[32m[I 2022-04-13 12:37:56,234][0m Trial 890 finished with value: 0.7748236257398279 and parameters: {'splitter': 'best', 'min_samples_split': 0.13744561250044712, 'min_samples_leaf': 0.0465098266995225, 'min_weight_fraction_leaf': 0.007895331819501177, 'max_features': 0.9993587924663062}. Best is trial 241 with value: 0.7773840258827056.[0m
[32m[I 2022-04-13 12:37:59,330][0m Trial 891 finished with value: 0.7701091537960177 and parameters: {'splitter': 'best', 'min_samples_split': 0.08124701722149939, 'min_samples_leaf': 0.018232181402433843, 'min_weight_fraction_leaf': 0.030109842168690948, 'max_features': 0.9492790136280261}. Best is trial 241 with value: 0.7773840258827056.[0m
[32m[I 2022-04-13 12:38:00,037][0m Trial 892 finished with value: 0.6158725266438454 and parameters: {'splitter': 'best', 'min_samples_split': 0.10453811371729048, 'min_samples_leaf': 0.28405012797702367, 'min_weight_fraction_leaf': 0.05122776794234281, 'max_features': 0.968266938420735}. Best is trial 241 with value: 0.7773840258827056.[0m
[32m[I 2022-04-13 12:38:02,483][0m Trial 893 finished with value: 0.7707334498141335 and parameters: {'splitter': 'best', 'min_samples_split': 0.11925281818566316, 'min_samples_leaf': 0.054338747799733696, 'min_weight_fraction_leaf': 0.021835627185935447, 'max_features': 0.9815658983588917}. Best is trial 241 with value: 0.7773840258827056.[0m
[32m[I 2022-04-13 12:38:06,218][0m Trial 894 finished with value: 0.7637452320963128 and parameters: {'splitter': 'best', 'min_samples_split': 0.14809370042764472, 'min_samples_leaf': 0.03943590938561258, 'min_weight_fraction_leaf': 0.04057588545595864, 'max_features': 0.9357574321048591}. Best is trial 241 with value: 0.7773840258827056.[0m
[32m[I 2022-04-13 12:38:08,317][0m Trial 895 finished with value: 0.7676720424277617 and parameters: {'splitter': 'best', 'min_samples_split': 0.17010358967871814, 'min_samples_leaf': 0.02740278660764305, 'min_weight_fraction_leaf': 0.03206247266940584, 'max_features': 0.9807902187105779}. Best is trial 241 with value: 0.7773840258827056.[0m
[32m[I 2022-04-13 12:38:09,902][0m Trial 896 finished with value: 0.7537900288486667 and parameters: {'splitter': 'best', 'min_samples_split': 0.12761375401255518, 'min_samples_leaf': 0.09130832487742152, 'min_weight_fraction_leaf': 0.05928991680187064, 'max_features': 0.9556281512937623}. Best is trial 241 with value: 0.7773840258827056.[0m
[32m[I 2022-04-13 12:38:13,049][0m Trial 897 finished with value: 0.7632024473592101 and parameters: {'splitter': 'best', 'min_samples_split': 0.24150693674969423, 'min_samples_leaf': 0.01180990063372946, 'min_weight_fraction_leaf': 0.0008807310675170502, 'max_features': 0.984088689920099}. Best is trial 241 with value: 0.7773840258827056.[0m
[32m[I 2022-04-13 12:38:15,138][0m Trial 898 finished with value: 0.7687837521400944 and parameters: {'splitter': 'best', 'min_samples_split': 0.056910590674132226, 'min_samples_leaf': 0.045653401522025544, 'min_weight_fraction_leaf': 0.01731496391711498, 'max_features': 0.9186186319507119}. Best is trial 241 with value: 0.7773840258827056.[0m
[32m[I 2022-04-13 12:38:16,533][0m Trial 899 finished with value: 0.7730486406940251 and parameters: {'splitter': 'best', 'min_samples_split': 0.10160881125155234, 'min_samples_leaf': 0.06353385546691717, 'min_weight_fraction_leaf': 0.07558598202781411, 'max_features': 0.99996473883184}. Best is trial 241 with value: 0.7773840258827056.[0m
[32m[I 2022-04-13 12:38:19,397][0m Trial 900 finished with value: 0.765835026193741 and parameters: {'splitter': 'best', 'min_samples_split': 0.11415018656905236, 'min_samples_leaf': 0.0260210792742149, 'min_weight_fraction_leaf': 0.04690966387575726, 'max_features': 0.9641741346786045}. Best is trial 241 with value: 0.7773840258827056.[0m
[32m[I 2022-04-13 12:38:22,071][0m Trial 901 finished with value: 0.7658644822546717 and parameters: {'splitter': 'best', 'min_samples_split': 0.09212182526611415, 'min_samples_leaf': 0.03783006089472839, 'min_weight_fraction_leaf': 0.027887727624041535, 'max_features': 0.9458946318866459}. Best is trial 241 with value: 0.7773840258827056.[0m
[32m[I 2022-04-13 12:38:22,486][0m Trial 902 finished with value: 0.7531408013911594 and parameters: {'splitter': 'random', 'min_samples_split': 0.13379369487803966, 'min_samples_leaf': 0.009144144258145595, 'min_weight_fraction_leaf': 0.0381729755811346, 'max_features': 0.8735050942245428}. Best is trial 241 with value: 0.7773840258827056.[0m
[32m[I 2022-04-13 12:38:24,596][0m Trial 903 finished with value: 0.7532451155424356 and parameters: {'splitter': 'best', 'min_samples_split': 0.12076126481395784, 'min_samples_leaf': 0.024377469560758546, 'min_weight_fraction_leaf': 0.11287464250651062, 'max_features': 0.9682948836043432}. Best is trial 241 with value: 0.7773840258827056.[0m
[32m[I 2022-04-13 12:38:26,026][0m Trial 904 finished with value: 0.770042804592184 and parameters: {'splitter': 'best', 'min_samples_split': 0.10664895710876833, 'min_samples_leaf': 0.05517346687168501, 'min_weight_fraction_leaf': 0.013292759030488571, 'max_features': 0.9994682793269413}. Best is trial 241 with value: 0.7773840258827056.[0m
[32m[I 2022-04-13 12:38:27,097][0m Trial 905 finished with value: 0.595902606094109 and parameters: {'splitter': 'best', 'min_samples_split': 0.1427606684139317, 'min_samples_leaf': 0.03976511795139142, 'min_weight_fraction_leaf': 0.4937071283716088, 'max_features': 0.9824812970091898}. Best is trial 241 with value: 0.7773840258827056.[0m
[32m[I 2022-04-13 12:38:29,043][0m Trial 906 finished with value: 0.7729307419597177 and parameters: {'splitter': 'best', 'min_samples_split': 0.07340024304934055, 'min_samples_leaf': 0.031810340663389725, 'min_weight_fraction_leaf': 0.02442968510928586, 'max_features': 0.9359597768461851}. Best is trial 241 with value: 0.7773840258827056.[0m
[32m[I 2022-04-13 12:38:30,531][0m Trial 907 finished with value: 0.7648131803447867 and parameters: {'splitter': 'best', 'min_samples_split': 0.12713810134528045, 'min_samples_leaf': 0.04606679327603083, 'min_weight_fraction_leaf': 0.054974323182719734, 'max_features': 0.9642943010971552}. Best is trial 241 with value: 0.7773840258827056.[0m
[32m[I 2022-04-13 12:38:31,685][0m Trial 908 finished with value: 0.7670080245142834 and parameters: {'splitter': 'best', 'min_samples_split': 0.11238772180772867, 'min_samples_leaf': 0.019269541032062715, 'min_weight_fraction_leaf': 0.0431434081287695, 'max_features': 0.9554402314716054}. Best is trial 241 with value: 0.7773840258827056.[0m
[32m[I 2022-04-13 12:38:32,280][0m Trial 909 finished with value: 0.7711137356721198 and parameters: {'splitter': 'best', 'min_samples_split': 0.08856412879055019, 'min_samples_leaf': 0.0793025852113173, 'min_weight_fraction_leaf': 0.0066731965479619754, 'max_features': 0.981392146698659}. Best is trial 241 with value: 0.7773840258827056.[0m
[32m[I 2022-04-13 12:38:33,092][0m Trial 910 finished with value: 0.7762435243427862 and parameters: {'splitter': 'best', 'min_samples_split': 0.11859844945771791, 'min_samples_leaf': 0.030934124799084604, 'min_weight_fraction_leaf': 0.03390250003030969, 'max_features': 0.9991859880418072}. Best is trial 241 with value: 0.7773840258827056.[0m
[32m[I 2022-04-13 12:38:33,823][0m Trial 911 finished with value: 0.7577513946613383 and parameters: {'splitter': 'best', 'min_samples_split': 0.09971778411624854, 'min_samples_leaf': 0.01208028057337424, 'min_weight_fraction_leaf': 0.020419999484957842, 'max_features': 0.7223138143915604}. Best is trial 241 with value: 0.7773840258827056.[0m
[32m[I 2022-04-13 12:38:34,700][0m Trial 912 finished with value: 0.7744274760951088 and parameters: {'splitter': 'best', 'min_samples_split': 0.11123680243679153, 'min_samples_leaf': 0.022350993881595567, 'min_weight_fraction_leaf': 0.03077735866603313, 'max_features': 0.9998697722599911}. Best is trial 241 with value: 0.7773840258827056.[0m
[32m[I 2022-04-13 12:38:36,110][0m Trial 913 finished with value: 0.7638569121936795 and parameters: {'splitter': 'best', 'min_samples_split': 0.10153047370216003, 'min_samples_leaf': 0.00690481894704369, 'min_weight_fraction_leaf': 0.010496864175421512, 'max_features': 0.9847257952048364}. Best is trial 241 with value: 0.7773840258827056.[0m
[32m[I 2022-04-13 12:38:38,408][0m Trial 914 finished with value: 0.7756527983730543 and parameters: {'splitter': 'best', 'min_samples_split': 0.1164001010531282, 'min_samples_leaf': 0.024308871250674526, 'min_weight_fraction_leaf': 0.024675758989345545, 'max_features': 0.9995347579320244}. Best is trial 241 with value: 0.7773840258827056.[0m
[32m[I 2022-04-13 12:38:39,600][0m Trial 915 finished with value: 0.7766060916987352 and parameters: {'splitter': 'best', 'min_samples_split': 0.12183285066136097, 'min_samples_leaf': 0.015712193455393937, 'min_weight_fraction_leaf': 0.03384546491591307, 'max_features': 0.9999734480874153}. Best is trial 241 with value: 0.7773840258827056.[0m
[32m[I 2022-04-13 12:38:41,617][0m Trial 916 finished with value: 0.7766060916987352 and parameters: {'splitter': 'best', 'min_samples_split': 0.12188413496177701, 'min_samples_leaf': 0.0017796516215704307, 'min_weight_fraction_leaf': 0.03294388604186399, 'max_features': 0.9839043811848938}. Best is trial 241 with value: 0.7773840258827056.[0m
[32m[I 2022-04-13 12:38:43,835][0m Trial 917 finished with value: 0.7730597517192981 and parameters: {'splitter': 'best', 'min_samples_split': 0.12603142024970143, 'min_samples_leaf': 0.0026676568409655724, 'min_weight_fraction_leaf': 0.026212702085602346, 'max_features': 0.999140083440501}. Best is trial 241 with value: 0.7773840258827056.[0m
[32m[I 2022-04-13 12:38:45,672][0m Trial 918 finished with value: 0.7735730988511728 and parameters: {'splitter': 'best', 'min_samples_split': 0.13401924698098652, 'min_samples_leaf': 0.0012083949126874063, 'min_weight_fraction_leaf': 0.038274305556703705, 'max_features': 0.9997970906226757}. Best is trial 241 with value: 0.7773840258827056.[0m
[32m[I 2022-04-13 12:38:46,235][0m Trial 919 finished with value: 0.7250392670237903 and parameters: {'splitter': 'best', 'min_samples_split': 0.12409106859181578, 'min_samples_leaf': 0.005909341398693074, 'min_weight_fraction_leaf': 0.023440650723417698, 'max_features': 0.17278433314295272}. Best is trial 241 with value: 0.7773840258827056.[0m
[32m[I 2022-04-13 12:38:48,053][0m Trial 920 finished with value: 0.7725182742463258 and parameters: {'splitter': 'best', 'min_samples_split': 0.14097661185734267, 'min_samples_leaf': 0.00331373641661855, 'min_weight_fraction_leaf': 0.03211020567332172, 'max_features': 0.9837533390407951}. Best is trial 241 with value: 0.7773840258827056.[0m
[32m[I 2022-04-13 12:38:50,367][0m Trial 921 finished with value: 0.7743357091866996 and parameters: {'splitter': 'best', 'min_samples_split': 0.12134146733634515, 'min_samples_leaf': 0.0062412993398598526, 'min_weight_fraction_leaf': 0.039012161434736785, 'max_features': 0.9988941466405337}. Best is trial 241 with value: 0.7773840258827056.[0m
[32m[I 2022-04-13 12:38:52,436][0m Trial 922 finished with value: 0.7719277651555913 and parameters: {'splitter': 'best', 'min_samples_split': 0.13163075920392894, 'min_samples_leaf': 0.002723729184222803, 'min_weight_fraction_leaf': 0.016550631514058917, 'max_features': 0.9995092144578132}. Best is trial 241 with value: 0.7773840258827056.[0m
[32m[I 2022-04-13 12:38:52,526][0m Trial 923 finished with value: 0.5595733643241385 and parameters: {'splitter': 'random', 'min_samples_split': 0.12287298385341142, 'min_samples_leaf': 0.01798816785655371, 'min_weight_fraction_leaf': 0.3991486714303361, 'max_features': 0.9995133943170682}. Best is trial 241 with value: 0.7773840258827056.[0m
[32m[I 2022-04-13 12:38:53,484][0m Trial 924 finished with value: 0.7725418447248682 and parameters: {'splitter': 'best', 'min_samples_split': 0.11893376733683755, 'min_samples_leaf': 0.01369187195775871, 'min_weight_fraction_leaf': 0.028568648982952853, 'max_features': 0.9998825727456998}. Best is trial 241 with value: 0.7773840258827056.[0m
[32m[I 2022-04-13 12:38:56,207][0m Trial 925 finished with value: 0.7696030996865986 and parameters: {'splitter': 'best', 'min_samples_split': 0.04748904116200171, 'min_samples_leaf': 0.011644222051747763, 'min_weight_fraction_leaf': 0.01757560673391618, 'max_features': 0.970672940683888}. Best is trial 241 with value: 0.7773840258827056.[0m
[32m[I 2022-04-13 12:38:58,583][0m Trial 926 finished with value: 0.752434713666853 and parameters: {'splitter': 'best', 'min_samples_split': 0.33324949221738964, 'min_samples_leaf': 0.012135990881900833, 'min_weight_fraction_leaf': 0.028732464656625954, 'max_features': 0.979893996680375}. Best is trial 241 with value: 0.7773840258827056.[0m
[32m[I 2022-04-13 12:39:00,730][0m Trial 927 finished with value: 0.7622950019969765 and parameters: {'splitter': 'best', 'min_samples_split': 0.13794217946520237, 'min_samples_leaf': 0.0025701764440685046, 'min_weight_fraction_leaf': 0.008500604375959137, 'max_features': 0.9693025011114426}. Best is trial 241 with value: 0.7773840258827056.[0m
[32m[I 2022-04-13 12:39:03,259][0m Trial 928 finished with value: 0.7652547927497095 and parameters: {'splitter': 'best', 'min_samples_split': 0.15697477900623485, 'min_samples_leaf': 0.015617531044956036, 'min_weight_fraction_leaf': 0.022647834611919316, 'max_features': 0.9804264982764216}. Best is trial 241 with value: 0.7773840258827056.[0m
[32m[I 2022-04-13 12:39:07,172][0m Trial 929 finished with value: 0.7653438598394493 and parameters: {'splitter': 'best', 'min_samples_split': 0.10836525003624854, 'min_samples_leaf': 0.011963589623850808, 'min_weight_fraction_leaf': 0.00010725631576356809, 'max_features': 0.985214875154218}. Best is trial 241 with value: 0.7773840258827056.[0m
[32m[I 2022-04-13 12:39:10,785][0m Trial 930 finished with value: 0.7638543953683035 and parameters: {'splitter': 'best', 'min_samples_split': 0.12948565872035617, 'min_samples_leaf': 0.0020079797443086425, 'min_weight_fraction_leaf': 0.045872130723980206, 'max_features': 0.9627932526869108}. Best is trial 241 with value: 0.7773840258827056.[0m
[32m[I 2022-04-13 12:39:13,079][0m Trial 931 finished with value: 0.7733432543556484 and parameters: {'splitter': 'best', 'min_samples_split': 0.14813812427688924, 'min_samples_leaf': 0.014331906766853296, 'min_weight_fraction_leaf': 0.03736118995472058, 'max_features': 0.9837022155268594}. Best is trial 241 with value: 0.7773840258827056.[0m
[32m[I 2022-04-13 12:39:15,955][0m Trial 932 finished with value: 0.7644746968790519 and parameters: {'splitter': 'best', 'min_samples_split': 0.1162578610840641, 'min_samples_leaf': 0.02003566694527097, 'min_weight_fraction_leaf': 0.015661800076838886, 'max_features': 0.9657467429942349}. Best is trial 241 with value: 0.7773840258827056.[0m
[32m[I 2022-04-13 12:39:16,581][0m Trial 933 finished with value: 0.593346362060699 and parameters: {'splitter': 'best', 'min_samples_split': 0.1276579639274061, 'min_samples_leaf': 0.39799128135260486, 'min_weight_fraction_leaf': 0.028023195954644236, 'max_features': 0.9540419149233336}. Best is trial 241 with value: 0.7773840258827056.[0m
[32m[I 2022-04-13 12:39:17,754][0m Trial 934 finished with value: 0.7719560141280668 and parameters: {'splitter': 'best', 'min_samples_split': 0.10261554794244013, 'min_samples_leaf': 0.01845737790132905, 'min_weight_fraction_leaf': 0.04790306888864103, 'max_features': 0.9991091014277812}. Best is trial 241 with value: 0.7773840258827056.[0m
[32m[I 2022-04-13 12:39:20,698][0m Trial 935 finished with value: 0.7750406184368898 and parameters: {'splitter': 'best', 'min_samples_split': 0.1187366818448691, 'min_samples_leaf': 0.001976432663963964, 'min_weight_fraction_leaf': 0.03860522017842596, 'max_features': 0.9994725238922194}. Best is trial 241 with value: 0.7773840258827056.[0m
[32m[I 2022-04-13 12:39:24,203][0m Trial 936 finished with value: 0.7712126681370963 and parameters: {'splitter': 'best', 'min_samples_split': 0.13397937952105465, 'min_samples_leaf': 0.004053296509069949, 'min_weight_fraction_leaf': 0.05716458518051008, 'max_features': 0.9995663785635577}. Best is trial 241 with value: 0.7773840258827056.[0m
[32m[I 2022-04-13 12:39:25,210][0m Trial 937 finished with value: 0.7755597377948635 and parameters: {'splitter': 'best', 'min_samples_split': 0.14440500747597854, 'min_samples_leaf': 0.0024904866353583546, 'min_weight_fraction_leaf': 0.044409159531637196, 'max_features': 0.9995619811957231}. Best is trial 241 with value: 0.7773840258827056.[0m
[32m[I 2022-04-13 12:39:26,141][0m Trial 938 finished with value: 0.771404451937951 and parameters: {'splitter': 'best', 'min_samples_split': 0.13968108966367934, 'min_samples_leaf': 0.009347176985770724, 'min_weight_fraction_leaf': 0.0621173540462239, 'max_features': 0.9817046269518812}. Best is trial 241 with value: 0.7773840258827056.[0m
[32m[I 2022-04-13 12:39:27,026][0m Trial 939 finished with value: 0.7693447624615798 and parameters: {'splitter': 'best', 'min_samples_split': 0.15348279142022458, 'min_samples_leaf': 0.006708711852972087, 'min_weight_fraction_leaf': 0.05082150600484467, 'max_features': 0.999060262534974}. Best is trial 241 with value: 0.7773840258827056.[0m
[32m[I 2022-04-13 12:39:28,736][0m Trial 940 finished with value: 0.7666969071894953 and parameters: {'splitter': 'best', 'min_samples_split': 0.12283357467216537, 'min_samples_leaf': 0.004664830420215295, 'min_weight_fraction_leaf': 0.06707946533669307, 'max_features': 0.9720815308102091}. Best is trial 241 with value: 0.7773840258827056.[0m
[32m[I 2022-04-13 12:39:31,631][0m Trial 941 finished with value: 0.7696560264257915 and parameters: {'splitter': 'best', 'min_samples_split': 0.1440892414360657, 'min_samples_leaf': 0.001751810783736086, 'min_weight_fraction_leaf': 0.050214149596403565, 'max_features': 0.9999092627282888}. Best is trial 241 with value: 0.7773840258827056.[0m
[32m[I 2022-04-13 12:39:32,033][0m Trial 942 finished with value: 0.7208324850202263 and parameters: {'splitter': 'random', 'min_samples_split': 0.47618695329679017, 'min_samples_leaf': 0.00419047483671562, 'min_weight_fraction_leaf': 0.04476936845043916, 'max_features': 0.9726912390668375}. Best is trial 241 with value: 0.7773840258827056.[0m
[32m[I 2022-04-13 12:39:34,856][0m Trial 943 finished with value: 0.7648125150255765 and parameters: {'splitter': 'best', 'min_samples_split': 0.11831786707161329, 'min_samples_leaf': 0.00719847482061853, 'min_weight_fraction_leaf': 0.05923146123305525, 'max_features': 0.954033591223735}. Best is trial 241 with value: 0.7773840258827056.[0m
[32m[I 2022-04-13 12:39:37,486][0m Trial 944 finished with value: 0.7736863205424763 and parameters: {'splitter': 'best', 'min_samples_split': 0.12881023692640886, 'min_samples_leaf': 0.0029495677557555824, 'min_weight_fraction_leaf': 0.04431107429502701, 'max_features': 0.9817004966305832}. Best is trial 241 with value: 0.7773840258827056.[0m
[32m[I 2022-04-13 12:39:40,846][0m Trial 945 finished with value: 0.7708501802721416 and parameters: {'splitter': 'best', 'min_samples_split': 0.11844380713855368, 'min_samples_leaf': 0.01446434866796009, 'min_weight_fraction_leaf': 0.053782067351414664, 'max_features': 0.9793029073179974}. Best is trial 241 with value: 0.7773840258827056.[0m
[32m[I 2022-04-13 12:39:41,882][0m Trial 946 finished with value: 0.7483991856104646 and parameters: {'splitter': 'best', 'min_samples_split': 0.1652888920427937, 'min_samples_leaf': 0.0026498235150614374, 'min_weight_fraction_leaf': 0.03979675826560163, 'max_features': 0.5319515862214782}. Best is trial 241 with value: 0.7773840258827056.[0m
[32m[I 2022-04-13 12:39:45,065][0m Trial 947 finished with value: 0.7604972801551825 and parameters: {'splitter': 'best', 'min_samples_split': 0.06742786600170445, 'min_samples_leaf': 0.0014317289161565813, 'min_weight_fraction_leaf': 0.0380260016702272, 'max_features': 0.9576054637247451}. Best is trial 241 with value: 0.7773840258827056.[0m
[32m[I 2022-04-13 12:39:46,946][0m Trial 948 finished with value: 0.7727431212725303 and parameters: {'splitter': 'best', 'min_samples_split': 0.10704706987355346, 'min_samples_leaf': 0.011480323788753004, 'min_weight_fraction_leaf': 0.07476789039447665, 'max_features': 0.9819490464477674}. Best is trial 241 with value: 0.7773840258827056.[0m
[32m[I 2022-04-13 12:39:49,427][0m Trial 949 finished with value: 0.7658086725202866 and parameters: {'splitter': 'best', 'min_samples_split': 0.1448270177180982, 'min_samples_leaf': 0.013837501875337154, 'min_weight_fraction_leaf': 0.046270295719831614, 'max_features': 0.9663921078308674}. Best is trial 241 with value: 0.7773840258827056.[0m
[32m[I 2022-04-13 12:39:51,708][0m Trial 950 finished with value: 0.7651071080010033 and parameters: {'splitter': 'best', 'min_samples_split': 0.09412472914357116, 'min_samples_leaf': 0.01424873457747168, 'min_weight_fraction_leaf': 0.06094228619873079, 'max_features': 0.9453600629415684}. Best is trial 241 with value: 0.7773840258827056.[0m
[32m[I 2022-04-13 12:39:52,898][0m Trial 951 finished with value: 0.7743787382127496 and parameters: {'splitter': 'best', 'min_samples_split': 0.13227362685140676, 'min_samples_leaf': 0.0016977019870474052, 'min_weight_fraction_leaf': 0.034712289649847364, 'max_features': 0.9833676287945611}. Best is trial 241 with value: 0.7773840258827056.[0m
[32m[I 2022-04-13 12:39:54,667][0m Trial 952 finished with value: 0.7711355271194625 and parameters: {'splitter': 'best', 'min_samples_split': 0.11394757582142032, 'min_samples_leaf': 0.018164259871601772, 'min_weight_fraction_leaf': 0.05180547241530033, 'max_features': 0.9996286529140745}. Best is trial 241 with value: 0.7773840258827056.[0m
