[32m[I 2022-04-13 18:17:45,493][0m Trial 208 finished with value: 0.25 and parameters: {'loss': 'coxph', 'learning_rate': 6.59090580103116e-06, 'n_estimators': 110, 'criterion': 'squared_error', 'min_samples_split': 10, 'min_samples_leaf': 1, 'min_weight_fraction_leaf': 0.05648446647073862, 'min_impurity_decrease': 0.5607411768500248, 'max_features': 0.19816408483525763, 'subsample': 0.5682934564899093, 'dropout_rate': 0.002033640573383226, 'ccp_alpha': 3.1765712749739747}. Best is trial 138 with value: 0.731155530669601.[0m
[32m[I 2022-04-13 18:19:13,706][0m Trial 209 finished with value: 0.25 and parameters: {'loss': 'coxph', 'learning_rate': 1.4312308556137236e-05, 'n_estimators': 606, 'criterion': 'squared_error', 'min_samples_split': 10, 'min_samples_leaf': 1, 'min_weight_fraction_leaf': 0.031483894293843934, 'min_impurity_decrease': 0.5928486612032029, 'max_features': 0.3063576193302736, 'subsample': 0.5517489075621121, 'dropout_rate': 0.75335891837037, 'ccp_alpha': 3.4350400926054583}. Best is trial 138 with value: 0.731155530669601.[0m
[32m[I 2022-04-13 18:21:41,342][0m Trial 210 finished with value: 0.25 and parameters: {'loss': 'coxph', 'learning_rate': 1.1162120578100995e-05, 'n_estimators': 576, 'criterion': 'squared_error', 'min_samples_split': 10, 'min_samples_leaf': 1, 'min_weight_fraction_leaf': 0.1818261505378314, 'min_impurity_decrease': 0.49577621468296384, 'max_features': 0.2850376435454217, 'subsample': 0.9931475154222104, 'dropout_rate': 0.1910957799354437, 'ccp_alpha': 3.5954904040143214}. Best is trial 138 with value: 0.731155530669601.[0m
[32m[I 2022-04-13 18:24:20,412][0m Trial 211 finished with value: 0.25 and parameters: {'loss': 'coxph', 'learning_rate': 8.913113254500498e-06, 'n_estimators': 598, 'criterion': 'squared_error', 'min_samples_split': 10, 'min_samples_leaf': 1, 'min_weight_fraction_leaf': 0.4890346218503823, 'min_impurity_decrease': 0.5326204289147518, 'max_features': 0.6925621650974396, 'subsample': 0.5121717251391902, 'dropout_rate': 0.12700458932180644, 'ccp_alpha': 3.693524671150495}. Best is trial 138 with value: 0.731155530669601.[0m
[32m[I 2022-04-13 18:26:42,982][0m Trial 212 finished with value: 0.25 and parameters: {'loss': 'coxph', 'learning_rate': 4.5498750179484174e-06, 'n_estimators': 552, 'criterion': 'squared_error', 'min_samples_split': 9, 'min_samples_leaf': 1, 'min_weight_fraction_leaf': 0.4923087257720339, 'min_impurity_decrease': 0.5026532692646222, 'max_features': 0.15507031209764582, 'subsample': 0.5332619283078793, 'dropout_rate': 0.08621797217531196, 'ccp_alpha': 2.7742107881805143}. Best is trial 138 with value: 0.731155530669601.[0m
[32m[I 2022-04-13 18:29:44,024][0m Trial 213 finished with value: 0.25 and parameters: {'loss': 'coxph', 'learning_rate': 6.704047104793447e-06, 'n_estimators': 652, 'criterion': 'squared_error', 'min_samples_split': 8, 'min_samples_leaf': 1, 'min_weight_fraction_leaf': 0.16605115892339806, 'min_impurity_decrease': 0.61864144594649, 'max_features': 0.8260881648905893, 'subsample': 0.9033666884378765, 'dropout_rate': 0.1644584495822223, 'ccp_alpha': 2.8825290471309617}. Best is trial 138 with value: 0.731155530669601.[0m
[32m[I 2022-04-13 18:35:46,200][0m Trial 214 finished with value: 0.25 and parameters: {'loss': 'coxph', 'learning_rate': 0.03493492264421138, 'n_estimators': 928, 'criterion': 'squared_error', 'min_samples_split': 5, 'min_samples_leaf': 1, 'min_weight_fraction_leaf': 0.18342362967304782, 'min_impurity_decrease': 0.5801772497989445, 'max_features': 0.24180962220416438, 'subsample': 0.932066587913799, 'dropout_rate': 0.11105734466829684, 'ccp_alpha': 2.9829685016400838}. Best is trial 138 with value: 0.731155530669601.[0m
[32m[I 2022-04-13 18:36:02,380][0m Trial 215 finished with value: 0.25 and parameters: {'loss': 'coxph', 'learning_rate': 9.564536490178629e-06, 'n_estimators': 101, 'criterion': 'squared_error', 'min_samples_split': 5, 'min_samples_leaf': 1, 'min_weight_fraction_leaf': 0.19108833742976133, 'min_impurity_decrease': 0.5322108726648032, 'max_features': 0.937333056875228, 'subsample': 0.9834072641280283, 'dropout_rate': 0.09589061306039973, 'ccp_alpha': 2.838890144488194}. Best is trial 138 with value: 0.731155530669601.[0m
[32m[I 2022-04-13 18:36:14,619][0m Trial 216 finished with value: 0.25 and parameters: {'loss': 'coxph', 'learning_rate': 6.407871993920208e-05, 'n_estimators': 106, 'criterion': 'squared_error', 'min_samples_split': 5, 'min_samples_leaf': 1, 'min_weight_fraction_leaf': 0.14891602758858918, 'min_impurity_decrease': 0.4728281086393726, 'max_features': 0.8591701427564912, 'subsample': 0.9725872834413121, 'dropout_rate': 0.16914971910964688, 'ccp_alpha': 2.4099460159740818}. Best is trial 138 with value: 0.731155530669601.[0m
[32m[I 2022-04-13 18:40:30,383][0m Trial 217 finished with value: 0.25 and parameters: {'loss': 'coxph', 'learning_rate': 5.9766882639180645e-06, 'n_estimators': 747, 'criterion': 'squared_error', 'min_samples_split': 5, 'min_samples_leaf': 1, 'min_weight_fraction_leaf': 0.17388289312664884, 'min_impurity_decrease': 0.008547263852746439, 'max_features': 0.933110360689016, 'subsample': 0.9113758931754764, 'dropout_rate': 0.1760399420162881, 'ccp_alpha': 3.0845973553894828}. Best is trial 138 with value: 0.731155530669601.[0m
[32m[I 2022-04-13 18:42:26,666][0m Trial 218 finished with value: 0.25 and parameters: {'loss': 'coxph', 'learning_rate': 1.2622421456940065e-05, 'n_estimators': 509, 'criterion': 'squared_error', 'min_samples_split': 5, 'min_samples_leaf': 1, 'min_weight_fraction_leaf': 0.1636656081252584, 'min_impurity_decrease': 0.44428656418190704, 'max_features': 0.8825012967324961, 'subsample': 0.9188519636620536, 'dropout_rate': 0.14460930548593448, 'ccp_alpha': 2.5645981781249207}. Best is trial 138 with value: 0.731155530669601.[0m
[32m[I 2022-04-13 18:44:06,196][0m Trial 219 finished with value: 0.25 and parameters: {'loss': 'coxph', 'learning_rate': 8.249867855926998e-05, 'n_estimators': 454, 'criterion': 'squared_error', 'min_samples_split': 9, 'min_samples_leaf': 1, 'min_weight_fraction_leaf': 0.15343300279342215, 'min_impurity_decrease': 0.4851067331966188, 'max_features': 0.9526816544226873, 'subsample': 0.9508731376540086, 'dropout_rate': 0.1203595723341748, 'ccp_alpha': 2.6160158604307657}. Best is trial 138 with value: 0.731155530669601.[0m
[32m[I 2022-04-13 18:46:17,149][0m Trial 220 finished with value: 0.25 and parameters: {'loss': 'coxph', 'learning_rate': 0.027430545364549152, 'n_estimators': 534, 'criterion': 'squared_error', 'min_samples_split': 3, 'min_samples_leaf': 1, 'min_weight_fraction_leaf': 0.2010486953388788, 'min_impurity_decrease': 0.470814971619516, 'max_features': 0.9728198487834645, 'subsample': 0.8910494513839318, 'dropout_rate': 0.18691243230773638, 'ccp_alpha': 2.538911040666222}. Best is trial 138 with value: 0.731155530669601.[0m
[32m[I 2022-04-13 18:47:55,410][0m Trial 221 finished with value: 0.25 and parameters: {'loss': 'coxph', 'learning_rate': 1.2689075317826835e-05, 'n_estimators': 427, 'criterion': 'squared_error', 'min_samples_split': 3, 'min_samples_leaf': 1, 'min_weight_fraction_leaf': 0.13837191184539943, 'min_impurity_decrease': 0.51306668363177, 'max_features': 0.9936943140329941, 'subsample': 0.3366725763593316, 'dropout_rate': 0.033453201853046996, 'ccp_alpha': 0.23323702737516022}. Best is trial 138 with value: 0.731155530669601.[0m
[32m[I 2022-04-13 18:48:41,050][0m Trial 222 finished with value: 0.25 and parameters: {'loss': 'coxph', 'learning_rate': 8.949042985731383e-05, 'n_estimators': 477, 'criterion': 'squared_error', 'min_samples_split': 3, 'min_samples_leaf': 9, 'min_weight_fraction_leaf': 0.10881308647877383, 'min_impurity_decrease': 0.5541359813364426, 'max_features': 0.9747917742358885, 'subsample': 0.4953402050218316, 'dropout_rate': 0.9028887548753324, 'ccp_alpha': 3.3880803250300353}. Best is trial 138 with value: 0.731155530669601.[0m
[32m[I 2022-04-13 18:50:05,704][0m Trial 223 finished with value: 0.25 and parameters: {'loss': 'coxph', 'learning_rate': 4.972059754291055e-06, 'n_estimators': 691, 'criterion': 'squared_error', 'min_samples_split': 3, 'min_samples_leaf': 1, 'min_weight_fraction_leaf': 0.13076107948136498, 'min_impurity_decrease': 0.3367588361926755, 'max_features': 0.8057342891515304, 'subsample': 0.4023358257112407, 'dropout_rate': 0.8761054424691003, 'ccp_alpha': 0.0016879860414401326}. Best is trial 138 with value: 0.731155530669601.[0m
[32m[I 2022-04-13 18:51:38,730][0m Trial 224 finished with value: 0.25 and parameters: {'loss': 'coxph', 'learning_rate': 0.0006612764836752509, 'n_estimators': 732, 'criterion': 'squared_error', 'min_samples_split': 2, 'min_samples_leaf': 7, 'min_weight_fraction_leaf': 0.08223483742725801, 'min_impurity_decrease': 0.539475022260909, 'max_features': 0.9136278056435201, 'subsample': 0.48218616476578846, 'dropout_rate': 0.841915782746289, 'ccp_alpha': 2.132538377230345}. Best is trial 138 with value: 0.731155530669601.[0m
[32m[I 2022-04-13 18:52:53,098][0m Trial 225 finished with value: 0.25 and parameters: {'loss': 'coxph', 'learning_rate': 6.250622000062933e-06, 'n_estimators': 674, 'criterion': 'squared_error', 'min_samples_split': 3, 'min_samples_leaf': 1, 'min_weight_fraction_leaf': 0.10168365534562479, 'min_impurity_decrease': 0.5578748888104391, 'max_features': 0.6928359934755229, 'subsample': 0.4121335451832241, 'dropout_rate': 0.9126325346023079, 'ccp_alpha': 3.249438884425442}. Best is trial 138 with value: 0.731155530669601.[0m
[32m[I 2022-04-13 18:53:50,062][0m Trial 226 finished with value: 0.25 and parameters: {'loss': 'coxph', 'learning_rate': 0.0009561204072929629, 'n_estimators': 616, 'criterion': 'squared_error', 'min_samples_split': 5, 'min_samples_leaf': 7, 'min_weight_fraction_leaf': 0.1196644173149253, 'min_impurity_decrease': 0.43525974157192654, 'max_features': 0.6519676761963914, 'subsample': 0.3824088184562288, 'dropout_rate': 0.9839411441714642, 'ccp_alpha': 2.44679546758363}. Best is trial 138 with value: 0.731155530669601.[0m
[32m[I 2022-04-13 18:55:07,944][0m Trial 227 finished with value: 0.25 and parameters: {'loss': 'coxph', 'learning_rate': 0.0008021862113558773, 'n_estimators': 709, 'criterion': 'squared_error', 'min_samples_split': 3, 'min_samples_leaf': 7, 'min_weight_fraction_leaf': 0.07683822862261147, 'min_impurity_decrease': 0.4611572383953408, 'max_features': 0.6568102858532026, 'subsample': 0.9301640483779884, 'dropout_rate': 0.887067845388676, 'ccp_alpha': 2.3663631078531777}. Best is trial 138 with value: 0.731155530669601.[0m
[32m[I 2022-04-13 18:56:30,581][0m Trial 228 finished with value: 0.25 and parameters: {'loss': 'coxph', 'learning_rate': 0.0005741928424620019, 'n_estimators': 433, 'criterion': 'squared_error', 'min_samples_split': 4, 'min_samples_leaf': 7, 'min_weight_fraction_leaf': 0.08283133778984914, 'min_impurity_decrease': 0.034268366738574266, 'max_features': 0.6207995581598761, 'subsample': 0.8376562736634471, 'dropout_rate': 0.20314276464681255, 'ccp_alpha': 1.6919939239783326}. Best is trial 138 with value: 0.731155530669601.[0m
[32m[I 2022-04-13 18:57:49,669][0m Trial 229 finished with value: 0.25 and parameters: {'loss': 'coxph', 'learning_rate': 0.0021235414845252975, 'n_estimators': 411, 'criterion': 'squared_error', 'min_samples_split': 4, 'min_samples_leaf': 9, 'min_weight_fraction_leaf': 0.10409512337090632, 'min_impurity_decrease': 0.08376172965897047, 'max_features': 0.6416731601264044, 'subsample': 0.5348641767785117, 'dropout_rate': 0.0694779830949331, 'ccp_alpha': 1.400222592032407}. Best is trial 138 with value: 0.731155530669601.[0m
[32m[I 2022-04-13 18:59:52,630][0m Trial 230 finished with value: 0.25 and parameters: {'loss': 'coxph', 'learning_rate': 0.001332107545431785, 'n_estimators': 398, 'criterion': 'absolute_error', 'min_samples_split': 4, 'min_samples_leaf': 8, 'min_weight_fraction_leaf': 0.13104200925592074, 'min_impurity_decrease': 0.03449016462205319, 'max_features': 0.8870966283911207, 'subsample': 0.7948683868852773, 'dropout_rate': 0.029316024899761504, 'ccp_alpha': 1.7198540857630944}. Best is trial 138 with value: 0.731155530669601.[0m
[32m[I 2022-04-13 19:01:59,641][0m Trial 231 finished with value: 0.25 and parameters: {'loss': 'coxph', 'learning_rate': 0.0004312146458278035, 'n_estimators': 512, 'criterion': 'absolute_error', 'min_samples_split': 4, 'min_samples_leaf': 10, 'min_weight_fraction_leaf': 0.23143127182945047, 'min_impurity_decrease': 0.05829975190161149, 'max_features': 0.9271446010217143, 'subsample': 0.4348505274397594, 'dropout_rate': 0.2087775082641043, 'ccp_alpha': 2.6572762340707774}. Best is trial 138 with value: 0.731155530669601.[0m
[32m[I 2022-04-13 19:03:20,476][0m Trial 232 finished with value: 0.25 and parameters: {'loss': 'coxph', 'learning_rate': 0.002190499796484289, 'n_estimators': 423, 'criterion': 'absolute_error', 'min_samples_split': 4, 'min_samples_leaf': 10, 'min_weight_fraction_leaf': 0.2222664818510619, 'min_impurity_decrease': 0.028102161753515997, 'max_features': 0.9554574952285299, 'subsample': 0.8747158532287105, 'dropout_rate': 0.9439858141362647, 'ccp_alpha': 0.9921776613223575}. Best is trial 138 with value: 0.731155530669601.[0m
[32m[I 2022-04-13 19:04:26,121][0m Trial 233 finished with value: 0.25 and parameters: {'loss': 'coxph', 'learning_rate': 0.0005440457082888211, 'n_estimators': 369, 'criterion': 'absolute_error', 'min_samples_split': 4, 'min_samples_leaf': 7, 'min_weight_fraction_leaf': 0.20468837337330134, 'min_impurity_decrease': 0.004600204342660376, 'max_features': 0.6740397633621076, 'subsample': 0.8810076423265891, 'dropout_rate': 0.9440616287188812, 'ccp_alpha': 1.60266684646514}. Best is trial 138 with value: 0.731155530669601.[0m
[32m[I 2022-04-13 19:07:28,495][0m Trial 234 finished with value: 0.25 and parameters: {'loss': 'coxph', 'learning_rate': 0.0006478114980491263, 'n_estimators': 499, 'criterion': 'absolute_error', 'min_samples_split': 4, 'min_samples_leaf': 7, 'min_weight_fraction_leaf': 0.210350250195621, 'min_impurity_decrease': 0.08532031653624539, 'max_features': 0.9014980246550105, 'subsample': 0.9450352916627923, 'dropout_rate': 0.2452592909845414, 'ccp_alpha': 1.6472916187493043}. Best is trial 138 with value: 0.731155530669601.[0m
[32m[I 2022-04-13 19:09:27,694][0m Trial 235 finished with value: 0.25 and parameters: {'loss': 'coxph', 'learning_rate': 0.00040768311471814096, 'n_estimators': 550, 'criterion': 'absolute_error', 'min_samples_split': 4, 'min_samples_leaf': 9, 'min_weight_fraction_leaf': 0.24020364048367482, 'min_impurity_decrease': 0.013053946928112523, 'max_features': 0.9756283437000871, 'subsample': 0.8268204300548471, 'dropout_rate': 0.9320082092697631, 'ccp_alpha': 1.5055942571553071}. Best is trial 138 with value: 0.731155530669601.[0m
[32m[I 2022-04-13 19:11:09,652][0m Trial 236 finished with value: 0.25 and parameters: {'loss': 'coxph', 'learning_rate': 0.0013311822802972737, 'n_estimators': 349, 'criterion': 'absolute_error', 'min_samples_split': 4, 'min_samples_leaf': 7, 'min_weight_fraction_leaf': 0.25955455196558486, 'min_impurity_decrease': 0.0011448054423001328, 'max_features': 0.6309648544287905, 'subsample': 0.8612528977450977, 'dropout_rate': 0.26047775407112084, 'ccp_alpha': 1.7944004091474501}. Best is trial 138 with value: 0.731155530669601.[0m
[32m[I 2022-04-13 19:16:10,628][0m Trial 237 finished with value: 0.25 and parameters: {'loss': 'coxph', 'learning_rate': 1.7508230156886085e-05, 'n_estimators': 805, 'criterion': 'squared_error', 'min_samples_split': 3, 'min_samples_leaf': 1, 'min_weight_fraction_leaf': 0.18793705194889102, 'min_impurity_decrease': 0.4961787180220865, 'max_features': 0.9951282032621251, 'subsample': 0.33627396392028175, 'dropout_rate': 0.12627638464109447, 'ccp_alpha': 0.3088634189764324}. Best is trial 138 with value: 0.731155530669601.[0m
[32m[I 2022-04-13 19:17:19,160][0m Trial 238 finished with value: -0.25 and parameters: {'loss': 'squared', 'learning_rate': 6.645753690635415e-05, 'n_estimators': 802, 'criterion': 'squared_error', 'min_samples_split': 3, 'min_samples_leaf': 1, 'min_weight_fraction_leaf': 0.09484615376157512, 'min_impurity_decrease': 0.3531005869607024, 'max_features': 0.9841077889177695, 'subsample': 0.31683607293304505, 'dropout_rate': 0.7826950141184543, 'ccp_alpha': 3.039003787830259}. Best is trial 138 with value: 0.731155530669601.[0m
[32m[I 2022-04-13 19:20:32,112][0m Trial 239 finished with value: 0.25 and parameters: {'loss': 'coxph', 'learning_rate': 6.101619374597017e-05, 'n_estimators': 659, 'criterion': 'squared_error', 'min_samples_split': 10, 'min_samples_leaf': 1, 'min_weight_fraction_leaf': 0.11174368394999044, 'min_impurity_decrease': 0.6209524537967342, 'max_features': 0.27778043821591203, 'subsample': 0.40704226922512815, 'dropout_rate': 0.1656984736388165, 'ccp_alpha': 2.895098080639152}. Best is trial 138 with value: 0.731155530669601.[0m
[32m[I 2022-04-13 19:22:03,456][0m Trial 240 finished with value: 0.25 and parameters: {'loss': 'coxph', 'learning_rate': 0.0008958219505047492, 'n_estimators': 381, 'criterion': 'absolute_error', 'min_samples_split': 5, 'min_samples_leaf': 8, 'min_weight_fraction_leaf': 0.23348292979577695, 'min_impurity_decrease': 0.27743262590918777, 'max_features': 0.5108344606547046, 'subsample': 0.9405652118627722, 'dropout_rate': 0.2339751507446392, 'ccp_alpha': 1.3556330412692832}. Best is trial 138 with value: 0.731155530669601.[0m
[32m[I 2022-04-13 19:23:27,063][0m Trial 241 finished with value: 0.25 and parameters: {'loss': 'coxph', 'learning_rate': 0.00014259024560301801, 'n_estimators': 398, 'criterion': 'absolute_error', 'min_samples_split': 5, 'min_samples_leaf': 8, 'min_weight_fraction_leaf': 0.27589203995726824, 'min_impurity_decrease': 0.051773393062864416, 'max_features': 0.8574414457947815, 'subsample': 0.9246781833640207, 'dropout_rate': 0.9559423877507288, 'ccp_alpha': 1.9871724298841085}. Best is trial 138 with value: 0.731155530669601.[0m
[32m[I 2022-04-13 19:24:13,597][0m Trial 242 finished with value: 0.25 and parameters: {'loss': 'coxph', 'learning_rate': 0.00022522772898085305, 'n_estimators': 370, 'criterion': 'absolute_error', 'min_samples_split': 3, 'min_samples_leaf': 8, 'min_weight_fraction_leaf': 0.24995806526928152, 'min_impurity_decrease': 0.8248916429403521, 'max_features': 0.6073923728545428, 'subsample': 0.3689240673929142, 'dropout_rate': 0.9887160431590678, 'ccp_alpha': 1.8425233223456576}. Best is trial 138 with value: 0.731155530669601.[0m
[32m[I 2022-04-13 19:24:59,049][0m Trial 243 finished with value: 0.25 and parameters: {'loss': 'coxph', 'learning_rate': 0.001192123382010839, 'n_estimators': 386, 'criterion': 'absolute_error', 'min_samples_split': 5, 'min_samples_leaf': 8, 'min_weight_fraction_leaf': 0.11959964667793432, 'min_impurity_decrease': 0.2490451919855435, 'max_features': 0.5933685697522422, 'subsample': 0.5834407079557564, 'dropout_rate': 0.9599148431643622, 'ccp_alpha': 2.2210347400150314}. Best is trial 138 with value: 0.731155530669601.[0m
[32m[I 2022-04-13 19:26:00,534][0m Trial 244 finished with value: 0.25 and parameters: {'loss': 'coxph', 'learning_rate': 0.004242556808775474, 'n_estimators': 329, 'criterion': 'absolute_error', 'min_samples_split': 3, 'min_samples_leaf': 7, 'min_weight_fraction_leaf': 0.14050148795851813, 'min_impurity_decrease': 0.3095009438984088, 'max_features': 0.5406924089485029, 'subsample': 0.5612018794216053, 'dropout_rate': 0.27736885837420344, 'ccp_alpha': 1.2605969833259407}. Best is trial 138 with value: 0.731155530669601.[0m
[32m[I 2022-04-13 19:26:51,905][0m Trial 245 finished with value: 0.25 and parameters: {'loss': 'coxph', 'learning_rate': 0.01612152379147691, 'n_estimators': 364, 'criterion': 'absolute_error', 'min_samples_split': 3, 'min_samples_leaf': 7, 'min_weight_fraction_leaf': 0.30130641316726264, 'min_impurity_decrease': 0.07362270003708135, 'max_features': 0.5624699825094873, 'subsample': 0.5996644327310208, 'dropout_rate': 0.858552586956929, 'ccp_alpha': 2.251865223738784}. Best is trial 138 with value: 0.731155530669601.[0m
[32m[I 2022-04-13 19:28:17,334][0m Trial 246 finished with value: 0.25 and parameters: {'loss': 'coxph', 'learning_rate': 0.001673913205071125, 'n_estimators': 409, 'criterion': 'absolute_error', 'min_samples_split': 4, 'min_samples_leaf': 8, 'min_weight_fraction_leaf': 0.09179232786129254, 'min_impurity_decrease': 0.1527503830308957, 'max_features': 0.5201349375403289, 'subsample': 0.5613926705329845, 'dropout_rate': 0.2941803774569066, 'ccp_alpha': 2.08571649748684}. Best is trial 138 with value: 0.731155530669601.[0m
[32m[I 2022-04-13 19:29:02,576][0m Trial 247 finished with value: 0.25 and parameters: {'loss': 'coxph', 'learning_rate': 0.0007741443794677381, 'n_estimators': 329, 'criterion': 'absolute_error', 'min_samples_split': 4, 'min_samples_leaf': 9, 'min_weight_fraction_leaf': 0.22885823512624454, 'min_impurity_decrease': 0.2705838878862676, 'max_features': 0.5508620825973735, 'subsample': 0.3455886437168627, 'dropout_rate': 0.8137784863799981, 'ccp_alpha': 1.947921743376822}. Best is trial 138 with value: 0.731155530669601.[0m
[32m[I 2022-04-13 19:29:47,367][0m Trial 248 finished with value: 0.25 and parameters: {'loss': 'coxph', 'learning_rate': 0.0011266347462574062, 'n_estimators': 323, 'criterion': 'absolute_error', 'min_samples_split': 4, 'min_samples_leaf': 6, 'min_weight_fraction_leaf': 0.2151646515905194, 'min_impurity_decrease': 0.24744020541622197, 'max_features': 0.5974515392830806, 'subsample': 0.6196866682205449, 'dropout_rate': 0.8616091428879613, 'ccp_alpha': 1.3469953403532944}. Best is trial 138 with value: 0.731155530669601.[0m
