[32m[I 2022-04-14 23:50:11,211][0m Trial 850 finished with value: 0.7821410470545883 and parameters: {'loss': 'coxph', 'learning_rate': 2.4345577759642045e-06, 'n_estimators': 628, 'criterion': 'friedman_mse', 'min_samples_split': 10, 'min_samples_leaf': 1, 'min_weight_fraction_leaf': 0.24989630354147763, 'min_impurity_decrease': 0.47606266671074343, 'max_features': 0.7495202559629188, 'subsample': 0.03378371317481119, 'dropout_rate': 0.7586371959035908, 'ccp_alpha': 0.08842074391361276}. Best is trial 820 with value: 0.7848883887964149.[0m
[32m[I 2022-04-14 23:51:37,321][0m Trial 851 finished with value: 0.25 and parameters: {'loss': 'coxph', 'learning_rate': 2.271703794447002e-06, 'n_estimators': 615, 'criterion': 'absolute_error', 'min_samples_split': 10, 'min_samples_leaf': 1, 'min_weight_fraction_leaf': 0.25264018397417715, 'min_impurity_decrease': 0.48972865648899117, 'max_features': 0.7070368018955641, 'subsample': 0.003992307167100643, 'dropout_rate': 0.7308664439269623, 'ccp_alpha': 0.0030633705683141685}. Best is trial 820 with value: 0.7848883887964149.[0m
[32m[I 2022-04-14 23:53:04,568][0m Trial 852 finished with value: 0.7814821263928916 and parameters: {'loss': 'coxph', 'learning_rate': 2.611977450756554e-06, 'n_estimators': 627, 'criterion': 'friedman_mse', 'min_samples_split': 10, 'min_samples_leaf': 1, 'min_weight_fraction_leaf': 0.24206932563887856, 'min_impurity_decrease': 0.5125628764843485, 'max_features': 0.7193454917260711, 'subsample': 0.032267744876389906, 'dropout_rate': 0.7608209275148565, 'ccp_alpha': 0.08602981560720592}. Best is trial 820 with value: 0.7848883887964149.[0m
[32m[I 2022-04-14 23:54:32,416][0m Trial 853 finished with value: 0.25 and parameters: {'loss': 'coxph', 'learning_rate': 1.1890254893472035e-06, 'n_estimators': 645, 'criterion': 'friedman_mse', 'min_samples_split': 10, 'min_samples_leaf': 1, 'min_weight_fraction_leaf': 0.26726193188553493, 'min_impurity_decrease': 0.5249572067077489, 'max_features': 0.7564401577511783, 'subsample': 0.001566748854214154, 'dropout_rate': 0.7408229227040923, 'ccp_alpha': 0.08936897107425817}. Best is trial 820 with value: 0.7848883887964149.[0m
[32m[I 2022-04-14 23:55:38,683][0m Trial 854 finished with value: 0.7807364138295266 and parameters: {'loss': 'coxph', 'learning_rate': 1.762527286379837e-06, 'n_estimators': 538, 'criterion': 'friedman_mse', 'min_samples_split': 10, 'min_samples_leaf': 1, 'min_weight_fraction_leaf': 0.2603018942772591, 'min_impurity_decrease': 0.49547661011143596, 'max_features': 0.7401424570027292, 'subsample': 0.032899224329682175, 'dropout_rate': 0.7967009744685759, 'ccp_alpha': 0.08220786150885216}. Best is trial 820 with value: 0.7848883887964149.[0m
[32m[I 2022-04-14 23:57:09,667][0m Trial 855 finished with value: 0.7803648244022635 and parameters: {'loss': 'coxph', 'learning_rate': 2.2012244505512937e-06, 'n_estimators': 649, 'criterion': 'friedman_mse', 'min_samples_split': 10, 'min_samples_leaf': 1, 'min_weight_fraction_leaf': 0.2224617222708097, 'min_impurity_decrease': 0.5050592114975447, 'max_features': 0.7644657740043888, 'subsample': 0.01562146026622142, 'dropout_rate': 0.7830583782061077, 'ccp_alpha': 0.1665227116832327}. Best is trial 820 with value: 0.7848883887964149.[0m
[32m[I 2022-04-14 23:58:30,823][0m Trial 856 finished with value: 0.7836464076896639 and parameters: {'loss': 'coxph', 'learning_rate': 1.2573110015299847e-06, 'n_estimators': 595, 'criterion': 'friedman_mse', 'min_samples_split': 10, 'min_samples_leaf': 1, 'min_weight_fraction_leaf': 0.2467473830501714, 'min_impurity_decrease': 0.4746039656431376, 'max_features': 0.7528999121935727, 'subsample': 0.021142616417497748, 'dropout_rate': 0.7596287930618368, 'ccp_alpha': 0.09076730519254006}. Best is trial 820 with value: 0.7848883887964149.[0m
[32m[I 2022-04-14 23:59:50,523][0m Trial 857 finished with value: 0.25 and parameters: {'loss': 'coxph', 'learning_rate': 1.3974993122946133e-06, 'n_estimators': 597, 'criterion': 'friedman_mse', 'min_samples_split': 10, 'min_samples_leaf': 1, 'min_weight_fraction_leaf': 0.24479454371448878, 'min_impurity_decrease': 0.469024939878317, 'max_features': 0.6787023724084543, 'subsample': 0.0017351670010924275, 'dropout_rate': 0.7722456351590339, 'ccp_alpha': 0.2707194054534428}. Best is trial 820 with value: 0.7848883887964149.[0m
[32m[I 2022-04-15 00:01:06,492][0m Trial 858 finished with value: 0.7815954427808947 and parameters: {'loss': 'coxph', 'learning_rate': 1.1536957929462362e-06, 'n_estimators': 563, 'criterion': 'friedman_mse', 'min_samples_split': 10, 'min_samples_leaf': 1, 'min_weight_fraction_leaf': 0.24907656465190875, 'min_impurity_decrease': 0.4357495692300803, 'max_features': 0.7054234964381498, 'subsample': 0.022787451578424666, 'dropout_rate': 0.7597605135434796, 'ccp_alpha': 0.17580730515642917}. Best is trial 820 with value: 0.7848883887964149.[0m
[32m[I 2022-04-15 00:02:21,629][0m Trial 859 finished with value: 0.7459179234695948 and parameters: {'loss': 'coxph', 'learning_rate': 1.1701735985099945e-06, 'n_estimators': 587, 'criterion': 'friedman_mse', 'min_samples_split': 10, 'min_samples_leaf': 1, 'min_weight_fraction_leaf': 0.23818166585202524, 'min_impurity_decrease': 0.47733855549940996, 'max_features': 0.7108784450024603, 'subsample': 0.03291556291462888, 'dropout_rate': 0.792302101015876, 'ccp_alpha': 0.3503647949648395}. Best is trial 820 with value: 0.7848883887964149.[0m
[32m[I 2022-04-15 00:02:50,861][0m Trial 860 finished with value: -0.25 and parameters: {'loss': 'squared', 'learning_rate': 1.0226743689486908e-06, 'n_estimators': 607, 'criterion': 'friedman_mse', 'min_samples_split': 10, 'min_samples_leaf': 1, 'min_weight_fraction_leaf': 0.22932447858653132, 'min_impurity_decrease': 0.5052124464956802, 'max_features': 0.7263727029568272, 'subsample': 0.0011547103028148112, 'dropout_rate': 0.768623892409547, 'ccp_alpha': 0.26629483204879606}. Best is trial 820 with value: 0.7848883887964149.[0m
[32m[I 2022-04-15 00:04:06,028][0m Trial 861 finished with value: 0.7791250169621236 and parameters: {'loss': 'coxph', 'learning_rate': 1.2011585431033546e-06, 'n_estimators': 563, 'criterion': 'friedman_mse', 'min_samples_split': 10, 'min_samples_leaf': 1, 'min_weight_fraction_leaf': 0.24348589296185089, 'min_impurity_decrease': 0.48825619070552234, 'max_features': 0.7330152039634215, 'subsample': 0.029882547941039582, 'dropout_rate': 0.7624719893945981, 'ccp_alpha': 0.23612712345596673}. Best is trial 820 with value: 0.7848883887964149.[0m
[32m[I 2022-04-15 00:05:29,661][0m Trial 862 finished with value: 0.7581086130513794 and parameters: {'loss': 'coxph', 'learning_rate': 1.4789681470294864e-06, 'n_estimators': 647, 'criterion': 'friedman_mse', 'min_samples_split': 10, 'min_samples_leaf': 1, 'min_weight_fraction_leaf': 0.2531882440054786, 'min_impurity_decrease': 0.5097399062342629, 'max_features': 0.7455741742258545, 'subsample': 0.021050449998272474, 'dropout_rate': 0.8042028371857609, 'ccp_alpha': 0.42368511758262234}. Best is trial 820 with value: 0.7848883887964149.[0m
[32m[I 2022-04-15 00:06:57,311][0m Trial 863 finished with value: 0.7799632216986202 and parameters: {'loss': 'coxph', 'learning_rate': 1.3960375260544268e-06, 'n_estimators': 616, 'criterion': 'friedman_mse', 'min_samples_split': 10, 'min_samples_leaf': 1, 'min_weight_fraction_leaf': 0.2509779281454408, 'min_impurity_decrease': 0.4683883262273242, 'max_features': 0.6886737552020077, 'subsample': 0.01927715309766761, 'dropout_rate': 0.7631265354901897, 'ccp_alpha': 0.17138566604426764}. Best is trial 820 with value: 0.7848883887964149.[0m
[32m[I 2022-04-15 00:08:06,517][0m Trial 864 finished with value: 0.769042295007061 and parameters: {'loss': 'coxph', 'learning_rate': 1.1953994737773805e-06, 'n_estimators': 547, 'criterion': 'friedman_mse', 'min_samples_split': 10, 'min_samples_leaf': 1, 'min_weight_fraction_leaf': 0.2729559177719375, 'min_impurity_decrease': 0.46625192052984027, 'max_features': 0.7129608889259741, 'subsample': 0.03588974246809066, 'dropout_rate': 0.7529794770698869, 'ccp_alpha': 0.2827014024235787}. Best is trial 820 with value: 0.7848883887964149.[0m
[32m[I 2022-04-15 00:09:18,978][0m Trial 865 finished with value: 0.7812914076705779 and parameters: {'loss': 'coxph', 'learning_rate': 1.6134682859748019e-06, 'n_estimators': 548, 'criterion': 'friedman_mse', 'min_samples_split': 10, 'min_samples_leaf': 1, 'min_weight_fraction_leaf': 0.2111598633544516, 'min_impurity_decrease': 0.46454986921095043, 'max_features': 0.6559695541379097, 'subsample': 0.019778065640877734, 'dropout_rate': 0.7471872205725553, 'ccp_alpha': 0.1740923088967599}. Best is trial 820 with value: 0.7848883887964149.[0m
[32m[I 2022-04-15 00:10:36,771][0m Trial 866 finished with value: 0.7809793245882954 and parameters: {'loss': 'coxph', 'learning_rate': 1.099176505269237e-06, 'n_estimators': 588, 'criterion': 'friedman_mse', 'min_samples_split': 10, 'min_samples_leaf': 1, 'min_weight_fraction_leaf': 0.2313711747394567, 'min_impurity_decrease': 0.5490333084563073, 'max_features': 0.701490624796165, 'subsample': 0.03881883276353532, 'dropout_rate': 0.7763779653547532, 'ccp_alpha': 0.15264599967889322}. Best is trial 820 with value: 0.7848883887964149.[0m
[32m[I 2022-04-15 00:11:53,491][0m Trial 867 finished with value: 0.25 and parameters: {'loss': 'coxph', 'learning_rate': 1.7413265606390952e-06, 'n_estimators': 566, 'criterion': 'friedman_mse', 'min_samples_split': 10, 'min_samples_leaf': 1, 'min_weight_fraction_leaf': 0.2590580882300966, 'min_impurity_decrease': 0.49519635795906686, 'max_features': 0.7520292995407788, 'subsample': 0.0019855817210020534, 'dropout_rate': 0.7572632876016804, 'ccp_alpha': 0.33337036681161397}. Best is trial 820 with value: 0.7848883887964149.[0m
[32m[I 2022-04-15 00:12:59,146][0m Trial 868 finished with value: 0.25 and parameters: {'loss': 'coxph', 'learning_rate': 1.4100789427708378e-06, 'n_estimators': 525, 'criterion': 'squared_error', 'min_samples_split': 10, 'min_samples_leaf': 1, 'min_weight_fraction_leaf': 0.2651375980008155, 'min_impurity_decrease': 0.44260862964398795, 'max_features': 0.7567266793759678, 'subsample': 0.0010939339018427273, 'dropout_rate': 0.8176092709326396, 'ccp_alpha': 0.09049176326911491}. Best is trial 820 with value: 0.7848883887964149.[0m
[32m[I 2022-04-15 00:14:21,534][0m Trial 869 finished with value: 0.7754535864907222 and parameters: {'loss': 'coxph', 'learning_rate': 1.9083267254293863e-06, 'n_estimators': 619, 'criterion': 'friedman_mse', 'min_samples_split': 10, 'min_samples_leaf': 1, 'min_weight_fraction_leaf': 0.24849537476234246, 'min_impurity_decrease': 0.5194704685838015, 'max_features': 0.7709319209156705, 'subsample': 0.04038225895843307, 'dropout_rate': 0.7945161060259675, 'ccp_alpha': 0.22068271699169068}. Best is trial 820 with value: 0.7848883887964149.[0m
[32m[I 2022-04-15 00:15:40,468][0m Trial 870 finished with value: 0.778192706372045 and parameters: {'loss': 'coxph', 'learning_rate': 2.1858179480122542e-06, 'n_estimators': 565, 'criterion': 'friedman_mse', 'min_samples_split': 10, 'min_samples_leaf': 1, 'min_weight_fraction_leaf': 0.27919397929848166, 'min_impurity_decrease': 0.47510630153620687, 'max_features': 0.7333894924739053, 'subsample': 0.01939600602308134, 'dropout_rate': 0.7457553904901681, 'ccp_alpha': 0.10470094372486936}. Best is trial 820 with value: 0.7848883887964149.[0m
[32m[I 2022-04-15 00:17:02,284][0m Trial 871 finished with value: 0.7761848044829838 and parameters: {'loss': 'coxph', 'learning_rate': 1.0597753533330153e-06, 'n_estimators': 596, 'criterion': 'friedman_mse', 'min_samples_split': 10, 'min_samples_leaf': 1, 'min_weight_fraction_leaf': 0.2696696743137941, 'min_impurity_decrease': 0.4511605556653286, 'max_features': 0.7662528267742302, 'subsample': 0.05286025977067665, 'dropout_rate': 0.7852112798368641, 'ccp_alpha': 0.1959415271659695}. Best is trial 820 with value: 0.7848883887964149.[0m
[32m[I 2022-04-15 00:18:23,025][0m Trial 872 finished with value: 0.7822329597660213 and parameters: {'loss': 'coxph', 'learning_rate': 1.5856210013699814e-06, 'n_estimators': 582, 'criterion': 'friedman_mse', 'min_samples_split': 10, 'min_samples_leaf': 1, 'min_weight_fraction_leaf': 0.23631642633632985, 'min_impurity_decrease': 0.467193115772359, 'max_features': 0.6951431109939974, 'subsample': 0.018790733300963872, 'dropout_rate': 0.744072799095247, 'ccp_alpha': 0.07934803964626333}. Best is trial 820 with value: 0.7848883887964149.[0m
[32m[I 2022-04-15 00:19:47,848][0m Trial 873 finished with value: 0.6741430020145392 and parameters: {'loss': 'coxph', 'learning_rate': 1.3826249815287019e-06, 'n_estimators': 617, 'criterion': 'absolute_error', 'min_samples_split': 10, 'min_samples_leaf': 1, 'min_weight_fraction_leaf': 0.22294135358845923, 'min_impurity_decrease': 0.4760240950095576, 'max_features': 0.6860642394581412, 'subsample': 0.02060312655089004, 'dropout_rate': 0.7323579803860173, 'ccp_alpha': 0.08944899538439176}. Best is trial 820 with value: 0.7848883887964149.[0m
[32m[I 2022-04-15 00:20:56,121][0m Trial 874 finished with value: 0.7823582983579633 and parameters: {'loss': 'coxph', 'learning_rate': 1.9243091004576556e-06, 'n_estimators': 524, 'criterion': 'friedman_mse', 'min_samples_split': 10, 'min_samples_leaf': 1, 'min_weight_fraction_leaf': 0.2333994498662718, 'min_impurity_decrease': 0.4988864152963929, 'max_features': 0.7000011820191311, 'subsample': 0.01847665237737353, 'dropout_rate': 0.7573301831254832, 'ccp_alpha': 0.08051295871035466}. Best is trial 820 with value: 0.7848883887964149.[0m
[32m[I 2022-04-15 00:22:09,001][0m Trial 875 finished with value: 0.7824246867097648 and parameters: {'loss': 'coxph', 'learning_rate': 1.8732993457768556e-06, 'n_estimators': 538, 'criterion': 'friedman_mse', 'min_samples_split': 10, 'min_samples_leaf': 1, 'min_weight_fraction_leaf': 0.23261728623180553, 'min_impurity_decrease': 0.4840043545773821, 'max_features': 0.6836117867420566, 'subsample': 0.018646293475849965, 'dropout_rate': 0.7261490635227137, 'ccp_alpha': 0.07958297982985271}. Best is trial 820 with value: 0.7848883887964149.[0m
[32m[I 2022-04-15 00:23:12,889][0m Trial 876 finished with value: 0.7796509281785574 and parameters: {'loss': 'coxph', 'learning_rate': 1.7681732075992694e-06, 'n_estimators': 482, 'criterion': 'friedman_mse', 'min_samples_split': 10, 'min_samples_leaf': 1, 'min_weight_fraction_leaf': 0.22390150004823545, 'min_impurity_decrease': 0.5370437028967537, 'max_features': 0.6630572400728199, 'subsample': 0.012640638358956222, 'dropout_rate': 0.726406486827159, 'ccp_alpha': 0.002217066353219025}. Best is trial 820 with value: 0.7848883887964149.[0m
[32m[I 2022-04-15 00:24:21,684][0m Trial 877 finished with value: 0.7849837723237536 and parameters: {'loss': 'coxph', 'learning_rate': 1.9784466462598274e-06, 'n_estimators': 513, 'criterion': 'friedman_mse', 'min_samples_split': 10, 'min_samples_leaf': 1, 'min_weight_fraction_leaf': 0.23427152393004713, 'min_impurity_decrease': 0.502900113179118, 'max_features': 0.6442148140024151, 'subsample': 0.019577506259794784, 'dropout_rate': 0.7290452955193059, 'ccp_alpha': 0.08559759243884126}. Best is trial 877 with value: 0.7849837723237536.[0m
[32m[I 2022-04-15 00:24:46,727][0m Trial 878 finished with value: -0.25 and parameters: {'loss': 'squared', 'learning_rate': 2.0180215881055466e-06, 'n_estimators': 512, 'criterion': 'friedman_mse', 'min_samples_split': 10, 'min_samples_leaf': 1, 'min_weight_fraction_leaf': 0.23458631415738657, 'min_impurity_decrease': 0.5090386714328918, 'max_features': 0.6767469095105829, 'subsample': 0.0030296663971576612, 'dropout_rate': 0.7456980210299863, 'ccp_alpha': 0.0900499551178938}. Best is trial 877 with value: 0.7849837723237536.[0m
[32m[I 2022-04-15 00:25:59,523][0m Trial 879 finished with value: 0.7838308552234708 and parameters: {'loss': 'coxph', 'learning_rate': 1.6118488832236476e-06, 'n_estimators': 528, 'criterion': 'friedman_mse', 'min_samples_split': 10, 'min_samples_leaf': 1, 'min_weight_fraction_leaf': 0.21378995336226322, 'min_impurity_decrease': 0.5016954973909196, 'max_features': 0.6370600568897877, 'subsample': 0.02161475706366156, 'dropout_rate': 0.7234079682521376, 'ccp_alpha': 0.08465707184792391}. Best is trial 877 with value: 0.7849837723237536.[0m
[32m[I 2022-04-15 00:27:05,117][0m Trial 880 finished with value: 0.778855539553615 and parameters: {'loss': 'coxph', 'learning_rate': 1.646261189532004e-06, 'n_estimators': 509, 'criterion': 'friedman_mse', 'min_samples_split': 10, 'min_samples_leaf': 1, 'min_weight_fraction_leaf': 0.22341572465659498, 'min_impurity_decrease': 0.523129714946626, 'max_features': 0.6402594651424376, 'subsample': 0.01873165978192675, 'dropout_rate': 0.7250694713128306, 'ccp_alpha': 0.27857010394368564}. Best is trial 877 with value: 0.7849837723237536.[0m
[32m[I 2022-04-15 00:28:07,396][0m Trial 881 finished with value: 0.25 and parameters: {'loss': 'coxph', 'learning_rate': 2.3252392460429705e-06, 'n_estimators': 493, 'criterion': 'friedman_mse', 'min_samples_split': 10, 'min_samples_leaf': 1, 'min_weight_fraction_leaf': 0.20293539342176814, 'min_impurity_decrease': 0.5009960867636362, 'max_features': 0.6366396872588057, 'subsample': 0.002691546070274709, 'dropout_rate': 0.7334806572471807, 'ccp_alpha': 0.10807506756658722}. Best is trial 877 with value: 0.7849837723237536.[0m
[32m[I 2022-04-15 00:29:04,327][0m Trial 882 finished with value: 0.7789727754744635 and parameters: {'loss': 'coxph', 'learning_rate': 1.7909365123146558e-06, 'n_estimators': 469, 'criterion': 'friedman_mse', 'min_samples_split': 10, 'min_samples_leaf': 1, 'min_weight_fraction_leaf': 0.20420298155117889, 'min_impurity_decrease': 0.5292526899935229, 'max_features': 0.6123641515749125, 'subsample': 0.031614926906410906, 'dropout_rate': 0.7690735559152745, 'ccp_alpha': 0.2503338815210305}. Best is trial 877 with value: 0.7849837723237536.[0m
[32m[I 2022-04-15 00:30:23,426][0m Trial 883 finished with value: 0.7834595529667242 and parameters: {'loss': 'coxph', 'learning_rate': 1.5101776374218627e-06, 'n_estimators': 533, 'criterion': 'friedman_mse', 'min_samples_split': 10, 'min_samples_leaf': 1, 'min_weight_fraction_leaf': 0.23322188157105306, 'min_impurity_decrease': 0.4933254568733687, 'max_features': 0.6470546420293964, 'subsample': 0.020046095147723826, 'dropout_rate': 0.7211676315909109, 'ccp_alpha': 0.0013680898908332623}. Best is trial 877 with value: 0.7849837723237536.[0m
[32m[I 2022-04-15 00:31:36,819][0m Trial 884 finished with value: 0.25 and parameters: {'loss': 'coxph', 'learning_rate': 2.140467488040123e-06, 'n_estimators': 533, 'criterion': 'friedman_mse', 'min_samples_split': 10, 'min_samples_leaf': 1, 'min_weight_fraction_leaf': 0.21910594759428867, 'min_impurity_decrease': 0.5576248336184647, 'max_features': 0.6612928743041631, 'subsample': 0.0031702129784786683, 'dropout_rate': 0.753575020552211, 'ccp_alpha': 0.07448695085701414}. Best is trial 877 with value: 0.7849837723237536.[0m
[32m[I 2022-04-15 00:32:52,415][0m Trial 885 finished with value: 0.7805691002893678 and parameters: {'loss': 'coxph', 'learning_rate': 2.567402042824208e-06, 'n_estimators': 523, 'criterion': 'friedman_mse', 'min_samples_split': 10, 'min_samples_leaf': 1, 'min_weight_fraction_leaf': 0.21130401693719747, 'min_impurity_decrease': 0.4945123763679908, 'max_features': 0.6277232642883392, 'subsample': 0.017620894478867367, 'dropout_rate': 0.7272654050808045, 'ccp_alpha': 0.003392727235204745}. Best is trial 877 with value: 0.7849837723237536.[0m
[32m[I 2022-04-15 00:34:06,831][0m Trial 886 finished with value: 0.7816510824846956 and parameters: {'loss': 'coxph', 'learning_rate': 1.7872215494602167e-06, 'n_estimators': 541, 'criterion': 'friedman_mse', 'min_samples_split': 10, 'min_samples_leaf': 1, 'min_weight_fraction_leaf': 0.22848280132885798, 'min_impurity_decrease': 0.5168029956032285, 'max_features': 0.6833938475594697, 'subsample': 0.027837181372858597, 'dropout_rate': 0.7766632033271028, 'ccp_alpha': 0.15535394269461789}. Best is trial 877 with value: 0.7849837723237536.[0m
[32m[I 2022-04-15 00:35:25,137][0m Trial 887 finished with value: 0.7799528171736757 and parameters: {'loss': 'coxph', 'learning_rate': 1.3903091095385585e-06, 'n_estimators': 545, 'criterion': 'friedman_mse', 'min_samples_split': 10, 'min_samples_leaf': 1, 'min_weight_fraction_leaf': 0.21469965652348214, 'min_impurity_decrease': 0.48665576838438057, 'max_features': 0.6560746461903412, 'subsample': 0.018099247284286742, 'dropout_rate': 0.7246246959117759, 'ccp_alpha': 0.09933095013046297}. Best is trial 877 with value: 0.7849837723237536.[0m
[32m[I 2022-04-15 00:36:28,660][0m Trial 888 finished with value: 0.25 and parameters: {'loss': 'coxph', 'learning_rate': 2.0791919350094592e-06, 'n_estimators': 496, 'criterion': 'friedman_mse', 'min_samples_split': 10, 'min_samples_leaf': 1, 'min_weight_fraction_leaf': 0.24233069843822747, 'min_impurity_decrease': 0.49792201997112684, 'max_features': 0.6683904378902581, 'subsample': 0.0016624724617997771, 'dropout_rate': 0.7497115633762722, 'ccp_alpha': 0.08861601686684202}. Best is trial 877 with value: 0.7849837723237536.[0m
[32m[I 2022-04-15 00:37:35,023][0m Trial 889 finished with value: 0.7788505434425115 and parameters: {'loss': 'coxph', 'learning_rate': 2.6290627637047696e-06, 'n_estimators': 557, 'criterion': 'friedman_mse', 'min_samples_split': 10, 'min_samples_leaf': 1, 'min_weight_fraction_leaf': 0.23668043220027785, 'min_impurity_decrease': 0.4844379909929314, 'max_features': 0.6449687494097565, 'subsample': 0.02028334322695797, 'dropout_rate': 0.8314879045354509, 'ccp_alpha': 0.15947135055084355}. Best is trial 877 with value: 0.7849837723237536.[0m
