[32m[I 2022-04-13 22:45:31,079][0m Trial 330 finished with value: 0.25 and parameters: {'loss': 'coxph', 'learning_rate': 4.692419606778808e-06, 'n_estimators': 818, 'criterion': 'friedman_mse', 'min_samples_split': 8, 'min_samples_leaf': 2, 'min_weight_fraction_leaf': 0.36525580191796825, 'min_impurity_decrease': 0.3772298021926442, 'max_features': 0.8481051968667559, 'subsample': 0.005766309467023729, 'dropout_rate': 0.5461287704216519, 'ccp_alpha': 0.0024338206468449697}. Best is trial 317 with value: 0.7815705261705512.[0m
[32m[I 2022-04-13 22:48:50,188][0m Trial 331 finished with value: 0.7793353120869374 and parameters: {'loss': 'coxph', 'learning_rate': 5.394165478666003e-06, 'n_estimators': 816, 'criterion': 'friedman_mse', 'min_samples_split': 8, 'min_samples_leaf': 2, 'min_weight_fraction_leaf': 0.357800978977644, 'min_impurity_decrease': 0.34977839139630057, 'max_features': 0.7995252328164345, 'subsample': 0.07135685546153847, 'dropout_rate': 0.5269555872580031, 'ccp_alpha': 0.15012377377264272}. Best is trial 317 with value: 0.7815705261705512.[0m
[32m[I 2022-04-13 22:51:28,883][0m Trial 332 finished with value: 0.6371812073302544 and parameters: {'loss': 'coxph', 'learning_rate': 4.171355753924757e-06, 'n_estimators': 729, 'criterion': 'friedman_mse', 'min_samples_split': 8, 'min_samples_leaf': 2, 'min_weight_fraction_leaf': 0.3629733689886833, 'min_impurity_decrease': 0.343567632257109, 'max_features': 0.8052302709592412, 'subsample': 0.06643871491305704, 'dropout_rate': 0.5285904701359707, 'ccp_alpha': 0.3185119040879419}. Best is trial 317 with value: 0.7815705261705512.[0m
[32m[I 2022-04-13 22:55:10,521][0m Trial 333 finished with value: 0.7795252135261033 and parameters: {'loss': 'coxph', 'learning_rate': 5.537179391108584e-06, 'n_estimators': 811, 'criterion': 'friedman_mse', 'min_samples_split': 8, 'min_samples_leaf': 2, 'min_weight_fraction_leaf': 0.3558942907610679, 'min_impurity_decrease': 0.38860875100753334, 'max_features': 0.7954843697447382, 'subsample': 0.039583483175353026, 'dropout_rate': 0.521369722324499, 'ccp_alpha': 0.10456899100372286}. Best is trial 317 with value: 0.7815705261705512.[0m
[32m[I 2022-04-13 22:59:01,068][0m Trial 334 finished with value: 0.7795220057481694 and parameters: {'loss': 'coxph', 'learning_rate': 6.008972582169813e-06, 'n_estimators': 815, 'criterion': 'friedman_mse', 'min_samples_split': 8, 'min_samples_leaf': 2, 'min_weight_fraction_leaf': 0.3564244454723301, 'min_impurity_decrease': 0.38965666661932125, 'max_features': 0.8444489391587444, 'subsample': 0.07262114692045707, 'dropout_rate': 0.49700895304302295, 'ccp_alpha': 0.09839711881178118}. Best is trial 317 with value: 0.7815705261705512.[0m
[32m[I 2022-04-13 23:02:54,598][0m Trial 335 finished with value: 0.48184912657428935 and parameters: {'loss': 'coxph', 'learning_rate': 5.741033593147916e-06, 'n_estimators': 816, 'criterion': 'friedman_mse', 'min_samples_split': 8, 'min_samples_leaf': 2, 'min_weight_fraction_leaf': 0.35616507277457554, 'min_impurity_decrease': 0.390062505901123, 'max_features': 0.8416714926582433, 'subsample': 0.07147100440048942, 'dropout_rate': 0.48488411359709166, 'ccp_alpha': 0.3616035325003748}. Best is trial 317 with value: 0.7815705261705512.[0m
[32m[I 2022-04-13 23:06:23,340][0m Trial 336 finished with value: 0.7805829111968969 and parameters: {'loss': 'coxph', 'learning_rate': 7.51615107463358e-06, 'n_estimators': 812, 'criterion': 'friedman_mse', 'min_samples_split': 8, 'min_samples_leaf': 2, 'min_weight_fraction_leaf': 0.3428772646378702, 'min_impurity_decrease': 0.3343603292624901, 'max_features': 0.7991809149434057, 'subsample': 0.05113197774860771, 'dropout_rate': 0.5558445570602831, 'ccp_alpha': 0.13449734302710348}. Best is trial 317 with value: 0.7815705261705512.[0m
[32m[I 2022-04-13 23:10:03,575][0m Trial 337 finished with value: 0.7803731882294624 and parameters: {'loss': 'coxph', 'learning_rate': 7.025574441183933e-06, 'n_estimators': 842, 'criterion': 'friedman_mse', 'min_samples_split': 8, 'min_samples_leaf': 2, 'min_weight_fraction_leaf': 0.3744595013591408, 'min_impurity_decrease': 0.32792952670492126, 'max_features': 0.789355201620299, 'subsample': 0.07941280215474582, 'dropout_rate': 0.5576073733528769, 'ccp_alpha': 0.11445166589303794}. Best is trial 317 with value: 0.7815705261705512.[0m
[32m[I 2022-04-13 23:14:06,000][0m Trial 338 finished with value: 0.7811243783180177 and parameters: {'loss': 'coxph', 'learning_rate': 7.466326602174707e-06, 'n_estimators': 830, 'criterion': 'friedman_mse', 'min_samples_split': 8, 'min_samples_leaf': 2, 'min_weight_fraction_leaf': 0.3592482770133384, 'min_impurity_decrease': 0.33757096261746916, 'max_features': 0.7943189387462151, 'subsample': 0.07314442720195094, 'dropout_rate': 0.5544700442243268, 'ccp_alpha': 0.10619593262540303}. Best is trial 317 with value: 0.7815705261705512.[0m
[32m[I 2022-04-13 23:18:02,458][0m Trial 339 finished with value: 0.7802167932228855 and parameters: {'loss': 'coxph', 'learning_rate': 7.467421829393149e-06, 'n_estimators': 844, 'criterion': 'friedman_mse', 'min_samples_split': 8, 'min_samples_leaf': 2, 'min_weight_fraction_leaf': 0.3704299485509589, 'min_impurity_decrease': 0.32837824518948344, 'max_features': 0.8690875893450808, 'subsample': 0.08108534559806985, 'dropout_rate': 0.5600818038154558, 'ccp_alpha': 0.09484077354234603}. Best is trial 317 with value: 0.7815705261705512.[0m
[32m[I 2022-04-13 23:22:00,722][0m Trial 340 finished with value: 0.7811565801247409 and parameters: {'loss': 'coxph', 'learning_rate': 6.1583637363691615e-06, 'n_estimators': 845, 'criterion': 'friedman_mse', 'min_samples_split': 8, 'min_samples_leaf': 2, 'min_weight_fraction_leaf': 0.36794790097856195, 'min_impurity_decrease': 0.32840801925242924, 'max_features': 0.8644329285874363, 'subsample': 0.08005220329685511, 'dropout_rate': 0.5577666517612695, 'ccp_alpha': 0.006492799056560111}. Best is trial 317 with value: 0.7815705261705512.[0m
[32m[I 2022-04-13 23:25:57,364][0m Trial 341 finished with value: 0.7808863705521811 and parameters: {'loss': 'coxph', 'learning_rate': 7.710337615982772e-06, 'n_estimators': 863, 'criterion': 'friedman_mse', 'min_samples_split': 8, 'min_samples_leaf': 2, 'min_weight_fraction_leaf': 0.3738312058921009, 'min_impurity_decrease': 0.3289936372546972, 'max_features': 0.8684033675413606, 'subsample': 0.08323495326167349, 'dropout_rate': 0.5562003356612101, 'ccp_alpha': 0.004001756004998696}. Best is trial 317 with value: 0.7815705261705512.[0m
[32m[I 2022-04-13 23:30:02,752][0m Trial 342 finished with value: 0.7803135737320195 and parameters: {'loss': 'coxph', 'learning_rate': 6.814043163445007e-06, 'n_estimators': 860, 'criterion': 'friedman_mse', 'min_samples_split': 8, 'min_samples_leaf': 2, 'min_weight_fraction_leaf': 0.3748079060540431, 'min_impurity_decrease': 0.32576707916669556, 'max_features': 0.8661329728621696, 'subsample': 0.08159835485683428, 'dropout_rate': 0.5610034680470825, 'ccp_alpha': 0.011796051326321428}. Best is trial 317 with value: 0.7815705261705512.[0m
[32m[I 2022-04-13 23:34:15,452][0m Trial 343 finished with value: 0.780763551875794 and parameters: {'loss': 'coxph', 'learning_rate': 6.750995716087199e-06, 'n_estimators': 862, 'criterion': 'friedman_mse', 'min_samples_split': 8, 'min_samples_leaf': 2, 'min_weight_fraction_leaf': 0.37511153644921547, 'min_impurity_decrease': 0.3265891480174484, 'max_features': 0.862507761415015, 'subsample': 0.08511805949806742, 'dropout_rate': 0.5591240076630722, 'ccp_alpha': 0.018502628516014835}. Best is trial 317 with value: 0.7815705261705512.[0m
[32m[I 2022-04-13 23:38:18,236][0m Trial 344 finished with value: 0.7803937295061196 and parameters: {'loss': 'coxph', 'learning_rate': 6.958357721525923e-06, 'n_estimators': 845, 'criterion': 'friedman_mse', 'min_samples_split': 8, 'min_samples_leaf': 2, 'min_weight_fraction_leaf': 0.376150650596292, 'min_impurity_decrease': 0.3193163268844377, 'max_features': 0.8727711031554493, 'subsample': 0.08158731766129136, 'dropout_rate': 0.5607794085022816, 'ccp_alpha': 0.0017477350293378996}. Best is trial 317 with value: 0.7815705261705512.[0m
[32m[I 2022-04-13 23:42:25,037][0m Trial 345 finished with value: 0.7807459077569773 and parameters: {'loss': 'coxph', 'learning_rate': 7.302028763402809e-06, 'n_estimators': 866, 'criterion': 'friedman_mse', 'min_samples_split': 8, 'min_samples_leaf': 2, 'min_weight_fraction_leaf': 0.38066788203829, 'min_impurity_decrease': 0.3301035459602473, 'max_features': 0.8676426407535581, 'subsample': 0.09099173665218635, 'dropout_rate': 0.5604229707201629, 'ccp_alpha': 0.00104216606863336}. Best is trial 317 with value: 0.7815705261705512.[0m
[32m[I 2022-04-13 23:46:34,446][0m Trial 346 finished with value: 0.7809413866561579 and parameters: {'loss': 'coxph', 'learning_rate': 7.660861892740408e-06, 'n_estimators': 872, 'criterion': 'friedman_mse', 'min_samples_split': 8, 'min_samples_leaf': 2, 'min_weight_fraction_leaf': 0.37635951541897605, 'min_impurity_decrease': 0.32438962713355074, 'max_features': 0.8612383754572173, 'subsample': 0.08578686898635493, 'dropout_rate': 0.5618662657946842, 'ccp_alpha': 0.007884327767835061}. Best is trial 317 with value: 0.7815705261705512.[0m
[32m[I 2022-04-13 23:50:42,215][0m Trial 347 finished with value: 0.7804423279584333 and parameters: {'loss': 'coxph', 'learning_rate': 7.923709312473647e-06, 'n_estimators': 865, 'criterion': 'friedman_mse', 'min_samples_split': 8, 'min_samples_leaf': 2, 'min_weight_fraction_leaf': 0.37353700916996185, 'min_impurity_decrease': 0.32352881390881794, 'max_features': 0.8712990855632902, 'subsample': 0.08964747970933887, 'dropout_rate': 0.563495073919736, 'ccp_alpha': 0.01459475737583325}. Best is trial 317 with value: 0.7815705261705512.[0m
[32m[I 2022-04-13 23:53:35,094][0m Trial 348 finished with value: -0.3669853896874334 and parameters: {'loss': 'squared', 'learning_rate': 8.044949913164252e-06, 'n_estimators': 866, 'criterion': 'friedman_mse', 'min_samples_split': 8, 'min_samples_leaf': 2, 'min_weight_fraction_leaf': 0.376783653835421, 'min_impurity_decrease': 0.322706344426793, 'max_features': 0.8623192878885949, 'subsample': 0.0907417411560668, 'dropout_rate': 0.563309558713926, 'ccp_alpha': 0.017087315492887167}. Best is trial 317 with value: 0.7815705261705512.[0m
[32m[I 2022-04-13 23:57:58,282][0m Trial 349 finished with value: 0.780518811809159 and parameters: {'loss': 'coxph', 'learning_rate': 7.543182799233305e-06, 'n_estimators': 866, 'criterion': 'friedman_mse', 'min_samples_split': 8, 'min_samples_leaf': 2, 'min_weight_fraction_leaf': 0.3744021563399891, 'min_impurity_decrease': 0.3278677565851995, 'max_features': 0.8742587269553047, 'subsample': 0.10115712352311401, 'dropout_rate': 0.5603905980359888, 'ccp_alpha': 0.001111479406098017}. Best is trial 317 with value: 0.7815705261705512.[0m
[32m[I 2022-04-14 00:02:26,715][0m Trial 350 finished with value: 0.7810445454992123 and parameters: {'loss': 'coxph', 'learning_rate': 7.79957383034111e-06, 'n_estimators': 869, 'criterion': 'friedman_mse', 'min_samples_split': 8, 'min_samples_leaf': 2, 'min_weight_fraction_leaf': 0.3742383261723954, 'min_impurity_decrease': 0.3253885940388223, 'max_features': 0.8753068497642641, 'subsample': 0.091353316078924, 'dropout_rate': 0.5677866478105027, 'ccp_alpha': 0.04761092177375589}. Best is trial 317 with value: 0.7815705261705512.[0m
[32m[I 2022-04-14 00:07:13,287][0m Trial 351 finished with value: 0.7802810826578253 and parameters: {'loss': 'coxph', 'learning_rate': 7.99213560165929e-06, 'n_estimators': 863, 'criterion': 'friedman_mse', 'min_samples_split': 8, 'min_samples_leaf': 2, 'min_weight_fraction_leaf': 0.3771656178688662, 'min_impurity_decrease': 0.3253762506726463, 'max_features': 0.8785785547217942, 'subsample': 0.08983025653906898, 'dropout_rate': 0.5591281107686958, 'ccp_alpha': 0.00985080040180103}. Best is trial 317 with value: 0.7815705261705512.[0m
[32m[I 2022-04-14 00:11:22,597][0m Trial 352 finished with value: 0.780984316966906 and parameters: {'loss': 'coxph', 'learning_rate': 7.565198639073931e-06, 'n_estimators': 863, 'criterion': 'friedman_mse', 'min_samples_split': 8, 'min_samples_leaf': 2, 'min_weight_fraction_leaf': 0.3761389258298829, 'min_impurity_decrease': 0.3313539298694523, 'max_features': 0.8750689346586592, 'subsample': 0.10395751325791386, 'dropout_rate': 0.573204960575261, 'ccp_alpha': 0.007528064145021093}. Best is trial 317 with value: 0.7815705261705512.[0m
[32m[I 2022-04-14 00:15:30,363][0m Trial 353 finished with value: 0.7806005236907153 and parameters: {'loss': 'coxph', 'learning_rate': 8.510980056204043e-06, 'n_estimators': 869, 'criterion': 'friedman_mse', 'min_samples_split': 8, 'min_samples_leaf': 2, 'min_weight_fraction_leaf': 0.37491088646305165, 'min_impurity_decrease': 0.3191333346963222, 'max_features': 0.8804716207447586, 'subsample': 0.10311186072083867, 'dropout_rate': 0.5617656108458144, 'ccp_alpha': 0.03344433627131956}. Best is trial 317 with value: 0.7815705261705512.[0m
[32m[I 2022-04-14 00:19:42,564][0m Trial 354 finished with value: 0.7807604512614461 and parameters: {'loss': 'coxph', 'learning_rate': 7.706689685896979e-06, 'n_estimators': 876, 'criterion': 'friedman_mse', 'min_samples_split': 8, 'min_samples_leaf': 2, 'min_weight_fraction_leaf': 0.37361091835427623, 'min_impurity_decrease': 0.32423832939857, 'max_features': 0.870103796092291, 'subsample': 0.10422285113204577, 'dropout_rate': 0.5646045651896386, 'ccp_alpha': 0.011086503241616037}. Best is trial 317 with value: 0.7815705261705512.[0m
[32m[I 2022-04-14 00:23:29,905][0m Trial 355 finished with value: 0.7806083486941363 and parameters: {'loss': 'coxph', 'learning_rate': 7.582198938476278e-06, 'n_estimators': 876, 'criterion': 'friedman_mse', 'min_samples_split': 8, 'min_samples_leaf': 2, 'min_weight_fraction_leaf': 0.37560489696824845, 'min_impurity_decrease': 0.3233571911475496, 'max_features': 0.8782017434067777, 'subsample': 0.10310251181981829, 'dropout_rate': 0.5666480536650488, 'ccp_alpha': 0.006922192701892604}. Best is trial 317 with value: 0.7815705261705512.[0m
[32m[I 2022-04-14 00:27:17,247][0m Trial 356 finished with value: 0.7811256326303126 and parameters: {'loss': 'coxph', 'learning_rate': 7.872852978261459e-06, 'n_estimators': 875, 'criterion': 'friedman_mse', 'min_samples_split': 9, 'min_samples_leaf': 2, 'min_weight_fraction_leaf': 0.37602276075879965, 'min_impurity_decrease': 0.3192922589594107, 'max_features': 0.8752184217979934, 'subsample': 0.10718474867838887, 'dropout_rate': 0.5689566166303792, 'ccp_alpha': 0.03389562659281717}. Best is trial 317 with value: 0.7815705261705512.[0m
[32m[I 2022-04-14 00:31:10,579][0m Trial 357 finished with value: 0.7808286474683225 and parameters: {'loss': 'coxph', 'learning_rate': 8.060940625854253e-06, 'n_estimators': 877, 'criterion': 'friedman_mse', 'min_samples_split': 8, 'min_samples_leaf': 2, 'min_weight_fraction_leaf': 0.3788591110148174, 'min_impurity_decrease': 0.3055244439124337, 'max_features': 0.8827031086607634, 'subsample': 0.10553059380293871, 'dropout_rate': 0.5756090756756834, 'ccp_alpha': 0.01415679513584159}. Best is trial 317 with value: 0.7815705261705512.[0m
[32m[I 2022-04-14 00:35:01,761][0m Trial 358 finished with value: 0.7810076851395862 and parameters: {'loss': 'coxph', 'learning_rate': 8.013506145529173e-06, 'n_estimators': 889, 'criterion': 'friedman_mse', 'min_samples_split': 9, 'min_samples_leaf': 2, 'min_weight_fraction_leaf': 0.3788857062576794, 'min_impurity_decrease': 0.29762774749708387, 'max_features': 0.8826344295044255, 'subsample': 0.10920810908817415, 'dropout_rate': 0.5722363550949945, 'ccp_alpha': 0.0019027149070295624}. Best is trial 317 with value: 0.7815705261705512.[0m
[32m[I 2022-04-14 00:38:34,495][0m Trial 359 finished with value: 0.7808971084637862 and parameters: {'loss': 'coxph', 'learning_rate': 8.27077815125338e-06, 'n_estimators': 877, 'criterion': 'friedman_mse', 'min_samples_split': 9, 'min_samples_leaf': 2, 'min_weight_fraction_leaf': 0.37769125418024385, 'min_impurity_decrease': 0.31287020642087754, 'max_features': 0.8827046062389368, 'subsample': 0.10604557055575209, 'dropout_rate': 0.5746432558007012, 'ccp_alpha': 0.010427892552731643}. Best is trial 317 with value: 0.7815705261705512.[0m
[32m[I 2022-04-14 00:42:34,316][0m Trial 360 finished with value: 0.7810003985774538 and parameters: {'loss': 'coxph', 'learning_rate': 9.984970580389382e-06, 'n_estimators': 892, 'criterion': 'friedman_mse', 'min_samples_split': 9, 'min_samples_leaf': 2, 'min_weight_fraction_leaf': 0.3777618368620128, 'min_impurity_decrease': 0.30245681484986026, 'max_features': 0.8832619235746229, 'subsample': 0.10921131663904265, 'dropout_rate': 0.5782912050473916, 'ccp_alpha': 0.010328967724550372}. Best is trial 317 with value: 0.7815705261705512.[0m
[32m[I 2022-04-14 00:46:26,195][0m Trial 361 finished with value: 0.7810608311961477 and parameters: {'loss': 'coxph', 'learning_rate': 9.616485752078766e-06, 'n_estimators': 904, 'criterion': 'friedman_mse', 'min_samples_split': 9, 'min_samples_leaf': 2, 'min_weight_fraction_leaf': 0.38788899717769193, 'min_impurity_decrease': 0.29460079721650095, 'max_features': 0.8929668499115774, 'subsample': 0.108582496339734, 'dropout_rate': 0.5788428402769628, 'ccp_alpha': 0.004007939517377788}. Best is trial 317 with value: 0.7815705261705512.[0m
[32m[I 2022-04-14 00:50:04,359][0m Trial 362 finished with value: 0.7815621168568985 and parameters: {'loss': 'coxph', 'learning_rate': 9.804952484708262e-06, 'n_estimators': 912, 'criterion': 'friedman_mse', 'min_samples_split': 9, 'min_samples_leaf': 2, 'min_weight_fraction_leaf': 0.38212741378979387, 'min_impurity_decrease': 0.2954869258965915, 'max_features': 0.8925279249527451, 'subsample': 0.11841836292298744, 'dropout_rate': 0.5806769180867232, 'ccp_alpha': 0.030789756076083637}. Best is trial 317 with value: 0.7815705261705512.[0m
[32m[I 2022-04-14 00:53:32,662][0m Trial 363 finished with value: 0.7801151707464252 and parameters: {'loss': 'coxph', 'learning_rate': 1.020588032126799e-05, 'n_estimators': 919, 'criterion': 'friedman_mse', 'min_samples_split': 9, 'min_samples_leaf': 2, 'min_weight_fraction_leaf': 0.38197126069005943, 'min_impurity_decrease': 0.2959618007123705, 'max_features': 0.8917535282135891, 'subsample': 0.10969443526796295, 'dropout_rate': 0.57736292688708, 'ccp_alpha': 0.08171037669718649}. Best is trial 317 with value: 0.7815705261705512.[0m
[32m[I 2022-04-14 00:57:01,805][0m Trial 364 finished with value: 0.7806162126338805 and parameters: {'loss': 'coxph', 'learning_rate': 9.625417899203329e-06, 'n_estimators': 893, 'criterion': 'friedman_mse', 'min_samples_split': 9, 'min_samples_leaf': 2, 'min_weight_fraction_leaf': 0.3848618406464965, 'min_impurity_decrease': 0.2985646211128599, 'max_features': 0.8836550546041733, 'subsample': 0.11139264687950995, 'dropout_rate': 0.5852076533330277, 'ccp_alpha': 0.02749311895168228}. Best is trial 317 with value: 0.7815705261705512.[0m
[32m[I 2022-04-14 01:00:45,732][0m Trial 365 finished with value: 0.7805204733618515 and parameters: {'loss': 'coxph', 'learning_rate': 9.34598693906634e-06, 'n_estimators': 900, 'criterion': 'friedman_mse', 'min_samples_split': 9, 'min_samples_leaf': 2, 'min_weight_fraction_leaf': 0.38601640378840824, 'min_impurity_decrease': 0.2993622219880889, 'max_features': 0.8996652841192658, 'subsample': 0.11061038256536951, 'dropout_rate': 0.5845859454250675, 'ccp_alpha': 0.0033788291228190005}. Best is trial 317 with value: 0.7815705261705512.[0m
[32m[I 2022-04-14 01:04:30,476][0m Trial 366 finished with value: 0.7811699302327499 and parameters: {'loss': 'coxph', 'learning_rate': 9.048870282579116e-06, 'n_estimators': 895, 'criterion': 'friedman_mse', 'min_samples_split': 9, 'min_samples_leaf': 2, 'min_weight_fraction_leaf': 0.3836915084822056, 'min_impurity_decrease': 0.289568331850808, 'max_features': 0.8983783999720446, 'subsample': 0.11393817157690876, 'dropout_rate': 0.5897734327829853, 'ccp_alpha': 0.0018762313909712804}. Best is trial 317 with value: 0.7815705261705512.[0m
[32m[I 2022-04-14 01:08:26,591][0m Trial 367 finished with value: 0.7817487788378487 and parameters: {'loss': 'coxph', 'learning_rate': 1.0710116710837584e-05, 'n_estimators': 901, 'criterion': 'friedman_mse', 'min_samples_split': 9, 'min_samples_leaf': 2, 'min_weight_fraction_leaf': 0.38729600946779863, 'min_impurity_decrease': 0.2746031704781005, 'max_features': 0.9062154004453044, 'subsample': 0.1182130985093916, 'dropout_rate': 0.578683150678607, 'ccp_alpha': 0.007246137102934176}. Best is trial 367 with value: 0.7817487788378487.[0m
[32m[I 2022-04-14 01:12:22,710][0m Trial 368 finished with value: 0.7811815049490793 and parameters: {'loss': 'coxph', 'learning_rate': 1.0870910794370522e-05, 'n_estimators': 920, 'criterion': 'friedman_mse', 'min_samples_split': 9, 'min_samples_leaf': 2, 'min_weight_fraction_leaf': 0.3855153341599293, 'min_impurity_decrease': 0.2862663201244866, 'max_features': 0.8966466283867627, 'subsample': 0.12089063741193781, 'dropout_rate': 0.5894608071804032, 'ccp_alpha': 0.005547738900602148}. Best is trial 367 with value: 0.7817487788378487.[0m
[32m[I 2022-04-14 01:14:58,337][0m Trial 369 finished with value: -0.36628871640997795 and parameters: {'loss': 'squared', 'learning_rate': 1.1302514120435882e-05, 'n_estimators': 940, 'criterion': 'friedman_mse', 'min_samples_split': 9, 'min_samples_leaf': 2, 'min_weight_fraction_leaf': 0.3881688717858285, 'min_impurity_decrease': 0.28106407524302096, 'max_features': 0.9108815140833268, 'subsample': 0.1271951041727762, 'dropout_rate': 0.599956465881846, 'ccp_alpha': 0.0999582374129047}. Best is trial 367 with value: 0.7817487788378487.[0m
