[32m[I 2022-04-18 10:15:02,498][0m Trial 773 finished with value: 0.7707176295402003 and parameters: {'n_hidden': 256, 'mixture_components': 10, 'use_sparse_layer': True, 'use_sparse_loss': True, 'lmbd': 0.00017907427470064492, 'use_batchnorm': False, 'use_dropout': True, 'dropout': 0.7692644966676705, 'mlp_size_1': 1, 'mlp_size_2': 4, 'mlp_size_3': 0, 'kernel': 'Exponential', 'loss_name': 'AlternativeNLLLoss'}. Best is trial 526 with value: 0.7749738194021545.[0m
[32m[I 2022-04-18 10:17:23,265][0m Trial 774 finished with value: 0.7739531664227852 and parameters: {'n_hidden': 256, 'mixture_components': 10, 'use_sparse_layer': True, 'use_sparse_loss': True, 'lmbd': 5.353434974779402e-05, 'use_batchnorm': False, 'use_dropout': True, 'dropout': 0.7936020324156692, 'mlp_size_1': 1, 'mlp_size_2': 4, 'mlp_size_3': 0, 'kernel': 'Exponential', 'loss_name': 'AlternativeNLLLoss'}. Best is trial 526 with value: 0.7749738194021545.[0m
[32m[I 2022-04-18 10:20:00,708][0m Trial 775 finished with value: 0.7687530159266919 and parameters: {'n_hidden': 256, 'mixture_components': 10, 'use_sparse_layer': True, 'use_sparse_loss': True, 'lmbd': 0.0006183268811158354, 'use_batchnorm': False, 'use_dropout': True, 'dropout': 0.8283448661326732, 'mlp_size_1': 1, 'mlp_size_2': 4, 'mlp_size_3': 0, 'kernel': 'Exponential', 'loss_name': 'AlternativeNLLLoss'}. Best is trial 526 with value: 0.7749738194021545.[0m
[32m[I 2022-04-18 10:23:15,833][0m Trial 776 finished with value: 0.7727482845109882 and parameters: {'n_hidden': 128, 'mixture_components': 10, 'use_sparse_layer': True, 'use_sparse_loss': True, 'lmbd': 2.9742331550947962e-05, 'use_batchnorm': True, 'use_dropout': True, 'dropout': 0.8033041465170899, 'mlp_size_1': 1, 'mlp_size_2': 3, 'mlp_size_3': 0, 'kernel': 'Exponential', 'loss_name': 'AlternativeNLLLoss'}. Best is trial 526 with value: 0.7749738194021545.[0m
[32m[I 2022-04-18 10:25:43,248][0m Trial 777 finished with value: 0.7711307912026942 and parameters: {'n_hidden': 256, 'mixture_components': 10, 'use_sparse_layer': False, 'use_batchnorm': False, 'use_dropout': True, 'dropout': 0.7972613454222702, 'mlp_size_1': 1, 'mlp_size_2': 4, 'mlp_size_3': 0, 'kernel': 'Exponential', 'loss_name': 'AlternativeNLLLoss'}. Best is trial 526 with value: 0.7749738194021545.[0m
[32m[I 2022-04-18 10:27:57,285][0m Trial 778 finished with value: 0.7732261941977445 and parameters: {'n_hidden': 256, 'mixture_components': 10, 'use_sparse_layer': True, 'use_sparse_loss': True, 'lmbd': 0.0013656310546346071, 'use_batchnorm': False, 'use_dropout': True, 'dropout': 0.7578589566877897, 'mlp_size_1': 1, 'mlp_size_2': 4, 'mlp_size_3': 0, 'kernel': 'Exponential', 'loss_name': 'AlternativeNLLLoss'}. Best is trial 526 with value: 0.7749738194021545.[0m
[32m[I 2022-04-18 10:31:18,044][0m Trial 779 finished with value: 0.7593126701939861 and parameters: {'n_hidden': 256, 'mixture_components': 10, 'use_sparse_layer': True, 'use_sparse_loss': True, 'lmbd': 5.822403865199571e-05, 'use_batchnorm': False, 'use_dropout': True, 'dropout': 0.80495418027596, 'mlp_size_1': 1, 'mlp_size_2': 4, 'mlp_size_3': 0, 'kernel': 'Normal', 'loss_name': 'AlternativeNLLLoss'}. Best is trial 526 with value: 0.7749738194021545.[0m
[32m[I 2022-04-18 10:33:56,233][0m Trial 780 finished with value: 0.7607265347655093 and parameters: {'n_hidden': 256, 'mixture_components': 2, 'use_sparse_layer': True, 'use_sparse_loss': True, 'lmbd': 0.002524697877719986, 'use_batchnorm': False, 'use_dropout': True, 'dropout': 0.7653198441338559, 'mlp_size_1': 1, 'mlp_size_2': 4, 'mlp_size_3': 0, 'kernel': 'LogLogistic', 'loss_name': 'AlternativeNLLLoss'}. Best is trial 526 with value: 0.7749738194021545.[0m
[32m[I 2022-04-18 10:35:52,245][0m Trial 781 finished with value: 0.6975931212143689 and parameters: {'n_hidden': 256, 'mixture_components': 3, 'use_sparse_layer': True, 'use_sparse_loss': True, 'lmbd': 8.964376922301429e-05, 'use_batchnorm': False, 'use_dropout': True, 'dropout': 0.8223037843374592, 'mlp_size_1': 1, 'mlp_size_2': 4, 'mlp_size_3': 0, 'kernel': 'Exponential', 'loss_name': 'NLLLoss'}. Best is trial 526 with value: 0.7749738194021545.[0m
[32m[I 2022-04-18 10:38:41,086][0m Trial 782 finished with value: 0.7736234759329073 and parameters: {'n_hidden': 256, 'mixture_components': 10, 'use_sparse_layer': True, 'use_sparse_loss': True, 'lmbd': 0.00047559184877519773, 'use_batchnorm': True, 'use_dropout': True, 'dropout': 0.7454814226152453, 'mlp_size_1': 1, 'mlp_size_2': 4, 'mlp_size_3': 0, 'kernel': 'Exponential', 'loss_name': 'AlternativeNLLLoss'}. Best is trial 526 with value: 0.7749738194021545.[0m
[32m[I 2022-04-18 10:41:10,734][0m Trial 783 finished with value: 0.7637786469882426 and parameters: {'n_hidden': 256, 'mixture_components': 10, 'use_sparse_layer': False, 'use_batchnorm': True, 'use_dropout': True, 'dropout': 0.7788135950917098, 'mlp_size_1': 1, 'mlp_size_2': 4, 'mlp_size_3': 0, 'kernel': 'Exponential', 'loss_name': 'AlternativeNLLLoss'}. Best is trial 526 with value: 0.7749738194021545.[0m
[32m[I 2022-04-18 10:43:33,628][0m Trial 784 finished with value: 0.7270041011322045 and parameters: {'n_hidden': 256, 'mixture_components': 10, 'use_sparse_layer': True, 'use_sparse_loss': True, 'lmbd': 0.0009554411826013584, 'use_batchnorm': True, 'use_dropout': True, 'dropout': 0.7429266448598123, 'mlp_size_1': 1, 'mlp_size_2': 4, 'mlp_size_3': 0, 'kernel': 'Gamma', 'loss_name': 'AlternativeNLLLoss'}. Best is trial 526 with value: 0.7749738194021545.[0m
[32m[I 2022-04-18 10:46:36,180][0m Trial 785 finished with value: 0.7712188094615895 and parameters: {'n_hidden': 256, 'mixture_components': 10, 'use_sparse_layer': True, 'use_sparse_loss': True, 'lmbd': 6.795530403943905e-05, 'use_batchnorm': True, 'use_dropout': True, 'dropout': 0.7744482304508514, 'mlp_size_1': 1, 'mlp_size_2': 4, 'mlp_size_3': 0, 'kernel': 'Exponential', 'loss_name': 'AlternativeNLLLoss'}. Best is trial 526 with value: 0.7749738194021545.[0m
[32m[I 2022-04-18 10:49:33,446][0m Trial 786 finished with value: 0.7727025154635172 and parameters: {'n_hidden': 256, 'mixture_components': 10, 'use_sparse_layer': True, 'use_sparse_loss': True, 'lmbd': 5.125356829649748e-05, 'use_batchnorm': True, 'use_dropout': True, 'dropout': 0.7515807043930992, 'mlp_size_1': 1, 'mlp_size_2': 4, 'mlp_size_3': 0, 'kernel': 'Exponential', 'loss_name': 'AlternativeNLLLoss'}. Best is trial 526 with value: 0.7749738194021545.[0m
[32m[I 2022-04-18 10:51:15,833][0m Trial 787 finished with value: -0.661536289626129 and parameters: {'n_hidden': 256, 'mixture_components': 10, 'use_sparse_layer': True, 'use_sparse_loss': True, 'lmbd': 0.0004646666227669574, 'use_batchnorm': True, 'use_dropout': False, 'mlp_size_1': 1, 'mlp_size_2': 4, 'mlp_size_3': 0, 'kernel': 'Gumbel', 'loss_name': 'AlternativeNLLLoss'}. Best is trial 526 with value: 0.7749738194021545.[0m
[32m[I 2022-04-18 10:54:06,737][0m Trial 788 finished with value: 0.771061782879887 and parameters: {'n_hidden': 256, 'mixture_components': 10, 'use_sparse_layer': True, 'use_sparse_loss': True, 'lmbd': 0.0039590981400419506, 'use_batchnorm': True, 'use_dropout': True, 'dropout': 0.7878439749739867, 'mlp_size_1': 1, 'mlp_size_2': 4, 'mlp_size_3': 0, 'kernel': 'Exponential', 'loss_name': 'AlternativeNLLLoss'}. Best is trial 526 with value: 0.7749738194021545.[0m
[32m[I 2022-04-18 10:57:05,687][0m Trial 789 finished with value: 0.7717565843772898 and parameters: {'n_hidden': 256, 'mixture_components': 10, 'use_sparse_layer': True, 'use_sparse_loss': True, 'lmbd': 0.00023056958687987447, 'use_batchnorm': True, 'use_dropout': True, 'dropout': 0.755043341904319, 'mlp_size_1': 1, 'mlp_size_2': 4, 'mlp_size_3': 0, 'kernel': 'Exponential', 'loss_name': 'AlternativeNLLLoss'}. Best is trial 526 with value: 0.7749738194021545.[0m
[32m[I 2022-04-18 10:59:56,920][0m Trial 790 finished with value: 0.7681182867163205 and parameters: {'n_hidden': 256, 'mixture_components': 10, 'use_sparse_layer': False, 'use_batchnorm': True, 'use_dropout': True, 'dropout': 0.734063754725408, 'mlp_size_1': 1, 'mlp_size_2': 4, 'mlp_size_3': 0, 'kernel': 'Exponential', 'loss_name': 'CensoredNLLLoss'}. Best is trial 526 with value: 0.7749738194021545.[0m
[32m[I 2022-04-18 11:02:44,292][0m Trial 791 finished with value: 0.7693762378018302 and parameters: {'n_hidden': 256, 'mixture_components': 8, 'use_sparse_layer': True, 'use_sparse_loss': True, 'lmbd': 0.0007865227394619002, 'use_batchnorm': True, 'use_dropout': True, 'dropout': 0.7706007863946657, 'mlp_size_1': 1, 'mlp_size_2': 4, 'mlp_size_3': 0, 'kernel': 'Exponential', 'loss_name': 'AlternativeNLLLoss'}. Best is trial 526 with value: 0.7749738194021545.[0m
[32m[I 2022-04-18 11:05:13,099][0m Trial 792 finished with value: 0.7665415132692616 and parameters: {'n_hidden': 256, 'mixture_components': 10, 'use_sparse_layer': True, 'use_sparse_loss': True, 'lmbd': 0.0001491409627160933, 'use_batchnorm': True, 'use_dropout': True, 'dropout': 0.7982807857188191, 'mlp_size_1': 1, 'mlp_size_2': 4, 'mlp_size_3': 0, 'kernel': 'Exponential', 'loss_name': 'AlternativeNLLLoss'}. Best is trial 526 with value: 0.7749738194021545.[0m
[32m[I 2022-04-18 11:09:45,826][0m Trial 793 finished with value: 0.7554246300137625 and parameters: {'n_hidden': 32, 'mixture_components': 10, 'use_sparse_layer': True, 'use_sparse_loss': True, 'lmbd': 1.313339192480067e-05, 'use_batchnorm': True, 'use_dropout': True, 'dropout': 0.740169318030992, 'mlp_size_1': 1, 'mlp_size_2': 1, 'mlp_size_3': 0, 'kernel': 'Exponential', 'loss_name': 'CensoredNLLLoss'}. Best is trial 526 with value: 0.7749738194021545.[0m
[32m[I 2022-04-18 11:14:32,220][0m Trial 794 finished with value: 0.7374333976566042 and parameters: {'n_hidden': 256, 'mixture_components': 10, 'use_sparse_layer': True, 'use_sparse_loss': True, 'lmbd': 7.483233223006192e-06, 'use_batchnorm': True, 'use_dropout': True, 'dropout': 0.7576655337602086, 'mlp_size_1': 1, 'mlp_size_2': 4, 'mlp_size_3': 0, 'kernel': 'Weibull', 'loss_name': 'AlternativeNLLLoss'}. Best is trial 526 with value: 0.7749738194021545.[0m
[32m[I 2022-04-18 11:17:14,042][0m Trial 795 finished with value: 0.7546830901505107 and parameters: {'n_hidden': 256, 'mixture_components': 10, 'use_sparse_layer': True, 'use_sparse_loss': True, 'lmbd': 0.00037616566160873267, 'use_batchnorm': True, 'use_dropout': True, 'dropout': 0.8245958590878689, 'mlp_size_1': 1, 'mlp_size_2': 4, 'mlp_size_3': 0, 'kernel': 'Exponential', 'loss_name': 'CensoredNLLLoss'}. Best is trial 526 with value: 0.7749738194021545.[0m
[32m[I 2022-04-18 11:21:20,027][0m Trial 796 finished with value: 0.7672448095187951 and parameters: {'n_hidden': 256, 'mixture_components': 10, 'use_sparse_layer': False, 'use_batchnorm': True, 'use_dropout': True, 'dropout': 0.7236076955820843, 'mlp_size_1': 1, 'mlp_size_2': 4, 'mlp_size_3': 0, 'kernel': 'LogNormal', 'loss_name': 'AlternativeNLLLoss'}. Best is trial 526 with value: 0.7749738194021545.[0m
[32m[I 2022-04-18 11:24:11,696][0m Trial 797 finished with value: 0.761166397852441 and parameters: {'n_hidden': 2048, 'mixture_components': 10, 'use_sparse_layer': True, 'use_sparse_loss': True, 'lmbd': 3.94801863269235e-05, 'use_batchnorm': True, 'use_dropout': True, 'dropout': 0.7422004273032335, 'mlp_size_1': 5, 'mlp_size_2': 3, 'mlp_size_3': 0, 'kernel': 'Exponential', 'loss_name': 'AlternativeNLLLoss'}. Best is trial 526 with value: 0.7749738194021545.[0m
[32m[I 2022-04-18 11:27:16,893][0m Trial 798 finished with value: 0.6983296285985993 and parameters: {'n_hidden': 256, 'mixture_components': 10, 'use_sparse_layer': True, 'use_sparse_loss': True, 'lmbd': 2.4211248908772634e-05, 'use_batchnorm': True, 'use_dropout': True, 'dropout': 0.785853959909515, 'mlp_size_1': 1, 'mlp_size_2': 4, 'mlp_size_3': 0, 'kernel': 'Exponential', 'loss_name': 'NLLLoss'}. Best is trial 526 with value: 0.7749738194021545.[0m
[32m[I 2022-04-18 11:30:18,121][0m Trial 799 finished with value: 0.770235033353894 and parameters: {'n_hidden': 256, 'mixture_components': 10, 'use_sparse_layer': True, 'use_sparse_loss': True, 'lmbd': 0.00010491574875260215, 'use_batchnorm': True, 'use_dropout': True, 'dropout': 0.7160219123216022, 'mlp_size_1': 1, 'mlp_size_2': 4, 'mlp_size_3': 0, 'kernel': 'Exponential', 'loss_name': 'CensoredNLLLoss'}. Best is trial 526 with value: 0.7749738194021545.[0m
[32m[I 2022-04-18 11:33:10,858][0m Trial 800 finished with value: 0.7740201542521934 and parameters: {'n_hidden': 256, 'mixture_components': 10, 'use_sparse_layer': True, 'use_sparse_loss': True, 'lmbd': 1.6723028418677844e-05, 'use_batchnorm': True, 'use_dropout': True, 'dropout': 0.7659656055395837, 'mlp_size_1': 1, 'mlp_size_2': 4, 'mlp_size_3': 0, 'kernel': 'Exponential', 'loss_name': 'AlternativeNLLLoss'}. Best is trial 526 with value: 0.7749738194021545.[0m
[32m[I 2022-04-18 11:36:06,951][0m Trial 801 finished with value: 0.7738653421842103 and parameters: {'n_hidden': 256, 'mixture_components': 10, 'use_sparse_layer': True, 'use_sparse_loss': True, 'lmbd': 1.8191840522293136e-05, 'use_batchnorm': True, 'use_dropout': True, 'dropout': 0.7489619000997636, 'mlp_size_1': 1, 'mlp_size_2': 4, 'mlp_size_3': 0, 'kernel': 'Exponential', 'loss_name': 'CensoredNLLLoss'}. Best is trial 526 with value: 0.7749738194021545.[0m
[32m[I 2022-04-18 11:40:03,663][0m Trial 802 finished with value: 0.7573220213753848 and parameters: {'n_hidden': 128, 'mixture_components': 10, 'use_sparse_layer': True, 'use_sparse_loss': True, 'lmbd': 3.622671126195424e-06, 'use_batchnorm': True, 'use_dropout': True, 'dropout': 0.39594304370022226, 'mlp_size_1': 1, 'mlp_size_2': 3, 'mlp_size_3': 0, 'kernel': 'Logistic', 'loss_name': 'AlternativeNLLLoss'}. Best is trial 526 with value: 0.7749738194021545.[0m
[32m[I 2022-04-18 11:42:45,758][0m Trial 803 finished with value: 0.7517002226762862 and parameters: {'n_hidden': 256, 'mixture_components': 10, 'use_sparse_layer': False, 'use_batchnorm': True, 'use_dropout': True, 'dropout': 0.25145005137908977, 'mlp_size_1': 1, 'mlp_size_2': 4, 'mlp_size_3': 0, 'kernel': 'Exponential', 'loss_name': 'CensoredNLLLoss'}. Best is trial 526 with value: 0.7749738194021545.[0m
[32m[I 2022-04-18 11:45:43,973][0m Trial 804 finished with value: 0.7740830476038278 and parameters: {'n_hidden': 256, 'mixture_components': 10, 'use_sparse_layer': True, 'use_sparse_loss': True, 'lmbd': 1.6504623279425338e-05, 'use_batchnorm': True, 'use_dropout': True, 'dropout': 0.7351902595024681, 'mlp_size_1': 1, 'mlp_size_2': 4, 'mlp_size_3': 0, 'kernel': 'Exponential', 'loss_name': 'AlternativeNLLLoss'}. Best is trial 526 with value: 0.7749738194021545.[0m
[32m[I 2022-04-18 11:48:38,304][0m Trial 805 finished with value: 0.7757843994873024 and parameters: {'n_hidden': 256, 'mixture_components': 10, 'use_sparse_layer': True, 'use_sparse_loss': True, 'lmbd': 1.7285913762664893e-05, 'use_batchnorm': True, 'use_dropout': True, 'dropout': 0.7513041929317823, 'mlp_size_1': 1, 'mlp_size_2': 4, 'mlp_size_3': 0, 'kernel': 'Exponential', 'loss_name': 'AlternativeNLLLoss'}. Best is trial 805 with value: 0.7757843994873024.[0m
[32m[I 2022-04-18 11:51:44,734][0m Trial 806 finished with value: 0.7763959235339837 and parameters: {'n_hidden': 256, 'mixture_components': 10, 'use_sparse_layer': True, 'use_sparse_loss': True, 'lmbd': 9.10001053399141e-06, 'use_batchnorm': True, 'use_dropout': True, 'dropout': 0.7607666920803298, 'mlp_size_1': 1, 'mlp_size_2': 4, 'mlp_size_3': 0, 'kernel': 'Exponential', 'loss_name': 'AlternativeNLLLoss'}. Best is trial 806 with value: 0.7763959235339837.[0m
[32m[I 2022-04-18 11:54:27,560][0m Trial 807 finished with value: 0.7507104682258547 and parameters: {'n_hidden': 256, 'mixture_components': 10, 'use_sparse_layer': True, 'use_sparse_loss': True, 'lmbd': 8.9751319600257e-06, 'use_batchnorm': True, 'use_dropout': False, 'mlp_size_1': 1, 'mlp_size_2': 4, 'mlp_size_3': 0, 'kernel': 'Exponential', 'loss_name': 'AlternativeNLLLoss'}. Best is trial 806 with value: 0.7763959235339837.[0m
[32m[I 2022-04-18 11:57:23,378][0m Trial 808 finished with value: 0.7724562271785211 and parameters: {'n_hidden': 256, 'mixture_components': 10, 'use_sparse_layer': True, 'use_sparse_loss': True, 'lmbd': 1.7922313655720492e-05, 'use_batchnorm': True, 'use_dropout': True, 'dropout': 0.7649170612719477, 'mlp_size_1': 1, 'mlp_size_2': 4, 'mlp_size_3': 0, 'kernel': 'Exponential', 'loss_name': 'AlternativeNLLLoss'}. Best is trial 806 with value: 0.7763959235339837.[0m
[32m[I 2022-04-18 12:02:43,239][0m Trial 809 finished with value: 0.7104452537526239 and parameters: {'n_hidden': 256, 'mixture_components': 10, 'use_sparse_layer': True, 'use_sparse_loss': True, 'lmbd': 1.1492913864488775e-05, 'use_batchnorm': True, 'use_dropout': True, 'dropout': 0.7606578726352895, 'mlp_size_1': 1, 'mlp_size_2': 4, 'mlp_size_3': 0, 'kernel': 'Normal', 'loss_name': 'AlternativeNLLLoss'}. Best is trial 806 with value: 0.7763959235339837.[0m
[32m[I 2022-04-18 12:05:35,130][0m Trial 810 finished with value: 0.7671026912573169 and parameters: {'n_hidden': 256, 'mixture_components': 10, 'use_sparse_layer': True, 'use_sparse_loss': True, 'lmbd': 5.089983842516129e-06, 'use_batchnorm': True, 'use_dropout': True, 'dropout': 0.7514559491878666, 'mlp_size_1': 1, 'mlp_size_2': 4, 'mlp_size_3': 0, 'kernel': 'Exponential', 'loss_name': 'AlternativeNLLLoss'}. Best is trial 806 with value: 0.7763959235339837.[0m
[32m[I 2022-04-18 12:11:01,835][0m Trial 811 finished with value: 0.7134368386498844 and parameters: {'n_hidden': 256, 'mixture_components': 10, 'use_sparse_layer': True, 'use_sparse_loss': True, 'lmbd': 7.4689885187627515e-06, 'use_batchnorm': True, 'use_dropout': True, 'dropout': 0.7734342900330942, 'mlp_size_1': 1, 'mlp_size_2': 4, 'mlp_size_3': 0, 'kernel': 'LogLogistic', 'loss_name': 'AlternativeNLLLoss'}. Best is trial 806 with value: 0.7763959235339837.[0m
[32m[I 2022-04-18 12:13:35,884][0m Trial 812 finished with value: 0.7725518374663384 and parameters: {'n_hidden': 256, 'mixture_components': 10, 'use_sparse_layer': True, 'use_sparse_loss': True, 'lmbd': 2.0847731871837164e-05, 'use_batchnorm': True, 'use_dropout': True, 'dropout': 0.7551852154231989, 'mlp_size_1': 1, 'mlp_size_2': 4, 'mlp_size_3': 0, 'kernel': 'Exponential', 'loss_name': 'AlternativeNLLLoss'}. Best is trial 806 with value: 0.7763959235339837.[0m
[32m[I 2022-04-18 12:16:35,696][0m Trial 813 finished with value: 0.7709226831294382 and parameters: {'n_hidden': 256, 'mixture_components': 10, 'use_sparse_layer': True, 'use_sparse_loss': True, 'lmbd': 1.570692155639781e-05, 'use_batchnorm': True, 'use_dropout': True, 'dropout': 0.7470332738938558, 'mlp_size_1': 1, 'mlp_size_2': 4, 'mlp_size_3': 0, 'kernel': 'Exponential', 'loss_name': 'AlternativeNLLLoss'}. Best is trial 806 with value: 0.7763959235339837.[0m
[32m[I 2022-04-18 12:18:43,246][0m Trial 814 finished with value: 0.714551246523812 and parameters: {'n_hidden': 256, 'mixture_components': 10, 'use_sparse_layer': True, 'use_sparse_loss': True, 'lmbd': 2.8143764141424732e-05, 'use_batchnorm': True, 'use_dropout': True, 'dropout': 0.7658452204124464, 'mlp_size_1': 1, 'mlp_size_2': 4, 'mlp_size_3': 0, 'kernel': 'Gamma', 'loss_name': 'AlternativeNLLLoss'}. Best is trial 806 with value: 0.7763959235339837.[0m
[32m[I 2022-04-18 12:21:31,884][0m Trial 815 finished with value: 0.7621675554449376 and parameters: {'n_hidden': 256, 'mixture_components': 10, 'use_sparse_layer': True, 'use_sparse_loss': True, 'lmbd': 1.1608821414508555e-05, 'use_batchnorm': True, 'use_dropout': True, 'dropout': 0.7760786132040939, 'mlp_size_1': 1, 'mlp_size_2': 4, 'mlp_size_3': 0, 'kernel': 'Exponential', 'loss_name': 'AlternativeNLLLoss'}. Best is trial 806 with value: 0.7763959235339837.[0m
[32m[I 2022-04-18 12:24:15,755][0m Trial 816 finished with value: 0.7695931374868201 and parameters: {'n_hidden': 256, 'mixture_components': 10, 'use_sparse_layer': True, 'use_sparse_loss': True, 'lmbd': 6.087870207120407e-06, 'use_batchnorm': True, 'use_dropout': True, 'dropout': 0.7426482309704822, 'mlp_size_1': 1, 'mlp_size_2': 4, 'mlp_size_3': 0, 'kernel': 'Exponential', 'loss_name': 'AlternativeNLLLoss'}. Best is trial 806 with value: 0.7763959235339837.[0m
[32m[I 2022-04-18 12:27:16,347][0m Trial 817 finished with value: 0.7703626337812313 and parameters: {'n_hidden': 256, 'mixture_components': 10, 'use_sparse_layer': True, 'use_sparse_loss': True, 'lmbd': 4.620544771800416e-06, 'use_batchnorm': True, 'use_dropout': True, 'dropout': 0.7364252608016096, 'mlp_size_1': 1, 'mlp_size_2': 4, 'mlp_size_3': 0, 'kernel': 'Exponential', 'loss_name': 'AlternativeNLLLoss'}. Best is trial 806 with value: 0.7763959235339837.[0m
[32m[I 2022-04-18 12:30:10,749][0m Trial 818 finished with value: 0.7710931596518029 and parameters: {'n_hidden': 256, 'mixture_components': 10, 'use_sparse_layer': True, 'use_sparse_loss': True, 'lmbd': 9.059940994981899e-06, 'use_batchnorm': True, 'use_dropout': True, 'dropout': 0.7715604729230838, 'mlp_size_1': 1, 'mlp_size_2': 4, 'mlp_size_3': 0, 'kernel': 'Exponential', 'loss_name': 'AlternativeNLLLoss'}. Best is trial 806 with value: 0.7763959235339837.[0m
[32m[I 2022-04-18 12:33:13,701][0m Trial 819 finished with value: 0.7749476510454608 and parameters: {'n_hidden': 256, 'mixture_components': 10, 'use_sparse_layer': True, 'use_sparse_loss': True, 'lmbd': 3.448904720087204e-05, 'use_batchnorm': True, 'use_dropout': True, 'dropout': 0.7298439529439922, 'mlp_size_1': 1, 'mlp_size_2': 4, 'mlp_size_3': 0, 'kernel': 'Exponential', 'loss_name': 'AlternativeNLLLoss'}. Best is trial 806 with value: 0.7763959235339837.[0m
