[32m[I 2022-04-13 12:08:04,587][0m Trial 872 finished with value: 0.88170908167111 and parameters: {'splitter': 'best', 'min_samples_split': 0.14204994455799236, 'min_samples_leaf': 0.03363102362135487, 'min_weight_fraction_leaf': 0.009712114837602207, 'max_features': 0.9696743755834852}. Best is trial 448 with value: 0.8888507593246218.[0m
/media/san2_ssd/data/Workdir/survival/utils.py:305: RuntimeWarning: invalid value encountered in true_divide
  pdfs = np.gradient(1-survs,axis=1)/norms
/media/san2_ssd/data/Workdir/survival/utils.py:305: RuntimeWarning: invalid value encountered in true_divide
  pdfs = np.gradient(1-survs,axis=1)/norms
/media/san2_ssd/data/Workdir/survival/utils.py:305: RuntimeWarning: invalid value encountered in true_divide
  pdfs = np.gradient(1-survs,axis=1)/norms
/media/san2_ssd/data/Workdir/survival/utils.py:305: RuntimeWarning: invalid value encountered in true_divide
  pdfs = np.gradient(1-survs,axis=1)/norms
[32m[I 2022-04-13 12:08:06,673][0m Trial 873 finished with value: 0.8876464825002224 and parameters: {'splitter': 'best', 'min_samples_split': 0.08866502699724563, 'min_samples_leaf': 0.04495075364562894, 'min_weight_fraction_leaf': 0.022110902115851885, 'max_features': 0.9999275907761422}. Best is trial 448 with value: 0.8888507593246218.[0m
[32m[I 2022-04-13 12:08:07,243][0m Trial 874 finished with value: 0.5371812073302544 and parameters: {'splitter': 'best', 'min_samples_split': 0.06838594272708644, 'min_samples_leaf': 0.31651609815166054, 'min_weight_fraction_leaf': 0.01853777370073344, 'max_features': 0.9819404261637247}. Best is trial 448 with value: 0.8888507593246218.[0m
[32m[I 2022-04-13 12:08:08,491][0m Trial 875 finished with value: 0.5371812073302544 and parameters: {'splitter': 'best', 'min_samples_split': 0.06975972154422969, 'min_samples_leaf': 0.07164971605427319, 'min_weight_fraction_leaf': 0.3493734320469125, 'max_features': 0.9997798118298845}. Best is trial 448 with value: 0.8888507593246218.[0m
/media/san2_ssd/data/Workdir/survival/utils.py:305: RuntimeWarning: invalid value encountered in true_divide
  pdfs = np.gradient(1-survs,axis=1)/norms
[32m[I 2022-04-13 12:08:10,444][0m Trial 876 finished with value: 0.8857694580205372 and parameters: {'splitter': 'best', 'min_samples_split': 0.0868042530095967, 'min_samples_leaf': 0.060932507894434385, 'min_weight_fraction_leaf': 0.007042601805531635, 'max_features': 0.9793519890944925}. Best is trial 448 with value: 0.8888507593246218.[0m
/media/san2_ssd/data/Workdir/survival/utils.py:305: RuntimeWarning: invalid value encountered in true_divide
  pdfs = np.gradient(1-survs,axis=1)/norms
/media/san2_ssd/data/Workdir/survival/utils.py:305: RuntimeWarning: invalid value encountered in true_divide
  pdfs = np.gradient(1-survs,axis=1)/norms
/media/san2_ssd/data/Workdir/survival/utils.py:305: RuntimeWarning: invalid value encountered in true_divide
  pdfs = np.gradient(1-survs,axis=1)/norms
[32m[I 2022-04-13 12:08:12,731][0m Trial 877 finished with value: 0.8837105019180342 and parameters: {'splitter': 'best', 'min_samples_split': 0.08095560963482348, 'min_samples_leaf': 0.05076236362032681, 'min_weight_fraction_leaf': 0.013828818375979287, 'max_features': 0.9544102280349696}. Best is trial 448 with value: 0.8888507593246218.[0m
[32m[I 2022-04-13 12:08:14,828][0m Trial 878 finished with value: 0.8831844130841933 and parameters: {'splitter': 'best', 'min_samples_split': 0.0584808213683747, 'min_samples_leaf': 0.06587262382958181, 'min_weight_fraction_leaf': 0.0220662837485451, 'max_features': 0.9854515073809208}. Best is trial 448 with value: 0.8888507593246218.[0m
/media/san2_ssd/data/Workdir/survival/utils.py:305: RuntimeWarning: invalid value encountered in true_divide
  pdfs = np.gradient(1-survs,axis=1)/norms
/media/san2_ssd/data/Workdir/survival/utils.py:305: RuntimeWarning: invalid value encountered in true_divide
  pdfs = np.gradient(1-survs,axis=1)/norms
/media/san2_ssd/data/Workdir/survival/utils.py:305: RuntimeWarning: invalid value encountered in true_divide
  pdfs = np.gradient(1-survs,axis=1)/norms
/media/san2_ssd/data/Workdir/survival/utils.py:305: RuntimeWarning: invalid value encountered in true_divide
  pdfs = np.gradient(1-survs,axis=1)/norms
[32m[I 2022-04-13 12:08:17,204][0m Trial 879 finished with value: 0.8876464825002224 and parameters: {'splitter': 'best', 'min_samples_split': 0.08395298474934393, 'min_samples_leaf': 0.045178302665700665, 'min_weight_fraction_leaf': 0.009645247369431668, 'max_features': 0.9989665208045188}. Best is trial 448 with value: 0.8888507593246218.[0m
/media/san2_ssd/data/Workdir/survival/utils.py:305: RuntimeWarning: invalid value encountered in true_divide
  pdfs = np.gradient(1-survs,axis=1)/norms
/media/san2_ssd/data/Workdir/survival/utils.py:305: RuntimeWarning: invalid value encountered in true_divide
  pdfs = np.gradient(1-survs,axis=1)/norms
[32m[I 2022-04-13 12:08:20,241][0m Trial 880 finished with value: 0.8850423837363179 and parameters: {'splitter': 'best', 'min_samples_split': 0.07444821052527426, 'min_samples_leaf': 0.05675140606918305, 'min_weight_fraction_leaf': 0.0027123924689780865, 'max_features': 0.9978248310271817}. Best is trial 448 with value: 0.8888507593246218.[0m
[32m[I 2022-04-13 12:08:21,889][0m Trial 881 finished with value: 0.8840445658458073 and parameters: {'splitter': 'best', 'min_samples_split': 0.0879925069817478, 'min_samples_leaf': 0.06890564650434952, 'min_weight_fraction_leaf': 0.0068355346889566355, 'max_features': 0.9995830361695874}. Best is trial 448 with value: 0.8888507593246218.[0m
[32m[I 2022-04-13 12:08:22,806][0m Trial 882 finished with value: 0.7130663967776387 and parameters: {'splitter': 'best', 'min_samples_split': 0.07861388047358163, 'min_samples_leaf': 0.07962374217402393, 'min_weight_fraction_leaf': 0.006553893173354839, 'max_features': 0.16580766666858743}. Best is trial 448 with value: 0.8888507593246218.[0m
/media/san2_ssd/data/Workdir/survival/utils.py:305: RuntimeWarning: invalid value encountered in true_divide
  pdfs = np.gradient(1-survs,axis=1)/norms
/media/san2_ssd/data/Workdir/survival/utils.py:305: RuntimeWarning: invalid value encountered in true_divide
  pdfs = np.gradient(1-survs,axis=1)/norms
/media/san2_ssd/data/Workdir/survival/utils.py:305: RuntimeWarning: invalid value encountered in true_divide
  pdfs = np.gradient(1-survs,axis=1)/norms
[32m[I 2022-04-13 12:08:24,154][0m Trial 883 finished with value: 0.8854132300742528 and parameters: {'splitter': 'best', 'min_samples_split': 0.05891006187980266, 'min_samples_leaf': 0.050549338510836775, 'min_weight_fraction_leaf': 0.012845137920905986, 'max_features': 0.9988726120392416}. Best is trial 448 with value: 0.8888507593246218.[0m
/media/san2_ssd/data/Workdir/survival/utils.py:305: RuntimeWarning: invalid value encountered in true_divide
  pdfs = np.gradient(1-survs,axis=1)/norms
/media/san2_ssd/data/Workdir/survival/utils.py:305: RuntimeWarning: invalid value encountered in true_divide
  pdfs = np.gradient(1-survs,axis=1)/norms
/media/san2_ssd/data/Workdir/survival/utils.py:305: RuntimeWarning: invalid value encountered in true_divide
  pdfs = np.gradient(1-survs,axis=1)/norms
[32m[I 2022-04-13 12:08:25,005][0m Trial 884 finished with value: 0.882788608758065 and parameters: {'splitter': 'best', 'min_samples_split': 0.07958071177360278, 'min_samples_leaf': 0.056351212248259765, 'min_weight_fraction_leaf': 0.014422333665356167, 'max_features': 0.9670543449593548}. Best is trial 448 with value: 0.8888507593246218.[0m
/media/san2_ssd/data/Workdir/survival/utils.py:305: RuntimeWarning: invalid value encountered in true_divide
  pdfs = np.gradient(1-survs,axis=1)/norms
/media/san2_ssd/data/Workdir/survival/utils.py:305: RuntimeWarning: invalid value encountered in true_divide
  pdfs = np.gradient(1-survs,axis=1)/norms
/media/san2_ssd/data/Workdir/survival/utils.py:305: RuntimeWarning: invalid value encountered in true_divide
  pdfs = np.gradient(1-survs,axis=1)/norms
/media/san2_ssd/data/Workdir/survival/utils.py:305: RuntimeWarning: invalid value encountered in true_divide
  pdfs = np.gradient(1-survs,axis=1)/norms
[32m[I 2022-04-13 12:08:26,006][0m Trial 885 finished with value: 0.8888216243073682 and parameters: {'splitter': 'best', 'min_samples_split': 0.06656874724255746, 'min_samples_leaf': 0.04413432628015367, 'min_weight_fraction_leaf': 0.011169069316549131, 'max_features': 0.9812865662046002}. Best is trial 448 with value: 0.8888507593246218.[0m
[32m[I 2022-04-13 12:08:28,115][0m Trial 886 finished with value: 0.8839356259001849 and parameters: {'splitter': 'best', 'min_samples_split': 0.042807752283353415, 'min_samples_leaf': 0.06606860097077707, 'min_weight_fraction_leaf': 0.0062194402361863115, 'max_features': 0.9345139753692342}. Best is trial 448 with value: 0.8888507593246218.[0m
/media/san2_ssd/data/Workdir/survival/utils.py:305: RuntimeWarning: invalid value encountered in true_divide
  pdfs = np.gradient(1-survs,axis=1)/norms
/media/san2_ssd/data/Workdir/survival/utils.py:305: RuntimeWarning: invalid value encountered in true_divide
  pdfs = np.gradient(1-survs,axis=1)/norms
/media/san2_ssd/data/Workdir/survival/utils.py:305: RuntimeWarning: invalid value encountered in true_divide
  pdfs = np.gradient(1-survs,axis=1)/norms
[32m[I 2022-04-13 12:08:30,499][0m Trial 887 finished with value: 0.8859062329891259 and parameters: {'splitter': 'best', 'min_samples_split': 0.05397620842784142, 'min_samples_leaf': 0.04750324539947452, 'min_weight_fraction_leaf': 0.008342168795694205, 'max_features': 0.9828021166268328}. Best is trial 448 with value: 0.8888507593246218.[0m
/media/san2_ssd/data/Workdir/survival/utils.py:305: RuntimeWarning: invalid value encountered in true_divide
  pdfs = np.gradient(1-survs,axis=1)/norms
/media/san2_ssd/data/Workdir/survival/utils.py:305: RuntimeWarning: invalid value encountered in true_divide
  pdfs = np.gradient(1-survs,axis=1)/norms
/media/san2_ssd/data/Workdir/survival/utils.py:305: RuntimeWarning: invalid value encountered in true_divide
  pdfs = np.gradient(1-survs,axis=1)/norms
[32m[I 2022-04-13 12:08:33,291][0m Trial 888 finished with value: 0.8825859714646638 and parameters: {'splitter': 'best', 'min_samples_split': 0.05976312115843536, 'min_samples_leaf': 0.0590836138566756, 'min_weight_fraction_leaf': 0.002947350550689558, 'max_features': 0.9653756620086784}. Best is trial 448 with value: 0.8888507593246218.[0m
/media/san2_ssd/data/Workdir/survival/utils.py:305: RuntimeWarning: invalid value encountered in true_divide
  pdfs = np.gradient(1-survs,axis=1)/norms
/media/san2_ssd/data/Workdir/survival/utils.py:305: RuntimeWarning: invalid value encountered in true_divide
  pdfs = np.gradient(1-survs,axis=1)/norms
/media/san2_ssd/data/Workdir/survival/utils.py:305: RuntimeWarning: invalid value encountered in true_divide
  pdfs = np.gradient(1-survs,axis=1)/norms
[32m[I 2022-04-13 12:08:35,016][0m Trial 889 finished with value: 0.8859062329891259 and parameters: {'splitter': 'best', 'min_samples_split': 0.0657887237296157, 'min_samples_leaf': 0.047223003470783016, 'min_weight_fraction_leaf': 0.015314198414745885, 'max_features': 0.9839631258662906}. Best is trial 448 with value: 0.8888507593246218.[0m
/media/san2_ssd/data/Workdir/survival/utils.py:305: RuntimeWarning: invalid value encountered in true_divide
  pdfs = np.gradient(1-survs,axis=1)/norms
/media/san2_ssd/data/Workdir/survival/utils.py:305: RuntimeWarning: invalid value encountered in true_divide
  pdfs = np.gradient(1-survs,axis=1)/norms
/media/san2_ssd/data/Workdir/survival/utils.py:305: RuntimeWarning: invalid value encountered in true_divide
  pdfs = np.gradient(1-survs,axis=1)/norms
/media/san2_ssd/data/Workdir/survival/utils.py:305: RuntimeWarning: invalid value encountered in true_divide
  pdfs = np.gradient(1-survs,axis=1)/norms
/media/san2_ssd/data/Workdir/survival/utils.py:305: RuntimeWarning: invalid value encountered in true_divide
  pdfs = np.gradient(1-survs,axis=1)/norms
[32m[I 2022-04-13 12:08:36,055][0m Trial 890 finished with value: 0.8831582110142913 and parameters: {'splitter': 'best', 'min_samples_split': 0.0640857614665438, 'min_samples_leaf': 0.043948293021579765, 'min_weight_fraction_leaf': 0.011051788917722787, 'max_features': 0.9485933490611278}. Best is trial 448 with value: 0.8888507593246218.[0m
[32m[I 2022-04-13 12:08:36,222][0m Trial 891 finished with value: 0.7799834887924101 and parameters: {'splitter': 'random', 'min_samples_split': 0.053005421869919855, 'min_samples_leaf': 0.05258623294171242, 'min_weight_fraction_leaf': 0.018028905009622936, 'max_features': 0.9670195672625095}. Best is trial 448 with value: 0.8888507593246218.[0m
[32m[I 2022-04-13 12:08:38,543][0m Trial 892 finished with value: 0.7857568027488551 and parameters: {'splitter': 'best', 'min_samples_split': 0.04596960298501537, 'min_samples_leaf': 0.07357196669401422, 'min_weight_fraction_leaf': 0.0012838573870801867, 'max_features': 0.9992335448333457}. Best is trial 448 with value: 0.8888507593246218.[0m
/media/san2_ssd/data/Workdir/survival/utils.py:305: RuntimeWarning: invalid value encountered in true_divide
  pdfs = np.gradient(1-survs,axis=1)/norms
[32m[I 2022-04-13 12:08:40,338][0m Trial 893 finished with value: 0.8857731545091931 and parameters: {'splitter': 'best', 'min_samples_split': 0.07299943115297162, 'min_samples_leaf': 0.06179296089880546, 'min_weight_fraction_leaf': 0.01961282161347474, 'max_features': 0.9807874160461114}. Best is trial 448 with value: 0.8888507593246218.[0m
/media/san2_ssd/data/Workdir/survival/utils.py:305: RuntimeWarning: invalid value encountered in true_divide
  pdfs = np.gradient(1-survs,axis=1)/norms
/media/san2_ssd/data/Workdir/survival/utils.py:305: RuntimeWarning: invalid value encountered in true_divide
  pdfs = np.gradient(1-survs,axis=1)/norms
/media/san2_ssd/data/Workdir/survival/utils.py:305: RuntimeWarning: invalid value encountered in true_divide
  pdfs = np.gradient(1-survs,axis=1)/norms
/media/san2_ssd/data/Workdir/survival/utils.py:305: RuntimeWarning: invalid value encountered in true_divide
  pdfs = np.gradient(1-survs,axis=1)/norms
/media/san2_ssd/data/Workdir/survival/utils.py:305: RuntimeWarning: invalid value encountered in true_divide
  pdfs = np.gradient(1-survs,axis=1)/norms
[32m[I 2022-04-13 12:08:41,589][0m Trial 894 finished with value: 0.8828776838339809 and parameters: {'splitter': 'best', 'min_samples_split': 0.07857635464037614, 'min_samples_leaf': 0.043138625597152376, 'min_weight_fraction_leaf': 0.01228480927829767, 'max_features': 0.9442475340553997}. Best is trial 448 with value: 0.8888507593246218.[0m
[32m[I 2022-04-13 12:08:42,515][0m Trial 895 finished with value: 0.7785642366098312 and parameters: {'splitter': 'best', 'min_samples_split': 0.06989601361371471, 'min_samples_leaf': 0.09765858711844555, 'min_weight_fraction_leaf': 0.023402589822892415, 'max_features': 0.9641682995426282}. Best is trial 448 with value: 0.8888507593246218.[0m
/media/san2_ssd/data/Workdir/survival/utils.py:305: RuntimeWarning: invalid value encountered in true_divide
  pdfs = np.gradient(1-survs,axis=1)/norms
/media/san2_ssd/data/Workdir/survival/utils.py:305: RuntimeWarning: invalid value encountered in true_divide
  pdfs = np.gradient(1-survs,axis=1)/norms
/media/san2_ssd/data/Workdir/survival/utils.py:305: RuntimeWarning: invalid value encountered in true_divide
  pdfs = np.gradient(1-survs,axis=1)/norms
/media/san2_ssd/data/Workdir/survival/utils.py:305: RuntimeWarning: invalid value encountered in true_divide
  pdfs = np.gradient(1-survs,axis=1)/norms
[32m[I 2022-04-13 12:08:45,204][0m Trial 896 finished with value: 0.8839985779492142 and parameters: {'splitter': 'best', 'min_samples_split': 0.06939020053545138, 'min_samples_leaf': 0.04240219785503921, 'min_weight_fraction_leaf': 0.0012084792460024182, 'max_features': 0.9011975191197441}. Best is trial 448 with value: 0.8888507593246218.[0m
/media/san2_ssd/data/Workdir/survival/utils.py:305: RuntimeWarning: invalid value encountered in true_divide
  pdfs = np.gradient(1-survs,axis=1)/norms
/media/san2_ssd/data/Workdir/survival/utils.py:305: RuntimeWarning: invalid value encountered in true_divide
  pdfs = np.gradient(1-survs,axis=1)/norms
[32m[I 2022-04-13 12:08:48,289][0m Trial 897 finished with value: 0.8850214022960919 and parameters: {'splitter': 'best', 'min_samples_split': 0.08339566594787631, 'min_samples_leaf': 0.055573377992125327, 'min_weight_fraction_leaf': 0.027276159473755147, 'max_features': 0.9993034024589864}. Best is trial 448 with value: 0.8888507593246218.[0m
[32m[I 2022-04-13 12:08:49,183][0m Trial 898 finished with value: 0.4653081804761695 and parameters: {'splitter': 'best', 'min_samples_split': 0.0875301761129931, 'min_samples_leaf': 0.28520289856770836, 'min_weight_fraction_leaf': 0.015300499920953496, 'max_features': 0.9836775490446152}. Best is trial 448 with value: 0.8888507593246218.[0m
/media/san2_ssd/data/Workdir/survival/utils.py:305: RuntimeWarning: invalid value encountered in true_divide
  pdfs = np.gradient(1-survs,axis=1)/norms
/media/san2_ssd/data/Workdir/survival/utils.py:305: RuntimeWarning: invalid value encountered in true_divide
  pdfs = np.gradient(1-survs,axis=1)/norms
/media/san2_ssd/data/Workdir/survival/utils.py:305: RuntimeWarning: invalid value encountered in true_divide
  pdfs = np.gradient(1-survs,axis=1)/norms
/media/san2_ssd/data/Workdir/survival/utils.py:305: RuntimeWarning: invalid value encountered in true_divide
  pdfs = np.gradient(1-survs,axis=1)/norms
[32m[I 2022-04-13 12:08:51,828][0m Trial 899 finished with value: 0.8844329711681841 and parameters: {'splitter': 'best', 'min_samples_split': 0.07175174004973421, 'min_samples_leaf': 0.041354944547629564, 'min_weight_fraction_leaf': 0.021211857606938247, 'max_features': 0.9257880822158251}. Best is trial 448 with value: 0.8888507593246218.[0m
/media/san2_ssd/data/Workdir/survival/utils.py:305: RuntimeWarning: invalid value encountered in true_divide
  pdfs = np.gradient(1-survs,axis=1)/norms
/media/san2_ssd/data/Workdir/survival/utils.py:305: RuntimeWarning: invalid value encountered in true_divide
  pdfs = np.gradient(1-survs,axis=1)/norms
/media/san2_ssd/data/Workdir/survival/utils.py:305: RuntimeWarning: invalid value encountered in true_divide
  pdfs = np.gradient(1-survs,axis=1)/norms
/media/san2_ssd/data/Workdir/survival/utils.py:305: RuntimeWarning: invalid value encountered in true_divide
  pdfs = np.gradient(1-survs,axis=1)/norms
/media/san2_ssd/data/Workdir/survival/utils.py:305: RuntimeWarning: invalid value encountered in true_divide
  pdfs = np.gradient(1-survs,axis=1)/norms
[32m[I 2022-04-13 12:08:53,188][0m Trial 900 finished with value: 0.8825513916183425 and parameters: {'splitter': 'best', 'min_samples_split': 0.08978815173118687, 'min_samples_leaf': 0.03798245475281741, 'min_weight_fraction_leaf': 0.001467477990677991, 'max_features': 0.9635882342193367}. Best is trial 448 with value: 0.8888507593246218.[0m
/media/san2_ssd/data/Workdir/survival/utils.py:305: RuntimeWarning: invalid value encountered in true_divide
  pdfs = np.gradient(1-survs,axis=1)/norms
/media/san2_ssd/data/Workdir/survival/utils.py:305: RuntimeWarning: invalid value encountered in true_divide
  pdfs = np.gradient(1-survs,axis=1)/norms
/media/san2_ssd/data/Workdir/survival/utils.py:305: RuntimeWarning: invalid value encountered in true_divide
  pdfs = np.gradient(1-survs,axis=1)/norms
[32m[I 2022-04-13 12:08:54,200][0m Trial 901 finished with value: 0.8836112643467416 and parameters: {'splitter': 'best', 'min_samples_split': 0.06092890774750251, 'min_samples_leaf': 0.051705358082467595, 'min_weight_fraction_leaf': 0.02905128643593474, 'max_features': 0.9498124567683599}. Best is trial 448 with value: 0.8888507593246218.[0m
[32m[I 2022-04-13 12:08:54,808][0m Trial 902 finished with value: 0.4653081804761695 and parameters: {'splitter': 'best', 'min_samples_split': 0.08622081541682981, 'min_samples_leaf': 0.06746957923019882, 'min_weight_fraction_leaf': 0.284436155751335, 'max_features': 0.9999188714642303}. Best is trial 448 with value: 0.8888507593246218.[0m
/media/san2_ssd/data/Workdir/survival/utils.py:305: RuntimeWarning: invalid value encountered in true_divide
  pdfs = np.gradient(1-survs,axis=1)/norms
/media/san2_ssd/data/Workdir/survival/utils.py:305: RuntimeWarning: invalid value encountered in true_divide
  pdfs = np.gradient(1-survs,axis=1)/norms
/media/san2_ssd/data/Workdir/survival/utils.py:305: RuntimeWarning: invalid value encountered in true_divide
  pdfs = np.gradient(1-survs,axis=1)/norms
[32m[I 2022-04-13 12:08:55,777][0m Trial 903 finished with value: 0.8827527438310078 and parameters: {'splitter': 'best', 'min_samples_split': 0.09299828813416337, 'min_samples_leaf': 0.04634703266557463, 'min_weight_fraction_leaf': 0.030263748562842384, 'max_features': 0.9684372725436181}. Best is trial 448 with value: 0.8888507593246218.[0m
/media/san2_ssd/data/Workdir/survival/utils.py:305: RuntimeWarning: invalid value encountered in true_divide
  pdfs = np.gradient(1-survs,axis=1)/norms
/media/san2_ssd/data/Workdir/survival/utils.py:305: RuntimeWarning: invalid value encountered in true_divide
  pdfs = np.gradient(1-survs,axis=1)/norms
/media/san2_ssd/data/Workdir/survival/utils.py:305: RuntimeWarning: invalid value encountered in true_divide
  pdfs = np.gradient(1-survs,axis=1)/norms
/media/san2_ssd/data/Workdir/survival/utils.py:305: RuntimeWarning: invalid value encountered in true_divide
  pdfs = np.gradient(1-survs,axis=1)/norms
/media/san2_ssd/data/Workdir/survival/utils.py:305: RuntimeWarning: invalid value encountered in true_divide
  pdfs = np.gradient(1-survs,axis=1)/norms
