[32m[I 2022-04-13 12:11:53,021][0m Trial 8 finished with value: 0.5 and parameters: {'splitter': 'random', 'min_samples_split': 0.39509311633597133, 'min_samples_leaf': 0.04088704348402252, 'min_weight_fraction_leaf': 0.4910137431602474, 'max_features': 0.485980330281817}. Best is trial 6 with value: 0.7019868539723896.[0m
[32m[I 2022-04-13 12:11:53,086][0m Trial 9 finished with value: 0.5741154210754972 and parameters: {'splitter': 'best', 'min_samples_split': 0.2065719659172984, 'min_samples_leaf': 0.0060806973677174, 'min_weight_fraction_leaf': 0.3678782359816879, 'max_features': 0.49059467855074235}. Best is trial 6 with value: 0.7019868539723896.[0m
[32m[I 2022-04-13 12:11:53,264][0m Trial 10 finished with value: 0.5726829235199622 and parameters: {'splitter': 'best', 'min_samples_split': 0.2933875239170571, 'min_samples_leaf': 0.08127988603713382, 'min_weight_fraction_leaf': 0.20585802554589389, 'max_features': 0.10108233109120762}. Best is trial 6 with value: 0.7019868539723896.[0m
[32m[I 2022-04-13 12:11:53,479][0m Trial 11 finished with value: 0.5 and parameters: {'splitter': 'random', 'min_samples_split': 0.49271129375931666, 'min_samples_leaf': 0.4897234619921996, 'min_weight_fraction_leaf': 0.3275177732575212, 'max_features': 0.7098247902537007}. Best is trial 6 with value: 0.7019868539723896.[0m
[32m[I 2022-04-13 12:11:53,685][0m Trial 12 finished with value: 0.6743624146605087 and parameters: {'splitter': 'random', 'min_samples_split': 0.29516559618197896, 'min_samples_leaf': 0.3723250304982473, 'min_weight_fraction_leaf': 0.3137410384979582, 'max_features': 0.9519747601410269}. Best is trial 6 with value: 0.7019868539723896.[0m
[32m[I 2022-04-13 12:11:53,939][0m Trial 13 finished with value: 0.6743624146605087 and parameters: {'splitter': 'random', 'min_samples_split': 0.13504644077369132, 'min_samples_leaf': 0.3705589277706642, 'min_weight_fraction_leaf': 0.11100609472473771, 'max_features': 0.8021557285481776}. Best is trial 6 with value: 0.7019868539723896.[0m
[32m[I 2022-04-13 12:11:54,130][0m Trial 14 finished with value: 0.6681877782925483 and parameters: {'splitter': 'random', 'min_samples_split': 0.3670753115236276, 'min_samples_leaf': 0.09854668870420842, 'min_weight_fraction_leaf': 0.2885625945474821, 'max_features': 0.6041454719494812}. Best is trial 6 with value: 0.7019868539723896.[0m
[32m[I 2022-04-13 12:11:54,255][0m Trial 15 finished with value: 0.5741154210754972 and parameters: {'splitter': 'best', 'min_samples_split': 0.495773145594967, 'min_samples_leaf': 0.2281729656085787, 'min_weight_fraction_leaf': 0.3915181505730448, 'max_features': 0.290097077859501}. Best is trial 6 with value: 0.7019868539723896.[0m
[32m[I 2022-04-13 12:11:54,692][0m Trial 16 finished with value: 0.6178248979461898 and parameters: {'splitter': 'best', 'min_samples_split': 0.14550810479238852, 'min_samples_leaf': 0.3123377174603183, 'min_weight_fraction_leaf': 0.20622421293192625, 'max_features': 0.6116268829389335}. Best is trial 6 with value: 0.7019868539723896.[0m
[32m[I 2022-04-13 12:11:54,815][0m Trial 17 finished with value: 0.5103861735704435 and parameters: {'splitter': 'random', 'min_samples_split': 0.28845163293500076, 'min_samples_leaf': 0.42469711178799685, 'min_weight_fraction_leaf': 0.2601262569021148, 'max_features': 0.8700394897060995}. Best is trial 6 with value: 0.7019868539723896.[0m
[32m[I 2022-04-13 12:11:54,946][0m Trial 18 finished with value: 0.6986565930222624 and parameters: {'splitter': 'random', 'min_samples_split': 0.3482876562820758, 'min_samples_leaf': 0.13658653866283607, 'min_weight_fraction_leaf': 0.07338445084119122, 'max_features': 0.9908807158660643}. Best is trial 6 with value: 0.7019868539723896.[0m
[32m[I 2022-04-13 12:11:55,139][0m Trial 19 finished with value: 0.610984748379064 and parameters: {'splitter': 'best', 'min_samples_split': 0.20710043267678444, 'min_samples_leaf': 0.11617400550431035, 'min_weight_fraction_leaf': 0.06775750973998082, 'max_features': 0.2405184756379543}. Best is trial 6 with value: 0.7019868539723896.[0m
[32m[I 2022-04-13 12:11:55,247][0m Trial 20 finished with value: 0.5811118321346231 and parameters: {'splitter': 'best', 'min_samples_split': 0.33839038996994025, 'min_samples_leaf': 0.230432183460631, 'min_weight_fraction_leaf': 0.09242800151533587, 'max_features': 0.1107988474951983}. Best is trial 6 with value: 0.7019868539723896.[0m
[32m[I 2022-04-13 12:11:55,362][0m Trial 21 finished with value: 0.6987706700730804 and parameters: {'splitter': 'random', 'min_samples_split': 0.43903039393424365, 'min_samples_leaf': 0.17081309752170332, 'min_weight_fraction_leaf': 0.18586640777414448, 'max_features': 0.9717787084327195}. Best is trial 6 with value: 0.7019868539723896.[0m
[32m[I 2022-04-13 12:11:55,512][0m Trial 22 finished with value: 0.695764844883872 and parameters: {'splitter': 'random', 'min_samples_split': 0.43240966455972685, 'min_samples_leaf': 0.14137126101208952, 'min_weight_fraction_leaf': 0.18261640819008942, 'max_features': 0.9903586492337791}. Best is trial 6 with value: 0.7019868539723896.[0m
[32m[I 2022-04-13 12:11:55,657][0m Trial 23 finished with value: 0.695764844883872 and parameters: {'splitter': 'random', 'min_samples_split': 0.4443273230158811, 'min_samples_leaf': 0.05716840529484993, 'min_weight_fraction_leaf': 0.052346444099968276, 'max_features': 0.6069781591336305}. Best is trial 6 with value: 0.7019868539723896.[0m
[32m[I 2022-04-13 12:11:55,761][0m Trial 24 finished with value: 0.6896617316428499 and parameters: {'splitter': 'random', 'min_samples_split': 0.3372483463570871, 'min_samples_leaf': 0.18913159884188957, 'min_weight_fraction_leaf': 0.2248702820328737, 'max_features': 0.9960626940235509}. Best is trial 6 with value: 0.7019868539723896.[0m
[32m[I 2022-04-13 12:11:55,883][0m Trial 25 finished with value: 0.695764844883872 and parameters: {'splitter': 'random', 'min_samples_split': 0.45001689027088054, 'min_samples_leaf': 0.12449296276881248, 'min_weight_fraction_leaf': 0.16046370664644713, 'max_features': 0.8915829216452222}. Best is trial 6 with value: 0.7019868539723896.[0m
[32m[I 2022-04-13 12:11:55,968][0m Trial 26 finished with value: 0.5 and parameters: {'splitter': 'random', 'min_samples_split': 0.2387112642641206, 'min_samples_leaf': 0.25953060047510534, 'min_weight_fraction_leaf': 0.12068342806949697, 'max_features': 0.009186540513116515}. Best is trial 6 with value: 0.7019868539723896.[0m
[32m[I 2022-04-13 12:11:56,095][0m Trial 27 finished with value: 0.695764844883872 and parameters: {'splitter': 'random', 'min_samples_split': 0.34176362040526403, 'min_samples_leaf': 0.19863321032837788, 'min_weight_fraction_leaf': 0.0797076495730525, 'max_features': 0.6849490889326904}. Best is trial 6 with value: 0.7019868539723896.[0m
[32m[I 2022-04-13 12:11:57,679][0m Trial 28 finished with value: 0.6494488309515625 and parameters: {'splitter': 'best', 'min_samples_split': 0.2496453208402723, 'min_samples_leaf': 0.07645194313104559, 'min_weight_fraction_leaf': 0.15716523549637113, 'max_features': 0.7839725909626585}. Best is trial 6 with value: 0.7019868539723896.[0m
[32m[I 2022-04-13 12:11:58,487][0m Trial 29 finished with value: 0.7372734408879567 and parameters: {'splitter': 'best', 'min_samples_split': 0.06057246679047173, 'min_samples_leaf': 0.02355222842055424, 'min_weight_fraction_leaf': 0.02809011131367025, 'max_features': 0.2991913101258903}. Best is trial 29 with value: 0.7372734408879567.[0m
[32m[I 2022-04-13 12:12:00,119][0m Trial 30 finished with value: 0.7130066175950386 and parameters: {'splitter': 'best', 'min_samples_split': 0.058001824320487, 'min_samples_leaf': 0.004303582067366748, 'min_weight_fraction_leaf': 0.0007547407089294189, 'max_features': 0.3572180198374451}. Best is trial 29 with value: 0.7372734408879567.[0m
[32m[I 2022-04-13 12:12:00,564][0m Trial 31 finished with value: 0.7371792905594037 and parameters: {'splitter': 'best', 'min_samples_split': 0.0656231118879733, 'min_samples_leaf': 0.02677147155873133, 'min_weight_fraction_leaf': 0.01347503276411035, 'max_features': 0.33260075490331864}. Best is trial 29 with value: 0.7372734408879567.[0m
[32m[I 2022-04-13 12:12:01,147][0m Trial 32 finished with value: 0.6951458776556848 and parameters: {'splitter': 'best', 'min_samples_split': 0.06646338923266608, 'min_samples_leaf': 0.005474066951484566, 'min_weight_fraction_leaf': 0.012060789257375082, 'max_features': 0.3676511783427856}. Best is trial 29 with value: 0.7372734408879567.[0m
[32m[I 2022-04-13 12:12:01,960][0m Trial 33 finished with value: 0.7368895626897058 and parameters: {'splitter': 'best', 'min_samples_split': 0.06699349923594883, 'min_samples_leaf': 0.04010764399315232, 'min_weight_fraction_leaf': 0.02662350970938176, 'max_features': 0.3288088445246506}. Best is trial 29 with value: 0.7372734408879567.[0m
[32m[I 2022-04-13 12:12:03,740][0m Trial 34 finished with value: 0.7151257132717497 and parameters: {'splitter': 'best', 'min_samples_split': 0.09922272912939192, 'min_samples_leaf': 0.03432499552512746, 'min_weight_fraction_leaf': 0.006894221591230817, 'max_features': 0.27414514667833845}. Best is trial 29 with value: 0.7372734408879567.[0m
[32m[I 2022-04-13 12:12:04,156][0m Trial 35 finished with value: 0.6967989370918485 and parameters: {'splitter': 'best', 'min_samples_split': 0.001595820504984885, 'min_samples_leaf': 0.03737355971511125, 'min_weight_fraction_leaf': 0.03875885205405327, 'max_features': 0.21946491882614982}. Best is trial 29 with value: 0.7372734408879567.[0m
[32m[I 2022-04-13 12:12:05,137][0m Trial 36 finished with value: 0.7427688524053071 and parameters: {'splitter': 'best', 'min_samples_split': 0.10090592950567237, 'min_samples_leaf': 0.03950423159140732, 'min_weight_fraction_leaf': 0.03435947992137219, 'max_features': 0.31655306801350563}. Best is trial 36 with value: 0.7427688524053071.[0m
[32m[I 2022-04-13 12:12:05,490][0m Trial 37 finished with value: 0.7201500008347161 and parameters: {'splitter': 'best', 'min_samples_split': 0.13655807920440322, 'min_samples_leaf': 0.0624653320830617, 'min_weight_fraction_leaf': 0.032060802413668765, 'max_features': 0.40885172887651156}. Best is trial 36 with value: 0.7427688524053071.[0m
[32m[I 2022-04-13 12:12:05,918][0m Trial 38 finished with value: 0.6971233988017504 and parameters: {'splitter': 'best', 'min_samples_split': 0.023048581817020367, 'min_samples_leaf': 0.09487798396210435, 'min_weight_fraction_leaf': 0.10383711059152662, 'max_features': 0.17770844978751624}. Best is trial 36 with value: 0.7427688524053071.[0m
[32m[I 2022-04-13 12:12:06,158][0m Trial 39 finished with value: 0.7258732947257209 and parameters: {'splitter': 'best', 'min_samples_split': 0.08839263208226936, 'min_samples_leaf': 0.025610591670586325, 'min_weight_fraction_leaf': 0.05703276211748831, 'max_features': 0.327052817817187}. Best is trial 36 with value: 0.7427688524053071.[0m
[32m[I 2022-04-13 12:12:06,422][0m Trial 40 finished with value: 0.742139287848477 and parameters: {'splitter': 'best', 'min_samples_split': 0.1696656528845033, 'min_samples_leaf': 0.060897327357139514, 'min_weight_fraction_leaf': 0.028388704590603782, 'max_features': 0.5267073826963942}. Best is trial 36 with value: 0.7427688524053071.[0m
[32m[I 2022-04-13 12:12:06,659][0m Trial 41 finished with value: 0.6978082690423476 and parameters: {'splitter': 'best', 'min_samples_split': 0.17755667433516525, 'min_samples_leaf': 0.051701783693990824, 'min_weight_fraction_leaf': 0.043260510112603845, 'max_features': 0.555816136022056}. Best is trial 36 with value: 0.7427688524053071.[0m
[32m[I 2022-04-13 12:12:07,342][0m Trial 42 finished with value: 0.7369024842173588 and parameters: {'splitter': 'best', 'min_samples_split': 0.11770615069960762, 'min_samples_leaf': 0.07651003315565795, 'min_weight_fraction_leaf': 0.021102492549303173, 'max_features': 0.42355092588205934}. Best is trial 36 with value: 0.7427688524053071.[0m
[32m[I 2022-04-13 12:12:07,906][0m Trial 43 finished with value: 0.7349790665470304 and parameters: {'splitter': 'best', 'min_samples_split': 0.1183588685807482, 'min_samples_leaf': 0.07584195345352529, 'min_weight_fraction_leaf': 0.02346740657746247, 'max_features': 0.42370533983049863}. Best is trial 36 with value: 0.7427688524053071.[0m
[32m[I 2022-04-13 12:12:08,498][0m Trial 44 finished with value: 0.6732856246694461 and parameters: {'splitter': 'best', 'min_samples_split': 0.1627053958949188, 'min_samples_leaf': 0.02394656571626319, 'min_weight_fraction_leaf': 0.08551759015604324, 'max_features': 0.46233568341624537}. Best is trial 36 with value: 0.7427688524053071.[0m
[32m[I 2022-04-13 12:12:09,076][0m Trial 45 finished with value: 0.6835043027893432 and parameters: {'splitter': 'best', 'min_samples_split': 0.04334747803423992, 'min_samples_leaf': 0.06741550480812843, 'min_weight_fraction_leaf': 0.1344954855576051, 'max_features': 0.5432865078574738}. Best is trial 36 with value: 0.7427688524053071.[0m
[32m[I 2022-04-13 12:12:09,271][0m Trial 46 finished with value: 0.689794863177221 and parameters: {'splitter': 'best', 'min_samples_split': 0.10957760449541518, 'min_samples_leaf': 0.09941551273629706, 'min_weight_fraction_leaf': 0.0568887721201674, 'max_features': 0.39322061967268745}. Best is trial 36 with value: 0.7427688524053071.[0m
[32m[I 2022-04-13 12:12:09,994][0m Trial 47 finished with value: 0.7544103504469687 and parameters: {'splitter': 'best', 'min_samples_split': 0.08159969383988025, 'min_samples_leaf': 0.018600634598992513, 'min_weight_fraction_leaf': 0.014873974637258102, 'max_features': 0.5391804425988219}. Best is trial 47 with value: 0.7544103504469687.[0m
[32m[I 2022-04-13 12:12:10,701][0m Trial 48 finished with value: 0.7482986880213185 and parameters: {'splitter': 'best', 'min_samples_split': 0.02639405543918205, 'min_samples_leaf': 0.017208828582145612, 'min_weight_fraction_leaf': 0.003697159282468415, 'max_features': 0.5283376334959808}. Best is trial 47 with value: 0.7544103504469687.[0m
[32m[I 2022-04-13 12:12:11,569][0m Trial 49 finished with value: 0.7355574375284235 and parameters: {'splitter': 'best', 'min_samples_split': 0.030622458222565686, 'min_samples_leaf': 0.003926239603131765, 'min_weight_fraction_leaf': 0.048846676461367866, 'max_features': 0.5379611708598239}. Best is trial 47 with value: 0.7544103504469687.[0m
[32m[I 2022-04-13 12:12:12,504][0m Trial 50 finished with value: 0.7005727853514621 and parameters: {'splitter': 'best', 'min_samples_split': 0.023260563351228794, 'min_samples_leaf': 0.09553727220191238, 'min_weight_fraction_leaf': 0.0014800059220371961, 'max_features': 0.6892175344821011}. Best is trial 47 with value: 0.7544103504469687.[0m
[32m[I 2022-04-13 12:12:14,807][0m Trial 51 finished with value: 0.7578942780380448 and parameters: {'splitter': 'best', 'min_samples_split': 0.08328182077996502, 'min_samples_leaf': 0.021587268944467553, 'min_weight_fraction_leaf': 0.0237887027540003, 'max_features': 0.4952352051568324}. Best is trial 51 with value: 0.7578942780380448.[0m
[32m[I 2022-04-13 12:12:16,691][0m Trial 52 finished with value: 0.7452250939608656 and parameters: {'splitter': 'best', 'min_samples_split': 0.08244162996601334, 'min_samples_leaf': 0.051191566107423155, 'min_weight_fraction_leaf': 0.06793573978693343, 'max_features': 0.6604409837448643}. Best is trial 51 with value: 0.7578942780380448.[0m
[32m[I 2022-04-13 12:12:18,614][0m Trial 53 finished with value: 0.7484667037486992 and parameters: {'splitter': 'best', 'min_samples_split': 0.0858307543456505, 'min_samples_leaf': 0.04600450576004756, 'min_weight_fraction_leaf': 0.07067572646847065, 'max_features': 0.6609424110706246}. Best is trial 51 with value: 0.7578942780380448.[0m
[32m[I 2022-04-13 12:12:20,709][0m Trial 54 finished with value: 0.7315514461623557 and parameters: {'splitter': 'best', 'min_samples_split': 0.08454495378597118, 'min_samples_leaf': 0.04847778430458611, 'min_weight_fraction_leaf': 0.09830615867958356, 'max_features': 0.7337718804747064}. Best is trial 51 with value: 0.7578942780380448.[0m
[32m[I 2022-04-13 12:12:23,250][0m Trial 55 finished with value: 0.7405635238110545 and parameters: {'splitter': 'best', 'min_samples_split': 0.0869204656790021, 'min_samples_leaf': 0.017733364085862676, 'min_weight_fraction_leaf': 0.06685100882318878, 'max_features': 0.6593859702814917}. Best is trial 51 with value: 0.7578942780380448.[0m
[32m[I 2022-04-13 12:12:23,382][0m Trial 56 finished with value: 0.5959868667917435 and parameters: {'splitter': 'best', 'min_samples_split': 0.041691929016518914, 'min_samples_leaf': 0.4871855154480204, 'min_weight_fraction_leaf': 0.08220476679670204, 'max_features': 0.7379442725391007}. Best is trial 51 with value: 0.7578942780380448.[0m
[32m[I 2022-04-13 12:12:25,976][0m Trial 57 finished with value: 0.7636404261395481 and parameters: {'splitter': 'best', 'min_samples_split': 0.01662147570357117, 'min_samples_leaf': 0.0011274157852637634, 'min_weight_fraction_leaf': 0.06293063522735245, 'max_features': 0.6460440135750556}. Best is trial 57 with value: 0.7636404261395481.[0m
[32m[I 2022-04-13 12:12:27,669][0m Trial 58 finished with value: 0.6932209738693274 and parameters: {'splitter': 'best', 'min_samples_split': 0.010993184929509833, 'min_samples_leaf': 0.0057846438367672795, 'min_weight_fraction_leaf': 0.12481548543253004, 'max_features': 0.5762634669459318}. Best is trial 57 with value: 0.7636404261395481.[0m
[32m[I 2022-04-13 12:12:28,364][0m Trial 59 finished with value: 0.7265872325472096 and parameters: {'splitter': 'best', 'min_samples_split': 0.04402122143101542, 'min_samples_leaf': 0.14127245093942742, 'min_weight_fraction_leaf': 0.1465561617445376, 'max_features': 0.6426832902806826}. Best is trial 57 with value: 0.7636404261395481.[0m
[32m[I 2022-04-13 12:12:28,457][0m Trial 60 finished with value: 0.5741154210754972 and parameters: {'splitter': 'best', 'min_samples_split': 0.07781179965655184, 'min_samples_leaf': 0.10271265933596203, 'min_weight_fraction_leaf': 0.44535642023148236, 'max_features': 0.5103021102385035}. Best is trial 57 with value: 0.7636404261395481.[0m
[32m[I 2022-04-13 12:12:29,368][0m Trial 61 finished with value: 0.7292961488053791 and parameters: {'splitter': 'best', 'min_samples_split': 0.10412590248166397, 'min_samples_leaf': 0.045134076792986345, 'min_weight_fraction_leaf': 0.06534736618036055, 'max_features': 0.5779483982461304}. Best is trial 57 with value: 0.7636404261395481.[0m
[32m[I 2022-04-13 12:12:30,301][0m Trial 62 finished with value: 0.7551734590928301 and parameters: {'splitter': 'best', 'min_samples_split': 0.014423252921341223, 'min_samples_leaf': 0.016627118043954565, 'min_weight_fraction_leaf': 0.04818175264855844, 'max_features': 0.46896144724252276}. Best is trial 57 with value: 0.7636404261395481.[0m
[32m[I 2022-04-13 12:12:31,251][0m Trial 63 finished with value: 0.7347229582880742 and parameters: {'splitter': 'best', 'min_samples_split': 0.01648484538917254, 'min_samples_leaf': 0.018328782373865753, 'min_weight_fraction_leaf': 0.11161364600028632, 'max_features': 0.48137241064638114}. Best is trial 57 with value: 0.7636404261395481.[0m
[32m[I 2022-04-13 12:12:33,040][0m Trial 64 finished with value: 0.7653782739371261 and parameters: {'splitter': 'best', 'min_samples_split': 0.037290902765289666, 'min_samples_leaf': 0.06074133360866085, 'min_weight_fraction_leaf': 0.0478732589092107, 'max_features': 0.8203229663480303}. Best is trial 64 with value: 0.7653782739371261.[0m
[32m[I 2022-04-13 12:12:34,686][0m Trial 65 finished with value: 0.7623842719605187 and parameters: {'splitter': 'best', 'min_samples_split': 0.001085526437764663, 'min_samples_leaf': 0.016862107715516085, 'min_weight_fraction_leaf': 0.04319570202822162, 'max_features': 0.8560811129076442}. Best is trial 64 with value: 0.7653782739371261.[0m
[32m[I 2022-04-13 12:12:35,801][0m Trial 66 finished with value: 0.7510320811398427 and parameters: {'splitter': 'best', 'min_samples_split': 0.005179371227375587, 'min_samples_leaf': 0.08584259117268841, 'min_weight_fraction_leaf': 0.09181678940541758, 'max_features': 0.8659154414040033}. Best is trial 64 with value: 0.7653782739371261.[0m
[32m[I 2022-04-13 12:12:37,587][0m Trial 67 finished with value: 0.7521314766299856 and parameters: {'splitter': 'best', 'min_samples_split': 0.011664797912501699, 'min_samples_leaf': 0.08893754414897893, 'min_weight_fraction_leaf': 0.046981704374422326, 'max_features': 0.9226245486304581}. Best is trial 64 with value: 0.7653782739371261.[0m
[32m[I 2022-04-13 12:12:38,358][0m Trial 68 finished with value: 0.6205121165077 and parameters: {'splitter': 'best', 'min_samples_split': 0.04699027664912871, 'min_samples_leaf': 0.317627590932464, 'min_weight_fraction_leaf': 0.041747693696458324, 'max_features': 0.8232855386335216}. Best is trial 64 with value: 0.7653782739371261.[0m
[32m[I 2022-04-13 12:12:39,116][0m Trial 69 finished with value: 0.5919106898732909 and parameters: {'splitter': 'best', 'min_samples_split': 0.0011162137576717496, 'min_samples_leaf': 0.11311737941112657, 'min_weight_fraction_leaf': 0.36165497207126385, 'max_features': 0.8315668975635098}. Best is trial 64 with value: 0.7653782739371261.[0m
[32m[I 2022-04-13 12:12:41,082][0m Trial 70 finished with value: 0.7678712518003701 and parameters: {'splitter': 'best', 'min_samples_split': 0.034977937760159734, 'min_samples_leaf': 0.06622771869109427, 'min_weight_fraction_leaf': 0.05232106996271717, 'max_features': 0.9478737117353977}. Best is trial 70 with value: 0.7678712518003701.[0m
