[32m[I 2022-04-13 12:06:43,902][0m Trial 832 finished with value: 0.7782303086947439 and parameters: {'splitter': 'random', 'min_samples_split': 0.15775010249251079, 'min_samples_leaf': 0.027334759388991967, 'min_weight_fraction_leaf': 0.05054049935326258, 'max_features': 0.964927897063347}. Best is trial 448 with value: 0.8888507593246218.[0m
[32m[I 2022-04-13 12:06:46,567][0m Trial 833 finished with value: 0.7827554057974566 and parameters: {'splitter': 'best', 'min_samples_split': 0.11203447905278191, 'min_samples_leaf': 0.033116341530268475, 'min_weight_fraction_leaf': 0.09533149579638775, 'max_features': 0.9831139087718764}. Best is trial 448 with value: 0.8888507593246218.[0m
[32m[I 2022-04-13 12:06:49,335][0m Trial 834 finished with value: 0.879873714025744 and parameters: {'splitter': 'best', 'min_samples_split': 0.14526842214395552, 'min_samples_leaf': 0.024953781077105996, 'min_weight_fraction_leaf': 0.04357465431279565, 'max_features': 0.8807933010987252}. Best is trial 448 with value: 0.8888507593246218.[0m
/media/san2_ssd/data/Workdir/survival/utils.py:305: RuntimeWarning: invalid value encountered in true_divide
  pdfs = np.gradient(1-survs,axis=1)/norms
/media/san2_ssd/data/Workdir/survival/utils.py:305: RuntimeWarning: invalid value encountered in true_divide
  pdfs = np.gradient(1-survs,axis=1)/norms
/media/san2_ssd/data/Workdir/survival/utils.py:305: RuntimeWarning: invalid value encountered in true_divide
  pdfs = np.gradient(1-survs,axis=1)/norms
[32m[I 2022-04-13 12:06:51,823][0m Trial 835 finished with value: 0.8828159493016997 and parameters: {'splitter': 'best', 'min_samples_split': 0.08925942362981493, 'min_samples_leaf': 0.011245064501336525, 'min_weight_fraction_leaf': 0.053339073707233, 'max_features': 0.9632596466158375}. Best is trial 448 with value: 0.8888507593246218.[0m
/media/san2_ssd/data/Workdir/survival/utils.py:305: RuntimeWarning: invalid value encountered in true_divide
  pdfs = np.gradient(1-survs,axis=1)/norms
/media/san2_ssd/data/Workdir/survival/utils.py:305: RuntimeWarning: invalid value encountered in true_divide
  pdfs = np.gradient(1-survs,axis=1)/norms
/media/san2_ssd/data/Workdir/survival/utils.py:305: RuntimeWarning: invalid value encountered in true_divide
  pdfs = np.gradient(1-survs,axis=1)/norms
/media/san2_ssd/data/Workdir/survival/utils.py:305: RuntimeWarning: invalid value encountered in true_divide
  pdfs = np.gradient(1-survs,axis=1)/norms
[32m[I 2022-04-13 12:06:53,746][0m Trial 836 finished with value: 0.8867977624164893 and parameters: {'splitter': 'best', 'min_samples_split': 0.12373125418673336, 'min_samples_leaf': 0.039782464079569445, 'min_weight_fraction_leaf': 0.0438410451820747, 'max_features': 0.9987299999275798}. Best is trial 448 with value: 0.8888507593246218.[0m
/media/san2_ssd/data/Workdir/survival/utils.py:305: RuntimeWarning: invalid value encountered in true_divide
  pdfs = np.gradient(1-survs,axis=1)/norms
[32m[I 2022-04-13 12:06:55,907][0m Trial 837 finished with value: 0.8857694580205372 and parameters: {'splitter': 'best', 'min_samples_split': 0.07379475434443489, 'min_samples_leaf': 0.021337145824776076, 'min_weight_fraction_leaf': 0.06101527558046796, 'max_features': 0.999373366687838}. Best is trial 448 with value: 0.8888507593246218.[0m
/media/san2_ssd/data/Workdir/survival/utils.py:305: RuntimeWarning: invalid value encountered in true_divide
  pdfs = np.gradient(1-survs,axis=1)/norms
/media/san2_ssd/data/Workdir/survival/utils.py:305: RuntimeWarning: invalid value encountered in true_divide
  pdfs = np.gradient(1-survs,axis=1)/norms
[32m[I 2022-04-13 12:06:58,071][0m Trial 838 finished with value: 0.8838079262031364 and parameters: {'splitter': 'best', 'min_samples_split': 0.10695742087453392, 'min_samples_leaf': 0.0494357126471523, 'min_weight_fraction_leaf': 0.039555900484825574, 'max_features': 0.6221377353952413}. Best is trial 448 with value: 0.8888507593246218.[0m
/media/san2_ssd/data/Workdir/survival/utils.py:305: RuntimeWarning: invalid value encountered in true_divide
  pdfs = np.gradient(1-survs,axis=1)/norms
/media/san2_ssd/data/Workdir/survival/utils.py:305: RuntimeWarning: invalid value encountered in true_divide
  pdfs = np.gradient(1-survs,axis=1)/norms
[32m[I 2022-04-13 12:07:00,277][0m Trial 839 finished with value: 0.8854235927554571 and parameters: {'splitter': 'best', 'min_samples_split': 0.13592161280401427, 'min_samples_leaf': 0.03554148356763065, 'min_weight_fraction_leaf': 0.05277217552842287, 'max_features': 0.9997568047271342}. Best is trial 448 with value: 0.8888507593246218.[0m
[32m[I 2022-04-13 12:07:00,994][0m Trial 840 finished with value: 0.7286815151800173 and parameters: {'splitter': 'best', 'min_samples_split': 0.11389911325519074, 'min_samples_leaf': 0.01015422328660593, 'min_weight_fraction_leaf': 0.0382359694827514, 'max_features': 0.370342237084223}. Best is trial 448 with value: 0.8888507593246218.[0m
[32m[I 2022-04-13 12:07:03,750][0m Trial 841 finished with value: 0.8837077431764083 and parameters: {'splitter': 'best', 'min_samples_split': 0.09663433929998763, 'min_samples_leaf': 0.06762919892133093, 'min_weight_fraction_leaf': 0.04623898474424245, 'max_features': 0.9370065314121186}. Best is trial 448 with value: 0.8888507593246218.[0m
[32m[I 2022-04-13 12:07:05,169][0m Trial 842 finished with value: 0.5539710385276961 and parameters: {'splitter': 'best', 'min_samples_split': 0.12403665725191255, 'min_samples_leaf': 0.17101472765977616, 'min_weight_fraction_leaf': 0.03441955472618506, 'max_features': 0.9141727451816242}. Best is trial 448 with value: 0.8888507593246218.[0m
[32m[I 2022-04-13 12:07:07,117][0m Trial 843 finished with value: 0.8815353114705882 and parameters: {'splitter': 'best', 'min_samples_split': 0.10571235131031181, 'min_samples_leaf': 0.029081813772600676, 'min_weight_fraction_leaf': 0.06858920093696905, 'max_features': 0.9653567868744873}. Best is trial 448 with value: 0.8888507593246218.[0m
/media/san2_ssd/data/Workdir/survival/utils.py:305: RuntimeWarning: invalid value encountered in true_divide
  pdfs = np.gradient(1-survs,axis=1)/norms
/media/san2_ssd/data/Workdir/survival/utils.py:305: RuntimeWarning: invalid value encountered in true_divide
  pdfs = np.gradient(1-survs,axis=1)/norms
/media/san2_ssd/data/Workdir/survival/utils.py:305: RuntimeWarning: invalid value encountered in true_divide
  pdfs = np.gradient(1-survs,axis=1)/norms
[32m[I 2022-04-13 12:07:09,505][0m Trial 844 finished with value: 0.8855619952094068 and parameters: {'splitter': 'best', 'min_samples_split': 0.11490852499659336, 'min_samples_leaf': 0.05141421958673528, 'min_weight_fraction_leaf': 0.030782245199117167, 'max_features': 0.9819521712068006}. Best is trial 448 with value: 0.8888507593246218.[0m
/media/san2_ssd/data/Workdir/survival/utils.py:305: RuntimeWarning: invalid value encountered in true_divide
  pdfs = np.gradient(1-survs,axis=1)/norms
[32m[I 2022-04-13 12:07:12,327][0m Trial 845 finished with value: 0.8833879518644334 and parameters: {'splitter': 'best', 'min_samples_split': 0.1331393845445827, 'min_samples_leaf': 0.01856657245908255, 'min_weight_fraction_leaf': 0.05453508938550197, 'max_features': 0.9500746184268655}. Best is trial 448 with value: 0.8888507593246218.[0m
[32m[I 2022-04-13 12:07:13,465][0m Trial 846 finished with value: 0.8555134455156568 and parameters: {'splitter': 'best', 'min_samples_split': 0.09357840463187553, 'min_samples_leaf': 0.04302711187666061, 'min_weight_fraction_leaf': 0.04215760946037871, 'max_features': 0.2583001243183401}. Best is trial 448 with value: 0.8888507593246218.[0m
/media/san2_ssd/data/Workdir/survival/utils.py:305: RuntimeWarning: invalid value encountered in true_divide
  pdfs = np.gradient(1-survs,axis=1)/norms
/media/san2_ssd/data/Workdir/survival/utils.py:305: RuntimeWarning: invalid value encountered in true_divide
  pdfs = np.gradient(1-survs,axis=1)/norms
/media/san2_ssd/data/Workdir/survival/utils.py:305: RuntimeWarning: invalid value encountered in true_divide
  pdfs = np.gradient(1-survs,axis=1)/norms
[32m[I 2022-04-13 12:07:16,136][0m Trial 847 finished with value: 0.8830594594126877 and parameters: {'splitter': 'best', 'min_samples_split': 0.118858999968618, 'min_samples_leaf': 0.0301089594941931, 'min_weight_fraction_leaf': 0.028584784852732158, 'max_features': 0.9663345617886834}. Best is trial 448 with value: 0.8888507593246218.[0m
[32m[I 2022-04-13 12:07:18,171][0m Trial 848 finished with value: 0.5795707266352232 and parameters: {'splitter': 'best', 'min_samples_split': 0.10219417034204624, 'min_samples_leaf': 0.020757020820985052, 'min_weight_fraction_leaf': 0.12206407655516036, 'max_features': 0.9809588118525876}. Best is trial 448 with value: 0.8888507593246218.[0m
/media/san2_ssd/data/Workdir/survival/utils.py:305: RuntimeWarning: invalid value encountered in true_divide
  pdfs = np.gradient(1-survs,axis=1)/norms
/media/san2_ssd/data/Workdir/survival/utils.py:305: RuntimeWarning: invalid value encountered in true_divide
  pdfs = np.gradient(1-survs,axis=1)/norms
[32m[I 2022-04-13 12:07:20,550][0m Trial 849 finished with value: 0.8850214022960919 and parameters: {'splitter': 'best', 'min_samples_split': 0.08493189356109913, 'min_samples_leaf': 0.05604817837876338, 'min_weight_fraction_leaf': 0.04751669364241856, 'max_features': 0.999141741394184}. Best is trial 448 with value: 0.8888507593246218.[0m
/media/san2_ssd/data/Workdir/survival/utils.py:305: RuntimeWarning: invalid value encountered in true_divide
  pdfs = np.gradient(1-survs,axis=1)/norms
/media/san2_ssd/data/Workdir/survival/utils.py:305: RuntimeWarning: invalid value encountered in true_divide
  pdfs = np.gradient(1-survs,axis=1)/norms
[32m[I 2022-04-13 12:07:23,185][0m Trial 850 finished with value: 0.886068157174658 and parameters: {'splitter': 'best', 'min_samples_split': 0.14262585881793666, 'min_samples_leaf': 0.0014759823308151485, 'min_weight_fraction_leaf': 0.035571284409095565, 'max_features': 0.9999326853857744}. Best is trial 448 with value: 0.8888507593246218.[0m
[32m[I 2022-04-13 12:07:23,715][0m Trial 851 finished with value: 0.873916290431356 and parameters: {'splitter': 'random', 'min_samples_split': 0.11009466269997135, 'min_samples_leaf': 0.03754389521734955, 'min_weight_fraction_leaf': 0.057058797500309205, 'max_features': 0.9483222187444064}. Best is trial 448 with value: 0.8888507593246218.[0m
[32m[I 2022-04-13 12:07:25,626][0m Trial 852 finished with value: 0.8802842546775059 and parameters: {'splitter': 'best', 'min_samples_split': 0.12757177818216547, 'min_samples_leaf': 0.07815334887004105, 'min_weight_fraction_leaf': 0.02510288299870434, 'max_features': 0.970065006955347}. Best is trial 448 with value: 0.8888507593246218.[0m
/media/san2_ssd/data/Workdir/survival/utils.py:305: RuntimeWarning: invalid value encountered in true_divide
  pdfs = np.gradient(1-survs,axis=1)/norms
/media/san2_ssd/data/Workdir/survival/utils.py:305: RuntimeWarning: invalid value encountered in true_divide
  pdfs = np.gradient(1-survs,axis=1)/norms
/media/san2_ssd/data/Workdir/survival/utils.py:305: RuntimeWarning: invalid value encountered in true_divide
  pdfs = np.gradient(1-survs,axis=1)/norms
[32m[I 2022-04-13 12:07:28,417][0m Trial 853 finished with value: 0.8810223953705943 and parameters: {'splitter': 'best', 'min_samples_split': 0.11746710002593093, 'min_samples_leaf': 0.04392153787387505, 'min_weight_fraction_leaf': 0.04198243775571492, 'max_features': 0.9210910785549696}. Best is trial 448 with value: 0.8888507593246218.[0m
/media/san2_ssd/data/Workdir/survival/utils.py:305: RuntimeWarning: invalid value encountered in true_divide
  pdfs = np.gradient(1-survs,axis=1)/norms
/media/san2_ssd/data/Workdir/survival/utils.py:305: RuntimeWarning: invalid value encountered in true_divide
  pdfs = np.gradient(1-survs,axis=1)/norms
/media/san2_ssd/data/Workdir/survival/utils.py:305: RuntimeWarning: invalid value encountered in true_divide
  pdfs = np.gradient(1-survs,axis=1)/norms
/media/san2_ssd/data/Workdir/survival/utils.py:305: RuntimeWarning: invalid value encountered in true_divide
  pdfs = np.gradient(1-survs,axis=1)/norms
[32m[I 2022-04-13 12:07:32,136][0m Trial 854 finished with value: 0.8834924105907233 and parameters: {'splitter': 'best', 'min_samples_split': 0.10252988237142831, 'min_samples_leaf': 0.01094447946024648, 'min_weight_fraction_leaf': 0.03264337664308348, 'max_features': 0.9686463859816458}. Best is trial 448 with value: 0.8888507593246218.[0m
[32m[I 2022-04-13 12:07:32,719][0m Trial 855 finished with value: 0.6953987916579007 and parameters: {'splitter': 'best', 'min_samples_split': 0.1268284549415673, 'min_samples_leaf': 0.42103519803848216, 'min_weight_fraction_leaf': 0.02021859586928513, 'max_features': 0.9816728200299604}. Best is trial 448 with value: 0.8888507593246218.[0m
/media/san2_ssd/data/Workdir/survival/utils.py:305: RuntimeWarning: invalid value encountered in true_divide
  pdfs = np.gradient(1-survs,axis=1)/norms
/media/san2_ssd/data/Workdir/survival/utils.py:305: RuntimeWarning: invalid value encountered in true_divide
  pdfs = np.gradient(1-survs,axis=1)/norms
/media/san2_ssd/data/Workdir/survival/utils.py:305: RuntimeWarning: invalid value encountered in true_divide
  pdfs = np.gradient(1-survs,axis=1)/norms
[32m[I 2022-04-13 12:07:35,079][0m Trial 856 finished with value: 0.8829070845542383 and parameters: {'splitter': 'best', 'min_samples_split': 0.09000107212204016, 'min_samples_leaf': 0.030056844477720654, 'min_weight_fraction_leaf': 0.04813143271190351, 'max_features': 0.9459527899882343}. Best is trial 448 with value: 0.8888507593246218.[0m
[32m[I 2022-04-13 12:07:37,423][0m Trial 857 finished with value: 0.8841083146958276 and parameters: {'splitter': 'best', 'min_samples_split': 0.1133448460266458, 'min_samples_leaf': 0.020762692415417124, 'min_weight_fraction_leaf': 0.06611025166274839, 'max_features': 0.9832473262955346}. Best is trial 448 with value: 0.8888507593246218.[0m
/media/san2_ssd/data/Workdir/survival/utils.py:305: RuntimeWarning: invalid value encountered in true_divide
  pdfs = np.gradient(1-survs,axis=1)/norms
/media/san2_ssd/data/Workdir/survival/utils.py:305: RuntimeWarning: invalid value encountered in true_divide
  pdfs = np.gradient(1-survs,axis=1)/norms
/media/san2_ssd/data/Workdir/survival/utils.py:305: RuntimeWarning: invalid value encountered in true_divide
  pdfs = np.gradient(1-survs,axis=1)/norms
/media/san2_ssd/data/Workdir/survival/utils.py:305: RuntimeWarning: invalid value encountered in true_divide
  pdfs = np.gradient(1-survs,axis=1)/norms
/media/san2_ssd/data/Workdir/survival/utils.py:305: RuntimeWarning: invalid value encountered in true_divide
  pdfs = np.gradient(1-survs,axis=1)/norms
[32m[I 2022-04-13 12:07:39,786][0m Trial 858 finished with value: 0.8802486400775912 and parameters: {'splitter': 'best', 'min_samples_split': 0.07907689051482168, 'min_samples_leaf': 0.035623958351931044, 'min_weight_fraction_leaf': 0.0377364675647093, 'max_features': 0.9605446597961339}. Best is trial 448 with value: 0.8888507593246218.[0m
/media/san2_ssd/data/Workdir/survival/utils.py:305: RuntimeWarning: invalid value encountered in true_divide
  pdfs = np.gradient(1-survs,axis=1)/norms
/media/san2_ssd/data/Workdir/survival/utils.py:305: RuntimeWarning: invalid value encountered in true_divide
  pdfs = np.gradient(1-survs,axis=1)/norms
/media/san2_ssd/data/Workdir/survival/utils.py:305: RuntimeWarning: invalid value encountered in true_divide
  pdfs = np.gradient(1-survs,axis=1)/norms
[32m[I 2022-04-13 12:07:42,328][0m Trial 859 finished with value: 0.8854960649840372 and parameters: {'splitter': 'best', 'min_samples_split': 0.06848657614450428, 'min_samples_leaf': 0.049171277466586935, 'min_weight_fraction_leaf': 0.02699042917564093, 'max_features': 0.9993434782022604}. Best is trial 448 with value: 0.8888507593246218.[0m
/media/san2_ssd/data/Workdir/survival/utils.py:305: RuntimeWarning: invalid value encountered in true_divide
  pdfs = np.gradient(1-survs,axis=1)/norms
[32m[I 2022-04-13 12:07:44,530][0m Trial 860 finished with value: 0.7858829325546598 and parameters: {'splitter': 'best', 'min_samples_split': 0.13671270997180807, 'min_samples_leaf': 0.06060148947994002, 'min_weight_fraction_leaf': 0.015871528017604945, 'max_features': 0.9810134154391449}. Best is trial 448 with value: 0.8888507593246218.[0m
[32m[I 2022-04-13 12:07:47,268][0m Trial 861 finished with value: 0.8783134620276911 and parameters: {'splitter': 'best', 'min_samples_split': 0.18385942806955236, 'min_samples_leaf': 0.027606614858390558, 'min_weight_fraction_leaf': 0.055619308751917604, 'max_features': 0.9407862075577689}. Best is trial 448 with value: 0.8888507593246218.[0m
[32m[I 2022-04-13 12:07:48,456][0m Trial 862 finished with value: 0.45603438573193067 and parameters: {'splitter': 'best', 'min_samples_split': 0.44762317017790165, 'min_samples_leaf': 0.00941907763763783, 'min_weight_fraction_leaf': 0.03583985762679815, 'max_features': 0.9664152710891275}. Best is trial 448 with value: 0.8888507593246218.[0m
[32m[I 2022-04-13 12:07:49,344][0m Trial 863 finished with value: 0.4644795396195961 and parameters: {'splitter': 'best', 'min_samples_split': 0.10184717021788364, 'min_samples_leaf': 0.03988190376114202, 'min_weight_fraction_leaf': 0.20613679946550814, 'max_features': 0.9998158302447638}. Best is trial 448 with value: 0.8888507593246218.[0m
[32m[I 2022-04-13 12:07:51,636][0m Trial 864 finished with value: 0.8764195793046042 and parameters: {'splitter': 'best', 'min_samples_split': 0.12200077026207315, 'min_samples_leaf': 0.019313827537134433, 'min_weight_fraction_leaf': 0.045889749438653385, 'max_features': 0.4362239742731586}. Best is trial 448 with value: 0.8888507593246218.[0m
[32m[I 2022-04-13 12:07:54,067][0m Trial 865 finished with value: 0.7862036597391231 and parameters: {'splitter': 'best', 'min_samples_split': 0.15196842072674963, 'min_samples_leaf': 0.04676449997854122, 'min_weight_fraction_leaf': 0.07481341612888312, 'max_features': 0.9827522252433669}. Best is trial 448 with value: 0.8888507593246218.[0m
/media/san2_ssd/data/Workdir/survival/utils.py:305: RuntimeWarning: invalid value encountered in true_divide
  pdfs = np.gradient(1-survs,axis=1)/norms
[32m[I 2022-04-13 12:07:54,589][0m Trial 866 finished with value: 0.7682406865177025 and parameters: {'splitter': 'best', 'min_samples_split': 0.10962557087335892, 'min_samples_leaf': 0.03392067930055143, 'min_weight_fraction_leaf': 0.026044077139717455, 'max_features': 0.40006491837248914}. Best is trial 448 with value: 0.8888507593246218.[0m
[32m[I 2022-04-13 12:07:55,291][0m Trial 867 finished with value: 0.6959553449366455 and parameters: {'splitter': 'best', 'min_samples_split': 0.13032227537737584, 'min_samples_leaf': 0.3618978542288713, 'min_weight_fraction_leaf': 0.019527592962511352, 'max_features': 0.928637934096936}. Best is trial 448 with value: 0.8888507593246218.[0m
/media/san2_ssd/data/Workdir/survival/utils.py:305: RuntimeWarning: invalid value encountered in true_divide
  pdfs = np.gradient(1-survs,axis=1)/norms
/media/san2_ssd/data/Workdir/survival/utils.py:305: RuntimeWarning: invalid value encountered in true_divide
  pdfs = np.gradient(1-survs,axis=1)/norms
/media/san2_ssd/data/Workdir/survival/utils.py:305: RuntimeWarning: invalid value encountered in true_divide
  pdfs = np.gradient(1-survs,axis=1)/norms
/media/san2_ssd/data/Workdir/survival/utils.py:305: RuntimeWarning: invalid value encountered in true_divide
  pdfs = np.gradient(1-survs,axis=1)/norms
/media/san2_ssd/data/Workdir/survival/utils.py:305: RuntimeWarning: invalid value encountered in true_divide
  pdfs = np.gradient(1-survs,axis=1)/norms
[32m[I 2022-04-13 12:07:58,603][0m Trial 868 finished with value: 0.8831237495053147 and parameters: {'splitter': 'best', 'min_samples_split': 0.09732455533963509, 'min_samples_leaf': 0.023409913941966187, 'min_weight_fraction_leaf': 0.038714785863578315, 'max_features': 0.9562691742751638}. Best is trial 448 with value: 0.8888507593246218.[0m
/media/san2_ssd/data/Workdir/survival/utils.py:305: RuntimeWarning: invalid value encountered in true_divide
  pdfs = np.gradient(1-survs,axis=1)/norms
[32m[I 2022-04-13 12:08:00,538][0m Trial 869 finished with value: 0.8857694580205372 and parameters: {'splitter': 'best', 'min_samples_split': 0.11752005011105773, 'min_samples_leaf': 0.055945238333542986, 'min_weight_fraction_leaf': 0.06089287144669112, 'max_features': 0.9801210447028162}. Best is trial 448 with value: 0.8888507593246218.[0m
[32m[I 2022-04-13 12:08:01,095][0m Trial 870 finished with value: 0.6971226324145205 and parameters: {'splitter': 'best', 'min_samples_split': 0.051507202137539954, 'min_samples_leaf': 0.3891371990745215, 'min_weight_fraction_leaf': 0.03016474764710614, 'max_features': 0.9559827255234336}. Best is trial 448 with value: 0.8888507593246218.[0m
[32m[I 2022-04-13 12:08:01,703][0m Trial 871 finished with value: 0.8709417872891656 and parameters: {'splitter': 'random', 'min_samples_split': 0.1070465130116743, 'min_samples_leaf': 0.013451469559917597, 'min_weight_fraction_leaf': 0.048209904102822526, 'max_features': 0.9821455862873961}. Best is trial 448 with value: 0.8888507593246218.[0m
/media/san2_ssd/data/Workdir/survival/utils.py:305: RuntimeWarning: invalid value encountered in true_divide
  pdfs = np.gradient(1-survs,axis=1)/norms
