[32m[I 2022-04-15 04:35:37,662][0m Trial 295 finished with value: 0.6743624146605087 and parameters: {'loss': 'coxph', 'learning_rate': 0.053150954302691324, 'n_estimators': 194, 'criterion': 'friedman_mse', 'min_samples_split': 2, 'min_samples_leaf': 7, 'min_weight_fraction_leaf': 0.2833181887319024, 'min_impurity_decrease': 0.9628437380736578, 'max_features': 0.7361749138825794, 'subsample': 0.6604890630730514, 'dropout_rate': 0.1570130178283112, 'ccp_alpha': 0.16506745602974573}. Best is trial 159 with value: 0.7654372273354745.[0m
[32m[I 2022-04-15 04:35:55,117][0m Trial 296 finished with value: 0.5 and parameters: {'loss': 'coxph', 'learning_rate': 0.05089255658109151, 'n_estimators': 185, 'criterion': 'squared_error', 'min_samples_split': 2, 'min_samples_leaf': 7, 'min_weight_fraction_leaf': 0.2976404912584194, 'min_impurity_decrease': 0.9557374013452415, 'max_features': 0.7325936003060293, 'subsample': 0.7065637498730162, 'dropout_rate': 0.16928438084247138, 'ccp_alpha': 0.1033472302288776}. Best is trial 159 with value: 0.7654372273354745.[0m
[32m[I 2022-04-15 04:36:17,677][0m Trial 297 finished with value: 0.5 and parameters: {'loss': 'coxph', 'learning_rate': 0.08108223829631656, 'n_estimators': 206, 'criterion': 'friedman_mse', 'min_samples_split': 2, 'min_samples_leaf': 7, 'min_weight_fraction_leaf': 0.28085731269300207, 'min_impurity_decrease': 0.9998312647548031, 'max_features': 0.7220213893029712, 'subsample': 0.6968925494525814, 'dropout_rate': 0.04987593358915809, 'ccp_alpha': 0.25689446385464765}. Best is trial 159 with value: 0.7654372273354745.[0m
[32m[I 2022-04-15 04:36:38,725][0m Trial 298 finished with value: 0.6743624146605087 and parameters: {'loss': 'coxph', 'learning_rate': 0.060530838387884846, 'n_estimators': 197, 'criterion': 'friedman_mse', 'min_samples_split': 2, 'min_samples_leaf': 7, 'min_weight_fraction_leaf': 0.28738293202131554, 'min_impurity_decrease': 0.8668588964417585, 'max_features': 0.8545349640907831, 'subsample': 0.6353464431326552, 'dropout_rate': 0.20659648386524926, 'ccp_alpha': 0.10202861141723091}. Best is trial 159 with value: 0.7654372273354745.[0m
[32m[I 2022-04-15 04:36:55,109][0m Trial 299 finished with value: 0.6743624146605087 and parameters: {'loss': 'coxph', 'learning_rate': 0.07989183904386081, 'n_estimators': 171, 'criterion': 'friedman_mse', 'min_samples_split': 3, 'min_samples_leaf': 6, 'min_weight_fraction_leaf': 0.2995598484722403, 'min_impurity_decrease': 0.8927193746861977, 'max_features': 0.7970062691763324, 'subsample': 0.676958599424416, 'dropout_rate': 0.11711892766188749, 'ccp_alpha': 0.17729845525978516}. Best is trial 159 with value: 0.7654372273354745.[0m
[32m[I 2022-04-15 04:37:14,979][0m Trial 300 finished with value: 0.7574119156472224 and parameters: {'loss': 'coxph', 'learning_rate': 0.097731636951273, 'n_estimators': 187, 'criterion': 'friedman_mse', 'min_samples_split': 2, 'min_samples_leaf': 6, 'min_weight_fraction_leaf': 0.31267145716105005, 'min_impurity_decrease': 0.9816088401998911, 'max_features': 0.7509708130984011, 'subsample': 0.6845750935407965, 'dropout_rate': 0.11372592986512314, 'ccp_alpha': 0.0059726009366656944}. Best is trial 159 with value: 0.7654372273354745.[0m
[32m[I 2022-04-15 04:37:35,555][0m Trial 301 finished with value: 0.5 and parameters: {'loss': 'coxph', 'learning_rate': 0.061707678099603605, 'n_estimators': 205, 'criterion': 'friedman_mse', 'min_samples_split': 2, 'min_samples_leaf': 7, 'min_weight_fraction_leaf': 0.2880858540713782, 'min_impurity_decrease': 0.9582537560490298, 'max_features': 0.7353589899865393, 'subsample': 0.7214886136553004, 'dropout_rate': 0.05968454983500868, 'ccp_alpha': 0.2795223268085959}. Best is trial 159 with value: 0.7654372273354745.[0m
[32m[I 2022-04-15 04:37:52,096][0m Trial 302 finished with value: 0.6743624146605087 and parameters: {'loss': 'coxph', 'learning_rate': 0.04879074529282417, 'n_estimators': 180, 'criterion': 'friedman_mse', 'min_samples_split': 2, 'min_samples_leaf': 6, 'min_weight_fraction_leaf': 0.29724347048735406, 'min_impurity_decrease': 0.9053228455909824, 'max_features': 0.7129127061897903, 'subsample': 0.6207785315612809, 'dropout_rate': 0.13745146345207732, 'ccp_alpha': 0.09774230695783004}. Best is trial 159 with value: 0.7654372273354745.[0m
[32m[I 2022-04-15 04:38:13,491][0m Trial 303 finished with value: 0.6743624146605087 and parameters: {'loss': 'coxph', 'learning_rate': 0.06744705797911991, 'n_estimators': 197, 'criterion': 'friedman_mse', 'min_samples_split': 2, 'min_samples_leaf': 6, 'min_weight_fraction_leaf': 0.2668545311857283, 'min_impurity_decrease': 0.9473068237929837, 'max_features': 0.769444104075223, 'subsample': 0.6336185534662852, 'dropout_rate': 0.04310987144265555, 'ccp_alpha': 0.09903070476877923}. Best is trial 159 with value: 0.7654372273354745.[0m
[32m[I 2022-04-15 04:38:35,436][0m Trial 304 finished with value: 0.5 and parameters: {'loss': 'coxph', 'learning_rate': 0.08395257113144615, 'n_estimators': 207, 'criterion': 'friedman_mse', 'min_samples_split': 2, 'min_samples_leaf': 6, 'min_weight_fraction_leaf': 0.3043418624651408, 'min_impurity_decrease': 0.8776370989901627, 'max_features': 0.7466415578254924, 'subsample': 0.6075021168193111, 'dropout_rate': 0.10970793993782811, 'ccp_alpha': 0.48205898267935177}. Best is trial 159 with value: 0.7654372273354745.[0m
[32m[I 2022-04-15 04:38:51,499][0m Trial 305 finished with value: 0.5660452785959845 and parameters: {'loss': 'coxph', 'learning_rate': 0.05127959995214197, 'n_estimators': 171, 'criterion': 'friedman_mse', 'min_samples_split': 2, 'min_samples_leaf': 6, 'min_weight_fraction_leaf': 0.2777095931267799, 'min_impurity_decrease': 0.9797233620119616, 'max_features': 0.7010693195755153, 'subsample': 0.6675959509796909, 'dropout_rate': 0.06771961362173877, 'ccp_alpha': 0.19754540907279797}. Best is trial 159 with value: 0.7654372273354745.[0m
[32m[I 2022-04-15 04:39:09,309][0m Trial 306 finished with value: 0.6743624146605087 and parameters: {'loss': 'coxph', 'learning_rate': 0.09827526955867921, 'n_estimators': 188, 'criterion': 'friedman_mse', 'min_samples_split': 2, 'min_samples_leaf': 6, 'min_weight_fraction_leaf': 0.2874173476091121, 'min_impurity_decrease': 0.9087970372584381, 'max_features': 0.7249614011299413, 'subsample': 0.6431050740142055, 'dropout_rate': 0.1628265988257036, 'ccp_alpha': 0.09136406493937321}. Best is trial 159 with value: 0.7654372273354745.[0m
[32m[I 2022-04-15 04:39:28,610][0m Trial 307 finished with value: 0.7561275414295917 and parameters: {'loss': 'coxph', 'learning_rate': 0.06895862612092488, 'n_estimators': 193, 'criterion': 'friedman_mse', 'min_samples_split': 2, 'min_samples_leaf': 7, 'min_weight_fraction_leaf': 0.3153625381738619, 'min_impurity_decrease': 0.9265498709650749, 'max_features': 0.7923815316268145, 'subsample': 0.6168042354199704, 'dropout_rate': 0.09754270424245552, 'ccp_alpha': 0.0026420598742993868}. Best is trial 159 with value: 0.7654372273354745.[0m
[32m[I 2022-04-15 04:39:56,791][0m Trial 308 finished with value: 0.7625141907543582 and parameters: {'loss': 'coxph', 'learning_rate': 0.045805774021066885, 'n_estimators': 244, 'criterion': 'friedman_mse', 'min_samples_split': 2, 'min_samples_leaf': 6, 'min_weight_fraction_leaf': 0.30004870834550956, 'min_impurity_decrease': 0.9640033908232474, 'max_features': 0.7509974207134904, 'subsample': 0.5444412447197922, 'dropout_rate': 0.07041748381473165, 'ccp_alpha': 0.0018744233888423989}. Best is trial 159 with value: 0.7654372273354745.[0m
[32m[I 2022-04-15 04:40:26,025][0m Trial 309 finished with value: 0.6743624146605087 and parameters: {'loss': 'coxph', 'learning_rate': 0.04134741299198969, 'n_estimators': 249, 'criterion': 'friedman_mse', 'min_samples_split': 2, 'min_samples_leaf': 6, 'min_weight_fraction_leaf': 0.29380112423752736, 'min_impurity_decrease': 0.9639043774989944, 'max_features': 0.7667192071127009, 'subsample': 0.5397659224974728, 'dropout_rate': 0.04180150274065931, 'ccp_alpha': 0.18795634565203934}. Best is trial 159 with value: 0.7654372273354745.[0m
[32m[I 2022-04-15 04:40:52,564][0m Trial 310 finished with value: 0.5 and parameters: {'loss': 'coxph', 'learning_rate': 0.04659140667957718, 'n_estimators': 239, 'criterion': 'friedman_mse', 'min_samples_split': 2, 'min_samples_leaf': 6, 'min_weight_fraction_leaf': 0.2761578115545928, 'min_impurity_decrease': 0.9772918555145459, 'max_features': 0.7492196144708548, 'subsample': 0.6555839688258929, 'dropout_rate': 0.06828134286732816, 'ccp_alpha': 0.3229381664633103}. Best is trial 159 with value: 0.7654372273354745.[0m
[32m[I 2022-04-15 04:41:17,273][0m Trial 311 finished with value: 0.7612473969210173 and parameters: {'loss': 'coxph', 'learning_rate': 0.03373830751981976, 'n_estimators': 208, 'criterion': 'friedman_mse', 'min_samples_split': 3, 'min_samples_leaf': 6, 'min_weight_fraction_leaf': 0.2618624884879046, 'min_impurity_decrease': 0.947999557814044, 'max_features': 0.8130512589864588, 'subsample': 0.606035262690623, 'dropout_rate': 0.11220689616103849, 'ccp_alpha': 0.003000569089678126}. Best is trial 159 with value: 0.7654372273354745.[0m
[32m[I 2022-04-15 04:41:36,206][0m Trial 312 finished with value: 0.6743624146605087 and parameters: {'loss': 'coxph', 'learning_rate': 0.05504860123882853, 'n_estimators': 179, 'criterion': 'friedman_mse', 'min_samples_split': 2, 'min_samples_leaf': 7, 'min_weight_fraction_leaf': 0.2859053373076702, 'min_impurity_decrease': 0.9989273067939325, 'max_features': 0.7795354864122683, 'subsample': 0.5305438019261698, 'dropout_rate': 0.13522118212158496, 'ccp_alpha': 0.10332470391839135}. Best is trial 159 with value: 0.7654372273354745.[0m
[32m[I 2022-04-15 04:42:08,097][0m Trial 313 finished with value: 0.6743624146605087 and parameters: {'loss': 'coxph', 'learning_rate': 0.08389888845566953, 'n_estimators': 269, 'criterion': 'friedman_mse', 'min_samples_split': 2, 'min_samples_leaf': 6, 'min_weight_fraction_leaf': 0.3008951664463453, 'min_impurity_decrease': 0.9493649814009517, 'max_features': 0.7324207369257103, 'subsample': 0.6376303665212675, 'dropout_rate': 0.048126003756109446, 'ccp_alpha': 0.16974298784589703}. Best is trial 159 with value: 0.7654372273354745.[0m
[32m[I 2022-04-15 04:42:30,220][0m Trial 314 finished with value: 0.6743624146605087 and parameters: {'loss': 'coxph', 'learning_rate': 0.06071558049035826, 'n_estimators': 216, 'criterion': 'friedman_mse', 'min_samples_split': 2, 'min_samples_leaf': 6, 'min_weight_fraction_leaf': 0.31474021078665415, 'min_impurity_decrease': 0.8612349459844096, 'max_features': 0.6844674889166169, 'subsample': 0.5917531326180757, 'dropout_rate': 0.09030478288335998, 'ccp_alpha': 0.10487394874626384}. Best is trial 159 with value: 0.7654372273354745.[0m
[32m[I 2022-04-15 04:42:54,264][0m Trial 315 finished with value: 0.5 and parameters: {'loss': 'coxph', 'learning_rate': 0.07964292428106082, 'n_estimators': 222, 'criterion': 'friedman_mse', 'min_samples_split': 2, 'min_samples_leaf': 6, 'min_weight_fraction_leaf': 0.2732434628283839, 'min_impurity_decrease': 0.9722004556277913, 'max_features': 0.7524070281813853, 'subsample': 0.5438244999787488, 'dropout_rate': 0.06483414720746991, 'ccp_alpha': 0.24279466437595554}. Best is trial 159 with value: 0.7654372273354745.[0m
[32m[I 2022-04-15 04:43:19,964][0m Trial 316 finished with value: 0.7604243744771648 and parameters: {'loss': 'coxph', 'learning_rate': 0.041594651142625644, 'n_estimators': 225, 'criterion': 'friedman_mse', 'min_samples_split': 2, 'min_samples_leaf': 7, 'min_weight_fraction_leaf': 0.24470699551403768, 'min_impurity_decrease': 0.9120240404856523, 'max_features': 0.7222074781249002, 'subsample': 0.6868116245678924, 'dropout_rate': 0.12596512541504254, 'ccp_alpha': 0.004559808696169639}. Best is trial 159 with value: 0.7654372273354745.[0m
[32m[I 2022-04-15 04:43:34,748][0m Trial 317 finished with value: 0.6743624146605087 and parameters: {'loss': 'coxph', 'learning_rate': 0.0676291570162777, 'n_estimators': 169, 'criterion': 'friedman_mse', 'min_samples_split': 2, 'min_samples_leaf': 6, 'min_weight_fraction_leaf': 0.2919755826652528, 'min_impurity_decrease': 0.9414713473978547, 'max_features': 0.698101730371959, 'subsample': 0.6145001408432752, 'dropout_rate': 0.16948492767197487, 'ccp_alpha': 0.10211377942193836}. Best is trial 159 with value: 0.7654372273354745.[0m
[32m[I 2022-04-15 04:43:56,415][0m Trial 318 finished with value: 0.5 and parameters: {'loss': 'coxph', 'learning_rate': 0.09823777156572829, 'n_estimators': 202, 'criterion': 'squared_error', 'min_samples_split': 2, 'min_samples_leaf': 6, 'min_weight_fraction_leaf': 0.30662868348071926, 'min_impurity_decrease': 0.8915030096167771, 'max_features': 0.7843336836001107, 'subsample': 0.546504147161107, 'dropout_rate': 0.10151406549770406, 'ccp_alpha': 0.002339622896704808}. Best is trial 159 with value: 0.7654372273354745.[0m
[32m[I 2022-04-15 04:44:23,860][0m Trial 319 finished with value: 0.6743624146605087 and parameters: {'loss': 'coxph', 'learning_rate': 9.353124993304759e-06, 'n_estimators': 231, 'criterion': 'friedman_mse', 'min_samples_split': 3, 'min_samples_leaf': 6, 'min_weight_fraction_leaf': 0.2792608526840503, 'min_impurity_decrease': 0.9668740006429986, 'max_features': 0.743435943809821, 'subsample': 0.5843623874882485, 'dropout_rate': 0.040261691736093355, 'ccp_alpha': 0.18641213642883936}. Best is trial 159 with value: 0.7654372273354745.[0m
[32m[I 2022-04-15 04:44:41,971][0m Trial 320 finished with value: 0.6840441386124001 and parameters: {'loss': 'coxph', 'learning_rate': 0.052339790378355525, 'n_estimators': 181, 'criterion': 'friedman_mse', 'min_samples_split': 2, 'min_samples_leaf': 7, 'min_weight_fraction_leaf': 0.29862150700973716, 'min_impurity_decrease': 0.9172167995171937, 'max_features': 0.6747061085321585, 'subsample': 0.5232759700875299, 'dropout_rate': 0.07713776836369887, 'ccp_alpha': 0.09299954349942181}. Best is trial 159 with value: 0.7654372273354745.[0m
[32m[I 2022-04-15 04:44:56,351][0m Trial 321 finished with value: 0.5 and parameters: {'loss': 'coxph', 'learning_rate': 0.030626259174061008, 'n_estimators': 156, 'criterion': 'friedman_mse', 'min_samples_split': 2, 'min_samples_leaf': 6, 'min_weight_fraction_leaf': 0.25221091537637613, 'min_impurity_decrease': 0.9415649229953417, 'max_features': 0.7681246665421891, 'subsample': 0.6312272133332473, 'dropout_rate': 0.05951498532405612, 'ccp_alpha': 0.3033321704486628}. Best is trial 159 with value: 0.7654372273354745.[0m
[32m[I 2022-04-15 04:45:14,428][0m Trial 322 finished with value: 0.7567851773353663 and parameters: {'loss': 'coxph', 'learning_rate': 0.08243780059223253, 'n_estimators': 186, 'criterion': 'friedman_mse', 'min_samples_split': 2, 'min_samples_leaf': 6, 'min_weight_fraction_leaf': 0.3185427992854738, 'min_impurity_decrease': 0.9840997444829451, 'max_features': 0.7144422839466743, 'subsample': 0.5597088693683199, 'dropout_rate': 0.10599681817559786, 'ccp_alpha': 0.0037546782426313534}. Best is trial 159 with value: 0.7654372273354745.[0m
[32m[I 2022-04-15 04:45:35,734][0m Trial 323 finished with value: 0.6743624146605087 and parameters: {'loss': 'coxph', 'learning_rate': 0.0443638851182044, 'n_estimators': 209, 'criterion': 'friedman_mse', 'min_samples_split': 2, 'min_samples_leaf': 7, 'min_weight_fraction_leaf': 0.28786451218703185, 'min_impurity_decrease': 0.8857844016095101, 'max_features': 0.7386856220078103, 'subsample': 0.6493346145986186, 'dropout_rate': 0.024311659839585636, 'ccp_alpha': 0.17153922797290838}. Best is trial 159 with value: 0.7654372273354745.[0m
[32m[I 2022-04-15 04:45:51,129][0m Trial 324 finished with value: 0.6743624146605087 and parameters: {'loss': 'coxph', 'learning_rate': 0.06693932988998524, 'n_estimators': 173, 'criterion': 'friedman_mse', 'min_samples_split': 2, 'min_samples_leaf': 6, 'min_weight_fraction_leaf': 0.3057471462323523, 'min_impurity_decrease': 0.9591041573131606, 'max_features': 0.7622738147835427, 'subsample': 0.606604655007576, 'dropout_rate': 0.14575928573349362, 'ccp_alpha': 0.10040400638136296}. Best is trial 159 with value: 0.7654372273354745.[0m
[32m[I 2022-04-15 04:46:12,326][0m Trial 325 finished with value: 0.7616467701034024 and parameters: {'loss': 'coxph', 'learning_rate': 0.09855674686140335, 'n_estimators': 194, 'criterion': 'friedman_mse', 'min_samples_split': 2, 'min_samples_leaf': 6, 'min_weight_fraction_leaf': 0.26409060295658915, 'min_impurity_decrease': 0.9261219143356859, 'max_features': 0.6961718429887124, 'subsample': 0.5241518458983659, 'dropout_rate': 0.08343152169752084, 'ccp_alpha': 0.002060456748312929}. Best is trial 159 with value: 0.7654372273354745.[0m
[32m[I 2022-04-15 04:46:32,013][0m Trial 326 finished with value: 0.5301157883717103 and parameters: {'loss': 'coxph', 'learning_rate': 0.09775335112609317, 'n_estimators': 189, 'criterion': 'friedman_mse', 'min_samples_split': 2, 'min_samples_leaf': 6, 'min_weight_fraction_leaf': 0.2614488656528175, 'min_impurity_decrease': 0.8711689636193639, 'max_features': 0.6765748739889638, 'subsample': 0.5222911149648805, 'dropout_rate': 0.08970254459907111, 'ccp_alpha': 0.20862098179344354}. Best is trial 159 with value: 0.7654372273354745.[0m
[32m[I 2022-04-15 04:46:45,575][0m Trial 327 finished with value: 0.6840441386124001 and parameters: {'loss': 'coxph', 'learning_rate': 0.08059410871036661, 'n_estimators': 147, 'criterion': 'friedman_mse', 'min_samples_split': 2, 'min_samples_leaf': 6, 'min_weight_fraction_leaf': 0.27363469355812486, 'min_impurity_decrease': 0.8438880160736724, 'max_features': 0.7026184847431388, 'subsample': 0.497391427877618, 'dropout_rate': 0.07268305158729041, 'ccp_alpha': 0.09903242118599302}. Best is trial 159 with value: 0.7654372273354745.[0m
[32m[I 2022-04-15 04:47:02,820][0m Trial 328 finished with value: 0.5 and parameters: {'loss': 'coxph', 'learning_rate': 0.09913060439050533, 'n_estimators': 177, 'criterion': 'friedman_mse', 'min_samples_split': 2, 'min_samples_leaf': 6, 'min_weight_fraction_leaf': 0.2666088679074893, 'min_impurity_decrease': 0.8996289012736918, 'max_features': 0.6876855038903481, 'subsample': 0.5463293883261947, 'dropout_rate': 0.05316003729136361, 'ccp_alpha': 4.969564661854044}. Best is trial 159 with value: 0.7654372273354745.[0m
[32m[I 2022-04-15 04:47:19,485][0m Trial 329 finished with value: 0.5 and parameters: {'loss': 'coxph', 'learning_rate': 0.07009330544655856, 'n_estimators': 168, 'criterion': 'friedman_mse', 'min_samples_split': 2, 'min_samples_leaf': 6, 'min_weight_fraction_leaf': 0.28108145075833896, 'min_impurity_decrease': 0.9236780950397989, 'max_features': 0.6633894015949386, 'subsample': 0.5175109511842035, 'dropout_rate': 0.09052548526254012, 'ccp_alpha': 0.3444272728910731}. Best is trial 159 with value: 0.7654372273354745.[0m
[32m[I 2022-04-15 04:47:38,709][0m Trial 330 finished with value: 0.6743624146605087 and parameters: {'loss': 'coxph', 'learning_rate': 0.0792176171202662, 'n_estimators': 197, 'criterion': 'friedman_mse', 'min_samples_split': 3, 'min_samples_leaf': 6, 'min_weight_fraction_leaf': 0.2962640789027524, 'min_impurity_decrease': 0.9198553793142852, 'max_features': 0.7129748462116613, 'subsample': 0.5691384711084861, 'dropout_rate': 0.12059258781802631, 'ccp_alpha': 0.11181832607847769}. Best is trial 159 with value: 0.7654372273354745.[0m
[32m[I 2022-04-15 04:48:01,113][0m Trial 331 finished with value: 0.5 and parameters: {'loss': 'coxph', 'learning_rate': 0.06176947645135159, 'n_estimators': 213, 'criterion': 'friedman_mse', 'min_samples_split': 2, 'min_samples_leaf': 6, 'min_weight_fraction_leaf': 0.31067674766233105, 'min_impurity_decrease': 0.9834540110652434, 'max_features': 0.8023862653873208, 'subsample': 0.5381706047688414, 'dropout_rate': 0.07226941985428399, 'ccp_alpha': 0.2623623054136335}. Best is trial 159 with value: 0.7654372273354745.[0m
[32m[I 2022-04-15 04:48:20,777][0m Trial 332 finished with value: 0.6743624146605087 and parameters: {'loss': 'coxph', 'learning_rate': 0.09882577311636202, 'n_estimators': 187, 'criterion': 'friedman_mse', 'min_samples_split': 2, 'min_samples_leaf': 6, 'min_weight_fraction_leaf': 0.3218536240135928, 'min_impurity_decrease': 0.8986588104711162, 'max_features': 0.6391410626281686, 'subsample': 0.5771888882170635, 'dropout_rate': 0.042798944673910794, 'ccp_alpha': 0.1692958551358913}. Best is trial 159 with value: 0.7654372273354745.[0m
[32m[I 2022-04-15 04:48:35,994][0m Trial 333 finished with value: 0.6931340451244224 and parameters: {'loss': 'coxph', 'learning_rate': 0.07763977132188322, 'n_estimators': 158, 'criterion': 'friedman_mse', 'min_samples_split': 2, 'min_samples_leaf': 6, 'min_weight_fraction_leaf': 0.26904065219625456, 'min_impurity_decrease': 0.9373921889425783, 'max_features': 0.6902190953063511, 'subsample': 0.5170375080943787, 'dropout_rate': 0.1023289221498938, 'ccp_alpha': 0.0898723169897848}. Best is trial 159 with value: 0.7654372273354745.[0m
[32m[I 2022-04-15 04:48:57,534][0m Trial 334 finished with value: 0.6939697080844383 and parameters: {'loss': 'coxph', 'learning_rate': 0.061616425679353486, 'n_estimators': 199, 'criterion': 'friedman_mse', 'min_samples_split': 2, 'min_samples_leaf': 6, 'min_weight_fraction_leaf': 0.28409226777782837, 'min_impurity_decrease': 0.9992406768260382, 'max_features': 0.7177986156801567, 'subsample': 0.48992931099582615, 'dropout_rate': 0.01969314615833808, 'ccp_alpha': 0.08710712876778583}. Best is trial 159 with value: 0.7654372273354745.[0m
