[32m[I 2022-04-13 12:03:21,737][0m Trial 731 finished with value: 0.8815576907488982 and parameters: {'splitter': 'best', 'min_samples_split': 0.14772337039758177, 'min_samples_leaf': 0.03372820324252372, 'min_weight_fraction_leaf': 0.04449615161320743, 'max_features': 0.9438665932293238}. Best is trial 448 with value: 0.8888507593246218.[0m
/media/san2_ssd/data/Workdir/survival/utils.py:305: RuntimeWarning: invalid value encountered in true_divide
  pdfs = np.gradient(1-survs,axis=1)/norms
/media/san2_ssd/data/Workdir/survival/utils.py:305: RuntimeWarning: invalid value encountered in true_divide
  pdfs = np.gradient(1-survs,axis=1)/norms
/media/san2_ssd/data/Workdir/survival/utils.py:305: RuntimeWarning: invalid value encountered in true_divide
  pdfs = np.gradient(1-survs,axis=1)/norms
[32m[I 2022-04-13 12:03:24,635][0m Trial 732 finished with value: 0.8837966261383119 and parameters: {'splitter': 'best', 'min_samples_split': 0.07597266321635823, 'min_samples_leaf': 0.04928618034978289, 'min_weight_fraction_leaf': 0.010439549660995225, 'max_features': 0.9709567494514734}. Best is trial 448 with value: 0.8888507593246218.[0m
/media/san2_ssd/data/Workdir/survival/utils.py:305: RuntimeWarning: invalid value encountered in true_divide
  pdfs = np.gradient(1-survs,axis=1)/norms
/media/san2_ssd/data/Workdir/survival/utils.py:305: RuntimeWarning: invalid value encountered in true_divide
  pdfs = np.gradient(1-survs,axis=1)/norms
/media/san2_ssd/data/Workdir/survival/utils.py:305: RuntimeWarning: invalid value encountered in true_divide
  pdfs = np.gradient(1-survs,axis=1)/norms
[32m[I 2022-04-13 12:03:27,137][0m Trial 733 finished with value: 0.8854912790244963 and parameters: {'splitter': 'best', 'min_samples_split': 0.0888474496834887, 'min_samples_leaf': 0.028511817651306018, 'min_weight_fraction_leaf': 0.05386215017446341, 'max_features': 0.9781977830381384}. Best is trial 448 with value: 0.8888507593246218.[0m
/media/san2_ssd/data/Workdir/survival/utils.py:305: RuntimeWarning: invalid value encountered in true_divide
  pdfs = np.gradient(1-survs,axis=1)/norms
/media/san2_ssd/data/Workdir/survival/utils.py:305: RuntimeWarning: invalid value encountered in true_divide
  pdfs = np.gradient(1-survs,axis=1)/norms
/media/san2_ssd/data/Workdir/survival/utils.py:305: RuntimeWarning: invalid value encountered in true_divide
  pdfs = np.gradient(1-survs,axis=1)/norms
/media/san2_ssd/data/Workdir/survival/utils.py:305: RuntimeWarning: invalid value encountered in true_divide
  pdfs = np.gradient(1-survs,axis=1)/norms
[32m[I 2022-04-13 12:03:29,004][0m Trial 734 finished with value: 0.8862709223624341 and parameters: {'splitter': 'best', 'min_samples_split': 0.1160715935649409, 'min_samples_leaf': 0.0073223804732973335, 'min_weight_fraction_leaf': 0.029397497932584275, 'max_features': 0.983732446174987}. Best is trial 448 with value: 0.8888507593246218.[0m
[32m[I 2022-04-13 12:03:29,429][0m Trial 735 finished with value: 0.6650584159101485 and parameters: {'splitter': 'random', 'min_samples_split': 0.3424920779082417, 'min_samples_leaf': 0.011106829300564065, 'min_weight_fraction_leaf': 0.04005031975412027, 'max_features': 0.9836385128945644}. Best is trial 448 with value: 0.8888507593246218.[0m
/media/san2_ssd/data/Workdir/survival/utils.py:305: RuntimeWarning: invalid value encountered in true_divide
  pdfs = np.gradient(1-survs,axis=1)/norms
/media/san2_ssd/data/Workdir/survival/utils.py:305: RuntimeWarning: invalid value encountered in true_divide
  pdfs = np.gradient(1-survs,axis=1)/norms
/media/san2_ssd/data/Workdir/survival/utils.py:305: RuntimeWarning: invalid value encountered in true_divide
  pdfs = np.gradient(1-survs,axis=1)/norms
/media/san2_ssd/data/Workdir/survival/utils.py:305: RuntimeWarning: invalid value encountered in true_divide
  pdfs = np.gradient(1-survs,axis=1)/norms
/media/san2_ssd/data/Workdir/survival/utils.py:305: RuntimeWarning: invalid value encountered in true_divide
  pdfs = np.gradient(1-survs,axis=1)/norms
[32m[I 2022-04-13 12:03:32,126][0m Trial 736 finished with value: 0.8842663704330646 and parameters: {'splitter': 'best', 'min_samples_split': 0.06790758405169699, 'min_samples_leaf': 0.04121543515844828, 'min_weight_fraction_leaf': 0.017677958661630352, 'max_features': 0.9375259452053153}. Best is trial 448 with value: 0.8888507593246218.[0m
/media/san2_ssd/data/Workdir/survival/utils.py:305: RuntimeWarning: invalid value encountered in true_divide
  pdfs = np.gradient(1-survs,axis=1)/norms
/media/san2_ssd/data/Workdir/survival/utils.py:305: RuntimeWarning: invalid value encountered in true_divide
  pdfs = np.gradient(1-survs,axis=1)/norms
/media/san2_ssd/data/Workdir/survival/utils.py:305: RuntimeWarning: invalid value encountered in true_divide
  pdfs = np.gradient(1-survs,axis=1)/norms
/media/san2_ssd/data/Workdir/survival/utils.py:305: RuntimeWarning: invalid value encountered in true_divide
  pdfs = np.gradient(1-survs,axis=1)/norms
[32m[I 2022-04-13 12:03:35,093][0m Trial 737 finished with value: 0.8829986047919217 and parameters: {'splitter': 'best', 'min_samples_split': 0.10189213372658096, 'min_samples_leaf': 0.0010704843608838749, 'min_weight_fraction_leaf': 0.031164746434604172, 'max_features': 0.9543098119645401}. Best is trial 448 with value: 0.8888507593246218.[0m
[32m[I 2022-04-13 12:03:36,827][0m Trial 738 finished with value: 0.8800085537324851 and parameters: {'splitter': 'best', 'min_samples_split': 0.13073930419556662, 'min_samples_leaf': 0.01766498211319449, 'min_weight_fraction_leaf': 0.06309837011512316, 'max_features': 0.8243034448343486}. Best is trial 448 with value: 0.8888507593246218.[0m
/media/san2_ssd/data/Workdir/survival/utils.py:305: RuntimeWarning: invalid value encountered in true_divide
  pdfs = np.gradient(1-survs,axis=1)/norms
/media/san2_ssd/data/Workdir/survival/utils.py:305: RuntimeWarning: invalid value encountered in true_divide
  pdfs = np.gradient(1-survs,axis=1)/norms
/media/san2_ssd/data/Workdir/survival/utils.py:305: RuntimeWarning: invalid value encountered in true_divide
  pdfs = np.gradient(1-survs,axis=1)/norms
[32m[I 2022-04-13 12:03:38,519][0m Trial 739 finished with value: 0.886036120924088 and parameters: {'splitter': 'best', 'min_samples_split': 0.10923490704864675, 'min_samples_leaf': 0.02327895613423804, 'min_weight_fraction_leaf': 0.048450218394278335, 'max_features': 0.984868249888619}. Best is trial 448 with value: 0.8888507593246218.[0m
/media/san2_ssd/data/Workdir/survival/utils.py:305: RuntimeWarning: invalid value encountered in true_divide
  pdfs = np.gradient(1-survs,axis=1)/norms
/media/san2_ssd/data/Workdir/survival/utils.py:305: RuntimeWarning: invalid value encountered in true_divide
  pdfs = np.gradient(1-survs,axis=1)/norms
/media/san2_ssd/data/Workdir/survival/utils.py:305: RuntimeWarning: invalid value encountered in true_divide
  pdfs = np.gradient(1-survs,axis=1)/norms
/media/san2_ssd/data/Workdir/survival/utils.py:305: RuntimeWarning: invalid value encountered in true_divide
  pdfs = np.gradient(1-survs,axis=1)/norms
[32m[I 2022-04-13 12:03:40,822][0m Trial 740 finished with value: 0.8875203092184449 and parameters: {'splitter': 'best', 'min_samples_split': 0.1210031630389858, 'min_samples_leaf': 0.03644404940151164, 'min_weight_fraction_leaf': 0.020875916305337697, 'max_features': 0.9983341274267179}. Best is trial 448 with value: 0.8888507593246218.[0m
/media/san2_ssd/data/Workdir/survival/utils.py:305: RuntimeWarning: invalid value encountered in true_divide
  pdfs = np.gradient(1-survs,axis=1)/norms
[32m[I 2022-04-13 12:03:42,881][0m Trial 741 finished with value: 0.8835405411787294 and parameters: {'splitter': 'best', 'min_samples_split': 0.14310804288913245, 'min_samples_leaf': 0.05766457559193776, 'min_weight_fraction_leaf': 0.009500494519908904, 'max_features': 0.9696570101639356}. Best is trial 448 with value: 0.8888507593246218.[0m
/media/san2_ssd/data/Workdir/survival/utils.py:305: RuntimeWarning: invalid value encountered in true_divide
  pdfs = np.gradient(1-survs,axis=1)/norms
/media/san2_ssd/data/Workdir/survival/utils.py:305: RuntimeWarning: invalid value encountered in true_divide
  pdfs = np.gradient(1-survs,axis=1)/norms
/media/san2_ssd/data/Workdir/survival/utils.py:305: RuntimeWarning: invalid value encountered in true_divide
  pdfs = np.gradient(1-survs,axis=1)/norms
[32m[I 2022-04-13 12:03:44,150][0m Trial 742 finished with value: 0.8854832260262091 and parameters: {'splitter': 'best', 'min_samples_split': 0.1250662257110917, 'min_samples_leaf': 0.05194387199345037, 'min_weight_fraction_leaf': 0.006951618911772688, 'max_features': 0.9983917072978136}. Best is trial 448 with value: 0.8888507593246218.[0m
[32m[I 2022-04-13 12:03:45,695][0m Trial 743 finished with value: 0.4681558859797863 and parameters: {'splitter': 'best', 'min_samples_split': 0.2917765028051609, 'min_samples_leaf': 0.04254325731765905, 'min_weight_fraction_leaf': 0.017575458057391358, 'max_features': 0.9620636001433142}. Best is trial 448 with value: 0.8888507593246218.[0m
[32m[I 2022-04-13 12:03:46,843][0m Trial 744 finished with value: 0.6516963713801349 and parameters: {'splitter': 'best', 'min_samples_split': 0.2725680659093855, 'min_samples_leaf': 0.06286018097049656, 'min_weight_fraction_leaf': 0.02118418260420735, 'max_features': 0.2970372498316489}. Best is trial 448 with value: 0.8888507593246218.[0m
/media/san2_ssd/data/Workdir/survival/utils.py:305: RuntimeWarning: invalid value encountered in true_divide
  pdfs = np.gradient(1-survs,axis=1)/norms
/media/san2_ssd/data/Workdir/survival/utils.py:305: RuntimeWarning: invalid value encountered in true_divide
  pdfs = np.gradient(1-survs,axis=1)/norms
/media/san2_ssd/data/Workdir/survival/utils.py:305: RuntimeWarning: invalid value encountered in true_divide
  pdfs = np.gradient(1-survs,axis=1)/norms
[32m[I 2022-04-13 12:03:49,188][0m Trial 745 finished with value: 0.8867865494255863 and parameters: {'splitter': 'best', 'min_samples_split': 0.13351486133559476, 'min_samples_leaf': 0.0366338198753253, 'min_weight_fraction_leaf': 0.001419495936648453, 'max_features': 0.9985179533425323}. Best is trial 448 with value: 0.8888507593246218.[0m
/media/san2_ssd/data/Workdir/survival/utils.py:305: RuntimeWarning: invalid value encountered in true_divide
  pdfs = np.gradient(1-survs,axis=1)/norms
/media/san2_ssd/data/Workdir/survival/utils.py:305: RuntimeWarning: invalid value encountered in true_divide
  pdfs = np.gradient(1-survs,axis=1)/norms
/media/san2_ssd/data/Workdir/survival/utils.py:305: RuntimeWarning: invalid value encountered in true_divide
  pdfs = np.gradient(1-survs,axis=1)/norms
[32m[I 2022-04-13 12:03:50,703][0m Trial 746 finished with value: 0.8871461026602387 and parameters: {'splitter': 'best', 'min_samples_split': 0.12022100329043185, 'min_samples_leaf': 0.04703047643886975, 'min_weight_fraction_leaf': 0.023144836409342687, 'max_features': 0.9994977120027557}. Best is trial 448 with value: 0.8888507593246218.[0m
[32m[I 2022-04-13 12:03:52,012][0m Trial 747 finished with value: 0.8803010018852703 and parameters: {'splitter': 'best', 'min_samples_split': 0.09666091436655486, 'min_samples_leaf': 0.07467245513688273, 'min_weight_fraction_leaf': 0.013028734853906841, 'max_features': 0.965836273032987}. Best is trial 448 with value: 0.8888507593246218.[0m
[32m[I 2022-04-13 12:03:52,268][0m Trial 748 finished with value: 0.5371812073302544 and parameters: {'splitter': 'best', 'min_samples_split': 0.11147314277001506, 'min_samples_leaf': 0.3334195261098591, 'min_weight_fraction_leaf': 0.028621078375207047, 'max_features': 0.9821858577968547}. Best is trial 448 with value: 0.8888507593246218.[0m
[32m[I 2022-04-13 12:03:53,087][0m Trial 749 finished with value: 0.6726757157599808 and parameters: {'splitter': 'best', 'min_samples_split': 0.12555463114574464, 'min_samples_leaf': 0.035098188445397804, 'min_weight_fraction_leaf': 0.19404618108073135, 'max_features': 0.9999980159674295}. Best is trial 448 with value: 0.8888507593246218.[0m
/media/san2_ssd/data/Workdir/survival/utils.py:305: RuntimeWarning: invalid value encountered in true_divide
  pdfs = np.gradient(1-survs,axis=1)/norms
/media/san2_ssd/data/Workdir/survival/utils.py:305: RuntimeWarning: invalid value encountered in true_divide
  pdfs = np.gradient(1-survs,axis=1)/norms
/media/san2_ssd/data/Workdir/survival/utils.py:305: RuntimeWarning: invalid value encountered in true_divide
  pdfs = np.gradient(1-survs,axis=1)/norms
[32m[I 2022-04-13 12:03:54,726][0m Trial 750 finished with value: 0.8843648194054754 and parameters: {'splitter': 'best', 'min_samples_split': 0.0843340197830086, 'min_samples_leaf': 0.046853087631059276, 'min_weight_fraction_leaf': 0.021558242229911193, 'max_features': 0.9478375228538051}. Best is trial 448 with value: 0.8888507593246218.[0m
/media/san2_ssd/data/Workdir/survival/utils.py:305: RuntimeWarning: invalid value encountered in true_divide
  pdfs = np.gradient(1-survs,axis=1)/norms
/media/san2_ssd/data/Workdir/survival/utils.py:305: RuntimeWarning: invalid value encountered in true_divide
  pdfs = np.gradient(1-survs,axis=1)/norms
/media/san2_ssd/data/Workdir/survival/utils.py:305: RuntimeWarning: invalid value encountered in true_divide
  pdfs = np.gradient(1-survs,axis=1)/norms
/media/san2_ssd/data/Workdir/survival/utils.py:305: RuntimeWarning: invalid value encountered in true_divide
  pdfs = np.gradient(1-survs,axis=1)/norms
/media/san2_ssd/data/Workdir/survival/utils.py:305: RuntimeWarning: invalid value encountered in true_divide
  pdfs = np.gradient(1-survs,axis=1)/norms
[32m[I 2022-04-13 12:03:58,415][0m Trial 751 finished with value: 0.8837283174643774 and parameters: {'splitter': 'best', 'min_samples_split': 0.10362758931620468, 'min_samples_leaf': 0.03403545092648612, 'min_weight_fraction_leaf': 0.03283365465930192, 'max_features': 0.9675458084770352}. Best is trial 448 with value: 0.8888507593246218.[0m
/media/san2_ssd/data/Workdir/survival/utils.py:305: RuntimeWarning: invalid value encountered in true_divide
  pdfs = np.gradient(1-survs,axis=1)/norms
/media/san2_ssd/data/Workdir/survival/utils.py:305: RuntimeWarning: invalid value encountered in true_divide
  pdfs = np.gradient(1-survs,axis=1)/norms
[32m[I 2022-04-13 12:04:01,735][0m Trial 752 finished with value: 0.8858067963850887 and parameters: {'splitter': 'best', 'min_samples_split': 0.13869502105524684, 'min_samples_leaf': 0.027613117920542482, 'min_weight_fraction_leaf': 5.96301142676281e-05, 'max_features': 0.9831395912569706}. Best is trial 448 with value: 0.8888507593246218.[0m
[32m[I 2022-04-13 12:04:03,714][0m Trial 753 finished with value: 0.5474145173769144 and parameters: {'splitter': 'best', 'min_samples_split': 0.11730987166504375, 'min_samples_leaf': 0.05277219814149337, 'min_weight_fraction_leaf': 0.23854624784130293, 'max_features': 0.9335432329433359}. Best is trial 448 with value: 0.8888507593246218.[0m
/media/san2_ssd/data/Workdir/survival/utils.py:305: RuntimeWarning: invalid value encountered in true_divide
  pdfs = np.gradient(1-survs,axis=1)/norms
/media/san2_ssd/data/Workdir/survival/utils.py:305: RuntimeWarning: invalid value encountered in true_divide
  pdfs = np.gradient(1-survs,axis=1)/norms
/media/san2_ssd/data/Workdir/survival/utils.py:305: RuntimeWarning: invalid value encountered in true_divide
  pdfs = np.gradient(1-survs,axis=1)/norms
/media/san2_ssd/data/Workdir/survival/utils.py:305: RuntimeWarning: invalid value encountered in true_divide
  pdfs = np.gradient(1-survs,axis=1)/norms
/media/san2_ssd/data/Workdir/survival/utils.py:305: RuntimeWarning: invalid value encountered in true_divide
  pdfs = np.gradient(1-survs,axis=1)/norms
[32m[I 2022-04-13 12:04:06,166][0m Trial 754 finished with value: 0.8819157419642542 and parameters: {'splitter': 'best', 'min_samples_split': 0.09150582611303923, 'min_samples_leaf': 0.04102148658514021, 'min_weight_fraction_leaf': 0.010831481905666098, 'max_features': 0.9547891759491355}. Best is trial 448 with value: 0.8888507593246218.[0m
/media/san2_ssd/data/Workdir/survival/utils.py:305: RuntimeWarning: invalid value encountered in true_divide
  pdfs = np.gradient(1-survs,axis=1)/norms
[32m[I 2022-04-13 12:04:07,506][0m Trial 755 finished with value: 0.8863404130559556 and parameters: {'splitter': 'best', 'min_samples_split': 0.1518004024793451, 'min_samples_leaf': 0.02734480376178132, 'min_weight_fraction_leaf': 0.035411665429396944, 'max_features': 0.9999439746362198}. Best is trial 448 with value: 0.8888507593246218.[0m
[32m[I 2022-04-13 12:04:07,753][0m Trial 756 finished with value: 0.8781591545591583 and parameters: {'splitter': 'random', 'min_samples_split': 0.10819242942555309, 'min_samples_leaf': 0.06117474414122806, 'min_weight_fraction_leaf': 0.023264554066837407, 'max_features': 0.961280022348449}. Best is trial 448 with value: 0.8888507593246218.[0m
/media/san2_ssd/data/Workdir/survival/utils.py:305: RuntimeWarning: invalid value encountered in true_divide
  pdfs = np.gradient(1-survs,axis=1)/norms
/media/san2_ssd/data/Workdir/survival/utils.py:305: RuntimeWarning: invalid value encountered in true_divide
  pdfs = np.gradient(1-survs,axis=1)/norms
/media/san2_ssd/data/Workdir/survival/utils.py:305: RuntimeWarning: invalid value encountered in true_divide
  pdfs = np.gradient(1-survs,axis=1)/norms
/media/san2_ssd/data/Workdir/survival/utils.py:305: RuntimeWarning: invalid value encountered in true_divide
  pdfs = np.gradient(1-survs,axis=1)/norms
[32m[I 2022-04-13 12:04:10,003][0m Trial 757 finished with value: 0.8863273054531856 and parameters: {'splitter': 'best', 'min_samples_split': 0.12692741375862798, 'min_samples_leaf': 0.03530505511002728, 'min_weight_fraction_leaf': 0.041935532820393584, 'max_features': 0.9821863570847578}. Best is trial 448 with value: 0.8888507593246218.[0m
[32m[I 2022-04-13 12:04:11,525][0m Trial 758 finished with value: 0.5371812073302544 and parameters: {'splitter': 'best', 'min_samples_split': 0.118358905781374, 'min_samples_leaf': 0.047951894813329565, 'min_weight_fraction_leaf': 0.32431640266529704, 'max_features': 0.9806957349040257}. Best is trial 448 with value: 0.8888507593246218.[0m
/media/san2_ssd/data/Workdir/survival/utils.py:305: RuntimeWarning: invalid value encountered in true_divide
  pdfs = np.gradient(1-survs,axis=1)/norms
/media/san2_ssd/data/Workdir/survival/utils.py:305: RuntimeWarning: invalid value encountered in true_divide
  pdfs = np.gradient(1-survs,axis=1)/norms
/media/san2_ssd/data/Workdir/survival/utils.py:305: RuntimeWarning: invalid value encountered in true_divide
  pdfs = np.gradient(1-survs,axis=1)/norms
/media/san2_ssd/data/Workdir/survival/utils.py:305: RuntimeWarning: invalid value encountered in true_divide
  pdfs = np.gradient(1-survs,axis=1)/norms
[32m[I 2022-04-13 12:04:15,628][0m Trial 759 finished with value: 0.8824118642103708 and parameters: {'splitter': 'best', 'min_samples_split': 0.09854189449412679, 'min_samples_leaf': 0.024368432756736984, 'min_weight_fraction_leaf': 0.01650151752725986, 'max_features': 0.9131068263519255}. Best is trial 448 with value: 0.8888507593246218.[0m
/media/san2_ssd/data/Workdir/survival/utils.py:305: RuntimeWarning: invalid value encountered in true_divide
  pdfs = np.gradient(1-survs,axis=1)/norms
/media/san2_ssd/data/Workdir/survival/utils.py:305: RuntimeWarning: invalid value encountered in true_divide
  pdfs = np.gradient(1-survs,axis=1)/norms
[32m[I 2022-04-13 12:04:17,283][0m Trial 760 finished with value: 0.8825898476313456 and parameters: {'splitter': 'best', 'min_samples_split': 0.1310055448964279, 'min_samples_leaf': 0.034408628598788335, 'min_weight_fraction_leaf': 0.03027689680712243, 'max_features': 0.9391059959131219}. Best is trial 448 with value: 0.8888507593246218.[0m
/media/san2_ssd/data/Workdir/survival/utils.py:305: RuntimeWarning: invalid value encountered in true_divide
  pdfs = np.gradient(1-survs,axis=1)/norms
/media/san2_ssd/data/Workdir/survival/utils.py:305: RuntimeWarning: invalid value encountered in true_divide
  pdfs = np.gradient(1-survs,axis=1)/norms
/media/san2_ssd/data/Workdir/survival/utils.py:305: RuntimeWarning: invalid value encountered in true_divide
  pdfs = np.gradient(1-survs,axis=1)/norms
[32m[I 2022-04-13 12:04:19,655][0m Trial 761 finished with value: 0.8832107377595857 and parameters: {'splitter': 'best', 'min_samples_split': 0.10669171440847923, 'min_samples_leaf': 0.017197643864611173, 'min_weight_fraction_leaf': 0.051995508323256, 'max_features': 0.9713874832193133}. Best is trial 448 with value: 0.8888507593246218.[0m
/media/san2_ssd/data/Workdir/survival/utils.py:305: RuntimeWarning: invalid value encountered in true_divide
  pdfs = np.gradient(1-survs,axis=1)/norms
/media/san2_ssd/data/Workdir/survival/utils.py:305: RuntimeWarning: invalid value encountered in true_divide
  pdfs = np.gradient(1-survs,axis=1)/norms
/media/san2_ssd/data/Workdir/survival/utils.py:305: RuntimeWarning: invalid value encountered in true_divide
  pdfs = np.gradient(1-survs,axis=1)/norms
/media/san2_ssd/data/Workdir/survival/utils.py:305: RuntimeWarning: invalid value encountered in true_divide
  pdfs = np.gradient(1-survs,axis=1)/norms
