[32m[I 2022-04-13 11:57:10,804][0m Trial 532 finished with value: 0.8816536421898498 and parameters: {'splitter': 'best', 'min_samples_split': 0.1295737725952661, 'min_samples_leaf': 0.010241487305899329, 'min_weight_fraction_leaf': 0.015136173190302242, 'max_features': 0.9677549885311532}. Best is trial 448 with value: 0.8888507593246218.[0m
/media/san2_ssd/data/Workdir/survival/utils.py:305: RuntimeWarning: invalid value encountered in true_divide
  pdfs = np.gradient(1-survs,axis=1)/norms
/media/san2_ssd/data/Workdir/survival/utils.py:305: RuntimeWarning: invalid value encountered in true_divide
  pdfs = np.gradient(1-survs,axis=1)/norms
/media/san2_ssd/data/Workdir/survival/utils.py:305: RuntimeWarning: invalid value encountered in true_divide
  pdfs = np.gradient(1-survs,axis=1)/norms
[32m[I 2022-04-13 11:57:13,915][0m Trial 533 finished with value: 0.8859062329891259 and parameters: {'splitter': 'best', 'min_samples_split': 0.07435892623015816, 'min_samples_leaf': 0.037223102768007305, 'min_weight_fraction_leaf': 0.048039284909370095, 'max_features': 0.9842920260304954}. Best is trial 448 with value: 0.8888507593246218.[0m
/media/san2_ssd/data/Workdir/survival/utils.py:305: RuntimeWarning: invalid value encountered in true_divide
  pdfs = np.gradient(1-survs,axis=1)/norms
/media/san2_ssd/data/Workdir/survival/utils.py:305: RuntimeWarning: invalid value encountered in true_divide
  pdfs = np.gradient(1-survs,axis=1)/norms
/media/san2_ssd/data/Workdir/survival/utils.py:305: RuntimeWarning: invalid value encountered in true_divide
  pdfs = np.gradient(1-survs,axis=1)/norms
[32m[I 2022-04-13 11:57:16,496][0m Trial 534 finished with value: 0.883671464201617 and parameters: {'splitter': 'best', 'min_samples_split': 0.10185675453257445, 'min_samples_leaf': 0.05203112738252651, 'min_weight_fraction_leaf': 0.026757164439224258, 'max_features': 0.9503398904664153}. Best is trial 448 with value: 0.8888507593246218.[0m
/media/san2_ssd/data/Workdir/survival/utils.py:305: RuntimeWarning: invalid value encountered in true_divide
  pdfs = np.gradient(1-survs,axis=1)/norms
/media/san2_ssd/data/Workdir/survival/utils.py:305: RuntimeWarning: invalid value encountered in true_divide
  pdfs = np.gradient(1-survs,axis=1)/norms
/media/san2_ssd/data/Workdir/survival/utils.py:305: RuntimeWarning: invalid value encountered in true_divide
  pdfs = np.gradient(1-survs,axis=1)/norms
/media/san2_ssd/data/Workdir/survival/utils.py:305: RuntimeWarning: invalid value encountered in true_divide
  pdfs = np.gradient(1-survs,axis=1)/norms
[32m[I 2022-04-13 11:57:18,888][0m Trial 535 finished with value: 0.8869851464496883 and parameters: {'splitter': 'best', 'min_samples_split': 0.11134001074529311, 'min_samples_leaf': 0.017203633823700683, 'min_weight_fraction_leaf': 0.03986491395827159, 'max_features': 0.9996793861912825}. Best is trial 448 with value: 0.8888507593246218.[0m
[32m[I 2022-04-13 11:57:20,683][0m Trial 536 finished with value: 0.675609710386116 and parameters: {'splitter': 'best', 'min_samples_split': 0.13775984266404817, 'min_samples_leaf': 0.11964051281262471, 'min_weight_fraction_leaf': 0.01709267279297571, 'max_features': 0.9241442996208552}. Best is trial 448 with value: 0.8888507593246218.[0m
[32m[I 2022-04-13 11:57:22,449][0m Trial 537 finished with value: 0.8827566500887588 and parameters: {'splitter': 'best', 'min_samples_split': 0.12068221742159607, 'min_samples_leaf': 0.0305162859147668, 'min_weight_fraction_leaf': 0.06554862415767461, 'max_features': 0.9813029504600904}. Best is trial 448 with value: 0.8888507593246218.[0m
/media/san2_ssd/data/Workdir/survival/utils.py:305: RuntimeWarning: invalid value encountered in true_divide
  pdfs = np.gradient(1-survs,axis=1)/norms
/media/san2_ssd/data/Workdir/survival/utils.py:305: RuntimeWarning: invalid value encountered in true_divide
  pdfs = np.gradient(1-survs,axis=1)/norms
/media/san2_ssd/data/Workdir/survival/utils.py:305: RuntimeWarning: invalid value encountered in true_divide
  pdfs = np.gradient(1-survs,axis=1)/norms
/media/san2_ssd/data/Workdir/survival/utils.py:305: RuntimeWarning: invalid value encountered in true_divide
  pdfs = np.gradient(1-survs,axis=1)/norms
/media/san2_ssd/data/Workdir/survival/utils.py:305: RuntimeWarning: invalid value encountered in true_divide
  pdfs = np.gradient(1-survs,axis=1)/norms
[32m[I 2022-04-13 11:57:23,797][0m Trial 538 finished with value: 0.8825424729290645 and parameters: {'splitter': 'best', 'min_samples_split': 0.09126295359581393, 'min_samples_leaf': 0.04459882956400869, 'min_weight_fraction_leaf': 0.029766791620660704, 'max_features': 0.9660587725091799}. Best is trial 448 with value: 0.8888507593246218.[0m
/media/san2_ssd/data/Workdir/survival/utils.py:305: RuntimeWarning: invalid value encountered in true_divide
  pdfs = np.gradient(1-survs,axis=1)/norms
[32m[I 2022-04-13 11:57:25,282][0m Trial 539 finished with value: 0.8807497968400861 and parameters: {'splitter': 'best', 'min_samples_split': 0.10797988928961065, 'min_samples_leaf': 0.06185586832326387, 'min_weight_fraction_leaf': 0.05231261286004732, 'max_features': 0.9520894770145326}. Best is trial 448 with value: 0.8888507593246218.[0m
/media/san2_ssd/data/Workdir/survival/utils.py:305: RuntimeWarning: invalid value encountered in true_divide
  pdfs = np.gradient(1-survs,axis=1)/norms
/media/san2_ssd/data/Workdir/survival/utils.py:305: RuntimeWarning: invalid value encountered in true_divide
  pdfs = np.gradient(1-survs,axis=1)/norms
/media/san2_ssd/data/Workdir/survival/utils.py:305: RuntimeWarning: invalid value encountered in true_divide
  pdfs = np.gradient(1-survs,axis=1)/norms
/media/san2_ssd/data/Workdir/survival/utils.py:305: RuntimeWarning: invalid value encountered in true_divide
  pdfs = np.gradient(1-survs,axis=1)/norms
[32m[I 2022-04-13 11:57:27,932][0m Trial 540 finished with value: 0.8869184066819494 and parameters: {'splitter': 'best', 'min_samples_split': 0.1298321398161088, 'min_samples_leaf': 0.001417073954522275, 'min_weight_fraction_leaf': 0.0362348913686023, 'max_features': 0.9831675364160123}. Best is trial 448 with value: 0.8888507593246218.[0m
/media/san2_ssd/data/Workdir/survival/utils.py:305: RuntimeWarning: invalid value encountered in true_divide
  pdfs = np.gradient(1-survs,axis=1)/norms
/media/san2_ssd/data/Workdir/survival/utils.py:305: RuntimeWarning: invalid value encountered in true_divide
  pdfs = np.gradient(1-survs,axis=1)/norms
/media/san2_ssd/data/Workdir/survival/utils.py:305: RuntimeWarning: invalid value encountered in true_divide
  pdfs = np.gradient(1-survs,axis=1)/norms
/media/san2_ssd/data/Workdir/survival/utils.py:305: RuntimeWarning: invalid value encountered in true_divide
  pdfs = np.gradient(1-survs,axis=1)/norms
[32m[I 2022-04-13 11:57:30,881][0m Trial 541 finished with value: 0.8868600072834173 and parameters: {'splitter': 'best', 'min_samples_split': 0.11740041211971004, 'min_samples_leaf': 0.027172877633696378, 'min_weight_fraction_leaf': 0.00888562083994189, 'max_features': 0.9991290180271198}. Best is trial 448 with value: 0.8888507593246218.[0m
/media/san2_ssd/data/Workdir/survival/utils.py:305: RuntimeWarning: invalid value encountered in true_divide
  pdfs = np.gradient(1-survs,axis=1)/norms
/media/san2_ssd/data/Workdir/survival/utils.py:305: RuntimeWarning: invalid value encountered in true_divide
  pdfs = np.gradient(1-survs,axis=1)/norms
/media/san2_ssd/data/Workdir/survival/utils.py:305: RuntimeWarning: invalid value encountered in true_divide
  pdfs = np.gradient(1-survs,axis=1)/norms
/media/san2_ssd/data/Workdir/survival/utils.py:305: RuntimeWarning: invalid value encountered in true_divide
  pdfs = np.gradient(1-survs,axis=1)/norms
[32m[I 2022-04-13 11:57:33,619][0m Trial 542 finished with value: 0.883866916518181 and parameters: {'splitter': 'best', 'min_samples_split': 0.10005536722154292, 'min_samples_leaf': 0.014662883345076788, 'min_weight_fraction_leaf': 0.02416553948848019, 'max_features': 0.969365829695214}. Best is trial 448 with value: 0.8888507593246218.[0m
/media/san2_ssd/data/Workdir/survival/utils.py:305: RuntimeWarning: invalid value encountered in true_divide
  pdfs = np.gradient(1-survs,axis=1)/norms
/media/san2_ssd/data/Workdir/survival/utils.py:305: RuntimeWarning: invalid value encountered in true_divide
  pdfs = np.gradient(1-survs,axis=1)/norms
/media/san2_ssd/data/Workdir/survival/utils.py:305: RuntimeWarning: invalid value encountered in true_divide
  pdfs = np.gradient(1-survs,axis=1)/norms
/media/san2_ssd/data/Workdir/survival/utils.py:305: RuntimeWarning: invalid value encountered in true_divide
  pdfs = np.gradient(1-survs,axis=1)/norms
/media/san2_ssd/data/Workdir/survival/utils.py:305: RuntimeWarning: invalid value encountered in true_divide
  pdfs = np.gradient(1-survs,axis=1)/norms
[32m[I 2022-04-13 11:57:36,894][0m Trial 543 finished with value: 0.8836090599860563 and parameters: {'splitter': 'best', 'min_samples_split': 0.08228977340108361, 'min_samples_leaf': 0.03740166905267148, 'min_weight_fraction_leaf': 0.034626164733922944, 'max_features': 0.9436334516528131}. Best is trial 448 with value: 0.8888507593246218.[0m
[32m[I 2022-04-13 11:57:37,820][0m Trial 544 finished with value: 0.7758778404531012 and parameters: {'splitter': 'random', 'min_samples_split': 0.12399708853512925, 'min_samples_leaf': 0.021789094804023416, 'min_weight_fraction_leaf': 0.018676817540226025, 'max_features': 0.9834865435074226}. Best is trial 448 with value: 0.8888507593246218.[0m
/media/san2_ssd/data/Workdir/survival/utils.py:305: RuntimeWarning: invalid value encountered in true_divide
  pdfs = np.gradient(1-survs,axis=1)/norms
/media/san2_ssd/data/Workdir/survival/utils.py:305: RuntimeWarning: invalid value encountered in true_divide
  pdfs = np.gradient(1-survs,axis=1)/norms
/media/san2_ssd/data/Workdir/survival/utils.py:305: RuntimeWarning: invalid value encountered in true_divide
  pdfs = np.gradient(1-survs,axis=1)/norms
[32m[I 2022-04-13 11:57:39,712][0m Trial 545 finished with value: 0.8839179303551603 and parameters: {'splitter': 'best', 'min_samples_split': 0.11214788128592845, 'min_samples_leaf': 0.049924505084178436, 'min_weight_fraction_leaf': 0.04270676618182083, 'max_features': 0.9664647826126712}. Best is trial 448 with value: 0.8888507593246218.[0m
[32m[I 2022-04-13 11:57:40,306][0m Trial 546 finished with value: 0.6981432179087999 and parameters: {'splitter': 'best', 'min_samples_split': 0.09742586125036501, 'min_samples_leaf': 0.25706717048432337, 'min_weight_fraction_leaf': 0.4770439618203628, 'max_features': 0.9997725315697955}. Best is trial 448 with value: 0.8888507593246218.[0m
/media/san2_ssd/data/Workdir/survival/utils.py:305: RuntimeWarning: invalid value encountered in true_divide
  pdfs = np.gradient(1-survs,axis=1)/norms
[32m[I 2022-04-13 11:57:42,010][0m Trial 547 finished with value: 0.8815138144524564 and parameters: {'splitter': 'best', 'min_samples_split': 0.13588030987661293, 'min_samples_leaf': 0.03324445651060403, 'min_weight_fraction_leaf': 0.05603794153340873, 'max_features': 0.934310342484585}. Best is trial 448 with value: 0.8888507593246218.[0m
/media/san2_ssd/data/Workdir/survival/utils.py:305: RuntimeWarning: invalid value encountered in true_divide
  pdfs = np.gradient(1-survs,axis=1)/norms
/media/san2_ssd/data/Workdir/survival/utils.py:305: RuntimeWarning: invalid value encountered in true_divide
  pdfs = np.gradient(1-survs,axis=1)/norms
/media/san2_ssd/data/Workdir/survival/utils.py:305: RuntimeWarning: invalid value encountered in true_divide
  pdfs = np.gradient(1-survs,axis=1)/norms
/media/san2_ssd/data/Workdir/survival/utils.py:305: RuntimeWarning: invalid value encountered in true_divide
  pdfs = np.gradient(1-survs,axis=1)/norms
/media/san2_ssd/data/Workdir/survival/utils.py:305: RuntimeWarning: invalid value encountered in true_divide
  pdfs = np.gradient(1-survs,axis=1)/norms
[32m[I 2022-04-13 11:57:43,607][0m Trial 548 finished with value: 0.886264925757897 and parameters: {'splitter': 'best', 'min_samples_split': 0.0642139076550225, 'min_samples_leaf': 0.014328353067317862, 'min_weight_fraction_leaf': 0.011601063041797541, 'max_features': 0.9821598972775537}. Best is trial 448 with value: 0.8888507593246218.[0m
/media/san2_ssd/data/Workdir/survival/utils.py:305: RuntimeWarning: invalid value encountered in true_divide
  pdfs = np.gradient(1-survs,axis=1)/norms
[32m[I 2022-04-13 11:57:45,636][0m Trial 549 finished with value: 0.8822157328498552 and parameters: {'splitter': 'best', 'min_samples_split': 0.14777024994323876, 'min_samples_leaf': 0.02701669127131235, 'min_weight_fraction_leaf': 0.02720928905889021, 'max_features': 0.9560753194955586}. Best is trial 448 with value: 0.8888507593246218.[0m
[32m[I 2022-04-13 11:57:46,574][0m Trial 550 finished with value: 0.4591883924723801 and parameters: {'splitter': 'best', 'min_samples_split': 0.4647112467566029, 'min_samples_leaf': 0.009228061885342732, 'min_weight_fraction_leaf': 0.04752994621947794, 'max_features': 0.9998272465250545}. Best is trial 448 with value: 0.8888507593246218.[0m
/media/san2_ssd/data/Workdir/survival/utils.py:305: RuntimeWarning: invalid value encountered in true_divide
  pdfs = np.gradient(1-survs,axis=1)/norms
/media/san2_ssd/data/Workdir/survival/utils.py:305: RuntimeWarning: invalid value encountered in true_divide
  pdfs = np.gradient(1-survs,axis=1)/norms
/media/san2_ssd/data/Workdir/survival/utils.py:305: RuntimeWarning: invalid value encountered in true_divide
  pdfs = np.gradient(1-survs,axis=1)/norms
/media/san2_ssd/data/Workdir/survival/utils.py:305: RuntimeWarning: invalid value encountered in true_divide
  pdfs = np.gradient(1-survs,axis=1)/norms
/media/san2_ssd/data/Workdir/survival/utils.py:305: RuntimeWarning: invalid value encountered in true_divide
  pdfs = np.gradient(1-survs,axis=1)/norms
[32m[I 2022-04-13 11:57:48,163][0m Trial 551 finished with value: 0.8848057367842259 and parameters: {'splitter': 'best', 'min_samples_split': 0.10573737597003084, 'min_samples_leaf': 0.0399408917674374, 'min_weight_fraction_leaf': 0.033694172592589736, 'max_features': 0.9681868774740239}. Best is trial 448 with value: 0.8888507593246218.[0m
/media/san2_ssd/data/Workdir/survival/utils.py:305: RuntimeWarning: invalid value encountered in true_divide
  pdfs = np.gradient(1-survs,axis=1)/norms
/media/san2_ssd/data/Workdir/survival/utils.py:305: RuntimeWarning: invalid value encountered in true_divide
  pdfs = np.gradient(1-survs,axis=1)/norms
/media/san2_ssd/data/Workdir/survival/utils.py:305: RuntimeWarning: invalid value encountered in true_divide
  pdfs = np.gradient(1-survs,axis=1)/norms
/media/san2_ssd/data/Workdir/survival/utils.py:305: RuntimeWarning: invalid value encountered in true_divide
  pdfs = np.gradient(1-survs,axis=1)/norms
[32m[I 2022-04-13 11:57:50,922][0m Trial 552 finished with value: 0.8871619858744337 and parameters: {'splitter': 'best', 'min_samples_split': 0.11833065328225292, 'min_samples_leaf': 0.021492988606055384, 'min_weight_fraction_leaf': 0.02158660891351949, 'max_features': 0.9823108758978972}. Best is trial 448 with value: 0.8888507593246218.[0m
[32m[I 2022-04-13 11:57:52,362][0m Trial 553 finished with value: 0.7865243203470126 and parameters: {'splitter': 'best', 'min_samples_split': 0.08958141534489654, 'min_samples_leaf': 0.07568555422056936, 'min_weight_fraction_leaf': 0.06346614639063411, 'max_features': 0.9999941966484369}. Best is trial 448 with value: 0.8888507593246218.[0m
[32m[I 2022-04-13 11:57:52,957][0m Trial 554 finished with value: 0.7089124489730949 and parameters: {'splitter': 'best', 'min_samples_split': 0.1269325825219182, 'min_samples_leaf': 0.31200352843714113, 'min_weight_fraction_leaf': 0.007958098759795152, 'max_features': 0.9450664606842374}. Best is trial 448 with value: 0.8888507593246218.[0m
/media/san2_ssd/data/Workdir/survival/utils.py:305: RuntimeWarning: invalid value encountered in true_divide
  pdfs = np.gradient(1-survs,axis=1)/norms
/media/san2_ssd/data/Workdir/survival/utils.py:305: RuntimeWarning: invalid value encountered in true_divide
  pdfs = np.gradient(1-survs,axis=1)/norms
[32m[I 2022-04-13 11:57:53,925][0m Trial 555 finished with value: 0.8820462377068378 and parameters: {'splitter': 'best', 'min_samples_split': 0.11104436865383356, 'min_samples_leaf': 0.055840640653905343, 'min_weight_fraction_leaf': 0.036745923156695226, 'max_features': 0.9108542937454733}. Best is trial 448 with value: 0.8888507593246218.[0m
/media/san2_ssd/data/Workdir/survival/utils.py:305: RuntimeWarning: invalid value encountered in true_divide
  pdfs = np.gradient(1-survs,axis=1)/norms
/media/san2_ssd/data/Workdir/survival/utils.py:305: RuntimeWarning: invalid value encountered in true_divide
  pdfs = np.gradient(1-survs,axis=1)/norms
/media/san2_ssd/data/Workdir/survival/utils.py:305: RuntimeWarning: invalid value encountered in true_divide
  pdfs = np.gradient(1-survs,axis=1)/norms
[32m[I 2022-04-13 11:57:55,007][0m Trial 556 finished with value: 0.8839074668483378 and parameters: {'splitter': 'best', 'min_samples_split': 0.09916950708541541, 'min_samples_leaf': 0.03455549456174044, 'min_weight_fraction_leaf': 0.047841050335891463, 'max_features': 0.966391127335002}. Best is trial 448 with value: 0.8888507593246218.[0m
/media/san2_ssd/data/Workdir/survival/utils.py:305: RuntimeWarning: invalid value encountered in true_divide
  pdfs = np.gradient(1-survs,axis=1)/norms
/media/san2_ssd/data/Workdir/survival/utils.py:305: RuntimeWarning: invalid value encountered in true_divide
  pdfs = np.gradient(1-survs,axis=1)/norms
/media/san2_ssd/data/Workdir/survival/utils.py:305: RuntimeWarning: invalid value encountered in true_divide
  pdfs = np.gradient(1-survs,axis=1)/norms
/media/san2_ssd/data/Workdir/survival/utils.py:305: RuntimeWarning: invalid value encountered in true_divide
  pdfs = np.gradient(1-survs,axis=1)/norms
[32m[I 2022-04-13 11:57:56,778][0m Trial 557 finished with value: 0.8873628585867758 and parameters: {'splitter': 'best', 'min_samples_split': 0.12019214885533194, 'min_samples_leaf': 0.04562114349857853, 'min_weight_fraction_leaf': 0.022709801313493247, 'max_features': 0.9820426457452207}. Best is trial 448 with value: 0.8888507593246218.[0m
[32m[I 2022-04-13 11:57:57,773][0m Trial 558 finished with value: 0.6962572664701397 and parameters: {'splitter': 'best', 'min_samples_split': 0.1344878936003162, 'min_samples_leaf': 0.3606436208125972, 'min_weight_fraction_leaf': 0.07754484678618245, 'max_features': 0.9332475179142291}. Best is trial 448 with value: 0.8888507593246218.[0m
/media/san2_ssd/data/Workdir/survival/utils.py:305: RuntimeWarning: invalid value encountered in true_divide
  pdfs = np.gradient(1-survs,axis=1)/norms
/media/san2_ssd/data/Workdir/survival/utils.py:305: RuntimeWarning: invalid value encountered in true_divide
  pdfs = np.gradient(1-survs,axis=1)/norms
/media/san2_ssd/data/Workdir/survival/utils.py:305: RuntimeWarning: invalid value encountered in true_divide
  pdfs = np.gradient(1-survs,axis=1)/norms
/media/san2_ssd/data/Workdir/survival/utils.py:305: RuntimeWarning: invalid value encountered in true_divide
  pdfs = np.gradient(1-survs,axis=1)/norms
/media/san2_ssd/data/Workdir/survival/utils.py:305: RuntimeWarning: invalid value encountered in true_divide
  pdfs = np.gradient(1-survs,axis=1)/norms
[32m[I 2022-04-13 11:58:00,857][0m Trial 559 finished with value: 0.8872236521646102 and parameters: {'splitter': 'best', 'min_samples_split': 0.10569142742666332, 'min_samples_leaf': 0.0095627983753726, 'min_weight_fraction_leaf': 0.032942403873117615, 'max_features': 0.9999673368273845}. Best is trial 448 with value: 0.8888507593246218.[0m
[32m[I 2022-04-13 11:58:01,718][0m Trial 560 finished with value: 0.695369879797871 and parameters: {'splitter': 'best', 'min_samples_split': 0.08087030435053376, 'min_samples_leaf': 0.023067144306086668, 'min_weight_fraction_leaf': 0.36521499290099113, 'max_features': 0.9574123607604802}. Best is trial 448 with value: 0.8888507593246218.[0m
/media/san2_ssd/data/Workdir/survival/utils.py:305: RuntimeWarning: invalid value encountered in true_divide
  pdfs = np.gradient(1-survs,axis=1)/norms
/media/san2_ssd/data/Workdir/survival/utils.py:305: RuntimeWarning: invalid value encountered in true_divide
  pdfs = np.gradient(1-survs,axis=1)/norms
/media/san2_ssd/data/Workdir/survival/utils.py:305: RuntimeWarning: invalid value encountered in true_divide
  pdfs = np.gradient(1-survs,axis=1)/norms
/media/san2_ssd/data/Workdir/survival/utils.py:305: RuntimeWarning: invalid value encountered in true_divide
  pdfs = np.gradient(1-survs,axis=1)/norms
/media/san2_ssd/data/Workdir/survival/utils.py:305: RuntimeWarning: invalid value encountered in true_divide
  pdfs = np.gradient(1-survs,axis=1)/norms
[32m[I 2022-04-13 11:58:04,610][0m Trial 561 finished with value: 0.8877660098483039 and parameters: {'splitter': 'best', 'min_samples_split': 0.11572587900717811, 'min_samples_leaf': 0.03189129724634815, 'min_weight_fraction_leaf': 0.016710065275445694, 'max_features': 0.9793690242525778}. Best is trial 448 with value: 0.8888507593246218.[0m
/media/san2_ssd/data/Workdir/survival/utils.py:305: RuntimeWarning: invalid value encountered in true_divide
  pdfs = np.gradient(1-survs,axis=1)/norms
/media/san2_ssd/data/Workdir/survival/utils.py:305: RuntimeWarning: invalid value encountered in true_divide
  pdfs = np.gradient(1-survs,axis=1)/norms
/media/san2_ssd/data/Workdir/survival/utils.py:305: RuntimeWarning: invalid value encountered in true_divide
  pdfs = np.gradient(1-survs,axis=1)/norms
