[32m[I 2022-04-16 14:47:01,807][0m Trial 649 finished with value: 0.8859494415419856 and parameters: {'n_hidden': 1024, 'mixture_components': 8, 'use_sparse_layer': True, 'use_sparse_loss': False, 'use_batchnorm': False, 'use_dropout': True, 'dropout': 0.6006019999081577, 'mlp_size_1': 2, 'mlp_size_2': 4, 'mlp_size_3': 1, 'kernel': 'Gamma', 'loss_name': 'AlternativeNLLLoss'}. Best is trial 634 with value: 0.8878076973253428.[0m
[32m[I 2022-04-16 14:49:38,164][0m Trial 650 finished with value: 0.886181873182295 and parameters: {'n_hidden': 1024, 'mixture_components': 8, 'use_sparse_layer': True, 'use_sparse_loss': False, 'use_batchnorm': False, 'use_dropout': True, 'dropout': 0.5645669011206618, 'mlp_size_1': 2, 'mlp_size_2': 4, 'mlp_size_3': 1, 'kernel': 'Gamma', 'loss_name': 'AlternativeNLLLoss'}. Best is trial 634 with value: 0.8878076973253428.[0m
[32m[I 2022-04-16 14:52:04,781][0m Trial 651 finished with value: 0.8857066511630369 and parameters: {'n_hidden': 1024, 'mixture_components': 8, 'use_sparse_layer': True, 'use_sparse_loss': False, 'use_batchnorm': False, 'use_dropout': True, 'dropout': 0.5820716164748373, 'mlp_size_1': 2, 'mlp_size_2': 4, 'mlp_size_3': 1, 'kernel': 'Gamma', 'loss_name': 'AlternativeNLLLoss'}. Best is trial 634 with value: 0.8878076973253428.[0m
[32m[I 2022-04-16 14:54:22,308][0m Trial 652 finished with value: 0.8852691165041586 and parameters: {'n_hidden': 1024, 'mixture_components': 8, 'use_sparse_layer': True, 'use_sparse_loss': False, 'use_batchnorm': False, 'use_dropout': True, 'dropout': 0.6100394868100101, 'mlp_size_1': 2, 'mlp_size_2': 4, 'mlp_size_3': 1, 'kernel': 'Gamma', 'loss_name': 'AlternativeNLLLoss'}. Best is trial 634 with value: 0.8878076973253428.[0m
[32m[I 2022-04-16 14:58:21,274][0m Trial 653 finished with value: 0.8847134327313796 and parameters: {'n_hidden': 32, 'mixture_components': 8, 'use_sparse_layer': True, 'use_sparse_loss': False, 'use_batchnorm': False, 'use_dropout': True, 'dropout': 0.5627892483983028, 'mlp_size_1': 2, 'mlp_size_2': 0, 'mlp_size_3': 0, 'kernel': 'Gamma', 'loss_name': 'AlternativeNLLLoss'}. Best is trial 634 with value: 0.8878076973253428.[0m
[32m[I 2022-04-16 15:00:34,230][0m Trial 654 finished with value: 0.8864997862802948 and parameters: {'n_hidden': 1024, 'mixture_components': 8, 'use_sparse_layer': True, 'use_sparse_loss': False, 'use_batchnorm': False, 'use_dropout': True, 'dropout': 0.5837511232022247, 'mlp_size_1': 2, 'mlp_size_2': 4, 'mlp_size_3': 1, 'kernel': 'Gamma', 'loss_name': 'AlternativeNLLLoss'}. Best is trial 634 with value: 0.8878076973253428.[0m
[32m[I 2022-04-16 15:03:12,291][0m Trial 655 finished with value: 0.8869846653584528 and parameters: {'n_hidden': 1024, 'mixture_components': 8, 'use_sparse_layer': True, 'use_sparse_loss': False, 'use_batchnorm': False, 'use_dropout': True, 'dropout': 0.5961419082636534, 'mlp_size_1': 2, 'mlp_size_2': 4, 'mlp_size_3': 1, 'kernel': 'Gamma', 'loss_name': 'AlternativeNLLLoss'}. Best is trial 634 with value: 0.8878076973253428.[0m
[32m[I 2022-04-16 15:05:32,012][0m Trial 656 finished with value: 0.8837665808044093 and parameters: {'n_hidden': 1024, 'mixture_components': 8, 'use_sparse_layer': True, 'use_sparse_loss': False, 'use_batchnorm': False, 'use_dropout': True, 'dropout': 0.5917591077004531, 'mlp_size_1': 2, 'mlp_size_2': 4, 'mlp_size_3': 1, 'kernel': 'Gamma', 'loss_name': 'AlternativeNLLLoss'}. Best is trial 634 with value: 0.8878076973253428.[0m
[32m[I 2022-04-16 15:07:45,797][0m Trial 657 finished with value: 0.8868085881940704 and parameters: {'n_hidden': 1024, 'mixture_components': 8, 'use_sparse_layer': False, 'use_batchnorm': False, 'use_dropout': True, 'dropout': 0.5949836579597146, 'mlp_size_1': 2, 'mlp_size_2': 4, 'mlp_size_3': 1, 'kernel': 'Gamma', 'loss_name': 'AlternativeNLLLoss'}. Best is trial 634 with value: 0.8878076973253428.[0m
[32m[I 2022-04-16 15:10:00,569][0m Trial 658 finished with value: 0.8866658657859869 and parameters: {'n_hidden': 1024, 'mixture_components': 8, 'use_sparse_layer': False, 'use_batchnorm': False, 'use_dropout': True, 'dropout': 0.6136810673409434, 'mlp_size_1': 2, 'mlp_size_2': 4, 'mlp_size_3': 1, 'kernel': 'Gamma', 'loss_name': 'AlternativeNLLLoss'}. Best is trial 634 with value: 0.8878076973253428.[0m
[32m[I 2022-04-16 15:12:22,696][0m Trial 659 finished with value: 0.8857268117034964 and parameters: {'n_hidden': 1024, 'mixture_components': 8, 'use_sparse_layer': False, 'use_batchnorm': False, 'use_dropout': True, 'dropout': 0.6124895671973672, 'mlp_size_1': 3, 'mlp_size_2': 4, 'mlp_size_3': 0, 'kernel': 'Gamma', 'loss_name': 'AlternativeNLLLoss'}. Best is trial 634 with value: 0.8878076973253428.[0m
[32m[I 2022-04-16 15:14:33,142][0m Trial 660 finished with value: 0.8831236028372963 and parameters: {'n_hidden': 128, 'mixture_components': 8, 'use_sparse_layer': False, 'use_batchnorm': False, 'use_dropout': True, 'dropout': 0.6303290821088575, 'mlp_size_1': 2, 'mlp_size_2': 2, 'mlp_size_3': 0, 'kernel': 'Gamma', 'loss_name': 'AlternativeNLLLoss'}. Best is trial 634 with value: 0.8878076973253428.[0m
[32m[I 2022-04-16 15:16:53,883][0m Trial 661 finished with value: 0.8854064732067977 and parameters: {'n_hidden': 1024, 'mixture_components': 8, 'use_sparse_layer': False, 'use_batchnorm': False, 'use_dropout': True, 'dropout': 0.6035430345489152, 'mlp_size_1': 2, 'mlp_size_2': 4, 'mlp_size_3': 1, 'kernel': 'Gamma', 'loss_name': 'AlternativeNLLLoss'}. Best is trial 634 with value: 0.8878076973253428.[0m
[32m[I 2022-04-16 15:19:06,252][0m Trial 662 finished with value: 0.8857986008041678 and parameters: {'n_hidden': 1024, 'mixture_components': 8, 'use_sparse_layer': False, 'use_batchnorm': False, 'use_dropout': True, 'dropout': 0.6227778018163436, 'mlp_size_1': 2, 'mlp_size_2': 4, 'mlp_size_3': 1, 'kernel': 'Gamma', 'loss_name': 'AlternativeNLLLoss'}. Best is trial 634 with value: 0.8878076973253428.[0m
[32m[I 2022-04-16 15:21:21,597][0m Trial 663 finished with value: 0.8851664616208341 and parameters: {'n_hidden': 1024, 'mixture_components': 8, 'use_sparse_layer': False, 'use_batchnorm': False, 'use_dropout': True, 'dropout': 0.6110651324331681, 'mlp_size_1': 2, 'mlp_size_2': 4, 'mlp_size_3': 1, 'kernel': 'Gamma', 'loss_name': 'AlternativeNLLLoss'}. Best is trial 634 with value: 0.8878076973253428.[0m
[32m[I 2022-04-16 15:23:43,368][0m Trial 664 finished with value: 0.8866623146426441 and parameters: {'n_hidden': 1024, 'mixture_components': 8, 'use_sparse_layer': False, 'use_batchnorm': False, 'use_dropout': True, 'dropout': 0.6393607505381772, 'mlp_size_1': 2, 'mlp_size_2': 4, 'mlp_size_3': 1, 'kernel': 'Gamma', 'loss_name': 'AlternativeNLLLoss'}. Best is trial 634 with value: 0.8878076973253428.[0m
[32m[I 2022-04-16 15:25:43,810][0m Trial 665 finished with value: 0.8862176368287642 and parameters: {'n_hidden': 512, 'mixture_components': 8, 'use_sparse_layer': False, 'use_batchnorm': False, 'use_dropout': True, 'dropout': 0.6475907039490993, 'mlp_size_1': 2, 'mlp_size_2': 4, 'mlp_size_3': 0, 'kernel': 'Gamma', 'loss_name': 'AlternativeNLLLoss'}. Best is trial 634 with value: 0.8878076973253428.[0m
[32m[I 2022-04-16 15:27:51,758][0m Trial 666 finished with value: 0.8869287472075303 and parameters: {'n_hidden': 1024, 'mixture_components': 8, 'use_sparse_layer': False, 'use_batchnorm': False, 'use_dropout': True, 'dropout': 0.6720170689565287, 'mlp_size_1': 2, 'mlp_size_2': 4, 'mlp_size_3': 1, 'kernel': 'Gamma', 'loss_name': 'AlternativeNLLLoss'}. Best is trial 634 with value: 0.8878076973253428.[0m
[32m[I 2022-04-16 15:29:51,140][0m Trial 667 finished with value: 0.8785194890549416 and parameters: {'n_hidden': 64, 'mixture_components': 8, 'use_sparse_layer': False, 'use_batchnorm': False, 'use_dropout': False, 'mlp_size_1': 2, 'mlp_size_2': 1, 'mlp_size_3': 0, 'kernel': 'Gamma', 'loss_name': 'AlternativeNLLLoss'}. Best is trial 634 with value: 0.8878076973253428.[0m
[32m[I 2022-04-16 15:32:21,194][0m Trial 668 finished with value: 0.8519088391388442 and parameters: {'n_hidden': 1024, 'mixture_components': 8, 'use_sparse_layer': False, 'use_batchnorm': True, 'use_dropout': True, 'dropout': 0.6784157987587479, 'mlp_size_1': 2, 'mlp_size_2': 4, 'mlp_size_3': 1, 'kernel': 'Gamma', 'loss_name': 'AlternativeNLLLoss'}. Best is trial 634 with value: 0.8878076973253428.[0m
[32m[I 2022-04-16 15:34:33,366][0m Trial 669 finished with value: 0.886343321886045 and parameters: {'n_hidden': 1024, 'mixture_components': 8, 'use_sparse_layer': False, 'use_batchnorm': False, 'use_dropout': True, 'dropout': 0.6437394519620262, 'mlp_size_1': 2, 'mlp_size_2': 4, 'mlp_size_3': 1, 'kernel': 'Gamma', 'loss_name': 'AlternativeNLLLoss'}. Best is trial 634 with value: 0.8878076973253428.[0m
[32m[I 2022-04-16 15:37:17,824][0m Trial 670 finished with value: 0.8851586880448272 and parameters: {'n_hidden': 2048, 'mixture_components': 8, 'use_sparse_layer': False, 'use_batchnorm': False, 'use_dropout': True, 'dropout': 0.6544927599964905, 'mlp_size_1': 3, 'mlp_size_2': 4, 'mlp_size_3': 1, 'kernel': 'Gamma', 'loss_name': 'AlternativeNLLLoss'}. Best is trial 634 with value: 0.8878076973253428.[0m
[32m[I 2022-04-16 15:39:31,449][0m Trial 671 finished with value: 0.8871041041311558 and parameters: {'n_hidden': 1024, 'mixture_components': 8, 'use_sparse_layer': False, 'use_batchnorm': False, 'use_dropout': True, 'dropout': 0.6528818164864867, 'mlp_size_1': 2, 'mlp_size_2': 4, 'mlp_size_3': 1, 'kernel': 'Gamma', 'loss_name': 'AlternativeNLLLoss'}. Best is trial 634 with value: 0.8878076973253428.[0m
[32m[I 2022-04-16 15:41:49,194][0m Trial 672 finished with value: 0.8863870867192357 and parameters: {'n_hidden': 1024, 'mixture_components': 8, 'use_sparse_layer': False, 'use_batchnorm': False, 'use_dropout': True, 'dropout': 0.65705480059708, 'mlp_size_1': 2, 'mlp_size_2': 4, 'mlp_size_3': 1, 'kernel': 'Gamma', 'loss_name': 'AlternativeNLLLoss'}. Best is trial 634 with value: 0.8878076973253428.[0m
[32m[I 2022-04-16 15:44:15,356][0m Trial 673 finished with value: 0.8838940974677367 and parameters: {'n_hidden': 1024, 'mixture_components': 8, 'use_sparse_layer': False, 'use_batchnorm': False, 'use_dropout': True, 'dropout': 0.7277279706533774, 'mlp_size_1': 2, 'mlp_size_2': 4, 'mlp_size_3': 1, 'kernel': 'Gamma', 'loss_name': 'AlternativeNLLLoss'}. Best is trial 634 with value: 0.8878076973253428.[0m
[32m[I 2022-04-16 15:46:35,560][0m Trial 674 finished with value: 0.8864791361573306 and parameters: {'n_hidden': 1024, 'mixture_components': 8, 'use_sparse_layer': False, 'use_batchnorm': False, 'use_dropout': True, 'dropout': 0.694201503990011, 'mlp_size_1': 2, 'mlp_size_2': 4, 'mlp_size_3': 1, 'kernel': 'Gamma', 'loss_name': 'AlternativeNLLLoss'}. Best is trial 634 with value: 0.8878076973253428.[0m
[32m[I 2022-04-16 15:49:00,051][0m Trial 675 finished with value: 0.8849527965928828 and parameters: {'n_hidden': 1024, 'mixture_components': 8, 'use_sparse_layer': False, 'use_batchnorm': False, 'use_dropout': True, 'dropout': 0.6830110356090621, 'mlp_size_1': 2, 'mlp_size_2': 4, 'mlp_size_3': 1, 'kernel': 'Gamma', 'loss_name': 'AlternativeNLLLoss'}. Best is trial 634 with value: 0.8878076973253428.[0m
[32m[I 2022-04-16 15:51:16,834][0m Trial 676 finished with value: 0.8836824865251185 and parameters: {'n_hidden': 1024, 'mixture_components': 8, 'use_sparse_layer': False, 'use_batchnorm': False, 'use_dropout': True, 'dropout': 0.7044147094757163, 'mlp_size_1': 2, 'mlp_size_2': 4, 'mlp_size_3': 1, 'kernel': 'Gamma', 'loss_name': 'AlternativeNLLLoss'}. Best is trial 634 with value: 0.8878076973253428.[0m
[32m[I 2022-04-16 15:53:39,824][0m Trial 677 finished with value: 0.8846733464439606 and parameters: {'n_hidden': 1024, 'mixture_components': 8, 'use_sparse_layer': False, 'use_batchnorm': False, 'use_dropout': True, 'dropout': 0.6392513257318271, 'mlp_size_1': 2, 'mlp_size_2': 4, 'mlp_size_3': 1, 'kernel': 'Gamma', 'loss_name': 'AlternativeNLLLoss'}. Best is trial 634 with value: 0.8878076973253428.[0m
[32m[I 2022-04-16 15:55:56,734][0m Trial 678 finished with value: 0.8849927018985515 and parameters: {'n_hidden': 1024, 'mixture_components': 7, 'use_sparse_layer': False, 'use_batchnorm': False, 'use_dropout': True, 'dropout': 0.6592397870890366, 'mlp_size_1': 2, 'mlp_size_2': 4, 'mlp_size_3': 1, 'kernel': 'Gamma', 'loss_name': 'AlternativeNLLLoss'}. Best is trial 634 with value: 0.8878076973253428.[0m
[32m[I 2022-04-16 15:58:22,129][0m Trial 679 finished with value: 0.7794894734915842 and parameters: {'n_hidden': 1024, 'mixture_components': 8, 'use_sparse_layer': False, 'use_batchnorm': False, 'use_dropout': True, 'dropout': 0.6715221730634672, 'mlp_size_1': 7, 'mlp_size_2': 0, 'mlp_size_3': 0, 'kernel': 'Gamma', 'loss_name': 'AlternativeNLLLoss'}. Best is trial 634 with value: 0.8878076973253428.[0m
[32m[I 2022-04-16 16:00:43,455][0m Trial 680 finished with value: 0.8862607029666172 and parameters: {'n_hidden': 1024, 'mixture_components': 8, 'use_sparse_layer': False, 'use_batchnorm': False, 'use_dropout': True, 'dropout': 0.6721258919277247, 'mlp_size_1': 2, 'mlp_size_2': 4, 'mlp_size_3': 1, 'kernel': 'Gamma', 'loss_name': 'AlternativeNLLLoss'}. Best is trial 634 with value: 0.8878076973253428.[0m
[32m[I 2022-04-16 16:04:39,226][0m Trial 681 finished with value: 0.8844813574216636 and parameters: {'n_hidden': 32, 'mixture_components': 8, 'use_sparse_layer': False, 'use_batchnorm': False, 'use_dropout': True, 'dropout': 0.6329168233676198, 'mlp_size_1': 2, 'mlp_size_2': 0, 'mlp_size_3': 0, 'kernel': 'Gamma', 'loss_name': 'AlternativeNLLLoss'}. Best is trial 634 with value: 0.8878076973253428.[0m
[32m[I 2022-04-16 16:07:05,893][0m Trial 682 finished with value: 0.8833573430184856 and parameters: {'n_hidden': 1024, 'mixture_components': 8, 'use_sparse_layer': False, 'use_batchnorm': False, 'use_dropout': True, 'dropout': 0.6301460205031519, 'mlp_size_1': 2, 'mlp_size_2': 4, 'mlp_size_3': 1, 'kernel': 'Gamma', 'loss_name': 'AlternativeNLLLoss'}. Best is trial 634 with value: 0.8878076973253428.[0m
[32m[I 2022-04-16 16:09:12,961][0m Trial 683 finished with value: 0.8876231127713469 and parameters: {'n_hidden': 1024, 'mixture_components': 8, 'use_sparse_layer': False, 'use_batchnorm': False, 'use_dropout': True, 'dropout': 0.6887843061522534, 'mlp_size_1': 2, 'mlp_size_2': 4, 'mlp_size_3': 1, 'kernel': 'Gamma', 'loss_name': 'AlternativeNLLLoss'}. Best is trial 634 with value: 0.8878076973253428.[0m
[32m[I 2022-04-16 16:11:27,241][0m Trial 684 finished with value: 0.8858752707168314 and parameters: {'n_hidden': 1024, 'mixture_components': 8, 'use_sparse_layer': False, 'use_batchnorm': False, 'use_dropout': True, 'dropout': 0.6298415808369954, 'mlp_size_1': 2, 'mlp_size_2': 4, 'mlp_size_3': 1, 'kernel': 'Gamma', 'loss_name': 'AlternativeNLLLoss'}. Best is trial 634 with value: 0.8878076973253428.[0m
[32m[I 2022-04-16 16:14:00,064][0m Trial 685 finished with value: 0.884961748541105 and parameters: {'n_hidden': 1024, 'mixture_components': 8, 'use_sparse_layer': False, 'use_batchnorm': False, 'use_dropout': True, 'dropout': 0.7314832755410402, 'mlp_size_1': 2, 'mlp_size_2': 4, 'mlp_size_3': 1, 'kernel': 'Gamma', 'loss_name': 'AlternativeNLLLoss'}. Best is trial 634 with value: 0.8878076973253428.[0m
[32m[I 2022-04-16 16:16:36,581][0m Trial 686 finished with value: 0.8861375637852126 and parameters: {'n_hidden': 1024, 'mixture_components': 7, 'use_sparse_layer': False, 'use_batchnorm': False, 'use_dropout': True, 'dropout': 0.6965202318233833, 'mlp_size_1': 2, 'mlp_size_2': 4, 'mlp_size_3': 1, 'kernel': 'Gamma', 'loss_name': 'AlternativeNLLLoss'}. Best is trial 634 with value: 0.8878076973253428.[0m
[32m[I 2022-04-16 16:18:51,000][0m Trial 687 finished with value: 0.8820505330861531 and parameters: {'n_hidden': 1024, 'mixture_components': 8, 'use_sparse_layer': False, 'use_batchnorm': False, 'use_dropout': False, 'mlp_size_1': 2, 'mlp_size_2': 4, 'mlp_size_3': 1, 'kernel': 'Gamma', 'loss_name': 'AlternativeNLLLoss'}. Best is trial 634 with value: 0.8878076973253428.[0m
[32m[I 2022-04-16 16:21:05,844][0m Trial 688 finished with value: 0.8473029977986656 and parameters: {'n_hidden': 128, 'mixture_components': 8, 'use_sparse_layer': False, 'use_batchnorm': True, 'use_dropout': True, 'dropout': 0.7136889446106451, 'mlp_size_1': 2, 'mlp_size_2': 2, 'mlp_size_3': 0, 'kernel': 'Gamma', 'loss_name': 'AlternativeNLLLoss'}. Best is trial 634 with value: 0.8878076973253428.[0m
[32m[I 2022-04-16 16:23:28,826][0m Trial 689 finished with value: 0.8859827388620479 and parameters: {'n_hidden': 1024, 'mixture_components': 8, 'use_sparse_layer': False, 'use_batchnorm': False, 'use_dropout': True, 'dropout': 0.6921521473866566, 'mlp_size_1': 2, 'mlp_size_2': 4, 'mlp_size_3': 1, 'kernel': 'Gamma', 'loss_name': 'AlternativeNLLLoss'}. Best is trial 634 with value: 0.8878076973253428.[0m
[32m[I 2022-04-16 16:25:59,820][0m Trial 690 finished with value: 0.8863051945913145 and parameters: {'n_hidden': 1024, 'mixture_components': 8, 'use_sparse_layer': False, 'use_batchnorm': False, 'use_dropout': True, 'dropout': 0.6581686783076094, 'mlp_size_1': 2, 'mlp_size_2': 4, 'mlp_size_3': 1, 'kernel': 'Gamma', 'loss_name': 'AlternativeNLLLoss'}. Best is trial 634 with value: 0.8878076973253428.[0m
[32m[I 2022-04-16 16:28:31,432][0m Trial 691 finished with value: 0.8847455983031569 and parameters: {'n_hidden': 1024, 'mixture_components': 8, 'use_sparse_layer': False, 'use_batchnorm': False, 'use_dropout': True, 'dropout': 0.6837762086636278, 'mlp_size_1': 2, 'mlp_size_2': 4, 'mlp_size_3': 1, 'kernel': 'Gamma', 'loss_name': 'AlternativeNLLLoss'}. Best is trial 634 with value: 0.8878076973253428.[0m
[32m[I 2022-04-16 16:30:44,734][0m Trial 692 finished with value: 0.885797591939388 and parameters: {'n_hidden': 1024, 'mixture_components': 8, 'use_sparse_layer': False, 'use_batchnorm': False, 'use_dropout': True, 'dropout': 0.6609379851665728, 'mlp_size_1': 2, 'mlp_size_2': 4, 'mlp_size_3': 1, 'kernel': 'Gamma', 'loss_name': 'AlternativeNLLLoss'}. Best is trial 634 with value: 0.8878076973253428.[0m
[32m[I 2022-04-16 16:32:40,255][0m Trial 693 finished with value: 0.8854890861488117 and parameters: {'n_hidden': 512, 'mixture_components': 8, 'use_sparse_layer': False, 'use_batchnorm': False, 'use_dropout': True, 'dropout': 0.6617530337649853, 'mlp_size_1': 2, 'mlp_size_2': 4, 'mlp_size_3': 0, 'kernel': 'Gamma', 'loss_name': 'AlternativeNLLLoss'}. Best is trial 634 with value: 0.8878076973253428.[0m
[32m[I 2022-04-16 16:34:40,578][0m Trial 694 finished with value: 0.8835638092707871 and parameters: {'n_hidden': 1024, 'mixture_components': 7, 'use_sparse_layer': False, 'use_batchnorm': False, 'use_dropout': True, 'dropout': 0.7504238522204558, 'mlp_size_1': 3, 'mlp_size_2': 4, 'mlp_size_3': 0, 'kernel': 'Gamma', 'loss_name': 'AlternativeNLLLoss'}. Best is trial 634 with value: 0.8878076973253428.[0m
[32m[I 2022-04-16 16:37:21,539][0m Trial 695 finished with value: 0.8824357000439373 and parameters: {'n_hidden': 64, 'mixture_components': 8, 'use_sparse_layer': False, 'use_batchnorm': False, 'use_dropout': True, 'dropout': 0.7271327921817542, 'mlp_size_1': 2, 'mlp_size_2': 1, 'mlp_size_3': 0, 'kernel': 'Gamma', 'loss_name': 'AlternativeNLLLoss'}. Best is trial 634 with value: 0.8878076973253428.[0m
[32m[I 2022-04-16 16:39:30,935][0m Trial 696 finished with value: 0.8852811424547576 and parameters: {'n_hidden': 1024, 'mixture_components': 8, 'use_sparse_layer': False, 'use_batchnorm': False, 'use_dropout': True, 'dropout': 0.6889194190322149, 'mlp_size_1': 2, 'mlp_size_2': 4, 'mlp_size_3': 1, 'kernel': 'Gamma', 'loss_name': 'AlternativeNLLLoss'}. Best is trial 634 with value: 0.8878076973253428.[0m
[32m[I 2022-04-16 16:42:09,830][0m Trial 697 finished with value: 0.8852315211265562 and parameters: {'n_hidden': 2048, 'mixture_components': 8, 'use_sparse_layer': False, 'use_batchnorm': False, 'use_dropout': True, 'dropout': 0.6222009159522339, 'mlp_size_1': 3, 'mlp_size_2': 4, 'mlp_size_3': 1, 'kernel': 'Gamma', 'loss_name': 'AlternativeNLLLoss'}. Best is trial 634 with value: 0.8878076973253428.[0m
[32m[I 2022-04-16 16:44:37,240][0m Trial 698 finished with value: 0.886752302383449 and parameters: {'n_hidden': 1024, 'mixture_components': 8, 'use_sparse_layer': False, 'use_batchnorm': False, 'use_dropout': True, 'dropout': 0.670281175716671, 'mlp_size_1': 2, 'mlp_size_2': 4, 'mlp_size_3': 1, 'kernel': 'Gamma', 'loss_name': 'AlternativeNLLLoss'}. Best is trial 634 with value: 0.8878076973253428.[0m
[32m[I 2022-04-16 16:46:52,206][0m Trial 699 finished with value: 0.8853957306318883 and parameters: {'n_hidden': 1024, 'mixture_components': 8, 'use_sparse_layer': False, 'use_batchnorm': False, 'use_dropout': True, 'dropout': 0.7015779620019547, 'mlp_size_1': 2, 'mlp_size_2': 4, 'mlp_size_3': 1, 'kernel': 'Gamma', 'loss_name': 'AlternativeNLLLoss'}. Best is trial 634 with value: 0.8878076973253428.[0m
[32m[I 2022-04-16 16:49:07,368][0m Trial 700 finished with value: 0.7856156931034446 and parameters: {'n_hidden': 1024, 'mixture_components': 8, 'use_sparse_layer': False, 'use_batchnorm': False, 'use_dropout': True, 'dropout': 0.6767320319476868, 'mlp_size_1': 2, 'mlp_size_2': 4, 'mlp_size_3': 1, 'kernel': 'Gamma', 'loss_name': 'AlternativeNLLLoss'}. Best is trial 634 with value: 0.8878076973253428.[0m
[32m[I 2022-04-16 16:51:10,015][0m Trial 701 finished with value: 0.8831420601142801 and parameters: {'n_hidden': 1024, 'mixture_components': 8, 'use_sparse_layer': False, 'use_batchnorm': False, 'use_dropout': True, 'dropout': 0.64625657252198, 'mlp_size_1': 2, 'mlp_size_2': 4, 'mlp_size_3': 1, 'kernel': 'Gamma', 'loss_name': 'AlternativeNLLLoss'}. Best is trial 634 with value: 0.8878076973253428.[0m
