[32m[I 2022-04-13 11:54:01,931][0m Trial 214 finished with value: 0.7726627287058293 and parameters: {'alpha': 1.2346105200247428, 'ties': 'efron'}. Best is trial 126 with value: 0.7727034345528856.[0m
[32m[I 2022-04-13 11:54:05,529][0m Trial 215 finished with value: 0.7724073343503532 and parameters: {'alpha': 1.4263629904468298, 'ties': 'efron'}. Best is trial 126 with value: 0.7727034345528856.[0m
[32m[I 2022-04-13 11:54:09,158][0m Trial 216 finished with value: 0.7726632417534969 and parameters: {'alpha': 1.2296659634857736, 'ties': 'efron'}. Best is trial 126 with value: 0.7727034345528856.[0m
[32m[I 2022-04-13 11:54:13,700][0m Trial 217 finished with value: 0.7725126928304406 and parameters: {'alpha': 1.3277567272978534, 'ties': 'efron'}. Best is trial 126 with value: 0.7727034345528856.[0m
[32m[I 2022-04-13 11:54:17,216][0m Trial 218 finished with value: 0.7726513776146993 and parameters: {'alpha': 1.1432902477463651, 'ties': 'efron'}. Best is trial 126 with value: 0.7727034345528856.[0m
[32m[I 2022-04-13 11:54:19,209][0m Trial 219 finished with value: 0.7724732866070616 and parameters: {'alpha': 1.5186951894874574, 'ties': 'efron'}. Best is trial 126 with value: 0.7727034345528856.[0m
[32m[I 2022-04-13 11:54:22,375][0m Trial 220 finished with value: 0.7725957891770039 and parameters: {'alpha': 1.0741809638470443, 'ties': 'efron'}. Best is trial 126 with value: 0.7727034345528856.[0m
[32m[I 2022-04-13 11:54:26,642][0m Trial 221 finished with value: 0.772683451413325 and parameters: {'alpha': 1.2469459843796749, 'ties': 'efron'}. Best is trial 126 with value: 0.7727034345528856.[0m
[32m[I 2022-04-13 11:54:30,583][0m Trial 222 finished with value: 0.7726593485389681 and parameters: {'alpha': 1.249302040210974, 'ties': 'efron'}. Best is trial 126 with value: 0.7727034345528856.[0m
[32m[I 2022-04-13 11:54:34,133][0m Trial 223 finished with value: 0.77252995537272 and parameters: {'alpha': 1.3500959598686286, 'ties': 'efron'}. Best is trial 126 with value: 0.7727034345528856.[0m
[32m[I 2022-04-13 11:54:38,150][0m Trial 224 finished with value: 0.7725780760274393 and parameters: {'alpha': 1.1724704934931574, 'ties': 'efron'}. Best is trial 126 with value: 0.7727034345528856.[0m
[32m[I 2022-04-13 11:54:41,255][0m Trial 225 finished with value: 0.7726352804210938 and parameters: {'alpha': 1.2667724612495774, 'ties': 'efron'}. Best is trial 126 with value: 0.7727034345528856.[0m
[32m[I 2022-04-13 11:54:44,928][0m Trial 226 finished with value: 0.772619307207739 and parameters: {'alpha': 1.0260511193677126, 'ties': 'efron'}. Best is trial 126 with value: 0.7727034345528856.[0m
[32m[I 2022-04-13 11:54:47,715][0m Trial 227 finished with value: 0.7725275233652498 and parameters: {'alpha': 1.369050129975701, 'ties': 'efron'}. Best is trial 126 with value: 0.7727034345528856.[0m
[32m[I 2022-04-13 11:54:52,300][0m Trial 228 finished with value: 0.7726133322877013 and parameters: {'alpha': 1.1228174951232803, 'ties': 'efron'}. Best is trial 126 with value: 0.7727034345528856.[0m
[32m[I 2022-04-13 11:54:56,034][0m Trial 229 finished with value: 0.7727034345528856 and parameters: {'alpha': 1.2131945022675679, 'ties': 'efron'}. Best is trial 126 with value: 0.7727034345528856.[0m
[32m[I 2022-04-13 11:54:59,080][0m Trial 230 finished with value: 0.772441194974693 and parameters: {'alpha': 1.4368219542172425, 'ties': 'efron'}. Best is trial 126 with value: 0.7727034345528856.[0m
[32m[I 2022-04-13 11:55:03,577][0m Trial 231 finished with value: 0.7725936919446862 and parameters: {'alpha': 1.186263670501703, 'ties': 'efron'}. Best is trial 126 with value: 0.7727034345528856.[0m
[32m[I 2022-04-13 11:55:07,327][0m Trial 232 finished with value: 0.7726402815090503 and parameters: {'alpha': 1.2671361248863011, 'ties': 'efron'}. Best is trial 126 with value: 0.7727034345528856.[0m
[32m[I 2022-04-13 11:55:12,429][0m Trial 233 finished with value: 0.7713797286187656 and parameters: {'alpha': 0.11830789438806022, 'ties': 'efron'}. Best is trial 126 with value: 0.7727034345528856.[0m
[32m[I 2022-04-13 11:55:16,315][0m Trial 234 finished with value: 0.7725795618240607 and parameters: {'alpha': 1.193521808978723, 'ties': 'efron'}. Best is trial 126 with value: 0.7727034345528856.[0m
[32m[I 2022-04-13 11:55:20,348][0m Trial 235 finished with value: 0.7726004717385093 and parameters: {'alpha': 1.2996924310025588, 'ties': 'efron'}. Best is trial 126 with value: 0.7727034345528856.[0m
[32m[I 2022-04-13 11:55:24,833][0m Trial 236 finished with value: 0.7725584820593896 and parameters: {'alpha': 1.1036562614964878, 'ties': 'efron'}. Best is trial 126 with value: 0.7727034345528856.[0m
[32m[I 2022-04-13 11:55:27,919][0m Trial 237 finished with value: 0.7726035053211294 and parameters: {'alpha': 1.0004932284323542, 'ties': 'efron'}. Best is trial 126 with value: 0.7727034345528856.[0m
[32m[I 2022-04-13 11:55:31,755][0m Trial 238 finished with value: 0.7725188634093637 and parameters: {'alpha': 1.3310047881584932, 'ties': 'efron'}. Best is trial 126 with value: 0.7727034345528856.[0m
[32m[I 2022-04-13 11:55:35,118][0m Trial 239 finished with value: 0.7726083634799021 and parameters: {'alpha': 1.2038002837950745, 'ties': 'efron'}. Best is trial 126 with value: 0.7727034345528856.[0m
[32m[I 2022-04-13 11:55:39,337][0m Trial 240 finished with value: 0.7724816398715726 and parameters: {'alpha': 1.4041288407256383, 'ties': 'efron'}. Best is trial 126 with value: 0.7727034345528856.[0m
[32m[I 2022-04-13 11:55:43,812][0m Trial 241 finished with value: 0.7726445816655405 and parameters: {'alpha': 1.2580740439614764, 'ties': 'efron'}. Best is trial 126 with value: 0.7727034345528856.[0m
[32m[I 2022-04-13 11:55:48,004][0m Trial 242 finished with value: 0.7727034345528856 and parameters: {'alpha': 1.2137426113694167, 'ties': 'efron'}. Best is trial 126 with value: 0.7727034345528856.[0m
[32m[I 2022-04-13 11:55:51,367][0m Trial 243 finished with value: 0.7726262481336962 and parameters: {'alpha': 1.1465193591552907, 'ties': 'efron'}. Best is trial 126 with value: 0.7727034345528856.[0m
[32m[I 2022-04-13 11:55:55,379][0m Trial 244 finished with value: 0.7726126859579457 and parameters: {'alpha': 1.0771420067789212, 'ties': 'efron'}. Best is trial 126 with value: 0.7727034345528856.[0m
[32m[I 2022-04-13 11:55:59,710][0m Trial 245 finished with value: 0.7726560852499821 and parameters: {'alpha': 1.2528865942638576, 'ties': 'efron'}. Best is trial 126 with value: 0.7727034345528856.[0m
[32m[I 2022-04-13 11:56:02,896][0m Trial 246 finished with value: 0.7725275976362116 and parameters: {'alpha': 1.3540897110513899, 'ties': 'efron'}. Best is trial 126 with value: 0.7727034345528856.[0m
[32m[I 2022-04-13 11:56:06,549][0m Trial 247 finished with value: 0.7726198459797918 and parameters: {'alpha': 1.1886447066631665, 'ties': 'breslow'}. Best is trial 126 with value: 0.7727034345528856.[0m
[32m[I 2022-04-13 11:56:09,216][0m Trial 248 finished with value: 0.7726060729959565 and parameters: {'alpha': 1.0137951314497213, 'ties': 'efron'}. Best is trial 126 with value: 0.7727034345528856.[0m
[32m[I 2022-04-13 11:56:11,766][0m Trial 249 finished with value: 0.7726049984792007 and parameters: {'alpha': 1.3117194280991127, 'ties': 'efron'}. Best is trial 126 with value: 0.7727034345528856.[0m
[32m[I 2022-04-13 11:56:15,795][0m Trial 250 finished with value: 0.7726469764491004 and parameters: {'alpha': 1.1380042651318782, 'ties': 'efron'}. Best is trial 126 with value: 0.7727034345528856.[0m
[32m[I 2022-04-13 11:56:20,742][0m Trial 251 finished with value: 0.7724574017841643 and parameters: {'alpha': 1.4955564574693634, 'ties': 'efron'}. Best is trial 126 with value: 0.7727034345528856.[0m
[32m[I 2022-04-13 11:56:25,503][0m Trial 252 finished with value: 0.7708739467100691 and parameters: {'alpha': 3.381911392628653, 'ties': 'efron'}. Best is trial 126 with value: 0.7727034345528856.[0m
[32m[I 2022-04-13 11:56:29,851][0m Trial 253 finished with value: 0.7726565818018052 and parameters: {'alpha': 1.2360288638452244, 'ties': 'efron'}. Best is trial 126 with value: 0.7727034345528856.[0m
[32m[I 2022-04-13 11:56:33,850][0m Trial 254 finished with value: 0.7724678032999279 and parameters: {'alpha': 1.4139286520130607, 'ties': 'efron'}. Best is trial 126 with value: 0.7727034345528856.[0m
[32m[I 2022-04-13 11:56:38,226][0m Trial 255 finished with value: 0.7726102786981079 and parameters: {'alpha': 1.129485503313052, 'ties': 'efron'}. Best is trial 126 with value: 0.7727034345528856.[0m
[32m[I 2022-04-13 11:56:42,121][0m Trial 256 finished with value: 0.7726004717385093 and parameters: {'alpha': 1.30007721286322, 'ties': 'efron'}. Best is trial 126 with value: 0.7727034345528856.[0m
[32m[I 2022-04-13 11:56:44,855][0m Trial 257 finished with value: 0.7726332979612963 and parameters: {'alpha': 0.9243339330469484, 'ties': 'efron'}. Best is trial 126 with value: 0.7727034345528856.[0m
[32m[I 2022-04-13 11:56:47,883][0m Trial 258 finished with value: 0.7725322597132205 and parameters: {'alpha': 1.034322593204474, 'ties': 'efron'}. Best is trial 126 with value: 0.7727034345528856.[0m
[32m[I 2022-04-13 11:56:50,529][0m Trial 259 finished with value: 0.7726357768621931 and parameters: {'alpha': 1.2062096455310445, 'ties': 'efron'}. Best is trial 126 with value: 0.7727034345528856.[0m
[32m[I 2022-04-13 11:56:53,686][0m Trial 260 finished with value: 0.7725388712959806 and parameters: {'alpha': 1.3523462691486468, 'ties': 'efron'}. Best is trial 126 with value: 0.7727034345528856.[0m
[32m[I 2022-04-13 11:56:57,088][0m Trial 261 finished with value: 0.7725724170390487 and parameters: {'alpha': 1.1080878136092676, 'ties': 'efron'}. Best is trial 126 with value: 0.7727034345528856.[0m
[32m[I 2022-04-13 11:57:00,278][0m Trial 262 finished with value: 0.7726614442893316 and parameters: {'alpha': 1.2397623677469223, 'ties': 'efron'}. Best is trial 126 with value: 0.7727034345528856.[0m
[32m[I 2022-04-13 11:57:03,199][0m Trial 263 finished with value: 0.7724160724675887 and parameters: {'alpha': 1.4426664493420562, 'ties': 'efron'}. Best is trial 126 with value: 0.7727034345528856.[0m
[32m[I 2022-04-13 11:57:06,014][0m Trial 264 finished with value: 0.7725793211322313 and parameters: {'alpha': 1.1787761040909812, 'ties': 'efron'}. Best is trial 126 with value: 0.7727034345528856.[0m
[32m[I 2022-04-13 11:57:08,968][0m Trial 265 finished with value: 0.7725585309167715 and parameters: {'alpha': 1.0513472376313384, 'ties': 'breslow'}. Best is trial 126 with value: 0.7727034345528856.[0m
[32m[I 2022-04-13 11:57:12,318][0m Trial 266 finished with value: 0.7725410440813648 and parameters: {'alpha': 1.3598740142830008, 'ties': 'efron'}. Best is trial 126 with value: 0.7727034345528856.[0m
[32m[I 2022-04-13 11:57:16,627][0m Trial 267 finished with value: 0.7726432019414645 and parameters: {'alpha': 1.2636891586835177, 'ties': 'efron'}. Best is trial 126 with value: 0.7727034345528856.[0m
[32m[I 2022-04-13 11:57:20,838][0m Trial 268 finished with value: 0.772474030894714 and parameters: {'alpha': 1.5924572648939321, 'ties': 'efron'}. Best is trial 126 with value: 0.7727034345528856.[0m
[32m[I 2022-04-13 11:57:24,370][0m Trial 269 finished with value: 0.7726505803332081 and parameters: {'alpha': 0.9541977027979387, 'ties': 'efron'}. Best is trial 126 with value: 0.7727034345528856.[0m
[32m[I 2022-04-13 11:57:27,580][0m Trial 270 finished with value: 0.7726202515064294 and parameters: {'alpha': 1.132577972089387, 'ties': 'efron'}. Best is trial 126 with value: 0.7727034345528856.[0m
[32m[I 2022-04-13 11:57:30,367][0m Trial 271 finished with value: 0.7726049984792007 and parameters: {'alpha': 1.3121297868931128, 'ties': 'efron'}. Best is trial 126 with value: 0.7727034345528856.[0m
[32m[I 2022-04-13 11:57:34,883][0m Trial 272 finished with value: 0.7720447529274197 and parameters: {'alpha': 2.3471271175284603, 'ties': 'efron'}. Best is trial 126 with value: 0.7727034345528856.[0m
[32m[I 2022-04-13 11:57:36,939][0m Trial 273 finished with value: 0.7725986253576769 and parameters: {'alpha': 1.1826881591613378, 'ties': 'efron'}. Best is trial 126 with value: 0.7727034345528856.[0m
[32m[I 2022-04-13 11:57:39,520][0m Trial 274 finished with value: 0.772464225800189 and parameters: {'alpha': 1.4674726508887905, 'ties': 'efron'}. Best is trial 126 with value: 0.7727034345528856.[0m
[32m[I 2022-04-13 11:57:41,884][0m Trial 275 finished with value: 0.772596822759273 and parameters: {'alpha': 1.0692268553144555, 'ties': 'efron'}. Best is trial 126 with value: 0.7727034345528856.[0m
[32m[I 2022-04-13 11:57:45,809][0m Trial 276 finished with value: 0.7726304900812113 and parameters: {'alpha': 1.2661574221814487, 'ties': 'efron'}. Best is trial 126 with value: 0.7727034345528856.[0m
[32m[I 2022-04-13 11:57:49,121][0m Trial 277 finished with value: 0.7724784766007293 and parameters: {'alpha': 1.3887638188258182, 'ties': 'efron'}. Best is trial 126 with value: 0.7727034345528856.[0m
[32m[I 2022-04-13 11:57:53,105][0m Trial 278 finished with value: 0.772678046581848 and parameters: {'alpha': 1.216884024139689, 'ties': 'efron'}. Best is trial 126 with value: 0.7727034345528856.[0m
[32m[I 2022-04-13 11:57:56,586][0m Trial 279 finished with value: 0.7726152184429692 and parameters: {'alpha': 0.9011403033184051, 'ties': 'efron'}. Best is trial 126 with value: 0.7727034345528856.[0m
[32m[I 2022-04-13 11:57:59,679][0m Trial 280 finished with value: 0.7726099351227351 and parameters: {'alpha': 1.1245353654427261, 'ties': 'efron'}. Best is trial 126 with value: 0.7727034345528856.[0m
[32m[I 2022-04-13 11:58:03,125][0m Trial 281 finished with value: 0.7725520209594091 and parameters: {'alpha': 1.0312100597295293, 'ties': 'efron'}. Best is trial 126 with value: 0.7727034345528856.[0m
[32m[I 2022-04-13 11:58:06,318][0m Trial 282 finished with value: 0.7725410440813648 and parameters: {'alpha': 1.3589526077171235, 'ties': 'efron'}. Best is trial 126 with value: 0.7727034345528856.[0m
[32m[I 2022-04-13 11:58:08,787][0m Trial 283 finished with value: 0.7725953869402695 and parameters: {'alpha': 1.1981340539275565, 'ties': 'efron'}. Best is trial 126 with value: 0.7727034345528856.[0m
[32m[I 2022-04-13 11:58:11,868][0m Trial 284 finished with value: 0.772615435112072 and parameters: {'alpha': 1.2944320882601983, 'ties': 'efron'}. Best is trial 126 with value: 0.7727034345528856.[0m
[32m[I 2022-04-13 11:58:14,861][0m Trial 285 finished with value: 0.7724708154348553 and parameters: {'alpha': 1.4945082376317869, 'ties': 'breslow'}. Best is trial 126 with value: 0.7727034345528856.[0m
[32m[I 2022-04-13 11:58:18,405][0m Trial 286 finished with value: 0.7726049965235908 and parameters: {'alpha': 1.125834500477064, 'ties': 'efron'}. Best is trial 126 with value: 0.7727034345528856.[0m
[32m[I 2022-04-13 11:58:21,172][0m Trial 287 finished with value: 0.7725518433299403 and parameters: {'alpha': 0.986854867313857, 'ties': 'efron'}. Best is trial 126 with value: 0.7727034345528856.[0m
[32m[I 2022-04-13 11:58:24,831][0m Trial 288 finished with value: 0.7726632417534969 and parameters: {'alpha': 1.233305456803556, 'ties': 'efron'}. Best is trial 126 with value: 0.7727034345528856.[0m
[32m[I 2022-04-13 11:58:28,288][0m Trial 289 finished with value: 0.7724939515620228 and parameters: {'alpha': 1.381726118698033, 'ties': 'efron'}. Best is trial 126 with value: 0.7727034345528856.[0m
[32m[I 2022-04-13 11:58:31,166][0m Trial 290 finished with value: 0.7725841925677589 and parameters: {'alpha': 1.161294383546064, 'ties': 'efron'}. Best is trial 126 with value: 0.7727034345528856.[0m
[32m[I 2022-04-13 11:58:35,042][0m Trial 291 finished with value: 0.7726288453450905 and parameters: {'alpha': 1.288833650550372, 'ties': 'efron'}. Best is trial 126 with value: 0.7727034345528856.[0m
[32m[I 2022-04-13 11:58:40,076][0m Trial 292 finished with value: 0.7726121935786419 and parameters: {'alpha': 1.0787149220927221, 'ties': 'efron'}. Best is trial 126 with value: 0.7727034345528856.[0m
[32m[I 2022-04-13 11:58:44,082][0m Trial 293 finished with value: 0.7724843959036817 and parameters: {'alpha': 1.5618305477410044, 'ties': 'efron'}. Best is trial 126 with value: 0.7727034345528856.[0m
[32m[I 2022-04-13 11:58:46,843][0m Trial 294 finished with value: 0.7727034345528856 and parameters: {'alpha': 1.2136057536735252, 'ties': 'efron'}. Best is trial 126 with value: 0.7727034345528856.[0m
[32m[I 2022-04-13 11:58:49,107][0m Trial 295 finished with value: 0.7725339707087346 and parameters: {'alpha': 1.352898611945606, 'ties': 'efron'}. Best is trial 126 with value: 0.7727034345528856.[0m
[32m[I 2022-04-13 11:58:52,464][0m Trial 296 finished with value: 0.7725811593458979 and parameters: {'alpha': 0.9890083752801508, 'ties': 'efron'}. Best is trial 126 with value: 0.7727034345528856.[0m
[32m[I 2022-04-13 11:58:57,174][0m Trial 297 finished with value: 0.7725935008392419 and parameters: {'alpha': 1.1814743138450279, 'ties': 'efron'}. Best is trial 126 with value: 0.7727034345528856.[0m
[32m[I 2022-04-13 11:59:02,076][0m Trial 298 finished with value: 0.7724678032999279 and parameters: {'alpha': 1.4125654227385906, 'ties': 'efron'}. Best is trial 126 with value: 0.7727034345528856.[0m
[32m[I 2022-04-13 11:59:06,375][0m Trial 299 finished with value: 0.7722796153555913 and parameters: {'alpha': 2.1593379806370514, 'ties': 'efron'}. Best is trial 126 with value: 0.7727034345528856.[0m
[32m[I 2022-04-13 11:59:09,954][0m Trial 300 finished with value: 0.7726445816655405 and parameters: {'alpha': 1.25622341733681, 'ties': 'efron'}. Best is trial 126 with value: 0.7727034345528856.[0m
[32m[I 2022-04-13 11:59:14,115][0m Trial 301 finished with value: 0.7725724170390487 and parameters: {'alpha': 1.1073678865430863, 'ties': 'efron'}. Best is trial 126 with value: 0.7727034345528856.[0m
[32m[I 2022-04-13 11:59:17,107][0m Trial 302 finished with value: 0.7725848982892402 and parameters: {'alpha': 1.3025161505492902, 'ties': 'efron'}. Best is trial 126 with value: 0.7727034345528856.[0m
[32m[I 2022-04-13 11:59:19,977][0m Trial 303 finished with value: 0.7725202720743485 and parameters: {'alpha': 0.8359930084536219, 'ties': 'efron'}. Best is trial 126 with value: 0.7727034345528856.[0m
[32m[I 2022-04-13 11:59:22,457][0m Trial 304 finished with value: 0.7726154320298018 and parameters: {'alpha': 1.183925934270644, 'ties': 'breslow'}. Best is trial 126 with value: 0.7727034345528856.[0m
[32m[I 2022-04-13 11:59:26,497][0m Trial 305 finished with value: 0.7725168769254052 and parameters: {'alpha': 1.0432883219552262, 'ties': 'efron'}. Best is trial 126 with value: 0.7727034345528856.[0m
[32m[I 2022-04-13 11:59:30,978][0m Trial 306 finished with value: 0.7725388712959806 and parameters: {'alpha': 1.3517743004901603, 'ties': 'efron'}. Best is trial 126 with value: 0.7727034345528856.[0m
[32m[I 2022-04-13 11:59:33,829][0m Trial 307 finished with value: 0.7699956067356245 and parameters: {'alpha': 3.938092274708108, 'ties': 'efron'}. Best is trial 126 with value: 0.7727034345528856.[0m
[32m[I 2022-04-13 11:59:37,590][0m Trial 308 finished with value: 0.7724534750633303 and parameters: {'alpha': 1.452300275781441, 'ties': 'efron'}. Best is trial 126 with value: 0.7727034345528856.[0m
[32m[I 2022-04-13 11:59:40,394][0m Trial 309 finished with value: 0.7726632417534969 and parameters: {'alpha': 1.2290513477847635, 'ties': 'efron'}. Best is trial 126 with value: 0.7727034345528856.[0m
[32m[I 2022-04-13 11:59:43,419][0m Trial 310 finished with value: 0.7725536445706671 and parameters: {'alpha': 1.101548331391379, 'ties': 'efron'}. Best is trial 126 with value: 0.7727034345528856.[0m
[32m[I 2022-04-13 11:59:47,336][0m Trial 311 finished with value: 0.7726458652276589 and parameters: {'alpha': 0.9626897906341105, 'ties': 'efron'}. Best is trial 126 with value: 0.7727034345528856.[0m
[32m[I 2022-04-13 11:59:50,735][0m Trial 312 finished with value: 0.7725731131895895 and parameters: {'alpha': 1.1708366641367542, 'ties': 'efron'}. Best is trial 126 with value: 0.7727034345528856.[0m
[32m[I 2022-04-13 11:59:53,264][0m Trial 313 finished with value: 0.7726400942618177 and parameters: {'alpha': 1.2813379154949107, 'ties': 'efron'}. Best is trial 126 with value: 0.7727034345528856.[0m
[32m[I 2022-04-13 11:59:56,776][0m Trial 314 finished with value: 0.7724722369269584 and parameters: {'alpha': 1.4080432096808024, 'ties': 'efron'}. Best is trial 126 with value: 0.7727034345528856.[0m
[32m[I 2022-04-13 12:00:01,302][0m Trial 315 finished with value: 0.7724596756577947 and parameters: {'alpha': 1.5104557139588832, 'ties': 'efron'}. Best is trial 126 with value: 0.7727034345528856.[0m
[32m[I 2022-04-13 12:00:04,012][0m Trial 316 finished with value: 0.7691935757037749 and parameters: {'alpha': 4.567519823990418, 'ties': 'efron'}. Best is trial 126 with value: 0.7727034345528856.[0m
[32m[I 2022-04-13 12:00:06,604][0m Trial 317 finished with value: 0.7725968858851369 and parameters: {'alpha': 1.072010960836619, 'ties': 'efron'}. Best is trial 126 with value: 0.7727034345528856.[0m
[32m[I 2022-04-13 12:00:09,542][0m Trial 318 finished with value: 0.7726400992616196 and parameters: {'alpha': 1.2866673693587027, 'ties': 'efron'}. Best is trial 126 with value: 0.7727034345528856.[0m
[32m[I 2022-04-13 12:00:14,274][0m Trial 319 finished with value: 0.772590346019485 and parameters: {'alpha': 1.173229314895189, 'ties': 'efron'}. Best is trial 126 with value: 0.7727034345528856.[0m
[32m[I 2022-04-13 12:00:18,401][0m Trial 320 finished with value: 0.772668248106903 and parameters: {'alpha': 1.2256178450528168, 'ties': 'efron'}. Best is trial 126 with value: 0.7727034345528856.[0m
