[32m[I 2022-04-13 12:18:42,245][0m Trial 260 finished with value: 0.7717275448789532 and parameters: {'splitter': 'best', 'min_samples_split': 0.12093612847013901, 'min_samples_leaf': 0.051955696838357365, 'min_weight_fraction_leaf': 0.04076933325107315, 'max_features': 0.9840068964612061}. Best is trial 241 with value: 0.7773840258827056.[0m
[32m[I 2022-04-13 12:18:43,423][0m Trial 261 finished with value: 0.7746194355071075 and parameters: {'splitter': 'best', 'min_samples_split': 0.1384150597835061, 'min_samples_leaf': 0.04079808434499514, 'min_weight_fraction_leaf': 0.03294056133113857, 'max_features': 0.9989665033625766}. Best is trial 241 with value: 0.7773840258827056.[0m
[32m[I 2022-04-13 12:18:43,599][0m Trial 262 finished with value: 0.74295075747259 and parameters: {'splitter': 'random', 'min_samples_split': 0.1471779965303714, 'min_samples_leaf': 0.038880902119085375, 'min_weight_fraction_leaf': 0.04946733212884609, 'max_features': 0.9994865558211379}. Best is trial 241 with value: 0.7773840258827056.[0m
[32m[I 2022-04-13 12:18:44,421][0m Trial 263 finished with value: 0.6743624146605087 and parameters: {'splitter': 'best', 'min_samples_split': 0.13370561115076454, 'min_samples_leaf': 0.3063058262903545, 'min_weight_fraction_leaf': 0.035136070683418404, 'max_features': 0.999959668191989}. Best is trial 241 with value: 0.7773840258827056.[0m
[32m[I 2022-04-13 12:18:47,229][0m Trial 264 finished with value: 0.7589266473811807 and parameters: {'splitter': 'best', 'min_samples_split': 0.1446254481182735, 'min_samples_leaf': 0.040893397523638894, 'min_weight_fraction_leaf': 0.06158948614281897, 'max_features': 0.9553052055634808}. Best is trial 241 with value: 0.7773840258827056.[0m
[32m[I 2022-04-13 12:18:47,593][0m Trial 265 finished with value: 0.6410077772049961 and parameters: {'splitter': 'best', 'min_samples_split': 0.10585042462604247, 'min_samples_leaf': 0.06217414748461085, 'min_weight_fraction_leaf': 0.04332092720866275, 'max_features': 0.23156043199218124}. Best is trial 241 with value: 0.7773840258827056.[0m
[32m[I 2022-04-13 12:18:50,916][0m Trial 266 finished with value: 0.763291005928517 and parameters: {'splitter': 'best', 'min_samples_split': 0.13880644185357327, 'min_samples_leaf': 0.02086252383883045, 'min_weight_fraction_leaf': 0.07508746658010707, 'max_features': 0.915098469289433}. Best is trial 241 with value: 0.7773840258827056.[0m
[32m[I 2022-04-13 12:18:51,361][0m Trial 267 finished with value: 0.7279964938322407 and parameters: {'splitter': 'best', 'min_samples_split': 0.1531875941057733, 'min_samples_leaf': 0.27873122497767827, 'min_weight_fraction_leaf': 0.03275574516288889, 'max_features': 0.9828309042901627}. Best is trial 241 with value: 0.7773840258827056.[0m
[32m[I 2022-04-13 12:18:53,630][0m Trial 268 finished with value: 0.7664044974848828 and parameters: {'splitter': 'best', 'min_samples_split': 0.12589894746299268, 'min_samples_leaf': 0.0311347002070187, 'min_weight_fraction_leaf': 0.02288985448820475, 'max_features': 0.961809592334956}. Best is trial 241 with value: 0.7773840258827056.[0m
[32m[I 2022-04-13 12:18:55,489][0m Trial 269 finished with value: 0.7673429284032343 and parameters: {'splitter': 'best', 'min_samples_split': 0.11386883077808166, 'min_samples_leaf': 0.0426820461290412, 'min_weight_fraction_leaf': 0.052512069079832066, 'max_features': 0.9371635168152379}. Best is trial 241 with value: 0.7773840258827056.[0m
[32m[I 2022-04-13 12:18:56,309][0m Trial 270 finished with value: 0.770042804592184 and parameters: {'splitter': 'best', 'min_samples_split': 0.10760836087505413, 'min_samples_leaf': 0.055911092046873424, 'min_weight_fraction_leaf': 0.03468506169482924, 'max_features': 0.9801447416639258}. Best is trial 241 with value: 0.7773840258827056.[0m
[32m[I 2022-04-13 12:18:57,754][0m Trial 271 finished with value: 0.7668283401318516 and parameters: {'splitter': 'best', 'min_samples_split': 0.12614200519862176, 'min_samples_leaf': 0.017666710861353567, 'min_weight_fraction_leaf': 0.02218504997969631, 'max_features': 0.9637836987894647}. Best is trial 241 with value: 0.7773840258827056.[0m
[32m[I 2022-04-13 12:18:59,434][0m Trial 272 finished with value: 0.7737566251946392 and parameters: {'splitter': 'best', 'min_samples_split': 0.10704067109369712, 'min_samples_leaf': 0.032280712644175466, 'min_weight_fraction_leaf': 0.042096062172746265, 'max_features': 0.9839913638189527}. Best is trial 241 with value: 0.7773840258827056.[0m
[32m[I 2022-04-13 12:19:01,299][0m Trial 273 finished with value: 0.7730713528570081 and parameters: {'splitter': 'best', 'min_samples_split': 0.10761463818336278, 'min_samples_leaf': 0.042597736383224546, 'min_weight_fraction_leaf': 0.04621838734173486, 'max_features': 0.9987838376127227}. Best is trial 241 with value: 0.7773840258827056.[0m
[32m[I 2022-04-13 12:19:02,644][0m Trial 274 finished with value: 0.7709004221224879 and parameters: {'splitter': 'best', 'min_samples_split': 0.10613167827225543, 'min_samples_leaf': 0.08048550226997214, 'min_weight_fraction_leaf': 0.06364764558422686, 'max_features': 0.9997125710056589}. Best is trial 241 with value: 0.7773840258827056.[0m
[32m[I 2022-04-13 12:19:04,616][0m Trial 275 finished with value: 0.7672674184145449 and parameters: {'splitter': 'best', 'min_samples_split': 0.1147925417994506, 'min_samples_leaf': 0.06974963390619852, 'min_weight_fraction_leaf': 0.04756217711355715, 'max_features': 0.9436543888958102}. Best is trial 241 with value: 0.7773840258827056.[0m
[32m[I 2022-04-13 12:19:06,933][0m Trial 276 finished with value: 0.7664913355270987 and parameters: {'splitter': 'best', 'min_samples_split': 0.09393930996215677, 'min_samples_leaf': 0.04648077311740031, 'min_weight_fraction_leaf': 0.056983487401156024, 'max_features': 0.9620205121828713}. Best is trial 241 with value: 0.7773840258827056.[0m
[32m[I 2022-04-13 12:19:07,942][0m Trial 277 finished with value: 0.7755444750580656 and parameters: {'splitter': 'best', 'min_samples_split': 0.10435895422462525, 'min_samples_leaf': 0.03185912902750628, 'min_weight_fraction_leaf': 0.04520085512569795, 'max_features': 0.9856219989201764}. Best is trial 241 with value: 0.7773840258827056.[0m
[32m[I 2022-04-13 12:19:08,491][0m Trial 278 finished with value: 0.6158725266438454 and parameters: {'splitter': 'best', 'min_samples_split': 0.10628719795624052, 'min_samples_leaf': 0.030391311884057706, 'min_weight_fraction_leaf': 0.2864719621707979, 'max_features': 0.7042115588855171}. Best is trial 241 with value: 0.7773840258827056.[0m
[32m[I 2022-04-13 12:19:09,353][0m Trial 279 finished with value: 0.7709381210267165 and parameters: {'splitter': 'best', 'min_samples_split': 0.09258423963559609, 'min_samples_leaf': 0.051881239767018764, 'min_weight_fraction_leaf': 0.0450987874483069, 'max_features': 0.9810079301132874}. Best is trial 241 with value: 0.7773840258827056.[0m
[32m[I 2022-04-13 12:19:10,196][0m Trial 280 finished with value: 0.7661872858519261 and parameters: {'splitter': 'best', 'min_samples_split': 0.10251715201993047, 'min_samples_leaf': 0.05895685096902192, 'min_weight_fraction_leaf': 0.06923163635221963, 'max_features': 0.9257963341174095}. Best is trial 241 with value: 0.7773840258827056.[0m
[32m[I 2022-04-13 12:19:11,470][0m Trial 281 finished with value: 0.7701298953539938 and parameters: {'splitter': 'best', 'min_samples_split': 0.11536610608321819, 'min_samples_leaf': 0.016344804711314533, 'min_weight_fraction_leaf': 0.0564525459543484, 'max_features': 0.9994064974165248}. Best is trial 241 with value: 0.7773840258827056.[0m
[32m[I 2022-04-13 12:19:11,666][0m Trial 282 finished with value: 0.7656483421925616 and parameters: {'splitter': 'random', 'min_samples_split': 0.12277236665875482, 'min_samples_leaf': 0.02892301922924041, 'min_weight_fraction_leaf': 0.04208499734972266, 'max_features': 0.9515017674906371}. Best is trial 241 with value: 0.7773840258827056.[0m
[32m[I 2022-04-13 12:19:13,111][0m Trial 283 finished with value: 0.7278752904252518 and parameters: {'splitter': 'best', 'min_samples_split': 0.0967106031619839, 'min_samples_leaf': 0.04371100057999007, 'min_weight_fraction_leaf': 0.22232607072176114, 'max_features': 0.9816047265602476}. Best is trial 241 with value: 0.7773840258827056.[0m
[32m[I 2022-04-13 12:19:14,524][0m Trial 284 finished with value: 0.7492814270451507 and parameters: {'splitter': 'best', 'min_samples_split': 0.11187950578093593, 'min_samples_leaf': 0.007375948482620786, 'min_weight_fraction_leaf': 0.0399445773034459, 'max_features': 0.4384710679173367}. Best is trial 241 with value: 0.7773840258827056.[0m
[32m[I 2022-04-13 12:19:16,990][0m Trial 285 finished with value: 0.7656318986033994 and parameters: {'splitter': 'best', 'min_samples_split': 0.10537280974573637, 'min_samples_leaf': 0.03345568318574861, 'min_weight_fraction_leaf': 0.05407391648612527, 'max_features': 0.9660031604566498}. Best is trial 241 with value: 0.7773840258827056.[0m
[32m[I 2022-04-13 12:19:17,284][0m Trial 286 finished with value: 0.594245264829041 and parameters: {'splitter': 'best', 'min_samples_split': 0.1332057918177964, 'min_samples_leaf': 0.38982877760650547, 'min_weight_fraction_leaf': 0.0840992641327096, 'max_features': 0.9481255614950479}. Best is trial 241 with value: 0.7773840258827056.[0m
[32m[I 2022-04-13 12:19:19,512][0m Trial 287 finished with value: 0.773744453223668 and parameters: {'splitter': 'best', 'min_samples_split': 0.12092833133177147, 'min_samples_leaf': 0.02434075255687026, 'min_weight_fraction_leaf': 0.04664378062174083, 'max_features': 0.9829371475190073}. Best is trial 241 with value: 0.7773840258827056.[0m
[32m[I 2022-04-13 12:19:21,856][0m Trial 288 finished with value: 0.7655133001775176 and parameters: {'splitter': 'best', 'min_samples_split': 0.12435275474158383, 'min_samples_leaf': 0.019972072281181242, 'min_weight_fraction_leaf': 0.06561388803305057, 'max_features': 0.9992278130868847}. Best is trial 241 with value: 0.7773840258827056.[0m
[32m[I 2022-04-13 12:19:24,518][0m Trial 289 finished with value: 0.7170485784080588 and parameters: {'splitter': 'best', 'min_samples_split': 0.09922191364821638, 'min_samples_leaf': 0.00684147216022073, 'min_weight_fraction_leaf': 0.15636460048475992, 'max_features': 0.9649509438830808}. Best is trial 241 with value: 0.7773840258827056.[0m
[32m[I 2022-04-13 12:19:27,115][0m Trial 290 finished with value: 0.7697309975819872 and parameters: {'splitter': 'best', 'min_samples_split': 0.0910862227998708, 'min_samples_leaf': 0.02413157700199358, 'min_weight_fraction_leaf': 0.04425999053181237, 'max_features': 0.9333509964102771}. Best is trial 241 with value: 0.7773840258827056.[0m
[32m[I 2022-04-13 12:19:27,602][0m Trial 291 finished with value: 0.7172876461370647 and parameters: {'splitter': 'best', 'min_samples_split': 0.1109094840147421, 'min_samples_leaf': 0.032947801977300316, 'min_weight_fraction_leaf': 0.053551279500066246, 'max_features': 0.35486541778712044}. Best is trial 241 with value: 0.7773840258827056.[0m
[32m[I 2022-04-13 12:19:28,819][0m Trial 292 finished with value: 0.7733585523886888 and parameters: {'splitter': 'best', 'min_samples_split': 0.12876338665454964, 'min_samples_leaf': 0.040100647863727606, 'min_weight_fraction_leaf': 0.03540746507114302, 'max_features': 0.9840712707945362}. Best is trial 241 with value: 0.7773840258827056.[0m
[32m[I 2022-04-13 12:19:32,120][0m Trial 293 finished with value: 0.7748236257398279 and parameters: {'splitter': 'best', 'min_samples_split': 0.1369022971185855, 'min_samples_leaf': 0.04125127763776064, 'min_weight_fraction_leaf': 0.04662625545186583, 'max_features': 0.9814275808933584}. Best is trial 241 with value: 0.7773840258827056.[0m
[32m[I 2022-04-13 12:19:33,132][0m Trial 294 finished with value: 0.7616189072405566 and parameters: {'splitter': 'best', 'min_samples_split': 0.13241740061738436, 'min_samples_leaf': 0.16696750702406044, 'min_weight_fraction_leaf': 0.060377191186032894, 'max_features': 0.9999481490655889}. Best is trial 241 with value: 0.7773840258827056.[0m
[32m[I 2022-04-13 12:19:33,615][0m Trial 295 finished with value: 0.5935837819302742 and parameters: {'splitter': 'best', 'min_samples_split': 0.14150032267820328, 'min_samples_leaf': 0.3489750804379155, 'min_weight_fraction_leaf': 0.04813774426776238, 'max_features': 0.9627079282390728}. Best is trial 241 with value: 0.7773840258827056.[0m
[32m[I 2022-04-13 12:19:33,939][0m Trial 296 finished with value: 0.5914687042621789 and parameters: {'splitter': 'best', 'min_samples_split': 0.12662950778760482, 'min_samples_leaf': 0.43966084969003466, 'min_weight_fraction_leaf': 0.07355734738785749, 'max_features': 0.907843730967037}. Best is trial 241 with value: 0.7773840258827056.[0m
[32m[I 2022-04-13 12:19:36,165][0m Trial 297 finished with value: 0.7715495279008934 and parameters: {'splitter': 'best', 'min_samples_split': 0.11998921216834749, 'min_samples_leaf': 0.05882761402392115, 'min_weight_fraction_leaf': 0.04479992761500162, 'max_features': 0.9824756419968005}. Best is trial 241 with value: 0.7773840258827056.[0m
[32m[I 2022-04-13 12:19:38,343][0m Trial 298 finished with value: 0.7634963885030225 and parameters: {'splitter': 'best', 'min_samples_split': 0.13841937689119863, 'min_samples_leaf': 0.03953761644081778, 'min_weight_fraction_leaf': 0.03686714839177586, 'max_features': 0.9449572802070199}. Best is trial 241 with value: 0.7773840258827056.[0m
[32m[I 2022-04-13 12:19:39,776][0m Trial 299 finished with value: 0.7637269347633521 and parameters: {'splitter': 'best', 'min_samples_split': 0.13032139475009896, 'min_samples_leaf': 0.043943135032306034, 'min_weight_fraction_leaf': 0.04872133760842323, 'max_features': 0.9657807729139682}. Best is trial 241 with value: 0.7773840258827056.[0m
[32m[I 2022-04-13 12:19:41,439][0m Trial 300 finished with value: 0.7715389160410744 and parameters: {'splitter': 'best', 'min_samples_split': 0.11943671631210878, 'min_samples_leaf': 0.028990060708398456, 'min_weight_fraction_leaf': 0.060525285503174445, 'max_features': 0.9773242224938534}. Best is trial 241 with value: 0.7773840258827056.[0m
[32m[I 2022-04-13 12:19:42,564][0m Trial 301 finished with value: 0.770042804592184 and parameters: {'splitter': 'best', 'min_samples_split': 0.11257748736083371, 'min_samples_leaf': 0.05453571531019113, 'min_weight_fraction_leaf': 0.0372457117220923, 'max_features': 0.9992900938478629}. Best is trial 241 with value: 0.7773840258827056.[0m
[32m[I 2022-04-13 12:19:44,887][0m Trial 302 finished with value: 0.7675351236702185 and parameters: {'splitter': 'best', 'min_samples_split': 0.13925830371303524, 'min_samples_leaf': 0.06688499681164758, 'min_weight_fraction_leaf': 0.054571874267795493, 'max_features': 0.9494620589129635}. Best is trial 241 with value: 0.7773840258827056.[0m
[32m[I 2022-04-13 12:19:45,499][0m Trial 303 finished with value: 0.751554492304753 and parameters: {'splitter': 'random', 'min_samples_split': 0.12842577651769965, 'min_samples_leaf': 0.03507968045478182, 'min_weight_fraction_leaf': 0.03227111559198775, 'max_features': 0.9849829477466341}. Best is trial 241 with value: 0.7773840258827056.[0m
[32m[I 2022-04-13 12:19:47,683][0m Trial 304 finished with value: 0.7682714470928507 and parameters: {'splitter': 'best', 'min_samples_split': 0.10942962019589295, 'min_samples_leaf': 0.022544945047478268, 'min_weight_fraction_leaf': 0.04134542017830558, 'max_features': 0.6207326015246298}. Best is trial 241 with value: 0.7773840258827056.[0m
[32m[I 2022-04-13 12:19:49,707][0m Trial 305 finished with value: 0.7599825405989563 and parameters: {'splitter': 'best', 'min_samples_split': 0.1207237036250339, 'min_samples_leaf': 0.041353557552993955, 'min_weight_fraction_leaf': 0.07669887561547667, 'max_features': 0.7302724502205755}. Best is trial 241 with value: 0.7773840258827056.[0m
[32m[I 2022-04-13 12:19:51,861][0m Trial 306 finished with value: 0.7555537707012393 and parameters: {'splitter': 'best', 'min_samples_split': 0.22171622553002432, 'min_samples_leaf': 0.050298144189867035, 'min_weight_fraction_leaf': 0.06627691963857044, 'max_features': 0.9272530371122991}. Best is trial 241 with value: 0.7773840258827056.[0m
[32m[I 2022-04-13 12:19:54,526][0m Trial 307 finished with value: 0.7676051739954209 and parameters: {'splitter': 'best', 'min_samples_split': 0.10445697213715459, 'min_samples_leaf': 0.03239657652397924, 'min_weight_fraction_leaf': 0.049499981556366084, 'max_features': 0.9653524093335654}. Best is trial 241 with value: 0.7773840258827056.[0m
[32m[I 2022-04-13 12:19:56,626][0m Trial 308 finished with value: 0.770084767472636 and parameters: {'splitter': 'best', 'min_samples_split': 0.09329260031654939, 'min_samples_leaf': 0.056710827824966545, 'min_weight_fraction_leaf': 0.03552674201933993, 'max_features': 0.980901325399387}. Best is trial 241 with value: 0.7773840258827056.[0m
[32m[I 2022-04-13 12:19:58,287][0m Trial 309 finished with value: 0.7649878589899146 and parameters: {'splitter': 'best', 'min_samples_split': 0.13311087112442396, 'min_samples_leaf': 0.02367777085102883, 'min_weight_fraction_leaf': 0.029445894530304585, 'max_features': 0.9572180799526097}. Best is trial 241 with value: 0.7773840258827056.[0m
[32m[I 2022-04-13 12:20:01,098][0m Trial 310 finished with value: 0.7715495279008934 and parameters: {'splitter': 'best', 'min_samples_split': 0.11772740449972297, 'min_samples_leaf': 0.04401511148211407, 'min_weight_fraction_leaf': 0.058789634737916305, 'max_features': 0.98369820433671}. Best is trial 241 with value: 0.7773840258827056.[0m
[32m[I 2022-04-13 12:20:04,102][0m Trial 311 finished with value: 0.7640411842665793 and parameters: {'splitter': 'best', 'min_samples_split': 0.1452591288795368, 'min_samples_leaf': 0.015546778722362178, 'min_weight_fraction_leaf': 0.04345938190531178, 'max_features': 0.9395999237066972}. Best is trial 241 with value: 0.7773840258827056.[0m
[32m[I 2022-04-13 12:20:05,505][0m Trial 312 finished with value: 0.7669208247374579 and parameters: {'splitter': 'best', 'min_samples_split': 0.10549899491961981, 'min_samples_leaf': 0.0700843998341227, 'min_weight_fraction_leaf': 0.0261323574949857, 'max_features': 0.9994511601979778}. Best is trial 241 with value: 0.7773840258827056.[0m
[32m[I 2022-04-13 12:20:06,658][0m Trial 313 finished with value: 0.6877160847885119 and parameters: {'splitter': 'best', 'min_samples_split': 0.12511250477138647, 'min_samples_leaf': 0.03418752492604978, 'min_weight_fraction_leaf': 0.048217469223950066, 'max_features': 0.2888383114123104}. Best is trial 241 with value: 0.7773840258827056.[0m
[32m[I 2022-04-13 12:20:10,470][0m Trial 314 finished with value: 0.7651285798971866 and parameters: {'splitter': 'best', 'min_samples_split': 0.09270503991604934, 'min_samples_leaf': 0.044896377260270744, 'min_weight_fraction_leaf': 0.03315784669121152, 'max_features': 0.9646498630600145}. Best is trial 241 with value: 0.7773840258827056.[0m
[32m[I 2022-04-13 12:20:11,801][0m Trial 315 finished with value: 0.5907975833158018 and parameters: {'splitter': 'best', 'min_samples_split': 0.11505103138804641, 'min_samples_leaf': 0.026472467731486954, 'min_weight_fraction_leaf': 0.42116886382853064, 'max_features': 0.9991991545784507}. Best is trial 241 with value: 0.7773840258827056.[0m
[32m[I 2022-04-13 12:20:13,912][0m Trial 316 finished with value: 0.7687998968101384 and parameters: {'splitter': 'best', 'min_samples_split': 0.135822550420745, 'min_samples_leaf': 0.05440805447262785, 'min_weight_fraction_leaf': 0.05352680677573684, 'max_features': 0.9653911455671867}. Best is trial 241 with value: 0.7773840258827056.[0m
[32m[I 2022-04-13 12:20:15,451][0m Trial 317 finished with value: 0.7733002551969935 and parameters: {'splitter': 'best', 'min_samples_split': 0.10578156226599206, 'min_samples_leaf': 0.03854734822387429, 'min_weight_fraction_leaf': 0.021743655870032207, 'max_features': 0.9821487080133805}. Best is trial 241 with value: 0.7773840258827056.[0m
[32m[I 2022-04-13 12:20:17,367][0m Trial 318 finished with value: 0.7142184767312153 and parameters: {'splitter': 'best', 'min_samples_split': 0.4229539277295662, 'min_samples_leaf': 0.010654479898456618, 'min_weight_fraction_leaf': 0.021334871763994352, 'max_features': 0.9141145094482439}. Best is trial 241 with value: 0.7773840258827056.[0m
[32m[I 2022-04-13 12:20:19,820][0m Trial 319 finished with value: 0.7668816587884899 and parameters: {'splitter': 'best', 'min_samples_split': 0.12482749517018944, 'min_samples_leaf': 0.03188685524295818, 'min_weight_fraction_leaf': 0.019623968033509687, 'max_features': 0.94467384529294}. Best is trial 241 with value: 0.7773840258827056.[0m
[32m[I 2022-04-13 12:20:22,592][0m Trial 320 finished with value: 0.772792401801716 and parameters: {'splitter': 'best', 'min_samples_split': 0.09868350143239234, 'min_samples_leaf': 0.021944574818918264, 'min_weight_fraction_leaf': 0.031960523013384194, 'max_features': 0.9772543455747227}. Best is trial 241 with value: 0.7773840258827056.[0m
[32m[I 2022-04-13 12:20:25,441][0m Trial 321 finished with value: 0.7672440923785013 and parameters: {'splitter': 'best', 'min_samples_split': 0.11348829534869746, 'min_samples_leaf': 0.06361985477046032, 'min_weight_fraction_leaf': 0.036226792200893865, 'max_features': 0.9492397884045193}. Best is trial 241 with value: 0.7773840258827056.[0m
[32m[I 2022-04-13 12:20:25,957][0m Trial 322 finished with value: 0.7523860264318164 and parameters: {'splitter': 'random', 'min_samples_split': 0.14147025636593621, 'min_samples_leaf': 0.0011634446759044223, 'min_weight_fraction_leaf': 0.01999367094284343, 'max_features': 0.9681401539966507}. Best is trial 241 with value: 0.7773840258827056.[0m
