[32m[I 2022-04-16 08:22:41,059][0m Trial 500 finished with value: 0.7784116356641513 and parameters: {'n_hidden': 32, 'mixture_components': 9, 'use_sparse_layer': True, 'use_sparse_loss': False, 'use_batchnorm': False, 'use_dropout': True, 'dropout': 0.5117887876128651, 'mlp_size_1': 2, 'mlp_size_2': 0, 'mlp_size_3': 0, 'kernel': 'Weibull', 'loss_name': 'CensoredNLLLoss'}. Best is trial 474 with value: 0.887294062722078.[0m
[32m[I 2022-04-16 08:25:04,364][0m Trial 501 finished with value: 0.8844653621554015 and parameters: {'n_hidden': 256, 'mixture_components': 10, 'use_sparse_layer': True, 'use_sparse_loss': False, 'use_batchnorm': False, 'use_dropout': True, 'dropout': 0.5716212830887902, 'mlp_size_1': 2, 'mlp_size_2': 3, 'mlp_size_3': 0, 'kernel': 'Weibull', 'loss_name': 'CensoredNLLLoss'}. Best is trial 474 with value: 0.887294062722078.[0m
[32m[I 2022-04-16 08:27:42,914][0m Trial 502 finished with value: 0.879724738812316 and parameters: {'n_hidden': 256, 'mixture_components': 10, 'use_sparse_layer': True, 'use_sparse_loss': False, 'use_batchnorm': False, 'use_dropout': True, 'dropout': 0.48475898362153447, 'mlp_size_1': 1, 'mlp_size_2': 4, 'mlp_size_3': 0, 'kernel': 'Weibull', 'loss_name': 'AlternativeNLLLoss'}. Best is trial 474 with value: 0.887294062722078.[0m
[32m[I 2022-04-16 08:29:44,617][0m Trial 503 finished with value: 0.6834197368115091 and parameters: {'n_hidden': 512, 'mixture_components': 9, 'use_sparse_layer': True, 'use_sparse_loss': False, 'use_batchnorm': False, 'use_dropout': True, 'dropout': 0.38617461658372926, 'mlp_size_1': 1, 'mlp_size_2': 4, 'mlp_size_3': 1, 'kernel': 'Exponential', 'loss_name': 'CensoredNLLLoss'}. Best is trial 474 with value: 0.887294062722078.[0m
[32m[I 2022-04-16 08:32:13,070][0m Trial 504 finished with value: 0.8854489725663361 and parameters: {'n_hidden': 256, 'mixture_components': 10, 'use_sparse_layer': True, 'use_sparse_loss': True, 'lmbd': 4.477302183851778e-06, 'use_batchnorm': False, 'use_dropout': True, 'dropout': 0.5373300783429844, 'mlp_size_1': 2, 'mlp_size_2': 3, 'mlp_size_3': 0, 'kernel': 'Weibull', 'loss_name': 'CensoredNLLLoss'}. Best is trial 474 with value: 0.887294062722078.[0m
[32m[I 2022-04-16 08:34:52,642][0m Trial 505 finished with value: 0.7804291761380402 and parameters: {'n_hidden': 64, 'mixture_components': 10, 'use_sparse_layer': True, 'use_sparse_loss': False, 'use_batchnorm': False, 'use_dropout': True, 'dropout': 0.34103057390114927, 'mlp_size_1': 2, 'mlp_size_2': 1, 'mlp_size_3': 0, 'kernel': 'LogLogistic', 'loss_name': 'CensoredNLLLoss'}. Best is trial 474 with value: 0.887294062722078.[0m
[32m[I 2022-04-16 08:40:00,974][0m Trial 506 finished with value: 0.8813682811233351 and parameters: {'n_hidden': 2048, 'mixture_components': 9, 'use_sparse_layer': True, 'use_sparse_loss': False, 'use_batchnorm': True, 'use_dropout': True, 'dropout': 0.41010138086576864, 'mlp_size_1': 1, 'mlp_size_2': 4, 'mlp_size_3': 2, 'kernel': 'Weibull', 'loss_name': 'CensoredNLLLoss'}. Best is trial 474 with value: 0.887294062722078.[0m
[32m[I 2022-04-16 08:42:13,481][0m Trial 507 finished with value: 0.8767306585388178 and parameters: {'n_hidden': 256, 'mixture_components': 10, 'use_sparse_layer': True, 'use_sparse_loss': False, 'use_batchnorm': False, 'use_dropout': False, 'mlp_size_1': 2, 'mlp_size_2': 3, 'mlp_size_3': 0, 'kernel': 'Weibull', 'loss_name': 'CensoredNLLLoss'}. Best is trial 474 with value: 0.887294062722078.[0m
[32m[I 2022-04-16 08:45:23,807][0m Trial 508 finished with value: 0.8770648775640705 and parameters: {'n_hidden': 32, 'mixture_components': 9, 'use_sparse_layer': True, 'use_sparse_loss': False, 'use_batchnorm': False, 'use_dropout': True, 'dropout': 0.44464497272810993, 'mlp_size_1': 2, 'mlp_size_2': 0, 'mlp_size_3': 0, 'kernel': 'Weibull', 'loss_name': 'CensoredNLLLoss'}. Best is trial 474 with value: 0.887294062722078.[0m
[32m[I 2022-04-16 08:47:57,277][0m Trial 509 finished with value: 0.883934307442756 and parameters: {'n_hidden': 1024, 'mixture_components': 10, 'use_sparse_layer': True, 'use_sparse_loss': False, 'use_batchnorm': False, 'use_dropout': True, 'dropout': 0.5027916145722334, 'mlp_size_1': 1, 'mlp_size_2': 4, 'mlp_size_3': 1, 'kernel': 'Weibull', 'loss_name': 'CensoredNLLLoss'}. Best is trial 474 with value: 0.887294062722078.[0m
[32m[I 2022-04-16 08:50:45,249][0m Trial 510 finished with value: 0.8820641978625844 and parameters: {'n_hidden': 1024, 'mixture_components': 8, 'use_sparse_layer': True, 'use_sparse_loss': False, 'use_batchnorm': False, 'use_dropout': True, 'dropout': 0.585216010606147, 'mlp_size_1': 1, 'mlp_size_2': 4, 'mlp_size_3': 1, 'kernel': 'Weibull', 'loss_name': 'CensoredNLLLoss'}. Best is trial 474 with value: 0.887294062722078.[0m
[32m[I 2022-04-16 08:53:45,518][0m Trial 511 finished with value: 0.8855377693985025 and parameters: {'n_hidden': 1024, 'mixture_components': 10, 'use_sparse_layer': True, 'use_sparse_loss': False, 'use_batchnorm': False, 'use_dropout': True, 'dropout': 0.6740727222144322, 'mlp_size_1': 1, 'mlp_size_2': 4, 'mlp_size_3': 1, 'kernel': 'Weibull', 'loss_name': 'CensoredNLLLoss'}. Best is trial 474 with value: 0.887294062722078.[0m
[32m[I 2022-04-16 08:56:12,833][0m Trial 512 finished with value: 0.8823526447751788 and parameters: {'n_hidden': 256, 'mixture_components': 7, 'use_sparse_layer': True, 'use_sparse_loss': True, 'lmbd': 7.802393650166489e-06, 'use_batchnorm': False, 'use_dropout': True, 'dropout': 0.5299809345751101, 'mlp_size_1': 2, 'mlp_size_2': 3, 'mlp_size_3': 0, 'kernel': 'Logistic', 'loss_name': 'CensoredNLLLoss'}. Best is trial 474 with value: 0.887294062722078.[0m
[32m[I 2022-04-16 08:58:34,157][0m Trial 513 finished with value: 0.754548082027652 and parameters: {'n_hidden': 1024, 'mixture_components': 10, 'use_sparse_layer': True, 'use_sparse_loss': False, 'use_batchnorm': False, 'use_dropout': True, 'dropout': 0.5571836361218728, 'mlp_size_1': 1, 'mlp_size_2': 4, 'mlp_size_3': 1, 'kernel': 'Weibull', 'loss_name': 'NLLLoss'}. Best is trial 474 with value: 0.887294062722078.[0m
[32m[I 2022-04-16 09:00:49,796][0m Trial 514 finished with value: 0.8844888089945118 and parameters: {'n_hidden': 1024, 'mixture_components': 9, 'use_sparse_layer': True, 'use_sparse_loss': False, 'use_batchnorm': False, 'use_dropout': True, 'dropout': 0.4658206280102815, 'mlp_size_1': 1, 'mlp_size_2': 4, 'mlp_size_3': 1, 'kernel': 'Gamma', 'loss_name': 'CensoredNLLLoss'}. Best is trial 474 with value: 0.887294062722078.[0m
[32m[I 2022-04-16 09:03:28,238][0m Trial 515 finished with value: 0.8843845513051505 and parameters: {'n_hidden': 1024, 'mixture_components': 10, 'use_sparse_layer': True, 'use_sparse_loss': False, 'use_batchnorm': False, 'use_dropout': True, 'dropout': 0.620277264843778, 'mlp_size_1': 1, 'mlp_size_2': 4, 'mlp_size_3': 1, 'kernel': 'Weibull', 'loss_name': 'CensoredNLLLoss'}. Best is trial 474 with value: 0.887294062722078.[0m
[32m[I 2022-04-16 09:06:20,310][0m Trial 516 finished with value: 0.87905998345694 and parameters: {'n_hidden': 128, 'mixture_components': 9, 'use_sparse_layer': True, 'use_sparse_loss': False, 'use_batchnorm': False, 'use_dropout': True, 'dropout': 0.4199935528555715, 'mlp_size_1': 2, 'mlp_size_2': 2, 'mlp_size_3': 0, 'kernel': 'Weibull', 'loss_name': 'AlternativeNLLLoss'}. Best is trial 474 with value: 0.887294062722078.[0m
[32m[I 2022-04-16 09:09:00,160][0m Trial 517 finished with value: 0.8856396718724187 and parameters: {'n_hidden': 1024, 'mixture_components': 10, 'use_sparse_layer': True, 'use_sparse_loss': False, 'use_batchnorm': False, 'use_dropout': True, 'dropout': 0.5541485243919413, 'mlp_size_1': 1, 'mlp_size_2': 4, 'mlp_size_3': 1, 'kernel': 'Weibull', 'loss_name': 'CensoredNLLLoss'}. Best is trial 474 with value: 0.887294062722078.[0m
[32m[I 2022-04-16 09:11:44,173][0m Trial 518 finished with value: 0.881729276721052 and parameters: {'n_hidden': 1024, 'mixture_components': 10, 'use_sparse_layer': True, 'use_sparse_loss': False, 'use_batchnorm': False, 'use_dropout': True, 'dropout': 0.582742811242257, 'mlp_size_1': 0, 'mlp_size_2': 4, 'mlp_size_3': 1, 'kernel': 'Weibull', 'loss_name': 'CensoredNLLLoss'}. Best is trial 474 with value: 0.887294062722078.[0m
[32m[I 2022-04-16 09:14:14,021][0m Trial 519 finished with value: 0.8836156541700255 and parameters: {'n_hidden': 256, 'mixture_components': 9, 'use_sparse_layer': True, 'use_sparse_loss': False, 'use_batchnorm': False, 'use_dropout': True, 'dropout': 0.50789510921114, 'mlp_size_1': 2, 'mlp_size_2': 3, 'mlp_size_3': 0, 'kernel': 'Weibull', 'loss_name': 'CensoredNLLLoss'}. Best is trial 474 with value: 0.887294062722078.[0m
[32m[I 2022-04-16 09:16:50,327][0m Trial 520 finished with value: 0.8843945037473487 and parameters: {'n_hidden': 1024, 'mixture_components': 10, 'use_sparse_layer': True, 'use_sparse_loss': True, 'lmbd': 1.00247347312757e-06, 'use_batchnorm': False, 'use_dropout': True, 'dropout': 0.4862807876999328, 'mlp_size_1': 2, 'mlp_size_2': 4, 'mlp_size_3': 1, 'kernel': 'Weibull', 'loss_name': 'CensoredNLLLoss'}. Best is trial 474 with value: 0.887294062722078.[0m
[32m[I 2022-04-16 09:19:29,638][0m Trial 521 finished with value: 0.884874558848152 and parameters: {'n_hidden': 512, 'mixture_components': 10, 'use_sparse_layer': True, 'use_sparse_loss': False, 'use_batchnorm': False, 'use_dropout': True, 'dropout': 0.6401273070029195, 'mlp_size_1': 2, 'mlp_size_2': 4, 'mlp_size_3': 0, 'kernel': 'Weibull', 'loss_name': 'CensoredNLLLoss'}. Best is trial 474 with value: 0.887294062722078.[0m
[32m[I 2022-04-16 09:22:33,844][0m Trial 522 finished with value: 0.7843558303421546 and parameters: {'n_hidden': 1024, 'mixture_components': 9, 'use_sparse_layer': True, 'use_sparse_loss': False, 'use_batchnorm': False, 'use_dropout': True, 'dropout': 0.5375475851539793, 'mlp_size_1': 1, 'mlp_size_2': 5, 'mlp_size_3': 1, 'kernel': 'Normal', 'loss_name': 'CensoredNLLLoss'}. Best is trial 474 with value: 0.887294062722078.[0m
[32m[I 2022-04-16 09:25:32,740][0m Trial 523 finished with value: 0.8853293785186039 and parameters: {'n_hidden': 2048, 'mixture_components': 6, 'use_sparse_layer': True, 'use_sparse_loss': False, 'use_batchnorm': False, 'use_dropout': True, 'dropout': 0.6015906744673998, 'mlp_size_1': 3, 'mlp_size_2': 4, 'mlp_size_3': 1, 'kernel': 'Weibull', 'loss_name': 'CensoredNLLLoss'}. Best is trial 474 with value: 0.887294062722078.[0m
[32m[I 2022-04-16 09:27:22,752][0m Trial 524 finished with value: 0.7024527254949187 and parameters: {'n_hidden': 64, 'mixture_components': 10, 'use_sparse_layer': True, 'use_sparse_loss': False, 'use_batchnorm': False, 'use_dropout': True, 'dropout': 0.5650237103344333, 'mlp_size_1': 2, 'mlp_size_2': 1, 'mlp_size_3': 0, 'kernel': 'Gumbel', 'loss_name': 'CensoredNLLLoss'}. Best is trial 474 with value: 0.887294062722078.[0m
[32m[I 2022-04-16 09:31:49,477][0m Trial 525 finished with value: 0.7831382270991716 and parameters: {'n_hidden': 1024, 'mixture_components': 8, 'use_sparse_layer': True, 'use_sparse_loss': False, 'use_batchnorm': True, 'use_dropout': True, 'dropout': 0.5194173549806584, 'mlp_size_1': 1, 'mlp_size_2': 4, 'mlp_size_3': 1, 'kernel': 'Weibull', 'loss_name': 'CensoredNLLLoss'}. Best is trial 474 with value: 0.887294062722078.[0m
[32m[I 2022-04-16 09:34:01,639][0m Trial 526 finished with value: 0.8831116358204494 and parameters: {'n_hidden': 1024, 'mixture_components': 10, 'use_sparse_layer': True, 'use_sparse_loss': False, 'use_batchnorm': False, 'use_dropout': False, 'mlp_size_1': 4, 'mlp_size_2': 3, 'mlp_size_3': 0, 'kernel': 'Weibull', 'loss_name': 'CensoredNLLLoss'}. Best is trial 474 with value: 0.887294062722078.[0m
[32m[I 2022-04-16 09:37:09,646][0m Trial 527 finished with value: 0.783785220738199 and parameters: {'n_hidden': 1024, 'mixture_components': 9, 'use_sparse_layer': True, 'use_sparse_loss': False, 'use_batchnorm': False, 'use_dropout': True, 'dropout': 0.583715935849921, 'mlp_size_1': 2, 'mlp_size_2': 4, 'mlp_size_3': 1, 'kernel': 'LogNormal', 'loss_name': 'AlternativeNLLLoss'}. Best is trial 474 with value: 0.887294062722078.[0m
[32m[I 2022-04-16 09:39:35,666][0m Trial 528 finished with value: 0.8850800313786618 and parameters: {'n_hidden': 256, 'mixture_components': 10, 'use_sparse_layer': True, 'use_sparse_loss': True, 'lmbd': 2.2391928680293425e-06, 'use_batchnorm': False, 'use_dropout': True, 'dropout': 0.45288727180808913, 'mlp_size_1': 2, 'mlp_size_2': 3, 'mlp_size_3': 0, 'kernel': 'Weibull', 'loss_name': 'CensoredNLLLoss'}. Best is trial 474 with value: 0.887294062722078.[0m
[32m[I 2022-04-16 09:42:00,233][0m Trial 529 finished with value: 0.8798163689470344 and parameters: {'n_hidden': 1024, 'mixture_components': 10, 'use_sparse_layer': True, 'use_sparse_loss': False, 'use_batchnorm': False, 'use_dropout': True, 'dropout': 0.37809908426593997, 'mlp_size_1': 1, 'mlp_size_2': 4, 'mlp_size_3': 1, 'kernel': 'Logistic', 'loss_name': 'CensoredNLLLoss'}. Best is trial 474 with value: 0.887294062722078.[0m
[32m[I 2022-04-16 09:44:50,201][0m Trial 530 finished with value: 0.8843303537104005 and parameters: {'n_hidden': 1024, 'mixture_components': 9, 'use_sparse_layer': True, 'use_sparse_loss': False, 'use_batchnorm': False, 'use_dropout': True, 'dropout': 0.6217809533994885, 'mlp_size_1': 1, 'mlp_size_2': 4, 'mlp_size_3': 1, 'kernel': 'Weibull', 'loss_name': 'CensoredNLLLoss'}. Best is trial 474 with value: 0.887294062722078.[0m
[32m[I 2022-04-16 09:47:35,723][0m Trial 531 finished with value: 0.7580041633906623 and parameters: {'n_hidden': 1024, 'mixture_components': 10, 'use_sparse_layer': True, 'use_sparse_loss': False, 'use_batchnorm': False, 'use_dropout': True, 'dropout': 0.5477474003091505, 'mlp_size_1': 7, 'mlp_size_2': 0, 'mlp_size_3': 0, 'kernel': 'Weibull', 'loss_name': 'CensoredNLLLoss'}. Best is trial 474 with value: 0.887294062722078.[0m
[32m[I 2022-04-16 09:50:09,859][0m Trial 532 finished with value: 0.885354588150457 and parameters: {'n_hidden': 1024, 'mixture_components': 10, 'use_sparse_layer': True, 'use_sparse_loss': False, 'use_batchnorm': False, 'use_dropout': True, 'dropout': 0.47420147995087386, 'mlp_size_1': 2, 'mlp_size_2': 4, 'mlp_size_3': 1, 'kernel': 'Weibull', 'loss_name': 'CensoredNLLLoss'}. Best is trial 474 with value: 0.887294062722078.[0m
[32m[I 2022-04-16 09:52:37,894][0m Trial 533 finished with value: 0.8815526166553915 and parameters: {'n_hidden': 1024, 'mixture_components': 9, 'use_sparse_layer': True, 'use_sparse_loss': False, 'use_batchnorm': False, 'use_dropout': True, 'dropout': 0.3107435024652367, 'mlp_size_1': 2, 'mlp_size_2': 4, 'mlp_size_3': 1, 'kernel': 'Weibull', 'loss_name': 'CensoredNLLLoss'}. Best is trial 474 with value: 0.887294062722078.[0m
[32m[I 2022-04-16 09:54:54,003][0m Trial 534 finished with value: 0.8841122196764291 and parameters: {'n_hidden': 256, 'mixture_components': 7, 'use_sparse_layer': True, 'use_sparse_loss': False, 'use_batchnorm': False, 'use_dropout': True, 'dropout': 0.35670455853589994, 'mlp_size_1': 2, 'mlp_size_2': 3, 'mlp_size_3': 0, 'kernel': 'Weibull', 'loss_name': 'CensoredNLLLoss'}. Best is trial 474 with value: 0.887294062722078.[0m
[32m[I 2022-04-16 09:56:47,056][0m Trial 535 finished with value: 0.35241370708179465 and parameters: {'n_hidden': 1024, 'mixture_components': 10, 'use_sparse_layer': True, 'use_sparse_loss': False, 'use_batchnorm': False, 'use_dropout': True, 'dropout': 0.5084874208114022, 'mlp_size_1': 2, 'mlp_size_2': 4, 'mlp_size_3': 1, 'kernel': 'Exponential', 'loss_name': 'NLLLoss'}. Best is trial 474 with value: 0.887294062722078.[0m
[32m[I 2022-04-16 09:59:27,816][0m Trial 536 finished with value: 0.8856326730576114 and parameters: {'n_hidden': 1024, 'mixture_components': 9, 'use_sparse_layer': True, 'use_sparse_loss': True, 'lmbd': 0.00022791434744406236, 'use_batchnorm': False, 'use_dropout': True, 'dropout': 0.5988355201926018, 'mlp_size_1': 1, 'mlp_size_2': 4, 'mlp_size_3': 1, 'kernel': 'Weibull', 'loss_name': 'CensoredNLLLoss'}. Best is trial 474 with value: 0.887294062722078.[0m
[32m[I 2022-04-16 10:01:47,061][0m Trial 537 finished with value: 0.8821218692090212 and parameters: {'n_hidden': 1024, 'mixture_components': 10, 'use_sparse_layer': True, 'use_sparse_loss': False, 'use_batchnorm': False, 'use_dropout': True, 'dropout': 0.5683829415935452, 'mlp_size_1': 5, 'mlp_size_2': 2, 'mlp_size_3': 0, 'kernel': 'LogLogistic', 'loss_name': 'CensoredNLLLoss'}. Best is trial 474 with value: 0.887294062722078.[0m
[32m[I 2022-04-16 10:04:38,373][0m Trial 538 finished with value: 0.8755816825180632 and parameters: {'n_hidden': 32, 'mixture_components': 10, 'use_sparse_layer': True, 'use_sparse_loss': False, 'use_batchnorm': False, 'use_dropout': True, 'dropout': 0.24785862885872845, 'mlp_size_1': 2, 'mlp_size_2': 0, 'mlp_size_3': 0, 'kernel': 'Weibull', 'loss_name': 'CensoredNLLLoss'}. Best is trial 474 with value: 0.887294062722078.[0m
[32m[I 2022-04-16 10:07:06,645][0m Trial 539 finished with value: 0.882720634363884 and parameters: {'n_hidden': 1024, 'mixture_components': 9, 'use_sparse_layer': True, 'use_sparse_loss': False, 'use_batchnorm': False, 'use_dropout': True, 'dropout': 0.43489833602033734, 'mlp_size_1': 1, 'mlp_size_2': 3, 'mlp_size_3': 1, 'kernel': 'Weibull', 'loss_name': 'CensoredNLLLoss'}. Best is trial 474 with value: 0.887294062722078.[0m
[32m[I 2022-04-16 10:09:35,238][0m Trial 540 finished with value: 0.8834471423351875 and parameters: {'n_hidden': 256, 'mixture_components': 10, 'use_sparse_layer': True, 'use_sparse_loss': False, 'use_batchnorm': False, 'use_dropout': True, 'dropout': 0.654692127099016, 'mlp_size_1': 2, 'mlp_size_2': 3, 'mlp_size_3': 0, 'kernel': 'Weibull', 'loss_name': 'CensoredNLLLoss'}. Best is trial 474 with value: 0.887294062722078.[0m
[32m[I 2022-04-16 10:12:21,436][0m Trial 541 finished with value: 0.8855063713440101 and parameters: {'n_hidden': 1024, 'mixture_components': 9, 'use_sparse_layer': True, 'use_sparse_loss': False, 'use_batchnorm': False, 'use_dropout': True, 'dropout': 0.49668484149966147, 'mlp_size_1': 2, 'mlp_size_2': 4, 'mlp_size_3': 1, 'kernel': 'Weibull', 'loss_name': 'AlternativeNLLLoss'}. Best is trial 474 with value: 0.887294062722078.[0m
[32m[I 2022-04-16 10:14:55,155][0m Trial 542 finished with value: 0.8864083281710293 and parameters: {'n_hidden': 1024, 'mixture_components': 10, 'use_sparse_layer': True, 'use_sparse_loss': False, 'use_batchnorm': False, 'use_dropout': True, 'dropout': 0.5302234712424063, 'mlp_size_1': 2, 'mlp_size_2': 4, 'mlp_size_3': 1, 'kernel': 'Weibull', 'loss_name': 'CensoredNLLLoss'}. Best is trial 474 with value: 0.887294062722078.[0m
[32m[I 2022-04-16 10:17:20,767][0m Trial 543 finished with value: 0.8795935767673433 and parameters: {'n_hidden': 1024, 'mixture_components': 10, 'use_sparse_layer': True, 'use_sparse_loss': False, 'use_batchnorm': False, 'use_dropout': True, 'dropout': 0.5349090944994037, 'mlp_size_1': 1, 'mlp_size_2': 6, 'mlp_size_3': 0, 'kernel': 'Weibull', 'loss_name': 'CensoredNLLLoss'}. Best is trial 474 with value: 0.887294062722078.[0m
[32m[I 2022-04-16 10:20:19,783][0m Trial 544 finished with value: 0.8803384622846974 and parameters: {'n_hidden': 1024, 'mixture_components': 8, 'use_sparse_layer': True, 'use_sparse_loss': True, 'lmbd': 0.0003598188813854779, 'use_batchnorm': False, 'use_dropout': True, 'dropout': 0.6143712613859086, 'mlp_size_1': 0, 'mlp_size_2': 7, 'mlp_size_3': 0, 'kernel': 'Weibull', 'loss_name': 'CensoredNLLLoss'}. Best is trial 474 with value: 0.887294062722078.[0m
/media/san2_ssd/data/Workdir/survival/utils.py:305: RuntimeWarning: invalid value encountered in true_divide
  pdfs = np.gradient(1-survs,axis=1)/norms
/media/san2_ssd/data/Workdir/survival/utils.py:305: RuntimeWarning: invalid value encountered in true_divide
  pdfs = np.gradient(1-survs,axis=1)/norms
[32m[I 2022-04-16 10:25:31,268][0m Trial 545 finished with value: 0.87788701598974 and parameters: {'n_hidden': 1024, 'mixture_components': 9, 'use_sparse_layer': True, 'use_sparse_loss': False, 'use_batchnorm': True, 'use_dropout': True, 'dropout': 0.4740663845401483, 'mlp_size_1': 2, 'mlp_size_2': 4, 'mlp_size_3': 1, 'kernel': 'Logistic', 'loss_name': 'CensoredNLLLoss'}. Best is trial 474 with value: 0.887294062722078.[0m
[32m[I 2022-04-16 10:27:24,353][0m Trial 546 finished with value: 0.8836381463275609 and parameters: {'n_hidden': 256, 'mixture_components': 10, 'use_sparse_layer': True, 'use_sparse_loss': False, 'use_batchnorm': False, 'use_dropout': False, 'mlp_size_1': 2, 'mlp_size_2': 3, 'mlp_size_3': 0, 'kernel': 'Gamma', 'loss_name': 'CensoredNLLLoss'}. Best is trial 474 with value: 0.887294062722078.[0m
[32m[I 2022-04-16 10:29:56,568][0m Trial 547 finished with value: 0.8812714911158628 and parameters: {'n_hidden': 128, 'mixture_components': 10, 'use_sparse_layer': True, 'use_sparse_loss': False, 'use_batchnorm': False, 'use_dropout': True, 'dropout': 0.5253534346013115, 'mlp_size_1': 2, 'mlp_size_2': 2, 'mlp_size_3': 0, 'kernel': 'Weibull', 'loss_name': 'CensoredNLLLoss'}. Best is trial 474 with value: 0.887294062722078.[0m
[32m[I 2022-04-16 10:32:37,608][0m Trial 548 finished with value: 0.7852550710991061 and parameters: {'n_hidden': 1024, 'mixture_components': 10, 'use_sparse_layer': True, 'use_sparse_loss': False, 'use_batchnorm': False, 'use_dropout': True, 'dropout': 0.4988550042601834, 'mlp_size_1': 2, 'mlp_size_2': 4, 'mlp_size_3': 1, 'kernel': 'Weibull', 'loss_name': 'CensoredNLLLoss'}. Best is trial 474 with value: 0.887294062722078.[0m
