[32m[I 2022-04-13 12:38:09,799][0m Trial 959 finished with value: 0.7718249683878834 and parameters: {'alpha': 0.5917147844043715, 'ties': 'efron'}. Best is trial 676 with value: 0.7727038262700389.[0m
[32m[I 2022-04-13 12:38:13,841][0m Trial 960 finished with value: 0.7726365528945663 and parameters: {'alpha': 1.206317035562628, 'ties': 'breslow'}. Best is trial 676 with value: 0.7727038262700389.[0m
[32m[I 2022-04-13 12:38:17,947][0m Trial 961 finished with value: 0.7724746053106538 and parameters: {'alpha': 1.3883000312536016, 'ties': 'breslow'}. Best is trial 676 with value: 0.7727038262700389.[0m
[32m[I 2022-04-13 12:38:20,969][0m Trial 962 finished with value: 0.7725904032746918 and parameters: {'alpha': 1.0870293725868851, 'ties': 'efron'}. Best is trial 676 with value: 0.7727038262700389.[0m
[32m[I 2022-04-13 12:38:23,005][0m Trial 963 finished with value: 0.7726515037164124 and parameters: {'alpha': 1.2635959428242893, 'ties': 'breslow'}. Best is trial 676 with value: 0.7727038262700389.[0m
[32m[I 2022-04-13 12:38:26,118][0m Trial 964 finished with value: 0.7726402855708456 and parameters: {'alpha': 1.2074681031036474, 'ties': 'efron'}. Best is trial 676 with value: 0.7727038262700389.[0m
[32m[I 2022-04-13 12:38:28,986][0m Trial 965 finished with value: 0.7725872950990729 and parameters: {'alpha': 1.0051157812231097, 'ties': 'breslow'}. Best is trial 676 with value: 0.7727038262700389.[0m
[32m[I 2022-04-13 12:38:32,291][0m Trial 966 finished with value: 0.7692210303200309 and parameters: {'alpha': 4.653705257635849, 'ties': 'efron'}. Best is trial 676 with value: 0.7727038262700389.[0m
[32m[I 2022-04-13 12:38:35,072][0m Trial 967 finished with value: 0.7724801965054506 and parameters: {'alpha': 1.4652082854832182, 'ties': 'breslow'}. Best is trial 676 with value: 0.7727038262700389.[0m
[32m[I 2022-04-13 12:38:38,683][0m Trial 968 finished with value: 0.7725191600605636 and parameters: {'alpha': 1.3430908783948274, 'ties': 'breslow'}. Best is trial 676 with value: 0.7727038262700389.[0m
[32m[I 2022-04-13 12:38:42,128][0m Trial 969 finished with value: 0.772598382956874 and parameters: {'alpha': 1.1200395864881123, 'ties': 'efron'}. Best is trial 676 with value: 0.7727038262700389.[0m
[32m[I 2022-04-13 12:38:45,763][0m Trial 970 finished with value: 0.7725985171212498 and parameters: {'alpha': 1.1757265969555566, 'ties': 'breslow'}. Best is trial 676 with value: 0.7727038262700389.[0m
[32m[I 2022-04-13 12:38:48,964][0m Trial 971 finished with value: 0.7726049984792007 and parameters: {'alpha': 1.313512758683711, 'ties': 'efron'}. Best is trial 676 with value: 0.7727038262700389.[0m
[32m[I 2022-04-13 12:38:53,233][0m Trial 972 finished with value: 0.7725799336883993 and parameters: {'alpha': 0.8919998794675619, 'ties': 'breslow'}. Best is trial 676 with value: 0.7727038262700389.[0m
[32m[I 2022-04-13 12:38:56,687][0m Trial 973 finished with value: 0.7723824917096721 and parameters: {'alpha': 1.6569856202836042, 'ties': 'efron'}. Best is trial 676 with value: 0.7727038262700389.[0m
[32m[I 2022-04-13 12:39:00,111][0m Trial 974 finished with value: 0.772560493248305 and parameters: {'alpha': 1.0535174827804938, 'ties': 'breslow'}. Best is trial 676 with value: 0.7727038262700389.[0m
[32m[I 2022-04-13 12:39:04,152][0m Trial 975 finished with value: 0.7712240005275135 and parameters: {'alpha': 0.03655569347244336, 'ties': 'efron'}. Best is trial 676 with value: 0.7727038262700389.[0m
[32m[I 2022-04-13 12:39:07,297][0m Trial 976 finished with value: 0.7725661939377707 and parameters: {'alpha': 0.7469042320163878, 'ties': 'breslow'}. Best is trial 676 with value: 0.7727038262700389.[0m
[32m[I 2022-04-13 12:39:11,356][0m Trial 977 finished with value: 0.7726785455214022 and parameters: {'alpha': 1.229406916968529, 'ties': 'breslow'}. Best is trial 676 with value: 0.7727038262700389.[0m
[32m[I 2022-04-13 12:39:15,368][0m Trial 978 finished with value: 0.7724206409637284 and parameters: {'alpha': 1.4271448099503499, 'ties': 'efron'}. Best is trial 676 with value: 0.7727038262700389.[0m
[32m[I 2022-04-13 12:39:17,975][0m Trial 979 finished with value: 0.7726103169482147 and parameters: {'alpha': 1.1271484209881137, 'ties': 'breslow'}. Best is trial 676 with value: 0.7727038262700389.[0m
[32m[I 2022-04-13 12:39:21,433][0m Trial 980 finished with value: 0.7725823512801403 and parameters: {'alpha': 1.2978553697419108, 'ties': 'efron'}. Best is trial 676 with value: 0.7727038262700389.[0m
[32m[I 2022-04-13 12:39:24,286][0m Trial 981 finished with value: 0.7726525474302305 and parameters: {'alpha': 1.2325186331044962, 'ties': 'breslow'}. Best is trial 676 with value: 0.7727038262700389.[0m
[32m[I 2022-04-13 12:39:26,052][0m Trial 982 finished with value: 0.7716436820269358 and parameters: {'alpha': 0.3665059146321715, 'ties': 'efron'}. Best is trial 676 with value: 0.7727038262700389.[0m
[32m[I 2022-04-13 12:39:27,541][0m Trial 983 finished with value: 0.7724715814912088 and parameters: {'alpha': 1.3847431561758008, 'ties': 'breslow'}. Best is trial 676 with value: 0.7727038262700389.[0m
[32m[I 2022-04-13 12:39:30,972][0m Trial 984 finished with value: 0.7724399713096247 and parameters: {'alpha': 1.5249276301768728, 'ties': 'efron'}. Best is trial 676 with value: 0.7727038262700389.[0m
[32m[I 2022-04-13 12:39:33,989][0m Trial 985 finished with value: 0.7726232041954298 and parameters: {'alpha': 0.9793191762461427, 'ties': 'breslow'}. Best is trial 676 with value: 0.7727038262700389.[0m
[32m[I 2022-04-13 12:39:38,539][0m Trial 986 finished with value: 0.7726478918657291 and parameters: {'alpha': 1.1464395102528664, 'ties': 'breslow'}. Best is trial 676 with value: 0.7727038262700389.[0m
[32m[I 2022-04-13 12:39:41,840][0m Trial 987 finished with value: 0.7725599972262311 and parameters: {'alpha': 1.0542689246353545, 'ties': 'efron'}. Best is trial 676 with value: 0.7727038262700389.[0m
[32m[I 2022-04-13 12:39:43,867][0m Trial 988 finished with value: 0.7725535496606369 and parameters: {'alpha': 1.3217361066369582, 'ties': 'breslow'}. Best is trial 676 with value: 0.7727038262700389.[0m
[32m[I 2022-04-13 12:39:46,940][0m Trial 989 finished with value: 0.7718961120212375 and parameters: {'alpha': 2.7682346433159157, 'ties': 'efron'}. Best is trial 676 with value: 0.7727038262700389.[0m
[32m[I 2022-04-13 12:39:50,713][0m Trial 990 finished with value: 0.7726152985605493 and parameters: {'alpha': 1.185155944365003, 'ties': 'breslow'}. Best is trial 676 with value: 0.7727038262700389.[0m
[32m[I 2022-04-13 12:39:54,292][0m Trial 991 finished with value: 0.772662321418378 and parameters: {'alpha': 1.2513383898787547, 'ties': 'efron'}. Best is trial 676 with value: 0.7727038262700389.[0m
[32m[I 2022-04-13 12:39:55,973][0m Trial 992 finished with value: 0.7724835297632366 and parameters: {'alpha': 1.390386505189983, 'ties': 'breslow'}. Best is trial 676 with value: 0.7727038262700389.[0m
[32m[I 2022-04-13 12:39:57,548][0m Trial 993 finished with value: 0.7725901864488831 and parameters: {'alpha': 1.1168074777412331, 'ties': 'efron'}. Best is trial 676 with value: 0.7727038262700389.[0m
[32m[I 2022-04-13 12:40:00,262][0m Trial 994 finished with value: 0.7726698665811458 and parameters: {'alpha': 1.2549169743987092, 'ties': 'breslow'}. Best is trial 676 with value: 0.7727038262700389.[0m
[32m[I 2022-04-13 12:40:03,290][0m Trial 995 finished with value: 0.7725729729016286 and parameters: {'alpha': 1.0548264978160504, 'ties': 'breslow'}. Best is trial 676 with value: 0.7727038262700389.[0m
[32m[I 2022-04-13 12:40:07,079][0m Trial 996 finished with value: 0.7724529651216285 and parameters: {'alpha': 1.4650569499761434, 'ties': 'efron'}. Best is trial 676 with value: 0.7727038262700389.[0m
[32m[I 2022-04-13 12:40:09,865][0m Trial 997 finished with value: 0.7725101770544184 and parameters: {'alpha': 1.333436605477419, 'ties': 'breslow'}. Best is trial 676 with value: 0.7727038262700389.[0m
[32m[I 2022-04-13 12:40:12,701][0m Trial 998 finished with value: 0.7726379476380223 and parameters: {'alpha': 0.9497086632226692, 'ties': 'efron'}. Best is trial 676 with value: 0.7727038262700389.[0m
[32m[I 2022-04-13 12:40:16,783][0m Trial 999 finished with value: 0.7725813550207153 and parameters: {'alpha': 1.1743318458125132, 'ties': 'breslow'}. Best is trial 676 with value: 0.7727038262700389.[0m
[32m[I 2022-04-13 12:40:16,786][0m A new study created in memory with name: no-name-9aec3d98-cbb2-41c6-8a66-20db31195e0c[0m
[32m[I 2022-04-13 12:40:19,809][0m Trial 0 finished with value: 0.743363565646981 and parameters: {'alpha': 0.33825931235182094, 'ties': 'efron'}. Best is trial 0 with value: 0.743363565646981.[0m
[32m[I 2022-04-13 12:40:21,848][0m Trial 1 finished with value: 0.7394253233303129 and parameters: {'alpha': 3.9958646803138023, 'ties': 'breslow'}. Best is trial 0 with value: 0.743363565646981.[0m
[32m[I 2022-04-13 12:40:24,203][0m Trial 2 finished with value: 0.7404689501604477 and parameters: {'alpha': 3.7583630195233164, 'ties': 'breslow'}. Best is trial 0 with value: 0.743363565646981.[0m
[32m[I 2022-04-13 12:40:27,143][0m Trial 3 finished with value: 0.7453120580411902 and parameters: {'alpha': 0.9142811874183179, 'ties': 'breslow'}. Best is trial 3 with value: 0.7453120580411902.[0m
[32m[I 2022-04-13 12:40:30,764][0m Trial 4 finished with value: 0.7433141559994525 and parameters: {'alpha': 0.23937042762794092, 'ties': 'breslow'}. Best is trial 3 with value: 0.7453120580411902.[0m
[32m[I 2022-04-13 12:40:33,767][0m Trial 5 finished with value: 0.7434895236097241 and parameters: {'alpha': 0.43513302483678207, 'ties': 'breslow'}. Best is trial 3 with value: 0.7453120580411902.[0m
[32m[I 2022-04-13 12:40:35,315][0m Trial 6 finished with value: 0.7383662222279261 and parameters: {'alpha': 4.543796877217928, 'ties': 'breslow'}. Best is trial 3 with value: 0.7453120580411902.[0m
[32m[I 2022-04-13 12:40:37,999][0m Trial 7 finished with value: 0.7427012276032221 and parameters: {'alpha': 0.10906698024185425, 'ties': 'breslow'}. Best is trial 3 with value: 0.7453120580411902.[0m
[32m[I 2022-04-13 12:40:40,282][0m Trial 8 finished with value: 0.7392935601292384 and parameters: {'alpha': 4.033641110808476, 'ties': 'breslow'}. Best is trial 3 with value: 0.7453120580411902.[0m
[32m[I 2022-04-13 12:40:41,897][0m Trial 9 finished with value: 0.7401576310518074 and parameters: {'alpha': 3.8569993579263304, 'ties': 'breslow'}. Best is trial 3 with value: 0.7453120580411902.[0m
[32m[I 2022-04-13 12:40:44,005][0m Trial 10 finished with value: 0.745090709282508 and parameters: {'alpha': 1.7136926109372612, 'ties': 'efron'}. Best is trial 3 with value: 0.7453120580411902.[0m
[32m[I 2022-04-13 12:40:46,608][0m Trial 11 finished with value: 0.7448940940705298 and parameters: {'alpha': 1.6783554149867919, 'ties': 'efron'}. Best is trial 3 with value: 0.7453120580411902.[0m
[32m[I 2022-04-13 12:40:50,099][0m Trial 12 finished with value: 0.7448509492570518 and parameters: {'alpha': 1.785390774911178, 'ties': 'efron'}. Best is trial 3 with value: 0.7453120580411902.[0m
[32m[I 2022-04-13 12:40:52,789][0m Trial 13 finished with value: 0.7447647877476726 and parameters: {'alpha': 1.6663231733232942, 'ties': 'efron'}. Best is trial 3 with value: 0.7453120580411902.[0m
[32m[I 2022-04-13 12:40:54,977][0m Trial 14 finished with value: 0.7436963159091604 and parameters: {'alpha': 2.741999192883301, 'ties': 'efron'}. Best is trial 3 with value: 0.7453120580411902.[0m
[32m[I 2022-04-13 12:40:57,842][0m Trial 15 finished with value: 0.7451915783540076 and parameters: {'alpha': 1.073452259297407, 'ties': 'efron'}. Best is trial 3 with value: 0.7453120580411902.[0m
[32m[I 2022-04-13 12:41:02,628][0m Trial 16 finished with value: 0.7451177239542828 and parameters: {'alpha': 1.0514698126670803, 'ties': 'efron'}. Best is trial 3 with value: 0.7453120580411902.[0m
[32m[I 2022-04-13 12:41:06,094][0m Trial 17 finished with value: 0.7438328592455863 and parameters: {'alpha': 2.6509744140014133, 'ties': 'efron'}. Best is trial 3 with value: 0.7453120580411902.[0m
[32m[I 2022-04-13 12:41:08,554][0m Trial 18 finished with value: 0.7451934941792416 and parameters: {'alpha': 0.8466198523305832, 'ties': 'efron'}. Best is trial 3 with value: 0.7453120580411902.[0m
[32m[I 2022-04-13 12:41:11,824][0m Trial 19 finished with value: 0.7452947199961095 and parameters: {'alpha': 0.9639566839625199, 'ties': 'breslow'}. Best is trial 3 with value: 0.7453120580411902.[0m
[32m[I 2022-04-13 12:41:13,966][0m Trial 20 finished with value: 0.7445153300152467 and parameters: {'alpha': 2.175616120984864, 'ties': 'breslow'}. Best is trial 3 with value: 0.7453120580411902.[0m
[32m[I 2022-04-13 12:41:16,088][0m Trial 21 finished with value: 0.7452710255669841 and parameters: {'alpha': 0.9545072826585288, 'ties': 'breslow'}. Best is trial 3 with value: 0.7453120580411902.[0m
[32m[I 2022-04-13 12:41:19,718][0m Trial 22 finished with value: 0.7452294900061469 and parameters: {'alpha': 0.8726913789358948, 'ties': 'breslow'}. Best is trial 3 with value: 0.7453120580411902.[0m
[32m[I 2022-04-13 12:41:23,095][0m Trial 23 finished with value: 0.7453018739649686 and parameters: {'alpha': 1.2929873640182872, 'ties': 'breslow'}. Best is trial 3 with value: 0.7453120580411902.[0m
[32m[I 2022-04-13 12:41:26,522][0m Trial 24 finished with value: 0.742034581981821 and parameters: {'alpha': 3.235985119166769, 'ties': 'breslow'}. Best is trial 3 with value: 0.7453120580411902.[0m
[32m[I 2022-04-13 12:41:28,733][0m Trial 25 finished with value: 0.7450581942111872 and parameters: {'alpha': 1.3619428318260627, 'ties': 'breslow'}. Best is trial 3 with value: 0.7453120580411902.[0m
[32m[I 2022-04-13 12:41:31,351][0m Trial 26 finished with value: 0.7441078591803583 and parameters: {'alpha': 2.2708688600394975, 'ties': 'breslow'}. Best is trial 3 with value: 0.7453120580411902.[0m
[32m[I 2022-04-13 12:41:34,177][0m Trial 27 finished with value: 0.7437762753734347 and parameters: {'alpha': 0.588275922113415, 'ties': 'breslow'}. Best is trial 3 with value: 0.7453120580411902.[0m
[32m[I 2022-04-13 12:41:36,955][0m Trial 28 finished with value: 0.7450635838726074 and parameters: {'alpha': 1.3555183861891356, 'ties': 'breslow'}. Best is trial 3 with value: 0.7453120580411902.[0m
[32m[I 2022-04-13 12:41:38,823][0m Trial 29 finished with value: 0.7437567177366773 and parameters: {'alpha': 0.5854186142673357, 'ties': 'breslow'}. Best is trial 3 with value: 0.7453120580411902.[0m
[32m[I 2022-04-13 12:41:40,388][0m Trial 30 finished with value: 0.7445322016443181 and parameters: {'alpha': 2.164198772551796, 'ties': 'breslow'}. Best is trial 3 with value: 0.7453120580411902.[0m
[32m[I 2022-04-13 12:41:43,258][0m Trial 31 finished with value: 0.7452042423051831 and parameters: {'alpha': 1.3190876301787946, 'ties': 'breslow'}. Best is trial 3 with value: 0.7453120580411902.[0m
[32m[I 2022-04-13 12:41:44,919][0m Trial 32 finished with value: 0.7445167106230621 and parameters: {'alpha': 0.6782614952477547, 'ties': 'breslow'}. Best is trial 3 with value: 0.7453120580411902.[0m
[32m[I 2022-04-13 12:41:48,762][0m Trial 33 finished with value: 0.7451386653194898 and parameters: {'alpha': 1.0997616087036828, 'ties': 'breslow'}. Best is trial 3 with value: 0.7453120580411902.[0m
[32m[I 2022-04-13 12:41:51,278][0m Trial 34 finished with value: 0.743008618041442 and parameters: {'alpha': 0.14712360350364162, 'ties': 'breslow'}. Best is trial 3 with value: 0.7453120580411902.[0m
[32m[I 2022-04-13 12:41:54,182][0m Trial 35 finished with value: 0.7434290740096483 and parameters: {'alpha': 0.37774200559786975, 'ties': 'breslow'}. Best is trial 3 with value: 0.7453120580411902.[0m
[32m[I 2022-04-13 12:41:57,624][0m Trial 36 finished with value: 0.7424901737947283 and parameters: {'alpha': 0.020596105219181204, 'ties': 'breslow'}. Best is trial 3 with value: 0.7453120580411902.[0m
[32m[I 2022-04-13 12:42:00,159][0m Trial 37 finished with value: 0.7449603930109012 and parameters: {'alpha': 1.4661281256145284, 'ties': 'breslow'}. Best is trial 3 with value: 0.7453120580411902.[0m
[32m[I 2022-04-13 12:42:03,006][0m Trial 38 finished with value: 0.7452261927328891 and parameters: {'alpha': 0.9030279789282216, 'ties': 'breslow'}. Best is trial 3 with value: 0.7453120580411902.[0m
[32m[I 2022-04-13 12:42:05,382][0m Trial 39 finished with value: 0.7383669194559823 and parameters: {'alpha': 4.718373206147344, 'ties': 'breslow'}. Best is trial 3 with value: 0.7453120580411902.[0m
[32m[I 2022-04-13 12:42:08,166][0m Trial 40 finished with value: 0.7448226971911794 and parameters: {'alpha': 1.9774363235070918, 'ties': 'breslow'}. Best is trial 3 with value: 0.7453120580411902.[0m
[32m[I 2022-04-13 12:42:10,881][0m Trial 41 finished with value: 0.7450623828540603 and parameters: {'alpha': 0.7782292054357095, 'ties': 'breslow'}. Best is trial 3 with value: 0.7453120580411902.[0m
[32m[I 2022-04-13 12:42:12,941][0m Trial 42 finished with value: 0.7432291242625055 and parameters: {'alpha': 0.3459420219186975, 'ties': 'breslow'}. Best is trial 3 with value: 0.7453120580411902.[0m
[32m[I 2022-04-13 12:42:16,495][0m Trial 43 finished with value: 0.7452217959569303 and parameters: {'alpha': 1.1305425153860476, 'ties': 'breslow'}. Best is trial 3 with value: 0.7453120580411902.[0m
[32m[I 2022-04-13 12:42:18,795][0m Trial 44 finished with value: 0.7449782545010356 and parameters: {'alpha': 1.5548635636356594, 'ties': 'breslow'}. Best is trial 3 with value: 0.7453120580411902.[0m
[32m[I 2022-04-13 12:42:21,291][0m Trial 45 finished with value: 0.743786155838609 and parameters: {'alpha': 0.5301169726451316, 'ties': 'breslow'}. Best is trial 3 with value: 0.7453120580411902.[0m
[32m[I 2022-04-13 12:42:23,243][0m Trial 46 finished with value: 0.7451802037777695 and parameters: {'alpha': 0.9001232903035126, 'ties': 'breslow'}. Best is trial 3 with value: 0.7453120580411902.[0m
[32m[I 2022-04-13 12:42:25,998][0m Trial 47 finished with value: 0.7449970288716207 and parameters: {'alpha': 1.8102186345036166, 'ties': 'breslow'}. Best is trial 3 with value: 0.7453120580411902.[0m
[32m[I 2022-04-13 12:42:28,778][0m Trial 48 finished with value: 0.7453475355819602 and parameters: {'alpha': 1.2217102959428605, 'ties': 'breslow'}. Best is trial 48 with value: 0.7453475355819602.[0m
[32m[I 2022-04-13 12:42:31,700][0m Trial 49 finished with value: 0.7452748865683528 and parameters: {'alpha': 1.2748592676226596, 'ties': 'breslow'}. Best is trial 48 with value: 0.7453475355819602.[0m
[32m[I 2022-04-13 12:42:35,897][0m Trial 50 finished with value: 0.7452504539223052 and parameters: {'alpha': 1.2015481916654227, 'ties': 'breslow'}. Best is trial 48 with value: 0.7453475355819602.[0m
[32m[I 2022-04-13 12:42:39,202][0m Trial 51 finished with value: 0.7449496466480174 and parameters: {'alpha': 1.5355179497480531, 'ties': 'breslow'}. Best is trial 48 with value: 0.7453475355819602.[0m
[32m[I 2022-04-13 12:42:40,841][0m Trial 52 finished with value: 0.745322975140555 and parameters: {'alpha': 1.2443372076038874, 'ties': 'breslow'}. Best is trial 48 with value: 0.7453475355819602.[0m
[32m[I 2022-04-13 12:42:42,769][0m Trial 53 finished with value: 0.7449185294282139 and parameters: {'alpha': 1.8532865735282296, 'ties': 'breslow'}. Best is trial 48 with value: 0.7453475355819602.[0m
[32m[I 2022-04-13 12:42:44,662][0m Trial 54 finished with value: 0.7452894940155386 and parameters: {'alpha': 1.2926977050007815, 'ties': 'breslow'}. Best is trial 48 with value: 0.7453475355819602.[0m
[32m[I 2022-04-13 12:42:46,643][0m Trial 55 finished with value: 0.742125597316418 and parameters: {'alpha': 3.1223933476424683, 'ties': 'efron'}. Best is trial 48 with value: 0.7453475355819602.[0m
[32m[I 2022-04-13 12:42:49,255][0m Trial 56 finished with value: 0.7449198113020182 and parameters: {'alpha': 1.9707337780279126, 'ties': 'breslow'}. Best is trial 48 with value: 0.7453475355819602.[0m
[32m[I 2022-04-13 12:42:52,630][0m Trial 57 finished with value: 0.7447968247129169 and parameters: {'alpha': 1.6508696621928642, 'ties': 'breslow'}. Best is trial 48 with value: 0.7453475355819602.[0m
[32m[I 2022-04-13 12:42:57,058][0m Trial 58 finished with value: 0.7446571079147457 and parameters: {'alpha': 0.6941073071276675, 'ties': 'efron'}. Best is trial 48 with value: 0.7453475355819602.[0m
[32m[I 2022-04-13 12:43:00,438][0m Trial 59 finished with value: 0.7439576657755208 and parameters: {'alpha': 2.3867594557069247, 'ties': 'breslow'}. Best is trial 48 with value: 0.7453475355819602.[0m
[32m[I 2022-04-13 12:43:02,802][0m Trial 60 finished with value: 0.7448876450875022 and parameters: {'alpha': 1.4500029195337845, 'ties': 'breslow'}. Best is trial 48 with value: 0.7453475355819602.[0m
[32m[I 2022-04-13 12:43:05,871][0m Trial 61 finished with value: 0.745322975140555 and parameters: {'alpha': 1.2444340363314252, 'ties': 'breslow'}. Best is trial 48 with value: 0.7453475355819602.[0m
[32m[I 2022-04-13 12:43:08,673][0m Trial 62 finished with value: 0.7451745901981458 and parameters: {'alpha': 1.0043784501123414, 'ties': 'breslow'}. Best is trial 48 with value: 0.7453475355819602.[0m
[32m[I 2022-04-13 12:43:13,002][0m Trial 63 finished with value: 0.745182246065808 and parameters: {'alpha': 1.1908866161155018, 'ties': 'breslow'}. Best is trial 48 with value: 0.7453475355819602.[0m
[32m[I 2022-04-13 12:43:16,806][0m Trial 64 finished with value: 0.7389148942216173 and parameters: {'alpha': 4.258165363056932, 'ties': 'breslow'}. Best is trial 48 with value: 0.7453475355819602.[0m
