[32m[I 2022-04-13 12:00:11,128][0m Trial 629 finished with value: 0.7772798695453697 and parameters: {'splitter': 'best', 'min_samples_split': 0.14645446335439508, 'min_samples_leaf': 0.039437877687807606, 'min_weight_fraction_leaf': 0.09005498098904152, 'max_features': 0.9707953524831463}. Best is trial 448 with value: 0.8888507593246218.[0m
[32m[I 2022-04-13 12:00:12,950][0m Trial 630 finished with value: 0.696318671835033 and parameters: {'splitter': 'best', 'min_samples_split': 0.09541860981806398, 'min_samples_leaf': 0.01661194491888298, 'min_weight_fraction_leaf': 0.499350101984363, 'max_features': 0.9088066498300927}. Best is trial 448 with value: 0.8888507593246218.[0m
[32m[I 2022-04-13 12:00:14,003][0m Trial 631 finished with value: 0.5556357723140267 and parameters: {'splitter': 'best', 'min_samples_split': 0.12698050298460342, 'min_samples_leaf': 0.20358924268721781, 'min_weight_fraction_leaf': 0.010167839099970363, 'max_features': 0.9406523344394374}. Best is trial 448 with value: 0.8888507593246218.[0m
/media/san2_ssd/data/Workdir/survival/utils.py:305: RuntimeWarning: invalid value encountered in true_divide
  pdfs = np.gradient(1-survs,axis=1)/norms
/media/san2_ssd/data/Workdir/survival/utils.py:305: RuntimeWarning: invalid value encountered in true_divide
  pdfs = np.gradient(1-survs,axis=1)/norms
/media/san2_ssd/data/Workdir/survival/utils.py:305: RuntimeWarning: invalid value encountered in true_divide
  pdfs = np.gradient(1-survs,axis=1)/norms
[32m[I 2022-04-13 12:00:15,883][0m Trial 632 finished with value: 0.8863881271863885 and parameters: {'splitter': 'best', 'min_samples_split': 0.11381600281219131, 'min_samples_leaf': 0.027440087688286003, 'min_weight_fraction_leaf': 0.047513779478367636, 'max_features': 0.9994327144341111}. Best is trial 448 with value: 0.8888507593246218.[0m
/media/san2_ssd/data/Workdir/survival/utils.py:305: RuntimeWarning: invalid value encountered in true_divide
  pdfs = np.gradient(1-survs,axis=1)/norms
/media/san2_ssd/data/Workdir/survival/utils.py:305: RuntimeWarning: invalid value encountered in true_divide
  pdfs = np.gradient(1-survs,axis=1)/norms
/media/san2_ssd/data/Workdir/survival/utils.py:305: RuntimeWarning: invalid value encountered in true_divide
  pdfs = np.gradient(1-survs,axis=1)/norms
[32m[I 2022-04-13 12:00:18,320][0m Trial 633 finished with value: 0.8849458687229605 and parameters: {'splitter': 'best', 'min_samples_split': 0.08439874584014362, 'min_samples_leaf': 0.05014598477016529, 'min_weight_fraction_leaf': 0.03119792953333387, 'max_features': 0.9656939455080407}. Best is trial 448 with value: 0.8888507593246218.[0m
/media/san2_ssd/data/Workdir/survival/utils.py:305: RuntimeWarning: invalid value encountered in true_divide
  pdfs = np.gradient(1-survs,axis=1)/norms
/media/san2_ssd/data/Workdir/survival/utils.py:305: RuntimeWarning: invalid value encountered in true_divide
  pdfs = np.gradient(1-survs,axis=1)/norms
/media/san2_ssd/data/Workdir/survival/utils.py:305: RuntimeWarning: invalid value encountered in true_divide
  pdfs = np.gradient(1-survs,axis=1)/norms
/media/san2_ssd/data/Workdir/survival/utils.py:305: RuntimeWarning: invalid value encountered in true_divide
  pdfs = np.gradient(1-survs,axis=1)/norms
/media/san2_ssd/data/Workdir/survival/utils.py:305: RuntimeWarning: invalid value encountered in true_divide
  pdfs = np.gradient(1-survs,axis=1)/norms
[32m[I 2022-04-13 12:00:22,264][0m Trial 634 finished with value: 0.8868625421922302 and parameters: {'splitter': 'best', 'min_samples_split': 0.10400801437072835, 'min_samples_leaf': 0.03422166433659419, 'min_weight_fraction_leaf': 0.02073316118454667, 'max_features': 0.9830497089714278}. Best is trial 448 with value: 0.8888507593246218.[0m
/media/san2_ssd/data/Workdir/survival/utils.py:305: RuntimeWarning: invalid value encountered in true_divide
  pdfs = np.gradient(1-survs,axis=1)/norms
/media/san2_ssd/data/Workdir/survival/utils.py:305: RuntimeWarning: invalid value encountered in true_divide
  pdfs = np.gradient(1-survs,axis=1)/norms
/media/san2_ssd/data/Workdir/survival/utils.py:305: RuntimeWarning: invalid value encountered in true_divide
  pdfs = np.gradient(1-survs,axis=1)/norms
[32m[I 2022-04-13 12:00:25,862][0m Trial 635 finished with value: 0.8837520445613418 and parameters: {'splitter': 'best', 'min_samples_split': 0.12037701667744104, 'min_samples_leaf': 0.012581187551478787, 'min_weight_fraction_leaf': 0.03775294752646117, 'max_features': 0.956825165146995}. Best is trial 448 with value: 0.8888507593246218.[0m
[32m[I 2022-04-13 12:00:27,683][0m Trial 636 finished with value: 0.8815058635530635 and parameters: {'splitter': 'best', 'min_samples_split': 0.13297323720854784, 'min_samples_leaf': 0.06213021080575505, 'min_weight_fraction_leaf': 0.01476104445849637, 'max_features': 0.9342301943783113}. Best is trial 448 with value: 0.8888507593246218.[0m
[32m[I 2022-04-13 12:00:28,520][0m Trial 637 finished with value: 0.4642421426116402 and parameters: {'splitter': 'best', 'min_samples_split': 0.10712599485184693, 'min_samples_leaf': 0.2244990047244007, 'min_weight_fraction_leaf': 0.050062245799929794, 'max_features': 0.9827256664937386}. Best is trial 448 with value: 0.8888507593246218.[0m
[32m[I 2022-04-13 12:00:32,148][0m Trial 638 finished with value: 0.777762438703808 and parameters: {'splitter': 'best', 'min_samples_split': 0.2063162812074031, 'min_samples_leaf': 0.024679720657581755, 'min_weight_fraction_leaf': 0.02785225555283235, 'max_features': 0.9677319516724101}. Best is trial 448 with value: 0.8888507593246218.[0m
[32m[I 2022-04-13 12:00:32,631][0m Trial 639 finished with value: 0.8733523702960568 and parameters: {'splitter': 'random', 'min_samples_split': 0.09454388815456741, 'min_samples_leaf': 0.04074276794264038, 'min_weight_fraction_leaf': 0.037868358790451334, 'max_features': 0.3876922868622529}. Best is trial 448 with value: 0.8888507593246218.[0m
[32m[I 2022-04-13 12:00:34,268][0m Trial 640 finished with value: 0.46399766320272856 and parameters: {'splitter': 'best', 'min_samples_split': 0.11401183137097984, 'min_samples_leaf': 0.011441570150419503, 'min_weight_fraction_leaf': 0.27535075915934737, 'max_features': 0.981739176552358}. Best is trial 448 with value: 0.8888507593246218.[0m
/media/san2_ssd/data/Workdir/survival/utils.py:305: RuntimeWarning: invalid value encountered in true_divide
  pdfs = np.gradient(1-survs,axis=1)/norms
/media/san2_ssd/data/Workdir/survival/utils.py:305: RuntimeWarning: invalid value encountered in true_divide
  pdfs = np.gradient(1-survs,axis=1)/norms
/media/san2_ssd/data/Workdir/survival/utils.py:305: RuntimeWarning: invalid value encountered in true_divide
  pdfs = np.gradient(1-survs,axis=1)/norms
/media/san2_ssd/data/Workdir/survival/utils.py:305: RuntimeWarning: invalid value encountered in true_divide
  pdfs = np.gradient(1-survs,axis=1)/norms
/media/san2_ssd/data/Workdir/survival/utils.py:305: RuntimeWarning: invalid value encountered in true_divide
  pdfs = np.gradient(1-survs,axis=1)/norms
[32m[I 2022-04-13 12:00:37,120][0m Trial 641 finished with value: 0.8860758331402538 and parameters: {'splitter': 'best', 'min_samples_split': 0.054376272145098006, 'min_samples_leaf': 0.022687076919273998, 'min_weight_fraction_leaf': 0.006535981335237327, 'max_features': 0.9989341446998029}. Best is trial 448 with value: 0.8888507593246218.[0m
/media/san2_ssd/data/Workdir/survival/utils.py:305: RuntimeWarning: invalid value encountered in true_divide
  pdfs = np.gradient(1-survs,axis=1)/norms
[32m[I 2022-04-13 12:00:39,994][0m Trial 642 finished with value: 0.8825556074771066 and parameters: {'splitter': 'best', 'min_samples_split': 0.12738593441677307, 'min_samples_leaf': 0.03356897443227391, 'min_weight_fraction_leaf': 0.061879117844535356, 'max_features': 0.949820524870621}. Best is trial 448 with value: 0.8888507593246218.[0m
/media/san2_ssd/data/Workdir/survival/utils.py:305: RuntimeWarning: invalid value encountered in true_divide
  pdfs = np.gradient(1-survs,axis=1)/norms
/media/san2_ssd/data/Workdir/survival/utils.py:305: RuntimeWarning: invalid value encountered in true_divide
  pdfs = np.gradient(1-survs,axis=1)/norms
/media/san2_ssd/data/Workdir/survival/utils.py:305: RuntimeWarning: invalid value encountered in true_divide
  pdfs = np.gradient(1-survs,axis=1)/norms
[32m[I 2022-04-13 12:00:41,885][0m Trial 643 finished with value: 0.8838025869977104 and parameters: {'splitter': 'best', 'min_samples_split': 0.10135813020472735, 'min_samples_leaf': 0.0500174191764832, 'min_weight_fraction_leaf': 0.01998760193563761, 'max_features': 0.9693126884310653}. Best is trial 448 with value: 0.8888507593246218.[0m
[32m[I 2022-04-13 12:00:42,858][0m Trial 644 finished with value: 0.45853053504751945 and parameters: {'splitter': 'best', 'min_samples_split': 0.11891490623807693, 'min_samples_leaf': 0.008314678860206728, 'min_weight_fraction_leaf': 0.1623144593012537, 'max_features': 0.9272174943019991}. Best is trial 448 with value: 0.8888507593246218.[0m
/media/san2_ssd/data/Workdir/survival/utils.py:305: RuntimeWarning: invalid value encountered in true_divide
  pdfs = np.gradient(1-survs,axis=1)/norms
/media/san2_ssd/data/Workdir/survival/utils.py:305: RuntimeWarning: invalid value encountered in true_divide
  pdfs = np.gradient(1-survs,axis=1)/norms
/media/san2_ssd/data/Workdir/survival/utils.py:305: RuntimeWarning: invalid value encountered in true_divide
  pdfs = np.gradient(1-survs,axis=1)/norms
/media/san2_ssd/data/Workdir/survival/utils.py:305: RuntimeWarning: invalid value encountered in true_divide
  pdfs = np.gradient(1-survs,axis=1)/norms
/media/san2_ssd/data/Workdir/survival/utils.py:305: RuntimeWarning: invalid value encountered in true_divide
  pdfs = np.gradient(1-survs,axis=1)/norms
[32m[I 2022-04-13 12:00:44,112][0m Trial 645 finished with value: 0.8841254079070889 and parameters: {'splitter': 'best', 'min_samples_split': 0.08455379346670368, 'min_samples_leaf': 0.02005794394501437, 'min_weight_fraction_leaf': 0.029900417681697607, 'max_features': 0.9995304018689514}. Best is trial 448 with value: 0.8888507593246218.[0m
[32m[I 2022-04-13 12:00:45,287][0m Trial 646 finished with value: 0.4579848107868454 and parameters: {'splitter': 'best', 'min_samples_split': 0.35950917559229734, 'min_samples_leaf': 0.11029812912467533, 'min_weight_fraction_leaf': 0.04315381529277853, 'max_features': 0.9540967859430064}. Best is trial 448 with value: 0.8888507593246218.[0m
/media/san2_ssd/data/Workdir/survival/utils.py:305: RuntimeWarning: invalid value encountered in true_divide
  pdfs = np.gradient(1-survs,axis=1)/norms
/media/san2_ssd/data/Workdir/survival/utils.py:305: RuntimeWarning: invalid value encountered in true_divide
  pdfs = np.gradient(1-survs,axis=1)/norms
/media/san2_ssd/data/Workdir/survival/utils.py:305: RuntimeWarning: invalid value encountered in true_divide
  pdfs = np.gradient(1-survs,axis=1)/norms
[32m[I 2022-04-13 12:00:46,481][0m Trial 647 finished with value: 0.7873094003261312 and parameters: {'splitter': 'best', 'min_samples_split': 0.13618649786429585, 'min_samples_leaf': 0.041362353752155405, 'min_weight_fraction_leaf': 0.0008846036917546339, 'max_features': 0.9809359115792579}. Best is trial 448 with value: 0.8888507593246218.[0m
/media/san2_ssd/data/Workdir/survival/utils.py:305: RuntimeWarning: invalid value encountered in true_divide
  pdfs = np.gradient(1-survs,axis=1)/norms
/media/san2_ssd/data/Workdir/survival/utils.py:305: RuntimeWarning: invalid value encountered in true_divide
  pdfs = np.gradient(1-survs,axis=1)/norms
/media/san2_ssd/data/Workdir/survival/utils.py:305: RuntimeWarning: invalid value encountered in true_divide
  pdfs = np.gradient(1-survs,axis=1)/norms
/media/san2_ssd/data/Workdir/survival/utils.py:305: RuntimeWarning: invalid value encountered in true_divide
  pdfs = np.gradient(1-survs,axis=1)/norms
/media/san2_ssd/data/Workdir/survival/utils.py:305: RuntimeWarning: invalid value encountered in true_divide
  pdfs = np.gradient(1-survs,axis=1)/norms
[32m[I 2022-04-13 12:00:47,763][0m Trial 648 finished with value: 0.8872137380475543 and parameters: {'splitter': 'best', 'min_samples_split': 0.11035493804328529, 'min_samples_leaf': 0.030870815094552577, 'min_weight_fraction_leaf': 0.02261989645814461, 'max_features': 0.983196987863068}. Best is trial 448 with value: 0.8888507593246218.[0m
/media/san2_ssd/data/Workdir/survival/utils.py:305: RuntimeWarning: invalid value encountered in true_divide
  pdfs = np.gradient(1-survs,axis=1)/norms
/media/san2_ssd/data/Workdir/survival/utils.py:305: RuntimeWarning: invalid value encountered in true_divide
  pdfs = np.gradient(1-survs,axis=1)/norms
/media/san2_ssd/data/Workdir/survival/utils.py:305: RuntimeWarning: invalid value encountered in true_divide
  pdfs = np.gradient(1-survs,axis=1)/norms
[32m[I 2022-04-13 12:00:50,893][0m Trial 649 finished with value: 0.8818942592739324 and parameters: {'splitter': 'best', 'min_samples_split': 0.12361351194720296, 'min_samples_leaf': 0.019274192357736596, 'min_weight_fraction_leaf': 0.05040607088111974, 'max_features': 0.9643767289174622}. Best is trial 448 with value: 0.8888507593246218.[0m
/media/san2_ssd/data/Workdir/survival/utils.py:305: RuntimeWarning: invalid value encountered in true_divide
  pdfs = np.gradient(1-survs,axis=1)/norms
/media/san2_ssd/data/Workdir/survival/utils.py:305: RuntimeWarning: invalid value encountered in true_divide
  pdfs = np.gradient(1-survs,axis=1)/norms
/media/san2_ssd/data/Workdir/survival/utils.py:305: RuntimeWarning: invalid value encountered in true_divide
  pdfs = np.gradient(1-survs,axis=1)/norms
/media/san2_ssd/data/Workdir/survival/utils.py:305: RuntimeWarning: invalid value encountered in true_divide
  pdfs = np.gradient(1-survs,axis=1)/norms
/media/san2_ssd/data/Workdir/survival/utils.py:305: RuntimeWarning: invalid value encountered in true_divide
  pdfs = np.gradient(1-survs,axis=1)/norms
[32m[I 2022-04-13 12:00:54,507][0m Trial 650 finished with value: 0.8822958578753882 and parameters: {'splitter': 'best', 'min_samples_split': 0.09281754617721333, 'min_samples_leaf': 0.0010268706915791195, 'min_weight_fraction_leaf': 0.013686817030415016, 'max_features': 0.9428543586195766}. Best is trial 448 with value: 0.8888507593246218.[0m
/media/san2_ssd/data/Workdir/survival/utils.py:305: RuntimeWarning: invalid value encountered in true_divide
  pdfs = np.gradient(1-survs,axis=1)/norms
[32m[I 2022-04-13 12:00:56,160][0m Trial 651 finished with value: 0.8863457088750339 and parameters: {'splitter': 'best', 'min_samples_split': 0.1475568260178164, 'min_samples_leaf': 0.03136498359114743, 'min_weight_fraction_leaf': 0.034868596718125706, 'max_features': 0.9829864738727211}. Best is trial 448 with value: 0.8888507593246218.[0m
/media/san2_ssd/data/Workdir/survival/utils.py:305: RuntimeWarning: invalid value encountered in true_divide
  pdfs = np.gradient(1-survs,axis=1)/norms
/media/san2_ssd/data/Workdir/survival/utils.py:305: RuntimeWarning: invalid value encountered in true_divide
  pdfs = np.gradient(1-survs,axis=1)/norms
[32m[I 2022-04-13 12:00:57,969][0m Trial 652 finished with value: 0.8850214022960919 and parameters: {'splitter': 'best', 'min_samples_split': 0.10546756786065434, 'min_samples_leaf': 0.05443639581818278, 'min_weight_fraction_leaf': 0.0268549901555738, 'max_features': 0.9992828940205647}. Best is trial 448 with value: 0.8888507593246218.[0m
[32m[I 2022-04-13 12:01:00,057][0m Trial 653 finished with value: 0.8803010018852703 and parameters: {'splitter': 'best', 'min_samples_split': 0.11310269995935403, 'min_samples_leaf': 0.04152502653226879, 'min_weight_fraction_leaf': 0.07414097031666651, 'max_features': 0.964614199288688}. Best is trial 448 with value: 0.8888507593246218.[0m
[32m[I 2022-04-13 12:01:01,043][0m Trial 654 finished with value: 0.6957687030819987 and parameters: {'splitter': 'best', 'min_samples_split': 0.07588002412178867, 'min_samples_leaf': 0.07614094811560593, 'min_weight_fraction_leaf': 0.4368393101707241, 'max_features': 0.8971426819532775}. Best is trial 448 with value: 0.8888507593246218.[0m
/media/san2_ssd/data/Workdir/survival/utils.py:305: RuntimeWarning: invalid value encountered in true_divide
  pdfs = np.gradient(1-survs,axis=1)/norms
/media/san2_ssd/data/Workdir/survival/utils.py:305: RuntimeWarning: invalid value encountered in true_divide
  pdfs = np.gradient(1-survs,axis=1)/norms
/media/san2_ssd/data/Workdir/survival/utils.py:305: RuntimeWarning: invalid value encountered in true_divide
  pdfs = np.gradient(1-survs,axis=1)/norms
/media/san2_ssd/data/Workdir/survival/utils.py:305: RuntimeWarning: invalid value encountered in true_divide
  pdfs = np.gradient(1-survs,axis=1)/norms
[32m[I 2022-04-13 12:01:04,173][0m Trial 655 finished with value: 0.8838769781658234 and parameters: {'splitter': 'best', 'min_samples_split': 0.1245857239484787, 'min_samples_leaf': 0.026956245084877012, 'min_weight_fraction_leaf': 0.04232257206168949, 'max_features': 0.9492807997764307}. Best is trial 448 with value: 0.8888507593246218.[0m
[32m[I 2022-04-13 12:01:04,558][0m Trial 656 finished with value: 0.5371812073302544 and parameters: {'splitter': 'best', 'min_samples_split': 0.09767738918169784, 'min_samples_leaf': 0.38803442918025255, 'min_weight_fraction_leaf': 0.009848321000999354, 'max_features': 0.9841108211326833}. Best is trial 448 with value: 0.8888507593246218.[0m
/media/san2_ssd/data/Workdir/survival/utils.py:305: RuntimeWarning: invalid value encountered in true_divide
  pdfs = np.gradient(1-survs,axis=1)/norms
/media/san2_ssd/data/Workdir/survival/utils.py:305: RuntimeWarning: invalid value encountered in true_divide
  pdfs = np.gradient(1-survs,axis=1)/norms
/media/san2_ssd/data/Workdir/survival/utils.py:305: RuntimeWarning: invalid value encountered in true_divide
  pdfs = np.gradient(1-survs,axis=1)/norms
[32m[I 2022-04-13 12:01:06,184][0m Trial 657 finished with value: 0.8824062575127882 and parameters: {'splitter': 'best', 'min_samples_split': 0.11604253519685773, 'min_samples_leaf': 0.012564269425307053, 'min_weight_fraction_leaf': 0.05913564207413988, 'max_features': 0.9673149263598283}. Best is trial 448 with value: 0.8888507593246218.[0m
[32m[I 2022-04-13 12:01:06,581][0m Trial 658 finished with value: 0.5371812073302544 and parameters: {'splitter': 'random', 'min_samples_split': 0.1377613052208976, 'min_samples_leaf': 0.046327202898991816, 'min_weight_fraction_leaf': 0.3771031551632354, 'max_features': 0.9994773817920288}. Best is trial 448 with value: 0.8888507593246218.[0m
[32m[I 2022-04-13 12:01:08,897][0m Trial 659 finished with value: 0.5743041674765487 and parameters: {'splitter': 'best', 'min_samples_split': 0.10438103651372632, 'min_samples_leaf': 0.13091290013432832, 'min_weight_fraction_leaf': 0.03303303272990661, 'max_features': 0.9279209050694671}. Best is trial 448 with value: 0.8888507593246218.[0m
/media/san2_ssd/data/Workdir/survival/utils.py:305: RuntimeWarning: invalid value encountered in true_divide
  pdfs = np.gradient(1-survs,axis=1)/norms
/media/san2_ssd/data/Workdir/survival/utils.py:305: RuntimeWarning: invalid value encountered in true_divide
  pdfs = np.gradient(1-survs,axis=1)/norms
/media/san2_ssd/data/Workdir/survival/utils.py:305: RuntimeWarning: invalid value encountered in true_divide
  pdfs = np.gradient(1-survs,axis=1)/norms
[32m[I 2022-04-13 12:01:13,250][0m Trial 660 finished with value: 0.8829225648520952 and parameters: {'splitter': 'best', 'min_samples_split': 0.1292067914181363, 'min_samples_leaf': 0.020076828736365668, 'min_weight_fraction_leaf': 0.01718451401194029, 'max_features': 0.9665190075287095}. Best is trial 448 with value: 0.8888507593246218.[0m
/media/san2_ssd/data/Workdir/survival/utils.py:305: RuntimeWarning: invalid value encountered in true_divide
  pdfs = np.gradient(1-survs,axis=1)/norms
/media/san2_ssd/data/Workdir/survival/utils.py:305: RuntimeWarning: invalid value encountered in true_divide
  pdfs = np.gradient(1-survs,axis=1)/norms
/media/san2_ssd/data/Workdir/survival/utils.py:305: RuntimeWarning: invalid value encountered in true_divide
  pdfs = np.gradient(1-survs,axis=1)/norms
/media/san2_ssd/data/Workdir/survival/utils.py:305: RuntimeWarning: invalid value encountered in true_divide
  pdfs = np.gradient(1-survs,axis=1)/norms
[32m[I 2022-04-13 12:01:15,847][0m Trial 661 finished with value: 0.8876464825002224 and parameters: {'splitter': 'best', 'min_samples_split': 0.08828658172062487, 'min_samples_leaf': 0.036615161740055364, 'min_weight_fraction_leaf': 0.04495381553590656, 'max_features': 0.982787053580624}. Best is trial 448 with value: 0.8888507593246218.[0m
/media/san2_ssd/data/Workdir/survival/utils.py:305: RuntimeWarning: invalid value encountered in true_divide
  pdfs = np.gradient(1-survs,axis=1)/norms
/media/san2_ssd/data/Workdir/survival/utils.py:305: RuntimeWarning: invalid value encountered in true_divide
  pdfs = np.gradient(1-survs,axis=1)/norms
[32m[I 2022-04-13 12:01:18,504][0m Trial 662 finished with value: 0.8857747639504467 and parameters: {'splitter': 'best', 'min_samples_split': 0.08049860929683306, 'min_samples_leaf': 0.0593254171490912, 'min_weight_fraction_leaf': 0.0553041806202937, 'max_features': 0.9997963043321787}. Best is trial 448 with value: 0.8888507593246218.[0m
[32m[I 2022-04-13 12:01:21,256][0m Trial 663 finished with value: 0.8818556658642427 and parameters: {'splitter': 'best', 'min_samples_split': 0.11817822074923329, 'min_samples_leaf': 0.07063149815077079, 'min_weight_fraction_leaf': 0.06545138260004396, 'max_features': 0.9539027912692308}. Best is trial 448 with value: 0.8888507593246218.[0m
