[32m[I 2022-04-18 01:57:57,559][0m Trial 577 finished with value: 0.7699735543338095 and parameters: {'n_hidden': 256, 'mixture_components': 9, 'use_sparse_layer': True, 'use_sparse_loss': False, 'use_batchnorm': False, 'use_dropout': True, 'dropout': 0.6943323653937931, 'mlp_size_1': 1, 'mlp_size_2': 4, 'mlp_size_3': 0, 'kernel': 'Exponential', 'loss_name': 'CensoredNLLLoss'}. Best is trial 526 with value: 0.7749738194021545.[0m
[32m[I 2022-04-18 02:00:33,859][0m Trial 578 finished with value: 0.7710240919449014 and parameters: {'n_hidden': 128, 'mixture_components': 5, 'use_sparse_layer': True, 'use_sparse_loss': False, 'use_batchnorm': False, 'use_dropout': True, 'dropout': 0.6675406722901941, 'mlp_size_1': 1, 'mlp_size_2': 3, 'mlp_size_3': 0, 'kernel': 'Exponential', 'loss_name': 'AlternativeNLLLoss'}. Best is trial 526 with value: 0.7749738194021545.[0m
[32m[I 2022-04-18 02:02:37,688][0m Trial 579 finished with value: 0.772236035559389 and parameters: {'n_hidden': 256, 'mixture_components': 4, 'use_sparse_layer': False, 'use_batchnorm': False, 'use_dropout': True, 'dropout': 0.7335313095065124, 'mlp_size_1': 1, 'mlp_size_2': 4, 'mlp_size_3': 0, 'kernel': 'Exponential', 'loss_name': 'CensoredNLLLoss'}. Best is trial 526 with value: 0.7749738194021545.[0m
[32m[I 2022-04-18 02:04:57,576][0m Trial 580 finished with value: 0.7742670560861008 and parameters: {'n_hidden': 256, 'mixture_components': 10, 'use_sparse_layer': True, 'use_sparse_loss': False, 'use_batchnorm': False, 'use_dropout': True, 'dropout': 0.8309531513269242, 'mlp_size_1': 1, 'mlp_size_2': 4, 'mlp_size_3': 0, 'kernel': 'Exponential', 'loss_name': 'AlternativeNLLLoss'}. Best is trial 526 with value: 0.7749738194021545.[0m
[32m[I 2022-04-18 02:07:38,787][0m Trial 581 finished with value: 0.7397952420248407 and parameters: {'n_hidden': 256, 'mixture_components': 10, 'use_sparse_layer': True, 'use_sparse_loss': False, 'use_batchnorm': False, 'use_dropout': True, 'dropout': 0.8643821318901889, 'mlp_size_1': 1, 'mlp_size_2': 4, 'mlp_size_3': 0, 'kernel': 'Logistic', 'loss_name': 'CensoredNLLLoss'}. Best is trial 526 with value: 0.7749738194021545.[0m
[32m[I 2022-04-18 02:10:06,844][0m Trial 582 finished with value: 0.765649945684008 and parameters: {'n_hidden': 256, 'mixture_components': 10, 'use_sparse_layer': True, 'use_sparse_loss': False, 'use_batchnorm': False, 'use_dropout': True, 'dropout': 0.8844398830196551, 'mlp_size_1': 1, 'mlp_size_2': 4, 'mlp_size_3': 0, 'kernel': 'Exponential', 'loss_name': 'AlternativeNLLLoss'}. Best is trial 526 with value: 0.7749738194021545.[0m
[32m[I 2022-04-18 02:12:04,110][0m Trial 583 finished with value: 0.772955100782355 and parameters: {'n_hidden': 512, 'mixture_components': 10, 'use_sparse_layer': True, 'use_sparse_loss': False, 'use_batchnorm': False, 'use_dropout': True, 'dropout': 0.8464133390958937, 'mlp_size_1': 2, 'mlp_size_2': 4, 'mlp_size_3': 0, 'kernel': 'Exponential', 'loss_name': 'CensoredNLLLoss'}. Best is trial 526 with value: 0.7749738194021545.[0m
[32m[I 2022-04-18 02:14:35,751][0m Trial 584 finished with value: 0.7532494608264256 and parameters: {'n_hidden': 512, 'mixture_components': 10, 'use_sparse_layer': True, 'use_sparse_loss': False, 'use_batchnorm': True, 'use_dropout': True, 'dropout': 0.8385778962720184, 'mlp_size_1': 2, 'mlp_size_2': 4, 'mlp_size_3': 0, 'kernel': 'Exponential', 'loss_name': 'CensoredNLLLoss'}. Best is trial 526 with value: 0.7749738194021545.[0m
[32m[I 2022-04-18 02:16:36,961][0m Trial 585 finished with value: 0.7666377964267348 and parameters: {'n_hidden': 512, 'mixture_components': 10, 'use_sparse_layer': True, 'use_sparse_loss': False, 'use_batchnorm': False, 'use_dropout': True, 'dropout': 0.8215857208276701, 'mlp_size_1': 1, 'mlp_size_2': 4, 'mlp_size_3': 0, 'kernel': 'Exponential', 'loss_name': 'CensoredNLLLoss'}. Best is trial 526 with value: 0.7749738194021545.[0m
[32m[I 2022-04-18 02:19:01,855][0m Trial 586 finished with value: 0.7582807306460145 and parameters: {'n_hidden': 64, 'mixture_components': 10, 'use_sparse_layer': True, 'use_sparse_loss': False, 'use_batchnorm': False, 'use_dropout': True, 'dropout': 0.8441239080537177, 'mlp_size_1': 2, 'mlp_size_2': 1, 'mlp_size_3': 0, 'kernel': 'Exponential', 'loss_name': 'CensoredNLLLoss'}. Best is trial 526 with value: 0.7749738194021545.[0m
[32m[I 2022-04-18 02:21:01,122][0m Trial 587 finished with value: 0.771854749338491 and parameters: {'n_hidden': 512, 'mixture_components': 10, 'use_sparse_layer': True, 'use_sparse_loss': False, 'use_batchnorm': False, 'use_dropout': True, 'dropout': 0.8663898442866069, 'mlp_size_1': 2, 'mlp_size_2': 4, 'mlp_size_3': 0, 'kernel': 'Exponential', 'loss_name': 'CensoredNLLLoss'}. Best is trial 526 with value: 0.7749738194021545.[0m
[32m[I 2022-04-18 02:23:34,794][0m Trial 588 finished with value: 0.7205483022254628 and parameters: {'n_hidden': 32, 'mixture_components': 10, 'use_sparse_layer': True, 'use_sparse_loss': False, 'use_batchnorm': False, 'use_dropout': True, 'dropout': 0.8599217602812855, 'mlp_size_1': 2, 'mlp_size_2': 0, 'mlp_size_3': 0, 'kernel': 'Exponential', 'loss_name': 'CensoredNLLLoss'}. Best is trial 526 with value: 0.7749738194021545.[0m
[32m[I 2022-04-18 02:26:29,293][0m Trial 589 finished with value: 0.7636229071136305 and parameters: {'n_hidden': 512, 'mixture_components': 10, 'use_sparse_layer': True, 'use_sparse_loss': False, 'use_batchnorm': False, 'use_dropout': True, 'dropout': 0.8281929693910713, 'mlp_size_1': 2, 'mlp_size_2': 4, 'mlp_size_3': 0, 'kernel': 'Normal', 'loss_name': 'CensoredNLLLoss'}. Best is trial 526 with value: 0.7749738194021545.[0m
[32m[I 2022-04-18 02:28:25,172][0m Trial 590 finished with value: 0.7708284531254227 and parameters: {'n_hidden': 512, 'mixture_components': 10, 'use_sparse_layer': True, 'use_sparse_loss': False, 'use_batchnorm': False, 'use_dropout': True, 'dropout': 0.8821268632899133, 'mlp_size_1': 2, 'mlp_size_2': 4, 'mlp_size_3': 0, 'kernel': 'Exponential', 'loss_name': 'CensoredNLLLoss'}. Best is trial 526 with value: 0.7749738194021545.[0m
[32m[I 2022-04-18 02:30:20,563][0m Trial 591 finished with value: 0.7685290294576811 and parameters: {'n_hidden': 512, 'mixture_components': 10, 'use_sparse_layer': True, 'use_sparse_loss': False, 'use_batchnorm': False, 'use_dropout': True, 'dropout': 0.8367466583889537, 'mlp_size_1': 2, 'mlp_size_2': 4, 'mlp_size_3': 0, 'kernel': 'Exponential', 'loss_name': 'CensoredNLLLoss'}. Best is trial 526 with value: 0.7749738194021545.[0m
[32m[I 2022-04-18 02:33:12,332][0m Trial 592 finished with value: 0.7662429509054951 and parameters: {'n_hidden': 512, 'mixture_components': 10, 'use_sparse_layer': True, 'use_sparse_loss': False, 'use_batchnorm': False, 'use_dropout': True, 'dropout': 0.8905254545117325, 'mlp_size_1': 2, 'mlp_size_2': 4, 'mlp_size_3': 0, 'kernel': 'LogLogistic', 'loss_name': 'CensoredNLLLoss'}. Best is trial 526 with value: 0.7749738194021545.[0m
[32m[I 2022-04-18 02:35:17,102][0m Trial 593 finished with value: 0.7712184430730128 and parameters: {'n_hidden': 512, 'mixture_components': 10, 'use_sparse_layer': True, 'use_sparse_loss': False, 'use_batchnorm': False, 'use_dropout': True, 'dropout': 0.8046907954168594, 'mlp_size_1': 3, 'mlp_size_2': 3, 'mlp_size_3': 0, 'kernel': 'Gamma', 'loss_name': 'CensoredNLLLoss'}. Best is trial 526 with value: 0.7749738194021545.[0m
[32m[I 2022-04-18 02:37:17,916][0m Trial 594 finished with value: 0.7718295345416177 and parameters: {'n_hidden': 512, 'mixture_components': 10, 'use_sparse_layer': True, 'use_sparse_loss': False, 'use_batchnorm': False, 'use_dropout': True, 'dropout': 0.8508819061030579, 'mlp_size_1': 2, 'mlp_size_2': 4, 'mlp_size_3': 0, 'kernel': 'Exponential', 'loss_name': 'CensoredNLLLoss'}. Best is trial 526 with value: 0.7749738194021545.[0m
[32m[I 2022-04-18 02:39:36,088][0m Trial 595 finished with value: 0.7715530703884733 and parameters: {'n_hidden': 512, 'mixture_components': 10, 'use_sparse_layer': True, 'use_sparse_loss': False, 'use_batchnorm': False, 'use_dropout': True, 'dropout': 0.9137317589101887, 'mlp_size_1': 1, 'mlp_size_2': 4, 'mlp_size_3': 0, 'kernel': 'Exponential', 'loss_name': 'CensoredNLLLoss'}. Best is trial 526 with value: 0.7749738194021545.[0m
[32m[I 2022-04-18 02:41:27,241][0m Trial 596 finished with value: 0.7698876823439363 and parameters: {'n_hidden': 256, 'mixture_components': 10, 'use_sparse_layer': True, 'use_sparse_loss': False, 'use_batchnorm': False, 'use_dropout': True, 'dropout': 0.8038423889708644, 'mlp_size_1': 2, 'mlp_size_2': 3, 'mlp_size_3': 0, 'kernel': 'Exponential', 'loss_name': 'CensoredNLLLoss'}. Best is trial 526 with value: 0.7749738194021545.[0m
[32m[I 2022-04-18 02:43:30,418][0m Trial 597 finished with value: 0.7629098126427458 and parameters: {'n_hidden': 256, 'mixture_components': 10, 'use_sparse_layer': True, 'use_sparse_loss': False, 'use_batchnorm': False, 'use_dropout': True, 'dropout': 0.8637442582135455, 'mlp_size_1': 2, 'mlp_size_2': 3, 'mlp_size_3': 0, 'kernel': 'Exponential', 'loss_name': 'CensoredNLLLoss'}. Best is trial 526 with value: 0.7749738194021545.[0m
[32m[I 2022-04-18 02:45:27,846][0m Trial 598 finished with value: 0.771232122501196 and parameters: {'n_hidden': 256, 'mixture_components': 10, 'use_sparse_layer': True, 'use_sparse_loss': False, 'use_batchnorm': False, 'use_dropout': True, 'dropout': 0.8137242616958528, 'mlp_size_1': 2, 'mlp_size_2': 3, 'mlp_size_3': 0, 'kernel': 'Exponential', 'loss_name': 'CensoredNLLLoss'}. Best is trial 526 with value: 0.7749738194021545.[0m
[32m[I 2022-04-18 02:46:58,217][0m Trial 599 finished with value: 0.6065038544062864 and parameters: {'n_hidden': 256, 'mixture_components': 9, 'use_sparse_layer': True, 'use_sparse_loss': False, 'use_batchnorm': False, 'use_dropout': True, 'dropout': 0.7917218337075846, 'mlp_size_1': 1, 'mlp_size_2': 4, 'mlp_size_3': 0, 'kernel': 'Gumbel', 'loss_name': 'NLLLoss'}. Best is trial 526 with value: 0.7749738194021545.[0m
[32m[I 2022-04-18 02:49:33,808][0m Trial 600 finished with value: 0.7706585134094759 and parameters: {'n_hidden': 256, 'mixture_components': 10, 'use_sparse_layer': True, 'use_sparse_loss': True, 'lmbd': 0.009096104914322554, 'use_batchnorm': False, 'use_dropout': True, 'dropout': 0.9021803288736802, 'mlp_size_1': 1, 'mlp_size_2': 4, 'mlp_size_3': 0, 'kernel': 'Exponential', 'loss_name': 'CensoredNLLLoss'}. Best is trial 526 with value: 0.7749738194021545.[0m
[32m[I 2022-04-18 02:52:02,238][0m Trial 601 finished with value: 0.7238633759269996 and parameters: {'n_hidden': 2048, 'mixture_components': 10, 'use_sparse_layer': True, 'use_sparse_loss': False, 'use_batchnorm': False, 'use_dropout': True, 'dropout': 0.7746730492123263, 'mlp_size_1': 8, 'mlp_size_2': 0, 'mlp_size_3': 0, 'kernel': 'Exponential', 'loss_name': 'CensoredNLLLoss'}. Best is trial 526 with value: 0.7749738194021545.[0m
[32m[I 2022-04-18 02:54:27,042][0m Trial 602 finished with value: 0.7704402911548348 and parameters: {'n_hidden': 256, 'mixture_components': 10, 'use_sparse_layer': True, 'use_sparse_loss': False, 'use_batchnorm': False, 'use_dropout': True, 'dropout': 0.775542171730693, 'mlp_size_1': 1, 'mlp_size_2': 4, 'mlp_size_3': 0, 'kernel': 'Exponential', 'loss_name': 'CensoredNLLLoss'}. Best is trial 526 with value: 0.7749738194021545.[0m
[32m[I 2022-04-18 02:56:50,519][0m Trial 603 finished with value: 0.7496292891429366 and parameters: {'n_hidden': 256, 'mixture_components': 9, 'use_sparse_layer': True, 'use_sparse_loss': False, 'use_batchnorm': True, 'use_dropout': True, 'dropout': 0.8767081202344046, 'mlp_size_1': 1, 'mlp_size_2': 4, 'mlp_size_3': 0, 'kernel': 'Exponential', 'loss_name': 'CensoredNLLLoss'}. Best is trial 526 with value: 0.7749738194021545.[0m
[32m[I 2022-04-18 02:59:07,185][0m Trial 604 finished with value: 0.7660010026362046 and parameters: {'n_hidden': 64, 'mixture_components': 10, 'use_sparse_layer': True, 'use_sparse_loss': False, 'use_batchnorm': False, 'use_dropout': True, 'dropout': 0.42978411749294554, 'mlp_size_1': 1, 'mlp_size_2': 2, 'mlp_size_3': 0, 'kernel': 'Exponential', 'loss_name': 'CensoredNLLLoss'}. Best is trial 526 with value: 0.7749738194021545.[0m
[32m[I 2022-04-18 03:01:33,827][0m Trial 605 finished with value: 0.766733827259686 and parameters: {'n_hidden': 256, 'mixture_components': 10, 'use_sparse_layer': True, 'use_sparse_loss': False, 'use_batchnorm': False, 'use_dropout': True, 'dropout': 0.7504961336408161, 'mlp_size_1': 2, 'mlp_size_2': 3, 'mlp_size_3': 0, 'kernel': 'Weibull', 'loss_name': 'CensoredNLLLoss'}. Best is trial 526 with value: 0.7749738194021545.[0m
[32m[I 2022-04-18 03:03:35,914][0m Trial 606 finished with value: 0.7481568181577705 and parameters: {'n_hidden': 128, 'mixture_components': 9, 'use_sparse_layer': True, 'use_sparse_loss': False, 'use_batchnorm': False, 'use_dropout': True, 'dropout': 0.8308852703997184, 'mlp_size_1': 2, 'mlp_size_2': 2, 'mlp_size_3': 0, 'kernel': 'Exponential', 'loss_name': 'CensoredNLLLoss'}. Best is trial 526 with value: 0.7749738194021545.[0m
[32m[I 2022-04-18 03:06:26,673][0m Trial 607 finished with value: 0.7636996732559485 and parameters: {'n_hidden': 512, 'mixture_components': 3, 'use_sparse_layer': True, 'use_sparse_loss': False, 'use_batchnorm': False, 'use_dropout': True, 'dropout': 0.7933557641170212, 'mlp_size_1': 1, 'mlp_size_2': 4, 'mlp_size_3': 0, 'kernel': 'LogNormal', 'loss_name': 'CensoredNLLLoss'}. Best is trial 526 with value: 0.7749738194021545.[0m
[32m[I 2022-04-18 03:08:33,028][0m Trial 608 finished with value: 0.7709471513318155 and parameters: {'n_hidden': 256, 'mixture_components': 8, 'use_sparse_layer': True, 'use_sparse_loss': True, 'lmbd': 0.005086386235033254, 'use_batchnorm': False, 'use_dropout': True, 'dropout': 0.7646175318280776, 'mlp_size_1': 1, 'mlp_size_2': 4, 'mlp_size_3': 0, 'kernel': 'Exponential', 'loss_name': 'AlternativeNLLLoss'}. Best is trial 526 with value: 0.7749738194021545.[0m
[32m[I 2022-04-18 03:10:51,673][0m Trial 609 finished with value: 0.7684173982112326 and parameters: {'n_hidden': 256, 'mixture_components': 10, 'use_sparse_layer': True, 'use_sparse_loss': False, 'use_batchnorm': False, 'use_dropout': True, 'dropout': 0.817841082097007, 'mlp_size_1': 1, 'mlp_size_2': 4, 'mlp_size_3': 0, 'kernel': 'Exponential', 'loss_name': 'CensoredNLLLoss'}. Best is trial 526 with value: 0.7749738194021545.[0m
[32m[I 2022-04-18 03:13:12,365][0m Trial 610 finished with value: 0.7675720326272535 and parameters: {'n_hidden': 256, 'mixture_components': 9, 'use_sparse_layer': True, 'use_sparse_loss': False, 'use_batchnorm': False, 'use_dropout': True, 'dropout': 0.8469828227097157, 'mlp_size_1': 1, 'mlp_size_2': 4, 'mlp_size_3': 0, 'kernel': 'Exponential', 'loss_name': 'CensoredNLLLoss'}. Best is trial 526 with value: 0.7749738194021545.[0m
[32m[I 2022-04-18 03:15:41,691][0m Trial 611 finished with value: 0.7747323843993533 and parameters: {'n_hidden': 256, 'mixture_components': 10, 'use_sparse_layer': True, 'use_sparse_loss': False, 'use_batchnorm': False, 'use_dropout': True, 'dropout': 0.7473493865233412, 'mlp_size_1': 1, 'mlp_size_2': 4, 'mlp_size_3': 0, 'kernel': 'Exponential', 'loss_name': 'AlternativeNLLLoss'}. Best is trial 526 with value: 0.7749738194021545.[0m
[32m[I 2022-04-18 03:17:59,844][0m Trial 612 finished with value: 0.7693512977342554 and parameters: {'n_hidden': 256, 'mixture_components': 10, 'use_sparse_layer': True, 'use_sparse_loss': False, 'use_batchnorm': False, 'use_dropout': True, 'dropout': 0.7613924203013757, 'mlp_size_1': 1, 'mlp_size_2': 4, 'mlp_size_3': 0, 'kernel': 'Exponential', 'loss_name': 'AlternativeNLLLoss'}. Best is trial 526 with value: 0.7749738194021545.[0m
[32m[I 2022-04-18 03:20:12,310][0m Trial 613 finished with value: 0.7696601017752971 and parameters: {'n_hidden': 256, 'mixture_components': 10, 'use_sparse_layer': True, 'use_sparse_loss': False, 'use_batchnorm': False, 'use_dropout': True, 'dropout': 0.749435978072205, 'mlp_size_1': 1, 'mlp_size_2': 4, 'mlp_size_3': 0, 'kernel': 'Exponential', 'loss_name': 'AlternativeNLLLoss'}. Best is trial 526 with value: 0.7749738194021545.[0m
[32m[I 2022-04-18 03:22:46,611][0m Trial 614 finished with value: 0.7640970972204238 and parameters: {'n_hidden': 256, 'mixture_components': 9, 'use_sparse_layer': True, 'use_sparse_loss': False, 'use_batchnorm': False, 'use_dropout': True, 'dropout': 0.9339412697614621, 'mlp_size_1': 1, 'mlp_size_2': 4, 'mlp_size_3': 0, 'kernel': 'Exponential', 'loss_name': 'AlternativeNLLLoss'}. Best is trial 526 with value: 0.7749738194021545.[0m
[32m[I 2022-04-18 03:25:32,329][0m Trial 615 finished with value: 0.759339224312304 and parameters: {'n_hidden': 256, 'mixture_components': 10, 'use_sparse_layer': True, 'use_sparse_loss': False, 'use_batchnorm': False, 'use_dropout': True, 'dropout': 0.7360006300273134, 'mlp_size_1': 1, 'mlp_size_2': 4, 'mlp_size_3': 0, 'kernel': 'Logistic', 'loss_name': 'AlternativeNLLLoss'}. Best is trial 526 with value: 0.7749738194021545.[0m
[32m[I 2022-04-18 03:27:44,246][0m Trial 616 finished with value: 0.7717860265652504 and parameters: {'n_hidden': 256, 'mixture_components': 10, 'use_sparse_layer': True, 'use_sparse_loss': False, 'use_batchnorm': False, 'use_dropout': True, 'dropout': 0.7802159834436267, 'mlp_size_1': 1, 'mlp_size_2': 4, 'mlp_size_3': 0, 'kernel': 'Exponential', 'loss_name': 'AlternativeNLLLoss'}. Best is trial 526 with value: 0.7749738194021545.[0m
[32m[I 2022-04-18 03:30:24,808][0m Trial 617 finished with value: 0.7716486568052835 and parameters: {'n_hidden': 256, 'mixture_components': 10, 'use_sparse_layer': True, 'use_sparse_loss': True, 'lmbd': 0.00014953503209765622, 'use_batchnorm': False, 'use_dropout': True, 'dropout': 0.7458814164483457, 'mlp_size_1': 1, 'mlp_size_2': 4, 'mlp_size_3': 0, 'kernel': 'Exponential', 'loss_name': 'AlternativeNLLLoss'}. Best is trial 526 with value: 0.7749738194021545.[0m
[32m[I 2022-04-18 03:33:29,151][0m Trial 618 finished with value: 0.7625440440913621 and parameters: {'n_hidden': 256, 'mixture_components': 9, 'use_sparse_layer': True, 'use_sparse_loss': False, 'use_batchnorm': False, 'use_dropout': True, 'dropout': 0.7164524121812756, 'mlp_size_1': 1, 'mlp_size_2': 4, 'mlp_size_3': 0, 'kernel': 'Normal', 'loss_name': 'AlternativeNLLLoss'}. Best is trial 526 with value: 0.7749738194021545.[0m
[32m[I 2022-04-18 03:35:41,796][0m Trial 619 finished with value: 0.774275985575621 and parameters: {'n_hidden': 256, 'mixture_components': 10, 'use_sparse_layer': True, 'use_sparse_loss': False, 'use_batchnorm': False, 'use_dropout': True, 'dropout': 0.7537891660647622, 'mlp_size_1': 1, 'mlp_size_2': 4, 'mlp_size_3': 0, 'kernel': 'Exponential', 'loss_name': 'AlternativeNLLLoss'}. Best is trial 526 with value: 0.7749738194021545.[0m
[32m[I 2022-04-18 03:37:40,848][0m Trial 620 finished with value: 0.77271205357749 and parameters: {'n_hidden': 256, 'mixture_components': 9, 'use_sparse_layer': True, 'use_sparse_loss': False, 'use_batchnorm': False, 'use_dropout': True, 'dropout': 0.7648530056730318, 'mlp_size_1': 1, 'mlp_size_2': 4, 'mlp_size_3': 0, 'kernel': 'Exponential', 'loss_name': 'AlternativeNLLLoss'}. Best is trial 526 with value: 0.7749738194021545.[0m
[32m[I 2022-04-18 03:39:38,210][0m Trial 621 finished with value: 0.7675250878691701 and parameters: {'n_hidden': 256, 'mixture_components': 10, 'use_sparse_layer': True, 'use_sparse_loss': False, 'use_batchnorm': False, 'use_dropout': True, 'dropout': 0.7807680084818006, 'mlp_size_1': 1, 'mlp_size_2': 4, 'mlp_size_3': 0, 'kernel': 'Exponential', 'loss_name': 'AlternativeNLLLoss'}. Best is trial 526 with value: 0.7749738194021545.[0m
[32m[I 2022-04-18 03:42:45,944][0m Trial 622 finished with value: 0.7740161849839813 and parameters: {'n_hidden': 256, 'mixture_components': 10, 'use_sparse_layer': True, 'use_sparse_loss': False, 'use_batchnorm': True, 'use_dropout': True, 'dropout': 0.7529477483912922, 'mlp_size_1': 1, 'mlp_size_2': 4, 'mlp_size_3': 0, 'kernel': 'Exponential', 'loss_name': 'AlternativeNLLLoss'}. Best is trial 526 with value: 0.7749738194021545.[0m
[32m[I 2022-04-18 03:47:00,003][0m Trial 623 finished with value: 0.7124526736386272 and parameters: {'n_hidden': 256, 'mixture_components': 10, 'use_sparse_layer': True, 'use_sparse_loss': False, 'use_batchnorm': True, 'use_dropout': True, 'dropout': 0.7634794380788975, 'mlp_size_1': 1, 'mlp_size_2': 4, 'mlp_size_3': 0, 'kernel': 'LogLogistic', 'loss_name': 'AlternativeNLLLoss'}. Best is trial 526 with value: 0.7749738194021545.[0m
[32m[I 2022-04-18 03:49:10,528][0m Trial 624 finished with value: 0.7399207672532108 and parameters: {'n_hidden': 256, 'mixture_components': 8, 'use_sparse_layer': True, 'use_sparse_loss': False, 'use_batchnorm': True, 'use_dropout': True, 'dropout': 0.7432906421184007, 'mlp_size_1': 1, 'mlp_size_2': 4, 'mlp_size_3': 0, 'kernel': 'Gamma', 'loss_name': 'AlternativeNLLLoss'}. Best is trial 526 with value: 0.7749738194021545.[0m
[32m[I 2022-04-18 03:52:04,741][0m Trial 625 finished with value: 0.7704194145204144 and parameters: {'n_hidden': 256, 'mixture_components': 3, 'use_sparse_layer': True, 'use_sparse_loss': False, 'use_batchnorm': True, 'use_dropout': True, 'dropout': 0.7802290435516904, 'mlp_size_1': 1, 'mlp_size_2': 4, 'mlp_size_3': 0, 'kernel': 'Exponential', 'loss_name': 'AlternativeNLLLoss'}. Best is trial 526 with value: 0.7749738194021545.[0m
[32m[I 2022-04-18 03:55:05,098][0m Trial 626 finished with value: 0.7697594519372408 and parameters: {'n_hidden': 256, 'mixture_components': 9, 'use_sparse_layer': True, 'use_sparse_loss': False, 'use_batchnorm': True, 'use_dropout': True, 'dropout': 0.7555409633721971, 'mlp_size_1': 1, 'mlp_size_2': 4, 'mlp_size_3': 0, 'kernel': 'Exponential', 'loss_name': 'AlternativeNLLLoss'}. Best is trial 526 with value: 0.7749738194021545.[0m
