[32m[I 2022-04-15 05:23:08,579][0m Trial 455 finished with value: 0.6743624146605087 and parameters: {'loss': 'coxph', 'learning_rate': 0.00987929646195251, 'n_estimators': 162, 'criterion': 'friedman_mse', 'min_samples_split': 5, 'min_samples_leaf': 6, 'min_weight_fraction_leaf': 0.15936756245871192, 'min_impurity_decrease': 0.6833507225256832, 'max_features': 0.861282427239018, 'subsample': 0.5543702255089391, 'dropout_rate': 0.05670601230258788, 'ccp_alpha': 0.18755348082630385}. Best is trial 365 with value: 0.769790840194853.[0m
[32m[I 2022-04-15 05:23:21,885][0m Trial 456 finished with value: 0.5 and parameters: {'loss': 'coxph', 'learning_rate': 0.005656938535414215, 'n_estimators': 139, 'criterion': 'friedman_mse', 'min_samples_split': 4, 'min_samples_leaf': 6, 'min_weight_fraction_leaf': 0.14658410167317845, 'min_impurity_decrease': 0.6671467866274645, 'max_features': 0.8868804984297679, 'subsample': 0.5157967462041319, 'dropout_rate': 0.017855201031656547, 'ccp_alpha': 3.6900350182857573}. Best is trial 365 with value: 0.769790840194853.[0m
[32m[I 2022-04-15 05:23:40,182][0m Trial 457 finished with value: 0.7054205885101433 and parameters: {'loss': 'coxph', 'learning_rate': 0.007058258996568221, 'n_estimators': 174, 'criterion': 'friedman_mse', 'min_samples_split': 5, 'min_samples_leaf': 5, 'min_weight_fraction_leaf': 0.1641499775111006, 'min_impurity_decrease': 0.7039253073008601, 'max_features': 0.8780832019364272, 'subsample': 0.5842425130578589, 'dropout_rate': 0.037578229467918126, 'ccp_alpha': 0.10783746352029246}. Best is trial 365 with value: 0.769790840194853.[0m
[32m[I 2022-04-15 05:23:55,373][0m Trial 458 finished with value: 0.7684895789297349 and parameters: {'loss': 'coxph', 'learning_rate': 0.009639398444098198, 'n_estimators': 150, 'criterion': 'friedman_mse', 'min_samples_split': 4, 'min_samples_leaf': 6, 'min_weight_fraction_leaf': 0.1819120931212422, 'min_impurity_decrease': 0.6203211221316907, 'max_features': 0.8968596891863445, 'subsample': 0.5449143921328902, 'dropout_rate': 0.001864719239788197, 'ccp_alpha': 0.0019233128703065347}. Best is trial 365 with value: 0.769790840194853.[0m
[32m[I 2022-04-15 05:24:01,949][0m Trial 459 finished with value: 0.5 and parameters: {'loss': 'squared', 'learning_rate': 0.008946673165787827, 'n_estimators': 146, 'criterion': 'friedman_mse', 'min_samples_split': 4, 'min_samples_leaf': 6, 'min_weight_fraction_leaf': 0.17993963243705635, 'min_impurity_decrease': 0.609654962922394, 'max_features': 0.9304727529320825, 'subsample': 0.5183444208232239, 'dropout_rate': 0.015755993197785128, 'ccp_alpha': 4.800970067324257}. Best is trial 365 with value: 0.769790840194853.[0m
[32m[I 2022-04-15 05:24:19,949][0m Trial 460 finished with value: 0.5 and parameters: {'loss': 'coxph', 'learning_rate': 0.006836990376522361, 'n_estimators': 168, 'criterion': 'friedman_mse', 'min_samples_split': 4, 'min_samples_leaf': 6, 'min_weight_fraction_leaf': 0.15298414232785185, 'min_impurity_decrease': 0.6382858250851126, 'max_features': 0.8982649620184276, 'subsample': 0.49011699950687565, 'dropout_rate': 0.004017090121763033, 'ccp_alpha': 0.3098556776132635}. Best is trial 365 with value: 0.769790840194853.[0m
[32m[I 2022-04-15 05:24:33,288][0m Trial 461 finished with value: 0.6743624146605087 and parameters: {'loss': 'coxph', 'learning_rate': 0.010427502140568683, 'n_estimators': 161, 'criterion': 'friedman_mse', 'min_samples_split': 4, 'min_samples_leaf': 6, 'min_weight_fraction_leaf': 0.16974233631060376, 'min_impurity_decrease': 0.6265810022864715, 'max_features': 0.9173962154846338, 'subsample': 0.5403182768129536, 'dropout_rate': 0.37982603225277894, 'ccp_alpha': 0.17361186880226534}. Best is trial 365 with value: 0.769790840194853.[0m
[32m[I 2022-04-15 05:25:42,975][0m Trial 462 finished with value: 0.7663617518950874 and parameters: {'loss': 'coxph', 'learning_rate': 0.011800946520013088, 'n_estimators': 392, 'criterion': 'friedman_mse', 'min_samples_split': 4, 'min_samples_leaf': 6, 'min_weight_fraction_leaf': 0.18415869301445129, 'min_impurity_decrease': 0.6539554205048553, 'max_features': 0.9450640087616429, 'subsample': 0.5543151811622733, 'dropout_rate': 0.02235459202139637, 'ccp_alpha': 0.0016825553444544043}. Best is trial 365 with value: 0.769790840194853.[0m
[32m[I 2022-04-15 05:26:42,827][0m Trial 463 finished with value: 0.7110247523086549 and parameters: {'loss': 'coxph', 'learning_rate': 0.009011519275117709, 'n_estimators': 379, 'criterion': 'friedman_mse', 'min_samples_split': 4, 'min_samples_leaf': 6, 'min_weight_fraction_leaf': 0.1836511115814251, 'min_impurity_decrease': 0.6507113499050067, 'max_features': 0.9664047029908912, 'subsample': 0.5487506187050553, 'dropout_rate': 0.01852651478959682, 'ccp_alpha': 0.09937226936253614}. Best is trial 365 with value: 0.769790840194853.[0m
[32m[I 2022-04-15 05:26:58,896][0m Trial 464 finished with value: 0.767268710899627 and parameters: {'loss': 'coxph', 'learning_rate': 0.0044836427743527455, 'n_estimators': 157, 'criterion': 'friedman_mse', 'min_samples_split': 4, 'min_samples_leaf': 6, 'min_weight_fraction_leaf': 0.16185893258371395, 'min_impurity_decrease': 0.5875707167271358, 'max_features': 0.9393155041789214, 'subsample': 0.5661044902274159, 'dropout_rate': 0.003710633498732234, 'ccp_alpha': 0.0030566431255997675}. Best is trial 365 with value: 0.769790840194853.[0m
[32m[I 2022-04-15 05:28:06,721][0m Trial 465 finished with value: 0.5 and parameters: {'loss': 'coxph', 'learning_rate': 0.006033450375427944, 'n_estimators': 407, 'criterion': 'friedman_mse', 'min_samples_split': 4, 'min_samples_leaf': 6, 'min_weight_fraction_leaf': 0.17463372396579327, 'min_impurity_decrease': 0.589500128722708, 'max_features': 0.9359772499291764, 'subsample': 0.5737632245265647, 'dropout_rate': 0.00029816952322958903, 'ccp_alpha': 0.2528683741429065}. Best is trial 365 with value: 0.769790840194853.[0m
[32m[I 2022-04-15 05:29:07,007][0m Trial 466 finished with value: 0.5 and parameters: {'loss': 'coxph', 'learning_rate': 0.012678566892072436, 'n_estimators': 355, 'criterion': 'absolute_error', 'min_samples_split': 4, 'min_samples_leaf': 6, 'min_weight_fraction_leaf': 0.16279226634700594, 'min_impurity_decrease': 0.5982924154697896, 'max_features': 0.9585815998203613, 'subsample': 0.595206340212904, 'dropout_rate': 0.0014090625166955188, 'ccp_alpha': 0.10245921994819733}. Best is trial 365 with value: 0.769790840194853.[0m
[32m[I 2022-04-15 05:29:22,274][0m Trial 467 finished with value: 0.6743624146605087 and parameters: {'loss': 'coxph', 'learning_rate': 0.004547719844089702, 'n_estimators': 155, 'criterion': 'friedman_mse', 'min_samples_split': 4, 'min_samples_leaf': 6, 'min_weight_fraction_leaf': 0.1893985068139472, 'min_impurity_decrease': 0.5696338127645889, 'max_features': 0.9436414530703263, 'subsample': 0.5649174238196584, 'dropout_rate': 0.01951411532341069, 'ccp_alpha': 0.18714606357709396}. Best is trial 365 with value: 0.769790840194853.[0m
[32m[I 2022-04-15 05:29:35,496][0m Trial 468 finished with value: 0.6483439063587755 and parameters: {'loss': 'coxph', 'learning_rate': 0.01094355608607349, 'n_estimators': 146, 'criterion': 'friedman_mse', 'min_samples_split': 4, 'min_samples_leaf': 6, 'min_weight_fraction_leaf': 0.4584746959462256, 'min_impurity_decrease': 0.6204211145895008, 'max_features': 0.9918466925818336, 'subsample': 0.5952819007914809, 'dropout_rate': 0.026394945811989978, 'ccp_alpha': 0.002963152621071513}. Best is trial 365 with value: 0.769790840194853.[0m
[32m[I 2022-04-15 05:29:51,334][0m Trial 469 finished with value: 0.7171567308896117 and parameters: {'loss': 'coxph', 'learning_rate': 0.007610468951025023, 'n_estimators': 158, 'criterion': 'friedman_mse', 'min_samples_split': 4, 'min_samples_leaf': 6, 'min_weight_fraction_leaf': 0.17230365878722279, 'min_impurity_decrease': 0.6418156101541252, 'max_features': 0.9182368930200592, 'subsample': 0.5557211747177532, 'dropout_rate': 0.002423838081853788, 'ccp_alpha': 0.09916710331723008}. Best is trial 365 with value: 0.769790840194853.[0m
[32m[I 2022-04-15 05:30:05,939][0m Trial 470 finished with value: 0.5 and parameters: {'loss': 'coxph', 'learning_rate': 0.011531034780619247, 'n_estimators': 151, 'criterion': 'friedman_mse', 'min_samples_split': 4, 'min_samples_leaf': 6, 'min_weight_fraction_leaf': 0.18611363577201137, 'min_impurity_decrease': 0.6117062560950105, 'max_features': 0.954420166570973, 'subsample': 0.5772108575957292, 'dropout_rate': 0.03332046488935744, 'ccp_alpha': 0.3655554106080421}. Best is trial 365 with value: 0.769790840194853.[0m
[32m[I 2022-04-15 05:31:27,998][0m Trial 471 finished with value: 0.5 and parameters: {'loss': 'coxph', 'learning_rate': 0.013418674093032303, 'n_estimators': 455, 'criterion': 'friedman_mse', 'min_samples_split': 4, 'min_samples_leaf': 7, 'min_weight_fraction_leaf': 0.16268346603011152, 'min_impurity_decrease': 0.5897866763807604, 'max_features': 0.9085333908318548, 'subsample': 0.5377858129097309, 'dropout_rate': 0.017389677094804115, 'ccp_alpha': 0.24536056680053114}. Best is trial 365 with value: 0.769790840194853.[0m
[32m[I 2022-04-15 05:31:41,842][0m Trial 472 finished with value: 0.7341471235373834 and parameters: {'loss': 'coxph', 'learning_rate': 0.0038368966988080646, 'n_estimators': 141, 'criterion': 'friedman_mse', 'min_samples_split': 4, 'min_samples_leaf': 6, 'min_weight_fraction_leaf': 0.17808459400799587, 'min_impurity_decrease': 0.6659412246677392, 'max_features': 0.9389548845874798, 'subsample': 0.5626192071823755, 'dropout_rate': 0.041823027851861636, 'ccp_alpha': 0.08846343710832434}. Best is trial 365 with value: 0.769790840194853.[0m
[32m[I 2022-04-15 05:33:17,453][0m Trial 473 finished with value: 0.6743624146605087 and parameters: {'loss': 'coxph', 'learning_rate': 0.008199231598350863, 'n_estimators': 493, 'criterion': 'friedman_mse', 'min_samples_split': 4, 'min_samples_leaf': 6, 'min_weight_fraction_leaf': 0.1938153470357492, 'min_impurity_decrease': 0.5438468579917989, 'max_features': 0.8966248876410675, 'subsample': 0.587292194145242, 'dropout_rate': 0.020820948043029558, 'ccp_alpha': 0.17429422308817002}. Best is trial 365 with value: 0.769790840194853.[0m
[32m[I 2022-04-15 05:33:34,943][0m Trial 474 finished with value: 0.7675446504820087 and parameters: {'loss': 'coxph', 'learning_rate': 0.015192201349556842, 'n_estimators': 161, 'criterion': 'friedman_mse', 'min_samples_split': 4, 'min_samples_leaf': 6, 'min_weight_fraction_leaf': 0.1348195641199397, 'min_impurity_decrease': 0.6348953693672025, 'max_features': 0.8563210314923388, 'subsample': 0.5273597473157736, 'dropout_rate': 0.03737465477727635, 'ccp_alpha': 0.00451684139016513}. Best is trial 365 with value: 0.769790840194853.[0m
[32m[I 2022-04-15 05:34:26,610][0m Trial 475 finished with value: 0.7180652654696106 and parameters: {'loss': 'coxph', 'learning_rate': 0.014784591389676048, 'n_estimators': 341, 'criterion': 'friedman_mse', 'min_samples_split': 4, 'min_samples_leaf': 6, 'min_weight_fraction_leaf': 0.10711532354143546, 'min_impurity_decrease': 0.6288087358197764, 'max_features': 0.9769674665853466, 'subsample': 0.5147692119435628, 'dropout_rate': 0.0002455585230184739, 'ccp_alpha': 0.0894510781870676}. Best is trial 365 with value: 0.769790840194853.[0m
[32m[I 2022-04-15 05:35:31,771][0m Trial 476 finished with value: 0.6743624146605087 and parameters: {'loss': 'coxph', 'learning_rate': 0.015402571915753097, 'n_estimators': 398, 'criterion': 'friedman_mse', 'min_samples_split': 4, 'min_samples_leaf': 6, 'min_weight_fraction_leaf': 0.12877859275688117, 'min_impurity_decrease': 0.6223387076105201, 'max_features': 0.8473509756096466, 'subsample': 0.5277032079869571, 'dropout_rate': 0.05682772107847092, 'ccp_alpha': 0.162439145745241}. Best is trial 365 with value: 0.769790840194853.[0m
[32m[I 2022-04-15 05:35:39,635][0m Trial 477 finished with value: 0.5 and parameters: {'loss': 'squared', 'learning_rate': 0.012020148174181164, 'n_estimators': 167, 'criterion': 'squared_error', 'min_samples_split': 4, 'min_samples_leaf': 6, 'min_weight_fraction_leaf': 0.19919059819716803, 'min_impurity_decrease': 0.6539190911600475, 'max_features': 0.9242482591055594, 'subsample': 0.5018295089529621, 'dropout_rate': 0.04138640501774089, 'ccp_alpha': 0.2508507416620486}. Best is trial 365 with value: 0.769790840194853.[0m
[32m[I 2022-04-15 05:35:54,244][0m Trial 478 finished with value: 0.7261358679298999 and parameters: {'loss': 'coxph', 'learning_rate': 0.0003887795470617118, 'n_estimators': 152, 'criterion': 'friedman_mse', 'min_samples_split': 4, 'min_samples_leaf': 7, 'min_weight_fraction_leaf': 0.18296171899309524, 'min_impurity_decrease': 0.6052526692942112, 'max_features': 0.8565029119822696, 'subsample': 0.5342430938516509, 'dropout_rate': 0.0011597822848711387, 'ccp_alpha': 0.09659365855531896}. Best is trial 365 with value: 0.769790840194853.[0m
[32m[I 2022-04-15 05:36:11,360][0m Trial 479 finished with value: 0.7692066447109418 and parameters: {'loss': 'coxph', 'learning_rate': 0.010528195204824372, 'n_estimators': 163, 'criterion': 'friedman_mse', 'min_samples_split': 4, 'min_samples_leaf': 6, 'min_weight_fraction_leaf': 0.1954404279451356, 'min_impurity_decrease': 0.5646498180394232, 'max_features': 0.8148677018402325, 'subsample': 0.6006751795458547, 'dropout_rate': 0.03864991298516886, 'ccp_alpha': 0.006360166708608093}. Best is trial 365 with value: 0.769790840194853.[0m
[32m[I 2022-04-15 05:36:26,446][0m Trial 480 finished with value: 0.5 and parameters: {'loss': 'coxph', 'learning_rate': 0.01581670789743613, 'n_estimators': 163, 'criterion': 'friedman_mse', 'min_samples_split': 4, 'min_samples_leaf': 6, 'min_weight_fraction_leaf': 0.19156158010785174, 'min_impurity_decrease': 0.5687908048332098, 'max_features': 0.8217526330753261, 'subsample': 0.6024119041322686, 'dropout_rate': 0.06114679557665906, 'ccp_alpha': 1.5181031987902815}. Best is trial 365 with value: 0.769790840194853.[0m
[32m[I 2022-04-15 05:36:45,213][0m Trial 481 finished with value: 0.7722003312994449 and parameters: {'loss': 'coxph', 'learning_rate': 0.01247357016050584, 'n_estimators': 172, 'criterion': 'friedman_mse', 'min_samples_split': 4, 'min_samples_leaf': 6, 'min_weight_fraction_leaf': 0.11830115550165027, 'min_impurity_decrease': 0.5834180202768852, 'max_features': 0.7993578166655897, 'subsample': 0.6187990491281502, 'dropout_rate': 0.041256329631269364, 'ccp_alpha': 0.001536959261592221}. Best is trial 481 with value: 0.7722003312994449.[0m
[32m[I 2022-04-15 05:37:03,292][0m Trial 482 finished with value: 0.6743624146605087 and parameters: {'loss': 'coxph', 'learning_rate': 0.01096008155163043, 'n_estimators': 177, 'criterion': 'friedman_mse', 'min_samples_split': 4, 'min_samples_leaf': 6, 'min_weight_fraction_leaf': 0.11214102598636612, 'min_impurity_decrease': 0.5521709253291078, 'max_features': 0.8082117622919687, 'subsample': 0.625925979522743, 'dropout_rate': 0.03821420850813087, 'ccp_alpha': 0.16878638737280316}. Best is trial 481 with value: 0.7722003312994449.[0m
[32m[I 2022-04-15 05:38:49,710][0m Trial 483 finished with value: 0.7286074326155736 and parameters: {'loss': 'coxph', 'learning_rate': 0.010950575978719446, 'n_estimators': 535, 'criterion': 'friedman_mse', 'min_samples_split': 4, 'min_samples_leaf': 6, 'min_weight_fraction_leaf': 0.13627449862450694, 'min_impurity_decrease': 0.5346719813312446, 'max_features': 0.7996664747584799, 'subsample': 0.6110583967845066, 'dropout_rate': 0.06434931925319773, 'ccp_alpha': 0.09676410534426726}. Best is trial 481 with value: 0.7722003312994449.[0m
[32m[I 2022-04-15 05:39:34,473][0m Trial 484 finished with value: 0.5 and parameters: {'loss': 'coxph', 'learning_rate': 0.0013914868243518938, 'n_estimators': 325, 'criterion': 'friedman_mse', 'min_samples_split': 4, 'min_samples_leaf': 6, 'min_weight_fraction_leaf': 0.17558649398975862, 'min_impurity_decrease': 0.5772493380028788, 'max_features': 0.8090855703572117, 'subsample': 0.600739029006213, 'dropout_rate': 0.03461947880185, 'ccp_alpha': 0.33659541228264167}. Best is trial 481 with value: 0.7722003312994449.[0m
[32m[I 2022-04-15 05:39:52,576][0m Trial 485 finished with value: 0.7099225483701009 and parameters: {'loss': 'coxph', 'learning_rate': 0.0158981191713293, 'n_estimators': 173, 'criterion': 'friedman_mse', 'min_samples_split': 4, 'min_samples_leaf': 6, 'min_weight_fraction_leaf': 0.12120581417557819, 'min_impurity_decrease': 0.5567557443197088, 'max_features': 0.8415464000929636, 'subsample': 0.6136835343026666, 'dropout_rate': 0.03381335380781086, 'ccp_alpha': 0.09782813010107472}. Best is trial 481 with value: 0.7722003312994449.[0m
[32m[I 2022-04-15 05:40:34,354][0m Trial 486 finished with value: 0.5 and parameters: {'loss': 'coxph', 'learning_rate': 0.01983717145860098, 'n_estimators': 303, 'criterion': 'friedman_mse', 'min_samples_split': 4, 'min_samples_leaf': 7, 'min_weight_fraction_leaf': 0.16759959911757055, 'min_impurity_decrease': 0.5935739863970994, 'max_features': 0.8567350733953732, 'subsample': 0.6357699764031415, 'dropout_rate': 0.06900904039590466, 'ccp_alpha': 0.2324671744958809}. Best is trial 481 with value: 0.7722003312994449.[0m
[32m[I 2022-04-15 05:41:57,021][0m Trial 487 finished with value: 0.7667255760049472 and parameters: {'loss': 'coxph', 'learning_rate': 0.012242134739114962, 'n_estimators': 430, 'criterion': 'friedman_mse', 'min_samples_split': 4, 'min_samples_leaf': 6, 'min_weight_fraction_leaf': 0.18493709365715452, 'min_impurity_decrease': 0.5106933148932423, 'max_features': 0.7974372621618194, 'subsample': 0.5894127934282782, 'dropout_rate': 0.023130307852344094, 'ccp_alpha': 0.004712076177217016}. Best is trial 481 with value: 0.7722003312994449.[0m
[32m[I 2022-04-15 05:43:21,985][0m Trial 488 finished with value: 0.6743624146605087 and parameters: {'loss': 'coxph', 'learning_rate': 0.010086020327405819, 'n_estimators': 467, 'criterion': 'friedman_mse', 'min_samples_split': 4, 'min_samples_leaf': 6, 'min_weight_fraction_leaf': 0.0967403342391591, 'min_impurity_decrease': 0.48578642458882293, 'max_features': 0.7995104260145622, 'subsample': 0.6232697221186547, 'dropout_rate': 0.026070454600416414, 'ccp_alpha': 0.16049400266805947}. Best is trial 481 with value: 0.7722003312994449.[0m
[32m[I 2022-04-15 05:43:41,433][0m Trial 489 finished with value: 0.5 and parameters: {'loss': 'coxph', 'learning_rate': 0.005940856209746183, 'n_estimators': 162, 'criterion': 'absolute_error', 'min_samples_split': 4, 'min_samples_leaf': 6, 'min_weight_fraction_leaf': 0.18451437145232816, 'min_impurity_decrease': 0.5797646474511486, 'max_features': 0.8212520714767817, 'subsample': 0.5894607194636494, 'dropout_rate': 0.020166106081396934, 'ccp_alpha': 0.0027109269613716136}. Best is trial 481 with value: 0.7722003312994449.[0m
[32m[I 2022-04-15 05:44:54,927][0m Trial 490 finished with value: 0.7683477765217359 and parameters: {'loss': 'coxph', 'learning_rate': 0.012584048422580407, 'n_estimators': 415, 'criterion': 'friedman_mse', 'min_samples_split': 4, 'min_samples_leaf': 6, 'min_weight_fraction_leaf': 0.19707409378105686, 'min_impurity_decrease': 0.5361730085760149, 'max_features': 0.8297793755130475, 'subsample': 0.5881731886936024, 'dropout_rate': 0.04446051468868101, 'ccp_alpha': 0.0023911485755295633}. Best is trial 481 with value: 0.7722003312994449.[0m
[32m[I 2022-04-15 05:46:08,294][0m Trial 491 finished with value: 0.7240864152172563 and parameters: {'loss': 'coxph', 'learning_rate': 0.01205629823050097, 'n_estimators': 432, 'criterion': 'friedman_mse', 'min_samples_split': 4, 'min_samples_leaf': 6, 'min_weight_fraction_leaf': 0.19700658324254053, 'min_impurity_decrease': 0.4718925103419719, 'max_features': 0.8323818073727483, 'subsample': 0.6031250137748448, 'dropout_rate': 0.04710475707637649, 'ccp_alpha': 0.09621056207254729}. Best is trial 481 with value: 0.7722003312994449.[0m
[32m[I 2022-04-15 05:46:25,123][0m Trial 492 finished with value: 0.5 and parameters: {'loss': 'coxph', 'learning_rate': 0.013553498505869697, 'n_estimators': 171, 'criterion': 'friedman_mse', 'min_samples_split': 4, 'min_samples_leaf': 6, 'min_weight_fraction_leaf': 0.18141893954119548, 'min_impurity_decrease': 0.5148336936032918, 'max_features': 0.8662485188442208, 'subsample': 0.6326928168647209, 'dropout_rate': 0.0464597477000921, 'ccp_alpha': 0.2719807765045201}. Best is trial 481 with value: 0.7722003312994449.[0m
[32m[I 2022-04-15 05:46:41,587][0m Trial 493 finished with value: 0.6743624146605087 and parameters: {'loss': 'coxph', 'learning_rate': 0.009628785551830039, 'n_estimators': 161, 'criterion': 'friedman_mse', 'min_samples_split': 4, 'min_samples_leaf': 6, 'min_weight_fraction_leaf': 0.19597184641211207, 'min_impurity_decrease': 0.5324405216511635, 'max_features': 0.8418461254368692, 'subsample': 0.5775695517732695, 'dropout_rate': 0.061534221906673195, 'ccp_alpha': 0.15906996293056386}. Best is trial 481 with value: 0.7722003312994449.[0m
[32m[I 2022-04-15 05:47:35,337][0m Trial 494 finished with value: 0.7188509754473573 and parameters: {'loss': 'coxph', 'learning_rate': 0.013747706604996274, 'n_estimators': 357, 'criterion': 'friedman_mse', 'min_samples_split': 4, 'min_samples_leaf': 6, 'min_weight_fraction_leaf': 0.17070062601943248, 'min_impurity_decrease': 0.5108249056476911, 'max_features': 0.8068955078740949, 'subsample': 0.5775389027051794, 'dropout_rate': 0.036072780385904245, 'ccp_alpha': 0.09811138617046272}. Best is trial 481 with value: 0.7722003312994449.[0m
