[32m[I 2022-04-15 05:02:05,521][0m Trial 375 finished with value: 0.5 and parameters: {'loss': 'coxph', 'learning_rate': 0.019229439408779043, 'n_estimators': 288, 'criterion': 'friedman_mse', 'min_samples_split': 3, 'min_samples_leaf': 6, 'min_weight_fraction_leaf': 0.22036389719938737, 'min_impurity_decrease': 0.9903410669727829, 'max_features': 0.877392481320075, 'subsample': 0.8222955836355362, 'dropout_rate': 0.024611633020875774, 'ccp_alpha': 0.2722767699094802}. Best is trial 365 with value: 0.769790840194853.[0m
[32m[I 2022-04-15 05:02:21,301][0m Trial 376 finished with value: 0.6743624146605087 and parameters: {'loss': 'coxph', 'learning_rate': 0.01867356376701434, 'n_estimators': 156, 'criterion': 'friedman_mse', 'min_samples_split': 3, 'min_samples_leaf': 6, 'min_weight_fraction_leaf': 0.18757024988892665, 'min_impurity_decrease': 0.9968708281864893, 'max_features': 0.8351680514403959, 'subsample': 0.5491940739450645, 'dropout_rate': 0.019648373073067587, 'ccp_alpha': 0.16959105175309422}. Best is trial 365 with value: 0.769790840194853.[0m
[32m[I 2022-04-15 05:02:34,885][0m Trial 377 finished with value: 0.7159809981652892 and parameters: {'loss': 'coxph', 'learning_rate': 0.02610547594889946, 'n_estimators': 145, 'criterion': 'friedman_mse', 'min_samples_split': 3, 'min_samples_leaf': 6, 'min_weight_fraction_leaf': 0.23606175198616033, 'min_impurity_decrease': 0.9531020781057988, 'max_features': 0.8358732965226182, 'subsample': 0.5580668575219402, 'dropout_rate': 0.050230172444196634, 'ccp_alpha': 0.09332934741787238}. Best is trial 365 with value: 0.769790840194853.[0m
[32m[I 2022-04-15 05:02:52,312][0m Trial 378 finished with value: 0.7667866897409306 and parameters: {'loss': 'coxph', 'learning_rate': 0.01515266577203958, 'n_estimators': 161, 'criterion': 'friedman_mse', 'min_samples_split': 4, 'min_samples_leaf': 6, 'min_weight_fraction_leaf': 0.17638502139437273, 'min_impurity_decrease': 0.6572057899049263, 'max_features': 0.8451975252157039, 'subsample': 0.5390329954205404, 'dropout_rate': 0.03286701274238675, 'ccp_alpha': 0.0015839794670979973}. Best is trial 365 with value: 0.769790840194853.[0m
[32m[I 2022-04-15 05:03:09,123][0m Trial 379 finished with value: 0.7696394846965435 and parameters: {'loss': 'coxph', 'learning_rate': 0.015515024314394225, 'n_estimators': 161, 'criterion': 'friedman_mse', 'min_samples_split': 3, 'min_samples_leaf': 6, 'min_weight_fraction_leaf': 0.1731107409531667, 'min_impurity_decrease': 0.6575137609503897, 'max_features': 0.8466676378768992, 'subsample': 0.5740850335252924, 'dropout_rate': 0.016851413084772456, 'ccp_alpha': 0.0028678867997182925}. Best is trial 365 with value: 0.769790840194853.[0m
[32m[I 2022-04-15 05:03:25,739][0m Trial 380 finished with value: 0.5636982531485787 and parameters: {'loss': 'coxph', 'learning_rate': 0.015009779095508251, 'n_estimators': 161, 'criterion': 'friedman_mse', 'min_samples_split': 4, 'min_samples_leaf': 6, 'min_weight_fraction_leaf': 0.1679179986380472, 'min_impurity_decrease': 0.6058439015494855, 'max_features': 0.8622809080422306, 'subsample': 0.5739223512444015, 'dropout_rate': 0.03626520650378573, 'ccp_alpha': 0.201054713297751}. Best is trial 365 with value: 0.769790840194853.[0m
[32m[I 2022-04-15 05:03:43,363][0m Trial 381 finished with value: 0.7668072234412687 and parameters: {'loss': 'coxph', 'learning_rate': 0.017687281842406307, 'n_estimators': 162, 'criterion': 'friedman_mse', 'min_samples_split': 3, 'min_samples_leaf': 6, 'min_weight_fraction_leaf': 0.169656988922054, 'min_impurity_decrease': 0.6934300807331466, 'max_features': 0.8428904226668515, 'subsample': 0.5849231154277277, 'dropout_rate': 0.01663418524559048, 'ccp_alpha': 0.005025961481347193}. Best is trial 365 with value: 0.769790840194853.[0m
[32m[I 2022-04-15 05:04:00,478][0m Trial 382 finished with value: 0.7681166384997463 and parameters: {'loss': 'coxph', 'learning_rate': 0.010272908564094043, 'n_estimators': 160, 'criterion': 'friedman_mse', 'min_samples_split': 3, 'min_samples_leaf': 6, 'min_weight_fraction_leaf': 0.17846316226220588, 'min_impurity_decrease': 0.6613905184901586, 'max_features': 0.8454445865958876, 'subsample': 0.5820219490725919, 'dropout_rate': 0.0016175925309958941, 'ccp_alpha': 0.0017576946441499248}. Best is trial 365 with value: 0.769790840194853.[0m
[32m[I 2022-04-15 05:04:15,481][0m Trial 383 finished with value: 0.6743624146605087 and parameters: {'loss': 'coxph', 'learning_rate': 0.0073646336108352094, 'n_estimators': 157, 'criterion': 'friedman_mse', 'min_samples_split': 3, 'min_samples_leaf': 6, 'min_weight_fraction_leaf': 0.17694069835332837, 'min_impurity_decrease': 0.6677121545072748, 'max_features': 0.8433343860357184, 'subsample': 0.5905376665608439, 'dropout_rate': 0.0030231886022972997, 'ccp_alpha': 0.15313775612236297}. Best is trial 365 with value: 0.769790840194853.[0m
[32m[I 2022-04-15 05:04:28,031][0m Trial 384 finished with value: 0.5 and parameters: {'loss': 'coxph', 'learning_rate': 0.012364855481701895, 'n_estimators': 166, 'criterion': 'squared_error', 'min_samples_split': 3, 'min_samples_leaf': 6, 'min_weight_fraction_leaf': 0.16133151559910136, 'min_impurity_decrease': 0.6499674929393146, 'max_features': 0.8613267243010968, 'subsample': 0.614821917089042, 'dropout_rate': 0.46130739065782417, 'ccp_alpha': 0.2726691157893466}. Best is trial 365 with value: 0.769790840194853.[0m
[32m[I 2022-04-15 05:04:43,389][0m Trial 385 finished with value: 0.7674062117343934 and parameters: {'loss': 'coxph', 'learning_rate': 0.00912894329223804, 'n_estimators': 152, 'criterion': 'friedman_mse', 'min_samples_split': 3, 'min_samples_leaf': 6, 'min_weight_fraction_leaf': 0.17712134481168867, 'min_impurity_decrease': 0.6373706053888117, 'max_features': 0.8332161534894345, 'subsample': 0.589159086355663, 'dropout_rate': 0.01840401556570718, 'ccp_alpha': 0.0021142895550463375}. Best is trial 365 with value: 0.769790840194853.[0m
[32m[I 2022-04-15 05:04:57,847][0m Trial 386 finished with value: 0.6910664208706038 and parameters: {'loss': 'coxph', 'learning_rate': 0.012296815564081775, 'n_estimators': 154, 'criterion': 'friedman_mse', 'min_samples_split': 3, 'min_samples_leaf': 6, 'min_weight_fraction_leaf': 0.1991376043510089, 'min_impurity_decrease': 0.6289133426826246, 'max_features': 0.8265414798909401, 'subsample': 0.5917351451630216, 'dropout_rate': 0.013278904347755255, 'ccp_alpha': 0.10846517214651998}. Best is trial 365 with value: 0.769790840194853.[0m
[32m[I 2022-04-15 05:05:10,430][0m Trial 387 finished with value: 0.7177864455507157 and parameters: {'loss': 'coxph', 'learning_rate': 0.00859173198079883, 'n_estimators': 139, 'criterion': 'friedman_mse', 'min_samples_split': 3, 'min_samples_leaf': 6, 'min_weight_fraction_leaf': 0.18012441227529877, 'min_impurity_decrease': 0.6305313204535559, 'max_features': 0.8867199833759559, 'subsample': 0.6093114959388239, 'dropout_rate': 0.012604406916689723, 'ccp_alpha': 0.10293709060673524}. Best is trial 365 with value: 0.769790840194853.[0m
[32m[I 2022-04-15 05:05:24,477][0m Trial 388 finished with value: 0.5 and parameters: {'loss': 'coxph', 'learning_rate': 0.009464365793362614, 'n_estimators': 150, 'criterion': 'friedman_mse', 'min_samples_split': 3, 'min_samples_leaf': 6, 'min_weight_fraction_leaf': 0.1642798136105227, 'min_impurity_decrease': 0.6495577383029554, 'max_features': 0.8485372804970785, 'subsample': 0.5873790364773283, 'dropout_rate': 0.002422129144167902, 'ccp_alpha': 0.3674972610663554}. Best is trial 365 with value: 0.769790840194853.[0m
[32m[I 2022-04-15 05:05:40,308][0m Trial 389 finished with value: 0.6743624146605087 and parameters: {'loss': 'coxph', 'learning_rate': 0.01465633250396278, 'n_estimators': 163, 'criterion': 'friedman_mse', 'min_samples_split': 3, 'min_samples_leaf': 6, 'min_weight_fraction_leaf': 0.17685695400688833, 'min_impurity_decrease': 0.67900731008368, 'max_features': 0.901925555048104, 'subsample': 0.574637746133602, 'dropout_rate': 0.024575649123888443, 'ccp_alpha': 0.172786542420772}. Best is trial 365 with value: 0.769790840194853.[0m
[32m[I 2022-04-15 05:05:56,570][0m Trial 390 finished with value: 0.7665041221719193 and parameters: {'loss': 'coxph', 'learning_rate': 0.012812269696971818, 'n_estimators': 152, 'criterion': 'friedman_mse', 'min_samples_split': 3, 'min_samples_leaf': 6, 'min_weight_fraction_leaf': 0.1717293379754844, 'min_impurity_decrease': 0.6946291128652359, 'max_features': 0.8695043689683029, 'subsample': 0.6090946765648952, 'dropout_rate': 0.02465945432600084, 'ccp_alpha': 0.0021758258856908325}. Best is trial 365 with value: 0.769790840194853.[0m
[32m[I 2022-04-15 05:06:12,080][0m Trial 391 finished with value: 0.5301157883717103 and parameters: {'loss': 'coxph', 'learning_rate': 0.005593541523291261, 'n_estimators': 153, 'criterion': 'friedman_mse', 'min_samples_split': 3, 'min_samples_leaf': 6, 'min_weight_fraction_leaf': 0.15264903618072276, 'min_impurity_decrease': 0.6600749839367339, 'max_features': 0.8684645467090639, 'subsample': 0.6103826950413387, 'dropout_rate': 0.022134539115213542, 'ccp_alpha': 0.22440309838769756}. Best is trial 365 with value: 0.769790840194853.[0m
[32m[I 2022-04-15 05:06:27,764][0m Trial 392 finished with value: 0.7328709095294615 and parameters: {'loss': 'coxph', 'learning_rate': 0.010821701164484394, 'n_estimators': 161, 'criterion': 'friedman_mse', 'min_samples_split': 3, 'min_samples_leaf': 6, 'min_weight_fraction_leaf': 0.16974071239385363, 'min_impurity_decrease': 0.6936978915496052, 'max_features': 0.8393301543367662, 'subsample': 0.6159403059798669, 'dropout_rate': 0.031176021575726593, 'ccp_alpha': 0.07840646647577826}. Best is trial 365 with value: 0.769790840194853.[0m
[32m[I 2022-04-15 05:06:40,787][0m Trial 393 finished with value: 0.5 and parameters: {'loss': 'coxph', 'learning_rate': 0.015656854516283507, 'n_estimators': 142, 'criterion': 'friedman_mse', 'min_samples_split': 3, 'min_samples_leaf': 6, 'min_weight_fraction_leaf': 0.18902521628938476, 'min_impurity_decrease': 0.670556278983346, 'max_features': 0.8246293487738543, 'subsample': 0.5787319333185382, 'dropout_rate': 0.004362135431454597, 'ccp_alpha': 0.5608625533606032}. Best is trial 365 with value: 0.769790840194853.[0m
[32m[I 2022-04-15 05:06:54,419][0m Trial 394 finished with value: 0.7117393418856149 and parameters: {'loss': 'coxph', 'learning_rate': 0.014948585274019984, 'n_estimators': 150, 'criterion': 'friedman_mse', 'min_samples_split': 3, 'min_samples_leaf': 6, 'min_weight_fraction_leaf': 0.1584565681272231, 'min_impurity_decrease': 0.7024058742904701, 'max_features': 0.8735680095683294, 'subsample': 0.5955944618963591, 'dropout_rate': 0.0338367342849886, 'ccp_alpha': 0.0969487309983567}. Best is trial 365 with value: 0.769790840194853.[0m
[32m[I 2022-04-15 05:07:09,055][0m Trial 395 finished with value: 0.5 and parameters: {'loss': 'coxph', 'learning_rate': 0.01790708903742377, 'n_estimators': 159, 'criterion': 'friedman_mse', 'min_samples_split': 4, 'min_samples_leaf': 6, 'min_weight_fraction_leaf': 0.18058328938057952, 'min_impurity_decrease': 0.6429823033018789, 'max_features': 0.8931691296887038, 'subsample': 0.6219626029903464, 'dropout_rate': 0.001194959919204673, 'ccp_alpha': 0.24346539461934386}. Best is trial 365 with value: 0.769790840194853.[0m
[32m[I 2022-04-15 05:07:24,842][0m Trial 396 finished with value: 0.7211925668401291 and parameters: {'loss': 'coxph', 'learning_rate': 0.010719786372296097, 'n_estimators': 166, 'criterion': 'friedman_mse', 'min_samples_split': 3, 'min_samples_leaf': 6, 'min_weight_fraction_leaf': 0.14097323681223098, 'min_impurity_decrease': 0.6862452858243688, 'max_features': 0.8476910027810955, 'subsample': 0.5968504404946373, 'dropout_rate': 0.0005032793981533043, 'ccp_alpha': 0.09646615272068403}. Best is trial 365 with value: 0.769790840194853.[0m
[32m[I 2022-04-15 05:07:38,465][0m Trial 397 finished with value: 0.767993112055116 and parameters: {'loss': 'coxph', 'learning_rate': 0.02015129011546444, 'n_estimators': 145, 'criterion': 'friedman_mse', 'min_samples_split': 3, 'min_samples_leaf': 6, 'min_weight_fraction_leaf': 0.18896241214352374, 'min_impurity_decrease': 0.6520389260565637, 'max_features': 0.9153060237598575, 'subsample': 0.5679235629400989, 'dropout_rate': 0.026282657956759947, 'ccp_alpha': 0.007822620004759265}. Best is trial 365 with value: 0.769790840194853.[0m
[32m[I 2022-04-15 05:07:53,807][0m Trial 398 finished with value: 0.5 and parameters: {'loss': 'coxph', 'learning_rate': 0.019741739567531866, 'n_estimators': 139, 'criterion': 'absolute_error', 'min_samples_split': 3, 'min_samples_leaf': 6, 'min_weight_fraction_leaf': 0.1760194062177974, 'min_impurity_decrease': 0.6546102820898547, 'max_features': 0.9121649232178994, 'subsample': 0.5651958831875643, 'dropout_rate': 0.025465239544769414, 'ccp_alpha': 0.004046456457133236}. Best is trial 365 with value: 0.769790840194853.[0m
[32m[I 2022-04-15 05:08:07,596][0m Trial 399 finished with value: 0.6743624146605087 and parameters: {'loss': 'coxph', 'learning_rate': 0.009722445358742225, 'n_estimators': 150, 'criterion': 'friedman_mse', 'min_samples_split': 3, 'min_samples_leaf': 6, 'min_weight_fraction_leaf': 0.190068990657089, 'min_impurity_decrease': 0.6214683024040607, 'max_features': 0.8169799009564586, 'subsample': 0.5908612824996852, 'dropout_rate': 0.036066076009038356, 'ccp_alpha': 0.16875317394317507}. Best is trial 365 with value: 0.769790840194853.[0m
[32m[I 2022-04-15 05:08:20,764][0m Trial 400 finished with value: 0.7173392363562211 and parameters: {'loss': 'coxph', 'learning_rate': 0.014089676375984161, 'n_estimators': 143, 'criterion': 'friedman_mse', 'min_samples_split': 3, 'min_samples_leaf': 6, 'min_weight_fraction_leaf': 0.17286814814318982, 'min_impurity_decrease': 0.6752690429932802, 'max_features': 0.9363062265661115, 'subsample': 0.6137983097443047, 'dropout_rate': 0.019690228744710693, 'ccp_alpha': 0.09658598280663774}. Best is trial 365 with value: 0.769790840194853.[0m
[32m[I 2022-04-15 05:08:33,519][0m Trial 401 finished with value: 0.5 and parameters: {'loss': 'coxph', 'learning_rate': 0.007140892822932569, 'n_estimators': 135, 'criterion': 'friedman_mse', 'min_samples_split': 3, 'min_samples_leaf': 6, 'min_weight_fraction_leaf': 0.19256366934741875, 'min_impurity_decrease': 0.7004140103272312, 'max_features': 0.9732306455377777, 'subsample': 0.5716127396751731, 'dropout_rate': 0.04732731881681758, 'ccp_alpha': 0.31921758791637544}. Best is trial 365 with value: 0.769790840194853.[0m
[32m[I 2022-04-15 05:08:40,140][0m Trial 402 finished with value: 0.3256375853394913 and parameters: {'loss': 'squared', 'learning_rate': 0.020619756933483266, 'n_estimators': 146, 'criterion': 'friedman_mse', 'min_samples_split': 3, 'min_samples_leaf': 6, 'min_weight_fraction_leaf': 0.16233413910383632, 'min_impurity_decrease': 0.6400331260820243, 'max_features': 0.8676281093964506, 'subsample': 0.5808738160178559, 'dropout_rate': 0.017034020769427127, 'ccp_alpha': 0.18380889429637048}. Best is trial 365 with value: 0.769790840194853.[0m
[32m[I 2022-04-15 05:08:54,575][0m Trial 403 finished with value: 0.7245652112068219 and parameters: {'loss': 'coxph', 'learning_rate': 0.011993977143150694, 'n_estimators': 156, 'criterion': 'friedman_mse', 'min_samples_split': 3, 'min_samples_leaf': 6, 'min_weight_fraction_leaf': 0.1839555143871845, 'min_impurity_decrease': 0.6796594493074826, 'max_features': 0.8293193654323697, 'subsample': 0.603377497771667, 'dropout_rate': 0.04005354676735523, 'ccp_alpha': 0.09801479386647827}. Best is trial 365 with value: 0.769790840194853.[0m
[32m[I 2022-04-15 05:09:08,194][0m Trial 404 finished with value: 0.5 and parameters: {'loss': 'coxph', 'learning_rate': 0.017520835401802916, 'n_estimators': 152, 'criterion': 'friedman_mse', 'min_samples_split': 3, 'min_samples_leaf': 6, 'min_weight_fraction_leaf': 0.2307096089021255, 'min_impurity_decrease': 0.66547248225879, 'max_features': 0.8065570402759619, 'subsample': 0.5620564396231479, 'dropout_rate': 0.017907231509380048, 'ccp_alpha': 0.2438645240382434}. Best is trial 365 with value: 0.769790840194853.[0m
[32m[I 2022-04-15 05:09:24,038][0m Trial 405 finished with value: 0.7637755467218931 and parameters: {'loss': 'coxph', 'learning_rate': 0.013014012895573265, 'n_estimators': 161, 'criterion': 'friedman_mse', 'min_samples_split': 3, 'min_samples_leaf': 6, 'min_weight_fraction_leaf': 0.20500699106736062, 'min_impurity_decrease': 0.6228079110128399, 'max_features': 0.9194476589746956, 'subsample': 0.5892516647281466, 'dropout_rate': 0.04993651546060559, 'ccp_alpha': 0.0015412452964595632}. Best is trial 365 with value: 0.769790840194853.[0m
[32m[I 2022-04-15 05:09:38,987][0m Trial 406 finished with value: 0.7126442491542804 and parameters: {'loss': 'coxph', 'learning_rate': 0.013230910271440214, 'n_estimators': 161, 'criterion': 'friedman_mse', 'min_samples_split': 4, 'min_samples_leaf': 6, 'min_weight_fraction_leaf': 0.19972276139917428, 'min_impurity_decrease': 0.5992628554873445, 'max_features': 0.8909402812798128, 'subsample': 0.543814860873641, 'dropout_rate': 0.048473175472873775, 'ccp_alpha': 0.10725289498105334}. Best is trial 365 with value: 0.769790840194853.[0m
[32m[I 2022-04-15 05:09:52,340][0m Trial 407 finished with value: 0.7678615538517681 and parameters: {'loss': 'coxph', 'learning_rate': 0.016531740257848267, 'n_estimators': 144, 'criterion': 'friedman_mse', 'min_samples_split': 3, 'min_samples_leaf': 6, 'min_weight_fraction_leaf': 0.2054466089188351, 'min_impurity_decrease': 0.6151848392353189, 'max_features': 0.9307721735834651, 'subsample': 0.5634470597639614, 'dropout_rate': 0.027908339717096702, 'ccp_alpha': 0.002946794070393341}. Best is trial 365 with value: 0.769790840194853.[0m
[32m[I 2022-04-15 05:10:04,326][0m Trial 408 finished with value: 0.5 and parameters: {'loss': 'coxph', 'learning_rate': 0.01507523825434387, 'n_estimators': 137, 'criterion': 'squared_error', 'min_samples_split': 3, 'min_samples_leaf': 6, 'min_weight_fraction_leaf': 0.20426244570827187, 'min_impurity_decrease': 0.6136688808900399, 'max_features': 0.918047182841068, 'subsample': 0.5610286655261627, 'dropout_rate': 0.023702948028478818, 'ccp_alpha': 0.0020526113294573557}. Best is trial 365 with value: 0.769790840194853.[0m
[32m[I 2022-04-15 05:10:16,971][0m Trial 409 finished with value: 0.6743624146605087 and parameters: {'loss': 'coxph', 'learning_rate': 0.022173671927305356, 'n_estimators': 142, 'criterion': 'friedman_mse', 'min_samples_split': 3, 'min_samples_leaf': 6, 'min_weight_fraction_leaf': 0.21245722685370086, 'min_impurity_decrease': 0.5973777069165956, 'max_features': 0.9159728746079251, 'subsample': 0.5401813999156215, 'dropout_rate': 0.03342184601008624, 'ccp_alpha': 0.17540322135921718}. Best is trial 365 with value: 0.769790840194853.[0m
[32m[I 2022-04-15 05:10:29,939][0m Trial 410 finished with value: 0.5 and parameters: {'loss': 'coxph', 'learning_rate': 0.012828987377350777, 'n_estimators': 147, 'criterion': 'friedman_mse', 'min_samples_split': 3, 'min_samples_leaf': 6, 'min_weight_fraction_leaf': 0.19250912892968408, 'min_impurity_decrease': 0.6330567364154353, 'max_features': 0.9324262141929781, 'subsample': 0.5745693828153153, 'dropout_rate': 0.0028315103356175587, 'ccp_alpha': 0.45640265502846283}. Best is trial 365 with value: 0.769790840194853.[0m
[32m[I 2022-04-15 05:10:45,258][0m Trial 411 finished with value: 0.7650481275852272 and parameters: {'loss': 'coxph', 'learning_rate': 0.008425213934907907, 'n_estimators': 155, 'criterion': 'friedman_mse', 'min_samples_split': 3, 'min_samples_leaf': 6, 'min_weight_fraction_leaf': 0.22502840215363054, 'min_impurity_decrease': 0.6446845056848474, 'max_features': 0.9626783257086687, 'subsample': 0.518129163968695, 'dropout_rate': 0.0002502524105920563, 'ccp_alpha': 0.001572640918310826}. Best is trial 365 with value: 0.769790840194853.[0m
[32m[I 2022-04-15 05:11:01,617][0m Trial 412 finished with value: 0.7192579243560455 and parameters: {'loss': 'coxph', 'learning_rate': 0.006496799581783649, 'n_estimators': 156, 'criterion': 'friedman_mse', 'min_samples_split': 3, 'min_samples_leaf': 6, 'min_weight_fraction_leaf': 0.22256854591963765, 'min_impurity_decrease': 0.642281912903453, 'max_features': 0.9774907028702974, 'subsample': 0.5011395395311714, 'dropout_rate': 0.000798807214047334, 'ccp_alpha': 0.09389802352092327}. Best is trial 365 with value: 0.769790840194853.[0m
[32m[I 2022-04-15 05:11:15,065][0m Trial 413 finished with value: 0.5 and parameters: {'loss': 'coxph', 'learning_rate': 0.008726763925908078, 'n_estimators': 149, 'criterion': 'friedman_mse', 'min_samples_split': 3, 'min_samples_leaf': 6, 'min_weight_fraction_leaf': 0.23785387502633074, 'min_impurity_decrease': 0.6184154783167357, 'max_features': 0.9486054969548133, 'subsample': 0.5196104675232386, 'dropout_rate': 0.02003280538912214, 'ccp_alpha': 0.27048203200166077}. Best is trial 365 with value: 0.769790840194853.[0m
[32m[I 2022-04-15 05:11:28,087][0m Trial 414 finished with value: 0.7557258991469757 and parameters: {'loss': 'coxph', 'learning_rate': 0.009485548977728677, 'n_estimators': 135, 'criterion': 'friedman_mse', 'min_samples_split': 3, 'min_samples_leaf': 6, 'min_weight_fraction_leaf': 0.21279603560457486, 'min_impurity_decrease': 0.5746051409137216, 'max_features': 0.9646805546072484, 'subsample': 0.5590957337236424, 'dropout_rate': 0.001010769819806863, 'ccp_alpha': 0.0018875162355406633}. Best is trial 365 with value: 0.769790840194853.[0m
