[32m[I 2022-04-13 14:05:23,142][0m Trial 84 finished with value: 0.25 and parameters: {'loss': 'coxph', 'learning_rate': 0.0001827205698076943, 'n_estimators': 251, 'criterion': 'friedman_mse', 'min_samples_split': 7, 'min_samples_leaf': 5, 'min_weight_fraction_leaf': 0.24698508713780146, 'min_impurity_decrease': 0.8676864118566554, 'max_features': 0.018510611037371595, 'subsample': 0.6435756810214182, 'dropout_rate': 0.3033204968248087, 'ccp_alpha': 4.555034177382462}. Best is trial 4 with value: 0.25.[0m
[32m[I 2022-04-13 14:06:37,798][0m Trial 85 finished with value: 0.25 and parameters: {'loss': 'coxph', 'learning_rate': 8.326409263491662e-05, 'n_estimators': 298, 'criterion': 'friedman_mse', 'min_samples_split': 7, 'min_samples_leaf': 6, 'min_weight_fraction_leaf': 0.2699127411664032, 'min_impurity_decrease': 0.8470109291432644, 'max_features': 0.044286863114467334, 'subsample': 0.4368749274435449, 'dropout_rate': 0.36240495255567146, 'ccp_alpha': 4.457722040574003}. Best is trial 4 with value: 0.25.[0m
[32m[I 2022-04-13 14:07:36,091][0m Trial 86 finished with value: -0.25 and parameters: {'loss': 'squared', 'learning_rate': 0.00014112591764478568, 'n_estimators': 357, 'criterion': 'friedman_mse', 'min_samples_split': 7, 'min_samples_leaf': 5, 'min_weight_fraction_leaf': 0.16087816406361463, 'min_impurity_decrease': 0.25912997144202315, 'max_features': 0.8822667133307518, 'subsample': 0.5871793205614898, 'dropout_rate': 0.48824782875180384, 'ccp_alpha': 4.5681409016749}. Best is trial 4 with value: 0.25.[0m
[32m[I 2022-04-13 14:08:05,278][0m Trial 87 finished with value: 0.25 and parameters: {'loss': 'coxph', 'learning_rate': 0.019015256523659426, 'n_estimators': 144, 'criterion': 'absolute_error', 'min_samples_split': 2, 'min_samples_leaf': 8, 'min_weight_fraction_leaf': 0.028569077376718655, 'min_impurity_decrease': 0.6798424173190807, 'max_features': 0.45284920574512016, 'subsample': 0.16214535368702326, 'dropout_rate': 0.18883584238689416, 'ccp_alpha': 2.2741287424308743}. Best is trial 4 with value: 0.25.[0m
[32m[I 2022-04-13 14:09:03,282][0m Trial 88 finished with value: 0.25 and parameters: {'loss': 'coxph', 'learning_rate': 2.8304572246385455e-05, 'n_estimators': 264, 'criterion': 'friedman_mse', 'min_samples_split': 7, 'min_samples_leaf': 5, 'min_weight_fraction_leaf': 0.4291391226505884, 'min_impurity_decrease': 0.29362604831601935, 'max_features': 0.5388801070643175, 'subsample': 0.6288221031329877, 'dropout_rate': 0.5733748165420107, 'ccp_alpha': 4.945925542074425}. Best is trial 4 with value: 0.25.[0m
[32m[I 2022-04-13 14:10:30,912][0m Trial 89 finished with value: 0.25 and parameters: {'loss': 'coxph', 'learning_rate': 0.00019705955517891112, 'n_estimators': 314, 'criterion': 'friedman_mse', 'min_samples_split': 7, 'min_samples_leaf': 4, 'min_weight_fraction_leaf': 0.394525049674357, 'min_impurity_decrease': 0.2169749633036647, 'max_features': 0.005807605960062679, 'subsample': 0.5998181518121994, 'dropout_rate': 0.33208492721155125, 'ccp_alpha': 4.6827307587684475}. Best is trial 4 with value: 0.25.[0m
[32m[I 2022-04-13 14:11:17,937][0m Trial 90 finished with value: 0.25 and parameters: {'loss': 'coxph', 'learning_rate': 3.7961982846421347e-06, 'n_estimators': 236, 'criterion': 'friedman_mse', 'min_samples_split': 6, 'min_samples_leaf': 3, 'min_weight_fraction_leaf': 0.469133841190542, 'min_impurity_decrease': 0.11092921761626429, 'max_features': 0.8142995812820938, 'subsample': 0.3246952522149983, 'dropout_rate': 0.6212897813001127, 'ccp_alpha': 4.224394043988326}. Best is trial 4 with value: 0.25.[0m
[32m[I 2022-04-13 14:12:28,340][0m Trial 91 finished with value: 0.25 and parameters: {'loss': 'coxph', 'learning_rate': 1.7641818368033042e-06, 'n_estimators': 286, 'criterion': 'friedman_mse', 'min_samples_split': 6, 'min_samples_leaf': 4, 'min_weight_fraction_leaf': 0.4625808218248001, 'min_impurity_decrease': 0.12664740838752095, 'max_features': 0.19298298146684295, 'subsample': 0.2282741759819077, 'dropout_rate': 0.6560076489415955, 'ccp_alpha': 4.9875037688112585}. Best is trial 4 with value: 0.25.[0m
[32m[I 2022-04-13 14:13:28,559][0m Trial 92 finished with value: 0.25 and parameters: {'loss': 'coxph', 'learning_rate': 1.9711832052368247e-06, 'n_estimators': 274, 'criterion': 'friedman_mse', 'min_samples_split': 6, 'min_samples_leaf': 5, 'min_weight_fraction_leaf': 0.49939861812624714, 'min_impurity_decrease': 0.39181981839073987, 'max_features': 0.2206342787637803, 'subsample': 0.4318697076945142, 'dropout_rate': 0.4771452801575762, 'ccp_alpha': 3.6462431118012977}. Best is trial 4 with value: 0.25.[0m
[32m[I 2022-04-13 14:14:22,812][0m Trial 93 finished with value: 0.25 and parameters: {'loss': 'coxph', 'learning_rate': 1.5583491075663067e-06, 'n_estimators': 210, 'criterion': 'friedman_mse', 'min_samples_split': 6, 'min_samples_leaf': 3, 'min_weight_fraction_leaf': 0.44869720681613595, 'min_impurity_decrease': 0.6171378681951298, 'max_features': 0.2889094176551521, 'subsample': 0.27192706504157527, 'dropout_rate': 0.39168221636839273, 'ccp_alpha': 4.007958533089504}. Best is trial 4 with value: 0.25.[0m
[32m[I 2022-04-13 14:15:10,728][0m Trial 94 finished with value: 0.25 and parameters: {'loss': 'coxph', 'learning_rate': 1.257699650385044e-06, 'n_estimators': 250, 'criterion': 'friedman_mse', 'min_samples_split': 6, 'min_samples_leaf': 6, 'min_weight_fraction_leaf': 0.07515516273935337, 'min_impurity_decrease': 0.7089428608674299, 'max_features': 0.10401709180546187, 'subsample': 0.46130208189072586, 'dropout_rate': 0.6557699496511418, 'ccp_alpha': 4.097096566713933}. Best is trial 4 with value: 0.25.[0m
[32m[I 2022-04-13 14:17:41,796][0m Trial 95 finished with value: 0.25 and parameters: {'loss': 'coxph', 'learning_rate': 1.933446748671461e-05, 'n_estimators': 528, 'criterion': 'friedman_mse', 'min_samples_split': 6, 'min_samples_leaf': 2, 'min_weight_fraction_leaf': 0.30509121191475264, 'min_impurity_decrease': 0.9199061819117382, 'max_features': 0.2101061079892534, 'subsample': 0.7245389686620324, 'dropout_rate': 0.5963670919199493, 'ccp_alpha': 2.0455707009596944}. Best is trial 4 with value: 0.25.[0m
[32m[I 2022-04-13 14:22:41,231][0m Trial 96 finished with value: 0.25 and parameters: {'loss': 'coxph', 'learning_rate': 1.0865981903745275e-05, 'n_estimators': 842, 'criterion': 'friedman_mse', 'min_samples_split': 6, 'min_samples_leaf': 3, 'min_weight_fraction_leaf': 0.4286344576125044, 'min_impurity_decrease': 0.8146032764684616, 'max_features': 0.37641734157085155, 'subsample': 0.516002148849907, 'dropout_rate': 0.698314273001137, 'ccp_alpha': 3.874599154615381}. Best is trial 4 with value: 0.25.[0m
[32m[I 2022-04-13 14:25:54,181][0m Trial 97 finished with value: 0.25 and parameters: {'loss': 'coxph', 'learning_rate': 0.00607322367323916, 'n_estimators': 663, 'criterion': 'friedman_mse', 'min_samples_split': 9, 'min_samples_leaf': 2, 'min_weight_fraction_leaf': 0.047528591128411284, 'min_impurity_decrease': 0.5085842799683333, 'max_features': 0.7339649042781322, 'subsample': 0.9018086308218636, 'dropout_rate': 0.7176315207509041, 'ccp_alpha': 3.5066435863809917}. Best is trial 4 with value: 0.25.[0m
[32m[I 2022-04-13 14:30:57,735][0m Trial 98 finished with value: 0.25 and parameters: {'loss': 'coxph', 'learning_rate': 1.007992986462967e-06, 'n_estimators': 793, 'criterion': 'friedman_mse', 'min_samples_split': 8, 'min_samples_leaf': 2, 'min_weight_fraction_leaf': 0.06478412715245471, 'min_impurity_decrease': 0.3362730161824692, 'max_features': 0.7620555480928595, 'subsample': 0.2915209839027221, 'dropout_rate': 0.6091910787659084, 'ccp_alpha': 4.8327184809307475}. Best is trial 4 with value: 0.25.[0m
[32m[I 2022-04-13 14:31:19,857][0m Trial 99 finished with value: -0.25 and parameters: {'loss': 'squared', 'learning_rate': 2.7572137967095016e-06, 'n_estimators': 175, 'criterion': 'absolute_error', 'min_samples_split': 9, 'min_samples_leaf': 1, 'min_weight_fraction_leaf': 0.4366971199514556, 'min_impurity_decrease': 0.41956743097362514, 'max_features': 0.7997826925280753, 'subsample': 0.8491319138054918, 'dropout_rate': 0.7600922852656807, 'ccp_alpha': 3.1980683958719425}. Best is trial 4 with value: 0.25.[0m
[32m[I 2022-04-13 14:33:18,632][0m Trial 100 finished with value: 0.25 and parameters: {'loss': 'coxph', 'learning_rate': 0.00011385667580421982, 'n_estimators': 349, 'criterion': 'friedman_mse', 'min_samples_split': 3, 'min_samples_leaf': 5, 'min_weight_fraction_leaf': 0.3466580417573927, 'min_impurity_decrease': 0.2925659051989933, 'max_features': 0.9001383835350913, 'subsample': 0.6758022149243761, 'dropout_rate': 0.26972647693668744, 'ccp_alpha': 1.034838706888521}. Best is trial 4 with value: 0.25.[0m
[32m[I 2022-04-13 14:34:48,785][0m Trial 101 finished with value: 0.25 and parameters: {'loss': 'coxph', 'learning_rate': 6.006061384968074e-05, 'n_estimators': 356, 'criterion': 'friedman_mse', 'min_samples_split': 3, 'min_samples_leaf': 5, 'min_weight_fraction_leaf': 0.34362635611775416, 'min_impurity_decrease': 0.2987209242658818, 'max_features': 0.5328572704538727, 'subsample': 0.4038679403334093, 'dropout_rate': 0.5107456259508886, 'ccp_alpha': 4.43336147889688}. Best is trial 4 with value: 0.25.[0m
[32m[I 2022-04-13 14:36:28,092][0m Trial 102 finished with value: 0.25 and parameters: {'loss': 'coxph', 'learning_rate': 7.828514999729718e-05, 'n_estimators': 376, 'criterion': 'friedman_mse', 'min_samples_split': 7, 'min_samples_leaf': 4, 'min_weight_fraction_leaf': 0.47578542381602734, 'min_impurity_decrease': 0.24535213640613301, 'max_features': 0.04836125658434125, 'subsample': 0.3959016075144213, 'dropout_rate': 0.508770242887444, 'ccp_alpha': 4.319796459924601}. Best is trial 4 with value: 0.25.[0m
[32m[I 2022-04-13 14:36:51,818][0m Trial 103 finished with value: 0.25 and parameters: {'loss': 'coxph', 'learning_rate': 0.05216019752511782, 'n_estimators': 117, 'criterion': 'squared_error', 'min_samples_split': 10, 'min_samples_leaf': 1, 'min_weight_fraction_leaf': 0.14552880631381507, 'min_impurity_decrease': 0.5285206371103925, 'max_features': 0.25515448314812084, 'subsample': 0.9526609114244806, 'dropout_rate': 0.03411981305389515, 'ccp_alpha': 3.176458654137252}. Best is trial 4 with value: 0.25.[0m
[32m[I 2022-04-13 14:37:24,084][0m Trial 104 finished with value: 0.25 and parameters: {'loss': 'coxph', 'learning_rate': 0.06361301138379194, 'n_estimators': 139, 'criterion': 'squared_error', 'min_samples_split': 10, 'min_samples_leaf': 1, 'min_weight_fraction_leaf': 0.11606362212087112, 'min_impurity_decrease': 0.45452303519318593, 'max_features': 0.31563337845096845, 'subsample': 0.9704454933404028, 'dropout_rate': 0.15054829868583647, 'ccp_alpha': 3.0580779890310326}. Best is trial 4 with value: 0.25.[0m
[32m[I 2022-04-13 14:42:01,796][0m Trial 105 finished with value: 0.25 and parameters: {'loss': 'coxph', 'learning_rate': 5.3201923237748485e-06, 'n_estimators': 596, 'criterion': 'squared_error', 'min_samples_split': 10, 'min_samples_leaf': 1, 'min_weight_fraction_leaf': 0.48887877841089117, 'min_impurity_decrease': 0.492583415893971, 'max_features': 0.15486005683014323, 'subsample': 0.5133048570360876, 'dropout_rate': 0.11980980409017222, 'ccp_alpha': 2.7557673792775828}. Best is trial 4 with value: 0.25.[0m
[32m[I 2022-04-13 14:42:27,559][0m Trial 106 finished with value: 0.25 and parameters: {'loss': 'coxph', 'learning_rate': 0.0710081305418126, 'n_estimators': 129, 'criterion': 'squared_error', 'min_samples_split': 5, 'min_samples_leaf': 1, 'min_weight_fraction_leaf': 0.2032164921697484, 'min_impurity_decrease': 0.6073481135066126, 'max_features': 0.26862889891580927, 'subsample': 0.8892743000122477, 'dropout_rate': 0.14934591623016444, 'ccp_alpha': 2.954495730553542}. Best is trial 4 with value: 0.25.[0m
[32m[I 2022-04-13 14:42:47,212][0m Trial 107 finished with value: 0.25 and parameters: {'loss': 'coxph', 'learning_rate': 8.278641266298903e-06, 'n_estimators': 105, 'criterion': 'squared_error', 'min_samples_split': 5, 'min_samples_leaf': 1, 'min_weight_fraction_leaf': 0.1284899725532994, 'min_impurity_decrease': 0.5445080667245047, 'max_features': 0.9676769826477514, 'subsample': 0.9615237427135606, 'dropout_rate': 0.06242969409122118, 'ccp_alpha': 2.6861991616880174}. Best is trial 4 with value: 0.25.[0m
[32m[I 2022-04-13 14:45:56,691][0m Trial 108 finished with value: 0.25 and parameters: {'loss': 'coxph', 'learning_rate': 5.957273994787341e-06, 'n_estimators': 502, 'criterion': 'squared_error', 'min_samples_split': 5, 'min_samples_leaf': 1, 'min_weight_fraction_leaf': 0.17160757920953196, 'min_impurity_decrease': 0.026037796138190416, 'max_features': 0.9329879408827322, 'subsample': 0.9160786731458843, 'dropout_rate': 0.16262443679213995, 'ccp_alpha': 2.772960794327787}. Best is trial 4 with value: 0.25.[0m
[32m[I 2022-04-13 14:48:48,806][0m Trial 109 finished with value: 0.25 and parameters: {'loss': 'coxph', 'learning_rate': 1.2053150781169446e-05, 'n_estimators': 458, 'criterion': 'squared_error', 'min_samples_split': 4, 'min_samples_leaf': 8, 'min_weight_fraction_leaf': 0.2850417241611088, 'min_impurity_decrease': 0.04543946882947122, 'max_features': 0.9568146754977848, 'subsample': 0.4863854338265142, 'dropout_rate': 0.22926961305086097, 'ccp_alpha': 2.6099297570663236}. Best is trial 4 with value: 0.25.[0m
[32m[I 2022-04-13 14:52:41,769][0m Trial 110 finished with value: 0.25 and parameters: {'loss': 'coxph', 'learning_rate': 0.0003395452880719101, 'n_estimators': 472, 'criterion': 'absolute_error', 'min_samples_split': 4, 'min_samples_leaf': 9, 'min_weight_fraction_leaf': 0.2723769728518183, 'min_impurity_decrease': 0.023911081632598346, 'max_features': 0.9950138093102504, 'subsample': 0.36557585103750645, 'dropout_rate': 0.10544732533309462, 'ccp_alpha': 1.448309100923452}. Best is trial 4 with value: 0.25.[0m
[32m[I 2022-04-13 14:54:51,475][0m Trial 111 finished with value: 0.25 and parameters: {'loss': 'coxph', 'learning_rate': 0.00045489256323597406, 'n_estimators': 636, 'criterion': 'absolute_error', 'min_samples_split': 5, 'min_samples_leaf': 1, 'min_weight_fraction_leaf': 0.2175852287069837, 'min_impurity_decrease': 0.47881520124015703, 'max_features': 0.8365014199535723, 'subsample': 0.3304826692767969, 'dropout_rate': 0.9287834213366466, 'ccp_alpha': 1.4845984041984586}. Best is trial 4 with value: 0.25.[0m
[32m[I 2022-04-13 14:57:06,094][0m Trial 112 finished with value: 0.25 and parameters: {'loss': 'coxph', 'learning_rate': 0.0015525404414285468, 'n_estimators': 712, 'criterion': 'absolute_error', 'min_samples_split': 5, 'min_samples_leaf': 8, 'min_weight_fraction_leaf': 0.15382440417897772, 'min_impurity_decrease': 0.4464704413378304, 'max_features': 0.9506241986226844, 'subsample': 0.3750421058131068, 'dropout_rate': 0.9674106147563193, 'ccp_alpha': 2.5807658462002565}. Best is trial 4 with value: 0.25.[0m
[32m[I 2022-04-13 14:58:26,546][0m Trial 113 finished with value: 0.25 and parameters: {'loss': 'coxph', 'learning_rate': 0.0007697261860075827, 'n_estimators': 437, 'criterion': 'absolute_error', 'min_samples_split': 3, 'min_samples_leaf': 7, 'min_weight_fraction_leaf': 0.08272731457966986, 'min_impurity_decrease': 0.35227960516886386, 'max_features': 0.6173535158897101, 'subsample': 0.3476214675344085, 'dropout_rate': 0.8888765813763774, 'ccp_alpha': 1.894030608619429}. Best is trial 4 with value: 0.25.[0m
[32m[I 2022-04-13 15:01:04,112][0m Trial 114 finished with value: 0.25 and parameters: {'loss': 'coxph', 'learning_rate': 0.0011246178606517732, 'n_estimators': 393, 'criterion': 'absolute_error', 'min_samples_split': 4, 'min_samples_leaf': 8, 'min_weight_fraction_leaf': 0.10281443007901947, 'min_impurity_decrease': 0.19368732650520565, 'max_features': 0.5726320783287504, 'subsample': 0.541243150401323, 'dropout_rate': 0.058068843230036235, 'ccp_alpha': 1.467976442685138}. Best is trial 4 with value: 0.25.[0m
[32m[I 2022-04-13 15:02:27,142][0m Trial 115 finished with value: 0.25 and parameters: {'loss': 'coxph', 'learning_rate': 0.002670490715446183, 'n_estimators': 423, 'criterion': 'absolute_error', 'min_samples_split': 4, 'min_samples_leaf': 9, 'min_weight_fraction_leaf': 0.0905011513778602, 'min_impurity_decrease': 0.1763248969610642, 'max_features': 0.47894323868054167, 'subsample': 0.4266084552666238, 'dropout_rate': 0.8338357103066202, 'ccp_alpha': 0.7663454451840856}. Best is trial 4 with value: 0.25.[0m
[32m[I 2022-04-13 15:08:26,006][0m Trial 116 finished with value: 0.25 and parameters: {'loss': 'coxph', 'learning_rate': 0.0006033094800950888, 'n_estimators': 692, 'criterion': 'absolute_error', 'min_samples_split': 4, 'min_samples_leaf': 7, 'min_weight_fraction_leaf': 0.3228628307134592, 'min_impurity_decrease': 0.07352388383856581, 'max_features': 0.6645786540786686, 'subsample': 0.39110622903568065, 'dropout_rate': 0.25203057871336726, 'ccp_alpha': 1.6326785347091035}. Best is trial 4 with value: 0.25.[0m
[32m[I 2022-04-13 15:10:06,560][0m Trial 117 finished with value: 0.25 and parameters: {'loss': 'coxph', 'learning_rate': 0.0004953663679205329, 'n_estimators': 337, 'criterion': 'absolute_error', 'min_samples_split': 4, 'min_samples_leaf': 9, 'min_weight_fraction_leaf': 0.258886237261331, 'min_impurity_decrease': 0.021734782542206066, 'max_features': 0.9763001363658763, 'subsample': 0.8251508885129577, 'dropout_rate': 0.9428964147611493, 'ccp_alpha': 1.1628537322039016}. Best is trial 4 with value: 0.25.[0m
[32m[I 2022-04-13 15:11:30,902][0m Trial 118 finished with value: -0.25 and parameters: {'loss': 'squared', 'learning_rate': 0.0001915930378552673, 'n_estimators': 383, 'criterion': 'absolute_error', 'min_samples_split': 4, 'min_samples_leaf': 6, 'min_weight_fraction_leaf': 0.24627626013186737, 'min_impurity_decrease': 0.07143622826451379, 'max_features': 0.9095284836274424, 'subsample': 0.37879059048833347, 'dropout_rate': 0.30814676981515565, 'ccp_alpha': 1.166696268057332}. Best is trial 4 with value: 0.25.[0m
[32m[I 2022-04-13 15:11:55,304][0m Trial 119 finished with value: 0.25 and parameters: {'loss': 'coxph', 'learning_rate': 1.518756193110423e-05, 'n_estimators': 128, 'criterion': 'squared_error', 'min_samples_split': 9, 'min_samples_leaf': 1, 'min_weight_fraction_leaf': 0.22416768177611696, 'min_impurity_decrease': 0.6158540724185024, 'max_features': 0.26914901239591316, 'subsample': 0.8501145210382481, 'dropout_rate': 0.20723467437782722, 'ccp_alpha': 2.9237340486699863}. Best is trial 4 with value: 0.25.[0m
[32m[I 2022-04-13 15:13:02,100][0m Trial 120 finished with value: 0.25 and parameters: {'loss': 'coxph', 'learning_rate': 0.00023232863542681565, 'n_estimators': 294, 'criterion': 'absolute_error', 'min_samples_split': 7, 'min_samples_leaf': 6, 'min_weight_fraction_leaf': 0.26366909801696803, 'min_impurity_decrease': 0.7927300334827042, 'max_features': 0.062009636650886005, 'subsample': 0.6634264838008318, 'dropout_rate': 0.42722178477919437, 'ccp_alpha': 1.82632583120305}. Best is trial 4 with value: 0.25.[0m
[32m[I 2022-04-13 15:14:00,380][0m Trial 121 finished with value: 0.25 and parameters: {'loss': 'coxph', 'learning_rate': 0.0001414530451033774, 'n_estimators': 246, 'criterion': 'absolute_error', 'min_samples_split': 7, 'min_samples_leaf': 6, 'min_weight_fraction_leaf': 0.2371415086057276, 'min_impurity_decrease': 0.8446669243332242, 'max_features': 0.01362347175973977, 'subsample': 0.43458671457157655, 'dropout_rate': 0.3591194918812313, 'ccp_alpha': 1.6143862182425708}. Best is trial 4 with value: 0.25.[0m
[32m[I 2022-04-13 15:15:52,635][0m Trial 122 finished with value: 0.25 and parameters: {'loss': 'coxph', 'learning_rate': 0.01784537275454541, 'n_estimators': 335, 'criterion': 'absolute_error', 'min_samples_split': 3, 'min_samples_leaf': 8, 'min_weight_fraction_leaf': 0.298426093361004, 'min_impurity_decrease': 0.9047614010729814, 'max_features': 0.03356498234998603, 'subsample': 0.14583031392374124, 'dropout_rate': 0.31119830906114526, 'ccp_alpha': 2.2581643315177318}. Best is trial 4 with value: 0.25.[0m
[32m[I 2022-04-13 15:16:57,119][0m Trial 123 finished with value: 0.25 and parameters: {'loss': 'coxph', 'learning_rate': 4.3693044830629826e-05, 'n_estimators': 325, 'criterion': 'absolute_error', 'min_samples_split': 4, 'min_samples_leaf': 5, 'min_weight_fraction_leaf': 0.01891297950838293, 'min_impurity_decrease': 0.2737908231666109, 'max_features': 0.5549889530504067, 'subsample': 0.32240824098845905, 'dropout_rate': 0.8144191028527136, 'ccp_alpha': 0.8085523155436765}. Best is trial 4 with value: 0.25.[0m
[32m[I 2022-04-13 15:17:57,028][0m Trial 124 finished with value: 0.25 and parameters: {'loss': 'coxph', 'learning_rate': 0.00010091924069982905, 'n_estimators': 259, 'criterion': 'friedman_mse', 'min_samples_split': 7, 'min_samples_leaf': 4, 'min_weight_fraction_leaf': 0.36937392686889403, 'min_impurity_decrease': 0.21217770262627283, 'max_features': 0.4401526856129735, 'subsample': 0.6975755882815186, 'dropout_rate': 0.2821552382631452, 'ccp_alpha': 4.675671700806121}. Best is trial 4 with value: 0.25.[0m
[32m[I 2022-04-13 15:19:00,191][0m Trial 125 finished with value: 0.25 and parameters: {'loss': 'coxph', 'learning_rate': 0.010474020091391723, 'n_estimators': 307, 'criterion': 'friedman_mse', 'min_samples_split': 7, 'min_samples_leaf': 4, 'min_weight_fraction_leaf': 0.4258424844881417, 'min_impurity_decrease': 0.22363339833702614, 'max_features': 0.5503043262173893, 'subsample': 0.6129930188925955, 'dropout_rate': 0.5387519380944733, 'ccp_alpha': 4.89787901173869}. Best is trial 4 with value: 0.25.[0m
