[32m[I 2022-04-14 06:13:49,173][0m Trial 450 finished with value: 0.6371812073302544 and parameters: {'loss': 'coxph', 'learning_rate': 5.42701673088576e-06, 'n_estimators': 807, 'criterion': 'friedman_mse', 'min_samples_split': 9, 'min_samples_leaf': 2, 'min_weight_fraction_leaf': 0.401988186344844, 'min_impurity_decrease': 0.31458385983781983, 'max_features': 0.8889092983704237, 'subsample': 0.17112246636598094, 'dropout_rate': 0.5435864683214777, 'ccp_alpha': 0.2567882578848277}. Best is trial 367 with value: 0.7817487788378487.[0m
[32m[I 2022-04-14 06:17:44,832][0m Trial 451 finished with value: 0.7806816750895547 and parameters: {'loss': 'coxph', 'learning_rate': 1.0473573290568322e-05, 'n_estimators': 962, 'criterion': 'friedman_mse', 'min_samples_split': 9, 'min_samples_leaf': 2, 'min_weight_fraction_leaf': 0.38256827944938643, 'min_impurity_decrease': 0.2946828820058543, 'max_features': 0.839854504305601, 'subsample': 0.11175172619901036, 'dropout_rate': 0.5914844663737949, 'ccp_alpha': 0.0021452693182734163}. Best is trial 367 with value: 0.7817487788378487.[0m
[32m[I 2022-04-14 06:21:15,621][0m Trial 452 finished with value: 0.7778574993470535 and parameters: {'loss': 'coxph', 'learning_rate': 7.015160662609179e-06, 'n_estimators': 878, 'criterion': 'friedman_mse', 'min_samples_split': 9, 'min_samples_leaf': 2, 'min_weight_fraction_leaf': 0.3663640432682344, 'min_impurity_decrease': 0.3284868518045385, 'max_features': 0.9433126887466313, 'subsample': 0.08513079895601036, 'dropout_rate': 0.5654986122231606, 'ccp_alpha': 0.1638158128434725}. Best is trial 367 with value: 0.7817487788378487.[0m
[32m[I 2022-04-14 06:24:32,059][0m Trial 453 finished with value: 0.7783165808052717 and parameters: {'loss': 'coxph', 'learning_rate': 1.600320249574867e-05, 'n_estimators': 845, 'criterion': 'friedman_mse', 'min_samples_split': 9, 'min_samples_leaf': 2, 'min_weight_fraction_leaf': 0.357375757769378, 'min_impurity_decrease': 0.3501981489236378, 'max_features': 0.9070157928706692, 'subsample': 0.1366525924506981, 'dropout_rate': 0.6149438224427515, 'ccp_alpha': 0.0994872744107343}. Best is trial 367 with value: 0.7817487788378487.[0m
[32m[I 2022-04-14 06:28:09,126][0m Trial 454 finished with value: 0.7800993348173443 and parameters: {'loss': 'coxph', 'learning_rate': 7.99749288315428e-06, 'n_estimators': 901, 'criterion': 'friedman_mse', 'min_samples_split': 9, 'min_samples_leaf': 2, 'min_weight_fraction_leaf': 0.3884002598165984, 'min_impurity_decrease': 0.2680683519749552, 'max_features': 0.8626166934969486, 'subsample': 0.06602197004323686, 'dropout_rate': 0.5815123618714324, 'ccp_alpha': 0.002393871828797677}. Best is trial 367 with value: 0.7817487788378487.[0m
[32m[I 2022-04-14 06:32:15,991][0m Trial 455 finished with value: 0.25 and parameters: {'loss': 'coxph', 'learning_rate': 1.1300574495171933e-05, 'n_estimators': 934, 'criterion': 'friedman_mse', 'min_samples_split': 9, 'min_samples_leaf': 2, 'min_weight_fraction_leaf': 0.3760851083310551, 'min_impurity_decrease': 0.30475894790162833, 'max_features': 0.8875526403237104, 'subsample': 0.11510745390704302, 'dropout_rate': 0.5420339054375292, 'ccp_alpha': 0.48001924098027315}. Best is trial 367 with value: 0.7817487788378487.[0m
[32m[I 2022-04-14 06:35:22,854][0m Trial 456 finished with value: 0.7742314489950924 and parameters: {'loss': 'coxph', 'learning_rate': 9.348151731380682e-06, 'n_estimators': 806, 'criterion': 'friedman_mse', 'min_samples_split': 9, 'min_samples_leaf': 2, 'min_weight_fraction_leaf': 0.3945636013793253, 'min_impurity_decrease': 0.2850640264147748, 'max_features': 0.9624703721692206, 'subsample': 0.0933711636663054, 'dropout_rate': 0.565892623472098, 'ccp_alpha': 0.17706041658298738}. Best is trial 367 with value: 0.7817487788378487.[0m
[32m[I 2022-04-14 06:39:24,484][0m Trial 457 finished with value: 0.36505789418585516 and parameters: {'loss': 'coxph', 'learning_rate': 5.686794665653278e-06, 'n_estimators': 994, 'criterion': 'friedman_mse', 'min_samples_split': 9, 'min_samples_leaf': 2, 'min_weight_fraction_leaf': 0.37940898343940804, 'min_impurity_decrease': 0.3174914198240493, 'max_features': 0.9217175486987376, 'subsample': 0.15202957514126653, 'dropout_rate': 0.6034982425628609, 'ccp_alpha': 0.3243294637385204}. Best is trial 367 with value: 0.7817487788378487.[0m
[32m[I 2022-04-14 06:43:10,420][0m Trial 458 finished with value: 0.7792274779649029 and parameters: {'loss': 'coxph', 'learning_rate': 7.359885385509454e-06, 'n_estimators': 883, 'criterion': 'friedman_mse', 'min_samples_split': 9, 'min_samples_leaf': 2, 'min_weight_fraction_leaf': 0.36795307461337706, 'min_impurity_decrease': 0.33490370946070097, 'max_features': 0.872893954545633, 'subsample': 0.11741729200027473, 'dropout_rate': 0.5428420950215502, 'ccp_alpha': 0.10105473346153643}. Best is trial 367 with value: 0.7817487788378487.[0m
[32m[I 2022-04-14 06:46:36,276][0m Trial 459 finished with value: 0.7796561653133927 and parameters: {'loss': 'coxph', 'learning_rate': 1.4062061459964617e-05, 'n_estimators': 844, 'criterion': 'friedman_mse', 'min_samples_split': 9, 'min_samples_leaf': 2, 'min_weight_fraction_leaf': 0.40588729656482436, 'min_impurity_decrease': 0.2553318434417186, 'max_features': 0.839248317336644, 'subsample': 0.060800437061614365, 'dropout_rate': 0.5802916390738857, 'ccp_alpha': 0.0013907112039484582}. Best is trial 367 with value: 0.7817487788378487.[0m
[32m[I 2022-04-14 06:50:08,767][0m Trial 460 finished with value: 0.7733944090366933 and parameters: {'loss': 'coxph', 'learning_rate': 1.9632505124991386e-05, 'n_estimators': 937, 'criterion': 'friedman_mse', 'min_samples_split': 9, 'min_samples_leaf': 2, 'min_weight_fraction_leaf': 0.38889286932262296, 'min_impurity_decrease': 0.30519936376405943, 'max_features': 0.8888386805825067, 'subsample': 0.08593623890461997, 'dropout_rate': 0.6470196248456239, 'ccp_alpha': 0.1941012153717058}. Best is trial 367 with value: 0.7817487788378487.[0m
[32m[I 2022-04-14 06:54:23,466][0m Trial 461 finished with value: 0.778429212785643 and parameters: {'loss': 'coxph', 'learning_rate': 9.08934144815863e-06, 'n_estimators': 897, 'criterion': 'friedman_mse', 'min_samples_split': 9, 'min_samples_leaf': 2, 'min_weight_fraction_leaf': 0.3744442009082632, 'min_impurity_decrease': 0.3532075068430742, 'max_features': 0.9064533517313098, 'subsample': 0.1344575668481667, 'dropout_rate': 0.5008761142367817, 'ccp_alpha': 0.08625700686212819}. Best is trial 367 with value: 0.7817487788378487.[0m
[32m[I 2022-04-14 06:57:24,480][0m Trial 462 finished with value: 0.778624278423494 and parameters: {'loss': 'coxph', 'learning_rate': 6.097600079380011e-06, 'n_estimators': 797, 'criterion': 'friedman_mse', 'min_samples_split': 9, 'min_samples_leaf': 2, 'min_weight_fraction_leaf': 0.3578153595787, 'min_impurity_decrease': 0.2902285054343408, 'max_features': 0.8587670842855348, 'subsample': 0.1057222643849605, 'dropout_rate': 0.5615134168696736, 'ccp_alpha': 0.09957662481103002}. Best is trial 367 with value: 0.7817487788378487.[0m
[32m[I 2022-04-14 07:00:25,517][0m Trial 463 finished with value: 0.6192164622181173 and parameters: {'loss': 'coxph', 'learning_rate': 1.1200435625147775e-05, 'n_estimators': 853, 'criterion': 'friedman_mse', 'min_samples_split': 9, 'min_samples_leaf': 2, 'min_weight_fraction_leaf': 0.38313684882519267, 'min_impurity_decrease': 0.3279040987545912, 'max_features': 0.9254376871408364, 'subsample': 0.16988557039097849, 'dropout_rate': 0.5939192888105486, 'ccp_alpha': 0.2611482391322784}. Best is trial 367 with value: 0.7817487788378487.[0m
[32m[I 2022-04-14 07:04:07,233][0m Trial 464 finished with value: 0.25 and parameters: {'loss': 'coxph', 'learning_rate': 8.309840849499593e-06, 'n_estimators': 960, 'criterion': 'friedman_mse', 'min_samples_split': 9, 'min_samples_leaf': 2, 'min_weight_fraction_leaf': 0.3977083683241142, 'min_impurity_decrease': 0.27550701845936176, 'max_features': 0.8961802542211948, 'subsample': 0.0066485653119954385, 'dropout_rate': 0.6228315016955212, 'ccp_alpha': 0.17360262888503403}. Best is trial 367 with value: 0.7817487788378487.[0m
[32m[I 2022-04-14 07:07:41,587][0m Trial 465 finished with value: 0.7800460409134689 and parameters: {'loss': 'coxph', 'learning_rate': 6.982701740092746e-06, 'n_estimators': 888, 'criterion': 'friedman_mse', 'min_samples_split': 9, 'min_samples_leaf': 2, 'min_weight_fraction_leaf': 0.36731709319135547, 'min_impurity_decrease': 0.31357525132792297, 'max_features': 0.8772936657545986, 'subsample': 0.06429277663153218, 'dropout_rate': 0.5378691014995968, 'ccp_alpha': 0.09300220349917056}. Best is trial 367 with value: 0.7817487788378487.[0m
[32m[I 2022-04-14 07:09:44,478][0m Trial 466 finished with value: -0.36703257232822806 and parameters: {'loss': 'squared', 'learning_rate': 1.1861299269305577e-05, 'n_estimators': 839, 'criterion': 'friedman_mse', 'min_samples_split': 9, 'min_samples_leaf': 2, 'min_weight_fraction_leaf': 0.3554370189647284, 'min_impurity_decrease': 0.24026820118390194, 'max_features': 0.8489431241221629, 'subsample': 0.09867240351725069, 'dropout_rate': 0.5636745250418574, 'ccp_alpha': 0.001279725245035655}. Best is trial 367 with value: 0.7817487788378487.[0m
[32m[I 2022-04-14 07:13:18,658][0m Trial 467 finished with value: 0.6371812073302544 and parameters: {'loss': 'coxph', 'learning_rate': 5.309638421571316e-06, 'n_estimators': 926, 'criterion': 'friedman_mse', 'min_samples_split': 9, 'min_samples_leaf': 2, 'min_weight_fraction_leaf': 0.40994967564500784, 'min_impurity_decrease': 0.3507425996562965, 'max_features': 0.9422649522787951, 'subsample': 0.12540156388228285, 'dropout_rate': 0.5866427653533008, 'ccp_alpha': 0.2609302031956423}. Best is trial 367 with value: 0.7817487788378487.[0m
[32m[I 2022-04-14 07:16:46,759][0m Trial 468 finished with value: 0.7803833950837215 and parameters: {'loss': 'coxph', 'learning_rate': 1.5238350811665521e-05, 'n_estimators': 868, 'criterion': 'friedman_mse', 'min_samples_split': 9, 'min_samples_leaf': 2, 'min_weight_fraction_leaf': 0.38000003242017233, 'min_impurity_decrease': 0.29088329628093934, 'max_features': 0.9119392899167357, 'subsample': 0.14770308108127514, 'dropout_rate': 0.5408314132096105, 'ccp_alpha': 0.003033186490143908}. Best is trial 367 with value: 0.7817487788378487.[0m
[32m[I 2022-04-14 07:19:43,058][0m Trial 469 finished with value: 0.7795854881572357 and parameters: {'loss': 'coxph', 'learning_rate': 9.423988727321818e-06, 'n_estimators': 807, 'criterion': 'friedman_mse', 'min_samples_split': 9, 'min_samples_leaf': 2, 'min_weight_fraction_leaf': 0.39002373856472106, 'min_impurity_decrease': 0.33254832761816405, 'max_features': 0.8707938690874057, 'subsample': 0.08392908005045163, 'dropout_rate': 0.598740113515492, 'ccp_alpha': 0.14134792409260788}. Best is trial 367 with value: 0.7817487788378487.[0m
[32m[I 2022-04-14 07:24:01,815][0m Trial 470 finished with value: 0.7742800008338029 and parameters: {'loss': 'coxph', 'learning_rate': 7.068197157987818e-06, 'n_estimators': 996, 'criterion': 'friedman_mse', 'min_samples_split': 9, 'min_samples_leaf': 2, 'min_weight_fraction_leaf': 0.3688962153262193, 'min_impurity_decrease': 0.30930179156136417, 'max_features': 0.8991059417259711, 'subsample': 0.025344291710327843, 'dropout_rate': 0.562336228211667, 'ccp_alpha': 0.3876007939791147}. Best is trial 367 with value: 0.7817487788378487.[0m
[32m[I 2022-04-14 07:27:25,978][0m Trial 471 finished with value: 0.7669174904088418 and parameters: {'loss': 'coxph', 'learning_rate': 1.0344058819515066e-05, 'n_estimators': 887, 'criterion': 'friedman_mse', 'min_samples_split': 9, 'min_samples_leaf': 2, 'min_weight_fraction_leaf': 0.39858926510241693, 'min_impurity_decrease': 0.2648773259512866, 'max_features': 0.8393825466284077, 'subsample': 0.10883369764095267, 'dropout_rate': 0.5772477159406451, 'ccp_alpha': 0.19184134115302415}. Best is trial 367 with value: 0.7817487788378487.[0m
[32m[I 2022-04-14 07:31:19,219][0m Trial 472 finished with value: 0.7805996666837943 and parameters: {'loss': 'coxph', 'learning_rate': 5.322281726468044e-06, 'n_estimators': 940, 'criterion': 'friedman_mse', 'min_samples_split': 9, 'min_samples_leaf': 2, 'min_weight_fraction_leaf': 0.3562414345541115, 'min_impurity_decrease': 0.2978828951196738, 'max_features': 0.8822180622781105, 'subsample': 0.06481823224666863, 'dropout_rate': 0.6179359718614709, 'ccp_alpha': 0.08661552310268936}. Best is trial 367 with value: 0.7817487788378487.[0m
[32m[I 2022-04-14 07:34:36,777][0m Trial 473 finished with value: 0.6371812073302544 and parameters: {'loss': 'coxph', 'learning_rate': 8.466471101460534e-06, 'n_estimators': 846, 'criterion': 'friedman_mse', 'min_samples_split': 9, 'min_samples_leaf': 2, 'min_weight_fraction_leaf': 0.3759420634054881, 'min_impurity_decrease': 0.3207343563905976, 'max_features': 0.8580881200361747, 'subsample': 0.08526172651815282, 'dropout_rate': 0.5559234248481599, 'ccp_alpha': 0.2873204959838117}. Best is trial 367 with value: 0.7817487788378487.[0m
[32m[I 2022-04-14 07:38:06,038][0m Trial 474 finished with value: 0.7788937480813811 and parameters: {'loss': 'coxph', 'learning_rate': 1.2847057399526405e-05, 'n_estimators': 919, 'criterion': 'friedman_mse', 'min_samples_split': 8, 'min_samples_leaf': 2, 'min_weight_fraction_leaf': 0.38820147080250617, 'min_impurity_decrease': 0.3504062408514814, 'max_features': 0.9246006130349748, 'subsample': 0.12081766131335404, 'dropout_rate': 0.595522828697131, 'ccp_alpha': 0.09804316806010928}. Best is trial 367 with value: 0.7817487788378487.[0m
[32m[I 2022-04-14 07:41:15,260][0m Trial 475 finished with value: 0.770266778357617 and parameters: {'loss': 'coxph', 'learning_rate': 6.80468012812639e-06, 'n_estimators': 820, 'criterion': 'friedman_mse', 'min_samples_split': 9, 'min_samples_leaf': 2, 'min_weight_fraction_leaf': 0.3670781158067167, 'min_impurity_decrease': 0.3333638518541487, 'max_features': 0.8920430113376766, 'subsample': 0.0987754527053091, 'dropout_rate': 0.5382621506206421, 'ccp_alpha': 0.19495531115471817}. Best is trial 367 with value: 0.7817487788378487.[0m
[32m[I 2022-04-14 07:44:40,812][0m Trial 476 finished with value: 0.7795317030499671 and parameters: {'loss': 'coxph', 'learning_rate': 9.98452616257549e-06, 'n_estimators': 881, 'criterion': 'friedman_mse', 'min_samples_split': 9, 'min_samples_leaf': 2, 'min_weight_fraction_leaf': 0.38099183256270225, 'min_impurity_decrease': 0.2786229359843898, 'max_features': 0.869492909160801, 'subsample': 0.1360341737462051, 'dropout_rate': 0.5749021572690642, 'ccp_alpha': 0.0804655227362099}. Best is trial 367 with value: 0.7817487788378487.[0m
[32m[I 2022-04-14 07:48:31,499][0m Trial 477 finished with value: 0.7810962171452093 and parameters: {'loss': 'coxph', 'learning_rate': 1.7426017742600634e-05, 'n_estimators': 959, 'criterion': 'friedman_mse', 'min_samples_split': 10, 'min_samples_leaf': 2, 'min_weight_fraction_leaf': 0.394024110772466, 'min_impurity_decrease': 0.300707642098244, 'max_features': 0.9091148230681669, 'subsample': 0.0601780840081116, 'dropout_rate': 0.6354899084644982, 'ccp_alpha': 0.09193379769047401}. Best is trial 367 with value: 0.7817487788378487.[0m
[32m[I 2022-04-14 07:52:14,435][0m Trial 478 finished with value: 0.7747290649024781 and parameters: {'loss': 'coxph', 'learning_rate': 1.8735509537863084e-05, 'n_estimators': 970, 'criterion': 'friedman_mse', 'min_samples_split': 10, 'min_samples_leaf': 2, 'min_weight_fraction_leaf': 0.40841768995354993, 'min_impurity_decrease': 0.3181457305969676, 'max_features': 0.9516852240265896, 'subsample': 0.02552397486398361, 'dropout_rate': 0.6459180545545617, 'ccp_alpha': 0.3069683813119312}. Best is trial 367 with value: 0.7817487788378487.[0m
[32m[I 2022-04-14 07:56:11,022][0m Trial 479 finished with value: 0.7791255834526803 and parameters: {'loss': 'coxph', 'learning_rate': 1.5037779820950807e-05, 'n_estimators': 964, 'criterion': 'friedman_mse', 'min_samples_split': 10, 'min_samples_leaf': 2, 'min_weight_fraction_leaf': 0.400101168450576, 'min_impurity_decrease': 0.2661802737816297, 'max_features': 0.915965209379774, 'subsample': 0.06172924781936345, 'dropout_rate': 0.629789252136448, 'ccp_alpha': 0.18000188437384615}. Best is trial 367 with value: 0.7817487788378487.[0m
[32m[I 2022-04-14 07:59:50,847][0m Trial 480 finished with value: 0.7791629630009094 and parameters: {'loss': 'coxph', 'learning_rate': 1.1978140328445488e-05, 'n_estimators': 919, 'criterion': 'friedman_mse', 'min_samples_split': 10, 'min_samples_leaf': 2, 'min_weight_fraction_leaf': 0.4142516412118479, 'min_impurity_decrease': 0.3526143820425084, 'max_features': 0.8345218746942171, 'subsample': 0.10959531475436526, 'dropout_rate': 0.655019443454615, 'ccp_alpha': 0.0874395567840477}. Best is trial 367 with value: 0.7817487788378487.[0m
[32m[I 2022-04-14 08:03:45,454][0m Trial 481 finished with value: 0.7619612289573423 and parameters: {'loss': 'coxph', 'learning_rate': 5.208262072197341e-06, 'n_estimators': 956, 'criterion': 'friedman_mse', 'min_samples_split': 10, 'min_samples_leaf': 2, 'min_weight_fraction_leaf': 0.3926403807628449, 'min_impurity_decrease': 0.28510193527726846, 'max_features': 0.9350120162150524, 'subsample': 0.06462014501649638, 'dropout_rate': 0.6107004480851673, 'ccp_alpha': 0.24386134660146988}. Best is trial 367 with value: 0.7817487788378487.[0m
[32m[I 2022-04-14 08:07:49,031][0m Trial 482 finished with value: 0.7799959891196717 and parameters: {'loss': 'coxph', 'learning_rate': 1.7206528018417798e-05, 'n_estimators': 996, 'criterion': 'friedman_mse', 'min_samples_split': 10, 'min_samples_leaf': 2, 'min_weight_fraction_leaf': 0.38400767849148937, 'min_impurity_decrease': 0.31438570359768087, 'max_features': 0.8569130690198695, 'subsample': 0.14831239808542523, 'dropout_rate': 0.6283566700556822, 'ccp_alpha': 0.003130375332951455}. Best is trial 367 with value: 0.7817487788378487.[0m
[32m[I 2022-04-14 08:12:01,771][0m Trial 483 finished with value: 0.775188157229927 and parameters: {'loss': 'coxph', 'learning_rate': 7.938150787253888e-06, 'n_estimators': 913, 'criterion': 'friedman_mse', 'min_samples_split': 8, 'min_samples_leaf': 3, 'min_weight_fraction_leaf': 0.39289837245785864, 'min_impurity_decrease': 0.32958639415410673, 'max_features': 0.9146518251519715, 'subsample': 0.08119165752849224, 'dropout_rate': 0.5042339393725153, 'ccp_alpha': 0.16381475057409217}. Best is trial 367 with value: 0.7817487788378487.[0m
[32m[I 2022-04-14 08:15:34,875][0m Trial 484 finished with value: 0.25 and parameters: {'loss': 'coxph', 'learning_rate': 6.14565006396018e-06, 'n_estimators': 891, 'criterion': 'friedman_mse', 'min_samples_split': 8, 'min_samples_leaf': 2, 'min_weight_fraction_leaf': 0.4029756592345273, 'min_impurity_decrease': 0.23845804756897898, 'max_features': 0.8743133215964045, 'subsample': 0.12197705935507339, 'dropout_rate': 0.5897141022560186, 'ccp_alpha': 0.39126528928653215}. Best is trial 367 with value: 0.7817487788378487.[0m
[32m[I 2022-04-14 08:18:08,388][0m Trial 485 finished with value: -0.3666336007601797 and parameters: {'loss': 'squared', 'learning_rate': 1.315716387236615e-05, 'n_estimators': 931, 'criterion': 'friedman_mse', 'min_samples_split': 8, 'min_samples_leaf': 2, 'min_weight_fraction_leaf': 0.3784509480087734, 'min_impurity_decrease': 0.29508737777682764, 'max_features': 0.8998364441847871, 'subsample': 0.1757657316899979, 'dropout_rate': 0.6062614836569551, 'ccp_alpha': 0.0020325722274427906}. Best is trial 367 with value: 0.7817487788378487.[0m
[32m[I 2022-04-14 08:21:44,191][0m Trial 486 finished with value: 0.779123891472733 and parameters: {'loss': 'coxph', 'learning_rate': 7.82772269063333e-06, 'n_estimators': 870, 'criterion': 'friedman_mse', 'min_samples_split': 8, 'min_samples_leaf': 2, 'min_weight_fraction_leaf': 0.3587171520849677, 'min_impurity_decrease': 0.34351565972482123, 'max_features': 0.8827988770594466, 'subsample': 0.10509267627202362, 'dropout_rate': 0.5365057087503019, 'ccp_alpha': 0.11213887647988993}. Best is trial 367 with value: 0.7817487788378487.[0m
[32m[I 2022-04-14 08:25:41,022][0m Trial 487 finished with value: 0.7773934237700627 and parameters: {'loss': 'coxph', 'learning_rate': 4.363660406953239e-06, 'n_estimators': 941, 'criterion': 'friedman_mse', 'min_samples_split': 10, 'min_samples_leaf': 1, 'min_weight_fraction_leaf': 0.3861125464735061, 'min_impurity_decrease': 0.3017202161763689, 'max_features': 0.8321529077752011, 'subsample': 0.061141338543140085, 'dropout_rate': 0.5573956531945617, 'ccp_alpha': 0.20990323570818395}. Best is trial 367 with value: 0.7817487788378487.[0m
[32m[I 2022-04-14 08:28:33,769][0m Trial 488 finished with value: 0.7793616460378587 and parameters: {'loss': 'coxph', 'learning_rate': 1.0587248967919649e-05, 'n_estimators': 788, 'criterion': 'friedman_mse', 'min_samples_split': 8, 'min_samples_leaf': 2, 'min_weight_fraction_leaf': 0.3658164880498353, 'min_impurity_decrease': 0.2538509615143102, 'max_features': 0.9311051885186084, 'subsample': 0.0899143722656705, 'dropout_rate': 0.58257051013018, 'ccp_alpha': 0.09176597710914453}. Best is trial 367 with value: 0.7817487788378487.[0m
[32m[I 2022-04-14 08:31:45,027][0m Trial 489 finished with value: 0.5203899749418202 and parameters: {'loss': 'coxph', 'learning_rate': 6.294605075308127e-06, 'n_estimators': 863, 'criterion': 'friedman_mse', 'min_samples_split': 8, 'min_samples_leaf': 2, 'min_weight_fraction_leaf': 0.3742845900592554, 'min_impurity_decrease': 0.3196116912770678, 'max_features': 0.9603796811570906, 'subsample': 0.1313876679423029, 'dropout_rate': 0.6347061421454625, 'ccp_alpha': 0.28716565328225785}. Best is trial 367 with value: 0.7817487788378487.[0m
