[32m[I 2022-04-16 01:50:39,202][0m Trial 349 finished with value: 0.8839216955872224 and parameters: {'n_hidden': 1024, 'mixture_components': 9, 'use_sparse_layer': True, 'use_sparse_loss': False, 'use_batchnorm': True, 'use_dropout': True, 'dropout': 0.522862828670873, 'mlp_size_1': 2, 'mlp_size_2': 4, 'mlp_size_3': 1, 'kernel': 'Weibull', 'loss_name': 'CensoredNLLLoss'}. Best is trial 340 with value: 0.8866661488681677.[0m
[32m[I 2022-04-16 01:53:17,919][0m Trial 350 finished with value: 0.882338606110759 and parameters: {'n_hidden': 1024, 'mixture_components': 9, 'use_sparse_layer': True, 'use_sparse_loss': False, 'use_batchnorm': False, 'use_dropout': True, 'dropout': 0.5316022150417591, 'mlp_size_1': 2, 'mlp_size_2': 4, 'mlp_size_3': 1, 'kernel': 'Logistic', 'loss_name': 'CensoredNLLLoss'}. Best is trial 340 with value: 0.8866661488681677.[0m
[32m[I 2022-04-16 01:55:46,848][0m Trial 351 finished with value: 0.8829441495437287 and parameters: {'n_hidden': 1024, 'mixture_components': 9, 'use_sparse_layer': True, 'use_sparse_loss': False, 'use_batchnorm': False, 'use_dropout': True, 'dropout': 0.5050913145208653, 'mlp_size_1': 2, 'mlp_size_2': 4, 'mlp_size_3': 1, 'kernel': 'Weibull', 'loss_name': 'CensoredNLLLoss'}. Best is trial 340 with value: 0.8866661488681677.[0m
[32m[I 2022-04-16 01:57:56,223][0m Trial 352 finished with value: 0.8825711283186847 and parameters: {'n_hidden': 1024, 'mixture_components': 9, 'use_sparse_layer': True, 'use_sparse_loss': False, 'use_batchnorm': False, 'use_dropout': False, 'mlp_size_1': 2, 'mlp_size_2': 4, 'mlp_size_3': 1, 'kernel': 'Weibull', 'loss_name': 'CensoredNLLLoss'}. Best is trial 340 with value: 0.8866661488681677.[0m
[32m[I 2022-04-16 02:00:13,889][0m Trial 353 finished with value: 0.8862555225668611 and parameters: {'n_hidden': 1024, 'mixture_components': 9, 'use_sparse_layer': True, 'use_sparse_loss': False, 'use_batchnorm': False, 'use_dropout': True, 'dropout': 0.5407303601685443, 'mlp_size_1': 2, 'mlp_size_2': 4, 'mlp_size_3': 1, 'kernel': 'Weibull', 'loss_name': 'CensoredNLLLoss'}. Best is trial 340 with value: 0.8866661488681677.[0m
[32m[I 2022-04-16 02:02:53,666][0m Trial 354 finished with value: 0.885002734895801 and parameters: {'n_hidden': 1024, 'mixture_components': 9, 'use_sparse_layer': True, 'use_sparse_loss': False, 'use_batchnorm': False, 'use_dropout': True, 'dropout': 0.5477340556293051, 'mlp_size_1': 2, 'mlp_size_2': 4, 'mlp_size_3': 1, 'kernel': 'Weibull', 'loss_name': 'CensoredNLLLoss'}. Best is trial 340 with value: 0.8866661488681677.[0m
[32m[I 2022-04-16 02:05:40,730][0m Trial 355 finished with value: 0.8856733056466572 and parameters: {'n_hidden': 1024, 'mixture_components': 9, 'use_sparse_layer': True, 'use_sparse_loss': False, 'use_batchnorm': False, 'use_dropout': True, 'dropout': 0.5329942951580259, 'mlp_size_1': 2, 'mlp_size_2': 4, 'mlp_size_3': 1, 'kernel': 'Weibull', 'loss_name': 'CensoredNLLLoss'}. Best is trial 340 with value: 0.8866661488681677.[0m
[32m[I 2022-04-16 02:07:47,331][0m Trial 356 finished with value: 0.7852369135300037 and parameters: {'n_hidden': 1024, 'mixture_components': 8, 'use_sparse_layer': True, 'use_sparse_loss': False, 'use_batchnorm': False, 'use_dropout': True, 'dropout': 0.513172268839895, 'mlp_size_1': 2, 'mlp_size_2': 4, 'mlp_size_3': 1, 'kernel': 'Exponential', 'loss_name': 'CensoredNLLLoss'}. Best is trial 340 with value: 0.8866661488681677.[0m
[32m[I 2022-04-16 02:09:41,269][0m Trial 357 finished with value: 0.8605485759149797 and parameters: {'n_hidden': 1024, 'mixture_components': 9, 'use_sparse_layer': True, 'use_sparse_loss': False, 'use_batchnorm': False, 'use_dropout': True, 'dropout': 0.5660811323709221, 'mlp_size_1': 2, 'mlp_size_2': 4, 'mlp_size_3': 1, 'kernel': 'Weibull', 'loss_name': 'NLLLoss'}. Best is trial 340 with value: 0.8866661488681677.[0m
[32m[I 2022-04-16 02:13:17,366][0m Trial 358 finished with value: 0.8774221576837042 and parameters: {'n_hidden': 32, 'mixture_components': 9, 'use_sparse_layer': True, 'use_sparse_loss': False, 'use_batchnorm': False, 'use_dropout': True, 'dropout': 0.5345474656558601, 'mlp_size_1': 2, 'mlp_size_2': 0, 'mlp_size_3': 0, 'kernel': 'Weibull', 'loss_name': 'CensoredNLLLoss'}. Best is trial 340 with value: 0.8866661488681677.[0m
[32m[I 2022-04-16 02:16:00,592][0m Trial 359 finished with value: 0.8862275467642906 and parameters: {'n_hidden': 1024, 'mixture_components': 9, 'use_sparse_layer': True, 'use_sparse_loss': False, 'use_batchnorm': False, 'use_dropout': True, 'dropout': 0.48798296388145757, 'mlp_size_1': 2, 'mlp_size_2': 4, 'mlp_size_3': 1, 'kernel': 'Weibull', 'loss_name': 'CensoredNLLLoss'}. Best is trial 340 with value: 0.8866661488681677.[0m
[32m[I 2022-04-16 02:18:35,192][0m Trial 360 finished with value: 0.8838862385326056 and parameters: {'n_hidden': 1024, 'mixture_components': 9, 'use_sparse_layer': True, 'use_sparse_loss': False, 'use_batchnorm': False, 'use_dropout': True, 'dropout': 0.5104644861481646, 'mlp_size_1': 2, 'mlp_size_2': 4, 'mlp_size_3': 1, 'kernel': 'Weibull', 'loss_name': 'CensoredNLLLoss'}. Best is trial 340 with value: 0.8866661488681677.[0m
[32m[I 2022-04-16 02:20:46,517][0m Trial 361 finished with value: 0.884215452486616 and parameters: {'n_hidden': 1024, 'mixture_components': 9, 'use_sparse_layer': True, 'use_sparse_loss': False, 'use_batchnorm': False, 'use_dropout': True, 'dropout': 0.4869246138699853, 'mlp_size_1': 2, 'mlp_size_2': 4, 'mlp_size_3': 1, 'kernel': 'Weibull', 'loss_name': 'CensoredNLLLoss'}. Best is trial 340 with value: 0.8866661488681677.[0m
[32m[I 2022-04-16 02:23:08,102][0m Trial 362 finished with value: 0.8841151779667067 and parameters: {'n_hidden': 1024, 'mixture_components': 9, 'use_sparse_layer': True, 'use_sparse_loss': False, 'use_batchnorm': False, 'use_dropout': True, 'dropout': 0.5449859582011694, 'mlp_size_1': 2, 'mlp_size_2': 4, 'mlp_size_3': 1, 'kernel': 'Weibull', 'loss_name': 'CensoredNLLLoss'}. Best is trial 340 with value: 0.8866661488681677.[0m
[32m[I 2022-04-16 02:25:30,060][0m Trial 363 finished with value: 0.8835882515653246 and parameters: {'n_hidden': 1024, 'mixture_components': 9, 'use_sparse_layer': True, 'use_sparse_loss': False, 'use_batchnorm': False, 'use_dropout': True, 'dropout': 0.4930294331180984, 'mlp_size_1': 2, 'mlp_size_2': 4, 'mlp_size_3': 1, 'kernel': 'Weibull', 'loss_name': 'CensoredNLLLoss'}. Best is trial 340 with value: 0.8866661488681677.[0m
[32m[I 2022-04-16 02:27:52,411][0m Trial 364 finished with value: 0.8848189210883858 and parameters: {'n_hidden': 1024, 'mixture_components': 8, 'use_sparse_layer': True, 'use_sparse_loss': False, 'use_batchnorm': False, 'use_dropout': True, 'dropout': 0.5557284663844636, 'mlp_size_1': 2, 'mlp_size_2': 4, 'mlp_size_3': 1, 'kernel': 'Weibull', 'loss_name': 'CensoredNLLLoss'}. Best is trial 340 with value: 0.8866661488681677.[0m
[32m[I 2022-04-16 02:30:07,818][0m Trial 365 finished with value: 0.8855282949158841 and parameters: {'n_hidden': 1024, 'mixture_components': 9, 'use_sparse_layer': True, 'use_sparse_loss': False, 'use_batchnorm': False, 'use_dropout': True, 'dropout': 0.5272523706447495, 'mlp_size_1': 2, 'mlp_size_2': 4, 'mlp_size_3': 1, 'kernel': 'Weibull', 'loss_name': 'CensoredNLLLoss'}. Best is trial 340 with value: 0.8866661488681677.[0m
[32m[I 2022-04-16 02:32:19,858][0m Trial 366 finished with value: 0.8862998936007829 and parameters: {'n_hidden': 256, 'mixture_components': 9, 'use_sparse_layer': True, 'use_sparse_loss': False, 'use_batchnorm': False, 'use_dropout': True, 'dropout': 0.5761584336675009, 'mlp_size_1': 2, 'mlp_size_2': 3, 'mlp_size_3': 0, 'kernel': 'Weibull', 'loss_name': 'CensoredNLLLoss'}. Best is trial 340 with value: 0.8866661488681677.[0m
[32m[I 2022-04-16 02:34:37,340][0m Trial 367 finished with value: 0.8854741864324603 and parameters: {'n_hidden': 256, 'mixture_components': 9, 'use_sparse_layer': True, 'use_sparse_loss': False, 'use_batchnorm': False, 'use_dropout': True, 'dropout': 0.5769746645124951, 'mlp_size_1': 2, 'mlp_size_2': 3, 'mlp_size_3': 0, 'kernel': 'Weibull', 'loss_name': 'CensoredNLLLoss'}. Best is trial 340 with value: 0.8866661488681677.[0m
[32m[I 2022-04-16 02:37:26,618][0m Trial 368 finished with value: 0.8835928302805313 and parameters: {'n_hidden': 256, 'mixture_components': 9, 'use_sparse_layer': True, 'use_sparse_loss': False, 'use_batchnorm': False, 'use_dropout': True, 'dropout': 0.5950530700617587, 'mlp_size_1': 2, 'mlp_size_2': 3, 'mlp_size_3': 0, 'kernel': 'Weibull', 'loss_name': 'CensoredNLLLoss'}. Best is trial 340 with value: 0.8866661488681677.[0m
[32m[I 2022-04-16 02:39:06,128][0m Trial 369 finished with value: 0.8094619179563356 and parameters: {'n_hidden': 256, 'mixture_components': 9, 'use_sparse_layer': True, 'use_sparse_loss': False, 'use_batchnorm': False, 'use_dropout': True, 'dropout': 0.5812380334757201, 'mlp_size_1': 2, 'mlp_size_2': 3, 'mlp_size_3': 0, 'kernel': 'Gumbel', 'loss_name': 'CensoredNLLLoss'}. Best is trial 340 with value: 0.8866661488681677.[0m
[32m[I 2022-04-16 02:42:53,392][0m Trial 370 finished with value: 0.6817459205559308 and parameters: {'n_hidden': 256, 'mixture_components': 8, 'use_sparse_layer': True, 'use_sparse_loss': False, 'use_batchnorm': True, 'use_dropout': True, 'dropout': 0.5470996340315589, 'mlp_size_1': 2, 'mlp_size_2': 3, 'mlp_size_3': 0, 'kernel': 'Weibull', 'loss_name': 'CensoredNLLLoss'}. Best is trial 340 with value: 0.8866661488681677.[0m
[32m[I 2022-04-16 02:45:13,155][0m Trial 371 finished with value: 0.8842882885448644 and parameters: {'n_hidden': 256, 'mixture_components': 9, 'use_sparse_layer': True, 'use_sparse_loss': False, 'use_batchnorm': False, 'use_dropout': True, 'dropout': 0.5643266299202285, 'mlp_size_1': 2, 'mlp_size_2': 3, 'mlp_size_3': 0, 'kernel': 'Weibull', 'loss_name': 'CensoredNLLLoss'}. Best is trial 340 with value: 0.8866661488681677.[0m
[32m[I 2022-04-16 02:47:34,489][0m Trial 372 finished with value: 0.7827821045476221 and parameters: {'n_hidden': 256, 'mixture_components': 9, 'use_sparse_layer': True, 'use_sparse_loss': False, 'use_batchnorm': False, 'use_dropout': True, 'dropout': 0.608981030750793, 'mlp_size_1': 2, 'mlp_size_2': 3, 'mlp_size_3': 0, 'kernel': 'Logistic', 'loss_name': 'CensoredNLLLoss'}. Best is trial 340 with value: 0.8866661488681677.[0m
[32m[I 2022-04-16 02:50:03,788][0m Trial 373 finished with value: 0.8811456759340528 and parameters: {'n_hidden': 128, 'mixture_components': 9, 'use_sparse_layer': True, 'use_sparse_loss': False, 'use_batchnorm': False, 'use_dropout': True, 'dropout': 0.5742441981377779, 'mlp_size_1': 2, 'mlp_size_2': 2, 'mlp_size_3': 0, 'kernel': 'Weibull', 'loss_name': 'CensoredNLLLoss'}. Best is trial 340 with value: 0.8866661488681677.[0m
[32m[I 2022-04-16 02:52:22,507][0m Trial 374 finished with value: 0.8807280482346039 and parameters: {'n_hidden': 512, 'mixture_components': 9, 'use_sparse_layer': True, 'use_sparse_loss': False, 'use_batchnorm': False, 'use_dropout': False, 'mlp_size_1': 2, 'mlp_size_2': 4, 'mlp_size_3': 0, 'kernel': 'Normal', 'loss_name': 'CensoredNLLLoss'}. Best is trial 340 with value: 0.8866661488681677.[0m
[32m[I 2022-04-16 02:55:11,740][0m Trial 375 finished with value: 0.8838288200319171 and parameters: {'n_hidden': 2048, 'mixture_components': 8, 'use_sparse_layer': True, 'use_sparse_loss': False, 'use_batchnorm': False, 'use_dropout': True, 'dropout': 0.5223790772079182, 'mlp_size_1': 1, 'mlp_size_2': 4, 'mlp_size_3': 1, 'kernel': 'Weibull', 'loss_name': 'CensoredNLLLoss'}. Best is trial 340 with value: 0.8866661488681677.[0m
[32m[I 2022-04-16 02:57:22,246][0m Trial 376 finished with value: 0.8835833201562207 and parameters: {'n_hidden': 256, 'mixture_components': 9, 'use_sparse_layer': True, 'use_sparse_loss': False, 'use_batchnorm': False, 'use_dropout': True, 'dropout': 0.6472586957815468, 'mlp_size_1': 2, 'mlp_size_2': 3, 'mlp_size_3': 0, 'kernel': 'Weibull', 'loss_name': 'CensoredNLLLoss'}. Best is trial 340 with value: 0.8866661488681677.[0m
[32m[I 2022-04-16 03:00:12,622][0m Trial 377 finished with value: 0.8813278409992439 and parameters: {'n_hidden': 64, 'mixture_components': 9, 'use_sparse_layer': True, 'use_sparse_loss': False, 'use_batchnorm': False, 'use_dropout': True, 'dropout': 0.6091128259245218, 'mlp_size_1': 2, 'mlp_size_2': 1, 'mlp_size_3': 0, 'kernel': 'Weibull', 'loss_name': 'CensoredNLLLoss'}. Best is trial 340 with value: 0.8866661488681677.[0m
[32m[I 2022-04-16 03:02:34,203][0m Trial 378 finished with value: 0.8836551487561592 and parameters: {'n_hidden': 1024, 'mixture_components': 9, 'use_sparse_layer': True, 'use_sparse_loss': False, 'use_batchnorm': False, 'use_dropout': True, 'dropout': 0.554737439556916, 'mlp_size_1': 2, 'mlp_size_2': 4, 'mlp_size_3': 1, 'kernel': 'Weibull', 'loss_name': 'CensoredNLLLoss'}. Best is trial 340 with value: 0.8866661488681677.[0m
[32m[I 2022-04-16 03:04:53,076][0m Trial 379 finished with value: 0.8583321039907865 and parameters: {'n_hidden': 1024, 'mixture_components': 9, 'use_sparse_layer': True, 'use_sparse_loss': False, 'use_batchnorm': False, 'use_dropout': True, 'dropout': 0.6294843569001484, 'mlp_size_1': 2, 'mlp_size_2': 4, 'mlp_size_3': 1, 'kernel': 'LogNormal', 'loss_name': 'NLLLoss'}. Best is trial 340 with value: 0.8866661488681677.[0m
[32m[I 2022-04-16 03:07:32,251][0m Trial 380 finished with value: 0.8837018424607711 and parameters: {'n_hidden': 1024, 'mixture_components': 9, 'use_sparse_layer': True, 'use_sparse_loss': False, 'use_batchnorm': False, 'use_dropout': True, 'dropout': 0.5822941957407762, 'mlp_size_1': 2, 'mlp_size_2': 4, 'mlp_size_3': 1, 'kernel': 'Weibull', 'loss_name': 'CensoredNLLLoss'}. Best is trial 340 with value: 0.8866661488681677.[0m
[32m[I 2022-04-16 03:09:55,621][0m Trial 381 finished with value: 0.8789736991140717 and parameters: {'n_hidden': 1024, 'mixture_components': 7, 'use_sparse_layer': True, 'use_sparse_loss': False, 'use_batchnorm': False, 'use_dropout': True, 'dropout': 0.5074072909746704, 'mlp_size_1': 2, 'mlp_size_2': 4, 'mlp_size_3': 1, 'kernel': 'Weibull', 'loss_name': 'CensoredNLLLoss'}. Best is trial 340 with value: 0.8866661488681677.[0m
[32m[I 2022-04-16 03:12:29,854][0m Trial 382 finished with value: 0.885042519708143 and parameters: {'n_hidden': 1024, 'mixture_components': 9, 'use_sparse_layer': True, 'use_sparse_loss': False, 'use_batchnorm': False, 'use_dropout': True, 'dropout': 0.5594841631440319, 'mlp_size_1': 2, 'mlp_size_2': 4, 'mlp_size_3': 1, 'kernel': 'Weibull', 'loss_name': 'CensoredNLLLoss'}. Best is trial 340 with value: 0.8866661488681677.[0m
[32m[I 2022-04-16 03:15:04,748][0m Trial 383 finished with value: 0.884217689334044 and parameters: {'n_hidden': 1024, 'mixture_components': 9, 'use_sparse_layer': True, 'use_sparse_loss': False, 'use_batchnorm': False, 'use_dropout': True, 'dropout': 0.6019858923769258, 'mlp_size_1': 2, 'mlp_size_2': 4, 'mlp_size_3': 1, 'kernel': 'Weibull', 'loss_name': 'CensoredNLLLoss'}. Best is trial 340 with value: 0.8866661488681677.[0m
[32m[I 2022-04-16 03:17:19,996][0m Trial 384 finished with value: 0.7840967198133622 and parameters: {'n_hidden': 1024, 'mixture_components': 9, 'use_sparse_layer': True, 'use_sparse_loss': False, 'use_batchnorm': False, 'use_dropout': True, 'dropout': 0.5410708285595103, 'mlp_size_1': 2, 'mlp_size_2': 4, 'mlp_size_3': 1, 'kernel': 'Exponential', 'loss_name': 'CensoredNLLLoss'}. Best is trial 340 with value: 0.8866661488681677.[0m
[32m[I 2022-04-16 03:21:09,073][0m Trial 385 finished with value: 0.8787512530416682 and parameters: {'n_hidden': 1024, 'mixture_components': 9, 'use_sparse_layer': True, 'use_sparse_loss': False, 'use_batchnorm': False, 'use_dropout': True, 'dropout': 0.8750066057120329, 'mlp_size_1': 2, 'mlp_size_2': 4, 'mlp_size_3': 1, 'kernel': 'Weibull', 'loss_name': 'CensoredNLLLoss'}. Best is trial 340 with value: 0.8866661488681677.[0m
[32m[I 2022-04-16 03:23:39,961][0m Trial 386 finished with value: 0.8844691575366689 and parameters: {'n_hidden': 1024, 'mixture_components': 9, 'use_sparse_layer': True, 'use_sparse_loss': False, 'use_batchnorm': False, 'use_dropout': True, 'dropout': 0.49690913955737126, 'mlp_size_1': 2, 'mlp_size_2': 4, 'mlp_size_3': 1, 'kernel': 'Weibull', 'loss_name': 'CensoredNLLLoss'}. Best is trial 340 with value: 0.8866661488681677.[0m
[32m[I 2022-04-16 03:26:12,178][0m Trial 387 finished with value: 0.8856976221134012 and parameters: {'n_hidden': 1024, 'mixture_components': 9, 'use_sparse_layer': True, 'use_sparse_loss': False, 'use_batchnorm': False, 'use_dropout': True, 'dropout': 0.5238381314471587, 'mlp_size_1': 2, 'mlp_size_2': 4, 'mlp_size_3': 1, 'kernel': 'Logistic', 'loss_name': 'CensoredNLLLoss'}. Best is trial 340 with value: 0.8866661488681677.[0m
[32m[I 2022-04-16 03:29:11,463][0m Trial 388 finished with value: 0.7703678929685377 and parameters: {'n_hidden': 32, 'mixture_components': 9, 'use_sparse_layer': True, 'use_sparse_loss': False, 'use_batchnorm': False, 'use_dropout': True, 'dropout': 0.5973530929247003, 'mlp_size_1': 2, 'mlp_size_2': 0, 'mlp_size_3': 0, 'kernel': 'Weibull', 'loss_name': 'CensoredNLLLoss'}. Best is trial 340 with value: 0.8866661488681677.[0m
[32m[I 2022-04-16 03:33:30,244][0m Trial 389 finished with value: 0.7867320295062672 and parameters: {'n_hidden': 1024, 'mixture_components': 8, 'use_sparse_layer': True, 'use_sparse_loss': False, 'use_batchnorm': True, 'use_dropout': True, 'dropout': 0.5746331045928964, 'mlp_size_1': 1, 'mlp_size_2': 4, 'mlp_size_3': 2, 'kernel': 'Weibull', 'loss_name': 'CensoredNLLLoss'}. Best is trial 340 with value: 0.8866661488681677.[0m
[32m[I 2022-04-16 03:35:54,028][0m Trial 390 finished with value: 0.8817959856540488 and parameters: {'n_hidden': 1024, 'mixture_components': 9, 'use_sparse_layer': True, 'use_sparse_loss': False, 'use_batchnorm': False, 'use_dropout': True, 'dropout': 0.19666936107846872, 'mlp_size_1': 2, 'mlp_size_2': 4, 'mlp_size_3': 1, 'kernel': 'Weibull', 'loss_name': 'CensoredNLLLoss'}. Best is trial 340 with value: 0.8866661488681677.[0m
[32m[I 2022-04-16 03:38:36,316][0m Trial 391 finished with value: 0.883972575713263 and parameters: {'n_hidden': 1024, 'mixture_components': 9, 'use_sparse_layer': True, 'use_sparse_loss': False, 'use_batchnorm': False, 'use_dropout': True, 'dropout': 0.6242913197018997, 'mlp_size_1': 2, 'mlp_size_2': 4, 'mlp_size_3': 1, 'kernel': 'Weibull', 'loss_name': 'CensoredNLLLoss'}. Best is trial 340 with value: 0.8866661488681677.[0m
[32m[I 2022-04-16 03:41:09,555][0m Trial 392 finished with value: 0.8845678604301325 and parameters: {'n_hidden': 1024, 'mixture_components': 10, 'use_sparse_layer': True, 'use_sparse_loss': False, 'use_batchnorm': False, 'use_dropout': True, 'dropout': 0.4802684210523911, 'mlp_size_1': 2, 'mlp_size_2': 4, 'mlp_size_3': 1, 'kernel': 'Weibull', 'loss_name': 'CensoredNLLLoss'}. Best is trial 340 with value: 0.8866661488681677.[0m
[32m[I 2022-04-16 03:43:26,746][0m Trial 393 finished with value: 0.8794819449891864 and parameters: {'n_hidden': 1024, 'mixture_components': 9, 'use_sparse_layer': True, 'use_sparse_loss': False, 'use_batchnorm': False, 'use_dropout': False, 'mlp_size_1': 1, 'mlp_size_2': 5, 'mlp_size_3': 1, 'kernel': 'Weibull', 'loss_name': 'CensoredNLLLoss'}. Best is trial 340 with value: 0.8866661488681677.[0m
[32m[I 2022-04-16 03:45:44,278][0m Trial 394 finished with value: 0.8812212055115358 and parameters: {'n_hidden': 256, 'mixture_components': 10, 'use_sparse_layer': True, 'use_sparse_loss': False, 'use_batchnorm': False, 'use_dropout': True, 'dropout': 0.5367367317382361, 'mlp_size_1': 2, 'mlp_size_2': 3, 'mlp_size_3': 0, 'kernel': 'Weibull', 'loss_name': 'CensoredNLLLoss'}. Best is trial 340 with value: 0.8866661488681677.[0m
[32m[I 2022-04-16 03:48:24,663][0m Trial 395 finished with value: 0.8859244307133366 and parameters: {'n_hidden': 1024, 'mixture_components': 10, 'use_sparse_layer': True, 'use_sparse_loss': False, 'use_batchnorm': False, 'use_dropout': True, 'dropout': 0.5072008269168159, 'mlp_size_1': 2, 'mlp_size_2': 4, 'mlp_size_3': 1, 'kernel': 'Weibull', 'loss_name': 'CensoredNLLLoss'}. Best is trial 340 with value: 0.8866661488681677.[0m
[32m[I 2022-04-16 03:51:07,907][0m Trial 396 finished with value: 0.8851427747942335 and parameters: {'n_hidden': 1024, 'mixture_components': 10, 'use_sparse_layer': True, 'use_sparse_loss': False, 'use_batchnorm': False, 'use_dropout': True, 'dropout': 0.5086690081510359, 'mlp_size_1': 2, 'mlp_size_2': 4, 'mlp_size_3': 1, 'kernel': 'Weibull', 'loss_name': 'CensoredNLLLoss'}. Best is trial 340 with value: 0.8866661488681677.[0m
[32m[I 2022-04-16 03:53:26,536][0m Trial 397 finished with value: 0.23897902031704543 and parameters: {'n_hidden': 1024, 'mixture_components': 9, 'use_sparse_layer': True, 'use_sparse_loss': False, 'use_batchnorm': False, 'use_dropout': True, 'dropout': 0.5143231266485704, 'mlp_size_1': 2, 'mlp_size_2': 4, 'mlp_size_3': 1, 'kernel': 'Gumbel', 'loss_name': 'CensoredNLLLoss'}. Best is trial 340 with value: 0.8866661488681677.[0m
[32m[I 2022-04-16 03:56:05,177][0m Trial 398 finished with value: 0.8848567977186661 and parameters: {'n_hidden': 128, 'mixture_components': 10, 'use_sparse_layer': True, 'use_sparse_loss': False, 'use_batchnorm': False, 'use_dropout': True, 'dropout': 0.5486583599826874, 'mlp_size_1': 2, 'mlp_size_2': 2, 'mlp_size_3': 0, 'kernel': 'Weibull', 'loss_name': 'CensoredNLLLoss'}. Best is trial 340 with value: 0.8866661488681677.[0m
