[32m[I 2022-04-15 14:30:00,146][0m Trial 935 finished with value: 0.7632024339504839 and parameters: {'loss': 'coxph', 'learning_rate': 0.0012314933521069753, 'n_estimators': 801, 'criterion': 'friedman_mse', 'min_samples_split': 8, 'min_samples_leaf': 2, 'min_weight_fraction_leaf': 0.021116762831816724, 'min_impurity_decrease': 0.3647059613828081, 'max_features': 0.7571252845692906, 'subsample': 0.07523825139165741, 'dropout_rate': 0.8735922404613286, 'ccp_alpha': 0.08845299173473697}. Best is trial 712 with value: 0.7824105962295036.[0m
[32m[I 2022-04-15 14:31:25,027][0m Trial 936 finished with value: 0.7620196084919845 and parameters: {'loss': 'coxph', 'learning_rate': 0.0015411691603309506, 'n_estimators': 691, 'criterion': 'friedman_mse', 'min_samples_split': 7, 'min_samples_leaf': 2, 'min_weight_fraction_leaf': 0.01266482756785389, 'min_impurity_decrease': 0.42293717380329204, 'max_features': 0.7189296840704188, 'subsample': 0.11984369655969052, 'dropout_rate': 0.8231245815959813, 'ccp_alpha': 0.10015654780684086}. Best is trial 712 with value: 0.7824105962295036.[0m
[32m[I 2022-04-15 14:32:57,491][0m Trial 937 finished with value: 0.7802259035170824 and parameters: {'loss': 'coxph', 'learning_rate': 0.0016144330586451861, 'n_estimators': 748, 'criterion': 'friedman_mse', 'min_samples_split': 8, 'min_samples_leaf': 2, 'min_weight_fraction_leaf': 0.02689152740330961, 'min_impurity_decrease': 0.4001534582826016, 'max_features': 0.6923949991045752, 'subsample': 0.13943241638041912, 'dropout_rate': 0.8538352053005647, 'ccp_alpha': 0.0011421362082751725}. Best is trial 712 with value: 0.7824105962295036.[0m
[32m[I 2022-04-15 14:34:33,285][0m Trial 938 finished with value: 0.6743624146605087 and parameters: {'loss': 'coxph', 'learning_rate': 0.0011152450295297026, 'n_estimators': 797, 'criterion': 'friedman_mse', 'min_samples_split': 8, 'min_samples_leaf': 2, 'min_weight_fraction_leaf': 0.0011946454846982271, 'min_impurity_decrease': 0.3734179802215535, 'max_features': 0.6880935430079658, 'subsample': 0.14638686686577734, 'dropout_rate': 0.8394902400667742, 'ccp_alpha': 0.24943058598726753}. Best is trial 712 with value: 0.7824105962295036.[0m
[32m[I 2022-04-15 14:36:17,548][0m Trial 939 finished with value: 0.6743624146605087 and parameters: {'loss': 'coxph', 'learning_rate': 3.2716420257066377e-06, 'n_estimators': 865, 'criterion': 'friedman_mse', 'min_samples_split': 8, 'min_samples_leaf': 2, 'min_weight_fraction_leaf': 0.020648710601664177, 'min_impurity_decrease': 0.3646948256727762, 'max_features': 0.6742878583278085, 'subsample': 0.166084326922817, 'dropout_rate': 0.8542977872606402, 'ccp_alpha': 0.16732137801903443}. Best is trial 712 with value: 0.7824105962295036.[0m
[32m[I 2022-04-15 14:37:57,518][0m Trial 940 finished with value: 0.7615835421837087 and parameters: {'loss': 'coxph', 'learning_rate': 0.0017966835077272488, 'n_estimators': 768, 'criterion': 'friedman_mse', 'min_samples_split': 8, 'min_samples_leaf': 2, 'min_weight_fraction_leaf': 0.02702606895912642, 'min_impurity_decrease': 0.4016860241421706, 'max_features': 0.6933455602561978, 'subsample': 0.14007590911655265, 'dropout_rate': 0.8003446433526618, 'ccp_alpha': 0.08581298598354412}. Best is trial 712 with value: 0.7824105962295036.[0m
[32m[I 2022-04-15 14:39:20,615][0m Trial 941 finished with value: 0.7597624697080132 and parameters: {'loss': 'coxph', 'learning_rate': 0.001608970245257247, 'n_estimators': 758, 'criterion': 'friedman_mse', 'min_samples_split': 8, 'min_samples_leaf': 2, 'min_weight_fraction_leaf': 0.0159623137063597, 'min_impurity_decrease': 0.3889753567015161, 'max_features': 0.7021076067955335, 'subsample': 0.1094892895016693, 'dropout_rate': 0.8909052427480946, 'ccp_alpha': 0.0917778458677009}. Best is trial 712 with value: 0.7824105962295036.[0m
[32m[I 2022-04-15 14:40:43,624][0m Trial 942 finished with value: 0.6743624146605087 and parameters: {'loss': 'coxph', 'learning_rate': 3.1668084406750885e-05, 'n_estimators': 730, 'criterion': 'friedman_mse', 'min_samples_split': 8, 'min_samples_leaf': 2, 'min_weight_fraction_leaf': 0.03073025980743293, 'min_impurity_decrease': 0.40220456111745095, 'max_features': 0.7106962485034338, 'subsample': 0.08965061850838514, 'dropout_rate': 0.8760683945923254, 'ccp_alpha': 0.2567675827130751}. Best is trial 712 with value: 0.7824105962295036.[0m
[32m[I 2022-04-15 14:42:08,419][0m Trial 943 finished with value: 0.5 and parameters: {'loss': 'coxph', 'learning_rate': 0.0012601572144645163, 'n_estimators': 703, 'criterion': 'absolute_error', 'min_samples_split': 8, 'min_samples_leaf': 2, 'min_weight_fraction_leaf': 0.034745825071445136, 'min_impurity_decrease': 0.4275465446248154, 'max_features': 0.7228548595589825, 'subsample': 0.1183869529138681, 'dropout_rate': 0.8371402607371153, 'ccp_alpha': 4.539391652292071}. Best is trial 712 with value: 0.7824105962295036.[0m
[32m[I 2022-04-15 14:43:30,382][0m Trial 944 finished with value: 0.7789658623007294 and parameters: {'loss': 'coxph', 'learning_rate': 0.0002768827995580169, 'n_estimators': 765, 'criterion': 'friedman_mse', 'min_samples_split': 8, 'min_samples_leaf': 2, 'min_weight_fraction_leaf': 0.023913219870629762, 'min_impurity_decrease': 0.38599700013476124, 'max_features': 0.7296505517389998, 'subsample': 0.15952573908891357, 'dropout_rate': 0.9105993889872213, 'ccp_alpha': 0.005125922052866699}. Best is trial 712 with value: 0.7824105962295036.[0m
[32m[I 2022-04-15 14:45:31,602][0m Trial 945 finished with value: 0.777719070489282 and parameters: {'loss': 'coxph', 'learning_rate': 0.0004056142627836229, 'n_estimators': 856, 'criterion': 'friedman_mse', 'min_samples_split': 8, 'min_samples_leaf': 2, 'min_weight_fraction_leaf': 0.013362086217271902, 'min_impurity_decrease': 0.3615966280236851, 'max_features': 0.6802722625249799, 'subsample': 0.15231993721924775, 'dropout_rate': 0.8089732525766402, 'ccp_alpha': 0.004154642051964896}. Best is trial 712 with value: 0.7824105962295036.[0m
[32m[I 2022-04-15 14:46:34,319][0m Trial 946 finished with value: 0.6930640133523541 and parameters: {'loss': 'coxph', 'learning_rate': 0.00023740271696891574, 'n_estimators': 707, 'criterion': 'friedman_mse', 'min_samples_split': 8, 'min_samples_leaf': 2, 'min_weight_fraction_leaf': 0.01793278232249266, 'min_impurity_decrease': 0.3800612244053284, 'max_features': 0.6954446884470127, 'subsample': 0.1953847422605106, 'dropout_rate': 0.9568664047926058, 'ccp_alpha': 0.16534769162003954}. Best is trial 712 with value: 0.7824105962295036.[0m
[32m[I 2022-04-15 14:47:04,197][0m Trial 947 finished with value: 0.5 and parameters: {'loss': 'squared', 'learning_rate': 0.0008688801964026057, 'n_estimators': 808, 'criterion': 'friedman_mse', 'min_samples_split': 8, 'min_samples_leaf': 2, 'min_weight_fraction_leaf': 0.026617385928965613, 'min_impurity_decrease': 0.39670982232820384, 'max_features': 0.6593697869114892, 'subsample': 0.13674395926533428, 'dropout_rate': 0.908091834079613, 'ccp_alpha': 4.145513157592754}. Best is trial 712 with value: 0.7824105962295036.[0m
[32m[I 2022-04-15 14:48:24,870][0m Trial 948 finished with value: 0.77950625819868 and parameters: {'loss': 'coxph', 'learning_rate': 0.00012330730610880222, 'n_estimators': 771, 'criterion': 'friedman_mse', 'min_samples_split': 8, 'min_samples_leaf': 2, 'min_weight_fraction_leaf': 0.02837835835213383, 'min_impurity_decrease': 0.41051508494599137, 'max_features': 0.7096169652868672, 'subsample': 0.1707912241213467, 'dropout_rate': 0.917626538088088, 'ccp_alpha': 0.001221038109934367}. Best is trial 712 with value: 0.7824105962295036.[0m
[32m[I 2022-04-15 14:49:48,825][0m Trial 949 finished with value: 0.5 and parameters: {'loss': 'coxph', 'learning_rate': 0.00012699972849359225, 'n_estimators': 800, 'criterion': 'friedman_mse', 'min_samples_split': 8, 'min_samples_leaf': 2, 'min_weight_fraction_leaf': 0.00846335718154111, 'min_impurity_decrease': 0.4140863291096808, 'max_features': 0.7291240763153214, 'subsample': 0.17366122352348834, 'dropout_rate': 0.8985606110490946, 'ccp_alpha': 0.36599717866936515}. Best is trial 712 with value: 0.7824105962295036.[0m
[32m[I 2022-04-15 14:50:57,528][0m Trial 950 finished with value: 0.6838981470077372 and parameters: {'loss': 'coxph', 'learning_rate': 0.0001385296713444206, 'n_estimators': 738, 'criterion': 'friedman_mse', 'min_samples_split': 8, 'min_samples_leaf': 2, 'min_weight_fraction_leaf': 0.017518158462720784, 'min_impurity_decrease': 0.4237860976685584, 'max_features': 0.6929610657832468, 'subsample': 0.22643106856715334, 'dropout_rate': 0.9322984969416956, 'ccp_alpha': 0.1697915830643126}. Best is trial 712 with value: 0.7824105962295036.[0m
[32m[I 2022-04-15 14:52:14,324][0m Trial 951 finished with value: 0.7605304337013324 and parameters: {'loss': 'coxph', 'learning_rate': 0.0006934099648163567, 'n_estimators': 738, 'criterion': 'friedman_mse', 'min_samples_split': 8, 'min_samples_leaf': 2, 'min_weight_fraction_leaf': 0.020598436719583717, 'min_impurity_decrease': 0.41010825031976084, 'max_features': 0.7320356913390416, 'subsample': 0.16429754866730495, 'dropout_rate': 0.9134760755502633, 'ccp_alpha': 0.09935359660613721}. Best is trial 712 with value: 0.7824105962295036.[0m
[32m[I 2022-04-15 14:53:34,561][0m Trial 952 finished with value: 0.7793177474161593 and parameters: {'loss': 'coxph', 'learning_rate': 0.0001261409224861541, 'n_estimators': 811, 'criterion': 'friedman_mse', 'min_samples_split': 8, 'min_samples_leaf': 2, 'min_weight_fraction_leaf': 0.031427468826262524, 'min_impurity_decrease': 0.42816113465865985, 'max_features': 0.7209569998045331, 'subsample': 0.18402565632339626, 'dropout_rate': 0.9406019308084681, 'ccp_alpha': 0.0012256029491322493}. Best is trial 712 with value: 0.7824105962295036.[0m
[32m[I 2022-04-15 14:55:04,594][0m Trial 953 finished with value: 0.6743624146605087 and parameters: {'loss': 'coxph', 'learning_rate': 7.303517166947817e-05, 'n_estimators': 946, 'criterion': 'friedman_mse', 'min_samples_split': 8, 'min_samples_leaf': 2, 'min_weight_fraction_leaf': 0.027546934941112204, 'min_impurity_decrease': 0.3844955300371599, 'max_features': 0.6721329500146515, 'subsample': 0.18824667993048244, 'dropout_rate': 0.9519567575580832, 'ccp_alpha': 0.24581779287212777}. Best is trial 712 with value: 0.7824105962295036.[0m
[32m[I 2022-04-15 14:56:26,604][0m Trial 954 finished with value: 0.7588149949785863 and parameters: {'loss': 'coxph', 'learning_rate': 0.00010084320335749192, 'n_estimators': 831, 'criterion': 'friedman_mse', 'min_samples_split': 9, 'min_samples_leaf': 2, 'min_weight_fraction_leaf': 0.007237674728192062, 'min_impurity_decrease': 0.42519217246900365, 'max_features': 0.7091539321370517, 'subsample': 0.21342725172051677, 'dropout_rate': 0.9213296411782845, 'ccp_alpha': 0.09042119794803467}. Best is trial 712 with value: 0.7824105962295036.[0m
[32m[I 2022-04-15 14:58:07,449][0m Trial 955 finished with value: 0.5 and parameters: {'loss': 'coxph', 'learning_rate': 0.00026698009470852807, 'n_estimators': 887, 'criterion': 'squared_error', 'min_samples_split': 8, 'min_samples_leaf': 2, 'min_weight_fraction_leaf': 0.03339485636239969, 'min_impurity_decrease': 0.40101198410633226, 'max_features': 0.6892490885352536, 'subsample': 0.15585727995579682, 'dropout_rate': 0.8817763689847238, 'ccp_alpha': 0.16303370998962413}. Best is trial 712 with value: 0.7824105962295036.[0m
[32m[I 2022-04-15 14:59:22,938][0m Trial 956 finished with value: 0.7611709415108103 and parameters: {'loss': 'coxph', 'learning_rate': 0.00018850656323137884, 'n_estimators': 765, 'criterion': 'friedman_mse', 'min_samples_split': 8, 'min_samples_leaf': 2, 'min_weight_fraction_leaf': 0.023835077689351516, 'min_impurity_decrease': 0.3599094411702204, 'max_features': 0.7123560244646228, 'subsample': 0.1307206815875978, 'dropout_rate': 0.9375725955219212, 'ccp_alpha': 0.09107865758782116}. Best is trial 712 with value: 0.7824105962295036.[0m
[32m[I 2022-04-15 15:00:45,467][0m Trial 957 finished with value: 0.6743624146605087 and parameters: {'loss': 'coxph', 'learning_rate': 9.305549225730437e-05, 'n_estimators': 827, 'criterion': 'friedman_mse', 'min_samples_split': 8, 'min_samples_leaf': 2, 'min_weight_fraction_leaf': 0.03134967448871034, 'min_impurity_decrease': 0.4291025417039178, 'max_features': 0.7228508988001411, 'subsample': 0.09380313747956552, 'dropout_rate': 0.9543721820678095, 'ccp_alpha': 0.2989542370072057}. Best is trial 712 with value: 0.7824105962295036.[0m
[32m[I 2022-04-15 15:02:01,405][0m Trial 958 finished with value: 0.7796294077661267 and parameters: {'loss': 'coxph', 'learning_rate': 0.0001094449078568717, 'n_estimators': 780, 'criterion': 'friedman_mse', 'min_samples_split': 8, 'min_samples_leaf': 2, 'min_weight_fraction_leaf': 0.001983699366547683, 'min_impurity_decrease': 0.16103233743109907, 'max_features': 0.6566232369906225, 'subsample': 0.15087525770850463, 'dropout_rate': 0.9715338744459819, 'ccp_alpha': 0.0019238629930299002}. Best is trial 712 with value: 0.7824105962295036.[0m
[32m[I 2022-04-15 15:03:10,675][0m Trial 959 finished with value: 0.6838981470077372 and parameters: {'loss': 'coxph', 'learning_rate': 5.671902329204245e-05, 'n_estimators': 789, 'criterion': 'friedman_mse', 'min_samples_split': 8, 'min_samples_leaf': 2, 'min_weight_fraction_leaf': 0.001602030322089918, 'min_impurity_decrease': 0.07361818664404061, 'max_features': 0.690098810847745, 'subsample': 0.18106947782675117, 'dropout_rate': 0.9832273611586247, 'ccp_alpha': 0.17449478642835833}. Best is trial 712 with value: 0.7824105962295036.[0m
[32m[I 2022-04-15 15:04:25,177][0m Trial 960 finished with value: 0.5 and parameters: {'loss': 'coxph', 'learning_rate': 0.00013547820379474493, 'n_estimators': 780, 'criterion': 'friedman_mse', 'min_samples_split': 8, 'min_samples_leaf': 2, 'min_weight_fraction_leaf': 0.009590695107249997, 'min_impurity_decrease': 0.38496255344749297, 'max_features': 0.6707158133447129, 'subsample': 0.14305466886511545, 'dropout_rate': 0.9610585051028444, 'ccp_alpha': 0.4826870084980443}. Best is trial 712 with value: 0.7824105962295036.[0m
[32m[I 2022-04-15 15:06:09,450][0m Trial 961 finished with value: 0.778000536838259 and parameters: {'loss': 'coxph', 'learning_rate': 0.00011772781475402417, 'n_estimators': 910, 'criterion': 'friedman_mse', 'min_samples_split': 8, 'min_samples_leaf': 2, 'min_weight_fraction_leaf': 0.012701523048529433, 'min_impurity_decrease': 0.18197270771167445, 'max_features': 0.6689070293176229, 'subsample': 0.11543981286117462, 'dropout_rate': 0.9275611596741282, 'ccp_alpha': 0.003783772782842607}. Best is trial 712 with value: 0.7824105962295036.[0m
[32m[I 2022-04-15 15:08:05,935][0m Trial 962 finished with value: 0.7795816372885181 and parameters: {'loss': 'coxph', 'learning_rate': 8.762849018643172e-05, 'n_estimators': 848, 'criterion': 'friedman_mse', 'min_samples_split': 8, 'min_samples_leaf': 2, 'min_weight_fraction_leaf': 0.017414552053173285, 'min_impurity_decrease': 0.40602528975212215, 'max_features': 0.6865468496167483, 'subsample': 0.17054624266934426, 'dropout_rate': 0.8604719585464539, 'ccp_alpha': 0.0016943062162840638}. Best is trial 712 with value: 0.7824105962295036.[0m
[32m[I 2022-04-15 15:09:22,712][0m Trial 963 finished with value: 0.7598185697074856 and parameters: {'loss': 'coxph', 'learning_rate': 9.870606290456152e-05, 'n_estimators': 847, 'criterion': 'friedman_mse', 'min_samples_split': 8, 'min_samples_leaf': 2, 'min_weight_fraction_leaf': 0.0038900167857750297, 'min_impurity_decrease': 0.40629250478060114, 'max_features': 0.6575056260383163, 'subsample': 0.1671851004355795, 'dropout_rate': 0.980765259005962, 'ccp_alpha': 0.0962297453121671}. Best is trial 712 with value: 0.7824105962295036.[0m
[32m[I 2022-04-15 15:10:30,414][0m Trial 964 finished with value: 0.5 and parameters: {'loss': 'coxph', 'learning_rate': 8.530483747266189e-05, 'n_estimators': 819, 'criterion': 'friedman_mse', 'min_samples_split': 8, 'min_samples_leaf': 2, 'min_weight_fraction_leaf': 0.012656786829787983, 'min_impurity_decrease': 0.3778300286417433, 'max_features': 0.6461894383268584, 'subsample': 0.20561638524328762, 'dropout_rate': 0.9887743516335081, 'ccp_alpha': 1.3474206821810153}. Best is trial 712 with value: 0.7824105962295036.[0m
[32m[I 2022-04-15 15:12:08,983][0m Trial 965 finished with value: 0.6743624146605087 and parameters: {'loss': 'coxph', 'learning_rate': 5.265943536892251e-05, 'n_estimators': 853, 'criterion': 'friedman_mse', 'min_samples_split': 8, 'min_samples_leaf': 2, 'min_weight_fraction_leaf': 0.008457341272614622, 'min_impurity_decrease': 0.1218365177533105, 'max_features': 0.6601993314294271, 'subsample': 0.16317133568498043, 'dropout_rate': 0.8627428035963662, 'ccp_alpha': 0.2291999368818778}. Best is trial 712 with value: 0.7824105962295036.[0m
[32m[I 2022-04-15 15:13:31,683][0m Trial 966 finished with value: 0.5 and parameters: {'loss': 'coxph', 'learning_rate': 6.240251028152499e-05, 'n_estimators': 786, 'criterion': 'absolute_error', 'min_samples_split': 9, 'min_samples_leaf': 2, 'min_weight_fraction_leaf': 0.019995949869490444, 'min_impurity_decrease': 0.4021664663175772, 'max_features': 0.6241766271916402, 'subsample': 0.18708620902014267, 'dropout_rate': 0.8945566661699833, 'ccp_alpha': 0.09038831599312813}. Best is trial 712 with value: 0.7824105962295036.[0m
[32m[I 2022-04-15 15:14:07,770][0m Trial 967 finished with value: 0.22028649721544252 and parameters: {'loss': 'squared', 'learning_rate': 4.7408590139537685e-05, 'n_estimators': 889, 'criterion': 'friedman_mse', 'min_samples_split': 8, 'min_samples_leaf': 2, 'min_weight_fraction_leaf': 0.001869540750910822, 'min_impurity_decrease': 0.14148880577068362, 'max_features': 0.6811913805203073, 'subsample': 0.13932233539493089, 'dropout_rate': 0.9194705114636735, 'ccp_alpha': 0.0015675389709329266}. Best is trial 712 with value: 0.7824105962295036.[0m
[32m[I 2022-04-15 15:15:36,838][0m Trial 968 finished with value: 0.7330941849857746 and parameters: {'loss': 'coxph', 'learning_rate': 0.00011383022821313957, 'n_estimators': 768, 'criterion': 'friedman_mse', 'min_samples_split': 8, 'min_samples_leaf': 2, 'min_weight_fraction_leaf': 0.02010824889270298, 'min_impurity_decrease': 0.36128806817308545, 'max_features': 0.6512046401155315, 'subsample': 0.14625934932187729, 'dropout_rate': 0.8573913593737262, 'ccp_alpha': 0.1624527556055791}. Best is trial 712 with value: 0.7824105962295036.[0m
[32m[I 2022-04-15 15:17:18,570][0m Trial 969 finished with value: 0.7607854521748856 and parameters: {'loss': 'coxph', 'learning_rate': 0.00015003980917214154, 'n_estimators': 831, 'criterion': 'friedman_mse', 'min_samples_split': 8, 'min_samples_leaf': 2, 'min_weight_fraction_leaf': 0.022408052895069752, 'min_impurity_decrease': 0.41690991457442445, 'max_features': 0.6757992343457545, 'subsample': 0.12525335979284621, 'dropout_rate': 0.8662455678085615, 'ccp_alpha': 0.09275604342161266}. Best is trial 712 with value: 0.7824105962295036.[0m
[32m[I 2022-04-15 15:18:39,761][0m Trial 970 finished with value: 0.6743624146605087 and parameters: {'loss': 'coxph', 'learning_rate': 6.976985782285922e-05, 'n_estimators': 756, 'criterion': 'friedman_mse', 'min_samples_split': 8, 'min_samples_leaf': 2, 'min_weight_fraction_leaf': 0.01490192184065636, 'min_impurity_decrease': 0.07382502489506501, 'max_features': 0.6916283339223079, 'subsample': 0.07145900849414165, 'dropout_rate': 0.9018497411370735, 'ccp_alpha': 0.32318962417629193}. Best is trial 712 with value: 0.7824105962295036.[0m
[32m[I 2022-04-15 15:20:01,141][0m Trial 971 finished with value: 0.5 and parameters: {'loss': 'coxph', 'learning_rate': 0.00017133958840091827, 'n_estimators': 819, 'criterion': 'friedman_mse', 'min_samples_split': 8, 'min_samples_leaf': 2, 'min_weight_fraction_leaf': 0.027659465890429464, 'min_impurity_decrease': 0.39105404710393754, 'max_features': 0.6994712644514881, 'subsample': 0.0994779986069056, 'dropout_rate': 0.9468321979509006, 'ccp_alpha': 0.8923154438958637}. Best is trial 712 with value: 0.7824105962295036.[0m
[32m[I 2022-04-15 15:21:21,097][0m Trial 972 finished with value: 0.6838981470077372 and parameters: {'loss': 'coxph', 'learning_rate': 9.805245756223696e-05, 'n_estimators': 876, 'criterion': 'friedman_mse', 'min_samples_split': 8, 'min_samples_leaf': 2, 'min_weight_fraction_leaf': 0.028398185318415505, 'min_impurity_decrease': 0.15114406340379577, 'max_features': 0.6918006016253995, 'subsample': 0.17499631098554128, 'dropout_rate': 0.9654596270554985, 'ccp_alpha': 0.18039622374979608}. Best is trial 712 with value: 0.7824105962295036.[0m
[32m[I 2022-04-15 15:23:00,292][0m Trial 973 finished with value: 0.7615399915313634 and parameters: {'loss': 'coxph', 'learning_rate': 7.970741466269212e-05, 'n_estimators': 784, 'criterion': 'friedman_mse', 'min_samples_split': 8, 'min_samples_leaf': 2, 'min_weight_fraction_leaf': 0.018944999980720547, 'min_impurity_decrease': 0.4247786959676698, 'max_features': 0.6780251225558889, 'subsample': 0.15469659296219682, 'dropout_rate': 0.8272952575585352, 'ccp_alpha': 0.09028170223981398}. Best is trial 712 with value: 0.7824105962295036.[0m
[32m[I 2022-04-15 15:24:29,085][0m Trial 974 finished with value: 0.7784029091111355 and parameters: {'loss': 'coxph', 'learning_rate': 9.072439518890884e-05, 'n_estimators': 757, 'criterion': 'friedman_mse', 'min_samples_split': 8, 'min_samples_leaf': 2, 'min_weight_fraction_leaf': 0.0029484598038565825, 'min_impurity_decrease': 0.40759806009932226, 'max_features': 0.7092069222625488, 'subsample': 0.12270911401168522, 'dropout_rate': 0.8804367517640341, 'ccp_alpha': 0.0014060426710257173}. Best is trial 712 with value: 0.7824105962295036.[0m
