[32m[I 2022-04-13 11:45:37,218][0m Trial 175 finished with value: 0.8827566500887588 and parameters: {'splitter': 'best', 'min_samples_split': 0.12157426131467358, 'min_samples_leaf': 0.010287080134190787, 'min_weight_fraction_leaf': 0.06484987934229859, 'max_features': 0.9809393214712988}. Best is trial 160 with value: 0.8861698281302243.[0m
/media/san2_ssd/data/Workdir/survival/utils.py:305: RuntimeWarning: invalid value encountered in true_divide
  pdfs = np.gradient(1-survs,axis=1)/norms
[32m[I 2022-04-13 11:45:40,080][0m Trial 176 finished with value: 0.8795521552328717 and parameters: {'splitter': 'best', 'min_samples_split': 0.17107659087377988, 'min_samples_leaf': 0.0012469968626417178, 'min_weight_fraction_leaf': 0.05413452789237142, 'max_features': 0.9653831946362489}. Best is trial 160 with value: 0.8861698281302243.[0m
[32m[I 2022-04-13 11:45:42,877][0m Trial 177 finished with value: 0.7857519525455213 and parameters: {'splitter': 'best', 'min_samples_split': 0.11294052150673572, 'min_samples_leaf': 0.011825803493178641, 'min_weight_fraction_leaf': 0.08399796932963711, 'max_features': 0.9983990886264588}. Best is trial 160 with value: 0.8861698281302243.[0m
[32m[I 2022-04-13 11:45:45,460][0m Trial 178 finished with value: 0.8818994321240806 and parameters: {'splitter': 'best', 'min_samples_split': 0.1485979679031058, 'min_samples_leaf': 0.012619265651079101, 'min_weight_fraction_leaf': 0.06409668358892623, 'max_features': 0.9647117271684208}. Best is trial 160 with value: 0.8861698281302243.[0m
/media/san2_ssd/data/Workdir/survival/utils.py:305: RuntimeWarning: invalid value encountered in true_divide
  pdfs = np.gradient(1-survs,axis=1)/norms
/media/san2_ssd/data/Workdir/survival/utils.py:305: RuntimeWarning: invalid value encountered in true_divide
  pdfs = np.gradient(1-survs,axis=1)/norms
/media/san2_ssd/data/Workdir/survival/utils.py:305: RuntimeWarning: invalid value encountered in true_divide
  pdfs = np.gradient(1-survs,axis=1)/norms
/media/san2_ssd/data/Workdir/survival/utils.py:305: RuntimeWarning: invalid value encountered in true_divide
  pdfs = np.gradient(1-survs,axis=1)/norms
[32m[I 2022-04-13 11:45:46,772][0m Trial 179 finished with value: 0.8862152259849732 and parameters: {'splitter': 'best', 'min_samples_split': 0.12818158585225195, 'min_samples_leaf': 0.0010753086388111054, 'min_weight_fraction_leaf': 0.04262975361184387, 'max_features': 0.9790185457449754}. Best is trial 179 with value: 0.8862152259849732.[0m
/media/san2_ssd/data/Workdir/survival/utils.py:305: RuntimeWarning: invalid value encountered in true_divide
  pdfs = np.gradient(1-survs,axis=1)/norms
/media/san2_ssd/data/Workdir/survival/utils.py:305: RuntimeWarning: invalid value encountered in true_divide
  pdfs = np.gradient(1-survs,axis=1)/norms
/media/san2_ssd/data/Workdir/survival/utils.py:305: RuntimeWarning: invalid value encountered in true_divide
  pdfs = np.gradient(1-survs,axis=1)/norms
/media/san2_ssd/data/Workdir/survival/utils.py:305: RuntimeWarning: invalid value encountered in true_divide
  pdfs = np.gradient(1-survs,axis=1)/norms
[32m[I 2022-04-13 11:45:48,106][0m Trial 180 finished with value: 0.8837733489079114 and parameters: {'splitter': 'best', 'min_samples_split': 0.1250542064763476, 'min_samples_leaf': 0.02350177100047711, 'min_weight_fraction_leaf': 0.04348553601078172, 'max_features': 0.9443267060137541}. Best is trial 179 with value: 0.8862152259849732.[0m
/media/san2_ssd/data/Workdir/survival/utils.py:305: RuntimeWarning: invalid value encountered in true_divide
  pdfs = np.gradient(1-survs,axis=1)/norms
/media/san2_ssd/data/Workdir/survival/utils.py:305: RuntimeWarning: invalid value encountered in true_divide
  pdfs = np.gradient(1-survs,axis=1)/norms
[32m[I 2022-04-13 11:45:49,974][0m Trial 181 finished with value: 0.885628898009227 and parameters: {'splitter': 'best', 'min_samples_split': 0.13446794616144617, 'min_samples_leaf': 0.0014644361045935256, 'min_weight_fraction_leaf': 0.05617618560518958, 'max_features': 0.9790729484620583}. Best is trial 179 with value: 0.8862152259849732.[0m
/media/san2_ssd/data/Workdir/survival/utils.py:305: RuntimeWarning: invalid value encountered in true_divide
  pdfs = np.gradient(1-survs,axis=1)/norms
/media/san2_ssd/data/Workdir/survival/utils.py:305: RuntimeWarning: invalid value encountered in true_divide
  pdfs = np.gradient(1-survs,axis=1)/norms
[32m[I 2022-04-13 11:45:51,950][0m Trial 182 finished with value: 0.786901769865304 and parameters: {'splitter': 'best', 'min_samples_split': 0.14383148402352455, 'min_samples_leaf': 0.0016574462234799781, 'min_weight_fraction_leaf': 0.04218105728130292, 'max_features': 0.9761988466949788}. Best is trial 179 with value: 0.8862152259849732.[0m
[32m[I 2022-04-13 11:45:53,378][0m Trial 183 finished with value: 0.7845663672563099 and parameters: {'splitter': 'best', 'min_samples_split': 0.11612366814349882, 'min_samples_leaf': 0.017702307201135047, 'min_weight_fraction_leaf': 0.07411663465226534, 'max_features': 0.9827530974387235}. Best is trial 179 with value: 0.8862152259849732.[0m
[32m[I 2022-04-13 11:45:55,041][0m Trial 184 finished with value: 0.8802665313434165 and parameters: {'splitter': 'best', 'min_samples_split': 0.15738672973705312, 'min_samples_leaf': 0.01276724124772699, 'min_weight_fraction_leaf': 0.06216690026628152, 'max_features': 0.9602708971347749}. Best is trial 179 with value: 0.8862152259849732.[0m
/media/san2_ssd/data/Workdir/survival/utils.py:305: RuntimeWarning: invalid value encountered in true_divide
  pdfs = np.gradient(1-survs,axis=1)/norms
/media/san2_ssd/data/Workdir/survival/utils.py:305: RuntimeWarning: invalid value encountered in true_divide
  pdfs = np.gradient(1-survs,axis=1)/norms
[32m[I 2022-04-13 11:45:56,458][0m Trial 185 finished with value: 0.8852711515616823 and parameters: {'splitter': 'best', 'min_samples_split': 0.1326780243013451, 'min_samples_leaf': 0.023403268065938298, 'min_weight_fraction_leaf': 0.053677000917043985, 'max_features': 0.9834975473842471}. Best is trial 179 with value: 0.8862152259849732.[0m
/media/san2_ssd/data/Workdir/survival/utils.py:305: RuntimeWarning: invalid value encountered in true_divide
  pdfs = np.gradient(1-survs,axis=1)/norms
/media/san2_ssd/data/Workdir/survival/utils.py:305: RuntimeWarning: invalid value encountered in true_divide
  pdfs = np.gradient(1-survs,axis=1)/norms
/media/san2_ssd/data/Workdir/survival/utils.py:305: RuntimeWarning: invalid value encountered in true_divide
  pdfs = np.gradient(1-survs,axis=1)/norms
[32m[I 2022-04-13 11:45:58,821][0m Trial 186 finished with value: 0.8827126458172483 and parameters: {'splitter': 'best', 'min_samples_split': 0.1209902840802673, 'min_samples_leaf': 0.001597364713666114, 'min_weight_fraction_leaf': 0.04808378080523302, 'max_features': 0.9433420387178408}. Best is trial 179 with value: 0.8862152259849732.[0m
[32m[I 2022-04-13 11:46:00,234][0m Trial 187 finished with value: 0.4625505324749512 and parameters: {'splitter': 'best', 'min_samples_split': 0.13806352969293484, 'min_samples_leaf': 0.01462232122029743, 'min_weight_fraction_leaf': 0.24940008459327517, 'max_features': 0.9999263709933365}. Best is trial 179 with value: 0.8862152259849732.[0m
[32m[I 2022-04-13 11:46:03,277][0m Trial 188 finished with value: 0.7771640036166199 and parameters: {'splitter': 'best', 'min_samples_split': 0.17014175451818764, 'min_samples_leaf': 0.025231469530310177, 'min_weight_fraction_leaf': 0.09491741412098889, 'max_features': 0.9652656493978502}. Best is trial 179 with value: 0.8862152259849732.[0m
/media/san2_ssd/data/Workdir/survival/utils.py:305: RuntimeWarning: invalid value encountered in true_divide
  pdfs = np.gradient(1-survs,axis=1)/norms
/media/san2_ssd/data/Workdir/survival/utils.py:305: RuntimeWarning: invalid value encountered in true_divide
  pdfs = np.gradient(1-survs,axis=1)/norms
/media/san2_ssd/data/Workdir/survival/utils.py:305: RuntimeWarning: invalid value encountered in true_divide
  pdfs = np.gradient(1-survs,axis=1)/norms
/media/san2_ssd/data/Workdir/survival/utils.py:305: RuntimeWarning: invalid value encountered in true_divide
  pdfs = np.gradient(1-survs,axis=1)/norms
[32m[I 2022-04-13 11:46:05,708][0m Trial 189 finished with value: 0.8841805437609545 and parameters: {'splitter': 'best', 'min_samples_split': 0.1098666225720468, 'min_samples_leaf': 0.009855500989804526, 'min_weight_fraction_leaf': 0.037769674174471954, 'max_features': 0.937478161027673}. Best is trial 179 with value: 0.8862152259849732.[0m
[32m[I 2022-04-13 11:46:07,502][0m Trial 190 finished with value: 0.7856273713682678 and parameters: {'splitter': 'best', 'min_samples_split': 0.15207568280274963, 'min_samples_leaf': 0.0188558908024645, 'min_weight_fraction_leaf': 0.07770534571205275, 'max_features': 0.9797893147770773}. Best is trial 179 with value: 0.8862152259849732.[0m
/media/san2_ssd/data/Workdir/survival/utils.py:305: RuntimeWarning: invalid value encountered in true_divide
  pdfs = np.gradient(1-survs,axis=1)/norms
/media/san2_ssd/data/Workdir/survival/utils.py:305: RuntimeWarning: invalid value encountered in true_divide
  pdfs = np.gradient(1-survs,axis=1)/norms
[32m[I 2022-04-13 11:46:09,820][0m Trial 191 finished with value: 0.88526113198411 and parameters: {'splitter': 'best', 'min_samples_split': 0.12933102847924327, 'min_samples_leaf': 0.026884137137712476, 'min_weight_fraction_leaf': 0.05498614115914474, 'max_features': 0.9834652975176407}. Best is trial 179 with value: 0.8862152259849732.[0m
[32m[I 2022-04-13 11:46:12,327][0m Trial 192 finished with value: 0.883412340557528 and parameters: {'splitter': 'best', 'min_samples_split': 0.13501376844985077, 'min_samples_leaf': 0.0017298477016992973, 'min_weight_fraction_leaf': 0.06555899642713778, 'max_features': 0.9616365193231393}. Best is trial 179 with value: 0.8862152259849732.[0m
/media/san2_ssd/data/Workdir/survival/utils.py:305: RuntimeWarning: invalid value encountered in true_divide
  pdfs = np.gradient(1-survs,axis=1)/norms
/media/san2_ssd/data/Workdir/survival/utils.py:305: RuntimeWarning: invalid value encountered in true_divide
  pdfs = np.gradient(1-survs,axis=1)/norms
/media/san2_ssd/data/Workdir/survival/utils.py:305: RuntimeWarning: invalid value encountered in true_divide
  pdfs = np.gradient(1-survs,axis=1)/norms
[32m[I 2022-04-13 11:46:15,412][0m Trial 193 finished with value: 0.8854832260262091 and parameters: {'splitter': 'best', 'min_samples_split': 0.12461817383079368, 'min_samples_leaf': 0.013692068244076818, 'min_weight_fraction_leaf': 0.05078835163269958, 'max_features': 0.9843032846566466}. Best is trial 179 with value: 0.8862152259849732.[0m
/media/san2_ssd/data/Workdir/survival/utils.py:305: RuntimeWarning: invalid value encountered in true_divide
  pdfs = np.gradient(1-survs,axis=1)/norms
/media/san2_ssd/data/Workdir/survival/utils.py:305: RuntimeWarning: invalid value encountered in true_divide
  pdfs = np.gradient(1-survs,axis=1)/norms
/media/san2_ssd/data/Workdir/survival/utils.py:305: RuntimeWarning: invalid value encountered in true_divide
  pdfs = np.gradient(1-survs,axis=1)/norms
/media/san2_ssd/data/Workdir/survival/utils.py:305: RuntimeWarning: invalid value encountered in true_divide
  pdfs = np.gradient(1-survs,axis=1)/norms
[32m[I 2022-04-13 11:46:18,856][0m Trial 194 finished with value: 0.8874414760441676 and parameters: {'splitter': 'best', 'min_samples_split': 0.11988526115369876, 'min_samples_leaf': 0.011394113439489893, 'min_weight_fraction_leaf': 0.03997838525967428, 'max_features': 0.9987173844031478}. Best is trial 194 with value: 0.8874414760441676.[0m
/media/san2_ssd/data/Workdir/survival/utils.py:305: RuntimeWarning: invalid value encountered in true_divide
  pdfs = np.gradient(1-survs,axis=1)/norms
/media/san2_ssd/data/Workdir/survival/utils.py:305: RuntimeWarning: invalid value encountered in true_divide
  pdfs = np.gradient(1-survs,axis=1)/norms
/media/san2_ssd/data/Workdir/survival/utils.py:305: RuntimeWarning: invalid value encountered in true_divide
  pdfs = np.gradient(1-survs,axis=1)/norms
/media/san2_ssd/data/Workdir/survival/utils.py:305: RuntimeWarning: invalid value encountered in true_divide
  pdfs = np.gradient(1-survs,axis=1)/norms
[32m[I 2022-04-13 11:46:21,810][0m Trial 195 finished with value: 0.887463563770632 and parameters: {'splitter': 'best', 'min_samples_split': 0.11544841910601569, 'min_samples_leaf': 0.012042319600551545, 'min_weight_fraction_leaf': 0.03833809172111885, 'max_features': 0.996650183698604}. Best is trial 195 with value: 0.887463563770632.[0m
/media/san2_ssd/data/Workdir/survival/utils.py:305: RuntimeWarning: invalid value encountered in true_divide
  pdfs = np.gradient(1-survs,axis=1)/norms
/media/san2_ssd/data/Workdir/survival/utils.py:305: RuntimeWarning: invalid value encountered in true_divide
  pdfs = np.gradient(1-survs,axis=1)/norms
/media/san2_ssd/data/Workdir/survival/utils.py:305: RuntimeWarning: invalid value encountered in true_divide
  pdfs = np.gradient(1-survs,axis=1)/norms
/media/san2_ssd/data/Workdir/survival/utils.py:305: RuntimeWarning: invalid value encountered in true_divide
  pdfs = np.gradient(1-survs,axis=1)/norms
[32m[I 2022-04-13 11:46:24,407][0m Trial 196 finished with value: 0.8843313536812085 and parameters: {'splitter': 'best', 'min_samples_split': 0.10830721619016685, 'min_samples_leaf': 0.013096191292833927, 'min_weight_fraction_leaf': 0.03945155343474702, 'max_features': 0.9431786826138754}. Best is trial 195 with value: 0.887463563770632.[0m
[32m[I 2022-04-13 11:46:25,504][0m Trial 197 finished with value: 0.696545040899416 and parameters: {'splitter': 'best', 'min_samples_split': 0.11673176366074915, 'min_samples_leaf': 0.0010441186980224906, 'min_weight_fraction_leaf': 0.39448145443676125, 'max_features': 0.9580646451084974}. Best is trial 195 with value: 0.887463563770632.[0m
/media/san2_ssd/data/Workdir/survival/utils.py:305: RuntimeWarning: invalid value encountered in true_divide
  pdfs = np.gradient(1-survs,axis=1)/norms
[32m[I 2022-04-13 11:46:26,801][0m Trial 198 finished with value: 0.8867789710995615 and parameters: {'splitter': 'best', 'min_samples_split': 0.14549841827413545, 'min_samples_leaf': 0.01899126177036235, 'min_weight_fraction_leaf': 0.033109138438882475, 'max_features': 0.9829214163008416}. Best is trial 195 with value: 0.887463563770632.[0m
/media/san2_ssd/data/Workdir/survival/utils.py:305: RuntimeWarning: invalid value encountered in true_divide
  pdfs = np.gradient(1-survs,axis=1)/norms
[32m[I 2022-04-13 11:46:28,820][0m Trial 199 finished with value: 0.88170908167111 and parameters: {'splitter': 'best', 'min_samples_split': 0.14441989643357556, 'min_samples_leaf': 0.018724361674032394, 'min_weight_fraction_leaf': 0.03448235734054702, 'max_features': 0.9587883206392206}. Best is trial 195 with value: 0.887463563770632.[0m
/media/san2_ssd/data/Workdir/survival/utils.py:305: RuntimeWarning: invalid value encountered in true_divide
  pdfs = np.gradient(1-survs,axis=1)/norms
/media/san2_ssd/data/Workdir/survival/utils.py:305: RuntimeWarning: invalid value encountered in true_divide
  pdfs = np.gradient(1-survs,axis=1)/norms
/media/san2_ssd/data/Workdir/survival/utils.py:305: RuntimeWarning: invalid value encountered in true_divide
  pdfs = np.gradient(1-survs,axis=1)/norms
/media/san2_ssd/data/Workdir/survival/utils.py:305: RuntimeWarning: invalid value encountered in true_divide
  pdfs = np.gradient(1-survs,axis=1)/norms
[32m[I 2022-04-13 11:46:31,190][0m Trial 200 finished with value: 0.8874963569996958 and parameters: {'splitter': 'best', 'min_samples_split': 0.11922448598496628, 'min_samples_leaf': 0.015174676462753733, 'min_weight_fraction_leaf': 0.0354866452851634, 'max_features': 0.9856027628758152}. Best is trial 200 with value: 0.8874963569996958.[0m
/media/san2_ssd/data/Workdir/survival/utils.py:305: RuntimeWarning: invalid value encountered in true_divide
  pdfs = np.gradient(1-survs,axis=1)/norms
/media/san2_ssd/data/Workdir/survival/utils.py:305: RuntimeWarning: invalid value encountered in true_divide
  pdfs = np.gradient(1-survs,axis=1)/norms
/media/san2_ssd/data/Workdir/survival/utils.py:305: RuntimeWarning: invalid value encountered in true_divide
  pdfs = np.gradient(1-survs,axis=1)/norms
/media/san2_ssd/data/Workdir/survival/utils.py:305: RuntimeWarning: invalid value encountered in true_divide
  pdfs = np.gradient(1-survs,axis=1)/norms
/media/san2_ssd/data/Workdir/survival/utils.py:305: RuntimeWarning: invalid value encountered in true_divide
  pdfs = np.gradient(1-survs,axis=1)/norms
[32m[I 2022-04-13 11:46:33,197][0m Trial 201 finished with value: 0.8881217621713932 and parameters: {'splitter': 'best', 'min_samples_split': 0.11678078886570666, 'min_samples_leaf': 0.014637112155422596, 'min_weight_fraction_leaf': 0.0333203137715266, 'max_features': 0.9975093485356784}. Best is trial 201 with value: 0.8881217621713932.[0m
/media/san2_ssd/data/Workdir/survival/utils.py:305: RuntimeWarning: invalid value encountered in true_divide
  pdfs = np.gradient(1-survs,axis=1)/norms
/media/san2_ssd/data/Workdir/survival/utils.py:305: RuntimeWarning: invalid value encountered in true_divide
  pdfs = np.gradient(1-survs,axis=1)/norms
/media/san2_ssd/data/Workdir/survival/utils.py:305: RuntimeWarning: invalid value encountered in true_divide
  pdfs = np.gradient(1-survs,axis=1)/norms
/media/san2_ssd/data/Workdir/survival/utils.py:305: RuntimeWarning: invalid value encountered in true_divide
  pdfs = np.gradient(1-survs,axis=1)/norms
/media/san2_ssd/data/Workdir/survival/utils.py:305: RuntimeWarning: invalid value encountered in true_divide
  pdfs = np.gradient(1-survs,axis=1)/norms
[32m[I 2022-04-13 11:46:35,236][0m Trial 202 finished with value: 0.8863721946582037 and parameters: {'splitter': 'best', 'min_samples_split': 0.10745229526915924, 'min_samples_leaf': 0.01696813393829855, 'min_weight_fraction_leaf': 0.030790545744637614, 'max_features': 0.9841395248118482}. Best is trial 201 with value: 0.8881217621713932.[0m
/media/san2_ssd/data/Workdir/survival/utils.py:305: RuntimeWarning: invalid value encountered in true_divide
  pdfs = np.gradient(1-survs,axis=1)/norms
/media/san2_ssd/data/Workdir/survival/utils.py:305: RuntimeWarning: invalid value encountered in true_divide
  pdfs = np.gradient(1-survs,axis=1)/norms
/media/san2_ssd/data/Workdir/survival/utils.py:305: RuntimeWarning: invalid value encountered in true_divide
  pdfs = np.gradient(1-survs,axis=1)/norms
/media/san2_ssd/data/Workdir/survival/utils.py:305: RuntimeWarning: invalid value encountered in true_divide
  pdfs = np.gradient(1-survs,axis=1)/norms
[32m[I 2022-04-13 11:46:37,975][0m Trial 203 finished with value: 0.8843050918311242 and parameters: {'splitter': 'best', 'min_samples_split': 0.10712766573122806, 'min_samples_leaf': 0.024558006918249952, 'min_weight_fraction_leaf': 0.03311908096869541, 'max_features': 0.9659054887628362}. Best is trial 201 with value: 0.8881217621713932.[0m
/media/san2_ssd/data/Workdir/survival/utils.py:305: RuntimeWarning: invalid value encountered in true_divide
  pdfs = np.gradient(1-survs,axis=1)/norms
/media/san2_ssd/data/Workdir/survival/utils.py:305: RuntimeWarning: invalid value encountered in true_divide
  pdfs = np.gradient(1-survs,axis=1)/norms
/media/san2_ssd/data/Workdir/survival/utils.py:305: RuntimeWarning: invalid value encountered in true_divide
  pdfs = np.gradient(1-survs,axis=1)/norms
[32m[I 2022-04-13 11:46:41,306][0m Trial 204 finished with value: 0.8831703158709004 and parameters: {'splitter': 'best', 'min_samples_split': 0.11205849797028361, 'min_samples_leaf': 0.016954554600752198, 'min_weight_fraction_leaf': 0.03207354133810848, 'max_features': 0.9296194389952477}. Best is trial 201 with value: 0.8881217621713932.[0m
/media/san2_ssd/data/Workdir/survival/utils.py:305: RuntimeWarning: invalid value encountered in true_divide
  pdfs = np.gradient(1-survs,axis=1)/norms
/media/san2_ssd/data/Workdir/survival/utils.py:305: RuntimeWarning: invalid value encountered in true_divide
  pdfs = np.gradient(1-survs,axis=1)/norms
[32m[I 2022-04-13 11:46:42,749][0m Trial 205 finished with value: 0.7868909629507603 and parameters: {'splitter': 'best', 'min_samples_split': 0.1418038913307495, 'min_samples_leaf': 0.0297580789714704, 'min_weight_fraction_leaf': 0.0400545670635542, 'max_features': 0.9985779716856898}. Best is trial 201 with value: 0.8881217621713932.[0m
/media/san2_ssd/data/Workdir/survival/utils.py:305: RuntimeWarning: invalid value encountered in true_divide
  pdfs = np.gradient(1-survs,axis=1)/norms
/media/san2_ssd/data/Workdir/survival/utils.py:305: RuntimeWarning: invalid value encountered in true_divide
  pdfs = np.gradient(1-survs,axis=1)/norms
/media/san2_ssd/data/Workdir/survival/utils.py:305: RuntimeWarning: invalid value encountered in true_divide
  pdfs = np.gradient(1-survs,axis=1)/norms
/media/san2_ssd/data/Workdir/survival/utils.py:305: RuntimeWarning: invalid value encountered in true_divide
  pdfs = np.gradient(1-survs,axis=1)/norms
/media/san2_ssd/data/Workdir/survival/utils.py:305: RuntimeWarning: invalid value encountered in true_divide
  pdfs = np.gradient(1-survs,axis=1)/norms
