[32m[I 2022-04-13 15:19:45,631][0m Trial 126 finished with value: 0.25 and parameters: {'loss': 'coxph', 'learning_rate': 0.000274587637779562, 'n_estimators': 227, 'criterion': 'friedman_mse', 'min_samples_split': 7, 'min_samples_leaf': 4, 'min_weight_fraction_leaf': 0.450559248296916, 'min_impurity_decrease': 0.16858886141646967, 'max_features': 0.5810217110572085, 'subsample': 0.5856649131084396, 'dropout_rate': 0.6387424434542047, 'ccp_alpha': 4.728284685687841}. Best is trial 4 with value: 0.25.[0m
[32m[I 2022-04-13 15:20:53,384][0m Trial 127 finished with value: 0.25 and parameters: {'loss': 'coxph', 'learning_rate': 3.5076734223931024e-05, 'n_estimators': 284, 'criterion': 'friedman_mse', 'min_samples_split': 7, 'min_samples_leaf': 4, 'min_weight_fraction_leaf': 0.4067211829649237, 'min_impurity_decrease': 0.11011144047760654, 'max_features': 0.005479840336282969, 'subsample': 0.6359775947493155, 'dropout_rate': 0.5822807106140444, 'ccp_alpha': 4.980334934088285}. Best is trial 4 with value: 0.25.[0m
[32m[I 2022-04-13 15:22:00,199][0m Trial 128 finished with value: 0.25 and parameters: {'loss': 'coxph', 'learning_rate': 3.657208582274899e-06, 'n_estimators': 262, 'criterion': 'friedman_mse', 'min_samples_split': 6, 'min_samples_leaf': 5, 'min_weight_fraction_leaf': 0.3980852898102453, 'min_impurity_decrease': 0.12497005737479222, 'max_features': 0.49635625086245116, 'subsample': 0.44316845195204685, 'dropout_rate': 0.46094470895712086, 'ccp_alpha': 4.50335401989613}. Best is trial 4 with value: 0.25.[0m
[32m[I 2022-04-13 15:22:57,210][0m Trial 129 finished with value: 0.25 and parameters: {'loss': 'coxph', 'learning_rate': 0.00725136576800744, 'n_estimators': 278, 'criterion': 'friedman_mse', 'min_samples_split': 2, 'min_samples_leaf': 4, 'min_weight_fraction_leaf': 0.459442560863107, 'min_impurity_decrease': 0.39872610958325666, 'max_features': 0.0921311748771175, 'subsample': 0.4670685554203329, 'dropout_rate': 0.4694080219466283, 'ccp_alpha': 1.259214384010916}. Best is trial 4 with value: 0.25.[0m
[32m[I 2022-04-13 15:24:27,837][0m Trial 130 finished with value: 0.25 and parameters: {'loss': 'coxph', 'learning_rate': 1.5226094321508178e-06, 'n_estimators': 304, 'criterion': 'friedman_mse', 'min_samples_split': 6, 'min_samples_leaf': 4, 'min_weight_fraction_leaf': 0.44736460597917804, 'min_impurity_decrease': 0.3849083260771855, 'max_features': 0.36405980823612644, 'subsample': 0.22614221815073143, 'dropout_rate': 0.3831270316567369, 'ccp_alpha': 4.175568516723475}. Best is trial 4 with value: 0.25.[0m
[32m[I 2022-04-13 15:25:12,177][0m Trial 131 finished with value: 0.25 and parameters: {'loss': 'coxph', 'learning_rate': 1.4815058119077175e-06, 'n_estimators': 214, 'criterion': 'friedman_mse', 'min_samples_split': 6, 'min_samples_leaf': 5, 'min_weight_fraction_leaf': 0.46558432217181606, 'min_impurity_decrease': 0.7201744715258181, 'max_features': 0.11283152056445982, 'subsample': 0.20856039682554792, 'dropout_rate': 0.6477608578615021, 'ccp_alpha': 4.195480900041899}. Best is trial 4 with value: 0.25.[0m
[32m[I 2022-04-13 15:26:15,531][0m Trial 132 finished with value: 0.25 and parameters: {'loss': 'coxph', 'learning_rate': 1.7760006553394082e-06, 'n_estimators': 236, 'criterion': 'friedman_mse', 'min_samples_split': 6, 'min_samples_leaf': 3, 'min_weight_fraction_leaf': 0.32050098445854425, 'min_impurity_decrease': 0.6774031632633256, 'max_features': 0.18503869759433478, 'subsample': 0.16147925214846368, 'dropout_rate': 0.3998160785089936, 'ccp_alpha': 4.657173432156875}. Best is trial 4 with value: 0.25.[0m
[32m[I 2022-04-13 15:27:06,020][0m Trial 133 finished with value: 0.25 and parameters: {'loss': 'coxph', 'learning_rate': 1.4190206207879619e-06, 'n_estimators': 259, 'criterion': 'friedman_mse', 'min_samples_split': 6, 'min_samples_leaf': 6, 'min_weight_fraction_leaf': 0.02483844339674235, 'min_impurity_decrease': 0.6820987411329307, 'max_features': 0.19140828184699982, 'subsample': 0.7186532694107982, 'dropout_rate': 0.5626605155106413, 'ccp_alpha': 4.105253710491325}. Best is trial 4 with value: 0.25.[0m
[32m[I 2022-04-13 15:27:47,127][0m Trial 134 finished with value: 0.25 and parameters: {'loss': 'coxph', 'learning_rate': 2.2913220403837007e-06, 'n_estimators': 217, 'criterion': 'friedman_mse', 'min_samples_split': 6, 'min_samples_leaf': 3, 'min_weight_fraction_leaf': 0.41604077476774126, 'min_impurity_decrease': 0.8433946410304304, 'max_features': 0.06746197926487767, 'subsample': 0.5261433218132302, 'dropout_rate': 0.43892461058793164, 'ccp_alpha': 3.8967038026871896}. Best is trial 4 with value: 0.25.[0m
[32m[I 2022-04-13 15:32:37,294][0m Trial 135 finished with value: 0.25 and parameters: {'loss': 'coxph', 'learning_rate': 2.236302697845778e-05, 'n_estimators': 858, 'criterion': 'friedman_mse', 'min_samples_split': 6, 'min_samples_leaf': 2, 'min_weight_fraction_leaf': 0.005960271142580895, 'min_impurity_decrease': 0.7463966986851699, 'max_features': 0.3918639759559774, 'subsample': 0.7643058925899614, 'dropout_rate': 0.6908670158067317, 'ccp_alpha': 3.9685728742021382}. Best is trial 4 with value: 0.25.[0m
[32m[I 2022-04-13 15:38:49,762][0m Trial 136 finished with value: 0.25 and parameters: {'loss': 'coxph', 'learning_rate': 1.0319928768055703e-06, 'n_estimators': 976, 'criterion': 'friedman_mse', 'min_samples_split': 6, 'min_samples_leaf': 2, 'min_weight_fraction_leaf': 0.047817670511927785, 'min_impurity_decrease': 0.9939707994390721, 'max_features': 0.7551239167125864, 'subsample': 0.26719675577482294, 'dropout_rate': 0.7118874512025245, 'ccp_alpha': 3.809841168790905}. Best is trial 4 with value: 0.25.[0m
[32m[I 2022-04-13 15:39:45,148][0m Trial 137 finished with value: 0.25 and parameters: {'loss': 'coxph', 'learning_rate': 2.4596939052026727e-05, 'n_estimators': 234, 'criterion': 'friedman_mse', 'min_samples_split': 8, 'min_samples_leaf': 3, 'min_weight_fraction_leaf': 0.06403066619230822, 'min_impurity_decrease': 0.774795647688439, 'max_features': 0.7247718553395557, 'subsample': 0.2887272025566726, 'dropout_rate': 0.5922549290738311, 'ccp_alpha': 3.6186413552995105}. Best is trial 4 with value: 0.25.[0m
[32m[I 2022-04-13 15:44:58,712][0m Trial 138 finished with value: 0.731155530669601 and parameters: {'loss': 'coxph', 'learning_rate': 3.434401392395661e-06, 'n_estimators': 898, 'criterion': 'friedman_mse', 'min_samples_split': 8, 'min_samples_leaf': 3, 'min_weight_fraction_leaf': 0.42927231587890785, 'min_impurity_decrease': 0.6260263063578521, 'max_features': 0.7837933245369217, 'subsample': 0.5692767032217297, 'dropout_rate': 0.6833247312597638, 'ccp_alpha': 0.002791521764287319}. Best is trial 138 with value: 0.731155530669601.[0m
[32m[I 2022-04-13 15:48:07,545][0m Trial 139 finished with value: -0.25 and parameters: {'loss': 'squared', 'learning_rate': 0.0002813527671340295, 'n_estimators': 915, 'criterion': 'friedman_mse', 'min_samples_split': 7, 'min_samples_leaf': 4, 'min_weight_fraction_leaf': 0.37515447657381706, 'min_impurity_decrease': 0.15178384742902942, 'max_features': 0.584593985962284, 'subsample': 0.5858681166111253, 'dropout_rate': 0.7435045069337992, 'ccp_alpha': 0.6678997357620119}. Best is trial 138 with value: 0.731155530669601.[0m
[32m[I 2022-04-13 15:52:52,129][0m Trial 140 finished with value: 0.25 and parameters: {'loss': 'coxph', 'learning_rate': 3.475523106478058e-05, 'n_estimators': 772, 'criterion': 'friedman_mse', 'min_samples_split': 7, 'min_samples_leaf': 3, 'min_weight_fraction_leaf': 0.3925540440721852, 'min_impurity_decrease': 0.10653467054890237, 'max_features': 0.008017062007136477, 'subsample': 0.6330441376369503, 'dropout_rate': 0.5765620272700531, 'ccp_alpha': 4.924689460650755}. Best is trial 138 with value: 0.731155530669601.[0m
[32m[I 2022-04-13 15:57:40,160][0m Trial 141 finished with value: 0.25 and parameters: {'loss': 'coxph', 'learning_rate': 5.742072790706087e-05, 'n_estimators': 779, 'criterion': 'friedman_mse', 'min_samples_split': 8, 'min_samples_leaf': 2, 'min_weight_fraction_leaf': 0.3526660077796148, 'min_impurity_decrease': 0.3238327221426495, 'max_features': 0.7773233940473429, 'subsample': 0.28905454464476094, 'dropout_rate': 0.6079629588210107, 'ccp_alpha': 4.30807030988961}. Best is trial 138 with value: 0.731155530669601.[0m
[32m[I 2022-04-13 16:02:27,363][0m Trial 142 finished with value: 0.25 and parameters: {'loss': 'coxph', 'learning_rate': 2.253373138414941e-06, 'n_estimators': 852, 'criterion': 'friedman_mse', 'min_samples_split': 8, 'min_samples_leaf': 3, 'min_weight_fraction_leaf': 0.477018024918159, 'min_impurity_decrease': 0.34240401869810466, 'max_features': 0.8205726155567613, 'subsample': 0.48382646282399666, 'dropout_rate': 0.6919229467920334, 'ccp_alpha': 4.817148015941036}. Best is trial 138 with value: 0.731155530669601.[0m
[32m[I 2022-04-13 16:07:15,964][0m Trial 143 finished with value: 0.25 and parameters: {'loss': 'coxph', 'learning_rate': 3.984804188151688e-06, 'n_estimators': 838, 'criterion': 'friedman_mse', 'min_samples_split': 6, 'min_samples_leaf': 2, 'min_weight_fraction_leaf': 0.0716219983784157, 'min_impurity_decrease': 0.5736021140327047, 'max_features': 0.24791769380359216, 'subsample': 0.4039563683173596, 'dropout_rate': 0.6624283747653567, 'ccp_alpha': 3.5248531006758217}. Best is trial 138 with value: 0.731155530669601.[0m
[32m[I 2022-04-13 16:14:44,567][0m Trial 144 finished with value: 0.25 and parameters: {'loss': 'coxph', 'learning_rate': 1.1635831708890455e-06, 'n_estimators': 914, 'criterion': 'friedman_mse', 'min_samples_split': 6, 'min_samples_leaf': 3, 'min_weight_fraction_leaf': 0.3372531123295285, 'min_impurity_decrease': 0.6311247640682147, 'max_features': 0.3023255295316243, 'subsample': 0.23657544408066136, 'dropout_rate': 0.49731046903229253, 'ccp_alpha': 3.996687835628444}. Best is trial 138 with value: 0.731155530669601.[0m
[32m[I 2022-04-13 16:15:02,624][0m Trial 145 finished with value: 0.25 and parameters: {'loss': 'coxph', 'learning_rate': 0.035226833233065025, 'n_estimators': 107, 'criterion': 'friedman_mse', 'min_samples_split': 10, 'min_samples_leaf': 2, 'min_weight_fraction_leaf': 0.044738979503893335, 'min_impurity_decrease': 0.5300653495269859, 'max_features': 0.22449943564334282, 'subsample': 0.9793912307413339, 'dropout_rate': 0.6870295820916474, 'ccp_alpha': 3.305166481136842}. Best is trial 138 with value: 0.731155530669601.[0m
[32m[I 2022-04-13 16:18:18,086][0m Trial 146 finished with value: 0.25 and parameters: {'loss': 'coxph', 'learning_rate': 0.0636316454081611, 'n_estimators': 583, 'criterion': 'squared_error', 'min_samples_split': 10, 'min_samples_leaf': 1, 'min_weight_fraction_leaf': 0.49365210644548946, 'min_impurity_decrease': 0.4983682505422579, 'max_features': 0.1494082249025431, 'subsample': 0.5183467852512954, 'dropout_rate': 0.5316543856328876, 'ccp_alpha': 3.119175547575792}. Best is trial 138 with value: 0.731155530669601.[0m
[32m[I 2022-04-13 16:24:04,896][0m Trial 147 finished with value: 0.25 and parameters: {'loss': 'coxph', 'learning_rate': 6.330700548784093e-06, 'n_estimators': 669, 'criterion': 'squared_error', 'min_samples_split': 10, 'min_samples_leaf': 1, 'min_weight_fraction_leaf': 0.48493207037674185, 'min_impurity_decrease': 0.47742715307610795, 'max_features': 0.2765594617994984, 'subsample': 0.5020882740552371, 'dropout_rate': 0.18148650201992675, 'ccp_alpha': 3.648115706395814}. Best is trial 138 with value: 0.731155530669601.[0m
[32m[I 2022-04-13 16:24:30,171][0m Trial 148 finished with value: 0.25 and parameters: {'loss': 'coxph', 'learning_rate': 1.389763222312683e-05, 'n_estimators': 130, 'criterion': 'squared_error', 'min_samples_split': 3, 'min_samples_leaf': 1, 'min_weight_fraction_leaf': 0.059006129039432254, 'min_impurity_decrease': 0.561330922280056, 'max_features': 0.2557395425319916, 'subsample': 0.5662094766752565, 'dropout_rate': 0.12906849736034987, 'ccp_alpha': 0.32421296977910086}. Best is trial 138 with value: 0.731155530669601.[0m
[32m[I 2022-04-13 16:29:19,032][0m Trial 149 finished with value: 0.25 and parameters: {'loss': 'coxph', 'learning_rate': 5.929114879017989e-05, 'n_estimators': 612, 'criterion': 'squared_error', 'min_samples_split': 10, 'min_samples_leaf': 1, 'min_weight_fraction_leaf': 0.07796811998544179, 'min_impurity_decrease': 0.6012978012203793, 'max_features': 0.16467226657567763, 'subsample': 0.45922808261968306, 'dropout_rate': 0.12095869036589435, 'ccp_alpha': 3.307200144979698}. Best is trial 138 with value: 0.731155530669601.[0m
[32m[I 2022-04-13 16:34:55,230][0m Trial 150 finished with value: 0.25 and parameters: {'loss': 'coxph', 'learning_rate': 7.309142454551857e-06, 'n_estimators': 667, 'criterion': 'squared_error', 'min_samples_split': 9, 'min_samples_leaf': 1, 'min_weight_fraction_leaf': 0.19573638413001027, 'min_impurity_decrease': 0.5405290030033996, 'max_features': 0.699456409052746, 'subsample': 0.9004900995131758, 'dropout_rate': 0.15137921194618167, 'ccp_alpha': 2.791353527820551}. Best is trial 138 with value: 0.731155530669601.[0m
[32m[I 2022-04-13 16:39:11,129][0m Trial 151 finished with value: 0.25 and parameters: {'loss': 'coxph', 'learning_rate': 9.29787053243995e-06, 'n_estimators': 529, 'criterion': 'squared_error', 'min_samples_split': 2, 'min_samples_leaf': 1, 'min_weight_fraction_leaf': 0.17844767290268992, 'min_impurity_decrease': 0.5163476031587483, 'max_features': 0.8905691625931041, 'subsample': 0.9070408429377792, 'dropout_rate': 0.028238688574386023, 'ccp_alpha': 2.397576378733675}. Best is trial 138 with value: 0.731155530669601.[0m
[32m[I 2022-04-13 16:39:29,081][0m Trial 152 finished with value: 0.25 and parameters: {'loss': 'coxph', 'learning_rate': 1.1859697174828924e-05, 'n_estimators': 105, 'criterion': 'squared_error', 'min_samples_split': 5, 'min_samples_leaf': 1, 'min_weight_fraction_leaf': 0.17727142668272688, 'min_impurity_decrease': 0.5017505412223843, 'max_features': 0.9544632009331977, 'subsample': 0.9318577291834683, 'dropout_rate': 0.17393356452662467, 'ccp_alpha': 2.6226093808834157}. Best is trial 138 with value: 0.731155530669601.[0m
[32m[I 2022-04-13 16:42:50,480][0m Trial 153 finished with value: 0.25 and parameters: {'loss': 'coxph', 'learning_rate': 9.889681307795103e-06, 'n_estimators': 480, 'criterion': 'squared_error', 'min_samples_split': 3, 'min_samples_leaf': 1, 'min_weight_fraction_leaf': 0.13270237698775805, 'min_impurity_decrease': 0.0027952518151968912, 'max_features': 0.977677242844415, 'subsample': 0.9499941454054668, 'dropout_rate': 0.1019789972301577, 'ccp_alpha': 2.775129561156441}. Best is trial 138 with value: 0.731155530669601.[0m
[32m[I 2022-04-13 16:46:37,678][0m Trial 154 finished with value: 0.25 and parameters: {'loss': 'coxph', 'learning_rate': 5.98175053723788e-06, 'n_estimators': 500, 'criterion': 'squared_error', 'min_samples_split': 5, 'min_samples_leaf': 1, 'min_weight_fraction_leaf': 0.15112823730411126, 'min_impurity_decrease': 0.02681780962453913, 'max_features': 0.9296889752831052, 'subsample': 0.8817819432891266, 'dropout_rate': 0.09043964888018335, 'ccp_alpha': 2.8624383210900004}. Best is trial 138 with value: 0.731155530669601.[0m
[32m[I 2022-04-13 16:49:27,198][0m Trial 155 finished with value: 0.25 and parameters: {'loss': 'coxph', 'learning_rate': 0.029611142060963238, 'n_estimators': 460, 'criterion': 'squared_error', 'min_samples_split': 5, 'min_samples_leaf': 1, 'min_weight_fraction_leaf': 0.2802068073279418, 'min_impurity_decrease': 0.034141349736188625, 'max_features': 0.9424305779885298, 'subsample': 0.9671549672900912, 'dropout_rate': 0.26619894044496517, 'ccp_alpha': 2.9753136967344798}. Best is trial 138 with value: 0.731155530669601.[0m
[32m[I 2022-04-13 16:55:38,512][0m Trial 156 finished with value: 0.25 and parameters: {'loss': 'coxph', 'learning_rate': 9.61690139785455e-05, 'n_estimators': 715, 'criterion': 'squared_error', 'min_samples_split': 5, 'min_samples_leaf': 1, 'min_weight_fraction_leaf': 0.2085314309424649, 'min_impurity_decrease': 0.4541952018509955, 'max_features': 0.9610132339609462, 'subsample': 0.9229451339260889, 'dropout_rate': 0.16479156461046116, 'ccp_alpha': 2.577473893079378}. Best is trial 138 with value: 0.731155530669601.[0m
[32m[I 2022-04-13 16:56:37,538][0m Trial 157 finished with value: 0.25 and parameters: {'loss': 'coxph', 'learning_rate': 7.305871606233157e-05, 'n_estimators': 371, 'criterion': 'squared_error', 'min_samples_split': 5, 'min_samples_leaf': 9, 'min_weight_fraction_leaf': 0.1508013444537476, 'min_impurity_decrease': 0.4772745778869838, 'max_features': 0.8497798616889816, 'subsample': 0.37982336059075134, 'dropout_rate': 0.9276538783042664, 'ccp_alpha': 0.9908673065222762}. Best is trial 138 with value: 0.731155530669601.[0m
[32m[I 2022-04-13 16:58:14,401][0m Trial 158 finished with value: 0.25 and parameters: {'loss': 'coxph', 'learning_rate': 0.00011625829467698164, 'n_estimators': 439, 'criterion': 'absolute_error', 'min_samples_split': 3, 'min_samples_leaf': 8, 'min_weight_fraction_leaf': 0.17609322613227363, 'min_impurity_decrease': 0.43567537874505874, 'max_features': 0.996815139021104, 'subsample': 0.3378516789147412, 'dropout_rate': 0.8923123456885952, 'ccp_alpha': 2.5200035508058214}. Best is trial 138 with value: 0.731155530669601.[0m
[32m[I 2022-04-13 17:00:23,304][0m Trial 159 finished with value: 0.25 and parameters: {'loss': 'coxph', 'learning_rate': 0.0011007658721770494, 'n_estimators': 402, 'criterion': 'squared_error', 'min_samples_split': 3, 'min_samples_leaf': 7, 'min_weight_fraction_leaf': 0.11238905640333842, 'min_impurity_decrease': 0.3056658621438566, 'max_features': 0.6099892202734676, 'subsample': 0.36255181950829535, 'dropout_rate': 0.21005900741538353, 'ccp_alpha': 1.4200339614833304}. Best is trial 138 with value: 0.731155530669601.[0m
[32m[I 2022-04-13 17:03:20,241][0m Trial 160 finished with value: 0.25 and parameters: {'loss': 'coxph', 'learning_rate': 0.0008762120018953978, 'n_estimators': 429, 'criterion': 'absolute_error', 'min_samples_split': 4, 'min_samples_leaf': 9, 'min_weight_fraction_leaf': 0.09524961088492788, 'min_impurity_decrease': 0.25527828588979873, 'max_features': 0.5181988745639489, 'subsample': 0.5382438322994122, 'dropout_rate': 0.051013023816590154, 'ccp_alpha': 1.436209359864664}. Best is trial 138 with value: 0.731155530669601.[0m
[32m[I 2022-04-13 17:05:55,785][0m Trial 161 finished with value: 0.25 and parameters: {'loss': 'coxph', 'learning_rate': 0.0006632720008791195, 'n_estimators': 705, 'criterion': 'absolute_error', 'min_samples_split': 4, 'min_samples_leaf': 7, 'min_weight_fraction_leaf': 0.11439119327223321, 'min_impurity_decrease': 0.3525513410025075, 'max_features': 0.6259337378481113, 'subsample': 0.409060158655291, 'dropout_rate': 0.8898130585939746, 'ccp_alpha': 1.6575521045559063}. Best is trial 138 with value: 0.731155530669601.[0m
[32m[I 2022-04-13 17:07:51,480][0m Trial 162 finished with value: 0.25 and parameters: {'loss': 'coxph', 'learning_rate': 0.0005118720278000261, 'n_estimators': 720, 'criterion': 'absolute_error', 'min_samples_split': 4, 'min_samples_leaf': 7, 'min_weight_fraction_leaf': 0.10438901813295319, 'min_impurity_decrease': 0.09146479326213061, 'max_features': 0.6478724720473279, 'subsample': 0.38605750800346006, 'dropout_rate': 0.8441378948235949, 'ccp_alpha': 1.8283021279378557}. Best is trial 138 with value: 0.731155530669601.[0m
[32m[I 2022-04-13 17:08:33,499][0m Trial 163 finished with value: 0.25 and parameters: {'loss': 'coxph', 'learning_rate': 0.0020629721338775503, 'n_estimators': 376, 'criterion': 'absolute_error', 'min_samples_split': 4, 'min_samples_leaf': 8, 'min_weight_fraction_leaf': 0.08511158491006668, 'min_impurity_decrease': 0.5504654626367168, 'max_features': 0.4772054530422937, 'subsample': 0.48741583930516497, 'dropout_rate': 0.9449133234617109, 'ccp_alpha': 2.1763979207271773}. Best is trial 138 with value: 0.731155530669601.[0m
[32m[I 2022-04-13 17:08:49,429][0m Trial 164 finished with value: 0.25 and parameters: {'loss': 'coxph', 'learning_rate': 0.0014683769685822313, 'n_estimators': 123, 'criterion': 'squared_error', 'min_samples_split': 4, 'min_samples_leaf': 9, 'min_weight_fraction_leaf': 0.12879721970923164, 'min_impurity_decrease': 0.07559983600232698, 'max_features': 0.9656944291637428, 'subsample': 0.8337157977824595, 'dropout_rate': 0.0627243876487123, 'ccp_alpha': 2.673553413782837}. Best is trial 138 with value: 0.731155530669601.[0m
[32m[I 2022-04-13 17:11:10,479][0m Trial 165 finished with value: 0.25 and parameters: {'loss': 'coxph', 'learning_rate': 0.000482821813178333, 'n_estimators': 414, 'criterion': 'absolute_error', 'min_samples_split': 4, 'min_samples_leaf': 7, 'min_weight_fraction_leaf': 0.2542117566148248, 'min_impurity_decrease': 0.014582337650837544, 'max_features': 0.9224913062422897, 'subsample': 0.8058634578114249, 'dropout_rate': 0.2136154605052669, 'ccp_alpha': 1.4220488297240943}. Best is trial 138 with value: 0.731155530669601.[0m
[32m[I 2022-04-13 17:12:30,684][0m Trial 166 finished with value: 0.25 and parameters: {'loss': 'coxph', 'learning_rate': 0.0006824049770583859, 'n_estimators': 562, 'criterion': 'absolute_error', 'min_samples_split': 5, 'min_samples_leaf': 8, 'min_weight_fraction_leaf': 0.2293067103856427, 'min_impurity_decrease': 0.023461115860597948, 'max_features': 0.8644184275781797, 'subsample': 0.42820731470735207, 'dropout_rate': 0.9692574042470166, 'ccp_alpha': 1.7573801735292431}. Best is trial 138 with value: 0.731155530669601.[0m
