[32m[I 2022-04-13 11:54:19,174][0m Trial 438 finished with value: 0.8874071487155536 and parameters: {'splitter': 'best', 'min_samples_split': 0.1323203851224699, 'min_samples_leaf': 0.03720000765596415, 'min_weight_fraction_leaf': 0.04673843104611655, 'max_features': 0.9993025087031675}. Best is trial 201 with value: 0.8881217621713932.[0m
/media/san2_ssd/data/Workdir/survival/utils.py:305: RuntimeWarning: invalid value encountered in true_divide
  pdfs = np.gradient(1-survs,axis=1)/norms
/media/san2_ssd/data/Workdir/survival/utils.py:305: RuntimeWarning: invalid value encountered in true_divide
  pdfs = np.gradient(1-survs,axis=1)/norms
/media/san2_ssd/data/Workdir/survival/utils.py:305: RuntimeWarning: invalid value encountered in true_divide
  pdfs = np.gradient(1-survs,axis=1)/norms
[32m[I 2022-04-13 11:54:21,273][0m Trial 439 finished with value: 0.8846070643281434 and parameters: {'splitter': 'best', 'min_samples_split': 0.11529140788530809, 'min_samples_leaf': 0.03517238145933379, 'min_weight_fraction_leaf': 0.0294204229815603, 'max_features': 0.8936674890891829}. Best is trial 201 with value: 0.8881217621713932.[0m
[32m[I 2022-04-13 11:54:23,647][0m Trial 440 finished with value: 0.46304589466485996 and parameters: {'splitter': 'best', 'min_samples_split': 0.2977451619403809, 'min_samples_leaf': 0.025166155330300078, 'min_weight_fraction_leaf': 0.012704005997128504, 'max_features': 0.9395034518482563}. Best is trial 201 with value: 0.8881217621713932.[0m
[32m[I 2022-04-13 11:54:24,524][0m Trial 441 finished with value: 0.5371812073302544 and parameters: {'splitter': 'best', 'min_samples_split': 0.08395691145308685, 'min_samples_leaf': 0.017037669847383547, 'min_weight_fraction_leaf': 0.323099731753402, 'max_features': 0.9825402020322461}. Best is trial 201 with value: 0.8881217621713932.[0m
/media/san2_ssd/data/Workdir/survival/utils.py:305: RuntimeWarning: invalid value encountered in true_divide
  pdfs = np.gradient(1-survs,axis=1)/norms
[32m[I 2022-04-13 11:54:27,489][0m Trial 442 finished with value: 0.882255385170685 and parameters: {'splitter': 'best', 'min_samples_split': 0.1277643200631918, 'min_samples_leaf': 0.03898332652903923, 'min_weight_fraction_leaf': 0.06347839470074389, 'max_features': 0.9644086328331913}. Best is trial 201 with value: 0.8881217621713932.[0m
/media/san2_ssd/data/Workdir/survival/utils.py:305: RuntimeWarning: invalid value encountered in true_divide
  pdfs = np.gradient(1-survs,axis=1)/norms
/media/san2_ssd/data/Workdir/survival/utils.py:305: RuntimeWarning: invalid value encountered in true_divide
  pdfs = np.gradient(1-survs,axis=1)/norms
/media/san2_ssd/data/Workdir/survival/utils.py:305: RuntimeWarning: invalid value encountered in true_divide
  pdfs = np.gradient(1-survs,axis=1)/norms
/media/san2_ssd/data/Workdir/survival/utils.py:305: RuntimeWarning: invalid value encountered in true_divide
  pdfs = np.gradient(1-survs,axis=1)/norms
[32m[I 2022-04-13 11:54:30,665][0m Trial 443 finished with value: 0.8866501275984968 and parameters: {'splitter': 'best', 'min_samples_split': 0.1036000958569896, 'min_samples_leaf': 0.02708255201733096, 'min_weight_fraction_leaf': 0.03695594387740221, 'max_features': 0.9825373018961046}. Best is trial 201 with value: 0.8881217621713932.[0m
/media/san2_ssd/data/Workdir/survival/utils.py:305: RuntimeWarning: invalid value encountered in true_divide
  pdfs = np.gradient(1-survs,axis=1)/norms
/media/san2_ssd/data/Workdir/survival/utils.py:305: RuntimeWarning: invalid value encountered in true_divide
  pdfs = np.gradient(1-survs,axis=1)/norms
/media/san2_ssd/data/Workdir/survival/utils.py:305: RuntimeWarning: invalid value encountered in true_divide
  pdfs = np.gradient(1-survs,axis=1)/norms
/media/san2_ssd/data/Workdir/survival/utils.py:305: RuntimeWarning: invalid value encountered in true_divide
  pdfs = np.gradient(1-survs,axis=1)/norms
[32m[I 2022-04-13 11:54:32,619][0m Trial 444 finished with value: 0.8823225740636934 and parameters: {'splitter': 'best', 'min_samples_split': 0.09522403971001114, 'min_samples_leaf': 0.009827800271979392, 'min_weight_fraction_leaf': 0.023605566083740516, 'max_features': 0.9458567271332936}. Best is trial 201 with value: 0.8881217621713932.[0m
/media/san2_ssd/data/Workdir/survival/utils.py:305: RuntimeWarning: invalid value encountered in true_divide
  pdfs = np.gradient(1-survs,axis=1)/norms
/media/san2_ssd/data/Workdir/survival/utils.py:305: RuntimeWarning: invalid value encountered in true_divide
  pdfs = np.gradient(1-survs,axis=1)/norms
/media/san2_ssd/data/Workdir/survival/utils.py:305: RuntimeWarning: invalid value encountered in true_divide
  pdfs = np.gradient(1-survs,axis=1)/norms
[32m[I 2022-04-13 11:54:34,861][0m Trial 445 finished with value: 0.8814086915567667 and parameters: {'splitter': 'best', 'min_samples_split': 0.12053491079349767, 'min_samples_leaf': 0.01753509563872656, 'min_weight_fraction_leaf': 0.04968957324503687, 'max_features': 0.9651940005874499}. Best is trial 201 with value: 0.8881217621713932.[0m
/media/san2_ssd/data/Workdir/survival/utils.py:305: RuntimeWarning: invalid value encountered in true_divide
  pdfs = np.gradient(1-survs,axis=1)/norms
/media/san2_ssd/data/Workdir/survival/utils.py:305: RuntimeWarning: invalid value encountered in true_divide
  pdfs = np.gradient(1-survs,axis=1)/norms
/media/san2_ssd/data/Workdir/survival/utils.py:305: RuntimeWarning: invalid value encountered in true_divide
  pdfs = np.gradient(1-survs,axis=1)/norms
/media/san2_ssd/data/Workdir/survival/utils.py:305: RuntimeWarning: invalid value encountered in true_divide
  pdfs = np.gradient(1-survs,axis=1)/norms
[32m[I 2022-04-13 11:54:38,024][0m Trial 446 finished with value: 0.886961587778379 and parameters: {'splitter': 'best', 'min_samples_split': 0.10847788053425751, 'min_samples_leaf': 0.03530464730864272, 'min_weight_fraction_leaf': 0.01811987797265513, 'max_features': 0.9833160602524751}. Best is trial 201 with value: 0.8881217621713932.[0m
[32m[I 2022-04-13 11:54:38,596][0m Trial 447 finished with value: 0.7699847695977804 and parameters: {'splitter': 'random', 'min_samples_split': 0.13055272776792898, 'min_samples_leaf': 0.0018193226816242691, 'min_weight_fraction_leaf': 0.03364967960727966, 'max_features': 0.9142450587060471}. Best is trial 201 with value: 0.8881217621713932.[0m
/media/san2_ssd/data/Workdir/survival/utils.py:305: RuntimeWarning: invalid value encountered in true_divide
  pdfs = np.gradient(1-survs,axis=1)/norms
/media/san2_ssd/data/Workdir/survival/utils.py:305: RuntimeWarning: invalid value encountered in true_divide
  pdfs = np.gradient(1-survs,axis=1)/norms
/media/san2_ssd/data/Workdir/survival/utils.py:305: RuntimeWarning: invalid value encountered in true_divide
  pdfs = np.gradient(1-survs,axis=1)/norms
/media/san2_ssd/data/Workdir/survival/utils.py:305: RuntimeWarning: invalid value encountered in true_divide
  pdfs = np.gradient(1-survs,axis=1)/norms
[32m[I 2022-04-13 11:54:40,589][0m Trial 448 finished with value: 0.8888507593246218 and parameters: {'splitter': 'best', 'min_samples_split': 0.1137811469951, 'min_samples_leaf': 0.026573332975240317, 'min_weight_fraction_leaf': 0.043648303940224134, 'max_features': 0.9988509294918843}. Best is trial 448 with value: 0.8888507593246218.[0m
/media/san2_ssd/data/Workdir/survival/utils.py:305: RuntimeWarning: invalid value encountered in true_divide
  pdfs = np.gradient(1-survs,axis=1)/norms
/media/san2_ssd/data/Workdir/survival/utils.py:305: RuntimeWarning: invalid value encountered in true_divide
  pdfs = np.gradient(1-survs,axis=1)/norms
[32m[I 2022-04-13 11:54:42,983][0m Trial 449 finished with value: 0.8856526600049065 and parameters: {'splitter': 'best', 'min_samples_split': 0.13533687394589938, 'min_samples_leaf': 0.04379248958351605, 'min_weight_fraction_leaf': 0.055807291581953716, 'max_features': 0.997437978258022}. Best is trial 448 with value: 0.8888507593246218.[0m
[32m[I 2022-04-13 11:54:45,482][0m Trial 450 finished with value: 0.8834604123687291 and parameters: {'splitter': 'best', 'min_samples_split': 0.11916942054544111, 'min_samples_leaf': 0.029840824235347282, 'min_weight_fraction_leaf': 0.06941824464745683, 'max_features': 0.9994637697040565}. Best is trial 448 with value: 0.8888507593246218.[0m
/media/san2_ssd/data/Workdir/survival/utils.py:305: RuntimeWarning: invalid value encountered in true_divide
  pdfs = np.gradient(1-survs,axis=1)/norms
/media/san2_ssd/data/Workdir/survival/utils.py:305: RuntimeWarning: invalid value encountered in true_divide
  pdfs = np.gradient(1-survs,axis=1)/norms
/media/san2_ssd/data/Workdir/survival/utils.py:305: RuntimeWarning: invalid value encountered in true_divide
  pdfs = np.gradient(1-survs,axis=1)/norms
/media/san2_ssd/data/Workdir/survival/utils.py:305: RuntimeWarning: invalid value encountered in true_divide
  pdfs = np.gradient(1-survs,axis=1)/norms
/media/san2_ssd/data/Workdir/survival/utils.py:305: RuntimeWarning: invalid value encountered in true_divide
  pdfs = np.gradient(1-survs,axis=1)/norms
[32m[I 2022-04-13 11:54:47,732][0m Trial 451 finished with value: 0.8831770149002848 and parameters: {'splitter': 'best', 'min_samples_split': 0.11367029507766871, 'min_samples_leaf': 0.042026148001119715, 'min_weight_fraction_leaf': 0.04382891595361999, 'max_features': 0.9650002747571704}. Best is trial 448 with value: 0.8888507593246218.[0m
/media/san2_ssd/data/Workdir/survival/utils.py:305: RuntimeWarning: invalid value encountered in true_divide
  pdfs = np.gradient(1-survs,axis=1)/norms
[32m[I 2022-04-13 11:54:48,594][0m Trial 452 finished with value: 0.8832886609994205 and parameters: {'splitter': 'best', 'min_samples_split': 0.1458149523312834, 'min_samples_leaf': 0.0554587714830313, 'min_weight_fraction_leaf': 0.0519465821331461, 'max_features': 0.948157977072021}. Best is trial 448 with value: 0.8888507593246218.[0m
/media/san2_ssd/data/Workdir/survival/utils.py:305: RuntimeWarning: invalid value encountered in true_divide
  pdfs = np.gradient(1-survs,axis=1)/norms
/media/san2_ssd/data/Workdir/survival/utils.py:305: RuntimeWarning: invalid value encountered in true_divide
  pdfs = np.gradient(1-survs,axis=1)/norms
/media/san2_ssd/data/Workdir/survival/utils.py:305: RuntimeWarning: invalid value encountered in true_divide
  pdfs = np.gradient(1-survs,axis=1)/norms
/media/san2_ssd/data/Workdir/survival/utils.py:305: RuntimeWarning: invalid value encountered in true_divide
  pdfs = np.gradient(1-survs,axis=1)/norms
[32m[I 2022-04-13 11:54:50,107][0m Trial 453 finished with value: 0.8861698281302243 and parameters: {'splitter': 'best', 'min_samples_split': 0.12485160066805624, 'min_samples_leaf': 0.027729188551484756, 'min_weight_fraction_leaf': 0.04257227289182415, 'max_features': 0.999777853822261}. Best is trial 448 with value: 0.8888507593246218.[0m
/media/san2_ssd/data/Workdir/survival/utils.py:305: RuntimeWarning: invalid value encountered in true_divide
  pdfs = np.gradient(1-survs,axis=1)/norms
/media/san2_ssd/data/Workdir/survival/utils.py:305: RuntimeWarning: invalid value encountered in true_divide
  pdfs = np.gradient(1-survs,axis=1)/norms
/media/san2_ssd/data/Workdir/survival/utils.py:305: RuntimeWarning: invalid value encountered in true_divide
  pdfs = np.gradient(1-survs,axis=1)/norms
/media/san2_ssd/data/Workdir/survival/utils.py:305: RuntimeWarning: invalid value encountered in true_divide
  pdfs = np.gradient(1-survs,axis=1)/norms
[32m[I 2022-04-13 11:54:53,201][0m Trial 454 finished with value: 0.884665596144335 and parameters: {'splitter': 'best', 'min_samples_split': 0.11092282687211183, 'min_samples_leaf': 0.03671570762915942, 'min_weight_fraction_leaf': 0.00025912301935112486, 'max_features': 0.971618877132812}. Best is trial 448 with value: 0.8888507593246218.[0m
/media/san2_ssd/data/Workdir/survival/utils.py:305: RuntimeWarning: invalid value encountered in true_divide
  pdfs = np.gradient(1-survs,axis=1)/norms
/media/san2_ssd/data/Workdir/survival/utils.py:305: RuntimeWarning: invalid value encountered in true_divide
  pdfs = np.gradient(1-survs,axis=1)/norms
/media/san2_ssd/data/Workdir/survival/utils.py:305: RuntimeWarning: invalid value encountered in true_divide
  pdfs = np.gradient(1-survs,axis=1)/norms
[32m[I 2022-04-13 11:54:55,860][0m Trial 455 finished with value: 0.8858392283237488 and parameters: {'splitter': 'best', 'min_samples_split': 0.13189406759305555, 'min_samples_leaf': 0.021737660761935226, 'min_weight_fraction_leaf': 0.024270256372161382, 'max_features': 0.9824755948730982}. Best is trial 448 with value: 0.8888507593246218.[0m
/media/san2_ssd/data/Workdir/survival/utils.py:305: RuntimeWarning: invalid value encountered in true_divide
  pdfs = np.gradient(1-survs,axis=1)/norms
/media/san2_ssd/data/Workdir/survival/utils.py:305: RuntimeWarning: invalid value encountered in true_divide
  pdfs = np.gradient(1-survs,axis=1)/norms
/media/san2_ssd/data/Workdir/survival/utils.py:305: RuntimeWarning: invalid value encountered in true_divide
  pdfs = np.gradient(1-survs,axis=1)/norms
[32m[I 2022-04-13 11:54:59,465][0m Trial 456 finished with value: 0.8841760105137461 and parameters: {'splitter': 'best', 'min_samples_split': 0.11978469211953487, 'min_samples_leaf': 0.02908413351880538, 'min_weight_fraction_leaf': 0.059447778030353934, 'max_features': 0.9321793148672823}. Best is trial 448 with value: 0.8888507593246218.[0m
/media/san2_ssd/data/Workdir/survival/utils.py:305: RuntimeWarning: invalid value encountered in true_divide
  pdfs = np.gradient(1-survs,axis=1)/norms
/media/san2_ssd/data/Workdir/survival/utils.py:305: RuntimeWarning: invalid value encountered in true_divide
  pdfs = np.gradient(1-survs,axis=1)/norms
/media/san2_ssd/data/Workdir/survival/utils.py:305: RuntimeWarning: invalid value encountered in true_divide
  pdfs = np.gradient(1-survs,axis=1)/norms
[32m[I 2022-04-13 11:55:01,603][0m Trial 457 finished with value: 0.8854690605133584 and parameters: {'splitter': 'best', 'min_samples_split': 0.09596166882755157, 'min_samples_leaf': 0.0511300531862134, 'min_weight_fraction_leaf': 0.015454200250920556, 'max_features': 0.9998193502270588}. Best is trial 448 with value: 0.8888507593246218.[0m
/media/san2_ssd/data/Workdir/survival/utils.py:305: RuntimeWarning: invalid value encountered in true_divide
  pdfs = np.gradient(1-survs,axis=1)/norms
/media/san2_ssd/data/Workdir/survival/utils.py:305: RuntimeWarning: invalid value encountered in true_divide
  pdfs = np.gradient(1-survs,axis=1)/norms
/media/san2_ssd/data/Workdir/survival/utils.py:305: RuntimeWarning: invalid value encountered in true_divide
  pdfs = np.gradient(1-survs,axis=1)/norms
/media/san2_ssd/data/Workdir/survival/utils.py:305: RuntimeWarning: invalid value encountered in true_divide
  pdfs = np.gradient(1-survs,axis=1)/norms
/media/san2_ssd/data/Workdir/survival/utils.py:305: RuntimeWarning: invalid value encountered in true_divide
  pdfs = np.gradient(1-survs,axis=1)/norms
[32m[I 2022-04-13 11:55:04,566][0m Trial 458 finished with value: 0.8851876658635216 and parameters: {'splitter': 'best', 'min_samples_split': 0.1067813183550819, 'min_samples_leaf': 0.01738488929315207, 'min_weight_fraction_leaf': 0.03813780210724695, 'max_features': 0.9543753801713724}. Best is trial 448 with value: 0.8888507593246218.[0m
[32m[I 2022-04-13 11:55:05,240][0m Trial 459 finished with value: 0.6955237630640643 and parameters: {'splitter': 'best', 'min_samples_split': 0.15341880448565826, 'min_samples_leaf': 0.4041881418533786, 'min_weight_fraction_leaf': 0.030669613272457652, 'max_features': 0.9701047251190655}. Best is trial 448 with value: 0.8888507593246218.[0m
[32m[I 2022-04-13 11:55:06,278][0m Trial 460 finished with value: 0.5802545153788989 and parameters: {'splitter': 'best', 'min_samples_split': 0.14058399902643393, 'min_samples_leaf': 0.17896126995775935, 'min_weight_fraction_leaf': 0.010477160833200348, 'max_features': 0.9999748800742362}. Best is trial 448 with value: 0.8888507593246218.[0m
/media/san2_ssd/data/Workdir/survival/utils.py:305: RuntimeWarning: invalid value encountered in true_divide
  pdfs = np.gradient(1-survs,axis=1)/norms
/media/san2_ssd/data/Workdir/survival/utils.py:305: RuntimeWarning: invalid value encountered in true_divide
  pdfs = np.gradient(1-survs,axis=1)/norms
/media/san2_ssd/data/Workdir/survival/utils.py:305: RuntimeWarning: invalid value encountered in true_divide
  pdfs = np.gradient(1-survs,axis=1)/norms
[32m[I 2022-04-13 11:55:07,617][0m Trial 461 finished with value: 0.8857329310766968 and parameters: {'splitter': 'best', 'min_samples_split': 0.12580669131863276, 'min_samples_leaf': 0.040414702344465446, 'min_weight_fraction_leaf': 0.047628310521367, 'max_features': 0.9800782738260099}. Best is trial 448 with value: 0.8888507593246218.[0m
[32m[I 2022-04-13 11:55:07,919][0m Trial 462 finished with value: 0.6870577105377486 and parameters: {'splitter': 'best', 'min_samples_split': 0.11090529483554429, 'min_samples_leaf': 0.024323958889673328, 'min_weight_fraction_leaf': 0.4590532986227343, 'max_features': 0.4656643259120603}. Best is trial 448 with value: 0.8888507593246218.[0m
/media/san2_ssd/data/Workdir/survival/utils.py:305: RuntimeWarning: invalid value encountered in true_divide
  pdfs = np.gradient(1-survs,axis=1)/norms
/media/san2_ssd/data/Workdir/survival/utils.py:305: RuntimeWarning: invalid value encountered in true_divide
  pdfs = np.gradient(1-survs,axis=1)/norms
/media/san2_ssd/data/Workdir/survival/utils.py:305: RuntimeWarning: invalid value encountered in true_divide
  pdfs = np.gradient(1-survs,axis=1)/norms
/media/san2_ssd/data/Workdir/survival/utils.py:305: RuntimeWarning: invalid value encountered in true_divide
  pdfs = np.gradient(1-survs,axis=1)/norms
/media/san2_ssd/data/Workdir/survival/utils.py:305: RuntimeWarning: invalid value encountered in true_divide
  pdfs = np.gradient(1-survs,axis=1)/norms
[32m[I 2022-04-13 11:55:10,446][0m Trial 463 finished with value: 0.8799368459689025 and parameters: {'splitter': 'best', 'min_samples_split': 0.07690659484548068, 'min_samples_leaf': 0.03463269017002975, 'min_weight_fraction_leaf': 0.025436448696808577, 'max_features': 0.9575579193913049}. Best is trial 448 with value: 0.8888507593246218.[0m
[32m[I 2022-04-13 11:55:12,319][0m Trial 464 finished with value: 0.7857519525455213 and parameters: {'splitter': 'best', 'min_samples_split': 0.08736299716339824, 'min_samples_leaf': 0.045594003627233176, 'min_weight_fraction_leaf': 0.08360296237349224, 'max_features': 0.9811628444897112}. Best is trial 448 with value: 0.8888507593246218.[0m
/media/san2_ssd/data/Workdir/survival/utils.py:305: RuntimeWarning: invalid value encountered in true_divide
  pdfs = np.gradient(1-survs,axis=1)/norms
/media/san2_ssd/data/Workdir/survival/utils.py:305: RuntimeWarning: invalid value encountered in true_divide
  pdfs = np.gradient(1-survs,axis=1)/norms
/media/san2_ssd/data/Workdir/survival/utils.py:305: RuntimeWarning: invalid value encountered in true_divide
  pdfs = np.gradient(1-survs,axis=1)/norms
[32m[I 2022-04-13 11:55:14,059][0m Trial 465 finished with value: 0.8827484674564096 and parameters: {'splitter': 'best', 'min_samples_split': 0.11952027364895407, 'min_samples_leaf': 0.01598250781558372, 'min_weight_fraction_leaf': 0.03907675242210548, 'max_features': 0.9372995425724108}. Best is trial 448 with value: 0.8888507593246218.[0m
[32m[I 2022-04-13 11:55:14,260][0m Trial 466 finished with value: 0.7595105942750412 and parameters: {'splitter': 'random', 'min_samples_split': 0.1622558943450237, 'min_samples_leaf': 0.05932762109445079, 'min_weight_fraction_leaf': 0.025061920360761034, 'max_features': 0.420634219291256}. Best is trial 448 with value: 0.8888507593246218.[0m
[32m[I 2022-04-13 11:55:17,188][0m Trial 467 finished with value: 0.8813267432681441 and parameters: {'splitter': 'best', 'min_samples_split': 0.13368804225672842, 'min_samples_leaf': 0.026724774336300564, 'min_weight_fraction_leaf': 0.061740454400356345, 'max_features': 0.971949932015649}. Best is trial 448 with value: 0.8888507593246218.[0m
/media/san2_ssd/data/Workdir/survival/utils.py:305: RuntimeWarning: invalid value encountered in true_divide
  pdfs = np.gradient(1-survs,axis=1)/norms
/media/san2_ssd/data/Workdir/survival/utils.py:305: RuntimeWarning: invalid value encountered in true_divide
  pdfs = np.gradient(1-survs,axis=1)/norms
/media/san2_ssd/data/Workdir/survival/utils.py:305: RuntimeWarning: invalid value encountered in true_divide
  pdfs = np.gradient(1-survs,axis=1)/norms
[32m[I 2022-04-13 11:55:20,197][0m Trial 468 finished with value: 0.8829057306160809 and parameters: {'splitter': 'best', 'min_samples_split': 0.10267507906344167, 'min_samples_leaf': 0.011845548930053643, 'min_weight_fraction_leaf': 0.049155976078884445, 'max_features': 0.9550597064918382}. Best is trial 448 with value: 0.8888507593246218.[0m
/media/san2_ssd/data/Workdir/survival/utils.py:305: RuntimeWarning: invalid value encountered in true_divide
  pdfs = np.gradient(1-survs,axis=1)/norms
/media/san2_ssd/data/Workdir/survival/utils.py:305: RuntimeWarning: invalid value encountered in true_divide
  pdfs = np.gradient(1-survs,axis=1)/norms
/media/san2_ssd/data/Workdir/survival/utils.py:305: RuntimeWarning: invalid value encountered in true_divide
  pdfs = np.gradient(1-survs,axis=1)/norms
/media/san2_ssd/data/Workdir/survival/utils.py:305: RuntimeWarning: invalid value encountered in true_divide
  pdfs = np.gradient(1-survs,axis=1)/norms
/media/san2_ssd/data/Workdir/survival/utils.py:305: RuntimeWarning: invalid value encountered in true_divide
  pdfs = np.gradient(1-survs,axis=1)/norms
