[32m[I 2022-04-13 12:08:57,088][0m Trial 904 finished with value: 0.8785732925138474 and parameters: {'splitter': 'best', 'min_samples_split': 0.08188616906782824, 'min_samples_leaf': 0.03619157943947871, 'min_weight_fraction_leaf': 0.027095434967715163, 'max_features': 0.49945184577518703}. Best is trial 448 with value: 0.8888507593246218.[0m
/media/san2_ssd/data/Workdir/survival/utils.py:305: RuntimeWarning: invalid value encountered in true_divide
  pdfs = np.gradient(1-survs,axis=1)/norms
/media/san2_ssd/data/Workdir/survival/utils.py:305: RuntimeWarning: invalid value encountered in true_divide
  pdfs = np.gradient(1-survs,axis=1)/norms
/media/san2_ssd/data/Workdir/survival/utils.py:305: RuntimeWarning: invalid value encountered in true_divide
  pdfs = np.gradient(1-survs,axis=1)/norms
/media/san2_ssd/data/Workdir/survival/utils.py:305: RuntimeWarning: invalid value encountered in true_divide
  pdfs = np.gradient(1-survs,axis=1)/norms
[32m[I 2022-04-13 12:08:58,891][0m Trial 905 finished with value: 0.8858572586341051 and parameters: {'splitter': 'best', 'min_samples_split': 0.09445020398034798, 'min_samples_leaf': 0.03617332738610827, 'min_weight_fraction_leaf': 0.010252029898107522, 'max_features': 0.9792519613005127}. Best is trial 448 with value: 0.8888507593246218.[0m
/media/san2_ssd/data/Workdir/survival/utils.py:305: RuntimeWarning: invalid value encountered in true_divide
  pdfs = np.gradient(1-survs,axis=1)/norms
/media/san2_ssd/data/Workdir/survival/utils.py:305: RuntimeWarning: invalid value encountered in true_divide
  pdfs = np.gradient(1-survs,axis=1)/norms
[32m[I 2022-04-13 12:09:01,673][0m Trial 906 finished with value: 0.8850214022960919 and parameters: {'splitter': 'best', 'min_samples_split': 0.07630687188703103, 'min_samples_leaf': 0.05519466073782693, 'min_weight_fraction_leaf': 0.019218990981959966, 'max_features': 0.9996495818565386}. Best is trial 448 with value: 0.8888507593246218.[0m
/media/san2_ssd/data/Workdir/survival/utils.py:305: RuntimeWarning: invalid value encountered in true_divide
  pdfs = np.gradient(1-survs,axis=1)/norms
[32m[I 2022-04-13 12:09:03,142][0m Trial 907 finished with value: 0.7862429285042403 and parameters: {'splitter': 'best', 'min_samples_split': 0.06257320740749417, 'min_samples_leaf': 0.06252142848322381, 'min_weight_fraction_leaf': 0.014757555629474785, 'max_features': 0.9998514156042267}. Best is trial 448 with value: 0.8888507593246218.[0m
/media/san2_ssd/data/Workdir/survival/utils.py:305: RuntimeWarning: invalid value encountered in true_divide
  pdfs = np.gradient(1-survs,axis=1)/norms
/media/san2_ssd/data/Workdir/survival/utils.py:305: RuntimeWarning: invalid value encountered in true_divide
  pdfs = np.gradient(1-survs,axis=1)/norms
/media/san2_ssd/data/Workdir/survival/utils.py:305: RuntimeWarning: invalid value encountered in true_divide
  pdfs = np.gradient(1-survs,axis=1)/norms
[32m[I 2022-04-13 12:09:04,168][0m Trial 908 finished with value: 0.8843648194054754 and parameters: {'splitter': 'best', 'min_samples_split': 0.0952769022260372, 'min_samples_leaf': 0.04695285970833103, 'min_weight_fraction_leaf': 0.03563668156851795, 'max_features': 0.9500630375308119}. Best is trial 448 with value: 0.8888507593246218.[0m
[32m[I 2022-04-13 12:09:04,300][0m Trial 909 finished with value: 0.7451411882084279 and parameters: {'splitter': 'random', 'min_samples_split': 0.02085658823984414, 'min_samples_leaf': 0.22947993936960054, 'min_weight_fraction_leaf': 0.033385577560877254, 'max_features': 0.9685897285224478}. Best is trial 448 with value: 0.8888507593246218.[0m
/media/san2_ssd/data/Workdir/survival/utils.py:305: RuntimeWarning: invalid value encountered in true_divide
  pdfs = np.gradient(1-survs,axis=1)/norms
/media/san2_ssd/data/Workdir/survival/utils.py:305: RuntimeWarning: invalid value encountered in true_divide
  pdfs = np.gradient(1-survs,axis=1)/norms
/media/san2_ssd/data/Workdir/survival/utils.py:305: RuntimeWarning: invalid value encountered in true_divide
  pdfs = np.gradient(1-survs,axis=1)/norms
/media/san2_ssd/data/Workdir/survival/utils.py:305: RuntimeWarning: invalid value encountered in true_divide
  pdfs = np.gradient(1-survs,axis=1)/norms
/media/san2_ssd/data/Workdir/survival/utils.py:305: RuntimeWarning: invalid value encountered in true_divide
  pdfs = np.gradient(1-survs,axis=1)/norms
[32m[I 2022-04-13 12:09:05,683][0m Trial 910 finished with value: 0.8833433275011169 and parameters: {'splitter': 'best', 'min_samples_split': 0.07727329711676492, 'min_samples_leaf': 0.04026345861676496, 'min_weight_fraction_leaf': 0.022778630572607587, 'max_features': 0.9355408340927945}. Best is trial 448 with value: 0.8888507593246218.[0m
/media/san2_ssd/data/Workdir/survival/utils.py:305: RuntimeWarning: invalid value encountered in true_divide
  pdfs = np.gradient(1-survs,axis=1)/norms
[32m[I 2022-04-13 12:09:06,497][0m Trial 911 finished with value: 0.863178575109599 and parameters: {'splitter': 'best', 'min_samples_split': 0.09554393729919203, 'min_samples_leaf': 0.02703739384240654, 'min_weight_fraction_leaf': 0.03994170971520366, 'max_features': 0.5407434179312718}. Best is trial 448 with value: 0.8888507593246218.[0m
[32m[I 2022-04-13 12:09:08,581][0m Trial 912 finished with value: 0.7812430357550673 and parameters: {'splitter': 'best', 'min_samples_split': 0.10096969179534072, 'min_samples_leaf': 0.03197114989536319, 'min_weight_fraction_leaf': 0.000696227450264604, 'max_features': 0.7636903707943794}. Best is trial 448 with value: 0.8888507593246218.[0m
/media/san2_ssd/data/Workdir/survival/utils.py:305: RuntimeWarning: invalid value encountered in true_divide
  pdfs = np.gradient(1-survs,axis=1)/norms
/media/san2_ssd/data/Workdir/survival/utils.py:305: RuntimeWarning: invalid value encountered in true_divide
  pdfs = np.gradient(1-survs,axis=1)/norms
/media/san2_ssd/data/Workdir/survival/utils.py:305: RuntimeWarning: invalid value encountered in true_divide
  pdfs = np.gradient(1-survs,axis=1)/norms
[32m[I 2022-04-13 12:09:10,115][0m Trial 913 finished with value: 0.8854690605133584 and parameters: {'splitter': 'best', 'min_samples_split': 0.04742284053246936, 'min_samples_leaf': 0.051334470316034324, 'min_weight_fraction_leaf': 0.012947686910629566, 'max_features': 0.9823151670017582}. Best is trial 448 with value: 0.8888507593246218.[0m
[32m[I 2022-04-13 12:09:11,134][0m Trial 914 finished with value: 0.7850944955918016 and parameters: {'splitter': 'best', 'min_samples_split': 0.08163666439879924, 'min_samples_leaf': 0.08576702382336832, 'min_weight_fraction_leaf': 0.02218325924090508, 'max_features': 0.9814140086354214}. Best is trial 448 with value: 0.8888507593246218.[0m
[32m[I 2022-04-13 12:09:11,809][0m Trial 915 finished with value: 0.6981432179087999 and parameters: {'splitter': 'best', 'min_samples_split': 0.09327536913416493, 'min_samples_leaf': 0.04340807177130998, 'min_weight_fraction_leaf': 0.46735600288971296, 'max_features': 0.9615883582677339}. Best is trial 448 with value: 0.8888507593246218.[0m
/media/san2_ssd/data/Workdir/survival/utils.py:305: RuntimeWarning: invalid value encountered in true_divide
  pdfs = np.gradient(1-survs,axis=1)/norms
/media/san2_ssd/data/Workdir/survival/utils.py:305: RuntimeWarning: invalid value encountered in true_divide
  pdfs = np.gradient(1-survs,axis=1)/norms
/media/san2_ssd/data/Workdir/survival/utils.py:305: RuntimeWarning: invalid value encountered in true_divide
  pdfs = np.gradient(1-survs,axis=1)/norms
/media/san2_ssd/data/Workdir/survival/utils.py:305: RuntimeWarning: invalid value encountered in true_divide
  pdfs = np.gradient(1-survs,axis=1)/norms
[32m[I 2022-04-13 12:09:14,714][0m Trial 916 finished with value: 0.8834984389132039 and parameters: {'splitter': 'best', 'min_samples_split': 0.10390307892632354, 'min_samples_leaf': 0.031396938783992974, 'min_weight_fraction_leaf': 0.009703411361499947, 'max_features': 0.95258385442369}. Best is trial 448 with value: 0.8888507593246218.[0m
[32m[I 2022-04-13 12:09:18,064][0m Trial 917 finished with value: 0.5724825449583739 and parameters: {'splitter': 'best', 'min_samples_split': 0.2546283593786569, 'min_samples_leaf': 0.05949406860252794, 'min_weight_fraction_leaf': 0.033561056880401015, 'max_features': 0.9229027803123617}. Best is trial 448 with value: 0.8888507593246218.[0m
[32m[I 2022-04-13 12:09:20,037][0m Trial 918 finished with value: 0.5800522583251434 and parameters: {'splitter': 'best', 'min_samples_split': 0.007491238955792262, 'min_samples_leaf': 0.1445594707984208, 'min_weight_fraction_leaf': 0.019733223106721924, 'max_features': 0.9799106028270885}. Best is trial 448 with value: 0.8888507593246218.[0m
/media/san2_ssd/data/Workdir/survival/utils.py:305: RuntimeWarning: invalid value encountered in true_divide
  pdfs = np.gradient(1-survs,axis=1)/norms
/media/san2_ssd/data/Workdir/survival/utils.py:305: RuntimeWarning: invalid value encountered in true_divide
  pdfs = np.gradient(1-survs,axis=1)/norms
/media/san2_ssd/data/Workdir/survival/utils.py:305: RuntimeWarning: invalid value encountered in true_divide
  pdfs = np.gradient(1-survs,axis=1)/norms
[32m[I 2022-04-13 12:09:21,997][0m Trial 919 finished with value: 0.8857783983670068 and parameters: {'splitter': 'best', 'min_samples_split': 0.08680090047653685, 'min_samples_leaf': 0.04976878805886286, 'min_weight_fraction_leaf': 0.025425082970311895, 'max_features': 0.9997394984546063}. Best is trial 448 with value: 0.8888507593246218.[0m
/media/san2_ssd/data/Workdir/survival/utils.py:305: RuntimeWarning: invalid value encountered in true_divide
  pdfs = np.gradient(1-survs,axis=1)/norms
/media/san2_ssd/data/Workdir/survival/utils.py:305: RuntimeWarning: invalid value encountered in true_divide
  pdfs = np.gradient(1-survs,axis=1)/norms
/media/san2_ssd/data/Workdir/survival/utils.py:305: RuntimeWarning: invalid value encountered in true_divide
  pdfs = np.gradient(1-survs,axis=1)/norms
/media/san2_ssd/data/Workdir/survival/utils.py:305: RuntimeWarning: invalid value encountered in true_divide
  pdfs = np.gradient(1-survs,axis=1)/norms
/media/san2_ssd/data/Workdir/survival/utils.py:305: RuntimeWarning: invalid value encountered in true_divide
  pdfs = np.gradient(1-survs,axis=1)/norms
[32m[I 2022-04-13 12:09:23,736][0m Trial 920 finished with value: 0.8841559343982069 and parameters: {'splitter': 'best', 'min_samples_split': 0.10564609209742268, 'min_samples_leaf': 0.027637659332348095, 'min_weight_fraction_leaf': 0.04217420791986711, 'max_features': 0.961758641961498}. Best is trial 448 with value: 0.8888507593246218.[0m
/media/san2_ssd/data/Workdir/survival/utils.py:305: RuntimeWarning: invalid value encountered in true_divide
  pdfs = np.gradient(1-survs,axis=1)/norms
/media/san2_ssd/data/Workdir/survival/utils.py:305: RuntimeWarning: invalid value encountered in true_divide
  pdfs = np.gradient(1-survs,axis=1)/norms
/media/san2_ssd/data/Workdir/survival/utils.py:305: RuntimeWarning: invalid value encountered in true_divide
  pdfs = np.gradient(1-survs,axis=1)/norms
/media/san2_ssd/data/Workdir/survival/utils.py:305: RuntimeWarning: invalid value encountered in true_divide
  pdfs = np.gradient(1-survs,axis=1)/norms
[32m[I 2022-04-13 12:09:24,725][0m Trial 921 finished with value: 0.8867263507711085 and parameters: {'splitter': 'best', 'min_samples_split': 0.10032844885815005, 'min_samples_leaf': 0.04010943375129913, 'min_weight_fraction_leaf': 0.011104022285986538, 'max_features': 0.983104138541938}. Best is trial 448 with value: 0.8888507593246218.[0m
/media/san2_ssd/data/Workdir/survival/utils.py:305: RuntimeWarning: invalid value encountered in true_divide
  pdfs = np.gradient(1-survs,axis=1)/norms
/media/san2_ssd/data/Workdir/survival/utils.py:305: RuntimeWarning: invalid value encountered in true_divide
  pdfs = np.gradient(1-survs,axis=1)/norms
/media/san2_ssd/data/Workdir/survival/utils.py:305: RuntimeWarning: invalid value encountered in true_divide
  pdfs = np.gradient(1-survs,axis=1)/norms
/media/san2_ssd/data/Workdir/survival/utils.py:305: RuntimeWarning: invalid value encountered in true_divide
  pdfs = np.gradient(1-survs,axis=1)/norms
[32m[I 2022-04-13 12:09:25,681][0m Trial 922 finished with value: 0.8847895862220911 and parameters: {'splitter': 'best', 'min_samples_split': 0.10949329456814569, 'min_samples_leaf': 0.03598697272291494, 'min_weight_fraction_leaf': 0.024623488876891544, 'max_features': 0.9682479263103343}. Best is trial 448 with value: 0.8888507593246218.[0m
/media/san2_ssd/data/Workdir/survival/utils.py:305: RuntimeWarning: invalid value encountered in true_divide
  pdfs = np.gradient(1-survs,axis=1)/norms
/media/san2_ssd/data/Workdir/survival/utils.py:305: RuntimeWarning: invalid value encountered in true_divide
  pdfs = np.gradient(1-survs,axis=1)/norms
/media/san2_ssd/data/Workdir/survival/utils.py:305: RuntimeWarning: invalid value encountered in true_divide
  pdfs = np.gradient(1-survs,axis=1)/norms
/media/san2_ssd/data/Workdir/survival/utils.py:305: RuntimeWarning: invalid value encountered in true_divide
  pdfs = np.gradient(1-survs,axis=1)/norms
/media/san2_ssd/data/Workdir/survival/utils.py:305: RuntimeWarning: invalid value encountered in true_divide
  pdfs = np.gradient(1-survs,axis=1)/norms
[32m[I 2022-04-13 12:09:27,484][0m Trial 923 finished with value: 0.8831582110142913 and parameters: {'splitter': 'best', 'min_samples_split': 0.08858815563505057, 'min_samples_leaf': 0.026626093159215665, 'min_weight_fraction_leaf': 0.044361648422371946, 'max_features': 0.9364964845751459}. Best is trial 448 with value: 0.8888507593246218.[0m
/media/san2_ssd/data/Workdir/survival/utils.py:305: RuntimeWarning: invalid value encountered in true_divide
  pdfs = np.gradient(1-survs,axis=1)/norms
[32m[I 2022-04-13 12:09:28,824][0m Trial 924 finished with value: 0.8857694580205372 and parameters: {'splitter': 'best', 'min_samples_split': 0.11429256579219473, 'min_samples_leaf': 0.061145683419074726, 'min_weight_fraction_leaf': 0.01741514485925666, 'max_features': 0.9995739958559418}. Best is trial 448 with value: 0.8888507593246218.[0m
[32m[I 2022-04-13 12:09:30,282][0m Trial 925 finished with value: 0.4625505324749512 and parameters: {'splitter': 'best', 'min_samples_split': 0.07094446124136747, 'min_samples_leaf': 0.049101027930435026, 'min_weight_fraction_leaf': 0.25026929773410755, 'max_features': 0.9810179793111614}. Best is trial 448 with value: 0.8888507593246218.[0m
[32m[I 2022-04-13 12:09:32,148][0m Trial 926 finished with value: 0.7857568027488551 and parameters: {'splitter': 'best', 'min_samples_split': 0.09512947000062058, 'min_samples_leaf': 0.07338345337797957, 'min_weight_fraction_leaf': 0.029086741797639402, 'max_features': 0.999927988778647}. Best is trial 448 with value: 0.8888507593246218.[0m
/media/san2_ssd/data/Workdir/survival/utils.py:305: RuntimeWarning: invalid value encountered in true_divide
  pdfs = np.gradient(1-survs,axis=1)/norms
/media/san2_ssd/data/Workdir/survival/utils.py:305: RuntimeWarning: invalid value encountered in true_divide
  pdfs = np.gradient(1-survs,axis=1)/norms
/media/san2_ssd/data/Workdir/survival/utils.py:305: RuntimeWarning: invalid value encountered in true_divide
  pdfs = np.gradient(1-survs,axis=1)/norms
/media/san2_ssd/data/Workdir/survival/utils.py:305: RuntimeWarning: invalid value encountered in true_divide
  pdfs = np.gradient(1-survs,axis=1)/norms
[32m[I 2022-04-13 12:09:34,231][0m Trial 927 finished with value: 0.8866338783395955 and parameters: {'splitter': 'best', 'min_samples_split': 0.12687898414891355, 'min_samples_leaf': 0.04006227543235657, 'min_weight_fraction_leaf': 7.783585566134739e-05, 'max_features': 0.9997949108629273}. Best is trial 448 with value: 0.8888507593246218.[0m
[32m[I 2022-04-13 12:09:34,538][0m Trial 928 finished with value: 0.8812580174371056 and parameters: {'splitter': 'random', 'min_samples_split': 0.10777722527619751, 'min_samples_leaf': 0.056615264257996914, 'min_weight_fraction_leaf': 0.010602992029962288, 'max_features': 0.9710617747757366}. Best is trial 448 with value: 0.8888507593246218.[0m
/media/san2_ssd/data/Workdir/survival/utils.py:305: RuntimeWarning: invalid value encountered in true_divide
  pdfs = np.gradient(1-survs,axis=1)/norms
/media/san2_ssd/data/Workdir/survival/utils.py:305: RuntimeWarning: invalid value encountered in true_divide
  pdfs = np.gradient(1-survs,axis=1)/norms
/media/san2_ssd/data/Workdir/survival/utils.py:305: RuntimeWarning: invalid value encountered in true_divide
  pdfs = np.gradient(1-survs,axis=1)/norms
/media/san2_ssd/data/Workdir/survival/utils.py:305: RuntimeWarning: invalid value encountered in true_divide
  pdfs = np.gradient(1-survs,axis=1)/norms
[32m[I 2022-04-13 12:09:36,920][0m Trial 929 finished with value: 0.8826272304382655 and parameters: {'splitter': 'best', 'min_samples_split': 0.07881347565666434, 'min_samples_leaf': 0.028468175431288413, 'min_weight_fraction_leaf': 0.027039960060347194, 'max_features': 0.9471935399867563}. Best is trial 448 with value: 0.8888507593246218.[0m
/media/san2_ssd/data/Workdir/survival/utils.py:305: RuntimeWarning: invalid value encountered in true_divide
  pdfs = np.gradient(1-survs,axis=1)/norms
/media/san2_ssd/data/Workdir/survival/utils.py:305: RuntimeWarning: invalid value encountered in true_divide
  pdfs = np.gradient(1-survs,axis=1)/norms
/media/san2_ssd/data/Workdir/survival/utils.py:305: RuntimeWarning: invalid value encountered in true_divide
  pdfs = np.gradient(1-survs,axis=1)/norms
[32m[I 2022-04-13 12:09:39,269][0m Trial 930 finished with value: 0.8814217760361182 and parameters: {'splitter': 'best', 'min_samples_split': 0.11851137076142591, 'min_samples_leaf': 0.032886994211574413, 'min_weight_fraction_leaf': 0.020717416036012723, 'max_features': 0.9105069962258049}. Best is trial 448 with value: 0.8888507593246218.[0m
[32m[I 2022-04-13 12:09:40,223][0m Trial 931 finished with value: 0.5748550336610132 and parameters: {'splitter': 'best', 'min_samples_split': 0.23271063047081808, 'min_samples_leaf': 0.12619587905148738, 'min_weight_fraction_leaf': 0.03299290059026106, 'max_features': 0.9631835196824674}. Best is trial 448 with value: 0.8888507593246218.[0m
/media/san2_ssd/data/Workdir/survival/utils.py:305: RuntimeWarning: invalid value encountered in true_divide
  pdfs = np.gradient(1-survs,axis=1)/norms
/media/san2_ssd/data/Workdir/survival/utils.py:305: RuntimeWarning: invalid value encountered in true_divide
  pdfs = np.gradient(1-survs,axis=1)/norms
/media/san2_ssd/data/Workdir/survival/utils.py:305: RuntimeWarning: invalid value encountered in true_divide
  pdfs = np.gradient(1-survs,axis=1)/norms
/media/san2_ssd/data/Workdir/survival/utils.py:305: RuntimeWarning: invalid value encountered in true_divide
  pdfs = np.gradient(1-survs,axis=1)/norms
/media/san2_ssd/data/Workdir/survival/utils.py:305: RuntimeWarning: invalid value encountered in true_divide
  pdfs = np.gradient(1-survs,axis=1)/norms
[32m[I 2022-04-13 12:09:42,464][0m Trial 932 finished with value: 0.8857011697080648 and parameters: {'splitter': 'best', 'min_samples_split': 0.03965028337165262, 'min_samples_leaf': 0.020334109873417335, 'min_weight_fraction_leaf': 0.010105829127085481, 'max_features': 0.9777452113295826}. Best is trial 448 with value: 0.8888507593246218.[0m
/media/san2_ssd/data/Workdir/survival/utils.py:305: RuntimeWarning: invalid value encountered in true_divide
  pdfs = np.gradient(1-survs,axis=1)/norms
/media/san2_ssd/data/Workdir/survival/utils.py:305: RuntimeWarning: invalid value encountered in true_divide
  pdfs = np.gradient(1-survs,axis=1)/norms
/media/san2_ssd/data/Workdir/survival/utils.py:305: RuntimeWarning: invalid value encountered in true_divide
  pdfs = np.gradient(1-survs,axis=1)/norms
[32m[I 2022-04-13 12:09:45,101][0m Trial 933 finished with value: 0.8828159493016997 and parameters: {'splitter': 'best', 'min_samples_split': 0.05563475693251934, 'min_samples_leaf': 0.044245307657167936, 'min_weight_fraction_leaf': 0.05407716141293178, 'max_features': 0.9527923240776668}. Best is trial 448 with value: 0.8888507593246218.[0m
/media/san2_ssd/data/Workdir/survival/utils.py:305: RuntimeWarning: invalid value encountered in true_divide
  pdfs = np.gradient(1-survs,axis=1)/norms
/media/san2_ssd/data/Workdir/survival/utils.py:305: RuntimeWarning: invalid value encountered in true_divide
  pdfs = np.gradient(1-survs,axis=1)/norms
/media/san2_ssd/data/Workdir/survival/utils.py:305: RuntimeWarning: invalid value encountered in true_divide
  pdfs = np.gradient(1-survs,axis=1)/norms
/media/san2_ssd/data/Workdir/survival/utils.py:305: RuntimeWarning: invalid value encountered in true_divide
  pdfs = np.gradient(1-survs,axis=1)/norms
/media/san2_ssd/data/Workdir/survival/utils.py:305: RuntimeWarning: invalid value encountered in true_divide
  pdfs = np.gradient(1-survs,axis=1)/norms
[32m[I 2022-04-13 12:09:47,661][0m Trial 934 finished with value: 0.8847936996447174 and parameters: {'splitter': 'best', 'min_samples_split': 0.09749877767189032, 'min_samples_leaf': 0.02552206350125952, 'min_weight_fraction_leaf': 0.04014849476738412, 'max_features': 0.9384377881120011}. Best is trial 448 with value: 0.8888507593246218.[0m
/media/san2_ssd/data/Workdir/survival/utils.py:305: RuntimeWarning: invalid value encountered in true_divide
  pdfs = np.gradient(1-survs,axis=1)/norms
/media/san2_ssd/data/Workdir/survival/utils.py:305: RuntimeWarning: invalid value encountered in true_divide
  pdfs = np.gradient(1-survs,axis=1)/norms
