[32m[I 2022-04-13 12:32:03,904][0m Trial 701 finished with value: 0.7601761363568971 and parameters: {'splitter': 'best', 'min_samples_split': 0.22759594060325217, 'min_samples_leaf': 0.03473517231920859, 'min_weight_fraction_leaf': 0.03611197332956786, 'max_features': 0.9836614294848869}. Best is trial 241 with value: 0.7773840258827056.[0m
[32m[I 2022-04-13 12:32:05,579][0m Trial 702 finished with value: 0.770084767472636 and parameters: {'splitter': 'best', 'min_samples_split': 0.05155913829543099, 'min_samples_leaf': 0.03915503670188491, 'min_weight_fraction_leaf': 0.057300464217270114, 'max_features': 0.9992945751048756}. Best is trial 241 with value: 0.7773840258827056.[0m
[32m[I 2022-04-13 12:32:09,620][0m Trial 703 finished with value: 0.7699077825235361 and parameters: {'splitter': 'best', 'min_samples_split': 0.08229330206843216, 'min_samples_leaf': 0.022800386194641656, 'min_weight_fraction_leaf': 0.024258996654914305, 'max_features': 0.9322161932516593}. Best is trial 241 with value: 0.7773840258827056.[0m
[32m[I 2022-04-13 12:32:12,736][0m Trial 704 finished with value: 0.7679930877218492 and parameters: {'splitter': 'best', 'min_samples_split': 0.11267873610543654, 'min_samples_leaf': 0.010277763986894691, 'min_weight_fraction_leaf': 0.03991773198596042, 'max_features': 0.9521282585874704}. Best is trial 241 with value: 0.7773840258827056.[0m
[32m[I 2022-04-13 12:32:13,564][0m Trial 705 finished with value: 0.7695518558773202 and parameters: {'splitter': 'best', 'min_samples_split': 0.14741843927178439, 'min_samples_leaf': 0.03609793464604823, 'min_weight_fraction_leaf': 0.0499166929509861, 'max_features': 0.9798168098173052}. Best is trial 241 with value: 0.7773840258827056.[0m
[32m[I 2022-04-13 12:32:14,054][0m Trial 706 finished with value: 0.7108095991864705 and parameters: {'splitter': 'best', 'min_samples_split': 0.12982675370970226, 'min_samples_leaf': 0.2010611903897636, 'min_weight_fraction_leaf': 0.028003223885495573, 'max_features': 0.9647201270285373}. Best is trial 241 with value: 0.7773840258827056.[0m
[32m[I 2022-04-13 12:32:15,183][0m Trial 707 finished with value: 0.770859115606928 and parameters: {'splitter': 'best', 'min_samples_split': 0.1066519872516333, 'min_samples_leaf': 0.02837925902915648, 'min_weight_fraction_leaf': 0.02317276726363532, 'max_features': 0.9819387910471552}. Best is trial 241 with value: 0.7773840258827056.[0m
[32m[I 2022-04-13 12:32:17,467][0m Trial 708 finished with value: 0.759156163083129 and parameters: {'splitter': 'best', 'min_samples_split': 0.13672047917205893, 'min_samples_leaf': 0.017376986999066545, 'min_weight_fraction_leaf': 0.1191993408419563, 'max_features': 0.9995416942724429}. Best is trial 241 with value: 0.7773840258827056.[0m
[32m[I 2022-04-13 12:32:19,217][0m Trial 709 finished with value: 0.7184224729562103 and parameters: {'splitter': 'best', 'min_samples_split': 0.11822590725895857, 'min_samples_leaf': 0.04077241219986806, 'min_weight_fraction_leaf': 0.14842153293342092, 'max_features': 0.9354327613542173}. Best is trial 241 with value: 0.7773840258827056.[0m
[32m[I 2022-04-13 12:32:19,953][0m Trial 710 finished with value: 0.7530879202667752 and parameters: {'splitter': 'best', 'min_samples_split': 0.09996430932264791, 'min_samples_leaf': 0.027496040319332813, 'min_weight_fraction_leaf': 0.03755976657767644, 'max_features': 0.5973307658646355}. Best is trial 241 with value: 0.7773840258827056.[0m
[32m[I 2022-04-13 12:32:20,325][0m Trial 711 finished with value: 0.7573056911344258 and parameters: {'splitter': 'random', 'min_samples_split': 0.12383713935403375, 'min_samples_leaf': 0.05004093281279491, 'min_weight_fraction_leaf': 0.06499516138576023, 'max_features': 0.9620823044623859}. Best is trial 241 with value: 0.7773840258827056.[0m
[32m[I 2022-04-13 12:32:22,875][0m Trial 712 finished with value: 0.7698972754490769 and parameters: {'splitter': 'best', 'min_samples_split': 0.14062513787692507, 'min_samples_leaf': 0.04236931533819744, 'min_weight_fraction_leaf': 0.05002177004599575, 'max_features': 0.9779846081384426}. Best is trial 241 with value: 0.7773840258827056.[0m
[32m[I 2022-04-13 12:32:25,305][0m Trial 713 finished with value: 0.773347988314503 and parameters: {'splitter': 'best', 'min_samples_split': 0.10999757582017583, 'min_samples_leaf': 0.010556997356548968, 'min_weight_fraction_leaf': 0.019495978073749837, 'max_features': 0.9997686412338884}. Best is trial 241 with value: 0.7773840258827056.[0m
[32m[I 2022-04-13 12:32:27,540][0m Trial 714 finished with value: 0.7669953487971306 and parameters: {'splitter': 'best', 'min_samples_split': 0.08724761030473077, 'min_samples_leaf': 0.030613974064632624, 'min_weight_fraction_leaf': 0.032676575353032755, 'max_features': 0.9188829811314976}. Best is trial 241 with value: 0.7773840258827056.[0m
[32m[I 2022-04-13 12:32:30,688][0m Trial 715 finished with value: 0.7637225669117346 and parameters: {'splitter': 'best', 'min_samples_split': 0.12756107007747738, 'min_samples_leaf': 0.01768711620524515, 'min_weight_fraction_leaf': 0.045320131537732844, 'max_features': 0.9515816838229891}. Best is trial 241 with value: 0.7773840258827056.[0m
[32m[I 2022-04-13 12:32:32,714][0m Trial 716 finished with value: 0.7695082774757669 and parameters: {'splitter': 'best', 'min_samples_split': 0.11519632557392182, 'min_samples_leaf': 0.036393034406510205, 'min_weight_fraction_leaf': 0.019620259649873906, 'max_features': 0.9689570913263434}. Best is trial 241 with value: 0.7773840258827056.[0m
[32m[I 2022-04-13 12:32:33,871][0m Trial 717 finished with value: 0.7709004221224879 and parameters: {'splitter': 'best', 'min_samples_split': 0.09829641133216972, 'min_samples_leaf': 0.050478511109392714, 'min_weight_fraction_leaf': 0.080401781080227, 'max_features': 0.9998964112658172}. Best is trial 241 with value: 0.7773840258827056.[0m
[32m[I 2022-04-13 12:32:35,154][0m Trial 718 finished with value: 0.7629360752972336 and parameters: {'splitter': 'best', 'min_samples_split': 0.14910705108479277, 'min_samples_leaf': 0.025534910066371545, 'min_weight_fraction_leaf': 0.032523342441252594, 'max_features': 0.9419727315216315}. Best is trial 241 with value: 0.7773840258827056.[0m
[32m[I 2022-04-13 12:32:36,480][0m Trial 719 finished with value: 0.7712577960184541 and parameters: {'splitter': 'best', 'min_samples_split': 0.13520434991849326, 'min_samples_leaf': 0.04322035397996841, 'min_weight_fraction_leaf': 0.05419484541116125, 'max_features': 0.9824750604821357}. Best is trial 241 with value: 0.7773840258827056.[0m
[32m[I 2022-04-13 12:32:37,789][0m Trial 720 finished with value: 0.7651719429293278 and parameters: {'splitter': 'best', 'min_samples_split': 0.12069654464047805, 'min_samples_leaf': 0.05901327718436776, 'min_weight_fraction_leaf': 0.04319518255856495, 'max_features': 0.9644067702078457}. Best is trial 241 with value: 0.7773840258827056.[0m
[32m[I 2022-04-13 12:32:37,984][0m Trial 721 finished with value: 0.5962864358175997 and parameters: {'splitter': 'best', 'min_samples_split': 0.11053991000607215, 'min_samples_leaf': 0.4548771336755516, 'min_weight_fraction_leaf': 0.18096234411735018, 'max_features': 0.9819124371188656}. Best is trial 241 with value: 0.7773840258827056.[0m
[32m[I 2022-04-13 12:32:39,409][0m Trial 722 finished with value: 0.7650540644465352 and parameters: {'splitter': 'best', 'min_samples_split': 0.0918931274243042, 'min_samples_leaf': 0.0011248971380807896, 'min_weight_fraction_leaf': 0.015074268957509011, 'max_features': 0.9534189891867839}. Best is trial 241 with value: 0.7773840258827056.[0m
[32m[I 2022-04-13 12:32:41,675][0m Trial 723 finished with value: 0.7687747649561059 and parameters: {'splitter': 'best', 'min_samples_split': 0.07766461532726177, 'min_samples_leaf': 0.018627440282471007, 'min_weight_fraction_leaf': 0.03162522396492341, 'max_features': 0.9809264108466331}. Best is trial 241 with value: 0.7773840258827056.[0m
[32m[I 2022-04-13 12:32:43,022][0m Trial 724 finished with value: 0.5962864358175997 and parameters: {'splitter': 'best', 'min_samples_split': 0.1592878500271955, 'min_samples_leaf': 0.03645214888288964, 'min_weight_fraction_leaf': 0.4542432581856184, 'max_features': 0.911166703769799}. Best is trial 241 with value: 0.7773840258827056.[0m
[32m[I 2022-04-13 12:32:45,038][0m Trial 725 finished with value: 0.7606796183705518 and parameters: {'splitter': 'best', 'min_samples_split': 0.061890111662631815, 'min_samples_leaf': 0.04988126249713296, 'min_weight_fraction_leaf': 0.06230737404659948, 'max_features': 0.9679530612303116}. Best is trial 241 with value: 0.7773840258827056.[0m
[32m[I 2022-04-13 12:32:46,073][0m Trial 726 finished with value: 0.7669973797317404 and parameters: {'splitter': 'best', 'min_samples_split': 0.12946136140289705, 'min_samples_leaf': 0.027022772242461884, 'min_weight_fraction_leaf': 0.025045624596216433, 'max_features': 0.9441520986319232}. Best is trial 241 with value: 0.7773840258827056.[0m
[32m[I 2022-04-13 12:32:46,594][0m Trial 727 finished with value: 0.7244050287093404 and parameters: {'splitter': 'best', 'min_samples_split': 0.1033049619474517, 'min_samples_leaf': 0.24495379504560488, 'min_weight_fraction_leaf': 0.04069263996445753, 'max_features': 0.9999919330683078}. Best is trial 241 with value: 0.7773840258827056.[0m
[32m[I 2022-04-13 12:32:46,928][0m Trial 728 finished with value: 0.6743624146605087 and parameters: {'splitter': 'best', 'min_samples_split': 0.1434783376514152, 'min_samples_leaf': 0.34002398149427837, 'min_weight_fraction_leaf': 0.01573582762560827, 'max_features': 0.9803825685369655}. Best is trial 241 with value: 0.7773840258827056.[0m
[32m[I 2022-04-13 12:32:47,958][0m Trial 729 finished with value: 0.7674154863528168 and parameters: {'splitter': 'best', 'min_samples_split': 0.12087551611543901, 'min_samples_leaf': 0.06775784483276058, 'min_weight_fraction_leaf': 0.00931139202983862, 'max_features': 0.9341919063642697}. Best is trial 241 with value: 0.7773840258827056.[0m
[32m[I 2022-04-13 12:32:48,183][0m Trial 730 finished with value: 0.7619544885491875 and parameters: {'splitter': 'random', 'min_samples_split': 0.11270356043167865, 'min_samples_leaf': 0.03132254959439618, 'min_weight_fraction_leaf': 0.0553498568068608, 'max_features': 0.9683672026220206}. Best is trial 241 with value: 0.7773840258827056.[0m
[32m[I 2022-04-13 12:32:51,015][0m Trial 731 finished with value: 0.7675282793524234 and parameters: {'splitter': 'best', 'min_samples_split': 0.1316556690470143, 'min_samples_leaf': 0.012491647836709415, 'min_weight_fraction_leaf': 0.028452698712730644, 'max_features': 0.9560415142037123}. Best is trial 241 with value: 0.7773840258827056.[0m
[32m[I 2022-04-13 12:32:53,321][0m Trial 732 finished with value: 0.774880857667228 and parameters: {'splitter': 'best', 'min_samples_split': 0.09624454357002603, 'min_samples_leaf': 0.042858419060589445, 'min_weight_fraction_leaf': 0.03801170791437851, 'max_features': 0.9993058906403478}. Best is trial 241 with value: 0.7773840258827056.[0m
[32m[I 2022-04-13 12:32:56,499][0m Trial 733 finished with value: 0.7718124659782518 and parameters: {'splitter': 'best', 'min_samples_split': 0.08336668508810403, 'min_samples_leaf': 0.03550723116982016, 'min_weight_fraction_leaf': 0.04803239615204029, 'max_features': 0.9844638700987279}. Best is trial 241 with value: 0.7773840258827056.[0m
[32m[I 2022-04-13 12:32:58,183][0m Trial 734 finished with value: 0.7647178720027151 and parameters: {'splitter': 'best', 'min_samples_split': 0.09658241649585057, 'min_samples_leaf': 0.020822900844670495, 'min_weight_fraction_leaf': 0.09997032083728007, 'max_features': 0.9821155626540597}. Best is trial 241 with value: 0.7773840258827056.[0m
[32m[I 2022-04-13 12:33:00,203][0m Trial 735 finished with value: 0.7669208247374579 and parameters: {'splitter': 'best', 'min_samples_split': 0.08962846989973923, 'min_samples_leaf': 0.04279254930633175, 'min_weight_fraction_leaf': 0.07007962416932026, 'max_features': 0.9985487548242464}. Best is trial 241 with value: 0.7773840258827056.[0m
[32m[I 2022-04-13 12:33:01,238][0m Trial 736 finished with value: 0.7678781812879817 and parameters: {'splitter': 'best', 'min_samples_split': 0.07588892307224573, 'min_samples_leaf': 0.026431678530431667, 'min_weight_fraction_leaf': 0.04112093574295447, 'max_features': 0.9614234584683204}. Best is trial 241 with value: 0.7773840258827056.[0m
[32m[I 2022-04-13 12:33:02,017][0m Trial 737 finished with value: 0.770042804592184 and parameters: {'splitter': 'best', 'min_samples_split': 0.09475551389316837, 'min_samples_leaf': 0.054649916136484414, 'min_weight_fraction_leaf': 0.05376403325417797, 'max_features': 0.9831561639502826}. Best is trial 241 with value: 0.7773840258827056.[0m
[32m[I 2022-04-13 12:33:02,558][0m Trial 738 finished with value: 0.593346362060699 and parameters: {'splitter': 'best', 'min_samples_split': 0.10489411491331385, 'min_samples_leaf': 0.011185525287172367, 'min_weight_fraction_leaf': 0.3987917678224284, 'max_features': 0.9546693622606824}. Best is trial 241 with value: 0.7773840258827056.[0m
[32m[I 2022-04-13 12:33:03,781][0m Trial 739 finished with value: 0.7695379396623343 and parameters: {'splitter': 'best', 'min_samples_split': 0.07094295842847353, 'min_samples_leaf': 0.037210550289717294, 'min_weight_fraction_leaf': 0.04125413061283667, 'max_features': 0.9976809102187859}. Best is trial 241 with value: 0.7773840258827056.[0m
[32m[I 2022-04-13 12:33:06,417][0m Trial 740 finished with value: 0.7614995936801723 and parameters: {'splitter': 'best', 'min_samples_split': 0.10085383088561735, 'min_samples_leaf': 0.021694950098278355, 'min_weight_fraction_leaf': 0.06175184483282073, 'max_features': 0.9682769951203793}. Best is trial 241 with value: 0.7773840258827056.[0m
[32m[I 2022-04-13 12:33:08,989][0m Trial 741 finished with value: 0.7691449892129505 and parameters: {'splitter': 'best', 'min_samples_split': 0.08514020840041545, 'min_samples_leaf': 0.03288283263205593, 'min_weight_fraction_leaf': 0.03422364375280253, 'max_features': 0.9992299526831752}. Best is trial 241 with value: 0.7773840258827056.[0m
[32m[I 2022-04-13 12:33:10,388][0m Trial 742 finished with value: 0.7668481654282513 and parameters: {'splitter': 'best', 'min_samples_split': 0.10601866685991326, 'min_samples_leaf': 0.04751363362452028, 'min_weight_fraction_leaf': 0.049088961173109555, 'max_features': 0.938753532936333}. Best is trial 241 with value: 0.7773840258827056.[0m
[32m[I 2022-04-13 12:33:12,192][0m Trial 743 finished with value: 0.7614995936801723 and parameters: {'splitter': 'best', 'min_samples_split': 0.0908731823103432, 'min_samples_leaf': 0.061441165925877596, 'min_weight_fraction_leaf': 0.03649932212633447, 'max_features': 0.9693643677217956}. Best is trial 241 with value: 0.7773840258827056.[0m
[32m[I 2022-04-13 12:33:14,212][0m Trial 744 finished with value: 0.7701298953539938 and parameters: {'splitter': 'best', 'min_samples_split': 0.11413310771324835, 'min_samples_leaf': 0.03962968262624699, 'min_weight_fraction_leaf': 0.05624525030897399, 'max_features': 0.9817359413973853}. Best is trial 241 with value: 0.7773840258827056.[0m
[32m[I 2022-04-13 12:33:16,810][0m Trial 745 finished with value: 0.7670326533365348 and parameters: {'splitter': 'best', 'min_samples_split': 0.10293982944537312, 'min_samples_leaf': 0.009001955387111679, 'min_weight_fraction_leaf': 0.028183341785111466, 'max_features': 0.9186031855075241}. Best is trial 241 with value: 0.7773840258827056.[0m
[32m[I 2022-04-13 12:33:19,570][0m Trial 746 finished with value: 0.768781740087314 and parameters: {'splitter': 'best', 'min_samples_split': 0.09341900338576098, 'min_samples_leaf': 0.023945239700492078, 'min_weight_fraction_leaf': 0.04580482968628135, 'max_features': 0.9500210847981001}. Best is trial 241 with value: 0.7773840258827056.[0m
[32m[I 2022-04-13 12:33:21,242][0m Trial 747 finished with value: 0.7284742146364456 and parameters: {'splitter': 'best', 'min_samples_split': 0.030563021569315247, 'min_samples_leaf': 0.051973595807701764, 'min_weight_fraction_leaf': 0.264978747007543, 'max_features': 0.9834456847666377}. Best is trial 241 with value: 0.7773840258827056.[0m
[32m[I 2022-04-13 12:33:24,673][0m Trial 748 finished with value: 0.7604972801551825 and parameters: {'splitter': 'best', 'min_samples_split': 0.06721632087267795, 'min_samples_leaf': 0.03272909836257078, 'min_weight_fraction_leaf': 0.03857000110141112, 'max_features': 0.9641474671919423}. Best is trial 241 with value: 0.7773840258827056.[0m
[32m[I 2022-04-13 12:33:25,218][0m Trial 749 finished with value: 0.7645661073034724 and parameters: {'splitter': 'random', 'min_samples_split': 0.11845294942412041, 'min_samples_leaf': 0.0010543893449277975, 'min_weight_fraction_leaf': 0.06767239145225754, 'max_features': 0.8812601053250443}. Best is trial 241 with value: 0.7773840258827056.[0m
[32m[I 2022-04-13 12:33:27,364][0m Trial 750 finished with value: 0.7720923736604812 and parameters: {'splitter': 'best', 'min_samples_split': 0.10848473130625652, 'min_samples_leaf': 0.017220884289546406, 'min_weight_fraction_leaf': 0.02531622904639024, 'max_features': 0.999775527613765}. Best is trial 241 with value: 0.7773840258827056.[0m
[32m[I 2022-04-13 12:33:30,698][0m Trial 751 finished with value: 0.7630213368218784 and parameters: {'splitter': 'best', 'min_samples_split': 0.11930415333185396, 'min_samples_leaf': 0.07730369278860996, 'min_weight_fraction_leaf': 0.03404360689101577, 'max_features': 0.9331825613741431}. Best is trial 241 with value: 0.7773840258827056.[0m
[32m[I 2022-04-13 12:33:33,048][0m Trial 752 finished with value: 0.7663336508695593 and parameters: {'splitter': 'best', 'min_samples_split': 0.08285066916296638, 'min_samples_leaf': 0.045083772238466185, 'min_weight_fraction_leaf': 0.04870681431545783, 'max_features': 0.9686949832500871}. Best is trial 241 with value: 0.7773840258827056.[0m
[32m[I 2022-04-13 12:33:34,935][0m Trial 753 finished with value: 0.7649321490207988 and parameters: {'splitter': 'best', 'min_samples_split': 0.18985167593370622, 'min_samples_leaf': 0.028556652446385562, 'min_weight_fraction_leaf': 0.021501143719657573, 'max_features': 0.998567333233562}. Best is trial 241 with value: 0.7773840258827056.[0m
[32m[I 2022-04-13 12:33:36,488][0m Trial 754 finished with value: 0.7715495279008934 and parameters: {'splitter': 'best', 'min_samples_split': 0.09946024792824316, 'min_samples_leaf': 0.05829463052404947, 'min_weight_fraction_leaf': 0.05936045608702345, 'max_features': 0.9991491204525638}. Best is trial 241 with value: 0.7773840258827056.[0m
[32m[I 2022-04-13 12:33:37,653][0m Trial 755 finished with value: 0.7705502030198781 and parameters: {'splitter': 'best', 'min_samples_split': 0.10580743597214216, 'min_samples_leaf': 0.04175881431539971, 'min_weight_fraction_leaf': 0.03961977820692362, 'max_features': 0.9501148292987047}. Best is trial 241 with value: 0.7773840258827056.[0m
[32m[I 2022-04-13 12:33:39,355][0m Trial 756 finished with value: 0.7725196589304643 and parameters: {'splitter': 'best', 'min_samples_split': 0.12319479475973312, 'min_samples_leaf': 0.019073398839816916, 'min_weight_fraction_leaf': 0.009163401539906253, 'max_features': 0.9817104353942593}. Best is trial 241 with value: 0.7773840258827056.[0m
[32m[I 2022-04-13 12:33:40,390][0m Trial 757 finished with value: 0.7460033162555251 and parameters: {'splitter': 'best', 'min_samples_split': 0.05029334498208082, 'min_samples_leaf': 0.13023283595255547, 'min_weight_fraction_leaf': 0.028249373411554125, 'max_features': 0.972255901817668}. Best is trial 241 with value: 0.7773840258827056.[0m
[32m[I 2022-04-13 12:33:41,321][0m Trial 758 finished with value: 0.7678358607103207 and parameters: {'splitter': 'best', 'min_samples_split': 0.1127432539029609, 'min_samples_leaf': 0.03529961643172543, 'min_weight_fraction_leaf': 0.04954766122729462, 'max_features': 0.9523313303544421}. Best is trial 241 with value: 0.7773840258827056.[0m
[32m[I 2022-04-13 12:33:43,378][0m Trial 759 finished with value: 0.7709381210267165 and parameters: {'splitter': 'best', 'min_samples_split': 0.09351405789951378, 'min_samples_leaf': 0.05173110707905032, 'min_weight_fraction_leaf': 0.017415445838416484, 'max_features': 0.9824302583550657}. Best is trial 241 with value: 0.7773840258827056.[0m
[32m[I 2022-04-13 12:33:44,306][0m Trial 760 finished with value: 0.7638108888421044 and parameters: {'splitter': 'best', 'min_samples_split': 0.1232694423474176, 'min_samples_leaf': 0.028143171029959165, 'min_weight_fraction_leaf': 0.033038996674861654, 'max_features': 0.9324214919733828}. Best is trial 241 with value: 0.7773840258827056.[0m
[32m[I 2022-04-13 12:33:46,043][0m Trial 761 finished with value: 0.7643437222645975 and parameters: {'splitter': 'best', 'min_samples_split': 0.13661009803079113, 'min_samples_leaf': 0.04172665752039308, 'min_weight_fraction_leaf': 0.04169617292675597, 'max_features': 0.9651580201214192}. Best is trial 241 with value: 0.7773840258827056.[0m
[32m[I 2022-04-13 12:33:47,732][0m Trial 762 finished with value: 0.7729959376143583 and parameters: {'splitter': 'best', 'min_samples_split': 0.10979802649715582, 'min_samples_leaf': 0.012235877074575671, 'min_weight_fraction_leaf': 0.08180302471150984, 'max_features': 0.9831256159373787}. Best is trial 241 with value: 0.7773840258827056.[0m
[32m[I 2022-04-13 12:33:49,728][0m Trial 763 finished with value: 0.7629878340165479 and parameters: {'splitter': 'best', 'min_samples_split': 0.07725295097593064, 'min_samples_leaf': 0.1003094185671789, 'min_weight_fraction_leaf': 0.023544658119287624, 'max_features': 0.9988825407231422}. Best is trial 241 with value: 0.7773840258827056.[0m
