[32m[I 2022-04-15 04:49:15,931][0m Trial 335 finished with value: 0.7670084683961967 and parameters: {'loss': 'coxph', 'learning_rate': 0.040083015990446835, 'n_estimators': 175, 'criterion': 'friedman_mse', 'min_samples_split': 2, 'min_samples_leaf': 6, 'min_weight_fraction_leaf': 0.2520382679118489, 'min_impurity_decrease': 0.9635284905457157, 'max_features': 0.6688887952442752, 'subsample': 0.5609287380042927, 'dropout_rate': 0.06364468093089519, 'ccp_alpha': 0.0029409247074637084}. Best is trial 335 with value: 0.7670084683961967.[0m
[32m[I 2022-04-15 04:49:32,764][0m Trial 336 finished with value: 0.5 and parameters: {'loss': 'coxph', 'learning_rate': 0.0336304960706727, 'n_estimators': 174, 'criterion': 'friedman_mse', 'min_samples_split': 2, 'min_samples_leaf': 6, 'min_weight_fraction_leaf': 0.25369421659048635, 'min_impurity_decrease': 0.971973918343398, 'max_features': 0.8252445672908311, 'subsample': 0.5954389065940847, 'dropout_rate': 0.0425290397098306, 'ccp_alpha': 0.43475194625038277}. Best is trial 335 with value: 0.7670084683961967.[0m
[32m[I 2022-04-15 04:49:50,305][0m Trial 337 finished with value: 0.7673957235887839 and parameters: {'loss': 'coxph', 'learning_rate': 0.08066603727179245, 'n_estimators': 165, 'criterion': 'friedman_mse', 'min_samples_split': 2, 'min_samples_leaf': 6, 'min_weight_fraction_leaf': 0.25134520204117494, 'min_impurity_decrease': 0.9640416288882011, 'max_features': 0.6672806935786744, 'subsample': 0.5512845763385882, 'dropout_rate': 0.05854062826117884, 'ccp_alpha': 0.0020287878216610506}. Best is trial 337 with value: 0.7673957235887839.[0m
[32m[I 2022-04-15 04:50:05,104][0m Trial 338 finished with value: 0.5 and parameters: {'loss': 'coxph', 'learning_rate': 0.040156398596102746, 'n_estimators': 152, 'criterion': 'friedman_mse', 'min_samples_split': 4, 'min_samples_leaf': 6, 'min_weight_fraction_leaf': 0.24463833712553767, 'min_impurity_decrease': 0.96045175570711, 'max_features': 0.6596657271851315, 'subsample': 0.5651254091442715, 'dropout_rate': 0.05748007579811567, 'ccp_alpha': 0.23683648951632041}. Best is trial 337 with value: 0.7673957235887839.[0m
[32m[I 2022-04-15 04:50:23,346][0m Trial 339 finished with value: 0.5 and parameters: {'loss': 'coxph', 'learning_rate': 0.0717807327828457, 'n_estimators': 164, 'criterion': 'squared_error', 'min_samples_split': 2, 'min_samples_leaf': 6, 'min_weight_fraction_leaf': 0.2999744140116483, 'min_impurity_decrease': 0.9869927508169427, 'max_features': 0.6251827466271076, 'subsample': 0.5861174836904898, 'dropout_rate': 0.029444365786885272, 'ccp_alpha': 0.1669523417753062}. Best is trial 337 with value: 0.7673957235887839.[0m
[32m[I 2022-04-15 04:50:38,983][0m Trial 340 finished with value: 0.6743624146605087 and parameters: {'loss': 'coxph', 'learning_rate': 0.04685549880067872, 'n_estimators': 165, 'criterion': 'friedman_mse', 'min_samples_split': 2, 'min_samples_leaf': 6, 'min_weight_fraction_leaf': 0.3094794313541661, 'min_impurity_decrease': 0.963567525348675, 'max_features': 0.6393413072900378, 'subsample': 0.7196939826047526, 'dropout_rate': 0.058069593586510926, 'ccp_alpha': 0.09626839181639814}. Best is trial 337 with value: 0.7673957235887839.[0m
[32m[I 2022-04-15 04:50:57,396][0m Trial 341 finished with value: 0.7623326208801241 and parameters: {'loss': 'coxph', 'learning_rate': 0.05889150389359333, 'n_estimators': 176, 'criterion': 'friedman_mse', 'min_samples_split': 2, 'min_samples_leaf': 6, 'min_weight_fraction_leaf': 0.2958598720126869, 'min_impurity_decrease': 0.9512150240904501, 'max_features': 0.66564318846255, 'subsample': 0.5510271064560595, 'dropout_rate': 0.018340471212436885, 'ccp_alpha': 0.004730764306402785}. Best is trial 337 with value: 0.7673957235887839.[0m
[32m[I 2022-04-15 04:51:12,774][0m Trial 342 finished with value: 0.5 and parameters: {'loss': 'coxph', 'learning_rate': 0.03719405017056821, 'n_estimators': 158, 'criterion': 'friedman_mse', 'min_samples_split': 2, 'min_samples_leaf': 6, 'min_weight_fraction_leaf': 0.2309973741407764, 'min_impurity_decrease': 0.9546014111901594, 'max_features': 0.6585526603054976, 'subsample': 0.5559430511536365, 'dropout_rate': 0.014376119086271706, 'ccp_alpha': 0.278815007768878}. Best is trial 337 with value: 0.7673957235887839.[0m
[32m[I 2022-04-15 04:51:26,710][0m Trial 343 finished with value: 0.7556181453348305 and parameters: {'loss': 'coxph', 'learning_rate': 0.07959069724259604, 'n_estimators': 147, 'criterion': 'friedman_mse', 'min_samples_split': 3, 'min_samples_leaf': 6, 'min_weight_fraction_leaf': 0.31975238407698603, 'min_impurity_decrease': 0.9737137825595539, 'max_features': 0.6734984049781927, 'subsample': 0.5431827039175701, 'dropout_rate': 0.018376951971109882, 'ccp_alpha': 0.002586781153446801}. Best is trial 337 with value: 0.7673957235887839.[0m
[32m[I 2022-04-15 04:51:47,456][0m Trial 344 finished with value: 0.6743624146605087 and parameters: {'loss': 'coxph', 'learning_rate': 0.05285007558113687, 'n_estimators': 182, 'criterion': 'friedman_mse', 'min_samples_split': 2, 'min_samples_leaf': 6, 'min_weight_fraction_leaf': 0.29615453850584583, 'min_impurity_decrease': 0.9464175844826256, 'max_features': 0.6464178933586506, 'subsample': 0.5612023864156204, 'dropout_rate': 0.03369675148539133, 'ccp_alpha': 0.16549258486658958}. Best is trial 337 with value: 0.7673957235887839.[0m
[32m[I 2022-04-15 04:52:03,849][0m Trial 345 finished with value: 0.6743624146605087 and parameters: {'loss': 'coxph', 'learning_rate': 0.06616378268710237, 'n_estimators': 168, 'criterion': 'friedman_mse', 'min_samples_split': 2, 'min_samples_leaf': 6, 'min_weight_fraction_leaf': 0.30436418292917816, 'min_impurity_decrease': 0.9997977966891448, 'max_features': 0.6741066303699714, 'subsample': 0.5319291921369637, 'dropout_rate': 0.04917427336625876, 'ccp_alpha': 0.09670110375467411}. Best is trial 337 with value: 0.7673957235887839.[0m
[32m[I 2022-04-15 04:52:21,791][0m Trial 346 finished with value: 0.6981822514497276 and parameters: {'loss': 'coxph', 'learning_rate': 0.029459668871725436, 'n_estimators': 179, 'criterion': 'friedman_mse', 'min_samples_split': 2, 'min_samples_leaf': 6, 'min_weight_fraction_leaf': 0.2924201560199803, 'min_impurity_decrease': 0.9787796634408489, 'max_features': 0.6717469239662854, 'subsample': 0.5098897646621733, 'dropout_rate': 0.07117446385358164, 'ccp_alpha': 0.0981133978118259}. Best is trial 337 with value: 0.7673957235887839.[0m
[32m[I 2022-04-15 04:52:37,397][0m Trial 347 finished with value: 0.5 and parameters: {'loss': 'coxph', 'learning_rate': 0.07632680784500168, 'n_estimators': 157, 'criterion': 'friedman_mse', 'min_samples_split': 2, 'min_samples_leaf': 6, 'min_weight_fraction_leaf': 0.3132904315910456, 'min_impurity_decrease': 0.9578013775659238, 'max_features': 0.646558202087759, 'subsample': 0.5718451665567321, 'dropout_rate': 0.03655944558961644, 'ccp_alpha': 0.23302656940712668}. Best is trial 337 with value: 0.7673957235887839.[0m
[32m[I 2022-04-15 04:52:51,110][0m Trial 348 finished with value: 0.6743624146605087 and parameters: {'loss': 'coxph', 'learning_rate': 0.04471715280152266, 'n_estimators': 144, 'criterion': 'friedman_mse', 'min_samples_split': 2, 'min_samples_leaf': 7, 'min_weight_fraction_leaf': 0.30261630302690545, 'min_impurity_decrease': 0.9361327445232666, 'max_features': 0.7196175473982854, 'subsample': 0.5489959726033465, 'dropout_rate': 0.06893803251787341, 'ccp_alpha': 0.09250461736813984}. Best is trial 337 with value: 0.7673957235887839.[0m
[32m[I 2022-04-15 04:53:09,471][0m Trial 349 finished with value: 0.7674270350063825 and parameters: {'loss': 'coxph', 'learning_rate': 0.05992110566344736, 'n_estimators': 170, 'criterion': 'friedman_mse', 'min_samples_split': 2, 'min_samples_leaf': 6, 'min_weight_fraction_leaf': 0.2376524622994972, 'min_impurity_decrease': 0.9709647416354277, 'max_features': 0.7343134034197972, 'subsample': 0.5907782596834112, 'dropout_rate': 0.0044508952768084545, 'ccp_alpha': 0.006350560402410694}. Best is trial 349 with value: 0.7674270350063825.[0m
[32m[I 2022-04-15 04:53:26,472][0m Trial 350 finished with value: 0.5 and parameters: {'loss': 'coxph', 'learning_rate': 0.05581798587679192, 'n_estimators': 169, 'criterion': 'friedman_mse', 'min_samples_split': 2, 'min_samples_leaf': 6, 'min_weight_fraction_leaf': 0.24688559737557, 'min_impurity_decrease': 0.9431037406660769, 'max_features': 0.745672814259364, 'subsample': 0.6012919114602997, 'dropout_rate': 8.89578356153449e-05, 'ccp_alpha': 0.39614899423787814}. Best is trial 349 with value: 0.7674270350063825.[0m
[32m[I 2022-04-15 04:54:12,111][0m Trial 351 finished with value: 0.6743624146605087 and parameters: {'loss': 'coxph', 'learning_rate': 0.03660215979275633, 'n_estimators': 319, 'criterion': 'friedman_mse', 'min_samples_split': 2, 'min_samples_leaf': 6, 'min_weight_fraction_leaf': 0.25323321615570693, 'min_impurity_decrease': 0.9687701943197558, 'max_features': 0.7346740140538099, 'subsample': 0.5787541165842331, 'dropout_rate': 0.017586894492354427, 'ccp_alpha': 0.1841706126882427}. Best is trial 349 with value: 0.7674270350063825.[0m
[32m[I 2022-04-15 04:54:26,919][0m Trial 352 finished with value: 0.7654972854717024 and parameters: {'loss': 'coxph', 'learning_rate': 0.05294656701483289, 'n_estimators': 154, 'criterion': 'friedman_mse', 'min_samples_split': 2, 'min_samples_leaf': 6, 'min_weight_fraction_leaf': 0.21305207850610813, 'min_impurity_decrease': 0.9382577307769505, 'max_features': 0.7835913103846592, 'subsample': 0.5878950231622943, 'dropout_rate': 0.01757071746191284, 'ccp_alpha': 0.00687605217391956}. Best is trial 349 with value: 0.7674270350063825.[0m
[32m[I 2022-04-15 04:54:41,984][0m Trial 353 finished with value: 0.7664411244823828 and parameters: {'loss': 'coxph', 'learning_rate': 0.04861484791810854, 'n_estimators': 156, 'criterion': 'friedman_mse', 'min_samples_split': 3, 'min_samples_leaf': 6, 'min_weight_fraction_leaf': 0.22540081938103948, 'min_impurity_decrease': 0.9326545630453505, 'max_features': 0.8533122712639214, 'subsample': 0.5937597288056745, 'dropout_rate': 0.012766475559658857, 'ccp_alpha': 0.002872988069679285}. Best is trial 349 with value: 0.7674270350063825.[0m
[32m[I 2022-04-15 04:54:56,061][0m Trial 354 finished with value: 0.6743624146605087 and parameters: {'loss': 'coxph', 'learning_rate': 0.0289427190182272, 'n_estimators': 153, 'criterion': 'friedman_mse', 'min_samples_split': 4, 'min_samples_leaf': 6, 'min_weight_fraction_leaf': 0.22775797682117926, 'min_impurity_decrease': 0.9280462936206079, 'max_features': 0.9070902158470336, 'subsample': 0.5836883956827629, 'dropout_rate': 0.013162005524732096, 'ccp_alpha': 0.18395995481527488}. Best is trial 349 with value: 0.7674270350063825.[0m
[32m[I 2022-04-15 04:55:09,991][0m Trial 355 finished with value: 0.6834635191948258 and parameters: {'loss': 'coxph', 'learning_rate': 0.042168395981191674, 'n_estimators': 149, 'criterion': 'friedman_mse', 'min_samples_split': 3, 'min_samples_leaf': 6, 'min_weight_fraction_leaf': 0.22004679871650984, 'min_impurity_decrease': 0.9494502646285431, 'max_features': 0.8812339868802589, 'subsample': 0.5905668392004227, 'dropout_rate': 0.02587116427037779, 'ccp_alpha': 0.1026200519128749}. Best is trial 349 with value: 0.7674270350063825.[0m
[32m[I 2022-04-15 04:55:26,042][0m Trial 356 finished with value: 0.5 and parameters: {'loss': 'coxph', 'learning_rate': 0.03420913304867687, 'n_estimators': 163, 'criterion': 'friedman_mse', 'min_samples_split': 3, 'min_samples_leaf': 6, 'min_weight_fraction_leaf': 0.20659564251624055, 'min_impurity_decrease': 0.9352508836553413, 'max_features': 0.9457139646188736, 'subsample': 0.566438259472084, 'dropout_rate': 0.0063612808929355835, 'ccp_alpha': 0.2825658783097997}. Best is trial 349 with value: 0.7674270350063825.[0m
[32m[I 2022-04-15 04:55:41,513][0m Trial 357 finished with value: 0.6902360726659664 and parameters: {'loss': 'coxph', 'learning_rate': 0.04774909215082582, 'n_estimators': 156, 'criterion': 'friedman_mse', 'min_samples_split': 3, 'min_samples_leaf': 6, 'min_weight_fraction_leaf': 0.21307944711568175, 'min_impurity_decrease': 0.9499048606924834, 'max_features': 0.7989370812621738, 'subsample': 0.5991782005464666, 'dropout_rate': 0.0036660940914756343, 'ccp_alpha': 0.09295949201433529}. Best is trial 349 with value: 0.7674270350063825.[0m
[32m[I 2022-04-15 04:55:54,441][0m Trial 358 finished with value: 0.6743624146605087 and parameters: {'loss': 'coxph', 'learning_rate': 0.05498974172375402, 'n_estimators': 144, 'criterion': 'friedman_mse', 'min_samples_split': 2, 'min_samples_leaf': 6, 'min_weight_fraction_leaf': 0.23487119435053141, 'min_impurity_decrease': 0.8341841091513771, 'max_features': 0.6322353782164194, 'subsample': 0.5331624703285787, 'dropout_rate': 0.027035957171254274, 'ccp_alpha': 0.17403161349336319}. Best is trial 349 with value: 0.7674270350063825.[0m
[32m[I 2022-04-15 04:56:10,346][0m Trial 359 finished with value: 0.7624311367310763 and parameters: {'loss': 'coxph', 'learning_rate': 0.04106767408870988, 'n_estimators': 160, 'criterion': 'friedman_mse', 'min_samples_split': 2, 'min_samples_leaf': 6, 'min_weight_fraction_leaf': 0.20714360031681017, 'min_impurity_decrease': 0.961114258179024, 'max_features': 0.7853366109320358, 'subsample': 0.5736764855824212, 'dropout_rate': 0.04057860141527879, 'ccp_alpha': 0.005895284659038836}. Best is trial 349 with value: 0.7674270350063825.[0m
[32m[I 2022-04-15 04:56:25,389][0m Trial 360 finished with value: 0.6810307377180425 and parameters: {'loss': 'coxph', 'learning_rate': 0.02833533901669728, 'n_estimators': 161, 'criterion': 'friedman_mse', 'min_samples_split': 4, 'min_samples_leaf': 6, 'min_weight_fraction_leaf': 0.19442972000753383, 'min_impurity_decrease': 0.9639307821244009, 'max_features': 0.7795592401927127, 'subsample': 0.5661203347803552, 'dropout_rate': 0.0404038382363969, 'ccp_alpha': 0.10178357499246501}. Best is trial 349 with value: 0.7674270350063825.[0m
[32m[I 2022-04-15 04:56:42,083][0m Trial 361 finished with value: 0.5 and parameters: {'loss': 'coxph', 'learning_rate': 0.04520496793290612, 'n_estimators': 171, 'criterion': 'squared_error', 'min_samples_split': 2, 'min_samples_leaf': 6, 'min_weight_fraction_leaf': 0.21369538721053757, 'min_impurity_decrease': 0.9182739832697209, 'max_features': 0.8341469949970973, 'subsample': 0.5818593367610563, 'dropout_rate': 0.03965658309767282, 'ccp_alpha': 0.2999510636353168}. Best is trial 349 with value: 0.7674270350063825.[0m
[32m[I 2022-04-15 04:56:57,777][0m Trial 362 finished with value: 0.6961712906087041 and parameters: {'loss': 'coxph', 'learning_rate': 0.03362457778569427, 'n_estimators': 166, 'criterion': 'friedman_mse', 'min_samples_split': 3, 'min_samples_leaf': 6, 'min_weight_fraction_leaf': 0.23826275852380474, 'min_impurity_decrease': 0.9617621876702258, 'max_features': 0.8589135189021108, 'subsample': 0.5945069091738971, 'dropout_rate': 0.04355120034388973, 'ccp_alpha': 0.09594984306682455}. Best is trial 349 with value: 0.7674270350063825.[0m
[32m[I 2022-04-15 04:57:14,379][0m Trial 363 finished with value: 0.768352101074134 and parameters: {'loss': 'coxph', 'learning_rate': 0.039281316878916894, 'n_estimators': 159, 'criterion': 'friedman_mse', 'min_samples_split': 2, 'min_samples_leaf': 6, 'min_weight_fraction_leaf': 0.20805169783699193, 'min_impurity_decrease': 0.6070123561860981, 'max_features': 0.8346341591723814, 'subsample': 0.5426853844330647, 'dropout_rate': 0.054187854207440135, 'ccp_alpha': 0.0026541879349203917}. Best is trial 363 with value: 0.768352101074134.[0m
[32m[I 2022-04-15 04:57:29,616][0m Trial 364 finished with value: 0.5301157883717103 and parameters: {'loss': 'coxph', 'learning_rate': 0.024850724534153882, 'n_estimators': 155, 'criterion': 'friedman_mse', 'min_samples_split': 2, 'min_samples_leaf': 6, 'min_weight_fraction_leaf': 0.22154038547767352, 'min_impurity_decrease': 0.5834544403473052, 'max_features': 0.8850637625269984, 'subsample': 0.5529951051904849, 'dropout_rate': 0.0001252769065312933, 'ccp_alpha': 0.22457962288345562}. Best is trial 363 with value: 0.768352101074134.[0m
[32m[I 2022-04-15 04:58:03,615][0m Trial 365 finished with value: 0.769790840194853 and parameters: {'loss': 'coxph', 'learning_rate': 0.037326971831628974, 'n_estimators': 257, 'criterion': 'friedman_mse', 'min_samples_split': 2, 'min_samples_leaf': 6, 'min_weight_fraction_leaf': 0.19483207766063293, 'min_impurity_decrease': 0.9330327391900154, 'max_features': 0.8424222708177185, 'subsample': 0.5676225147878314, 'dropout_rate': 0.026091326725684233, 'ccp_alpha': 0.0074624351176090864}. Best is trial 365 with value: 0.769790840194853.[0m
[32m[I 2022-04-15 04:58:15,616][0m Trial 366 finished with value: 0.5 and parameters: {'loss': 'coxph', 'learning_rate': 0.020232650136659647, 'n_estimators': 141, 'criterion': 'friedman_mse', 'min_samples_split': 2, 'min_samples_leaf': 6, 'min_weight_fraction_leaf': 0.1866711874134867, 'min_impurity_decrease': 0.9393851893495268, 'max_features': 0.7885469490053517, 'subsample': 0.5707822339143837, 'dropout_rate': 0.027321291036700123, 'ccp_alpha': 3.1145500106432165}. Best is trial 365 with value: 0.769790840194853.[0m
[32m[I 2022-04-15 04:58:45,641][0m Trial 367 finished with value: 0.6743624146605087 and parameters: {'loss': 'coxph', 'learning_rate': 0.03623711352428229, 'n_estimators': 258, 'criterion': 'friedman_mse', 'min_samples_split': 2, 'min_samples_leaf': 6, 'min_weight_fraction_leaf': 0.19702203986154682, 'min_impurity_decrease': 0.9343563836404316, 'max_features': 0.8380065232546031, 'subsample': 0.7736691459955112, 'dropout_rate': 0.018291530517639445, 'ccp_alpha': 0.16515069472124083}. Best is trial 365 with value: 0.769790840194853.[0m
[32m[I 2022-04-15 04:59:12,961][0m Trial 368 finished with value: 0.7329406040012449 and parameters: {'loss': 'coxph', 'learning_rate': 0.04085592934276061, 'n_estimators': 240, 'criterion': 'friedman_mse', 'min_samples_split': 2, 'min_samples_leaf': 6, 'min_weight_fraction_leaf': 0.21457258162311932, 'min_impurity_decrease': 0.5534761503940824, 'max_features': 0.8219716479882064, 'subsample': 0.5519769299514686, 'dropout_rate': 0.05073390889308056, 'ccp_alpha': 0.08013675013567911}. Best is trial 365 with value: 0.769790840194853.[0m
[32m[I 2022-04-15 04:59:27,865][0m Trial 369 finished with value: 0.7644383161036638 and parameters: {'loss': 'coxph', 'learning_rate': 0.026666242137896118, 'n_estimators': 152, 'criterion': 'friedman_mse', 'min_samples_split': 3, 'min_samples_leaf': 6, 'min_weight_fraction_leaf': 0.2100283894356937, 'min_impurity_decrease': 0.9640307983300622, 'max_features': 0.8282563682184028, 'subsample': 0.5774171498927091, 'dropout_rate': 0.0360455548851612, 'ccp_alpha': 0.0017682202884672777}. Best is trial 365 with value: 0.769790840194853.[0m
[32m[I 2022-04-15 04:59:41,249][0m Trial 370 finished with value: 0.6743624146605087 and parameters: {'loss': 'coxph', 'learning_rate': 0.027738876154120903, 'n_estimators': 147, 'criterion': 'friedman_mse', 'min_samples_split': 3, 'min_samples_leaf': 6, 'min_weight_fraction_leaf': 0.20088940260465746, 'min_impurity_decrease': 0.6171761606752557, 'max_features': 0.850575577472024, 'subsample': 0.5822032473918276, 'dropout_rate': 0.027231441255826938, 'ccp_alpha': 0.18418430646064318}. Best is trial 365 with value: 0.769790840194853.[0m
[32m[I 2022-04-15 05:00:25,044][0m Trial 371 finished with value: 0.5 and parameters: {'loss': 'coxph', 'learning_rate': 0.026859467295217602, 'n_estimators': 312, 'criterion': 'friedman_mse', 'min_samples_split': 3, 'min_samples_leaf': 6, 'min_weight_fraction_leaf': 0.2023695316265084, 'min_impurity_decrease': 0.5210251619301285, 'max_features': 0.853002225778111, 'subsample': 0.6009634285872161, 'dropout_rate': 0.03569372164029137, 'ccp_alpha': 0.35517928512244984}. Best is trial 365 with value: 0.769790840194853.[0m
[32m[I 2022-04-15 05:00:58,810][0m Trial 372 finished with value: 0.7289750567988288 and parameters: {'loss': 'coxph', 'learning_rate': 0.03000489226474206, 'n_estimators': 257, 'criterion': 'friedman_mse', 'min_samples_split': 3, 'min_samples_leaf': 6, 'min_weight_fraction_leaf': 0.20936647051999305, 'min_impurity_decrease': 0.9729491321784214, 'max_features': 0.8686046316595445, 'subsample': 0.5712008474583569, 'dropout_rate': 6.53176789706944e-06, 'ccp_alpha': 0.08511846424704109}. Best is trial 365 with value: 0.769790840194853.[0m
[32m[I 2022-04-15 05:01:12,360][0m Trial 373 finished with value: 0.7140145015255057 and parameters: {'loss': 'coxph', 'learning_rate': 0.03740304170459681, 'n_estimators': 152, 'criterion': 'friedman_mse', 'min_samples_split': 3, 'min_samples_leaf': 6, 'min_weight_fraction_leaf': 0.22507057134673442, 'min_impurity_decrease': 0.9637635648904378, 'max_features': 0.8130924431779625, 'subsample': 0.6043182777291765, 'dropout_rate': 0.05216866417778676, 'ccp_alpha': 0.09120214371774764}. Best is trial 365 with value: 0.769790840194853.[0m
[32m[I 2022-04-15 05:01:27,346][0m Trial 374 finished with value: 0.7642768588250691 and parameters: {'loss': 'coxph', 'learning_rate': 0.018738199436099282, 'n_estimators': 156, 'criterion': 'friedman_mse', 'min_samples_split': 3, 'min_samples_leaf': 6, 'min_weight_fraction_leaf': 0.22452063631875244, 'min_impurity_decrease': 0.9890330929703464, 'max_features': 0.8362809585847092, 'subsample': 0.553051589893369, 'dropout_rate': 0.030519436573611607, 'ccp_alpha': 0.009011768115912797}. Best is trial 365 with value: 0.769790840194853.[0m
