[32m[I 2022-04-13 13:28:00,750][0m Trial 918 finished with value: 0.7451822431136589 and parameters: {'alpha': 1.1596402335866578, 'ties': 'breslow'}. Best is trial 429 with value: 0.745409816487361.[0m
[32m[I 2022-04-13 13:28:04,491][0m Trial 919 finished with value: 0.7450004090313975 and parameters: {'alpha': 1.5546210533087526, 'ties': 'breslow'}. Best is trial 429 with value: 0.745409816487361.[0m
[32m[I 2022-04-13 13:28:08,120][0m Trial 920 finished with value: 0.7449492106213075 and parameters: {'alpha': 1.3878476629152074, 'ties': 'breslow'}. Best is trial 429 with value: 0.745409816487361.[0m
[32m[I 2022-04-13 13:28:10,848][0m Trial 921 finished with value: 0.7453319671949813 and parameters: {'alpha': 1.2503192892790103, 'ties': 'breslow'}. Best is trial 429 with value: 0.745409816487361.[0m
[32m[I 2022-04-13 13:28:14,542][0m Trial 922 finished with value: 0.7451511376562816 and parameters: {'alpha': 1.098583076963292, 'ties': 'breslow'}. Best is trial 429 with value: 0.745409816487361.[0m
[32m[I 2022-04-13 13:28:18,427][0m Trial 923 finished with value: 0.7453106550165456 and parameters: {'alpha': 0.9584789749604701, 'ties': 'breslow'}. Best is trial 429 with value: 0.745409816487361.[0m
[32m[I 2022-04-13 13:28:21,079][0m Trial 924 finished with value: 0.745187001678484 and parameters: {'alpha': 1.1820167501577412, 'ties': 'efron'}. Best is trial 429 with value: 0.745409816487361.[0m
[32m[I 2022-04-13 13:28:23,906][0m Trial 925 finished with value: 0.7452598558685691 and parameters: {'alpha': 1.2870519281197386, 'ties': 'breslow'}. Best is trial 429 with value: 0.745409816487361.[0m
[32m[I 2022-04-13 13:28:26,138][0m Trial 926 finished with value: 0.7448876450875022 and parameters: {'alpha': 1.4476235515657132, 'ties': 'breslow'}. Best is trial 429 with value: 0.745409816487361.[0m
[32m[I 2022-04-13 13:28:27,763][0m Trial 927 finished with value: 0.7452243871572837 and parameters: {'alpha': 1.0788678111930663, 'ties': 'breslow'}. Best is trial 429 with value: 0.745409816487361.[0m
[32m[I 2022-04-13 13:28:30,123][0m Trial 928 finished with value: 0.7450635838726074 and parameters: {'alpha': 1.3551376894142488, 'ties': 'breslow'}. Best is trial 429 with value: 0.745409816487361.[0m
[32m[I 2022-04-13 13:28:32,853][0m Trial 929 finished with value: 0.7453989166660413 and parameters: {'alpha': 1.2161681823662118, 'ties': 'breslow'}. Best is trial 429 with value: 0.745409816487361.[0m
[32m[I 2022-04-13 13:28:35,697][0m Trial 930 finished with value: 0.7453038106933624 and parameters: {'alpha': 1.1405416746571677, 'ties': 'breslow'}. Best is trial 429 with value: 0.745409816487361.[0m
[32m[I 2022-04-13 13:28:39,250][0m Trial 931 finished with value: 0.745091454173972 and parameters: {'alpha': 1.0467801486804766, 'ties': 'breslow'}. Best is trial 429 with value: 0.745409816487361.[0m
[32m[I 2022-04-13 13:28:43,393][0m Trial 932 finished with value: 0.7453397331622917 and parameters: {'alpha': 1.2553299484766833, 'ties': 'breslow'}. Best is trial 429 with value: 0.745409816487361.[0m
[32m[I 2022-04-13 13:28:47,676][0m Trial 933 finished with value: 0.7451171014971867 and parameters: {'alpha': 1.3223985903879636, 'ties': 'breslow'}. Best is trial 429 with value: 0.745409816487361.[0m
[32m[I 2022-04-13 13:28:50,904][0m Trial 934 finished with value: 0.7452572958997067 and parameters: {'alpha': 0.9464808817363506, 'ties': 'breslow'}. Best is trial 429 with value: 0.745409816487361.[0m
[32m[I 2022-04-13 13:28:54,055][0m Trial 935 finished with value: 0.7451550197305433 and parameters: {'alpha': 1.168466275687982, 'ties': 'efron'}. Best is trial 429 with value: 0.745409816487361.[0m
[32m[I 2022-04-13 13:28:58,476][0m Trial 936 finished with value: 0.7453475355819602 and parameters: {'alpha': 1.2221685987197923, 'ties': 'breslow'}. Best is trial 429 with value: 0.745409816487361.[0m
[32m[I 2022-04-13 13:29:01,818][0m Trial 937 finished with value: 0.7385290204034727 and parameters: {'alpha': 4.4585152851023935, 'ties': 'breslow'}. Best is trial 429 with value: 0.745409816487361.[0m
[32m[I 2022-04-13 13:29:04,475][0m Trial 938 finished with value: 0.7449459362392495 and parameters: {'alpha': 1.410028029697667, 'ties': 'breslow'}. Best is trial 429 with value: 0.745409816487361.[0m
[32m[I 2022-04-13 13:29:07,318][0m Trial 939 finished with value: 0.7453570910428045 and parameters: {'alpha': 1.228382970567229, 'ties': 'breslow'}. Best is trial 429 with value: 0.745409816487361.[0m
[32m[I 2022-04-13 13:29:10,382][0m Trial 940 finished with value: 0.7449384465509437 and parameters: {'alpha': 1.501647205079053, 'ties': 'breslow'}. Best is trial 429 with value: 0.745409816487361.[0m
[32m[I 2022-04-13 13:29:14,616][0m Trial 941 finished with value: 0.7451642749718491 and parameters: {'alpha': 1.1093519776579543, 'ties': 'breslow'}. Best is trial 429 with value: 0.745409816487361.[0m
[32m[I 2022-04-13 13:29:18,753][0m Trial 942 finished with value: 0.7450507765216705 and parameters: {'alpha': 1.352796518636608, 'ties': 'breslow'}. Best is trial 429 with value: 0.745409816487361.[0m
[32m[I 2022-04-13 13:29:21,738][0m Trial 943 finished with value: 0.7447416387078547 and parameters: {'alpha': 1.6610025211566777, 'ties': 'breslow'}. Best is trial 429 with value: 0.745409816487361.[0m
[32m[I 2022-04-13 13:29:24,581][0m Trial 944 finished with value: 0.7450171264420951 and parameters: {'alpha': 1.0357805553981425, 'ties': 'breslow'}. Best is trial 429 with value: 0.745409816487361.[0m
[32m[I 2022-04-13 13:29:28,060][0m Trial 945 finished with value: 0.744979828713955 and parameters: {'alpha': 0.8119983957773098, 'ties': 'breslow'}. Best is trial 429 with value: 0.745409816487361.[0m
[32m[I 2022-04-13 13:29:32,204][0m Trial 946 finished with value: 0.7453050415126674 and parameters: {'alpha': 1.2961161929410714, 'ties': 'breslow'}. Best is trial 429 with value: 0.745409816487361.[0m
[32m[I 2022-04-13 13:29:36,122][0m Trial 947 finished with value: 0.7452528829622889 and parameters: {'alpha': 1.1341931569453634, 'ties': 'efron'}. Best is trial 429 with value: 0.745409816487361.[0m
[32m[I 2022-04-13 13:29:39,299][0m Trial 948 finished with value: 0.7451778849371689 and parameters: {'alpha': 0.9964418495772679, 'ties': 'breslow'}. Best is trial 429 with value: 0.745409816487361.[0m
[32m[I 2022-04-13 13:29:43,495][0m Trial 949 finished with value: 0.744951269580145 and parameters: {'alpha': 1.4240277111361677, 'ties': 'breslow'}. Best is trial 429 with value: 0.745409816487361.[0m
[32m[I 2022-04-13 13:29:47,778][0m Trial 950 finished with value: 0.7450095974532611 and parameters: {'alpha': 1.3302168386776263, 'ties': 'breslow'}. Best is trial 429 with value: 0.745409816487361.[0m
[32m[I 2022-04-13 13:29:52,009][0m Trial 951 finished with value: 0.7452504539223052 and parameters: {'alpha': 1.2020661482561625, 'ties': 'breslow'}. Best is trial 429 with value: 0.745409816487361.[0m
[32m[I 2022-04-13 13:29:54,668][0m Trial 952 finished with value: 0.7451822431136589 and parameters: {'alpha': 1.1600197079348777, 'ties': 'breslow'}. Best is trial 429 with value: 0.745409816487361.[0m
[32m[I 2022-04-13 13:29:57,851][0m Trial 953 finished with value: 0.7453319671949813 and parameters: {'alpha': 1.2500962290853643, 'ties': 'breslow'}. Best is trial 429 with value: 0.745409816487361.[0m
[32m[I 2022-04-13 13:30:02,056][0m Trial 954 finished with value: 0.7448980866980359 and parameters: {'alpha': 1.5281057548751575, 'ties': 'breslow'}. Best is trial 429 with value: 0.745409816487361.[0m
[32m[I 2022-04-13 13:30:05,392][0m Trial 955 finished with value: 0.7453397331622917 and parameters: {'alpha': 1.2539343153045457, 'ties': 'breslow'}. Best is trial 429 with value: 0.745409816487361.[0m
[32m[I 2022-04-13 13:30:09,649][0m Trial 956 finished with value: 0.7451760447750605 and parameters: {'alpha': 1.0894441952767382, 'ties': 'breslow'}. Best is trial 429 with value: 0.745409816487361.[0m
[32m[I 2022-04-13 13:30:13,743][0m Trial 957 finished with value: 0.7449333896410337 and parameters: {'alpha': 1.4310159812468273, 'ties': 'efron'}. Best is trial 429 with value: 0.745409816487361.[0m
[32m[I 2022-04-13 13:30:16,320][0m Trial 958 finished with value: 0.7392775209902296 and parameters: {'alpha': 4.081296467184063, 'ties': 'breslow'}. Best is trial 429 with value: 0.745409816487361.[0m
[32m[I 2022-04-13 13:30:19,827][0m Trial 959 finished with value: 0.7451269026716786 and parameters: {'alpha': 1.3242397126293293, 'ties': 'breslow'}. Best is trial 429 with value: 0.745409816487361.[0m
[32m[I 2022-04-13 13:30:22,598][0m Trial 960 finished with value: 0.7452286856231661 and parameters: {'alpha': 0.8777466339804589, 'ties': 'breslow'}. Best is trial 429 with value: 0.745409816487361.[0m
[32m[I 2022-04-13 13:30:25,538][0m Trial 961 finished with value: 0.745194605256751 and parameters: {'alpha': 1.0165977807097704, 'ties': 'breslow'}. Best is trial 429 with value: 0.745409816487361.[0m
[32m[I 2022-04-13 13:30:28,992][0m Trial 962 finished with value: 0.7384355783952662 and parameters: {'alpha': 4.798992231685425, 'ties': 'breslow'}. Best is trial 429 with value: 0.745409816487361.[0m
[32m[I 2022-04-13 13:30:33,364][0m Trial 963 finished with value: 0.7452007770911889 and parameters: {'alpha': 1.1251685741606399, 'ties': 'breslow'}. Best is trial 429 with value: 0.745409816487361.[0m
[32m[I 2022-04-13 13:30:37,553][0m Trial 964 finished with value: 0.745409816487361 and parameters: {'alpha': 1.2127475089484845, 'ties': 'breslow'}. Best is trial 429 with value: 0.745409816487361.[0m
[32m[I 2022-04-13 13:30:39,988][0m Trial 965 finished with value: 0.7451625090249575 and parameters: {'alpha': 1.1555590416354935, 'ties': 'breslow'}. Best is trial 429 with value: 0.745409816487361.[0m
[32m[I 2022-04-13 13:30:43,868][0m Trial 966 finished with value: 0.7450635226667168 and parameters: {'alpha': 1.3523601030214079, 'ties': 'breslow'}. Best is trial 429 with value: 0.745409816487361.[0m
[32m[I 2022-04-13 13:30:47,588][0m Trial 967 finished with value: 0.7452670261240364 and parameters: {'alpha': 0.9518281393810297, 'ties': 'breslow'}. Best is trial 429 with value: 0.745409816487361.[0m
[32m[I 2022-04-13 13:30:50,622][0m Trial 968 finished with value: 0.7453354392337473 and parameters: {'alpha': 1.238122640460297, 'ties': 'breslow'}. Best is trial 429 with value: 0.745409816487361.[0m
[32m[I 2022-04-13 13:30:53,441][0m Trial 969 finished with value: 0.7451395478095922 and parameters: {'alpha': 1.0914490356570483, 'ties': 'breslow'}. Best is trial 429 with value: 0.745409816487361.[0m
[32m[I 2022-04-13 13:30:57,895][0m Trial 970 finished with value: 0.7453989166660413 and parameters: {'alpha': 1.2138632842016435, 'ties': 'breslow'}. Best is trial 429 with value: 0.745409816487361.[0m
[32m[I 2022-04-13 13:31:01,134][0m Trial 971 finished with value: 0.7452485092956167 and parameters: {'alpha': 1.2075181108141324, 'ties': 'breslow'}. Best is trial 429 with value: 0.745409816487361.[0m
[32m[I 2022-04-13 13:31:04,570][0m Trial 972 finished with value: 0.745064519426441 and parameters: {'alpha': 1.0362626740619123, 'ties': 'efron'}. Best is trial 429 with value: 0.745409816487361.[0m
[32m[I 2022-04-13 13:31:07,851][0m Trial 973 finished with value: 0.7422572302366609 and parameters: {'alpha': 2.9288020721021337, 'ties': 'breslow'}. Best is trial 429 with value: 0.745409816487361.[0m
[32m[I 2022-04-13 13:31:11,404][0m Trial 974 finished with value: 0.7450480300433827 and parameters: {'alpha': 1.336245703651975, 'ties': 'breslow'}. Best is trial 429 with value: 0.745409816487361.[0m
[32m[I 2022-04-13 13:31:15,727][0m Trial 975 finished with value: 0.74522044678315 and parameters: {'alpha': 1.151918883570926, 'ties': 'breslow'}. Best is trial 429 with value: 0.745409816487361.[0m
[32m[I 2022-04-13 13:31:18,591][0m Trial 976 finished with value: 0.7449080471191372 and parameters: {'alpha': 1.45343198323071, 'ties': 'breslow'}. Best is trial 429 with value: 0.745409816487361.[0m
[32m[I 2022-04-13 13:31:22,208][0m Trial 977 finished with value: 0.7452547315964927 and parameters: {'alpha': 0.9242748589731176, 'ties': 'breslow'}. Best is trial 429 with value: 0.745409816487361.[0m
[32m[I 2022-04-13 13:31:26,085][0m Trial 978 finished with value: 0.7452517592707897 and parameters: {'alpha': 1.277819507536325, 'ties': 'breslow'}. Best is trial 429 with value: 0.745409816487361.[0m
[32m[I 2022-04-13 13:31:29,206][0m Trial 979 finished with value: 0.745091454173972 and parameters: {'alpha': 1.0465419819685418, 'ties': 'breslow'}. Best is trial 429 with value: 0.745409816487361.[0m
[32m[I 2022-04-13 13:31:30,993][0m Trial 980 finished with value: 0.7446643653350606 and parameters: {'alpha': 0.6928370236674329, 'ties': 'breslow'}. Best is trial 429 with value: 0.745409816487361.[0m
[32m[I 2022-04-13 13:31:34,570][0m Trial 981 finished with value: 0.7424788474555682 and parameters: {'alpha': 0.01692740210658883, 'ties': 'breslow'}. Best is trial 429 with value: 0.745409816487361.[0m
[32m[I 2022-04-13 13:31:38,244][0m Trial 982 finished with value: 0.7449367266126131 and parameters: {'alpha': 1.3828489982264074, 'ties': 'efron'}. Best is trial 429 with value: 0.745409816487361.[0m
[32m[I 2022-04-13 13:31:40,741][0m Trial 983 finished with value: 0.7449753078699752 and parameters: {'alpha': 1.5473431790471985, 'ties': 'breslow'}. Best is trial 429 with value: 0.745409816487361.[0m
[32m[I 2022-04-13 13:31:44,387][0m Trial 984 finished with value: 0.745253068475342 and parameters: {'alpha': 1.205078739220657, 'ties': 'breslow'}. Best is trial 429 with value: 0.745409816487361.[0m
[32m[I 2022-04-13 13:31:48,151][0m Trial 985 finished with value: 0.7453024785774375 and parameters: {'alpha': 1.1369331766930109, 'ties': 'breslow'}. Best is trial 429 with value: 0.745409816487361.[0m
[32m[I 2022-04-13 13:31:52,027][0m Trial 986 finished with value: 0.7452148592895542 and parameters: {'alpha': 1.318528578216921, 'ties': 'breslow'}. Best is trial 429 with value: 0.745409816487361.[0m
[32m[I 2022-04-13 13:31:55,946][0m Trial 987 finished with value: 0.7452934267530601 and parameters: {'alpha': 1.2641284542185316, 'ties': 'breslow'}. Best is trial 429 with value: 0.745409816487361.[0m
[32m[I 2022-04-13 13:31:58,648][0m Trial 988 finished with value: 0.7452328219623576 and parameters: {'alpha': 1.0817553937321442, 'ties': 'breslow'}. Best is trial 429 with value: 0.745409816487361.[0m
[32m[I 2022-04-13 13:32:02,593][0m Trial 989 finished with value: 0.7449899145912454 and parameters: {'alpha': 1.4016914413278174, 'ties': 'breslow'}. Best is trial 429 with value: 0.745409816487361.[0m
[32m[I 2022-04-13 13:32:06,379][0m Trial 990 finished with value: 0.745281329616783 and parameters: {'alpha': 0.9809541109652485, 'ties': 'breslow'}. Best is trial 429 with value: 0.745409816487361.[0m
[32m[I 2022-04-13 13:32:10,679][0m Trial 991 finished with value: 0.744011957682546 and parameters: {'alpha': 2.3603345037415617, 'ties': 'breslow'}. Best is trial 429 with value: 0.745409816487361.[0m
[32m[I 2022-04-13 13:32:13,432][0m Trial 992 finished with value: 0.7405892080447942 and parameters: {'alpha': 3.65792263477171, 'ties': 'efron'}. Best is trial 429 with value: 0.745409816487361.[0m
[32m[I 2022-04-13 13:32:16,927][0m Trial 993 finished with value: 0.7451970342424996 and parameters: {'alpha': 1.1761562349343901, 'ties': 'breslow'}. Best is trial 429 with value: 0.745409816487361.[0m
[32m[I 2022-04-13 13:32:20,129][0m Trial 994 finished with value: 0.7421270154449077 and parameters: {'alpha': 3.1663571257734136, 'ties': 'breslow'}. Best is trial 429 with value: 0.745409816487361.[0m
[32m[I 2022-04-13 13:32:24,100][0m Trial 995 finished with value: 0.7450308338708971 and parameters: {'alpha': 1.3400516386374293, 'ties': 'breslow'}. Best is trial 429 with value: 0.745409816487361.[0m
[32m[I 2022-04-13 13:32:26,939][0m Trial 996 finished with value: 0.7449154142979261 and parameters: {'alpha': 1.4583495452447517, 'ties': 'breslow'}. Best is trial 429 with value: 0.745409816487361.[0m
[32m[I 2022-04-13 13:32:31,454][0m Trial 997 finished with value: 0.7453212759512853 and parameters: {'alpha': 1.2479571086792283, 'ties': 'breslow'}. Best is trial 429 with value: 0.745409816487361.[0m
[32m[I 2022-04-13 13:32:34,833][0m Trial 998 finished with value: 0.7451448497161023 and parameters: {'alpha': 1.1069674189094427, 'ties': 'breslow'}. Best is trial 429 with value: 0.745409816487361.[0m
[32m[I 2022-04-13 13:32:38,132][0m Trial 999 finished with value: 0.7453018739649686 and parameters: {'alpha': 1.2927753697566784, 'ties': 'breslow'}. Best is trial 429 with value: 0.745409816487361.[0m
CoxPH
Running Optimizer with LogRank binary scoring
{'alpha': 1.2171135171603977, 'ties': 'breslow', 'UnoC_LR': 0.7727038262700389}
Running Optimizer normaly
{'alpha': 1.2126152404223869, 'ties': 'breslow', 'UnoC': 0.745409816487361}
