[32m[I 2022-04-15 05:11:42,899][0m Trial 415 finished with value: 0.6743624146605087 and parameters: {'loss': 'coxph', 'learning_rate': 0.017802166931323308, 'n_estimators': 143, 'criterion': 'friedman_mse', 'min_samples_split': 3, 'min_samples_leaf': 6, 'min_weight_fraction_leaf': 0.22693140845238297, 'min_impurity_decrease': 0.6559210701267063, 'max_features': 0.9947614053160907, 'subsample': 0.5878353903198639, 'dropout_rate': 0.03507558542331055, 'ccp_alpha': 0.17617781027209228}. Best is trial 365 with value: 0.769790840194853.[0m
[32m[I 2022-04-15 05:11:59,156][0m Trial 416 finished with value: 0.7225934112163407 and parameters: {'loss': 'coxph', 'learning_rate': 0.0045951766729707124, 'n_estimators': 155, 'criterion': 'friedman_mse', 'min_samples_split': 3, 'min_samples_leaf': 6, 'min_weight_fraction_leaf': 0.18418671961411007, 'min_impurity_decrease': 0.7003265083171057, 'max_features': 0.9306395023998671, 'subsample': 0.5272013720214848, 'dropout_rate': 0.020932036086240547, 'ccp_alpha': 0.09531535259474795}. Best is trial 365 with value: 0.769790840194853.[0m
[32m[I 2022-04-15 05:12:15,013][0m Trial 417 finished with value: 0.6743624146605087 and parameters: {'loss': 'coxph', 'learning_rate': 0.02188376104018854, 'n_estimators': 160, 'criterion': 'friedman_mse', 'min_samples_split': 3, 'min_samples_leaf': 6, 'min_weight_fraction_leaf': 0.2042374729831536, 'min_impurity_decrease': 0.6587611375000745, 'max_features': 0.8984114083295628, 'subsample': 0.5976273568700022, 'dropout_rate': 0.04932585150158742, 'ccp_alpha': 0.17157308103782595}. Best is trial 365 with value: 0.769790840194853.[0m
[32m[I 2022-04-15 05:12:28,862][0m Trial 418 finished with value: 0.5 and parameters: {'loss': 'coxph', 'learning_rate': 0.011352284068176073, 'n_estimators': 149, 'criterion': 'friedman_mse', 'min_samples_split': 3, 'min_samples_leaf': 6, 'min_weight_fraction_leaf': 0.16893277649987215, 'min_impurity_decrease': 0.6113132830016518, 'max_features': 0.9522218135726486, 'subsample': 0.6243796817201075, 'dropout_rate': 7.578064803284712e-05, 'ccp_alpha': 0.33743276121989163}. Best is trial 365 with value: 0.769790840194853.[0m
[32m[I 2022-04-15 05:12:36,916][0m Trial 419 finished with value: 0.2735082810473772 and parameters: {'loss': 'squared', 'learning_rate': 0.01615319966223995, 'n_estimators': 167, 'criterion': 'friedman_mse', 'min_samples_split': 3, 'min_samples_leaf': 6, 'min_weight_fraction_leaf': 0.22012993450942855, 'min_impurity_decrease': 0.6292747574831328, 'max_features': 0.8630745949917609, 'subsample': 0.5592650154426481, 'dropout_rate': 0.03818368210827734, 'ccp_alpha': 0.07773451227318197}. Best is trial 365 with value: 0.769790840194853.[0m
[32m[I 2022-04-15 05:12:52,217][0m Trial 420 finished with value: 0.5 and parameters: {'loss': 'coxph', 'learning_rate': 0.007851449949942335, 'n_estimators': 143, 'criterion': 'absolute_error', 'min_samples_split': 3, 'min_samples_leaf': 6, 'min_weight_fraction_leaf': 0.19502110363971262, 'min_impurity_decrease': 0.7162408311585676, 'max_features': 0.8346846588308862, 'subsample': 0.5150467442701128, 'dropout_rate': 0.02174381720813432, 'ccp_alpha': 0.00557940102678054}. Best is trial 365 with value: 0.769790840194853.[0m
[32m[I 2022-04-15 05:13:06,645][0m Trial 421 finished with value: 0.6743624146605087 and parameters: {'loss': 'coxph', 'learning_rate': 0.013951617162826701, 'n_estimators': 153, 'criterion': 'friedman_mse', 'min_samples_split': 4, 'min_samples_leaf': 6, 'min_weight_fraction_leaf': 0.15029543854365957, 'min_impurity_decrease': 0.6736561539486909, 'max_features': 0.8546121188621132, 'subsample': 0.579136256020578, 'dropout_rate': 0.052154206200220474, 'ccp_alpha': 0.16926987001599247}. Best is trial 365 with value: 0.769790840194853.[0m
[32m[I 2022-04-15 05:13:18,407][0m Trial 422 finished with value: 0.6953679659582598 and parameters: {'loss': 'coxph', 'learning_rate': 0.02127117215556044, 'n_estimators': 135, 'criterion': 'friedman_mse', 'min_samples_split': 3, 'min_samples_leaf': 6, 'min_weight_fraction_leaf': 0.23959965498958305, 'min_impurity_decrease': 0.6428937610949861, 'max_features': 0.8755955902442458, 'subsample': 0.5446187160754201, 'dropout_rate': 0.02122507714454302, 'ccp_alpha': 0.09976728079491487}. Best is trial 365 with value: 0.769790840194853.[0m
[32m[I 2022-04-15 05:13:33,094][0m Trial 423 finished with value: 0.5 and parameters: {'loss': 'coxph', 'learning_rate': 0.010717334215226304, 'n_estimators': 160, 'criterion': 'friedman_mse', 'min_samples_split': 3, 'min_samples_leaf': 6, 'min_weight_fraction_leaf': 0.20590721748236163, 'min_impurity_decrease': 0.5809716988106168, 'max_features': 0.9239371439861105, 'subsample': 0.6190978312162304, 'dropout_rate': 0.04946966672287818, 'ccp_alpha': 0.25743406141784464}. Best is trial 365 with value: 0.769790840194853.[0m
[32m[I 2022-04-15 05:13:49,579][0m Trial 424 finished with value: 0.7655286440120528 and parameters: {'loss': 'coxph', 'learning_rate': 0.01766902557270718, 'n_estimators': 163, 'criterion': 'friedman_mse', 'min_samples_split': 3, 'min_samples_leaf': 6, 'min_weight_fraction_leaf': 0.1750516760875399, 'min_impurity_decrease': 0.68378105847742, 'max_features': 0.8077595191915475, 'subsample': 0.5677233921678337, 'dropout_rate': 0.034888853127631944, 'ccp_alpha': 0.0038509203291525844}. Best is trial 365 with value: 0.769790840194853.[0m
[32m[I 2022-04-15 05:14:05,563][0m Trial 425 finished with value: 0.7024168003863569 and parameters: {'loss': 'coxph', 'learning_rate': 0.016564606376015454, 'n_estimators': 161, 'criterion': 'friedman_mse', 'min_samples_split': 3, 'min_samples_leaf': 6, 'min_weight_fraction_leaf': 0.17983811257438054, 'min_impurity_decrease': 0.6804239671789982, 'max_features': 0.8136586246589749, 'subsample': 0.5653466374164099, 'dropout_rate': 0.032399220979043256, 'ccp_alpha': 0.09766561298521595}. Best is trial 365 with value: 0.769790840194853.[0m
[32m[I 2022-04-15 05:15:03,893][0m Trial 426 finished with value: 0.5 and parameters: {'loss': 'coxph', 'learning_rate': 0.022383256657424334, 'n_estimators': 433, 'criterion': 'friedman_mse', 'min_samples_split': 3, 'min_samples_leaf': 6, 'min_weight_fraction_leaf': 0.17149893303654, 'min_impurity_decrease': 0.6971854875547324, 'max_features': 0.846390598621755, 'subsample': 0.5393421147194908, 'dropout_rate': 0.3495022023736587, 'ccp_alpha': 0.23037136687259352}. Best is trial 365 with value: 0.769790840194853.[0m
[32m[I 2022-04-15 05:15:19,343][0m Trial 427 finished with value: 0.7185952849224341 and parameters: {'loss': 'coxph', 'learning_rate': 0.01230566296809955, 'n_estimators': 152, 'criterion': 'friedman_mse', 'min_samples_split': 3, 'min_samples_leaf': 6, 'min_weight_fraction_leaf': 0.18241429147248026, 'min_impurity_decrease': 0.6559944063427083, 'max_features': 0.8269161778102504, 'subsample': 0.5298796977268615, 'dropout_rate': 8.03634267286385e-05, 'ccp_alpha': 0.09336883669477751}. Best is trial 365 with value: 0.769790840194853.[0m
[32m[I 2022-04-15 05:15:35,967][0m Trial 428 finished with value: 0.5 and parameters: {'loss': 'coxph', 'learning_rate': 0.017145657033944328, 'n_estimators': 167, 'criterion': 'friedman_mse', 'min_samples_split': 3, 'min_samples_leaf': 6, 'min_weight_fraction_leaf': 0.19623828880301916, 'min_impurity_decrease': 0.6308336131628889, 'max_features': 0.8504207917679618, 'subsample': 0.5614603679882794, 'dropout_rate': 0.03623529811478562, 'ccp_alpha': 3.309536990317284}. Best is trial 365 with value: 0.769790840194853.[0m
[32m[I 2022-04-15 05:15:49,519][0m Trial 429 finished with value: 0.5 and parameters: {'loss': 'coxph', 'learning_rate': 0.022460580561163575, 'n_estimators': 146, 'criterion': 'friedman_mse', 'min_samples_split': 4, 'min_samples_leaf': 6, 'min_weight_fraction_leaf': 0.1577314473378941, 'min_impurity_decrease': 0.6082741701263191, 'max_features': 0.9617406033912, 'subsample': 0.5828173256948207, 'dropout_rate': 0.019239760020897556, 'ccp_alpha': 0.3642513360419947}. Best is trial 365 with value: 0.769790840194853.[0m
[32m[I 2022-04-15 05:16:06,223][0m Trial 430 finished with value: 0.7650754782212379 and parameters: {'loss': 'coxph', 'learning_rate': 0.014158686041029314, 'n_estimators': 167, 'criterion': 'friedman_mse', 'min_samples_split': 3, 'min_samples_leaf': 6, 'min_weight_fraction_leaf': 0.21788329898791847, 'min_impurity_decrease': 0.7093970265735696, 'max_features': 0.8943857923997077, 'subsample': 0.5106938747845969, 'dropout_rate': 0.05299030592372226, 'ccp_alpha': 0.0024101651842989816}. Best is trial 365 with value: 0.769790840194853.[0m
[32m[I 2022-04-15 05:16:22,357][0m Trial 431 finished with value: 0.5 and parameters: {'loss': 'coxph', 'learning_rate': 0.014305267996622897, 'n_estimators': 165, 'criterion': 'squared_error', 'min_samples_split': 3, 'min_samples_leaf': 6, 'min_weight_fraction_leaf': 0.21771496622995273, 'min_impurity_decrease': 0.7154255037197573, 'max_features': 0.8961432698826685, 'subsample': 0.49988775369656324, 'dropout_rate': 0.05279727272241019, 'ccp_alpha': 0.1715707556373836}. Best is trial 365 with value: 0.769790840194853.[0m
[32m[I 2022-04-15 05:17:24,432][0m Trial 432 finished with value: 0.7271918846610463 and parameters: {'loss': 'coxph', 'learning_rate': 0.009600756953863306, 'n_estimators': 365, 'criterion': 'friedman_mse', 'min_samples_split': 3, 'min_samples_leaf': 6, 'min_weight_fraction_leaf': 0.2284183059512682, 'min_impurity_decrease': 0.6816139562287169, 'max_features': 0.8818382815055058, 'subsample': 0.5138613446030741, 'dropout_rate': 0.01926286651392965, 'ccp_alpha': 0.08820155238354878}. Best is trial 365 with value: 0.769790840194853.[0m
[32m[I 2022-04-15 05:17:40,131][0m Trial 433 finished with value: 0.762510985077211 and parameters: {'loss': 'coxph', 'learning_rate': 0.018066951195892324, 'n_estimators': 155, 'criterion': 'friedman_mse', 'min_samples_split': 3, 'min_samples_leaf': 6, 'min_weight_fraction_leaf': 0.2102927558942351, 'min_impurity_decrease': 0.7157197940766117, 'max_features': 0.9177293440602202, 'subsample': 0.48558876483010316, 'dropout_rate': 0.0370409799555779, 'ccp_alpha': 0.004927939124602323}. Best is trial 365 with value: 0.769790840194853.[0m
[32m[I 2022-04-15 05:17:57,045][0m Trial 434 finished with value: 0.6743624146605087 and parameters: {'loss': 'coxph', 'learning_rate': 0.007557310629157444, 'n_estimators': 168, 'criterion': 'friedman_mse', 'min_samples_split': 3, 'min_samples_leaf': 6, 'min_weight_fraction_leaf': 0.1889273248858666, 'min_impurity_decrease': 0.6921068211949704, 'max_features': 0.8692119093060824, 'subsample': 0.5078068893409189, 'dropout_rate': 0.054433542759839464, 'ccp_alpha': 0.17696790743643545}. Best is trial 365 with value: 0.769790840194853.[0m
[32m[I 2022-04-15 05:18:13,409][0m Trial 435 finished with value: 0.7269831623366179 and parameters: {'loss': 'coxph', 'learning_rate': 0.012365829016143762, 'n_estimators': 158, 'criterion': 'friedman_mse', 'min_samples_split': 3, 'min_samples_leaf': 6, 'min_weight_fraction_leaf': 0.2046340610121312, 'min_impurity_decrease': 0.6596561264539456, 'max_features': 0.9001481610241109, 'subsample': 0.5369761511612228, 'dropout_rate': 0.00040770269173465666, 'ccp_alpha': 0.08616552164060141}. Best is trial 365 with value: 0.769790840194853.[0m
[32m[I 2022-04-15 05:18:27,809][0m Trial 436 finished with value: 0.7667630545040227 and parameters: {'loss': 'coxph', 'learning_rate': 0.01599979803486908, 'n_estimators': 141, 'criterion': 'friedman_mse', 'min_samples_split': 3, 'min_samples_leaf': 6, 'min_weight_fraction_leaf': 0.1690927330534149, 'min_impurity_decrease': 0.5952441015118134, 'max_features': 0.8813226317756854, 'subsample': 0.525409986781238, 'dropout_rate': 0.025336121817510437, 'ccp_alpha': 0.004714183668312167}. Best is trial 365 with value: 0.769790840194853.[0m
[32m[I 2022-04-15 05:18:42,028][0m Trial 437 finished with value: 0.5301157883717103 and parameters: {'loss': 'coxph', 'learning_rate': 0.023506429440087476, 'n_estimators': 139, 'criterion': 'friedman_mse', 'min_samples_split': 3, 'min_samples_leaf': 6, 'min_weight_fraction_leaf': 0.16331825244743584, 'min_impurity_decrease': 0.5998169043832328, 'max_features': 0.8757703783303097, 'subsample': 0.4916625142859096, 'dropout_rate': 0.01910123591385511, 'ccp_alpha': 0.24590937496013776}. Best is trial 365 with value: 0.769790840194853.[0m
[32m[I 2022-04-15 05:18:53,927][0m Trial 438 finished with value: 0.6743624146605087 and parameters: {'loss': 'coxph', 'learning_rate': 0.018304179370115154, 'n_estimators': 132, 'criterion': 'friedman_mse', 'min_samples_split': 3, 'min_samples_leaf': 6, 'min_weight_fraction_leaf': 0.1749985479918191, 'min_impurity_decrease': 0.5644150161392542, 'max_features': 0.8448618311365769, 'subsample': 0.5193642317498073, 'dropout_rate': 0.029540222188631678, 'ccp_alpha': 0.16378104366106133}. Best is trial 365 with value: 0.769790840194853.[0m
[32m[I 2022-04-15 05:19:07,516][0m Trial 439 finished with value: 0.7280555953004985 and parameters: {'loss': 'coxph', 'learning_rate': 0.016066600033540365, 'n_estimators': 144, 'criterion': 'friedman_mse', 'min_samples_split': 3, 'min_samples_leaf': 6, 'min_weight_fraction_leaf': 0.18596442535164506, 'min_impurity_decrease': 0.7031057400964976, 'max_features': 0.815470938137636, 'subsample': 0.5269724475720042, 'dropout_rate': 0.017772900947026053, 'ccp_alpha': 0.0911812293058832}. Best is trial 365 with value: 0.769790840194853.[0m
[32m[I 2022-04-15 05:19:16,012][0m Trial 440 finished with value: 0.23145372661213112 and parameters: {'loss': 'squared', 'learning_rate': 0.025688561393881697, 'n_estimators': 150, 'criterion': 'friedman_mse', 'min_samples_split': 4, 'min_samples_leaf': 6, 'min_weight_fraction_leaf': 0.1429692751177455, 'min_impurity_decrease': 0.6411650748966691, 'max_features': 0.8649574525717945, 'subsample': 0.5055571588121466, 'dropout_rate': 0.039165218165251994, 'ccp_alpha': 0.0019366498032613285}. Best is trial 365 with value: 0.769790840194853.[0m
[32m[I 2022-04-15 05:19:29,628][0m Trial 441 finished with value: 0.6743624146605087 and parameters: {'loss': 'coxph', 'learning_rate': 0.010079922282145158, 'n_estimators': 140, 'criterion': 'friedman_mse', 'min_samples_split': 3, 'min_samples_leaf': 6, 'min_weight_fraction_leaf': 0.1700793630365643, 'min_impurity_decrease': 0.6692680458317809, 'max_features': 0.8348891478008788, 'subsample': 0.4793317492648019, 'dropout_rate': 0.015773495804833355, 'ccp_alpha': 0.15996751090804748}. Best is trial 365 with value: 0.769790840194853.[0m
[32m[I 2022-04-15 05:19:44,851][0m Trial 442 finished with value: 0.5 and parameters: {'loss': 'coxph', 'learning_rate': 0.023161651216147425, 'n_estimators': 149, 'criterion': 'friedman_mse', 'min_samples_split': 3, 'min_samples_leaf': 6, 'min_weight_fraction_leaf': 0.15363166574313514, 'min_impurity_decrease': 0.687898576893388, 'max_features': 0.8873020028489624, 'subsample': 0.5455111442568427, 'dropout_rate': 0.0014846860451150825, 'ccp_alpha': 0.29906062885548784}. Best is trial 365 with value: 0.769790840194853.[0m
[32m[I 2022-04-15 05:19:56,784][0m Trial 443 finished with value: 0.7233915017580637 and parameters: {'loss': 'coxph', 'learning_rate': 0.018829562388184867, 'n_estimators': 135, 'criterion': 'friedman_mse', 'min_samples_split': 3, 'min_samples_leaf': 6, 'min_weight_fraction_leaf': 0.22370269327355546, 'min_impurity_decrease': 0.7247240285233341, 'max_features': 0.8556662098685364, 'subsample': 0.53152933211303, 'dropout_rate': 0.05422368107990258, 'ccp_alpha': 0.08414539407818016}. Best is trial 365 with value: 0.769790840194853.[0m
[32m[I 2022-04-15 05:20:12,627][0m Trial 444 finished with value: 0.7301854125199918 and parameters: {'loss': 'coxph', 'learning_rate': 0.014715675493126109, 'n_estimators': 155, 'criterion': 'friedman_mse', 'min_samples_split': 3, 'min_samples_leaf': 6, 'min_weight_fraction_leaf': 0.2304618827864216, 'min_impurity_decrease': 0.6474996056026374, 'max_features': 0.8059047125193501, 'subsample': 0.5507195655187586, 'dropout_rate': 0.03669519820523402, 'ccp_alpha': 0.08419307722739736}. Best is trial 365 with value: 0.769790840194853.[0m
[32m[I 2022-04-15 05:20:32,505][0m Trial 445 finished with value: 0.5 and parameters: {'loss': 'coxph', 'learning_rate': 0.012389798657425864, 'n_estimators': 168, 'criterion': 'absolute_error', 'min_samples_split': 3, 'min_samples_leaf': 6, 'min_weight_fraction_leaf': 0.19288797358015788, 'min_impurity_decrease': 0.5852034397745192, 'max_features': 0.8489125619389711, 'subsample': 0.5698396229139323, 'dropout_rate': 0.0003961672312650204, 'ccp_alpha': 0.25210513191118233}. Best is trial 365 with value: 0.769790840194853.[0m
[32m[I 2022-04-15 05:20:45,216][0m Trial 446 finished with value: 0.5 and parameters: {'loss': 'coxph', 'learning_rate': 0.01874238491612807, 'n_estimators': 144, 'criterion': 'friedman_mse', 'min_samples_split': 5, 'min_samples_leaf': 6, 'min_weight_fraction_leaf': 0.1765524806263526, 'min_impurity_decrease': 0.6718554739759606, 'max_features': 0.8278208462703124, 'subsample': 0.5052201857426065, 'dropout_rate': 0.033272472183531535, 'ccp_alpha': 0.8411676656159511}. Best is trial 365 with value: 0.769790840194853.[0m
[32m[I 2022-04-15 05:21:02,074][0m Trial 447 finished with value: 0.7659490792401944 and parameters: {'loss': 'coxph', 'learning_rate': 0.006471776995448888, 'n_estimators': 159, 'criterion': 'friedman_mse', 'min_samples_split': 4, 'min_samples_leaf': 6, 'min_weight_fraction_leaf': 0.1635425248479625, 'min_impurity_decrease': 0.7032289656704656, 'max_features': 0.8881121266736562, 'subsample': 0.5552470177417048, 'dropout_rate': 0.056318747687904, 'ccp_alpha': 0.0037822144615903604}. Best is trial 365 with value: 0.769790840194853.[0m
[32m[I 2022-04-15 05:21:16,481][0m Trial 448 finished with value: 0.5 and parameters: {'loss': 'coxph', 'learning_rate': 0.005374182648651432, 'n_estimators': 153, 'criterion': 'friedman_mse', 'min_samples_split': 4, 'min_samples_leaf': 6, 'min_weight_fraction_leaf': 0.17003586282964092, 'min_impurity_decrease': 0.7140333244201107, 'max_features': 0.9051785391263378, 'subsample': 0.5357838311196624, 'dropout_rate': 0.05501772231211539, 'ccp_alpha': 1.3385165672739616}. Best is trial 365 with value: 0.769790840194853.[0m
[32m[I 2022-04-15 05:21:33,003][0m Trial 449 finished with value: 0.7648505441185371 and parameters: {'loss': 'coxph', 'learning_rate': 0.008573487707706785, 'n_estimators': 159, 'criterion': 'friedman_mse', 'min_samples_split': 4, 'min_samples_leaf': 6, 'min_weight_fraction_leaf': 0.15741206039256145, 'min_impurity_decrease': 0.6941742694992074, 'max_features': 0.8758865620407686, 'subsample': 0.5537026428325523, 'dropout_rate': 0.021157307150087054, 'ccp_alpha': 0.004979563801436425}. Best is trial 365 with value: 0.769790840194853.[0m
[32m[I 2022-04-15 05:21:50,181][0m Trial 450 finished with value: 0.5 and parameters: {'loss': 'coxph', 'learning_rate': 0.0035071170692327737, 'n_estimators': 164, 'criterion': 'friedman_mse', 'min_samples_split': 4, 'min_samples_leaf': 6, 'min_weight_fraction_leaf': 0.15919860979415915, 'min_impurity_decrease': 0.6907468985802022, 'max_features': 0.8881233649401362, 'subsample': 0.5284859468260537, 'dropout_rate': 0.017033181641693852, 'ccp_alpha': 0.42710745499535474}. Best is trial 365 with value: 0.769790840194853.[0m
[32m[I 2022-04-15 05:22:04,755][0m Trial 451 finished with value: 0.6743624146605087 and parameters: {'loss': 'coxph', 'learning_rate': 0.007484604554147933, 'n_estimators': 148, 'criterion': 'friedman_mse', 'min_samples_split': 4, 'min_samples_leaf': 5, 'min_weight_fraction_leaf': 0.1274168000487235, 'min_impurity_decrease': 0.7044200635153535, 'max_features': 0.9373397694735183, 'subsample': 0.47549662907925605, 'dropout_rate': 0.03754045004155476, 'ccp_alpha': 0.17739523715091945}. Best is trial 365 with value: 0.769790840194853.[0m
[32m[I 2022-04-15 05:22:23,264][0m Trial 452 finished with value: 0.7648473821617027 and parameters: {'loss': 'coxph', 'learning_rate': 0.008713623943785866, 'n_estimators': 170, 'criterion': 'friedman_mse', 'min_samples_split': 5, 'min_samples_leaf': 6, 'min_weight_fraction_leaf': 0.15220317142075565, 'min_impurity_decrease': 0.725338391029685, 'max_features': 0.8770874611910933, 'subsample': 0.5515452357621743, 'dropout_rate': 0.057022037334291176, 'ccp_alpha': 0.005472400709534067}. Best is trial 365 with value: 0.769790840194853.[0m
[32m[I 2022-04-15 05:22:41,695][0m Trial 453 finished with value: 0.728180887781922 and parameters: {'loss': 'coxph', 'learning_rate': 0.006292990672112407, 'n_estimators': 171, 'criterion': 'friedman_mse', 'min_samples_split': 4, 'min_samples_leaf': 6, 'min_weight_fraction_leaf': 0.1480761357783348, 'min_impurity_decrease': 0.6564253882465882, 'max_features': 0.8752710322130138, 'subsample': 0.5621703453971504, 'dropout_rate': 0.05684276184540894, 'ccp_alpha': 0.09921639404701646}. Best is trial 365 with value: 0.769790840194853.[0m
[32m[I 2022-04-15 05:22:53,138][0m Trial 454 finished with value: 0.5 and parameters: {'loss': 'coxph', 'learning_rate': 0.008579543972430187, 'n_estimators': 132, 'criterion': 'squared_error', 'min_samples_split': 5, 'min_samples_leaf': 6, 'min_weight_fraction_leaf': 0.1379070121512784, 'min_impurity_decrease': 0.7244997163109279, 'max_features': 0.9035633480028737, 'subsample': 0.5731036668129812, 'dropout_rate': 0.015233371051051051, 'ccp_alpha': 0.004101278549643482}. Best is trial 365 with value: 0.769790840194853.[0m
