[32m[I 2022-04-14 21:29:43,840][0m Trial 770 finished with value: 0.7845773442016363 and parameters: {'loss': 'coxph', 'learning_rate': 5.922424243473019e-06, 'n_estimators': 844, 'criterion': 'friedman_mse', 'min_samples_split': 10, 'min_samples_leaf': 2, 'min_weight_fraction_leaf': 0.2810541274694603, 'min_impurity_decrease': 0.38231282647741094, 'max_features': 0.7588899275837374, 'subsample': 0.029334329837740376, 'dropout_rate': 0.6467639228794739, 'ccp_alpha': 0.004283314029647298}. Best is trial 770 with value: 0.7845773442016363.[0m
[32m[I 2022-04-14 21:32:12,421][0m Trial 771 finished with value: 0.25 and parameters: {'loss': 'coxph', 'learning_rate': 5.911295826705186e-06, 'n_estimators': 784, 'criterion': 'friedman_mse', 'min_samples_split': 10, 'min_samples_leaf': 2, 'min_weight_fraction_leaf': 0.26820653698096475, 'min_impurity_decrease': 0.4148191255875179, 'max_features': 0.7649386126125565, 'subsample': 0.0032213080411747745, 'dropout_rate': 0.6293773668383839, 'ccp_alpha': 0.0015134987198649847}. Best is trial 770 with value: 0.7845773442016363.[0m
[32m[I 2022-04-14 21:34:18,102][0m Trial 772 finished with value: 0.25 and parameters: {'loss': 'coxph', 'learning_rate': 3.445919054340122e-06, 'n_estimators': 720, 'criterion': 'friedman_mse', 'min_samples_split': 10, 'min_samples_leaf': 2, 'min_weight_fraction_leaf': 0.2565374489591636, 'min_impurity_decrease': 0.3781509628075121, 'max_features': 0.7412988930378177, 'subsample': 0.0019379373588903105, 'dropout_rate': 0.6074415261940451, 'ccp_alpha': 0.008725774457547934}. Best is trial 770 with value: 0.7845773442016363.[0m
[32m[I 2022-04-14 21:36:46,576][0m Trial 773 finished with value: 0.7790640923086565 and parameters: {'loss': 'coxph', 'learning_rate': 4.991977869407266e-06, 'n_estimators': 825, 'criterion': 'friedman_mse', 'min_samples_split': 10, 'min_samples_leaf': 2, 'min_weight_fraction_leaf': 0.2687691335683556, 'min_impurity_decrease': 0.39401461359009377, 'max_features': 0.7581575190704475, 'subsample': 0.03017304322123962, 'dropout_rate': 0.6451386162284463, 'ccp_alpha': 0.16170476401885014}. Best is trial 770 with value: 0.7845773442016363.[0m
[32m[I 2022-04-14 21:39:05,978][0m Trial 774 finished with value: 0.7769643596825644 and parameters: {'loss': 'coxph', 'learning_rate': 4.132003092027989e-06, 'n_estimators': 757, 'criterion': 'friedman_mse', 'min_samples_split': 10, 'min_samples_leaf': 2, 'min_weight_fraction_leaf': 0.3053423936845044, 'min_impurity_decrease': 0.3326330716481562, 'max_features': 0.7785435921239854, 'subsample': 0.021114478549552288, 'dropout_rate': 0.6166893352734085, 'ccp_alpha': 0.08425100548591864}. Best is trial 770 with value: 0.7845773442016363.[0m
[32m[I 2022-04-14 21:41:33,848][0m Trial 775 finished with value: 0.7779964929982174 and parameters: {'loss': 'coxph', 'learning_rate': 5.749105496300205e-06, 'n_estimators': 843, 'criterion': 'friedman_mse', 'min_samples_split': 10, 'min_samples_leaf': 2, 'min_weight_fraction_leaf': 0.2980470623299194, 'min_impurity_decrease': 0.42644947720558635, 'max_features': 0.7945749180782153, 'subsample': 0.03645776701722392, 'dropout_rate': 0.633430585405501, 'ccp_alpha': 0.26609560974722435}. Best is trial 770 with value: 0.7845773442016363.[0m
[32m[I 2022-04-14 21:43:51,534][0m Trial 776 finished with value: 0.7790180576335504 and parameters: {'loss': 'coxph', 'learning_rate': 4.753535623865352e-06, 'n_estimators': 812, 'criterion': 'friedman_mse', 'min_samples_split': 10, 'min_samples_leaf': 1, 'min_weight_fraction_leaf': 0.2951029944759665, 'min_impurity_decrease': 0.3995618564574194, 'max_features': 0.7910453888815075, 'subsample': 0.042398259769692095, 'dropout_rate': 0.6725834315451839, 'ccp_alpha': 0.16256751131973196}. Best is trial 770 with value: 0.7845773442016363.[0m
[32m[I 2022-04-14 21:46:10,502][0m Trial 777 finished with value: 0.25 and parameters: {'loss': 'coxph', 'learning_rate': 6.352465526247702e-06, 'n_estimators': 783, 'criterion': 'friedman_mse', 'min_samples_split': 10, 'min_samples_leaf': 2, 'min_weight_fraction_leaf': 0.3185986595353232, 'min_impurity_decrease': 0.3762939082582482, 'max_features': 0.8078907871661521, 'subsample': 0.0011866428765670567, 'dropout_rate': 0.6085847623029036, 'ccp_alpha': 0.0011904930205341255}. Best is trial 770 with value: 0.7845773442016363.[0m
[32m[I 2022-04-14 21:47:37,125][0m Trial 778 finished with value: -0.3710913989450525 and parameters: {'loss': 'squared', 'learning_rate': 3.276046950111153e-06, 'n_estimators': 854, 'criterion': 'friedman_mse', 'min_samples_split': 10, 'min_samples_leaf': 2, 'min_weight_fraction_leaf': 0.30992183859807343, 'min_impurity_decrease': 0.4465255057586513, 'max_features': 0.8196964708062944, 'subsample': 0.04386025229552797, 'dropout_rate': 0.6519683109278779, 'ccp_alpha': 0.08758452744276835}. Best is trial 770 with value: 0.7845773442016363.[0m
[32m[I 2022-04-14 21:49:46,075][0m Trial 779 finished with value: 0.7790087355662401 and parameters: {'loss': 'coxph', 'learning_rate': 2.7097873877788476e-06, 'n_estimators': 735, 'criterion': 'friedman_mse', 'min_samples_split': 10, 'min_samples_leaf': 2, 'min_weight_fraction_leaf': 0.2607406712505428, 'min_impurity_decrease': 0.32927019090308085, 'max_features': 0.8406972038647915, 'subsample': 0.02090232065114905, 'dropout_rate': 0.6267860994688362, 'ccp_alpha': 0.19518903742264984}. Best is trial 770 with value: 0.7845773442016363.[0m
[32m[I 2022-04-14 21:52:29,922][0m Trial 780 finished with value: 0.7762844892441394 and parameters: {'loss': 'coxph', 'learning_rate': 5.90432438816229e-06, 'n_estimators': 852, 'criterion': 'squared_error', 'min_samples_split': 10, 'min_samples_leaf': 2, 'min_weight_fraction_leaf': 0.3291578336458982, 'min_impurity_decrease': 0.352617192593906, 'max_features': 0.7943951605634153, 'subsample': 0.021272882456075438, 'dropout_rate': 0.6003080221300715, 'ccp_alpha': 0.08705518492781328}. Best is trial 770 with value: 0.7845773442016363.[0m
[32m[I 2022-04-14 21:54:53,221][0m Trial 781 finished with value: 0.7819304994359122 and parameters: {'loss': 'coxph', 'learning_rate': 4.207442702563572e-06, 'n_estimators': 800, 'criterion': 'friedman_mse', 'min_samples_split': 10, 'min_samples_leaf': 1, 'min_weight_fraction_leaf': 0.27437241193357226, 'min_impurity_decrease': 0.37885324846052154, 'max_features': 0.8179395379559226, 'subsample': 0.04977472911128443, 'dropout_rate': 0.6461960505463228, 'ccp_alpha': 0.0035203965808406727}. Best is trial 770 with value: 0.7845773442016363.[0m
[32m[I 2022-04-14 21:56:46,859][0m Trial 782 finished with value: 0.7813210045884198 and parameters: {'loss': 'coxph', 'learning_rate': 2.4457323023407705e-06, 'n_estimators': 705, 'criterion': 'friedman_mse', 'min_samples_split': 10, 'min_samples_leaf': 1, 'min_weight_fraction_leaf': 0.2946580452546774, 'min_impurity_decrease': 0.40417792432073224, 'max_features': 0.845033270363505, 'subsample': 0.038166814338737594, 'dropout_rate': 0.6788347131661456, 'ccp_alpha': 0.010174299966880927}. Best is trial 770 with value: 0.7845773442016363.[0m
[32m[I 2022-04-14 21:58:24,971][0m Trial 783 finished with value: 0.7810057638915446 and parameters: {'loss': 'coxph', 'learning_rate': 1.93504522314777e-06, 'n_estimators': 660, 'criterion': 'friedman_mse', 'min_samples_split': 10, 'min_samples_leaf': 1, 'min_weight_fraction_leaf': 0.27728851940893073, 'min_impurity_decrease': 0.4234764604876803, 'max_features': 0.8414119123954069, 'subsample': 0.03478772386449907, 'dropout_rate': 0.7135693099079508, 'ccp_alpha': 0.0027338702869691422}. Best is trial 770 with value: 0.7845773442016363.[0m
[32m[I 2022-04-14 22:00:20,805][0m Trial 784 finished with value: 0.7828818580298602 and parameters: {'loss': 'coxph', 'learning_rate': 2.6750709074898947e-06, 'n_estimators': 692, 'criterion': 'friedman_mse', 'min_samples_split': 10, 'min_samples_leaf': 1, 'min_weight_fraction_leaf': 0.2853500758382803, 'min_impurity_decrease': 0.4070253936839533, 'max_features': 0.8175341601045126, 'subsample': 0.022569984500303984, 'dropout_rate': 0.6684502529932873, 'ccp_alpha': 0.08170228331902965}. Best is trial 770 with value: 0.7845773442016363.[0m
[32m[I 2022-04-14 22:01:55,911][0m Trial 785 finished with value: 0.25 and parameters: {'loss': 'coxph', 'learning_rate': 1.7999727043983776e-06, 'n_estimators': 638, 'criterion': 'friedman_mse', 'min_samples_split': 10, 'min_samples_leaf': 1, 'min_weight_fraction_leaf': 0.2801451887334095, 'min_impurity_decrease': 0.4366337472685489, 'max_features': 0.8166180386831036, 'subsample': 0.0011382315908966961, 'dropout_rate': 0.7597027286908101, 'ccp_alpha': 0.0026784405244918365}. Best is trial 770 with value: 0.7845773442016363.[0m
[32m[I 2022-04-14 22:03:47,136][0m Trial 786 finished with value: 0.7792084822830785 and parameters: {'loss': 'coxph', 'learning_rate': 1.7661017517849848e-06, 'n_estimators': 674, 'criterion': 'friedman_mse', 'min_samples_split': 10, 'min_samples_leaf': 1, 'min_weight_fraction_leaf': 0.2860346547707921, 'min_impurity_decrease': 0.41438236111852117, 'max_features': 0.8238745882544354, 'subsample': 0.02165045056918129, 'dropout_rate': 0.6697224985496106, 'ccp_alpha': 0.16798639101838353}. Best is trial 770 with value: 0.7845773442016363.[0m
[32m[I 2022-04-14 22:05:38,481][0m Trial 787 finished with value: 0.7754906446292175 and parameters: {'loss': 'coxph', 'learning_rate': 2.3103889360762525e-06, 'n_estimators': 716, 'criterion': 'friedman_mse', 'min_samples_split': 10, 'min_samples_leaf': 1, 'min_weight_fraction_leaf': 0.28502207841085664, 'min_impurity_decrease': 0.4006091158330908, 'max_features': 0.826100875324057, 'subsample': 0.02843194364800225, 'dropout_rate': 0.6996892005724253, 'ccp_alpha': 0.30226160434219057}. Best is trial 770 with value: 0.7845773442016363.[0m
[32m[I 2022-04-14 22:07:13,256][0m Trial 788 finished with value: 0.7800153335157686 and parameters: {'loss': 'coxph', 'learning_rate': 2.217119169349e-06, 'n_estimators': 631, 'criterion': 'friedman_mse', 'min_samples_split': 10, 'min_samples_leaf': 1, 'min_weight_fraction_leaf': 0.2794643445715573, 'min_impurity_decrease': 0.41756934001052964, 'max_features': 0.8082074197270571, 'subsample': 0.021112918009171706, 'dropout_rate': 0.683619373391621, 'ccp_alpha': 0.15479096589777327}. Best is trial 770 with value: 0.7845773442016363.[0m
[32m[I 2022-04-14 22:08:58,224][0m Trial 789 finished with value: 0.780804735886923 and parameters: {'loss': 'coxph', 'learning_rate': 2.4234596593424335e-06, 'n_estimators': 690, 'criterion': 'friedman_mse', 'min_samples_split': 10, 'min_samples_leaf': 1, 'min_weight_fraction_leaf': 0.29104679452540083, 'min_impurity_decrease': 0.4361313088394177, 'max_features': 0.844481637347562, 'subsample': 0.04676147421936052, 'dropout_rate': 0.7366196587381686, 'ccp_alpha': 0.0971662077348306}. Best is trial 770 with value: 0.7845773442016363.[0m
[32m[I 2022-04-14 22:10:46,063][0m Trial 790 finished with value: 0.778715095468684 and parameters: {'loss': 'coxph', 'learning_rate': 1.9867507257162676e-06, 'n_estimators': 702, 'criterion': 'friedman_mse', 'min_samples_split': 10, 'min_samples_leaf': 1, 'min_weight_fraction_leaf': 0.27825093953298097, 'min_impurity_decrease': 0.4076458513300366, 'max_features': 0.8120375324511651, 'subsample': 0.018772200463355374, 'dropout_rate': 0.6944034855142824, 'ccp_alpha': 0.22679426091786517}. Best is trial 770 with value: 0.7845773442016363.[0m
[32m[I 2022-04-14 22:12:09,506][0m Trial 791 finished with value: 0.7811225468952689 and parameters: {'loss': 'coxph', 'learning_rate': 2.6393611507255765e-06, 'n_estimators': 605, 'criterion': 'friedman_mse', 'min_samples_split': 10, 'min_samples_leaf': 1, 'min_weight_fraction_leaf': 0.24799709837281467, 'min_impurity_decrease': 0.3941150844090143, 'max_features': 0.7899644374975154, 'subsample': 0.04383595588483806, 'dropout_rate': 0.7203800387488919, 'ccp_alpha': 0.08716066065410921}. Best is trial 770 with value: 0.7845773442016363.[0m
[32m[I 2022-04-14 22:14:02,703][0m Trial 792 finished with value: 0.25 and parameters: {'loss': 'coxph', 'learning_rate': 3.07323542229535e-06, 'n_estimators': 700, 'criterion': 'friedman_mse', 'min_samples_split': 10, 'min_samples_leaf': 1, 'min_weight_fraction_leaf': 0.285394068843501, 'min_impurity_decrease': 0.41688711444678306, 'max_features': 0.8352838343213478, 'subsample': 0.0014757151922657821, 'dropout_rate': 0.6784454698488807, 'ccp_alpha': 0.31987768570987846}. Best is trial 770 with value: 0.7845773442016363.[0m
[32m[I 2022-04-14 22:15:56,359][0m Trial 793 finished with value: 0.7818847909093438 and parameters: {'loss': 'coxph', 'learning_rate': 1.4767313448928275e-06, 'n_estimators': 716, 'criterion': 'friedman_mse', 'min_samples_split': 10, 'min_samples_leaf': 1, 'min_weight_fraction_leaf': 0.2567790641768633, 'min_impurity_decrease': 0.39995545573502256, 'max_features': 0.7748004672765292, 'subsample': 0.039191607722627954, 'dropout_rate': 0.6914328953781385, 'ccp_alpha': 0.08358314809395387}. Best is trial 770 with value: 0.7845773442016363.[0m
[32m[I 2022-04-14 22:17:40,594][0m Trial 794 finished with value: 0.7782301439780375 and parameters: {'loss': 'coxph', 'learning_rate': 1.5060777217343232e-06, 'n_estimators': 669, 'criterion': 'friedman_mse', 'min_samples_split': 10, 'min_samples_leaf': 1, 'min_weight_fraction_leaf': 0.27037934936118646, 'min_impurity_decrease': 0.4490418860363685, 'max_features': 0.7716541703461075, 'subsample': 0.017832882362718683, 'dropout_rate': 0.704320524175165, 'ccp_alpha': 0.2447965217428775}. Best is trial 770 with value: 0.7845773442016363.[0m
[32m[I 2022-04-14 22:19:16,121][0m Trial 795 finished with value: 0.7795452746579381 and parameters: {'loss': 'coxph', 'learning_rate': 1.1185780044242388e-06, 'n_estimators': 646, 'criterion': 'friedman_mse', 'min_samples_split': 10, 'min_samples_leaf': 1, 'min_weight_fraction_leaf': 0.24237883769829838, 'min_impurity_decrease': 0.4167573446896907, 'max_features': 0.7624818774866181, 'subsample': 0.03517677455960321, 'dropout_rate': 0.7262653009815683, 'ccp_alpha': 0.16702878543994398}. Best is trial 770 with value: 0.7845773442016363.[0m
[32m[I 2022-04-14 22:21:08,089][0m Trial 796 finished with value: 0.7821906796281053 and parameters: {'loss': 'coxph', 'learning_rate': 1.677031770581549e-06, 'n_estimators': 682, 'criterion': 'friedman_mse', 'min_samples_split': 10, 'min_samples_leaf': 1, 'min_weight_fraction_leaf': 0.26107824306504324, 'min_impurity_decrease': 0.39857676303462036, 'max_features': 0.7879899347793923, 'subsample': 0.036180741060215404, 'dropout_rate': 0.6858372334876836, 'ccp_alpha': 0.0022785630379452276}. Best is trial 770 with value: 0.7845773442016363.[0m
[32m[I 2022-04-14 22:22:41,552][0m Trial 797 finished with value: 0.7734922453167112 and parameters: {'loss': 'coxph', 'learning_rate': 1.4335732976590877e-06, 'n_estimators': 626, 'criterion': 'friedman_mse', 'min_samples_split': 10, 'min_samples_leaf': 1, 'min_weight_fraction_leaf': 0.2684573592972568, 'min_impurity_decrease': 0.4324218360770213, 'max_features': 0.7693446672441708, 'subsample': 0.022025657408690228, 'dropout_rate': 0.7084028783595681, 'ccp_alpha': 0.3453790771131937}. Best is trial 770 with value: 0.7845773442016363.[0m
[32m[I 2022-04-14 22:23:32,123][0m Trial 798 finished with value: -0.3824689409024152 and parameters: {'loss': 'squared', 'learning_rate': 1.6058811295092193e-06, 'n_estimators': 682, 'criterion': 'friedman_mse', 'min_samples_split': 10, 'min_samples_leaf': 1, 'min_weight_fraction_leaf': 0.2547712295581229, 'min_impurity_decrease': 0.4031328946938544, 'max_features': 0.7502239821112752, 'subsample': 0.04014976076359668, 'dropout_rate': 0.7306141037625253, 'ccp_alpha': 0.001849938247468554}. Best is trial 770 with value: 0.7845773442016363.[0m
[32m[I 2022-04-14 22:25:13,487][0m Trial 799 finished with value: 0.7565104904864193 and parameters: {'loss': 'coxph', 'learning_rate': 1.4696731823007958e-06, 'n_estimators': 657, 'criterion': 'friedman_mse', 'min_samples_split': 10, 'min_samples_leaf': 1, 'min_weight_fraction_leaf': 0.24762052600720696, 'min_impurity_decrease': 0.3960868699977658, 'max_features': 0.7812284099457447, 'subsample': 0.017393095739818572, 'dropout_rate': 0.6908099091063279, 'ccp_alpha': 0.5072951176507519}. Best is trial 770 with value: 0.7845773442016363.[0m
[32m[I 2022-04-14 22:27:00,711][0m Trial 800 finished with value: 0.25 and parameters: {'loss': 'coxph', 'learning_rate': 1.3241747243834804e-06, 'n_estimators': 694, 'criterion': 'friedman_mse', 'min_samples_split': 10, 'min_samples_leaf': 1, 'min_weight_fraction_leaf': 0.2597993977203539, 'min_impurity_decrease': 0.4516424278028327, 'max_features': 0.7933974828527357, 'subsample': 0.0012833808800652609, 'dropout_rate': 0.7016083704636102, 'ccp_alpha': 0.14776511797905956}. Best is trial 770 with value: 0.7845773442016363.[0m
[32m[I 2022-04-14 22:28:37,353][0m Trial 801 finished with value: 0.45 and parameters: {'loss': 'coxph', 'learning_rate': 1.8016088580083388e-06, 'n_estimators': 647, 'criterion': 'squared_error', 'min_samples_split': 10, 'min_samples_leaf': 1, 'min_weight_fraction_leaf': 0.26357586755915313, 'min_impurity_decrease': 0.46351343573162124, 'max_features': 0.7105793480922716, 'subsample': 0.04088956097604452, 'dropout_rate': 0.6792517811032031, 'ccp_alpha': 0.23415487360742135}. Best is trial 770 with value: 0.7845773442016363.[0m
[32m[I 2022-04-14 22:30:21,840][0m Trial 802 finished with value: 0.780890639098302 and parameters: {'loss': 'coxph', 'learning_rate': 1.8494101812818087e-06, 'n_estimators': 688, 'criterion': 'friedman_mse', 'min_samples_split': 10, 'min_samples_leaf': 1, 'min_weight_fraction_leaf': 0.2832317152707765, 'min_impurity_decrease': 0.42588941902838034, 'max_features': 0.7306164519374527, 'subsample': 0.046975779754632976, 'dropout_rate': 0.7516640830730211, 'ccp_alpha': 0.09221428149368584}. Best is trial 770 with value: 0.7845773442016363.[0m
[32m[I 2022-04-14 22:32:21,976][0m Trial 803 finished with value: 0.7823460644541603 and parameters: {'loss': 'coxph', 'learning_rate': 2.00016194996253e-06, 'n_estimators': 714, 'criterion': 'friedman_mse', 'min_samples_split': 10, 'min_samples_leaf': 1, 'min_weight_fraction_leaf': 0.2723856652437463, 'min_impurity_decrease': 0.4030389615538841, 'max_features': 0.7620336739649513, 'subsample': 0.020508458137273314, 'dropout_rate': 0.6741769776020003, 'ccp_alpha': 0.09278241877803683}. Best is trial 770 with value: 0.7845773442016363.[0m
[32m[I 2022-04-14 22:33:59,062][0m Trial 804 finished with value: 0.7668754618296327 and parameters: {'loss': 'coxph', 'learning_rate': 1.1279561203876574e-06, 'n_estimators': 662, 'criterion': 'friedman_mse', 'min_samples_split': 10, 'min_samples_leaf': 1, 'min_weight_fraction_leaf': 0.2747260121768449, 'min_impurity_decrease': 0.41059874705827804, 'max_features': 0.7420192136941681, 'subsample': 0.01676971256031606, 'dropout_rate': 0.7204824646296617, 'ccp_alpha': 0.43566279401275576}. Best is trial 770 with value: 0.7845773442016363.[0m
[32m[I 2022-04-14 22:35:53,454][0m Trial 805 finished with value: 0.25 and parameters: {'loss': 'coxph', 'learning_rate': 2.6493930881689178e-06, 'n_estimators': 709, 'criterion': 'friedman_mse', 'min_samples_split': 10, 'min_samples_leaf': 1, 'min_weight_fraction_leaf': 0.2558742079445584, 'min_impurity_decrease': 0.4322820149310898, 'max_features': 0.7564953624016739, 'subsample': 0.0020377453984675303, 'dropout_rate': 0.690379816877125, 'ccp_alpha': 0.32728759333050794}. Best is trial 770 with value: 0.7845773442016363.[0m
[32m[I 2022-04-14 22:37:30,209][0m Trial 806 finished with value: 0.25 and parameters: {'loss': 'coxph', 'learning_rate': 1.411709862927874e-06, 'n_estimators': 601, 'criterion': 'friedman_mse', 'min_samples_split': 10, 'min_samples_leaf': 1, 'min_weight_fraction_leaf': 0.27076774710977336, 'min_impurity_decrease': 0.39435104500426726, 'max_features': 0.7776135030345757, 'subsample': 0.0011335635783293503, 'dropout_rate': 0.6734038856565655, 'ccp_alpha': 0.26385484424737843}. Best is trial 770 with value: 0.7845773442016363.[0m
[32m[I 2022-04-14 22:39:18,536][0m Trial 807 finished with value: 0.7793126044640474 and parameters: {'loss': 'coxph', 'learning_rate': 1.8913803109125488e-06, 'n_estimators': 683, 'criterion': 'friedman_mse', 'min_samples_split': 10, 'min_samples_leaf': 1, 'min_weight_fraction_leaf': 0.2378475735890302, 'min_impurity_decrease': 0.40982434565681497, 'max_features': 0.7392671511113643, 'subsample': 0.022194003251992455, 'dropout_rate': 0.6733427578676806, 'ccp_alpha': 0.15668121380707736}. Best is trial 770 with value: 0.7845773442016363.[0m
[32m[I 2022-04-14 22:41:04,761][0m Trial 808 finished with value: 0.7787013324349371 and parameters: {'loss': 'coxph', 'learning_rate': 1.898688980656367e-06, 'n_estimators': 709, 'criterion': 'friedman_mse', 'min_samples_split': 10, 'min_samples_leaf': 1, 'min_weight_fraction_leaf': 0.26462404272935885, 'min_impurity_decrease': 0.4783836676512978, 'max_features': 0.7719205214725341, 'subsample': 0.029440447273583744, 'dropout_rate': 0.7068527761460043, 'ccp_alpha': 0.19303576108078155}. Best is trial 770 with value: 0.7845773442016363.[0m
[32m[I 2022-04-14 22:42:40,088][0m Trial 809 finished with value: 0.780919347642786 and parameters: {'loss': 'coxph', 'learning_rate': 1.0034266228845915e-06, 'n_estimators': 643, 'criterion': 'friedman_mse', 'min_samples_split': 10, 'min_samples_leaf': 1, 'min_weight_fraction_leaf': 0.279416898197962, 'min_impurity_decrease': 0.3903175559567257, 'max_features': 0.7901307212876092, 'subsample': 0.03419452963183269, 'dropout_rate': 0.6925333034935273, 'ccp_alpha': 0.08425227236257055}. Best is trial 770 with value: 0.7845773442016363.[0m
