[32m[I 2022-04-15 04:08:45,109][0m Trial 215 finished with value: 0.5 and parameters: {'loss': 'coxph', 'learning_rate': 0.06281173650779005, 'n_estimators': 163, 'criterion': 'friedman_mse', 'min_samples_split': 2, 'min_samples_leaf': 6, 'min_weight_fraction_leaf': 0.3164972571695716, 'min_impurity_decrease': 0.7077850472425584, 'max_features': 0.6071672198061302, 'subsample': 0.5023777671798626, 'dropout_rate': 0.10216764467282052, 'ccp_alpha': 0.2273019822125795}. Best is trial 159 with value: 0.7654372273354745.[0m
[32m[I 2022-04-15 04:09:03,423][0m Trial 216 finished with value: 0.7583648017946295 and parameters: {'loss': 'coxph', 'learning_rate': 0.04541242083617407, 'n_estimators': 181, 'criterion': 'friedman_mse', 'min_samples_split': 2, 'min_samples_leaf': 5, 'min_weight_fraction_leaf': 0.36290185730630853, 'min_impurity_decrease': 0.7447992184296875, 'max_features': 0.5913150748753511, 'subsample': 0.5388747544505789, 'dropout_rate': 0.09489472476880535, 'ccp_alpha': 0.0016281405909044262}. Best is trial 159 with value: 0.7654372273354745.[0m
[32m[I 2022-04-15 04:09:20,015][0m Trial 217 finished with value: 0.6743624146605087 and parameters: {'loss': 'coxph', 'learning_rate': 0.04408816174528806, 'n_estimators': 168, 'criterion': 'friedman_mse', 'min_samples_split': 2, 'min_samples_leaf': 6, 'min_weight_fraction_leaf': 0.32406307758053854, 'min_impurity_decrease': 0.7337167482568413, 'max_features': 0.5965415004509428, 'subsample': 0.46823157288564615, 'dropout_rate': 0.06726834549371086, 'ccp_alpha': 0.11851352218257367}. Best is trial 159 with value: 0.7654372273354745.[0m
[32m[I 2022-04-15 04:09:35,300][0m Trial 218 finished with value: 0.7643470494435166 and parameters: {'loss': 'coxph', 'learning_rate': 0.04924065233766319, 'n_estimators': 159, 'criterion': 'friedman_mse', 'min_samples_split': 2, 'min_samples_leaf': 6, 'min_weight_fraction_leaf': 0.302324745990193, 'min_impurity_decrease': 0.7474415954486983, 'max_features': 0.6396658266655585, 'subsample': 0.536201107713831, 'dropout_rate': 0.09845591366302404, 'ccp_alpha': 0.004266136599954158}. Best is trial 159 with value: 0.7654372273354745.[0m
[32m[I 2022-04-15 04:09:49,216][0m Trial 219 finished with value: 0.5636982531485787 and parameters: {'loss': 'coxph', 'learning_rate': 0.04504659320126347, 'n_estimators': 156, 'criterion': 'friedman_mse', 'min_samples_split': 3, 'min_samples_leaf': 6, 'min_weight_fraction_leaf': 0.30708547873259895, 'min_impurity_decrease': 0.7476190301228587, 'max_features': 0.6359261884665717, 'subsample': 0.573913723930266, 'dropout_rate': 0.12936417689541488, 'ccp_alpha': 0.19898508037960422}. Best is trial 159 with value: 0.7654372273354745.[0m
[32m[I 2022-04-15 04:10:05,880][0m Trial 220 finished with value: 0.5 and parameters: {'loss': 'coxph', 'learning_rate': 0.05115184960949188, 'n_estimators': 183, 'criterion': 'friedman_mse', 'min_samples_split': 2, 'min_samples_leaf': 6, 'min_weight_fraction_leaf': 0.31262129116318926, 'min_impurity_decrease': 0.7169567230032496, 'max_features': 0.6521749502835366, 'subsample': 0.5354864163261204, 'dropout_rate': 0.15927012179183436, 'ccp_alpha': 0.29070509828200386}. Best is trial 159 with value: 0.7654372273354745.[0m
[32m[I 2022-04-15 04:10:20,898][0m Trial 221 finished with value: 0.6840234635062397 and parameters: {'loss': 'coxph', 'learning_rate': 0.059984194361923086, 'n_estimators': 159, 'criterion': 'friedman_mse', 'min_samples_split': 2, 'min_samples_leaf': 5, 'min_weight_fraction_leaf': 0.36742275573375643, 'min_impurity_decrease': 0.7696833826492777, 'max_features': 0.6099614860325953, 'subsample': 0.5022707618166584, 'dropout_rate': 0.09847338272893569, 'ccp_alpha': 0.09619249916636965}. Best is trial 159 with value: 0.7654372273354745.[0m
[32m[I 2022-04-15 04:10:37,417][0m Trial 222 finished with value: 0.7620345796751933 and parameters: {'loss': 'coxph', 'learning_rate': 0.04152475430392416, 'n_estimators': 169, 'criterion': 'friedman_mse', 'min_samples_split': 2, 'min_samples_leaf': 6, 'min_weight_fraction_leaf': 0.2955553334443454, 'min_impurity_decrease': 0.7496923356597339, 'max_features': 0.5639200137973587, 'subsample': 0.5292528865601097, 'dropout_rate': 0.0749105233056767, 'ccp_alpha': 0.008924899635115538}. Best is trial 159 with value: 0.7654372273354745.[0m
[32m[I 2022-04-15 04:10:54,294][0m Trial 223 finished with value: 0.7583996804381978 and parameters: {'loss': 'coxph', 'learning_rate': 0.039101485977574214, 'n_estimators': 174, 'criterion': 'friedman_mse', 'min_samples_split': 2, 'min_samples_leaf': 6, 'min_weight_fraction_leaf': 0.3433472094038686, 'min_impurity_decrease': 0.7433112959829876, 'max_features': 0.5590398452876953, 'subsample': 0.5305231770216509, 'dropout_rate': 0.05423081980485454, 'ccp_alpha': 0.0029337747624302406}. Best is trial 159 with value: 0.7654372273354745.[0m
[32m[I 2022-04-15 04:11:08,169][0m Trial 224 finished with value: 0.7622254212196544 and parameters: {'loss': 'coxph', 'learning_rate': 0.039529801693315055, 'n_estimators': 148, 'criterion': 'friedman_mse', 'min_samples_split': 2, 'min_samples_leaf': 6, 'min_weight_fraction_leaf': 0.2963559221396464, 'min_impurity_decrease': 0.9304838587057394, 'max_features': 0.570812269495516, 'subsample': 0.5289026164390029, 'dropout_rate': 0.051272678220600616, 'ccp_alpha': 0.002121913890688941}. Best is trial 159 with value: 0.7654372273354745.[0m
[32m[I 2022-04-15 04:11:24,351][0m Trial 225 finished with value: 0.6743624146605087 and parameters: {'loss': 'coxph', 'learning_rate': 0.035650705362102075, 'n_estimators': 171, 'criterion': 'friedman_mse', 'min_samples_split': 2, 'min_samples_leaf': 6, 'min_weight_fraction_leaf': 0.2691339913565446, 'min_impurity_decrease': 0.9358345748360892, 'max_features': 0.5683185895220145, 'subsample': 0.5316008621742766, 'dropout_rate': 0.04837432655557745, 'ccp_alpha': 0.1256413051586155}. Best is trial 159 with value: 0.7654372273354745.[0m
[32m[I 2022-04-15 04:11:38,035][0m Trial 226 finished with value: 0.6743624146605087 and parameters: {'loss': 'coxph', 'learning_rate': 0.045776283139526676, 'n_estimators': 149, 'criterion': 'friedman_mse', 'min_samples_split': 2, 'min_samples_leaf': 6, 'min_weight_fraction_leaf': 0.29582038566838215, 'min_impurity_decrease': 0.7362930014977601, 'max_features': 0.587732229414107, 'subsample': 0.5642852299881809, 'dropout_rate': 0.03469055884054219, 'ccp_alpha': 0.16991389139627452}. Best is trial 159 with value: 0.7654372273354745.[0m
[32m[I 2022-04-15 04:11:56,934][0m Trial 227 finished with value: 0.7620762678684252 and parameters: {'loss': 'coxph', 'learning_rate': 0.07858313388538672, 'n_estimators': 179, 'criterion': 'friedman_mse', 'min_samples_split': 2, 'min_samples_leaf': 6, 'min_weight_fraction_leaf': 0.28669612762613866, 'min_impurity_decrease': 0.9184451586768901, 'max_features': 0.6329917244757189, 'subsample': 0.5275244971098739, 'dropout_rate': 0.05404983565414465, 'ccp_alpha': 0.0035466936739852297}. Best is trial 159 with value: 0.7654372273354745.[0m
[32m[I 2022-04-15 04:12:15,510][0m Trial 228 finished with value: 0.6743624146605087 and parameters: {'loss': 'coxph', 'learning_rate': 0.09840860139207083, 'n_estimators': 186, 'criterion': 'friedman_mse', 'min_samples_split': 2, 'min_samples_leaf': 6, 'min_weight_fraction_leaf': 0.27816233527365625, 'min_impurity_decrease': 0.9601388561440192, 'max_features': 0.634028904681321, 'subsample': 0.5583569181690189, 'dropout_rate': 0.05249410531601956, 'ccp_alpha': 0.10730797372827798}. Best is trial 159 with value: 0.7654372273354745.[0m
[32m[I 2022-04-15 04:12:33,921][0m Trial 229 finished with value: 0.5636982531485787 and parameters: {'loss': 'coxph', 'learning_rate': 0.05152770449582518, 'n_estimators': 180, 'criterion': 'friedman_mse', 'min_samples_split': 2, 'min_samples_leaf': 6, 'min_weight_fraction_leaf': 0.28964702956767774, 'min_impurity_decrease': 0.9208575898578337, 'max_features': 0.6751221176843407, 'subsample': 0.5190542578273506, 'dropout_rate': 0.02735053175014912, 'ccp_alpha': 0.20215832030757908}. Best is trial 159 with value: 0.7654372273354745.[0m
[32m[I 2022-04-15 04:12:51,547][0m Trial 230 finished with value: 0.7629229374436288 and parameters: {'loss': 'coxph', 'learning_rate': 0.08084091625806852, 'n_estimators': 172, 'criterion': 'friedman_mse', 'min_samples_split': 2, 'min_samples_leaf': 6, 'min_weight_fraction_leaf': 0.3005207680804534, 'min_impurity_decrease': 0.7935197557324746, 'max_features': 0.6611969189726856, 'subsample': 0.5387327194288888, 'dropout_rate': 0.06788190739353388, 'ccp_alpha': 0.0037414202449408927}. Best is trial 159 with value: 0.7654372273354745.[0m
[32m[I 2022-04-15 04:13:09,321][0m Trial 231 finished with value: 0.7633786316357852 and parameters: {'loss': 'coxph', 'learning_rate': 0.08049510215549933, 'n_estimators': 173, 'criterion': 'friedman_mse', 'min_samples_split': 2, 'min_samples_leaf': 6, 'min_weight_fraction_leaf': 0.3021472248813347, 'min_impurity_decrease': 0.908780702817623, 'max_features': 0.6502446092510837, 'subsample': 0.542103810614149, 'dropout_rate': 0.06815542111134457, 'ccp_alpha': 0.001472684854904413}. Best is trial 159 with value: 0.7654372273354745.[0m
[32m[I 2022-04-15 04:13:29,440][0m Trial 232 finished with value: 0.6743624146605087 and parameters: {'loss': 'coxph', 'learning_rate': 0.07767585176835183, 'n_estimators': 196, 'criterion': 'friedman_mse', 'min_samples_split': 2, 'min_samples_leaf': 6, 'min_weight_fraction_leaf': 0.2989538270418674, 'min_impurity_decrease': 0.9047146820017494, 'max_features': 0.6556864507667483, 'subsample': 0.5839160506120976, 'dropout_rate': 0.06452934777989747, 'ccp_alpha': 0.11670715804804876}. Best is trial 159 with value: 0.7654372273354745.[0m
[32m[I 2022-04-15 04:13:48,592][0m Trial 233 finished with value: 0.7617047371302286 and parameters: {'loss': 'coxph', 'learning_rate': 0.08255045652235013, 'n_estimators': 176, 'criterion': 'friedman_mse', 'min_samples_split': 2, 'min_samples_leaf': 6, 'min_weight_fraction_leaf': 0.27883943014367996, 'min_impurity_decrease': 0.984687165778751, 'max_features': 0.6847973375054838, 'subsample': 0.5532436690462091, 'dropout_rate': 0.06962902834469219, 'ccp_alpha': 0.001143736637971405}. Best is trial 159 with value: 0.7654372273354745.[0m
[32m[I 2022-04-15 04:14:06,811][0m Trial 234 finished with value: 0.6743624146605087 and parameters: {'loss': 'coxph', 'learning_rate': 0.08077851127584759, 'n_estimators': 176, 'criterion': 'friedman_mse', 'min_samples_split': 2, 'min_samples_leaf': 6, 'min_weight_fraction_leaf': 0.27867914259023474, 'min_impurity_decrease': 0.9618719558907125, 'max_features': 0.6940176209006814, 'subsample': 0.5513216352090494, 'dropout_rate': 0.07785984444226328, 'ccp_alpha': 0.1067633749040736}. Best is trial 159 with value: 0.7654372273354745.[0m
[32m[I 2022-04-15 04:14:24,240][0m Trial 235 finished with value: 0.6743624146605087 and parameters: {'loss': 'coxph', 'learning_rate': 0.08100098459837822, 'n_estimators': 175, 'criterion': 'friedman_mse', 'min_samples_split': 2, 'min_samples_leaf': 6, 'min_weight_fraction_leaf': 0.3004945270085697, 'min_impurity_decrease': 0.9862729540789953, 'max_features': 0.6792001677043553, 'subsample': 0.535628375736463, 'dropout_rate': 0.1189113003949981, 'ccp_alpha': 0.10351934845103074}. Best is trial 159 with value: 0.7654372273354745.[0m
[32m[I 2022-04-15 04:14:41,509][0m Trial 236 finished with value: 0.5 and parameters: {'loss': 'coxph', 'learning_rate': 0.09504526435691665, 'n_estimators': 169, 'criterion': 'friedman_mse', 'min_samples_split': 2, 'min_samples_leaf': 6, 'min_weight_fraction_leaf': 0.28436106952232976, 'min_impurity_decrease': 0.9754973001278711, 'max_features': 0.6595151815693309, 'subsample': 0.6078822601865003, 'dropout_rate': 0.060969623839119684, 'ccp_alpha': 0.2923035216391344}. Best is trial 159 with value: 0.7654372273354745.[0m
[32m[I 2022-04-15 04:15:02,535][0m Trial 237 finished with value: 0.7612155497466173 and parameters: {'loss': 'coxph', 'learning_rate': 0.0655245524258091, 'n_estimators': 193, 'criterion': 'friedman_mse', 'min_samples_split': 2, 'min_samples_leaf': 6, 'min_weight_fraction_leaf': 0.3035552398354977, 'min_impurity_decrease': 0.9277851223544488, 'max_features': 0.71114670912943, 'subsample': 0.5594095814746208, 'dropout_rate': 0.07913926772628946, 'ccp_alpha': 0.001428563337696948}. Best is trial 159 with value: 0.7654372273354745.[0m
[32m[I 2022-04-15 04:15:22,240][0m Trial 238 finished with value: 0.6743624146605087 and parameters: {'loss': 'coxph', 'learning_rate': 0.06814759000360542, 'n_estimators': 195, 'criterion': 'friedman_mse', 'min_samples_split': 2, 'min_samples_leaf': 6, 'min_weight_fraction_leaf': 0.304907675034788, 'min_impurity_decrease': 0.9254873023776558, 'max_features': 0.7083466847886143, 'subsample': 0.591438053352891, 'dropout_rate': 0.08100779310031114, 'ccp_alpha': 0.19421762449157912}. Best is trial 159 with value: 0.7654372273354745.[0m
[32m[I 2022-04-15 04:15:40,208][0m Trial 239 finished with value: 0.6743624146605087 and parameters: {'loss': 'coxph', 'learning_rate': 0.09725132931186606, 'n_estimators': 189, 'criterion': 'friedman_mse', 'min_samples_split': 2, 'min_samples_leaf': 6, 'min_weight_fraction_leaf': 0.29313246637603546, 'min_impurity_decrease': 0.8909061512881847, 'max_features': 0.7508237854498165, 'subsample': 0.5570326534110733, 'dropout_rate': 0.10440036050615661, 'ccp_alpha': 0.09712638567072573}. Best is trial 159 with value: 0.7654372273354745.[0m
[32m[I 2022-04-15 04:15:57,095][0m Trial 240 finished with value: 0.7605564659609181 and parameters: {'loss': 'coxph', 'learning_rate': 0.0690586228412768, 'n_estimators': 176, 'criterion': 'friedman_mse', 'min_samples_split': 2, 'min_samples_leaf': 6, 'min_weight_fraction_leaf': 0.27385576381801147, 'min_impurity_decrease': 0.9132094518103455, 'max_features': 0.6953369848954116, 'subsample': 0.5745517984651204, 'dropout_rate': 0.079235683331022, 'ccp_alpha': 0.0064132237918884775}. Best is trial 159 with value: 0.7654372273354745.[0m
[32m[I 2022-04-15 04:16:16,106][0m Trial 241 finished with value: 0.7605293452749265 and parameters: {'loss': 'coxph', 'learning_rate': 0.06792490386066574, 'n_estimators': 179, 'criterion': 'friedman_mse', 'min_samples_split': 2, 'min_samples_leaf': 6, 'min_weight_fraction_leaf': 0.29251167419820084, 'min_impurity_decrease': 0.9394136372646074, 'max_features': 0.6910444264463013, 'subsample': 0.572147268522905, 'dropout_rate': 0.08002613843017682, 'ccp_alpha': 0.008394350672375255}. Best is trial 159 with value: 0.7654372273354745.[0m
[32m[I 2022-04-15 04:16:35,971][0m Trial 242 finished with value: 0.6743624146605087 and parameters: {'loss': 'coxph', 'learning_rate': 0.06578770746822113, 'n_estimators': 181, 'criterion': 'friedman_mse', 'min_samples_split': 2, 'min_samples_leaf': 6, 'min_weight_fraction_leaf': 0.26668122738179634, 'min_impurity_decrease': 0.9474888997930838, 'max_features': 0.7263431511794275, 'subsample': 0.5761174700924502, 'dropout_rate': 0.05337952355980058, 'ccp_alpha': 0.10084453327606453}. Best is trial 159 with value: 0.7654372273354745.[0m
[32m[I 2022-04-15 04:16:59,924][0m Trial 243 finished with value: 0.7614703759765418 and parameters: {'loss': 'coxph', 'learning_rate': 0.052836154407543225, 'n_estimators': 209, 'criterion': 'friedman_mse', 'min_samples_split': 2, 'min_samples_leaf': 6, 'min_weight_fraction_leaf': 0.28532059221869577, 'min_impurity_decrease': 0.9158361587112932, 'max_features': 0.6982459490354262, 'subsample': 0.5454963160138939, 'dropout_rate': 0.08196287979036106, 'ccp_alpha': 0.0025467844361955864}. Best is trial 159 with value: 0.7654372273354745.[0m
[32m[I 2022-04-15 04:17:21,612][0m Trial 244 finished with value: 0.6743624146605087 and parameters: {'loss': 'coxph', 'learning_rate': 0.05132411959527239, 'n_estimators': 200, 'criterion': 'friedman_mse', 'min_samples_split': 2, 'min_samples_leaf': 6, 'min_weight_fraction_leaf': 0.2862980672697615, 'min_impurity_decrease': 0.918948350390727, 'max_features': 0.7014927283643575, 'subsample': 0.5437622115210983, 'dropout_rate': 0.10337058296585218, 'ccp_alpha': 0.18852224825503022}. Best is trial 159 with value: 0.7654372273354745.[0m
[32m[I 2022-04-15 04:17:46,205][0m Trial 245 finished with value: 0.7607129184137822 and parameters: {'loss': 'coxph', 'learning_rate': 0.04471111536165639, 'n_estimators': 217, 'criterion': 'friedman_mse', 'min_samples_split': 2, 'min_samples_leaf': 6, 'min_weight_fraction_leaf': 0.2737457659796287, 'min_impurity_decrease': 0.9335735909854121, 'max_features': 0.6918914418394345, 'subsample': 0.5692789302295158, 'dropout_rate': 0.08858383053048322, 'ccp_alpha': 0.005125724788583058}. Best is trial 159 with value: 0.7654372273354745.[0m
[32m[I 2022-04-15 04:18:08,218][0m Trial 246 finished with value: 0.7070433189357845 and parameters: {'loss': 'coxph', 'learning_rate': 0.04078105982792324, 'n_estimators': 211, 'criterion': 'friedman_mse', 'min_samples_split': 2, 'min_samples_leaf': 6, 'min_weight_fraction_leaf': 0.27161122272952015, 'min_impurity_decrease': 0.934674871397516, 'max_features': 0.7023735967370425, 'subsample': 0.5647997122284136, 'dropout_rate': 0.12007324607537964, 'ccp_alpha': 0.09218428624431937}. Best is trial 159 with value: 0.7654372273354745.[0m
[32m[I 2022-04-15 04:18:31,416][0m Trial 247 finished with value: 0.6743624146605087 and parameters: {'loss': 'coxph', 'learning_rate': 0.06299387913492349, 'n_estimators': 227, 'criterion': 'friedman_mse', 'min_samples_split': 2, 'min_samples_leaf': 6, 'min_weight_fraction_leaf': 0.2479270487454527, 'min_impurity_decrease': 0.9752341316104652, 'max_features': 0.7152843069049701, 'subsample': 0.6058779258200463, 'dropout_rate': 0.08661127079205377, 'ccp_alpha': 0.18850056976067023}. Best is trial 159 with value: 0.7654372273354745.[0m
[32m[I 2022-04-15 04:18:50,000][0m Trial 248 finished with value: 0.6743624146605087 and parameters: {'loss': 'coxph', 'learning_rate': 0.04672607847024206, 'n_estimators': 188, 'criterion': 'friedman_mse', 'min_samples_split': 2, 'min_samples_leaf': 6, 'min_weight_fraction_leaf': 0.25814680785394795, 'min_impurity_decrease': 0.9190401154045938, 'max_features': 0.6889376946694693, 'subsample': 0.5422035186243004, 'dropout_rate': 0.0822092334075963, 'ccp_alpha': 0.12209022733023016}. Best is trial 159 with value: 0.7654372273354745.[0m
[32m[I 2022-04-15 04:19:06,852][0m Trial 249 finished with value: 0.761675974828012 and parameters: {'loss': 'coxph', 'learning_rate': 0.06203349326001363, 'n_estimators': 175, 'criterion': 'friedman_mse', 'min_samples_split': 2, 'min_samples_leaf': 6, 'min_weight_fraction_leaf': 0.2779955191588861, 'min_impurity_decrease': 0.9020650446224956, 'max_features': 0.7667420760460438, 'subsample': 0.6205429909921252, 'dropout_rate': 0.1379293157476359, 'ccp_alpha': 0.0019266288064342088}. Best is trial 159 with value: 0.7654372273354745.[0m
[32m[I 2022-04-15 04:19:23,523][0m Trial 250 finished with value: 0.5 and parameters: {'loss': 'coxph', 'learning_rate': 0.06345964258876244, 'n_estimators': 174, 'criterion': 'friedman_mse', 'min_samples_split': 2, 'min_samples_leaf': 6, 'min_weight_fraction_leaf': 0.27743164944122756, 'min_impurity_decrease': 0.8985836467175758, 'max_features': 0.6429256813324894, 'subsample': 0.5880671764899434, 'dropout_rate': 0.133063069383641, 'ccp_alpha': 0.2745447837640258}. Best is trial 159 with value: 0.7654372273354745.[0m
[32m[I 2022-04-15 04:19:48,157][0m Trial 251 finished with value: 0.7620754518929291 and parameters: {'loss': 'coxph', 'learning_rate': 0.06981831758858453, 'n_estimators': 210, 'criterion': 'friedman_mse', 'min_samples_split': 2, 'min_samples_leaf': 6, 'min_weight_fraction_leaf': 0.2876489794410083, 'min_impurity_decrease': 0.8779983943277374, 'max_features': 0.7327830466801146, 'subsample': 0.6342928720606199, 'dropout_rate': 0.06870566168454613, 'ccp_alpha': 0.007197004715403002}. Best is trial 159 with value: 0.7654372273354745.[0m
[32m[I 2022-04-15 04:20:11,096][0m Trial 252 finished with value: 0.6743624146605087 and parameters: {'loss': 'coxph', 'learning_rate': 0.07606796917586789, 'n_estimators': 219, 'criterion': 'friedman_mse', 'min_samples_split': 2, 'min_samples_leaf': 6, 'min_weight_fraction_leaf': 0.2876418853216047, 'min_impurity_decrease': 0.8787495340980676, 'max_features': 0.7462419875087167, 'subsample': 0.6629395596041171, 'dropout_rate': 0.1074866989849954, 'ccp_alpha': 0.10752517032263591}. Best is trial 159 with value: 0.7654372273354745.[0m
[32m[I 2022-04-15 04:20:32,656][0m Trial 253 finished with value: 0.6743624146605087 and parameters: {'loss': 'coxph', 'learning_rate': 0.05887599863356442, 'n_estimators': 209, 'criterion': 'friedman_mse', 'min_samples_split': 2, 'min_samples_leaf': 6, 'min_weight_fraction_leaf': 0.2927427184422936, 'min_impurity_decrease': 0.9412444130122805, 'max_features': 0.7959014560418631, 'subsample': 0.6266452697191205, 'dropout_rate': 0.07959044597886042, 'ccp_alpha': 0.17810001059613617}. Best is trial 159 with value: 0.7654372273354745.[0m
[32m[I 2022-04-15 04:20:53,493][0m Trial 254 finished with value: 0.7637656903124158 and parameters: {'loss': 'coxph', 'learning_rate': 0.0995165690281904, 'n_estimators': 197, 'criterion': 'friedman_mse', 'min_samples_split': 2, 'min_samples_leaf': 6, 'min_weight_fraction_leaf': 0.3025974031692089, 'min_impurity_decrease': 0.9046908268758131, 'max_features': 0.7867842043737125, 'subsample': 0.5618730719753275, 'dropout_rate': 0.07302621514193314, 'ccp_alpha': 0.003953571310459555}. Best is trial 159 with value: 0.7654372273354745.[0m
