[32m[I 2022-04-15 06:34:58,787][0m Trial 535 finished with value: 0.7716654115465564 and parameters: {'loss': 'coxph', 'learning_rate': 0.005623103588339781, 'n_estimators': 388, 'criterion': 'friedman_mse', 'min_samples_split': 4, 'min_samples_leaf': 1, 'min_weight_fraction_leaf': 0.11961171027134007, 'min_impurity_decrease': 0.5113257129698937, 'max_features': 0.8223798571737067, 'subsample': 0.6800400732184672, 'dropout_rate': 0.45585604529409496, 'ccp_alpha': 0.0012247003060114707}. Best is trial 532 with value: 0.7730183877040865.[0m
[32m[I 2022-04-15 06:35:28,966][0m Trial 536 finished with value: 0.5 and parameters: {'loss': 'squared', 'learning_rate': 0.005008533019701779, 'n_estimators': 337, 'criterion': 'absolute_error', 'min_samples_split': 4, 'min_samples_leaf': 1, 'min_weight_fraction_leaf': 0.11563074436317153, 'min_impurity_decrease': 0.5149885029378818, 'max_features': 0.8053561880279989, 'subsample': 0.7319964043479567, 'dropout_rate': 0.5267731791470505, 'ccp_alpha': 0.6969181705813406}. Best is trial 532 with value: 0.7730183877040865.[0m
[32m[I 2022-04-15 06:36:13,702][0m Trial 537 finished with value: 0.7320009036524204 and parameters: {'loss': 'coxph', 'learning_rate': 0.003856155709594985, 'n_estimators': 377, 'criterion': 'friedman_mse', 'min_samples_split': 5, 'min_samples_leaf': 1, 'min_weight_fraction_leaf': 0.10147988223506374, 'min_impurity_decrease': 0.4852120313359225, 'max_features': 0.8293139070324527, 'subsample': 0.6874750836366207, 'dropout_rate': 0.4577584430647094, 'ccp_alpha': 0.0962853497314798}. Best is trial 532 with value: 0.7730183877040865.[0m
[32m[I 2022-04-15 06:37:02,611][0m Trial 538 finished with value: 0.5301157883717103 and parameters: {'loss': 'coxph', 'learning_rate': 0.0059323363812742195, 'n_estimators': 393, 'criterion': 'friedman_mse', 'min_samples_split': 4, 'min_samples_leaf': 1, 'min_weight_fraction_leaf': 0.12521990589461351, 'min_impurity_decrease': 0.5290300331919989, 'max_features': 0.8191846469337152, 'subsample': 0.6886561240229161, 'dropout_rate': 0.374066972782373, 'ccp_alpha': 0.21987609048650464}. Best is trial 532 with value: 0.7730183877040865.[0m
[32m[I 2022-04-15 06:37:39,160][0m Trial 539 finished with value: 0.7285353032626953 and parameters: {'loss': 'coxph', 'learning_rate': 0.0005884291690784687, 'n_estimators': 380, 'criterion': 'friedman_mse', 'min_samples_split': 4, 'min_samples_leaf': 1, 'min_weight_fraction_leaf': 0.11188611950385846, 'min_impurity_decrease': 0.5084801705682407, 'max_features': 0.8602208852859212, 'subsample': 0.6800354469394468, 'dropout_rate': 0.6160028824183761, 'ccp_alpha': 0.09532507156471773}. Best is trial 532 with value: 0.7730183877040865.[0m
[32m[I 2022-04-15 06:38:26,648][0m Trial 540 finished with value: 0.6743624146605087 and parameters: {'loss': 'coxph', 'learning_rate': 0.002785381505420384, 'n_estimators': 401, 'criterion': 'friedman_mse', 'min_samples_split': 4, 'min_samples_leaf': 2, 'min_weight_fraction_leaf': 0.09248772747515469, 'min_impurity_decrease': 0.5505559625849419, 'max_features': 0.9411199507644918, 'subsample': 0.7031275475338303, 'dropout_rate': 0.4388940102852928, 'ccp_alpha': 0.17148368676216436}. Best is trial 532 with value: 0.7730183877040865.[0m
[32m[I 2022-04-15 06:39:06,601][0m Trial 541 finished with value: 0.7333153594949583 and parameters: {'loss': 'coxph', 'learning_rate': 0.004917300823682119, 'n_estimators': 353, 'criterion': 'friedman_mse', 'min_samples_split': 5, 'min_samples_leaf': 2, 'min_weight_fraction_leaf': 0.1307052012078339, 'min_impurity_decrease': 0.4966282472962635, 'max_features': 0.8261352233314178, 'subsample': 0.6607919810489898, 'dropout_rate': 0.4369030373477498, 'ccp_alpha': 0.08952541222841359}. Best is trial 532 with value: 0.7730183877040865.[0m
[32m[I 2022-04-15 06:39:56,516][0m Trial 542 finished with value: 0.5 and parameters: {'loss': 'coxph', 'learning_rate': 0.006422571884228567, 'n_estimators': 408, 'criterion': 'friedman_mse', 'min_samples_split': 4, 'min_samples_leaf': 1, 'min_weight_fraction_leaf': 0.11299371831161067, 'min_impurity_decrease': 0.573864935173874, 'max_features': 0.8558958029054168, 'subsample': 0.6713251756352658, 'dropout_rate': 0.4093516826278444, 'ccp_alpha': 0.3018351910245295}. Best is trial 532 with value: 0.7730183877040865.[0m
[32m[I 2022-04-15 06:40:51,883][0m Trial 543 finished with value: 0.7334080166134718 and parameters: {'loss': 'coxph', 'learning_rate': 0.007379632329898435, 'n_estimators': 431, 'criterion': 'friedman_mse', 'min_samples_split': 4, 'min_samples_leaf': 8, 'min_weight_fraction_leaf': 0.13460074944571548, 'min_impurity_decrease': 0.5192330400485656, 'max_features': 0.8129132290655372, 'subsample': 0.7583451315214941, 'dropout_rate': 0.4792097824318417, 'ccp_alpha': 0.09010453514064501}. Best is trial 532 with value: 0.7730183877040865.[0m
[32m[I 2022-04-15 06:41:34,145][0m Trial 544 finished with value: 0.5301157883717103 and parameters: {'loss': 'coxph', 'learning_rate': 9.6784788194698e-05, 'n_estimators': 369, 'criterion': 'friedman_mse', 'min_samples_split': 4, 'min_samples_leaf': 9, 'min_weight_fraction_leaf': 0.10711359087437902, 'min_impurity_decrease': 0.5453004207471258, 'max_features': 0.9068362917258244, 'subsample': 0.711089648617251, 'dropout_rate': 0.4741868617709634, 'ccp_alpha': 0.2157476502890734}. Best is trial 532 with value: 0.7730183877040865.[0m
[32m[I 2022-04-15 06:42:10,411][0m Trial 545 finished with value: 0.7368239320096157 and parameters: {'loss': 'coxph', 'learning_rate': 0.008458925272724434, 'n_estimators': 330, 'criterion': 'friedman_mse', 'min_samples_split': 5, 'min_samples_leaf': 1, 'min_weight_fraction_leaf': 0.09642438329020009, 'min_impurity_decrease': 0.5808677090478106, 'max_features': 0.8422338241712304, 'subsample': 0.6831092748844043, 'dropout_rate': 0.5133346599759306, 'ccp_alpha': 0.07686180474390569}. Best is trial 532 with value: 0.7730183877040865.[0m
[32m[I 2022-04-15 06:43:00,176][0m Trial 546 finished with value: 0.5 and parameters: {'loss': 'coxph', 'learning_rate': 4.117044013672032e-06, 'n_estimators': 415, 'criterion': 'squared_error', 'min_samples_split': 4, 'min_samples_leaf': 1, 'min_weight_fraction_leaf': 0.12489103042314496, 'min_impurity_decrease': 0.6219453021181872, 'max_features': 0.8677909907053347, 'subsample': 0.6576805424123299, 'dropout_rate': 0.4255130795946673, 'ccp_alpha': 0.0030253843923663828}. Best is trial 532 with value: 0.7730183877040865.[0m
[32m[I 2022-04-15 06:43:52,061][0m Trial 547 finished with value: 0.6743624146605087 and parameters: {'loss': 'coxph', 'learning_rate': 0.009385096693185319, 'n_estimators': 447, 'criterion': 'friedman_mse', 'min_samples_split': 4, 'min_samples_leaf': 1, 'min_weight_fraction_leaf': 0.12123355922718357, 'min_impurity_decrease': 0.5644219852560514, 'max_features': 0.7952430725681506, 'subsample': 0.6750468495082941, 'dropout_rate': 0.4915235074827029, 'ccp_alpha': 0.18289642287797037}. Best is trial 532 with value: 0.7730183877040865.[0m
[32m[I 2022-04-15 06:44:38,394][0m Trial 548 finished with value: 0.7282927859033373 and parameters: {'loss': 'coxph', 'learning_rate': 0.006269951718275226, 'n_estimators': 386, 'criterion': 'friedman_mse', 'min_samples_split': 4, 'min_samples_leaf': 9, 'min_weight_fraction_leaf': 0.20856266270638849, 'min_impurity_decrease': 0.5171810932483063, 'max_features': 0.9277054020204725, 'subsample': 0.7105777813512713, 'dropout_rate': 0.4512698632468493, 'ccp_alpha': 0.09034137432940842}. Best is trial 532 with value: 0.7730183877040865.[0m
[32m[I 2022-04-15 06:45:48,854][0m Trial 549 finished with value: 0.5 and parameters: {'loss': 'coxph', 'learning_rate': 0.010079470682569853, 'n_estimators': 424, 'criterion': 'friedman_mse', 'min_samples_split': 4, 'min_samples_leaf': 8, 'min_weight_fraction_leaf': 0.2132722320538792, 'min_impurity_decrease': 0.5431697654169232, 'max_features': 0.8859691793584205, 'subsample': 0.6934708561211628, 'dropout_rate': 0.08089464732678517, 'ccp_alpha': 0.2906514538242685}. Best is trial 532 with value: 0.7730183877040865.[0m
[32m[I 2022-04-15 06:46:18,037][0m Trial 550 finished with value: 0.6743624146605087 and parameters: {'loss': 'coxph', 'learning_rate': 0.0050483526864466685, 'n_estimators': 356, 'criterion': 'friedman_mse', 'min_samples_split': 4, 'min_samples_leaf': 1, 'min_weight_fraction_leaf': 0.14025306181208172, 'min_impurity_decrease': 0.4980095330869776, 'max_features': 0.8147371839876488, 'subsample': 0.7255307053013008, 'dropout_rate': 0.7566735261380331, 'ccp_alpha': 0.16316825413121097}. Best is trial 532 with value: 0.7730183877040865.[0m
[32m[I 2022-04-15 06:47:20,866][0m Trial 551 finished with value: 0.5 and parameters: {'loss': 'coxph', 'learning_rate': 0.007933400030488487, 'n_estimators': 380, 'criterion': 'friedman_mse', 'min_samples_split': 4, 'min_samples_leaf': 10, 'min_weight_fraction_leaf': 0.1949108782011514, 'min_impurity_decrease': 0.4473682656178072, 'max_features': 0.842258157376948, 'subsample': 0.6917270744754498, 'dropout_rate': 0.0010354960847982655, 'ccp_alpha': 2.0077773702859174}. Best is trial 532 with value: 0.7730183877040865.[0m
[32m[I 2022-04-15 06:48:25,509][0m Trial 552 finished with value: 0.7707984253234106 and parameters: {'loss': 'coxph', 'learning_rate': 0.0067536948484863074, 'n_estimators': 433, 'criterion': 'friedman_mse', 'min_samples_split': 6, 'min_samples_leaf': 1, 'min_weight_fraction_leaf': 0.20215624154029008, 'min_impurity_decrease': 0.5687653363052316, 'max_features': 0.8621387358941534, 'subsample': 0.666451801796219, 'dropout_rate': 0.29441655017393653, 'ccp_alpha': 0.00113578566561732}. Best is trial 532 with value: 0.7730183877040865.[0m
[32m[I 2022-04-15 06:49:23,360][0m Trial 553 finished with value: 0.7287869585076209 and parameters: {'loss': 'coxph', 'learning_rate': 0.00658198629236991, 'n_estimators': 431, 'criterion': 'friedman_mse', 'min_samples_split': 6, 'min_samples_leaf': 1, 'min_weight_fraction_leaf': 0.21254858880655314, 'min_impurity_decrease': 0.5590989288392615, 'max_features': 0.9063481832482759, 'subsample': 0.6705026299070993, 'dropout_rate': 0.3476061369840612, 'ccp_alpha': 0.08309020046544438}. Best is trial 532 with value: 0.7730183877040865.[0m
[32m[I 2022-04-15 06:50:57,872][0m Trial 554 finished with value: 0.7608437488269774 and parameters: {'loss': 'coxph', 'learning_rate': 0.0035904003078061704, 'n_estimators': 473, 'criterion': 'friedman_mse', 'min_samples_split': 7, 'min_samples_leaf': 1, 'min_weight_fraction_leaf': 0.20616673592205423, 'min_impurity_decrease': 0.578259583589717, 'max_features': 0.8740700466117395, 'subsample': 0.6768986831983167, 'dropout_rate': 0.049678494603388496, 'ccp_alpha': 0.006425822959830817}. Best is trial 532 with value: 0.7730183877040865.[0m
[32m[I 2022-04-15 06:51:57,327][0m Trial 555 finished with value: 0.5 and parameters: {'loss': 'coxph', 'learning_rate': 0.00030921451396858854, 'n_estimators': 443, 'criterion': 'friedman_mse', 'min_samples_split': 8, 'min_samples_leaf': 1, 'min_weight_fraction_leaf': 0.2464046657738656, 'min_impurity_decrease': 0.5969318218470983, 'max_features': 0.8947231542824939, 'subsample': 0.6606611535689749, 'dropout_rate': 0.41012753725017553, 'ccp_alpha': 0.37334649629105776}. Best is trial 532 with value: 0.7730183877040865.[0m
[32m[I 2022-04-15 06:53:01,303][0m Trial 556 finished with value: 0.5 and parameters: {'loss': 'coxph', 'learning_rate': 0.004656525938790743, 'n_estimators': 404, 'criterion': 'absolute_error', 'min_samples_split': 5, 'min_samples_leaf': 1, 'min_weight_fraction_leaf': 0.19918857993653216, 'min_impurity_decrease': 0.5367241007822803, 'max_features': 0.9516597386178071, 'subsample': 0.6951786913749619, 'dropout_rate': 0.5293774018392778, 'ccp_alpha': 4.628516176628419}. Best is trial 532 with value: 0.7730183877040865.[0m
[32m[I 2022-04-15 06:54:25,779][0m Trial 557 finished with value: 0.764281927954258 and parameters: {'loss': 'coxph', 'learning_rate': 0.007064461921253607, 'n_estimators': 457, 'criterion': 'friedman_mse', 'min_samples_split': 4, 'min_samples_leaf': 2, 'min_weight_fraction_leaf': 0.21870346197844082, 'min_impurity_decrease': 0.45866920324872507, 'max_features': 0.8613843813000589, 'subsample': 0.6491120082519355, 'dropout_rate': 0.07726901622379102, 'ccp_alpha': 0.004411692196078974}. Best is trial 532 with value: 0.7730183877040865.[0m
[32m[I 2022-04-15 06:55:10,321][0m Trial 558 finished with value: 0.3203738440887215 and parameters: {'loss': 'squared', 'learning_rate': 0.00901350806319399, 'n_estimators': 425, 'criterion': 'friedman_mse', 'min_samples_split': 6, 'min_samples_leaf': 1, 'min_weight_fraction_leaf': 0.25276258795419987, 'min_impurity_decrease': 0.574665946878097, 'max_features': 0.9239385430796169, 'subsample': 0.6704151897906152, 'dropout_rate': 0.29035181703959934, 'ccp_alpha': 0.17322606209310168}. Best is trial 532 with value: 0.7730183877040865.[0m
[32m[I 2022-04-15 06:56:07,467][0m Trial 559 finished with value: 0.7276333810565406 and parameters: {'loss': 'coxph', 'learning_rate': 0.005458340514118142, 'n_estimators': 413, 'criterion': 'friedman_mse', 'min_samples_split': 4, 'min_samples_leaf': 1, 'min_weight_fraction_leaf': 0.19184619530968863, 'min_impurity_decrease': 0.5592016849382688, 'max_features': 0.8719367829177093, 'subsample': 0.6516194819364571, 'dropout_rate': 0.3185467430928063, 'ccp_alpha': 0.09715045658938776}. Best is trial 532 with value: 0.7730183877040865.[0m
[32m[I 2022-04-15 06:56:56,316][0m Trial 560 finished with value: 0.5301157883717103 and parameters: {'loss': 'coxph', 'learning_rate': 0.0077325444432016785, 'n_estimators': 398, 'criterion': 'friedman_mse', 'min_samples_split': 4, 'min_samples_leaf': 1, 'min_weight_fraction_leaf': 0.10227093210648605, 'min_impurity_decrease': 0.6110274352326115, 'max_features': 0.7903853573983256, 'subsample': 0.643030831678819, 'dropout_rate': 0.4243943408846174, 'ccp_alpha': 0.22938580862189228}. Best is trial 532 with value: 0.7730183877040865.[0m
[32m[I 2022-04-15 06:57:40,846][0m Trial 561 finished with value: 0.7732244799069579 and parameters: {'loss': 'coxph', 'learning_rate': 0.010737336899622864, 'n_estimators': 374, 'criterion': 'friedman_mse', 'min_samples_split': 4, 'min_samples_leaf': 1, 'min_weight_fraction_leaf': 0.11695967388063579, 'min_impurity_decrease': 0.5214990868280855, 'max_features': 0.8259861418304263, 'subsample': 0.7088346948240263, 'dropout_rate': 0.49595236593063746, 'ccp_alpha': 0.003711749035745799}. Best is trial 561 with value: 0.7732244799069579.[0m
[32m[I 2022-04-15 06:58:22,997][0m Trial 562 finished with value: 0.6743624146605087 and parameters: {'loss': 'coxph', 'learning_rate': 0.0105030964533898, 'n_estimators': 376, 'criterion': 'friedman_mse', 'min_samples_split': 4, 'min_samples_leaf': 1, 'min_weight_fraction_leaf': 0.1301061245787478, 'min_impurity_decrease': 0.5227359571001322, 'max_features': 0.826966752183, 'subsample': 0.7254177821529846, 'dropout_rate': 0.5085423777378116, 'ccp_alpha': 0.15627799678141835}. Best is trial 561 with value: 0.7732244799069579.[0m
[32m[I 2022-04-15 06:59:05,850][0m Trial 563 finished with value: 0.7322243422048539 and parameters: {'loss': 'coxph', 'learning_rate': 2.2060317541493323e-05, 'n_estimators': 365, 'criterion': 'friedman_mse', 'min_samples_split': 4, 'min_samples_leaf': 1, 'min_weight_fraction_leaf': 0.11310049771425049, 'min_impurity_decrease': 0.4804901781329995, 'max_features': 0.8088204132789211, 'subsample': 0.7125459454861327, 'dropout_rate': 0.45867521461556826, 'ccp_alpha': 0.09356367661707682}. Best is trial 561 with value: 0.7732244799069579.[0m
[32m[I 2022-04-15 06:59:51,307][0m Trial 564 finished with value: 0.7722141298572439 and parameters: {'loss': 'coxph', 'learning_rate': 0.011291810143167571, 'n_estimators': 384, 'criterion': 'friedman_mse', 'min_samples_split': 5, 'min_samples_leaf': 1, 'min_weight_fraction_leaf': 0.11980096471404224, 'min_impurity_decrease': 0.5258929247139124, 'max_features': 0.8472055894716437, 'subsample': 0.7349590788757967, 'dropout_rate': 0.5447766980514869, 'ccp_alpha': 0.001959920397526574}. Best is trial 561 with value: 0.7732244799069579.[0m
[32m[I 2022-04-15 07:00:28,061][0m Trial 565 finished with value: 0.5 and parameters: {'loss': 'coxph', 'learning_rate': 0.011195793082965687, 'n_estimators': 350, 'criterion': 'friedman_mse', 'min_samples_split': 6, 'min_samples_leaf': 1, 'min_weight_fraction_leaf': 0.13798241637200398, 'min_impurity_decrease': 0.524728191307708, 'max_features': 0.8449761445980497, 'subsample': 0.8009007110834956, 'dropout_rate': 0.5366888614955877, 'ccp_alpha': 0.2939777392133484}. Best is trial 561 with value: 0.7732244799069579.[0m
[32m[I 2022-04-15 07:01:13,429][0m Trial 566 finished with value: 0.6743624146605087 and parameters: {'loss': 'coxph', 'learning_rate': 0.011604567839065352, 'n_estimators': 393, 'criterion': 'friedman_mse', 'min_samples_split': 5, 'min_samples_leaf': 1, 'min_weight_fraction_leaf': 0.12239624279728656, 'min_impurity_decrease': 0.5079465833892015, 'max_features': 0.8287104139032647, 'subsample': 0.7654309731133605, 'dropout_rate': 0.4927627546894187, 'ccp_alpha': 0.16566787963579852}. Best is trial 561 with value: 0.7732244799069579.[0m
[32m[I 2022-04-15 07:01:53,940][0m Trial 567 finished with value: 0.6743624146605087 and parameters: {'loss': 'coxph', 'learning_rate': 0.009060007505801626, 'n_estimators': 341, 'criterion': 'friedman_mse', 'min_samples_split': 5, 'min_samples_leaf': 1, 'min_weight_fraction_leaf': 0.09266258853201356, 'min_impurity_decrease': 0.4903339030930299, 'max_features': 0.8552562689588777, 'subsample': 0.7375395403023022, 'dropout_rate': 0.39778138924126233, 'ccp_alpha': 0.13348556589346247}. Best is trial 561 with value: 0.7732244799069579.[0m
[32m[I 2022-04-15 07:02:36,164][0m Trial 568 finished with value: 0.7374345159871755 and parameters: {'loss': 'coxph', 'learning_rate': 0.011835695032701763, 'n_estimators': 371, 'criterion': 'friedman_mse', 'min_samples_split': 6, 'min_samples_leaf': 2, 'min_weight_fraction_leaf': 0.11479356999920234, 'min_impurity_decrease': 0.5451609224441636, 'max_features': 0.8211780004084077, 'subsample': 0.7459123743546094, 'dropout_rate': 0.5509968373816275, 'ccp_alpha': 0.07908260007839327}. Best is trial 561 with value: 0.7732244799069579.[0m
[32m[I 2022-04-15 07:03:19,421][0m Trial 569 finished with value: 0.5 and parameters: {'loss': 'coxph', 'learning_rate': 0.008822151726936001, 'n_estimators': 393, 'criterion': 'squared_error', 'min_samples_split': 5, 'min_samples_leaf': 1, 'min_weight_fraction_leaf': 0.10134127145696856, 'min_impurity_decrease': 0.5130783355823063, 'max_features': 0.8541178460244333, 'subsample': 0.7319084236936008, 'dropout_rate': 0.5148094878662697, 'ccp_alpha': 0.001558080666663777}. Best is trial 561 with value: 0.7732244799069579.[0m
[32m[I 2022-04-15 07:03:43,390][0m Trial 570 finished with value: 0.5 and parameters: {'loss': 'coxph', 'learning_rate': 0.012889488545868728, 'n_estimators': 278, 'criterion': 'friedman_mse', 'min_samples_split': 5, 'min_samples_leaf': 1, 'min_weight_fraction_leaf': 0.12149474964707553, 'min_impurity_decrease': 0.5388064670487211, 'max_features': 0.7825527328868636, 'subsample': 0.7672032449554574, 'dropout_rate': 0.5587234444550443, 'ccp_alpha': 0.24295634405146466}. Best is trial 561 with value: 0.7732244799069579.[0m
[32m[I 2022-04-15 07:04:23,663][0m Trial 571 finished with value: 0.7325963480779508 and parameters: {'loss': 'coxph', 'learning_rate': 0.010043379093381337, 'n_estimators': 384, 'criterion': 'friedman_mse', 'min_samples_split': 7, 'min_samples_leaf': 1, 'min_weight_fraction_leaf': 0.11015745459875168, 'min_impurity_decrease': 0.4967641527160165, 'max_features': 0.8747590965833204, 'subsample': 0.6997436762813003, 'dropout_rate': 0.5268302027605128, 'ccp_alpha': 0.09068619962102935}. Best is trial 561 with value: 0.7732244799069579.[0m
[32m[I 2022-04-15 07:05:11,650][0m Trial 572 finished with value: 0.7770667440438721 and parameters: {'loss': 'coxph', 'learning_rate': 0.007053503704459513, 'n_estimators': 406, 'criterion': 'friedman_mse', 'min_samples_split': 4, 'min_samples_leaf': 1, 'min_weight_fraction_leaf': 0.07321207386775727, 'min_impurity_decrease': 0.5255879398749613, 'max_features': 0.8121416490820254, 'subsample': 0.7243466197291966, 'dropout_rate': 0.5767740785483177, 'ccp_alpha': 0.0037720321921022033}. Best is trial 572 with value: 0.7770667440438721.[0m
[32m[I 2022-04-15 07:05:55,544][0m Trial 573 finished with value: 0.5 and parameters: {'loss': 'coxph', 'learning_rate': 0.006809446731779466, 'n_estimators': 414, 'criterion': 'friedman_mse', 'min_samples_split': 4, 'min_samples_leaf': 1, 'min_weight_fraction_leaf': 0.05991234009088234, 'min_impurity_decrease': 0.4784696253386673, 'max_features': 0.804928845310516, 'subsample': 0.7576075452581152, 'dropout_rate': 0.579284105030659, 'ccp_alpha': 0.9340994769523815}. Best is trial 572 with value: 0.7770667440438721.[0m
[32m[I 2022-04-15 07:06:46,110][0m Trial 574 finished with value: 0.7647932590971893 and parameters: {'loss': 'coxph', 'learning_rate': 0.007865381037264686, 'n_estimators': 439, 'criterion': 'friedman_mse', 'min_samples_split': 4, 'min_samples_leaf': 1, 'min_weight_fraction_leaf': 0.20325788132840397, 'min_impurity_decrease': 0.5249383375720885, 'max_features': 0.8351943638806165, 'subsample': 0.7043139375234434, 'dropout_rate': 0.58751027037192, 'ccp_alpha': 0.0034000704956511528}. Best is trial 572 with value: 0.7770667440438721.[0m
