[32m[I 2022-04-14 08:35:50,308][0m Trial 490 finished with value: 0.7781814573216324 and parameters: {'loss': 'coxph', 'learning_rate': 2.0929457807673714e-05, 'n_estimators': 998, 'criterion': 'friedman_mse', 'min_samples_split': 10, 'min_samples_leaf': 2, 'min_weight_fraction_leaf': 0.39520005676539555, 'min_impurity_decrease': 0.2765800271615277, 'max_features': 0.9043583130390076, 'subsample': 0.15966629576146926, 'dropout_rate': 0.6039937534423468, 'ccp_alpha': 0.09616650569379787}. Best is trial 367 with value: 0.7817487788378487.[0m
[32m[I 2022-04-14 08:39:48,288][0m Trial 491 finished with value: 0.7801285277326971 and parameters: {'loss': 'coxph', 'learning_rate': 1.4487224170593686e-05, 'n_estimators': 902, 'criterion': 'friedman_mse', 'min_samples_split': 8, 'min_samples_leaf': 3, 'min_weight_fraction_leaf': 0.38656712818357625, 'min_impurity_decrease': 0.3516194500684618, 'max_features': 0.8557485660178951, 'subsample': 0.029396610460185657, 'dropout_rate': 0.5389516512279575, 'ccp_alpha': 0.17273648130538144}. Best is trial 367 with value: 0.7817487788378487.[0m
[32m[I 2022-04-14 08:43:14,813][0m Trial 492 finished with value: 0.7789866496874849 and parameters: {'loss': 'coxph', 'learning_rate': 8.923327618046118e-06, 'n_estimators': 838, 'criterion': 'friedman_mse', 'min_samples_split': 9, 'min_samples_leaf': 2, 'min_weight_fraction_leaf': 0.3581698052590139, 'min_impurity_decrease': 0.3350000140348223, 'max_features': 0.8787766561554897, 'subsample': 0.10478824143223504, 'dropout_rate': 0.5695096985615733, 'ccp_alpha': 0.08215899646226792}. Best is trial 367 with value: 0.7817487788378487.[0m
[32m[I 2022-04-14 08:48:17,288][0m Trial 493 finished with value: 0.7809428031561105 and parameters: {'loss': 'coxph', 'learning_rate': 7.461973119572432e-06, 'n_estimators': 945, 'criterion': 'friedman_mse', 'min_samples_split': 9, 'min_samples_leaf': 1, 'min_weight_fraction_leaf': 0.37553485568376277, 'min_impurity_decrease': 0.30465715640831986, 'max_features': 0.9118477812808284, 'subsample': 0.07705253130269539, 'dropout_rate': 0.4828225879563459, 'ccp_alpha': 0.005721165201076243}. Best is trial 367 with value: 0.7817487788378487.[0m
[32m[I 2022-04-14 08:52:34,372][0m Trial 494 finished with value: 0.7800953965710371 and parameters: {'loss': 'coxph', 'learning_rate': 4.877676633813359e-06, 'n_estimators': 895, 'criterion': 'friedman_mse', 'min_samples_split': 8, 'min_samples_leaf': 1, 'min_weight_fraction_leaf': 0.3711463936648648, 'min_impurity_decrease': 0.28852395790751917, 'max_features': 0.9471831140745228, 'subsample': 0.13981361625200522, 'dropout_rate': 0.4972765403884212, 'ccp_alpha': 0.005580849414803567}. Best is trial 367 with value: 0.7817487788378487.[0m
[32m[I 2022-04-14 08:56:21,957][0m Trial 495 finished with value: 0.77950266440726 and parameters: {'loss': 'coxph', 'learning_rate': 6.938393560193161e-06, 'n_estimators': 803, 'criterion': 'friedman_mse', 'min_samples_split': 9, 'min_samples_leaf': 1, 'min_weight_fraction_leaf': 0.3759688798049267, 'min_impurity_decrease': 0.2712632139067074, 'max_features': 0.9199729373572754, 'subsample': 0.08531879998626929, 'dropout_rate': 0.4727042399195772, 'ccp_alpha': 0.08359641250427495}. Best is trial 367 with value: 0.7817487788378487.[0m
[32m[I 2022-04-14 08:59:49,434][0m Trial 496 finished with value: 0.6371812073302544 and parameters: {'loss': 'coxph', 'learning_rate': 5.649622503564009e-06, 'n_estimators': 863, 'criterion': 'friedman_mse', 'min_samples_split': 9, 'min_samples_leaf': 1, 'min_weight_fraction_leaf': 0.3540433493025452, 'min_impurity_decrease': 0.3059548998770848, 'max_features': 0.8593401618285653, 'subsample': 0.12174749116487646, 'dropout_rate': 0.5099668233661252, 'ccp_alpha': 0.22970851998051559}. Best is trial 367 with value: 0.7817487788378487.[0m
[32m[I 2022-04-14 09:03:59,931][0m Trial 497 finished with value: 0.7807940072664137 and parameters: {'loss': 'coxph', 'learning_rate': 7.695083070508963e-06, 'n_estimators': 961, 'criterion': 'friedman_mse', 'min_samples_split': 8, 'min_samples_leaf': 1, 'min_weight_fraction_leaf': 0.3644593923177809, 'min_impurity_decrease': 0.33448283680052376, 'max_features': 0.9127663392038408, 'subsample': 0.10213255411389241, 'dropout_rate': 0.538342986525421, 'ccp_alpha': 0.003129836442741421}. Best is trial 367 with value: 0.7817487788378487.[0m
[32m[I 2022-04-14 09:07:50,417][0m Trial 498 finished with value: 0.7806747139691432 and parameters: {'loss': 'coxph', 'learning_rate': 5.40966146572661e-06, 'n_estimators': 911, 'criterion': 'friedman_mse', 'min_samples_split': 9, 'min_samples_leaf': 1, 'min_weight_fraction_leaf': 0.37771722868983854, 'min_impurity_decrease': 0.25532873868463335, 'max_features': 0.8792875350619606, 'subsample': 0.06046407537795195, 'dropout_rate': 0.5527357185087132, 'ccp_alpha': 0.0889675633239174}. Best is trial 367 with value: 0.7817487788378487.[0m
[32m[I 2022-04-14 09:11:35,879][0m Trial 499 finished with value: 0.7755608159685391 and parameters: {'loss': 'coxph', 'learning_rate': 8.042720432663479e-06, 'n_estimators': 854, 'criterion': 'friedman_mse', 'min_samples_split': 8, 'min_samples_leaf': 3, 'min_weight_fraction_leaf': 0.39822101817894234, 'min_impurity_decrease': 0.2892324912552271, 'max_features': 0.934467205305179, 'subsample': 0.08040957551566613, 'dropout_rate': 0.48150734962622826, 'ccp_alpha': 0.1745463181542669}. Best is trial 367 with value: 0.7817487788378487.[0m
[32m[I 2022-04-14 09:15:55,126][0m Trial 500 finished with value: 0.7799497860402951 and parameters: {'loss': 'coxph', 'learning_rate': 3.971571171684488e-06, 'n_estimators': 917, 'criterion': 'friedman_mse', 'min_samples_split': 9, 'min_samples_leaf': 1, 'min_weight_fraction_leaf': 0.3635953611482865, 'min_impurity_decrease': 0.3603810703556582, 'max_features': 0.8449142506753504, 'subsample': 0.1229443601197312, 'dropout_rate': 0.490039241227363, 'ccp_alpha': 0.003846808468789263}. Best is trial 367 with value: 0.7817487788378487.[0m
[32m[I 2022-04-14 09:19:05,711][0m Trial 501 finished with value: 0.7774944922137378 and parameters: {'loss': 'coxph', 'learning_rate': 6.745651845119874e-06, 'n_estimators': 796, 'criterion': 'friedman_mse', 'min_samples_split': 10, 'min_samples_leaf': 3, 'min_weight_fraction_leaf': 0.4140875732644774, 'min_impurity_decrease': 0.31472804358940903, 'max_features': 0.8973298937795402, 'subsample': 0.09087768335641103, 'dropout_rate': 0.5575988472731328, 'ccp_alpha': 0.002965360997459615}. Best is trial 367 with value: 0.7817487788378487.[0m
[32m[I 2022-04-14 09:23:12,439][0m Trial 502 finished with value: 0.25 and parameters: {'loss': 'coxph', 'learning_rate': 1.2188828048601245e-05, 'n_estimators': 955, 'criterion': 'friedman_mse', 'min_samples_split': 8, 'min_samples_leaf': 2, 'min_weight_fraction_leaf': 0.3894654414282493, 'min_impurity_decrease': 0.2926085902739285, 'max_features': 0.832021070926985, 'subsample': 0.003917011576629138, 'dropout_rate': 0.5749721314808177, 'ccp_alpha': 0.3387008124205109}. Best is trial 367 with value: 0.7817487788378487.[0m
[32m[I 2022-04-14 09:26:53,384][0m Trial 503 finished with value: 0.7444314188469159 and parameters: {'loss': 'coxph', 'learning_rate': 9.28688842262215e-06, 'n_estimators': 881, 'criterion': 'friedman_mse', 'min_samples_split': 9, 'min_samples_leaf': 2, 'min_weight_fraction_leaf': 0.379733501601439, 'min_impurity_decrease': 0.38763814585299966, 'max_features': 0.8699008722203511, 'subsample': 0.15607611589001857, 'dropout_rate': 0.5030133100295684, 'ccp_alpha': 0.16916733595313924}. Best is trial 367 with value: 0.7817487788378487.[0m
[32m[I 2022-04-14 09:30:08,628][0m Trial 504 finished with value: 0.7788377835316942 and parameters: {'loss': 'coxph', 'learning_rate': 5.775226346895077e-06, 'n_estimators': 830, 'criterion': 'friedman_mse', 'min_samples_split': 9, 'min_samples_leaf': 2, 'min_weight_fraction_leaf': 0.3673122277426156, 'min_impurity_decrease': 0.325093095412112, 'max_features': 0.9668976088634339, 'subsample': 0.1099624339954665, 'dropout_rate': 0.5336185695203571, 'ccp_alpha': 0.09784489592561739}. Best is trial 367 with value: 0.7817487788378487.[0m
[32m[I 2022-04-14 09:31:51,303][0m Trial 505 finished with value: -0.36843886700168194 and parameters: {'loss': 'squared', 'learning_rate': 1.0290688582464842e-05, 'n_estimators': 704, 'criterion': 'friedman_mse', 'min_samples_split': 9, 'min_samples_leaf': 1, 'min_weight_fraction_leaf': 0.4045110332783232, 'min_impurity_decrease': 0.2684628012080523, 'max_features': 0.8982861766064754, 'subsample': 0.05538894728729633, 'dropout_rate': 0.46963979082611185, 'ccp_alpha': 0.0019729699774618677}. Best is trial 367 with value: 0.7817487788378487.[0m
[32m[I 2022-04-14 09:35:23,681][0m Trial 506 finished with value: 0.6371812073302544 and parameters: {'loss': 'coxph', 'learning_rate': 7.70066821669621e-06, 'n_estimators': 911, 'criterion': 'friedman_mse', 'min_samples_split': 8, 'min_samples_leaf': 2, 'min_weight_fraction_leaf': 0.35449076491002457, 'min_impurity_decrease': 0.22430088946638865, 'max_features': 0.9256506040494847, 'subsample': 0.13630748989379307, 'dropout_rate': 0.5879522622085004, 'ccp_alpha': 0.2631808818236326}. Best is trial 367 with value: 0.7817487788378487.[0m
[32m[I 2022-04-14 09:38:34,398][0m Trial 507 finished with value: 0.7716787806862051 and parameters: {'loss': 'coxph', 'learning_rate': 4.466207093069243e-06, 'n_estimators': 869, 'criterion': 'friedman_mse', 'min_samples_split': 9, 'min_samples_leaf': 2, 'min_weight_fraction_leaf': 0.37365049369051834, 'min_impurity_decrease': 0.35409570856002104, 'max_features': 0.8832252709224017, 'subsample': 0.10113199778430365, 'dropout_rate': 0.6151804449063163, 'ccp_alpha': 0.15875107054950144}. Best is trial 367 with value: 0.7817487788378487.[0m
[32m[I 2022-04-14 09:43:10,756][0m Trial 508 finished with value: 0.7810406569566931 and parameters: {'loss': 'coxph', 'learning_rate': 1.5194132452943074e-05, 'n_estimators': 996, 'criterion': 'friedman_mse', 'min_samples_split': 8, 'min_samples_leaf': 2, 'min_weight_fraction_leaf': 0.3928652847180999, 'min_impurity_decrease': 0.3077423051238935, 'max_features': 0.8556626406716333, 'subsample': 0.06749489593387546, 'dropout_rate': 0.5524447865372845, 'ccp_alpha': 0.08820251418040961}. Best is trial 367 with value: 0.7817487788378487.[0m
[32m[I 2022-04-14 09:47:59,590][0m Trial 509 finished with value: 0.592861841842758 and parameters: {'loss': 'coxph', 'learning_rate': 2.4116926119579562e-05, 'n_estimators': 995, 'criterion': 'friedman_mse', 'min_samples_split': 9, 'min_samples_leaf': 3, 'min_weight_fraction_leaf': 0.393548171939703, 'min_impurity_decrease': 0.33600191643202293, 'max_features': 0.8354230668926373, 'subsample': 0.027091293463006483, 'dropout_rate': 0.5312548805773388, 'ccp_alpha': 0.5676191737021687}. Best is trial 367 with value: 0.7817487788378487.[0m
[32m[I 2022-04-14 09:52:51,911][0m Trial 510 finished with value: 0.7668152373683885 and parameters: {'loss': 'coxph', 'learning_rate': 1.7882218112981746e-05, 'n_estimators': 995, 'criterion': 'friedman_mse', 'min_samples_split': 8, 'min_samples_leaf': 2, 'min_weight_fraction_leaf': 0.4156205617476679, 'min_impurity_decrease': 0.2794349741211544, 'max_features': 0.8547668202764311, 'subsample': 0.06805221935435522, 'dropout_rate': 0.5530946324909551, 'ccp_alpha': 0.25171353582560846}. Best is trial 367 with value: 0.7817487788378487.[0m
[32m[I 2022-04-14 09:57:40,903][0m Trial 511 finished with value: 0.7669157422360995 and parameters: {'loss': 'coxph', 'learning_rate': 1.543833860253428e-05, 'n_estimators': 959, 'criterion': 'friedman_mse', 'min_samples_split': 9, 'min_samples_leaf': 2, 'min_weight_fraction_leaf': 0.4040664534273194, 'min_impurity_decrease': 0.31227638394395474, 'max_features': 0.8509992769495924, 'subsample': 0.03279181318181587, 'dropout_rate': 0.503639457598122, 'ccp_alpha': 0.3787286870385445}. Best is trial 367 with value: 0.7817487788378487.[0m
[32m[I 2022-04-14 10:02:28,192][0m Trial 512 finished with value: 0.7806278865105204 and parameters: {'loss': 'coxph', 'learning_rate': 1.3202248965616433e-05, 'n_estimators': 943, 'criterion': 'friedman_mse', 'min_samples_split': 8, 'min_samples_leaf': 2, 'min_weight_fraction_leaf': 0.38692291691317765, 'min_impurity_decrease': 0.33139557752144694, 'max_features': 0.9112582394716799, 'subsample': 0.07961406687120479, 'dropout_rate': 0.5326874574636822, 'ccp_alpha': 0.10516281865952025}. Best is trial 367 with value: 0.7817487788378487.[0m
[32m[I 2022-04-14 10:07:18,529][0m Trial 513 finished with value: 0.7782483077063046 and parameters: {'loss': 'coxph', 'learning_rate': 1.2406765069459358e-05, 'n_estimators': 999, 'criterion': 'friedman_mse', 'min_samples_split': 9, 'min_samples_leaf': 2, 'min_weight_fraction_leaf': 0.3957536310628967, 'min_impurity_decrease': 0.29745648084044984, 'max_features': 0.8301242249342328, 'subsample': 0.05730211526784232, 'dropout_rate': 0.5562823217451011, 'ccp_alpha': 0.17132967243169137}. Best is trial 367 with value: 0.7817487788378487.[0m
[32m[I 2022-04-14 10:11:32,917][0m Trial 514 finished with value: 0.7804930644396937 and parameters: {'loss': 'coxph', 'learning_rate': 1.6149249293202957e-05, 'n_estimators': 936, 'criterion': 'friedman_mse', 'min_samples_split': 9, 'min_samples_leaf': 2, 'min_weight_fraction_leaf': 0.38111718894663127, 'min_impurity_decrease': 0.25042487840400657, 'max_features': 0.8668860236612513, 'subsample': 0.0778236267732436, 'dropout_rate': 0.5931164518571261, 'ccp_alpha': 0.09407741225264372}. Best is trial 367 with value: 0.7817487788378487.[0m
[32m[I 2022-04-14 10:15:48,032][0m Trial 515 finished with value: 0.7811067740809057 and parameters: {'loss': 'coxph', 'learning_rate': 1.0467450389503023e-05, 'n_estimators': 913, 'criterion': 'friedman_mse', 'min_samples_split': 8, 'min_samples_leaf': 1, 'min_weight_fraction_leaf': 0.36554901650048094, 'min_impurity_decrease': 0.31431099391223233, 'max_features': 0.9392235084013696, 'subsample': 0.11851698636582779, 'dropout_rate': 0.5705716239682954, 'ccp_alpha': 0.002152551054060308}. Best is trial 367 with value: 0.7817487788378487.[0m
[32m[I 2022-04-14 10:18:42,366][0m Trial 516 finished with value: 0.25 and parameters: {'loss': 'coxph', 'learning_rate': 2.2254079498702107e-05, 'n_estimators': 831, 'criterion': 'friedman_mse', 'min_samples_split': 8, 'min_samples_leaf': 1, 'min_weight_fraction_leaf': 0.3929830067706727, 'min_impurity_decrease': 0.35897258837989926, 'max_features': 0.9584485721324976, 'subsample': 0.17886560340041535, 'dropout_rate': 0.6536422425329768, 'ccp_alpha': 0.44572399320308403}. Best is trial 367 with value: 0.7817487788378487.[0m
[32m[I 2022-04-14 10:22:23,591][0m Trial 517 finished with value: 0.6371812073302544 and parameters: {'loss': 'coxph', 'learning_rate': 1.0951319910842087e-05, 'n_estimators': 901, 'criterion': 'friedman_mse', 'min_samples_split': 8, 'min_samples_leaf': 1, 'min_weight_fraction_leaf': 0.35379327919828235, 'min_impurity_decrease': 0.33774852619583345, 'max_features': 0.894027866660325, 'subsample': 0.13039670895788122, 'dropout_rate': 0.6067882058153047, 'ccp_alpha': 0.20880558221121398}. Best is trial 367 with value: 0.7817487788378487.[0m
[32m[I 2022-04-14 10:25:11,630][0m Trial 518 finished with value: 0.5203899749418202 and parameters: {'loss': 'coxph', 'learning_rate': 1.83912784225889e-05, 'n_estimators': 800, 'criterion': 'friedman_mse', 'min_samples_split': 8, 'min_samples_leaf': 1, 'min_weight_fraction_leaf': 0.37445599918046596, 'min_impurity_decrease': 0.28147185067789693, 'max_features': 0.8646871899060444, 'subsample': 0.14322016580355826, 'dropout_rate': 0.5723228537674075, 'ccp_alpha': 0.2894734599454262}. Best is trial 367 with value: 0.7817487788378487.[0m
[32m[I 2022-04-14 10:28:30,587][0m Trial 519 finished with value: 0.7790967457850259 and parameters: {'loss': 'coxph', 'learning_rate': 9.833042886093737e-06, 'n_estimators': 891, 'criterion': 'friedman_mse', 'min_samples_split': 8, 'min_samples_leaf': 1, 'min_weight_fraction_leaf': 0.3856862983552437, 'min_impurity_decrease': 0.3876922777829621, 'max_features': 0.9117533734514764, 'subsample': 0.1165534929228263, 'dropout_rate': 0.6318251704555881, 'ccp_alpha': 0.09176226060880147}. Best is trial 367 with value: 0.7817487788378487.[0m
[32m[I 2022-04-14 10:32:05,771][0m Trial 520 finished with value: 0.7737585940896717 and parameters: {'loss': 'coxph', 'learning_rate': 1.4580066482928286e-05, 'n_estimators': 855, 'criterion': 'friedman_mse', 'min_samples_split': 8, 'min_samples_leaf': 1, 'min_weight_fraction_leaf': 0.36436736586597995, 'min_impurity_decrease': 0.3202607383560355, 'max_features': 0.9449085529740201, 'subsample': 0.09945453665121103, 'dropout_rate': 0.5839199369657189, 'ccp_alpha': 0.17376453103000938}. Best is trial 367 with value: 0.7817487788378487.[0m
[32m[I 2022-04-14 10:36:12,935][0m Trial 521 finished with value: 0.7785280521408614 and parameters: {'loss': 'coxph', 'learning_rate': 1.2211162410767618e-05, 'n_estimators': 943, 'criterion': 'friedman_mse', 'min_samples_split': 8, 'min_samples_leaf': 1, 'min_weight_fraction_leaf': 0.4030579213636976, 'min_impurity_decrease': 0.3537423639968785, 'max_features': 0.8819834215967881, 'subsample': 0.15708383194255907, 'dropout_rate': 0.568807369326145, 'ccp_alpha': 0.0023700118052163745}. Best is trial 367 with value: 0.7817487788378487.[0m
[32m[I 2022-04-14 10:36:29,721][0m Trial 522 finished with value: 0.7761869138128766 and parameters: {'loss': 'coxph', 'learning_rate': 8.956585416059542e-06, 'n_estimators': 149, 'criterion': 'friedman_mse', 'min_samples_split': 8, 'min_samples_leaf': 1, 'min_weight_fraction_leaf': 0.37181784803945817, 'min_impurity_decrease': 0.2958174687376567, 'max_features': 0.8579799972156715, 'subsample': 0.12341543796909915, 'dropout_rate': 0.5999955894770238, 'ccp_alpha': 0.1053220036035384}. Best is trial 367 with value: 0.7817487788378487.[0m
[32m[I 2022-04-14 10:39:40,312][0m Trial 523 finished with value: 0.7427966072696188 and parameters: {'loss': 'coxph', 'learning_rate': 1.0756934460505396e-05, 'n_estimators': 826, 'criterion': 'friedman_mse', 'min_samples_split': 8, 'min_samples_leaf': 1, 'min_weight_fraction_leaf': 0.38265562497156874, 'min_impurity_decrease': 0.32331144068991857, 'max_features': 0.8265748380229925, 'subsample': 0.09323336377368775, 'dropout_rate': 0.5322939327259328, 'ccp_alpha': 0.25292944827357977}. Best is trial 367 with value: 0.7817487788378487.[0m
[32m[I 2022-04-14 10:43:26,432][0m Trial 524 finished with value: 0.7788200389546952 and parameters: {'loss': 'coxph', 'learning_rate': 1.3194788899142751e-05, 'n_estimators': 913, 'criterion': 'friedman_mse', 'min_samples_split': 8, 'min_samples_leaf': 1, 'min_weight_fraction_leaf': 0.393529321571454, 'min_impurity_decrease': 0.2688105691848715, 'max_features': 0.903334329921616, 'subsample': 0.1452160237022262, 'dropout_rate': 0.5577634119934992, 'ccp_alpha': 0.09186972808566}. Best is trial 367 with value: 0.7817487788378487.[0m
[32m[I 2022-04-14 10:46:27,055][0m Trial 525 finished with value: 0.7794966491566744 and parameters: {'loss': 'coxph', 'learning_rate': 6.66667931018454e-06, 'n_estimators': 776, 'criterion': 'friedman_mse', 'min_samples_split': 8, 'min_samples_leaf': 2, 'min_weight_fraction_leaf': 0.35552313434503674, 'min_impurity_decrease': 0.3050462736365428, 'max_features': 0.8796155294742232, 'subsample': 0.055656755588871884, 'dropout_rate': 0.5110072113391027, 'ccp_alpha': 0.18020273218191746}. Best is trial 367 with value: 0.7817487788378487.[0m
[32m[I 2022-04-14 10:48:56,717][0m Trial 526 finished with value: -0.36694250262562605 and parameters: {'loss': 'squared', 'learning_rate': 8.763175802474189e-06, 'n_estimators': 968, 'criterion': 'friedman_mse', 'min_samples_split': 10, 'min_samples_leaf': 3, 'min_weight_fraction_leaf': 0.37339652627367825, 'min_impurity_decrease': 0.3342600307576585, 'max_features': 0.8427574691816584, 'subsample': 0.11676502736816989, 'dropout_rate': 0.6136332482160634, 'ccp_alpha': 0.0018164674181141882}. Best is trial 367 with value: 0.7817487788378487.[0m
[32m[I 2022-04-14 10:52:12,347][0m Trial 527 finished with value: 0.6371812073302544 and parameters: {'loss': 'coxph', 'learning_rate': 1.6465948639433668e-05, 'n_estimators': 865, 'criterion': 'friedman_mse', 'min_samples_split': 8, 'min_samples_leaf': 2, 'min_weight_fraction_leaf': 0.4078598901622102, 'min_impurity_decrease': 0.28800278357747455, 'max_features': 0.9222025789827246, 'subsample': 0.09323381648930398, 'dropout_rate': 0.5766351410078847, 'ccp_alpha': 0.31208110723439797}. Best is trial 367 with value: 0.7817487788378487.[0m
[32m[I 2022-04-14 10:55:49,635][0m Trial 528 finished with value: 0.7787594277616979 and parameters: {'loss': 'coxph', 'learning_rate': 5.21735461177272e-06, 'n_estimators': 905, 'criterion': 'friedman_mse', 'min_samples_split': 8, 'min_samples_leaf': 2, 'min_weight_fraction_leaf': 0.38608395575375176, 'min_impurity_decrease': 0.24465840286688956, 'max_features': 0.8933659373979057, 'subsample': 0.11923208274248606, 'dropout_rate': 0.5487437281406206, 'ccp_alpha': 0.09613397061010115}. Best is trial 367 with value: 0.7817487788378487.[0m
[32m[I 2022-04-14 10:59:47,147][0m Trial 529 finished with value: 0.7752791041041109 and parameters: {'loss': 'coxph', 'learning_rate': 9.260034588996356e-06, 'n_estimators': 998, 'criterion': 'friedman_mse', 'min_samples_split': 9, 'min_samples_leaf': 2, 'min_weight_fraction_leaf': 0.36221859919297683, 'min_impurity_decrease': 0.35406676005657806, 'max_features': 0.8703413915472403, 'subsample': 0.08217805130603723, 'dropout_rate': 0.596540483018484, 'ccp_alpha': 0.17638596159455777}. Best is trial 367 with value: 0.7817487788378487.[0m
