No protocol specified
dropped categorical variable 'SEX', because it has only 1 values
[32m[I 2022-04-13 11:42:50,685][0m A new study created in memory with name: no-name-ca3f505b-8eba-4d04-a94e-1a02dea18737[0m
[32m[I 2022-04-13 11:42:52,426][0m Trial 0 finished with value: 0.7711148627184724 and parameters: {'alpha': 2.9712300690489584, 'ties': 'efron'}. Best is trial 0 with value: 0.7711148627184724.[0m
[32m[I 2022-04-13 11:42:53,520][0m Trial 1 finished with value: 0.7691631327169544 and parameters: {'alpha': 4.977093709984286, 'ties': 'breslow'}. Best is trial 0 with value: 0.7711148627184724.[0m
[32m[I 2022-04-13 11:42:54,781][0m Trial 2 finished with value: 0.7692028383778442 and parameters: {'alpha': 4.793853052136064, 'ties': 'efron'}. Best is trial 0 with value: 0.7711148627184724.[0m
[32m[I 2022-04-13 11:42:55,837][0m Trial 3 finished with value: 0.7695857385472097 and parameters: {'alpha': 4.19583106804015, 'ties': 'breslow'}. Best is trial 0 with value: 0.7711148627184724.[0m
[32m[I 2022-04-13 11:42:57,438][0m Trial 4 finished with value: 0.7702996940270678 and parameters: {'alpha': 3.6451608654497285, 'ties': 'efron'}. Best is trial 0 with value: 0.7711148627184724.[0m
[32m[I 2022-04-13 11:42:58,957][0m Trial 5 finished with value: 0.77231125999157 and parameters: {'alpha': 0.6915065814230655, 'ties': 'efron'}. Best is trial 5 with value: 0.77231125999157.[0m
[32m[I 2022-04-13 11:43:00,813][0m Trial 6 finished with value: 0.7725004593039034 and parameters: {'alpha': 0.8020220365002008, 'ties': 'efron'}. Best is trial 6 with value: 0.7725004593039034.[0m
[32m[I 2022-04-13 11:43:02,646][0m Trial 7 finished with value: 0.769197926516944 and parameters: {'alpha': 4.775370027156603, 'ties': 'efron'}. Best is trial 6 with value: 0.7725004593039034.[0m
[32m[I 2022-04-13 11:43:05,003][0m Trial 8 finished with value: 0.7720210211166387 and parameters: {'alpha': 2.3045393294287897, 'ties': 'efron'}. Best is trial 6 with value: 0.7725004593039034.[0m
[32m[I 2022-04-13 11:43:06,946][0m Trial 9 finished with value: 0.7724246557990276 and parameters: {'alpha': 2.0183133187930635, 'ties': 'breslow'}. Best is trial 6 with value: 0.7725004593039034.[0m
[32m[I 2022-04-13 11:43:08,602][0m Trial 10 finished with value: 0.771714537004824 and parameters: {'alpha': 0.3776026402219073, 'ties': 'breslow'}. Best is trial 6 with value: 0.7725004593039034.[0m
[32m[I 2022-04-13 11:43:10,011][0m Trial 11 finished with value: 0.7724729681196247 and parameters: {'alpha': 1.4122323843752769, 'ties': 'breslow'}. Best is trial 6 with value: 0.7725004593039034.[0m
[32m[I 2022-04-13 11:43:11,473][0m Trial 12 finished with value: 0.7726198459797918 and parameters: {'alpha': 1.186913631950538, 'ties': 'breslow'}. Best is trial 12 with value: 0.7726198459797918.[0m
[32m[I 2022-04-13 11:43:13,391][0m Trial 13 finished with value: 0.7725949775230065 and parameters: {'alpha': 1.0859210121797198, 'ties': 'breslow'}. Best is trial 12 with value: 0.7726198459797918.[0m
[32m[I 2022-04-13 11:43:15,503][0m Trial 14 finished with value: 0.7724801965054506 and parameters: {'alpha': 1.4659100881157245, 'ties': 'breslow'}. Best is trial 12 with value: 0.7726198459797918.[0m
[32m[I 2022-04-13 11:43:17,583][0m Trial 15 finished with value: 0.7724835297632366 and parameters: {'alpha': 1.3925846614166688, 'ties': 'breslow'}. Best is trial 12 with value: 0.7726198459797918.[0m
[32m[I 2022-04-13 11:43:19,601][0m Trial 16 finished with value: 0.7712619400757188 and parameters: {'alpha': 0.05789905993237565, 'ties': 'breslow'}. Best is trial 12 with value: 0.7726198459797918.[0m
[32m[I 2022-04-13 11:43:21,548][0m Trial 17 finished with value: 0.7718598844548055 and parameters: {'alpha': 2.8189506220663962, 'ties': 'breslow'}. Best is trial 12 with value: 0.7726198459797918.[0m
[32m[I 2022-04-13 11:43:23,286][0m Trial 18 finished with value: 0.7726327970152793 and parameters: {'alpha': 0.907794036239854, 'ties': 'breslow'}. Best is trial 18 with value: 0.7726327970152793.[0m
[32m[I 2022-04-13 11:43:25,481][0m Trial 19 finished with value: 0.7724600137457215 and parameters: {'alpha': 1.8350085873072153, 'ties': 'breslow'}. Best is trial 18 with value: 0.7726327970152793.[0m
[32m[I 2022-04-13 11:43:28,551][0m Trial 20 finished with value: 0.7712906462560388 and parameters: {'alpha': 0.08882079408081922, 'ties': 'breslow'}. Best is trial 18 with value: 0.7726327970152793.[0m
[32m[I 2022-04-13 11:43:30,960][0m Trial 21 finished with value: 0.7726370671112898 and parameters: {'alpha': 0.9609222509588935, 'ties': 'breslow'}. Best is trial 21 with value: 0.7726370671112898.[0m
[32m[I 2022-04-13 11:43:33,212][0m Trial 22 finished with value: 0.7725082507332643 and parameters: {'alpha': 0.8229426624122388, 'ties': 'breslow'}. Best is trial 21 with value: 0.7726370671112898.[0m
[32m[I 2022-04-13 11:43:35,641][0m Trial 23 finished with value: 0.7724548468112719 and parameters: {'alpha': 1.8554586448263033, 'ties': 'breslow'}. Best is trial 21 with value: 0.7726370671112898.[0m
[32m[I 2022-04-13 11:43:37,236][0m Trial 24 finished with value: 0.7718178640926414 and parameters: {'alpha': 0.5148478813485436, 'ties': 'breslow'}. Best is trial 21 with value: 0.7726370671112898.[0m
[32m[I 2022-04-13 11:43:38,808][0m Trial 25 finished with value: 0.7726034404614767 and parameters: {'alpha': 1.117581896935531, 'ties': 'breslow'}. Best is trial 21 with value: 0.7726370671112898.[0m
[32m[I 2022-04-13 11:43:40,669][0m Trial 26 finished with value: 0.7719147964084444 and parameters: {'alpha': 2.6099057095696128, 'ties': 'breslow'}. Best is trial 21 with value: 0.7726370671112898.[0m
[32m[I 2022-04-13 11:43:42,225][0m Trial 27 finished with value: 0.7725912727529298 and parameters: {'alpha': 1.1545741473941715, 'ties': 'breslow'}. Best is trial 21 with value: 0.7726370671112898.[0m
[32m[I 2022-04-13 11:43:44,175][0m Trial 28 finished with value: 0.772447482452397 and parameters: {'alpha': 1.618496216503059, 'ties': 'breslow'}. Best is trial 21 with value: 0.7726370671112898.[0m
[32m[I 2022-04-13 11:43:46,836][0m Trial 29 finished with value: 0.7710536931249274 and parameters: {'alpha': 3.163173157525583, 'ties': 'breslow'}. Best is trial 21 with value: 0.7726370671112898.[0m
[32m[I 2022-04-13 11:43:49,325][0m Trial 30 finished with value: 0.7720758931576635 and parameters: {'alpha': 2.253377782240337, 'ties': 'breslow'}. Best is trial 21 with value: 0.7726370671112898.[0m
[32m[I 2022-04-13 11:43:51,779][0m Trial 31 finished with value: 0.7725972030309795 and parameters: {'alpha': 1.111774704272224, 'ties': 'breslow'}. Best is trial 21 with value: 0.7726370671112898.[0m
[32m[I 2022-04-13 11:43:54,325][0m Trial 32 finished with value: 0.7716686923657373 and parameters: {'alpha': 0.4755302464758877, 'ties': 'breslow'}. Best is trial 21 with value: 0.7726370671112898.[0m
[32m[I 2022-04-13 11:43:56,169][0m Trial 33 finished with value: 0.772605484156139 and parameters: {'alpha': 1.011714987040966, 'ties': 'breslow'}. Best is trial 21 with value: 0.7726370671112898.[0m
[32m[I 2022-04-13 11:43:58,697][0m Trial 34 finished with value: 0.7725799336883993 and parameters: {'alpha': 0.8921897458545787, 'ties': 'breslow'}. Best is trial 21 with value: 0.7726370671112898.[0m
[32m[I 2022-04-13 11:44:00,657][0m Trial 35 finished with value: 0.7716734328054262 and parameters: {'alpha': 0.215718500305091, 'ties': 'breslow'}. Best is trial 21 with value: 0.7726370671112898.[0m
[32m[I 2022-04-13 11:44:02,838][0m Trial 36 finished with value: 0.7718261375835547 and parameters: {'alpha': 0.582214242677116, 'ties': 'efron'}. Best is trial 21 with value: 0.7726370671112898.[0m
[32m[I 2022-04-13 11:44:04,754][0m Trial 37 finished with value: 0.7725349800577173 and parameters: {'alpha': 1.7292064734106272, 'ties': 'breslow'}. Best is trial 21 with value: 0.7726370671112898.[0m
[32m[I 2022-04-13 11:44:07,101][0m Trial 38 finished with value: 0.7722775521573958 and parameters: {'alpha': 2.0910708089319594, 'ties': 'efron'}. Best is trial 21 with value: 0.7726370671112898.[0m
[32m[I 2022-04-13 11:44:09,480][0m Trial 39 finished with value: 0.7708642202615901 and parameters: {'alpha': 3.4509679226049776, 'ties': 'efron'}. Best is trial 21 with value: 0.7726370671112898.[0m
[32m[I 2022-04-13 11:44:11,543][0m Trial 40 finished with value: 0.7696160703553633 and parameters: {'alpha': 4.116074469538603, 'ties': 'breslow'}. Best is trial 21 with value: 0.7726370671112898.[0m
[32m[I 2022-04-13 11:44:14,089][0m Trial 41 finished with value: 0.7726121935786419 and parameters: {'alpha': 1.0786372030602833, 'ties': 'breslow'}. Best is trial 21 with value: 0.7726370671112898.[0m
[32m[I 2022-04-13 11:44:15,980][0m Trial 42 finished with value: 0.7725799336883993 and parameters: {'alpha': 0.8923591367248982, 'ties': 'breslow'}. Best is trial 21 with value: 0.7726370671112898.[0m
[32m[I 2022-04-13 11:44:17,942][0m Trial 43 finished with value: 0.7726087145248813 and parameters: {'alpha': 1.3173031320144668, 'ties': 'breslow'}. Best is trial 21 with value: 0.7726370671112898.[0m
[32m[I 2022-04-13 11:44:20,789][0m Trial 44 finished with value: 0.7724733789640232 and parameters: {'alpha': 1.3810431985678244, 'ties': 'breslow'}. Best is trial 21 with value: 0.7726370671112898.[0m
[32m[I 2022-04-13 11:44:22,949][0m Trial 45 finished with value: 0.7723026402890488 and parameters: {'alpha': 0.7181365634815632, 'ties': 'breslow'}. Best is trial 21 with value: 0.7726370671112898.[0m
[32m[I 2022-04-13 11:44:25,394][0m Trial 46 finished with value: 0.772635713519416 and parameters: {'alpha': 1.2750625384389012, 'ties': 'efron'}. Best is trial 21 with value: 0.7726370671112898.[0m
[32m[I 2022-04-13 11:44:28,328][0m Trial 47 finished with value: 0.7724669908685449 and parameters: {'alpha': 1.5476683445119495, 'ties': 'efron'}. Best is trial 21 with value: 0.7726370671112898.[0m
[32m[I 2022-04-13 11:44:31,889][0m Trial 48 finished with value: 0.7717372169672347 and parameters: {'alpha': 0.28397186885031855, 'ties': 'efron'}. Best is trial 21 with value: 0.7726370671112898.[0m
[32m[I 2022-04-13 11:44:35,536][0m Trial 49 finished with value: 0.7722643763486405 and parameters: {'alpha': 0.6784296311150724, 'ties': 'efron'}. Best is trial 21 with value: 0.7726370671112898.[0m
[32m[I 2022-04-13 11:44:39,012][0m Trial 50 finished with value: 0.7722869581347582 and parameters: {'alpha': 2.055275220247321, 'ties': 'efron'}. Best is trial 21 with value: 0.7726370671112898.[0m
[32m[I 2022-04-13 11:44:43,205][0m Trial 51 finished with value: 0.7726304900812113 and parameters: {'alpha': 1.2661875049096754, 'ties': 'efron'}. Best is trial 21 with value: 0.7726370671112898.[0m
[32m[I 2022-04-13 11:44:48,227][0m Trial 52 finished with value: 0.7726736786448299 and parameters: {'alpha': 1.2160805257942795, 'ties': 'efron'}. Best is trial 52 with value: 0.7726736786448299.[0m
[32m[I 2022-04-13 11:44:52,041][0m Trial 53 finished with value: 0.7726049984792007 and parameters: {'alpha': 1.3111157317128288, 'ties': 'efron'}. Best is trial 52 with value: 0.7726736786448299.[0m
[32m[I 2022-04-13 11:44:56,362][0m Trial 54 finished with value: 0.7724900094495958 and parameters: {'alpha': 1.5765726842741399, 'ties': 'efron'}. Best is trial 52 with value: 0.7726736786448299.[0m
[32m[I 2022-04-13 11:45:01,493][0m Trial 55 finished with value: 0.7725296755104193 and parameters: {'alpha': 1.822574779959837, 'ties': 'efron'}. Best is trial 52 with value: 0.7726736786448299.[0m
[32m[I 2022-04-13 11:45:05,511][0m Trial 56 finished with value: 0.7726194516065379 and parameters: {'alpha': 0.8826078888122563, 'ties': 'efron'}. Best is trial 52 with value: 0.7726736786448299.[0m
[32m[I 2022-04-13 11:45:09,408][0m Trial 57 finished with value: 0.772635713519416 and parameters: {'alpha': 1.273763549079855, 'ties': 'efron'}. Best is trial 52 with value: 0.7726736786448299.[0m
[32m[I 2022-04-13 11:45:13,474][0m Trial 58 finished with value: 0.7726391035857147 and parameters: {'alpha': 1.2798666800885607, 'ties': 'efron'}. Best is trial 52 with value: 0.7726736786448299.[0m
[32m[I 2022-04-13 11:45:16,294][0m Trial 59 finished with value: 0.7719867143724688 and parameters: {'alpha': 2.445743459673508, 'ties': 'efron'}. Best is trial 52 with value: 0.7726736786448299.[0m
[32m[I 2022-04-13 11:45:19,956][0m Trial 60 finished with value: 0.7717199676478269 and parameters: {'alpha': 0.37735683735786785, 'ties': 'efron'}. Best is trial 52 with value: 0.7726736786448299.[0m
[32m[I 2022-04-13 11:45:23,614][0m Trial 61 finished with value: 0.7726624905430529 and parameters: {'alpha': 1.218826350438468, 'ties': 'efron'}. Best is trial 52 with value: 0.7726736786448299.[0m
[32m[I 2022-04-13 11:45:27,434][0m Trial 62 finished with value: 0.7724901210462651 and parameters: {'alpha': 1.6869440103721653, 'ties': 'efron'}. Best is trial 52 with value: 0.7726736786448299.[0m
[32m[I 2022-04-13 11:45:31,952][0m Trial 63 finished with value: 0.7726458652276589 and parameters: {'alpha': 0.962911631912486, 'ties': 'efron'}. Best is trial 52 with value: 0.7726736786448299.[0m
[32m[I 2022-04-13 11:45:35,071][0m Trial 64 finished with value: 0.772441194974693 and parameters: {'alpha': 1.4383157466536738, 'ties': 'efron'}. Best is trial 52 with value: 0.7726736786448299.[0m
[32m[I 2022-04-13 11:45:37,934][0m Trial 65 finished with value: 0.7721664699503092 and parameters: {'alpha': 0.638470061451418, 'ties': 'efron'}. Best is trial 52 with value: 0.7726736786448299.[0m
[32m[I 2022-04-13 11:45:42,395][0m Trial 66 finished with value: 0.7726328463918968 and parameters: {'alpha': 0.9417957972255313, 'ties': 'efron'}. Best is trial 52 with value: 0.7726736786448299.[0m
[32m[I 2022-04-13 11:45:45,720][0m Trial 67 finished with value: 0.7726736786448299 and parameters: {'alpha': 1.2161696594601226, 'ties': 'efron'}. Best is trial 52 with value: 0.7726736786448299.[0m
[32m[I 2022-04-13 11:45:49,862][0m Trial 68 finished with value: 0.7724550525229261 and parameters: {'alpha': 1.9463758186759113, 'ties': 'efron'}. Best is trial 52 with value: 0.7726736786448299.[0m
[32m[I 2022-04-13 11:45:53,241][0m Trial 69 finished with value: 0.772454930730624 and parameters: {'alpha': 1.5154103774010594, 'ties': 'efron'}. Best is trial 52 with value: 0.7726736786448299.[0m
[32m[I 2022-04-13 11:45:57,252][0m Trial 70 finished with value: 0.7723540195522962 and parameters: {'alpha': 0.7350720731285914, 'ties': 'efron'}. Best is trial 52 with value: 0.7726736786448299.[0m
[32m[I 2022-04-13 11:46:01,458][0m Trial 71 finished with value: 0.7725819630500788 and parameters: {'alpha': 1.1905717504296978, 'ties': 'efron'}. Best is trial 52 with value: 0.7726736786448299.[0m
[32m[I 2022-04-13 11:46:04,567][0m Trial 72 finished with value: 0.7726100643627025 and parameters: {'alpha': 1.2007973111483263, 'ties': 'efron'}. Best is trial 52 with value: 0.7726736786448299.[0m
[32m[I 2022-04-13 11:46:09,075][0m Trial 73 finished with value: 0.7725653560019609 and parameters: {'alpha': 1.0980424731060094, 'ties': 'efron'}. Best is trial 52 with value: 0.7726736786448299.[0m
[32m[I 2022-04-13 11:46:13,487][0m Trial 74 finished with value: 0.7725171392050367 and parameters: {'alpha': 1.7052185156200637, 'ties': 'efron'}. Best is trial 52 with value: 0.7726736786448299.[0m
[32m[I 2022-04-13 11:46:18,246][0m Trial 75 finished with value: 0.7724866973761754 and parameters: {'alpha': 1.402210080859501, 'ties': 'efron'}. Best is trial 52 with value: 0.7726736786448299.[0m
[32m[I 2022-04-13 11:46:21,766][0m Trial 76 finished with value: 0.772603146693655 and parameters: {'alpha': 1.0053809246228114, 'ties': 'efron'}. Best is trial 52 with value: 0.7726736786448299.[0m
[32m[I 2022-04-13 11:46:26,772][0m Trial 77 finished with value: 0.7725276661813196 and parameters: {'alpha': 0.7923928054840154, 'ties': 'efron'}. Best is trial 52 with value: 0.7726736786448299.[0m
[32m[I 2022-04-13 11:46:31,334][0m Trial 78 finished with value: 0.771698401453361 and parameters: {'alpha': 0.49855725455588207, 'ties': 'efron'}. Best is trial 52 with value: 0.7726736786448299.[0m
[32m[I 2022-04-13 11:46:36,066][0m Trial 79 finished with value: 0.7726445816655405 and parameters: {'alpha': 1.2576617487286552, 'ties': 'efron'}. Best is trial 52 with value: 0.7726736786448299.[0m
[32m[I 2022-04-13 11:46:40,032][0m Trial 80 finished with value: 0.7720644619999563 and parameters: {'alpha': 2.2466790623548816, 'ties': 'efron'}. Best is trial 52 with value: 0.7726736786448299.[0m
[32m[I 2022-04-13 11:46:43,941][0m Trial 81 finished with value: 0.7726445816655405 and parameters: {'alpha': 1.2590077594095932, 'ties': 'efron'}. Best is trial 52 with value: 0.7726736786448299.[0m
[32m[I 2022-04-13 11:46:48,831][0m Trial 82 finished with value: 0.772596822759273 and parameters: {'alpha': 1.0687827486974235, 'ties': 'efron'}. Best is trial 52 with value: 0.7726736786448299.[0m
[32m[I 2022-04-13 11:46:51,907][0m Trial 83 finished with value: 0.7724529167588038 and parameters: {'alpha': 1.4912291786399239, 'ties': 'efron'}. Best is trial 52 with value: 0.7726736786448299.[0m
[32m[I 2022-04-13 11:46:55,896][0m Trial 84 finished with value: 0.772603146693655 and parameters: {'alpha': 1.0038916326706002, 'ties': 'efron'}. Best is trial 52 with value: 0.7726736786448299.[0m
[32m[I 2022-04-13 11:46:57,906][0m Trial 85 finished with value: 0.7726433672570545 and parameters: {'alpha': 1.2720847901758654, 'ties': 'efron'}. Best is trial 52 with value: 0.7726736786448299.[0m
[32m[I 2022-04-13 11:47:00,039][0m Trial 86 finished with value: 0.7724121622096829 and parameters: {'alpha': 1.62244957642101, 'ties': 'efron'}. Best is trial 52 with value: 0.7726736786448299.[0m
[32m[I 2022-04-13 11:47:03,488][0m Trial 87 finished with value: 0.7725338301471111 and parameters: {'alpha': 0.7857143967182758, 'ties': 'efron'}. Best is trial 52 with value: 0.7726736786448299.[0m
[32m[I 2022-04-13 11:47:05,937][0m Trial 88 finished with value: 0.7725793211322313 and parameters: {'alpha': 1.1785709362930237, 'ties': 'efron'}. Best is trial 52 with value: 0.7726736786448299.[0m
[32m[I 2022-04-13 11:47:08,699][0m Trial 89 finished with value: 0.7724022921488659 and parameters: {'alpha': 1.7940267191719341, 'ties': 'efron'}. Best is trial 52 with value: 0.7726736786448299.[0m
[32m[I 2022-04-13 11:47:10,787][0m Trial 90 finished with value: 0.7691852231584617 and parameters: {'alpha': 4.862262294151771, 'ties': 'efron'}. Best is trial 52 with value: 0.7726736786448299.[0m
[32m[I 2022-04-13 11:47:14,533][0m Trial 91 finished with value: 0.7725275976362116 and parameters: {'alpha': 1.354921969316621, 'ties': 'efron'}. Best is trial 52 with value: 0.7726736786448299.[0m
[32m[I 2022-04-13 11:47:18,213][0m Trial 92 finished with value: 0.7726358948807311 and parameters: {'alpha': 1.2077464796512496, 'ties': 'efron'}. Best is trial 52 with value: 0.7726736786448299.[0m
[32m[I 2022-04-13 11:47:21,602][0m Trial 93 finished with value: 0.7726326306203696 and parameters: {'alpha': 0.9458133078549109, 'ties': 'efron'}. Best is trial 52 with value: 0.7726736786448299.[0m
[32m[I 2022-04-13 11:47:24,511][0m Trial 94 finished with value: 0.7726980471141479 and parameters: {'alpha': 1.2149208686695412, 'ties': 'efron'}. Best is trial 94 with value: 0.7726980471141479.[0m
[32m[I 2022-04-13 11:47:26,139][0m Trial 95 finished with value: 0.7718261952451317 and parameters: {'alpha': 0.5802110887100892, 'ties': 'efron'}. Best is trial 94 with value: 0.7726980471141479.[0m
[32m[I 2022-04-13 11:47:28,715][0m Trial 96 finished with value: 0.7724207033194351 and parameters: {'alpha': 1.4391663847044676, 'ties': 'efron'}. Best is trial 94 with value: 0.7726980471141479.[0m
[32m[I 2022-04-13 11:47:32,609][0m Trial 97 finished with value: 0.7725524268236531 and parameters: {'alpha': 0.8392307187222747, 'ties': 'efron'}. Best is trial 94 with value: 0.7726980471141479.[0m
[32m[I 2022-04-13 11:47:34,565][0m Trial 98 finished with value: 0.7725465710487492 and parameters: {'alpha': 1.0318991796041814, 'ties': 'efron'}. Best is trial 94 with value: 0.7726980471141479.[0m
[32m[I 2022-04-13 11:47:37,837][0m Trial 99 finished with value: 0.7710825773135503 and parameters: {'alpha': 3.011457588973652, 'ties': 'efron'}. Best is trial 94 with value: 0.7726980471141479.[0m
[32m[I 2022-04-13 11:47:40,653][0m Trial 100 finished with value: 0.7724661986548105 and parameters: {'alpha': 1.9213272052320856, 'ties': 'efron'}. Best is trial 94 with value: 0.7726980471141479.[0m
[32m[I 2022-04-13 11:47:44,983][0m Trial 101 finished with value: 0.7726614442893316 and parameters: {'alpha': 1.2391095647669095, 'ties': 'efron'}. Best is trial 94 with value: 0.7726980471141479.[0m
[32m[I 2022-04-13 11:47:47,750][0m Trial 102 finished with value: 0.7724746572153629 and parameters: {'alpha': 1.595626062542462, 'ties': 'efron'}. Best is trial 94 with value: 0.7726980471141479.[0m
[32m[I 2022-04-13 11:47:51,099][0m Trial 103 finished with value: 0.7726049984792007 and parameters: {'alpha': 1.3115790395409146, 'ties': 'efron'}. Best is trial 94 with value: 0.7726980471141479.[0m
[32m[I 2022-04-13 11:47:55,197][0m Trial 104 finished with value: 0.7726133322877013 and parameters: {'alpha': 1.12338588830573, 'ties': 'efron'}. Best is trial 94 with value: 0.7726980471141479.[0m
[32m[I 2022-04-13 11:47:58,050][0m Trial 105 finished with value: 0.769634441673928 and parameters: {'alpha': 4.183396445069512, 'ties': 'efron'}. Best is trial 94 with value: 0.7726980471141479.[0m
[32m[I 2022-04-13 11:48:01,360][0m Trial 106 finished with value: 0.7724643149331488 and parameters: {'alpha': 1.4708672830174456, 'ties': 'efron'}. Best is trial 94 with value: 0.7726980471141479.[0m
