[32m[I 2022-04-15 17:12:17,360][0m Trial 150 finished with value: 0.883506316751674 and parameters: {'n_hidden': 1024, 'mixture_components': 10, 'use_sparse_layer': True, 'use_sparse_loss': False, 'use_batchnorm': True, 'use_dropout': True, 'dropout': 0.4348546535375954, 'mlp_size_1': 3, 'mlp_size_2': 3, 'mlp_size_3': 1, 'kernel': 'Weibull', 'loss_name': 'CensoredNLLLoss'}. Best is trial 87 with value: 0.8866301826616875.[0m
[32m[I 2022-04-15 17:14:33,615][0m Trial 151 finished with value: 0.8830755016228217 and parameters: {'n_hidden': 1024, 'mixture_components': 10, 'use_sparse_layer': True, 'use_sparse_loss': False, 'use_batchnorm': False, 'use_dropout': True, 'dropout': 0.39048062749733686, 'mlp_size_1': 2, 'mlp_size_2': 4, 'mlp_size_3': 1, 'kernel': 'Weibull', 'loss_name': 'CensoredNLLLoss'}. Best is trial 87 with value: 0.8866301826616875.[0m
[32m[I 2022-04-15 17:17:20,783][0m Trial 152 finished with value: 0.8858244222781604 and parameters: {'n_hidden': 1024, 'mixture_components': 10, 'use_sparse_layer': True, 'use_sparse_loss': False, 'use_batchnorm': False, 'use_dropout': True, 'dropout': 0.48030620098026455, 'mlp_size_1': 2, 'mlp_size_2': 4, 'mlp_size_3': 1, 'kernel': 'Weibull', 'loss_name': 'CensoredNLLLoss'}. Best is trial 87 with value: 0.8866301826616875.[0m
[32m[I 2022-04-15 17:19:45,275][0m Trial 153 finished with value: 0.8832600973560037 and parameters: {'n_hidden': 1024, 'mixture_components': 10, 'use_sparse_layer': True, 'use_sparse_loss': False, 'use_batchnorm': False, 'use_dropout': True, 'dropout': 0.34601405896068443, 'mlp_size_1': 2, 'mlp_size_2': 4, 'mlp_size_3': 1, 'kernel': 'Weibull', 'loss_name': 'CensoredNLLLoss'}. Best is trial 87 with value: 0.8866301826616875.[0m
[32m[I 2022-04-15 17:22:14,340][0m Trial 154 finished with value: 0.8840952410023799 and parameters: {'n_hidden': 1024, 'mixture_components': 10, 'use_sparse_layer': True, 'use_sparse_loss': False, 'use_batchnorm': False, 'use_dropout': True, 'dropout': 0.455950654810357, 'mlp_size_1': 2, 'mlp_size_2': 4, 'mlp_size_3': 1, 'kernel': 'Weibull', 'loss_name': 'CensoredNLLLoss'}. Best is trial 87 with value: 0.8866301826616875.[0m
[32m[I 2022-04-15 17:25:17,547][0m Trial 155 finished with value: 0.7827031623880931 and parameters: {'n_hidden': 1024, 'mixture_components': 10, 'use_sparse_layer': True, 'use_sparse_loss': False, 'use_batchnorm': False, 'use_dropout': True, 'dropout': 0.488276019151188, 'mlp_size_1': 3, 'mlp_size_2': 3, 'mlp_size_3': 1, 'kernel': 'LogNormal', 'loss_name': 'CensoredNLLLoss'}. Best is trial 87 with value: 0.8866301826616875.[0m
[32m[I 2022-04-15 17:28:00,553][0m Trial 156 finished with value: 0.88355801618502 and parameters: {'n_hidden': 2048, 'mixture_components': 9, 'use_sparse_layer': False, 'use_batchnorm': False, 'use_dropout': True, 'dropout': 0.5159171808404381, 'mlp_size_1': 2, 'mlp_size_2': 4, 'mlp_size_3': 1, 'kernel': 'Weibull', 'loss_name': 'CensoredNLLLoss'}. Best is trial 87 with value: 0.8866301826616875.[0m
[32m[I 2022-04-15 17:30:27,844][0m Trial 157 finished with value: 0.7577582189680094 and parameters: {'n_hidden': 1024, 'mixture_components': 10, 'use_sparse_layer': True, 'use_sparse_loss': False, 'use_batchnorm': False, 'use_dropout': True, 'dropout': 0.5802143197442011, 'mlp_size_1': 2, 'mlp_size_2': 4, 'mlp_size_3': 1, 'kernel': 'Weibull', 'loss_name': 'NLLLoss'}. Best is trial 87 with value: 0.8866301826616875.[0m
[32m[I 2022-04-15 17:32:50,004][0m Trial 158 finished with value: 0.8847250824631299 and parameters: {'n_hidden': 1024, 'mixture_components': 10, 'use_sparse_layer': True, 'use_sparse_loss': False, 'use_batchnorm': False, 'use_dropout': True, 'dropout': 0.3136822605601861, 'mlp_size_1': 3, 'mlp_size_2': 3, 'mlp_size_3': 1, 'kernel': 'LogLogistic', 'loss_name': 'CensoredNLLLoss'}. Best is trial 87 with value: 0.8866301826616875.[0m
[32m[I 2022-04-15 17:34:43,636][0m Trial 159 finished with value: 0.6841619517000149 and parameters: {'n_hidden': 256, 'mixture_components': 10, 'use_sparse_layer': True, 'use_sparse_loss': False, 'use_batchnorm': False, 'use_dropout': True, 'dropout': 0.6095866457130154, 'mlp_size_1': 2, 'mlp_size_2': 3, 'mlp_size_3': 0, 'kernel': 'Exponential', 'loss_name': 'CensoredNLLLoss'}. Best is trial 87 with value: 0.8866301826616875.[0m
[32m[I 2022-04-15 17:37:04,849][0m Trial 160 finished with value: 0.8819091487604311 and parameters: {'n_hidden': 128, 'mixture_components': 10, 'use_sparse_layer': True, 'use_sparse_loss': False, 'use_batchnorm': False, 'use_dropout': True, 'dropout': 0.2799703122592516, 'mlp_size_1': 2, 'mlp_size_2': 2, 'mlp_size_3': 0, 'kernel': 'Weibull', 'loss_name': 'CensoredNLLLoss'}. Best is trial 87 with value: 0.8866301826616875.[0m
[32m[I 2022-04-15 17:39:36,335][0m Trial 161 finished with value: 0.8856763015741302 and parameters: {'n_hidden': 1024, 'mixture_components': 10, 'use_sparse_layer': True, 'use_sparse_loss': True, 'lmbd': 0.04924823831942045, 'use_batchnorm': False, 'use_dropout': True, 'dropout': 0.4789429498757321, 'mlp_size_1': 2, 'mlp_size_2': 4, 'mlp_size_3': 1, 'kernel': 'Weibull', 'loss_name': 'CensoredNLLLoss'}. Best is trial 87 with value: 0.8866301826616875.[0m
[32m[I 2022-04-15 17:42:20,932][0m Trial 162 finished with value: 0.8840519559076416 and parameters: {'n_hidden': 1024, 'mixture_components': 10, 'use_sparse_layer': True, 'use_sparse_loss': False, 'use_batchnorm': False, 'use_dropout': True, 'dropout': 0.5071303499783125, 'mlp_size_1': 2, 'mlp_size_2': 4, 'mlp_size_3': 1, 'kernel': 'Weibull', 'loss_name': 'CensoredNLLLoss'}. Best is trial 87 with value: 0.8866301826616875.[0m
[32m[I 2022-04-15 17:44:38,639][0m Trial 163 finished with value: 0.8837984941148818 and parameters: {'n_hidden': 1024, 'mixture_components': 10, 'use_sparse_layer': True, 'use_sparse_loss': True, 'lmbd': 0.054197532947055246, 'use_batchnorm': False, 'use_dropout': True, 'dropout': 0.39777476283820773, 'mlp_size_1': 2, 'mlp_size_2': 4, 'mlp_size_3': 1, 'kernel': 'Weibull', 'loss_name': 'CensoredNLLLoss'}. Best is trial 87 with value: 0.8866301826616875.[0m
[32m[I 2022-04-15 17:46:41,877][0m Trial 164 finished with value: 0.8812850998275383 and parameters: {'n_hidden': 1024, 'mixture_components': 10, 'use_sparse_layer': True, 'use_sparse_loss': False, 'use_batchnorm': False, 'use_dropout': True, 'dropout': 0.5597459638541433, 'mlp_size_1': 3, 'mlp_size_2': 4, 'mlp_size_3': 0, 'kernel': 'Weibull', 'loss_name': 'CensoredNLLLoss'}. Best is trial 87 with value: 0.8866301826616875.[0m
[32m[I 2022-04-15 17:48:56,453][0m Trial 165 finished with value: 0.8841123587625705 and parameters: {'n_hidden': 1024, 'mixture_components': 9, 'use_sparse_layer': True, 'use_sparse_loss': True, 'lmbd': 0.027017274175977064, 'use_batchnorm': False, 'use_dropout': True, 'dropout': 0.5421809258207017, 'mlp_size_1': 2, 'mlp_size_2': 4, 'mlp_size_3': 1, 'kernel': 'Weibull', 'loss_name': 'CensoredNLLLoss'}. Best is trial 87 with value: 0.8866301826616875.[0m
[32m[I 2022-04-15 17:51:16,529][0m Trial 166 finished with value: 0.8833568400754771 and parameters: {'n_hidden': 1024, 'mixture_components': 10, 'use_sparse_layer': True, 'use_sparse_loss': False, 'use_batchnorm': False, 'use_dropout': True, 'dropout': 0.6502652556048699, 'mlp_size_1': 1, 'mlp_size_2': 3, 'mlp_size_3': 1, 'kernel': 'Weibull', 'loss_name': 'CensoredNLLLoss'}. Best is trial 87 with value: 0.8866301826616875.[0m
[32m[I 2022-04-15 17:53:49,478][0m Trial 167 finished with value: 0.8828783974755616 and parameters: {'n_hidden': 64, 'mixture_components': 10, 'use_sparse_layer': True, 'use_sparse_loss': False, 'use_batchnorm': False, 'use_dropout': True, 'dropout': 0.4797759423342983, 'mlp_size_1': 2, 'mlp_size_2': 1, 'mlp_size_3': 0, 'kernel': 'Gamma', 'loss_name': 'CensoredNLLLoss'}. Best is trial 87 with value: 0.8866301826616875.[0m
[32m[I 2022-04-15 17:56:25,050][0m Trial 168 finished with value: 0.8854868471244893 and parameters: {'n_hidden': 1024, 'mixture_components': 10, 'use_sparse_layer': True, 'use_sparse_loss': True, 'lmbd': 0.06937682191827259, 'use_batchnorm': False, 'use_dropout': True, 'dropout': 0.596271057250917, 'mlp_size_1': 1, 'mlp_size_2': 3, 'mlp_size_3': 1, 'kernel': 'Weibull', 'loss_name': 'CensoredNLLLoss'}. Best is trial 87 with value: 0.8866301826616875.[0m
[32m[I 2022-04-15 17:58:59,039][0m Trial 169 finished with value: 0.8860057499409987 and parameters: {'n_hidden': 1024, 'mixture_components': 9, 'use_sparse_layer': True, 'use_sparse_loss': False, 'use_batchnorm': False, 'use_dropout': True, 'dropout': 0.598040520102055, 'mlp_size_1': 2, 'mlp_size_2': 3, 'mlp_size_3': 1, 'kernel': 'Weibull', 'loss_name': 'CensoredNLLLoss'}. Best is trial 87 with value: 0.8866301826616875.[0m
[32m[I 2022-04-15 18:01:39,453][0m Trial 170 finished with value: 0.8841709282937138 and parameters: {'n_hidden': 1024, 'mixture_components': 9, 'use_sparse_layer': True, 'use_sparse_loss': True, 'lmbd': 0.06423018182300502, 'use_batchnorm': False, 'use_dropout': True, 'dropout': 0.6131244281811826, 'mlp_size_1': 3, 'mlp_size_2': 3, 'mlp_size_3': 1, 'kernel': 'Weibull', 'loss_name': 'CensoredNLLLoss'}. Best is trial 87 with value: 0.8866301826616875.[0m
[32m[I 2022-04-15 18:04:07,537][0m Trial 171 finished with value: 0.8850966976754249 and parameters: {'n_hidden': 1024, 'mixture_components': 10, 'use_sparse_layer': True, 'use_sparse_loss': False, 'use_batchnorm': False, 'use_dropout': True, 'dropout': 0.5840532198493219, 'mlp_size_1': 2, 'mlp_size_2': 3, 'mlp_size_3': 1, 'kernel': 'Weibull', 'loss_name': 'CensoredNLLLoss'}. Best is trial 87 with value: 0.8866301826616875.[0m
[32m[I 2022-04-15 18:06:30,378][0m Trial 172 finished with value: 0.8857381885941651 and parameters: {'n_hidden': 1024, 'mixture_components': 10, 'use_sparse_layer': True, 'use_sparse_loss': False, 'use_batchnorm': False, 'use_dropout': True, 'dropout': 0.44722824364610625, 'mlp_size_1': 2, 'mlp_size_2': 3, 'mlp_size_3': 1, 'kernel': 'Weibull', 'loss_name': 'CensoredNLLLoss'}. Best is trial 87 with value: 0.8866301826616875.[0m
[32m[I 2022-04-15 18:09:10,467][0m Trial 173 finished with value: 0.7822137289619043 and parameters: {'n_hidden': 1024, 'mixture_components': 10, 'use_sparse_layer': True, 'use_sparse_loss': False, 'use_batchnorm': False, 'use_dropout': True, 'dropout': 0.5224813062758638, 'mlp_size_1': 2, 'mlp_size_2': 3, 'mlp_size_3': 1, 'kernel': 'Weibull', 'loss_name': 'CensoredNLLLoss'}. Best is trial 87 with value: 0.8866301826616875.[0m
[32m[I 2022-04-15 18:11:38,426][0m Trial 174 finished with value: 0.88533297315955 and parameters: {'n_hidden': 1024, 'mixture_components': 4, 'use_sparse_layer': True, 'use_sparse_loss': False, 'use_batchnorm': False, 'use_dropout': True, 'dropout': 0.6028359336400977, 'mlp_size_1': 2, 'mlp_size_2': 3, 'mlp_size_3': 1, 'kernel': 'Weibull', 'loss_name': 'CensoredNLLLoss'}. Best is trial 87 with value: 0.8866301826616875.[0m
[32m[I 2022-04-15 18:13:52,116][0m Trial 175 finished with value: 0.8846530145773741 and parameters: {'n_hidden': 1024, 'mixture_components': 4, 'use_sparse_layer': True, 'use_sparse_loss': False, 'use_batchnorm': False, 'use_dropout': True, 'dropout': 0.6233094869765755, 'mlp_size_1': 1, 'mlp_size_2': 3, 'mlp_size_3': 1, 'kernel': 'Weibull', 'loss_name': 'CensoredNLLLoss'}. Best is trial 87 with value: 0.8866301826616875.[0m
[32m[I 2022-04-15 18:16:08,001][0m Trial 176 finished with value: 0.8847764670768286 and parameters: {'n_hidden': 1024, 'mixture_components': 3, 'use_sparse_layer': True, 'use_sparse_loss': False, 'use_batchnorm': False, 'use_dropout': True, 'dropout': 0.5931865773323824, 'mlp_size_1': 2, 'mlp_size_2': 3, 'mlp_size_3': 1, 'kernel': 'Weibull', 'loss_name': 'CensoredNLLLoss'}. Best is trial 87 with value: 0.8866301826616875.[0m
[32m[I 2022-04-15 18:18:49,171][0m Trial 177 finished with value: 0.8849884072205692 and parameters: {'n_hidden': 1024, 'mixture_components': 5, 'use_sparse_layer': True, 'use_sparse_loss': True, 'lmbd': 0.01513963588807875, 'use_batchnorm': False, 'use_dropout': True, 'dropout': 0.548629924217603, 'mlp_size_1': 2, 'mlp_size_2': 3, 'mlp_size_3': 1, 'kernel': 'Weibull', 'loss_name': 'CensoredNLLLoss'}. Best is trial 87 with value: 0.8866301826616875.[0m
[32m[I 2022-04-15 18:24:16,681][0m Trial 178 finished with value: 0.8798023788281585 and parameters: {'n_hidden': 1024, 'mixture_components': 2, 'use_sparse_layer': True, 'use_sparse_loss': False, 'use_batchnorm': True, 'use_dropout': True, 'dropout': 0.6425651015186844, 'mlp_size_1': 3, 'mlp_size_2': 3, 'mlp_size_3': 1, 'kernel': 'Weibull', 'loss_name': 'AlternativeNLLLoss'}. Best is trial 87 with value: 0.8866301826616875.[0m
[32m[I 2022-04-15 18:26:14,370][0m Trial 179 finished with value: 0.8438020872288702 and parameters: {'n_hidden': 1024, 'mixture_components': 5, 'use_sparse_layer': True, 'use_sparse_loss': True, 'lmbd': 0.0995644993525833, 'use_batchnorm': False, 'use_dropout': True, 'dropout': 0.5991119134090697, 'mlp_size_1': 1, 'mlp_size_2': 3, 'mlp_size_3': 1, 'kernel': 'Gumbel', 'loss_name': 'CensoredNLLLoss'}. Best is trial 87 with value: 0.8866301826616875.[0m
[32m[I 2022-04-15 18:28:35,750][0m Trial 180 finished with value: 0.7836309223867622 and parameters: {'n_hidden': 1024, 'mixture_components': 4, 'use_sparse_layer': False, 'use_batchnorm': False, 'use_dropout': True, 'dropout': 0.6651698071966453, 'mlp_size_1': 2, 'mlp_size_2': 3, 'mlp_size_3': 1, 'kernel': 'Weibull', 'loss_name': 'CensoredNLLLoss'}. Best is trial 87 with value: 0.8866301826616875.[0m
[32m[I 2022-04-15 18:31:17,540][0m Trial 181 finished with value: 0.7865764409849755 and parameters: {'n_hidden': 1024, 'mixture_components': 10, 'use_sparse_layer': True, 'use_sparse_loss': False, 'use_batchnorm': False, 'use_dropout': True, 'dropout': 0.7125728827628671, 'mlp_size_1': 2, 'mlp_size_2': 3, 'mlp_size_3': 1, 'kernel': 'Weibull', 'loss_name': 'CensoredNLLLoss'}. Best is trial 87 with value: 0.8866301826616875.[0m
[32m[I 2022-04-15 18:33:38,906][0m Trial 182 finished with value: 0.8802643580625761 and parameters: {'n_hidden': 1024, 'mixture_components': 1, 'use_sparse_layer': True, 'use_sparse_loss': False, 'use_batchnorm': False, 'use_dropout': True, 'dropout': 0.3500682206206867, 'mlp_size_1': 2, 'mlp_size_2': 3, 'mlp_size_3': 1, 'kernel': 'Weibull', 'loss_name': 'CensoredNLLLoss'}. Best is trial 87 with value: 0.8866301826616875.[0m
[32m[I 2022-04-15 18:36:00,870][0m Trial 183 finished with value: 0.7846397033756842 and parameters: {'n_hidden': 1024, 'mixture_components': 3, 'use_sparse_layer': True, 'use_sparse_loss': False, 'use_batchnorm': False, 'use_dropout': True, 'dropout': 0.5700648868033962, 'mlp_size_1': 2, 'mlp_size_2': 3, 'mlp_size_3': 1, 'kernel': 'Weibull', 'loss_name': 'CensoredNLLLoss'}. Best is trial 87 with value: 0.8866301826616875.[0m
[32m[I 2022-04-15 18:38:21,202][0m Trial 184 finished with value: 0.8821368210058347 and parameters: {'n_hidden': 1024, 'mixture_components': 10, 'use_sparse_layer': True, 'use_sparse_loss': False, 'use_batchnorm': False, 'use_dropout': True, 'dropout': 0.5497116910068464, 'mlp_size_1': 2, 'mlp_size_2': 3, 'mlp_size_3': 1, 'kernel': 'Weibull', 'loss_name': 'CensoredNLLLoss'}. Best is trial 87 with value: 0.8866301826616875.[0m
[32m[I 2022-04-15 18:40:52,702][0m Trial 185 finished with value: 0.8844508585305269 and parameters: {'n_hidden': 1024, 'mixture_components': 6, 'use_sparse_layer': True, 'use_sparse_loss': False, 'use_batchnorm': False, 'use_dropout': True, 'dropout': 0.43326657441672034, 'mlp_size_1': 2, 'mlp_size_2': 3, 'mlp_size_3': 1, 'kernel': 'Weibull', 'loss_name': 'CensoredNLLLoss'}. Best is trial 87 with value: 0.8866301826616875.[0m
[32m[I 2022-04-15 18:43:24,257][0m Trial 186 finished with value: 0.7848394477707027 and parameters: {'n_hidden': 1024, 'mixture_components': 10, 'use_sparse_layer': True, 'use_sparse_loss': False, 'use_batchnorm': False, 'use_dropout': True, 'dropout': 0.5138285257875924, 'mlp_size_1': 2, 'mlp_size_2': 3, 'mlp_size_3': 1, 'kernel': 'Normal', 'loss_name': 'CensoredNLLLoss'}. Best is trial 87 with value: 0.8866301826616875.[0m
[32m[I 2022-04-15 18:46:08,441][0m Trial 187 finished with value: 0.8842015104620666 and parameters: {'n_hidden': 1024, 'mixture_components': 10, 'use_sparse_layer': True, 'use_sparse_loss': True, 'lmbd': 0.04220645627138452, 'use_batchnorm': False, 'use_dropout': True, 'dropout': 0.3863132580444962, 'mlp_size_1': 3, 'mlp_size_2': 3, 'mlp_size_3': 1, 'kernel': 'Weibull', 'loss_name': 'CensoredNLLLoss'}. Best is trial 87 with value: 0.8866301826616875.[0m
[32m[I 2022-04-15 18:48:36,061][0m Trial 188 finished with value: 0.8846354636213715 and parameters: {'n_hidden': 1024, 'mixture_components': 10, 'use_sparse_layer': True, 'use_sparse_loss': False, 'use_batchnorm': False, 'use_dropout': True, 'dropout': 0.49469821647548556, 'mlp_size_1': 2, 'mlp_size_2': 3, 'mlp_size_3': 1, 'kernel': 'Weibull', 'loss_name': 'CensoredNLLLoss'}. Best is trial 87 with value: 0.8866301826616875.[0m
[32m[I 2022-04-15 18:50:59,017][0m Trial 189 finished with value: 0.8420810093099806 and parameters: {'n_hidden': 32, 'mixture_components': 10, 'use_sparse_layer': True, 'use_sparse_loss': False, 'use_batchnorm': False, 'use_dropout': True, 'dropout': 0.6259004821760463, 'mlp_size_1': 2, 'mlp_size_2': 0, 'mlp_size_3': 0, 'kernel': 'Weibull', 'loss_name': 'NLLLoss'}. Best is trial 87 with value: 0.8866301826616875.[0m
[32m[I 2022-04-15 18:54:02,181][0m Trial 190 finished with value: 0.7766625897076429 and parameters: {'n_hidden': 1024, 'mixture_components': 9, 'use_sparse_layer': True, 'use_sparse_loss': True, 'lmbd': 0.011445441078267901, 'use_batchnorm': False, 'use_dropout': True, 'dropout': 0.4628954086193885, 'mlp_size_1': 1, 'mlp_size_2': 3, 'mlp_size_3': 1, 'kernel': 'LogNormal', 'loss_name': 'CensoredNLLLoss'}. Best is trial 87 with value: 0.8866301826616875.[0m
[32m[I 2022-04-15 18:56:57,186][0m Trial 191 finished with value: 0.8801983938578118 and parameters: {'n_hidden': 2048, 'mixture_components': 10, 'use_sparse_layer': True, 'use_sparse_loss': False, 'use_batchnorm': False, 'use_dropout': True, 'dropout': 0.45789452794908764, 'mlp_size_1': 8, 'mlp_size_2': 0, 'mlp_size_3': 0, 'kernel': 'Weibull', 'loss_name': 'CensoredNLLLoss'}. Best is trial 87 with value: 0.8866301826616875.[0m
[32m[I 2022-04-15 18:58:45,201][0m Trial 192 finished with value: -0.5 and parameters: {'n_hidden': 1024, 'mixture_components': 10, 'use_sparse_layer': True, 'use_sparse_loss': False, 'use_batchnorm': False, 'use_dropout': True, 'dropout': 0.968166714741518, 'mlp_size_1': 2, 'mlp_size_2': 3, 'mlp_size_3': 1, 'kernel': 'Weibull', 'loss_name': 'CensoredNLLLoss'}. Best is trial 87 with value: 0.8866301826616875.[0m
[32m[I 2022-04-15 19:01:13,932][0m Trial 193 finished with value: 0.8824716111845156 and parameters: {'n_hidden': 1024, 'mixture_components': 10, 'use_sparse_layer': True, 'use_sparse_loss': False, 'use_batchnorm': False, 'use_dropout': True, 'dropout': 0.5954087126160053, 'mlp_size_1': 2, 'mlp_size_2': 4, 'mlp_size_3': 1, 'kernel': 'Weibull', 'loss_name': 'CensoredNLLLoss'}. Best is trial 87 with value: 0.8866301826616875.[0m
[32m[I 2022-04-15 19:03:38,652][0m Trial 194 finished with value: 0.8852643360619569 and parameters: {'n_hidden': 1024, 'mixture_components': 10, 'use_sparse_layer': True, 'use_sparse_loss': False, 'use_batchnorm': False, 'use_dropout': True, 'dropout': 0.36531355881638616, 'mlp_size_1': 2, 'mlp_size_2': 3, 'mlp_size_3': 1, 'kernel': 'Weibull', 'loss_name': 'CensoredNLLLoss'}. Best is trial 87 with value: 0.8866301826616875.[0m
[32m[I 2022-04-15 19:06:17,432][0m Trial 195 finished with value: 0.8856507805852682 and parameters: {'n_hidden': 1024, 'mixture_components': 10, 'use_sparse_layer': True, 'use_sparse_loss': False, 'use_batchnorm': False, 'use_dropout': True, 'dropout': 0.3380603195160325, 'mlp_size_1': 2, 'mlp_size_2': 3, 'mlp_size_3': 1, 'kernel': 'Weibull', 'loss_name': 'CensoredNLLLoss'}. Best is trial 87 with value: 0.8866301826616875.[0m
[32m[I 2022-04-15 19:08:25,254][0m Trial 196 finished with value: 0.8828373350023607 and parameters: {'n_hidden': 1024, 'mixture_components': 10, 'use_sparse_layer': True, 'use_sparse_loss': False, 'use_batchnorm': False, 'use_dropout': True, 'dropout': 0.37047851562773276, 'mlp_size_1': 1, 'mlp_size_2': 3, 'mlp_size_3': 1, 'kernel': 'Weibull', 'loss_name': 'CensoredNLLLoss'}. Best is trial 87 with value: 0.8866301826616875.[0m
[32m[I 2022-04-15 19:10:58,475][0m Trial 197 finished with value: 0.8840514401732957 and parameters: {'n_hidden': 1024, 'mixture_components': 10, 'use_sparse_layer': True, 'use_sparse_loss': False, 'use_batchnorm': False, 'use_dropout': True, 'dropout': 0.3593144126428724, 'mlp_size_1': 2, 'mlp_size_2': 3, 'mlp_size_3': 1, 'kernel': 'Weibull', 'loss_name': 'CensoredNLLLoss'}. Best is trial 87 with value: 0.8866301826616875.[0m
[32m[I 2022-04-15 19:13:45,259][0m Trial 198 finished with value: 0.8835629750404695 and parameters: {'n_hidden': 1024, 'mixture_components': 10, 'use_sparse_layer': True, 'use_sparse_loss': True, 'lmbd': 0.02355810627498886, 'use_batchnorm': False, 'use_dropout': True, 'dropout': 0.32689684029390026, 'mlp_size_1': 3, 'mlp_size_2': 3, 'mlp_size_3': 1, 'kernel': 'LogLogistic', 'loss_name': 'CensoredNLLLoss'}. Best is trial 87 with value: 0.8866301826616875.[0m
[32m[I 2022-04-15 19:16:35,726][0m Trial 199 finished with value: 0.8832585906975581 and parameters: {'n_hidden': 1024, 'mixture_components': 10, 'use_sparse_layer': True, 'use_sparse_loss': False, 'use_batchnorm': False, 'use_dropout': True, 'dropout': 0.5681043432769727, 'mlp_size_1': 1, 'mlp_size_2': 6, 'mlp_size_3': 0, 'kernel': 'Weibull', 'loss_name': 'CensoredNLLLoss'}. Best is trial 87 with value: 0.8866301826616875.[0m
