[32m[I 2022-04-15 03:24:50,163][0m Trial 94 finished with value: 0.5 and parameters: {'loss': 'squared', 'learning_rate': 0.00013795349082496838, 'n_estimators': 224, 'criterion': 'absolute_error', 'min_samples_split': 5, 'min_samples_leaf': 3, 'min_weight_fraction_leaf': 0.24261736638598733, 'min_impurity_decrease': 0.4698490911103621, 'max_features': 0.09889456953473398, 'subsample': 0.1507594217466974, 'dropout_rate': 0.6495115006781891, 'ccp_alpha': 3.8095930613628983}. Best is trial 0 with value: 0.5.[0m
[32m[I 2022-04-15 03:25:04,071][0m Trial 95 finished with value: 0.5 and parameters: {'loss': 'squared', 'learning_rate': 0.00014799369665153208, 'n_estimators': 289, 'criterion': 'absolute_error', 'min_samples_split': 6, 'min_samples_leaf': 3, 'min_weight_fraction_leaf': 0.45874876104126827, 'min_impurity_decrease': 0.5641958373302011, 'max_features': 0.02899026033251055, 'subsample': 0.10302086561033055, 'dropout_rate': 0.5067468031598811, 'ccp_alpha': 4.192770768452162}. Best is trial 0 with value: 0.5.[0m
[32m[I 2022-04-15 03:25:07,443][0m Trial 96 finished with value: 0.5 and parameters: {'loss': 'squared', 'learning_rate': 0.00023863938062000344, 'n_estimators': 146, 'criterion': 'absolute_error', 'min_samples_split': 6, 'min_samples_leaf': 6, 'min_weight_fraction_leaf': 0.1836384939379455, 'min_impurity_decrease': 0.11816569928833169, 'max_features': 0.04739468835129447, 'subsample': 0.2353883619553367, 'dropout_rate': 0.6226391639041003, 'ccp_alpha': 3.633217146369465}. Best is trial 0 with value: 0.5.[0m
[32m[I 2022-04-15 03:25:15,917][0m Trial 97 finished with value: 0.5 and parameters: {'loss': 'squared', 'learning_rate': 0.00011582208752522901, 'n_estimators': 268, 'criterion': 'absolute_error', 'min_samples_split': 5, 'min_samples_leaf': 6, 'min_weight_fraction_leaf': 0.16757492067461482, 'min_impurity_decrease': 0.4195005372391397, 'max_features': 0.031228483415688818, 'subsample': 0.025485286458775985, 'dropout_rate': 0.6572477913088127, 'ccp_alpha': 4.046390031702722}. Best is trial 0 with value: 0.5.[0m
[32m[I 2022-04-15 03:25:21,109][0m Trial 98 finished with value: 0.5 and parameters: {'loss': 'squared', 'learning_rate': 3.152233860398473e-05, 'n_estimators': 194, 'criterion': 'absolute_error', 'min_samples_split': 6, 'min_samples_leaf': 6, 'min_weight_fraction_leaf': 0.2143038610317308, 'min_impurity_decrease': 0.86153817326921, 'max_features': 0.0410926544617834, 'subsample': 0.011240747798368691, 'dropout_rate': 0.5903148695308719, 'ccp_alpha': 4.169680803652376}. Best is trial 0 with value: 0.5.[0m
[32m[I 2022-04-15 03:25:54,312][0m Trial 99 finished with value: 0.5 and parameters: {'loss': 'squared', 'learning_rate': 2.1249071414261653e-06, 'n_estimators': 596, 'criterion': 'absolute_error', 'min_samples_split': 5, 'min_samples_leaf': 6, 'min_weight_fraction_leaf': 0.145874050479349, 'min_impurity_decrease': 0.042134435005338575, 'max_features': 0.06356618794470939, 'subsample': 0.05649586419533177, 'dropout_rate': 0.7187168661813794, 'ccp_alpha': 4.5074271209775505}. Best is trial 0 with value: 0.5.[0m
[32m[I 2022-04-15 03:26:11,539][0m Trial 100 finished with value: 0.5 and parameters: {'loss': 'squared', 'learning_rate': 4.273374515453571e-06, 'n_estimators': 466, 'criterion': 'absolute_error', 'min_samples_split': 5, 'min_samples_leaf': 10, 'min_weight_fraction_leaf': 0.1679928423528137, 'min_impurity_decrease': 0.2478886412084203, 'max_features': 0.1012647399654413, 'subsample': 0.09501046379322575, 'dropout_rate': 0.7944472275397253, 'ccp_alpha': 4.109651342914849}. Best is trial 0 with value: 0.5.[0m
[32m[I 2022-04-15 03:26:55,988][0m Trial 101 finished with value: 0.5 and parameters: {'loss': 'squared', 'learning_rate': 0.0015505381083129458, 'n_estimators': 645, 'criterion': 'absolute_error', 'min_samples_split': 4, 'min_samples_leaf': 10, 'min_weight_fraction_leaf': 0.13190673804131442, 'min_impurity_decrease': 0.9964339521816471, 'max_features': 0.9010958960206984, 'subsample': 0.048352060337549796, 'dropout_rate': 0.6869469551416469, 'ccp_alpha': 4.693967536157049}. Best is trial 0 with value: 0.5.[0m
[32m[I 2022-04-15 03:28:07,530][0m Trial 102 finished with value: 0.5 and parameters: {'loss': 'squared', 'learning_rate': 0.004296903599073618, 'n_estimators': 579, 'criterion': 'absolute_error', 'min_samples_split': 5, 'min_samples_leaf': 10, 'min_weight_fraction_leaf': 0.19842224769971736, 'min_impurity_decrease': 0.35696459096479016, 'max_features': 0.9223224463691242, 'subsample': 0.909605397607887, 'dropout_rate': 0.6399572572829301, 'ccp_alpha': 3.930823721986307}. Best is trial 0 with value: 0.5.[0m
[32m[I 2022-04-15 03:28:51,615][0m Trial 103 finished with value: 0.5 and parameters: {'loss': 'coxph', 'learning_rate': 0.0021406802155028225, 'n_estimators': 303, 'criterion': 'absolute_error', 'min_samples_split': 6, 'min_samples_leaf': 9, 'min_weight_fraction_leaf': 0.15465049441293327, 'min_impurity_decrease': 0.21848920609547817, 'max_features': 0.7768102131648018, 'subsample': 0.9135830525731041, 'dropout_rate': 0.6055363520979895, 'ccp_alpha': 4.3444694246003746}. Best is trial 0 with value: 0.5.[0m
[32m[I 2022-04-15 03:29:49,625][0m Trial 104 finished with value: 0.5 and parameters: {'loss': 'coxph', 'learning_rate': 1.3240688697865912e-06, 'n_estimators': 659, 'criterion': 'squared_error', 'min_samples_split': 4, 'min_samples_leaf': 9, 'min_weight_fraction_leaf': 0.1266021343306206, 'min_impurity_decrease': 0.3281524838398137, 'max_features': 0.7463858107959076, 'subsample': 0.8511979394748103, 'dropout_rate': 0.8825971254717895, 'ccp_alpha': 1.7135724783749617}. Best is trial 0 with value: 0.5.[0m
[32m[I 2022-04-15 03:31:10,399][0m Trial 105 finished with value: 0.5 and parameters: {'loss': 'coxph', 'learning_rate': 0.002526203049516567, 'n_estimators': 789, 'criterion': 'squared_error', 'min_samples_split': 9, 'min_samples_leaf': 10, 'min_weight_fraction_leaf': 0.17702608725495242, 'min_impurity_decrease': 0.2104091943403714, 'max_features': 0.978293457673026, 'subsample': 0.9593592737073376, 'dropout_rate': 0.8586479666761186, 'ccp_alpha': 1.834986060802863}. Best is trial 0 with value: 0.5.[0m
[32m[I 2022-04-15 03:33:25,106][0m Trial 106 finished with value: 0.5 and parameters: {'loss': 'coxph', 'learning_rate': 0.002792283691843694, 'n_estimators': 958, 'criterion': 'squared_error', 'min_samples_split': 8, 'min_samples_leaf': 7, 'min_weight_fraction_leaf': 0.14795499125538594, 'min_impurity_decrease': 0.26947282228023667, 'max_features': 0.66409681761073, 'subsample': 0.7465266904061498, 'dropout_rate': 0.7376970891170631, 'ccp_alpha': 2.166290779742166}. Best is trial 0 with value: 0.5.[0m
[32m[I 2022-04-15 03:34:55,066][0m Trial 107 finished with value: 0.5 and parameters: {'loss': 'coxph', 'learning_rate': 0.0016690316057262685, 'n_estimators': 984, 'criterion': 'friedman_mse', 'min_samples_split': 9, 'min_samples_leaf': 7, 'min_weight_fraction_leaf': 0.020201921062759535, 'min_impurity_decrease': 0.3559616913371674, 'max_features': 0.8372506571402438, 'subsample': 0.9366246465967367, 'dropout_rate': 0.9405924905584345, 'ccp_alpha': 1.3954727210607323}. Best is trial 0 with value: 0.5.[0m
[32m[I 2022-04-15 03:36:10,111][0m Trial 108 finished with value: 0.5 and parameters: {'loss': 'coxph', 'learning_rate': 0.010953612294931801, 'n_estimators': 876, 'criterion': 'friedman_mse', 'min_samples_split': 9, 'min_samples_leaf': 8, 'min_weight_fraction_leaf': 0.0011096519104366355, 'min_impurity_decrease': 0.285626417818337, 'max_features': 0.5639178839446144, 'subsample': 0.8554245821457684, 'dropout_rate': 0.917118473737751, 'ccp_alpha': 2.3641744164846203}. Best is trial 0 with value: 0.5.[0m
[32m[I 2022-04-15 03:37:23,896][0m Trial 109 finished with value: 0.5 and parameters: {'loss': 'coxph', 'learning_rate': 0.028164965640116665, 'n_estimators': 811, 'criterion': 'friedman_mse', 'min_samples_split': 7, 'min_samples_leaf': 8, 'min_weight_fraction_leaf': 0.03408130735872873, 'min_impurity_decrease': 0.2593291275574299, 'max_features': 0.5391965503675079, 'subsample': 0.7387821070432143, 'dropout_rate': 0.907031142571197, 'ccp_alpha': 2.142257277512006}. Best is trial 0 with value: 0.5.[0m
[32m[I 2022-04-15 03:38:21,894][0m Trial 110 finished with value: 0.5 and parameters: {'loss': 'coxph', 'learning_rate': 0.004755354317248567, 'n_estimators': 724, 'criterion': 'friedman_mse', 'min_samples_split': 7, 'min_samples_leaf': 8, 'min_weight_fraction_leaf': 0.08177917998415977, 'min_impurity_decrease': 0.323515734499424, 'max_features': 0.7004352433778227, 'subsample': 0.5802332563212785, 'dropout_rate': 0.9240114570937751, 'ccp_alpha': 1.9018838366361004}. Best is trial 0 with value: 0.5.[0m
[32m[I 2022-04-15 03:39:33,271][0m Trial 111 finished with value: 0.5 and parameters: {'loss': 'coxph', 'learning_rate': 0.00039471765893252876, 'n_estimators': 719, 'criterion': 'friedman_mse', 'min_samples_split': 8, 'min_samples_leaf': 7, 'min_weight_fraction_leaf': 0.11542229406919986, 'min_impurity_decrease': 0.3729233239125623, 'max_features': 0.49053806993386395, 'subsample': 0.6965430708816628, 'dropout_rate': 0.8320267817661795, 'ccp_alpha': 1.7204699196465207}. Best is trial 0 with value: 0.5.[0m
[32m[I 2022-04-15 03:41:06,221][0m Trial 112 finished with value: 0.5 and parameters: {'loss': 'coxph', 'learning_rate': 0.09726010580889523, 'n_estimators': 825, 'criterion': 'friedman_mse', 'min_samples_split': 10, 'min_samples_leaf': 9, 'min_weight_fraction_leaf': 0.09877003137102253, 'min_impurity_decrease': 0.42906797733432794, 'max_features': 0.6387901561553475, 'subsample': 0.4847626837186925, 'dropout_rate': 0.7913396630228228, 'ccp_alpha': 2.1171800406917356}. Best is trial 0 with value: 0.5.[0m
[32m[I 2022-04-15 03:41:45,313][0m Trial 113 finished with value: 0.5 and parameters: {'loss': 'coxph', 'learning_rate': 0.010831398064494586, 'n_estimators': 519, 'criterion': 'friedman_mse', 'min_samples_split': 10, 'min_samples_leaf': 9, 'min_weight_fraction_leaf': 0.08643602739859653, 'min_impurity_decrease': 0.9281134322259071, 'max_features': 0.4247303466383977, 'subsample': 0.43113241699313554, 'dropout_rate': 0.9478414009799352, 'ccp_alpha': 2.9121916509471784}. Best is trial 0 with value: 0.5.[0m
[32m[I 2022-04-15 03:42:24,695][0m Trial 114 finished with value: 0.5 and parameters: {'loss': 'coxph', 'learning_rate': 0.008389389939692942, 'n_estimators': 524, 'criterion': 'friedman_mse', 'min_samples_split': 10, 'min_samples_leaf': 9, 'min_weight_fraction_leaf': 0.0643624460274793, 'min_impurity_decrease': 0.8709421648131506, 'max_features': 0.9978221299525394, 'subsample': 0.5229554924635395, 'dropout_rate': 0.8903282131729109, 'ccp_alpha': 2.5939757807169137}. Best is trial 0 with value: 0.5.[0m
[32m[I 2022-04-15 03:43:21,543][0m Trial 115 finished with value: 0.5 and parameters: {'loss': 'coxph', 'learning_rate': 0.03421843863535416, 'n_estimators': 890, 'criterion': 'friedman_mse', 'min_samples_split': 10, 'min_samples_leaf': 5, 'min_weight_fraction_leaf': 0.013784091912083993, 'min_impurity_decrease': 0.7174167662451345, 'max_features': 0.38970729533267134, 'subsample': 0.4645419139297856, 'dropout_rate': 0.9955373618718704, 'ccp_alpha': 2.4576893791984293}. Best is trial 0 with value: 0.5.[0m
[32m[I 2022-04-15 03:46:12,323][0m Trial 116 finished with value: 0.5 and parameters: {'loss': 'coxph', 'learning_rate': 0.01859633347786236, 'n_estimators': 760, 'criterion': 'friedman_mse', 'min_samples_split': 10, 'min_samples_leaf': 5, 'min_weight_fraction_leaf': 0.31875826816610153, 'min_impurity_decrease': 0.7125822671061313, 'max_features': 0.3692264160305128, 'subsample': 0.6352583884359505, 'dropout_rate': 0.16296317070292665, 'ccp_alpha': 1.6193990236778264}. Best is trial 0 with value: 0.5.[0m
[32m[I 2022-04-15 03:49:57,293][0m Trial 117 finished with value: 0.5 and parameters: {'loss': 'coxph', 'learning_rate': 0.05964743095579452, 'n_estimators': 920, 'criterion': 'friedman_mse', 'min_samples_split': 10, 'min_samples_leaf': 7, 'min_weight_fraction_leaf': 0.30085301051310914, 'min_impurity_decrease': 0.834533128099719, 'max_features': 0.5138641376099468, 'subsample': 0.4055865909399278, 'dropout_rate': 0.2982389755016429, 'ccp_alpha': 2.549070274380144}. Best is trial 0 with value: 0.5.[0m
[32m[I 2022-04-15 03:50:08,391][0m Trial 118 finished with value: 0.5 and parameters: {'loss': 'coxph', 'learning_rate': 0.04261718872193424, 'n_estimators': 135, 'criterion': 'friedman_mse', 'min_samples_split': 10, 'min_samples_leaf': 4, 'min_weight_fraction_leaf': 0.3315016867987894, 'min_impurity_decrease': 0.7282904454207472, 'max_features': 0.41940712725757157, 'subsample': 0.65700215555606, 'dropout_rate': 0.32588909216315404, 'ccp_alpha': 2.67377439489469}. Best is trial 0 with value: 0.5.[0m
[32m[I 2022-04-15 03:50:14,935][0m Trial 119 finished with value: 0.7568366180073333 and parameters: {'loss': 'coxph', 'learning_rate': 0.01753474705229002, 'n_estimators': 114, 'criterion': 'friedman_mse', 'min_samples_split': 10, 'min_samples_leaf': 4, 'min_weight_fraction_leaf': 0.35524554859793434, 'min_impurity_decrease': 0.7778777009025194, 'max_features': 0.4659995326085279, 'subsample': 0.43303306617355347, 'dropout_rate': 0.9613686793925588, 'ccp_alpha': 0.05203448710369363}. Best is trial 119 with value: 0.7568366180073333.[0m
[32m[I 2022-04-15 03:50:22,546][0m Trial 120 finished with value: 0.7572000007384097 and parameters: {'loss': 'coxph', 'learning_rate': 0.02227217384327247, 'n_estimators': 101, 'criterion': 'friedman_mse', 'min_samples_split': 2, 'min_samples_leaf': 4, 'min_weight_fraction_leaf': 0.3501612577938997, 'min_impurity_decrease': 0.7499084325922126, 'max_features': 0.4662862107987723, 'subsample': 0.43616674947194106, 'dropout_rate': 0.2258162896975079, 'ccp_alpha': 0.005160132980151222}. Best is trial 120 with value: 0.7572000007384097.[0m
[32m[I 2022-04-15 03:50:31,670][0m Trial 121 finished with value: 0.6743624146605087 and parameters: {'loss': 'coxph', 'learning_rate': 0.02446135577995533, 'n_estimators': 112, 'criterion': 'friedman_mse', 'min_samples_split': 10, 'min_samples_leaf': 4, 'min_weight_fraction_leaf': 0.3460047583241719, 'min_impurity_decrease': 0.7702609142399421, 'max_features': 0.516265804118788, 'subsample': 0.3948265579420381, 'dropout_rate': 0.2510816818376623, 'ccp_alpha': 0.20523911846274898}. Best is trial 120 with value: 0.7572000007384097.[0m
[32m[I 2022-04-15 03:50:39,911][0m Trial 122 finished with value: 0.7515924403809694 and parameters: {'loss': 'coxph', 'learning_rate': 0.02214373867463469, 'n_estimators': 103, 'criterion': 'friedman_mse', 'min_samples_split': 10, 'min_samples_leaf': 4, 'min_weight_fraction_leaf': 0.35399506758120836, 'min_impurity_decrease': 0.7556043118089497, 'max_features': 0.5101486765446067, 'subsample': 0.40015895359326215, 'dropout_rate': 0.2500612154201156, 'ccp_alpha': 0.05267311750007356}. Best is trial 120 with value: 0.7572000007384097.[0m
[32m[I 2022-04-15 03:50:48,197][0m Trial 123 finished with value: 0.7516167827014684 and parameters: {'loss': 'coxph', 'learning_rate': 0.022817606657369007, 'n_estimators': 104, 'criterion': 'friedman_mse', 'min_samples_split': 2, 'min_samples_leaf': 4, 'min_weight_fraction_leaf': 0.35571691559807583, 'min_impurity_decrease': 0.7536295777476967, 'max_features': 0.47618105595086113, 'subsample': 0.40266808248935987, 'dropout_rate': 0.2425241762231316, 'ccp_alpha': 0.05208254444931845}. Best is trial 120 with value: 0.7572000007384097.[0m
[32m[I 2022-04-15 03:50:51,179][0m Trial 124 finished with value: 0.28851689300153793 and parameters: {'loss': 'squared', 'learning_rate': 0.01685143765946794, 'n_estimators': 100, 'criterion': 'friedman_mse', 'min_samples_split': 2, 'min_samples_leaf': 4, 'min_weight_fraction_leaf': 0.4005947744638131, 'min_impurity_decrease': 0.7733741507402808, 'max_features': 0.46947623427172813, 'subsample': 0.4338166693371911, 'dropout_rate': 0.22572082358443224, 'ccp_alpha': 0.033492071021061734}. Best is trial 120 with value: 0.7572000007384097.[0m
[32m[I 2022-04-15 03:51:00,232][0m Trial 125 finished with value: 0.5 and parameters: {'loss': 'coxph', 'learning_rate': 0.028188643188237616, 'n_estimators': 111, 'criterion': 'friedman_mse', 'min_samples_split': 2, 'min_samples_leaf': 4, 'min_weight_fraction_leaf': 0.3582134420665795, 'min_impurity_decrease': 0.7534943847574573, 'max_features': 0.5389398173650752, 'subsample': 0.3864599572538343, 'dropout_rate': 0.18919683002166743, 'ccp_alpha': 0.25653187905982033}. Best is trial 120 with value: 0.7572000007384097.[0m
[32m[I 2022-04-15 03:51:08,934][0m Trial 126 finished with value: 0.6743624146605087 and parameters: {'loss': 'coxph', 'learning_rate': 0.02309269978144951, 'n_estimators': 107, 'criterion': 'friedman_mse', 'min_samples_split': 2, 'min_samples_leaf': 4, 'min_weight_fraction_leaf': 0.3437199770300484, 'min_impurity_decrease': 0.6662201115889889, 'max_features': 0.46461401057868285, 'subsample': 0.36369103191682484, 'dropout_rate': 0.2468336768357312, 'ccp_alpha': 0.1326530440277629}. Best is trial 120 with value: 0.7572000007384097.[0m
[32m[I 2022-04-15 03:51:17,361][0m Trial 127 finished with value: 0.6743624146605087 and parameters: {'loss': 'coxph', 'learning_rate': 0.02447404124496427, 'n_estimators': 105, 'criterion': 'friedman_mse', 'min_samples_split': 2, 'min_samples_leaf': 4, 'min_weight_fraction_leaf': 0.3494803963833947, 'min_impurity_decrease': 0.675417853153988, 'max_features': 0.4803169972891371, 'subsample': 0.3683049696091582, 'dropout_rate': 0.24645489379226415, 'ccp_alpha': 0.15379198634031627}. Best is trial 120 with value: 0.7572000007384097.[0m
[32m[I 2022-04-15 03:51:20,694][0m Trial 128 finished with value: 0.5 and parameters: {'loss': 'squared', 'learning_rate': 0.023768336510142395, 'n_estimators': 117, 'criterion': 'squared_error', 'min_samples_split': 2, 'min_samples_leaf': 4, 'min_weight_fraction_leaf': 0.42798789183576363, 'min_impurity_decrease': 0.67181608403332, 'max_features': 0.41216274151755333, 'subsample': 0.34627854334255564, 'dropout_rate': 0.24511117699890844, 'ccp_alpha': 0.171878907082062}. Best is trial 120 with value: 0.7572000007384097.[0m
[32m[I 2022-04-15 03:51:29,264][0m Trial 129 finished with value: 0.5 and parameters: {'loss': 'coxph', 'learning_rate': 0.05084618867204208, 'n_estimators': 107, 'criterion': 'friedman_mse', 'min_samples_split': 2, 'min_samples_leaf': 4, 'min_weight_fraction_leaf': 0.34899338182656464, 'min_impurity_decrease': 0.6906205398656083, 'max_features': 0.4428218795759007, 'subsample': 0.37576113776356274, 'dropout_rate': 0.20211790303980037, 'ccp_alpha': 0.4987664693522642}. Best is trial 120 with value: 0.7572000007384097.[0m
[32m[I 2022-04-15 03:51:38,546][0m Trial 130 finished with value: 0.6743624146605087 and parameters: {'loss': 'coxph', 'learning_rate': 0.015324185631164137, 'n_estimators': 120, 'criterion': 'friedman_mse', 'min_samples_split': 10, 'min_samples_leaf': 4, 'min_weight_fraction_leaf': 0.3419861194768353, 'min_impurity_decrease': 0.8029984658216411, 'max_features': 0.47542623900556763, 'subsample': 0.4197466001419952, 'dropout_rate': 0.2689823197790129, 'ccp_alpha': 0.1633760607628784}. Best is trial 120 with value: 0.7572000007384097.[0m
[32m[I 2022-04-15 03:51:41,991][0m Trial 131 finished with value: 0.3613891398188982 and parameters: {'loss': 'squared', 'learning_rate': 3.6231350249052464e-05, 'n_estimators': 122, 'criterion': 'friedman_mse', 'min_samples_split': 3, 'min_samples_leaf': 4, 'min_weight_fraction_leaf': 0.3907788772642468, 'min_impurity_decrease': 0.7968991911168809, 'max_features': 0.4829403399721302, 'subsample': 0.30121972531898894, 'dropout_rate': 0.26314085600429304, 'ccp_alpha': 0.4205217087310511}. Best is trial 120 with value: 0.7572000007384097.[0m
[32m[I 2022-04-15 03:51:44,678][0m Trial 132 finished with value: 0.5 and parameters: {'loss': 'squared', 'learning_rate': 0.02425567889110698, 'n_estimators': 105, 'criterion': 'squared_error', 'min_samples_split': 2, 'min_samples_leaf': 4, 'min_weight_fraction_leaf': 0.3382613671468857, 'min_impurity_decrease': 0.6460202223087511, 'max_features': 0.5294160054595453, 'subsample': 0.36511001093687756, 'dropout_rate': 0.2570596951142253, 'ccp_alpha': 0.13466596543574644}. Best is trial 120 with value: 0.7572000007384097.[0m
[32m[I 2022-04-15 03:51:55,185][0m Trial 133 finished with value: 0.5 and parameters: {'loss': 'coxph', 'learning_rate': 0.013139374705195305, 'n_estimators': 132, 'criterion': 'friedman_mse', 'min_samples_split': 2, 'min_samples_leaf': 3, 'min_weight_fraction_leaf': 0.347893523889249, 'min_impurity_decrease': 0.7510669726154671, 'max_features': 0.4661305697323582, 'subsample': 0.41085387075018404, 'dropout_rate': 0.2869873363247972, 'ccp_alpha': 0.6974929013912113}. Best is trial 120 with value: 0.7572000007384097.[0m
[32m[I 2022-04-15 03:52:05,335][0m Trial 134 finished with value: 0.5 and parameters: {'loss': 'coxph', 'learning_rate': 0.01608530135045686, 'n_estimators': 116, 'criterion': 'friedman_mse', 'min_samples_split': 2, 'min_samples_leaf': 4, 'min_weight_fraction_leaf': 0.3207793070663376, 'min_impurity_decrease': 0.684575818376483, 'max_features': 0.5124060175255757, 'subsample': 0.32442197046676463, 'dropout_rate': 0.08122087673961259, 'ccp_alpha': 0.6187044243221442}. Best is trial 120 with value: 0.7572000007384097.[0m
