[32m[I 2022-04-18 19:59:07,849][0m Trial 961 finished with value: 0.7717052793417879 and parameters: {'n_hidden': 256, 'mixture_components': 10, 'use_sparse_layer': True, 'use_sparse_loss': True, 'lmbd': 6.929721472960986e-06, 'use_batchnorm': True, 'use_dropout': True, 'dropout': 0.7518925192554425, 'mlp_size_1': 1, 'mlp_size_2': 4, 'mlp_size_3': 0, 'kernel': 'Exponential', 'loss_name': 'AlternativeNLLLoss'}. Best is trial 861 with value: 0.7786620056496094.[0m
[32m[I 2022-04-18 20:02:09,498][0m Trial 962 finished with value: 0.772888463886073 and parameters: {'n_hidden': 256, 'mixture_components': 10, 'use_sparse_layer': True, 'use_sparse_loss': True, 'lmbd': 8.304782440279503e-05, 'use_batchnorm': True, 'use_dropout': True, 'dropout': 0.7811060032319155, 'mlp_size_1': 1, 'mlp_size_2': 4, 'mlp_size_3': 0, 'kernel': 'Exponential', 'loss_name': 'AlternativeNLLLoss'}. Best is trial 861 with value: 0.7786620056496094.[0m
[32m[I 2022-04-18 20:05:00,175][0m Trial 963 finished with value: 0.7525398908960093 and parameters: {'n_hidden': 256, 'mixture_components': 10, 'use_sparse_layer': True, 'use_sparse_loss': True, 'lmbd': 2.266090985792872e-05, 'use_batchnorm': True, 'use_dropout': False, 'mlp_size_1': 1, 'mlp_size_2': 4, 'mlp_size_3': 0, 'kernel': 'Exponential', 'loss_name': 'AlternativeNLLLoss'}. Best is trial 861 with value: 0.7786620056496094.[0m
[32m[I 2022-04-18 20:07:58,826][0m Trial 964 finished with value: 0.771467347801168 and parameters: {'n_hidden': 256, 'mixture_components': 10, 'use_sparse_layer': True, 'use_sparse_loss': True, 'lmbd': 1.532665980989672e-05, 'use_batchnorm': True, 'use_dropout': True, 'dropout': 0.7088695932451772, 'mlp_size_1': 1, 'mlp_size_2': 4, 'mlp_size_3': 0, 'kernel': 'Exponential', 'loss_name': 'AlternativeNLLLoss'}. Best is trial 861 with value: 0.7786620056496094.[0m
[32m[I 2022-04-18 20:11:00,337][0m Trial 965 finished with value: 0.7703349271521682 and parameters: {'n_hidden': 256, 'mixture_components': 10, 'use_sparse_layer': True, 'use_sparse_loss': True, 'lmbd': 4.7925363770866155e-06, 'use_batchnorm': True, 'use_dropout': True, 'dropout': 0.7379191040571681, 'mlp_size_1': 1, 'mlp_size_2': 4, 'mlp_size_3': 0, 'kernel': 'Exponential', 'loss_name': 'AlternativeNLLLoss'}. Best is trial 861 with value: 0.7786620056496094.[0m
[32m[I 2022-04-18 20:17:25,792][0m Trial 966 finished with value: 0.7115521128124264 and parameters: {'n_hidden': 512, 'mixture_components': 10, 'use_sparse_layer': True, 'use_sparse_loss': True, 'lmbd': 3.47007316729782e-05, 'use_batchnorm': True, 'use_dropout': True, 'dropout': 0.7606371155212546, 'mlp_size_1': 1, 'mlp_size_2': 4, 'mlp_size_3': 0, 'kernel': 'Normal', 'loss_name': 'AlternativeNLLLoss'}. Best is trial 861 with value: 0.7786620056496094.[0m
[32m[I 2022-04-18 20:20:06,750][0m Trial 967 finished with value: 0.756716394071135 and parameters: {'n_hidden': 2048, 'mixture_components': 10, 'use_sparse_layer': True, 'use_sparse_loss': True, 'lmbd': 1.0749973991556055e-05, 'use_batchnorm': True, 'use_dropout': True, 'dropout': 0.8008967124352733, 'mlp_size_1': 5, 'mlp_size_2': 3, 'mlp_size_3': 0, 'kernel': 'Exponential', 'loss_name': 'AlternativeNLLLoss'}. Best is trial 861 with value: 0.7786620056496094.[0m
[32m[I 2022-04-18 20:24:55,509][0m Trial 968 finished with value: 0.7244855435327885 and parameters: {'n_hidden': 256, 'mixture_components': 10, 'use_sparse_layer': True, 'use_sparse_loss': True, 'lmbd': 1.746514646183238e-05, 'use_batchnorm': True, 'use_dropout': True, 'dropout': 0.7316631565233896, 'mlp_size_1': 1, 'mlp_size_2': 4, 'mlp_size_3': 0, 'kernel': 'LogLogistic', 'loss_name': 'AlternativeNLLLoss'}. Best is trial 861 with value: 0.7786620056496094.[0m
[32m[I 2022-04-18 20:28:10,990][0m Trial 969 finished with value: 0.767258510378318 and parameters: {'n_hidden': 128, 'mixture_components': 10, 'use_sparse_layer': True, 'use_sparse_loss': True, 'lmbd': 6.282416768232327e-05, 'use_batchnorm': True, 'use_dropout': True, 'dropout': 0.7695696903058836, 'mlp_size_1': 1, 'mlp_size_2': 3, 'mlp_size_3': 0, 'kernel': 'Exponential', 'loss_name': 'AlternativeNLLLoss'}. Best is trial 861 with value: 0.7786620056496094.[0m
[32m[I 2022-04-18 20:31:03,485][0m Trial 970 finished with value: 0.7697390211559606 and parameters: {'n_hidden': 256, 'mixture_components': 10, 'use_sparse_layer': True, 'use_sparse_loss': True, 'lmbd': 2.8255937215259135e-05, 'use_batchnorm': True, 'use_dropout': True, 'dropout': 0.6995839924006808, 'mlp_size_1': 1, 'mlp_size_2': 4, 'mlp_size_3': 0, 'kernel': 'Exponential', 'loss_name': 'AlternativeNLLLoss'}. Best is trial 861 with value: 0.7786620056496094.[0m
[32m[I 2022-04-18 20:33:44,346][0m Trial 971 finished with value: 0.7714957709290517 and parameters: {'n_hidden': 256, 'mixture_components': 10, 'use_sparse_layer': True, 'use_sparse_loss': True, 'lmbd': 5.714591999541391e-06, 'use_batchnorm': True, 'use_dropout': True, 'dropout': 0.7478768457486864, 'mlp_size_1': 1, 'mlp_size_2': 4, 'mlp_size_3': 0, 'kernel': 'Exponential', 'loss_name': 'AlternativeNLLLoss'}. Best is trial 861 with value: 0.7786620056496094.[0m
[32m[I 2022-04-18 20:36:26,494][0m Trial 972 finished with value: 0.7682970144443197 and parameters: {'n_hidden': 256, 'mixture_components': 7, 'use_sparse_layer': True, 'use_sparse_loss': True, 'lmbd': 8.005356408985589e-06, 'use_batchnorm': True, 'use_dropout': True, 'dropout': 0.7220200853103502, 'mlp_size_1': 1, 'mlp_size_2': 4, 'mlp_size_3': 0, 'kernel': 'Exponential', 'loss_name': 'AlternativeNLLLoss'}. Best is trial 861 with value: 0.7786620056496094.[0m
[32m[I 2022-04-18 20:39:22,775][0m Trial 973 finished with value: 0.7643361162164506 and parameters: {'n_hidden': 256, 'mixture_components': 10, 'use_sparse_layer': True, 'use_sparse_loss': True, 'lmbd': 1.2974133532655973e-05, 'use_batchnorm': True, 'use_dropout': True, 'dropout': 0.2685547561728921, 'mlp_size_1': 1, 'mlp_size_2': 4, 'mlp_size_3': 0, 'kernel': 'Gamma', 'loss_name': 'AlternativeNLLLoss'}. Best is trial 861 with value: 0.7786620056496094.[0m
[32m[I 2022-04-18 20:42:24,544][0m Trial 974 finished with value: 0.7700608028587228 and parameters: {'n_hidden': 256, 'mixture_components': 10, 'use_sparse_layer': True, 'use_sparse_loss': True, 'lmbd': 4.203496492991162e-05, 'use_batchnorm': True, 'use_dropout': True, 'dropout': 0.7937903063227933, 'mlp_size_1': 1, 'mlp_size_2': 4, 'mlp_size_3': 0, 'kernel': 'Exponential', 'loss_name': 'AlternativeNLLLoss'}. Best is trial 861 with value: 0.7786620056496094.[0m
[32m[I 2022-04-18 20:45:00,272][0m Trial 975 finished with value: 0.7619101175008731 and parameters: {'n_hidden': 256, 'mixture_components': 10, 'use_sparse_layer': True, 'use_sparse_loss': True, 'lmbd': 2.130020592221212e-05, 'use_batchnorm': True, 'use_dropout': True, 'dropout': 0.8331893061917665, 'mlp_size_1': 1, 'mlp_size_2': 4, 'mlp_size_3': 0, 'kernel': 'Exponential', 'loss_name': 'AlternativeNLLLoss'}. Best is trial 861 with value: 0.7786620056496094.[0m
[32m[I 2022-04-18 20:47:07,685][0m Trial 976 finished with value: -1.0 and parameters: {'n_hidden': 256, 'mixture_components': 10, 'use_sparse_layer': True, 'use_sparse_loss': True, 'lmbd': 0.00021269688300355348, 'use_batchnorm': True, 'use_dropout': True, 'dropout': 0.7678738139768098, 'mlp_size_1': 1, 'mlp_size_2': 4, 'mlp_size_3': 0, 'kernel': 'Gumbel', 'loss_name': 'AlternativeNLLLoss'}. Best is trial 861 with value: 0.7786620056496094.[0m
[32m[I 2022-04-18 20:49:45,765][0m Trial 977 finished with value: 0.7718380791983754 and parameters: {'n_hidden': 256, 'mixture_components': 10, 'use_sparse_layer': True, 'use_sparse_loss': True, 'lmbd': 9.479562206930917e-06, 'use_batchnorm': True, 'use_dropout': True, 'dropout': 0.7381520096347619, 'mlp_size_1': 1, 'mlp_size_2': 4, 'mlp_size_3': 0, 'kernel': 'Exponential', 'loss_name': 'AlternativeNLLLoss'}. Best is trial 861 with value: 0.7786620056496094.[0m
[32m[I 2022-04-18 20:53:12,223][0m Trial 978 finished with value: 0.6923997417455899 and parameters: {'n_hidden': 64, 'mixture_components': 10, 'use_sparse_layer': True, 'use_sparse_loss': True, 'lmbd': 4.987496112591546e-05, 'use_batchnorm': True, 'use_dropout': True, 'dropout': 0.8093709195309999, 'mlp_size_1': 1, 'mlp_size_2': 0, 'mlp_size_3': 0, 'kernel': 'Exponential', 'loss_name': 'NLLLoss'}. Best is trial 861 with value: 0.7786620056496094.[0m
[32m[I 2022-04-18 20:56:09,869][0m Trial 979 finished with value: 0.768430932871482 and parameters: {'n_hidden': 256, 'mixture_components': 1, 'use_sparse_layer': True, 'use_sparse_loss': True, 'lmbd': 3.2664379490085174e-05, 'use_batchnorm': True, 'use_dropout': True, 'dropout': 0.7842059273471235, 'mlp_size_1': 1, 'mlp_size_2': 4, 'mlp_size_3': 0, 'kernel': 'Exponential', 'loss_name': 'AlternativeNLLLoss'}. Best is trial 861 with value: 0.7786620056496094.[0m
[32m[I 2022-04-18 20:59:07,654][0m Trial 980 finished with value: 0.7686539376785955 and parameters: {'n_hidden': 256, 'mixture_components': 10, 'use_sparse_layer': True, 'use_sparse_loss': True, 'lmbd': 0.00010184027605180822, 'use_batchnorm': True, 'use_dropout': True, 'dropout': 0.720922295839891, 'mlp_size_1': 1, 'mlp_size_2': 4, 'mlp_size_3': 0, 'kernel': 'Exponential', 'loss_name': 'AlternativeNLLLoss'}. Best is trial 861 with value: 0.7786620056496094.[0m
[32m[I 2022-04-18 21:03:23,336][0m Trial 981 finished with value: 0.7389957901915224 and parameters: {'n_hidden': 256, 'mixture_components': 10, 'use_sparse_layer': True, 'use_sparse_loss': True, 'lmbd': 1.714677506624593e-05, 'use_batchnorm': True, 'use_dropout': False, 'mlp_size_1': 1, 'mlp_size_2': 4, 'mlp_size_3': 0, 'kernel': 'Weibull', 'loss_name': 'AlternativeNLLLoss'}. Best is trial 861 with value: 0.7786620056496094.[0m
[32m[I 2022-04-18 21:06:26,727][0m Trial 982 finished with value: 0.7732510442718812 and parameters: {'n_hidden': 256, 'mixture_components': 10, 'use_sparse_layer': True, 'use_sparse_loss': True, 'lmbd': 2.6599239610320704e-05, 'use_batchnorm': True, 'use_dropout': True, 'dropout': 0.7508522006445792, 'mlp_size_1': 1, 'mlp_size_2': 4, 'mlp_size_3': 0, 'kernel': 'Exponential', 'loss_name': 'AlternativeNLLLoss'}. Best is trial 861 with value: 0.7786620056496094.[0m
[32m[I 2022-04-18 21:09:18,344][0m Trial 983 finished with value: 0.7715653389225172 and parameters: {'n_hidden': 256, 'mixture_components': 10, 'use_sparse_layer': True, 'use_sparse_loss': True, 'lmbd': 1.138825266819683e-05, 'use_batchnorm': True, 'use_dropout': True, 'dropout': 0.6986480491680077, 'mlp_size_1': 1, 'mlp_size_2': 4, 'mlp_size_3': 0, 'kernel': 'Exponential', 'loss_name': 'AlternativeNLLLoss'}. Best is trial 861 with value: 0.7786620056496094.[0m
[32m[I 2022-04-18 21:12:19,433][0m Trial 984 finished with value: 0.7689414463474324 and parameters: {'n_hidden': 256, 'mixture_components': 10, 'use_sparse_layer': True, 'use_sparse_loss': True, 'lmbd': 1.3899911312774494e-05, 'use_batchnorm': True, 'use_dropout': True, 'dropout': 0.7592210698203442, 'mlp_size_1': 1, 'mlp_size_2': 4, 'mlp_size_3': 0, 'kernel': 'Exponential', 'loss_name': 'AlternativeNLLLoss'}. Best is trial 861 with value: 0.7786620056496094.[0m
[32m[I 2022-04-18 21:15:19,777][0m Trial 985 finished with value: 0.7728430095533529 and parameters: {'n_hidden': 256, 'mixture_components': 10, 'use_sparse_layer': True, 'use_sparse_loss': True, 'lmbd': 2.127615594797526e-05, 'use_batchnorm': True, 'use_dropout': True, 'dropout': 0.7242055832307178, 'mlp_size_1': 1, 'mlp_size_2': 4, 'mlp_size_3': 0, 'kernel': 'Exponential', 'loss_name': 'AlternativeNLLLoss'}. Best is trial 861 with value: 0.7786620056496094.[0m
[32m[I 2022-04-18 21:19:32,396][0m Trial 986 finished with value: 0.754687272758308 and parameters: {'n_hidden': 256, 'mixture_components': 10, 'use_sparse_layer': True, 'use_sparse_loss': True, 'lmbd': 3.696230036882776e-05, 'use_batchnorm': True, 'use_dropout': True, 'dropout': 0.7778293732855767, 'mlp_size_1': 1, 'mlp_size_2': 4, 'mlp_size_3': 0, 'kernel': 'LogNormal', 'loss_name': 'AlternativeNLLLoss'}. Best is trial 861 with value: 0.7786620056496094.[0m
[32m[I 2022-04-18 21:22:28,315][0m Trial 987 finished with value: 0.77026411322506 and parameters: {'n_hidden': 256, 'mixture_components': 10, 'use_sparse_layer': True, 'use_sparse_loss': True, 'lmbd': 7.512779785725207e-05, 'use_batchnorm': True, 'use_dropout': True, 'dropout': 0.7469329021710878, 'mlp_size_1': 1, 'mlp_size_2': 4, 'mlp_size_3': 0, 'kernel': 'Exponential', 'loss_name': 'AlternativeNLLLoss'}. Best is trial 861 with value: 0.7786620056496094.[0m
[32m[I 2022-04-18 21:25:30,662][0m Trial 988 finished with value: 0.7637861615103689 and parameters: {'n_hidden': 256, 'mixture_components': 10, 'use_sparse_layer': True, 'use_sparse_loss': True, 'lmbd': 5.246179853438801e-05, 'use_batchnorm': True, 'use_dropout': True, 'dropout': 0.8473353579192145, 'mlp_size_1': 1, 'mlp_size_2': 4, 'mlp_size_3': 0, 'kernel': 'Exponential', 'loss_name': 'AlternativeNLLLoss'}. Best is trial 861 with value: 0.7786620056496094.[0m
[32m[I 2022-04-18 21:29:23,782][0m Trial 989 finished with value: 0.7175254625737902 and parameters: {'n_hidden': 32, 'mixture_components': 10, 'use_sparse_layer': True, 'use_sparse_loss': True, 'lmbd': 7.134360096231051e-06, 'use_batchnorm': True, 'use_dropout': True, 'dropout': 0.8231051538705945, 'mlp_size_1': 1, 'mlp_size_2': 1, 'mlp_size_3': 0, 'kernel': 'Exponential', 'loss_name': 'AlternativeNLLLoss'}. Best is trial 861 with value: 0.7786620056496094.[0m
[32m[I 2022-04-18 21:32:22,112][0m Trial 990 finished with value: 0.7674559929298047 and parameters: {'n_hidden': 256, 'mixture_components': 10, 'use_sparse_layer': True, 'use_sparse_loss': True, 'lmbd': 0.00015267619106170094, 'use_batchnorm': True, 'use_dropout': True, 'dropout': 0.7279507858373896, 'mlp_size_1': 1, 'mlp_size_2': 4, 'mlp_size_3': 0, 'kernel': 'Exponential', 'loss_name': 'AlternativeNLLLoss'}. Best is trial 861 with value: 0.7786620056496094.[0m
[32m[I 2022-04-18 21:36:57,729][0m Trial 991 finished with value: 0.7266868659873914 and parameters: {'n_hidden': 256, 'mixture_components': 9, 'use_sparse_layer': True, 'use_sparse_loss': True, 'lmbd': 1.7947362765928858e-05, 'use_batchnorm': True, 'use_dropout': True, 'dropout': 0.7030360983192144, 'mlp_size_1': 1, 'mlp_size_2': 4, 'mlp_size_3': 0, 'kernel': 'Logistic', 'loss_name': 'AlternativeNLLLoss'}. Best is trial 861 with value: 0.7786620056496094.[0m
[32m[I 2022-04-18 21:39:42,426][0m Trial 992 finished with value: 0.7673505278123379 and parameters: {'n_hidden': 256, 'mixture_components': 10, 'use_sparse_layer': True, 'use_sparse_loss': True, 'lmbd': 2.5094976325939905e-05, 'use_batchnorm': True, 'use_dropout': True, 'dropout': 0.7836707285535693, 'mlp_size_1': 1, 'mlp_size_2': 4, 'mlp_size_3': 0, 'kernel': 'Exponential', 'loss_name': 'AlternativeNLLLoss'}. Best is trial 861 with value: 0.7786620056496094.[0m
[32m[I 2022-04-18 21:43:12,028][0m Trial 993 finished with value: 0.7167854917423717 and parameters: {'n_hidden': 2048, 'mixture_components': 10, 'use_sparse_layer': True, 'use_sparse_loss': True, 'lmbd': 8.622038102961058e-06, 'use_batchnorm': True, 'use_dropout': True, 'dropout': 0.7583046891239754, 'mlp_size_1': 2, 'mlp_size_2': 4, 'mlp_size_3': 1, 'kernel': 'Exponential', 'loss_name': 'NLLLoss'}. Best is trial 861 with value: 0.7786620056496094.[0m
[32m[I 2022-04-18 21:46:04,344][0m Trial 994 finished with value: 0.7730366638247531 and parameters: {'n_hidden': 256, 'mixture_components': 10, 'use_sparse_layer': True, 'use_sparse_loss': True, 'lmbd': 1.1326899582950943e-05, 'use_batchnorm': True, 'use_dropout': True, 'dropout': 0.7371367045591549, 'mlp_size_1': 1, 'mlp_size_2': 4, 'mlp_size_3': 0, 'kernel': 'Exponential', 'loss_name': 'AlternativeNLLLoss'}. Best is trial 861 with value: 0.7786620056496094.[0m
[32m[I 2022-04-18 21:50:32,220][0m Trial 995 finished with value: 0.7067321427087949 and parameters: {'n_hidden': 256, 'mixture_components': 10, 'use_sparse_layer': True, 'use_sparse_loss': True, 'lmbd': 3.223468099423837e-05, 'use_batchnorm': True, 'use_dropout': True, 'dropout': 0.804060786455136, 'mlp_size_1': 1, 'mlp_size_2': 4, 'mlp_size_3': 0, 'kernel': 'Normal', 'loss_name': 'AlternativeNLLLoss'}. Best is trial 861 with value: 0.7786620056496094.[0m
[32m[I 2022-04-18 21:53:22,657][0m Trial 996 finished with value: 0.7498387265803765 and parameters: {'n_hidden': 512, 'mixture_components': 10, 'use_sparse_layer': True, 'use_sparse_loss': True, 'lmbd': 3.932113026218899e-06, 'use_batchnorm': True, 'use_dropout': True, 'dropout': 0.7688632272018251, 'mlp_size_1': 6, 'mlp_size_2': 0, 'mlp_size_3': 0, 'kernel': 'Exponential', 'loss_name': 'AlternativeNLLLoss'}. Best is trial 861 with value: 0.7786620056496094.[0m
[32m[I 2022-04-18 21:57:25,111][0m Trial 997 finished with value: 0.7689147218036858 and parameters: {'n_hidden': 1024, 'mixture_components': 10, 'use_sparse_layer': True, 'use_sparse_loss': True, 'lmbd': 1.3781502481969371e-05, 'use_batchnorm': True, 'use_dropout': True, 'dropout': 0.7095571476634498, 'mlp_size_1': 0, 'mlp_size_2': 5, 'mlp_size_3': 1, 'kernel': 'Exponential', 'loss_name': 'AlternativeNLLLoss'}. Best is trial 861 with value: 0.7786620056496094.[0m
[32m[I 2022-04-18 22:00:07,813][0m Trial 998 finished with value: 0.7700408916280269 and parameters: {'n_hidden': 256, 'mixture_components': 9, 'use_sparse_layer': True, 'use_sparse_loss': True, 'lmbd': 6.612182679188813e-05, 'use_batchnorm': True, 'use_dropout': True, 'dropout': 0.7440936318022879, 'mlp_size_1': 1, 'mlp_size_2': 4, 'mlp_size_3': 0, 'kernel': 'Exponential', 'loss_name': 'AlternativeNLLLoss'}. Best is trial 861 with value: 0.7786620056496094.[0m
[32m[I 2022-04-18 22:04:59,033][0m Trial 999 finished with value: 0.6965830962603645 and parameters: {'n_hidden': 256, 'mixture_components': 10, 'use_sparse_layer': True, 'use_sparse_loss': True, 'lmbd': 4.088696002743153e-05, 'use_batchnorm': True, 'use_dropout': True, 'dropout': 0.7905850454344299, 'mlp_size_1': 1, 'mlp_size_2': 4, 'mlp_size_3': 0, 'kernel': 'LogLogistic', 'loss_name': 'AlternativeNLLLoss'}. Best is trial 861 with value: 0.7786620056496094.[0m
Running Optimizer with LogRank binary scoring
{'n_hidden': 1024, 'mixture_components': 8, 'use_sparse_layer': False, 'use_batchnorm': False, 'use_dropout': True, 'dropout': 0.6197630727681631, 'mlp_size_1': 2, 'mlp_size_2': 4, 'mlp_size_3': 1, 'kernel': 'Gamma', 'loss_name': 'AlternativeNLLLoss', 'UnoC_LR': 0.8901518638077398}
Running Optimizer normaly
{'n_hidden': 256, 'mixture_components': 10, 'use_sparse_layer': True, 'use_sparse_loss': True, 'lmbd': 1.4963805463910381e-05, 'use_batchnorm': True, 'use_dropout': True, 'dropout': 0.7734249900448279, 'mlp_size_1': 1, 'mlp_size_2': 4, 'mlp_size_3': 0, 'kernel': 'Exponential', 'loss_name': 'AlternativeNLLLoss', 'UnoC': 0.7786620056496094}
