[32m[I 2022-04-13 11:51:01,773][0m Trial 339 finished with value: 0.7081229452081603 and parameters: {'splitter': 'best', 'min_samples_split': 0.1209865414397652, 'min_samples_leaf': 0.28063487146769056, 'min_weight_fraction_leaf': 0.03763261124997027, 'max_features': 0.9653030949897002}. Best is trial 201 with value: 0.8881217621713932.[0m
/media/san2_ssd/data/Workdir/survival/utils.py:305: RuntimeWarning: invalid value encountered in true_divide
  pdfs = np.gradient(1-survs,axis=1)/norms
/media/san2_ssd/data/Workdir/survival/utils.py:305: RuntimeWarning: invalid value encountered in true_divide
  pdfs = np.gradient(1-survs,axis=1)/norms
/media/san2_ssd/data/Workdir/survival/utils.py:305: RuntimeWarning: invalid value encountered in true_divide
  pdfs = np.gradient(1-survs,axis=1)/norms
/media/san2_ssd/data/Workdir/survival/utils.py:305: RuntimeWarning: invalid value encountered in true_divide
  pdfs = np.gradient(1-survs,axis=1)/norms
/media/san2_ssd/data/Workdir/survival/utils.py:305: RuntimeWarning: invalid value encountered in true_divide
  pdfs = np.gradient(1-survs,axis=1)/norms
[32m[I 2022-04-13 11:51:03,740][0m Trial 340 finished with value: 0.8874579776514858 and parameters: {'splitter': 'best', 'min_samples_split': 0.0937114489863191, 'min_samples_leaf': 0.024537597594845795, 'min_weight_fraction_leaf': 0.025606535388815178, 'max_features': 0.9794587066966649}. Best is trial 201 with value: 0.8881217621713932.[0m
/media/san2_ssd/data/Workdir/survival/utils.py:305: RuntimeWarning: invalid value encountered in true_divide
  pdfs = np.gradient(1-survs,axis=1)/norms
/media/san2_ssd/data/Workdir/survival/utils.py:305: RuntimeWarning: invalid value encountered in true_divide
  pdfs = np.gradient(1-survs,axis=1)/norms
/media/san2_ssd/data/Workdir/survival/utils.py:305: RuntimeWarning: invalid value encountered in true_divide
  pdfs = np.gradient(1-survs,axis=1)/norms
[32m[I 2022-04-13 11:51:05,772][0m Trial 341 finished with value: 0.885388045891888 and parameters: {'splitter': 'best', 'min_samples_split': 0.09098564414673026, 'min_samples_leaf': 0.05291400841688269, 'min_weight_fraction_leaf': 0.02800278482167074, 'max_features': 0.9975913110994873}. Best is trial 201 with value: 0.8881217621713932.[0m
/media/san2_ssd/data/Workdir/survival/utils.py:305: RuntimeWarning: invalid value encountered in true_divide
  pdfs = np.gradient(1-survs,axis=1)/norms
/media/san2_ssd/data/Workdir/survival/utils.py:305: RuntimeWarning: invalid value encountered in true_divide
  pdfs = np.gradient(1-survs,axis=1)/norms
/media/san2_ssd/data/Workdir/survival/utils.py:305: RuntimeWarning: invalid value encountered in true_divide
  pdfs = np.gradient(1-survs,axis=1)/norms
[32m[I 2022-04-13 11:51:07,712][0m Trial 342 finished with value: 0.8854960649840372 and parameters: {'splitter': 'best', 'min_samples_split': 0.08237664240808089, 'min_samples_leaf': 0.033559422236173274, 'min_weight_fraction_leaf': 0.048242982490496245, 'max_features': 0.9985803318727385}. Best is trial 201 with value: 0.8881217621713932.[0m
/media/san2_ssd/data/Workdir/survival/utils.py:305: RuntimeWarning: invalid value encountered in true_divide
  pdfs = np.gradient(1-survs,axis=1)/norms
/media/san2_ssd/data/Workdir/survival/utils.py:305: RuntimeWarning: invalid value encountered in true_divide
  pdfs = np.gradient(1-survs,axis=1)/norms
/media/san2_ssd/data/Workdir/survival/utils.py:305: RuntimeWarning: invalid value encountered in true_divide
  pdfs = np.gradient(1-survs,axis=1)/norms
/media/san2_ssd/data/Workdir/survival/utils.py:305: RuntimeWarning: invalid value encountered in true_divide
  pdfs = np.gradient(1-survs,axis=1)/norms
/media/san2_ssd/data/Workdir/survival/utils.py:305: RuntimeWarning: invalid value encountered in true_divide
  pdfs = np.gradient(1-survs,axis=1)/norms
[32m[I 2022-04-13 11:51:09,733][0m Trial 343 finished with value: 0.8848458330321105 and parameters: {'splitter': 'best', 'min_samples_split': 0.09467038191077917, 'min_samples_leaf': 0.043791296725083556, 'min_weight_fraction_leaf': 0.03760848413035019, 'max_features': 0.9504653512516219}. Best is trial 201 with value: 0.8881217621713932.[0m
/media/san2_ssd/data/Workdir/survival/utils.py:305: RuntimeWarning: invalid value encountered in true_divide
  pdfs = np.gradient(1-survs,axis=1)/norms
/media/san2_ssd/data/Workdir/survival/utils.py:305: RuntimeWarning: invalid value encountered in true_divide
  pdfs = np.gradient(1-survs,axis=1)/norms
/media/san2_ssd/data/Workdir/survival/utils.py:305: RuntimeWarning: invalid value encountered in true_divide
  pdfs = np.gradient(1-survs,axis=1)/norms
[32m[I 2022-04-13 11:51:11,314][0m Trial 344 finished with value: 0.8847930545937116 and parameters: {'splitter': 'best', 'min_samples_split': 0.10509391104738405, 'min_samples_leaf': 0.00924130764343709, 'min_weight_fraction_leaf': 0.026138275262696638, 'max_features': 0.965763854841282}. Best is trial 201 with value: 0.8881217621713932.[0m
/media/san2_ssd/data/Workdir/survival/utils.py:305: RuntimeWarning: invalid value encountered in true_divide
  pdfs = np.gradient(1-survs,axis=1)/norms
/media/san2_ssd/data/Workdir/survival/utils.py:305: RuntimeWarning: invalid value encountered in true_divide
  pdfs = np.gradient(1-survs,axis=1)/norms
/media/san2_ssd/data/Workdir/survival/utils.py:305: RuntimeWarning: invalid value encountered in true_divide
  pdfs = np.gradient(1-survs,axis=1)/norms
/media/san2_ssd/data/Workdir/survival/utils.py:305: RuntimeWarning: invalid value encountered in true_divide
  pdfs = np.gradient(1-survs,axis=1)/norms
/media/san2_ssd/data/Workdir/survival/utils.py:305: RuntimeWarning: invalid value encountered in true_divide
  pdfs = np.gradient(1-survs,axis=1)/norms
[32m[I 2022-04-13 11:51:13,247][0m Trial 345 finished with value: 0.8868158005312786 and parameters: {'splitter': 'best', 'min_samples_split': 0.10009895698505569, 'min_samples_leaf': 0.024461227086349686, 'min_weight_fraction_leaf': 0.009741565412556483, 'max_features': 0.9820681365323863}. Best is trial 201 with value: 0.8881217621713932.[0m
/media/san2_ssd/data/Workdir/survival/utils.py:305: RuntimeWarning: invalid value encountered in true_divide
  pdfs = np.gradient(1-survs,axis=1)/norms
/media/san2_ssd/data/Workdir/survival/utils.py:305: RuntimeWarning: invalid value encountered in true_divide
  pdfs = np.gradient(1-survs,axis=1)/norms
/media/san2_ssd/data/Workdir/survival/utils.py:305: RuntimeWarning: invalid value encountered in true_divide
  pdfs = np.gradient(1-survs,axis=1)/norms
[32m[I 2022-04-13 11:51:14,384][0m Trial 346 finished with value: 0.8833898705950409 and parameters: {'splitter': 'best', 'min_samples_split': 0.10787320961029148, 'min_samples_leaf': 0.03459119087163559, 'min_weight_fraction_leaf': 0.049460096275601016, 'max_features': 0.9300059785934064}. Best is trial 201 with value: 0.8881217621713932.[0m
/media/san2_ssd/data/Workdir/survival/utils.py:305: RuntimeWarning: invalid value encountered in true_divide
  pdfs = np.gradient(1-survs,axis=1)/norms
/media/san2_ssd/data/Workdir/survival/utils.py:305: RuntimeWarning: invalid value encountered in true_divide
  pdfs = np.gradient(1-survs,axis=1)/norms
/media/san2_ssd/data/Workdir/survival/utils.py:305: RuntimeWarning: invalid value encountered in true_divide
  pdfs = np.gradient(1-survs,axis=1)/norms
/media/san2_ssd/data/Workdir/survival/utils.py:305: RuntimeWarning: invalid value encountered in true_divide
  pdfs = np.gradient(1-survs,axis=1)/norms
[32m[I 2022-04-13 11:51:15,794][0m Trial 347 finished with value: 0.884589266634143 and parameters: {'splitter': 'best', 'min_samples_split': 0.09095406543987082, 'min_samples_leaf': 0.022314026015380725, 'min_weight_fraction_leaf': 0.036228812076191635, 'max_features': 0.9994064743702764}. Best is trial 201 with value: 0.8881217621713932.[0m
/media/san2_ssd/data/Workdir/survival/utils.py:305: RuntimeWarning: invalid value encountered in true_divide
  pdfs = np.gradient(1-survs,axis=1)/norms
/media/san2_ssd/data/Workdir/survival/utils.py:305: RuntimeWarning: invalid value encountered in true_divide
  pdfs = np.gradient(1-survs,axis=1)/norms
/media/san2_ssd/data/Workdir/survival/utils.py:305: RuntimeWarning: invalid value encountered in true_divide
  pdfs = np.gradient(1-survs,axis=1)/norms
[32m[I 2022-04-13 11:51:18,567][0m Trial 348 finished with value: 0.8858392283237488 and parameters: {'splitter': 'best', 'min_samples_split': 0.1301392635315028, 'min_samples_leaf': 0.010238826545758766, 'min_weight_fraction_leaf': 0.024183331929921847, 'max_features': 0.9806804466558912}. Best is trial 201 with value: 0.8881217621713932.[0m
[32m[I 2022-04-13 11:51:20,415][0m Trial 349 finished with value: 0.573273683683226 and parameters: {'splitter': 'best', 'min_samples_split': 0.25181980721087666, 'min_samples_leaf': 0.04401138533308796, 'min_weight_fraction_leaf': 0.0627875024696281, 'max_features': 0.9596975344870022}. Best is trial 201 with value: 0.8881217621713932.[0m
[32m[I 2022-04-13 11:51:20,622][0m Trial 350 finished with value: 0.7473982324896058 and parameters: {'splitter': 'random', 'min_samples_split': 0.12051346006274946, 'min_samples_leaf': 0.14863358334936766, 'min_weight_fraction_leaf': 0.012258650534057065, 'max_features': 0.9995498587178516}. Best is trial 201 with value: 0.8881217621713932.[0m
/media/san2_ssd/data/Workdir/survival/utils.py:305: RuntimeWarning: invalid value encountered in true_divide
  pdfs = np.gradient(1-survs,axis=1)/norms
/media/san2_ssd/data/Workdir/survival/utils.py:305: RuntimeWarning: invalid value encountered in true_divide
  pdfs = np.gradient(1-survs,axis=1)/norms
/media/san2_ssd/data/Workdir/survival/utils.py:305: RuntimeWarning: invalid value encountered in true_divide
  pdfs = np.gradient(1-survs,axis=1)/norms
/media/san2_ssd/data/Workdir/survival/utils.py:305: RuntimeWarning: invalid value encountered in true_divide
  pdfs = np.gradient(1-survs,axis=1)/norms
[32m[I 2022-04-13 11:51:23,716][0m Trial 351 finished with value: 0.8841805437609545 and parameters: {'splitter': 'best', 'min_samples_split': 0.10984417320873512, 'min_samples_leaf': 0.028880979445146657, 'min_weight_fraction_leaf': 0.03836197214367769, 'max_features': 0.9441313772375037}. Best is trial 201 with value: 0.8881217621713932.[0m
[32m[I 2022-04-13 11:51:26,148][0m Trial 352 finished with value: 0.7825964305303621 and parameters: {'splitter': 'best', 'min_samples_split': 0.18293442700642548, 'min_samples_leaf': 0.019925036201171833, 'min_weight_fraction_leaf': 0.026116510862835778, 'max_features': 0.9789824795536656}. Best is trial 201 with value: 0.8881217621713932.[0m
/media/san2_ssd/data/Workdir/survival/utils.py:305: RuntimeWarning: invalid value encountered in true_divide
  pdfs = np.gradient(1-survs,axis=1)/norms
/media/san2_ssd/data/Workdir/survival/utils.py:305: RuntimeWarning: invalid value encountered in true_divide
  pdfs = np.gradient(1-survs,axis=1)/norms
/media/san2_ssd/data/Workdir/survival/utils.py:305: RuntimeWarning: invalid value encountered in true_divide
  pdfs = np.gradient(1-survs,axis=1)/norms
[32m[I 2022-04-13 11:51:28,256][0m Trial 353 finished with value: 0.8833540188224372 and parameters: {'splitter': 'best', 'min_samples_split': 0.08077734072440458, 'min_samples_leaf': 0.05745337453007307, 'min_weight_fraction_leaf': 0.055549202199371844, 'max_features': 0.9650675350910686}. Best is trial 201 with value: 0.8881217621713932.[0m
/media/san2_ssd/data/Workdir/survival/utils.py:305: RuntimeWarning: invalid value encountered in true_divide
  pdfs = np.gradient(1-survs,axis=1)/norms
/media/san2_ssd/data/Workdir/survival/utils.py:305: RuntimeWarning: invalid value encountered in true_divide
  pdfs = np.gradient(1-survs,axis=1)/norms
/media/san2_ssd/data/Workdir/survival/utils.py:305: RuntimeWarning: invalid value encountered in true_divide
  pdfs = np.gradient(1-survs,axis=1)/norms
[32m[I 2022-04-13 11:51:30,785][0m Trial 354 finished with value: 0.8867072761952345 and parameters: {'splitter': 'best', 'min_samples_split': 0.13874995531392428, 'min_samples_leaf': 0.03478949230586104, 'min_weight_fraction_leaf': 0.009686051146695214, 'max_features': 0.9993152617442821}. Best is trial 201 with value: 0.8881217621713932.[0m
[32m[I 2022-04-13 11:51:32,488][0m Trial 355 finished with value: 0.6706503823377552 and parameters: {'splitter': 'best', 'min_samples_split': 0.1014149109544226, 'min_samples_leaf': 0.012094113353057007, 'min_weight_fraction_leaf': 0.14232434076480002, 'max_features': 0.9218059809587186}. Best is trial 201 with value: 0.8881217621713932.[0m
/media/san2_ssd/data/Workdir/survival/utils.py:305: RuntimeWarning: invalid value encountered in true_divide
  pdfs = np.gradient(1-survs,axis=1)/norms
/media/san2_ssd/data/Workdir/survival/utils.py:305: RuntimeWarning: invalid value encountered in true_divide
  pdfs = np.gradient(1-survs,axis=1)/norms
/media/san2_ssd/data/Workdir/survival/utils.py:305: RuntimeWarning: invalid value encountered in true_divide
  pdfs = np.gradient(1-survs,axis=1)/norms
/media/san2_ssd/data/Workdir/survival/utils.py:305: RuntimeWarning: invalid value encountered in true_divide
  pdfs = np.gradient(1-survs,axis=1)/norms
[32m[I 2022-04-13 11:51:35,091][0m Trial 356 finished with value: 0.8871246339845099 and parameters: {'splitter': 'best', 'min_samples_split': 0.12602528482311787, 'min_samples_leaf': 0.02893347778517591, 'min_weight_fraction_leaf': 0.029697698755410555, 'max_features': 0.9797989228886665}. Best is trial 201 with value: 0.8881217621713932.[0m
/media/san2_ssd/data/Workdir/survival/utils.py:305: RuntimeWarning: invalid value encountered in true_divide
  pdfs = np.gradient(1-survs,axis=1)/norms
[32m[I 2022-04-13 11:51:36,922][0m Trial 357 finished with value: 0.8818916109392297 and parameters: {'splitter': 'best', 'min_samples_split': 0.1434701918209388, 'min_samples_leaf': 0.04479489623757467, 'min_weight_fraction_leaf': 0.04609584460696228, 'max_features': 0.9490988732968554}. Best is trial 201 with value: 0.8881217621713932.[0m
/media/san2_ssd/data/Workdir/survival/utils.py:305: RuntimeWarning: invalid value encountered in true_divide
  pdfs = np.gradient(1-survs,axis=1)/norms
/media/san2_ssd/data/Workdir/survival/utils.py:305: RuntimeWarning: invalid value encountered in true_divide
  pdfs = np.gradient(1-survs,axis=1)/norms
/media/san2_ssd/data/Workdir/survival/utils.py:305: RuntimeWarning: invalid value encountered in true_divide
  pdfs = np.gradient(1-survs,axis=1)/norms
[32m[I 2022-04-13 11:51:39,347][0m Trial 358 finished with value: 0.883556590960041 and parameters: {'splitter': 'best', 'min_samples_split': 0.129058789640272, 'min_samples_leaf': 0.031595343657536974, 'min_weight_fraction_leaf': 0.03718448770701173, 'max_features': 0.9672556832664292}. Best is trial 201 with value: 0.8881217621713932.[0m
/media/san2_ssd/data/Workdir/survival/utils.py:305: RuntimeWarning: invalid value encountered in true_divide
  pdfs = np.gradient(1-survs,axis=1)/norms
[32m[I 2022-04-13 11:51:41,901][0m Trial 359 finished with value: 0.7859025994102726 and parameters: {'splitter': 'best', 'min_samples_split': 0.15409303869378743, 'min_samples_leaf': 0.011061878157426874, 'min_weight_fraction_leaf': 0.029744687896454538, 'max_features': 0.9827840673436997}. Best is trial 201 with value: 0.8881217621713932.[0m
/media/san2_ssd/data/Workdir/survival/utils.py:305: RuntimeWarning: invalid value encountered in true_divide
  pdfs = np.gradient(1-survs,axis=1)/norms
/media/san2_ssd/data/Workdir/survival/utils.py:305: RuntimeWarning: invalid value encountered in true_divide
  pdfs = np.gradient(1-survs,axis=1)/norms
/media/san2_ssd/data/Workdir/survival/utils.py:305: RuntimeWarning: invalid value encountered in true_divide
  pdfs = np.gradient(1-survs,axis=1)/norms
[32m[I 2022-04-13 11:51:44,784][0m Trial 360 finished with value: 0.886872226611834 and parameters: {'splitter': 'best', 'min_samples_split': 0.12032158950242934, 'min_samples_leaf': 0.020144432308801297, 'min_weight_fraction_leaf': 0.046671771793995134, 'max_features': 0.9994403007499988}. Best is trial 201 with value: 0.8881217621713932.[0m
[32m[I 2022-04-13 11:51:45,969][0m Trial 361 finished with value: 0.5480111951884148 and parameters: {'splitter': 'best', 'min_samples_split': 0.1251311243264246, 'min_samples_leaf': 0.24870577456799509, 'min_weight_fraction_leaf': 0.057620917924333465, 'max_features': 0.9623346034929834}. Best is trial 201 with value: 0.8881217621713932.[0m
/media/san2_ssd/data/Workdir/survival/utils.py:305: RuntimeWarning: invalid value encountered in true_divide
  pdfs = np.gradient(1-survs,axis=1)/norms
/media/san2_ssd/data/Workdir/survival/utils.py:305: RuntimeWarning: invalid value encountered in true_divide
  pdfs = np.gradient(1-survs,axis=1)/norms
/media/san2_ssd/data/Workdir/survival/utils.py:305: RuntimeWarning: invalid value encountered in true_divide
  pdfs = np.gradient(1-survs,axis=1)/norms
[32m[I 2022-04-13 11:51:49,254][0m Trial 362 finished with value: 0.8827126458172483 and parameters: {'splitter': 'best', 'min_samples_split': 0.12163283780548824, 'min_samples_leaf': 0.039929243105615665, 'min_weight_fraction_leaf': 0.04798662826544521, 'max_features': 0.9377122810869143}. Best is trial 201 with value: 0.8881217621713932.[0m
/media/san2_ssd/data/Workdir/survival/utils.py:305: RuntimeWarning: invalid value encountered in true_divide
  pdfs = np.gradient(1-survs,axis=1)/norms
/media/san2_ssd/data/Workdir/survival/utils.py:305: RuntimeWarning: invalid value encountered in true_divide
  pdfs = np.gradient(1-survs,axis=1)/norms
[32m[I 2022-04-13 11:51:50,053][0m Trial 363 finished with value: 0.8854235927554571 and parameters: {'splitter': 'best', 'min_samples_split': 0.1356961289630944, 'min_samples_leaf': 0.05059669726403552, 'min_weight_fraction_leaf': 0.042666298903599145, 'max_features': 0.9825242949989187}. Best is trial 201 with value: 0.8881217621713932.[0m
/media/san2_ssd/data/Workdir/survival/utils.py:305: RuntimeWarning: invalid value encountered in true_divide
  pdfs = np.gradient(1-survs,axis=1)/norms
/media/san2_ssd/data/Workdir/survival/utils.py:305: RuntimeWarning: invalid value encountered in true_divide
  pdfs = np.gradient(1-survs,axis=1)/norms
/media/san2_ssd/data/Workdir/survival/utils.py:305: RuntimeWarning: invalid value encountered in true_divide
  pdfs = np.gradient(1-survs,axis=1)/norms
/media/san2_ssd/data/Workdir/survival/utils.py:305: RuntimeWarning: invalid value encountered in true_divide
  pdfs = np.gradient(1-survs,axis=1)/norms
[32m[I 2022-04-13 11:51:52,812][0m Trial 364 finished with value: 0.8846301486601276 and parameters: {'splitter': 'best', 'min_samples_split': 0.11458744837703799, 'min_samples_leaf': 0.027834873415130332, 'min_weight_fraction_leaf': 0.03648974059907075, 'max_features': 0.9545664064190637}. Best is trial 201 with value: 0.8881217621713932.[0m
[32m[I 2022-04-13 11:51:54,927][0m Trial 365 finished with value: 0.8840445658458073 and parameters: {'splitter': 'best', 'min_samples_split': 0.1103355391135527, 'min_samples_leaf': 0.008720759900909139, 'min_weight_fraction_leaf': 0.06905523548105763, 'max_features': 0.9993312315176194}. Best is trial 201 with value: 0.8881217621713932.[0m
/media/san2_ssd/data/Workdir/survival/utils.py:305: RuntimeWarning: invalid value encountered in true_divide
  pdfs = np.gradient(1-survs,axis=1)/norms
[32m[I 2022-04-13 11:51:57,613][0m Trial 366 finished with value: 0.8833285908153702 and parameters: {'splitter': 'best', 'min_samples_split': 0.1322014076426225, 'min_samples_leaf': 0.018768610448532695, 'min_weight_fraction_leaf': 0.05335716496460482, 'max_features': 0.9708708267931895}. Best is trial 201 with value: 0.8881217621713932.[0m
[32m[I 2022-04-13 11:52:00,263][0m Trial 367 finished with value: 0.8804781489974334 and parameters: {'splitter': 'best', 'min_samples_split': 0.14537416700195618, 'min_samples_leaf': 0.03701020934757011, 'min_weight_fraction_leaf': 0.021228559321057508, 'max_features': 0.8969904689006307}. Best is trial 201 with value: 0.8881217621713932.[0m
/media/san2_ssd/data/Workdir/survival/utils.py:305: RuntimeWarning: invalid value encountered in true_divide
  pdfs = np.gradient(1-survs,axis=1)/norms
/media/san2_ssd/data/Workdir/survival/utils.py:305: RuntimeWarning: invalid value encountered in true_divide
  pdfs = np.gradient(1-survs,axis=1)/norms
/media/san2_ssd/data/Workdir/survival/utils.py:305: RuntimeWarning: invalid value encountered in true_divide
  pdfs = np.gradient(1-survs,axis=1)/norms
/media/san2_ssd/data/Workdir/survival/utils.py:305: RuntimeWarning: invalid value encountered in true_divide
  pdfs = np.gradient(1-survs,axis=1)/norms
[32m[I 2022-04-13 11:52:02,355][0m Trial 368 finished with value: 0.8879472935262784 and parameters: {'splitter': 'best', 'min_samples_split': 0.12293493851832818, 'min_samples_leaf': 0.027379940588889796, 'min_weight_fraction_leaf': 0.032021810656267705, 'max_features': 0.9997684991975967}. Best is trial 201 with value: 0.8881217621713932.[0m
/media/san2_ssd/data/Workdir/survival/utils.py:305: RuntimeWarning: invalid value encountered in true_divide
  pdfs = np.gradient(1-survs,axis=1)/norms
/media/san2_ssd/data/Workdir/survival/utils.py:305: RuntimeWarning: invalid value encountered in true_divide
  pdfs = np.gradient(1-survs,axis=1)/norms
/media/san2_ssd/data/Workdir/survival/utils.py:305: RuntimeWarning: invalid value encountered in true_divide
  pdfs = np.gradient(1-survs,axis=1)/norms
[32m[I 2022-04-13 11:52:02,732][0m Trial 369 finished with value: 0.8303756564451537 and parameters: {'splitter': 'best', 'min_samples_split': 0.12880062531007455, 'min_samples_leaf': 0.0548060961581222, 'min_weight_fraction_leaf': 0.04371045770007205, 'max_features': 0.2077536162109368}. Best is trial 201 with value: 0.8881217621713932.[0m
