[32m[I 2022-04-15 19:18:26,085][0m Trial 200 finished with value: 0.7847614611032134 and parameters: {'n_hidden': 256, 'mixture_components': 9, 'use_sparse_layer': True, 'use_sparse_loss': False, 'use_batchnorm': False, 'use_dropout': True, 'dropout': 0.534706507256683, 'mlp_size_1': 2, 'mlp_size_2': 3, 'mlp_size_3': 0, 'kernel': 'Exponential', 'loss_name': 'CensoredNLLLoss'}. Best is trial 87 with value: 0.8866301826616875.[0m
[32m[I 2022-04-15 19:20:58,932][0m Trial 201 finished with value: 0.8841794677563396 and parameters: {'n_hidden': 1024, 'mixture_components': 10, 'use_sparse_layer': True, 'use_sparse_loss': False, 'use_batchnorm': False, 'use_dropout': True, 'dropout': 0.32351304057965624, 'mlp_size_1': 2, 'mlp_size_2': 3, 'mlp_size_3': 1, 'kernel': 'Weibull', 'loss_name': 'CensoredNLLLoss'}. Best is trial 87 with value: 0.8866301826616875.[0m
[32m[I 2022-04-15 19:23:29,842][0m Trial 202 finished with value: 0.884110295582461 and parameters: {'n_hidden': 1024, 'mixture_components': 10, 'use_sparse_layer': True, 'use_sparse_loss': False, 'use_batchnorm': False, 'use_dropout': True, 'dropout': 0.35177258900692826, 'mlp_size_1': 2, 'mlp_size_2': 3, 'mlp_size_3': 1, 'kernel': 'Weibull', 'loss_name': 'CensoredNLLLoss'}. Best is trial 87 with value: 0.8866301826616875.[0m
[32m[I 2022-04-15 19:25:38,348][0m Trial 203 finished with value: 0.8841321241150929 and parameters: {'n_hidden': 1024, 'mixture_components': 10, 'use_sparse_layer': True, 'use_sparse_loss': False, 'use_batchnorm': False, 'use_dropout': True, 'dropout': 0.2953926456071178, 'mlp_size_1': 2, 'mlp_size_2': 3, 'mlp_size_3': 1, 'kernel': 'Weibull', 'loss_name': 'CensoredNLLLoss'}. Best is trial 87 with value: 0.8866301826616875.[0m
[32m[I 2022-04-15 19:27:56,753][0m Trial 204 finished with value: 0.8865291032626723 and parameters: {'n_hidden': 1024, 'mixture_components': 10, 'use_sparse_layer': True, 'use_sparse_loss': False, 'use_batchnorm': False, 'use_dropout': True, 'dropout': 0.5869330220774952, 'mlp_size_1': 2, 'mlp_size_2': 3, 'mlp_size_3': 1, 'kernel': 'Weibull', 'loss_name': 'CensoredNLLLoss'}. Best is trial 87 with value: 0.8866301826616875.[0m
[32m[I 2022-04-15 19:30:16,836][0m Trial 205 finished with value: 0.8850179421098116 and parameters: {'n_hidden': 1024, 'mixture_components': 10, 'use_sparse_layer': True, 'use_sparse_loss': False, 'use_batchnorm': False, 'use_dropout': True, 'dropout': 0.5770001622763993, 'mlp_size_1': 2, 'mlp_size_2': 3, 'mlp_size_3': 1, 'kernel': 'Weibull', 'loss_name': 'CensoredNLLLoss'}. Best is trial 87 with value: 0.8866301826616875.[0m
[32m[I 2022-04-15 19:32:39,950][0m Trial 206 finished with value: 0.8838471130490536 and parameters: {'n_hidden': 1024, 'mixture_components': 10, 'use_sparse_layer': True, 'use_sparse_loss': True, 'lmbd': 0.008157559117938296, 'use_batchnorm': False, 'use_dropout': True, 'dropout': 0.598828733895795, 'mlp_size_1': 2, 'mlp_size_2': 3, 'mlp_size_3': 1, 'kernel': 'Weibull', 'loss_name': 'CensoredNLLLoss'}. Best is trial 87 with value: 0.8866301826616875.[0m
[32m[I 2022-04-15 19:34:43,027][0m Trial 207 finished with value: 0.8815980339963998 and parameters: {'n_hidden': 128, 'mixture_components': 10, 'use_sparse_layer': True, 'use_sparse_loss': False, 'use_batchnorm': False, 'use_dropout': True, 'dropout': 0.5545984993552493, 'mlp_size_1': 2, 'mlp_size_2': 2, 'mlp_size_3': 0, 'kernel': 'Gamma', 'loss_name': 'CensoredNLLLoss'}. Best is trial 87 with value: 0.8866301826616875.[0m
[32m[I 2022-04-15 19:37:13,323][0m Trial 208 finished with value: 0.8854979573705564 and parameters: {'n_hidden': 1024, 'mixture_components': 10, 'use_sparse_layer': True, 'use_sparse_loss': False, 'use_batchnorm': False, 'use_dropout': True, 'dropout': 0.6086488775691685, 'mlp_size_1': 3, 'mlp_size_2': 3, 'mlp_size_3': 1, 'kernel': 'Weibull', 'loss_name': 'CensoredNLLLoss'}. Best is trial 87 with value: 0.8866301826616875.[0m
[32m[I 2022-04-15 19:41:47,633][0m Trial 209 finished with value: 0.8850900765579611 and parameters: {'n_hidden': 1024, 'mixture_components': 8, 'use_sparse_layer': True, 'use_sparse_loss': True, 'lmbd': 0.03678545208836595, 'use_batchnorm': True, 'use_dropout': True, 'dropout': 0.6221059322813012, 'mlp_size_1': 3, 'mlp_size_2': 3, 'mlp_size_3': 1, 'kernel': 'Weibull', 'loss_name': 'CensoredNLLLoss'}. Best is trial 87 with value: 0.8866301826616875.[0m
[32m[I 2022-04-15 19:44:14,834][0m Trial 210 finished with value: 0.8856367576445592 and parameters: {'n_hidden': 1024, 'mixture_components': 10, 'use_sparse_layer': True, 'use_sparse_loss': False, 'use_batchnorm': False, 'use_dropout': True, 'dropout': 0.582093336667133, 'mlp_size_1': 3, 'mlp_size_2': 3, 'mlp_size_3': 1, 'kernel': 'Weibull', 'loss_name': 'CensoredNLLLoss'}. Best is trial 87 with value: 0.8866301826616875.[0m
[32m[I 2022-04-15 19:47:00,682][0m Trial 211 finished with value: 0.883838401416914 and parameters: {'n_hidden': 1024, 'mixture_components': 10, 'use_sparse_layer': True, 'use_sparse_loss': False, 'use_batchnorm': False, 'use_dropout': True, 'dropout': 0.6098713301620596, 'mlp_size_1': 3, 'mlp_size_2': 3, 'mlp_size_3': 1, 'kernel': 'Weibull', 'loss_name': 'CensoredNLLLoss'}. Best is trial 87 with value: 0.8866301826616875.[0m
[32m[I 2022-04-15 19:49:34,506][0m Trial 212 finished with value: 0.8836741325558932 and parameters: {'n_hidden': 1024, 'mixture_components': 10, 'use_sparse_layer': True, 'use_sparse_loss': False, 'use_batchnorm': False, 'use_dropout': True, 'dropout': 0.5820137642485215, 'mlp_size_1': 3, 'mlp_size_2': 3, 'mlp_size_3': 1, 'kernel': 'Weibull', 'loss_name': 'CensoredNLLLoss'}. Best is trial 87 with value: 0.8866301826616875.[0m
[32m[I 2022-04-15 19:52:17,315][0m Trial 213 finished with value: 0.8832300565823772 and parameters: {'n_hidden': 1024, 'mixture_components': 10, 'use_sparse_layer': True, 'use_sparse_loss': False, 'use_batchnorm': False, 'use_dropout': True, 'dropout': 0.6460738817712112, 'mlp_size_1': 3, 'mlp_size_2': 3, 'mlp_size_3': 1, 'kernel': 'Weibull', 'loss_name': 'CensoredNLLLoss'}. Best is trial 87 with value: 0.8866301826616875.[0m
[32m[I 2022-04-15 19:55:17,362][0m Trial 214 finished with value: 0.8813983419716742 and parameters: {'n_hidden': 64, 'mixture_components': 10, 'use_sparse_layer': True, 'use_sparse_loss': False, 'use_batchnorm': False, 'use_dropout': True, 'dropout': 0.5293828363672541, 'mlp_size_1': 2, 'mlp_size_2': 1, 'mlp_size_3': 0, 'kernel': 'Weibull', 'loss_name': 'CensoredNLLLoss'}. Best is trial 87 with value: 0.8866301826616875.[0m
[32m[I 2022-04-15 19:57:35,539][0m Trial 215 finished with value: 0.8772190454563902 and parameters: {'n_hidden': 1024, 'mixture_components': 10, 'use_sparse_layer': True, 'use_sparse_loss': False, 'use_batchnorm': False, 'use_dropout': True, 'dropout': 0.5699186502685983, 'mlp_size_1': 3, 'mlp_size_2': 3, 'mlp_size_3': 1, 'kernel': 'Weibull', 'loss_name': 'CensoredNLLLoss'}. Best is trial 87 with value: 0.8866301826616875.[0m
[32m[I 2022-04-15 19:59:59,057][0m Trial 216 finished with value: 0.8856328001962364 and parameters: {'n_hidden': 1024, 'mixture_components': 10, 'use_sparse_layer': True, 'use_sparse_loss': True, 'lmbd': 0.019685498408591812, 'use_batchnorm': False, 'use_dropout': True, 'dropout': 0.5524862949339445, 'mlp_size_1': 3, 'mlp_size_2': 3, 'mlp_size_3': 1, 'kernel': 'Weibull', 'loss_name': 'CensoredNLLLoss'}. Best is trial 87 with value: 0.8866301826616875.[0m
[32m[I 2022-04-15 20:02:29,497][0m Trial 217 finished with value: 0.8851476060755218 and parameters: {'n_hidden': 1024, 'mixture_components': 10, 'use_sparse_layer': True, 'use_sparse_loss': True, 'lmbd': 0.019240271520551466, 'use_batchnorm': False, 'use_dropout': True, 'dropout': 0.5457569884863811, 'mlp_size_1': 3, 'mlp_size_2': 3, 'mlp_size_3': 1, 'kernel': 'Weibull', 'loss_name': 'AlternativeNLLLoss'}. Best is trial 87 with value: 0.8866301826616875.[0m
[32m[I 2022-04-15 20:05:05,791][0m Trial 218 finished with value: 0.8841809327315403 and parameters: {'n_hidden': 1024, 'mixture_components': 10, 'use_sparse_layer': True, 'use_sparse_loss': True, 'lmbd': 0.05651429850014452, 'use_batchnorm': False, 'use_dropout': True, 'dropout': 0.5003918190969718, 'mlp_size_1': 3, 'mlp_size_2': 3, 'mlp_size_3': 1, 'kernel': 'Weibull', 'loss_name': 'CensoredNLLLoss'}. Best is trial 87 with value: 0.8866301826616875.[0m
[32m[I 2022-04-15 20:07:46,313][0m Trial 219 finished with value: 0.8815952567146821 and parameters: {'n_hidden': 1024, 'mixture_components': 10, 'use_sparse_layer': True, 'use_sparse_loss': True, 'lmbd': 0.08478573876208638, 'use_batchnorm': False, 'use_dropout': True, 'dropout': 0.5561358951122889, 'mlp_size_1': 3, 'mlp_size_2': 3, 'mlp_size_3': 1, 'kernel': 'Weibull', 'loss_name': 'CensoredNLLLoss'}. Best is trial 87 with value: 0.8866301826616875.[0m
[32m[I 2022-04-15 20:10:15,381][0m Trial 220 finished with value: 0.4368889371574555 and parameters: {'n_hidden': 1024, 'mixture_components': 10, 'use_sparse_layer': False, 'use_batchnorm': False, 'use_dropout': True, 'dropout': 0.5173903532369026, 'mlp_size_1': 3, 'mlp_size_2': 3, 'mlp_size_3': 1, 'kernel': 'Gumbel', 'loss_name': 'CensoredNLLLoss'}. Best is trial 87 with value: 0.8866301826616875.[0m
[32m[I 2022-04-15 20:12:56,873][0m Trial 221 finished with value: 0.8832660754579301 and parameters: {'n_hidden': 1024, 'mixture_components': 10, 'use_sparse_layer': True, 'use_sparse_loss': True, 'lmbd': 0.009650877356639994, 'use_batchnorm': False, 'use_dropout': True, 'dropout': 0.5900274308955509, 'mlp_size_1': 3, 'mlp_size_2': 3, 'mlp_size_3': 1, 'kernel': 'Weibull', 'loss_name': 'CensoredNLLLoss'}. Best is trial 87 with value: 0.8866301826616875.[0m
[32m[I 2022-04-15 20:15:45,567][0m Trial 222 finished with value: 0.8849054218687737 and parameters: {'n_hidden': 1024, 'mixture_components': 10, 'use_sparse_layer': True, 'use_sparse_loss': True, 'lmbd': 0.033836742362249574, 'use_batchnorm': False, 'use_dropout': True, 'dropout': 0.6309635780753446, 'mlp_size_1': 3, 'mlp_size_2': 3, 'mlp_size_3': 1, 'kernel': 'Weibull', 'loss_name': 'CensoredNLLLoss'}. Best is trial 87 with value: 0.8866301826616875.[0m
[32m[I 2022-04-15 20:18:20,099][0m Trial 223 finished with value: 0.8831009645002565 and parameters: {'n_hidden': 1024, 'mixture_components': 10, 'use_sparse_layer': True, 'use_sparse_loss': False, 'use_batchnorm': False, 'use_dropout': True, 'dropout': 0.605165543762904, 'mlp_size_1': 1, 'mlp_size_2': 3, 'mlp_size_3': 1, 'kernel': 'Weibull', 'loss_name': 'CensoredNLLLoss'}. Best is trial 87 with value: 0.8866301826616875.[0m
[32m[I 2022-04-15 20:21:05,082][0m Trial 224 finished with value: 0.8836875312346366 and parameters: {'n_hidden': 1024, 'mixture_components': 10, 'use_sparse_layer': True, 'use_sparse_loss': False, 'use_batchnorm': False, 'use_dropout': True, 'dropout': 0.575993569790207, 'mlp_size_1': 3, 'mlp_size_2': 3, 'mlp_size_3': 1, 'kernel': 'Weibull', 'loss_name': 'CensoredNLLLoss'}. Best is trial 87 with value: 0.8866301826616875.[0m
[32m[I 2022-04-15 20:24:07,289][0m Trial 225 finished with value: 0.8844051010672691 and parameters: {'n_hidden': 1024, 'mixture_components': 10, 'use_sparse_layer': True, 'use_sparse_loss': True, 'lmbd': 0.0207161865169285, 'use_batchnorm': False, 'use_dropout': True, 'dropout': 0.5367310193926588, 'mlp_size_1': 3, 'mlp_size_2': 3, 'mlp_size_3': 1, 'kernel': 'Weibull', 'loss_name': 'CensoredNLLLoss'}. Best is trial 87 with value: 0.8866301826616875.[0m
[32m[I 2022-04-15 20:26:42,425][0m Trial 226 finished with value: 0.8850823044042094 and parameters: {'n_hidden': 1024, 'mixture_components': 10, 'use_sparse_layer': True, 'use_sparse_loss': False, 'use_batchnorm': False, 'use_dropout': True, 'dropout': 0.47851637454990215, 'mlp_size_1': 2, 'mlp_size_2': 3, 'mlp_size_3': 1, 'kernel': 'Weibull', 'loss_name': 'CensoredNLLLoss'}. Best is trial 87 with value: 0.8866301826616875.[0m
[32m[I 2022-04-15 20:29:15,945][0m Trial 227 finished with value: 0.8861135539617127 and parameters: {'n_hidden': 1024, 'mixture_components': 10, 'use_sparse_layer': True, 'use_sparse_loss': False, 'use_batchnorm': False, 'use_dropout': True, 'dropout': 0.5937849204430894, 'mlp_size_1': 1, 'mlp_size_2': 3, 'mlp_size_3': 1, 'kernel': 'Weibull', 'loss_name': 'CensoredNLLLoss'}. Best is trial 87 with value: 0.8866301826616875.[0m
[32m[I 2022-04-15 20:31:23,016][0m Trial 228 finished with value: 0.7537033051804477 and parameters: {'n_hidden': 1024, 'mixture_components': 10, 'use_sparse_layer': True, 'use_sparse_loss': False, 'use_batchnorm': False, 'use_dropout': True, 'dropout': 0.559562726382155, 'mlp_size_1': 1, 'mlp_size_2': 3, 'mlp_size_3': 1, 'kernel': 'Weibull', 'loss_name': 'NLLLoss'}. Best is trial 87 with value: 0.8866301826616875.[0m
[32m[I 2022-04-15 20:34:29,714][0m Trial 229 finished with value: 0.7842110879113642 and parameters: {'n_hidden': 1024, 'mixture_components': 10, 'use_sparse_layer': True, 'use_sparse_loss': True, 'lmbd': 0.0690098051046246, 'use_batchnorm': False, 'use_dropout': True, 'dropout': 0.5889561249881122, 'mlp_size_1': 1, 'mlp_size_2': 3, 'mlp_size_3': 1, 'kernel': 'Normal', 'loss_name': 'CensoredNLLLoss'}. Best is trial 87 with value: 0.8866301826616875.[0m
[32m[I 2022-04-15 20:37:07,776][0m Trial 230 finished with value: 0.8847245201054166 and parameters: {'n_hidden': 1024, 'mixture_components': 10, 'use_sparse_layer': True, 'use_sparse_loss': False, 'use_batchnorm': False, 'use_dropout': True, 'dropout': 0.6184704903164402, 'mlp_size_1': 1, 'mlp_size_2': 3, 'mlp_size_3': 1, 'kernel': 'Weibull', 'loss_name': 'CensoredNLLLoss'}. Best is trial 87 with value: 0.8866301826616875.[0m
[32m[I 2022-04-15 20:39:42,697][0m Trial 231 finished with value: 0.8860469170289719 and parameters: {'n_hidden': 1024, 'mixture_components': 10, 'use_sparse_layer': True, 'use_sparse_loss': False, 'use_batchnorm': False, 'use_dropout': True, 'dropout': 0.5994425639448393, 'mlp_size_1': 1, 'mlp_size_2': 3, 'mlp_size_3': 1, 'kernel': 'Weibull', 'loss_name': 'CensoredNLLLoss'}. Best is trial 87 with value: 0.8866301826616875.[0m
[32m[I 2022-04-15 20:42:19,142][0m Trial 232 finished with value: 0.8846301146786908 and parameters: {'n_hidden': 1024, 'mixture_components': 10, 'use_sparse_layer': True, 'use_sparse_loss': False, 'use_batchnorm': False, 'use_dropout': True, 'dropout': 0.570967749465335, 'mlp_size_1': 1, 'mlp_size_2': 3, 'mlp_size_3': 1, 'kernel': 'Weibull', 'loss_name': 'CensoredNLLLoss'}. Best is trial 87 with value: 0.8866301826616875.[0m
[32m[I 2022-04-15 20:45:00,965][0m Trial 233 finished with value: 0.8851241166928338 and parameters: {'n_hidden': 1024, 'mixture_components': 10, 'use_sparse_layer': True, 'use_sparse_loss': False, 'use_batchnorm': False, 'use_dropout': True, 'dropout': 0.5944345994635917, 'mlp_size_1': 1, 'mlp_size_2': 3, 'mlp_size_3': 1, 'kernel': 'Weibull', 'loss_name': 'CensoredNLLLoss'}. Best is trial 87 with value: 0.8866301826616875.[0m
[32m[I 2022-04-15 20:47:40,209][0m Trial 234 finished with value: 0.8848775066522508 and parameters: {'n_hidden': 1024, 'mixture_components': 10, 'use_sparse_layer': True, 'use_sparse_loss': False, 'use_batchnorm': False, 'use_dropout': True, 'dropout': 0.5509480246820982, 'mlp_size_1': 1, 'mlp_size_2': 5, 'mlp_size_3': 1, 'kernel': 'Weibull', 'loss_name': 'CensoredNLLLoss'}. Best is trial 87 with value: 0.8866301826616875.[0m
[32m[I 2022-04-15 20:50:28,134][0m Trial 235 finished with value: 0.7683882815371815 and parameters: {'n_hidden': 32, 'mixture_components': 10, 'use_sparse_layer': True, 'use_sparse_loss': False, 'use_batchnorm': False, 'use_dropout': True, 'dropout': 0.631084580414118, 'mlp_size_1': 2, 'mlp_size_2': 0, 'mlp_size_3': 0, 'kernel': 'Weibull', 'loss_name': 'CensoredNLLLoss'}. Best is trial 87 with value: 0.8866301826616875.[0m
[32m[I 2022-04-15 20:52:54,519][0m Trial 236 finished with value: 0.8807966652552937 and parameters: {'n_hidden': 1024, 'mixture_components': 10, 'use_sparse_layer': True, 'use_sparse_loss': False, 'use_batchnorm': False, 'use_dropout': True, 'dropout': 0.61018385161633, 'mlp_size_1': 1, 'mlp_size_2': 3, 'mlp_size_3': 1, 'kernel': 'Weibull', 'loss_name': 'CensoredNLLLoss'}. Best is trial 87 with value: 0.8866301826616875.[0m
[32m[I 2022-04-15 20:55:43,270][0m Trial 237 finished with value: 0.7774861596717837 and parameters: {'n_hidden': 1024, 'mixture_components': 10, 'use_sparse_layer': True, 'use_sparse_loss': True, 'lmbd': 2.4327275128213563e-05, 'use_batchnorm': False, 'use_dropout': True, 'dropout': 0.4026836377254351, 'mlp_size_1': 1, 'mlp_size_2': 3, 'mlp_size_3': 1, 'kernel': 'LogNormal', 'loss_name': 'CensoredNLLLoss'}. Best is trial 87 with value: 0.8866301826616875.[0m
[32m[I 2022-04-15 20:58:18,434][0m Trial 238 finished with value: 0.8828544202838813 and parameters: {'n_hidden': 1024, 'mixture_components': 9, 'use_sparse_layer': True, 'use_sparse_loss': False, 'use_batchnorm': False, 'use_dropout': True, 'dropout': 0.5744330307998263, 'mlp_size_1': 1, 'mlp_size_2': 3, 'mlp_size_3': 1, 'kernel': 'Weibull', 'loss_name': 'CensoredNLLLoss'}. Best is trial 87 with value: 0.8866301826616875.[0m
[32m[I 2022-04-15 21:00:44,773][0m Trial 239 finished with value: 0.8847197186832195 and parameters: {'n_hidden': 1024, 'mixture_components': 10, 'use_sparse_layer': True, 'use_sparse_loss': False, 'use_batchnorm': False, 'use_dropout': True, 'dropout': 0.42753038593496606, 'mlp_size_1': 3, 'mlp_size_2': 3, 'mlp_size_3': 1, 'kernel': 'Weibull', 'loss_name': 'CensoredNLLLoss'}. Best is trial 87 with value: 0.8866301826616875.[0m
[32m[I 2022-04-15 21:03:06,213][0m Trial 240 finished with value: 0.87777825640358 and parameters: {'n_hidden': 1024, 'mixture_components': 10, 'use_sparse_layer': True, 'use_sparse_loss': True, 'lmbd': 0.013261555379842612, 'use_batchnorm': False, 'use_dropout': True, 'dropout': 0.009533913291541352, 'mlp_size_1': 1, 'mlp_size_2': 3, 'mlp_size_3': 1, 'kernel': 'Weibull', 'loss_name': 'CensoredNLLLoss'}. Best is trial 87 with value: 0.8866301826616875.[0m
[32m[I 2022-04-15 21:06:00,712][0m Trial 241 finished with value: 0.8809254372952872 and parameters: {'n_hidden': 1024, 'mixture_components': 10, 'use_sparse_layer': True, 'use_sparse_loss': False, 'use_batchnorm': False, 'use_dropout': True, 'dropout': 0.5998612345976166, 'mlp_size_1': 2, 'mlp_size_2': 3, 'mlp_size_3': 1, 'kernel': 'Weibull', 'loss_name': 'CensoredNLLLoss'}. Best is trial 87 with value: 0.8866301826616875.[0m
[32m[I 2022-04-15 21:08:46,817][0m Trial 242 finished with value: 0.8767453469272223 and parameters: {'n_hidden': 1024, 'mixture_components': 10, 'use_sparse_layer': True, 'use_sparse_loss': False, 'use_batchnorm': False, 'use_dropout': True, 'dropout': 0.6617566889751663, 'mlp_size_1': 2, 'mlp_size_2': 3, 'mlp_size_3': 1, 'kernel': 'Weibull', 'loss_name': 'CensoredNLLLoss'}. Best is trial 87 with value: 0.8866301826616875.[0m
[32m[I 2022-04-15 21:11:14,398][0m Trial 243 finished with value: 0.8849288541855553 and parameters: {'n_hidden': 1024, 'mixture_components': 10, 'use_sparse_layer': True, 'use_sparse_loss': False, 'use_batchnorm': False, 'use_dropout': True, 'dropout': 0.5858723697249895, 'mlp_size_1': 2, 'mlp_size_2': 3, 'mlp_size_3': 1, 'kernel': 'Weibull', 'loss_name': 'CensoredNLLLoss'}. Best is trial 87 with value: 0.8866301826616875.[0m
[32m[I 2022-04-15 21:13:47,580][0m Trial 244 finished with value: 0.8820917088560376 and parameters: {'n_hidden': 1024, 'mixture_components': 10, 'use_sparse_layer': True, 'use_sparse_loss': False, 'use_batchnorm': False, 'use_dropout': True, 'dropout': 0.6179758215603223, 'mlp_size_1': 2, 'mlp_size_2': 3, 'mlp_size_3': 1, 'kernel': 'Weibull', 'loss_name': 'CensoredNLLLoss'}. Best is trial 87 with value: 0.8866301826616875.[0m
[32m[I 2022-04-15 21:16:30,620][0m Trial 245 finished with value: 0.8845284671281142 and parameters: {'n_hidden': 1024, 'mixture_components': 4, 'use_sparse_layer': True, 'use_sparse_loss': False, 'use_batchnorm': False, 'use_dropout': True, 'dropout': 0.5226550476096474, 'mlp_size_1': 2, 'mlp_size_2': 3, 'mlp_size_3': 1, 'kernel': 'Weibull', 'loss_name': 'CensoredNLLLoss'}. Best is trial 87 with value: 0.8866301826616875.[0m
[32m[I 2022-04-15 21:18:46,997][0m Trial 246 finished with value: 0.7854328359531109 and parameters: {'n_hidden': 1024, 'mixture_components': 3, 'use_sparse_layer': True, 'use_sparse_loss': False, 'use_batchnorm': False, 'use_dropout': True, 'dropout': 0.4879480114146703, 'mlp_size_1': 1, 'mlp_size_2': 3, 'mlp_size_3': 1, 'kernel': 'LogLogistic', 'loss_name': 'CensoredNLLLoss'}. Best is trial 87 with value: 0.8866301826616875.[0m
[32m[I 2022-04-15 21:21:17,958][0m Trial 247 finished with value: 0.8832458835236942 and parameters: {'n_hidden': 128, 'mixture_components': 10, 'use_sparse_layer': True, 'use_sparse_loss': False, 'use_batchnorm': False, 'use_dropout': True, 'dropout': 0.5623131415363016, 'mlp_size_1': 2, 'mlp_size_2': 2, 'mlp_size_3': 0, 'kernel': 'Weibull', 'loss_name': 'CensoredNLLLoss'}. Best is trial 87 with value: 0.8866301826616875.[0m
[32m[I 2022-04-15 21:23:45,019][0m Trial 248 finished with value: 0.6851622224711618 and parameters: {'n_hidden': 1024, 'mixture_components': 10, 'use_sparse_layer': True, 'use_sparse_loss': True, 'lmbd': 0.003199424486208872, 'use_batchnorm': False, 'use_dropout': True, 'dropout': 0.6399243748744872, 'mlp_size_1': 3, 'mlp_size_2': 3, 'mlp_size_3': 1, 'kernel': 'Exponential', 'loss_name': 'CensoredNLLLoss'}. Best is trial 87 with value: 0.8866301826616875.[0m
