[32m[I 2022-04-14 13:20:38,470][0m Trial 570 finished with value: 0.7769079058466181 and parameters: {'loss': 'coxph', 'learning_rate': 5.901147606674849e-06, 'n_estimators': 851, 'criterion': 'friedman_mse', 'min_samples_split': 8, 'min_samples_leaf': 1, 'min_weight_fraction_leaf': 0.3498291798341256, 'min_impurity_decrease': 0.24275497392486775, 'max_features': 0.7843336485218291, 'subsample': 0.07676401439791936, 'dropout_rate': 0.4620231213410991, 'ccp_alpha': 0.16400522347165522}. Best is trial 367 with value: 0.7817487788378487.[0m
[32m[I 2022-04-14 13:23:28,756][0m Trial 571 finished with value: 0.7803392281170203 and parameters: {'loss': 'coxph', 'learning_rate': 4.333799263391528e-06, 'n_estimators': 809, 'criterion': 'friedman_mse', 'min_samples_split': 8, 'min_samples_leaf': 1, 'min_weight_fraction_leaf': 0.33658366878120033, 'min_impurity_decrease': 0.29553634633390347, 'max_features': 0.8964791999748043, 'subsample': 0.045055743642607615, 'dropout_rate': 0.5041225222422278, 'ccp_alpha': 0.08612877858467433}. Best is trial 367 with value: 0.7817487788378487.[0m
[32m[I 2022-04-14 13:26:41,070][0m Trial 572 finished with value: 0.7795891070486347 and parameters: {'loss': 'coxph', 'learning_rate': 2.0024865400954673e-05, 'n_estimators': 924, 'criterion': 'friedman_mse', 'min_samples_split': 8, 'min_samples_leaf': 1, 'min_weight_fraction_leaf': 0.320689704940034, 'min_impurity_decrease': 0.26656903445926444, 'max_features': 0.8643292655852057, 'subsample': 0.09188682623473449, 'dropout_rate': 0.5447461292786375, 'ccp_alpha': 0.08862827183639786}. Best is trial 367 with value: 0.7817487788378487.[0m
[32m[I 2022-04-14 13:29:34,636][0m Trial 573 finished with value: 0.7811771633046882 and parameters: {'loss': 'coxph', 'learning_rate': 1.5137631813555758e-05, 'n_estimators': 863, 'criterion': 'friedman_mse', 'min_samples_split': 8, 'min_samples_leaf': 1, 'min_weight_fraction_leaf': 0.36507053779817084, 'min_impurity_decrease': 0.2876287540872707, 'max_features': 0.9371077914203588, 'subsample': 0.07185468233321785, 'dropout_rate': 0.5564319452606419, 'ccp_alpha': 0.0036089670689500126}. Best is trial 367 with value: 0.7817487788378487.[0m
[32m[I 2022-04-14 13:32:18,340][0m Trial 574 finished with value: 0.7806658415266311 and parameters: {'loss': 'coxph', 'learning_rate': 1.5161837229758218e-05, 'n_estimators': 828, 'criterion': 'friedman_mse', 'min_samples_split': 8, 'min_samples_leaf': 1, 'min_weight_fraction_leaf': 0.36677107552890975, 'min_impurity_decrease': 0.33935207171530046, 'max_features': 0.9699580330954749, 'subsample': 0.12394397592059009, 'dropout_rate': 0.5611954270251055, 'ccp_alpha': 0.0022884936603599117}. Best is trial 367 with value: 0.7817487788378487.[0m
[32m[I 2022-04-14 13:35:12,326][0m Trial 575 finished with value: 0.7786112620921488 and parameters: {'loss': 'coxph', 'learning_rate': 2.090420226559074e-05, 'n_estimators': 889, 'criterion': 'friedman_mse', 'min_samples_split': 8, 'min_samples_leaf': 1, 'min_weight_fraction_leaf': 0.37849895016818, 'min_impurity_decrease': 0.30848229281634815, 'max_features': 0.9291048844422917, 'subsample': 0.04291892414267068, 'dropout_rate': 0.6060796837672429, 'ccp_alpha': 0.2548487749648485}. Best is trial 367 with value: 0.7817487788378487.[0m
[32m[I 2022-04-14 13:37:15,469][0m Trial 576 finished with value: 0.7737612600871235 and parameters: {'loss': 'coxph', 'learning_rate': 1.4203339029854367e-05, 'n_estimators': 718, 'criterion': 'friedman_mse', 'min_samples_split': 8, 'min_samples_leaf': 2, 'min_weight_fraction_leaf': 0.39272724302056705, 'min_impurity_decrease': 0.39811534033189766, 'max_features': 0.9520945213903601, 'subsample': 0.09460248787595961, 'dropout_rate': 0.5808868215148008, 'ccp_alpha': 0.169492066155786}. Best is trial 367 with value: 0.7817487788378487.[0m
[32m[I 2022-04-14 13:39:29,713][0m Trial 577 finished with value: 0.638288755790546 and parameters: {'loss': 'coxph', 'learning_rate': 1.6702279861281187e-05, 'n_estimators': 783, 'criterion': 'friedman_mse', 'min_samples_split': 8, 'min_samples_leaf': 1, 'min_weight_fraction_leaf': 0.37021171268953124, 'min_impurity_decrease': 0.3656950942716333, 'max_features': 0.9245725192125771, 'subsample': 0.0620716030857678, 'dropout_rate': 0.6277828870103951, 'ccp_alpha': 0.3134022751063686}. Best is trial 367 with value: 0.7817487788378487.[0m
[32m[I 2022-04-14 13:42:43,488][0m Trial 578 finished with value: 0.7816730905692464 and parameters: {'loss': 'coxph', 'learning_rate': 1.13398218650548e-05, 'n_estimators': 952, 'criterion': 'friedman_mse', 'min_samples_split': 8, 'min_samples_leaf': 2, 'min_weight_fraction_leaf': 0.38160786940889724, 'min_impurity_decrease': 0.32752978542924427, 'max_features': 0.9434694191073346, 'subsample': 0.11875770971363336, 'dropout_rate': 0.5567721015317811, 'ccp_alpha': 0.003331251238852555}. Best is trial 367 with value: 0.7817487788378487.[0m
[32m[I 2022-04-14 13:46:19,359][0m Trial 579 finished with value: 0.7799131888860398 and parameters: {'loss': 'coxph', 'learning_rate': 1.1490278339194055e-05, 'n_estimators': 1000, 'criterion': 'friedman_mse', 'min_samples_split': 8, 'min_samples_leaf': 2, 'min_weight_fraction_leaf': 0.3618264623007907, 'min_impurity_decrease': 0.3308976732762189, 'max_features': 0.9584897378230419, 'subsample': 0.018983512556801065, 'dropout_rate': 0.5521276828187724, 'ccp_alpha': 0.16162646199484265}. Best is trial 367 with value: 0.7817487788378487.[0m
[32m[I 2022-04-14 13:49:35,871][0m Trial 580 finished with value: 0.7793102286064948 and parameters: {'loss': 'coxph', 'learning_rate': 1.1585250033241173e-05, 'n_estimators': 947, 'criterion': 'friedman_mse', 'min_samples_split': 8, 'min_samples_leaf': 2, 'min_weight_fraction_leaf': 0.37616789892189534, 'min_impurity_decrease': 0.3516027778711735, 'max_features': 0.9303183341351161, 'subsample': 0.10987652857603095, 'dropout_rate': 0.5141089167754577, 'ccp_alpha': 0.11251958512207369}. Best is trial 367 with value: 0.7817487788378487.[0m
[32m[I 2022-04-14 13:52:52,528][0m Trial 581 finished with value: 0.7805705151700366 and parameters: {'loss': 'coxph', 'learning_rate': 9.761451623077977e-06, 'n_estimators': 962, 'criterion': 'friedman_mse', 'min_samples_split': 8, 'min_samples_leaf': 2, 'min_weight_fraction_leaf': 0.3972380382036288, 'min_impurity_decrease': 0.3722439254005025, 'max_features': 0.9492295195534729, 'subsample': 0.08243996455506289, 'dropout_rate': 0.556859708267947, 'ccp_alpha': 0.0848738106836269}. Best is trial 367 with value: 0.7817487788378487.[0m
[32m[I 2022-04-14 13:54:51,696][0m Trial 582 finished with value: -0.35892940437704074 and parameters: {'loss': 'squared', 'learning_rate': 2.3754980711136737e-05, 'n_estimators': 924, 'criterion': 'friedman_mse', 'min_samples_split': 8, 'min_samples_leaf': 3, 'min_weight_fraction_leaf': 0.41373974854786333, 'min_impurity_decrease': 0.3179441451192025, 'max_features': 0.94744143721809, 'subsample': 0.11410024729652495, 'dropout_rate': 0.5302908773611215, 'ccp_alpha': 0.22834028011055663}. Best is trial 367 with value: 0.7817487788378487.[0m
[32m[I 2022-04-14 13:57:59,818][0m Trial 583 finished with value: 0.7803290096632949 and parameters: {'loss': 'coxph', 'learning_rate': 7.361857535329121e-06, 'n_estimators': 858, 'criterion': 'friedman_mse', 'min_samples_split': 8, 'min_samples_leaf': 2, 'min_weight_fraction_leaf': 0.3667564657934019, 'min_impurity_decrease': 0.3357720660005414, 'max_features': 0.9731735981022736, 'subsample': 0.07022170254279861, 'dropout_rate': 0.48733051614522643, 'ccp_alpha': 0.08129565275363729}. Best is trial 367 with value: 0.7817487788378487.[0m
[32m[I 2022-04-14 14:01:12,159][0m Trial 584 finished with value: 0.7676503654386593 and parameters: {'loss': 'coxph', 'learning_rate': 9.003306763221118e-06, 'n_estimators': 957, 'criterion': 'friedman_mse', 'min_samples_split': 8, 'min_samples_leaf': 1, 'min_weight_fraction_leaf': 0.38580400548198596, 'min_impurity_decrease': 0.29360398531189436, 'max_features': 0.9977525221720231, 'subsample': 0.14931334236359153, 'dropout_rate': 0.5638486946927829, 'ccp_alpha': 0.16487812534087185}. Best is trial 367 with value: 0.7817487788378487.[0m
[32m[I 2022-04-14 14:04:18,154][0m Trial 585 finished with value: 0.7793454359650317 and parameters: {'loss': 'coxph', 'learning_rate': 1.2288149082755969e-05, 'n_estimators': 893, 'criterion': 'friedman_mse', 'min_samples_split': 8, 'min_samples_leaf': 2, 'min_weight_fraction_leaf': 0.37640683890450216, 'min_impurity_decrease': 0.32434811222422766, 'max_features': 0.7544360121120148, 'subsample': 0.08877740714002971, 'dropout_rate': 0.541508276180223, 'ccp_alpha': 0.0016274861710925497}. Best is trial 367 with value: 0.7817487788378487.[0m
[32m[I 2022-04-14 14:06:45,370][0m Trial 586 finished with value: 0.609834169948251 and parameters: {'loss': 'coxph', 'learning_rate': 1.6434718300750865e-05, 'n_estimators': 831, 'criterion': 'friedman_mse', 'min_samples_split': 8, 'min_samples_leaf': 2, 'min_weight_fraction_leaf': 0.35959508393928935, 'min_impurity_decrease': 0.34993302285744227, 'max_features': 0.9377180525022015, 'subsample': 0.03996318266765288, 'dropout_rate': 0.5993754423401514, 'ccp_alpha': 0.44918610968497363}. Best is trial 367 with value: 0.7817487788378487.[0m
[32m[I 2022-04-14 14:09:38,675][0m Trial 587 finished with value: 0.4829336714255586 and parameters: {'loss': 'coxph', 'learning_rate': 7.023407498394652e-06, 'n_estimators': 923, 'criterion': 'friedman_mse', 'min_samples_split': 8, 'min_samples_leaf': 2, 'min_weight_fraction_leaf': 0.3948964202718344, 'min_impurity_decrease': 0.38259748946971284, 'max_features': 0.9094443563344146, 'subsample': 0.1271410427593172, 'dropout_rate': 0.5705022366193329, 'ccp_alpha': 0.33443212522892996}. Best is trial 367 with value: 0.7817487788378487.[0m
[32m[I 2022-04-14 14:11:58,499][0m Trial 588 finished with value: 0.7800230718184276 and parameters: {'loss': 'coxph', 'learning_rate': 9.837050923747645e-06, 'n_estimators': 760, 'criterion': 'friedman_mse', 'min_samples_split': 8, 'min_samples_leaf': 2, 'min_weight_fraction_leaf': 0.37148687441766304, 'min_impurity_decrease': 0.28053972042216996, 'max_features': 0.9733373126380067, 'subsample': 0.09835437206962946, 'dropout_rate': 0.5204643535669706, 'ccp_alpha': 0.0032530829847402043}. Best is trial 367 with value: 0.7817487788378487.[0m
[32m[I 2022-04-14 14:14:45,906][0m Trial 589 finished with value: 0.779353771102973 and parameters: {'loss': 'coxph', 'learning_rate': 5.956373455724058e-06, 'n_estimators': 879, 'criterion': 'friedman_mse', 'min_samples_split': 7, 'min_samples_leaf': 1, 'min_weight_fraction_leaf': 0.3845278405835863, 'min_impurity_decrease': 0.253333721524344, 'max_features': 0.9186841161877496, 'subsample': 0.06262327214434749, 'dropout_rate': 0.5480997915219312, 'ccp_alpha': 0.18517071399571103}. Best is trial 367 with value: 0.7817487788378487.[0m
[32m[I 2022-04-14 14:17:02,250][0m Trial 590 finished with value: 0.7773949619844485 and parameters: {'loss': 'coxph', 'learning_rate': 8.26077156779521e-06, 'n_estimators': 810, 'criterion': 'friedman_mse', 'min_samples_split': 8, 'min_samples_leaf': 2, 'min_weight_fraction_leaf': 0.406643810960092, 'min_impurity_decrease': 0.21961877533827762, 'max_features': 0.938226185994471, 'subsample': 0.17303428970225793, 'dropout_rate': 0.5809580083994302, 'ccp_alpha': 0.09850888681719332}. Best is trial 367 with value: 0.7817487788378487.[0m
[32m[I 2022-04-14 14:20:02,283][0m Trial 591 finished with value: 0.6371812073302544 and parameters: {'loss': 'coxph', 'learning_rate': 1.201615001653435e-05, 'n_estimators': 960, 'criterion': 'friedman_mse', 'min_samples_split': 8, 'min_samples_leaf': 2, 'min_weight_fraction_leaf': 0.3622145708425745, 'min_impurity_decrease': 0.3040823244633741, 'max_features': 0.8217545292852458, 'subsample': 0.11266012184318044, 'dropout_rate': 0.6108913511445974, 'ccp_alpha': 0.23834275284068}. Best is trial 367 with value: 0.7817487788378487.[0m
[32m[I 2022-04-14 14:23:45,293][0m Trial 592 finished with value: 0.7802246345602859 and parameters: {'loss': 'coxph', 'learning_rate': 1.5679006086373623e-05, 'n_estimators': 1000, 'criterion': 'friedman_mse', 'min_samples_split': 8, 'min_samples_leaf': 2, 'min_weight_fraction_leaf': 0.37973486067906687, 'min_impurity_decrease': 0.31866914438911786, 'max_features': 0.8380286266892426, 'subsample': 0.0784857634753344, 'dropout_rate': 0.5599521067946142, 'ccp_alpha': 0.08841663806636384}. Best is trial 367 with value: 0.7817487788378487.[0m
[32m[I 2022-04-14 14:26:35,890][0m Trial 593 finished with value: 0.779907789406115 and parameters: {'loss': 'coxph', 'learning_rate': 1.0474966599779203e-05, 'n_estimators': 856, 'criterion': 'friedman_mse', 'min_samples_split': 8, 'min_samples_leaf': 1, 'min_weight_fraction_leaf': 0.39102521146487956, 'min_impurity_decrease': 0.34021989774035105, 'max_features': 0.908225232696177, 'subsample': 0.1381867577383322, 'dropout_rate': 0.5294305636121459, 'ccp_alpha': 0.0023774533282522057}. Best is trial 367 with value: 0.7817487788378487.[0m
[32m[I 2022-04-14 14:29:27,452][0m Trial 594 finished with value: 0.7809885455479192 and parameters: {'loss': 'coxph', 'learning_rate': 6.4673249960609766e-06, 'n_estimators': 916, 'criterion': 'friedman_mse', 'min_samples_split': 10, 'min_samples_leaf': 2, 'min_weight_fraction_leaf': 0.3492405931561527, 'min_impurity_decrease': 0.29076130656588495, 'max_features': 0.8622314536387925, 'subsample': 0.05481643880755885, 'dropout_rate': 0.6466404788374016, 'ccp_alpha': 0.0012264723175770126}. Best is trial 367 with value: 0.7817487788378487.[0m
[32m[I 2022-04-14 14:32:21,116][0m Trial 595 finished with value: 0.7828124688588588 and parameters: {'loss': 'coxph', 'learning_rate': 5.5231695405414835e-06, 'n_estimators': 924, 'criterion': 'friedman_mse', 'min_samples_split': 10, 'min_samples_leaf': 2, 'min_weight_fraction_leaf': 0.3407806718177387, 'min_impurity_decrease': 0.2731036556334936, 'max_features': 0.8838938520287253, 'subsample': 0.024965250045585374, 'dropout_rate': 0.6584560591692825, 'ccp_alpha': 0.0012584052356229558}. Best is trial 595 with value: 0.7828124688588588.[0m
[32m[I 2022-04-14 14:35:06,026][0m Trial 596 finished with value: 0.25 and parameters: {'loss': 'coxph', 'learning_rate': 5.3416073499547655e-06, 'n_estimators': 921, 'criterion': 'friedman_mse', 'min_samples_split': 10, 'min_samples_leaf': 2, 'min_weight_fraction_leaf': 0.32941378057115833, 'min_impurity_decrease': 0.2400136361709145, 'max_features': 0.8721856787455463, 'subsample': 0.011692168765614875, 'dropout_rate': 0.6573472789368151, 'ccp_alpha': 0.17456649929158333}. Best is trial 595 with value: 0.7828124688588588.[0m
[32m[I 2022-04-14 14:37:51,416][0m Trial 597 finished with value: 0.7796276593054187 and parameters: {'loss': 'coxph', 'learning_rate': 2.761299647918813e-05, 'n_estimators': 911, 'criterion': 'friedman_mse', 'min_samples_split': 10, 'min_samples_leaf': 3, 'min_weight_fraction_leaf': 0.3353833779602729, 'min_impurity_decrease': 0.2627697794616552, 'max_features': 0.8445302798172059, 'subsample': 0.027751676275397645, 'dropout_rate': 0.6620790515909686, 'ccp_alpha': 0.1055653706201351}. Best is trial 595 with value: 0.7828124688588588.[0m
[32m[I 2022-04-14 14:40:24,134][0m Trial 598 finished with value: 0.25 and parameters: {'loss': 'coxph', 'learning_rate': 5.589254000336971e-06, 'n_estimators': 881, 'criterion': 'friedman_mse', 'min_samples_split': 10, 'min_samples_leaf': 2, 'min_weight_fraction_leaf': 0.3477218318853242, 'min_impurity_decrease': 0.26042344227813313, 'max_features': 0.8818425578371563, 'subsample': 0.0012557729900310732, 'dropout_rate': 0.680102998509409, 'ccp_alpha': 0.29833411277522465}. Best is trial 595 with value: 0.7828124688588588.[0m
[32m[I 2022-04-14 14:42:49,442][0m Trial 599 finished with value: 0.7795481780089029 and parameters: {'loss': 'coxph', 'learning_rate': 3.2668864863727143e-06, 'n_estimators': 830, 'criterion': 'friedman_mse', 'min_samples_split': 10, 'min_samples_leaf': 2, 'min_weight_fraction_leaf': 0.31160523250266026, 'min_impurity_decrease': 0.2840596096110245, 'max_features': 0.8303091951276289, 'subsample': 0.02622333610914887, 'dropout_rate': 0.6517400264957709, 'ccp_alpha': 0.17883103471143236}. Best is trial 595 with value: 0.7828124688588588.[0m
[32m[I 2022-04-14 14:45:42,424][0m Trial 600 finished with value: 0.780186180293793 and parameters: {'loss': 'coxph', 'learning_rate': 6.251151381794514e-06, 'n_estimators': 956, 'criterion': 'friedman_mse', 'min_samples_split': 10, 'min_samples_leaf': 2, 'min_weight_fraction_leaf': 0.33739582772904064, 'min_impurity_decrease': 0.1986310395832936, 'max_features': 0.8566036740557725, 'subsample': 0.043152046645325, 'dropout_rate': 0.6740003290970673, 'ccp_alpha': 0.09011352832050104}. Best is trial 595 with value: 0.7828124688588588.[0m
[32m[I 2022-04-14 14:47:55,436][0m Trial 601 finished with value: 0.778880000989656 and parameters: {'loss': 'coxph', 'learning_rate': 4.002779530843217e-06, 'n_estimators': 782, 'criterion': 'friedman_mse', 'min_samples_split': 10, 'min_samples_leaf': 2, 'min_weight_fraction_leaf': 0.3478390095571088, 'min_impurity_decrease': 0.2725345845324, 'max_features': 0.8836027835225441, 'subsample': 0.0207944474027568, 'dropout_rate': 0.6578291020972455, 'ccp_alpha': 0.26165773652436675}. Best is trial 595 with value: 0.7828124688588588.[0m
[32m[I 2022-04-14 14:50:44,685][0m Trial 602 finished with value: 0.7813047504656947 and parameters: {'loss': 'coxph', 'learning_rate': 5.2468220735388e-06, 'n_estimators': 908, 'criterion': 'friedman_mse', 'min_samples_split': 10, 'min_samples_leaf': 2, 'min_weight_fraction_leaf': 0.34741764441597306, 'min_impurity_decrease': 0.4366389584011422, 'max_features': 0.8676150975839093, 'subsample': 0.0517738022576333, 'dropout_rate': 0.6427807715623323, 'ccp_alpha': 0.004077386241707729}. Best is trial 595 with value: 0.7828124688588588.[0m
[32m[I 2022-04-14 14:52:24,315][0m Trial 603 finished with value: -0.3702752322935156 and parameters: {'loss': 'squared', 'learning_rate': 5.150937009114591e-06, 'n_estimators': 919, 'criterion': 'friedman_mse', 'min_samples_split': 10, 'min_samples_leaf': 2, 'min_weight_fraction_leaf': 0.32178450715799634, 'min_impurity_decrease': 0.2363440823082796, 'max_features': 0.8530453195971454, 'subsample': 0.05051846231230916, 'dropout_rate': 0.6392244417577972, 'ccp_alpha': 0.0962774357201861}. Best is trial 595 with value: 0.7828124688588588.[0m
[32m[I 2022-04-14 14:52:43,026][0m Trial 604 finished with value: 0.7773739560904003 and parameters: {'loss': 'coxph', 'learning_rate': 4.25127453755712e-06, 'n_estimators': 182, 'criterion': 'friedman_mse', 'min_samples_split': 10, 'min_samples_leaf': 2, 'min_weight_fraction_leaf': 0.34093754219440203, 'min_impurity_decrease': 0.45650694455852014, 'max_features': 0.8247132667964209, 'subsample': 0.02362121799335397, 'dropout_rate': 0.6992690974826046, 'ccp_alpha': 0.0019510062226632562}. Best is trial 595 with value: 0.7828124688588588.[0m
[32m[I 2022-04-14 14:55:13,627][0m Trial 605 finished with value: 0.7797077048063901 and parameters: {'loss': 'coxph', 'learning_rate': 3.576471672160344e-06, 'n_estimators': 852, 'criterion': 'friedman_mse', 'min_samples_split': 10, 'min_samples_leaf': 2, 'min_weight_fraction_leaf': 0.34950189555637823, 'min_impurity_decrease': 0.41919039610774833, 'max_features': 0.8687014463105269, 'subsample': 0.047319191317653705, 'dropout_rate': 0.6649980006505911, 'ccp_alpha': 0.18867669774410234}. Best is trial 595 with value: 0.7828124688588588.[0m
[32m[I 2022-04-14 14:58:15,487][0m Trial 606 finished with value: 0.7413414479581082 and parameters: {'loss': 'coxph', 'learning_rate': 5.039327296541684e-06, 'n_estimators': 964, 'criterion': 'friedman_mse', 'min_samples_split': 10, 'min_samples_leaf': 2, 'min_weight_fraction_leaf': 0.3241528551489847, 'min_impurity_decrease': 0.38937079559173826, 'max_features': 0.8445682343697762, 'subsample': 0.0428460829045286, 'dropout_rate': 0.6450906854471316, 'ccp_alpha': 0.3989465115178783}. Best is trial 595 with value: 0.7828124688588588.[0m
[32m[I 2022-04-14 15:00:50,090][0m Trial 607 finished with value: 0.7796185638810347 and parameters: {'loss': 'coxph', 'learning_rate': 6.404927573575508e-06, 'n_estimators': 876, 'criterion': 'friedman_mse', 'min_samples_split': 10, 'min_samples_leaf': 3, 'min_weight_fraction_leaf': 0.343158848255991, 'min_impurity_decrease': 0.40824092592202543, 'max_features': 0.7853659442971247, 'subsample': 0.055990994516298846, 'dropout_rate': 0.6316028108379076, 'ccp_alpha': 0.16075397998665486}. Best is trial 595 with value: 0.7828124688588588.[0m
[32m[I 2022-04-14 15:04:10,029][0m Trial 608 finished with value: 0.780376576539973 and parameters: {'loss': 'coxph', 'learning_rate': 2.9633615753668414e-06, 'n_estimators': 1000, 'criterion': 'friedman_mse', 'min_samples_split': 10, 'min_samples_leaf': 2, 'min_weight_fraction_leaf': 0.35198133718573915, 'min_impurity_decrease': 0.3865114984259215, 'max_features': 0.8704812060091804, 'subsample': 0.02852474756925201, 'dropout_rate': 0.6378884497410875, 'ccp_alpha': 0.09835514524618058}. Best is trial 595 with value: 0.7828124688588588.[0m
[32m[I 2022-04-14 15:06:26,149][0m Trial 609 finished with value: 0.25 and parameters: {'loss': 'coxph', 'learning_rate': 6.533183691361293e-06, 'n_estimators': 823, 'criterion': 'friedman_mse', 'min_samples_split': 10, 'min_samples_leaf': 2, 'min_weight_fraction_leaf': 0.3364074129561307, 'min_impurity_decrease': 0.3719876212673499, 'max_features': 0.8262568019277813, 'subsample': 0.007299631600152949, 'dropout_rate': 0.6835123693473022, 'ccp_alpha': 0.276821220433915}. Best is trial 595 with value: 0.7828124688588588.[0m
