No protocol specified
dropped categorical variable 'SEX', because it has only 1 values
[32m[I 2022-04-15 11:09:08,658][0m A new study created in memory with name: no-name-7a0f7431-de17-466f-8013-45f12107945a[0m
2022-04-15 11:09:08.697547: E tensorflow/stream_executor/cuda/cuda_driver.cc:271] failed call to cuInit: CUDA_ERROR_NO_DEVICE: no CUDA-capable device is detected
2022-04-15 11:09:08.697597: I tensorflow/stream_executor/cuda/cuda_diagnostics.cc:156] kernel driver does not appear to be running on this host (nbcwdc01): /proc/driver/nvidia/version does not exist
2022-04-15 11:09:08.698184: I tensorflow/core/platform/cpu_feature_guard.cc:151] This TensorFlow binary is optimized with oneAPI Deep Neural Network Library (oneDNN) to use the following CPU instructions in performance-critical operations:  AVX2 AVX512F FMA
To enable them in other operations, rebuild TensorFlow with the appropriate compiler flags.
WARNING:tensorflow:Setting parallel_iterations > 1 has no effect when executing eagerly. Consider calling map_fn with tf.function to execute fn in parallel.
[32m[I 2022-04-15 11:10:41,915][0m Trial 0 finished with value: 0.8296796615271831 and parameters: {'n_hidden': 256, 'mixture_components': 7, 'use_sparse_layer': True, 'use_sparse_loss': False, 'use_batchnorm': False, 'use_dropout': True, 'dropout': 0.01867423332382978, 'mlp_size_1': 2, 'mlp_size_2': 2, 'mlp_size_3': 0, 'kernel': 'Gumbel', 'loss_name': 'AlternativeNLLLoss'}. Best is trial 0 with value: 0.8296796615271831.[0m
[32m[I 2022-04-15 11:13:16,739][0m Trial 1 finished with value: 0.8825310621529836 and parameters: {'n_hidden': 2048, 'mixture_components': 2, 'use_sparse_layer': False, 'use_batchnorm': False, 'use_dropout': False, 'mlp_size_1': 4, 'mlp_size_2': 0, 'mlp_size_3': 3, 'kernel': 'Logistic', 'loss_name': 'CensoredNLLLoss'}. Best is trial 1 with value: 0.8825310621529836.[0m
[32m[I 2022-04-15 11:16:17,812][0m Trial 2 finished with value: 0.7626218137568608 and parameters: {'n_hidden': 64, 'mixture_components': 2, 'use_sparse_layer': True, 'use_sparse_loss': True, 'lmbd': 0.00010664813829612825, 'use_batchnorm': True, 'use_dropout': False, 'mlp_size_1': 3, 'mlp_size_2': 0, 'mlp_size_3': 0, 'kernel': 'Weibull', 'loss_name': 'CensoredNLLLoss'}. Best is trial 1 with value: 0.8825310621529836.[0m
[32m[I 2022-04-15 11:18:39,215][0m Trial 3 finished with value: 0.7750829987522303 and parameters: {'n_hidden': 2048, 'mixture_components': 5, 'use_sparse_layer': True, 'use_sparse_loss': False, 'use_batchnorm': False, 'use_dropout': False, 'mlp_size_1': 1, 'mlp_size_2': 4, 'mlp_size_3': 0, 'kernel': 'Logistic', 'loss_name': 'AlternativeNLLLoss'}. Best is trial 1 with value: 0.8825310621529836.[0m
[32m[I 2022-04-15 11:21:01,952][0m Trial 4 finished with value: 0.7741430273670385 and parameters: {'n_hidden': 128, 'mixture_components': 4, 'use_sparse_layer': False, 'use_batchnorm': True, 'use_dropout': True, 'dropout': 0.16589849952228097, 'mlp_size_1': 2, 'mlp_size_2': 0, 'mlp_size_3': 0, 'kernel': 'Logistic', 'loss_name': 'CensoredNLLLoss'}. Best is trial 1 with value: 0.8825310621529836.[0m
[32m[I 2022-04-15 11:23:53,490][0m Trial 5 finished with value: 0.8767081370133329 and parameters: {'n_hidden': 64, 'mixture_components': 3, 'use_sparse_layer': False, 'use_batchnorm': True, 'use_dropout': True, 'dropout': 0.229219281973695, 'mlp_size_1': 1, 'mlp_size_2': 1, 'mlp_size_3': 0, 'kernel': 'LogLogistic', 'loss_name': 'AlternativeNLLLoss'}. Best is trial 1 with value: 0.8825310621529836.[0m
[32m[I 2022-04-15 11:26:19,564][0m Trial 6 finished with value: 0.7632390052247635 and parameters: {'n_hidden': 64, 'mixture_components': 6, 'use_sparse_layer': False, 'use_batchnorm': True, 'use_dropout': False, 'mlp_size_1': 1, 'mlp_size_2': 1, 'mlp_size_3': 0, 'kernel': 'Normal', 'loss_name': 'AlternativeNLLLoss'}. Best is trial 1 with value: 0.8825310621529836.[0m
[32m[I 2022-04-15 11:28:49,027][0m Trial 7 finished with value: 0.8440622398755926 and parameters: {'n_hidden': 128, 'mixture_components': 8, 'use_sparse_layer': False, 'use_batchnorm': True, 'use_dropout': True, 'dropout': 0.19347636516542854, 'mlp_size_1': 1, 'mlp_size_2': 3, 'mlp_size_3': 0, 'kernel': 'Weibull', 'loss_name': 'NLLLoss'}. Best is trial 1 with value: 0.8825310621529836.[0m
[32m[I 2022-04-15 11:30:21,856][0m Trial 8 finished with value: 0.8760975085594203 and parameters: {'n_hidden': 512, 'mixture_components': 8, 'use_sparse_layer': True, 'use_sparse_loss': False, 'use_batchnorm': False, 'use_dropout': False, 'mlp_size_1': 6, 'mlp_size_2': 0, 'mlp_size_3': 0, 'kernel': 'Logistic', 'loss_name': 'CensoredNLLLoss'}. Best is trial 1 with value: 0.8825310621529836.[0m
[32m[I 2022-04-15 11:32:37,473][0m Trial 9 finished with value: 0.7812489762050869 and parameters: {'n_hidden': 512, 'mixture_components': 8, 'use_sparse_layer': False, 'use_batchnorm': False, 'use_dropout': True, 'dropout': 0.7008250262519559, 'mlp_size_1': 1, 'mlp_size_2': 4, 'mlp_size_3': 0, 'kernel': 'LogNormal', 'loss_name': 'CensoredNLLLoss'}. Best is trial 1 with value: 0.8825310621529836.[0m
[32m[I 2022-04-15 11:34:09,381][0m Trial 10 finished with value: 0.5555173758336636 and parameters: {'n_hidden': 1024, 'mixture_components': 1, 'use_sparse_layer': False, 'use_batchnorm': False, 'use_dropout': False, 'mlp_size_1': 6, 'mlp_size_2': 0, 'mlp_size_3': 1, 'kernel': 'Gamma', 'loss_name': 'NLLLoss'}. Best is trial 1 with value: 0.8825310621529836.[0m
[32m[I 2022-04-15 11:38:52,560][0m Trial 11 finished with value: 0.7740821891728461 and parameters: {'n_hidden': 32, 'mixture_components': 3, 'use_sparse_layer': False, 'use_batchnorm': True, 'use_dropout': True, 'dropout': 0.4711417666532526, 'mlp_size_1': 0, 'mlp_size_2': 1, 'mlp_size_3': 1, 'kernel': 'LogLogistic', 'loss_name': 'AlternativeNLLLoss'}. Best is trial 1 with value: 0.8825310621529836.[0m
[32m[I 2022-04-15 11:41:51,195][0m Trial 12 finished with value: 0.7610017002514764 and parameters: {'n_hidden': 2048, 'mixture_components': 1, 'use_sparse_layer': False, 'use_batchnorm': True, 'use_dropout': False, 'mlp_size_1': 8, 'mlp_size_2': 0, 'mlp_size_3': 0, 'kernel': 'LogLogistic', 'loss_name': 'AlternativeNLLLoss'}. Best is trial 1 with value: 0.8825310621529836.[0m
[32m[I 2022-04-15 11:43:50,672][0m Trial 13 finished with value: 0.7831784582486929 and parameters: {'n_hidden': 2048, 'mixture_components': 3, 'use_sparse_layer': False, 'use_batchnorm': False, 'use_dropout': True, 'dropout': 0.4442913653248812, 'mlp_size_1': 5, 'mlp_size_2': 1, 'mlp_size_3': 2, 'kernel': 'Exponential', 'loss_name': 'CensoredNLLLoss'}. Best is trial 1 with value: 0.8825310621529836.[0m
[32m[I 2022-04-15 11:45:03,844][0m Trial 14 finished with value: 0.8374374995501312 and parameters: {'n_hidden': 64, 'mixture_components': 10, 'use_sparse_layer': False, 'use_batchnorm': False, 'use_dropout': False, 'mlp_size_1': 0, 'mlp_size_2': 2, 'mlp_size_3': 1, 'kernel': 'LogLogistic', 'loss_name': 'NLLLoss'}. Best is trial 1 with value: 0.8825310621529836.[0m
[32m[I 2022-04-15 11:46:55,144][0m Trial 15 finished with value: -0.5 and parameters: {'n_hidden': 256, 'mixture_components': 3, 'use_sparse_layer': False, 'use_batchnorm': True, 'use_dropout': True, 'dropout': 0.9017482858597219, 'mlp_size_1': 3, 'mlp_size_2': 1, 'mlp_size_3': 1, 'kernel': 'LogNormal', 'loss_name': 'CensoredNLLLoss'}. Best is trial 1 with value: 0.8825310621529836.[0m
[32m[I 2022-04-15 11:50:03,060][0m Trial 16 finished with value: 0.7697792034348729 and parameters: {'n_hidden': 1024, 'mixture_components': 5, 'use_sparse_layer': False, 'use_batchnorm': True, 'use_dropout': False, 'mlp_size_1': 4, 'mlp_size_2': 2, 'mlp_size_3': 1, 'kernel': 'Exponential', 'loss_name': 'AlternativeNLLLoss'}. Best is trial 1 with value: 0.8825310621529836.[0m
[32m[I 2022-04-15 11:53:48,910][0m Trial 17 finished with value: 0.7702465131705779 and parameters: {'n_hidden': 32, 'mixture_components': 2, 'use_sparse_layer': False, 'use_batchnorm': False, 'use_dropout': True, 'dropout': 0.3432945515630746, 'mlp_size_1': 0, 'mlp_size_2': 1, 'mlp_size_3': 1, 'kernel': 'Normal', 'loss_name': 'CensoredNLLLoss'}. Best is trial 1 with value: 0.8825310621529836.[0m
[32m[I 2022-04-15 11:55:17,932][0m Trial 18 finished with value: 0.8409506965389948 and parameters: {'n_hidden': 64, 'mixture_components': 4, 'use_sparse_layer': True, 'use_sparse_loss': True, 'lmbd': 0.023199988680494006, 'use_batchnorm': False, 'use_dropout': False, 'mlp_size_1': 2, 'mlp_size_2': 0, 'mlp_size_3': 1, 'kernel': 'Gumbel', 'loss_name': 'AlternativeNLLLoss'}. Best is trial 1 with value: 0.8825310621529836.[0m
[32m[I 2022-04-15 12:00:08,696][0m Trial 19 finished with value: 0.6335774200865527 and parameters: {'n_hidden': 2048, 'mixture_components': 2, 'use_sparse_layer': False, 'use_batchnorm': True, 'use_dropout': True, 'dropout': 0.6957494794536127, 'mlp_size_1': 8, 'mlp_size_2': 0, 'mlp_size_3': 0, 'kernel': 'Gamma', 'loss_name': 'NLLLoss'}. Best is trial 1 with value: 0.8825310621529836.[0m
[32m[I 2022-04-15 12:02:37,146][0m Trial 20 finished with value: 0.7794334154019044 and parameters: {'n_hidden': 2048, 'mixture_components': 4, 'use_sparse_layer': False, 'use_batchnorm': False, 'use_dropout': True, 'dropout': 0.02772636411717777, 'mlp_size_1': 4, 'mlp_size_2': 1, 'mlp_size_3': 3, 'kernel': 'Logistic', 'loss_name': 'CensoredNLLLoss'}. Best is trial 1 with value: 0.8825310621529836.[0m
[32m[I 2022-04-15 12:04:14,233][0m Trial 21 finished with value: 0.8792825471073694 and parameters: {'n_hidden': 512, 'mixture_components': 10, 'use_sparse_layer': True, 'use_sparse_loss': False, 'use_batchnorm': False, 'use_dropout': False, 'mlp_size_1': 5, 'mlp_size_2': 0, 'mlp_size_3': 0, 'kernel': 'Logistic', 'loss_name': 'CensoredNLLLoss'}. Best is trial 1 with value: 0.8825310621529836.[0m
[32m[I 2022-04-15 12:05:57,378][0m Trial 22 finished with value: 0.7824407317913494 and parameters: {'n_hidden': 512, 'mixture_components': 10, 'use_sparse_layer': True, 'use_sparse_loss': False, 'use_batchnorm': False, 'use_dropout': False, 'mlp_size_1': 4, 'mlp_size_2': 0, 'mlp_size_3': 2, 'kernel': 'Logistic', 'loss_name': 'CensoredNLLLoss'}. Best is trial 1 with value: 0.8825310621529836.[0m
[32m[I 2022-04-15 12:07:33,412][0m Trial 23 finished with value: 0.8783586226253057 and parameters: {'n_hidden': 512, 'mixture_components': 9, 'use_sparse_layer': True, 'use_sparse_loss': False, 'use_batchnorm': False, 'use_dropout': False, 'mlp_size_1': 5, 'mlp_size_2': 0, 'mlp_size_3': 0, 'kernel': 'LogLogistic', 'loss_name': 'CensoredNLLLoss'}. Best is trial 1 with value: 0.8825310621529836.[0m
[32m[I 2022-04-15 12:09:11,009][0m Trial 24 finished with value: 0.8833697701789252 and parameters: {'n_hidden': 512, 'mixture_components': 9, 'use_sparse_layer': True, 'use_sparse_loss': False, 'use_batchnorm': False, 'use_dropout': False, 'mlp_size_1': 5, 'mlp_size_2': 0, 'mlp_size_3': 0, 'kernel': 'Logistic', 'loss_name': 'CensoredNLLLoss'}. Best is trial 24 with value: 0.8833697701789252.[0m
[32m[I 2022-04-15 12:10:41,951][0m Trial 25 finished with value: 0.8809312229120263 and parameters: {'n_hidden': 512, 'mixture_components': 9, 'use_sparse_layer': True, 'use_sparse_loss': False, 'use_batchnorm': False, 'use_dropout': False, 'mlp_size_1': 5, 'mlp_size_2': 0, 'mlp_size_3': 0, 'kernel': 'Logistic', 'loss_name': 'CensoredNLLLoss'}. Best is trial 24 with value: 0.8833697701789252.[0m
[32m[I 2022-04-15 12:12:23,195][0m Trial 26 finished with value: 0.8811911143285569 and parameters: {'n_hidden': 512, 'mixture_components': 7, 'use_sparse_layer': True, 'use_sparse_loss': False, 'use_batchnorm': False, 'use_dropout': False, 'mlp_size_1': 5, 'mlp_size_2': 0, 'mlp_size_3': 0, 'kernel': 'Logistic', 'loss_name': 'CensoredNLLLoss'}. Best is trial 24 with value: 0.8833697701789252.[0m
[32m[I 2022-04-15 12:14:10,244][0m Trial 27 finished with value: 0.8820862261538845 and parameters: {'n_hidden': 512, 'mixture_components': 7, 'use_sparse_layer': True, 'use_sparse_loss': True, 'lmbd': 1.503767800817791e-06, 'use_batchnorm': False, 'use_dropout': False, 'mlp_size_1': 4, 'mlp_size_2': 0, 'mlp_size_3': 2, 'kernel': 'Logistic', 'loss_name': 'CensoredNLLLoss'}. Best is trial 24 with value: 0.8833697701789252.[0m
[32m[I 2022-04-15 12:15:57,336][0m Trial 28 finished with value: 0.779790064061063 and parameters: {'n_hidden': 512, 'mixture_components': 6, 'use_sparse_layer': True, 'use_sparse_loss': True, 'lmbd': 1.1699025783422094e-06, 'use_batchnorm': False, 'use_dropout': False, 'mlp_size_1': 3, 'mlp_size_2': 1, 'mlp_size_3': 2, 'kernel': 'Logistic', 'loss_name': 'CensoredNLLLoss'}. Best is trial 24 with value: 0.8833697701789252.[0m
[32m[I 2022-04-15 12:17:33,690][0m Trial 29 finished with value: 0.8269912436464777 and parameters: {'n_hidden': 256, 'mixture_components': 7, 'use_sparse_layer': True, 'use_sparse_loss': True, 'lmbd': 1.3274181281001111e-06, 'use_batchnorm': False, 'use_dropout': False, 'mlp_size_1': 4, 'mlp_size_2': 0, 'mlp_size_3': 1, 'kernel': 'Gumbel', 'loss_name': 'CensoredNLLLoss'}. Best is trial 24 with value: 0.8833697701789252.[0m
[32m[I 2022-04-15 12:19:34,538][0m Trial 30 finished with value: 0.877915166891893 and parameters: {'n_hidden': 1024, 'mixture_components': 7, 'use_sparse_layer': True, 'use_sparse_loss': True, 'lmbd': 0.00011904753774213928, 'use_batchnorm': False, 'use_dropout': False, 'mlp_size_1': 6, 'mlp_size_2': 0, 'mlp_size_3': 1, 'kernel': 'Logistic', 'loss_name': 'CensoredNLLLoss'}. Best is trial 24 with value: 0.8833697701789252.[0m
[32m[I 2022-04-15 12:21:28,590][0m Trial 31 finished with value: 0.8513907492927222 and parameters: {'n_hidden': 512, 'mixture_components': 7, 'use_sparse_layer': True, 'use_sparse_loss': False, 'use_batchnorm': False, 'use_dropout': False, 'mlp_size_1': 4, 'mlp_size_2': 0, 'mlp_size_3': 2, 'kernel': 'Logistic', 'loss_name': 'CensoredNLLLoss'}. Best is trial 24 with value: 0.8833697701789252.[0m
[32m[I 2022-04-15 12:23:53,450][0m Trial 32 finished with value: 0.8828475919012853 and parameters: {'n_hidden': 512, 'mixture_components': 9, 'use_sparse_layer': True, 'use_sparse_loss': True, 'lmbd': 0.012221072575355164, 'use_batchnorm': False, 'use_dropout': False, 'mlp_size_1': 5, 'mlp_size_2': 0, 'mlp_size_3': 1, 'kernel': 'Logistic', 'loss_name': 'CensoredNLLLoss'}. Best is trial 24 with value: 0.8833697701789252.[0m
[32m[I 2022-04-15 12:26:01,614][0m Trial 33 finished with value: 0.878371648034656 and parameters: {'n_hidden': 512, 'mixture_components': 9, 'use_sparse_layer': True, 'use_sparse_loss': True, 'lmbd': 0.04569023635419825, 'use_batchnorm': False, 'use_dropout': False, 'mlp_size_1': 3, 'mlp_size_2': 0, 'mlp_size_3': 3, 'kernel': 'Weibull', 'loss_name': 'CensoredNLLLoss'}. Best is trial 24 with value: 0.8833697701789252.[0m
[32m[I 2022-04-15 12:27:50,620][0m Trial 34 finished with value: 0.8751083412688073 and parameters: {'n_hidden': 128, 'mixture_components': 9, 'use_sparse_layer': True, 'use_sparse_loss': True, 'lmbd': 0.0026198629141808137, 'use_batchnorm': False, 'use_dropout': False, 'mlp_size_1': 4, 'mlp_size_2': 0, 'mlp_size_3': 0, 'kernel': 'Logistic', 'loss_name': 'CensoredNLLLoss'}. Best is trial 24 with value: 0.8833697701789252.[0m
[32m[I 2022-04-15 12:30:22,850][0m Trial 35 finished with value: 0.7561461125791427 and parameters: {'n_hidden': 2048, 'mixture_components': 8, 'use_sparse_layer': True, 'use_sparse_loss': True, 'lmbd': 1.5217282103082812e-05, 'use_batchnorm': False, 'use_dropout': False, 'mlp_size_1': 7, 'mlp_size_2': 0, 'mlp_size_3': 1, 'kernel': 'Logistic', 'loss_name': 'CensoredNLLLoss'}. Best is trial 24 with value: 0.8833697701789252.[0m
[32m[I 2022-04-15 12:32:25,588][0m Trial 36 finished with value: 0.8769785227581695 and parameters: {'n_hidden': 512, 'mixture_components': 6, 'use_sparse_layer': True, 'use_sparse_loss': True, 'lmbd': 0.002128246463354402, 'use_batchnorm': False, 'use_dropout': False, 'mlp_size_1': 5, 'mlp_size_2': 0, 'mlp_size_3': 1, 'kernel': 'Logistic', 'loss_name': 'CensoredNLLLoss'}. Best is trial 24 with value: 0.8833697701789252.[0m
[32m[I 2022-04-15 12:33:53,167][0m Trial 37 finished with value: 0.8384063520989589 and parameters: {'n_hidden': 256, 'mixture_components': 5, 'use_sparse_layer': True, 'use_sparse_loss': True, 'lmbd': 0.0021036299393025217, 'use_batchnorm': False, 'use_dropout': False, 'mlp_size_1': 4, 'mlp_size_2': 0, 'mlp_size_3': 1, 'kernel': 'Normal', 'loss_name': 'NLLLoss'}. Best is trial 24 with value: 0.8833697701789252.[0m
[32m[I 2022-04-15 12:36:06,559][0m Trial 38 finished with value: 0.869670197877791 and parameters: {'n_hidden': 32, 'mixture_components': 8, 'use_sparse_layer': True, 'use_sparse_loss': True, 'lmbd': 1.3866411520148042e-05, 'use_batchnorm': False, 'use_dropout': False, 'mlp_size_1': 2, 'mlp_size_2': 0, 'mlp_size_3': 0, 'kernel': 'Weibull', 'loss_name': 'CensoredNLLLoss'}. Best is trial 24 with value: 0.8833697701789252.[0m
[32m[I 2022-04-15 12:37:39,418][0m Trial 39 finished with value: 0.8748372609426319 and parameters: {'n_hidden': 128, 'mixture_components': 9, 'use_sparse_layer': True, 'use_sparse_loss': True, 'lmbd': 0.010150628147728937, 'use_batchnorm': False, 'use_dropout': False, 'mlp_size_1': 3, 'mlp_size_2': 0, 'mlp_size_3': 1, 'kernel': 'Logistic', 'loss_name': 'CensoredNLLLoss'}. Best is trial 24 with value: 0.8833697701789252.[0m
[32m[I 2022-04-15 12:40:36,887][0m Trial 40 finished with value: 0.7711737950882458 and parameters: {'n_hidden': 512, 'mixture_components': 10, 'use_sparse_layer': True, 'use_sparse_loss': True, 'lmbd': 0.0005474525272871171, 'use_batchnorm': False, 'use_dropout': False, 'mlp_size_1': 5, 'mlp_size_2': 0, 'mlp_size_3': 1, 'kernel': 'LogNormal', 'loss_name': 'CensoredNLLLoss'}. Best is trial 24 with value: 0.8833697701789252.[0m
[32m[I 2022-04-15 12:42:19,534][0m Trial 41 finished with value: 0.8807613973178242 and parameters: {'n_hidden': 512, 'mixture_components': 6, 'use_sparse_layer': True, 'use_sparse_loss': False, 'use_batchnorm': False, 'use_dropout': False, 'mlp_size_1': 5, 'mlp_size_2': 0, 'mlp_size_3': 0, 'kernel': 'Logistic', 'loss_name': 'CensoredNLLLoss'}. Best is trial 24 with value: 0.8833697701789252.[0m
[32m[I 2022-04-15 12:44:24,502][0m Trial 42 finished with value: 0.8789076104582779 and parameters: {'n_hidden': 512, 'mixture_components': 7, 'use_sparse_layer': True, 'use_sparse_loss': False, 'use_batchnorm': False, 'use_dropout': False, 'mlp_size_1': 5, 'mlp_size_2': 0, 'mlp_size_3': 0, 'kernel': 'Logistic', 'loss_name': 'CensoredNLLLoss'}. Best is trial 24 with value: 0.8833697701789252.[0m
[32m[I 2022-04-15 12:46:00,341][0m Trial 43 finished with value: 0.779263739731084 and parameters: {'n_hidden': 512, 'mixture_components': 8, 'use_sparse_layer': True, 'use_sparse_loss': False, 'use_batchnorm': False, 'use_dropout': False, 'mlp_size_1': 4, 'mlp_size_2': 0, 'mlp_size_3': 2, 'kernel': 'Gamma', 'loss_name': 'CensoredNLLLoss'}. Best is trial 24 with value: 0.8833697701789252.[0m
[32m[I 2022-04-15 12:47:43,711][0m Trial 44 finished with value: 0.8741644505955437 and parameters: {'n_hidden': 512, 'mixture_components': 8, 'use_sparse_layer': True, 'use_sparse_loss': False, 'use_batchnorm': False, 'use_dropout': False, 'mlp_size_1': 6, 'mlp_size_2': 0, 'mlp_size_3': 0, 'kernel': 'Logistic', 'loss_name': 'CensoredNLLLoss'}. Best is trial 24 with value: 0.8833697701789252.[0m
[32m[I 2022-04-15 12:49:50,104][0m Trial 45 finished with value: 0.35258102507982086 and parameters: {'n_hidden': 2048, 'mixture_components': 6, 'use_sparse_layer': True, 'use_sparse_loss': False, 'use_batchnorm': False, 'use_dropout': False, 'mlp_size_1': 6, 'mlp_size_2': 0, 'mlp_size_3': 2, 'kernel': 'Exponential', 'loss_name': 'NLLLoss'}. Best is trial 24 with value: 0.8833697701789252.[0m
[32m[I 2022-04-15 12:51:30,277][0m Trial 46 finished with value: 0.772808746983743 and parameters: {'n_hidden': 512, 'mixture_components': 7, 'use_sparse_layer': True, 'use_sparse_loss': False, 'use_batchnorm': False, 'use_dropout': False, 'mlp_size_1': 5, 'mlp_size_2': 0, 'mlp_size_3': 0, 'kernel': 'Logistic', 'loss_name': 'CensoredNLLLoss'}. Best is trial 24 with value: 0.8833697701789252.[0m
[32m[I 2022-04-15 12:52:46,155][0m Trial 47 finished with value: 0.004410225497753162 and parameters: {'n_hidden': 64, 'mixture_components': 9, 'use_sparse_layer': False, 'use_batchnorm': True, 'use_dropout': False, 'mlp_size_1': 3, 'mlp_size_2': 0, 'mlp_size_3': 0, 'kernel': 'Gumbel', 'loss_name': 'AlternativeNLLLoss'}. Best is trial 24 with value: 0.8833697701789252.[0m
[32m[I 2022-04-15 12:55:00,417][0m Trial 48 finished with value: 0.7794750501308592 and parameters: {'n_hidden': 1024, 'mixture_components': 7, 'use_sparse_layer': True, 'use_sparse_loss': True, 'lmbd': 1.0679022364223065e-05, 'use_batchnorm': False, 'use_dropout': False, 'mlp_size_1': 6, 'mlp_size_2': 0, 'mlp_size_3': 1, 'kernel': 'Logistic', 'loss_name': 'CensoredNLLLoss'}. Best is trial 24 with value: 0.8833697701789252.[0m
[32m[I 2022-04-15 12:57:36,827][0m Trial 49 finished with value: 0.5758278661494423 and parameters: {'n_hidden': 2048, 'mixture_components': 1, 'use_sparse_layer': False, 'use_batchnorm': False, 'use_dropout': False, 'mlp_size_1': 3, 'mlp_size_2': 5, 'mlp_size_3': 0, 'kernel': 'Normal', 'loss_name': 'CensoredNLLLoss'}. Best is trial 24 with value: 0.8833697701789252.[0m
[32m[I 2022-04-15 13:00:33,467][0m Trial 50 finished with value: 0.8336215112758515 and parameters: {'n_hidden': 32, 'mixture_components': 5, 'use_sparse_layer': True, 'use_sparse_loss': False, 'use_batchnorm': True, 'use_dropout': False, 'mlp_size_1': 2, 'mlp_size_2': 0, 'mlp_size_3': 0, 'kernel': 'LogNormal', 'loss_name': 'NLLLoss'}. Best is trial 24 with value: 0.8833697701789252.[0m
