[32m[I 2022-04-13 12:26:13,436][0m Trial 512 finished with value: 0.7648844173947996 and parameters: {'splitter': 'best', 'min_samples_split': 0.1174459972937038, 'min_samples_leaf': 0.028460507747139388, 'min_weight_fraction_leaf': 0.0317166516645678, 'max_features': 0.9345220717382973}. Best is trial 241 with value: 0.7773840258827056.[0m
[32m[I 2022-04-13 12:26:16,212][0m Trial 513 finished with value: 0.7668246811150562 and parameters: {'splitter': 'best', 'min_samples_split': 0.1322172509192386, 'min_samples_leaf': 0.04799374807079968, 'min_weight_fraction_leaf': 0.0649346033145319, 'max_features': 0.955886638047862}. Best is trial 241 with value: 0.7773840258827056.[0m
[32m[I 2022-04-13 12:26:18,765][0m Trial 514 finished with value: 0.7740825819227838 and parameters: {'splitter': 'best', 'min_samples_split': 0.12365995052476368, 'min_samples_leaf': 0.027882404769361185, 'min_weight_fraction_leaf': 0.014238136347388991, 'max_features': 0.9817360732170552}. Best is trial 241 with value: 0.7773840258827056.[0m
[32m[I 2022-04-13 12:26:20,371][0m Trial 515 finished with value: 0.7698223091411682 and parameters: {'splitter': 'best', 'min_samples_split': 0.13607986031529135, 'min_samples_leaf': 0.03948771520368012, 'min_weight_fraction_leaf': 0.08806956288906581, 'max_features': 0.9994054065682957}. Best is trial 241 with value: 0.7773840258827056.[0m
[32m[I 2022-04-13 12:26:21,973][0m Trial 516 finished with value: 0.7667824828576928 and parameters: {'splitter': 'best', 'min_samples_split': 0.11324916888656181, 'min_samples_leaf': 0.06477180678306933, 'min_weight_fraction_leaf': 0.0469371068113218, 'max_features': 0.9667216464543054}. Best is trial 241 with value: 0.7773840258827056.[0m
[32m[I 2022-04-13 12:26:24,453][0m Trial 517 finished with value: 0.764769781692247 and parameters: {'splitter': 'best', 'min_samples_split': 0.14402622462309395, 'min_samples_leaf': 0.0518603407840236, 'min_weight_fraction_leaf': 0.03881154258490645, 'max_features': 0.9432358685271856}. Best is trial 241 with value: 0.7773840258827056.[0m
[32m[I 2022-04-13 12:26:26,117][0m Trial 518 finished with value: 0.6743624146605087 and parameters: {'splitter': 'best', 'min_samples_split': 0.053071134827577644, 'min_samples_leaf': 0.02583199015753982, 'min_weight_fraction_leaf': 0.3259080987148859, 'max_features': 0.9832121737194416}. Best is trial 241 with value: 0.7773840258827056.[0m
[32m[I 2022-04-13 12:26:26,662][0m Trial 519 finished with value: 0.7666258222954834 and parameters: {'splitter': 'random', 'min_samples_split': 0.12245405583857338, 'min_samples_leaf': 0.03672878069764588, 'min_weight_fraction_leaf': 0.024091710169470076, 'max_features': 0.9593418004370593}. Best is trial 241 with value: 0.7773840258827056.[0m
[32m[I 2022-04-13 12:26:28,558][0m Trial 520 finished with value: 0.765854794979218 and parameters: {'splitter': 'best', 'min_samples_split': 0.10520099304475551, 'min_samples_leaf': 0.046151583505130975, 'min_weight_fraction_leaf': 0.056452999088206016, 'max_features': 0.9150691038939505}. Best is trial 241 with value: 0.7773840258827056.[0m
[32m[I 2022-04-13 12:26:31,996][0m Trial 521 finished with value: 0.7717956722620598 and parameters: {'splitter': 'best', 'min_samples_split': 0.1299279067675121, 'min_samples_leaf': 0.025036080539873395, 'min_weight_fraction_leaf': 0.028777696985414082, 'max_features': 0.9832126649928437}. Best is trial 241 with value: 0.7773840258827056.[0m
[32m[I 2022-04-13 12:26:34,179][0m Trial 522 finished with value: 0.7654796711290085 and parameters: {'splitter': 'best', 'min_samples_split': 0.11558112075300958, 'min_samples_leaf': 0.03672383920903599, 'min_weight_fraction_leaf': 0.010426787259336268, 'max_features': 0.9342499183137761}. Best is trial 241 with value: 0.7773840258827056.[0m
[32m[I 2022-04-13 12:26:36,593][0m Trial 523 finished with value: 0.7605685093550119 and parameters: {'splitter': 'best', 'min_samples_split': 0.10059703597004041, 'min_samples_leaf': 0.07869989621684984, 'min_weight_fraction_leaf': 0.04193929556405481, 'max_features': 0.968667962310976}. Best is trial 241 with value: 0.7773840258827056.[0m
[32m[I 2022-04-13 12:26:38,264][0m Trial 524 finished with value: 0.763721216216722 and parameters: {'splitter': 'best', 'min_samples_split': 0.1578015909531183, 'min_samples_leaf': 0.05387086261470765, 'min_weight_fraction_leaf': 0.03251242693406104, 'max_features': 0.9520794153251224}. Best is trial 241 with value: 0.7773840258827056.[0m
[32m[I 2022-04-13 12:26:39,228][0m Trial 525 finished with value: 0.7747706942408039 and parameters: {'splitter': 'best', 'min_samples_split': 0.13915149332649776, 'min_samples_leaf': 0.04488376363186027, 'min_weight_fraction_leaf': 0.01437756903922519, 'max_features': 0.9812585113744582}. Best is trial 241 with value: 0.7773840258827056.[0m
[32m[I 2022-04-13 12:26:41,214][0m Trial 526 finished with value: 0.7637988642481615 and parameters: {'splitter': 'best', 'min_samples_split': 0.14835419097118638, 'min_samples_leaf': 0.06473532057401157, 'min_weight_fraction_leaf': 0.0488441525104897, 'max_features': 0.9673812293149195}. Best is trial 241 with value: 0.7773840258827056.[0m
[32m[I 2022-04-13 12:26:42,832][0m Trial 527 finished with value: 0.7637832218784595 and parameters: {'splitter': 'best', 'min_samples_split': 0.14293199915294144, 'min_samples_leaf': 0.046966124901854936, 'min_weight_fraction_leaf': 0.020106424613546718, 'max_features': 0.9310474860179923}. Best is trial 241 with value: 0.7773840258827056.[0m
[32m[I 2022-04-13 12:26:45,115][0m Trial 528 finished with value: 0.7601415998431464 and parameters: {'splitter': 'best', 'min_samples_split': 0.16463440783397823, 'min_samples_leaf': 0.05612627958156096, 'min_weight_fraction_leaf': 0.10663786447604158, 'max_features': 0.9471405768617659}. Best is trial 241 with value: 0.7773840258827056.[0m
[32m[I 2022-04-13 12:26:47,771][0m Trial 529 finished with value: 0.7761877820774684 and parameters: {'splitter': 'best', 'min_samples_split': 0.13871719083049314, 'min_samples_leaf': 0.044052275429815, 'min_weight_fraction_leaf': 0.03243190841831192, 'max_features': 0.9766248160107744}. Best is trial 241 with value: 0.7773840258827056.[0m
[32m[I 2022-04-13 12:26:49,869][0m Trial 530 finished with value: 0.7630706229411763 and parameters: {'splitter': 'best', 'min_samples_split': 0.1349898932255473, 'min_samples_leaf': 0.06938271669738587, 'min_weight_fraction_leaf': 0.056193139093836914, 'max_features': 0.966551516928056}. Best is trial 241 with value: 0.7773840258827056.[0m
[32m[I 2022-04-13 12:26:51,206][0m Trial 531 finished with value: 0.770084767472636 and parameters: {'splitter': 'best', 'min_samples_split': 0.08394187008913645, 'min_samples_leaf': 0.056471977085882905, 'min_weight_fraction_leaf': 0.026875404572551137, 'max_features': 0.999697551182279}. Best is trial 241 with value: 0.7773840258827056.[0m
[32m[I 2022-04-13 12:26:53,670][0m Trial 532 finished with value: 0.7417990685271777 and parameters: {'splitter': 'best', 'min_samples_split': 0.2881552378615331, 'min_samples_leaf': 0.028197475161581075, 'min_weight_fraction_leaf': 0.06987813432859204, 'max_features': 0.9522820185170559}. Best is trial 241 with value: 0.7773840258827056.[0m
[32m[I 2022-04-13 12:26:54,298][0m Trial 533 finished with value: 0.7076766077168181 and parameters: {'splitter': 'best', 'min_samples_split': 0.19225636213043665, 'min_samples_leaf': 0.04921016691591848, 'min_weight_fraction_leaf': 0.0176274091600058, 'max_features': 0.4472874145786961}. Best is trial 241 with value: 0.7773840258827056.[0m
[32m[I 2022-04-13 12:26:55,161][0m Trial 534 finished with value: 0.6960223903768297 and parameters: {'splitter': 'best', 'min_samples_split': 0.11246244450972323, 'min_samples_leaf': 0.24762830597707677, 'min_weight_fraction_leaf': 0.032029904327928044, 'max_features': 0.9044405412041542}. Best is trial 241 with value: 0.7773840258827056.[0m
[32m[I 2022-04-13 12:26:57,667][0m Trial 535 finished with value: 0.776726673620824 and parameters: {'splitter': 'best', 'min_samples_split': 0.13082958155709673, 'min_samples_leaf': 0.039928818406717144, 'min_weight_fraction_leaf': 0.04350593293838996, 'max_features': 0.9782167105994799}. Best is trial 241 with value: 0.7773840258827056.[0m
[32m[I 2022-04-13 12:26:59,963][0m Trial 536 finished with value: 0.7725619973986828 and parameters: {'splitter': 'best', 'min_samples_split': 0.09421986192049188, 'min_samples_leaf': 0.03992067622747795, 'min_weight_fraction_leaf': 0.0408442464571843, 'max_features': 0.9775945577042834}. Best is trial 241 with value: 0.7773840258827056.[0m
[32m[I 2022-04-13 12:27:01,696][0m Trial 537 finished with value: 0.7319086102587252 and parameters: {'splitter': 'best', 'min_samples_split': 0.12365537295524393, 'min_samples_leaf': 0.14586580154753698, 'min_weight_fraction_leaf': 0.03954436299508148, 'max_features': 0.9268974404659684}. Best is trial 241 with value: 0.7773840258827056.[0m
[32m[I 2022-04-13 12:27:02,085][0m Trial 538 finished with value: 0.7561923953057959 and parameters: {'splitter': 'random', 'min_samples_split': 0.13199834484573808, 'min_samples_leaf': 0.0601088406386445, 'min_weight_fraction_leaf': 0.053399395053861445, 'max_features': 0.9509323420041157}. Best is trial 241 with value: 0.7773840258827056.[0m
[32m[I 2022-04-13 12:27:03,989][0m Trial 539 finished with value: 0.7729540927062496 and parameters: {'splitter': 'best', 'min_samples_split': 0.06243391002903865, 'min_samples_leaf': 0.04269533019061004, 'min_weight_fraction_leaf': 0.03572638440785346, 'max_features': 0.981036813137257}. Best is trial 241 with value: 0.7773840258827056.[0m
[32m[I 2022-04-13 12:27:06,929][0m Trial 540 finished with value: 0.775139131266071 and parameters: {'splitter': 'best', 'min_samples_split': 0.10797899562644131, 'min_samples_leaf': 0.024739499112949474, 'min_weight_fraction_leaf': 0.045590960743374674, 'max_features': 0.9993744343315103}. Best is trial 241 with value: 0.7773840258827056.[0m
[32m[I 2022-04-13 12:27:09,623][0m Trial 541 finished with value: 0.7715389160410744 and parameters: {'splitter': 'best', 'min_samples_split': 0.02252772296084552, 'min_samples_leaf': 0.02227347730586117, 'min_weight_fraction_leaf': 0.06053159640518803, 'max_features': 0.9847796324552452}. Best is trial 241 with value: 0.7773840258827056.[0m
[32m[I 2022-04-13 12:27:12,811][0m Trial 542 finished with value: 0.7675932522766239 and parameters: {'splitter': 'best', 'min_samples_split': 0.09303419060980833, 'min_samples_leaf': 0.024913338929360235, 'min_weight_fraction_leaf': 0.04924536765678145, 'max_features': 0.9684491607390919}. Best is trial 241 with value: 0.7773840258827056.[0m
[32m[I 2022-04-13 12:27:14,497][0m Trial 543 finished with value: 0.7711137356721198 and parameters: {'splitter': 'best', 'min_samples_split': 0.10617120565168849, 'min_samples_leaf': 0.02341442825797975, 'min_weight_fraction_leaf': 0.07986018610165649, 'max_features': 0.9873802076996465}. Best is trial 241 with value: 0.7773840258827056.[0m
[32m[I 2022-04-13 12:27:16,609][0m Trial 544 finished with value: 0.7669848211814468 and parameters: {'splitter': 'best', 'min_samples_split': 0.10328896959086026, 'min_samples_leaf': 0.032293585780667114, 'min_weight_fraction_leaf': 0.027761875979881393, 'max_features': 0.963378382810731}. Best is trial 241 with value: 0.7773840258827056.[0m
[32m[I 2022-04-13 12:27:17,942][0m Trial 545 finished with value: 0.7592067039249626 and parameters: {'splitter': 'best', 'min_samples_split': 0.0835488885158393, 'min_samples_leaf': 0.047425406200271865, 'min_weight_fraction_leaf': 0.04599802569396659, 'max_features': 0.6490203843157998}. Best is trial 241 with value: 0.7773840258827056.[0m
[32m[I 2022-04-13 12:27:19,310][0m Trial 546 finished with value: 0.7724858570084804 and parameters: {'splitter': 'best', 'min_samples_split': 0.11455295962879208, 'min_samples_leaf': 0.03866313627599823, 'min_weight_fraction_leaf': 0.06252007031188436, 'max_features': 0.9842793310667544}. Best is trial 241 with value: 0.7773840258827056.[0m
[32m[I 2022-04-13 12:27:20,214][0m Trial 547 finished with value: 0.7567916070368017 and parameters: {'splitter': 'best', 'min_samples_split': 0.09732000666891219, 'min_samples_leaf': 0.020199529265824523, 'min_weight_fraction_leaf': 0.033591887685400224, 'max_features': 0.5316690189480012}. Best is trial 241 with value: 0.7773840258827056.[0m
[32m[I 2022-04-13 12:27:21,850][0m Trial 548 finished with value: 0.7669208247374579 and parameters: {'splitter': 'best', 'min_samples_split': 0.0746201879006187, 'min_samples_leaf': 0.07010563583174886, 'min_weight_fraction_leaf': 0.024278984216576163, 'max_features': 0.9993793036518916}. Best is trial 241 with value: 0.7773840258827056.[0m
[32m[I 2022-04-13 12:27:23,631][0m Trial 549 finished with value: 0.75973506986834 and parameters: {'splitter': 'best', 'min_samples_split': 0.11111876020709069, 'min_samples_leaf': 0.08493487174634151, 'min_weight_fraction_leaf': 0.037872449384114416, 'max_features': 0.9556532096791798}. Best is trial 241 with value: 0.7773840258827056.[0m
[32m[I 2022-04-13 12:27:25,296][0m Trial 550 finished with value: 0.7707334498141335 and parameters: {'splitter': 'best', 'min_samples_split': 0.12083230110456439, 'min_samples_leaf': 0.0552823186424852, 'min_weight_fraction_leaf': 0.05354330928183949, 'max_features': 0.9991430697357534}. Best is trial 241 with value: 0.7773840258827056.[0m
[32m[I 2022-04-13 12:27:25,767][0m Trial 551 finished with value: 0.5914687042621789 and parameters: {'splitter': 'best', 'min_samples_split': 0.10554675893732547, 'min_samples_leaf': 0.4421501163273139, 'min_weight_fraction_leaf': 0.01962382420613601, 'max_features': 0.9996599911250086}. Best is trial 241 with value: 0.7773840258827056.[0m
[32m[I 2022-04-13 12:27:29,018][0m Trial 552 finished with value: 0.7651796952626913 and parameters: {'splitter': 'best', 'min_samples_split': 0.13121646664238018, 'min_samples_leaf': 0.03390134488756859, 'min_weight_fraction_leaf': 0.030232296081140683, 'max_features': 0.9355437818425711}. Best is trial 241 with value: 0.7773840258827056.[0m
[32m[I 2022-04-13 12:27:31,413][0m Trial 553 finished with value: 0.7676352978557268 and parameters: {'splitter': 'best', 'min_samples_split': 0.08867918412826581, 'min_samples_leaf': 0.041788297462992535, 'min_weight_fraction_leaf': 0.009808781626304698, 'max_features': 0.9683252419250806}. Best is trial 241 with value: 0.7773840258827056.[0m
[32m[I 2022-04-13 12:27:32,703][0m Trial 554 finished with value: 0.7660818447132334 and parameters: {'splitter': 'best', 'min_samples_split': 0.11572805516874288, 'min_samples_leaf': 0.02617043567449714, 'min_weight_fraction_leaf': 0.043136202746995214, 'max_features': 0.9673165445774979}. Best is trial 241 with value: 0.7773840258827056.[0m
[32m[I 2022-04-13 12:27:34,253][0m Trial 555 finished with value: 0.761333140701197 and parameters: {'splitter': 'best', 'min_samples_split': 0.09732528360784794, 'min_samples_leaf': 0.04972784578001994, 'min_weight_fraction_leaf': 0.07147386211025832, 'max_features': 0.8863076770329827}. Best is trial 241 with value: 0.7773840258827056.[0m
[32m[I 2022-04-13 12:27:36,308][0m Trial 556 finished with value: 0.7645117707886725 and parameters: {'splitter': 'best', 'min_samples_split': 0.12484575879124743, 'min_samples_leaf': 0.06111325601825755, 'min_weight_fraction_leaf': 0.02718432360984719, 'max_features': 0.9461620375206036}. Best is trial 241 with value: 0.7773840258827056.[0m
[32m[I 2022-04-13 12:27:38,940][0m Trial 557 finished with value: 0.7172251636606001 and parameters: {'splitter': 'best', 'min_samples_split': 0.13364983726965848, 'min_samples_leaf': 0.01880119965766894, 'min_weight_fraction_leaf': 0.3007895068639165, 'max_features': 0.9811841895089909}. Best is trial 241 with value: 0.7773840258827056.[0m
[32m[I 2022-04-13 12:27:39,449][0m Trial 558 finished with value: 0.7524323324610974 and parameters: {'splitter': 'random', 'min_samples_split': 0.15150557358580566, 'min_samples_leaf': 0.03309207708380504, 'min_weight_fraction_leaf': 0.01763338581262545, 'max_features': 0.9991626590131188}. Best is trial 241 with value: 0.7773840258827056.[0m
[32m[I 2022-04-13 12:27:41,995][0m Trial 559 finished with value: 0.767705385569161 and parameters: {'splitter': 'best', 'min_samples_split': 0.1078983757738185, 'min_samples_leaf': 0.04392648824037069, 'min_weight_fraction_leaf': 0.04728633830429044, 'max_features': 0.9700107575976412}. Best is trial 241 with value: 0.7773840258827056.[0m
[32m[I 2022-04-13 12:27:43,746][0m Trial 560 finished with value: 0.767032359197131 and parameters: {'splitter': 'best', 'min_samples_split': 0.11832990484675293, 'min_samples_leaf': 0.03442712506440391, 'min_weight_fraction_leaf': 0.00020515566788305642, 'max_features': 0.9502048371525924}. Best is trial 241 with value: 0.7773840258827056.[0m
[32m[I 2022-04-13 12:27:44,506][0m Trial 561 finished with value: 0.7709601691407293 and parameters: {'splitter': 'best', 'min_samples_split': 0.1383066358926559, 'min_samples_leaf': 0.05302934390948606, 'min_weight_fraction_leaf': 0.035782563235297084, 'max_features': 0.9799330738212851}. Best is trial 241 with value: 0.7773840258827056.[0m
[32m[I 2022-04-13 12:27:46,002][0m Trial 562 finished with value: 0.7616485687729619 and parameters: {'splitter': 'best', 'min_samples_split': 0.09997085640687878, 'min_samples_leaf': 0.02147667486496778, 'min_weight_fraction_leaf': 0.062245228956892266, 'max_features': 0.9164256640169774}. Best is trial 241 with value: 0.7773840258827056.[0m
[32m[I 2022-04-13 12:27:47,846][0m Trial 563 finished with value: 0.7660012464203698 and parameters: {'splitter': 'best', 'min_samples_split': 0.12430936773588784, 'min_samples_leaf': 0.04260629811986979, 'min_weight_fraction_leaf': 0.010182871888185998, 'max_features': 0.9576363753470554}. Best is trial 241 with value: 0.7773840258827056.[0m
[32m[I 2022-04-13 12:27:49,810][0m Trial 564 finished with value: 0.7744238918340146 and parameters: {'splitter': 'best', 'min_samples_split': 0.11250823622891824, 'min_samples_leaf': 0.030747653265039723, 'min_weight_fraction_leaf': 0.023130200481984938, 'max_features': 0.980895393517788}. Best is trial 241 with value: 0.7773840258827056.[0m
[32m[I 2022-04-13 12:27:49,907][0m Trial 565 finished with value: 0.5879283737718464 and parameters: {'splitter': 'best', 'min_samples_split': 0.08536540433253956, 'min_samples_leaf': 0.06198739750710271, 'min_weight_fraction_leaf': 0.036861644718895574, 'max_features': 0.0804508893380651}. Best is trial 241 with value: 0.7773840258827056.[0m
[32m[I 2022-04-13 12:27:51,400][0m Trial 566 finished with value: 0.7637280917094722 and parameters: {'splitter': 'best', 'min_samples_split': 0.1358609500427858, 'min_samples_leaf': 0.048638417864634936, 'min_weight_fraction_leaf': 0.05218096992147361, 'max_features': 0.9335597980289145}. Best is trial 241 with value: 0.7773840258827056.[0m
[32m[I 2022-04-13 12:27:52,264][0m Trial 567 finished with value: 0.6172593136445288 and parameters: {'splitter': 'best', 'min_samples_split': 0.10756739642635044, 'min_samples_leaf': 0.3068737218915804, 'min_weight_fraction_leaf': 0.026843224734414313, 'max_features': 0.8271975911065088}. Best is trial 241 with value: 0.7773840258827056.[0m
[32m[I 2022-04-13 12:27:54,429][0m Trial 568 finished with value: 0.773871819354332 and parameters: {'splitter': 'best', 'min_samples_split': 0.12323681122916133, 'min_samples_leaf': 0.01472740892961781, 'min_weight_fraction_leaf': 0.04439087666879039, 'max_features': 0.9995963814033646}. Best is trial 241 with value: 0.7773840258827056.[0m
[32m[I 2022-04-13 12:27:56,731][0m Trial 569 finished with value: 0.7628268023182319 and parameters: {'splitter': 'best', 'min_samples_split': 0.1545780542079197, 'min_samples_leaf': 0.03815221210890349, 'min_weight_fraction_leaf': 0.015296331968012186, 'max_features': 0.9660879744628814}. Best is trial 241 with value: 0.7773840258827056.[0m
[32m[I 2022-04-13 12:27:57,948][0m Trial 570 finished with value: 0.752434713666853 and parameters: {'splitter': 'best', 'min_samples_split': 0.35506176872629885, 'min_samples_leaf': 0.0746388533690637, 'min_weight_fraction_leaf': 0.032249656706446944, 'max_features': 0.9828560134213699}. Best is trial 241 with value: 0.7773840258827056.[0m
[32m[I 2022-04-13 12:27:59,679][0m Trial 571 finished with value: 0.6362189907380784 and parameters: {'splitter': 'best', 'min_samples_split': 0.1311641506528038, 'min_samples_leaf': 0.026235911417167208, 'min_weight_fraction_leaf': 0.27255886771700466, 'max_features': 0.9490473850509804}. Best is trial 241 with value: 0.7773840258827056.[0m
[32m[I 2022-04-13 12:28:02,216][0m Trial 572 finished with value: 0.7709825580489926 and parameters: {'splitter': 'best', 'min_samples_split': 0.09445949790546249, 'min_samples_leaf': 0.05367531419823593, 'min_weight_fraction_leaf': 0.008941785550064828, 'max_features': 0.9818618716892205}. Best is trial 241 with value: 0.7773840258827056.[0m
[32m[I 2022-04-13 12:28:04,988][0m Trial 573 finished with value: 0.7692922430830655 and parameters: {'splitter': 'best', 'min_samples_split': 0.04148142357376936, 'min_samples_leaf': 0.04117691200487536, 'min_weight_fraction_leaf': 0.01856057610812466, 'max_features': 0.9661072458284926}. Best is trial 241 with value: 0.7773840258827056.[0m
[32m[I 2022-04-13 12:28:05,708][0m Trial 574 finished with value: 0.749636174496994 and parameters: {'splitter': 'best', 'min_samples_split': 0.11735381411317225, 'min_samples_leaf': 0.02940564612055941, 'min_weight_fraction_leaf': 0.04416026807522379, 'max_features': 0.40856767155583273}. Best is trial 241 with value: 0.7773840258827056.[0m
