[32m[I 2022-04-13 12:05:30,516][0m Trial 798 finished with value: 0.4590462884738506 and parameters: {'splitter': 'best', 'min_samples_split': 0.12428715414634547, 'min_samples_leaf': 0.04666860400560027, 'min_weight_fraction_leaf': 0.17447526915133593, 'max_features': 0.969816074855207}. Best is trial 448 with value: 0.8888507593246218.[0m
/media/san2_ssd/data/Workdir/survival/utils.py:305: RuntimeWarning: invalid value encountered in true_divide
  pdfs = np.gradient(1-survs,axis=1)/norms
/media/san2_ssd/data/Workdir/survival/utils.py:305: RuntimeWarning: invalid value encountered in true_divide
  pdfs = np.gradient(1-survs,axis=1)/norms
[32m[I 2022-04-13 12:05:33,590][0m Trial 799 finished with value: 0.8850214022960919 and parameters: {'splitter': 'best', 'min_samples_split': 0.06057095463866494, 'min_samples_leaf': 0.009123976066439358, 'min_weight_fraction_leaf': 0.05431236008274025, 'max_features': 0.9996373822419129}. Best is trial 448 with value: 0.8888507593246218.[0m
/media/san2_ssd/data/Workdir/survival/utils.py:305: RuntimeWarning: invalid value encountered in true_divide
  pdfs = np.gradient(1-survs,axis=1)/norms
/media/san2_ssd/data/Workdir/survival/utils.py:305: RuntimeWarning: invalid value encountered in true_divide
  pdfs = np.gradient(1-survs,axis=1)/norms
/media/san2_ssd/data/Workdir/survival/utils.py:305: RuntimeWarning: invalid value encountered in true_divide
  pdfs = np.gradient(1-survs,axis=1)/norms
/media/san2_ssd/data/Workdir/survival/utils.py:305: RuntimeWarning: invalid value encountered in true_divide
  pdfs = np.gradient(1-survs,axis=1)/norms
[32m[I 2022-04-13 12:05:37,435][0m Trial 800 finished with value: 0.884393380866031 and parameters: {'splitter': 'best', 'min_samples_split': 0.11909044418344936, 'min_samples_leaf': 0.03189987692123803, 'min_weight_fraction_leaf': 0.04155895681234236, 'max_features': 0.9435011739814431}. Best is trial 448 with value: 0.8888507593246218.[0m
/media/san2_ssd/data/Workdir/survival/utils.py:305: RuntimeWarning: invalid value encountered in true_divide
  pdfs = np.gradient(1-survs,axis=1)/norms
/media/san2_ssd/data/Workdir/survival/utils.py:305: RuntimeWarning: invalid value encountered in true_divide
  pdfs = np.gradient(1-survs,axis=1)/norms
/media/san2_ssd/data/Workdir/survival/utils.py:305: RuntimeWarning: invalid value encountered in true_divide
  pdfs = np.gradient(1-survs,axis=1)/norms
/media/san2_ssd/data/Workdir/survival/utils.py:305: RuntimeWarning: invalid value encountered in true_divide
  pdfs = np.gradient(1-survs,axis=1)/norms
[32m[I 2022-04-13 12:05:39,985][0m Trial 801 finished with value: 0.8864555823631471 and parameters: {'splitter': 'best', 'min_samples_split': 0.13036449155440907, 'min_samples_leaf': 0.023356386561878967, 'min_weight_fraction_leaf': 0.04320279033154188, 'max_features': 0.9991907257919845}. Best is trial 448 with value: 0.8888507593246218.[0m
/media/san2_ssd/data/Workdir/survival/utils.py:305: RuntimeWarning: invalid value encountered in true_divide
  pdfs = np.gradient(1-survs,axis=1)/norms
[32m[I 2022-04-13 12:05:43,784][0m Trial 802 finished with value: 0.7848883998515221 and parameters: {'splitter': 'best', 'min_samples_split': 0.15343441386852397, 'min_samples_leaf': 0.05819477864370631, 'min_weight_fraction_leaf': 0.05779124360784213, 'max_features': 0.9998807555414704}. Best is trial 448 with value: 0.8888507593246218.[0m
/media/san2_ssd/data/Workdir/survival/utils.py:305: RuntimeWarning: invalid value encountered in true_divide
  pdfs = np.gradient(1-survs,axis=1)/norms
/media/san2_ssd/data/Workdir/survival/utils.py:305: RuntimeWarning: invalid value encountered in true_divide
  pdfs = np.gradient(1-survs,axis=1)/norms
/media/san2_ssd/data/Workdir/survival/utils.py:305: RuntimeWarning: invalid value encountered in true_divide
  pdfs = np.gradient(1-survs,axis=1)/norms
/media/san2_ssd/data/Workdir/survival/utils.py:305: RuntimeWarning: invalid value encountered in true_divide
  pdfs = np.gradient(1-survs,axis=1)/norms
/media/san2_ssd/data/Workdir/survival/utils.py:305: RuntimeWarning: invalid value encountered in true_divide
  pdfs = np.gradient(1-survs,axis=1)/norms
[32m[I 2022-04-13 12:05:47,127][0m Trial 803 finished with value: 0.8847686934737519 and parameters: {'splitter': 'best', 'min_samples_split': 0.10590733787012453, 'min_samples_leaf': 0.039719923758413135, 'min_weight_fraction_leaf': 0.03478858501098893, 'max_features': 0.9682533385684995}. Best is trial 448 with value: 0.8888507593246218.[0m
[32m[I 2022-04-13 12:05:47,700][0m Trial 804 finished with value: 0.759051381384665 and parameters: {'splitter': 'best', 'min_samples_split': 0.12067414665042238, 'min_samples_leaf': 0.0857084766612575, 'min_weight_fraction_leaf': 0.04607520791433304, 'max_features': 0.3392534294693873}. Best is trial 448 with value: 0.8888507593246218.[0m
/media/san2_ssd/data/Workdir/survival/utils.py:305: RuntimeWarning: invalid value encountered in true_divide
  pdfs = np.gradient(1-survs,axis=1)/norms
[32m[I 2022-04-13 12:05:49,600][0m Trial 805 finished with value: 0.7718761696123959 and parameters: {'splitter': 'best', 'min_samples_split': 0.09609099043629253, 'min_samples_leaf': 0.015522198017868503, 'min_weight_fraction_leaf': 0.07042271512715763, 'max_features': 0.46826440340403586}. Best is trial 448 with value: 0.8888507593246218.[0m
/media/san2_ssd/data/Workdir/survival/utils.py:305: RuntimeWarning: invalid value encountered in true_divide
  pdfs = np.gradient(1-survs,axis=1)/norms
[32m[I 2022-04-13 12:05:52,682][0m Trial 806 finished with value: 0.8867789710995615 and parameters: {'splitter': 'best', 'min_samples_split': 0.14458013124580643, 'min_samples_leaf': 0.03183386958874925, 'min_weight_fraction_leaf': 0.033416086957225574, 'max_features': 0.9801665370373023}. Best is trial 448 with value: 0.8888507593246218.[0m
/media/san2_ssd/data/Workdir/survival/utils.py:305: RuntimeWarning: invalid value encountered in true_divide
  pdfs = np.gradient(1-survs,axis=1)/norms
/media/san2_ssd/data/Workdir/survival/utils.py:305: RuntimeWarning: invalid value encountered in true_divide
  pdfs = np.gradient(1-survs,axis=1)/norms
/media/san2_ssd/data/Workdir/survival/utils.py:305: RuntimeWarning: invalid value encountered in true_divide
  pdfs = np.gradient(1-survs,axis=1)/norms
[32m[I 2022-04-13 12:05:54,940][0m Trial 807 finished with value: 0.8839202727400121 and parameters: {'splitter': 'best', 'min_samples_split': 0.10978887321772672, 'min_samples_leaf': 0.04882831509023326, 'min_weight_fraction_leaf': 0.03999313661837401, 'max_features': 0.953106027256568}. Best is trial 448 with value: 0.8888507593246218.[0m
/media/san2_ssd/data/Workdir/survival/utils.py:305: RuntimeWarning: invalid value encountered in true_divide
  pdfs = np.gradient(1-survs,axis=1)/norms
/media/san2_ssd/data/Workdir/survival/utils.py:305: RuntimeWarning: invalid value encountered in true_divide
  pdfs = np.gradient(1-survs,axis=1)/norms
[32m[I 2022-04-13 12:05:58,836][0m Trial 808 finished with value: 0.8834986898658702 and parameters: {'splitter': 'best', 'min_samples_split': 0.1302916687295799, 'min_samples_leaf': 0.001620787931376176, 'min_weight_fraction_leaf': 0.027931095344124465, 'max_features': 0.9319636551849226}. Best is trial 448 with value: 0.8888507593246218.[0m
/media/san2_ssd/data/Workdir/survival/utils.py:305: RuntimeWarning: invalid value encountered in true_divide
  pdfs = np.gradient(1-survs,axis=1)/norms
/media/san2_ssd/data/Workdir/survival/utils.py:305: RuntimeWarning: invalid value encountered in true_divide
  pdfs = np.gradient(1-survs,axis=1)/norms
/media/san2_ssd/data/Workdir/survival/utils.py:305: RuntimeWarning: invalid value encountered in true_divide
  pdfs = np.gradient(1-survs,axis=1)/norms
[32m[I 2022-04-13 12:06:01,403][0m Trial 809 finished with value: 0.881657187146286 and parameters: {'splitter': 'best', 'min_samples_split': 0.12053677907796194, 'min_samples_leaf': 0.023427756194755307, 'min_weight_fraction_leaf': 0.051710523706682755, 'max_features': 0.9678216706496332}. Best is trial 448 with value: 0.8888507593246218.[0m
/media/san2_ssd/data/Workdir/survival/utils.py:305: RuntimeWarning: invalid value encountered in true_divide
  pdfs = np.gradient(1-survs,axis=1)/norms
/media/san2_ssd/data/Workdir/survival/utils.py:305: RuntimeWarning: invalid value encountered in true_divide
  pdfs = np.gradient(1-survs,axis=1)/norms
/media/san2_ssd/data/Workdir/survival/utils.py:305: RuntimeWarning: invalid value encountered in true_divide
  pdfs = np.gradient(1-survs,axis=1)/norms
/media/san2_ssd/data/Workdir/survival/utils.py:305: RuntimeWarning: invalid value encountered in true_divide
  pdfs = np.gradient(1-survs,axis=1)/norms
[32m[I 2022-04-13 12:06:03,220][0m Trial 810 finished with value: 0.8859020908311571 and parameters: {'splitter': 'best', 'min_samples_split': 0.09994938549435961, 'min_samples_leaf': 0.03914052330712098, 'min_weight_fraction_leaf': 0.02690385267497696, 'max_features': 0.9996717944489236}. Best is trial 448 with value: 0.8888507593246218.[0m
/media/san2_ssd/data/Workdir/survival/utils.py:305: RuntimeWarning: invalid value encountered in true_divide
  pdfs = np.gradient(1-survs,axis=1)/norms
/media/san2_ssd/data/Workdir/survival/utils.py:305: RuntimeWarning: invalid value encountered in true_divide
  pdfs = np.gradient(1-survs,axis=1)/norms
[32m[I 2022-04-13 12:06:04,971][0m Trial 811 finished with value: 0.88562319264034 and parameters: {'splitter': 'best', 'min_samples_split': 0.11140088394043686, 'min_samples_leaf': 0.05850539232223117, 'min_weight_fraction_leaf': 0.040651624580144576, 'max_features': 0.9782143165770383}. Best is trial 448 with value: 0.8888507593246218.[0m
/media/san2_ssd/data/Workdir/survival/utils.py:305: RuntimeWarning: invalid value encountered in true_divide
  pdfs = np.gradient(1-survs,axis=1)/norms
[32m[I 2022-04-13 12:06:08,046][0m Trial 812 finished with value: 0.8807497968400861 and parameters: {'splitter': 'best', 'min_samples_split': 0.08502185554596547, 'min_samples_leaf': 0.018595527959824998, 'min_weight_fraction_leaf': 0.061115452608387646, 'max_features': 0.9531732838093996}. Best is trial 448 with value: 0.8888507593246218.[0m
[32m[I 2022-04-13 12:06:08,416][0m Trial 813 finished with value: 0.7682751696112153 and parameters: {'splitter': 'random', 'min_samples_split': 0.16900633507018634, 'min_samples_leaf': 0.03394104732344382, 'min_weight_fraction_leaf': 0.03621938098991345, 'max_features': 0.9168121120677054}. Best is trial 448 with value: 0.8888507593246218.[0m
/media/san2_ssd/data/Workdir/survival/utils.py:305: RuntimeWarning: invalid value encountered in true_divide
  pdfs = np.gradient(1-survs,axis=1)/norms
/media/san2_ssd/data/Workdir/survival/utils.py:305: RuntimeWarning: invalid value encountered in true_divide
  pdfs = np.gradient(1-survs,axis=1)/norms
[32m[I 2022-04-13 12:06:10,466][0m Trial 814 finished with value: 0.8852510173209153 and parameters: {'splitter': 'best', 'min_samples_split': 0.13774664941597958, 'min_samples_leaf': 0.043825126756203314, 'min_weight_fraction_leaf': 0.051454952514818825, 'max_features': 0.9807465661042714}. Best is trial 448 with value: 0.8888507593246218.[0m
/media/san2_ssd/data/Workdir/survival/utils.py:305: RuntimeWarning: invalid value encountered in true_divide
  pdfs = np.gradient(1-survs,axis=1)/norms
/media/san2_ssd/data/Workdir/survival/utils.py:305: RuntimeWarning: invalid value encountered in true_divide
  pdfs = np.gradient(1-survs,axis=1)/norms
/media/san2_ssd/data/Workdir/survival/utils.py:305: RuntimeWarning: invalid value encountered in true_divide
  pdfs = np.gradient(1-survs,axis=1)/norms
[32m[I 2022-04-13 12:06:13,436][0m Trial 815 finished with value: 0.8867491985721673 and parameters: {'splitter': 'best', 'min_samples_split': 0.12481289728035333, 'min_samples_leaf': 0.010142096543179956, 'min_weight_fraction_leaf': 0.02429155527005323, 'max_features': 0.9997841157146781}. Best is trial 448 with value: 0.8888507593246218.[0m
/media/san2_ssd/data/Workdir/survival/utils.py:305: RuntimeWarning: invalid value encountered in true_divide
  pdfs = np.gradient(1-survs,axis=1)/norms
/media/san2_ssd/data/Workdir/survival/utils.py:305: RuntimeWarning: invalid value encountered in true_divide
  pdfs = np.gradient(1-survs,axis=1)/norms
/media/san2_ssd/data/Workdir/survival/utils.py:305: RuntimeWarning: invalid value encountered in true_divide
  pdfs = np.gradient(1-survs,axis=1)/norms
/media/san2_ssd/data/Workdir/survival/utils.py:305: RuntimeWarning: invalid value encountered in true_divide
  pdfs = np.gradient(1-survs,axis=1)/norms
/media/san2_ssd/data/Workdir/survival/utils.py:305: RuntimeWarning: invalid value encountered in true_divide
  pdfs = np.gradient(1-survs,axis=1)/norms
[32m[I 2022-04-13 12:06:16,127][0m Trial 816 finished with value: 0.8849735326234859 and parameters: {'splitter': 'best', 'min_samples_split': 0.10516561626790144, 'min_samples_leaf': 0.025288727663086694, 'min_weight_fraction_leaf': 0.03459354630463949, 'max_features': 0.9686270050347169}. Best is trial 448 with value: 0.8888507593246218.[0m
/media/san2_ssd/data/Workdir/survival/utils.py:305: RuntimeWarning: invalid value encountered in true_divide
  pdfs = np.gradient(1-survs,axis=1)/norms
/media/san2_ssd/data/Workdir/survival/utils.py:305: RuntimeWarning: invalid value encountered in true_divide
  pdfs = np.gradient(1-survs,axis=1)/norms
/media/san2_ssd/data/Workdir/survival/utils.py:305: RuntimeWarning: invalid value encountered in true_divide
  pdfs = np.gradient(1-survs,axis=1)/norms
[32m[I 2022-04-13 12:06:18,064][0m Trial 817 finished with value: 0.8831973521198314 and parameters: {'splitter': 'best', 'min_samples_split': 0.09458121090158254, 'min_samples_leaf': 0.04802187042537236, 'min_weight_fraction_leaf': 0.04621747017175679, 'max_features': 0.9517218886328186}. Best is trial 448 with value: 0.8888507593246218.[0m
[32m[I 2022-04-13 12:06:19,403][0m Trial 818 finished with value: 0.4642371073182228 and parameters: {'splitter': 'best', 'min_samples_split': 0.11492283322193286, 'min_samples_leaf': 0.03246734634554566, 'min_weight_fraction_leaf': 0.26373621145730186, 'max_features': 0.9823933908577381}. Best is trial 448 with value: 0.8888507593246218.[0m
/media/san2_ssd/data/Workdir/survival/utils.py:305: RuntimeWarning: invalid value encountered in true_divide
  pdfs = np.gradient(1-survs,axis=1)/norms
[32m[I 2022-04-13 12:06:22,794][0m Trial 819 finished with value: 0.8835966637452138 and parameters: {'splitter': 'best', 'min_samples_split': 0.1312111721966701, 'min_samples_leaf': 0.06312820792656593, 'min_weight_fraction_leaf': 0.02375543305866576, 'max_features': 0.936869593920379}. Best is trial 448 with value: 0.8888507593246218.[0m
/media/san2_ssd/data/Workdir/survival/utils.py:305: RuntimeWarning: invalid value encountered in true_divide
  pdfs = np.gradient(1-survs,axis=1)/norms
/media/san2_ssd/data/Workdir/survival/utils.py:305: RuntimeWarning: invalid value encountered in true_divide
  pdfs = np.gradient(1-survs,axis=1)/norms
[32m[I 2022-04-13 12:06:26,370][0m Trial 820 finished with value: 0.8809134993279691 and parameters: {'splitter': 'best', 'min_samples_split': 0.11550511312931286, 'min_samples_leaf': 0.01767858669748565, 'min_weight_fraction_leaf': 0.06084872181559398, 'max_features': 0.9690205218988919}. Best is trial 448 with value: 0.8888507593246218.[0m
[32m[I 2022-04-13 12:06:27,178][0m Trial 821 finished with value: 0.4762173568334265 and parameters: {'splitter': 'best', 'min_samples_split': 0.32957771459979424, 'min_samples_leaf': 0.039000713304055544, 'min_weight_fraction_leaf': 0.03215669089085066, 'max_features': 0.9805145212359561}. Best is trial 448 with value: 0.8888507593246218.[0m
/media/san2_ssd/data/Workdir/survival/utils.py:305: RuntimeWarning: invalid value encountered in true_divide
  pdfs = np.gradient(1-survs,axis=1)/norms
/media/san2_ssd/data/Workdir/survival/utils.py:305: RuntimeWarning: invalid value encountered in true_divide
  pdfs = np.gradient(1-survs,axis=1)/norms
/media/san2_ssd/data/Workdir/survival/utils.py:305: RuntimeWarning: invalid value encountered in true_divide
  pdfs = np.gradient(1-survs,axis=1)/norms
/media/san2_ssd/data/Workdir/survival/utils.py:305: RuntimeWarning: invalid value encountered in true_divide
  pdfs = np.gradient(1-survs,axis=1)/norms
/media/san2_ssd/data/Workdir/survival/utils.py:305: RuntimeWarning: invalid value encountered in true_divide
  pdfs = np.gradient(1-survs,axis=1)/norms
[32m[I 2022-04-13 12:06:29,505][0m Trial 822 finished with value: 0.8827905367053281 and parameters: {'splitter': 'best', 'min_samples_split': 0.10213371034086047, 'min_samples_leaf': 0.02774337350238454, 'min_weight_fraction_leaf': 0.04409518457332944, 'max_features': 0.9562406959670522}. Best is trial 448 with value: 0.8888507593246218.[0m
[32m[I 2022-04-13 12:06:29,962][0m Trial 823 finished with value: 0.8307396524402076 and parameters: {'splitter': 'best', 'min_samples_split': 0.12074839811591659, 'min_samples_leaf': 0.0012534418181179355, 'min_weight_fraction_leaf': 0.021695107276932885, 'max_features': 0.10799953975844268}. Best is trial 448 with value: 0.8888507593246218.[0m
/media/san2_ssd/data/Workdir/survival/utils.py:305: RuntimeWarning: invalid value encountered in true_divide
  pdfs = np.gradient(1-survs,axis=1)/norms
/media/san2_ssd/data/Workdir/survival/utils.py:305: RuntimeWarning: invalid value encountered in true_divide
  pdfs = np.gradient(1-survs,axis=1)/norms
[32m[I 2022-04-13 12:06:32,229][0m Trial 824 finished with value: 0.8854800845703646 and parameters: {'splitter': 'best', 'min_samples_split': 0.13766021929874164, 'min_samples_leaf': 0.05399971002507012, 'min_weight_fraction_leaf': 0.05299205667219424, 'max_features': 0.9788322561258832}. Best is trial 448 with value: 0.8888507593246218.[0m
[32m[I 2022-04-13 12:06:34,813][0m Trial 825 finished with value: 0.8808887021423036 and parameters: {'splitter': 'best', 'min_samples_split': 0.09257890100161018, 'min_samples_leaf': 0.015469481780825686, 'min_weight_fraction_leaf': 0.07994884898973217, 'max_features': 0.937417379553397}. Best is trial 448 with value: 0.8888507593246218.[0m
[32m[I 2022-04-13 12:06:35,194][0m Trial 826 finished with value: 0.46254628895208666 and parameters: {'splitter': 'best', 'min_samples_split': 0.07965183919591479, 'min_samples_leaf': 0.2596481785694426, 'min_weight_fraction_leaf': 0.034754004724844315, 'max_features': 0.9841264809968346}. Best is trial 448 with value: 0.8888507593246218.[0m
/media/san2_ssd/data/Workdir/survival/utils.py:305: RuntimeWarning: invalid value encountered in true_divide
  pdfs = np.gradient(1-survs,axis=1)/norms
/media/san2_ssd/data/Workdir/survival/utils.py:305: RuntimeWarning: invalid value encountered in true_divide
  pdfs = np.gradient(1-survs,axis=1)/norms
[32m[I 2022-04-13 12:06:36,229][0m Trial 827 finished with value: 0.8830744991073722 and parameters: {'splitter': 'best', 'min_samples_split': 0.10702015065768948, 'min_samples_leaf': 0.04246703686161736, 'min_weight_fraction_leaf': 0.017194893169733425, 'max_features': 0.847729001736408}. Best is trial 448 with value: 0.8888507593246218.[0m
/media/san2_ssd/data/Workdir/survival/utils.py:305: RuntimeWarning: invalid value encountered in true_divide
  pdfs = np.gradient(1-survs,axis=1)/norms
/media/san2_ssd/data/Workdir/survival/utils.py:305: RuntimeWarning: invalid value encountered in true_divide
  pdfs = np.gradient(1-survs,axis=1)/norms
[32m[I 2022-04-13 12:06:37,274][0m Trial 828 finished with value: 0.8832752686627872 and parameters: {'splitter': 'best', 'min_samples_split': 0.12164938903325255, 'min_samples_leaf': 0.025228161621759213, 'min_weight_fraction_leaf': 0.02759741514027465, 'max_features': 0.9559270275742076}. Best is trial 448 with value: 0.8888507593246218.[0m
/media/san2_ssd/data/Workdir/survival/utils.py:305: RuntimeWarning: invalid value encountered in true_divide
  pdfs = np.gradient(1-survs,axis=1)/norms
/media/san2_ssd/data/Workdir/survival/utils.py:305: RuntimeWarning: invalid value encountered in true_divide
  pdfs = np.gradient(1-survs,axis=1)/norms
/media/san2_ssd/data/Workdir/survival/utils.py:305: RuntimeWarning: invalid value encountered in true_divide
  pdfs = np.gradient(1-survs,axis=1)/norms
/media/san2_ssd/data/Workdir/survival/utils.py:305: RuntimeWarning: invalid value encountered in true_divide
  pdfs = np.gradient(1-survs,axis=1)/norms
[32m[I 2022-04-13 12:06:38,183][0m Trial 829 finished with value: 0.8877947855517132 and parameters: {'splitter': 'best', 'min_samples_split': 0.11042454409708821, 'min_samples_leaf': 0.030488182982558086, 'min_weight_fraction_leaf': 0.04249261172676699, 'max_features': 0.9830242734220842}. Best is trial 448 with value: 0.8888507593246218.[0m
[32m[I 2022-04-13 12:06:40,241][0m Trial 830 finished with value: 0.8834604123687291 and parameters: {'splitter': 'best', 'min_samples_split': 0.1293931403441124, 'min_samples_leaf': 0.016226465596358954, 'min_weight_fraction_leaf': 0.06937558764416407, 'max_features': 0.9990405544537005}. Best is trial 448 with value: 0.8888507593246218.[0m
/media/san2_ssd/data/Workdir/survival/utils.py:305: RuntimeWarning: invalid value encountered in true_divide
  pdfs = np.gradient(1-survs,axis=1)/norms
[32m[I 2022-04-13 12:06:43,018][0m Trial 831 finished with value: 0.8857731545091931 and parameters: {'splitter': 'best', 'min_samples_split': 0.09981117964069934, 'min_samples_leaf': 0.009168166591934125, 'min_weight_fraction_leaf': 0.06211288758775366, 'max_features': 0.9827582857973135}. Best is trial 448 with value: 0.8888507593246218.[0m
