[32m[I 2022-04-13 12:33:51,126][0m Trial 764 finished with value: 0.7462817008584336 and parameters: {'splitter': 'best', 'min_samples_split': 0.12709808403284684, 'min_samples_leaf': 0.02583078233675228, 'min_weight_fraction_leaf': 0.011090627779252831, 'max_features': 0.4982332408994722}. Best is trial 241 with value: 0.7773840258827056.[0m
[32m[I 2022-04-13 12:33:52,451][0m Trial 765 finished with value: 0.7681584637166906 and parameters: {'splitter': 'best', 'min_samples_split': 0.11502153678812735, 'min_samples_leaf': 0.06768840773748815, 'min_weight_fraction_leaf': 0.0566167984611743, 'max_features': 0.9550671469450052}. Best is trial 241 with value: 0.7773840258827056.[0m
[32m[I 2022-04-13 12:33:54,621][0m Trial 766 finished with value: 0.7735339637020835 and parameters: {'splitter': 'best', 'min_samples_split': 0.10093806958559419, 'min_samples_leaf': 0.03338469167537548, 'min_weight_fraction_leaf': 0.03406472293432064, 'max_features': 0.9996489275848405}. Best is trial 241 with value: 0.7773840258827056.[0m
[32m[I 2022-04-13 12:33:57,568][0m Trial 767 finished with value: 0.7637619055286078 and parameters: {'splitter': 'best', 'min_samples_split': 0.13290689592118998, 'min_samples_leaf': 0.05558801238314771, 'min_weight_fraction_leaf': 0.046096047635502076, 'max_features': 0.9055330702756623}. Best is trial 241 with value: 0.7773840258827056.[0m
[32m[I 2022-04-13 12:33:58,002][0m Trial 768 finished with value: 0.7523860264318164 and parameters: {'splitter': 'random', 'min_samples_split': 0.14284390319114906, 'min_samples_leaf': 0.017269755508897634, 'min_weight_fraction_leaf': 0.022021265118112886, 'max_features': 0.9687752276790066}. Best is trial 241 with value: 0.7773840258827056.[0m
[32m[I 2022-04-13 12:34:00,506][0m Trial 769 finished with value: 0.7678712518003701 and parameters: {'splitter': 'best', 'min_samples_split': 0.11788480315301693, 'min_samples_leaf': 0.04526493973185838, 'min_weight_fraction_leaf': 0.06639687300713042, 'max_features': 0.9444737331093177}. Best is trial 241 with value: 0.7773840258827056.[0m
[32m[I 2022-04-13 12:34:04,280][0m Trial 770 finished with value: 0.7691236854016246 and parameters: {'splitter': 'best', 'min_samples_split': 0.06222623604730304, 'min_samples_leaf': 0.03390049769770528, 'min_weight_fraction_leaf': 0.03561837165313177, 'max_features': 0.9788791097645836}. Best is trial 241 with value: 0.7773840258827056.[0m
[32m[I 2022-04-13 12:34:06,555][0m Trial 771 finished with value: 0.6960223903768297 and parameters: {'splitter': 'best', 'min_samples_split': 0.09553923397849383, 'min_samples_leaf': 0.021592134437753013, 'min_weight_fraction_leaf': 0.2439295932967444, 'max_features': 0.9670789996618169}. Best is trial 241 with value: 0.7773840258827056.[0m
[32m[I 2022-04-13 12:34:08,424][0m Trial 772 finished with value: 0.6155046506572347 and parameters: {'splitter': 'best', 'min_samples_split': 0.15276907934208006, 'min_samples_leaf': 0.040374681309686654, 'min_weight_fraction_leaf': 0.29797092335622305, 'max_features': 0.9227816067537286}. Best is trial 241 with value: 0.7773840258827056.[0m
[32m[I 2022-04-13 12:34:09,725][0m Trial 773 finished with value: 0.7605843470803202 and parameters: {'splitter': 'best', 'min_samples_split': 0.1100714761731485, 'min_samples_leaf': 0.15213964577442785, 'min_weight_fraction_leaf': 0.0007660304297526458, 'max_features': 0.9830202534100256}. Best is trial 241 with value: 0.7773840258827056.[0m
[32m[I 2022-04-13 12:34:09,913][0m Trial 774 finished with value: 0.5962864358175997 and parameters: {'splitter': 'best', 'min_samples_split': 0.08446470351601076, 'min_samples_leaf': 0.4798768525103225, 'min_weight_fraction_leaf': 0.013261079281355918, 'max_features': 0.9476070187870899}. Best is trial 241 with value: 0.7773840258827056.[0m
[32m[I 2022-04-13 12:34:12,303][0m Trial 775 finished with value: 0.7709664520524182 and parameters: {'splitter': 'best', 'min_samples_split': 0.12485124480284183, 'min_samples_leaf': 0.011124189392874607, 'min_weight_fraction_leaf': 0.050964850998719835, 'max_features': 0.9996742870566284}. Best is trial 241 with value: 0.7773840258827056.[0m
[32m[I 2022-04-13 12:34:14,024][0m Trial 776 finished with value: 0.7705020346418305 and parameters: {'splitter': 'best', 'min_samples_split': 0.13969537269124532, 'min_samples_leaf': 0.051500913777734664, 'min_weight_fraction_leaf': 0.02888218345052087, 'max_features': 0.9997684450439187}. Best is trial 241 with value: 0.7773840258827056.[0m
[32m[I 2022-04-13 12:34:16,095][0m Trial 777 finished with value: 0.7010673274220223 and parameters: {'splitter': 'best', 'min_samples_split': 0.4889882506716977, 'min_samples_leaf': 0.06312192130892202, 'min_weight_fraction_leaf': 0.04242980560445975, 'max_features': 0.965762112062023}. Best is trial 241 with value: 0.7773840258827056.[0m
[32m[I 2022-04-13 12:34:18,424][0m Trial 778 finished with value: 0.7714482401264492 and parameters: {'splitter': 'best', 'min_samples_split': 0.10289391495315604, 'min_samples_leaf': 0.02868168643064411, 'min_weight_fraction_leaf': 0.019587208627893874, 'max_features': 0.9811124859424767}. Best is trial 241 with value: 0.7773840258827056.[0m
[32m[I 2022-04-13 12:34:20,188][0m Trial 779 finished with value: 0.7657858925429669 and parameters: {'splitter': 'best', 'min_samples_split': 0.1161257513610799, 'min_samples_leaf': 0.041736899758708805, 'min_weight_fraction_leaf': 0.02853939777289861, 'max_features': 0.9548088187825376}. Best is trial 241 with value: 0.7773840258827056.[0m
[32m[I 2022-04-13 12:34:22,977][0m Trial 780 finished with value: 0.7741046738371813 and parameters: {'splitter': 'best', 'min_samples_split': 0.12991182680522306, 'min_samples_leaf': 0.023195047785729637, 'min_weight_fraction_leaf': 0.04032680090476343, 'max_features': 0.9997530655350243}. Best is trial 241 with value: 0.7773840258827056.[0m
[32m[I 2022-04-13 12:34:25,276][0m Trial 781 finished with value: 0.7667797411900819 and parameters: {'splitter': 'best', 'min_samples_split': 0.10782246970510992, 'min_samples_leaf': 0.04998850756638268, 'min_weight_fraction_leaf': 0.007070036771618091, 'max_features': 0.9387481207613906}. Best is trial 241 with value: 0.7773840258827056.[0m
[32m[I 2022-04-13 12:34:27,180][0m Trial 782 finished with value: 0.7674210038360685 and parameters: {'splitter': 'best', 'min_samples_split': 0.0912575657384244, 'min_samples_leaf': 0.0348109428532683, 'min_weight_fraction_leaf': 0.05166657690305029, 'max_features': 0.9681168358019088}. Best is trial 241 with value: 0.7773840258827056.[0m
[32m[I 2022-04-13 12:34:28,492][0m Trial 783 finished with value: 0.7724858570084804 and parameters: {'splitter': 'best', 'min_samples_split': 0.1240316856858344, 'min_samples_leaf': 0.009697185026323272, 'min_weight_fraction_leaf': 0.06340544618169057, 'max_features': 0.9797979720076412}. Best is trial 241 with value: 0.7773840258827056.[0m
[32m[I 2022-04-13 12:34:29,417][0m Trial 784 finished with value: 0.7709959654802228 and parameters: {'splitter': 'best', 'min_samples_split': 0.14253185774550037, 'min_samples_leaf': 0.05918855476401509, 'min_weight_fraction_leaf': 0.01906494312876944, 'max_features': 0.9810465575623929}. Best is trial 241 with value: 0.7773840258827056.[0m
[32m[I 2022-04-13 12:34:30,614][0m Trial 785 finished with value: 0.7755320196966078 and parameters: {'splitter': 'best', 'min_samples_split': 0.11411582874043594, 'min_samples_leaf': 0.02925007996970371, 'min_weight_fraction_leaf': 0.03262342925504334, 'max_features': 0.9999894041230585}. Best is trial 241 with value: 0.7773840258827056.[0m
[32m[I 2022-04-13 12:34:33,319][0m Trial 786 finished with value: 0.7711647155393629 and parameters: {'splitter': 'best', 'min_samples_split': 0.09995172813808022, 'min_samples_leaf': 0.017083929224262613, 'min_weight_fraction_leaf': 0.027535910195422182, 'max_features': 0.9993307965967055}. Best is trial 241 with value: 0.7773840258827056.[0m
[32m[I 2022-04-13 12:34:36,704][0m Trial 787 finished with value: 0.7634664404241663 and parameters: {'splitter': 'best', 'min_samples_split': 0.10842905601773578, 'min_samples_leaf': 0.0013128282541186587, 'min_weight_fraction_leaf': 0.010498559002059375, 'max_features': 0.9997935203775405}. Best is trial 241 with value: 0.7773840258827056.[0m
[32m[I 2022-04-13 12:34:37,036][0m Trial 788 finished with value: 0.7693937079571012 and parameters: {'splitter': 'random', 'min_samples_split': 0.09086279492189034, 'min_samples_leaf': 0.026353364536825803, 'min_weight_fraction_leaf': 0.032446815940847765, 'max_features': 0.9646270572894353}. Best is trial 241 with value: 0.7773840258827056.[0m
[32m[I 2022-04-13 12:34:37,990][0m Trial 789 finished with value: 0.7388454250214005 and parameters: {'splitter': 'best', 'min_samples_split': 0.07887096236426665, 'min_samples_leaf': 0.012716437149928012, 'min_weight_fraction_leaf': 0.017778036337463943, 'max_features': 0.46077770285321884}. Best is trial 241 with value: 0.7773840258827056.[0m
[32m[I 2022-04-13 12:34:41,039][0m Trial 790 finished with value: 0.7725756105467954 and parameters: {'splitter': 'best', 'min_samples_split': 0.10207849041704133, 'min_samples_leaf': 0.029836699254673783, 'min_weight_fraction_leaf': 8.490227876662045e-05, 'max_features': 0.9813033683013571}. Best is trial 241 with value: 0.7773840258827056.[0m
[32m[I 2022-04-13 12:34:44,968][0m Trial 791 finished with value: 0.7684733358626448 and parameters: {'splitter': 'best', 'min_samples_split': 0.1155217705955303, 'min_samples_leaf': 0.01984836774514979, 'min_weight_fraction_leaf': 0.024825760310404447, 'max_features': 0.9575648402001183}. Best is trial 241 with value: 0.7773840258827056.[0m
[32m[I 2022-04-13 12:34:46,244][0m Trial 792 finished with value: 0.7749797577146007 and parameters: {'splitter': 'best', 'min_samples_split': 0.11207688026357268, 'min_samples_leaf': 0.035140519435532265, 'min_weight_fraction_leaf': 0.03656517684794748, 'max_features': 0.9827445547001127}. Best is trial 241 with value: 0.7773840258827056.[0m
[32m[I 2022-04-13 12:34:48,691][0m Trial 793 finished with value: 0.7654060155926273 and parameters: {'splitter': 'best', 'min_samples_split': 0.11856894722195019, 'min_samples_leaf': 0.019636342646688267, 'min_weight_fraction_leaf': 0.014015589228978366, 'max_features': 0.9314972000357691}. Best is trial 241 with value: 0.7773840258827056.[0m
[32m[I 2022-04-13 12:34:51,439][0m Trial 794 finished with value: 0.7673066247860951 and parameters: {'splitter': 'best', 'min_samples_split': 0.11451697900866536, 'min_samples_leaf': 0.03357411038881915, 'min_weight_fraction_leaf': 0.03125676119891991, 'max_features': 0.9462515264727157}. Best is trial 241 with value: 0.7773840258827056.[0m
[32m[I 2022-04-13 12:34:52,072][0m Trial 795 finished with value: 0.7165826992906317 and parameters: {'splitter': 'best', 'min_samples_split': 0.127103672084801, 'min_samples_leaf': 0.17018345934154636, 'min_weight_fraction_leaf': 0.02151815516568785, 'max_features': 0.8091628470226158}. Best is trial 241 with value: 0.7773840258827056.[0m
[32m[I 2022-04-13 12:34:54,682][0m Trial 796 finished with value: 0.7663540298005695 and parameters: {'splitter': 'best', 'min_samples_split': 0.10980498635935966, 'min_samples_leaf': 0.0441317905054456, 'min_weight_fraction_leaf': 0.03735635617255719, 'max_features': 0.9662371535813794}. Best is trial 241 with value: 0.7773840258827056.[0m
[32m[I 2022-04-13 12:34:58,056][0m Trial 797 finished with value: 0.7623458577532599 and parameters: {'splitter': 'best', 'min_samples_split': 0.12094030961017468, 'min_samples_leaf': 0.041287021330033445, 'min_weight_fraction_leaf': 0.00862520836558307, 'max_features': 0.9208029491647356}. Best is trial 241 with value: 0.7773840258827056.[0m
[32m[I 2022-04-13 12:35:00,239][0m Trial 798 finished with value: 0.77187483575543 and parameters: {'splitter': 'best', 'min_samples_split': 0.10681034824821117, 'min_samples_leaf': 0.04874069271979715, 'min_weight_fraction_leaf': 0.02481130337194899, 'max_features': 0.98035214955472}. Best is trial 241 with value: 0.7773840258827056.[0m
[32m[I 2022-04-13 12:35:03,412][0m Trial 799 finished with value: 0.7643766232533115 and parameters: {'splitter': 'best', 'min_samples_split': 0.1227992138129893, 'min_samples_leaf': 0.03651428386985188, 'min_weight_fraction_leaf': 0.0377759023853909, 'max_features': 0.9511065914841381}. Best is trial 241 with value: 0.7773840258827056.[0m
[32m[I 2022-04-13 12:35:06,165][0m Trial 800 finished with value: 0.7184032701195723 and parameters: {'splitter': 'best', 'min_samples_split': 0.3616771760388517, 'min_samples_leaf': 0.012281947783045512, 'min_weight_fraction_leaf': 0.044944491695936145, 'max_features': 0.9681296713744961}. Best is trial 241 with value: 0.7773840258827056.[0m
[32m[I 2022-04-13 12:35:08,477][0m Trial 801 finished with value: 0.7736215741085104 and parameters: {'splitter': 'best', 'min_samples_split': 0.11411531963126055, 'min_samples_leaf': 0.0227522072176876, 'min_weight_fraction_leaf': 0.015620869519011376, 'max_features': 0.9822786134801582}. Best is trial 241 with value: 0.7773840258827056.[0m
[32m[I 2022-04-13 12:35:11,992][0m Trial 802 finished with value: 0.7669973797317404 and parameters: {'splitter': 'best', 'min_samples_split': 0.1304189818042797, 'min_samples_leaf': 0.006907334900934252, 'min_weight_fraction_leaf': 0.027865302201578814, 'max_features': 0.938924479894039}. Best is trial 241 with value: 0.7773840258827056.[0m
[32m[I 2022-04-13 12:35:13,666][0m Trial 803 finished with value: 0.7542541114910326 and parameters: {'splitter': 'best', 'min_samples_split': 0.31217469242935225, 'min_samples_leaf': 0.051771218131233726, 'min_weight_fraction_leaf': 0.03449948461871552, 'max_features': 0.999425647198182}. Best is trial 241 with value: 0.7773840258827056.[0m
[32m[I 2022-04-13 12:35:13,924][0m Trial 804 finished with value: 0.6622043189904463 and parameters: {'splitter': 'best', 'min_samples_split': 0.1073226985056539, 'min_samples_leaf': 0.028081596277066048, 'min_weight_fraction_leaf': 0.05259416280673017, 'max_features': 0.21989549622049614}. Best is trial 241 with value: 0.7773840258827056.[0m
[32m[I 2022-04-13 12:35:17,090][0m Trial 805 finished with value: 0.7665505373255745 and parameters: {'splitter': 'best', 'min_samples_split': 0.12176377630124208, 'min_samples_leaf': 0.028083337312583303, 'min_weight_fraction_leaf': 0.009195752620682007, 'max_features': 0.9650424798247494}. Best is trial 241 with value: 0.7773840258827056.[0m
[32m[I 2022-04-13 12:35:18,884][0m Trial 806 finished with value: 0.752434713666853 and parameters: {'splitter': 'best', 'min_samples_split': 0.38435546460854564, 'min_samples_leaf': 0.040878311993637555, 'min_weight_fraction_leaf': 0.020062738994302675, 'max_features': 0.9789270664055113}. Best is trial 241 with value: 0.7773840258827056.[0m
[32m[I 2022-04-13 12:35:19,173][0m Trial 807 finished with value: 0.7600088210932092 and parameters: {'splitter': 'random', 'min_samples_split': 0.13107238341776475, 'min_samples_leaf': 0.02068120558848479, 'min_weight_fraction_leaf': 0.04532818885793435, 'max_features': 0.9541114929724461}. Best is trial 241 with value: 0.7773840258827056.[0m
[32m[I 2022-04-13 12:35:20,970][0m Trial 808 finished with value: 0.7653921338157594 and parameters: {'splitter': 'best', 'min_samples_split': 0.11410507107063514, 'min_samples_leaf': 0.03161792515570512, 'min_weight_fraction_leaf': 0.02630554686844398, 'max_features': 0.8416686534612046}. Best is trial 241 with value: 0.7773840258827056.[0m
[32m[I 2022-04-13 12:35:23,085][0m Trial 809 finished with value: 0.7183767849447602 and parameters: {'splitter': 'best', 'min_samples_split': 0.4605165043492086, 'min_samples_leaf': 0.018885473537758234, 'min_weight_fraction_leaf': 2.175018014045904e-05, 'max_features': 0.9808382499030612}. Best is trial 241 with value: 0.7773840258827056.[0m
[32m[I 2022-04-13 12:35:26,579][0m Trial 810 finished with value: 0.7705901872156735 and parameters: {'splitter': 'best', 'min_samples_split': 0.10109590528849825, 'min_samples_leaf': 0.010044622464986679, 'min_weight_fraction_leaf': 0.038132284149340494, 'max_features': 0.902444341724917}. Best is trial 241 with value: 0.7773840258827056.[0m
[32m[I 2022-04-13 12:35:28,861][0m Trial 811 finished with value: 0.7476971132742101 and parameters: {'splitter': 'best', 'min_samples_split': 0.12419690884998848, 'min_samples_leaf': 0.03134908859617548, 'min_weight_fraction_leaf': 0.13451575399922616, 'max_features': 0.9372737509624391}. Best is trial 241 with value: 0.7773840258827056.[0m
[32m[I 2022-04-13 12:35:31,966][0m Trial 812 finished with value: 0.7653858318744305 and parameters: {'splitter': 'best', 'min_samples_split': 0.1127053012994265, 'min_samples_leaf': 0.03433156458110837, 'min_weight_fraction_leaf': 0.057742680369197955, 'max_features': 0.962173306259825}. Best is trial 241 with value: 0.7773840258827056.[0m
[32m[I 2022-04-13 12:35:33,354][0m Trial 813 finished with value: 0.7727431212725303 and parameters: {'splitter': 'best', 'min_samples_split': 0.0968954835588017, 'min_samples_leaf': 0.07491608921885987, 'min_weight_fraction_leaf': 0.016923526261253447, 'max_features': 0.982956955743992}. Best is trial 241 with value: 0.7773840258827056.[0m
[32m[I 2022-04-13 12:35:36,610][0m Trial 814 finished with value: 0.7674062555968251 and parameters: {'splitter': 'best', 'min_samples_split': 0.043748480175146987, 'min_samples_leaf': 0.001184040636226416, 'min_weight_fraction_leaf': 0.030941982641115542, 'max_features': 0.9817779787604791}. Best is trial 241 with value: 0.7773840258827056.[0m
[32m[I 2022-04-13 12:35:39,152][0m Trial 815 finished with value: 0.7657500086652168 and parameters: {'splitter': 'best', 'min_samples_split': 0.13575833050525113, 'min_samples_leaf': 0.021340247686391395, 'min_weight_fraction_leaf': 0.04472541615761874, 'max_features': 0.9529897407405041}. Best is trial 241 with value: 0.7773840258827056.[0m
[32m[I 2022-04-13 12:35:41,794][0m Trial 816 finished with value: 0.770084767472636 and parameters: {'splitter': 'best', 'min_samples_split': 0.014864885804258376, 'min_samples_leaf': 0.057573325286852745, 'min_weight_fraction_leaf': 0.010453597243779405, 'max_features': 0.9824734862908897}. Best is trial 241 with value: 0.7773840258827056.[0m
[32m[I 2022-04-13 12:35:43,818][0m Trial 817 finished with value: 0.772582314832463 and parameters: {'splitter': 'best', 'min_samples_split': 0.10548495216025064, 'min_samples_leaf': 0.04626223641242856, 'min_weight_fraction_leaf': 0.034129771560425626, 'max_features': 0.999775096736253}. Best is trial 241 with value: 0.7773840258827056.[0m
[32m[I 2022-04-13 12:35:45,479][0m Trial 818 finished with value: 0.7667824828576928 and parameters: {'splitter': 'best', 'min_samples_split': 0.12137046609115243, 'min_samples_leaf': 0.06537623697359632, 'min_weight_fraction_leaf': 0.023206348020668066, 'max_features': 0.9643436370806123}. Best is trial 241 with value: 0.7773840258827056.[0m
[32m[I 2022-04-13 12:35:47,265][0m Trial 819 finished with value: 0.7696531744215964 and parameters: {'splitter': 'best', 'min_samples_split': 0.09642590960145073, 'min_samples_leaf': 0.04381771678170554, 'min_weight_fraction_leaf': 0.03923608732845319, 'max_features': 0.9201549000915461}. Best is trial 241 with value: 0.7773840258827056.[0m
[32m[I 2022-04-13 12:35:49,240][0m Trial 820 finished with value: 0.7702493603117248 and parameters: {'splitter': 'best', 'min_samples_split': 0.13182467582942484, 'min_samples_leaf': 0.05036316030853592, 'min_weight_fraction_leaf': 0.019381571955762542, 'max_features': 0.9991425493977637}. Best is trial 241 with value: 0.7773840258827056.[0m
[32m[I 2022-04-13 12:35:52,182][0m Trial 821 finished with value: 0.7681866875310146 and parameters: {'splitter': 'best', 'min_samples_split': 0.11705966414021737, 'min_samples_leaf': 0.04035046619956187, 'min_weight_fraction_leaf': 0.030355753673886248, 'max_features': 0.9402876825052182}. Best is trial 241 with value: 0.7773840258827056.[0m
[32m[I 2022-04-13 12:35:54,524][0m Trial 822 finished with value: 0.7682069681852861 and parameters: {'splitter': 'best', 'min_samples_split': 0.10226047115563626, 'min_samples_leaf': 0.03788807607537931, 'min_weight_fraction_leaf': 0.01117761811403233, 'max_features': 0.9630261481126056}. Best is trial 241 with value: 0.7773840258827056.[0m
[32m[I 2022-04-13 12:35:56,831][0m Trial 823 finished with value: 0.7601185147372499 and parameters: {'splitter': 'best', 'min_samples_split': 0.28035341946134185, 'min_samples_leaf': 0.014529196226715602, 'min_weight_fraction_leaf': 0.05539450856782541, 'max_features': 0.980659523815573}. Best is trial 241 with value: 0.7773840258827056.[0m
[32m[I 2022-04-13 12:35:59,076][0m Trial 824 finished with value: 0.7477745460069574 and parameters: {'splitter': 'best', 'min_samples_split': 0.08719741118470754, 'min_samples_leaf': 0.05648468004173543, 'min_weight_fraction_leaf': 0.03981575941707208, 'max_features': 0.754178941728668}. Best is trial 241 with value: 0.7773840258827056.[0m
[32m[I 2022-04-13 12:36:01,047][0m Trial 825 finished with value: 0.7702153144704936 and parameters: {'splitter': 'best', 'min_samples_split': 0.14029012513102934, 'min_samples_leaf': 0.049101882201201166, 'min_weight_fraction_leaf': 0.02406516866206335, 'max_features': 0.9995775676482858}. Best is trial 241 with value: 0.7773840258827056.[0m
[32m[I 2022-04-13 12:36:01,621][0m Trial 826 finished with value: 0.7601566649127793 and parameters: {'splitter': 'random', 'min_samples_split': 0.12363530203166433, 'min_samples_leaf': 0.025038576984926734, 'min_weight_fraction_leaf': 0.04851199708936315, 'max_features': 0.9668700647125524}. Best is trial 241 with value: 0.7773840258827056.[0m
