[32m[I 2022-04-15 11:08:45,890][0m Trial 775 finished with value: 0.5 and parameters: {'loss': 'coxph', 'learning_rate': 0.0012939038124930224, 'n_estimators': 777, 'criterion': 'squared_error', 'min_samples_split': 6, 'min_samples_leaf': 2, 'min_weight_fraction_leaf': 0.08956554381833343, 'min_impurity_decrease': 0.4340930633922042, 'max_features': 0.7504800350547908, 'subsample': 0.7490262917461885, 'dropout_rate': 0.681191436730539, 'ccp_alpha': 0.10108255469333345}. Best is trial 712 with value: 0.7824105962295036.[0m
[32m[I 2022-04-15 11:09:58,182][0m Trial 776 finished with value: 0.5 and parameters: {'loss': 'coxph', 'learning_rate': 0.003763313973350597, 'n_estimators': 625, 'criterion': 'friedman_mse', 'min_samples_split': 6, 'min_samples_leaf': 2, 'min_weight_fraction_leaf': 0.4993815172849584, 'min_impurity_decrease': 0.3915098385077559, 'max_features': 0.7182468734545051, 'subsample': 0.7756192401351001, 'dropout_rate': 0.6598091115361064, 'ccp_alpha': 0.08973895733761196}. Best is trial 712 with value: 0.7824105962295036.[0m
[32m[I 2022-04-15 11:11:10,748][0m Trial 777 finished with value: 0.5 and parameters: {'loss': 'coxph', 'learning_rate': 0.0025307457203516074, 'n_estimators': 601, 'criterion': 'friedman_mse', 'min_samples_split': 6, 'min_samples_leaf': 2, 'min_weight_fraction_leaf': 0.07174230700836493, 'min_impurity_decrease': 0.2975568565037397, 'max_features': 0.7393409491534281, 'subsample': 0.8229275117011123, 'dropout_rate': 0.6179001280057626, 'ccp_alpha': 0.23576853718395785}. Best is trial 712 with value: 0.7824105962295036.[0m
[32m[I 2022-04-15 11:12:40,898][0m Trial 778 finished with value: 0.6743624146605087 and parameters: {'loss': 'coxph', 'learning_rate': 0.0034818847577543985, 'n_estimators': 638, 'criterion': 'friedman_mse', 'min_samples_split': 6, 'min_samples_leaf': 2, 'min_weight_fraction_leaf': 0.06136430540286504, 'min_impurity_decrease': 0.452650252696535, 'max_features': 0.7638214257213547, 'subsample': 0.7998054846327193, 'dropout_rate': 0.6069970452856372, 'ccp_alpha': 0.16107638309067993}. Best is trial 712 with value: 0.7824105962295036.[0m
[32m[I 2022-04-15 11:13:58,474][0m Trial 779 finished with value: 0.7739791342103954 and parameters: {'loss': 'coxph', 'learning_rate': 0.00196182656446809, 'n_estimators': 595, 'criterion': 'friedman_mse', 'min_samples_split': 6, 'min_samples_leaf': 2, 'min_weight_fraction_leaf': 0.08213966769366168, 'min_impurity_decrease': 0.3276642405723974, 'max_features': 0.7207019760611217, 'subsample': 0.7491993821689088, 'dropout_rate': 0.6287323659234112, 'ccp_alpha': 0.005718205568124234}. Best is trial 712 with value: 0.7824105962295036.[0m
[32m[I 2022-04-15 11:15:07,456][0m Trial 780 finished with value: 0.7778487191843088 and parameters: {'loss': 'coxph', 'learning_rate': 0.0015528179038475332, 'n_estimators': 582, 'criterion': 'friedman_mse', 'min_samples_split': 6, 'min_samples_leaf': 2, 'min_weight_fraction_leaf': 0.0698667604597694, 'min_impurity_decrease': 0.4213353710822085, 'max_features': 0.7625098280330744, 'subsample': 0.7805515284127748, 'dropout_rate': 0.6935142301063949, 'ccp_alpha': 0.0031370632453812724}. Best is trial 712 with value: 0.7824105962295036.[0m
[32m[I 2022-04-15 11:16:40,038][0m Trial 781 finished with value: 0.7351759947622986 and parameters: {'loss': 'coxph', 'learning_rate': 0.0017824804733051962, 'n_estimators': 738, 'criterion': 'friedman_mse', 'min_samples_split': 6, 'min_samples_leaf': 2, 'min_weight_fraction_leaf': 0.10173595895002294, 'min_impurity_decrease': 0.47895369442290525, 'max_features': 0.746704764265854, 'subsample': 0.7784906848914503, 'dropout_rate': 0.6982163329899226, 'ccp_alpha': 0.0864450154881687}. Best is trial 712 with value: 0.7824105962295036.[0m
[32m[I 2022-04-15 11:17:50,023][0m Trial 782 finished with value: 0.5 and parameters: {'loss': 'coxph', 'learning_rate': 0.0014281365630619922, 'n_estimators': 620, 'criterion': 'friedman_mse', 'min_samples_split': 6, 'min_samples_leaf': 2, 'min_weight_fraction_leaf': 0.07659454569134323, 'min_impurity_decrease': 0.434433797053953, 'max_features': 0.6910932668705194, 'subsample': 0.8235422188495476, 'dropout_rate': 0.691671300613867, 'ccp_alpha': 0.33498175078734704}. Best is trial 712 with value: 0.7824105962295036.[0m
[32m[I 2022-04-15 11:18:55,448][0m Trial 783 finished with value: 0.6743624146605087 and parameters: {'loss': 'coxph', 'learning_rate': 0.001208636127274158, 'n_estimators': 579, 'criterion': 'friedman_mse', 'min_samples_split': 6, 'min_samples_leaf': 2, 'min_weight_fraction_leaf': 0.09399176875718757, 'min_impurity_decrease': 0.453808801274783, 'max_features': 0.7371019122942966, 'subsample': 0.7879641707818626, 'dropout_rate': 0.6743594250789954, 'ccp_alpha': 0.16103871157116442}. Best is trial 712 with value: 0.7824105962295036.[0m
[32m[I 2022-04-15 11:20:15,595][0m Trial 784 finished with value: 0.7783964631258783 and parameters: {'loss': 'coxph', 'learning_rate': 0.0016703507890461979, 'n_estimators': 589, 'criterion': 'friedman_mse', 'min_samples_split': 7, 'min_samples_leaf': 2, 'min_weight_fraction_leaf': 0.06974248159409814, 'min_impurity_decrease': 0.4263358205887482, 'max_features': 0.7641759526443876, 'subsample': 0.8056466107956769, 'dropout_rate': 0.6496854183741773, 'ccp_alpha': 0.001210062786537789}. Best is trial 712 with value: 0.7824105962295036.[0m
[32m[I 2022-04-15 11:21:30,232][0m Trial 785 finished with value: 0.5 and parameters: {'loss': 'coxph', 'learning_rate': 0.0011003236003542594, 'n_estimators': 649, 'criterion': 'friedman_mse', 'min_samples_split': 7, 'min_samples_leaf': 2, 'min_weight_fraction_leaf': 0.0825678767682404, 'min_impurity_decrease': 0.4667282931292643, 'max_features': 0.7559921787788647, 'subsample': 0.7565390064874024, 'dropout_rate': 0.6702416718839761, 'ccp_alpha': 0.25182371092005335}. Best is trial 712 with value: 0.7824105962295036.[0m
[32m[I 2022-04-15 11:22:34,145][0m Trial 786 finished with value: 0.7252478827232294 and parameters: {'loss': 'coxph', 'learning_rate': 0.001487033927216466, 'n_estimators': 599, 'criterion': 'friedman_mse', 'min_samples_split': 7, 'min_samples_leaf': 2, 'min_weight_fraction_leaf': 0.07159446666173516, 'min_impurity_decrease': 0.4786956299921829, 'max_features': 0.7133645387271171, 'subsample': 0.7787879765172562, 'dropout_rate': 0.7286043045714808, 'ccp_alpha': 0.10053097294033429}. Best is trial 712 with value: 0.7824105962295036.[0m
[32m[I 2022-04-15 11:23:48,225][0m Trial 787 finished with value: 0.7743760679992743 and parameters: {'loss': 'coxph', 'learning_rate': 0.0014650272049779613, 'n_estimators': 604, 'criterion': 'friedman_mse', 'min_samples_split': 6, 'min_samples_leaf': 2, 'min_weight_fraction_leaf': 0.08647933632982346, 'min_impurity_decrease': 0.4034774818080165, 'max_features': 0.7251888459139917, 'subsample': 0.8094758818224855, 'dropout_rate': 0.6960781330827686, 'ccp_alpha': 0.004343785746133107}. Best is trial 712 with value: 0.7824105962295036.[0m
[32m[I 2022-04-15 11:25:29,613][0m Trial 788 finished with value: 0.5 and parameters: {'loss': 'coxph', 'learning_rate': 0.0019371998895030824, 'n_estimators': 646, 'criterion': 'absolute_error', 'min_samples_split': 6, 'min_samples_leaf': 2, 'min_weight_fraction_leaf': 0.07245738865896395, 'min_impurity_decrease': 0.28753240407845615, 'max_features': 0.7613730650328308, 'subsample': 0.7965130203066828, 'dropout_rate': 0.6474858650694058, 'ccp_alpha': 0.0021193129573570677}. Best is trial 712 with value: 0.7824105962295036.[0m
[32m[I 2022-04-15 11:26:33,284][0m Trial 789 finished with value: 0.6743624146605087 and parameters: {'loss': 'coxph', 'learning_rate': 0.001460735734380143, 'n_estimators': 578, 'criterion': 'friedman_mse', 'min_samples_split': 6, 'min_samples_leaf': 2, 'min_weight_fraction_leaf': 0.05491847540693376, 'min_impurity_decrease': 0.21170641418984742, 'max_features': 0.7409079152069058, 'subsample': 0.7473801476636929, 'dropout_rate': 0.6575844366190343, 'ccp_alpha': 0.16850517496640274}. Best is trial 712 with value: 0.7824105962295036.[0m
[32m[I 2022-04-15 11:27:50,257][0m Trial 790 finished with value: 0.7234917963341548 and parameters: {'loss': 'coxph', 'learning_rate': 0.0012286938781075408, 'n_estimators': 623, 'criterion': 'friedman_mse', 'min_samples_split': 7, 'min_samples_leaf': 2, 'min_weight_fraction_leaf': 0.08146375194322125, 'min_impurity_decrease': 0.24387302300983993, 'max_features': 0.7002244305139216, 'subsample': 0.7717747913021762, 'dropout_rate': 0.606155153756341, 'ccp_alpha': 0.10218721088374846}. Best is trial 712 with value: 0.7824105962295036.[0m
[32m[I 2022-04-15 11:28:53,215][0m Trial 791 finished with value: 0.5 and parameters: {'loss': 'coxph', 'learning_rate': 0.0018749294703857616, 'n_estimators': 568, 'criterion': 'friedman_mse', 'min_samples_split': 8, 'min_samples_leaf': 4, 'min_weight_fraction_leaf': 0.06814434294684873, 'min_impurity_decrease': 0.4277523247811219, 'max_features': 0.759646053764231, 'subsample': 0.8025175527632445, 'dropout_rate': 0.6530606327733839, 'ccp_alpha': 4.904427137069406}. Best is trial 712 with value: 0.7824105962295036.[0m
[32m[I 2022-04-15 11:29:53,987][0m Trial 792 finished with value: 0.5 and parameters: {'loss': 'squared', 'learning_rate': 0.0022907110823904954, 'n_estimators': 687, 'criterion': 'friedman_mse', 'min_samples_split': 6, 'min_samples_leaf': 2, 'min_weight_fraction_leaf': 0.09494360137432412, 'min_impurity_decrease': 0.4523530111283615, 'max_features': 0.7313928689169577, 'subsample': 0.760269864711157, 'dropout_rate': 0.5896786874676411, 'ccp_alpha': 0.44761556390548074}. Best is trial 712 with value: 0.7824105962295036.[0m
[32m[I 2022-04-15 11:30:58,542][0m Trial 793 finished with value: 0.5 and parameters: {'loss': 'coxph', 'learning_rate': 0.001657677200483678, 'n_estimators': 594, 'criterion': 'friedman_mse', 'min_samples_split': 6, 'min_samples_leaf': 2, 'min_weight_fraction_leaf': 0.05907310722014362, 'min_impurity_decrease': 0.40775274740366657, 'max_features': 0.76740182818446, 'subsample': 0.7879045195247495, 'dropout_rate': 0.6877927612975783, 'ccp_alpha': 0.26004681546122976}. Best is trial 712 with value: 0.7824105962295036.[0m
[32m[I 2022-04-15 11:32:06,861][0m Trial 794 finished with value: 0.7201285821977037 and parameters: {'loss': 'coxph', 'learning_rate': 0.0023469485731889388, 'n_estimators': 568, 'criterion': 'friedman_mse', 'min_samples_split': 6, 'min_samples_leaf': 2, 'min_weight_fraction_leaf': 0.07222694782044352, 'min_impurity_decrease': 0.4788133723257713, 'max_features': 0.7446276467272269, 'subsample': 0.8178147094823482, 'dropout_rate': 0.6194205764031238, 'ccp_alpha': 0.10196836133824923}. Best is trial 712 with value: 0.7824105962295036.[0m
[32m[I 2022-04-15 11:33:33,631][0m Trial 795 finished with value: 0.6743624146605087 and parameters: {'loss': 'coxph', 'learning_rate': 0.0011930329489310111, 'n_estimators': 614, 'criterion': 'friedman_mse', 'min_samples_split': 7, 'min_samples_leaf': 2, 'min_weight_fraction_leaf': 0.08070981459043045, 'min_impurity_decrease': 0.38511398915893413, 'max_features': 0.6858569424844524, 'subsample': 0.7416727489085486, 'dropout_rate': 0.5690976300892936, 'ccp_alpha': 0.1828612879335661}. Best is trial 712 with value: 0.7824105962295036.[0m
[32m[I 2022-04-15 11:34:38,457][0m Trial 796 finished with value: 0.7333416604163523 and parameters: {'loss': 'coxph', 'learning_rate': 0.0016386408834001488, 'n_estimators': 556, 'criterion': 'friedman_mse', 'min_samples_split': 6, 'min_samples_leaf': 2, 'min_weight_fraction_leaf': 0.05949223792615053, 'min_impurity_decrease': 0.452285867372399, 'max_features': 0.7215835572824402, 'subsample': 0.7768526158039526, 'dropout_rate': 0.6442678807590712, 'ccp_alpha': 0.0904637510089324}. Best is trial 712 with value: 0.7824105962295036.[0m
[32m[I 2022-04-15 11:35:53,134][0m Trial 797 finished with value: 0.5 and parameters: {'loss': 'coxph', 'learning_rate': 0.002393230574944412, 'n_estimators': 594, 'criterion': 'squared_error', 'min_samples_split': 6, 'min_samples_leaf': 2, 'min_weight_fraction_leaf': 0.10101417810682335, 'min_impurity_decrease': 0.4236153571873105, 'max_features': 0.7543878496546955, 'subsample': 0.8326284696415379, 'dropout_rate': 0.6004599673626789, 'ccp_alpha': 0.24330674272860656}. Best is trial 712 with value: 0.7824105962295036.[0m
[32m[I 2022-04-15 11:37:34,015][0m Trial 798 finished with value: 0.7308901083940931 and parameters: {'loss': 'coxph', 'learning_rate': 0.0019018438850491716, 'n_estimators': 651, 'criterion': 'friedman_mse', 'min_samples_split': 6, 'min_samples_leaf': 4, 'min_weight_fraction_leaf': 0.06850353005523534, 'min_impurity_decrease': 0.44217942522283465, 'max_features': 0.7108531143220009, 'subsample': 0.7906059316491665, 'dropout_rate': 0.5065070943921663, 'ccp_alpha': 0.09243484977004628}. Best is trial 712 with value: 0.7824105962295036.[0m
[32m[I 2022-04-15 11:38:38,150][0m Trial 799 finished with value: 0.6743624146605087 and parameters: {'loss': 'coxph', 'learning_rate': 0.0013084233081948212, 'n_estimators': 581, 'criterion': 'friedman_mse', 'min_samples_split': 6, 'min_samples_leaf': 2, 'min_weight_fraction_leaf': 0.08794829868428373, 'min_impurity_decrease': 0.4851604821432864, 'max_features': 0.7707675415816745, 'subsample': 0.8047765238969197, 'dropout_rate': 0.672441925536795, 'ccp_alpha': 0.16647446916152206}. Best is trial 712 with value: 0.7824105962295036.[0m
[32m[I 2022-04-15 11:39:51,366][0m Trial 800 finished with value: 0.7780156775764334 and parameters: {'loss': 'coxph', 'learning_rate': 0.004385905885907751, 'n_estimators': 554, 'criterion': 'friedman_mse', 'min_samples_split': 6, 'min_samples_leaf': 2, 'min_weight_fraction_leaf': 0.05592752373616348, 'min_impurity_decrease': 0.4622573629090067, 'max_features': 0.7397956228618514, 'subsample': 0.7674384298794468, 'dropout_rate': 0.6226971148689472, 'ccp_alpha': 0.0018119081980432937}. Best is trial 712 with value: 0.7824105962295036.[0m
[32m[I 2022-04-15 11:41:06,691][0m Trial 801 finished with value: 0.7775869208309565 and parameters: {'loss': 'coxph', 'learning_rate': 0.004344720375053564, 'n_estimators': 557, 'criterion': 'friedman_mse', 'min_samples_split': 6, 'min_samples_leaf': 2, 'min_weight_fraction_leaf': 0.05584237385703343, 'min_impurity_decrease': 0.4600548811226177, 'max_features': 0.7358461691155483, 'subsample': 0.7463611317164837, 'dropout_rate': 0.6185414547873421, 'ccp_alpha': 0.0037459126438503685}. Best is trial 712 with value: 0.7824105962295036.[0m
[32m[I 2022-04-15 11:42:20,470][0m Trial 802 finished with value: 0.7776034629242476 and parameters: {'loss': 'coxph', 'learning_rate': 0.003362381503136146, 'n_estimators': 564, 'criterion': 'friedman_mse', 'min_samples_split': 6, 'min_samples_leaf': 2, 'min_weight_fraction_leaf': 0.05857282030155297, 'min_impurity_decrease': 0.4661169255624268, 'max_features': 0.701543700835928, 'subsample': 0.7589151191409712, 'dropout_rate': 0.6307531393035758, 'ccp_alpha': 0.0019242601802620988}. Best is trial 712 with value: 0.7824105962295036.[0m
[32m[I 2022-04-15 11:43:34,250][0m Trial 803 finished with value: 0.6743624146605087 and parameters: {'loss': 'coxph', 'learning_rate': 0.004677771291669831, 'n_estimators': 602, 'criterion': 'friedman_mse', 'min_samples_split': 6, 'min_samples_leaf': 2, 'min_weight_fraction_leaf': 0.05844898049832793, 'min_impurity_decrease': 0.03748155973199163, 'max_features': 0.7161458609696334, 'subsample': 0.7385758453512908, 'dropout_rate': 0.6390869894757766, 'ccp_alpha': 0.17916296996783246}. Best is trial 712 with value: 0.7824105962295036.[0m
[32m[I 2022-04-15 11:44:49,964][0m Trial 804 finished with value: 0.5 and parameters: {'loss': 'coxph', 'learning_rate': 0.004173863622966793, 'n_estimators': 633, 'criterion': 'friedman_mse', 'min_samples_split': 6, 'min_samples_leaf': 2, 'min_weight_fraction_leaf': 0.07618135329491649, 'min_impurity_decrease': 0.4612390711240673, 'max_features': 0.6949170076929858, 'subsample': 0.7482890005236563, 'dropout_rate': 0.6325390838214626, 'ccp_alpha': 0.33223658474892337}. Best is trial 712 with value: 0.7824105962295036.[0m
[32m[I 2022-04-15 11:45:54,744][0m Trial 805 finished with value: 0.7161056672992218 and parameters: {'loss': 'coxph', 'learning_rate': 0.004499921949321339, 'n_estimators': 565, 'criterion': 'friedman_mse', 'min_samples_split': 6, 'min_samples_leaf': 2, 'min_weight_fraction_leaf': 0.05306933397960507, 'min_impurity_decrease': 0.1495172527054488, 'max_features': 0.7128998931698013, 'subsample': 0.760812911032837, 'dropout_rate': 0.651185112668459, 'ccp_alpha': 0.1087250687790887}. Best is trial 712 with value: 0.7824105962295036.[0m
[32m[I 2022-04-15 11:47:11,919][0m Trial 806 finished with value: 0.7253871175452409 and parameters: {'loss': 'coxph', 'learning_rate': 0.0032774806553919505, 'n_estimators': 617, 'criterion': 'friedman_mse', 'min_samples_split': 6, 'min_samples_leaf': 2, 'min_weight_fraction_leaf': 0.06791493799094471, 'min_impurity_decrease': 0.4664647293764812, 'max_features': 0.6820885096628082, 'subsample': 0.7420252762828773, 'dropout_rate': 0.6184660232899387, 'ccp_alpha': 0.09639608809973198}. Best is trial 712 with value: 0.7824105962295036.[0m
[32m[I 2022-04-15 11:48:20,912][0m Trial 807 finished with value: 0.5 and parameters: {'loss': 'coxph', 'learning_rate': 0.004302495869461788, 'n_estimators': 573, 'criterion': 'friedman_mse', 'min_samples_split': 6, 'min_samples_leaf': 2, 'min_weight_fraction_leaf': 0.07718301774457141, 'min_impurity_decrease': 0.44466861773855604, 'max_features': 0.18137404664954726, 'subsample': 0.7303419487041727, 'dropout_rate': 0.6196028895235582, 'ccp_alpha': 0.23817377965504075}. Best is trial 712 with value: 0.7824105962295036.[0m
[32m[I 2022-04-15 11:49:53,111][0m Trial 808 finished with value: 0.5 and parameters: {'loss': 'coxph', 'learning_rate': 0.0035639031704065233, 'n_estimators': 591, 'criterion': 'absolute_error', 'min_samples_split': 6, 'min_samples_leaf': 2, 'min_weight_fraction_leaf': 0.05616844700985557, 'min_impurity_decrease': 0.4846453954475275, 'max_features': 0.6838529870340357, 'subsample': 0.764268141903667, 'dropout_rate': 0.6512583614784968, 'ccp_alpha': 0.09303269245092889}. Best is trial 712 with value: 0.7824105962295036.[0m
[32m[I 2022-04-15 11:51:30,289][0m Trial 809 finished with value: 0.7350974976419339 and parameters: {'loss': 'coxph', 'learning_rate': 0.0030392136940571007, 'n_estimators': 706, 'criterion': 'friedman_mse', 'min_samples_split': 6, 'min_samples_leaf': 2, 'min_weight_fraction_leaf': 0.06704569025945332, 'min_impurity_decrease': 0.4620346495675125, 'max_features': 0.7023060303588853, 'subsample': 0.7660603419035011, 'dropout_rate': 0.6682878762271585, 'ccp_alpha': 0.08781492909959246}. Best is trial 712 with value: 0.7824105962295036.[0m
[32m[I 2022-04-15 11:52:46,868][0m Trial 810 finished with value: 0.7748424720740215 and parameters: {'loss': 'coxph', 'learning_rate': 0.004531273400364924, 'n_estimators': 555, 'criterion': 'friedman_mse', 'min_samples_split': 6, 'min_samples_leaf': 2, 'min_weight_fraction_leaf': 0.08983260605700549, 'min_impurity_decrease': 0.4387529924764035, 'max_features': 0.7298591422847316, 'subsample': 0.7383998157055786, 'dropout_rate': 0.6151937215304702, 'ccp_alpha': 0.005793009354880455}. Best is trial 712 with value: 0.7824105962295036.[0m
[32m[I 2022-04-15 11:53:45,496][0m Trial 811 finished with value: 0.2131591018320901 and parameters: {'loss': 'squared', 'learning_rate': 0.0028299155926810216, 'n_estimators': 619, 'criterion': 'friedman_mse', 'min_samples_split': 8, 'min_samples_leaf': 2, 'min_weight_fraction_leaf': 0.07526952305109384, 'min_impurity_decrease': 0.4752888847810669, 'max_features': 0.732929477295446, 'subsample': 0.762737987034527, 'dropout_rate': 0.6327255744367962, 'ccp_alpha': 0.002310525785068904}. Best is trial 712 with value: 0.7824105962295036.[0m
[32m[I 2022-04-15 11:55:07,919][0m Trial 812 finished with value: 0.6743624146605087 and parameters: {'loss': 'coxph', 'learning_rate': 0.003447046078427034, 'n_estimators': 655, 'criterion': 'friedman_mse', 'min_samples_split': 7, 'min_samples_leaf': 2, 'min_weight_fraction_leaf': 0.05536703851451937, 'min_impurity_decrease': 0.45680949545750754, 'max_features': 0.7061401600201364, 'subsample': 0.7292044371881646, 'dropout_rate': 0.603950787487447, 'ccp_alpha': 0.1832712882938565}. Best is trial 712 with value: 0.7824105962295036.[0m
[32m[I 2022-04-15 11:56:11,523][0m Trial 813 finished with value: 0.5 and parameters: {'loss': 'coxph', 'learning_rate': 0.004500732156530723, 'n_estimators': 583, 'criterion': 'friedman_mse', 'min_samples_split': 6, 'min_samples_leaf': 2, 'min_weight_fraction_leaf': 0.0661899689077049, 'min_impurity_decrease': 0.42773657235240203, 'max_features': 0.7387488923797177, 'subsample': 0.7514310871445837, 'dropout_rate': 0.6881149392435468, 'ccp_alpha': 0.30426086994820034}. Best is trial 712 with value: 0.7824105962295036.[0m
[32m[I 2022-04-15 11:57:15,744][0m Trial 814 finished with value: 0.5 and parameters: {'loss': 'coxph', 'learning_rate': 0.0027371355720468395, 'n_estimators': 559, 'criterion': 'friedman_mse', 'min_samples_split': 6, 'min_samples_leaf': 2, 'min_weight_fraction_leaf': 0.48099008178631847, 'min_impurity_decrease': 0.44541677768635984, 'max_features': 0.7271568293357947, 'subsample': 0.769703279271909, 'dropout_rate': 0.6422097049698924, 'ccp_alpha': 0.16768695959596272}. Best is trial 712 with value: 0.7824105962295036.[0m
