[32m[I 2022-04-15 04:21:15,707][0m Trial 255 finished with value: 0.6743624146605087 and parameters: {'loss': 'coxph', 'learning_rate': 0.09918794846726207, 'n_estimators': 213, 'criterion': 'friedman_mse', 'min_samples_split': 2, 'min_samples_leaf': 6, 'min_weight_fraction_leaf': 0.3020043235544562, 'min_impurity_decrease': 0.9016472282237772, 'max_features': 0.7991606469940334, 'subsample': 0.5976119455862297, 'dropout_rate': 0.06258637040161566, 'ccp_alpha': 0.10789340658625232}. Best is trial 159 with value: 0.7654372273354745.[0m
[32m[I 2022-04-15 04:21:35,833][0m Trial 256 finished with value: 0.5 and parameters: {'loss': 'coxph', 'learning_rate': 0.07813783961927835, 'n_estimators': 201, 'criterion': 'friedman_mse', 'min_samples_split': 2, 'min_samples_leaf': 6, 'min_weight_fraction_leaf': 0.28086053560552, 'min_impurity_decrease': 0.916123641781006, 'max_features': 0.7795981656628448, 'subsample': 0.6452148453465165, 'dropout_rate': 0.12028723468166891, 'ccp_alpha': 0.25733399631402093}. Best is trial 159 with value: 0.7654372273354745.[0m
[32m[I 2022-04-15 04:21:57,626][0m Trial 257 finished with value: 0.7633788841768948 and parameters: {'loss': 'coxph', 'learning_rate': 0.09867972022218473, 'n_estimators': 201, 'criterion': 'friedman_mse', 'min_samples_split': 3, 'min_samples_leaf': 6, 'min_weight_fraction_leaf': 0.2734520748108357, 'min_impurity_decrease': 0.8801561635081601, 'max_features': 0.7633473481037089, 'subsample': 0.6109759649317518, 'dropout_rate': 0.09798881722099809, 'ccp_alpha': 0.0030424098044645417}. Best is trial 159 with value: 0.7654372273354745.[0m
[32m[I 2022-04-15 04:22:18,139][0m Trial 258 finished with value: 0.699934757470517 and parameters: {'loss': 'coxph', 'learning_rate': 0.09962391413693394, 'n_estimators': 192, 'criterion': 'friedman_mse', 'min_samples_split': 3, 'min_samples_leaf': 6, 'min_weight_fraction_leaf': 0.27188689537022304, 'min_impurity_decrease': 0.8812645317902443, 'max_features': 0.772373967167688, 'subsample': 0.6243149968388974, 'dropout_rate': 0.1464103720347283, 'ccp_alpha': 0.08574582939066226}. Best is trial 159 with value: 0.7654372273354745.[0m
[32m[I 2022-04-15 04:22:43,149][0m Trial 259 finished with value: 0.6743624146605087 and parameters: {'loss': 'coxph', 'learning_rate': 0.07803721342500865, 'n_estimators': 225, 'criterion': 'friedman_mse', 'min_samples_split': 3, 'min_samples_leaf': 6, 'min_weight_fraction_leaf': 0.2920157859246301, 'min_impurity_decrease': 0.9413758570897832, 'max_features': 0.8121625019462982, 'subsample': 0.5665782728511894, 'dropout_rate': 0.10511278523127977, 'ccp_alpha': 0.18922982619500106}. Best is trial 159 with value: 0.7654372273354745.[0m
[32m[I 2022-04-15 04:23:02,989][0m Trial 260 finished with value: 0.6841290860061015 and parameters: {'loss': 'coxph', 'learning_rate': 0.06825745074968667, 'n_estimators': 188, 'criterion': 'friedman_mse', 'min_samples_split': 2, 'min_samples_leaf': 6, 'min_weight_fraction_leaf': 0.25975669607088686, 'min_impurity_decrease': 0.8861061558712046, 'max_features': 0.7596208595279119, 'subsample': 0.6197694873744608, 'dropout_rate': 0.07103468143962063, 'ccp_alpha': 0.09144927547265219}. Best is trial 159 with value: 0.7654372273354745.[0m
[32m[I 2022-04-15 04:23:24,683][0m Trial 261 finished with value: 0.763291000189418 and parameters: {'loss': 'coxph', 'learning_rate': 0.08502755898252382, 'n_estimators': 199, 'criterion': 'friedman_mse', 'min_samples_split': 2, 'min_samples_leaf': 6, 'min_weight_fraction_leaf': 0.3004699570636125, 'min_impurity_decrease': 0.9344453793587391, 'max_features': 0.7333179791480461, 'subsample': 0.5863034728597185, 'dropout_rate': 0.09045125215874734, 'ccp_alpha': 0.004133165559240474}. Best is trial 159 with value: 0.7654372273354745.[0m
[32m[I 2022-04-15 04:23:46,533][0m Trial 262 finished with value: 0.7641882111913396 and parameters: {'loss': 'coxph', 'learning_rate': 0.09954707065653119, 'n_estimators': 204, 'criterion': 'friedman_mse', 'min_samples_split': 2, 'min_samples_leaf': 6, 'min_weight_fraction_leaf': 0.305173118433139, 'min_impurity_decrease': 0.9719066656291332, 'max_features': 0.7315025107446406, 'subsample': 0.6076066468013962, 'dropout_rate': 0.09786080588585673, 'ccp_alpha': 0.003930786600587906}. Best is trial 159 with value: 0.7654372273354745.[0m
[32m[I 2022-04-15 04:24:07,437][0m Trial 263 finished with value: 0.5 and parameters: {'loss': 'coxph', 'learning_rate': 0.09574952787069542, 'n_estimators': 204, 'criterion': 'friedman_mse', 'min_samples_split': 2, 'min_samples_leaf': 6, 'min_weight_fraction_leaf': 0.3020123883550041, 'min_impurity_decrease': 0.9935459473258328, 'max_features': 0.7332235387641531, 'subsample': 0.6097349561992598, 'dropout_rate': 0.10227627919175977, 'ccp_alpha': 0.34977767985066177}. Best is trial 159 with value: 0.7654372273354745.[0m
[32m[I 2022-04-15 04:24:29,893][0m Trial 264 finished with value: 0.7620813038222976 and parameters: {'loss': 'coxph', 'learning_rate': 0.08277079691188842, 'n_estimators': 205, 'criterion': 'friedman_mse', 'min_samples_split': 2, 'min_samples_leaf': 6, 'min_weight_fraction_leaf': 0.28313224867098136, 'min_impurity_decrease': 0.9660346931373854, 'max_features': 0.738635868411586, 'subsample': 0.638832654541209, 'dropout_rate': 0.12677239251127043, 'ccp_alpha': 0.002639372701470487}. Best is trial 159 with value: 0.7654372273354745.[0m
[32m[I 2022-04-15 04:24:51,782][0m Trial 265 finished with value: 0.6353792978522599 and parameters: {'loss': 'coxph', 'learning_rate': 0.08282826770217294, 'n_estimators': 203, 'criterion': 'friedman_mse', 'min_samples_split': 2, 'min_samples_leaf': 6, 'min_weight_fraction_leaf': 0.28245884891410833, 'min_impurity_decrease': 0.9703790962057459, 'max_features': 0.7413606656328506, 'subsample': 0.5893529912242825, 'dropout_rate': 0.1170371999646933, 'ccp_alpha': 0.19152937704327647}. Best is trial 159 with value: 0.7654372273354745.[0m
[32m[I 2022-04-15 04:25:19,811][0m Trial 266 finished with value: 0.6743624146605087 and parameters: {'loss': 'coxph', 'learning_rate': 0.09909692681853206, 'n_estimators': 247, 'criterion': 'friedman_mse', 'min_samples_split': 3, 'min_samples_leaf': 6, 'min_weight_fraction_leaf': 0.2740254447661401, 'min_impurity_decrease': 0.9419983802930395, 'max_features': 0.7889744018695052, 'subsample': 0.6512203170918998, 'dropout_rate': 0.1341719909738701, 'ccp_alpha': 0.10573471705395096}. Best is trial 159 with value: 0.7654372273354745.[0m
[32m[I 2022-04-15 04:25:41,658][0m Trial 267 finished with value: 0.5 and parameters: {'loss': 'coxph', 'learning_rate': 0.07651568178776476, 'n_estimators': 218, 'criterion': 'friedman_mse', 'min_samples_split': 2, 'min_samples_leaf': 6, 'min_weight_fraction_leaf': 0.29335944015947846, 'min_impurity_decrease': 0.9271853861890624, 'max_features': 0.8161546241765278, 'subsample': 0.6853988986002033, 'dropout_rate': 0.15972064537950004, 'ccp_alpha': 0.25456150674795675}. Best is trial 159 with value: 0.7654372273354745.[0m
[32m[I 2022-04-15 04:26:07,813][0m Trial 268 finished with value: 0.6743624146605087 and parameters: {'loss': 'coxph', 'learning_rate': 0.09995089137242015, 'n_estimators': 233, 'criterion': 'friedman_mse', 'min_samples_split': 2, 'min_samples_leaf': 6, 'min_weight_fraction_leaf': 0.30846342609091726, 'min_impurity_decrease': 0.9041494946207765, 'max_features': 0.7538152072141475, 'subsample': 0.6338401293176333, 'dropout_rate': 0.09382292919650391, 'ccp_alpha': 0.09100642603702369}. Best is trial 159 with value: 0.7654372273354745.[0m
[32m[I 2022-04-15 04:26:28,845][0m Trial 269 finished with value: 0.7618254722421981 and parameters: {'loss': 'coxph', 'learning_rate': 0.07334362844367014, 'n_estimators': 196, 'criterion': 'friedman_mse', 'min_samples_split': 2, 'min_samples_leaf': 6, 'min_weight_fraction_leaf': 0.28757946486953123, 'min_impurity_decrease': 0.9131361527915955, 'max_features': 0.7206393710799988, 'subsample': 0.6153876390743349, 'dropout_rate': 0.12869675694712304, 'ccp_alpha': 0.004654253044054983}. Best is trial 159 with value: 0.7654372273354745.[0m
[32m[I 2022-04-15 04:26:49,297][0m Trial 270 finished with value: 0.6353792978522599 and parameters: {'loss': 'coxph', 'learning_rate': 0.0666111292122314, 'n_estimators': 198, 'criterion': 'friedman_mse', 'min_samples_split': 2, 'min_samples_leaf': 6, 'min_weight_fraction_leaf': 0.28813578154072594, 'min_impurity_decrease': 0.9986048862111333, 'max_features': 0.7258317075915438, 'subsample': 0.6244029280007753, 'dropout_rate': 0.14166011208792656, 'ccp_alpha': 0.1956036226982676}. Best is trial 159 with value: 0.7654372273354745.[0m
[32m[I 2022-04-15 04:27:12,559][0m Trial 271 finished with value: 0.6860052342205107 and parameters: {'loss': 'coxph', 'learning_rate': 0.0806801297424889, 'n_estimators': 209, 'criterion': 'friedman_mse', 'min_samples_split': 2, 'min_samples_leaf': 6, 'min_weight_fraction_leaf': 0.26676466179532043, 'min_impurity_decrease': 0.9081204614886738, 'max_features': 0.7740671466035781, 'subsample': 0.5934310289131945, 'dropout_rate': 0.1284200938494356, 'ccp_alpha': 0.09579871091469745}. Best is trial 159 with value: 0.7654372273354745.[0m
[32m[I 2022-04-15 04:27:32,009][0m Trial 272 finished with value: 0.763060963010662 and parameters: {'loss': 'coxph', 'learning_rate': 0.06757011772880601, 'n_estimators': 194, 'criterion': 'friedman_mse', 'min_samples_split': 2, 'min_samples_leaf': 6, 'min_weight_fraction_leaf': 0.3012897986790745, 'min_impurity_decrease': 0.9414506541779538, 'max_features': 0.7263867092492683, 'subsample': 0.6074334451247138, 'dropout_rate': 0.11490649323516343, 'ccp_alpha': 0.0012835006632672774}. Best is trial 159 with value: 0.7654372273354745.[0m
[32m[I 2022-04-15 04:27:50,811][0m Trial 273 finished with value: 0.6743624146605087 and parameters: {'loss': 'coxph', 'learning_rate': 0.0785207768023547, 'n_estimators': 191, 'criterion': 'friedman_mse', 'min_samples_split': 2, 'min_samples_leaf': 6, 'min_weight_fraction_leaf': 0.29707705641688315, 'min_impurity_decrease': 0.9327677130112974, 'max_features': 0.7357982129548097, 'subsample': 0.6229138582704214, 'dropout_rate': 0.11692509311975832, 'ccp_alpha': 0.16421094753814003}. Best is trial 159 with value: 0.7654372273354745.[0m
[32m[I 2022-04-15 04:28:10,381][0m Trial 274 finished with value: 0.5 and parameters: {'loss': 'coxph', 'learning_rate': 0.05568777393638478, 'n_estimators': 196, 'criterion': 'friedman_mse', 'min_samples_split': 2, 'min_samples_leaf': 7, 'min_weight_fraction_leaf': 0.30539166673678403, 'min_impurity_decrease': 0.9486007262414518, 'max_features': 0.7630601904157794, 'subsample': 0.6020998233768516, 'dropout_rate': 0.17180214998299548, 'ccp_alpha': 0.4114723043130798}. Best is trial 159 with value: 0.7654372273354745.[0m
[32m[I 2022-04-15 04:28:27,002][0m Trial 275 finished with value: 0.5 and parameters: {'loss': 'coxph', 'learning_rate': 0.07043364109756385, 'n_estimators': 184, 'criterion': 'squared_error', 'min_samples_split': 2, 'min_samples_leaf': 6, 'min_weight_fraction_leaf': 0.2541336195808103, 'min_impurity_decrease': 0.9739240767651915, 'max_features': 0.7143780132550345, 'subsample': 0.5775608338807758, 'dropout_rate': 0.1506106420478694, 'ccp_alpha': 0.005333369590415492}. Best is trial 159 with value: 0.7654372273354745.[0m
[32m[I 2022-04-15 04:28:48,961][0m Trial 276 finished with value: 0.5 and parameters: {'loss': 'coxph', 'learning_rate': 0.08436477890172425, 'n_estimators': 209, 'criterion': 'friedman_mse', 'min_samples_split': 2, 'min_samples_leaf': 6, 'min_weight_fraction_leaf': 0.2812889703712658, 'min_impurity_decrease': 0.9236882000963754, 'max_features': 0.7247696991086215, 'subsample': 0.6449929233742039, 'dropout_rate': 0.10644697156507617, 'ccp_alpha': 0.2912807740806046}. Best is trial 159 with value: 0.7654372273354745.[0m
[32m[I 2022-04-15 04:29:11,620][0m Trial 277 finished with value: 0.6743624146605087 and parameters: {'loss': 'coxph', 'learning_rate': 0.09811495777217674, 'n_estimators': 201, 'criterion': 'friedman_mse', 'min_samples_split': 2, 'min_samples_leaf': 6, 'min_weight_fraction_leaf': 0.2897943137822477, 'min_impurity_decrease': 0.9014721007977189, 'max_features': 0.7491084036106583, 'subsample': 0.6064109417928677, 'dropout_rate': 0.07248815990208038, 'ccp_alpha': 0.10233155590686553}. Best is trial 159 with value: 0.7654372273354745.[0m
[32m[I 2022-04-15 04:29:29,132][0m Trial 278 finished with value: 0.6743624146605087 and parameters: {'loss': 'coxph', 'learning_rate': 0.054145028073664, 'n_estimators': 183, 'criterion': 'friedman_mse', 'min_samples_split': 2, 'min_samples_leaf': 6, 'min_weight_fraction_leaf': 0.27473727916648727, 'min_impurity_decrease': 0.8772733286514108, 'max_features': 0.7168703688289579, 'subsample': 0.5771948997374625, 'dropout_rate': 0.1195869133614031, 'ccp_alpha': 0.19145029343213701}. Best is trial 159 with value: 0.7654372273354745.[0m
[32m[I 2022-04-15 04:29:51,835][0m Trial 279 finished with value: 0.7611404145309277 and parameters: {'loss': 'coxph', 'learning_rate': 0.06887096002684392, 'n_estimators': 217, 'criterion': 'friedman_mse', 'min_samples_split': 2, 'min_samples_leaf': 7, 'min_weight_fraction_leaf': 0.309136555852451, 'min_impurity_decrease': 0.9423995214386484, 'max_features': 0.7612793621059578, 'subsample': 0.560311207081329, 'dropout_rate': 0.09499188940329562, 'ccp_alpha': 0.00110948318415891}. Best is trial 159 with value: 0.7654372273354745.[0m
[32m[I 2022-04-15 04:30:14,670][0m Trial 280 finished with value: 0.6743624146605087 and parameters: {'loss': 'coxph', 'learning_rate': 0.09988960442263241, 'n_estimators': 217, 'criterion': 'friedman_mse', 'min_samples_split': 3, 'min_samples_leaf': 7, 'min_weight_fraction_leaf': 0.30775950749827924, 'min_impurity_decrease': 0.9487889813394798, 'max_features': 0.7653174075363287, 'subsample': 0.6724507037775982, 'dropout_rate': 0.07953431538738094, 'ccp_alpha': 0.09014200579997232}. Best is trial 159 with value: 0.7654372273354745.[0m
[32m[I 2022-04-15 04:30:37,069][0m Trial 281 finished with value: 0.7624229575035568 and parameters: {'loss': 'coxph', 'learning_rate': 0.06692600642427457, 'n_estimators': 203, 'criterion': 'friedman_mse', 'min_samples_split': 2, 'min_samples_leaf': 7, 'min_weight_fraction_leaf': 0.2975663209145063, 'min_impurity_decrease': 0.9760412192593648, 'max_features': 0.7435855154299887, 'subsample': 0.5543189138100911, 'dropout_rate': 0.065551305130266, 'ccp_alpha': 0.002210540902452842}. Best is trial 159 with value: 0.7654372273354745.[0m
[32m[I 2022-04-15 04:31:03,790][0m Trial 282 finished with value: 0.5 and parameters: {'loss': 'coxph', 'learning_rate': 0.07735541644327179, 'n_estimators': 233, 'criterion': 'friedman_mse', 'min_samples_split': 2, 'min_samples_leaf': 7, 'min_weight_fraction_leaf': 0.3025391284096746, 'min_impurity_decrease': 0.9759272871911235, 'max_features': 0.7812285587409348, 'subsample': 0.560768252044933, 'dropout_rate': 0.06366905929018363, 'ccp_alpha': 0.2861139874158022}. Best is trial 159 with value: 0.7654372273354745.[0m
[32m[I 2022-04-15 04:31:27,245][0m Trial 283 finished with value: 0.6743624146605087 and parameters: {'loss': 'coxph', 'learning_rate': 0.05199444783578966, 'n_estimators': 214, 'criterion': 'friedman_mse', 'min_samples_split': 2, 'min_samples_leaf': 7, 'min_weight_fraction_leaf': 0.3134299235502128, 'min_impurity_decrease': 0.9616342469920734, 'max_features': 0.7407057329705831, 'subsample': 0.6340237503093867, 'dropout_rate': 0.12958098887207178, 'ccp_alpha': 0.1578943563528358}. Best is trial 159 with value: 0.7654372273354745.[0m
[32m[I 2022-04-15 04:31:47,631][0m Trial 284 finished with value: 0.6743624146605087 and parameters: {'loss': 'coxph', 'learning_rate': 0.08016286970802407, 'n_estimators': 195, 'criterion': 'friedman_mse', 'min_samples_split': 2, 'min_samples_leaf': 7, 'min_weight_fraction_leaf': 0.26457120009853363, 'min_impurity_decrease': 0.9170361776700878, 'max_features': 0.7446685311157106, 'subsample': 0.5953436775067034, 'dropout_rate': 0.061688926505416436, 'ccp_alpha': 0.10988115213288345}. Best is trial 159 with value: 0.7654372273354745.[0m
[32m[I 2022-04-15 04:32:10,257][0m Trial 285 finished with value: 0.5301157883717103 and parameters: {'loss': 'coxph', 'learning_rate': 0.06615605673609402, 'n_estimators': 206, 'criterion': 'friedman_mse', 'min_samples_split': 2, 'min_samples_leaf': 7, 'min_weight_fraction_leaf': 0.28285603978760177, 'min_impurity_decrease': 0.9992200526175676, 'max_features': 0.7255767702828999, 'subsample': 0.555985972492871, 'dropout_rate': 0.09692713984944935, 'ccp_alpha': 0.21010993153644844}. Best is trial 159 with value: 0.7654372273354745.[0m
[32m[I 2022-04-15 04:32:29,211][0m Trial 286 finished with value: 0.6743624146605087 and parameters: {'loss': 'coxph', 'learning_rate': 0.05213409594341595, 'n_estimators': 189, 'criterion': 'friedman_mse', 'min_samples_split': 2, 'min_samples_leaf': 6, 'min_weight_fraction_leaf': 0.30174594495925433, 'min_impurity_decrease': 0.8921443671300939, 'max_features': 0.8164723851615292, 'subsample': 0.6138391032000208, 'dropout_rate': 0.0863064956094849, 'ccp_alpha': 0.09814266958961579}. Best is trial 159 with value: 0.7654372273354745.[0m
[32m[I 2022-04-15 04:32:50,419][0m Trial 287 finished with value: 0.7611197171299364 and parameters: {'loss': 'coxph', 'learning_rate': 0.09959424854412136, 'n_estimators': 200, 'criterion': 'friedman_mse', 'min_samples_split': 2, 'min_samples_leaf': 6, 'min_weight_fraction_leaf': 0.29559426853887155, 'min_impurity_decrease': 0.9265801468526905, 'max_features': 0.7082757689101897, 'subsample': 0.5853364716985936, 'dropout_rate': 0.14265792308330916, 'ccp_alpha': 0.010210569620434524}. Best is trial 159 with value: 0.7654372273354745.[0m
[32m[I 2022-04-15 04:33:14,624][0m Trial 288 finished with value: 0.6743624146605087 and parameters: {'loss': 'coxph', 'learning_rate': 0.09910303752468928, 'n_estimators': 223, 'criterion': 'friedman_mse', 'min_samples_split': 2, 'min_samples_leaf': 6, 'min_weight_fraction_leaf': 0.29577130916489214, 'min_impurity_decrease': 0.9619868079640616, 'max_features': 0.7644705332588414, 'subsample': 0.5506580087352226, 'dropout_rate': 0.14672176127157127, 'ccp_alpha': 0.10643595227191133}. Best is trial 159 with value: 0.7654372273354745.[0m
[32m[I 2022-04-15 04:33:37,954][0m Trial 289 finished with value: 0.5 and parameters: {'loss': 'coxph', 'learning_rate': 0.08212506645670638, 'n_estimators': 214, 'criterion': 'friedman_mse', 'min_samples_split': 3, 'min_samples_leaf': 6, 'min_weight_fraction_leaf': 0.30888098888620763, 'min_impurity_decrease': 0.9316734568207083, 'max_features': 0.7113277560910806, 'subsample': 0.5873675684285439, 'dropout_rate': 0.12931604098377675, 'ccp_alpha': 1.1042942894000094}. Best is trial 159 with value: 0.7654372273354745.[0m
[32m[I 2022-04-15 04:33:58,555][0m Trial 290 finished with value: 0.761298056632804 and parameters: {'loss': 'coxph', 'learning_rate': 0.05286562506678684, 'n_estimators': 202, 'criterion': 'friedman_mse', 'min_samples_split': 2, 'min_samples_leaf': 7, 'min_weight_fraction_leaf': 0.2883324124567208, 'min_impurity_decrease': 0.9454228391643792, 'max_features': 0.7358050411251922, 'subsample': 0.6376920322179189, 'dropout_rate': 0.17988599750190873, 'ccp_alpha': 0.003187952192740791}. Best is trial 159 with value: 0.7654372273354745.[0m
[32m[I 2022-04-15 04:34:18,807][0m Trial 291 finished with value: 0.7617352605941738 and parameters: {'loss': 'coxph', 'learning_rate': 0.09974890672732889, 'n_estimators': 202, 'criterion': 'friedman_mse', 'min_samples_split': 2, 'min_samples_leaf': 7, 'min_weight_fraction_leaf': 0.2964010914768882, 'min_impurity_decrease': 0.9818569009440732, 'max_features': 0.747358563685194, 'subsample': 0.6574349857039083, 'dropout_rate': 0.1860956650599323, 'ccp_alpha': 0.0037851154589783748}. Best is trial 159 with value: 0.7654372273354745.[0m
[32m[I 2022-04-15 04:34:37,188][0m Trial 292 finished with value: 0.5301157883717103 and parameters: {'loss': 'coxph', 'learning_rate': 0.06284869801375759, 'n_estimators': 192, 'criterion': 'friedman_mse', 'min_samples_split': 2, 'min_samples_leaf': 7, 'min_weight_fraction_leaf': 0.3149836359117407, 'min_impurity_decrease': 0.9770807669298991, 'max_features': 0.7550971670742885, 'subsample': 0.6607255630745595, 'dropout_rate': 0.1911197951834736, 'ccp_alpha': 0.21239204855425733}. Best is trial 159 with value: 0.7654372273354745.[0m
[32m[I 2022-04-15 04:34:57,196][0m Trial 293 finished with value: 0.5 and parameters: {'loss': 'coxph', 'learning_rate': 0.0780825737439711, 'n_estimators': 202, 'criterion': 'friedman_mse', 'min_samples_split': 2, 'min_samples_leaf': 7, 'min_weight_fraction_leaf': 0.28963588258427586, 'min_impurity_decrease': 0.9819637877165476, 'max_features': 0.7805806548459795, 'subsample': 0.6478361176125039, 'dropout_rate': 0.1900667133663286, 'ccp_alpha': 0.35751204641525164}. Best is trial 159 with value: 0.7654372273354745.[0m
[32m[I 2022-04-15 04:35:19,505][0m Trial 294 finished with value: 0.7625156384524558 and parameters: {'loss': 'coxph', 'learning_rate': 0.054431916100620634, 'n_estimators': 207, 'criterion': 'friedman_mse', 'min_samples_split': 2, 'min_samples_leaf': 7, 'min_weight_fraction_leaf': 0.2859379465387347, 'min_impurity_decrease': 0.9590424815323513, 'max_features': 0.7285158815053477, 'subsample': 0.6891883456480187, 'dropout_rate': 0.11281322480033397, 'ccp_alpha': 0.0028294292693192115}. Best is trial 159 with value: 0.7654372273354745.[0m
