[32m[I 2022-04-13 19:31:01,553][0m Trial 249 finished with value: 0.25 and parameters: {'loss': 'coxph', 'learning_rate': 0.0001725768599092569, 'n_estimators': 355, 'criterion': 'absolute_error', 'min_samples_split': 4, 'min_samples_leaf': 7, 'min_weight_fraction_leaf': 0.10418767227665698, 'min_impurity_decrease': 0.19436108313816486, 'max_features': 0.4886412008423701, 'subsample': 0.5960744591361822, 'dropout_rate': 0.28759536580187917, 'ccp_alpha': 1.472764867551923}. Best is trial 138 with value: 0.731155530669601.[0m
[32m[I 2022-04-13 19:31:35,659][0m Trial 250 finished with value: 0.25 and parameters: {'loss': 'coxph', 'learning_rate': 0.0002726574479257396, 'n_estimators': 319, 'criterion': 'absolute_error', 'min_samples_split': 4, 'min_samples_leaf': 9, 'min_weight_fraction_leaf': 0.41999789474763394, 'min_impurity_decrease': 0.21098994978060195, 'max_features': 0.4683014033757197, 'subsample': 0.6611488902238769, 'dropout_rate': 0.996633187096195, 'ccp_alpha': 2.068647260692362}. Best is trial 138 with value: 0.731155530669601.[0m
[32m[I 2022-04-13 19:32:33,620][0m Trial 251 finished with value: 0.25 and parameters: {'loss': 'coxph', 'learning_rate': 0.0003510199794964735, 'n_estimators': 310, 'criterion': 'absolute_error', 'min_samples_split': 7, 'min_samples_leaf': 7, 'min_weight_fraction_leaf': 0.4042615182106138, 'min_impurity_decrease': 0.22647466598970165, 'max_features': 0.5344573583748956, 'subsample': 0.6687581700825524, 'dropout_rate': 0.34135503973058345, 'ccp_alpha': 1.876113827424517}. Best is trial 138 with value: 0.731155530669601.[0m
[32m[I 2022-04-13 19:33:34,096][0m Trial 252 finished with value: 0.25 and parameters: {'loss': 'coxph', 'learning_rate': 0.0009097491996014188, 'n_estimators': 299, 'criterion': 'absolute_error', 'min_samples_split': 7, 'min_samples_leaf': 7, 'min_weight_fraction_leaf': 0.4219672804562119, 'min_impurity_decrease': 0.22892759788027495, 'max_features': 0.5632604837515975, 'subsample': 0.020587412745397132, 'dropout_rate': 0.32215977822122904, 'ccp_alpha': 1.7559112762293054}. Best is trial 138 with value: 0.731155530669601.[0m
[32m[I 2022-04-13 19:34:03,991][0m Trial 253 finished with value: 0.25 and parameters: {'loss': 'coxph', 'learning_rate': 0.0031437236900714203, 'n_estimators': 272, 'criterion': 'absolute_error', 'min_samples_split': 7, 'min_samples_leaf': 6, 'min_weight_fraction_leaf': 0.4516834608519668, 'min_impurity_decrease': 0.17910095661217473, 'max_features': 0.5728940061069498, 'subsample': 0.6083400784440647, 'dropout_rate': 0.9677782275498574, 'ccp_alpha': 1.5585264583102914}. Best is trial 138 with value: 0.731155530669601.[0m
[32m[I 2022-04-13 19:34:36,882][0m Trial 254 finished with value: 0.25 and parameters: {'loss': 'coxph', 'learning_rate': 0.004578594645126794, 'n_estimators': 286, 'criterion': 'absolute_error', 'min_samples_split': 7, 'min_samples_leaf': 4, 'min_weight_fraction_leaf': 0.46068470909144416, 'min_impurity_decrease': 0.16735402858765436, 'max_features': 0.5012486498365556, 'subsample': 0.5763599947125839, 'dropout_rate': 0.8447107443254795, 'ccp_alpha': 1.9528471278370514}. Best is trial 138 with value: 0.731155530669601.[0m
[32m[I 2022-04-13 19:35:20,751][0m Trial 255 finished with value: 0.25 and parameters: {'loss': 'coxph', 'learning_rate': 0.0004843901526777968, 'n_estimators': 285, 'criterion': 'absolute_error', 'min_samples_split': 7, 'min_samples_leaf': 4, 'min_weight_fraction_leaf': 0.4068761380568655, 'min_impurity_decrease': 0.12845759127939121, 'max_features': 0.4821422354507644, 'subsample': 0.6566457660195097, 'dropout_rate': 0.3610647780776477, 'ccp_alpha': 1.7299702562393335}. Best is trial 138 with value: 0.731155530669601.[0m
[32m[I 2022-04-13 19:36:08,344][0m Trial 256 finished with value: 0.25 and parameters: {'loss': 'coxph', 'learning_rate': 0.006907323014801379, 'n_estimators': 279, 'criterion': 'absolute_error', 'min_samples_split': 7, 'min_samples_leaf': 4, 'min_weight_fraction_leaf': 0.403813004394473, 'min_impurity_decrease': 0.10701859119417938, 'max_features': 0.4410190086845131, 'subsample': 0.1125599382527732, 'dropout_rate': 0.35181568610127933, 'ccp_alpha': 4.636811890378149}. Best is trial 138 with value: 0.731155530669601.[0m
[32m[I 2022-04-13 19:36:53,846][0m Trial 257 finished with value: 0.25 and parameters: {'loss': 'coxph', 'learning_rate': 0.00032050757018558087, 'n_estimators': 267, 'criterion': 'absolute_error', 'min_samples_split': 7, 'min_samples_leaf': 6, 'min_weight_fraction_leaf': 0.43854403047371054, 'min_impurity_decrease': 0.1259807585808319, 'max_features': 0.4690028651903149, 'subsample': 0.1710553575977676, 'dropout_rate': 0.3354335853585729, 'ccp_alpha': 4.524522343498472}. Best is trial 138 with value: 0.731155530669601.[0m
[32m[I 2022-04-13 19:37:30,850][0m Trial 258 finished with value: 0.25 and parameters: {'loss': 'coxph', 'learning_rate': 0.008708008549293902, 'n_estimators': 245, 'criterion': 'absolute_error', 'min_samples_split': 7, 'min_samples_leaf': 5, 'min_weight_fraction_leaf': 0.4118496193339626, 'min_impurity_decrease': 0.14261512165355605, 'max_features': 0.45478635918435456, 'subsample': 0.6842266442065944, 'dropout_rate': 0.4541916379010494, 'ccp_alpha': 4.761328418729036}. Best is trial 138 with value: 0.731155530669601.[0m
[32m[I 2022-04-13 19:38:20,208][0m Trial 259 finished with value: 0.25 and parameters: {'loss': 'coxph', 'learning_rate': 0.010008297773089, 'n_estimators': 277, 'criterion': 'absolute_error', 'min_samples_split': 2, 'min_samples_leaf': 6, 'min_weight_fraction_leaf': 0.42871008310952213, 'min_impurity_decrease': 0.7018152667311729, 'max_features': 0.4322878879885825, 'subsample': 0.18090750216050486, 'dropout_rate': 0.3968389449715437, 'ccp_alpha': 1.296492355292767}. Best is trial 138 with value: 0.731155530669601.[0m
[32m[I 2022-04-13 19:38:53,801][0m Trial 260 finished with value: 0.25 and parameters: {'loss': 'coxph', 'learning_rate': 0.005596669661262107, 'n_estimators': 220, 'criterion': 'absolute_error', 'min_samples_split': 2, 'min_samples_leaf': 4, 'min_weight_fraction_leaf': 0.019971981054366095, 'min_impurity_decrease': 0.8072178711810747, 'max_features': 0.4131288705181077, 'subsample': 0.7467168434750052, 'dropout_rate': 0.4201690336004576, 'ccp_alpha': 4.597232968076782}. Best is trial 138 with value: 0.731155530669601.[0m
[32m[I 2022-04-13 19:39:45,877][0m Trial 261 finished with value: 0.25 and parameters: {'loss': 'coxph', 'learning_rate': 3.019510102580404e-06, 'n_estimators': 310, 'criterion': 'absolute_error', 'min_samples_split': 7, 'min_samples_leaf': 4, 'min_weight_fraction_leaf': 0.4452050389465355, 'min_impurity_decrease': 0.15998659146612787, 'max_features': 0.38047658500742465, 'subsample': 0.19593262946523282, 'dropout_rate': 0.4067762152082941, 'ccp_alpha': 4.254065102543612}. Best is trial 138 with value: 0.731155530669601.[0m
[32m[I 2022-04-13 19:40:21,709][0m Trial 262 finished with value: 0.25 and parameters: {'loss': 'coxph', 'learning_rate': 2.3060249141747425e-06, 'n_estimators': 209, 'criterion': 'absolute_error', 'min_samples_split': 6, 'min_samples_leaf': 4, 'min_weight_fraction_leaf': 0.012231469312645267, 'min_impurity_decrease': 0.6915935993621167, 'max_features': 0.3681466676324021, 'subsample': 0.055697177809331415, 'dropout_rate': 0.38232018501122705, 'ccp_alpha': 4.49748700614393}. Best is trial 138 with value: 0.731155530669601.[0m
[32m[I 2022-04-13 19:40:29,857][0m Trial 263 finished with value: -0.25 and parameters: {'loss': 'squared', 'learning_rate': 0.0002133579525177921, 'n_estimators': 199, 'criterion': 'absolute_error', 'min_samples_split': 6, 'min_samples_leaf': 5, 'min_weight_fraction_leaf': 0.4664684904917322, 'min_impurity_decrease': 0.7114543100242221, 'max_features': 0.08399767049161236, 'subsample': 0.07383932531996042, 'dropout_rate': 0.4502425302805746, 'ccp_alpha': 4.711472765811238}. Best is trial 138 with value: 0.731155530669601.[0m
[32m[I 2022-04-13 19:42:02,326][0m Trial 264 finished with value: 0.25 and parameters: {'loss': 'coxph', 'learning_rate': 0.0014295885632312048, 'n_estimators': 404, 'criterion': 'absolute_error', 'min_samples_split': 4, 'min_samples_leaf': 8, 'min_weight_fraction_leaf': 0.09286153790211923, 'min_impurity_decrease': 0.09327199680650822, 'max_features': 0.5187136813331911, 'subsample': 0.5443124396464964, 'dropout_rate': 0.21160959936199228, 'ccp_alpha': 2.1404243623214922}. Best is trial 138 with value: 0.731155530669601.[0m
[32m[I 2022-04-13 19:42:42,584][0m Trial 265 finished with value: 0.25 and parameters: {'loss': 'coxph', 'learning_rate': 2.781974519524921e-06, 'n_estimators': 252, 'criterion': 'friedman_mse', 'min_samples_split': 6, 'min_samples_leaf': 6, 'min_weight_fraction_leaf': 0.009944432204344378, 'min_impurity_decrease': 0.7533897270172766, 'max_features': 0.11871362551473583, 'subsample': 0.10108014152312034, 'dropout_rate': 0.37777234943645416, 'ccp_alpha': 4.087171003493324}. Best is trial 138 with value: 0.731155530669601.[0m
[32m[I 2022-04-13 19:43:19,095][0m Trial 266 finished with value: 0.25 and parameters: {'loss': 'coxph', 'learning_rate': 1.7187117438626657e-06, 'n_estimators': 241, 'criterion': 'friedman_mse', 'min_samples_split': 6, 'min_samples_leaf': 6, 'min_weight_fraction_leaf': 0.00307309867355541, 'min_impurity_decrease': 0.6651199390026145, 'max_features': 0.06786461384092154, 'subsample': 0.1666275198772547, 'dropout_rate': 0.40729592525412694, 'ccp_alpha': 4.630989002850577}. Best is trial 138 with value: 0.731155530669601.[0m
[32m[I 2022-04-13 19:44:04,535][0m Trial 267 finished with value: 0.25 and parameters: {'loss': 'coxph', 'learning_rate': 1.2121769376037616e-06, 'n_estimators': 256, 'criterion': 'friedman_mse', 'min_samples_split': 6, 'min_samples_leaf': 6, 'min_weight_fraction_leaf': 0.037459174252495675, 'min_impurity_decrease': 0.7416173650484995, 'max_features': 0.09640866599436443, 'subsample': 0.0988977633745464, 'dropout_rate': 0.3058710588642848, 'ccp_alpha': 4.159173319397261}. Best is trial 138 with value: 0.731155530669601.[0m
[32m[I 2022-04-13 19:44:29,183][0m Trial 268 finished with value: 0.25 and parameters: {'loss': 'coxph', 'learning_rate': 1.3506465887326181e-06, 'n_estimators': 225, 'criterion': 'friedman_mse', 'min_samples_split': 6, 'min_samples_leaf': 6, 'min_weight_fraction_leaf': 0.024446284692845478, 'min_impurity_decrease': 0.7888216744576413, 'max_features': 0.09343472756666871, 'subsample': 0.7382205390263128, 'dropout_rate': 0.3630464928309108, 'ccp_alpha': 4.090428430232306}. Best is trial 138 with value: 0.731155530669601.[0m
[32m[I 2022-04-13 19:45:03,934][0m Trial 269 finished with value: 0.25 and parameters: {'loss': 'coxph', 'learning_rate': 3.1273036116122405e-05, 'n_estimators': 229, 'criterion': 'friedman_mse', 'min_samples_split': 6, 'min_samples_leaf': 6, 'min_weight_fraction_leaf': 0.36377651091985175, 'min_impurity_decrease': 0.7789143469422037, 'max_features': 0.12061305186456492, 'subsample': 0.1425935206767031, 'dropout_rate': 0.4435115861381659, 'ccp_alpha': 4.821851310077996}. Best is trial 138 with value: 0.731155530669601.[0m
[32m[I 2022-04-13 19:45:41,679][0m Trial 270 finished with value: 0.25 and parameters: {'loss': 'coxph', 'learning_rate': 3.107209566310927e-06, 'n_estimators': 235, 'criterion': 'friedman_mse', 'min_samples_split': 6, 'min_samples_leaf': 6, 'min_weight_fraction_leaf': 0.4172991159239916, 'min_impurity_decrease': 0.8514395549669863, 'max_features': 0.405799806975177, 'subsample': 0.20136361439251996, 'dropout_rate': 0.4358058600742692, 'ccp_alpha': 4.887902571096801}. Best is trial 138 with value: 0.731155530669601.[0m
[32m[I 2022-04-13 19:46:09,579][0m Trial 271 finished with value: 0.25 and parameters: {'loss': 'coxph', 'learning_rate': 3.9364496626114796e-05, 'n_estimators': 218, 'criterion': 'friedman_mse', 'min_samples_split': 8, 'min_samples_leaf': 4, 'min_weight_fraction_leaf': 0.0011216399694731689, 'min_impurity_decrease': 0.7590586587030334, 'max_features': 0.7850125974349529, 'subsample': 0.756859784972039, 'dropout_rate': 0.5555615034481058, 'ccp_alpha': 3.8506187465651043}. Best is trial 138 with value: 0.731155530669601.[0m
[32m[I 2022-04-13 19:46:49,946][0m Trial 272 finished with value: 0.25 and parameters: {'loss': 'coxph', 'learning_rate': 2.2957095385200983e-05, 'n_estimators': 243, 'criterion': 'friedman_mse', 'min_samples_split': 8, 'min_samples_leaf': 3, 'min_weight_fraction_leaf': 0.012270097451098895, 'min_impurity_decrease': 0.7379381640694421, 'max_features': 0.4305022879184622, 'subsample': 0.7069232821314874, 'dropout_rate': 0.37717192508729225, 'ccp_alpha': 3.9659267374119893}. Best is trial 138 with value: 0.731155530669601.[0m
[32m[I 2022-04-13 19:47:17,890][0m Trial 273 finished with value: 0.25 and parameters: {'loss': 'coxph', 'learning_rate': 2.5271119640141563e-05, 'n_estimators': 202, 'criterion': 'friedman_mse', 'min_samples_split': 8, 'min_samples_leaf': 3, 'min_weight_fraction_leaf': 0.3841298480534087, 'min_impurity_decrease': 0.9830734925110483, 'max_features': 0.7624552016071056, 'subsample': 0.22331503242412007, 'dropout_rate': 0.710235174580424, 'ccp_alpha': 4.859933367545065}. Best is trial 138 with value: 0.731155530669601.[0m
[32m[I 2022-04-13 19:50:47,901][0m Trial 274 finished with value: 0.25 and parameters: {'loss': 'coxph', 'learning_rate': 4.6838459273047254e-05, 'n_estimators': 986, 'criterion': 'friedman_mse', 'min_samples_split': 8, 'min_samples_leaf': 3, 'min_weight_fraction_leaf': 0.4328856077913945, 'min_impurity_decrease': 0.9738124843226654, 'max_features': 0.7434304016892539, 'subsample': 0.7277507021944846, 'dropout_rate': 0.6308935714065326, 'ccp_alpha': 4.971504297803022}. Best is trial 138 with value: 0.731155530669601.[0m
[32m[I 2022-04-13 19:51:17,701][0m Trial 275 finished with value: 0.25 and parameters: {'loss': 'coxph', 'learning_rate': 3.252278681426557e-05, 'n_estimators': 192, 'criterion': 'friedman_mse', 'min_samples_split': 8, 'min_samples_leaf': 3, 'min_weight_fraction_leaf': 0.01836995315037917, 'min_impurity_decrease': 0.7736452279668915, 'max_features': 0.7170464772144585, 'subsample': 0.12386479811455209, 'dropout_rate': 0.5598176907173011, 'ccp_alpha': 4.427512079092166}. Best is trial 138 with value: 0.731155530669601.[0m
[32m[I 2022-04-13 19:51:46,387][0m Trial 276 finished with value: 0.25 and parameters: {'loss': 'coxph', 'learning_rate': 3.75657330466907e-05, 'n_estimators': 231, 'criterion': 'friedman_mse', 'min_samples_split': 8, 'min_samples_leaf': 3, 'min_weight_fraction_leaf': 0.439518290508112, 'min_impurity_decrease': 0.7143794795205801, 'max_features': 0.7730572883802018, 'subsample': 0.6436283217962963, 'dropout_rate': 0.5906296859429265, 'ccp_alpha': 4.344525082828153}. Best is trial 138 with value: 0.731155530669601.[0m
[32m[I 2022-04-13 19:55:50,203][0m Trial 277 finished with value: 0.25 and parameters: {'loss': 'coxph', 'learning_rate': 2.7296786455570058e-05, 'n_estimators': 963, 'criterion': 'friedman_mse', 'min_samples_split': 8, 'min_samples_leaf': 4, 'min_weight_fraction_leaf': 0.3967149716191656, 'min_impurity_decrease': 0.3743966476078568, 'max_features': 0.7544787247612438, 'subsample': 0.2484513841297218, 'dropout_rate': 0.6258690311183056, 'ccp_alpha': 4.768224286473918}. Best is trial 138 with value: 0.731155530669601.[0m
[32m[I 2022-04-13 19:59:07,215][0m Trial 278 finished with value: 0.25 and parameters: {'loss': 'coxph', 'learning_rate': 2.234200086729529e-06, 'n_estimators': 883, 'criterion': 'friedman_mse', 'min_samples_split': 8, 'min_samples_leaf': 3, 'min_weight_fraction_leaf': 0.4305123887484679, 'min_impurity_decrease': 0.6978153004599246, 'max_features': 0.7404220824729717, 'subsample': 0.20973494682419674, 'dropout_rate': 0.6443586286029753, 'ccp_alpha': 4.759065850819412}. Best is trial 138 with value: 0.731155530669601.[0m
[32m[I 2022-04-13 19:59:49,291][0m Trial 279 finished with value: 0.25 and parameters: {'loss': 'coxph', 'learning_rate': 2.628973258735903e-06, 'n_estimators': 290, 'criterion': 'absolute_error', 'min_samples_split': 7, 'min_samples_leaf': 4, 'min_weight_fraction_leaf': 0.42496518582378234, 'min_impurity_decrease': 0.6962069363571587, 'max_features': 0.340355329558734, 'subsample': 0.7934578754784908, 'dropout_rate': 0.4105636453999092, 'ccp_alpha': 4.491037987879565}. Best is trial 138 with value: 0.731155530669601.[0m
[32m[I 2022-04-13 20:00:38,997][0m Trial 280 finished with value: 0.25 and parameters: {'loss': 'coxph', 'learning_rate': 0.0002759294458857481, 'n_estimators': 293, 'criterion': 'absolute_error', 'min_samples_split': 7, 'min_samples_leaf': 4, 'min_weight_fraction_leaf': 0.4226822797881292, 'min_impurity_decrease': 0.6456543493180038, 'max_features': 0.3486357061427947, 'subsample': 0.8004015325926386, 'dropout_rate': 0.4026938367644985, 'ccp_alpha': 4.4408620626527355}. Best is trial 138 with value: 0.731155530669601.[0m
[32m[I 2022-04-13 20:04:52,404][0m Trial 281 finished with value: 0.25 and parameters: {'loss': 'coxph', 'learning_rate': 1.2506998967446076e-06, 'n_estimators': 873, 'criterion': 'friedman_mse', 'min_samples_split': 8, 'min_samples_leaf': 5, 'min_weight_fraction_leaf': 0.45296302232684965, 'min_impurity_decrease': 0.6651182016568452, 'max_features': 0.04944856016552548, 'subsample': 0.14242579674530062, 'dropout_rate': 0.4847928845544806, 'ccp_alpha': 0.43290493147127423}. Best is trial 138 with value: 0.731155530669601.[0m
[32m[I 2022-04-13 20:05:20,692][0m Trial 282 finished with value: 0.25 and parameters: {'loss': 'coxph', 'learning_rate': 1.0366847951559893e-06, 'n_estimators': 254, 'criterion': 'friedman_mse', 'min_samples_split': 8, 'min_samples_leaf': 5, 'min_weight_fraction_leaf': 0.3907180987642272, 'min_impurity_decrease': 0.6434527418616773, 'max_features': 0.05696157106454854, 'subsample': 0.6904204342584822, 'dropout_rate': 0.45740414630827614, 'ccp_alpha': 0.5582978567343411}. Best is trial 138 with value: 0.731155530669601.[0m
[32m[I 2022-04-13 20:07:25,385][0m Trial 283 finished with value: -0.25 and parameters: {'loss': 'squared', 'learning_rate': 3.016743041240008e-06, 'n_estimators': 826, 'criterion': 'friedman_mse', 'min_samples_split': 6, 'min_samples_leaf': 2, 'min_weight_fraction_leaf': 0.35848780983079864, 'min_impurity_decrease': 0.7179474435628876, 'max_features': 0.10408408989936087, 'subsample': 0.711771623890463, 'dropout_rate': 0.5750811012158593, 'ccp_alpha': 3.7389211370444055}. Best is trial 138 with value: 0.731155530669601.[0m
[32m[I 2022-04-13 20:08:11,855][0m Trial 284 finished with value: 0.25 and parameters: {'loss': 'coxph', 'learning_rate': 0.01176730653367565, 'n_estimators': 269, 'criterion': 'friedman_mse', 'min_samples_split': 7, 'min_samples_leaf': 6, 'min_weight_fraction_leaf': 0.002163868398705592, 'min_impurity_decrease': 0.6626216202033042, 'max_features': 0.06736238120374648, 'subsample': 0.19160877515629948, 'dropout_rate': 0.3417602227593345, 'ccp_alpha': 4.62935449897982}. Best is trial 138 with value: 0.731155530669601.[0m
[32m[I 2022-04-13 20:11:48,763][0m Trial 285 finished with value: 0.25 and parameters: {'loss': 'coxph', 'learning_rate': 2.0410633078656646e-05, 'n_estimators': 929, 'criterion': 'friedman_mse', 'min_samples_split': 10, 'min_samples_leaf': 3, 'min_weight_fraction_leaf': 0.03632316902867857, 'min_impurity_decrease': 0.6038183670636653, 'max_features': 0.3178013882026435, 'subsample': 0.08669794864859422, 'dropout_rate': 0.7469355084563623, 'ccp_alpha': 3.562012420776341}. Best is trial 138 with value: 0.731155530669601.[0m
[32m[I 2022-04-13 20:12:23,836][0m Trial 286 finished with value: 0.25 and parameters: {'loss': 'coxph', 'learning_rate': 2.1394709205049355e-05, 'n_estimators': 210, 'criterion': 'friedman_mse', 'min_samples_split': 10, 'min_samples_leaf': 3, 'min_weight_fraction_leaf': 0.05119270537871751, 'min_impurity_decrease': 0.589324160129441, 'max_features': 0.289574932131467, 'subsample': 0.1285415378201894, 'dropout_rate': 0.5411093436385619, 'ccp_alpha': 3.8519738017712126}. Best is trial 138 with value: 0.731155530669601.[0m
[32m[I 2022-04-13 20:15:19,581][0m Trial 287 finished with value: 0.25 and parameters: {'loss': 'coxph', 'learning_rate': 3.5716830044590557e-06, 'n_estimators': 847, 'criterion': 'friedman_mse', 'min_samples_split': 10, 'min_samples_leaf': 3, 'min_weight_fraction_leaf': 0.030938506761575946, 'min_impurity_decrease': 0.5757127856443123, 'max_features': 0.32008219202348753, 'subsample': 0.21906550937597366, 'dropout_rate': 0.6656136419238485, 'ccp_alpha': 3.374526462317819}. Best is trial 138 with value: 0.731155530669601.[0m
[32m[I 2022-04-13 20:18:55,756][0m Trial 288 finished with value: 0.25 and parameters: {'loss': 'coxph', 'learning_rate': 1.4903708134219e-05, 'n_estimators': 947, 'criterion': 'friedman_mse', 'min_samples_split': 10, 'min_samples_leaf': 2, 'min_weight_fraction_leaf': 0.05740857493883963, 'min_impurity_decrease': 0.5881199913692423, 'max_features': 0.18739657042386704, 'subsample': 0.1820795047883072, 'dropout_rate': 0.6776251128096306, 'ccp_alpha': 3.508737814246781}. Best is trial 138 with value: 0.731155530669601.[0m
[32m[I 2022-04-13 20:21:48,704][0m Trial 289 finished with value: 0.25 and parameters: {'loss': 'coxph', 'learning_rate': 9.915545816033064e-06, 'n_estimators': 892, 'criterion': 'friedman_mse', 'min_samples_split': 10, 'min_samples_leaf': 3, 'min_weight_fraction_leaf': 0.3537876742707888, 'min_impurity_decrease': 0.9415408719763355, 'max_features': 0.3054215093505718, 'subsample': 0.2368615051818389, 'dropout_rate': 0.7227849385996526, 'ccp_alpha': 4.02872254611528}. Best is trial 138 with value: 0.731155530669601.[0m
