[32m[I 2022-04-13 13:04:03,398][0m Trial 490 finished with value: 0.7449531651583303 and parameters: {'alpha': 1.3842501320970315, 'ties': 'breslow'}. Best is trial 429 with value: 0.745409816487361.[0m
[32m[I 2022-04-13 13:04:07,289][0m Trial 491 finished with value: 0.7453212759512853 and parameters: {'alpha': 1.2479736454925259, 'ties': 'breslow'}. Best is trial 429 with value: 0.745409816487361.[0m
[32m[I 2022-04-13 13:04:10,602][0m Trial 492 finished with value: 0.7451548518920152 and parameters: {'alpha': 1.1044496291491344, 'ties': 'breslow'}. Best is trial 429 with value: 0.745409816487361.[0m
[32m[I 2022-04-13 13:04:12,878][0m Trial 493 finished with value: 0.7453570910428045 and parameters: {'alpha': 1.229139125423833, 'ties': 'breslow'}. Best is trial 429 with value: 0.745409816487361.[0m
[32m[I 2022-04-13 13:04:16,467][0m Trial 494 finished with value: 0.7449057635230418 and parameters: {'alpha': 1.457676541249448, 'ties': 'breslow'}. Best is trial 429 with value: 0.745409816487361.[0m
[32m[I 2022-04-13 13:04:20,285][0m Trial 495 finished with value: 0.7451615840130272 and parameters: {'alpha': 0.8962316841406643, 'ties': 'breslow'}. Best is trial 429 with value: 0.745409816487361.[0m
[32m[I 2022-04-13 13:04:23,072][0m Trial 496 finished with value: 0.7452314251596781 and parameters: {'alpha': 1.3068495939088245, 'ties': 'breslow'}. Best is trial 429 with value: 0.745409816487361.[0m
[32m[I 2022-04-13 13:04:26,760][0m Trial 497 finished with value: 0.7450057379243107 and parameters: {'alpha': 1.0339061278794126, 'ties': 'breslow'}. Best is trial 429 with value: 0.745409816487361.[0m
[32m[I 2022-04-13 13:04:30,407][0m Trial 498 finished with value: 0.7452033477552196 and parameters: {'alpha': 1.1476870731571087, 'ties': 'breslow'}. Best is trial 429 with value: 0.745409816487361.[0m
[32m[I 2022-04-13 13:04:34,198][0m Trial 499 finished with value: 0.7453259011446767 and parameters: {'alpha': 1.2622733915564393, 'ties': 'efron'}. Best is trial 429 with value: 0.745409816487361.[0m
[32m[I 2022-04-13 13:04:37,318][0m Trial 500 finished with value: 0.7449473169915948 and parameters: {'alpha': 1.4168512900402848, 'ties': 'breslow'}. Best is trial 429 with value: 0.745409816487361.[0m
[32m[I 2022-04-13 13:04:40,769][0m Trial 501 finished with value: 0.7450550872429478 and parameters: {'alpha': 1.7051462312227819, 'ties': 'breslow'}. Best is trial 429 with value: 0.745409816487361.[0m
[32m[I 2022-04-13 13:04:45,297][0m Trial 502 finished with value: 0.7452082938495679 and parameters: {'alpha': 1.1776030548998695, 'ties': 'breslow'}. Best is trial 429 with value: 0.745409816487361.[0m
[32m[I 2022-04-13 13:04:49,768][0m Trial 503 finished with value: 0.7450304402386586 and parameters: {'alpha': 1.3346192431159274, 'ties': 'breslow'}. Best is trial 429 with value: 0.745409816487361.[0m
[32m[I 2022-04-13 13:04:53,144][0m Trial 504 finished with value: 0.7453043707709938 and parameters: {'alpha': 0.968282077220249, 'ties': 'breslow'}. Best is trial 429 with value: 0.745409816487361.[0m
[32m[I 2022-04-13 13:04:55,440][0m Trial 505 finished with value: 0.7451511376562816 and parameters: {'alpha': 1.0978428827910447, 'ties': 'breslow'}. Best is trial 429 with value: 0.745409816487361.[0m
[32m[I 2022-04-13 13:04:57,879][0m Trial 506 finished with value: 0.7452416760176046 and parameters: {'alpha': 1.1988371956575237, 'ties': 'breslow'}. Best is trial 429 with value: 0.745409816487361.[0m
[32m[I 2022-04-13 13:05:01,191][0m Trial 507 finished with value: 0.7450198441111991 and parameters: {'alpha': 1.5521470151033707, 'ties': 'breslow'}. Best is trial 429 with value: 0.745409816487361.[0m
[32m[I 2022-04-13 13:05:05,719][0m Trial 508 finished with value: 0.7452748865683528 and parameters: {'alpha': 1.273931085293939, 'ties': 'breslow'}. Best is trial 429 with value: 0.745409816487361.[0m
[32m[I 2022-04-13 13:05:09,189][0m Trial 509 finished with value: 0.7449670595264732 and parameters: {'alpha': 1.3902777945794074, 'ties': 'breslow'}. Best is trial 429 with value: 0.745409816487361.[0m
[32m[I 2022-04-13 13:05:10,748][0m Trial 510 finished with value: 0.7450261450372169 and parameters: {'alpha': 1.0414160729271293, 'ties': 'breslow'}. Best is trial 429 with value: 0.745409816487361.[0m
[32m[I 2022-04-13 13:05:13,834][0m Trial 511 finished with value: 0.7453245192910702 and parameters: {'alpha': 1.2352462383180713, 'ties': 'breslow'}. Best is trial 429 with value: 0.745409816487361.[0m
[32m[I 2022-04-13 13:05:17,083][0m Trial 512 finished with value: 0.7445429351558817 and parameters: {'alpha': 2.117102107809789, 'ties': 'breslow'}. Best is trial 429 with value: 0.745409816487361.[0m
[32m[I 2022-04-13 13:05:20,226][0m Trial 513 finished with value: 0.74522044678315 and parameters: {'alpha': 1.150558697574024, 'ties': 'breslow'}. Best is trial 429 with value: 0.745409816487361.[0m
[32m[I 2022-04-13 13:05:22,847][0m Trial 514 finished with value: 0.7450304402386586 and parameters: {'alpha': 1.3343044085665745, 'ties': 'breslow'}. Best is trial 429 with value: 0.745409816487361.[0m
[32m[I 2022-04-13 13:05:25,325][0m Trial 515 finished with value: 0.7448870716221989 and parameters: {'alpha': 1.4523400428192443, 'ties': 'breslow'}. Best is trial 429 with value: 0.745409816487361.[0m
[32m[I 2022-04-13 13:05:28,154][0m Trial 516 finished with value: 0.7453570910428045 and parameters: {'alpha': 1.2252224637376015, 'ties': 'breslow'}. Best is trial 429 with value: 0.745409816487361.[0m
[32m[I 2022-04-13 13:05:30,555][0m Trial 517 finished with value: 0.7451455786868567 and parameters: {'alpha': 1.0560678349728199, 'ties': 'breslow'}. Best is trial 429 with value: 0.745409816487361.[0m
[32m[I 2022-04-13 13:05:32,242][0m Trial 518 finished with value: 0.7451612988427062 and parameters: {'alpha': 1.3083367062373346, 'ties': 'efron'}. Best is trial 429 with value: 0.745409816487361.[0m
[32m[I 2022-04-13 13:05:35,818][0m Trial 519 finished with value: 0.7451527595717933 and parameters: {'alpha': 1.1575526978323443, 'ties': 'breslow'}. Best is trial 429 with value: 0.745409816487361.[0m
[32m[I 2022-04-13 13:05:40,344][0m Trial 520 finished with value: 0.7452733912055258 and parameters: {'alpha': 0.9394906792199842, 'ties': 'breslow'}. Best is trial 429 with value: 0.745409816487361.[0m
[32m[I 2022-04-13 13:05:44,059][0m Trial 521 finished with value: 0.7449459362392495 and parameters: {'alpha': 1.4097919185866525, 'ties': 'breslow'}. Best is trial 429 with value: 0.745409816487361.[0m
[32m[I 2022-04-13 13:05:46,390][0m Trial 522 finished with value: 0.745323663778475 and parameters: {'alpha': 1.2370233418089174, 'ties': 'breslow'}. Best is trial 429 with value: 0.745409816487361.[0m
[32m[I 2022-04-13 13:05:49,762][0m Trial 523 finished with value: 0.7451899550460126 and parameters: {'alpha': 1.0869249126779053, 'ties': 'breslow'}. Best is trial 429 with value: 0.745409816487361.[0m
[32m[I 2022-04-13 13:05:53,099][0m Trial 524 finished with value: 0.7450084310830186 and parameters: {'alpha': 1.329241388890533, 'ties': 'breslow'}. Best is trial 429 with value: 0.745409816487361.[0m
[32m[I 2022-04-13 13:05:55,605][0m Trial 525 finished with value: 0.7449178084887749 and parameters: {'alpha': 1.5008914381974967, 'ties': 'breslow'}. Best is trial 429 with value: 0.745409816487361.[0m
[32m[I 2022-04-13 13:05:58,918][0m Trial 526 finished with value: 0.7452396919595836 and parameters: {'alpha': 1.1867701518269376, 'ties': 'breslow'}. Best is trial 429 with value: 0.745409816487361.[0m
[32m[I 2022-04-13 13:06:01,260][0m Trial 527 finished with value: 0.7451085456412951 and parameters: {'alpha': 0.989310841452224, 'ties': 'breslow'}. Best is trial 429 with value: 0.745409816487361.[0m
[32m[I 2022-04-13 13:06:03,510][0m Trial 528 finished with value: 0.7452748865683528 and parameters: {'alpha': 1.2740131300224709, 'ties': 'breslow'}. Best is trial 429 with value: 0.745409816487361.[0m
[32m[I 2022-04-13 13:06:06,929][0m Trial 529 finished with value: 0.7452526080614736 and parameters: {'alpha': 1.134497395662127, 'ties': 'breslow'}. Best is trial 429 with value: 0.745409816487361.[0m
[32m[I 2022-04-13 13:06:09,529][0m Trial 530 finished with value: 0.7389014258055311 and parameters: {'alpha': 4.289149106465547, 'ties': 'breslow'}. Best is trial 429 with value: 0.745409816487361.[0m
[32m[I 2022-04-13 13:06:13,032][0m Trial 531 finished with value: 0.7450533278378381 and parameters: {'alpha': 1.3262566088614194, 'ties': 'breslow'}. Best is trial 429 with value: 0.745409816487361.[0m
[32m[I 2022-04-13 13:06:15,024][0m Trial 532 finished with value: 0.7438007128705859 and parameters: {'alpha': 0.526297276112978, 'ties': 'breslow'}. Best is trial 429 with value: 0.745409816487361.[0m
[32m[I 2022-04-13 13:06:16,799][0m Trial 533 finished with value: 0.7449653625894417 and parameters: {'alpha': 1.423605233220662, 'ties': 'breslow'}. Best is trial 429 with value: 0.745409816487361.[0m
[32m[I 2022-04-13 13:06:18,958][0m Trial 534 finished with value: 0.7451923420239629 and parameters: {'alpha': 0.8437190092002296, 'ties': 'breslow'}. Best is trial 429 with value: 0.745409816487361.[0m
[32m[I 2022-04-13 13:06:22,463][0m Trial 535 finished with value: 0.7452482582455214 and parameters: {'alpha': 1.2090436981724813, 'ties': 'breslow'}. Best is trial 429 with value: 0.745409816487361.[0m
[32m[I 2022-04-13 13:06:26,738][0m Trial 536 finished with value: 0.7451730885943613 and parameters: {'alpha': 1.0706420764642797, 'ties': 'breslow'}. Best is trial 429 with value: 0.745409816487361.[0m
[32m[I 2022-04-13 13:06:29,953][0m Trial 537 finished with value: 0.7452934267530601 and parameters: {'alpha': 1.2651701071231967, 'ties': 'breslow'}. Best is trial 429 with value: 0.745409816487361.[0m
[32m[I 2022-04-13 13:06:33,361][0m Trial 538 finished with value: 0.7452755584741744 and parameters: {'alpha': 1.1446787850521565, 'ties': 'efron'}. Best is trial 429 with value: 0.745409816487361.[0m
[32m[I 2022-04-13 13:06:36,932][0m Trial 539 finished with value: 0.7450393011898746 and parameters: {'alpha': 1.369716081995238, 'ties': 'breslow'}. Best is trial 429 with value: 0.745409816487361.[0m
[32m[I 2022-04-13 13:06:39,329][0m Trial 540 finished with value: 0.744958265963905 and parameters: {'alpha': 1.6170094955890895, 'ties': 'breslow'}. Best is trial 429 with value: 0.745409816487361.[0m
[32m[I 2022-04-13 13:06:41,897][0m Trial 541 finished with value: 0.7451455786868567 and parameters: {'alpha': 1.056523179225211, 'ties': 'breslow'}. Best is trial 429 with value: 0.745409816487361.[0m
[32m[I 2022-04-13 13:06:44,685][0m Trial 542 finished with value: 0.745305094860461 and parameters: {'alpha': 1.2338681710492125, 'ties': 'breslow'}. Best is trial 429 with value: 0.745409816487361.[0m
[32m[I 2022-04-13 13:06:48,639][0m Trial 543 finished with value: 0.7419769325494551 and parameters: {'alpha': 3.2563903873036666, 'ties': 'breslow'}. Best is trial 429 with value: 0.745409816487361.[0m
[32m[I 2022-04-13 13:06:50,406][0m Trial 544 finished with value: 0.7383364114070122 and parameters: {'alpha': 4.841947395403606, 'ties': 'breslow'}. Best is trial 429 with value: 0.745409816487361.[0m
[32m[I 2022-04-13 13:06:53,439][0m Trial 545 finished with value: 0.7449713539121028 and parameters: {'alpha': 1.4639569062391973, 'ties': 'breslow'}. Best is trial 429 with value: 0.745409816487361.[0m
[32m[I 2022-04-13 13:06:57,273][0m Trial 546 finished with value: 0.7452464083908594 and parameters: {'alpha': 0.9783090235048653, 'ties': 'breslow'}. Best is trial 429 with value: 0.745409816487361.[0m
[32m[I 2022-04-13 13:07:01,225][0m Trial 547 finished with value: 0.7451385309327818 and parameters: {'alpha': 1.1704677169762083, 'ties': 'breslow'}. Best is trial 429 with value: 0.745409816487361.[0m
[32m[I 2022-04-13 13:07:05,377][0m Trial 548 finished with value: 0.7450169567622551 and parameters: {'alpha': 1.3283307999695837, 'ties': 'breslow'}. Best is trial 429 with value: 0.745409816487361.[0m
[32m[I 2022-04-13 13:07:08,770][0m Trial 549 finished with value: 0.7453159507935966 and parameters: {'alpha': 1.2589432235367908, 'ties': 'breslow'}. Best is trial 429 with value: 0.745409816487361.[0m
[32m[I 2022-04-13 13:07:11,829][0m Trial 550 finished with value: 0.7421612645383205 and parameters: {'alpha': 3.008578901341969, 'ties': 'breslow'}. Best is trial 429 with value: 0.745409816487361.[0m
[32m[I 2022-04-13 13:07:14,483][0m Trial 551 finished with value: 0.7451642749718491 and parameters: {'alpha': 1.1098852072252603, 'ties': 'breslow'}. Best is trial 429 with value: 0.745409816487361.[0m
[32m[I 2022-04-13 13:07:17,766][0m Trial 552 finished with value: 0.7450577800916403 and parameters: {'alpha': 1.3681715841946995, 'ties': 'breslow'}. Best is trial 429 with value: 0.745409816487361.[0m
[32m[I 2022-04-13 13:07:21,129][0m Trial 553 finished with value: 0.7451803434157991 and parameters: {'alpha': 1.1949437994609309, 'ties': 'breslow'}. Best is trial 429 with value: 0.745409816487361.[0m
[32m[I 2022-04-13 13:07:25,265][0m Trial 554 finished with value: 0.7451383091319534 and parameters: {'alpha': 1.05856348311749, 'ties': 'breslow'}. Best is trial 429 with value: 0.745409816487361.[0m
[32m[I 2022-04-13 13:07:28,107][0m Trial 555 finished with value: 0.7449095564367114 and parameters: {'alpha': 1.524765471139703, 'ties': 'breslow'}. Best is trial 429 with value: 0.745409816487361.[0m
[32m[I 2022-04-13 13:07:31,406][0m Trial 556 finished with value: 0.7453319671949813 and parameters: {'alpha': 1.249848172475779, 'ties': 'breslow'}. Best is trial 429 with value: 0.745409816487361.[0m
[32m[I 2022-04-13 13:07:35,402][0m Trial 557 finished with value: 0.7450507757638682 and parameters: {'alpha': 1.3755571264989148, 'ties': 'efron'}. Best is trial 429 with value: 0.745409816487361.[0m
[32m[I 2022-04-13 13:07:39,275][0m Trial 558 finished with value: 0.745235993907381 and parameters: {'alpha': 0.9039182826774588, 'ties': 'breslow'}. Best is trial 429 with value: 0.745409816487361.[0m
[32m[I 2022-04-13 13:07:42,230][0m Trial 559 finished with value: 0.7453024785774375 and parameters: {'alpha': 1.1367034425495395, 'ties': 'breslow'}. Best is trial 429 with value: 0.745409816487361.[0m
[32m[I 2022-04-13 13:07:43,717][0m Trial 560 finished with value: 0.741087246914766 and parameters: {'alpha': 3.491005761042693, 'ties': 'breslow'}. Best is trial 429 with value: 0.745409816487361.[0m
[32m[I 2022-04-13 13:07:47,117][0m Trial 561 finished with value: 0.7451307115370496 and parameters: {'alpha': 0.7631678301797751, 'ties': 'breslow'}. Best is trial 429 with value: 0.745409816487361.[0m
[32m[I 2022-04-13 13:07:50,913][0m Trial 562 finished with value: 0.7451773276387363 and parameters: {'alpha': 0.9988982311318525, 'ties': 'breslow'}. Best is trial 429 with value: 0.745409816487361.[0m
[32m[I 2022-04-13 13:07:54,443][0m Trial 563 finished with value: 0.7452992105879381 and parameters: {'alpha': 1.2924713724446224, 'ties': 'breslow'}. Best is trial 429 with value: 0.745409816487361.[0m
[32m[I 2022-04-13 13:07:58,058][0m Trial 564 finished with value: 0.7449565812092127 and parameters: {'alpha': 1.4232847107748443, 'ties': 'breslow'}. Best is trial 429 with value: 0.745409816487361.[0m
[32m[I 2022-04-13 13:08:02,408][0m Trial 565 finished with value: 0.7451662282743517 and parameters: {'alpha': 1.1945647981169847, 'ties': 'breslow'}. Best is trial 429 with value: 0.745409816487361.[0m
[32m[I 2022-04-13 13:08:05,682][0m Trial 566 finished with value: 0.7452056007159378 and parameters: {'alpha': 1.1200039670973079, 'ties': 'breslow'}. Best is trial 429 with value: 0.745409816487361.[0m
[32m[I 2022-04-13 13:08:08,105][0m Trial 567 finished with value: 0.7452992105879381 and parameters: {'alpha': 1.2920694340412648, 'ties': 'breslow'}. Best is trial 429 with value: 0.745409816487361.[0m
[32m[I 2022-04-13 13:08:11,489][0m Trial 568 finished with value: 0.7452244384709666 and parameters: {'alpha': 1.0245865427213636, 'ties': 'breslow'}. Best is trial 429 with value: 0.745409816487361.[0m
[32m[I 2022-04-13 13:08:14,340][0m Trial 569 finished with value: 0.7452504539223052 and parameters: {'alpha': 1.2013012455794123, 'ties': 'breslow'}. Best is trial 429 with value: 0.745409816487361.[0m
[32m[I 2022-04-13 13:08:17,606][0m Trial 570 finished with value: 0.744954198470112 and parameters: {'alpha': 1.4622921720250257, 'ties': 'breslow'}. Best is trial 429 with value: 0.745409816487361.[0m
[32m[I 2022-04-13 13:08:21,348][0m Trial 571 finished with value: 0.7450533278378381 and parameters: {'alpha': 1.3268277026664383, 'ties': 'breslow'}. Best is trial 429 with value: 0.745409816487361.[0m
[32m[I 2022-04-13 13:08:24,818][0m Trial 572 finished with value: 0.7452452688385873 and parameters: {'alpha': 1.0812574451775734, 'ties': 'breslow'}. Best is trial 429 with value: 0.745409816487361.[0m
[32m[I 2022-04-13 13:08:26,647][0m Trial 573 finished with value: 0.7453322082366861 and parameters: {'alpha': 1.2461382314196676, 'ties': 'breslow'}. Best is trial 429 with value: 0.745409816487361.[0m
[32m[I 2022-04-13 13:08:29,960][0m Trial 574 finished with value: 0.7449851617834833 and parameters: {'alpha': 1.3949264969448998, 'ties': 'breslow'}. Best is trial 429 with value: 0.745409816487361.[0m
[32m[I 2022-04-13 13:08:34,188][0m Trial 575 finished with value: 0.7452083535806449 and parameters: {'alpha': 1.1828053018303961, 'ties': 'efron'}. Best is trial 429 with value: 0.745409816487361.[0m
[32m[I 2022-04-13 13:08:37,333][0m Trial 576 finished with value: 0.7448904492629511 and parameters: {'alpha': 1.5206765758309233, 'ties': 'breslow'}. Best is trial 429 with value: 0.745409816487361.[0m
[32m[I 2022-04-13 13:08:40,785][0m Trial 577 finished with value: 0.7452380627284809 and parameters: {'alpha': 0.9072369594698286, 'ties': 'breslow'}. Best is trial 429 with value: 0.745409816487361.[0m
[32m[I 2022-04-13 13:08:44,142][0m Trial 578 finished with value: 0.7451944060619586 and parameters: {'alpha': 1.111968719109636, 'ties': 'breslow'}. Best is trial 429 with value: 0.745409816487361.[0m
[32m[I 2022-04-13 13:08:47,278][0m Trial 579 finished with value: 0.7451070993212736 and parameters: {'alpha': 1.3209700559405138, 'ties': 'breslow'}. Best is trial 429 with value: 0.745409816487361.[0m
[32m[I 2022-04-13 13:08:50,778][0m Trial 580 finished with value: 0.7453190605798685 and parameters: {'alpha': 1.2419406652693996, 'ties': 'breslow'}. Best is trial 429 with value: 0.745409816487361.[0m
[32m[I 2022-04-13 13:08:54,568][0m Trial 581 finished with value: 0.7437298807082727 and parameters: {'alpha': 2.735687772676909, 'ties': 'breslow'}. Best is trial 429 with value: 0.745409816487361.[0m
[32m[I 2022-04-13 13:08:57,621][0m Trial 582 finished with value: 0.7451290541832506 and parameters: {'alpha': 0.9903814995357284, 'ties': 'breslow'}. Best is trial 429 with value: 0.745409816487361.[0m
[32m[I 2022-04-13 13:09:00,418][0m Trial 583 finished with value: 0.7452033477552196 and parameters: {'alpha': 1.1480527364508866, 'ties': 'breslow'}. Best is trial 429 with value: 0.745409816487361.[0m
[32m[I 2022-04-13 13:09:02,977][0m Trial 584 finished with value: 0.7450452312981456 and parameters: {'alpha': 1.3648179138532621, 'ties': 'breslow'}. Best is trial 429 with value: 0.745409816487361.[0m
[32m[I 2022-04-13 13:09:06,160][0m Trial 585 finished with value: 0.7453203345679345 and parameters: {'alpha': 1.2706574088340254, 'ties': 'breslow'}. Best is trial 429 with value: 0.745409816487361.[0m
[32m[I 2022-04-13 13:09:08,883][0m Trial 586 finished with value: 0.7451822431136589 and parameters: {'alpha': 1.1592091756460428, 'ties': 'breslow'}. Best is trial 429 with value: 0.745409816487361.[0m
[32m[I 2022-04-13 13:09:11,402][0m Trial 587 finished with value: 0.7449541984969716 and parameters: {'alpha': 1.4261683486750314, 'ties': 'breslow'}. Best is trial 429 with value: 0.745409816487361.[0m
[32m[I 2022-04-13 13:09:14,908][0m Trial 588 finished with value: 0.7449853038241673 and parameters: {'alpha': 1.5727027825827815, 'ties': 'breslow'}. Best is trial 429 with value: 0.745409816487361.[0m
[32m[I 2022-04-13 13:09:18,384][0m Trial 589 finished with value: 0.7450261450372169 and parameters: {'alpha': 1.039975963055307, 'ties': 'breslow'}. Best is trial 429 with value: 0.745409816487361.[0m
[32m[I 2022-04-13 13:09:22,807][0m Trial 590 finished with value: 0.7452598558685691 and parameters: {'alpha': 1.2855471215700789, 'ties': 'breslow'}. Best is trial 429 with value: 0.745409816487361.[0m
[32m[I 2022-04-13 13:09:27,004][0m Trial 591 finished with value: 0.7451957235176491 and parameters: {'alpha': 1.1221359183329525, 'ties': 'breslow'}. Best is trial 429 with value: 0.745409816487361.[0m
[32m[I 2022-04-13 13:09:30,317][0m Trial 592 finished with value: 0.7453454108905417 and parameters: {'alpha': 1.2189188820391332, 'ties': 'breslow'}. Best is trial 429 with value: 0.745409816487361.[0m
[32m[I 2022-04-13 13:09:35,306][0m Trial 593 finished with value: 0.7450179027781576 and parameters: {'alpha': 1.3404795923562502, 'ties': 'breslow'}. Best is trial 429 with value: 0.745409816487361.[0m
[32m[I 2022-04-13 13:09:39,164][0m Trial 594 finished with value: 0.7452240489700082 and parameters: {'alpha': 1.0207839978179136, 'ties': 'efron'}. Best is trial 429 with value: 0.745409816487361.[0m
[32m[I 2022-04-13 13:09:41,731][0m Trial 595 finished with value: 0.7448871520462477 and parameters: {'alpha': 1.4457811333111434, 'ties': 'breslow'}. Best is trial 429 with value: 0.745409816487361.[0m
[32m[I 2022-04-13 13:09:44,500][0m Trial 596 finished with value: 0.7452272903418172 and parameters: {'alpha': 1.2000525516665699, 'ties': 'breslow'}. Best is trial 429 with value: 0.745409816487361.[0m
