[32m[I 2022-04-17 05:22:45,275][0m Trial 20 finished with value: 0.7616096132721908 and parameters: {'n_hidden': 64, 'mixture_components': 2, 'use_sparse_layer': False, 'use_batchnorm': False, 'use_dropout': False, 'mlp_size_1': 3, 'mlp_size_2': 0, 'mlp_size_3': 0, 'kernel': 'Gamma', 'loss_name': 'AlternativeNLLLoss'}. Best is trial 12 with value: 0.7673193132040163.[0m
[32m[I 2022-04-17 05:24:29,261][0m Trial 21 finished with value: 0.7556287671524109 and parameters: {'n_hidden': 512, 'mixture_components': 1, 'use_sparse_layer': False, 'use_batchnorm': False, 'use_dropout': False, 'mlp_size_1': 5, 'mlp_size_2': 1, 'mlp_size_3': 0, 'kernel': 'Exponential', 'loss_name': 'AlternativeNLLLoss'}. Best is trial 12 with value: 0.7673193132040163.[0m
[32m[I 2022-04-17 05:26:06,884][0m Trial 22 finished with value: 0.7668419681193572 and parameters: {'n_hidden': 512, 'mixture_components': 2, 'use_sparse_layer': False, 'use_batchnorm': False, 'use_dropout': False, 'mlp_size_1': 5, 'mlp_size_2': 1, 'mlp_size_3': 0, 'kernel': 'Exponential', 'loss_name': 'AlternativeNLLLoss'}. Best is trial 12 with value: 0.7673193132040163.[0m
[32m[I 2022-04-17 05:27:44,029][0m Trial 23 finished with value: 0.7642187249331113 and parameters: {'n_hidden': 512, 'mixture_components': 2, 'use_sparse_layer': False, 'use_batchnorm': False, 'use_dropout': False, 'mlp_size_1': 4, 'mlp_size_2': 2, 'mlp_size_3': 0, 'kernel': 'Exponential', 'loss_name': 'AlternativeNLLLoss'}. Best is trial 12 with value: 0.7673193132040163.[0m
[32m[I 2022-04-17 05:29:51,443][0m Trial 24 finished with value: 0.7359841443651552 and parameters: {'n_hidden': 256, 'mixture_components': 5, 'use_sparse_layer': False, 'use_batchnorm': False, 'use_dropout': False, 'mlp_size_1': 4, 'mlp_size_2': 1, 'mlp_size_3': 0, 'kernel': 'Gumbel', 'loss_name': 'AlternativeNLLLoss'}. Best is trial 12 with value: 0.7673193132040163.[0m
[32m[I 2022-04-17 05:31:37,793][0m Trial 25 finished with value: 0.6856032835640719 and parameters: {'n_hidden': 128, 'mixture_components': 3, 'use_sparse_layer': False, 'use_batchnorm': False, 'use_dropout': False, 'mlp_size_1': 4, 'mlp_size_2': 0, 'mlp_size_3': 0, 'kernel': 'Logistic', 'loss_name': 'NLLLoss'}. Best is trial 12 with value: 0.7673193132040163.[0m
[32m[I 2022-04-17 05:33:29,876][0m Trial 26 finished with value: -1.0 and parameters: {'n_hidden': 512, 'mixture_components': 2, 'use_sparse_layer': False, 'use_batchnorm': True, 'use_dropout': True, 'dropout': 0.9909134991432599, 'mlp_size_1': 3, 'mlp_size_2': 3, 'mlp_size_3': 0, 'kernel': 'Weibull', 'loss_name': 'AlternativeNLLLoss'}. Best is trial 12 with value: 0.7673193132040163.[0m
[32m[I 2022-04-17 05:35:11,012][0m Trial 27 finished with value: 0.7690887283605428 and parameters: {'n_hidden': 512, 'mixture_components': 5, 'use_sparse_layer': False, 'use_batchnorm': False, 'use_dropout': False, 'mlp_size_1': 5, 'mlp_size_2': 1, 'mlp_size_3': 0, 'kernel': 'Exponential', 'loss_name': 'AlternativeNLLLoss'}. Best is trial 27 with value: 0.7690887283605428.[0m
[32m[I 2022-04-17 05:36:55,940][0m Trial 28 finished with value: 0.751736667391963 and parameters: {'n_hidden': 512, 'mixture_components': 9, 'use_sparse_layer': False, 'use_batchnorm': False, 'use_dropout': False, 'mlp_size_1': 6, 'mlp_size_2': 0, 'mlp_size_3': 0, 'kernel': 'Exponential', 'loss_name': 'AlternativeNLLLoss'}. Best is trial 27 with value: 0.7690887283605428.[0m
[32m[I 2022-04-17 05:39:47,512][0m Trial 29 finished with value: 0.7437514268226277 and parameters: {'n_hidden': 512, 'mixture_components': 4, 'use_sparse_layer': False, 'use_batchnorm': True, 'use_dropout': False, 'mlp_size_1': 3, 'mlp_size_2': 3, 'mlp_size_3': 0, 'kernel': 'Gamma', 'loss_name': 'AlternativeNLLLoss'}. Best is trial 27 with value: 0.7690887283605428.[0m
[32m[I 2022-04-17 05:41:27,785][0m Trial 30 finished with value: 0.6996546744460898 and parameters: {'n_hidden': 1024, 'mixture_components': 5, 'use_sparse_layer': False, 'use_batchnorm': False, 'use_dropout': False, 'mlp_size_1': 6, 'mlp_size_2': 1, 'mlp_size_3': 0, 'kernel': 'Exponential', 'loss_name': 'NLLLoss'}. Best is trial 27 with value: 0.7690887283605428.[0m
[32m[I 2022-04-17 05:43:11,793][0m Trial 31 finished with value: 0.7613446825023912 and parameters: {'n_hidden': 512, 'mixture_components': 4, 'use_sparse_layer': False, 'use_batchnorm': False, 'use_dropout': False, 'mlp_size_1': 5, 'mlp_size_2': 1, 'mlp_size_3': 0, 'kernel': 'Exponential', 'loss_name': 'AlternativeNLLLoss'}. Best is trial 27 with value: 0.7690887283605428.[0m
[32m[I 2022-04-17 05:44:59,716][0m Trial 32 finished with value: 0.767048919729592 and parameters: {'n_hidden': 512, 'mixture_components': 7, 'use_sparse_layer': False, 'use_batchnorm': False, 'use_dropout': False, 'mlp_size_1': 5, 'mlp_size_2': 1, 'mlp_size_3': 0, 'kernel': 'Exponential', 'loss_name': 'AlternativeNLLLoss'}. Best is trial 27 with value: 0.7690887283605428.[0m
[32m[I 2022-04-17 05:46:40,446][0m Trial 33 finished with value: 0.6949649696317197 and parameters: {'n_hidden': 512, 'mixture_components': 7, 'use_sparse_layer': False, 'use_batchnorm': False, 'use_dropout': False, 'mlp_size_1': 6, 'mlp_size_2': 0, 'mlp_size_3': 0, 'kernel': 'Gumbel', 'loss_name': 'AlternativeNLLLoss'}. Best is trial 27 with value: 0.7690887283605428.[0m
[32m[I 2022-04-17 05:48:29,064][0m Trial 34 finished with value: 0.7534915071851855 and parameters: {'n_hidden': 64, 'mixture_components': 7, 'use_sparse_layer': False, 'use_batchnorm': False, 'use_dropout': False, 'mlp_size_1': 3, 'mlp_size_2': 0, 'mlp_size_3': 0, 'kernel': 'Exponential', 'loss_name': 'AlternativeNLLLoss'}. Best is trial 27 with value: 0.7690887283605428.[0m
[32m[I 2022-04-17 05:50:34,656][0m Trial 35 finished with value: 0.7625874734509858 and parameters: {'n_hidden': 256, 'mixture_components': 8, 'use_sparse_layer': False, 'use_batchnorm': False, 'use_dropout': False, 'mlp_size_1': 5, 'mlp_size_2': 0, 'mlp_size_3': 0, 'kernel': 'Weibull', 'loss_name': 'AlternativeNLLLoss'}. Best is trial 27 with value: 0.7690887283605428.[0m
[32m[I 2022-04-17 05:52:22,841][0m Trial 36 finished with value: 0.7528021479262739 and parameters: {'n_hidden': 128, 'mixture_components': 8, 'use_sparse_layer': False, 'use_batchnorm': False, 'use_dropout': True, 'dropout': 0.0044624653074029075, 'mlp_size_1': 4, 'mlp_size_2': 0, 'mlp_size_3': 0, 'kernel': 'LogLogistic', 'loss_name': 'CensoredNLLLoss'}. Best is trial 27 with value: 0.7690887283605428.[0m
[32m[I 2022-04-17 05:54:09,379][0m Trial 37 finished with value: 0.7663046964996478 and parameters: {'n_hidden': 512, 'mixture_components': 7, 'use_sparse_layer': True, 'use_sparse_loss': True, 'lmbd': 0.07982627170283262, 'use_batchnorm': False, 'use_dropout': False, 'mlp_size_1': 2, 'mlp_size_2': 2, 'mlp_size_3': 2, 'kernel': 'Exponential', 'loss_name': 'AlternativeNLLLoss'}. Best is trial 27 with value: 0.7690887283605428.[0m
[32m[I 2022-04-17 05:58:44,399][0m Trial 38 finished with value: 0.7056254930915522 and parameters: {'n_hidden': 32, 'mixture_components': 5, 'use_sparse_layer': False, 'use_batchnorm': False, 'use_dropout': False, 'mlp_size_1': 2, 'mlp_size_2': 0, 'mlp_size_3': 0, 'kernel': 'LogNormal', 'loss_name': 'CensoredNLLLoss'}. Best is trial 27 with value: 0.7690887283605428.[0m
[32m[I 2022-04-17 06:01:13,715][0m Trial 39 finished with value: 0.7469633091604819 and parameters: {'n_hidden': 512, 'mixture_components': 3, 'use_sparse_layer': False, 'use_batchnorm': False, 'use_dropout': True, 'dropout': 0.6335626913821311, 'mlp_size_1': 6, 'mlp_size_2': 0, 'mlp_size_3': 0, 'kernel': 'Logistic', 'loss_name': 'AlternativeNLLLoss'}. Best is trial 27 with value: 0.7690887283605428.[0m
[32m[I 2022-04-17 06:04:18,966][0m Trial 40 finished with value: 0.7515470463105118 and parameters: {'n_hidden': 1024, 'mixture_components': 9, 'use_sparse_layer': True, 'use_sparse_loss': True, 'lmbd': 1.2188391344289046e-06, 'use_batchnorm': True, 'use_dropout': False, 'mlp_size_1': 6, 'mlp_size_2': 1, 'mlp_size_3': 0, 'kernel': 'Gamma', 'loss_name': 'CensoredNLLLoss'}. Best is trial 27 with value: 0.7690887283605428.[0m
[32m[I 2022-04-17 06:06:05,242][0m Trial 41 finished with value: 0.7618766976627225 and parameters: {'n_hidden': 512, 'mixture_components': 7, 'use_sparse_layer': True, 'use_sparse_loss': True, 'lmbd': 0.07480398341828272, 'use_batchnorm': False, 'use_dropout': False, 'mlp_size_1': 2, 'mlp_size_2': 3, 'mlp_size_3': 1, 'kernel': 'Exponential', 'loss_name': 'AlternativeNLLLoss'}. Best is trial 27 with value: 0.7690887283605428.[0m
[32m[I 2022-04-17 06:08:13,041][0m Trial 42 finished with value: 0.7642880672777778 and parameters: {'n_hidden': 512, 'mixture_components': 6, 'use_sparse_layer': True, 'use_sparse_loss': True, 'lmbd': 0.03823771921507628, 'use_batchnorm': False, 'use_dropout': False, 'mlp_size_1': 2, 'mlp_size_2': 2, 'mlp_size_3': 2, 'kernel': 'Exponential', 'loss_name': 'AlternativeNLLLoss'}. Best is trial 27 with value: 0.7690887283605428.[0m
[32m[I 2022-04-17 06:11:04,632][0m Trial 43 finished with value: 0.7691234843192308 and parameters: {'n_hidden': 2048, 'mixture_components': 7, 'use_sparse_layer': True, 'use_sparse_loss': True, 'lmbd': 0.0015548959927400234, 'use_batchnorm': False, 'use_dropout': False, 'mlp_size_1': 0, 'mlp_size_2': 7, 'mlp_size_3': 1, 'kernel': 'Exponential', 'loss_name': 'AlternativeNLLLoss'}. Best is trial 43 with value: 0.7691234843192308.[0m
[32m[I 2022-04-17 06:13:33,664][0m Trial 44 finished with value: 0.754865595804679 and parameters: {'n_hidden': 2048, 'mixture_components': 8, 'use_sparse_layer': True, 'use_sparse_loss': True, 'lmbd': 0.0007787922523846443, 'use_batchnorm': False, 'use_dropout': False, 'mlp_size_1': 8, 'mlp_size_2': 0, 'mlp_size_3': 0, 'kernel': 'LogLogistic', 'loss_name': 'AlternativeNLLLoss'}. Best is trial 43 with value: 0.7691234843192308.[0m
[32m[I 2022-04-17 06:16:10,605][0m Trial 45 finished with value: 0.753087102822336 and parameters: {'n_hidden': 2048, 'mixture_components': 6, 'use_sparse_layer': True, 'use_sparse_loss': False, 'use_batchnorm': False, 'use_dropout': False, 'mlp_size_1': 0, 'mlp_size_2': 8, 'mlp_size_3': 0, 'kernel': 'Exponential', 'loss_name': 'AlternativeNLLLoss'}. Best is trial 43 with value: 0.7691234843192308.[0m
[32m[I 2022-04-17 06:18:50,458][0m Trial 46 finished with value: 0.7095376164927458 and parameters: {'n_hidden': 2048, 'mixture_components': 9, 'use_sparse_layer': True, 'use_sparse_loss': True, 'lmbd': 3.351339357810381e-05, 'use_batchnorm': False, 'use_dropout': False, 'mlp_size_1': 1, 'mlp_size_2': 5, 'mlp_size_3': 1, 'kernel': 'Gumbel', 'loss_name': 'AlternativeNLLLoss'}. Best is trial 43 with value: 0.7691234843192308.[0m
[32m[I 2022-04-17 06:21:00,822][0m Trial 47 finished with value: 0.7035823497977409 and parameters: {'n_hidden': 2048, 'mixture_components': 7, 'use_sparse_layer': True, 'use_sparse_loss': True, 'lmbd': 0.004843349541319408, 'use_batchnorm': False, 'use_dropout': True, 'dropout': 0.22347852802022344, 'mlp_size_1': 6, 'mlp_size_2': 1, 'mlp_size_3': 1, 'kernel': 'Exponential', 'loss_name': 'NLLLoss'}. Best is trial 43 with value: 0.7691234843192308.[0m
[32m[I 2022-04-17 06:23:29,341][0m Trial 48 finished with value: 0.7535100168824818 and parameters: {'n_hidden': 32, 'mixture_components': 6, 'use_sparse_layer': False, 'use_batchnorm': False, 'use_dropout': False, 'mlp_size_1': 2, 'mlp_size_2': 0, 'mlp_size_3': 0, 'kernel': 'Weibull', 'loss_name': 'AlternativeNLLLoss'}. Best is trial 43 with value: 0.7691234843192308.[0m
[32m[I 2022-04-17 06:25:53,043][0m Trial 49 finished with value: 0.7560427598414974 and parameters: {'n_hidden': 64, 'mixture_components': 3, 'use_sparse_layer': False, 'use_batchnorm': False, 'use_dropout': False, 'mlp_size_1': 3, 'mlp_size_2': 0, 'mlp_size_3': 0, 'kernel': 'Normal', 'loss_name': 'CensoredNLLLoss'}. Best is trial 43 with value: 0.7691234843192308.[0m
[32m[I 2022-04-17 06:28:59,094][0m Trial 50 finished with value: 0.7522198192266433 and parameters: {'n_hidden': 2048, 'mixture_components': 5, 'use_sparse_layer': True, 'use_sparse_loss': False, 'use_batchnorm': True, 'use_dropout': False, 'mlp_size_1': 7, 'mlp_size_2': 1, 'mlp_size_3': 0, 'kernel': 'Exponential', 'loss_name': 'AlternativeNLLLoss'}. Best is trial 43 with value: 0.7691234843192308.[0m
[32m[I 2022-04-17 06:31:10,620][0m Trial 51 finished with value: 0.7667431568889008 and parameters: {'n_hidden': 512, 'mixture_components': 7, 'use_sparse_layer': True, 'use_sparse_loss': True, 'lmbd': 0.01032309896698877, 'use_batchnorm': False, 'use_dropout': False, 'mlp_size_1': 0, 'mlp_size_2': 4, 'mlp_size_3': 2, 'kernel': 'Exponential', 'loss_name': 'AlternativeNLLLoss'}. Best is trial 43 with value: 0.7691234843192308.[0m
[32m[I 2022-04-17 06:33:26,849][0m Trial 52 finished with value: 0.7666743798206082 and parameters: {'n_hidden': 512, 'mixture_components': 8, 'use_sparse_layer': True, 'use_sparse_loss': True, 'lmbd': 0.007486748226849579, 'use_batchnorm': False, 'use_dropout': False, 'mlp_size_1': 0, 'mlp_size_2': 4, 'mlp_size_3': 2, 'kernel': 'Exponential', 'loss_name': 'AlternativeNLLLoss'}. Best is trial 43 with value: 0.7691234843192308.[0m
[32m[I 2022-04-17 06:35:17,782][0m Trial 53 finished with value: 0.7704184978621734 and parameters: {'n_hidden': 512, 'mixture_components': 6, 'use_sparse_layer': True, 'use_sparse_loss': True, 'lmbd': 0.00010368092083584143, 'use_batchnorm': False, 'use_dropout': False, 'mlp_size_1': 1, 'mlp_size_2': 5, 'mlp_size_3': 0, 'kernel': 'Exponential', 'loss_name': 'AlternativeNLLLoss'}. Best is trial 53 with value: 0.7704184978621734.[0m
[32m[I 2022-04-17 06:37:09,379][0m Trial 54 finished with value: 0.7713591884824607 and parameters: {'n_hidden': 512, 'mixture_components': 6, 'use_sparse_layer': True, 'use_sparse_loss': True, 'lmbd': 8.633344924866937e-05, 'use_batchnorm': False, 'use_dropout': False, 'mlp_size_1': 1, 'mlp_size_2': 5, 'mlp_size_3': 0, 'kernel': 'Exponential', 'loss_name': 'AlternativeNLLLoss'}. Best is trial 54 with value: 0.7713591884824607.[0m
[32m[I 2022-04-17 06:39:45,051][0m Trial 55 finished with value: 0.7399821097735282 and parameters: {'n_hidden': 256, 'mixture_components': 6, 'use_sparse_layer': True, 'use_sparse_loss': True, 'lmbd': 6.551246970354603e-05, 'use_batchnorm': False, 'use_dropout': False, 'mlp_size_1': 1, 'mlp_size_2': 4, 'mlp_size_3': 0, 'kernel': 'LogNormal', 'loss_name': 'AlternativeNLLLoss'}. Best is trial 54 with value: 0.7713591884824607.[0m
[32m[I 2022-04-17 06:41:33,703][0m Trial 56 finished with value: 0.7696943532236931 and parameters: {'n_hidden': 512, 'mixture_components': 5, 'use_sparse_layer': True, 'use_sparse_loss': True, 'lmbd': 6.0774255184393586e-05, 'use_batchnorm': False, 'use_dropout': False, 'mlp_size_1': 1, 'mlp_size_2': 5, 'mlp_size_3': 0, 'kernel': 'Exponential', 'loss_name': 'AlternativeNLLLoss'}. Best is trial 54 with value: 0.7713591884824607.[0m
[32m[I 2022-04-17 06:43:29,798][0m Trial 57 finished with value: 0.7662173625721975 and parameters: {'n_hidden': 1024, 'mixture_components': 5, 'use_sparse_layer': True, 'use_sparse_loss': True, 'lmbd': 4.612133682954295e-05, 'use_batchnorm': False, 'use_dropout': False, 'mlp_size_1': 1, 'mlp_size_2': 6, 'mlp_size_3': 0, 'kernel': 'Exponential', 'loss_name': 'AlternativeNLLLoss'}. Best is trial 54 with value: 0.7713591884824607.[0m
[32m[I 2022-04-17 06:45:51,843][0m Trial 58 finished with value: 0.7034586762105736 and parameters: {'n_hidden': 128, 'mixture_components': 6, 'use_sparse_layer': True, 'use_sparse_loss': True, 'lmbd': 0.0002879783308976226, 'use_batchnorm': False, 'use_dropout': True, 'dropout': 0.5846565628707754, 'mlp_size_1': 1, 'mlp_size_2': 3, 'mlp_size_3': 0, 'kernel': 'Logistic', 'loss_name': 'NLLLoss'}. Best is trial 54 with value: 0.7713591884824607.[0m
[32m[I 2022-04-17 06:47:45,615][0m Trial 59 finished with value: 0.7685909659140903 and parameters: {'n_hidden': 512, 'mixture_components': 5, 'use_sparse_layer': True, 'use_sparse_loss': True, 'lmbd': 1.5432126309417946e-05, 'use_batchnorm': False, 'use_dropout': False, 'mlp_size_1': 0, 'mlp_size_2': 5, 'mlp_size_3': 1, 'kernel': 'Exponential', 'loss_name': 'AlternativeNLLLoss'}. Best is trial 54 with value: 0.7713591884824607.[0m
[32m[I 2022-04-17 06:50:53,610][0m Trial 60 finished with value: 0.7169516218080296 and parameters: {'n_hidden': 32, 'mixture_components': 5, 'use_sparse_layer': True, 'use_sparse_loss': True, 'lmbd': 1.5433990093587685e-05, 'use_batchnorm': True, 'use_dropout': False, 'mlp_size_1': 1, 'mlp_size_2': 1, 'mlp_size_3': 0, 'kernel': 'Normal', 'loss_name': 'AlternativeNLLLoss'}. Best is trial 54 with value: 0.7713591884824607.[0m
[32m[I 2022-04-17 06:52:37,592][0m Trial 61 finished with value: 0.7622228376230739 and parameters: {'n_hidden': 512, 'mixture_components': 4, 'use_sparse_layer': True, 'use_sparse_loss': True, 'lmbd': 0.00011303457357564201, 'use_batchnorm': False, 'use_dropout': False, 'mlp_size_1': 0, 'mlp_size_2': 5, 'mlp_size_3': 1, 'kernel': 'Exponential', 'loss_name': 'AlternativeNLLLoss'}. Best is trial 54 with value: 0.7713591884824607.[0m
[32m[I 2022-04-17 06:54:17,637][0m Trial 62 finished with value: 0.767681790801132 and parameters: {'n_hidden': 512, 'mixture_components': 5, 'use_sparse_layer': True, 'use_sparse_loss': True, 'lmbd': 1.4097083558983108e-05, 'use_batchnorm': False, 'use_dropout': False, 'mlp_size_1': 0, 'mlp_size_2': 5, 'mlp_size_3': 1, 'kernel': 'Exponential', 'loss_name': 'AlternativeNLLLoss'}. Best is trial 54 with value: 0.7713591884824607.[0m
[32m[I 2022-04-17 06:56:03,078][0m Trial 63 finished with value: 0.7682793406372823 and parameters: {'n_hidden': 512, 'mixture_components': 5, 'use_sparse_layer': True, 'use_sparse_loss': True, 'lmbd': 1.0064028358821261e-05, 'use_batchnorm': False, 'use_dropout': False, 'mlp_size_1': 0, 'mlp_size_2': 5, 'mlp_size_3': 1, 'kernel': 'Exponential', 'loss_name': 'AlternativeNLLLoss'}. Best is trial 54 with value: 0.7713591884824607.[0m
[32m[I 2022-04-17 06:58:04,310][0m Trial 64 finished with value: 0.7658746639255297 and parameters: {'n_hidden': 512, 'mixture_components': 6, 'use_sparse_layer': True, 'use_sparse_loss': True, 'lmbd': 4.769054672901358e-06, 'use_batchnorm': False, 'use_dropout': False, 'mlp_size_1': 0, 'mlp_size_2': 6, 'mlp_size_3': 0, 'kernel': 'Exponential', 'loss_name': 'AlternativeNLLLoss'}. Best is trial 54 with value: 0.7713591884824607.[0m
[32m[I 2022-04-17 06:59:49,914][0m Trial 65 finished with value: 0.7670989684335408 and parameters: {'n_hidden': 512, 'mixture_components': 4, 'use_sparse_layer': True, 'use_sparse_loss': True, 'lmbd': 1.54081019410523e-05, 'use_batchnorm': False, 'use_dropout': False, 'mlp_size_1': 1, 'mlp_size_2': 5, 'mlp_size_3': 0, 'kernel': 'Exponential', 'loss_name': 'AlternativeNLLLoss'}. Best is trial 54 with value: 0.7713591884824607.[0m
[32m[I 2022-04-17 07:02:00,685][0m Trial 66 finished with value: 0.7659894004036182 and parameters: {'n_hidden': 512, 'mixture_components': 5, 'use_sparse_layer': True, 'use_sparse_loss': True, 'lmbd': 0.00013321737249231706, 'use_batchnorm': False, 'use_dropout': False, 'mlp_size_1': 0, 'mlp_size_2': 6, 'mlp_size_3': 0, 'kernel': 'Exponential', 'loss_name': 'AlternativeNLLLoss'}. Best is trial 54 with value: 0.7713591884824607.[0m
[32m[I 2022-04-17 07:04:01,453][0m Trial 67 finished with value: 0.7386737639807456 and parameters: {'n_hidden': 64, 'mixture_components': 6, 'use_sparse_layer': True, 'use_sparse_loss': True, 'lmbd': 2.326349639064575e-05, 'use_batchnorm': False, 'use_dropout': False, 'mlp_size_1': 0, 'mlp_size_2': 3, 'mlp_size_3': 0, 'kernel': 'LogLogistic', 'loss_name': 'AlternativeNLLLoss'}. Best is trial 54 with value: 0.7713591884824607.[0m
[32m[I 2022-04-17 07:05:56,079][0m Trial 68 finished with value: 0.765597514783236 and parameters: {'n_hidden': 512, 'mixture_components': 4, 'use_sparse_layer': True, 'use_sparse_loss': True, 'lmbd': 6.005012845128903e-06, 'use_batchnorm': False, 'use_dropout': False, 'mlp_size_1': 1, 'mlp_size_2': 5, 'mlp_size_3': 0, 'kernel': 'Exponential', 'loss_name': 'AlternativeNLLLoss'}. Best is trial 54 with value: 0.7713591884824607.[0m
[32m[I 2022-04-17 07:08:14,137][0m Trial 69 finished with value: 0.7091703961793463 and parameters: {'n_hidden': 2048, 'mixture_components': 5, 'use_sparse_layer': True, 'use_sparse_loss': True, 'lmbd': 9.568020722359872e-05, 'use_batchnorm': False, 'use_dropout': False, 'mlp_size_1': 1, 'mlp_size_2': 7, 'mlp_size_3': 0, 'kernel': 'Gamma', 'loss_name': 'NLLLoss'}. Best is trial 54 with value: 0.7713591884824607.[0m
[32m[I 2022-04-17 07:10:23,066][0m Trial 70 finished with value: 0.739194862559808 and parameters: {'n_hidden': 512, 'mixture_components': 4, 'use_sparse_layer': True, 'use_sparse_loss': True, 'lmbd': 0.000897653572717092, 'use_batchnorm': False, 'use_dropout': False, 'mlp_size_1': 0, 'mlp_size_2': 4, 'mlp_size_3': 1, 'kernel': 'Gumbel', 'loss_name': 'AlternativeNLLLoss'}. Best is trial 54 with value: 0.7713591884824607.[0m
[32m[I 2022-04-17 07:12:16,081][0m Trial 71 finished with value: 0.7687766238968295 and parameters: {'n_hidden': 512, 'mixture_components': 5, 'use_sparse_layer': True, 'use_sparse_loss': True, 'lmbd': 1.8988630545076952e-05, 'use_batchnorm': False, 'use_dropout': False, 'mlp_size_1': 0, 'mlp_size_2': 5, 'mlp_size_3': 1, 'kernel': 'Exponential', 'loss_name': 'AlternativeNLLLoss'}. Best is trial 54 with value: 0.7713591884824607.[0m
[32m[I 2022-04-17 07:14:04,115][0m Trial 72 finished with value: 0.764974970163065 and parameters: {'n_hidden': 512, 'mixture_components': 6, 'use_sparse_layer': True, 'use_sparse_loss': True, 'lmbd': 7.352060021425725e-06, 'use_batchnorm': False, 'use_dropout': False, 'mlp_size_1': 0, 'mlp_size_2': 5, 'mlp_size_3': 1, 'kernel': 'Exponential', 'loss_name': 'AlternativeNLLLoss'}. Best is trial 54 with value: 0.7713591884824607.[0m
