[32m[I 2022-04-13 12:39:55,331][0m Trial 953 finished with value: 0.7162535825935347 and parameters: {'splitter': 'best', 'min_samples_split': 0.12540343020904055, 'min_samples_leaf': 0.014253555128177513, 'min_weight_fraction_leaf': 0.03598414713537719, 'max_features': 0.24966051265570038}. Best is trial 241 with value: 0.7773840258827056.[0m
[32m[I 2022-04-13 12:39:59,625][0m Trial 954 finished with value: 0.7650328541969166 and parameters: {'splitter': 'best', 'min_samples_split': 0.10251129842519816, 'min_samples_leaf': 0.012603365452969677, 'min_weight_fraction_leaf': 0.043600084277266846, 'max_features': 0.9694604396473023}. Best is trial 241 with value: 0.7773840258827056.[0m
[32m[I 2022-04-13 12:40:02,021][0m Trial 955 finished with value: 0.7712637836026864 and parameters: {'splitter': 'best', 'min_samples_split': 0.08108600023708362, 'min_samples_leaf': 0.02134464667582179, 'min_weight_fraction_leaf': 0.031011041820897645, 'max_features': 0.9422993132942266}. Best is trial 241 with value: 0.7773840258827056.[0m
[32m[I 2022-04-13 12:40:03,873][0m Trial 956 finished with value: 0.7709601691407293 and parameters: {'splitter': 'best', 'min_samples_split': 0.13938946109234923, 'min_samples_leaf': 0.012544586807780606, 'min_weight_fraction_leaf': 0.05546444027772198, 'max_features': 0.9999861305664718}. Best is trial 241 with value: 0.7773840258827056.[0m
[32m[I 2022-04-13 12:40:05,806][0m Trial 957 finished with value: 0.7737200145668346 and parameters: {'splitter': 'best', 'min_samples_split': 0.11806316418086642, 'min_samples_leaf': 0.022131528548591347, 'min_weight_fraction_leaf': 0.028199198661334156, 'max_features': 0.982038952563713}. Best is trial 241 with value: 0.7773840258827056.[0m
[32m[I 2022-04-13 12:40:08,422][0m Trial 958 finished with value: 0.7633998478668979 and parameters: {'splitter': 'best', 'min_samples_split': 0.15192122439614672, 'min_samples_leaf': 0.021654599845487163, 'min_weight_fraction_leaf': 0.04270838985858346, 'max_features': 0.9602770161708206}. Best is trial 241 with value: 0.7773840258827056.[0m
[32m[I 2022-04-13 12:40:09,876][0m Trial 959 finished with value: 0.7733015018506548 and parameters: {'splitter': 'best', 'min_samples_split': 0.10814740423232884, 'min_samples_leaf': 0.0015073933698784743, 'min_weight_fraction_leaf': 0.036280881366189593, 'max_features': 0.9992225897903024}. Best is trial 241 with value: 0.7773840258827056.[0m
[32m[I 2022-04-13 12:40:11,723][0m Trial 960 finished with value: 0.7692665848435334 and parameters: {'splitter': 'best', 'min_samples_split': 0.09127665823191504, 'min_samples_leaf': 0.014780495843855643, 'min_weight_fraction_leaf': 0.0644403794152204, 'max_features': 0.999862642865803}. Best is trial 241 with value: 0.7773840258827056.[0m
[32m[I 2022-04-13 12:40:13,896][0m Trial 961 finished with value: 0.7676519185094698 and parameters: {'splitter': 'best', 'min_samples_split': 0.12794993657451922, 'min_samples_leaf': 0.022140076431849627, 'min_weight_fraction_leaf': 0.02420604861053975, 'max_features': 0.9664608706789702}. Best is trial 241 with value: 0.7773840258827056.[0m
[32m[I 2022-04-13 12:40:14,231][0m Trial 962 finished with value: 0.7022767458820938 and parameters: {'splitter': 'best', 'min_samples_split': 0.1190825222828225, 'min_samples_leaf': 0.2574823302776726, 'min_weight_fraction_leaf': 0.05143672061923586, 'max_features': 0.9298681548180393}. Best is trial 241 with value: 0.7773840258827056.[0m
[32m[I 2022-04-13 12:40:14,512][0m Trial 963 finished with value: 0.7588153114062247 and parameters: {'splitter': 'random', 'min_samples_split': 0.13557105243705864, 'min_samples_leaf': 0.009559272395035578, 'min_weight_fraction_leaf': 0.03312360493587914, 'max_features': 0.9518813703320745}. Best is trial 241 with value: 0.7773840258827056.[0m
[32m[I 2022-04-13 12:40:16,200][0m Trial 964 finished with value: 0.7755895711034265 and parameters: {'splitter': 'best', 'min_samples_split': 0.10990395895353411, 'min_samples_leaf': 0.023165200792499858, 'min_weight_fraction_leaf': 0.042913034531190254, 'max_features': 0.9792193458661466}. Best is trial 241 with value: 0.7773840258827056.[0m
[32m[I 2022-04-13 12:40:18,040][0m Trial 965 finished with value: 0.7013504654287714 and parameters: {'splitter': 'best', 'min_samples_split': 0.09610437401193242, 'min_samples_leaf': 0.013331521867267316, 'min_weight_fraction_leaf': 0.04628818629602124, 'max_features': 0.3487839144778385}. Best is trial 241 with value: 0.7773840258827056.[0m
[32m[I 2022-04-13 12:40:19,003][0m Trial 966 finished with value: 0.7727431212725303 and parameters: {'splitter': 'best', 'min_samples_split': 0.08896238325056433, 'min_samples_leaf': 0.022956628869814897, 'min_weight_fraction_leaf': 0.07485779832321299, 'max_features': 0.9997053648388251}. Best is trial 241 with value: 0.7773840258827056.[0m
[32m[I 2022-04-13 12:40:22,935][0m Trial 967 finished with value: 0.7731619837116147 and parameters: {'splitter': 'best', 'min_samples_split': 0.10325680064608524, 'min_samples_leaf': 0.010423800600769542, 'min_weight_fraction_leaf': 0.019649785916094273, 'max_features': 0.9807202519596621}. Best is trial 241 with value: 0.7773840258827056.[0m
[32m[I 2022-04-13 12:40:25,649][0m Trial 968 finished with value: 0.7664913355270987 and parameters: {'splitter': 'best', 'min_samples_split': 0.08287233993810007, 'min_samples_leaf': 0.02230308685956498, 'min_weight_fraction_leaf': 0.05647433365391215, 'max_features': 0.9648134926997332}. Best is trial 241 with value: 0.7773840258827056.[0m
[32m[I 2022-04-13 12:40:28,136][0m Trial 969 finished with value: 0.7728397425307536 and parameters: {'splitter': 'best', 'min_samples_split': 0.10951931517457714, 'min_samples_leaf': 0.0012062455018679006, 'min_weight_fraction_leaf': 0.02615223523599045, 'max_features': 0.9832409941877274}. Best is trial 241 with value: 0.7773840258827056.[0m
[32m[I 2022-04-13 12:40:29,138][0m Trial 970 finished with value: 0.7666866550022338 and parameters: {'splitter': 'best', 'min_samples_split': 0.035525448147993875, 'min_samples_leaf': 0.02099698277721397, 'min_weight_fraction_leaf': 0.040666836399642727, 'max_features': 0.9452144416299624}. Best is trial 241 with value: 0.7773840258827056.[0m
[32m[I 2022-04-13 12:40:30,366][0m Trial 971 finished with value: 0.7642494894171297 and parameters: {'splitter': 'best', 'min_samples_split': 0.09702159213162416, 'min_samples_leaf': 0.002164002097297992, 'min_weight_fraction_leaf': 0.03308885268468632, 'max_features': 0.9660679308643176}. Best is trial 241 with value: 0.7773840258827056.[0m
[32m[I 2022-04-13 12:40:33,363][0m Trial 972 finished with value: 0.7731408987635284 and parameters: {'splitter': 'best', 'min_samples_split': 0.1151744819113253, 'min_samples_leaf': 0.014711581011972076, 'min_weight_fraction_leaf': 0.04638320216044172, 'max_features': 0.9995951829334443}. Best is trial 241 with value: 0.7773840258827056.[0m
[32m[I 2022-04-13 12:40:33,873][0m Trial 973 finished with value: 0.590968215891156 and parameters: {'splitter': 'best', 'min_samples_split': 0.10684047050943399, 'min_samples_leaf': 0.024490463917760788, 'min_weight_fraction_leaf': 0.3633590608721252, 'max_features': 0.9245866318222188}. Best is trial 241 with value: 0.7773840258827056.[0m
[32m[I 2022-04-13 12:40:34,705][0m Trial 974 finished with value: 0.7629825742433654 and parameters: {'splitter': 'best', 'min_samples_split': 0.12475809414489973, 'min_samples_leaf': 0.011209386579619486, 'min_weight_fraction_leaf': 0.06376136612590909, 'max_features': 0.7725018154631648}. Best is trial 241 with value: 0.7773840258827056.[0m
[32m[I 2022-04-13 12:40:35,819][0m Trial 975 finished with value: 0.7642798364072021 and parameters: {'splitter': 'best', 'min_samples_split': 0.07235026092945385, 'min_samples_leaf': 0.0011257798245391465, 'min_weight_fraction_leaf': 0.016424234291787326, 'max_features': 0.9817135364069852}. Best is trial 241 with value: 0.7773840258827056.[0m
[32m[I 2022-04-13 12:40:37,260][0m Trial 976 finished with value: 0.7638581989667245 and parameters: {'splitter': 'best', 'min_samples_split': 0.11281636617007063, 'min_samples_leaf': 0.02649477257730873, 'min_weight_fraction_leaf': 0.029429135985282833, 'max_features': 0.9046435996576104}. Best is trial 241 with value: 0.7773840258827056.[0m
[32m[I 2022-04-13 12:40:38,282][0m Trial 977 finished with value: 0.6743624146605087 and parameters: {'splitter': 'best', 'min_samples_split': 0.21636424725242104, 'min_samples_leaf': 0.31272229504871785, 'min_weight_fraction_leaf': 0.04075427868023058, 'max_features': 0.9996091583767693}. Best is trial 241 with value: 0.7773840258827056.[0m
[32m[I 2022-04-13 12:40:39,961][0m Trial 978 finished with value: 0.7700765148137712 and parameters: {'splitter': 'best', 'min_samples_split': 0.054191368491115846, 'min_samples_leaf': 0.02515774210063847, 'min_weight_fraction_leaf': 0.008193659437605175, 'max_features': 0.9634659820225318}. Best is trial 241 with value: 0.7773840258827056.[0m
[32m[I 2022-04-13 12:40:43,060][0m Trial 979 finished with value: 0.7579755357200259 and parameters: {'splitter': 'best', 'min_samples_split': 0.09853784215495924, 'min_samples_leaf': 0.014217877538474087, 'min_weight_fraction_leaf': 0.08378774617122572, 'max_features': 0.9454262467141903}. Best is trial 241 with value: 0.7773840258827056.[0m
[32m[I 2022-04-13 12:40:43,370][0m Trial 980 finished with value: 0.7346523103213889 and parameters: {'splitter': 'random', 'min_samples_split': 0.131505030806592, 'min_samples_leaf': 0.02302925002838361, 'min_weight_fraction_leaf': 0.0522327135344379, 'max_features': 0.980954595275323}. Best is trial 241 with value: 0.7773840258827056.[0m
[32m[I 2022-04-13 12:40:44,210][0m Trial 981 finished with value: 0.5962864358175997 and parameters: {'splitter': 'best', 'min_samples_split': 0.12154491925705198, 'min_samples_leaf': 0.01428692835103698, 'min_weight_fraction_leaf': 0.4784773836975337, 'max_features': 0.9682562373486401}. Best is trial 241 with value: 0.7773840258827056.[0m
[32m[I 2022-04-13 12:40:46,556][0m Trial 982 finished with value: 0.7713131013566003 and parameters: {'splitter': 'best', 'min_samples_split': 0.10658119000001151, 'min_samples_leaf': 0.02702753293030687, 'min_weight_fraction_leaf': 0.021557734259394865, 'max_features': 0.9785095959062612}. Best is trial 241 with value: 0.7773840258827056.[0m
[32m[I 2022-04-13 12:40:48,120][0m Trial 983 finished with value: 0.7637491271780353 and parameters: {'splitter': 'best', 'min_samples_split': 0.14736569043369713, 'min_samples_leaf': 0.010682563574157478, 'min_weight_fraction_leaf': 0.03427264786511029, 'max_features': 0.9521305821128053}. Best is trial 241 with value: 0.7773840258827056.[0m
[32m[I 2022-04-13 12:40:50,318][0m Trial 984 finished with value: 0.7730597517192981 and parameters: {'splitter': 'best', 'min_samples_split': 0.12323724509430492, 'min_samples_leaf': 0.025972051247721416, 'min_weight_fraction_leaf': 0.02358174770644717, 'max_features': 0.9801592007633139}. Best is trial 241 with value: 0.7773840258827056.[0m
[32m[I 2022-04-13 12:40:50,849][0m Trial 985 finished with value: 0.7113383882493189 and parameters: {'splitter': 'best', 'min_samples_split': 0.08506640534561105, 'min_samples_leaf': 0.1965586385645246, 'min_weight_fraction_leaf': 0.15133949659430687, 'max_features': 0.9302257076365213}. Best is trial 241 with value: 0.7773840258827056.[0m
[32m[I 2022-04-13 12:40:52,943][0m Trial 986 finished with value: 0.7738410532465567 and parameters: {'splitter': 'best', 'min_samples_split': 0.13828919031162443, 'min_samples_leaf': 0.018135216906448343, 'min_weight_fraction_leaf': 0.01330876805793855, 'max_features': 0.9999301999007518}. Best is trial 241 with value: 0.7773840258827056.[0m
[32m[I 2022-04-13 12:40:53,072][0m Trial 987 finished with value: 0.5 and parameters: {'splitter': 'best', 'min_samples_split': 0.11361912624556782, 'min_samples_leaf': 0.497552208842335, 'min_weight_fraction_leaf': 1.3833071346964348e-05, 'max_features': 0.32745520527553285}. Best is trial 241 with value: 0.7773840258827056.[0m
[32m[I 2022-04-13 12:40:54,616][0m Trial 988 finished with value: 0.7718124659782518 and parameters: {'splitter': 'best', 'min_samples_split': 0.09623006932979428, 'min_samples_leaf': 0.029194516021441255, 'min_weight_fraction_leaf': 0.04724311533099024, 'max_features': 0.9999232747007821}. Best is trial 241 with value: 0.7773840258827056.[0m
[32m[I 2022-04-13 12:40:57,616][0m Trial 989 finished with value: 0.7674897500658444 and parameters: {'splitter': 'best', 'min_samples_split': 0.12657794320463753, 'min_samples_leaf': 0.0021612575898667177, 'min_weight_fraction_leaf': 0.03628329573848132, 'max_features': 0.9559866013927707}. Best is trial 241 with value: 0.7773840258827056.[0m
[32m[I 2022-04-13 12:40:58,379][0m Trial 990 finished with value: 0.7654490288419997 and parameters: {'splitter': 'best', 'min_samples_split': 0.15843499736581437, 'min_samples_leaf': 0.001178388019494228, 'min_weight_fraction_leaf': 0.06655356293471716, 'max_features': 0.8513979910276547}. Best is trial 241 with value: 0.7773840258827056.[0m
[32m[I 2022-04-13 12:40:59,450][0m Trial 991 finished with value: 0.7737997647017326 and parameters: {'splitter': 'best', 'min_samples_split': 0.06156740996287105, 'min_samples_leaf': 0.017513652552062716, 'min_weight_fraction_leaf': 0.024799740197089682, 'max_features': 0.9809155911480913}. Best is trial 241 with value: 0.7773840258827056.[0m
[32m[I 2022-04-13 12:41:00,459][0m Trial 992 finished with value: 0.7670080245142834 and parameters: {'splitter': 'best', 'min_samples_split': 0.10727607173814144, 'min_samples_leaf': 0.026601285701246275, 'min_weight_fraction_leaf': 0.04264205838664398, 'max_features': 0.9653552123483876}. Best is trial 241 with value: 0.7773840258827056.[0m
[32m[I 2022-04-13 12:41:00,852][0m Trial 993 finished with value: 0.6153041429812699 and parameters: {'splitter': 'best', 'min_samples_split': 0.13575938046577746, 'min_samples_leaf': 0.29887132619213236, 'min_weight_fraction_leaf': 0.055612909946492116, 'max_features': 0.9427752657406221}. Best is trial 241 with value: 0.7773840258827056.[0m
[32m[I 2022-04-13 12:41:02,093][0m Trial 994 finished with value: 0.7674445332960907 and parameters: {'splitter': 'best', 'min_samples_split': 0.11716717480241914, 'min_samples_leaf': 0.01156499442776459, 'min_weight_fraction_leaf': 0.016162513434082617, 'max_features': 0.9810307463234796}. Best is trial 241 with value: 0.7773840258827056.[0m
[32m[I 2022-04-13 12:41:04,416][0m Trial 995 finished with value: 0.768660246842026 and parameters: {'splitter': 'best', 'min_samples_split': 0.10047117013163029, 'min_samples_leaf': 0.029763538475029945, 'min_weight_fraction_leaf': 0.03509258452612949, 'max_features': 0.9613054770740449}. Best is trial 241 with value: 0.7773840258827056.[0m
[32m[I 2022-04-13 12:41:06,347][0m Trial 996 finished with value: 0.7571132026283898 and parameters: {'splitter': 'best', 'min_samples_split': 0.12927837808443104, 'min_samples_leaf': 0.11203118377131366, 'min_weight_fraction_leaf': 0.022005254533711535, 'max_features': 0.9766037509938831}. Best is trial 241 with value: 0.7773840258827056.[0m
[32m[I 2022-04-13 12:41:07,707][0m Trial 997 finished with value: 0.7603616500077169 and parameters: {'splitter': 'best', 'min_samples_split': 0.14519352731804536, 'min_samples_leaf': 0.1336079283782215, 'min_weight_fraction_leaf': 0.008504085324260408, 'max_features': 0.9827111353823014}. Best is trial 241 with value: 0.7773840258827056.[0m
[32m[I 2022-04-13 12:41:09,595][0m Trial 998 finished with value: 0.7674062555968251 and parameters: {'splitter': 'best', 'min_samples_split': 0.012093947229668722, 'min_samples_leaf': 0.01852877609092239, 'min_weight_fraction_leaf': 0.031572022616004655, 'max_features': 0.9995403589671614}. Best is trial 241 with value: 0.7773840258827056.[0m
[32m[I 2022-04-13 12:41:10,048][0m Trial 999 finished with value: 0.7525999047406261 and parameters: {'splitter': 'random', 'min_samples_split': 0.11688737904368397, 'min_samples_leaf': 0.028531916277331294, 'min_weight_fraction_leaf': 0.04861579606448804, 'max_features': 0.9354786046947179}. Best is trial 241 with value: 0.7773840258827056.[0m
SurvivalTree
Running Optimizer with LogRank binary scoring
{'splitter': 'best', 'min_samples_split': 0.1137811469951, 'min_samples_leaf': 0.026573332975240317, 'min_weight_fraction_leaf': 0.043648303940224134, 'max_features': 0.9988509294918843, 'UnoC_LR': 0.8888507593246218}
Running Optimizer normaly
{'splitter': 'best', 'min_samples_split': 0.12029135864431753, 'min_samples_leaf': 0.044175924193285254, 'min_weight_fraction_leaf': 0.037131083511610485, 'max_features': 0.9801713980264842, 'UnoC': 0.7773840258827056}
