[32m[I 2022-04-13 11:55:21,923][0m Trial 469 finished with value: 0.8876799465766639 and parameters: {'splitter': 'best', 'min_samples_split': 0.11346255961225968, 'min_samples_leaf': 0.03495556812626002, 'min_weight_fraction_leaf': 0.01677876497834894, 'max_features': 0.9853238735686985}. Best is trial 448 with value: 0.8888507593246218.[0m
[32m[I 2022-04-13 11:55:23,274][0m Trial 470 finished with value: 0.7509963310260819 and parameters: {'splitter': 'best', 'min_samples_split': 0.09578765830345169, 'min_samples_leaf': 0.048683670180647565, 'min_weight_fraction_leaf': 0.006794777409723972, 'max_features': 0.2844622691722126}. Best is trial 448 with value: 0.8888507593246218.[0m
/media/san2_ssd/data/Workdir/survival/utils.py:305: RuntimeWarning: invalid value encountered in true_divide
  pdfs = np.gradient(1-survs,axis=1)/norms
/media/san2_ssd/data/Workdir/survival/utils.py:305: RuntimeWarning: invalid value encountered in true_divide
  pdfs = np.gradient(1-survs,axis=1)/norms
/media/san2_ssd/data/Workdir/survival/utils.py:305: RuntimeWarning: invalid value encountered in true_divide
  pdfs = np.gradient(1-survs,axis=1)/norms
/media/san2_ssd/data/Workdir/survival/utils.py:305: RuntimeWarning: invalid value encountered in true_divide
  pdfs = np.gradient(1-survs,axis=1)/norms
[32m[I 2022-04-13 11:55:25,587][0m Trial 471 finished with value: 0.8874898788573005 and parameters: {'splitter': 'best', 'min_samples_split': 0.11268581193320369, 'min_samples_leaf': 0.03736422012350479, 'min_weight_fraction_leaf': 0.011678539825900119, 'max_features': 0.9834674814438872}. Best is trial 448 with value: 0.8888507593246218.[0m
[32m[I 2022-04-13 11:55:27,207][0m Trial 472 finished with value: 0.8841083146958276 and parameters: {'splitter': 'best', 'min_samples_split': 0.10307626713112066, 'min_samples_leaf': 0.06632943353346211, 'min_weight_fraction_leaf': 0.0097415368907347, 'max_features': 0.9998853548309731}. Best is trial 448 with value: 0.8888507593246218.[0m
/media/san2_ssd/data/Workdir/survival/utils.py:305: RuntimeWarning: invalid value encountered in true_divide
  pdfs = np.gradient(1-survs,axis=1)/norms
/media/san2_ssd/data/Workdir/survival/utils.py:305: RuntimeWarning: invalid value encountered in true_divide
  pdfs = np.gradient(1-survs,axis=1)/norms
/media/san2_ssd/data/Workdir/survival/utils.py:305: RuntimeWarning: invalid value encountered in true_divide
  pdfs = np.gradient(1-survs,axis=1)/norms
/media/san2_ssd/data/Workdir/survival/utils.py:305: RuntimeWarning: invalid value encountered in true_divide
  pdfs = np.gradient(1-survs,axis=1)/norms
[32m[I 2022-04-13 11:55:29,029][0m Trial 473 finished with value: 0.8888481322092098 and parameters: {'splitter': 'best', 'min_samples_split': 0.09195094515312502, 'min_samples_leaf': 0.044494777696099636, 'min_weight_fraction_leaf': 0.016141663737938836, 'max_features': 0.9826239906576475}. Best is trial 448 with value: 0.8888507593246218.[0m
[32m[I 2022-04-13 11:55:29,460][0m Trial 474 finished with value: 0.7550552672639754 and parameters: {'splitter': 'best', 'min_samples_split': 0.07992410115063038, 'min_samples_leaf': 0.06026941140754109, 'min_weight_fraction_leaf': 0.007628938397512639, 'max_features': 0.24728593473677357}. Best is trial 448 with value: 0.8888507593246218.[0m
/media/san2_ssd/data/Workdir/survival/utils.py:305: RuntimeWarning: invalid value encountered in true_divide
  pdfs = np.gradient(1-survs,axis=1)/norms
/media/san2_ssd/data/Workdir/survival/utils.py:305: RuntimeWarning: invalid value encountered in true_divide
  pdfs = np.gradient(1-survs,axis=1)/norms
/media/san2_ssd/data/Workdir/survival/utils.py:305: RuntimeWarning: invalid value encountered in true_divide
  pdfs = np.gradient(1-survs,axis=1)/norms
[32m[I 2022-04-13 11:55:30,680][0m Trial 475 finished with value: 0.8854690605133584 and parameters: {'splitter': 'best', 'min_samples_split': 0.08706779011422418, 'min_samples_leaf': 0.051376057027638644, 'min_weight_fraction_leaf': 0.014654726898602905, 'max_features': 0.981979289768927}. Best is trial 448 with value: 0.8888507593246218.[0m
/media/san2_ssd/data/Workdir/survival/utils.py:305: RuntimeWarning: invalid value encountered in true_divide
  pdfs = np.gradient(1-survs,axis=1)/norms
/media/san2_ssd/data/Workdir/survival/utils.py:305: RuntimeWarning: invalid value encountered in true_divide
  pdfs = np.gradient(1-survs,axis=1)/norms
[32m[I 2022-04-13 11:55:31,842][0m Trial 476 finished with value: 0.8739246542291857 and parameters: {'splitter': 'best', 'min_samples_split': 0.09346839067600926, 'min_samples_leaf': 0.04273563074875219, 'min_weight_fraction_leaf': 1.0729190882460132e-05, 'max_features': 0.6924673246720381}. Best is trial 448 with value: 0.8888507593246218.[0m
[32m[I 2022-04-13 11:55:32,981][0m Trial 477 finished with value: 0.7856273713682678 and parameters: {'splitter': 'best', 'min_samples_split': 0.08748530514685689, 'min_samples_leaf': 0.0778600665058222, 'min_weight_fraction_leaf': 0.019457120446210976, 'max_features': 0.9993701751662202}. Best is trial 448 with value: 0.8888507593246218.[0m
/media/san2_ssd/data/Workdir/survival/utils.py:305: RuntimeWarning: invalid value encountered in true_divide
  pdfs = np.gradient(1-survs,axis=1)/norms
/media/san2_ssd/data/Workdir/survival/utils.py:305: RuntimeWarning: invalid value encountered in true_divide
  pdfs = np.gradient(1-survs,axis=1)/norms
[32m[I 2022-04-13 11:55:35,805][0m Trial 478 finished with value: 0.8817947068275555 and parameters: {'splitter': 'best', 'min_samples_split': 0.07308462072970298, 'min_samples_leaf': 0.036438398631760356, 'min_weight_fraction_leaf': 0.010014461593211515, 'max_features': 0.7734031043723243}. Best is trial 448 with value: 0.8888507593246218.[0m
/media/san2_ssd/data/Workdir/survival/utils.py:305: RuntimeWarning: invalid value encountered in true_divide
  pdfs = np.gradient(1-survs,axis=1)/norms
/media/san2_ssd/data/Workdir/survival/utils.py:305: RuntimeWarning: invalid value encountered in true_divide
  pdfs = np.gradient(1-survs,axis=1)/norms
/media/san2_ssd/data/Workdir/survival/utils.py:305: RuntimeWarning: invalid value encountered in true_divide
  pdfs = np.gradient(1-survs,axis=1)/norms
[32m[I 2022-04-13 11:55:37,543][0m Trial 479 finished with value: 0.8846714363127945 and parameters: {'splitter': 'best', 'min_samples_split': 0.10569579181786289, 'min_samples_leaf': 0.04879544515150028, 'min_weight_fraction_leaf': 0.019291635685443773, 'max_features': 0.9577922657997016}. Best is trial 448 with value: 0.8888507593246218.[0m
/media/san2_ssd/data/Workdir/survival/utils.py:305: RuntimeWarning: invalid value encountered in true_divide
  pdfs = np.gradient(1-survs,axis=1)/norms
/media/san2_ssd/data/Workdir/survival/utils.py:305: RuntimeWarning: invalid value encountered in true_divide
  pdfs = np.gradient(1-survs,axis=1)/norms
/media/san2_ssd/data/Workdir/survival/utils.py:305: RuntimeWarning: invalid value encountered in true_divide
  pdfs = np.gradient(1-survs,axis=1)/norms
/media/san2_ssd/data/Workdir/survival/utils.py:305: RuntimeWarning: invalid value encountered in true_divide
  pdfs = np.gradient(1-survs,axis=1)/norms
[32m[I 2022-04-13 11:55:40,733][0m Trial 480 finished with value: 0.8834763961517054 and parameters: {'splitter': 'best', 'min_samples_split': 0.09882892256449409, 'min_samples_leaf': 0.03274438599073718, 'min_weight_fraction_leaf': 0.00031641574753514534, 'max_features': 0.9670986551753732}. Best is trial 448 with value: 0.8888507593246218.[0m
/media/san2_ssd/data/Workdir/survival/utils.py:305: RuntimeWarning: invalid value encountered in true_divide
  pdfs = np.gradient(1-survs,axis=1)/norms
/media/san2_ssd/data/Workdir/survival/utils.py:305: RuntimeWarning: invalid value encountered in true_divide
  pdfs = np.gradient(1-survs,axis=1)/norms
/media/san2_ssd/data/Workdir/survival/utils.py:305: RuntimeWarning: invalid value encountered in true_divide
  pdfs = np.gradient(1-survs,axis=1)/norms
/media/san2_ssd/data/Workdir/survival/utils.py:305: RuntimeWarning: invalid value encountered in true_divide
  pdfs = np.gradient(1-survs,axis=1)/norms
[32m[I 2022-04-13 11:55:42,568][0m Trial 481 finished with value: 0.8878050728238328 and parameters: {'splitter': 'best', 'min_samples_split': 0.11167488347774131, 'min_samples_leaf': 0.04230605719162749, 'min_weight_fraction_leaf': 0.021133084308256854, 'max_features': 0.9998797718748936}. Best is trial 448 with value: 0.8888507593246218.[0m
[32m[I 2022-04-13 11:55:42,804][0m Trial 482 finished with value: 0.7182800883297926 and parameters: {'splitter': 'best', 'min_samples_split': 0.09523017347889103, 'min_samples_leaf': 0.05055304721102936, 'min_weight_fraction_leaf': 0.015053994448070148, 'max_features': 0.1437671280813802}. Best is trial 448 with value: 0.8888507593246218.[0m
[32m[I 2022-04-13 11:55:45,370][0m Trial 483 finished with value: 0.8836337092072725 and parameters: {'splitter': 'best', 'min_samples_split': 0.11171107312161943, 'min_samples_leaf': 0.06949521001775996, 'min_weight_fraction_leaf': 0.026461150592101607, 'max_features': 0.9336666124609649}. Best is trial 448 with value: 0.8888507593246218.[0m
/media/san2_ssd/data/Workdir/survival/utils.py:305: RuntimeWarning: invalid value encountered in true_divide
  pdfs = np.gradient(1-survs,axis=1)/norms
[32m[I 2022-04-13 11:55:46,833][0m Trial 484 finished with value: 0.8857694580205372 and parameters: {'splitter': 'best', 'min_samples_split': 0.0790804258560752, 'min_samples_leaf': 0.06093137830448733, 'min_weight_fraction_leaf': 0.03213784460505013, 'max_features': 0.9818408580511985}. Best is trial 448 with value: 0.8888507593246218.[0m
/media/san2_ssd/data/Workdir/survival/utils.py:305: RuntimeWarning: invalid value encountered in true_divide
  pdfs = np.gradient(1-survs,axis=1)/norms
/media/san2_ssd/data/Workdir/survival/utils.py:305: RuntimeWarning: invalid value encountered in true_divide
  pdfs = np.gradient(1-survs,axis=1)/norms
/media/san2_ssd/data/Workdir/survival/utils.py:305: RuntimeWarning: invalid value encountered in true_divide
  pdfs = np.gradient(1-survs,axis=1)/norms
/media/san2_ssd/data/Workdir/survival/utils.py:305: RuntimeWarning: invalid value encountered in true_divide
  pdfs = np.gradient(1-survs,axis=1)/norms
/media/san2_ssd/data/Workdir/survival/utils.py:305: RuntimeWarning: invalid value encountered in true_divide
  pdfs = np.gradient(1-survs,axis=1)/norms
[32m[I 2022-04-13 11:55:48,029][0m Trial 485 finished with value: 0.8853876301108647 and parameters: {'splitter': 'best', 'min_samples_split': 0.11037041997052428, 'min_samples_leaf': 0.042308908431292695, 'min_weight_fraction_leaf': 0.014610010758713723, 'max_features': 0.9509344038360009}. Best is trial 448 with value: 0.8888507593246218.[0m
[32m[I 2022-04-13 11:55:48,251][0m Trial 486 finished with value: 0.7476085189081766 and parameters: {'splitter': 'random', 'min_samples_split': 0.10035454217057527, 'min_samples_leaf': 0.03829093452851881, 'min_weight_fraction_leaf': 0.20082858402908343, 'max_features': 0.9808747338942397}. Best is trial 448 with value: 0.8888507593246218.[0m
[32m[I 2022-04-13 11:55:48,612][0m Trial 487 finished with value: 0.6965020065742571 and parameters: {'splitter': 'best', 'min_samples_split': 0.08892349192021218, 'min_samples_leaf': 0.3448205467748624, 'min_weight_fraction_leaf': 0.031801999836818334, 'max_features': 0.9611407494629184}. Best is trial 448 with value: 0.8888507593246218.[0m
/media/san2_ssd/data/Workdir/survival/utils.py:305: RuntimeWarning: invalid value encountered in true_divide
  pdfs = np.gradient(1-survs,axis=1)/norms
/media/san2_ssd/data/Workdir/survival/utils.py:305: RuntimeWarning: invalid value encountered in true_divide
  pdfs = np.gradient(1-survs,axis=1)/norms
[32m[I 2022-04-13 11:55:50,019][0m Trial 488 finished with value: 0.8821059634336141 and parameters: {'splitter': 'best', 'min_samples_split': 0.11280687780770438, 'min_samples_leaf': 0.05450627606095135, 'min_weight_fraction_leaf': 0.01029449973523469, 'max_features': 0.9209451130497579}. Best is trial 448 with value: 0.8888507593246218.[0m
/media/san2_ssd/data/Workdir/survival/utils.py:305: RuntimeWarning: invalid value encountered in true_divide
  pdfs = np.gradient(1-survs,axis=1)/norms
[32m[I 2022-04-13 11:55:51,360][0m Trial 489 finished with value: 0.7791334492823889 and parameters: {'splitter': 'best', 'min_samples_split': 0.10333156065502393, 'min_samples_leaf': 0.01877780318077822, 'min_weight_fraction_leaf': 0.019819282299365144, 'max_features': 0.5760381777304674}. Best is trial 448 with value: 0.8888507593246218.[0m
/media/san2_ssd/data/Workdir/survival/utils.py:305: RuntimeWarning: invalid value encountered in true_divide
  pdfs = np.gradient(1-survs,axis=1)/norms
/media/san2_ssd/data/Workdir/survival/utils.py:305: RuntimeWarning: invalid value encountered in true_divide
  pdfs = np.gradient(1-survs,axis=1)/norms
/media/san2_ssd/data/Workdir/survival/utils.py:305: RuntimeWarning: invalid value encountered in true_divide
  pdfs = np.gradient(1-survs,axis=1)/norms
/media/san2_ssd/data/Workdir/survival/utils.py:305: RuntimeWarning: invalid value encountered in true_divide
  pdfs = np.gradient(1-survs,axis=1)/norms
[32m[I 2022-04-13 11:55:53,583][0m Trial 490 finished with value: 0.8875203092184449 and parameters: {'splitter': 'best', 'min_samples_split': 0.11852076491167562, 'min_samples_leaf': 0.02345818685131486, 'min_weight_fraction_leaf': 0.03684369760495484, 'max_features': 0.9828607625620779}. Best is trial 448 with value: 0.8888507593246218.[0m
/media/san2_ssd/data/Workdir/survival/utils.py:305: RuntimeWarning: invalid value encountered in true_divide
  pdfs = np.gradient(1-survs,axis=1)/norms
/media/san2_ssd/data/Workdir/survival/utils.py:305: RuntimeWarning: invalid value encountered in true_divide
  pdfs = np.gradient(1-survs,axis=1)/norms
/media/san2_ssd/data/Workdir/survival/utils.py:305: RuntimeWarning: invalid value encountered in true_divide
  pdfs = np.gradient(1-survs,axis=1)/norms
/media/san2_ssd/data/Workdir/survival/utils.py:305: RuntimeWarning: invalid value encountered in true_divide
  pdfs = np.gradient(1-survs,axis=1)/norms
/media/san2_ssd/data/Workdir/survival/utils.py:305: RuntimeWarning: invalid value encountered in true_divide
  pdfs = np.gradient(1-survs,axis=1)/norms
[32m[I 2022-04-13 11:55:55,617][0m Trial 491 finished with value: 0.8854213927293182 and parameters: {'splitter': 'best', 'min_samples_split': 0.11466808050504836, 'min_samples_leaf': 0.008752042103308254, 'min_weight_fraction_leaf': 0.04108108113575042, 'max_features': 0.9411185323372725}. Best is trial 448 with value: 0.8888507593246218.[0m
/media/san2_ssd/data/Workdir/survival/utils.py:305: RuntimeWarning: invalid value encountered in true_divide
  pdfs = np.gradient(1-survs,axis=1)/norms
/media/san2_ssd/data/Workdir/survival/utils.py:305: RuntimeWarning: invalid value encountered in true_divide
  pdfs = np.gradient(1-survs,axis=1)/norms
/media/san2_ssd/data/Workdir/survival/utils.py:305: RuntimeWarning: invalid value encountered in true_divide
  pdfs = np.gradient(1-survs,axis=1)/norms
[32m[I 2022-04-13 11:55:57,394][0m Trial 492 finished with value: 0.8849458687229605 and parameters: {'splitter': 'best', 'min_samples_split': 0.09529197153066046, 'min_samples_leaf': 0.02153169077680573, 'min_weight_fraction_leaf': 0.04952172878624478, 'max_features': 0.9653963287807276}. Best is trial 448 with value: 0.8888507593246218.[0m
[32m[I 2022-04-13 11:55:58,794][0m Trial 493 finished with value: 0.784449894978656 and parameters: {'splitter': 'best', 'min_samples_split': 0.12310934171972379, 'min_samples_leaf': 0.012270420392362818, 'min_weight_fraction_leaf': 0.07271764053748785, 'max_features': 0.9840804856742291}. Best is trial 448 with value: 0.8888507593246218.[0m
/media/san2_ssd/data/Workdir/survival/utils.py:305: RuntimeWarning: invalid value encountered in true_divide
  pdfs = np.gradient(1-survs,axis=1)/norms
/media/san2_ssd/data/Workdir/survival/utils.py:305: RuntimeWarning: invalid value encountered in true_divide
  pdfs = np.gradient(1-survs,axis=1)/norms
/media/san2_ssd/data/Workdir/survival/utils.py:305: RuntimeWarning: invalid value encountered in true_divide
  pdfs = np.gradient(1-survs,axis=1)/norms
/media/san2_ssd/data/Workdir/survival/utils.py:305: RuntimeWarning: invalid value encountered in true_divide
  pdfs = np.gradient(1-survs,axis=1)/norms
/media/san2_ssd/data/Workdir/survival/utils.py:305: RuntimeWarning: invalid value encountered in true_divide
  pdfs = np.gradient(1-survs,axis=1)/norms
[32m[I 2022-04-13 11:55:59,905][0m Trial 494 finished with value: 0.883157315735108 and parameters: {'splitter': 'best', 'min_samples_split': 0.06614541041352495, 'min_samples_leaf': 0.025153250669592987, 'min_weight_fraction_leaf': 0.03551772601744358, 'max_features': 0.9475844857280384}. Best is trial 448 with value: 0.8888507593246218.[0m
/media/san2_ssd/data/Workdir/survival/utils.py:305: RuntimeWarning: invalid value encountered in true_divide
  pdfs = np.gradient(1-survs,axis=1)/norms
/media/san2_ssd/data/Workdir/survival/utils.py:305: RuntimeWarning: invalid value encountered in true_divide
  pdfs = np.gradient(1-survs,axis=1)/norms
[32m[I 2022-04-13 11:56:01,297][0m Trial 495 finished with value: 0.8809134993279691 and parameters: {'splitter': 'best', 'min_samples_split': 0.10135052243392, 'min_samples_leaf': 0.04356847689475235, 'min_weight_fraction_leaf': 0.06004009227820432, 'max_features': 0.9677276718445736}. Best is trial 448 with value: 0.8888507593246218.[0m
/media/san2_ssd/data/Workdir/survival/utils.py:305: RuntimeWarning: invalid value encountered in true_divide
  pdfs = np.gradient(1-survs,axis=1)/norms
/media/san2_ssd/data/Workdir/survival/utils.py:305: RuntimeWarning: invalid value encountered in true_divide
  pdfs = np.gradient(1-survs,axis=1)/norms
/media/san2_ssd/data/Workdir/survival/utils.py:305: RuntimeWarning: invalid value encountered in true_divide
  pdfs = np.gradient(1-survs,axis=1)/norms
/media/san2_ssd/data/Workdir/survival/utils.py:305: RuntimeWarning: invalid value encountered in true_divide
  pdfs = np.gradient(1-survs,axis=1)/norms
[32m[I 2022-04-13 11:56:03,162][0m Trial 496 finished with value: 0.8864770463531247 and parameters: {'splitter': 'best', 'min_samples_split': 0.08608272137917616, 'min_samples_leaf': 0.001464833146896917, 'min_weight_fraction_leaf': 0.043412121968579666, 'max_features': 0.9814633334924271}. Best is trial 448 with value: 0.8888507593246218.[0m
/media/san2_ssd/data/Workdir/survival/utils.py:305: RuntimeWarning: invalid value encountered in true_divide
  pdfs = np.gradient(1-survs,axis=1)/norms
/media/san2_ssd/data/Workdir/survival/utils.py:305: RuntimeWarning: invalid value encountered in true_divide
  pdfs = np.gradient(1-survs,axis=1)/norms
/media/san2_ssd/data/Workdir/survival/utils.py:305: RuntimeWarning: invalid value encountered in true_divide
  pdfs = np.gradient(1-survs,axis=1)/norms
/media/san2_ssd/data/Workdir/survival/utils.py:305: RuntimeWarning: invalid value encountered in true_divide
  pdfs = np.gradient(1-survs,axis=1)/norms
[32m[I 2022-04-13 11:56:05,459][0m Trial 497 finished with value: 0.8874677187690981 and parameters: {'splitter': 'best', 'min_samples_split': 0.10975888107781169, 'min_samples_leaf': 0.03612186816691248, 'min_weight_fraction_leaf': 0.027047457726519186, 'max_features': 0.9996790251403846}. Best is trial 448 with value: 0.8888507593246218.[0m
/media/san2_ssd/data/Workdir/survival/utils.py:305: RuntimeWarning: invalid value encountered in true_divide
  pdfs = np.gradient(1-survs,axis=1)/norms
/media/san2_ssd/data/Workdir/survival/utils.py:305: RuntimeWarning: invalid value encountered in true_divide
  pdfs = np.gradient(1-survs,axis=1)/norms
/media/san2_ssd/data/Workdir/survival/utils.py:305: RuntimeWarning: invalid value encountered in true_divide
  pdfs = np.gradient(1-survs,axis=1)/norms
/media/san2_ssd/data/Workdir/survival/utils.py:305: RuntimeWarning: invalid value encountered in true_divide
  pdfs = np.gradient(1-survs,axis=1)/norms
[32m[I 2022-04-13 11:56:09,224][0m Trial 498 finished with value: 0.8833256379407924 and parameters: {'splitter': 'best', 'min_samples_split': 0.10508046307984277, 'min_samples_leaf': 0.01620535864049203, 'min_weight_fraction_leaf': 0.021664570333217142, 'max_features': 0.9662493376118682}. Best is trial 448 with value: 0.8888507593246218.[0m
/media/san2_ssd/data/Workdir/survival/utils.py:305: RuntimeWarning: invalid value encountered in true_divide
  pdfs = np.gradient(1-survs,axis=1)/norms
/media/san2_ssd/data/Workdir/survival/utils.py:305: RuntimeWarning: invalid value encountered in true_divide
  pdfs = np.gradient(1-survs,axis=1)/norms
/media/san2_ssd/data/Workdir/survival/utils.py:305: RuntimeWarning: invalid value encountered in true_divide
  pdfs = np.gradient(1-survs,axis=1)/norms
[32m[I 2022-04-13 11:56:12,102][0m Trial 499 finished with value: 0.8819903394782826 and parameters: {'splitter': 'best', 'min_samples_split': 0.11188117977422081, 'min_samples_leaf': 0.03216697898515509, 'min_weight_fraction_leaf': 0.008114485391213122, 'max_features': 0.9109452915002614}. Best is trial 448 with value: 0.8888507593246218.[0m
