[32m[I 2022-04-13 12:36:03,989][0m Trial 827 finished with value: 0.7678712518003701 and parameters: {'splitter': 'best', 'min_samples_split': 0.1113389757568865, 'min_samples_leaf': 0.027502126569805434, 'min_weight_fraction_leaf': 0.0669182227267124, 'max_features': 0.9489993650528823}. Best is trial 241 with value: 0.7773840258827056.[0m
[32m[I 2022-04-13 12:36:04,685][0m Trial 828 finished with value: 0.7486898580143745 and parameters: {'splitter': 'best', 'min_samples_split': 0.12961575529095076, 'min_samples_leaf': 0.009231884627007407, 'min_weight_fraction_leaf': 0.009135603931357223, 'max_features': 0.3064585063819327}. Best is trial 241 with value: 0.7773840258827056.[0m
[32m[I 2022-04-13 12:36:06,696][0m Trial 829 finished with value: 0.7749797577146007 and parameters: {'splitter': 'best', 'min_samples_split': 0.11235122496738807, 'min_samples_leaf': 0.038577381849587956, 'min_weight_fraction_leaf': 0.03222971484857037, 'max_features': 0.9782100547620897}. Best is trial 241 with value: 0.7773840258827056.[0m
[32m[I 2022-04-13 12:36:09,460][0m Trial 830 finished with value: 0.7637634901630201 and parameters: {'splitter': 'best', 'min_samples_split': 0.11995793359699186, 'min_samples_leaf': 0.03611616161265634, 'min_weight_fraction_leaf': 0.01850173101786495, 'max_features': 0.9220611574320443}. Best is trial 241 with value: 0.7773840258827056.[0m
[32m[I 2022-04-13 12:36:12,269][0m Trial 831 finished with value: 0.7629065110886375 and parameters: {'splitter': 'best', 'min_samples_split': 0.15017706805510056, 'min_samples_leaf': 0.036681381037400526, 'min_weight_fraction_leaf': 0.028712665167324156, 'max_features': 0.9354424195900838}. Best is trial 241 with value: 0.7773840258827056.[0m
[32m[I 2022-04-13 12:36:14,332][0m Trial 832 finished with value: 0.7667710284212822 and parameters: {'splitter': 'best', 'min_samples_split': 0.13253479039195418, 'min_samples_leaf': 0.06284091261242211, 'min_weight_fraction_leaf': 0.007095500728584135, 'max_features': 0.9515000349679945}. Best is trial 241 with value: 0.7773840258827056.[0m
[32m[I 2022-04-13 12:36:16,550][0m Trial 833 finished with value: 0.7633143742925722 and parameters: {'splitter': 'best', 'min_samples_split': 0.12186673043431326, 'min_samples_leaf': 0.05125724765722005, 'min_weight_fraction_leaf': 0.029754319936894445, 'max_features': 0.9660919668959483}. Best is trial 241 with value: 0.7773840258827056.[0m
[32m[I 2022-04-13 12:36:18,287][0m Trial 834 finished with value: 0.7663434349767677 and parameters: {'splitter': 'best', 'min_samples_split': 0.11167761071877126, 'min_samples_leaf': 0.031834727157824386, 'min_weight_fraction_leaf': 0.019114348484509658, 'max_features': 0.8907714233904365}. Best is trial 241 with value: 0.7773840258827056.[0m
[32m[I 2022-04-13 12:36:20,207][0m Trial 835 finished with value: 0.7665943874547625 and parameters: {'splitter': 'best', 'min_samples_split': 0.1355556146811812, 'min_samples_leaf': 0.03950113472003103, 'min_weight_fraction_leaf': 0.036627781396441156, 'max_features': 0.9748405383303578}. Best is trial 241 with value: 0.7773840258827056.[0m
[32m[I 2022-04-13 12:36:22,593][0m Trial 836 finished with value: 0.7662697367733857 and parameters: {'splitter': 'best', 'min_samples_split': 0.11427290639619792, 'min_samples_leaf': 0.031058012137406207, 'min_weight_fraction_leaf': 0.02296971066545571, 'max_features': 0.9445899791105029}. Best is trial 241 with value: 0.7773840258827056.[0m
[32m[I 2022-04-13 12:36:25,128][0m Trial 837 finished with value: 0.7704812312211491 and parameters: {'splitter': 'best', 'min_samples_split': 0.12679724838178166, 'min_samples_leaf': 0.056066249301604185, 'min_weight_fraction_leaf': 0.008028860091629536, 'max_features': 0.9800466071929528}. Best is trial 241 with value: 0.7773840258827056.[0m
[32m[I 2022-04-13 12:36:27,233][0m Trial 838 finished with value: 0.760877979601004 and parameters: {'splitter': 'best', 'min_samples_split': 0.10841301889257118, 'min_samples_leaf': 0.083126159388898, 'min_weight_fraction_leaf': 0.0002690210692743236, 'max_features': 0.9241898187773352}. Best is trial 241 with value: 0.7773840258827056.[0m
[32m[I 2022-04-13 12:36:28,787][0m Trial 839 finished with value: 0.7648087621929358 and parameters: {'splitter': 'best', 'min_samples_split': 0.14493687480161233, 'min_samples_leaf': 0.042787817285526206, 'min_weight_fraction_leaf': 0.04519108262227518, 'max_features': 0.957227552160873}. Best is trial 241 with value: 0.7773840258827056.[0m
[32m[I 2022-04-13 12:36:29,891][0m Trial 840 finished with value: 0.7744271184343475 and parameters: {'splitter': 'best', 'min_samples_split': 0.11847193566486876, 'min_samples_leaf': 0.02824848501196707, 'min_weight_fraction_leaf': 0.03130440914712613, 'max_features': 0.9781783587243029}. Best is trial 241 with value: 0.7773840258827056.[0m
[32m[I 2022-04-13 12:36:30,672][0m Trial 841 finished with value: 0.7642842198241525 and parameters: {'splitter': 'best', 'min_samples_split': 0.12808867345825234, 'min_samples_leaf': 0.07230744008243814, 'min_weight_fraction_leaf': 0.016569760603048284, 'max_features': 0.9680826223198731}. Best is trial 241 with value: 0.7773840258827056.[0m
[32m[I 2022-04-13 12:36:31,605][0m Trial 842 finished with value: 0.768729638810951 and parameters: {'splitter': 'best', 'min_samples_split': 0.05615551297606469, 'min_samples_leaf': 0.04639621856552376, 'min_weight_fraction_leaf': 0.04105283197848869, 'max_features': 0.9438682293445627}. Best is trial 241 with value: 0.7773840258827056.[0m
[32m[I 2022-04-13 12:36:33,864][0m Trial 843 finished with value: 0.7725737926738789 and parameters: {'splitter': 'best', 'min_samples_split': 0.13922521189086629, 'min_samples_leaf': 0.03826171326583447, 'min_weight_fraction_leaf': 0.026628890032923427, 'max_features': 0.9800373690027777}. Best is trial 241 with value: 0.7773840258827056.[0m
[32m[I 2022-04-13 12:36:35,605][0m Trial 844 finished with value: 0.7460457587879568 and parameters: {'splitter': 'best', 'min_samples_split': 0.10392849616741053, 'min_samples_leaf': 0.02527013945569757, 'min_weight_fraction_leaf': 0.052211726465855646, 'max_features': 0.5817721130298047}. Best is trial 241 with value: 0.7773840258827056.[0m
[32m[I 2022-04-13 12:36:35,987][0m Trial 845 finished with value: 0.7630437849757823 and parameters: {'splitter': 'random', 'min_samples_split': 0.11813392551319603, 'min_samples_leaf': 0.05779520795644858, 'min_weight_fraction_leaf': 0.016105615628929936, 'max_features': 0.9572790613978879}. Best is trial 241 with value: 0.7773840258827056.[0m
[32m[I 2022-04-13 12:36:38,270][0m Trial 846 finished with value: 0.7295639359158859 and parameters: {'splitter': 'best', 'min_samples_split': 0.12895559014981547, 'min_samples_leaf': 0.03414306768485652, 'min_weight_fraction_leaf': 0.2888351406614211, 'max_features': 0.9833627091948105}. Best is trial 241 with value: 0.7773840258827056.[0m
[32m[I 2022-04-13 12:36:40,921][0m Trial 847 finished with value: 0.7715567967340136 and parameters: {'splitter': 'best', 'min_samples_split': 0.10776561439721882, 'min_samples_leaf': 0.05032670323994679, 'min_weight_fraction_leaf': 0.03410692820679406, 'max_features': 0.9994926196906647}. Best is trial 241 with value: 0.7773840258827056.[0m
[32m[I 2022-04-13 12:36:43,078][0m Trial 848 finished with value: 0.7685497498501339 and parameters: {'splitter': 'best', 'min_samples_split': 0.1410955255507068, 'min_samples_leaf': 0.02320685865672048, 'min_weight_fraction_leaf': 0.07385885956822427, 'max_features': 0.932469735048473}. Best is trial 241 with value: 0.7773840258827056.[0m
[32m[I 2022-04-13 12:36:43,231][0m Trial 849 finished with value: 0.5741154210754972 and parameters: {'splitter': 'best', 'min_samples_split': 0.11524078740281864, 'min_samples_leaf': 0.3810721268354378, 'min_weight_fraction_leaf': 0.046572534445753655, 'max_features': 0.4244713866977855}. Best is trial 241 with value: 0.7773840258827056.[0m
[32m[I 2022-04-13 12:36:44,219][0m Trial 850 finished with value: 0.7530406924344838 and parameters: {'splitter': 'best', 'min_samples_split': 0.12459777509723056, 'min_samples_leaf': 0.044030577040843365, 'min_weight_fraction_leaf': 0.09170883446214055, 'max_features': 0.9638284140676068}. Best is trial 241 with value: 0.7773840258827056.[0m
[32m[I 2022-04-13 12:36:44,982][0m Trial 851 finished with value: 0.7724858570084804 and parameters: {'splitter': 'best', 'min_samples_split': 0.10419583084610066, 'min_samples_leaf': 0.06316211815944159, 'min_weight_fraction_leaf': 0.026229778316289275, 'max_features': 0.9829965493548722}. Best is trial 241 with value: 0.7773840258827056.[0m
[32m[I 2022-04-13 12:36:47,490][0m Trial 852 finished with value: 0.76529604827326 and parameters: {'splitter': 'best', 'min_samples_split': 0.13501477087195876, 'min_samples_leaf': 0.0342353226938092, 'min_weight_fraction_leaf': 0.015108079445182596, 'max_features': 0.9137004242760047}. Best is trial 241 with value: 0.7773840258827056.[0m
[32m[I 2022-04-13 12:36:49,329][0m Trial 853 finished with value: 0.7667080376448746 and parameters: {'splitter': 'best', 'min_samples_split': 0.11306932810249583, 'min_samples_leaf': 0.019942056191003834, 'min_weight_fraction_leaf': 0.057221811495220376, 'max_features': 0.9558900745711582}. Best is trial 241 with value: 0.7773840258827056.[0m
[32m[I 2022-04-13 12:36:51,081][0m Trial 854 finished with value: 0.7735945019738232 and parameters: {'splitter': 'best', 'min_samples_split': 0.14999521307210809, 'min_samples_leaf': 0.04754917745164139, 'min_weight_fraction_leaf': 0.03562202218776876, 'max_features': 0.9998392535773906}. Best is trial 241 with value: 0.7773840258827056.[0m
[32m[I 2022-04-13 12:36:53,068][0m Trial 855 finished with value: 0.7674062555968251 and parameters: {'splitter': 'best', 'min_samples_split': 0.025897882473025033, 'min_samples_leaf': 0.03140841152200734, 'min_weight_fraction_leaf': 0.00024966446306192575, 'max_features': 0.9999328550878179}. Best is trial 241 with value: 0.7773840258827056.[0m
[32m[I 2022-04-13 12:36:55,150][0m Trial 856 finished with value: 0.6872597818130096 and parameters: {'splitter': 'best', 'min_samples_split': 0.16204484785033185, 'min_samples_leaf': 0.03830171877986749, 'min_weight_fraction_leaf': 0.23249126313301074, 'max_features': 0.9678173347201087}. Best is trial 241 with value: 0.7773840258827056.[0m
[32m[I 2022-04-13 12:36:58,575][0m Trial 857 finished with value: 0.7655564254522295 and parameters: {'splitter': 'best', 'min_samples_split': 0.12333694472854008, 'min_samples_leaf': 0.024100663267569402, 'min_weight_fraction_leaf': 0.02580729883453585, 'max_features': 0.9404854070798603}. Best is trial 241 with value: 0.7773840258827056.[0m
[32m[I 2022-04-13 12:37:00,765][0m Trial 858 finished with value: 0.770042804592184 and parameters: {'splitter': 'best', 'min_samples_split': 0.09545208695849897, 'min_samples_leaf': 0.05602163826014732, 'min_weight_fraction_leaf': 0.04242273698045021, 'max_features': 0.9798658133203657}. Best is trial 241 with value: 0.7773840258827056.[0m
[32m[I 2022-04-13 12:37:03,153][0m Trial 859 finished with value: 0.7656225480602655 and parameters: {'splitter': 'best', 'min_samples_split': 0.13462548967102966, 'min_samples_leaf': 0.04652354695677157, 'min_weight_fraction_leaf': 0.010175401476418624, 'max_features': 0.9671108427882186}. Best is trial 241 with value: 0.7773840258827056.[0m
[32m[I 2022-04-13 12:37:05,338][0m Trial 860 finished with value: 0.7744952246782927 and parameters: {'splitter': 'best', 'min_samples_split': 0.1038059576207439, 'min_samples_leaf': 0.019122331385167605, 'min_weight_fraction_leaf': 0.03375104160289483, 'max_features': 0.9792715415268716}. Best is trial 241 with value: 0.7773840258827056.[0m
[32m[I 2022-04-13 12:37:07,171][0m Trial 861 finished with value: 0.7674416482307027 and parameters: {'splitter': 'best', 'min_samples_split': 0.11855598319205465, 'min_samples_leaf': 0.06816333110796348, 'min_weight_fraction_leaf': 0.02270471793888666, 'max_features': 0.9488613305392187}. Best is trial 241 with value: 0.7773840258827056.[0m
[32m[I 2022-04-13 12:37:09,272][0m Trial 862 finished with value: 0.7717414180113884 and parameters: {'splitter': 'best', 'min_samples_split': 0.11157332076265018, 'min_samples_leaf': 0.036228252550056565, 'min_weight_fraction_leaf': 0.04989325951776155, 'max_features': 0.9996181077108994}. Best is trial 241 with value: 0.7773840258827056.[0m
[32m[I 2022-04-13 12:37:11,997][0m Trial 863 finished with value: 0.7628160386157131 and parameters: {'splitter': 'best', 'min_samples_split': 0.20098623253206427, 'min_samples_leaf': 0.028429165578543254, 'min_weight_fraction_leaf': 0.06048451252851901, 'max_features': 0.9795241016075593}. Best is trial 241 with value: 0.7773840258827056.[0m
[32m[I 2022-04-13 12:37:12,388][0m Trial 864 finished with value: 0.7590058691930175 and parameters: {'splitter': 'random', 'min_samples_split': 0.03773231147778447, 'min_samples_leaf': 0.0407463467599004, 'min_weight_fraction_leaf': 0.018743095355145203, 'max_features': 0.9339835016715089}. Best is trial 241 with value: 0.7773840258827056.[0m
[32m[I 2022-04-13 12:37:14,975][0m Trial 865 finished with value: 0.6205121165077 and parameters: {'splitter': 'best', 'min_samples_split': 0.43919631770394646, 'min_samples_leaf': 0.05122986290295957, 'min_weight_fraction_leaf': 0.3175771377974761, 'max_features': 0.9551201626707756}. Best is trial 241 with value: 0.7773840258827056.[0m
[32m[I 2022-04-13 12:37:17,210][0m Trial 866 finished with value: 0.5907975833158018 and parameters: {'splitter': 'best', 'min_samples_split': 0.1285147819143175, 'min_samples_leaf': 0.016630445666652973, 'min_weight_fraction_leaf': 0.4304521368850389, 'max_features': 0.9819767911135419}. Best is trial 241 with value: 0.7773840258827056.[0m
[32m[I 2022-04-13 12:37:19,049][0m Trial 867 finished with value: 0.7037861006896403 and parameters: {'splitter': 'best', 'min_samples_split': 0.09356544039941363, 'min_samples_leaf': 0.029439458722021083, 'min_weight_fraction_leaf': 0.19333746705116084, 'max_features': 0.9060411904735135}. Best is trial 241 with value: 0.7773840258827056.[0m
[32m[I 2022-04-13 12:37:19,893][0m Trial 868 finished with value: 0.7678781812879817 and parameters: {'splitter': 'best', 'min_samples_split': 0.06855639122117285, 'min_samples_leaf': 0.04054514889777753, 'min_weight_fraction_leaf': 0.0358912735507832, 'max_features': 0.9669938491540879}. Best is trial 241 with value: 0.7773840258827056.[0m
[32m[I 2022-04-13 12:37:19,959][0m Trial 869 finished with value: 0.5 and parameters: {'splitter': 'best', 'min_samples_split': 0.14588523651517224, 'min_samples_leaf': 0.060086950070283, 'min_weight_fraction_leaf': 0.21591723356048315, 'max_features': 0.0666426249089791}. Best is trial 241 with value: 0.7773840258827056.[0m
[32m[I 2022-04-13 12:37:20,692][0m Trial 870 finished with value: 0.761523725412814 and parameters: {'splitter': 'best', 'min_samples_split': 0.2531696403364656, 'min_samples_leaf': 0.026722125351129028, 'min_weight_fraction_leaf': 0.17093899949926653, 'max_features': 0.9824967417400747}. Best is trial 241 with value: 0.7773840258827056.[0m
[32m[I 2022-04-13 12:37:21,868][0m Trial 871 finished with value: 0.7628173831135336 and parameters: {'splitter': 'best', 'min_samples_split': 0.1197316093223864, 'min_samples_leaf': 0.04725146292343147, 'min_weight_fraction_leaf': 0.04306409059334436, 'max_features': 0.9555885515130603}. Best is trial 241 with value: 0.7773840258827056.[0m
[32m[I 2022-04-13 12:37:23,682][0m Trial 872 finished with value: 0.7674736231256207 and parameters: {'splitter': 'best', 'min_samples_split': 0.10662642700590635, 'min_samples_leaf': 0.0187193021570585, 'min_weight_fraction_leaf': 0.026911252728818003, 'max_features': 0.9305641716916454}. Best is trial 241 with value: 0.7773840258827056.[0m
[32m[I 2022-04-13 12:37:25,733][0m Trial 873 finished with value: 0.7735222799689591 and parameters: {'splitter': 'best', 'min_samples_split': 0.13473352356846155, 'min_samples_leaf': 0.03563586333700473, 'min_weight_fraction_leaf': 0.013125271368878831, 'max_features': 0.9856389330854984}. Best is trial 241 with value: 0.7773840258827056.[0m
[32m[I 2022-04-13 12:37:26,641][0m Trial 874 finished with value: 0.5930040131485143 and parameters: {'splitter': 'best', 'min_samples_split': 0.08469320535873727, 'min_samples_leaf': 0.052470351399792114, 'min_weight_fraction_leaf': 0.3433465425662048, 'max_features': 0.9664338753829415}. Best is trial 241 with value: 0.7773840258827056.[0m
[32m[I 2022-04-13 12:37:29,460][0m Trial 875 finished with value: 0.7721426005587448 and parameters: {'splitter': 'best', 'min_samples_split': 0.12735928210966543, 'min_samples_leaf': 0.029270510838559208, 'min_weight_fraction_leaf': 0.049182195318516454, 'max_features': 0.9991277202080239}. Best is trial 241 with value: 0.7773840258827056.[0m
[32m[I 2022-04-13 12:37:34,044][0m Trial 876 finished with value: 0.7664864815645134 and parameters: {'splitter': 'best', 'min_samples_split': 0.11559213081830241, 'min_samples_leaf': 0.012569907278577316, 'min_weight_fraction_leaf': 0.03253382906917339, 'max_features': 0.9545145303061582}. Best is trial 241 with value: 0.7773840258827056.[0m
[32m[I 2022-04-13 12:37:36,445][0m Trial 877 finished with value: 0.7673484405620001 and parameters: {'splitter': 'best', 'min_samples_split': 0.09993438377368488, 'min_samples_leaf': 0.0405451854952377, 'min_weight_fraction_leaf': 0.011485972318620688, 'max_features': 0.6295536248742928}. Best is trial 241 with value: 0.7773840258827056.[0m
[32m[I 2022-04-13 12:37:39,226][0m Trial 878 finished with value: 0.7745982351313483 and parameters: {'splitter': 'best', 'min_samples_split': 0.1115701638269412, 'min_samples_leaf': 0.022901138887921866, 'min_weight_fraction_leaf': 0.022628047758588146, 'max_features': 0.9824859291773066}. Best is trial 241 with value: 0.7773840258827056.[0m
[32m[I 2022-04-13 12:37:39,463][0m Trial 879 finished with value: 0.5907975833158018 and parameters: {'splitter': 'best', 'min_samples_split': 0.15563526668263866, 'min_samples_leaf': 0.429568089021067, 'min_weight_fraction_leaf': 0.04336832987351013, 'max_features': 0.9428845675043144}. Best is trial 241 with value: 0.7773840258827056.[0m
[32m[I 2022-04-13 12:37:40,423][0m Trial 880 finished with value: 0.6902660947144552 and parameters: {'splitter': 'best', 'min_samples_split': 0.14174120624736128, 'min_samples_leaf': 0.22736959805102336, 'min_weight_fraction_leaf': 0.0579225064404929, 'max_features': 0.9668216961467606}. Best is trial 241 with value: 0.7773840258827056.[0m
[32m[I 2022-04-13 12:37:41,803][0m Trial 881 finished with value: 0.7598600540971794 and parameters: {'splitter': 'best', 'min_samples_split': 0.12392511179144237, 'min_samples_leaf': 0.1842605572716416, 'min_weight_fraction_leaf': 0.03264112951368918, 'max_features': 0.9830509109238259}. Best is trial 241 with value: 0.7773840258827056.[0m
[32m[I 2022-04-13 12:37:43,549][0m Trial 882 finished with value: 0.77124638528068 and parameters: {'splitter': 'best', 'min_samples_split': 0.09837204738587571, 'min_samples_leaf': 0.05867539084642745, 'min_weight_fraction_leaf': 0.008552819398446428, 'max_features': 0.9987977026755124}. Best is trial 241 with value: 0.7773840258827056.[0m
[32m[I 2022-04-13 12:37:43,800][0m Trial 883 finished with value: 0.733493906356624 and parameters: {'splitter': 'random', 'min_samples_split': 0.18412163920650118, 'min_samples_leaf': 0.06981550315172337, 'min_weight_fraction_leaf': 0.020103906863758653, 'max_features': 0.6629827992047268}. Best is trial 241 with value: 0.7773840258827056.[0m
[32m[I 2022-04-13 12:37:45,900][0m Trial 884 finished with value: 0.7661297185218062 and parameters: {'splitter': 'best', 'min_samples_split': 0.13425238215275642, 'min_samples_leaf': 0.03504987239073444, 'min_weight_fraction_leaf': 0.039638957407822285, 'max_features': 0.9199033925721024}. Best is trial 241 with value: 0.7773840258827056.[0m
[32m[I 2022-04-13 12:37:46,831][0m Trial 885 finished with value: 0.7170610700950389 and parameters: {'splitter': 'best', 'min_samples_split': 0.10748797592133841, 'min_samples_leaf': 0.16169803384552067, 'min_weight_fraction_leaf': 0.05081486801495299, 'max_features': 0.9656461166530591}. Best is trial 241 with value: 0.7773840258827056.[0m
[32m[I 2022-04-13 12:37:49,365][0m Trial 886 finished with value: 0.7654252916344966 and parameters: {'splitter': 'best', 'min_samples_split': 0.11943641006732843, 'min_samples_leaf': 0.047385720919109475, 'min_weight_fraction_leaf': 0.027512229422785826, 'max_features': 0.9447058059484198}. Best is trial 241 with value: 0.7773840258827056.[0m
[32m[I 2022-04-13 12:37:51,849][0m Trial 887 finished with value: 0.7739653577491689 and parameters: {'splitter': 'best', 'min_samples_split': 0.1263235350574966, 'min_samples_leaf': 0.01630233524123551, 'min_weight_fraction_leaf': 0.01768051287140834, 'max_features': 0.9810009802401125}. Best is trial 241 with value: 0.7773840258827056.[0m
[32m[I 2022-04-13 12:37:52,970][0m Trial 888 finished with value: 0.7681584637166906 and parameters: {'splitter': 'best', 'min_samples_split': 0.09209393168389665, 'min_samples_leaf': 0.029982987375933166, 'min_weight_fraction_leaf': 0.06785424755207575, 'max_features': 0.9665780513319072}. Best is trial 241 with value: 0.7773840258827056.[0m
[32m[I 2022-04-13 12:37:54,480][0m Trial 889 finished with value: 0.7740376036066976 and parameters: {'splitter': 'best', 'min_samples_split': 0.11235858992237052, 'min_samples_leaf': 0.035568045336121026, 'min_weight_fraction_leaf': 0.0392340331491042, 'max_features': 0.9998738482487813}. Best is trial 241 with value: 0.7773840258827056.[0m
