[32m[I 2022-04-15 11:58:26,802][0m Trial 815 finished with value: 0.7343111888027052 and parameters: {'loss': 'coxph', 'learning_rate': 0.0034345483883262587, 'n_estimators': 597, 'criterion': 'friedman_mse', 'min_samples_split': 6, 'min_samples_leaf': 2, 'min_weight_fraction_leaf': 0.08117431612283983, 'min_impurity_decrease': 0.48324016351865196, 'max_features': 0.6962766538967086, 'subsample': 0.7838456518970647, 'dropout_rate': 0.6647378376843377, 'ccp_alpha': 0.08993472885984169}. Best is trial 712 with value: 0.7824105962295036.[0m
[32m[I 2022-04-15 11:59:36,304][0m Trial 816 finished with value: 0.7255760037352238 and parameters: {'loss': 'coxph', 'learning_rate': 0.004709992899706382, 'n_estimators': 551, 'criterion': 'friedman_mse', 'min_samples_split': 6, 'min_samples_leaf': 2, 'min_weight_fraction_leaf': 0.09860971773813926, 'min_impurity_decrease': 0.46596769415352135, 'max_features': 0.7245496865555058, 'subsample': 0.7488097500555027, 'dropout_rate': 0.5946212310756424, 'ccp_alpha': 0.09574173198402475}. Best is trial 712 with value: 0.7824105962295036.[0m
[32m[I 2022-04-15 12:00:55,210][0m Trial 817 finished with value: 0.5 and parameters: {'loss': 'coxph', 'learning_rate': 0.002530554764472827, 'n_estimators': 637, 'criterion': 'friedman_mse', 'min_samples_split': 6, 'min_samples_leaf': 2, 'min_weight_fraction_leaf': 0.05902246801994529, 'min_impurity_decrease': 0.4245476776608693, 'max_features': 0.763126872526881, 'subsample': 0.7708354719812064, 'dropout_rate': 0.6206093520307201, 'ccp_alpha': 0.24991584110161977}. Best is trial 712 with value: 0.7824105962295036.[0m
[32m[I 2022-04-15 12:02:11,797][0m Trial 818 finished with value: 0.7744612083449539 and parameters: {'loss': 'coxph', 'learning_rate': 0.0035391065896905874, 'n_estimators': 581, 'criterion': 'friedman_mse', 'min_samples_split': 6, 'min_samples_leaf': 2, 'min_weight_fraction_leaf': 0.08548251784071527, 'min_impurity_decrease': 0.4882286197327294, 'max_features': 0.7466239405142618, 'subsample': 0.7852087801525348, 'dropout_rate': 0.6316153329911475, 'ccp_alpha': 0.0042938590384177956}. Best is trial 712 with value: 0.7824105962295036.[0m
[32m[I 2022-04-15 12:03:14,855][0m Trial 819 finished with value: 0.5 and parameters: {'loss': 'coxph', 'learning_rate': 0.002697127796496498, 'n_estimators': 556, 'criterion': 'friedman_mse', 'min_samples_split': 6, 'min_samples_leaf': 2, 'min_weight_fraction_leaf': 0.4396902614547151, 'min_impurity_decrease': 0.45425801660403947, 'max_features': 0.7648770153900704, 'subsample': 0.7322203612353071, 'dropout_rate': 0.603998577200167, 'ccp_alpha': 1.790855570065567}. Best is trial 712 with value: 0.7824105962295036.[0m
[32m[I 2022-04-15 12:04:43,041][0m Trial 820 finished with value: 0.5636982531485787 and parameters: {'loss': 'coxph', 'learning_rate': 0.004075093245439316, 'n_estimators': 679, 'criterion': 'friedman_mse', 'min_samples_split': 6, 'min_samples_leaf': 2, 'min_weight_fraction_leaf': 0.0706292719301614, 'min_impurity_decrease': 0.43320378274351307, 'max_features': 0.6858130244232112, 'subsample': 0.9948998806095891, 'dropout_rate': 0.6476692394974602, 'ccp_alpha': 0.1633411491525857}. Best is trial 712 with value: 0.7824105962295036.[0m
[32m[I 2022-04-15 12:05:51,394][0m Trial 821 finished with value: 0.5 and parameters: {'loss': 'coxph', 'learning_rate': 0.0031417961162535117, 'n_estimators': 613, 'criterion': 'squared_error', 'min_samples_split': 6, 'min_samples_leaf': 2, 'min_weight_fraction_leaf': 0.05343249410753365, 'min_impurity_decrease': 0.46665093600810403, 'max_features': 0.7087415822383092, 'subsample': 0.7501173085870881, 'dropout_rate': 0.6620428108404305, 'ccp_alpha': 0.0023572385008188315}. Best is trial 712 with value: 0.7824105962295036.[0m
[32m[I 2022-04-15 12:07:04,282][0m Trial 822 finished with value: 0.5 and parameters: {'loss': 'coxph', 'learning_rate': 0.004761007503474066, 'n_estimators': 578, 'criterion': 'friedman_mse', 'min_samples_split': 6, 'min_samples_leaf': 2, 'min_weight_fraction_leaf': 0.07712760720731954, 'min_impurity_decrease': 0.41569551204190913, 'max_features': 0.4382714188504402, 'subsample': 0.7807617885995864, 'dropout_rate': 0.593640335444851, 'ccp_alpha': 0.41733392260578916}. Best is trial 712 with value: 0.7824105962295036.[0m
[32m[I 2022-04-15 12:08:01,961][0m Trial 823 finished with value: 0.732623385650002 and parameters: {'loss': 'coxph', 'learning_rate': 0.002682686008540832, 'n_estimators': 555, 'criterion': 'friedman_mse', 'min_samples_split': 7, 'min_samples_leaf': 2, 'min_weight_fraction_leaf': 0.0625951415091093, 'min_impurity_decrease': 0.43819331955573226, 'max_features': 0.7326598619384448, 'subsample': 0.7285098751769924, 'dropout_rate': 0.7043018559345768, 'ccp_alpha': 0.0900846738477127}. Best is trial 712 with value: 0.7824105962295036.[0m
[32m[I 2022-04-15 12:09:15,356][0m Trial 824 finished with value: 0.5 and parameters: {'loss': 'coxph', 'learning_rate': 0.0021962863423192545, 'n_estimators': 606, 'criterion': 'friedman_mse', 'min_samples_split': 6, 'min_samples_leaf': 2, 'min_weight_fraction_leaf': 0.09427470013032319, 'min_impurity_decrease': 0.4768269736310418, 'max_features': 0.7676998351847759, 'subsample': 0.7702697679597357, 'dropout_rate': 0.6124377493369628, 'ccp_alpha': 0.22572717824190883}. Best is trial 712 with value: 0.7824105962295036.[0m
[32m[I 2022-04-15 12:10:12,235][0m Trial 825 finished with value: 0.7316084684922833 and parameters: {'loss': 'coxph', 'learning_rate': 0.0037390269139832757, 'n_estimators': 521, 'criterion': 'friedman_mse', 'min_samples_split': 6, 'min_samples_leaf': 2, 'min_weight_fraction_leaf': 0.07144258872027028, 'min_impurity_decrease': 0.09706740629056732, 'max_features': 0.7483912110908042, 'subsample': 0.7946075102537807, 'dropout_rate': 0.6311038232511802, 'ccp_alpha': 0.09033109590751635}. Best is trial 712 with value: 0.7824105962295036.[0m
[32m[I 2022-04-15 12:11:16,005][0m Trial 826 finished with value: 0.7769413898244627 and parameters: {'loss': 'coxph', 'learning_rate': 0.004786137079229528, 'n_estimators': 549, 'criterion': 'friedman_mse', 'min_samples_split': 6, 'min_samples_leaf': 2, 'min_weight_fraction_leaf': 0.05250596746758221, 'min_impurity_decrease': 0.4518325566690668, 'max_features': 0.7171579029783784, 'subsample': 0.7575374899482594, 'dropout_rate': 0.6735870532127833, 'ccp_alpha': 0.0029218290477173933}. Best is trial 712 with value: 0.7824105962295036.[0m
[32m[I 2022-04-15 12:12:25,781][0m Trial 827 finished with value: 0.7770260850896977 and parameters: {'loss': 'coxph', 'learning_rate': 0.003157648835656944, 'n_estimators': 584, 'criterion': 'friedman_mse', 'min_samples_split': 6, 'min_samples_leaf': 2, 'min_weight_fraction_leaf': 0.046993010462961185, 'min_impurity_decrease': 0.4943710232295656, 'max_features': 0.7055316918228249, 'subsample': 0.7434135130616081, 'dropout_rate': 0.6858742372047182, 'ccp_alpha': 0.0013325550571259422}. Best is trial 712 with value: 0.7824105962295036.[0m
[32m[I 2022-04-15 12:13:34,876][0m Trial 828 finished with value: 0.5 and parameters: {'loss': 'coxph', 'learning_rate': 0.00047957143090883306, 'n_estimators': 642, 'criterion': 'friedman_mse', 'min_samples_split': 6, 'min_samples_leaf': 2, 'min_weight_fraction_leaf': 0.05294779896366768, 'min_impurity_decrease': 0.4960129195694115, 'max_features': 0.688066740883152, 'subsample': 0.7519637930862754, 'dropout_rate': 0.7030318540878355, 'ccp_alpha': 0.3518456211173054}. Best is trial 712 with value: 0.7824105962295036.[0m
[32m[I 2022-04-15 12:14:38,369][0m Trial 829 finished with value: 0.6743624146605087 and parameters: {'loss': 'coxph', 'learning_rate': 0.0048397823322529525, 'n_estimators': 616, 'criterion': 'friedman_mse', 'min_samples_split': 6, 'min_samples_leaf': 2, 'min_weight_fraction_leaf': 0.050370621165643836, 'min_impurity_decrease': 0.4940279987151207, 'max_features': 0.6920425653304383, 'subsample': 0.7307021206038764, 'dropout_rate': 0.7364267517834926, 'ccp_alpha': 0.16962228561502946}. Best is trial 712 with value: 0.7824105962295036.[0m
[32m[I 2022-04-15 12:15:56,340][0m Trial 830 finished with value: 0.5 and parameters: {'loss': 'coxph', 'learning_rate': 0.0022259926547064167, 'n_estimators': 586, 'criterion': 'absolute_error', 'min_samples_split': 6, 'min_samples_leaf': 2, 'min_weight_fraction_leaf': 0.061565315777986414, 'min_impurity_decrease': 0.4838376932491195, 'max_features': 0.682682723044466, 'subsample': 0.7565247423032059, 'dropout_rate': 0.7163204230622942, 'ccp_alpha': 0.24877629551793648}. Best is trial 712 with value: 0.7824105962295036.[0m
[32m[I 2022-04-15 12:16:34,837][0m Trial 831 finished with value: 0.2578331993290825 and parameters: {'loss': 'squared', 'learning_rate': 0.00023499555695680513, 'n_estimators': 579, 'criterion': 'friedman_mse', 'min_samples_split': 6, 'min_samples_leaf': 2, 'min_weight_fraction_leaf': 0.04698846981855109, 'min_impurity_decrease': 0.4682980769217437, 'max_features': 0.7065865180797979, 'subsample': 0.7251671272498819, 'dropout_rate': 0.6795828501321404, 'ccp_alpha': 0.0910494137087489}. Best is trial 712 with value: 0.7824105962295036.[0m
[32m[I 2022-04-15 12:17:47,525][0m Trial 832 finished with value: 0.6743624146605087 and parameters: {'loss': 'coxph', 'learning_rate': 0.003000645192592281, 'n_estimators': 648, 'criterion': 'friedman_mse', 'min_samples_split': 6, 'min_samples_leaf': 2, 'min_weight_fraction_leaf': 0.06614412042497758, 'min_impurity_decrease': 0.49002069552402533, 'max_features': 0.716098986126446, 'subsample': 0.7753445815568395, 'dropout_rate': 0.6873228373287518, 'ccp_alpha': 0.16374892193243037}. Best is trial 712 with value: 0.7824105962295036.[0m
[32m[I 2022-04-15 12:18:55,078][0m Trial 833 finished with value: 0.7331354324241212 and parameters: {'loss': 'coxph', 'learning_rate': 0.00392724083640705, 'n_estimators': 612, 'criterion': 'friedman_mse', 'min_samples_split': 6, 'min_samples_leaf': 2, 'min_weight_fraction_leaf': 0.050345824249074064, 'min_impurity_decrease': 0.45439786058880915, 'max_features': 0.6815098962203836, 'subsample': 0.7471629249028666, 'dropout_rate': 0.6871631291444313, 'ccp_alpha': 0.08984749951242316}. Best is trial 712 with value: 0.7824105962295036.[0m
[32m[I 2022-04-15 12:19:54,238][0m Trial 834 finished with value: 0.6743624146605087 and parameters: {'loss': 'coxph', 'learning_rate': 0.0029175233263437103, 'n_estimators': 554, 'criterion': 'friedman_mse', 'min_samples_split': 7, 'min_samples_leaf': 2, 'min_weight_fraction_leaf': 0.06659745688820676, 'min_impurity_decrease': 0.4719075849394659, 'max_features': 0.6658095906276206, 'subsample': 0.7229827175557146, 'dropout_rate': 0.6625970844885767, 'ccp_alpha': 0.17081357525359764}. Best is trial 712 with value: 0.7824105962295036.[0m
[32m[I 2022-04-15 12:21:11,775][0m Trial 835 finished with value: 0.5 and parameters: {'loss': 'coxph', 'learning_rate': 0.0022653845083148547, 'n_estimators': 676, 'criterion': 'friedman_mse', 'min_samples_split': 6, 'min_samples_leaf': 2, 'min_weight_fraction_leaf': 0.07682424343547138, 'min_impurity_decrease': 0.41764613015738644, 'max_features': 0.714384641064714, 'subsample': 0.7662912293293329, 'dropout_rate': 0.7160954593878884, 'ccp_alpha': 0.5564300473779568}. Best is trial 712 with value: 0.7824105962295036.[0m
[32m[I 2022-04-15 12:22:23,078][0m Trial 836 finished with value: 0.5 and parameters: {'loss': 'coxph', 'learning_rate': 0.004605808822144236, 'n_estimators': 590, 'criterion': 'friedman_mse', 'min_samples_split': 6, 'min_samples_leaf': 2, 'min_weight_fraction_leaf': 0.060857114169557934, 'min_impurity_decrease': 0.4448630840572476, 'max_features': 0.7100693005416525, 'subsample': 0.7954965186971802, 'dropout_rate': 0.6720448293542255, 'ccp_alpha': 0.2708733533234738}. Best is trial 712 with value: 0.7824105962295036.[0m
[32m[I 2022-04-15 12:23:28,485][0m Trial 837 finished with value: 0.5 and parameters: {'loss': 'coxph', 'learning_rate': 0.002613757169768524, 'n_estimators': 558, 'criterion': 'friedman_mse', 'min_samples_split': 6, 'min_samples_leaf': 2, 'min_weight_fraction_leaf': 0.047286954999667265, 'min_impurity_decrease': 0.4938188989737325, 'max_features': 0.7192204348034322, 'subsample': 0.744587225552938, 'dropout_rate': 0.645707136510548, 'ccp_alpha': 3.4848756161164087}. Best is trial 712 with value: 0.7824105962295036.[0m
[32m[I 2022-04-15 12:25:10,382][0m Trial 838 finished with value: 0.7336370337168362 and parameters: {'loss': 'coxph', 'learning_rate': 0.0019624291371574676, 'n_estimators': 741, 'criterion': 'friedman_mse', 'min_samples_split': 6, 'min_samples_leaf': 2, 'min_weight_fraction_leaf': 0.07430634946921807, 'min_impurity_decrease': 0.26461450637760425, 'max_features': 0.7349171926543461, 'subsample': 0.785961338406668, 'dropout_rate': 0.6671880767044487, 'ccp_alpha': 0.08780191554223309}. Best is trial 712 with value: 0.7824105962295036.[0m
[32m[I 2022-04-15 12:26:44,974][0m Trial 839 finished with value: 0.7766408692154545 and parameters: {'loss': 'coxph', 'learning_rate': 0.003875507488339005, 'n_estimators': 636, 'criterion': 'friedman_mse', 'min_samples_split': 6, 'min_samples_leaf': 2, 'min_weight_fraction_leaf': 0.08518628486276404, 'min_impurity_decrease': 0.46323528388890967, 'max_features': 0.7008605551829064, 'subsample': 0.19242189649632402, 'dropout_rate': 0.6925000996504638, 'ccp_alpha': 0.001523712528961081}. Best is trial 712 with value: 0.7824105962295036.[0m
[32m[I 2022-04-15 12:27:52,680][0m Trial 840 finished with value: 0.7316994387866653 and parameters: {'loss': 'coxph', 'learning_rate': 0.0032266914633810417, 'n_estimators': 575, 'criterion': 'friedman_mse', 'min_samples_split': 6, 'min_samples_leaf': 2, 'min_weight_fraction_leaf': 0.05867467154078457, 'min_impurity_decrease': 0.40742226542366267, 'max_features': 0.7289728518707452, 'subsample': 0.7631008977098374, 'dropout_rate': 0.6552047482353953, 'ccp_alpha': 0.09371849851340106}. Best is trial 712 with value: 0.7824105962295036.[0m
[32m[I 2022-04-15 12:29:09,944][0m Trial 841 finished with value: 0.6743624146605087 and parameters: {'loss': 'coxph', 'learning_rate': 0.00501799149149454, 'n_estimators': 606, 'criterion': 'friedman_mse', 'min_samples_split': 6, 'min_samples_leaf': 2, 'min_weight_fraction_leaf': 0.06782819094636093, 'min_impurity_decrease': 0.4465326258631538, 'max_features': 0.35105835289745224, 'subsample': 0.8041940643616634, 'dropout_rate': 0.6411535664749708, 'ccp_alpha': 0.16839863960075968}. Best is trial 712 with value: 0.7824105962295036.[0m
[32m[I 2022-04-15 12:30:06,946][0m Trial 842 finished with value: 0.5 and parameters: {'loss': 'coxph', 'learning_rate': 0.00227957341776595, 'n_estimators': 541, 'criterion': 'squared_error', 'min_samples_split': 6, 'min_samples_leaf': 2, 'min_weight_fraction_leaf': 0.09075543132340068, 'min_impurity_decrease': 0.4253323949593883, 'max_features': 0.6680969097526912, 'subsample': 0.7404897138274863, 'dropout_rate': 0.6784621261386673, 'ccp_alpha': 0.0014223041021844893}. Best is trial 712 with value: 0.7824105962295036.[0m
[32m[I 2022-04-15 12:31:14,272][0m Trial 843 finished with value: 0.5 and parameters: {'loss': 'coxph', 'learning_rate': 0.0032698509096077398, 'n_estimators': 586, 'criterion': 'friedman_mse', 'min_samples_split': 6, 'min_samples_leaf': 2, 'min_weight_fraction_leaf': 0.053828465137744974, 'min_impurity_decrease': 0.4732103818986781, 'max_features': 0.7456439389699193, 'subsample': 0.7772607428777736, 'dropout_rate': 0.625494039370357, 'ccp_alpha': 0.24928393093342346}. Best is trial 712 with value: 0.7824105962295036.[0m
[32m[I 2022-04-15 12:32:24,087][0m Trial 844 finished with value: 0.7769570800079629 and parameters: {'loss': 'coxph', 'learning_rate': 0.0042688850063107115, 'n_estimators': 562, 'criterion': 'friedman_mse', 'min_samples_split': 7, 'min_samples_leaf': 2, 'min_weight_fraction_leaf': 0.07739516991319553, 'min_impurity_decrease': 0.49915487685871157, 'max_features': 0.7724738904728987, 'subsample': 0.7189156335949128, 'dropout_rate': 0.6541185383427994, 'ccp_alpha': 0.0028372508829173065}. Best is trial 712 with value: 0.7824105962295036.[0m
[32m[I 2022-04-15 12:33:30,322][0m Trial 845 finished with value: 0.6743624146605087 and parameters: {'loss': 'coxph', 'learning_rate': 0.004753765686942847, 'n_estimators': 624, 'criterion': 'friedman_mse', 'min_samples_split': 7, 'min_samples_leaf': 2, 'min_weight_fraction_leaf': 0.0678217318553621, 'min_impurity_decrease': 0.50063617961559, 'max_features': 0.782102012564863, 'subsample': 0.7115875381352822, 'dropout_rate': 0.7086575354660193, 'ccp_alpha': 0.1636230256038103}. Best is trial 712 with value: 0.7824105962295036.[0m
[32m[I 2022-04-15 12:34:38,570][0m Trial 846 finished with value: 0.777208808793749 and parameters: {'loss': 'coxph', 'learning_rate': 0.004005419629045252, 'n_estimators': 573, 'criterion': 'friedman_mse', 'min_samples_split': 7, 'min_samples_leaf': 2, 'min_weight_fraction_leaf': 0.04594817896677297, 'min_impurity_decrease': 0.4930808961007299, 'max_features': 0.7752204292765243, 'subsample': 0.7206726729303979, 'dropout_rate': 0.6684997034236437, 'ccp_alpha': 0.002623470306866575}. Best is trial 712 with value: 0.7824105962295036.[0m
[32m[I 2022-04-15 12:35:56,309][0m Trial 847 finished with value: 0.5 and parameters: {'loss': 'coxph', 'learning_rate': 0.0038454866926191855, 'n_estimators': 660, 'criterion': 'friedman_mse', 'min_samples_split': 7, 'min_samples_leaf': 2, 'min_weight_fraction_leaf': 0.04421050257638301, 'min_impurity_decrease': 0.49648255274160824, 'max_features': 0.775763489563095, 'subsample': 0.7240367921907086, 'dropout_rate': 0.654346450964532, 'ccp_alpha': 0.3429355338791987}. Best is trial 712 with value: 0.7824105962295036.[0m
[32m[I 2022-04-15 12:37:04,140][0m Trial 848 finished with value: 0.7211560799573088 and parameters: {'loss': 'coxph', 'learning_rate': 0.003333685237558499, 'n_estimators': 601, 'criterion': 'friedman_mse', 'min_samples_split': 7, 'min_samples_leaf': 2, 'min_weight_fraction_leaf': 0.07589191534035966, 'min_impurity_decrease': 0.49941990323487084, 'max_features': 0.7818728670773593, 'subsample': 0.7164432915413607, 'dropout_rate': 0.651189235004205, 'ccp_alpha': 0.1078429208901072}. Best is trial 712 with value: 0.7824105962295036.[0m
[32m[I 2022-04-15 12:38:05,606][0m Trial 849 finished with value: 0.7117175688547097 and parameters: {'loss': 'coxph', 'learning_rate': 0.00034342561920059, 'n_estimators': 571, 'criterion': 'friedman_mse', 'min_samples_split': 9, 'min_samples_leaf': 2, 'min_weight_fraction_leaf': 0.06378915466566511, 'min_impurity_decrease': 0.11978194587670876, 'max_features': 0.7670178567058056, 'subsample': 0.7092235361867651, 'dropout_rate': 0.6688829318814529, 'ccp_alpha': 0.11582904626385862}. Best is trial 712 with value: 0.7824105962295036.[0m
[32m[I 2022-04-15 12:38:45,118][0m Trial 850 finished with value: 0.26957266407362807 and parameters: {'loss': 'squared', 'learning_rate': 0.004118229915892916, 'n_estimators': 613, 'criterion': 'friedman_mse', 'min_samples_split': 7, 'min_samples_leaf': 2, 'min_weight_fraction_leaf': 0.08798652867037128, 'min_impurity_decrease': 0.4947935872548463, 'max_features': 0.7944083348241575, 'subsample': 0.7366196701208605, 'dropout_rate': 0.6988999428044148, 'ccp_alpha': 0.08805041810895657}. Best is trial 712 with value: 0.7824105962295036.[0m
[32m[I 2022-04-15 12:39:55,619][0m Trial 851 finished with value: 0.5 and parameters: {'loss': 'coxph', 'learning_rate': 0.0009813851372531134, 'n_estimators': 581, 'criterion': 'friedman_mse', 'min_samples_split': 7, 'min_samples_leaf': 2, 'min_weight_fraction_leaf': 0.058288936858644586, 'min_impurity_decrease': 0.5051782991888693, 'max_features': 0.7911008817985249, 'subsample': 0.7222001258444906, 'dropout_rate': 0.6599027775629338, 'ccp_alpha': 0.24110955017171237}. Best is trial 712 with value: 0.7824105962295036.[0m
[32m[I 2022-04-15 12:40:38,753][0m Trial 852 finished with value: 0.5 and parameters: {'loss': 'coxph', 'learning_rate': 0.002634878448278546, 'n_estimators': 296, 'criterion': 'absolute_error', 'min_samples_split': 7, 'min_samples_leaf': 2, 'min_weight_fraction_leaf': 0.1011630335031711, 'min_impurity_decrease': 0.4765324835496315, 'max_features': 0.7649114506505041, 'subsample': 0.8466359071639491, 'dropout_rate': 0.6333879303596366, 'ccp_alpha': 0.09174029112067116}. Best is trial 712 with value: 0.7824105962295036.[0m
[32m[I 2022-04-15 12:41:44,592][0m Trial 853 finished with value: 0.5301157883717103 and parameters: {'loss': 'coxph', 'learning_rate': 0.0019786078896191087, 'n_estimators': 567, 'criterion': 'friedman_mse', 'min_samples_split': 7, 'min_samples_leaf': 2, 'min_weight_fraction_leaf': 0.04709932604723082, 'min_impurity_decrease': 0.2443137042428999, 'max_features': 0.7677524517428544, 'subsample': 0.8264094905088062, 'dropout_rate': 0.6876304573864764, 'ccp_alpha': 0.1899677317202398}. Best is trial 712 with value: 0.7824105962295036.[0m
[32m[I 2022-04-15 12:43:27,451][0m Trial 854 finished with value: 0.7754205850399661 and parameters: {'loss': 'coxph', 'learning_rate': 0.0039812473060512445, 'n_estimators': 693, 'criterion': 'friedman_mse', 'min_samples_split': 7, 'min_samples_leaf': 2, 'min_weight_fraction_leaf': 0.07713720043220405, 'min_impurity_decrease': 0.20275369871475374, 'max_features': 0.7925482701859451, 'subsample': 0.805023697288525, 'dropout_rate': 0.6416503256687173, 'ccp_alpha': 0.006431244038188046}. Best is trial 712 with value: 0.7824105962295036.[0m
