[32m[I 2022-04-18 06:01:13,751][0m Trial 676 finished with value: 0.7667269766354655 and parameters: {'n_hidden': 256, 'mixture_components': 4, 'use_sparse_layer': True, 'use_sparse_loss': False, 'use_batchnorm': False, 'use_dropout': True, 'dropout': 0.8018114198642923, 'mlp_size_1': 1, 'mlp_size_2': 4, 'mlp_size_3': 0, 'kernel': 'Exponential', 'loss_name': 'AlternativeNLLLoss'}. Best is trial 526 with value: 0.7749738194021545.[0m
[32m[I 2022-04-18 06:03:18,057][0m Trial 677 finished with value: 0.771904396168835 and parameters: {'n_hidden': 256, 'mixture_components': 9, 'use_sparse_layer': True, 'use_sparse_loss': False, 'use_batchnorm': False, 'use_dropout': True, 'dropout': 0.7607579132894557, 'mlp_size_1': 1, 'mlp_size_2': 4, 'mlp_size_3': 0, 'kernel': 'Exponential', 'loss_name': 'AlternativeNLLLoss'}. Best is trial 526 with value: 0.7749738194021545.[0m
[32m[I 2022-04-18 06:05:23,905][0m Trial 678 finished with value: 0.7720138770010279 and parameters: {'n_hidden': 256, 'mixture_components': 8, 'use_sparse_layer': True, 'use_sparse_loss': True, 'lmbd': 0.0007290658116688126, 'use_batchnorm': False, 'use_dropout': True, 'dropout': 0.7357474409334183, 'mlp_size_1': 1, 'mlp_size_2': 4, 'mlp_size_3': 0, 'kernel': 'Exponential', 'loss_name': 'AlternativeNLLLoss'}. Best is trial 526 with value: 0.7749738194021545.[0m
[32m[I 2022-04-18 06:07:27,236][0m Trial 679 finished with value: 0.77326823953688 and parameters: {'n_hidden': 256, 'mixture_components': 10, 'use_sparse_layer': True, 'use_sparse_loss': False, 'use_batchnorm': False, 'use_dropout': True, 'dropout': 0.715680332124423, 'mlp_size_1': 1, 'mlp_size_2': 4, 'mlp_size_3': 0, 'kernel': 'Exponential', 'loss_name': 'AlternativeNLLLoss'}. Best is trial 526 with value: 0.7749738194021545.[0m
[32m[I 2022-04-18 06:09:30,823][0m Trial 680 finished with value: 0.7710470212433067 and parameters: {'n_hidden': 256, 'mixture_components': 10, 'use_sparse_layer': True, 'use_sparse_loss': False, 'use_batchnorm': False, 'use_dropout': True, 'dropout': 0.6982684911718112, 'mlp_size_1': 1, 'mlp_size_2': 4, 'mlp_size_3': 0, 'kernel': 'Exponential', 'loss_name': 'AlternativeNLLLoss'}. Best is trial 526 with value: 0.7749738194021545.[0m
[32m[I 2022-04-18 06:11:34,915][0m Trial 681 finished with value: 0.7702953695084698 and parameters: {'n_hidden': 256, 'mixture_components': 10, 'use_sparse_layer': True, 'use_sparse_loss': False, 'use_batchnorm': False, 'use_dropout': True, 'dropout': 0.7128441276951305, 'mlp_size_1': 1, 'mlp_size_2': 4, 'mlp_size_3': 0, 'kernel': 'Exponential', 'loss_name': 'AlternativeNLLLoss'}. Best is trial 526 with value: 0.7749738194021545.[0m
[32m[I 2022-04-18 06:14:30,371][0m Trial 682 finished with value: 0.7642003811671187 and parameters: {'n_hidden': 256, 'mixture_components': 10, 'use_sparse_layer': True, 'use_sparse_loss': False, 'use_batchnorm': False, 'use_dropout': True, 'dropout': 0.689304327918019, 'mlp_size_1': 1, 'mlp_size_2': 4, 'mlp_size_3': 0, 'kernel': 'Normal', 'loss_name': 'AlternativeNLLLoss'}. Best is trial 526 with value: 0.7749738194021545.[0m
[32m[I 2022-04-18 06:16:38,531][0m Trial 683 finished with value: 0.7741479300180509 and parameters: {'n_hidden': 256, 'mixture_components': 10, 'use_sparse_layer': True, 'use_sparse_loss': False, 'use_batchnorm': False, 'use_dropout': True, 'dropout': 0.7201765823157452, 'mlp_size_1': 1, 'mlp_size_2': 4, 'mlp_size_3': 0, 'kernel': 'Exponential', 'loss_name': 'AlternativeNLLLoss'}. Best is trial 526 with value: 0.7749738194021545.[0m
[32m[I 2022-04-18 06:19:11,681][0m Trial 684 finished with value: 0.7599983690961993 and parameters: {'n_hidden': 256, 'mixture_components': 10, 'use_sparse_layer': True, 'use_sparse_loss': False, 'use_batchnorm': False, 'use_dropout': True, 'dropout': 0.7303493507523126, 'mlp_size_1': 1, 'mlp_size_2': 4, 'mlp_size_3': 0, 'kernel': 'LogLogistic', 'loss_name': 'AlternativeNLLLoss'}. Best is trial 526 with value: 0.7749738194021545.[0m
[32m[I 2022-04-18 06:22:07,244][0m Trial 685 finished with value: 0.7726087699537276 and parameters: {'n_hidden': 256, 'mixture_components': 10, 'use_sparse_layer': True, 'use_sparse_loss': False, 'use_batchnorm': True, 'use_dropout': True, 'dropout': 0.7461840177923673, 'mlp_size_1': 1, 'mlp_size_2': 4, 'mlp_size_3': 0, 'kernel': 'Exponential', 'loss_name': 'AlternativeNLLLoss'}. Best is trial 526 with value: 0.7749738194021545.[0m
[32m[I 2022-04-18 06:24:11,789][0m Trial 686 finished with value: 0.7701124696157583 and parameters: {'n_hidden': 256, 'mixture_components': 10, 'use_sparse_layer': True, 'use_sparse_loss': False, 'use_batchnorm': False, 'use_dropout': True, 'dropout': 0.7701595391088674, 'mlp_size_1': 1, 'mlp_size_2': 4, 'mlp_size_3': 0, 'kernel': 'Exponential', 'loss_name': 'AlternativeNLLLoss'}. Best is trial 526 with value: 0.7749738194021545.[0m
[32m[I 2022-04-18 06:26:09,366][0m Trial 687 finished with value: 0.7710050707540039 and parameters: {'n_hidden': 256, 'mixture_components': 10, 'use_sparse_layer': True, 'use_sparse_loss': False, 'use_batchnorm': False, 'use_dropout': True, 'dropout': 0.7167283864626632, 'mlp_size_1': 1, 'mlp_size_2': 4, 'mlp_size_3': 0, 'kernel': 'Gamma', 'loss_name': 'AlternativeNLLLoss'}. Best is trial 526 with value: 0.7749738194021545.[0m
[32m[I 2022-04-18 06:28:11,658][0m Trial 688 finished with value: 0.7696057637150238 and parameters: {'n_hidden': 256, 'mixture_components': 10, 'use_sparse_layer': True, 'use_sparse_loss': False, 'use_batchnorm': False, 'use_dropout': True, 'dropout': 0.7425879607520992, 'mlp_size_1': 1, 'mlp_size_2': 4, 'mlp_size_3': 0, 'kernel': 'Exponential', 'loss_name': 'AlternativeNLLLoss'}. Best is trial 526 with value: 0.7749738194021545.[0m
[32m[I 2022-04-18 06:30:20,534][0m Trial 689 finished with value: 0.770052340078857 and parameters: {'n_hidden': 256, 'mixture_components': 10, 'use_sparse_layer': True, 'use_sparse_loss': False, 'use_batchnorm': False, 'use_dropout': True, 'dropout': 0.7164864327730305, 'mlp_size_1': 1, 'mlp_size_2': 4, 'mlp_size_3': 0, 'kernel': 'Exponential', 'loss_name': 'AlternativeNLLLoss'}. Best is trial 526 with value: 0.7749738194021545.[0m
[32m[I 2022-04-18 06:32:26,981][0m Trial 690 finished with value: 0.7733128421164572 and parameters: {'n_hidden': 256, 'mixture_components': 10, 'use_sparse_layer': True, 'use_sparse_loss': True, 'lmbd': 0.00011065342256825186, 'use_batchnorm': False, 'use_dropout': True, 'dropout': 0.7942458878747722, 'mlp_size_1': 1, 'mlp_size_2': 4, 'mlp_size_3': 0, 'kernel': 'Exponential', 'loss_name': 'AlternativeNLLLoss'}. Best is trial 526 with value: 0.7749738194021545.[0m
[32m[I 2022-04-18 06:34:27,384][0m Trial 691 finished with value: 0.7712079705969038 and parameters: {'n_hidden': 256, 'mixture_components': 10, 'use_sparse_layer': True, 'use_sparse_loss': False, 'use_batchnorm': False, 'use_dropout': True, 'dropout': 0.7989706645127391, 'mlp_size_1': 1, 'mlp_size_2': 4, 'mlp_size_3': 0, 'kernel': 'Exponential', 'loss_name': 'AlternativeNLLLoss'}. Best is trial 526 with value: 0.7749738194021545.[0m
[32m[I 2022-04-18 06:36:35,414][0m Trial 692 finished with value: 0.7644591721989263 and parameters: {'n_hidden': 256, 'mixture_components': 10, 'use_sparse_layer': True, 'use_sparse_loss': False, 'use_batchnorm': False, 'use_dropout': True, 'dropout': 0.8300227263575407, 'mlp_size_1': 1, 'mlp_size_2': 4, 'mlp_size_3': 0, 'kernel': 'Exponential', 'loss_name': 'AlternativeNLLLoss'}. Best is trial 526 with value: 0.7749738194021545.[0m
[32m[I 2022-04-18 06:38:40,220][0m Trial 693 finished with value: 0.7711659911494015 and parameters: {'n_hidden': 256, 'mixture_components': 10, 'use_sparse_layer': True, 'use_sparse_loss': False, 'use_batchnorm': False, 'use_dropout': True, 'dropout': 0.8123470915237595, 'mlp_size_1': 1, 'mlp_size_2': 4, 'mlp_size_3': 0, 'kernel': 'Exponential', 'loss_name': 'AlternativeNLLLoss'}. Best is trial 526 with value: 0.7749738194021545.[0m
[32m[I 2022-04-18 06:40:10,758][0m Trial 694 finished with value: -0.37225811932419334 and parameters: {'n_hidden': 256, 'mixture_components': 10, 'use_sparse_layer': True, 'use_sparse_loss': False, 'use_batchnorm': False, 'use_dropout': True, 'dropout': 0.7838768649878644, 'mlp_size_1': 1, 'mlp_size_2': 4, 'mlp_size_3': 0, 'kernel': 'Gumbel', 'loss_name': 'AlternativeNLLLoss'}. Best is trial 526 with value: 0.7749738194021545.[0m
[32m[I 2022-04-18 06:42:20,595][0m Trial 695 finished with value: 0.7709951329082851 and parameters: {'n_hidden': 256, 'mixture_components': 10, 'use_sparse_layer': True, 'use_sparse_loss': True, 'lmbd': 0.026442731725999424, 'use_batchnorm': False, 'use_dropout': True, 'dropout': 0.7538774394469648, 'mlp_size_1': 1, 'mlp_size_2': 4, 'mlp_size_3': 0, 'kernel': 'Exponential', 'loss_name': 'AlternativeNLLLoss'}. Best is trial 526 with value: 0.7749738194021545.[0m
[32m[I 2022-04-18 06:44:16,770][0m Trial 696 finished with value: 0.7681903001861328 and parameters: {'n_hidden': 256, 'mixture_components': 10, 'use_sparse_layer': True, 'use_sparse_loss': False, 'use_batchnorm': False, 'use_dropout': True, 'dropout': 0.5519111290004388, 'mlp_size_1': 1, 'mlp_size_2': 4, 'mlp_size_3': 0, 'kernel': 'Exponential', 'loss_name': 'AlternativeNLLLoss'}. Best is trial 526 with value: 0.7749738194021545.[0m
[32m[I 2022-04-18 06:47:21,376][0m Trial 697 finished with value: 0.7581379600522519 and parameters: {'n_hidden': 1024, 'mixture_components': 10, 'use_sparse_layer': True, 'use_sparse_loss': False, 'use_batchnorm': True, 'use_dropout': True, 'dropout': 0.702446562978947, 'mlp_size_1': 0, 'mlp_size_2': 5, 'mlp_size_3': 2, 'kernel': 'Exponential', 'loss_name': 'AlternativeNLLLoss'}. Best is trial 526 with value: 0.7749738194021545.[0m
[32m[I 2022-04-18 06:49:50,803][0m Trial 698 finished with value: 0.6976106244696236 and parameters: {'n_hidden': 256, 'mixture_components': 10, 'use_sparse_layer': True, 'use_sparse_loss': False, 'use_batchnorm': False, 'use_dropout': True, 'dropout': 0.7291758156927592, 'mlp_size_1': 1, 'mlp_size_2': 4, 'mlp_size_3': 0, 'kernel': 'Exponential', 'loss_name': 'NLLLoss'}. Best is trial 526 with value: 0.7749738194021545.[0m
[32m[I 2022-04-18 06:51:59,728][0m Trial 699 finished with value: 0.7703483799997126 and parameters: {'n_hidden': 256, 'mixture_components': 10, 'use_sparse_layer': True, 'use_sparse_loss': False, 'use_batchnorm': False, 'use_dropout': True, 'dropout': 0.7676005270464513, 'mlp_size_1': 1, 'mlp_size_2': 4, 'mlp_size_3': 0, 'kernel': 'Exponential', 'loss_name': 'AlternativeNLLLoss'}. Best is trial 526 with value: 0.7749738194021545.[0m
[32m[I 2022-04-18 06:55:59,649][0m Trial 700 finished with value: 0.7476230677461719 and parameters: {'n_hidden': 32, 'mixture_components': 10, 'use_sparse_layer': True, 'use_sparse_loss': False, 'use_batchnorm': False, 'use_dropout': True, 'dropout': 0.3156044402342745, 'mlp_size_1': 1, 'mlp_size_2': 1, 'mlp_size_3': 0, 'kernel': 'LogNormal', 'loss_name': 'AlternativeNLLLoss'}. Best is trial 526 with value: 0.7749738194021545.[0m
[32m[I 2022-04-18 06:58:08,079][0m Trial 701 finished with value: 0.7713212227917433 and parameters: {'n_hidden': 256, 'mixture_components': 10, 'use_sparse_layer': True, 'use_sparse_loss': False, 'use_batchnorm': False, 'use_dropout': True, 'dropout': 0.7934658183781025, 'mlp_size_1': 1, 'mlp_size_2': 4, 'mlp_size_3': 0, 'kernel': 'Exponential', 'loss_name': 'AlternativeNLLLoss'}. Best is trial 526 with value: 0.7749738194021545.[0m
[32m[I 2022-04-18 06:59:36,916][0m Trial 702 finished with value: -0.6580827142876583 and parameters: {'n_hidden': 256, 'mixture_components': 10, 'use_sparse_layer': True, 'use_sparse_loss': False, 'use_batchnorm': False, 'use_dropout': True, 'dropout': 0.9620118488443834, 'mlp_size_1': 1, 'mlp_size_2': 4, 'mlp_size_3': 0, 'kernel': 'Exponential', 'loss_name': 'AlternativeNLLLoss'}. Best is trial 526 with value: 0.7749738194021545.[0m
[32m[I 2022-04-18 07:02:06,834][0m Trial 703 finished with value: 0.7680371676300196 and parameters: {'n_hidden': 256, 'mixture_components': 10, 'use_sparse_layer': True, 'use_sparse_loss': False, 'use_batchnorm': False, 'use_dropout': True, 'dropout': 0.7327045664194409, 'mlp_size_1': 1, 'mlp_size_2': 4, 'mlp_size_3': 0, 'kernel': 'Weibull', 'loss_name': 'AlternativeNLLLoss'}. Best is trial 526 with value: 0.7749738194021545.[0m
[32m[I 2022-04-18 07:04:10,659][0m Trial 704 finished with value: 0.7722185253644541 and parameters: {'n_hidden': 256, 'mixture_components': 10, 'use_sparse_layer': True, 'use_sparse_loss': False, 'use_batchnorm': False, 'use_dropout': True, 'dropout': 0.699323011024432, 'mlp_size_1': 1, 'mlp_size_2': 4, 'mlp_size_3': 0, 'kernel': 'Exponential', 'loss_name': 'AlternativeNLLLoss'}. Best is trial 526 with value: 0.7749738194021545.[0m
[32m[I 2022-04-18 07:06:33,847][0m Trial 705 finished with value: 0.7701306889564086 and parameters: {'n_hidden': 256, 'mixture_components': 10, 'use_sparse_layer': True, 'use_sparse_loss': True, 'lmbd': 0.00036571447830669856, 'use_batchnorm': False, 'use_dropout': True, 'dropout': 0.8183606419849078, 'mlp_size_1': 1, 'mlp_size_2': 4, 'mlp_size_3': 0, 'kernel': 'Exponential', 'loss_name': 'AlternativeNLLLoss'}. Best is trial 526 with value: 0.7749738194021545.[0m
[32m[I 2022-04-18 07:09:16,706][0m Trial 706 finished with value: 0.7465830622407309 and parameters: {'n_hidden': 256, 'mixture_components': 10, 'use_sparse_layer': True, 'use_sparse_loss': False, 'use_batchnorm': False, 'use_dropout': True, 'dropout': 0.7538600487321195, 'mlp_size_1': 1, 'mlp_size_2': 4, 'mlp_size_3': 0, 'kernel': 'Logistic', 'loss_name': 'AlternativeNLLLoss'}. Best is trial 526 with value: 0.7749738194021545.[0m
[32m[I 2022-04-18 07:11:23,132][0m Trial 707 finished with value: 0.716480180538473 and parameters: {'n_hidden': 2048, 'mixture_components': 10, 'use_sparse_layer': True, 'use_sparse_loss': False, 'use_batchnorm': False, 'use_dropout': True, 'dropout': 0.7200131633090993, 'mlp_size_1': 0, 'mlp_size_2': 5, 'mlp_size_3': 0, 'kernel': 'Exponential', 'loss_name': 'AlternativeNLLLoss'}. Best is trial 526 with value: 0.7749738194021545.[0m
[32m[I 2022-04-18 07:14:20,731][0m Trial 708 finished with value: 0.772477876858684 and parameters: {'n_hidden': 256, 'mixture_components': 10, 'use_sparse_layer': True, 'use_sparse_loss': False, 'use_batchnorm': True, 'use_dropout': True, 'dropout': 0.7697785418020326, 'mlp_size_1': 1, 'mlp_size_2': 4, 'mlp_size_3': 0, 'kernel': 'Exponential', 'loss_name': 'AlternativeNLLLoss'}. Best is trial 526 with value: 0.7749738194021545.[0m
[32m[I 2022-04-18 07:16:33,320][0m Trial 709 finished with value: 0.7716746233868672 and parameters: {'n_hidden': 128, 'mixture_components': 10, 'use_sparse_layer': True, 'use_sparse_loss': False, 'use_batchnorm': False, 'use_dropout': True, 'dropout': 0.6893928850136484, 'mlp_size_1': 1, 'mlp_size_2': 3, 'mlp_size_3': 0, 'kernel': 'Exponential', 'loss_name': 'AlternativeNLLLoss'}. Best is trial 526 with value: 0.7749738194021545.[0m
[32m[I 2022-04-18 07:18:16,313][0m Trial 710 finished with value: 0.7670922618994004 and parameters: {'n_hidden': 256, 'mixture_components': 10, 'use_sparse_layer': True, 'use_sparse_loss': False, 'use_batchnorm': False, 'use_dropout': False, 'mlp_size_1': 1, 'mlp_size_2': 4, 'mlp_size_3': 0, 'kernel': 'Exponential', 'loss_name': 'AlternativeNLLLoss'}. Best is trial 526 with value: 0.7749738194021545.[0m
[32m[I 2022-04-18 07:19:59,882][0m Trial 711 finished with value: 0.7017319831566726 and parameters: {'n_hidden': 256, 'mixture_components': 10, 'use_sparse_layer': True, 'use_sparse_loss': False, 'use_batchnorm': False, 'use_dropout': True, 'dropout': 0.7420470916950357, 'mlp_size_1': 1, 'mlp_size_2': 4, 'mlp_size_3': 0, 'kernel': 'Exponential', 'loss_name': 'NLLLoss'}. Best is trial 526 with value: 0.7749738194021545.[0m
[32m[I 2022-04-18 07:21:45,855][0m Trial 712 finished with value: 0.7624539389458429 and parameters: {'n_hidden': 256, 'mixture_components': 10, 'use_sparse_layer': True, 'use_sparse_loss': False, 'use_batchnorm': False, 'use_dropout': True, 'dropout': 0.5248337639338958, 'mlp_size_1': 1, 'mlp_size_2': 4, 'mlp_size_3': 0, 'kernel': 'Exponential', 'loss_name': 'AlternativeNLLLoss'}. Best is trial 526 with value: 0.7749738194021545.[0m
[32m[I 2022-04-18 07:24:25,197][0m Trial 713 finished with value: 0.7556340457185712 and parameters: {'n_hidden': 1024, 'mixture_components': 10, 'use_sparse_layer': True, 'use_sparse_loss': False, 'use_batchnorm': False, 'use_dropout': True, 'dropout': 0.7058389430908333, 'mlp_size_1': 0, 'mlp_size_2': 6, 'mlp_size_3': 0, 'kernel': 'Exponential', 'loss_name': 'AlternativeNLLLoss'}. Best is trial 526 with value: 0.7749738194021545.[0m
[32m[I 2022-04-18 07:26:34,615][0m Trial 714 finished with value: 0.7679130313274272 and parameters: {'n_hidden': 256, 'mixture_components': 10, 'use_sparse_layer': True, 'use_sparse_loss': False, 'use_batchnorm': False, 'use_dropout': True, 'dropout': 0.7896770547046857, 'mlp_size_1': 1, 'mlp_size_2': 4, 'mlp_size_3': 0, 'kernel': 'Exponential', 'loss_name': 'AlternativeNLLLoss'}. Best is trial 526 with value: 0.7749738194021545.[0m
[32m[I 2022-04-18 07:29:27,579][0m Trial 715 finished with value: 0.7556075528187001 and parameters: {'n_hidden': 256, 'mixture_components': 10, 'use_sparse_layer': True, 'use_sparse_loss': True, 'lmbd': 0.0034309336788869386, 'use_batchnorm': False, 'use_dropout': True, 'dropout': 0.7269518969080682, 'mlp_size_1': 1, 'mlp_size_2': 4, 'mlp_size_3': 0, 'kernel': 'Normal', 'loss_name': 'AlternativeNLLLoss'}. Best is trial 526 with value: 0.7749738194021545.[0m
[32m[I 2022-04-18 07:32:22,488][0m Trial 716 finished with value: 0.7662361684093772 and parameters: {'n_hidden': 256, 'mixture_components': 10, 'use_sparse_layer': True, 'use_sparse_loss': False, 'use_batchnorm': False, 'use_dropout': True, 'dropout': 0.759479845291166, 'mlp_size_1': 1, 'mlp_size_2': 4, 'mlp_size_3': 0, 'kernel': 'LogLogistic', 'loss_name': 'AlternativeNLLLoss'}. Best is trial 526 with value: 0.7749738194021545.[0m
[32m[I 2022-04-18 07:34:29,510][0m Trial 717 finished with value: 0.7654604552152033 and parameters: {'n_hidden': 256, 'mixture_components': 10, 'use_sparse_layer': True, 'use_sparse_loss': False, 'use_batchnorm': False, 'use_dropout': True, 'dropout': 0.711110109094752, 'mlp_size_1': 1, 'mlp_size_2': 4, 'mlp_size_3': 0, 'kernel': 'Exponential', 'loss_name': 'AlternativeNLLLoss'}. Best is trial 526 with value: 0.7749738194021545.[0m
[32m[I 2022-04-18 07:37:11,115][0m Trial 718 finished with value: 0.7697374230752928 and parameters: {'n_hidden': 256, 'mixture_components': 10, 'use_sparse_layer': True, 'use_sparse_loss': False, 'use_batchnorm': False, 'use_dropout': True, 'dropout': 0.7469378300407089, 'mlp_size_1': 1, 'mlp_size_2': 4, 'mlp_size_3': 0, 'kernel': 'Gamma', 'loss_name': 'AlternativeNLLLoss'}. Best is trial 526 with value: 0.7749738194021545.[0m
[32m[I 2022-04-18 07:39:52,829][0m Trial 719 finished with value: 0.7735820564880775 and parameters: {'n_hidden': 256, 'mixture_components': 10, 'use_sparse_layer': True, 'use_sparse_loss': False, 'use_batchnorm': True, 'use_dropout': True, 'dropout': 0.6848162722466347, 'mlp_size_1': 1, 'mlp_size_2': 4, 'mlp_size_3': 0, 'kernel': 'Exponential', 'loss_name': 'CensoredNLLLoss'}. Best is trial 526 with value: 0.7749738194021545.[0m
[32m[I 2022-04-18 07:41:56,498][0m Trial 720 finished with value: 0.7713749647406006 and parameters: {'n_hidden': 256, 'mixture_components': 10, 'use_sparse_layer': True, 'use_sparse_loss': False, 'use_batchnorm': False, 'use_dropout': True, 'dropout': 0.6815512294825796, 'mlp_size_1': 1, 'mlp_size_2': 4, 'mlp_size_3': 0, 'kernel': 'Exponential', 'loss_name': 'CensoredNLLLoss'}. Best is trial 526 with value: 0.7749738194021545.[0m
[32m[I 2022-04-18 07:44:50,001][0m Trial 721 finished with value: 0.7681597726240231 and parameters: {'n_hidden': 256, 'mixture_components': 10, 'use_sparse_layer': True, 'use_sparse_loss': False, 'use_batchnorm': True, 'use_dropout': True, 'dropout': 0.6835727948819709, 'mlp_size_1': 1, 'mlp_size_2': 4, 'mlp_size_3': 0, 'kernel': 'Exponential', 'loss_name': 'CensoredNLLLoss'}. Best is trial 526 with value: 0.7749738194021545.[0m
[32m[I 2022-04-18 07:47:44,355][0m Trial 722 finished with value: 0.7663459046697392 and parameters: {'n_hidden': 256, 'mixture_components': 10, 'use_sparse_layer': True, 'use_sparse_loss': False, 'use_batchnorm': True, 'use_dropout': True, 'dropout': 0.69198236137618, 'mlp_size_1': 1, 'mlp_size_2': 4, 'mlp_size_3': 0, 'kernel': 'Exponential', 'loss_name': 'CensoredNLLLoss'}. Best is trial 526 with value: 0.7749738194021545.[0m
[32m[I 2022-04-18 07:50:36,022][0m Trial 723 finished with value: 0.7693357814639963 and parameters: {'n_hidden': 256, 'mixture_components': 10, 'use_sparse_layer': True, 'use_sparse_loss': False, 'use_batchnorm': True, 'use_dropout': True, 'dropout': 0.7015306025929774, 'mlp_size_1': 1, 'mlp_size_2': 4, 'mlp_size_3': 0, 'kernel': 'Exponential', 'loss_name': 'CensoredNLLLoss'}. Best is trial 526 with value: 0.7749738194021545.[0m
[32m[I 2022-04-18 07:53:45,693][0m Trial 724 finished with value: 0.772006535277866 and parameters: {'n_hidden': 256, 'mixture_components': 10, 'use_sparse_layer': True, 'use_sparse_loss': False, 'use_batchnorm': True, 'use_dropout': True, 'dropout': 0.6717324455310933, 'mlp_size_1': 1, 'mlp_size_2': 4, 'mlp_size_3': 0, 'kernel': 'Exponential', 'loss_name': 'CensoredNLLLoss'}. Best is trial 526 with value: 0.7749738194021545.[0m
