[32m[I 2022-04-13 12:24:14,758][0m Trial 449 finished with value: 0.7652157210965317 and parameters: {'splitter': 'best', 'min_samples_split': 0.13798485742089175, 'min_samples_leaf': 0.007908503707830139, 'min_weight_fraction_leaf': 0.031115518758412713, 'max_features': 0.9286309108762881}. Best is trial 241 with value: 0.7773840258827056.[0m
[32m[I 2022-04-13 12:24:16,096][0m Trial 450 finished with value: 0.7244050287093404 and parameters: {'splitter': 'best', 'min_samples_split': 0.1281917802815722, 'min_samples_leaf': 0.08383776567881188, 'min_weight_fraction_leaf': 0.24334657492599743, 'max_features': 0.9832664719321708}. Best is trial 241 with value: 0.7773840258827056.[0m
[32m[I 2022-04-13 12:24:17,048][0m Trial 451 finished with value: 0.6648845686603017 and parameters: {'splitter': 'best', 'min_samples_split': 0.15336551474796772, 'min_samples_leaf': 0.264734255990793, 'min_weight_fraction_leaf': 0.036152362124664536, 'max_features': 0.9523794986146963}. Best is trial 241 with value: 0.7773840258827056.[0m
[32m[I 2022-04-13 12:24:19,147][0m Trial 452 finished with value: 0.7751321558396359 and parameters: {'splitter': 'best', 'min_samples_split': 0.12834334029610844, 'min_samples_leaf': 0.03349455263197276, 'min_weight_fraction_leaf': 0.016244587872820265, 'max_features': 0.9801686118480054}. Best is trial 241 with value: 0.7773840258827056.[0m
[32m[I 2022-04-13 12:24:21,126][0m Trial 453 finished with value: 0.7184032701195723 and parameters: {'splitter': 'best', 'min_samples_split': 0.3969127291530188, 'min_samples_leaf': 0.02991750715124737, 'min_weight_fraction_leaf': 0.008783975332574304, 'max_features': 0.965673599181373}. Best is trial 241 with value: 0.7773840258827056.[0m
[32m[I 2022-04-13 12:24:23,092][0m Trial 454 finished with value: 0.7727802318406021 and parameters: {'splitter': 'best', 'min_samples_split': 0.14215635464644538, 'min_samples_leaf': 0.019775018208815227, 'min_weight_fraction_leaf': 0.013988050633137385, 'max_features': 0.9836930979216897}. Best is trial 241 with value: 0.7773840258827056.[0m
[32m[I 2022-04-13 12:24:25,968][0m Trial 455 finished with value: 0.7666451055124981 and parameters: {'splitter': 'best', 'min_samples_split': 0.13216752240459195, 'min_samples_leaf': 0.03190259386149426, 'min_weight_fraction_leaf': 0.0005308411944156509, 'max_features': 0.9381347525955688}. Best is trial 241 with value: 0.7773840258827056.[0m
[32m[I 2022-04-13 12:24:27,765][0m Trial 456 finished with value: 0.761523725412814 and parameters: {'splitter': 'best', 'min_samples_split': 0.12493921589715182, 'min_samples_leaf': 0.010588954683066285, 'min_weight_fraction_leaf': 0.17236423609832457, 'max_features': 0.9995972390573264}. Best is trial 241 with value: 0.7773840258827056.[0m
[32m[I 2022-04-13 12:24:30,380][0m Trial 457 finished with value: 0.7634204209796794 and parameters: {'splitter': 'best', 'min_samples_split': 0.14443493527223092, 'min_samples_leaf': 0.023622461472410514, 'min_weight_fraction_leaf': 0.020849823108433346, 'max_features': 0.9625083566554122}. Best is trial 241 with value: 0.7773840258827056.[0m
[32m[I 2022-04-13 12:24:32,458][0m Trial 458 finished with value: 0.7705423031233647 and parameters: {'splitter': 'best', 'min_samples_split': 0.13131488960438487, 'min_samples_leaf': 0.055269921908500705, 'min_weight_fraction_leaf': 0.025212741444510658, 'max_features': 0.9997991066452258}. Best is trial 241 with value: 0.7773840258827056.[0m
[32m[I 2022-04-13 12:24:34,762][0m Trial 459 finished with value: 0.7750406184368898 and parameters: {'splitter': 'best', 'min_samples_split': 0.11963494468974897, 'min_samples_leaf': 0.038294337371262054, 'min_weight_fraction_leaf': 0.013353841743165715, 'max_features': 0.9797265992757355}. Best is trial 241 with value: 0.7773840258827056.[0m
[32m[I 2022-04-13 12:24:35,235][0m Trial 460 finished with value: 0.7572502049560074 and parameters: {'splitter': 'random', 'min_samples_split': 0.12176975612482967, 'min_samples_leaf': 0.044225583704606816, 'min_weight_fraction_leaf': 0.008190281912115564, 'max_features': 0.7983451482080043}. Best is trial 241 with value: 0.7773840258827056.[0m
[32m[I 2022-04-13 12:24:37,863][0m Trial 461 finished with value: 0.7635713551543936 and parameters: {'splitter': 'best', 'min_samples_split': 0.13691639061511196, 'min_samples_leaf': 0.04877674289337487, 'min_weight_fraction_leaf': 0.014357101115005391, 'max_features': 0.9062150851342978}. Best is trial 241 with value: 0.7773840258827056.[0m
[32m[I 2022-04-13 12:24:39,789][0m Trial 462 finished with value: 0.7636138086446478 and parameters: {'splitter': 'best', 'min_samples_split': 0.14836705142036585, 'min_samples_leaf': 0.0370554084404015, 'min_weight_fraction_leaf': 0.0018855634002290754, 'max_features': 0.9456834079827648}. Best is trial 241 with value: 0.7773840258827056.[0m
[32m[I 2022-04-13 12:24:40,985][0m Trial 463 finished with value: 0.7616901068917432 and parameters: {'splitter': 'best', 'min_samples_split': 0.1655181647869977, 'min_samples_leaf': 0.06252193906955421, 'min_weight_fraction_leaf': 0.020043231267633556, 'max_features': 0.9648442184571692}. Best is trial 241 with value: 0.7773840258827056.[0m
[32m[I 2022-04-13 12:24:43,218][0m Trial 464 finished with value: 0.7639518373485346 and parameters: {'splitter': 'best', 'min_samples_split': 0.11951773380686441, 'min_samples_leaf': 0.03676086886382598, 'min_weight_fraction_leaf': 0.013842304897321476, 'max_features': 0.8638793151890737}. Best is trial 241 with value: 0.7773840258827056.[0m
[32m[I 2022-04-13 12:24:44,503][0m Trial 465 finished with value: 0.7647090605636022 and parameters: {'splitter': 'best', 'min_samples_split': 0.13366761109988415, 'min_samples_leaf': 0.05290682468356384, 'min_weight_fraction_leaf': 0.02473498726482054, 'max_features': 0.9258006174184604}. Best is trial 241 with value: 0.7773840258827056.[0m
[32m[I 2022-04-13 12:24:47,293][0m Trial 466 finished with value: 0.7752720783368885 and parameters: {'splitter': 'best', 'min_samples_split': 0.11673468073613569, 'min_samples_leaf': 0.042780170754365354, 'min_weight_fraction_leaf': 0.008198091407526722, 'max_features': 0.9800658763748447}. Best is trial 241 with value: 0.7773840258827056.[0m
[32m[I 2022-04-13 12:24:48,376][0m Trial 467 finished with value: 0.7109837781625641 and parameters: {'splitter': 'best', 'min_samples_split': 0.11728456744707798, 'min_samples_leaf': 0.2078447922350944, 'min_weight_fraction_leaf': 0.0039698035072536254, 'max_features': 0.9514508035578295}. Best is trial 241 with value: 0.7773840258827056.[0m
[32m[I 2022-04-13 12:24:50,683][0m Trial 468 finished with value: 0.7731524354641773 and parameters: {'splitter': 'best', 'min_samples_split': 0.11342999770456569, 'min_samples_leaf': 0.04675360600862018, 'min_weight_fraction_leaf': 9.036003693971284e-05, 'max_features': 0.976135086197602}. Best is trial 241 with value: 0.7773840258827056.[0m
[32m[I 2022-04-13 12:24:52,998][0m Trial 469 finished with value: 0.7618269986559383 and parameters: {'splitter': 'best', 'min_samples_split': 0.11882953720042645, 'min_samples_leaf': 0.060023703142961474, 'min_weight_fraction_leaf': 0.011407211640263454, 'max_features': 0.966396357921657}. Best is trial 241 with value: 0.7773840258827056.[0m
[32m[I 2022-04-13 12:24:55,933][0m Trial 470 finished with value: 0.766913753733654 and parameters: {'splitter': 'best', 'min_samples_split': 0.12600468942231804, 'min_samples_leaf': 0.06865412911416176, 'min_weight_fraction_leaf': 0.01562408480622371, 'max_features': 0.9508978099083094}. Best is trial 241 with value: 0.7773840258827056.[0m
[32m[I 2022-04-13 12:24:58,298][0m Trial 471 finished with value: 0.7747248242639119 and parameters: {'splitter': 'best', 'min_samples_split': 0.11244642000837587, 'min_samples_leaf': 0.04139157312305835, 'min_weight_fraction_leaf': 0.008408212359964098, 'max_features': 0.9840020991480194}. Best is trial 241 with value: 0.7773840258827056.[0m
[32m[I 2022-04-13 12:24:59,816][0m Trial 472 finished with value: 0.7709825580489926 and parameters: {'splitter': 'best', 'min_samples_split': 0.07410748276579598, 'min_samples_leaf': 0.05374082937416198, 'min_weight_fraction_leaf': 0.010070561384611626, 'max_features': 0.9810771889992392}. Best is trial 241 with value: 0.7773840258827056.[0m
[32m[I 2022-04-13 12:25:02,126][0m Trial 473 finished with value: 0.7705278164649438 and parameters: {'splitter': 'best', 'min_samples_split': 0.098583625386407, 'min_samples_leaf': 0.042942837862633955, 'min_weight_fraction_leaf': 0.002841772717317342, 'max_features': 0.9369472201640018}. Best is trial 241 with value: 0.7773840258827056.[0m
[32m[I 2022-04-13 12:25:05,167][0m Trial 474 finished with value: 0.7717414180113884 and parameters: {'splitter': 'best', 'min_samples_split': 0.11169735172519937, 'min_samples_leaf': 0.0503842016964685, 'min_weight_fraction_leaf': 0.0009094344816417826, 'max_features': 0.9802873839821169}. Best is trial 241 with value: 0.7773840258827056.[0m
[32m[I 2022-04-13 12:25:07,555][0m Trial 475 finished with value: 0.7672381134458992 and parameters: {'splitter': 'best', 'min_samples_split': 0.08822114558494897, 'min_samples_leaf': 0.040490463413442035, 'min_weight_fraction_leaf': 0.015352710475121175, 'max_features': 0.9621473302939327}. Best is trial 241 with value: 0.7773840258827056.[0m
[32m[I 2022-04-13 12:25:09,085][0m Trial 476 finished with value: 0.7643637680731431 and parameters: {'splitter': 'best', 'min_samples_split': 0.10029783107520054, 'min_samples_leaf': 0.06008982938779659, 'min_weight_fraction_leaf': 0.019939075043367508, 'max_features': 0.9167687798784578}. Best is trial 241 with value: 0.7773840258827056.[0m
[32m[I 2022-04-13 12:25:11,186][0m Trial 477 finished with value: 0.7745265105853889 and parameters: {'splitter': 'best', 'min_samples_split': 0.12496198024841204, 'min_samples_leaf': 0.035239307834277034, 'min_weight_fraction_leaf': 0.009597479289990668, 'max_features': 0.9995631108869304}. Best is trial 241 with value: 0.7773840258827056.[0m
[32m[I 2022-04-13 12:25:13,553][0m Trial 478 finished with value: 0.7736674594500965 and parameters: {'splitter': 'best', 'min_samples_split': 0.1485715296007978, 'min_samples_leaf': 0.04771454611099857, 'min_weight_fraction_leaf': 0.008123081679564527, 'max_features': 0.9994438776665473}. Best is trial 241 with value: 0.7773840258827056.[0m
[32m[I 2022-04-13 12:25:16,725][0m Trial 479 finished with value: 0.7637706767159315 and parameters: {'splitter': 'best', 'min_samples_split': 0.13828177146538953, 'min_samples_leaf': 0.03645301018547414, 'min_weight_fraction_leaf': 0.011879315145811201, 'max_features': 0.967204216995282}. Best is trial 241 with value: 0.7773840258827056.[0m
[32m[I 2022-04-13 12:25:16,863][0m Trial 480 finished with value: 0.7344554787897263 and parameters: {'splitter': 'random', 'min_samples_split': 0.1251945164328754, 'min_samples_leaf': 0.06857555601758493, 'min_weight_fraction_leaf': 0.0013452425955929811, 'max_features': 0.9817722407626154}. Best is trial 241 with value: 0.7773840258827056.[0m
[32m[I 2022-04-13 12:25:17,972][0m Trial 481 finished with value: 0.7677539563316469 and parameters: {'splitter': 'best', 'min_samples_split': 0.12726133996020084, 'min_samples_leaf': 0.04251403187044308, 'min_weight_fraction_leaf': 9.829505633676336e-05, 'max_features': 0.9424734257438788}. Best is trial 241 with value: 0.7773840258827056.[0m
[32m[I 2022-04-13 12:25:19,072][0m Trial 482 finished with value: 0.7678574272748236 and parameters: {'splitter': 'best', 'min_samples_split': 0.13838218207737596, 'min_samples_leaf': 0.055325471366865546, 'min_weight_fraction_leaf': 0.016819101649820912, 'max_features': 0.9526900323270252}. Best is trial 241 with value: 0.7773840258827056.[0m
[32m[I 2022-04-13 12:25:21,203][0m Trial 483 finished with value: 0.7761300334471601 and parameters: {'splitter': 'best', 'min_samples_split': 0.11542621893385346, 'min_samples_leaf': 0.03409113667248123, 'min_weight_fraction_leaf': 0.020628289826780694, 'max_features': 0.9814183362103868}. Best is trial 241 with value: 0.7773840258827056.[0m
[32m[I 2022-04-13 12:25:23,731][0m Trial 484 finished with value: 0.7627945013810864 and parameters: {'splitter': 'best', 'min_samples_split': 0.11989003556173067, 'min_samples_leaf': 0.035258112413579276, 'min_weight_fraction_leaf': 0.01095562061496461, 'max_features': 0.926213481916031}. Best is trial 241 with value: 0.7773840258827056.[0m
[32m[I 2022-04-13 12:25:24,838][0m Trial 485 finished with value: 0.753359155476071 and parameters: {'splitter': 'best', 'min_samples_split': 0.14222901124695253, 'min_samples_leaf': 0.04955053070516977, 'min_weight_fraction_leaf': 0.021095605903638587, 'max_features': 0.48181413715102506}. Best is trial 241 with value: 0.7773840258827056.[0m
[32m[I 2022-04-13 12:25:27,721][0m Trial 486 finished with value: 0.7692922430830655 and parameters: {'splitter': 'best', 'min_samples_split': 0.03172651028961879, 'min_samples_leaf': 0.04121167032924957, 'min_weight_fraction_leaf': 0.00857150410538441, 'max_features': 0.9675658783627697}. Best is trial 241 with value: 0.7773840258827056.[0m
[32m[I 2022-04-13 12:25:29,474][0m Trial 487 finished with value: 0.7711992839858441 and parameters: {'splitter': 'best', 'min_samples_split': 0.12830909952691955, 'min_samples_leaf': 0.06210538812820803, 'min_weight_fraction_leaf': 0.02247349379436389, 'max_features': 0.9790066380960424}. Best is trial 241 with value: 0.7773840258827056.[0m
[32m[I 2022-04-13 12:25:30,266][0m Trial 488 finished with value: 0.5952180453030295 and parameters: {'splitter': 'best', 'min_samples_split': 0.15796710487230184, 'min_samples_leaf': 0.032914237328829726, 'min_weight_fraction_leaf': 0.3861627859797401, 'max_features': 0.8942951028243877}. Best is trial 241 with value: 0.7773840258827056.[0m
[32m[I 2022-04-13 12:25:32,408][0m Trial 489 finished with value: 0.7605294851257207 and parameters: {'splitter': 'best', 'min_samples_split': 0.11589634094151188, 'min_samples_leaf': 0.07660222026351772, 'min_weight_fraction_leaf': 0.015480815910230162, 'max_features': 0.9540223916601904}. Best is trial 241 with value: 0.7773840258827056.[0m
[32m[I 2022-04-13 12:25:34,208][0m Trial 490 finished with value: 0.7651575772710213 and parameters: {'splitter': 'best', 'min_samples_split': 0.14981749816607187, 'min_samples_leaf': 0.09316894921575523, 'min_weight_fraction_leaf': 0.029461813043185365, 'max_features': 0.9791139575356341}. Best is trial 241 with value: 0.7773840258827056.[0m
[32m[I 2022-04-13 12:25:35,095][0m Trial 491 finished with value: 0.7660962812781558 and parameters: {'splitter': 'best', 'min_samples_split': 0.13409026915493488, 'min_samples_leaf': 0.05245796409954077, 'min_weight_fraction_leaf': 0.025685433625186993, 'max_features': 0.9410262870422301}. Best is trial 241 with value: 0.7773840258827056.[0m
[32m[I 2022-04-13 12:25:35,565][0m Trial 492 finished with value: 0.7405437167475782 and parameters: {'splitter': 'best', 'min_samples_split': 0.1211669903260891, 'min_samples_leaf': 0.043813344412545786, 'min_weight_fraction_leaf': 0.012679372693212551, 'max_features': 0.3156142433194773}. Best is trial 241 with value: 0.7773840258827056.[0m
[32m[I 2022-04-13 12:25:37,563][0m Trial 493 finished with value: 0.7113383882493189 and parameters: {'splitter': 'best', 'min_samples_split': 0.11479352293006717, 'min_samples_leaf': 0.03160538984684455, 'min_weight_fraction_leaf': 0.19477773972232404, 'max_features': 0.9660598425268262}. Best is trial 241 with value: 0.7773840258827056.[0m
[32m[I 2022-04-13 12:25:38,464][0m Trial 494 finished with value: 0.7238136741594238 and parameters: {'splitter': 'best', 'min_samples_split': 0.4535242565643415, 'min_samples_leaf': 0.05529557522579753, 'min_weight_fraction_leaf': 0.024496039113430703, 'max_features': 0.9833422379237636}. Best is trial 241 with value: 0.7773840258827056.[0m
[32m[I 2022-04-13 12:25:40,766][0m Trial 495 finished with value: 0.76980484181515 and parameters: {'splitter': 'best', 'min_samples_split': 0.009773240791944186, 'min_samples_leaf': 0.0337706367816598, 'min_weight_fraction_leaf': 0.010658077424338896, 'max_features': 0.9508514785239269}. Best is trial 241 with value: 0.7773840258827056.[0m
[32m[I 2022-04-13 12:25:42,508][0m Trial 496 finished with value: 0.7714658621533939 and parameters: {'splitter': 'best', 'min_samples_split': 0.12498113335251305, 'min_samples_leaf': 0.047213384633871286, 'min_weight_fraction_leaf': 0.03336251248626547, 'max_features': 0.9806992749686168}. Best is trial 241 with value: 0.7773840258827056.[0m
[32m[I 2022-04-13 12:25:44,341][0m Trial 497 finished with value: 0.7749904581130769 and parameters: {'splitter': 'best', 'min_samples_split': 0.13467981698880702, 'min_samples_leaf': 0.03936260474797417, 'min_weight_fraction_leaf': 0.01771956455949862, 'max_features': 0.9986765908164877}. Best is trial 241 with value: 0.7773840258827056.[0m
[32m[I 2022-04-13 12:25:47,050][0m Trial 498 finished with value: 0.7659895454226339 and parameters: {'splitter': 'best', 'min_samples_split': 0.1487160284836474, 'min_samples_leaf': 0.06450148446766782, 'min_weight_fraction_leaf': 0.001567573250884349, 'max_features': 0.9278421547785624}. Best is trial 241 with value: 0.7773840258827056.[0m
[32m[I 2022-04-13 12:25:47,282][0m Trial 499 finished with value: 0.7607778294145446 and parameters: {'splitter': 'random', 'min_samples_split': 0.1365568312014754, 'min_samples_leaf': 0.04267846977658647, 'min_weight_fraction_leaf': 4.3039498533119225e-05, 'max_features': 0.9608910445885848}. Best is trial 241 with value: 0.7773840258827056.[0m
[32m[I 2022-04-13 12:25:48,265][0m Trial 500 finished with value: 0.7676328557548676 and parameters: {'splitter': 'best', 'min_samples_split': 0.17094483507726577, 'min_samples_leaf': 0.0539514514933889, 'min_weight_fraction_leaf': 0.020208822518788076, 'max_features': 0.9813546266508211}. Best is trial 241 with value: 0.7773840258827056.[0m
[32m[I 2022-04-13 12:25:50,750][0m Trial 501 finished with value: 0.7632828448088322 and parameters: {'splitter': 'best', 'min_samples_split': 0.1425843684649372, 'min_samples_leaf': 0.03968334833509013, 'min_weight_fraction_leaf': 0.018413421481880125, 'max_features': 0.9653484216303178}. Best is trial 241 with value: 0.7773840258827056.[0m
[32m[I 2022-04-13 12:25:52,883][0m Trial 502 finished with value: 0.765898687631687 and parameters: {'splitter': 'best', 'min_samples_split': 0.13289021203209425, 'min_samples_leaf': 0.07196540094270745, 'min_weight_fraction_leaf': 0.010720095583198107, 'max_features': 0.9422747105268}. Best is trial 241 with value: 0.7773840258827056.[0m
[32m[I 2022-04-13 12:25:55,200][0m Trial 503 finished with value: 0.7697767997030442 and parameters: {'splitter': 'best', 'min_samples_split': 0.15329526315139363, 'min_samples_leaf': 0.058648106077923035, 'min_weight_fraction_leaf': 0.04221937121940009, 'max_features': 0.9799317494729549}. Best is trial 241 with value: 0.7773840258827056.[0m
[32m[I 2022-04-13 12:25:57,311][0m Trial 504 finished with value: 0.7729551356512465 and parameters: {'splitter': 'best', 'min_samples_split': 0.12927087708856505, 'min_samples_leaf': 0.0458796763967593, 'min_weight_fraction_leaf': 0.02521746271545216, 'max_features': 0.9987565799127}. Best is trial 241 with value: 0.7773840258827056.[0m
[32m[I 2022-04-13 12:26:00,437][0m Trial 505 finished with value: 0.7631331370330171 and parameters: {'splitter': 'best', 'min_samples_split': 0.1382014871457934, 'min_samples_leaf': 0.03146990835005965, 'min_weight_fraction_leaf': 0.009536216692622598, 'max_features': 0.9628589243264081}. Best is trial 241 with value: 0.7773840258827056.[0m
[32m[I 2022-04-13 12:26:03,090][0m Trial 506 finished with value: 0.7681499331885474 and parameters: {'splitter': 'best', 'min_samples_split': 0.04426669625014357, 'min_samples_leaf': 0.039778379124451785, 'min_weight_fraction_leaf': 0.019074212751668335, 'max_features': 0.9838785998581328}. Best is trial 241 with value: 0.7773840258827056.[0m
[32m[I 2022-04-13 12:26:05,111][0m Trial 507 finished with value: 0.768061111924508 and parameters: {'splitter': 'best', 'min_samples_split': 0.12543274021800033, 'min_samples_leaf': 0.05103987552967966, 'min_weight_fraction_leaf': 0.03991229751981645, 'max_features': 0.9155159859870312}. Best is trial 241 with value: 0.7773840258827056.[0m
[32m[I 2022-04-13 12:26:07,492][0m Trial 508 finished with value: 0.746751366158916 and parameters: {'splitter': 'best', 'min_samples_split': 0.1595816637360971, 'min_samples_leaf': 0.03067581720310833, 'min_weight_fraction_leaf': 0.051209738759923316, 'max_features': 0.748214688878834}. Best is trial 241 with value: 0.7773840258827056.[0m
[32m[I 2022-04-13 12:26:09,548][0m Trial 509 finished with value: 0.7651071080010033 and parameters: {'splitter': 'best', 'min_samples_split': 0.0697390869104386, 'min_samples_leaf': 0.06009485569172231, 'min_weight_fraction_leaf': 8.276390577940246e-05, 'max_features': 0.9472922535936126}. Best is trial 241 with value: 0.7773840258827056.[0m
[32m[I 2022-04-13 12:26:10,426][0m Trial 510 finished with value: 0.7317427893487037 and parameters: {'splitter': 'best', 'min_samples_split': 0.14598856818604508, 'min_samples_leaf': 0.04030167138669784, 'min_weight_fraction_leaf': 0.13307927499388192, 'max_features': 0.9679231131906569}. Best is trial 241 with value: 0.7773840258827056.[0m
[32m[I 2022-04-13 12:26:11,299][0m Trial 511 finished with value: 0.7747005666883504 and parameters: {'splitter': 'best', 'min_samples_split': 0.11447459066944672, 'min_samples_leaf': 0.029343995872137894, 'min_weight_fraction_leaf': 0.029477024721471196, 'max_features': 0.982686773401397}. Best is trial 241 with value: 0.7773840258827056.[0m
