[32m[I 2022-04-15 10:17:48,971][0m Trial 735 finished with value: 0.7267605281237429 and parameters: {'loss': 'coxph', 'learning_rate': 0.003091353602791193, 'n_estimators': 580, 'criterion': 'friedman_mse', 'min_samples_split': 6, 'min_samples_leaf': 2, 'min_weight_fraction_leaf': 0.0741371486230686, 'min_impurity_decrease': 0.46320398732203133, 'max_features': 0.7604611012465569, 'subsample': 0.8062722265715766, 'dropout_rate': 0.6333472736376106, 'ccp_alpha': 0.09487542596648452}. Best is trial 712 with value: 0.7824105962295036.[0m
[32m[I 2022-04-15 10:18:52,995][0m Trial 736 finished with value: 0.7341961767983693 and parameters: {'loss': 'coxph', 'learning_rate': 0.0038365489417618082, 'n_estimators': 547, 'criterion': 'friedman_mse', 'min_samples_split': 6, 'min_samples_leaf': 2, 'min_weight_fraction_leaf': 0.09337247747070539, 'min_impurity_decrease': 0.4344849716834847, 'max_features': 0.809832478954845, 'subsample': 0.7783421778511836, 'dropout_rate': 0.6195993282707083, 'ccp_alpha': 0.08882659714938945}. Best is trial 712 with value: 0.7824105962295036.[0m
[32m[I 2022-04-15 10:19:59,603][0m Trial 737 finished with value: 0.7767703738100966 and parameters: {'loss': 'coxph', 'learning_rate': 0.0027152448612960496, 'n_estimators': 509, 'criterion': 'friedman_mse', 'min_samples_split': 6, 'min_samples_leaf': 2, 'min_weight_fraction_leaf': 0.0788304600036741, 'min_impurity_decrease': 0.4541327013850181, 'max_features': 0.7208246984229035, 'subsample': 0.761672607571988, 'dropout_rate': 0.5910932205947959, 'ccp_alpha': 0.002667255373106743}. Best is trial 712 with value: 0.7824105962295036.[0m
[32m[I 2022-04-15 10:20:57,336][0m Trial 738 finished with value: 0.5 and parameters: {'loss': 'coxph', 'learning_rate': 0.002746097138336387, 'n_estimators': 502, 'criterion': 'friedman_mse', 'min_samples_split': 6, 'min_samples_leaf': 2, 'min_weight_fraction_leaf': 0.08375330742310846, 'min_impurity_decrease': 0.4184198154156924, 'max_features': 0.7236401820602588, 'subsample': 0.7697915459897818, 'dropout_rate': 0.5774968458820707, 'ccp_alpha': 0.2669599673395262}. Best is trial 712 with value: 0.7824105962295036.[0m
[32m[I 2022-04-15 10:22:09,191][0m Trial 739 finished with value: 0.6743624146605087 and parameters: {'loss': 'coxph', 'learning_rate': 0.0024386787449675986, 'n_estimators': 564, 'criterion': 'friedman_mse', 'min_samples_split': 6, 'min_samples_leaf': 2, 'min_weight_fraction_leaf': 0.07690414221831197, 'min_impurity_decrease': 0.44800124918816225, 'max_features': 0.7137383817171481, 'subsample': 0.7700037420444001, 'dropout_rate': 0.5967756753452013, 'ccp_alpha': 0.18095198391070727}. Best is trial 712 with value: 0.7824105962295036.[0m
[32m[I 2022-04-15 10:23:12,465][0m Trial 740 finished with value: 0.7321667752529487 and parameters: {'loss': 'coxph', 'learning_rate': 0.0026937621653105584, 'n_estimators': 537, 'criterion': 'friedman_mse', 'min_samples_split': 6, 'min_samples_leaf': 2, 'min_weight_fraction_leaf': 0.09231882689135315, 'min_impurity_decrease': 0.4674715016869036, 'max_features': 0.7456952274537446, 'subsample': 0.7564462923744315, 'dropout_rate': 0.6157952354435886, 'ccp_alpha': 0.09297810044295271}. Best is trial 712 with value: 0.7824105962295036.[0m
[32m[I 2022-04-15 10:24:41,626][0m Trial 741 finished with value: 0.5 and parameters: {'loss': 'coxph', 'learning_rate': 0.0035521829298777135, 'n_estimators': 579, 'criterion': 'absolute_error', 'min_samples_split': 6, 'min_samples_leaf': 2, 'min_weight_fraction_leaf': 0.07127601125477406, 'min_impurity_decrease': 0.4379385454943926, 'max_features': 0.7182622766789284, 'subsample': 0.8078514358622573, 'dropout_rate': 0.6442494762237488, 'ccp_alpha': 0.33963310590325224}. Best is trial 712 with value: 0.7824105962295036.[0m
[32m[I 2022-04-15 10:25:41,668][0m Trial 742 finished with value: 0.6743624146605087 and parameters: {'loss': 'coxph', 'learning_rate': 0.002793147887828088, 'n_estimators': 509, 'criterion': 'friedman_mse', 'min_samples_split': 6, 'min_samples_leaf': 2, 'min_weight_fraction_leaf': 0.08014022806233671, 'min_impurity_decrease': 0.4169353798503493, 'max_features': 0.7398207233764765, 'subsample': 0.7894475971426677, 'dropout_rate': 0.6019700877305556, 'ccp_alpha': 0.17717860904752486}. Best is trial 712 with value: 0.7824105962295036.[0m
[32m[I 2022-04-15 10:27:11,143][0m Trial 743 finished with value: 0.5 and parameters: {'loss': 'coxph', 'learning_rate': 0.002216388708659346, 'n_estimators': 625, 'criterion': 'friedman_mse', 'min_samples_split': 6, 'min_samples_leaf': 2, 'min_weight_fraction_leaf': 0.06969092306440455, 'min_impurity_decrease': 0.45691453008085314, 'max_features': 0.7612109506565367, 'subsample': 0.7618957142723928, 'dropout_rate': 0.5898473284420137, 'ccp_alpha': 1.0203713381016601}. Best is trial 712 with value: 0.7824105962295036.[0m
[32m[I 2022-04-15 10:28:20,629][0m Trial 744 finished with value: 0.7761006433012313 and parameters: {'loss': 'coxph', 'learning_rate': 0.0035867300381363567, 'n_estimators': 541, 'criterion': 'friedman_mse', 'min_samples_split': 6, 'min_samples_leaf': 2, 'min_weight_fraction_leaf': 0.06433201433017235, 'min_impurity_decrease': 0.4304444239469758, 'max_features': 0.7788257028994271, 'subsample': 0.8267138141630682, 'dropout_rate': 0.6331203909298398, 'ccp_alpha': 0.004988087270951555}. Best is trial 712 with value: 0.7824105962295036.[0m
[32m[I 2022-04-15 10:29:39,214][0m Trial 745 finished with value: 0.7784164866816184 and parameters: {'loss': 'coxph', 'learning_rate': 0.003999985187368031, 'n_estimators': 593, 'criterion': 'friedman_mse', 'min_samples_split': 6, 'min_samples_leaf': 2, 'min_weight_fraction_leaf': 0.06483775112409473, 'min_impurity_decrease': 0.44273385564546497, 'max_features': 0.7324202126847147, 'subsample': 0.8102650179081289, 'dropout_rate': 0.634611836252513, 'ccp_alpha': 0.0019371804955182915}. Best is trial 712 with value: 0.7824105962295036.[0m
[32m[I 2022-04-15 10:30:49,468][0m Trial 746 finished with value: 0.7789701821020434 and parameters: {'loss': 'coxph', 'learning_rate': 0.0038352401010597614, 'n_estimators': 553, 'criterion': 'friedman_mse', 'min_samples_split': 6, 'min_samples_leaf': 2, 'min_weight_fraction_leaf': 0.07834116399336291, 'min_impurity_decrease': 0.4217466797659287, 'max_features': 0.7200572466849909, 'subsample': 0.8194415139224153, 'dropout_rate': 0.6592182104282245, 'ccp_alpha': 0.0013850861318990154}. Best is trial 712 with value: 0.7824105962295036.[0m
[32m[I 2022-04-15 10:32:12,063][0m Trial 747 finished with value: 0.7200905767426 and parameters: {'loss': 'coxph', 'learning_rate': 0.0040616240067108435, 'n_estimators': 613, 'criterion': 'friedman_mse', 'min_samples_split': 6, 'min_samples_leaf': 2, 'min_weight_fraction_leaf': 0.08270780832376479, 'min_impurity_decrease': 0.4477200603483306, 'max_features': 0.7155882652081681, 'subsample': 0.8206143433423938, 'dropout_rate': 0.6310463134464129, 'ccp_alpha': 0.10081178935682382}. Best is trial 712 with value: 0.7824105962295036.[0m
[32m[I 2022-04-15 10:33:36,467][0m Trial 748 finished with value: 0.6048504596593662 and parameters: {'loss': 'coxph', 'learning_rate': 0.004194569972677745, 'n_estimators': 651, 'criterion': 'friedman_mse', 'min_samples_split': 6, 'min_samples_leaf': 2, 'min_weight_fraction_leaf': 0.0947920913687654, 'min_impurity_decrease': 0.46350457245182325, 'max_features': 0.7010313497087736, 'subsample': 0.8232161404751492, 'dropout_rate': 0.6105665656272941, 'ccp_alpha': 0.18455153544862957}. Best is trial 712 with value: 0.7824105962295036.[0m
[32m[I 2022-04-15 10:34:44,151][0m Trial 749 finished with value: 0.7273445802302455 and parameters: {'loss': 'coxph', 'learning_rate': 0.0032837550933935513, 'n_estimators': 553, 'criterion': 'friedman_mse', 'min_samples_split': 6, 'min_samples_leaf': 2, 'min_weight_fraction_leaf': 0.07487561803266692, 'min_impurity_decrease': 0.42703150659564665, 'max_features': 0.7057727562416247, 'subsample': 0.7796368977858925, 'dropout_rate': 0.634459076744494, 'ccp_alpha': 0.09820810090797957}. Best is trial 712 with value: 0.7824105962295036.[0m
[32m[I 2022-04-15 10:35:49,297][0m Trial 750 finished with value: 0.5 and parameters: {'loss': 'coxph', 'learning_rate': 0.003665387639702643, 'n_estimators': 552, 'criterion': 'friedman_mse', 'min_samples_split': 6, 'min_samples_leaf': 2, 'min_weight_fraction_leaf': 0.06539278718073062, 'min_impurity_decrease': 0.44575289962132875, 'max_features': 0.7361575362813835, 'subsample': 0.8071568761706925, 'dropout_rate': 0.6348344896009976, 'ccp_alpha': 0.24156159839681415}. Best is trial 712 with value: 0.7824105962295036.[0m
[32m[I 2022-04-15 10:37:08,052][0m Trial 751 finished with value: 0.7239394935819161 and parameters: {'loss': 'coxph', 'learning_rate': 0.003826239677986024, 'n_estimators': 593, 'criterion': 'friedman_mse', 'min_samples_split': 6, 'min_samples_leaf': 2, 'min_weight_fraction_leaf': 0.08867210888506663, 'min_impurity_decrease': 0.46865435899457575, 'max_features': 0.730399355733283, 'subsample': 0.8277235014607214, 'dropout_rate': 0.6609668070376097, 'ccp_alpha': 0.09609903448396667}. Best is trial 712 with value: 0.7824105962295036.[0m
[32m[I 2022-04-15 10:38:11,737][0m Trial 752 finished with value: 0.7286308475869108 and parameters: {'loss': 'coxph', 'learning_rate': 0.004243410913300921, 'n_estimators': 540, 'criterion': 'friedman_mse', 'min_samples_split': 6, 'min_samples_leaf': 2, 'min_weight_fraction_leaf': 0.06995214647101994, 'min_impurity_decrease': 0.4245463545165615, 'max_features': 0.7203870465255174, 'subsample': 0.8364148749314985, 'dropout_rate': 0.6494982442435845, 'ccp_alpha': 0.09123930367268852}. Best is trial 712 with value: 0.7824105962295036.[0m
[32m[I 2022-04-15 10:38:50,714][0m Trial 753 finished with value: 0.5 and parameters: {'loss': 'squared', 'learning_rate': 0.0030949048706168185, 'n_estimators': 596, 'criterion': 'friedman_mse', 'min_samples_split': 6, 'min_samples_leaf': 2, 'min_weight_fraction_leaf': 0.07992254645823364, 'min_impurity_decrease': 0.4476139431910868, 'max_features': 0.3013644796414736, 'subsample': 0.8002810451953732, 'dropout_rate': 0.6534854253871242, 'ccp_alpha': 0.7877343346809997}. Best is trial 712 with value: 0.7824105962295036.[0m
[32m[I 2022-04-15 10:39:54,568][0m Trial 754 finished with value: 0.5 and parameters: {'loss': 'coxph', 'learning_rate': 0.003481105284868198, 'n_estimators': 568, 'criterion': 'squared_error', 'min_samples_split': 6, 'min_samples_leaf': 2, 'min_weight_fraction_leaf': 0.06434716394626344, 'min_impurity_decrease': 0.41070398781067946, 'max_features': 0.6975026032698597, 'subsample': 0.7586301722617338, 'dropout_rate': 0.6168192240695102, 'ccp_alpha': 0.0012921714762312861}. Best is trial 712 with value: 0.7824105962295036.[0m
[32m[I 2022-04-15 10:40:56,219][0m Trial 755 finished with value: 0.5 and parameters: {'loss': 'coxph', 'learning_rate': 0.0026883941299713303, 'n_estimators': 537, 'criterion': 'friedman_mse', 'min_samples_split': 6, 'min_samples_leaf': 2, 'min_weight_fraction_leaf': 0.09038041285567121, 'min_impurity_decrease': 0.4682102334943028, 'max_features': 0.7433057362989687, 'subsample': 0.8093010977646019, 'dropout_rate': 0.6248586508927187, 'ccp_alpha': 0.3017205732355707}. Best is trial 712 with value: 0.7824105962295036.[0m
[32m[I 2022-04-15 10:42:08,484][0m Trial 756 finished with value: 0.6743624146605087 and parameters: {'loss': 'coxph', 'learning_rate': 0.0017947918851199565, 'n_estimators': 582, 'criterion': 'friedman_mse', 'min_samples_split': 6, 'min_samples_leaf': 2, 'min_weight_fraction_leaf': 0.07605974144332209, 'min_impurity_decrease': 0.43968735734657816, 'max_features': 0.7125589763576621, 'subsample': 0.8393752789251023, 'dropout_rate': 0.648238655754361, 'ccp_alpha': 0.15827344866398868}. Best is trial 712 with value: 0.7824105962295036.[0m
[32m[I 2022-04-15 10:43:31,210][0m Trial 757 finished with value: 0.6743624146605087 and parameters: {'loss': 'coxph', 'learning_rate': 0.003944496905900277, 'n_estimators': 632, 'criterion': 'friedman_mse', 'min_samples_split': 6, 'min_samples_leaf': 2, 'min_weight_fraction_leaf': 0.06429368356834483, 'min_impurity_decrease': 0.46526689248923947, 'max_features': 0.7285467391065108, 'subsample': 0.7651833577472196, 'dropout_rate': 0.580665454217795, 'ccp_alpha': 0.17825293592061683}. Best is trial 712 with value: 0.7824105962295036.[0m
[32m[I 2022-04-15 10:44:41,136][0m Trial 758 finished with value: 0.7347243469303553 and parameters: {'loss': 'coxph', 'learning_rate': 0.004280657906088737, 'n_estimators': 526, 'criterion': 'friedman_mse', 'min_samples_split': 6, 'min_samples_leaf': 2, 'min_weight_fraction_leaf': 0.08022712446694527, 'min_impurity_decrease': 0.41345450778519377, 'max_features': 0.7541280328869167, 'subsample': 0.7732522015440694, 'dropout_rate': 0.5759367571737215, 'ccp_alpha': 0.08732928078329005}. Best is trial 712 with value: 0.7824105962295036.[0m
[32m[I 2022-04-15 10:45:47,402][0m Trial 759 finished with value: 0.5 and parameters: {'loss': 'coxph', 'learning_rate': 0.0029847585947039928, 'n_estimators': 562, 'criterion': 'friedman_mse', 'min_samples_split': 6, 'min_samples_leaf': 2, 'min_weight_fraction_leaf': 0.09705235254456693, 'min_impurity_decrease': 0.2377157079804115, 'max_features': 0.7454252552627245, 'subsample': 0.7888618394904996, 'dropout_rate': 0.6233701083346982, 'ccp_alpha': 3.7675617640725236}. Best is trial 712 with value: 0.7824105962295036.[0m
[32m[I 2022-04-15 10:46:46,317][0m Trial 760 finished with value: 0.5 and parameters: {'loss': 'coxph', 'learning_rate': 1.520500677476063e-06, 'n_estimators': 527, 'criterion': 'friedman_mse', 'min_samples_split': 7, 'min_samples_leaf': 2, 'min_weight_fraction_leaf': 0.06333446196302965, 'min_impurity_decrease': 0.4378349737506613, 'max_features': 0.7017115871085314, 'subsample': 0.8217672861475509, 'dropout_rate': 0.6612139214200979, 'ccp_alpha': 0.2594629935571103}. Best is trial 712 with value: 0.7824105962295036.[0m
[32m[I 2022-04-15 10:48:21,570][0m Trial 761 finished with value: 0.7783504904230016 and parameters: {'loss': 'coxph', 'learning_rate': 0.002332522442850665, 'n_estimators': 592, 'criterion': 'friedman_mse', 'min_samples_split': 6, 'min_samples_leaf': 2, 'min_weight_fraction_leaf': 0.07135937608564948, 'min_impurity_decrease': 0.4527308417099249, 'max_features': 0.7533165502157595, 'subsample': 0.7823896342881579, 'dropout_rate': 0.5187843582450513, 'ccp_alpha': 0.001106678636565972}. Best is trial 712 with value: 0.7824105962295036.[0m
[32m[I 2022-04-15 10:49:50,680][0m Trial 762 finished with value: 0.7372279190148309 and parameters: {'loss': 'coxph', 'learning_rate': 0.0024132880140389857, 'n_estimators': 615, 'criterion': 'friedman_mse', 'min_samples_split': 6, 'min_samples_leaf': 2, 'min_weight_fraction_leaf': 0.08631194890034821, 'min_impurity_decrease': 0.455045717711371, 'max_features': 0.4054492047009397, 'subsample': 0.7886055098522025, 'dropout_rate': 0.5122997679618927, 'ccp_alpha': 0.08935226169522027}. Best is trial 712 with value: 0.7824105962295036.[0m
[32m[I 2022-04-15 10:51:38,405][0m Trial 763 finished with value: 0.5 and parameters: {'loss': 'coxph', 'learning_rate': 0.0021737294040734363, 'n_estimators': 594, 'criterion': 'absolute_error', 'min_samples_split': 6, 'min_samples_leaf': 2, 'min_weight_fraction_leaf': 0.07383360954141742, 'min_impurity_decrease': 0.4728017307857992, 'max_features': 0.7288528931953177, 'subsample': 0.8103357026542282, 'dropout_rate': 0.5218789096572936, 'ccp_alpha': 0.1882057528760539}. Best is trial 712 with value: 0.7824105962295036.[0m
[32m[I 2022-04-15 10:53:13,151][0m Trial 764 finished with value: 0.5 and parameters: {'loss': 'coxph', 'learning_rate': 0.0018461355820399428, 'n_estimators': 673, 'criterion': 'friedman_mse', 'min_samples_split': 6, 'min_samples_leaf': 2, 'min_weight_fraction_leaf': 0.07424934537960015, 'min_impurity_decrease': 0.42594967340966183, 'max_features': 0.7562417591412373, 'subsample': 0.8494046508925124, 'dropout_rate': 0.6084392627688656, 'ccp_alpha': 0.4057976587229566}. Best is trial 712 with value: 0.7824105962295036.[0m
[32m[I 2022-04-15 10:54:45,550][0m Trial 765 finished with value: 0.7773089488491008 and parameters: {'loss': 'coxph', 'learning_rate': 0.0029516936609759368, 'n_estimators': 640, 'criterion': 'friedman_mse', 'min_samples_split': 6, 'min_samples_leaf': 2, 'min_weight_fraction_leaf': 0.05828585433912804, 'min_impurity_decrease': 0.4535255442773334, 'max_features': 0.7644005741916473, 'subsample': 0.780736937769294, 'dropout_rate': 0.6394231352548787, 'ccp_alpha': 0.0038173754083405858}. Best is trial 712 with value: 0.7824105962295036.[0m
[32m[I 2022-04-15 10:56:10,015][0m Trial 766 finished with value: 0.7351660648101344 and parameters: {'loss': 'coxph', 'learning_rate': 0.0027099443026171043, 'n_estimators': 690, 'criterion': 'friedman_mse', 'min_samples_split': 6, 'min_samples_leaf': 2, 'min_weight_fraction_leaf': 0.058791910921150756, 'min_impurity_decrease': 0.4078562659598272, 'max_features': 0.732734565667081, 'subsample': 0.7772087071099959, 'dropout_rate': 0.6766805110136754, 'ccp_alpha': 0.08773385345746589}. Best is trial 712 with value: 0.7824105962295036.[0m
[32m[I 2022-04-15 10:57:37,494][0m Trial 767 finished with value: 0.7752253448832572 and parameters: {'loss': 'coxph', 'learning_rate': 0.0030019062776214574, 'n_estimators': 617, 'criterion': 'friedman_mse', 'min_samples_split': 6, 'min_samples_leaf': 2, 'min_weight_fraction_leaf': 0.08463473816035669, 'min_impurity_decrease': 0.4725169346779658, 'max_features': 0.7561275613048125, 'subsample': 0.7566431238249771, 'dropout_rate': 0.6388843083175243, 'ccp_alpha': 0.0013953841296113507}. Best is trial 712 with value: 0.7824105962295036.[0m
[32m[I 2022-04-15 10:59:05,414][0m Trial 768 finished with value: 0.7778784004290296 and parameters: {'loss': 'coxph', 'learning_rate': 0.0016367791306882875, 'n_estimators': 635, 'criterion': 'friedman_mse', 'min_samples_split': 6, 'min_samples_leaf': 2, 'min_weight_fraction_leaf': 0.06097229466107871, 'min_impurity_decrease': 0.39512282557852346, 'max_features': 0.7101457599324936, 'subsample': 0.7984385010391567, 'dropout_rate': 0.6465342951259176, 'ccp_alpha': 0.0016038951474882206}. Best is trial 712 with value: 0.7824105962295036.[0m
[32m[I 2022-04-15 11:00:21,705][0m Trial 769 finished with value: 0.6743624146605087 and parameters: {'loss': 'coxph', 'learning_rate': 0.0016461735615606013, 'n_estimators': 635, 'criterion': 'friedman_mse', 'min_samples_split': 6, 'min_samples_leaf': 2, 'min_weight_fraction_leaf': 0.07410223581711296, 'min_impurity_decrease': 0.38493640473262586, 'max_features': 0.725986514555587, 'subsample': 0.7926558118563927, 'dropout_rate': 0.6493700167415031, 'ccp_alpha': 0.1757405598827534}. Best is trial 712 with value: 0.7824105962295036.[0m
[32m[I 2022-04-15 11:01:43,511][0m Trial 770 finished with value: 0.5 and parameters: {'loss': 'coxph', 'learning_rate': 0.002316637605353792, 'n_estimators': 670, 'criterion': 'friedman_mse', 'min_samples_split': 6, 'min_samples_leaf': 2, 'min_weight_fraction_leaf': 0.06249460626425089, 'min_impurity_decrease': 0.3968658460142078, 'max_features': 0.7011095209931766, 'subsample': 0.7752743300294012, 'dropout_rate': 0.6768851065667149, 'ccp_alpha': 0.31065721881593444}. Best is trial 712 with value: 0.7824105962295036.[0m
[32m[I 2022-04-15 11:03:24,634][0m Trial 771 finished with value: 0.5 and parameters: {'loss': 'coxph', 'learning_rate': 0.0019538355596771554, 'n_estimators': 710, 'criterion': 'friedman_mse', 'min_samples_split': 6, 'min_samples_leaf': 2, 'min_weight_fraction_leaf': 0.0946563284005538, 'min_impurity_decrease': 0.43255699021383476, 'max_features': 0.7065268386986044, 'subsample': 0.8035828746074306, 'dropout_rate': 0.6329246448112295, 'ccp_alpha': 2.084513709926117}. Best is trial 712 with value: 0.7824105962295036.[0m
[32m[I 2022-04-15 11:04:49,711][0m Trial 772 finished with value: 0.7250784475199511 and parameters: {'loss': 'coxph', 'learning_rate': 0.0030199473639662476, 'n_estimators': 669, 'criterion': 'friedman_mse', 'min_samples_split': 6, 'min_samples_leaf': 2, 'min_weight_fraction_leaf': 0.0820057064565602, 'min_impurity_decrease': 0.4496635334420889, 'max_features': 0.7187369561390916, 'subsample': 0.7892877695990003, 'dropout_rate': 0.6615706381022441, 'ccp_alpha': 0.09899502727261188}. Best is trial 712 with value: 0.7824105962295036.[0m
[32m[I 2022-04-15 11:05:42,259][0m Trial 773 finished with value: 0.5 and parameters: {'loss': 'squared', 'learning_rate': 0.0023687724449552175, 'n_estimators': 659, 'criterion': 'friedman_mse', 'min_samples_split': 7, 'min_samples_leaf': 2, 'min_weight_fraction_leaf': 0.07000814699031307, 'min_impurity_decrease': 0.4757637570296921, 'max_features': 0.7408195186941758, 'subsample': 0.808957434734345, 'dropout_rate': 0.6421658044112127, 'ccp_alpha': 2.8323879454554612}. Best is trial 712 with value: 0.7824105962295036.[0m
[32m[I 2022-04-15 11:07:02,107][0m Trial 774 finished with value: 0.5690989051799592 and parameters: {'loss': 'coxph', 'learning_rate': 0.0017208353418446468, 'n_estimators': 644, 'criterion': 'friedman_mse', 'min_samples_split': 6, 'min_samples_leaf': 2, 'min_weight_fraction_leaf': 0.060331801812628885, 'min_impurity_decrease': 0.17649108020625262, 'max_features': 0.6973701603316871, 'subsample': 0.7584827516702856, 'dropout_rate': 0.6278903891459684, 'ccp_alpha': 0.18877528692654968}. Best is trial 712 with value: 0.7824105962295036.[0m
