[32m[I 2022-04-15 02:17:35,333][0m Trial 10 finished with value: 0.5 and parameters: {'loss': 'coxph', 'learning_rate': 0.000623676815808108, 'n_estimators': 910, 'criterion': 'absolute_error', 'min_samples_split': 10, 'min_samples_leaf': 5, 'min_weight_fraction_leaf': 0.006195661409582276, 'min_impurity_decrease': 0.3487301833929176, 'max_features': 0.4501479550598799, 'subsample': 0.03442453533609213, 'dropout_rate': 0.9014443860081343, 'ccp_alpha': 4.774255254017924}. Best is trial 0 with value: 0.5.[0m
[32m[I 2022-04-15 02:17:36,779][0m Trial 11 finished with value: 0.5 and parameters: {'loss': 'squared', 'learning_rate': 0.00313316392086666, 'n_estimators': 114, 'criterion': 'squared_error', 'min_samples_split': 2, 'min_samples_leaf': 1, 'min_weight_fraction_leaf': 0.13888764783414798, 'min_impurity_decrease': 0.4171495812083272, 'max_features': 0.6747206062143547, 'subsample': 0.6982881838420114, 'dropout_rate': 0.7713242575551009, 'ccp_alpha': 1.689783289777084}. Best is trial 0 with value: 0.5.[0m
[32m[I 2022-04-15 02:19:55,391][0m Trial 12 finished with value: 0.5 and parameters: {'loss': 'coxph', 'learning_rate': 0.0024078096121219737, 'n_estimators': 617, 'criterion': 'absolute_error', 'min_samples_split': 3, 'min_samples_leaf': 1, 'min_weight_fraction_leaf': 0.32770480514654177, 'min_impurity_decrease': 0.10400437004324842, 'max_features': 0.5980744644545863, 'subsample': 0.2794257964022566, 'dropout_rate': 0.03487424117538289, 'ccp_alpha': 3.0672737321905723}. Best is trial 0 with value: 0.5.[0m
[32m[I 2022-04-15 02:21:58,302][0m Trial 13 finished with value: 0.5 and parameters: {'loss': 'squared', 'learning_rate': 0.09071000825416332, 'n_estimators': 987, 'criterion': 'squared_error', 'min_samples_split': 8, 'min_samples_leaf': 3, 'min_weight_fraction_leaf': 0.49429837326649345, 'min_impurity_decrease': 0.5605123281648815, 'max_features': 0.28243022230634823, 'subsample': 0.003472866250957718, 'dropout_rate': 0.5930923580774548, 'ccp_alpha': 1.2260693793120359}. Best is trial 0 with value: 0.5.[0m
[32m[I 2022-04-15 02:22:01,558][0m Trial 14 finished with value: 0.5 and parameters: {'loss': 'squared', 'learning_rate': 4.974281480226142e-05, 'n_estimators': 103, 'criterion': 'absolute_error', 'min_samples_split': 4, 'min_samples_leaf': 4, 'min_weight_fraction_leaf': 0.16440997917530514, 'min_impurity_decrease': 0.2306296282900519, 'max_features': 0.5197612277075655, 'subsample': 0.3731627618848459, 'dropout_rate': 0.4323923764570275, 'ccp_alpha': 2.4218587652947496}. Best is trial 0 with value: 0.5.[0m
[32m[I 2022-04-15 02:22:22,268][0m Trial 15 finished with value: 0.5 and parameters: {'loss': 'coxph', 'learning_rate': 0.0015495199698208342, 'n_estimators': 300, 'criterion': 'squared_error', 'min_samples_split': 9, 'min_samples_leaf': 7, 'min_weight_fraction_leaf': 0.287627973226833, 'min_impurity_decrease': 0.6547938234754165, 'max_features': 0.24451277044661013, 'subsample': 0.6739576578342801, 'dropout_rate': 0.7876345130070473, 'ccp_alpha': 3.7548833876111187}. Best is trial 0 with value: 0.5.[0m
[32m[I 2022-04-15 02:23:43,276][0m Trial 16 finished with value: 0.5 and parameters: {'loss': 'coxph', 'learning_rate': 0.00010439533326688687, 'n_estimators': 450, 'criterion': 'absolute_error', 'min_samples_split': 6, 'min_samples_leaf': 2, 'min_weight_fraction_leaf': 0.08222705037325424, 'min_impurity_decrease': 0.48342548813062874, 'max_features': 0.40741172087573313, 'subsample': 0.12854112569897702, 'dropout_rate': 0.11846683653917334, 'ccp_alpha': 0.940996792974159}. Best is trial 0 with value: 0.5.[0m
[32m[I 2022-04-15 02:23:46,258][0m Trial 17 finished with value: 0.5 and parameters: {'loss': 'squared', 'learning_rate': 9.723659869546296e-05, 'n_estimators': 108, 'criterion': 'absolute_error', 'min_samples_split': 4, 'min_samples_leaf': 4, 'min_weight_fraction_leaf': 0.1769227533304972, 'min_impurity_decrease': 0.22455598677927885, 'max_features': 0.5146992241430273, 'subsample': 0.30770226926373706, 'dropout_rate': 0.47725736716358025, 'ccp_alpha': 2.3094260685238823}. Best is trial 0 with value: 0.5.[0m
[32m[I 2022-04-15 02:24:10,342][0m Trial 18 finished with value: 0.5 and parameters: {'loss': 'coxph', 'learning_rate': 0.001121928743658167, 'n_estimators': 314, 'criterion': 'squared_error', 'min_samples_split': 9, 'min_samples_leaf': 7, 'min_weight_fraction_leaf': 0.28234042614889676, 'min_impurity_decrease': 0.668081223322048, 'max_features': 0.17855548629828377, 'subsample': 0.8054821569529853, 'dropout_rate': 0.771313213687911, 'ccp_alpha': 3.989865854604653}. Best is trial 0 with value: 0.5.[0m
[32m[I 2022-04-15 02:25:48,114][0m Trial 19 finished with value: 0.5 and parameters: {'loss': 'coxph', 'learning_rate': 9.81368325348662e-05, 'n_estimators': 509, 'criterion': 'absolute_error', 'min_samples_split': 6, 'min_samples_leaf': 2, 'min_weight_fraction_leaf': 0.07758683483387355, 'min_impurity_decrease': 0.4506712744942103, 'max_features': 0.39142905494120217, 'subsample': 0.12557151655359977, 'dropout_rate': 0.13747529072747888, 'ccp_alpha': 0.9802708952481737}. Best is trial 0 with value: 0.5.[0m
[32m[I 2022-04-15 02:25:53,842][0m Trial 20 finished with value: 0.5 and parameters: {'loss': 'squared', 'learning_rate': 2.772052038381847e-05, 'n_estimators': 204, 'criterion': 'absolute_error', 'min_samples_split': 4, 'min_samples_leaf': 4, 'min_weight_fraction_leaf': 0.20426835786137465, 'min_impurity_decrease': 0.02664723728083429, 'max_features': 0.020806021525066037, 'subsample': 0.29715060340159344, 'dropout_rate': 0.5988801199845092, 'ccp_alpha': 3.0321181911984385}. Best is trial 0 with value: 0.5.[0m
[32m[I 2022-04-15 02:26:26,614][0m Trial 21 finished with value: 0.5 and parameters: {'loss': 'coxph', 'learning_rate': 0.0011089450178214954, 'n_estimators': 371, 'criterion': 'absolute_error', 'min_samples_split': 8, 'min_samples_leaf': 6, 'min_weight_fraction_leaf': 0.28257732875675323, 'min_impurity_decrease': 0.2417789644434136, 'max_features': 0.17161643814156363, 'subsample': 0.814143555675001, 'dropout_rate': 0.7698256530190044, 'ccp_alpha': 4.631493325024104}. Best is trial 0 with value: 0.5.[0m
[32m[I 2022-04-15 02:27:28,289][0m Trial 22 finished with value: 0.5 and parameters: {'loss': 'coxph', 'learning_rate': 0.0001856033850454859, 'n_estimators': 612, 'criterion': 'absolute_error', 'min_samples_split': 9, 'min_samples_leaf': 8, 'min_weight_fraction_leaf': 0.10317791775783525, 'min_impurity_decrease': 0.48338993630738797, 'max_features': 0.18022703397227607, 'subsample': 0.09911550247746706, 'dropout_rate': 0.8899923788312148, 'ccp_alpha': 4.207426969935654}. Best is trial 0 with value: 0.5.[0m
[32m[I 2022-04-15 02:29:25,734][0m Trial 23 finished with value: 0.5 and parameters: {'loss': 'coxph', 'learning_rate': 2.3330528376524474e-05, 'n_estimators': 763, 'criterion': 'absolute_error', 'min_samples_split': 6, 'min_samples_leaf': 4, 'min_weight_fraction_leaf': 0.012099414812030723, 'min_impurity_decrease': 0.04350184150993547, 'max_features': 0.012309596477862662, 'subsample': 0.1862261357892413, 'dropout_rate': 0.620038647538355, 'ccp_alpha': 2.9684410614130394}. Best is trial 0 with value: 0.5.[0m
[32m[I 2022-04-15 02:29:43,878][0m Trial 24 finished with value: 0.5 and parameters: {'loss': 'coxph', 'learning_rate': 0.006188474353450361, 'n_estimators': 239, 'criterion': 'absolute_error', 'min_samples_split': 8, 'min_samples_leaf': 6, 'min_weight_fraction_leaf': 0.2018497515577901, 'min_impurity_decrease': 0.22650759478917032, 'max_features': 0.011765861457655055, 'subsample': 0.46086863586832666, 'dropout_rate': 0.6869179165352437, 'ccp_alpha': 4.755001750890896}. Best is trial 0 with value: 0.5.[0m
[32m[I 2022-04-15 02:30:33,093][0m Trial 25 finished with value: 0.5 and parameters: {'loss': 'coxph', 'learning_rate': 0.00028824305772972924, 'n_estimators': 577, 'criterion': 'absolute_error', 'min_samples_split': 8, 'min_samples_leaf': 9, 'min_weight_fraction_leaf': 0.1141477247750115, 'min_impurity_decrease': 0.32686509374470907, 'max_features': 0.1761380762054411, 'subsample': 0.7864912695949323, 'dropout_rate': 0.8854134022261219, 'ccp_alpha': 4.2620297137514624}. Best is trial 0 with value: 0.5.[0m
[32m[I 2022-04-15 02:31:57,201][0m Trial 26 finished with value: 0.5 and parameters: {'loss': 'coxph', 'learning_rate': 1.1409084952477897e-05, 'n_estimators': 779, 'criterion': 'absolute_error', 'min_samples_split': 9, 'min_samples_leaf': 5, 'min_weight_fraction_leaf': 0.0071946624759518475, 'min_impurity_decrease': 0.025133642805153223, 'max_features': 0.11994469603422322, 'subsample': 0.10297915784731074, 'dropout_rate': 0.9149289363164356, 'ccp_alpha': 2.037497457734964}. Best is trial 0 with value: 0.5.[0m
[32m[I 2022-04-15 02:32:17,221][0m Trial 27 finished with value: 0.5 and parameters: {'loss': 'coxph', 'learning_rate': 0.005425754934013828, 'n_estimators': 251, 'criterion': 'absolute_error', 'min_samples_split': 7, 'min_samples_leaf': 6, 'min_weight_fraction_leaf': 0.021112241038802645, 'min_impurity_decrease': 0.1731588221330571, 'max_features': 0.01860102689486784, 'subsample': 0.5291974107599176, 'dropout_rate': 0.6774503103198319, 'ccp_alpha': 3.0424139884417483}. Best is trial 0 with value: 0.5.[0m
[32m[I 2022-04-15 02:33:05,072][0m Trial 28 finished with value: 0.5 and parameters: {'loss': 'coxph', 'learning_rate': 0.0003590681631338387, 'n_estimators': 553, 'criterion': 'absolute_error', 'min_samples_split': 8, 'min_samples_leaf': 9, 'min_weight_fraction_leaf': 0.12077464228363483, 'min_impurity_decrease': 0.3226622818284942, 'max_features': 0.11519972094734039, 'subsample': 0.4515578538315001, 'dropout_rate': 0.8604666959656808, 'ccp_alpha': 4.924175742256}. Best is trial 0 with value: 0.5.[0m
[32m[I 2022-04-15 02:34:05,839][0m Trial 29 finished with value: 0.5 and parameters: {'loss': 'coxph', 'learning_rate': 7.4077390316530294e-06, 'n_estimators': 845, 'criterion': 'absolute_error', 'min_samples_split': 9, 'min_samples_leaf': 7, 'min_weight_fraction_leaf': 0.0507421384695113, 'min_impurity_decrease': 0.2999805252518518, 'max_features': 0.3347300648797593, 'subsample': 0.6205938521743796, 'dropout_rate': 0.9983186143850965, 'ccp_alpha': 2.0002160202463437}. Best is trial 0 with value: 0.5.[0m
[32m[I 2022-04-15 02:35:28,939][0m Trial 30 finished with value: 0.5 and parameters: {'loss': 'coxph', 'learning_rate': 0.08700323519365348, 'n_estimators': 693, 'criterion': 'friedman_mse', 'min_samples_split': 7, 'min_samples_leaf': 5, 'min_weight_fraction_leaf': 0.03529144979373916, 'min_impurity_decrease': 0.13493478028060835, 'max_features': 0.08208090835041543, 'subsample': 0.543165486348277, 'dropout_rate': 0.6998336582495291, 'ccp_alpha': 2.7633956402890925}. Best is trial 0 with value: 0.5.[0m
[32m[I 2022-04-15 02:36:48,139][0m Trial 31 finished with value: 0.5 and parameters: {'loss': 'coxph', 'learning_rate': 0.00594330099412127, 'n_estimators': 773, 'criterion': 'absolute_error', 'min_samples_split': 8, 'min_samples_leaf': 9, 'min_weight_fraction_leaf': 0.047093570523077444, 'min_impurity_decrease': 0.16061523440348147, 'max_features': 0.13957350852137326, 'subsample': 0.4800314299104274, 'dropout_rate': 0.8410159343833636, 'ccp_alpha': 2.0380004441228157}. Best is trial 0 with value: 0.5.[0m
[32m[I 2022-04-15 02:37:44,995][0m Trial 32 finished with value: 0.5 and parameters: {'loss': 'coxph', 'learning_rate': 0.0005286129950792641, 'n_estimators': 858, 'criterion': 'absolute_error', 'min_samples_split': 7, 'min_samples_leaf': 7, 'min_weight_fraction_leaf': 0.045135338653225596, 'min_impurity_decrease': 0.29739334923159666, 'max_features': 0.260412855314118, 'subsample': 0.6210678839384436, 'dropout_rate': 0.9998819973536812, 'ccp_alpha': 1.9521245563895342}. Best is trial 0 with value: 0.5.[0m
[32m[I 2022-04-15 02:38:19,205][0m Trial 33 finished with value: 0.5 and parameters: {'loss': 'coxph', 'learning_rate': 0.061181683506607736, 'n_estimators': 551, 'criterion': 'friedman_mse', 'min_samples_split': 10, 'min_samples_leaf': 9, 'min_weight_fraction_leaf': 0.11229249614073676, 'min_impurity_decrease': 0.40252465310612096, 'max_features': 0.33673671651137693, 'subsample': 0.5633754322802772, 'dropout_rate': 0.9648801380357819, 'ccp_alpha': 2.709292981735202}. Best is trial 0 with value: 0.5.[0m
[32m[I 2022-04-15 02:39:41,333][0m Trial 34 finished with value: 0.5 and parameters: {'loss': 'coxph', 'learning_rate': 0.014741510438283204, 'n_estimators': 741, 'criterion': 'friedman_mse', 'min_samples_split': 9, 'min_samples_leaf': 5, 'min_weight_fraction_leaf': 0.050536950353816314, 'min_impurity_decrease': 0.13944951523019133, 'max_features': 0.08603004783073256, 'subsample': 0.3645819922281166, 'dropout_rate': 0.8181687341913356, 'ccp_alpha': 1.9973304892073613}. Best is trial 0 with value: 0.5.[0m
[32m[I 2022-04-15 02:40:11,668][0m Trial 35 finished with value: 0.5 and parameters: {'loss': 'squared', 'learning_rate': 5.268554825052397e-05, 'n_estimators': 370, 'criterion': 'absolute_error', 'min_samples_split': 6, 'min_samples_leaf': 2, 'min_weight_fraction_leaf': 0.2599893972499954, 'min_impurity_decrease': 0.060848748560976385, 'max_features': 0.2416878124694208, 'subsample': 0.3109777696941737, 'dropout_rate': 0.36047043214984353, 'ccp_alpha': 1.0252820561395368}. Best is trial 0 with value: 0.5.[0m
[32m[I 2022-04-15 02:40:18,288][0m Trial 36 finished with value: 0.5 and parameters: {'loss': 'squared', 'learning_rate': 0.00019884255917350735, 'n_estimators': 201, 'criterion': 'absolute_error', 'min_samples_split': 2, 'min_samples_leaf': 4, 'min_weight_fraction_leaf': 0.19523610437579297, 'min_impurity_decrease': 0.5374923803546833, 'max_features': 0.1916278186072826, 'subsample': 0.2183486338710563, 'dropout_rate': 0.5469581706811923, 'ccp_alpha': 4.306123539634822}. Best is trial 0 with value: 0.5.[0m
[32m[I 2022-04-15 02:40:22,244][0m Trial 37 finished with value: 0.5 and parameters: {'loss': 'squared', 'learning_rate': 0.0008371814269930133, 'n_estimators': 180, 'criterion': 'absolute_error', 'min_samples_split': 4, 'min_samples_leaf': 8, 'min_weight_fraction_leaf': 0.3848446601595988, 'min_impurity_decrease': 0.3997003543763013, 'max_features': 0.05449573776390651, 'subsample': 0.24920275624792684, 'dropout_rate': 0.7417747865990472, 'ccp_alpha': 3.444544396072607}. Best is trial 0 with value: 0.5.[0m
[32m[I 2022-04-15 02:41:22,046][0m Trial 38 finished with value: 0.5 and parameters: {'loss': 'coxph', 'learning_rate': 1.9657906185437047e-05, 'n_estimators': 452, 'criterion': 'absolute_error', 'min_samples_split': 6, 'min_samples_leaf': 6, 'min_weight_fraction_leaf': 0.2302502654708481, 'min_impurity_decrease': 0.23861201009741614, 'max_features': 0.19710395677004744, 'subsample': 0.1655588565211047, 'dropout_rate': 0.5899171306558272, 'ccp_alpha': 4.403231569689568}. Best is trial 0 with value: 0.5.[0m
[32m[I 2022-04-15 02:42:57,619][0m Trial 39 finished with value: 0.5 and parameters: {'loss': 'coxph', 'learning_rate': 2.114175619265943e-06, 'n_estimators': 640, 'criterion': 'absolute_error', 'min_samples_split': 6, 'min_samples_leaf': 8, 'min_weight_fraction_leaf': 0.09671098825800774, 'min_impurity_decrease': 0.08841893858430983, 'max_features': 0.06074290320816787, 'subsample': 0.08094899845552447, 'dropout_rate': 0.6323160972109062, 'ccp_alpha': 3.9499818711387427}. Best is trial 0 with value: 0.5.[0m
[32m[I 2022-04-15 02:43:23,112][0m Trial 40 finished with value: 0.5 and parameters: {'loss': 'coxph', 'learning_rate': 0.028368166032642902, 'n_estimators': 276, 'criterion': 'absolute_error', 'min_samples_split': 5, 'min_samples_leaf': 6, 'min_weight_fraction_leaf': 0.1870370727493893, 'min_impurity_decrease': 0.19413667873034046, 'max_features': 0.04565253743892176, 'subsample': 0.2083993801824331, 'dropout_rate': 0.714685923173405, 'ccp_alpha': 3.429076902608508}. Best is trial 0 with value: 0.5.[0m
[32m[I 2022-04-15 02:44:16,133][0m Trial 41 finished with value: 0.5 and parameters: {'loss': 'coxph', 'learning_rate': 0.00026923918190722453, 'n_estimators': 624, 'criterion': 'absolute_error', 'min_samples_split': 8, 'min_samples_leaf': 10, 'min_weight_fraction_leaf': 0.1330732855993423, 'min_impurity_decrease': 0.37543732001193875, 'max_features': 0.0031359302539906465, 'subsample': 0.3454472976495087, 'dropout_rate': 0.9046405068838399, 'ccp_alpha': 4.359013069666542}. Best is trial 0 with value: 0.5.[0m
[32m[I 2022-04-15 02:45:23,205][0m Trial 42 finished with value: 0.5 and parameters: {'loss': 'coxph', 'learning_rate': 1.1435843282014167e-05, 'n_estimators': 777, 'criterion': 'absolute_error', 'min_samples_split': 8, 'min_samples_leaf': 5, 'min_weight_fraction_leaf': 0.0035348627230296133, 'min_impurity_decrease': 0.009474346957610777, 'max_features': 0.11901729188349484, 'subsample': 0.42548505899976213, 'dropout_rate': 0.9288630356266968, 'ccp_alpha': 4.592001243311979}. Best is trial 0 with value: 0.5.[0m
[32m[I 2022-04-15 02:47:29,111][0m Trial 43 finished with value: 0.5 and parameters: {'loss': 'coxph', 'learning_rate': 2.844904401598747e-06, 'n_estimators': 902, 'criterion': 'absolute_error', 'min_samples_split': 7, 'min_samples_leaf': 3, 'min_weight_fraction_leaf': 0.14260201683933021, 'min_impurity_decrease': 0.27507575438616727, 'max_features': 0.12790606327236154, 'subsample': 0.05290861294015506, 'dropout_rate': 0.8323024211310762, 'ccp_alpha': 2.248540814896083}. Best is trial 0 with value: 0.5.[0m
[32m[I 2022-04-15 02:47:47,928][0m Trial 44 finished with value: 0.5 and parameters: {'loss': 'coxph', 'learning_rate': 0.007454927024057569, 'n_estimators': 250, 'criterion': 'absolute_error', 'min_samples_split': 7, 'min_samples_leaf': 6, 'min_weight_fraction_leaf': 0.026174558455185654, 'min_impurity_decrease': 0.18386746210338728, 'max_features': 0.0064450193568062475, 'subsample': 0.5007288860907646, 'dropout_rate': 0.6782960017153554, 'ccp_alpha': 1.5938533013441458}. Best is trial 0 with value: 0.5.[0m
[32m[I 2022-04-15 02:48:03,648][0m Trial 45 finished with value: 0.5 and parameters: {'loss': 'coxph', 'learning_rate': 0.0035385740111242483, 'n_estimators': 238, 'criterion': 'absolute_error', 'min_samples_split': 8, 'min_samples_leaf': 5, 'min_weight_fraction_leaf': 0.06995848696704474, 'min_impurity_decrease': 0.10046604337531559, 'max_features': 0.08750402368878361, 'subsample': 0.7854144502455136, 'dropout_rate': 0.9438670313260601, 'ccp_alpha': 2.615802890647191}. Best is trial 0 with value: 0.5.[0m
[32m[I 2022-04-15 02:48:49,657][0m Trial 46 finished with value: 0.5 and parameters: {'loss': 'coxph', 'learning_rate': 0.012226529184858488, 'n_estimators': 550, 'criterion': 'squared_error', 'min_samples_split': 7, 'min_samples_leaf': 10, 'min_weight_fraction_leaf': 0.12060494680764253, 'min_impurity_decrease': 0.31705432474227924, 'max_features': 0.1191149263668937, 'subsample': 0.9823420879585749, 'dropout_rate': 0.8833931330594459, 'ccp_alpha': 4.850710956408489}. Best is trial 0 with value: 0.5.[0m
[32m[I 2022-04-15 02:49:23,068][0m Trial 47 finished with value: 0.5 and parameters: {'loss': 'coxph', 'learning_rate': 0.0019240465287642939, 'n_estimators': 423, 'criterion': 'friedman_mse', 'min_samples_split': 9, 'min_samples_leaf': 9, 'min_weight_fraction_leaf': 0.15523711016766065, 'min_impurity_decrease': 0.3415071187246882, 'max_features': 0.9515311583844024, 'subsample': 0.8881148462437335, 'dropout_rate': 0.8677644799822457, 'ccp_alpha': 3.729321514853623}. Best is trial 0 with value: 0.5.[0m
[32m[I 2022-04-15 02:50:44,601][0m Trial 48 finished with value: 0.5 and parameters: {'loss': 'coxph', 'learning_rate': 1.1297512357925823e-06, 'n_estimators': 965, 'criterion': 'absolute_error', 'min_samples_split': 10, 'min_samples_leaf': 7, 'min_weight_fraction_leaf': 0.05745590964955897, 'min_impurity_decrease': 0.2628429007738086, 'max_features': 0.3069894932518241, 'subsample': 0.6193006881258004, 'dropout_rate': 0.966646542424752, 'ccp_alpha': 1.291142603567219}. Best is trial 0 with value: 0.5.[0m
[32m[I 2022-04-15 02:52:38,932][0m Trial 49 finished with value: 0.5 and parameters: {'loss': 'coxph', 'learning_rate': 6.765169919032798e-06, 'n_estimators': 830, 'criterion': 'absolute_error', 'min_samples_split': 9, 'min_samples_leaf': 7, 'min_weight_fraction_leaf': 0.019052780987722354, 'min_impurity_decrease': 0.19375135161447962, 'max_features': 0.5962331591302155, 'subsample': 0.6759763564918152, 'dropout_rate': 0.8093598970300757, 'ccp_alpha': 1.8252498258619303}. Best is trial 0 with value: 0.5.[0m
[32m[I 2022-04-15 02:53:57,553][0m Trial 50 finished with value: 0.5 and parameters: {'loss': 'coxph', 'learning_rate': 0.07865136012175299, 'n_estimators': 702, 'criterion': 'friedman_mse', 'min_samples_split': 7, 'min_samples_leaf': 5, 'min_weight_fraction_leaf': 0.03141619853889331, 'min_impurity_decrease': 0.14262994373812024, 'max_features': 0.2278524361559044, 'subsample': 0.5573859263817902, 'dropout_rate': 0.7269564031135634, 'ccp_alpha': 2.839732097967179}. Best is trial 0 with value: 0.5.[0m
[32m[I 2022-04-15 02:55:02,139][0m Trial 51 finished with value: 0.5 and parameters: {'loss': 'coxph', 'learning_rate': 0.007979653506758536, 'n_estimators': 675, 'criterion': 'friedman_mse', 'min_samples_split': 7, 'min_samples_leaf': 9, 'min_weight_fraction_leaf': 0.04419770094905386, 'min_impurity_decrease': 0.17246682104932298, 'max_features': 0.06889056526683056, 'subsample': 0.5063678530567084, 'dropout_rate': 0.8474544968963282, 'ccp_alpha': 2.2593770521899543}. Best is trial 0 with value: 0.5.[0m
