[32m[I 2022-04-15 01:18:33,916][0m Trial 930 finished with value: 0.7846380047502909 and parameters: {'loss': 'coxph', 'learning_rate': 1.0163839742353752e-06, 'n_estimators': 406, 'criterion': 'friedman_mse', 'min_samples_split': 10, 'min_samples_leaf': 1, 'min_weight_fraction_leaf': 0.1619789099506345, 'min_impurity_decrease': 0.6438550859470046, 'max_features': 0.5329481084954071, 'subsample': 0.07808625657365321, 'dropout_rate': 0.6974901371057354, 'ccp_alpha': 0.004665410992060005}. Best is trial 910 with value: 0.7857589794114699.[0m
[32m[I 2022-04-15 01:19:22,390][0m Trial 931 finished with value: 0.7838605084504404 and parameters: {'loss': 'coxph', 'learning_rate': 1.0471387359549446e-06, 'n_estimators': 393, 'criterion': 'friedman_mse', 'min_samples_split': 10, 'min_samples_leaf': 1, 'min_weight_fraction_leaf': 0.15827627250638995, 'min_impurity_decrease': 0.6536822804517177, 'max_features': 0.5414882941445736, 'subsample': 0.075720002889796, 'dropout_rate': 0.6964491599770238, 'ccp_alpha': 0.0050019702186703}. Best is trial 910 with value: 0.7857589794114699.[0m
[32m[I 2022-04-15 01:20:14,223][0m Trial 932 finished with value: 0.7746820571397345 and parameters: {'loss': 'coxph', 'learning_rate': 1.244599836529462e-06, 'n_estimators': 416, 'criterion': 'friedman_mse', 'min_samples_split': 10, 'min_samples_leaf': 1, 'min_weight_fraction_leaf': 0.15036928655153572, 'min_impurity_decrease': 0.6486631786692578, 'max_features': 0.5304926393601938, 'subsample': 0.07254185919866903, 'dropout_rate': 0.693832115176506, 'ccp_alpha': 0.1580016494107226}. Best is trial 910 with value: 0.7857589794114699.[0m
[32m[I 2022-04-15 01:21:09,456][0m Trial 933 finished with value: 0.774749827536511 and parameters: {'loss': 'coxph', 'learning_rate': 1.008401668773727e-06, 'n_estimators': 434, 'criterion': 'friedman_mse', 'min_samples_split': 10, 'min_samples_leaf': 1, 'min_weight_fraction_leaf': 0.16299464657734639, 'min_impurity_decrease': 0.6364116360663462, 'max_features': 0.5692637754779849, 'subsample': 0.07951947538357852, 'dropout_rate': 0.6995178529306717, 'ccp_alpha': 0.1575707154575333}. Best is trial 910 with value: 0.7857589794114699.[0m
[32m[I 2022-04-15 01:21:55,434][0m Trial 934 finished with value: 0.7846242297800285 and parameters: {'loss': 'coxph', 'learning_rate': 1.2802169591978608e-06, 'n_estimators': 382, 'criterion': 'friedman_mse', 'min_samples_split': 10, 'min_samples_leaf': 1, 'min_weight_fraction_leaf': 0.145280609401642, 'min_impurity_decrease': 0.6587994200604795, 'max_features': 0.5489349989808588, 'subsample': 0.06965240297044045, 'dropout_rate': 0.6976051563878646, 'ccp_alpha': 0.0033126880641284116}. Best is trial 910 with value: 0.7857589794114699.[0m
[32m[I 2022-04-15 01:22:43,279][0m Trial 935 finished with value: 0.7846470560356497 and parameters: {'loss': 'coxph', 'learning_rate': 1.2919364906711854e-06, 'n_estimators': 395, 'criterion': 'friedman_mse', 'min_samples_split': 10, 'min_samples_leaf': 1, 'min_weight_fraction_leaf': 0.14157826859930067, 'min_impurity_decrease': 0.6749571204485316, 'max_features': 0.5507377861369152, 'subsample': 0.06919100462605876, 'dropout_rate': 0.696821150004426, 'ccp_alpha': 0.0048842329382292075}. Best is trial 910 with value: 0.7857589794114699.[0m
[32m[I 2022-04-15 01:23:31,225][0m Trial 936 finished with value: 0.7846363393312752 and parameters: {'loss': 'coxph', 'learning_rate': 1.265549732698131e-06, 'n_estimators': 388, 'criterion': 'friedman_mse', 'min_samples_split': 10, 'min_samples_leaf': 1, 'min_weight_fraction_leaf': 0.14010582955988485, 'min_impurity_decrease': 0.6727583835477395, 'max_features': 0.5412625274818597, 'subsample': 0.07489089021029877, 'dropout_rate': 0.6967203679763132, 'ccp_alpha': 0.003290724250431521}. Best is trial 910 with value: 0.7857589794114699.[0m
[32m[I 2022-04-15 01:23:50,229][0m Trial 937 finished with value: -0.38415455262869197 and parameters: {'loss': 'squared', 'learning_rate': 1.2730757857464337e-06, 'n_estimators': 390, 'criterion': 'friedman_mse', 'min_samples_split': 10, 'min_samples_leaf': 1, 'min_weight_fraction_leaf': 0.14570719416185376, 'min_impurity_decrease': 0.680997962609594, 'max_features': 0.5391117210483157, 'subsample': 0.0764604207507591, 'dropout_rate': 0.6970570588475692, 'ccp_alpha': 0.0010457779959551407}. Best is trial 910 with value: 0.7857589794114699.[0m
[32m[I 2022-04-15 01:24:31,688][0m Trial 938 finished with value: 0.25 and parameters: {'loss': 'coxph', 'learning_rate': 1.2352180967619208e-06, 'n_estimators': 371, 'criterion': 'squared_error', 'min_samples_split': 10, 'min_samples_leaf': 1, 'min_weight_fraction_leaf': 0.13443628323367618, 'min_impurity_decrease': 0.6286365156158874, 'max_features': 0.5135594110914907, 'subsample': 0.0732938483455818, 'dropout_rate': 0.6945739791010499, 'ccp_alpha': 0.15107914456188876}. Best is trial 910 with value: 0.7857589794114699.[0m
[32m[I 2022-04-15 01:25:19,719][0m Trial 939 finished with value: 0.7786142876164502 and parameters: {'loss': 'coxph', 'learning_rate': 1.0264198584922423e-06, 'n_estimators': 412, 'criterion': 'friedman_mse', 'min_samples_split': 10, 'min_samples_leaf': 1, 'min_weight_fraction_leaf': 0.16738788087497186, 'min_impurity_decrease': 0.6144320803298112, 'max_features': 0.5742940584978663, 'subsample': 0.07145452313587612, 'dropout_rate': 0.6979783107619444, 'ccp_alpha': 0.1434329448158548}. Best is trial 910 with value: 0.7857589794114699.[0m
[32m[I 2022-04-15 01:26:02,803][0m Trial 940 finished with value: 0.25 and parameters: {'loss': 'coxph', 'learning_rate': 1.3603102402710173e-06, 'n_estimators': 384, 'criterion': 'absolute_error', 'min_samples_split': 10, 'min_samples_leaf': 1, 'min_weight_fraction_leaf': 0.15606367384405317, 'min_impurity_decrease': 0.6687748731454398, 'max_features': 0.553864733459051, 'subsample': 0.07705979382087853, 'dropout_rate': 0.7003529682609301, 'ccp_alpha': 0.14165291588246381}. Best is trial 910 with value: 0.7857589794114699.[0m
[32m[I 2022-04-15 01:26:56,953][0m Trial 941 finished with value: 0.7808111487725624 and parameters: {'loss': 'coxph', 'learning_rate': 1.3346982696337309e-06, 'n_estimators': 431, 'criterion': 'friedman_mse', 'min_samples_split': 10, 'min_samples_leaf': 1, 'min_weight_fraction_leaf': 0.14390200288637758, 'min_impurity_decrease': 0.640083548627168, 'max_features': 0.5310253259955697, 'subsample': 0.07020776318538775, 'dropout_rate': 0.6968346035943515, 'ccp_alpha': 0.08599125944011084}. Best is trial 910 with value: 0.7857589794114699.[0m
[32m[I 2022-04-15 01:27:44,073][0m Trial 942 finished with value: 0.7742295917206341 and parameters: {'loss': 'coxph', 'learning_rate': 1.0004389637680575e-06, 'n_estimators': 407, 'criterion': 'friedman_mse', 'min_samples_split': 10, 'min_samples_leaf': 1, 'min_weight_fraction_leaf': 0.16871556817733918, 'min_impurity_decrease': 0.6657924749784085, 'max_features': 0.5791407733773647, 'subsample': 0.07468541669904323, 'dropout_rate': 0.6971193078681124, 'ccp_alpha': 0.1620074320140397}. Best is trial 910 with value: 0.7857589794114699.[0m
[32m[I 2022-04-15 01:28:38,198][0m Trial 943 finished with value: 0.7848205631473298 and parameters: {'loss': 'coxph', 'learning_rate': 1.0079675371319989e-06, 'n_estimators': 438, 'criterion': 'friedman_mse', 'min_samples_split': 10, 'min_samples_leaf': 1, 'min_weight_fraction_leaf': 0.1380357899293512, 'min_impurity_decrease': 0.6198282207871746, 'max_features': 0.5652608638567891, 'subsample': 0.070225685607422, 'dropout_rate': 0.7042851018870578, 'ccp_alpha': 0.0063755359335300205}. Best is trial 910 with value: 0.7857589794114699.[0m
[32m[I 2022-04-15 01:29:32,589][0m Trial 944 finished with value: 0.7805276717443232 and parameters: {'loss': 'coxph', 'learning_rate': 1.2284545198291553e-06, 'n_estimators': 443, 'criterion': 'friedman_mse', 'min_samples_split': 10, 'min_samples_leaf': 1, 'min_weight_fraction_leaf': 0.12603969020916825, 'min_impurity_decrease': 0.6175228961817171, 'max_features': 0.5393394488401341, 'subsample': 0.0823792465463231, 'dropout_rate': 0.6912534980923095, 'ccp_alpha': 0.08465930936525662}. Best is trial 910 with value: 0.7857589794114699.[0m
[32m[I 2022-04-15 01:30:21,422][0m Trial 945 finished with value: 0.784622577748211 and parameters: {'loss': 'coxph', 'learning_rate': 1.2654802161926587e-06, 'n_estimators': 394, 'criterion': 'friedman_mse', 'min_samples_split': 10, 'min_samples_leaf': 1, 'min_weight_fraction_leaf': 0.14405939535156634, 'min_impurity_decrease': 0.6296661779854565, 'max_features': 0.5663532176234283, 'subsample': 0.06987173365734708, 'dropout_rate': 0.7034807008199121, 'ccp_alpha': 0.002259041423268715}. Best is trial 910 with value: 0.7857589794114699.[0m
[32m[I 2022-04-15 01:31:11,044][0m Trial 946 finished with value: 0.7846218445459439 and parameters: {'loss': 'coxph', 'learning_rate': 1.0121295725712421e-06, 'n_estimators': 388, 'criterion': 'friedman_mse', 'min_samples_split': 10, 'min_samples_leaf': 1, 'min_weight_fraction_leaf': 0.13983904654435864, 'min_impurity_decrease': 0.6371788414556186, 'max_features': 0.5647508101917698, 'subsample': 0.07697447681440968, 'dropout_rate': 0.6892563461008454, 'ccp_alpha': 0.00801495614629344}. Best is trial 910 with value: 0.7857589794114699.[0m
[32m[I 2022-04-15 01:31:59,344][0m Trial 947 finished with value: 0.7849753780064231 and parameters: {'loss': 'coxph', 'learning_rate': 1.3188454467024958e-06, 'n_estimators': 382, 'criterion': 'friedman_mse', 'min_samples_split': 10, 'min_samples_leaf': 1, 'min_weight_fraction_leaf': 0.13881697250391334, 'min_impurity_decrease': 0.6323809390399985, 'max_features': 0.571590121477302, 'subsample': 0.08414437809439189, 'dropout_rate': 0.6831512693717916, 'ccp_alpha': 0.007304283996358999}. Best is trial 910 with value: 0.7857589794114699.[0m
[32m[I 2022-04-15 01:32:45,178][0m Trial 948 finished with value: 0.785546639990022 and parameters: {'loss': 'coxph', 'learning_rate': 1.303228766998938e-06, 'n_estimators': 372, 'criterion': 'friedman_mse', 'min_samples_split': 10, 'min_samples_leaf': 1, 'min_weight_fraction_leaf': 0.1365516687674791, 'min_impurity_decrease': 0.6292793229064355, 'max_features': 0.5704418232247005, 'subsample': 0.09094398076910094, 'dropout_rate': 0.6844284019863283, 'ccp_alpha': 0.005049851148747536}. Best is trial 910 with value: 0.7857589794114699.[0m
[32m[I 2022-04-15 01:33:30,002][0m Trial 949 finished with value: 0.7849212982592239 and parameters: {'loss': 'coxph', 'learning_rate': 1.2660856030114682e-06, 'n_estimators': 361, 'criterion': 'friedman_mse', 'min_samples_split': 10, 'min_samples_leaf': 1, 'min_weight_fraction_leaf': 0.13894011557861452, 'min_impurity_decrease': 0.6913274309299665, 'max_features': 0.5733114971729499, 'subsample': 0.08725841946773558, 'dropout_rate': 0.6886225979588025, 'ccp_alpha': 0.006193091033248584}. Best is trial 910 with value: 0.7857589794114699.[0m
[32m[I 2022-04-15 01:34:08,689][0m Trial 950 finished with value: 0.7634353567800718 and parameters: {'loss': 'coxph', 'learning_rate': 1.3205697501543365e-06, 'n_estimators': 353, 'criterion': 'friedman_mse', 'min_samples_split': 10, 'min_samples_leaf': 1, 'min_weight_fraction_leaf': 0.13519377442265582, 'min_impurity_decrease': 0.6834229963760452, 'max_features': 0.5723553148396527, 'subsample': 0.08929417123242343, 'dropout_rate': 0.6861576245142886, 'ccp_alpha': 0.16793748634402852}. Best is trial 910 with value: 0.7857589794114699.[0m
[32m[I 2022-04-15 01:34:50,679][0m Trial 951 finished with value: 0.7679398197172761 and parameters: {'loss': 'coxph', 'learning_rate': 1.321495743038409e-06, 'n_estimators': 370, 'criterion': 'friedman_mse', 'min_samples_split': 10, 'min_samples_leaf': 1, 'min_weight_fraction_leaf': 0.11828919663234494, 'min_impurity_decrease': 0.6320146522888769, 'max_features': 0.564408885400723, 'subsample': 0.09939650089018534, 'dropout_rate': 0.684696141312646, 'ccp_alpha': 0.1484958983533353}. Best is trial 910 with value: 0.7857589794114699.[0m
[32m[I 2022-04-15 01:35:38,689][0m Trial 952 finished with value: 0.7839612671106538 and parameters: {'loss': 'coxph', 'learning_rate': 1.3091847528254735e-06, 'n_estimators': 379, 'criterion': 'friedman_mse', 'min_samples_split': 10, 'min_samples_leaf': 1, 'min_weight_fraction_leaf': 0.1510163365513944, 'min_impurity_decrease': 0.7043307301468328, 'max_features': 0.5009825017539219, 'subsample': 0.08082341797509963, 'dropout_rate': 0.6846252552179686, 'ccp_alpha': 0.0037099786614535803}. Best is trial 910 with value: 0.7857589794114699.[0m
[32m[I 2022-04-15 01:36:19,107][0m Trial 953 finished with value: 0.7803299903547251 and parameters: {'loss': 'coxph', 'learning_rate': 1.2638673774642596e-06, 'n_estimators': 359, 'criterion': 'friedman_mse', 'min_samples_split': 10, 'min_samples_leaf': 1, 'min_weight_fraction_leaf': 0.13724650929758858, 'min_impurity_decrease': 0.6282274522136791, 'max_features': 0.5803182268823535, 'subsample': 0.08650065267392618, 'dropout_rate': 0.70908701588505, 'ccp_alpha': 0.11319221723271125}. Best is trial 910 with value: 0.7857589794114699.[0m
[32m[I 2022-04-15 01:37:05,418][0m Trial 954 finished with value: 0.7371812073302544 and parameters: {'loss': 'coxph', 'learning_rate': 1.2959597813029988e-06, 'n_estimators': 393, 'criterion': 'friedman_mse', 'min_samples_split': 10, 'min_samples_leaf': 1, 'min_weight_fraction_leaf': 0.1309057955552006, 'min_impurity_decrease': 0.6661003692743477, 'max_features': 0.5601847677832011, 'subsample': 0.09022237979030989, 'dropout_rate': 0.6876603884202777, 'ccp_alpha': 0.20667219291433875}. Best is trial 910 with value: 0.7857589794114699.[0m
[32m[I 2022-04-15 01:37:53,709][0m Trial 955 finished with value: 0.7851962874292718 and parameters: {'loss': 'coxph', 'learning_rate': 1.3029749233504002e-06, 'n_estimators': 399, 'criterion': 'friedman_mse', 'min_samples_split': 10, 'min_samples_leaf': 1, 'min_weight_fraction_leaf': 0.14796653895834808, 'min_impurity_decrease': 0.6168304966354279, 'max_features': 0.5855732190682075, 'subsample': 0.08738274022188756, 'dropout_rate': 0.7057757381902401, 'ccp_alpha': 0.00475659425609767}. Best is trial 910 with value: 0.7857589794114699.[0m
[32m[I 2022-04-15 01:38:33,538][0m Trial 956 finished with value: 0.7799552356901692 and parameters: {'loss': 'coxph', 'learning_rate': 1.3325789543522717e-06, 'n_estimators': 346, 'criterion': 'friedman_mse', 'min_samples_split': 10, 'min_samples_leaf': 1, 'min_weight_fraction_leaf': 0.13914287405247508, 'min_impurity_decrease': 0.6914901140122387, 'max_features': 0.5678761820552832, 'subsample': 0.08380021217102569, 'dropout_rate': 0.7146383889028366, 'ccp_alpha': 0.10403403997750764}. Best is trial 910 with value: 0.7857589794114699.[0m
[32m[I 2022-04-15 01:38:49,670][0m Trial 957 finished with value: -0.3610648024810385 and parameters: {'loss': 'squared', 'learning_rate': 1.3870043974632012e-06, 'n_estimators': 381, 'criterion': 'friedman_mse', 'min_samples_split': 10, 'min_samples_leaf': 1, 'min_weight_fraction_leaf': 0.1490970506697155, 'min_impurity_decrease': 0.6507614015852013, 'max_features': 0.5174361056746855, 'subsample': 0.0912570064605822, 'dropout_rate': 0.6906228011492451, 'ccp_alpha': 0.2231129949380055}. Best is trial 910 with value: 0.7857589794114699.[0m
[32m[I 2022-04-15 01:39:38,599][0m Trial 958 finished with value: 0.7857038591634682 and parameters: {'loss': 'coxph', 'learning_rate': 1.3283924178538249e-06, 'n_estimators': 397, 'criterion': 'friedman_mse', 'min_samples_split': 10, 'min_samples_leaf': 1, 'min_weight_fraction_leaf': 0.12395423834806345, 'min_impurity_decrease': 0.6226100877073362, 'max_features': 0.5869626504522949, 'subsample': 0.09164516317382573, 'dropout_rate': 0.6869377804314037, 'ccp_alpha': 0.0029018177188025974}. Best is trial 910 with value: 0.7857589794114699.[0m
[32m[I 2022-04-15 01:40:24,396][0m Trial 959 finished with value: 0.25 and parameters: {'loss': 'coxph', 'learning_rate': 1.2943813485305244e-06, 'n_estimators': 397, 'criterion': 'squared_error', 'min_samples_split': 10, 'min_samples_leaf': 1, 'min_weight_fraction_leaf': 0.12439125832005876, 'min_impurity_decrease': 0.6273089120311652, 'max_features': 0.5803891715615317, 'subsample': 0.08448554055639974, 'dropout_rate': 0.7097476845426979, 'ccp_alpha': 0.08577856481190946}. Best is trial 910 with value: 0.7857589794114699.[0m
[32m[I 2022-04-15 01:41:04,460][0m Trial 960 finished with value: 0.780433317531891 and parameters: {'loss': 'coxph', 'learning_rate': 1.4239167029771644e-06, 'n_estimators': 366, 'criterion': 'friedman_mse', 'min_samples_split': 10, 'min_samples_leaf': 1, 'min_weight_fraction_leaf': 0.1536893508281354, 'min_impurity_decrease': 0.6147064586036246, 'max_features': 0.5867509332853705, 'subsample': 0.09385468513173958, 'dropout_rate': 0.7124906399182908, 'ccp_alpha': 0.09101707920721533}. Best is trial 910 with value: 0.7857589794114699.[0m
[32m[I 2022-04-15 01:41:56,239][0m Trial 961 finished with value: 0.7851461012397027 and parameters: {'loss': 'coxph', 'learning_rate': 1.2907390203649832e-06, 'n_estimators': 416, 'criterion': 'friedman_mse', 'min_samples_split': 10, 'min_samples_leaf': 1, 'min_weight_fraction_leaf': 0.14236279254319045, 'min_impurity_decrease': 0.6585859909310944, 'max_features': 0.5591253501412157, 'subsample': 0.09530829577093336, 'dropout_rate': 0.6844255741219261, 'ccp_alpha': 0.0036725710142579333}. Best is trial 910 with value: 0.7857589794114699.[0m
[32m[I 2022-04-15 01:42:43,472][0m Trial 962 finished with value: 0.25 and parameters: {'loss': 'coxph', 'learning_rate': 1.0033231328516298e-06, 'n_estimators': 412, 'criterion': 'absolute_error', 'min_samples_split': 10, 'min_samples_leaf': 1, 'min_weight_fraction_leaf': 0.1410659497751905, 'min_impurity_decrease': 0.6822630009507259, 'max_features': 0.5257369461282965, 'subsample': 0.08761209770221151, 'dropout_rate': 0.6878350827980361, 'ccp_alpha': 0.16113230779460908}. Best is trial 910 with value: 0.7857589794114699.[0m
[32m[I 2022-04-15 01:43:36,261][0m Trial 963 finished with value: 0.7855477612637178 and parameters: {'loss': 'coxph', 'learning_rate': 1.0062569320237085e-06, 'n_estimators': 427, 'criterion': 'friedman_mse', 'min_samples_split': 10, 'min_samples_leaf': 1, 'min_weight_fraction_leaf': 0.12852533888190745, 'min_impurity_decrease': 0.6640779909039063, 'max_features': 0.5538134576319165, 'subsample': 0.09085783324646576, 'dropout_rate': 0.6788721342976295, 'ccp_alpha': 0.001737144073930642}. Best is trial 910 with value: 0.7857589794114699.[0m
[32m[I 2022-04-15 01:44:23,813][0m Trial 964 finished with value: 0.7879949387224262 and parameters: {'loss': 'coxph', 'learning_rate': 1.2745966283612484e-06, 'n_estimators': 395, 'criterion': 'friedman_mse', 'min_samples_split': 10, 'min_samples_leaf': 1, 'min_weight_fraction_leaf': 0.1138343326389939, 'min_impurity_decrease': 0.6652059900562292, 'max_features': 0.5612389360771136, 'subsample': 0.10302681646187198, 'dropout_rate': 0.6800472639365835, 'ccp_alpha': 0.0038312984208842223}. Best is trial 964 with value: 0.7879949387224262.[0m
[32m[I 2022-04-15 01:45:11,781][0m Trial 965 finished with value: 0.7867534709558844 and parameters: {'loss': 'coxph', 'learning_rate': 1.3321683812327652e-06, 'n_estimators': 395, 'criterion': 'friedman_mse', 'min_samples_split': 10, 'min_samples_leaf': 1, 'min_weight_fraction_leaf': 0.11332901875671693, 'min_impurity_decrease': 0.6636200958109642, 'max_features': 0.5516760584621383, 'subsample': 0.10133824325321167, 'dropout_rate': 0.6829958590511601, 'ccp_alpha': 0.004482785443433214}. Best is trial 964 with value: 0.7879949387224262.[0m
[32m[I 2022-04-15 01:46:00,384][0m Trial 966 finished with value: 0.7755751892258983 and parameters: {'loss': 'coxph', 'learning_rate': 1.3144086370982693e-06, 'n_estimators': 419, 'criterion': 'friedman_mse', 'min_samples_split': 10, 'min_samples_leaf': 1, 'min_weight_fraction_leaf': 0.11414202540012813, 'min_impurity_decrease': 0.6761990131684502, 'max_features': 0.5449992880800236, 'subsample': 0.10136985761347193, 'dropout_rate': 0.6827532438821664, 'ccp_alpha': 0.13631131305496627}. Best is trial 964 with value: 0.7879949387224262.[0m
[32m[I 2022-04-15 01:46:51,141][0m Trial 967 finished with value: 0.78539164025262 and parameters: {'loss': 'coxph', 'learning_rate': 1.2969019230217382e-06, 'n_estimators': 404, 'criterion': 'friedman_mse', 'min_samples_split': 10, 'min_samples_leaf': 1, 'min_weight_fraction_leaf': 0.12130350658150674, 'min_impurity_decrease': 0.7166218567145015, 'max_features': 0.5026873652771476, 'subsample': 0.10171767906802304, 'dropout_rate': 0.6794685696331767, 'ccp_alpha': 0.0010203510860940911}. Best is trial 964 with value: 0.7879949387224262.[0m
[32m[I 2022-04-15 01:47:43,541][0m Trial 968 finished with value: 0.7854277190344421 and parameters: {'loss': 'coxph', 'learning_rate': 1.4263914139127683e-06, 'n_estimators': 425, 'criterion': 'friedman_mse', 'min_samples_split': 10, 'min_samples_leaf': 1, 'min_weight_fraction_leaf': 0.12369111648070212, 'min_impurity_decrease': 0.6943418970114298, 'max_features': 0.4979678509425309, 'subsample': 0.10176910514557863, 'dropout_rate': 0.6777668473018686, 'ccp_alpha': 0.0014482308469690869}. Best is trial 964 with value: 0.7879949387224262.[0m
[32m[I 2022-04-15 01:48:33,039][0m Trial 969 finished with value: 0.7371812073302544 and parameters: {'loss': 'coxph', 'learning_rate': 1.509036533805329e-06, 'n_estimators': 424, 'criterion': 'friedman_mse', 'min_samples_split': 10, 'min_samples_leaf': 1, 'min_weight_fraction_leaf': 0.12426440171062157, 'min_impurity_decrease': 0.7071997042344084, 'max_features': 0.4884507224303481, 'subsample': 0.10443228189545706, 'dropout_rate': 0.6800931423074816, 'ccp_alpha': 0.19701472584350915}. Best is trial 964 with value: 0.7879949387224262.[0m
