[32m[I 2022-04-13 11:43:43,100][0m Trial 105 finished with value: 0.8836038124955797 and parameters: {'splitter': 'best', 'min_samples_split': 0.05014316994367619, 'min_samples_leaf': 0.03717102384126975, 'min_weight_fraction_leaf': 0.026852957803847523, 'max_features': 0.8065385264150491}. Best is trial 102 with value: 0.884576309806181.[0m
/media/san2_ssd/data/Workdir/survival/utils.py:305: RuntimeWarning: invalid value encountered in true_divide
  pdfs = np.gradient(1-survs,axis=1)/norms
/media/san2_ssd/data/Workdir/survival/utils.py:305: RuntimeWarning: invalid value encountered in true_divide
  pdfs = np.gradient(1-survs,axis=1)/norms
/media/san2_ssd/data/Workdir/survival/utils.py:305: RuntimeWarning: invalid value encountered in true_divide
  pdfs = np.gradient(1-survs,axis=1)/norms
[32m[I 2022-04-13 11:43:44,595][0m Trial 106 finished with value: 0.8841392521679957 and parameters: {'splitter': 'best', 'min_samples_split': 0.04260000504270002, 'min_samples_leaf': 0.0377035614038521, 'min_weight_fraction_leaf': 0.022506090385974134, 'max_features': 0.8349020398104078}. Best is trial 102 with value: 0.884576309806181.[0m
/media/san2_ssd/data/Workdir/survival/utils.py:305: RuntimeWarning: invalid value encountered in true_divide
  pdfs = np.gradient(1-survs,axis=1)/norms
/media/san2_ssd/data/Workdir/survival/utils.py:305: RuntimeWarning: invalid value encountered in true_divide
  pdfs = np.gradient(1-survs,axis=1)/norms
/media/san2_ssd/data/Workdir/survival/utils.py:305: RuntimeWarning: invalid value encountered in true_divide
  pdfs = np.gradient(1-survs,axis=1)/norms
/media/san2_ssd/data/Workdir/survival/utils.py:305: RuntimeWarning: invalid value encountered in true_divide
  pdfs = np.gradient(1-survs,axis=1)/norms
[32m[I 2022-04-13 11:43:46,305][0m Trial 107 finished with value: 0.8829338833077566 and parameters: {'splitter': 'best', 'min_samples_split': 0.043576006174449816, 'min_samples_leaf': 0.03775491126296604, 'min_weight_fraction_leaf': 0.02081892941369609, 'max_features': 0.8645016305116425}. Best is trial 102 with value: 0.884576309806181.[0m
/media/san2_ssd/data/Workdir/survival/utils.py:305: RuntimeWarning: invalid value encountered in true_divide
  pdfs = np.gradient(1-survs,axis=1)/norms
/media/san2_ssd/data/Workdir/survival/utils.py:305: RuntimeWarning: invalid value encountered in true_divide
  pdfs = np.gradient(1-survs,axis=1)/norms
/media/san2_ssd/data/Workdir/survival/utils.py:305: RuntimeWarning: invalid value encountered in true_divide
  pdfs = np.gradient(1-survs,axis=1)/norms
/media/san2_ssd/data/Workdir/survival/utils.py:305: RuntimeWarning: invalid value encountered in true_divide
  pdfs = np.gradient(1-survs,axis=1)/norms
[32m[I 2022-04-13 11:43:48,117][0m Trial 108 finished with value: 0.8842536424047905 and parameters: {'splitter': 'best', 'min_samples_split': 0.043446013888771326, 'min_samples_leaf': 0.040266328219745254, 'min_weight_fraction_leaf': 0.01799651986360641, 'max_features': 0.8697284331340217}. Best is trial 102 with value: 0.884576309806181.[0m
/media/san2_ssd/data/Workdir/survival/utils.py:305: RuntimeWarning: invalid value encountered in true_divide
  pdfs = np.gradient(1-survs,axis=1)/norms
/media/san2_ssd/data/Workdir/survival/utils.py:305: RuntimeWarning: invalid value encountered in true_divide
  pdfs = np.gradient(1-survs,axis=1)/norms
[32m[I 2022-04-13 11:43:49,286][0m Trial 109 finished with value: 0.8851336647396714 and parameters: {'splitter': 'best', 'min_samples_split': 0.04297440526279098, 'min_samples_leaf': 0.04250667320315237, 'min_weight_fraction_leaf': 0.007269031759247145, 'max_features': 0.853108190268662}. Best is trial 109 with value: 0.8851336647396714.[0m
[32m[I 2022-04-13 11:43:50,626][0m Trial 110 finished with value: 0.8816668242936444 and parameters: {'splitter': 'best', 'min_samples_split': 0.06655393776959995, 'min_samples_leaf': 0.06388524382016154, 'min_weight_fraction_leaf': 0.011562456279586525, 'max_features': 0.8650250887809463}. Best is trial 109 with value: 0.8851336647396714.[0m
/media/san2_ssd/data/Workdir/survival/utils.py:305: RuntimeWarning: invalid value encountered in true_divide
  pdfs = np.gradient(1-survs,axis=1)/norms
/media/san2_ssd/data/Workdir/survival/utils.py:305: RuntimeWarning: invalid value encountered in true_divide
  pdfs = np.gradient(1-survs,axis=1)/norms
/media/san2_ssd/data/Workdir/survival/utils.py:305: RuntimeWarning: invalid value encountered in true_divide
  pdfs = np.gradient(1-survs,axis=1)/norms
/media/san2_ssd/data/Workdir/survival/utils.py:305: RuntimeWarning: invalid value encountered in true_divide
  pdfs = np.gradient(1-survs,axis=1)/norms
[32m[I 2022-04-13 11:43:52,246][0m Trial 111 finished with value: 0.8842366888411541 and parameters: {'splitter': 'best', 'min_samples_split': 0.06933692866824288, 'min_samples_leaf': 0.041670154753508035, 'min_weight_fraction_leaf': 0.007736168842476942, 'max_features': 0.857446609270645}. Best is trial 109 with value: 0.8851336647396714.[0m
/media/san2_ssd/data/Workdir/survival/utils.py:305: RuntimeWarning: invalid value encountered in true_divide
  pdfs = np.gradient(1-survs,axis=1)/norms
/media/san2_ssd/data/Workdir/survival/utils.py:305: RuntimeWarning: invalid value encountered in true_divide
  pdfs = np.gradient(1-survs,axis=1)/norms
/media/san2_ssd/data/Workdir/survival/utils.py:305: RuntimeWarning: invalid value encountered in true_divide
  pdfs = np.gradient(1-survs,axis=1)/norms
/media/san2_ssd/data/Workdir/survival/utils.py:305: RuntimeWarning: invalid value encountered in true_divide
  pdfs = np.gradient(1-survs,axis=1)/norms
[32m[I 2022-04-13 11:43:53,911][0m Trial 112 finished with value: 0.8842536424047905 and parameters: {'splitter': 'best', 'min_samples_split': 0.07177530368077725, 'min_samples_leaf': 0.04024894242226998, 'min_weight_fraction_leaf': 0.02050509108258082, 'max_features': 0.8558393298144559}. Best is trial 109 with value: 0.8851336647396714.[0m
/media/san2_ssd/data/Workdir/survival/utils.py:305: RuntimeWarning: invalid value encountered in true_divide
  pdfs = np.gradient(1-survs,axis=1)/norms
/media/san2_ssd/data/Workdir/survival/utils.py:305: RuntimeWarning: invalid value encountered in true_divide
  pdfs = np.gradient(1-survs,axis=1)/norms
/media/san2_ssd/data/Workdir/survival/utils.py:305: RuntimeWarning: invalid value encountered in true_divide
  pdfs = np.gradient(1-survs,axis=1)/norms
/media/san2_ssd/data/Workdir/survival/utils.py:305: RuntimeWarning: invalid value encountered in true_divide
  pdfs = np.gradient(1-survs,axis=1)/norms
/media/san2_ssd/data/Workdir/survival/utils.py:305: RuntimeWarning: invalid value encountered in true_divide
  pdfs = np.gradient(1-survs,axis=1)/norms
[32m[I 2022-04-13 11:43:55,044][0m Trial 113 finished with value: 0.8831582110142913 and parameters: {'splitter': 'best', 'min_samples_split': 0.04496867936139773, 'min_samples_leaf': 0.04363496772567159, 'min_weight_fraction_leaf': 0.021344706895778682, 'max_features': 0.9341467072077224}. Best is trial 109 with value: 0.8851336647396714.[0m
/media/san2_ssd/data/Workdir/survival/utils.py:305: RuntimeWarning: invalid value encountered in true_divide
  pdfs = np.gradient(1-survs,axis=1)/norms
/media/san2_ssd/data/Workdir/survival/utils.py:305: RuntimeWarning: invalid value encountered in true_divide
  pdfs = np.gradient(1-survs,axis=1)/norms
/media/san2_ssd/data/Workdir/survival/utils.py:305: RuntimeWarning: invalid value encountered in true_divide
  pdfs = np.gradient(1-survs,axis=1)/norms
/media/san2_ssd/data/Workdir/survival/utils.py:305: RuntimeWarning: invalid value encountered in true_divide
  pdfs = np.gradient(1-survs,axis=1)/norms
/media/san2_ssd/data/Workdir/survival/utils.py:305: RuntimeWarning: invalid value encountered in true_divide
  pdfs = np.gradient(1-survs,axis=1)/norms
[32m[I 2022-04-13 11:43:56,499][0m Trial 114 finished with value: 0.8833433275011169 and parameters: {'splitter': 'best', 'min_samples_split': 0.04849491972306329, 'min_samples_leaf': 0.04026041648893631, 'min_weight_fraction_leaf': 0.022735230796812167, 'max_features': 0.9390210888199317}. Best is trial 109 with value: 0.8851336647396714.[0m
/media/san2_ssd/data/Workdir/survival/utils.py:305: RuntimeWarning: invalid value encountered in true_divide
  pdfs = np.gradient(1-survs,axis=1)/norms
/media/san2_ssd/data/Workdir/survival/utils.py:305: RuntimeWarning: invalid value encountered in true_divide
  pdfs = np.gradient(1-survs,axis=1)/norms
/media/san2_ssd/data/Workdir/survival/utils.py:305: RuntimeWarning: invalid value encountered in true_divide
  pdfs = np.gradient(1-survs,axis=1)/norms
/media/san2_ssd/data/Workdir/survival/utils.py:305: RuntimeWarning: invalid value encountered in true_divide
  pdfs = np.gradient(1-survs,axis=1)/norms
/media/san2_ssd/data/Workdir/survival/utils.py:305: RuntimeWarning: invalid value encountered in true_divide
  pdfs = np.gradient(1-survs,axis=1)/norms
[32m[I 2022-04-13 11:43:57,418][0m Trial 115 finished with value: 0.8833433275011169 and parameters: {'splitter': 'best', 'min_samples_split': 0.04828116675303763, 'min_samples_leaf': 0.040105174034102735, 'min_weight_fraction_leaf': 0.023818176025826036, 'max_features': 0.9369911104594438}. Best is trial 109 with value: 0.8851336647396714.[0m
/media/san2_ssd/data/Workdir/survival/utils.py:305: RuntimeWarning: invalid value encountered in true_divide
  pdfs = np.gradient(1-survs,axis=1)/norms
/media/san2_ssd/data/Workdir/survival/utils.py:305: RuntimeWarning: invalid value encountered in true_divide
  pdfs = np.gradient(1-survs,axis=1)/norms
/media/san2_ssd/data/Workdir/survival/utils.py:305: RuntimeWarning: invalid value encountered in true_divide
  pdfs = np.gradient(1-survs,axis=1)/norms
/media/san2_ssd/data/Workdir/survival/utils.py:305: RuntimeWarning: invalid value encountered in true_divide
  pdfs = np.gradient(1-survs,axis=1)/norms
/media/san2_ssd/data/Workdir/survival/utils.py:305: RuntimeWarning: invalid value encountered in true_divide
  pdfs = np.gradient(1-survs,axis=1)/norms
[32m[I 2022-04-13 11:43:58,650][0m Trial 116 finished with value: 0.8822106782769226 and parameters: {'splitter': 'best', 'min_samples_split': 0.04947696140931868, 'min_samples_leaf': 0.03914983986856343, 'min_weight_fraction_leaf': 0.00010827869836050209, 'max_features': 0.9373058715425546}. Best is trial 109 with value: 0.8851336647396714.[0m
/media/san2_ssd/data/Workdir/survival/utils.py:305: RuntimeWarning: invalid value encountered in true_divide
  pdfs = np.gradient(1-survs,axis=1)/norms
/media/san2_ssd/data/Workdir/survival/utils.py:305: RuntimeWarning: invalid value encountered in true_divide
  pdfs = np.gradient(1-survs,axis=1)/norms
/media/san2_ssd/data/Workdir/survival/utils.py:305: RuntimeWarning: invalid value encountered in true_divide
  pdfs = np.gradient(1-survs,axis=1)/norms
[32m[I 2022-04-13 11:43:59,988][0m Trial 117 finished with value: 0.8813587386655488 and parameters: {'splitter': 'best', 'min_samples_split': 0.060801547268447144, 'min_samples_leaf': 0.05541576403422853, 'min_weight_fraction_leaf': 0.01869326213994576, 'max_features': 0.8560326899579587}. Best is trial 109 with value: 0.8851336647396714.[0m
/media/san2_ssd/data/Workdir/survival/utils.py:305: RuntimeWarning: invalid value encountered in true_divide
  pdfs = np.gradient(1-survs,axis=1)/norms
/media/san2_ssd/data/Workdir/survival/utils.py:305: RuntimeWarning: invalid value encountered in true_divide
  pdfs = np.gradient(1-survs,axis=1)/norms
/media/san2_ssd/data/Workdir/survival/utils.py:305: RuntimeWarning: invalid value encountered in true_divide
  pdfs = np.gradient(1-survs,axis=1)/norms
/media/san2_ssd/data/Workdir/survival/utils.py:305: RuntimeWarning: invalid value encountered in true_divide
  pdfs = np.gradient(1-survs,axis=1)/norms
[32m[I 2022-04-13 11:44:01,187][0m Trial 118 finished with value: 0.8819605767726235 and parameters: {'splitter': 'best', 'min_samples_split': 0.09030905442561482, 'min_samples_leaf': 0.04316098519012541, 'min_weight_fraction_leaf': 0.006094605220286459, 'max_features': 0.8771434689410325}. Best is trial 109 with value: 0.8851336647396714.[0m
[32m[I 2022-04-13 11:44:01,906][0m Trial 119 finished with value: 0.8832046656213158 and parameters: {'splitter': 'best', 'min_samples_split': 0.06977723210942342, 'min_samples_leaf': 0.06420033943397602, 'min_weight_fraction_leaf': 0.032994671827778065, 'max_features': 0.8337616986446635}. Best is trial 109 with value: 0.8851336647396714.[0m
[32m[I 2022-04-13 11:44:02,962][0m Trial 120 finished with value: 0.880650188930996 and parameters: {'splitter': 'best', 'min_samples_split': 0.05404952220771741, 'min_samples_leaf': 0.08257029997712972, 'min_weight_fraction_leaf': 0.03172695138686368, 'max_features': 0.8241848343987195}. Best is trial 109 with value: 0.8851336647396714.[0m
[32m[I 2022-04-13 11:44:04,246][0m Trial 121 finished with value: 0.8815353114705882 and parameters: {'splitter': 'best', 'min_samples_split': 0.06628022954691874, 'min_samples_leaf': 0.06841765511458603, 'min_weight_fraction_leaf': 0.020351055714388114, 'max_features': 0.954494942287523}. Best is trial 109 with value: 0.8851336647396714.[0m
/media/san2_ssd/data/Workdir/survival/utils.py:305: RuntimeWarning: invalid value encountered in true_divide
  pdfs = np.gradient(1-survs,axis=1)/norms
/media/san2_ssd/data/Workdir/survival/utils.py:305: RuntimeWarning: invalid value encountered in true_divide
  pdfs = np.gradient(1-survs,axis=1)/norms
[32m[I 2022-04-13 11:44:06,329][0m Trial 122 finished with value: 0.8836251863251195 and parameters: {'splitter': 'best', 'min_samples_split': 0.07119319062804959, 'min_samples_leaf': 0.058128218993691104, 'min_weight_fraction_leaf': 0.007804107401938817, 'max_features': 0.9197641724654544}. Best is trial 109 with value: 0.8851336647396714.[0m
/media/san2_ssd/data/Workdir/survival/utils.py:305: RuntimeWarning: invalid value encountered in true_divide
  pdfs = np.gradient(1-survs,axis=1)/norms
/media/san2_ssd/data/Workdir/survival/utils.py:305: RuntimeWarning: invalid value encountered in true_divide
  pdfs = np.gradient(1-survs,axis=1)/norms
[32m[I 2022-04-13 11:44:07,898][0m Trial 123 finished with value: 0.8838043405498158 and parameters: {'splitter': 'best', 'min_samples_split': 0.07468270039612414, 'min_samples_leaf': 0.05967294766570859, 'min_weight_fraction_leaf': 0.0076320425256955204, 'max_features': 0.9162227030062392}. Best is trial 109 with value: 0.8851336647396714.[0m
/media/san2_ssd/data/Workdir/survival/utils.py:305: RuntimeWarning: invalid value encountered in true_divide
  pdfs = np.gradient(1-survs,axis=1)/norms
/media/san2_ssd/data/Workdir/survival/utils.py:305: RuntimeWarning: invalid value encountered in true_divide
  pdfs = np.gradient(1-survs,axis=1)/norms
[32m[I 2022-04-13 11:44:08,717][0m Trial 124 finished with value: 0.88562319264034 and parameters: {'splitter': 'best', 'min_samples_split': 0.06978356060683427, 'min_samples_leaf': 0.057901858815422313, 'min_weight_fraction_leaf': 0.007997100185383108, 'max_features': 0.9972820394624392}. Best is trial 124 with value: 0.88562319264034.[0m
/media/san2_ssd/data/Workdir/survival/utils.py:305: RuntimeWarning: invalid value encountered in true_divide
  pdfs = np.gradient(1-survs,axis=1)/norms
/media/san2_ssd/data/Workdir/survival/utils.py:305: RuntimeWarning: invalid value encountered in true_divide
  pdfs = np.gradient(1-survs,axis=1)/norms
/media/san2_ssd/data/Workdir/survival/utils.py:305: RuntimeWarning: invalid value encountered in true_divide
  pdfs = np.gradient(1-survs,axis=1)/norms
[32m[I 2022-04-13 11:44:10,648][0m Trial 125 finished with value: 0.8839456325461915 and parameters: {'splitter': 'best', 'min_samples_split': 0.09056490108866025, 'min_samples_leaf': 0.05641942129435435, 'min_weight_fraction_leaf': 0.009562028336152965, 'max_features': 0.9742993343872923}. Best is trial 124 with value: 0.88562319264034.[0m
[32m[I 2022-04-13 11:44:11,188][0m Trial 126 finished with value: 0.5371812073302544 and parameters: {'splitter': 'best', 'min_samples_split': 0.08793653545076752, 'min_samples_leaf': 0.32595242717651624, 'min_weight_fraction_leaf': 0.009334121629260993, 'max_features': 0.9845635991868293}. Best is trial 124 with value: 0.88562319264034.[0m
[32m[I 2022-04-13 11:44:12,081][0m Trial 127 finished with value: 0.7757932878710069 and parameters: {'splitter': 'best', 'min_samples_split': 0.07239316814083231, 'min_samples_leaf': 0.09137018076792686, 'min_weight_fraction_leaf': 0.007408510874621033, 'max_features': 0.9078337750746602}. Best is trial 124 with value: 0.88562319264034.[0m
/media/san2_ssd/data/Workdir/survival/utils.py:305: RuntimeWarning: invalid value encountered in true_divide
  pdfs = np.gradient(1-survs,axis=1)/norms
/media/san2_ssd/data/Workdir/survival/utils.py:305: RuntimeWarning: invalid value encountered in true_divide
  pdfs = np.gradient(1-survs,axis=1)/norms
/media/san2_ssd/data/Workdir/survival/utils.py:305: RuntimeWarning: invalid value encountered in true_divide
  pdfs = np.gradient(1-survs,axis=1)/norms
[32m[I 2022-04-13 11:44:13,070][0m Trial 128 finished with value: 0.8833540188224372 and parameters: {'splitter': 'best', 'min_samples_split': 0.10328658810697089, 'min_samples_leaf': 0.056712284270087523, 'min_weight_fraction_leaf': 0.0019430746881448071, 'max_features': 0.9599774642527882}. Best is trial 124 with value: 0.88562319264034.[0m
/media/san2_ssd/data/Workdir/survival/utils.py:305: RuntimeWarning: invalid value encountered in true_divide
  pdfs = np.gradient(1-survs,axis=1)/norms
/media/san2_ssd/data/Workdir/survival/utils.py:305: RuntimeWarning: invalid value encountered in true_divide
  pdfs = np.gradient(1-survs,axis=1)/norms
/media/san2_ssd/data/Workdir/survival/utils.py:305: RuntimeWarning: invalid value encountered in true_divide
  pdfs = np.gradient(1-survs,axis=1)/norms
[32m[I 2022-04-13 11:44:14,752][0m Trial 129 finished with value: 0.8828140496129546 and parameters: {'splitter': 'best', 'min_samples_split': 0.10004375632652003, 'min_samples_leaf': 0.054465770453931056, 'min_weight_fraction_leaf': 0.0014638397418468097, 'max_features': 0.9738629968728469}. Best is trial 124 with value: 0.88562319264034.[0m
[32m[I 2022-04-13 11:44:16,208][0m Trial 130 finished with value: 0.8805937248167715 and parameters: {'splitter': 'best', 'min_samples_split': 0.12002099017210044, 'min_samples_leaf': 0.07195580915965397, 'min_weight_fraction_leaf': 0.037221714132877934, 'max_features': 0.8869460059459597}. Best is trial 124 with value: 0.88562319264034.[0m
/media/san2_ssd/data/Workdir/survival/utils.py:305: RuntimeWarning: invalid value encountered in true_divide
  pdfs = np.gradient(1-survs,axis=1)/norms
/media/san2_ssd/data/Workdir/survival/utils.py:305: RuntimeWarning: invalid value encountered in true_divide
  pdfs = np.gradient(1-survs,axis=1)/norms
[32m[I 2022-04-13 11:44:17,570][0m Trial 131 finished with value: 0.8838043405498158 and parameters: {'splitter': 'best', 'min_samples_split': 0.059781160984161065, 'min_samples_leaf': 0.05946516086823165, 'min_weight_fraction_leaf': 0.014140629381678056, 'max_features': 0.9157534351305203}. Best is trial 124 with value: 0.88562319264034.[0m
/media/san2_ssd/data/Workdir/survival/utils.py:305: RuntimeWarning: invalid value encountered in true_divide
  pdfs = np.gradient(1-survs,axis=1)/norms
[32m[I 2022-04-13 11:44:19,166][0m Trial 132 finished with value: 0.8857694580205372 and parameters: {'splitter': 'best', 'min_samples_split': 0.05967305378376831, 'min_samples_leaf': 0.06021758629590907, 'min_weight_fraction_leaf': 0.010873666840508625, 'max_features': 0.9957955473511872}. Best is trial 132 with value: 0.8857694580205372.[0m
[32m[I 2022-04-13 11:44:20,541][0m Trial 133 finished with value: 0.7864979688071791 and parameters: {'splitter': 'best', 'min_samples_split': 0.060410552714292444, 'min_samples_leaf': 0.08184298630835261, 'min_weight_fraction_leaf': 0.01177756040345602, 'max_features': 0.992982265551282}. Best is trial 132 with value: 0.8857694580205372.[0m
[32m[I 2022-04-13 11:44:21,720][0m Trial 134 finished with value: 0.8808242843864811 and parameters: {'splitter': 'best', 'min_samples_split': 0.05793999509169994, 'min_samples_leaf': 0.062145111265254294, 'min_weight_fraction_leaf': 0.03582125479657755, 'max_features': 0.9144696900673377}. Best is trial 132 with value: 0.8857694580205372.[0m
[32m[I 2022-04-13 11:44:22,897][0m Trial 135 finished with value: 0.6964090917580827 and parameters: {'splitter': 'best', 'min_samples_split': 0.0759695829431904, 'min_samples_leaf': 0.04985121815322369, 'min_weight_fraction_leaf': 0.3335840137255892, 'max_features': 0.8421848666636631}. Best is trial 132 with value: 0.8857694580205372.[0m
[32m[I 2022-04-13 11:44:23,606][0m Trial 136 finished with value: 0.5480111951884148 and parameters: {'splitter': 'best', 'min_samples_split': 0.08954814833882903, 'min_samples_leaf': 0.2447972365365216, 'min_weight_fraction_leaf': 0.014425182473520887, 'max_features': 0.8092751299095855}. Best is trial 132 with value: 0.8857694580205372.[0m
[32m[I 2022-04-13 11:44:24,519][0m Trial 137 finished with value: 0.8844443183055116 and parameters: {'splitter': 'best', 'min_samples_split': 0.07295822334196603, 'min_samples_leaf': 0.07360144242859437, 'min_weight_fraction_leaf': 0.04939526656046132, 'max_features': 0.9033723419777656}. Best is trial 132 with value: 0.8857694580205372.[0m
[32m[I 2022-04-13 11:44:25,480][0m Trial 138 finished with value: 0.8844443183055116 and parameters: {'splitter': 'best', 'min_samples_split': 0.07309714759314899, 'min_samples_leaf': 0.07308397283809666, 'min_weight_fraction_leaf': 0.04584793836723893, 'max_features': 0.9031102025685951}. Best is trial 132 with value: 0.8857694580205372.[0m
