[32m[I 2022-04-16 21:09:42,965][0m Trial 808 finished with value: 0.8852657213487521 and parameters: {'n_hidden': 1024, 'mixture_components': 7, 'use_sparse_layer': False, 'use_batchnorm': False, 'use_dropout': True, 'dropout': 0.6980550431816726, 'mlp_size_1': 4, 'mlp_size_2': 3, 'mlp_size_3': 0, 'kernel': 'Gamma', 'loss_name': 'AlternativeNLLLoss'}. Best is trial 704 with value: 0.8891333137081187.[0m
[32m[I 2022-04-16 21:12:45,267][0m Trial 809 finished with value: 0.7811674307753718 and parameters: {'n_hidden': 1024, 'mixture_components': 8, 'use_sparse_layer': False, 'use_batchnorm': False, 'use_dropout': True, 'dropout': 0.7753466870864794, 'mlp_size_1': 4, 'mlp_size_2': 3, 'mlp_size_3': 0, 'kernel': 'LogNormal', 'loss_name': 'AlternativeNLLLoss'}. Best is trial 704 with value: 0.8891333137081187.[0m
[32m[I 2022-04-16 21:14:44,699][0m Trial 810 finished with value: 0.8867158135034611 and parameters: {'n_hidden': 1024, 'mixture_components': 7, 'use_sparse_layer': False, 'use_batchnorm': False, 'use_dropout': True, 'dropout': 0.7198997922931856, 'mlp_size_1': 4, 'mlp_size_2': 3, 'mlp_size_3': 0, 'kernel': 'Gamma', 'loss_name': 'AlternativeNLLLoss'}. Best is trial 704 with value: 0.8891333137081187.[0m
[32m[I 2022-04-16 21:17:02,990][0m Trial 811 finished with value: 0.8848284504838475 and parameters: {'n_hidden': 1024, 'mixture_components': 8, 'use_sparse_layer': False, 'use_batchnorm': False, 'use_dropout': True, 'dropout': 0.6807375728226822, 'mlp_size_1': 4, 'mlp_size_2': 3, 'mlp_size_3': 0, 'kernel': 'Gamma', 'loss_name': 'AlternativeNLLLoss'}. Best is trial 704 with value: 0.8891333137081187.[0m
/media/san2_ssd/data/Workdir/survival/utils.py:305: RuntimeWarning: invalid value encountered in true_divide
  pdfs = np.gradient(1-survs,axis=1)/norms
[32m[I 2022-04-16 21:19:30,748][0m Trial 812 finished with value: 0.7801965592498282 and parameters: {'n_hidden': 1024, 'mixture_components': 7, 'use_sparse_layer': False, 'use_batchnorm': False, 'use_dropout': True, 'dropout': 0.6457674878737937, 'mlp_size_1': 4, 'mlp_size_2': 3, 'mlp_size_3': 0, 'kernel': 'LogLogistic', 'loss_name': 'AlternativeNLLLoss'}. Best is trial 704 with value: 0.8891333137081187.[0m
[32m[I 2022-04-16 21:21:31,020][0m Trial 813 finished with value: 0.882684054051413 and parameters: {'n_hidden': 1024, 'mixture_components': 7, 'use_sparse_layer': False, 'use_batchnorm': False, 'use_dropout': True, 'dropout': 0.6637919875167635, 'mlp_size_1': 4, 'mlp_size_2': 3, 'mlp_size_3': 0, 'kernel': 'Gamma', 'loss_name': 'AlternativeNLLLoss'}. Best is trial 704 with value: 0.8891333137081187.[0m
[32m[I 2022-04-16 21:23:35,173][0m Trial 814 finished with value: 0.8853490581689364 and parameters: {'n_hidden': 1024, 'mixture_components': 8, 'use_sparse_layer': False, 'use_batchnorm': False, 'use_dropout': True, 'dropout': 0.744996334229182, 'mlp_size_1': 4, 'mlp_size_2': 3, 'mlp_size_3': 0, 'kernel': 'Gamma', 'loss_name': 'AlternativeNLLLoss'}. Best is trial 704 with value: 0.8891333137081187.[0m
[32m[I 2022-04-16 21:25:34,816][0m Trial 815 finished with value: 0.8859217847523555 and parameters: {'n_hidden': 1024, 'mixture_components': 7, 'use_sparse_layer': False, 'use_batchnorm': False, 'use_dropout': True, 'dropout': 0.7184828260528904, 'mlp_size_1': 5, 'mlp_size_2': 2, 'mlp_size_3': 0, 'kernel': 'Gamma', 'loss_name': 'AlternativeNLLLoss'}. Best is trial 704 with value: 0.8891333137081187.[0m
[32m[I 2022-04-16 21:28:42,710][0m Trial 816 finished with value: 0.8758439277727389 and parameters: {'n_hidden': 32, 'mixture_components': 6, 'use_sparse_layer': False, 'use_batchnorm': False, 'use_dropout': True, 'dropout': 0.6920734852937904, 'mlp_size_1': 2, 'mlp_size_2': 0, 'mlp_size_3': 0, 'kernel': 'Exponential', 'loss_name': 'AlternativeNLLLoss'}. Best is trial 704 with value: 0.8891333137081187.[0m
[32m[I 2022-04-16 21:30:40,517][0m Trial 817 finished with value: 0.8863195107944113 and parameters: {'n_hidden': 1024, 'mixture_components': 8, 'use_sparse_layer': False, 'use_batchnorm': False, 'use_dropout': True, 'dropout': 0.6392811765827532, 'mlp_size_1': 3, 'mlp_size_2': 4, 'mlp_size_3': 0, 'kernel': 'Gamma', 'loss_name': 'AlternativeNLLLoss'}. Best is trial 704 with value: 0.8891333137081187.[0m
[32m[I 2022-04-16 21:32:30,874][0m Trial 818 finished with value: 0.8865928604512211 and parameters: {'n_hidden': 1024, 'mixture_components': 7, 'use_sparse_layer': False, 'use_batchnorm': False, 'use_dropout': True, 'dropout': 0.7038559093916747, 'mlp_size_1': 4, 'mlp_size_2': 3, 'mlp_size_3': 0, 'kernel': 'Gamma', 'loss_name': 'AlternativeNLLLoss'}. Best is trial 704 with value: 0.8891333137081187.[0m
[32m[I 2022-04-16 21:34:40,903][0m Trial 819 finished with value: 0.8848487062308019 and parameters: {'n_hidden': 1024, 'mixture_components': 8, 'use_sparse_layer': False, 'use_batchnorm': False, 'use_dropout': True, 'dropout': 0.7607990172844096, 'mlp_size_1': 3, 'mlp_size_2': 4, 'mlp_size_3': 0, 'kernel': 'Gamma', 'loss_name': 'AlternativeNLLLoss'}. Best is trial 704 with value: 0.8891333137081187.[0m
[32m[I 2022-04-16 21:37:00,711][0m Trial 820 finished with value: 0.8850939477366906 and parameters: {'n_hidden': 1024, 'mixture_components': 8, 'use_sparse_layer': False, 'use_batchnorm': False, 'use_dropout': True, 'dropout': 0.6746357227926204, 'mlp_size_1': 0, 'mlp_size_2': 4, 'mlp_size_3': 2, 'kernel': 'Gamma', 'loss_name': 'AlternativeNLLLoss'}. Best is trial 704 with value: 0.8891333137081187.[0m
[32m[I 2022-04-16 21:38:56,874][0m Trial 821 finished with value: 0.8856448796135691 and parameters: {'n_hidden': 256, 'mixture_components': 7, 'use_sparse_layer': False, 'use_batchnorm': False, 'use_dropout': True, 'dropout': 0.7177146652881904, 'mlp_size_1': 2, 'mlp_size_2': 3, 'mlp_size_3': 0, 'kernel': 'Gamma', 'loss_name': 'AlternativeNLLLoss'}. Best is trial 704 with value: 0.8891333137081187.[0m
[32m[I 2022-04-16 21:42:03,716][0m Trial 822 finished with value: 0.8723597806805301 and parameters: {'n_hidden': 1024, 'mixture_components': 6, 'use_sparse_layer': False, 'use_batchnorm': True, 'use_dropout': False, 'mlp_size_1': 4, 'mlp_size_2': 3, 'mlp_size_3': 0, 'kernel': 'Gamma', 'loss_name': 'AlternativeNLLLoss'}. Best is trial 704 with value: 0.8891333137081187.[0m
[32m[I 2022-04-16 21:44:14,846][0m Trial 823 finished with value: 0.8843087103113259 and parameters: {'n_hidden': 1024, 'mixture_components': 8, 'use_sparse_layer': False, 'use_batchnorm': False, 'use_dropout': True, 'dropout': 0.7872204551806466, 'mlp_size_1': 4, 'mlp_size_2': 3, 'mlp_size_3': 0, 'kernel': 'Gamma', 'loss_name': 'AlternativeNLLLoss'}. Best is trial 704 with value: 0.8891333137081187.[0m
[32m[I 2022-04-16 21:46:59,289][0m Trial 824 finished with value: 0.8808573561868565 and parameters: {'n_hidden': 128, 'mixture_components': 5, 'use_sparse_layer': False, 'use_batchnorm': False, 'use_dropout': True, 'dropout': 0.7370725440786732, 'mlp_size_1': 2, 'mlp_size_2': 2, 'mlp_size_3': 0, 'kernel': 'Gamma', 'loss_name': 'AlternativeNLLLoss'}. Best is trial 704 with value: 0.8891333137081187.[0m
[32m[I 2022-04-16 21:49:11,281][0m Trial 825 finished with value: 0.8866525644626166 and parameters: {'n_hidden': 1024, 'mixture_components': 7, 'use_sparse_layer': False, 'use_batchnorm': False, 'use_dropout': True, 'dropout': 0.6868783961465414, 'mlp_size_1': 4, 'mlp_size_2': 3, 'mlp_size_3': 0, 'kernel': 'Gamma', 'loss_name': 'AlternativeNLLLoss'}. Best is trial 704 with value: 0.8891333137081187.[0m
[32m[I 2022-04-16 21:51:19,111][0m Trial 826 finished with value: 0.8855593462738117 and parameters: {'n_hidden': 512, 'mixture_components': 8, 'use_sparse_layer': False, 'use_batchnorm': False, 'use_dropout': True, 'dropout': 0.6611169235999987, 'mlp_size_1': 2, 'mlp_size_2': 4, 'mlp_size_3': 0, 'kernel': 'Gamma', 'loss_name': 'AlternativeNLLLoss'}. Best is trial 704 with value: 0.8891333137081187.[0m
[32m[I 2022-04-16 21:53:31,465][0m Trial 827 finished with value: 0.8846425106858813 and parameters: {'n_hidden': 1024, 'mixture_components': 7, 'use_sparse_layer': False, 'use_batchnorm': False, 'use_dropout': True, 'dropout': 0.6486670021762104, 'mlp_size_1': 3, 'mlp_size_2': 4, 'mlp_size_3': 0, 'kernel': 'Gamma', 'loss_name': 'AlternativeNLLLoss'}. Best is trial 704 with value: 0.8891333137081187.[0m
[32m[I 2022-04-16 21:55:40,994][0m Trial 828 finished with value: 0.28522674797438297 and parameters: {'n_hidden': 1024, 'mixture_components': 8, 'use_sparse_layer': False, 'use_batchnorm': False, 'use_dropout': True, 'dropout': 0.8246357648971904, 'mlp_size_1': 3, 'mlp_size_2': 4, 'mlp_size_3': 0, 'kernel': 'Gumbel', 'loss_name': 'AlternativeNLLLoss'}. Best is trial 704 with value: 0.8891333137081187.[0m
[32m[I 2022-04-16 21:58:26,176][0m Trial 829 finished with value: 0.8863907952911034 and parameters: {'n_hidden': 64, 'mixture_components': 7, 'use_sparse_layer': False, 'use_batchnorm': False, 'use_dropout': True, 'dropout': 0.6319502198470994, 'mlp_size_1': 2, 'mlp_size_2': 1, 'mlp_size_3': 0, 'kernel': 'Gamma', 'loss_name': 'AlternativeNLLLoss'}. Best is trial 704 with value: 0.8891333137081187.[0m
[32m[I 2022-04-16 22:00:36,513][0m Trial 830 finished with value: 0.8860880072043644 and parameters: {'n_hidden': 1024, 'mixture_components': 8, 'use_sparse_layer': False, 'use_batchnorm': False, 'use_dropout': True, 'dropout': 0.7611712743133751, 'mlp_size_1': 4, 'mlp_size_2': 3, 'mlp_size_3': 0, 'kernel': 'Gamma', 'loss_name': 'AlternativeNLLLoss'}. Best is trial 704 with value: 0.8891333137081187.[0m
[32m[I 2022-04-16 22:03:33,190][0m Trial 831 finished with value: 0.8788464885206206 and parameters: {'n_hidden': 2048, 'mixture_components': 7, 'use_sparse_layer': False, 'use_batchnorm': False, 'use_dropout': True, 'dropout': 0.7018112939559672, 'mlp_size_1': 8, 'mlp_size_2': 0, 'mlp_size_3': 0, 'kernel': 'Gamma', 'loss_name': 'AlternativeNLLLoss'}. Best is trial 704 with value: 0.8891333137081187.[0m
[32m[I 2022-04-16 22:07:41,799][0m Trial 832 finished with value: 0.6646524804753767 and parameters: {'n_hidden': 1024, 'mixture_components': 8, 'use_sparse_layer': False, 'use_batchnorm': False, 'use_dropout': True, 'dropout': 0.732720564291776, 'mlp_size_1': 6, 'mlp_size_2': 1, 'mlp_size_3': 0, 'kernel': 'Normal', 'loss_name': 'AlternativeNLLLoss'}. Best is trial 704 with value: 0.8891333137081187.[0m
[32m[I 2022-04-16 22:10:01,575][0m Trial 833 finished with value: 0.8842927628686794 and parameters: {'n_hidden': 256, 'mixture_components': 7, 'use_sparse_layer': False, 'use_batchnorm': False, 'use_dropout': True, 'dropout': 0.6779898066496994, 'mlp_size_1': 2, 'mlp_size_2': 3, 'mlp_size_3': 0, 'kernel': 'Gamma', 'loss_name': 'AlternativeNLLLoss'}. Best is trial 704 with value: 0.8891333137081187.[0m
[32m[I 2022-04-16 22:12:05,475][0m Trial 834 finished with value: 0.8842656139704314 and parameters: {'n_hidden': 1024, 'mixture_components': 8, 'use_sparse_layer': False, 'use_batchnorm': False, 'use_dropout': True, 'dropout': 0.7133956651490769, 'mlp_size_1': 4, 'mlp_size_2': 3, 'mlp_size_3': 0, 'kernel': 'Gamma', 'loss_name': 'AlternativeNLLLoss'}. Best is trial 704 with value: 0.8891333137081187.[0m
[32m[I 2022-04-16 22:15:00,742][0m Trial 835 finished with value: 0.785314972558445 and parameters: {'n_hidden': 1024, 'mixture_components': 7, 'use_sparse_layer': False, 'use_batchnorm': False, 'use_dropout': True, 'dropout': 0.6529310859245328, 'mlp_size_1': 4, 'mlp_size_2': 3, 'mlp_size_3': 0, 'kernel': 'LogNormal', 'loss_name': 'AlternativeNLLLoss'}. Best is trial 704 with value: 0.8891333137081187.[0m
[32m[I 2022-04-16 22:18:09,015][0m Trial 836 finished with value: 0.8843649777390589 and parameters: {'n_hidden': 1024, 'mixture_components': 7, 'use_sparse_layer': False, 'use_batchnorm': False, 'use_dropout': True, 'dropout': 0.805922049464639, 'mlp_size_1': 0, 'mlp_size_2': 5, 'mlp_size_3': 1, 'kernel': 'Gamma', 'loss_name': 'AlternativeNLLLoss'}. Best is trial 704 with value: 0.8891333137081187.[0m
[32m[I 2022-04-16 22:20:12,650][0m Trial 837 finished with value: 0.8860882124982268 and parameters: {'n_hidden': 1024, 'mixture_components': 8, 'use_sparse_layer': False, 'use_batchnorm': False, 'use_dropout': True, 'dropout': 0.6285155361124859, 'mlp_size_1': 3, 'mlp_size_2': 4, 'mlp_size_3': 0, 'kernel': 'Gamma', 'loss_name': 'AlternativeNLLLoss'}. Best is trial 704 with value: 0.8891333137081187.[0m
[32m[I 2022-04-16 22:22:15,838][0m Trial 838 finished with value: 0.8867002505617038 and parameters: {'n_hidden': 1024, 'mixture_components': 7, 'use_sparse_layer': False, 'use_batchnorm': False, 'use_dropout': True, 'dropout': 0.6921049722606076, 'mlp_size_1': 4, 'mlp_size_2': 3, 'mlp_size_3': 0, 'kernel': 'Gamma', 'loss_name': 'AlternativeNLLLoss'}. Best is trial 704 with value: 0.8891333137081187.[0m
[32m[I 2022-04-16 22:24:08,338][0m Trial 839 finished with value: 0.6837114595277926 and parameters: {'n_hidden': 1024, 'mixture_components': 8, 'use_sparse_layer': False, 'use_batchnorm': False, 'use_dropout': True, 'dropout': 0.7378882851471704, 'mlp_size_1': 4, 'mlp_size_2': 3, 'mlp_size_3': 0, 'kernel': 'Exponential', 'loss_name': 'AlternativeNLLLoss'}. Best is trial 704 with value: 0.8891333137081187.[0m
[32m[I 2022-04-16 22:26:15,033][0m Trial 840 finished with value: 0.8857325011133443 and parameters: {'n_hidden': 1024, 'mixture_components': 7, 'use_sparse_layer': False, 'use_batchnorm': False, 'use_dropout': True, 'dropout': 0.7772376718699432, 'mlp_size_1': 4, 'mlp_size_2': 3, 'mlp_size_3': 0, 'kernel': 'Gamma', 'loss_name': 'AlternativeNLLLoss'}. Best is trial 704 with value: 0.8891333137081187.[0m
[32m[I 2022-04-16 22:28:57,613][0m Trial 841 finished with value: 0.8762104622840606 and parameters: {'n_hidden': 256, 'mixture_components': 8, 'use_sparse_layer': False, 'use_batchnorm': True, 'use_dropout': False, 'mlp_size_1': 2, 'mlp_size_2': 3, 'mlp_size_3': 0, 'kernel': 'Gamma', 'loss_name': 'AlternativeNLLLoss'}. Best is trial 704 with value: 0.8891333137081187.[0m
/media/san2_ssd/data/Workdir/survival/utils.py:305: RuntimeWarning: invalid value encountered in true_divide
  pdfs = np.gradient(1-survs,axis=1)/norms
[32m[I 2022-04-16 22:31:55,541][0m Trial 842 finished with value: 0.6815910509085276 and parameters: {'n_hidden': 1024, 'mixture_components': 7, 'use_sparse_layer': False, 'use_batchnorm': False, 'use_dropout': True, 'dropout': 0.6657551241377277, 'mlp_size_1': 5, 'mlp_size_2': 2, 'mlp_size_3': 0, 'kernel': 'LogLogistic', 'loss_name': 'AlternativeNLLLoss'}. Best is trial 704 with value: 0.8891333137081187.[0m
[32m[I 2022-04-16 22:34:16,759][0m Trial 843 finished with value: 0.8845908340746295 and parameters: {'n_hidden': 1024, 'mixture_components': 6, 'use_sparse_layer': False, 'use_batchnorm': False, 'use_dropout': True, 'dropout': 0.7208237375629654, 'mlp_size_1': 2, 'mlp_size_2': 4, 'mlp_size_3': 1, 'kernel': 'Gamma', 'loss_name': 'AlternativeNLLLoss'}. Best is trial 704 with value: 0.8891333137081187.[0m
[32m[I 2022-04-16 22:37:44,020][0m Trial 844 finished with value: 0.8828429196319971 and parameters: {'n_hidden': 32, 'mixture_components': 8, 'use_sparse_layer': False, 'use_batchnorm': False, 'use_dropout': True, 'dropout': 0.6969936520335468, 'mlp_size_1': 2, 'mlp_size_2': 0, 'mlp_size_3': 0, 'kernel': 'Gamma', 'loss_name': 'AlternativeNLLLoss'}. Best is trial 704 with value: 0.8891333137081187.[0m
[32m[I 2022-04-16 22:39:36,820][0m Trial 845 finished with value: 0.5510824842225466 and parameters: {'n_hidden': 1024, 'mixture_components': 7, 'use_sparse_layer': False, 'use_batchnorm': False, 'use_dropout': True, 'dropout': 0.6387445667996159, 'mlp_size_1': 4, 'mlp_size_2': 3, 'mlp_size_3': 0, 'kernel': 'Gamma', 'loss_name': 'NLLLoss'}. Best is trial 704 with value: 0.8891333137081187.[0m
[32m[I 2022-04-16 22:41:45,899][0m Trial 846 finished with value: 0.8847194035867911 and parameters: {'n_hidden': 1024, 'mixture_components': 8, 'use_sparse_layer': False, 'use_batchnorm': False, 'use_dropout': True, 'dropout': 0.7514539973331967, 'mlp_size_1': 3, 'mlp_size_2': 4, 'mlp_size_3': 0, 'kernel': 'Gamma', 'loss_name': 'AlternativeNLLLoss'}. Best is trial 704 with value: 0.8891333137081187.[0m
[32m[I 2022-04-16 22:43:55,185][0m Trial 847 finished with value: 0.8858620599430871 and parameters: {'n_hidden': 1024, 'mixture_components': 7, 'use_sparse_layer': False, 'use_batchnorm': False, 'use_dropout': True, 'dropout': 0.6761533524691811, 'mlp_size_1': 2, 'mlp_size_2': 4, 'mlp_size_3': 1, 'kernel': 'Gamma', 'loss_name': 'AlternativeNLLLoss'}. Best is trial 704 with value: 0.8891333137081187.[0m
[32m[I 2022-04-16 22:46:09,166][0m Trial 848 finished with value: 0.8834783400871131 and parameters: {'n_hidden': 1024, 'mixture_components': 8, 'use_sparse_layer': False, 'use_batchnorm': False, 'use_dropout': True, 'dropout': 0.7226050757102211, 'mlp_size_1': 2, 'mlp_size_2': 4, 'mlp_size_3': 1, 'kernel': 'Gamma', 'loss_name': 'AlternativeNLLLoss'}. Best is trial 704 with value: 0.8891333137081187.[0m
[32m[I 2022-04-16 22:48:12,315][0m Trial 849 finished with value: 0.8845865850422706 and parameters: {'n_hidden': 1024, 'mixture_components': 7, 'use_sparse_layer': False, 'use_batchnorm': False, 'use_dropout': True, 'dropout': 0.6602670328995502, 'mlp_size_1': 4, 'mlp_size_2': 3, 'mlp_size_3': 0, 'kernel': 'Gamma', 'loss_name': 'AlternativeNLLLoss'}. Best is trial 704 with value: 0.8891333137081187.[0m
[32m[I 2022-04-16 22:50:27,604][0m Trial 850 finished with value: 0.8856467610829529 and parameters: {'n_hidden': 1024, 'mixture_components': 8, 'use_sparse_layer': False, 'use_batchnorm': False, 'use_dropout': True, 'dropout': 0.7703768433025185, 'mlp_size_1': 2, 'mlp_size_2': 4, 'mlp_size_3': 1, 'kernel': 'Gamma', 'loss_name': 'AlternativeNLLLoss'}. Best is trial 704 with value: 0.8891333137081187.[0m
[32m[I 2022-04-16 22:52:28,950][0m Trial 851 finished with value: 0.8829267352147138 and parameters: {'n_hidden': 256, 'mixture_components': 7, 'use_sparse_layer': False, 'use_batchnorm': False, 'use_dropout': True, 'dropout': 0.6249308763780169, 'mlp_size_1': 2, 'mlp_size_2': 3, 'mlp_size_3': 0, 'kernel': 'Gamma', 'loss_name': 'AlternativeNLLLoss'}. Best is trial 704 with value: 0.8891333137081187.[0m
[32m[I 2022-04-16 22:54:01,370][0m Trial 852 finished with value: 0.6954009424601293 and parameters: {'n_hidden': 128, 'mixture_components': 8, 'use_sparse_layer': False, 'use_batchnorm': False, 'use_dropout': True, 'dropout': 0.6991393708986731, 'mlp_size_1': 2, 'mlp_size_2': 2, 'mlp_size_3': 0, 'kernel': 'Gumbel', 'loss_name': 'AlternativeNLLLoss'}. Best is trial 704 with value: 0.8891333137081187.[0m
[32m[I 2022-04-16 22:56:18,772][0m Trial 853 finished with value: 0.8846137380859643 and parameters: {'n_hidden': 1024, 'mixture_components': 7, 'use_sparse_layer': False, 'use_batchnorm': False, 'use_dropout': True, 'dropout': 0.6793144370234343, 'mlp_size_1': 2, 'mlp_size_2': 4, 'mlp_size_3': 1, 'kernel': 'Gamma', 'loss_name': 'AlternativeNLLLoss'}. Best is trial 704 with value: 0.8891333137081187.[0m
[32m[I 2022-04-16 22:58:37,147][0m Trial 854 finished with value: 0.8869086528503057 and parameters: {'n_hidden': 1024, 'mixture_components': 8, 'use_sparse_layer': False, 'use_batchnorm': False, 'use_dropout': True, 'dropout': 0.744173835519267, 'mlp_size_1': 2, 'mlp_size_2': 4, 'mlp_size_3': 1, 'kernel': 'Gamma', 'loss_name': 'AlternativeNLLLoss'}. Best is trial 704 with value: 0.8891333137081187.[0m
[32m[I 2022-04-16 23:01:00,663][0m Trial 855 finished with value: 0.8871686825437335 and parameters: {'n_hidden': 1024, 'mixture_components': 8, 'use_sparse_layer': False, 'use_batchnorm': False, 'use_dropout': True, 'dropout': 0.7507493766131345, 'mlp_size_1': 2, 'mlp_size_2': 4, 'mlp_size_3': 1, 'kernel': 'Gamma', 'loss_name': 'AlternativeNLLLoss'}. Best is trial 704 with value: 0.8891333137081187.[0m
[32m[I 2022-04-16 23:04:19,770][0m Trial 856 finished with value: 0.7675772036327047 and parameters: {'n_hidden': 1024, 'mixture_components': 8, 'use_sparse_layer': False, 'use_batchnorm': False, 'use_dropout': True, 'dropout': 0.7771341712317403, 'mlp_size_1': 2, 'mlp_size_2': 4, 'mlp_size_3': 1, 'kernel': 'Normal', 'loss_name': 'AlternativeNLLLoss'}. Best is trial 704 with value: 0.8891333137081187.[0m
[32m[I 2022-04-16 23:06:50,766][0m Trial 857 finished with value: 0.8836690685241194 and parameters: {'n_hidden': 1024, 'mixture_components': 8, 'use_sparse_layer': False, 'use_batchnorm': False, 'use_dropout': True, 'dropout': 0.741234316374226, 'mlp_size_1': 2, 'mlp_size_2': 4, 'mlp_size_3': 1, 'kernel': 'Gamma', 'loss_name': 'AlternativeNLLLoss'}. Best is trial 704 with value: 0.8891333137081187.[0m
[32m[I 2022-04-16 23:09:09,708][0m Trial 858 finished with value: 0.886390984837098 and parameters: {'n_hidden': 512, 'mixture_components': 8, 'use_sparse_layer': False, 'use_batchnorm': False, 'use_dropout': True, 'dropout': 0.7663752614733087, 'mlp_size_1': 2, 'mlp_size_2': 4, 'mlp_size_3': 0, 'kernel': 'Gamma', 'loss_name': 'AlternativeNLLLoss'}. Best is trial 704 with value: 0.8891333137081187.[0m
[32m[I 2022-04-16 23:12:09,277][0m Trial 859 finished with value: 0.8817900032806051 and parameters: {'n_hidden': 2048, 'mixture_components': 8, 'use_sparse_layer': False, 'use_batchnorm': False, 'use_dropout': True, 'dropout': 0.7560854038735865, 'mlp_size_1': 3, 'mlp_size_2': 4, 'mlp_size_3': 1, 'kernel': 'Gamma', 'loss_name': 'AlternativeNLLLoss'}. Best is trial 704 with value: 0.8891333137081187.[0m
[32m[I 2022-04-16 23:16:27,222][0m Trial 860 finished with value: 0.5751128009822416 and parameters: {'n_hidden': 1024, 'mixture_components': 8, 'use_sparse_layer': False, 'use_batchnorm': True, 'use_dropout': False, 'mlp_size_1': 2, 'mlp_size_2': 4, 'mlp_size_3': 1, 'kernel': 'LogNormal', 'loss_name': 'AlternativeNLLLoss'}. Best is trial 704 with value: 0.8891333137081187.[0m
