[32m[I 2022-04-14 03:46:05,008][0m Trial 410 finished with value: 0.7721484411055753 and parameters: {'loss': 'coxph', 'learning_rate': 9.241241880653975e-06, 'n_estimators': 846, 'criterion': 'friedman_mse', 'min_samples_split': 9, 'min_samples_leaf': 2, 'min_weight_fraction_leaf': 0.3824559407126468, 'min_impurity_decrease': 0.33997964458644975, 'max_features': 0.8684854637948229, 'subsample': 0.12701189448450745, 'dropout_rate': 0.576132592273236, 'ccp_alpha': 0.15770817398959008}. Best is trial 367 with value: 0.7817487788378487.[0m
[32m[I 2022-04-14 03:50:04,274][0m Trial 411 finished with value: 0.25 and parameters: {'loss': 'coxph', 'learning_rate': 7.870193557842464e-06, 'n_estimators': 910, 'criterion': 'friedman_mse', 'min_samples_split': 9, 'min_samples_leaf': 2, 'min_weight_fraction_leaf': 0.40253137727106936, 'min_impurity_decrease': 0.31273858809956195, 'max_features': 0.905845860639049, 'subsample': 0.06504376887338366, 'dropout_rate': 0.593005652188324, 'ccp_alpha': 0.518087008273777}. Best is trial 367 with value: 0.7817487788378487.[0m
[32m[I 2022-04-14 03:54:05,491][0m Trial 412 finished with value: 0.780144394477291 and parameters: {'loss': 'coxph', 'learning_rate': 1.3937596076744317e-05, 'n_estimators': 876, 'criterion': 'friedman_mse', 'min_samples_split': 9, 'min_samples_leaf': 2, 'min_weight_fraction_leaf': 0.36329902976157585, 'min_impurity_decrease': 0.27621129136417105, 'max_features': 0.93582546167689, 'subsample': 0.09075847762034839, 'dropout_rate': 0.61600355254959, 'ccp_alpha': 0.004240307483457497}. Best is trial 367 with value: 0.7817487788378487.[0m
[32m[I 2022-04-14 03:58:42,288][0m Trial 413 finished with value: 0.7788673424330407 and parameters: {'loss': 'coxph', 'learning_rate': 6.2574585161988855e-06, 'n_estimators': 944, 'criterion': 'friedman_mse', 'min_samples_split': 9, 'min_samples_leaf': 2, 'min_weight_fraction_leaf': 0.37146534994422514, 'min_impurity_decrease': 0.2549581757906955, 'max_features': 0.8824563764491113, 'subsample': 0.11620223807502611, 'dropout_rate': 0.5481336906216296, 'ccp_alpha': 0.10712044483088226}. Best is trial 367 with value: 0.7817487788378487.[0m
[32m[I 2022-04-14 04:02:14,695][0m Trial 414 finished with value: 0.6371812073302544 and parameters: {'loss': 'coxph', 'learning_rate': 1.0527050147515507e-05, 'n_estimators': 853, 'criterion': 'friedman_mse', 'min_samples_split': 9, 'min_samples_leaf': 2, 'min_weight_fraction_leaf': 0.3888954681397238, 'min_impurity_decrease': 0.342215744119575, 'max_features': 0.8511959957461169, 'subsample': 0.1413570207951159, 'dropout_rate': 0.571568321733031, 'ccp_alpha': 0.23718817994569014}. Best is trial 367 with value: 0.7817487788378487.[0m
[32m[I 2022-04-14 04:06:19,124][0m Trial 415 finished with value: 0.7806453431091583 and parameters: {'loss': 'coxph', 'learning_rate': 8.103038167220054e-06, 'n_estimators': 904, 'criterion': 'friedman_mse', 'min_samples_split': 9, 'min_samples_leaf': 2, 'min_weight_fraction_leaf': 0.35977210841601015, 'min_impurity_decrease': 0.3087462013276352, 'max_features': 0.9167327159541501, 'subsample': 0.06896542825184426, 'dropout_rate': 0.5894158666714654, 'ccp_alpha': 0.11925055836552674}. Best is trial 367 with value: 0.7817487788378487.[0m
[32m[I 2022-04-14 04:11:10,200][0m Trial 416 finished with value: 0.36505789418585516 and parameters: {'loss': 'coxph', 'learning_rate': 1.7639132923315216e-05, 'n_estimators': 998, 'criterion': 'friedman_mse', 'min_samples_split': 9, 'min_samples_leaf': 2, 'min_weight_fraction_leaf': 0.37885006951090666, 'min_impurity_decrease': 0.2918044248242766, 'max_features': 0.89309204621799, 'subsample': 0.09878321488603121, 'dropout_rate': 0.547632888919726, 'ccp_alpha': 0.39824333910637044}. Best is trial 367 with value: 0.7817487788378487.[0m
[32m[I 2022-04-14 04:14:09,188][0m Trial 417 finished with value: 0.7781949569816364 and parameters: {'loss': 'coxph', 'learning_rate': 6.066644326653134e-06, 'n_estimators': 808, 'criterion': 'friedman_mse', 'min_samples_split': 9, 'min_samples_leaf': 2, 'min_weight_fraction_leaf': 0.3945307350108482, 'min_impurity_decrease': 0.31151510366907126, 'max_features': 0.8717363808686086, 'subsample': 0.16430135134138324, 'dropout_rate': 0.5726487744030851, 'ccp_alpha': 0.08057051082264013}. Best is trial 367 with value: 0.7817487788378487.[0m
[32m[I 2022-04-14 04:17:31,788][0m Trial 418 finished with value: 0.7791395027433333 and parameters: {'loss': 'coxph', 'learning_rate': 1.2001959160781498e-05, 'n_estimators': 896, 'criterion': 'friedman_mse', 'min_samples_split': 9, 'min_samples_leaf': 2, 'min_weight_fraction_leaf': 0.4086207230728276, 'min_impurity_decrease': 0.3339602091750523, 'max_features': 0.9490359510830645, 'subsample': 0.11797991455656606, 'dropout_rate': 0.6107867576501227, 'ccp_alpha': 0.0044684674070324185}. Best is trial 367 with value: 0.7817487788378487.[0m
[32m[I 2022-04-14 04:21:01,505][0m Trial 419 finished with value: 0.7785164195842134 and parameters: {'loss': 'coxph', 'learning_rate': 8.791142031630739e-06, 'n_estimators': 844, 'criterion': 'friedman_mse', 'min_samples_split': 9, 'min_samples_leaf': 2, 'min_weight_fraction_leaf': 0.370710792266967, 'min_impurity_decrease': 0.26934199196722225, 'max_features': 0.8989195947767012, 'subsample': 0.07177901781455037, 'dropout_rate': 0.5437955727636711, 'ccp_alpha': 0.17903082451464544}. Best is trial 367 with value: 0.7817487788378487.[0m
[32m[I 2022-04-14 04:24:49,606][0m Trial 420 finished with value: 0.779964995246401 and parameters: {'loss': 'coxph', 'learning_rate': 1.3701165219251195e-05, 'n_estimators': 953, 'criterion': 'friedman_mse', 'min_samples_split': 9, 'min_samples_leaf': 2, 'min_weight_fraction_leaf': 0.3832071188405452, 'min_impurity_decrease': 0.34786049742889563, 'max_features': 0.8434739930746921, 'subsample': 0.0903672491745812, 'dropout_rate': 0.6328735342290663, 'ccp_alpha': 0.09443504677933678}. Best is trial 367 with value: 0.7817487788378487.[0m
[32m[I 2022-04-14 04:28:10,393][0m Trial 421 finished with value: 0.6371812073302544 and parameters: {'loss': 'coxph', 'learning_rate': 6.014779359289165e-06, 'n_estimators': 882, 'criterion': 'friedman_mse', 'min_samples_split': 9, 'min_samples_leaf': 2, 'min_weight_fraction_leaf': 0.39249782684217005, 'min_impurity_decrease': 0.3183723279099422, 'max_features': 0.8692071000484815, 'subsample': 0.1395069083350611, 'dropout_rate': 0.5913618056712886, 'ccp_alpha': 0.25918344518954906}. Best is trial 367 with value: 0.7817487788378487.[0m
[32m[I 2022-04-14 04:32:13,692][0m Trial 422 finished with value: 0.7726626854858519 and parameters: {'loss': 'coxph', 'learning_rate': 1.0276067900815734e-05, 'n_estimators': 922, 'criterion': 'friedman_mse', 'min_samples_split': 9, 'min_samples_leaf': 2, 'min_weight_fraction_leaf': 0.3588263413107741, 'min_impurity_decrease': 0.29186198400392405, 'max_features': 0.916978508295681, 'subsample': 0.11339194772885701, 'dropout_rate': 0.569659747329567, 'ccp_alpha': 0.16895261990358784}. Best is trial 367 with value: 0.7817487788378487.[0m
[32m[I 2022-04-14 04:36:20,968][0m Trial 423 finished with value: 0.7801794982073156 and parameters: {'loss': 'coxph', 'learning_rate': 7.87988026282344e-06, 'n_estimators': 848, 'criterion': 'friedman_mse', 'min_samples_split': 9, 'min_samples_leaf': 2, 'min_weight_fraction_leaf': 0.3705278657895095, 'min_impurity_decrease': 0.24200065915328878, 'max_features': 0.8796983567490969, 'subsample': 0.08657267853328826, 'dropout_rate': 0.5499798918144762, 'ccp_alpha': 0.003351133455791449}. Best is trial 367 with value: 0.7817487788378487.[0m
[32m[I 2022-04-14 04:40:10,861][0m Trial 424 finished with value: 0.7804722592131585 and parameters: {'loss': 'coxph', 'learning_rate': 7.229130688722319e-06, 'n_estimators': 894, 'criterion': 'friedman_mse', 'min_samples_split': 9, 'min_samples_leaf': 2, 'min_weight_fraction_leaf': 0.3809963483883695, 'min_impurity_decrease': 0.3274113736007135, 'max_features': 0.8509595420539259, 'subsample': 0.06662429506076807, 'dropout_rate': 0.6052990330583127, 'ccp_alpha': 0.08844490735208474}. Best is trial 367 with value: 0.7817487788378487.[0m
[32m[I 2022-04-14 04:43:19,115][0m Trial 425 finished with value: 0.6371812073302544 and parameters: {'loss': 'coxph', 'learning_rate': 1.0332797001781263e-05, 'n_estimators': 802, 'criterion': 'friedman_mse', 'min_samples_split': 9, 'min_samples_leaf': 2, 'min_weight_fraction_leaf': 0.4005767739570902, 'min_impurity_decrease': 0.2958086500902148, 'max_features': 0.9299650424841699, 'subsample': 0.13209945694495434, 'dropout_rate': 0.5728630014304568, 'ccp_alpha': 0.2579019187468601}. Best is trial 367 with value: 0.7817487788378487.[0m
[32m[I 2022-04-14 04:47:33,194][0m Trial 426 finished with value: 0.7692087937132775 and parameters: {'loss': 'coxph', 'learning_rate': 1.3107146407522014e-05, 'n_estimators': 961, 'criterion': 'friedman_mse', 'min_samples_split': 9, 'min_samples_leaf': 2, 'min_weight_fraction_leaf': 0.37327859207539354, 'min_impurity_decrease': 0.2709682443107873, 'max_features': 0.8936404150242669, 'subsample': 0.10827783293559214, 'dropout_rate': 0.5919418523811469, 'ccp_alpha': 0.18878647454935168}. Best is trial 367 with value: 0.7817487788378487.[0m
[32m[I 2022-04-14 04:51:09,050][0m Trial 427 finished with value: 0.7805627849333943 and parameters: {'loss': 'coxph', 'learning_rate': 6.066003356840866e-06, 'n_estimators': 845, 'criterion': 'friedman_mse', 'min_samples_split': 9, 'min_samples_leaf': 2, 'min_weight_fraction_leaf': 0.3876616218810768, 'min_impurity_decrease': 0.3151995264317085, 'max_features': 0.8681821276531809, 'subsample': 0.09132069619929883, 'dropout_rate': 0.5454307279193492, 'ccp_alpha': 0.08735662154432594}. Best is trial 367 with value: 0.7817487788378487.[0m
[32m[I 2022-04-14 04:55:48,595][0m Trial 428 finished with value: 0.780145710044057 and parameters: {'loss': 'coxph', 'learning_rate': 8.694094763827099e-06, 'n_estimators': 1000, 'criterion': 'friedman_mse', 'min_samples_split': 9, 'min_samples_leaf': 2, 'min_weight_fraction_leaf': 0.36246378911101806, 'min_impurity_decrease': 0.3479950929321289, 'max_features': 0.9075397125868004, 'subsample': 0.16078261316126988, 'dropout_rate': 0.5727358895764493, 'ccp_alpha': 0.0020184446985560597}. Best is trial 367 with value: 0.7817487788378487.[0m
[32m[I 2022-04-14 04:58:31,505][0m Trial 429 finished with value: -0.3670415344320914 and parameters: {'loss': 'squared', 'learning_rate': 1.1289731454417912e-05, 'n_estimators': 921, 'criterion': 'friedman_mse', 'min_samples_split': 9, 'min_samples_leaf': 2, 'min_weight_fraction_leaf': 0.37659882868186134, 'min_impurity_decrease': 0.2855857896518143, 'max_features': 0.843546530581422, 'subsample': 0.12147002842820664, 'dropout_rate': 0.562514989866981, 'ccp_alpha': 0.0013547042203899962}. Best is trial 367 with value: 0.7817487788378487.[0m
[32m[I 2022-04-14 05:01:43,248][0m Trial 430 finished with value: 0.7798665857289525 and parameters: {'loss': 'coxph', 'learning_rate': 8.024333062396834e-06, 'n_estimators': 812, 'criterion': 'friedman_mse', 'min_samples_split': 9, 'min_samples_leaf': 2, 'min_weight_fraction_leaf': 0.39200546712776646, 'min_impurity_decrease': 0.315753039116992, 'max_features': 0.9513252928148604, 'subsample': 0.06875728844566234, 'dropout_rate': 0.6261010029595692, 'ccp_alpha': 0.14543261697718163}. Best is trial 367 with value: 0.7817487788378487.[0m
[32m[I 2022-04-14 05:05:30,182][0m Trial 431 finished with value: 0.7773455951460209 and parameters: {'loss': 'coxph', 'learning_rate': 2.1095355711293825e-05, 'n_estimators': 875, 'criterion': 'friedman_mse', 'min_samples_split': 9, 'min_samples_leaf': 2, 'min_weight_fraction_leaf': 0.3578339566399471, 'min_impurity_decrease': 0.34902138692630974, 'max_features': 0.8839200314978832, 'subsample': 0.01671313580184758, 'dropout_rate': 0.5887518809580704, 'ccp_alpha': 0.37213488208874523}. Best is trial 367 with value: 0.7817487788378487.[0m
[32m[I 2022-04-14 05:09:39,649][0m Trial 432 finished with value: 0.6371812073302544 and parameters: {'loss': 'coxph', 'learning_rate': 1.6831539647412404e-05, 'n_estimators': 927, 'criterion': 'friedman_mse', 'min_samples_split': 9, 'min_samples_leaf': 2, 'min_weight_fraction_leaf': 0.4089313134103243, 'min_impurity_decrease': 0.25459368307577623, 'max_features': 0.9204048817668358, 'subsample': 0.10071136676755713, 'dropout_rate': 0.5464191683814795, 'ccp_alpha': 0.2517819558094431}. Best is trial 367 with value: 0.7817487788378487.[0m
[32m[I 2022-04-14 05:13:20,347][0m Trial 433 finished with value: 0.7782066344501094 and parameters: {'loss': 'coxph', 'learning_rate': 5.6677995638896975e-06, 'n_estimators': 868, 'criterion': 'friedman_mse', 'min_samples_split': 9, 'min_samples_leaf': 2, 'min_weight_fraction_leaf': 0.3797248767290186, 'min_impurity_decrease': 0.33142333353062814, 'max_features': 0.8605978761776149, 'subsample': 0.1456132751025863, 'dropout_rate': 0.6032857657429571, 'ccp_alpha': 0.09528567837338614}. Best is trial 367 with value: 0.7817487788378487.[0m
[32m[I 2022-04-14 05:17:11,074][0m Trial 434 finished with value: 0.7808030821049572 and parameters: {'loss': 'coxph', 'learning_rate': 9.416631907749204e-06, 'n_estimators': 837, 'criterion': 'friedman_mse', 'min_samples_split': 9, 'min_samples_leaf': 2, 'min_weight_fraction_leaf': 0.37181737036767787, 'min_impurity_decrease': 0.3000883077729608, 'max_features': 0.8959574079157974, 'subsample': 0.0832714327812332, 'dropout_rate': 0.5662616577561432, 'ccp_alpha': 0.0017319795696841191}. Best is trial 367 with value: 0.7817487788378487.[0m
[32m[I 2022-04-14 05:20:30,402][0m Trial 435 finished with value: 0.7796115055901038 and parameters: {'loss': 'coxph', 'learning_rate': 6.624752922028082e-06, 'n_estimators': 804, 'criterion': 'friedman_mse', 'min_samples_split': 9, 'min_samples_leaf': 2, 'min_weight_fraction_leaf': 0.368782844255254, 'min_impurity_decrease': 0.2967030687033986, 'max_features': 0.8991839066904093, 'subsample': 0.06621083991456672, 'dropout_rate': 0.5436258466456295, 'ccp_alpha': 0.17070893554188218}. Best is trial 367 with value: 0.7817487788378487.[0m
[32m[I 2022-04-14 05:23:48,154][0m Trial 436 finished with value: 0.7800963047593971 and parameters: {'loss': 'coxph', 'learning_rate': 9.130821782595397e-06, 'n_estimators': 832, 'criterion': 'friedman_mse', 'min_samples_split': 9, 'min_samples_leaf': 2, 'min_weight_fraction_leaf': 0.368002912021959, 'min_impurity_decrease': 0.27882299419710416, 'max_features': 0.9385800383004579, 'subsample': 0.08114069090480855, 'dropout_rate': 0.5635551220524618, 'ccp_alpha': 0.09410239447027777}. Best is trial 367 with value: 0.7817487788378487.[0m
[32m[I 2022-04-14 05:27:48,980][0m Trial 437 finished with value: 0.6371812073302544 and parameters: {'loss': 'coxph', 'learning_rate': 7.392263046577416e-06, 'n_estimators': 956, 'criterion': 'friedman_mse', 'min_samples_split': 9, 'min_samples_leaf': 2, 'min_weight_fraction_leaf': 0.3829023410846835, 'min_impurity_decrease': 0.3032672226543608, 'max_features': 0.9107297153771667, 'subsample': 0.1008339500148964, 'dropout_rate': 0.587908262675945, 'ccp_alpha': 0.3187259783892594}. Best is trial 367 with value: 0.7817487788378487.[0m
[32m[I 2022-04-14 05:31:32,163][0m Trial 438 finished with value: 0.776555743657065 and parameters: {'loss': 'coxph', 'learning_rate': 1.12754539918571e-05, 'n_estimators': 904, 'criterion': 'friedman_mse', 'min_samples_split': 9, 'min_samples_leaf': 2, 'min_weight_fraction_leaf': 0.3587040539251458, 'min_impurity_decrease': 0.2641531502814905, 'max_features': 0.8913058379434233, 'subsample': 0.08121663850628859, 'dropout_rate': 0.6145643307858737, 'ccp_alpha': 0.1861516681345341}. Best is trial 367 with value: 0.7817487788378487.[0m
[32m[I 2022-04-14 05:35:03,062][0m Trial 439 finished with value: 0.7797427750321845 and parameters: {'loss': 'coxph', 'learning_rate': 5.677666721609046e-06, 'n_estimators': 841, 'criterion': 'friedman_mse', 'min_samples_split': 9, 'min_samples_leaf': 2, 'min_weight_fraction_leaf': 0.37261940554313494, 'min_impurity_decrease': 0.3171011310273513, 'max_features': 0.8400422642234616, 'subsample': 0.10755685354678127, 'dropout_rate': 0.5499412574389023, 'ccp_alpha': 0.08899782470190684}. Best is trial 367 with value: 0.7817487788378487.[0m
[32m[I 2022-04-14 05:38:16,647][0m Trial 440 finished with value: 0.7792998619696853 and parameters: {'loss': 'coxph', 'learning_rate': 9.53534590068792e-06, 'n_estimators': 799, 'criterion': 'friedman_mse', 'min_samples_split': 9, 'min_samples_leaf': 2, 'min_weight_fraction_leaf': 0.38777915111345024, 'min_impurity_decrease': 0.29207438934933255, 'max_features': 0.9283963255073968, 'subsample': 0.06588612555405425, 'dropout_rate': 0.5672165098262006, 'ccp_alpha': 0.17422602400642204}. Best is trial 367 with value: 0.7817487788378487.[0m
[32m[I 2022-04-14 05:42:51,916][0m Trial 441 finished with value: 0.7792384838549635 and parameters: {'loss': 'coxph', 'learning_rate': 7.510334372360897e-06, 'n_estimators': 923, 'criterion': 'friedman_mse', 'min_samples_split': 9, 'min_samples_leaf': 2, 'min_weight_fraction_leaf': 0.37651629670619474, 'min_impurity_decrease': 0.32601245320549815, 'max_features': 0.8655690206888504, 'subsample': 0.08813739562799065, 'dropout_rate': 0.4961042361702138, 'ccp_alpha': 0.08266891408563523}. Best is trial 367 with value: 0.7817487788378487.[0m
[32m[I 2022-04-14 05:46:14,559][0m Trial 442 finished with value: 0.7771919157481673 and parameters: {'loss': 'coxph', 'learning_rate': 9.226651983015505e-06, 'n_estimators': 861, 'criterion': 'friedman_mse', 'min_samples_split': 9, 'min_samples_leaf': 2, 'min_weight_fraction_leaf': 0.36069650078768933, 'min_impurity_decrease': 0.27944692576339675, 'max_features': 0.8918278656724513, 'subsample': 0.02173405240488481, 'dropout_rate': 0.6408626806956483, 'ccp_alpha': 0.2669931911448771}. Best is trial 367 with value: 0.7817487788378487.[0m
[32m[I 2022-04-14 05:50:32,403][0m Trial 443 finished with value: 0.7808616309230181 and parameters: {'loss': 'coxph', 'learning_rate': 5.951838935657236e-06, 'n_estimators': 960, 'criterion': 'friedman_mse', 'min_samples_split': 9, 'min_samples_leaf': 2, 'min_weight_fraction_leaf': 0.38589300599172394, 'min_impurity_decrease': 0.3068515154408546, 'max_features': 0.9130493152176319, 'subsample': 0.12318019732323078, 'dropout_rate': 0.5941525834609667, 'ccp_alpha': 0.0010731546157524141}. Best is trial 367 with value: 0.7817487788378487.[0m
[32m[I 2022-04-14 05:54:37,487][0m Trial 444 finished with value: 0.7768249096628999 and parameters: {'loss': 'coxph', 'learning_rate': 5.864765080082181e-06, 'n_estimators': 954, 'criterion': 'friedman_mse', 'min_samples_split': 9, 'min_samples_leaf': 2, 'min_weight_fraction_leaf': 0.3668289025131137, 'min_impurity_decrease': 0.30057634878948286, 'max_features': 0.8753795396063508, 'subsample': 0.1387210267747879, 'dropout_rate': 0.6083715760172396, 'ccp_alpha': 0.10936809346124311}. Best is trial 367 with value: 0.7817487788378487.[0m
[32m[I 2022-04-14 05:58:51,961][0m Trial 445 finished with value: 0.780558267577569 and parameters: {'loss': 'coxph', 'learning_rate': 6.630217598950327e-06, 'n_estimators': 994, 'criterion': 'friedman_mse', 'min_samples_split': 9, 'min_samples_leaf': 2, 'min_weight_fraction_leaf': 0.397147214403724, 'min_impurity_decrease': 0.2566402432299451, 'max_features': 0.9041478570775741, 'subsample': 0.1242999623367684, 'dropout_rate': 0.5880305181186006, 'ccp_alpha': 0.009632064601316447}. Best is trial 367 with value: 0.7817487788378487.[0m
[32m[I 2022-04-14 06:02:16,789][0m Trial 446 finished with value: 0.4829336714255586 and parameters: {'loss': 'coxph', 'learning_rate': 1.1612894055490999e-05, 'n_estimators': 955, 'criterion': 'friedman_mse', 'min_samples_split': 9, 'min_samples_leaf': 2, 'min_weight_fraction_leaf': 0.3556312404195696, 'min_impurity_decrease': 0.3306939483507723, 'max_features': 0.8488213641336979, 'subsample': 0.10690122990450614, 'dropout_rate': 0.6288756018015477, 'ccp_alpha': 0.3772307075375456}. Best is trial 367 with value: 0.7817487788378487.[0m
[32m[I 2022-04-14 06:04:32,222][0m Trial 447 finished with value: -0.36612500206003956 and parameters: {'loss': 'squared', 'learning_rate': 5.329495764252323e-06, 'n_estimators': 916, 'criterion': 'friedman_mse', 'min_samples_split': 9, 'min_samples_leaf': 2, 'min_weight_fraction_leaf': 0.38924577754957823, 'min_impurity_decrease': 0.23583834290837713, 'max_features': 0.8803632586988357, 'subsample': 0.15316923122338247, 'dropout_rate': 0.5863130042530194, 'ccp_alpha': 0.004433113384834465}. Best is trial 367 with value: 0.7817487788378487.[0m
[32m[I 2022-04-14 06:07:20,459][0m Trial 448 finished with value: 0.6371812073302544 and parameters: {'loss': 'coxph', 'learning_rate': 7.323875102461479e-06, 'n_estimators': 837, 'criterion': 'friedman_mse', 'min_samples_split': 9, 'min_samples_leaf': 2, 'min_weight_fraction_leaf': 0.3769295685562133, 'min_impurity_decrease': 0.2785201653858979, 'max_features': 0.9103337484511644, 'subsample': 0.12900648136301843, 'dropout_rate': 0.6069668035884825, 'ccp_alpha': 0.20072663958161094}. Best is trial 367 with value: 0.7817487788378487.[0m
[32m[I 2022-04-14 06:10:53,021][0m Trial 449 finished with value: 0.7791540977791509 and parameters: {'loss': 'coxph', 'learning_rate': 1.3646510436746525e-05, 'n_estimators': 909, 'criterion': 'friedman_mse', 'min_samples_split': 9, 'min_samples_leaf': 2, 'min_weight_fraction_leaf': 0.3697649929201973, 'min_impurity_decrease': 0.34521221688418885, 'max_features': 0.8620624627793352, 'subsample': 0.09592935138490509, 'dropout_rate': 0.5711573468760625, 'ccp_alpha': 0.11330931650108482}. Best is trial 367 with value: 0.7817487788378487.[0m
