[32m[I 2022-04-16 06:16:44,415][0m Trial 450 finished with value: 0.8822380562013444 and parameters: {'n_hidden': 1024, 'mixture_components': 10, 'use_sparse_layer': True, 'use_sparse_loss': False, 'use_batchnorm': False, 'use_dropout': True, 'dropout': 0.46866145452518815, 'mlp_size_1': 1, 'mlp_size_2': 3, 'mlp_size_3': 3, 'kernel': 'Weibull', 'loss_name': 'CensoredNLLLoss'}. Best is trial 422 with value: 0.8872774135438553.[0m
[32m[I 2022-04-16 06:19:28,342][0m Trial 451 finished with value: 0.882598957703056 and parameters: {'n_hidden': 1024, 'mixture_components': 9, 'use_sparse_layer': True, 'use_sparse_loss': False, 'use_batchnorm': False, 'use_dropout': True, 'dropout': 0.5440531661923699, 'mlp_size_1': 6, 'mlp_size_2': 1, 'mlp_size_3': 0, 'kernel': 'Weibull', 'loss_name': 'CensoredNLLLoss'}. Best is trial 422 with value: 0.8872774135438553.[0m
[32m[I 2022-04-16 06:22:06,000][0m Trial 452 finished with value: 0.7853877595407319 and parameters: {'n_hidden': 1024, 'mixture_components': 10, 'use_sparse_layer': True, 'use_sparse_loss': False, 'use_batchnorm': False, 'use_dropout': True, 'dropout': 0.6217063221585974, 'mlp_size_1': 0, 'mlp_size_2': 3, 'mlp_size_3': 1, 'kernel': 'Weibull', 'loss_name': 'CensoredNLLLoss'}. Best is trial 422 with value: 0.8872774135438553.[0m
[32m[I 2022-04-16 06:24:16,709][0m Trial 453 finished with value: 0.8852275920416378 and parameters: {'n_hidden': 1024, 'mixture_components': 10, 'use_sparse_layer': True, 'use_sparse_loss': False, 'use_batchnorm': False, 'use_dropout': True, 'dropout': 0.7061033905607903, 'mlp_size_1': 2, 'mlp_size_2': 4, 'mlp_size_3': 1, 'kernel': 'Gamma', 'loss_name': 'CensoredNLLLoss'}. Best is trial 422 with value: 0.8872774135438553.[0m
[32m[I 2022-04-16 06:26:49,422][0m Trial 454 finished with value: 0.8829193652759502 and parameters: {'n_hidden': 1024, 'mixture_components': 7, 'use_sparse_layer': True, 'use_sparse_loss': False, 'use_batchnorm': False, 'use_dropout': True, 'dropout': 0.5824638747892243, 'mlp_size_1': 2, 'mlp_size_2': 4, 'mlp_size_3': 1, 'kernel': 'Weibull', 'loss_name': 'CensoredNLLLoss'}. Best is trial 422 with value: 0.8872774135438553.[0m
[32m[I 2022-04-16 06:29:17,263][0m Trial 455 finished with value: 0.8835834556675767 and parameters: {'n_hidden': 1024, 'mixture_components': 8, 'use_sparse_layer': True, 'use_sparse_loss': False, 'use_batchnorm': False, 'use_dropout': True, 'dropout': 0.6083841942708037, 'mlp_size_1': 1, 'mlp_size_2': 3, 'mlp_size_3': 1, 'kernel': 'Weibull', 'loss_name': 'CensoredNLLLoss'}. Best is trial 422 with value: 0.8872774135438553.[0m
[32m[I 2022-04-16 06:31:37,067][0m Trial 456 finished with value: 0.882373072280286 and parameters: {'n_hidden': 128, 'mixture_components': 2, 'use_sparse_layer': True, 'use_sparse_loss': False, 'use_batchnorm': False, 'use_dropout': True, 'dropout': 0.562022764298944, 'mlp_size_1': 2, 'mlp_size_2': 2, 'mlp_size_3': 0, 'kernel': 'Weibull', 'loss_name': 'CensoredNLLLoss'}. Best is trial 422 with value: 0.8872774135438553.[0m
[32m[I 2022-04-16 06:33:29,208][0m Trial 457 finished with value: 0.44851255574216625 and parameters: {'n_hidden': 1024, 'mixture_components': 9, 'use_sparse_layer': True, 'use_sparse_loss': False, 'use_batchnorm': False, 'use_dropout': True, 'dropout': 0.5784972958234255, 'mlp_size_1': 2, 'mlp_size_2': 4, 'mlp_size_3': 1, 'kernel': 'Gumbel', 'loss_name': 'CensoredNLLLoss'}. Best is trial 422 with value: 0.8872774135438553.[0m
[32m[I 2022-04-16 06:35:37,670][0m Trial 458 finished with value: 0.8829356070621965 and parameters: {'n_hidden': 256, 'mixture_components': 10, 'use_sparse_layer': True, 'use_sparse_loss': False, 'use_batchnorm': False, 'use_dropout': True, 'dropout': 0.40661844435473016, 'mlp_size_1': 2, 'mlp_size_2': 3, 'mlp_size_3': 0, 'kernel': 'Weibull', 'loss_name': 'CensoredNLLLoss'}. Best is trial 422 with value: 0.8872774135438553.[0m
[32m[I 2022-04-16 06:37:54,877][0m Trial 459 finished with value: 0.8786457124963946 and parameters: {'n_hidden': 1024, 'mixture_components': 10, 'use_sparse_layer': True, 'use_sparse_loss': False, 'use_batchnorm': False, 'use_dropout': True, 'dropout': 0.28559837899993, 'mlp_size_1': 1, 'mlp_size_2': 3, 'mlp_size_3': 1, 'kernel': 'Weibull', 'loss_name': 'CensoredNLLLoss'}. Best is trial 422 with value: 0.8872774135438553.[0m
[32m[I 2022-04-16 06:40:15,422][0m Trial 460 finished with value: 0.8832729869732987 and parameters: {'n_hidden': 1024, 'mixture_components': 10, 'use_sparse_layer': False, 'use_batchnorm': False, 'use_dropout': True, 'dropout': 0.48393400963807764, 'mlp_size_1': 2, 'mlp_size_2': 4, 'mlp_size_3': 1, 'kernel': 'Weibull', 'loss_name': 'CensoredNLLLoss'}. Best is trial 422 with value: 0.8872774135438553.[0m
/media/san2_ssd/data/Workdir/survival/utils.py:305: RuntimeWarning: invalid value encountered in true_divide
  pdfs = np.gradient(1-survs,axis=1)/norms
[32m[I 2022-04-16 06:43:16,636][0m Trial 461 finished with value: 0.5855870364146523 and parameters: {'n_hidden': 1024, 'mixture_components': 9, 'use_sparse_layer': True, 'use_sparse_loss': False, 'use_batchnorm': False, 'use_dropout': True, 'dropout': 0.6331680665853906, 'mlp_size_1': 1, 'mlp_size_2': 3, 'mlp_size_3': 1, 'kernel': 'Normal', 'loss_name': 'CensoredNLLLoss'}. Best is trial 422 with value: 0.8872774135438553.[0m
[32m[I 2022-04-16 06:45:39,528][0m Trial 462 finished with value: 0.8803501654413045 and parameters: {'n_hidden': 512, 'mixture_components': 10, 'use_sparse_layer': True, 'use_sparse_loss': False, 'use_batchnorm': False, 'use_dropout': True, 'dropout': 0.5474007738437161, 'mlp_size_1': 2, 'mlp_size_2': 4, 'mlp_size_3': 0, 'kernel': 'Weibull', 'loss_name': 'AlternativeNLLLoss'}. Best is trial 422 with value: 0.8872774135438553.[0m
[32m[I 2022-04-16 06:48:47,069][0m Trial 463 finished with value: 0.8832036516364891 and parameters: {'n_hidden': 64, 'mixture_components': 10, 'use_sparse_layer': True, 'use_sparse_loss': False, 'use_batchnorm': False, 'use_dropout': True, 'dropout': 0.5960813361190311, 'mlp_size_1': 2, 'mlp_size_2': 1, 'mlp_size_3': 0, 'kernel': 'Weibull', 'loss_name': 'CensoredNLLLoss'}. Best is trial 422 with value: 0.8872774135438553.[0m
[32m[I 2022-04-16 06:52:07,915][0m Trial 464 finished with value: 0.8839285897551328 and parameters: {'n_hidden': 2048, 'mixture_components': 9, 'use_sparse_layer': True, 'use_sparse_loss': False, 'use_batchnorm': False, 'use_dropout': True, 'dropout': 0.5029173244032396, 'mlp_size_1': 0, 'mlp_size_2': 5, 'mlp_size_3': 3, 'kernel': 'Logistic', 'loss_name': 'CensoredNLLLoss'}. Best is trial 422 with value: 0.8872774135438553.[0m
[32m[I 2022-04-16 06:54:17,026][0m Trial 465 finished with value: 0.8826995725084954 and parameters: {'n_hidden': 1024, 'mixture_components': 10, 'use_sparse_layer': True, 'use_sparse_loss': False, 'use_batchnorm': False, 'use_dropout': True, 'dropout': 0.3441087417503434, 'mlp_size_1': 1, 'mlp_size_2': 3, 'mlp_size_3': 1, 'kernel': 'Weibull', 'loss_name': 'CensoredNLLLoss'}. Best is trial 422 with value: 0.8872774135438553.[0m
[32m[I 2022-04-16 06:58:21,711][0m Trial 466 finished with value: 0.8849468772259076 and parameters: {'n_hidden': 1024, 'mixture_components': 10, 'use_sparse_layer': True, 'use_sparse_loss': False, 'use_batchnorm': True, 'use_dropout': True, 'dropout': 0.5331413469535556, 'mlp_size_1': 2, 'mlp_size_2': 4, 'mlp_size_3': 1, 'kernel': 'Weibull', 'loss_name': 'CensoredNLLLoss'}. Best is trial 422 with value: 0.8872774135438553.[0m
[32m[I 2022-04-16 07:01:08,458][0m Trial 467 finished with value: 0.8844270140839123 and parameters: {'n_hidden': 1024, 'mixture_components': 9, 'use_sparse_layer': True, 'use_sparse_loss': False, 'use_batchnorm': False, 'use_dropout': True, 'dropout': 0.5653050378006204, 'mlp_size_1': 2, 'mlp_size_2': 4, 'mlp_size_3': 1, 'kernel': 'Weibull', 'loss_name': 'CensoredNLLLoss'}. Best is trial 422 with value: 0.8872774135438553.[0m
[32m[I 2022-04-16 07:03:35,691][0m Trial 468 finished with value: 0.8576604174795819 and parameters: {'n_hidden': 1024, 'mixture_components': 10, 'use_sparse_layer': True, 'use_sparse_loss': False, 'use_batchnorm': False, 'use_dropout': True, 'dropout': 0.3186528159569377, 'mlp_size_1': 2, 'mlp_size_2': 4, 'mlp_size_3': 1, 'kernel': 'LogNormal', 'loss_name': 'NLLLoss'}. Best is trial 422 with value: 0.8872774135438553.[0m
[32m[I 2022-04-16 07:05:44,821][0m Trial 469 finished with value: 0.8829338272754645 and parameters: {'n_hidden': 1024, 'mixture_components': 9, 'use_sparse_layer': True, 'use_sparse_loss': False, 'use_batchnorm': False, 'use_dropout': False, 'mlp_size_1': 4, 'mlp_size_2': 3, 'mlp_size_3': 0, 'kernel': 'Weibull', 'loss_name': 'CensoredNLLLoss'}. Best is trial 422 with value: 0.8872774135438553.[0m
[32m[I 2022-04-16 07:08:30,882][0m Trial 470 finished with value: 0.7855667475498354 and parameters: {'n_hidden': 1024, 'mixture_components': 8, 'use_sparse_layer': True, 'use_sparse_loss': False, 'use_batchnorm': False, 'use_dropout': True, 'dropout': 0.6057044730718728, 'mlp_size_1': 2, 'mlp_size_2': 4, 'mlp_size_3': 1, 'kernel': 'Weibull', 'loss_name': 'CensoredNLLLoss'}. Best is trial 422 with value: 0.8872774135438553.[0m
[32m[I 2022-04-16 07:10:59,206][0m Trial 471 finished with value: 0.8836114657365794 and parameters: {'n_hidden': 1024, 'mixture_components': 10, 'use_sparse_layer': False, 'use_batchnorm': False, 'use_dropout': True, 'dropout': 0.467171833157415, 'mlp_size_1': 1, 'mlp_size_2': 3, 'mlp_size_3': 1, 'kernel': 'Weibull', 'loss_name': 'CensoredNLLLoss'}. Best is trial 422 with value: 0.8872774135438553.[0m
[32m[I 2022-04-16 07:13:08,738][0m Trial 472 finished with value: 0.8841969422300495 and parameters: {'n_hidden': 1024, 'mixture_components': 10, 'use_sparse_layer': True, 'use_sparse_loss': False, 'use_batchnorm': False, 'use_dropout': True, 'dropout': 0.48762969320565713, 'mlp_size_1': 2, 'mlp_size_2': 4, 'mlp_size_3': 1, 'kernel': 'Exponential', 'loss_name': 'CensoredNLLLoss'}. Best is trial 422 with value: 0.8872774135438553.[0m
[32m[I 2022-04-16 07:15:45,725][0m Trial 473 finished with value: 0.884539065299669 and parameters: {'n_hidden': 1024, 'mixture_components': 10, 'use_sparse_layer': True, 'use_sparse_loss': False, 'use_batchnorm': False, 'use_dropout': True, 'dropout': 0.3903154159096745, 'mlp_size_1': 2, 'mlp_size_2': 4, 'mlp_size_3': 1, 'kernel': 'Weibull', 'loss_name': 'CensoredNLLLoss'}. Best is trial 422 with value: 0.8872774135438553.[0m
[32m[I 2022-04-16 07:18:09,092][0m Trial 474 finished with value: 0.887294062722078 and parameters: {'n_hidden': 256, 'mixture_components': 9, 'use_sparse_layer': True, 'use_sparse_loss': False, 'use_batchnorm': False, 'use_dropout': True, 'dropout': 0.5841383519767985, 'mlp_size_1': 2, 'mlp_size_2': 3, 'mlp_size_3': 0, 'kernel': 'Weibull', 'loss_name': 'CensoredNLLLoss'}. Best is trial 474 with value: 0.887294062722078.[0m
[32m[I 2022-04-16 07:20:39,428][0m Trial 475 finished with value: 0.8770307947436546 and parameters: {'n_hidden': 256, 'mixture_components': 9, 'use_sparse_layer': True, 'use_sparse_loss': False, 'use_batchnorm': False, 'use_dropout': True, 'dropout': 0.5222272659597369, 'mlp_size_1': 2, 'mlp_size_2': 3, 'mlp_size_3': 0, 'kernel': 'Weibull', 'loss_name': 'CensoredNLLLoss'}. Best is trial 474 with value: 0.887294062722078.[0m
[32m[I 2022-04-16 07:22:49,908][0m Trial 476 finished with value: 0.8820060911591856 and parameters: {'n_hidden': 256, 'mixture_components': 9, 'use_sparse_layer': True, 'use_sparse_loss': False, 'use_batchnorm': False, 'use_dropout': True, 'dropout': 0.5558343217226429, 'mlp_size_1': 2, 'mlp_size_2': 3, 'mlp_size_3': 0, 'kernel': 'Weibull', 'loss_name': 'AlternativeNLLLoss'}. Best is trial 474 with value: 0.887294062722078.[0m
[32m[I 2022-04-16 07:25:02,192][0m Trial 477 finished with value: 0.8856089359213317 and parameters: {'n_hidden': 256, 'mixture_components': 9, 'use_sparse_layer': True, 'use_sparse_loss': False, 'use_batchnorm': False, 'use_dropout': True, 'dropout': 0.5791165704909765, 'mlp_size_1': 2, 'mlp_size_2': 3, 'mlp_size_3': 0, 'kernel': 'Weibull', 'loss_name': 'CensoredNLLLoss'}. Best is trial 474 with value: 0.887294062722078.[0m
[32m[I 2022-04-16 07:27:11,899][0m Trial 478 finished with value: 0.8863852749798067 and parameters: {'n_hidden': 256, 'mixture_components': 9, 'use_sparse_layer': True, 'use_sparse_loss': False, 'use_batchnorm': False, 'use_dropout': True, 'dropout': 0.5419596614852189, 'mlp_size_1': 2, 'mlp_size_2': 3, 'mlp_size_3': 0, 'kernel': 'Weibull', 'loss_name': 'CensoredNLLLoss'}. Best is trial 474 with value: 0.887294062722078.[0m
[32m[I 2022-04-16 07:29:17,529][0m Trial 479 finished with value: 0.8845489528354573 and parameters: {'n_hidden': 256, 'mixture_components': 9, 'use_sparse_layer': True, 'use_sparse_loss': False, 'use_batchnorm': False, 'use_dropout': True, 'dropout': 0.5309812568468977, 'mlp_size_1': 2, 'mlp_size_2': 3, 'mlp_size_3': 0, 'kernel': 'Weibull', 'loss_name': 'CensoredNLLLoss'}. Best is trial 474 with value: 0.887294062722078.[0m
[32m[I 2022-04-16 07:31:18,743][0m Trial 480 finished with value: 0.7864427685905557 and parameters: {'n_hidden': 256, 'mixture_components': 9, 'use_sparse_layer': True, 'use_sparse_loss': False, 'use_batchnorm': False, 'use_dropout': True, 'dropout': 0.5162126637932895, 'mlp_size_1': 2, 'mlp_size_2': 3, 'mlp_size_3': 0, 'kernel': 'Logistic', 'loss_name': 'CensoredNLLLoss'}. Best is trial 474 with value: 0.887294062722078.[0m
[32m[I 2022-04-16 07:33:37,457][0m Trial 481 finished with value: 0.8849243782281038 and parameters: {'n_hidden': 256, 'mixture_components': 9, 'use_sparse_layer': True, 'use_sparse_loss': False, 'use_batchnorm': False, 'use_dropout': True, 'dropout': 0.49454714619529005, 'mlp_size_1': 2, 'mlp_size_2': 3, 'mlp_size_3': 0, 'kernel': 'Weibull', 'loss_name': 'CensoredNLLLoss'}. Best is trial 474 with value: 0.887294062722078.[0m
[32m[I 2022-04-16 07:36:04,512][0m Trial 482 finished with value: 0.8801428678482669 and parameters: {'n_hidden': 128, 'mixture_components': 9, 'use_sparse_layer': True, 'use_sparse_loss': False, 'use_batchnorm': False, 'use_dropout': True, 'dropout': 0.5467919567635589, 'mlp_size_1': 2, 'mlp_size_2': 2, 'mlp_size_3': 0, 'kernel': 'Weibull', 'loss_name': 'CensoredNLLLoss'}. Best is trial 474 with value: 0.887294062722078.[0m
[32m[I 2022-04-16 07:38:12,985][0m Trial 483 finished with value: 0.8857373060219589 and parameters: {'n_hidden': 256, 'mixture_components': 9, 'use_sparse_layer': True, 'use_sparse_loss': False, 'use_batchnorm': False, 'use_dropout': True, 'dropout': 0.5436862744872355, 'mlp_size_1': 2, 'mlp_size_2': 3, 'mlp_size_3': 0, 'kernel': 'Gamma', 'loss_name': 'CensoredNLLLoss'}. Best is trial 474 with value: 0.887294062722078.[0m
[32m[I 2022-04-16 07:40:26,796][0m Trial 484 finished with value: 0.8824826339702705 and parameters: {'n_hidden': 256, 'mixture_components': 8, 'use_sparse_layer': True, 'use_sparse_loss': False, 'use_batchnorm': False, 'use_dropout': True, 'dropout': 0.4248634535297358, 'mlp_size_1': 2, 'mlp_size_2': 3, 'mlp_size_3': 0, 'kernel': 'Weibull', 'loss_name': 'CensoredNLLLoss'}. Best is trial 474 with value: 0.887294062722078.[0m
[32m[I 2022-04-16 07:42:46,905][0m Trial 485 finished with value: 0.8847107065440089 and parameters: {'n_hidden': 256, 'mixture_components': 5, 'use_sparse_layer': True, 'use_sparse_loss': False, 'use_batchnorm': False, 'use_dropout': True, 'dropout': 0.3648744857050535, 'mlp_size_1': 2, 'mlp_size_2': 3, 'mlp_size_3': 0, 'kernel': 'Weibull', 'loss_name': 'CensoredNLLLoss'}. Best is trial 474 with value: 0.887294062722078.[0m
[32m[I 2022-04-16 07:45:25,839][0m Trial 486 finished with value: 0.8829142510035688 and parameters: {'n_hidden': 256, 'mixture_components': 9, 'use_sparse_layer': True, 'use_sparse_loss': False, 'use_batchnorm': False, 'use_dropout': True, 'dropout': 0.7588564325669221, 'mlp_size_1': 2, 'mlp_size_2': 3, 'mlp_size_3': 0, 'kernel': 'Weibull', 'loss_name': 'CensoredNLLLoss'}. Best is trial 474 with value: 0.887294062722078.[0m
[32m[I 2022-04-16 07:47:05,709][0m Trial 487 finished with value: 0.8234922886907464 and parameters: {'n_hidden': 256, 'mixture_components': 9, 'use_sparse_layer': True, 'use_sparse_loss': False, 'use_batchnorm': False, 'use_dropout': True, 'dropout': 0.5090616626993238, 'mlp_size_1': 2, 'mlp_size_2': 3, 'mlp_size_3': 0, 'kernel': 'Gumbel', 'loss_name': 'CensoredNLLLoss'}. Best is trial 474 with value: 0.887294062722078.[0m
[32m[I 2022-04-16 07:51:28,468][0m Trial 488 finished with value: 0.6720527007569659 and parameters: {'n_hidden': 256, 'mixture_components': 9, 'use_sparse_layer': True, 'use_sparse_loss': False, 'use_batchnorm': True, 'use_dropout': False, 'mlp_size_1': 2, 'mlp_size_2': 3, 'mlp_size_3': 0, 'kernel': 'Weibull', 'loss_name': 'AlternativeNLLLoss'}. Best is trial 474 with value: 0.887294062722078.[0m
[32m[I 2022-04-16 07:53:55,783][0m Trial 489 finished with value: 0.8819335038753493 and parameters: {'n_hidden': 256, 'mixture_components': 6, 'use_sparse_layer': True, 'use_sparse_loss': False, 'use_batchnorm': False, 'use_dropout': True, 'dropout': 0.5662686781180877, 'mlp_size_1': 1, 'mlp_size_2': 4, 'mlp_size_3': 0, 'kernel': 'Weibull', 'loss_name': 'CensoredNLLLoss'}. Best is trial 474 with value: 0.887294062722078.[0m
[32m[I 2022-04-16 07:56:26,421][0m Trial 490 finished with value: 0.8872084971249306 and parameters: {'n_hidden': 256, 'mixture_components': 10, 'use_sparse_layer': True, 'use_sparse_loss': False, 'use_batchnorm': False, 'use_dropout': True, 'dropout': 0.5309506216747737, 'mlp_size_1': 2, 'mlp_size_2': 3, 'mlp_size_3': 0, 'kernel': 'Weibull', 'loss_name': 'CensoredNLLLoss'}. Best is trial 474 with value: 0.887294062722078.[0m
[32m[I 2022-04-16 07:58:58,792][0m Trial 491 finished with value: 0.8859571999867473 and parameters: {'n_hidden': 256, 'mixture_components': 10, 'use_sparse_layer': True, 'use_sparse_loss': False, 'use_batchnorm': False, 'use_dropout': True, 'dropout': 0.4650866438882025, 'mlp_size_1': 2, 'mlp_size_2': 3, 'mlp_size_3': 0, 'kernel': 'Weibull', 'loss_name': 'CensoredNLLLoss'}. Best is trial 474 with value: 0.887294062722078.[0m
[32m[I 2022-04-16 08:00:58,843][0m Trial 492 finished with value: 0.7551891022849041 and parameters: {'n_hidden': 256, 'mixture_components': 9, 'use_sparse_layer': True, 'use_sparse_loss': False, 'use_batchnorm': False, 'use_dropout': True, 'dropout': 0.5184058605522284, 'mlp_size_1': 2, 'mlp_size_2': 3, 'mlp_size_3': 0, 'kernel': 'Weibull', 'loss_name': 'NLLLoss'}. Best is trial 474 with value: 0.887294062722078.[0m
[32m[I 2022-04-16 08:03:45,846][0m Trial 493 finished with value: 0.780658464017432 and parameters: {'n_hidden': 256, 'mixture_components': 8, 'use_sparse_layer': True, 'use_sparse_loss': False, 'use_batchnorm': False, 'use_dropout': True, 'dropout': 0.49640516332226364, 'mlp_size_1': 1, 'mlp_size_2': 4, 'mlp_size_3': 0, 'kernel': 'Normal', 'loss_name': 'CensoredNLLLoss'}. Best is trial 474 with value: 0.887294062722078.[0m
[32m[I 2022-04-16 08:06:07,400][0m Trial 494 finished with value: 0.8813856241940664 and parameters: {'n_hidden': 256, 'mixture_components': 10, 'use_sparse_layer': True, 'use_sparse_loss': False, 'use_batchnorm': False, 'use_dropout': True, 'dropout': 0.5303085929618878, 'mlp_size_1': 2, 'mlp_size_2': 3, 'mlp_size_3': 0, 'kernel': 'Weibull', 'loss_name': 'CensoredNLLLoss'}. Best is trial 474 with value: 0.887294062722078.[0m
[32m[I 2022-04-16 08:08:26,792][0m Trial 495 finished with value: 0.8848301658101996 and parameters: {'n_hidden': 256, 'mixture_components': 9, 'use_sparse_layer': True, 'use_sparse_loss': False, 'use_batchnorm': False, 'use_dropout': True, 'dropout': 0.489075235136612, 'mlp_size_1': 2, 'mlp_size_2': 3, 'mlp_size_3': 0, 'kernel': 'Weibull', 'loss_name': 'CensoredNLLLoss'}. Best is trial 474 with value: 0.887294062722078.[0m
[32m[I 2022-04-16 08:11:20,596][0m Trial 496 finished with value: 0.8822131398544875 and parameters: {'n_hidden': 256, 'mixture_components': 10, 'use_sparse_layer': True, 'use_sparse_loss': False, 'use_batchnorm': False, 'use_dropout': True, 'dropout': 0.5421541253410234, 'mlp_size_1': 1, 'mlp_size_2': 4, 'mlp_size_3': 0, 'kernel': 'Weibull', 'loss_name': 'CensoredNLLLoss'}. Best is trial 474 with value: 0.887294062722078.[0m
[32m[I 2022-04-16 08:14:16,030][0m Trial 497 finished with value: 0.7808038171464775 and parameters: {'n_hidden': 256, 'mixture_components': 10, 'use_sparse_layer': True, 'use_sparse_loss': False, 'use_batchnorm': False, 'use_dropout': True, 'dropout': 0.5222459227969793, 'mlp_size_1': 2, 'mlp_size_2': 3, 'mlp_size_3': 0, 'kernel': 'LogNormal', 'loss_name': 'CensoredNLLLoss'}. Best is trial 474 with value: 0.887294062722078.[0m
[32m[I 2022-04-16 08:16:29,165][0m Trial 498 finished with value: 0.7835407093034171 and parameters: {'n_hidden': 256, 'mixture_components': 8, 'use_sparse_layer': True, 'use_sparse_loss': False, 'use_batchnorm': False, 'use_dropout': True, 'dropout': 0.4666288695494597, 'mlp_size_1': 2, 'mlp_size_2': 3, 'mlp_size_3': 0, 'kernel': 'Logistic', 'loss_name': 'CensoredNLLLoss'}. Best is trial 474 with value: 0.887294062722078.[0m
[32m[I 2022-04-16 08:19:15,055][0m Trial 499 finished with value: 0.8817910814874761 and parameters: {'n_hidden': 256, 'mixture_components': 10, 'use_sparse_layer': True, 'use_sparse_loss': False, 'use_batchnorm': False, 'use_dropout': True, 'dropout': 0.5542731529151784, 'mlp_size_1': 1, 'mlp_size_2': 4, 'mlp_size_3': 0, 'kernel': 'Weibull', 'loss_name': 'CensoredNLLLoss'}. Best is trial 474 with value: 0.887294062722078.[0m
