[32m[I 2022-04-15 12:44:56,492][0m Trial 855 finished with value: 0.7781794452880756 and parameters: {'loss': 'coxph', 'learning_rate': 0.0049138871711953925, 'n_estimators': 632, 'criterion': 'friedman_mse', 'min_samples_split': 7, 'min_samples_leaf': 2, 'min_weight_fraction_leaf': 0.06917707538970348, 'min_impurity_decrease': 0.48118623266244454, 'max_features': 0.7547712480758104, 'subsample': 0.744923371042125, 'dropout_rate': 0.6214056123783108, 'ccp_alpha': 0.0015625736118672613}. Best is trial 712 with value: 0.7824105962295036.[0m
[32m[I 2022-04-15 12:46:19,386][0m Trial 856 finished with value: 0.5 and parameters: {'loss': 'coxph', 'learning_rate': 0.005055762583833604, 'n_estimators': 646, 'criterion': 'friedman_mse', 'min_samples_split': 7, 'min_samples_leaf': 2, 'min_weight_fraction_leaf': 0.06435379261507942, 'min_impurity_decrease': 0.5043596473666171, 'max_features': 0.7470321099505025, 'subsample': 0.734817404635271, 'dropout_rate': 0.6291933835291921, 'ccp_alpha': 2.295903170579139}. Best is trial 712 with value: 0.7824105962295036.[0m
[32m[I 2022-04-15 12:47:43,720][0m Trial 857 finished with value: 0.7781477006715566 and parameters: {'loss': 'coxph', 'learning_rate': 0.005063331483184736, 'n_estimators': 632, 'criterion': 'friedman_mse', 'min_samples_split': 7, 'min_samples_leaf': 2, 'min_weight_fraction_leaf': 0.05613732631672223, 'min_impurity_decrease': 0.49105140986546875, 'max_features': 0.7505251910607664, 'subsample': 0.715434835788513, 'dropout_rate': 0.7239964843932061, 'ccp_alpha': 0.0022753948970585264}. Best is trial 712 with value: 0.7824105962295036.[0m
[32m[I 2022-04-15 12:48:56,937][0m Trial 858 finished with value: 0.5 and parameters: {'loss': 'coxph', 'learning_rate': 0.0007402734546969088, 'n_estimators': 654, 'criterion': 'friedman_mse', 'min_samples_split': 7, 'min_samples_leaf': 2, 'min_weight_fraction_leaf': 0.042260721145983116, 'min_impurity_decrease': 0.47713820968571186, 'max_features': 0.7502988713070624, 'subsample': 0.7469361933715094, 'dropout_rate': 0.72817020790357, 'ccp_alpha': 0.3249292600695438}. Best is trial 712 with value: 0.7824105962295036.[0m
[32m[I 2022-04-15 12:50:16,425][0m Trial 859 finished with value: 0.6743624146605087 and parameters: {'loss': 'coxph', 'learning_rate': 0.00550871165642939, 'n_estimators': 714, 'criterion': 'friedman_mse', 'min_samples_split': 7, 'min_samples_leaf': 2, 'min_weight_fraction_leaf': 0.05422781691322211, 'min_impurity_decrease': 0.5119509295628984, 'max_features': 0.7534214584923608, 'subsample': 0.7099383287281832, 'dropout_rate': 0.7478820489959463, 'ccp_alpha': 0.16719290746324633}. Best is trial 712 with value: 0.7824105962295036.[0m
[32m[I 2022-04-15 12:51:41,489][0m Trial 860 finished with value: 0.7284320914543984 and parameters: {'loss': 'coxph', 'learning_rate': 0.0052843824655399545, 'n_estimators': 697, 'criterion': 'friedman_mse', 'min_samples_split': 7, 'min_samples_leaf': 2, 'min_weight_fraction_leaf': 0.04637919902630851, 'min_impurity_decrease': 0.2261841391537939, 'max_features': 0.7404544940914546, 'subsample': 0.7420877416318945, 'dropout_rate': 0.6835816214980731, 'ccp_alpha': 0.09456634672308799}. Best is trial 712 with value: 0.7824105962295036.[0m
[32m[I 2022-04-15 12:52:51,815][0m Trial 861 finished with value: 0.7781344467666428 and parameters: {'loss': 'coxph', 'learning_rate': 0.00419673712090815, 'n_estimators': 631, 'criterion': 'friedman_mse', 'min_samples_split': 7, 'min_samples_leaf': 2, 'min_weight_fraction_leaf': 0.06196312480807799, 'min_impurity_decrease': 0.4854495555662903, 'max_features': 0.7643863702763464, 'subsample': 0.7266239690042299, 'dropout_rate': 0.7605408183449033, 'ccp_alpha': 0.0026493776494997748}. Best is trial 712 with value: 0.7824105962295036.[0m
[32m[I 2022-04-15 12:53:57,252][0m Trial 862 finished with value: 0.5 and parameters: {'loss': 'coxph', 'learning_rate': 0.004315084646242944, 'n_estimators': 659, 'criterion': 'friedman_mse', 'min_samples_split': 7, 'min_samples_leaf': 2, 'min_weight_fraction_leaf': 0.05777561206445953, 'min_impurity_decrease': 0.48540230939542545, 'max_features': 0.27108326713064124, 'subsample': 0.7306053722819061, 'dropout_rate': 0.7801085766860508, 'ccp_alpha': 0.23002842802116444}. Best is trial 712 with value: 0.7824105962295036.[0m
[32m[I 2022-04-15 12:55:20,059][0m Trial 863 finished with value: 0.7771922828529304 and parameters: {'loss': 'coxph', 'learning_rate': 0.005209900943761475, 'n_estimators': 681, 'criterion': 'friedman_mse', 'min_samples_split': 7, 'min_samples_leaf': 2, 'min_weight_fraction_leaf': 0.04271773005251328, 'min_impurity_decrease': 0.5103191304774313, 'max_features': 0.7340587068846529, 'subsample': 0.7163349024529488, 'dropout_rate': 0.7609015312349232, 'ccp_alpha': 0.0013568155807130934}. Best is trial 712 with value: 0.7824105962295036.[0m
[32m[I 2022-04-15 12:56:44,737][0m Trial 864 finished with value: 0.5 and parameters: {'loss': 'coxph', 'learning_rate': 0.005591452414637414, 'n_estimators': 682, 'criterion': 'squared_error', 'min_samples_split': 7, 'min_samples_leaf': 2, 'min_weight_fraction_leaf': 0.04104951404611867, 'min_impurity_decrease': 0.5065027015222708, 'max_features': 0.7549008698133545, 'subsample': 0.7093330029427001, 'dropout_rate': 0.7215367226764992, 'ccp_alpha': 0.15407687979258355}. Best is trial 712 with value: 0.7824105962295036.[0m
[32m[I 2022-04-15 12:58:02,474][0m Trial 865 finished with value: 0.7326095190419515 and parameters: {'loss': 'coxph', 'learning_rate': 0.005088942445723355, 'n_estimators': 687, 'criterion': 'friedman_mse', 'min_samples_split': 7, 'min_samples_leaf': 2, 'min_weight_fraction_leaf': 0.05842886782954005, 'min_impurity_decrease': 0.479685186290283, 'max_features': 0.7416364493716759, 'subsample': 0.7174915365516696, 'dropout_rate': 0.7715522365405336, 'ccp_alpha': 0.09281295673026971}. Best is trial 712 with value: 0.7824105962295036.[0m
[32m[I 2022-04-15 12:59:33,516][0m Trial 866 finished with value: 0.5 and parameters: {'loss': 'coxph', 'learning_rate': 0.004870631473789614, 'n_estimators': 775, 'criterion': 'friedman_mse', 'min_samples_split': 7, 'min_samples_leaf': 2, 'min_weight_fraction_leaf': 0.053757160970914396, 'min_impurity_decrease': 0.2746344793098821, 'max_features': 0.7583397936006167, 'subsample': 0.703420384705145, 'dropout_rate': 0.7522242999417945, 'ccp_alpha': 0.2577406459635648}. Best is trial 712 with value: 0.7824105962295036.[0m
[32m[I 2022-04-15 13:00:54,520][0m Trial 867 finished with value: 0.7120407504961597 and parameters: {'loss': 'coxph', 'learning_rate': 0.005546814175929206, 'n_estimators': 726, 'criterion': 'friedman_mse', 'min_samples_split': 7, 'min_samples_leaf': 2, 'min_weight_fraction_leaf': 0.0685559923187476, 'min_impurity_decrease': 0.5193630001380777, 'max_features': 0.13693804108814273, 'subsample': 0.7243492520487013, 'dropout_rate': 0.7592702898166173, 'ccp_alpha': 0.10467036853566161}. Best is trial 712 with value: 0.7824105962295036.[0m
[32m[I 2022-04-15 13:02:18,245][0m Trial 868 finished with value: 0.5 and parameters: {'loss': 'coxph', 'learning_rate': 0.004130003246576509, 'n_estimators': 716, 'criterion': 'friedman_mse', 'min_samples_split': 7, 'min_samples_leaf': 2, 'min_weight_fraction_leaf': 0.038188206729935614, 'min_impurity_decrease': 0.4855122875026107, 'max_features': 0.734354668440663, 'subsample': 0.7011917325609227, 'dropout_rate': 0.7333957613119169, 'ccp_alpha': 0.44934005718922443}. Best is trial 712 with value: 0.7824105962295036.[0m
[32m[I 2022-04-15 13:03:02,969][0m Trial 869 finished with value: 0.2870908022950359 and parameters: {'loss': 'squared', 'learning_rate': 0.00572592007451384, 'n_estimators': 755, 'criterion': 'friedman_mse', 'min_samples_split': 7, 'min_samples_leaf': 2, 'min_weight_fraction_leaf': 0.060100550442694155, 'min_impurity_decrease': 0.5124386799426053, 'max_features': 0.7666901268138661, 'subsample': 0.7522623359329185, 'dropout_rate': 0.8029166607266683, 'ccp_alpha': 0.17149273919602773}. Best is trial 712 with value: 0.7824105962295036.[0m
[32m[I 2022-04-15 13:04:17,562][0m Trial 870 finished with value: 0.7251317004884209 and parameters: {'loss': 'coxph', 'learning_rate': 0.004089428431685228, 'n_estimators': 681, 'criterion': 'friedman_mse', 'min_samples_split': 7, 'min_samples_leaf': 2, 'min_weight_fraction_leaf': 0.050195710499978015, 'min_impurity_decrease': 0.4683817126861983, 'max_features': 0.7316400574666423, 'subsample': 0.769196917877819, 'dropout_rate': 0.7476780860204087, 'ccp_alpha': 0.100819421757012}. Best is trial 712 with value: 0.7824105962295036.[0m
[32m[I 2022-04-15 13:05:19,976][0m Trial 871 finished with value: 0.5 and parameters: {'loss': 'coxph', 'learning_rate': 0.00531239628511636, 'n_estimators': 638, 'criterion': 'friedman_mse', 'min_samples_split': 8, 'min_samples_leaf': 2, 'min_weight_fraction_leaf': 0.06761338279771271, 'min_impurity_decrease': 0.48311562671167024, 'max_features': 0.7565396268827123, 'subsample': 0.7298569977297534, 'dropout_rate': 0.7969077708239328, 'ccp_alpha': 1.2392663773649077}. Best is trial 712 with value: 0.7824105962295036.[0m
[32m[I 2022-04-15 13:06:31,800][0m Trial 872 finished with value: 0.7377220093749896 and parameters: {'loss': 'coxph', 'learning_rate': 0.003680078068009178, 'n_estimators': 669, 'criterion': 'friedman_mse', 'min_samples_split': 7, 'min_samples_leaf': 2, 'min_weight_fraction_leaf': 0.04422177163210991, 'min_impurity_decrease': 0.5155541347494957, 'max_features': 0.7665607624223404, 'subsample': 0.7594702226709458, 'dropout_rate': 0.7836006753056262, 'ccp_alpha': 0.0865870958793089}. Best is trial 712 with value: 0.7824105962295036.[0m
[32m[I 2022-04-15 13:08:01,601][0m Trial 873 finished with value: 0.779158096355155 and parameters: {'loss': 'coxph', 'learning_rate': 0.004249297393991539, 'n_estimators': 633, 'criterion': 'friedman_mse', 'min_samples_split': 7, 'min_samples_leaf': 2, 'min_weight_fraction_leaf': 0.06399604466282899, 'min_impurity_decrease': 0.4646958580919777, 'max_features': 0.7368432544858003, 'subsample': 0.11044130546829978, 'dropout_rate': 0.7294250214826096, 'ccp_alpha': 0.004422124058458356}. Best is trial 712 with value: 0.7824105962295036.[0m
[32m[I 2022-04-15 13:09:04,323][0m Trial 874 finished with value: 0.5 and parameters: {'loss': 'coxph', 'learning_rate': 0.0036542367246825674, 'n_estimators': 636, 'criterion': 'friedman_mse', 'min_samples_split': 7, 'min_samples_leaf': 2, 'min_weight_fraction_leaf': 0.05833186939582869, 'min_impurity_decrease': 0.4586958911905967, 'max_features': 0.7283406405823124, 'subsample': 0.7957341592477746, 'dropout_rate': 0.7804980819603069, 'ccp_alpha': 0.3236870529105409}. Best is trial 712 with value: 0.7824105962295036.[0m
[32m[I 2022-04-15 13:10:53,141][0m Trial 875 finished with value: 0.5 and parameters: {'loss': 'coxph', 'learning_rate': 0.004550624729263542, 'n_estimators': 827, 'criterion': 'absolute_error', 'min_samples_split': 7, 'min_samples_leaf': 2, 'min_weight_fraction_leaf': 0.06361772582428644, 'min_impurity_decrease': 0.4313955704796837, 'max_features': 0.7455369048191565, 'subsample': 0.32866008110501843, 'dropout_rate': 0.7558770953860292, 'ccp_alpha': 0.001994865244102119}. Best is trial 712 with value: 0.7824105962295036.[0m
[32m[I 2022-04-15 13:12:02,032][0m Trial 876 finished with value: 0.5301157883717103 and parameters: {'loss': 'coxph', 'learning_rate': 0.0032375347236865072, 'n_estimators': 666, 'criterion': 'friedman_mse', 'min_samples_split': 7, 'min_samples_leaf': 2, 'min_weight_fraction_leaf': 0.04744622048569658, 'min_impurity_decrease': 0.39841103693040225, 'max_features': 0.73239322408663, 'subsample': 0.777461264948748, 'dropout_rate': 0.7704017038266032, 'ccp_alpha': 0.2023064570525785}. Best is trial 712 with value: 0.7824105962295036.[0m
[32m[I 2022-04-15 13:13:23,324][0m Trial 877 finished with value: 0.778856087407381 and parameters: {'loss': 'coxph', 'learning_rate': 0.002793296031111968, 'n_estimators': 632, 'criterion': 'friedman_mse', 'min_samples_split': 7, 'min_samples_leaf': 2, 'min_weight_fraction_leaf': 0.05636917396975774, 'min_impurity_decrease': 0.4632138400982522, 'max_features': 0.7277553621835624, 'subsample': 0.14949693879339016, 'dropout_rate': 0.7617553336379154, 'ccp_alpha': 0.0019345559390813848}. Best is trial 712 with value: 0.7824105962295036.[0m
[32m[I 2022-04-15 13:14:41,979][0m Trial 878 finished with value: 0.7621796304328983 and parameters: {'loss': 'coxph', 'learning_rate': 0.0027084108724891366, 'n_estimators': 635, 'criterion': 'friedman_mse', 'min_samples_split': 7, 'min_samples_leaf': 2, 'min_weight_fraction_leaf': 0.03968729521363834, 'min_impurity_decrease': 0.46207428031305386, 'max_features': 0.7240172704579075, 'subsample': 0.1040193986430613, 'dropout_rate': 0.7681177778168047, 'ccp_alpha': 0.0948527177399864}. Best is trial 712 with value: 0.7824105962295036.[0m
[32m[I 2022-04-15 13:16:06,267][0m Trial 879 finished with value: 0.7140805857049799 and parameters: {'loss': 'coxph', 'learning_rate': 0.0023642350660101996, 'n_estimators': 660, 'criterion': 'friedman_mse', 'min_samples_split': 7, 'min_samples_leaf': 2, 'min_weight_fraction_leaf': 0.05390181423330479, 'min_impurity_decrease': 0.4416643993693734, 'max_features': 0.7409805169188004, 'subsample': 0.1021479366239135, 'dropout_rate': 0.7467671715476613, 'ccp_alpha': 0.205456369452345}. Best is trial 712 with value: 0.7824105962295036.[0m
[32m[I 2022-04-15 13:17:26,487][0m Trial 880 finished with value: 0.7635933347180165 and parameters: {'loss': 'coxph', 'learning_rate': 0.003442924845242659, 'n_estimators': 628, 'criterion': 'friedman_mse', 'min_samples_split': 7, 'min_samples_leaf': 2, 'min_weight_fraction_leaf': 0.04243992142080077, 'min_impurity_decrease': 0.46748707277550244, 'max_features': 0.7133469895339322, 'subsample': 0.14625449477033708, 'dropout_rate': 0.7412239217869058, 'ccp_alpha': 0.09254473773171022}. Best is trial 712 with value: 0.7824105962295036.[0m
[32m[I 2022-04-15 13:18:57,129][0m Trial 881 finished with value: 0.7784099007554232 and parameters: {'loss': 'coxph', 'learning_rate': 0.0030137384644397386, 'n_estimators': 685, 'criterion': 'friedman_mse', 'min_samples_split': 7, 'min_samples_leaf': 2, 'min_weight_fraction_leaf': 0.05315901575838246, 'min_impurity_decrease': 0.4253410048050237, 'max_features': 0.7305473519229647, 'subsample': 0.13110986955616455, 'dropout_rate': 0.8074365977923338, 'ccp_alpha': 0.002464813160079846}. Best is trial 712 with value: 0.7824105962295036.[0m
[32m[I 2022-04-15 13:20:25,427][0m Trial 882 finished with value: 0.5 and parameters: {'loss': 'coxph', 'learning_rate': 0.0025552471513815944, 'n_estimators': 715, 'criterion': 'friedman_mse', 'min_samples_split': 7, 'min_samples_leaf': 2, 'min_weight_fraction_leaf': 0.05943587400199006, 'min_impurity_decrease': 0.41696951524734166, 'max_features': 0.7029909607859353, 'subsample': 0.05658730049720989, 'dropout_rate': 0.8427349827782614, 'ccp_alpha': 3.8839419933402324}. Best is trial 712 with value: 0.7824105962295036.[0m
[32m[I 2022-04-15 13:21:46,020][0m Trial 883 finished with value: 0.7546880438802036 and parameters: {'loss': 'coxph', 'learning_rate': 0.00300304299766651, 'n_estimators': 625, 'criterion': 'friedman_mse', 'min_samples_split': 8, 'min_samples_leaf': 2, 'min_weight_fraction_leaf': 0.05485157318838477, 'min_impurity_decrease': 0.4260829516286501, 'max_features': 0.7510442926370499, 'subsample': 0.08585439273005702, 'dropout_rate': 0.7259186505101515, 'ccp_alpha': 0.17588244147200657}. Best is trial 712 with value: 0.7824105962295036.[0m
[32m[I 2022-04-15 13:22:53,312][0m Trial 884 finished with value: 0.6017968330753914 and parameters: {'loss': 'coxph', 'learning_rate': 0.0021814806228169716, 'n_estimators': 651, 'criterion': 'friedman_mse', 'min_samples_split': 7, 'min_samples_leaf': 2, 'min_weight_fraction_leaf': 0.06659902192922248, 'min_impurity_decrease': 0.4017259933199162, 'max_features': 0.7233667087115982, 'subsample': 0.11491138034106524, 'dropout_rate': 0.8908103870305808, 'ccp_alpha': 0.3157328176901079}. Best is trial 712 with value: 0.7824105962295036.[0m
[32m[I 2022-04-15 13:24:04,982][0m Trial 885 finished with value: 0.7610957339432087 and parameters: {'loss': 'coxph', 'learning_rate': 0.002768572681377716, 'n_estimators': 615, 'criterion': 'friedman_mse', 'min_samples_split': 7, 'min_samples_leaf': 2, 'min_weight_fraction_leaf': 0.0641140717246573, 'min_impurity_decrease': 0.435576238383628, 'max_features': 0.7572278203682546, 'subsample': 0.09550383282123903, 'dropout_rate': 0.8222442146106241, 'ccp_alpha': 0.09826836814994709}. Best is trial 712 with value: 0.7824105962295036.[0m
[32m[I 2022-04-15 13:25:12,831][0m Trial 886 finished with value: 0.7599222155084064 and parameters: {'loss': 'coxph', 'learning_rate': 4.6030555056288114e-05, 'n_estimators': 625, 'criterion': 'friedman_mse', 'min_samples_split': 8, 'min_samples_leaf': 2, 'min_weight_fraction_leaf': 0.051920497249641234, 'min_impurity_decrease': 0.44640712975721514, 'max_features': 0.697396049997051, 'subsample': 0.16028618725450008, 'dropout_rate': 0.8558096543869258, 'ccp_alpha': 0.09297040331202414}. Best is trial 712 with value: 0.7824105962295036.[0m
[32m[I 2022-04-15 13:26:30,096][0m Trial 887 finished with value: 0.5 and parameters: {'loss': 'coxph', 'learning_rate': 0.0034145815829007115, 'n_estimators': 662, 'criterion': 'squared_error', 'min_samples_split': 7, 'min_samples_leaf': 2, 'min_weight_fraction_leaf': 0.06681470247551101, 'min_impurity_decrease': 0.41785340544378746, 'max_features': 0.7362162257914305, 'subsample': 0.14511228258730363, 'dropout_rate': 0.8142139653652242, 'ccp_alpha': 1.5147757190201474}. Best is trial 712 with value: 0.7824105962295036.[0m
[32m[I 2022-04-15 13:27:18,792][0m Trial 888 finished with value: 0.27327420544141423 and parameters: {'loss': 'squared', 'learning_rate': 0.002082504466406921, 'n_estimators': 702, 'criterion': 'friedman_mse', 'min_samples_split': 7, 'min_samples_leaf': 2, 'min_weight_fraction_leaf': 0.0525542881343903, 'min_impurity_decrease': 0.45581613223027406, 'max_features': 0.7656486249584181, 'subsample': 0.17519834835003134, 'dropout_rate': 0.7290332224846291, 'ccp_alpha': 0.21582398988773363}. Best is trial 712 with value: 0.7824105962295036.[0m
[32m[I 2022-04-15 13:28:33,875][0m Trial 889 finished with value: 0.7645101287254024 and parameters: {'loss': 'coxph', 'learning_rate': 0.003792735626488438, 'n_estimators': 609, 'criterion': 'friedman_mse', 'min_samples_split': 7, 'min_samples_leaf': 2, 'min_weight_fraction_leaf': 0.05996127195696288, 'min_impurity_decrease': 0.43360356654649107, 'max_features': 0.7282678210931388, 'subsample': 0.0780133511778068, 'dropout_rate': 0.7951677933282986, 'ccp_alpha': 0.08418975489192218}. Best is trial 712 with value: 0.7824105962295036.[0m
[32m[I 2022-04-15 13:30:14,038][0m Trial 890 finished with value: 0.6743624146605087 and parameters: {'loss': 'coxph', 'learning_rate': 0.0018780634954068838, 'n_estimators': 748, 'criterion': 'friedman_mse', 'min_samples_split': 7, 'min_samples_leaf': 2, 'min_weight_fraction_leaf': 0.072252376879838, 'min_impurity_decrease': 0.47834216930580165, 'max_features': 0.7452252000883054, 'subsample': 0.13001847055306115, 'dropout_rate': 0.7706237724187059, 'ccp_alpha': 0.25593093640148673}. Best is trial 712 with value: 0.7824105962295036.[0m
[32m[I 2022-04-15 13:31:26,310][0m Trial 891 finished with value: 0.7138195699617016 and parameters: {'loss': 'coxph', 'learning_rate': 0.0026686836974579033, 'n_estimators': 636, 'criterion': 'friedman_mse', 'min_samples_split': 7, 'min_samples_leaf': 2, 'min_weight_fraction_leaf': 0.03668272657437053, 'min_impurity_decrease': 0.4085108410046453, 'max_features': 0.7100427465689279, 'subsample': 0.13850538743494265, 'dropout_rate': 0.8220583310843763, 'ccp_alpha': 0.1662362547220291}. Best is trial 712 with value: 0.7824105962295036.[0m
[32m[I 2022-04-15 13:32:37,973][0m Trial 892 finished with value: 0.7606371533757393 and parameters: {'loss': 'coxph', 'learning_rate': 0.004099440765721363, 'n_estimators': 612, 'criterion': 'friedman_mse', 'min_samples_split': 7, 'min_samples_leaf': 2, 'min_weight_fraction_leaf': 0.08039055025020833, 'min_impurity_decrease': 0.003403083265728024, 'max_features': 0.7708937788948194, 'subsample': 0.1203632534196634, 'dropout_rate': 0.8086723863189685, 'ccp_alpha': 0.08878817800716061}. Best is trial 712 with value: 0.7824105962295036.[0m
[32m[I 2022-04-15 13:34:18,650][0m Trial 893 finished with value: 0.778409762080593 and parameters: {'loss': 'coxph', 'learning_rate': 0.003113254731833479, 'n_estimators': 652, 'criterion': 'friedman_mse', 'min_samples_split': 7, 'min_samples_leaf': 2, 'min_weight_fraction_leaf': 0.05037827327282945, 'min_impurity_decrease': 0.39340951709813227, 'max_features': 0.7415668185825115, 'subsample': 0.031655007374596866, 'dropout_rate': 0.7138648343067566, 'ccp_alpha': 0.006635320989633614}. Best is trial 712 with value: 0.7824105962295036.[0m
[32m[I 2022-04-15 13:35:50,214][0m Trial 894 finished with value: 0.5 and parameters: {'loss': 'coxph', 'learning_rate': 0.0022667063372849637, 'n_estimators': 680, 'criterion': 'friedman_mse', 'min_samples_split': 7, 'min_samples_leaf': 2, 'min_weight_fraction_leaf': 0.06490990160646126, 'min_impurity_decrease': 0.39995269660910454, 'max_features': 0.7202746447714716, 'subsample': 0.0019442882955314766, 'dropout_rate': 0.7886086474741425, 'ccp_alpha': 1.9402329694336438}. Best is trial 712 with value: 0.7824105962295036.[0m
