[32m[I 2022-04-13 11:46:45,064][0m Trial 206 finished with value: 0.8862878052733978 and parameters: {'splitter': 'best', 'min_samples_split': 0.10177283947178883, 'min_samples_leaf': 0.01571405109169423, 'min_weight_fraction_leaf': 0.029997128400113118, 'max_features': 0.9998592335428254}. Best is trial 201 with value: 0.8881217621713932.[0m
/media/san2_ssd/data/Workdir/survival/utils.py:305: RuntimeWarning: invalid value encountered in true_divide
  pdfs = np.gradient(1-survs,axis=1)/norms
/media/san2_ssd/data/Workdir/survival/utils.py:305: RuntimeWarning: invalid value encountered in true_divide
  pdfs = np.gradient(1-survs,axis=1)/norms
/media/san2_ssd/data/Workdir/survival/utils.py:305: RuntimeWarning: invalid value encountered in true_divide
  pdfs = np.gradient(1-survs,axis=1)/norms
/media/san2_ssd/data/Workdir/survival/utils.py:305: RuntimeWarning: invalid value encountered in true_divide
  pdfs = np.gradient(1-survs,axis=1)/norms
[32m[I 2022-04-13 11:46:46,574][0m Trial 207 finished with value: 0.8843343990189441 and parameters: {'splitter': 'best', 'min_samples_split': 0.10487535352046837, 'min_samples_leaf': 0.013546391550544531, 'min_weight_fraction_leaf': 0.02993290249253545, 'max_features': 0.9514675696014526}. Best is trial 201 with value: 0.8881217621713932.[0m
/media/san2_ssd/data/Workdir/survival/utils.py:305: RuntimeWarning: invalid value encountered in true_divide
  pdfs = np.gradient(1-survs,axis=1)/norms
/media/san2_ssd/data/Workdir/survival/utils.py:305: RuntimeWarning: invalid value encountered in true_divide
  pdfs = np.gradient(1-survs,axis=1)/norms
/media/san2_ssd/data/Workdir/survival/utils.py:305: RuntimeWarning: invalid value encountered in true_divide
  pdfs = np.gradient(1-survs,axis=1)/norms
/media/san2_ssd/data/Workdir/survival/utils.py:305: RuntimeWarning: invalid value encountered in true_divide
  pdfs = np.gradient(1-survs,axis=1)/norms
[32m[I 2022-04-13 11:46:48,561][0m Trial 208 finished with value: 0.8875122029085215 and parameters: {'splitter': 'best', 'min_samples_split': 0.10048972756805442, 'min_samples_leaf': 0.02432117596755323, 'min_weight_fraction_leaf': 0.04259950853589333, 'max_features': 0.9757003200698185}. Best is trial 201 with value: 0.8881217621713932.[0m
/media/san2_ssd/data/Workdir/survival/utils.py:305: RuntimeWarning: invalid value encountered in true_divide
  pdfs = np.gradient(1-survs,axis=1)/norms
/media/san2_ssd/data/Workdir/survival/utils.py:305: RuntimeWarning: invalid value encountered in true_divide
  pdfs = np.gradient(1-survs,axis=1)/norms
/media/san2_ssd/data/Workdir/survival/utils.py:305: RuntimeWarning: invalid value encountered in true_divide
  pdfs = np.gradient(1-survs,axis=1)/norms
/media/san2_ssd/data/Workdir/survival/utils.py:305: RuntimeWarning: invalid value encountered in true_divide
  pdfs = np.gradient(1-survs,axis=1)/norms
/media/san2_ssd/data/Workdir/survival/utils.py:305: RuntimeWarning: invalid value encountered in true_divide
  pdfs = np.gradient(1-survs,axis=1)/norms
[32m[I 2022-04-13 11:46:50,338][0m Trial 209 finished with value: 0.8842368530066791 and parameters: {'splitter': 'best', 'min_samples_split': 0.09850410130463265, 'min_samples_leaf': 0.027218541199185847, 'min_weight_fraction_leaf': 0.03899541036428888, 'max_features': 0.963872641125518}. Best is trial 201 with value: 0.8881217621713932.[0m
/media/san2_ssd/data/Workdir/survival/utils.py:305: RuntimeWarning: invalid value encountered in true_divide
  pdfs = np.gradient(1-survs,axis=1)/norms
/media/san2_ssd/data/Workdir/survival/utils.py:305: RuntimeWarning: invalid value encountered in true_divide
  pdfs = np.gradient(1-survs,axis=1)/norms
/media/san2_ssd/data/Workdir/survival/utils.py:305: RuntimeWarning: invalid value encountered in true_divide
  pdfs = np.gradient(1-survs,axis=1)/norms
/media/san2_ssd/data/Workdir/survival/utils.py:305: RuntimeWarning: invalid value encountered in true_divide
  pdfs = np.gradient(1-survs,axis=1)/norms
[32m[I 2022-04-13 11:46:52,600][0m Trial 210 finished with value: 0.8868600072834173 and parameters: {'splitter': 'best', 'min_samples_split': 0.11402600478777195, 'min_samples_leaf': 0.02049354095978213, 'min_weight_fraction_leaf': 0.028163791284642112, 'max_features': 0.9989302097832958}. Best is trial 201 with value: 0.8881217621713932.[0m
/media/san2_ssd/data/Workdir/survival/utils.py:305: RuntimeWarning: invalid value encountered in true_divide
  pdfs = np.gradient(1-survs,axis=1)/norms
/media/san2_ssd/data/Workdir/survival/utils.py:305: RuntimeWarning: invalid value encountered in true_divide
  pdfs = np.gradient(1-survs,axis=1)/norms
/media/san2_ssd/data/Workdir/survival/utils.py:305: RuntimeWarning: invalid value encountered in true_divide
  pdfs = np.gradient(1-survs,axis=1)/norms
/media/san2_ssd/data/Workdir/survival/utils.py:305: RuntimeWarning: invalid value encountered in true_divide
  pdfs = np.gradient(1-survs,axis=1)/norms
[32m[I 2022-04-13 11:46:55,325][0m Trial 211 finished with value: 0.8862709223624341 and parameters: {'splitter': 'best', 'min_samples_split': 0.11696484129916197, 'min_samples_leaf': 0.016833000795685286, 'min_weight_fraction_leaf': 0.02912667454700365, 'max_features': 0.9995710563577552}. Best is trial 201 with value: 0.8881217621713932.[0m
/media/san2_ssd/data/Workdir/survival/utils.py:305: RuntimeWarning: invalid value encountered in true_divide
  pdfs = np.gradient(1-survs,axis=1)/norms
/media/san2_ssd/data/Workdir/survival/utils.py:305: RuntimeWarning: invalid value encountered in true_divide
  pdfs = np.gradient(1-survs,axis=1)/norms
/media/san2_ssd/data/Workdir/survival/utils.py:305: RuntimeWarning: invalid value encountered in true_divide
  pdfs = np.gradient(1-survs,axis=1)/norms
/media/san2_ssd/data/Workdir/survival/utils.py:305: RuntimeWarning: invalid value encountered in true_divide
  pdfs = np.gradient(1-survs,axis=1)/norms
[32m[I 2022-04-13 11:46:57,707][0m Trial 212 finished with value: 0.8868600072834173 and parameters: {'splitter': 'best', 'min_samples_split': 0.11847187476634487, 'min_samples_leaf': 0.022261283350594803, 'min_weight_fraction_leaf': 0.027993946738400728, 'max_features': 0.9816821392143359}. Best is trial 201 with value: 0.8881217621713932.[0m
/media/san2_ssd/data/Workdir/survival/utils.py:305: RuntimeWarning: invalid value encountered in true_divide
  pdfs = np.gradient(1-survs,axis=1)/norms
/media/san2_ssd/data/Workdir/survival/utils.py:305: RuntimeWarning: invalid value encountered in true_divide
  pdfs = np.gradient(1-survs,axis=1)/norms
/media/san2_ssd/data/Workdir/survival/utils.py:305: RuntimeWarning: invalid value encountered in true_divide
  pdfs = np.gradient(1-survs,axis=1)/norms
/media/san2_ssd/data/Workdir/survival/utils.py:305: RuntimeWarning: invalid value encountered in true_divide
  pdfs = np.gradient(1-survs,axis=1)/norms
[32m[I 2022-04-13 11:46:59,876][0m Trial 213 finished with value: 0.8862709223624341 and parameters: {'splitter': 'best', 'min_samples_split': 0.1192311524020153, 'min_samples_leaf': 0.023201913262879167, 'min_weight_fraction_leaf': 0.02825506936730443, 'max_features': 0.9997731301754802}. Best is trial 201 with value: 0.8881217621713932.[0m
/media/san2_ssd/data/Workdir/survival/utils.py:305: RuntimeWarning: invalid value encountered in true_divide
  pdfs = np.gradient(1-survs,axis=1)/norms
/media/san2_ssd/data/Workdir/survival/utils.py:305: RuntimeWarning: invalid value encountered in true_divide
  pdfs = np.gradient(1-survs,axis=1)/norms
[32m[I 2022-04-13 11:47:02,770][0m Trial 214 finished with value: 0.8832752686627872 and parameters: {'splitter': 'best', 'min_samples_split': 0.11963914916421496, 'min_samples_leaf': 0.024233672683887306, 'min_weight_fraction_leaf': 0.02573226914275411, 'max_features': 0.9703075650212625}. Best is trial 201 with value: 0.8881217621713932.[0m
/media/san2_ssd/data/Workdir/survival/utils.py:305: RuntimeWarning: invalid value encountered in true_divide
  pdfs = np.gradient(1-survs,axis=1)/norms
/media/san2_ssd/data/Workdir/survival/utils.py:305: RuntimeWarning: invalid value encountered in true_divide
  pdfs = np.gradient(1-survs,axis=1)/norms
/media/san2_ssd/data/Workdir/survival/utils.py:305: RuntimeWarning: invalid value encountered in true_divide
  pdfs = np.gradient(1-survs,axis=1)/norms
/media/san2_ssd/data/Workdir/survival/utils.py:305: RuntimeWarning: invalid value encountered in true_divide
  pdfs = np.gradient(1-survs,axis=1)/norms
[32m[I 2022-04-13 11:47:04,704][0m Trial 215 finished with value: 0.882979913603112 and parameters: {'splitter': 'best', 'min_samples_split': 0.10195086947720028, 'min_samples_leaf': 0.020962641220016974, 'min_weight_fraction_leaf': 0.03160493682755475, 'max_features': 0.949003530911264}. Best is trial 201 with value: 0.8881217621713932.[0m
[32m[I 2022-04-13 11:47:05,335][0m Trial 216 finished with value: 0.46399766320272856 and parameters: {'splitter': 'best', 'min_samples_split': 0.16201790406821687, 'min_samples_leaf': 0.2708772252942127, 'min_weight_fraction_leaf': 0.27657871956830093, 'max_features': 0.9995831353279548}. Best is trial 201 with value: 0.8881217621713932.[0m
[32m[I 2022-04-13 11:47:07,187][0m Trial 217 finished with value: 0.8780766364180588 and parameters: {'splitter': 'best', 'min_samples_split': 0.1989322879853882, 'min_samples_leaf': 0.02781641028827345, 'min_weight_fraction_leaf': 0.04169804743195735, 'max_features': 0.9738535580377372}. Best is trial 201 with value: 0.8881217621713932.[0m
/media/san2_ssd/data/Workdir/survival/utils.py:305: RuntimeWarning: invalid value encountered in true_divide
  pdfs = np.gradient(1-survs,axis=1)/norms
/media/san2_ssd/data/Workdir/survival/utils.py:305: RuntimeWarning: invalid value encountered in true_divide
  pdfs = np.gradient(1-survs,axis=1)/norms
[32m[I 2022-04-13 11:47:08,659][0m Trial 218 finished with value: 0.8832746357509891 and parameters: {'splitter': 'best', 'min_samples_split': 0.11903281196146988, 'min_samples_leaf': 0.015000918471814305, 'min_weight_fraction_leaf': 0.028313022404926263, 'max_features': 0.9407368946576921}. Best is trial 201 with value: 0.8881217621713932.[0m
/media/san2_ssd/data/Workdir/survival/utils.py:305: RuntimeWarning: invalid value encountered in true_divide
  pdfs = np.gradient(1-survs,axis=1)/norms
[32m[I 2022-04-13 11:47:09,771][0m Trial 219 finished with value: 0.7868508375586669 and parameters: {'splitter': 'best', 'min_samples_split': 0.14660550829226798, 'min_samples_leaf': 0.02024486016383078, 'min_weight_fraction_leaf': 0.040532699305381455, 'max_features': 0.980786972701048}. Best is trial 201 with value: 0.8881217621713932.[0m
/media/san2_ssd/data/Workdir/survival/utils.py:305: RuntimeWarning: invalid value encountered in true_divide
  pdfs = np.gradient(1-survs,axis=1)/norms
/media/san2_ssd/data/Workdir/survival/utils.py:305: RuntimeWarning: invalid value encountered in true_divide
  pdfs = np.gradient(1-survs,axis=1)/norms
/media/san2_ssd/data/Workdir/survival/utils.py:305: RuntimeWarning: invalid value encountered in true_divide
  pdfs = np.gradient(1-survs,axis=1)/norms
/media/san2_ssd/data/Workdir/survival/utils.py:305: RuntimeWarning: invalid value encountered in true_divide
  pdfs = np.gradient(1-survs,axis=1)/norms
[32m[I 2022-04-13 11:47:12,167][0m Trial 220 finished with value: 0.8834763961517054 and parameters: {'splitter': 'best', 'min_samples_split': 0.09763562897102333, 'min_samples_leaf': 0.03236234040574425, 'min_weight_fraction_leaf': 0.02783145744618449, 'max_features': 0.9603923567030829}. Best is trial 201 with value: 0.8881217621713932.[0m
/media/san2_ssd/data/Workdir/survival/utils.py:305: RuntimeWarning: invalid value encountered in true_divide
  pdfs = np.gradient(1-survs,axis=1)/norms
/media/san2_ssd/data/Workdir/survival/utils.py:305: RuntimeWarning: invalid value encountered in true_divide
  pdfs = np.gradient(1-survs,axis=1)/norms
/media/san2_ssd/data/Workdir/survival/utils.py:305: RuntimeWarning: invalid value encountered in true_divide
  pdfs = np.gradient(1-survs,axis=1)/norms
[32m[I 2022-04-13 11:47:14,685][0m Trial 221 finished with value: 0.7876159732125412 and parameters: {'splitter': 'best', 'min_samples_split': 0.13514090453671143, 'min_samples_leaf': 0.011959626667349666, 'min_weight_fraction_leaf': 0.040990858063742704, 'max_features': 0.9877006996873108}. Best is trial 201 with value: 0.8881217621713932.[0m
/media/san2_ssd/data/Workdir/survival/utils.py:305: RuntimeWarning: invalid value encountered in true_divide
  pdfs = np.gradient(1-survs,axis=1)/norms
/media/san2_ssd/data/Workdir/survival/utils.py:305: RuntimeWarning: invalid value encountered in true_divide
  pdfs = np.gradient(1-survs,axis=1)/norms
/media/san2_ssd/data/Workdir/survival/utils.py:305: RuntimeWarning: invalid value encountered in true_divide
  pdfs = np.gradient(1-survs,axis=1)/norms
/media/san2_ssd/data/Workdir/survival/utils.py:305: RuntimeWarning: invalid value encountered in true_divide
  pdfs = np.gradient(1-survs,axis=1)/norms
[32m[I 2022-04-13 11:47:18,085][0m Trial 222 finished with value: 0.8877780664932649 and parameters: {'splitter': 'best', 'min_samples_split': 0.12032894095991678, 'min_samples_leaf': 0.010770919536935774, 'min_weight_fraction_leaf': 0.032062918673940635, 'max_features': 0.9985337081023318}. Best is trial 201 with value: 0.8881217621713932.[0m
[32m[I 2022-04-13 11:47:19,764][0m Trial 223 finished with value: 0.4645224029888337 and parameters: {'splitter': 'best', 'min_samples_split': 0.10908633762897302, 'min_samples_leaf': 0.01612301616877039, 'min_weight_fraction_leaf': 0.2938327075422665, 'max_features': 0.9985345472630236}. Best is trial 201 with value: 0.8881217621713932.[0m
/media/san2_ssd/data/Workdir/survival/utils.py:305: RuntimeWarning: invalid value encountered in true_divide
  pdfs = np.gradient(1-survs,axis=1)/norms
/media/san2_ssd/data/Workdir/survival/utils.py:305: RuntimeWarning: invalid value encountered in true_divide
  pdfs = np.gradient(1-survs,axis=1)/norms
/media/san2_ssd/data/Workdir/survival/utils.py:305: RuntimeWarning: invalid value encountered in true_divide
  pdfs = np.gradient(1-survs,axis=1)/norms
[32m[I 2022-04-13 11:47:20,906][0m Trial 224 finished with value: 0.8864522060404086 and parameters: {'splitter': 'best', 'min_samples_split': 0.12172153682798127, 'min_samples_leaf': 0.029346087603179468, 'min_weight_fraction_leaf': 0.025317367657778183, 'max_features': 0.999696609985257}. Best is trial 201 with value: 0.8881217621713932.[0m
/media/san2_ssd/data/Workdir/survival/utils.py:305: RuntimeWarning: invalid value encountered in true_divide
  pdfs = np.gradient(1-survs,axis=1)/norms
/media/san2_ssd/data/Workdir/survival/utils.py:305: RuntimeWarning: invalid value encountered in true_divide
  pdfs = np.gradient(1-survs,axis=1)/norms
/media/san2_ssd/data/Workdir/survival/utils.py:305: RuntimeWarning: invalid value encountered in true_divide
  pdfs = np.gradient(1-survs,axis=1)/norms
/media/san2_ssd/data/Workdir/survival/utils.py:305: RuntimeWarning: invalid value encountered in true_divide
  pdfs = np.gradient(1-survs,axis=1)/norms
/media/san2_ssd/data/Workdir/survival/utils.py:305: RuntimeWarning: invalid value encountered in true_divide
  pdfs = np.gradient(1-survs,axis=1)/norms
[32m[I 2022-04-13 11:47:22,584][0m Trial 225 finished with value: 0.8873502833441753 and parameters: {'splitter': 'best', 'min_samples_split': 0.11990952863761109, 'min_samples_leaf': 0.03026475290303845, 'min_weight_fraction_leaf': 0.02219109660296086, 'max_features': 0.999743498867221}. Best is trial 201 with value: 0.8881217621713932.[0m
/media/san2_ssd/data/Workdir/survival/utils.py:305: RuntimeWarning: invalid value encountered in true_divide
  pdfs = np.gradient(1-survs,axis=1)/norms
/media/san2_ssd/data/Workdir/survival/utils.py:305: RuntimeWarning: invalid value encountered in true_divide
  pdfs = np.gradient(1-survs,axis=1)/norms
[32m[I 2022-04-13 11:47:24,795][0m Trial 226 finished with value: 0.8837098205648243 and parameters: {'splitter': 'best', 'min_samples_split': 0.12108929965221191, 'min_samples_leaf': 0.028936572136544582, 'min_weight_fraction_leaf': 0.02341802364788206, 'max_features': 0.9654391243058879}. Best is trial 201 with value: 0.8881217621713932.[0m
/media/san2_ssd/data/Workdir/survival/utils.py:305: RuntimeWarning: invalid value encountered in true_divide
  pdfs = np.gradient(1-survs,axis=1)/norms
/media/san2_ssd/data/Workdir/survival/utils.py:305: RuntimeWarning: invalid value encountered in true_divide
  pdfs = np.gradient(1-survs,axis=1)/norms
/media/san2_ssd/data/Workdir/survival/utils.py:305: RuntimeWarning: invalid value encountered in true_divide
  pdfs = np.gradient(1-survs,axis=1)/norms
/media/san2_ssd/data/Workdir/survival/utils.py:305: RuntimeWarning: invalid value encountered in true_divide
  pdfs = np.gradient(1-survs,axis=1)/norms
/media/san2_ssd/data/Workdir/survival/utils.py:305: RuntimeWarning: invalid value encountered in true_divide
  pdfs = np.gradient(1-survs,axis=1)/norms
[32m[I 2022-04-13 11:47:27,118][0m Trial 227 finished with value: 0.8863721946582037 and parameters: {'splitter': 'best', 'min_samples_split': 0.10600720467413109, 'min_samples_leaf': 0.03066849518604899, 'min_weight_fraction_leaf': 0.02732497315885818, 'max_features': 0.9998825966605929}. Best is trial 201 with value: 0.8881217621713932.[0m
/media/san2_ssd/data/Workdir/survival/utils.py:305: RuntimeWarning: invalid value encountered in true_divide
  pdfs = np.gradient(1-survs,axis=1)/norms
/media/san2_ssd/data/Workdir/survival/utils.py:305: RuntimeWarning: invalid value encountered in true_divide
  pdfs = np.gradient(1-survs,axis=1)/norms
/media/san2_ssd/data/Workdir/survival/utils.py:305: RuntimeWarning: invalid value encountered in true_divide
  pdfs = np.gradient(1-survs,axis=1)/norms
/media/san2_ssd/data/Workdir/survival/utils.py:305: RuntimeWarning: invalid value encountered in true_divide
  pdfs = np.gradient(1-survs,axis=1)/norms
/media/san2_ssd/data/Workdir/survival/utils.py:305: RuntimeWarning: invalid value encountered in true_divide
  pdfs = np.gradient(1-survs,axis=1)/norms
[32m[I 2022-04-13 11:47:28,267][0m Trial 228 finished with value: 0.8866952077761342 and parameters: {'splitter': 'best', 'min_samples_split': 0.09749917582883029, 'min_samples_leaf': 0.0338834296397604, 'min_weight_fraction_leaf': 0.022468690078345895, 'max_features': 0.9763580514387598}. Best is trial 201 with value: 0.8881217621713932.[0m
/media/san2_ssd/data/Workdir/survival/utils.py:305: RuntimeWarning: invalid value encountered in true_divide
  pdfs = np.gradient(1-survs,axis=1)/norms
/media/san2_ssd/data/Workdir/survival/utils.py:305: RuntimeWarning: invalid value encountered in true_divide
  pdfs = np.gradient(1-survs,axis=1)/norms
/media/san2_ssd/data/Workdir/survival/utils.py:305: RuntimeWarning: invalid value encountered in true_divide
  pdfs = np.gradient(1-survs,axis=1)/norms
/media/san2_ssd/data/Workdir/survival/utils.py:305: RuntimeWarning: invalid value encountered in true_divide
  pdfs = np.gradient(1-survs,axis=1)/norms
[32m[I 2022-04-13 11:47:29,259][0m Trial 229 finished with value: 0.8843050918311242 and parameters: {'splitter': 'best', 'min_samples_split': 0.10718897069957431, 'min_samples_leaf': 0.033003945651544034, 'min_weight_fraction_leaf': 0.023652855225912515, 'max_features': 0.952548016714312}. Best is trial 201 with value: 0.8881217621713932.[0m
/media/san2_ssd/data/Workdir/survival/utils.py:305: RuntimeWarning: invalid value encountered in true_divide
  pdfs = np.gradient(1-survs,axis=1)/norms
/media/san2_ssd/data/Workdir/survival/utils.py:305: RuntimeWarning: invalid value encountered in true_divide
  pdfs = np.gradient(1-survs,axis=1)/norms
/media/san2_ssd/data/Workdir/survival/utils.py:305: RuntimeWarning: invalid value encountered in true_divide
  pdfs = np.gradient(1-survs,axis=1)/norms
/media/san2_ssd/data/Workdir/survival/utils.py:305: RuntimeWarning: invalid value encountered in true_divide
  pdfs = np.gradient(1-survs,axis=1)/norms
/media/san2_ssd/data/Workdir/survival/utils.py:305: RuntimeWarning: invalid value encountered in true_divide
  pdfs = np.gradient(1-survs,axis=1)/norms
[32m[I 2022-04-13 11:47:31,850][0m Trial 230 finished with value: 0.8826845529110224 and parameters: {'splitter': 'best', 'min_samples_split': 0.0975723323181232, 'min_samples_leaf': 0.03407785993561727, 'min_weight_fraction_leaf': 0.03222907017694322, 'max_features': 0.9303772255768604}. Best is trial 201 with value: 0.8881217621713932.[0m
/media/san2_ssd/data/Workdir/survival/utils.py:305: RuntimeWarning: invalid value encountered in true_divide
  pdfs = np.gradient(1-survs,axis=1)/norms
/media/san2_ssd/data/Workdir/survival/utils.py:305: RuntimeWarning: invalid value encountered in true_divide
  pdfs = np.gradient(1-survs,axis=1)/norms
/media/san2_ssd/data/Workdir/survival/utils.py:305: RuntimeWarning: invalid value encountered in true_divide
  pdfs = np.gradient(1-survs,axis=1)/norms
/media/san2_ssd/data/Workdir/survival/utils.py:305: RuntimeWarning: invalid value encountered in true_divide
  pdfs = np.gradient(1-survs,axis=1)/norms
[32m[I 2022-04-13 11:47:32,829][0m Trial 231 finished with value: 0.8871619858744337 and parameters: {'splitter': 'best', 'min_samples_split': 0.11674039532929542, 'min_samples_leaf': 0.022199299917233344, 'min_weight_fraction_leaf': 0.01946844765464375, 'max_features': 0.9779731339431016}. Best is trial 201 with value: 0.8881217621713932.[0m
/media/san2_ssd/data/Workdir/survival/utils.py:305: RuntimeWarning: invalid value encountered in true_divide
  pdfs = np.gradient(1-survs,axis=1)/norms
/media/san2_ssd/data/Workdir/survival/utils.py:305: RuntimeWarning: invalid value encountered in true_divide
  pdfs = np.gradient(1-survs,axis=1)/norms
/media/san2_ssd/data/Workdir/survival/utils.py:305: RuntimeWarning: invalid value encountered in true_divide
  pdfs = np.gradient(1-survs,axis=1)/norms
