[32m[I 2022-04-15 01:49:22,275][0m Trial 970 finished with value: 0.25 and parameters: {'loss': 'coxph', 'learning_rate': 1.3167216472304765e-06, 'n_estimators': 407, 'criterion': 'friedman_mse', 'min_samples_split': 10, 'min_samples_leaf': 1, 'min_weight_fraction_leaf': 0.10621997096938132, 'min_impurity_decrease': 0.7243622264344695, 'max_features': 0.5021236430196402, 'subsample': 0.1110674566912693, 'dropout_rate': 0.6814368958499769, 'ccp_alpha': 2.3081494406041045}. Best is trial 964 with value: 0.7879949387224262.[0m
[32m[I 2022-04-15 01:50:14,645][0m Trial 971 finished with value: 0.7806171453796777 and parameters: {'loss': 'coxph', 'learning_rate': 1.501372780496005e-06, 'n_estimators': 425, 'criterion': 'friedman_mse', 'min_samples_split': 10, 'min_samples_leaf': 1, 'min_weight_fraction_leaf': 0.12000535058485576, 'min_impurity_decrease': 0.6918517037172299, 'max_features': 0.5274811825319345, 'subsample': 0.10479905327316835, 'dropout_rate': 0.6752974418441183, 'ccp_alpha': 0.10889541047223447}. Best is trial 964 with value: 0.7879949387224262.[0m
[32m[I 2022-04-15 01:50:58,866][0m Trial 972 finished with value: 0.7876426016841439 and parameters: {'loss': 'coxph', 'learning_rate': 1.4803157071479093e-06, 'n_estimators': 367, 'criterion': 'friedman_mse', 'min_samples_split': 10, 'min_samples_leaf': 1, 'min_weight_fraction_leaf': 0.12931636244802708, 'min_impurity_decrease': 0.7141809885162289, 'max_features': 0.5129561569102085, 'subsample': 0.09685428217136663, 'dropout_rate': 0.6767602935255022, 'ccp_alpha': 0.0023444276867855204}. Best is trial 964 with value: 0.7879949387224262.[0m
[32m[I 2022-04-15 01:51:37,785][0m Trial 973 finished with value: 0.6371812073302544 and parameters: {'loss': 'coxph', 'learning_rate': 1.5400688853150418e-06, 'n_estimators': 339, 'criterion': 'friedman_mse', 'min_samples_split': 10, 'min_samples_leaf': 1, 'min_weight_fraction_leaf': 0.13132392499206264, 'min_impurity_decrease': 0.7184084518130898, 'max_features': 0.4677919506336063, 'subsample': 0.09757942848912532, 'dropout_rate': 0.6776242550957077, 'ccp_alpha': 0.23392828469395927}. Best is trial 964 with value: 0.7879949387224262.[0m
[32m[I 2022-04-15 01:52:21,058][0m Trial 974 finished with value: 0.7816872766632103 and parameters: {'loss': 'coxph', 'learning_rate': 0.09929206399475213, 'n_estimators': 362, 'criterion': 'friedman_mse', 'min_samples_split': 10, 'min_samples_leaf': 1, 'min_weight_fraction_leaf': 0.11160945299714928, 'min_impurity_decrease': 0.6950449826158129, 'max_features': 0.5026516742144593, 'subsample': 0.10272418594534699, 'dropout_rate': 0.6740050437609817, 'ccp_alpha': 0.09592864138155154}. Best is trial 964 with value: 0.7879949387224262.[0m
[32m[I 2022-04-15 01:53:04,751][0m Trial 975 finished with value: 0.7657102855244948 and parameters: {'loss': 'coxph', 'learning_rate': 1.4431219901904316e-06, 'n_estimators': 375, 'criterion': 'friedman_mse', 'min_samples_split': 10, 'min_samples_leaf': 1, 'min_weight_fraction_leaf': 0.12866981420595902, 'min_impurity_decrease': 0.7377215238865984, 'max_features': 0.5255721396208644, 'subsample': 0.09689547759719383, 'dropout_rate': 0.6780325903327237, 'ccp_alpha': 0.15404022199677317}. Best is trial 964 with value: 0.7879949387224262.[0m
[32m[I 2022-04-15 01:53:19,781][0m Trial 976 finished with value: -0.37507472665476815 and parameters: {'loss': 'squared', 'learning_rate': 1.2966549338455353e-06, 'n_estimators': 356, 'criterion': 'friedman_mse', 'min_samples_split': 10, 'min_samples_leaf': 1, 'min_weight_fraction_leaf': 0.12213687948154074, 'min_impurity_decrease': 0.6726492485728154, 'max_features': 0.518313325378754, 'subsample': 0.11509847098869638, 'dropout_rate': 0.6743748133469966, 'ccp_alpha': 0.09839365942416896}. Best is trial 964 with value: 0.7879949387224262.[0m
[32m[I 2022-04-15 01:54:04,194][0m Trial 977 finished with value: 0.6371812073302544 and parameters: {'loss': 'coxph', 'learning_rate': 1.4712718455998264e-06, 'n_estimators': 399, 'criterion': 'friedman_mse', 'min_samples_split': 10, 'min_samples_leaf': 1, 'min_weight_fraction_leaf': 0.11396282384196926, 'min_impurity_decrease': 0.7075295603928412, 'max_features': 0.5512614205062535, 'subsample': 0.09853869155523935, 'dropout_rate': 0.6787558565953669, 'ccp_alpha': 0.25309852687880546}. Best is trial 964 with value: 0.7879949387224262.[0m
[32m[I 2022-04-15 01:54:56,300][0m Trial 978 finished with value: 0.7878157128980054 and parameters: {'loss': 'coxph', 'learning_rate': 1.0015367777840126e-06, 'n_estimators': 430, 'criterion': 'friedman_mse', 'min_samples_split': 10, 'min_samples_leaf': 1, 'min_weight_fraction_leaf': 0.0990287985217267, 'min_impurity_decrease': 0.6610713327164768, 'max_features': 0.4862779081349955, 'subsample': 0.0975849197009167, 'dropout_rate': 0.7196252273496903, 'ccp_alpha': 0.003975429260531619}. Best is trial 964 with value: 0.7879949387224262.[0m
[32m[I 2022-04-15 01:55:43,391][0m Trial 979 finished with value: 0.7820674586473924 and parameters: {'loss': 'coxph', 'learning_rate': 1.2649475356739254e-06, 'n_estimators': 427, 'criterion': 'friedman_mse', 'min_samples_split': 10, 'min_samples_leaf': 1, 'min_weight_fraction_leaf': 0.09631085403684522, 'min_impurity_decrease': 0.6530275317532835, 'max_features': 0.4826621920955056, 'subsample': 0.12054871654143334, 'dropout_rate': 0.7250889132341133, 'ccp_alpha': 0.09700623567491323}. Best is trial 964 with value: 0.7879949387224262.[0m
[32m[I 2022-04-15 01:56:32,205][0m Trial 980 finished with value: 0.7870659006057659 and parameters: {'loss': 'coxph', 'learning_rate': 1.5506284972045995e-06, 'n_estimators': 404, 'criterion': 'friedman_mse', 'min_samples_split': 10, 'min_samples_leaf': 1, 'min_weight_fraction_leaf': 0.09838292660408626, 'min_impurity_decrease': 0.6584463966760897, 'max_features': 0.5015234534066939, 'subsample': 0.12985710871308434, 'dropout_rate': 0.7200664258272402, 'ccp_alpha': 0.001090328923751516}. Best is trial 964 with value: 0.7879949387224262.[0m
[32m[I 2022-04-15 01:57:20,923][0m Trial 981 finished with value: 0.25 and parameters: {'loss': 'coxph', 'learning_rate': 1.5704717482048791e-06, 'n_estimators': 436, 'criterion': 'squared_error', 'min_samples_split': 10, 'min_samples_leaf': 1, 'min_weight_fraction_leaf': 0.09788413303383711, 'min_impurity_decrease': 0.6924817164009045, 'max_features': 0.47409854672622004, 'subsample': 0.13205015803260217, 'dropout_rate': 0.7265218599821408, 'ccp_alpha': 0.1969842789610239}. Best is trial 964 with value: 0.7879949387224262.[0m
[32m[I 2022-04-15 01:58:03,607][0m Trial 982 finished with value: 0.7874037424852494 and parameters: {'loss': 'coxph', 'learning_rate': 1.5993009601369862e-06, 'n_estimators': 373, 'criterion': 'friedman_mse', 'min_samples_split': 10, 'min_samples_leaf': 1, 'min_weight_fraction_leaf': 0.10392531100791295, 'min_impurity_decrease': 0.6604444477702843, 'max_features': 0.4563435943649572, 'subsample': 0.10615260719912831, 'dropout_rate': 0.7372771450098435, 'ccp_alpha': 0.0022483995756533495}. Best is trial 964 with value: 0.7879949387224262.[0m
[32m[I 2022-04-15 01:58:36,961][0m Trial 983 finished with value: 0.776505216072905 and parameters: {'loss': 'coxph', 'learning_rate': 1.5812314029780526e-06, 'n_estimators': 340, 'criterion': 'friedman_mse', 'min_samples_split': 10, 'min_samples_leaf': 1, 'min_weight_fraction_leaf': 0.1000887666377103, 'min_impurity_decrease': 0.6161913412834158, 'max_features': 0.4447434186141119, 'subsample': 0.1369250052040303, 'dropout_rate': 0.7413885225207546, 'ccp_alpha': 0.11042433279919635}. Best is trial 964 with value: 0.7879949387224262.[0m
[32m[I 2022-04-15 01:59:14,290][0m Trial 984 finished with value: 0.6371812073302544 and parameters: {'loss': 'coxph', 'learning_rate': 1.553598019796351e-06, 'n_estimators': 366, 'criterion': 'friedman_mse', 'min_samples_split': 10, 'min_samples_leaf': 1, 'min_weight_fraction_leaf': 0.10980916717693442, 'min_impurity_decrease': 0.756661485594111, 'max_features': 0.4947067493993487, 'subsample': 0.12680575627630106, 'dropout_rate': 0.7332251275543338, 'ccp_alpha': 0.2420503281819748}. Best is trial 964 with value: 0.7879949387224262.[0m
[32m[I 2022-04-15 02:00:01,194][0m Trial 985 finished with value: 0.25 and parameters: {'loss': 'coxph', 'learning_rate': 1.0079757096455372e-06, 'n_estimators': 431, 'criterion': 'absolute_error', 'min_samples_split': 10, 'min_samples_leaf': 1, 'min_weight_fraction_leaf': 0.08677692579778877, 'min_impurity_decrease': 0.6603407578313518, 'max_features': 0.4762589572362515, 'subsample': 0.1157353759985191, 'dropout_rate': 0.7391200450065818, 'ccp_alpha': 0.0013864294547051726}. Best is trial 964 with value: 0.7879949387224262.[0m
[32m[I 2022-04-15 02:00:42,271][0m Trial 986 finished with value: 0.7506804096746145 and parameters: {'loss': 'coxph', 'learning_rate': 1.5977324372388648e-06, 'n_estimators': 376, 'criterion': 'friedman_mse', 'min_samples_split': 10, 'min_samples_leaf': 1, 'min_weight_fraction_leaf': 0.10530643434348977, 'min_impurity_decrease': 0.724355195178107, 'max_features': 0.46258404864824915, 'subsample': 0.10392212020485503, 'dropout_rate': 0.7181955436362125, 'ccp_alpha': 0.16535449146539}. Best is trial 964 with value: 0.7879949387224262.[0m
[32m[I 2022-04-15 02:01:29,123][0m Trial 987 finished with value: 0.77971009916187 and parameters: {'loss': 'coxph', 'learning_rate': 1.2297561690121937e-06, 'n_estimators': 406, 'criterion': 'friedman_mse', 'min_samples_split': 10, 'min_samples_leaf': 1, 'min_weight_fraction_leaf': 0.12188077504931728, 'min_impurity_decrease': 0.6546217848165995, 'max_features': 0.6099998594451121, 'subsample': 0.10637673407037249, 'dropout_rate': 0.7253808812069099, 'ccp_alpha': 0.10283614676880659}. Best is trial 964 with value: 0.7879949387224262.[0m
[32m[I 2022-04-15 02:02:21,286][0m Trial 988 finished with value: 0.7809089260245899 and parameters: {'loss': 'coxph', 'learning_rate': 1.0010277406927926e-06, 'n_estimators': 441, 'criterion': 'friedman_mse', 'min_samples_split': 10, 'min_samples_leaf': 1, 'min_weight_fraction_leaf': 0.12932227725078285, 'min_impurity_decrease': 0.6218193979206279, 'max_features': 0.505497027126882, 'subsample': 0.13224288216411195, 'dropout_rate': 0.7092428988563136, 'ccp_alpha': 0.09967468808969598}. Best is trial 964 with value: 0.7879949387224262.[0m
[32m[I 2022-04-15 02:03:12,612][0m Trial 989 finished with value: 0.7851732193215748 and parameters: {'loss': 'coxph', 'learning_rate': 1.5966644671324326e-06, 'n_estimators': 419, 'criterion': 'friedman_mse', 'min_samples_split': 10, 'min_samples_leaf': 1, 'min_weight_fraction_leaf': 0.11736377683165009, 'min_impurity_decrease': 0.6958314178351691, 'max_features': 0.45213481088653745, 'subsample': 0.10554048973337535, 'dropout_rate': 0.740539670949729, 'ccp_alpha': 0.0015085784282719953}. Best is trial 964 with value: 0.7879949387224262.[0m
[32m[I 2022-04-15 02:04:02,049][0m Trial 990 finished with value: 0.7860005134659647 and parameters: {'loss': 'coxph', 'learning_rate': 1.5766671973412054e-06, 'n_estimators': 420, 'criterion': 'friedman_mse', 'min_samples_split': 10, 'min_samples_leaf': 1, 'min_weight_fraction_leaf': 0.11712684435089724, 'min_impurity_decrease': 0.7061851045185994, 'max_features': 0.41300202767110555, 'subsample': 0.14607294107746183, 'dropout_rate': 0.737685073079204, 'ccp_alpha': 0.001724139903399282}. Best is trial 964 with value: 0.7879949387224262.[0m
[32m[I 2022-04-15 02:04:45,111][0m Trial 991 finished with value: 0.7812867503122616 and parameters: {'loss': 'coxph', 'learning_rate': 1.6976352680692914e-06, 'n_estimators': 407, 'criterion': 'friedman_mse', 'min_samples_split': 10, 'min_samples_leaf': 1, 'min_weight_fraction_leaf': 0.113229634341842, 'min_impurity_decrease': 0.6941680650174813, 'max_features': 0.42267583474357806, 'subsample': 0.15150153079237746, 'dropout_rate': 0.7380722447073617, 'ccp_alpha': 0.10136386266730978}. Best is trial 964 with value: 0.7879949387224262.[0m
[32m[I 2022-04-15 02:05:24,452][0m Trial 992 finished with value: 0.7371812073302544 and parameters: {'loss': 'coxph', 'learning_rate': 1.5708006271130572e-06, 'n_estimators': 379, 'criterion': 'friedman_mse', 'min_samples_split': 10, 'min_samples_leaf': 1, 'min_weight_fraction_leaf': 0.08048529222266454, 'min_impurity_decrease': 0.718360969524022, 'max_features': 0.45449175709589434, 'subsample': 0.14273876234973507, 'dropout_rate': 0.7532742768609337, 'ccp_alpha': 0.1746428021840322}. Best is trial 964 with value: 0.7879949387224262.[0m
[32m[I 2022-04-15 02:06:14,856][0m Trial 993 finished with value: 0.7875298343410514 and parameters: {'loss': 'coxph', 'learning_rate': 1.3259355132654797e-06, 'n_estimators': 424, 'criterion': 'friedman_mse', 'min_samples_split': 10, 'min_samples_leaf': 1, 'min_weight_fraction_leaf': 0.1039553047317067, 'min_impurity_decrease': 0.7053116557673978, 'max_features': 0.38405142757127597, 'subsample': 0.1330118111109293, 'dropout_rate': 0.745864090219477, 'ccp_alpha': 0.001851874424646148}. Best is trial 964 with value: 0.7879949387224262.[0m
[32m[I 2022-04-15 02:07:02,284][0m Trial 994 finished with value: 0.78623760305874 and parameters: {'loss': 'coxph', 'learning_rate': 1.6794850281705245e-06, 'n_estimators': 417, 'criterion': 'friedman_mse', 'min_samples_split': 10, 'min_samples_leaf': 1, 'min_weight_fraction_leaf': 0.10356188758399854, 'min_impurity_decrease': 0.731579395830142, 'max_features': 0.3769188276411442, 'subsample': 0.15557269838140325, 'dropout_rate': 0.7390065472177788, 'ccp_alpha': 0.002728605648465215}. Best is trial 964 with value: 0.7879949387224262.[0m
[32m[I 2022-04-15 02:07:41,629][0m Trial 995 finished with value: 0.6371812073302544 and parameters: {'loss': 'coxph', 'learning_rate': 1.6959231820230678e-06, 'n_estimators': 397, 'criterion': 'friedman_mse', 'min_samples_split': 10, 'min_samples_leaf': 1, 'min_weight_fraction_leaf': 0.09404089417413132, 'min_impurity_decrease': 0.7419783645213172, 'max_features': 0.3987056943989856, 'subsample': 0.1821384983330214, 'dropout_rate': 0.7723487688630487, 'ccp_alpha': 0.23898793874604832}. Best is trial 964 with value: 0.7879949387224262.[0m
[32m[I 2022-04-15 02:07:57,976][0m Trial 996 finished with value: -0.37447857511361776 and parameters: {'loss': 'squared', 'learning_rate': 1.7331501720061135e-06, 'n_estimators': 416, 'criterion': 'friedman_mse', 'min_samples_split': 10, 'min_samples_leaf': 1, 'min_weight_fraction_leaf': 0.10201217710999091, 'min_impurity_decrease': 0.7070617267685408, 'max_features': 0.35553379467256097, 'subsample': 0.1634720898681895, 'dropout_rate': 0.747212591807068, 'ccp_alpha': 0.09421148513364877}. Best is trial 964 with value: 0.7879949387224262.[0m
[32m[I 2022-04-15 02:08:32,744][0m Trial 997 finished with value: 0.7786310528564805 and parameters: {'loss': 'coxph', 'learning_rate': 1.5078607987176308e-06, 'n_estimators': 351, 'criterion': 'friedman_mse', 'min_samples_split': 10, 'min_samples_leaf': 1, 'min_weight_fraction_leaf': 0.11816197784403941, 'min_impurity_decrease': 0.7357219920180579, 'max_features': 0.37970632253982706, 'subsample': 0.1614701213139419, 'dropout_rate': 0.7421463009142187, 'ccp_alpha': 0.10425502065017979}. Best is trial 964 with value: 0.7879949387224262.[0m
[32m[I 2022-04-15 02:09:11,587][0m Trial 998 finished with value: 0.7371812073302544 and parameters: {'loss': 'coxph', 'learning_rate': 1.3541173883845943e-06, 'n_estimators': 381, 'criterion': 'friedman_mse', 'min_samples_split': 10, 'min_samples_leaf': 1, 'min_weight_fraction_leaf': 0.11295712921717337, 'min_impurity_decrease': 0.7105252545001499, 'max_features': 0.39605197601740033, 'subsample': 0.14736313695965692, 'dropout_rate': 0.7747788350523142, 'ccp_alpha': 0.17552463372125293}. Best is trial 964 with value: 0.7879949387224262.[0m
[32m[I 2022-04-15 02:09:55,542][0m Trial 999 finished with value: 0.7791789002773205 and parameters: {'loss': 'coxph', 'learning_rate': 1.729319474248579e-06, 'n_estimators': 416, 'criterion': 'friedman_mse', 'min_samples_split': 10, 'min_samples_leaf': 1, 'min_weight_fraction_leaf': 0.08530858009348025, 'min_impurity_decrease': 0.6854894483809968, 'max_features': 0.4463369001420521, 'subsample': 0.14754091433349945, 'dropout_rate': 0.7474235401450247, 'ccp_alpha': 0.0985071976150625}. Best is trial 964 with value: 0.7879949387224262.[0m
[32m[I 2022-04-15 02:09:55,548][0m A new study created in memory with name: no-name-b7780b17-dfdf-42ba-a64d-5826b6306baf[0m
[32m[I 2022-04-15 02:11:02,626][0m Trial 0 finished with value: 0.5 and parameters: {'loss': 'coxph', 'learning_rate': 0.003494930134408409, 'n_estimators': 659, 'criterion': 'absolute_error', 'min_samples_split': 7, 'min_samples_leaf': 5, 'min_weight_fraction_leaf': 0.15054448553744781, 'min_impurity_decrease': 0.3147988207337326, 'max_features': 0.01357118263518595, 'subsample': 0.315443330664508, 'dropout_rate': 0.7945644274981877, 'ccp_alpha': 1.9614286570458475}. Best is trial 0 with value: 0.5.[0m
[32m[I 2022-04-15 02:11:08,221][0m Trial 1 finished with value: 0.5 and parameters: {'loss': 'squared', 'learning_rate': 0.03580700895786434, 'n_estimators': 142, 'criterion': 'squared_error', 'min_samples_split': 3, 'min_samples_leaf': 2, 'min_weight_fraction_leaf': 0.4412926463461261, 'min_impurity_decrease': 0.7743291099639533, 'max_features': 0.676879849317377, 'subsample': 0.38289044613321, 'dropout_rate': 0.06189684185205602, 'ccp_alpha': 0.6295784031837987}. Best is trial 0 with value: 0.5.[0m
[32m[I 2022-04-15 02:11:54,606][0m Trial 2 finished with value: 0.5 and parameters: {'loss': 'squared', 'learning_rate': 0.006856832693572604, 'n_estimators': 480, 'criterion': 'friedman_mse', 'min_samples_split': 5, 'min_samples_leaf': 5, 'min_weight_fraction_leaf': 0.3423716052488321, 'min_impurity_decrease': 0.8215634888434132, 'max_features': 0.7780592703307599, 'subsample': 0.3955543019325811, 'dropout_rate': 0.2929858277684657, 'ccp_alpha': 0.6530790476490776}. Best is trial 0 with value: 0.5.[0m
[32m[I 2022-04-15 02:12:05,963][0m Trial 3 finished with value: 0.5 and parameters: {'loss': 'squared', 'learning_rate': 0.02124814883451718, 'n_estimators': 313, 'criterion': 'squared_error', 'min_samples_split': 3, 'min_samples_leaf': 3, 'min_weight_fraction_leaf': 0.41594745369886654, 'min_impurity_decrease': 0.7746939015027313, 'max_features': 0.3151493024196419, 'subsample': 0.5995559862642024, 'dropout_rate': 0.6642257614851085, 'ccp_alpha': 0.5777564065752392}. Best is trial 0 with value: 0.5.[0m
[32m[I 2022-04-15 02:12:19,617][0m Trial 4 finished with value: 0.5 and parameters: {'loss': 'squared', 'learning_rate': 5.930088924830783e-06, 'n_estimators': 217, 'criterion': 'absolute_error', 'min_samples_split': 7, 'min_samples_leaf': 8, 'min_weight_fraction_leaf': 0.21974790209470987, 'min_impurity_decrease': 0.350231016693319, 'max_features': 0.11637183585931826, 'subsample': 0.53901743745655, 'dropout_rate': 0.05095855756223955, 'ccp_alpha': 0.33806191518847256}. Best is trial 0 with value: 0.5.[0m
[32m[I 2022-04-15 02:12:34,890][0m Trial 5 finished with value: 0.5 and parameters: {'loss': 'coxph', 'learning_rate': 1.0514682111863475e-06, 'n_estimators': 161, 'criterion': 'friedman_mse', 'min_samples_split': 10, 'min_samples_leaf': 6, 'min_weight_fraction_leaf': 0.1548363695253914, 'min_impurity_decrease': 0.12710381382671088, 'max_features': 0.0609607903979969, 'subsample': 0.23281535280407367, 'dropout_rate': 0.2667305902221617, 'ccp_alpha': 2.4008276683489704}. Best is trial 0 with value: 0.5.[0m
[32m[I 2022-04-15 02:14:25,518][0m Trial 6 finished with value: 0.5 and parameters: {'loss': 'coxph', 'learning_rate': 0.0003565477445739406, 'n_estimators': 694, 'criterion': 'friedman_mse', 'min_samples_split': 7, 'min_samples_leaf': 10, 'min_weight_fraction_leaf': 0.2365887309417037, 'min_impurity_decrease': 0.5951367816562898, 'max_features': 0.9200079143605299, 'subsample': 0.9058164383889532, 'dropout_rate': 0.47806200100050233, 'ccp_alpha': 1.668326738808789}. Best is trial 0 with value: 0.5.[0m
[32m[I 2022-04-15 02:14:42,088][0m Trial 7 finished with value: 0.5 and parameters: {'loss': 'coxph', 'learning_rate': 0.01304500489311222, 'n_estimators': 145, 'criterion': 'absolute_error', 'min_samples_split': 7, 'min_samples_leaf': 8, 'min_weight_fraction_leaf': 0.45019433933424824, 'min_impurity_decrease': 0.8947099286493395, 'max_features': 0.8716337534453672, 'subsample': 0.9555180901640864, 'dropout_rate': 0.9911749323997981, 'ccp_alpha': 1.4688498627142264}. Best is trial 0 with value: 0.5.[0m
[32m[I 2022-04-15 02:15:16,543][0m Trial 8 finished with value: 0.5 and parameters: {'loss': 'squared', 'learning_rate': 0.03415194571686676, 'n_estimators': 400, 'criterion': 'squared_error', 'min_samples_split': 5, 'min_samples_leaf': 10, 'min_weight_fraction_leaf': 0.3388096786362624, 'min_impurity_decrease': 0.7099586813989354, 'max_features': 0.8441456542748996, 'subsample': 0.18495059214406687, 'dropout_rate': 0.27599932531104965, 'ccp_alpha': 0.050488039577213845}. Best is trial 0 with value: 0.5.[0m
[32m[I 2022-04-15 02:15:42,456][0m Trial 9 finished with value: 0.5 and parameters: {'loss': 'coxph', 'learning_rate': 5.497670251820982e-06, 'n_estimators': 238, 'criterion': 'friedman_mse', 'min_samples_split': 5, 'min_samples_leaf': 3, 'min_weight_fraction_leaf': 0.07576053375238738, 'min_impurity_decrease': 0.9363067817449914, 'max_features': 0.8352512062555122, 'subsample': 0.4152358800985036, 'dropout_rate': 0.26832466953815903, 'ccp_alpha': 3.4939105526496816}. Best is trial 0 with value: 0.5.[0m
