[32m[I 2022-04-14 15:09:14,888][0m Trial 610 finished with value: 0.7798150552133754 and parameters: {'loss': 'coxph', 'learning_rate': 5.575957420744246e-06, 'n_estimators': 921, 'criterion': 'friedman_mse', 'min_samples_split': 10, 'min_samples_leaf': 2, 'min_weight_fraction_leaf': 0.34078909669914303, 'min_impurity_decrease': 0.40001096020511456, 'max_features': 0.8896577662630734, 'subsample': 0.05855644277889498, 'dropout_rate': 0.6584090300869897, 'ccp_alpha': 0.08453334082790413}. Best is trial 595 with value: 0.7828124688588588.[0m
[32m[I 2022-04-14 15:11:10,568][0m Trial 611 finished with value: 0.7761830495640037 and parameters: {'loss': 'coxph', 'learning_rate': 4.130375949872457e-06, 'n_estimators': 745, 'criterion': 'friedman_mse', 'min_samples_split': 10, 'min_samples_leaf': 2, 'min_weight_fraction_leaf': 0.3561977833843182, 'min_impurity_decrease': 0.4391677459558996, 'max_features': 0.8594841235489086, 'subsample': 0.05918046576481909, 'dropout_rate': 0.6731017045446501, 'ccp_alpha': 0.20900996525244075}. Best is trial 595 with value: 0.7828124688588588.[0m
[32m[I 2022-04-14 15:13:35,817][0m Trial 612 finished with value: 0.7823135794484158 and parameters: {'loss': 'coxph', 'learning_rate': 8.229770122139586e-06, 'n_estimators': 790, 'criterion': 'friedman_mse', 'min_samples_split': 10, 'min_samples_leaf': 2, 'min_weight_fraction_leaf': 0.35453502436020984, 'min_impurity_decrease': 0.2883270272949475, 'max_features': 0.895937222019598, 'subsample': 0.028093769852559333, 'dropout_rate': 0.6266886697790448, 'ccp_alpha': 0.0011932624842349447}. Best is trial 595 with value: 0.7828124688588588.[0m
[32m[I 2022-04-14 15:15:30,653][0m Trial 613 finished with value: 0.7792666720897948 and parameters: {'loss': 'coxph', 'learning_rate': 8.346196815084281e-06, 'n_estimators': 706, 'criterion': 'friedman_mse', 'min_samples_split': 10, 'min_samples_leaf': 3, 'min_weight_fraction_leaf': 0.32727105427117126, 'min_impurity_decrease': 0.2632758613521494, 'max_features': 0.9344067657838623, 'subsample': 0.020147441448166103, 'dropout_rate': 0.6445969184605087, 'ccp_alpha': 0.10528237409707328}. Best is trial 595 with value: 0.7828124688588588.[0m
[32m[I 2022-04-14 15:17:36,851][0m Trial 614 finished with value: 0.7795741428633228 and parameters: {'loss': 'coxph', 'learning_rate': 4.914208842449768e-06, 'n_estimators': 738, 'criterion': 'friedman_mse', 'min_samples_split': 10, 'min_samples_leaf': 2, 'min_weight_fraction_leaf': 0.3428279446814302, 'min_impurity_decrease': 0.44081417064014167, 'max_features': 0.9592565368652218, 'subsample': 0.0264445706361332, 'dropout_rate': 0.6249185353987197, 'ccp_alpha': 0.09342178676940081}. Best is trial 595 with value: 0.7828124688588588.[0m
[32m[I 2022-04-14 15:19:49,991][0m Trial 615 finished with value: 0.25 and parameters: {'loss': 'coxph', 'learning_rate': 6.57862176206267e-06, 'n_estimators': 785, 'criterion': 'friedman_mse', 'min_samples_split': 10, 'min_samples_leaf': 2, 'min_weight_fraction_leaf': 0.35048716347802533, 'min_impurity_decrease': 0.28194989091586825, 'max_features': 0.9151852370913008, 'subsample': 0.001733567373989428, 'dropout_rate': 0.6413837369046008, 'ccp_alpha': 0.353329938656777}. Best is trial 595 with value: 0.7828124688588588.[0m
[32m[I 2022-04-14 15:22:01,105][0m Trial 616 finished with value: 0.7796360631121038 and parameters: {'loss': 'coxph', 'learning_rate': 9.192486628042864e-06, 'n_estimators': 784, 'criterion': 'friedman_mse', 'min_samples_split': 10, 'min_samples_leaf': 2, 'min_weight_fraction_leaf': 0.33641848439767685, 'min_impurity_decrease': 0.24946235094665523, 'max_features': 0.8958792075907801, 'subsample': 0.037735241178396356, 'dropout_rate': 0.6865259445913644, 'ccp_alpha': 0.002034098399327073}. Best is trial 595 with value: 0.7828124688588588.[0m
[32m[I 2022-04-14 15:24:26,942][0m Trial 617 finished with value: 0.7780513790175779 and parameters: {'loss': 'coxph', 'learning_rate': 8.067773626746793e-06, 'n_estimators': 810, 'criterion': 'friedman_mse', 'min_samples_split': 10, 'min_samples_leaf': 2, 'min_weight_fraction_leaf': 0.3516066099406449, 'min_impurity_decrease': 0.22085320506695094, 'max_features': 0.9224839505151575, 'subsample': 0.039509146698873426, 'dropout_rate': 0.62564595735276, 'ccp_alpha': 0.1874588136142106}. Best is trial 595 with value: 0.7828124688588588.[0m
[32m[I 2022-04-14 15:27:04,146][0m Trial 618 finished with value: 0.783753686536768 and parameters: {'loss': 'coxph', 'learning_rate': 5.5081406418852335e-06, 'n_estimators': 847, 'criterion': 'friedman_mse', 'min_samples_split': 10, 'min_samples_leaf': 2, 'min_weight_fraction_leaf': 0.30987233413768167, 'min_impurity_decrease': 0.2850724877674894, 'max_features': 0.9783880329830971, 'subsample': 0.01919094917667761, 'dropout_rate': 0.6499484120946291, 'ccp_alpha': 0.005287439224926259}. Best is trial 618 with value: 0.783753686536768.[0m
[32m[I 2022-04-14 15:29:23,409][0m Trial 619 finished with value: 0.25 and parameters: {'loss': 'coxph', 'learning_rate': 3.7995402738928677e-06, 'n_estimators': 783, 'criterion': 'friedman_mse', 'min_samples_split': 10, 'min_samples_leaf': 2, 'min_weight_fraction_leaf': 0.3203729730193795, 'min_impurity_decrease': 0.2729657462267282, 'max_features': 0.9616264783806483, 'subsample': 0.00872712874110196, 'dropout_rate': 0.6135842339717144, 'ccp_alpha': 0.23035130104165644}. Best is trial 618 with value: 0.783753686536768.[0m
[32m[I 2022-04-14 15:31:48,326][0m Trial 620 finished with value: 0.25 and parameters: {'loss': 'coxph', 'learning_rate': 4.4939969428849375e-06, 'n_estimators': 821, 'criterion': 'friedman_mse', 'min_samples_split': 10, 'min_samples_leaf': 2, 'min_weight_fraction_leaf': 0.2918251651219273, 'min_impurity_decrease': 0.25036217063729216, 'max_features': 0.977053450106659, 'subsample': 0.001754230648141064, 'dropout_rate': 0.6263178533980036, 'ccp_alpha': 0.10318688240502627}. Best is trial 618 with value: 0.783753686536768.[0m
[32m[I 2022-04-14 15:33:58,738][0m Trial 621 finished with value: 0.7796907074830675 and parameters: {'loss': 'coxph', 'learning_rate': 1.0524307465048341e-05, 'n_estimators': 739, 'criterion': 'friedman_mse', 'min_samples_split': 10, 'min_samples_leaf': 2, 'min_weight_fraction_leaf': 0.32913649542053697, 'min_impurity_decrease': 0.29212222413724126, 'max_features': 0.9675506070534458, 'subsample': 0.02391364215511262, 'dropout_rate': 0.6638975759148988, 'ccp_alpha': 0.17223773393164488}. Best is trial 618 with value: 0.783753686536768.[0m
[32m[I 2022-04-14 15:36:41,329][0m Trial 622 finished with value: 0.7805624191284252 and parameters: {'loss': 'coxph', 'learning_rate': 5.335006179353914e-06, 'n_estimators': 840, 'criterion': 'friedman_mse', 'min_samples_split': 10, 'min_samples_leaf': 2, 'min_weight_fraction_leaf': 0.30048397395139503, 'min_impurity_decrease': 0.27029852971864593, 'max_features': 0.9772326514218089, 'subsample': 0.024829755790349323, 'dropout_rate': 0.6168478368219974, 'ccp_alpha': 0.08578844642383388}. Best is trial 618 with value: 0.783753686536768.[0m
[32m[I 2022-04-14 15:39:08,360][0m Trial 623 finished with value: 0.7801622678827673 and parameters: {'loss': 'coxph', 'learning_rate': 2.985674913260569e-06, 'n_estimators': 805, 'criterion': 'friedman_mse', 'min_samples_split': 10, 'min_samples_leaf': 2, 'min_weight_fraction_leaf': 0.35963200088187564, 'min_impurity_decrease': 0.2974511361152813, 'max_features': 0.9495747661469652, 'subsample': 0.042073534525254655, 'dropout_rate': 0.6057103190244061, 'ccp_alpha': 0.001808528938090184}. Best is trial 618 with value: 0.783753686536768.[0m
[32m[I 2022-04-14 15:40:36,071][0m Trial 624 finished with value: -0.3704958793308685 and parameters: {'loss': 'squared', 'learning_rate': 8.39550705452757e-06, 'n_estimators': 859, 'criterion': 'friedman_mse', 'min_samples_split': 10, 'min_samples_leaf': 3, 'min_weight_fraction_leaf': 0.30288614490252724, 'min_impurity_decrease': 0.25350880079011245, 'max_features': 0.979734124153856, 'subsample': 0.019839380555957353, 'dropout_rate': 0.6362862761993443, 'ccp_alpha': 0.2986618555815066}. Best is trial 618 with value: 0.783753686536768.[0m
[32m[I 2022-04-14 15:42:35,363][0m Trial 625 finished with value: 0.7801761352207118 and parameters: {'loss': 'coxph', 'learning_rate': 1.414367529390346e-05, 'n_estimators': 757, 'criterion': 'friedman_mse', 'min_samples_split': 10, 'min_samples_leaf': 2, 'min_weight_fraction_leaf': 0.3580151141228005, 'min_impurity_decrease': 0.2891302052181327, 'max_features': 0.9484262584941944, 'subsample': 0.04368988273709957, 'dropout_rate': 0.6912224096498432, 'ccp_alpha': 0.16465012699519407}. Best is trial 618 with value: 0.783753686536768.[0m
[32m[I 2022-04-14 15:45:08,755][0m Trial 626 finished with value: 0.78111241357041 and parameters: {'loss': 'coxph', 'learning_rate': 6.980917807152638e-06, 'n_estimators': 878, 'criterion': 'friedman_mse', 'min_samples_split': 10, 'min_samples_leaf': 2, 'min_weight_fraction_leaf': 0.35995231673602074, 'min_impurity_decrease': 0.35967554110100114, 'max_features': 0.992498995127556, 'subsample': 0.06658393118974783, 'dropout_rate': 0.6607804591568734, 'ccp_alpha': 0.08591669823068325}. Best is trial 618 with value: 0.783753686536768.[0m
[32m[I 2022-04-14 15:47:34,626][0m Trial 627 finished with value: 0.7582624900996014 and parameters: {'loss': 'coxph', 'learning_rate': 5.21027151583513e-06, 'n_estimators': 838, 'criterion': 'friedman_mse', 'min_samples_split': 10, 'min_samples_leaf': 2, 'min_weight_fraction_leaf': 0.31106678932477677, 'min_impurity_decrease': 0.36629801230875136, 'max_features': 0.9829789180083056, 'subsample': 0.06300562584946245, 'dropout_rate': 0.6744946166920993, 'ccp_alpha': 0.26740427337863665}. Best is trial 618 with value: 0.783753686536768.[0m
[32m[I 2022-04-14 15:49:36,541][0m Trial 628 finished with value: 0.7793979908684381 and parameters: {'loss': 'coxph', 'learning_rate': 4.069426303050879e-06, 'n_estimators': 790, 'criterion': 'friedman_mse', 'min_samples_split': 10, 'min_samples_leaf': 2, 'min_weight_fraction_leaf': 0.34368013328630515, 'min_impurity_decrease': 0.40284443103715656, 'max_features': 0.9978562347496764, 'subsample': 0.06367547206828422, 'dropout_rate': 0.7274423752621443, 'ccp_alpha': 0.16694109698077556}. Best is trial 618 with value: 0.783753686536768.[0m
[32m[I 2022-04-14 15:52:12,170][0m Trial 629 finished with value: 0.7277099471879545 and parameters: {'loss': 'coxph', 'learning_rate': 7.047106266667876e-06, 'n_estimators': 877, 'criterion': 'friedman_mse', 'min_samples_split': 10, 'min_samples_leaf': 3, 'min_weight_fraction_leaf': 0.33478646003121637, 'min_impurity_decrease': 0.3598162788172494, 'max_features': 0.9906226631857366, 'subsample': 0.03560424716735472, 'dropout_rate': 0.666841624973911, 'ccp_alpha': 0.475641969307784}. Best is trial 618 with value: 0.783753686536768.[0m
[32m[I 2022-04-14 15:54:27,282][0m Trial 630 finished with value: 0.7805856044227916 and parameters: {'loss': 'coxph', 'learning_rate': 5.387330552941813e-06, 'n_estimators': 839, 'criterion': 'friedman_mse', 'min_samples_split': 10, 'min_samples_leaf': 2, 'min_weight_fraction_leaf': 0.35580443161594005, 'min_impurity_decrease': 0.3757865721648807, 'max_features': 0.9708539784434144, 'subsample': 0.04193374867453581, 'dropout_rate': 0.7156099451753067, 'ccp_alpha': 0.10444076095425148}. Best is trial 618 with value: 0.783753686536768.[0m
[32m[I 2022-04-14 15:56:31,009][0m Trial 631 finished with value: 0.7810546100014214 and parameters: {'loss': 'coxph', 'learning_rate': 6.9332499850264735e-06, 'n_estimators': 713, 'criterion': 'friedman_mse', 'min_samples_split': 10, 'min_samples_leaf': 2, 'min_weight_fraction_leaf': 0.3620170391233805, 'min_impurity_decrease': 0.3607457151072038, 'max_features': 0.9893065143165909, 'subsample': 0.06802593636557704, 'dropout_rate': 0.6229807152175959, 'ccp_alpha': 0.0022360464139791767}. Best is trial 618 with value: 0.783753686536768.[0m
[32m[I 2022-04-14 15:58:33,908][0m Trial 632 finished with value: 0.7798919526540964 and parameters: {'loss': 'coxph', 'learning_rate': 3.3789643134813313e-06, 'n_estimators': 744, 'criterion': 'friedman_mse', 'min_samples_split': 10, 'min_samples_leaf': 2, 'min_weight_fraction_leaf': 0.3433835542937849, 'min_impurity_decrease': 0.4258182902462168, 'max_features': 0.9600265968554076, 'subsample': 0.014699277076069016, 'dropout_rate': 0.6484313575100482, 'ccp_alpha': 0.3615446964045387}. Best is trial 618 with value: 0.783753686536768.[0m
[32m[I 2022-04-14 16:00:27,484][0m Trial 633 finished with value: 0.7748486450430044 and parameters: {'loss': 'coxph', 'learning_rate': 6.08174384570897e-06, 'n_estimators': 712, 'criterion': 'friedman_mse', 'min_samples_split': 10, 'min_samples_leaf': 2, 'min_weight_fraction_leaf': 0.3634244418765483, 'min_impurity_decrease': 0.37872049413252906, 'max_features': 0.972889198158257, 'subsample': 0.05709475595967636, 'dropout_rate': 0.6355294093697956, 'ccp_alpha': 0.2433673924906229}. Best is trial 618 with value: 0.783753686536768.[0m
[32m[I 2022-04-14 16:02:25,837][0m Trial 634 finished with value: 0.7805112236864526 and parameters: {'loss': 'coxph', 'learning_rate': 4.640584132590143e-06, 'n_estimators': 762, 'criterion': 'friedman_mse', 'min_samples_split': 10, 'min_samples_leaf': 2, 'min_weight_fraction_leaf': 0.35520991047787104, 'min_impurity_decrease': 0.3597924013158602, 'max_features': 0.9894010250984909, 'subsample': 0.07024197469541427, 'dropout_rate': 0.7004174835631148, 'ccp_alpha': 0.08900203949411063}. Best is trial 618 with value: 0.783753686536768.[0m
[32m[I 2022-04-14 16:04:30,410][0m Trial 635 finished with value: 0.7804121162613609 and parameters: {'loss': 'coxph', 'learning_rate': 6.577668111113253e-06, 'n_estimators': 745, 'criterion': 'friedman_mse', 'min_samples_split': 10, 'min_samples_leaf': 2, 'min_weight_fraction_leaf': 0.36061127108149293, 'min_impurity_decrease': 0.3936441422603188, 'max_features': 0.9948399440183553, 'subsample': 0.04584201013716166, 'dropout_rate': 0.6594193003805544, 'ccp_alpha': 0.0026378221161368156}. Best is trial 618 with value: 0.783753686536768.[0m
[32m[I 2022-04-14 16:06:20,223][0m Trial 636 finished with value: 0.7816587757080976 and parameters: {'loss': 'coxph', 'learning_rate': 7.175675380595272e-06, 'n_estimators': 673, 'criterion': 'friedman_mse', 'min_samples_split': 10, 'min_samples_leaf': 2, 'min_weight_fraction_leaf': 0.3261617760854508, 'min_impurity_decrease': 0.3520113304432936, 'max_features': 0.9975190555490938, 'subsample': 0.03140132854933433, 'dropout_rate': 0.6506733605226337, 'ccp_alpha': 0.16977985753045308}. Best is trial 618 with value: 0.783753686536768.[0m
[32m[I 2022-04-14 16:08:21,322][0m Trial 637 finished with value: 0.25 and parameters: {'loss': 'coxph', 'learning_rate': 5.789613570433114e-06, 'n_estimators': 715, 'criterion': 'friedman_mse', 'min_samples_split': 10, 'min_samples_leaf': 2, 'min_weight_fraction_leaf': 0.3345461815772585, 'min_impurity_decrease': 0.3958766634825701, 'max_features': 0.9975755898879545, 'subsample': 0.00802180860555909, 'dropout_rate': 0.6485908071071693, 'ccp_alpha': 0.3372931173366571}. Best is trial 618 with value: 0.783753686536768.[0m
[32m[I 2022-04-14 16:10:11,747][0m Trial 638 finished with value: 0.7778291437939451 and parameters: {'loss': 'coxph', 'learning_rate': 4.437368321365899e-06, 'n_estimators': 689, 'criterion': 'friedman_mse', 'min_samples_split': 10, 'min_samples_leaf': 2, 'min_weight_fraction_leaf': 0.3338660614958134, 'min_impurity_decrease': 0.354484959262766, 'max_features': 0.9992605535026223, 'subsample': 0.030170595287195994, 'dropout_rate': 0.6798302702817616, 'ccp_alpha': 0.23808268910615743}. Best is trial 618 with value: 0.783753686536768.[0m
[32m[I 2022-04-14 16:12:00,938][0m Trial 639 finished with value: 0.778498520055416 and parameters: {'loss': 'coxph', 'learning_rate': 7.2094081850258e-06, 'n_estimators': 682, 'criterion': 'friedman_mse', 'min_samples_split': 10, 'min_samples_leaf': 2, 'min_weight_fraction_leaf': 0.3293293727492539, 'min_impurity_decrease': 0.37109975775370635, 'max_features': 0.9970898114560238, 'subsample': 0.03761161722432639, 'dropout_rate': 0.6436420597260473, 'ccp_alpha': 0.19706204628595647}. Best is trial 618 with value: 0.783753686536768.[0m
[32m[I 2022-04-14 16:13:39,541][0m Trial 640 finished with value: 0.7672801391993207 and parameters: {'loss': 'coxph', 'learning_rate': 5.248174108053687e-06, 'n_estimators': 661, 'criterion': 'friedman_mse', 'min_samples_split': 10, 'min_samples_leaf': 2, 'min_weight_fraction_leaf': 0.3123935374855039, 'min_impurity_decrease': 0.418962733704959, 'max_features': 0.9836217900239649, 'subsample': 0.01300010866874562, 'dropout_rate': 0.6639416552605603, 'ccp_alpha': 0.5583841739470904}. Best is trial 618 with value: 0.783753686536768.[0m
[32m[I 2022-04-14 16:15:09,781][0m Trial 641 finished with value: 0.25 and parameters: {'loss': 'coxph', 'learning_rate': 7.266541807934106e-06, 'n_estimators': 630, 'criterion': 'friedman_mse', 'min_samples_split': 10, 'min_samples_leaf': 3, 'min_weight_fraction_leaf': 0.32131498486685317, 'min_impurity_decrease': 0.35429671004744556, 'max_features': 0.9988301074250157, 'subsample': 0.003427011283826359, 'dropout_rate': 0.6953048010667959, 'ccp_alpha': 0.16348101474580587}. Best is trial 618 with value: 0.783753686536768.[0m
[32m[I 2022-04-14 16:16:05,706][0m Trial 642 finished with value: -0.3731879592746845 and parameters: {'loss': 'squared', 'learning_rate': 3.4952130723920297e-06, 'n_estimators': 708, 'criterion': 'friedman_mse', 'min_samples_split': 10, 'min_samples_leaf': 2, 'min_weight_fraction_leaf': 0.3217910815892943, 'min_impurity_decrease': 0.3784039801164314, 'max_features': 0.9633209772948459, 'subsample': 0.04451052537993103, 'dropout_rate': 0.6682290470492087, 'ccp_alpha': 0.09461659053075254}. Best is trial 618 with value: 0.783753686536768.[0m
[32m[I 2022-04-14 16:17:55,389][0m Trial 643 finished with value: 0.7618947884748647 and parameters: {'loss': 'coxph', 'learning_rate': 8.789111574259582e-06, 'n_estimators': 678, 'criterion': 'friedman_mse', 'min_samples_split': 10, 'min_samples_leaf': 2, 'min_weight_fraction_leaf': 0.342441050121861, 'min_impurity_decrease': 0.3420721858826431, 'max_features': 0.9774878440896747, 'subsample': 0.029073003940266018, 'dropout_rate': 0.6504450842918864, 'ccp_alpha': 0.42640196433366956}. Best is trial 618 with value: 0.783753686536768.[0m
[32m[I 2022-04-14 16:19:37,977][0m Trial 644 finished with value: 0.7599636492197506 and parameters: {'loss': 'coxph', 'learning_rate': 6.276887427302726e-06, 'n_estimators': 643, 'criterion': 'friedman_mse', 'min_samples_split': 10, 'min_samples_leaf': 2, 'min_weight_fraction_leaf': 0.34673870041752053, 'min_impurity_decrease': 0.4027755718761299, 'max_features': 0.9598462844685982, 'subsample': 0.07040353118588932, 'dropout_rate': 0.6245443046115833, 'ccp_alpha': 0.2634582213007334}. Best is trial 618 with value: 0.783753686536768.[0m
[32m[I 2022-04-14 16:21:47,323][0m Trial 645 finished with value: 0.7810054874057364 and parameters: {'loss': 'coxph', 'learning_rate': 4.7330178173726115e-06, 'n_estimators': 716, 'criterion': 'friedman_mse', 'min_samples_split': 10, 'min_samples_leaf': 2, 'min_weight_fraction_leaf': 0.3276427780559693, 'min_impurity_decrease': 0.36207341382916913, 'max_features': 0.9822364953222448, 'subsample': 0.0534091371167741, 'dropout_rate': 0.6308707784710332, 'ccp_alpha': 0.0013050410272545084}. Best is trial 618 with value: 0.783753686536768.[0m
[32m[I 2022-04-14 16:23:48,750][0m Trial 646 finished with value: 0.7796630860790257 and parameters: {'loss': 'coxph', 'learning_rate': 2.857158198005449e-06, 'n_estimators': 758, 'criterion': 'friedman_mse', 'min_samples_split': 10, 'min_samples_leaf': 2, 'min_weight_fraction_leaf': 0.3406095778115783, 'min_impurity_decrease': 0.3501239082487403, 'max_features': 0.9751060751061651, 'subsample': 0.07847212615845445, 'dropout_rate': 0.6824533158598414, 'ccp_alpha': 0.1528831322363492}. Best is trial 618 with value: 0.783753686536768.[0m
[32m[I 2022-04-14 16:26:08,840][0m Trial 647 finished with value: 0.7794502757525762 and parameters: {'loss': 'coxph', 'learning_rate': 8.336602737598816e-06, 'n_estimators': 781, 'criterion': 'friedman_mse', 'min_samples_split': 10, 'min_samples_leaf': 2, 'min_weight_fraction_leaf': 0.35441345171214056, 'min_impurity_decrease': 0.43759706486186023, 'max_features': 0.951448412272784, 'subsample': 0.026467067149250928, 'dropout_rate': 0.6563721274529015, 'ccp_alpha': 0.09508080100400981}. Best is trial 618 with value: 0.783753686536768.[0m
[32m[I 2022-04-14 16:28:15,098][0m Trial 648 finished with value: 0.7605134671698608 and parameters: {'loss': 'coxph', 'learning_rate': 6.21455024056436e-06, 'n_estimators': 729, 'criterion': 'friedman_mse', 'min_samples_split': 10, 'min_samples_leaf': 3, 'min_weight_fraction_leaf': 0.3114963051953438, 'min_impurity_decrease': 0.34070943730567466, 'max_features': 0.9649412425075895, 'subsample': 0.051867888506145744, 'dropout_rate': 0.6168469073906045, 'ccp_alpha': 0.31960980508311987}. Best is trial 618 with value: 0.783753686536768.[0m
[32m[I 2022-04-14 16:30:10,973][0m Trial 649 finished with value: 0.7801463813631917 and parameters: {'loss': 'coxph', 'learning_rate': 9.796972008541515e-06, 'n_estimators': 684, 'criterion': 'friedman_mse', 'min_samples_split': 10, 'min_samples_leaf': 2, 'min_weight_fraction_leaf': 0.35001880389466455, 'min_impurity_decrease': 0.38999669600507975, 'max_features': 0.9426776688873187, 'subsample': 0.07935920139484157, 'dropout_rate': 0.6284777578347056, 'ccp_alpha': 0.09367331708876869}. Best is trial 618 with value: 0.783753686536768.[0m
