[32m[I 2022-04-16 16:53:13,368][0m Trial 702 finished with value: 0.786968267771678 and parameters: {'n_hidden': 1024, 'mixture_components': 7, 'use_sparse_layer': False, 'use_batchnorm': False, 'use_dropout': True, 'dropout': 0.672746940581583, 'mlp_size_1': 2, 'mlp_size_2': 4, 'mlp_size_3': 1, 'kernel': 'Gamma', 'loss_name': 'AlternativeNLLLoss'}. Best is trial 634 with value: 0.8878076973253428.[0m
[32m[I 2022-04-16 16:55:39,528][0m Trial 703 finished with value: 0.888409937792888 and parameters: {'n_hidden': 1024, 'mixture_components': 8, 'use_sparse_layer': False, 'use_batchnorm': False, 'use_dropout': True, 'dropout': 0.7169735930903173, 'mlp_size_1': 2, 'mlp_size_2': 4, 'mlp_size_3': 1, 'kernel': 'Gamma', 'loss_name': 'AlternativeNLLLoss'}. Best is trial 703 with value: 0.888409937792888.[0m
[32m[I 2022-04-16 16:57:59,629][0m Trial 704 finished with value: 0.8891333137081187 and parameters: {'n_hidden': 1024, 'mixture_components': 8, 'use_sparse_layer': False, 'use_batchnorm': False, 'use_dropout': True, 'dropout': 0.6400458355781498, 'mlp_size_1': 2, 'mlp_size_2': 4, 'mlp_size_3': 1, 'kernel': 'Gamma', 'loss_name': 'AlternativeNLLLoss'}. Best is trial 704 with value: 0.8891333137081187.[0m
[32m[I 2022-04-16 17:00:18,326][0m Trial 705 finished with value: 0.8855320677688457 and parameters: {'n_hidden': 1024, 'mixture_components': 8, 'use_sparse_layer': False, 'use_batchnorm': False, 'use_dropout': True, 'dropout': 0.6636987321033823, 'mlp_size_1': 2, 'mlp_size_2': 4, 'mlp_size_3': 1, 'kernel': 'Gamma', 'loss_name': 'AlternativeNLLLoss'}. Best is trial 704 with value: 0.8891333137081187.[0m
[32m[I 2022-04-16 17:02:39,813][0m Trial 706 finished with value: 0.885044386842958 and parameters: {'n_hidden': 1024, 'mixture_components': 8, 'use_sparse_layer': False, 'use_batchnorm': False, 'use_dropout': True, 'dropout': 0.7140289663237772, 'mlp_size_1': 2, 'mlp_size_2': 4, 'mlp_size_3': 1, 'kernel': 'Gamma', 'loss_name': 'AlternativeNLLLoss'}. Best is trial 704 with value: 0.8891333137081187.[0m
[32m[I 2022-04-16 17:05:51,351][0m Trial 707 finished with value: 0.7714744808045582 and parameters: {'n_hidden': 1024, 'mixture_components': 8, 'use_sparse_layer': False, 'use_batchnorm': True, 'use_dropout': False, 'mlp_size_1': 2, 'mlp_size_2': 4, 'mlp_size_3': 1, 'kernel': 'Gamma', 'loss_name': 'AlternativeNLLLoss'}. Best is trial 704 with value: 0.8891333137081187.[0m
[32m[I 2022-04-16 17:09:25,130][0m Trial 708 finished with value: 0.8810920609143175 and parameters: {'n_hidden': 32, 'mixture_components': 8, 'use_sparse_layer': False, 'use_batchnorm': False, 'use_dropout': True, 'dropout': 0.7503407526948462, 'mlp_size_1': 2, 'mlp_size_2': 0, 'mlp_size_3': 0, 'kernel': 'Gamma', 'loss_name': 'AlternativeNLLLoss'}. Best is trial 704 with value: 0.8891333137081187.[0m
[32m[I 2022-04-16 17:11:53,196][0m Trial 709 finished with value: 0.8855890018817518 and parameters: {'n_hidden': 1024, 'mixture_components': 8, 'use_sparse_layer': False, 'use_batchnorm': False, 'use_dropout': True, 'dropout': 0.769861277964005, 'mlp_size_1': 2, 'mlp_size_2': 4, 'mlp_size_3': 1, 'kernel': 'Gamma', 'loss_name': 'AlternativeNLLLoss'}. Best is trial 704 with value: 0.8891333137081187.[0m
[32m[I 2022-04-16 17:14:34,443][0m Trial 710 finished with value: 0.8870287468282161 and parameters: {'n_hidden': 1024, 'mixture_components': 7, 'use_sparse_layer': False, 'use_batchnorm': False, 'use_dropout': True, 'dropout': 0.7239386105865625, 'mlp_size_1': 2, 'mlp_size_2': 4, 'mlp_size_3': 1, 'kernel': 'Gamma', 'loss_name': 'AlternativeNLLLoss'}. Best is trial 704 with value: 0.8891333137081187.[0m
[32m[I 2022-04-16 17:17:17,433][0m Trial 711 finished with value: 0.8848786213979689 and parameters: {'n_hidden': 1024, 'mixture_components': 7, 'use_sparse_layer': False, 'use_batchnorm': False, 'use_dropout': True, 'dropout': 0.7087898240043153, 'mlp_size_1': 2, 'mlp_size_2': 4, 'mlp_size_3': 1, 'kernel': 'Gamma', 'loss_name': 'AlternativeNLLLoss'}. Best is trial 704 with value: 0.8891333137081187.[0m
[32m[I 2022-04-16 17:19:38,034][0m Trial 712 finished with value: 0.8868650195394047 and parameters: {'n_hidden': 1024, 'mixture_components': 7, 'use_sparse_layer': False, 'use_batchnorm': False, 'use_dropout': True, 'dropout': 0.7345913294855164, 'mlp_size_1': 2, 'mlp_size_2': 4, 'mlp_size_3': 1, 'kernel': 'Gamma', 'loss_name': 'AlternativeNLLLoss'}. Best is trial 704 with value: 0.8891333137081187.[0m
[32m[I 2022-04-16 17:21:53,138][0m Trial 713 finished with value: 0.8844420958828169 and parameters: {'n_hidden': 1024, 'mixture_components': 7, 'use_sparse_layer': False, 'use_batchnorm': False, 'use_dropout': True, 'dropout': 0.7245701988416325, 'mlp_size_1': 2, 'mlp_size_2': 4, 'mlp_size_3': 1, 'kernel': 'Gamma', 'loss_name': 'AlternativeNLLLoss'}. Best is trial 704 with value: 0.8891333137081187.[0m
[32m[I 2022-04-16 17:24:16,065][0m Trial 714 finished with value: 0.8874433408398325 and parameters: {'n_hidden': 1024, 'mixture_components': 7, 'use_sparse_layer': False, 'use_batchnorm': False, 'use_dropout': True, 'dropout': 0.7694882146541188, 'mlp_size_1': 2, 'mlp_size_2': 4, 'mlp_size_3': 1, 'kernel': 'Gamma', 'loss_name': 'AlternativeNLLLoss'}. Best is trial 704 with value: 0.8891333137081187.[0m
[32m[I 2022-04-16 17:26:53,935][0m Trial 715 finished with value: 0.8868724592503561 and parameters: {'n_hidden': 1024, 'mixture_components': 7, 'use_sparse_layer': False, 'use_batchnorm': False, 'use_dropout': True, 'dropout': 0.7422178287627528, 'mlp_size_1': 2, 'mlp_size_2': 4, 'mlp_size_3': 1, 'kernel': 'Gamma', 'loss_name': 'AlternativeNLLLoss'}. Best is trial 704 with value: 0.8891333137081187.[0m
[32m[I 2022-04-16 17:29:17,766][0m Trial 716 finished with value: 0.8824988788257034 and parameters: {'n_hidden': 1024, 'mixture_components': 7, 'use_sparse_layer': False, 'use_batchnorm': False, 'use_dropout': True, 'dropout': 0.7679241997242037, 'mlp_size_1': 2, 'mlp_size_2': 4, 'mlp_size_3': 1, 'kernel': 'Gamma', 'loss_name': 'AlternativeNLLLoss'}. Best is trial 704 with value: 0.8891333137081187.[0m
[32m[I 2022-04-16 17:32:03,316][0m Trial 717 finished with value: 0.885904535916581 and parameters: {'n_hidden': 128, 'mixture_components': 7, 'use_sparse_layer': False, 'use_batchnorm': False, 'use_dropout': True, 'dropout': 0.7412160950619716, 'mlp_size_1': 2, 'mlp_size_2': 2, 'mlp_size_3': 0, 'kernel': 'Gamma', 'loss_name': 'AlternativeNLLLoss'}. Best is trial 704 with value: 0.8891333137081187.[0m
[32m[I 2022-04-16 17:34:40,344][0m Trial 718 finished with value: 0.8816886051511519 and parameters: {'n_hidden': 1024, 'mixture_components': 7, 'use_sparse_layer': False, 'use_batchnorm': False, 'use_dropout': True, 'dropout': 0.8182720254706726, 'mlp_size_1': 6, 'mlp_size_2': 1, 'mlp_size_3': 0, 'kernel': 'Gamma', 'loss_name': 'AlternativeNLLLoss'}. Best is trial 704 with value: 0.8891333137081187.[0m
[32m[I 2022-04-16 17:37:04,213][0m Trial 719 finished with value: 0.8849960240855006 and parameters: {'n_hidden': 512, 'mixture_components': 7, 'use_sparse_layer': False, 'use_batchnorm': False, 'use_dropout': True, 'dropout': 0.7744268575076665, 'mlp_size_1': 2, 'mlp_size_2': 4, 'mlp_size_3': 0, 'kernel': 'Gamma', 'loss_name': 'AlternativeNLLLoss'}. Best is trial 704 with value: 0.8891333137081187.[0m
[32m[I 2022-04-16 17:39:21,969][0m Trial 720 finished with value: 0.8865069638307734 and parameters: {'n_hidden': 1024, 'mixture_components': 7, 'use_sparse_layer': False, 'use_batchnorm': False, 'use_dropout': True, 'dropout': 0.7917316451293034, 'mlp_size_1': 3, 'mlp_size_2': 4, 'mlp_size_3': 0, 'kernel': 'Gamma', 'loss_name': 'AlternativeNLLLoss'}. Best is trial 704 with value: 0.8891333137081187.[0m
[32m[I 2022-04-16 17:41:58,734][0m Trial 721 finished with value: 0.8870271219423602 and parameters: {'n_hidden': 1024, 'mixture_components': 7, 'use_sparse_layer': False, 'use_batchnorm': False, 'use_dropout': True, 'dropout': 0.7827529936889974, 'mlp_size_1': 2, 'mlp_size_2': 4, 'mlp_size_3': 1, 'kernel': 'Gamma', 'loss_name': 'AlternativeNLLLoss'}. Best is trial 704 with value: 0.8891333137081187.[0m
[32m[I 2022-04-16 17:44:55,891][0m Trial 722 finished with value: 0.8814516655345106 and parameters: {'n_hidden': 64, 'mixture_components': 7, 'use_sparse_layer': False, 'use_batchnorm': False, 'use_dropout': True, 'dropout': 0.7537088619678151, 'mlp_size_1': 2, 'mlp_size_2': 1, 'mlp_size_3': 0, 'kernel': 'Gamma', 'loss_name': 'AlternativeNLLLoss'}. Best is trial 704 with value: 0.8891333137081187.[0m
[32m[I 2022-04-16 17:47:21,321][0m Trial 723 finished with value: 0.8860629643449611 and parameters: {'n_hidden': 1024, 'mixture_components': 7, 'use_sparse_layer': False, 'use_batchnorm': False, 'use_dropout': True, 'dropout': 0.7796627004947665, 'mlp_size_1': 2, 'mlp_size_2': 4, 'mlp_size_3': 1, 'kernel': 'Gamma', 'loss_name': 'AlternativeNLLLoss'}. Best is trial 704 with value: 0.8891333137081187.[0m
[32m[I 2022-04-16 17:49:57,782][0m Trial 724 finished with value: 0.8859618501469502 and parameters: {'n_hidden': 1024, 'mixture_components': 7, 'use_sparse_layer': False, 'use_batchnorm': False, 'use_dropout': True, 'dropout': 0.7938402938228072, 'mlp_size_1': 2, 'mlp_size_2': 4, 'mlp_size_3': 1, 'kernel': 'Gamma', 'loss_name': 'AlternativeNLLLoss'}. Best is trial 704 with value: 0.8891333137081187.[0m
[32m[I 2022-04-16 17:52:55,973][0m Trial 725 finished with value: 0.8860214556537432 and parameters: {'n_hidden': 2048, 'mixture_components': 7, 'use_sparse_layer': False, 'use_batchnorm': False, 'use_dropout': True, 'dropout': 0.7396148076969289, 'mlp_size_1': 3, 'mlp_size_2': 4, 'mlp_size_3': 1, 'kernel': 'Gamma', 'loss_name': 'AlternativeNLLLoss'}. Best is trial 704 with value: 0.8891333137081187.[0m
[32m[I 2022-04-16 17:55:30,917][0m Trial 726 finished with value: 0.8830333041862168 and parameters: {'n_hidden': 1024, 'mixture_components': 7, 'use_sparse_layer': False, 'use_batchnorm': False, 'use_dropout': True, 'dropout': 0.8234769146617835, 'mlp_size_1': 2, 'mlp_size_2': 4, 'mlp_size_3': 1, 'kernel': 'Gamma', 'loss_name': 'AlternativeNLLLoss'}. Best is trial 704 with value: 0.8891333137081187.[0m
[32m[I 2022-04-16 17:58:50,862][0m Trial 727 finished with value: 0.8686703018647902 and parameters: {'n_hidden': 1024, 'mixture_components': 7, 'use_sparse_layer': False, 'use_batchnorm': True, 'use_dropout': False, 'mlp_size_1': 2, 'mlp_size_2': 4, 'mlp_size_3': 1, 'kernel': 'Gamma', 'loss_name': 'AlternativeNLLLoss'}. Best is trial 704 with value: 0.8891333137081187.[0m
[32m[I 2022-04-16 18:01:18,133][0m Trial 728 finished with value: 0.8851072749618728 and parameters: {'n_hidden': 1024, 'mixture_components': 7, 'use_sparse_layer': False, 'use_batchnorm': False, 'use_dropout': True, 'dropout': 0.800549771695922, 'mlp_size_1': 2, 'mlp_size_2': 4, 'mlp_size_3': 1, 'kernel': 'Gamma', 'loss_name': 'AlternativeNLLLoss'}. Best is trial 704 with value: 0.8891333137081187.[0m
[32m[I 2022-04-16 18:03:53,997][0m Trial 729 finished with value: 0.8847986774925782 and parameters: {'n_hidden': 1024, 'mixture_components': 7, 'use_sparse_layer': False, 'use_batchnorm': False, 'use_dropout': True, 'dropout': 0.7511934983876224, 'mlp_size_1': 2, 'mlp_size_2': 4, 'mlp_size_3': 1, 'kernel': 'Gamma', 'loss_name': 'AlternativeNLLLoss'}. Best is trial 704 with value: 0.8891333137081187.[0m
[32m[I 2022-04-16 18:06:35,270][0m Trial 730 finished with value: 0.8858974374258846 and parameters: {'n_hidden': 1024, 'mixture_components': 7, 'use_sparse_layer': False, 'use_batchnorm': False, 'use_dropout': True, 'dropout': 0.8104854510815529, 'mlp_size_1': 2, 'mlp_size_2': 4, 'mlp_size_3': 1, 'kernel': 'Gamma', 'loss_name': 'AlternativeNLLLoss'}. Best is trial 704 with value: 0.8891333137081187.[0m
[32m[I 2022-04-16 18:09:24,587][0m Trial 731 finished with value: 0.886756574193293 and parameters: {'n_hidden': 1024, 'mixture_components': 7, 'use_sparse_layer': False, 'use_batchnorm': False, 'use_dropout': True, 'dropout': 0.7589872975143721, 'mlp_size_1': 2, 'mlp_size_2': 4, 'mlp_size_3': 1, 'kernel': 'Gamma', 'loss_name': 'AlternativeNLLLoss'}. Best is trial 704 with value: 0.8891333137081187.[0m
[32m[I 2022-04-16 18:12:10,031][0m Trial 732 finished with value: 0.881164403860131 and parameters: {'n_hidden': 1024, 'mixture_components': 6, 'use_sparse_layer': False, 'use_batchnorm': False, 'use_dropout': True, 'dropout': 0.846848741591963, 'mlp_size_1': 2, 'mlp_size_2': 4, 'mlp_size_3': 1, 'kernel': 'Gamma', 'loss_name': 'AlternativeNLLLoss'}. Best is trial 704 with value: 0.8891333137081187.[0m
[32m[I 2022-04-16 18:14:54,076][0m Trial 733 finished with value: 0.8873648805372207 and parameters: {'n_hidden': 1024, 'mixture_components': 7, 'use_sparse_layer': False, 'use_batchnorm': False, 'use_dropout': True, 'dropout': 0.7162090334928088, 'mlp_size_1': 2, 'mlp_size_2': 4, 'mlp_size_3': 1, 'kernel': 'Gamma', 'loss_name': 'AlternativeNLLLoss'}. Best is trial 704 with value: 0.8891333137081187.[0m
[32m[I 2022-04-16 18:17:16,062][0m Trial 734 finished with value: 0.886756756547495 and parameters: {'n_hidden': 1024, 'mixture_components': 7, 'use_sparse_layer': False, 'use_batchnorm': False, 'use_dropout': True, 'dropout': 0.7225132982170952, 'mlp_size_1': 2, 'mlp_size_2': 4, 'mlp_size_3': 1, 'kernel': 'Gamma', 'loss_name': 'AlternativeNLLLoss'}. Best is trial 704 with value: 0.8891333137081187.[0m
[32m[I 2022-04-16 18:19:28,384][0m Trial 735 finished with value: 0.8855076905856005 and parameters: {'n_hidden': 1024, 'mixture_components': 7, 'use_sparse_layer': False, 'use_batchnorm': False, 'use_dropout': True, 'dropout': 0.7121251750654077, 'mlp_size_1': 2, 'mlp_size_2': 4, 'mlp_size_3': 1, 'kernel': 'Gamma', 'loss_name': 'AlternativeNLLLoss'}. Best is trial 704 with value: 0.8891333137081187.[0m
[32m[I 2022-04-16 18:21:45,735][0m Trial 736 finished with value: 0.8839449912035914 and parameters: {'n_hidden': 1024, 'mixture_components': 7, 'use_sparse_layer': False, 'use_batchnorm': False, 'use_dropout': True, 'dropout': 0.7393407139866474, 'mlp_size_1': 2, 'mlp_size_2': 4, 'mlp_size_3': 1, 'kernel': 'Gamma', 'loss_name': 'AlternativeNLLLoss'}. Best is trial 704 with value: 0.8891333137081187.[0m
[32m[I 2022-04-16 18:26:34,135][0m Trial 737 finished with value: 0.877109084791934 and parameters: {'n_hidden': 32, 'mixture_components': 7, 'use_sparse_layer': False, 'use_batchnorm': False, 'use_dropout': True, 'dropout': 0.7318296169436078, 'mlp_size_1': 2, 'mlp_size_2': 0, 'mlp_size_3': 0, 'kernel': 'Gamma', 'loss_name': 'AlternativeNLLLoss'}. Best is trial 704 with value: 0.8891333137081187.[0m
[32m[I 2022-04-16 18:28:53,573][0m Trial 738 finished with value: 0.8837178357303135 and parameters: {'n_hidden': 1024, 'mixture_components': 7, 'use_sparse_layer': False, 'use_batchnorm': False, 'use_dropout': True, 'dropout': 0.7421463830370523, 'mlp_size_1': 2, 'mlp_size_2': 4, 'mlp_size_3': 1, 'kernel': 'Gamma', 'loss_name': 'AlternativeNLLLoss'}. Best is trial 704 with value: 0.8891333137081187.[0m
[32m[I 2022-04-16 18:31:14,950][0m Trial 739 finished with value: 0.8857914279755089 and parameters: {'n_hidden': 1024, 'mixture_components': 7, 'use_sparse_layer': False, 'use_batchnorm': False, 'use_dropout': True, 'dropout': 0.7701389538413991, 'mlp_size_1': 2, 'mlp_size_2': 4, 'mlp_size_3': 1, 'kernel': 'Gamma', 'loss_name': 'AlternativeNLLLoss'}. Best is trial 704 with value: 0.8891333137081187.[0m
[32m[I 2022-04-16 18:33:27,933][0m Trial 740 finished with value: 0.8849037082446649 and parameters: {'n_hidden': 1024, 'mixture_components': 6, 'use_sparse_layer': False, 'use_batchnorm': False, 'use_dropout': True, 'dropout': 0.707675735367028, 'mlp_size_1': 2, 'mlp_size_2': 4, 'mlp_size_3': 1, 'kernel': 'Gamma', 'loss_name': 'AlternativeNLLLoss'}. Best is trial 704 with value: 0.8891333137081187.[0m
[32m[I 2022-04-16 18:35:46,117][0m Trial 741 finished with value: 0.8866592265299753 and parameters: {'n_hidden': 1024, 'mixture_components': 7, 'use_sparse_layer': False, 'use_batchnorm': False, 'use_dropout': True, 'dropout': 0.7807881659374628, 'mlp_size_1': 2, 'mlp_size_2': 4, 'mlp_size_3': 1, 'kernel': 'Gamma', 'loss_name': 'AlternativeNLLLoss'}. Best is trial 704 with value: 0.8891333137081187.[0m
[32m[I 2022-04-16 18:38:10,325][0m Trial 742 finished with value: 0.8832131509757201 and parameters: {'n_hidden': 128, 'mixture_components': 7, 'use_sparse_layer': False, 'use_batchnorm': False, 'use_dropout': True, 'dropout': 0.7339926815026441, 'mlp_size_1': 2, 'mlp_size_2': 2, 'mlp_size_3': 0, 'kernel': 'Gamma', 'loss_name': 'AlternativeNLLLoss'}. Best is trial 704 with value: 0.8891333137081187.[0m
[32m[I 2022-04-16 18:40:27,338][0m Trial 743 finished with value: 0.8843181633207807 and parameters: {'n_hidden': 1024, 'mixture_components': 7, 'use_sparse_layer': False, 'use_batchnorm': False, 'use_dropout': True, 'dropout': 0.7179218915760546, 'mlp_size_1': 2, 'mlp_size_2': 4, 'mlp_size_3': 1, 'kernel': 'Gamma', 'loss_name': 'AlternativeNLLLoss'}. Best is trial 704 with value: 0.8891333137081187.[0m
[32m[I 2022-04-16 18:42:42,005][0m Trial 744 finished with value: 0.8841099961094159 and parameters: {'n_hidden': 1024, 'mixture_components': 7, 'use_sparse_layer': False, 'use_batchnorm': False, 'use_dropout': True, 'dropout': 0.7659472189938105, 'mlp_size_1': 2, 'mlp_size_2': 4, 'mlp_size_3': 1, 'kernel': 'Gamma', 'loss_name': 'AlternativeNLLLoss'}. Best is trial 704 with value: 0.8891333137081187.[0m
[32m[I 2022-04-16 18:45:01,288][0m Trial 745 finished with value: 0.886191106858637 and parameters: {'n_hidden': 1024, 'mixture_components': 7, 'use_sparse_layer': False, 'use_batchnorm': False, 'use_dropout': True, 'dropout': 0.7853000665654588, 'mlp_size_1': 2, 'mlp_size_2': 4, 'mlp_size_3': 1, 'kernel': 'Gamma', 'loss_name': 'AlternativeNLLLoss'}. Best is trial 704 with value: 0.8891333137081187.[0m
[32m[I 2022-04-16 18:48:02,334][0m Trial 746 finished with value: 0.8777939486418397 and parameters: {'n_hidden': 512, 'mixture_components': 7, 'use_sparse_layer': False, 'use_batchnorm': True, 'use_dropout': False, 'mlp_size_1': 2, 'mlp_size_2': 4, 'mlp_size_3': 0, 'kernel': 'Gamma', 'loss_name': 'AlternativeNLLLoss'}. Best is trial 704 with value: 0.8891333137081187.[0m
[32m[I 2022-04-16 18:50:19,089][0m Trial 747 finished with value: 0.8856477453613814 and parameters: {'n_hidden': 1024, 'mixture_components': 7, 'use_sparse_layer': False, 'use_batchnorm': False, 'use_dropout': True, 'dropout': 0.7014700973648323, 'mlp_size_1': 2, 'mlp_size_2': 4, 'mlp_size_3': 1, 'kernel': 'Gamma', 'loss_name': 'AlternativeNLLLoss'}. Best is trial 704 with value: 0.8891333137081187.[0m
[32m[I 2022-04-16 18:52:29,718][0m Trial 748 finished with value: 0.8847653687269483 and parameters: {'n_hidden': 1024, 'mixture_components': 6, 'use_sparse_layer': False, 'use_batchnorm': False, 'use_dropout': True, 'dropout': 0.6994656312678339, 'mlp_size_1': 2, 'mlp_size_2': 4, 'mlp_size_3': 1, 'kernel': 'Gamma', 'loss_name': 'AlternativeNLLLoss'}. Best is trial 704 with value: 0.8891333137081187.[0m
[32m[I 2022-04-16 18:55:24,060][0m Trial 749 finished with value: 0.8823365146324547 and parameters: {'n_hidden': 64, 'mixture_components': 7, 'use_sparse_layer': False, 'use_batchnorm': False, 'use_dropout': True, 'dropout': 0.7303939241939542, 'mlp_size_1': 2, 'mlp_size_2': 1, 'mlp_size_3': 0, 'kernel': 'Gamma', 'loss_name': 'AlternativeNLLLoss'}. Best is trial 704 with value: 0.8891333137081187.[0m
[32m[I 2022-04-16 18:58:08,038][0m Trial 750 finished with value: 0.8847610514970794 and parameters: {'n_hidden': 2048, 'mixture_components': 7, 'use_sparse_layer': False, 'use_batchnorm': False, 'use_dropout': True, 'dropout': 0.7214098743475044, 'mlp_size_1': 3, 'mlp_size_2': 4, 'mlp_size_3': 1, 'kernel': 'Gamma', 'loss_name': 'AlternativeNLLLoss'}. Best is trial 704 with value: 0.8891333137081187.[0m
[32m[I 2022-04-16 19:00:52,229][0m Trial 751 finished with value: 0.8806963529513672 and parameters: {'n_hidden': 1024, 'mixture_components': 7, 'use_sparse_layer': False, 'use_batchnorm': False, 'use_dropout': True, 'dropout': 0.8418429151465562, 'mlp_size_1': 2, 'mlp_size_2': 4, 'mlp_size_3': 1, 'kernel': 'Gamma', 'loss_name': 'AlternativeNLLLoss'}. Best is trial 704 with value: 0.8891333137081187.[0m
[32m[I 2022-04-16 19:03:29,440][0m Trial 752 finished with value: 0.8859703329212699 and parameters: {'n_hidden': 1024, 'mixture_components': 6, 'use_sparse_layer': False, 'use_batchnorm': False, 'use_dropout': True, 'dropout': 0.7574867465216357, 'mlp_size_1': 2, 'mlp_size_2': 4, 'mlp_size_3': 1, 'kernel': 'Gamma', 'loss_name': 'AlternativeNLLLoss'}. Best is trial 704 with value: 0.8891333137081187.[0m
[32m[I 2022-04-16 19:05:47,134][0m Trial 753 finished with value: 0.8832082020418609 and parameters: {'n_hidden': 1024, 'mixture_components': 7, 'use_sparse_layer': False, 'use_batchnorm': False, 'use_dropout': True, 'dropout': 0.6940893303548945, 'mlp_size_1': 2, 'mlp_size_2': 4, 'mlp_size_3': 1, 'kernel': 'Gamma', 'loss_name': 'AlternativeNLLLoss'}. Best is trial 704 with value: 0.8891333137081187.[0m
[32m[I 2022-04-16 19:07:59,562][0m Trial 754 finished with value: 0.8861454299113207 and parameters: {'n_hidden': 1024, 'mixture_components': 7, 'use_sparse_layer': False, 'use_batchnorm': False, 'use_dropout': True, 'dropout': 0.7592356413542892, 'mlp_size_1': 2, 'mlp_size_2': 4, 'mlp_size_3': 1, 'kernel': 'Gamma', 'loss_name': 'AlternativeNLLLoss'}. Best is trial 704 with value: 0.8891333137081187.[0m
