[32m[I 2022-04-15 15:26:00,023][0m Trial 975 finished with value: 0.5 and parameters: {'loss': 'coxph', 'learning_rate': 0.00013563539686545868, 'n_estimators': 805, 'criterion': 'friedman_mse', 'min_samples_split': 8, 'min_samples_leaf': 2, 'min_weight_fraction_leaf': 0.0018264256649389882, 'min_impurity_decrease': 0.37619621637495965, 'max_features': 0.6444577322072003, 'subsample': 0.11758670544172062, 'dropout_rate': 0.8813238007399984, 'ccp_alpha': 1.6859482027320776}. Best is trial 712 with value: 0.7824105962295036.[0m
[32m[I 2022-04-15 15:27:30,243][0m Trial 976 finished with value: 0.6743624146605087 and parameters: {'loss': 'coxph', 'learning_rate': 0.00010572974627169127, 'n_estimators': 749, 'criterion': 'friedman_mse', 'min_samples_split': 8, 'min_samples_leaf': 2, 'min_weight_fraction_leaf': 0.006130282066959501, 'min_impurity_decrease': 0.40475497304432956, 'max_features': 0.7017962196521266, 'subsample': 0.10265302761121856, 'dropout_rate': 0.8498146998372835, 'ccp_alpha': 0.25991633554126103}. Best is trial 712 with value: 0.7824105962295036.[0m
[32m[I 2022-04-15 15:28:49,826][0m Trial 977 finished with value: 0.5 and parameters: {'loss': 'coxph', 'learning_rate': 6.580877721225945e-05, 'n_estimators': 747, 'criterion': 'squared_error', 'min_samples_split': 8, 'min_samples_leaf': 2, 'min_weight_fraction_leaf': 0.011155748571001203, 'min_impurity_decrease': 0.3857696391876091, 'max_features': 0.6643071960656481, 'subsample': 0.13169685038217444, 'dropout_rate': 0.89116105864459, 'ccp_alpha': 0.17379915207126082}. Best is trial 712 with value: 0.7824105962295036.[0m
[32m[I 2022-04-15 15:30:43,788][0m Trial 978 finished with value: 0.7779056403244142 and parameters: {'loss': 'coxph', 'learning_rate': 8.399702825550571e-05, 'n_estimators': 981, 'criterion': 'friedman_mse', 'min_samples_split': 8, 'min_samples_leaf': 2, 'min_weight_fraction_leaf': 0.011029134107228108, 'min_impurity_decrease': 0.17031532382558454, 'max_features': 0.6842885304861466, 'subsample': 0.1582418182696805, 'dropout_rate': 0.9176446750868346, 'ccp_alpha': 0.002444287753064217}. Best is trial 712 with value: 0.7824105962295036.[0m
[32m[I 2022-04-15 15:31:49,326][0m Trial 979 finished with value: 0.7583289643824572 and parameters: {'loss': 'coxph', 'learning_rate': 0.00015802368933875543, 'n_estimators': 760, 'criterion': 'friedman_mse', 'min_samples_split': 8, 'min_samples_leaf': 2, 'min_weight_fraction_leaf': 0.0020572353093862676, 'min_impurity_decrease': 0.3494310947423027, 'max_features': 0.701589001487557, 'subsample': 0.13367110564951137, 'dropout_rate': 0.9974972490599388, 'ccp_alpha': 0.09311704365743191}. Best is trial 712 with value: 0.7824105962295036.[0m
[32m[I 2022-04-15 15:33:18,496][0m Trial 980 finished with value: 0.6905883424136569 and parameters: {'loss': 'coxph', 'learning_rate': 0.00020807143154559802, 'n_estimators': 801, 'criterion': 'friedman_mse', 'min_samples_split': 8, 'min_samples_leaf': 2, 'min_weight_fraction_leaf': 0.0010793492205653718, 'min_impurity_decrease': 0.4177312560758976, 'max_features': 0.7028226488702318, 'subsample': 0.19879739728087487, 'dropout_rate': 0.8755679436052879, 'ccp_alpha': 0.16572473496607626}. Best is trial 712 with value: 0.7824105962295036.[0m
[32m[I 2022-04-15 15:34:49,677][0m Trial 981 finished with value: 0.7615828741365422 and parameters: {'loss': 'coxph', 'learning_rate': 0.00015509750524340108, 'n_estimators': 857, 'criterion': 'friedman_mse', 'min_samples_split': 8, 'min_samples_leaf': 2, 'min_weight_fraction_leaf': 0.018422761083293174, 'min_impurity_decrease': 0.40093649481533356, 'max_features': 0.7113490519741065, 'subsample': 0.10701263483097109, 'dropout_rate': 0.9350944311857398, 'ccp_alpha': 0.0864052189264979}. Best is trial 712 with value: 0.7824105962295036.[0m
[32m[I 2022-04-15 15:36:08,485][0m Trial 982 finished with value: 0.5 and parameters: {'loss': 'coxph', 'learning_rate': 0.00012701317512797743, 'n_estimators': 758, 'criterion': 'friedman_mse', 'min_samples_split': 9, 'min_samples_leaf': 2, 'min_weight_fraction_leaf': 0.02450761672740134, 'min_impurity_decrease': 0.04684474703756192, 'max_features': 0.6637126479385431, 'subsample': 0.17787007551759704, 'dropout_rate': 0.9033483501291456, 'ccp_alpha': 0.36471988402883254}. Best is trial 712 with value: 0.7824105962295036.[0m
[32m[I 2022-04-15 15:37:54,407][0m Trial 983 finished with value: 0.7265340064674072 and parameters: {'loss': 'coxph', 'learning_rate': 9.38451990926559e-05, 'n_estimators': 800, 'criterion': 'friedman_mse', 'min_samples_split': 8, 'min_samples_leaf': 2, 'min_weight_fraction_leaf': 0.034429258089034874, 'min_impurity_decrease': 0.3671909146836733, 'max_features': 0.6783825916579014, 'subsample': 0.07493555724869692, 'dropout_rate': 0.8341117607636035, 'ccp_alpha': 0.23622688330559277}. Best is trial 712 with value: 0.7824105962295036.[0m
[32m[I 2022-04-15 15:39:19,609][0m Trial 984 finished with value: 0.762552887041004 and parameters: {'loss': 'coxph', 'learning_rate': 5.894505716853274e-05, 'n_estimators': 727, 'criterion': 'friedman_mse', 'min_samples_split': 8, 'min_samples_leaf': 2, 'min_weight_fraction_leaf': 0.015461867533086333, 'min_impurity_decrease': 0.4313886483099295, 'max_features': 0.7132448861078711, 'subsample': 0.14794898152734218, 'dropout_rate': 0.8558937230542835, 'ccp_alpha': 0.08871810820580725}. Best is trial 712 with value: 0.7824105962295036.[0m
[32m[I 2022-04-15 15:39:55,204][0m Trial 985 finished with value: 0.5 and parameters: {'loss': 'squared', 'learning_rate': 8.321754843802718e-05, 'n_estimators': 833, 'criterion': 'friedman_mse', 'min_samples_split': 8, 'min_samples_leaf': 2, 'min_weight_fraction_leaf': 0.028806383908712128, 'min_impurity_decrease': 0.4085381117072319, 'max_features': 0.7203427063862248, 'subsample': 0.08861227318689899, 'dropout_rate': 0.8888114696671381, 'ccp_alpha': 4.731197303421512}. Best is trial 712 with value: 0.7824105962295036.[0m
[32m[I 2022-04-15 15:41:34,427][0m Trial 986 finished with value: 0.7668267497769994 and parameters: {'loss': 'coxph', 'learning_rate': 0.00012354226701281217, 'n_estimators': 776, 'criterion': 'friedman_mse', 'min_samples_split': 8, 'min_samples_leaf': 2, 'min_weight_fraction_leaf': 0.02100107771525281, 'min_impurity_decrease': 0.09685884900517792, 'max_features': 0.694928148671764, 'subsample': 0.0460017900793948, 'dropout_rate': 0.8638794898989125, 'ccp_alpha': 0.0867328982184746}. Best is trial 712 with value: 0.7824105962295036.[0m
[32m[I 2022-04-15 15:43:48,853][0m Trial 987 finished with value: 0.7797004368727913 and parameters: {'loss': 'coxph', 'learning_rate': 0.0003104828298047114, 'n_estimators': 906, 'criterion': 'friedman_mse', 'min_samples_split': 8, 'min_samples_leaf': 2, 'min_weight_fraction_leaf': 0.033798715654140644, 'min_impurity_decrease': 0.3879690617188591, 'max_features': 0.7112237544983969, 'subsample': 0.1238725951319157, 'dropout_rate': 0.8099339868511348, 'ccp_alpha': 0.001637308667054898}. Best is trial 712 with value: 0.7824105962295036.[0m
[32m[I 2022-04-15 15:45:30,872][0m Trial 988 finished with value: 0.5658673428511173 and parameters: {'loss': 'coxph', 'learning_rate': 0.0003093514508780098, 'n_estimators': 824, 'criterion': 'absolute_error', 'min_samples_split': 8, 'min_samples_leaf': 2, 'min_weight_fraction_leaf': 0.03525113655216178, 'min_impurity_decrease': 0.33622379603794017, 'max_features': 0.7232266385708622, 'subsample': 0.12511865572162775, 'dropout_rate': 0.8387610428594587, 'ccp_alpha': 0.0016959747217563665}. Best is trial 712 with value: 0.7824105962295036.[0m
[32m[I 2022-04-15 15:47:45,326][0m Trial 989 finished with value: 0.7005858373859218 and parameters: {'loss': 'coxph', 'learning_rate': 0.0002532446942050942, 'n_estimators': 956, 'criterion': 'friedman_mse', 'min_samples_split': 8, 'min_samples_leaf': 2, 'min_weight_fraction_leaf': 0.01282086503171537, 'min_impurity_decrease': 0.3814667192557408, 'max_features': 0.7062052216283021, 'subsample': 0.11668681212396455, 'dropout_rate': 0.821087655057466, 'ccp_alpha': 0.19469140748380517}. Best is trial 712 with value: 0.7824105962295036.[0m
[32m[I 2022-04-15 15:49:57,116][0m Trial 990 finished with value: 0.7796614376293856 and parameters: {'loss': 'coxph', 'learning_rate': 0.0003359407768789989, 'n_estimators': 911, 'criterion': 'friedman_mse', 'min_samples_split': 8, 'min_samples_leaf': 2, 'min_weight_fraction_leaf': 0.027368975836386644, 'min_impurity_decrease': 0.36858033749694746, 'max_features': 0.6849735162384464, 'subsample': 0.16382654567078572, 'dropout_rate': 0.8148011392776303, 'ccp_alpha': 0.0017173321849019954}. Best is trial 712 with value: 0.7824105962295036.[0m
[32m[I 2022-04-15 15:52:01,617][0m Trial 991 finished with value: 0.6743624146605087 and parameters: {'loss': 'coxph', 'learning_rate': 0.0002967239714267096, 'n_estimators': 935, 'criterion': 'friedman_mse', 'min_samples_split': 8, 'min_samples_leaf': 2, 'min_weight_fraction_leaf': 0.03234398903756884, 'min_impurity_decrease': 0.3750713021639022, 'max_features': 0.6414814330057769, 'subsample': 0.15623422683154578, 'dropout_rate': 0.8073612238900549, 'ccp_alpha': 0.24894694051775948}. Best is trial 712 with value: 0.7824105962295036.[0m
[32m[I 2022-04-15 15:54:10,183][0m Trial 992 finished with value: 0.7797197087716949 and parameters: {'loss': 'coxph', 'learning_rate': 0.00019241224208808367, 'n_estimators': 918, 'criterion': 'friedman_mse', 'min_samples_split': 8, 'min_samples_leaf': 2, 'min_weight_fraction_leaf': 0.025451549253289834, 'min_impurity_decrease': 0.3569199923297898, 'max_features': 0.6676871217808118, 'subsample': 0.16615291107347452, 'dropout_rate': 0.8053804277759693, 'ccp_alpha': 0.0010659152056430288}. Best is trial 712 with value: 0.7824105962295036.[0m
[32m[I 2022-04-15 15:56:24,469][0m Trial 993 finished with value: 0.5 and parameters: {'loss': 'coxph', 'learning_rate': 0.0002069291802949514, 'n_estimators': 994, 'criterion': 'friedman_mse', 'min_samples_split': 8, 'min_samples_leaf': 2, 'min_weight_fraction_leaf': 0.0247945421026967, 'min_impurity_decrease': 0.366482729055548, 'max_features': 0.6761440354298198, 'subsample': 0.1845903076846505, 'dropout_rate': 0.8101236276110859, 'ccp_alpha': 2.608041975980077}. Best is trial 712 with value: 0.7824105962295036.[0m
[32m[I 2022-04-15 15:58:27,776][0m Trial 994 finished with value: 0.6919162980752858 and parameters: {'loss': 'coxph', 'learning_rate': 0.00042546132123390707, 'n_estimators': 917, 'criterion': 'friedman_mse', 'min_samples_split': 8, 'min_samples_leaf': 2, 'min_weight_fraction_leaf': 0.011264961996854818, 'min_impurity_decrease': 0.3507254199571719, 'max_features': 0.6506942046586178, 'subsample': 0.22464393122935225, 'dropout_rate': 0.7882365942352922, 'ccp_alpha': 0.16269585908311285}. Best is trial 712 with value: 0.7824105962295036.[0m
[32m[I 2022-04-15 16:00:45,153][0m Trial 995 finished with value: 0.7552256674323892 and parameters: {'loss': 'coxph', 'learning_rate': 0.00031117488381455523, 'n_estimators': 947, 'criterion': 'friedman_mse', 'min_samples_split': 8, 'min_samples_leaf': 2, 'min_weight_fraction_leaf': 0.023791553421024507, 'min_impurity_decrease': 0.3507290540368562, 'max_features': 0.6142293988881385, 'subsample': 0.1676571380367646, 'dropout_rate': 0.7943748642173543, 'ccp_alpha': 0.11008392850486506}. Best is trial 712 with value: 0.7824105962295036.[0m
[32m[I 2022-04-15 16:02:42,722][0m Trial 996 finished with value: 0.758675946095008 and parameters: {'loss': 'coxph', 'learning_rate': 0.00015522609202679155, 'n_estimators': 897, 'criterion': 'friedman_mse', 'min_samples_split': 8, 'min_samples_leaf': 2, 'min_weight_fraction_leaf': 0.028593532921885847, 'min_impurity_decrease': 0.3322636609739162, 'max_features': 0.6375823146687563, 'subsample': 0.20630316523772882, 'dropout_rate': 0.8352485062178241, 'ccp_alpha': 0.09280313486353252}. Best is trial 712 with value: 0.7824105962295036.[0m
[32m[I 2022-04-15 16:04:47,328][0m Trial 997 finished with value: 0.5 and parameters: {'loss': 'coxph', 'learning_rate': 0.00017071075923397034, 'n_estimators': 909, 'criterion': 'friedman_mse', 'min_samples_split': 9, 'min_samples_leaf': 2, 'min_weight_fraction_leaf': 0.01519848389969699, 'min_impurity_decrease': 0.33821405021273515, 'max_features': 0.6626951959172009, 'subsample': 0.1396033745118116, 'dropout_rate': 0.8213763733266686, 'ccp_alpha': 4.341162459342608}. Best is trial 712 with value: 0.7824105962295036.[0m
[32m[I 2022-04-15 16:06:46,654][0m Trial 998 finished with value: 0.5660452785959845 and parameters: {'loss': 'coxph', 'learning_rate': 0.00018209766443938664, 'n_estimators': 887, 'criterion': 'friedman_mse', 'min_samples_split': 8, 'min_samples_leaf': 2, 'min_weight_fraction_leaf': 0.03568825070205892, 'min_impurity_decrease': 0.36339638705227334, 'max_features': 0.6704921768340564, 'subsample': 0.1669315613147377, 'dropout_rate': 0.8048787063774551, 'ccp_alpha': 0.302921497411429}. Best is trial 712 with value: 0.7824105962295036.[0m
[32m[I 2022-04-15 16:08:44,817][0m Trial 999 finished with value: 0.7479983341420123 and parameters: {'loss': 'coxph', 'learning_rate': 0.00023154498401407723, 'n_estimators': 938, 'criterion': 'friedman_mse', 'min_samples_split': 8, 'min_samples_leaf': 2, 'min_weight_fraction_leaf': 0.019955606944849595, 'min_impurity_decrease': 0.3814971932823799, 'max_features': 0.6570399084752416, 'subsample': 0.14463642682206065, 'dropout_rate': 0.8444533191792036, 'ccp_alpha': 0.15772343251126886}. Best is trial 712 with value: 0.7824105962295036.[0m
BoostingSurvival
Running Optimizer with LogRank binary scoring
{'loss': 'coxph', 'learning_rate': 1.2745966283612484e-06, 'n_estimators': 395, 'criterion': 'friedman_mse', 'min_samples_split': 10, 'min_samples_leaf': 1, 'min_weight_fraction_leaf': 0.1138343326389939, 'min_impurity_decrease': 0.6652059900562292, 'max_features': 0.5612389360771136, 'subsample': 0.10302681646187198, 'dropout_rate': 0.6800472639365835, 'ccp_alpha': 0.0038312984208842223, 'UnoC_LR': 0.7879949387224262}
Running Optimizer normaly
{'loss': 'coxph', 'learning_rate': 0.0013971654585556252, 'n_estimators': 623, 'criterion': 'friedman_mse', 'min_samples_split': 5, 'min_samples_leaf': 3, 'min_weight_fraction_leaf': 0.06051776602264631, 'min_impurity_decrease': 0.2686862347610615, 'max_features': 0.732294710437406, 'subsample': 0.9999041933346642, 'dropout_rate': 0.606180590130397, 'ccp_alpha': 0.0020705719228226705, 'UnoC': 0.7824105962295036}
