[32m[I 2022-04-15 13:02:17,433][0m Trial 51 finished with value: 0.8799535414148453 and parameters: {'n_hidden': 512, 'mixture_components': 9, 'use_sparse_layer': True, 'use_sparse_loss': False, 'use_batchnorm': False, 'use_dropout': False, 'mlp_size_1': 5, 'mlp_size_2': 0, 'mlp_size_3': 0, 'kernel': 'Logistic', 'loss_name': 'CensoredNLLLoss'}. Best is trial 24 with value: 0.8833697701789252.[0m
[32m[I 2022-04-15 13:03:52,968][0m Trial 52 finished with value: 0.878370583040285 and parameters: {'n_hidden': 512, 'mixture_components': 8, 'use_sparse_layer': True, 'use_sparse_loss': False, 'use_batchnorm': False, 'use_dropout': False, 'mlp_size_1': 5, 'mlp_size_2': 0, 'mlp_size_3': 0, 'kernel': 'Logistic', 'loss_name': 'CensoredNLLLoss'}. Best is trial 24 with value: 0.8833697701789252.[0m
[32m[I 2022-04-15 13:05:37,402][0m Trial 53 finished with value: 0.8803897134310212 and parameters: {'n_hidden': 512, 'mixture_components': 9, 'use_sparse_layer': True, 'use_sparse_loss': False, 'use_batchnorm': False, 'use_dropout': False, 'mlp_size_1': 5, 'mlp_size_2': 0, 'mlp_size_3': 0, 'kernel': 'Logistic', 'loss_name': 'CensoredNLLLoss'}. Best is trial 24 with value: 0.8833697701789252.[0m
[32m[I 2022-04-15 13:06:57,270][0m Trial 54 finished with value: -0.5 and parameters: {'n_hidden': 512, 'mixture_components': 10, 'use_sparse_layer': False, 'use_batchnorm': False, 'use_dropout': True, 'dropout': 0.9717284731774076, 'mlp_size_1': 4, 'mlp_size_2': 1, 'mlp_size_3': 0, 'kernel': 'Logistic', 'loss_name': 'AlternativeNLLLoss'}. Best is trial 24 with value: 0.8833697701789252.[0m
[32m[I 2022-04-15 13:08:35,812][0m Trial 55 finished with value: 0.6834488149895354 and parameters: {'n_hidden': 128, 'mixture_components': 4, 'use_sparse_layer': True, 'use_sparse_loss': False, 'use_batchnorm': False, 'use_dropout': False, 'mlp_size_1': 4, 'mlp_size_2': 0, 'mlp_size_3': 0, 'kernel': 'Exponential', 'loss_name': 'CensoredNLLLoss'}. Best is trial 24 with value: 0.8833697701789252.[0m
[32m[I 2022-04-15 13:10:16,478][0m Trial 56 finished with value: 0.8810995203124818 and parameters: {'n_hidden': 512, 'mixture_components': 8, 'use_sparse_layer': True, 'use_sparse_loss': False, 'use_batchnorm': False, 'use_dropout': False, 'mlp_size_1': 5, 'mlp_size_2': 0, 'mlp_size_3': 1, 'kernel': 'Gamma', 'loss_name': 'CensoredNLLLoss'}. Best is trial 24 with value: 0.8833697701789252.[0m
[32m[I 2022-04-15 13:13:32,859][0m Trial 57 finished with value: 0.8673875580220074 and parameters: {'n_hidden': 2048, 'mixture_components': 8, 'use_sparse_layer': False, 'use_batchnorm': False, 'use_dropout': True, 'dropout': 0.6893362700542071, 'mlp_size_1': 6, 'mlp_size_2': 1, 'mlp_size_3': 1, 'kernel': 'Gamma', 'loss_name': 'CensoredNLLLoss'}. Best is trial 24 with value: 0.8833697701789252.[0m
[32m[I 2022-04-15 13:16:42,160][0m Trial 58 finished with value: 0.8669193257075465 and parameters: {'n_hidden': 256, 'mixture_components': 7, 'use_sparse_layer': True, 'use_sparse_loss': False, 'use_batchnorm': True, 'use_dropout': False, 'mlp_size_1': 4, 'mlp_size_2': 0, 'mlp_size_3': 1, 'kernel': 'Gamma', 'loss_name': 'CensoredNLLLoss'}. Best is trial 24 with value: 0.8833697701789252.[0m
[32m[I 2022-04-15 13:18:30,625][0m Trial 59 finished with value: 0.8806508799416711 and parameters: {'n_hidden': 64, 'mixture_components': 8, 'use_sparse_layer': False, 'use_batchnorm': False, 'use_dropout': False, 'mlp_size_1': 3, 'mlp_size_2': 0, 'mlp_size_3': 0, 'kernel': 'Gamma', 'loss_name': 'AlternativeNLLLoss'}. Best is trial 24 with value: 0.8833697701789252.[0m
/media/san2_ssd/data/Workdir/survival/utils.py:305: RuntimeWarning: invalid value encountered in true_divide
  pdfs = np.gradient(1-survs,axis=1)/norms
[32m[I 2022-04-15 13:20:14,110][0m Trial 60 finished with value: 0.8793801202769382 and parameters: {'n_hidden': 512, 'mixture_components': 2, 'use_sparse_layer': True, 'use_sparse_loss': True, 'lmbd': 0.09109310024343226, 'use_batchnorm': False, 'use_dropout': False, 'mlp_size_1': 5, 'mlp_size_2': 0, 'mlp_size_3': 1, 'kernel': 'Gamma', 'loss_name': 'CensoredNLLLoss'}. Best is trial 24 with value: 0.8833697701789252.[0m
[32m[I 2022-04-15 13:22:13,966][0m Trial 61 finished with value: 0.8775737002206874 and parameters: {'n_hidden': 512, 'mixture_components': 9, 'use_sparse_layer': True, 'use_sparse_loss': False, 'use_batchnorm': False, 'use_dropout': False, 'mlp_size_1': 5, 'mlp_size_2': 0, 'mlp_size_3': 1, 'kernel': 'Logistic', 'loss_name': 'CensoredNLLLoss'}. Best is trial 24 with value: 0.8833697701789252.[0m
[32m[I 2022-04-15 13:23:56,435][0m Trial 62 finished with value: 0.7828466651645385 and parameters: {'n_hidden': 512, 'mixture_components': 9, 'use_sparse_layer': True, 'use_sparse_loss': False, 'use_batchnorm': False, 'use_dropout': False, 'mlp_size_1': 5, 'mlp_size_2': 0, 'mlp_size_3': 1, 'kernel': 'LogLogistic', 'loss_name': 'CensoredNLLLoss'}. Best is trial 24 with value: 0.8833697701789252.[0m
[32m[I 2022-04-15 13:26:00,589][0m Trial 63 finished with value: 0.8826589956430931 and parameters: {'n_hidden': 512, 'mixture_components': 10, 'use_sparse_layer': True, 'use_sparse_loss': False, 'use_batchnorm': False, 'use_dropout': False, 'mlp_size_1': 5, 'mlp_size_2': 0, 'mlp_size_3': 1, 'kernel': 'Weibull', 'loss_name': 'CensoredNLLLoss'}. Best is trial 24 with value: 0.8833697701789252.[0m
[32m[I 2022-04-15 13:27:59,862][0m Trial 64 finished with value: 0.8845370921829263 and parameters: {'n_hidden': 512, 'mixture_components': 10, 'use_sparse_layer': True, 'use_sparse_loss': False, 'use_batchnorm': False, 'use_dropout': False, 'mlp_size_1': 4, 'mlp_size_2': 1, 'mlp_size_3': 1, 'kernel': 'Weibull', 'loss_name': 'CensoredNLLLoss'}. Best is trial 64 with value: 0.8845370921829263.[0m
[32m[I 2022-04-15 13:29:56,291][0m Trial 65 finished with value: 0.8817796203442885 and parameters: {'n_hidden': 512, 'mixture_components': 10, 'use_sparse_layer': True, 'use_sparse_loss': False, 'use_batchnorm': False, 'use_dropout': False, 'mlp_size_1': 4, 'mlp_size_2': 1, 'mlp_size_3': 1, 'kernel': 'Weibull', 'loss_name': 'CensoredNLLLoss'}. Best is trial 64 with value: 0.8845370921829263.[0m
[32m[I 2022-04-15 13:32:34,489][0m Trial 66 finished with value: 0.8833784322004157 and parameters: {'n_hidden': 1024, 'mixture_components': 10, 'use_sparse_layer': True, 'use_sparse_loss': False, 'use_batchnorm': False, 'use_dropout': True, 'dropout': 0.5890451657225433, 'mlp_size_1': 4, 'mlp_size_2': 2, 'mlp_size_3': 1, 'kernel': 'Weibull', 'loss_name': 'CensoredNLLLoss'}. Best is trial 64 with value: 0.8845370921829263.[0m
[32m[I 2022-04-15 13:34:42,153][0m Trial 67 finished with value: 0.7471683193309132 and parameters: {'n_hidden': 1024, 'mixture_components': 10, 'use_sparse_layer': False, 'use_batchnorm': False, 'use_dropout': True, 'dropout': 0.8197235427263896, 'mlp_size_1': 4, 'mlp_size_2': 2, 'mlp_size_3': 1, 'kernel': 'Weibull', 'loss_name': 'NLLLoss'}. Best is trial 64 with value: 0.8845370921829263.[0m
[32m[I 2022-04-15 13:38:01,095][0m Trial 68 finished with value: 0.8774971536568821 and parameters: {'n_hidden': 1024, 'mixture_components': 10, 'use_sparse_layer': True, 'use_sparse_loss': False, 'use_batchnorm': True, 'use_dropout': True, 'dropout': 0.5875917787840241, 'mlp_size_1': 4, 'mlp_size_2': 2, 'mlp_size_3': 1, 'kernel': 'Weibull', 'loss_name': 'CensoredNLLLoss'}. Best is trial 64 with value: 0.8845370921829263.[0m
[32m[I 2022-04-15 13:40:33,180][0m Trial 69 finished with value: 0.8855969967010585 and parameters: {'n_hidden': 1024, 'mixture_components': 10, 'use_sparse_layer': True, 'use_sparse_loss': True, 'lmbd': 0.008414180921742917, 'use_batchnorm': False, 'use_dropout': True, 'dropout': 0.5602855328317894, 'mlp_size_1': 3, 'mlp_size_2': 3, 'mlp_size_3': 1, 'kernel': 'Weibull', 'loss_name': 'CensoredNLLLoss'}. Best is trial 69 with value: 0.8855969967010585.[0m
[32m[I 2022-04-15 13:42:52,997][0m Trial 70 finished with value: 0.8856221725434066 and parameters: {'n_hidden': 1024, 'mixture_components': 10, 'use_sparse_layer': True, 'use_sparse_loss': False, 'use_batchnorm': False, 'use_dropout': True, 'dropout': 0.558932368155721, 'mlp_size_1': 3, 'mlp_size_2': 3, 'mlp_size_3': 1, 'kernel': 'Weibull', 'loss_name': 'CensoredNLLLoss'}. Best is trial 70 with value: 0.8856221725434066.[0m
[32m[I 2022-04-15 13:45:22,688][0m Trial 71 finished with value: 0.8860575227689568 and parameters: {'n_hidden': 1024, 'mixture_components': 10, 'use_sparse_layer': True, 'use_sparse_loss': False, 'use_batchnorm': False, 'use_dropout': True, 'dropout': 0.5772653960939458, 'mlp_size_1': 3, 'mlp_size_2': 3, 'mlp_size_3': 1, 'kernel': 'Weibull', 'loss_name': 'CensoredNLLLoss'}. Best is trial 71 with value: 0.8860575227689568.[0m
[32m[I 2022-04-15 13:47:33,355][0m Trial 72 finished with value: 0.8837076580698227 and parameters: {'n_hidden': 1024, 'mixture_components': 10, 'use_sparse_layer': True, 'use_sparse_loss': False, 'use_batchnorm': False, 'use_dropout': True, 'dropout': 0.5639991029789853, 'mlp_size_1': 2, 'mlp_size_2': 3, 'mlp_size_3': 1, 'kernel': 'Weibull', 'loss_name': 'CensoredNLLLoss'}. Best is trial 71 with value: 0.8860575227689568.[0m
[32m[I 2022-04-15 13:50:01,883][0m Trial 73 finished with value: 0.8860437804477698 and parameters: {'n_hidden': 1024, 'mixture_components': 10, 'use_sparse_layer': True, 'use_sparse_loss': False, 'use_batchnorm': False, 'use_dropout': True, 'dropout': 0.5798223585416361, 'mlp_size_1': 2, 'mlp_size_2': 3, 'mlp_size_3': 1, 'kernel': 'Weibull', 'loss_name': 'CensoredNLLLoss'}. Best is trial 71 with value: 0.8860575227689568.[0m
[32m[I 2022-04-15 13:52:31,682][0m Trial 74 finished with value: 0.8856298796261571 and parameters: {'n_hidden': 1024, 'mixture_components': 10, 'use_sparse_layer': True, 'use_sparse_loss': False, 'use_batchnorm': False, 'use_dropout': True, 'dropout': 0.5816668791753783, 'mlp_size_1': 2, 'mlp_size_2': 3, 'mlp_size_3': 1, 'kernel': 'Weibull', 'loss_name': 'CensoredNLLLoss'}. Best is trial 71 with value: 0.8860575227689568.[0m
[32m[I 2022-04-15 13:54:38,075][0m Trial 75 finished with value: 0.8820311496326425 and parameters: {'n_hidden': 1024, 'mixture_components': 10, 'use_sparse_layer': True, 'use_sparse_loss': False, 'use_batchnorm': False, 'use_dropout': True, 'dropout': 0.5738804387832328, 'mlp_size_1': 2, 'mlp_size_2': 3, 'mlp_size_3': 1, 'kernel': 'Weibull', 'loss_name': 'CensoredNLLLoss'}. Best is trial 71 with value: 0.8860575227689568.[0m
[32m[I 2022-04-15 13:56:46,695][0m Trial 76 finished with value: 0.8833959931435708 and parameters: {'n_hidden': 1024, 'mixture_components': 10, 'use_sparse_layer': True, 'use_sparse_loss': False, 'use_batchnorm': False, 'use_dropout': True, 'dropout': 0.5663946969658805, 'mlp_size_1': 1, 'mlp_size_2': 3, 'mlp_size_3': 1, 'kernel': 'Weibull', 'loss_name': 'CensoredNLLLoss'}. Best is trial 71 with value: 0.8860575227689568.[0m
[32m[I 2022-04-15 13:59:01,999][0m Trial 77 finished with value: 0.8854330986147744 and parameters: {'n_hidden': 1024, 'mixture_components': 10, 'use_sparse_layer': True, 'use_sparse_loss': False, 'use_batchnorm': False, 'use_dropout': True, 'dropout': 0.5435041866555976, 'mlp_size_1': 1, 'mlp_size_2': 3, 'mlp_size_3': 1, 'kernel': 'Weibull', 'loss_name': 'CensoredNLLLoss'}. Best is trial 71 with value: 0.8860575227689568.[0m
[32m[I 2022-04-15 14:01:15,283][0m Trial 78 finished with value: 0.8840307876649088 and parameters: {'n_hidden': 1024, 'mixture_components': 10, 'use_sparse_layer': True, 'use_sparse_loss': False, 'use_batchnorm': False, 'use_dropout': True, 'dropout': 0.4899268554561434, 'mlp_size_1': 1, 'mlp_size_2': 4, 'mlp_size_3': 1, 'kernel': 'Weibull', 'loss_name': 'CensoredNLLLoss'}. Best is trial 71 with value: 0.8860575227689568.[0m
[32m[I 2022-04-15 14:03:54,254][0m Trial 79 finished with value: 0.8815563144771682 and parameters: {'n_hidden': 1024, 'mixture_components': 10, 'use_sparse_layer': True, 'use_sparse_loss': False, 'use_batchnorm': False, 'use_dropout': True, 'dropout': 0.46210094014363645, 'mlp_size_1': 0, 'mlp_size_2': 4, 'mlp_size_3': 1, 'kernel': 'Weibull', 'loss_name': 'CensoredNLLLoss'}. Best is trial 71 with value: 0.8860575227689568.[0m
[32m[I 2022-04-15 14:06:19,133][0m Trial 80 finished with value: 0.8836716323712247 and parameters: {'n_hidden': 1024, 'mixture_components': 10, 'use_sparse_layer': True, 'use_sparse_loss': False, 'use_batchnorm': False, 'use_dropout': True, 'dropout': 0.6499966914042989, 'mlp_size_1': 1, 'mlp_size_2': 4, 'mlp_size_3': 1, 'kernel': 'Weibull', 'loss_name': 'AlternativeNLLLoss'}. Best is trial 71 with value: 0.8860575227689568.[0m
[32m[I 2022-04-15 14:08:30,826][0m Trial 81 finished with value: 0.8800285834540305 and parameters: {'n_hidden': 1024, 'mixture_components': 10, 'use_sparse_layer': True, 'use_sparse_loss': False, 'use_batchnorm': False, 'use_dropout': True, 'dropout': 0.5166708803906486, 'mlp_size_1': 2, 'mlp_size_2': 3, 'mlp_size_3': 1, 'kernel': 'Weibull', 'loss_name': 'CensoredNLLLoss'}. Best is trial 71 with value: 0.8860575227689568.[0m
[32m[I 2022-04-15 14:10:53,474][0m Trial 82 finished with value: 0.8817538873478666 and parameters: {'n_hidden': 1024, 'mixture_components': 10, 'use_sparse_layer': True, 'use_sparse_loss': False, 'use_batchnorm': False, 'use_dropout': True, 'dropout': 0.5146006334622963, 'mlp_size_1': 1, 'mlp_size_2': 3, 'mlp_size_3': 1, 'kernel': 'Weibull', 'loss_name': 'CensoredNLLLoss'}. Best is trial 71 with value: 0.8860575227689568.[0m
[32m[I 2022-04-15 14:13:03,060][0m Trial 83 finished with value: 0.8848672655076696 and parameters: {'n_hidden': 1024, 'mixture_components': 10, 'use_sparse_layer': True, 'use_sparse_loss': False, 'use_batchnorm': False, 'use_dropout': True, 'dropout': 0.6170686057464106, 'mlp_size_1': 1, 'mlp_size_2': 3, 'mlp_size_3': 1, 'kernel': 'Weibull', 'loss_name': 'CensoredNLLLoss'}. Best is trial 71 with value: 0.8860575227689568.[0m
[32m[I 2022-04-15 14:15:33,225][0m Trial 84 finished with value: 0.8836175328564362 and parameters: {'n_hidden': 1024, 'mixture_components': 9, 'use_sparse_layer': True, 'use_sparse_loss': False, 'use_batchnorm': False, 'use_dropout': True, 'dropout': 0.6396827396818776, 'mlp_size_1': 1, 'mlp_size_2': 4, 'mlp_size_3': 1, 'kernel': 'Weibull', 'loss_name': 'CensoredNLLLoss'}. Best is trial 71 with value: 0.8860575227689568.[0m
[32m[I 2022-04-15 14:18:05,678][0m Trial 85 finished with value: 0.8861003543728725 and parameters: {'n_hidden': 1024, 'mixture_components': 10, 'use_sparse_layer': True, 'use_sparse_loss': False, 'use_batchnorm': False, 'use_dropout': True, 'dropout': 0.37813479379686105, 'mlp_size_1': 1, 'mlp_size_2': 4, 'mlp_size_3': 1, 'kernel': 'Weibull', 'loss_name': 'CensoredNLLLoss'}. Best is trial 85 with value: 0.8861003543728725.[0m
[32m[I 2022-04-15 14:20:27,595][0m Trial 86 finished with value: 0.7727498289018693 and parameters: {'n_hidden': 1024, 'mixture_components': 9, 'use_sparse_layer': True, 'use_sparse_loss': False, 'use_batchnorm': False, 'use_dropout': True, 'dropout': 0.3309974520209467, 'mlp_size_1': 0, 'mlp_size_2': 7, 'mlp_size_3': 0, 'kernel': 'Weibull', 'loss_name': 'CensoredNLLLoss'}. Best is trial 85 with value: 0.8861003543728725.[0m
[32m[I 2022-04-15 14:22:40,935][0m Trial 87 finished with value: 0.8866301826616875 and parameters: {'n_hidden': 1024, 'mixture_components': 10, 'use_sparse_layer': True, 'use_sparse_loss': False, 'use_batchnorm': False, 'use_dropout': True, 'dropout': 0.3884947727084014, 'mlp_size_1': 2, 'mlp_size_2': 3, 'mlp_size_3': 1, 'kernel': 'Weibull', 'loss_name': 'CensoredNLLLoss'}. Best is trial 87 with value: 0.8866301826616875.[0m
[32m[I 2022-04-15 14:24:39,908][0m Trial 88 finished with value: 0.6573175233747353 and parameters: {'n_hidden': 1024, 'mixture_components': 10, 'use_sparse_layer': True, 'use_sparse_loss': False, 'use_batchnorm': False, 'use_dropout': True, 'dropout': 0.3689973363229486, 'mlp_size_1': 2, 'mlp_size_2': 3, 'mlp_size_3': 1, 'kernel': 'Weibull', 'loss_name': 'NLLLoss'}. Best is trial 87 with value: 0.8866301826616875.[0m
[32m[I 2022-04-15 14:28:23,074][0m Trial 89 finished with value: 0.7814532146580238 and parameters: {'n_hidden': 1024, 'mixture_components': 9, 'use_sparse_layer': True, 'use_sparse_loss': False, 'use_batchnorm': True, 'use_dropout': True, 'dropout': 0.3968286148470351, 'mlp_size_1': 2, 'mlp_size_2': 3, 'mlp_size_3': 1, 'kernel': 'Weibull', 'loss_name': 'CensoredNLLLoss'}. Best is trial 87 with value: 0.8866301826616875.[0m
[32m[I 2022-04-15 14:31:00,085][0m Trial 90 finished with value: 0.8847858470369664 and parameters: {'n_hidden': 1024, 'mixture_components': 10, 'use_sparse_layer': True, 'use_sparse_loss': False, 'use_batchnorm': False, 'use_dropout': True, 'dropout': 0.6023056819379388, 'mlp_size_1': 3, 'mlp_size_2': 3, 'mlp_size_3': 1, 'kernel': 'Weibull', 'loss_name': 'CensoredNLLLoss'}. Best is trial 87 with value: 0.8866301826616875.[0m
[32m[I 2022-04-15 14:33:33,082][0m Trial 91 finished with value: 0.8830608301985056 and parameters: {'n_hidden': 1024, 'mixture_components': 10, 'use_sparse_layer': True, 'use_sparse_loss': False, 'use_batchnorm': False, 'use_dropout': True, 'dropout': 0.6434081298683836, 'mlp_size_1': 3, 'mlp_size_2': 3, 'mlp_size_3': 1, 'kernel': 'Weibull', 'loss_name': 'CensoredNLLLoss'}. Best is trial 87 with value: 0.8866301826616875.[0m
[32m[I 2022-04-15 14:35:51,847][0m Trial 92 finished with value: 0.8822898400936691 and parameters: {'n_hidden': 1024, 'mixture_components': 10, 'use_sparse_layer': True, 'use_sparse_loss': False, 'use_batchnorm': False, 'use_dropout': True, 'dropout': 0.5475382576869388, 'mlp_size_1': 3, 'mlp_size_2': 3, 'mlp_size_3': 1, 'kernel': 'Weibull', 'loss_name': 'CensoredNLLLoss'}. Best is trial 87 with value: 0.8866301826616875.[0m
[32m[I 2022-04-15 14:38:13,142][0m Trial 93 finished with value: 0.8815769651726253 and parameters: {'n_hidden': 1024, 'mixture_components': 10, 'use_sparse_layer': True, 'use_sparse_loss': False, 'use_batchnorm': False, 'use_dropout': True, 'dropout': 0.6204950564674918, 'mlp_size_1': 1, 'mlp_size_2': 3, 'mlp_size_3': 1, 'kernel': 'Weibull', 'loss_name': 'CensoredNLLLoss'}. Best is trial 87 with value: 0.8866301826616875.[0m
[32m[I 2022-04-15 14:40:26,510][0m Trial 94 finished with value: 0.884347208770159 and parameters: {'n_hidden': 1024, 'mixture_components': 9, 'use_sparse_layer': True, 'use_sparse_loss': False, 'use_batchnorm': False, 'use_dropout': True, 'dropout': 0.26670858695241006, 'mlp_size_1': 2, 'mlp_size_2': 3, 'mlp_size_3': 1, 'kernel': 'Weibull', 'loss_name': 'CensoredNLLLoss'}. Best is trial 87 with value: 0.8866301826616875.[0m
[32m[I 2022-04-15 14:42:12,903][0m Trial 95 finished with value: 0.8169627456691131 and parameters: {'n_hidden': 1024, 'mixture_components': 10, 'use_sparse_layer': True, 'use_sparse_loss': False, 'use_batchnorm': False, 'use_dropout': True, 'dropout': 0.5322440639820921, 'mlp_size_1': 3, 'mlp_size_2': 3, 'mlp_size_3': 1, 'kernel': 'Gumbel', 'loss_name': 'CensoredNLLLoss'}. Best is trial 87 with value: 0.8866301826616875.[0m
[32m[I 2022-04-15 14:44:28,195][0m Trial 96 finished with value: 0.8799043371245242 and parameters: {'n_hidden': 1024, 'mixture_components': 10, 'use_sparse_layer': True, 'use_sparse_loss': False, 'use_batchnorm': False, 'use_dropout': True, 'dropout': 0.4403343440433315, 'mlp_size_1': 2, 'mlp_size_2': 4, 'mlp_size_3': 1, 'kernel': 'Weibull', 'loss_name': 'CensoredNLLLoss'}. Best is trial 87 with value: 0.8866301826616875.[0m
[32m[I 2022-04-15 14:46:50,115][0m Trial 97 finished with value: 0.8820199469445595 and parameters: {'n_hidden': 1024, 'mixture_components': 9, 'use_sparse_layer': True, 'use_sparse_loss': True, 'lmbd': 0.0004055562193086486, 'use_batchnorm': False, 'use_dropout': True, 'dropout': 0.6033266089385028, 'mlp_size_1': 1, 'mlp_size_2': 2, 'mlp_size_3': 2, 'kernel': 'Weibull', 'loss_name': 'CensoredNLLLoss'}. Best is trial 87 with value: 0.8866301826616875.[0m
[32m[I 2022-04-15 14:49:56,611][0m Trial 98 finished with value: 0.7758621922252074 and parameters: {'n_hidden': 1024, 'mixture_components': 10, 'use_sparse_layer': True, 'use_sparse_loss': False, 'use_batchnorm': False, 'use_dropout': True, 'dropout': 0.7302206369936656, 'mlp_size_1': 3, 'mlp_size_2': 3, 'mlp_size_3': 1, 'kernel': 'Normal', 'loss_name': 'CensoredNLLLoss'}. Best is trial 87 with value: 0.8866301826616875.[0m
[32m[I 2022-04-15 14:52:39,448][0m Trial 99 finished with value: 0.7804017971585019 and parameters: {'n_hidden': 1024, 'mixture_components': 9, 'use_sparse_layer': True, 'use_sparse_loss': False, 'use_batchnorm': False, 'use_dropout': True, 'dropout': 0.5116008947714381, 'mlp_size_1': 2, 'mlp_size_2': 3, 'mlp_size_3': 1, 'kernel': 'LogNormal', 'loss_name': 'CensoredNLLLoss'}. Best is trial 87 with value: 0.8866301826616875.[0m
[32m[I 2022-04-15 14:55:38,226][0m Trial 100 finished with value: 0.7731241814407778 and parameters: {'n_hidden': 32, 'mixture_components': 10, 'use_sparse_layer': True, 'use_sparse_loss': False, 'use_batchnorm': False, 'use_dropout': True, 'dropout': 0.6609820377481836, 'mlp_size_1': 2, 'mlp_size_2': 0, 'mlp_size_3': 0, 'kernel': 'Weibull', 'loss_name': 'AlternativeNLLLoss'}. Best is trial 87 with value: 0.8866301826616875.[0m
[32m[I 2022-04-15 14:57:53,928][0m Trial 101 finished with value: 0.8813685782054346 and parameters: {'n_hidden': 1024, 'mixture_components': 10, 'use_sparse_layer': True, 'use_sparse_loss': False, 'use_batchnorm': False, 'use_dropout': True, 'dropout': 0.4191665295586025, 'mlp_size_1': 3, 'mlp_size_2': 3, 'mlp_size_3': 1, 'kernel': 'Weibull', 'loss_name': 'CensoredNLLLoss'}. Best is trial 87 with value: 0.8866301826616875.[0m
