[32m[I 2022-04-13 17:14:37,561][0m Trial 167 finished with value: 0.25 and parameters: {'loss': 'coxph', 'learning_rate': 0.00042669502195940884, 'n_estimators': 513, 'criterion': 'absolute_error', 'min_samples_split': 4, 'min_samples_leaf': 10, 'min_weight_fraction_leaf': 0.23156598467798384, 'min_impurity_decrease': 0.0599348204674435, 'max_features': 0.0616305065263006, 'subsample': 0.8734716019858259, 'dropout_rate': 0.23171810710675292, 'ccp_alpha': 1.1864098108378687}. Best is trial 138 with value: 0.731155530669601.[0m
[32m[I 2022-04-13 17:15:21,299][0m Trial 168 finished with value: 0.25 and parameters: {'loss': 'coxph', 'learning_rate': 0.00023391467841120823, 'n_estimators': 344, 'criterion': 'absolute_error', 'min_samples_split': 4, 'min_samples_leaf': 7, 'min_weight_fraction_leaf': 0.2163021631457977, 'min_impurity_decrease': 0.6499682021931976, 'max_features': 0.038482510495431256, 'subsample': 0.9271448495135913, 'dropout_rate': 0.9428233870927744, 'ccp_alpha': 1.6618578463251716}. Best is trial 138 with value: 0.731155530669601.[0m
[32m[I 2022-04-13 17:16:38,393][0m Trial 169 finished with value: -0.25 and parameters: {'loss': 'squared', 'learning_rate': 0.0010524752388283874, 'n_estimators': 462, 'criterion': 'absolute_error', 'min_samples_split': 4, 'min_samples_leaf': 8, 'min_weight_fraction_leaf': 0.2948131216182141, 'min_impurity_decrease': 0.8867210326491599, 'max_features': 0.9453079339130886, 'subsample': 0.3628274922106819, 'dropout_rate': 0.320860499074536, 'ccp_alpha': 0.0711094718299965}. Best is trial 138 with value: 0.731155530669601.[0m
[32m[I 2022-04-13 17:16:50,306][0m Trial 170 finished with value: 0.25 and parameters: {'loss': 'coxph', 'learning_rate': 7.89876370480229e-06, 'n_estimators': 100, 'criterion': 'squared_error', 'min_samples_split': 5, 'min_samples_leaf': 1, 'min_weight_fraction_leaf': 0.19986822857201259, 'min_impurity_decrease': 0.5127910559869607, 'max_features': 0.9041428430190498, 'subsample': 0.9481674122679402, 'dropout_rate': 0.27526526412613506, 'ccp_alpha': 2.836037828567779}. Best is trial 138 with value: 0.731155530669601.[0m
[32m[I 2022-04-13 17:18:04,039][0m Trial 171 finished with value: 0.25 and parameters: {'loss': 'coxph', 'learning_rate': 0.0013609334531664342, 'n_estimators': 326, 'criterion': 'absolute_error', 'min_samples_split': 4, 'min_samples_leaf': 6, 'min_weight_fraction_leaf': 0.26925242745125133, 'min_impurity_decrease': 0.845895297257044, 'max_features': 0.5638650153770367, 'subsample': 0.6633819617454845, 'dropout_rate': 0.3588509581048284, 'ccp_alpha': 1.5055724990117751}. Best is trial 138 with value: 0.731155530669601.[0m
[32m[I 2022-04-13 17:19:17,981][0m Trial 172 finished with value: 0.25 and parameters: {'loss': 'coxph', 'learning_rate': 0.003669018648268947, 'n_estimators': 325, 'criterion': 'absolute_error', 'min_samples_split': 3, 'min_samples_leaf': 6, 'min_weight_fraction_leaf': 0.2978801376347779, 'min_impurity_decrease': 0.8257280375961116, 'max_features': 0.6699407207977964, 'subsample': 0.4476016507095596, 'dropout_rate': 0.2476489664608602, 'ccp_alpha': 1.9431783283775335}. Best is trial 138 with value: 0.731155530669601.[0m
[32m[I 2022-04-13 17:21:04,626][0m Trial 173 finished with value: 0.25 and parameters: {'loss': 'coxph', 'learning_rate': 0.0011035801666458818, 'n_estimators': 402, 'criterion': 'squared_error', 'min_samples_split': 3, 'min_samples_leaf': 8, 'min_weight_fraction_leaf': 0.11107992681278876, 'min_impurity_decrease': 0.24262223197606617, 'max_features': 0.5957774904768036, 'subsample': 0.36326648850459325, 'dropout_rate': 0.14381133785211503, 'ccp_alpha': 2.4954741874146444}. Best is trial 138 with value: 0.731155530669601.[0m
[32m[I 2022-04-13 17:22:30,403][0m Trial 174 finished with value: 0.25 and parameters: {'loss': 'coxph', 'learning_rate': 0.0008074639311329892, 'n_estimators': 389, 'criterion': 'squared_error', 'min_samples_split': 3, 'min_samples_leaf': 9, 'min_weight_fraction_leaf': 0.09018259980065037, 'min_impurity_decrease': 0.2891540722762163, 'max_features': 0.5303158312359512, 'subsample': 0.5540016791943108, 'dropout_rate': 0.05389047628358165, 'ccp_alpha': 1.3542425994964526}. Best is trial 138 with value: 0.731155530669601.[0m
[32m[I 2022-04-13 17:23:01,964][0m Trial 175 finished with value: 0.25 and parameters: {'loss': 'coxph', 'learning_rate': 0.00015244410527942158, 'n_estimators': 310, 'criterion': 'absolute_error', 'min_samples_split': 7, 'min_samples_leaf': 8, 'min_weight_fraction_leaf': 0.020734246550586345, 'min_impurity_decrease': 0.1689239123938854, 'max_features': 0.44130920738899587, 'subsample': 0.5773682860227569, 'dropout_rate': 0.9999211880695386, 'ccp_alpha': 2.045648381802993}. Best is trial 138 with value: 0.731155530669601.[0m
[32m[I 2022-04-13 17:23:37,363][0m Trial 176 finished with value: 0.25 and parameters: {'loss': 'coxph', 'learning_rate': 0.018017542732781826, 'n_estimators': 289, 'criterion': 'absolute_error', 'min_samples_split': 7, 'min_samples_leaf': 7, 'min_weight_fraction_leaf': 0.40536927724697897, 'min_impurity_decrease': 0.1962413038764092, 'max_features': 0.5671539249157322, 'subsample': 0.6128152694724728, 'dropout_rate': 0.8251618942830716, 'ccp_alpha': 2.247107958470057}. Best is trial 138 with value: 0.731155530669601.[0m
[32m[I 2022-04-13 17:24:06,204][0m Trial 177 finished with value: 0.25 and parameters: {'loss': 'coxph', 'learning_rate': 3.17331551825436e-05, 'n_estimators': 260, 'criterion': 'absolute_error', 'min_samples_split': 7, 'min_samples_leaf': 5, 'min_weight_fraction_leaf': 0.42027420741086235, 'min_impurity_decrease': 0.12725660701991778, 'max_features': 0.5519993122731017, 'subsample': 0.6090050635601265, 'dropout_rate': 0.8610237890570904, 'ccp_alpha': 4.733713427604433}. Best is trial 138 with value: 0.731155530669601.[0m
[32m[I 2022-04-13 17:24:56,732][0m Trial 178 finished with value: 0.25 and parameters: {'loss': 'coxph', 'learning_rate': 4.220805399729776e-05, 'n_estimators': 265, 'criterion': 'absolute_error', 'min_samples_split': 7, 'min_samples_leaf': 6, 'min_weight_fraction_leaf': 0.42440498605457233, 'min_impurity_decrease': 0.16041668372119716, 'max_features': 0.48713861359448013, 'subsample': 0.6969013015102089, 'dropout_rate': 0.2939941761950821, 'ccp_alpha': 4.917644099508439}. Best is trial 138 with value: 0.731155530669601.[0m
[32m[I 2022-04-13 17:26:00,127][0m Trial 179 finished with value: 0.25 and parameters: {'loss': 'coxph', 'learning_rate': 0.0002469340441274156, 'n_estimators': 320, 'criterion': 'absolute_error', 'min_samples_split': 7, 'min_samples_leaf': 4, 'min_weight_fraction_leaf': 0.400963751713296, 'min_impurity_decrease': 0.2157216070502345, 'max_features': 0.6098236956070147, 'subsample': 0.6081782589491737, 'dropout_rate': 0.33919231936038907, 'ccp_alpha': 4.618504595541431}. Best is trial 138 with value: 0.731155530669601.[0m
[32m[I 2022-04-13 17:26:46,246][0m Trial 180 finished with value: 0.25 and parameters: {'loss': 'coxph', 'learning_rate': 0.00030703752521416537, 'n_estimators': 277, 'criterion': 'absolute_error', 'min_samples_split': 2, 'min_samples_leaf': 4, 'min_weight_fraction_leaf': 0.3691535191210537, 'min_impurity_decrease': 0.21890270929894554, 'max_features': 0.08613304994768621, 'subsample': 0.6640202187923908, 'dropout_rate': 0.3300721964836635, 'ccp_alpha': 1.8697038924135847}. Best is trial 138 with value: 0.731155530669601.[0m
[32m[I 2022-04-13 17:27:18,396][0m Trial 181 finished with value: 0.25 and parameters: {'loss': 'coxph', 'learning_rate': 0.009710492370849576, 'n_estimators': 222, 'criterion': 'friedman_mse', 'min_samples_split': 7, 'min_samples_leaf': 4, 'min_weight_fraction_leaf': 0.4481086242906579, 'min_impurity_decrease': 0.11984586913463822, 'max_features': 0.5013182647639361, 'subsample': 0.20459439835652515, 'dropout_rate': 0.44619966446990994, 'ccp_alpha': 0.8981624277219482}. Best is trial 138 with value: 0.731155530669601.[0m
[32m[I 2022-04-13 17:27:58,148][0m Trial 182 finished with value: 0.25 and parameters: {'loss': 'coxph', 'learning_rate': 3.76722222296962e-06, 'n_estimators': 231, 'criterion': 'friedman_mse', 'min_samples_split': 7, 'min_samples_leaf': 4, 'min_weight_fraction_leaf': 0.4630677614790425, 'min_impurity_decrease': 0.7139918356932939, 'max_features': 0.1140247399326, 'subsample': 0.1148948471072421, 'dropout_rate': 0.3961112878689521, 'ccp_alpha': 4.230946172477132}. Best is trial 138 with value: 0.731155530669601.[0m
[32m[I 2022-04-13 17:28:40,854][0m Trial 183 finished with value: 0.25 and parameters: {'loss': 'coxph', 'learning_rate': 0.007451017792364682, 'n_estimators': 287, 'criterion': 'friedman_mse', 'min_samples_split': 6, 'min_samples_leaf': 4, 'min_weight_fraction_leaf': 0.45617788534032827, 'min_impurity_decrease': 0.13409991435060986, 'max_features': 0.4301154151387695, 'subsample': 0.17716933929551454, 'dropout_rate': 0.6406750238907143, 'ccp_alpha': 4.6715957087394635}. Best is trial 138 with value: 0.731155530669601.[0m
[32m[I 2022-04-13 17:29:20,297][0m Trial 184 finished with value: 0.25 and parameters: {'loss': 'coxph', 'learning_rate': 1.3452326063973598e-06, 'n_estimators': 244, 'criterion': 'friedman_mse', 'min_samples_split': 6, 'min_samples_leaf': 5, 'min_weight_fraction_leaf': 0.320607003889431, 'min_impurity_decrease': 0.6931178491093702, 'max_features': 0.46248408299655264, 'subsample': 0.22444608344619293, 'dropout_rate': 0.4632751669882026, 'ccp_alpha': 4.738985768291471}. Best is trial 138 with value: 0.731155530669601.[0m
[32m[I 2022-04-13 17:29:56,564][0m Trial 185 finished with value: 0.25 and parameters: {'loss': 'coxph', 'learning_rate': 1.9719301387323756e-06, 'n_estimators': 259, 'criterion': 'friedman_mse', 'min_samples_split': 6, 'min_samples_leaf': 5, 'min_weight_fraction_leaf': 0.41138609492124295, 'min_impurity_decrease': 0.6653833758092007, 'max_features': 0.06820611130221174, 'subsample': 0.7136575949605891, 'dropout_rate': 0.43897099934983114, 'ccp_alpha': 4.12175238766589}. Best is trial 138 with value: 0.731155530669601.[0m
[32m[I 2022-04-13 17:30:33,995][0m Trial 186 finished with value: 0.25 and parameters: {'loss': 'coxph', 'learning_rate': 2.555019908010366e-06, 'n_estimators': 210, 'criterion': 'friedman_mse', 'min_samples_split': 6, 'min_samples_leaf': 6, 'min_weight_fraction_leaf': 0.008126569891273175, 'min_impurity_decrease': 0.7417372222926373, 'max_features': 0.3681340589805108, 'subsample': 0.1833471782855001, 'dropout_rate': 0.4036782195758222, 'ccp_alpha': 3.875620509718269}. Best is trial 138 with value: 0.731155530669601.[0m
[32m[I 2022-04-13 17:31:07,383][0m Trial 187 finished with value: 0.25 and parameters: {'loss': 'coxph', 'learning_rate': 1.6024756625116606e-05, 'n_estimators': 218, 'criterion': 'friedman_mse', 'min_samples_split': 6, 'min_samples_leaf': 4, 'min_weight_fraction_leaf': 0.02165281766581668, 'min_impurity_decrease': 0.7855853419564137, 'max_features': 0.39208725614579976, 'subsample': 0.76137229542673, 'dropout_rate': 0.42444980496548235, 'ccp_alpha': 4.528024090976325}. Best is trial 138 with value: 0.731155530669601.[0m
[32m[I 2022-04-13 17:31:45,981][0m Trial 188 finished with value: 0.25 and parameters: {'loss': 'coxph', 'learning_rate': 1.5563778073546793e-06, 'n_estimators': 211, 'criterion': 'friedman_mse', 'min_samples_split': 6, 'min_samples_leaf': 3, 'min_weight_fraction_leaf': 0.0028094919660916137, 'min_impurity_decrease': 0.6821245116980189, 'max_features': 0.08689059151454984, 'subsample': 0.08928957299341889, 'dropout_rate': 0.37904693745478685, 'ccp_alpha': 3.9399374583946662}. Best is trial 138 with value: 0.731155530669601.[0m
[32m[I 2022-04-13 17:32:13,767][0m Trial 189 finished with value: 0.25 and parameters: {'loss': 'coxph', 'learning_rate': 1.1190834746868817e-06, 'n_estimators': 245, 'criterion': 'friedman_mse', 'min_samples_split': 6, 'min_samples_leaf': 6, 'min_weight_fraction_leaf': 0.036365275153962234, 'min_impurity_decrease': 0.7538733521186615, 'max_features': 0.11172778363926714, 'subsample': 0.7426308478150846, 'dropout_rate': 0.5506800730588358, 'ccp_alpha': 4.08411285079831}. Best is trial 138 with value: 0.731155530669601.[0m
[32m[I 2022-04-13 17:32:55,689][0m Trial 190 finished with value: 0.25 and parameters: {'loss': 'coxph', 'learning_rate': 2.9738531297208082e-06, 'n_estimators': 252, 'criterion': 'friedman_mse', 'min_samples_split': 6, 'min_samples_leaf': 6, 'min_weight_fraction_leaf': 0.43739054878450917, 'min_impurity_decrease': 0.9831124358620786, 'max_features': 0.061385619102254374, 'subsample': 0.13624534752760764, 'dropout_rate': 0.6405798277831087, 'ccp_alpha': 4.149997648252551}. Best is trial 138 with value: 0.731155530669601.[0m
[32m[I 2022-04-13 17:33:27,362][0m Trial 191 finished with value: 0.25 and parameters: {'loss': 'coxph', 'learning_rate': 2.3656005725581608e-05, 'n_estimators': 230, 'criterion': 'friedman_mse', 'min_samples_split': 8, 'min_samples_leaf': 3, 'min_weight_fraction_leaf': 0.39606947172281337, 'min_impurity_decrease': 0.9107683925173304, 'max_features': 0.008223024149599415, 'subsample': 0.20870340329079745, 'dropout_rate': 0.5834111412430484, 'ccp_alpha': 4.990642846853507}. Best is trial 138 with value: 0.731155530669601.[0m
[32m[I 2022-04-13 17:37:36,051][0m Trial 192 finished with value: 0.25 and parameters: {'loss': 'coxph', 'learning_rate': 3.3404634722885295e-05, 'n_estimators': 981, 'criterion': 'friedman_mse', 'min_samples_split': 8, 'min_samples_leaf': 3, 'min_weight_fraction_leaf': 0.35332526246228546, 'min_impurity_decrease': 0.7696754620518468, 'max_features': 0.7755399246199618, 'subsample': 0.7188483099254644, 'dropout_rate': 0.5943602735540503, 'ccp_alpha': 4.8792713367605085}. Best is trial 138 with value: 0.731155530669601.[0m
[32m[I 2022-04-13 17:41:11,668][0m Trial 193 finished with value: 0.25 and parameters: {'loss': 'coxph', 'learning_rate': 4.8764076536939556e-05, 'n_estimators': 837, 'criterion': 'friedman_mse', 'min_samples_split': 8, 'min_samples_leaf': 3, 'min_weight_fraction_leaf': 0.013474842372168228, 'min_impurity_decrease': 0.726644517317661, 'max_features': 0.775957716489198, 'subsample': 0.266160375592098, 'dropout_rate': 0.5705072786975043, 'ccp_alpha': 3.8167862654748355}. Best is trial 138 with value: 0.731155530669601.[0m
[32m[I 2022-04-13 17:44:20,434][0m Trial 194 finished with value: 0.25 and parameters: {'loss': 'coxph', 'learning_rate': 2.7440036240599593e-05, 'n_estimators': 875, 'criterion': 'friedman_mse', 'min_samples_split': 8, 'min_samples_leaf': 3, 'min_weight_fraction_leaf': 0.4312880045060646, 'min_impurity_decrease': 0.38767354153913874, 'max_features': 0.7585251186712647, 'subsample': 0.6441420425354155, 'dropout_rate': 0.6978587380117974, 'ccp_alpha': 4.810365205520097}. Best is trial 138 with value: 0.731155530669601.[0m
[32m[I 2022-04-13 17:47:45,577][0m Trial 195 finished with value: 0.25 and parameters: {'loss': 'coxph', 'learning_rate': 4.0241090031504173e-05, 'n_estimators': 944, 'criterion': 'friedman_mse', 'min_samples_split': 8, 'min_samples_leaf': 2, 'min_weight_fraction_leaf': 0.04987699936744865, 'min_impurity_decrease': 0.4044126569084972, 'max_features': 0.7256139029626689, 'subsample': 0.6313985873553587, 'dropout_rate': 0.7202406950238152, 'ccp_alpha': 4.31728177625692}. Best is trial 138 with value: 0.731155530669601.[0m
[32m[I 2022-04-13 17:50:23,894][0m Trial 196 finished with value: 0.25 and parameters: {'loss': 'coxph', 'learning_rate': 2.260024616490742e-06, 'n_estimators': 764, 'criterion': 'friedman_mse', 'min_samples_split': 6, 'min_samples_leaf': 2, 'min_weight_fraction_leaf': 0.4486355323133101, 'min_impurity_decrease': 0.6971451424586267, 'max_features': 0.1865980891667224, 'subsample': 0.28593422404948093, 'dropout_rate': 0.6853667811523567, 'ccp_alpha': 3.5130583429487627}. Best is trial 138 with value: 0.731155530669601.[0m
[32m[I 2022-04-13 17:53:16,261][0m Trial 197 finished with value: 0.25 and parameters: {'loss': 'coxph', 'learning_rate': 1.5386440874644831e-06, 'n_estimators': 783, 'criterion': 'friedman_mse', 'min_samples_split': 8, 'min_samples_leaf': 2, 'min_weight_fraction_leaf': 0.411645790129947, 'min_impurity_decrease': 0.37645638160922906, 'max_features': 0.7549048942564566, 'subsample': 0.25157820923046853, 'dropout_rate': 0.6230110543653835, 'ccp_alpha': 4.747447818653311}. Best is trial 138 with value: 0.731155530669601.[0m
[32m[I 2022-04-13 17:57:00,450][0m Trial 198 finished with value: 0.25 and parameters: {'loss': 'coxph', 'learning_rate': 1.0480117589026077e-06, 'n_estimators': 891, 'criterion': 'friedman_mse', 'min_samples_split': 8, 'min_samples_leaf': 3, 'min_weight_fraction_leaf': 0.39095882250049663, 'min_impurity_decrease': 0.6388308729303267, 'max_features': 0.7913886509242731, 'subsample': 0.2381125647492912, 'dropout_rate': 0.6064527437982752, 'ccp_alpha': 3.999835028320573}. Best is trial 138 with value: 0.731155530669601.[0m
[32m[I 2022-04-13 17:57:56,311][0m Trial 199 finished with value: 0.25 and parameters: {'loss': 'coxph', 'learning_rate': 1.4656079030373448e-06, 'n_estimators': 301, 'criterion': 'friedman_mse', 'min_samples_split': 7, 'min_samples_leaf': 5, 'min_weight_fraction_leaf': 0.3193941246646646, 'min_impurity_decrease': 0.6406443196274456, 'max_features': 0.03017879257465592, 'subsample': 0.13978097868050782, 'dropout_rate': 0.4747159453754987, 'ccp_alpha': 0.4440219593268937}. Best is trial 138 with value: 0.731155530669601.[0m
[32m[I 2022-04-13 17:58:11,695][0m Trial 200 finished with value: -0.28184912657428934 and parameters: {'loss': 'squared', 'learning_rate': 1.7002830921508686e-06, 'n_estimators': 263, 'criterion': 'friedman_mse', 'min_samples_split': 7, 'min_samples_leaf': 5, 'min_weight_fraction_leaf': 0.41415905133383213, 'min_impurity_decrease': 0.6746049090843711, 'max_features': 0.07485723933299218, 'subsample': 0.711139591348393, 'dropout_rate': 0.4293502940328838, 'ccp_alpha': 0.15367774004350038}. Best is trial 138 with value: 0.731155530669601.[0m
[32m[I 2022-04-13 17:59:14,236][0m Trial 201 finished with value: 0.25 and parameters: {'loss': 'coxph', 'learning_rate': 0.0001129094811120476, 'n_estimators': 341, 'criterion': 'friedman_mse', 'min_samples_split': 2, 'min_samples_leaf': 5, 'min_weight_fraction_leaf': 0.3289005333995777, 'min_impurity_decrease': 0.6694428144857527, 'max_features': 0.05304027630534481, 'subsample': 0.682579098647662, 'dropout_rate': 0.4311778094927463, 'ccp_alpha': 1.1114382328880303}. Best is trial 138 with value: 0.731155530669601.[0m
[32m[I 2022-04-13 18:02:10,982][0m Trial 202 finished with value: 0.25 and parameters: {'loss': 'coxph', 'learning_rate': 2.297284246526815e-06, 'n_estimators': 854, 'criterion': 'friedman_mse', 'min_samples_split': 6, 'min_samples_leaf': 3, 'min_weight_fraction_leaf': 0.06256326051180443, 'min_impurity_decrease': 0.630558353704998, 'max_features': 0.2333489903826944, 'subsample': 0.47820883155813243, 'dropout_rate': 0.6783868200975446, 'ccp_alpha': 0.2942431074234507}. Best is trial 138 with value: 0.731155530669601.[0m
[32m[I 2022-04-13 18:06:38,926][0m Trial 203 finished with value: 0.25 and parameters: {'loss': 'coxph', 'learning_rate': 3.3010635753927884e-06, 'n_estimators': 966, 'criterion': 'friedman_mse', 'min_samples_split': 6, 'min_samples_leaf': 2, 'min_weight_fraction_leaf': 0.34118981151931665, 'min_impurity_decrease': 0.31479266676187573, 'max_features': 0.2438565847179247, 'subsample': 0.5261666753370449, 'dropout_rate': 0.49353135084324756, 'ccp_alpha': 3.725692762174665}. Best is trial 138 with value: 0.731155530669601.[0m
[32m[I 2022-04-13 18:10:08,456][0m Trial 204 finished with value: 0.25 and parameters: {'loss': 'coxph', 'learning_rate': 3.932204034519332e-06, 'n_estimators': 897, 'criterion': 'friedman_mse', 'min_samples_split': 6, 'min_samples_leaf': 2, 'min_weight_fraction_leaf': 0.042218490931226316, 'min_impurity_decrease': 0.7301396243303431, 'max_features': 0.14948432195901407, 'subsample': 0.512354686700076, 'dropout_rate': 0.510839011859268, 'ccp_alpha': 3.9238307963125805}. Best is trial 138 with value: 0.731155530669601.[0m
[32m[I 2022-04-13 18:13:17,538][0m Trial 205 finished with value: 0.25 and parameters: {'loss': 'coxph', 'learning_rate': 2.0187561605241455e-06, 'n_estimators': 829, 'criterion': 'friedman_mse', 'min_samples_split': 6, 'min_samples_leaf': 3, 'min_weight_fraction_leaf': 0.4770038398354994, 'min_impurity_decrease': 0.5692690665904693, 'max_features': 0.3230013219691566, 'subsample': 0.497312685029278, 'dropout_rate': 0.533098310518642, 'ccp_alpha': 3.628087454009655}. Best is trial 138 with value: 0.731155530669601.[0m
[32m[I 2022-04-13 18:15:29,999][0m Trial 206 finished with value: 0.25 and parameters: {'loss': 'coxph', 'learning_rate': 5.2989459625508955e-05, 'n_estimators': 751, 'criterion': 'friedman_mse', 'min_samples_split': 10, 'min_samples_leaf': 2, 'min_weight_fraction_leaf': 0.48097825880952405, 'min_impurity_decrease': 0.5883554416407426, 'max_features': 0.16678742655668669, 'subsample': 0.4605845432754355, 'dropout_rate': 0.6582055243384749, 'ccp_alpha': 3.314161850620664}. Best is trial 138 with value: 0.731155530669601.[0m
[32m[I 2022-04-13 18:17:34,830][0m Trial 207 finished with value: 0.25 and parameters: {'loss': 'coxph', 'learning_rate': 0.045479977426616004, 'n_estimators': 672, 'criterion': 'squared_error', 'min_samples_split': 10, 'min_samples_leaf': 2, 'min_weight_fraction_leaf': 0.07093832996828654, 'min_impurity_decrease': 0.5333436557636902, 'max_features': 0.25723234489421865, 'subsample': 0.2610970176906429, 'dropout_rate': 0.6751824022646518, 'ccp_alpha': 3.2956566653694703}. Best is trial 138 with value: 0.731155530669601.[0m
