[32m[I 2022-04-17 14:37:15,817][0m Trial 276 finished with value: 0.7601073776400282 and parameters: {'n_hidden': 128, 'mixture_components': 4, 'use_sparse_layer': True, 'use_sparse_loss': True, 'lmbd': 2.7901136825093307e-06, 'use_batchnorm': False, 'use_dropout': True, 'dropout': 0.6645274401078953, 'mlp_size_1': 1, 'mlp_size_2': 3, 'mlp_size_3': 0, 'kernel': 'Normal', 'loss_name': 'CensoredNLLLoss'}. Best is trial 245 with value: 0.7744390497152815.[0m
[32m[I 2022-04-17 14:39:17,059][0m Trial 277 finished with value: 0.7669891960206305 and parameters: {'n_hidden': 256, 'mixture_components': 9, 'use_sparse_layer': True, 'use_sparse_loss': False, 'use_batchnorm': False, 'use_dropout': True, 'dropout': 0.6959521691386086, 'mlp_size_1': 1, 'mlp_size_2': 4, 'mlp_size_3': 0, 'kernel': 'Exponential', 'loss_name': 'AlternativeNLLLoss'}. Best is trial 245 with value: 0.7744390497152815.[0m
[32m[I 2022-04-17 14:41:17,433][0m Trial 278 finished with value: 0.7711020731997549 and parameters: {'n_hidden': 256, 'mixture_components': 8, 'use_sparse_layer': True, 'use_sparse_loss': False, 'use_batchnorm': False, 'use_dropout': True, 'dropout': 0.6478642797763896, 'mlp_size_1': 1, 'mlp_size_2': 4, 'mlp_size_3': 0, 'kernel': 'Exponential', 'loss_name': 'CensoredNLLLoss'}. Best is trial 245 with value: 0.7744390497152815.[0m
[32m[I 2022-04-17 14:43:19,137][0m Trial 279 finished with value: 0.7659258408548097 and parameters: {'n_hidden': 1024, 'mixture_components': 5, 'use_sparse_layer': True, 'use_sparse_loss': False, 'use_batchnorm': False, 'use_dropout': True, 'dropout': 0.5791436874779031, 'mlp_size_1': 3, 'mlp_size_2': 4, 'mlp_size_3': 0, 'kernel': 'LogLogistic', 'loss_name': 'CensoredNLLLoss'}. Best is trial 245 with value: 0.7744390497152815.[0m
[32m[I 2022-04-17 14:45:11,953][0m Trial 280 finished with value: 0.7648074176157073 and parameters: {'n_hidden': 256, 'mixture_components': 9, 'use_sparse_layer': True, 'use_sparse_loss': False, 'use_batchnorm': False, 'use_dropout': True, 'dropout': 0.6089785077702679, 'mlp_size_1': 1, 'mlp_size_2': 4, 'mlp_size_3': 0, 'kernel': 'Gamma', 'loss_name': 'CensoredNLLLoss'}. Best is trial 245 with value: 0.7744390497152815.[0m
[32m[I 2022-04-17 14:47:13,440][0m Trial 281 finished with value: 0.7691930933028747 and parameters: {'n_hidden': 256, 'mixture_components': 10, 'use_sparse_layer': True, 'use_sparse_loss': False, 'use_batchnorm': False, 'use_dropout': True, 'dropout': 0.7112488361744186, 'mlp_size_1': 1, 'mlp_size_2': 4, 'mlp_size_3': 0, 'kernel': 'Exponential', 'loss_name': 'AlternativeNLLLoss'}. Best is trial 245 with value: 0.7744390497152815.[0m
[32m[I 2022-04-17 14:49:39,593][0m Trial 282 finished with value: 0.7695542819813233 and parameters: {'n_hidden': 256, 'mixture_components': 5, 'use_sparse_layer': True, 'use_sparse_loss': False, 'use_batchnorm': False, 'use_dropout': True, 'dropout': 0.7507812723404078, 'mlp_size_1': 1, 'mlp_size_2': 4, 'mlp_size_3': 0, 'kernel': 'Exponential', 'loss_name': 'CensoredNLLLoss'}. Best is trial 245 with value: 0.7744390497152815.[0m
[32m[I 2022-04-17 14:52:02,123][0m Trial 283 finished with value: 0.7717368900370367 and parameters: {'n_hidden': 256, 'mixture_components': 8, 'use_sparse_layer': True, 'use_sparse_loss': False, 'use_batchnorm': False, 'use_dropout': True, 'dropout': 0.6813219240043986, 'mlp_size_1': 1, 'mlp_size_2': 4, 'mlp_size_3': 0, 'kernel': 'Exponential', 'loss_name': 'CensoredNLLLoss'}. Best is trial 245 with value: 0.7744390497152815.[0m
[32m[I 2022-04-17 14:53:54,658][0m Trial 284 finished with value: 0.771020004070141 and parameters: {'n_hidden': 256, 'mixture_components': 10, 'use_sparse_layer': True, 'use_sparse_loss': False, 'use_batchnorm': False, 'use_dropout': True, 'dropout': 0.28078019515143426, 'mlp_size_1': 1, 'mlp_size_2': 4, 'mlp_size_3': 0, 'kernel': 'Exponential', 'loss_name': 'AlternativeNLLLoss'}. Best is trial 245 with value: 0.7744390497152815.[0m
[32m[I 2022-04-17 14:56:57,883][0m Trial 285 finished with value: 0.7655234547816292 and parameters: {'n_hidden': 64, 'mixture_components': 10, 'use_sparse_layer': True, 'use_sparse_loss': True, 'lmbd': 0.018681589353964592, 'use_batchnorm': False, 'use_dropout': True, 'dropout': 0.655807888230921, 'mlp_size_1': 1, 'mlp_size_2': 2, 'mlp_size_3': 0, 'kernel': 'Exponential', 'loss_name': 'CensoredNLLLoss'}. Best is trial 245 with value: 0.7744390497152815.[0m
[32m[I 2022-04-17 14:58:35,246][0m Trial 286 finished with value: 0.6517341752026543 and parameters: {'n_hidden': 256, 'mixture_components': 9, 'use_sparse_layer': True, 'use_sparse_loss': False, 'use_batchnorm': False, 'use_dropout': True, 'dropout': 0.5116685987594783, 'mlp_size_1': 1, 'mlp_size_2': 4, 'mlp_size_3': 0, 'kernel': 'Gumbel', 'loss_name': 'CensoredNLLLoss'}. Best is trial 245 with value: 0.7744390497152815.[0m
[32m[I 2022-04-17 15:00:41,437][0m Trial 287 finished with value: 0.7702965574880076 and parameters: {'n_hidden': 256, 'mixture_components': 10, 'use_sparse_layer': True, 'use_sparse_loss': False, 'use_batchnorm': False, 'use_dropout': True, 'dropout': 0.7018425561484071, 'mlp_size_1': 1, 'mlp_size_2': 4, 'mlp_size_3': 0, 'kernel': 'Exponential', 'loss_name': 'CensoredNLLLoss'}. Best is trial 245 with value: 0.7744390497152815.[0m
[32m[I 2022-04-17 15:02:59,579][0m Trial 288 finished with value: 0.769215886529218 and parameters: {'n_hidden': 1024, 'mixture_components': 10, 'use_sparse_layer': True, 'use_sparse_loss': False, 'use_batchnorm': False, 'use_dropout': True, 'dropout': 0.6373837773822199, 'mlp_size_1': 0, 'mlp_size_2': 5, 'mlp_size_3': 2, 'kernel': 'Exponential', 'loss_name': 'AlternativeNLLLoss'}. Best is trial 245 with value: 0.7744390497152815.[0m
[32m[I 2022-04-17 15:04:53,843][0m Trial 289 finished with value: 0.7609910274886097 and parameters: {'n_hidden': 256, 'mixture_components': 1, 'use_sparse_layer': True, 'use_sparse_loss': False, 'use_batchnorm': False, 'use_dropout': True, 'dropout': 0.561394655956911, 'mlp_size_1': 1, 'mlp_size_2': 4, 'mlp_size_3': 0, 'kernel': 'Exponential', 'loss_name': 'CensoredNLLLoss'}. Best is trial 245 with value: 0.7744390497152815.[0m
[32m[I 2022-04-17 15:07:10,643][0m Trial 290 finished with value: 0.7705581717239044 and parameters: {'n_hidden': 256, 'mixture_components': 5, 'use_sparse_layer': True, 'use_sparse_loss': False, 'use_batchnorm': False, 'use_dropout': True, 'dropout': 0.7324068205152626, 'mlp_size_1': 1, 'mlp_size_2': 4, 'mlp_size_3': 0, 'kernel': 'Exponential', 'loss_name': 'CensoredNLLLoss'}. Best is trial 245 with value: 0.7744390497152815.[0m
[32m[I 2022-04-17 15:10:25,421][0m Trial 291 finished with value: 0.7667548760206946 and parameters: {'n_hidden': 256, 'mixture_components': 10, 'use_sparse_layer': True, 'use_sparse_loss': False, 'use_batchnorm': True, 'use_dropout': True, 'dropout': 0.4145064077920083, 'mlp_size_1': 1, 'mlp_size_2': 4, 'mlp_size_3': 0, 'kernel': 'Weibull', 'loss_name': 'CensoredNLLLoss'}. Best is trial 245 with value: 0.7744390497152815.[0m
[32m[I 2022-04-17 15:12:26,687][0m Trial 292 finished with value: 0.7725590550745116 and parameters: {'n_hidden': 256, 'mixture_components': 10, 'use_sparse_layer': True, 'use_sparse_loss': False, 'use_batchnorm': False, 'use_dropout': True, 'dropout': 0.6767866253619548, 'mlp_size_1': 1, 'mlp_size_2': 4, 'mlp_size_3': 0, 'kernel': 'Exponential', 'loss_name': 'AlternativeNLLLoss'}. Best is trial 245 with value: 0.7744390497152815.[0m
[32m[I 2022-04-17 15:14:36,862][0m Trial 293 finished with value: 0.7733292307979224 and parameters: {'n_hidden': 256, 'mixture_components': 9, 'use_sparse_layer': True, 'use_sparse_loss': False, 'use_batchnorm': False, 'use_dropout': True, 'dropout': 0.776352599024239, 'mlp_size_1': 1, 'mlp_size_2': 4, 'mlp_size_3': 0, 'kernel': 'Exponential', 'loss_name': 'CensoredNLLLoss'}. Best is trial 245 with value: 0.7744390497152815.[0m
[32m[I 2022-04-17 15:18:23,361][0m Trial 294 finished with value: 0.7668717998888985 and parameters: {'n_hidden': 32, 'mixture_components': 4, 'use_sparse_layer': True, 'use_sparse_loss': False, 'use_batchnorm': False, 'use_dropout': True, 'dropout': 0.7716159358716091, 'mlp_size_1': 1, 'mlp_size_2': 1, 'mlp_size_3': 0, 'kernel': 'Exponential', 'loss_name': 'CensoredNLLLoss'}. Best is trial 245 with value: 0.7744390497152815.[0m
[32m[I 2022-04-17 15:20:17,727][0m Trial 295 finished with value: 0.6970004263317876 and parameters: {'n_hidden': 256, 'mixture_components': 10, 'use_sparse_layer': True, 'use_sparse_loss': True, 'lmbd': 1.0989049761440295e-06, 'use_batchnorm': False, 'use_dropout': True, 'dropout': 0.7992554175723156, 'mlp_size_1': 1, 'mlp_size_2': 4, 'mlp_size_3': 0, 'kernel': 'Exponential', 'loss_name': 'NLLLoss'}. Best is trial 245 with value: 0.7744390497152815.[0m
[32m[I 2022-04-17 15:24:02,942][0m Trial 296 finished with value: 0.7612552005599182 and parameters: {'n_hidden': 256, 'mixture_components': 10, 'use_sparse_layer': True, 'use_sparse_loss': False, 'use_batchnorm': False, 'use_dropout': True, 'dropout': 0.709067495516756, 'mlp_size_1': 1, 'mlp_size_2': 4, 'mlp_size_3': 0, 'kernel': 'LogNormal', 'loss_name': 'CensoredNLLLoss'}. Best is trial 245 with value: 0.7744390497152815.[0m
[32m[I 2022-04-17 15:26:38,027][0m Trial 297 finished with value: 0.7653460671650373 and parameters: {'n_hidden': 1024, 'mixture_components': 9, 'use_sparse_layer': True, 'use_sparse_loss': False, 'use_batchnorm': False, 'use_dropout': True, 'dropout': 0.8179300263207221, 'mlp_size_1': 0, 'mlp_size_2': 3, 'mlp_size_3': 2, 'kernel': 'Exponential', 'loss_name': 'AlternativeNLLLoss'}. Best is trial 245 with value: 0.7744390497152815.[0m
[32m[I 2022-04-17 15:28:45,776][0m Trial 298 finished with value: 0.7706933923760468 and parameters: {'n_hidden': 256, 'mixture_components': 10, 'use_sparse_layer': True, 'use_sparse_loss': False, 'use_batchnorm': False, 'use_dropout': True, 'dropout': 0.7487360927451134, 'mlp_size_1': 1, 'mlp_size_2': 4, 'mlp_size_3': 0, 'kernel': 'Exponential', 'loss_name': 'CensoredNLLLoss'}. Best is trial 245 with value: 0.7744390497152815.[0m
[32m[I 2022-04-17 15:30:56,266][0m Trial 299 finished with value: 0.7728682778337778 and parameters: {'n_hidden': 256, 'mixture_components': 5, 'use_sparse_layer': True, 'use_sparse_loss': False, 'use_batchnorm': False, 'use_dropout': True, 'dropout': 0.7854827334033851, 'mlp_size_1': 1, 'mlp_size_2': 4, 'mlp_size_3': 0, 'kernel': 'Exponential', 'loss_name': 'CensoredNLLLoss'}. Best is trial 245 with value: 0.7744390497152815.[0m
[32m[I 2022-04-17 15:33:33,023][0m Trial 300 finished with value: 0.7607482771936152 and parameters: {'n_hidden': 256, 'mixture_components': 5, 'use_sparse_layer': True, 'use_sparse_loss': False, 'use_batchnorm': False, 'use_dropout': True, 'dropout': 0.7732422780931297, 'mlp_size_1': 1, 'mlp_size_2': 4, 'mlp_size_3': 0, 'kernel': 'Logistic', 'loss_name': 'CensoredNLLLoss'}. Best is trial 245 with value: 0.7744390497152815.[0m
[32m[I 2022-04-17 15:36:52,869][0m Trial 301 finished with value: 0.7703723570177111 and parameters: {'n_hidden': 64, 'mixture_components': 5, 'use_sparse_layer': True, 'use_sparse_loss': False, 'use_batchnorm': False, 'use_dropout': True, 'dropout': 0.8210684332023243, 'mlp_size_1': 1, 'mlp_size_2': 2, 'mlp_size_3': 0, 'kernel': 'Exponential', 'loss_name': 'AlternativeNLLLoss'}. Best is trial 245 with value: 0.7744390497152815.[0m
[32m[I 2022-04-17 15:39:00,098][0m Trial 302 finished with value: 0.772309361750672 and parameters: {'n_hidden': 256, 'mixture_components': 5, 'use_sparse_layer': True, 'use_sparse_loss': False, 'use_batchnorm': False, 'use_dropout': True, 'dropout': 0.8566854289584118, 'mlp_size_1': 1, 'mlp_size_2': 4, 'mlp_size_3': 0, 'kernel': 'Exponential', 'loss_name': 'CensoredNLLLoss'}. Best is trial 245 with value: 0.7744390497152815.[0m
[32m[I 2022-04-17 15:41:12,447][0m Trial 303 finished with value: 0.7328828363623335 and parameters: {'n_hidden': 2048, 'mixture_components': 5, 'use_sparse_layer': True, 'use_sparse_loss': False, 'use_batchnorm': False, 'use_dropout': True, 'dropout': 0.7871276853329571, 'mlp_size_1': 0, 'mlp_size_2': 5, 'mlp_size_3': 0, 'kernel': 'Exponential', 'loss_name': 'CensoredNLLLoss'}. Best is trial 245 with value: 0.7744390497152815.[0m
[32m[I 2022-04-17 15:43:08,026][0m Trial 304 finished with value: 0.7678945944375674 and parameters: {'n_hidden': 256, 'mixture_components': 5, 'use_sparse_layer': True, 'use_sparse_loss': False, 'use_batchnorm': False, 'use_dropout': True, 'dropout': 0.7545347197772377, 'mlp_size_1': 2, 'mlp_size_2': 3, 'mlp_size_3': 0, 'kernel': 'Exponential', 'loss_name': 'AlternativeNLLLoss'}. Best is trial 245 with value: 0.7744390497152815.[0m
[32m[I 2022-04-17 15:45:13,363][0m Trial 305 finished with value: 0.7703292994309473 and parameters: {'n_hidden': 256, 'mixture_components': 5, 'use_sparse_layer': True, 'use_sparse_loss': True, 'lmbd': 0.09061400059733875, 'use_batchnorm': False, 'use_dropout': True, 'dropout': 0.7234144673585517, 'mlp_size_1': 1, 'mlp_size_2': 4, 'mlp_size_3': 0, 'kernel': 'Exponential', 'loss_name': 'CensoredNLLLoss'}. Best is trial 245 with value: 0.7744390497152815.[0m
[32m[I 2022-04-17 15:47:33,939][0m Trial 306 finished with value: 0.7712174996786023 and parameters: {'n_hidden': 128, 'mixture_components': 5, 'use_sparse_layer': True, 'use_sparse_loss': False, 'use_batchnorm': False, 'use_dropout': True, 'dropout': 0.740342722764207, 'mlp_size_1': 1, 'mlp_size_2': 3, 'mlp_size_3': 0, 'kernel': 'Exponential', 'loss_name': 'CensoredNLLLoss'}. Best is trial 245 with value: 0.7744390497152815.[0m
[32m[I 2022-04-17 15:49:40,048][0m Trial 307 finished with value: 0.7726364949951849 and parameters: {'n_hidden': 256, 'mixture_components': 9, 'use_sparse_layer': True, 'use_sparse_loss': False, 'use_batchnorm': False, 'use_dropout': True, 'dropout': 0.6915711003908686, 'mlp_size_1': 1, 'mlp_size_2': 4, 'mlp_size_3': 0, 'kernel': 'Exponential', 'loss_name': 'CensoredNLLLoss'}. Best is trial 245 with value: 0.7744390497152815.[0m
[32m[I 2022-04-17 15:51:41,574][0m Trial 308 finished with value: 0.7663762242659354 and parameters: {'n_hidden': 256, 'mixture_components': 9, 'use_sparse_layer': True, 'use_sparse_loss': False, 'use_batchnorm': False, 'use_dropout': True, 'dropout': 0.6890062526174351, 'mlp_size_1': 1, 'mlp_size_2': 4, 'mlp_size_3': 0, 'kernel': 'Exponential', 'loss_name': 'AlternativeNLLLoss'}. Best is trial 245 with value: 0.7744390497152815.[0m
[32m[I 2022-04-17 15:54:11,807][0m Trial 309 finished with value: 0.763588890331732 and parameters: {'n_hidden': 1024, 'mixture_components': 8, 'use_sparse_layer': True, 'use_sparse_loss': False, 'use_batchnorm': False, 'use_dropout': True, 'dropout': 0.7181656267466533, 'mlp_size_1': 3, 'mlp_size_2': 4, 'mlp_size_3': 0, 'kernel': 'Normal', 'loss_name': 'CensoredNLLLoss'}. Best is trial 245 with value: 0.7744390497152815.[0m
[32m[I 2022-04-17 15:56:54,997][0m Trial 310 finished with value: 0.7610330473296358 and parameters: {'n_hidden': 256, 'mixture_components': 9, 'use_sparse_layer': True, 'use_sparse_loss': False, 'use_batchnorm': False, 'use_dropout': True, 'dropout': 0.7911726075620402, 'mlp_size_1': 1, 'mlp_size_2': 4, 'mlp_size_3': 0, 'kernel': 'LogLogistic', 'loss_name': 'CensoredNLLLoss'}. Best is trial 245 with value: 0.7744390497152815.[0m
[32m[I 2022-04-17 15:59:43,494][0m Trial 311 finished with value: 0.7664655573454752 and parameters: {'n_hidden': 256, 'mixture_components': 9, 'use_sparse_layer': True, 'use_sparse_loss': False, 'use_batchnorm': True, 'use_dropout': True, 'dropout': 0.6979788627269589, 'mlp_size_1': 1, 'mlp_size_2': 4, 'mlp_size_3': 0, 'kernel': 'Exponential', 'loss_name': 'CensoredNLLLoss'}. Best is trial 245 with value: 0.7744390497152815.[0m
[32m[I 2022-04-17 16:01:53,998][0m Trial 312 finished with value: 0.773530208809481 and parameters: {'n_hidden': 256, 'mixture_components': 9, 'use_sparse_layer': True, 'use_sparse_loss': False, 'use_batchnorm': False, 'use_dropout': True, 'dropout': 0.743992049932434, 'mlp_size_1': 1, 'mlp_size_2': 4, 'mlp_size_3': 0, 'kernel': 'Exponential', 'loss_name': 'AlternativeNLLLoss'}. Best is trial 245 with value: 0.7744390497152815.[0m
[32m[I 2022-04-17 16:04:03,961][0m Trial 313 finished with value: 0.7709396281952399 and parameters: {'n_hidden': 256, 'mixture_components': 9, 'use_sparse_layer': True, 'use_sparse_loss': False, 'use_batchnorm': False, 'use_dropout': True, 'dropout': 0.742127329116849, 'mlp_size_1': 1, 'mlp_size_2': 4, 'mlp_size_3': 0, 'kernel': 'Exponential', 'loss_name': 'CensoredNLLLoss'}. Best is trial 245 with value: 0.7744390497152815.[0m
[32m[I 2022-04-17 16:06:09,637][0m Trial 314 finished with value: 0.7691047958289244 and parameters: {'n_hidden': 256, 'mixture_components': 9, 'use_sparse_layer': True, 'use_sparse_loss': False, 'use_batchnorm': False, 'use_dropout': True, 'dropout': 0.769327166092576, 'mlp_size_1': 1, 'mlp_size_2': 4, 'mlp_size_3': 0, 'kernel': 'Exponential', 'loss_name': 'AlternativeNLLLoss'}. Best is trial 245 with value: 0.7744390497152815.[0m
[32m[I 2022-04-17 16:08:11,945][0m Trial 315 finished with value: 0.7687339840564887 and parameters: {'n_hidden': 256, 'mixture_components': 9, 'use_sparse_layer': True, 'use_sparse_loss': True, 'lmbd': 4.0413900285143165e-06, 'use_batchnorm': False, 'use_dropout': True, 'dropout': 0.6715101934895502, 'mlp_size_1': 1, 'mlp_size_2': 4, 'mlp_size_3': 0, 'kernel': 'Exponential', 'loss_name': 'CensoredNLLLoss'}. Best is trial 245 with value: 0.7744390497152815.[0m
[32m[I 2022-04-17 16:10:00,992][0m Trial 316 finished with value: 0.7538008021862949 and parameters: {'n_hidden': 64, 'mixture_components': 9, 'use_sparse_layer': True, 'use_sparse_loss': False, 'use_batchnorm': False, 'use_dropout': False, 'mlp_size_1': 2, 'mlp_size_2': 1, 'mlp_size_3': 0, 'kernel': 'Exponential', 'loss_name': 'CensoredNLLLoss'}. Best is trial 245 with value: 0.7744390497152815.[0m
[32m[I 2022-04-17 16:12:28,478][0m Trial 317 finished with value: 0.7690635965671798 and parameters: {'n_hidden': 256, 'mixture_components': 9, 'use_sparse_layer': True, 'use_sparse_loss': False, 'use_batchnorm': False, 'use_dropout': True, 'dropout': 0.7289516268693704, 'mlp_size_1': 1, 'mlp_size_2': 4, 'mlp_size_3': 0, 'kernel': 'Exponential', 'loss_name': 'CensoredNLLLoss'}. Best is trial 245 with value: 0.7744390497152815.[0m
[32m[I 2022-04-17 16:14:08,072][0m Trial 318 finished with value: 0.6486721206973789 and parameters: {'n_hidden': 256, 'mixture_components': 9, 'use_sparse_layer': True, 'use_sparse_loss': False, 'use_batchnorm': False, 'use_dropout': True, 'dropout': 0.9471147896903991, 'mlp_size_1': 1, 'mlp_size_2': 4, 'mlp_size_3': 0, 'kernel': 'Exponential', 'loss_name': 'NLLLoss'}. Best is trial 245 with value: 0.7744390497152815.[0m
[32m[I 2022-04-17 16:15:56,469][0m Trial 319 finished with value: 0.5930264078583947 and parameters: {'n_hidden': 1024, 'mixture_components': 9, 'use_sparse_layer': True, 'use_sparse_loss': False, 'use_batchnorm': False, 'use_dropout': True, 'dropout': 0.7582931586293641, 'mlp_size_1': 0, 'mlp_size_2': 6, 'mlp_size_3': 1, 'kernel': 'Gumbel', 'loss_name': 'AlternativeNLLLoss'}. Best is trial 245 with value: 0.7744390497152815.[0m
[32m[I 2022-04-17 16:17:47,025][0m Trial 320 finished with value: 0.768407747010059 and parameters: {'n_hidden': 256, 'mixture_components': 8, 'use_sparse_layer': False, 'use_batchnorm': False, 'use_dropout': True, 'dropout': 0.7013044154263275, 'mlp_size_1': 1, 'mlp_size_2': 4, 'mlp_size_3': 0, 'kernel': 'Gamma', 'loss_name': 'CensoredNLLLoss'}. Best is trial 245 with value: 0.7744390497152815.[0m
[32m[I 2022-04-17 16:19:59,504][0m Trial 321 finished with value: 0.7686081050438865 and parameters: {'n_hidden': 256, 'mixture_components': 4, 'use_sparse_layer': True, 'use_sparse_loss': False, 'use_batchnorm': False, 'use_dropout': True, 'dropout': 0.6571432542491834, 'mlp_size_1': 1, 'mlp_size_2': 4, 'mlp_size_3': 0, 'kernel': 'Exponential', 'loss_name': 'CensoredNLLLoss'}. Best is trial 245 with value: 0.7744390497152815.[0m
[32m[I 2022-04-17 16:21:55,022][0m Trial 322 finished with value: 0.7691665640406574 and parameters: {'n_hidden': 256, 'mixture_components': 9, 'use_sparse_layer': True, 'use_sparse_loss': False, 'use_batchnorm': False, 'use_dropout': True, 'dropout': 0.5497985110507299, 'mlp_size_1': 1, 'mlp_size_2': 4, 'mlp_size_3': 0, 'kernel': 'Exponential', 'loss_name': 'CensoredNLLLoss'}. Best is trial 245 with value: 0.7744390497152815.[0m
[32m[I 2022-04-17 16:23:38,337][0m Trial 323 finished with value: 0.7698739091404578 and parameters: {'n_hidden': 256, 'mixture_components': 9, 'use_sparse_layer': True, 'use_sparse_loss': False, 'use_batchnorm': False, 'use_dropout': False, 'mlp_size_1': 1, 'mlp_size_2': 4, 'mlp_size_3': 0, 'kernel': 'Exponential', 'loss_name': 'AlternativeNLLLoss'}. Best is trial 245 with value: 0.7744390497152815.[0m
[32m[I 2022-04-17 16:26:22,013][0m Trial 324 finished with value: 0.7658323737281124 and parameters: {'n_hidden': 32, 'mixture_components': 10, 'use_sparse_layer': True, 'use_sparse_loss': False, 'use_batchnorm': False, 'use_dropout': True, 'dropout': 0.084153636178385, 'mlp_size_1': 1, 'mlp_size_2': 1, 'mlp_size_3': 0, 'kernel': 'Exponential', 'loss_name': 'CensoredNLLLoss'}. Best is trial 245 with value: 0.7744390497152815.[0m
[32m[I 2022-04-17 16:28:22,748][0m Trial 325 finished with value: 0.7710330358510273 and parameters: {'n_hidden': 256, 'mixture_components': 3, 'use_sparse_layer': False, 'use_batchnorm': False, 'use_dropout': True, 'dropout': 0.6866888674860333, 'mlp_size_1': 1, 'mlp_size_2': 4, 'mlp_size_3': 0, 'kernel': 'Exponential', 'loss_name': 'CensoredNLLLoss'}. Best is trial 245 with value: 0.7744390497152815.[0m
