[32m[I 2022-04-17 22:03:10,878][0m Trial 476 finished with value: 0.7694027876575914 and parameters: {'n_hidden': 256, 'mixture_components': 10, 'use_sparse_layer': True, 'use_sparse_loss': False, 'use_batchnorm': False, 'use_dropout': True, 'dropout': 0.15879434540187098, 'mlp_size_1': 1, 'mlp_size_2': 4, 'mlp_size_3': 0, 'kernel': 'Exponential', 'loss_name': 'CensoredNLLLoss'}. Best is trial 245 with value: 0.7744390497152815.[0m
[32m[I 2022-04-17 22:05:15,798][0m Trial 477 finished with value: 0.769772888552622 and parameters: {'n_hidden': 256, 'mixture_components': 4, 'use_sparse_layer': True, 'use_sparse_loss': False, 'use_batchnorm': False, 'use_dropout': True, 'dropout': 0.719184044443817, 'mlp_size_1': 1, 'mlp_size_2': 4, 'mlp_size_3': 0, 'kernel': 'Exponential', 'loss_name': 'CensoredNLLLoss'}. Best is trial 245 with value: 0.7744390497152815.[0m
[32m[I 2022-04-17 22:07:12,781][0m Trial 478 finished with value: 0.7026907912809073 and parameters: {'n_hidden': 64, 'mixture_components': 10, 'use_sparse_layer': False, 'use_batchnorm': False, 'use_dropout': True, 'dropout': 0.6565168540251832, 'mlp_size_1': 1, 'mlp_size_2': 2, 'mlp_size_3': 0, 'kernel': 'Exponential', 'loss_name': 'NLLLoss'}. Best is trial 245 with value: 0.7744390497152815.[0m
[32m[I 2022-04-17 22:11:22,773][0m Trial 479 finished with value: 0.7590370491259562 and parameters: {'n_hidden': 32, 'mixture_components': 9, 'use_sparse_layer': True, 'use_sparse_loss': True, 'lmbd': 2.092827555727941e-05, 'use_batchnorm': False, 'use_dropout': True, 'dropout': 0.6873320086425215, 'mlp_size_1': 1, 'mlp_size_2': 1, 'mlp_size_3': 0, 'kernel': 'Exponential', 'loss_name': 'CensoredNLLLoss'}. Best is trial 245 with value: 0.7744390497152815.[0m
[32m[I 2022-04-17 22:13:40,261][0m Trial 480 finished with value: 0.768505491319473 and parameters: {'n_hidden': 256, 'mixture_components': 10, 'use_sparse_layer': True, 'use_sparse_loss': False, 'use_batchnorm': False, 'use_dropout': True, 'dropout': 0.5639271101437434, 'mlp_size_1': 1, 'mlp_size_2': 4, 'mlp_size_3': 0, 'kernel': 'Exponential', 'loss_name': 'CensoredNLLLoss'}. Best is trial 245 with value: 0.7744390497152815.[0m
[32m[I 2022-04-17 22:16:33,254][0m Trial 481 finished with value: 0.7712287688508402 and parameters: {'n_hidden': 256, 'mixture_components': 10, 'use_sparse_layer': True, 'use_sparse_loss': False, 'use_batchnorm': False, 'use_dropout': True, 'dropout': 0.7635105383228116, 'mlp_size_1': 1, 'mlp_size_2': 4, 'mlp_size_3': 0, 'kernel': 'Weibull', 'loss_name': 'AlternativeNLLLoss'}. Best is trial 245 with value: 0.7744390497152815.[0m
[32m[I 2022-04-17 22:18:31,487][0m Trial 482 finished with value: 0.76715692289522 and parameters: {'n_hidden': 256, 'mixture_components': 9, 'use_sparse_layer': False, 'use_batchnorm': False, 'use_dropout': True, 'dropout': 0.7764423182245076, 'mlp_size_1': 1, 'mlp_size_2': 4, 'mlp_size_3': 0, 'kernel': 'Exponential', 'loss_name': 'CensoredNLLLoss'}. Best is trial 245 with value: 0.7744390497152815.[0m
[32m[I 2022-04-17 22:21:27,870][0m Trial 483 finished with value: 0.7585543392393947 and parameters: {'n_hidden': 256, 'mixture_components': 10, 'use_sparse_layer': True, 'use_sparse_loss': False, 'use_batchnorm': False, 'use_dropout': True, 'dropout': 0.6238824332268996, 'mlp_size_1': 1, 'mlp_size_2': 4, 'mlp_size_3': 0, 'kernel': 'LogNormal', 'loss_name': 'AlternativeNLLLoss'}. Best is trial 245 with value: 0.7744390497152815.[0m
[32m[I 2022-04-17 22:23:47,082][0m Trial 484 finished with value: 0.7683357036898053 and parameters: {'n_hidden': 256, 'mixture_components': 9, 'use_sparse_layer': True, 'use_sparse_loss': False, 'use_batchnorm': False, 'use_dropout': True, 'dropout': 0.7071873207876123, 'mlp_size_1': 1, 'mlp_size_2': 4, 'mlp_size_3': 0, 'kernel': 'Exponential', 'loss_name': 'CensoredNLLLoss'}. Best is trial 245 with value: 0.7744390497152815.[0m
[32m[I 2022-04-17 22:25:46,802][0m Trial 485 finished with value: 0.7696346768870903 and parameters: {'n_hidden': 256, 'mixture_components': 10, 'use_sparse_layer': True, 'use_sparse_loss': False, 'use_batchnorm': False, 'use_dropout': True, 'dropout': 0.5198204987309148, 'mlp_size_1': 1, 'mlp_size_2': 4, 'mlp_size_3': 0, 'kernel': 'Exponential', 'loss_name': 'AlternativeNLLLoss'}. Best is trial 245 with value: 0.7744390497152815.[0m
[32m[I 2022-04-17 22:28:01,400][0m Trial 486 finished with value: 0.7341309249178536 and parameters: {'n_hidden': 2048, 'mixture_components': 10, 'use_sparse_layer': True, 'use_sparse_loss': False, 'use_batchnorm': False, 'use_dropout': True, 'dropout': 0.7353525150349002, 'mlp_size_1': 0, 'mlp_size_2': 5, 'mlp_size_3': 0, 'kernel': 'Exponential', 'loss_name': 'CensoredNLLLoss'}. Best is trial 245 with value: 0.7744390497152815.[0m
[32m[I 2022-04-17 22:32:09,267][0m Trial 487 finished with value: 0.7205050402556636 and parameters: {'n_hidden': 256, 'mixture_components': 8, 'use_sparse_layer': False, 'use_batchnorm': True, 'use_dropout': True, 'dropout': 0.6615654414096717, 'mlp_size_1': 1, 'mlp_size_2': 4, 'mlp_size_3': 0, 'kernel': 'Logistic', 'loss_name': 'CensoredNLLLoss'}. Best is trial 245 with value: 0.7744390497152815.[0m
[32m[I 2022-04-17 22:34:44,181][0m Trial 488 finished with value: 0.7697030054363486 and parameters: {'n_hidden': 128, 'mixture_components': 1, 'use_sparse_layer': True, 'use_sparse_loss': True, 'lmbd': 0.002733925259351818, 'use_batchnorm': False, 'use_dropout': True, 'dropout': 0.8188487819676424, 'mlp_size_1': 1, 'mlp_size_2': 3, 'mlp_size_3': 0, 'kernel': 'Exponential', 'loss_name': 'AlternativeNLLLoss'}. Best is trial 245 with value: 0.7744390497152815.[0m
[32m[I 2022-04-17 22:37:04,663][0m Trial 489 finished with value: 0.7714837973623648 and parameters: {'n_hidden': 256, 'mixture_components': 5, 'use_sparse_layer': True, 'use_sparse_loss': False, 'use_batchnorm': False, 'use_dropout': True, 'dropout': 0.6828852277507796, 'mlp_size_1': 1, 'mlp_size_2': 4, 'mlp_size_3': 0, 'kernel': 'Exponential', 'loss_name': 'CensoredNLLLoss'}. Best is trial 245 with value: 0.7744390497152815.[0m
[32m[I 2022-04-17 22:39:25,072][0m Trial 490 finished with value: 0.7738686744719385 and parameters: {'n_hidden': 256, 'mixture_components': 3, 'use_sparse_layer': True, 'use_sparse_loss': False, 'use_batchnorm': False, 'use_dropout': True, 'dropout': 0.7215576758832084, 'mlp_size_1': 1, 'mlp_size_2': 4, 'mlp_size_3': 0, 'kernel': 'Exponential', 'loss_name': 'AlternativeNLLLoss'}. Best is trial 245 with value: 0.7744390497152815.[0m
[32m[I 2022-04-17 22:41:30,552][0m Trial 491 finished with value: 0.7708464354931344 and parameters: {'n_hidden': 256, 'mixture_components': 6, 'use_sparse_layer': True, 'use_sparse_loss': False, 'use_batchnorm': False, 'use_dropout': True, 'dropout': 0.740674349488122, 'mlp_size_1': 1, 'mlp_size_2': 4, 'mlp_size_3': 0, 'kernel': 'Exponential', 'loss_name': 'AlternativeNLLLoss'}. Best is trial 245 with value: 0.7744390497152815.[0m
[32m[I 2022-04-17 22:43:27,682][0m Trial 492 finished with value: 0.7729143755408706 and parameters: {'n_hidden': 256, 'mixture_components': 5, 'use_sparse_layer': False, 'use_batchnorm': False, 'use_dropout': True, 'dropout': 0.7158952529293213, 'mlp_size_1': 1, 'mlp_size_2': 4, 'mlp_size_3': 0, 'kernel': 'Exponential', 'loss_name': 'AlternativeNLLLoss'}. Best is trial 245 with value: 0.7744390497152815.[0m
[32m[I 2022-04-17 22:45:13,136][0m Trial 493 finished with value: 0.7728455541444913 and parameters: {'n_hidden': 512, 'mixture_components': 3, 'use_sparse_layer': False, 'use_batchnorm': False, 'use_dropout': True, 'dropout': 0.7200755286976401, 'mlp_size_1': 3, 'mlp_size_2': 3, 'mlp_size_3': 0, 'kernel': 'Exponential', 'loss_name': 'AlternativeNLLLoss'}. Best is trial 245 with value: 0.7744390497152815.[0m
[32m[I 2022-04-17 22:47:10,956][0m Trial 494 finished with value: 0.7681429698169 and parameters: {'n_hidden': 256, 'mixture_components': 5, 'use_sparse_layer': False, 'use_batchnorm': False, 'use_dropout': True, 'dropout': 0.7054518460916175, 'mlp_size_1': 1, 'mlp_size_2': 4, 'mlp_size_3': 0, 'kernel': 'Exponential', 'loss_name': 'AlternativeNLLLoss'}. Best is trial 245 with value: 0.7744390497152815.[0m
[32m[I 2022-04-17 22:49:45,282][0m Trial 495 finished with value: 0.7644105434729045 and parameters: {'n_hidden': 64, 'mixture_components': 3, 'use_sparse_layer': False, 'use_batchnorm': False, 'use_dropout': True, 'dropout': 0.7248154663055603, 'mlp_size_1': 1, 'mlp_size_2': 2, 'mlp_size_3': 0, 'kernel': 'Exponential', 'loss_name': 'AlternativeNLLLoss'}. Best is trial 245 with value: 0.7744390497152815.[0m
[32m[I 2022-04-17 22:52:31,889][0m Trial 496 finished with value: 0.7640595466703517 and parameters: {'n_hidden': 256, 'mixture_components': 3, 'use_sparse_layer': False, 'use_batchnorm': False, 'use_dropout': True, 'dropout': 0.7473553811780217, 'mlp_size_1': 1, 'mlp_size_2': 4, 'mlp_size_3': 0, 'kernel': 'Normal', 'loss_name': 'AlternativeNLLLoss'}. Best is trial 245 with value: 0.7744390497152815.[0m
[32m[I 2022-04-17 22:54:26,561][0m Trial 497 finished with value: 0.7729175556878275 and parameters: {'n_hidden': 256, 'mixture_components': 5, 'use_sparse_layer': False, 'use_batchnorm': False, 'use_dropout': True, 'dropout': 0.698255766201254, 'mlp_size_1': 1, 'mlp_size_2': 4, 'mlp_size_3': 0, 'kernel': 'Exponential', 'loss_name': 'AlternativeNLLLoss'}. Best is trial 245 with value: 0.7744390497152815.[0m
[32m[I 2022-04-17 22:56:22,921][0m Trial 498 finished with value: 0.7681763694068708 and parameters: {'n_hidden': 256, 'mixture_components': 7, 'use_sparse_layer': False, 'use_batchnorm': False, 'use_dropout': True, 'dropout': 0.7079351728137313, 'mlp_size_1': 1, 'mlp_size_2': 4, 'mlp_size_3': 0, 'kernel': 'Exponential', 'loss_name': 'AlternativeNLLLoss'}. Best is trial 245 with value: 0.7744390497152815.[0m
[32m[I 2022-04-17 22:58:40,837][0m Trial 499 finished with value: 0.7615905793167335 and parameters: {'n_hidden': 256, 'mixture_components': 3, 'use_sparse_layer': False, 'use_batchnorm': False, 'use_dropout': True, 'dropout': 0.723244875761531, 'mlp_size_1': 1, 'mlp_size_2': 4, 'mlp_size_3': 0, 'kernel': 'LogLogistic', 'loss_name': 'AlternativeNLLLoss'}. Best is trial 245 with value: 0.7744390497152815.[0m
[32m[I 2022-04-17 23:00:28,366][0m Trial 500 finished with value: 0.7687485471811444 and parameters: {'n_hidden': 256, 'mixture_components': 2, 'use_sparse_layer': False, 'use_batchnorm': False, 'use_dropout': True, 'dropout': 0.6951789072262805, 'mlp_size_1': 1, 'mlp_size_2': 4, 'mlp_size_3': 0, 'kernel': 'Exponential', 'loss_name': 'AlternativeNLLLoss'}. Best is trial 245 with value: 0.7744390497152815.[0m
[32m[I 2022-04-17 23:02:19,828][0m Trial 501 finished with value: 0.7671663335996597 and parameters: {'n_hidden': 256, 'mixture_components': 3, 'use_sparse_layer': False, 'use_batchnorm': False, 'use_dropout': True, 'dropout': 0.6926218536666624, 'mlp_size_1': 1, 'mlp_size_2': 4, 'mlp_size_3': 0, 'kernel': 'Exponential', 'loss_name': 'AlternativeNLLLoss'}. Best is trial 245 with value: 0.7744390497152815.[0m
[32m[I 2022-04-17 23:04:17,323][0m Trial 502 finished with value: 0.7673391363945772 and parameters: {'n_hidden': 256, 'mixture_components': 5, 'use_sparse_layer': False, 'use_batchnorm': False, 'use_dropout': True, 'dropout': 0.728085876678725, 'mlp_size_1': 1, 'mlp_size_2': 4, 'mlp_size_3': 0, 'kernel': 'Exponential', 'loss_name': 'AlternativeNLLLoss'}. Best is trial 245 with value: 0.7744390497152815.[0m
[32m[I 2022-04-17 23:06:38,256][0m Trial 503 finished with value: 0.7684121608473052 and parameters: {'n_hidden': 256, 'mixture_components': 3, 'use_sparse_layer': False, 'use_batchnorm': False, 'use_dropout': True, 'dropout': 0.6730571985983903, 'mlp_size_1': 1, 'mlp_size_2': 4, 'mlp_size_3': 0, 'kernel': 'Gamma', 'loss_name': 'AlternativeNLLLoss'}. Best is trial 245 with value: 0.7744390497152815.[0m
[32m[I 2022-04-17 23:08:35,826][0m Trial 504 finished with value: 0.7684494997397888 and parameters: {'n_hidden': 256, 'mixture_components': 9, 'use_sparse_layer': False, 'use_batchnorm': False, 'use_dropout': True, 'dropout': 0.7096657570259092, 'mlp_size_1': 1, 'mlp_size_2': 4, 'mlp_size_3': 0, 'kernel': 'Exponential', 'loss_name': 'AlternativeNLLLoss'}. Best is trial 245 with value: 0.7744390497152815.[0m
[32m[I 2022-04-17 23:10:55,105][0m Trial 505 finished with value: 0.7709377638059542 and parameters: {'n_hidden': 256, 'mixture_components': 6, 'use_sparse_layer': False, 'use_batchnorm': False, 'use_dropout': True, 'dropout': 0.7485283664985226, 'mlp_size_1': 1, 'mlp_size_2': 4, 'mlp_size_3': 0, 'kernel': 'Exponential', 'loss_name': 'AlternativeNLLLoss'}. Best is trial 245 with value: 0.7744390497152815.[0m
[32m[I 2022-04-17 23:12:53,417][0m Trial 506 finished with value: 0.7722041054597638 and parameters: {'n_hidden': 256, 'mixture_components': 5, 'use_sparse_layer': False, 'use_batchnorm': False, 'use_dropout': True, 'dropout': 0.6984571288753715, 'mlp_size_1': 1, 'mlp_size_2': 4, 'mlp_size_3': 0, 'kernel': 'Exponential', 'loss_name': 'AlternativeNLLLoss'}. Best is trial 245 with value: 0.7744390497152815.[0m
[32m[I 2022-04-17 23:15:01,762][0m Trial 507 finished with value: 0.728427973471143 and parameters: {'n_hidden': 256, 'mixture_components': 3, 'use_sparse_layer': False, 'use_batchnorm': False, 'use_dropout': True, 'dropout': 0.7354819410122566, 'mlp_size_1': 1, 'mlp_size_2': 4, 'mlp_size_3': 0, 'kernel': 'Gumbel', 'loss_name': 'AlternativeNLLLoss'}. Best is trial 245 with value: 0.7744390497152815.[0m
[32m[I 2022-04-17 23:17:48,372][0m Trial 508 finished with value: 0.7722803543962471 and parameters: {'n_hidden': 256, 'mixture_components': 9, 'use_sparse_layer': False, 'use_batchnorm': True, 'use_dropout': True, 'dropout': 0.6772786847126252, 'mlp_size_1': 1, 'mlp_size_2': 4, 'mlp_size_3': 0, 'kernel': 'Exponential', 'loss_name': 'AlternativeNLLLoss'}. Best is trial 245 with value: 0.7744390497152815.[0m
[32m[I 2022-04-17 23:19:41,954][0m Trial 509 finished with value: 0.7691134503012169 and parameters: {'n_hidden': 256, 'mixture_components': 5, 'use_sparse_layer': False, 'use_batchnorm': False, 'use_dropout': True, 'dropout': 0.6503187323954904, 'mlp_size_1': 1, 'mlp_size_2': 4, 'mlp_size_3': 0, 'kernel': 'Exponential', 'loss_name': 'AlternativeNLLLoss'}. Best is trial 245 with value: 0.7744390497152815.[0m
[32m[I 2022-04-17 23:21:45,293][0m Trial 510 finished with value: 0.7696820265222404 and parameters: {'n_hidden': 256, 'mixture_components': 2, 'use_sparse_layer': False, 'use_batchnorm': False, 'use_dropout': True, 'dropout': 0.7150227053198857, 'mlp_size_1': 1, 'mlp_size_2': 4, 'mlp_size_3': 0, 'kernel': 'Exponential', 'loss_name': 'AlternativeNLLLoss'}. Best is trial 245 with value: 0.7744390497152815.[0m
[32m[I 2022-04-17 23:24:09,049][0m Trial 511 finished with value: 0.770241807465733 and parameters: {'n_hidden': 256, 'mixture_components': 9, 'use_sparse_layer': False, 'use_batchnorm': False, 'use_dropout': True, 'dropout': 0.7615930344890864, 'mlp_size_1': 1, 'mlp_size_2': 4, 'mlp_size_3': 0, 'kernel': 'Exponential', 'loss_name': 'AlternativeNLLLoss'}. Best is trial 245 with value: 0.7744390497152815.[0m
[32m[I 2022-04-17 23:26:08,260][0m Trial 512 finished with value: 0.7704385514887814 and parameters: {'n_hidden': 256, 'mixture_components': 2, 'use_sparse_layer': False, 'use_batchnorm': False, 'use_dropout': True, 'dropout': 0.6930282931997409, 'mlp_size_1': 1, 'mlp_size_2': 4, 'mlp_size_3': 0, 'kernel': 'Exponential', 'loss_name': 'AlternativeNLLLoss'}. Best is trial 245 with value: 0.7744390497152815.[0m
[32m[I 2022-04-17 23:28:08,165][0m Trial 513 finished with value: 0.7677063328600717 and parameters: {'n_hidden': 256, 'mixture_components': 5, 'use_sparse_layer': False, 'use_batchnorm': False, 'use_dropout': True, 'dropout': 0.733412488842122, 'mlp_size_1': 1, 'mlp_size_2': 4, 'mlp_size_3': 0, 'kernel': 'Exponential', 'loss_name': 'AlternativeNLLLoss'}. Best is trial 245 with value: 0.7744390497152815.[0m
[32m[I 2022-04-17 23:30:54,418][0m Trial 514 finished with value: 0.7064234129973851 and parameters: {'n_hidden': 32, 'mixture_components': 6, 'use_sparse_layer': False, 'use_batchnorm': False, 'use_dropout': True, 'dropout': 0.6627916557122218, 'mlp_size_1': 1, 'mlp_size_2': 1, 'mlp_size_3': 0, 'kernel': 'Weibull', 'loss_name': 'NLLLoss'}. Best is trial 245 with value: 0.7744390497152815.[0m
[32m[I 2022-04-17 23:32:47,728][0m Trial 515 finished with value: 0.7701039176282756 and parameters: {'n_hidden': 256, 'mixture_components': 5, 'use_sparse_layer': False, 'use_batchnorm': False, 'use_dropout': True, 'dropout': 0.5926394225490325, 'mlp_size_1': 1, 'mlp_size_2': 4, 'mlp_size_3': 0, 'kernel': 'Exponential', 'loss_name': 'AlternativeNLLLoss'}. Best is trial 245 with value: 0.7744390497152815.[0m
[32m[I 2022-04-17 23:34:49,815][0m Trial 516 finished with value: 0.770891319347655 and parameters: {'n_hidden': 256, 'mixture_components': 9, 'use_sparse_layer': False, 'use_batchnorm': False, 'use_dropout': True, 'dropout': 0.7143551730667625, 'mlp_size_1': 1, 'mlp_size_2': 4, 'mlp_size_3': 0, 'kernel': 'Exponential', 'loss_name': 'AlternativeNLLLoss'}. Best is trial 245 with value: 0.7744390497152815.[0m
[32m[I 2022-04-17 23:40:31,699][0m Trial 517 finished with value: 0.7490507008524554 and parameters: {'n_hidden': 64, 'mixture_components': 4, 'use_sparse_layer': False, 'use_batchnorm': False, 'use_dropout': True, 'dropout': 0.7476053782239056, 'mlp_size_1': 1, 'mlp_size_2': 2, 'mlp_size_3': 0, 'kernel': 'LogNormal', 'loss_name': 'AlternativeNLLLoss'}. Best is trial 245 with value: 0.7744390497152815.[0m
[32m[I 2022-04-17 23:42:31,467][0m Trial 518 finished with value: 0.7720282494373717 and parameters: {'n_hidden': 256, 'mixture_components': 10, 'use_sparse_layer': False, 'use_batchnorm': False, 'use_dropout': True, 'dropout': 0.6799298274069352, 'mlp_size_1': 1, 'mlp_size_2': 4, 'mlp_size_3': 0, 'kernel': 'Exponential', 'loss_name': 'AlternativeNLLLoss'}. Best is trial 245 with value: 0.7744390497152815.[0m
[32m[I 2022-04-17 23:44:37,458][0m Trial 519 finished with value: 0.7721968082628459 and parameters: {'n_hidden': 256, 'mixture_components': 2, 'use_sparse_layer': True, 'use_sparse_loss': False, 'use_batchnorm': False, 'use_dropout': True, 'dropout': 0.7730762317642097, 'mlp_size_1': 1, 'mlp_size_2': 4, 'mlp_size_3': 0, 'kernel': 'Exponential', 'loss_name': 'AlternativeNLLLoss'}. Best is trial 245 with value: 0.7744390497152815.[0m
[32m[I 2022-04-17 23:46:38,279][0m Trial 520 finished with value: 0.6733247722403576 and parameters: {'n_hidden': 2048, 'mixture_components': 7, 'use_sparse_layer': False, 'use_batchnorm': False, 'use_dropout': True, 'dropout': 0.7112740578496409, 'mlp_size_1': 0, 'mlp_size_2': 3, 'mlp_size_3': 0, 'kernel': 'Logistic', 'loss_name': 'AlternativeNLLLoss'}. Best is trial 245 with value: 0.7744390497152815.[0m
[32m[I 2022-04-17 23:48:39,268][0m Trial 521 finished with value: 0.7706225519594284 and parameters: {'n_hidden': 256, 'mixture_components': 9, 'use_sparse_layer': True, 'use_sparse_loss': False, 'use_batchnorm': False, 'use_dropout': True, 'dropout': 0.6439881690070702, 'mlp_size_1': 1, 'mlp_size_2': 4, 'mlp_size_3': 0, 'kernel': 'Exponential', 'loss_name': 'AlternativeNLLLoss'}. Best is trial 245 with value: 0.7744390497152815.[0m
[32m[I 2022-04-17 23:50:47,612][0m Trial 522 finished with value: 0.772457101014419 and parameters: {'n_hidden': 256, 'mixture_components': 8, 'use_sparse_layer': True, 'use_sparse_loss': False, 'use_batchnorm': False, 'use_dropout': True, 'dropout': 0.7387241548015017, 'mlp_size_1': 1, 'mlp_size_2': 4, 'mlp_size_3': 0, 'kernel': 'Exponential', 'loss_name': 'AlternativeNLLLoss'}. Best is trial 245 with value: 0.7744390497152815.[0m
[32m[I 2022-04-17 23:53:03,577][0m Trial 523 finished with value: 0.7644128089699247 and parameters: {'n_hidden': 128, 'mixture_components': 5, 'use_sparse_layer': True, 'use_sparse_loss': False, 'use_batchnorm': False, 'use_dropout': True, 'dropout': 0.6989044265037336, 'mlp_size_1': 1, 'mlp_size_2': 3, 'mlp_size_3': 0, 'kernel': 'Exponential', 'loss_name': 'AlternativeNLLLoss'}. Best is trial 245 with value: 0.7744390497152815.[0m
[32m[I 2022-04-17 23:54:53,329][0m Trial 524 finished with value: 0.7706892565269309 and parameters: {'n_hidden': 256, 'mixture_components': 10, 'use_sparse_layer': False, 'use_batchnorm': False, 'use_dropout': True, 'dropout': 0.6708963885564683, 'mlp_size_1': 1, 'mlp_size_2': 4, 'mlp_size_3': 0, 'kernel': 'Exponential', 'loss_name': 'AlternativeNLLLoss'}. Best is trial 245 with value: 0.7744390497152815.[0m
[32m[I 2022-04-17 23:56:35,433][0m Trial 525 finished with value: 0.6995382893758514 and parameters: {'n_hidden': 256, 'mixture_components': 5, 'use_sparse_layer': True, 'use_sparse_loss': False, 'use_batchnorm': False, 'use_dropout': True, 'dropout': 0.7604935143955099, 'mlp_size_1': 1, 'mlp_size_2': 4, 'mlp_size_3': 0, 'kernel': 'Exponential', 'loss_name': 'NLLLoss'}. Best is trial 245 with value: 0.7744390497152815.[0m
[32m[I 2022-04-17 23:58:37,180][0m Trial 526 finished with value: 0.7749738194021545 and parameters: {'n_hidden': 256, 'mixture_components': 4, 'use_sparse_layer': True, 'use_sparse_loss': False, 'use_batchnorm': False, 'use_dropout': True, 'dropout': 0.7245203894197327, 'mlp_size_1': 1, 'mlp_size_2': 4, 'mlp_size_3': 0, 'kernel': 'Exponential', 'loss_name': 'AlternativeNLLLoss'}. Best is trial 526 with value: 0.7749738194021545.[0m
