[32m[I 2022-04-13 12:28:07,613][0m Trial 575 finished with value: 0.768352021027492 and parameters: {'splitter': 'best', 'min_samples_split': 0.07628412972454979, 'min_samples_leaf': 0.018894224169881756, 'min_weight_fraction_leaf': 0.05971574675017985, 'max_features': 0.9368937350728449}. Best is trial 241 with value: 0.7773840258827056.[0m
[32m[I 2022-04-13 12:28:09,030][0m Trial 576 finished with value: 0.7741167929967024 and parameters: {'splitter': 'best', 'min_samples_split': 0.14488332541155102, 'min_samples_leaf': 0.046448702014447354, 'min_weight_fraction_leaf': 0.03316894617005448, 'max_features': 0.9993536522295501}. Best is trial 241 with value: 0.7773840258827056.[0m
[32m[I 2022-04-13 12:28:09,177][0m Trial 577 finished with value: 0.7274486175324558 and parameters: {'splitter': 'random', 'min_samples_split': 0.10392300418274834, 'min_samples_leaf': 0.06259821105646275, 'min_weight_fraction_leaf': 0.024341958880393897, 'max_features': 0.3483404838088152}. Best is trial 241 with value: 0.7773840258827056.[0m
[32m[I 2022-04-13 12:28:11,270][0m Trial 578 finished with value: 0.7674210038360685 and parameters: {'splitter': 'best', 'min_samples_split': 0.06839860078321666, 'min_samples_leaf': 0.03696526070379709, 'min_weight_fraction_leaf': 0.051089592755681465, 'max_features': 0.9659939396189883}. Best is trial 241 with value: 0.7773840258827056.[0m
[32m[I 2022-04-13 12:28:14,340][0m Trial 579 finished with value: 0.7730825475218297 and parameters: {'splitter': 'best', 'min_samples_split': 0.11558378427065685, 'min_samples_leaf': 0.026761219310536006, 'min_weight_fraction_leaf': 0.010888983582884267, 'max_features': 0.9988397643389544}. Best is trial 241 with value: 0.7773840258827056.[0m
[32m[I 2022-04-13 12:28:16,343][0m Trial 580 finished with value: 0.7720399840271608 and parameters: {'splitter': 'best', 'min_samples_split': 0.12887866111269197, 'min_samples_leaf': 0.04902261671106099, 'min_weight_fraction_leaf': 0.03946976342112056, 'max_features': 0.999966722842517}. Best is trial 241 with value: 0.7773840258827056.[0m
[32m[I 2022-04-13 12:28:16,638][0m Trial 581 finished with value: 0.6747422957888503 and parameters: {'splitter': 'best', 'min_samples_split': 0.1402617171762792, 'min_samples_leaf': 0.012974522046519592, 'min_weight_fraction_leaf': 0.00024246747583898942, 'max_features': 0.19728435350891393}. Best is trial 241 with value: 0.7773840258827056.[0m
[32m[I 2022-04-13 12:28:18,996][0m Trial 582 finished with value: 0.7667169854246645 and parameters: {'splitter': 'best', 'min_samples_split': 0.09029986721053905, 'min_samples_leaf': 0.0369128819164212, 'min_weight_fraction_leaf': 0.026690963313280035, 'max_features': 0.9478875689377618}. Best is trial 241 with value: 0.7773840258827056.[0m
[32m[I 2022-04-13 12:28:20,756][0m Trial 583 finished with value: 0.7689645608482674 and parameters: {'splitter': 'best', 'min_samples_split': 0.10829050183533571, 'min_samples_leaf': 0.05856711215010924, 'min_weight_fraction_leaf': 0.06783597448552559, 'max_features': 0.9801992987542758}. Best is trial 241 with value: 0.7773840258827056.[0m
[32m[I 2022-04-13 12:28:23,628][0m Trial 584 finished with value: 0.766866335821288 and parameters: {'splitter': 'best', 'min_samples_split': 0.12535885090583596, 'min_samples_leaf': 0.026222188890137638, 'min_weight_fraction_leaf': 0.018144479912076288, 'max_features': 0.9655562488574143}. Best is trial 241 with value: 0.7773840258827056.[0m
[32m[I 2022-04-13 12:28:25,779][0m Trial 585 finished with value: 0.7693822046630692 and parameters: {'splitter': 'best', 'min_samples_split': 0.16330200189440236, 'min_samples_leaf': 0.04169134382579477, 'min_weight_fraction_leaf': 0.034304492689931285, 'max_features': 0.9807803859128904}. Best is trial 241 with value: 0.7773840258827056.[0m
[32m[I 2022-04-13 12:28:27,722][0m Trial 586 finished with value: 0.7667797411900819 and parameters: {'splitter': 'best', 'min_samples_split': 0.11293000857836953, 'min_samples_leaf': 0.04995259318110615, 'min_weight_fraction_leaf': 0.05032501375929017, 'max_features': 0.9294039078933563}. Best is trial 241 with value: 0.7773840258827056.[0m
[32m[I 2022-04-13 12:28:29,136][0m Trial 587 finished with value: 0.7630706229411763 and parameters: {'splitter': 'best', 'min_samples_split': 0.1029234344907895, 'min_samples_leaf': 0.06884645241232625, 'min_weight_fraction_leaf': 0.008594591135284463, 'max_features': 0.9554686847925582}. Best is trial 241 with value: 0.7773840258827056.[0m
[32m[I 2022-04-13 12:28:31,904][0m Trial 588 finished with value: 0.76586729447726 and parameters: {'splitter': 'best', 'min_samples_split': 0.05586693118992406, 'min_samples_leaf': 0.007946065407213463, 'min_weight_fraction_leaf': 0.040150147473076395, 'max_features': 0.9807965477668019}. Best is trial 241 with value: 0.7773840258827056.[0m
[32m[I 2022-04-13 12:28:35,525][0m Trial 589 finished with value: 0.76529604827326 and parameters: {'splitter': 'best', 'min_samples_split': 0.13598719696159703, 'min_samples_leaf': 0.03313092985364822, 'min_weight_fraction_leaf': 0.021856712247417098, 'max_features': 0.9183030532102054}. Best is trial 241 with value: 0.7773840258827056.[0m
[32m[I 2022-04-13 12:28:37,942][0m Trial 590 finished with value: 0.7661951970895984 and parameters: {'splitter': 'best', 'min_samples_split': 0.11975130501679485, 'min_samples_leaf': 0.020508138139541762, 'min_weight_fraction_leaf': 0.05674216964854065, 'max_features': 0.9639493189901867}. Best is trial 241 with value: 0.7773840258827056.[0m
[32m[I 2022-04-13 12:28:39,825][0m Trial 591 finished with value: 0.7721871332315295 and parameters: {'splitter': 'best', 'min_samples_split': 0.14430886459708978, 'min_samples_leaf': 0.03830412605105184, 'min_weight_fraction_leaf': 0.03202459694517317, 'max_features': 0.9815291200144874}. Best is trial 241 with value: 0.7773840258827056.[0m
[32m[I 2022-04-13 12:28:42,819][0m Trial 592 finished with value: 0.7675223280516692 and parameters: {'splitter': 'best', 'min_samples_split': 0.0824003107925998, 'min_samples_leaf': 0.05468470098643904, 'min_weight_fraction_leaf': 0.04554567405187047, 'max_features': 0.9447841826573719}. Best is trial 241 with value: 0.7773840258827056.[0m
[32m[I 2022-04-13 12:28:46,687][0m Trial 593 finished with value: 0.772792401801716 and parameters: {'splitter': 'best', 'min_samples_split': 0.09619401795359889, 'min_samples_leaf': 0.032039973541895785, 'min_weight_fraction_leaf': 0.021242707761768793, 'max_features': 0.9989874456608677}. Best is trial 241 with value: 0.7773840258827056.[0m
[32m[I 2022-04-13 12:28:49,608][0m Trial 594 finished with value: 0.7729551356512465 and parameters: {'splitter': 'best', 'min_samples_split': 0.1292999721473575, 'min_samples_leaf': 0.045454128011367015, 'min_weight_fraction_leaf': 0.008986292051122391, 'max_features': 0.9999857500905318}. Best is trial 241 with value: 0.7773840258827056.[0m
[32m[I 2022-04-13 12:28:50,151][0m Trial 595 finished with value: 0.5915960497776094 and parameters: {'splitter': 'best', 'min_samples_split': 0.11625000469240185, 'min_samples_leaf': 0.37450856960476614, 'min_weight_fraction_leaf': 0.030179300452675965, 'max_features': 0.9680666741352799}. Best is trial 241 with value: 0.7773840258827056.[0m
[32m[I 2022-04-13 12:28:50,746][0m Trial 596 finished with value: 0.7573859020779203 and parameters: {'splitter': 'random', 'min_samples_split': 0.17659236077045484, 'min_samples_leaf': 0.021056929724999802, 'min_weight_fraction_leaf': 0.03920172696470375, 'max_features': 0.9524003774882317}. Best is trial 241 with value: 0.7773840258827056.[0m
[32m[I 2022-04-13 12:28:52,557][0m Trial 597 finished with value: 0.6743624146605087 and parameters: {'splitter': 'best', 'min_samples_split': 0.15612773336267802, 'min_samples_leaf': 0.05731998333436959, 'min_weight_fraction_leaf': 0.37231536589010406, 'max_features': 0.9801724258707393}. Best is trial 241 with value: 0.7773840258827056.[0m
[32m[I 2022-04-13 12:28:55,112][0m Trial 598 finished with value: 0.765885129241774 and parameters: {'splitter': 'best', 'min_samples_split': 0.12405779445915764, 'min_samples_leaf': 0.030358703258854664, 'min_weight_fraction_leaf': 0.017048887289465582, 'max_features': 0.9044016808590832}. Best is trial 241 with value: 0.7773840258827056.[0m
[32m[I 2022-04-13 12:28:56,507][0m Trial 599 finished with value: 0.7165069254133108 and parameters: {'splitter': 'best', 'min_samples_split': 0.10241041648452705, 'min_samples_leaf': 0.17781796482060697, 'min_weight_fraction_leaf': 0.1617636785921679, 'max_features': 0.9346959456262063}. Best is trial 241 with value: 0.7773840258827056.[0m
[32m[I 2022-04-13 12:28:59,692][0m Trial 600 finished with value: 0.7705020346418305 and parameters: {'splitter': 'best', 'min_samples_split': 0.1378722475403774, 'min_samples_leaf': 0.044788413197284827, 'min_weight_fraction_leaf': 0.051667504504289447, 'max_features': 0.9802347961789093}. Best is trial 241 with value: 0.7773840258827056.[0m
[32m[I 2022-04-13 12:29:02,910][0m Trial 601 finished with value: 0.7663688261683868 and parameters: {'splitter': 'best', 'min_samples_split': 0.11120550880403575, 'min_samples_leaf': 0.009000939264606989, 'min_weight_fraction_leaf': 0.06580634796877464, 'max_features': 0.9997494687621012}. Best is trial 241 with value: 0.7773840258827056.[0m
[32m[I 2022-04-13 12:29:06,001][0m Trial 602 finished with value: 0.7669042091493704 and parameters: {'splitter': 'best', 'min_samples_split': 0.12930420954150512, 'min_samples_leaf': 0.018175610492632187, 'min_weight_fraction_leaf': 0.028824733575058308, 'max_features': 0.9595954830550613}. Best is trial 241 with value: 0.7773840258827056.[0m
[32m[I 2022-04-13 12:29:07,381][0m Trial 603 finished with value: 0.7542541114910326 and parameters: {'splitter': 'best', 'min_samples_split': 0.30326614564610116, 'min_samples_leaf': 0.06937662033025596, 'min_weight_fraction_leaf': 0.0004310054347384795, 'max_features': 0.9999573176044666}. Best is trial 241 with value: 0.7773840258827056.[0m
[32m[I 2022-04-13 12:29:08,507][0m Trial 604 finished with value: 0.5907975833158018 and parameters: {'splitter': 'best', 'min_samples_split': 0.09343958129963824, 'min_samples_leaf': 0.036574763136631834, 'min_weight_fraction_leaf': 0.41900174649855393, 'max_features': 0.9678395018009458}. Best is trial 241 with value: 0.7773840258827056.[0m
[32m[I 2022-04-13 12:29:09,649][0m Trial 605 finished with value: 0.7701566150700737 and parameters: {'splitter': 'best', 'min_samples_split': 0.1479967648886538, 'min_samples_leaf': 0.05132228063222966, 'min_weight_fraction_leaf': 0.04482529034864183, 'max_features': 0.9831018951024469}. Best is trial 241 with value: 0.7773840258827056.[0m
[32m[I 2022-04-13 12:29:11,394][0m Trial 606 finished with value: 0.7661679306475279 and parameters: {'splitter': 'best', 'min_samples_split': 0.1186341298657745, 'min_samples_leaf': 0.026550972974272734, 'min_weight_fraction_leaf': 0.015489698282344668, 'max_features': 0.9514436288775538}. Best is trial 241 with value: 0.7773840258827056.[0m
[32m[I 2022-04-13 12:29:13,684][0m Trial 607 finished with value: 0.7604682769538689 and parameters: {'splitter': 'best', 'min_samples_split': 0.10716786989831976, 'min_samples_leaf': 0.04321666315533427, 'min_weight_fraction_leaf': 0.07590796613634399, 'max_features': 0.9694714045184685}. Best is trial 241 with value: 0.7773840258827056.[0m
[32m[I 2022-04-13 12:29:15,706][0m Trial 608 finished with value: 0.7634818288620512 and parameters: {'splitter': 'best', 'min_samples_split': 0.13548782691153152, 'min_samples_leaf': 0.06019994828251512, 'min_weight_fraction_leaf': 0.03674237656097569, 'max_features': 0.9306725000251528}. Best is trial 241 with value: 0.7773840258827056.[0m
[32m[I 2022-04-13 12:29:18,139][0m Trial 609 finished with value: 0.7638108888421044 and parameters: {'splitter': 'best', 'min_samples_split': 0.12326793181166068, 'min_samples_leaf': 0.034028298443403646, 'min_weight_fraction_leaf': 0.02516371348029075, 'max_features': 0.947084362969997}. Best is trial 241 with value: 0.7773840258827056.[0m
[32m[I 2022-04-13 12:29:19,147][0m Trial 610 finished with value: 0.7712547427365355 and parameters: {'splitter': 'best', 'min_samples_split': 0.03356544217824256, 'min_samples_leaf': 0.07872552795285125, 'min_weight_fraction_leaf': 0.00671818260809182, 'max_features': 0.9803922001686618}. Best is trial 241 with value: 0.7773840258827056.[0m
[32m[I 2022-04-13 12:29:19,857][0m Trial 611 finished with value: 0.7273909105702967 and parameters: {'splitter': 'best', 'min_samples_split': 0.08666256480434459, 'min_samples_leaf': 0.01771995872508333, 'min_weight_fraction_leaf': 0.22843313628580614, 'max_features': 0.9798721877110558}. Best is trial 241 with value: 0.7773840258827056.[0m
[32m[I 2022-04-13 12:29:21,314][0m Trial 612 finished with value: 0.7684350609530888 and parameters: {'splitter': 'best', 'min_samples_split': 0.09800296086619065, 'min_samples_leaf': 0.04705216298327808, 'min_weight_fraction_leaf': 0.017279848777635737, 'max_features': 0.9602070925551464}. Best is trial 241 with value: 0.7773840258827056.[0m
[32m[I 2022-04-13 12:29:23,898][0m Trial 613 finished with value: 0.7701595350501922 and parameters: {'splitter': 'best', 'min_samples_split': 0.11378152671913594, 'min_samples_leaf': 0.02644784528469819, 'min_weight_fraction_leaf': 0.053779172836116176, 'max_features': 0.9823945056499751}. Best is trial 241 with value: 0.7773840258827056.[0m
[32m[I 2022-04-13 12:29:25,791][0m Trial 614 finished with value: 0.7190955901387244 and parameters: {'splitter': 'best', 'min_samples_split': 0.3333947169427447, 'min_samples_leaf': 0.0390551372786286, 'min_weight_fraction_leaf': 0.03672836037222828, 'max_features': 0.9184980574347987}. Best is trial 241 with value: 0.7773840258827056.[0m
[32m[I 2022-04-13 12:29:26,008][0m Trial 615 finished with value: 0.750245038874488 and parameters: {'splitter': 'random', 'min_samples_split': 0.24524884659760834, 'min_samples_leaf': 0.056748710594842836, 'min_weight_fraction_leaf': 0.028584317226578636, 'max_features': 0.9450329256561731}. Best is trial 241 with value: 0.7773840258827056.[0m
[32m[I 2022-04-13 12:29:27,866][0m Trial 616 finished with value: 0.7658086725202866 and parameters: {'splitter': 'best', 'min_samples_split': 0.14737720457491763, 'min_samples_leaf': 0.010815088808161928, 'min_weight_fraction_leaf': 0.046654416973558176, 'max_features': 0.9668842297574457}. Best is trial 241 with value: 0.7773840258827056.[0m
[32m[I 2022-04-13 12:29:29,380][0m Trial 617 finished with value: 0.7715463090183867 and parameters: {'splitter': 'best', 'min_samples_split': 0.06527539038743074, 'min_samples_leaf': 0.03158961733700287, 'min_weight_fraction_leaf': 0.06191516081038281, 'max_features': 0.9985146031741028}. Best is trial 241 with value: 0.7773840258827056.[0m
[32m[I 2022-04-13 12:29:30,664][0m Trial 618 finished with value: 0.7748142974311071 and parameters: {'splitter': 'best', 'min_samples_split': 0.13091828231514344, 'min_samples_leaf': 0.046071110771425165, 'min_weight_fraction_leaf': 0.020011188529054494, 'max_features': 0.9827356438758305}. Best is trial 241 with value: 0.7773840258827056.[0m
[32m[I 2022-04-13 12:29:32,350][0m Trial 619 finished with value: 0.7636003801283061 and parameters: {'splitter': 'best', 'min_samples_split': 0.1271161866287821, 'min_samples_leaf': 0.0011042979907270045, 'min_weight_fraction_leaf': 0.010537219700639276, 'max_features': 0.6207498012782863}. Best is trial 241 with value: 0.7773840258827056.[0m
[32m[I 2022-04-13 12:29:32,729][0m Trial 620 finished with value: 0.627231459397374 and parameters: {'splitter': 'best', 'min_samples_split': 0.10737630517593469, 'min_samples_leaf': 0.051511316965790484, 'min_weight_fraction_leaf': 0.007682615201551907, 'max_features': 0.14093075601193888}. Best is trial 241 with value: 0.7773840258827056.[0m
[32m[I 2022-04-13 12:29:35,264][0m Trial 621 finished with value: 0.7678712518003701 and parameters: {'splitter': 'best', 'min_samples_split': 0.1181506974979684, 'min_samples_leaf': 0.06617000361756431, 'min_weight_fraction_leaf': 0.01959436372162333, 'max_features': 0.93871871355681}. Best is trial 241 with value: 0.7773840258827056.[0m
[32m[I 2022-04-13 12:29:35,984][0m Trial 622 finished with value: 0.6177559723639554 and parameters: {'splitter': 'best', 'min_samples_split': 0.07748691212708464, 'min_samples_leaf': 0.32269863895478407, 'min_weight_fraction_leaf': 0.021460797470941158, 'max_features': 0.9591805036223902}. Best is trial 241 with value: 0.7773840258827056.[0m
[32m[I 2022-04-13 12:29:37,974][0m Trial 623 finished with value: 0.7679199464801072 and parameters: {'splitter': 'best', 'min_samples_split': 0.09851721767008761, 'min_samples_leaf': 0.043201222824959945, 'min_weight_fraction_leaf': 0.00811974191334822, 'max_features': 0.9685123328803515}. Best is trial 241 with value: 0.7773840258827056.[0m
[32m[I 2022-04-13 12:29:39,595][0m Trial 624 finished with value: 0.7712769527318276 and parameters: {'splitter': 'best', 'min_samples_split': 0.1310940986335998, 'min_samples_leaf': 0.023313497027158958, 'min_weight_fraction_leaf': 0.026808922437976782, 'max_features': 0.9803481005965708}. Best is trial 241 with value: 0.7773840258827056.[0m
[32m[I 2022-04-13 12:29:41,441][0m Trial 625 finished with value: 0.763402167074178 and parameters: {'splitter': 'best', 'min_samples_split': 0.11305977016635943, 'min_samples_leaf': 0.05210118403601521, 'min_weight_fraction_leaf': 0.03871127631981754, 'max_features': 0.9227762307617637}. Best is trial 241 with value: 0.7773840258827056.[0m
[32m[I 2022-04-13 12:29:42,167][0m Trial 626 finished with value: 0.5962864358175997 and parameters: {'splitter': 'best', 'min_samples_split': 0.12305651852232428, 'min_samples_leaf': 0.036058905020377584, 'min_weight_fraction_leaf': 0.47714438056394504, 'max_features': 0.9491869724187918}. Best is trial 241 with value: 0.7773840258827056.[0m
[32m[I 2022-04-13 12:29:42,977][0m Trial 627 finished with value: 0.7614000856479388 and parameters: {'splitter': 'best', 'min_samples_split': 0.10540989708053054, 'min_samples_leaf': 0.05746730472450593, 'min_weight_fraction_leaf': 0.0003563484536126989, 'max_features': 0.895029180846778}. Best is trial 241 with value: 0.7773840258827056.[0m
[32m[I 2022-04-13 12:29:43,112][0m Trial 628 finished with value: 0.5907975833158018 and parameters: {'splitter': 'best', 'min_samples_split': 0.08908901343633545, 'min_samples_leaf': 0.4082720737237526, 'min_weight_fraction_leaf': 0.01753554432832139, 'max_features': 0.9824683045210395}. Best is trial 241 with value: 0.7773840258827056.[0m
[32m[I 2022-04-13 12:29:43,298][0m Trial 629 finished with value: 0.5925145329402793 and parameters: {'splitter': 'best', 'min_samples_split': 0.13751612451625717, 'min_samples_leaf': 0.35656948136656746, 'min_weight_fraction_leaf': 0.03139651565063204, 'max_features': 0.9624477790337342}. Best is trial 241 with value: 0.7773840258827056.[0m
[32m[I 2022-04-13 12:29:44,229][0m Trial 630 finished with value: 0.759744904511227 and parameters: {'splitter': 'best', 'min_samples_split': 0.26656465225675385, 'min_samples_leaf': 0.04214459872777592, 'min_weight_fraction_leaf': 0.01490043291748685, 'max_features': 0.9829875900650998}. Best is trial 241 with value: 0.7773840258827056.[0m
[32m[I 2022-04-13 12:29:45,658][0m Trial 631 finished with value: 0.7684013227937123 and parameters: {'splitter': 'best', 'min_samples_split': 0.1189106063327858, 'min_samples_leaf': 0.02687003275320064, 'min_weight_fraction_leaf': 0.044388902529429966, 'max_features': 0.9404628314349601}. Best is trial 241 with value: 0.7773840258827056.[0m
[32m[I 2022-04-13 12:29:48,251][0m Trial 632 finished with value: 0.7474209264188896 and parameters: {'splitter': 'best', 'min_samples_split': 0.1271304550619094, 'min_samples_leaf': 0.016440782186153774, 'min_weight_fraction_leaf': 0.026270830116253165, 'max_features': 0.6763746811061544}. Best is trial 241 with value: 0.7773840258827056.[0m
[32m[I 2022-04-13 12:29:51,287][0m Trial 633 finished with value: 0.7545597390907391 and parameters: {'splitter': 'best', 'min_samples_split': 0.04834785068858866, 'min_samples_leaf': 0.08980666552509234, 'min_weight_fraction_leaf': 0.056687332580097685, 'max_features': 0.9657942644821471}. Best is trial 241 with value: 0.7773840258827056.[0m
[32m[I 2022-04-13 12:29:51,608][0m Trial 634 finished with value: 0.7105078687626362 and parameters: {'splitter': 'random', 'min_samples_split': 0.10727735885069718, 'min_samples_leaf': 0.11534987553842313, 'min_weight_fraction_leaf': 0.008455726539475693, 'max_features': 0.9825721315579918}. Best is trial 241 with value: 0.7773840258827056.[0m
[32m[I 2022-04-13 12:29:53,904][0m Trial 635 finished with value: 0.7630706229411763 and parameters: {'splitter': 'best', 'min_samples_split': 0.09694402112765951, 'min_samples_leaf': 0.06845816701661173, 'min_weight_fraction_leaf': 0.03503077364241374, 'max_features': 0.9531771576816092}. Best is trial 241 with value: 0.7773840258827056.[0m
[32m[I 2022-04-13 12:29:54,785][0m Trial 636 finished with value: 0.7738926192359774 and parameters: {'splitter': 'best', 'min_samples_split': 0.13796497423923787, 'min_samples_leaf': 0.047242694567668005, 'min_weight_fraction_leaf': 0.020298845152653438, 'max_features': 0.9842823981639371}. Best is trial 241 with value: 0.7773840258827056.[0m
[32m[I 2022-04-13 12:29:56,212][0m Trial 637 finished with value: 0.7698223091411682 and parameters: {'splitter': 'best', 'min_samples_split': 0.11829850878728919, 'min_samples_leaf': 0.03334969701323908, 'min_weight_fraction_leaf': 0.08792590570769435, 'max_features': 0.999574616178747}. Best is trial 241 with value: 0.7773840258827056.[0m
