[32m[I 2022-04-13 12:20:27,802][0m Trial 323 finished with value: 0.7653955342971 and parameters: {'splitter': 'best', 'min_samples_split': 0.12885656267160545, 'min_samples_leaf': 0.03708566474582147, 'min_weight_fraction_leaf': 0.02761180130688107, 'max_features': 0.9333276056907187}. Best is trial 241 with value: 0.7773840258827056.[0m
[32m[I 2022-04-13 12:20:29,000][0m Trial 324 finished with value: 0.7709381210267165 and parameters: {'splitter': 'best', 'min_samples_split': 0.0886461168738534, 'min_samples_leaf': 0.0509766575742025, 'min_weight_fraction_leaf': 0.03878934529775971, 'max_features': 0.9842787227026649}. Best is trial 241 with value: 0.7773840258827056.[0m
[32m[I 2022-04-13 12:20:32,683][0m Trial 325 finished with value: 0.7647971602555459 and parameters: {'splitter': 'best', 'min_samples_split': 0.10333133750995531, 'min_samples_leaf': 0.015885899623466527, 'min_weight_fraction_leaf': 0.06285829399199254, 'max_features': 0.9617532139671877}. Best is trial 241 with value: 0.7773840258827056.[0m
[32m[I 2022-04-13 12:20:33,727][0m Trial 326 finished with value: 0.7284885611300307 and parameters: {'splitter': 'best', 'min_samples_split': 0.11600736503189081, 'min_samples_leaf': 0.21104131238766588, 'min_weight_fraction_leaf': 0.02093231236410512, 'max_features': 0.9826638839427423}. Best is trial 241 with value: 0.7773840258827056.[0m
[32m[I 2022-04-13 12:20:35,904][0m Trial 327 finished with value: 0.7599109761249403 and parameters: {'splitter': 'best', 'min_samples_split': 0.18057205981148836, 'min_samples_leaf': 0.029081060592500627, 'min_weight_fraction_leaf': 0.040756177832217924, 'max_features': 0.9506915767522832}. Best is trial 241 with value: 0.7773840258827056.[0m
[32m[I 2022-04-13 12:20:38,908][0m Trial 328 finished with value: 0.7667142166199503 and parameters: {'splitter': 'best', 'min_samples_split': 0.11942378336789726, 'min_samples_leaf': 0.04030239643054464, 'min_weight_fraction_leaf': 0.029244478066079556, 'max_features': 0.9730713188314395}. Best is trial 241 with value: 0.7773840258827056.[0m
[32m[I 2022-04-13 12:20:41,159][0m Trial 329 finished with value: 0.7209149879629041 and parameters: {'splitter': 'best', 'min_samples_split': 0.32354191524070464, 'min_samples_leaf': 0.048882954226878494, 'min_weight_fraction_leaf': 0.047386461579942064, 'max_features': 0.9234076182838432}. Best is trial 241 with value: 0.7773840258827056.[0m
[32m[I 2022-04-13 12:20:43,439][0m Trial 330 finished with value: 0.7610456229750671 and parameters: {'splitter': 'best', 'min_samples_split': 0.10124289173180075, 'min_samples_leaf': 0.023206515767512894, 'min_weight_fraction_leaf': 0.055650410828317065, 'max_features': 0.8972589182844531}. Best is trial 241 with value: 0.7773840258827056.[0m
[32m[I 2022-04-13 12:20:45,452][0m Trial 331 finished with value: 0.7678977884473014 and parameters: {'splitter': 'best', 'min_samples_split': 0.16196204750735846, 'min_samples_leaf': 0.03581333220842833, 'min_weight_fraction_leaf': 0.03835250313045376, 'max_features': 0.9833098791017859}. Best is trial 241 with value: 0.7773840258827056.[0m
[32m[I 2022-04-13 12:20:46,466][0m Trial 332 finished with value: 0.7376824856064391 and parameters: {'splitter': 'best', 'min_samples_split': 0.13384964692086265, 'min_samples_leaf': 0.05856957242234594, 'min_weight_fraction_leaf': 0.01841501375512211, 'max_features': 0.565868134142666}. Best is trial 241 with value: 0.7773840258827056.[0m
[32m[I 2022-04-13 12:20:46,654][0m Trial 333 finished with value: 0.5552415274237209 and parameters: {'splitter': 'best', 'min_samples_split': 0.0894371710903955, 'min_samples_leaf': 0.04341864888477688, 'min_weight_fraction_leaf': 0.06856950317330002, 'max_features': 0.03453989276478009}. Best is trial 241 with value: 0.7773840258827056.[0m
[32m[I 2022-04-13 12:20:49,580][0m Trial 334 finished with value: 0.7744274760951088 and parameters: {'splitter': 'best', 'min_samples_split': 0.10960326024866987, 'min_samples_leaf': 0.014576491053113108, 'min_weight_fraction_leaf': 0.03083185033573336, 'max_features': 0.9996625902746408}. Best is trial 241 with value: 0.7773840258827056.[0m
[32m[I 2022-04-13 12:20:51,234][0m Trial 335 finished with value: 0.7601658781007672 and parameters: {'splitter': 'best', 'min_samples_split': 0.10643756916071379, 'min_samples_leaf': 0.1558717615179781, 'min_weight_fraction_leaf': 0.02824640849225584, 'max_features': 0.9978782422330222}. Best is trial 241 with value: 0.7773840258827056.[0m
[32m[I 2022-04-13 12:20:53,782][0m Trial 336 finished with value: 0.7635865914177173 and parameters: {'splitter': 'best', 'min_samples_split': 0.1235348521213398, 'min_samples_leaf': 0.010575307068645005, 'min_weight_fraction_leaf': 0.016905643280537314, 'max_features': 0.9615348640088226}. Best is trial 241 with value: 0.7773840258827056.[0m
[32m[I 2022-04-13 12:20:56,025][0m Trial 337 finished with value: 0.7703555658586806 and parameters: {'splitter': 'best', 'min_samples_split': 0.09545231557178938, 'min_samples_leaf': 0.011357328989003511, 'min_weight_fraction_leaf': 0.029091057110492223, 'max_features': 0.9835777973753174}. Best is trial 241 with value: 0.7773840258827056.[0m
[32m[I 2022-04-13 12:20:58,886][0m Trial 338 finished with value: 0.7637491271780353 and parameters: {'splitter': 'best', 'min_samples_split': 0.14898816089514585, 'min_samples_leaf': 0.021030525066423864, 'min_weight_fraction_leaf': 0.035930531656380785, 'max_features': 0.9391440360710921}. Best is trial 241 with value: 0.7773840258827056.[0m
[32m[I 2022-04-13 12:21:01,072][0m Trial 339 finished with value: 0.7693249902700107 and parameters: {'splitter': 'best', 'min_samples_split': 0.11336956336752076, 'min_samples_leaf': 0.02770778555601907, 'min_weight_fraction_leaf': 0.017475233135785938, 'max_features': 0.9640949316869395}. Best is trial 241 with value: 0.7773840258827056.[0m
[32m[I 2022-04-13 12:21:03,173][0m Trial 340 finished with value: 0.7601942186431094 and parameters: {'splitter': 'best', 'min_samples_split': 0.10248593396084221, 'min_samples_leaf': 0.015952986825238265, 'min_weight_fraction_leaf': 0.18613259970749815, 'max_features': 0.9804313380950441}. Best is trial 241 with value: 0.7773840258827056.[0m
[32m[I 2022-04-13 12:21:04,783][0m Trial 341 finished with value: 0.773267756679191 and parameters: {'splitter': 'best', 'min_samples_split': 0.12692770540216758, 'min_samples_leaf': 0.0021893849881849878, 'min_weight_fraction_leaf': 0.040447443548173485, 'max_features': 0.9982716612747778}. Best is trial 241 with value: 0.7773840258827056.[0m
[32m[I 2022-04-13 12:21:04,974][0m Trial 342 finished with value: 0.7619747497674985 and parameters: {'splitter': 'random', 'min_samples_split': 0.08941530842825743, 'min_samples_leaf': 0.03435822812191004, 'min_weight_fraction_leaf': 0.026238435048629438, 'max_features': 0.9992508409558291}. Best is trial 241 with value: 0.7773840258827056.[0m
[32m[I 2022-04-13 12:21:07,887][0m Trial 343 finished with value: 0.7594678349057584 and parameters: {'splitter': 'best', 'min_samples_split': 0.13259877945302895, 'min_samples_leaf': 0.07992243688968248, 'min_weight_fraction_leaf': 0.052596122085699186, 'max_features': 0.9547102443939952}. Best is trial 241 with value: 0.7773840258827056.[0m
[32m[I 2022-04-13 12:21:10,468][0m Trial 344 finished with value: 0.7738492905786677 and parameters: {'splitter': 'best', 'min_samples_split': 0.10742393724510058, 'min_samples_leaf': 0.024222910221828004, 'min_weight_fraction_leaf': 0.03245422750393763, 'max_features': 0.9999542658782294}. Best is trial 241 with value: 0.7773840258827056.[0m
[32m[I 2022-04-13 12:21:12,937][0m Trial 345 finished with value: 0.7638658233904253 and parameters: {'splitter': 'best', 'min_samples_split': 0.140272195281496, 'min_samples_leaf': 0.01893519567533756, 'min_weight_fraction_leaf': 0.04371910644357517, 'max_features': 0.9699483054200002}. Best is trial 241 with value: 0.7773840258827056.[0m
[32m[I 2022-04-13 12:21:15,229][0m Trial 346 finished with value: 0.768352021027492 and parameters: {'splitter': 'best', 'min_samples_split': 0.12047501294859582, 'min_samples_leaf': 0.02563957245227807, 'min_weight_fraction_leaf': 0.05945587036125709, 'max_features': 0.9489715741198117}. Best is trial 241 with value: 0.7773840258827056.[0m
[32m[I 2022-04-13 12:21:18,231][0m Trial 347 finished with value: 0.7725422023856293 and parameters: {'splitter': 'best', 'min_samples_split': 0.10981335970704512, 'min_samples_leaf': 0.012979167030252675, 'min_weight_fraction_leaf': 0.029118304202277723, 'max_features': 0.9998719450059486}. Best is trial 241 with value: 0.7773840258827056.[0m
[32m[I 2022-04-13 12:21:21,420][0m Trial 348 finished with value: 0.7663228264628221 and parameters: {'splitter': 'best', 'min_samples_split': 0.09723308214207449, 'min_samples_leaf': 0.028281939454425753, 'min_weight_fraction_leaf': 0.036299544009669796, 'max_features': 0.9669981798818623}. Best is trial 241 with value: 0.7773840258827056.[0m
[32m[I 2022-04-13 12:21:23,790][0m Trial 349 finished with value: 0.7708501802721416 and parameters: {'splitter': 'best', 'min_samples_split': 0.12252803176761622, 'min_samples_leaf': 0.053528704874921916, 'min_weight_fraction_leaf': 0.0508976623339418, 'max_features': 0.9992316363142111}. Best is trial 241 with value: 0.7773840258827056.[0m
[32m[I 2022-04-13 12:21:26,886][0m Trial 350 finished with value: 0.7636138086446478 and parameters: {'splitter': 'best', 'min_samples_split': 0.1476194645605385, 'min_samples_leaf': 0.010220549253578771, 'min_weight_fraction_leaf': 0.03952317875135499, 'max_features': 0.9357521469199007}. Best is trial 241 with value: 0.7773840258827056.[0m
[32m[I 2022-04-13 12:21:29,462][0m Trial 351 finished with value: 0.7601185147372499 and parameters: {'splitter': 'best', 'min_samples_split': 0.27108790116756587, 'min_samples_leaf': 0.0315043857311212, 'min_weight_fraction_leaf': 0.012965713975407623, 'max_features': 0.9792053986965057}. Best is trial 241 with value: 0.7773840258827056.[0m
[32m[I 2022-04-13 12:21:31,504][0m Trial 352 finished with value: 0.7677459249127839 and parameters: {'splitter': 'best', 'min_samples_split': 0.11202931636150895, 'min_samples_leaf': 0.020803206739451626, 'min_weight_fraction_leaf': 0.04635442931002399, 'max_features': 0.9584773015395721}. Best is trial 241 with value: 0.7773840258827056.[0m
[32m[I 2022-04-13 12:21:33,668][0m Trial 353 finished with value: 0.7710939707278462 and parameters: {'splitter': 'best', 'min_samples_split': 0.13296429936984216, 'min_samples_leaf': 0.04784570010477841, 'min_weight_fraction_leaf': 0.07709963496619072, 'max_features': 0.981024110627027}. Best is trial 241 with value: 0.7773840258827056.[0m
[32m[I 2022-04-13 12:21:35,854][0m Trial 354 finished with value: 0.7676360572829874 and parameters: {'splitter': 'best', 'min_samples_split': 0.08781278509393639, 'min_samples_leaf': 0.06621713515685194, 'min_weight_fraction_leaf': 0.03176955643462795, 'max_features': 0.9666275841601117}. Best is trial 241 with value: 0.7773840258827056.[0m
[32m[I 2022-04-13 12:21:37,000][0m Trial 355 finished with value: 0.7468864719531504 and parameters: {'splitter': 'best', 'min_samples_split': 0.11985581890189138, 'min_samples_leaf': 0.13685807812202855, 'min_weight_fraction_leaf': 0.06067173542758163, 'max_features': 0.9436655733437311}. Best is trial 241 with value: 0.7773840258827056.[0m
[32m[I 2022-04-13 12:21:40,071][0m Trial 356 finished with value: 0.7716093027206015 and parameters: {'splitter': 'best', 'min_samples_split': 0.09741146491215626, 'min_samples_leaf': 0.0027743827496265125, 'min_weight_fraction_leaf': 0.02479901680518906, 'max_features': 0.9835435108955193}. Best is trial 241 with value: 0.7773840258827056.[0m
[32m[I 2022-04-13 12:21:42,214][0m Trial 357 finished with value: 0.7650498232355989 and parameters: {'splitter': 'best', 'min_samples_split': 0.10857097809735818, 'min_samples_leaf': 0.03524381904872489, 'min_weight_fraction_leaf': 0.04864746770751076, 'max_features': 0.9209638340636871}. Best is trial 241 with value: 0.7773840258827056.[0m
[32m[I 2022-04-13 12:21:44,488][0m Trial 358 finished with value: 0.773414552390469 and parameters: {'splitter': 'best', 'min_samples_split': 0.13790681087465795, 'min_samples_leaf': 0.02498540974350274, 'min_weight_fraction_leaf': 0.034751440850461335, 'max_features': 0.9995503319891089}. Best is trial 241 with value: 0.7773840258827056.[0m
[32m[I 2022-04-13 12:21:46,474][0m Trial 359 finished with value: 0.7727802318406021 and parameters: {'splitter': 'best', 'min_samples_split': 0.1423288100734902, 'min_samples_leaf': 0.019859153076483668, 'min_weight_fraction_leaf': 0.01100200032661683, 'max_features': 0.998254769049552}. Best is trial 241 with value: 0.7773840258827056.[0m
[32m[I 2022-04-13 12:21:49,295][0m Trial 360 finished with value: 0.7649248663040809 and parameters: {'splitter': 'best', 'min_samples_split': 0.1565418652786705, 'min_samples_leaf': 0.026340477346097013, 'min_weight_fraction_leaf': 0.05439522307570593, 'max_features': 0.965136065437912}. Best is trial 241 with value: 0.7773840258827056.[0m
[32m[I 2022-04-13 12:21:49,374][0m Trial 361 finished with value: 0.5 and parameters: {'splitter': 'random', 'min_samples_split': 0.11277788425468789, 'min_samples_leaf': 0.4932679329690104, 'min_weight_fraction_leaf': 0.0399913147998619, 'max_features': 0.19200145539512448}. Best is trial 241 with value: 0.7773840258827056.[0m
[32m[I 2022-04-13 12:21:52,587][0m Trial 362 finished with value: 0.7741863029116108 and parameters: {'splitter': 'best', 'min_samples_split': 0.10195597331088271, 'min_samples_leaf': 0.012295911057338252, 'min_weight_fraction_leaf': 0.023658569625044756, 'max_features': 0.9985864977417492}. Best is trial 241 with value: 0.7773840258827056.[0m
[32m[I 2022-04-13 12:21:54,873][0m Trial 363 finished with value: 0.765350700553859 and parameters: {'splitter': 'best', 'min_samples_split': 0.08873249722653909, 'min_samples_leaf': 0.009284743192520324, 'min_weight_fraction_leaf': 0.019648107186019247, 'max_features': 0.9527348351867267}. Best is trial 241 with value: 0.7773840258827056.[0m
[32m[I 2022-04-13 12:21:56,247][0m Trial 364 finished with value: 0.7706973454895037 and parameters: {'splitter': 'best', 'min_samples_split': 0.09815636048887684, 'min_samples_leaf': 0.017859206085694024, 'min_weight_fraction_leaf': 0.009605952682563625, 'max_features': 0.9764594014994373}. Best is trial 241 with value: 0.7773840258827056.[0m
[32m[I 2022-04-13 12:21:56,805][0m Trial 365 finished with value: 0.6743624146605087 and parameters: {'splitter': 'best', 'min_samples_split': 0.10112734726202643, 'min_samples_leaf': 0.0016663535869644273, 'min_weight_fraction_leaf': 0.3104314737157481, 'max_features': 0.9788445343339027}. Best is trial 241 with value: 0.7773840258827056.[0m
[32m[I 2022-04-13 12:21:58,578][0m Trial 366 finished with value: 0.5962864358175997 and parameters: {'splitter': 'best', 'min_samples_split': 0.08500311576450838, 'min_samples_leaf': 0.015192628727782943, 'min_weight_fraction_leaf': 0.47799424515097894, 'max_features': 0.9294204313931623}. Best is trial 241 with value: 0.7773840258827056.[0m
[32m[I 2022-04-13 12:22:01,476][0m Trial 367 finished with value: 0.7745201153759307 and parameters: {'splitter': 'best', 'min_samples_split': 0.10843094767447074, 'min_samples_leaf': 0.03241565215112062, 'min_weight_fraction_leaf': 0.02504225079846362, 'max_features': 0.9984383422885418}. Best is trial 241 with value: 0.7773840258827056.[0m
[32m[I 2022-04-13 12:22:01,820][0m Trial 368 finished with value: 0.5907975833158018 and parameters: {'splitter': 'best', 'min_samples_split': 0.11742470470452422, 'min_samples_leaf': 0.4138046406646122, 'min_weight_fraction_leaf': 0.028606910008861033, 'max_features': 0.9543056765597909}. Best is trial 241 with value: 0.7773840258827056.[0m
[32m[I 2022-04-13 12:22:04,713][0m Trial 369 finished with value: 0.7667824828576928 and parameters: {'splitter': 'best', 'min_samples_split': 0.11085146715144578, 'min_samples_leaf': 0.04980922456334767, 'min_weight_fraction_leaf': 0.06568337384210142, 'max_features': 0.9679889919131096}. Best is trial 241 with value: 0.7773840258827056.[0m
[32m[I 2022-04-13 12:22:05,986][0m Trial 370 finished with value: 0.7728233071946777 and parameters: {'splitter': 'best', 'min_samples_split': 0.1250313409363569, 'min_samples_leaf': 0.03724658995253769, 'min_weight_fraction_leaf': 0.04577004560889531, 'max_features': 0.9845335657591903}. Best is trial 241 with value: 0.7773840258827056.[0m
[32m[I 2022-04-13 12:22:08,405][0m Trial 371 finished with value: 0.768352021027492 and parameters: {'splitter': 'best', 'min_samples_split': 0.10347089825220936, 'min_samples_leaf': 0.05929088217111029, 'min_weight_fraction_leaf': 0.026031173967280743, 'max_features': 0.9458994479780084}. Best is trial 241 with value: 0.7773840258827056.[0m
[32m[I 2022-04-13 12:22:09,018][0m Trial 372 finished with value: 0.7419333435768353 and parameters: {'splitter': 'best', 'min_samples_split': 0.11053130299310916, 'min_samples_leaf': 0.03211505931230744, 'min_weight_fraction_leaf': 0.0405688750385119, 'max_features': 0.3933650616778661}. Best is trial 241 with value: 0.7773840258827056.[0m
[32m[I 2022-04-13 12:22:10,320][0m Trial 373 finished with value: 0.7542541114910326 and parameters: {'splitter': 'best', 'min_samples_split': 0.30179413755528417, 'min_samples_leaf': 0.04358726469494951, 'min_weight_fraction_leaf': 0.054714630167702, 'max_features': 0.9991043650264579}. Best is trial 241 with value: 0.7773840258827056.[0m
[32m[I 2022-04-13 12:22:12,833][0m Trial 374 finished with value: 0.7184032701195723 and parameters: {'splitter': 'best', 'min_samples_split': 0.3741203172488834, 'min_samples_leaf': 0.013391414796089868, 'min_weight_fraction_leaf': 0.03268685842521783, 'max_features': 0.9695550777512486}. Best is trial 241 with value: 0.7773840258827056.[0m
[32m[I 2022-04-13 12:22:15,375][0m Trial 375 finished with value: 0.7718245615373284 and parameters: {'splitter': 'best', 'min_samples_split': 0.12628950595634386, 'min_samples_leaf': 0.04975249153241916, 'min_weight_fraction_leaf': 0.022162795224519128, 'max_features': 0.9820524722096468}. Best is trial 241 with value: 0.7773840258827056.[0m
[32m[I 2022-04-13 12:22:17,301][0m Trial 376 finished with value: 0.752434713666853 and parameters: {'splitter': 'best', 'min_samples_split': 0.349765138363737, 'min_samples_leaf': 0.029780869100148908, 'min_weight_fraction_leaf': 0.044740149054500286, 'max_features': 0.9999702755751287}. Best is trial 241 with value: 0.7773840258827056.[0m
[32m[I 2022-04-13 12:22:19,790][0m Trial 377 finished with value: 0.7606020037705408 and parameters: {'splitter': 'best', 'min_samples_split': 0.10260278582317163, 'min_samples_leaf': 0.07421797483592923, 'min_weight_fraction_leaf': 0.01541975150047389, 'max_features': 0.9519251228016292}. Best is trial 241 with value: 0.7773840258827056.[0m
[32m[I 2022-04-13 12:22:21,795][0m Trial 378 finished with value: 0.7665409505328171 and parameters: {'splitter': 'best', 'min_samples_split': 0.11646675514653074, 'min_samples_leaf': 0.04271186929233409, 'min_weight_fraction_leaf': 0.0697634357324378, 'max_features': 0.9110043481314293}. Best is trial 241 with value: 0.7773840258827056.[0m
[32m[I 2022-04-13 12:22:24,069][0m Trial 379 finished with value: 0.7632110176867186 and parameters: {'splitter': 'best', 'min_samples_split': 0.09481264780970759, 'min_samples_leaf': 0.021177817641174494, 'min_weight_fraction_leaf': 0.034162003830547925, 'max_features': 0.9681845762662343}. Best is trial 241 with value: 0.7773840258827056.[0m
[32m[I 2022-04-13 12:22:25,906][0m Trial 380 finished with value: 0.7651112149542133 and parameters: {'splitter': 'best', 'min_samples_split': 0.12264739032238468, 'min_samples_leaf': 0.06177061655971856, 'min_weight_fraction_leaf': 0.05473961157465287, 'max_features': 0.9390539703875803}. Best is trial 241 with value: 0.7773840258827056.[0m
[32m[I 2022-04-13 12:22:26,191][0m Trial 381 finished with value: 0.7539900697968734 and parameters: {'splitter': 'random', 'min_samples_split': 0.1329269403554118, 'min_samples_leaf': 0.008199560402597908, 'min_weight_fraction_leaf': 0.007607021419609304, 'max_features': 0.9813405942729454}. Best is trial 241 with value: 0.7773840258827056.[0m
[32m[I 2022-04-13 12:22:26,536][0m Trial 382 finished with value: 0.6156516348923894 and parameters: {'splitter': 'best', 'min_samples_split': 0.11095035205427042, 'min_samples_leaf': 0.2901567758795474, 'min_weight_fraction_leaf': 0.027474426031577397, 'max_features': 0.9644680432943468}. Best is trial 241 with value: 0.7773840258827056.[0m
[32m[I 2022-04-13 12:22:27,591][0m Trial 383 finished with value: 0.773699253230707 and parameters: {'splitter': 'best', 'min_samples_split': 0.10531539990905969, 'min_samples_leaf': 0.03505230946835511, 'min_weight_fraction_leaf': 0.04071554791615559, 'max_features': 0.9845522217926675}. Best is trial 241 with value: 0.7773840258827056.[0m
[32m[I 2022-04-13 12:22:28,812][0m Trial 384 finished with value: 0.7754009269082506 and parameters: {'splitter': 'best', 'min_samples_split': 0.09727408275828393, 'min_samples_leaf': 0.03136927650142072, 'min_weight_fraction_leaf': 0.04557870953826193, 'max_features': 0.9996242739245752}. Best is trial 241 with value: 0.7773840258827056.[0m
[32m[I 2022-04-13 12:22:30,513][0m Trial 385 finished with value: 0.7715495279008934 and parameters: {'splitter': 'best', 'min_samples_split': 0.0938103027870457, 'min_samples_leaf': 0.0012754205747310121, 'min_weight_fraction_leaf': 0.05974219819816019, 'max_features': 0.9974620636979553}. Best is trial 241 with value: 0.7773840258827056.[0m
