[32m[I 2022-04-13 11:43:09,043][0m Trial 63 finished with value: 0.7292368988962108 and parameters: {'splitter': 'random', 'min_samples_split': 0.1824825569471657, 'min_samples_leaf': 0.12300977352994541, 'min_weight_fraction_leaf': 0.04927651091970966, 'max_features': 0.19711467790734344}. Best is trial 41 with value: 0.8561362655111697.[0m
[32m[I 2022-04-13 11:43:09,182][0m Trial 64 finished with value: 0.6629557092410192 and parameters: {'splitter': 'random', 'min_samples_split': 0.3567384449597368, 'min_samples_leaf': 0.025963915980428257, 'min_weight_fraction_leaf': 0.01969826287819275, 'max_features': 0.3758500984352845}. Best is trial 41 with value: 0.8561362655111697.[0m
[32m[I 2022-04-13 11:43:09,309][0m Trial 65 finished with value: 0.5650625510638596 and parameters: {'splitter': 'random', 'min_samples_split': 0.3999526582047307, 'min_samples_leaf': 0.06907796864894643, 'min_weight_fraction_leaf': 7.978248787589119e-05, 'max_features': 0.443442761687309}. Best is trial 41 with value: 0.8561362655111697.[0m
[32m[I 2022-04-13 11:43:09,563][0m Trial 66 finished with value: 0.6391265263494803 and parameters: {'splitter': 'random', 'min_samples_split': 0.2618557322688033, 'min_samples_leaf': 0.17228616208944023, 'min_weight_fraction_leaf': 0.07778591358022383, 'max_features': 0.27835138893065603}. Best is trial 41 with value: 0.8561362655111697.[0m
[32m[I 2022-04-13 11:43:09,723][0m Trial 67 finished with value: 0.7638603645026973 and parameters: {'splitter': 'random', 'min_samples_split': 0.11119593645796363, 'min_samples_leaf': 0.10193479623045865, 'min_weight_fraction_leaf': 0.0370605651134137, 'max_features': 0.3889506381735723}. Best is trial 41 with value: 0.8561362655111697.[0m
[32m[I 2022-04-13 11:43:09,848][0m Trial 68 finished with value: 0.7625135703475339 and parameters: {'splitter': 'random', 'min_samples_split': 0.10882285516107182, 'min_samples_leaf': 0.09886379422643252, 'min_weight_fraction_leaf': 0.03983384832502472, 'max_features': 0.3848348322699166}. Best is trial 41 with value: 0.8561362655111697.[0m
[32m[I 2022-04-13 11:43:09,961][0m Trial 69 finished with value: 0.5371812073302544 and parameters: {'splitter': 'random', 'min_samples_split': 0.11131144578468755, 'min_samples_leaf': 0.3854398232160635, 'min_weight_fraction_leaf': 0.03299343772336162, 'max_features': 0.4850247113698704}. Best is trial 41 with value: 0.8561362655111697.[0m
[32m[I 2022-04-13 11:43:10,455][0m Trial 70 finished with value: 0.7624420941414725 and parameters: {'splitter': 'best', 'min_samples_split': 0.13867352509134792, 'min_samples_leaf': 0.07684713588175864, 'min_weight_fraction_leaf': 0.054763363034736494, 'max_features': 0.580724053658505}. Best is trial 41 with value: 0.8561362655111697.[0m
[32m[I 2022-04-13 11:43:10,814][0m Trial 71 finished with value: 0.8729469306252062 and parameters: {'splitter': 'best', 'min_samples_split': 0.07748129975894907, 'min_samples_leaf': 0.07375576782284102, 'min_weight_fraction_leaf': 0.05746925120246929, 'max_features': 0.5878323939365755}. Best is trial 71 with value: 0.8729469306252062.[0m
/media/san2_ssd/data/Workdir/survival/utils.py:305: RuntimeWarning: invalid value encountered in true_divide
  pdfs = np.gradient(1-survs,axis=1)/norms
[32m[I 2022-04-13 11:43:11,240][0m Trial 72 finished with value: 0.8763300725809282 and parameters: {'splitter': 'best', 'min_samples_split': 0.07861701140970265, 'min_samples_leaf': 0.04658372049681145, 'min_weight_fraction_leaf': 0.059923609386187196, 'max_features': 0.5997695855702461}. Best is trial 72 with value: 0.8763300725809282.[0m
[32m[I 2022-04-13 11:43:11,510][0m Trial 73 finished with value: 0.8729469306252062 and parameters: {'splitter': 'best', 'min_samples_split': 0.08309942478106196, 'min_samples_leaf': 0.07332459296281174, 'min_weight_fraction_leaf': 0.05533069333715633, 'max_features': 0.5921865830441729}. Best is trial 72 with value: 0.8763300725809282.[0m
[32m[I 2022-04-13 11:43:12,209][0m Trial 74 finished with value: 0.7610782844260497 and parameters: {'splitter': 'best', 'min_samples_split': 0.082476900189161, 'min_samples_leaf': 0.044069936331232636, 'min_weight_fraction_leaf': 0.09727469954741828, 'max_features': 0.6721714867193832}. Best is trial 72 with value: 0.8763300725809282.[0m
[32m[I 2022-04-13 11:43:12,553][0m Trial 75 finished with value: 0.7656643027366613 and parameters: {'splitter': 'best', 'min_samples_split': 0.0583358661832548, 'min_samples_leaf': 0.0037817713335192155, 'min_weight_fraction_leaf': 0.12262887539231165, 'max_features': 0.6060756949479922}. Best is trial 72 with value: 0.8763300725809282.[0m
[32m[I 2022-04-13 11:43:13,966][0m Trial 76 finished with value: 0.5724188074244891 and parameters: {'splitter': 'best', 'min_samples_split': 0.0641913311879741, 'min_samples_leaf': 0.005436557901355346, 'min_weight_fraction_leaf': 0.1234611496118478, 'max_features': 0.610448199347417}. Best is trial 72 with value: 0.8763300725809282.[0m
/media/san2_ssd/data/Workdir/survival/utils.py:305: RuntimeWarning: invalid value encountered in true_divide
  pdfs = np.gradient(1-survs,axis=1)/norms
[32m[I 2022-04-13 11:43:14,909][0m Trial 77 finished with value: 0.8822667399503734 and parameters: {'splitter': 'best', 'min_samples_split': 0.08142264102504644, 'min_samples_leaf': 0.017907459264370484, 'min_weight_fraction_leaf': 0.0636974406484565, 'max_features': 0.6507312579291459}. Best is trial 77 with value: 0.8822667399503734.[0m
[32m[I 2022-04-13 11:43:15,295][0m Trial 78 finished with value: 0.8600029050257485 and parameters: {'splitter': 'best', 'min_samples_split': 0.05511631860689095, 'min_samples_leaf': 0.015663426831483654, 'min_weight_fraction_leaf': 0.06133946625644563, 'max_features': 0.544576810637137}. Best is trial 77 with value: 0.8822667399503734.[0m
/media/san2_ssd/data/Workdir/survival/utils.py:305: RuntimeWarning: invalid value encountered in true_divide
  pdfs = np.gradient(1-survs,axis=1)/norms
[32m[I 2022-04-13 11:43:16,336][0m Trial 79 finished with value: 0.8814440213828053 and parameters: {'splitter': 'best', 'min_samples_split': 0.019318406594399897, 'min_samples_leaf': 0.027702955255058805, 'min_weight_fraction_leaf': 0.06068671505048777, 'max_features': 0.6513006271446239}. Best is trial 77 with value: 0.8822667399503734.[0m
/media/san2_ssd/data/Workdir/survival/utils.py:305: RuntimeWarning: invalid value encountered in true_divide
  pdfs = np.gradient(1-survs,axis=1)/norms
[32m[I 2022-04-13 11:43:17,180][0m Trial 80 finished with value: 0.8814440213828053 and parameters: {'splitter': 'best', 'min_samples_split': 0.012736915252871642, 'min_samples_leaf': 0.018103712750563244, 'min_weight_fraction_leaf': 0.06059189178417496, 'max_features': 0.6495543691746618}. Best is trial 77 with value: 0.8822667399503734.[0m
/media/san2_ssd/data/Workdir/survival/utils.py:305: RuntimeWarning: invalid value encountered in true_divide
  pdfs = np.gradient(1-survs,axis=1)/norms
[32m[I 2022-04-13 11:43:18,274][0m Trial 81 finished with value: 0.8813081327543237 and parameters: {'splitter': 'best', 'min_samples_split': 0.018025094546726482, 'min_samples_leaf': 0.018736823905049646, 'min_weight_fraction_leaf': 0.0660822024594966, 'max_features': 0.6577428346854871}. Best is trial 77 with value: 0.8822667399503734.[0m
/media/san2_ssd/data/Workdir/survival/utils.py:305: RuntimeWarning: invalid value encountered in true_divide
  pdfs = np.gradient(1-survs,axis=1)/norms
[32m[I 2022-04-13 11:43:19,223][0m Trial 82 finished with value: 0.8779847725624098 and parameters: {'splitter': 'best', 'min_samples_split': 0.012907566572631111, 'min_samples_leaf': 0.02206590262036356, 'min_weight_fraction_leaf': 0.07434586619174703, 'max_features': 0.6469836231876273}. Best is trial 77 with value: 0.8822667399503734.[0m
/media/san2_ssd/data/Workdir/survival/utils.py:305: RuntimeWarning: invalid value encountered in true_divide
  pdfs = np.gradient(1-survs,axis=1)/norms
[32m[I 2022-04-13 11:43:20,109][0m Trial 83 finished with value: 0.8799281257325748 and parameters: {'splitter': 'best', 'min_samples_split': 0.019878751078154733, 'min_samples_leaf': 0.020764220462360542, 'min_weight_fraction_leaf': 0.06877672364945263, 'max_features': 0.6561791169952791}. Best is trial 77 with value: 0.8822667399503734.[0m
/media/san2_ssd/data/Workdir/survival/utils.py:305: RuntimeWarning: invalid value encountered in true_divide
  pdfs = np.gradient(1-survs,axis=1)/norms
[32m[I 2022-04-13 11:43:21,010][0m Trial 84 finished with value: 0.8778310294514892 and parameters: {'splitter': 'best', 'min_samples_split': 0.016146922510136698, 'min_samples_leaf': 0.024001955880809358, 'min_weight_fraction_leaf': 0.07550285403731159, 'max_features': 0.6466767206793748}. Best is trial 77 with value: 0.8822667399503734.[0m
/media/san2_ssd/data/Workdir/survival/utils.py:305: RuntimeWarning: invalid value encountered in true_divide
  pdfs = np.gradient(1-survs,axis=1)/norms
[32m[I 2022-04-13 11:43:21,868][0m Trial 85 finished with value: 0.8791627440311995 and parameters: {'splitter': 'best', 'min_samples_split': 0.01725994065651247, 'min_samples_leaf': 0.023274803267066997, 'min_weight_fraction_leaf': 0.07659827910436567, 'max_features': 0.6515711091101198}. Best is trial 77 with value: 0.8822667399503734.[0m
/media/san2_ssd/data/Workdir/survival/utils.py:305: RuntimeWarning: invalid value encountered in true_divide
  pdfs = np.gradient(1-survs,axis=1)/norms
[32m[I 2022-04-13 11:43:22,733][0m Trial 86 finished with value: 0.8807486554274757 and parameters: {'splitter': 'best', 'min_samples_split': 0.011524408571437493, 'min_samples_leaf': 0.019801873144855164, 'min_weight_fraction_leaf': 0.07361577281051401, 'max_features': 0.6538560668931094}. Best is trial 77 with value: 0.8822667399503734.[0m
[32m[I 2022-04-13 11:43:23,459][0m Trial 87 finished with value: 0.8587553873522509 and parameters: {'splitter': 'best', 'min_samples_split': 0.017233927874112154, 'min_samples_leaf': 0.023977677104270737, 'min_weight_fraction_leaf': 0.07686747438994165, 'max_features': 0.698761007595437}. Best is trial 77 with value: 0.8822667399503734.[0m
[32m[I 2022-04-13 11:43:24,415][0m Trial 88 finished with value: 0.7768501021694739 and parameters: {'splitter': 'best', 'min_samples_split': 0.01252228143207801, 'min_samples_leaf': 0.032780908741071695, 'min_weight_fraction_leaf': 0.08802456456115143, 'max_features': 0.6555293458773512}. Best is trial 77 with value: 0.8822667399503734.[0m
[32m[I 2022-04-13 11:43:26,136][0m Trial 89 finished with value: 0.7810571127924814 and parameters: {'splitter': 'best', 'min_samples_split': 0.0280061176314375, 'min_samples_leaf': 0.016330371455434065, 'min_weight_fraction_leaf': 0.0667482572223691, 'max_features': 0.7794875783568205}. Best is trial 77 with value: 0.8822667399503734.[0m
[32m[I 2022-04-13 11:43:27,319][0m Trial 90 finished with value: 0.8592963565948081 and parameters: {'splitter': 'best', 'min_samples_split': 0.008914988719149499, 'min_samples_leaf': 0.04024011357117234, 'min_weight_fraction_leaf': 0.07998861897831133, 'max_features': 0.7051093269017029}. Best is trial 77 with value: 0.8822667399503734.[0m
/media/san2_ssd/data/Workdir/survival/utils.py:305: RuntimeWarning: invalid value encountered in true_divide
  pdfs = np.gradient(1-survs,axis=1)/norms
[32m[I 2022-04-13 11:43:28,377][0m Trial 91 finished with value: 0.8799281257325748 and parameters: {'splitter': 'best', 'min_samples_split': 0.001194026721904825, 'min_samples_leaf': 0.05173129516793175, 'min_weight_fraction_leaf': 0.06888080904129751, 'max_features': 0.635971697750502}. Best is trial 77 with value: 0.8822667399503734.[0m
[32m[I 2022-04-13 11:43:29,472][0m Trial 92 finished with value: 0.7770459108544472 and parameters: {'splitter': 'best', 'min_samples_split': 0.0013549523808110645, 'min_samples_leaf': 0.05428365932194304, 'min_weight_fraction_leaf': 0.09044145820872876, 'max_features': 0.6373720548514686}. Best is trial 77 with value: 0.8822667399503734.[0m
[32m[I 2022-04-13 11:43:30,400][0m Trial 93 finished with value: 0.8817554412447699 and parameters: {'splitter': 'best', 'min_samples_split': 0.03452518827494322, 'min_samples_leaf': 0.024187832502982173, 'min_weight_fraction_leaf': 0.07247334228302246, 'max_features': 0.7220659697154178}. Best is trial 77 with value: 0.8822667399503734.[0m
/media/san2_ssd/data/Workdir/survival/utils.py:305: RuntimeWarning: invalid value encountered in true_divide
  pdfs = np.gradient(1-survs,axis=1)/norms
/media/san2_ssd/data/Workdir/survival/utils.py:305: RuntimeWarning: invalid value encountered in true_divide
  pdfs = np.gradient(1-survs,axis=1)/norms
/media/san2_ssd/data/Workdir/survival/utils.py:305: RuntimeWarning: invalid value encountered in true_divide
  pdfs = np.gradient(1-survs,axis=1)/norms
[32m[I 2022-04-13 11:43:31,420][0m Trial 94 finished with value: 0.8798320447716501 and parameters: {'splitter': 'best', 'min_samples_split': 0.032216997636078874, 'min_samples_leaf': 0.01601736094422504, 'min_weight_fraction_leaf': 0.045381490037335756, 'max_features': 0.718739727245199}. Best is trial 77 with value: 0.8822667399503734.[0m
/media/san2_ssd/data/Workdir/survival/utils.py:305: RuntimeWarning: invalid value encountered in true_divide
  pdfs = np.gradient(1-survs,axis=1)/norms
/media/san2_ssd/data/Workdir/survival/utils.py:305: RuntimeWarning: invalid value encountered in true_divide
  pdfs = np.gradient(1-survs,axis=1)/norms
/media/san2_ssd/data/Workdir/survival/utils.py:305: RuntimeWarning: invalid value encountered in true_divide
  pdfs = np.gradient(1-survs,axis=1)/norms
[32m[I 2022-04-13 11:43:32,400][0m Trial 95 finished with value: 0.8768030080486755 and parameters: {'splitter': 'best', 'min_samples_split': 0.035383297189364685, 'min_samples_leaf': 0.0017709380201186842, 'min_weight_fraction_leaf': 0.04440794620420438, 'max_features': 0.7328187758251044}. Best is trial 77 with value: 0.8822667399503734.[0m
[32m[I 2022-04-13 11:43:33,039][0m Trial 96 finished with value: 0.8451696663632411 and parameters: {'splitter': 'best', 'min_samples_split': 0.04846752803872239, 'min_samples_leaf': 0.03669264983558019, 'min_weight_fraction_leaf': 0.10795168375385308, 'max_features': 0.6851650283485403}. Best is trial 77 with value: 0.8822667399503734.[0m
/media/san2_ssd/data/Workdir/survival/utils.py:305: RuntimeWarning: invalid value encountered in true_divide
  pdfs = np.gradient(1-survs,axis=1)/norms
/media/san2_ssd/data/Workdir/survival/utils.py:305: RuntimeWarning: invalid value encountered in true_divide
  pdfs = np.gradient(1-survs,axis=1)/norms
/media/san2_ssd/data/Workdir/survival/utils.py:305: RuntimeWarning: invalid value encountered in true_divide
  pdfs = np.gradient(1-survs,axis=1)/norms
/media/san2_ssd/data/Workdir/survival/utils.py:305: RuntimeWarning: invalid value encountered in true_divide
  pdfs = np.gradient(1-survs,axis=1)/norms
/media/san2_ssd/data/Workdir/survival/utils.py:305: RuntimeWarning: invalid value encountered in true_divide
  pdfs = np.gradient(1-survs,axis=1)/norms
[32m[I 2022-04-13 11:43:34,896][0m Trial 97 finished with value: 0.8763252454180428 and parameters: {'splitter': 'best', 'min_samples_split': 0.02706046131778087, 'min_samples_leaf': 0.011279254147019243, 'min_weight_fraction_leaf': 0.029910077160271935, 'max_features': 0.7944074766153757}. Best is trial 77 with value: 0.8822667399503734.[0m
[32m[I 2022-04-13 11:43:35,477][0m Trial 98 finished with value: 0.6973123945546231 and parameters: {'splitter': 'best', 'min_samples_split': 0.036295477236966536, 'min_samples_leaf': 0.06049899020800413, 'min_weight_fraction_leaf': 0.4496343747875, 'max_features': 0.7236825090074501}. Best is trial 77 with value: 0.8822667399503734.[0m
/media/san2_ssd/data/Workdir/survival/utils.py:305: RuntimeWarning: invalid value encountered in true_divide
  pdfs = np.gradient(1-survs,axis=1)/norms
/media/san2_ssd/data/Workdir/survival/utils.py:305: RuntimeWarning: invalid value encountered in true_divide
  pdfs = np.gradient(1-survs,axis=1)/norms
[32m[I 2022-04-13 11:43:36,215][0m Trial 99 finished with value: 0.8757197035346319 and parameters: {'splitter': 'best', 'min_samples_split': 0.002873294622099761, 'min_samples_leaf': 0.04892098025961188, 'min_weight_fraction_leaf': 0.04392429674711383, 'max_features': 0.6643756286546582}. Best is trial 77 with value: 0.8822667399503734.[0m
/media/san2_ssd/data/Workdir/survival/utils.py:305: RuntimeWarning: invalid value encountered in true_divide
  pdfs = np.gradient(1-survs,axis=1)/norms
/media/san2_ssd/data/Workdir/survival/utils.py:305: RuntimeWarning: invalid value encountered in true_divide
  pdfs = np.gradient(1-survs,axis=1)/norms
/media/san2_ssd/data/Workdir/survival/utils.py:305: RuntimeWarning: invalid value encountered in true_divide
  pdfs = np.gradient(1-survs,axis=1)/norms
/media/san2_ssd/data/Workdir/survival/utils.py:305: RuntimeWarning: invalid value encountered in true_divide
  pdfs = np.gradient(1-survs,axis=1)/norms
/media/san2_ssd/data/Workdir/survival/utils.py:305: RuntimeWarning: invalid value encountered in true_divide
  pdfs = np.gradient(1-survs,axis=1)/norms
[32m[I 2022-04-13 11:43:36,998][0m Trial 100 finished with value: 0.8808525951395921 and parameters: {'splitter': 'best', 'min_samples_split': 0.024012056344472243, 'min_samples_leaf': 0.031666911268375744, 'min_weight_fraction_leaf': 0.025040602842689323, 'max_features': 0.7538195071185083}. Best is trial 77 with value: 0.8822667399503734.[0m
[32m[I 2022-04-13 11:43:37,812][0m Trial 101 finished with value: 0.7810029542146371 and parameters: {'splitter': 'best', 'min_samples_split': 0.02670444004491767, 'min_samples_leaf': 0.02913848673439983, 'min_weight_fraction_leaf': 0.0693462437345479, 'max_features': 0.7605962186384085}. Best is trial 77 with value: 0.8822667399503734.[0m
/media/san2_ssd/data/Workdir/survival/utils.py:305: RuntimeWarning: invalid value encountered in true_divide
  pdfs = np.gradient(1-survs,axis=1)/norms
/media/san2_ssd/data/Workdir/survival/utils.py:305: RuntimeWarning: invalid value encountered in true_divide
  pdfs = np.gradient(1-survs,axis=1)/norms
/media/san2_ssd/data/Workdir/survival/utils.py:305: RuntimeWarning: invalid value encountered in true_divide
  pdfs = np.gradient(1-survs,axis=1)/norms
/media/san2_ssd/data/Workdir/survival/utils.py:305: RuntimeWarning: invalid value encountered in true_divide
  pdfs = np.gradient(1-survs,axis=1)/norms
/media/san2_ssd/data/Workdir/survival/utils.py:305: RuntimeWarning: invalid value encountered in true_divide
  pdfs = np.gradient(1-survs,axis=1)/norms
[32m[I 2022-04-13 11:43:38,985][0m Trial 102 finished with value: 0.884576309806181 and parameters: {'splitter': 'best', 'min_samples_split': 0.04006106085176632, 'min_samples_leaf': 0.014048266115714603, 'min_weight_fraction_leaf': 0.020995695776851238, 'max_features': 0.8103104170775295}. Best is trial 102 with value: 0.884576309806181.[0m
/media/san2_ssd/data/Workdir/survival/utils.py:305: RuntimeWarning: invalid value encountered in true_divide
  pdfs = np.gradient(1-survs,axis=1)/norms
/media/san2_ssd/data/Workdir/survival/utils.py:305: RuntimeWarning: invalid value encountered in true_divide
  pdfs = np.gradient(1-survs,axis=1)/norms
/media/san2_ssd/data/Workdir/survival/utils.py:305: RuntimeWarning: invalid value encountered in true_divide
  pdfs = np.gradient(1-survs,axis=1)/norms
/media/san2_ssd/data/Workdir/survival/utils.py:305: RuntimeWarning: invalid value encountered in true_divide
  pdfs = np.gradient(1-survs,axis=1)/norms
/media/san2_ssd/data/Workdir/survival/utils.py:305: RuntimeWarning: invalid value encountered in true_divide
  pdfs = np.gradient(1-survs,axis=1)/norms
[32m[I 2022-04-13 11:43:40,655][0m Trial 103 finished with value: 0.8828607410163067 and parameters: {'splitter': 'best', 'min_samples_split': 0.04338496206938841, 'min_samples_leaf': 0.01330552467107067, 'min_weight_fraction_leaf': 0.0238725811734459, 'max_features': 0.8093839088148883}. Best is trial 102 with value: 0.884576309806181.[0m
/media/san2_ssd/data/Workdir/survival/utils.py:305: RuntimeWarning: invalid value encountered in true_divide
  pdfs = np.gradient(1-survs,axis=1)/norms
/media/san2_ssd/data/Workdir/survival/utils.py:305: RuntimeWarning: invalid value encountered in true_divide
  pdfs = np.gradient(1-survs,axis=1)/norms
/media/san2_ssd/data/Workdir/survival/utils.py:305: RuntimeWarning: invalid value encountered in true_divide
  pdfs = np.gradient(1-survs,axis=1)/norms
/media/san2_ssd/data/Workdir/survival/utils.py:305: RuntimeWarning: invalid value encountered in true_divide
  pdfs = np.gradient(1-survs,axis=1)/norms
[32m[I 2022-04-13 11:43:41,958][0m Trial 104 finished with value: 0.8833805330820361 and parameters: {'splitter': 'best', 'min_samples_split': 0.044867247929893675, 'min_samples_leaf': 0.04032910813687323, 'min_weight_fraction_leaf': 0.021457637707096577, 'max_features': 0.8218423139716734}. Best is trial 102 with value: 0.884576309806181.[0m
/media/san2_ssd/data/Workdir/survival/utils.py:305: RuntimeWarning: invalid value encountered in true_divide
  pdfs = np.gradient(1-survs,axis=1)/norms
/media/san2_ssd/data/Workdir/survival/utils.py:305: RuntimeWarning: invalid value encountered in true_divide
  pdfs = np.gradient(1-survs,axis=1)/norms
/media/san2_ssd/data/Workdir/survival/utils.py:305: RuntimeWarning: invalid value encountered in true_divide
  pdfs = np.gradient(1-survs,axis=1)/norms
/media/san2_ssd/data/Workdir/survival/utils.py:305: RuntimeWarning: invalid value encountered in true_divide
  pdfs = np.gradient(1-survs,axis=1)/norms
