[32m[I 2022-04-13 12:22:31,801][0m Trial 386 finished with value: 0.7655108115949132 and parameters: {'splitter': 'best', 'min_samples_split': 0.0890463281799582, 'min_samples_leaf': 0.024793036472228233, 'min_weight_fraction_leaf': 0.09622263242348467, 'max_features': 0.9997029587265079}. Best is trial 241 with value: 0.7773840258827056.[0m
[32m[I 2022-04-13 12:22:34,340][0m Trial 387 finished with value: 0.767038546563025 and parameters: {'splitter': 'best', 'min_samples_split': 0.09958452064150804, 'min_samples_leaf': 0.030800865184683134, 'min_weight_fraction_leaf': 0.04874957179075359, 'max_features': 0.9650795421070683}. Best is trial 241 with value: 0.7773840258827056.[0m
[32m[I 2022-04-13 12:22:36,918][0m Trial 388 finished with value: 0.7667797411900819 and parameters: {'splitter': 'best', 'min_samples_split': 0.1093311174530901, 'min_samples_leaf': 0.015842539106363424, 'min_weight_fraction_leaf': 0.0494233198170729, 'max_features': 0.9508942378866855}. Best is trial 241 with value: 0.7773840258827056.[0m
[32m[I 2022-04-13 12:22:38,460][0m Trial 389 finished with value: 0.7729959376143583 and parameters: {'splitter': 'best', 'min_samples_split': 0.1160550373601025, 'min_samples_leaf': 0.022233371073627564, 'min_weight_fraction_leaf': 0.08181018630036535, 'max_features': 0.9990488107145559}. Best is trial 241 with value: 0.7773840258827056.[0m
[32m[I 2022-04-13 12:22:38,610][0m Trial 390 finished with value: 0.5907397595957419 and parameters: {'splitter': 'best', 'min_samples_split': 0.08227103391265483, 'min_samples_leaf': 0.3646796550126884, 'min_weight_fraction_leaf': 0.07039591857826155, 'max_features': 0.9283227830010595}. Best is trial 241 with value: 0.7773840258827056.[0m
[32m[I 2022-04-13 12:22:40,502][0m Trial 391 finished with value: 0.7674210038360685 and parameters: {'splitter': 'best', 'min_samples_split': 0.09762386386118099, 'min_samples_leaf': 0.05066827461749298, 'min_weight_fraction_leaf': 0.021382793212190655, 'max_features': 0.9719212914791069}. Best is trial 241 with value: 0.7773840258827056.[0m
[32m[I 2022-04-13 12:22:41,679][0m Trial 392 finished with value: 0.7734527015422169 and parameters: {'splitter': 'best', 'min_samples_split': 0.10216668949398394, 'min_samples_leaf': 0.03569197670020041, 'min_weight_fraction_leaf': 0.04096370477332487, 'max_features': 0.9792670028813714}. Best is trial 241 with value: 0.7773840258827056.[0m
[32m[I 2022-04-13 12:22:43,671][0m Trial 393 finished with value: 0.7612132037659963 and parameters: {'splitter': 'best', 'min_samples_split': 0.1297410111841357, 'min_samples_leaf': 0.011723232558632522, 'min_weight_fraction_leaf': 0.06129237602770529, 'max_features': 0.9541605780858513}. Best is trial 241 with value: 0.7773840258827056.[0m
[32m[I 2022-04-13 12:22:44,603][0m Trial 394 finished with value: 0.7179415932980041 and parameters: {'splitter': 'best', 'min_samples_split': 0.11753066333949438, 'min_samples_leaf': 0.042457809835527785, 'min_weight_fraction_leaf': 0.030901681942448037, 'max_features': 0.2554354603745672}. Best is trial 241 with value: 0.7773840258827056.[0m
[32m[I 2022-04-13 12:22:47,674][0m Trial 395 finished with value: 0.7709381210267165 and parameters: {'splitter': 'best', 'min_samples_split': 0.0939789285918841, 'min_samples_leaf': 0.027051192048155284, 'min_weight_fraction_leaf': 0.05109444150507377, 'max_features': 0.9831295327207381}. Best is trial 241 with value: 0.7773840258827056.[0m
[32m[I 2022-04-13 12:22:50,436][0m Trial 396 finished with value: 0.7010673274220223 and parameters: {'splitter': 'best', 'min_samples_split': 0.48756413919125186, 'min_samples_leaf': 0.0357842752205926, 'min_weight_fraction_leaf': 0.018467472376987943, 'max_features': 0.9385964738796658}. Best is trial 241 with value: 0.7773840258827056.[0m
[32m[I 2022-04-13 12:22:54,057][0m Trial 397 finished with value: 0.7682377821754662 and parameters: {'splitter': 'best', 'min_samples_split': 0.10626948424524262, 'min_samples_leaf': 0.016911332832622222, 'min_weight_fraction_leaf': 0.04191356596003316, 'max_features': 0.9651368577212488}. Best is trial 241 with value: 0.7773840258827056.[0m
[32m[I 2022-04-13 12:22:55,274][0m Trial 398 finished with value: 0.7251010649499023 and parameters: {'splitter': 'best', 'min_samples_split': 0.13666350150557519, 'min_samples_leaf': 0.05370571254671626, 'min_weight_fraction_leaf': 0.2536681506983178, 'max_features': 0.9984872477745852}. Best is trial 241 with value: 0.7773840258827056.[0m
[32m[I 2022-04-13 12:22:57,180][0m Trial 399 finished with value: 0.769362780814669 and parameters: {'splitter': 'best', 'min_samples_split': 0.12127224052785393, 'min_samples_leaf': 0.0273030645163065, 'min_weight_fraction_leaf': 0.04117583777967397, 'max_features': 0.8866320018733267}. Best is trial 241 with value: 0.7773840258827056.[0m
[32m[I 2022-04-13 12:22:57,402][0m Trial 400 finished with value: 0.6833902267520489 and parameters: {'splitter': 'random', 'min_samples_split': 0.2334215623618619, 'min_samples_leaf': 0.2365481448202961, 'min_weight_fraction_leaf': 0.1445504818782824, 'max_features': 0.9814898658030314}. Best is trial 241 with value: 0.7773840258827056.[0m
[32m[I 2022-04-13 12:23:00,460][0m Trial 401 finished with value: 0.7627850284076624 and parameters: {'splitter': 'best', 'min_samples_split': 0.149174503271927, 'min_samples_leaf': 0.033347078193693425, 'min_weight_fraction_leaf': 0.0586777176163987, 'max_features': 0.9154246124141406}. Best is trial 241 with value: 0.7773840258827056.[0m
[32m[I 2022-04-13 12:23:03,465][0m Trial 402 finished with value: 0.7650892483794202 and parameters: {'splitter': 'best', 'min_samples_split': 0.08594805070111419, 'min_samples_leaf': 0.0452742898255188, 'min_weight_fraction_leaf': 0.029516507254768464, 'max_features': 0.9626309707796821}. Best is trial 241 with value: 0.7773840258827056.[0m
[32m[I 2022-04-13 12:23:03,934][0m Trial 403 finished with value: 0.6371751523559601 and parameters: {'splitter': 'best', 'min_samples_split': 0.11158966878671533, 'min_samples_leaf': 0.06371401570986437, 'min_weight_fraction_leaf': 0.011098616112850977, 'max_features': 0.11991797501009643}. Best is trial 241 with value: 0.7773840258827056.[0m
[32m[I 2022-04-13 12:23:04,694][0m Trial 404 finished with value: 0.6743624146605087 and parameters: {'splitter': 'best', 'min_samples_split': 0.16708325871561733, 'min_samples_leaf': 0.19135124116980104, 'min_weight_fraction_leaf': 0.35564039284233184, 'max_features': 0.9814178365949183}. Best is trial 241 with value: 0.7773840258827056.[0m
[32m[I 2022-04-13 12:23:07,911][0m Trial 405 finished with value: 0.7673507499977444 and parameters: {'splitter': 'best', 'min_samples_split': 0.12531197392182072, 'min_samples_leaf': 0.009246308410461233, 'min_weight_fraction_leaf': 0.025367371776694007, 'max_features': 0.9447557992199643}. Best is trial 241 with value: 0.7773840258827056.[0m
[32m[I 2022-04-13 12:23:08,742][0m Trial 406 finished with value: 0.770042804592184 and parameters: {'splitter': 'best', 'min_samples_split': 0.10504175102011275, 'min_samples_leaf': 0.054468646642495205, 'min_weight_fraction_leaf': 0.03535444111431965, 'max_features': 0.999524287209562}. Best is trial 241 with value: 0.7773840258827056.[0m
[32m[I 2022-04-13 12:23:08,944][0m Trial 407 finished with value: 0.6055732239298597 and parameters: {'splitter': 'best', 'min_samples_split': 0.1335524653962396, 'min_samples_leaf': 0.3288608870911787, 'min_weight_fraction_leaf': 0.21423355293447366, 'max_features': 0.9677517860086717}. Best is trial 241 with value: 0.7773840258827056.[0m
[32m[I 2022-04-13 12:23:10,172][0m Trial 408 finished with value: 0.7667797411900819 and parameters: {'splitter': 'best', 'min_samples_split': 0.07907965281525514, 'min_samples_leaf': 0.02280722532231897, 'min_weight_fraction_leaf': 0.04956575654425102, 'max_features': 0.9364847793198158}. Best is trial 241 with value: 0.7773840258827056.[0m
[32m[I 2022-04-13 12:23:12,035][0m Trial 409 finished with value: 0.7749271275412639 and parameters: {'splitter': 'best', 'min_samples_split': 0.11499448564601811, 'min_samples_leaf': 0.03871671431059159, 'min_weight_fraction_leaf': 0.01684470390676407, 'max_features': 0.9819724445154411}. Best is trial 241 with value: 0.7773840258827056.[0m
[32m[I 2022-04-13 12:23:12,320][0m Trial 410 finished with value: 0.6989914463531874 and parameters: {'splitter': 'best', 'min_samples_split': 0.11776929337590059, 'min_samples_leaf': 0.17954123954809573, 'min_weight_fraction_leaf': 0.009594896284580602, 'max_features': 0.5087717714652651}. Best is trial 241 with value: 0.7773840258827056.[0m
[32m[I 2022-04-13 12:23:14,168][0m Trial 411 finished with value: 0.7634181633422197 and parameters: {'splitter': 'best', 'min_samples_split': 0.14231207845976462, 'min_samples_leaf': 0.0010136160728028039, 'min_weight_fraction_leaf': 0.0329820008636858, 'max_features': 0.9535811436670653}. Best is trial 241 with value: 0.7773840258827056.[0m
[32m[I 2022-04-13 12:23:16,658][0m Trial 412 finished with value: 0.7676881131359845 and parameters: {'splitter': 'best', 'min_samples_split': 0.12577217897467854, 'min_samples_leaf': 0.018448719953046363, 'min_weight_fraction_leaf': 0.06463074306846345, 'max_features': 0.9795450196072382}. Best is trial 241 with value: 0.7773840258827056.[0m
[32m[I 2022-04-13 12:23:18,904][0m Trial 413 finished with value: 0.7635341160772752 and parameters: {'splitter': 'best', 'min_samples_split': 0.09260022626459749, 'min_samples_leaf': 0.04007146934602142, 'min_weight_fraction_leaf': 0.00019003284494134576, 'max_features': 0.9627225107239428}. Best is trial 241 with value: 0.7773840258827056.[0m
[32m[I 2022-04-13 12:23:19,017][0m Trial 414 finished with value: 0.5962864358175997 and parameters: {'splitter': 'best', 'min_samples_split': 0.11494228414426966, 'min_samples_leaf': 0.47909616289455126, 'min_weight_fraction_leaf': 0.04539744381271681, 'max_features': 0.6798659890604573}. Best is trial 241 with value: 0.7773840258827056.[0m
[32m[I 2022-04-13 12:23:21,023][0m Trial 415 finished with value: 0.7668816587884899 and parameters: {'splitter': 'best', 'min_samples_split': 0.1270417514926533, 'min_samples_leaf': 0.03211491527092966, 'min_weight_fraction_leaf': 0.022572689494497887, 'max_features': 0.9271298902216861}. Best is trial 241 with value: 0.7773840258827056.[0m
[32m[I 2022-04-13 12:23:22,728][0m Trial 416 finished with value: 0.759156163083129 and parameters: {'splitter': 'best', 'min_samples_split': 0.10117053626488431, 'min_samples_leaf': 0.04703356917999815, 'min_weight_fraction_leaf': 0.12052590717982975, 'max_features': 0.9812725925214745}. Best is trial 241 with value: 0.7773840258827056.[0m
[32m[I 2022-04-13 12:23:24,557][0m Trial 417 finished with value: 0.7725737926738789 and parameters: {'splitter': 'best', 'min_samples_split': 0.13934075096459425, 'min_samples_leaf': 0.026273559080528194, 'min_weight_fraction_leaf': 0.03662487365798741, 'max_features': 0.99927965652334}. Best is trial 241 with value: 0.7773840258827056.[0m
[32m[I 2022-04-13 12:23:26,862][0m Trial 418 finished with value: 0.7591159773290113 and parameters: {'splitter': 'best', 'min_samples_split': 0.18023794663294984, 'min_samples_leaf': 0.05589676012312806, 'min_weight_fraction_leaf': 0.052105269301452525, 'max_features': 0.9517567728328638}. Best is trial 241 with value: 0.7773840258827056.[0m
[32m[I 2022-04-13 12:23:29,666][0m Trial 419 finished with value: 0.7693958852384256 and parameters: {'splitter': 'best', 'min_samples_split': 0.11225339588372782, 'min_samples_leaf': 0.012237747636960276, 'min_weight_fraction_leaf': 0.028020837558213073, 'max_features': 0.970208401787039}. Best is trial 241 with value: 0.7773840258827056.[0m
[32m[I 2022-04-13 12:23:29,772][0m Trial 420 finished with value: 0.7387272354749699 and parameters: {'splitter': 'random', 'min_samples_split': 0.15310754564139528, 'min_samples_leaf': 0.037170645464350345, 'min_weight_fraction_leaf': 0.01580797143958493, 'max_features': 0.7668523880194219}. Best is trial 241 with value: 0.7773840258827056.[0m
[32m[I 2022-04-13 12:23:30,552][0m Trial 421 finished with value: 0.7669208247374579 and parameters: {'splitter': 'best', 'min_samples_split': 0.09386380458952218, 'min_samples_leaf': 0.06958468897480916, 'min_weight_fraction_leaf': 0.04375129227422069, 'max_features': 0.9809091432226933}. Best is trial 241 with value: 0.7773840258827056.[0m
[32m[I 2022-04-13 12:23:32,347][0m Trial 422 finished with value: 0.7677126767304253 and parameters: {'splitter': 'best', 'min_samples_split': 0.11815161299810845, 'min_samples_leaf': 0.020439225932795485, 'min_weight_fraction_leaf': 0.05781539423847767, 'max_features': 0.9470197908454877}. Best is trial 241 with value: 0.7773840258827056.[0m
[32m[I 2022-04-13 12:23:34,006][0m Trial 423 finished with value: 0.7758910681193609 and parameters: {'splitter': 'best', 'min_samples_split': 0.1311045642287502, 'min_samples_leaf': 0.04560045821909835, 'min_weight_fraction_leaf': 0.03417073840685631, 'max_features': 0.9999106134447053}. Best is trial 241 with value: 0.7773840258827056.[0m
[32m[I 2022-04-13 12:23:35,373][0m Trial 424 finished with value: 0.7733635517642241 and parameters: {'splitter': 'best', 'min_samples_split': 0.1341296126117694, 'min_samples_leaf': 0.029165635486864055, 'min_weight_fraction_leaf': 0.02385246241057635, 'max_features': 0.9995141199313082}. Best is trial 241 with value: 0.7773840258827056.[0m
[32m[I 2022-04-13 12:23:36,254][0m Trial 425 finished with value: 0.7591414532704464 and parameters: {'splitter': 'best', 'min_samples_split': 0.14173539482312264, 'min_samples_leaf': 0.12187735856620714, 'min_weight_fraction_leaf': 0.034467815182599025, 'max_features': 0.9815708910818058}. Best is trial 241 with value: 0.7773840258827056.[0m
[32m[I 2022-04-13 12:23:38,174][0m Trial 426 finished with value: 0.7561985199445933 and parameters: {'splitter': 'best', 'min_samples_split': 0.2005824346848567, 'min_samples_leaf': 0.0389294975708389, 'min_weight_fraction_leaf': 0.0156106598101197, 'max_features': 0.9638318470254114}. Best is trial 241 with value: 0.7773840258827056.[0m
[32m[I 2022-04-13 12:23:40,586][0m Trial 427 finished with value: 0.7693428726255892 and parameters: {'splitter': 'best', 'min_samples_split': 0.10646052885528319, 'min_samples_leaf': 0.04855311748020017, 'min_weight_fraction_leaf': 0.007539584811274348, 'max_features': 0.9678446343136682}. Best is trial 241 with value: 0.7773840258827056.[0m
[32m[I 2022-04-13 12:23:42,771][0m Trial 428 finished with value: 0.772071381853563 and parameters: {'splitter': 'best', 'min_samples_split': 0.12921247486190304, 'min_samples_leaf': 0.022072671929259505, 'min_weight_fraction_leaf': 0.028565156053321144, 'max_features': 0.9831039707977934}. Best is trial 241 with value: 0.7773840258827056.[0m
[32m[I 2022-04-13 12:23:44,003][0m Trial 429 finished with value: 0.5907975833158018 and parameters: {'splitter': 'best', 'min_samples_split': 0.1595437767118284, 'min_samples_leaf': 0.05963796661288438, 'min_weight_fraction_leaf': 0.422075254347436, 'max_features': 0.9486662434570688}. Best is trial 241 with value: 0.7773840258827056.[0m
[32m[I 2022-04-13 12:23:45,931][0m Trial 430 finished with value: 0.7718124659782518 and parameters: {'splitter': 'best', 'min_samples_split': 0.08000320936179685, 'min_samples_leaf': 0.009887787896814222, 'min_weight_fraction_leaf': 0.04751971842947167, 'max_features': 0.9996457468919091}. Best is trial 241 with value: 0.7773840258827056.[0m
[32m[I 2022-04-13 12:23:46,809][0m Trial 431 finished with value: 0.7454319241245271 and parameters: {'splitter': 'best', 'min_samples_split': 0.2520852973528113, 'min_samples_leaf': 0.04755900453753835, 'min_weight_fraction_leaf': 0.03654670728241685, 'max_features': 0.9066905808193886}. Best is trial 241 with value: 0.7773840258827056.[0m
[32m[I 2022-04-13 12:23:48,147][0m Trial 432 finished with value: 0.7693289852733967 and parameters: {'splitter': 'best', 'min_samples_split': 0.09983782524249922, 'min_samples_leaf': 0.06282222165689924, 'min_weight_fraction_leaf': 0.02091509338170765, 'max_features': 0.9296494461170302}. Best is trial 241 with value: 0.7773840258827056.[0m
[32m[I 2022-04-13 12:23:49,267][0m Trial 433 finished with value: 0.7707334498141335 and parameters: {'splitter': 'best', 'min_samples_split': 0.12193613793558986, 'min_samples_leaf': 0.035707202248285934, 'min_weight_fraction_leaf': 0.05543613384869137, 'max_features': 0.9793110773690883}. Best is trial 241 with value: 0.7773840258827056.[0m
[32m[I 2022-04-13 12:23:50,371][0m Trial 434 finished with value: 0.7606020037705408 and parameters: {'splitter': 'best', 'min_samples_split': 0.10902335028177207, 'min_samples_leaf': 0.029847502393885318, 'min_weight_fraction_leaf': 0.07429134538309941, 'max_features': 0.9618731644522017}. Best is trial 241 with value: 0.7773840258827056.[0m
[32m[I 2022-04-13 12:23:51,416][0m Trial 435 finished with value: 0.7739912499435498 and parameters: {'splitter': 'best', 'min_samples_split': 0.13063729089046788, 'min_samples_leaf': 0.01671383938173943, 'min_weight_fraction_leaf': 0.03287692912519373, 'max_features': 0.9809937837984175}. Best is trial 241 with value: 0.7773840258827056.[0m
[32m[I 2022-04-13 12:23:52,650][0m Trial 436 finished with value: 0.7735651556703456 and parameters: {'splitter': 'best', 'min_samples_split': 0.1407766545994526, 'min_samples_leaf': 0.013602105757849148, 'min_weight_fraction_leaf': 0.018188101668440537, 'max_features': 0.9994872164874815}. Best is trial 241 with value: 0.7773840258827056.[0m
[32m[I 2022-04-13 12:23:54,731][0m Trial 437 finished with value: 0.7617000125687523 and parameters: {'splitter': 'best', 'min_samples_split': 0.15447128916877895, 'min_samples_leaf': 0.011533999888358711, 'min_weight_fraction_leaf': 0.0297246704267355, 'max_features': 0.9604667813116798}. Best is trial 241 with value: 0.7773840258827056.[0m
[32m[I 2022-04-13 12:23:55,963][0m Trial 438 finished with value: 0.7283109747703488 and parameters: {'splitter': 'best', 'min_samples_split': 0.15001222363742273, 'min_samples_leaf': 0.0011910757726624633, 'min_weight_fraction_leaf': 0.27490116558472977, 'max_features': 0.9824536309498565}. Best is trial 241 with value: 0.7773840258827056.[0m
[32m[I 2022-04-13 12:23:56,195][0m Trial 439 finished with value: 0.722777980231194 and parameters: {'splitter': 'random', 'min_samples_split': 0.1302593900457487, 'min_samples_leaf': 0.10470770378159379, 'min_weight_fraction_leaf': 0.006844277770606595, 'max_features': 0.9992608915198992}. Best is trial 241 with value: 0.7773840258827056.[0m
[32m[I 2022-04-13 12:23:59,191][0m Trial 440 finished with value: 0.7660413064167428 and parameters: {'splitter': 'best', 'min_samples_split': 0.09097233554810796, 'min_samples_leaf': 0.03814600475577942, 'min_weight_fraction_leaf': 0.03741174482973398, 'max_features': 0.9411717824172302}. Best is trial 241 with value: 0.7773840258827056.[0m
[32m[I 2022-04-13 12:24:01,872][0m Trial 441 finished with value: 0.7650752927594147 and parameters: {'splitter': 'best', 'min_samples_split': 0.13350641069942626, 'min_samples_leaf': 0.01871348984026987, 'min_weight_fraction_leaf': 0.023226379693240033, 'max_features': 0.9698962468149915}. Best is trial 241 with value: 0.7773840258827056.[0m
[32m[I 2022-04-13 12:24:04,131][0m Trial 442 finished with value: 0.7744274760951088 and parameters: {'splitter': 'best', 'min_samples_split': 0.11160093587163689, 'min_samples_leaf': 0.029917266264768864, 'min_weight_fraction_leaf': 0.030987606138995108, 'max_features': 0.9997553051352962}. Best is trial 241 with value: 0.7773840258827056.[0m
[32m[I 2022-04-13 12:24:06,303][0m Trial 443 finished with value: 0.7745294452175183 and parameters: {'splitter': 'best', 'min_samples_split': 0.14273012556300627, 'min_samples_leaf': 0.0447896042207392, 'min_weight_fraction_leaf': 0.01613958809483111, 'max_features': 0.9809846452625692}. Best is trial 241 with value: 0.7773840258827056.[0m
[32m[I 2022-04-13 12:24:07,287][0m Trial 444 finished with value: 0.7672445028709095 and parameters: {'splitter': 'best', 'min_samples_split': 0.14690320426295522, 'min_samples_leaf': 0.054019110347049495, 'min_weight_fraction_leaf': 0.014551723392313856, 'max_features': 0.957842313032424}. Best is trial 241 with value: 0.7773840258827056.[0m
[32m[I 2022-04-13 12:24:08,165][0m Trial 445 finished with value: 0.767037230309584 and parameters: {'splitter': 'best', 'min_samples_split': 0.17226160514614175, 'min_samples_leaf': 0.0270151863184992, 'min_weight_fraction_leaf': 0.008206927191512357, 'max_features': 0.9991842553700908}. Best is trial 241 with value: 0.7773840258827056.[0m
[32m[I 2022-04-13 12:24:09,758][0m Trial 446 finished with value: 0.7714406111168398 and parameters: {'splitter': 'best', 'min_samples_split': 0.15935264706045155, 'min_samples_leaf': 0.07349039342641091, 'min_weight_fraction_leaf': 0.0031597382234354165, 'max_features': 0.9989057456233505}. Best is trial 241 with value: 0.7773840258827056.[0m
[32m[I 2022-04-13 12:24:11,113][0m Trial 447 finished with value: 0.7638658233904253 and parameters: {'splitter': 'best', 'min_samples_split': 0.14228014112235376, 'min_samples_leaf': 0.04416201225066672, 'min_weight_fraction_leaf': 0.023274719807012338, 'max_features': 0.9693971850480184}. Best is trial 241 with value: 0.7773840258827056.[0m
[32m[I 2022-04-13 12:24:11,675][0m Trial 448 finished with value: 0.7310862625455703 and parameters: {'splitter': 'best', 'min_samples_split': 0.21468337188955933, 'min_samples_leaf': 0.01827510321905587, 'min_weight_fraction_leaf': 0.015982316845160494, 'max_features': 0.5995928873881798}. Best is trial 241 with value: 0.7773840258827056.[0m
