[32m[I 2022-04-17 18:25:25,055][0m Trial 376 finished with value: 0.7595801933612407 and parameters: {'n_hidden': 256, 'mixture_components': 10, 'use_sparse_layer': True, 'use_sparse_loss': False, 'use_batchnorm': False, 'use_dropout': True, 'dropout': 0.607838125595527, 'mlp_size_1': 1, 'mlp_size_2': 4, 'mlp_size_3': 0, 'kernel': 'LogLogistic', 'loss_name': 'AlternativeNLLLoss'}. Best is trial 245 with value: 0.7744390497152815.[0m
[32m[I 2022-04-17 18:28:06,530][0m Trial 377 finished with value: 0.7658711409201563 and parameters: {'n_hidden': 64, 'mixture_components': 7, 'use_sparse_layer': False, 'use_batchnorm': False, 'use_dropout': True, 'dropout': 0.7459205685326344, 'mlp_size_1': 1, 'mlp_size_2': 2, 'mlp_size_3': 0, 'kernel': 'Exponential', 'loss_name': 'CensoredNLLLoss'}. Best is trial 245 with value: 0.7744390497152815.[0m
[32m[I 2022-04-17 18:30:16,412][0m Trial 378 finished with value: 0.7718951692086158 and parameters: {'n_hidden': 256, 'mixture_components': 4, 'use_sparse_layer': True, 'use_sparse_loss': False, 'use_batchnorm': False, 'use_dropout': True, 'dropout': 0.7806531161632322, 'mlp_size_1': 1, 'mlp_size_2': 4, 'mlp_size_3': 0, 'kernel': 'Exponential', 'loss_name': 'CensoredNLLLoss'}. Best is trial 245 with value: 0.7744390497152815.[0m
[32m[I 2022-04-17 18:32:10,439][0m Trial 379 finished with value: 0.7682148038132636 and parameters: {'n_hidden': 256, 'mixture_components': 10, 'use_sparse_layer': True, 'use_sparse_loss': False, 'use_batchnorm': False, 'use_dropout': True, 'dropout': 0.7040460812378432, 'mlp_size_1': 1, 'mlp_size_2': 4, 'mlp_size_3': 0, 'kernel': 'Exponential', 'loss_name': 'AlternativeNLLLoss'}. Best is trial 245 with value: 0.7744390497152815.[0m
[32m[I 2022-04-17 18:33:56,985][0m Trial 380 finished with value: 0.7704292200371835 and parameters: {'n_hidden': 1024, 'mixture_components': 10, 'use_sparse_layer': True, 'use_sparse_loss': False, 'use_batchnorm': False, 'use_dropout': False, 'mlp_size_1': 0, 'mlp_size_2': 5, 'mlp_size_3': 2, 'kernel': 'Exponential', 'loss_name': 'CensoredNLLLoss'}. Best is trial 245 with value: 0.7744390497152815.[0m
[32m[I 2022-04-17 18:35:27,724][0m Trial 381 finished with value: 0.609514155926391 and parameters: {'n_hidden': 256, 'mixture_components': 9, 'use_sparse_layer': True, 'use_sparse_loss': True, 'lmbd': 0.054713090247871486, 'use_batchnorm': False, 'use_dropout': True, 'dropout': 0.6834478801997689, 'mlp_size_1': 1, 'mlp_size_2': 4, 'mlp_size_3': 0, 'kernel': 'Gumbel', 'loss_name': 'CensoredNLLLoss'}. Best is trial 245 with value: 0.7744390497152815.[0m
[32m[I 2022-04-17 18:38:26,378][0m Trial 382 finished with value: 0.7668873974434045 and parameters: {'n_hidden': 32, 'mixture_components': 5, 'use_sparse_layer': False, 'use_batchnorm': False, 'use_dropout': True, 'dropout': 0.6349477219842239, 'mlp_size_1': 1, 'mlp_size_2': 1, 'mlp_size_3': 0, 'kernel': 'Exponential', 'loss_name': 'CensoredNLLLoss'}. Best is trial 245 with value: 0.7744390497152815.[0m
[32m[I 2022-04-17 18:40:26,483][0m Trial 383 finished with value: 0.7722102874693745 and parameters: {'n_hidden': 256, 'mixture_components': 9, 'use_sparse_layer': True, 'use_sparse_loss': False, 'use_batchnorm': False, 'use_dropout': True, 'dropout': 0.717029670954526, 'mlp_size_1': 1, 'mlp_size_2': 4, 'mlp_size_3': 0, 'kernel': 'Exponential', 'loss_name': 'AlternativeNLLLoss'}. Best is trial 245 with value: 0.7744390497152815.[0m
[32m[I 2022-04-17 18:42:41,005][0m Trial 384 finished with value: 0.772292203778527 and parameters: {'n_hidden': 256, 'mixture_components': 10, 'use_sparse_layer': True, 'use_sparse_loss': False, 'use_batchnorm': False, 'use_dropout': True, 'dropout': 0.7572543939672359, 'mlp_size_1': 1, 'mlp_size_2': 4, 'mlp_size_3': 0, 'kernel': 'Exponential', 'loss_name': 'CensoredNLLLoss'}. Best is trial 245 with value: 0.7744390497152815.[0m
[32m[I 2022-04-17 18:45:16,239][0m Trial 385 finished with value: 0.7703790778599029 and parameters: {'n_hidden': 256, 'mixture_components': 10, 'use_sparse_layer': True, 'use_sparse_loss': False, 'use_batchnorm': False, 'use_dropout': True, 'dropout': 0.6614070290756742, 'mlp_size_1': 1, 'mlp_size_2': 4, 'mlp_size_3': 0, 'kernel': 'Weibull', 'loss_name': 'CensoredNLLLoss'}. Best is trial 245 with value: 0.7744390497152815.[0m
[32m[I 2022-04-17 18:47:03,054][0m Trial 386 finished with value: 0.7046513169211889 and parameters: {'n_hidden': 256, 'mixture_components': 10, 'use_sparse_layer': False, 'use_batchnorm': False, 'use_dropout': True, 'dropout': 0.6952102109515951, 'mlp_size_1': 1, 'mlp_size_2': 4, 'mlp_size_3': 0, 'kernel': 'Exponential', 'loss_name': 'NLLLoss'}. Best is trial 245 with value: 0.7744390497152815.[0m
[32m[I 2022-04-17 18:49:25,600][0m Trial 387 finished with value: 0.7735355871608844 and parameters: {'n_hidden': 256, 'mixture_components': 5, 'use_sparse_layer': True, 'use_sparse_loss': False, 'use_batchnorm': False, 'use_dropout': True, 'dropout': 0.784940882094986, 'mlp_size_1': 1, 'mlp_size_2': 4, 'mlp_size_3': 0, 'kernel': 'Exponential', 'loss_name': 'AlternativeNLLLoss'}. Best is trial 245 with value: 0.7744390497152815.[0m
[32m[I 2022-04-17 18:51:02,290][0m Trial 388 finished with value: 0.7606637753087376 and parameters: {'n_hidden': 256, 'mixture_components': 5, 'use_sparse_layer': True, 'use_sparse_loss': False, 'use_batchnorm': False, 'use_dropout': False, 'mlp_size_1': 2, 'mlp_size_2': 3, 'mlp_size_3': 0, 'kernel': 'Exponential', 'loss_name': 'AlternativeNLLLoss'}. Best is trial 245 with value: 0.7744390497152815.[0m
[32m[I 2022-04-17 18:55:02,467][0m Trial 389 finished with value: 0.7272989423497391 and parameters: {'n_hidden': 2048, 'mixture_components': 5, 'use_sparse_layer': True, 'use_sparse_loss': False, 'use_batchnorm': True, 'use_dropout': True, 'dropout': 0.7842874277773876, 'mlp_size_1': 0, 'mlp_size_2': 5, 'mlp_size_3': 1, 'kernel': 'Exponential', 'loss_name': 'AlternativeNLLLoss'}. Best is trial 245 with value: 0.7744390497152815.[0m
[32m[I 2022-04-17 18:57:13,377][0m Trial 390 finished with value: 0.7699589668115924 and parameters: {'n_hidden': 256, 'mixture_components': 5, 'use_sparse_layer': True, 'use_sparse_loss': True, 'lmbd': 0.00019393285396624146, 'use_batchnorm': False, 'use_dropout': True, 'dropout': 0.7975215662739756, 'mlp_size_1': 1, 'mlp_size_2': 4, 'mlp_size_3': 0, 'kernel': 'Exponential', 'loss_name': 'AlternativeNLLLoss'}. Best is trial 245 with value: 0.7744390497152815.[0m
[32m[I 2022-04-17 18:59:07,251][0m Trial 391 finished with value: 0.7691125224247914 and parameters: {'n_hidden': 1024, 'mixture_components': 5, 'use_sparse_layer': False, 'use_batchnorm': False, 'use_dropout': True, 'dropout': 0.839779097458352, 'mlp_size_1': 3, 'mlp_size_2': 4, 'mlp_size_3': 0, 'kernel': 'Exponential', 'loss_name': 'AlternativeNLLLoss'}. Best is trial 245 with value: 0.7744390497152815.[0m
[32m[I 2022-04-17 19:01:28,498][0m Trial 392 finished with value: 0.7705418793019227 and parameters: {'n_hidden': 256, 'mixture_components': 5, 'use_sparse_layer': True, 'use_sparse_loss': False, 'use_batchnorm': False, 'use_dropout': True, 'dropout': 0.7759773286384213, 'mlp_size_1': 1, 'mlp_size_2': 4, 'mlp_size_3': 0, 'kernel': 'Exponential', 'loss_name': 'AlternativeNLLLoss'}. Best is trial 245 with value: 0.7744390497152815.[0m
[32m[I 2022-04-17 19:05:38,096][0m Trial 393 finished with value: 0.75594919459624 and parameters: {'n_hidden': 128, 'mixture_components': 5, 'use_sparse_layer': True, 'use_sparse_loss': False, 'use_batchnorm': False, 'use_dropout': True, 'dropout': 0.7446677912630765, 'mlp_size_1': 1, 'mlp_size_2': 3, 'mlp_size_3': 0, 'kernel': 'LogNormal', 'loss_name': 'AlternativeNLLLoss'}. Best is trial 245 with value: 0.7744390497152815.[0m
[32m[I 2022-04-17 19:07:49,910][0m Trial 394 finished with value: 0.7665791046676246 and parameters: {'n_hidden': 256, 'mixture_components': 4, 'use_sparse_layer': True, 'use_sparse_loss': False, 'use_batchnorm': False, 'use_dropout': True, 'dropout': 0.8186457638297584, 'mlp_size_1': 1, 'mlp_size_2': 4, 'mlp_size_3': 0, 'kernel': 'Exponential', 'loss_name': 'AlternativeNLLLoss'}. Best is trial 245 with value: 0.7744390497152815.[0m
[32m[I 2022-04-17 19:10:14,074][0m Trial 395 finished with value: 0.7673602783949193 and parameters: {'n_hidden': 256, 'mixture_components': 5, 'use_sparse_layer': True, 'use_sparse_loss': False, 'use_batchnorm': False, 'use_dropout': True, 'dropout': 0.7327844737404205, 'mlp_size_1': 1, 'mlp_size_2': 4, 'mlp_size_3': 0, 'kernel': 'Logistic', 'loss_name': 'AlternativeNLLLoss'}. Best is trial 245 with value: 0.7744390497152815.[0m
[32m[I 2022-04-17 19:12:00,030][0m Trial 396 finished with value: 0.7531232753588494 and parameters: {'n_hidden': 64, 'mixture_components': 6, 'use_sparse_layer': False, 'use_batchnorm': False, 'use_dropout': False, 'mlp_size_1': 1, 'mlp_size_2': 2, 'mlp_size_3': 0, 'kernel': 'Exponential', 'loss_name': 'AlternativeNLLLoss'}. Best is trial 245 with value: 0.7744390497152815.[0m
[32m[I 2022-04-17 19:14:05,279][0m Trial 397 finished with value: 0.770281083080256 and parameters: {'n_hidden': 256, 'mixture_components': 9, 'use_sparse_layer': True, 'use_sparse_loss': False, 'use_batchnorm': False, 'use_dropout': True, 'dropout': 0.7684064071145663, 'mlp_size_1': 1, 'mlp_size_2': 4, 'mlp_size_3': 0, 'kernel': 'Exponential', 'loss_name': 'AlternativeNLLLoss'}. Best is trial 245 with value: 0.7744390497152815.[0m
[32m[I 2022-04-17 19:16:04,372][0m Trial 398 finished with value: 0.7698892664837047 and parameters: {'n_hidden': 256, 'mixture_components': 5, 'use_sparse_layer': True, 'use_sparse_loss': False, 'use_batchnorm': False, 'use_dropout': True, 'dropout': 0.5818894673326699, 'mlp_size_1': 1, 'mlp_size_2': 4, 'mlp_size_3': 0, 'kernel': 'Exponential', 'loss_name': 'AlternativeNLLLoss'}. Best is trial 245 with value: 0.7744390497152815.[0m
[32m[I 2022-04-17 19:17:54,186][0m Trial 399 finished with value: 0.767608243602956 and parameters: {'n_hidden': 256, 'mixture_components': 3, 'use_sparse_layer': True, 'use_sparse_loss': True, 'lmbd': 3.12396360254758e-06, 'use_batchnorm': False, 'use_dropout': True, 'dropout': 0.21540226130765877, 'mlp_size_1': 1, 'mlp_size_2': 4, 'mlp_size_3': 0, 'kernel': 'Exponential', 'loss_name': 'AlternativeNLLLoss'}. Best is trial 245 with value: 0.7744390497152815.[0m
[32m[I 2022-04-17 19:19:41,087][0m Trial 400 finished with value: 0.7725634877653599 and parameters: {'n_hidden': 512, 'mixture_components': 9, 'use_sparse_layer': False, 'use_batchnorm': False, 'use_dropout': True, 'dropout': 0.7561589370714688, 'mlp_size_1': 2, 'mlp_size_2': 4, 'mlp_size_3': 0, 'kernel': 'Exponential', 'loss_name': 'CensoredNLLLoss'}. Best is trial 245 with value: 0.7744390497152815.[0m
[32m[I 2022-04-17 19:21:42,919][0m Trial 401 finished with value: 0.7691084930261232 and parameters: {'n_hidden': 256, 'mixture_components': 5, 'use_sparse_layer': True, 'use_sparse_loss': False, 'use_batchnorm': False, 'use_dropout': True, 'dropout': 0.7165156818864483, 'mlp_size_1': 1, 'mlp_size_2': 4, 'mlp_size_3': 0, 'kernel': 'Exponential', 'loss_name': 'CensoredNLLLoss'}. Best is trial 245 with value: 0.7744390497152815.[0m
[32m[I 2022-04-17 19:23:50,904][0m Trial 402 finished with value: 0.7667324896939839 and parameters: {'n_hidden': 256, 'mixture_components': 4, 'use_sparse_layer': True, 'use_sparse_loss': False, 'use_batchnorm': False, 'use_dropout': True, 'dropout': 0.613080087365173, 'mlp_size_1': 1, 'mlp_size_2': 4, 'mlp_size_3': 0, 'kernel': 'LogLogistic', 'loss_name': 'AlternativeNLLLoss'}. Best is trial 245 with value: 0.7744390497152815.[0m
[32m[I 2022-04-17 19:25:34,987][0m Trial 403 finished with value: 0.7707876698068764 and parameters: {'n_hidden': 1024, 'mixture_components': 8, 'use_sparse_layer': True, 'use_sparse_loss': False, 'use_batchnorm': False, 'use_dropout': True, 'dropout': 0.6507689844352497, 'mlp_size_1': 2, 'mlp_size_2': 5, 'mlp_size_3': 0, 'kernel': 'Exponential', 'loss_name': 'CensoredNLLLoss'}. Best is trial 245 with value: 0.7744390497152815.[0m
[32m[I 2022-04-17 19:27:19,461][0m Trial 404 finished with value: 0.7432572751194735 and parameters: {'n_hidden': 256, 'mixture_components': 9, 'use_sparse_layer': False, 'use_batchnorm': False, 'use_dropout': False, 'mlp_size_1': 1, 'mlp_size_2': 4, 'mlp_size_3': 0, 'kernel': 'Normal', 'loss_name': 'AlternativeNLLLoss'}. Best is trial 245 with value: 0.7744390497152815.[0m
[32m[I 2022-04-17 19:29:49,965][0m Trial 405 finished with value: 0.7711086628364329 and parameters: {'n_hidden': 256, 'mixture_components': 9, 'use_sparse_layer': True, 'use_sparse_loss': False, 'use_batchnorm': False, 'use_dropout': True, 'dropout': 0.7942695328674816, 'mlp_size_1': 1, 'mlp_size_2': 4, 'mlp_size_3': 0, 'kernel': 'Gamma', 'loss_name': 'CensoredNLLLoss'}. Best is trial 245 with value: 0.7744390497152815.[0m
[32m[I 2022-04-17 19:31:54,868][0m Trial 406 finished with value: 0.7668347485814813 and parameters: {'n_hidden': 256, 'mixture_components': 10, 'use_sparse_layer': True, 'use_sparse_loss': False, 'use_batchnorm': False, 'use_dropout': True, 'dropout': 0.7298007896727318, 'mlp_size_1': 1, 'mlp_size_2': 4, 'mlp_size_3': 0, 'kernel': 'Exponential', 'loss_name': 'CensoredNLLLoss'}. Best is trial 245 with value: 0.7744390497152815.[0m
[32m[I 2022-04-17 19:33:58,831][0m Trial 407 finished with value: 0.7729413560665211 and parameters: {'n_hidden': 256, 'mixture_components': 5, 'use_sparse_layer': True, 'use_sparse_loss': False, 'use_batchnorm': False, 'use_dropout': True, 'dropout': 0.6793341765310321, 'mlp_size_1': 1, 'mlp_size_2': 4, 'mlp_size_3': 0, 'kernel': 'Exponential', 'loss_name': 'AlternativeNLLLoss'}. Best is trial 245 with value: 0.7744390497152815.[0m
[32m[I 2022-04-17 19:35:59,087][0m Trial 408 finished with value: 0.7676015594513407 and parameters: {'n_hidden': 256, 'mixture_components': 5, 'use_sparse_layer': True, 'use_sparse_loss': True, 'lmbd': 6.844475719594987e-06, 'use_batchnorm': False, 'use_dropout': True, 'dropout': 0.6822355402276352, 'mlp_size_1': 1, 'mlp_size_2': 4, 'mlp_size_3': 0, 'kernel': 'Exponential', 'loss_name': 'AlternativeNLLLoss'}. Best is trial 245 with value: 0.7744390497152815.[0m
[32m[I 2022-04-17 19:39:39,152][0m Trial 409 finished with value: 0.7671704799777214 and parameters: {'n_hidden': 64, 'mixture_components': 5, 'use_sparse_layer': False, 'use_batchnorm': True, 'use_dropout': True, 'dropout': 0.7028710699994366, 'mlp_size_1': 1, 'mlp_size_2': 2, 'mlp_size_3': 0, 'kernel': 'Exponential', 'loss_name': 'AlternativeNLLLoss'}. Best is trial 245 with value: 0.7744390497152815.[0m
[32m[I 2022-04-17 19:41:44,058][0m Trial 410 finished with value: 0.7702508047240337 and parameters: {'n_hidden': 256, 'mixture_components': 5, 'use_sparse_layer': True, 'use_sparse_loss': False, 'use_batchnorm': False, 'use_dropout': True, 'dropout': 0.7380552257916142, 'mlp_size_1': 1, 'mlp_size_2': 4, 'mlp_size_3': 0, 'kernel': 'Exponential', 'loss_name': 'AlternativeNLLLoss'}. Best is trial 245 with value: 0.7744390497152815.[0m
[32m[I 2022-04-17 19:43:49,806][0m Trial 411 finished with value: 0.7694468026643299 and parameters: {'n_hidden': 256, 'mixture_components': 5, 'use_sparse_layer': True, 'use_sparse_loss': False, 'use_batchnorm': False, 'use_dropout': True, 'dropout': 0.7623815355462884, 'mlp_size_1': 1, 'mlp_size_2': 4, 'mlp_size_3': 0, 'kernel': 'Exponential', 'loss_name': 'AlternativeNLLLoss'}. Best is trial 245 with value: 0.7744390497152815.[0m
[32m[I 2022-04-17 19:45:35,180][0m Trial 412 finished with value: 0.6694888055479149 and parameters: {'n_hidden': 32, 'mixture_components': 5, 'use_sparse_layer': True, 'use_sparse_loss': False, 'use_batchnorm': False, 'use_dropout': False, 'mlp_size_1': 1, 'mlp_size_2': 1, 'mlp_size_3': 0, 'kernel': 'Gumbel', 'loss_name': 'AlternativeNLLLoss'}. Best is trial 245 with value: 0.7744390497152815.[0m
[32m[I 2022-04-17 19:47:25,801][0m Trial 413 finished with value: 0.7554976799205855 and parameters: {'n_hidden': 1024, 'mixture_components': 5, 'use_sparse_layer': False, 'use_batchnorm': False, 'use_dropout': True, 'dropout': 0.6764354272737225, 'mlp_size_1': 5, 'mlp_size_2': 2, 'mlp_size_3': 0, 'kernel': 'Exponential', 'loss_name': 'AlternativeNLLLoss'}. Best is trial 245 with value: 0.7744390497152815.[0m
[32m[I 2022-04-17 19:49:31,006][0m Trial 414 finished with value: 0.7689210770942726 and parameters: {'n_hidden': 256, 'mixture_components': 4, 'use_sparse_layer': True, 'use_sparse_loss': False, 'use_batchnorm': False, 'use_dropout': True, 'dropout': 0.714976058904476, 'mlp_size_1': 1, 'mlp_size_2': 4, 'mlp_size_3': 0, 'kernel': 'Exponential', 'loss_name': 'AlternativeNLLLoss'}. Best is trial 245 with value: 0.7744390497152815.[0m
[32m[I 2022-04-17 19:51:33,565][0m Trial 415 finished with value: 0.7706063573856923 and parameters: {'n_hidden': 256, 'mixture_components': 5, 'use_sparse_layer': True, 'use_sparse_loss': False, 'use_batchnorm': False, 'use_dropout': True, 'dropout': 0.6959753334121107, 'mlp_size_1': 1, 'mlp_size_2': 4, 'mlp_size_3': 0, 'kernel': 'Exponential', 'loss_name': 'AlternativeNLLLoss'}. Best is trial 245 with value: 0.7744390497152815.[0m
[32m[I 2022-04-17 19:53:20,351][0m Trial 416 finished with value: 0.6954203459011561 and parameters: {'n_hidden': 256, 'mixture_components': 8, 'use_sparse_layer': True, 'use_sparse_loss': False, 'use_batchnorm': False, 'use_dropout': True, 'dropout': 0.6675017560118207, 'mlp_size_1': 1, 'mlp_size_2': 4, 'mlp_size_3': 0, 'kernel': 'Exponential', 'loss_name': 'NLLLoss'}. Best is trial 245 with value: 0.7744390497152815.[0m
[32m[I 2022-04-17 19:55:59,548][0m Trial 417 finished with value: 0.7697911174498556 and parameters: {'n_hidden': 256, 'mixture_components': 5, 'use_sparse_layer': True, 'use_sparse_loss': True, 'lmbd': 0.015202575410490499, 'use_batchnorm': False, 'use_dropout': True, 'dropout': 0.7465467465194605, 'mlp_size_1': 1, 'mlp_size_2': 4, 'mlp_size_3': 0, 'kernel': 'Weibull', 'loss_name': 'AlternativeNLLLoss'}. Best is trial 245 with value: 0.7744390497152815.[0m
[32m[I 2022-04-17 19:57:59,554][0m Trial 418 finished with value: 0.766846490264472 and parameters: {'n_hidden': 256, 'mixture_components': 6, 'use_sparse_layer': False, 'use_batchnorm': False, 'use_dropout': True, 'dropout': 0.7830493102153571, 'mlp_size_1': 1, 'mlp_size_2': 4, 'mlp_size_3': 0, 'kernel': 'Exponential', 'loss_name': 'AlternativeNLLLoss'}. Best is trial 245 with value: 0.7744390497152815.[0m
[32m[I 2022-04-17 20:00:08,252][0m Trial 419 finished with value: 0.7714699545486411 and parameters: {'n_hidden': 256, 'mixture_components': 9, 'use_sparse_layer': True, 'use_sparse_loss': False, 'use_batchnorm': False, 'use_dropout': True, 'dropout': 0.7227677121867011, 'mlp_size_1': 1, 'mlp_size_2': 4, 'mlp_size_3': 0, 'kernel': 'Exponential', 'loss_name': 'AlternativeNLLLoss'}. Best is trial 245 with value: 0.7744390497152815.[0m
[32m[I 2022-04-17 20:02:16,061][0m Trial 420 finished with value: 0.732653213413674 and parameters: {'n_hidden': 2048, 'mixture_components': 5, 'use_sparse_layer': True, 'use_sparse_loss': False, 'use_batchnorm': False, 'use_dropout': False, 'mlp_size_1': 0, 'mlp_size_2': 5, 'mlp_size_3': 0, 'kernel': 'Exponential', 'loss_name': 'AlternativeNLLLoss'}. Best is trial 245 with value: 0.7744390497152815.[0m
[32m[I 2022-04-17 20:04:47,941][0m Trial 421 finished with value: 0.7531087812570871 and parameters: {'n_hidden': 256, 'mixture_components': 6, 'use_sparse_layer': True, 'use_sparse_loss': False, 'use_batchnorm': False, 'use_dropout': True, 'dropout': 0.3650651775409402, 'mlp_size_1': 1, 'mlp_size_2': 4, 'mlp_size_3': 0, 'kernel': 'LogNormal', 'loss_name': 'CensoredNLLLoss'}. Best is trial 245 with value: 0.7744390497152815.[0m
[32m[I 2022-04-17 20:07:18,159][0m Trial 422 finished with value: 0.7725421962481628 and parameters: {'n_hidden': 128, 'mixture_components': 9, 'use_sparse_layer': False, 'use_batchnorm': False, 'use_dropout': True, 'dropout': 0.7033523967296157, 'mlp_size_1': 1, 'mlp_size_2': 3, 'mlp_size_3': 0, 'kernel': 'Exponential', 'loss_name': 'AlternativeNLLLoss'}. Best is trial 245 with value: 0.7744390497152815.[0m
[32m[I 2022-04-17 20:09:34,241][0m Trial 423 finished with value: 0.7680676026926601 and parameters: {'n_hidden': 256, 'mixture_components': 4, 'use_sparse_layer': True, 'use_sparse_loss': False, 'use_batchnorm': False, 'use_dropout': True, 'dropout': 0.8131595693688667, 'mlp_size_1': 1, 'mlp_size_2': 4, 'mlp_size_3': 0, 'kernel': 'Exponential', 'loss_name': 'CensoredNLLLoss'}. Best is trial 245 with value: 0.7744390497152815.[0m
[32m[I 2022-04-17 20:11:36,875][0m Trial 424 finished with value: 0.7731070780567197 and parameters: {'n_hidden': 1024, 'mixture_components': 5, 'use_sparse_layer': True, 'use_sparse_loss': False, 'use_batchnorm': False, 'use_dropout': True, 'dropout': 0.8822193439481109, 'mlp_size_1': 2, 'mlp_size_2': 5, 'mlp_size_3': 0, 'kernel': 'Exponential', 'loss_name': 'AlternativeNLLLoss'}. Best is trial 245 with value: 0.7744390497152815.[0m
[32m[I 2022-04-17 20:13:16,130][0m Trial 425 finished with value: -0.35334043664822745 and parameters: {'n_hidden': 1024, 'mixture_components': 5, 'use_sparse_layer': True, 'use_sparse_loss': False, 'use_batchnorm': False, 'use_dropout': True, 'dropout': 0.9805313007619773, 'mlp_size_1': 2, 'mlp_size_2': 5, 'mlp_size_3': 0, 'kernel': 'Logistic', 'loss_name': 'AlternativeNLLLoss'}. Best is trial 245 with value: 0.7744390497152815.[0m
