No protocol specified
dropped categorical variable 'SEX', because it has only 1 values
[32m[I 2022-04-13 11:42:59,381][0m A new study created in memory with name: no-name-0c08b7b2-4d03-4419-a476-73dc7ded446b[0m
[32m[I 2022-04-13 11:42:59,497][0m Trial 0 finished with value: 0.6870577105377486 and parameters: {'splitter': 'best', 'min_samples_split': 0.021693936850286477, 'min_samples_leaf': 0.3290960976027318, 'min_weight_fraction_leaf': 0.07212372543608347, 'max_features': 0.17799176221893676}. Best is trial 0 with value: 0.6870577105377486.[0m
[32m[I 2022-04-13 11:42:59,598][0m Trial 1 finished with value: 0.5675998125513939 and parameters: {'splitter': 'random', 'min_samples_split': 0.14716680593984333, 'min_samples_leaf': 0.14108716090881668, 'min_weight_fraction_leaf': 0.056502882399466325, 'max_features': 0.4430605293416787}. Best is trial 0 with value: 0.6870577105377486.[0m
[32m[I 2022-04-13 11:42:59,699][0m Trial 2 finished with value: 0.5371812073302544 and parameters: {'splitter': 'random', 'min_samples_split': 0.2858707397930379, 'min_samples_leaf': 0.2090396131806389, 'min_weight_fraction_leaf': 0.3855321187225128, 'max_features': 0.6427591324617941}. Best is trial 0 with value: 0.6870577105377486.[0m
[32m[I 2022-04-13 11:42:59,795][0m Trial 3 finished with value: 0.5487174062227944 and parameters: {'splitter': 'random', 'min_samples_split': 0.023598877144065267, 'min_samples_leaf': 0.1141296765377075, 'min_weight_fraction_leaf': 0.06414252270218529, 'max_features': 0.03652933653827717}. Best is trial 0 with value: 0.6870577105377486.[0m
[32m[I 2022-04-13 11:42:59,892][0m Trial 4 finished with value: 0.6870577105377486 and parameters: {'splitter': 'best', 'min_samples_split': 0.006803589358051582, 'min_samples_leaf': 0.37684361965999125, 'min_weight_fraction_leaf': 0.18058329016717117, 'max_features': 0.4715501441990906}. Best is trial 0 with value: 0.6870577105377486.[0m
[32m[I 2022-04-13 11:43:00,005][0m Trial 5 finished with value: 0.6981432179087999 and parameters: {'splitter': 'best', 'min_samples_split': 0.20578789950644613, 'min_samples_leaf': 0.4864403490745172, 'min_weight_fraction_leaf': 0.48027083261543957, 'max_features': 0.9097469110798819}. Best is trial 5 with value: 0.6981432179087999.[0m
[32m[I 2022-04-13 11:43:00,106][0m Trial 6 finished with value: 0.5371812073302544 and parameters: {'splitter': 'random', 'min_samples_split': 0.4800798904769033, 'min_samples_leaf': 0.2698589253056267, 'min_weight_fraction_leaf': 0.18632025960299303, 'max_features': 0.5557123834220872}. Best is trial 5 with value: 0.6981432179087999.[0m
[32m[I 2022-04-13 11:43:00,199][0m Trial 7 finished with value: 0.25 and parameters: {'splitter': 'random', 'min_samples_split': 0.25783881096691197, 'min_samples_leaf': 0.48108998339593967, 'min_weight_fraction_leaf': 0.025879100277031664, 'max_features': 0.054175641360618476}. Best is trial 5 with value: 0.6981432179087999.[0m
[32m[I 2022-04-13 11:43:00,294][0m Trial 8 finished with value: 0.7220796947866349 and parameters: {'splitter': 'random', 'min_samples_split': 0.02375967326093491, 'min_samples_leaf': 0.18808026834185615, 'min_weight_fraction_leaf': 0.15005207879147164, 'max_features': 0.2038705293955917}. Best is trial 8 with value: 0.7220796947866349.[0m
[32m[I 2022-04-13 11:43:00,395][0m Trial 9 finished with value: 0.747882422441936 and parameters: {'splitter': 'random', 'min_samples_split': 0.4048276297915919, 'min_samples_leaf': 0.16221836448902194, 'min_weight_fraction_leaf': 0.08719391806640897, 'max_features': 0.5631951149835619}. Best is trial 9 with value: 0.747882422441936.[0m
[32m[I 2022-04-13 11:43:00,520][0m Trial 10 finished with value: 0.5371812073302544 and parameters: {'splitter': 'random', 'min_samples_split': 0.45012511856371756, 'min_samples_leaf': 0.016805658578913224, 'min_weight_fraction_leaf': 0.30701041870778323, 'max_features': 0.8222498799370244}. Best is trial 9 with value: 0.747882422441936.[0m
[32m[I 2022-04-13 11:43:00,642][0m Trial 11 finished with value: 0.7504988232253569 and parameters: {'splitter': 'random', 'min_samples_split': 0.3520731526155306, 'min_samples_leaf': 0.1446899040886875, 'min_weight_fraction_leaf': 0.18780939003879382, 'max_features': 0.30127454610726834}. Best is trial 11 with value: 0.7504988232253569.[0m
[32m[I 2022-04-13 11:43:00,755][0m Trial 12 finished with value: 0.5371812073302544 and parameters: {'splitter': 'random', 'min_samples_split': 0.3579939285110602, 'min_samples_leaf': 0.059150932779600596, 'min_weight_fraction_leaf': 0.26673290494290347, 'max_features': 0.36146473572116944}. Best is trial 11 with value: 0.7504988232253569.[0m
[32m[I 2022-04-13 11:43:00,871][0m Trial 13 finished with value: 0.7477885314515145 and parameters: {'splitter': 'random', 'min_samples_split': 0.3741073816578607, 'min_samples_leaf': 0.11259542760198818, 'min_weight_fraction_leaf': 0.17002092059400908, 'max_features': 0.674417641253879}. Best is trial 11 with value: 0.7504988232253569.[0m
[32m[I 2022-04-13 11:43:00,978][0m Trial 14 finished with value: 0.7384155512541137 and parameters: {'splitter': 'random', 'min_samples_split': 0.3688622121457503, 'min_samples_leaf': 0.26281294765767327, 'min_weight_fraction_leaf': 0.11855721280619687, 'max_features': 0.297181470593267}. Best is trial 11 with value: 0.7504988232253569.[0m
[32m[I 2022-04-13 11:43:01,360][0m Trial 15 finished with value: 0.7181094953690392 and parameters: {'splitter': 'best', 'min_samples_split': 0.4222874937967023, 'min_samples_leaf': 0.17115427241573267, 'min_weight_fraction_leaf': 0.2724564095981721, 'max_features': 0.7552522583286219}. Best is trial 11 with value: 0.7504988232253569.[0m
[32m[I 2022-04-13 11:43:01,482][0m Trial 16 finished with value: 0.5632396395050204 and parameters: {'splitter': 'random', 'min_samples_split': 0.31239570001921185, 'min_samples_leaf': 0.05098237269219365, 'min_weight_fraction_leaf': 0.005596199920794687, 'max_features': 0.34189592556460835}. Best is trial 11 with value: 0.7504988232253569.[0m
[32m[I 2022-04-13 11:43:01,590][0m Trial 17 finished with value: 0.5371812073302544 and parameters: {'splitter': 'random', 'min_samples_split': 0.193332449770314, 'min_samples_leaf': 0.2341503533679093, 'min_weight_fraction_leaf': 0.3500960503763754, 'max_features': 0.5634040905975748}. Best is trial 11 with value: 0.7504988232253569.[0m
[32m[I 2022-04-13 11:43:01,829][0m Trial 18 finished with value: 0.7161795303986783 and parameters: {'splitter': 'best', 'min_samples_split': 0.407452115148957, 'min_samples_leaf': 0.08594409172672943, 'min_weight_fraction_leaf': 0.22881252176989478, 'max_features': 0.2443635226532459}. Best is trial 11 with value: 0.7504988232253569.[0m
[32m[I 2022-04-13 11:43:01,953][0m Trial 19 finished with value: 0.5371812073302544 and parameters: {'splitter': 'random', 'min_samples_split': 0.3274347990424437, 'min_samples_leaf': 0.33799008650016393, 'min_weight_fraction_leaf': 0.10796249629543303, 'max_features': 0.4147402791138594}. Best is trial 11 with value: 0.7504988232253569.[0m
[32m[I 2022-04-13 11:43:02,074][0m Trial 20 finished with value: 0.747882422441936 and parameters: {'splitter': 'random', 'min_samples_split': 0.49513454176728966, 'min_samples_leaf': 0.1489534951705346, 'min_weight_fraction_leaf': 0.21712602879649526, 'max_features': 0.9575879946315747}. Best is trial 11 with value: 0.7504988232253569.[0m
[32m[I 2022-04-13 11:43:02,190][0m Trial 21 finished with value: 0.744830865821425 and parameters: {'splitter': 'random', 'min_samples_split': 0.4931619523788271, 'min_samples_leaf': 0.15659119585519446, 'min_weight_fraction_leaf': 0.22787364395852688, 'max_features': 0.9907083749523938}. Best is trial 11 with value: 0.7504988232253569.[0m
[32m[I 2022-04-13 11:43:02,311][0m Trial 22 finished with value: 0.747882422441936 and parameters: {'splitter': 'random', 'min_samples_split': 0.4282614468393491, 'min_samples_leaf': 0.1315673190814649, 'min_weight_fraction_leaf': 0.13205651804131746, 'max_features': 0.8323340734185811}. Best is trial 11 with value: 0.7504988232253569.[0m
[32m[I 2022-04-13 11:43:02,459][0m Trial 23 finished with value: 0.747882422441936 and parameters: {'splitter': 'random', 'min_samples_split': 0.4627444597344277, 'min_samples_leaf': 0.012475863752233751, 'min_weight_fraction_leaf': 0.21172271834345402, 'max_features': 0.9796161004802131}. Best is trial 11 with value: 0.7504988232253569.[0m
[32m[I 2022-04-13 11:43:02,583][0m Trial 24 finished with value: 0.747882422441936 and parameters: {'splitter': 'random', 'min_samples_split': 0.49970003469363367, 'min_samples_leaf': 0.10767208333559886, 'min_weight_fraction_leaf': 0.13908264978034032, 'max_features': 0.8629668106676998}. Best is trial 11 with value: 0.7504988232253569.[0m
[32m[I 2022-04-13 11:43:02,752][0m Trial 25 finished with value: 0.747882422441936 and parameters: {'splitter': 'random', 'min_samples_split': 0.43530088111555665, 'min_samples_leaf': 0.08707055747936841, 'min_weight_fraction_leaf': 0.14274558120645206, 'max_features': 0.8461858391514339}. Best is trial 11 with value: 0.7504988232253569.[0m
[32m[I 2022-04-13 11:43:03,481][0m Trial 26 finished with value: 0.7089124489730949 and parameters: {'splitter': 'best', 'min_samples_split': 0.45992713113789824, 'min_samples_leaf': 0.006166544639881149, 'min_weight_fraction_leaf': 0.3107128411853445, 'max_features': 0.7416143930779177}. Best is trial 11 with value: 0.7504988232253569.[0m
[32m[I 2022-04-13 11:43:03,614][0m Trial 27 finished with value: 0.7483032284952962 and parameters: {'splitter': 'random', 'min_samples_split': 0.33660578942753183, 'min_samples_leaf': 0.04354720772974349, 'min_weight_fraction_leaf': 0.19060196159564954, 'max_features': 0.8933355081143393}. Best is trial 11 with value: 0.7504988232253569.[0m
[32m[I 2022-04-13 11:43:03,775][0m Trial 28 finished with value: 0.7481778559225306 and parameters: {'splitter': 'random', 'min_samples_split': 0.31171400527939297, 'min_samples_leaf': 0.05910636824039092, 'min_weight_fraction_leaf': 0.19578266763424612, 'max_features': 0.750942647941865}. Best is trial 11 with value: 0.7504988232253569.[0m
[32m[I 2022-04-13 11:43:03,931][0m Trial 29 finished with value: 0.6866116851304951 and parameters: {'splitter': 'best', 'min_samples_split': 0.25164463988506214, 'min_samples_leaf': 0.06029146210245888, 'min_weight_fraction_leaf': 0.28258551169100443, 'max_features': 0.0974381144389756}. Best is trial 11 with value: 0.7504988232253569.[0m
[32m[I 2022-04-13 11:43:04,122][0m Trial 30 finished with value: 0.5371812073302544 and parameters: {'splitter': 'random', 'min_samples_split': 0.3268884428366869, 'min_samples_leaf': 0.052561644719762386, 'min_weight_fraction_leaf': 0.36844947002221784, 'max_features': 0.717834115675984}. Best is trial 11 with value: 0.7504988232253569.[0m
[32m[I 2022-04-13 11:43:04,255][0m Trial 31 finished with value: 0.7485652195103432 and parameters: {'splitter': 'random', 'min_samples_split': 0.3020030900116222, 'min_samples_leaf': 0.08771650769270775, 'min_weight_fraction_leaf': 0.1894499542805006, 'max_features': 0.8909190926150076}. Best is trial 11 with value: 0.7504988232253569.[0m
[32m[I 2022-04-13 11:43:04,402][0m Trial 32 finished with value: 0.748052470524708 and parameters: {'splitter': 'random', 'min_samples_split': 0.2874983545068555, 'min_samples_leaf': 0.036166048630349175, 'min_weight_fraction_leaf': 0.18858407588870177, 'max_features': 0.9219238330575317}. Best is trial 11 with value: 0.7504988232253569.[0m
[32m[I 2022-04-13 11:43:04,534][0m Trial 33 finished with value: 0.6412183264981094 and parameters: {'splitter': 'random', 'min_samples_split': 0.21501977400718053, 'min_samples_leaf': 0.08120517846677891, 'min_weight_fraction_leaf': 0.24687480059515649, 'max_features': 0.6272283892491703}. Best is trial 11 with value: 0.7504988232253569.[0m
[32m[I 2022-04-13 11:43:04,651][0m Trial 34 finished with value: 0.7445564646291503 and parameters: {'splitter': 'random', 'min_samples_split': 0.2906077378596922, 'min_samples_leaf': 0.19776424418680197, 'min_weight_fraction_leaf': 0.20333332604598886, 'max_features': 0.7877310001792943}. Best is trial 11 with value: 0.7504988232253569.[0m
[32m[I 2022-04-13 11:43:04,774][0m Trial 35 finished with value: 0.7489200628615208 and parameters: {'splitter': 'random', 'min_samples_split': 0.15739852756740713, 'min_samples_leaf': 0.12321983302912301, 'min_weight_fraction_leaf': 0.16100750986851609, 'max_features': 0.893676805433149}. Best is trial 11 with value: 0.7504988232253569.[0m
[32m[I 2022-04-13 11:43:04,889][0m Trial 36 finished with value: 0.7463002775313001 and parameters: {'splitter': 'random', 'min_samples_split': 0.11749800373003166, 'min_samples_leaf': 0.22675269675945892, 'min_weight_fraction_leaf': 0.084655895766959, 'max_features': 0.8967368525179659}. Best is trial 11 with value: 0.7504988232253569.[0m
[32m[I 2022-04-13 11:43:05,045][0m Trial 37 finished with value: 0.7188408346450134 and parameters: {'splitter': 'best', 'min_samples_split': 0.13101589406491396, 'min_samples_leaf': 0.12504743577836946, 'min_weight_fraction_leaf': 0.15788702748061323, 'max_features': 0.1335846929982394}. Best is trial 11 with value: 0.7504988232253569.[0m
[32m[I 2022-04-13 11:43:05,157][0m Trial 38 finished with value: 0.6551930867852217 and parameters: {'splitter': 'random', 'min_samples_split': 0.1862995596268736, 'min_samples_leaf': 0.29385597228031307, 'min_weight_fraction_leaf': 0.4242261626638125, 'max_features': 0.6774273851433987}. Best is trial 11 with value: 0.7504988232253569.[0m
[32m[I 2022-04-13 11:43:05,285][0m Trial 39 finished with value: 0.7763061289706478 and parameters: {'splitter': 'random', 'min_samples_split': 0.07703735035721276, 'min_samples_leaf': 0.09529925103201987, 'min_weight_fraction_leaf': 0.10079349397874231, 'max_features': 0.47949087849173244}. Best is trial 39 with value: 0.7763061289706478.[0m
[32m[I 2022-04-13 11:43:05,391][0m Trial 40 finished with value: 0.6567788921383528 and parameters: {'splitter': 'random', 'min_samples_split': 0.0790715035154644, 'min_samples_leaf': 0.4363949510896499, 'min_weight_fraction_leaf': 0.040204500868386395, 'max_features': 0.5090525917848239}. Best is trial 39 with value: 0.7763061289706478.[0m
[32m[I 2022-04-13 11:43:05,504][0m Trial 41 finished with value: 0.8561362655111697 and parameters: {'splitter': 'random', 'min_samples_split': 0.04355071874779771, 'min_samples_leaf': 0.12008313362733536, 'min_weight_fraction_leaf': 0.09649277948032045, 'max_features': 0.416357107130366}. Best is trial 41 with value: 0.8561362655111697.[0m
[32m[I 2022-04-13 11:43:05,614][0m Trial 42 finished with value: 0.4650535860361704 and parameters: {'splitter': 'random', 'min_samples_split': 0.06392690175847907, 'min_samples_leaf': 0.18137415440424898, 'min_weight_fraction_leaf': 0.057572366157870467, 'max_features': 0.39886833794677423}. Best is trial 41 with value: 0.8561362655111697.[0m
[32m[I 2022-04-13 11:43:05,738][0m Trial 43 finished with value: 0.6770957809733498 and parameters: {'splitter': 'random', 'min_samples_split': 0.0687684729690843, 'min_samples_leaf': 0.09810824006469776, 'min_weight_fraction_leaf': 0.09520958000134896, 'max_features': 0.46574251110288006}. Best is trial 41 with value: 0.8561362655111697.[0m
[32m[I 2022-04-13 11:43:05,847][0m Trial 44 finished with value: 0.6400117942027668 and parameters: {'splitter': 'random', 'min_samples_split': 0.038040584578337894, 'min_samples_leaf': 0.13807373116499438, 'min_weight_fraction_leaf': 0.06831816186708488, 'max_features': 0.24033328432414}. Best is trial 41 with value: 0.8561362655111697.[0m
[32m[I 2022-04-13 11:43:05,966][0m Trial 45 finished with value: 0.7686682051627963 and parameters: {'splitter': 'random', 'min_samples_split': 0.09697265712269305, 'min_samples_leaf': 0.11776310191197346, 'min_weight_fraction_leaf': 0.1115387419439097, 'max_features': 0.5155287028501305}. Best is trial 41 with value: 0.8561362655111697.[0m
[32m[I 2022-04-13 11:43:06,075][0m Trial 46 finished with value: 0.7450197680904354 and parameters: {'splitter': 'random', 'min_samples_split': 0.09619538083069304, 'min_samples_leaf': 0.21566958649202883, 'min_weight_fraction_leaf': 0.12115176282046648, 'max_features': 0.5163950523467163}. Best is trial 41 with value: 0.8561362655111697.[0m
[32m[I 2022-04-13 11:43:06,432][0m Trial 47 finished with value: 0.717927573359422 and parameters: {'splitter': 'best', 'min_samples_split': 0.16698050548382803, 'min_samples_leaf': 0.11874565487694498, 'min_weight_fraction_leaf': 0.030558723692659412, 'max_features': 0.3479732742972069}. Best is trial 41 with value: 0.8561362655111697.[0m
[32m[I 2022-04-13 11:43:06,618][0m Trial 48 finished with value: 0.6391265263494803 and parameters: {'splitter': 'random', 'min_samples_split': 0.0025607784279529366, 'min_samples_leaf': 0.17819770831113724, 'min_weight_fraction_leaf': 0.16121796471566477, 'max_features': 0.2879407128932848}. Best is trial 41 with value: 0.8561362655111697.[0m
[32m[I 2022-04-13 11:43:06,731][0m Trial 49 finished with value: 0.7480358429451242 and parameters: {'splitter': 'random', 'min_samples_split': 0.14657319762476784, 'min_samples_leaf': 0.13850568822007786, 'min_weight_fraction_leaf': 0.10255492410420275, 'max_features': 0.5978561388681074}. Best is trial 41 with value: 0.8561362655111697.[0m
[32m[I 2022-04-13 11:43:06,881][0m Trial 50 finished with value: 0.7484517594562901 and parameters: {'splitter': 'random', 'min_samples_split': 0.029731111295596798, 'min_samples_leaf': 0.200032604023685, 'min_weight_fraction_leaf': 0.0857447416139062, 'max_features': 0.4319086431212196}. Best is trial 41 with value: 0.8561362655111697.[0m
[32m[I 2022-04-13 11:43:07,060][0m Trial 51 finished with value: 0.7433782081058057 and parameters: {'splitter': 'random', 'min_samples_split': 0.10042213060002392, 'min_samples_leaf': 0.08706020548946487, 'min_weight_fraction_leaf': 0.1591184562271777, 'max_features': 0.4668699750399164}. Best is trial 41 with value: 0.8561362655111697.[0m
[32m[I 2022-04-13 11:43:07,208][0m Trial 52 finished with value: 0.25 and parameters: {'splitter': 'random', 'min_samples_split': 0.22274625394095132, 'min_samples_leaf': 0.08057988783749385, 'min_weight_fraction_leaf': 0.17496939481802332, 'max_features': 0.0032943761903510005}. Best is trial 41 with value: 0.8561362655111697.[0m
[32m[I 2022-04-13 11:43:07,464][0m Trial 53 finished with value: 0.6545953383434548 and parameters: {'splitter': 'random', 'min_samples_split': 0.052315864705373784, 'min_samples_leaf': 0.16012815083090054, 'min_weight_fraction_leaf': 0.13728096136104703, 'max_features': 0.3761190365858215}. Best is trial 41 with value: 0.8561362655111697.[0m
[32m[I 2022-04-13 11:43:07,657][0m Trial 54 finished with value: 0.7242640726355979 and parameters: {'splitter': 'random', 'min_samples_split': 0.09343985178339481, 'min_samples_leaf': 0.03137838555449492, 'min_weight_fraction_leaf': 0.11195853523690563, 'max_features': 0.176063475566348}. Best is trial 41 with value: 0.8561362655111697.[0m
[32m[I 2022-04-13 11:43:07,776][0m Trial 55 finished with value: 0.7499383616185917 and parameters: {'splitter': 'random', 'min_samples_split': 0.233862863273042, 'min_samples_leaf': 0.1063047068639463, 'min_weight_fraction_leaf': 0.012941528008853564, 'max_features': 0.32944501177074714}. Best is trial 41 with value: 0.8561362655111697.[0m
[32m[I 2022-04-13 11:43:07,896][0m Trial 56 finished with value: 0.7557667989342857 and parameters: {'splitter': 'random', 'min_samples_split': 0.16400385066582976, 'min_samples_leaf': 0.10897622926155102, 'min_weight_fraction_leaf': 0.013185761555593437, 'max_features': 0.32713512936616634}. Best is trial 41 with value: 0.8561362655111697.[0m
[32m[I 2022-04-13 11:43:08,015][0m Trial 57 finished with value: 0.7616665876599763 and parameters: {'splitter': 'random', 'min_samples_split': 0.2664992690435204, 'min_samples_leaf': 0.1092777923307785, 'min_weight_fraction_leaf': 0.011337707376024223, 'max_features': 0.3125579056412295}. Best is trial 41 with value: 0.8561362655111697.[0m
[32m[I 2022-04-13 11:43:08,416][0m Trial 58 finished with value: 0.6516963713801349 and parameters: {'splitter': 'best', 'min_samples_split': 0.2653116471788019, 'min_samples_leaf': 0.06631364507579898, 'min_weight_fraction_leaf': 0.046656519902344054, 'max_features': 0.3086504713911189}. Best is trial 41 with value: 0.8561362655111697.[0m
[32m[I 2022-04-13 11:43:08,531][0m Trial 59 finished with value: 0.7453019336811413 and parameters: {'splitter': 'random', 'min_samples_split': 0.12492737484244196, 'min_samples_leaf': 0.15919870415251927, 'min_weight_fraction_leaf': 0.0020203817177392135, 'max_features': 0.25947984416519376}. Best is trial 41 with value: 0.8561362655111697.[0m
[32m[I 2022-04-13 11:43:08,654][0m Trial 60 finished with value: 0.6657744949730089 and parameters: {'splitter': 'random', 'min_samples_split': 0.044841337344076616, 'min_samples_leaf': 0.10250367464784213, 'min_weight_fraction_leaf': 0.026414337548709824, 'max_features': 0.5410782903856268}. Best is trial 41 with value: 0.8561362655111697.[0m
[32m[I 2022-04-13 11:43:08,775][0m Trial 61 finished with value: 0.7615755116696881 and parameters: {'splitter': 'random', 'min_samples_split': 0.24076441051371433, 'min_samples_leaf': 0.11377499931949242, 'min_weight_fraction_leaf': 0.015474285542311807, 'max_features': 0.3808394502514112}. Best is trial 41 with value: 0.8561362655111697.[0m
[32m[I 2022-04-13 11:43:08,916][0m Trial 62 finished with value: 0.46801152081639924 and parameters: {'splitter': 'random', 'min_samples_split': 0.02045575491354377, 'min_samples_leaf': 0.1417188075718974, 'min_weight_fraction_leaf': 0.07025615622360308, 'max_features': 0.4097684189118791}. Best is trial 41 with value: 0.8561362655111697.[0m
