[32m[I 2022-04-18 00:03:47,729][0m Trial 527 finished with value: 0.7520245857897407 and parameters: {'n_hidden': 256, 'mixture_components': 4, 'use_sparse_layer': True, 'use_sparse_loss': False, 'use_batchnorm': True, 'use_dropout': True, 'dropout': 0.7329251883091791, 'mlp_size_1': 1, 'mlp_size_2': 4, 'mlp_size_3': 0, 'kernel': 'Normal', 'loss_name': 'AlternativeNLLLoss'}. Best is trial 526 with value: 0.7749738194021545.[0m
[32m[I 2022-04-18 00:05:33,249][0m Trial 528 finished with value: 0.7716714713228106 and parameters: {'n_hidden': 512, 'mixture_components': 4, 'use_sparse_layer': True, 'use_sparse_loss': False, 'use_batchnorm': False, 'use_dropout': True, 'dropout': 0.6943182690812062, 'mlp_size_1': 3, 'mlp_size_2': 3, 'mlp_size_3': 0, 'kernel': 'Exponential', 'loss_name': 'CensoredNLLLoss'}. Best is trial 526 with value: 0.7749738194021545.[0m
[32m[I 2022-04-18 00:07:52,838][0m Trial 529 finished with value: 0.758189265752528 and parameters: {'n_hidden': 256, 'mixture_components': 4, 'use_sparse_layer': True, 'use_sparse_loss': False, 'use_batchnorm': False, 'use_dropout': True, 'dropout': 0.7563894090157283, 'mlp_size_1': 1, 'mlp_size_2': 4, 'mlp_size_3': 0, 'kernel': 'LogLogistic', 'loss_name': 'AlternativeNLLLoss'}. Best is trial 526 with value: 0.7749738194021545.[0m
[32m[I 2022-04-18 00:09:52,731][0m Trial 530 finished with value: 0.7684698349413537 and parameters: {'n_hidden': 256, 'mixture_components': 4, 'use_sparse_layer': True, 'use_sparse_loss': False, 'use_batchnorm': False, 'use_dropout': True, 'dropout': 0.6100781537893375, 'mlp_size_1': 1, 'mlp_size_2': 4, 'mlp_size_3': 0, 'kernel': 'Exponential', 'loss_name': 'CensoredNLLLoss'}. Best is trial 526 with value: 0.7749738194021545.[0m
[32m[I 2022-04-18 00:12:13,068][0m Trial 531 finished with value: 0.7685692106874212 and parameters: {'n_hidden': 256, 'mixture_components': 4, 'use_sparse_layer': True, 'use_sparse_loss': False, 'use_batchnorm': False, 'use_dropout': True, 'dropout': 0.7249751262859226, 'mlp_size_1': 1, 'mlp_size_2': 4, 'mlp_size_3': 0, 'kernel': 'Exponential', 'loss_name': 'CensoredNLLLoss'}. Best is trial 526 with value: 0.7749738194021545.[0m
[32m[I 2022-04-18 00:15:06,470][0m Trial 532 finished with value: 0.7702568307750309 and parameters: {'n_hidden': 64, 'mixture_components': 4, 'use_sparse_layer': True, 'use_sparse_loss': False, 'use_batchnorm': False, 'use_dropout': True, 'dropout': 0.6861706147346159, 'mlp_size_1': 1, 'mlp_size_2': 2, 'mlp_size_3': 0, 'kernel': 'Exponential', 'loss_name': 'AlternativeNLLLoss'}. Best is trial 526 with value: 0.7749738194021545.[0m
[32m[I 2022-04-18 00:17:07,722][0m Trial 533 finished with value: 0.7705675534517955 and parameters: {'n_hidden': 256, 'mixture_components': 3, 'use_sparse_layer': True, 'use_sparse_loss': False, 'use_batchnorm': False, 'use_dropout': True, 'dropout': 0.6325705946031028, 'mlp_size_1': 1, 'mlp_size_2': 4, 'mlp_size_3': 0, 'kernel': 'Gamma', 'loss_name': 'CensoredNLLLoss'}. Best is trial 526 with value: 0.7749738194021545.[0m
[32m[I 2022-04-18 00:19:04,361][0m Trial 534 finished with value: 0.7703660321463425 and parameters: {'n_hidden': 256, 'mixture_components': 4, 'use_sparse_layer': True, 'use_sparse_loss': False, 'use_batchnorm': False, 'use_dropout': True, 'dropout': 0.6593913563172753, 'mlp_size_1': 1, 'mlp_size_2': 4, 'mlp_size_3': 0, 'kernel': 'Exponential', 'loss_name': 'AlternativeNLLLoss'}. Best is trial 526 with value: 0.7749738194021545.[0m
[32m[I 2022-04-18 00:21:39,711][0m Trial 535 finished with value: 0.7651812192772368 and parameters: {'n_hidden': 256, 'mixture_components': 10, 'use_sparse_layer': True, 'use_sparse_loss': False, 'use_batchnorm': False, 'use_dropout': True, 'dropout': 0.9051778134056423, 'mlp_size_1': 1, 'mlp_size_2': 4, 'mlp_size_3': 0, 'kernel': 'Exponential', 'loss_name': 'CensoredNLLLoss'}. Best is trial 526 with value: 0.7749738194021545.[0m
[32m[I 2022-04-18 00:23:37,481][0m Trial 536 finished with value: 0.7684385407177082 and parameters: {'n_hidden': 256, 'mixture_components': 10, 'use_sparse_layer': True, 'use_sparse_loss': False, 'use_batchnorm': False, 'use_dropout': True, 'dropout': 0.7856283982628516, 'mlp_size_1': 1, 'mlp_size_2': 4, 'mlp_size_3': 0, 'kernel': 'Exponential', 'loss_name': 'AlternativeNLLLoss'}. Best is trial 526 with value: 0.7749738194021545.[0m
[32m[I 2022-04-18 00:25:32,142][0m Trial 537 finished with value: 0.7696998415786942 and parameters: {'n_hidden': 256, 'mixture_components': 9, 'use_sparse_layer': True, 'use_sparse_loss': False, 'use_batchnorm': False, 'use_dropout': True, 'dropout': 0.7434347643375729, 'mlp_size_1': 1, 'mlp_size_2': 4, 'mlp_size_3': 0, 'kernel': 'Exponential', 'loss_name': 'CensoredNLLLoss'}. Best is trial 526 with value: 0.7749738194021545.[0m
[32m[I 2022-04-18 00:27:10,956][0m Trial 538 finished with value: 0.625214994766274 and parameters: {'n_hidden': 256, 'mixture_components': 10, 'use_sparse_layer': True, 'use_sparse_loss': False, 'use_batchnorm': False, 'use_dropout': True, 'dropout': 0.7088126973441659, 'mlp_size_1': 1, 'mlp_size_2': 4, 'mlp_size_3': 0, 'kernel': 'Gumbel', 'loss_name': 'AlternativeNLLLoss'}. Best is trial 526 with value: 0.7749738194021545.[0m
[32m[I 2022-04-18 00:29:16,835][0m Trial 539 finished with value: 0.7710008489791024 and parameters: {'n_hidden': 256, 'mixture_components': 9, 'use_sparse_layer': True, 'use_sparse_loss': False, 'use_batchnorm': False, 'use_dropout': True, 'dropout': 0.678475599367716, 'mlp_size_1': 1, 'mlp_size_2': 4, 'mlp_size_3': 0, 'kernel': 'Exponential', 'loss_name': 'CensoredNLLLoss'}. Best is trial 526 with value: 0.7749738194021545.[0m
[32m[I 2022-04-18 00:31:23,289][0m Trial 540 finished with value: 0.7700858758408501 and parameters: {'n_hidden': 256, 'mixture_components': 10, 'use_sparse_layer': True, 'use_sparse_loss': False, 'use_batchnorm': False, 'use_dropout': True, 'dropout': 0.7281386119676897, 'mlp_size_1': 1, 'mlp_size_2': 4, 'mlp_size_3': 0, 'kernel': 'Exponential', 'loss_name': 'AlternativeNLLLoss'}. Best is trial 526 with value: 0.7749738194021545.[0m
[32m[I 2022-04-18 00:33:37,968][0m Trial 541 finished with value: 0.7719619489310257 and parameters: {'n_hidden': 256, 'mixture_components': 8, 'use_sparse_layer': True, 'use_sparse_loss': False, 'use_batchnorm': False, 'use_dropout': True, 'dropout': 0.4960957168006631, 'mlp_size_1': 1, 'mlp_size_2': 4, 'mlp_size_3': 0, 'kernel': 'Exponential', 'loss_name': 'CensoredNLLLoss'}. Best is trial 526 with value: 0.7749738194021545.[0m
[32m[I 2022-04-18 00:37:26,857][0m Trial 542 finished with value: 0.7576186668306751 and parameters: {'n_hidden': 32, 'mixture_components': 4, 'use_sparse_layer': True, 'use_sparse_loss': False, 'use_batchnorm': False, 'use_dropout': True, 'dropout': 0.7622114901820858, 'mlp_size_1': 1, 'mlp_size_2': 1, 'mlp_size_3': 0, 'kernel': 'Exponential', 'loss_name': 'AlternativeNLLLoss'}. Best is trial 526 with value: 0.7749738194021545.[0m
[32m[I 2022-04-18 00:39:26,598][0m Trial 543 finished with value: 0.7696889220156689 and parameters: {'n_hidden': 256, 'mixture_components': 10, 'use_sparse_layer': True, 'use_sparse_loss': False, 'use_batchnorm': False, 'use_dropout': True, 'dropout': 0.7026865994271841, 'mlp_size_1': 1, 'mlp_size_2': 4, 'mlp_size_3': 0, 'kernel': 'Exponential', 'loss_name': 'CensoredNLLLoss'}. Best is trial 526 with value: 0.7749738194021545.[0m
[32m[I 2022-04-18 00:41:55,149][0m Trial 544 finished with value: 0.7661181109179344 and parameters: {'n_hidden': 256, 'mixture_components': 4, 'use_sparse_layer': True, 'use_sparse_loss': False, 'use_batchnorm': False, 'use_dropout': True, 'dropout': 0.729753400634465, 'mlp_size_1': 1, 'mlp_size_2': 4, 'mlp_size_3': 0, 'kernel': 'Weibull', 'loss_name': 'AlternativeNLLLoss'}. Best is trial 526 with value: 0.7749738194021545.[0m
[32m[I 2022-04-18 00:44:24,758][0m Trial 545 finished with value: 0.7602899047493066 and parameters: {'n_hidden': 64, 'mixture_components': 9, 'use_sparse_layer': True, 'use_sparse_loss': False, 'use_batchnorm': False, 'use_dropout': True, 'dropout': 0.6605144598747759, 'mlp_size_1': 1, 'mlp_size_2': 2, 'mlp_size_3': 0, 'kernel': 'Exponential', 'loss_name': 'CensoredNLLLoss'}. Best is trial 526 with value: 0.7749738194021545.[0m
[32m[I 2022-04-18 00:47:12,532][0m Trial 546 finished with value: 0.6925877259055462 and parameters: {'n_hidden': 256, 'mixture_components': 3, 'use_sparse_layer': True, 'use_sparse_loss': False, 'use_batchnorm': True, 'use_dropout': True, 'dropout': 0.5448457975510822, 'mlp_size_1': 1, 'mlp_size_2': 4, 'mlp_size_3': 0, 'kernel': 'Exponential', 'loss_name': 'NLLLoss'}. Best is trial 526 with value: 0.7749738194021545.[0m
[32m[I 2022-04-18 00:49:31,099][0m Trial 547 finished with value: 0.7301397073962257 and parameters: {'n_hidden': 2048, 'mixture_components': 10, 'use_sparse_layer': True, 'use_sparse_loss': False, 'use_batchnorm': False, 'use_dropout': True, 'dropout': 0.6917190510223463, 'mlp_size_1': 0, 'mlp_size_2': 0, 'mlp_size_3': 7, 'kernel': 'Exponential', 'loss_name': 'CensoredNLLLoss'}. Best is trial 526 with value: 0.7749738194021545.[0m
[32m[I 2022-04-18 00:52:47,481][0m Trial 548 finished with value: 0.7595901987365179 and parameters: {'n_hidden': 256, 'mixture_components': 10, 'use_sparse_layer': True, 'use_sparse_loss': False, 'use_batchnorm': False, 'use_dropout': True, 'dropout': 0.772480047151198, 'mlp_size_1': 1, 'mlp_size_2': 4, 'mlp_size_3': 0, 'kernel': 'LogNormal', 'loss_name': 'AlternativeNLLLoss'}. Best is trial 526 with value: 0.7749738194021545.[0m
[32m[I 2022-04-18 00:54:53,604][0m Trial 549 finished with value: 0.7710903023022394 and parameters: {'n_hidden': 256, 'mixture_components': 10, 'use_sparse_layer': True, 'use_sparse_loss': False, 'use_batchnorm': False, 'use_dropout': True, 'dropout': 0.748723657412287, 'mlp_size_1': 1, 'mlp_size_2': 4, 'mlp_size_3': 0, 'kernel': 'Exponential', 'loss_name': 'CensoredNLLLoss'}. Best is trial 526 with value: 0.7749738194021545.[0m
[32m[I 2022-04-18 00:56:54,013][0m Trial 550 finished with value: 0.7576134502970864 and parameters: {'n_hidden': 256, 'mixture_components': 1, 'use_sparse_layer': True, 'use_sparse_loss': False, 'use_batchnorm': False, 'use_dropout': True, 'dropout': 0.714909002588055, 'mlp_size_1': 1, 'mlp_size_2': 4, 'mlp_size_3': 0, 'kernel': 'Logistic', 'loss_name': 'AlternativeNLLLoss'}. Best is trial 526 with value: 0.7749738194021545.[0m
[32m[I 2022-04-18 00:59:09,135][0m Trial 551 finished with value: 0.767741879024393 and parameters: {'n_hidden': 128, 'mixture_components': 9, 'use_sparse_layer': True, 'use_sparse_loss': False, 'use_batchnorm': False, 'use_dropout': True, 'dropout': 0.6284435650410025, 'mlp_size_1': 1, 'mlp_size_2': 3, 'mlp_size_3': 0, 'kernel': 'Exponential', 'loss_name': 'CensoredNLLLoss'}. Best is trial 526 with value: 0.7749738194021545.[0m
[32m[I 2022-04-18 01:01:12,767][0m Trial 552 finished with value: 0.7725493642496006 and parameters: {'n_hidden': 256, 'mixture_components': 10, 'use_sparse_layer': True, 'use_sparse_loss': False, 'use_batchnorm': False, 'use_dropout': True, 'dropout': 0.6765988807546773, 'mlp_size_1': 1, 'mlp_size_2': 4, 'mlp_size_3': 0, 'kernel': 'Exponential', 'loss_name': 'AlternativeNLLLoss'}. Best is trial 526 with value: 0.7749738194021545.[0m
[32m[I 2022-04-18 01:03:20,805][0m Trial 553 finished with value: 0.7727573031040521 and parameters: {'n_hidden': 256, 'mixture_components': 9, 'use_sparse_layer': True, 'use_sparse_loss': False, 'use_batchnorm': False, 'use_dropout': True, 'dropout': 0.8008724126154079, 'mlp_size_1': 1, 'mlp_size_2': 4, 'mlp_size_3': 0, 'kernel': 'Exponential', 'loss_name': 'CensoredNLLLoss'}. Best is trial 526 with value: 0.7749738194021545.[0m
[32m[I 2022-04-18 01:05:24,379][0m Trial 554 finished with value: 0.7728250672852142 and parameters: {'n_hidden': 256, 'mixture_components': 4, 'use_sparse_layer': True, 'use_sparse_loss': False, 'use_batchnorm': False, 'use_dropout': True, 'dropout': 0.7206664942755089, 'mlp_size_1': 1, 'mlp_size_2': 4, 'mlp_size_3': 0, 'kernel': 'Exponential', 'loss_name': 'AlternativeNLLLoss'}. Best is trial 526 with value: 0.7749738194021545.[0m
[32m[I 2022-04-18 01:07:42,877][0m Trial 555 finished with value: 0.7703618280777408 and parameters: {'n_hidden': 256, 'mixture_components': 10, 'use_sparse_layer': True, 'use_sparse_loss': False, 'use_batchnorm': False, 'use_dropout': True, 'dropout': 0.6978431215792712, 'mlp_size_1': 1, 'mlp_size_2': 4, 'mlp_size_3': 0, 'kernel': 'Exponential', 'loss_name': 'CensoredNLLLoss'}. Best is trial 526 with value: 0.7749738194021545.[0m
[32m[I 2022-04-18 01:09:37,945][0m Trial 556 finished with value: 0.7687100555526765 and parameters: {'n_hidden': 512, 'mixture_components': 9, 'use_sparse_layer': True, 'use_sparse_loss': False, 'use_batchnorm': False, 'use_dropout': True, 'dropout': 0.646768111859058, 'mlp_size_1': 1, 'mlp_size_2': 4, 'mlp_size_3': 0, 'kernel': 'Exponential', 'loss_name': 'AlternativeNLLLoss'}. Best is trial 526 with value: 0.7749738194021545.[0m
[32m[I 2022-04-18 01:12:18,947][0m Trial 557 finished with value: 0.7604497846741196 and parameters: {'n_hidden': 256, 'mixture_components': 3, 'use_sparse_layer': True, 'use_sparse_loss': False, 'use_batchnorm': False, 'use_dropout': True, 'dropout': 0.5741152187601926, 'mlp_size_1': 1, 'mlp_size_2': 4, 'mlp_size_3': 0, 'kernel': 'Normal', 'loss_name': 'CensoredNLLLoss'}. Best is trial 526 with value: 0.7749738194021545.[0m
[32m[I 2022-04-18 01:14:28,049][0m Trial 558 finished with value: 0.7705827975575983 and parameters: {'n_hidden': 256, 'mixture_components': 10, 'use_sparse_layer': True, 'use_sparse_loss': False, 'use_batchnorm': False, 'use_dropout': True, 'dropout': 0.7440185820266737, 'mlp_size_1': 1, 'mlp_size_2': 4, 'mlp_size_3': 0, 'kernel': 'Exponential', 'loss_name': 'AlternativeNLLLoss'}. Best is trial 526 with value: 0.7749738194021545.[0m
[32m[I 2022-04-18 01:16:20,898][0m Trial 559 finished with value: 0.7692448774334878 and parameters: {'n_hidden': 256, 'mixture_components': 4, 'use_sparse_layer': True, 'use_sparse_loss': False, 'use_batchnorm': False, 'use_dropout': True, 'dropout': 0.30160461048962645, 'mlp_size_1': 1, 'mlp_size_2': 4, 'mlp_size_3': 0, 'kernel': 'Exponential', 'loss_name': 'CensoredNLLLoss'}. Best is trial 526 with value: 0.7749738194021545.[0m
[32m[I 2022-04-18 01:19:21,778][0m Trial 560 finished with value: 0.7644072210542515 and parameters: {'n_hidden': 64, 'mixture_components': 10, 'use_sparse_layer': True, 'use_sparse_loss': False, 'use_batchnorm': False, 'use_dropout': True, 'dropout': 0.6735174790751189, 'mlp_size_1': 1, 'mlp_size_2': 2, 'mlp_size_3': 0, 'kernel': 'Exponential', 'loss_name': 'AlternativeNLLLoss'}. Best is trial 526 with value: 0.7749738194021545.[0m
[32m[I 2022-04-18 01:21:38,212][0m Trial 561 finished with value: 0.7705309368915167 and parameters: {'n_hidden': 256, 'mixture_components': 8, 'use_sparse_layer': True, 'use_sparse_loss': False, 'use_batchnorm': False, 'use_dropout': True, 'dropout': 0.7662856412160085, 'mlp_size_1': 1, 'mlp_size_2': 4, 'mlp_size_3': 0, 'kernel': 'Exponential', 'loss_name': 'CensoredNLLLoss'}. Best is trial 526 with value: 0.7749738194021545.[0m
[32m[I 2022-04-18 01:23:57,341][0m Trial 562 finished with value: 0.7573923997521542 and parameters: {'n_hidden': 256, 'mixture_components': 10, 'use_sparse_layer': True, 'use_sparse_loss': False, 'use_batchnorm': False, 'use_dropout': True, 'dropout': 0.7114810318832318, 'mlp_size_1': 1, 'mlp_size_2': 4, 'mlp_size_3': 0, 'kernel': 'LogLogistic', 'loss_name': 'AlternativeNLLLoss'}. Best is trial 526 with value: 0.7749738194021545.[0m
[32m[I 2022-04-18 01:25:57,913][0m Trial 563 finished with value: 0.7701804309342772 and parameters: {'n_hidden': 256, 'mixture_components': 6, 'use_sparse_layer': True, 'use_sparse_loss': False, 'use_batchnorm': False, 'use_dropout': True, 'dropout': 0.7310691982154683, 'mlp_size_1': 1, 'mlp_size_2': 4, 'mlp_size_3': 0, 'kernel': 'Gamma', 'loss_name': 'CensoredNLLLoss'}. Best is trial 526 with value: 0.7749738194021545.[0m
[32m[I 2022-04-18 01:27:44,038][0m Trial 564 finished with value: 0.7657918092813611 and parameters: {'n_hidden': 256, 'mixture_components': 9, 'use_sparse_layer': True, 'use_sparse_loss': False, 'use_batchnorm': False, 'use_dropout': True, 'dropout': 0.6901094430836661, 'mlp_size_1': 1, 'mlp_size_2': 4, 'mlp_size_3': 0, 'kernel': 'Exponential', 'loss_name': 'AlternativeNLLLoss'}. Best is trial 526 with value: 0.7749738194021545.[0m
[32m[I 2022-04-18 01:30:40,254][0m Trial 565 finished with value: 0.7689588663014728 and parameters: {'n_hidden': 256, 'mixture_components': 4, 'use_sparse_layer': False, 'use_batchnorm': True, 'use_dropout': True, 'dropout': 0.7532869800999311, 'mlp_size_1': 1, 'mlp_size_2': 4, 'mlp_size_3': 0, 'kernel': 'Exponential', 'loss_name': 'CensoredNLLLoss'}. Best is trial 526 with value: 0.7749738194021545.[0m
[32m[I 2022-04-18 01:32:54,480][0m Trial 566 finished with value: 0.7676713340181169 and parameters: {'n_hidden': 256, 'mixture_components': 2, 'use_sparse_layer': True, 'use_sparse_loss': False, 'use_batchnorm': False, 'use_dropout': True, 'dropout': 0.6598772862119547, 'mlp_size_1': 1, 'mlp_size_2': 4, 'mlp_size_3': 0, 'kernel': 'Exponential', 'loss_name': 'AlternativeNLLLoss'}. Best is trial 526 with value: 0.7749738194021545.[0m
[32m[I 2022-04-18 01:34:52,504][0m Trial 567 finished with value: 0.7706718325026999 and parameters: {'n_hidden': 256, 'mixture_components': 7, 'use_sparse_layer': True, 'use_sparse_loss': False, 'use_batchnorm': False, 'use_dropout': True, 'dropout': 0.7031350240372987, 'mlp_size_1': 1, 'mlp_size_2': 4, 'mlp_size_3': 0, 'kernel': 'Exponential', 'loss_name': 'CensoredNLLLoss'}. Best is trial 526 with value: 0.7749738194021545.[0m
[32m[I 2022-04-18 01:36:58,468][0m Trial 568 finished with value: 0.6706821028503688 and parameters: {'n_hidden': 32, 'mixture_components': 10, 'use_sparse_layer': False, 'use_batchnorm': False, 'use_dropout': True, 'dropout': 0.7756670196965714, 'mlp_size_1': 1, 'mlp_size_2': 1, 'mlp_size_3': 0, 'kernel': 'Exponential', 'loss_name': 'NLLLoss'}. Best is trial 526 with value: 0.7749738194021545.[0m
[32m[I 2022-04-18 01:39:16,432][0m Trial 569 finished with value: 0.7655696732698465 and parameters: {'n_hidden': 256, 'mixture_components': 10, 'use_sparse_layer': True, 'use_sparse_loss': False, 'use_batchnorm': False, 'use_dropout': True, 'dropout': 0.7305853752292659, 'mlp_size_1': 1, 'mlp_size_2': 4, 'mlp_size_3': 0, 'kernel': 'Exponential', 'loss_name': 'AlternativeNLLLoss'}. Best is trial 526 with value: 0.7749738194021545.[0m
[32m[I 2022-04-18 01:40:55,288][0m Trial 570 finished with value: 0.28406170986520046 and parameters: {'n_hidden': 256, 'mixture_components': 9, 'use_sparse_layer': True, 'use_sparse_loss': False, 'use_batchnorm': False, 'use_dropout': True, 'dropout': 0.6060977812256007, 'mlp_size_1': 1, 'mlp_size_2': 4, 'mlp_size_3': 0, 'kernel': 'Gumbel', 'loss_name': 'CensoredNLLLoss'}. Best is trial 526 with value: 0.7749738194021545.[0m
[32m[I 2022-04-18 01:42:49,919][0m Trial 571 finished with value: 0.7636551125016827 and parameters: {'n_hidden': 256, 'mixture_components': 5, 'use_sparse_layer': True, 'use_sparse_loss': False, 'use_batchnorm': False, 'use_dropout': True, 'dropout': 0.6434055494476865, 'mlp_size_1': 1, 'mlp_size_2': 4, 'mlp_size_3': 0, 'kernel': 'Exponential', 'loss_name': 'AlternativeNLLLoss'}. Best is trial 526 with value: 0.7749738194021545.[0m
[32m[I 2022-04-18 01:44:45,458][0m Trial 572 finished with value: 0.7693253391446204 and parameters: {'n_hidden': 256, 'mixture_components': 10, 'use_sparse_layer': False, 'use_batchnorm': False, 'use_dropout': True, 'dropout': 0.6839837739985826, 'mlp_size_1': 1, 'mlp_size_2': 4, 'mlp_size_3': 0, 'kernel': 'Exponential', 'loss_name': 'CensoredNLLLoss'}. Best is trial 526 with value: 0.7749738194021545.[0m
[32m[I 2022-04-18 01:46:57,201][0m Trial 573 finished with value: 0.7658584588554899 and parameters: {'n_hidden': 256, 'mixture_components': 5, 'use_sparse_layer': True, 'use_sparse_loss': False, 'use_batchnorm': False, 'use_dropout': True, 'dropout': 0.7922180159282228, 'mlp_size_1': 1, 'mlp_size_2': 4, 'mlp_size_3': 0, 'kernel': 'Exponential', 'loss_name': 'AlternativeNLLLoss'}. Best is trial 526 with value: 0.7749738194021545.[0m
[32m[I 2022-04-18 01:50:35,926][0m Trial 574 finished with value: 0.7690540470436199 and parameters: {'n_hidden': 2048, 'mixture_components': 10, 'use_sparse_layer': True, 'use_sparse_loss': False, 'use_batchnorm': False, 'use_dropout': True, 'dropout': 0.7477495037483005, 'mlp_size_1': 0, 'mlp_size_2': 3, 'mlp_size_3': 3, 'kernel': 'Weibull', 'loss_name': 'CensoredNLLLoss'}. Best is trial 526 with value: 0.7749738194021545.[0m
[32m[I 2022-04-18 01:53:03,529][0m Trial 575 finished with value: 0.764274440933309 and parameters: {'n_hidden': 64, 'mixture_components': 9, 'use_sparse_layer': True, 'use_sparse_loss': False, 'use_batchnorm': False, 'use_dropout': True, 'dropout': 0.7138878250029747, 'mlp_size_1': 2, 'mlp_size_2': 1, 'mlp_size_3': 0, 'kernel': 'Exponential', 'loss_name': 'CensoredNLLLoss'}. Best is trial 526 with value: 0.7749738194021545.[0m
[32m[I 2022-04-18 01:55:59,380][0m Trial 576 finished with value: 0.7622832437071534 and parameters: {'n_hidden': 256, 'mixture_components': 10, 'use_sparse_layer': False, 'use_batchnorm': False, 'use_dropout': True, 'dropout': 0.7251072404507511, 'mlp_size_1': 1, 'mlp_size_2': 4, 'mlp_size_3': 0, 'kernel': 'LogNormal', 'loss_name': 'AlternativeNLLLoss'}. Best is trial 526 with value: 0.7749738194021545.[0m
