[32m[I 2022-04-14 11:03:02,620][0m Trial 530 finished with value: 0.778515265811956 and parameters: {'loss': 'coxph', 'learning_rate': 6.336033221953179e-06, 'n_estimators': 835, 'criterion': 'friedman_mse', 'min_samples_split': 8, 'min_samples_leaf': 2, 'min_weight_fraction_leaf': 0.3799531086230951, 'min_impurity_decrease': 0.3137760776786498, 'max_features': 0.9414997631412143, 'subsample': 0.1339064625528747, 'dropout_rate': 0.5685399943884609, 'ccp_alpha': 0.08988599413751394}. Best is trial 367 with value: 0.7817487788378487.[0m
[32m[I 2022-04-14 11:07:27,345][0m Trial 531 finished with value: 0.25 and parameters: {'loss': 'coxph', 'learning_rate': 1.1432307048662414e-05, 'n_estimators': 946, 'criterion': 'friedman_mse', 'min_samples_split': 9, 'min_samples_leaf': 1, 'min_weight_fraction_leaf': 0.3994543377441454, 'min_impurity_decrease': 0.2742196681626954, 'max_features': 0.907767403940291, 'subsample': 0.03101523408557568, 'dropout_rate': 0.4794926749022182, 'ccp_alpha': 0.671764953800394}. Best is trial 367 with value: 0.7817487788378487.[0m
[32m[I 2022-04-14 11:11:02,307][0m Trial 532 finished with value: 0.6371812073302544 and parameters: {'loss': 'coxph', 'learning_rate': 4.142420998522685e-06, 'n_estimators': 881, 'criterion': 'friedman_mse', 'min_samples_split': 9, 'min_samples_leaf': 2, 'min_weight_fraction_leaf': 0.3708700723445071, 'min_impurity_decrease': 0.3355302045323485, 'max_features': 0.848316786856039, 'subsample': 0.1687317329264468, 'dropout_rate': 0.5365859142074187, 'ccp_alpha': 0.22973109811469336}. Best is trial 367 with value: 0.7817487788378487.[0m
[32m[I 2022-04-14 11:14:04,099][0m Trial 533 finished with value: 0.7807762006373469 and parameters: {'loss': 'coxph', 'learning_rate': 8.283171129347292e-06, 'n_estimators': 790, 'criterion': 'friedman_mse', 'min_samples_split': 8, 'min_samples_leaf': 3, 'min_weight_fraction_leaf': 0.35377796450406945, 'min_impurity_decrease': 0.29568107363187074, 'max_features': 0.887202227171709, 'subsample': 0.057861125084162586, 'dropout_rate': 0.6143572516448685, 'ccp_alpha': 0.0024781743440318235}. Best is trial 367 with value: 0.7817487788378487.[0m
[32m[I 2022-04-14 11:18:05,003][0m Trial 534 finished with value: 0.7801463863125709 and parameters: {'loss': 'coxph', 'learning_rate': 1.4026465548612323e-05, 'n_estimators': 922, 'criterion': 'friedman_mse', 'min_samples_split': 10, 'min_samples_leaf': 2, 'min_weight_fraction_leaf': 0.38987594032745376, 'min_impurity_decrease': 0.317397401645645, 'max_features': 0.8713558886702641, 'subsample': 0.10692904257358903, 'dropout_rate': 0.5890030608990063, 'ccp_alpha': 0.08586541626405231}. Best is trial 367 with value: 0.7817487788378487.[0m
[32m[I 2022-04-14 11:21:47,070][0m Trial 535 finished with value: 0.7810675730177399 and parameters: {'loss': 'coxph', 'learning_rate': 6.403128519977529e-06, 'n_estimators': 850, 'criterion': 'friedman_mse', 'min_samples_split': 9, 'min_samples_leaf': 2, 'min_weight_fraction_leaf': 0.36406151435314593, 'min_impurity_decrease': 0.2601303689818581, 'max_features': 0.9209803855231373, 'subsample': 0.0841443034323075, 'dropout_rate': 0.5603965640962193, 'ccp_alpha': 0.003019928983271145}. Best is trial 367 with value: 0.7817487788378487.[0m
[32m[I 2022-04-14 11:25:29,680][0m Trial 536 finished with value: 0.6371812073302544 and parameters: {'loss': 'coxph', 'learning_rate': 1.8742101013889657e-05, 'n_estimators': 827, 'criterion': 'friedman_mse', 'min_samples_split': 8, 'min_samples_leaf': 2, 'min_weight_fraction_leaf': 0.3634085255916092, 'min_impurity_decrease': 0.207753887726292, 'max_features': 0.9699694624600276, 'subsample': 0.07492339766643002, 'dropout_rate': 0.5128150358011162, 'ccp_alpha': 0.33187403731352155}. Best is trial 367 with value: 0.7817487788378487.[0m
[32m[I 2022-04-14 11:28:35,769][0m Trial 537 finished with value: 0.7803428268478477 and parameters: {'loss': 'coxph', 'learning_rate': 1.0919249609724415e-05, 'n_estimators': 777, 'criterion': 'friedman_mse', 'min_samples_split': 9, 'min_samples_leaf': 2, 'min_weight_fraction_leaf': 0.36287021015253995, 'min_impurity_decrease': 0.22955077761854653, 'max_features': 0.8345763940376218, 'subsample': 0.051211033289879616, 'dropout_rate': 0.5525798472104267, 'ccp_alpha': 0.17311278719073214}. Best is trial 367 with value: 0.7817487788378487.[0m
[32m[I 2022-04-14 11:32:18,988][0m Trial 538 finished with value: 0.7789848840614718 and parameters: {'loss': 'coxph', 'learning_rate': 7.5094522237480765e-06, 'n_estimators': 853, 'criterion': 'friedman_mse', 'min_samples_split': 9, 'min_samples_leaf': 1, 'min_weight_fraction_leaf': 0.3543006866454609, 'min_impurity_decrease': 0.2584524218007826, 'max_features': 0.9348306797164253, 'subsample': 0.09235607483612275, 'dropout_rate': 0.5327973427837323, 'ccp_alpha': 0.10766553071732972}. Best is trial 367 with value: 0.7817487788378487.[0m
[32m[I 2022-04-14 11:35:21,044][0m Trial 539 finished with value: 0.7806106614005458 and parameters: {'loss': 'coxph', 'learning_rate': 9.404216871147722e-06, 'n_estimators': 736, 'criterion': 'friedman_mse', 'min_samples_split': 8, 'min_samples_leaf': 2, 'min_weight_fraction_leaf': 0.37545962623461654, 'min_impurity_decrease': 0.25785368238993234, 'max_features': 0.8622302719299978, 'subsample': 0.06555195431393718, 'dropout_rate': 0.5630792751115522, 'ccp_alpha': 0.0012104650216877184}. Best is trial 367 with value: 0.7817487788378487.[0m
[32m[I 2022-04-14 11:39:00,410][0m Trial 540 finished with value: 0.7775733600190187 and parameters: {'loss': 'coxph', 'learning_rate': 7.124762272198958e-06, 'n_estimators': 808, 'criterion': 'friedman_mse', 'min_samples_split': 9, 'min_samples_leaf': 2, 'min_weight_fraction_leaf': 0.36925354115100795, 'min_impurity_decrease': 0.27928814455107037, 'max_features': 0.8958916450752891, 'subsample': 0.03476765038603624, 'dropout_rate': 0.5089443490231733, 'ccp_alpha': 0.2192991385632574}. Best is trial 367 with value: 0.7817487788378487.[0m
[32m[I 2022-04-14 11:42:44,544][0m Trial 541 finished with value: 0.25 and parameters: {'loss': 'coxph', 'learning_rate': 4.98600100382623e-06, 'n_estimators': 865, 'criterion': 'friedman_mse', 'min_samples_split': 8, 'min_samples_leaf': 2, 'min_weight_fraction_leaf': 0.3777930341406072, 'min_impurity_decrease': 0.22939002338854125, 'max_features': 0.7763847140493424, 'subsample': 0.0015574210362703164, 'dropout_rate': 0.5507392329835188, 'ccp_alpha': 0.0012463110464724042}. Best is trial 367 with value: 0.7817487788378487.[0m
[32m[I 2022-04-14 11:43:06,351][0m Trial 542 finished with value: 0.7759731616297916 and parameters: {'loss': 'coxph', 'learning_rate': 1.3968412074695486e-05, 'n_estimators': 161, 'criterion': 'friedman_mse', 'min_samples_split': 9, 'min_samples_leaf': 2, 'min_weight_fraction_leaf': 0.35470856032997194, 'min_impurity_decrease': 0.38537408148120195, 'max_features': 0.919949128115272, 'subsample': 0.0851000044876099, 'dropout_rate': 0.5255150244927198, 'ccp_alpha': 0.10651499235633112}. Best is trial 367 with value: 0.7817487788378487.[0m
[32m[I 2022-04-14 11:45:17,272][0m Trial 543 finished with value: -0.35727048270083495 and parameters: {'loss': 'squared', 'learning_rate': 1.0758094573799619e-05, 'n_estimators': 890, 'criterion': 'friedman_mse', 'min_samples_split': 10, 'min_samples_leaf': 2, 'min_weight_fraction_leaf': 0.36541519256574756, 'min_impurity_decrease': 0.35898804276406154, 'max_features': 0.8838582354628167, 'subsample': 0.10343549742759338, 'dropout_rate': 0.5618737587021976, 'ccp_alpha': 0.2587856844244818}. Best is trial 367 with value: 0.7817487788378487.[0m
[32m[I 2022-04-14 11:48:40,518][0m Trial 544 finished with value: 0.7795341027019566 and parameters: {'loss': 'coxph', 'learning_rate': 8.453472502244562e-06, 'n_estimators': 826, 'criterion': 'friedman_mse', 'min_samples_split': 9, 'min_samples_leaf': 3, 'min_weight_fraction_leaf': 0.3841058061560981, 'min_impurity_decrease': 0.2847532876654993, 'max_features': 0.8559546035175096, 'subsample': 0.05965853127462937, 'dropout_rate': 0.5760605483067731, 'ccp_alpha': 0.14466870107133217}. Best is trial 367 with value: 0.7817487788378487.[0m
[32m[I 2022-04-14 11:52:36,011][0m Trial 545 finished with value: 0.7806841045695098 and parameters: {'loss': 'coxph', 'learning_rate': 2.607107555627913e-05, 'n_estimators': 858, 'criterion': 'friedman_mse', 'min_samples_split': 8, 'min_samples_leaf': 1, 'min_weight_fraction_leaf': 0.3987297627205859, 'min_impurity_decrease': 0.25074982557138553, 'max_features': 0.9465821603969016, 'subsample': 0.07858408790140478, 'dropout_rate': 0.5336106566635761, 'ccp_alpha': 0.09341317476896163}. Best is trial 367 with value: 0.7817487788378487.[0m
[32m[I 2022-04-14 11:56:43,441][0m Trial 546 finished with value: 0.36505789418585516 and parameters: {'loss': 'coxph', 'learning_rate': 6.073798895849596e-06, 'n_estimators': 897, 'criterion': 'friedman_mse', 'min_samples_split': 9, 'min_samples_leaf': 2, 'min_weight_fraction_leaf': 0.3722696196275322, 'min_impurity_decrease': 0.33963635404762005, 'max_features': 0.8273921755118643, 'subsample': 0.10247599364699507, 'dropout_rate': 0.4954671860370133, 'ccp_alpha': 0.38289773194933135}. Best is trial 367 with value: 0.7817487788378487.[0m
[32m[I 2022-04-14 12:00:01,273][0m Trial 547 finished with value: 0.7780755218164295 and parameters: {'loss': 'coxph', 'learning_rate': 1.2508064108699246e-05, 'n_estimators': 793, 'criterion': 'friedman_mse', 'min_samples_split': 8, 'min_samples_leaf': 2, 'min_weight_fraction_leaf': 0.3516323754128388, 'min_impurity_decrease': 0.30382174974920967, 'max_features': 0.9008933740884585, 'subsample': 0.035282791871699234, 'dropout_rate': 0.5725970706263367, 'ccp_alpha': 0.17949363561030432}. Best is trial 367 with value: 0.7817487788378487.[0m
[32m[I 2022-04-14 12:03:41,615][0m Trial 548 finished with value: 0.777969425006505 and parameters: {'loss': 'coxph', 'learning_rate': 3.5104423657902425e-06, 'n_estimators': 843, 'criterion': 'friedman_mse', 'min_samples_split': 9, 'min_samples_leaf': 2, 'min_weight_fraction_leaf': 0.3795542222749486, 'min_impurity_decrease': 0.26930756880700335, 'max_features': 0.8775278066511588, 'subsample': 0.1465758956235758, 'dropout_rate': 0.5465436187362366, 'ccp_alpha': 0.08961367430523029}. Best is trial 367 with value: 0.7817487788378487.[0m
[32m[I 2022-04-14 12:07:33,617][0m Trial 549 finished with value: 0.6371812073302544 and parameters: {'loss': 'coxph', 'learning_rate': 1.9129249768888222e-05, 'n_estimators': 913, 'criterion': 'friedman_mse', 'min_samples_split': 9, 'min_samples_leaf': 2, 'min_weight_fraction_leaf': 0.4138885264686248, 'min_impurity_decrease': 0.3323143951802687, 'max_features': 0.9261203404914288, 'subsample': 0.11711582887586769, 'dropout_rate': 0.5840365096929508, 'ccp_alpha': 0.26152926639423135}. Best is trial 367 with value: 0.7817487788378487.[0m
[32m[I 2022-04-14 12:10:21,054][0m Trial 550 finished with value: 0.3678757772397035 and parameters: {'loss': 'coxph', 'learning_rate': 7.119358588766865e-06, 'n_estimators': 759, 'criterion': 'friedman_mse', 'min_samples_split': 8, 'min_samples_leaf': 1, 'min_weight_fraction_leaf': 0.3919719080847101, 'min_impurity_decrease': 0.31828706178125044, 'max_features': 0.8506818365305264, 'subsample': 0.08277547338569913, 'dropout_rate': 0.6267800800496316, 'ccp_alpha': 0.49118826321399}. Best is trial 367 with value: 0.7817487788378487.[0m
[32m[I 2022-04-14 12:14:20,192][0m Trial 551 finished with value: 0.7807617488130801 and parameters: {'loss': 'coxph', 'learning_rate': 9.562848289272869e-06, 'n_estimators': 886, 'criterion': 'friedman_mse', 'min_samples_split': 9, 'min_samples_leaf': 2, 'min_weight_fraction_leaf': 0.3619480401140303, 'min_impurity_decrease': 0.2867264364254968, 'max_features': 0.9034281471137714, 'subsample': 0.05739525152555546, 'dropout_rate': 0.5534355337541582, 'ccp_alpha': 0.003378932444275621}. Best is trial 367 with value: 0.7817487788378487.[0m
[32m[I 2022-04-14 12:17:47,516][0m Trial 552 finished with value: 0.7811368404452674 and parameters: {'loss': 'coxph', 'learning_rate': 5.055546846700802e-06, 'n_estimators': 822, 'criterion': 'friedman_mse', 'min_samples_split': 8, 'min_samples_leaf': 2, 'min_weight_fraction_leaf': 0.3704392317641585, 'min_impurity_decrease': 0.37592935216496515, 'max_features': 0.8703662665337463, 'subsample': 0.0963802654655583, 'dropout_rate': 0.5987864233703313, 'ccp_alpha': 0.0016387119696533725}. Best is trial 367 with value: 0.7817487788378487.[0m
[32m[I 2022-04-14 12:20:05,461][0m Trial 553 finished with value: 0.7426399079409036 and parameters: {'loss': 'coxph', 'learning_rate': 4.484403815181905e-06, 'n_estimators': 697, 'criterion': 'friedman_mse', 'min_samples_split': 9, 'min_samples_leaf': 2, 'min_weight_fraction_leaf': 0.3368259366267889, 'min_impurity_decrease': 0.3868124535450893, 'max_features': 0.8860178618046932, 'subsample': 0.13148427572957205, 'dropout_rate': 0.6450812485546313, 'ccp_alpha': 0.16736761531396133}. Best is trial 367 with value: 0.7817487788378487.[0m
[32m[I 2022-04-14 12:23:11,842][0m Trial 554 finished with value: 0.77650447866507 and parameters: {'loss': 'coxph', 'learning_rate': 3.907459326097628e-06, 'n_estimators': 808, 'criterion': 'friedman_mse', 'min_samples_split': 8, 'min_samples_leaf': 2, 'min_weight_fraction_leaf': 0.366129830400503, 'min_impurity_decrease': 0.3991633779086141, 'max_features': 0.9148489953434196, 'subsample': 0.10171704763019485, 'dropout_rate': 0.6121726545221924, 'ccp_alpha': 0.13038686596646126}. Best is trial 367 with value: 0.7817487788378487.[0m
[32m[I 2022-04-14 12:25:44,372][0m Trial 555 finished with value: 0.7800905954220495 and parameters: {'loss': 'coxph', 'learning_rate': 4.9692019350672685e-06, 'n_estimators': 736, 'criterion': 'friedman_mse', 'min_samples_split': 10, 'min_samples_leaf': 2, 'min_weight_fraction_leaf': 0.3838740541021971, 'min_impurity_decrease': 0.3728569831601276, 'max_features': 0.8260593538620717, 'subsample': 0.19150568388690536, 'dropout_rate': 0.6009233727682158, 'ccp_alpha': 0.0013281241838110443}. Best is trial 367 with value: 0.7817487788378487.[0m
[32m[I 2022-04-14 12:28:32,043][0m Trial 556 finished with value: 0.4829336714255586 and parameters: {'loss': 'coxph', 'learning_rate': 5.348273518466597e-06, 'n_estimators': 771, 'criterion': 'friedman_mse', 'min_samples_split': 9, 'min_samples_leaf': 3, 'min_weight_fraction_leaf': 0.3502581941305096, 'min_impurity_decrease': 0.35862626159653255, 'max_features': 0.9501286891352275, 'subsample': 0.11319724054153502, 'dropout_rate': 0.6217216287428068, 'ccp_alpha': 0.3371666049339709}. Best is trial 367 with value: 0.7817487788378487.[0m
[32m[I 2022-04-14 12:32:06,401][0m Trial 557 finished with value: 0.7784095704094371 and parameters: {'loss': 'coxph', 'learning_rate': 6.3747703148220235e-06, 'n_estimators': 823, 'criterion': 'friedman_mse', 'min_samples_split': 8, 'min_samples_leaf': 2, 'min_weight_fraction_leaf': 0.4061004489270633, 'min_impurity_decrease': 0.24594017537436036, 'max_features': 0.8485743962573286, 'subsample': 0.15700871698460844, 'dropout_rate': 0.5861363010183325, 'ccp_alpha': 0.08255264706114192}. Best is trial 367 with value: 0.7817487788378487.[0m
[32m[I 2022-04-14 12:36:05,886][0m Trial 558 finished with value: 0.7498200498439229 and parameters: {'loss': 'coxph', 'learning_rate': 1.551942403074607e-05, 'n_estimators': 930, 'criterion': 'friedman_mse', 'min_samples_split': 9, 'min_samples_leaf': 2, 'min_weight_fraction_leaf': 0.3918925023300769, 'min_impurity_decrease': 0.37618478843076253, 'max_features': 0.8718271447076535, 'subsample': 0.0961972112981832, 'dropout_rate': 0.5917071643716694, 'ccp_alpha': 0.22666298068666835}. Best is trial 367 with value: 0.7817487788378487.[0m
[32m[I 2022-04-14 12:39:10,632][0m Trial 559 finished with value: 0.7782150599113249 and parameters: {'loss': 'coxph', 'learning_rate': 1.226340103261582e-05, 'n_estimators': 853, 'criterion': 'friedman_mse', 'min_samples_split': 9, 'min_samples_leaf': 1, 'min_weight_fraction_leaf': 0.37216067955588056, 'min_impurity_decrease': 0.34863404769353956, 'max_features': 0.8963559986187914, 'subsample': 0.13067260285577087, 'dropout_rate': 0.6679659127320489, 'ccp_alpha': 0.09525962125551866}. Best is trial 367 with value: 0.7817487788378487.[0m
[32m[I 2022-04-14 12:43:20,719][0m Trial 560 finished with value: 0.7773422791310999 and parameters: {'loss': 'coxph', 'learning_rate': 3.632437274791305e-06, 'n_estimators': 960, 'criterion': 'friedman_mse', 'min_samples_split': 8, 'min_samples_leaf': 2, 'min_weight_fraction_leaf': 0.3809870305865231, 'min_impurity_decrease': 0.2686754274489692, 'max_features': 0.9294562241432609, 'subsample': 0.07488010042669839, 'dropout_rate': 0.6066909195988589, 'ccp_alpha': 0.17495581250596656}. Best is trial 367 with value: 0.7817487788378487.[0m
[32m[I 2022-04-14 12:46:49,326][0m Trial 561 finished with value: 0.779603708815525 and parameters: {'loss': 'coxph', 'learning_rate': 8.85207414261666e-06, 'n_estimators': 889, 'criterion': 'friedman_mse', 'min_samples_split': 9, 'min_samples_leaf': 2, 'min_weight_fraction_leaf': 0.3611381890619786, 'min_impurity_decrease': 0.29532003155323655, 'max_features': 0.8660049507764048, 'subsample': 0.10861584512487035, 'dropout_rate': 0.6361955211088705, 'ccp_alpha': 0.09739906255610717}. Best is trial 367 with value: 0.7817487788378487.[0m
[32m[I 2022-04-14 12:49:57,856][0m Trial 562 finished with value: 0.7572026940275699 and parameters: {'loss': 'coxph', 'learning_rate': 5.884973134066286e-06, 'n_estimators': 805, 'criterion': 'friedman_mse', 'min_samples_split': 8, 'min_samples_leaf': 2, 'min_weight_fraction_leaf': 0.4007799454301034, 'min_impurity_decrease': 0.30562766198648983, 'max_features': 0.9117751112324708, 'subsample': 0.05518191207070455, 'dropout_rate': 0.5724599357999459, 'ccp_alpha': 0.279080696819799}. Best is trial 367 with value: 0.7817487788378487.[0m
[32m[I 2022-04-14 12:52:25,582][0m Trial 563 finished with value: -0.3675740830575914 and parameters: {'loss': 'squared', 'learning_rate': 1.0109585357130608e-05, 'n_estimators': 924, 'criterion': 'friedman_mse', 'min_samples_split': 9, 'min_samples_leaf': 2, 'min_weight_fraction_leaf': 0.37091613485649955, 'min_impurity_decrease': 0.32218259940671945, 'max_features': 0.8844620363611136, 'subsample': 0.0916056852127205, 'dropout_rate': 0.5715435389967775, 'ccp_alpha': 0.08490611167366546}. Best is trial 367 with value: 0.7817487788378487.[0m
[32m[I 2022-04-14 12:55:51,167][0m Trial 564 finished with value: 0.7530191740491452 and parameters: {'loss': 'coxph', 'learning_rate': 7.396023280233455e-06, 'n_estimators': 838, 'criterion': 'friedman_mse', 'min_samples_split': 10, 'min_samples_leaf': 3, 'min_weight_fraction_leaf': 0.38709866923548697, 'min_impurity_decrease': 0.3537129454280321, 'max_features': 0.8463849355850195, 'subsample': 0.14219337312105484, 'dropout_rate': 0.5907509468644885, 'ccp_alpha': 0.18775968619290073}. Best is trial 367 with value: 0.7817487788378487.[0m
[32m[I 2022-04-14 12:59:58,690][0m Trial 565 finished with value: 0.7809120510558165 and parameters: {'loss': 'coxph', 'learning_rate': 4.451008529290734e-06, 'n_estimators': 868, 'criterion': 'friedman_mse', 'min_samples_split': 8, 'min_samples_leaf': 1, 'min_weight_fraction_leaf': 0.35388444880082365, 'min_impurity_decrease': 0.28063196539925983, 'max_features': 0.89739598920629, 'subsample': 0.07201557014591328, 'dropout_rate': 0.5307754058284071, 'ccp_alpha': 0.0013163486865424205}. Best is trial 367 with value: 0.7817487788378487.[0m
[32m[I 2022-04-14 13:03:42,333][0m Trial 566 finished with value: 0.7801893204837042 and parameters: {'loss': 'coxph', 'learning_rate': 3.52723766815294e-06, 'n_estimators': 770, 'criterion': 'friedman_mse', 'min_samples_split': 8, 'min_samples_leaf': 1, 'min_weight_fraction_leaf': 0.35475566984801554, 'min_impurity_decrease': 0.23310640742643596, 'max_features': 0.9795947135605271, 'subsample': 0.035191033721996744, 'dropout_rate': 0.47730935609975234, 'ccp_alpha': 0.00134220312656326}. Best is trial 367 with value: 0.7817487788378487.[0m
[32m[I 2022-04-14 13:08:32,589][0m Trial 567 finished with value: 0.7803701266647037 and parameters: {'loss': 'coxph', 'learning_rate': 4.624885243588643e-06, 'n_estimators': 962, 'criterion': 'friedman_mse', 'min_samples_split': 8, 'min_samples_leaf': 1, 'min_weight_fraction_leaf': 0.3501974433891184, 'min_impurity_decrease': 0.2863129794896095, 'max_features': 0.9308351151848091, 'subsample': 0.06994634724447019, 'dropout_rate': 0.5074464442258502, 'ccp_alpha': 0.09890467114364934}. Best is trial 367 with value: 0.7817487788378487.[0m
[32m[I 2022-04-14 13:13:31,638][0m Trial 568 finished with value: 0.7782112163529068 and parameters: {'loss': 'coxph', 'learning_rate': 4.657414955592476e-06, 'n_estimators': 999, 'criterion': 'friedman_mse', 'min_samples_split': 8, 'min_samples_leaf': 1, 'min_weight_fraction_leaf': 0.36096182849841096, 'min_impurity_decrease': 0.2610485805672844, 'max_features': 0.9577160039654433, 'subsample': 0.02027381240941952, 'dropout_rate': 0.5269556329244487, 'ccp_alpha': 0.2434185166640172}. Best is trial 367 with value: 0.7817487788378487.[0m
[32m[I 2022-04-14 13:17:37,257][0m Trial 569 finished with value: 0.6176896489261299 and parameters: {'loss': 'coxph', 'learning_rate': 3.227267608903267e-06, 'n_estimators': 900, 'criterion': 'friedman_mse', 'min_samples_split': 8, 'min_samples_leaf': 1, 'min_weight_fraction_leaf': 0.33674676933264425, 'min_impurity_decrease': 0.2725478943776298, 'max_features': 0.9091430724728999, 'subsample': 0.05496565891764103, 'dropout_rate': 0.5374108844745834, 'ccp_alpha': 0.37895065967117514}. Best is trial 367 with value: 0.7817487788378487.[0m
