[32m[I 2022-04-13 12:43:20,828][0m Trial 65 finished with value: 0.7451028956781608 and parameters: {'alpha': 0.7532465239881156, 'ties': 'breslow'}. Best is trial 48 with value: 0.7453475355819602.[0m
[32m[I 2022-04-13 12:43:25,904][0m Trial 66 finished with value: 0.745194605256751 and parameters: {'alpha': 1.0174802472954658, 'ties': 'breslow'}. Best is trial 48 with value: 0.7453475355819602.[0m
[32m[I 2022-04-13 12:43:29,969][0m Trial 67 finished with value: 0.7434921550642296 and parameters: {'alpha': 0.45918286907604455, 'ties': 'efron'}. Best is trial 48 with value: 0.7453475355819602.[0m
[32m[I 2022-04-13 12:43:33,924][0m Trial 68 finished with value: 0.7453018739649686 and parameters: {'alpha': 1.2935731660570529, 'ties': 'breslow'}. Best is trial 48 with value: 0.7453475355819602.[0m
[32m[I 2022-04-13 12:43:37,858][0m Trial 69 finished with value: 0.7448809068899822 and parameters: {'alpha': 1.6733080296361103, 'ties': 'breslow'}. Best is trial 48 with value: 0.7453475355819602.[0m
[32m[I 2022-04-13 12:43:40,791][0m Trial 70 finished with value: 0.7431229557934794 and parameters: {'alpha': 0.18646171136012457, 'ties': 'breslow'}. Best is trial 48 with value: 0.7453475355819602.[0m
[32m[I 2022-04-13 12:43:43,038][0m Trial 71 finished with value: 0.745323663778475 and parameters: {'alpha': 1.2369342397007779, 'ties': 'breslow'}. Best is trial 48 with value: 0.7453475355819602.[0m
[32m[I 2022-04-13 12:43:45,835][0m Trial 72 finished with value: 0.7452526080614736 and parameters: {'alpha': 1.1327754776948409, 'ties': 'breslow'}. Best is trial 48 with value: 0.7453475355819602.[0m
[32m[I 2022-04-13 12:43:47,368][0m Trial 73 finished with value: 0.7449018017078199 and parameters: {'alpha': 1.4190351497370368, 'ties': 'breslow'}. Best is trial 48 with value: 0.7453475355819602.[0m
[32m[I 2022-04-13 12:43:49,405][0m Trial 74 finished with value: 0.7450977458536305 and parameters: {'alpha': 0.8363214111828212, 'ties': 'breslow'}. Best is trial 48 with value: 0.7453475355819602.[0m
[32m[I 2022-04-13 12:43:52,452][0m Trial 75 finished with value: 0.7449881537039866 and parameters: {'alpha': 1.5464952598602566, 'ties': 'breslow'}. Best is trial 48 with value: 0.7453475355819602.[0m
[32m[I 2022-04-13 12:43:55,014][0m Trial 76 finished with value: 0.7448470377746229 and parameters: {'alpha': 2.025201823006903, 'ties': 'breslow'}. Best is trial 48 with value: 0.7453475355819602.[0m
[32m[I 2022-04-13 12:43:58,749][0m Trial 77 finished with value: 0.7438018972138992 and parameters: {'alpha': 0.6317469465828747, 'ties': 'breslow'}. Best is trial 48 with value: 0.7453475355819602.[0m
[32m[I 2022-04-13 12:44:01,774][0m Trial 78 finished with value: 0.7452715004988285 and parameters: {'alpha': 0.9807254598207463, 'ties': 'breslow'}. Best is trial 48 with value: 0.7453475355819602.[0m
[32m[I 2022-04-13 12:44:04,554][0m Trial 79 finished with value: 0.7452891633310809 and parameters: {'alpha': 1.259077860694998, 'ties': 'efron'}. Best is trial 48 with value: 0.7453475355819602.[0m
[32m[I 2022-04-13 12:44:07,282][0m Trial 80 finished with value: 0.7452032686504501 and parameters: {'alpha': 1.1144969664280193, 'ties': 'breslow'}. Best is trial 48 with value: 0.7453475355819602.[0m
[32m[I 2022-04-13 12:44:10,189][0m Trial 81 finished with value: 0.7448870716221989 and parameters: {'alpha': 1.4520815179933344, 'ties': 'breslow'}. Best is trial 48 with value: 0.7453475355819602.[0m
[32m[I 2022-04-13 12:44:12,577][0m Trial 82 finished with value: 0.7453018739649686 and parameters: {'alpha': 1.2931906442835337, 'ties': 'breslow'}. Best is trial 48 with value: 0.7453475355819602.[0m
[32m[I 2022-04-13 12:44:14,838][0m Trial 83 finished with value: 0.7450635838726074 and parameters: {'alpha': 1.3550571236017417, 'ties': 'breslow'}. Best is trial 48 with value: 0.7453475355819602.[0m
[32m[I 2022-04-13 12:44:17,651][0m Trial 84 finished with value: 0.7450718986592795 and parameters: {'alpha': 0.8304781762923333, 'ties': 'breslow'}. Best is trial 48 with value: 0.7453475355819602.[0m
[32m[I 2022-04-13 12:44:19,925][0m Trial 85 finished with value: 0.7448650557612742 and parameters: {'alpha': 1.6345567750466587, 'ties': 'breslow'}. Best is trial 48 with value: 0.7453475355819602.[0m
[32m[I 2022-04-13 12:44:22,066][0m Trial 86 finished with value: 0.7452874966620713 and parameters: {'alpha': 0.9707813074240356, 'ties': 'breslow'}. Best is trial 48 with value: 0.7453475355819602.[0m
[32m[I 2022-04-13 12:44:25,445][0m Trial 87 finished with value: 0.7447663497651067 and parameters: {'alpha': 1.7921647111525214, 'ties': 'breslow'}. Best is trial 48 with value: 0.7453475355819602.[0m
[32m[I 2022-04-13 12:44:28,306][0m Trial 88 finished with value: 0.7451662282743517 and parameters: {'alpha': 1.1946006344051276, 'ties': 'breslow'}. Best is trial 48 with value: 0.7453475355819602.[0m
[32m[I 2022-04-13 12:44:32,455][0m Trial 89 finished with value: 0.7435327202682792 and parameters: {'alpha': 0.504105877517994, 'ties': 'breslow'}. Best is trial 48 with value: 0.7453475355819602.[0m
[32m[I 2022-04-13 12:44:35,032][0m Trial 90 finished with value: 0.7433801189792364 and parameters: {'alpha': 0.26316308817675726, 'ties': 'breslow'}. Best is trial 48 with value: 0.7453475355819602.[0m
[32m[I 2022-04-13 12:44:37,613][0m Trial 91 finished with value: 0.7450095974532611 and parameters: {'alpha': 1.3304441889584617, 'ties': 'breslow'}. Best is trial 48 with value: 0.7453475355819602.[0m
[32m[I 2022-04-13 12:44:40,149][0m Trial 92 finished with value: 0.7453050415126674 and parameters: {'alpha': 1.2949953556141258, 'ties': 'breslow'}. Best is trial 48 with value: 0.7453475355819602.[0m
[32m[I 2022-04-13 12:44:43,588][0m Trial 93 finished with value: 0.7451930834633986 and parameters: {'alpha': 1.061872380153929, 'ties': 'breslow'}. Best is trial 48 with value: 0.7453475355819602.[0m
[32m[I 2022-04-13 12:44:47,527][0m Trial 94 finished with value: 0.7453475355819602 and parameters: {'alpha': 1.2236021404050272, 'ties': 'breslow'}. Best is trial 48 with value: 0.7453475355819602.[0m
[32m[I 2022-04-13 12:44:50,645][0m Trial 95 finished with value: 0.7449496466480174 and parameters: {'alpha': 1.536662499533457, 'ties': 'breslow'}. Best is trial 48 with value: 0.7453475355819602.[0m
[32m[I 2022-04-13 12:44:52,433][0m Trial 96 finished with value: 0.7452517592707897 and parameters: {'alpha': 1.2778825324302214, 'ties': 'breslow'}. Best is trial 48 with value: 0.7453475355819602.[0m
[32m[I 2022-04-13 12:44:54,970][0m Trial 97 finished with value: 0.7449025373811843 and parameters: {'alpha': 1.8759633764317418, 'ties': 'breslow'}. Best is trial 48 with value: 0.7453475355819602.[0m
[32m[I 2022-04-13 12:44:57,378][0m Trial 98 finished with value: 0.7448987845042967 and parameters: {'alpha': 1.4331295501020636, 'ties': 'breslow'}. Best is trial 48 with value: 0.7453475355819602.[0m
[32m[I 2022-04-13 12:45:01,054][0m Trial 99 finished with value: 0.7445518188701309 and parameters: {'alpha': 0.6979313947126705, 'ties': 'efron'}. Best is trial 48 with value: 0.7453475355819602.[0m
[32m[I 2022-04-13 12:45:03,312][0m Trial 100 finished with value: 0.7407525215271306 and parameters: {'alpha': 3.574446443766533, 'ties': 'breslow'}. Best is trial 48 with value: 0.7453475355819602.[0m
[32m[I 2022-04-13 12:45:05,593][0m Trial 101 finished with value: 0.7452644682112134 and parameters: {'alpha': 0.9107508446116634, 'ties': 'breslow'}. Best is trial 48 with value: 0.7453475355819602.[0m
[32m[I 2022-04-13 12:45:08,958][0m Trial 102 finished with value: 0.7451901377843573 and parameters: {'alpha': 1.0891901632501944, 'ties': 'breslow'}. Best is trial 48 with value: 0.7453475355819602.[0m
[32m[I 2022-04-13 12:45:12,812][0m Trial 103 finished with value: 0.7453381641269956 and parameters: {'alpha': 1.243025254862243, 'ties': 'breslow'}. Best is trial 48 with value: 0.7453475355819602.[0m
[32m[I 2022-04-13 12:45:15,138][0m Trial 104 finished with value: 0.7452485092956167 and parameters: {'alpha': 1.2077123209535536, 'ties': 'breslow'}. Best is trial 48 with value: 0.7453475355819602.[0m
[32m[I 2022-04-13 12:45:17,235][0m Trial 105 finished with value: 0.7449487046728828 and parameters: {'alpha': 1.6013782200591722, 'ties': 'breslow'}. Best is trial 48 with value: 0.7453475355819602.[0m
[32m[I 2022-04-13 12:45:20,099][0m Trial 106 finished with value: 0.7450699601154341 and parameters: {'alpha': 1.728985720782716, 'ties': 'breslow'}. Best is trial 48 with value: 0.7453475355819602.[0m
[32m[I 2022-04-13 12:45:23,029][0m Trial 107 finished with value: 0.7450635838726074 and parameters: {'alpha': 1.3575457805566549, 'ties': 'breslow'}. Best is trial 48 with value: 0.7453475355819602.[0m
[32m[I 2022-04-13 12:45:25,637][0m Trial 108 finished with value: 0.7437588267669987 and parameters: {'alpha': 2.699156933227191, 'ties': 'breslow'}. Best is trial 48 with value: 0.7453475355819602.[0m
[32m[I 2022-04-13 12:45:27,332][0m Trial 109 finished with value: 0.7451970342424996 and parameters: {'alpha': 1.1758856604414047, 'ties': 'breslow'}. Best is trial 48 with value: 0.7453475355819602.[0m
[32m[I 2022-04-13 12:45:31,847][0m Trial 110 finished with value: 0.7449326608189895 and parameters: {'alpha': 1.4922387509325201, 'ties': 'breslow'}. Best is trial 48 with value: 0.7453475355819602.[0m
[32m[I 2022-04-13 12:45:35,641][0m Trial 111 finished with value: 0.7452026043715146 and parameters: {'alpha': 1.0085498808153552, 'ties': 'breslow'}. Best is trial 48 with value: 0.7453475355819602.[0m
[32m[I 2022-04-13 12:45:38,095][0m Trial 112 finished with value: 0.7450817098449717 and parameters: {'alpha': 0.8399388779803822, 'ties': 'breslow'}. Best is trial 48 with value: 0.7453475355819602.[0m
[32m[I 2022-04-13 12:45:41,303][0m Trial 113 finished with value: 0.7452934267530601 and parameters: {'alpha': 1.2647508844943343, 'ties': 'breslow'}. Best is trial 48 with value: 0.7453475355819602.[0m
[32m[I 2022-04-13 12:45:43,385][0m Trial 114 finished with value: 0.7452148583401925 and parameters: {'alpha': 1.07821664345084, 'ties': 'breslow'}. Best is trial 48 with value: 0.7453475355819602.[0m
[32m[I 2022-04-13 12:45:45,158][0m Trial 115 finished with value: 0.7449628949812945 and parameters: {'alpha': 1.3941299807054475, 'ties': 'breslow'}. Best is trial 48 with value: 0.7453475355819602.[0m
[32m[I 2022-04-13 12:45:46,738][0m Trial 116 finished with value: 0.7452573103539889 and parameters: {'alpha': 0.9752755527238008, 'ties': 'breslow'}. Best is trial 48 with value: 0.7453475355819602.[0m
[32m[I 2022-04-13 12:45:50,091][0m Trial 117 finished with value: 0.7451683851355176 and parameters: {'alpha': 1.1599283364553188, 'ties': 'efron'}. Best is trial 48 with value: 0.7453475355819602.[0m
[32m[I 2022-04-13 12:45:53,047][0m Trial 118 finished with value: 0.744615806205329 and parameters: {'alpha': 0.7179124881548192, 'ties': 'breslow'}. Best is trial 48 with value: 0.7453475355819602.[0m
[32m[I 2022-04-13 12:45:57,420][0m Trial 119 finished with value: 0.745170425567674 and parameters: {'alpha': 0.8926832205809611, 'ties': 'breslow'}. Best is trial 48 with value: 0.7453475355819602.[0m
[32m[I 2022-04-13 12:46:00,978][0m Trial 120 finished with value: 0.7435166587683731 and parameters: {'alpha': 2.901917858517914, 'ties': 'breslow'}. Best is trial 48 with value: 0.7453475355819602.[0m
[32m[I 2022-04-13 12:46:03,694][0m Trial 121 finished with value: 0.7452517592707897 and parameters: {'alpha': 1.2770874196566966, 'ties': 'breslow'}. Best is trial 48 with value: 0.7453475355819602.[0m
[32m[I 2022-04-13 12:46:06,514][0m Trial 122 finished with value: 0.745286734514109 and parameters: {'alpha': 1.273034791704591, 'ties': 'breslow'}. Best is trial 48 with value: 0.7453475355819602.[0m
[32m[I 2022-04-13 12:46:08,873][0m Trial 123 finished with value: 0.745003351460453 and parameters: {'alpha': 1.397741907177514, 'ties': 'breslow'}. Best is trial 48 with value: 0.7453475355819602.[0m
[32m[I 2022-04-13 12:46:10,325][0m Trial 124 finished with value: 0.7448884956679951 and parameters: {'alpha': 1.525309291732371, 'ties': 'breslow'}. Best is trial 48 with value: 0.7453475355819602.[0m
[32m[I 2022-04-13 12:46:12,933][0m Trial 125 finished with value: 0.7451571216771639 and parameters: {'alpha': 1.1025275155949206, 'ties': 'breslow'}. Best is trial 48 with value: 0.7453475355819602.[0m
[32m[I 2022-04-13 12:46:15,927][0m Trial 126 finished with value: 0.7451662282743517 and parameters: {'alpha': 1.1945665002571368, 'ties': 'breslow'}. Best is trial 48 with value: 0.7453475355819602.[0m
[32m[I 2022-04-13 12:46:17,761][0m Trial 127 finished with value: 0.7450545757481135 and parameters: {'alpha': 0.796379888449374, 'ties': 'breslow'}. Best is trial 48 with value: 0.7453475355819602.[0m
[32m[I 2022-04-13 12:46:19,485][0m Trial 128 finished with value: 0.7449919582736306 and parameters: {'alpha': 1.6796429154790493, 'ties': 'breslow'}. Best is trial 48 with value: 0.7453475355819602.[0m
[32m[I 2022-04-13 12:46:22,194][0m Trial 129 finished with value: 0.7451951411695268 and parameters: {'alpha': 1.313104456610865, 'ties': 'breslow'}. Best is trial 48 with value: 0.7453475355819602.[0m
[32m[I 2022-04-13 12:46:25,791][0m Trial 130 finished with value: 0.7452225461590017 and parameters: {'alpha': 1.020572903959984, 'ties': 'breslow'}. Best is trial 48 with value: 0.7453475355819602.[0m
[32m[I 2022-04-13 12:46:28,574][0m Trial 131 finished with value: 0.745323663778475 and parameters: {'alpha': 1.2367503915572537, 'ties': 'breslow'}. Best is trial 48 with value: 0.7453475355819602.[0m
[32m[I 2022-04-13 12:46:30,933][0m Trial 132 finished with value: 0.7453282106586034 and parameters: {'alpha': 1.261594393578937, 'ties': 'breslow'}. Best is trial 48 with value: 0.7453475355819602.[0m
[32m[I 2022-04-13 12:46:32,905][0m Trial 133 finished with value: 0.744904566401031 and parameters: {'alpha': 1.460893165668667, 'ties': 'breslow'}. Best is trial 48 with value: 0.7453475355819602.[0m
[32m[I 2022-04-13 12:46:35,418][0m Trial 134 finished with value: 0.7452316731552189 and parameters: {'alpha': 1.1287468236792648, 'ties': 'breslow'}. Best is trial 48 with value: 0.7453475355819602.[0m
[32m[I 2022-04-13 12:46:37,909][0m Trial 135 finished with value: 0.7436913381055168 and parameters: {'alpha': 0.6018836723107048, 'ties': 'breslow'}. Best is trial 48 with value: 0.7453475355819602.[0m
[32m[I 2022-04-13 12:46:41,966][0m Trial 136 finished with value: 0.7452146207920454 and parameters: {'alpha': 0.9268250796869895, 'ties': 'breslow'}. Best is trial 48 with value: 0.7453475355819602.[0m
[32m[I 2022-04-13 12:46:44,908][0m Trial 137 finished with value: 0.7449670595264732 and parameters: {'alpha': 1.3898088580465142, 'ties': 'breslow'}. Best is trial 48 with value: 0.7453475355819602.[0m
[32m[I 2022-04-13 12:46:48,887][0m Trial 138 finished with value: 0.7449766260922294 and parameters: {'alpha': 1.55954401015526, 'ties': 'efron'}. Best is trial 48 with value: 0.7453475355819602.[0m
[32m[I 2022-04-13 12:46:51,869][0m Trial 139 finished with value: 0.745305094860461 and parameters: {'alpha': 1.2342672065240279, 'ties': 'breslow'}. Best is trial 48 with value: 0.7453475355819602.[0m
[32m[I 2022-04-13 12:46:54,652][0m Trial 140 finished with value: 0.7451803434157991 and parameters: {'alpha': 1.1969289170818485, 'ties': 'breslow'}. Best is trial 48 with value: 0.7453475355819602.[0m
[32m[I 2022-04-13 12:46:56,880][0m Trial 141 finished with value: 0.745101711387585 and parameters: {'alpha': 1.0486655391288457, 'ties': 'breslow'}. Best is trial 48 with value: 0.7453475355819602.[0m
[32m[I 2022-04-13 12:46:59,385][0m Trial 142 finished with value: 0.7452570020427938 and parameters: {'alpha': 1.2882021326674729, 'ties': 'breslow'}. Best is trial 48 with value: 0.7453475355819602.[0m
[32m[I 2022-04-13 12:47:01,732][0m Trial 143 finished with value: 0.7450723772239717 and parameters: {'alpha': 1.3599286173864458, 'ties': 'breslow'}. Best is trial 48 with value: 0.7453475355819602.[0m
[32m[I 2022-04-13 12:47:04,176][0m Trial 144 finished with value: 0.7452516263686848 and parameters: {'alpha': 1.1978103861385978, 'ties': 'breslow'}. Best is trial 48 with value: 0.7453475355819602.[0m
[32m[I 2022-04-13 12:47:07,744][0m Trial 145 finished with value: 0.7452623660596677 and parameters: {'alpha': 0.9360978665709411, 'ties': 'breslow'}. Best is trial 48 with value: 0.7453475355819602.[0m
[32m[I 2022-04-13 12:47:09,500][0m Trial 146 finished with value: 0.7449624535043116 and parameters: {'alpha': 1.4727717017388644, 'ties': 'breslow'}. Best is trial 48 with value: 0.7453475355819602.[0m
[32m[I 2022-04-13 12:47:10,966][0m Trial 147 finished with value: 0.7451890591295676 and parameters: {'alpha': 1.0597122979721991, 'ties': 'breslow'}. Best is trial 48 with value: 0.7453475355819602.[0m
[32m[I 2022-04-13 12:47:12,586][0m Trial 148 finished with value: 0.7448928020357309 and parameters: {'alpha': 1.6254458140626762, 'ties': 'breslow'}. Best is trial 48 with value: 0.7453475355819602.[0m
[32m[I 2022-04-13 12:47:13,850][0m Trial 149 finished with value: 0.745100874489568 and parameters: {'alpha': 0.791597244770073, 'ties': 'breslow'}. Best is trial 48 with value: 0.7453475355819602.[0m
[32m[I 2022-04-13 12:47:16,383][0m Trial 150 finished with value: 0.7452060255882695 and parameters: {'alpha': 1.1538639490987994, 'ties': 'breslow'}. Best is trial 48 with value: 0.7453475355819602.[0m
[32m[I 2022-04-13 12:47:18,674][0m Trial 151 finished with value: 0.7453319671949813 and parameters: {'alpha': 1.2495950274142946, 'ties': 'breslow'}. Best is trial 48 with value: 0.7453475355819602.[0m
[32m[I 2022-04-13 12:47:20,910][0m Trial 152 finished with value: 0.7453603360442735 and parameters: {'alpha': 1.256563993896079, 'ties': 'breslow'}. Best is trial 152 with value: 0.7453603360442735.[0m
[32m[I 2022-04-13 12:47:24,108][0m Trial 153 finished with value: 0.7450481080813652 and parameters: {'alpha': 1.3624241817265257, 'ties': 'breslow'}. Best is trial 152 with value: 0.7453603360442735.[0m
[32m[I 2022-04-13 12:47:27,530][0m Trial 154 finished with value: 0.7453319671949813 and parameters: {'alpha': 1.250157185189897, 'ties': 'breslow'}. Best is trial 152 with value: 0.7453603360442735.[0m
[32m[I 2022-04-13 12:47:30,380][0m Trial 155 finished with value: 0.7453186299788388 and parameters: {'alpha': 1.263191305375107, 'ties': 'breslow'}. Best is trial 152 with value: 0.7453603360442735.[0m
[32m[I 2022-04-13 12:47:33,393][0m Trial 156 finished with value: 0.7448871520462477 and parameters: {'alpha': 1.4457234108498989, 'ties': 'breslow'}. Best is trial 152 with value: 0.7453603360442735.[0m
[32m[I 2022-04-13 12:47:36,978][0m Trial 157 finished with value: 0.7453041873829125 and parameters: {'alpha': 1.2507003545002566, 'ties': 'breslow'}. Best is trial 152 with value: 0.7453603360442735.[0m
[32m[I 2022-04-13 12:47:40,756][0m Trial 158 finished with value: 0.745305094860461 and parameters: {'alpha': 1.2337654914758704, 'ties': 'breslow'}. Best is trial 152 with value: 0.7453603360442735.[0m
[32m[I 2022-04-13 12:47:43,841][0m Trial 159 finished with value: 0.7451833715783749 and parameters: {'alpha': 1.0066796802325821, 'ties': 'breslow'}. Best is trial 152 with value: 0.7453603360442735.[0m
[32m[I 2022-04-13 12:47:45,230][0m Trial 160 finished with value: 0.7451822431136589 and parameters: {'alpha': 1.1598021906223968, 'ties': 'breslow'}. Best is trial 152 with value: 0.7453603360442735.[0m
[32m[I 2022-04-13 12:47:47,597][0m Trial 161 finished with value: 0.7453463118080326 and parameters: {'alpha': 1.2211236822856228, 'ties': 'breslow'}. Best is trial 152 with value: 0.7453603360442735.[0m
[32m[I 2022-04-13 12:47:50,066][0m Trial 162 finished with value: 0.7451395478095922 and parameters: {'alpha': 1.091353411199086, 'ties': 'breslow'}. Best is trial 152 with value: 0.7453603360442735.[0m
[32m[I 2022-04-13 12:47:52,108][0m Trial 163 finished with value: 0.7453381641269956 and parameters: {'alpha': 1.243322009835718, 'ties': 'breslow'}. Best is trial 152 with value: 0.7453603360442735.[0m
[32m[I 2022-04-13 12:47:54,968][0m Trial 164 finished with value: 0.7449378083401955 and parameters: {'alpha': 1.5062070091718094, 'ties': 'breslow'}. Best is trial 152 with value: 0.7453603360442735.[0m
[32m[I 2022-04-13 12:47:59,184][0m Trial 165 finished with value: 0.745253068475342 and parameters: {'alpha': 1.2050961112112146, 'ties': 'breslow'}. Best is trial 152 with value: 0.7453603360442735.[0m
[32m[I 2022-04-13 12:48:01,930][0m Trial 166 finished with value: 0.7449685892470552 and parameters: {'alpha': 1.3786428973509885, 'ties': 'breslow'}. Best is trial 152 with value: 0.7453603360442735.[0m
[32m[I 2022-04-13 12:48:04,798][0m Trial 167 finished with value: 0.7451786296653975 and parameters: {'alpha': 1.059866086386061, 'ties': 'efron'}. Best is trial 152 with value: 0.7453603360442735.[0m
[32m[I 2022-04-13 12:48:06,098][0m Trial 168 finished with value: 0.7453322082366861 and parameters: {'alpha': 1.2450866253927872, 'ties': 'breslow'}. Best is trial 152 with value: 0.7453603360442735.[0m
[32m[I 2022-04-13 12:48:09,058][0m Trial 169 finished with value: 0.7452074075190774 and parameters: {'alpha': 0.9020155678464425, 'ties': 'breslow'}. Best is trial 152 with value: 0.7453603360442735.[0m
[32m[I 2022-04-13 12:48:11,461][0m Trial 170 finished with value: 0.7449704113245085 and parameters: {'alpha': 1.589465446516308, 'ties': 'breslow'}. Best is trial 152 with value: 0.7453603360442735.[0m
[32m[I 2022-04-13 12:48:13,918][0m Trial 171 finished with value: 0.7453218749428759 and parameters: {'alpha': 1.2659899225418167, 'ties': 'breslow'}. Best is trial 152 with value: 0.7453603360442735.[0m
