[32m[I 2022-04-14 16:32:43,693][0m Trial 650 finished with value: 0.7796396675711528 and parameters: {'loss': 'coxph', 'learning_rate': 4.191053748437614e-06, 'n_estimators': 802, 'criterion': 'friedman_mse', 'min_samples_split': 10, 'min_samples_leaf': 2, 'min_weight_fraction_leaf': 0.36398249360108825, 'min_impurity_decrease': 0.3801732015056588, 'max_features': 0.9831201533346772, 'subsample': 0.027182430411598395, 'dropout_rate': 0.6124737333442649, 'ccp_alpha': 0.0015820346578979128}. Best is trial 618 with value: 0.783753686536768.[0m
[32m[I 2022-04-14 16:34:53,713][0m Trial 651 finished with value: 0.25 and parameters: {'loss': 'coxph', 'learning_rate': 7.73201120723394e-06, 'n_estimators': 762, 'criterion': 'friedman_mse', 'min_samples_split': 10, 'min_samples_leaf': 2, 'min_weight_fraction_leaf': 0.3390546012175408, 'min_impurity_decrease': 0.34516342563365116, 'max_features': 0.9956902987896903, 'subsample': 0.061525696863626016, 'dropout_rate': 0.6510188036791255, 'ccp_alpha': 0.8606735767017127}. Best is trial 618 with value: 0.783753686536768.[0m
[32m[I 2022-04-14 16:37:00,428][0m Trial 652 finished with value: 0.7736039069364083 and parameters: {'loss': 'coxph', 'learning_rate': 5.092926772516647e-06, 'n_estimators': 800, 'criterion': 'friedman_mse', 'min_samples_split': 10, 'min_samples_leaf': 2, 'min_weight_fraction_leaf': 0.35567890361030013, 'min_impurity_decrease': 0.4656933959412223, 'max_features': 0.9995651458074668, 'subsample': 0.087026460697675, 'dropout_rate': 0.7042883382438272, 'ccp_alpha': 0.18305548631914237}. Best is trial 618 with value: 0.783753686536768.[0m
[32m[I 2022-04-14 16:39:10,549][0m Trial 653 finished with value: 0.7801247830591373 and parameters: {'loss': 'coxph', 'learning_rate': 1.0818655648385807e-05, 'n_estimators': 718, 'criterion': 'friedman_mse', 'min_samples_split': 10, 'min_samples_leaf': 2, 'min_weight_fraction_leaf': 0.3493711430399254, 'min_impurity_decrease': 0.329377526617297, 'max_features': 0.9413019236437081, 'subsample': 0.03765817372150687, 'dropout_rate': 0.6321041172213903, 'ccp_alpha': 0.09014330560712694}. Best is trial 618 with value: 0.783753686536768.[0m
[32m[I 2022-04-14 16:41:43,152][0m Trial 654 finished with value: 0.7680663962235525 and parameters: {'loss': 'coxph', 'learning_rate': 6.59343922705206e-06, 'n_estimators': 806, 'criterion': 'friedman_mse', 'min_samples_split': 10, 'min_samples_leaf': 2, 'min_weight_fraction_leaf': 0.32630695801696824, 'min_impurity_decrease': 0.3635131923051775, 'max_features': 0.962453574712334, 'subsample': 0.06788456501494872, 'dropout_rate': 0.5991015670128897, 'ccp_alpha': 0.25042490576236714}. Best is trial 618 with value: 0.783753686536768.[0m
[32m[I 2022-04-14 16:44:10,621][0m Trial 655 finished with value: 0.7748734250014084 and parameters: {'loss': 'coxph', 'learning_rate': 7.731682614388042e-06, 'n_estimators': 835, 'criterion': 'friedman_mse', 'min_samples_split': 10, 'min_samples_leaf': 3, 'min_weight_fraction_leaf': 0.3653349653722802, 'min_impurity_decrease': 0.32402493379572145, 'max_features': 0.9448616976304173, 'subsample': 0.09088353120689852, 'dropout_rate': 0.6758240220857328, 'ccp_alpha': 0.17935537556575148}. Best is trial 618 with value: 0.783753686536768.[0m
[32m[I 2022-04-14 16:46:32,174][0m Trial 656 finished with value: 0.25 and parameters: {'loss': 'coxph', 'learning_rate': 9.908704400063647e-06, 'n_estimators': 762, 'criterion': 'friedman_mse', 'min_samples_split': 10, 'min_samples_leaf': 2, 'min_weight_fraction_leaf': 0.3652345217802893, 'min_impurity_decrease': 0.4096560712731668, 'max_features': 0.9739616687047132, 'subsample': 0.0035393778717816606, 'dropout_rate': 0.6123090983921206, 'ccp_alpha': 0.11311816125152742}. Best is trial 618 with value: 0.783753686536768.[0m
[32m[I 2022-04-14 16:49:17,957][0m Trial 657 finished with value: 0.7809537636078862 and parameters: {'loss': 'coxph', 'learning_rate': 3.7565443204515763e-06, 'n_estimators': 859, 'criterion': 'friedman_mse', 'min_samples_split': 10, 'min_samples_leaf': 1, 'min_weight_fraction_leaf': 0.3474200805660531, 'min_impurity_decrease': 0.3435811675946424, 'max_features': 0.9378254682674251, 'subsample': 0.05381346057320763, 'dropout_rate': 0.642481886881695, 'ccp_alpha': 0.0018768877769514047}. Best is trial 618 with value: 0.783753686536768.[0m
[32m[I 2022-04-14 16:51:46,319][0m Trial 658 finished with value: 0.7800068008609088 and parameters: {'loss': 'coxph', 'learning_rate': 5.5944119744546295e-06, 'n_estimators': 815, 'criterion': 'friedman_mse', 'min_samples_split': 10, 'min_samples_leaf': 2, 'min_weight_fraction_leaf': 0.3585571625017526, 'min_impurity_decrease': 0.37882607990931827, 'max_features': 0.9621296561036469, 'subsample': 0.07810909019589166, 'dropout_rate': 0.6192669929562437, 'ccp_alpha': 0.08465788590231015}. Best is trial 618 with value: 0.783753686536768.[0m
[32m[I 2022-04-14 16:54:25,754][0m Trial 659 finished with value: 0.776793195379572 and parameters: {'loss': 'coxph', 'learning_rate': 9.084979100213999e-06, 'n_estimators': 785, 'criterion': 'friedman_mse', 'min_samples_split': 10, 'min_samples_leaf': 2, 'min_weight_fraction_leaf': 0.33669312094580844, 'min_impurity_decrease': 0.32385763736291495, 'max_features': 0.9274607570803024, 'subsample': 0.025281363817760902, 'dropout_rate': 0.600105514324297, 'ccp_alpha': 0.3390015870035495}. Best is trial 618 with value: 0.783753686536768.[0m
[32m[I 2022-04-14 16:57:03,658][0m Trial 660 finished with value: 0.7794523737494468 and parameters: {'loss': 'coxph', 'learning_rate': 6.6849493895184744e-06, 'n_estimators': 878, 'criterion': 'friedman_mse', 'min_samples_split': 10, 'min_samples_leaf': 2, 'min_weight_fraction_leaf': 0.3667959717660137, 'min_impurity_decrease': 0.2349341717671952, 'max_features': 0.9510554570143815, 'subsample': 0.043925964367109424, 'dropout_rate': 0.6653285274411604, 'ccp_alpha': 0.18586402333018306}. Best is trial 618 with value: 0.783753686536768.[0m
[32m[I 2022-04-14 16:57:57,104][0m Trial 661 finished with value: -0.370349622619152 and parameters: {'loss': 'squared', 'learning_rate': 5.363844034681126e-06, 'n_estimators': 662, 'criterion': 'friedman_mse', 'min_samples_split': 10, 'min_samples_leaf': 2, 'min_weight_fraction_leaf': 0.3521577893433139, 'min_impurity_decrease': 0.3618988128318158, 'max_features': 0.9997414400929724, 'subsample': 0.09255930986736159, 'dropout_rate': 0.6377819170782724, 'ccp_alpha': 0.07882295799384739}. Best is trial 618 with value: 0.783753686536768.[0m
[32m[I 2022-04-14 17:00:29,735][0m Trial 662 finished with value: 0.7744742265731505 and parameters: {'loss': 'coxph', 'learning_rate': 1.1600340860503804e-05, 'n_estimators': 837, 'criterion': 'friedman_mse', 'min_samples_split': 10, 'min_samples_leaf': 2, 'min_weight_fraction_leaf': 0.3409843440844086, 'min_impurity_decrease': 0.31788008918057215, 'max_features': 0.9755391762579438, 'subsample': 0.06125758837572578, 'dropout_rate': 0.5976053291466467, 'ccp_alpha': 0.2367065477780995}. Best is trial 618 with value: 0.783753686536768.[0m
[32m[I 2022-04-14 17:02:23,635][0m Trial 663 finished with value: 0.7804812208735221 and parameters: {'loss': 'coxph', 'learning_rate': 8.156338255055421e-06, 'n_estimators': 742, 'criterion': 'friedman_mse', 'min_samples_split': 10, 'min_samples_leaf': 2, 'min_weight_fraction_leaf': 0.36738486338891885, 'min_impurity_decrease': 0.33850562335332823, 'max_features': 0.931141213502992, 'subsample': 0.07811223891475357, 'dropout_rate': 0.6872702488633888, 'ccp_alpha': 0.08663763686499784}. Best is trial 618 with value: 0.783753686536768.[0m
[32m[I 2022-04-14 17:05:14,082][0m Trial 664 finished with value: 0.7800717482263847 and parameters: {'loss': 'coxph', 'learning_rate': 4.373586028673836e-06, 'n_estimators': 894, 'criterion': 'friedman_mse', 'min_samples_split': 10, 'min_samples_leaf': 1, 'min_weight_fraction_leaf': 0.3176214983895998, 'min_impurity_decrease': 0.2766346418153418, 'max_features': 0.9487015013718914, 'subsample': 0.021566311666881346, 'dropout_rate': 0.6208390480729036, 'ccp_alpha': 0.19075697632812103}. Best is trial 618 with value: 0.783753686536768.[0m
[32m[I 2022-04-14 17:07:46,033][0m Trial 665 finished with value: 0.7794588419743341 and parameters: {'loss': 'coxph', 'learning_rate': 7.107962969768823e-06, 'n_estimators': 849, 'criterion': 'friedman_mse', 'min_samples_split': 10, 'min_samples_leaf': 2, 'min_weight_fraction_leaf': 0.3578669531286092, 'min_impurity_decrease': 0.3187616365382714, 'max_features': 0.9788988672748922, 'subsample': 0.0940273921112161, 'dropout_rate': 0.5982205263877357, 'ccp_alpha': 0.08463076602000696}. Best is trial 618 with value: 0.783753686536768.[0m
[32m[I 2022-04-14 17:09:57,513][0m Trial 666 finished with value: 0.5002980658606476 and parameters: {'loss': 'coxph', 'learning_rate': 1.0759133545159472e-05, 'n_estimators': 783, 'criterion': 'friedman_mse', 'min_samples_split': 10, 'min_samples_leaf': 2, 'min_weight_fraction_leaf': 0.3316618835490274, 'min_impurity_decrease': 0.3618976570282102, 'max_features': 0.9204952289293213, 'subsample': 0.04098348671433387, 'dropout_rate': 0.6580704745326074, 'ccp_alpha': 0.4241509378620133}. Best is trial 618 with value: 0.783753686536768.[0m
[32m[I 2022-04-14 17:13:10,190][0m Trial 667 finished with value: 0.7804376189997219 and parameters: {'loss': 'coxph', 'learning_rate': 5.5806331834922635e-06, 'n_estimators': 929, 'criterion': 'friedman_mse', 'min_samples_split': 10, 'min_samples_leaf': 2, 'min_weight_fraction_leaf': 0.3504832359075059, 'min_impurity_decrease': 0.39079458333522965, 'max_features': 0.938690870910684, 'subsample': 0.05704682250333954, 'dropout_rate': 0.6178226562261743, 'ccp_alpha': 0.0053500755131966875}. Best is trial 618 with value: 0.783753686536768.[0m
[32m[I 2022-04-14 17:15:48,788][0m Trial 668 finished with value: 0.7808032178959637 and parameters: {'loss': 'coxph', 'learning_rate': 2.9931436376183637e-06, 'n_estimators': 821, 'criterion': 'friedman_mse', 'min_samples_split': 10, 'min_samples_leaf': 3, 'min_weight_fraction_leaf': 0.3688971526459693, 'min_impurity_decrease': 0.34358789953038554, 'max_features': 0.9626452442302046, 'subsample': 0.06907650768774962, 'dropout_rate': 0.5963374373319176, 'ccp_alpha': 0.003444023553600302}. Best is trial 618 with value: 0.783753686536768.[0m
[32m[I 2022-04-14 17:18:35,921][0m Trial 669 finished with value: 0.7801363802786773 and parameters: {'loss': 'coxph', 'learning_rate': 8.457634342881495e-06, 'n_estimators': 895, 'criterion': 'friedman_mse', 'min_samples_split': 10, 'min_samples_leaf': 2, 'min_weight_fraction_leaf': 0.3598523415230647, 'min_impurity_decrease': 0.21797974028971936, 'max_features': 0.9158125163518034, 'subsample': 0.10033642171332857, 'dropout_rate': 0.6448806008027854, 'ccp_alpha': 0.0011631050563598033}. Best is trial 618 with value: 0.783753686536768.[0m
[32m[I 2022-04-14 17:21:23,726][0m Trial 670 finished with value: 0.7778720341004025 and parameters: {'loss': 'coxph', 'learning_rate': 1.330274316633532e-05, 'n_estimators': 859, 'criterion': 'friedman_mse', 'min_samples_split': 10, 'min_samples_leaf': 2, 'min_weight_fraction_leaf': 0.3403525160449492, 'min_impurity_decrease': 0.3046642797851746, 'max_features': 0.7297734689852075, 'subsample': 0.01828097990507379, 'dropout_rate': 0.5920470786990674, 'ccp_alpha': 0.27945167319296843}. Best is trial 618 with value: 0.783753686536768.[0m
[32m[I 2022-04-14 17:23:19,069][0m Trial 671 finished with value: 0.7747556448510162 and parameters: {'loss': 'coxph', 'learning_rate': 3.882901226825791e-06, 'n_estimators': 700, 'criterion': 'friedman_mse', 'min_samples_split': 10, 'min_samples_leaf': 1, 'min_weight_fraction_leaf': 0.36904512990815325, 'min_impurity_decrease': 0.2663305934262143, 'max_features': 0.9097663626619604, 'subsample': 0.07874441107355862, 'dropout_rate': 0.6336111107720244, 'ccp_alpha': 0.17622638506194366}. Best is trial 618 with value: 0.783753686536768.[0m
[32m[I 2022-04-14 17:25:42,246][0m Trial 672 finished with value: 0.25 and parameters: {'loss': 'coxph', 'learning_rate': 6.358989748595846e-06, 'n_estimators': 820, 'criterion': 'friedman_mse', 'min_samples_split': 7, 'min_samples_leaf': 2, 'min_weight_fraction_leaf': 0.34869945800118934, 'min_impurity_decrease': 0.32403200530448, 'max_features': 0.9853106193378965, 'subsample': 0.0023306739372403185, 'dropout_rate': 0.6825819918641561, 'ccp_alpha': 0.15164407303257849}. Best is trial 618 with value: 0.783753686536768.[0m
[32m[I 2022-04-14 17:28:51,544][0m Trial 673 finished with value: 0.7793613125617069 and parameters: {'loss': 'coxph', 'learning_rate': 9.843722849076113e-06, 'n_estimators': 931, 'criterion': 'friedman_mse', 'min_samples_split': 10, 'min_samples_leaf': 2, 'min_weight_fraction_leaf': 0.36041290433119233, 'min_impurity_decrease': 0.3740973504643513, 'max_features': 0.7584912868346614, 'subsample': 0.038970412383114245, 'dropout_rate': 0.611565269377196, 'ccp_alpha': 0.002963583955296188}. Best is trial 618 with value: 0.783753686536768.[0m
[32m[I 2022-04-14 17:30:51,562][0m Trial 674 finished with value: 0.6371812073302544 and parameters: {'loss': 'coxph', 'learning_rate': 4.825183131912012e-06, 'n_estimators': 761, 'criterion': 'friedman_mse', 'min_samples_split': 10, 'min_samples_leaf': 2, 'min_weight_fraction_leaf': 0.3706988220892586, 'min_impurity_decrease': 0.2461135084596316, 'max_features': 0.942282608980667, 'subsample': 0.09841870525070902, 'dropout_rate': 0.6645857999864083, 'ccp_alpha': 0.2990177076902987}. Best is trial 618 with value: 0.783753686536768.[0m
[32m[I 2022-04-14 17:33:38,245][0m Trial 675 finished with value: 0.7771212925427334 and parameters: {'loss': 'coxph', 'learning_rate': 7.2217629686818534e-06, 'n_estimators': 876, 'criterion': 'friedman_mse', 'min_samples_split': 10, 'min_samples_leaf': 2, 'min_weight_fraction_leaf': 0.33352087273342207, 'min_impurity_decrease': 0.28287654375197213, 'max_features': 0.9594670398888752, 'subsample': 0.1184829468626854, 'dropout_rate': 0.5890468023549634, 'ccp_alpha': 0.1499992836644124}. Best is trial 618 with value: 0.783753686536768.[0m
[32m[I 2022-04-14 17:36:27,023][0m Trial 676 finished with value: 0.7801766455916246 and parameters: {'loss': 'coxph', 'learning_rate': 1.2118893660474709e-05, 'n_estimators': 901, 'criterion': 'friedman_mse', 'min_samples_split': 10, 'min_samples_leaf': 1, 'min_weight_fraction_leaf': 0.34883404325185485, 'min_impurity_decrease': 0.341021568257674, 'max_features': 0.9058724313114022, 'subsample': 0.058150255847900935, 'dropout_rate': 0.6279114775196564, 'ccp_alpha': 0.09488969922402804}. Best is trial 618 with value: 0.783753686536768.[0m
[32m[I 2022-04-14 17:38:32,723][0m Trial 677 finished with value: 0.7648131289267679 and parameters: {'loss': 'coxph', 'learning_rate': 9.088920686799359e-06, 'n_estimators': 796, 'criterion': 'friedman_mse', 'min_samples_split': 10, 'min_samples_leaf': 2, 'min_weight_fraction_leaf': 0.3053542097293375, 'min_impurity_decrease': 0.4268927183693943, 'max_features': 0.9210539819856207, 'subsample': 0.07846383330161248, 'dropout_rate': 0.7037068642831998, 'ccp_alpha': 0.2412363833683301}. Best is trial 618 with value: 0.783753686536768.[0m
[32m[I 2022-04-14 17:40:59,583][0m Trial 678 finished with value: 0.7795834789543875 and parameters: {'loss': 'coxph', 'learning_rate': 6.182503764229017e-06, 'n_estimators': 861, 'criterion': 'friedman_mse', 'min_samples_split': 10, 'min_samples_leaf': 2, 'min_weight_fraction_leaf': 0.36255986037058907, 'min_impurity_decrease': 0.3095308493935077, 'max_features': 0.9315275053747135, 'subsample': 0.15402094266823033, 'dropout_rate': 0.6485837639194708, 'ccp_alpha': 0.0017876973189226034}. Best is trial 618 with value: 0.783753686536768.[0m
[32m[I 2022-04-14 17:44:17,349][0m Trial 679 finished with value: 0.779919805235925 and parameters: {'loss': 'coxph', 'learning_rate': 7.901155814205721e-06, 'n_estimators': 949, 'criterion': 'friedman_mse', 'min_samples_split': 10, 'min_samples_leaf': 3, 'min_weight_fraction_leaf': 0.3237857697136322, 'min_impurity_decrease': 0.40282527414433045, 'max_features': 0.7046412178098411, 'subsample': 0.03747521930959606, 'dropout_rate': 0.6045662720882272, 'ccp_alpha': 0.09899332909094284}. Best is trial 618 with value: 0.783753686536768.[0m
[32m[I 2022-04-14 17:45:53,182][0m Trial 680 finished with value: -0.3650322602874478 and parameters: {'loss': 'squared', 'learning_rate': 3.709722536200783e-06, 'n_estimators': 826, 'criterion': 'friedman_mse', 'min_samples_split': 10, 'min_samples_leaf': 2, 'min_weight_fraction_leaf': 0.37295033115719245, 'min_impurity_decrease': 0.3568716501587274, 'max_features': 0.9642737573833011, 'subsample': 0.09547471964421149, 'dropout_rate': 0.5786879138635381, 'ccp_alpha': 0.17673290150291512}. Best is trial 618 with value: 0.783753686536768.[0m
[32m[I 2022-04-14 17:48:02,250][0m Trial 681 finished with value: 0.6176896489261299 and parameters: {'loss': 'coxph', 'learning_rate': 5.390015942604824e-06, 'n_estimators': 739, 'criterion': 'friedman_mse', 'min_samples_split': 7, 'min_samples_leaf': 2, 'min_weight_fraction_leaf': 0.3561171271935455, 'min_impurity_decrease': 0.28830029219060294, 'max_features': 0.7886782657911177, 'subsample': 0.06130386949259231, 'dropout_rate': 0.6173589656716049, 'ccp_alpha': 0.35229419775072207}. Best is trial 618 with value: 0.783753686536768.[0m
[32m[I 2022-04-14 17:51:04,940][0m Trial 682 finished with value: 0.7790436509315817 and parameters: {'loss': 'coxph', 'learning_rate': 1.161750671906058e-05, 'n_estimators': 910, 'criterion': 'friedman_mse', 'min_samples_split': 10, 'min_samples_leaf': 2, 'min_weight_fraction_leaf': 0.37117137385405613, 'min_impurity_decrease': 0.26232853067397055, 'max_features': 0.9011540559069336, 'subsample': 0.11966213079698378, 'dropout_rate': 0.5870828888062896, 'ccp_alpha': 0.09559537135191772}. Best is trial 618 with value: 0.783753686536768.[0m
[32m[I 2022-04-14 17:53:26,012][0m Trial 683 finished with value: 0.7723245039700175 and parameters: {'loss': 'coxph', 'learning_rate': 9.109838183598296e-06, 'n_estimators': 856, 'criterion': 'friedman_mse', 'min_samples_split': 10, 'min_samples_leaf': 1, 'min_weight_fraction_leaf': 0.346657088402484, 'min_impurity_decrease': 0.32925719642227563, 'max_features': 0.9751252738326549, 'subsample': 0.07850618671014026, 'dropout_rate': 0.6716688914857023, 'ccp_alpha': 0.22870094748809613}. Best is trial 618 with value: 0.783753686536768.[0m
[32m[I 2022-04-14 17:55:58,273][0m Trial 684 finished with value: 0.7815041049785176 and parameters: {'loss': 'coxph', 'learning_rate': 4.727372222968583e-06, 'n_estimators': 784, 'criterion': 'friedman_mse', 'min_samples_split': 10, 'min_samples_leaf': 2, 'min_weight_fraction_leaf': 0.34032759091215875, 'min_impurity_decrease': 0.30600955108544253, 'max_features': 0.9308271178099832, 'subsample': 0.05069560124114349, 'dropout_rate': 0.5456583827125248, 'ccp_alpha': 0.003153587227288073}. Best is trial 618 with value: 0.783753686536768.[0m
[32m[I 2022-04-14 17:58:16,690][0m Trial 685 finished with value: 0.7801519066428154 and parameters: {'loss': 'coxph', 'learning_rate': 3.1849969484877524e-06, 'n_estimators': 696, 'criterion': 'friedman_mse', 'min_samples_split': 10, 'min_samples_leaf': 2, 'min_weight_fraction_leaf': 0.2877755749151442, 'min_impurity_decrease': 0.2805804745047209, 'max_features': 0.9461333813919122, 'subsample': 0.021313256537328972, 'dropout_rate': 0.5326763555382436, 'ccp_alpha': 0.08664080003979789}. Best is trial 618 with value: 0.783753686536768.[0m
[32m[I 2022-04-14 18:00:41,532][0m Trial 686 finished with value: 0.7800155505431104 and parameters: {'loss': 'coxph', 'learning_rate': 4.488993798648187e-06, 'n_estimators': 714, 'criterion': 'friedman_mse', 'min_samples_split': 10, 'min_samples_leaf': 2, 'min_weight_fraction_leaf': 0.3263809374535488, 'min_impurity_decrease': 0.3008940621533176, 'max_features': 0.9327195262428455, 'subsample': 0.03849045717708667, 'dropout_rate': 0.5043309533568499, 'ccp_alpha': 0.09089987427642267}. Best is trial 618 with value: 0.783753686536768.[0m
[32m[I 2022-04-14 18:03:13,236][0m Trial 687 finished with value: 0.7797052677004856 and parameters: {'loss': 'coxph', 'learning_rate': 3.822806674125459e-06, 'n_estimators': 748, 'criterion': 'friedman_mse', 'min_samples_split': 10, 'min_samples_leaf': 3, 'min_weight_fraction_leaf': 0.33716847315941767, 'min_impurity_decrease': 0.25281805539971547, 'max_features': 0.9838907293436835, 'subsample': 0.02271752899198755, 'dropout_rate': 0.5394810730646535, 'ccp_alpha': 0.14200969109260664}. Best is trial 618 with value: 0.783753686536768.[0m
[32m[I 2022-04-14 18:05:56,400][0m Trial 688 finished with value: 0.7807790672919155 and parameters: {'loss': 'coxph', 'learning_rate': 4.874110587847632e-06, 'n_estimators': 781, 'criterion': 'friedman_mse', 'min_samples_split': 10, 'min_samples_leaf': 2, 'min_weight_fraction_leaf': 0.3407238836734807, 'min_impurity_decrease': 0.3031038049597646, 'max_features': 0.9437570315300245, 'subsample': 0.04652992781578588, 'dropout_rate': 0.5170467195966059, 'ccp_alpha': 0.0019756831564474346}. Best is trial 618 with value: 0.783753686536768.[0m
[32m[I 2022-04-14 18:08:33,009][0m Trial 689 finished with value: 0.7792081575672808 and parameters: {'loss': 'coxph', 'learning_rate': 5.47970697386304e-06, 'n_estimators': 799, 'criterion': 'friedman_mse', 'min_samples_split': 10, 'min_samples_leaf': 2, 'min_weight_fraction_leaf': 0.3316257837011593, 'min_impurity_decrease': 0.23215891433049318, 'max_features': 0.9987299207997158, 'subsample': 0.05550781464321719, 'dropout_rate': 0.5523272119347631, 'ccp_alpha': 0.1798498942941291}. Best is trial 618 with value: 0.783753686536768.[0m
