[32m[I 2022-04-13 12:29:58,846][0m Trial 638 finished with value: 0.7667120723440168 and parameters: {'splitter': 'best', 'min_samples_split': 0.10912469820031126, 'min_samples_leaf': 0.03726462478544827, 'min_weight_fraction_leaf': 0.0415737747439085, 'max_features': 0.9677437645418439}. Best is trial 241 with value: 0.7773840258827056.[0m
[32m[I 2022-04-13 12:30:00,371][0m Trial 639 finished with value: 0.7707970898310276 and parameters: {'splitter': 'best', 'min_samples_split': 0.15180102737585796, 'min_samples_leaf': 0.061897789904736045, 'min_weight_fraction_leaf': 0.026989481868126237, 'max_features': 0.9998808170973175}. Best is trial 241 with value: 0.7773840258827056.[0m
[32m[I 2022-04-13 12:30:03,524][0m Trial 640 finished with value: 0.7669973797317404 and parameters: {'splitter': 'best', 'min_samples_split': 0.13040950389671177, 'min_samples_leaf': 0.02582292365737837, 'min_weight_fraction_leaf': 5.890637767434238e-05, 'max_features': 0.9292044124340245}. Best is trial 241 with value: 0.7773840258827056.[0m
[32m[I 2022-04-13 12:30:06,494][0m Trial 641 finished with value: 0.7658141691084763 and parameters: {'splitter': 'best', 'min_samples_split': 0.07968031569125139, 'min_samples_leaf': 0.047353041556070494, 'min_weight_fraction_leaf': 0.015762705652458776, 'max_features': 0.9508146321905907}. Best is trial 241 with value: 0.7773840258827056.[0m
[32m[I 2022-04-13 12:30:08,791][0m Trial 642 finished with value: 0.7625420910982182 and parameters: {'splitter': 'best', 'min_samples_split': 0.1177011312028776, 'min_samples_leaf': 0.016622487041765298, 'min_weight_fraction_leaf': 0.05053147855603961, 'max_features': 0.9701961808227334}. Best is trial 241 with value: 0.7773840258827056.[0m
[32m[I 2022-04-13 12:30:10,247][0m Trial 643 finished with value: 0.773252350759495 and parameters: {'splitter': 'best', 'min_samples_split': 0.10124074509967906, 'min_samples_leaf': 0.035752352758060574, 'min_weight_fraction_leaf': 0.035478635376437063, 'max_features': 0.9999540969880465}. Best is trial 241 with value: 0.7773840258827056.[0m
[32m[I 2022-04-13 12:30:11,850][0m Trial 644 finished with value: 0.7669208247374579 and parameters: {'splitter': 'best', 'min_samples_split': 0.14156134287303965, 'min_samples_leaf': 0.053375161004502014, 'min_weight_fraction_leaf': 0.06947276119172094, 'max_features': 0.9798467094300635}. Best is trial 241 with value: 0.7773840258827056.[0m
[32m[I 2022-04-13 12:30:12,033][0m Trial 645 finished with value: 0.5 and parameters: {'splitter': 'best', 'min_samples_split': 0.12425493333935289, 'min_samples_leaf': 0.21864857375149124, 'min_weight_fraction_leaf': 0.02535333052322992, 'max_features': 0.026260775389275626}. Best is trial 241 with value: 0.7773840258827056.[0m
[32m[I 2022-04-13 12:30:12,581][0m Trial 646 finished with value: 0.7240867504306024 and parameters: {'splitter': 'best', 'min_samples_split': 0.11158660193381263, 'min_samples_leaf': 0.027516226524795375, 'min_weight_fraction_leaf': 0.015059905008825888, 'max_features': 0.5561019243196469}. Best is trial 241 with value: 0.7773840258827056.[0m
[32m[I 2022-04-13 12:30:13,608][0m Trial 647 finished with value: 0.7612114591819501 and parameters: {'splitter': 'best', 'min_samples_split': 0.08992005831376948, 'min_samples_leaf': 0.0767947094345722, 'min_weight_fraction_leaf': 0.04448177988662167, 'max_features': 0.8687462018670824}. Best is trial 241 with value: 0.7773840258827056.[0m
[32m[I 2022-04-13 12:30:15,595][0m Trial 648 finished with value: 0.7675898326179493 and parameters: {'splitter': 'best', 'min_samples_split': 0.1288292051049189, 'min_samples_leaf': 0.042291457847559194, 'min_weight_fraction_leaf': 0.009817237210666513, 'max_features': 0.9384271754870109}. Best is trial 241 with value: 0.7773840258827056.[0m
[32m[I 2022-04-13 12:30:19,993][0m Trial 649 finished with value: 0.7653858318744305 and parameters: {'splitter': 'best', 'min_samples_split': 0.09893103931711807, 'min_samples_leaf': 0.008311407909524796, 'min_weight_fraction_leaf': 0.05779210532911906, 'max_features': 0.9606060344855661}. Best is trial 241 with value: 0.7773840258827056.[0m
[32m[I 2022-04-13 12:30:21,634][0m Trial 650 finished with value: 0.7627850284076624 and parameters: {'splitter': 'best', 'min_samples_split': 0.14496643577491922, 'min_samples_leaf': 0.058571909504926925, 'min_weight_fraction_leaf': 0.03209668981438613, 'max_features': 0.9101163818752454}. Best is trial 241 with value: 0.7773840258827056.[0m
[32m[I 2022-04-13 12:30:23,952][0m Trial 651 finished with value: 0.7756495717727214 and parameters: {'splitter': 'best', 'min_samples_split': 0.11254669695316069, 'min_samples_leaf': 0.020773485784555644, 'min_weight_fraction_leaf': 0.02354940202588512, 'max_features': 0.982395955391787}. Best is trial 241 with value: 0.7773840258827056.[0m
[32m[I 2022-04-13 12:30:26,719][0m Trial 652 finished with value: 0.7723474458034836 and parameters: {'splitter': 'best', 'min_samples_split': 0.060138592781426976, 'min_samples_leaf': 0.0011932003553216455, 'min_weight_fraction_leaf': 0.017473634698036186, 'max_features': 0.9645926764095832}. Best is trial 241 with value: 0.7773840258827056.[0m
[32m[I 2022-04-13 12:30:26,912][0m Trial 653 finished with value: 0.7483114040876906 and parameters: {'splitter': 'random', 'min_samples_split': 0.1307777344884826, 'min_samples_leaf': 0.015497044398862622, 'min_weight_fraction_leaf': 0.021679156743442892, 'max_features': 0.9843667684111693}. Best is trial 241 with value: 0.7773840258827056.[0m
[32m[I 2022-04-13 12:30:29,032][0m Trial 654 finished with value: 0.7709953958550793 and parameters: {'splitter': 'best', 'min_samples_split': 0.07400507665854557, 'min_samples_leaf': 0.025938085780069748, 'min_weight_fraction_leaf': 0.0001419156596523339, 'max_features': 0.9452240515978727}. Best is trial 241 with value: 0.7773840258827056.[0m
[32m[I 2022-04-13 12:30:30,723][0m Trial 655 finished with value: 0.7418492426728784 and parameters: {'splitter': 'best', 'min_samples_split': 0.10838457787347823, 'min_samples_leaf': 0.019335585581013316, 'min_weight_fraction_leaf': 0.009405086955783994, 'max_features': 0.7860741506382638}. Best is trial 241 with value: 0.7773840258827056.[0m
[32m[I 2022-04-13 12:30:31,105][0m Trial 656 finished with value: 0.7289678546268679 and parameters: {'splitter': 'best', 'min_samples_split': 0.40407414226388594, 'min_samples_leaf': 0.2916291930757319, 'min_weight_fraction_leaf': 0.041859674500483425, 'max_features': 0.9826244228125296}. Best is trial 241 with value: 0.7773840258827056.[0m
[32m[I 2022-04-13 12:30:32,965][0m Trial 657 finished with value: 0.7657381951635353 and parameters: {'splitter': 'best', 'min_samples_split': 0.12048299406604202, 'min_samples_leaf': 0.04338255396470313, 'min_weight_fraction_leaf': 0.024690890124520186, 'max_features': 0.9625191570030864}. Best is trial 241 with value: 0.7773840258827056.[0m
[32m[I 2022-04-13 12:30:34,752][0m Trial 658 finished with value: 0.7649997455154274 and parameters: {'splitter': 'best', 'min_samples_split': 0.15717628283568486, 'min_samples_leaf': 0.03710615281715213, 'min_weight_fraction_leaf': 0.0514766325858838, 'max_features': 0.9986492727924698}. Best is trial 241 with value: 0.7773840258827056.[0m
[32m[I 2022-04-13 12:30:37,799][0m Trial 659 finished with value: 0.7691420907331364 and parameters: {'splitter': 'best', 'min_samples_split': 0.08973645950453531, 'min_samples_leaf': 0.05008656861239791, 'min_weight_fraction_leaf': 0.03631162490625671, 'max_features': 0.9245919713673337}. Best is trial 241 with value: 0.7773840258827056.[0m
[32m[I 2022-04-13 12:30:41,787][0m Trial 660 finished with value: 0.7621967485594663 and parameters: {'splitter': 'best', 'min_samples_split': 0.136875562450162, 'min_samples_leaf': 0.011433032153055621, 'min_weight_fraction_leaf': 0.008765051258798378, 'max_features': 0.954645478573986}. Best is trial 241 with value: 0.7773840258827056.[0m
[32m[I 2022-04-13 12:30:42,860][0m Trial 661 finished with value: 0.7311299333039226 and parameters: {'splitter': 'best', 'min_samples_split': 0.42467134388655736, 'min_samples_leaf': 0.06538676257421316, 'min_weight_fraction_leaf': 0.01718270056717181, 'max_features': 0.979893648791763}. Best is trial 241 with value: 0.7773840258827056.[0m
[32m[I 2022-04-13 12:30:45,622][0m Trial 662 finished with value: 0.7724858570084804 and parameters: {'splitter': 'best', 'min_samples_split': 0.10975486926032646, 'min_samples_leaf': 0.034523944402745525, 'min_weight_fraction_leaf': 0.06323597175898389, 'max_features': 0.9989666738584637}. Best is trial 241 with value: 0.7773840258827056.[0m
[32m[I 2022-04-13 12:30:48,438][0m Trial 663 finished with value: 0.7675903003763844 and parameters: {'splitter': 'best', 'min_samples_split': 0.0021073956057121868, 'min_samples_leaf': 0.021126956740011745, 'min_weight_fraction_leaf': 0.028241762109405693, 'max_features': 0.9996774697328977}. Best is trial 241 with value: 0.7773840258827056.[0m
[32m[I 2022-04-13 12:30:50,173][0m Trial 664 finished with value: 0.7658114612321618 and parameters: {'splitter': 'best', 'min_samples_split': 0.10126247066791125, 'min_samples_leaf': 0.04883618427273646, 'min_weight_fraction_leaf': 0.047547458032520556, 'max_features': 0.9673305943208406}. Best is trial 241 with value: 0.7773840258827056.[0m
[32m[I 2022-04-13 12:30:52,941][0m Trial 665 finished with value: 0.7650510938164405 and parameters: {'splitter': 'best', 'min_samples_split': 0.12395710666717004, 'min_samples_leaf': 0.03160198377539002, 'min_weight_fraction_leaf': 0.03392887554101039, 'max_features': 0.9476672501407459}. Best is trial 241 with value: 0.7773840258827056.[0m
[32m[I 2022-04-13 12:30:55,412][0m Trial 666 finished with value: 0.7619076894521151 and parameters: {'splitter': 'best', 'min_samples_split': 0.1672255425167044, 'min_samples_leaf': 0.055853283082042376, 'min_weight_fraction_leaf': 0.017590944586740744, 'max_features': 0.9695827562619381}. Best is trial 241 with value: 0.7773840258827056.[0m
[32m[I 2022-04-13 12:30:57,636][0m Trial 667 finished with value: 0.762257482873107 and parameters: {'splitter': 'best', 'min_samples_split': 0.13527703529934734, 'min_samples_leaf': 0.04192433072913372, 'min_weight_fraction_leaf': 0.04136438585646729, 'max_features': 0.932266525234864}. Best is trial 241 with value: 0.7773840258827056.[0m
[32m[I 2022-04-13 12:30:59,781][0m Trial 668 finished with value: 0.7756527983730543 and parameters: {'splitter': 'best', 'min_samples_split': 0.11769030480745174, 'min_samples_leaf': 0.024127465891143177, 'min_weight_fraction_leaf': 0.02464972305564415, 'max_features': 0.9830426519818569}. Best is trial 241 with value: 0.7773840258827056.[0m
[32m[I 2022-04-13 12:31:01,552][0m Trial 669 finished with value: 0.7708612625826594 and parameters: {'splitter': 'best', 'min_samples_split': 0.15052063345454741, 'min_samples_leaf': 0.007330651854807468, 'min_weight_fraction_leaf': 0.053875361501759395, 'max_features': 0.9802596880267482}. Best is trial 241 with value: 0.7773840258827056.[0m
[32m[I 2022-04-13 12:31:02,997][0m Trial 670 finished with value: 0.5930040131485143 and parameters: {'splitter': 'best', 'min_samples_split': 0.019602304438789728, 'min_samples_leaf': 0.012810632456813673, 'min_weight_fraction_leaf': 0.34227687696238923, 'max_features': 0.9510041056653514}. Best is trial 241 with value: 0.7773840258827056.[0m
[32m[I 2022-04-13 12:31:05,643][0m Trial 671 finished with value: 0.775381986947632 and parameters: {'splitter': 'best', 'min_samples_split': 0.12333293072733413, 'min_samples_leaf': 0.02348783605795367, 'min_weight_fraction_leaf': 0.037530970536353694, 'max_features': 0.9997424531103982}. Best is trial 241 with value: 0.7773840258827056.[0m
[32m[I 2022-04-13 12:31:07,320][0m Trial 672 finished with value: 0.7744622125684593 and parameters: {'splitter': 'best', 'min_samples_split': 0.13953754639324806, 'min_samples_leaf': 0.0155216962686032, 'min_weight_fraction_leaf': 0.0460730473934525, 'max_features': 0.9824132178954518}. Best is trial 241 with value: 0.7773840258827056.[0m
[32m[I 2022-04-13 12:31:07,540][0m Trial 673 finished with value: 0.7302908609625185 and parameters: {'splitter': 'random', 'min_samples_split': 0.12926580736004514, 'min_samples_leaf': 0.007296953952977608, 'min_weight_fraction_leaf': 0.05899108457001267, 'max_features': 0.9999019392672367}. Best is trial 241 with value: 0.7773840258827056.[0m
[32m[I 2022-04-13 12:31:09,150][0m Trial 674 finished with value: 0.7635656406608312 and parameters: {'splitter': 'best', 'min_samples_split': 0.14449491134119824, 'min_samples_leaf': 0.020776436208530584, 'min_weight_fraction_leaf': 0.07225021329237051, 'max_features': 0.9674710825139}. Best is trial 241 with value: 0.7773840258827056.[0m
[32m[I 2022-04-13 12:31:10,603][0m Trial 675 finished with value: 0.7743357091866996 and parameters: {'splitter': 'best', 'min_samples_split': 0.12145623010108629, 'min_samples_leaf': 0.026337632357147433, 'min_weight_fraction_leaf': 0.03909498674780367, 'max_features': 0.9995237627749735}. Best is trial 241 with value: 0.7773840258827056.[0m
[32m[I 2022-04-13 12:31:13,982][0m Trial 676 finished with value: 0.7656225480602655 and parameters: {'splitter': 'best', 'min_samples_split': 0.13409662027461675, 'min_samples_leaf': 0.0028614820980191052, 'min_weight_fraction_leaf': 0.04895168261770484, 'max_features': 0.9671838444137055}. Best is trial 241 with value: 0.7773840258827056.[0m
[32m[I 2022-04-13 12:31:16,932][0m Trial 677 finished with value: 0.7524753068310986 and parameters: {'splitter': 'best', 'min_samples_split': 0.12517784562855291, 'min_samples_leaf': 0.021121313120224056, 'min_weight_fraction_leaf': 0.03300012811311853, 'max_features': 0.7325546077521802}. Best is trial 241 with value: 0.7773840258827056.[0m
[32m[I 2022-04-13 12:31:19,302][0m Trial 678 finished with value: 0.7754733840489538 and parameters: {'splitter': 'best', 'min_samples_split': 0.11866410212836893, 'min_samples_leaf': 0.017521818014175267, 'min_weight_fraction_leaf': 0.03489970956724036, 'max_features': 0.9811886256022974}. Best is trial 241 with value: 0.7773840258827056.[0m
[32m[I 2022-04-13 12:31:21,310][0m Trial 679 finished with value: 0.7449254148246496 and parameters: {'splitter': 'best', 'min_samples_split': 0.1159627059959614, 'min_samples_leaf': 0.010758961878297954, 'min_weight_fraction_leaf': 0.06124426995948949, 'max_features': 0.7072618238862911}. Best is trial 241 with value: 0.7773840258827056.[0m
[32m[I 2022-04-13 12:31:22,838][0m Trial 680 finished with value: 0.7701979816209147 and parameters: {'splitter': 'best', 'min_samples_split': 0.10094684055927668, 'min_samples_leaf': 0.014774755042164179, 'min_weight_fraction_leaf': 0.04481541211735774, 'max_features': 0.9411465351061025}. Best is trial 241 with value: 0.7773840258827056.[0m
[32m[I 2022-04-13 12:31:26,170][0m Trial 681 finished with value: 0.7708501802721416 and parameters: {'splitter': 'best', 'min_samples_split': 0.11748505598915847, 'min_samples_leaf': 0.004876564498915256, 'min_weight_fraction_leaf': 0.054050482052029857, 'max_features': 0.9836998387749144}. Best is trial 241 with value: 0.7773840258827056.[0m
[32m[I 2022-04-13 12:31:27,253][0m Trial 682 finished with value: 0.6902123269228779 and parameters: {'splitter': 'best', 'min_samples_split': 0.10621554550818638, 'min_samples_leaf': 0.011879345781509908, 'min_weight_fraction_leaf': 0.04192271232576483, 'max_features': 0.27197337934574517}. Best is trial 241 with value: 0.7773840258827056.[0m
[32m[I 2022-04-13 12:31:27,978][0m Trial 683 finished with value: 0.6354877979517285 and parameters: {'splitter': 'best', 'min_samples_split': 0.08433682023536324, 'min_samples_leaf': 0.26859081569066345, 'min_weight_fraction_leaf': 0.03530458072074444, 'max_features': 0.9581359644333477}. Best is trial 241 with value: 0.7773840258827056.[0m
[32m[I 2022-04-13 12:31:29,834][0m Trial 684 finished with value: 0.7613792572785766 and parameters: {'splitter': 'best', 'min_samples_split': 0.210637528545326, 'min_samples_leaf': 0.020940334913591457, 'min_weight_fraction_leaf': 0.037904954176168716, 'max_features': 0.999509363928627}. Best is trial 241 with value: 0.7773840258827056.[0m
[32m[I 2022-04-13 12:31:32,135][0m Trial 685 finished with value: 0.7636778954371168 and parameters: {'splitter': 'best', 'min_samples_split': 0.12258201340496624, 'min_samples_leaf': 0.023455631462570417, 'min_weight_fraction_leaf': 0.052809475188392414, 'max_features': 0.9702040889622143}. Best is trial 241 with value: 0.7773840258827056.[0m
[32m[I 2022-04-13 12:31:34,319][0m Trial 686 finished with value: 0.7639806789565652 and parameters: {'splitter': 'best', 'min_samples_split': 0.11226795206009176, 'min_samples_leaf': 0.026261260151795522, 'min_weight_fraction_leaf': 0.031285927878155234, 'max_features': 0.9191927263830605}. Best is trial 241 with value: 0.7773840258827056.[0m
[32m[I 2022-04-13 12:31:36,573][0m Trial 687 finished with value: 0.766913753733654 and parameters: {'splitter': 'best', 'min_samples_split': 0.09749216585240586, 'min_samples_leaf': 0.018902685944153095, 'min_weight_fraction_leaf': 0.06939964155856088, 'max_features': 0.9494405611860218}. Best is trial 241 with value: 0.7773840258827056.[0m
[32m[I 2022-04-13 12:31:38,542][0m Trial 688 finished with value: 0.7729551356512465 and parameters: {'splitter': 'best', 'min_samples_split': 0.1296118066415592, 'min_samples_leaf': 0.0029131513094384463, 'min_weight_fraction_leaf': 0.04571072889205507, 'max_features': 0.9833971496565157}. Best is trial 241 with value: 0.7773840258827056.[0m
[32m[I 2022-04-13 12:31:38,995][0m Trial 689 finished with value: 0.6551109689187437 and parameters: {'splitter': 'best', 'min_samples_split': 0.12154272587561474, 'min_samples_leaf': 0.030553524686293805, 'min_weight_fraction_leaf': 0.027590670157585876, 'max_features': 0.3821777796163757}. Best is trial 241 with value: 0.7773840258827056.[0m
[32m[I 2022-04-13 12:31:41,456][0m Trial 690 finished with value: 0.770042804592184 and parameters: {'splitter': 'best', 'min_samples_split': 0.1059463573404692, 'min_samples_leaf': 0.016202674104578742, 'min_weight_fraction_leaf': 0.055171383705919785, 'max_features': 0.9999754896265506}. Best is trial 241 with value: 0.7773840258827056.[0m
[32m[I 2022-04-13 12:31:43,067][0m Trial 691 finished with value: 0.7635813716040067 and parameters: {'splitter': 'best', 'min_samples_split': 0.09509599825805246, 'min_samples_leaf': 0.02968251044410638, 'min_weight_fraction_leaf': 0.03907517193721054, 'max_features': 0.96666009606317}. Best is trial 241 with value: 0.7773840258827056.[0m
[32m[I 2022-04-13 12:31:43,478][0m Trial 692 finished with value: 0.7501905172071934 and parameters: {'splitter': 'random', 'min_samples_split': 0.11443304205423699, 'min_samples_leaf': 0.025064962354674033, 'min_weight_fraction_leaf': 0.027464513412249418, 'max_features': 0.9803092131826462}. Best is trial 241 with value: 0.7773840258827056.[0m
[32m[I 2022-04-13 12:31:46,394][0m Trial 693 finished with value: 0.768729638810951 and parameters: {'splitter': 'best', 'min_samples_split': 0.07052556644296683, 'min_samples_leaf': 0.011294774833646208, 'min_weight_fraction_leaf': 0.04634357270624005, 'max_features': 0.9332759343345176}. Best is trial 241 with value: 0.7773840258827056.[0m
[32m[I 2022-04-13 12:31:48,681][0m Trial 694 finished with value: 0.7645107703413699 and parameters: {'splitter': 'best', 'min_samples_split': 0.1281403212531768, 'min_samples_leaf': 0.03350170061372683, 'min_weight_fraction_leaf': 0.0628833927218205, 'max_features': 0.9543990949429048}. Best is trial 241 with value: 0.7773840258827056.[0m
[32m[I 2022-04-13 12:31:49,667][0m Trial 695 finished with value: 0.7710939707278462 and parameters: {'splitter': 'best', 'min_samples_split': 0.11712029551954065, 'min_samples_leaf': 0.020554410897535746, 'min_weight_fraction_leaf': 0.0775260002777077, 'max_features': 0.9993663608829519}. Best is trial 241 with value: 0.7773840258827056.[0m
[32m[I 2022-04-13 12:31:50,538][0m Trial 696 finished with value: 0.7109837781625641 and parameters: {'splitter': 'best', 'min_samples_split': 0.09079974885736007, 'min_samples_leaf': 0.03375469318631419, 'min_weight_fraction_leaf': 0.20815407130372643, 'max_features': 0.9688364223579565}. Best is trial 241 with value: 0.7773840258827056.[0m
[32m[I 2022-04-13 12:31:52,508][0m Trial 697 finished with value: 0.7677854910918248 and parameters: {'splitter': 'best', 'min_samples_split': 0.03849799379833349, 'min_samples_leaf': 0.03077281534434237, 'min_weight_fraction_leaf': 0.03517115851346504, 'max_features': 0.9816912247564371}. Best is trial 241 with value: 0.7773840258827056.[0m
[32m[I 2022-04-13 12:31:54,889][0m Trial 698 finished with value: 0.7690166980476587 and parameters: {'splitter': 'best', 'min_samples_split': 0.13228400049915298, 'min_samples_leaf': 0.014549044195464338, 'min_weight_fraction_leaf': 0.02296924423697072, 'max_features': 0.8991100635326092}. Best is trial 241 with value: 0.7773840258827056.[0m
[32m[I 2022-04-13 12:31:57,744][0m Trial 699 finished with value: 0.7666334300202813 and parameters: {'splitter': 'best', 'min_samples_split': 0.1041284465793192, 'min_samples_leaf': 0.023367152027664796, 'min_weight_fraction_leaf': 0.02895884949426852, 'max_features': 0.9493317585051703}. Best is trial 241 with value: 0.7773840258827056.[0m
[32m[I 2022-04-13 12:32:01,372][0m Trial 700 finished with value: 0.7629400457521286 and parameters: {'splitter': 'best', 'min_samples_split': 0.12271909796210358, 'min_samples_leaf': 0.0010730052049873484, 'min_weight_fraction_leaf': 0.04564538403050429, 'max_features': 0.967349941572155}. Best is trial 241 with value: 0.7773840258827056.[0m
