[32m[I 2022-04-13 11:52:03,304][0m Trial 370 finished with value: 0.5371812073302544 and parameters: {'splitter': 'best', 'min_samples_split': 0.11985376249989167, 'min_samples_leaf': 0.34521379649013617, 'min_weight_fraction_leaf': 0.034857763628478144, 'max_features': 0.9808918935101135}. Best is trial 201 with value: 0.8881217621713932.[0m
[32m[I 2022-04-13 11:52:05,573][0m Trial 371 finished with value: 0.8817095879923034 and parameters: {'splitter': 'best', 'min_samples_split': 0.13822864668930307, 'min_samples_leaf': 0.06495898393598311, 'min_weight_fraction_leaf': 0.06009730316695809, 'max_features': 0.9520675965315348}. Best is trial 201 with value: 0.8881217621713932.[0m
[32m[I 2022-04-13 11:52:06,136][0m Trial 372 finished with value: 0.873063946102578 and parameters: {'splitter': 'random', 'min_samples_split': 0.09233393368662897, 'min_samples_leaf': 0.029118559070432842, 'min_weight_fraction_leaf': 0.04900537133069964, 'max_features': 0.999185448744731}. Best is trial 201 with value: 0.8881217621713932.[0m
/media/san2_ssd/data/Workdir/survival/utils.py:305: RuntimeWarning: invalid value encountered in true_divide
  pdfs = np.gradient(1-survs,axis=1)/norms
/media/san2_ssd/data/Workdir/survival/utils.py:305: RuntimeWarning: invalid value encountered in true_divide
  pdfs = np.gradient(1-survs,axis=1)/norms
/media/san2_ssd/data/Workdir/survival/utils.py:305: RuntimeWarning: invalid value encountered in true_divide
  pdfs = np.gradient(1-survs,axis=1)/norms
/media/san2_ssd/data/Workdir/survival/utils.py:305: RuntimeWarning: invalid value encountered in true_divide
  pdfs = np.gradient(1-survs,axis=1)/norms
/media/san2_ssd/data/Workdir/survival/utils.py:305: RuntimeWarning: invalid value encountered in true_divide
  pdfs = np.gradient(1-survs,axis=1)/norms
[32m[I 2022-04-13 11:52:08,776][0m Trial 373 finished with value: 0.8831770149002848 and parameters: {'splitter': 'best', 'min_samples_split': 0.10779789167516125, 'min_samples_leaf': 0.044552632335899546, 'min_weight_fraction_leaf': 0.019644604328094496, 'max_features': 0.9687836891516836}. Best is trial 201 with value: 0.8881217621713932.[0m
[32m[I 2022-04-13 11:52:09,879][0m Trial 374 finished with value: 0.5371812073302544 and parameters: {'splitter': 'best', 'min_samples_split': 0.1227855781467458, 'min_samples_leaf': 0.019533978040508965, 'min_weight_fraction_leaf': 0.36073191517469194, 'max_features': 0.9994556636024148}. Best is trial 201 with value: 0.8881217621713932.[0m
/media/san2_ssd/data/Workdir/survival/utils.py:305: RuntimeWarning: invalid value encountered in true_divide
  pdfs = np.gradient(1-survs,axis=1)/norms
/media/san2_ssd/data/Workdir/survival/utils.py:305: RuntimeWarning: invalid value encountered in true_divide
  pdfs = np.gradient(1-survs,axis=1)/norms
/media/san2_ssd/data/Workdir/survival/utils.py:305: RuntimeWarning: invalid value encountered in true_divide
  pdfs = np.gradient(1-survs,axis=1)/norms
/media/san2_ssd/data/Workdir/survival/utils.py:305: RuntimeWarning: invalid value encountered in true_divide
  pdfs = np.gradient(1-survs,axis=1)/norms
/media/san2_ssd/data/Workdir/survival/utils.py:305: RuntimeWarning: invalid value encountered in true_divide
  pdfs = np.gradient(1-survs,axis=1)/norms
[32m[I 2022-04-13 11:52:12,359][0m Trial 375 finished with value: 0.8869778639861845 and parameters: {'splitter': 'best', 'min_samples_split': 0.1020960732481057, 'min_samples_leaf': 0.01002628029357418, 'min_weight_fraction_leaf': 0.032893325138595116, 'max_features': 0.9805007485099732}. Best is trial 201 with value: 0.8881217621713932.[0m
[32m[I 2022-04-13 11:52:13,164][0m Trial 376 finished with value: 0.5474145173769144 and parameters: {'splitter': 'best', 'min_samples_split': 0.08892136970725034, 'min_samples_leaf': 0.23557193811452176, 'min_weight_fraction_leaf': 0.030630154254037936, 'max_features': 0.9225684392598895}. Best is trial 201 with value: 0.8881217621713932.[0m
/media/san2_ssd/data/Workdir/survival/utils.py:305: RuntimeWarning: invalid value encountered in true_divide
  pdfs = np.gradient(1-survs,axis=1)/norms
/media/san2_ssd/data/Workdir/survival/utils.py:305: RuntimeWarning: invalid value encountered in true_divide
  pdfs = np.gradient(1-survs,axis=1)/norms
/media/san2_ssd/data/Workdir/survival/utils.py:305: RuntimeWarning: invalid value encountered in true_divide
  pdfs = np.gradient(1-survs,axis=1)/norms
/media/san2_ssd/data/Workdir/survival/utils.py:305: RuntimeWarning: invalid value encountered in true_divide
  pdfs = np.gradient(1-survs,axis=1)/norms
[32m[I 2022-04-13 11:52:15,921][0m Trial 377 finished with value: 0.8836623610584986 and parameters: {'splitter': 'best', 'min_samples_split': 0.10477321874686844, 'min_samples_leaf': 0.007668576489322379, 'min_weight_fraction_leaf': 0.02162906608150165, 'max_features': 0.943274820180325}. Best is trial 201 with value: 0.8881217621713932.[0m
/media/san2_ssd/data/Workdir/survival/utils.py:305: RuntimeWarning: invalid value encountered in true_divide
  pdfs = np.gradient(1-survs,axis=1)/norms
/media/san2_ssd/data/Workdir/survival/utils.py:305: RuntimeWarning: invalid value encountered in true_divide
  pdfs = np.gradient(1-survs,axis=1)/norms
/media/san2_ssd/data/Workdir/survival/utils.py:305: RuntimeWarning: invalid value encountered in true_divide
  pdfs = np.gradient(1-survs,axis=1)/norms
/media/san2_ssd/data/Workdir/survival/utils.py:305: RuntimeWarning: invalid value encountered in true_divide
  pdfs = np.gradient(1-survs,axis=1)/norms
/media/san2_ssd/data/Workdir/survival/utils.py:305: RuntimeWarning: invalid value encountered in true_divide
  pdfs = np.gradient(1-survs,axis=1)/norms
[32m[I 2022-04-13 11:52:19,306][0m Trial 378 finished with value: 0.8821907357423088 and parameters: {'splitter': 'best', 'min_samples_split': 0.09759110346682472, 'min_samples_leaf': 0.008478186776204929, 'min_weight_fraction_leaf': 0.035277205386206024, 'max_features': 0.967659320978047}. Best is trial 201 with value: 0.8881217621713932.[0m
[32m[I 2022-04-13 11:52:22,023][0m Trial 379 finished with value: 0.5800971093215547 and parameters: {'splitter': 'best', 'min_samples_split': 0.11071856529856634, 'min_samples_leaf': 0.0015920810643755001, 'min_weight_fraction_leaf': 0.18623930217089113, 'max_features': 0.9795298088473392}. Best is trial 201 with value: 0.8881217621713932.[0m
[32m[I 2022-04-13 11:52:24,242][0m Trial 380 finished with value: 0.4584695393066511 and parameters: {'splitter': 'best', 'min_samples_split': 0.4374465419212486, 'min_samples_leaf': 0.03354858472146542, 'min_weight_fraction_leaf': 0.025179397472423273, 'max_features': 0.9556262165425138}. Best is trial 201 with value: 0.8881217621713932.[0m
/media/san2_ssd/data/Workdir/survival/utils.py:305: RuntimeWarning: invalid value encountered in true_divide
  pdfs = np.gradient(1-survs,axis=1)/norms
/media/san2_ssd/data/Workdir/survival/utils.py:305: RuntimeWarning: invalid value encountered in true_divide
  pdfs = np.gradient(1-survs,axis=1)/norms
/media/san2_ssd/data/Workdir/survival/utils.py:305: RuntimeWarning: invalid value encountered in true_divide
  pdfs = np.gradient(1-survs,axis=1)/norms
/media/san2_ssd/data/Workdir/survival/utils.py:305: RuntimeWarning: invalid value encountered in true_divide
  pdfs = np.gradient(1-survs,axis=1)/norms
[32m[I 2022-04-13 11:52:26,513][0m Trial 381 finished with value: 0.8842977228723813 and parameters: {'splitter': 'best', 'min_samples_split': 0.08179094810383064, 'min_samples_leaf': 0.028075873523100724, 'min_weight_fraction_leaf': 0.03655130435668939, 'max_features': 0.9817942113509271}. Best is trial 201 with value: 0.8881217621713932.[0m
[32m[I 2022-04-13 11:52:28,321][0m Trial 382 finished with value: 0.46304589466485996 and parameters: {'splitter': 'best', 'min_samples_split': 0.3141618907037381, 'min_samples_leaf': 0.04112689656266398, 'min_weight_fraction_leaf': 0.017420473112936073, 'max_features': 0.9366853716442632}. Best is trial 201 with value: 0.8881217621713932.[0m
[32m[I 2022-04-13 11:52:29,273][0m Trial 383 finished with value: 0.45835385819045193 and parameters: {'splitter': 'best', 'min_samples_split': 0.09970365218833732, 'min_samples_leaf': 0.16707337189735644, 'min_weight_fraction_leaf': 0.027891865861525235, 'max_features': 0.9653960262625576}. Best is trial 201 with value: 0.8881217621713932.[0m
[32m[I 2022-04-13 11:52:29,906][0m Trial 384 finished with value: 0.5798788386831745 and parameters: {'splitter': 'best', 'min_samples_split': 0.11349797526542654, 'min_samples_leaf': 0.1341614035805691, 'min_weight_fraction_leaf': 0.04258239949835547, 'max_features': 0.9820033412383493}. Best is trial 201 with value: 0.8881217621713932.[0m
/media/san2_ssd/data/Workdir/survival/utils.py:305: RuntimeWarning: invalid value encountered in true_divide
  pdfs = np.gradient(1-survs,axis=1)/norms
/media/san2_ssd/data/Workdir/survival/utils.py:305: RuntimeWarning: invalid value encountered in true_divide
  pdfs = np.gradient(1-survs,axis=1)/norms
[32m[I 2022-04-13 11:52:33,056][0m Trial 385 finished with value: 0.882415722066046 and parameters: {'splitter': 'best', 'min_samples_split': 0.1325222818062352, 'min_samples_leaf': 0.018577191570383084, 'min_weight_fraction_leaf': 0.018206986127556984, 'max_features': 0.9526423136741022}. Best is trial 201 with value: 0.8881217621713932.[0m
[32m[I 2022-04-13 11:52:36,314][0m Trial 386 finished with value: 0.788161647392147 and parameters: {'splitter': 'best', 'min_samples_split': 0.15285287896242442, 'min_samples_leaf': 0.01082810037884814, 'min_weight_fraction_leaf': 0.006642487859241524, 'max_features': 0.9997529802451209}. Best is trial 201 with value: 0.8881217621713932.[0m
/media/san2_ssd/data/Workdir/survival/utils.py:305: RuntimeWarning: invalid value encountered in true_divide
  pdfs = np.gradient(1-survs,axis=1)/norms
/media/san2_ssd/data/Workdir/survival/utils.py:305: RuntimeWarning: invalid value encountered in true_divide
  pdfs = np.gradient(1-survs,axis=1)/norms
/media/san2_ssd/data/Workdir/survival/utils.py:305: RuntimeWarning: invalid value encountered in true_divide
  pdfs = np.gradient(1-survs,axis=1)/norms
/media/san2_ssd/data/Workdir/survival/utils.py:305: RuntimeWarning: invalid value encountered in true_divide
  pdfs = np.gradient(1-survs,axis=1)/norms
/media/san2_ssd/data/Workdir/survival/utils.py:305: RuntimeWarning: invalid value encountered in true_divide
  pdfs = np.gradient(1-survs,axis=1)/norms
[32m[I 2022-04-13 11:52:38,734][0m Trial 387 finished with value: 0.8845846950615062 and parameters: {'splitter': 'best', 'min_samples_split': 0.09135773211232767, 'min_samples_leaf': 0.031143099652209863, 'min_weight_fraction_leaf': 0.0316442296826413, 'max_features': 0.9801417183912674}. Best is trial 201 with value: 0.8881217621713932.[0m
[32m[I 2022-04-13 11:52:40,010][0m Trial 388 finished with value: 0.8631490127271391 and parameters: {'splitter': 'best', 'min_samples_split': 0.1053224349497776, 'min_samples_leaf': 0.04872959129317132, 'min_weight_fraction_leaf': 0.05698266977518847, 'max_features': 0.5529586555118798}. Best is trial 201 with value: 0.8881217621713932.[0m
[32m[I 2022-04-13 11:52:43,332][0m Trial 389 finished with value: 0.45990368619997335 and parameters: {'splitter': 'best', 'min_samples_split': 0.34677739215377174, 'min_samples_leaf': 0.018486749331861316, 'min_weight_fraction_leaf': 0.04340448332300015, 'max_features': 0.9690881225856007}. Best is trial 201 with value: 0.8881217621713932.[0m
/media/san2_ssd/data/Workdir/survival/utils.py:305: RuntimeWarning: invalid value encountered in true_divide
  pdfs = np.gradient(1-survs,axis=1)/norms
/media/san2_ssd/data/Workdir/survival/utils.py:305: RuntimeWarning: invalid value encountered in true_divide
  pdfs = np.gradient(1-survs,axis=1)/norms
/media/san2_ssd/data/Workdir/survival/utils.py:305: RuntimeWarning: invalid value encountered in true_divide
  pdfs = np.gradient(1-survs,axis=1)/norms
[32m[I 2022-04-13 11:52:44,766][0m Trial 390 finished with value: 0.8827408362504375 and parameters: {'splitter': 'best', 'min_samples_split': 0.12373494302662315, 'min_samples_leaf': 0.03822486147066517, 'min_weight_fraction_leaf': 0.029026337827344484, 'max_features': 0.9221115677003052}. Best is trial 201 with value: 0.8881217621713932.[0m
[32m[I 2022-04-13 11:52:44,972][0m Trial 391 finished with value: 0.6828302216966866 and parameters: {'splitter': 'random', 'min_samples_split': 0.1134971923374602, 'min_samples_leaf': 0.0279161795068872, 'min_weight_fraction_leaf': 0.013852135717730751, 'max_features': 0.5193237470222858}. Best is trial 201 with value: 0.8881217621713932.[0m
/media/san2_ssd/data/Workdir/survival/utils.py:305: RuntimeWarning: invalid value encountered in true_divide
  pdfs = np.gradient(1-survs,axis=1)/norms
/media/san2_ssd/data/Workdir/survival/utils.py:305: RuntimeWarning: invalid value encountered in true_divide
  pdfs = np.gradient(1-survs,axis=1)/norms
/media/san2_ssd/data/Workdir/survival/utils.py:305: RuntimeWarning: invalid value encountered in true_divide
  pdfs = np.gradient(1-survs,axis=1)/norms
[32m[I 2022-04-13 11:52:46,982][0m Trial 392 finished with value: 0.8823738230862437 and parameters: {'splitter': 'best', 'min_samples_split': 0.1299007554646457, 'min_samples_leaf': 0.00959856807755604, 'min_weight_fraction_leaf': 0.03922770642691734, 'max_features': 0.9468548342829406}. Best is trial 201 with value: 0.8881217621713932.[0m
/media/san2_ssd/data/Workdir/survival/utils.py:305: RuntimeWarning: invalid value encountered in true_divide
  pdfs = np.gradient(1-survs,axis=1)/norms
[32m[I 2022-04-13 11:52:48,583][0m Trial 393 finished with value: 0.8857694580205372 and parameters: {'splitter': 'best', 'min_samples_split': 0.1000976770497516, 'min_samples_leaf': 0.06009292435939974, 'min_weight_fraction_leaf': 0.020932396076783513, 'max_features': 0.9823452859786732}. Best is trial 201 with value: 0.8881217621713932.[0m
/media/san2_ssd/data/Workdir/survival/utils.py:305: RuntimeWarning: invalid value encountered in true_divide
  pdfs = np.gradient(1-survs,axis=1)/norms
[32m[I 2022-04-13 11:52:50,511][0m Trial 394 finished with value: 0.8807127366695292 and parameters: {'splitter': 'best', 'min_samples_split': 0.16512224615996196, 'min_samples_leaf': 0.017934741143698325, 'min_weight_fraction_leaf': 0.05105491301976815, 'max_features': 0.9647874641636642}. Best is trial 201 with value: 0.8881217621713932.[0m
/media/san2_ssd/data/Workdir/survival/utils.py:305: RuntimeWarning: invalid value encountered in true_divide
  pdfs = np.gradient(1-survs,axis=1)/norms
/media/san2_ssd/data/Workdir/survival/utils.py:305: RuntimeWarning: invalid value encountered in true_divide
  pdfs = np.gradient(1-survs,axis=1)/norms
/media/san2_ssd/data/Workdir/survival/utils.py:305: RuntimeWarning: invalid value encountered in true_divide
  pdfs = np.gradient(1-survs,axis=1)/norms
/media/san2_ssd/data/Workdir/survival/utils.py:305: RuntimeWarning: invalid value encountered in true_divide
  pdfs = np.gradient(1-survs,axis=1)/norms
/media/san2_ssd/data/Workdir/survival/utils.py:305: RuntimeWarning: invalid value encountered in true_divide
  pdfs = np.gradient(1-survs,axis=1)/norms
[32m[I 2022-04-13 11:52:53,576][0m Trial 395 finished with value: 0.8843379110010625 and parameters: {'splitter': 'best', 'min_samples_split': 0.07974027563543794, 'min_samples_leaf': 0.001437127273096214, 'min_weight_fraction_leaf': 0.03339191917491997, 'max_features': 0.9992705583883428}. Best is trial 201 with value: 0.8881217621713932.[0m
/media/san2_ssd/data/Workdir/survival/utils.py:305: RuntimeWarning: invalid value encountered in true_divide
  pdfs = np.gradient(1-survs,axis=1)/norms
[32m[I 2022-04-13 11:52:56,583][0m Trial 396 finished with value: 0.7846332924217666 and parameters: {'splitter': 'best', 'min_samples_split': 0.1154517866343308, 'min_samples_leaf': 0.038282525967908126, 'min_weight_fraction_leaf': 0.06457865517752781, 'max_features': 0.9802134332036625}. Best is trial 201 with value: 0.8881217621713932.[0m
[32m[I 2022-04-13 11:52:58,497][0m Trial 397 finished with value: 0.5482322369346744 and parameters: {'splitter': 'best', 'min_samples_split': 0.14319543863656822, 'min_samples_leaf': 0.026856792923274787, 'min_weight_fraction_leaf': 0.2260755183335843, 'max_features': 0.9376565258606526}. Best is trial 201 with value: 0.8881217621713932.[0m
[32m[I 2022-04-13 11:53:01,517][0m Trial 398 finished with value: 0.8769378901551738 and parameters: {'splitter': 'best', 'min_samples_split': 0.20856187891327382, 'min_samples_leaf': 0.04727490246954144, 'min_weight_fraction_leaf': 0.005924084830097685, 'max_features': 0.9607576652901867}. Best is trial 201 with value: 0.8881217621713932.[0m
[32m[I 2022-04-13 11:53:01,912][0m Trial 399 finished with value: 0.25 and parameters: {'splitter': 'best', 'min_samples_split': 0.09085094648639418, 'min_samples_leaf': 0.018175452773841503, 'min_weight_fraction_leaf': 0.40588698112804866, 'max_features': 0.02740857341671843}. Best is trial 201 with value: 0.8881217621713932.[0m
/media/san2_ssd/data/Workdir/survival/utils.py:305: RuntimeWarning: invalid value encountered in true_divide
  pdfs = np.gradient(1-survs,axis=1)/norms
/media/san2_ssd/data/Workdir/survival/utils.py:305: RuntimeWarning: invalid value encountered in true_divide
  pdfs = np.gradient(1-survs,axis=1)/norms
/media/san2_ssd/data/Workdir/survival/utils.py:305: RuntimeWarning: invalid value encountered in true_divide
  pdfs = np.gradient(1-survs,axis=1)/norms
/media/san2_ssd/data/Workdir/survival/utils.py:305: RuntimeWarning: invalid value encountered in true_divide
  pdfs = np.gradient(1-survs,axis=1)/norms
/media/san2_ssd/data/Workdir/survival/utils.py:305: RuntimeWarning: invalid value encountered in true_divide
  pdfs = np.gradient(1-survs,axis=1)/norms
[32m[I 2022-04-13 11:53:04,015][0m Trial 400 finished with value: 0.8862638450988614 and parameters: {'splitter': 'best', 'min_samples_split': 0.10571936315732311, 'min_samples_leaf': 0.029996594511589415, 'min_weight_fraction_leaf': 0.027126308015559868, 'max_features': 0.9805192778965278}. Best is trial 201 with value: 0.8881217621713932.[0m
/media/san2_ssd/data/Workdir/survival/utils.py:305: RuntimeWarning: invalid value encountered in true_divide
  pdfs = np.gradient(1-survs,axis=1)/norms
/media/san2_ssd/data/Workdir/survival/utils.py:305: RuntimeWarning: invalid value encountered in true_divide
  pdfs = np.gradient(1-survs,axis=1)/norms
/media/san2_ssd/data/Workdir/survival/utils.py:305: RuntimeWarning: invalid value encountered in true_divide
  pdfs = np.gradient(1-survs,axis=1)/norms
[32m[I 2022-04-13 11:53:07,486][0m Trial 401 finished with value: 0.8828091406553513 and parameters: {'splitter': 'best', 'min_samples_split': 0.12420762415290033, 'min_samples_leaf': 0.009760188524299359, 'min_weight_fraction_leaf': 0.0406718968989895, 'max_features': 0.9063405280940551}. Best is trial 201 with value: 0.8881217621713932.[0m
/media/san2_ssd/data/Workdir/survival/utils.py:305: RuntimeWarning: invalid value encountered in true_divide
  pdfs = np.gradient(1-survs,axis=1)/norms
/media/san2_ssd/data/Workdir/survival/utils.py:305: RuntimeWarning: invalid value encountered in true_divide
  pdfs = np.gradient(1-survs,axis=1)/norms
/media/san2_ssd/data/Workdir/survival/utils.py:305: RuntimeWarning: invalid value encountered in true_divide
  pdfs = np.gradient(1-survs,axis=1)/norms
[32m[I 2022-04-13 11:53:09,483][0m Trial 402 finished with value: 0.787221062687854 and parameters: {'splitter': 'best', 'min_samples_split': 0.1371149514589659, 'min_samples_leaf': 0.04052429333885635, 'min_weight_fraction_leaf': 0.018020219384993992, 'max_features': 0.9998154273477895}. Best is trial 201 with value: 0.8881217621713932.[0m
/media/san2_ssd/data/Workdir/survival/utils.py:305: RuntimeWarning: invalid value encountered in true_divide
  pdfs = np.gradient(1-survs,axis=1)/norms
/media/san2_ssd/data/Workdir/survival/utils.py:305: RuntimeWarning: invalid value encountered in true_divide
  pdfs = np.gradient(1-survs,axis=1)/norms
/media/san2_ssd/data/Workdir/survival/utils.py:305: RuntimeWarning: invalid value encountered in true_divide
  pdfs = np.gradient(1-survs,axis=1)/norms
[32m[I 2022-04-13 11:53:13,219][0m Trial 403 finished with value: 0.8815076988460271 and parameters: {'splitter': 'best', 'min_samples_split': 0.11633538695620355, 'min_samples_leaf': 0.022153533238880547, 'min_weight_fraction_leaf': 0.05340294592471135, 'max_features': 0.9569029593700623}. Best is trial 201 with value: 0.8881217621713932.[0m
/media/san2_ssd/data/Workdir/survival/utils.py:305: RuntimeWarning: invalid value encountered in true_divide
  pdfs = np.gradient(1-survs,axis=1)/norms
/media/san2_ssd/data/Workdir/survival/utils.py:305: RuntimeWarning: invalid value encountered in true_divide
  pdfs = np.gradient(1-survs,axis=1)/norms
/media/san2_ssd/data/Workdir/survival/utils.py:305: RuntimeWarning: invalid value encountered in true_divide
  pdfs = np.gradient(1-survs,axis=1)/norms
/media/san2_ssd/data/Workdir/survival/utils.py:305: RuntimeWarning: invalid value encountered in true_divide
  pdfs = np.gradient(1-survs,axis=1)/norms
