[32m[I 2022-04-15 13:37:36,182][0m Trial 895 finished with value: 0.7570350200785836 and parameters: {'loss': 'coxph', 'learning_rate': 0.0029354137000690223, 'n_estimators': 705, 'criterion': 'friedman_mse', 'min_samples_split': 7, 'min_samples_leaf': 2, 'min_weight_fraction_leaf': 0.054779742402450704, 'min_impurity_decrease': 0.39109046734556097, 'max_features': 0.677410037423637, 'subsample': 0.05932483158540117, 'dropout_rate': 0.7161781538767042, 'ccp_alpha': 0.1623439033576588}. Best is trial 712 with value: 0.7824105962295036.[0m
[32m[I 2022-04-15 13:38:57,140][0m Trial 896 finished with value: 0.5 and parameters: {'loss': 'coxph', 'learning_rate': 0.0017044613725428872, 'n_estimators': 658, 'criterion': 'friedman_mse', 'min_samples_split': 7, 'min_samples_leaf': 2, 'min_weight_fraction_leaf': 0.07236007283494532, 'min_impurity_decrease': 0.37821281605029683, 'max_features': 0.6935650178714128, 'subsample': 0.21116397392085057, 'dropout_rate': 0.7302203047467563, 'ccp_alpha': 0.37453644474100617}. Best is trial 712 with value: 0.7824105962295036.[0m
[32m[I 2022-04-15 13:40:27,437][0m Trial 897 finished with value: 0.7767641702824953 and parameters: {'loss': 'coxph', 'learning_rate': 0.00266447370005104, 'n_estimators': 655, 'criterion': 'friedman_mse', 'min_samples_split': 7, 'min_samples_leaf': 2, 'min_weight_fraction_leaf': 0.08345800904652736, 'min_impurity_decrease': 0.39353862519801863, 'max_features': 0.7364968088642716, 'subsample': 0.2428308239749343, 'dropout_rate': 0.7426472719231691, 'ccp_alpha': 0.0026934255678179187}. Best is trial 712 with value: 0.7824105962295036.[0m
[32m[I 2022-04-15 13:42:09,966][0m Trial 898 finished with value: 0.7140469920252818 and parameters: {'loss': 'coxph', 'learning_rate': 0.002046964282477984, 'n_estimators': 699, 'criterion': 'absolute_error', 'min_samples_split': 7, 'min_samples_leaf': 2, 'min_weight_fraction_leaf': 0.05893229079659395, 'min_impurity_decrease': 0.4208244810655929, 'max_features': 0.7126969500107004, 'subsample': 0.026653724393146394, 'dropout_rate': 0.7093904397024541, 'ccp_alpha': 0.09142970719647422}. Best is trial 712 with value: 0.7824105962295036.[0m
[32m[I 2022-04-15 13:43:39,054][0m Trial 899 finished with value: 0.7576740844085722 and parameters: {'loss': 'coxph', 'learning_rate': 6.109561934248933e-06, 'n_estimators': 632, 'criterion': 'friedman_mse', 'min_samples_split': 7, 'min_samples_leaf': 2, 'min_weight_fraction_leaf': 0.06897514083867641, 'min_impurity_decrease': 0.3776340618347846, 'max_features': 0.7542683506791585, 'subsample': 0.024855541351194457, 'dropout_rate': 0.7180271631385577, 'ccp_alpha': 0.2438463342022569}. Best is trial 712 with value: 0.7824105962295036.[0m
[32m[I 2022-04-15 13:45:24,598][0m Trial 900 finished with value: 0.7620668234233628 and parameters: {'loss': 'coxph', 'learning_rate': 0.0031468808158637315, 'n_estimators': 737, 'criterion': 'friedman_mse', 'min_samples_split': 7, 'min_samples_leaf': 2, 'min_weight_fraction_leaf': 0.08775539121470546, 'min_impurity_decrease': 0.4311302006690061, 'max_features': 0.7431675503856711, 'subsample': 0.03698247915607693, 'dropout_rate': 0.7579937901200238, 'ccp_alpha': 0.16197139915304085}. Best is trial 712 with value: 0.7824105962295036.[0m
[32m[I 2022-04-15 13:46:59,561][0m Trial 901 finished with value: 0.7656693208893954 and parameters: {'loss': 'coxph', 'learning_rate': 0.0016983881586260607, 'n_estimators': 671, 'criterion': 'friedman_mse', 'min_samples_split': 7, 'min_samples_leaf': 2, 'min_weight_fraction_leaf': 0.0471304513974337, 'min_impurity_decrease': 0.41399027044131076, 'max_features': 0.7226343419635644, 'subsample': 0.04514496244647422, 'dropout_rate': 0.7468524762768255, 'ccp_alpha': 0.08844198018218147}. Best is trial 712 with value: 0.7824105962295036.[0m
[32m[I 2022-04-15 13:48:06,529][0m Trial 902 finished with value: 0.778854023555132 and parameters: {'loss': 'coxph', 'learning_rate': 0.0022957799042129974, 'n_estimators': 613, 'criterion': 'friedman_mse', 'min_samples_split': 7, 'min_samples_leaf': 2, 'min_weight_fraction_leaf': 0.05929906259651571, 'min_impurity_decrease': 0.44643576291781906, 'max_features': 0.7531332494545643, 'subsample': 0.10075153675578911, 'dropout_rate': 0.8706494870375128, 'ccp_alpha': 0.006998939442700526}. Best is trial 712 with value: 0.7824105962295036.[0m
[32m[I 2022-04-15 13:49:14,310][0m Trial 903 finished with value: 0.5 and parameters: {'loss': 'coxph', 'learning_rate': 0.0024393303827294588, 'n_estimators': 627, 'criterion': 'friedman_mse', 'min_samples_split': 7, 'min_samples_leaf': 2, 'min_weight_fraction_leaf': 0.07184263040382753, 'min_impurity_decrease': 0.4048669406881051, 'max_features': 0.7003279452589793, 'subsample': 0.0878666493513737, 'dropout_rate': 0.8663818238616064, 'ccp_alpha': 3.0248650078779296}. Best is trial 712 with value: 0.7824105962295036.[0m
[32m[I 2022-04-15 13:50:23,310][0m Trial 904 finished with value: 0.6870144488614703 and parameters: {'loss': 'coxph', 'learning_rate': 0.00164709102553424, 'n_estimators': 604, 'criterion': 'friedman_mse', 'min_samples_split': 8, 'min_samples_leaf': 2, 'min_weight_fraction_leaf': 0.08101826380272582, 'min_impurity_decrease': 0.4407055780125825, 'max_features': 0.7217852630051379, 'subsample': 0.07990217518445449, 'dropout_rate': 0.8301180465303518, 'ccp_alpha': 0.26096438608423694}. Best is trial 712 with value: 0.7824105962295036.[0m
[32m[I 2022-04-15 13:52:01,029][0m Trial 905 finished with value: 0.7800616718238849 and parameters: {'loss': 'coxph', 'learning_rate': 0.0021321881099805183, 'n_estimators': 652, 'criterion': 'friedman_mse', 'min_samples_split': 7, 'min_samples_leaf': 2, 'min_weight_fraction_leaf': 0.05001902726672876, 'min_impurity_decrease': 0.44457704171013496, 'max_features': 0.7465467191961804, 'subsample': 0.12164083603251236, 'dropout_rate': 0.7116327618231597, 'ccp_alpha': 0.0014501890438346726}. Best is trial 712 with value: 0.7824105962295036.[0m
[32m[I 2022-04-15 13:53:35,448][0m Trial 906 finished with value: 0.7515221371227773 and parameters: {'loss': 'coxph', 'learning_rate': 0.0013647947659534163, 'n_estimators': 665, 'criterion': 'friedman_mse', 'min_samples_split': 7, 'min_samples_leaf': 2, 'min_weight_fraction_leaf': 0.04045719858761168, 'min_impurity_decrease': 0.4135024739893373, 'max_features': 0.7380753347492245, 'subsample': 0.12380143500428874, 'dropout_rate': 0.7030512762005654, 'ccp_alpha': 0.15478714696993104}. Best is trial 712 with value: 0.7824105962295036.[0m
[32m[I 2022-04-15 13:54:34,589][0m Trial 907 finished with value: 0.7623483249103439 and parameters: {'loss': 'coxph', 'learning_rate': 0.001944816426357617, 'n_estimators': 606, 'criterion': 'friedman_mse', 'min_samples_split': 7, 'min_samples_leaf': 2, 'min_weight_fraction_leaf': 0.030208605294562985, 'min_impurity_decrease': 0.4336836470302724, 'max_features': 0.6820528879300125, 'subsample': 0.12873878419121593, 'dropout_rate': 0.8941489845108792, 'ccp_alpha': 0.09125880482495836}. Best is trial 712 with value: 0.7824105962295036.[0m
[32m[I 2022-04-15 13:56:16,725][0m Trial 908 finished with value: 0.7662512534732153 and parameters: {'loss': 'coxph', 'learning_rate': 0.002069938819316646, 'n_estimators': 722, 'criterion': 'friedman_mse', 'min_samples_split': 7, 'min_samples_leaf': 2, 'min_weight_fraction_leaf': 0.05075471759319596, 'min_impurity_decrease': 0.392075127200047, 'max_features': 0.7067802311859591, 'subsample': 0.0611784257721438, 'dropout_rate': 0.7330243328717978, 'ccp_alpha': 0.08239459379784982}. Best is trial 712 with value: 0.7824105962295036.[0m
[32m[I 2022-04-15 13:56:33,726][0m Trial 909 finished with value: 0.3256375853394913 and parameters: {'loss': 'squared', 'learning_rate': 0.0015522332106799974, 'n_estimators': 688, 'criterion': 'squared_error', 'min_samples_split': 7, 'min_samples_leaf': 2, 'min_weight_fraction_leaf': 0.06593717304116166, 'min_impurity_decrease': 0.4269437535398925, 'max_features': 0.7457178690625611, 'subsample': 0.176350946454336, 'dropout_rate': 0.9344419781795518, 'ccp_alpha': 0.006321906713669161}. Best is trial 712 with value: 0.7824105962295036.[0m
[32m[I 2022-04-15 13:57:54,407][0m Trial 910 finished with value: 0.6855932145392376 and parameters: {'loss': 'coxph', 'learning_rate': 0.002499052946809722, 'n_estimators': 641, 'criterion': 'friedman_mse', 'min_samples_split': 8, 'min_samples_leaf': 2, 'min_weight_fraction_leaf': 0.036498279458864274, 'min_impurity_decrease': 0.44783550911624515, 'max_features': 0.725741761501689, 'subsample': 0.15855711889109836, 'dropout_rate': 0.7149659524868764, 'ccp_alpha': 0.1886071838577921}. Best is trial 712 with value: 0.7824105962295036.[0m
[32m[I 2022-04-15 13:59:14,187][0m Trial 911 finished with value: 0.779247229969114 and parameters: {'loss': 'coxph', 'learning_rate': 0.0017948168979489375, 'n_estimators': 606, 'criterion': 'friedman_mse', 'min_samples_split': 7, 'min_samples_leaf': 2, 'min_weight_fraction_leaf': 0.051567813324792364, 'min_impurity_decrease': 0.41740873035896575, 'max_features': 0.7539026343815664, 'subsample': 0.1398266000798295, 'dropout_rate': 0.7421681886745458, 'ccp_alpha': 0.0015518212478171196}. Best is trial 712 with value: 0.7824105962295036.[0m
[32m[I 2022-04-15 14:00:29,800][0m Trial 912 finished with value: 0.6017968330753914 and parameters: {'loss': 'coxph', 'learning_rate': 0.0020387311378832523, 'n_estimators': 613, 'criterion': 'friedman_mse', 'min_samples_split': 7, 'min_samples_leaf': 2, 'min_weight_fraction_leaf': 0.050876826581335355, 'min_impurity_decrease': 0.3905735294781915, 'max_features': 0.7041230725142071, 'subsample': 0.10887167905501255, 'dropout_rate': 0.7828449769417766, 'ccp_alpha': 0.33040238290576274}. Best is trial 712 with value: 0.7824105962295036.[0m
[32m[I 2022-04-15 14:01:40,863][0m Trial 913 finished with value: 0.7182568118021196 and parameters: {'loss': 'coxph', 'learning_rate': 0.002351500625636577, 'n_estimators': 648, 'criterion': 'friedman_mse', 'min_samples_split': 7, 'min_samples_leaf': 2, 'min_weight_fraction_leaf': 0.04650485903546613, 'min_impurity_decrease': 0.4101440565334082, 'max_features': 0.7343874381674014, 'subsample': 0.13808815271895153, 'dropout_rate': 0.8475683991392131, 'ccp_alpha': 0.16544583664324908}. Best is trial 712 with value: 0.7824105962295036.[0m
[32m[I 2022-04-15 14:02:55,165][0m Trial 914 finished with value: 0.7561310555502386 and parameters: {'loss': 'coxph', 'learning_rate': 0.0016198538465034965, 'n_estimators': 606, 'criterion': 'friedman_mse', 'min_samples_split': 7, 'min_samples_leaf': 2, 'min_weight_fraction_leaf': 0.04317694336955914, 'min_impurity_decrease': 0.37138856046730273, 'max_features': 0.9990265846258918, 'subsample': 0.15279507056697625, 'dropout_rate': 0.7635786803099434, 'ccp_alpha': 0.09149051434707653}. Best is trial 712 with value: 0.7824105962295036.[0m
[32m[I 2022-04-15 14:04:04,243][0m Trial 915 finished with value: 0.7798973673290123 and parameters: {'loss': 'coxph', 'learning_rate': 0.0022977941349530467, 'n_estimators': 640, 'criterion': 'friedman_mse', 'min_samples_split': 7, 'min_samples_leaf': 2, 'min_weight_fraction_leaf': 0.03753406168224047, 'min_impurity_decrease': 0.4199362717714777, 'max_features': 0.7468121200295827, 'subsample': 0.13347745823975427, 'dropout_rate': 0.8750696954550108, 'ccp_alpha': 0.00199346088434109}. Best is trial 712 with value: 0.7824105962295036.[0m
[32m[I 2022-04-15 14:05:12,632][0m Trial 916 finished with value: 0.5996277433728529 and parameters: {'loss': 'coxph', 'learning_rate': 0.001891192088707585, 'n_estimators': 687, 'criterion': 'friedman_mse', 'min_samples_split': 7, 'min_samples_leaf': 2, 'min_weight_fraction_leaf': 0.03027584027209486, 'min_impurity_decrease': 0.38724819118844983, 'max_features': 0.7577227679343082, 'subsample': 0.19600028670956138, 'dropout_rate': 0.8813123932543659, 'ccp_alpha': 0.277115085539742}. Best is trial 712 with value: 0.7824105962295036.[0m
[32m[I 2022-04-15 14:06:34,110][0m Trial 917 finished with value: 0.7801059726256906 and parameters: {'loss': 'coxph', 'learning_rate': 7.349570843315647e-05, 'n_estimators': 659, 'criterion': 'friedman_mse', 'min_samples_split': 7, 'min_samples_leaf': 2, 'min_weight_fraction_leaf': 0.033233104764822836, 'min_impurity_decrease': 0.4069098686750164, 'max_features': 0.7528778230837115, 'subsample': 0.1288185075934337, 'dropout_rate': 0.8563801181914033, 'ccp_alpha': 0.002822123982329177}. Best is trial 712 with value: 0.7824105962295036.[0m
[32m[I 2022-04-15 14:07:57,398][0m Trial 918 finished with value: 0.7454763249064282 and parameters: {'loss': 'coxph', 'learning_rate': 6.463019180537696e-05, 'n_estimators': 726, 'criterion': 'friedman_mse', 'min_samples_split': 7, 'min_samples_leaf': 2, 'min_weight_fraction_leaf': 0.027715314132750843, 'min_impurity_decrease': 0.37365803938974146, 'max_features': 0.7551948123683908, 'subsample': 0.11142563694876864, 'dropout_rate': 0.8749146314310731, 'ccp_alpha': 0.1751573582914574}. Best is trial 712 with value: 0.7824105962295036.[0m
[32m[I 2022-04-15 14:09:06,903][0m Trial 919 finished with value: 0.759043552562082 and parameters: {'loss': 'coxph', 'learning_rate': 3.853645487067617e-05, 'n_estimators': 675, 'criterion': 'friedman_mse', 'min_samples_split': 7, 'min_samples_leaf': 2, 'min_weight_fraction_leaf': 0.03481603896938671, 'min_impurity_decrease': 0.398300782766496, 'max_features': 0.768741894485093, 'subsample': 0.16996380780762582, 'dropout_rate': 0.8658391158974851, 'ccp_alpha': 0.0881445200882459}. Best is trial 712 with value: 0.7824105962295036.[0m
[32m[I 2022-04-15 14:10:31,472][0m Trial 920 finished with value: 0.7793514979059601 and parameters: {'loss': 'coxph', 'learning_rate': 0.0014647099929068973, 'n_estimators': 663, 'criterion': 'friedman_mse', 'min_samples_split': 7, 'min_samples_leaf': 2, 'min_weight_fraction_leaf': 0.03466064857988158, 'min_impurity_decrease': 0.4210567675775935, 'max_features': 0.7524527321974086, 'subsample': 0.13505229280413544, 'dropout_rate': 0.805471913096624, 'ccp_alpha': 0.002820757681070401}. Best is trial 712 with value: 0.7824105962295036.[0m
[32m[I 2022-04-15 14:11:52,668][0m Trial 921 finished with value: 0.6962895326274062 and parameters: {'loss': 'coxph', 'learning_rate': 7.650657982756173e-05, 'n_estimators': 778, 'criterion': 'friedman_mse', 'min_samples_split': 7, 'min_samples_leaf': 2, 'min_weight_fraction_leaf': 0.031185381145529698, 'min_impurity_decrease': 0.39463970120810277, 'max_features': 0.7504654667107653, 'subsample': 0.13012155726305494, 'dropout_rate': 0.8944353272245689, 'ccp_alpha': 0.18076527898389394}. Best is trial 712 with value: 0.7824105962295036.[0m
[32m[I 2022-04-15 14:13:08,503][0m Trial 922 finished with value: 0.5 and parameters: {'loss': 'coxph', 'learning_rate': 0.001535846266123044, 'n_estimators': 702, 'criterion': 'friedman_mse', 'min_samples_split': 7, 'min_samples_leaf': 2, 'min_weight_fraction_leaf': 0.027556653458506046, 'min_impurity_decrease': 0.4104858346573639, 'max_features': 0.7299652338676684, 'subsample': 0.16343311973895025, 'dropout_rate': 0.8326072551063403, 'ccp_alpha': 0.4329460275111818}. Best is trial 712 with value: 0.7824105962295036.[0m
[32m[I 2022-04-15 14:14:12,599][0m Trial 923 finished with value: 0.5 and parameters: {'loss': 'coxph', 'learning_rate': 0.0013133304816465353, 'n_estimators': 663, 'criterion': 'absolute_error', 'min_samples_split': 7, 'min_samples_leaf': 2, 'min_weight_fraction_leaf': 0.03442259399739847, 'min_impurity_decrease': 0.3774057698541579, 'max_features': 0.7483960503391974, 'subsample': 0.14553319580106314, 'dropout_rate': 0.9219793164680289, 'ccp_alpha': 0.09484330729699819}. Best is trial 712 with value: 0.7824105962295036.[0m
[32m[I 2022-04-15 14:15:32,248][0m Trial 924 finished with value: 0.6743624146605087 and parameters: {'loss': 'coxph', 'learning_rate': 0.0013125046385531974, 'n_estimators': 732, 'criterion': 'friedman_mse', 'min_samples_split': 7, 'min_samples_leaf': 2, 'min_weight_fraction_leaf': 0.03258013566911981, 'min_impurity_decrease': 0.4146006191041842, 'max_features': 0.7203664571542344, 'subsample': 0.11130905296890424, 'dropout_rate': 0.907592829339876, 'ccp_alpha': 0.23531893165136983}. Best is trial 712 with value: 0.7824105962295036.[0m
[32m[I 2022-04-15 14:16:53,335][0m Trial 925 finished with value: 0.7786328370004426 and parameters: {'loss': 'coxph', 'learning_rate': 0.0016441619656058783, 'n_estimators': 661, 'criterion': 'friedman_mse', 'min_samples_split': 8, 'min_samples_leaf': 2, 'min_weight_fraction_leaf': 0.021007440770670648, 'min_impurity_decrease': 0.4018339272528709, 'max_features': 0.7468094558140472, 'subsample': 0.09247135322548025, 'dropout_rate': 0.8732953948939438, 'ccp_alpha': 0.003966871581034176}. Best is trial 712 with value: 0.7824105962295036.[0m
[32m[I 2022-04-15 14:18:27,733][0m Trial 926 finished with value: 0.777248183855061 and parameters: {'loss': 'coxph', 'learning_rate': 2.4673844425261126e-05, 'n_estimators': 701, 'criterion': 'friedman_mse', 'min_samples_split': 9, 'min_samples_leaf': 2, 'min_weight_fraction_leaf': 0.02251185702579732, 'min_impurity_decrease': 0.37488985449116213, 'max_features': 0.7415292119139687, 'subsample': 0.07473442089074447, 'dropout_rate': 0.8377941627015983, 'ccp_alpha': 0.00280688448707541}. Best is trial 712 with value: 0.7824105962295036.[0m
[32m[I 2022-04-15 14:19:47,642][0m Trial 927 finished with value: 0.7627921259213444 and parameters: {'loss': 'coxph', 'learning_rate': 8.269030481663828e-05, 'n_estimators': 668, 'criterion': 'friedman_mse', 'min_samples_split': 8, 'min_samples_leaf': 2, 'min_weight_fraction_leaf': 0.024619163434922743, 'min_impurity_decrease': 0.39503614021840705, 'max_features': 0.7218572573567031, 'subsample': 0.09552342280033055, 'dropout_rate': 0.8535778431240948, 'ccp_alpha': 0.09554984706555864}. Best is trial 712 with value: 0.7824105962295036.[0m
[32m[I 2022-04-15 14:20:20,117][0m Trial 928 finished with value: 0.4309010948200407 and parameters: {'loss': 'squared', 'learning_rate': 0.00011369578712646573, 'n_estimators': 653, 'criterion': 'friedman_mse', 'min_samples_split': 8, 'min_samples_leaf': 2, 'min_weight_fraction_leaf': 0.014521016656336774, 'min_impurity_decrease': 0.37227061914958365, 'max_features': 0.7471476467723965, 'subsample': 0.12939939272282402, 'dropout_rate': 0.8127273607496177, 'ccp_alpha': 0.6423544696994015}. Best is trial 712 with value: 0.7824105962295036.[0m
[32m[I 2022-04-15 14:21:36,904][0m Trial 929 finished with value: 0.7486589400645157 and parameters: {'loss': 'coxph', 'learning_rate': 0.00017652418445078798, 'n_estimators': 668, 'criterion': 'friedman_mse', 'min_samples_split': 7, 'min_samples_leaf': 2, 'min_weight_fraction_leaf': 0.019900986577555846, 'min_impurity_decrease': 0.4047031889140588, 'max_features': 0.724401508051392, 'subsample': 0.1144741936136088, 'dropout_rate': 0.8693094643538196, 'ccp_alpha': 0.16271245695114248}. Best is trial 712 with value: 0.7824105962295036.[0m
[32m[I 2022-04-15 14:23:03,953][0m Trial 930 finished with value: 0.7805611348359999 and parameters: {'loss': 'coxph', 'learning_rate': 0.001263465864284853, 'n_estimators': 704, 'criterion': 'friedman_mse', 'min_samples_split': 8, 'min_samples_leaf': 2, 'min_weight_fraction_leaf': 0.033107772369749544, 'min_impurity_decrease': 0.4187551511957486, 'max_features': 0.7620636724706147, 'subsample': 0.13641894093545262, 'dropout_rate': 0.8500333979141583, 'ccp_alpha': 0.0014956534618827304}. Best is trial 712 with value: 0.7824105962295036.[0m
[32m[I 2022-04-15 14:24:28,870][0m Trial 931 finished with value: 0.5301157883717103 and parameters: {'loss': 'coxph', 'learning_rate': 0.0010419394189181736, 'n_estimators': 729, 'criterion': 'friedman_mse', 'min_samples_split': 8, 'min_samples_leaf': 2, 'min_weight_fraction_leaf': 0.014888048015580024, 'min_impurity_decrease': 0.39050902734746445, 'max_features': 0.7463565540959344, 'subsample': 0.1510486972925369, 'dropout_rate': 0.8540713258200568, 'ccp_alpha': 0.33943708213708673}. Best is trial 712 with value: 0.7824105962295036.[0m
[32m[I 2022-04-15 14:25:47,314][0m Trial 932 finished with value: 0.6743624146605087 and parameters: {'loss': 'coxph', 'learning_rate': 0.0011127906996186029, 'n_estimators': 710, 'criterion': 'friedman_mse', 'min_samples_split': 9, 'min_samples_leaf': 2, 'min_weight_fraction_leaf': 0.004821670139439505, 'min_impurity_decrease': 0.4150311560507185, 'max_features': 0.2095087173935311, 'subsample': 0.12805723622488846, 'dropout_rate': 0.8772174428217644, 'ccp_alpha': 0.25880461512190955}. Best is trial 712 with value: 0.7824105962295036.[0m
[32m[I 2022-04-15 14:27:07,401][0m Trial 933 finished with value: 0.5301157883717103 and parameters: {'loss': 'coxph', 'learning_rate': 0.001403966123254987, 'n_estimators': 746, 'criterion': 'squared_error', 'min_samples_split': 7, 'min_samples_leaf': 2, 'min_weight_fraction_leaf': 0.03413888068976522, 'min_impurity_decrease': 0.38747459011252355, 'max_features': 0.7105095000931952, 'subsample': 0.09652932360977363, 'dropout_rate': 0.906836358547512, 'ccp_alpha': 0.09345109042749995}. Best is trial 712 with value: 0.7824105962295036.[0m
[32m[I 2022-04-15 14:28:22,997][0m Trial 934 finished with value: 0.7008636978498013 and parameters: {'loss': 'coxph', 'learning_rate': 9.690304297767486e-06, 'n_estimators': 694, 'criterion': 'friedman_mse', 'min_samples_split': 8, 'min_samples_leaf': 2, 'min_weight_fraction_leaf': 0.04104338696143463, 'min_impurity_decrease': 0.4119570977774071, 'max_features': 0.7341280250285379, 'subsample': 0.18240678680136865, 'dropout_rate': 0.8472764358646561, 'ccp_alpha': 0.16208310782573165}. Best is trial 712 with value: 0.7824105962295036.[0m
