[32m[I 2022-04-15 21:27:43,189][0m Trial 249 finished with value: 0.8810654343816349 and parameters: {'n_hidden': 1024, 'mixture_components': 10, 'use_sparse_layer': True, 'use_sparse_loss': False, 'use_batchnorm': True, 'use_dropout': True, 'dropout': 0.5370960928071037, 'mlp_size_1': 2, 'mlp_size_2': 3, 'mlp_size_3': 1, 'kernel': 'Weibull', 'loss_name': 'CensoredNLLLoss'}. Best is trial 87 with value: 0.8866301826616875.[0m
[32m[I 2022-04-15 21:29:56,982][0m Trial 250 finished with value: 0.8826559379815174 and parameters: {'n_hidden': 256, 'mixture_components': 10, 'use_sparse_layer': True, 'use_sparse_loss': False, 'use_batchnorm': False, 'use_dropout': True, 'dropout': 0.1004738415140326, 'mlp_size_1': 3, 'mlp_size_2': 2, 'mlp_size_3': 0, 'kernel': 'Weibull', 'loss_name': 'CensoredNLLLoss'}. Best is trial 87 with value: 0.8866301826616875.[0m
[32m[I 2022-04-15 21:32:27,821][0m Trial 251 finished with value: 0.8859421425715734 and parameters: {'n_hidden': 1024, 'mixture_components': 10, 'use_sparse_layer': False, 'use_batchnorm': False, 'use_dropout': True, 'dropout': 0.5969376081274383, 'mlp_size_1': 2, 'mlp_size_2': 3, 'mlp_size_3': 1, 'kernel': 'Weibull', 'loss_name': 'CensoredNLLLoss'}. Best is trial 87 with value: 0.8866301826616875.[0m
[32m[I 2022-04-15 21:34:39,824][0m Trial 252 finished with value: 0.8855700423827859 and parameters: {'n_hidden': 1024, 'mixture_components': 10, 'use_sparse_layer': False, 'use_batchnorm': False, 'use_dropout': True, 'dropout': 0.5765762652035642, 'mlp_size_1': 1, 'mlp_size_2': 3, 'mlp_size_3': 1, 'kernel': 'Gamma', 'loss_name': 'AlternativeNLLLoss'}. Best is trial 87 with value: 0.8866301826616875.[0m
[32m[I 2022-04-15 21:36:52,054][0m Trial 253 finished with value: 0.8819755790324993 and parameters: {'n_hidden': 64, 'mixture_components': 10, 'use_sparse_layer': False, 'use_batchnorm': False, 'use_dropout': True, 'dropout': 0.5939403598519446, 'mlp_size_1': 1, 'mlp_size_2': 2, 'mlp_size_3': 0, 'kernel': 'Gamma', 'loss_name': 'CensoredNLLLoss'}. Best is trial 87 with value: 0.8866301826616875.[0m
[32m[I 2022-04-15 21:39:13,787][0m Trial 254 finished with value: 0.8833644187276743 and parameters: {'n_hidden': 1024, 'mixture_components': 10, 'use_sparse_layer': False, 'use_batchnorm': False, 'use_dropout': True, 'dropout': 0.5764112229934865, 'mlp_size_1': 1, 'mlp_size_2': 3, 'mlp_size_3': 1, 'kernel': 'Weibull', 'loss_name': 'AlternativeNLLLoss'}. Best is trial 87 with value: 0.8866301826616875.[0m
[32m[I 2022-04-15 21:41:22,922][0m Trial 255 finished with value: 0.885203130475678 and parameters: {'n_hidden': 1024, 'mixture_components': 10, 'use_sparse_layer': False, 'use_batchnorm': False, 'use_dropout': True, 'dropout': 0.6152749421422836, 'mlp_size_1': 1, 'mlp_size_2': 3, 'mlp_size_3': 1, 'kernel': 'Gamma', 'loss_name': 'AlternativeNLLLoss'}. Best is trial 87 with value: 0.8866301826616875.[0m
[32m[I 2022-04-15 21:43:30,893][0m Trial 256 finished with value: 0.8841288786352717 and parameters: {'n_hidden': 1024, 'mixture_components': 10, 'use_sparse_layer': False, 'use_batchnorm': False, 'use_dropout': True, 'dropout': 0.5690708494832366, 'mlp_size_1': 1, 'mlp_size_2': 3, 'mlp_size_3': 1, 'kernel': 'Gamma', 'loss_name': 'AlternativeNLLLoss'}. Best is trial 87 with value: 0.8866301826616875.[0m
[32m[I 2022-04-15 21:46:01,646][0m Trial 257 finished with value: 0.882114190882229 and parameters: {'n_hidden': 1024, 'mixture_components': 10, 'use_sparse_layer': False, 'use_batchnorm': False, 'use_dropout': True, 'dropout': 0.44267831945556035, 'mlp_size_1': 1, 'mlp_size_2': 3, 'mlp_size_3': 1, 'kernel': 'Weibull', 'loss_name': 'AlternativeNLLLoss'}. Best is trial 87 with value: 0.8866301826616875.[0m
[32m[I 2022-04-15 21:48:18,622][0m Trial 258 finished with value: 0.8831685893718373 and parameters: {'n_hidden': 1024, 'mixture_components': 9, 'use_sparse_layer': False, 'use_batchnorm': False, 'use_dropout': True, 'dropout': 0.5904770392866071, 'mlp_size_1': 1, 'mlp_size_2': 3, 'mlp_size_3': 1, 'kernel': 'Gamma', 'loss_name': 'AlternativeNLLLoss'}. Best is trial 87 with value: 0.8866301826616875.[0m
[32m[I 2022-04-15 21:50:34,869][0m Trial 259 finished with value: 0.8500287274032712 and parameters: {'n_hidden': 1024, 'mixture_components': 8, 'use_sparse_layer': True, 'use_sparse_loss': False, 'use_batchnorm': False, 'use_dropout': True, 'dropout': 0.469918457167096, 'mlp_size_1': 3, 'mlp_size_2': 3, 'mlp_size_3': 1, 'kernel': 'Gamma', 'loss_name': 'NLLLoss'}. Best is trial 87 with value: 0.8866301826616875.[0m
[32m[I 2022-04-15 21:52:48,764][0m Trial 260 finished with value: 0.8852604623641682 and parameters: {'n_hidden': 1024, 'mixture_components': 10, 'use_sparse_layer': False, 'use_batchnorm': False, 'use_dropout': True, 'dropout': 0.545304010763275, 'mlp_size_1': 2, 'mlp_size_2': 3, 'mlp_size_3': 1, 'kernel': 'Weibull', 'loss_name': 'CensoredNLLLoss'}. Best is trial 87 with value: 0.8866301826616875.[0m
[32m[I 2022-04-15 21:54:56,408][0m Trial 261 finished with value: 0.8852312232832948 and parameters: {'n_hidden': 1024, 'mixture_components': 10, 'use_sparse_layer': False, 'use_batchnorm': False, 'use_dropout': True, 'dropout': 0.3886264833812526, 'mlp_size_1': 4, 'mlp_size_2': 3, 'mlp_size_3': 0, 'kernel': 'Weibull', 'loss_name': 'CensoredNLLLoss'}. Best is trial 87 with value: 0.8866301826616875.[0m
[32m[I 2022-04-15 21:56:44,436][0m Trial 262 finished with value: 0.7228160553070382 and parameters: {'n_hidden': 1024, 'mixture_components': 10, 'use_sparse_layer': False, 'use_batchnorm': False, 'use_dropout': True, 'dropout': 0.5057846185632445, 'mlp_size_1': 1, 'mlp_size_2': 3, 'mlp_size_3': 1, 'kernel': 'Gumbel', 'loss_name': 'AlternativeNLLLoss'}. Best is trial 87 with value: 0.8866301826616875.[0m
[32m[I 2022-04-15 21:59:20,411][0m Trial 263 finished with value: 0.8835759547810037 and parameters: {'n_hidden': 1024, 'mixture_components': 10, 'use_sparse_layer': False, 'use_batchnorm': False, 'use_dropout': True, 'dropout': 0.6412916201791975, 'mlp_size_1': 2, 'mlp_size_2': 3, 'mlp_size_3': 1, 'kernel': 'Weibull', 'loss_name': 'CensoredNLLLoss'}. Best is trial 87 with value: 0.8866301826616875.[0m
[32m[I 2022-04-15 22:01:45,941][0m Trial 264 finished with value: 0.8827660839160533 and parameters: {'n_hidden': 1024, 'mixture_components': 9, 'use_sparse_layer': False, 'use_batchnorm': False, 'use_dropout': True, 'dropout': 0.6071241680185474, 'mlp_size_1': 2, 'mlp_size_2': 3, 'mlp_size_3': 1, 'kernel': 'Weibull', 'loss_name': 'CensoredNLLLoss'}. Best is trial 87 with value: 0.8866301826616875.[0m
[32m[I 2022-04-15 22:04:40,026][0m Trial 265 finished with value: 0.8845444054066727 and parameters: {'n_hidden': 1024, 'mixture_components': 10, 'use_sparse_layer': True, 'use_sparse_loss': False, 'use_batchnorm': False, 'use_dropout': True, 'dropout': 0.5604366092563208, 'mlp_size_1': 3, 'mlp_size_2': 3, 'mlp_size_3': 1, 'kernel': 'Weibull', 'loss_name': 'CensoredNLLLoss'}. Best is trial 87 with value: 0.8866301826616875.[0m
[32m[I 2022-04-15 22:07:10,123][0m Trial 266 finished with value: 0.8829520190528068 and parameters: {'n_hidden': 1024, 'mixture_components': 10, 'use_sparse_layer': True, 'use_sparse_loss': False, 'use_batchnorm': False, 'use_dropout': True, 'dropout': 0.5857166365388283, 'mlp_size_1': 2, 'mlp_size_2': 3, 'mlp_size_3': 1, 'kernel': 'Weibull', 'loss_name': 'CensoredNLLLoss'}. Best is trial 87 with value: 0.8866301826616875.[0m
[32m[I 2022-04-15 22:11:54,145][0m Trial 267 finished with value: 0.7607020299308582 and parameters: {'n_hidden': 32, 'mixture_components': 10, 'use_sparse_layer': True, 'use_sparse_loss': False, 'use_batchnorm': True, 'use_dropout': True, 'dropout': 0.6285496976660399, 'mlp_size_1': 2, 'mlp_size_2': 0, 'mlp_size_3': 0, 'kernel': 'Weibull', 'loss_name': 'CensoredNLLLoss'}. Best is trial 87 with value: 0.8866301826616875.[0m
[32m[I 2022-04-15 22:14:27,639][0m Trial 268 finished with value: 0.7857271461403101 and parameters: {'n_hidden': 1024, 'mixture_components': 10, 'use_sparse_layer': True, 'use_sparse_loss': False, 'use_batchnorm': False, 'use_dropout': True, 'dropout': 0.3062839067814771, 'mlp_size_1': 1, 'mlp_size_2': 4, 'mlp_size_3': 1, 'kernel': 'Normal', 'loss_name': 'CensoredNLLLoss'}. Best is trial 87 with value: 0.8866301826616875.[0m
[32m[I 2022-04-15 22:17:12,111][0m Trial 269 finished with value: 0.8812763935705924 and parameters: {'n_hidden': 1024, 'mixture_components': 10, 'use_sparse_layer': True, 'use_sparse_loss': False, 'use_batchnorm': False, 'use_dropout': True, 'dropout': 0.5563545010969697, 'mlp_size_1': 3, 'mlp_size_2': 3, 'mlp_size_3': 1, 'kernel': 'Weibull', 'loss_name': 'CensoredNLLLoss'}. Best is trial 87 with value: 0.8866301826616875.[0m
[32m[I 2022-04-15 22:19:50,864][0m Trial 270 finished with value: 0.885939515375943 and parameters: {'n_hidden': 1024, 'mixture_components': 10, 'use_sparse_layer': True, 'use_sparse_loss': False, 'use_batchnorm': False, 'use_dropout': True, 'dropout': 0.6060465125770337, 'mlp_size_1': 1, 'mlp_size_2': 4, 'mlp_size_3': 1, 'kernel': 'Weibull', 'loss_name': 'CensoredNLLLoss'}. Best is trial 87 with value: 0.8866301826616875.[0m
[32m[I 2022-04-15 22:22:53,750][0m Trial 271 finished with value: 0.8812626022779861 and parameters: {'n_hidden': 1024, 'mixture_components': 10, 'use_sparse_layer': True, 'use_sparse_loss': True, 'lmbd': 0.0019108802853209982, 'use_batchnorm': False, 'use_dropout': True, 'dropout': 0.7947542805928389, 'mlp_size_1': 2, 'mlp_size_2': 4, 'mlp_size_3': 1, 'kernel': 'Weibull', 'loss_name': 'CensoredNLLLoss'}. Best is trial 87 with value: 0.8866301826616875.[0m
[32m[I 2022-04-15 22:25:48,181][0m Trial 272 finished with value: 0.7844658850759487 and parameters: {'n_hidden': 1024, 'mixture_components': 10, 'use_sparse_layer': False, 'use_batchnorm': False, 'use_dropout': True, 'dropout': 0.6118225849948736, 'mlp_size_1': 1, 'mlp_size_2': 4, 'mlp_size_3': 1, 'kernel': 'LogNormal', 'loss_name': 'CensoredNLLLoss'}. Best is trial 87 with value: 0.8866301826616875.[0m
[32m[I 2022-04-15 22:28:45,325][0m Trial 273 finished with value: 0.8849370112537756 and parameters: {'n_hidden': 1024, 'mixture_components': 10, 'use_sparse_layer': True, 'use_sparse_loss': False, 'use_batchnorm': False, 'use_dropout': True, 'dropout': 0.6593119190394165, 'mlp_size_1': 2, 'mlp_size_2': 4, 'mlp_size_3': 1, 'kernel': 'Weibull', 'loss_name': 'CensoredNLLLoss'}. Best is trial 87 with value: 0.8866301826616875.[0m
[32m[I 2022-04-15 22:31:41,985][0m Trial 274 finished with value: 0.8802663949604813 and parameters: {'n_hidden': 1024, 'mixture_components': 10, 'use_sparse_layer': True, 'use_sparse_loss': False, 'use_batchnorm': False, 'use_dropout': True, 'dropout': 0.6791897348362121, 'mlp_size_1': 3, 'mlp_size_2': 3, 'mlp_size_3': 1, 'kernel': 'Weibull', 'loss_name': 'CensoredNLLLoss'}. Best is trial 87 with value: 0.8866301826616875.[0m
[32m[I 2022-04-15 22:34:22,273][0m Trial 275 finished with value: 0.8837680840525227 and parameters: {'n_hidden': 1024, 'mixture_components': 9, 'use_sparse_layer': True, 'use_sparse_loss': False, 'use_batchnorm': False, 'use_dropout': True, 'dropout': 0.5979730018675453, 'mlp_size_1': 1, 'mlp_size_2': 4, 'mlp_size_3': 1, 'kernel': 'Weibull', 'loss_name': 'CensoredNLLLoss'}. Best is trial 87 with value: 0.8866301826616875.[0m
[32m[I 2022-04-15 22:37:09,801][0m Trial 276 finished with value: 0.8812987315746866 and parameters: {'n_hidden': 128, 'mixture_components': 10, 'use_sparse_layer': True, 'use_sparse_loss': True, 'lmbd': 0.008234670226712804, 'use_batchnorm': False, 'use_dropout': True, 'dropout': 0.5846930245313232, 'mlp_size_1': 2, 'mlp_size_2': 2, 'mlp_size_3': 0, 'kernel': 'Weibull', 'loss_name': 'CensoredNLLLoss'}. Best is trial 87 with value: 0.8866301826616875.[0m
[32m[I 2022-04-15 22:39:30,297][0m Trial 277 finished with value: 0.7869280479885995 and parameters: {'n_hidden': 1024, 'mixture_components': 10, 'use_sparse_layer': True, 'use_sparse_loss': False, 'use_batchnorm': False, 'use_dropout': True, 'dropout': 0.32963040043007724, 'mlp_size_1': 2, 'mlp_size_2': 4, 'mlp_size_3': 1, 'kernel': 'Exponential', 'loss_name': 'CensoredNLLLoss'}. Best is trial 87 with value: 0.8866301826616875.[0m
[32m[I 2022-04-15 22:41:33,848][0m Trial 278 finished with value: 0.8834272546270607 and parameters: {'n_hidden': 256, 'mixture_components': 9, 'use_sparse_layer': True, 'use_sparse_loss': False, 'use_batchnorm': False, 'use_dropout': True, 'dropout': 0.6244532176716037, 'mlp_size_1': 3, 'mlp_size_2': 2, 'mlp_size_3': 0, 'kernel': 'Gamma', 'loss_name': 'AlternativeNLLLoss'}. Best is trial 87 with value: 0.8866301826616875.[0m
[32m[I 2022-04-15 22:44:00,822][0m Trial 279 finished with value: 0.8857350965074009 and parameters: {'n_hidden': 1024, 'mixture_components': 10, 'use_sparse_layer': True, 'use_sparse_loss': True, 'lmbd': 0.04389430353916035, 'use_batchnorm': False, 'use_dropout': True, 'dropout': 0.45335079138509926, 'mlp_size_1': 1, 'mlp_size_2': 3, 'mlp_size_3': 1, 'kernel': 'LogLogistic', 'loss_name': 'CensoredNLLLoss'}. Best is trial 87 with value: 0.8866301826616875.[0m
[32m[I 2022-04-15 22:46:39,302][0m Trial 280 finished with value: 0.7845401204850634 and parameters: {'n_hidden': 1024, 'mixture_components': 10, 'use_sparse_layer': True, 'use_sparse_loss': False, 'use_batchnorm': False, 'use_dropout': True, 'dropout': 0.46288087666168726, 'mlp_size_1': 2, 'mlp_size_2': 4, 'mlp_size_3': 1, 'kernel': 'LogLogistic', 'loss_name': 'CensoredNLLLoss'}. Best is trial 87 with value: 0.8866301826616875.[0m
[32m[I 2022-04-15 22:49:28,924][0m Trial 281 finished with value: 0.8824597301086559 and parameters: {'n_hidden': 1024, 'mixture_components': 7, 'use_sparse_layer': True, 'use_sparse_loss': False, 'use_batchnorm': False, 'use_dropout': True, 'dropout': 0.4156000901841621, 'mlp_size_1': 1, 'mlp_size_2': 3, 'mlp_size_3': 1, 'kernel': 'LogLogistic', 'loss_name': 'CensoredNLLLoss'}. Best is trial 87 with value: 0.8866301826616875.[0m
[32m[I 2022-04-15 22:52:30,576][0m Trial 282 finished with value: 0.8828971100242043 and parameters: {'n_hidden': 1024, 'mixture_components': 10, 'use_sparse_layer': True, 'use_sparse_loss': True, 'lmbd': 0.0432938752514053, 'use_batchnorm': False, 'use_dropout': True, 'dropout': 0.44366687227922996, 'mlp_size_1': 3, 'mlp_size_2': 3, 'mlp_size_3': 1, 'kernel': 'LogLogistic', 'loss_name': 'CensoredNLLLoss'}. Best is trial 87 with value: 0.8866301826616875.[0m
[32m[I 2022-04-15 22:54:48,049][0m Trial 283 finished with value: 0.777273427804771 and parameters: {'n_hidden': 64, 'mixture_components': 10, 'use_sparse_layer': True, 'use_sparse_loss': False, 'use_batchnorm': False, 'use_dropout': True, 'dropout': 0.4824544616166782, 'mlp_size_1': 2, 'mlp_size_2': 1, 'mlp_size_3': 0, 'kernel': 'LogLogistic', 'loss_name': 'CensoredNLLLoss'}. Best is trial 87 with value: 0.8866301826616875.[0m
[32m[I 2022-04-15 22:56:32,832][0m Trial 284 finished with value: 0.8419094607412816 and parameters: {'n_hidden': 1024, 'mixture_components': 10, 'use_sparse_layer': False, 'use_batchnorm': False, 'use_dropout': True, 'dropout': 0.2590484281572457, 'mlp_size_1': 1, 'mlp_size_2': 3, 'mlp_size_3': 1, 'kernel': 'LogLogistic', 'loss_name': 'NLLLoss'}. Best is trial 87 with value: 0.8866301826616875.[0m
[32m[I 2022-04-15 22:59:05,521][0m Trial 285 finished with value: 0.8849901942244266 and parameters: {'n_hidden': 1024, 'mixture_components': 10, 'use_sparse_layer': True, 'use_sparse_loss': False, 'use_batchnorm': False, 'use_dropout': True, 'dropout': 0.4519768409669356, 'mlp_size_1': 3, 'mlp_size_2': 3, 'mlp_size_3': 1, 'kernel': 'Weibull', 'loss_name': 'CensoredNLLLoss'}. Best is trial 87 with value: 0.8866301826616875.[0m
[32m[I 2022-04-15 23:01:38,410][0m Trial 286 finished with value: 0.8858271725846963 and parameters: {'n_hidden': 1024, 'mixture_components': 10, 'use_sparse_layer': True, 'use_sparse_loss': True, 'lmbd': 0.005595004109140061, 'use_batchnorm': False, 'use_dropout': True, 'dropout': 0.4980279360906639, 'mlp_size_1': 2, 'mlp_size_2': 4, 'mlp_size_3': 1, 'kernel': 'Weibull', 'loss_name': 'CensoredNLLLoss'}. Best is trial 87 with value: 0.8866301826616875.[0m
/media/san2_ssd/data/Workdir/survival/utils.py:305: RuntimeWarning: invalid value encountered in true_divide
  pdfs = np.gradient(1-survs,axis=1)/norms
[32m[I 2022-04-15 23:07:00,336][0m Trial 287 finished with value: 0.8805823748646289 and parameters: {'n_hidden': 1024, 'mixture_components': 10, 'use_sparse_layer': True, 'use_sparse_loss': True, 'lmbd': 0.005323513145737111, 'use_batchnorm': True, 'use_dropout': True, 'dropout': 0.49625754856079873, 'mlp_size_1': 2, 'mlp_size_2': 4, 'mlp_size_3': 1, 'kernel': 'Logistic', 'loss_name': 'CensoredNLLLoss'}. Best is trial 87 with value: 0.8866301826616875.[0m
[32m[I 2022-04-15 23:09:28,463][0m Trial 288 finished with value: 0.883848703737111 and parameters: {'n_hidden': 1024, 'mixture_components': 10, 'use_sparse_layer': True, 'use_sparse_loss': True, 'lmbd': 0.0025876998212483195, 'use_batchnorm': False, 'use_dropout': True, 'dropout': 0.5127842337445349, 'mlp_size_1': 2, 'mlp_size_2': 4, 'mlp_size_3': 1, 'kernel': 'Weibull', 'loss_name': 'CensoredNLLLoss'}. Best is trial 87 with value: 0.8866301826616875.[0m
[32m[I 2022-04-15 23:12:02,415][0m Trial 289 finished with value: 0.8832438911772972 and parameters: {'n_hidden': 1024, 'mixture_components': 8, 'use_sparse_layer': True, 'use_sparse_loss': True, 'lmbd': 0.024605281011516555, 'use_batchnorm': False, 'use_dropout': True, 'dropout': 0.47954111556173235, 'mlp_size_1': 2, 'mlp_size_2': 4, 'mlp_size_3': 1, 'kernel': 'Weibull', 'loss_name': 'CensoredNLLLoss'}. Best is trial 87 with value: 0.8866301826616875.[0m
[32m[I 2022-04-15 23:14:46,465][0m Trial 290 finished with value: 0.884204914773002 and parameters: {'n_hidden': 1024, 'mixture_components': 9, 'use_sparse_layer': True, 'use_sparse_loss': True, 'lmbd': 0.015882060888234496, 'use_batchnorm': False, 'use_dropout': True, 'dropout': 0.5355523435780072, 'mlp_size_1': 2, 'mlp_size_2': 4, 'mlp_size_3': 1, 'kernel': 'Weibull', 'loss_name': 'CensoredNLLLoss'}. Best is trial 87 with value: 0.8866301826616875.[0m
[32m[I 2022-04-15 23:17:15,547][0m Trial 291 finished with value: 0.8832936820309307 and parameters: {'n_hidden': 1024, 'mixture_components': 10, 'use_sparse_layer': True, 'use_sparse_loss': True, 'lmbd': 0.0038827831749015003, 'use_batchnorm': False, 'use_dropout': True, 'dropout': 0.357923965815105, 'mlp_size_1': 2, 'mlp_size_2': 4, 'mlp_size_3': 1, 'kernel': 'Weibull', 'loss_name': 'CensoredNLLLoss'}. Best is trial 87 with value: 0.8866301826616875.[0m
[32m[I 2022-04-15 23:19:32,954][0m Trial 292 finished with value: 0.3004233356570179 and parameters: {'n_hidden': 1024, 'mixture_components': 10, 'use_sparse_layer': True, 'use_sparse_loss': True, 'lmbd': 0.006219100507722909, 'use_batchnorm': False, 'use_dropout': True, 'dropout': 0.4118115628933694, 'mlp_size_1': 1, 'mlp_size_2': 3, 'mlp_size_3': 3, 'kernel': 'Gumbel', 'loss_name': 'CensoredNLLLoss'}. Best is trial 87 with value: 0.8866301826616875.[0m
[32m[I 2022-04-15 23:21:56,901][0m Trial 293 finished with value: 0.881040589483644 and parameters: {'n_hidden': 1024, 'mixture_components': 10, 'use_sparse_layer': False, 'use_batchnorm': False, 'use_dropout': True, 'dropout': 0.3808401791709072, 'mlp_size_1': 2, 'mlp_size_2': 4, 'mlp_size_3': 1, 'kernel': 'Weibull', 'loss_name': 'AlternativeNLLLoss'}. Best is trial 87 with value: 0.8866301826616875.[0m
[32m[I 2022-04-15 23:24:40,124][0m Trial 294 finished with value: 0.8847676564084459 and parameters: {'n_hidden': 1024, 'mixture_components': 10, 'use_sparse_layer': True, 'use_sparse_loss': True, 'lmbd': 0.00997195654473789, 'use_batchnorm': False, 'use_dropout': True, 'dropout': 0.5005275539289862, 'mlp_size_1': 2, 'mlp_size_2': 4, 'mlp_size_3': 1, 'kernel': 'Weibull', 'loss_name': 'CensoredNLLLoss'}. Best is trial 87 with value: 0.8866301826616875.[0m
[32m[I 2022-04-15 23:26:46,038][0m Trial 295 finished with value: 0.7580034008621924 and parameters: {'n_hidden': 32, 'mixture_components': 10, 'use_sparse_layer': True, 'use_sparse_loss': True, 'lmbd': 0.0014858102631031345, 'use_batchnorm': False, 'use_dropout': True, 'dropout': 0.5222838095101711, 'mlp_size_1': 2, 'mlp_size_2': 0, 'mlp_size_3': 0, 'kernel': 'LogLogistic', 'loss_name': 'CensoredNLLLoss'}. Best is trial 87 with value: 0.8866301826616875.[0m
[32m[I 2022-04-15 23:28:57,642][0m Trial 296 finished with value: 0.8845065987356303 and parameters: {'n_hidden': 1024, 'mixture_components': 10, 'use_sparse_layer': True, 'use_sparse_loss': False, 'use_batchnorm': False, 'use_dropout': True, 'dropout': 0.46628502266035404, 'mlp_size_1': 1, 'mlp_size_2': 3, 'mlp_size_3': 1, 'kernel': 'Gamma', 'loss_name': 'CensoredNLLLoss'}. Best is trial 87 with value: 0.8866301826616875.[0m
[32m[I 2022-04-15 23:31:27,913][0m Trial 297 finished with value: 0.886644028271613 and parameters: {'n_hidden': 1024, 'mixture_components': 10, 'use_sparse_layer': True, 'use_sparse_loss': True, 'lmbd': 0.0006747481166486846, 'use_batchnorm': False, 'use_dropout': True, 'dropout': 0.43241109297899155, 'mlp_size_1': 2, 'mlp_size_2': 3, 'mlp_size_3': 1, 'kernel': 'Weibull', 'loss_name': 'CensoredNLLLoss'}. Best is trial 297 with value: 0.886644028271613.[0m
[32m[I 2022-04-15 23:33:49,352][0m Trial 298 finished with value: 0.8838446909665587 and parameters: {'n_hidden': 1024, 'mixture_components': 10, 'use_sparse_layer': True, 'use_sparse_loss': False, 'use_batchnorm': False, 'use_dropout': True, 'dropout': 0.4354313256992456, 'mlp_size_1': 2, 'mlp_size_2': 4, 'mlp_size_3': 1, 'kernel': 'Weibull', 'loss_name': 'CensoredNLLLoss'}. Best is trial 297 with value: 0.886644028271613.[0m
