[32m[I 2022-04-13 12:12:42,855][0m Trial 71 finished with value: 0.7672440923785013 and parameters: {'splitter': 'best', 'min_samples_split': 0.03332069020468197, 'min_samples_leaf': 0.06427569042545983, 'min_weight_fraction_leaf': 0.05059838300347126, 'max_features': 0.933749070208626}. Best is trial 70 with value: 0.7678712518003701.[0m
[32m[I 2022-04-13 12:12:47,148][0m Trial 72 finished with value: 0.7675223280516692 and parameters: {'splitter': 'best', 'min_samples_split': 0.03434067867863818, 'min_samples_leaf': 0.0012194368752942407, 'min_weight_fraction_leaf': 0.05502742081419727, 'max_features': 0.9400585447860531}. Best is trial 70 with value: 0.7678712518003701.[0m
[32m[I 2022-04-13 12:12:49,306][0m Trial 73 finished with value: 0.7658338891484747 and parameters: {'splitter': 'best', 'min_samples_split': 0.03817717062311959, 'min_samples_leaf': 0.06383461551826355, 'min_weight_fraction_leaf': 0.05530822941802125, 'max_features': 0.9200255808272334}. Best is trial 70 with value: 0.7678712518003701.[0m
[32m[I 2022-04-13 12:12:51,515][0m Trial 74 finished with value: 0.7579755357200259 and parameters: {'splitter': 'best', 'min_samples_split': 0.03366054712325321, 'min_samples_leaf': 0.06507951129754963, 'min_weight_fraction_leaf': 0.08456646710638935, 'max_features': 0.9393664990538526}. Best is trial 70 with value: 0.7678712518003701.[0m
[32m[I 2022-04-13 12:12:53,359][0m Trial 75 finished with value: 0.7562091993323573 and parameters: {'splitter': 'best', 'min_samples_split': 0.0334693834158499, 'min_samples_leaf': 0.06648416690835118, 'min_weight_fraction_leaf': 0.11273606297818137, 'max_features': 0.9396564390497297}. Best is trial 70 with value: 0.7678712518003701.[0m
[32m[I 2022-04-13 12:12:55,195][0m Trial 76 finished with value: 0.7521371685971093 and parameters: {'splitter': 'best', 'min_samples_split': 0.05582886323118044, 'min_samples_leaf': 0.12380945003368918, 'min_weight_fraction_leaf': 0.07965942598174358, 'max_features': 0.8869507685109893}. Best is trial 70 with value: 0.7678712518003701.[0m
[32m[I 2022-04-13 12:12:56,519][0m Trial 77 finished with value: 0.6158847137966011 and parameters: {'splitter': 'best', 'min_samples_split': 0.035521433221875155, 'min_samples_leaf': 0.15541817856643358, 'min_weight_fraction_leaf': 0.2788843679881642, 'max_features': 0.96116141552713}. Best is trial 70 with value: 0.7678712518003701.[0m
[32m[I 2022-04-13 12:12:57,150][0m Trial 78 finished with value: 0.6158847137966011 and parameters: {'splitter': 'best', 'min_samples_split': 0.053148312360977494, 'min_samples_leaf': 0.27662304814089356, 'min_weight_fraction_leaf': 0.08974316490082117, 'max_features': 0.9090739977588109}. Best is trial 70 with value: 0.7678712518003701.[0m
[32m[I 2022-04-13 12:12:59,499][0m Trial 79 finished with value: 0.7192520710391361 and parameters: {'splitter': 'best', 'min_samples_split': 0.06925185343823587, 'min_samples_leaf': 0.07490818146083911, 'min_weight_fraction_leaf': 0.05668635438937464, 'max_features': 0.7989280194887705}. Best is trial 70 with value: 0.7678712518003701.[0m
[32m[I 2022-04-13 12:13:00,539][0m Trial 80 finished with value: 0.7079420770553924 and parameters: {'splitter': 'best', 'min_samples_split': 0.034544479318766176, 'min_samples_leaf': 0.05890947343790047, 'min_weight_fraction_leaf': 0.17147385195040907, 'max_features': 0.8628346581595668}. Best is trial 70 with value: 0.7678712518003701.[0m
[32m[I 2022-04-13 12:13:02,784][0m Trial 81 finished with value: 0.7642198659697671 and parameters: {'splitter': 'best', 'min_samples_split': 0.02553022695865072, 'min_samples_leaf': 0.03421547426759197, 'min_weight_fraction_leaf': 0.034727233964470874, 'max_features': 0.9348179670394328}. Best is trial 70 with value: 0.7678712518003701.[0m
[32m[I 2022-04-13 12:13:04,940][0m Trial 82 finished with value: 0.7685327408661294 and parameters: {'splitter': 'best', 'min_samples_split': 0.02370649537993517, 'min_samples_leaf': 0.03375409046660889, 'min_weight_fraction_leaf': 0.04219820760082217, 'max_features': 0.9358853052471423}. Best is trial 82 with value: 0.7685327408661294.[0m
[32m[I 2022-04-13 12:13:08,360][0m Trial 83 finished with value: 0.7605956517043928 and parameters: {'splitter': 'best', 'min_samples_split': 0.020468123250148244, 'min_samples_leaf': 0.03206693256872384, 'min_weight_fraction_leaf': 0.03927786348340133, 'max_features': 0.9701191132457267}. Best is trial 82 with value: 0.7685327408661294.[0m
[32m[I 2022-04-13 12:13:09,466][0m Trial 84 finished with value: 0.7676086810996317 and parameters: {'splitter': 'best', 'min_samples_split': 0.04872942350061129, 'min_samples_leaf': 0.03465607111672579, 'min_weight_fraction_leaf': 0.0597539775713, 'max_features': 0.9125576918120162}. Best is trial 82 with value: 0.7685327408661294.[0m
[32m[I 2022-04-13 12:13:10,347][0m Trial 85 finished with value: 0.7633319058705844 and parameters: {'splitter': 'best', 'min_samples_split': 0.05389887139283937, 'min_samples_leaf': 0.03351766085772766, 'min_weight_fraction_leaf': 0.0666684947028851, 'max_features': 0.9009707152078865}. Best is trial 82 with value: 0.7685327408661294.[0m
[32m[I 2022-04-13 12:13:10,567][0m Trial 86 finished with value: 0.7504475477417545 and parameters: {'splitter': 'random', 'min_samples_split': 0.06949456118964899, 'min_samples_leaf': 0.0030336108798023924, 'min_weight_fraction_leaf': 0.06017498245742664, 'max_features': 0.9295227627950592}. Best is trial 82 with value: 0.7685327408661294.[0m
[32m[I 2022-04-13 12:13:11,917][0m Trial 87 finished with value: 0.7623514660472807 and parameters: {'splitter': 'best', 'min_samples_split': 0.04683362031224368, 'min_samples_leaf': 0.1070454778178242, 'min_weight_fraction_leaf': 0.031224420222589814, 'max_features': 0.9989822735418773}. Best is trial 82 with value: 0.7685327408661294.[0m
[32m[I 2022-04-13 12:13:13,013][0m Trial 88 finished with value: 0.7599589028387848 and parameters: {'splitter': 'best', 'min_samples_split': 0.024469346704102113, 'min_samples_leaf': 0.03988738744551057, 'min_weight_fraction_leaf': 0.019506241321123174, 'max_features': 0.8941885997050036}. Best is trial 82 with value: 0.7685327408661294.[0m
[32m[I 2022-04-13 12:13:14,909][0m Trial 89 finished with value: 0.7571284732196624 and parameters: {'splitter': 'best', 'min_samples_split': 0.06979821794283222, 'min_samples_leaf': 0.08085084515340848, 'min_weight_fraction_leaf': 0.09775089484116745, 'max_features': 0.9650560448718376}. Best is trial 82 with value: 0.7685327408661294.[0m
[32m[I 2022-04-13 12:13:16,658][0m Trial 90 finished with value: 0.7474273762426028 and parameters: {'splitter': 'best', 'min_samples_split': 0.05715081548463555, 'min_samples_leaf': 0.057841113582291666, 'min_weight_fraction_leaf': 0.12566863416619156, 'max_features': 0.8116957457454582}. Best is trial 82 with value: 0.7685327408661294.[0m
[32m[I 2022-04-13 12:13:17,552][0m Trial 91 finished with value: 0.7432123772441047 and parameters: {'splitter': 'best', 'min_samples_split': 0.2812795495552079, 'min_samples_leaf': 0.033199464112303304, 'min_weight_fraction_leaf': 0.07169042394458149, 'max_features': 0.9045425518562961}. Best is trial 82 with value: 0.7685327408661294.[0m
[32m[I 2022-04-13 12:13:18,998][0m Trial 92 finished with value: 0.7641283585020304 and parameters: {'splitter': 'best', 'min_samples_split': 0.05449950430193164, 'min_samples_leaf': 0.033375059882011636, 'min_weight_fraction_leaf': 0.05680166178171032, 'max_features': 0.8436106046222265}. Best is trial 82 with value: 0.7685327408661294.[0m
[32m[I 2022-04-13 12:13:21,363][0m Trial 93 finished with value: 0.7595884243714972 and parameters: {'splitter': 'best', 'min_samples_split': 0.023541357029592522, 'min_samples_leaf': 0.051452013879874525, 'min_weight_fraction_leaf': 0.05369366990708701, 'max_features': 0.8421130264266511}. Best is trial 82 with value: 0.7685327408661294.[0m
[32m[I 2022-04-13 12:13:22,477][0m Trial 94 finished with value: 0.757426185744847 and parameters: {'splitter': 'best', 'min_samples_split': 0.03887929301184437, 'min_samples_leaf': 0.06795433598506403, 'min_weight_fraction_leaf': 0.07672930358376862, 'max_features': 0.7637747382187312}. Best is trial 82 with value: 0.7685327408661294.[0m
[32m[I 2022-04-13 12:13:24,802][0m Trial 95 finished with value: 0.761126718482813 and parameters: {'splitter': 'best', 'min_samples_split': 0.014877192720925185, 'min_samples_leaf': 0.011960125240757069, 'min_weight_fraction_leaf': 0.01491229910102193, 'max_features': 0.8779465706116989}. Best is trial 82 with value: 0.7685327408661294.[0m
[32m[I 2022-04-13 12:13:25,906][0m Trial 96 finished with value: 0.7601415998431464 and parameters: {'splitter': 'best', 'min_samples_split': 0.04357484996836161, 'min_samples_leaf': 0.029331459130527537, 'min_weight_fraction_leaf': 0.1048404920789788, 'max_features': 0.9419838855556636}. Best is trial 82 with value: 0.7685327408661294.[0m
[32m[I 2022-04-13 12:13:26,083][0m Trial 97 finished with value: 0.7567618019420829 and parameters: {'splitter': 'random', 'min_samples_split': 0.0615919448305637, 'min_samples_leaf': 0.0011232181460426732, 'min_weight_fraction_leaf': 0.036867625059354474, 'max_features': 0.9853118838057157}. Best is trial 82 with value: 0.7685327408661294.[0m
[32m[I 2022-04-13 12:13:27,490][0m Trial 98 finished with value: 0.7595048837366716 and parameters: {'splitter': 'best', 'min_samples_split': 0.029010222489437163, 'min_samples_leaf': 0.04455655732864207, 'min_weight_fraction_leaf': 0.05466213379851254, 'max_features': 0.8447223099812337}. Best is trial 82 with value: 0.7685327408661294.[0m
[32m[I 2022-04-13 12:13:28,990][0m Trial 99 finished with value: 0.7441058761076502 and parameters: {'splitter': 'best', 'min_samples_split': 0.22677482104942603, 'min_samples_leaf': 0.08996274120328487, 'min_weight_fraction_leaf': 0.026746775724427047, 'max_features': 0.7765815816458715}. Best is trial 82 with value: 0.7685327408661294.[0m
[32m[I 2022-04-13 12:13:31,577][0m Trial 100 finished with value: 0.7677251517370894 and parameters: {'splitter': 'best', 'min_samples_split': 0.09552978426831296, 'min_samples_leaf': 0.05335514333537017, 'min_weight_fraction_leaf': 0.009113832990006704, 'max_features': 0.9504019873315755}. Best is trial 82 with value: 0.7685327408661294.[0m
[32m[I 2022-04-13 12:13:33,438][0m Trial 101 finished with value: 0.7647331132733701 and parameters: {'splitter': 'best', 'min_samples_split': 0.05198104291927613, 'min_samples_leaf': 0.054773901305616664, 'min_weight_fraction_leaf': 0.012455413897771161, 'max_features': 0.9172495746972437}. Best is trial 82 with value: 0.7685327408661294.[0m
[32m[I 2022-04-13 12:13:35,525][0m Trial 102 finished with value: 0.7636983930691541 and parameters: {'splitter': 'best', 'min_samples_split': 0.12144620971192063, 'min_samples_leaf': 0.05441721898395711, 'min_weight_fraction_leaf': 0.010171538205428612, 'max_features': 0.9149973545243908}. Best is trial 82 with value: 0.7685327408661294.[0m
[32m[I 2022-04-13 12:13:36,382][0m Trial 103 finished with value: 0.7606020037705408 and parameters: {'splitter': 'best', 'min_samples_split': 0.0747032363173894, 'min_samples_leaf': 0.07499732819622995, 'min_weight_fraction_leaf': 0.00799551266075854, 'max_features': 0.9595765568696919}. Best is trial 82 with value: 0.7685327408661294.[0m
[32m[I 2022-04-13 12:13:36,590][0m Trial 104 finished with value: 0.593346362060699 and parameters: {'splitter': 'best', 'min_samples_split': 0.09344594981921753, 'min_samples_leaf': 0.39780838222046433, 'min_weight_fraction_leaf': 0.000995090296391797, 'max_features': 0.9259334903849498}. Best is trial 82 with value: 0.7685327408661294.[0m
[32m[I 2022-04-13 12:13:37,722][0m Trial 105 finished with value: 0.7695379396623343 and parameters: {'splitter': 'best', 'min_samples_split': 0.04714483207960136, 'min_samples_leaf': 0.041871440934084, 'min_weight_fraction_leaf': 0.03801197999605779, 'max_features': 0.9768840773831526}. Best is trial 105 with value: 0.7695379396623343.[0m
[32m[I 2022-04-13 12:13:39,722][0m Trial 106 finished with value: 0.7729540927062496 and parameters: {'splitter': 'best', 'min_samples_split': 0.04117298494792802, 'min_samples_leaf': 0.042867268514005824, 'min_weight_fraction_leaf': 0.018354976680518085, 'max_features': 0.9815297065981634}. Best is trial 106 with value: 0.7729540927062496.[0m
[32m[I 2022-04-13 12:13:41,731][0m Trial 107 finished with value: 0.75973506986834 and parameters: {'splitter': 'best', 'min_samples_split': 0.04805437449855393, 'min_samples_leaf': 0.0853278622099132, 'min_weight_fraction_leaf': 0.019291138494620608, 'max_features': 0.9558659747668389}. Best is trial 106 with value: 0.7729540927062496.[0m
[32m[I 2022-04-13 12:13:42,629][0m Trial 108 finished with value: 0.7680891316916145 and parameters: {'splitter': 'best', 'min_samples_split': 0.09534742979964841, 'min_samples_leaf': 0.06899228202545599, 'min_weight_fraction_leaf': 0.023045598120087232, 'max_features': 0.9876732648697655}. Best is trial 106 with value: 0.7729540927062496.[0m
[32m[I 2022-04-13 12:13:43,764][0m Trial 109 finished with value: 0.7594061382146009 and parameters: {'splitter': 'best', 'min_samples_split': 0.14577933091973472, 'min_samples_leaf': 0.12466359620016554, 'min_weight_fraction_leaf': 0.04671134535977001, 'max_features': 0.9804848510222799}. Best is trial 106 with value: 0.7729540927062496.[0m
[32m[I 2022-04-13 12:13:44,566][0m Trial 110 finished with value: 0.7278752904252518 and parameters: {'splitter': 'best', 'min_samples_split': 0.11007954304014676, 'min_samples_leaf': 0.22122465106120567, 'min_weight_fraction_leaf': 0.02980500742513585, 'max_features': 0.9878680702033816}. Best is trial 106 with value: 0.7729540927062496.[0m
[32m[I 2022-04-13 12:13:46,907][0m Trial 111 finished with value: 0.7608138009140344 and parameters: {'splitter': 'best', 'min_samples_split': 0.06322940287085704, 'min_samples_leaf': 0.06777000067255902, 'min_weight_fraction_leaf': 0.01260448789762515, 'max_features': 0.8818329490496948}. Best is trial 106 with value: 0.7729540927062496.[0m
[32m[I 2022-04-13 12:13:48,555][0m Trial 112 finished with value: 0.7663947042396628 and parameters: {'splitter': 'best', 'min_samples_split': 0.09378598106019706, 'min_samples_leaf': 0.04715246320727727, 'min_weight_fraction_leaf': 0.03554484473380556, 'max_features': 0.9550392989644505}. Best is trial 106 with value: 0.7729540927062496.[0m
[32m[I 2022-04-13 12:13:50,716][0m Trial 113 finished with value: 0.770992129968074 and parameters: {'splitter': 'best', 'min_samples_split': 0.07460976234919289, 'min_samples_leaf': 0.049271774644286406, 'min_weight_fraction_leaf': 0.03891142843402132, 'max_features': 0.9999517066466345}. Best is trial 106 with value: 0.7729540927062496.[0m
[32m[I 2022-04-13 12:13:53,185][0m Trial 114 finished with value: 0.7635117563667665 and parameters: {'splitter': 'best', 'min_samples_split': 0.09489579204297048, 'min_samples_leaf': 0.04190195668738181, 'min_weight_fraction_leaf': 0.03848123751817094, 'max_features': 0.9721338673208985}. Best is trial 106 with value: 0.7729540927062496.[0m
[32m[I 2022-04-13 12:13:54,397][0m Trial 115 finished with value: 0.7638241365686455 and parameters: {'splitter': 'best', 'min_samples_split': 0.1277726902599998, 'min_samples_leaf': 0.048873802134767705, 'min_weight_fraction_leaf': 0.024523753515557984, 'max_features': 0.9472819913996096}. Best is trial 106 with value: 0.7729540927062496.[0m
[32m[I 2022-04-13 12:13:54,562][0m Trial 116 finished with value: 0.7356957962719173 and parameters: {'splitter': 'random', 'min_samples_split': 0.07899210203940461, 'min_samples_leaf': 0.025722372992095906, 'min_weight_fraction_leaf': 0.07478472456368868, 'max_features': 0.9873311219892911}. Best is trial 106 with value: 0.7729540927062496.[0m
[32m[I 2022-04-13 12:13:55,834][0m Trial 117 finished with value: 0.7265960774365806 and parameters: {'splitter': 'best', 'min_samples_split': 0.10311549498407124, 'min_samples_leaf': 0.0791219696675216, 'min_weight_fraction_leaf': 0.23613568367976115, 'max_features': 0.9975410997203955}. Best is trial 106 with value: 0.7729540927062496.[0m
[32m[I 2022-04-13 12:13:58,236][0m Trial 118 finished with value: 0.7561985199445933 and parameters: {'splitter': 'best', 'min_samples_split': 0.19222918640503844, 'min_samples_leaf': 0.011435353956401967, 'min_weight_fraction_leaf': 0.03893023269900894, 'max_features': 0.9615593347877063}. Best is trial 106 with value: 0.7729540927062496.[0m
[32m[I 2022-04-13 12:14:01,600][0m Trial 119 finished with value: 0.765898687631687 and parameters: {'splitter': 'best', 'min_samples_split': 0.13869794594941742, 'min_samples_leaf': 0.07230861644068455, 'min_weight_fraction_leaf': 0.02323275552030943, 'max_features': 0.9494115977444098}. Best is trial 106 with value: 0.7729540927062496.[0m
[32m[I 2022-04-13 12:14:03,629][0m Trial 120 finished with value: 0.7641518425277647 and parameters: {'splitter': 'best', 'min_samples_split': 0.1437569692110606, 'min_samples_leaf': 0.04273304704549129, 'min_weight_fraction_leaf': 0.021636033780484926, 'max_features': 0.9550400262071637}. Best is trial 106 with value: 0.7729540927062496.[0m
[32m[I 2022-04-13 12:14:05,320][0m Trial 121 finished with value: 0.7688886366110229 and parameters: {'splitter': 'best', 'min_samples_split': 0.07412304660173713, 'min_samples_leaf': 0.072956433098231, 'min_weight_fraction_leaf': 0.0012597617760997937, 'max_features': 0.9266973639083071}. Best is trial 106 with value: 0.7729540927062496.[0m
[32m[I 2022-04-13 12:14:06,654][0m Trial 122 finished with value: 0.7560279980000855 and parameters: {'splitter': 'best', 'min_samples_split': 0.09639451674024345, 'min_samples_leaf': 0.0932980612995373, 'min_weight_fraction_leaf': 0.002118073555661759, 'max_features': 0.9357384534946672}. Best is trial 106 with value: 0.7729540927062496.[0m
[32m[I 2022-04-13 12:14:07,770][0m Trial 123 finished with value: 0.7611874496335428 and parameters: {'splitter': 'best', 'min_samples_split': 0.11214220939347463, 'min_samples_leaf': 0.07260751733680632, 'min_weight_fraction_leaf': 0.030839691302704364, 'max_features': 0.8870141234054467}. Best is trial 106 with value: 0.7729540927062496.[0m
[32m[I 2022-04-13 12:14:09,812][0m Trial 124 finished with value: 0.7709400095566614 and parameters: {'splitter': 'best', 'min_samples_split': 0.07509558245202819, 'min_samples_leaf': 0.026192399457253095, 'min_weight_fraction_leaf': 0.01515837228276665, 'max_features': 0.9767249348326263}. Best is trial 106 with value: 0.7729540927062496.[0m
[32m[I 2022-04-13 12:14:13,674][0m Trial 125 finished with value: 0.7724915466571712 and parameters: {'splitter': 'best', 'min_samples_split': 0.071313731559023, 'min_samples_leaf': 0.024942469818365717, 'min_weight_fraction_leaf': 0.0005104853705706506, 'max_features': 0.9738142992617707}. Best is trial 106 with value: 0.7729540927062496.[0m
[32m[I 2022-04-13 12:14:16,772][0m Trial 126 finished with value: 0.7709824715663036 and parameters: {'splitter': 'best', 'min_samples_split': 0.07867859836286002, 'min_samples_leaf': 0.020537090991338235, 'min_weight_fraction_leaf': 0.00037569879505851625, 'max_features': 0.9753872870833421}. Best is trial 106 with value: 0.7729540927062496.[0m
[32m[I 2022-04-13 12:14:18,363][0m Trial 127 finished with value: 0.7689139653704731 and parameters: {'splitter': 'best', 'min_samples_split': 0.07447137735670366, 'min_samples_leaf': 0.02264410090107454, 'min_weight_fraction_leaf': 0.008511872977306911, 'max_features': 0.9998178343000522}. Best is trial 106 with value: 0.7729540927062496.[0m
[32m[I 2022-04-13 12:14:22,409][0m Trial 128 finished with value: 0.7720444667628741 and parameters: {'splitter': 'best', 'min_samples_split': 0.07508147843094726, 'min_samples_leaf': 0.0255950816572586, 'min_weight_fraction_leaf': 0.0026068272793961997, 'max_features': 0.975617808880303}. Best is trial 106 with value: 0.7729540927062496.[0m
[32m[I 2022-04-13 12:14:25,955][0m Trial 129 finished with value: 0.768691585903021 and parameters: {'splitter': 'best', 'min_samples_split': 0.07019575722595772, 'min_samples_leaf': 0.02355197930722073, 'min_weight_fraction_leaf': 0.00045476786615231135, 'max_features': 0.9974616489740231}. Best is trial 106 with value: 0.7729540927062496.[0m
[32m[I 2022-04-13 12:14:28,320][0m Trial 130 finished with value: 0.7688819842302322 and parameters: {'splitter': 'best', 'min_samples_split': 0.07275583732090381, 'min_samples_leaf': 0.024167636124383038, 'min_weight_fraction_leaf': 0.004004569338647117, 'max_features': 0.9777203011618341}. Best is trial 106 with value: 0.7729540927062496.[0m
[32m[I 2022-04-13 12:14:31,273][0m Trial 131 finished with value: 0.7699814904833259 and parameters: {'splitter': 'best', 'min_samples_split': 0.0743452847495104, 'min_samples_leaf': 0.021133732615823048, 'min_weight_fraction_leaf': 0.0009995556087696, 'max_features': 0.998675073297775}. Best is trial 106 with value: 0.7729540927062496.[0m
[32m[I 2022-04-13 12:14:32,736][0m Trial 132 finished with value: 0.7677989369392082 and parameters: {'splitter': 'best', 'min_samples_split': 0.08055120310629743, 'min_samples_leaf': 0.0147491846142238, 'min_weight_fraction_leaf': 0.0008542884816418406, 'max_features': 0.9778628973057126}. Best is trial 106 with value: 0.7729540927062496.[0m
[32m[I 2022-04-13 12:14:34,011][0m Trial 133 finished with value: 0.7686590168743554 and parameters: {'splitter': 'best', 'min_samples_split': 0.07025064528773187, 'min_samples_leaf': 0.022635256026258266, 'min_weight_fraction_leaf': 0.01424849125173536, 'max_features': 0.9799354461388113}. Best is trial 106 with value: 0.7729540927062496.[0m
