[32m[I 2022-04-15 15:00:54,766][0m Trial 102 finished with value: 0.8803620846258079 and parameters: {'n_hidden': 1024, 'mixture_components': 10, 'use_sparse_layer': True, 'use_sparse_loss': False, 'use_batchnorm': False, 'use_dropout': True, 'dropout': 0.743923653923574, 'mlp_size_1': 3, 'mlp_size_2': 3, 'mlp_size_3': 1, 'kernel': 'Weibull', 'loss_name': 'CensoredNLLLoss'}. Best is trial 87 with value: 0.8866301826616875.[0m
[32m[I 2022-04-15 15:03:06,363][0m Trial 103 finished with value: 0.8826753213923813 and parameters: {'n_hidden': 1024, 'mixture_components': 10, 'use_sparse_layer': True, 'use_sparse_loss': False, 'use_batchnorm': False, 'use_dropout': True, 'dropout': 0.29229915723510697, 'mlp_size_1': 1, 'mlp_size_2': 2, 'mlp_size_3': 2, 'kernel': 'Weibull', 'loss_name': 'CensoredNLLLoss'}. Best is trial 87 with value: 0.8866301826616875.[0m
[32m[I 2022-04-15 15:05:16,084][0m Trial 104 finished with value: 0.8835938895392236 and parameters: {'n_hidden': 256, 'mixture_components': 9, 'use_sparse_layer': True, 'use_sparse_loss': False, 'use_batchnorm': False, 'use_dropout': True, 'dropout': 0.4778839922177013, 'mlp_size_1': 3, 'mlp_size_2': 2, 'mlp_size_3': 0, 'kernel': 'Weibull', 'loss_name': 'CensoredNLLLoss'}. Best is trial 87 with value: 0.8866301826616875.[0m
[32m[I 2022-04-15 15:07:47,505][0m Trial 105 finished with value: 0.7819994067110494 and parameters: {'n_hidden': 128, 'mixture_components': 10, 'use_sparse_layer': True, 'use_sparse_loss': True, 'lmbd': 0.006200880997754793, 'use_batchnorm': False, 'use_dropout': True, 'dropout': 0.5568093931318152, 'mlp_size_1': 2, 'mlp_size_2': 2, 'mlp_size_3': 0, 'kernel': 'LogLogistic', 'loss_name': 'CensoredNLLLoss'}. Best is trial 87 with value: 0.8866301826616875.[0m
[32m[I 2022-04-15 15:09:53,674][0m Trial 106 finished with value: 0.6851619411328773 and parameters: {'n_hidden': 1024, 'mixture_components': 10, 'use_sparse_layer': True, 'use_sparse_loss': False, 'use_batchnorm': False, 'use_dropout': True, 'dropout': 0.6033850245720064, 'mlp_size_1': 1, 'mlp_size_2': 4, 'mlp_size_3': 1, 'kernel': 'Exponential', 'loss_name': 'CensoredNLLLoss'}. Best is trial 87 with value: 0.8866301826616875.[0m
[32m[I 2022-04-15 15:12:06,184][0m Trial 107 finished with value: 0.8562593870092794 and parameters: {'n_hidden': 64, 'mixture_components': 9, 'use_sparse_layer': True, 'use_sparse_loss': False, 'use_batchnorm': False, 'use_dropout': True, 'dropout': 0.6851472469635839, 'mlp_size_1': 3, 'mlp_size_2': 0, 'mlp_size_3': 0, 'kernel': 'Weibull', 'loss_name': 'NLLLoss'}. Best is trial 87 with value: 0.8866301826616875.[0m
[32m[I 2022-04-15 15:16:53,861][0m Trial 108 finished with value: 0.7834422187854948 and parameters: {'n_hidden': 1024, 'mixture_components': 10, 'use_sparse_layer': True, 'use_sparse_loss': False, 'use_batchnorm': True, 'use_dropout': True, 'dropout': 0.6136247729948009, 'mlp_size_1': 1, 'mlp_size_2': 3, 'mlp_size_3': 1, 'kernel': 'Weibull', 'loss_name': 'CensoredNLLLoss'}. Best is trial 87 with value: 0.8866301826616875.[0m
[32m[I 2022-04-15 15:19:33,916][0m Trial 109 finished with value: 0.8853649759262213 and parameters: {'n_hidden': 1024, 'mixture_components': 10, 'use_sparse_layer': True, 'use_sparse_loss': True, 'lmbd': 7.171017634918817e-05, 'use_batchnorm': False, 'use_dropout': True, 'dropout': 0.5396609125826917, 'mlp_size_1': 0, 'mlp_size_2': 5, 'mlp_size_3': 1, 'kernel': 'Weibull', 'loss_name': 'CensoredNLLLoss'}. Best is trial 87 with value: 0.8866301826616875.[0m
[32m[I 2022-04-15 15:22:17,674][0m Trial 110 finished with value: 0.8848061407698238 and parameters: {'n_hidden': 1024, 'mixture_components': 9, 'use_sparse_layer': True, 'use_sparse_loss': True, 'lmbd': 6.960337213058625e-05, 'use_batchnorm': False, 'use_dropout': True, 'dropout': 0.5458581554384193, 'mlp_size_1': 0, 'mlp_size_2': 5, 'mlp_size_3': 1, 'kernel': 'Weibull', 'loss_name': 'CensoredNLLLoss'}. Best is trial 87 with value: 0.8866301826616875.[0m
[32m[I 2022-04-15 15:24:57,039][0m Trial 111 finished with value: 0.8805833325015925 and parameters: {'n_hidden': 1024, 'mixture_components': 10, 'use_sparse_layer': True, 'use_sparse_loss': True, 'lmbd': 7.095979177595289e-05, 'use_batchnorm': False, 'use_dropout': True, 'dropout': 0.5440758603176444, 'mlp_size_1': 0, 'mlp_size_2': 5, 'mlp_size_3': 1, 'kernel': 'Weibull', 'loss_name': 'CensoredNLLLoss'}. Best is trial 87 with value: 0.8866301826616875.[0m
[32m[I 2022-04-15 15:27:43,485][0m Trial 112 finished with value: 0.8841988831376673 and parameters: {'n_hidden': 1024, 'mixture_components': 10, 'use_sparse_layer': True, 'use_sparse_loss': True, 'lmbd': 3.529379393698417e-05, 'use_batchnorm': False, 'use_dropout': True, 'dropout': 0.580449933934172, 'mlp_size_1': 0, 'mlp_size_2': 5, 'mlp_size_3': 1, 'kernel': 'Weibull', 'loss_name': 'CensoredNLLLoss'}. Best is trial 87 with value: 0.8866301826616875.[0m
[32m[I 2022-04-15 15:30:10,273][0m Trial 113 finished with value: 0.8815662748805103 and parameters: {'n_hidden': 1024, 'mixture_components': 9, 'use_sparse_layer': True, 'use_sparse_loss': True, 'lmbd': 0.0007416418595936102, 'use_batchnorm': False, 'use_dropout': True, 'dropout': 0.49277179257843073, 'mlp_size_1': 0, 'mlp_size_2': 5, 'mlp_size_3': 1, 'kernel': 'Weibull', 'loss_name': 'CensoredNLLLoss'}. Best is trial 87 with value: 0.8866301826616875.[0m
[32m[I 2022-04-15 15:32:51,549][0m Trial 114 finished with value: 0.8825911791644547 and parameters: {'n_hidden': 1024, 'mixture_components': 10, 'use_sparse_layer': True, 'use_sparse_loss': True, 'lmbd': 4.08948278725229e-06, 'use_batchnorm': False, 'use_dropout': True, 'dropout': 0.529911831431121, 'mlp_size_1': 0, 'mlp_size_2': 6, 'mlp_size_3': 1, 'kernel': 'Weibull', 'loss_name': 'CensoredNLLLoss'}. Best is trial 87 with value: 0.8866301826616875.[0m
[32m[I 2022-04-15 15:34:51,968][0m Trial 115 finished with value: 0.837045403505545 and parameters: {'n_hidden': 1024, 'mixture_components': 10, 'use_sparse_layer': True, 'use_sparse_loss': True, 'lmbd': 0.0001921845390655793, 'use_batchnorm': False, 'use_dropout': True, 'dropout': 0.5862119125870362, 'mlp_size_1': 0, 'mlp_size_2': 4, 'mlp_size_3': 1, 'kernel': 'Gumbel', 'loss_name': 'CensoredNLLLoss'}. Best is trial 87 with value: 0.8866301826616875.[0m
[32m[I 2022-04-15 15:37:39,577][0m Trial 116 finished with value: 0.8833257079736873 and parameters: {'n_hidden': 1024, 'mixture_components': 10, 'use_sparse_layer': True, 'use_sparse_loss': True, 'lmbd': 4.345769488597484e-05, 'use_batchnorm': False, 'use_dropout': True, 'dropout': 0.5628570510498376, 'mlp_size_1': 0, 'mlp_size_2': 6, 'mlp_size_3': 1, 'kernel': 'Weibull', 'loss_name': 'CensoredNLLLoss'}. Best is trial 87 with value: 0.8866301826616875.[0m
[32m[I 2022-04-15 15:40:21,427][0m Trial 117 finished with value: 0.8855263000404976 and parameters: {'n_hidden': 1024, 'mixture_components': 9, 'use_sparse_layer': True, 'use_sparse_loss': True, 'lmbd': 0.0012117384168225207, 'use_batchnorm': False, 'use_dropout': True, 'dropout': 0.6213496000634184, 'mlp_size_1': 1, 'mlp_size_2': 3, 'mlp_size_3': 1, 'kernel': 'Weibull', 'loss_name': 'CensoredNLLLoss'}. Best is trial 87 with value: 0.8866301826616875.[0m
[32m[I 2022-04-15 15:42:29,933][0m Trial 118 finished with value: 0.8836187181084025 and parameters: {'n_hidden': 1024, 'mixture_components': 9, 'use_sparse_layer': True, 'use_sparse_loss': True, 'lmbd': 0.0002562353789363635, 'use_batchnorm': False, 'use_dropout': True, 'dropout': 0.1193448342526785, 'mlp_size_1': 1, 'mlp_size_2': 3, 'mlp_size_3': 1, 'kernel': 'Weibull', 'loss_name': 'CensoredNLLLoss'}. Best is trial 87 with value: 0.8866301826616875.[0m
[32m[I 2022-04-15 15:45:37,484][0m Trial 119 finished with value: 0.8734112754137955 and parameters: {'n_hidden': 32, 'mixture_components': 9, 'use_sparse_layer': True, 'use_sparse_loss': True, 'lmbd': 0.0011214685001898605, 'use_batchnorm': False, 'use_dropout': True, 'dropout': 0.4575051495868651, 'mlp_size_1': 1, 'mlp_size_2': 1, 'mlp_size_3': 0, 'kernel': 'Weibull', 'loss_name': 'CensoredNLLLoss'}. Best is trial 87 with value: 0.8866301826616875.[0m
[32m[I 2022-04-15 15:48:33,977][0m Trial 120 finished with value: 0.7849074504923698 and parameters: {'n_hidden': 1024, 'mixture_components': 9, 'use_sparse_layer': True, 'use_sparse_loss': True, 'lmbd': 0.00014745735835947245, 'use_batchnorm': False, 'use_dropout': True, 'dropout': 0.6321823512348136, 'mlp_size_1': 1, 'mlp_size_2': 3, 'mlp_size_3': 1, 'kernel': 'Normal', 'loss_name': 'AlternativeNLLLoss'}. Best is trial 87 with value: 0.8866301826616875.[0m
[32m[I 2022-04-15 15:50:48,775][0m Trial 121 finished with value: 0.8804816872337851 and parameters: {'n_hidden': 1024, 'mixture_components': 10, 'use_sparse_layer': True, 'use_sparse_loss': True, 'lmbd': 0.0033648282272022655, 'use_batchnorm': False, 'use_dropout': True, 'dropout': 0.5976338108417962, 'mlp_size_1': 2, 'mlp_size_2': 3, 'mlp_size_3': 1, 'kernel': 'Weibull', 'loss_name': 'CensoredNLLLoss'}. Best is trial 87 with value: 0.8866301826616875.[0m
[32m[I 2022-04-15 15:53:24,152][0m Trial 122 finished with value: 0.8848118191070824 and parameters: {'n_hidden': 1024, 'mixture_components': 10, 'use_sparse_layer': True, 'use_sparse_loss': True, 'lmbd': 0.0009867442078191316, 'use_batchnorm': False, 'use_dropout': True, 'dropout': 0.5372064729176393, 'mlp_size_1': 0, 'mlp_size_2': 4, 'mlp_size_3': 1, 'kernel': 'Weibull', 'loss_name': 'CensoredNLLLoss'}. Best is trial 87 with value: 0.8866301826616875.[0m
[32m[I 2022-04-15 15:55:55,403][0m Trial 123 finished with value: 0.879619224671702 and parameters: {'n_hidden': 1024, 'mixture_components': 10, 'use_sparse_layer': True, 'use_sparse_loss': True, 'lmbd': 4.194342197049807e-05, 'use_batchnorm': False, 'use_dropout': True, 'dropout': 0.5300260198318616, 'mlp_size_1': 0, 'mlp_size_2': 4, 'mlp_size_3': 1, 'kernel': 'Weibull', 'loss_name': 'CensoredNLLLoss'}. Best is trial 87 with value: 0.8866301826616875.[0m
[32m[I 2022-04-15 15:59:05,697][0m Trial 124 finished with value: 0.8791657473819117 and parameters: {'n_hidden': 1024, 'mixture_components': 10, 'use_sparse_layer': True, 'use_sparse_loss': True, 'lmbd': 0.0011704737766763456, 'use_batchnorm': False, 'use_dropout': True, 'dropout': 0.5018588373259433, 'mlp_size_1': 0, 'mlp_size_2': 5, 'mlp_size_3': 1, 'kernel': 'LogNormal', 'loss_name': 'CensoredNLLLoss'}. Best is trial 87 with value: 0.8866301826616875.[0m
[32m[I 2022-04-15 16:02:04,628][0m Trial 125 finished with value: 0.8830794586861769 and parameters: {'n_hidden': 1024, 'mixture_components': 10, 'use_sparse_layer': True, 'use_sparse_loss': True, 'lmbd': 0.005395707168530058, 'use_batchnorm': False, 'use_dropout': True, 'dropout': 0.5589969990840644, 'mlp_size_1': 0, 'mlp_size_2': 5, 'mlp_size_3': 1, 'kernel': 'Weibull', 'loss_name': 'CensoredNLLLoss'}. Best is trial 87 with value: 0.8866301826616875.[0m
[32m[I 2022-04-15 16:04:41,170][0m Trial 126 finished with value: 0.8838201400743847 and parameters: {'n_hidden': 1024, 'mixture_components': 9, 'use_sparse_layer': True, 'use_sparse_loss': True, 'lmbd': 8.679031103649074e-05, 'use_batchnorm': False, 'use_dropout': True, 'dropout': 0.36609246981192983, 'mlp_size_1': 1, 'mlp_size_2': 3, 'mlp_size_3': 3, 'kernel': 'Weibull', 'loss_name': 'CensoredNLLLoss'}. Best is trial 87 with value: 0.8866301826616875.[0m
[32m[I 2022-04-15 16:11:43,003][0m Trial 127 finished with value: 0.7653777516606391 and parameters: {'n_hidden': 256, 'mixture_components': 10, 'use_sparse_layer': True, 'use_sparse_loss': True, 'lmbd': 0.016406126546489725, 'use_batchnorm': True, 'use_dropout': True, 'dropout': 0.673454648261088, 'mlp_size_1': 0, 'mlp_size_2': 3, 'mlp_size_3': 1, 'kernel': 'LogLogistic', 'loss_name': 'CensoredNLLLoss'}. Best is trial 87 with value: 0.8866301826616875.[0m
[32m[I 2022-04-15 16:13:17,137][0m Trial 128 finished with value: 0.3486002050053612 and parameters: {'n_hidden': 128, 'mixture_components': 10, 'use_sparse_layer': True, 'use_sparse_loss': True, 'lmbd': 0.0002984690400075439, 'use_batchnorm': False, 'use_dropout': True, 'dropout': 0.41574372241536556, 'mlp_size_1': 2, 'mlp_size_2': 2, 'mlp_size_3': 0, 'kernel': 'Exponential', 'loss_name': 'NLLLoss'}. Best is trial 87 with value: 0.8866301826616875.[0m
[32m[I 2022-04-15 16:15:41,783][0m Trial 129 finished with value: 0.8850369248892548 and parameters: {'n_hidden': 1024, 'mixture_components': 10, 'use_sparse_layer': True, 'use_sparse_loss': True, 'lmbd': 0.0009445524029116138, 'use_batchnorm': False, 'use_dropout': True, 'dropout': 0.5721242811350428, 'mlp_size_1': 1, 'mlp_size_2': 4, 'mlp_size_3': 1, 'kernel': 'Weibull', 'loss_name': 'CensoredNLLLoss'}. Best is trial 87 with value: 0.8866301826616875.[0m
[32m[I 2022-04-15 16:18:17,537][0m Trial 130 finished with value: 0.8830131778489239 and parameters: {'n_hidden': 1024, 'mixture_components': 10, 'use_sparse_layer': False, 'use_batchnorm': False, 'use_dropout': True, 'dropout': 0.6290728450447106, 'mlp_size_1': 1, 'mlp_size_2': 4, 'mlp_size_3': 1, 'kernel': 'Weibull', 'loss_name': 'CensoredNLLLoss'}. Best is trial 87 with value: 0.8866301826616875.[0m
[32m[I 2022-04-15 16:20:57,253][0m Trial 131 finished with value: 0.8830548847936056 and parameters: {'n_hidden': 1024, 'mixture_components': 10, 'use_sparse_layer': True, 'use_sparse_loss': True, 'lmbd': 0.0010094422835381018, 'use_batchnorm': False, 'use_dropout': True, 'dropout': 0.5659039661595454, 'mlp_size_1': 1, 'mlp_size_2': 4, 'mlp_size_3': 1, 'kernel': 'Weibull', 'loss_name': 'CensoredNLLLoss'}. Best is trial 87 with value: 0.8866301826616875.[0m
[32m[I 2022-04-15 16:23:27,654][0m Trial 132 finished with value: 0.8838007773143401 and parameters: {'n_hidden': 1024, 'mixture_components': 10, 'use_sparse_layer': True, 'use_sparse_loss': True, 'lmbd': 0.0004906326897901087, 'use_batchnorm': False, 'use_dropout': True, 'dropout': 0.5281866802357342, 'mlp_size_1': 1, 'mlp_size_2': 3, 'mlp_size_3': 1, 'kernel': 'Weibull', 'loss_name': 'CensoredNLLLoss'}. Best is trial 87 with value: 0.8866301826616875.[0m
[32m[I 2022-04-15 16:26:01,039][0m Trial 133 finished with value: 0.8822887342659438 and parameters: {'n_hidden': 1024, 'mixture_components': 10, 'use_sparse_layer': True, 'use_sparse_loss': True, 'lmbd': 0.0015824424938909133, 'use_batchnorm': False, 'use_dropout': True, 'dropout': 0.5832618068037544, 'mlp_size_1': 1, 'mlp_size_2': 3, 'mlp_size_3': 1, 'kernel': 'Weibull', 'loss_name': 'CensoredNLLLoss'}. Best is trial 87 with value: 0.8866301826616875.[0m
[32m[I 2022-04-15 16:28:43,038][0m Trial 134 finished with value: 0.88622635132547 and parameters: {'n_hidden': 1024, 'mixture_components': 10, 'use_sparse_layer': True, 'use_sparse_loss': True, 'lmbd': 0.027458592587262978, 'use_batchnorm': False, 'use_dropout': True, 'dropout': 0.4840008148452898, 'mlp_size_1': 2, 'mlp_size_2': 4, 'mlp_size_3': 1, 'kernel': 'Weibull', 'loss_name': 'CensoredNLLLoss'}. Best is trial 87 with value: 0.8866301826616875.[0m
[32m[I 2022-04-15 16:31:53,687][0m Trial 135 finished with value: 0.8819077082080433 and parameters: {'n_hidden': 64, 'mixture_components': 10, 'use_sparse_layer': True, 'use_sparse_loss': True, 'lmbd': 0.03029936779688156, 'use_batchnorm': False, 'use_dropout': True, 'dropout': 0.5019945604524461, 'mlp_size_1': 1, 'mlp_size_2': 2, 'mlp_size_3': 0, 'kernel': 'Weibull', 'loss_name': 'CensoredNLLLoss'}. Best is trial 87 with value: 0.8866301826616875.[0m
[32m[I 2022-04-15 16:34:22,651][0m Trial 136 finished with value: 0.8850310344722555 and parameters: {'n_hidden': 1024, 'mixture_components': 10, 'use_sparse_layer': True, 'use_sparse_loss': True, 'lmbd': 0.004227335541075829, 'use_batchnorm': False, 'use_dropout': True, 'dropout': 0.47859553110001085, 'mlp_size_1': 2, 'mlp_size_2': 4, 'mlp_size_3': 1, 'kernel': 'Weibull', 'loss_name': 'CensoredNLLLoss'}. Best is trial 87 with value: 0.8866301826616875.[0m
[32m[I 2022-04-15 16:37:15,487][0m Trial 137 finished with value: 0.8851016585954194 and parameters: {'n_hidden': 2048, 'mixture_components': 10, 'use_sparse_layer': True, 'use_sparse_loss': False, 'use_batchnorm': False, 'use_dropout': True, 'dropout': 0.44779746309201995, 'mlp_size_1': 2, 'mlp_size_2': 4, 'mlp_size_3': 1, 'kernel': 'Weibull', 'loss_name': 'CensoredNLLLoss'}. Best is trial 87 with value: 0.8866301826616875.[0m
[32m[I 2022-04-15 16:39:47,742][0m Trial 138 finished with value: 0.8802200468292712 and parameters: {'n_hidden': 2048, 'mixture_components': 10, 'use_sparse_layer': True, 'use_sparse_loss': False, 'use_batchnorm': False, 'use_dropout': True, 'dropout': 0.43626330043402667, 'mlp_size_1': 2, 'mlp_size_2': 4, 'mlp_size_3': 1, 'kernel': 'Weibull', 'loss_name': 'CensoredNLLLoss'}. Best is trial 87 with value: 0.8866301826616875.[0m
[32m[I 2022-04-15 16:42:38,734][0m Trial 139 finished with value: 0.8825587377771476 and parameters: {'n_hidden': 2048, 'mixture_components': 10, 'use_sparse_layer': True, 'use_sparse_loss': True, 'lmbd': 0.006208466171773922, 'use_batchnorm': False, 'use_dropout': True, 'dropout': 0.4683952586896135, 'mlp_size_1': 2, 'mlp_size_2': 4, 'mlp_size_3': 1, 'kernel': 'Weibull', 'loss_name': 'CensoredNLLLoss'}. Best is trial 87 with value: 0.8866301826616875.[0m
[32m[I 2022-04-15 16:45:14,948][0m Trial 140 finished with value: 0.8482558351379037 and parameters: {'n_hidden': 2048, 'mixture_components': 10, 'use_sparse_layer': True, 'use_sparse_loss': False, 'use_batchnorm': False, 'use_dropout': True, 'dropout': 0.37140342439385704, 'mlp_size_1': 2, 'mlp_size_2': 4, 'mlp_size_3': 1, 'kernel': 'Gumbel', 'loss_name': 'CensoredNLLLoss'}. Best is trial 87 with value: 0.8866301826616875.[0m
[32m[I 2022-04-15 16:48:11,219][0m Trial 141 finished with value: 0.8831887816437105 and parameters: {'n_hidden': 2048, 'mixture_components': 10, 'use_sparse_layer': True, 'use_sparse_loss': False, 'use_batchnorm': False, 'use_dropout': True, 'dropout': 0.4151145756720825, 'mlp_size_1': 2, 'mlp_size_2': 3, 'mlp_size_3': 1, 'kernel': 'Weibull', 'loss_name': 'CensoredNLLLoss'}. Best is trial 87 with value: 0.8866301826616875.[0m
[32m[I 2022-04-15 16:50:49,347][0m Trial 142 finished with value: 0.8861279117505341 and parameters: {'n_hidden': 1024, 'mixture_components': 10, 'use_sparse_layer': True, 'use_sparse_loss': False, 'use_batchnorm': False, 'use_dropout': True, 'dropout': 0.33842592485073164, 'mlp_size_1': 2, 'mlp_size_2': 3, 'mlp_size_3': 1, 'kernel': 'Weibull', 'loss_name': 'CensoredNLLLoss'}. Best is trial 87 with value: 0.8866301826616875.[0m
[32m[I 2022-04-15 16:53:08,216][0m Trial 143 finished with value: 0.8852579031374026 and parameters: {'n_hidden': 1024, 'mixture_components': 10, 'use_sparse_layer': True, 'use_sparse_loss': False, 'use_batchnorm': False, 'use_dropout': True, 'dropout': 0.3395059226164094, 'mlp_size_1': 2, 'mlp_size_2': 4, 'mlp_size_3': 1, 'kernel': 'Weibull', 'loss_name': 'CensoredNLLLoss'}. Best is trial 87 with value: 0.8866301826616875.[0m
[32m[I 2022-04-15 16:55:16,741][0m Trial 144 finished with value: 0.7775025741836659 and parameters: {'n_hidden': 1024, 'mixture_components': 10, 'use_sparse_layer': True, 'use_sparse_loss': False, 'use_batchnorm': False, 'use_dropout': True, 'dropout': 0.3253888272534179, 'mlp_size_1': 2, 'mlp_size_2': 4, 'mlp_size_3': 1, 'kernel': 'Weibull', 'loss_name': 'CensoredNLLLoss'}. Best is trial 87 with value: 0.8866301826616875.[0m
[32m[I 2022-04-15 16:57:36,913][0m Trial 145 finished with value: 0.882626043636576 and parameters: {'n_hidden': 1024, 'mixture_components': 10, 'use_sparse_layer': True, 'use_sparse_loss': False, 'use_batchnorm': False, 'use_dropout': True, 'dropout': 0.34380811599206884, 'mlp_size_1': 2, 'mlp_size_2': 3, 'mlp_size_3': 1, 'kernel': 'Weibull', 'loss_name': 'CensoredNLLLoss'}. Best is trial 87 with value: 0.8866301826616875.[0m
[32m[I 2022-04-15 16:59:54,035][0m Trial 146 finished with value: 0.8796434988349991 and parameters: {'n_hidden': 1024, 'mixture_components': 10, 'use_sparse_layer': True, 'use_sparse_loss': False, 'use_batchnorm': False, 'use_dropout': True, 'dropout': 0.3034578932506376, 'mlp_size_1': 2, 'mlp_size_2': 3, 'mlp_size_3': 1, 'kernel': 'Weibull', 'loss_name': 'CensoredNLLLoss'}. Best is trial 87 with value: 0.8866301826616875.[0m
[32m[I 2022-04-15 17:02:14,448][0m Trial 147 finished with value: 0.7853592326468399 and parameters: {'n_hidden': 1024, 'mixture_components': 9, 'use_sparse_layer': True, 'use_sparse_loss': False, 'use_batchnorm': False, 'use_dropout': True, 'dropout': 0.26557828589971894, 'mlp_size_1': 2, 'mlp_size_2': 3, 'mlp_size_3': 1, 'kernel': 'Weibull', 'loss_name': 'CensoredNLLLoss'}. Best is trial 87 with value: 0.8866301826616875.[0m
[32m[I 2022-04-15 17:05:26,249][0m Trial 148 finished with value: 0.7682045105381221 and parameters: {'n_hidden': 32, 'mixture_components': 10, 'use_sparse_layer': True, 'use_sparse_loss': False, 'use_batchnorm': False, 'use_dropout': True, 'dropout': 0.37575192416480707, 'mlp_size_1': 2, 'mlp_size_2': 0, 'mlp_size_3': 0, 'kernel': 'Normal', 'loss_name': 'AlternativeNLLLoss'}. Best is trial 87 with value: 0.8866301826616875.[0m
[32m[I 2022-04-15 17:07:58,290][0m Trial 149 finished with value: 0.8846110042356642 and parameters: {'n_hidden': 1024, 'mixture_components': 10, 'use_sparse_layer': True, 'use_sparse_loss': False, 'use_batchnorm': False, 'use_dropout': True, 'dropout': 0.40940358195600324, 'mlp_size_1': 3, 'mlp_size_2': 3, 'mlp_size_3': 1, 'kernel': 'Weibull', 'loss_name': 'CensoredNLLLoss'}. Best is trial 87 with value: 0.8866301826616875.[0m
