[32m[I 2022-04-13 11:50:04,263][0m Trial 309 finished with value: 0.8833803096950914 and parameters: {'splitter': 'best', 'min_samples_split': 0.11476851107869136, 'min_samples_leaf': 0.013245215105953018, 'min_weight_fraction_leaf': 0.0069380003681926775, 'max_features': 0.9988384286199232}. Best is trial 201 with value: 0.8881217621713932.[0m
/media/san2_ssd/data/Workdir/survival/utils.py:305: RuntimeWarning: invalid value encountered in true_divide
  pdfs = np.gradient(1-survs,axis=1)/norms
/media/san2_ssd/data/Workdir/survival/utils.py:305: RuntimeWarning: invalid value encountered in true_divide
  pdfs = np.gradient(1-survs,axis=1)/norms
/media/san2_ssd/data/Workdir/survival/utils.py:305: RuntimeWarning: invalid value encountered in true_divide
  pdfs = np.gradient(1-survs,axis=1)/norms
/media/san2_ssd/data/Workdir/survival/utils.py:305: RuntimeWarning: invalid value encountered in true_divide
  pdfs = np.gradient(1-survs,axis=1)/norms
[32m[I 2022-04-13 11:50:07,418][0m Trial 310 finished with value: 0.8867187101623747 and parameters: {'splitter': 'best', 'min_samples_split': 0.09774025533808747, 'min_samples_leaf': 0.04156067194777835, 'min_weight_fraction_leaf': 0.0328630293415926, 'max_features': 0.9999048593958696}. Best is trial 201 with value: 0.8881217621713932.[0m
/media/san2_ssd/data/Workdir/survival/utils.py:305: RuntimeWarning: invalid value encountered in true_divide
  pdfs = np.gradient(1-survs,axis=1)/norms
/media/san2_ssd/data/Workdir/survival/utils.py:305: RuntimeWarning: invalid value encountered in true_divide
  pdfs = np.gradient(1-survs,axis=1)/norms
/media/san2_ssd/data/Workdir/survival/utils.py:305: RuntimeWarning: invalid value encountered in true_divide
  pdfs = np.gradient(1-survs,axis=1)/norms
[32m[I 2022-04-13 11:50:09,411][0m Trial 311 finished with value: 0.8863475858828039 and parameters: {'splitter': 'best', 'min_samples_split': 0.10788936654256102, 'min_samples_leaf': 0.04767513152460395, 'min_weight_fraction_leaf': 0.03182672899238163, 'max_features': 0.9831713993885605}. Best is trial 201 with value: 0.8881217621713932.[0m
/media/san2_ssd/data/Workdir/survival/utils.py:305: RuntimeWarning: invalid value encountered in true_divide
  pdfs = np.gradient(1-survs,axis=1)/norms
/media/san2_ssd/data/Workdir/survival/utils.py:305: RuntimeWarning: invalid value encountered in true_divide
  pdfs = np.gradient(1-survs,axis=1)/norms
/media/san2_ssd/data/Workdir/survival/utils.py:305: RuntimeWarning: invalid value encountered in true_divide
  pdfs = np.gradient(1-survs,axis=1)/norms
/media/san2_ssd/data/Workdir/survival/utils.py:305: RuntimeWarning: invalid value encountered in true_divide
  pdfs = np.gradient(1-survs,axis=1)/norms
/media/san2_ssd/data/Workdir/survival/utils.py:305: RuntimeWarning: invalid value encountered in true_divide
  pdfs = np.gradient(1-survs,axis=1)/norms
[32m[I 2022-04-13 11:50:11,542][0m Trial 312 finished with value: 0.8839390906439908 and parameters: {'splitter': 'best', 'min_samples_split': 0.08286461571964937, 'min_samples_leaf': 0.04015749861373227, 'min_weight_fraction_leaf': 0.036179572006519146, 'max_features': 0.9623208188681351}. Best is trial 201 with value: 0.8881217621713932.[0m
/media/san2_ssd/data/Workdir/survival/utils.py:305: RuntimeWarning: invalid value encountered in true_divide
  pdfs = np.gradient(1-survs,axis=1)/norms
/media/san2_ssd/data/Workdir/survival/utils.py:305: RuntimeWarning: invalid value encountered in true_divide
  pdfs = np.gradient(1-survs,axis=1)/norms
/media/san2_ssd/data/Workdir/survival/utils.py:305: RuntimeWarning: invalid value encountered in true_divide
  pdfs = np.gradient(1-survs,axis=1)/norms
[32m[I 2022-04-13 11:50:15,033][0m Trial 313 finished with value: 0.8828091406553513 and parameters: {'splitter': 'best', 'min_samples_split': 0.12421431336753572, 'min_samples_leaf': 0.02049217309649394, 'min_weight_fraction_leaf': 0.041010784539889954, 'max_features': 0.9219614097580155}. Best is trial 201 with value: 0.8881217621713932.[0m
/media/san2_ssd/data/Workdir/survival/utils.py:305: RuntimeWarning: invalid value encountered in true_divide
  pdfs = np.gradient(1-survs,axis=1)/norms
[32m[I 2022-04-13 11:50:16,821][0m Trial 314 finished with value: 0.7852943261557691 and parameters: {'splitter': 'best', 'min_samples_split': 0.14618505310248425, 'min_samples_leaf': 0.05376131673226557, 'min_weight_fraction_leaf': 0.04735553585906405, 'max_features': 0.9976217984316124}. Best is trial 201 with value: 0.8881217621713932.[0m
/media/san2_ssd/data/Workdir/survival/utils.py:305: RuntimeWarning: invalid value encountered in true_divide
  pdfs = np.gradient(1-survs,axis=1)/norms
/media/san2_ssd/data/Workdir/survival/utils.py:305: RuntimeWarning: invalid value encountered in true_divide
  pdfs = np.gradient(1-survs,axis=1)/norms
/media/san2_ssd/data/Workdir/survival/utils.py:305: RuntimeWarning: invalid value encountered in true_divide
  pdfs = np.gradient(1-survs,axis=1)/norms
/media/san2_ssd/data/Workdir/survival/utils.py:305: RuntimeWarning: invalid value encountered in true_divide
  pdfs = np.gradient(1-survs,axis=1)/norms
/media/san2_ssd/data/Workdir/survival/utils.py:305: RuntimeWarning: invalid value encountered in true_divide
  pdfs = np.gradient(1-survs,axis=1)/norms
[32m[I 2022-04-13 11:50:18,239][0m Trial 315 finished with value: 0.8873502833441753 and parameters: {'splitter': 'best', 'min_samples_split': 0.11359766527360096, 'min_samples_leaf': 0.030124226579651865, 'min_weight_fraction_leaf': 0.026439883780099878, 'max_features': 0.9987756800562774}. Best is trial 201 with value: 0.8881217621713932.[0m
/media/san2_ssd/data/Workdir/survival/utils.py:305: RuntimeWarning: invalid value encountered in true_divide
  pdfs = np.gradient(1-survs,axis=1)/norms
/media/san2_ssd/data/Workdir/survival/utils.py:305: RuntimeWarning: invalid value encountered in true_divide
  pdfs = np.gradient(1-survs,axis=1)/norms
/media/san2_ssd/data/Workdir/survival/utils.py:305: RuntimeWarning: invalid value encountered in true_divide
  pdfs = np.gradient(1-survs,axis=1)/norms
/media/san2_ssd/data/Workdir/survival/utils.py:305: RuntimeWarning: invalid value encountered in true_divide
  pdfs = np.gradient(1-survs,axis=1)/norms
/media/san2_ssd/data/Workdir/survival/utils.py:305: RuntimeWarning: invalid value encountered in true_divide
  pdfs = np.gradient(1-survs,axis=1)/norms
[32m[I 2022-04-13 11:50:19,977][0m Trial 316 finished with value: 0.8831315383718035 and parameters: {'splitter': 'best', 'min_samples_split': 0.11398944801445618, 'min_samples_leaf': 0.010744514285491304, 'min_weight_fraction_leaf': 0.010208094494178335, 'max_features': 0.999981364362258}. Best is trial 201 with value: 0.8881217621713932.[0m
[32m[I 2022-04-13 11:50:20,537][0m Trial 317 finished with value: 0.6981432179087999 and parameters: {'splitter': 'best', 'min_samples_split': 0.13117037989597002, 'min_samples_leaf': 0.021161774145354122, 'min_weight_fraction_leaf': 0.4528076260051186, 'max_features': 0.9495903585814096}. Best is trial 201 with value: 0.8881217621713932.[0m
[32m[I 2022-04-13 11:50:22,433][0m Trial 318 finished with value: 0.4762173568334265 and parameters: {'splitter': 'best', 'min_samples_split': 0.32928313962284517, 'min_samples_leaf': 0.01160847334388302, 'min_weight_fraction_leaf': 0.032279043596419504, 'max_features': 0.9816788882400289}. Best is trial 201 with value: 0.8881217621713932.[0m
/media/san2_ssd/data/Workdir/survival/utils.py:305: RuntimeWarning: invalid value encountered in true_divide
  pdfs = np.gradient(1-survs,axis=1)/norms
/media/san2_ssd/data/Workdir/survival/utils.py:305: RuntimeWarning: invalid value encountered in true_divide
  pdfs = np.gradient(1-survs,axis=1)/norms
[32m[I 2022-04-13 11:50:23,857][0m Trial 319 finished with value: 0.8832752686627872 and parameters: {'splitter': 'best', 'min_samples_split': 0.12126800562422571, 'min_samples_leaf': 0.027934161736406764, 'min_weight_fraction_leaf': 0.027070823001108708, 'max_features': 0.9656543442007173}. Best is trial 201 with value: 0.8881217621713932.[0m
/media/san2_ssd/data/Workdir/survival/utils.py:305: RuntimeWarning: invalid value encountered in true_divide
  pdfs = np.gradient(1-survs,axis=1)/norms
/media/san2_ssd/data/Workdir/survival/utils.py:305: RuntimeWarning: invalid value encountered in true_divide
  pdfs = np.gradient(1-survs,axis=1)/norms
/media/san2_ssd/data/Workdir/survival/utils.py:305: RuntimeWarning: invalid value encountered in true_divide
  pdfs = np.gradient(1-survs,axis=1)/norms
/media/san2_ssd/data/Workdir/survival/utils.py:305: RuntimeWarning: invalid value encountered in true_divide
  pdfs = np.gradient(1-survs,axis=1)/norms
[32m[I 2022-04-13 11:50:25,262][0m Trial 320 finished with value: 0.8877947855517132 and parameters: {'splitter': 'best', 'min_samples_split': 0.1114225586969031, 'min_samples_leaf': 0.02150702672305427, 'min_weight_fraction_leaf': 0.04346677426050848, 'max_features': 0.9805077943555311}. Best is trial 201 with value: 0.8881217621713932.[0m
/media/san2_ssd/data/Workdir/survival/utils.py:305: RuntimeWarning: invalid value encountered in true_divide
  pdfs = np.gradient(1-survs,axis=1)/norms
/media/san2_ssd/data/Workdir/survival/utils.py:305: RuntimeWarning: invalid value encountered in true_divide
  pdfs = np.gradient(1-survs,axis=1)/norms
/media/san2_ssd/data/Workdir/survival/utils.py:305: RuntimeWarning: invalid value encountered in true_divide
  pdfs = np.gradient(1-survs,axis=1)/norms
/media/san2_ssd/data/Workdir/survival/utils.py:305: RuntimeWarning: invalid value encountered in true_divide
  pdfs = np.gradient(1-survs,axis=1)/norms
[32m[I 2022-04-13 11:50:29,020][0m Trial 321 finished with value: 0.8850989908104573 and parameters: {'splitter': 'best', 'min_samples_split': 0.11075544130770003, 'min_samples_leaf': 0.021419194677385026, 'min_weight_fraction_leaf': 0.045598561872638034, 'max_features': 0.9473100120289843}. Best is trial 201 with value: 0.8881217621713932.[0m
/media/san2_ssd/data/Workdir/survival/utils.py:305: RuntimeWarning: invalid value encountered in true_divide
  pdfs = np.gradient(1-survs,axis=1)/norms
/media/san2_ssd/data/Workdir/survival/utils.py:305: RuntimeWarning: invalid value encountered in true_divide
  pdfs = np.gradient(1-survs,axis=1)/norms
/media/san2_ssd/data/Workdir/survival/utils.py:305: RuntimeWarning: invalid value encountered in true_divide
  pdfs = np.gradient(1-survs,axis=1)/norms
/media/san2_ssd/data/Workdir/survival/utils.py:305: RuntimeWarning: invalid value encountered in true_divide
  pdfs = np.gradient(1-survs,axis=1)/norms
[32m[I 2022-04-13 11:50:31,709][0m Trial 322 finished with value: 0.8818612834558672 and parameters: {'splitter': 'best', 'min_samples_split': 0.1264821091190379, 'min_samples_leaf': 0.011630460768594805, 'min_weight_fraction_leaf': 0.045676909942363855, 'max_features': 0.9648758336639851}. Best is trial 201 with value: 0.8881217621713932.[0m
/media/san2_ssd/data/Workdir/survival/utils.py:305: RuntimeWarning: invalid value encountered in true_divide
  pdfs = np.gradient(1-survs,axis=1)/norms
/media/san2_ssd/data/Workdir/survival/utils.py:305: RuntimeWarning: invalid value encountered in true_divide
  pdfs = np.gradient(1-survs,axis=1)/norms
/media/san2_ssd/data/Workdir/survival/utils.py:305: RuntimeWarning: invalid value encountered in true_divide
  pdfs = np.gradient(1-survs,axis=1)/norms
/media/san2_ssd/data/Workdir/survival/utils.py:305: RuntimeWarning: invalid value encountered in true_divide
  pdfs = np.gradient(1-survs,axis=1)/norms
[32m[I 2022-04-13 11:50:33,640][0m Trial 323 finished with value: 0.8862709223624341 and parameters: {'splitter': 'best', 'min_samples_split': 0.11684366884364827, 'min_samples_leaf': 0.02892012317431588, 'min_weight_fraction_leaf': 0.019157990412031516, 'max_features': 0.9801119324977128}. Best is trial 201 with value: 0.8881217621713932.[0m
[32m[I 2022-04-13 11:50:37,237][0m Trial 324 finished with value: 0.8821374854646346 and parameters: {'splitter': 'best', 'min_samples_split': 0.1408735095315335, 'min_samples_leaf': 0.009096629291613232, 'min_weight_fraction_leaf': 6.105088704962472e-05, 'max_features': 0.9320450603480797}. Best is trial 201 with value: 0.8881217621713932.[0m
/media/san2_ssd/data/Workdir/survival/utils.py:305: RuntimeWarning: invalid value encountered in true_divide
  pdfs = np.gradient(1-survs,axis=1)/norms
[32m[I 2022-04-13 11:50:38,838][0m Trial 325 finished with value: 0.8822951209087941 and parameters: {'splitter': 'best', 'min_samples_split': 0.10798335304119858, 'min_samples_leaf': 0.017939680133092405, 'min_weight_fraction_leaf': 0.0648241644857394, 'max_features': 0.9642058151926313}. Best is trial 201 with value: 0.8881217621713932.[0m
/media/san2_ssd/data/Workdir/survival/utils.py:305: RuntimeWarning: invalid value encountered in true_divide
  pdfs = np.gradient(1-survs,axis=1)/norms
/media/san2_ssd/data/Workdir/survival/utils.py:305: RuntimeWarning: invalid value encountered in true_divide
  pdfs = np.gradient(1-survs,axis=1)/norms
/media/san2_ssd/data/Workdir/survival/utils.py:305: RuntimeWarning: invalid value encountered in true_divide
  pdfs = np.gradient(1-survs,axis=1)/norms
[32m[I 2022-04-13 11:50:40,563][0m Trial 326 finished with value: 0.8869369774366327 and parameters: {'splitter': 'best', 'min_samples_split': 0.13263505479489973, 'min_samples_leaf': 0.03366992151316324, 'min_weight_fraction_leaf': 0.03604364688536654, 'max_features': 0.9991694391359123}. Best is trial 201 with value: 0.8881217621713932.[0m
[32m[I 2022-04-13 11:50:40,751][0m Trial 327 finished with value: 0.6953987916579007 and parameters: {'splitter': 'best', 'min_samples_split': 0.13255640196168614, 'min_samples_leaf': 0.4093553090255657, 'min_weight_fraction_leaf': 0.015827590224964203, 'max_features': 0.9842559825175071}. Best is trial 201 with value: 0.8881217621713932.[0m
/media/san2_ssd/data/Workdir/survival/utils.py:305: RuntimeWarning: invalid value encountered in true_divide
  pdfs = np.gradient(1-survs,axis=1)/norms
/media/san2_ssd/data/Workdir/survival/utils.py:305: RuntimeWarning: invalid value encountered in true_divide
  pdfs = np.gradient(1-survs,axis=1)/norms
/media/san2_ssd/data/Workdir/survival/utils.py:305: RuntimeWarning: invalid value encountered in true_divide
  pdfs = np.gradient(1-survs,axis=1)/norms
/media/san2_ssd/data/Workdir/survival/utils.py:305: RuntimeWarning: invalid value encountered in true_divide
  pdfs = np.gradient(1-survs,axis=1)/norms
[32m[I 2022-04-13 11:50:41,855][0m Trial 328 finished with value: 0.8875203092184449 and parameters: {'splitter': 'best', 'min_samples_split': 0.12102810562853131, 'min_samples_leaf': 0.03739328981244098, 'min_weight_fraction_leaf': 0.0377184313807827, 'max_features': 0.9982990280019743}. Best is trial 201 with value: 0.8881217621713932.[0m
/media/san2_ssd/data/Workdir/survival/utils.py:305: RuntimeWarning: invalid value encountered in true_divide
  pdfs = np.gradient(1-survs,axis=1)/norms
/media/san2_ssd/data/Workdir/survival/utils.py:305: RuntimeWarning: invalid value encountered in true_divide
  pdfs = np.gradient(1-survs,axis=1)/norms
/media/san2_ssd/data/Workdir/survival/utils.py:305: RuntimeWarning: invalid value encountered in true_divide
  pdfs = np.gradient(1-survs,axis=1)/norms
[32m[I 2022-04-13 11:50:42,970][0m Trial 329 finished with value: 0.885912280768664 and parameters: {'splitter': 'best', 'min_samples_split': 0.12387474938073859, 'min_samples_leaf': 0.04976328840504743, 'min_weight_fraction_leaf': 0.04694284617596538, 'max_features': 0.9963947738129313}. Best is trial 201 with value: 0.8881217621713932.[0m
[32m[I 2022-04-13 11:50:44,540][0m Trial 330 finished with value: 0.5371812073302544 and parameters: {'splitter': 'best', 'min_samples_split': 0.13450162291060824, 'min_samples_leaf': 0.039159162335837244, 'min_weight_fraction_leaf': 0.3881390353506126, 'max_features': 0.9985526836802201}. Best is trial 201 with value: 0.8881217621713932.[0m
[32m[I 2022-04-13 11:50:44,870][0m Trial 331 finished with value: 0.7456805200845313 and parameters: {'splitter': 'random', 'min_samples_split': 0.11591175182061554, 'min_samples_leaf': 0.0328932166682565, 'min_weight_fraction_leaf': 0.17143746915338814, 'max_features': 0.948550035277509}. Best is trial 201 with value: 0.8881217621713932.[0m
/media/san2_ssd/data/Workdir/survival/utils.py:305: RuntimeWarning: invalid value encountered in true_divide
  pdfs = np.gradient(1-survs,axis=1)/norms
/media/san2_ssd/data/Workdir/survival/utils.py:305: RuntimeWarning: invalid value encountered in true_divide
  pdfs = np.gradient(1-survs,axis=1)/norms
/media/san2_ssd/data/Workdir/survival/utils.py:305: RuntimeWarning: invalid value encountered in true_divide
  pdfs = np.gradient(1-survs,axis=1)/norms
/media/san2_ssd/data/Workdir/survival/utils.py:305: RuntimeWarning: invalid value encountered in true_divide
  pdfs = np.gradient(1-survs,axis=1)/norms
[32m[I 2022-04-13 11:50:47,070][0m Trial 332 finished with value: 0.883000623210185 and parameters: {'splitter': 'best', 'min_samples_split': 0.12534553666052897, 'min_samples_leaf': 0.042547110323117504, 'min_weight_fraction_leaf': 0.037653636925811536, 'max_features': 0.9701323062436106}. Best is trial 201 with value: 0.8881217621713932.[0m
/media/san2_ssd/data/Workdir/survival/utils.py:305: RuntimeWarning: invalid value encountered in true_divide
  pdfs = np.gradient(1-survs,axis=1)/norms
[32m[I 2022-04-13 11:50:49,641][0m Trial 333 finished with value: 0.7848883998515221 and parameters: {'splitter': 'best', 'min_samples_split': 0.1528114015786782, 'min_samples_leaf': 0.05446055360086152, 'min_weight_fraction_leaf': 0.04974233227485589, 'max_features': 0.9993002697719797}. Best is trial 201 with value: 0.8881217621713932.[0m
[32m[I 2022-04-13 11:50:50,140][0m Trial 334 finished with value: 0.6981432179087999 and parameters: {'splitter': 'best', 'min_samples_split': 0.11386881230253723, 'min_samples_leaf': 0.4648639039338793, 'min_weight_fraction_leaf': 0.06445707209199575, 'max_features': 0.9801353367040545}. Best is trial 201 with value: 0.8881217621713932.[0m
/media/san2_ssd/data/Workdir/survival/utils.py:305: RuntimeWarning: invalid value encountered in true_divide
  pdfs = np.gradient(1-survs,axis=1)/norms
/media/san2_ssd/data/Workdir/survival/utils.py:305: RuntimeWarning: invalid value encountered in true_divide
  pdfs = np.gradient(1-survs,axis=1)/norms
/media/san2_ssd/data/Workdir/survival/utils.py:305: RuntimeWarning: invalid value encountered in true_divide
  pdfs = np.gradient(1-survs,axis=1)/norms
[32m[I 2022-04-13 11:50:53,397][0m Trial 335 finished with value: 0.8830720965690741 and parameters: {'splitter': 'best', 'min_samples_split': 0.12907210451374887, 'min_samples_leaf': 0.031196676241392114, 'min_weight_fraction_leaf': 0.0349465026451713, 'max_features': 0.956227035926648}. Best is trial 201 with value: 0.8881217621713932.[0m
/media/san2_ssd/data/Workdir/survival/utils.py:305: RuntimeWarning: invalid value encountered in true_divide
  pdfs = np.gradient(1-survs,axis=1)/norms
/media/san2_ssd/data/Workdir/survival/utils.py:305: RuntimeWarning: invalid value encountered in true_divide
  pdfs = np.gradient(1-survs,axis=1)/norms
/media/san2_ssd/data/Workdir/survival/utils.py:305: RuntimeWarning: invalid value encountered in true_divide
  pdfs = np.gradient(1-survs,axis=1)/norms
/media/san2_ssd/data/Workdir/survival/utils.py:305: RuntimeWarning: invalid value encountered in true_divide
  pdfs = np.gradient(1-survs,axis=1)/norms
[32m[I 2022-04-13 11:50:55,291][0m Trial 336 finished with value: 0.8856565506783001 and parameters: {'splitter': 'best', 'min_samples_split': 0.10700009705033574, 'min_samples_leaf': 0.026624870642101776, 'min_weight_fraction_leaf': 0.02719555308041648, 'max_features': 0.9798267852014475}. Best is trial 201 with value: 0.8881217621713932.[0m
/media/san2_ssd/data/Workdir/survival/utils.py:305: RuntimeWarning: invalid value encountered in true_divide
  pdfs = np.gradient(1-survs,axis=1)/norms
/media/san2_ssd/data/Workdir/survival/utils.py:305: RuntimeWarning: invalid value encountered in true_divide
  pdfs = np.gradient(1-survs,axis=1)/norms
/media/san2_ssd/data/Workdir/survival/utils.py:305: RuntimeWarning: invalid value encountered in true_divide
  pdfs = np.gradient(1-survs,axis=1)/norms
[32m[I 2022-04-13 11:50:57,966][0m Trial 337 finished with value: 0.8838563383652127 and parameters: {'splitter': 'best', 'min_samples_split': 0.11814603699618466, 'min_samples_leaf': 0.03779806391745552, 'min_weight_fraction_leaf': 0.05871009271114176, 'max_features': 0.9379300211284034}. Best is trial 201 with value: 0.8881217621713932.[0m
/media/san2_ssd/data/Workdir/survival/utils.py:305: RuntimeWarning: invalid value encountered in true_divide
  pdfs = np.gradient(1-survs,axis=1)/norms
/media/san2_ssd/data/Workdir/survival/utils.py:305: RuntimeWarning: invalid value encountered in true_divide
  pdfs = np.gradient(1-survs,axis=1)/norms
[32m[I 2022-04-13 11:51:01,276][0m Trial 338 finished with value: 0.8827343184579298 and parameters: {'splitter': 'best', 'min_samples_split': 0.1381114363437105, 'min_samples_leaf': 0.011508960733049212, 'min_weight_fraction_leaf': 0.044082071397127984, 'max_features': 0.9071768361068181}. Best is trial 201 with value: 0.8881217621713932.[0m
