[32m[I 2022-04-13 12:25:19,749][0m Trial 747 finished with value: 0.7725697739047961 and parameters: {'alpha': 1.0911915402280692, 'ties': 'breslow'}. Best is trial 676 with value: 0.7727038262700389.[0m
[32m[I 2022-04-13 12:25:23,849][0m Trial 748 finished with value: 0.7725255478310734 and parameters: {'alpha': 1.3247335019865087, 'ties': 'efron'}. Best is trial 676 with value: 0.7727038262700389.[0m
[32m[I 2022-04-13 12:25:26,715][0m Trial 749 finished with value: 0.772657284469995 and parameters: {'alpha': 1.2360080352604133, 'ties': 'breslow'}. Best is trial 676 with value: 0.7727038262700389.[0m
[32m[I 2022-04-13 12:25:30,807][0m Trial 750 finished with value: 0.772446095561939 and parameters: {'alpha': 1.433612589144507, 'ties': 'efron'}. Best is trial 676 with value: 0.7727038262700389.[0m
[32m[I 2022-04-13 12:25:35,969][0m Trial 751 finished with value: 0.7726406648083914 and parameters: {'alpha': 0.9812010212753652, 'ties': 'breslow'}. Best is trial 676 with value: 0.7727038262700389.[0m
[32m[I 2022-04-13 12:25:39,570][0m Trial 752 finished with value: 0.7725853114228161 and parameters: {'alpha': 1.17366068821337, 'ties': 'efron'}. Best is trial 676 with value: 0.7727038262700389.[0m
[32m[I 2022-04-13 12:25:43,641][0m Trial 753 finished with value: 0.7725975705847634 and parameters: {'alpha': 1.3157144026175638, 'ties': 'efron'}. Best is trial 676 with value: 0.7727038262700389.[0m
[32m[I 2022-04-13 12:25:48,531][0m Trial 754 finished with value: 0.7721705450456862 and parameters: {'alpha': 0.6586159862206851, 'ties': 'breslow'}. Best is trial 676 with value: 0.7727038262700389.[0m
[32m[I 2022-04-13 12:25:52,833][0m Trial 755 finished with value: 0.7725951623586641 and parameters: {'alpha': 1.0839823015802024, 'ties': 'efron'}. Best is trial 676 with value: 0.7727038262700389.[0m
[32m[I 2022-04-13 12:25:57,442][0m Trial 756 finished with value: 0.7726785455214022 and parameters: {'alpha': 1.2293669487333527, 'ties': 'breslow'}. Best is trial 676 with value: 0.7727038262700389.[0m
[32m[I 2022-04-13 12:26:00,357][0m Trial 757 finished with value: 0.7725146610608229 and parameters: {'alpha': 1.3717286151882613, 'ties': 'efron'}. Best is trial 676 with value: 0.7727038262700389.[0m
[32m[I 2022-04-13 12:26:03,280][0m Trial 758 finished with value: 0.771864813992762 and parameters: {'alpha': 2.736889953497831, 'ties': 'breslow'}. Best is trial 676 with value: 0.7727038262700389.[0m
[32m[I 2022-04-13 12:26:05,853][0m Trial 759 finished with value: 0.7724655993482128 and parameters: {'alpha': 1.4727595100685442, 'ties': 'efron'}. Best is trial 676 with value: 0.7727038262700389.[0m
[32m[I 2022-04-13 12:26:10,508][0m Trial 760 finished with value: 0.7726785455214022 and parameters: {'alpha': 1.2271679986940334, 'ties': 'breslow'}. Best is trial 676 with value: 0.7727038262700389.[0m
[32m[I 2022-04-13 12:26:13,603][0m Trial 761 finished with value: 0.772600867519898 and parameters: {'alpha': 1.1155723427915114, 'ties': 'breslow'}. Best is trial 676 with value: 0.7727038262700389.[0m
[32m[I 2022-04-13 12:26:16,437][0m Trial 762 finished with value: 0.7726897369101616 and parameters: {'alpha': 1.2443274345401922, 'ties': 'breslow'}. Best is trial 676 with value: 0.7727038262700389.[0m
[32m[I 2022-04-13 12:26:21,177][0m Trial 763 finished with value: 0.7723821626560701 and parameters: {'alpha': 1.6665282731986077, 'ties': 'breslow'}. Best is trial 676 with value: 0.7727038262700389.[0m
[32m[I 2022-04-13 12:26:25,930][0m Trial 764 finished with value: 0.7694607931993984 and parameters: {'alpha': 4.274517737875082, 'ties': 'breslow'}. Best is trial 676 with value: 0.7727038262700389.[0m
[32m[I 2022-04-13 12:26:30,227][0m Trial 765 finished with value: 0.7725268905165502 and parameters: {'alpha': 1.0431428430606704, 'ties': 'breslow'}. Best is trial 676 with value: 0.7727038262700389.[0m
[32m[I 2022-04-13 12:26:34,257][0m Trial 766 finished with value: 0.7726156986081077 and parameters: {'alpha': 1.3034833717494134, 'ties': 'breslow'}. Best is trial 676 with value: 0.7727038262700389.[0m
[32m[I 2022-04-13 12:26:37,549][0m Trial 767 finished with value: 0.7726098281687659 and parameters: {'alpha': 1.1810218809197113, 'ties': 'breslow'}. Best is trial 676 with value: 0.7727038262700389.[0m
[32m[I 2022-04-13 12:26:40,793][0m Trial 768 finished with value: 0.7725272878740567 and parameters: {'alpha': 0.7969043619302179, 'ties': 'breslow'}. Best is trial 676 with value: 0.7727038262700389.[0m
[32m[I 2022-04-13 12:26:44,956][0m Trial 769 finished with value: 0.7724884877714994 and parameters: {'alpha': 1.3766050198377786, 'ties': 'breslow'}. Best is trial 676 with value: 0.7727038262700389.[0m
[32m[I 2022-04-13 12:26:49,214][0m Trial 770 finished with value: 0.7726179152065387 and parameters: {'alpha': 0.9483664141652325, 'ties': 'breslow'}. Best is trial 676 with value: 0.7727038262700389.[0m
[32m[I 2022-04-13 12:26:53,307][0m Trial 771 finished with value: 0.7726785455214022 and parameters: {'alpha': 1.2293730365203155, 'ties': 'breslow'}. Best is trial 676 with value: 0.7727038262700389.[0m
[32m[I 2022-04-13 12:26:57,605][0m Trial 772 finished with value: 0.772597837520119 and parameters: {'alpha': 1.1232638497216705, 'ties': 'breslow'}. Best is trial 676 with value: 0.7727038262700389.[0m
[32m[I 2022-04-13 12:27:01,555][0m Trial 773 finished with value: 0.7724794154138523 and parameters: {'alpha': 1.4865682470824826, 'ties': 'breslow'}. Best is trial 676 with value: 0.7727038262700389.[0m
[32m[I 2022-04-13 12:27:03,808][0m Trial 774 finished with value: 0.7726349290222411 and parameters: {'alpha': 1.2817389310703644, 'ties': 'breslow'}. Best is trial 676 with value: 0.7727038262700389.[0m
[32m[I 2022-04-13 12:27:06,259][0m Trial 775 finished with value: 0.7725078700501119 and parameters: {'alpha': 1.033375361749984, 'ties': 'breslow'}. Best is trial 676 with value: 0.7727038262700389.[0m
[32m[I 2022-04-13 12:27:09,284][0m Trial 776 finished with value: 0.7725015505178554 and parameters: {'alpha': 1.3745887269981192, 'ties': 'breslow'}. Best is trial 676 with value: 0.7727038262700389.[0m
[32m[I 2022-04-13 12:27:12,740][0m Trial 777 finished with value: 0.7726155821350116 and parameters: {'alpha': 1.2025657396226956, 'ties': 'breslow'}. Best is trial 676 with value: 0.7727038262700389.[0m
[32m[I 2022-04-13 12:27:18,127][0m Trial 778 finished with value: 0.7725959046820483 and parameters: {'alpha': 1.1150160882100262, 'ties': 'breslow'}. Best is trial 676 with value: 0.7727038262700389.[0m
[32m[I 2022-04-13 12:27:22,920][0m Trial 779 finished with value: 0.7725188343616619 and parameters: {'alpha': 1.5681781811355617, 'ties': 'breslow'}. Best is trial 676 with value: 0.7727038262700389.[0m
[32m[I 2022-04-13 12:27:26,376][0m Trial 780 finished with value: 0.7726258796353948 and parameters: {'alpha': 1.279008159960651, 'ties': 'breslow'}. Best is trial 676 with value: 0.7727038262700389.[0m
[32m[I 2022-04-13 12:27:31,123][0m Trial 781 finished with value: 0.7724925808917418 and parameters: {'alpha': 1.3952459244352664, 'ties': 'breslow'}. Best is trial 676 with value: 0.7727038262700389.[0m
[32m[I 2022-04-13 12:27:34,980][0m Trial 782 finished with value: 0.7725901018888848 and parameters: {'alpha': 0.9015612880163029, 'ties': 'breslow'}. Best is trial 676 with value: 0.7727038262700389.[0m
[32m[I 2022-04-13 12:27:38,652][0m Trial 783 finished with value: 0.7725911215568294 and parameters: {'alpha': 1.1590593041176678, 'ties': 'breslow'}. Best is trial 676 with value: 0.7727038262700389.[0m
[32m[I 2022-04-13 12:27:42,630][0m Trial 784 finished with value: 0.7725130725186085 and parameters: {'alpha': 1.0393839987390185, 'ties': 'breslow'}. Best is trial 676 with value: 0.7727038262700389.[0m
[32m[I 2022-04-13 12:27:45,913][0m Trial 785 finished with value: 0.7726520936914563 and parameters: {'alpha': 1.2515018341591095, 'ties': 'breslow'}. Best is trial 676 with value: 0.7727038262700389.[0m
[32m[I 2022-04-13 12:27:50,619][0m Trial 786 finished with value: 0.7725221641678227 and parameters: {'alpha': 1.3462082738744425, 'ties': 'breslow'}. Best is trial 676 with value: 0.7727038262700389.[0m
[32m[I 2022-04-13 12:27:54,839][0m Trial 787 finished with value: 0.7726199360194486 and parameters: {'alpha': 1.1521703479159786, 'ties': 'breslow'}. Best is trial 676 with value: 0.7727038262700389.[0m
[32m[I 2022-04-13 12:28:00,116][0m Trial 788 finished with value: 0.7726673320169679 and parameters: {'alpha': 1.2401054968913863, 'ties': 'efron'}. Best is trial 676 with value: 0.7727038262700389.[0m
[32m[I 2022-04-13 12:28:02,869][0m Trial 789 finished with value: 0.7724566182725476 and parameters: {'alpha': 1.4617680283681316, 'ties': 'breslow'}. Best is trial 676 with value: 0.7727038262700389.[0m
[32m[I 2022-04-13 12:28:04,760][0m Trial 790 finished with value: 0.7725862886532375 and parameters: {'alpha': 0.9918293264072056, 'ties': 'efron'}. Best is trial 676 with value: 0.7727038262700389.[0m
[32m[I 2022-04-13 12:28:08,048][0m Trial 791 finished with value: 0.7725653560019609 and parameters: {'alpha': 1.096994869643547, 'ties': 'efron'}. Best is trial 676 with value: 0.7727038262700389.[0m
[32m[I 2022-04-13 12:28:11,819][0m Trial 792 finished with value: 0.7726355348969951 and parameters: {'alpha': 1.3002744198598777, 'ties': 'breslow'}. Best is trial 676 with value: 0.7727038262700389.[0m
[32m[I 2022-04-13 12:28:14,142][0m Trial 793 finished with value: 0.7725935008392419 and parameters: {'alpha': 1.1817391983477805, 'ties': 'efron'}. Best is trial 676 with value: 0.7727038262700389.[0m
[32m[I 2022-04-13 12:28:16,099][0m Trial 794 finished with value: 0.7725063452483834 and parameters: {'alpha': 1.3741634112283019, 'ties': 'breslow'}. Best is trial 676 with value: 0.7727038262700389.[0m
[32m[I 2022-04-13 12:28:20,372][0m Trial 795 finished with value: 0.7726788348652596 and parameters: {'alpha': 1.245223208949687, 'ties': 'efron'}. Best is trial 676 with value: 0.7727038262700389.[0m
[32m[I 2022-04-13 12:28:24,934][0m Trial 796 finished with value: 0.7724822307352032 and parameters: {'alpha': 1.5527106753946727, 'ties': 'efron'}. Best is trial 676 with value: 0.7727038262700389.[0m
[32m[I 2022-04-13 12:28:28,790][0m Trial 797 finished with value: 0.7725806354496217 and parameters: {'alpha': 1.3055899470056997, 'ties': 'efron'}. Best is trial 676 with value: 0.7727038262700389.[0m
[32m[I 2022-04-13 12:28:32,598][0m Trial 798 finished with value: 0.7725536445706671 and parameters: {'alpha': 1.1017235673336576, 'ties': 'efron'}. Best is trial 676 with value: 0.7727038262700389.[0m
[32m[I 2022-04-13 12:28:36,294][0m Trial 799 finished with value: 0.7724678032999279 and parameters: {'alpha': 1.413966336207288, 'ties': 'efron'}. Best is trial 676 with value: 0.7727038262700389.[0m
[32m[I 2022-04-13 12:28:40,794][0m Trial 800 finished with value: 0.7726035053211294 and parameters: {'alpha': 0.9993807398556112, 'ties': 'efron'}. Best is trial 676 with value: 0.7727038262700389.[0m
[32m[I 2022-04-13 12:28:43,570][0m Trial 801 finished with value: 0.7726154375395305 and parameters: {'alpha': 1.2002702721652487, 'ties': 'efron'}. Best is trial 676 with value: 0.7727038262700389.[0m
[32m[I 2022-04-13 12:28:46,133][0m Trial 802 finished with value: 0.7725806354496217 and parameters: {'alpha': 1.3048756545949163, 'ties': 'efron'}. Best is trial 676 with value: 0.7727038262700389.[0m
[32m[I 2022-04-13 12:28:50,528][0m Trial 803 finished with value: 0.7725653560019609 and parameters: {'alpha': 1.0979967103379547, 'ties': 'efron'}. Best is trial 676 with value: 0.7727038262700389.[0m
[32m[I 2022-04-13 12:28:55,516][0m Trial 804 finished with value: 0.7724643149331488 and parameters: {'alpha': 1.4709664784735064, 'ties': 'efron'}. Best is trial 676 with value: 0.7727038262700389.[0m
[32m[I 2022-04-13 12:28:59,019][0m Trial 805 finished with value: 0.7726051649074629 and parameters: {'alpha': 0.8861237976243245, 'ties': 'efron'}. Best is trial 676 with value: 0.7727038262700389.[0m
[32m[I 2022-04-13 12:29:02,325][0m Trial 806 finished with value: 0.7716630202068753 and parameters: {'alpha': 0.48026306532072394, 'ties': 'efron'}. Best is trial 676 with value: 0.7727038262700389.[0m
[32m[I 2022-04-13 12:29:06,485][0m Trial 807 finished with value: 0.772402628351052 and parameters: {'alpha': 2.0003308416155683, 'ties': 'efron'}. Best is trial 676 with value: 0.7727038262700389.[0m
[32m[I 2022-04-13 12:29:09,610][0m Trial 808 finished with value: 0.772663406381513 and parameters: {'alpha': 1.2238723378044312, 'ties': 'efron'}. Best is trial 676 with value: 0.7727038262700389.[0m
[32m[I 2022-04-13 12:29:13,066][0m Trial 809 finished with value: 0.7725275233652498 and parameters: {'alpha': 1.36901838472785, 'ties': 'efron'}. Best is trial 676 with value: 0.7727038262700389.[0m
[32m[I 2022-04-13 12:29:17,659][0m Trial 810 finished with value: 0.7726147464945908 and parameters: {'alpha': 1.1562129243039863, 'ties': 'efron'}. Best is trial 676 with value: 0.7727038262700389.[0m
[32m[I 2022-04-13 12:29:21,775][0m Trial 811 finished with value: 0.7725985301455894 and parameters: {'alpha': 1.0014419901901166, 'ties': 'efron'}. Best is trial 676 with value: 0.7727038262700389.[0m
[32m[I 2022-04-13 12:29:25,567][0m Trial 812 finished with value: 0.7726400942618177 and parameters: {'alpha': 1.2824976117231979, 'ties': 'efron'}. Best is trial 676 with value: 0.7727038262700389.[0m
[32m[I 2022-04-13 12:29:29,556][0m Trial 813 finished with value: 0.7725768978795886 and parameters: {'alpha': 1.1655406605445453, 'ties': 'efron'}. Best is trial 676 with value: 0.7727038262700389.[0m
[32m[I 2022-04-13 12:29:34,031][0m Trial 814 finished with value: 0.7725893148326987 and parameters: {'alpha': 1.0599217164957686, 'ties': 'efron'}. Best is trial 676 with value: 0.7727038262700389.[0m
[32m[I 2022-04-13 12:29:38,378][0m Trial 815 finished with value: 0.7715792151069399 and parameters: {'alpha': 0.1965058368985413, 'ties': 'efron'}. Best is trial 676 with value: 0.7727038262700389.[0m
[32m[I 2022-04-13 12:29:42,394][0m Trial 816 finished with value: 0.7725382405356057 and parameters: {'alpha': 1.3473119793735095, 'ties': 'efron'}. Best is trial 676 with value: 0.7727038262700389.[0m
[32m[I 2022-04-13 12:29:46,513][0m Trial 817 finished with value: 0.7725863662403722 and parameters: {'alpha': 1.1929403733097064, 'ties': 'efron'}. Best is trial 676 with value: 0.7727038262700389.[0m
[32m[I 2022-04-13 12:29:51,456][0m Trial 818 finished with value: 0.7724534750633303 and parameters: {'alpha': 1.4521700073063868, 'ties': 'efron'}. Best is trial 676 with value: 0.7727038262700389.[0m
[32m[I 2022-04-13 12:29:55,948][0m Trial 819 finished with value: 0.7726502236318102 and parameters: {'alpha': 1.2692639037529703, 'ties': 'efron'}. Best is trial 676 with value: 0.7727038262700389.[0m
[32m[I 2022-04-13 12:29:59,819][0m Trial 820 finished with value: 0.7725953644685234 and parameters: {'alpha': 1.0642355593735453, 'ties': 'efron'}. Best is trial 676 with value: 0.7727038262700389.[0m
[32m[I 2022-04-13 12:30:03,643][0m Trial 821 finished with value: 0.772668248106903 and parameters: {'alpha': 1.2263388900537162, 'ties': 'efron'}. Best is trial 676 with value: 0.7727038262700389.[0m
[32m[I 2022-04-13 12:30:07,730][0m Trial 822 finished with value: 0.7725209028565736 and parameters: {'alpha': 1.37667970475737, 'ties': 'efron'}. Best is trial 676 with value: 0.7727038262700389.[0m
[32m[I 2022-04-13 12:30:11,931][0m Trial 823 finished with value: 0.7724900185130206 and parameters: {'alpha': 1.5884125286093294, 'ties': 'efron'}. Best is trial 676 with value: 0.7727038262700389.[0m
[32m[I 2022-04-13 12:30:15,580][0m Trial 824 finished with value: 0.7726519053466813 and parameters: {'alpha': 1.1384392618847894, 'ties': 'efron'}. Best is trial 676 with value: 0.7727038262700389.[0m
[32m[I 2022-04-13 12:30:19,732][0m Trial 825 finished with value: 0.7725255478310734 and parameters: {'alpha': 1.3216422247905273, 'ties': 'efron'}. Best is trial 676 with value: 0.7727038262700389.[0m
[32m[I 2022-04-13 12:30:24,362][0m Trial 826 finished with value: 0.7726328463918968 and parameters: {'alpha': 0.9415266295666673, 'ties': 'efron'}. Best is trial 676 with value: 0.7727038262700389.[0m
[32m[I 2022-04-13 12:30:27,172][0m Trial 827 finished with value: 0.7726517320740269 and parameters: {'alpha': 1.2377297115916348, 'ties': 'efron'}. Best is trial 676 with value: 0.7727038262700389.[0m
[32m[I 2022-04-13 12:30:31,118][0m Trial 828 finished with value: 0.772579093930425 and parameters: {'alpha': 1.091841834083125, 'ties': 'efron'}. Best is trial 676 with value: 0.7727038262700389.[0m
[32m[I 2022-04-13 12:30:35,686][0m Trial 829 finished with value: 0.7724682481660352 and parameters: {'alpha': 1.4898792370231853, 'ties': 'breslow'}. Best is trial 676 with value: 0.7727038262700389.[0m
[32m[I 2022-04-13 12:30:39,888][0m Trial 830 finished with value: 0.7726400992616196 and parameters: {'alpha': 1.287472150555987, 'ties': 'efron'}. Best is trial 676 with value: 0.7727038262700389.[0m
[32m[I 2022-04-13 12:30:44,206][0m Trial 831 finished with value: 0.7725542823712594 and parameters: {'alpha': 0.8409506768218462, 'ties': 'breslow'}. Best is trial 676 with value: 0.7727038262700389.[0m
[32m[I 2022-04-13 12:30:48,207][0m Trial 832 finished with value: 0.7726060729959565 and parameters: {'alpha': 1.0135641735953107, 'ties': 'efron'}. Best is trial 676 with value: 0.7727038262700389.[0m
[32m[I 2022-04-13 12:30:50,988][0m Trial 833 finished with value: 0.7725763797858967 and parameters: {'alpha': 1.1574891718465026, 'ties': 'breslow'}. Best is trial 676 with value: 0.7727038262700389.[0m
[32m[I 2022-04-13 12:30:53,413][0m Trial 834 finished with value: 0.7724784766007293 and parameters: {'alpha': 1.388557619992893, 'ties': 'efron'}. Best is trial 676 with value: 0.7727038262700389.[0m
[32m[I 2022-04-13 12:30:56,446][0m Trial 835 finished with value: 0.7726785455214022 and parameters: {'alpha': 1.2289828681503847, 'ties': 'breslow'}. Best is trial 676 with value: 0.7727038262700389.[0m
[32m[I 2022-04-13 12:31:00,259][0m Trial 836 finished with value: 0.772600867519898 and parameters: {'alpha': 1.1152747084113477, 'ties': 'breslow'}. Best is trial 676 with value: 0.7727038262700389.[0m
[32m[I 2022-04-13 12:31:03,582][0m Trial 837 finished with value: 0.7725901717078996 and parameters: {'alpha': 1.1963357927563738, 'ties': 'breslow'}. Best is trial 676 with value: 0.7727038262700389.[0m
[32m[I 2022-04-13 12:31:06,698][0m Trial 838 finished with value: 0.7726423589100984 and parameters: {'alpha': 0.9652287914720901, 'ties': 'breslow'}. Best is trial 676 with value: 0.7727038262700389.[0m
[32m[I 2022-04-13 12:31:09,796][0m Trial 839 finished with value: 0.7725047987266306 and parameters: {'alpha': 1.3313357156995194, 'ties': 'breslow'}. Best is trial 676 with value: 0.7727038262700389.[0m
[32m[I 2022-04-13 12:31:12,539][0m Trial 840 finished with value: 0.7725697739047961 and parameters: {'alpha': 1.0914324908119666, 'ties': 'breslow'}. Best is trial 676 with value: 0.7727038262700389.[0m
[32m[I 2022-04-13 12:31:16,504][0m Trial 841 finished with value: 0.7726785455214022 and parameters: {'alpha': 1.2263165405295648, 'ties': 'breslow'}. Best is trial 676 with value: 0.7727038262700389.[0m
[32m[I 2022-04-13 12:31:21,215][0m Trial 842 finished with value: 0.7724478113906942 and parameters: {'alpha': 1.4378243681676859, 'ties': 'breslow'}. Best is trial 676 with value: 0.7727038262700389.[0m
[32m[I 2022-04-13 12:31:25,118][0m Trial 843 finished with value: 0.7726641053293019 and parameters: {'alpha': 1.2607600612431427, 'ties': 'breslow'}. Best is trial 676 with value: 0.7727038262700389.[0m
[32m[I 2022-04-13 12:31:28,552][0m Trial 844 finished with value: 0.7725741660536368 and parameters: {'alpha': 1.1683988133772196, 'ties': 'breslow'}. Best is trial 676 with value: 0.7727038262700389.[0m
[32m[I 2022-04-13 12:31:33,078][0m Trial 845 finished with value: 0.7725240150216914 and parameters: {'alpha': 1.33601075648633, 'ties': 'breslow'}. Best is trial 676 with value: 0.7727038262700389.[0m
[32m[I 2022-04-13 12:31:37,121][0m Trial 846 finished with value: 0.7725773635917431 and parameters: {'alpha': 1.0552725627660144, 'ties': 'breslow'}. Best is trial 676 with value: 0.7727038262700389.[0m
[32m[I 2022-04-13 12:31:39,443][0m Trial 847 finished with value: 0.7724789956839732 and parameters: {'alpha': 1.5109355210796154, 'ties': 'breslow'}. Best is trial 676 with value: 0.7727038262700389.[0m
[32m[I 2022-04-13 12:31:41,519][0m Trial 848 finished with value: 0.772665487422714 and parameters: {'alpha': 1.2536987970790654, 'ties': 'breslow'}. Best is trial 676 with value: 0.7727038262700389.[0m
[32m[I 2022-04-13 12:31:45,434][0m Trial 849 finished with value: 0.7726519053466813 and parameters: {'alpha': 1.1405456505519482, 'ties': 'breslow'}. Best is trial 676 with value: 0.7727038262700389.[0m
[32m[I 2022-04-13 12:31:48,905][0m Trial 850 finished with value: 0.7724746053106538 and parameters: {'alpha': 1.3874721003025472, 'ties': 'breslow'}. Best is trial 676 with value: 0.7727038262700389.[0m
[32m[I 2022-04-13 12:31:52,386][0m Trial 851 finished with value: 0.7710548796530448 and parameters: {'alpha': 3.1537825595765985, 'ties': 'breslow'}. Best is trial 676 with value: 0.7727038262700389.[0m
[32m[I 2022-04-13 12:31:54,588][0m Trial 852 finished with value: 0.7726618318892375 and parameters: {'alpha': 1.2369805322064054, 'ties': 'breslow'}. Best is trial 676 with value: 0.7727038262700389.[0m
