[32m[I 2022-04-15 09:27:02,548][0m Trial 695 finished with value: 0.5 and parameters: {'loss': 'squared', 'learning_rate': 0.002762361293322248, 'n_estimators': 536, 'criterion': 'absolute_error', 'min_samples_split': 5, 'min_samples_leaf': 3, 'min_weight_fraction_leaf': 0.010790700687813789, 'min_impurity_decrease': 0.39259874470406564, 'max_features': 0.7613676193575275, 'subsample': 0.7903772330613308, 'dropout_rate': 0.5517131468583143, 'ccp_alpha': 0.2479666716375307}. Best is trial 582 with value: 0.7782421835300739.[0m
[32m[I 2022-04-15 09:28:10,928][0m Trial 696 finished with value: 0.713081725464437 and parameters: {'loss': 'coxph', 'learning_rate': 0.0015528303752329452, 'n_estimators': 529, 'criterion': 'friedman_mse', 'min_samples_split': 5, 'min_samples_leaf': 4, 'min_weight_fraction_leaf': 0.05537795271036163, 'min_impurity_decrease': 0.31783329300386215, 'max_features': 0.7556212347807222, 'subsample': 0.8402495600283199, 'dropout_rate': 0.5284438506455948, 'ccp_alpha': 0.10702084830780507}. Best is trial 582 with value: 0.7782421835300739.[0m
[32m[I 2022-04-15 09:29:34,174][0m Trial 697 finished with value: 0.7778676861861549 and parameters: {'loss': 'coxph', 'learning_rate': 0.002327548944008647, 'n_estimators': 561, 'criterion': 'friedman_mse', 'min_samples_split': 5, 'min_samples_leaf': 3, 'min_weight_fraction_leaf': 0.07115055347258584, 'min_impurity_decrease': 0.28944113257774307, 'max_features': 0.7715803096031464, 'subsample': 0.8594940131015526, 'dropout_rate': 0.5562128348726325, 'ccp_alpha': 0.0031163087825801412}. Best is trial 582 with value: 0.7782421835300739.[0m
[32m[I 2022-04-15 09:30:47,309][0m Trial 698 finished with value: 0.6743624146605087 and parameters: {'loss': 'coxph', 'learning_rate': 0.0023383038651677277, 'n_estimators': 569, 'criterion': 'friedman_mse', 'min_samples_split': 5, 'min_samples_leaf': 3, 'min_weight_fraction_leaf': 0.0715477229434762, 'min_impurity_decrease': 0.2512419143547828, 'max_features': 0.7458775413174121, 'subsample': 0.8181942710038907, 'dropout_rate': 0.5652376273124707, 'ccp_alpha': 0.1768469141902695}. Best is trial 582 with value: 0.7782421835300739.[0m
[32m[I 2022-04-15 09:32:05,375][0m Trial 699 finished with value: 0.5 and parameters: {'loss': 'coxph', 'learning_rate': 0.0017768131297180194, 'n_estimators': 608, 'criterion': 'friedman_mse', 'min_samples_split': 5, 'min_samples_leaf': 3, 'min_weight_fraction_leaf': 0.08051196009577748, 'min_impurity_decrease': 0.4308644698928285, 'max_features': 0.7715995703543503, 'subsample': 0.802203750352084, 'dropout_rate': 0.6148149597126198, 'ccp_alpha': 0.3525280291640424}. Best is trial 582 with value: 0.7782421835300739.[0m
[32m[I 2022-04-15 09:33:21,332][0m Trial 700 finished with value: 0.7236224364112613 and parameters: {'loss': 'coxph', 'learning_rate': 0.002849874979009864, 'n_estimators': 559, 'criterion': 'friedman_mse', 'min_samples_split': 5, 'min_samples_leaf': 2, 'min_weight_fraction_leaf': 0.058592977806979946, 'min_impurity_decrease': 0.3477532858487938, 'max_features': 0.7413993824807713, 'subsample': 0.8472767742321508, 'dropout_rate': 0.549319072917208, 'ccp_alpha': 0.09800370698934266}. Best is trial 582 with value: 0.7782421835300739.[0m
[32m[I 2022-04-15 09:34:25,745][0m Trial 701 finished with value: 0.5 and parameters: {'loss': 'coxph', 'learning_rate': 0.0019995906327743606, 'n_estimators': 498, 'criterion': 'friedman_mse', 'min_samples_split': 5, 'min_samples_leaf': 3, 'min_weight_fraction_leaf': 0.06823063231178607, 'min_impurity_decrease': 0.3645385000066982, 'max_features': 0.7665791261647866, 'subsample': 0.9806203994933675, 'dropout_rate': 0.5866261314561366, 'ccp_alpha': 0.22107952350643412}. Best is trial 582 with value: 0.7782421835300739.[0m
[32m[I 2022-04-15 09:35:51,730][0m Trial 702 finished with value: 0.7180619609515999 and parameters: {'loss': 'coxph', 'learning_rate': 0.0004789549733601979, 'n_estimators': 595, 'criterion': 'friedman_mse', 'min_samples_split': 5, 'min_samples_leaf': 3, 'min_weight_fraction_leaf': 0.05134222700463051, 'min_impurity_decrease': 0.2710161460761892, 'max_features': 0.767759634218759, 'subsample': 0.8743600573318328, 'dropout_rate': 0.532861020183918, 'ccp_alpha': 0.09805300208334965}. Best is trial 582 with value: 0.7782421835300739.[0m
[32m[I 2022-04-15 09:37:26,523][0m Trial 703 finished with value: 0.7309120328028698 and parameters: {'loss': 'coxph', 'learning_rate': 0.003161017526034876, 'n_estimators': 640, 'criterion': 'friedman_mse', 'min_samples_split': 5, 'min_samples_leaf': 3, 'min_weight_fraction_leaf': 0.06431555057724425, 'min_impurity_decrease': 0.40508214970802175, 'max_features': 0.7344313350114712, 'subsample': 0.8206760431918705, 'dropout_rate': 0.5800078404772577, 'ccp_alpha': 0.09205727660631555}. Best is trial 582 with value: 0.7782421835300739.[0m
[32m[I 2022-04-15 09:38:34,634][0m Trial 704 finished with value: 0.5301157883717103 and parameters: {'loss': 'coxph', 'learning_rate': 0.00231615084106526, 'n_estimators': 550, 'criterion': 'friedman_mse', 'min_samples_split': 5, 'min_samples_leaf': 3, 'min_weight_fraction_leaf': 0.04419560734407775, 'min_impurity_decrease': 0.23260991898119798, 'max_features': 0.77856581470288, 'subsample': 0.7923431996301036, 'dropout_rate': 0.546892020055481, 'ccp_alpha': 0.18756631023229728}. Best is trial 582 with value: 0.7782421835300739.[0m
[32m[I 2022-04-15 09:39:36,660][0m Trial 705 finished with value: 0.7770148604397679 and parameters: {'loss': 'coxph', 'learning_rate': 0.0012223755116967509, 'n_estimators': 500, 'criterion': 'friedman_mse', 'min_samples_split': 5, 'min_samples_leaf': 3, 'min_weight_fraction_leaf': 0.07051945669785868, 'min_impurity_decrease': 0.44622857741217564, 'max_features': 0.783679479515658, 'subsample': 0.8997859062614416, 'dropout_rate': 0.6256326001614271, 'ccp_alpha': 0.0038235660338752538}. Best is trial 582 with value: 0.7782421835300739.[0m
[32m[I 2022-04-15 09:40:46,211][0m Trial 706 finished with value: 0.7775389682696228 and parameters: {'loss': 'coxph', 'learning_rate': 0.0008930785667670719, 'n_estimators': 541, 'criterion': 'friedman_mse', 'min_samples_split': 5, 'min_samples_leaf': 3, 'min_weight_fraction_leaf': 0.07898459867224406, 'min_impurity_decrease': 0.2758063540739345, 'max_features': 0.756095050460064, 'subsample': 0.8516641365392393, 'dropout_rate': 0.6262833071681302, 'ccp_alpha': 0.0022953712704321524}. Best is trial 582 with value: 0.7782421835300739.[0m
[32m[I 2022-04-15 09:41:55,366][0m Trial 707 finished with value: 0.5 and parameters: {'loss': 'coxph', 'learning_rate': 0.0008901925699034524, 'n_estimators': 571, 'criterion': 'squared_error', 'min_samples_split': 6, 'min_samples_leaf': 2, 'min_weight_fraction_leaf': 0.07897009880189607, 'min_impurity_decrease': 0.28157810101444825, 'max_features': 0.7386175146183251, 'subsample': 0.8302879384467724, 'dropout_rate': 0.6459298055426828, 'ccp_alpha': 0.0025719623792034513}. Best is trial 582 with value: 0.7782421835300739.[0m
[32m[I 2022-04-15 09:42:54,212][0m Trial 708 finished with value: 0.5 and parameters: {'loss': 'coxph', 'learning_rate': 0.0008169534061282532, 'n_estimators': 505, 'criterion': 'friedman_mse', 'min_samples_split': 5, 'min_samples_leaf': 3, 'min_weight_fraction_leaf': 0.08776397781185619, 'min_impurity_decrease': 0.2522301767255596, 'max_features': 0.7841801694677191, 'subsample': 0.8543733695251652, 'dropout_rate': 0.6187816243534915, 'ccp_alpha': 0.29714548203383384}. Best is trial 582 with value: 0.7782421835300739.[0m
[32m[I 2022-04-15 09:44:00,826][0m Trial 709 finished with value: 0.6743624146605087 and parameters: {'loss': 'coxph', 'learning_rate': 0.001203099088046319, 'n_estimators': 546, 'criterion': 'friedman_mse', 'min_samples_split': 5, 'min_samples_leaf': 4, 'min_weight_fraction_leaf': 0.07233649271831354, 'min_impurity_decrease': 0.2818754953837455, 'max_features': 0.7539447717968879, 'subsample': 0.8685077946665269, 'dropout_rate': 0.6178731285242662, 'ccp_alpha': 0.1505584003858654}. Best is trial 582 with value: 0.7782421835300739.[0m
[32m[I 2022-04-15 09:45:34,785][0m Trial 710 finished with value: 0.7283217040217845 and parameters: {'loss': 'coxph', 'learning_rate': 0.001089815305429993, 'n_estimators': 685, 'criterion': 'friedman_mse', 'min_samples_split': 5, 'min_samples_leaf': 3, 'min_weight_fraction_leaf': 0.08228924890452241, 'min_impurity_decrease': 0.45293308005362976, 'max_features': 0.7773673938177563, 'subsample': 0.8325829773936881, 'dropout_rate': 0.638397353090631, 'ccp_alpha': 0.09370220531583622}. Best is trial 582 with value: 0.7782421835300739.[0m
[32m[I 2022-04-15 09:46:45,787][0m Trial 711 finished with value: 0.5 and parameters: {'loss': 'coxph', 'learning_rate': 0.0005634199946613125, 'n_estimators': 581, 'criterion': 'friedman_mse', 'min_samples_split': 5, 'min_samples_leaf': 3, 'min_weight_fraction_leaf': 0.06785385484949268, 'min_impurity_decrease': 0.3172683147296847, 'max_features': 0.7516970980769206, 'subsample': 0.8844709333255705, 'dropout_rate': 0.6533603310151727, 'ccp_alpha': 0.4280959584301314}. Best is trial 582 with value: 0.7782421835300739.[0m
[32m[I 2022-04-15 09:48:22,090][0m Trial 712 finished with value: 0.7824105962295036 and parameters: {'loss': 'coxph', 'learning_rate': 0.0013971654585556252, 'n_estimators': 623, 'criterion': 'friedman_mse', 'min_samples_split': 5, 'min_samples_leaf': 3, 'min_weight_fraction_leaf': 0.06051776602264631, 'min_impurity_decrease': 0.2686862347610615, 'max_features': 0.732294710437406, 'subsample': 0.9999041933346642, 'dropout_rate': 0.606180590130397, 'ccp_alpha': 0.0020705719228226705}. Best is trial 712 with value: 0.7824105962295036.[0m
[32m[I 2022-04-15 09:49:43,718][0m Trial 713 finished with value: 0.5301157883717103 and parameters: {'loss': 'coxph', 'learning_rate': 0.0007308685988661579, 'n_estimators': 630, 'criterion': 'friedman_mse', 'min_samples_split': 5, 'min_samples_leaf': 3, 'min_weight_fraction_leaf': 0.05870729808786628, 'min_impurity_decrease': 0.2865250323298024, 'max_features': 0.7267883267372388, 'subsample': 0.9734521442415881, 'dropout_rate': 0.6318762898709188, 'ccp_alpha': 0.19068686143186206}. Best is trial 712 with value: 0.7824105962295036.[0m
[32m[I 2022-04-15 09:51:09,442][0m Trial 714 finished with value: 0.7256708588204015 and parameters: {'loss': 'coxph', 'learning_rate': 0.0014262407264655497, 'n_estimators': 614, 'criterion': 'friedman_mse', 'min_samples_split': 5, 'min_samples_leaf': 3, 'min_weight_fraction_leaf': 0.06352805411986784, 'min_impurity_decrease': 0.23257276211390904, 'max_features': 0.7350304514581134, 'subsample': 0.9830642311623539, 'dropout_rate': 0.5971598514573402, 'ccp_alpha': 0.09317165027152413}. Best is trial 712 with value: 0.7824105962295036.[0m
[32m[I 2022-04-15 09:51:54,516][0m Trial 715 finished with value: 0.3256375853394913 and parameters: {'loss': 'squared', 'learning_rate': 0.0010560091915124688, 'n_estimators': 599, 'criterion': 'friedman_mse', 'min_samples_split': 5, 'min_samples_leaf': 3, 'min_weight_fraction_leaf': 0.07518110605413403, 'min_impurity_decrease': 0.253300926683764, 'max_features': 0.7570098565986391, 'subsample': 0.986516051957788, 'dropout_rate': 0.659816971761877, 'ccp_alpha': 0.2565402491337187}. Best is trial 712 with value: 0.7824105962295036.[0m
[32m[I 2022-04-15 09:53:39,871][0m Trial 716 finished with value: 0.7291459786873805 and parameters: {'loss': 'coxph', 'learning_rate': 0.0014305964180685636, 'n_estimators': 670, 'criterion': 'friedman_mse', 'min_samples_split': 5, 'min_samples_leaf': 3, 'min_weight_fraction_leaf': 0.050933176934845684, 'min_impurity_decrease': 0.19518151409407114, 'max_features': 0.7783951323903443, 'subsample': 0.9112128022394604, 'dropout_rate': 0.561103428006736, 'ccp_alpha': 0.08646783922524647}. Best is trial 712 with value: 0.7824105962295036.[0m
[32m[I 2022-04-15 09:55:35,868][0m Trial 717 finished with value: 0.6743624146605087 and parameters: {'loss': 'coxph', 'learning_rate': 0.002856044757744383, 'n_estimators': 710, 'criterion': 'friedman_mse', 'min_samples_split': 5, 'min_samples_leaf': 4, 'min_weight_fraction_leaf': 0.06008004940080747, 'min_impurity_decrease': 0.3066033478845714, 'max_features': 0.7418085452525319, 'subsample': 0.8486450015542059, 'dropout_rate': 0.515613324535999, 'ccp_alpha': 0.16882047678899095}. Best is trial 712 with value: 0.7824105962295036.[0m
[32m[I 2022-04-15 09:56:50,015][0m Trial 718 finished with value: 0.5 and parameters: {'loss': 'coxph', 'learning_rate': 0.0017297340256191764, 'n_estimators': 567, 'criterion': 'friedman_mse', 'min_samples_split': 5, 'min_samples_leaf': 3, 'min_weight_fraction_leaf': 0.05042931509970545, 'min_impurity_decrease': 0.2970422180443879, 'max_features': 0.7703998695294038, 'subsample': 0.9973876010491716, 'dropout_rate': 0.6034900339180145, 'ccp_alpha': 2.50191926176868}. Best is trial 712 with value: 0.7824105962295036.[0m
[32m[I 2022-04-15 09:58:38,257][0m Trial 719 finished with value: 0.5 and parameters: {'loss': 'coxph', 'learning_rate': 0.0006601496866833996, 'n_estimators': 636, 'criterion': 'absolute_error', 'min_samples_split': 5, 'min_samples_leaf': 2, 'min_weight_fraction_leaf': 0.06953663538165791, 'min_impurity_decrease': 0.4453894232121755, 'max_features': 0.7880120402337998, 'subsample': 0.7894957558776108, 'dropout_rate': 0.5750990022979612, 'ccp_alpha': 0.08957156281927121}. Best is trial 712 with value: 0.7824105962295036.[0m
[32m[I 2022-04-15 09:59:37,830][0m Trial 720 finished with value: 0.5 and parameters: {'loss': 'coxph', 'learning_rate': 0.0012314983409112531, 'n_estimators': 530, 'criterion': 'friedman_mse', 'min_samples_split': 6, 'min_samples_leaf': 3, 'min_weight_fraction_leaf': 0.04474543535938391, 'min_impurity_decrease': 0.218785526508865, 'max_features': 0.8021415806856509, 'subsample': 0.8152614647769753, 'dropout_rate': 0.6236889388799771, 'ccp_alpha': 0.23015593482206345}. Best is trial 712 with value: 0.7824105962295036.[0m
[32m[I 2022-04-15 10:00:51,236][0m Trial 721 finished with value: 0.7739206093791503 and parameters: {'loss': 'coxph', 'learning_rate': 0.000941199132799771, 'n_estimators': 518, 'criterion': 'friedman_mse', 'min_samples_split': 5, 'min_samples_leaf': 3, 'min_weight_fraction_leaf': 0.06308894375605562, 'min_impurity_decrease': 0.2674621273378763, 'max_features': 0.7293413178108751, 'subsample': 0.9569491400823729, 'dropout_rate': 0.5564237230246515, 'ccp_alpha': 0.0052465897733433835}. Best is trial 712 with value: 0.7824105962295036.[0m
[32m[I 2022-04-15 10:02:03,488][0m Trial 722 finished with value: 0.7033705783468636 and parameters: {'loss': 'coxph', 'learning_rate': 0.0010245227728805282, 'n_estimators': 548, 'criterion': 'friedman_mse', 'min_samples_split': 5, 'min_samples_leaf': 3, 'min_weight_fraction_leaf': 0.07498513880599941, 'min_impurity_decrease': 0.2673996489131407, 'max_features': 0.7339114666029645, 'subsample': 0.9542886001788343, 'dropout_rate': 0.5511367094157072, 'ccp_alpha': 0.10555646738976251}. Best is trial 712 with value: 0.7824105962295036.[0m
[32m[I 2022-04-15 10:03:24,439][0m Trial 723 finished with value: 0.5 and parameters: {'loss': 'coxph', 'learning_rate': 0.0007566158505065073, 'n_estimators': 580, 'criterion': 'friedman_mse', 'min_samples_split': 5, 'min_samples_leaf': 2, 'min_weight_fraction_leaf': 0.06149497801408133, 'min_impurity_decrease': 0.26210298369255824, 'max_features': 0.7157985264613552, 'subsample': 0.999692834479178, 'dropout_rate': 0.5634344467097386, 'ccp_alpha': 0.37163204901592417}. Best is trial 712 with value: 0.7824105962295036.[0m
[32m[I 2022-04-15 10:04:35,428][0m Trial 724 finished with value: 0.5301157883717103 and parameters: {'loss': 'coxph', 'learning_rate': 0.0009189524216051896, 'n_estimators': 521, 'criterion': 'friedman_mse', 'min_samples_split': 5, 'min_samples_leaf': 3, 'min_weight_fraction_leaf': 0.08878226225718606, 'min_impurity_decrease': 0.27792454182531673, 'max_features': 0.7530410273630415, 'subsample': 0.9519882934667613, 'dropout_rate': 0.5110537983788004, 'ccp_alpha': 0.17445635979290225}. Best is trial 712 with value: 0.7824105962295036.[0m
[32m[I 2022-04-15 10:06:04,833][0m Trial 725 finished with value: 0.7265377236642758 and parameters: {'loss': 'coxph', 'learning_rate': 0.0013581561723354308, 'n_estimators': 604, 'criterion': 'friedman_mse', 'min_samples_split': 5, 'min_samples_leaf': 4, 'min_weight_fraction_leaf': 0.06842232114012357, 'min_impurity_decrease': 0.2978223046270716, 'max_features': 0.7179578203161674, 'subsample': 0.9805621996229278, 'dropout_rate': 0.5415688754813318, 'ccp_alpha': 0.08616031974302495}. Best is trial 712 with value: 0.7824105962295036.[0m
[32m[I 2022-04-15 10:07:24,330][0m Trial 726 finished with value: 0.7766297806923351 and parameters: {'loss': 'coxph', 'learning_rate': 0.003318700172817854, 'n_estimators': 543, 'criterion': 'friedman_mse', 'min_samples_split': 5, 'min_samples_leaf': 3, 'min_weight_fraction_leaf': 0.05493885816889672, 'min_impurity_decrease': 0.4558886573186115, 'max_features': 0.7436874650355388, 'subsample': 0.9649417238135621, 'dropout_rate': 0.5910925081309794, 'ccp_alpha': 0.0017232419011457736}. Best is trial 712 with value: 0.7824105962295036.[0m
[32m[I 2022-04-15 10:08:32,240][0m Trial 727 finished with value: 0.5 and parameters: {'loss': 'coxph', 'learning_rate': 0.0035403544288886276, 'n_estimators': 556, 'criterion': 'friedman_mse', 'min_samples_split': 5, 'min_samples_leaf': 3, 'min_weight_fraction_leaf': 0.053566888194786014, 'min_impurity_decrease': 0.43203021836596645, 'max_features': 0.7578062782733717, 'subsample': 0.8673120429336761, 'dropout_rate': 0.599989867431384, 'ccp_alpha': 0.29125275094610703}. Best is trial 712 with value: 0.7824105962295036.[0m
[32m[I 2022-04-15 10:09:50,064][0m Trial 728 finished with value: 0.6743624146605087 and parameters: {'loss': 'coxph', 'learning_rate': 0.002576647204546965, 'n_estimators': 584, 'criterion': 'friedman_mse', 'min_samples_split': 5, 'min_samples_leaf': 3, 'min_weight_fraction_leaf': 0.049651367850771344, 'min_impurity_decrease': 0.45272467927038146, 'max_features': 0.7465048663348895, 'subsample': 0.9720085303216309, 'dropout_rate': 0.5749828830958376, 'ccp_alpha': 0.156433422088748}. Best is trial 712 with value: 0.7824105962295036.[0m
[32m[I 2022-04-15 10:11:14,664][0m Trial 729 finished with value: 0.777667865688592 and parameters: {'loss': 'coxph', 'learning_rate': 0.0033780082111878372, 'n_estimators': 556, 'criterion': 'friedman_mse', 'min_samples_split': 6, 'min_samples_leaf': 3, 'min_weight_fraction_leaf': 0.0787665407167499, 'min_impurity_decrease': 0.4603571473573108, 'max_features': 0.8028603747796227, 'subsample': 0.7788845953212915, 'dropout_rate': 0.5234188718799593, 'ccp_alpha': 0.0022355689902002493}. Best is trial 712 with value: 0.7824105962295036.[0m
[32m[I 2022-04-15 10:12:33,111][0m Trial 730 finished with value: 0.7769479706249105 and parameters: {'loss': 'coxph', 'learning_rate': 0.0032754056993716278, 'n_estimators': 550, 'criterion': 'friedman_mse', 'min_samples_split': 6, 'min_samples_leaf': 3, 'min_weight_fraction_leaf': 0.078986067451616, 'min_impurity_decrease': 0.46748178794367523, 'max_features': 0.8060471530362162, 'subsample': 0.7803230530091595, 'dropout_rate': 0.5967369248503552, 'ccp_alpha': 0.001855467481252206}. Best is trial 712 with value: 0.7824105962295036.[0m
[32m[I 2022-04-15 10:13:37,891][0m Trial 731 finished with value: 0.5 and parameters: {'loss': 'coxph', 'learning_rate': 0.0032515823268092843, 'n_estimators': 557, 'criterion': 'squared_error', 'min_samples_split': 6, 'min_samples_leaf': 3, 'min_weight_fraction_leaf': 0.08902692585782415, 'min_impurity_decrease': 0.4589689311679446, 'max_features': 0.7669605321626676, 'subsample': 0.7929739865750708, 'dropout_rate': 0.6000616109239312, 'ccp_alpha': 0.09151287615373155}. Best is trial 712 with value: 0.7824105962295036.[0m
[32m[I 2022-04-15 10:14:43,797][0m Trial 732 finished with value: 0.5 and parameters: {'loss': 'coxph', 'learning_rate': 0.0035945894058094082, 'n_estimators': 537, 'criterion': 'friedman_mse', 'min_samples_split': 6, 'min_samples_leaf': 3, 'min_weight_fraction_leaf': 0.08479055495984698, 'min_impurity_decrease': 0.46442077615461513, 'max_features': 0.8056171618388241, 'subsample': 0.7874718352807732, 'dropout_rate': 0.5871431268455327, 'ccp_alpha': 0.22935952397342532}. Best is trial 712 with value: 0.7824105962295036.[0m
[32m[I 2022-04-15 10:16:02,299][0m Trial 733 finished with value: 0.7778061260543315 and parameters: {'loss': 'coxph', 'learning_rate': 0.0033312363498971278, 'n_estimators': 576, 'criterion': 'friedman_mse', 'min_samples_split': 6, 'min_samples_leaf': 2, 'min_weight_fraction_leaf': 0.07358404735615788, 'min_impurity_decrease': 0.4554064659993997, 'max_features': 0.7735509904273099, 'subsample': 0.7650446393121768, 'dropout_rate': 0.6278041892946815, 'ccp_alpha': 0.0011054916636880922}. Best is trial 712 with value: 0.7824105962295036.[0m
[32m[I 2022-04-15 10:16:39,957][0m Trial 734 finished with value: 0.28067988875989597 and parameters: {'loss': 'squared', 'learning_rate': 0.00399848407111792, 'n_estimators': 534, 'criterion': 'friedman_mse', 'min_samples_split': 6, 'min_samples_leaf': 2, 'min_weight_fraction_leaf': 0.07846957116838293, 'min_impurity_decrease': 0.4457802699941976, 'max_features': 0.7346474446461229, 'subsample': 0.7719424202041083, 'dropout_rate': 0.6143757681458296, 'ccp_alpha': 0.16562460273345206}. Best is trial 712 with value: 0.7824105962295036.[0m
