[32m[I 2022-04-13 13:21:43,333][0m Trial 811 finished with value: 0.7443536534425391 and parameters: {'alpha': 0.6712382079058129, 'ties': 'breslow'}. Best is trial 429 with value: 0.745409816487361.[0m
[32m[I 2022-04-13 13:21:46,600][0m Trial 812 finished with value: 0.7449565336458611 and parameters: {'alpha': 1.4886442600789866, 'ties': 'breslow'}. Best is trial 429 with value: 0.745409816487361.[0m
[32m[I 2022-04-13 13:21:50,206][0m Trial 813 finished with value: 0.7451395478095922 and parameters: {'alpha': 1.0931941224941373, 'ties': 'breslow'}. Best is trial 429 with value: 0.745409816487361.[0m
[32m[I 2022-04-13 13:21:53,900][0m Trial 814 finished with value: 0.7449685892470552 and parameters: {'alpha': 1.3783847981561228, 'ties': 'breslow'}. Best is trial 429 with value: 0.745409816487361.[0m
[32m[I 2022-04-13 13:21:57,262][0m Trial 815 finished with value: 0.7452416760176046 and parameters: {'alpha': 1.1983949248454049, 'ties': 'breslow'}. Best is trial 429 with value: 0.745409816487361.[0m
[32m[I 2022-04-13 13:22:01,516][0m Trial 816 finished with value: 0.7452170973209604 and parameters: {'alpha': 0.8708957140090358, 'ties': 'breslow'}. Best is trial 429 with value: 0.745409816487361.[0m
[32m[I 2022-04-13 13:22:05,691][0m Trial 817 finished with value: 0.7452215960417237 and parameters: {'alpha': 1.3052974157928592, 'ties': 'breslow'}. Best is trial 429 with value: 0.745409816487361.[0m
[32m[I 2022-04-13 13:22:09,415][0m Trial 818 finished with value: 0.7452244504421016 and parameters: {'alpha': 1.0236652941034496, 'ties': 'breslow'}. Best is trial 429 with value: 0.745409816487361.[0m
[32m[I 2022-04-13 13:22:13,036][0m Trial 819 finished with value: 0.7452413934021013 and parameters: {'alpha': 1.1475394378745616, 'ties': 'efron'}. Best is trial 429 with value: 0.745409816487361.[0m
[32m[I 2022-04-13 13:22:16,574][0m Trial 820 finished with value: 0.7448823899493863 and parameters: {'alpha': 1.4364326154286235, 'ties': 'breslow'}. Best is trial 429 with value: 0.745409816487361.[0m
[32m[I 2022-04-13 13:22:19,173][0m Trial 821 finished with value: 0.7453282106586034 and parameters: {'alpha': 1.2604168679941548, 'ties': 'breslow'}. Best is trial 429 with value: 0.745409816487361.[0m
[32m[I 2022-04-13 13:22:23,324][0m Trial 822 finished with value: 0.7452079357932885 and parameters: {'alpha': 1.1106682649675765, 'ties': 'breslow'}. Best is trial 429 with value: 0.745409816487361.[0m
[32m[I 2022-04-13 13:22:26,103][0m Trial 823 finished with value: 0.7449776066643603 and parameters: {'alpha': 1.3778408315292459, 'ties': 'breslow'}. Best is trial 429 with value: 0.745409816487361.[0m
[32m[I 2022-04-13 13:22:28,814][0m Trial 824 finished with value: 0.7453989166660413 and parameters: {'alpha': 1.2141053444673584, 'ties': 'breslow'}. Best is trial 429 with value: 0.745409816487361.[0m
[32m[I 2022-04-13 13:22:31,885][0m Trial 825 finished with value: 0.745281329616783 and parameters: {'alpha': 0.9810380709133827, 'ties': 'breslow'}. Best is trial 429 with value: 0.745409816487361.[0m
[32m[I 2022-04-13 13:22:36,100][0m Trial 826 finished with value: 0.7451803434157991 and parameters: {'alpha': 1.1954721302697726, 'ties': 'breslow'}. Best is trial 429 with value: 0.745409816487361.[0m
[32m[I 2022-04-13 13:22:39,114][0m Trial 827 finished with value: 0.7445244764472982 and parameters: {'alpha': 2.181901023369117, 'ties': 'breslow'}. Best is trial 429 with value: 0.745409816487361.[0m
[32m[I 2022-04-13 13:22:42,783][0m Trial 828 finished with value: 0.7452099969584014 and parameters: {'alpha': 1.310885684338317, 'ties': 'breslow'}. Best is trial 429 with value: 0.745409816487361.[0m
[32m[I 2022-04-13 13:22:46,106][0m Trial 829 finished with value: 0.742024024526761 and parameters: {'alpha': 3.0620775231547595, 'ties': 'breslow'}. Best is trial 429 with value: 0.745409816487361.[0m
[32m[I 2022-04-13 13:22:49,390][0m Trial 830 finished with value: 0.7450537810331005 and parameters: {'alpha': 1.043816453987634, 'ties': 'breslow'}. Best is trial 429 with value: 0.745409816487361.[0m
[32m[I 2022-04-13 13:22:52,733][0m Trial 831 finished with value: 0.7452608186578482 and parameters: {'alpha': 1.1488421929871868, 'ties': 'efron'}. Best is trial 429 with value: 0.745409816487361.[0m
[32m[I 2022-04-13 13:22:55,396][0m Trial 832 finished with value: 0.7453319671949813 and parameters: {'alpha': 1.2497930447268526, 'ties': 'breslow'}. Best is trial 429 with value: 0.745409816487361.[0m
[32m[I 2022-04-13 13:22:59,325][0m Trial 833 finished with value: 0.7448796743854758 and parameters: {'alpha': 1.523012305330026, 'ties': 'breslow'}. Best is trial 429 with value: 0.745409816487361.[0m
[32m[I 2022-04-13 13:23:02,967][0m Trial 834 finished with value: 0.7449531651583303 and parameters: {'alpha': 1.3844824168556884, 'ties': 'breslow'}. Best is trial 429 with value: 0.745409816487361.[0m
[32m[I 2022-04-13 13:23:06,753][0m Trial 835 finished with value: 0.7451395478095922 and parameters: {'alpha': 1.0922426576715618, 'ties': 'breslow'}. Best is trial 429 with value: 0.745409816487361.[0m
[32m[I 2022-04-13 13:23:10,323][0m Trial 836 finished with value: 0.7453030406238851 and parameters: {'alpha': 0.9131691946248823, 'ties': 'breslow'}. Best is trial 429 with value: 0.745409816487361.[0m
[32m[I 2022-04-13 13:23:14,128][0m Trial 837 finished with value: 0.7418444094832031 and parameters: {'alpha': 3.3579152667609553, 'ties': 'breslow'}. Best is trial 429 with value: 0.745409816487361.[0m
[32m[I 2022-04-13 13:23:17,334][0m Trial 838 finished with value: 0.7453989166660413 and parameters: {'alpha': 1.2143405244161458, 'ties': 'breslow'}. Best is trial 429 with value: 0.745409816487361.[0m
[32m[I 2022-04-13 13:23:22,324][0m Trial 839 finished with value: 0.7452396919595836 and parameters: {'alpha': 1.1875355958112324, 'ties': 'breslow'}. Best is trial 429 with value: 0.745409816487361.[0m
[32m[I 2022-04-13 13:23:26,866][0m Trial 840 finished with value: 0.7452314251596781 and parameters: {'alpha': 1.3057057189258934, 'ties': 'breslow'}. Best is trial 429 with value: 0.745409816487361.[0m
[32m[I 2022-04-13 13:23:31,299][0m Trial 841 finished with value: 0.7451548518920152 and parameters: {'alpha': 1.1054991652425086, 'ties': 'breslow'}. Best is trial 429 with value: 0.745409816487361.[0m
[32m[I 2022-04-13 13:23:34,478][0m Trial 842 finished with value: 0.7452109683122783 and parameters: {'alpha': 1.011721838589951, 'ties': 'breslow'}. Best is trial 429 with value: 0.745409816487361.[0m
[32m[I 2022-04-13 13:23:37,266][0m Trial 843 finished with value: 0.7453104041468817 and parameters: {'alpha': 1.2476106292827032, 'ties': 'efron'}. Best is trial 429 with value: 0.745409816487361.[0m
[32m[I 2022-04-13 13:23:41,091][0m Trial 844 finished with value: 0.7449154142979261 and parameters: {'alpha': 1.4581537507041473, 'ties': 'breslow'}. Best is trial 429 with value: 0.745409816487361.[0m
[32m[I 2022-04-13 13:23:44,451][0m Trial 845 finished with value: 0.7451248511116821 and parameters: {'alpha': 0.7851717740052193, 'ties': 'breslow'}. Best is trial 429 with value: 0.745409816487361.[0m
[32m[I 2022-04-13 13:23:47,984][0m Trial 846 finished with value: 0.7450308338708971 and parameters: {'alpha': 1.340110130194799, 'ties': 'breslow'}. Best is trial 429 with value: 0.745409816487361.[0m
[32m[I 2022-04-13 13:23:49,815][0m Trial 847 finished with value: 0.7449320655388312 and parameters: {'alpha': 1.7563885774281975, 'ties': 'breslow'}. Best is trial 429 with value: 0.745409816487361.[0m
[32m[I 2022-04-13 13:23:53,189][0m Trial 848 finished with value: 0.7451240209077932 and parameters: {'alpha': 1.1635740127318606, 'ties': 'breslow'}. Best is trial 429 with value: 0.745409816487361.[0m
[32m[I 2022-04-13 13:23:56,537][0m Trial 849 finished with value: 0.7453282106586034 and parameters: {'alpha': 1.2619510014873037, 'ties': 'breslow'}. Best is trial 429 with value: 0.745409816487361.[0m
[32m[I 2022-04-13 13:24:00,651][0m Trial 850 finished with value: 0.7451455786868567 and parameters: {'alpha': 1.0568077493400858, 'ties': 'breslow'}. Best is trial 429 with value: 0.745409816487361.[0m
[32m[I 2022-04-13 13:24:04,587][0m Trial 851 finished with value: 0.7452722445673681 and parameters: {'alpha': 0.9332098879648432, 'ties': 'breslow'}. Best is trial 429 with value: 0.745409816487361.[0m
[32m[I 2022-04-13 13:24:09,265][0m Trial 852 finished with value: 0.7449851617834833 and parameters: {'alpha': 1.3955488157379499, 'ties': 'breslow'}. Best is trial 429 with value: 0.745409816487361.[0m
[32m[I 2022-04-13 13:24:14,261][0m Trial 853 finished with value: 0.7452313486505211 and parameters: {'alpha': 1.180327231938027, 'ties': 'breslow'}. Best is trial 429 with value: 0.745409816487361.[0m
[32m[I 2022-04-13 13:24:18,240][0m Trial 854 finished with value: 0.7452314251596781 and parameters: {'alpha': 1.3071806130673231, 'ties': 'breslow'}. Best is trial 429 with value: 0.745409816487361.[0m
[32m[I 2022-04-13 13:24:21,806][0m Trial 855 finished with value: 0.7451549202079195 and parameters: {'alpha': 1.106765748400729, 'ties': 'efron'}. Best is trial 429 with value: 0.745409816487361.[0m
[32m[I 2022-04-13 13:24:24,354][0m Trial 856 finished with value: 0.7449753078699752 and parameters: {'alpha': 1.5489998638285656, 'ties': 'breslow'}. Best is trial 429 with value: 0.745409816487361.[0m
[32m[I 2022-04-13 13:24:28,428][0m Trial 857 finished with value: 0.7452392408282164 and parameters: {'alpha': 1.2124762060843393, 'ties': 'breslow'}. Best is trial 429 with value: 0.745409816487361.[0m
[32m[I 2022-04-13 13:24:31,529][0m Trial 858 finished with value: 0.7451070993212736 and parameters: {'alpha': 1.3213711710219618, 'ties': 'breslow'}. Best is trial 429 with value: 0.745409816487361.[0m
[32m[I 2022-04-13 13:24:35,427][0m Trial 859 finished with value: 0.7448987845042967 and parameters: {'alpha': 1.4333367976660334, 'ties': 'breslow'}. Best is trial 429 with value: 0.745409816487361.[0m
[32m[I 2022-04-13 13:24:39,060][0m Trial 860 finished with value: 0.7451918580178585 and parameters: {'alpha': 1.0102376940191773, 'ties': 'breslow'}. Best is trial 429 with value: 0.745409816487361.[0m
[32m[I 2022-04-13 13:24:43,442][0m Trial 861 finished with value: 0.7451385309327818 and parameters: {'alpha': 1.1702693877207055, 'ties': 'breslow'}. Best is trial 429 with value: 0.745409816487361.[0m
[32m[I 2022-04-13 13:24:46,541][0m Trial 862 finished with value: 0.7453322082366861 and parameters: {'alpha': 1.245107997229289, 'ties': 'breslow'}. Best is trial 429 with value: 0.745409816487361.[0m
[32m[I 2022-04-13 13:24:49,100][0m Trial 863 finished with value: 0.7452452688385873 and parameters: {'alpha': 1.080977560968336, 'ties': 'breslow'}. Best is trial 429 with value: 0.745409816487361.[0m
[32m[I 2022-04-13 13:24:51,678][0m Trial 864 finished with value: 0.745069734022117 and parameters: {'alpha': 1.361313607198564, 'ties': 'breslow'}. Best is trial 429 with value: 0.745409816487361.[0m
[32m[I 2022-04-13 13:24:54,489][0m Trial 865 finished with value: 0.745285538193883 and parameters: {'alpha': 1.1458008673741455, 'ties': 'breslow'}. Best is trial 429 with value: 0.745409816487361.[0m
[32m[I 2022-04-13 13:24:59,925][0m Trial 866 finished with value: 0.745271427038832 and parameters: {'alpha': 1.273911633428657, 'ties': 'efron'}. Best is trial 429 with value: 0.745409816487361.[0m
[32m[I 2022-04-13 13:25:03,561][0m Trial 867 finished with value: 0.7452804152674108 and parameters: {'alpha': 0.9537498094835153, 'ties': 'breslow'}. Best is trial 429 with value: 0.745409816487361.[0m
[32m[I 2022-04-13 13:25:07,236][0m Trial 868 finished with value: 0.7449499343231034 and parameters: {'alpha': 1.4721957175670828, 'ties': 'breslow'}. Best is trial 429 with value: 0.745409816487361.[0m
[32m[I 2022-04-13 13:25:10,067][0m Trial 869 finished with value: 0.7452148583401925 and parameters: {'alpha': 1.076035821031485, 'ties': 'breslow'}. Best is trial 429 with value: 0.745409816487361.[0m
[32m[I 2022-04-13 13:25:13,831][0m Trial 870 finished with value: 0.7453570910428045 and parameters: {'alpha': 1.2282332524631354, 'ties': 'breslow'}. Best is trial 429 with value: 0.745409816487361.[0m
[32m[I 2022-04-13 13:25:17,751][0m Trial 871 finished with value: 0.7450031010357108 and parameters: {'alpha': 1.3757240370506487, 'ties': 'breslow'}. Best is trial 429 with value: 0.745409816487361.[0m
[32m[I 2022-04-13 13:25:20,963][0m Trial 872 finished with value: 0.7451803434157991 and parameters: {'alpha': 1.195323578615116, 'ties': 'breslow'}. Best is trial 429 with value: 0.745409816487361.[0m
[32m[I 2022-04-13 13:25:23,157][0m Trial 873 finished with value: 0.7449480617894281 and parameters: {'alpha': 1.5923456348748324, 'ties': 'breslow'}. Best is trial 429 with value: 0.745409816487361.[0m
[32m[I 2022-04-13 13:25:26,325][0m Trial 874 finished with value: 0.745286734514109 and parameters: {'alpha': 1.2735802907588656, 'ties': 'breslow'}. Best is trial 429 with value: 0.745409816487361.[0m
[32m[I 2022-04-13 13:25:28,605][0m Trial 875 finished with value: 0.7452350445104887 and parameters: {'alpha': 0.8611167838058236, 'ties': 'breslow'}. Best is trial 429 with value: 0.745409816487361.[0m
[32m[I 2022-04-13 13:25:31,526][0m Trial 876 finished with value: 0.7452007770911889 and parameters: {'alpha': 1.1260615718143936, 'ties': 'breslow'}. Best is trial 429 with value: 0.745409816487361.[0m
[32m[I 2022-04-13 13:25:35,670][0m Trial 877 finished with value: 0.7450643084341927 and parameters: {'alpha': 1.3670478468843323, 'ties': 'efron'}. Best is trial 429 with value: 0.745409816487361.[0m
[32m[I 2022-04-13 13:25:39,086][0m Trial 878 finished with value: 0.7452127967058375 and parameters: {'alpha': 1.0197491716169211, 'ties': 'breslow'}. Best is trial 429 with value: 0.745409816487361.[0m
[32m[I 2022-04-13 13:25:42,537][0m Trial 879 finished with value: 0.7452598558685691 and parameters: {'alpha': 1.2871910835682512, 'ties': 'breslow'}. Best is trial 429 with value: 0.745409816487361.[0m
[32m[I 2022-04-13 13:25:45,413][0m Trial 880 finished with value: 0.7452082938495679 and parameters: {'alpha': 1.1794698376960877, 'ties': 'breslow'}. Best is trial 429 with value: 0.745409816487361.[0m
[32m[I 2022-04-13 13:25:48,983][0m Trial 881 finished with value: 0.7448870716221989 and parameters: {'alpha': 1.4520783515061446, 'ties': 'breslow'}. Best is trial 429 with value: 0.745409816487361.[0m
[32m[I 2022-04-13 13:25:52,945][0m Trial 882 finished with value: 0.7451579026067834 and parameters: {'alpha': 1.0909176173780657, 'ties': 'breslow'}. Best is trial 429 with value: 0.745409816487361.[0m
[32m[I 2022-04-13 13:25:55,682][0m Trial 883 finished with value: 0.7436912112050547 and parameters: {'alpha': 2.670937507312644, 'ties': 'breslow'}. Best is trial 429 with value: 0.745409816487361.[0m
[32m[I 2022-04-13 13:25:59,219][0m Trial 884 finished with value: 0.7452214994839786 and parameters: {'alpha': 1.3077874914739838, 'ties': 'breslow'}. Best is trial 429 with value: 0.745409816487361.[0m
[32m[I 2022-04-13 13:26:03,482][0m Trial 885 finished with value: 0.7452632189363739 and parameters: {'alpha': 1.2058891371782603, 'ties': 'breslow'}. Best is trial 429 with value: 0.745409816487361.[0m
[32m[I 2022-04-13 13:26:07,259][0m Trial 886 finished with value: 0.7452947199961095 and parameters: {'alpha': 0.9636361690453656, 'ties': 'breslow'}. Best is trial 429 with value: 0.745409816487361.[0m
[32m[I 2022-04-13 13:26:11,486][0m Trial 887 finished with value: 0.7449492106213075 and parameters: {'alpha': 1.3888026957524748, 'ties': 'breslow'}. Best is trial 429 with value: 0.745409816487361.[0m
[32m[I 2022-04-13 13:26:15,436][0m Trial 888 finished with value: 0.7453570910428045 and parameters: {'alpha': 1.2255543057402398, 'ties': 'breslow'}. Best is trial 429 with value: 0.745409816487361.[0m
[32m[I 2022-04-13 13:26:20,225][0m Trial 889 finished with value: 0.7451307120039219 and parameters: {'alpha': 1.0955055911002807, 'ties': 'efron'}. Best is trial 429 with value: 0.745409816487361.[0m
[32m[I 2022-04-13 13:26:23,599][0m Trial 890 finished with value: 0.7451527595717933 and parameters: {'alpha': 1.1561737392004101, 'ties': 'breslow'}. Best is trial 429 with value: 0.745409816487361.[0m
[32m[I 2022-04-13 13:26:27,029][0m Trial 891 finished with value: 0.7452517592707897 and parameters: {'alpha': 1.2769726735950895, 'ties': 'breslow'}. Best is trial 429 with value: 0.745409816487361.[0m
[32m[I 2022-04-13 13:26:30,641][0m Trial 892 finished with value: 0.744954198470112 and parameters: {'alpha': 1.4631838504914922, 'ties': 'breslow'}. Best is trial 429 with value: 0.745409816487361.[0m
[32m[I 2022-04-13 13:26:32,449][0m Trial 893 finished with value: 0.745053086652509 and parameters: {'alpha': 1.346448093275868, 'ties': 'breslow'}. Best is trial 429 with value: 0.745409816487361.[0m
[32m[I 2022-04-13 13:26:36,595][0m Trial 894 finished with value: 0.7452334678594068 and parameters: {'alpha': 1.0229553383766359, 'ties': 'breslow'}. Best is trial 429 with value: 0.745409816487361.[0m
[32m[I 2022-04-13 13:26:39,472][0m Trial 895 finished with value: 0.7452257568974496 and parameters: {'alpha': 1.152841784466243, 'ties': 'breslow'}. Best is trial 429 with value: 0.745409816487361.[0m
[32m[I 2022-04-13 13:26:41,888][0m Trial 896 finished with value: 0.7433279869862309 and parameters: {'alpha': 0.3193879391123726, 'ties': 'breslow'}. Best is trial 429 with value: 0.745409816487361.[0m
[32m[I 2022-04-13 13:26:44,643][0m Trial 897 finished with value: 0.743807437919497 and parameters: {'alpha': 0.5319625040352137, 'ties': 'breslow'}. Best is trial 429 with value: 0.745409816487361.[0m
[32m[I 2022-04-13 13:26:48,996][0m Trial 898 finished with value: 0.7453570910428045 and parameters: {'alpha': 1.229399256711827, 'ties': 'breslow'}. Best is trial 429 with value: 0.745409816487361.[0m
[32m[I 2022-04-13 13:26:52,786][0m Trial 899 finished with value: 0.7449192820561582 and parameters: {'alpha': 1.6053971172887969, 'ties': 'breslow'}. Best is trial 429 with value: 0.745409816487361.[0m
[32m[I 2022-04-13 13:26:55,745][0m Trial 900 finished with value: 0.7452517592707897 and parameters: {'alpha': 1.278650179577464, 'ties': 'breslow'}. Best is trial 429 with value: 0.745409816487361.[0m
[32m[I 2022-04-13 13:26:59,755][0m Trial 901 finished with value: 0.7449569532014586 and parameters: {'alpha': 1.390255462843693, 'ties': 'efron'}. Best is trial 429 with value: 0.745409816487361.[0m
[32m[I 2022-04-13 13:27:04,147][0m Trial 902 finished with value: 0.7451890591295676 and parameters: {'alpha': 1.0600287673613364, 'ties': 'breslow'}. Best is trial 429 with value: 0.745409816487361.[0m
[32m[I 2022-04-13 13:27:08,081][0m Trial 903 finished with value: 0.7452416760176046 and parameters: {'alpha': 1.1995291146255243, 'ties': 'breslow'}. Best is trial 429 with value: 0.745409816487361.[0m
[32m[I 2022-04-13 13:27:11,974][0m Trial 904 finished with value: 0.7452146207920454 and parameters: {'alpha': 0.9271042417157448, 'ties': 'breslow'}. Best is trial 429 with value: 0.745409816487361.[0m
[32m[I 2022-04-13 13:27:15,546][0m Trial 905 finished with value: 0.7453038106933624 and parameters: {'alpha': 1.1414099114814888, 'ties': 'breslow'}. Best is trial 429 with value: 0.745409816487361.[0m
[32m[I 2022-04-13 13:27:19,857][0m Trial 906 finished with value: 0.7450480300433827 and parameters: {'alpha': 1.3359388640472867, 'ties': 'breslow'}. Best is trial 429 with value: 0.745409816487361.[0m
[32m[I 2022-04-13 13:27:23,449][0m Trial 907 finished with value: 0.7449326608189895 and parameters: {'alpha': 1.4928535360494535, 'ties': 'breslow'}. Best is trial 429 with value: 0.745409816487361.[0m
[32m[I 2022-04-13 13:27:26,344][0m Trial 908 finished with value: 0.7453563245148448 and parameters: {'alpha': 1.2195804612285968, 'ties': 'breslow'}. Best is trial 429 with value: 0.745409816487361.[0m
[32m[I 2022-04-13 13:27:30,212][0m Trial 909 finished with value: 0.745091454173972 and parameters: {'alpha': 1.0449251807611633, 'ties': 'breslow'}. Best is trial 429 with value: 0.745409816487361.[0m
[32m[I 2022-04-13 13:27:33,288][0m Trial 910 finished with value: 0.7451171014971867 and parameters: {'alpha': 1.3222069278071433, 'ties': 'breslow'}. Best is trial 429 with value: 0.745409816487361.[0m
[32m[I 2022-04-13 13:27:36,266][0m Trial 911 finished with value: 0.7453570910428045 and parameters: {'alpha': 1.22646192293911, 'ties': 'breslow'}. Best is trial 429 with value: 0.745409816487361.[0m
[32m[I 2022-04-13 13:27:39,842][0m Trial 912 finished with value: 0.7451202368313283 and parameters: {'alpha': 1.110966573449198, 'ties': 'efron'}. Best is trial 429 with value: 0.745409816487361.[0m
[32m[I 2022-04-13 13:27:43,275][0m Trial 913 finished with value: 0.7448321990941753 and parameters: {'alpha': 1.4211999210170363, 'ties': 'breslow'}. Best is trial 429 with value: 0.745409816487361.[0m
[32m[I 2022-04-13 13:27:45,818][0m Trial 914 finished with value: 0.7453570910428045 and parameters: {'alpha': 1.2287264563645435, 'ties': 'breslow'}. Best is trial 429 with value: 0.745409816487361.[0m
[32m[I 2022-04-13 13:27:50,464][0m Trial 915 finished with value: 0.7453018739649686 and parameters: {'alpha': 1.2938298956063525, 'ties': 'breslow'}. Best is trial 429 with value: 0.745409816487361.[0m
[32m[I 2022-04-13 13:27:54,535][0m Trial 916 finished with value: 0.745202292375043 and parameters: {'alpha': 0.8441378869698499, 'ties': 'breslow'}. Best is trial 429 with value: 0.745409816487361.[0m
[32m[I 2022-04-13 13:27:57,317][0m Trial 917 finished with value: 0.7452109683122783 and parameters: {'alpha': 1.0116475314555138, 'ties': 'breslow'}. Best is trial 429 with value: 0.745409816487361.[0m
