[32m[I 2022-04-13 12:14:36,392][0m Trial 134 finished with value: 0.7682641570099428 and parameters: {'splitter': 'best', 'min_samples_split': 0.06656164785319162, 'min_samples_leaf': 0.024696955128647818, 'min_weight_fraction_leaf': 0.00082015385393433, 'max_features': 0.9961156542110177}. Best is trial 106 with value: 0.7729540927062496.[0m
[32m[I 2022-04-13 12:14:38,859][0m Trial 135 finished with value: 0.7718158364671326 and parameters: {'splitter': 'best', 'min_samples_split': 0.08008177628705408, 'min_samples_leaf': 0.02066427419359693, 'min_weight_fraction_leaf': 0.010990702265910788, 'max_features': 0.9986667532288755}. Best is trial 106 with value: 0.7729540927062496.[0m
[32m[I 2022-04-13 12:14:40,903][0m Trial 136 finished with value: 0.7715605941322748 and parameters: {'splitter': 'best', 'min_samples_split': 0.0793747166497588, 'min_samples_leaf': 0.01225281181152464, 'min_weight_fraction_leaf': 0.013240536598624071, 'max_features': 0.9706302150693515}. Best is trial 106 with value: 0.7729540927062496.[0m
[32m[I 2022-04-13 12:14:44,105][0m Trial 137 finished with value: 0.770759275883847 and parameters: {'splitter': 'best', 'min_samples_split': 0.08395027102583856, 'min_samples_leaf': 0.01280891917391013, 'min_weight_fraction_leaf': 0.011337434371549314, 'max_features': 0.9738386021044593}. Best is trial 106 with value: 0.7729540927062496.[0m
[32m[I 2022-04-13 12:14:46,673][0m Trial 138 finished with value: 0.7652902700063529 and parameters: {'splitter': 'best', 'min_samples_split': 0.08537187456958305, 'min_samples_leaf': 0.010626625935752844, 'min_weight_fraction_leaf': 0.016134832640605473, 'max_features': 0.9721466995623202}. Best is trial 106 with value: 0.7729540927062496.[0m
[32m[I 2022-04-13 12:14:47,067][0m Trial 139 finished with value: 0.7529315152682062 and parameters: {'splitter': 'random', 'min_samples_split': 0.10529142174353318, 'min_samples_leaf': 0.01186322890437867, 'min_weight_fraction_leaf': 0.014337644177803057, 'max_features': 0.9689789614917313}. Best is trial 106 with value: 0.7729540927062496.[0m
[32m[I 2022-04-13 12:14:49,589][0m Trial 140 finished with value: 0.7709824715663036 and parameters: {'splitter': 'best', 'min_samples_split': 0.07806601585744641, 'min_samples_leaf': 0.020293113251480262, 'min_weight_fraction_leaf': 0.008818509022342175, 'max_features': 0.9736684273625601}. Best is trial 106 with value: 0.7729540927062496.[0m
[32m[I 2022-04-13 12:14:52,439][0m Trial 141 finished with value: 0.7694931669660919 and parameters: {'splitter': 'best', 'min_samples_split': 0.07705964392275969, 'min_samples_leaf': 0.02348120570150036, 'min_weight_fraction_leaf': 0.007321016208272933, 'max_features': 0.9953563388254169}. Best is trial 106 with value: 0.7729540927062496.[0m
[32m[I 2022-04-13 12:14:55,040][0m Trial 142 finished with value: 0.7669860908221483 and parameters: {'splitter': 'best', 'min_samples_split': 0.07970628709085353, 'min_samples_leaf': 0.011028973071079948, 'min_weight_fraction_leaf': 0.011269670537519379, 'max_features': 0.9962128635646925}. Best is trial 106 with value: 0.7729540927062496.[0m
[32m[I 2022-04-13 12:14:57,691][0m Trial 143 finished with value: 0.7616801481631505 and parameters: {'splitter': 'best', 'min_samples_split': 0.06121127069420376, 'min_samples_leaf': 0.037255467364073036, 'min_weight_fraction_leaf': 0.021690422603127618, 'max_features': 0.9690552982830031}. Best is trial 106 with value: 0.7729540927062496.[0m
[32m[I 2022-04-13 12:14:58,948][0m Trial 144 finished with value: 0.7645533287109549 and parameters: {'splitter': 'best', 'min_samples_split': 0.11619635075028478, 'min_samples_leaf': 0.02020487995543311, 'min_weight_fraction_leaf': 0.02813167066434326, 'max_features': 0.9075945043971456}. Best is trial 106 with value: 0.7729540927062496.[0m
[32m[I 2022-04-13 12:15:01,198][0m Trial 145 finished with value: 0.7636152688344531 and parameters: {'splitter': 'best', 'min_samples_split': 0.0860694675112839, 'min_samples_leaf': 0.02872528184837182, 'min_weight_fraction_leaf': 0.010380040196473874, 'max_features': 0.9714587553764615}. Best is trial 106 with value: 0.7729540927062496.[0m
[32m[I 2022-04-13 12:15:03,711][0m Trial 146 finished with value: 0.7639964527525739 and parameters: {'splitter': 'best', 'min_samples_split': 0.1273806486319365, 'min_samples_leaf': 0.010765877249807106, 'min_weight_fraction_leaf': 0.0006757693626283732, 'max_features': 0.9241362892386623}. Best is trial 106 with value: 0.7729540927062496.[0m
[32m[I 2022-04-13 12:15:04,641][0m Trial 147 finished with value: 0.7695379396623343 and parameters: {'splitter': 'best', 'min_samples_split': 0.061742760187903686, 'min_samples_leaf': 0.04164719120570218, 'min_weight_fraction_leaf': 0.017737173290096584, 'max_features': 0.99516196380445}. Best is trial 106 with value: 0.7729540927062496.[0m
[32m[I 2022-04-13 12:15:06,027][0m Trial 148 finished with value: 0.7687933700577771 and parameters: {'splitter': 'best', 'min_samples_split': 0.06120533045102295, 'min_samples_leaf': 0.0019231658668882844, 'min_weight_fraction_leaf': 0.018266761294917444, 'max_features': 0.9926810774021891}. Best is trial 106 with value: 0.7729540927062496.[0m
[32m[I 2022-04-13 12:15:08,161][0m Trial 149 finished with value: 0.767969536386618 and parameters: {'splitter': 'best', 'min_samples_split': 0.08462118116886175, 'min_samples_leaf': 0.03991809673873278, 'min_weight_fraction_leaf': 0.033152923807537094, 'max_features': 0.9961870352656251}. Best is trial 106 with value: 0.7729540927062496.[0m
[32m[I 2022-04-13 12:15:11,099][0m Trial 150 finished with value: 0.7642955146436845 and parameters: {'splitter': 'best', 'min_samples_split': 0.10368654451781363, 'min_samples_leaf': 0.018832663923538877, 'min_weight_fraction_leaf': 0.018818066620348548, 'max_features': 0.9583060868110163}. Best is trial 106 with value: 0.7729540927062496.[0m
[32m[I 2022-04-13 12:15:13,500][0m Trial 151 finished with value: 0.7668927377391542 and parameters: {'splitter': 'best', 'min_samples_split': 0.07930661428345023, 'min_samples_leaf': 0.03179519959586631, 'min_weight_fraction_leaf': 0.009734476282402918, 'max_features': 0.9728998516759088}. Best is trial 106 with value: 0.7729540927062496.[0m
[32m[I 2022-04-13 12:15:15,155][0m Trial 152 finished with value: 0.6743624146605087 and parameters: {'splitter': 'best', 'min_samples_split': 0.07500720657141338, 'min_samples_leaf': 0.04321272936235215, 'min_weight_fraction_leaf': 0.3140243179914952, 'max_features': 0.9994568755298698}. Best is trial 106 with value: 0.7729540927062496.[0m
[32m[I 2022-04-13 12:15:16,003][0m Trial 153 finished with value: 0.5614661507407795 and parameters: {'splitter': 'best', 'min_samples_split': 0.059734997186103554, 'min_samples_leaf': 0.025000327228788224, 'min_weight_fraction_leaf': 0.4994555717290766, 'max_features': 0.9468384956653078}. Best is trial 106 with value: 0.7729540927062496.[0m
[32m[I 2022-04-13 12:15:16,452][0m Trial 154 finished with value: 0.5930040131485143 and parameters: {'splitter': 'best', 'min_samples_split': 0.05262009955306547, 'min_samples_leaf': 0.3461282566940584, 'min_weight_fraction_leaf': 0.00975831950448164, 'max_features': 0.9313257054927689}. Best is trial 106 with value: 0.7729540927062496.[0m
[32m[I 2022-04-13 12:15:19,552][0m Trial 155 finished with value: 0.7676641952834425 and parameters: {'splitter': 'best', 'min_samples_split': 0.08970470088449772, 'min_samples_leaf': 0.010204918326396636, 'min_weight_fraction_leaf': 0.028269680939984873, 'max_features': 0.9996811192147812}. Best is trial 106 with value: 0.7729540927062496.[0m
[32m[I 2022-04-13 12:15:19,646][0m Trial 156 finished with value: 0.5611932377084641 and parameters: {'splitter': 'best', 'min_samples_split': 0.07374634729221646, 'min_samples_leaf': 0.05339552104185056, 'min_weight_fraction_leaf': 0.0013405381544377031, 'max_features': 0.00021758283418238378}. Best is trial 106 with value: 0.7729540927062496.[0m
[32m[I 2022-04-13 12:15:21,620][0m Trial 157 finished with value: 0.7113383882493189 and parameters: {'splitter': 'best', 'min_samples_split': 0.06509611380635358, 'min_samples_leaf': 0.03746721954849867, 'min_weight_fraction_leaf': 0.19938367709274413, 'max_features': 0.9663621360380481}. Best is trial 106 with value: 0.7729540927062496.[0m
[32m[I 2022-04-13 12:15:22,232][0m Trial 158 finished with value: 0.5914687042621789 and parameters: {'splitter': 'best', 'min_samples_split': 0.04592577403708013, 'min_samples_leaf': 0.01792671645311263, 'min_weight_fraction_leaf': 0.44163330593074146, 'max_features': 0.9527451728838575}. Best is trial 106 with value: 0.7729540927062496.[0m
[32m[I 2022-04-13 12:15:23,908][0m Trial 159 finished with value: 0.7691693901230126 and parameters: {'splitter': 'best', 'min_samples_split': 0.09062564859798983, 'min_samples_leaf': 0.030882604194199137, 'min_weight_fraction_leaf': 0.018931892414352613, 'max_features': 0.9768616686675541}. Best is trial 106 with value: 0.7729540927062496.[0m
[32m[I 2022-04-13 12:15:24,363][0m Trial 160 finished with value: 0.6039056757186527 and parameters: {'splitter': 'best', 'min_samples_split': 0.088033041806961, 'min_samples_leaf': 0.031347930098200624, 'min_weight_fraction_leaf': 0.03228199848443875, 'max_features': 0.0667030424065368}. Best is trial 106 with value: 0.7729540927062496.[0m
[32m[I 2022-04-13 12:15:26,868][0m Trial 161 finished with value: 0.7752929650004449 and parameters: {'splitter': 'best', 'min_samples_split': 0.07642878805541167, 'min_samples_leaf': 0.0449752637576047, 'min_weight_fraction_leaf': 0.017345588815614363, 'max_features': 0.9796126433594934}. Best is trial 161 with value: 0.7752929650004449.[0m
[32m[I 2022-04-13 12:15:28,516][0m Trial 162 finished with value: 0.7642214831624017 and parameters: {'splitter': 'best', 'min_samples_split': 0.10308561752413234, 'min_samples_leaf': 0.0016606210027858385, 'min_weight_fraction_leaf': 0.021054547815308126, 'max_features': 0.9735758487744176}. Best is trial 161 with value: 0.7752929650004449.[0m
[32m[I 2022-04-13 12:15:30,688][0m Trial 163 finished with value: 0.7720244242708463 and parameters: {'splitter': 'best', 'min_samples_split': 0.06080451767856357, 'min_samples_leaf': 0.04590619586840918, 'min_weight_fraction_leaf': 0.015825338033979213, 'max_features': 0.9756590549671535}. Best is trial 161 with value: 0.7752929650004449.[0m
[32m[I 2022-04-13 12:15:34,167][0m Trial 164 finished with value: 0.768729638810951 and parameters: {'splitter': 'best', 'min_samples_split': 0.058156345405079204, 'min_samples_leaf': 0.04625271724223519, 'min_weight_fraction_leaf': 0.0395812437334149, 'max_features': 0.947480228494032}. Best is trial 161 with value: 0.7752929650004449.[0m
[32m[I 2022-04-13 12:15:36,268][0m Trial 165 finished with value: 0.770042804592184 and parameters: {'splitter': 'best', 'min_samples_split': 0.0925131023647276, 'min_samples_leaf': 0.05539549256199513, 'min_weight_fraction_leaf': 0.02026874595879822, 'max_features': 0.9790770195371338}. Best is trial 161 with value: 0.7752929650004449.[0m
[32m[I 2022-04-13 12:15:36,603][0m Trial 166 finished with value: 0.5962864358175997 and parameters: {'splitter': 'best', 'min_samples_split': 0.06390460400091359, 'min_samples_leaf': 0.058293844043914925, 'min_weight_fraction_leaf': 0.4607624849472489, 'max_features': 0.8999634959841598}. Best is trial 161 with value: 0.7752929650004449.[0m
[32m[I 2022-04-13 12:15:36,689][0m Trial 167 finished with value: 0.7465692962260888 and parameters: {'splitter': 'random', 'min_samples_split': 0.3172990540979992, 'min_samples_leaf': 0.045124989334582234, 'min_weight_fraction_leaf': 0.02896423790932215, 'max_features': 0.9558055473365015}. Best is trial 161 with value: 0.7752929650004449.[0m
[32m[I 2022-04-13 12:15:37,588][0m Trial 168 finished with value: 0.7752929650004449 and parameters: {'splitter': 'best', 'min_samples_split': 0.05085712279380071, 'min_samples_leaf': 0.03975907135219317, 'min_weight_fraction_leaf': 0.045091712432444225, 'max_features': 0.978617526621452}. Best is trial 161 with value: 0.7752929650004449.[0m
[32m[I 2022-04-13 12:15:40,217][0m Trial 169 finished with value: 0.7142184767312153 and parameters: {'splitter': 'best', 'min_samples_split': 0.3829705387899694, 'min_samples_leaf': 0.048847300000092866, 'min_weight_fraction_leaf': 0.044874273329881025, 'max_features': 0.9218191323855509}. Best is trial 161 with value: 0.7752929650004449.[0m
[32m[I 2022-04-13 12:15:42,767][0m Trial 170 finished with value: 0.7681499331885474 and parameters: {'splitter': 'best', 'min_samples_split': 0.051451424370422494, 'min_samples_leaf': 0.039297212701422043, 'min_weight_fraction_leaf': 0.024884414059375377, 'max_features': 0.9757433962953381}. Best is trial 161 with value: 0.7752929650004449.[0m
[32m[I 2022-04-13 12:15:45,584][0m Trial 171 finished with value: 0.7659393649069175 and parameters: {'splitter': 'best', 'min_samples_split': 0.04252247136207903, 'min_samples_leaf': 0.014210770649929472, 'min_weight_fraction_leaf': 0.01282902394944467, 'max_features': 0.9785497735516797}. Best is trial 161 with value: 0.7752929650004449.[0m
[32m[I 2022-04-13 12:15:48,421][0m Trial 172 finished with value: 0.7694414617370277 and parameters: {'splitter': 'best', 'min_samples_split': 0.07910246814957862, 'min_samples_leaf': 0.032549189854957306, 'min_weight_fraction_leaf': 0.03473055369549842, 'max_features': 0.9420803055521841}. Best is trial 161 with value: 0.7752929650004449.[0m
[32m[I 2022-04-13 12:15:50,812][0m Trial 173 finished with value: 0.765628099225909 and parameters: {'splitter': 'best', 'min_samples_split': 0.06041382875923876, 'min_samples_leaf': 0.05517474276436747, 'min_weight_fraction_leaf': 0.016732711145311614, 'max_features': 0.9624159922873532}. Best is trial 161 with value: 0.7752929650004449.[0m
[32m[I 2022-04-13 12:15:50,982][0m Trial 174 finished with value: 0.5962864358175997 and parameters: {'splitter': 'best', 'min_samples_split': 0.05331207204928583, 'min_samples_leaf': 0.4624968141212111, 'min_weight_fraction_leaf': 0.025351175623864373, 'max_features': 0.9840167430248165}. Best is trial 161 with value: 0.7752929650004449.[0m
[32m[I 2022-04-13 12:15:53,501][0m Trial 175 finished with value: 0.7715141426201738 and parameters: {'splitter': 'best', 'min_samples_split': 0.06787588709849744, 'min_samples_leaf': 0.02570168740843315, 'min_weight_fraction_leaf': 0.01118131092799719, 'max_features': 0.9988233557233822}. Best is trial 161 with value: 0.7752929650004449.[0m
[32m[I 2022-04-13 12:15:54,351][0m Trial 176 finished with value: 0.5952180453030295 and parameters: {'splitter': 'best', 'min_samples_split': 0.06903462977581179, 'min_samples_leaf': 0.04008739743472855, 'min_weight_fraction_leaf': 0.3862695917284691, 'max_features': 0.9544311539815649}. Best is trial 161 with value: 0.7752929650004449.[0m
[32m[I 2022-04-13 12:15:57,220][0m Trial 177 finished with value: 0.769913708448545 and parameters: {'splitter': 'best', 'min_samples_split': 0.09756732112553707, 'min_samples_leaf': 0.01677882589011452, 'min_weight_fraction_leaf': 0.04357842650583718, 'max_features': 0.936141121542306}. Best is trial 161 with value: 0.7752929650004449.[0m
[32m[I 2022-04-13 12:16:00,232][0m Trial 178 finished with value: 0.774880857667228 and parameters: {'splitter': 'best', 'min_samples_split': 0.09630326065270117, 'min_samples_leaf': 0.010601273597895828, 'min_weight_fraction_leaf': 0.04341096970337975, 'max_features': 0.9997197418102552}. Best is trial 161 with value: 0.7752929650004449.[0m
[32m[I 2022-04-13 12:16:02,659][0m Trial 179 finished with value: 0.7705953981008077 and parameters: {'splitter': 'best', 'min_samples_split': 0.11287648142719237, 'min_samples_leaf': 0.009875111894339839, 'min_weight_fraction_leaf': 0.04390917646300423, 'max_features': 0.9328562897343373}. Best is trial 161 with value: 0.7752929650004449.[0m
[32m[I 2022-04-13 12:16:06,307][0m Trial 180 finished with value: 0.7661057785887893 and parameters: {'splitter': 'best', 'min_samples_split': 0.11352791810067908, 'min_samples_leaf': 0.008036468700649908, 'min_weight_fraction_leaf': 0.0004151258285477571, 'max_features': 0.9643847052421097}. Best is trial 161 with value: 0.7752929650004449.[0m
[32m[I 2022-04-13 12:16:08,667][0m Trial 181 finished with value: 0.7661240523829094 and parameters: {'splitter': 'best', 'min_samples_split': 0.09045472578316474, 'min_samples_leaf': 0.017745237029091268, 'min_weight_fraction_leaf': 0.04025083868398692, 'max_features': 0.936341900461227}. Best is trial 161 with value: 0.7752929650004449.[0m
[32m[I 2022-04-13 12:16:10,086][0m Trial 182 finished with value: 0.6927692112613728 and parameters: {'splitter': 'best', 'min_samples_split': 0.4692090624975297, 'min_samples_leaf': 0.012682534245806386, 'min_weight_fraction_leaf': 0.048921962788029044, 'max_features': 0.9126393174109089}. Best is trial 161 with value: 0.7752929650004449.[0m
[32m[I 2022-04-13 12:16:12,185][0m Trial 183 finished with value: 0.7711647155393629 and parameters: {'splitter': 'best', 'min_samples_split': 0.09746939481940227, 'min_samples_leaf': 0.02790783566693078, 'min_weight_fraction_leaf': 0.026632939101778847, 'max_features': 0.9997206883121788}. Best is trial 161 with value: 0.7752929650004449.[0m
[32m[I 2022-04-13 12:16:14,746][0m Trial 184 finished with value: 0.7688844524938692 and parameters: {'splitter': 'best', 'min_samples_split': 0.10636368246735681, 'min_samples_leaf': 0.0010806977144251217, 'min_weight_fraction_leaf': 0.029668974348762183, 'max_features': 0.9747122974325438}. Best is trial 161 with value: 0.7752929650004449.[0m
[32m[I 2022-04-13 12:16:15,862][0m Trial 185 finished with value: 0.7713474738954735 and parameters: {'splitter': 'best', 'min_samples_split': 0.09731600140431707, 'min_samples_leaf': 0.026463257418043395, 'min_weight_fraction_leaf': 0.016141509815093578, 'max_features': 0.9973672212292312}. Best is trial 161 with value: 0.7752929650004449.[0m
[32m[I 2022-04-13 12:16:17,405][0m Trial 186 finished with value: 0.7657085077611919 and parameters: {'splitter': 'best', 'min_samples_split': 0.09891975848473292, 'min_samples_leaf': 0.030227328186770527, 'min_weight_fraction_leaf': 0.013548740069339496, 'max_features': 0.956293614494206}. Best is trial 161 with value: 0.7752929650004449.[0m
[32m[I 2022-04-13 12:16:18,709][0m Trial 187 finished with value: 0.7250925779041733 and parameters: {'splitter': 'best', 'min_samples_split': 0.11667698503442422, 'min_samples_leaf': 0.02757763912727975, 'min_weight_fraction_leaf': 0.2599606484265836, 'max_features': 0.9801098019638614}. Best is trial 161 with value: 0.7752929650004449.[0m
[32m[I 2022-04-13 12:16:20,861][0m Trial 188 finished with value: 0.766866335821288 and parameters: {'splitter': 'best', 'min_samples_split': 0.1266932830434166, 'min_samples_leaf': 0.009179014108644634, 'min_weight_fraction_leaf': 0.02760683148739272, 'max_features': 0.9594010536454766}. Best is trial 161 with value: 0.7752929650004449.[0m
[32m[I 2022-04-13 12:16:24,382][0m Trial 189 finished with value: 0.7735871632805502 and parameters: {'splitter': 'best', 'min_samples_split': 0.08597472158561585, 'min_samples_leaf': 0.02745744760242476, 'min_weight_fraction_leaf': 0.018638999732959464, 'max_features': 0.9997275097055807}. Best is trial 161 with value: 0.7752929650004449.[0m
[32m[I 2022-04-13 12:16:26,331][0m Trial 190 finished with value: 0.7707092124781387 and parameters: {'splitter': 'best', 'min_samples_split': 0.08420564360196688, 'min_samples_leaf': 0.02716253040824705, 'min_weight_fraction_leaf': 0.010986106640848915, 'max_features': 0.9415911811462885}. Best is trial 161 with value: 0.7752929650004449.[0m
[32m[I 2022-04-13 12:16:30,386][0m Trial 191 finished with value: 0.7707092124781387 and parameters: {'splitter': 'best', 'min_samples_split': 0.08356990043323195, 'min_samples_leaf': 0.027371936215041276, 'min_weight_fraction_leaf': 0.012093351118008903, 'max_features': 0.9432123133822837}. Best is trial 161 with value: 0.7752929650004449.[0m
[32m[I 2022-04-13 12:16:32,771][0m Trial 192 finished with value: 0.7675062568078111 and parameters: {'splitter': 'best', 'min_samples_split': 0.08267738224186699, 'min_samples_leaf': 0.02837874657279893, 'min_weight_fraction_leaf': 0.011140558581888352, 'max_features': 0.9954641773414878}. Best is trial 161 with value: 0.7752929650004449.[0m
[32m[I 2022-04-13 12:16:34,872][0m Trial 193 finished with value: 0.7693308388319393 and parameters: {'splitter': 'best', 'min_samples_split': 0.08398395465966078, 'min_samples_leaf': 0.021343983482132914, 'min_weight_fraction_leaf': 0.009934942725736126, 'max_features': 0.9586374650418884}. Best is trial 161 with value: 0.7752929650004449.[0m
[32m[I 2022-04-13 12:16:36,041][0m Trial 194 finished with value: 0.7678063385756827 and parameters: {'splitter': 'best', 'min_samples_split': 0.06789168116124235, 'min_samples_leaf': 0.03372371281142564, 'min_weight_fraction_leaf': 0.020639679736088972, 'max_features': 0.9985144787952198}. Best is trial 161 with value: 0.7752929650004449.[0m
[32m[I 2022-04-13 12:16:38,263][0m Trial 195 finished with value: 0.7715831341461824 and parameters: {'splitter': 'best', 'min_samples_split': 0.09868621930171434, 'min_samples_leaf': 0.025025485839611446, 'min_weight_fraction_leaf': 0.012468945600761623, 'max_features': 0.9761726739458492}. Best is trial 161 with value: 0.7752929650004449.[0m
[32m[I 2022-04-13 12:16:42,207][0m Trial 196 finished with value: 0.7716875005394559 and parameters: {'splitter': 'best', 'min_samples_split': 0.09959198354105792, 'min_samples_leaf': 0.018213350449828202, 'min_weight_fraction_leaf': 0.03159172802316659, 'max_features': 0.9785596144342402}. Best is trial 161 with value: 0.7752929650004449.[0m
