[32m[I 2022-04-15 05:48:47,783][0m Trial 495 finished with value: 0.7276117566798206 and parameters: {'loss': 'coxph', 'learning_rate': 0.01088087160025244, 'n_estimators': 427, 'criterion': 'friedman_mse', 'min_samples_split': 4, 'min_samples_leaf': 6, 'min_weight_fraction_leaf': 0.18054445639664288, 'min_impurity_decrease': 0.49071005717725513, 'max_features': 0.8615495156453999, 'subsample': 0.5992077234331992, 'dropout_rate': 0.02073364794384214, 'ccp_alpha': 0.08565537270753773}. Best is trial 481 with value: 0.7722003312994449.[0m
[32m[I 2022-04-15 05:50:07,498][0m Trial 496 finished with value: 0.7727263861886147 and parameters: {'loss': 'coxph', 'learning_rate': 0.006493835919041398, 'n_estimators': 406, 'criterion': 'friedman_mse', 'min_samples_split': 4, 'min_samples_leaf': 6, 'min_weight_fraction_leaf': 0.11996117209763957, 'min_impurity_decrease': 0.5526696221972962, 'max_features': 0.8302354899203377, 'subsample': 0.5705070739748995, 'dropout_rate': 0.0002643426262265991, 'ccp_alpha': 0.003200403598044503}. Best is trial 496 with value: 0.7727263861886147.[0m
[32m[I 2022-04-15 05:51:15,142][0m Trial 497 finished with value: 0.5 and parameters: {'loss': 'coxph', 'learning_rate': 0.005063088286324826, 'n_estimators': 403, 'criterion': 'friedman_mse', 'min_samples_split': 4, 'min_samples_leaf': 6, 'min_weight_fraction_leaf': 0.11730562522805613, 'min_impurity_decrease': 0.5478252602317519, 'max_features': 0.8377711183347807, 'subsample': 0.6225420841332879, 'dropout_rate': 0.0010776107044329665, 'ccp_alpha': 0.2324106863920469}. Best is trial 496 with value: 0.7727263861886147.[0m
[32m[I 2022-04-15 05:52:25,199][0m Trial 498 finished with value: 0.5 and parameters: {'loss': 'coxph', 'learning_rate': 0.006995754880575487, 'n_estimators': 399, 'criterion': 'friedman_mse', 'min_samples_split': 4, 'min_samples_leaf': 7, 'min_weight_fraction_leaf': 0.10388258385142804, 'min_impurity_decrease': 0.5328681557076316, 'max_features': 0.8637417785937092, 'subsample': 0.5927906913385449, 'dropout_rate': 0.0004644032022505587, 'ccp_alpha': 0.37075498086934755}. Best is trial 496 with value: 0.7727263861886147.[0m
[32m[I 2022-04-15 05:53:10,728][0m Trial 499 finished with value: 0.3282191205918289 and parameters: {'loss': 'squared', 'learning_rate': 0.00574693177574775, 'n_estimators': 386, 'criterion': 'friedman_mse', 'min_samples_split': 4, 'min_samples_leaf': 6, 'min_weight_fraction_leaf': 0.12184766273381846, 'min_impurity_decrease': 0.5615168836133175, 'max_features': 0.8289909076169479, 'subsample': 0.5712819630507788, 'dropout_rate': 0.019545128800056717, 'ccp_alpha': 0.16580293718977218}. Best is trial 496 with value: 0.7727263861886147.[0m
[32m[I 2022-04-15 05:54:22,991][0m Trial 500 finished with value: 0.5 and parameters: {'loss': 'coxph', 'learning_rate': 0.006994145241501935, 'n_estimators': 410, 'criterion': 'squared_error', 'min_samples_split': 5, 'min_samples_leaf': 6, 'min_weight_fraction_leaf': 0.12881279561070802, 'min_impurity_decrease': 0.526536636829127, 'max_features': 0.8876009829925612, 'subsample': 0.608409575960269, 'dropout_rate': 0.018485348959834204, 'ccp_alpha': 0.5108729106902905}. Best is trial 496 with value: 0.7727263861886147.[0m
[32m[I 2022-04-15 05:55:42,073][0m Trial 501 finished with value: 0.5 and parameters: {'loss': 'coxph', 'learning_rate': 0.004405476879874649, 'n_estimators': 451, 'criterion': 'friedman_mse', 'min_samples_split': 4, 'min_samples_leaf': 6, 'min_weight_fraction_leaf': 0.14841376609229548, 'min_impurity_decrease': 0.5784833085832529, 'max_features': 0.8538667301188644, 'subsample': 0.5580859225370938, 'dropout_rate': 0.04622029060289279, 'ccp_alpha': 2.7749203222002703}. Best is trial 496 with value: 0.7727263861886147.[0m
[32m[I 2022-04-15 05:57:03,735][0m Trial 502 finished with value: 0.7256604493983078 and parameters: {'loss': 'coxph', 'learning_rate': 0.008675265149006605, 'n_estimators': 439, 'criterion': 'friedman_mse', 'min_samples_split': 4, 'min_samples_leaf': 6, 'min_weight_fraction_leaf': 0.14016796764463424, 'min_impurity_decrease': 0.5587229994767843, 'max_features': 0.8210071283231831, 'subsample': 0.584300008591925, 'dropout_rate': 0.020391050324874614, 'ccp_alpha': 0.08998306062634918}. Best is trial 496 with value: 0.7727263861886147.[0m
[32m[I 2022-04-15 05:58:21,500][0m Trial 503 finished with value: 0.5 and parameters: {'loss': 'coxph', 'learning_rate': 0.011009973963842993, 'n_estimators': 448, 'criterion': 'friedman_mse', 'min_samples_split': 4, 'min_samples_leaf': 6, 'min_weight_fraction_leaf': 0.19109212674522488, 'min_impurity_decrease': 0.5080471722515276, 'max_features': 0.8439004477105891, 'subsample': 0.5694296324415988, 'dropout_rate': 0.06394162730684069, 'ccp_alpha': 1.110594109761988}. Best is trial 496 with value: 0.7727263861886147.[0m
[32m[I 2022-04-15 05:59:36,824][0m Trial 504 finished with value: 0.7321297154195883 and parameters: {'loss': 'coxph', 'learning_rate': 0.003144729571690088, 'n_estimators': 421, 'criterion': 'friedman_mse', 'min_samples_split': 4, 'min_samples_leaf': 6, 'min_weight_fraction_leaf': 0.1320927342793776, 'min_impurity_decrease': 0.6010829568207722, 'max_features': 0.8726622455428434, 'subsample': 0.629546771997368, 'dropout_rate': 0.03913088449413557, 'ccp_alpha': 0.08873608232557464}. Best is trial 496 with value: 0.7727263861886147.[0m
[32m[I 2022-04-15 06:01:02,319][0m Trial 505 finished with value: 0.7685481167016484 and parameters: {'loss': 'coxph', 'learning_rate': 0.0073018750342457904, 'n_estimators': 424, 'criterion': 'friedman_mse', 'min_samples_split': 4, 'min_samples_leaf': 6, 'min_weight_fraction_leaf': 0.1965283659313879, 'min_impurity_decrease': 0.4414073615199199, 'max_features': 0.9086563024467237, 'subsample': 0.6043958019701089, 'dropout_rate': 0.01896541998508499, 'ccp_alpha': 0.005442692904795498}. Best is trial 496 with value: 0.7727263861886147.[0m
[32m[I 2022-04-15 06:02:26,211][0m Trial 506 finished with value: 0.7720580978179982 and parameters: {'loss': 'coxph', 'learning_rate': 0.013770472033755417, 'n_estimators': 416, 'criterion': 'friedman_mse', 'min_samples_split': 4, 'min_samples_leaf': 1, 'min_weight_fraction_leaf': 0.20178277712442194, 'min_impurity_decrease': 0.5529659584495531, 'max_features': 0.9096907892658641, 'subsample': 0.6342689811921444, 'dropout_rate': 0.000906170726005141, 'ccp_alpha': 0.0020785407845258894}. Best is trial 496 with value: 0.7727263861886147.[0m
[32m[I 2022-04-15 06:03:57,218][0m Trial 507 finished with value: 0.5301157883717103 and parameters: {'loss': 'coxph', 'learning_rate': 0.016417365247426895, 'n_estimators': 472, 'criterion': 'friedman_mse', 'min_samples_split': 4, 'min_samples_leaf': 7, 'min_weight_fraction_leaf': 0.20438360092064356, 'min_impurity_decrease': 0.4618103025971577, 'max_features': 0.9106317934401956, 'subsample': 0.6469173120533981, 'dropout_rate': 0.0021128254808317343, 'ccp_alpha': 0.21469577126454054}. Best is trial 496 with value: 0.7727263861886147.[0m
[32m[I 2022-04-15 06:05:12,251][0m Trial 508 finished with value: 0.5 and parameters: {'loss': 'coxph', 'learning_rate': 0.00938132858907475, 'n_estimators': 416, 'criterion': 'friedman_mse', 'min_samples_split': 4, 'min_samples_leaf': 6, 'min_weight_fraction_leaf': 0.2024335913620457, 'min_impurity_decrease': 0.42051646170933515, 'max_features': 0.9064176286101285, 'subsample': 0.650280074479313, 'dropout_rate': 0.0002742280966518233, 'ccp_alpha': 0.28814115727786965}. Best is trial 496 with value: 0.7727263861886147.[0m
[32m[I 2022-04-15 06:06:27,498][0m Trial 509 finished with value: 0.6743624146605087 and parameters: {'loss': 'coxph', 'learning_rate': 0.0145631105100515, 'n_estimators': 421, 'criterion': 'friedman_mse', 'min_samples_split': 4, 'min_samples_leaf': 6, 'min_weight_fraction_leaf': 0.1957552958483581, 'min_impurity_decrease': 0.4423268678807364, 'max_features': 0.8502984086728714, 'subsample': 0.6262829055637391, 'dropout_rate': 0.017426337333928333, 'ccp_alpha': 0.16631376801459202}. Best is trial 496 with value: 0.7727263861886147.[0m
[32m[I 2022-04-15 06:07:51,065][0m Trial 510 finished with value: 0.7185048240025204 and parameters: {'loss': 'coxph', 'learning_rate': 0.020354683136121713, 'n_estimators': 442, 'criterion': 'friedman_mse', 'min_samples_split': 5, 'min_samples_leaf': 6, 'min_weight_fraction_leaf': 0.24232480029358583, 'min_impurity_decrease': 0.49255406954025516, 'max_features': 0.821050048111656, 'subsample': 0.6665323327619106, 'dropout_rate': 0.03112558529243674, 'ccp_alpha': 0.08848147979650732}. Best is trial 496 with value: 0.7727263861886147.[0m
[32m[I 2022-04-15 06:09:03,907][0m Trial 511 finished with value: 0.5 and parameters: {'loss': 'coxph', 'learning_rate': 0.007761220154300796, 'n_estimators': 377, 'criterion': 'absolute_error', 'min_samples_split': 4, 'min_samples_leaf': 2, 'min_weight_fraction_leaf': 0.11572431640172888, 'min_impurity_decrease': 0.5421458684966511, 'max_features': 0.7961015601853106, 'subsample': 0.6402027479035721, 'dropout_rate': 0.0007804427265878863, 'ccp_alpha': 0.16862709735095263}. Best is trial 496 with value: 0.7727263861886147.[0m
[32m[I 2022-04-15 06:10:30,716][0m Trial 512 finished with value: 0.5 and parameters: {'loss': 'coxph', 'learning_rate': 0.013176944321232132, 'n_estimators': 477, 'criterion': 'friedman_mse', 'min_samples_split': 4, 'min_samples_leaf': 1, 'min_weight_fraction_leaf': 0.20423846150634992, 'min_impurity_decrease': 0.5624868206886379, 'max_features': 0.8826703711166228, 'subsample': 0.607601133222739, 'dropout_rate': 0.02193416087290284, 'ccp_alpha': 2.980071671734107}. Best is trial 496 with value: 0.7727263861886147.[0m
[32m[I 2022-04-15 06:11:46,298][0m Trial 513 finished with value: 0.768407510459133 and parameters: {'loss': 'coxph', 'learning_rate': 0.009648107639072721, 'n_estimators': 407, 'criterion': 'friedman_mse', 'min_samples_split': 4, 'min_samples_leaf': 1, 'min_weight_fraction_leaf': 0.19064323462737248, 'min_impurity_decrease': 0.533425362321087, 'max_features': 0.8691211387601923, 'subsample': 0.6211468786641494, 'dropout_rate': 0.00041964269730201953, 'ccp_alpha': 0.006314029274340541}. Best is trial 496 with value: 0.7727263861886147.[0m
[32m[I 2022-04-15 06:12:58,026][0m Trial 514 finished with value: 0.7660418934409915 and parameters: {'loss': 'coxph', 'learning_rate': 0.009495787267229093, 'n_estimators': 391, 'criterion': 'friedman_mse', 'min_samples_split': 4, 'min_samples_leaf': 6, 'min_weight_fraction_leaf': 0.1898399946143988, 'min_impurity_decrease': 0.5244277337789747, 'max_features': 0.9088299206256559, 'subsample': 0.6571231509565024, 'dropout_rate': 0.03855290403224153, 'ccp_alpha': 0.0023946647575115794}. Best is trial 496 with value: 0.7727263861886147.[0m
[32m[I 2022-04-15 06:14:13,826][0m Trial 515 finished with value: 0.726936885770517 and parameters: {'loss': 'coxph', 'learning_rate': 0.006958607102368473, 'n_estimators': 442, 'criterion': 'friedman_mse', 'min_samples_split': 4, 'min_samples_leaf': 1, 'min_weight_fraction_leaf': 0.18926774372498126, 'min_impurity_decrease': 0.38383484563109227, 'max_features': 0.8795326553853581, 'subsample': 0.632115676185188, 'dropout_rate': 0.0018059097544244546, 'ccp_alpha': 0.09354862367196497}. Best is trial 496 with value: 0.7727263861886147.[0m
[32m[I 2022-04-15 06:15:19,996][0m Trial 516 finished with value: 0.5 and parameters: {'loss': 'coxph', 'learning_rate': 0.010569379833218219, 'n_estimators': 413, 'criterion': 'friedman_mse', 'min_samples_split': 4, 'min_samples_leaf': 6, 'min_weight_fraction_leaf': 0.19862598802001769, 'min_impurity_decrease': 0.5403607685915675, 'max_features': 0.8680001903930559, 'subsample': 0.6261398262035831, 'dropout_rate': 0.020802138992784974, 'ccp_alpha': 0.25478022003455253}. Best is trial 496 with value: 0.7727263861886147.[0m
[32m[I 2022-04-15 06:15:59,158][0m Trial 517 finished with value: 0.25892132593440975 and parameters: {'loss': 'squared', 'learning_rate': 0.01355204407060296, 'n_estimators': 370, 'criterion': 'friedman_mse', 'min_samples_split': 4, 'min_samples_leaf': 1, 'min_weight_fraction_leaf': 0.18963533695492832, 'min_impurity_decrease': 0.5040327981169519, 'max_features': 0.8345023019499677, 'subsample': 0.6134227949409886, 'dropout_rate': 0.043601452908288374, 'ccp_alpha': 0.09228165216489848}. Best is trial 496 with value: 0.7727263861886147.[0m
[32m[I 2022-04-15 06:17:10,751][0m Trial 518 finished with value: 0.6743624146605087 and parameters: {'loss': 'coxph', 'learning_rate': 0.008227681113452156, 'n_estimators': 418, 'criterion': 'friedman_mse', 'min_samples_split': 4, 'min_samples_leaf': 1, 'min_weight_fraction_leaf': 0.17346134919728545, 'min_impurity_decrease': 0.5507328723185392, 'max_features': 0.9176678963021568, 'subsample': 0.6167566661284135, 'dropout_rate': 6.241403491683006e-05, 'ccp_alpha': 0.17459088632500205}. Best is trial 496 with value: 0.7727263861886147.[0m
[32m[I 2022-04-15 06:18:18,136][0m Trial 519 finished with value: 0.7665282886816398 and parameters: {'loss': 'coxph', 'learning_rate': 0.005257424026497354, 'n_estimators': 388, 'criterion': 'friedman_mse', 'min_samples_split': 4, 'min_samples_leaf': 7, 'min_weight_fraction_leaf': 0.18036331926536286, 'min_impurity_decrease': 0.584351449270511, 'max_features': 0.8962911352236207, 'subsample': 0.6450372785036405, 'dropout_rate': 0.03164844391038399, 'ccp_alpha': 0.00489030963479718}. Best is trial 496 with value: 0.7727263861886147.[0m
[32m[I 2022-04-15 06:19:15,725][0m Trial 520 finished with value: 0.5 and parameters: {'loss': 'coxph', 'learning_rate': 0.00452786378256473, 'n_estimators': 388, 'criterion': 'friedman_mse', 'min_samples_split': 4, 'min_samples_leaf': 1, 'min_weight_fraction_leaf': 0.1984390973011065, 'min_impurity_decrease': 0.5801466189230267, 'max_features': 0.9226613344882144, 'subsample': 0.6356120084998496, 'dropout_rate': 0.04652208661500095, 'ccp_alpha': 0.3573922138931733}. Best is trial 496 with value: 0.7727263861886147.[0m
[32m[I 2022-04-15 06:20:20,999][0m Trial 521 finished with value: 0.7256554509320269 and parameters: {'loss': 'coxph', 'learning_rate': 0.005542424177904659, 'n_estimators': 400, 'criterion': 'friedman_mse', 'min_samples_split': 4, 'min_samples_leaf': 8, 'min_weight_fraction_leaf': 0.1834484422616798, 'min_impurity_decrease': 0.4011400799293718, 'max_features': 0.8984322237556033, 'subsample': 0.6670488631088454, 'dropout_rate': 7.889623435110684e-05, 'ccp_alpha': 0.09768601163704503}. Best is trial 496 with value: 0.7727263861886147.[0m
[32m[I 2022-04-15 06:21:38,371][0m Trial 522 finished with value: 0.6353792978522599 and parameters: {'loss': 'coxph', 'learning_rate': 0.0023407548789778345, 'n_estimators': 458, 'criterion': 'friedman_mse', 'min_samples_split': 4, 'min_samples_leaf': 1, 'min_weight_fraction_leaf': 0.2064434716779245, 'min_impurity_decrease': 0.5679731883488311, 'max_features': 0.9303707995200484, 'subsample': 0.6419250476192995, 'dropout_rate': 0.07073486895330468, 'ccp_alpha': 0.19272943762871453}. Best is trial 496 with value: 0.7727263861886147.[0m
[32m[I 2022-04-15 06:22:48,032][0m Trial 523 finished with value: 0.5 and parameters: {'loss': 'coxph', 'learning_rate': 0.006182411489278514, 'n_estimators': 429, 'criterion': 'squared_error', 'min_samples_split': 6, 'min_samples_leaf': 1, 'min_weight_fraction_leaf': 0.18592006152904453, 'min_impurity_decrease': 0.5897008462872495, 'max_features': 0.8188859343818378, 'subsample': 0.6537795507886122, 'dropout_rate': 0.032614422511373156, 'ccp_alpha': 0.09548287174493574}. Best is trial 496 with value: 0.7727263861886147.[0m
[32m[I 2022-04-15 06:24:22,451][0m Trial 524 finished with value: 0.5 and parameters: {'loss': 'coxph', 'learning_rate': 0.004033041501966012, 'n_estimators': 499, 'criterion': 'friedman_mse', 'min_samples_split': 4, 'min_samples_leaf': 1, 'min_weight_fraction_leaf': 0.17774555207252793, 'min_impurity_decrease': 0.5356287443789973, 'max_features': 0.7953043774862252, 'subsample': 0.5921402602384918, 'dropout_rate': 0.020313338231687645, 'ccp_alpha': 0.2825301300873279}. Best is trial 496 with value: 0.7727263861886147.[0m
[32m[I 2022-04-15 06:25:34,207][0m Trial 525 finished with value: 0.7682218022604006 and parameters: {'loss': 'coxph', 'learning_rate': 0.008150698212376434, 'n_estimators': 410, 'criterion': 'friedman_mse', 'min_samples_split': 4, 'min_samples_leaf': 8, 'min_weight_fraction_leaf': 0.19442416791473227, 'min_impurity_decrease': 0.6061897888248657, 'max_features': 0.890819416203131, 'subsample': 0.6728711843237467, 'dropout_rate': 0.05371181784970658, 'ccp_alpha': 0.006823174844295644}. Best is trial 496 with value: 0.7727263861886147.[0m
[32m[I 2022-04-15 06:26:37,462][0m Trial 526 finished with value: 0.7690479090352588 and parameters: {'loss': 'coxph', 'learning_rate': 0.00938977650679561, 'n_estimators': 373, 'criterion': 'friedman_mse', 'min_samples_split': 4, 'min_samples_leaf': 9, 'min_weight_fraction_leaf': 0.19703652697216634, 'min_impurity_decrease': 0.5147744644724299, 'max_features': 0.8530016792776446, 'subsample': 0.6845252892710023, 'dropout_rate': 0.06595036878744759, 'ccp_alpha': 0.005302647058727415}. Best is trial 496 with value: 0.7727263861886147.[0m
[32m[I 2022-04-15 06:27:35,184][0m Trial 527 finished with value: 0.7623616926320272 and parameters: {'loss': 'coxph', 'learning_rate': 0.007553115187666604, 'n_estimators': 369, 'criterion': 'friedman_mse', 'min_samples_split': 4, 'min_samples_leaf': 9, 'min_weight_fraction_leaf': 0.2107288430466884, 'min_impurity_decrease': 0.6034459788345528, 'max_features': 0.8520930980413369, 'subsample': 0.6803947204988218, 'dropout_rate': 0.07356597825561417, 'ccp_alpha': 0.0013844788222108267}. Best is trial 496 with value: 0.7727263861886147.[0m
[32m[I 2022-04-15 06:28:36,084][0m Trial 528 finished with value: 0.6743624146605087 and parameters: {'loss': 'coxph', 'learning_rate': 0.00949307262817715, 'n_estimators': 406, 'criterion': 'friedman_mse', 'min_samples_split': 4, 'min_samples_leaf': 10, 'min_weight_fraction_leaf': 0.19521068147777665, 'min_impurity_decrease': 0.47401971960367323, 'max_features': 0.8797980209094093, 'subsample': 0.6627314689655432, 'dropout_rate': 0.06476489822579831, 'ccp_alpha': 0.17059551674986492}. Best is trial 496 with value: 0.7727263861886147.[0m
[32m[I 2022-04-15 06:29:37,396][0m Trial 529 finished with value: 0.7254189549959955 and parameters: {'loss': 'coxph', 'learning_rate': 0.00818150978092123, 'n_estimators': 384, 'criterion': 'friedman_mse', 'min_samples_split': 4, 'min_samples_leaf': 8, 'min_weight_fraction_leaf': 0.21109981747627224, 'min_impurity_decrease': 0.5617109266753659, 'max_features': 0.8437650452121044, 'subsample': 0.7044022142924218, 'dropout_rate': 0.05606720212414912, 'ccp_alpha': 0.09532917965415559}. Best is trial 496 with value: 0.7727263861886147.[0m
[32m[I 2022-04-15 06:30:42,161][0m Trial 530 finished with value: 0.5 and parameters: {'loss': 'coxph', 'learning_rate': 0.010069761016597225, 'n_estimators': 414, 'criterion': 'friedman_mse', 'min_samples_split': 4, 'min_samples_leaf': 1, 'min_weight_fraction_leaf': 0.20118101235953284, 'min_impurity_decrease': 0.6165879914078553, 'max_features': 0.8629324034816602, 'subsample': 0.7188220489255512, 'dropout_rate': 0.07319065295149674, 'ccp_alpha': 0.42707963227895973}. Best is trial 496 with value: 0.7727263861886147.[0m
[32m[I 2022-04-15 06:31:46,087][0m Trial 531 finished with value: 0.6743624146605087 and parameters: {'loss': 'coxph', 'learning_rate': 0.02147194393045715, 'n_estimators': 403, 'criterion': 'friedman_mse', 'min_samples_split': 4, 'min_samples_leaf': 10, 'min_weight_fraction_leaf': 0.19806908775223975, 'min_impurity_decrease': 0.6003660492253398, 'max_features': 0.8929170981833663, 'subsample': 0.7424108239602096, 'dropout_rate': 0.05558752731130221, 'ccp_alpha': 0.18157265797770378}. Best is trial 496 with value: 0.7727263861886147.[0m
[32m[I 2022-04-15 06:32:37,671][0m Trial 532 finished with value: 0.7730183877040865 and parameters: {'loss': 'coxph', 'learning_rate': 0.0071724852500123365, 'n_estimators': 381, 'criterion': 'friedman_mse', 'min_samples_split': 4, 'min_samples_leaf': 1, 'min_weight_fraction_leaf': 0.11397138773330624, 'min_impurity_decrease': 0.5512447903079549, 'max_features': 0.8352370367682236, 'subsample': 0.6797923806618066, 'dropout_rate': 0.4218648982326181, 'ccp_alpha': 0.0023042594784833926}. Best is trial 532 with value: 0.7730183877040865.[0m
[32m[I 2022-04-15 06:33:13,837][0m Trial 533 finished with value: 0.5 and parameters: {'loss': 'coxph', 'learning_rate': 0.006493313749819277, 'n_estimators': 356, 'criterion': 'friedman_mse', 'min_samples_split': 4, 'min_samples_leaf': 9, 'min_weight_fraction_leaf': 0.10728577501596567, 'min_impurity_decrease': 0.5352732755439684, 'max_features': 0.830299329509365, 'subsample': 0.7006384634608555, 'dropout_rate': 0.5681605760892028, 'ccp_alpha': 0.27111245579722726}. Best is trial 532 with value: 0.7730183877040865.[0m
[32m[I 2022-04-15 06:34:08,341][0m Trial 534 finished with value: 0.6868312218783537 and parameters: {'loss': 'coxph', 'learning_rate': 0.00759582285342613, 'n_estimators': 366, 'criterion': 'friedman_mse', 'min_samples_split': 4, 'min_samples_leaf': 1, 'min_weight_fraction_leaf': 0.08337978692885202, 'min_impurity_decrease': 0.5518331710064609, 'max_features': 0.8378666014635944, 'subsample': 0.6478087011677931, 'dropout_rate': 0.04785938640007918, 'ccp_alpha': 0.1218253259255698}. Best is trial 532 with value: 0.7730183877040865.[0m
