[32m[I 2022-04-13 11:53:16,895][0m Trial 404 finished with value: 0.8862902675002976 and parameters: {'splitter': 'best', 'min_samples_split': 0.10097237256710356, 'min_samples_leaf': 0.0329263148759833, 'min_weight_fraction_leaf': 0.03588756785568782, 'max_features': 0.9811078435760884}. Best is trial 201 with value: 0.8881217621713932.[0m
/media/san2_ssd/data/Workdir/survival/utils.py:305: RuntimeWarning: invalid value encountered in true_divide
  pdfs = np.gradient(1-survs,axis=1)/norms
/media/san2_ssd/data/Workdir/survival/utils.py:305: RuntimeWarning: invalid value encountered in true_divide
  pdfs = np.gradient(1-survs,axis=1)/norms
/media/san2_ssd/data/Workdir/survival/utils.py:305: RuntimeWarning: invalid value encountered in true_divide
  pdfs = np.gradient(1-survs,axis=1)/norms
[32m[I 2022-04-13 11:53:18,955][0m Trial 405 finished with value: 0.8828998746997995 and parameters: {'splitter': 'best', 'min_samples_split': 0.12787264939053136, 'min_samples_leaf': 0.0545576178299914, 'min_weight_fraction_leaf': 0.023096179270883664, 'max_features': 0.937782113788218}. Best is trial 201 with value: 0.8881217621713932.[0m
/media/san2_ssd/data/Workdir/survival/utils.py:305: RuntimeWarning: invalid value encountered in true_divide
  pdfs = np.gradient(1-survs,axis=1)/norms
/media/san2_ssd/data/Workdir/survival/utils.py:305: RuntimeWarning: invalid value encountered in true_divide
  pdfs = np.gradient(1-survs,axis=1)/norms
/media/san2_ssd/data/Workdir/survival/utils.py:305: RuntimeWarning: invalid value encountered in true_divide
  pdfs = np.gradient(1-survs,axis=1)/norms
[32m[I 2022-04-13 11:53:22,351][0m Trial 406 finished with value: 0.8838729624563919 and parameters: {'splitter': 'best', 'min_samples_split': 0.11065148778922444, 'min_samples_leaf': 0.012607274838442505, 'min_weight_fraction_leaf': 0.04667771137356825, 'max_features': 0.966762440313884}. Best is trial 201 with value: 0.8881217621713932.[0m
/media/san2_ssd/data/Workdir/survival/utils.py:305: RuntimeWarning: invalid value encountered in true_divide
  pdfs = np.gradient(1-survs,axis=1)/norms
/media/san2_ssd/data/Workdir/survival/utils.py:305: RuntimeWarning: invalid value encountered in true_divide
  pdfs = np.gradient(1-survs,axis=1)/norms
/media/san2_ssd/data/Workdir/survival/utils.py:305: RuntimeWarning: invalid value encountered in true_divide
  pdfs = np.gradient(1-survs,axis=1)/norms
/media/san2_ssd/data/Workdir/survival/utils.py:305: RuntimeWarning: invalid value encountered in true_divide
  pdfs = np.gradient(1-survs,axis=1)/norms
/media/san2_ssd/data/Workdir/survival/utils.py:305: RuntimeWarning: invalid value encountered in true_divide
  pdfs = np.gradient(1-survs,axis=1)/norms
[32m[I 2022-04-13 11:53:24,122][0m Trial 407 finished with value: 0.8849498319473883 and parameters: {'splitter': 'best', 'min_samples_split': 0.09148064462493352, 'min_samples_leaf': 0.023589476531019653, 'min_weight_fraction_leaf': 0.011296562135105133, 'max_features': 0.9818311427518542}. Best is trial 201 with value: 0.8881217621713932.[0m
[32m[I 2022-04-13 11:53:24,471][0m Trial 408 finished with value: 0.7786809299803908 and parameters: {'splitter': 'random', 'min_samples_split': 0.11904003130966598, 'min_samples_leaf': 0.03740677014967824, 'min_weight_fraction_leaf': 0.03052473053430026, 'max_features': 0.9996025481185086}. Best is trial 201 with value: 0.8881217621713932.[0m
[32m[I 2022-04-13 11:53:26,353][0m Trial 409 finished with value: 0.7087829833014309 and parameters: {'splitter': 'best', 'min_samples_split': 0.10523449383375688, 'min_samples_leaf': 0.008943847287598321, 'min_weight_fraction_leaf': 0.3098367812163606, 'max_features': 0.9486570314061473}. Best is trial 201 with value: 0.8881217621713932.[0m
/media/san2_ssd/data/Workdir/survival/utils.py:305: RuntimeWarning: invalid value encountered in true_divide
  pdfs = np.gradient(1-survs,axis=1)/norms
[32m[I 2022-04-13 11:53:28,655][0m Trial 410 finished with value: 0.8828112740301327 and parameters: {'splitter': 'best', 'min_samples_split': 0.13357410449012935, 'min_samples_leaf': 0.04781891751758667, 'min_weight_fraction_leaf': 0.03999835008869021, 'max_features': 0.9682415613016746}. Best is trial 201 with value: 0.8881217621713932.[0m
[32m[I 2022-04-13 11:53:30,798][0m Trial 411 finished with value: 0.5798841569358725 and parameters: {'splitter': 'best', 'min_samples_split': 0.14715304735393608, 'min_samples_leaf': 0.028169448239787523, 'min_weight_fraction_leaf': 0.15088984873047911, 'max_features': 0.9998213120047535}. Best is trial 201 with value: 0.8881217621713932.[0m
/media/san2_ssd/data/Workdir/survival/utils.py:305: RuntimeWarning: invalid value encountered in true_divide
  pdfs = np.gradient(1-survs,axis=1)/norms
/media/san2_ssd/data/Workdir/survival/utils.py:305: RuntimeWarning: invalid value encountered in true_divide
  pdfs = np.gradient(1-survs,axis=1)/norms
/media/san2_ssd/data/Workdir/survival/utils.py:305: RuntimeWarning: invalid value encountered in true_divide
  pdfs = np.gradient(1-survs,axis=1)/norms
[32m[I 2022-04-13 11:53:32,032][0m Trial 412 finished with value: 0.7585894821021286 and parameters: {'splitter': 'best', 'min_samples_split': 0.12175720183932005, 'min_samples_leaf': 0.019055074419735536, 'min_weight_fraction_leaf': 0.020549174078351627, 'max_features': 0.35681015372442854}. Best is trial 201 with value: 0.8881217621713932.[0m
[32m[I 2022-04-13 11:53:34,287][0m Trial 413 finished with value: 0.5753568176162753 and parameters: {'splitter': 'best', 'min_samples_split': 0.11088000216698919, 'min_samples_leaf': 0.03607881240711213, 'min_weight_fraction_leaf': 0.12757208720106641, 'max_features': 0.9249295373764193}. Best is trial 201 with value: 0.8881217621713932.[0m
/media/san2_ssd/data/Workdir/survival/utils.py:305: RuntimeWarning: invalid value encountered in true_divide
  pdfs = np.gradient(1-survs,axis=1)/norms
/media/san2_ssd/data/Workdir/survival/utils.py:305: RuntimeWarning: invalid value encountered in true_divide
  pdfs = np.gradient(1-survs,axis=1)/norms
/media/san2_ssd/data/Workdir/survival/utils.py:305: RuntimeWarning: invalid value encountered in true_divide
  pdfs = np.gradient(1-survs,axis=1)/norms
[32m[I 2022-04-13 11:53:36,961][0m Trial 414 finished with value: 0.8854690605133584 and parameters: {'splitter': 'best', 'min_samples_split': 0.07763780378634291, 'min_samples_leaf': 0.008893900009216905, 'min_weight_fraction_leaf': 0.05160521551257598, 'max_features': 0.980398956169441}. Best is trial 201 with value: 0.8881217621713932.[0m
/media/san2_ssd/data/Workdir/survival/utils.py:305: RuntimeWarning: invalid value encountered in true_divide
  pdfs = np.gradient(1-survs,axis=1)/norms
/media/san2_ssd/data/Workdir/survival/utils.py:305: RuntimeWarning: invalid value encountered in true_divide
  pdfs = np.gradient(1-survs,axis=1)/norms
/media/san2_ssd/data/Workdir/survival/utils.py:305: RuntimeWarning: invalid value encountered in true_divide
  pdfs = np.gradient(1-survs,axis=1)/norms
/media/san2_ssd/data/Workdir/survival/utils.py:305: RuntimeWarning: invalid value encountered in true_divide
  pdfs = np.gradient(1-survs,axis=1)/norms
[32m[I 2022-04-13 11:53:39,205][0m Trial 415 finished with value: 0.8828542538805959 and parameters: {'splitter': 'best', 'min_samples_split': 0.09785252489196347, 'min_samples_leaf': 0.020729211724070173, 'min_weight_fraction_leaf': 0.030478055914628564, 'max_features': 0.9556021135852474}. Best is trial 201 with value: 0.8881217621713932.[0m
[32m[I 2022-04-13 11:53:40,383][0m Trial 416 finished with value: 0.6800202662816828 and parameters: {'splitter': 'best', 'min_samples_split': 0.2326678575425332, 'min_samples_leaf': 0.029053996262828244, 'min_weight_fraction_leaf': 0.004413895257457997, 'max_features': 0.9798761908163319}. Best is trial 201 with value: 0.8881217621713932.[0m
[32m[I 2022-04-13 11:53:42,905][0m Trial 417 finished with value: 0.8803010018852703 and parameters: {'splitter': 'best', 'min_samples_split': 0.1280706113618018, 'min_samples_leaf': 0.001211884223644627, 'min_weight_fraction_leaf': 0.07499684564365391, 'max_features': 0.964433396540229}. Best is trial 201 with value: 0.8881217621713932.[0m
/media/san2_ssd/data/Workdir/survival/utils.py:305: RuntimeWarning: invalid value encountered in true_divide
  pdfs = np.gradient(1-survs,axis=1)/norms
/media/san2_ssd/data/Workdir/survival/utils.py:305: RuntimeWarning: invalid value encountered in true_divide
  pdfs = np.gradient(1-survs,axis=1)/norms
/media/san2_ssd/data/Workdir/survival/utils.py:305: RuntimeWarning: invalid value encountered in true_divide
  pdfs = np.gradient(1-survs,axis=1)/norms
/media/san2_ssd/data/Workdir/survival/utils.py:305: RuntimeWarning: invalid value encountered in true_divide
  pdfs = np.gradient(1-survs,axis=1)/norms
[32m[I 2022-04-13 11:53:44,387][0m Trial 418 finished with value: 0.8875783504178576 and parameters: {'splitter': 'best', 'min_samples_split': 0.11307327099888631, 'min_samples_leaf': 0.045378093707948555, 'min_weight_fraction_leaf': 0.04160197163474419, 'max_features': 0.9826981656985789}. Best is trial 201 with value: 0.8881217621713932.[0m
/media/san2_ssd/data/Workdir/survival/utils.py:305: RuntimeWarning: invalid value encountered in true_divide
  pdfs = np.gradient(1-survs,axis=1)/norms
[32m[I 2022-04-13 11:53:47,458][0m Trial 419 finished with value: 0.8825556074771066 and parameters: {'splitter': 'best', 'min_samples_split': 0.11873655139801567, 'min_samples_leaf': 0.06148359783511585, 'min_weight_fraction_leaf': 0.06079022591858306, 'max_features': 0.9443256424683485}. Best is trial 201 with value: 0.8881217621713932.[0m
/media/san2_ssd/data/Workdir/survival/utils.py:305: RuntimeWarning: invalid value encountered in true_divide
  pdfs = np.gradient(1-survs,axis=1)/norms
/media/san2_ssd/data/Workdir/survival/utils.py:305: RuntimeWarning: invalid value encountered in true_divide
  pdfs = np.gradient(1-survs,axis=1)/norms
[32m[I 2022-04-13 11:53:49,535][0m Trial 420 finished with value: 0.8869463096179887 and parameters: {'splitter': 'best', 'min_samples_split': 0.1387685374345115, 'min_samples_leaf': 0.047753736034825064, 'min_weight_fraction_leaf': 0.045467272411538535, 'max_features': 0.9996210786740062}. Best is trial 201 with value: 0.8881217621713932.[0m
/media/san2_ssd/data/Workdir/survival/utils.py:305: RuntimeWarning: invalid value encountered in true_divide
  pdfs = np.gradient(1-survs,axis=1)/norms
[32m[I 2022-04-13 11:53:51,733][0m Trial 421 finished with value: 0.8835526022431452 and parameters: {'splitter': 'best', 'min_samples_split': 0.13959575495615098, 'min_samples_leaf': 0.05453014723103464, 'min_weight_fraction_leaf': 0.04748011101057037, 'max_features': 0.9653165950159629}. Best is trial 201 with value: 0.8881217621713932.[0m
/media/san2_ssd/data/Workdir/survival/utils.py:305: RuntimeWarning: invalid value encountered in true_divide
  pdfs = np.gradient(1-survs,axis=1)/norms
/media/san2_ssd/data/Workdir/survival/utils.py:305: RuntimeWarning: invalid value encountered in true_divide
  pdfs = np.gradient(1-survs,axis=1)/norms
[32m[I 2022-04-13 11:53:53,643][0m Trial 422 finished with value: 0.8857747639504467 and parameters: {'splitter': 'best', 'min_samples_split': 0.11521730101522103, 'min_samples_leaf': 0.046965297697201765, 'min_weight_fraction_leaf': 0.059793139486396245, 'max_features': 0.9803484119116738}. Best is trial 201 with value: 0.8881217621713932.[0m
/media/san2_ssd/data/Workdir/survival/utils.py:305: RuntimeWarning: invalid value encountered in true_divide
  pdfs = np.gradient(1-survs,axis=1)/norms
[32m[I 2022-04-13 11:53:55,177][0m Trial 423 finished with value: 0.8836220461892508 and parameters: {'splitter': 'best', 'min_samples_split': 0.08683533780143948, 'min_samples_leaf': 0.06457012081965931, 'min_weight_fraction_leaf': 0.0455715347665877, 'max_features': 0.9290575625965356}. Best is trial 201 with value: 0.8881217621713932.[0m
[32m[I 2022-04-13 11:53:56,183][0m Trial 424 finished with value: 0.8834604123687291 and parameters: {'splitter': 'best', 'min_samples_split': 0.09937786191430803, 'min_samples_leaf': 0.041123929440870385, 'min_weight_fraction_leaf': 0.07019277509033404, 'max_features': 0.9992575477299735}. Best is trial 201 with value: 0.8881217621713932.[0m
/media/san2_ssd/data/Workdir/survival/utils.py:305: RuntimeWarning: invalid value encountered in true_divide
  pdfs = np.gradient(1-survs,axis=1)/norms
/media/san2_ssd/data/Workdir/survival/utils.py:305: RuntimeWarning: invalid value encountered in true_divide
  pdfs = np.gradient(1-survs,axis=1)/norms
/media/san2_ssd/data/Workdir/survival/utils.py:305: RuntimeWarning: invalid value encountered in true_divide
  pdfs = np.gradient(1-survs,axis=1)/norms
[32m[I 2022-04-13 11:53:57,281][0m Trial 425 finished with value: 0.8817975531533916 and parameters: {'splitter': 'best', 'min_samples_split': 0.1260560208347259, 'min_samples_leaf': 0.04635375588738408, 'min_weight_fraction_leaf': 0.00023792732057799706, 'max_features': 0.9567953219762624}. Best is trial 201 with value: 0.8881217621713932.[0m
/media/san2_ssd/data/Workdir/survival/utils.py:305: RuntimeWarning: invalid value encountered in true_divide
  pdfs = np.gradient(1-survs,axis=1)/norms
/media/san2_ssd/data/Workdir/survival/utils.py:305: RuntimeWarning: invalid value encountered in true_divide
  pdfs = np.gradient(1-survs,axis=1)/norms
/media/san2_ssd/data/Workdir/survival/utils.py:305: RuntimeWarning: invalid value encountered in true_divide
  pdfs = np.gradient(1-survs,axis=1)/norms
/media/san2_ssd/data/Workdir/survival/utils.py:305: RuntimeWarning: invalid value encountered in true_divide
  pdfs = np.gradient(1-survs,axis=1)/norms
[32m[I 2022-04-13 11:53:58,713][0m Trial 426 finished with value: 0.8868366603286402 and parameters: {'splitter': 'best', 'min_samples_split': 0.11095324999572737, 'min_samples_leaf': 0.018220542068446907, 'min_weight_fraction_leaf': 0.020745464148831654, 'max_features': 0.9819887752920716}. Best is trial 201 with value: 0.8881217621713932.[0m
/media/san2_ssd/data/Workdir/survival/utils.py:305: RuntimeWarning: invalid value encountered in true_divide
  pdfs = np.gradient(1-survs,axis=1)/norms
/media/san2_ssd/data/Workdir/survival/utils.py:305: RuntimeWarning: invalid value encountered in true_divide
  pdfs = np.gradient(1-survs,axis=1)/norms
/media/san2_ssd/data/Workdir/survival/utils.py:305: RuntimeWarning: invalid value encountered in true_divide
  pdfs = np.gradient(1-survs,axis=1)/norms
/media/san2_ssd/data/Workdir/survival/utils.py:305: RuntimeWarning: invalid value encountered in true_divide
  pdfs = np.gradient(1-survs,axis=1)/norms
[32m[I 2022-04-13 11:54:00,305][0m Trial 427 finished with value: 0.8845751195696178 and parameters: {'splitter': 'best', 'min_samples_split': 0.12162088664160456, 'min_samples_leaf': 0.012883165865855382, 'min_weight_fraction_leaf': 0.04037373772431864, 'max_features': 0.9476462359617202}. Best is trial 201 with value: 0.8881217621713932.[0m
[32m[I 2022-04-13 11:54:00,537][0m Trial 428 finished with value: 0.661426770361806 and parameters: {'splitter': 'random', 'min_samples_split': 0.27500725725592734, 'min_samples_leaf': 0.07045194533046538, 'min_weight_fraction_leaf': 0.055644666583536034, 'max_features': 0.9808560564202193}. Best is trial 201 with value: 0.8881217621713932.[0m
/media/san2_ssd/data/Workdir/survival/utils.py:305: RuntimeWarning: invalid value encountered in true_divide
  pdfs = np.gradient(1-survs,axis=1)/norms
/media/san2_ssd/data/Workdir/survival/utils.py:305: RuntimeWarning: invalid value encountered in true_divide
  pdfs = np.gradient(1-survs,axis=1)/norms
/media/san2_ssd/data/Workdir/survival/utils.py:305: RuntimeWarning: invalid value encountered in true_divide
  pdfs = np.gradient(1-survs,axis=1)/norms
/media/san2_ssd/data/Workdir/survival/utils.py:305: RuntimeWarning: invalid value encountered in true_divide
  pdfs = np.gradient(1-survs,axis=1)/norms
[32m[I 2022-04-13 11:54:02,685][0m Trial 429 finished with value: 0.8864259123601693 and parameters: {'splitter': 'best', 'min_samples_split': 0.10505215964234343, 'min_samples_leaf': 0.03929569756850652, 'min_weight_fraction_leaf': 0.01575040836942385, 'max_features': 0.9995262315123611}. Best is trial 201 with value: 0.8881217621713932.[0m
[32m[I 2022-04-13 11:54:04,097][0m Trial 430 finished with value: 0.7078258174461948 and parameters: {'splitter': 'best', 'min_samples_split': 0.13923630489374567, 'min_samples_leaf': 0.0012843669810962115, 'min_weight_fraction_leaf': 0.28928569925393127, 'max_features': 0.9652281275344048}. Best is trial 201 with value: 0.8881217621713932.[0m
[32m[I 2022-04-13 11:54:05,201][0m Trial 431 finished with value: 0.5586022031865912 and parameters: {'splitter': 'best', 'min_samples_split': 0.09142280108780819, 'min_samples_leaf': 0.2984317605533799, 'min_weight_fraction_leaf': 0.026811222557694976, 'max_features': 0.9814045165826453}. Best is trial 201 with value: 0.8881217621713932.[0m
/media/san2_ssd/data/Workdir/survival/utils.py:305: RuntimeWarning: invalid value encountered in true_divide
  pdfs = np.gradient(1-survs,axis=1)/norms
/media/san2_ssd/data/Workdir/survival/utils.py:305: RuntimeWarning: invalid value encountered in true_divide
  pdfs = np.gradient(1-survs,axis=1)/norms
[32m[I 2022-04-13 11:54:07,052][0m Trial 432 finished with value: 0.8816440874480632 and parameters: {'splitter': 'best', 'min_samples_split': 0.11347399642821022, 'min_samples_leaf': 0.05402410617302775, 'min_weight_fraction_leaf': 0.040864918450730925, 'max_features': 0.9194561907698395}. Best is trial 201 with value: 0.8881217621713932.[0m
[32m[I 2022-04-13 11:54:07,954][0m Trial 433 finished with value: 0.5552955865615024 and parameters: {'splitter': 'best', 'min_samples_split': 0.12885760273969188, 'min_samples_leaf': 0.21031650992581957, 'min_weight_fraction_leaf': 0.03229581727961986, 'max_features': 0.947434666072134}. Best is trial 201 with value: 0.8881217621713932.[0m
/media/san2_ssd/data/Workdir/survival/utils.py:305: RuntimeWarning: invalid value encountered in true_divide
  pdfs = np.gradient(1-survs,axis=1)/norms
[32m[I 2022-04-13 11:54:09,041][0m Trial 434 finished with value: 0.7852146126705976 and parameters: {'splitter': 'best', 'min_samples_split': 0.15066164507472643, 'min_samples_leaf': 0.030380660710668472, 'min_weight_fraction_leaf': 0.05192787062504445, 'max_features': 0.9999703928605416}. Best is trial 201 with value: 0.8881217621713932.[0m
/media/san2_ssd/data/Workdir/survival/utils.py:305: RuntimeWarning: invalid value encountered in true_divide
  pdfs = np.gradient(1-survs,axis=1)/norms
/media/san2_ssd/data/Workdir/survival/utils.py:305: RuntimeWarning: invalid value encountered in true_divide
  pdfs = np.gradient(1-survs,axis=1)/norms
/media/san2_ssd/data/Workdir/survival/utils.py:305: RuntimeWarning: invalid value encountered in true_divide
  pdfs = np.gradient(1-survs,axis=1)/norms
/media/san2_ssd/data/Workdir/survival/utils.py:305: RuntimeWarning: invalid value encountered in true_divide
  pdfs = np.gradient(1-survs,axis=1)/norms
[32m[I 2022-04-13 11:54:11,089][0m Trial 435 finished with value: 0.8828163902855553 and parameters: {'splitter': 'best', 'min_samples_split': 0.09740317326617658, 'min_samples_leaf': 0.01945012300166432, 'min_weight_fraction_leaf': 0.013729472823995089, 'max_features': 0.9649276056095644}. Best is trial 201 with value: 0.8881217621713932.[0m
/media/san2_ssd/data/Workdir/survival/utils.py:305: RuntimeWarning: invalid value encountered in true_divide
  pdfs = np.gradient(1-survs,axis=1)/norms
/media/san2_ssd/data/Workdir/survival/utils.py:305: RuntimeWarning: invalid value encountered in true_divide
  pdfs = np.gradient(1-survs,axis=1)/norms
/media/san2_ssd/data/Workdir/survival/utils.py:305: RuntimeWarning: invalid value encountered in true_divide
  pdfs = np.gradient(1-survs,axis=1)/norms
[32m[I 2022-04-13 11:54:12,987][0m Trial 436 finished with value: 0.8866387948119542 and parameters: {'splitter': 'best', 'min_samples_split': 0.12051787650485321, 'min_samples_leaf': 0.024626925910658168, 'min_weight_fraction_leaf': 0.02485870489999716, 'max_features': 0.9823467117220986}. Best is trial 201 with value: 0.8881217621713932.[0m
/media/san2_ssd/data/Workdir/survival/utils.py:305: RuntimeWarning: invalid value encountered in true_divide
  pdfs = np.gradient(1-survs,axis=1)/norms
/media/san2_ssd/data/Workdir/survival/utils.py:305: RuntimeWarning: invalid value encountered in true_divide
  pdfs = np.gradient(1-survs,axis=1)/norms
/media/san2_ssd/data/Workdir/survival/utils.py:305: RuntimeWarning: invalid value encountered in true_divide
  pdfs = np.gradient(1-survs,axis=1)/norms
/media/san2_ssd/data/Workdir/survival/utils.py:305: RuntimeWarning: invalid value encountered in true_divide
  pdfs = np.gradient(1-survs,axis=1)/norms
[32m[I 2022-04-13 11:54:16,215][0m Trial 437 finished with value: 0.8844113978431694 and parameters: {'splitter': 'best', 'min_samples_split': 0.10785708084519682, 'min_samples_leaf': 0.011236423017193183, 'min_weight_fraction_leaf': 0.03864509698204197, 'max_features': 0.9637548927182634}. Best is trial 201 with value: 0.8881217621713932.[0m
/media/san2_ssd/data/Workdir/survival/utils.py:305: RuntimeWarning: invalid value encountered in true_divide
  pdfs = np.gradient(1-survs,axis=1)/norms
/media/san2_ssd/data/Workdir/survival/utils.py:305: RuntimeWarning: invalid value encountered in true_divide
  pdfs = np.gradient(1-survs,axis=1)/norms
