[32m[I 2022-04-13 12:00:21,665][0m Trial 321 finished with value: 0.7725250366491174 and parameters: {'alpha': 1.3336453623189355, 'ties': 'efron'}. Best is trial 126 with value: 0.7727034345528856.[0m
[32m[I 2022-04-13 12:00:25,580][0m Trial 322 finished with value: 0.7725997887515539 and parameters: {'alpha': 1.081869872836273, 'ties': 'efron'}. Best is trial 126 with value: 0.7727034345528856.[0m
[32m[I 2022-04-13 12:00:29,540][0m Trial 323 finished with value: 0.7725861885982617 and parameters: {'alpha': 0.9955266553539244, 'ties': 'efron'}. Best is trial 126 with value: 0.7727034345528856.[0m
[32m[I 2022-04-13 12:00:32,280][0m Trial 324 finished with value: 0.7726249663342732 and parameters: {'alpha': 0.8768082427908095, 'ties': 'breslow'}. Best is trial 126 with value: 0.7727034345528856.[0m
[32m[I 2022-04-13 12:00:35,445][0m Trial 325 finished with value: 0.7716628058807439 and parameters: {'alpha': 2.878286726225501, 'ties': 'efron'}. Best is trial 126 with value: 0.7727034345528856.[0m
[32m[I 2022-04-13 12:00:39,921][0m Trial 326 finished with value: 0.7725844365506428 and parameters: {'alpha': 1.1948164655925486, 'ties': 'efron'}. Best is trial 126 with value: 0.7727034345528856.[0m
[32m[I 2022-04-13 12:00:43,331][0m Trial 327 finished with value: 0.7724816398715726 and parameters: {'alpha': 1.4043313034506193, 'ties': 'efron'}. Best is trial 126 with value: 0.7727034345528856.[0m
[32m[I 2022-04-13 12:00:46,898][0m Trial 328 finished with value: 0.7726102786981079 and parameters: {'alpha': 1.128231096077892, 'ties': 'efron'}. Best is trial 126 with value: 0.7727034345528856.[0m
[32m[I 2022-04-13 12:00:49,983][0m Trial 329 finished with value: 0.772628830816292 and parameters: {'alpha': 1.2891544857634953, 'ties': 'efron'}. Best is trial 126 with value: 0.7727034345528856.[0m
[32m[I 2022-04-13 12:00:54,884][0m Trial 330 finished with value: 0.7724824370926315 and parameters: {'alpha': 1.5547025389168898, 'ties': 'efron'}. Best is trial 126 with value: 0.7727034345528856.[0m
[32m[I 2022-04-13 12:00:58,411][0m Trial 331 finished with value: 0.772668248106903 and parameters: {'alpha': 1.2274370341915555, 'ties': 'efron'}. Best is trial 126 with value: 0.7727034345528856.[0m
[32m[I 2022-04-13 12:01:02,595][0m Trial 332 finished with value: 0.7725275976362116 and parameters: {'alpha': 1.3554588941431227, 'ties': 'efron'}. Best is trial 126 with value: 0.7727034345528856.[0m
[32m[I 2022-04-13 12:01:06,281][0m Trial 333 finished with value: 0.7726342918338693 and parameters: {'alpha': 1.1524342154071088, 'ties': 'efron'}. Best is trial 126 with value: 0.7727034345528856.[0m
[32m[I 2022-04-13 12:01:10,191][0m Trial 334 finished with value: 0.7725535295286134 and parameters: {'alpha': 1.030118583738233, 'ties': 'efron'}. Best is trial 126 with value: 0.7727034345528856.[0m
[32m[I 2022-04-13 12:01:13,289][0m Trial 335 finished with value: 0.7724529651216285 and parameters: {'alpha': 1.4654089842032914, 'ties': 'efron'}. Best is trial 126 with value: 0.7727034345528856.[0m
[32m[I 2022-04-13 12:01:16,736][0m Trial 336 finished with value: 0.7726628233083153 and parameters: {'alpha': 1.241718424410589, 'ties': 'efron'}. Best is trial 126 with value: 0.7727034345528856.[0m
[32m[I 2022-04-13 12:01:20,216][0m Trial 337 finished with value: 0.772640805868172 and parameters: {'alpha': 0.9225534974211462, 'ties': 'efron'}. Best is trial 126 with value: 0.7727034345528856.[0m
[32m[I 2022-04-13 12:01:23,842][0m Trial 338 finished with value: 0.7725194465944851 and parameters: {'alpha': 1.3328646844380654, 'ties': 'efron'}. Best is trial 126 with value: 0.7727034345528856.[0m
[32m[I 2022-04-13 12:01:26,918][0m Trial 339 finished with value: 0.7725601184156641 and parameters: {'alpha': 1.110931101650842, 'ties': 'efron'}. Best is trial 126 with value: 0.7727034345528856.[0m
[32m[I 2022-04-13 12:01:31,243][0m Trial 340 finished with value: 0.7723928791148797 and parameters: {'alpha': 1.6717137233639727, 'ties': 'efron'}. Best is trial 126 with value: 0.7727034345528856.[0m
[32m[I 2022-04-13 12:01:36,315][0m Trial 341 finished with value: 0.772678046581848 and parameters: {'alpha': 1.21646934494292, 'ties': 'efron'}. Best is trial 126 with value: 0.7727034345528856.[0m
[32m[I 2022-04-13 12:01:40,132][0m Trial 342 finished with value: 0.7725780760274393 and parameters: {'alpha': 1.1722588228935058, 'ties': 'efron'}. Best is trial 126 with value: 0.7727034345528856.[0m
[32m[I 2022-04-13 12:01:44,009][0m Trial 343 finished with value: 0.772607149758422 and parameters: {'alpha': 1.0190222426649627, 'ties': 'efron'}. Best is trial 126 with value: 0.7727034345528856.[0m
[32m[I 2022-04-13 12:01:48,477][0m Trial 344 finished with value: 0.77245090085391 and parameters: {'alpha': 1.4197660032457984, 'ties': 'breslow'}. Best is trial 126 with value: 0.7727034345528856.[0m
[32m[I 2022-04-13 12:01:52,114][0m Trial 345 finished with value: 0.7726352733459347 and parameters: {'alpha': 1.2855678626835993, 'ties': 'efron'}. Best is trial 126 with value: 0.7727034345528856.[0m
[32m[I 2022-04-13 12:01:55,783][0m Trial 346 finished with value: 0.7725951623586641 and parameters: {'alpha': 1.084250849603625, 'ties': 'efron'}. Best is trial 126 with value: 0.7727034345528856.[0m
[32m[I 2022-04-13 12:01:59,372][0m Trial 347 finished with value: 0.7725936919446862 and parameters: {'alpha': 1.1859147755959834, 'ties': 'efron'}. Best is trial 126 with value: 0.7727034345528856.[0m
[32m[I 2022-04-13 12:02:03,579][0m Trial 348 finished with value: 0.772589941354151 and parameters: {'alpha': 1.3019192773488268, 'ties': 'efron'}. Best is trial 126 with value: 0.7727034345528856.[0m
[32m[I 2022-04-13 12:02:07,770][0m Trial 349 finished with value: 0.7726358948807311 and parameters: {'alpha': 1.209239844225438, 'ties': 'efron'}. Best is trial 126 with value: 0.7727034345528856.[0m
[32m[I 2022-04-13 12:02:11,476][0m Trial 350 finished with value: 0.7724434537817488 and parameters: {'alpha': 1.45113051281774, 'ties': 'efron'}. Best is trial 126 with value: 0.7727034345528856.[0m
[32m[I 2022-04-13 12:02:14,750][0m Trial 351 finished with value: 0.7726390074650553 and parameters: {'alpha': 0.9642836169760951, 'ties': 'efron'}. Best is trial 126 with value: 0.7727034345528856.[0m
[32m[I 2022-04-13 12:02:19,284][0m Trial 352 finished with value: 0.7725653560019609 and parameters: {'alpha': 1.0949374575747404, 'ties': 'efron'}. Best is trial 126 with value: 0.7727034345528856.[0m
[32m[I 2022-04-13 12:02:22,614][0m Trial 353 finished with value: 0.7725255478310734 and parameters: {'alpha': 1.3216745720424803, 'ties': 'efron'}. Best is trial 126 with value: 0.7727034345528856.[0m
[32m[I 2022-04-13 12:02:26,435][0m Trial 354 finished with value: 0.7726358948807311 and parameters: {'alpha': 1.2089056586339242, 'ties': 'efron'}. Best is trial 126 with value: 0.7727034345528856.[0m
[32m[I 2022-04-13 12:02:29,203][0m Trial 355 finished with value: 0.7724637127400793 and parameters: {'alpha': 1.3874653871706188, 'ties': 'efron'}. Best is trial 126 with value: 0.7727034345528856.[0m
[32m[I 2022-04-13 12:02:32,597][0m Trial 356 finished with value: 0.7725901864488831 and parameters: {'alpha': 1.116516605684694, 'ties': 'efron'}. Best is trial 126 with value: 0.7727034345528856.[0m
[32m[I 2022-04-13 12:02:36,064][0m Trial 357 finished with value: 0.7726387423524219 and parameters: {'alpha': 1.2553291885137035, 'ties': 'efron'}. Best is trial 126 with value: 0.7727034345528856.[0m
[32m[I 2022-04-13 12:02:40,247][0m Trial 358 finished with value: 0.77107064330373 and parameters: {'alpha': 3.1274752080538955, 'ties': 'efron'}. Best is trial 126 with value: 0.7727034345528856.[0m
[32m[I 2022-04-13 12:02:42,651][0m Trial 359 finished with value: 0.772456629769809 and parameters: {'alpha': 1.5028415423113854, 'ties': 'efron'}. Best is trial 126 with value: 0.7727034345528856.[0m
[32m[I 2022-04-13 12:02:47,928][0m Trial 360 finished with value: 0.772607149758422 and parameters: {'alpha': 1.0170639496715057, 'ties': 'efron'}. Best is trial 126 with value: 0.7727034345528856.[0m
[32m[I 2022-04-13 12:02:51,146][0m Trial 361 finished with value: 0.7725410440813648 and parameters: {'alpha': 1.3586074668993815, 'ties': 'efron'}. Best is trial 126 with value: 0.7727034345528856.[0m
[32m[I 2022-04-13 12:02:54,577][0m Trial 362 finished with value: 0.7726462548459118 and parameters: {'alpha': 1.1422676566038785, 'ties': 'efron'}. Best is trial 126 with value: 0.7727034345528856.[0m
[32m[I 2022-04-13 12:02:56,965][0m Trial 363 finished with value: 0.7726601672839672 and parameters: {'alpha': 1.2685907763764475, 'ties': 'breslow'}. Best is trial 126 with value: 0.7727034345528856.[0m
[32m[I 2022-04-13 12:02:59,985][0m Trial 364 finished with value: 0.7725897300845255 and parameters: {'alpha': 1.1966256379323579, 'ties': 'efron'}. Best is trial 126 with value: 0.7727034345528856.[0m
[32m[I 2022-04-13 12:03:03,327][0m Trial 365 finished with value: 0.7726173686499508 and parameters: {'alpha': 0.8546817789640138, 'ties': 'efron'}. Best is trial 126 with value: 0.7727034345528856.[0m
[32m[I 2022-04-13 12:03:06,667][0m Trial 366 finished with value: 0.77252187129712 and parameters: {'alpha': 1.042805430573479, 'ties': 'efron'}. Best is trial 126 with value: 0.7727034345528856.[0m
[32m[I 2022-04-13 12:03:11,163][0m Trial 367 finished with value: 0.7725230865258137 and parameters: {'alpha': 1.3643423346198762, 'ties': 'efron'}. Best is trial 126 with value: 0.7727034345528856.[0m
[32m[I 2022-04-13 12:03:14,099][0m Trial 368 finished with value: 0.7724900094495958 and parameters: {'alpha': 1.5760438543628845, 'ties': 'efron'}. Best is trial 126 with value: 0.7727034345528856.[0m
[32m[I 2022-04-13 12:03:17,535][0m Trial 369 finished with value: 0.7726377792370872 and parameters: {'alpha': 1.1446751165550644, 'ties': 'efron'}. Best is trial 126 with value: 0.7727034345528856.[0m
[32m[I 2022-04-13 12:03:19,359][0m Trial 370 finished with value: 0.772635713519416 and parameters: {'alpha': 1.2744623634104206, 'ties': 'efron'}. Best is trial 126 with value: 0.7727034345528856.[0m
[32m[I 2022-04-13 12:03:21,866][0m Trial 371 finished with value: 0.7719234450674681 and parameters: {'alpha': 2.4975425181858433, 'ties': 'efron'}. Best is trial 126 with value: 0.7727034345528856.[0m
[32m[I 2022-04-13 12:03:25,251][0m Trial 372 finished with value: 0.7726491777672339 and parameters: {'alpha': 0.9167342596516779, 'ties': 'efron'}. Best is trial 126 with value: 0.7727034345528856.[0m
[32m[I 2022-04-13 12:03:27,733][0m Trial 373 finished with value: 0.772441194974693 and parameters: {'alpha': 1.4373239274226162, 'ties': 'efron'}. Best is trial 126 with value: 0.7727034345528856.[0m
[32m[I 2022-04-13 12:03:31,974][0m Trial 374 finished with value: 0.7726632417534969 and parameters: {'alpha': 1.2291613136772357, 'ties': 'efron'}. Best is trial 126 with value: 0.7727034345528856.[0m
[32m[I 2022-04-13 12:03:36,454][0m Trial 375 finished with value: 0.7725861404350735 and parameters: {'alpha': 1.089343078163294, 'ties': 'efron'}. Best is trial 126 with value: 0.7727034345528856.[0m
[32m[I 2022-04-13 12:03:39,561][0m Trial 376 finished with value: 0.7725294875585549 and parameters: {'alpha': 1.3415913608393122, 'ties': 'efron'}. Best is trial 126 with value: 0.7727034345528856.[0m
[32m[I 2022-04-13 12:03:42,947][0m Trial 377 finished with value: 0.7725765023549904 and parameters: {'alpha': 1.1621495894081197, 'ties': 'efron'}. Best is trial 126 with value: 0.7727034345528856.[0m
[32m[I 2022-04-13 12:03:46,972][0m Trial 378 finished with value: 0.7726084439202738 and parameters: {'alpha': 0.9981622156905054, 'ties': 'efron'}. Best is trial 126 with value: 0.7727034345528856.[0m
[32m[I 2022-04-13 12:03:51,047][0m Trial 379 finished with value: 0.7726391035857147 and parameters: {'alpha': 1.2776997331853006, 'ties': 'efron'}. Best is trial 126 with value: 0.7727034345528856.[0m
[32m[I 2022-04-13 12:03:54,368][0m Trial 380 finished with value: 0.7716874867055179 and parameters: {'alpha': 0.26501170236691185, 'ties': 'efron'}. Best is trial 126 with value: 0.7727034345528856.[0m
[32m[I 2022-04-13 12:03:57,227][0m Trial 381 finished with value: 0.7724631167283917 and parameters: {'alpha': 1.432149757364927, 'ties': 'efron'}. Best is trial 126 with value: 0.7727034345528856.[0m
[32m[I 2022-04-13 12:04:01,212][0m Trial 382 finished with value: 0.7726402855708456 and parameters: {'alpha': 1.207390617600555, 'ties': 'efron'}. Best is trial 126 with value: 0.7727034345528856.[0m
[32m[I 2022-04-13 12:04:04,911][0m Trial 383 finished with value: 0.7725653560019609 and parameters: {'alpha': 1.097675425884464, 'ties': 'efron'}. Best is trial 126 with value: 0.7727034345528856.[0m
[32m[I 2022-04-13 12:04:09,271][0m Trial 384 finished with value: 0.772615712579839 and parameters: {'alpha': 1.3072762356233625, 'ties': 'breslow'}. Best is trial 126 with value: 0.7727034345528856.[0m
[32m[I 2022-04-13 12:04:13,187][0m Trial 385 finished with value: 0.7724677740341326 and parameters: {'alpha': 1.5178343929536644, 'ties': 'efron'}. Best is trial 126 with value: 0.7727034345528856.[0m
[32m[I 2022-04-13 12:04:17,802][0m Trial 386 finished with value: 0.7725999815725169 and parameters: {'alpha': 1.1867077497841219, 'ties': 'efron'}. Best is trial 126 with value: 0.7727034345528856.[0m
[32m[I 2022-04-13 12:04:22,241][0m Trial 387 finished with value: 0.7725670736316623 and parameters: {'alpha': 1.054798545696221, 'ties': 'efron'}. Best is trial 126 with value: 0.7727034345528856.[0m
[32m[I 2022-04-13 12:04:26,585][0m Trial 388 finished with value: 0.7725250725332411 and parameters: {'alpha': 1.3728928509885947, 'ties': 'efron'}. Best is trial 126 with value: 0.7727034345528856.[0m
[32m[I 2022-04-13 12:04:31,283][0m Trial 389 finished with value: 0.7726445816655405 and parameters: {'alpha': 1.2576350276705446, 'ties': 'efron'}. Best is trial 126 with value: 0.7727034345528856.[0m
[32m[I 2022-04-13 12:04:35,757][0m Trial 390 finished with value: 0.7726279458046508 and parameters: {'alpha': 0.9432981356805827, 'ties': 'efron'}. Best is trial 126 with value: 0.7727034345528856.[0m
[32m[I 2022-04-13 12:04:39,748][0m Trial 391 finished with value: 0.7725246211851167 and parameters: {'alpha': 0.7698881212960165, 'ties': 'efron'}. Best is trial 126 with value: 0.7727034345528856.[0m
[32m[I 2022-04-13 12:04:44,691][0m Trial 392 finished with value: 0.7726202515064294 and parameters: {'alpha': 1.1327463522606833, 'ties': 'efron'}. Best is trial 126 with value: 0.7727034345528856.[0m
[32m[I 2022-04-13 12:04:47,682][0m Trial 393 finished with value: 0.772615435112072 and parameters: {'alpha': 1.2946005763897952, 'ties': 'efron'}. Best is trial 126 with value: 0.7727034345528856.[0m
[32m[I 2022-04-13 12:04:52,097][0m Trial 394 finished with value: 0.7724729417644065 and parameters: {'alpha': 1.4075915264401972, 'ties': 'efron'}. Best is trial 126 with value: 0.7727034345528856.[0m
[32m[I 2022-04-13 12:04:54,428][0m Trial 395 finished with value: 0.7725161269293901 and parameters: {'alpha': 1.0403423761778483, 'ties': 'efron'}. Best is trial 126 with value: 0.7727034345528856.[0m
[32m[I 2022-04-13 12:04:56,044][0m Trial 396 finished with value: 0.7727034345528856 and parameters: {'alpha': 1.213352463684807, 'ties': 'efron'}. Best is trial 126 with value: 0.7727034345528856.[0m
[32m[I 2022-04-13 12:04:59,056][0m Trial 397 finished with value: 0.7725765023549904 and parameters: {'alpha': 1.1624122290232168, 'ties': 'efron'}. Best is trial 126 with value: 0.7727034345528856.[0m
[32m[I 2022-04-13 12:05:03,171][0m Trial 398 finished with value: 0.7725345506833812 and parameters: {'alpha': 1.3192965900206248, 'ties': 'efron'}. Best is trial 126 with value: 0.7727034345528856.[0m
[32m[I 2022-04-13 12:05:06,866][0m Trial 399 finished with value: 0.7726154375395305 and parameters: {'alpha': 1.200332339623299, 'ties': 'efron'}. Best is trial 126 with value: 0.7727034345528856.[0m
[32m[I 2022-04-13 12:05:09,951][0m Trial 400 finished with value: 0.7725653560019609 and parameters: {'alpha': 1.0986222196946516, 'ties': 'efron'}. Best is trial 126 with value: 0.7727034345528856.[0m
[32m[I 2022-04-13 12:05:14,514][0m Trial 401 finished with value: 0.7724485816867717 and parameters: {'alpha': 1.4906056552941582, 'ties': 'efron'}. Best is trial 126 with value: 0.7727034345528856.[0m
[32m[I 2022-04-13 12:05:18,242][0m Trial 402 finished with value: 0.7724719752257656 and parameters: {'alpha': 1.9120097165569434, 'ties': 'efron'}. Best is trial 126 with value: 0.7727034345528856.[0m
[32m[I 2022-04-13 12:05:22,441][0m Trial 403 finished with value: 0.7726459146555377 and parameters: {'alpha': 0.9441460814560887, 'ties': 'breslow'}. Best is trial 126 with value: 0.7727034345528856.[0m
[32m[I 2022-04-13 12:05:27,021][0m Trial 404 finished with value: 0.7718755719105325 and parameters: {'alpha': 2.667105130110581, 'ties': 'efron'}. Best is trial 126 with value: 0.7727034345528856.[0m
[32m[I 2022-04-13 12:05:30,610][0m Trial 405 finished with value: 0.7725370854701864 and parameters: {'alpha': 1.3573695841534559, 'ties': 'efron'}. Best is trial 126 with value: 0.7727034345528856.[0m
[32m[I 2022-04-13 12:05:32,976][0m Trial 406 finished with value: 0.772675441298717 and parameters: {'alpha': 1.25034383381635, 'ties': 'efron'}. Best is trial 126 with value: 0.7727034345528856.[0m
[32m[I 2022-04-13 12:05:37,431][0m Trial 407 finished with value: 0.7726383013542184 and parameters: {'alpha': 1.2659026264265922, 'ties': 'efron'}. Best is trial 126 with value: 0.7727034345528856.[0m
[32m[I 2022-04-13 12:05:41,265][0m Trial 408 finished with value: 0.7724026776707593 and parameters: {'alpha': 1.644532537731654, 'ties': 'efron'}. Best is trial 126 with value: 0.7727034345528856.[0m
[32m[I 2022-04-13 12:05:45,423][0m Trial 409 finished with value: 0.7725957891770039 and parameters: {'alpha': 1.0726748801515196, 'ties': 'efron'}. Best is trial 126 with value: 0.7727034345528856.[0m
[32m[I 2022-04-13 12:05:49,349][0m Trial 410 finished with value: 0.7724539450443666 and parameters: {'alpha': 1.3842635371730898, 'ties': 'efron'}. Best is trial 126 with value: 0.7727034345528856.[0m
[32m[I 2022-04-13 12:05:53,324][0m Trial 411 finished with value: 0.7725793211322313 and parameters: {'alpha': 1.1790044072493198, 'ties': 'efron'}. Best is trial 126 with value: 0.7727034345528856.[0m
[32m[I 2022-04-13 12:05:57,306][0m Trial 412 finished with value: 0.7726432019414645 and parameters: {'alpha': 1.264143453026674, 'ties': 'efron'}. Best is trial 126 with value: 0.7727034345528856.[0m
[32m[I 2022-04-13 12:06:01,377][0m Trial 413 finished with value: 0.77260319849651 and parameters: {'alpha': 1.0079785178851535, 'ties': 'efron'}. Best is trial 126 with value: 0.7727034345528856.[0m
[32m[I 2022-04-13 12:06:03,265][0m Trial 414 finished with value: 0.7724705821002954 and parameters: {'alpha': 1.4815860447652227, 'ties': 'efron'}. Best is trial 126 with value: 0.7727034345528856.[0m
[32m[I 2022-04-13 12:06:05,649][0m Trial 415 finished with value: 0.7726342918338693 and parameters: {'alpha': 1.1535209273869258, 'ties': 'efron'}. Best is trial 126 with value: 0.7727034345528856.[0m
[32m[I 2022-04-13 12:06:10,240][0m Trial 416 finished with value: 0.7725250366491174 and parameters: {'alpha': 1.3344465417865614, 'ties': 'efron'}. Best is trial 126 with value: 0.7727034345528856.[0m
[32m[I 2022-04-13 12:06:15,128][0m Trial 417 finished with value: 0.772668248106903 and parameters: {'alpha': 1.2275688513102911, 'ties': 'efron'}. Best is trial 126 with value: 0.7727034345528856.[0m
[32m[I 2022-04-13 12:06:19,881][0m Trial 418 finished with value: 0.7725901864488831 and parameters: {'alpha': 1.115913545758904, 'ties': 'efron'}. Best is trial 126 with value: 0.7727034345528856.[0m
[32m[I 2022-04-13 12:06:24,972][0m Trial 419 finished with value: 0.7724678032999279 and parameters: {'alpha': 1.4116733202630867, 'ties': 'efron'}. Best is trial 126 with value: 0.7727034345528856.[0m
[32m[I 2022-04-13 12:06:29,841][0m Trial 420 finished with value: 0.7726566068006091 and parameters: {'alpha': 1.2384675162219976, 'ties': 'efron'}. Best is trial 126 with value: 0.7727034345528856.[0m
[32m[I 2022-04-13 12:06:33,468][0m Trial 421 finished with value: 0.7725294743739427 and parameters: {'alpha': 1.0293521412994606, 'ties': 'efron'}. Best is trial 126 with value: 0.7727034345528856.[0m
[32m[I 2022-04-13 12:06:36,777][0m Trial 422 finished with value: 0.7726032746577532 and parameters: {'alpha': 1.315461108456302, 'ties': 'breslow'}. Best is trial 126 with value: 0.7727034345528856.[0m
[32m[I 2022-04-13 12:06:39,972][0m Trial 423 finished with value: 0.7724900185130206 and parameters: {'alpha': 1.5871472940614628, 'ties': 'efron'}. Best is trial 126 with value: 0.7727034345528856.[0m
[32m[I 2022-04-13 12:06:44,260][0m Trial 424 finished with value: 0.7725897300845255 and parameters: {'alpha': 1.1959645954614393, 'ties': 'efron'}. Best is trial 126 with value: 0.7727034345528856.[0m
[32m[I 2022-04-13 12:06:46,789][0m Trial 425 finished with value: 0.7726043536685505 and parameters: {'alpha': 0.8964073953124237, 'ties': 'efron'}. Best is trial 126 with value: 0.7727034345528856.[0m
[32m[I 2022-04-13 12:06:50,232][0m Trial 426 finished with value: 0.7726264797312512 and parameters: {'alpha': 1.1357452994728805, 'ties': 'efron'}. Best is trial 126 with value: 0.7727034345528856.[0m
[32m[I 2022-04-13 12:06:54,331][0m Trial 427 finished with value: 0.7724160724675887 and parameters: {'alpha': 1.439832312044971, 'ties': 'efron'}. Best is trial 126 with value: 0.7727034345528856.[0m
