[32m[I 2022-04-15 00:38:38,978][0m Trial 890 finished with value: 0.7780230150896426 and parameters: {'loss': 'coxph', 'learning_rate': 1.7268997465254648e-06, 'n_estimators': 513, 'criterion': 'friedman_mse', 'min_samples_split': 10, 'min_samples_leaf': 1, 'min_weight_fraction_leaf': 0.23314686494023434, 'min_impurity_decrease': 0.5379689981328829, 'max_features': 0.6839842093351376, 'subsample': 0.036959824391140025, 'dropout_rate': 0.7192166150012121, 'ccp_alpha': 0.22753385932406317}. Best is trial 877 with value: 0.7849837723237536.[0m
[32m[I 2022-04-15 00:39:44,537][0m Trial 891 finished with value: 0.25 and parameters: {'loss': 'coxph', 'learning_rate': 1.393413509319815e-06, 'n_estimators': 521, 'criterion': 'friedman_mse', 'min_samples_split': 10, 'min_samples_leaf': 1, 'min_weight_fraction_leaf': 0.23468928027904928, 'min_impurity_decrease': 0.5058479274842336, 'max_features': 0.6953536502044759, 'subsample': 0.0010191149450945076, 'dropout_rate': 0.7395207624123352, 'ccp_alpha': 0.07500553623029046}. Best is trial 877 with value: 0.7849837723237536.[0m
[32m[I 2022-04-15 00:40:52,449][0m Trial 892 finished with value: 0.25 and parameters: {'loss': 'coxph', 'learning_rate': 2.125418226584507e-06, 'n_estimators': 546, 'criterion': 'squared_error', 'min_samples_split': 10, 'min_samples_leaf': 1, 'min_weight_fraction_leaf': 0.21508995929766386, 'min_impurity_decrease': 0.47162092691578295, 'max_features': 0.622723356199858, 'subsample': 0.04144985010396517, 'dropout_rate': 0.7606350799532521, 'ccp_alpha': 1.227308651540778}. Best is trial 877 with value: 0.7849837723237536.[0m
[32m[I 2022-04-15 00:42:15,366][0m Trial 893 finished with value: 0.7844461724712224 and parameters: {'loss': 'coxph', 'learning_rate': 2.7579853861477745e-06, 'n_estimators': 569, 'criterion': 'friedman_mse', 'min_samples_split': 10, 'min_samples_leaf': 1, 'min_weight_fraction_leaf': 0.22460518457732484, 'min_impurity_decrease': 0.48340340486377786, 'max_features': 0.586632542460763, 'subsample': 0.02359240948975165, 'dropout_rate': 0.7138899028191326, 'ccp_alpha': 0.0067506319205795084}. Best is trial 877 with value: 0.7849837723237536.[0m
[32m[I 2022-04-15 00:43:31,287][0m Trial 894 finished with value: 0.46505789418585514 and parameters: {'loss': 'coxph', 'learning_rate': 2.6309770503797705e-06, 'n_estimators': 570, 'criterion': 'absolute_error', 'min_samples_split': 10, 'min_samples_leaf': 1, 'min_weight_fraction_leaf': 0.22436631262086904, 'min_impurity_decrease': 0.5238393551353492, 'max_features': 0.64266431327104, 'subsample': 0.02146690779599411, 'dropout_rate': 0.7099114984446628, 'ccp_alpha': 0.17423997095856614}. Best is trial 877 with value: 0.7849837723237536.[0m
[32m[I 2022-04-15 00:44:33,327][0m Trial 895 finished with value: 0.25 and parameters: {'loss': 'coxph', 'learning_rate': 1.62332228694178e-06, 'n_estimators': 496, 'criterion': 'friedman_mse', 'min_samples_split': 10, 'min_samples_leaf': 1, 'min_weight_fraction_leaf': 0.1999792715245793, 'min_impurity_decrease': 0.4884226512577477, 'max_features': 0.6102767268324664, 'subsample': 0.001864029451091407, 'dropout_rate': 0.7308708805861505, 'ccp_alpha': 0.00488675095452501}. Best is trial 877 with value: 0.7849837723237536.[0m
[32m[I 2022-04-15 00:45:36,489][0m Trial 896 finished with value: 0.7669506936125098 and parameters: {'loss': 'coxph', 'learning_rate': 1.931181191936941e-06, 'n_estimators': 529, 'criterion': 'friedman_mse', 'min_samples_split': 10, 'min_samples_leaf': 1, 'min_weight_fraction_leaf': 0.21576920394692872, 'min_impurity_decrease': 0.5091566568702671, 'max_features': 0.6574831942652107, 'subsample': 0.033123948005040316, 'dropout_rate': 0.7882992659782706, 'ccp_alpha': 0.32486463557194}. Best is trial 877 with value: 0.7849837723237536.[0m
[32m[I 2022-04-15 00:47:03,058][0m Trial 897 finished with value: 0.7819077202637447 and parameters: {'loss': 'coxph', 'learning_rate': 2.4370984206052543e-06, 'n_estimators': 582, 'criterion': 'friedman_mse', 'min_samples_split': 10, 'min_samples_leaf': 1, 'min_weight_fraction_leaf': 0.23083598825430313, 'min_impurity_decrease': 0.4721025464342184, 'max_features': 0.6710906142649481, 'subsample': 0.021729126964109106, 'dropout_rate': 0.7101400775934418, 'ccp_alpha': 0.16330290167820066}. Best is trial 877 with value: 0.7849837723237536.[0m
[32m[I 2022-04-15 00:47:34,473][0m Trial 898 finished with value: -0.3729789852724946 and parameters: {'loss': 'squared', 'learning_rate': 1.2548039479212147e-06, 'n_estimators': 564, 'criterion': 'friedman_mse', 'min_samples_split': 10, 'min_samples_leaf': 1, 'min_weight_fraction_leaf': 0.24086152923298026, 'min_impurity_decrease': 0.4893427965632886, 'max_features': 0.5829280160374127, 'subsample': 0.018730816417633658, 'dropout_rate': 0.7504589564522505, 'ccp_alpha': 0.004153003549254854}. Best is trial 877 with value: 0.7849837723237536.[0m
[32m[I 2022-04-15 00:48:55,563][0m Trial 899 finished with value: 0.7833213955824428 and parameters: {'loss': 'coxph', 'learning_rate': 1.6297736453136314e-06, 'n_estimators': 584, 'criterion': 'friedman_mse', 'min_samples_split': 10, 'min_samples_leaf': 1, 'min_weight_fraction_leaf': 0.19135058503436145, 'min_impurity_decrease': 0.5541494459258638, 'max_features': 0.7012183062111954, 'subsample': 0.040007855491025424, 'dropout_rate': 0.7159226484450268, 'ccp_alpha': 0.08971336688597083}. Best is trial 877 with value: 0.7849837723237536.[0m
[32m[I 2022-04-15 00:50:12,041][0m Trial 900 finished with value: 0.7721138493797977 and parameters: {'loss': 'coxph', 'learning_rate': 1.335953601056054e-06, 'n_estimators': 579, 'criterion': 'friedman_mse', 'min_samples_split': 10, 'min_samples_leaf': 1, 'min_weight_fraction_leaf': 0.17466096060109584, 'min_impurity_decrease': 0.4678455344576982, 'max_features': 0.6997335532405038, 'subsample': 0.045208249240043005, 'dropout_rate': 0.7094735990874098, 'ccp_alpha': 0.24873244457190044}. Best is trial 877 with value: 0.7849837723237536.[0m
[32m[I 2022-04-15 00:51:20,962][0m Trial 901 finished with value: 0.7799685074528393 and parameters: {'loss': 'coxph', 'learning_rate': 1.642324891781301e-06, 'n_estimators': 540, 'criterion': 'friedman_mse', 'min_samples_split': 10, 'min_samples_leaf': 1, 'min_weight_fraction_leaf': 0.20279598975712979, 'min_impurity_decrease': 0.575366090992866, 'max_features': 0.5944866069182566, 'subsample': 0.05134385587791637, 'dropout_rate': 0.7277798794692619, 'ccp_alpha': 0.15776999053499022}. Best is trial 877 with value: 0.7849837723237536.[0m
[32m[I 2022-04-15 00:52:17,451][0m Trial 902 finished with value: 0.7838582309126789 and parameters: {'loss': 'coxph', 'learning_rate': 1.0497291458326292e-06, 'n_estimators': 448, 'criterion': 'friedman_mse', 'min_samples_split': 10, 'min_samples_leaf': 1, 'min_weight_fraction_leaf': 0.2242287743040411, 'min_impurity_decrease': 0.5696678818902963, 'max_features': 0.6438846211528378, 'subsample': 0.03220712242355767, 'dropout_rate': 0.7112521673931845, 'ccp_alpha': 0.002717707466919599}. Best is trial 877 with value: 0.7849837723237536.[0m
[32m[I 2022-04-15 00:53:17,297][0m Trial 903 finished with value: 0.7824764716683612 and parameters: {'loss': 'coxph', 'learning_rate': 1.0107751200335638e-06, 'n_estimators': 478, 'criterion': 'friedman_mse', 'min_samples_split': 10, 'min_samples_leaf': 1, 'min_weight_fraction_leaf': 0.2114653707393338, 'min_impurity_decrease': 0.5656884786842784, 'max_features': 0.629487163982277, 'subsample': 0.03865982825356614, 'dropout_rate': 0.7158256213189941, 'ccp_alpha': 0.08832651158619688}. Best is trial 877 with value: 0.7849837723237536.[0m
[32m[I 2022-04-15 00:54:19,269][0m Trial 904 finished with value: 0.6829336714255586 and parameters: {'loss': 'coxph', 'learning_rate': 1.246506770578586e-06, 'n_estimators': 488, 'criterion': 'friedman_mse', 'min_samples_split': 10, 'min_samples_leaf': 1, 'min_weight_fraction_leaf': 0.19084861879906256, 'min_impurity_decrease': 0.5068380734670934, 'max_features': 0.6740958709102376, 'subsample': 0.04885057740361225, 'dropout_rate': 0.7058300761034025, 'ccp_alpha': 0.34134429326979676}. Best is trial 877 with value: 0.7849837723237536.[0m
[32m[I 2022-04-15 00:55:24,618][0m Trial 905 finished with value: 0.778395389607376 and parameters: {'loss': 'coxph', 'learning_rate': 1.0358885142972033e-06, 'n_estimators': 501, 'criterion': 'friedman_mse', 'min_samples_split': 10, 'min_samples_leaf': 1, 'min_weight_fraction_leaf': 0.18568535480219253, 'min_impurity_decrease': 0.53057183995264, 'max_features': 0.6207968304788217, 'subsample': 0.01768844323942056, 'dropout_rate': 0.7248989048183851, 'ccp_alpha': 0.21220619159264276}. Best is trial 877 with value: 0.7849837723237536.[0m
[32m[I 2022-04-15 00:56:20,672][0m Trial 906 finished with value: 0.25 and parameters: {'loss': 'coxph', 'learning_rate': 1.167627857604935e-06, 'n_estimators': 448, 'criterion': 'friedman_mse', 'min_samples_split': 10, 'min_samples_leaf': 1, 'min_weight_fraction_leaf': 0.19263313553580838, 'min_impurity_decrease': 0.5657977082883882, 'max_features': 0.6470222300278717, 'subsample': 0.0019797726621342097, 'dropout_rate': 0.70838089071505, 'ccp_alpha': 0.1072239653086427}. Best is trial 877 with value: 0.7849837723237536.[0m
[32m[I 2022-04-15 00:57:22,371][0m Trial 907 finished with value: 0.782897943261374 and parameters: {'loss': 'coxph', 'learning_rate': 1.0257071067251865e-06, 'n_estimators': 469, 'criterion': 'friedman_mse', 'min_samples_split': 10, 'min_samples_leaf': 1, 'min_weight_fraction_leaf': 0.21438250611805873, 'min_impurity_decrease': 0.5923180889064029, 'max_features': 0.6222100819571973, 'subsample': 0.055337593514043534, 'dropout_rate': 0.7328372791895462, 'ccp_alpha': 0.004184533062846524}. Best is trial 877 with value: 0.7849837723237536.[0m
[32m[I 2022-04-15 00:58:19,749][0m Trial 908 finished with value: 0.7832995980249224 and parameters: {'loss': 'coxph', 'learning_rate': 1.0547879691358697e-06, 'n_estimators': 454, 'criterion': 'friedman_mse', 'min_samples_split': 10, 'min_samples_leaf': 1, 'min_weight_fraction_leaf': 0.21384976468243827, 'min_impurity_decrease': 0.59242627968452, 'max_features': 0.6330213409215649, 'subsample': 0.054982152328707797, 'dropout_rate': 0.7139386595752679, 'ccp_alpha': 0.005416295689377321}. Best is trial 877 with value: 0.7849837723237536.[0m
[32m[I 2022-04-15 00:59:16,189][0m Trial 909 finished with value: 0.7813919800881516 and parameters: {'loss': 'coxph', 'learning_rate': 1.0697552072172232e-06, 'n_estimators': 463, 'criterion': 'friedman_mse', 'min_samples_split': 10, 'min_samples_leaf': 1, 'min_weight_fraction_leaf': 0.20815276027076474, 'min_impurity_decrease': 0.5841063024474069, 'max_features': 0.629100933522931, 'subsample': 0.056084896689207075, 'dropout_rate': 0.7184824682396601, 'ccp_alpha': 0.0931034360752919}. Best is trial 877 with value: 0.7849837723237536.[0m
[32m[I 2022-04-15 01:00:25,579][0m Trial 910 finished with value: 0.7857589794114699 and parameters: {'loss': 'coxph', 'learning_rate': 1.0373330965631253e-06, 'n_estimators': 518, 'criterion': 'friedman_mse', 'min_samples_split': 10, 'min_samples_leaf': 1, 'min_weight_fraction_leaf': 0.194177831956437, 'min_impurity_decrease': 0.6068630368752201, 'max_features': 0.6045682467304292, 'subsample': 0.05513215218532981, 'dropout_rate': 0.7039073826824067, 'ccp_alpha': 0.007174126408044249}. Best is trial 910 with value: 0.7857589794114699.[0m
[32m[I 2022-04-15 01:01:25,591][0m Trial 911 finished with value: 0.7816042600224287 and parameters: {'loss': 'coxph', 'learning_rate': 1.0112714171769021e-06, 'n_estimators': 461, 'criterion': 'friedman_mse', 'min_samples_split': 10, 'min_samples_leaf': 1, 'min_weight_fraction_leaf': 0.1936587195371325, 'min_impurity_decrease': 0.6231493904675628, 'max_features': 0.6202224998685599, 'subsample': 0.05922723167083299, 'dropout_rate': 0.7035933111614916, 'ccp_alpha': 0.08223542069220453}. Best is trial 910 with value: 0.7857589794114699.[0m
[32m[I 2022-04-15 01:02:24,854][0m Trial 912 finished with value: 0.7835594368369472 and parameters: {'loss': 'coxph', 'learning_rate': 1.0112454350145392e-06, 'n_estimators': 457, 'criterion': 'friedman_mse', 'min_samples_split': 10, 'min_samples_leaf': 1, 'min_weight_fraction_leaf': 0.20528586581090374, 'min_impurity_decrease': 0.5840768518702997, 'max_features': 0.6006458887134655, 'subsample': 0.05952163918292721, 'dropout_rate': 0.7288092841556586, 'ccp_alpha': 0.01180224645400832}. Best is trial 910 with value: 0.7857589794114699.[0m
[32m[I 2022-04-15 01:03:31,820][0m Trial 913 finished with value: 0.7835006588418729 and parameters: {'loss': 'coxph', 'learning_rate': 1.0748717311758353e-06, 'n_estimators': 502, 'criterion': 'friedman_mse', 'min_samples_split': 10, 'min_samples_leaf': 1, 'min_weight_fraction_leaf': 0.2016762897439683, 'min_impurity_decrease': 0.59804129126125, 'max_features': 0.5940379376222431, 'subsample': 0.05978002257572465, 'dropout_rate': 0.7192787174294986, 'ccp_alpha': 0.002511131533316781}. Best is trial 910 with value: 0.7857589794114699.[0m
[32m[I 2022-04-15 01:04:21,476][0m Trial 914 finished with value: 0.25 and parameters: {'loss': 'coxph', 'learning_rate': 1.2607213496791393e-06, 'n_estimators': 424, 'criterion': 'squared_error', 'min_samples_split': 10, 'min_samples_leaf': 1, 'min_weight_fraction_leaf': 0.2003322153189494, 'min_impurity_decrease': 0.6117837681489424, 'max_features': 0.5804586965106648, 'subsample': 0.060518304231859346, 'dropout_rate': 0.7154882824783115, 'ccp_alpha': 0.17191973639723696}. Best is trial 910 with value: 0.7857589794114699.[0m
[32m[I 2022-04-15 01:05:14,659][0m Trial 915 finished with value: 0.7817869400376652 and parameters: {'loss': 'coxph', 'learning_rate': 1.0736935844434162e-06, 'n_estimators': 434, 'criterion': 'friedman_mse', 'min_samples_split': 10, 'min_samples_leaf': 1, 'min_weight_fraction_leaf': 0.18231568362234174, 'min_impurity_decrease': 0.5979169399569265, 'max_features': 0.5945984977342462, 'subsample': 0.05930162600603811, 'dropout_rate': 0.703181472924899, 'ccp_alpha': 0.07948429579744072}. Best is trial 910 with value: 0.7857589794114699.[0m
[32m[I 2022-04-15 01:06:11,565][0m Trial 916 finished with value: 0.7834518846936576 and parameters: {'loss': 'coxph', 'learning_rate': 1.1117511894108097e-06, 'n_estimators': 454, 'criterion': 'friedman_mse', 'min_samples_split': 10, 'min_samples_leaf': 1, 'min_weight_fraction_leaf': 0.19211731137680346, 'min_impurity_decrease': 0.5951171062855644, 'max_features': 0.5942794015508351, 'subsample': 0.058261608752211536, 'dropout_rate': 0.7305562430401825, 'ccp_alpha': 0.0036357323327736797}. Best is trial 910 with value: 0.7857589794114699.[0m
[32m[I 2022-04-15 01:06:32,389][0m Trial 917 finished with value: -0.25 and parameters: {'loss': 'squared', 'learning_rate': 1.0094529709578195e-06, 'n_estimators': 471, 'criterion': 'absolute_error', 'min_samples_split': 10, 'min_samples_leaf': 1, 'min_weight_fraction_leaf': 0.18510529460955963, 'min_impurity_decrease': 0.5893276015825616, 'max_features': 0.5619348261503072, 'subsample': 0.056923536544902606, 'dropout_rate': 0.7362771295597416, 'ccp_alpha': 0.003263007678029585}. Best is trial 910 with value: 0.7857589794114699.[0m
[32m[I 2022-04-15 01:07:34,754][0m Trial 918 finished with value: 0.7847909100453629 and parameters: {'loss': 'coxph', 'learning_rate': 1.0430604430339857e-06, 'n_estimators': 452, 'criterion': 'friedman_mse', 'min_samples_split': 10, 'min_samples_leaf': 1, 'min_weight_fraction_leaf': 0.16327500150367524, 'min_impurity_decrease': 0.6008644080415653, 'max_features': 0.5994563873070592, 'subsample': 0.05507867078882387, 'dropout_rate': 0.7033860215819563, 'ccp_alpha': 0.007243781967091546}. Best is trial 910 with value: 0.7857589794114699.[0m
[32m[I 2022-04-15 01:08:31,388][0m Trial 919 finished with value: 0.7842766394392983 and parameters: {'loss': 'coxph', 'learning_rate': 1.0563077837973686e-06, 'n_estimators': 449, 'criterion': 'friedman_mse', 'min_samples_split': 10, 'min_samples_leaf': 1, 'min_weight_fraction_leaf': 0.16404046201756817, 'min_impurity_decrease': 0.5998688464907352, 'max_features': 0.5972926517271694, 'subsample': 0.06478429413909594, 'dropout_rate': 0.7036052319369521, 'ccp_alpha': 0.0053728226439230566}. Best is trial 910 with value: 0.7857589794114699.[0m
[32m[I 2022-04-15 01:09:27,419][0m Trial 920 finished with value: 0.7841387237915888 and parameters: {'loss': 'coxph', 'learning_rate': 1.0312369217031805e-06, 'n_estimators': 443, 'criterion': 'friedman_mse', 'min_samples_split': 10, 'min_samples_leaf': 1, 'min_weight_fraction_leaf': 0.1438438242516058, 'min_impurity_decrease': 0.6059025557692287, 'max_features': 0.6014432502014734, 'subsample': 0.060561643700265996, 'dropout_rate': 0.7028454152284189, 'ccp_alpha': 0.025745388685487033}. Best is trial 910 with value: 0.7857589794114699.[0m
[32m[I 2022-04-15 01:10:26,962][0m Trial 921 finished with value: 0.7848431160685134 and parameters: {'loss': 'coxph', 'learning_rate': 1.0125332926324963e-06, 'n_estimators': 455, 'criterion': 'friedman_mse', 'min_samples_split': 10, 'min_samples_leaf': 1, 'min_weight_fraction_leaf': 0.1628908579141734, 'min_impurity_decrease': 0.6051517968841048, 'max_features': 0.5960015678132048, 'subsample': 0.06160868534201492, 'dropout_rate': 0.7047515725298251, 'ccp_alpha': 0.015119257223360359}. Best is trial 910 with value: 0.7857589794114699.[0m
[32m[I 2022-04-15 01:11:22,298][0m Trial 922 finished with value: 0.7845679253512767 and parameters: {'loss': 'coxph', 'learning_rate': 1.011152684935717e-06, 'n_estimators': 437, 'criterion': 'friedman_mse', 'min_samples_split': 10, 'min_samples_leaf': 1, 'min_weight_fraction_leaf': 0.16195974753177794, 'min_impurity_decrease': 0.5988549482239466, 'max_features': 0.5982595186907481, 'subsample': 0.06731339595963816, 'dropout_rate': 0.7001651693393428, 'ccp_alpha': 0.0010601486014556946}. Best is trial 910 with value: 0.7857589794114699.[0m
[32m[I 2022-04-15 01:12:19,980][0m Trial 923 finished with value: 0.7853507700859962 and parameters: {'loss': 'coxph', 'learning_rate': 1.0415483398349797e-06, 'n_estimators': 445, 'criterion': 'friedman_mse', 'min_samples_split': 10, 'min_samples_leaf': 1, 'min_weight_fraction_leaf': 0.15793357677591735, 'min_impurity_decrease': 0.6094975618069876, 'max_features': 0.5991328675724835, 'subsample': 0.06667428553324457, 'dropout_rate': 0.698220819914554, 'ccp_alpha': 0.010077724980329994}. Best is trial 910 with value: 0.7857589794114699.[0m
[32m[I 2022-04-15 01:13:15,577][0m Trial 924 finished with value: 0.7852526330058399 and parameters: {'loss': 'coxph', 'learning_rate': 1.007496556781277e-06, 'n_estimators': 427, 'criterion': 'friedman_mse', 'min_samples_split': 10, 'min_samples_leaf': 1, 'min_weight_fraction_leaf': 0.1591340265086527, 'min_impurity_decrease': 0.6392683119399651, 'max_features': 0.5997622758361182, 'subsample': 0.06593248006292213, 'dropout_rate': 0.7002243107340378, 'ccp_alpha': 0.005071966589359073}. Best is trial 910 with value: 0.7857589794114699.[0m
[32m[I 2022-04-15 01:14:12,217][0m Trial 925 finished with value: 0.7847623075171084 and parameters: {'loss': 'coxph', 'learning_rate': 1.0626958155447199e-06, 'n_estimators': 439, 'criterion': 'friedman_mse', 'min_samples_split': 10, 'min_samples_leaf': 1, 'min_weight_fraction_leaf': 0.16058246433609485, 'min_impurity_decrease': 0.644688043030839, 'max_features': 0.5777714077561737, 'subsample': 0.0687323312840501, 'dropout_rate': 0.7009738231309055, 'ccp_alpha': 0.008812168809596635}. Best is trial 910 with value: 0.7857589794114699.[0m
[32m[I 2022-04-15 01:15:04,946][0m Trial 926 finished with value: 0.7846345094283952 and parameters: {'loss': 'coxph', 'learning_rate': 1.0067922154038745e-06, 'n_estimators': 415, 'criterion': 'friedman_mse', 'min_samples_split': 10, 'min_samples_leaf': 1, 'min_weight_fraction_leaf': 0.15930500066806536, 'min_impurity_decrease': 0.6440206590024872, 'max_features': 0.5776551556197678, 'subsample': 0.06807727475980666, 'dropout_rate': 0.7037969361339973, 'ccp_alpha': 0.0037101629352826854}. Best is trial 910 with value: 0.7857589794114699.[0m
[32m[I 2022-04-15 01:15:57,222][0m Trial 927 finished with value: 0.7840750282145306 and parameters: {'loss': 'coxph', 'learning_rate': 1.001261020061715e-06, 'n_estimators': 413, 'criterion': 'friedman_mse', 'min_samples_split': 10, 'min_samples_leaf': 1, 'min_weight_fraction_leaf': 0.1648253919290779, 'min_impurity_decrease': 0.6435306572982556, 'max_features': 0.5452666741809056, 'subsample': 0.06642593851591891, 'dropout_rate': 0.7003455982022356, 'ccp_alpha': 0.005700651195589386}. Best is trial 910 with value: 0.7857589794114699.[0m
[32m[I 2022-04-15 01:16:51,591][0m Trial 928 finished with value: 0.7837732206501219 and parameters: {'loss': 'coxph', 'learning_rate': 1.0100165845331482e-06, 'n_estimators': 417, 'criterion': 'friedman_mse', 'min_samples_split': 10, 'min_samples_leaf': 1, 'min_weight_fraction_leaf': 0.16158108596464993, 'min_impurity_decrease': 0.658375402529256, 'max_features': 0.5544309355194297, 'subsample': 0.07042510520978992, 'dropout_rate': 0.6972341663071713, 'ccp_alpha': 0.005570497534988709}. Best is trial 910 with value: 0.7857589794114699.[0m
[32m[I 2022-04-15 01:17:43,585][0m Trial 929 finished with value: 0.7836262099073845 and parameters: {'loss': 'coxph', 'learning_rate': 1.0196429698212675e-06, 'n_estimators': 401, 'criterion': 'friedman_mse', 'min_samples_split': 10, 'min_samples_leaf': 1, 'min_weight_fraction_leaf': 0.15981309535140473, 'min_impurity_decrease': 0.648635580505943, 'max_features': 0.5503057858970293, 'subsample': 0.07018055452053358, 'dropout_rate': 0.7022204171994648, 'ccp_alpha': 0.0031735487905122086}. Best is trial 910 with value: 0.7857589794114699.[0m
