[32m[I 2022-04-14 18:10:39,099][0m Trial 690 finished with value: 0.7774602227544821 and parameters: {'loss': 'coxph', 'learning_rate': 3.421153934999805e-06, 'n_estimators': 736, 'criterion': 'friedman_mse', 'min_samples_split': 10, 'min_samples_leaf': 2, 'min_weight_fraction_leaf': 0.3503487432579052, 'min_impurity_decrease': 0.27140691468636513, 'max_features': 0.963743240275583, 'subsample': 0.03117200649654806, 'dropout_rate': 0.6487160239616477, 'ccp_alpha': 0.2787489356330915}. Best is trial 618 with value: 0.783753686536768.[0m
[32m[I 2022-04-14 18:13:14,319][0m Trial 691 finished with value: 0.7804517450167303 and parameters: {'loss': 'coxph', 'learning_rate': 4.097195584711636e-06, 'n_estimators': 775, 'criterion': 'friedman_mse', 'min_samples_split': 10, 'min_samples_leaf': 1, 'min_weight_fraction_leaf': 0.3414215781118949, 'min_impurity_decrease': 0.31380142351127654, 'max_features': 0.9296365746712483, 'subsample': 0.06508986981457461, 'dropout_rate': 0.5260359354548119, 'ccp_alpha': 0.08376370384745993}. Best is trial 618 with value: 0.783753686536768.[0m
[32m[I 2022-04-14 18:15:52,415][0m Trial 692 finished with value: 0.25 and parameters: {'loss': 'coxph', 'learning_rate': 2.635118364353681e-06, 'n_estimators': 811, 'criterion': 'friedman_mse', 'min_samples_split': 10, 'min_samples_leaf': 2, 'min_weight_fraction_leaf': 0.3571741753018178, 'min_impurity_decrease': 0.28731815689785, 'max_features': 0.9088699587847893, 'subsample': 0.0016112713819744807, 'dropout_rate': 0.5647391544245665, 'ccp_alpha': 0.0034423856252594268}. Best is trial 618 with value: 0.783753686536768.[0m
[32m[I 2022-04-14 18:18:06,769][0m Trial 693 finished with value: 0.781236207800838 and parameters: {'loss': 'coxph', 'learning_rate': 6.831450844028881e-06, 'n_estimators': 764, 'criterion': 'friedman_mse', 'min_samples_split': 10, 'min_samples_leaf': 2, 'min_weight_fraction_leaf': 0.3175177416038421, 'min_impurity_decrease': 0.38170081347175855, 'max_features': 0.9429830895380599, 'subsample': 0.04831649205139541, 'dropout_rate': 0.6267319398990493, 'ccp_alpha': 0.1660999066038348}. Best is trial 618 with value: 0.783753686536768.[0m
[32m[I 2022-04-14 18:20:58,107][0m Trial 694 finished with value: 0.7693691686985861 and parameters: {'loss': 'coxph', 'learning_rate': 1.9240995200630877e-05, 'n_estimators': 827, 'criterion': 'friedman_mse', 'min_samples_split': 10, 'min_samples_leaf': 2, 'min_weight_fraction_leaf': 0.3319193222118715, 'min_impurity_decrease': 0.41562133780189087, 'max_features': 0.9220797333214782, 'subsample': 0.019166252752403024, 'dropout_rate': 0.5459011271671912, 'ccp_alpha': 0.4811007936581727}. Best is trial 618 with value: 0.783753686536768.[0m
[32m[I 2022-04-14 18:23:13,214][0m Trial 695 finished with value: 0.7662871727234295 and parameters: {'loss': 'coxph', 'learning_rate': 5.980173982363922e-06, 'n_estimators': 775, 'criterion': 'friedman_mse', 'min_samples_split': 10, 'min_samples_leaf': 2, 'min_weight_fraction_leaf': 0.32844238522923536, 'min_impurity_decrease': 0.3921664095528258, 'max_features': 0.9307099257566221, 'subsample': 0.043418961733933455, 'dropout_rate': 0.6634436352245516, 'ccp_alpha': 0.33675254961528944}. Best is trial 618 with value: 0.783753686536768.[0m
[32m[I 2022-04-14 18:25:46,373][0m Trial 696 finished with value: 0.7531415295149502 and parameters: {'loss': 'coxph', 'learning_rate': 4.571179782549837e-06, 'n_estimators': 831, 'criterion': 'friedman_mse', 'min_samples_split': 10, 'min_samples_leaf': 3, 'min_weight_fraction_leaf': 0.29857483527203577, 'min_impurity_decrease': 0.3789388811290912, 'max_features': 0.9153009673019832, 'subsample': 0.037952768601554776, 'dropout_rate': 0.6014651666372501, 'ccp_alpha': 0.4086394805211955}. Best is trial 618 with value: 0.783753686536768.[0m
[32m[I 2022-04-14 18:29:08,474][0m Trial 697 finished with value: 0.7770496848996596 and parameters: {'loss': 'coxph', 'learning_rate': 1.3645076917571425e-05, 'n_estimators': 956, 'criterion': 'friedman_mse', 'min_samples_split': 10, 'min_samples_leaf': 2, 'min_weight_fraction_leaf': 0.27397601830748114, 'min_impurity_decrease': 0.45935127861990144, 'max_features': 0.9438576902575327, 'subsample': 0.01631269311520029, 'dropout_rate': 0.583708683862879, 'ccp_alpha': 0.2394780508837755}. Best is trial 618 with value: 0.783753686536768.[0m
[32m[I 2022-04-14 18:31:45,639][0m Trial 698 finished with value: 0.7789306460794678 and parameters: {'loss': 'coxph', 'learning_rate': 6.502139469387707e-06, 'n_estimators': 868, 'criterion': 'friedman_mse', 'min_samples_split': 10, 'min_samples_leaf': 1, 'min_weight_fraction_leaf': 0.30496930950908563, 'min_impurity_decrease': 0.4348700101477944, 'max_features': 0.9160635918177541, 'subsample': 0.05317220537554969, 'dropout_rate': 0.6271279876776478, 'ccp_alpha': 0.19054388097719532}. Best is trial 618 with value: 0.783753686536768.[0m
[32m[I 2022-04-14 18:33:18,687][0m Trial 699 finished with value: -0.25 and parameters: {'loss': 'squared', 'learning_rate': 1.0143183560404916e-05, 'n_estimators': 795, 'criterion': 'friedman_mse', 'min_samples_split': 10, 'min_samples_leaf': 2, 'min_weight_fraction_leaf': 0.3104629768410319, 'min_impurity_decrease': 0.2605753757658179, 'max_features': 0.9018882911137294, 'subsample': 0.0021103331655962336, 'dropout_rate': 0.515478394762878, 'ccp_alpha': 0.16550823235200623}. Best is trial 618 with value: 0.783753686536768.[0m
[32m[I 2022-04-14 18:36:03,913][0m Trial 700 finished with value: 0.7640894876447734 and parameters: {'loss': 'coxph', 'learning_rate': 5.203474080753409e-06, 'n_estimators': 907, 'criterion': 'friedman_mse', 'min_samples_split': 10, 'min_samples_leaf': 2, 'min_weight_fraction_leaf': 0.3215085648752565, 'min_impurity_decrease': 0.3398950341003259, 'max_features': 0.9472548874620634, 'subsample': 0.05243251349686069, 'dropout_rate': 0.6393964648805556, 'ccp_alpha': 0.3001441087504703}. Best is trial 618 with value: 0.783753686536768.[0m
[32m[I 2022-04-14 18:38:45,203][0m Trial 701 finished with value: 0.25 and parameters: {'loss': 'coxph', 'learning_rate': 2.5550415203425634e-06, 'n_estimators': 847, 'criterion': 'friedman_mse', 'min_samples_split': 10, 'min_samples_leaf': 2, 'min_weight_fraction_leaf': 0.3104589152120092, 'min_impurity_decrease': 0.2951385935694251, 'max_features': 0.8892879674209985, 'subsample': 0.14030213677795822, 'dropout_rate': 0.5627689305300265, 'ccp_alpha': 0.7610476060785161}. Best is trial 618 with value: 0.783753686536768.[0m
[32m[I 2022-04-14 18:41:08,500][0m Trial 702 finished with value: 0.7774688629227715 and parameters: {'loss': 'coxph', 'learning_rate': 7.823030986276751e-06, 'n_estimators': 770, 'criterion': 'friedman_mse', 'min_samples_split': 10, 'min_samples_leaf': 1, 'min_weight_fraction_leaf': 0.3262663215622531, 'min_impurity_decrease': 0.31344553430597083, 'max_features': 0.7688631021910995, 'subsample': 0.08097365931727918, 'dropout_rate': 0.5434220218378147, 'ccp_alpha': 0.16178379947158084}. Best is trial 618 with value: 0.783753686536768.[0m
[32m[I 2022-04-14 18:41:26,588][0m Trial 703 finished with value: 0.7769903841072282 and parameters: {'loss': 'coxph', 'learning_rate': 6.583271593782047e-06, 'n_estimators': 172, 'criterion': 'friedman_mse', 'min_samples_split': 10, 'min_samples_leaf': 2, 'min_weight_fraction_leaf': 0.3142230341307834, 'min_impurity_decrease': 0.2760154848549014, 'max_features': 0.8974320965347141, 'subsample': 0.11083467174456714, 'dropout_rate': 0.6880436619463248, 'ccp_alpha': 0.10205566906819376}. Best is trial 618 with value: 0.783753686536768.[0m
[32m[I 2022-04-14 18:44:35,882][0m Trial 704 finished with value: 0.7783136004844045 and parameters: {'loss': 'coxph', 'learning_rate': 4.423233540943155e-06, 'n_estimators': 932, 'criterion': 'friedman_mse', 'min_samples_split': 10, 'min_samples_leaf': 2, 'min_weight_fraction_leaf': 0.3241529603146268, 'min_impurity_decrease': 0.3992510397112026, 'max_features': 0.926200251774948, 'subsample': 0.029764165532101528, 'dropout_rate': 0.6021952305007569, 'ccp_alpha': 0.26026204990065105}. Best is trial 618 with value: 0.783753686536768.[0m
[32m[I 2022-04-14 18:47:30,062][0m Trial 705 finished with value: 0.25 and parameters: {'loss': 'coxph', 'learning_rate': 1.2222087033211385e-05, 'n_estimators': 899, 'criterion': 'friedman_mse', 'min_samples_split': 10, 'min_samples_leaf': 2, 'min_weight_fraction_leaf': 0.3208853414050284, 'min_impurity_decrease': 0.3653257590961313, 'max_features': 0.9028420206470742, 'subsample': 0.16859300160002588, 'dropout_rate': 0.5780060879385442, 'ccp_alpha': 0.6320249212355074}. Best is trial 618 with value: 0.783753686536768.[0m
[32m[I 2022-04-14 18:50:06,388][0m Trial 706 finished with value: 0.7802505515025349 and parameters: {'loss': 'coxph', 'learning_rate': 8.647485917216781e-06, 'n_estimators': 814, 'criterion': 'friedman_mse', 'min_samples_split': 9, 'min_samples_leaf': 2, 'min_weight_fraction_leaf': 0.2901209411209765, 'min_impurity_decrease': 0.335339789494994, 'max_features': 0.9543800933764875, 'subsample': 0.06577409370571381, 'dropout_rate': 0.5881917104815445, 'ccp_alpha': 0.10507909089823833}. Best is trial 618 with value: 0.783753686536768.[0m
[32m[I 2022-04-14 18:52:41,284][0m Trial 707 finished with value: 0.46505789418585514 and parameters: {'loss': 'coxph', 'learning_rate': 3.2821327273553304e-06, 'n_estimators': 871, 'criterion': 'friedman_mse', 'min_samples_split': 10, 'min_samples_leaf': 2, 'min_weight_fraction_leaf': 0.31407720353624285, 'min_impurity_decrease': 0.24296331087152784, 'max_features': 0.9295019370776798, 'subsample': 0.09519866897415838, 'dropout_rate': 0.6556959945448804, 'ccp_alpha': 0.38808481726136373}. Best is trial 618 with value: 0.783753686536768.[0m
[32m[I 2022-04-14 18:56:12,659][0m Trial 708 finished with value: 0.7789638818498867 and parameters: {'loss': 'coxph', 'learning_rate': 1.6936058887497118e-05, 'n_estimators': 960, 'criterion': 'friedman_mse', 'min_samples_split': 7, 'min_samples_leaf': 2, 'min_weight_fraction_leaf': 0.3335419597590109, 'min_impurity_decrease': 0.2987941219559213, 'max_features': 0.9567093678652872, 'subsample': 0.03353044026810626, 'dropout_rate': 0.5382503152189696, 'ccp_alpha': 0.2236982262917408}. Best is trial 618 with value: 0.783753686536768.[0m
[32m[I 2022-04-14 18:58:25,589][0m Trial 709 finished with value: 0.7800190190156675 and parameters: {'loss': 'coxph', 'learning_rate': 5.371965170000346e-06, 'n_estimators': 842, 'criterion': 'friedman_mse', 'min_samples_split': 9, 'min_samples_leaf': 3, 'min_weight_fraction_leaf': 0.34259777025756605, 'min_impurity_decrease': 0.3196263911007495, 'max_features': 0.9151686236712763, 'subsample': 0.07844159676640747, 'dropout_rate': 0.7354181151845451, 'ccp_alpha': 0.0911787937624222}. Best is trial 618 with value: 0.783753686536768.[0m
[32m[I 2022-04-14 19:01:16,570][0m Trial 710 finished with value: 0.7797087755590852 and parameters: {'loss': 'coxph', 'learning_rate': 9.874119325113183e-06, 'n_estimators': 890, 'criterion': 'friedman_mse', 'min_samples_split': 10, 'min_samples_leaf': 1, 'min_weight_fraction_leaf': 0.34556610278230243, 'min_impurity_decrease': 0.21310883978074063, 'max_features': 0.9013150517391229, 'subsample': 0.13115752063094907, 'dropout_rate': 0.6089550211845194, 'ccp_alpha': 0.003851455889118935}. Best is trial 618 with value: 0.783753686536768.[0m
[32m[I 2022-04-14 19:03:38,633][0m Trial 711 finished with value: 0.7801381695253438 and parameters: {'loss': 'coxph', 'learning_rate': 6.977164435252723e-06, 'n_estimators': 752, 'criterion': 'friedman_mse', 'min_samples_split': 9, 'min_samples_leaf': 2, 'min_weight_fraction_leaf': 0.3372448180823885, 'min_impurity_decrease': 0.37886434616492404, 'max_features': 0.938413042799865, 'subsample': 0.0580178686354105, 'dropout_rate': 0.569095884044043, 'ccp_alpha': 0.003684779655378066}. Best is trial 618 with value: 0.783753686536768.[0m
[32m[I 2022-04-14 19:05:49,011][0m Trial 712 finished with value: 0.7750658781054042 and parameters: {'loss': 'coxph', 'learning_rate': 1.4244003896652164e-05, 'n_estimators': 797, 'criterion': 'friedman_mse', 'min_samples_split': 10, 'min_samples_leaf': 2, 'min_weight_fraction_leaf': 0.35037430865496216, 'min_impurity_decrease': 0.2688119537997639, 'max_features': 0.886748819853144, 'subsample': 0.10222424343192116, 'dropout_rate': 0.6380408291019444, 'ccp_alpha': 0.16119581201301902}. Best is trial 618 with value: 0.783753686536768.[0m
[32m[I 2022-04-14 19:08:24,416][0m Trial 713 finished with value: 0.7607631550229842 and parameters: {'loss': 'coxph', 'learning_rate': 4.043688701242958e-06, 'n_estimators': 930, 'criterion': 'friedman_mse', 'min_samples_split': 9, 'min_samples_leaf': 2, 'min_weight_fraction_leaf': 0.3597224691711936, 'min_impurity_decrease': 0.34944499514279737, 'max_features': 0.9642210936489628, 'subsample': 0.04895273453806202, 'dropout_rate': 0.7105250811198061, 'ccp_alpha': 0.30164340173790344}. Best is trial 618 with value: 0.783753686536768.[0m
[32m[I 2022-04-14 19:11:18,753][0m Trial 714 finished with value: 0.779628175147331 and parameters: {'loss': 'coxph', 'learning_rate': 7.925996281377012e-06, 'n_estimators': 838, 'criterion': 'friedman_mse', 'min_samples_split': 10, 'min_samples_leaf': 2, 'min_weight_fraction_leaf': 0.38039475203665407, 'min_impurity_decrease': 0.2831921589860982, 'max_features': 0.9179138888794774, 'subsample': 0.022252085323213065, 'dropout_rate': 0.518117241670502, 'ccp_alpha': 0.09792919236574303}. Best is trial 618 with value: 0.783753686536768.[0m
[32m[I 2022-04-14 19:14:44,921][0m Trial 715 finished with value: 0.7805059638714305 and parameters: {'loss': 'coxph', 'learning_rate': 1.1022622315917745e-05, 'n_estimators': 968, 'criterion': 'friedman_mse', 'min_samples_split': 10, 'min_samples_leaf': 2, 'min_weight_fraction_leaf': 0.3697481077534531, 'min_impurity_decrease': 0.48382953444243837, 'max_features': 0.8864491931051469, 'subsample': 0.08660633157025736, 'dropout_rate': 0.5543013495670414, 'ccp_alpha': 0.0025348472218608697}. Best is trial 618 with value: 0.783753686536768.[0m
[32m[I 2022-04-14 19:17:30,250][0m Trial 716 finished with value: 0.750567896058314 and parameters: {'loss': 'coxph', 'learning_rate': 6.0964945936766575e-06, 'n_estimators': 884, 'criterion': 'friedman_mse', 'min_samples_split': 9, 'min_samples_leaf': 3, 'min_weight_fraction_leaf': 0.3182729541052164, 'min_impurity_decrease': 0.3163700711222667, 'max_features': 0.6740999392412639, 'subsample': 0.11993987293246848, 'dropout_rate': 0.6178077871271969, 'ccp_alpha': 0.18629553382528197}. Best is trial 618 with value: 0.783753686536768.[0m
[32m[I 2022-04-14 19:19:32,970][0m Trial 717 finished with value: 0.7481515810969528 and parameters: {'loss': 'coxph', 'learning_rate': 4.8338462378233864e-06, 'n_estimators': 791, 'criterion': 'squared_error', 'min_samples_split': 10, 'min_samples_leaf': 1, 'min_weight_fraction_leaf': 0.34221546688249904, 'min_impurity_decrease': 0.25461579720822736, 'max_features': 0.9349417073213803, 'subsample': 0.07379994545164859, 'dropout_rate': 0.6671489003188209, 'ccp_alpha': 0.002319712934712747}. Best is trial 618 with value: 0.783753686536768.[0m
[32m[I 2022-04-14 19:21:25,247][0m Trial 718 finished with value: -0.25 and parameters: {'loss': 'squared', 'learning_rate': 9.203303183957093e-06, 'n_estimators': 922, 'criterion': 'friedman_mse', 'min_samples_split': 9, 'min_samples_leaf': 2, 'min_weight_fraction_leaf': 0.42035534996944757, 'min_impurity_decrease': 0.334610072551287, 'max_features': 0.9049837018369599, 'subsample': 0.1850212300295297, 'dropout_rate': 0.5821746161650629, 'ccp_alpha': 1.0656185468640789}. Best is trial 618 with value: 0.783753686536768.[0m
[32m[I 2022-04-14 19:24:18,956][0m Trial 719 finished with value: 0.6371812073302544 and parameters: {'loss': 'coxph', 'learning_rate': 6.068988095751811e-06, 'n_estimators': 855, 'criterion': 'friedman_mse', 'min_samples_split': 10, 'min_samples_leaf': 2, 'min_weight_fraction_leaf': 0.30367235123583664, 'min_impurity_decrease': 0.2957946079865274, 'max_features': 0.9567216878788525, 'subsample': 0.14465312594241791, 'dropout_rate': 0.49983920788424474, 'ccp_alpha': 0.24985641379536153}. Best is trial 618 with value: 0.783753686536768.[0m
[32m[I 2022-04-14 19:27:05,625][0m Trial 720 finished with value: 0.7806285606939148 and parameters: {'loss': 'coxph', 'learning_rate': 1.2206601341387509e-05, 'n_estimators': 816, 'criterion': 'friedman_mse', 'min_samples_split': 9, 'min_samples_leaf': 2, 'min_weight_fraction_leaf': 0.3537799415289589, 'min_impurity_decrease': 0.3594731654997545, 'max_features': 0.882814383668689, 'subsample': 0.04425126599035993, 'dropout_rate': 0.5366483098547323, 'ccp_alpha': 0.0969055903607687}. Best is trial 618 with value: 0.783753686536768.[0m
[32m[I 2022-04-14 19:29:12,170][0m Trial 721 finished with value: 0.7722483717125026 and parameters: {'loss': 'coxph', 'learning_rate': 2.0372251159411235e-05, 'n_estimators': 744, 'criterion': 'friedman_mse', 'min_samples_split': 8, 'min_samples_leaf': 2, 'min_weight_fraction_leaf': 0.3848779166908707, 'min_impurity_decrease': 0.41487059654591296, 'max_features': 0.7451359987615198, 'subsample': 0.10573180274418992, 'dropout_rate': 0.5996911783165659, 'ccp_alpha': 0.1695372579523163}. Best is trial 618 with value: 0.783753686536768.[0m
[32m[I 2022-04-14 19:32:08,092][0m Trial 722 finished with value: 0.7802040917111469 and parameters: {'loss': 'coxph', 'learning_rate': 7.471613974328547e-06, 'n_estimators': 896, 'criterion': 'friedman_mse', 'min_samples_split': 10, 'min_samples_leaf': 2, 'min_weight_fraction_leaf': 0.36813096074824897, 'min_impurity_decrease': 0.308957816453023, 'max_features': 0.9298741701479347, 'subsample': 0.06655471545928299, 'dropout_rate': 0.568367943881879, 'ccp_alpha': 0.09315964621128747}. Best is trial 618 with value: 0.783753686536768.[0m
[32m[I 2022-04-14 19:35:15,756][0m Trial 723 finished with value: 0.7758020322842267 and parameters: {'loss': 'coxph', 'learning_rate': 3.651021924611214e-06, 'n_estimators': 961, 'criterion': 'friedman_mse', 'min_samples_split': 9, 'min_samples_leaf': 1, 'min_weight_fraction_leaf': 0.33139871517270225, 'min_impurity_decrease': 0.3789574107884222, 'max_features': 0.8993593491423886, 'subsample': 0.017629454436704477, 'dropout_rate': 0.6422657845595171, 'ccp_alpha': 0.36249314835969393}. Best is trial 618 with value: 0.783753686536768.[0m
[32m[I 2022-04-14 19:38:03,505][0m Trial 724 finished with value: 0.7492913890316475 and parameters: {'loss': 'coxph', 'learning_rate': 9.93983541319699e-06, 'n_estimators': 860, 'criterion': 'friedman_mse', 'min_samples_split': 8, 'min_samples_leaf': 2, 'min_weight_fraction_leaf': 0.4028395697323315, 'min_impurity_decrease': 0.2826250046927766, 'max_features': 0.7858233173676176, 'subsample': 0.08966127729765831, 'dropout_rate': 0.5571150225933009, 'ccp_alpha': 0.23759415836920844}. Best is trial 618 with value: 0.783753686536768.[0m
[32m[I 2022-04-14 19:41:05,305][0m Trial 725 finished with value: 0.7797151235801252 and parameters: {'loss': 'coxph', 'learning_rate': 5.438675652878814e-06, 'n_estimators': 924, 'criterion': 'friedman_mse', 'min_samples_split': 7, 'min_samples_leaf': 3, 'min_weight_fraction_leaf': 0.3552943863211356, 'min_impurity_decrease': 0.34161347345439247, 'max_features': 0.9731094694368042, 'subsample': 0.035748104677232606, 'dropout_rate': 0.6253630670245609, 'ccp_alpha': 0.10211474709210044}. Best is trial 618 with value: 0.783753686536768.[0m
[32m[I 2022-04-14 19:43:05,211][0m Trial 726 finished with value: 0.6371812073302544 and parameters: {'loss': 'coxph', 'learning_rate': 1.4223934993351364e-05, 'n_estimators': 778, 'criterion': 'friedman_mse', 'min_samples_split': 10, 'min_samples_leaf': 2, 'min_weight_fraction_leaf': 0.37640869331212523, 'min_impurity_decrease': 0.3230893413922021, 'max_features': 0.9497180632794946, 'subsample': 0.30093629404325506, 'dropout_rate': 0.6030877724393994, 'ccp_alpha': 0.16494616137172927}. Best is trial 618 with value: 0.783753686536768.[0m
[32m[I 2022-04-14 19:45:43,391][0m Trial 727 finished with value: 0.7789921868259078 and parameters: {'loss': 'coxph', 'learning_rate': 7.683786234863997e-06, 'n_estimators': 823, 'criterion': 'friedman_mse', 'min_samples_split': 9, 'min_samples_leaf': 2, 'min_weight_fraction_leaf': 0.3877215105015495, 'min_impurity_decrease': 0.23099120261495518, 'max_features': 0.9189583314049031, 'subsample': 0.11767357393831003, 'dropout_rate': 0.5213787503304116, 'ccp_alpha': 0.1111524195961181}. Best is trial 618 with value: 0.783753686536768.[0m
[32m[I 2022-04-14 19:48:34,953][0m Trial 728 finished with value: 0.25 and parameters: {'loss': 'coxph', 'learning_rate': 2.8526192816543e-06, 'n_estimators': 882, 'criterion': 'friedman_mse', 'min_samples_split': 10, 'min_samples_leaf': 2, 'min_weight_fraction_leaf': 0.3429314455688339, 'min_impurity_decrease': 0.2606741857859429, 'max_features': 0.8772016155844572, 'subsample': 0.001353154708951601, 'dropout_rate': 0.5842996574314308, 'ccp_alpha': 0.003485101439108498}. Best is trial 618 with value: 0.783753686536768.[0m
[32m[I 2022-04-14 19:51:59,702][0m Trial 729 finished with value: 0.3678757772397035 and parameters: {'loss': 'coxph', 'learning_rate': 4.566907803196988e-06, 'n_estimators': 961, 'criterion': 'friedman_mse', 'min_samples_split': 8, 'min_samples_leaf': 2, 'min_weight_fraction_leaf': 0.3653063546734916, 'min_impurity_decrease': 0.29683696929800557, 'max_features': 0.8947392659424106, 'subsample': 0.05388672379624831, 'dropout_rate': 0.5442902501379634, 'ccp_alpha': 0.5249306582430522}. Best is trial 618 with value: 0.783753686536768.[0m
