[32m[I 2022-04-13 12:18:56,535][0m Trial 641 finished with value: 0.7724088058077625 and parameters: {'alpha': 1.6429847145164433, 'ties': 'breslow'}. Best is trial 126 with value: 0.7727034345528856.[0m
[32m[I 2022-04-13 12:19:00,491][0m Trial 642 finished with value: 0.7724949572956227 and parameters: {'alpha': 1.4021618992605254, 'ties': 'breslow'}. Best is trial 126 with value: 0.7727034345528856.[0m
[32m[I 2022-04-13 12:19:03,238][0m Trial 643 finished with value: 0.7726295165614985 and parameters: {'alpha': 1.2084324374110338, 'ties': 'breslow'}. Best is trial 126 with value: 0.7727034345528856.[0m
[32m[I 2022-04-13 12:19:05,972][0m Trial 644 finished with value: 0.7699299120364527 and parameters: {'alpha': 3.9765593897256064, 'ties': 'breslow'}. Best is trial 126 with value: 0.7727034345528856.[0m
[32m[I 2022-04-13 12:19:08,971][0m Trial 645 finished with value: 0.7725180401409839 and parameters: {'alpha': 1.0320778348659079, 'ties': 'breslow'}. Best is trial 126 with value: 0.7727034345528856.[0m
[32m[I 2022-04-13 12:19:13,359][0m Trial 646 finished with value: 0.7726208206712639 and parameters: {'alpha': 0.9284630297464691, 'ties': 'breslow'}. Best is trial 126 with value: 0.7727034345528856.[0m
[32m[I 2022-04-13 12:19:15,672][0m Trial 647 finished with value: 0.7726628251245765 and parameters: {'alpha': 1.2567407137303106, 'ties': 'breslow'}. Best is trial 126 with value: 0.7727034345528856.[0m
[32m[I 2022-04-13 12:19:18,421][0m Trial 648 finished with value: 0.7726214786432947 and parameters: {'alpha': 1.1311405218382098, 'ties': 'breslow'}. Best is trial 126 with value: 0.7727034345528856.[0m
[32m[I 2022-04-13 12:19:22,546][0m Trial 649 finished with value: 0.7725664644434609 and parameters: {'alpha': 0.7498011553004115, 'ties': 'breslow'}. Best is trial 126 with value: 0.7727034345528856.[0m
[32m[I 2022-04-13 12:19:26,321][0m Trial 650 finished with value: 0.7724708154348553 and parameters: {'alpha': 1.493792285054612, 'ties': 'breslow'}. Best is trial 126 with value: 0.7727034345528856.[0m
[32m[I 2022-04-13 12:19:29,533][0m Trial 651 finished with value: 0.7725141925675403 and parameters: {'alpha': 1.3438845011467162, 'ties': 'breslow'}. Best is trial 126 with value: 0.7727034345528856.[0m
[32m[I 2022-04-13 12:19:31,492][0m Trial 652 finished with value: 0.7725901717078996 and parameters: {'alpha': 1.195416512082328, 'ties': 'breslow'}. Best is trial 126 with value: 0.7727034345528856.[0m
[32m[I 2022-04-13 12:19:36,407][0m Trial 653 finished with value: 0.7725094538239613 and parameters: {'alpha': 1.0344986655845436, 'ties': 'breslow'}. Best is trial 126 with value: 0.7727034345528856.[0m
[32m[I 2022-04-13 12:19:38,576][0m Trial 654 finished with value: 0.7726285010213969 and parameters: {'alpha': 1.2885926845784312, 'ties': 'breslow'}. Best is trial 126 with value: 0.7727034345528856.[0m
[32m[I 2022-04-13 12:19:41,690][0m Trial 655 finished with value: 0.7724160995470876 and parameters: {'alpha': 1.4208736982656132, 'ties': 'breslow'}. Best is trial 126 with value: 0.7727034345528856.[0m
[32m[I 2022-04-13 12:19:44,763][0m Trial 656 finished with value: 0.772607428538065 and parameters: {'alpha': 1.1531723844769053, 'ties': 'breslow'}. Best is trial 126 with value: 0.7727034345528856.[0m
[32m[I 2022-04-13 12:19:49,003][0m Trial 657 finished with value: 0.7726169839185241 and parameters: {'alpha': 1.079867306300937, 'ties': 'breslow'}. Best is trial 126 with value: 0.7727034345528856.[0m
[32m[I 2022-04-13 12:19:53,829][0m Trial 658 finished with value: 0.7726618318892375 and parameters: {'alpha': 1.2377886155965774, 'ties': 'breslow'}. Best is trial 126 with value: 0.7727034345528856.[0m
[32m[I 2022-04-13 12:19:55,982][0m Trial 659 finished with value: 0.7725317613333583 and parameters: {'alpha': 1.3524304135602165, 'ties': 'breslow'}. Best is trial 126 with value: 0.7727034345528856.[0m
[32m[I 2022-04-13 12:19:58,657][0m Trial 660 finished with value: 0.7726234378400993 and parameters: {'alpha': 0.9494617913589063, 'ties': 'breslow'}. Best is trial 126 with value: 0.7727034345528856.[0m
[32m[I 2022-04-13 12:20:02,172][0m Trial 661 finished with value: 0.7725911215568294 and parameters: {'alpha': 1.162083344381881, 'ties': 'breslow'}. Best is trial 126 with value: 0.7727034345528856.[0m
[32m[I 2022-04-13 12:20:06,659][0m Trial 662 finished with value: 0.7726593149894195 and parameters: {'alpha': 1.2631552578217646, 'ties': 'breslow'}. Best is trial 126 with value: 0.7727034345528856.[0m
[32m[I 2022-04-13 12:20:11,563][0m Trial 663 finished with value: 0.7724876539349876 and parameters: {'alpha': 1.5479648179416967, 'ties': 'breslow'}. Best is trial 126 with value: 0.7727034345528856.[0m
[32m[I 2022-04-13 12:20:15,690][0m Trial 664 finished with value: 0.7725865442971805 and parameters: {'alpha': 1.066993655090467, 'ties': 'breslow'}. Best is trial 126 with value: 0.7727034345528856.[0m
[32m[I 2022-04-13 12:20:19,736][0m Trial 665 finished with value: 0.7724770992484857 and parameters: {'alpha': 1.4253807368234759, 'ties': 'breslow'}. Best is trial 126 with value: 0.7727034345528856.[0m
[32m[I 2022-04-13 12:20:21,982][0m Trial 666 finished with value: 0.7726032746577532 and parameters: {'alpha': 1.3156775700343408, 'ties': 'breslow'}. Best is trial 126 with value: 0.7727034345528856.[0m
[32m[I 2022-04-13 12:20:24,850][0m Trial 667 finished with value: 0.7725032755577244 and parameters: {'alpha': 0.8219635452977829, 'ties': 'breslow'}. Best is trial 126 with value: 0.7727034345528856.[0m
[32m[I 2022-04-13 12:20:28,562][0m Trial 668 finished with value: 0.7726154320298018 and parameters: {'alpha': 1.182791550496235, 'ties': 'breslow'}. Best is trial 126 with value: 0.7727034345528856.[0m
[32m[I 2022-04-13 12:20:32,967][0m Trial 669 finished with value: 0.7716639934931154 and parameters: {'alpha': 0.3195354776102537, 'ties': 'breslow'}. Best is trial 126 with value: 0.7727034345528856.[0m
[32m[I 2022-04-13 12:20:36,542][0m Trial 670 finished with value: 0.772622423770334 and parameters: {'alpha': 1.0838449240395316, 'ties': 'breslow'}. Best is trial 126 with value: 0.7727034345528856.[0m
[32m[I 2022-04-13 12:20:40,203][0m Trial 671 finished with value: 0.7726601672839672 and parameters: {'alpha': 1.2691418047389327, 'ties': 'breslow'}. Best is trial 126 with value: 0.7727034345528856.[0m
[32m[I 2022-04-13 12:20:44,577][0m Trial 672 finished with value: 0.7725226156490728 and parameters: {'alpha': 1.3650291532360435, 'ties': 'breslow'}. Best is trial 126 with value: 0.7727034345528856.[0m
[32m[I 2022-04-13 12:20:49,368][0m Trial 673 finished with value: 0.7725668601816749 and parameters: {'alpha': 1.1639728524970925, 'ties': 'breslow'}. Best is trial 126 with value: 0.7727034345528856.[0m
[32m[I 2022-04-13 12:20:52,760][0m Trial 674 finished with value: 0.7726179152065387 and parameters: {'alpha': 0.9481387636453529, 'ties': 'breslow'}. Best is trial 126 with value: 0.7727034345528856.[0m
[32m[I 2022-04-13 12:20:55,917][0m Trial 675 finished with value: 0.7724856769560515 and parameters: {'alpha': 1.463914612137545, 'ties': 'breslow'}. Best is trial 126 with value: 0.7727034345528856.[0m
[32m[I 2022-04-13 12:20:59,171][0m Trial 676 finished with value: 0.7727038262700389 and parameters: {'alpha': 1.2171135171603977, 'ties': 'breslow'}. Best is trial 676 with value: 0.7727038262700389.[0m
[32m[I 2022-04-13 12:21:03,582][0m Trial 677 finished with value: 0.7725268905165502 and parameters: {'alpha': 1.0431780979008654, 'ties': 'breslow'}. Best is trial 676 with value: 0.7727038262700389.[0m
[32m[I 2022-04-13 12:21:08,818][0m Trial 678 finished with value: 0.7725266639189192 and parameters: {'alpha': 1.3256241216436708, 'ties': 'breslow'}. Best is trial 676 with value: 0.7727038262700389.[0m
[32m[I 2022-04-13 12:21:12,900][0m Trial 679 finished with value: 0.7726469764491004 and parameters: {'alpha': 1.1384182913482008, 'ties': 'breslow'}. Best is trial 676 with value: 0.7727038262700389.[0m
[32m[I 2022-04-13 12:21:17,203][0m Trial 680 finished with value: 0.7726155821350116 and parameters: {'alpha': 1.2030402498659971, 'ties': 'breslow'}. Best is trial 676 with value: 0.7727038262700389.[0m
[32m[I 2022-04-13 12:21:21,096][0m Trial 681 finished with value: 0.7726433672570545 and parameters: {'alpha': 1.2731335144324671, 'ties': 'breslow'}. Best is trial 676 with value: 0.7727038262700389.[0m
[32m[I 2022-04-13 12:21:22,994][0m Trial 682 finished with value: 0.7724687052800064 and parameters: {'alpha': 1.4143844364297142, 'ties': 'breslow'}. Best is trial 676 with value: 0.7727038262700389.[0m
[32m[I 2022-04-13 12:21:24,680][0m Trial 683 finished with value: 0.7725251190412707 and parameters: {'alpha': 1.7191693255432345, 'ties': 'breslow'}. Best is trial 676 with value: 0.7727038262700389.[0m
[32m[I 2022-04-13 12:21:27,860][0m Trial 684 finished with value: 0.7725916857891875 and parameters: {'alpha': 1.0069585738918145, 'ties': 'breslow'}. Best is trial 676 with value: 0.7727038262700389.[0m
[32m[I 2022-04-13 12:21:32,943][0m Trial 685 finished with value: 0.7726469764491004 and parameters: {'alpha': 1.1373484158936555, 'ties': 'breslow'}. Best is trial 676 with value: 0.7727038262700389.[0m
[32m[I 2022-04-13 12:21:37,207][0m Trial 686 finished with value: 0.7725152201193295 and parameters: {'alpha': 1.3344698442819876, 'ties': 'breslow'}. Best is trial 676 with value: 0.7727038262700389.[0m
[32m[I 2022-04-13 12:21:41,320][0m Trial 687 finished with value: 0.7724639580727659 and parameters: {'alpha': 1.5343898513270033, 'ties': 'breslow'}. Best is trial 676 with value: 0.7727038262700389.[0m
[32m[I 2022-04-13 12:21:45,873][0m Trial 688 finished with value: 0.7726994583330207 and parameters: {'alpha': 1.2156866264288284, 'ties': 'breslow'}. Best is trial 676 with value: 0.7727038262700389.[0m
[32m[I 2022-04-13 12:21:50,564][0m Trial 689 finished with value: 0.7726169839185241 and parameters: {'alpha': 1.0792224809755524, 'ties': 'breslow'}. Best is trial 676 with value: 0.7727038262700389.[0m
[32m[I 2022-04-13 12:21:53,715][0m Trial 690 finished with value: 0.772585212783837 and parameters: {'alpha': 0.8925195456537849, 'ties': 'breslow'}. Best is trial 676 with value: 0.7727038262700389.[0m
[32m[I 2022-04-13 12:21:57,535][0m Trial 691 finished with value: 0.7726641053293019 and parameters: {'alpha': 1.2623699283833367, 'ties': 'breslow'}. Best is trial 676 with value: 0.7727038262700389.[0m
[32m[I 2022-04-13 12:21:59,718][0m Trial 692 finished with value: 0.7724842946235275 and parameters: {'alpha': 1.3786611517704084, 'ties': 'breslow'}. Best is trial 676 with value: 0.7727038262700389.[0m
[32m[I 2022-04-13 12:22:03,465][0m Trial 693 finished with value: 0.7725856598939481 and parameters: {'alpha': 1.1131484736763058, 'ties': 'breslow'}. Best is trial 676 with value: 0.7727038262700389.[0m
[32m[I 2022-04-13 12:22:06,652][0m Trial 694 finished with value: 0.7725895528664264 and parameters: {'alpha': 0.9922760890338513, 'ties': 'breslow'}. Best is trial 676 with value: 0.7727038262700389.[0m
[32m[I 2022-04-13 12:22:10,805][0m Trial 695 finished with value: 0.7726196204141081 and parameters: {'alpha': 1.210693143198099, 'ties': 'breslow'}. Best is trial 676 with value: 0.7727038262700389.[0m
[32m[I 2022-04-13 12:22:15,067][0m Trial 696 finished with value: 0.7724856769560515 and parameters: {'alpha': 1.4636184092217657, 'ties': 'breslow'}. Best is trial 676 with value: 0.7727038262700389.[0m
[32m[I 2022-04-13 12:22:17,444][0m Trial 697 finished with value: 0.7726032746577532 and parameters: {'alpha': 1.3149457702848921, 'ties': 'breslow'}. Best is trial 676 with value: 0.7727038262700389.[0m
[32m[I 2022-04-13 12:22:22,140][0m Trial 698 finished with value: 0.7726128784487247 and parameters: {'alpha': 1.1526479771767286, 'ties': 'breslow'}. Best is trial 676 with value: 0.7727038262700389.[0m
[32m[I 2022-04-13 12:22:27,185][0m Trial 699 finished with value: 0.7726614875702775 and parameters: {'alpha': 1.2447413285147426, 'ties': 'breslow'}. Best is trial 676 with value: 0.7727038262700389.[0m
[32m[I 2022-04-13 12:22:29,327][0m Trial 700 finished with value: 0.7725174516770402 and parameters: {'alpha': 1.0421376338943489, 'ties': 'breslow'}. Best is trial 676 with value: 0.7727038262700389.[0m
[32m[I 2022-04-13 12:22:33,025][0m Trial 701 finished with value: 0.7725015505178554 and parameters: {'alpha': 1.375938256278796, 'ties': 'breslow'}. Best is trial 676 with value: 0.7727038262700389.[0m
[32m[I 2022-04-13 12:22:36,832][0m Trial 702 finished with value: 0.772610223391575 and parameters: {'alpha': 1.1510943640216904, 'ties': 'breslow'}. Best is trial 676 with value: 0.7727038262700389.[0m
[32m[I 2022-04-13 12:22:39,660][0m Trial 703 finished with value: 0.7719956984244678 and parameters: {'alpha': 2.398936716486399, 'ties': 'breslow'}. Best is trial 676 with value: 0.7727038262700389.[0m
[32m[I 2022-04-13 12:22:43,818][0m Trial 704 finished with value: 0.7726659385593945 and parameters: {'alpha': 1.267745343335365, 'ties': 'breslow'}. Best is trial 676 with value: 0.7727038262700389.[0m
[32m[I 2022-04-13 12:22:47,620][0m Trial 705 finished with value: 0.7725924789909339 and parameters: {'alpha': 1.0728471165843443, 'ties': 'breslow'}. Best is trial 676 with value: 0.7727038262700389.[0m
[32m[I 2022-04-13 12:22:51,256][0m Trial 706 finished with value: 0.7725040317983811 and parameters: {'alpha': 1.5672849190985287, 'ties': 'breslow'}. Best is trial 676 with value: 0.7727038262700389.[0m
[32m[I 2022-04-13 12:22:56,159][0m Trial 707 finished with value: 0.7724729681196247 and parameters: {'alpha': 1.4097469615110751, 'ties': 'breslow'}. Best is trial 676 with value: 0.7727038262700389.[0m
[32m[I 2022-04-13 12:22:59,638][0m Trial 708 finished with value: 0.7726365528945663 and parameters: {'alpha': 1.206336151458757, 'ties': 'breslow'}. Best is trial 676 with value: 0.7727038262700389.[0m
[32m[I 2022-04-13 12:23:03,751][0m Trial 709 finished with value: 0.7726353941241355 and parameters: {'alpha': 0.9530111658658076, 'ties': 'breslow'}. Best is trial 676 with value: 0.7727038262700389.[0m
[32m[I 2022-04-13 12:23:08,160][0m Trial 710 finished with value: 0.7726496052939691 and parameters: {'alpha': 1.2922996612043687, 'ties': 'breslow'}. Best is trial 676 with value: 0.7727038262700389.[0m
[32m[I 2022-04-13 12:23:11,067][0m Trial 711 finished with value: 0.7726103169482147 and parameters: {'alpha': 1.127193455775403, 'ties': 'breslow'}. Best is trial 676 with value: 0.7727038262700389.[0m
[32m[I 2022-04-13 12:23:14,613][0m Trial 712 finished with value: 0.7725047987266306 and parameters: {'alpha': 1.3326184189687944, 'ties': 'breslow'}. Best is trial 676 with value: 0.7727038262700389.[0m
[32m[I 2022-04-13 12:23:20,033][0m Trial 713 finished with value: 0.7726155821350116 and parameters: {'alpha': 1.2025973025725496, 'ties': 'breslow'}. Best is trial 676 with value: 0.7727038262700389.[0m
[32m[I 2022-04-13 12:23:23,433][0m Trial 714 finished with value: 0.7724260994386872 and parameters: {'alpha': 1.4475076587768827, 'ties': 'efron'}. Best is trial 676 with value: 0.7727038262700389.[0m
[32m[I 2022-04-13 12:23:27,091][0m Trial 715 finished with value: 0.7726267242123093 and parameters: {'alpha': 0.8477766007363785, 'ties': 'breslow'}. Best is trial 676 with value: 0.7727038262700389.[0m
[32m[I 2022-04-13 12:23:31,202][0m Trial 716 finished with value: 0.7725422359767171 and parameters: {'alpha': 1.0339045035556333, 'ties': 'efron'}. Best is trial 676 with value: 0.7727038262700389.[0m
[32m[I 2022-04-13 12:23:35,076][0m Trial 717 finished with value: 0.7726355348969951 and parameters: {'alpha': 1.3007277730149376, 'ties': 'breslow'}. Best is trial 676 with value: 0.7727038262700389.[0m
[32m[I 2022-04-13 12:23:37,968][0m Trial 718 finished with value: 0.772573369059545 and parameters: {'alpha': 1.1761196902052442, 'ties': 'efron'}. Best is trial 676 with value: 0.7727038262700389.[0m
[32m[I 2022-04-13 12:23:40,783][0m Trial 719 finished with value: 0.7725653560019609 and parameters: {'alpha': 1.0970553522336708, 'ties': 'efron'}. Best is trial 676 with value: 0.7727038262700389.[0m
[32m[I 2022-04-13 12:23:42,786][0m Trial 720 finished with value: 0.7725317919363037 and parameters: {'alpha': 1.356816140611782, 'ties': 'breslow'}. Best is trial 676 with value: 0.7727038262700389.[0m
[32m[I 2022-04-13 12:23:44,554][0m Trial 721 finished with value: 0.7726520343825628 and parameters: {'alpha': 1.2352420417274002, 'ties': 'efron'}. Best is trial 676 with value: 0.7727038262700389.[0m
[32m[I 2022-04-13 12:23:46,864][0m Trial 722 finished with value: 0.7724687527181576 and parameters: {'alpha': 1.484757843076247, 'ties': 'breslow'}. Best is trial 676 with value: 0.7727038262700389.[0m
[32m[I 2022-04-13 12:23:49,760][0m Trial 723 finished with value: 0.7726505803332081 and parameters: {'alpha': 0.9553177301571163, 'ties': 'efron'}. Best is trial 676 with value: 0.7727038262700389.[0m
[32m[I 2022-04-13 12:23:53,447][0m Trial 724 finished with value: 0.7726158365776095 and parameters: {'alpha': 1.1282273451574878, 'ties': 'breslow'}. Best is trial 676 with value: 0.7727038262700389.[0m
[32m[I 2022-04-13 12:23:55,789][0m Trial 725 finished with value: 0.772662321418378 and parameters: {'alpha': 1.2512675038807035, 'ties': 'efron'}. Best is trial 676 with value: 0.7727038262700389.[0m
[32m[I 2022-04-13 12:24:00,777][0m Trial 726 finished with value: 0.7725301613727382 and parameters: {'alpha': 1.3630140761454221, 'ties': 'efron'}. Best is trial 676 with value: 0.7727038262700389.[0m
[32m[I 2022-04-13 12:24:03,884][0m Trial 727 finished with value: 0.7725034911310029 and parameters: {'alpha': 1.0387983115504082, 'ties': 'breslow'}. Best is trial 676 with value: 0.7727038262700389.[0m
[32m[I 2022-04-13 12:24:06,132][0m Trial 728 finished with value: 0.772442053695406 and parameters: {'alpha': 1.861519156590246, 'ties': 'efron'}. Best is trial 676 with value: 0.7727038262700389.[0m
[32m[I 2022-04-13 12:24:09,630][0m Trial 729 finished with value: 0.7703659906293039 and parameters: {'alpha': 3.542219806348923, 'ties': 'breslow'}. Best is trial 676 with value: 0.7727038262700389.[0m
[32m[I 2022-04-13 12:24:13,549][0m Trial 730 finished with value: 0.7726008102341806 and parameters: {'alpha': 1.187696863574635, 'ties': 'efron'}. Best is trial 676 with value: 0.7727038262700389.[0m
[32m[I 2022-04-13 12:24:18,593][0m Trial 731 finished with value: 0.7726199614477262 and parameters: {'alpha': 1.300964991274051, 'ties': 'breslow'}. Best is trial 676 with value: 0.7727038262700389.[0m
[32m[I 2022-04-13 12:24:21,979][0m Trial 732 finished with value: 0.7724678032999279 and parameters: {'alpha': 1.4122559017955487, 'ties': 'efron'}. Best is trial 676 with value: 0.7727038262700389.[0m
[32m[I 2022-04-13 12:24:25,333][0m Trial 733 finished with value: 0.7724743523364415 and parameters: {'alpha': 1.59612903344799, 'ties': 'breslow'}. Best is trial 676 with value: 0.7727038262700389.[0m
[32m[I 2022-04-13 12:24:29,766][0m Trial 734 finished with value: 0.7726147464945908 and parameters: {'alpha': 1.156081024234894, 'ties': 'efron'}. Best is trial 676 with value: 0.7727038262700389.[0m
[32m[I 2022-04-13 12:24:33,943][0m Trial 735 finished with value: 0.772582884762948 and parameters: {'alpha': 1.059047544472299, 'ties': 'efron'}. Best is trial 676 with value: 0.7727038262700389.[0m
[32m[I 2022-04-13 12:24:35,900][0m Trial 736 finished with value: 0.7726433672570545 and parameters: {'alpha': 1.2724192557139615, 'ties': 'breslow'}. Best is trial 676 with value: 0.7727038262700389.[0m
[32m[I 2022-04-13 12:24:38,771][0m Trial 737 finished with value: 0.7725819630500788 and parameters: {'alpha': 1.1915099181468352, 'ties': 'efron'}. Best is trial 676 with value: 0.7727038262700389.[0m
[32m[I 2022-04-13 12:24:43,171][0m Trial 738 finished with value: 0.7724589042443875 and parameters: {'alpha': 1.4987753831596153, 'ties': 'breslow'}. Best is trial 676 with value: 0.7727038262700389.[0m
[32m[I 2022-04-13 12:24:48,100][0m Trial 739 finished with value: 0.7725861885982617 and parameters: {'alpha': 0.9959237211154894, 'ties': 'efron'}. Best is trial 676 with value: 0.7727038262700389.[0m
[32m[I 2022-04-13 12:24:52,745][0m Trial 740 finished with value: 0.7721750627566 and parameters: {'alpha': 2.2367898164846363, 'ties': 'breslow'}. Best is trial 676 with value: 0.7727038262700389.[0m
[32m[I 2022-04-13 12:24:56,016][0m Trial 741 finished with value: 0.7725975705847634 and parameters: {'alpha': 1.3158428186832545, 'ties': 'efron'}. Best is trial 676 with value: 0.7727038262700389.[0m
[32m[I 2022-04-13 12:25:00,110][0m Trial 742 finished with value: 0.7725724248580511 and parameters: {'alpha': 1.1080377826532337, 'ties': 'breslow'}. Best is trial 676 with value: 0.7727038262700389.[0m
[32m[I 2022-04-13 12:25:03,241][0m Trial 743 finished with value: 0.7724866973761754 and parameters: {'alpha': 1.4011133759654422, 'ties': 'efron'}. Best is trial 676 with value: 0.7727038262700389.[0m
[32m[I 2022-04-13 12:25:07,396][0m Trial 744 finished with value: 0.7726445816655405 and parameters: {'alpha': 1.257830625903109, 'ties': 'efron'}. Best is trial 676 with value: 0.7727038262700389.[0m
[32m[I 2022-04-13 12:25:11,458][0m Trial 745 finished with value: 0.7726037037595387 and parameters: {'alpha': 0.9022418858389608, 'ties': 'breslow'}. Best is trial 676 with value: 0.7727038262700389.[0m
[32m[I 2022-04-13 12:25:15,227][0m Trial 746 finished with value: 0.7725731131895895 and parameters: {'alpha': 1.1706893179326192, 'ties': 'efron'}. Best is trial 676 with value: 0.7727038262700389.[0m
