[32m[I 2022-04-13 20:23:33,478][0m Trial 290 finished with value: 0.25 and parameters: {'loss': 'coxph', 'learning_rate': 4.3268055786400125e-06, 'n_estimators': 584, 'criterion': 'friedman_mse', 'min_samples_split': 8, 'min_samples_leaf': 2, 'min_weight_fraction_leaf': 0.03359237221418544, 'min_impurity_decrease': 0.7373657400701884, 'max_features': 0.12913195683302234, 'subsample': 0.26203455443728146, 'dropout_rate': 0.6356612553232925, 'ccp_alpha': 3.4519472801792026}. Best is trial 138 with value: 0.731155530669601.[0m
[32m[I 2022-04-13 20:25:04,005][0m Trial 291 finished with value: 0.25 and parameters: {'loss': 'coxph', 'learning_rate': 1.6490102769284994e-05, 'n_estimators': 563, 'criterion': 'friedman_mse', 'min_samples_split': 8, 'min_samples_leaf': 2, 'min_weight_fraction_leaf': 0.039223015145274716, 'min_impurity_decrease': 0.6274392018345321, 'max_features': 0.7918799491548911, 'subsample': 0.2495737248267535, 'dropout_rate': 0.6982882135578637, 'ccp_alpha': 3.7425911706808987}. Best is trial 138 with value: 0.731155530669601.[0m
[32m[I 2022-04-13 20:29:15,764][0m Trial 292 finished with value: 0.25 and parameters: {'loss': 'coxph', 'learning_rate': 1.6331932554159714e-06, 'n_estimators': 997, 'criterion': 'friedman_mse', 'min_samples_split': 8, 'min_samples_leaf': 3, 'min_weight_fraction_leaf': 0.02774200529162324, 'min_impurity_decrease': 0.6561823296449072, 'max_features': 0.7720618442407194, 'subsample': 0.9803952875158981, 'dropout_rate': 0.5906603739829932, 'ccp_alpha': 3.6503462606539916}. Best is trial 138 with value: 0.731155530669601.[0m
[32m[I 2022-04-13 20:31:24,563][0m Trial 293 finished with value: 0.25 and parameters: {'loss': 'coxph', 'learning_rate': 1.4634394097971827e-06, 'n_estimators': 602, 'criterion': 'friedman_mse', 'min_samples_split': 9, 'min_samples_leaf': 3, 'min_weight_fraction_leaf': 0.4989296080996676, 'min_impurity_decrease': 0.6376791229535974, 'max_features': 0.7809551293822795, 'subsample': 0.15760665992168524, 'dropout_rate': 0.6044652191097619, 'ccp_alpha': 3.904913529571767}. Best is trial 138 with value: 0.731155530669601.[0m
[32m[I 2022-04-13 20:37:25,992][0m Trial 294 finished with value: 0.25 and parameters: {'loss': 'coxph', 'learning_rate': 1.0220884833654079e-06, 'n_estimators': 890, 'criterion': 'friedman_mse', 'min_samples_split': 8, 'min_samples_leaf': 5, 'min_weight_fraction_leaf': 0.31378814177374736, 'min_impurity_decrease': 0.4062764174770663, 'max_features': 0.7168516708835081, 'subsample': 0.9932470435902934, 'dropout_rate': 0.08982856894898936, 'ccp_alpha': 4.0344210381202155}. Best is trial 138 with value: 0.731155530669601.[0m
[32m[I 2022-04-13 20:40:51,018][0m Trial 295 finished with value: 0.25 and parameters: {'loss': 'coxph', 'learning_rate': 1.8957786071886846e-06, 'n_estimators': 918, 'criterion': 'friedman_mse', 'min_samples_split': 8, 'min_samples_leaf': 3, 'min_weight_fraction_leaf': 0.3291294060549424, 'min_impurity_decrease': 0.6808457191854534, 'max_features': 0.025554499056599487, 'subsample': 0.7417205992614209, 'dropout_rate': 0.6180601354107933, 'ccp_alpha': 4.140245729787805}. Best is trial 138 with value: 0.731155530669601.[0m
[32m[I 2022-04-13 20:44:09,084][0m Trial 296 finished with value: 0.764096187994334 and parameters: {'loss': 'coxph', 'learning_rate': 2.360718467630412e-06, 'n_estimators': 761, 'criterion': 'friedman_mse', 'min_samples_split': 8, 'min_samples_leaf': 3, 'min_weight_fraction_leaf': 0.3414293017439092, 'min_impurity_decrease': 0.6187465035423942, 'max_features': 0.2406228325102755, 'subsample': 0.05313966334702004, 'dropout_rate': 0.49137043361162475, 'ccp_alpha': 0.2057344307024982}. Best is trial 296 with value: 0.764096187994334.[0m
[32m[I 2022-04-13 20:48:06,889][0m Trial 297 finished with value: 0.25 and parameters: {'loss': 'coxph', 'learning_rate': 2.3645408077574146e-06, 'n_estimators': 927, 'criterion': 'friedman_mse', 'min_samples_split': 8, 'min_samples_leaf': 3, 'min_weight_fraction_leaf': 0.34050818965575286, 'min_impurity_decrease': 0.6164345169522578, 'max_features': 0.24287046662555684, 'subsample': 0.7715511044410829, 'dropout_rate': 0.503072297090077, 'ccp_alpha': 0.2863429084856091}. Best is trial 296 with value: 0.764096187994334.[0m
[32m[I 2022-04-13 20:51:29,496][0m Trial 298 finished with value: 0.6371812073302544 and parameters: {'loss': 'coxph', 'learning_rate': 2.068060239226302e-06, 'n_estimators': 787, 'criterion': 'friedman_mse', 'min_samples_split': 6, 'min_samples_leaf': 2, 'min_weight_fraction_leaf': 0.33093659627664557, 'min_impurity_decrease': 0.4152477970162041, 'max_features': 0.8338107484214108, 'subsample': 0.9671789469872417, 'dropout_rate': 0.515556063994681, 'ccp_alpha': 0.0825785834610734}. Best is trial 296 with value: 0.764096187994334.[0m
[32m[I 2022-04-13 20:55:01,860][0m Trial 299 finished with value: 0.6371812073302544 and parameters: {'loss': 'coxph', 'learning_rate': 3.5543179940256226e-06, 'n_estimators': 774, 'criterion': 'friedman_mse', 'min_samples_split': 6, 'min_samples_leaf': 2, 'min_weight_fraction_leaf': 0.3292576751440822, 'min_impurity_decrease': 0.41303258298563467, 'max_features': 0.8089149326833928, 'subsample': 0.9713964269132815, 'dropout_rate': 0.5121650618473519, 'ccp_alpha': 0.15226519214538797}. Best is trial 296 with value: 0.764096187994334.[0m
[32m[I 2022-04-13 20:59:07,961][0m Trial 300 finished with value: 0.7761470796392778 and parameters: {'loss': 'coxph', 'learning_rate': 3.449537304659525e-06, 'n_estimators': 781, 'criterion': 'friedman_mse', 'min_samples_split': 8, 'min_samples_leaf': 2, 'min_weight_fraction_leaf': 0.33466398709566947, 'min_impurity_decrease': 0.4097348087640345, 'max_features': 0.8333347977944717, 'subsample': 0.035012867403614284, 'dropout_rate': 0.5147440845468279, 'ccp_alpha': 0.23227432571851026}. Best is trial 300 with value: 0.7761470796392778.[0m
[32m[I 2022-04-13 21:03:04,132][0m Trial 301 finished with value: 0.7799636929228214 and parameters: {'loss': 'coxph', 'learning_rate': 2.1272408449265622e-06, 'n_estimators': 752, 'criterion': 'friedman_mse', 'min_samples_split': 8, 'min_samples_leaf': 2, 'min_weight_fraction_leaf': 0.33054878837214147, 'min_impurity_decrease': 0.402225968987528, 'max_features': 0.8173291863941243, 'subsample': 0.04199084330902066, 'dropout_rate': 0.5389038316672831, 'ccp_alpha': 0.11911321365038285}. Best is trial 301 with value: 0.7799636929228214.[0m
[32m[I 2022-04-13 21:07:27,697][0m Trial 302 finished with value: 0.7800707928476036 and parameters: {'loss': 'coxph', 'learning_rate': 1.9521710389020637e-06, 'n_estimators': 769, 'criterion': 'friedman_mse', 'min_samples_split': 8, 'min_samples_leaf': 2, 'min_weight_fraction_leaf': 0.3308334338311278, 'min_impurity_decrease': 0.42444801803432847, 'max_features': 0.830540021139156, 'subsample': 0.028159910025302506, 'dropout_rate': 0.5262320400039983, 'ccp_alpha': 0.11768964712066571}. Best is trial 302 with value: 0.7800707928476036.[0m
[32m[I 2022-04-13 21:11:41,637][0m Trial 303 finished with value: 0.7804086765608305 and parameters: {'loss': 'coxph', 'learning_rate': 2.9838058742949013e-06, 'n_estimators': 774, 'criterion': 'friedman_mse', 'min_samples_split': 8, 'min_samples_leaf': 2, 'min_weight_fraction_leaf': 0.3353590062890476, 'min_impurity_decrease': 0.4099112936592036, 'max_features': 0.8284055103669283, 'subsample': 0.04995819353981312, 'dropout_rate': 0.5121117917595641, 'ccp_alpha': 0.06867019681712637}. Best is trial 303 with value: 0.7804086765608305.[0m
[32m[I 2022-04-13 21:15:37,581][0m Trial 304 finished with value: 0.7787476210990799 and parameters: {'loss': 'coxph', 'learning_rate': 3.383783686893262e-06, 'n_estimators': 758, 'criterion': 'friedman_mse', 'min_samples_split': 8, 'min_samples_leaf': 2, 'min_weight_fraction_leaf': 0.3308825676273533, 'min_impurity_decrease': 0.37837245141819015, 'max_features': 0.8199447214709373, 'subsample': 0.031088259689636254, 'dropout_rate': 0.5213036719521558, 'ccp_alpha': 0.08324392776364313}. Best is trial 303 with value: 0.7804086765608305.[0m
[32m[I 2022-04-13 21:18:27,744][0m Trial 305 finished with value: -0.36832349438639966 and parameters: {'loss': 'squared', 'learning_rate': 3.4049080284513387e-06, 'n_estimators': 760, 'criterion': 'friedman_mse', 'min_samples_split': 8, 'min_samples_leaf': 2, 'min_weight_fraction_leaf': 0.33388175018280186, 'min_impurity_decrease': 0.4099929086247071, 'max_features': 0.8193517233699962, 'subsample': 0.04019139458941509, 'dropout_rate': 0.49811707088051205, 'ccp_alpha': 0.1196802143767082}. Best is trial 303 with value: 0.7804086765608305.[0m
[32m[I 2022-04-13 21:22:33,694][0m Trial 306 finished with value: 0.25 and parameters: {'loss': 'coxph', 'learning_rate': 2.03908071561181e-06, 'n_estimators': 794, 'criterion': 'friedman_mse', 'min_samples_split': 8, 'min_samples_leaf': 2, 'min_weight_fraction_leaf': 0.3174040809593001, 'min_impurity_decrease': 0.3905936123469345, 'max_features': 0.8357828086276257, 'subsample': 0.009361234646678075, 'dropout_rate': 0.5206748261734647, 'ccp_alpha': 0.07699041394264379}. Best is trial 303 with value: 0.7804086765608305.[0m
[32m[I 2022-04-13 21:26:57,632][0m Trial 307 finished with value: 0.7799329362661882 and parameters: {'loss': 'coxph', 'learning_rate': 2.6984998669470487e-06, 'n_estimators': 827, 'criterion': 'friedman_mse', 'min_samples_split': 8, 'min_samples_leaf': 2, 'min_weight_fraction_leaf': 0.3421357122375364, 'min_impurity_decrease': 0.3700568824854922, 'max_features': 0.8005289126150067, 'subsample': 0.041092996976521204, 'dropout_rate': 0.5213840619055339, 'ccp_alpha': 0.024723625722372522}. Best is trial 303 with value: 0.7804086765608305.[0m
[32m[I 2022-04-13 21:31:00,340][0m Trial 308 finished with value: 0.7801061449224971 and parameters: {'loss': 'coxph', 'learning_rate': 2.7806071879908854e-06, 'n_estimators': 833, 'criterion': 'friedman_mse', 'min_samples_split': 8, 'min_samples_leaf': 2, 'min_weight_fraction_leaf': 0.340735650329521, 'min_impurity_decrease': 0.37137732857054084, 'max_features': 0.8048345177705439, 'subsample': 0.038611854496774504, 'dropout_rate': 0.5227735607413224, 'ccp_alpha': 0.22264430590845702}. Best is trial 303 with value: 0.7804086765608305.[0m
[32m[I 2022-04-13 21:35:22,200][0m Trial 309 finished with value: 0.778847346934134 and parameters: {'loss': 'coxph', 'learning_rate': 2.4576199136343744e-06, 'n_estimators': 830, 'criterion': 'friedman_mse', 'min_samples_split': 8, 'min_samples_leaf': 2, 'min_weight_fraction_leaf': 0.3477188050731066, 'min_impurity_decrease': 0.38172338964361, 'max_features': 0.8064606080318447, 'subsample': 0.04601602002360715, 'dropout_rate': 0.5251430175119822, 'ccp_alpha': 0.20612734368180005}. Best is trial 303 with value: 0.7804086765608305.[0m
[32m[I 2022-04-13 21:40:07,523][0m Trial 310 finished with value: 0.7803636842151913 and parameters: {'loss': 'coxph', 'learning_rate': 4.104910394126138e-06, 'n_estimators': 824, 'criterion': 'friedman_mse', 'min_samples_split': 8, 'min_samples_leaf': 2, 'min_weight_fraction_leaf': 0.34240652107596603, 'min_impurity_decrease': 0.42302042871110757, 'max_features': 0.807380230125053, 'subsample': 0.048118464522468526, 'dropout_rate': 0.5247049578408124, 'ccp_alpha': 0.00935508071113545}. Best is trial 303 with value: 0.7804086765608305.[0m
[32m[I 2022-04-13 21:44:35,822][0m Trial 311 finished with value: 0.7792338867633191 and parameters: {'loss': 'coxph', 'learning_rate': 4.00376403747372e-06, 'n_estimators': 831, 'criterion': 'friedman_mse', 'min_samples_split': 8, 'min_samples_leaf': 2, 'min_weight_fraction_leaf': 0.3461070782930177, 'min_impurity_decrease': 0.37384087594974846, 'max_features': 0.8079137915213, 'subsample': 0.04566410538011959, 'dropout_rate': 0.5253755399500006, 'ccp_alpha': 0.20096550788299217}. Best is trial 303 with value: 0.7804086765608305.[0m
[32m[I 2022-04-13 21:48:57,929][0m Trial 312 finished with value: 0.7797520195656744 and parameters: {'loss': 'coxph', 'learning_rate': 3.571049811529754e-06, 'n_estimators': 828, 'criterion': 'friedman_mse', 'min_samples_split': 8, 'min_samples_leaf': 2, 'min_weight_fraction_leaf': 0.34505328852063255, 'min_impurity_decrease': 0.4199054420221368, 'max_features': 0.8073426526514534, 'subsample': 0.05394805975648324, 'dropout_rate': 0.5258685246644826, 'ccp_alpha': 0.20527151802975857}. Best is trial 303 with value: 0.7804086765608305.[0m
[32m[I 2022-04-13 21:52:23,427][0m Trial 313 finished with value: 0.7802487623953323 and parameters: {'loss': 'coxph', 'learning_rate': 4.073393621318701e-06, 'n_estimators': 765, 'criterion': 'friedman_mse', 'min_samples_split': 8, 'min_samples_leaf': 2, 'min_weight_fraction_leaf': 0.344023481479309, 'min_impurity_decrease': 0.36851469685519284, 'max_features': 0.8322697183349516, 'subsample': 0.044999540398307905, 'dropout_rate': 0.5157820167796254, 'ccp_alpha': 0.19122567440682503}. Best is trial 303 with value: 0.7804086765608305.[0m
[32m[I 2022-04-13 21:55:32,949][0m Trial 314 finished with value: 0.7795639699865518 and parameters: {'loss': 'coxph', 'learning_rate': 4.54609965422721e-06, 'n_estimators': 759, 'criterion': 'friedman_mse', 'min_samples_split': 8, 'min_samples_leaf': 2, 'min_weight_fraction_leaf': 0.34285553395207735, 'min_impurity_decrease': 0.36881555456862253, 'max_features': 0.8128151114840367, 'subsample': 0.04636934768449904, 'dropout_rate': 0.518061044395303, 'ccp_alpha': 0.197196620441772}. Best is trial 303 with value: 0.7804086765608305.[0m
[32m[I 2022-04-13 21:59:21,791][0m Trial 315 finished with value: 0.7791231986614147 and parameters: {'loss': 'coxph', 'learning_rate': 4.230427376300018e-06, 'n_estimators': 825, 'criterion': 'friedman_mse', 'min_samples_split': 8, 'min_samples_leaf': 2, 'min_weight_fraction_leaf': 0.34306307539667963, 'min_impurity_decrease': 0.42077413558291316, 'max_features': 0.8188694515385928, 'subsample': 0.04991405675580682, 'dropout_rate': 0.523573680270835, 'ccp_alpha': 0.19729703820897992}. Best is trial 303 with value: 0.7804086765608305.[0m
[32m[I 2022-04-13 22:03:02,552][0m Trial 316 finished with value: 0.7794095455547205 and parameters: {'loss': 'coxph', 'learning_rate': 4.619806780700364e-06, 'n_estimators': 826, 'criterion': 'friedman_mse', 'min_samples_split': 8, 'min_samples_leaf': 2, 'min_weight_fraction_leaf': 0.3461274445328471, 'min_impurity_decrease': 0.36784311873156894, 'max_features': 0.8075429806453848, 'subsample': 0.046853841808400305, 'dropout_rate': 0.519829752366591, 'ccp_alpha': 0.20168518450642592}. Best is trial 303 with value: 0.7804086765608305.[0m
[32m[I 2022-04-13 22:06:14,654][0m Trial 317 finished with value: 0.7815705261705512 and parameters: {'loss': 'coxph', 'learning_rate': 4.706167638965535e-06, 'n_estimators': 769, 'criterion': 'friedman_mse', 'min_samples_split': 8, 'min_samples_leaf': 2, 'min_weight_fraction_leaf': 0.34591671635273985, 'min_impurity_decrease': 0.3753031442581544, 'max_features': 0.8055741275347711, 'subsample': 0.0526113123558293, 'dropout_rate': 0.5246478184367712, 'ccp_alpha': 0.19371286539966448}. Best is trial 317 with value: 0.7815705261705512.[0m
[32m[I 2022-04-13 22:09:31,813][0m Trial 318 finished with value: 0.7794994597281928 and parameters: {'loss': 'coxph', 'learning_rate': 4.773588170235229e-06, 'n_estimators': 781, 'criterion': 'friedman_mse', 'min_samples_split': 8, 'min_samples_leaf': 2, 'min_weight_fraction_leaf': 0.34662322998281864, 'min_impurity_decrease': 0.3694873290424713, 'max_features': 0.8084892698297428, 'subsample': 0.048751654103141286, 'dropout_rate': 0.5241969165586778, 'ccp_alpha': 0.1981480615705313}. Best is trial 317 with value: 0.7815705261705512.[0m
[32m[I 2022-04-13 22:12:51,331][0m Trial 319 finished with value: 0.7794884945721863 and parameters: {'loss': 'coxph', 'learning_rate': 4.120381662889233e-06, 'n_estimators': 778, 'criterion': 'friedman_mse', 'min_samples_split': 8, 'min_samples_leaf': 2, 'min_weight_fraction_leaf': 0.34695881773609016, 'min_impurity_decrease': 0.36813441296119254, 'max_features': 0.8083963525048886, 'subsample': 0.04607473129984116, 'dropout_rate': 0.5227564900280063, 'ccp_alpha': 0.20246306622140636}. Best is trial 317 with value: 0.7815705261705512.[0m
[32m[I 2022-04-13 22:16:02,026][0m Trial 320 finished with value: 0.7802774691165039 and parameters: {'loss': 'coxph', 'learning_rate': 4.909002693851556e-06, 'n_estimators': 773, 'criterion': 'friedman_mse', 'min_samples_split': 8, 'min_samples_leaf': 2, 'min_weight_fraction_leaf': 0.34656042784480107, 'min_impurity_decrease': 0.3659995271220292, 'max_features': 0.8090073492742162, 'subsample': 0.04559236312982317, 'dropout_rate': 0.5230932707432878, 'ccp_alpha': 0.17602904132417024}. Best is trial 317 with value: 0.7815705261705512.[0m
[32m[I 2022-04-13 22:19:13,689][0m Trial 321 finished with value: 0.7788455010068962 and parameters: {'loss': 'coxph', 'learning_rate': 4.627648627900861e-06, 'n_estimators': 781, 'criterion': 'friedman_mse', 'min_samples_split': 8, 'min_samples_leaf': 2, 'min_weight_fraction_leaf': 0.3447244040585366, 'min_impurity_decrease': 0.3663920206942566, 'max_features': 0.8060827981145243, 'subsample': 0.04729687978514596, 'dropout_rate': 0.5149656707028075, 'ccp_alpha': 0.2058641153947648}. Best is trial 317 with value: 0.7815705261705512.[0m
[32m[I 2022-04-13 22:22:26,380][0m Trial 322 finished with value: 0.7791016927095352 and parameters: {'loss': 'coxph', 'learning_rate': 4.696976752125695e-06, 'n_estimators': 776, 'criterion': 'friedman_mse', 'min_samples_split': 8, 'min_samples_leaf': 2, 'min_weight_fraction_leaf': 0.34801634055208147, 'min_impurity_decrease': 0.36693370081155063, 'max_features': 0.8333691808579191, 'subsample': 0.04716263567605237, 'dropout_rate': 0.5221181719975475, 'ccp_alpha': 0.20835142554838573}. Best is trial 317 with value: 0.7815705261705512.[0m
[32m[I 2022-04-13 22:25:21,861][0m Trial 323 finished with value: 0.7799131156709355 and parameters: {'loss': 'coxph', 'learning_rate': 4.123273505759971e-06, 'n_estimators': 751, 'criterion': 'friedman_mse', 'min_samples_split': 8, 'min_samples_leaf': 2, 'min_weight_fraction_leaf': 0.34658485645426346, 'min_impurity_decrease': 0.36339376384281796, 'max_features': 0.8113862578845348, 'subsample': 0.04635191788982279, 'dropout_rate': 0.5217525724890493, 'ccp_alpha': 0.19309620872222932}. Best is trial 317 with value: 0.7815705261705512.[0m
[32m[I 2022-04-13 22:28:10,492][0m Trial 324 finished with value: 0.7815006109006057 and parameters: {'loss': 'coxph', 'learning_rate': 4.932461237421835e-06, 'n_estimators': 743, 'criterion': 'friedman_mse', 'min_samples_split': 8, 'min_samples_leaf': 2, 'min_weight_fraction_leaf': 0.34774286941078186, 'min_impurity_decrease': 0.3726926046074144, 'max_features': 0.8072739257267971, 'subsample': 0.051932289509425224, 'dropout_rate': 0.5267364417323228, 'ccp_alpha': 0.2006819945786379}. Best is trial 317 with value: 0.7815705261705512.[0m
[32m[I 2022-04-13 22:31:04,494][0m Trial 325 finished with value: 0.7788379125039283 and parameters: {'loss': 'coxph', 'learning_rate': 4.920571917479294e-06, 'n_estimators': 740, 'criterion': 'friedman_mse', 'min_samples_split': 8, 'min_samples_leaf': 2, 'min_weight_fraction_leaf': 0.3466368963274544, 'min_impurity_decrease': 0.367777777510655, 'max_features': 0.809402845091482, 'subsample': 0.05044282277119923, 'dropout_rate': 0.5368692673187971, 'ccp_alpha': 0.1994528905120004}. Best is trial 317 with value: 0.7815705261705512.[0m
[32m[I 2022-04-13 22:33:56,664][0m Trial 326 finished with value: 0.7786020982506632 and parameters: {'loss': 'coxph', 'learning_rate': 4.978775432063778e-06, 'n_estimators': 735, 'criterion': 'friedman_mse', 'min_samples_split': 8, 'min_samples_leaf': 2, 'min_weight_fraction_leaf': 0.34714570940206063, 'min_impurity_decrease': 0.3613437423490622, 'max_features': 0.813218801734157, 'subsample': 0.04490303830980315, 'dropout_rate': 0.5399472015579588, 'ccp_alpha': 0.2154526701096904}. Best is trial 317 with value: 0.7815705261705512.[0m
[32m[I 2022-04-13 22:37:00,531][0m Trial 327 finished with value: 0.7779499320646652 and parameters: {'loss': 'coxph', 'learning_rate': 4.849068016081304e-06, 'n_estimators': 738, 'criterion': 'friedman_mse', 'min_samples_split': 8, 'min_samples_leaf': 2, 'min_weight_fraction_leaf': 0.3487310973502728, 'min_impurity_decrease': 0.3640927312072982, 'max_features': 0.8146142277883465, 'subsample': 0.031862868628986005, 'dropout_rate': 0.5322312864942382, 'ccp_alpha': 0.22133549282502676}. Best is trial 317 with value: 0.7815705261705512.[0m
[32m[I 2022-04-13 22:38:42,891][0m Trial 328 finished with value: -0.3615899609510659 and parameters: {'loss': 'squared', 'learning_rate': 4.899340033593166e-06, 'n_estimators': 740, 'criterion': 'friedman_mse', 'min_samples_split': 8, 'min_samples_leaf': 2, 'min_weight_fraction_leaf': 0.348325482699661, 'min_impurity_decrease': 0.36666860648239236, 'max_features': 0.8069390946171353, 'subsample': 0.05702068890726697, 'dropout_rate': 0.5352775596212341, 'ccp_alpha': 0.3991988037473555}. Best is trial 317 with value: 0.7815705261705512.[0m
[32m[I 2022-04-13 22:42:09,110][0m Trial 329 finished with value: 0.7783771795505613 and parameters: {'loss': 'coxph', 'learning_rate': 5.1219281737678824e-06, 'n_estimators': 816, 'criterion': 'friedman_mse', 'min_samples_split': 8, 'min_samples_leaf': 2, 'min_weight_fraction_leaf': 0.34823152646553646, 'min_impurity_decrease': 0.37026450641924136, 'max_features': 0.8198769167330624, 'subsample': 0.020278337023658218, 'dropout_rate': 0.5361905506882623, 'ccp_alpha': 0.19243076318217842}. Best is trial 317 with value: 0.7815705261705512.[0m
