[32m[I 2022-04-18 17:29:33,774][0m Trial 914 finished with value: 0.7737125117674999 and parameters: {'n_hidden': 128, 'mixture_components': 10, 'use_sparse_layer': True, 'use_sparse_loss': True, 'lmbd': 1.272988392283604e-05, 'use_batchnorm': True, 'use_dropout': True, 'dropout': 0.7371815806761413, 'mlp_size_1': 1, 'mlp_size_2': 3, 'mlp_size_3': 0, 'kernel': 'Exponential', 'loss_name': 'AlternativeNLLLoss'}. Best is trial 861 with value: 0.7786620056496094.[0m
[32m[I 2022-04-18 17:31:19,802][0m Trial 915 finished with value: -1.0 and parameters: {'n_hidden': 256, 'mixture_components': 10, 'use_sparse_layer': True, 'use_sparse_loss': True, 'lmbd': 5.08477292980221e-05, 'use_batchnorm': True, 'use_dropout': True, 'dropout': 0.8104606376639806, 'mlp_size_1': 1, 'mlp_size_2': 4, 'mlp_size_3': 0, 'kernel': 'Gumbel', 'loss_name': 'AlternativeNLLLoss'}. Best is trial 861 with value: 0.7786620056496094.[0m
[32m[I 2022-04-18 17:34:12,037][0m Trial 916 finished with value: 0.7718323927097093 and parameters: {'n_hidden': 256, 'mixture_components': 10, 'use_sparse_layer': True, 'use_sparse_loss': True, 'lmbd': 7.44286217374474e-05, 'use_batchnorm': True, 'use_dropout': True, 'dropout': 0.7368143869877727, 'mlp_size_1': 1, 'mlp_size_2': 4, 'mlp_size_3': 0, 'kernel': 'Exponential', 'loss_name': 'AlternativeNLLLoss'}. Best is trial 861 with value: 0.7786620056496094.[0m
[32m[I 2022-04-18 17:37:03,774][0m Trial 917 finished with value: 0.7667098080311896 and parameters: {'n_hidden': 256, 'mixture_components': 10, 'use_sparse_layer': True, 'use_sparse_loss': True, 'lmbd': 6.328453617718008e-06, 'use_batchnorm': True, 'use_dropout': True, 'dropout': 0.7733578797737368, 'mlp_size_1': 1, 'mlp_size_2': 4, 'mlp_size_3': 0, 'kernel': 'Exponential', 'loss_name': 'AlternativeNLLLoss'}. Best is trial 861 with value: 0.7786620056496094.[0m
[32m[I 2022-04-18 17:40:01,535][0m Trial 918 finished with value: 0.7738705206144827 and parameters: {'n_hidden': 256, 'mixture_components': 10, 'use_sparse_layer': True, 'use_sparse_loss': True, 'lmbd': 2.2370790174082657e-05, 'use_batchnorm': True, 'use_dropout': True, 'dropout': 0.7285331625432482, 'mlp_size_1': 1, 'mlp_size_2': 4, 'mlp_size_3': 0, 'kernel': 'Exponential', 'loss_name': 'AlternativeNLLLoss'}. Best is trial 861 with value: 0.7786620056496094.[0m
[32m[I 2022-04-18 17:42:52,455][0m Trial 919 finished with value: 0.7717521268979419 and parameters: {'n_hidden': 256, 'mixture_components': 10, 'use_sparse_layer': True, 'use_sparse_loss': True, 'lmbd': 3.387007286540953e-05, 'use_batchnorm': True, 'use_dropout': True, 'dropout': 0.754677062708517, 'mlp_size_1': 1, 'mlp_size_2': 4, 'mlp_size_3': 0, 'kernel': 'Exponential', 'loss_name': 'AlternativeNLLLoss'}. Best is trial 861 with value: 0.7786620056496094.[0m
[32m[I 2022-04-18 17:45:38,741][0m Trial 920 finished with value: 0.7678929207287339 and parameters: {'n_hidden': 256, 'mixture_components': 10, 'use_sparse_layer': True, 'use_sparse_loss': True, 'lmbd': 9.073680063152498e-05, 'use_batchnorm': True, 'use_dropout': True, 'dropout': 0.7916642075934853, 'mlp_size_1': 1, 'mlp_size_2': 4, 'mlp_size_3': 0, 'kernel': 'Exponential', 'loss_name': 'AlternativeNLLLoss'}. Best is trial 861 with value: 0.7786620056496094.[0m
[32m[I 2022-04-18 17:50:12,598][0m Trial 921 finished with value: 0.68580631029458 and parameters: {'n_hidden': 256, 'mixture_components': 10, 'use_sparse_layer': True, 'use_sparse_loss': True, 'lmbd': 1.8155404271147166e-05, 'use_batchnorm': True, 'use_dropout': True, 'dropout': 0.7673610527653498, 'mlp_size_1': 1, 'mlp_size_2': 4, 'mlp_size_3': 0, 'kernel': 'Weibull', 'loss_name': 'NLLLoss'}. Best is trial 861 with value: 0.7786620056496094.[0m
[32m[I 2022-04-18 17:52:57,978][0m Trial 922 finished with value: 0.7560346207228001 and parameters: {'n_hidden': 256, 'mixture_components': 10, 'use_sparse_layer': True, 'use_sparse_loss': True, 'lmbd': 1.1457601479768773e-05, 'use_batchnorm': True, 'use_dropout': True, 'dropout': 0.32918424942736935, 'mlp_size_1': 1, 'mlp_size_2': 4, 'mlp_size_3': 0, 'kernel': 'Exponential', 'loss_name': 'AlternativeNLLLoss'}. Best is trial 861 with value: 0.7786620056496094.[0m
[32m[I 2022-04-18 17:55:47,666][0m Trial 923 finished with value: 0.7660742648977152 and parameters: {'n_hidden': 256, 'mixture_components': 10, 'use_sparse_layer': True, 'use_sparse_loss': True, 'lmbd': 1.504860307424325e-05, 'use_batchnorm': True, 'use_dropout': True, 'dropout': 0.442989858317025, 'mlp_size_1': 1, 'mlp_size_2': 4, 'mlp_size_3': 0, 'kernel': 'Exponential', 'loss_name': 'AlternativeNLLLoss'}. Best is trial 861 with value: 0.7786620056496094.[0m
[32m[I 2022-04-18 17:58:20,886][0m Trial 924 finished with value: 0.7513702314559725 and parameters: {'n_hidden': 256, 'mixture_components': 10, 'use_sparse_layer': True, 'use_sparse_loss': True, 'lmbd': 2.6646051816932427e-05, 'use_batchnorm': True, 'use_dropout': False, 'mlp_size_1': 1, 'mlp_size_2': 4, 'mlp_size_3': 0, 'kernel': 'Exponential', 'loss_name': 'AlternativeNLLLoss'}. Best is trial 861 with value: 0.7786620056496094.[0m
[32m[I 2022-04-18 18:01:16,693][0m Trial 925 finished with value: 0.7701547123035903 and parameters: {'n_hidden': 256, 'mixture_components': 10, 'use_sparse_layer': True, 'use_sparse_loss': True, 'lmbd': 4.395870694604871e-06, 'use_batchnorm': True, 'use_dropout': True, 'dropout': 0.7353084307312191, 'mlp_size_1': 1, 'mlp_size_2': 4, 'mlp_size_3': 0, 'kernel': 'Exponential', 'loss_name': 'AlternativeNLLLoss'}. Best is trial 861 with value: 0.7786620056496094.[0m
[32m[I 2022-04-18 18:06:11,122][0m Trial 926 finished with value: 0.7723540398719574 and parameters: {'n_hidden': 256, 'mixture_components': 10, 'use_sparse_layer': True, 'use_sparse_loss': True, 'lmbd': 7.664584521515552e-06, 'use_batchnorm': True, 'use_dropout': True, 'dropout': 0.7493713725999798, 'mlp_size_1': 1, 'mlp_size_2': 4, 'mlp_size_3': 0, 'kernel': 'LogNormal', 'loss_name': 'AlternativeNLLLoss'}. Best is trial 861 with value: 0.7786620056496094.[0m
[32m[I 2022-04-18 18:09:01,048][0m Trial 927 finished with value: 0.7685871977043697 and parameters: {'n_hidden': 256, 'mixture_components': 10, 'use_sparse_layer': True, 'use_sparse_loss': True, 'lmbd': 4.682385578078784e-05, 'use_batchnorm': True, 'use_dropout': True, 'dropout': 0.8303745409951422, 'mlp_size_1': 1, 'mlp_size_2': 4, 'mlp_size_3': 0, 'kernel': 'Exponential', 'loss_name': 'AlternativeNLLLoss'}. Best is trial 861 with value: 0.7786620056496094.[0m
[32m[I 2022-04-18 18:11:43,197][0m Trial 928 finished with value: 0.7634256708660236 and parameters: {'n_hidden': 256, 'mixture_components': 10, 'use_sparse_layer': True, 'use_sparse_loss': True, 'lmbd': 3.286564322421478e-05, 'use_batchnorm': True, 'use_dropout': True, 'dropout': 0.7982493807470119, 'mlp_size_1': 1, 'mlp_size_2': 4, 'mlp_size_3': 0, 'kernel': 'Exponential', 'loss_name': 'AlternativeNLLLoss'}. Best is trial 861 with value: 0.7786620056496094.[0m
[32m[I 2022-04-18 18:14:29,066][0m Trial 929 finished with value: 0.7510813867729307 and parameters: {'n_hidden': 256, 'mixture_components': 10, 'use_sparse_layer': True, 'use_sparse_loss': True, 'lmbd': 1.0463821645273664e-05, 'use_batchnorm': True, 'use_dropout': True, 'dropout': 0.13151959905431532, 'mlp_size_1': 1, 'mlp_size_2': 4, 'mlp_size_3': 0, 'kernel': 'Exponential', 'loss_name': 'AlternativeNLLLoss'}. Best is trial 861 with value: 0.7786620056496094.[0m
[32m[I 2022-04-18 18:17:17,470][0m Trial 930 finished with value: 0.7693091372806652 and parameters: {'n_hidden': 256, 'mixture_components': 10, 'use_sparse_layer': True, 'use_sparse_loss': True, 'lmbd': 1.95496945524137e-05, 'use_batchnorm': True, 'use_dropout': True, 'dropout': 0.7794347789554023, 'mlp_size_1': 1, 'mlp_size_2': 4, 'mlp_size_3': 0, 'kernel': 'Exponential', 'loss_name': 'AlternativeNLLLoss'}. Best is trial 861 with value: 0.7786620056496094.[0m
[32m[I 2022-04-18 18:21:55,318][0m Trial 931 finished with value: 0.7075709102210345 and parameters: {'n_hidden': 256, 'mixture_components': 10, 'use_sparse_layer': True, 'use_sparse_loss': True, 'lmbd': 5.372481353382468e-06, 'use_batchnorm': True, 'use_dropout': True, 'dropout': 0.7212037914856163, 'mlp_size_1': 1, 'mlp_size_2': 4, 'mlp_size_3': 0, 'kernel': 'Logistic', 'loss_name': 'AlternativeNLLLoss'}. Best is trial 861 with value: 0.7786620056496094.[0m
[32m[I 2022-04-18 18:24:50,762][0m Trial 932 finished with value: 0.7701777015645144 and parameters: {'n_hidden': 256, 'mixture_components': 10, 'use_sparse_layer': True, 'use_sparse_loss': True, 'lmbd': 1.452310096764634e-05, 'use_batchnorm': True, 'use_dropout': True, 'dropout': 0.7577662600498745, 'mlp_size_1': 1, 'mlp_size_2': 4, 'mlp_size_3': 0, 'kernel': 'Exponential', 'loss_name': 'AlternativeNLLLoss'}. Best is trial 861 with value: 0.7786620056496094.[0m
[32m[I 2022-04-18 18:27:51,684][0m Trial 933 finished with value: 0.7712858336367898 and parameters: {'n_hidden': 256, 'mixture_components': 10, 'use_sparse_layer': True, 'use_sparse_loss': True, 'lmbd': 5.767100588759365e-05, 'use_batchnorm': True, 'use_dropout': True, 'dropout': 0.7326572810944552, 'mlp_size_1': 1, 'mlp_size_2': 4, 'mlp_size_3': 0, 'kernel': 'Exponential', 'loss_name': 'AlternativeNLLLoss'}. Best is trial 861 with value: 0.7786620056496094.[0m
[32m[I 2022-04-18 18:30:38,471][0m Trial 934 finished with value: 0.7697486078162635 and parameters: {'n_hidden': 256, 'mixture_components': 10, 'use_sparse_layer': True, 'use_sparse_loss': True, 'lmbd': 3.890707198680776e-05, 'use_batchnorm': True, 'use_dropout': True, 'dropout': 0.7780625095119881, 'mlp_size_1': 1, 'mlp_size_2': 4, 'mlp_size_3': 0, 'kernel': 'Exponential', 'loss_name': 'AlternativeNLLLoss'}. Best is trial 861 with value: 0.7786620056496094.[0m
[32m[I 2022-04-18 18:34:56,033][0m Trial 935 finished with value: 0.5997487572200102 and parameters: {'n_hidden': 2048, 'mixture_components': 10, 'use_sparse_layer': True, 'use_sparse_loss': True, 'lmbd': 2.496957040746054e-05, 'use_batchnorm': True, 'use_dropout': True, 'dropout': 0.8162208587690375, 'mlp_size_1': 0, 'mlp_size_2': 5, 'mlp_size_3': 3, 'kernel': 'Normal', 'loss_name': 'AlternativeNLLLoss'}. Best is trial 861 with value: 0.7786620056496094.[0m
[32m[I 2022-04-18 18:37:53,143][0m Trial 936 finished with value: 0.7729662341451526 and parameters: {'n_hidden': 256, 'mixture_components': 10, 'use_sparse_layer': True, 'use_sparse_loss': True, 'lmbd': 8.425311495865009e-06, 'use_batchnorm': True, 'use_dropout': True, 'dropout': 0.7463791786267492, 'mlp_size_1': 1, 'mlp_size_2': 4, 'mlp_size_3': 0, 'kernel': 'Exponential', 'loss_name': 'AlternativeNLLLoss'}. Best is trial 861 with value: 0.7786620056496094.[0m
[32m[I 2022-04-18 18:43:18,293][0m Trial 937 finished with value: 0.7601747674350653 and parameters: {'n_hidden': 32, 'mixture_components': 10, 'use_sparse_layer': True, 'use_sparse_loss': True, 'lmbd': 0.00015597418109698956, 'use_batchnorm': True, 'use_dropout': True, 'dropout': 0.71010104709884, 'mlp_size_1': 1, 'mlp_size_2': 1, 'mlp_size_3': 0, 'kernel': 'Exponential', 'loss_name': 'AlternativeNLLLoss'}. Best is trial 861 with value: 0.7786620056496094.[0m
[32m[I 2022-04-18 18:46:13,949][0m Trial 938 finished with value: 0.7720448342933957 and parameters: {'n_hidden': 256, 'mixture_components': 10, 'use_sparse_layer': True, 'use_sparse_loss': True, 'lmbd': 0.00010242885787128023, 'use_batchnorm': True, 'use_dropout': True, 'dropout': 0.7961775354683527, 'mlp_size_1': 1, 'mlp_size_2': 4, 'mlp_size_3': 0, 'kernel': 'Exponential', 'loss_name': 'AlternativeNLLLoss'}. Best is trial 861 with value: 0.7786620056496094.[0m
[32m[I 2022-04-18 18:49:11,659][0m Trial 939 finished with value: 0.6995215436219292 and parameters: {'n_hidden': 512, 'mixture_components': 10, 'use_sparse_layer': True, 'use_sparse_loss': True, 'lmbd': 1.7326066371364933e-05, 'use_batchnorm': True, 'use_dropout': True, 'dropout': 0.7286372301278129, 'mlp_size_1': 1, 'mlp_size_2': 4, 'mlp_size_3': 0, 'kernel': 'Gamma', 'loss_name': 'NLLLoss'}. Best is trial 861 with value: 0.7786620056496094.[0m
[32m[I 2022-04-18 18:52:00,414][0m Trial 940 finished with value: 0.7691267518342846 and parameters: {'n_hidden': 256, 'mixture_components': 10, 'use_sparse_layer': True, 'use_sparse_loss': True, 'lmbd': 1.3357540060379077e-05, 'use_batchnorm': True, 'use_dropout': True, 'dropout': 0.7641853870215234, 'mlp_size_1': 1, 'mlp_size_2': 4, 'mlp_size_3': 0, 'kernel': 'Exponential', 'loss_name': 'AlternativeNLLLoss'}. Best is trial 861 with value: 0.7786620056496094.[0m
[32m[I 2022-04-18 18:55:06,990][0m Trial 941 finished with value: 0.7701508911802114 and parameters: {'n_hidden': 128, 'mixture_components': 10, 'use_sparse_layer': True, 'use_sparse_loss': True, 'lmbd': 2.140424572711824e-05, 'use_batchnorm': True, 'use_dropout': True, 'dropout': 0.7409131469662377, 'mlp_size_1': 1, 'mlp_size_2': 3, 'mlp_size_3': 0, 'kernel': 'Exponential', 'loss_name': 'AlternativeNLLLoss'}. Best is trial 861 with value: 0.7786620056496094.[0m
[32m[I 2022-04-18 18:59:08,082][0m Trial 942 finished with value: 0.7173154472103196 and parameters: {'n_hidden': 256, 'mixture_components': 10, 'use_sparse_layer': True, 'use_sparse_loss': True, 'lmbd': 2.9032159634298594e-05, 'use_batchnorm': True, 'use_dropout': True, 'dropout': 0.7082358875021237, 'mlp_size_1': 1, 'mlp_size_2': 4, 'mlp_size_3': 0, 'kernel': 'LogLogistic', 'loss_name': 'AlternativeNLLLoss'}. Best is trial 861 with value: 0.7786620056496094.[0m
[32m[I 2022-04-18 19:01:29,714][0m Trial 943 finished with value: 0.7578146022318429 and parameters: {'n_hidden': 256, 'mixture_components': 10, 'use_sparse_layer': True, 'use_sparse_loss': True, 'lmbd': 9.65927702957761e-06, 'use_batchnorm': True, 'use_dropout': False, 'mlp_size_1': 1, 'mlp_size_2': 4, 'mlp_size_3': 0, 'kernel': 'Exponential', 'loss_name': 'AlternativeNLLLoss'}. Best is trial 861 with value: 0.7786620056496094.[0m
[32m[I 2022-04-18 19:04:08,067][0m Trial 944 finished with value: 0.7678669028803469 and parameters: {'n_hidden': 256, 'mixture_components': 10, 'use_sparse_layer': True, 'use_sparse_loss': True, 'lmbd': 7.373170817940954e-05, 'use_batchnorm': True, 'use_dropout': True, 'dropout': 0.7724085198591973, 'mlp_size_1': 1, 'mlp_size_2': 4, 'mlp_size_3': 0, 'kernel': 'Exponential', 'loss_name': 'AlternativeNLLLoss'}. Best is trial 861 with value: 0.7786620056496094.[0m
[32m[I 2022-04-18 19:05:45,424][0m Trial 945 finished with value: -1.0 and parameters: {'n_hidden': 256, 'mixture_components': 10, 'use_sparse_layer': True, 'use_sparse_loss': True, 'lmbd': 3.819055971603148e-05, 'use_batchnorm': True, 'use_dropout': True, 'dropout': 0.8619404738524219, 'mlp_size_1': 1, 'mlp_size_2': 4, 'mlp_size_3': 0, 'kernel': 'Gumbel', 'loss_name': 'AlternativeNLLLoss'}. Best is trial 861 with value: 0.7786620056496094.[0m
[32m[I 2022-04-18 19:08:41,836][0m Trial 946 finished with value: 0.7698626996171705 and parameters: {'n_hidden': 256, 'mixture_components': 10, 'use_sparse_layer': True, 'use_sparse_loss': True, 'lmbd': 3.418367367954003e-06, 'use_batchnorm': True, 'use_dropout': True, 'dropout': 0.7563124362356956, 'mlp_size_1': 1, 'mlp_size_2': 4, 'mlp_size_3': 0, 'kernel': 'Exponential', 'loss_name': 'AlternativeNLLLoss'}. Best is trial 861 with value: 0.7786620056496094.[0m
[32m[I 2022-04-18 19:11:24,828][0m Trial 947 finished with value: 0.7447302443170156 and parameters: {'n_hidden': 256, 'mixture_components': 10, 'use_sparse_layer': True, 'use_sparse_loss': True, 'lmbd': 4.8436407893884096e-05, 'use_batchnorm': True, 'use_dropout': True, 'dropout': 0.042903151921217575, 'mlp_size_1': 1, 'mlp_size_2': 4, 'mlp_size_3': 0, 'kernel': 'Exponential', 'loss_name': 'AlternativeNLLLoss'}. Best is trial 861 with value: 0.7786620056496094.[0m
[32m[I 2022-04-18 19:14:10,457][0m Trial 948 finished with value: 0.756629075089988 and parameters: {'n_hidden': 256, 'mixture_components': 10, 'use_sparse_layer': True, 'use_sparse_loss': True, 'lmbd': 6.871770114711079e-06, 'use_batchnorm': True, 'use_dropout': True, 'dropout': 0.0003968615907884443, 'mlp_size_1': 1, 'mlp_size_2': 4, 'mlp_size_3': 0, 'kernel': 'Exponential', 'loss_name': 'AlternativeNLLLoss'}. Best is trial 861 with value: 0.7786620056496094.[0m
[32m[I 2022-04-18 19:17:42,467][0m Trial 949 finished with value: 0.768654886521327 and parameters: {'n_hidden': 64, 'mixture_components': 10, 'use_sparse_layer': True, 'use_sparse_loss': True, 'lmbd': 1.1871417427225496e-05, 'use_batchnorm': True, 'use_dropout': True, 'dropout': 0.7278299990257908, 'mlp_size_1': 1, 'mlp_size_2': 0, 'mlp_size_3': 0, 'kernel': 'Exponential', 'loss_name': 'AlternativeNLLLoss'}. Best is trial 861 with value: 0.7786620056496094.[0m
[32m[I 2022-04-18 19:20:37,139][0m Trial 950 finished with value: 0.7711040522150515 and parameters: {'n_hidden': 256, 'mixture_components': 10, 'use_sparse_layer': True, 'use_sparse_loss': True, 'lmbd': 1.5907713133145918e-05, 'use_batchnorm': True, 'use_dropout': True, 'dropout': 0.7901573649197027, 'mlp_size_1': 1, 'mlp_size_2': 4, 'mlp_size_3': 0, 'kernel': 'Exponential', 'loss_name': 'AlternativeNLLLoss'}. Best is trial 861 with value: 0.7786620056496094.[0m
[32m[I 2022-04-18 19:23:23,663][0m Trial 951 finished with value: 0.7626378624579815 and parameters: {'n_hidden': 256, 'mixture_components': 10, 'use_sparse_layer': True, 'use_sparse_loss': True, 'lmbd': 2.285900690196587e-05, 'use_batchnorm': True, 'use_dropout': True, 'dropout': 0.8165358857894278, 'mlp_size_1': 1, 'mlp_size_2': 4, 'mlp_size_3': 0, 'kernel': 'Exponential', 'loss_name': 'AlternativeNLLLoss'}. Best is trial 861 with value: 0.7786620056496094.[0m
[32m[I 2022-04-18 19:26:23,411][0m Trial 952 finished with value: 0.7670678199274112 and parameters: {'n_hidden': 256, 'mixture_components': 10, 'use_sparse_layer': True, 'use_sparse_loss': True, 'lmbd': 0.00012433035838701293, 'use_batchnorm': True, 'use_dropout': True, 'dropout': 0.7480649865855048, 'mlp_size_1': 1, 'mlp_size_2': 4, 'mlp_size_3': 0, 'kernel': 'Exponential', 'loss_name': 'AlternativeNLLLoss'}. Best is trial 861 with value: 0.7786620056496094.[0m
[32m[I 2022-04-18 19:29:31,652][0m Trial 953 finished with value: 0.765846070946177 and parameters: {'n_hidden': 256, 'mixture_components': 10, 'use_sparse_layer': True, 'use_sparse_loss': True, 'lmbd': 3.272419199786441e-05, 'use_batchnorm': True, 'use_dropout': True, 'dropout': 0.710371539777627, 'mlp_size_1': 1, 'mlp_size_2': 4, 'mlp_size_3': 0, 'kernel': 'Exponential', 'loss_name': 'AlternativeNLLLoss'}. Best is trial 861 with value: 0.7786620056496094.[0m
[32m[I 2022-04-18 19:35:03,309][0m Trial 954 finished with value: 0.7670266870423538 and parameters: {'n_hidden': 256, 'mixture_components': 10, 'use_sparse_layer': True, 'use_sparse_loss': True, 'lmbd': 1.8811291495733614e-05, 'use_batchnorm': True, 'use_dropout': True, 'dropout': 0.7786606050889726, 'mlp_size_1': 1, 'mlp_size_2': 4, 'mlp_size_3': 0, 'kernel': 'LogNormal', 'loss_name': 'AlternativeNLLLoss'}. Best is trial 861 with value: 0.7786620056496094.[0m
[32m[I 2022-04-18 19:39:17,122][0m Trial 955 finished with value: 0.7641660057967841 and parameters: {'n_hidden': 256, 'mixture_components': 10, 'use_sparse_layer': True, 'use_sparse_loss': True, 'lmbd': 5.9975537217004586e-05, 'use_batchnorm': True, 'use_dropout': True, 'dropout': 0.7336457692271184, 'mlp_size_1': 1, 'mlp_size_2': 4, 'mlp_size_3': 0, 'kernel': 'Weibull', 'loss_name': 'AlternativeNLLLoss'}. Best is trial 861 with value: 0.7786620056496094.[0m
[32m[I 2022-04-18 19:41:52,419][0m Trial 956 finished with value: 0.7471481284675201 and parameters: {'n_hidden': 256, 'mixture_components': 10, 'use_sparse_layer': True, 'use_sparse_loss': True, 'lmbd': 9.312201779938097e-06, 'use_batchnorm': True, 'use_dropout': True, 'dropout': 0.8365946245458336, 'mlp_size_1': 1, 'mlp_size_2': 4, 'mlp_size_3': 0, 'kernel': 'Exponential', 'loss_name': 'AlternativeNLLLoss'}. Best is trial 861 with value: 0.7786620056496094.[0m
[32m[I 2022-04-18 19:44:47,936][0m Trial 957 finished with value: 0.7071092533960787 and parameters: {'n_hidden': 256, 'mixture_components': 10, 'use_sparse_layer': True, 'use_sparse_loss': True, 'lmbd': 2.7115902453730523e-05, 'use_batchnorm': True, 'use_dropout': True, 'dropout': 0.7631612256162194, 'mlp_size_1': 1, 'mlp_size_2': 4, 'mlp_size_3': 0, 'kernel': 'Exponential', 'loss_name': 'NLLLoss'}. Best is trial 861 with value: 0.7786620056496094.[0m
[32m[I 2022-04-18 19:48:12,915][0m Trial 958 finished with value: 0.7572181362451812 and parameters: {'n_hidden': 256, 'mixture_components': 10, 'use_sparse_layer': True, 'use_sparse_loss': True, 'lmbd': 1.2854680382892891e-05, 'use_batchnorm': True, 'use_dropout': True, 'dropout': 0.20270346584746002, 'mlp_size_1': 1, 'mlp_size_2': 4, 'mlp_size_3': 0, 'kernel': 'Logistic', 'loss_name': 'AlternativeNLLLoss'}. Best is trial 861 with value: 0.7786620056496094.[0m
[32m[I 2022-04-18 19:51:03,896][0m Trial 959 finished with value: 0.7678449897150547 and parameters: {'n_hidden': 256, 'mixture_components': 10, 'use_sparse_layer': True, 'use_sparse_loss': True, 'lmbd': 2.305890977860546e-06, 'use_batchnorm': True, 'use_dropout': True, 'dropout': 0.803789017681522, 'mlp_size_1': 1, 'mlp_size_2': 4, 'mlp_size_3': 0, 'kernel': 'Exponential', 'loss_name': 'AlternativeNLLLoss'}. Best is trial 861 with value: 0.7786620056496094.[0m
[32m[I 2022-04-18 19:56:07,211][0m Trial 960 finished with value: 0.7671400097151859 and parameters: {'n_hidden': 32, 'mixture_components': 10, 'use_sparse_layer': True, 'use_sparse_loss': True, 'lmbd': 4.475959325524788e-05, 'use_batchnorm': True, 'use_dropout': True, 'dropout': 0.7163085004427108, 'mlp_size_1': 1, 'mlp_size_2': 0, 'mlp_size_3': 0, 'kernel': 'Exponential', 'loss_name': 'AlternativeNLLLoss'}. Best is trial 861 with value: 0.7786620056496094.[0m
