[32m[I 2022-04-14 22:44:34,408][0m Trial 810 finished with value: 0.778685367803228 and parameters: {'loss': 'coxph', 'learning_rate': 2.077656774222296e-06, 'n_estimators': 710, 'criterion': 'friedman_mse', 'min_samples_split': 10, 'min_samples_leaf': 1, 'min_weight_fraction_leaf': 0.2502204791257315, 'min_impurity_decrease': 0.43635653097942523, 'max_features': 0.7594125495477967, 'subsample': 0.019797591050381494, 'dropout_rate': 0.669284975713805, 'ccp_alpha': 0.23517711459313706}. Best is trial 770 with value: 0.7845773442016363.[0m
[32m[I 2022-04-14 22:46:07,668][0m Trial 811 finished with value: 0.7811594226250413 and parameters: {'loss': 'coxph', 'learning_rate': 1.361910170853155e-06, 'n_estimators': 622, 'criterion': 'friedman_mse', 'min_samples_split': 10, 'min_samples_leaf': 1, 'min_weight_fraction_leaf': 0.2933737855822808, 'min_impurity_decrease': 0.38729450775478075, 'max_features': 0.7352297259165255, 'subsample': 0.04783729719853602, 'dropout_rate': 0.6617911786405675, 'ccp_alpha': 0.0929485090354373}. Best is trial 770 with value: 0.7845773442016363.[0m
[32m[I 2022-04-14 22:47:49,413][0m Trial 812 finished with value: 0.7632057989223554 and parameters: {'loss': 'coxph', 'learning_rate': 2.3521649259902987e-06, 'n_estimators': 674, 'criterion': 'friedman_mse', 'min_samples_split': 10, 'min_samples_leaf': 1, 'min_weight_fraction_leaf': 0.264331842608722, 'min_impurity_decrease': 0.4138863519818813, 'max_features': 0.8018959898583896, 'subsample': 0.034932791575519984, 'dropout_rate': 0.6929555591522765, 'ccp_alpha': 0.3508495586676922}. Best is trial 770 with value: 0.7845773442016363.[0m
[32m[I 2022-04-14 22:49:40,564][0m Trial 813 finished with value: 0.25 and parameters: {'loss': 'coxph', 'learning_rate': 1.5642089603794126e-06, 'n_estimators': 729, 'criterion': 'friedman_mse', 'min_samples_split': 10, 'min_samples_leaf': 1, 'min_weight_fraction_leaf': 0.290364802885947, 'min_impurity_decrease': 0.44959333808032914, 'max_features': 0.7961490831087527, 'subsample': 0.0020185653373312844, 'dropout_rate': 0.71002208763852, 'ccp_alpha': 0.16659154832647105}. Best is trial 770 with value: 0.7845773442016363.[0m
[32m[I 2022-04-14 22:51:41,552][0m Trial 814 finished with value: 0.7843601877900079 and parameters: {'loss': 'coxph', 'learning_rate': 2.131223918535993e-06, 'n_estimators': 731, 'criterion': 'friedman_mse', 'min_samples_split': 10, 'min_samples_leaf': 1, 'min_weight_fraction_leaf': 0.2759140562706919, 'min_impurity_decrease': 0.38561742022642037, 'max_features': 0.7789277009451656, 'subsample': 0.022021964400443884, 'dropout_rate': 0.68133411689325, 'ccp_alpha': 0.09560528829115565}. Best is trial 770 with value: 0.7845773442016363.[0m
[32m[I 2022-04-14 22:53:25,408][0m Trial 815 finished with value: 0.7683545563010995 and parameters: {'loss': 'coxph', 'learning_rate': 2.3362637550631754e-06, 'n_estimators': 725, 'criterion': 'friedman_mse', 'min_samples_split': 10, 'min_samples_leaf': 1, 'min_weight_fraction_leaf': 0.2757930066442345, 'min_impurity_decrease': 0.392661108822319, 'max_features': 0.7605813042467995, 'subsample': 0.018793156531417873, 'dropout_rate': 0.7738684450791763, 'ccp_alpha': 0.42235335651151634}. Best is trial 770 with value: 0.7845773442016363.[0m
[32m[I 2022-04-14 22:55:13,729][0m Trial 816 finished with value: 0.7779837900059494 and parameters: {'loss': 'coxph', 'learning_rate': 2.4042298225835263e-06, 'n_estimators': 702, 'criterion': 'friedman_mse', 'min_samples_split': 10, 'min_samples_leaf': 1, 'min_weight_fraction_leaf': 0.28211944875861983, 'min_impurity_decrease': 0.41643151846546744, 'max_features': 0.7153839785804873, 'subsample': 0.018975223212519748, 'dropout_rate': 0.6889569178088141, 'ccp_alpha': 0.26593164731064045}. Best is trial 770 with value: 0.7845773442016363.[0m
[32m[I 2022-04-14 22:55:57,380][0m Trial 817 finished with value: -0.25 and parameters: {'loss': 'squared', 'learning_rate': 1.7588944684648136e-06, 'n_estimators': 679, 'criterion': 'friedman_mse', 'min_samples_split': 10, 'min_samples_leaf': 1, 'min_weight_fraction_leaf': 0.263624783102283, 'min_impurity_decrease': 0.3858974877680273, 'max_features': 0.7830253097260037, 'subsample': 0.0010796474570442943, 'dropout_rate': 0.7147386459208634, 'ccp_alpha': 0.1690770747255429}. Best is trial 770 with value: 0.7845773442016363.[0m
[32m[I 2022-04-14 22:57:56,382][0m Trial 818 finished with value: 0.7634326633588009 and parameters: {'loss': 'coxph', 'learning_rate': 1.3212245232641621e-06, 'n_estimators': 727, 'criterion': 'friedman_mse', 'min_samples_split': 10, 'min_samples_leaf': 1, 'min_weight_fraction_leaf': 0.2921334501643423, 'min_impurity_decrease': 0.4068745178301711, 'max_features': 0.747473161509166, 'subsample': 0.04481558617532924, 'dropout_rate': 0.6787978116670788, 'ccp_alpha': 0.2627070938009146}. Best is trial 770 with value: 0.7845773442016363.[0m
[32m[I 2022-04-14 22:59:24,477][0m Trial 819 finished with value: 0.7809697999683569 and parameters: {'loss': 'coxph', 'learning_rate': 1.93553223549917e-06, 'n_estimators': 645, 'criterion': 'friedman_mse', 'min_samples_split': 10, 'min_samples_leaf': 1, 'min_weight_fraction_leaf': 0.25900685207384544, 'min_impurity_decrease': 0.38805109263008275, 'max_features': 0.764671020050384, 'subsample': 0.03522596767634575, 'dropout_rate': 0.7442282953514712, 'ccp_alpha': 0.12411750350276408}. Best is trial 770 with value: 0.7845773442016363.[0m
[32m[I 2022-04-14 23:01:38,674][0m Trial 820 finished with value: 0.7848883887964149 and parameters: {'loss': 'coxph', 'learning_rate': 2.0509484878420714e-06, 'n_estimators': 728, 'criterion': 'friedman_mse', 'min_samples_split': 10, 'min_samples_leaf': 1, 'min_weight_fraction_leaf': 0.26981036738613134, 'min_impurity_decrease': 0.4220612912683924, 'max_features': 0.8109757003970857, 'subsample': 0.021501120456272692, 'dropout_rate': 0.6606879406768088, 'ccp_alpha': 0.08967479692464159}. Best is trial 820 with value: 0.7848883887964149.[0m
[32m[I 2022-04-14 23:03:19,167][0m Trial 821 finished with value: 0.7587057984666026 and parameters: {'loss': 'coxph', 'learning_rate': 2.0918147952188682e-06, 'n_estimators': 669, 'criterion': 'friedman_mse', 'min_samples_split': 10, 'min_samples_leaf': 1, 'min_weight_fraction_leaf': 0.2515681975996327, 'min_impurity_decrease': 0.4691103135174873, 'max_features': 0.7817925275660157, 'subsample': 0.0487398898135003, 'dropout_rate': 0.6873336609473476, 'ccp_alpha': 0.300846239059433}. Best is trial 820 with value: 0.7848883887964149.[0m
[32m[I 2022-04-14 23:05:07,871][0m Trial 822 finished with value: 0.7282276910775203 and parameters: {'loss': 'coxph', 'learning_rate': 1.765582754252495e-06, 'n_estimators': 727, 'criterion': 'squared_error', 'min_samples_split': 10, 'min_samples_leaf': 1, 'min_weight_fraction_leaf': 0.2741232367951562, 'min_impurity_decrease': 0.43839498364322627, 'max_features': 0.8005834903116601, 'subsample': 0.032537359472419376, 'dropout_rate': 0.7201082455906237, 'ccp_alpha': 0.2315350392075239}. Best is trial 820 with value: 0.7848883887964149.[0m
[32m[I 2022-04-14 23:07:00,306][0m Trial 823 finished with value: 0.7330445394034601 and parameters: {'loss': 'coxph', 'learning_rate': 1.4707294734795825e-06, 'n_estimators': 713, 'criterion': 'friedman_mse', 'min_samples_split': 10, 'min_samples_leaf': 1, 'min_weight_fraction_leaf': 0.2780785754658187, 'min_impurity_decrease': 0.4287189024325688, 'max_features': 0.7700016537823193, 'subsample': 0.05165084109640327, 'dropout_rate': 0.6645735887221067, 'ccp_alpha': 0.33938712155005}. Best is trial 820 with value: 0.7848883887964149.[0m
[32m[I 2022-04-14 23:08:49,780][0m Trial 824 finished with value: 0.7795602078213998 and parameters: {'loss': 'coxph', 'learning_rate': 2.1470270151468562e-06, 'n_estimators': 683, 'criterion': 'friedman_mse', 'min_samples_split': 10, 'min_samples_leaf': 1, 'min_weight_fraction_leaf': 0.268076305925241, 'min_impurity_decrease': 0.42655961099975864, 'max_features': 0.8092790498724299, 'subsample': 0.020370195988795053, 'dropout_rate': 0.6952012195378635, 'ccp_alpha': 0.17859271247822903}. Best is trial 820 with value: 0.7848883887964149.[0m
[32m[I 2022-04-14 23:10:46,131][0m Trial 825 finished with value: 0.7811292944121456 and parameters: {'loss': 'coxph', 'learning_rate': 1.3055094987342645e-06, 'n_estimators': 723, 'criterion': 'friedman_mse', 'min_samples_split': 10, 'min_samples_leaf': 1, 'min_weight_fraction_leaf': 0.296469581713455, 'min_impurity_decrease': 0.4092949570499577, 'max_features': 0.7821837358785242, 'subsample': 0.05130984291135713, 'dropout_rate': 0.6599444062191312, 'ccp_alpha': 0.08845645308168203}. Best is trial 820 with value: 0.7848883887964149.[0m
[32m[I 2022-04-14 23:12:47,051][0m Trial 826 finished with value: 0.7786249462525979 and parameters: {'loss': 'coxph', 'learning_rate': 2.1839598987621507e-06, 'n_estimators': 741, 'criterion': 'friedman_mse', 'min_samples_split': 10, 'min_samples_leaf': 1, 'min_weight_fraction_leaf': 0.2417418710596869, 'min_impurity_decrease': 0.45619817014058417, 'max_features': 0.8161083078779363, 'subsample': 0.02973865382941523, 'dropout_rate': 0.6824804185695716, 'ccp_alpha': 0.1649277921761013}. Best is trial 820 with value: 0.7848883887964149.[0m
[32m[I 2022-04-14 23:14:32,694][0m Trial 827 finished with value: 0.7031717398401722 and parameters: {'loss': 'coxph', 'learning_rate': 1.609235310231124e-06, 'n_estimators': 683, 'criterion': 'friedman_mse', 'min_samples_split': 10, 'min_samples_leaf': 1, 'min_weight_fraction_leaf': 0.2858566792596315, 'min_impurity_decrease': 0.4226049863970102, 'max_features': 0.7455146903260989, 'subsample': 0.048032901492147936, 'dropout_rate': 0.6656672209160088, 'ccp_alpha': 0.3657286587480441}. Best is trial 820 with value: 0.7848883887964149.[0m
[32m[I 2022-04-14 23:16:40,666][0m Trial 828 finished with value: 0.25 and parameters: {'loss': 'coxph', 'learning_rate': 2.548957133143452e-06, 'n_estimators': 741, 'criterion': 'friedman_mse', 'min_samples_split': 10, 'min_samples_leaf': 1, 'min_weight_fraction_leaf': 0.27045025787515975, 'min_impurity_decrease': 0.40408685067204575, 'max_features': 0.7922132716009267, 'subsample': 0.018030855025714634, 'dropout_rate': 0.6562474790476718, 'ccp_alpha': 0.9594857243505961}. Best is trial 820 with value: 0.7848883887964149.[0m
[32m[I 2022-04-14 23:18:16,650][0m Trial 829 finished with value: 0.35 and parameters: {'loss': 'coxph', 'learning_rate': 1.2094669987016649e-06, 'n_estimators': 655, 'criterion': 'absolute_error', 'min_samples_split': 10, 'min_samples_leaf': 1, 'min_weight_fraction_leaf': 0.25762998477636107, 'min_impurity_decrease': 0.4478812610101471, 'max_features': 0.820190730833696, 'subsample': 0.03536151263099281, 'dropout_rate': 0.7063344735313364, 'ccp_alpha': 0.5029360671387738}. Best is trial 820 with value: 0.7848883887964149.[0m
[32m[I 2022-04-14 23:20:02,565][0m Trial 830 finished with value: 0.25 and parameters: {'loss': 'coxph', 'learning_rate': 1.7419774104254128e-06, 'n_estimators': 701, 'criterion': 'friedman_mse', 'min_samples_split': 10, 'min_samples_leaf': 1, 'min_weight_fraction_leaf': 0.2997929267975202, 'min_impurity_decrease': 0.38208192869053115, 'max_features': 0.7973556471955225, 'subsample': 0.002304121363300979, 'dropout_rate': 0.7260851303413411, 'ccp_alpha': 0.10215230806132646}. Best is trial 820 with value: 0.7848883887964149.[0m
[32m[I 2022-04-14 23:21:31,760][0m Trial 831 finished with value: 0.7781484330924533 and parameters: {'loss': 'coxph', 'learning_rate': 2.713311785236867e-06, 'n_estimators': 617, 'criterion': 'friedman_mse', 'min_samples_split': 10, 'min_samples_leaf': 1, 'min_weight_fraction_leaf': 0.2759805980462636, 'min_impurity_decrease': 0.4028706490447579, 'max_features': 0.7317828152967697, 'subsample': 0.0501108523704292, 'dropout_rate': 0.675164619792837, 'ccp_alpha': 0.2045253481686153}. Best is trial 820 with value: 0.7848883887964149.[0m
[32m[I 2022-04-14 23:23:37,588][0m Trial 832 finished with value: 0.7841735969358027 and parameters: {'loss': 'coxph', 'learning_rate': 2.3802597084459157e-06, 'n_estimators': 724, 'criterion': 'friedman_mse', 'min_samples_split': 10, 'min_samples_leaf': 1, 'min_weight_fraction_leaf': 0.26590749955543186, 'min_impurity_decrease': 0.38036752198258067, 'max_features': 0.777475175203066, 'subsample': 0.02063425075312607, 'dropout_rate': 0.6600462386472694, 'ccp_alpha': 0.001125696488029071}. Best is trial 820 with value: 0.7848883887964149.[0m
[32m[I 2022-04-14 23:25:27,626][0m Trial 833 finished with value: 0.7847357614481951 and parameters: {'loss': 'coxph', 'learning_rate': 2.2212901060872077e-06, 'n_estimators': 683, 'criterion': 'friedman_mse', 'min_samples_split': 10, 'min_samples_leaf': 1, 'min_weight_fraction_leaf': 0.2642128902279101, 'min_impurity_decrease': 0.4269155056998135, 'max_features': 0.7535377106034907, 'subsample': 0.022025274312333133, 'dropout_rate': 0.695445654356815, 'ccp_alpha': 0.07535916198232386}. Best is trial 820 with value: 0.7848883887964149.[0m
[32m[I 2022-04-14 23:26:49,043][0m Trial 834 finished with value: 0.7825527052876071 and parameters: {'loss': 'coxph', 'learning_rate': 2.4273987782153012e-06, 'n_estimators': 574, 'criterion': 'friedman_mse', 'min_samples_split': 10, 'min_samples_leaf': 1, 'min_weight_fraction_leaf': 0.26353761140657234, 'min_impurity_decrease': 0.45566394010298156, 'max_features': 0.7445764649469153, 'subsample': 0.018045913072711545, 'dropout_rate': 0.7321145489102242, 'ccp_alpha': 0.07481335058238035}. Best is trial 820 with value: 0.7848883887964149.[0m
[32m[I 2022-04-14 23:28:15,371][0m Trial 835 finished with value: 0.25 and parameters: {'loss': 'coxph', 'learning_rate': 2.1268882829335044e-06, 'n_estimators': 614, 'criterion': 'friedman_mse', 'min_samples_split': 10, 'min_samples_leaf': 1, 'min_weight_fraction_leaf': 0.2505148798023076, 'min_impurity_decrease': 0.419285927681566, 'max_features': 0.7214316528899657, 'subsample': 0.0015098366186855755, 'dropout_rate': 0.7403226852747721, 'ccp_alpha': 0.09324459586816417}. Best is trial 820 with value: 0.7848883887964149.[0m
[32m[I 2022-04-14 23:29:28,068][0m Trial 836 finished with value: 0.25 and parameters: {'loss': 'coxph', 'learning_rate': 1.831043333166544e-06, 'n_estimators': 571, 'criterion': 'friedman_mse', 'min_samples_split': 10, 'min_samples_leaf': 1, 'min_weight_fraction_leaf': 0.2597347430064775, 'min_impurity_decrease': 0.4491914123635443, 'max_features': 0.6867493607573553, 'subsample': 0.002226501054385585, 'dropout_rate': 0.7771666639018736, 'ccp_alpha': 0.24232293598512228}. Best is trial 820 with value: 0.7848883887964149.[0m
[32m[I 2022-04-14 23:31:03,256][0m Trial 837 finished with value: 0.7804474954370353 and parameters: {'loss': 'coxph', 'learning_rate': 2.4915443986697406e-06, 'n_estimators': 634, 'criterion': 'friedman_mse', 'min_samples_split': 10, 'min_samples_leaf': 1, 'min_weight_fraction_leaf': 0.26470250885734237, 'min_impurity_decrease': 0.4615251549229794, 'max_features': 0.7286564403369884, 'subsample': 0.021054474565249677, 'dropout_rate': 0.7119452948227128, 'ccp_alpha': 0.10456222263351585}. Best is trial 820 with value: 0.7848883887964149.[0m
[32m[I 2022-04-14 23:31:48,970][0m Trial 838 finished with value: -0.3769509824502979 and parameters: {'loss': 'squared', 'learning_rate': 2.084608977576146e-06, 'n_estimators': 671, 'criterion': 'friedman_mse', 'min_samples_split': 10, 'min_samples_leaf': 1, 'min_weight_fraction_leaf': 0.24619727524139473, 'min_impurity_decrease': 0.4759521042959879, 'max_features': 0.7491697791389981, 'subsample': 0.019382810224286937, 'dropout_rate': 0.7367696789960525, 'ccp_alpha': 0.09889758473361045}. Best is trial 820 with value: 0.7848883887964149.[0m
[32m[I 2022-04-14 23:33:27,149][0m Trial 839 finished with value: 0.7823845758102408 and parameters: {'loss': 'coxph', 'learning_rate': 1.6042583278279827e-06, 'n_estimators': 653, 'criterion': 'friedman_mse', 'min_samples_split': 10, 'min_samples_leaf': 1, 'min_weight_fraction_leaf': 0.2303094629470932, 'min_impurity_decrease': 0.48057239358712356, 'max_features': 0.7479972337806408, 'subsample': 0.018073418176038452, 'dropout_rate': 0.7302548077691631, 'ccp_alpha': 0.0016112711682964905}. Best is trial 820 with value: 0.7848883887964149.[0m
[32m[I 2022-04-14 23:34:56,191][0m Trial 840 finished with value: 0.7786095465358814 and parameters: {'loss': 'coxph', 'learning_rate': 1.5825815174280543e-06, 'n_estimators': 638, 'criterion': 'friedman_mse', 'min_samples_split': 10, 'min_samples_leaf': 1, 'min_weight_fraction_leaf': 0.24413641997735483, 'min_impurity_decrease': 0.5213368048150357, 'max_features': 0.7323434637731275, 'subsample': 0.017508089154014153, 'dropout_rate': 0.7565755891700434, 'ccp_alpha': 0.2605106753758072}. Best is trial 820 with value: 0.7848883887964149.[0m
[32m[I 2022-04-14 23:36:13,412][0m Trial 841 finished with value: 0.7771140779461582 and parameters: {'loss': 'coxph', 'learning_rate': 1.3189029937648635e-06, 'n_estimators': 577, 'criterion': 'friedman_mse', 'min_samples_split': 10, 'min_samples_leaf': 1, 'min_weight_fraction_leaf': 0.23757124072508115, 'min_impurity_decrease': 0.48593177353487005, 'max_features': 0.6931033254911525, 'subsample': 0.014612649183449233, 'dropout_rate': 0.7698341821652764, 'ccp_alpha': 0.10106591290735653}. Best is trial 820 with value: 0.7848883887964149.[0m
[32m[I 2022-04-14 23:37:51,979][0m Trial 842 finished with value: 0.25 and parameters: {'loss': 'coxph', 'learning_rate': 1.0664383715427343e-06, 'n_estimators': 655, 'criterion': 'friedman_mse', 'min_samples_split': 10, 'min_samples_leaf': 1, 'min_weight_fraction_leaf': 0.2661721455996553, 'min_impurity_decrease': 0.4778305947950165, 'max_features': 0.7159135599535855, 'subsample': 0.0023556213046985325, 'dropout_rate': 0.7153997971581647, 'ccp_alpha': 0.0016356164698267314}. Best is trial 820 with value: 0.7848883887964149.[0m
[32m[I 2022-04-14 23:39:22,743][0m Trial 843 finished with value: 0.7798293376229921 and parameters: {'loss': 'coxph', 'learning_rate': 1.5873663770407924e-06, 'n_estimators': 614, 'criterion': 'friedman_mse', 'min_samples_split': 10, 'min_samples_leaf': 1, 'min_weight_fraction_leaf': 0.22989759468015897, 'min_impurity_decrease': 0.45783967329702413, 'max_features': 0.7557093408551598, 'subsample': 0.02954348382069853, 'dropout_rate': 0.7177708313856496, 'ccp_alpha': 0.16270153441077914}. Best is trial 820 with value: 0.7848883887964149.[0m
[32m[I 2022-04-14 23:41:03,364][0m Trial 844 finished with value: 0.7778358889082602 and parameters: {'loss': 'coxph', 'learning_rate': 1.538205152912222e-06, 'n_estimators': 677, 'criterion': 'friedman_mse', 'min_samples_split': 10, 'min_samples_leaf': 1, 'min_weight_fraction_leaf': 0.2549641856606043, 'min_impurity_decrease': 0.49533866402026017, 'max_features': 0.7472193931564721, 'subsample': 0.01715229529969818, 'dropout_rate': 0.7393418098184348, 'ccp_alpha': 0.31936371500494276}. Best is trial 820 with value: 0.7848883887964149.[0m
[32m[I 2022-04-14 23:42:30,501][0m Trial 845 finished with value: 0.7232225714627946 and parameters: {'loss': 'coxph', 'learning_rate': 1.9710733379760282e-06, 'n_estimators': 650, 'criterion': 'squared_error', 'min_samples_split': 10, 'min_samples_leaf': 1, 'min_weight_fraction_leaf': 0.21853575354831342, 'min_impurity_decrease': 0.44694948029147247, 'max_features': 0.7644506144192682, 'subsample': 0.03213429782016907, 'dropout_rate': 0.7857633175648572, 'ccp_alpha': 0.21114997801301383}. Best is trial 820 with value: 0.7848883887964149.[0m
[32m[I 2022-04-14 23:44:12,848][0m Trial 846 finished with value: 0.7820741835332742 and parameters: {'loss': 'coxph', 'learning_rate': 2.882518946338515e-06, 'n_estimators': 689, 'criterion': 'friedman_mse', 'min_samples_split': 10, 'min_samples_leaf': 1, 'min_weight_fraction_leaf': 0.2581407365936553, 'min_impurity_decrease': 0.5112544734313499, 'max_features': 0.7128250930857923, 'subsample': 0.020912450215417173, 'dropout_rate': 0.7575878517929215, 'ccp_alpha': 0.07964595431890435}. Best is trial 820 with value: 0.7848883887964149.[0m
[32m[I 2022-04-14 23:45:32,460][0m Trial 847 finished with value: 0.25 and parameters: {'loss': 'coxph', 'learning_rate': 2.7292103915335335e-06, 'n_estimators': 597, 'criterion': 'friedman_mse', 'min_samples_split': 10, 'min_samples_leaf': 1, 'min_weight_fraction_leaf': 0.22731380134168802, 'min_impurity_decrease': 0.507847855389558, 'max_features': 0.711251278329397, 'subsample': 0.004007654885042813, 'dropout_rate': 0.8115149920615289, 'ccp_alpha': 0.08566198270578586}. Best is trial 820 with value: 0.7848883887964149.[0m
[32m[I 2022-04-14 23:47:04,027][0m Trial 848 finished with value: 0.7494439924496061 and parameters: {'loss': 'coxph', 'learning_rate': 1.9580155799642034e-06, 'n_estimators': 659, 'criterion': 'friedman_mse', 'min_samples_split': 10, 'min_samples_leaf': 1, 'min_weight_fraction_leaf': 0.2560502897676011, 'min_impurity_decrease': 0.5392083337377825, 'max_features': 0.7289356100510362, 'subsample': 0.030996943193078573, 'dropout_rate': 0.7414521686472518, 'ccp_alpha': 0.402072092475577}. Best is trial 820 with value: 0.7848883887964149.[0m
[32m[I 2022-04-14 23:48:43,217][0m Trial 849 finished with value: 0.7814016395811942 and parameters: {'loss': 'coxph', 'learning_rate': 1.6389486414072276e-06, 'n_estimators': 686, 'criterion': 'friedman_mse', 'min_samples_split': 10, 'min_samples_leaf': 1, 'min_weight_fraction_leaf': 0.23633208528479419, 'min_impurity_decrease': 0.48784377908615756, 'max_features': 0.7388253027641719, 'subsample': 0.019132847392664507, 'dropout_rate': 0.7470079282296975, 'ccp_alpha': 0.18944854294115301}. Best is trial 820 with value: 0.7848883887964149.[0m
