[32m[I 2022-04-13 11:49:04,549][0m Trial 279 finished with value: 0.8830779806007181 and parameters: {'splitter': 'best', 'min_samples_split': 0.11816668467765364, 'min_samples_leaf': 0.04949788129207172, 'min_weight_fraction_leaf': 0.0005952862271258186, 'max_features': 0.9291011946658538}. Best is trial 201 with value: 0.8881217621713932.[0m
/media/san2_ssd/data/Workdir/survival/utils.py:305: RuntimeWarning: invalid value encountered in true_divide
  pdfs = np.gradient(1-survs,axis=1)/norms
/media/san2_ssd/data/Workdir/survival/utils.py:305: RuntimeWarning: invalid value encountered in true_divide
  pdfs = np.gradient(1-survs,axis=1)/norms
/media/san2_ssd/data/Workdir/survival/utils.py:305: RuntimeWarning: invalid value encountered in true_divide
  pdfs = np.gradient(1-survs,axis=1)/norms
/media/san2_ssd/data/Workdir/survival/utils.py:305: RuntimeWarning: invalid value encountered in true_divide
  pdfs = np.gradient(1-survs,axis=1)/norms
[32m[I 2022-04-13 11:49:07,726][0m Trial 280 finished with value: 0.8834924105907233 and parameters: {'splitter': 'best', 'min_samples_split': 0.10430163704339196, 'min_samples_leaf': 0.013436256778706109, 'min_weight_fraction_leaf': 0.032819098343140715, 'max_features': 0.9620285314656865}. Best is trial 201 with value: 0.8881217621713932.[0m
[32m[I 2022-04-13 11:49:08,031][0m Trial 281 finished with value: 0.6979513030470545 and parameters: {'splitter': 'best', 'min_samples_split': 0.12654417024351297, 'min_samples_leaf': 0.4910794943725336, 'min_weight_fraction_leaf': 0.0227693541696035, 'max_features': 0.999846566273834}. Best is trial 201 with value: 0.8881217621713932.[0m
/media/san2_ssd/data/Workdir/survival/utils.py:305: RuntimeWarning: invalid value encountered in true_divide
  pdfs = np.gradient(1-survs,axis=1)/norms
/media/san2_ssd/data/Workdir/survival/utils.py:305: RuntimeWarning: invalid value encountered in true_divide
  pdfs = np.gradient(1-survs,axis=1)/norms
[32m[I 2022-04-13 11:49:10,209][0m Trial 282 finished with value: 0.8862971175630839 and parameters: {'splitter': 'best', 'min_samples_split': 0.14372552687937978, 'min_samples_leaf': 0.035144817720879996, 'min_weight_fraction_leaf': 0.01013881551558199, 'max_features': 0.9787654420940548}. Best is trial 201 with value: 0.8881217621713932.[0m
[32m[I 2022-04-13 11:49:12,506][0m Trial 283 finished with value: 0.5554918890812821 and parameters: {'splitter': 'best', 'min_samples_split': 0.08649288285001763, 'min_samples_leaf': 0.023986079398662048, 'min_weight_fraction_leaf': 0.20850717212088388, 'max_features': 0.9511500799891873}. Best is trial 201 with value: 0.8881217621713932.[0m
[32m[I 2022-04-13 11:49:15,467][0m Trial 284 finished with value: 0.4762173568334265 and parameters: {'splitter': 'best', 'min_samples_split': 0.37156167102811377, 'min_samples_leaf': 0.015083878835709103, 'min_weight_fraction_leaf': 0.043200089768017993, 'max_features': 0.9812710641616395}. Best is trial 201 with value: 0.8881217621713932.[0m
/media/san2_ssd/data/Workdir/survival/utils.py:305: RuntimeWarning: invalid value encountered in true_divide
  pdfs = np.gradient(1-survs,axis=1)/norms
/media/san2_ssd/data/Workdir/survival/utils.py:305: RuntimeWarning: invalid value encountered in true_divide
  pdfs = np.gradient(1-survs,axis=1)/norms
/media/san2_ssd/data/Workdir/survival/utils.py:305: RuntimeWarning: invalid value encountered in true_divide
  pdfs = np.gradient(1-survs,axis=1)/norms
/media/san2_ssd/data/Workdir/survival/utils.py:305: RuntimeWarning: invalid value encountered in true_divide
  pdfs = np.gradient(1-survs,axis=1)/norms
/media/san2_ssd/data/Workdir/survival/utils.py:305: RuntimeWarning: invalid value encountered in true_divide
  pdfs = np.gradient(1-survs,axis=1)/norms
[32m[I 2022-04-13 11:49:18,404][0m Trial 285 finished with value: 0.8876799465766639 and parameters: {'splitter': 'best', 'min_samples_split': 0.11525321988400389, 'min_samples_leaf': 0.034644109246665146, 'min_weight_fraction_leaf': 0.030697631487227605, 'max_features': 0.9820256497873341}. Best is trial 201 with value: 0.8881217621713932.[0m
[32m[I 2022-04-13 11:49:20,919][0m Trial 286 finished with value: 0.4592016350597861 and parameters: {'splitter': 'best', 'min_samples_split': 0.39260348289377095, 'min_samples_leaf': 0.05157937501953243, 'min_weight_fraction_leaf': 0.04321994017885948, 'max_features': 0.9450488407097265}. Best is trial 201 with value: 0.8881217621713932.[0m
[32m[I 2022-04-13 11:49:21,491][0m Trial 287 finished with value: 0.8111175921818736 and parameters: {'splitter': 'best', 'min_samples_split': 0.09572354489729785, 'min_samples_leaf': 0.012362740214022928, 'min_weight_fraction_leaf': 0.033617042034256146, 'max_features': 0.13791705963832368}. Best is trial 201 with value: 0.8881217621713932.[0m
[32m[I 2022-04-13 11:49:22,782][0m Trial 288 finished with value: 0.5518930503448202 and parameters: {'splitter': 'best', 'min_samples_split': 0.1122505985402203, 'min_samples_leaf': 0.1936042848064699, 'min_weight_fraction_leaf': 0.01925241793499641, 'max_features': 0.9239116024906013}. Best is trial 201 with value: 0.8881217621713932.[0m
/media/san2_ssd/data/Workdir/survival/utils.py:305: RuntimeWarning: invalid value encountered in true_divide
  pdfs = np.gradient(1-survs,axis=1)/norms
/media/san2_ssd/data/Workdir/survival/utils.py:305: RuntimeWarning: invalid value encountered in true_divide
  pdfs = np.gradient(1-survs,axis=1)/norms
/media/san2_ssd/data/Workdir/survival/utils.py:305: RuntimeWarning: invalid value encountered in true_divide
  pdfs = np.gradient(1-survs,axis=1)/norms
/media/san2_ssd/data/Workdir/survival/utils.py:305: RuntimeWarning: invalid value encountered in true_divide
  pdfs = np.gradient(1-survs,axis=1)/norms
[32m[I 2022-04-13 11:49:24,865][0m Trial 289 finished with value: 0.8844113978431694 and parameters: {'splitter': 'best', 'min_samples_split': 0.10992007105982408, 'min_samples_leaf': 0.038756102279268415, 'min_weight_fraction_leaf': 0.03157025968527979, 'max_features': 0.9664802507731043}. Best is trial 201 with value: 0.8881217621713932.[0m
/media/san2_ssd/data/Workdir/survival/utils.py:305: RuntimeWarning: invalid value encountered in true_divide
  pdfs = np.gradient(1-survs,axis=1)/norms
/media/san2_ssd/data/Workdir/survival/utils.py:305: RuntimeWarning: invalid value encountered in true_divide
  pdfs = np.gradient(1-survs,axis=1)/norms
/media/san2_ssd/data/Workdir/survival/utils.py:305: RuntimeWarning: invalid value encountered in true_divide
  pdfs = np.gradient(1-survs,axis=1)/norms
/media/san2_ssd/data/Workdir/survival/utils.py:305: RuntimeWarning: invalid value encountered in true_divide
  pdfs = np.gradient(1-survs,axis=1)/norms
/media/san2_ssd/data/Workdir/survival/utils.py:305: RuntimeWarning: invalid value encountered in true_divide
  pdfs = np.gradient(1-survs,axis=1)/norms
[32m[I 2022-04-13 11:49:26,062][0m Trial 290 finished with value: 0.8868158005312786 and parameters: {'splitter': 'best', 'min_samples_split': 0.10005497824404688, 'min_samples_leaf': 0.023701491522657506, 'min_weight_fraction_leaf': 0.011667600971211278, 'max_features': 0.9794155728777579}. Best is trial 201 with value: 0.8881217621713932.[0m
[32m[I 2022-04-13 11:49:26,938][0m Trial 291 finished with value: 0.5511383729410468 and parameters: {'splitter': 'best', 'min_samples_split': 0.08208414716837684, 'min_samples_leaf': 0.02162155608591847, 'min_weight_fraction_leaf': 0.25956297841075837, 'max_features': 0.9614812517634858}. Best is trial 201 with value: 0.8881217621713932.[0m
[32m[I 2022-04-13 11:49:27,644][0m Trial 292 finished with value: 0.4636117468969436 and parameters: {'splitter': 'best', 'min_samples_split': 0.22182271489024985, 'min_samples_leaf': 0.21848334102558464, 'min_weight_fraction_leaf': 0.22938415656729869, 'max_features': 0.9821310504722809}. Best is trial 201 with value: 0.8881217621713932.[0m
/media/san2_ssd/data/Workdir/survival/utils.py:305: RuntimeWarning: invalid value encountered in true_divide
  pdfs = np.gradient(1-survs,axis=1)/norms
/media/san2_ssd/data/Workdir/survival/utils.py:305: RuntimeWarning: invalid value encountered in true_divide
  pdfs = np.gradient(1-survs,axis=1)/norms
/media/san2_ssd/data/Workdir/survival/utils.py:305: RuntimeWarning: invalid value encountered in true_divide
  pdfs = np.gradient(1-survs,axis=1)/norms
[32m[I 2022-04-13 11:49:29,711][0m Trial 293 finished with value: 0.8823738230862437 and parameters: {'splitter': 'best', 'min_samples_split': 0.12927993003068036, 'min_samples_leaf': 0.03819786756395992, 'min_weight_fraction_leaf': 0.00506796039183811, 'max_features': 0.9401062332136988}. Best is trial 201 with value: 0.8881217621713932.[0m
/media/san2_ssd/data/Workdir/survival/utils.py:305: RuntimeWarning: invalid value encountered in true_divide
  pdfs = np.gradient(1-survs,axis=1)/norms
/media/san2_ssd/data/Workdir/survival/utils.py:305: RuntimeWarning: invalid value encountered in true_divide
  pdfs = np.gradient(1-survs,axis=1)/norms
/media/san2_ssd/data/Workdir/survival/utils.py:305: RuntimeWarning: invalid value encountered in true_divide
  pdfs = np.gradient(1-survs,axis=1)/norms
/media/san2_ssd/data/Workdir/survival/utils.py:305: RuntimeWarning: invalid value encountered in true_divide
  pdfs = np.gradient(1-survs,axis=1)/norms
[32m[I 2022-04-13 11:49:31,735][0m Trial 294 finished with value: 0.8840640978933516 and parameters: {'splitter': 'best', 'min_samples_split': 0.0961157350481121, 'min_samples_leaf': 0.012651142072255612, 'min_weight_fraction_leaf': 0.012255943693591714, 'max_features': 0.9638694158796616}. Best is trial 201 with value: 0.8881217621713932.[0m
[32m[I 2022-04-13 11:49:32,016][0m Trial 295 finished with value: 0.5371812073302544 and parameters: {'splitter': 'best', 'min_samples_split': 0.11653290788638689, 'min_samples_leaf': 0.31821567100637277, 'min_weight_fraction_leaf': 0.02183337464644803, 'max_features': 0.980287972804388}. Best is trial 201 with value: 0.8881217621713932.[0m
/media/san2_ssd/data/Workdir/survival/utils.py:305: RuntimeWarning: invalid value encountered in true_divide
  pdfs = np.gradient(1-survs,axis=1)/norms
/media/san2_ssd/data/Workdir/survival/utils.py:305: RuntimeWarning: invalid value encountered in true_divide
  pdfs = np.gradient(1-survs,axis=1)/norms
/media/san2_ssd/data/Workdir/survival/utils.py:305: RuntimeWarning: invalid value encountered in true_divide
  pdfs = np.gradient(1-survs,axis=1)/norms
/media/san2_ssd/data/Workdir/survival/utils.py:305: RuntimeWarning: invalid value encountered in true_divide
  pdfs = np.gradient(1-survs,axis=1)/norms
[32m[I 2022-04-13 11:49:34,223][0m Trial 296 finished with value: 0.88448681181298 and parameters: {'splitter': 'best', 'min_samples_split': 0.10612089728148147, 'min_samples_leaf': 0.03097932571388155, 'min_weight_fraction_leaf': 0.013097251489244345, 'max_features': 0.9522663314395148}. Best is trial 201 with value: 0.8881217621713932.[0m
/media/san2_ssd/data/Workdir/survival/utils.py:305: RuntimeWarning: invalid value encountered in true_divide
  pdfs = np.gradient(1-survs,axis=1)/norms
/media/san2_ssd/data/Workdir/survival/utils.py:305: RuntimeWarning: invalid value encountered in true_divide
  pdfs = np.gradient(1-survs,axis=1)/norms
[32m[I 2022-04-13 11:49:36,986][0m Trial 297 finished with value: 0.8853868740119045 and parameters: {'splitter': 'best', 'min_samples_split': 0.1383879010887944, 'min_samples_leaf': 0.021075022298390107, 'min_weight_fraction_leaf': 0.024787037587229478, 'max_features': 0.9829636704122219}. Best is trial 201 with value: 0.8881217621713932.[0m
/media/san2_ssd/data/Workdir/survival/utils.py:305: RuntimeWarning: invalid value encountered in true_divide
  pdfs = np.gradient(1-survs,axis=1)/norms
/media/san2_ssd/data/Workdir/survival/utils.py:305: RuntimeWarning: invalid value encountered in true_divide
  pdfs = np.gradient(1-survs,axis=1)/norms
[32m[I 2022-04-13 11:49:39,002][0m Trial 298 finished with value: 0.8815700767771469 and parameters: {'splitter': 'best', 'min_samples_split': 0.1171031954779099, 'min_samples_leaf': 0.046093814438997016, 'min_weight_fraction_leaf': 0.0011027102217066737, 'max_features': 0.9107143742134542}. Best is trial 201 with value: 0.8881217621713932.[0m
[32m[I 2022-04-13 11:49:41,638][0m Trial 299 finished with value: 0.47184529006407494 and parameters: {'splitter': 'best', 'min_samples_split': 0.28176650147442456, 'min_samples_leaf': 0.014901056607064585, 'min_weight_fraction_leaf': 0.04564932188870007, 'max_features': 0.9660539243688894}. Best is trial 201 with value: 0.8881217621713932.[0m
/media/san2_ssd/data/Workdir/survival/utils.py:305: RuntimeWarning: invalid value encountered in true_divide
  pdfs = np.gradient(1-survs,axis=1)/norms
/media/san2_ssd/data/Workdir/survival/utils.py:305: RuntimeWarning: invalid value encountered in true_divide
  pdfs = np.gradient(1-survs,axis=1)/norms
/media/san2_ssd/data/Workdir/survival/utils.py:305: RuntimeWarning: invalid value encountered in true_divide
  pdfs = np.gradient(1-survs,axis=1)/norms
/media/san2_ssd/data/Workdir/survival/utils.py:305: RuntimeWarning: invalid value encountered in true_divide
  pdfs = np.gradient(1-survs,axis=1)/norms
[32m[I 2022-04-13 11:49:44,386][0m Trial 300 finished with value: 0.8858812108528544 and parameters: {'splitter': 'best', 'min_samples_split': 0.09488186579041911, 'min_samples_leaf': 0.0368766377958535, 'min_weight_fraction_leaf': 0.028671673504147333, 'max_features': 0.9988557552404782}. Best is trial 201 with value: 0.8881217621713932.[0m
[32m[I 2022-04-13 11:49:45,133][0m Trial 301 finished with value: 0.6964090917580827 and parameters: {'splitter': 'best', 'min_samples_split': 0.12487345593248561, 'min_samples_leaf': 0.024442631730436336, 'min_weight_fraction_leaf': 0.33266850688609356, 'max_features': 0.9334231442165761}. Best is trial 201 with value: 0.8881217621713932.[0m
/media/san2_ssd/data/Workdir/survival/utils.py:305: RuntimeWarning: invalid value encountered in true_divide
  pdfs = np.gradient(1-survs,axis=1)/norms
/media/san2_ssd/data/Workdir/survival/utils.py:305: RuntimeWarning: invalid value encountered in true_divide
  pdfs = np.gradient(1-survs,axis=1)/norms
/media/san2_ssd/data/Workdir/survival/utils.py:305: RuntimeWarning: invalid value encountered in true_divide
  pdfs = np.gradient(1-survs,axis=1)/norms
/media/san2_ssd/data/Workdir/survival/utils.py:305: RuntimeWarning: invalid value encountered in true_divide
  pdfs = np.gradient(1-survs,axis=1)/norms
/media/san2_ssd/data/Workdir/survival/utils.py:305: RuntimeWarning: invalid value encountered in true_divide
  pdfs = np.gradient(1-survs,axis=1)/norms
[32m[I 2022-04-13 11:49:48,426][0m Trial 302 finished with value: 0.8833867389273422 and parameters: {'splitter': 'best', 'min_samples_split': 0.1074120934462614, 'min_samples_leaf': 0.012729813526179396, 'min_weight_fraction_leaf': 0.015052734704402874, 'max_features': 0.9798171687346604}. Best is trial 201 with value: 0.8881217621713932.[0m
/media/san2_ssd/data/Workdir/survival/utils.py:305: RuntimeWarning: invalid value encountered in true_divide
  pdfs = np.gradient(1-survs,axis=1)/norms
/media/san2_ssd/data/Workdir/survival/utils.py:305: RuntimeWarning: invalid value encountered in true_divide
  pdfs = np.gradient(1-survs,axis=1)/norms
/media/san2_ssd/data/Workdir/survival/utils.py:305: RuntimeWarning: invalid value encountered in true_divide
  pdfs = np.gradient(1-survs,axis=1)/norms
/media/san2_ssd/data/Workdir/survival/utils.py:305: RuntimeWarning: invalid value encountered in true_divide
  pdfs = np.gradient(1-survs,axis=1)/norms
/media/san2_ssd/data/Workdir/survival/utils.py:305: RuntimeWarning: invalid value encountered in true_divide
  pdfs = np.gradient(1-survs,axis=1)/norms
[32m[I 2022-04-13 11:49:50,531][0m Trial 303 finished with value: 0.8852167826523882 and parameters: {'splitter': 'best', 'min_samples_split': 0.08897353068575203, 'min_samples_leaf': 0.029654111161355245, 'min_weight_fraction_leaf': 0.032702820445739786, 'max_features': 0.9991673982237612}. Best is trial 201 with value: 0.8881217621713932.[0m
[32m[I 2022-04-13 11:49:52,141][0m Trial 304 finished with value: 0.4505336637110111 and parameters: {'splitter': 'best', 'min_samples_split': 0.4798402083625415, 'min_samples_leaf': 0.0485023183131059, 'min_weight_fraction_leaf': 0.02001487274968782, 'max_features': 0.9521910108656918}. Best is trial 201 with value: 0.8881217621713932.[0m
/media/san2_ssd/data/Workdir/survival/utils.py:305: RuntimeWarning: invalid value encountered in true_divide
  pdfs = np.gradient(1-survs,axis=1)/norms
/media/san2_ssd/data/Workdir/survival/utils.py:305: RuntimeWarning: invalid value encountered in true_divide
  pdfs = np.gradient(1-survs,axis=1)/norms
/media/san2_ssd/data/Workdir/survival/utils.py:305: RuntimeWarning: invalid value encountered in true_divide
  pdfs = np.gradient(1-survs,axis=1)/norms
/media/san2_ssd/data/Workdir/survival/utils.py:305: RuntimeWarning: invalid value encountered in true_divide
  pdfs = np.gradient(1-survs,axis=1)/norms
/media/san2_ssd/data/Workdir/survival/utils.py:305: RuntimeWarning: invalid value encountered in true_divide
  pdfs = np.gradient(1-survs,axis=1)/norms
[32m[I 2022-04-13 11:49:53,527][0m Trial 305 finished with value: 0.8828690975817676 and parameters: {'splitter': 'best', 'min_samples_split': 0.11879321347499633, 'min_samples_leaf': 0.012739591972082874, 'min_weight_fraction_leaf': 0.042659652512602814, 'max_features': 0.9678691296384434}. Best is trial 201 with value: 0.8881217621713932.[0m
/media/san2_ssd/data/Workdir/survival/utils.py:305: RuntimeWarning: invalid value encountered in true_divide
  pdfs = np.gradient(1-survs,axis=1)/norms
/media/san2_ssd/data/Workdir/survival/utils.py:305: RuntimeWarning: invalid value encountered in true_divide
  pdfs = np.gradient(1-survs,axis=1)/norms
/media/san2_ssd/data/Workdir/survival/utils.py:305: RuntimeWarning: invalid value encountered in true_divide
  pdfs = np.gradient(1-survs,axis=1)/norms
[32m[I 2022-04-13 11:49:54,682][0m Trial 306 finished with value: 0.8863916389008996 and parameters: {'splitter': 'best', 'min_samples_split': 0.13757523506852296, 'min_samples_leaf': 0.03737473423004855, 'min_weight_fraction_leaf': 0.013504581608542666, 'max_features': 0.9819955773693451}. Best is trial 201 with value: 0.8881217621713932.[0m
/media/san2_ssd/data/Workdir/survival/utils.py:305: RuntimeWarning: invalid value encountered in true_divide
  pdfs = np.gradient(1-survs,axis=1)/norms
/media/san2_ssd/data/Workdir/survival/utils.py:305: RuntimeWarning: invalid value encountered in true_divide
  pdfs = np.gradient(1-survs,axis=1)/norms
/media/san2_ssd/data/Workdir/survival/utils.py:305: RuntimeWarning: invalid value encountered in true_divide
  pdfs = np.gradient(1-survs,axis=1)/norms
/media/san2_ssd/data/Workdir/survival/utils.py:305: RuntimeWarning: invalid value encountered in true_divide
  pdfs = np.gradient(1-survs,axis=1)/norms
[32m[I 2022-04-13 11:49:57,571][0m Trial 307 finished with value: 0.8836188172935099 and parameters: {'splitter': 'best', 'min_samples_split': 0.10278690575961565, 'min_samples_leaf': 0.022265710650447024, 'min_weight_fraction_leaf': 0.02577248758394131, 'max_features': 0.9384857734158218}. Best is trial 201 with value: 0.8881217621713932.[0m
/media/san2_ssd/data/Workdir/survival/utils.py:305: RuntimeWarning: invalid value encountered in true_divide
  pdfs = np.gradient(1-survs,axis=1)/norms
/media/san2_ssd/data/Workdir/survival/utils.py:305: RuntimeWarning: invalid value encountered in true_divide
  pdfs = np.gradient(1-survs,axis=1)/norms
/media/san2_ssd/data/Workdir/survival/utils.py:305: RuntimeWarning: invalid value encountered in true_divide
  pdfs = np.gradient(1-survs,axis=1)/norms
/media/san2_ssd/data/Workdir/survival/utils.py:305: RuntimeWarning: invalid value encountered in true_divide
  pdfs = np.gradient(1-survs,axis=1)/norms
[32m[I 2022-04-13 11:50:01,054][0m Trial 308 finished with value: 0.8819271976841516 and parameters: {'splitter': 'best', 'min_samples_split': 0.12935386893877804, 'min_samples_leaf': 0.02771815897165306, 'min_weight_fraction_leaf': 0.04498211353257809, 'max_features': 0.9609758805026263}. Best is trial 201 with value: 0.8881217621713932.[0m
/media/san2_ssd/data/Workdir/survival/utils.py:305: RuntimeWarning: invalid value encountered in true_divide
  pdfs = np.gradient(1-survs,axis=1)/norms
/media/san2_ssd/data/Workdir/survival/utils.py:305: RuntimeWarning: invalid value encountered in true_divide
  pdfs = np.gradient(1-survs,axis=1)/norms
/media/san2_ssd/data/Workdir/survival/utils.py:305: RuntimeWarning: invalid value encountered in true_divide
  pdfs = np.gradient(1-survs,axis=1)/norms
/media/san2_ssd/data/Workdir/survival/utils.py:305: RuntimeWarning: invalid value encountered in true_divide
  pdfs = np.gradient(1-survs,axis=1)/norms
/media/san2_ssd/data/Workdir/survival/utils.py:305: RuntimeWarning: invalid value encountered in true_divide
  pdfs = np.gradient(1-survs,axis=1)/norms
