[32m[I 2022-04-16 03:58:40,640][0m Trial 399 finished with value: 0.884466839514866 and parameters: {'n_hidden': 1024, 'mixture_components': 9, 'use_sparse_layer': True, 'use_sparse_loss': False, 'use_batchnorm': False, 'use_dropout': True, 'dropout': 0.4952296272885087, 'mlp_size_1': 1, 'mlp_size_2': 4, 'mlp_size_3': 2, 'kernel': 'Weibull', 'loss_name': 'CensoredNLLLoss'}. Best is trial 340 with value: 0.8866661488681677.[0m
[32m[I 2022-04-16 04:00:34,906][0m Trial 400 finished with value: -0.10211057987712666 and parameters: {'n_hidden': 1024, 'mixture_components': 10, 'use_sparse_layer': True, 'use_sparse_loss': False, 'use_batchnorm': False, 'use_dropout': True, 'dropout': 0.9983043250938979, 'mlp_size_1': 7, 'mlp_size_2': 0, 'mlp_size_3': 0, 'kernel': 'Weibull', 'loss_name': 'CensoredNLLLoss'}. Best is trial 340 with value: 0.8866661488681677.[0m
[32m[I 2022-04-16 04:02:44,675][0m Trial 401 finished with value: 0.7533787356480044 and parameters: {'n_hidden': 1024, 'mixture_components': 10, 'use_sparse_layer': True, 'use_sparse_loss': False, 'use_batchnorm': False, 'use_dropout': True, 'dropout': 0.566636730240874, 'mlp_size_1': 2, 'mlp_size_2': 4, 'mlp_size_3': 1, 'kernel': 'Weibull', 'loss_name': 'NLLLoss'}. Best is trial 340 with value: 0.8866661488681677.[0m
[32m[I 2022-04-16 04:05:10,999][0m Trial 402 finished with value: 0.7797522886549522 and parameters: {'n_hidden': 512, 'mixture_components': 10, 'use_sparse_layer': True, 'use_sparse_loss': False, 'use_batchnorm': False, 'use_dropout': True, 'dropout': 0.5348227052748774, 'mlp_size_1': 2, 'mlp_size_2': 4, 'mlp_size_3': 0, 'kernel': 'Logistic', 'loss_name': 'CensoredNLLLoss'}. Best is trial 340 with value: 0.8866661488681677.[0m
[32m[I 2022-04-16 04:08:16,400][0m Trial 403 finished with value: 0.8854075041135825 and parameters: {'n_hidden': 64, 'mixture_components': 10, 'use_sparse_layer': True, 'use_sparse_loss': False, 'use_batchnorm': False, 'use_dropout': True, 'dropout': 0.59013343890313, 'mlp_size_1': 2, 'mlp_size_2': 1, 'mlp_size_3': 0, 'kernel': 'Weibull', 'loss_name': 'CensoredNLLLoss'}. Best is trial 340 with value: 0.8866661488681677.[0m
[32m[I 2022-04-16 04:10:53,563][0m Trial 404 finished with value: 0.8862171362335298 and parameters: {'n_hidden': 1024, 'mixture_components': 9, 'use_sparse_layer': True, 'use_sparse_loss': False, 'use_batchnorm': False, 'use_dropout': True, 'dropout': 0.5227034540698141, 'mlp_size_1': 1, 'mlp_size_2': 4, 'mlp_size_3': 1, 'kernel': 'Weibull', 'loss_name': 'CensoredNLLLoss'}. Best is trial 340 with value: 0.8866661488681677.[0m
[32m[I 2022-04-16 04:13:48,831][0m Trial 405 finished with value: 0.8841062387926335 and parameters: {'n_hidden': 2048, 'mixture_components': 9, 'use_sparse_layer': True, 'use_sparse_loss': False, 'use_batchnorm': False, 'use_dropout': True, 'dropout': 0.5549720702680997, 'mlp_size_1': 1, 'mlp_size_2': 4, 'mlp_size_3': 1, 'kernel': 'Weibull', 'loss_name': 'CensoredNLLLoss'}. Best is trial 340 with value: 0.8866661488681677.[0m
[32m[I 2022-04-16 04:16:28,596][0m Trial 406 finished with value: 0.684896789329096 and parameters: {'n_hidden': 1024, 'mixture_components': 8, 'use_sparse_layer': True, 'use_sparse_loss': False, 'use_batchnorm': False, 'use_dropout': True, 'dropout': 0.5321888253463488, 'mlp_size_1': 1, 'mlp_size_2': 4, 'mlp_size_3': 1, 'kernel': 'Normal', 'loss_name': 'CensoredNLLLoss'}. Best is trial 340 with value: 0.8866661488681677.[0m
[32m[I 2022-04-16 04:19:04,864][0m Trial 407 finished with value: 0.8837042381980197 and parameters: {'n_hidden': 1024, 'mixture_components': 9, 'use_sparse_layer': True, 'use_sparse_loss': False, 'use_batchnorm': False, 'use_dropout': True, 'dropout': 0.5835842588435318, 'mlp_size_1': 1, 'mlp_size_2': 4, 'mlp_size_3': 1, 'kernel': 'Weibull', 'loss_name': 'CensoredNLLLoss'}. Best is trial 340 with value: 0.8866661488681677.[0m
[32m[I 2022-04-16 04:24:04,661][0m Trial 408 finished with value: 0.7793988858531087 and parameters: {'n_hidden': 1024, 'mixture_components': 9, 'use_sparse_layer': True, 'use_sparse_loss': False, 'use_batchnorm': True, 'use_dropout': True, 'dropout': 0.6134051699878266, 'mlp_size_1': 1, 'mlp_size_2': 5, 'mlp_size_3': 1, 'kernel': 'LogNormal', 'loss_name': 'CensoredNLLLoss'}. Best is trial 340 with value: 0.8866661488681677.[0m
[32m[I 2022-04-16 04:26:38,352][0m Trial 409 finished with value: 0.8832554935233954 and parameters: {'n_hidden': 1024, 'mixture_components': 9, 'use_sparse_layer': True, 'use_sparse_loss': False, 'use_batchnorm': False, 'use_dropout': True, 'dropout': 0.5197892613912172, 'mlp_size_1': 1, 'mlp_size_2': 4, 'mlp_size_3': 2, 'kernel': 'Weibull', 'loss_name': 'CensoredNLLLoss'}. Best is trial 340 with value: 0.8866661488681677.[0m
[32m[I 2022-04-16 04:29:06,670][0m Trial 410 finished with value: 0.8803400924847861 and parameters: {'n_hidden': 1024, 'mixture_components': 9, 'use_sparse_layer': True, 'use_sparse_loss': False, 'use_batchnorm': False, 'use_dropout': False, 'mlp_size_1': 1, 'mlp_size_2': 4, 'mlp_size_3': 1, 'kernel': 'Weibull', 'loss_name': 'CensoredNLLLoss'}. Best is trial 340 with value: 0.8866661488681677.[0m
[32m[I 2022-04-16 04:31:40,126][0m Trial 411 finished with value: 0.8831414439017553 and parameters: {'n_hidden': 1024, 'mixture_components': 9, 'use_sparse_layer': True, 'use_sparse_loss': False, 'use_batchnorm': False, 'use_dropout': True, 'dropout': 0.5666449110388797, 'mlp_size_1': 1, 'mlp_size_2': 4, 'mlp_size_3': 1, 'kernel': 'Weibull', 'loss_name': 'CensoredNLLLoss'}. Best is trial 340 with value: 0.8866661488681677.[0m
[32m[I 2022-04-16 04:34:00,911][0m Trial 412 finished with value: 0.8820638841040548 and parameters: {'n_hidden': 256, 'mixture_components': 9, 'use_sparse_layer': True, 'use_sparse_loss': False, 'use_batchnorm': False, 'use_dropout': True, 'dropout': 0.5939413329175193, 'mlp_size_1': 2, 'mlp_size_2': 3, 'mlp_size_3': 0, 'kernel': 'Weibull', 'loss_name': 'CensoredNLLLoss'}. Best is trial 340 with value: 0.8866661488681677.[0m
[32m[I 2022-04-16 04:36:41,272][0m Trial 413 finished with value: 0.8839277660513696 and parameters: {'n_hidden': 1024, 'mixture_components': 1, 'use_sparse_layer': True, 'use_sparse_loss': False, 'use_batchnorm': False, 'use_dropout': True, 'dropout': 0.6495750608595594, 'mlp_size_1': 1, 'mlp_size_2': 4, 'mlp_size_3': 1, 'kernel': 'Weibull', 'loss_name': 'CensoredNLLLoss'}. Best is trial 340 with value: 0.8866661488681677.[0m
[32m[I 2022-04-16 04:39:18,175][0m Trial 414 finished with value: 0.8819393289645259 and parameters: {'n_hidden': 1024, 'mixture_components': 9, 'use_sparse_layer': True, 'use_sparse_loss': False, 'use_batchnorm': False, 'use_dropout': True, 'dropout': 0.5551052591880219, 'mlp_size_1': 1, 'mlp_size_2': 5, 'mlp_size_3': 1, 'kernel': 'Weibull', 'loss_name': 'CensoredNLLLoss'}. Best is trial 340 with value: 0.8866661488681677.[0m
[32m[I 2022-04-16 04:42:07,677][0m Trial 415 finished with value: 0.780543508252788 and parameters: {'n_hidden': 1024, 'mixture_components': 5, 'use_sparse_layer': True, 'use_sparse_loss': False, 'use_batchnorm': False, 'use_dropout': True, 'dropout': 0.5173562288600251, 'mlp_size_1': 0, 'mlp_size_2': 5, 'mlp_size_3': 1, 'kernel': 'Exponential', 'loss_name': 'CensoredNLLLoss'}. Best is trial 340 with value: 0.8866661488681677.[0m
[32m[I 2022-04-16 04:44:35,549][0m Trial 416 finished with value: 0.8834606672481821 and parameters: {'n_hidden': 1024, 'mixture_components': 9, 'use_sparse_layer': True, 'use_sparse_loss': False, 'use_batchnorm': False, 'use_dropout': True, 'dropout': 0.47773854504974617, 'mlp_size_1': 2, 'mlp_size_2': 4, 'mlp_size_3': 1, 'kernel': 'Weibull', 'loss_name': 'CensoredNLLLoss'}. Best is trial 340 with value: 0.8866661488681677.[0m
[32m[I 2022-04-16 04:47:17,064][0m Trial 417 finished with value: 0.8862750349408923 and parameters: {'n_hidden': 1024, 'mixture_components': 8, 'use_sparse_layer': True, 'use_sparse_loss': False, 'use_batchnorm': False, 'use_dropout': True, 'dropout': 0.6225213099868576, 'mlp_size_1': 1, 'mlp_size_2': 4, 'mlp_size_3': 1, 'kernel': 'Weibull', 'loss_name': 'CensoredNLLLoss'}. Best is trial 340 with value: 0.8866661488681677.[0m
[32m[I 2022-04-16 04:50:01,311][0m Trial 418 finished with value: 0.6671165424379405 and parameters: {'n_hidden': 32, 'mixture_components': 8, 'use_sparse_layer': True, 'use_sparse_loss': False, 'use_batchnorm': False, 'use_dropout': True, 'dropout': 0.6429297537826392, 'mlp_size_1': 2, 'mlp_size_2': 0, 'mlp_size_3': 0, 'kernel': 'Logistic', 'loss_name': 'CensoredNLLLoss'}. Best is trial 340 with value: 0.8866661488681677.[0m
[32m[I 2022-04-16 04:52:40,210][0m Trial 419 finished with value: 0.8833470165960161 and parameters: {'n_hidden': 1024, 'mixture_components': 8, 'use_sparse_layer': True, 'use_sparse_loss': False, 'use_batchnorm': False, 'use_dropout': True, 'dropout': 0.6311848884826985, 'mlp_size_1': 1, 'mlp_size_2': 4, 'mlp_size_3': 1, 'kernel': 'Weibull', 'loss_name': 'CensoredNLLLoss'}. Best is trial 340 with value: 0.8866661488681677.[0m
[32m[I 2022-04-16 04:55:19,672][0m Trial 420 finished with value: 0.8843749024165627 and parameters: {'n_hidden': 1024, 'mixture_components': 10, 'use_sparse_layer': True, 'use_sparse_loss': False, 'use_batchnorm': False, 'use_dropout': True, 'dropout': 0.6116518748217703, 'mlp_size_1': 1, 'mlp_size_2': 4, 'mlp_size_3': 1, 'kernel': 'Weibull', 'loss_name': 'CensoredNLLLoss'}. Best is trial 340 with value: 0.8866661488681677.[0m
[32m[I 2022-04-16 04:58:04,642][0m Trial 421 finished with value: 0.88663022652798 and parameters: {'n_hidden': 1024, 'mixture_components': 10, 'use_sparse_layer': True, 'use_sparse_loss': False, 'use_batchnorm': False, 'use_dropout': True, 'dropout': 0.5965538494642413, 'mlp_size_1': 1, 'mlp_size_2': 4, 'mlp_size_3': 1, 'kernel': 'Weibull', 'loss_name': 'CensoredNLLLoss'}. Best is trial 340 with value: 0.8866661488681677.[0m
[32m[I 2022-04-16 05:00:48,816][0m Trial 422 finished with value: 0.8872774135438553 and parameters: {'n_hidden': 1024, 'mixture_components': 7, 'use_sparse_layer': True, 'use_sparse_loss': False, 'use_batchnorm': False, 'use_dropout': True, 'dropout': 0.6134817132459037, 'mlp_size_1': 1, 'mlp_size_2': 4, 'mlp_size_3': 1, 'kernel': 'Weibull', 'loss_name': 'AlternativeNLLLoss'}. Best is trial 422 with value: 0.8872774135438553.[0m
[32m[I 2022-04-16 05:03:27,816][0m Trial 423 finished with value: 0.7867066752179392 and parameters: {'n_hidden': 1024, 'mixture_components': 6, 'use_sparse_layer': True, 'use_sparse_loss': False, 'use_batchnorm': False, 'use_dropout': True, 'dropout': 0.6154693118610091, 'mlp_size_1': 1, 'mlp_size_2': 4, 'mlp_size_3': 1, 'kernel': 'Weibull', 'loss_name': 'AlternativeNLLLoss'}. Best is trial 422 with value: 0.8872774135438553.[0m
[32m[I 2022-04-16 05:06:07,023][0m Trial 424 finished with value: 0.8845246188758864 and parameters: {'n_hidden': 1024, 'mixture_components': 7, 'use_sparse_layer': True, 'use_sparse_loss': False, 'use_batchnorm': False, 'use_dropout': True, 'dropout': 0.6616233136787673, 'mlp_size_1': 1, 'mlp_size_2': 4, 'mlp_size_3': 1, 'kernel': 'Weibull', 'loss_name': 'AlternativeNLLLoss'}. Best is trial 422 with value: 0.8872774135438553.[0m
[32m[I 2022-04-16 05:08:40,079][0m Trial 425 finished with value: 0.8836384477659417 and parameters: {'n_hidden': 1024, 'mixture_components': 8, 'use_sparse_layer': True, 'use_sparse_loss': False, 'use_batchnorm': False, 'use_dropout': True, 'dropout': 0.630679886264212, 'mlp_size_1': 1, 'mlp_size_2': 6, 'mlp_size_3': 0, 'kernel': 'Weibull', 'loss_name': 'AlternativeNLLLoss'}. Best is trial 422 with value: 0.8872774135438553.[0m
[32m[I 2022-04-16 05:10:17,251][0m Trial 426 finished with value: 0.7898716200621942 and parameters: {'n_hidden': 256, 'mixture_components': 8, 'use_sparse_layer': True, 'use_sparse_loss': False, 'use_batchnorm': False, 'use_dropout': True, 'dropout': 0.6841190123779154, 'mlp_size_1': 1, 'mlp_size_2': 4, 'mlp_size_3': 0, 'kernel': 'Gumbel', 'loss_name': 'AlternativeNLLLoss'}. Best is trial 422 with value: 0.8872774135438553.[0m
[32m[I 2022-04-16 05:12:59,664][0m Trial 427 finished with value: 0.8853956819646381 and parameters: {'n_hidden': 1024, 'mixture_components': 8, 'use_sparse_layer': False, 'use_batchnorm': False, 'use_dropout': True, 'dropout': 0.5926889170573364, 'mlp_size_1': 1, 'mlp_size_2': 4, 'mlp_size_3': 1, 'kernel': 'Weibull', 'loss_name': 'AlternativeNLLLoss'}. Best is trial 422 with value: 0.8872774135438553.[0m
[32m[I 2022-04-16 05:18:51,726][0m Trial 428 finished with value: 0.8509554609614141 and parameters: {'n_hidden': 1024, 'mixture_components': 8, 'use_sparse_layer': True, 'use_sparse_loss': False, 'use_batchnorm': True, 'use_dropout': True, 'dropout': 0.57903467811833, 'mlp_size_1': 1, 'mlp_size_2': 4, 'mlp_size_3': 1, 'kernel': 'Weibull', 'loss_name': 'NLLLoss'}. Best is trial 422 with value: 0.8872774135438553.[0m
[32m[I 2022-04-16 05:20:58,239][0m Trial 429 finished with value: 0.8726924206697007 and parameters: {'n_hidden': 128, 'mixture_components': 9, 'use_sparse_layer': True, 'use_sparse_loss': False, 'use_batchnorm': False, 'use_dropout': True, 'dropout': 0.04637400987635759, 'mlp_size_1': 1, 'mlp_size_2': 3, 'mlp_size_3': 0, 'kernel': 'Weibull', 'loss_name': 'AlternativeNLLLoss'}. Best is trial 422 with value: 0.8872774135438553.[0m
[32m[I 2022-04-16 05:23:12,433][0m Trial 430 finished with value: 0.8815061413089571 and parameters: {'n_hidden': 1024, 'mixture_components': 6, 'use_sparse_layer': True, 'use_sparse_loss': False, 'use_batchnorm': False, 'use_dropout': False, 'mlp_size_1': 1, 'mlp_size_2': 4, 'mlp_size_3': 1, 'kernel': 'Weibull', 'loss_name': 'CensoredNLLLoss'}. Best is trial 422 with value: 0.8872774135438553.[0m
[32m[I 2022-04-16 05:25:34,419][0m Trial 431 finished with value: 0.884459181005262 and parameters: {'n_hidden': 1024, 'mixture_components': 10, 'use_sparse_layer': True, 'use_sparse_loss': False, 'use_batchnorm': False, 'use_dropout': True, 'dropout': 0.35542732432798996, 'mlp_size_1': 4, 'mlp_size_2': 3, 'mlp_size_3': 0, 'kernel': 'Weibull', 'loss_name': 'AlternativeNLLLoss'}. Best is trial 422 with value: 0.8872774135438553.[0m
[32m[I 2022-04-16 05:28:16,836][0m Trial 432 finished with value: 0.882353318019476 and parameters: {'n_hidden': 1024, 'mixture_components': 7, 'use_sparse_layer': True, 'use_sparse_loss': False, 'use_batchnorm': False, 'use_dropout': True, 'dropout': 0.6004257353138988, 'mlp_size_1': 1, 'mlp_size_2': 4, 'mlp_size_3': 1, 'kernel': 'Normal', 'loss_name': 'CensoredNLLLoss'}. Best is trial 422 with value: 0.8872774135438553.[0m
[32m[I 2022-04-16 05:30:44,758][0m Trial 433 finished with value: 0.8803720560275989 and parameters: {'n_hidden': 512, 'mixture_components': 10, 'use_sparse_layer': True, 'use_sparse_loss': False, 'use_batchnorm': False, 'use_dropout': True, 'dropout': 0.632528362525401, 'mlp_size_1': 1, 'mlp_size_2': 4, 'mlp_size_3': 1, 'kernel': 'Logistic', 'loss_name': 'AlternativeNLLLoss'}. Best is trial 422 with value: 0.8872774135438553.[0m
[32m[I 2022-04-16 05:33:25,706][0m Trial 434 finished with value: 0.8829879836853 and parameters: {'n_hidden': 64, 'mixture_components': 7, 'use_sparse_layer': True, 'use_sparse_loss': False, 'use_batchnorm': False, 'use_dropout': True, 'dropout': 0.3893813325108509, 'mlp_size_1': 2, 'mlp_size_2': 1, 'mlp_size_3': 0, 'kernel': 'Weibull', 'loss_name': 'AlternativeNLLLoss'}. Best is trial 422 with value: 0.8872774135438553.[0m
[32m[I 2022-04-16 05:36:13,989][0m Trial 435 finished with value: 0.8838480911178654 and parameters: {'n_hidden': 1024, 'mixture_components': 7, 'use_sparse_layer': True, 'use_sparse_loss': False, 'use_batchnorm': False, 'use_dropout': True, 'dropout': 0.5769743597446468, 'mlp_size_1': 0, 'mlp_size_2': 4, 'mlp_size_3': 2, 'kernel': 'Weibull', 'loss_name': 'CensoredNLLLoss'}. Best is trial 422 with value: 0.8872774135438553.[0m
[32m[I 2022-04-16 05:39:25,142][0m Trial 436 finished with value: 0.8811244793509843 and parameters: {'n_hidden': 1024, 'mixture_components': 8, 'use_sparse_layer': True, 'use_sparse_loss': False, 'use_batchnorm': False, 'use_dropout': True, 'dropout': 0.6208363955608742, 'mlp_size_1': 1, 'mlp_size_2': 4, 'mlp_size_3': 1, 'kernel': 'LogNormal', 'loss_name': 'CensoredNLLLoss'}. Best is trial 422 with value: 0.8872774135438553.[0m
[32m[I 2022-04-16 05:41:58,879][0m Trial 437 finished with value: 0.8811898212775808 and parameters: {'n_hidden': 1024, 'mixture_components': 10, 'use_sparse_layer': True, 'use_sparse_loss': False, 'use_batchnorm': False, 'use_dropout': True, 'dropout': 0.5984259293880563, 'mlp_size_1': 1, 'mlp_size_2': 4, 'mlp_size_3': 1, 'kernel': 'Weibull', 'loss_name': 'CensoredNLLLoss'}. Best is trial 422 with value: 0.8872774135438553.[0m
[32m[I 2022-04-16 05:44:56,905][0m Trial 438 finished with value: 0.8837523586511955 and parameters: {'n_hidden': 2048, 'mixture_components': 9, 'use_sparse_layer': False, 'use_batchnorm': False, 'use_dropout': True, 'dropout': 0.5737573349339098, 'mlp_size_1': 1, 'mlp_size_2': 3, 'mlp_size_3': 1, 'kernel': 'Weibull', 'loss_name': 'CensoredNLLLoss'}. Best is trial 422 with value: 0.8872774135438553.[0m
[32m[I 2022-04-16 05:47:54,852][0m Trial 439 finished with value: 0.8849235363390168 and parameters: {'n_hidden': 1024, 'mixture_components': 10, 'use_sparse_layer': True, 'use_sparse_loss': False, 'use_batchnorm': False, 'use_dropout': True, 'dropout': 0.40694734830094487, 'mlp_size_1': 1, 'mlp_size_2': 4, 'mlp_size_3': 1, 'kernel': 'Weibull', 'loss_name': 'CensoredNLLLoss'}. Best is trial 422 with value: 0.8872774135438553.[0m
[32m[I 2022-04-16 05:50:26,928][0m Trial 440 finished with value: 0.8850241609417828 and parameters: {'n_hidden': 1024, 'mixture_components': 10, 'use_sparse_layer': True, 'use_sparse_loss': False, 'use_batchnorm': False, 'use_dropout': True, 'dropout': 0.560791701155907, 'mlp_size_1': 1, 'mlp_size_2': 3, 'mlp_size_3': 2, 'kernel': 'Weibull', 'loss_name': 'CensoredNLLLoss'}. Best is trial 422 with value: 0.8872774135438553.[0m
[32m[I 2022-04-16 05:53:05,774][0m Trial 441 finished with value: 0.8806979858453768 and parameters: {'n_hidden': 1024, 'mixture_components': 10, 'use_sparse_layer': True, 'use_sparse_loss': False, 'use_batchnorm': False, 'use_dropout': True, 'dropout': 0.6431499671447041, 'mlp_size_1': 1, 'mlp_size_2': 4, 'mlp_size_3': 1, 'kernel': 'Weibull', 'loss_name': 'CensoredNLLLoss'}. Best is trial 422 with value: 0.8872774135438553.[0m
[32m[I 2022-04-16 05:55:31,503][0m Trial 442 finished with value: 0.7876581624936072 and parameters: {'n_hidden': 1024, 'mixture_components': 9, 'use_sparse_layer': True, 'use_sparse_loss': False, 'use_batchnorm': False, 'use_dropout': True, 'dropout': 0.6137117097251356, 'mlp_size_1': 1, 'mlp_size_2': 3, 'mlp_size_3': 1, 'kernel': 'Exponential', 'loss_name': 'CensoredNLLLoss'}. Best is trial 422 with value: 0.8872774135438553.[0m
[32m[I 2022-04-16 05:58:01,507][0m Trial 443 finished with value: 0.8841131565574669 and parameters: {'n_hidden': 256, 'mixture_components': 10, 'use_sparse_layer': True, 'use_sparse_loss': False, 'use_batchnorm': False, 'use_dropout': True, 'dropout': 0.5891766675725422, 'mlp_size_1': 2, 'mlp_size_2': 3, 'mlp_size_3': 0, 'kernel': 'Weibull', 'loss_name': 'CensoredNLLLoss'}. Best is trial 422 with value: 0.8872774135438553.[0m
[32m[I 2022-04-16 06:00:33,927][0m Trial 444 finished with value: 0.8849594481748653 and parameters: {'n_hidden': 1024, 'mixture_components': 10, 'use_sparse_layer': True, 'use_sparse_loss': False, 'use_batchnorm': False, 'use_dropout': True, 'dropout': 0.5420407404704646, 'mlp_size_1': 1, 'mlp_size_2': 4, 'mlp_size_3': 1, 'kernel': 'Weibull', 'loss_name': 'CensoredNLLLoss'}. Best is trial 422 with value: 0.8872774135438553.[0m
[32m[I 2022-04-16 06:02:42,478][0m Trial 445 finished with value: 0.7574800517528325 and parameters: {'n_hidden': 1024, 'mixture_components': 9, 'use_sparse_layer': True, 'use_sparse_loss': False, 'use_batchnorm': False, 'use_dropout': True, 'dropout': 0.5958857125327789, 'mlp_size_1': 2, 'mlp_size_2': 4, 'mlp_size_3': 1, 'kernel': 'Weibull', 'loss_name': 'NLLLoss'}. Best is trial 422 with value: 0.8872774135438553.[0m
[32m[I 2022-04-16 06:05:10,683][0m Trial 446 finished with value: 0.8855763707670196 and parameters: {'n_hidden': 1024, 'mixture_components': 10, 'use_sparse_layer': True, 'use_sparse_loss': False, 'use_batchnorm': False, 'use_dropout': True, 'dropout': 0.3713363983891179, 'mlp_size_1': 1, 'mlp_size_2': 3, 'mlp_size_3': 1, 'kernel': 'Weibull', 'loss_name': 'CensoredNLLLoss'}. Best is trial 422 with value: 0.8872774135438553.[0m
[32m[I 2022-04-16 06:09:37,148][0m Trial 447 finished with value: 0.8819377928668208 and parameters: {'n_hidden': 1024, 'mixture_components': 10, 'use_sparse_layer': True, 'use_sparse_loss': False, 'use_batchnorm': True, 'use_dropout': True, 'dropout': 0.5656312066913812, 'mlp_size_1': 2, 'mlp_size_2': 4, 'mlp_size_3': 1, 'kernel': 'Weibull', 'loss_name': 'CensoredNLLLoss'}. Best is trial 422 with value: 0.8872774135438553.[0m
[32m[I 2022-04-16 06:11:59,136][0m Trial 448 finished with value: 0.6541486462071314 and parameters: {'n_hidden': 32, 'mixture_components': 10, 'use_sparse_layer': True, 'use_sparse_loss': False, 'use_batchnorm': False, 'use_dropout': True, 'dropout': 0.6576503473674616, 'mlp_size_1': 2, 'mlp_size_2': 0, 'mlp_size_3': 0, 'kernel': 'Logistic', 'loss_name': 'CensoredNLLLoss'}. Best is trial 422 with value: 0.8872774135438553.[0m
[32m[I 2022-04-16 06:14:08,077][0m Trial 449 finished with value: 0.7812367157177238 and parameters: {'n_hidden': 1024, 'mixture_components': 9, 'use_sparse_layer': False, 'use_batchnorm': False, 'use_dropout': False, 'mlp_size_1': 2, 'mlp_size_2': 4, 'mlp_size_3': 1, 'kernel': 'Weibull', 'loss_name': 'AlternativeNLLLoss'}. Best is trial 422 with value: 0.8872774135438553.[0m
