[32m[I 2022-04-17 01:20:00,601][0m Trial 914 finished with value: 0.8870801533583684 and parameters: {'n_hidden': 1024, 'mixture_components': 8, 'use_sparse_layer': False, 'use_batchnorm': False, 'use_dropout': True, 'dropout': 0.5934349130610547, 'mlp_size_1': 2, 'mlp_size_2': 4, 'mlp_size_3': 1, 'kernel': 'Gamma', 'loss_name': 'AlternativeNLLLoss'}. Best is trial 885 with value: 0.8901518638077398.[0m
[32m[I 2022-04-17 01:22:24,782][0m Trial 915 finished with value: 0.778904521488254 and parameters: {'n_hidden': 256, 'mixture_components': 8, 'use_sparse_layer': False, 'use_batchnorm': False, 'use_dropout': True, 'dropout': 0.6070009819211407, 'mlp_size_1': 2, 'mlp_size_2': 3, 'mlp_size_3': 0, 'kernel': 'LogLogistic', 'loss_name': 'AlternativeNLLLoss'}. Best is trial 885 with value: 0.8901518638077398.[0m
[32m[I 2022-04-17 01:24:32,464][0m Trial 916 finished with value: 0.8853075878672684 and parameters: {'n_hidden': 1024, 'mixture_components': 8, 'use_sparse_layer': False, 'use_batchnorm': False, 'use_dropout': True, 'dropout': 0.6069671049769764, 'mlp_size_1': 2, 'mlp_size_2': 4, 'mlp_size_3': 1, 'kernel': 'Gamma', 'loss_name': 'AlternativeNLLLoss'}. Best is trial 885 with value: 0.8901518638077398.[0m
[32m[I 2022-04-17 01:26:29,440][0m Trial 917 finished with value: 0.8849496440597031 and parameters: {'n_hidden': 512, 'mixture_components': 8, 'use_sparse_layer': False, 'use_batchnorm': False, 'use_dropout': True, 'dropout': 0.5914317174723169, 'mlp_size_1': 2, 'mlp_size_2': 4, 'mlp_size_3': 0, 'kernel': 'Gamma', 'loss_name': 'AlternativeNLLLoss'}. Best is trial 885 with value: 0.8901518638077398.[0m
[32m[I 2022-04-17 01:28:25,015][0m Trial 918 finished with value: 0.7809972438624838 and parameters: {'n_hidden': 1024, 'mixture_components': 8, 'use_sparse_layer': False, 'use_batchnorm': False, 'use_dropout': False, 'mlp_size_1': 0, 'mlp_size_2': 4, 'mlp_size_3': 1, 'kernel': 'Exponential', 'loss_name': 'AlternativeNLLLoss'}. Best is trial 885 with value: 0.8901518638077398.[0m
[32m[I 2022-04-17 01:31:31,627][0m Trial 919 finished with value: 0.8797595797420689 and parameters: {'n_hidden': 64, 'mixture_components': 8, 'use_sparse_layer': False, 'use_batchnorm': True, 'use_dropout': True, 'dropout': 0.5940922233525334, 'mlp_size_1': 2, 'mlp_size_2': 1, 'mlp_size_3': 0, 'kernel': 'Gamma', 'loss_name': 'AlternativeNLLLoss'}. Best is trial 885 with value: 0.8901518638077398.[0m
[32m[I 2022-04-17 01:33:58,987][0m Trial 920 finished with value: 0.8848976351029869 and parameters: {'n_hidden': 2048, 'mixture_components': 8, 'use_sparse_layer': False, 'use_batchnorm': False, 'use_dropout': True, 'dropout': 0.6225292779397548, 'mlp_size_1': 5, 'mlp_size_2': 3, 'mlp_size_3': 0, 'kernel': 'Gamma', 'loss_name': 'AlternativeNLLLoss'}. Best is trial 885 with value: 0.8901518638077398.[0m
[32m[I 2022-04-17 01:36:03,730][0m Trial 921 finished with value: 0.8871485383704257 and parameters: {'n_hidden': 1024, 'mixture_components': 8, 'use_sparse_layer': False, 'use_batchnorm': False, 'use_dropout': True, 'dropout': 0.6434228425498287, 'mlp_size_1': 2, 'mlp_size_2': 4, 'mlp_size_3': 1, 'kernel': 'Gamma', 'loss_name': 'AlternativeNLLLoss'}. Best is trial 885 with value: 0.8901518638077398.[0m
[32m[I 2022-04-17 01:37:53,775][0m Trial 922 finished with value: 0.6490905390335953 and parameters: {'n_hidden': 1024, 'mixture_components': 8, 'use_sparse_layer': False, 'use_batchnorm': False, 'use_dropout': True, 'dropout': 0.6512102021054611, 'mlp_size_1': 2, 'mlp_size_2': 4, 'mlp_size_3': 1, 'kernel': 'Gamma', 'loss_name': 'NLLLoss'}. Best is trial 885 with value: 0.8901518638077398.[0m
[32m[I 2022-04-17 01:39:53,548][0m Trial 923 finished with value: 0.8847825888748438 and parameters: {'n_hidden': 1024, 'mixture_components': 8, 'use_sparse_layer': False, 'use_batchnorm': False, 'use_dropout': True, 'dropout': 0.5903129103262833, 'mlp_size_1': 2, 'mlp_size_2': 4, 'mlp_size_3': 1, 'kernel': 'Gamma', 'loss_name': 'AlternativeNLLLoss'}. Best is trial 885 with value: 0.8901518638077398.[0m
[32m[I 2022-04-17 01:42:11,695][0m Trial 924 finished with value: 0.8842121161622696 and parameters: {'n_hidden': 1024, 'mixture_components': 8, 'use_sparse_layer': False, 'use_batchnorm': False, 'use_dropout': True, 'dropout': 0.6687087071021751, 'mlp_size_1': 2, 'mlp_size_2': 4, 'mlp_size_3': 1, 'kernel': 'Gamma', 'loss_name': 'AlternativeNLLLoss'}. Best is trial 885 with value: 0.8901518638077398.[0m
[32m[I 2022-04-17 01:44:34,697][0m Trial 925 finished with value: 0.8829361009852352 and parameters: {'n_hidden': 1024, 'mixture_components': 8, 'use_sparse_layer': False, 'use_batchnorm': False, 'use_dropout': True, 'dropout': 0.6435616967705389, 'mlp_size_1': 2, 'mlp_size_2': 4, 'mlp_size_3': 1, 'kernel': 'Gamma', 'loss_name': 'AlternativeNLLLoss'}. Best is trial 885 with value: 0.8901518638077398.[0m
[32m[I 2022-04-17 01:46:43,779][0m Trial 926 finished with value: 0.8852510756096962 and parameters: {'n_hidden': 1024, 'mixture_components': 8, 'use_sparse_layer': False, 'use_batchnorm': False, 'use_dropout': True, 'dropout': 0.6093311581998431, 'mlp_size_1': 2, 'mlp_size_2': 4, 'mlp_size_3': 1, 'kernel': 'Gamma', 'loss_name': 'AlternativeNLLLoss'}. Best is trial 885 with value: 0.8901518638077398.[0m
[32m[I 2022-04-17 01:48:36,712][0m Trial 927 finished with value: 0.8873385190655375 and parameters: {'n_hidden': 256, 'mixture_components': 8, 'use_sparse_layer': False, 'use_batchnorm': False, 'use_dropout': True, 'dropout': 0.6217660758654765, 'mlp_size_1': 2, 'mlp_size_2': 3, 'mlp_size_3': 0, 'kernel': 'Gamma', 'loss_name': 'AlternativeNLLLoss'}. Best is trial 885 with value: 0.8901518638077398.[0m
[32m[I 2022-04-17 01:50:37,931][0m Trial 928 finished with value: 0.884203771882514 and parameters: {'n_hidden': 256, 'mixture_components': 8, 'use_sparse_layer': False, 'use_batchnorm': False, 'use_dropout': True, 'dropout': 0.6598468845246791, 'mlp_size_1': 2, 'mlp_size_2': 3, 'mlp_size_3': 0, 'kernel': 'Gamma', 'loss_name': 'AlternativeNLLLoss'}. Best is trial 885 with value: 0.8901518638077398.[0m
[32m[I 2022-04-17 01:52:50,034][0m Trial 929 finished with value: 0.886511545660675 and parameters: {'n_hidden': 256, 'mixture_components': 8, 'use_sparse_layer': False, 'use_batchnorm': False, 'use_dropout': True, 'dropout': 0.6248529629560868, 'mlp_size_1': 2, 'mlp_size_2': 3, 'mlp_size_3': 0, 'kernel': 'Gamma', 'loss_name': 'AlternativeNLLLoss'}. Best is trial 885 with value: 0.8901518638077398.[0m
[32m[I 2022-04-17 01:54:32,817][0m Trial 930 finished with value: 0.8176768652059782 and parameters: {'n_hidden': 256, 'mixture_components': 8, 'use_sparse_layer': False, 'use_batchnorm': False, 'use_dropout': True, 'dropout': 0.6246815090548961, 'mlp_size_1': 2, 'mlp_size_2': 3, 'mlp_size_3': 0, 'kernel': 'Gumbel', 'loss_name': 'AlternativeNLLLoss'}. Best is trial 885 with value: 0.8901518638077398.[0m
[32m[I 2022-04-17 01:56:42,660][0m Trial 931 finished with value: 0.884362998496562 and parameters: {'n_hidden': 256, 'mixture_components': 8, 'use_sparse_layer': False, 'use_batchnorm': False, 'use_dropout': True, 'dropout': 0.6489910609037824, 'mlp_size_1': 2, 'mlp_size_2': 3, 'mlp_size_3': 0, 'kernel': 'Gamma', 'loss_name': 'AlternativeNLLLoss'}. Best is trial 885 with value: 0.8901518638077398.[0m
[32m[I 2022-04-17 01:58:50,017][0m Trial 932 finished with value: 0.8844093900130634 and parameters: {'n_hidden': 256, 'mixture_components': 4, 'use_sparse_layer': False, 'use_batchnorm': False, 'use_dropout': True, 'dropout': 0.6684780190916265, 'mlp_size_1': 2, 'mlp_size_2': 3, 'mlp_size_3': 0, 'kernel': 'Gamma', 'loss_name': 'AlternativeNLLLoss'}. Best is trial 885 with value: 0.8901518638077398.[0m
[32m[I 2022-04-17 02:01:05,436][0m Trial 933 finished with value: 0.8866869012280706 and parameters: {'n_hidden': 256, 'mixture_components': 5, 'use_sparse_layer': False, 'use_batchnorm': False, 'use_dropout': True, 'dropout': 0.637805838313515, 'mlp_size_1': 2, 'mlp_size_2': 3, 'mlp_size_3': 0, 'kernel': 'Gamma', 'loss_name': 'AlternativeNLLLoss'}. Best is trial 885 with value: 0.8901518638077398.[0m
/media/san2_ssd/data/Workdir/survival/utils.py:305: RuntimeWarning: invalid value encountered in true_divide
  pdfs = np.gradient(1-survs,axis=1)/norms
[32m[I 2022-04-17 02:04:11,274][0m Trial 934 finished with value: 0.4851700752182183 and parameters: {'n_hidden': 256, 'mixture_components': 8, 'use_sparse_layer': False, 'use_batchnorm': False, 'use_dropout': True, 'dropout': 0.6877354262362978, 'mlp_size_1': 2, 'mlp_size_2': 3, 'mlp_size_3': 0, 'kernel': 'Normal', 'loss_name': 'AlternativeNLLLoss'}. Best is trial 885 with value: 0.8901518638077398.[0m
[32m[I 2022-04-17 02:06:32,134][0m Trial 935 finished with value: 0.8841104063812658 and parameters: {'n_hidden': 256, 'mixture_components': 8, 'use_sparse_layer': False, 'use_batchnorm': False, 'use_dropout': True, 'dropout': 0.6111707483364415, 'mlp_size_1': 2, 'mlp_size_2': 3, 'mlp_size_3': 0, 'kernel': 'Gamma', 'loss_name': 'AlternativeNLLLoss'}. Best is trial 885 with value: 0.8901518638077398.[0m
[32m[I 2022-04-17 02:09:10,066][0m Trial 936 finished with value: 0.8814317894347491 and parameters: {'n_hidden': 256, 'mixture_components': 8, 'use_sparse_layer': False, 'use_batchnorm': False, 'use_dropout': True, 'dropout': 0.9350940262264731, 'mlp_size_1': 2, 'mlp_size_2': 3, 'mlp_size_3': 0, 'kernel': 'Gamma', 'loss_name': 'AlternativeNLLLoss'}. Best is trial 885 with value: 0.8901518638077398.[0m
[32m[I 2022-04-17 02:12:59,017][0m Trial 937 finished with value: 0.7681754371603888 and parameters: {'n_hidden': 32, 'mixture_components': 8, 'use_sparse_layer': False, 'use_batchnorm': False, 'use_dropout': False, 'mlp_size_1': 2, 'mlp_size_2': 0, 'mlp_size_3': 0, 'kernel': 'LogNormal', 'loss_name': 'AlternativeNLLLoss'}. Best is trial 885 with value: 0.8901518638077398.[0m
[32m[I 2022-04-17 02:15:33,754][0m Trial 938 finished with value: 0.868144513717106 and parameters: {'n_hidden': 256, 'mixture_components': 8, 'use_sparse_layer': False, 'use_batchnorm': True, 'use_dropout': True, 'dropout': 0.6587460394264935, 'mlp_size_1': 2, 'mlp_size_2': 3, 'mlp_size_3': 0, 'kernel': 'Gamma', 'loss_name': 'AlternativeNLLLoss'}. Best is trial 885 with value: 0.8901518638077398.[0m
[32m[I 2022-04-17 02:17:58,573][0m Trial 939 finished with value: 0.8854420468021417 and parameters: {'n_hidden': 256, 'mixture_components': 8, 'use_sparse_layer': False, 'use_batchnorm': False, 'use_dropout': True, 'dropout': 0.6974831157637916, 'mlp_size_1': 2, 'mlp_size_2': 3, 'mlp_size_3': 0, 'kernel': 'Gamma', 'loss_name': 'AlternativeNLLLoss'}. Best is trial 885 with value: 0.8901518638077398.[0m
[32m[I 2022-04-17 02:19:59,896][0m Trial 940 finished with value: 0.8838330875778151 and parameters: {'n_hidden': 256, 'mixture_components': 8, 'use_sparse_layer': False, 'use_batchnorm': False, 'use_dropout': True, 'dropout': 0.6445226749760729, 'mlp_size_1': 2, 'mlp_size_2': 3, 'mlp_size_3': 0, 'kernel': 'Gamma', 'loss_name': 'AlternativeNLLLoss'}. Best is trial 885 with value: 0.8901518638077398.[0m
[32m[I 2022-04-17 02:22:11,378][0m Trial 941 finished with value: 0.8850813920204015 and parameters: {'n_hidden': 256, 'mixture_components': 8, 'use_sparse_layer': False, 'use_batchnorm': False, 'use_dropout': True, 'dropout': 0.6037949897397035, 'mlp_size_1': 2, 'mlp_size_2': 3, 'mlp_size_3': 0, 'kernel': 'Gamma', 'loss_name': 'AlternativeNLLLoss'}. Best is trial 885 with value: 0.8901518638077398.[0m
[32m[I 2022-04-17 02:24:01,732][0m Trial 942 finished with value: 0.7861190378354257 and parameters: {'n_hidden': 512, 'mixture_components': 8, 'use_sparse_layer': False, 'use_batchnorm': False, 'use_dropout': True, 'dropout': 0.6688813396318566, 'mlp_size_1': 2, 'mlp_size_2': 4, 'mlp_size_3': 0, 'kernel': 'Exponential', 'loss_name': 'AlternativeNLLLoss'}. Best is trial 885 with value: 0.8901518638077398.[0m
[32m[I 2022-04-17 02:26:40,013][0m Trial 943 finished with value: 0.8460667428287211 and parameters: {'n_hidden': 64, 'mixture_components': 8, 'use_sparse_layer': False, 'use_batchnorm': False, 'use_dropout': True, 'dropout': 0.6223118335311391, 'mlp_size_1': 2, 'mlp_size_2': 1, 'mlp_size_3': 0, 'kernel': 'LogLogistic', 'loss_name': 'NLLLoss'}. Best is trial 885 with value: 0.8901518638077398.[0m
[32m[I 2022-04-17 02:28:36,034][0m Trial 944 finished with value: 0.8845752537082152 and parameters: {'n_hidden': 256, 'mixture_components': 8, 'use_sparse_layer': False, 'use_batchnorm': False, 'use_dropout': True, 'dropout': 0.6810192025481051, 'mlp_size_1': 2, 'mlp_size_2': 3, 'mlp_size_3': 0, 'kernel': 'Gamma', 'loss_name': 'AlternativeNLLLoss'}. Best is trial 885 with value: 0.8901518638077398.[0m
[32m[I 2022-04-17 02:30:30,819][0m Trial 945 finished with value: 0.8843677906138572 and parameters: {'n_hidden': 256, 'mixture_components': 8, 'use_sparse_layer': False, 'use_batchnorm': False, 'use_dropout': True, 'dropout': 0.6373558584007145, 'mlp_size_1': 2, 'mlp_size_2': 3, 'mlp_size_3': 0, 'kernel': 'Gamma', 'loss_name': 'AlternativeNLLLoss'}. Best is trial 885 with value: 0.8901518638077398.[0m
[32m[I 2022-04-17 02:32:53,075][0m Trial 946 finished with value: 0.8856548986071452 and parameters: {'n_hidden': 256, 'mixture_components': 6, 'use_sparse_layer': False, 'use_batchnorm': False, 'use_dropout': True, 'dropout': 0.6998370651400744, 'mlp_size_1': 2, 'mlp_size_2': 3, 'mlp_size_3': 0, 'kernel': 'Gamma', 'loss_name': 'AlternativeNLLLoss'}. Best is trial 885 with value: 0.8901518638077398.[0m
[32m[I 2022-04-17 02:35:00,750][0m Trial 947 finished with value: 0.8837184390462042 and parameters: {'n_hidden': 128, 'mixture_components': 8, 'use_sparse_layer': False, 'use_batchnorm': False, 'use_dropout': True, 'dropout': 0.5955017067444641, 'mlp_size_1': 2, 'mlp_size_2': 2, 'mlp_size_3': 0, 'kernel': 'Gamma', 'loss_name': 'AlternativeNLLLoss'}. Best is trial 885 with value: 0.8901518638077398.[0m
[32m[I 2022-04-17 02:36:57,996][0m Trial 948 finished with value: 0.8845176305650011 and parameters: {'n_hidden': 256, 'mixture_components': 8, 'use_sparse_layer': False, 'use_batchnorm': False, 'use_dropout': True, 'dropout': 0.6522055094055226, 'mlp_size_1': 2, 'mlp_size_2': 3, 'mlp_size_3': 0, 'kernel': 'Gamma', 'loss_name': 'AlternativeNLLLoss'}. Best is trial 885 with value: 0.8901518638077398.[0m
[32m[I 2022-04-17 02:39:29,162][0m Trial 949 finished with value: 0.8729274775419968 and parameters: {'n_hidden': 2048, 'mixture_components': 8, 'use_sparse_layer': False, 'use_batchnorm': False, 'use_dropout': True, 'dropout': 0.619002995813971, 'mlp_size_1': 0, 'mlp_size_2': 8, 'mlp_size_3': 0, 'kernel': 'Gamma', 'loss_name': 'AlternativeNLLLoss'}. Best is trial 885 with value: 0.8901518638077398.[0m
[32m[I 2022-04-17 02:41:52,105][0m Trial 950 finished with value: 0.8839505894511669 and parameters: {'n_hidden': 1024, 'mixture_components': 8, 'use_sparse_layer': False, 'use_batchnorm': False, 'use_dropout': True, 'dropout': 0.6827671232907151, 'mlp_size_1': 3, 'mlp_size_2': 4, 'mlp_size_3': 0, 'kernel': 'Gamma', 'loss_name': 'AlternativeNLLLoss'}. Best is trial 885 with value: 0.8901518638077398.[0m
[32m[I 2022-04-17 02:44:05,731][0m Trial 951 finished with value: 0.8862426328717762 and parameters: {'n_hidden': 512, 'mixture_components': 8, 'use_sparse_layer': False, 'use_batchnorm': False, 'use_dropout': True, 'dropout': 0.5900392380366757, 'mlp_size_1': 2, 'mlp_size_2': 4, 'mlp_size_3': 0, 'kernel': 'Gamma', 'loss_name': 'AlternativeNLLLoss'}. Best is trial 885 with value: 0.8901518638077398.[0m
[32m[I 2022-04-17 02:46:03,967][0m Trial 952 finished with value: 0.8838455133369496 and parameters: {'n_hidden': 1024, 'mixture_components': 8, 'use_sparse_layer': False, 'use_batchnorm': False, 'use_dropout': True, 'dropout': 0.7061262346794565, 'mlp_size_1': 3, 'mlp_size_2': 4, 'mlp_size_3': 0, 'kernel': 'Gamma', 'loss_name': 'AlternativeNLLLoss'}. Best is trial 885 with value: 0.8901518638077398.[0m
[32m[I 2022-04-17 02:48:18,350][0m Trial 953 finished with value: 0.7872171377584269 and parameters: {'n_hidden': 1024, 'mixture_components': 8, 'use_sparse_layer': False, 'use_batchnorm': False, 'use_dropout': True, 'dropout': 0.6351325525296526, 'mlp_size_1': 3, 'mlp_size_2': 4, 'mlp_size_3': 0, 'kernel': 'Gamma', 'loss_name': 'AlternativeNLLLoss'}. Best is trial 885 with value: 0.8901518638077398.[0m
[32m[I 2022-04-17 02:50:24,169][0m Trial 954 finished with value: 0.8840787586012528 and parameters: {'n_hidden': 256, 'mixture_components': 8, 'use_sparse_layer': False, 'use_batchnorm': False, 'use_dropout': True, 'dropout': 0.6657095296389733, 'mlp_size_1': 2, 'mlp_size_2': 3, 'mlp_size_3': 0, 'kernel': 'Gamma', 'loss_name': 'AlternativeNLLLoss'}. Best is trial 885 with value: 0.8901518638077398.[0m
[32m[I 2022-04-17 02:52:38,186][0m Trial 955 finished with value: 0.8860249814763099 and parameters: {'n_hidden': 1024, 'mixture_components': 8, 'use_sparse_layer': False, 'use_batchnorm': False, 'use_dropout': True, 'dropout': 0.6084072913951822, 'mlp_size_1': 2, 'mlp_size_2': 4, 'mlp_size_3': 1, 'kernel': 'Gamma', 'loss_name': 'AlternativeNLLLoss'}. Best is trial 885 with value: 0.8901518638077398.[0m
[32m[I 2022-04-17 02:54:49,603][0m Trial 956 finished with value: 0.8792817762973577 and parameters: {'n_hidden': 1024, 'mixture_components': 8, 'use_sparse_layer': False, 'use_batchnorm': False, 'use_dropout': False, 'mlp_size_1': 2, 'mlp_size_2': 4, 'mlp_size_3': 1, 'kernel': 'Gamma', 'loss_name': 'AlternativeNLLLoss'}. Best is trial 885 with value: 0.8901518638077398.[0m
[32m[I 2022-04-17 02:56:46,498][0m Trial 957 finished with value: -0.5 and parameters: {'n_hidden': 1024, 'mixture_components': 8, 'use_sparse_layer': False, 'use_batchnorm': True, 'use_dropout': True, 'dropout': 0.6432619264011037, 'mlp_size_1': 3, 'mlp_size_2': 4, 'mlp_size_3': 0, 'kernel': 'Gumbel', 'loss_name': 'AlternativeNLLLoss'}. Best is trial 885 with value: 0.8901518638077398.[0m
[32m[I 2022-04-17 02:58:55,085][0m Trial 958 finished with value: 0.8850739592680619 and parameters: {'n_hidden': 1024, 'mixture_components': 8, 'use_sparse_layer': False, 'use_batchnorm': False, 'use_dropout': True, 'dropout': 0.5860731424836373, 'mlp_size_1': 2, 'mlp_size_2': 4, 'mlp_size_3': 1, 'kernel': 'Gamma', 'loss_name': 'AlternativeNLLLoss'}. Best is trial 885 with value: 0.8901518638077398.[0m
[32m[I 2022-04-17 03:01:11,519][0m Trial 959 finished with value: 0.8849065203688868 and parameters: {'n_hidden': 1024, 'mixture_components': 8, 'use_sparse_layer': False, 'use_batchnorm': False, 'use_dropout': True, 'dropout': 0.6677275856684083, 'mlp_size_1': 2, 'mlp_size_2': 4, 'mlp_size_3': 1, 'kernel': 'Gamma', 'loss_name': 'AlternativeNLLLoss'}. Best is trial 885 with value: 0.8901518638077398.[0m
[32m[I 2022-04-17 03:03:28,162][0m Trial 960 finished with value: 0.8424076284774167 and parameters: {'n_hidden': 1024, 'mixture_components': 8, 'use_sparse_layer': False, 'use_batchnorm': False, 'use_dropout': True, 'dropout': 0.6112980519104435, 'mlp_size_1': 2, 'mlp_size_2': 4, 'mlp_size_3': 1, 'kernel': 'Normal', 'loss_name': 'NLLLoss'}. Best is trial 885 with value: 0.8901518638077398.[0m
[32m[I 2022-04-17 03:05:31,852][0m Trial 961 finished with value: 0.8838490604022677 and parameters: {'n_hidden': 256, 'mixture_components': 3, 'use_sparse_layer': False, 'use_batchnorm': False, 'use_dropout': True, 'dropout': 0.6982089601273952, 'mlp_size_1': 2, 'mlp_size_2': 3, 'mlp_size_3': 0, 'kernel': 'Gamma', 'loss_name': 'AlternativeNLLLoss'}. Best is trial 885 with value: 0.8901518638077398.[0m
[32m[I 2022-04-17 03:09:03,569][0m Trial 962 finished with value: 0.882691053279747 and parameters: {'n_hidden': 32, 'mixture_components': 8, 'use_sparse_layer': False, 'use_batchnorm': False, 'use_dropout': True, 'dropout': 0.6389871502296808, 'mlp_size_1': 2, 'mlp_size_2': 0, 'mlp_size_3': 0, 'kernel': 'Gamma', 'loss_name': 'AlternativeNLLLoss'}. Best is trial 885 with value: 0.8901518638077398.[0m
[32m[I 2022-04-17 03:12:09,482][0m Trial 963 finished with value: 0.7810418195809395 and parameters: {'n_hidden': 1024, 'mixture_components': 8, 'use_sparse_layer': False, 'use_batchnorm': False, 'use_dropout': True, 'dropout': 0.711215989377671, 'mlp_size_1': 2, 'mlp_size_2': 4, 'mlp_size_3': 1, 'kernel': 'LogNormal', 'loss_name': 'AlternativeNLLLoss'}. Best is trial 885 with value: 0.8901518638077398.[0m
[32m[I 2022-04-17 03:14:20,603][0m Trial 964 finished with value: 0.8848458984354235 and parameters: {'n_hidden': 1024, 'mixture_components': 8, 'use_sparse_layer': False, 'use_batchnorm': False, 'use_dropout': True, 'dropout': 0.6279703094033355, 'mlp_size_1': 2, 'mlp_size_2': 4, 'mlp_size_3': 1, 'kernel': 'Gamma', 'loss_name': 'AlternativeNLLLoss'}. Best is trial 885 with value: 0.8901518638077398.[0m
[32m[I 2022-04-17 03:16:44,635][0m Trial 965 finished with value: 0.8850042407443593 and parameters: {'n_hidden': 1024, 'mixture_components': 6, 'use_sparse_layer': False, 'use_batchnorm': False, 'use_dropout': True, 'dropout': 0.686259952313581, 'mlp_size_1': 2, 'mlp_size_2': 4, 'mlp_size_3': 1, 'kernel': 'Gamma', 'loss_name': 'AlternativeNLLLoss'}. Best is trial 885 with value: 0.8901518638077398.[0m
[32m[I 2022-04-17 03:18:33,682][0m Trial 966 finished with value: 0.8870555851708886 and parameters: {'n_hidden': 512, 'mixture_components': 8, 'use_sparse_layer': False, 'use_batchnorm': False, 'use_dropout': True, 'dropout': 0.6539501619460211, 'mlp_size_1': 2, 'mlp_size_2': 4, 'mlp_size_3': 0, 'kernel': 'Gamma', 'loss_name': 'AlternativeNLLLoss'}. Best is trial 885 with value: 0.8901518638077398.[0m
