[32m[I 2022-04-13 12:16:45,065][0m Trial 197 finished with value: 0.7727053063636226 and parameters: {'splitter': 'best', 'min_samples_split': 0.10032099459690999, 'min_samples_leaf': 0.015467109606271569, 'min_weight_fraction_leaf': 0.03412965312785437, 'max_features': 0.9792564751479483}. Best is trial 161 with value: 0.7752929650004449.[0m
[32m[I 2022-04-13 12:16:46,588][0m Trial 198 finished with value: 0.7725828131056098 and parameters: {'splitter': 'best', 'min_samples_split': 0.15468646700869626, 'min_samples_leaf': 0.03760529228116558, 'min_weight_fraction_leaf': 0.02767583483719255, 'max_features': 0.998639503064975}. Best is trial 161 with value: 0.7752929650004449.[0m
[32m[I 2022-04-13 12:16:46,807][0m Trial 199 finished with value: 0.7380721120646487 and parameters: {'splitter': 'random', 'min_samples_split': 0.12477054876076117, 'min_samples_leaf': 0.04643670327641906, 'min_weight_fraction_leaf': 0.03362399841254937, 'max_features': 0.9992850806458018}. Best is trial 161 with value: 0.7752929650004449.[0m
[32m[I 2022-04-13 12:16:49,294][0m Trial 200 finished with value: 0.7719477298121291 and parameters: {'splitter': 'best', 'min_samples_split': 0.10087860962715743, 'min_samples_leaf': 0.03884702649905114, 'min_weight_fraction_leaf': 0.032258887828203964, 'max_features': 0.9803143778639724}. Best is trial 161 with value: 0.7752929650004449.[0m
[32m[I 2022-04-13 12:16:51,684][0m Trial 201 finished with value: 0.7725828131056098 and parameters: {'splitter': 'best', 'min_samples_split': 0.15295120806215629, 'min_samples_leaf': 0.038350860898364064, 'min_weight_fraction_leaf': 0.030918754141165676, 'max_features': 0.9806506562222698}. Best is trial 161 with value: 0.7752929650004449.[0m
[32m[I 2022-04-13 12:16:53,196][0m Trial 202 finished with value: 0.7670928976355765 and parameters: {'splitter': 'best', 'min_samples_split': 0.17332563120745959, 'min_samples_leaf': 0.038349442078669735, 'min_weight_fraction_leaf': 0.033349447003586635, 'max_features': 0.9830671321836784}. Best is trial 161 with value: 0.7752929650004449.[0m
[32m[I 2022-04-13 12:16:55,692][0m Trial 203 finished with value: 0.7654482022980433 and parameters: {'splitter': 'best', 'min_samples_split': 0.14928314990694522, 'min_samples_leaf': 0.050243793005617335, 'min_weight_fraction_leaf': 0.0494087709980419, 'max_features': 0.9637860499078378}. Best is trial 161 with value: 0.7752929650004449.[0m
[32m[I 2022-04-13 12:16:58,084][0m Trial 204 finished with value: 0.7642093491120809 and parameters: {'splitter': 'best', 'min_samples_split': 0.19182246515141035, 'min_samples_leaf': 0.03838645816905358, 'min_weight_fraction_leaf': 0.025945657230683632, 'max_features': 0.979968260893284}. Best is trial 161 with value: 0.7752929650004449.[0m
[32m[I 2022-04-13 12:16:59,859][0m Trial 205 finished with value: 0.7117924516846708 and parameters: {'splitter': 'best', 'min_samples_split': 0.15556549412098014, 'min_samples_leaf': 0.18841706809320236, 'min_weight_fraction_leaf': 0.03713396785127819, 'max_features': 0.9590426586027173}. Best is trial 161 with value: 0.7752929650004449.[0m
[32m[I 2022-04-13 12:17:00,586][0m Trial 206 finished with value: 0.7715463090183867 and parameters: {'splitter': 'best', 'min_samples_split': 0.109236393786513, 'min_samples_leaf': 0.06128720734370928, 'min_weight_fraction_leaf': 0.02520910223808034, 'max_features': 0.9995574199486628}. Best is trial 161 with value: 0.7752929650004449.[0m
[32m[I 2022-04-13 12:17:01,506][0m Trial 207 finished with value: 0.7715389160410744 and parameters: {'splitter': 'best', 'min_samples_split': 0.10628473597965285, 'min_samples_leaf': 0.06078426682922931, 'min_weight_fraction_leaf': 0.05818518003996138, 'max_features': 0.998569829810693}. Best is trial 161 with value: 0.7752929650004449.[0m
[32m[I 2022-04-13 12:17:03,303][0m Trial 208 finished with value: 0.7716484261219019 and parameters: {'splitter': 'best', 'min_samples_split': 0.1341504605710125, 'min_samples_leaf': 0.0613339578343705, 'min_weight_fraction_leaf': 0.061641436406530095, 'max_features': 0.9951199863076026}. Best is trial 161 with value: 0.7752929650004449.[0m
[32m[I 2022-04-13 12:17:04,677][0m Trial 209 finished with value: 0.7689645608482674 and parameters: {'splitter': 'best', 'min_samples_split': 0.13349083893539312, 'min_samples_leaf': 0.06403320348648883, 'min_weight_fraction_leaf': 0.06812266837097336, 'max_features': 0.980802513103308}. Best is trial 161 with value: 0.7752929650004449.[0m
[32m[I 2022-04-13 12:17:06,843][0m Trial 210 finished with value: 0.7649965992405638 and parameters: {'splitter': 'best', 'min_samples_split': 0.1085805914365672, 'min_samples_leaf': 0.057809517883828425, 'min_weight_fraction_leaf': 0.05764381534154782, 'max_features': 0.9569086736300728}. Best is trial 161 with value: 0.7752929650004449.[0m
[32m[I 2022-04-13 12:17:08,339][0m Trial 211 finished with value: 0.7664815541316651 and parameters: {'splitter': 'best', 'min_samples_split': 0.16124641786596913, 'min_samples_leaf': 0.03580371489088721, 'min_weight_fraction_leaf': 0.05193784556734819, 'max_features': 0.998562355306513}. Best is trial 161 with value: 0.7752929650004449.[0m
[32m[I 2022-04-13 12:17:10,489][0m Trial 212 finished with value: 0.7723334357708791 and parameters: {'splitter': 'best', 'min_samples_split': 0.12039115895287632, 'min_samples_leaf': 0.05017763884102593, 'min_weight_fraction_leaf': 0.02724204908827614, 'max_features': 0.9791987904585694}. Best is trial 161 with value: 0.7752929650004449.[0m
[32m[I 2022-04-13 12:17:12,339][0m Trial 213 finished with value: 0.7707334498141335 and parameters: {'splitter': 'best', 'min_samples_split': 0.12217717052200096, 'min_samples_leaf': 0.05601918537837075, 'min_weight_fraction_leaf': 0.03640917036276121, 'max_features': 0.9997877095489002}. Best is trial 161 with value: 0.7752929650004449.[0m
[32m[I 2022-04-13 12:17:14,626][0m Trial 214 finished with value: 0.7749206965180232 and parameters: {'splitter': 'best', 'min_samples_split': 0.13309598952474358, 'min_samples_leaf': 0.04602981688274484, 'min_weight_fraction_leaf': 0.046884506005690926, 'max_features': 0.9779765922246509}. Best is trial 161 with value: 0.7752929650004449.[0m
[32m[I 2022-04-13 12:17:15,167][0m Trial 215 finished with value: 0.7022767458820938 and parameters: {'splitter': 'best', 'min_samples_split': 0.140225139804039, 'min_samples_leaf': 0.2584714381786409, 'min_weight_fraction_leaf': 0.06208427942001464, 'max_features': 0.9658101170003184}. Best is trial 161 with value: 0.7752929650004449.[0m
[32m[I 2022-04-13 12:17:16,455][0m Trial 216 finished with value: 0.7711644052028728 and parameters: {'splitter': 'best', 'min_samples_split': 0.15127876839978338, 'min_samples_leaf': 0.06314208071439395, 'min_weight_fraction_leaf': 0.046630083666368505, 'max_features': 0.9779554884337457}. Best is trial 161 with value: 0.7752929650004449.[0m
[32m[I 2022-04-13 12:17:19,017][0m Trial 217 finished with value: 0.7637832218784595 and parameters: {'splitter': 'best', 'min_samples_split': 0.13788085173647874, 'min_samples_leaf': 0.046306679262371364, 'min_weight_fraction_leaf': 0.027201486610987254, 'max_features': 0.9491158529725011}. Best is trial 161 with value: 0.7752929650004449.[0m
[32m[I 2022-04-13 12:17:21,812][0m Trial 218 finished with value: 0.7705673993331413 and parameters: {'splitter': 'best', 'min_samples_split': 0.13145663937208332, 'min_samples_leaf': 0.048515950127035856, 'min_weight_fraction_leaf': 0.045489247451733564, 'max_features': 0.9796325296676275}. Best is trial 161 with value: 0.7752929650004449.[0m
[32m[I 2022-04-13 12:17:23,120][0m Trial 219 finished with value: 0.7643637680731431 and parameters: {'splitter': 'best', 'min_samples_split': 0.12053870153595243, 'min_samples_leaf': 0.06074014511924297, 'min_weight_fraction_leaf': 0.058448043808160086, 'max_features': 0.9245388167129585}. Best is trial 161 with value: 0.7752929650004449.[0m
[32m[I 2022-04-13 12:17:24,910][0m Trial 220 finished with value: 0.7688227956863387 and parameters: {'splitter': 'best', 'min_samples_split': 0.109161254483257, 'min_samples_leaf': 0.03773696224469811, 'min_weight_fraction_leaf': 0.03367070822022407, 'max_features': 0.9578316393154475}. Best is trial 161 with value: 0.7752929650004449.[0m
[32m[I 2022-04-13 12:17:26,468][0m Trial 221 finished with value: 0.773699253230707 and parameters: {'splitter': 'best', 'min_samples_split': 0.10657777628918955, 'min_samples_leaf': 0.04055544156722703, 'min_weight_fraction_leaf': 0.018976318278598473, 'max_features': 0.9994206571870017}. Best is trial 161 with value: 0.7752929650004449.[0m
[32m[I 2022-04-13 12:17:28,193][0m Trial 222 finished with value: 0.7726514747922956 and parameters: {'splitter': 'best', 'min_samples_split': 0.11664718646302336, 'min_samples_leaf': 0.04844865395581574, 'min_weight_fraction_leaf': 0.023673937731315008, 'max_features': 0.9804878599465032}. Best is trial 161 with value: 0.7752929650004449.[0m
[32m[I 2022-04-13 12:17:29,366][0m Trial 223 finished with value: 0.7707334498141335 and parameters: {'splitter': 'best', 'min_samples_split': 0.11861109181085783, 'min_samples_leaf': 0.05484266167403784, 'min_weight_fraction_leaf': 0.024097373623698147, 'max_features': 0.9765164137424843}. Best is trial 161 with value: 0.7752929650004449.[0m
[32m[I 2022-04-13 12:17:31,464][0m Trial 224 finished with value: 0.7738275201630542 and parameters: {'splitter': 'best', 'min_samples_split': 0.10687977235979884, 'min_samples_leaf': 0.04189840468981667, 'min_weight_fraction_leaf': 0.03991657826783279, 'max_features': 0.9783389193953608}. Best is trial 161 with value: 0.7752929650004449.[0m
[32m[I 2022-04-13 12:17:34,271][0m Trial 225 finished with value: 0.7677539563316469 and parameters: {'splitter': 'best', 'min_samples_split': 0.1249859528378982, 'min_samples_leaf': 0.043471261237902, 'min_weight_fraction_leaf': 0.040731359607407536, 'max_features': 0.9489431160988709}. Best is trial 161 with value: 0.7752929650004449.[0m
[32m[I 2022-04-13 12:17:37,229][0m Trial 226 finished with value: 0.7679930877218492 and parameters: {'splitter': 'best', 'min_samples_split': 0.1134708405592786, 'min_samples_leaf': 0.03890303610347267, 'min_weight_fraction_leaf': 0.024466996621892195, 'max_features': 0.9682386848106149}. Best is trial 161 with value: 0.7752929650004449.[0m
[32m[I 2022-04-13 12:17:39,052][0m Trial 227 finished with value: 0.7707489209884318 and parameters: {'splitter': 'best', 'min_samples_split': 0.12854154969562717, 'min_samples_leaf': 0.05133408548006963, 'min_weight_fraction_leaf': 0.03438847527574309, 'max_features': 0.9775742910051624}. Best is trial 161 with value: 0.7752929650004449.[0m
[32m[I 2022-04-13 12:17:42,101][0m Trial 228 finished with value: 0.7702152434031215 and parameters: {'splitter': 'best', 'min_samples_split': 0.1027854466756085, 'min_samples_leaf': 0.039049724412776994, 'min_weight_fraction_leaf': 0.019616270223587834, 'max_features': 0.9463093584710517}. Best is trial 161 with value: 0.7752929650004449.[0m
[32m[I 2022-04-13 12:17:45,019][0m Trial 229 finished with value: 0.7745294452175183 and parameters: {'splitter': 'best', 'min_samples_split': 0.14304313108167888, 'min_samples_leaf': 0.032835516858818026, 'min_weight_fraction_leaf': 0.045173320224264346, 'max_features': 0.9788717572796861}. Best is trial 161 with value: 0.7752929650004449.[0m
[32m[I 2022-04-13 12:17:46,130][0m Trial 230 finished with value: 0.7634227516562163 and parameters: {'splitter': 'best', 'min_samples_split': 0.14403423326802745, 'min_samples_leaf': 0.03412208422126498, 'min_weight_fraction_leaf': 0.047418008545609354, 'max_features': 0.926848924413668}. Best is trial 161 with value: 0.7752929650004449.[0m
[32m[I 2022-04-13 12:17:47,282][0m Trial 231 finished with value: 0.768002346805681 and parameters: {'splitter': 'best', 'min_samples_split': 0.1586732105965443, 'min_samples_leaf': 0.04551761439490849, 'min_weight_fraction_leaf': 0.03305347469497623, 'max_features': 0.9791967475950717}. Best is trial 161 with value: 0.7752929650004449.[0m
[32m[I 2022-04-13 12:17:48,656][0m Trial 232 finished with value: 0.765275142936577 and parameters: {'splitter': 'best', 'min_samples_split': 0.1346081769555327, 'min_samples_leaf': 0.01678356588783385, 'min_weight_fraction_leaf': 0.023910029635752672, 'max_features': 0.9586922862551546}. Best is trial 161 with value: 0.7752929650004449.[0m
[32m[I 2022-04-13 12:17:50,341][0m Trial 233 finished with value: 0.7749271275412639 and parameters: {'splitter': 'best', 'min_samples_split': 0.11476744948984863, 'min_samples_leaf': 0.0327804935035958, 'min_weight_fraction_leaf': 0.03717172945804765, 'max_features': 0.9810579147161328}. Best is trial 161 with value: 0.7752929650004449.[0m
[32m[I 2022-04-13 12:17:52,124][0m Trial 234 finished with value: 0.767719705786033 and parameters: {'splitter': 'best', 'min_samples_split': 0.09885941733627349, 'min_samples_leaf': 0.031932915546640135, 'min_weight_fraction_leaf': 0.04385418648319805, 'max_features': 0.9655697773653189}. Best is trial 161 with value: 0.7752929650004449.[0m
[32m[I 2022-04-13 12:17:55,427][0m Trial 235 finished with value: 0.7740952377286536 and parameters: {'splitter': 'best', 'min_samples_split': 0.11775052625899851, 'min_samples_leaf': 0.018629173180283076, 'min_weight_fraction_leaf': 0.039255049430469334, 'max_features': 0.983628052055299}. Best is trial 161 with value: 0.7752929650004449.[0m
[32m[I 2022-04-13 12:17:58,295][0m Trial 236 finished with value: 0.773744453223668 and parameters: {'splitter': 'best', 'min_samples_split': 0.11885580566618821, 'min_samples_leaf': 0.04617058475906883, 'min_weight_fraction_leaf': 0.0413596704336096, 'max_features': 0.9774189635512873}. Best is trial 161 with value: 0.7752929650004449.[0m
[32m[I 2022-04-13 12:17:58,548][0m Trial 237 finished with value: 0.754889705818954 and parameters: {'splitter': 'random', 'min_samples_split': 0.13571027431013083, 'min_samples_leaf': 0.04850153585983809, 'min_weight_fraction_leaf': 0.052787058104955695, 'max_features': 0.9440519541873477}. Best is trial 161 with value: 0.7752929650004449.[0m
[32m[I 2022-04-13 12:18:00,602][0m Trial 238 finished with value: 0.7750204772701936 and parameters: {'splitter': 'best', 'min_samples_split': 0.11831656818191699, 'min_samples_leaf': 0.037863541363855585, 'min_weight_fraction_leaf': 0.040834277728026475, 'max_features': 0.9790325072616899}. Best is trial 161 with value: 0.7752929650004449.[0m
[32m[I 2022-04-13 12:18:02,405][0m Trial 239 finished with value: 0.7745771974987049 and parameters: {'splitter': 'best', 'min_samples_split': 0.12237698797205777, 'min_samples_leaf': 0.036743287231404964, 'min_weight_fraction_leaf': 0.04083951077055899, 'max_features': 0.9792718446704957}. Best is trial 161 with value: 0.7752929650004449.[0m
[32m[I 2022-04-13 12:18:05,055][0m Trial 240 finished with value: 0.7649934391594679 and parameters: {'splitter': 'best', 'min_samples_split': 0.12300159875241817, 'min_samples_leaf': 0.03775673495748878, 'min_weight_fraction_leaf': 0.04213635030318776, 'max_features': 0.9606316344677377}. Best is trial 161 with value: 0.7752929650004449.[0m
[32m[I 2022-04-13 12:18:07,685][0m Trial 241 finished with value: 0.7773840258827056 and parameters: {'splitter': 'best', 'min_samples_split': 0.12029135864431753, 'min_samples_leaf': 0.044175924193285254, 'min_weight_fraction_leaf': 0.037131083511610485, 'max_features': 0.9801713980264842}. Best is trial 241 with value: 0.7773840258827056.[0m
[32m[I 2022-04-13 12:18:10,122][0m Trial 242 finished with value: 0.7731408987635284 and parameters: {'splitter': 'best', 'min_samples_split': 0.11577928109971075, 'min_samples_leaf': 0.04104947996094311, 'min_weight_fraction_leaf': 0.046051178685015653, 'max_features': 0.9832937996051396}. Best is trial 241 with value: 0.7773840258827056.[0m
[32m[I 2022-04-13 12:18:11,626][0m Trial 243 finished with value: 0.6743624146605087 and parameters: {'splitter': 'best', 'min_samples_split': 0.11664106030801788, 'min_samples_leaf': 0.04596773476632561, 'min_weight_fraction_leaf': 0.34165406915573626, 'max_features': 0.9772031095034285}. Best is trial 241 with value: 0.7773840258827056.[0m
[32m[I 2022-04-13 12:18:14,661][0m Trial 244 finished with value: 0.766155961201436 and parameters: {'splitter': 'best', 'min_samples_split': 0.1181555398436483, 'min_samples_leaf': 0.03713490411023673, 'min_weight_fraction_leaf': 0.049819594077322296, 'max_features': 0.947510104185617}. Best is trial 241 with value: 0.7773840258827056.[0m
[32m[I 2022-04-13 12:18:17,239][0m Trial 245 finished with value: 0.7718245615373284 and parameters: {'splitter': 'best', 'min_samples_split': 0.12740632143086347, 'min_samples_leaf': 0.04998115203826116, 'min_weight_fraction_leaf': 0.04093919350500028, 'max_features': 0.9807745859120411}. Best is trial 241 with value: 0.7773840258827056.[0m
[32m[I 2022-04-13 12:18:18,911][0m Trial 246 finished with value: 0.7642842198241525 and parameters: {'splitter': 'best', 'min_samples_split': 0.14833019629550925, 'min_samples_leaf': 0.04235402023177718, 'min_weight_fraction_leaf': 0.06977803914987848, 'max_features': 0.9609472271847194}. Best is trial 241 with value: 0.7773840258827056.[0m
[32m[I 2022-04-13 12:18:20,497][0m Trial 247 finished with value: 0.7679360568676347 and parameters: {'splitter': 'best', 'min_samples_split': 0.11294214286146029, 'min_samples_leaf': 0.033604865798903545, 'min_weight_fraction_leaf': 0.05056565681743236, 'max_features': 0.9422391137769703}. Best is trial 241 with value: 0.7773840258827056.[0m
[32m[I 2022-04-13 12:18:21,796][0m Trial 248 finished with value: 0.770438219026632 and parameters: {'splitter': 'best', 'min_samples_split': 0.1414288999894172, 'min_samples_leaf': 0.051400624253305716, 'min_weight_fraction_leaf': 0.03995988602362516, 'max_features': 0.9819106680305023}. Best is trial 241 with value: 0.7773840258827056.[0m
[32m[I 2022-04-13 12:18:22,214][0m Trial 249 finished with value: 0.6221279755861111 and parameters: {'splitter': 'best', 'min_samples_split': 0.11763358368203818, 'min_samples_leaf': 0.031056162207840396, 'min_weight_fraction_leaf': 0.038376981484372, 'max_features': 0.15193864830694648}. Best is trial 241 with value: 0.7773840258827056.[0m
[32m[I 2022-04-13 12:18:23,771][0m Trial 250 finished with value: 0.7652820340136179 and parameters: {'splitter': 'best', 'min_samples_split': 0.13014665760820263, 'min_samples_leaf': 0.0533464849555606, 'min_weight_fraction_leaf': 0.0535884424735566, 'max_features': 0.9617275099824794}. Best is trial 241 with value: 0.7773840258827056.[0m
[32m[I 2022-04-13 12:18:25,424][0m Trial 251 finished with value: 0.7737566251946392 and parameters: {'splitter': 'best', 'min_samples_split': 0.10778742895309242, 'min_samples_leaf': 0.04182558593925099, 'min_weight_fraction_leaf': 0.02892598788085705, 'max_features': 0.9827095294875617}. Best is trial 241 with value: 0.7773840258827056.[0m
[32m[I 2022-04-13 12:18:28,208][0m Trial 252 finished with value: 0.7683349586400923 and parameters: {'splitter': 'best', 'min_samples_split': 0.10886897945146083, 'min_samples_leaf': 0.04678125766240585, 'min_weight_fraction_leaf': 0.03151788589313372, 'max_features': 0.9301664587561809}. Best is trial 241 with value: 0.7773840258827056.[0m
[32m[I 2022-04-13 12:18:30,000][0m Trial 253 finished with value: 0.759744904511227 and parameters: {'splitter': 'best', 'min_samples_split': 0.26042844558663986, 'min_samples_leaf': 0.030508702135497286, 'min_weight_fraction_leaf': 0.0461452437526766, 'max_features': 0.9828292407398551}. Best is trial 241 with value: 0.7773840258827056.[0m
[32m[I 2022-04-13 12:18:31,582][0m Trial 254 finished with value: 0.7637113317284854 and parameters: {'splitter': 'best', 'min_samples_split': 0.12150217087012513, 'min_samples_leaf': 0.07070638691047072, 'min_weight_fraction_leaf': 0.039325733472533445, 'max_features': 0.9621438235056193}. Best is trial 241 with value: 0.7773840258827056.[0m
[32m[I 2022-04-13 12:18:33,279][0m Trial 255 finished with value: 0.7747248242639119 and parameters: {'splitter': 'best', 'min_samples_split': 0.1118475412483982, 'min_samples_leaf': 0.042293160497409304, 'min_weight_fraction_leaf': 0.023881644909939707, 'max_features': 0.9835345889838414}. Best is trial 241 with value: 0.7773840258827056.[0m
[32m[I 2022-04-13 12:18:34,887][0m Trial 256 finished with value: 0.7692665848435334 and parameters: {'splitter': 'best', 'min_samples_split': 0.1124961531402944, 'min_samples_leaf': 0.0352073147946775, 'min_weight_fraction_leaf': 0.06425502625862824, 'max_features': 0.9990451531558117}. Best is trial 241 with value: 0.7773840258827056.[0m
[32m[I 2022-04-13 12:18:35,771][0m Trial 257 finished with value: 0.6872597818130096 and parameters: {'splitter': 'best', 'min_samples_split': 0.16646872924276013, 'min_samples_leaf': 0.23347230443310826, 'min_weight_fraction_leaf': 0.026876634998102902, 'max_features': 0.9421134745644292}. Best is trial 241 with value: 0.7773840258827056.[0m
[32m[I 2022-04-13 12:18:38,892][0m Trial 258 finished with value: 0.7660251591547255 and parameters: {'splitter': 'best', 'min_samples_split': 0.1306880028427102, 'min_samples_leaf': 0.025866504890524798, 'min_weight_fraction_leaf': 0.05284718805371917, 'max_features': 0.9613744915140491}. Best is trial 241 with value: 0.7773840258827056.[0m
[32m[I 2022-04-13 12:18:40,891][0m Trial 259 finished with value: 0.7736490970799623 and parameters: {'splitter': 'best', 'min_samples_split': 0.12121773358580452, 'min_samples_leaf': 0.04317471700683796, 'min_weight_fraction_leaf': 0.0348033420673688, 'max_features': 0.9809173664573294}. Best is trial 241 with value: 0.7773840258827056.[0m
