[32m[I 2022-04-14 19:54:04,847][0m Trial 730 finished with value: 0.6371812073302544 and parameters: {'loss': 'coxph', 'learning_rate': 6.495616806775677e-06, 'n_estimators': 829, 'criterion': 'friedman_mse', 'min_samples_split': 9, 'min_samples_leaf': 1, 'min_weight_fraction_leaf': 0.35069008047511846, 'min_impurity_decrease': 0.3621726903809676, 'max_features': 0.9403809170374154, 'subsample': 0.15914433673449194, 'dropout_rate': 0.6844688267996692, 'ccp_alpha': 0.26574362038769417}. Best is trial 618 with value: 0.783753686536768.[0m
[32m[I 2022-04-14 19:56:09,868][0m Trial 731 finished with value: 0.7777098007644903 and parameters: {'loss': 'coxph', 'learning_rate': 1.036696875306664e-05, 'n_estimators': 766, 'criterion': 'friedman_mse', 'min_samples_split': 10, 'min_samples_leaf': 2, 'min_weight_fraction_leaf': 0.31792652607413885, 'min_impurity_decrease': 0.27688684406167, 'max_features': 0.8695653348374487, 'subsample': 0.0776832748331714, 'dropout_rate': 0.6551983014197366, 'ccp_alpha': 0.16808947727435747}. Best is trial 618 with value: 0.783753686536768.[0m
[32m[I 2022-04-14 19:59:07,531][0m Trial 732 finished with value: 0.7792540793971656 and parameters: {'loss': 'coxph', 'learning_rate': 8.640907967621385e-06, 'n_estimators': 885, 'criterion': 'friedman_mse', 'min_samples_split': 8, 'min_samples_leaf': 2, 'min_weight_fraction_leaf': 0.376304694110304, 'min_impurity_decrease': 0.3987251525603772, 'max_features': 0.8291511495844015, 'subsample': 0.13306461748285336, 'dropout_rate': 0.5676416763588304, 'ccp_alpha': 0.08428781764377691}. Best is trial 618 with value: 0.783753686536768.[0m
[32m[I 2022-04-14 20:02:06,033][0m Trial 733 finished with value: 0.7807875402507902 and parameters: {'loss': 'coxph', 'learning_rate': 5.6936210492044894e-06, 'n_estimators': 931, 'criterion': 'friedman_mse', 'min_samples_split': 9, 'min_samples_leaf': 2, 'min_weight_fraction_leaf': 0.3616739762374622, 'min_impurity_decrease': 0.32341858006697743, 'max_features': 0.914489306662788, 'subsample': 0.1071067014804839, 'dropout_rate': 0.6257431106539734, 'ccp_alpha': 0.0037965819440825242}. Best is trial 618 with value: 0.783753686536768.[0m
[32m[I 2022-04-14 20:04:46,048][0m Trial 734 finished with value: 0.7683483347727987 and parameters: {'loss': 'coxph', 'learning_rate': 1.3384985897017097e-05, 'n_estimators': 842, 'criterion': 'friedman_mse', 'min_samples_split': 10, 'min_samples_leaf': 2, 'min_weight_fraction_leaf': 0.4000534486104842, 'min_impurity_decrease': 0.34472645473670455, 'max_features': 0.977539441014159, 'subsample': 0.036296394557372984, 'dropout_rate': 0.5907153214676444, 'ccp_alpha': 0.35953688712663945}. Best is trial 618 with value: 0.783753686536768.[0m
[32m[I 2022-04-14 20:08:29,956][0m Trial 735 finished with value: 0.7801264882657684 and parameters: {'loss': 'coxph', 'learning_rate': 1.744713200640551e-05, 'n_estimators': 997, 'criterion': 'friedman_mse', 'min_samples_split': 8, 'min_samples_leaf': 2, 'min_weight_fraction_leaf': 0.387653632546876, 'min_impurity_decrease': 0.3033994084392584, 'max_features': 0.8969014029612108, 'subsample': 0.06369220699268321, 'dropout_rate': 0.5486022881449414, 'ccp_alpha': 0.08278619062849293}. Best is trial 618 with value: 0.783753686536768.[0m
[32m[I 2022-04-14 20:10:50,527][0m Trial 736 finished with value: 0.7458337785672688 and parameters: {'loss': 'coxph', 'learning_rate': 3.9172626205305e-06, 'n_estimators': 802, 'criterion': 'friedman_mse', 'min_samples_split': 10, 'min_samples_leaf': 1, 'min_weight_fraction_leaf': 0.3311942260575634, 'min_impurity_decrease': 0.37733047307930295, 'max_features': 0.8513480459002739, 'subsample': 0.09210530796439188, 'dropout_rate': 0.6131407805518329, 'ccp_alpha': 0.22684625178097695}. Best is trial 618 with value: 0.783753686536768.[0m
[32m[I 2022-04-14 20:12:47,992][0m Trial 737 finished with value: 0.7807433002210599 and parameters: {'loss': 'coxph', 'learning_rate': 7.4411515936185815e-06, 'n_estimators': 733, 'criterion': 'friedman_mse', 'min_samples_split': 9, 'min_samples_leaf': 10, 'min_weight_fraction_leaf': 0.36996264609908963, 'min_impurity_decrease': 0.24361082457979705, 'max_features': 0.9539807750104146, 'subsample': 0.05138901710823138, 'dropout_rate': 0.6717873329734051, 'ccp_alpha': 0.09331877785098441}. Best is trial 618 with value: 0.783753686536768.[0m
[32m[I 2022-04-14 20:14:51,230][0m Trial 738 finished with value: -0.3664887510308321 and parameters: {'loss': 'squared', 'learning_rate': 1.0998750545914276e-05, 'n_estimators': 905, 'criterion': 'squared_error', 'min_samples_split': 10, 'min_samples_leaf': 3, 'min_weight_fraction_leaf': 0.3382960221497058, 'min_impurity_decrease': 0.2774398752769565, 'max_features': 0.9245020477519519, 'subsample': 0.07412406244080788, 'dropout_rate': 0.49763996649831843, 'ccp_alpha': 0.18089975679170933}. Best is trial 618 with value: 0.783753686536768.[0m
[32m[I 2022-04-14 20:17:28,466][0m Trial 739 finished with value: 0.7833752661256307 and parameters: {'loss': 'coxph', 'learning_rate': 4.9372345070030746e-06, 'n_estimators': 862, 'criterion': 'friedman_mse', 'min_samples_split': 9, 'min_samples_leaf': 2, 'min_weight_fraction_leaf': 0.35530866389655885, 'min_impurity_decrease': 0.3187625440917511, 'max_features': 0.8197019361380594, 'subsample': 0.023114464930368298, 'dropout_rate': 0.6420541058880256, 'ccp_alpha': 0.005133360578507287}. Best is trial 618 with value: 0.783753686536768.[0m
[32m[I 2022-04-14 20:19:46,043][0m Trial 740 finished with value: 0.25 and parameters: {'loss': 'coxph', 'learning_rate': 2.9057537501610086e-06, 'n_estimators': 773, 'criterion': 'friedman_mse', 'min_samples_split': 7, 'min_samples_leaf': 2, 'min_weight_fraction_leaf': 0.34712672169657643, 'min_impurity_decrease': 0.35108168508082926, 'max_features': 0.7939811287684828, 'subsample': 0.0010107438719949187, 'dropout_rate': 0.6508119409399629, 'ccp_alpha': 0.29919992303410686}. Best is trial 618 with value: 0.783753686536768.[0m
[32m[I 2022-04-14 20:22:28,463][0m Trial 741 finished with value: 0.7791833145374231 and parameters: {'loss': 'coxph', 'learning_rate': 4.358780206042204e-06, 'n_estimators': 850, 'criterion': 'friedman_mse', 'min_samples_split': 8, 'min_samples_leaf': 2, 'min_weight_fraction_leaf': 0.3479561728203455, 'min_impurity_decrease': 0.4463992824959638, 'max_features': 0.8066182666952039, 'subsample': 0.030724531942460248, 'dropout_rate': 0.6438678579265306, 'ccp_alpha': 0.0034500535496409116}. Best is trial 618 with value: 0.783753686536768.[0m
[32m[I 2022-04-14 20:24:57,527][0m Trial 742 finished with value: 0.780292195224632 and parameters: {'loss': 'coxph', 'learning_rate': 3.837242268915343e-06, 'n_estimators': 819, 'criterion': 'friedman_mse', 'min_samples_split': 9, 'min_samples_leaf': 2, 'min_weight_fraction_leaf': 0.35671874849098073, 'min_impurity_decrease': 0.33434223021914083, 'max_features': 0.7755556883719302, 'subsample': 0.017173047184379866, 'dropout_rate': 0.6764415449592873, 'ccp_alpha': 0.001153459488481029}. Best is trial 618 with value: 0.783753686536768.[0m
[32m[I 2022-04-14 20:27:15,947][0m Trial 743 finished with value: 0.7796373644655278 and parameters: {'loss': 'coxph', 'learning_rate': 5.168334419560886e-06, 'n_estimators': 798, 'criterion': 'friedman_mse', 'min_samples_split': 8, 'min_samples_leaf': 1, 'min_weight_fraction_leaf': 0.33733575815719913, 'min_impurity_decrease': 0.316571141981578, 'max_features': 0.8330861224827408, 'subsample': 0.02983518016419655, 'dropout_rate': 0.6597291821503402, 'ccp_alpha': 0.1590666543427715}. Best is trial 618 with value: 0.783753686536768.[0m
[32m[I 2022-04-14 20:29:59,606][0m Trial 744 finished with value: 0.781186210815332 and parameters: {'loss': 'coxph', 'learning_rate': 5.064894506427522e-06, 'n_estimators': 870, 'criterion': 'friedman_mse', 'min_samples_split': 10, 'min_samples_leaf': 2, 'min_weight_fraction_leaf': 0.359473631225575, 'min_impurity_decrease': 0.35901425283644506, 'max_features': 0.8125479047163725, 'subsample': 0.01781934901219169, 'dropout_rate': 0.636361419844815, 'ccp_alpha': 0.0013026993089975576}. Best is trial 618 with value: 0.783753686536768.[0m
[32m[I 2022-04-14 20:32:39,434][0m Trial 745 finished with value: 0.745996752391326 and parameters: {'loss': 'coxph', 'learning_rate': 3.4889993850334906e-06, 'n_estimators': 928, 'criterion': 'friedman_mse', 'min_samples_split': 10, 'min_samples_leaf': 2, 'min_weight_fraction_leaf': 0.3549550032410658, 'min_impurity_decrease': 0.38695382705435755, 'max_features': 0.8142274737662402, 'subsample': 0.028603881437985194, 'dropout_rate': 0.6945070481320806, 'ccp_alpha': 0.41753318885196444}. Best is trial 618 with value: 0.783753686536768.[0m
[32m[I 2022-04-14 20:35:17,379][0m Trial 746 finished with value: 0.7780018183592957 and parameters: {'loss': 'coxph', 'learning_rate': 2.6227309176169315e-06, 'n_estimators': 871, 'criterion': 'friedman_mse', 'min_samples_split': 10, 'min_samples_leaf': 2, 'min_weight_fraction_leaf': 0.32583502251536134, 'min_impurity_decrease': 0.36245286273468263, 'max_features': 0.7585586073250543, 'subsample': 0.017327980537044825, 'dropout_rate': 0.6587663946364422, 'ccp_alpha': 0.1584224260019081}. Best is trial 618 with value: 0.783753686536768.[0m
[32m[I 2022-04-14 20:38:04,223][0m Trial 747 finished with value: 0.7809206178042569 and parameters: {'loss': 'coxph', 'learning_rate': 4.58327141085468e-06, 'n_estimators': 873, 'criterion': 'friedman_mse', 'min_samples_split': 10, 'min_samples_leaf': 2, 'min_weight_fraction_leaf': 0.34833235732410156, 'min_impurity_decrease': 0.40689421882538357, 'max_features': 0.784958718503679, 'subsample': 0.0234813281033777, 'dropout_rate': 0.6425144721780744, 'ccp_alpha': 0.0974092513079964}. Best is trial 618 with value: 0.783753686536768.[0m
[32m[I 2022-04-14 20:40:14,530][0m Trial 748 finished with value: 0.25 and parameters: {'loss': 'coxph', 'learning_rate': 3.3040157081725604e-06, 'n_estimators': 763, 'criterion': 'friedman_mse', 'min_samples_split': 10, 'min_samples_leaf': 2, 'min_weight_fraction_leaf': 0.34143397485687854, 'min_impurity_decrease': 0.3576390024721476, 'max_features': 0.8232143799686263, 'subsample': 0.004649032522441027, 'dropout_rate': 0.6329181687630006, 'ccp_alpha': 0.25627153336718805}. Best is trial 618 with value: 0.783753686536768.[0m
[32m[I 2022-04-14 20:43:13,977][0m Trial 749 finished with value: 0.25 and parameters: {'loss': 'coxph', 'learning_rate': 4.411979667452093e-06, 'n_estimators': 956, 'criterion': 'friedman_mse', 'min_samples_split': 10, 'min_samples_leaf': 2, 'min_weight_fraction_leaf': 0.3610804316456769, 'min_impurity_decrease': 0.37786451595716425, 'max_features': 0.7833676255172346, 'subsample': 0.004750154196713846, 'dropout_rate': 0.6685384940184146, 'ccp_alpha': 0.09383789494860273}. Best is trial 618 with value: 0.783753686536768.[0m
[32m[I 2022-04-14 20:45:38,047][0m Trial 750 finished with value: 0.7834664932438107 and parameters: {'loss': 'coxph', 'learning_rate': 5.274820985699303e-06, 'n_estimators': 810, 'criterion': 'friedman_mse', 'min_samples_split': 10, 'min_samples_leaf': 2, 'min_weight_fraction_leaf': 0.3550300163682042, 'min_impurity_decrease': 0.34016992649549915, 'max_features': 0.813623551386141, 'subsample': 0.022434202677913333, 'dropout_rate': 0.6408794741240893, 'ccp_alpha': 0.0018511308368277207}. Best is trial 618 with value: 0.783753686536768.[0m
[32m[I 2022-04-14 20:47:40,961][0m Trial 751 finished with value: 0.776581441427165 and parameters: {'loss': 'coxph', 'learning_rate': 5.085591759875353e-06, 'n_estimators': 745, 'criterion': 'friedman_mse', 'min_samples_split': 10, 'min_samples_leaf': 3, 'min_weight_fraction_leaf': 0.3537933101635939, 'min_impurity_decrease': 0.3661388523313192, 'max_features': 0.7713629697083325, 'subsample': 0.019161674462572366, 'dropout_rate': 0.6933323830065341, 'ccp_alpha': 0.10622471908989807}. Best is trial 618 with value: 0.783753686536768.[0m
[32m[I 2022-04-14 20:50:05,895][0m Trial 752 finished with value: 0.781378808572546 and parameters: {'loss': 'coxph', 'learning_rate': 3.354396951274961e-06, 'n_estimators': 806, 'criterion': 'friedman_mse', 'min_samples_split': 10, 'min_samples_leaf': 1, 'min_weight_fraction_leaf': 0.3338461399660152, 'min_impurity_decrease': 0.3481838014309958, 'max_features': 0.8181550774611384, 'subsample': 0.02270734054309511, 'dropout_rate': 0.6298124369483152, 'ccp_alpha': 0.09051234625610508}. Best is trial 618 with value: 0.783753686536768.[0m
[32m[I 2022-04-14 20:52:26,610][0m Trial 753 finished with value: 0.25 and parameters: {'loss': 'coxph', 'learning_rate': 2.558113840780046e-06, 'n_estimators': 786, 'criterion': 'friedman_mse', 'min_samples_split': 10, 'min_samples_leaf': 2, 'min_weight_fraction_leaf': 0.32721209064981155, 'min_impurity_decrease': 0.38583446732871574, 'max_features': 0.7975382326748862, 'subsample': 0.0034731643657675004, 'dropout_rate': 0.6464971937767503, 'ccp_alpha': 0.24124856738225606}. Best is trial 618 with value: 0.783753686536768.[0m
[32m[I 2022-04-14 20:54:27,252][0m Trial 754 finished with value: 0.7765868844570504 and parameters: {'loss': 'coxph', 'learning_rate': 3.222891005787988e-06, 'n_estimators': 740, 'criterion': 'friedman_mse', 'min_samples_split': 10, 'min_samples_leaf': 2, 'min_weight_fraction_leaf': 0.31776025088088, 'min_impurity_decrease': 0.34927601442161665, 'max_features': 0.7974866770443152, 'subsample': 0.01624416154589202, 'dropout_rate': 0.6793327244816628, 'ccp_alpha': 0.20977790367360233}. Best is trial 618 with value: 0.783753686536768.[0m
[32m[I 2022-04-14 20:56:19,701][0m Trial 755 finished with value: 0.775128914600077 and parameters: {'loss': 'coxph', 'learning_rate': 2.2541576851352492e-06, 'n_estimators': 689, 'criterion': 'friedman_mse', 'min_samples_split': 10, 'min_samples_leaf': 1, 'min_weight_fraction_leaf': 0.33291371012321996, 'min_impurity_decrease': 0.3697225121752755, 'max_features': 0.8188181979341078, 'subsample': 0.02038302902022608, 'dropout_rate': 0.6324695210902456, 'ccp_alpha': 0.3114022003187205}. Best is trial 618 with value: 0.783753686536768.[0m
[32m[I 2022-04-14 20:58:33,565][0m Trial 756 finished with value: 0.7795365453056502 and parameters: {'loss': 'coxph', 'learning_rate': 3.117495822912337e-06, 'n_estimators': 805, 'criterion': 'friedman_mse', 'min_samples_split': 10, 'min_samples_leaf': 2, 'min_weight_fraction_leaf': 0.33538874319431544, 'min_impurity_decrease': 0.39595488376695936, 'max_features': 0.8053505823035545, 'subsample': 0.03985142285442846, 'dropout_rate': 0.7130982777393129, 'ccp_alpha': 0.08708970481349516}. Best is trial 618 with value: 0.783753686536768.[0m
[32m[I 2022-04-14 20:59:37,100][0m Trial 757 finished with value: -0.25 and parameters: {'loss': 'squared', 'learning_rate': 3.6038195860992564e-06, 'n_estimators': 769, 'criterion': 'friedman_mse', 'min_samples_split': 10, 'min_samples_leaf': 2, 'min_weight_fraction_leaf': 0.30454947317261616, 'min_impurity_decrease': 0.34516705380724544, 'max_features': 0.8047284574568605, 'subsample': 0.0010124142308884608, 'dropout_rate': 0.6566836527532147, 'ccp_alpha': 0.16365614371320816}. Best is trial 618 with value: 0.783753686536768.[0m
[32m[I 2022-04-14 21:01:40,664][0m Trial 758 finished with value: 0.77925253620667 and parameters: {'loss': 'coxph', 'learning_rate': 3.895259158467798e-06, 'n_estimators': 728, 'criterion': 'friedman_mse', 'min_samples_split': 10, 'min_samples_leaf': 2, 'min_weight_fraction_leaf': 0.32084389634124105, 'min_impurity_decrease': 0.42954180956458665, 'max_features': 0.8197076871145693, 'subsample': 0.029397919511914616, 'dropout_rate': 0.6229323969699841, 'ccp_alpha': 0.09162267499837283}. Best is trial 618 with value: 0.783753686536768.[0m
[32m[I 2022-04-14 21:04:03,713][0m Trial 759 finished with value: 0.7612498388133785 and parameters: {'loss': 'coxph', 'learning_rate': 2.954936975214862e-06, 'n_estimators': 809, 'criterion': 'squared_error', 'min_samples_split': 10, 'min_samples_leaf': 3, 'min_weight_fraction_leaf': 0.3403011806761484, 'min_impurity_decrease': 0.3554100075418416, 'max_features': 0.8219710940526301, 'subsample': 0.03247092431378194, 'dropout_rate': 0.6424834437085558, 'ccp_alpha': 0.19344835933702778}. Best is trial 618 with value: 0.783753686536768.[0m
[32m[I 2022-04-14 21:06:24,393][0m Trial 760 finished with value: 0.7804131263901196 and parameters: {'loss': 'coxph', 'learning_rate': 4.590412753719942e-06, 'n_estimators': 792, 'criterion': 'friedman_mse', 'min_samples_split': 10, 'min_samples_leaf': 2, 'min_weight_fraction_leaf': 0.34500260759527895, 'min_impurity_decrease': 0.3813846873342088, 'max_features': 0.8108678333392157, 'subsample': 0.01902589952282268, 'dropout_rate': 0.6744887842652996, 'ccp_alpha': 0.0024714416379853204}. Best is trial 618 with value: 0.783753686536768.[0m
[32m[I 2022-04-14 21:08:59,682][0m Trial 761 finished with value: 0.25 and parameters: {'loss': 'coxph', 'learning_rate': 2.308976491686842e-06, 'n_estimators': 828, 'criterion': 'friedman_mse', 'min_samples_split': 10, 'min_samples_leaf': 2, 'min_weight_fraction_leaf': 0.31299802590210435, 'min_impurity_decrease': 0.3387213261461212, 'max_features': 0.8001105236922869, 'subsample': 0.0020027204418838172, 'dropout_rate': 0.625517737978807, 'ccp_alpha': 0.003221535446020024}. Best is trial 618 with value: 0.783753686536768.[0m
[32m[I 2022-04-14 21:11:04,814][0m Trial 762 finished with value: 0.7715237790452513 and parameters: {'loss': 'coxph', 'learning_rate': 3.821312023972303e-06, 'n_estimators': 759, 'criterion': 'friedman_mse', 'min_samples_split': 10, 'min_samples_leaf': 2, 'min_weight_fraction_leaf': 0.3295238436325767, 'min_impurity_decrease': 0.36999652057213683, 'max_features': 0.7729253250040495, 'subsample': 0.02911631417699298, 'dropout_rate': 0.6631529133792186, 'ccp_alpha': 0.34167825206499947}. Best is trial 618 with value: 0.783753686536768.[0m
[32m[I 2022-04-14 21:13:07,384][0m Trial 763 finished with value: 0.7802807967072679 and parameters: {'loss': 'coxph', 'learning_rate': 5.0741084418752034e-06, 'n_estimators': 720, 'criterion': 'friedman_mse', 'min_samples_split': 10, 'min_samples_leaf': 1, 'min_weight_fraction_leaf': 0.294855982270995, 'min_impurity_decrease': 0.33332662708089716, 'max_features': 0.8349843289050959, 'subsample': 0.04637633599356773, 'dropout_rate': 0.6141049278895979, 'ccp_alpha': 0.1693779246088054}. Best is trial 618 with value: 0.783753686536768.[0m
[32m[I 2022-04-14 21:15:40,890][0m Trial 764 finished with value: 0.7800346163032764 and parameters: {'loss': 'coxph', 'learning_rate': 5.377105421740973e-06, 'n_estimators': 821, 'criterion': 'friedman_mse', 'min_samples_split': 10, 'min_samples_leaf': 2, 'min_weight_fraction_leaf': 0.34281290633064576, 'min_impurity_decrease': 0.3571689184312863, 'max_features': 0.8339630319577993, 'subsample': 0.043204782852023754, 'dropout_rate': 0.6418815383931317, 'ccp_alpha': 0.08702656219623676}. Best is trial 618 with value: 0.783753686536768.[0m
[32m[I 2022-04-14 21:18:07,340][0m Trial 765 finished with value: 0.7769800844570423 and parameters: {'loss': 'coxph', 'learning_rate': 4.458413543574624e-06, 'n_estimators': 788, 'criterion': 'friedman_mse', 'min_samples_split': 10, 'min_samples_leaf': 2, 'min_weight_fraction_leaf': 0.3513329994401253, 'min_impurity_decrease': 0.40776516458206397, 'max_features': 0.8011100990466803, 'subsample': 0.03607209126849502, 'dropout_rate': 0.6169585047551173, 'ccp_alpha': 0.2546398714451359}. Best is trial 618 with value: 0.783753686536768.[0m
[32m[I 2022-04-14 21:20:45,488][0m Trial 766 finished with value: 0.7803401467580484 and parameters: {'loss': 'coxph', 'learning_rate': 3.67133050112071e-06, 'n_estimators': 843, 'criterion': 'friedman_mse', 'min_samples_split': 10, 'min_samples_leaf': 2, 'min_weight_fraction_leaf': 0.33468662199127114, 'min_impurity_decrease': 0.3926780591530059, 'max_features': 0.7849022981825725, 'subsample': 0.013973851750122144, 'dropout_rate': 0.6567684367700185, 'ccp_alpha': 0.08546274594117541}. Best is trial 618 with value: 0.783753686536768.[0m
[32m[I 2022-04-14 21:22:31,682][0m Trial 767 finished with value: 0.4829336714255586 and parameters: {'loss': 'coxph', 'learning_rate': 5.632269467228897e-06, 'n_estimators': 669, 'criterion': 'friedman_mse', 'min_samples_split': 10, 'min_samples_leaf': 2, 'min_weight_fraction_leaf': 0.35014044142915896, 'min_impurity_decrease': 0.33521045541198197, 'max_features': 0.8199542414061349, 'subsample': 0.0520155390521592, 'dropout_rate': 0.6334181119653954, 'ccp_alpha': 0.4300249796954034}. Best is trial 618 with value: 0.783753686536768.[0m
[32m[I 2022-04-14 21:24:35,505][0m Trial 768 finished with value: 0.7791710559982951 and parameters: {'loss': 'coxph', 'learning_rate': 2.849164067695401e-06, 'n_estimators': 763, 'criterion': 'friedman_mse', 'min_samples_split': 10, 'min_samples_leaf': 1, 'min_weight_fraction_leaf': 0.3195869852574698, 'min_impurity_decrease': 0.3612212721938115, 'max_features': 0.8273372639072182, 'subsample': 0.018983837234402827, 'dropout_rate': 0.6904537075147144, 'ccp_alpha': 0.19125269174616188}. Best is trial 618 with value: 0.783753686536768.[0m
[32m[I 2022-04-14 21:27:07,374][0m Trial 769 finished with value: 0.7804741271468275 and parameters: {'loss': 'coxph', 'learning_rate': 4.249497051367016e-06, 'n_estimators': 816, 'criterion': 'friedman_mse', 'min_samples_split': 10, 'min_samples_leaf': 3, 'min_weight_fraction_leaf': 0.35815169315931267, 'min_impurity_decrease': 0.3469213942692516, 'max_features': 0.8428999514579443, 'subsample': 0.04610032565837853, 'dropout_rate': 0.6056882130544486, 'ccp_alpha': 0.08799597183533199}. Best is trial 618 with value: 0.783753686536768.[0m
