[32m[I 2022-04-13 11:58:07,564][0m Trial 562 finished with value: 0.8843648194054754 and parameters: {'splitter': 'best', 'min_samples_split': 0.09488819511923005, 'min_samples_leaf': 0.046233016034147575, 'min_weight_fraction_leaf': 0.004424496321147317, 'max_features': 0.9299956535458584}. Best is trial 448 with value: 0.8888507593246218.[0m
[32m[I 2022-04-13 11:58:08,210][0m Trial 563 finished with value: 0.7815218924878913 and parameters: {'splitter': 'random', 'min_samples_split': 0.1118917727648769, 'min_samples_leaf': 0.057910781927911714, 'min_weight_fraction_leaf': 0.014303545800246176, 'max_features': 0.9531619878371623}. Best is trial 448 with value: 0.8888507593246218.[0m
/media/san2_ssd/data/Workdir/survival/utils.py:305: RuntimeWarning: invalid value encountered in true_divide
  pdfs = np.gradient(1-survs,axis=1)/norms
/media/san2_ssd/data/Workdir/survival/utils.py:305: RuntimeWarning: invalid value encountered in true_divide
  pdfs = np.gradient(1-survs,axis=1)/norms
/media/san2_ssd/data/Workdir/survival/utils.py:305: RuntimeWarning: invalid value encountered in true_divide
  pdfs = np.gradient(1-survs,axis=1)/norms
/media/san2_ssd/data/Workdir/survival/utils.py:305: RuntimeWarning: invalid value encountered in true_divide
  pdfs = np.gradient(1-survs,axis=1)/norms
/media/san2_ssd/data/Workdir/survival/utils.py:305: RuntimeWarning: invalid value encountered in true_divide
  pdfs = np.gradient(1-survs,axis=1)/norms
[32m[I 2022-04-13 11:58:10,278][0m Trial 564 finished with value: 0.8842097976941039 and parameters: {'splitter': 'best', 'min_samples_split': 0.10391129608135069, 'min_samples_leaf': 0.036507996656809316, 'min_weight_fraction_leaf': 0.013636255246015512, 'max_features': 0.9696738558220878}. Best is trial 448 with value: 0.8888507593246218.[0m
/media/san2_ssd/data/Workdir/survival/utils.py:305: RuntimeWarning: invalid value encountered in true_divide
  pdfs = np.gradient(1-survs,axis=1)/norms
/media/san2_ssd/data/Workdir/survival/utils.py:305: RuntimeWarning: invalid value encountered in true_divide
  pdfs = np.gradient(1-survs,axis=1)/norms
/media/san2_ssd/data/Workdir/survival/utils.py:305: RuntimeWarning: invalid value encountered in true_divide
  pdfs = np.gradient(1-survs,axis=1)/norms
/media/san2_ssd/data/Workdir/survival/utils.py:305: RuntimeWarning: invalid value encountered in true_divide
  pdfs = np.gradient(1-survs,axis=1)/norms
[32m[I 2022-04-13 11:58:12,925][0m Trial 565 finished with value: 0.8875206800650692 and parameters: {'splitter': 'best', 'min_samples_split': 0.12692038441596665, 'min_samples_leaf': 0.033565557139612935, 'min_weight_fraction_leaf': 0.02181338816245778, 'max_features': 0.9790515467979328}. Best is trial 448 with value: 0.8888507593246218.[0m
/media/san2_ssd/data/Workdir/survival/utils.py:305: RuntimeWarning: invalid value encountered in true_divide
  pdfs = np.gradient(1-survs,axis=1)/norms
[32m[I 2022-04-13 11:58:15,899][0m Trial 566 finished with value: 0.8824773115430494 and parameters: {'splitter': 'best', 'min_samples_split': 0.14203319964844083, 'min_samples_leaf': 0.029273147648749453, 'min_weight_fraction_leaf': 0.02457131585329486, 'max_features': 0.9429977137408101}. Best is trial 448 with value: 0.8888507593246218.[0m
/media/san2_ssd/data/Workdir/survival/utils.py:305: RuntimeWarning: invalid value encountered in true_divide
  pdfs = np.gradient(1-survs,axis=1)/norms
/media/san2_ssd/data/Workdir/survival/utils.py:305: RuntimeWarning: invalid value encountered in true_divide
  pdfs = np.gradient(1-survs,axis=1)/norms
[32m[I 2022-04-13 11:58:18,059][0m Trial 567 finished with value: 0.8825638960126232 and parameters: {'splitter': 'best', 'min_samples_split': 0.13006609579401968, 'min_samples_leaf': 0.044549508090857864, 'min_weight_fraction_leaf': 0.0025681664577942506, 'max_features': 0.6257997582054436}. Best is trial 448 with value: 0.8888507593246218.[0m
/media/san2_ssd/data/Workdir/survival/utils.py:305: RuntimeWarning: invalid value encountered in true_divide
  pdfs = np.gradient(1-survs,axis=1)/norms
/media/san2_ssd/data/Workdir/survival/utils.py:305: RuntimeWarning: invalid value encountered in true_divide
  pdfs = np.gradient(1-survs,axis=1)/norms
/media/san2_ssd/data/Workdir/survival/utils.py:305: RuntimeWarning: invalid value encountered in true_divide
  pdfs = np.gradient(1-survs,axis=1)/norms
[32m[I 2022-04-13 11:58:20,299][0m Trial 568 finished with value: 0.882942564620887 and parameters: {'splitter': 'best', 'min_samples_split': 0.12404823723745209, 'min_samples_leaf': 0.028637175479106877, 'min_weight_fraction_leaf': 0.025686223981288548, 'max_features': 0.9183325426338543}. Best is trial 448 with value: 0.8888507593246218.[0m
[32m[I 2022-04-13 11:58:20,482][0m Trial 569 finished with value: 0.6953987916579007 and parameters: {'splitter': 'best', 'min_samples_split': 0.15529877580735393, 'min_samples_leaf': 0.42565721775801324, 'min_weight_fraction_leaf': 0.01687566097930781, 'max_features': 0.9655740487454222}. Best is trial 448 with value: 0.8888507593246218.[0m
/media/san2_ssd/data/Workdir/survival/utils.py:305: RuntimeWarning: invalid value encountered in true_divide
  pdfs = np.gradient(1-survs,axis=1)/norms
/media/san2_ssd/data/Workdir/survival/utils.py:305: RuntimeWarning: invalid value encountered in true_divide
  pdfs = np.gradient(1-survs,axis=1)/norms
/media/san2_ssd/data/Workdir/survival/utils.py:305: RuntimeWarning: invalid value encountered in true_divide
  pdfs = np.gradient(1-survs,axis=1)/norms
/media/san2_ssd/data/Workdir/survival/utils.py:305: RuntimeWarning: invalid value encountered in true_divide
  pdfs = np.gradient(1-survs,axis=1)/norms
[32m[I 2022-04-13 11:58:21,523][0m Trial 570 finished with value: 0.8826148018879397 and parameters: {'splitter': 'best', 'min_samples_split': 0.11667130893305543, 'min_samples_leaf': 0.03693680263891478, 'min_weight_fraction_leaf': 0.03234095843398206, 'max_features': 0.949686237929141}. Best is trial 448 with value: 0.8888507593246218.[0m
/media/san2_ssd/data/Workdir/survival/utils.py:305: RuntimeWarning: invalid value encountered in true_divide
  pdfs = np.gradient(1-survs,axis=1)/norms
/media/san2_ssd/data/Workdir/survival/utils.py:305: RuntimeWarning: invalid value encountered in true_divide
  pdfs = np.gradient(1-survs,axis=1)/norms
/media/san2_ssd/data/Workdir/survival/utils.py:305: RuntimeWarning: invalid value encountered in true_divide
  pdfs = np.gradient(1-survs,axis=1)/norms
[32m[I 2022-04-13 11:58:22,868][0m Trial 571 finished with value: 0.7728362395831556 and parameters: {'splitter': 'best', 'min_samples_split': 0.1325426784680181, 'min_samples_leaf': 0.019209412904952133, 'min_weight_fraction_leaf': 0.012518404024425347, 'max_features': 0.49756471669082925}. Best is trial 448 with value: 0.8888507593246218.[0m
[32m[I 2022-04-13 11:58:24,374][0m Trial 572 finished with value: 0.8831844130841933 and parameters: {'splitter': 'best', 'min_samples_split': 0.12311417216621742, 'min_samples_leaf': 0.06583248217131546, 'min_weight_fraction_leaf': 0.04117538894476082, 'max_features': 0.9770091589153354}. Best is trial 448 with value: 0.8888507593246218.[0m
[32m[I 2022-04-13 11:58:24,886][0m Trial 573 finished with value: 0.579830071686072 and parameters: {'splitter': 'best', 'min_samples_split': 0.09034075620621326, 'min_samples_leaf': 0.19032765076976596, 'min_weight_fraction_leaf': 0.023686597880635474, 'max_features': 0.9776350628804144}. Best is trial 448 with value: 0.8888507593246218.[0m
/media/san2_ssd/data/Workdir/survival/utils.py:305: RuntimeWarning: invalid value encountered in true_divide
  pdfs = np.gradient(1-survs,axis=1)/norms
/media/san2_ssd/data/Workdir/survival/utils.py:305: RuntimeWarning: invalid value encountered in true_divide
  pdfs = np.gradient(1-survs,axis=1)/norms
/media/san2_ssd/data/Workdir/survival/utils.py:305: RuntimeWarning: invalid value encountered in true_divide
  pdfs = np.gradient(1-survs,axis=1)/norms
[32m[I 2022-04-13 11:58:26,144][0m Trial 574 finished with value: 0.8839179303551603 and parameters: {'splitter': 'best', 'min_samples_split': 0.11253827405538087, 'min_samples_leaf': 0.049807994920520994, 'min_weight_fraction_leaf': 0.032843646090527284, 'max_features': 0.9556576623007823}. Best is trial 448 with value: 0.8888507593246218.[0m
/media/san2_ssd/data/Workdir/survival/utils.py:305: RuntimeWarning: invalid value encountered in true_divide
  pdfs = np.gradient(1-survs,axis=1)/norms
/media/san2_ssd/data/Workdir/survival/utils.py:305: RuntimeWarning: invalid value encountered in true_divide
  pdfs = np.gradient(1-survs,axis=1)/norms
/media/san2_ssd/data/Workdir/survival/utils.py:305: RuntimeWarning: invalid value encountered in true_divide
  pdfs = np.gradient(1-survs,axis=1)/norms
/media/san2_ssd/data/Workdir/survival/utils.py:305: RuntimeWarning: invalid value encountered in true_divide
  pdfs = np.gradient(1-survs,axis=1)/norms
[32m[I 2022-04-13 11:58:29,103][0m Trial 575 finished with value: 0.8837174401229413 and parameters: {'splitter': 'best', 'min_samples_split': 0.10222720804647771, 'min_samples_leaf': 0.028581397215676055, 'min_weight_fraction_leaf': 0.007950966141275235, 'max_features': 0.9375456545061248}. Best is trial 448 with value: 0.8888507593246218.[0m
/media/san2_ssd/data/Workdir/survival/utils.py:305: RuntimeWarning: invalid value encountered in true_divide
  pdfs = np.gradient(1-survs,axis=1)/norms
/media/san2_ssd/data/Workdir/survival/utils.py:305: RuntimeWarning: invalid value encountered in true_divide
  pdfs = np.gradient(1-survs,axis=1)/norms
/media/san2_ssd/data/Workdir/survival/utils.py:305: RuntimeWarning: invalid value encountered in true_divide
  pdfs = np.gradient(1-survs,axis=1)/norms
[32m[I 2022-04-13 11:58:30,308][0m Trial 576 finished with value: 0.8857329310766968 and parameters: {'splitter': 'best', 'min_samples_split': 0.12401457415053245, 'min_samples_leaf': 0.018791752875451814, 'min_weight_fraction_leaf': 0.04706073428788529, 'max_features': 0.9798065889091916}. Best is trial 448 with value: 0.8888507593246218.[0m
/media/san2_ssd/data/Workdir/survival/utils.py:305: RuntimeWarning: invalid value encountered in true_divide
  pdfs = np.gradient(1-survs,axis=1)/norms
[32m[I 2022-04-13 11:58:31,880][0m Trial 577 finished with value: 0.881806904322324 and parameters: {'splitter': 'best', 'min_samples_split': 0.1469082989963559, 'min_samples_leaf': 0.03803671417899709, 'min_weight_fraction_leaf': 0.0008182771822753745, 'max_features': 0.9702184003753704}. Best is trial 448 with value: 0.8888507593246218.[0m
/media/san2_ssd/data/Workdir/survival/utils.py:305: RuntimeWarning: invalid value encountered in true_divide
  pdfs = np.gradient(1-survs,axis=1)/norms
/media/san2_ssd/data/Workdir/survival/utils.py:305: RuntimeWarning: invalid value encountered in true_divide
  pdfs = np.gradient(1-survs,axis=1)/norms
[32m[I 2022-04-13 11:58:32,833][0m Trial 578 finished with value: 0.8825989838726447 and parameters: {'splitter': 'best', 'min_samples_split': 0.11540107299437595, 'min_samples_leaf': 0.027565057187663247, 'min_weight_fraction_leaf': 0.021267865188839493, 'max_features': 0.8998617956047106}. Best is trial 448 with value: 0.8888507593246218.[0m
/media/san2_ssd/data/Workdir/survival/utils.py:305: RuntimeWarning: invalid value encountered in true_divide
  pdfs = np.gradient(1-survs,axis=1)/norms
/media/san2_ssd/data/Workdir/survival/utils.py:305: RuntimeWarning: invalid value encountered in true_divide
  pdfs = np.gradient(1-survs,axis=1)/norms
[32m[I 2022-04-13 11:58:35,012][0m Trial 579 finished with value: 0.8869463096179887 and parameters: {'splitter': 'best', 'min_samples_split': 0.13876396735814886, 'min_samples_leaf': 0.04715606808954375, 'min_weight_fraction_leaf': 0.029378320694992216, 'max_features': 0.9816422799176217}. Best is trial 448 with value: 0.8888507593246218.[0m
/media/san2_ssd/data/Workdir/survival/utils.py:305: RuntimeWarning: invalid value encountered in true_divide
  pdfs = np.gradient(1-survs,axis=1)/norms
/media/san2_ssd/data/Workdir/survival/utils.py:305: RuntimeWarning: invalid value encountered in true_divide
  pdfs = np.gradient(1-survs,axis=1)/norms
/media/san2_ssd/data/Workdir/survival/utils.py:305: RuntimeWarning: invalid value encountered in true_divide
  pdfs = np.gradient(1-survs,axis=1)/norms
/media/san2_ssd/data/Workdir/survival/utils.py:305: RuntimeWarning: invalid value encountered in true_divide
  pdfs = np.gradient(1-survs,axis=1)/norms
/media/san2_ssd/data/Workdir/survival/utils.py:305: RuntimeWarning: invalid value encountered in true_divide
  pdfs = np.gradient(1-survs,axis=1)/norms
[32m[I 2022-04-13 11:58:37,058][0m Trial 580 finished with value: 0.8827948778540039 and parameters: {'splitter': 'best', 'min_samples_split': 0.09541195048668995, 'min_samples_leaf': 0.03543649624952691, 'min_weight_fraction_leaf': 0.04071345746470603, 'max_features': 0.9513151255822287}. Best is trial 448 with value: 0.8888507593246218.[0m
/media/san2_ssd/data/Workdir/survival/utils.py:305: RuntimeWarning: invalid value encountered in true_divide
  pdfs = np.gradient(1-survs,axis=1)/norms
/media/san2_ssd/data/Workdir/survival/utils.py:305: RuntimeWarning: invalid value encountered in true_divide
  pdfs = np.gradient(1-survs,axis=1)/norms
[32m[I 2022-04-13 11:58:39,366][0m Trial 581 finished with value: 0.882954233924502 and parameters: {'splitter': 'best', 'min_samples_split': 0.07543177680346416, 'min_samples_leaf': 0.019813133206018893, 'min_weight_fraction_leaf': 0.05680577580114374, 'max_features': 0.9238710090949651}. Best is trial 448 with value: 0.8888507593246218.[0m
[32m[I 2022-04-13 11:58:39,613][0m Trial 582 finished with value: 0.8788624033287737 and parameters: {'splitter': 'random', 'min_samples_split': 0.10658933034330814, 'min_samples_leaf': 0.010575762129554047, 'min_weight_fraction_leaf': 0.01586114377959718, 'max_features': 0.9805009799808335}. Best is trial 448 with value: 0.8888507593246218.[0m
/media/san2_ssd/data/Workdir/survival/utils.py:305: RuntimeWarning: invalid value encountered in true_divide
  pdfs = np.gradient(1-survs,axis=1)/norms
[32m[I 2022-04-13 11:58:39,820][0m Trial 583 finished with value: 0.857054245599873 and parameters: {'splitter': 'best', 'min_samples_split': 0.08558932555419398, 'min_samples_leaf': 0.027273416208886767, 'min_weight_fraction_leaf': 0.02862805237764511, 'max_features': 0.20582975414153043}. Best is trial 448 with value: 0.8888507593246218.[0m
/media/san2_ssd/data/Workdir/survival/utils.py:305: RuntimeWarning: invalid value encountered in true_divide
  pdfs = np.gradient(1-survs,axis=1)/norms
/media/san2_ssd/data/Workdir/survival/utils.py:305: RuntimeWarning: invalid value encountered in true_divide
  pdfs = np.gradient(1-survs,axis=1)/norms
/media/san2_ssd/data/Workdir/survival/utils.py:305: RuntimeWarning: invalid value encountered in true_divide
  pdfs = np.gradient(1-survs,axis=1)/norms
[32m[I 2022-04-13 11:58:40,240][0m Trial 584 finished with value: 0.764916750930127 and parameters: {'splitter': 'best', 'min_samples_split': 0.1311886326062171, 'min_samples_leaf': 0.05700206449106637, 'min_weight_fraction_leaf': 0.019783146490222246, 'max_features': 0.4446010655670243}. Best is trial 448 with value: 0.8888507593246218.[0m
/media/san2_ssd/data/Workdir/survival/utils.py:305: RuntimeWarning: invalid value encountered in true_divide
  pdfs = np.gradient(1-survs,axis=1)/norms
/media/san2_ssd/data/Workdir/survival/utils.py:305: RuntimeWarning: invalid value encountered in true_divide
  pdfs = np.gradient(1-survs,axis=1)/norms
/media/san2_ssd/data/Workdir/survival/utils.py:305: RuntimeWarning: invalid value encountered in true_divide
  pdfs = np.gradient(1-survs,axis=1)/norms
/media/san2_ssd/data/Workdir/survival/utils.py:305: RuntimeWarning: invalid value encountered in true_divide
  pdfs = np.gradient(1-survs,axis=1)/norms
/media/san2_ssd/data/Workdir/survival/utils.py:305: RuntimeWarning: invalid value encountered in true_divide
  pdfs = np.gradient(1-survs,axis=1)/norms
[32m[I 2022-04-13 11:58:41,489][0m Trial 585 finished with value: 0.8831770149002848 and parameters: {'splitter': 'best', 'min_samples_split': 0.11404985561534438, 'min_samples_leaf': 0.03720916971039361, 'min_weight_fraction_leaf': 0.04424510158149041, 'max_features': 0.9598552621872833}. Best is trial 448 with value: 0.8888507593246218.[0m
/media/san2_ssd/data/Workdir/survival/utils.py:305: RuntimeWarning: invalid value encountered in true_divide
  pdfs = np.gradient(1-survs,axis=1)/norms
/media/san2_ssd/data/Workdir/survival/utils.py:305: RuntimeWarning: invalid value encountered in true_divide
  pdfs = np.gradient(1-survs,axis=1)/norms
/media/san2_ssd/data/Workdir/survival/utils.py:305: RuntimeWarning: invalid value encountered in true_divide
  pdfs = np.gradient(1-survs,axis=1)/norms
/media/san2_ssd/data/Workdir/survival/utils.py:305: RuntimeWarning: invalid value encountered in true_divide
  pdfs = np.gradient(1-survs,axis=1)/norms
[32m[I 2022-04-13 11:58:42,918][0m Trial 586 finished with value: 0.8866261753797475 and parameters: {'splitter': 'best', 'min_samples_split': 0.10128236490670303, 'min_samples_leaf': 0.016121391086197052, 'min_weight_fraction_leaf': 0.035494517308471335, 'max_features': 0.9834502669721286}. Best is trial 448 with value: 0.8888507593246218.[0m
/media/san2_ssd/data/Workdir/survival/utils.py:305: RuntimeWarning: invalid value encountered in true_divide
  pdfs = np.gradient(1-survs,axis=1)/norms
/media/san2_ssd/data/Workdir/survival/utils.py:305: RuntimeWarning: invalid value encountered in true_divide
  pdfs = np.gradient(1-survs,axis=1)/norms
/media/san2_ssd/data/Workdir/survival/utils.py:305: RuntimeWarning: invalid value encountered in true_divide
  pdfs = np.gradient(1-survs,axis=1)/norms
/media/san2_ssd/data/Workdir/survival/utils.py:305: RuntimeWarning: invalid value encountered in true_divide
  pdfs = np.gradient(1-survs,axis=1)/norms
[32m[I 2022-04-13 11:58:44,777][0m Trial 587 finished with value: 0.883000623210185 and parameters: {'splitter': 'best', 'min_samples_split': 0.12365235208264788, 'min_samples_leaf': 0.043287245789275085, 'min_weight_fraction_leaf': 0.00991641988486612, 'max_features': 0.9646471308278137}. Best is trial 448 with value: 0.8888507593246218.[0m
[32m[I 2022-04-13 11:58:45,702][0m Trial 588 finished with value: 0.772967702308465 and parameters: {'splitter': 'best', 'min_samples_split': 0.11197586388006436, 'min_samples_leaf': 0.008566705973224046, 'min_weight_fraction_leaf': 0.05290630575880778, 'max_features': 0.5294889535203248}. Best is trial 448 with value: 0.8888507593246218.[0m
/media/san2_ssd/data/Workdir/survival/utils.py:305: RuntimeWarning: invalid value encountered in true_divide
  pdfs = np.gradient(1-survs,axis=1)/norms
/media/san2_ssd/data/Workdir/survival/utils.py:305: RuntimeWarning: invalid value encountered in true_divide
  pdfs = np.gradient(1-survs,axis=1)/norms
/media/san2_ssd/data/Workdir/survival/utils.py:305: RuntimeWarning: invalid value encountered in true_divide
  pdfs = np.gradient(1-survs,axis=1)/norms
/media/san2_ssd/data/Workdir/survival/utils.py:305: RuntimeWarning: invalid value encountered in true_divide
  pdfs = np.gradient(1-survs,axis=1)/norms
[32m[I 2022-04-13 11:58:48,626][0m Trial 589 finished with value: 0.8830365158674965 and parameters: {'splitter': 'best', 'min_samples_split': 0.09357593959278794, 'min_samples_leaf': 0.024526846946121037, 'min_weight_fraction_leaf': 0.026603725736439505, 'max_features': 0.878528551495422}. Best is trial 448 with value: 0.8888507593246218.[0m
[32m[I 2022-04-13 11:58:49,511][0m Trial 590 finished with value: 0.7181094953690392 and parameters: {'splitter': 'best', 'min_samples_split': 0.13768977781848968, 'min_samples_leaf': 0.2727482857017282, 'min_weight_fraction_leaf': 5.156091294654386e-05, 'max_features': 0.938549702825514}. Best is trial 448 with value: 0.8888507593246218.[0m
[32m[I 2022-04-13 11:58:52,042][0m Trial 591 finished with value: 0.8844822804241337 and parameters: {'splitter': 'best', 'min_samples_split': 0.12419849700668747, 'min_samples_leaf': 0.032623838874793504, 'min_weight_fraction_leaf': 0.06745590628644259, 'max_features': 0.9836481173581054}. Best is trial 448 with value: 0.8888507593246218.[0m
/media/san2_ssd/data/Workdir/survival/utils.py:305: RuntimeWarning: invalid value encountered in true_divide
  pdfs = np.gradient(1-survs,axis=1)/norms
/media/san2_ssd/data/Workdir/survival/utils.py:305: RuntimeWarning: invalid value encountered in true_divide
  pdfs = np.gradient(1-survs,axis=1)/norms
/media/san2_ssd/data/Workdir/survival/utils.py:305: RuntimeWarning: invalid value encountered in true_divide
  pdfs = np.gradient(1-survs,axis=1)/norms
[32m[I 2022-04-13 11:58:54,280][0m Trial 592 finished with value: 0.8844773994495669 and parameters: {'splitter': 'best', 'min_samples_split': 0.10624815706691873, 'min_samples_leaf': 0.05075255319648901, 'min_weight_fraction_leaf': 0.035583369905446346, 'max_features': 0.9621571670324379}. Best is trial 448 with value: 0.8888507593246218.[0m
[32m[I 2022-04-13 11:58:56,175][0m Trial 593 finished with value: 0.8834604123687291 and parameters: {'splitter': 'best', 'min_samples_split': 0.11589371665746706, 'min_samples_leaf': 0.06934373789410321, 'min_weight_fraction_leaf': 0.01802405897568418, 'max_features': 0.9996532852026048}. Best is trial 448 with value: 0.8888507593246218.[0m
