[32m[I 2022-04-13 11:58:57,856][0m Trial 594 finished with value: 0.7857519525455213 and parameters: {'splitter': 'best', 'min_samples_split': 0.08634185606023151, 'min_samples_leaf': 0.08422459870398466, 'min_weight_fraction_leaf': 0.04153300570320663, 'max_features': 0.9807512010156301}. Best is trial 448 with value: 0.8888507593246218.[0m
/media/san2_ssd/data/Workdir/survival/utils.py:305: RuntimeWarning: invalid value encountered in true_divide
  pdfs = np.gradient(1-survs,axis=1)/norms
/media/san2_ssd/data/Workdir/survival/utils.py:305: RuntimeWarning: invalid value encountered in true_divide
  pdfs = np.gradient(1-survs,axis=1)/norms
/media/san2_ssd/data/Workdir/survival/utils.py:305: RuntimeWarning: invalid value encountered in true_divide
  pdfs = np.gradient(1-survs,axis=1)/norms
/media/san2_ssd/data/Workdir/survival/utils.py:305: RuntimeWarning: invalid value encountered in true_divide
  pdfs = np.gradient(1-survs,axis=1)/norms
/media/san2_ssd/data/Workdir/survival/utils.py:305: RuntimeWarning: invalid value encountered in true_divide
  pdfs = np.gradient(1-survs,axis=1)/norms
[32m[I 2022-04-13 11:58:59,511][0m Trial 595 finished with value: 0.8855823577696814 and parameters: {'splitter': 'best', 'min_samples_split': 0.09969566253493448, 'min_samples_leaf': 0.017715121891577527, 'min_weight_fraction_leaf': 0.0275238057841016, 'max_features': 0.9994320101135679}. Best is trial 448 with value: 0.8888507593246218.[0m
/media/san2_ssd/data/Workdir/survival/utils.py:305: RuntimeWarning: invalid value encountered in true_divide
  pdfs = np.gradient(1-survs,axis=1)/norms
/media/san2_ssd/data/Workdir/survival/utils.py:305: RuntimeWarning: invalid value encountered in true_divide
  pdfs = np.gradient(1-survs,axis=1)/norms
/media/san2_ssd/data/Workdir/survival/utils.py:305: RuntimeWarning: invalid value encountered in true_divide
  pdfs = np.gradient(1-survs,axis=1)/norms
[32m[I 2022-04-13 11:59:01,419][0m Trial 596 finished with value: 0.8818812763920663 and parameters: {'splitter': 'best', 'min_samples_split': 0.12855999723459932, 'min_samples_leaf': 0.04221847758641319, 'min_weight_fraction_leaf': 0.04895973085702304, 'max_features': 0.9436018650680154}. Best is trial 448 with value: 0.8888507593246218.[0m
[32m[I 2022-04-13 11:59:03,104][0m Trial 597 finished with value: 0.7785440455401529 and parameters: {'splitter': 'best', 'min_samples_split': 0.11721248763554909, 'min_samples_leaf': 0.09938301808249506, 'min_weight_fraction_leaf': 0.012475598935421066, 'max_features': 0.9626290697340846}. Best is trial 448 with value: 0.8888507593246218.[0m
[32m[I 2022-04-13 11:59:05,211][0m Trial 598 finished with value: 0.4762173568334265 and parameters: {'splitter': 'best', 'min_samples_split': 0.3844611105882108, 'min_samples_leaf': 0.024756681491037012, 'min_weight_fraction_leaf': 0.03596208941580122, 'max_features': 0.9815023471051522}. Best is trial 448 with value: 0.8888507593246218.[0m
/media/san2_ssd/data/Workdir/survival/utils.py:305: RuntimeWarning: invalid value encountered in true_divide
  pdfs = np.gradient(1-survs,axis=1)/norms
/media/san2_ssd/data/Workdir/survival/utils.py:305: RuntimeWarning: invalid value encountered in true_divide
  pdfs = np.gradient(1-survs,axis=1)/norms
/media/san2_ssd/data/Workdir/survival/utils.py:305: RuntimeWarning: invalid value encountered in true_divide
  pdfs = np.gradient(1-survs,axis=1)/norms
/media/san2_ssd/data/Workdir/survival/utils.py:305: RuntimeWarning: invalid value encountered in true_divide
  pdfs = np.gradient(1-survs,axis=1)/norms
/media/san2_ssd/data/Workdir/survival/utils.py:305: RuntimeWarning: invalid value encountered in true_divide
  pdfs = np.gradient(1-survs,axis=1)/norms
[32m[I 2022-04-13 11:59:07,428][0m Trial 599 finished with value: 0.88377081308902 and parameters: {'splitter': 'best', 'min_samples_split': 0.06725580072757335, 'min_samples_leaf': 0.03264783346709705, 'min_weight_fraction_leaf': 0.02152642420355349, 'max_features': 0.9226151105868211}. Best is trial 448 with value: 0.8888507593246218.[0m
[32m[I 2022-04-13 11:59:08,907][0m Trial 600 finished with value: 0.696791890965137 and parameters: {'splitter': 'best', 'min_samples_split': 0.10514048614023862, 'min_samples_leaf': 0.0014373385334086573, 'min_weight_fraction_leaf': 0.34801951550274723, 'max_features': 0.9535207038316149}. Best is trial 448 with value: 0.8888507593246218.[0m
[32m[I 2022-04-13 11:59:09,505][0m Trial 601 finished with value: 0.767513195700688 and parameters: {'splitter': 'random', 'min_samples_split': 0.14321613747801765, 'min_samples_leaf': 0.01197942374785594, 'min_weight_fraction_leaf': 0.05983756833901256, 'max_features': 0.982315289685095}. Best is trial 448 with value: 0.8888507593246218.[0m
/media/san2_ssd/data/Workdir/survival/utils.py:305: RuntimeWarning: invalid value encountered in true_divide
  pdfs = np.gradient(1-survs,axis=1)/norms
/media/san2_ssd/data/Workdir/survival/utils.py:305: RuntimeWarning: invalid value encountered in true_divide
  pdfs = np.gradient(1-survs,axis=1)/norms
[32m[I 2022-04-13 11:59:12,518][0m Trial 602 finished with value: 0.8830980245552164 and parameters: {'splitter': 'best', 'min_samples_split': 0.1327050895825281, 'min_samples_leaf': 0.02354162116227744, 'min_weight_fraction_leaf': 0.02975562790034891, 'max_features': 0.9707025233359549}. Best is trial 448 with value: 0.8888507593246218.[0m
[32m[I 2022-04-13 11:59:14,106][0m Trial 603 finished with value: 0.6587257603200443 and parameters: {'splitter': 'best', 'min_samples_split': 0.2604928026629762, 'min_samples_leaf': 0.05638132052303091, 'min_weight_fraction_leaf': 0.04512699207740863, 'max_features': 0.7533618660529631}. Best is trial 448 with value: 0.8888507593246218.[0m
/media/san2_ssd/data/Workdir/survival/utils.py:305: RuntimeWarning: invalid value encountered in true_divide
  pdfs = np.gradient(1-survs,axis=1)/norms
/media/san2_ssd/data/Workdir/survival/utils.py:305: RuntimeWarning: invalid value encountered in true_divide
  pdfs = np.gradient(1-survs,axis=1)/norms
/media/san2_ssd/data/Workdir/survival/utils.py:305: RuntimeWarning: invalid value encountered in true_divide
  pdfs = np.gradient(1-survs,axis=1)/norms
/media/san2_ssd/data/Workdir/survival/utils.py:305: RuntimeWarning: invalid value encountered in true_divide
  pdfs = np.gradient(1-survs,axis=1)/norms
/media/san2_ssd/data/Workdir/survival/utils.py:305: RuntimeWarning: invalid value encountered in true_divide
  pdfs = np.gradient(1-survs,axis=1)/norms
[32m[I 2022-04-13 11:59:17,060][0m Trial 604 finished with value: 0.8830476035478629 and parameters: {'splitter': 'best', 'min_samples_split': 0.09516518328001691, 'min_samples_leaf': 0.039760655560219946, 'min_weight_fraction_leaf': 0.018567107798291415, 'max_features': 0.9465866799247307}. Best is trial 448 with value: 0.8888507593246218.[0m
/media/san2_ssd/data/Workdir/survival/utils.py:305: RuntimeWarning: invalid value encountered in true_divide
  pdfs = np.gradient(1-survs,axis=1)/norms
/media/san2_ssd/data/Workdir/survival/utils.py:305: RuntimeWarning: invalid value encountered in true_divide
  pdfs = np.gradient(1-survs,axis=1)/norms
/media/san2_ssd/data/Workdir/survival/utils.py:305: RuntimeWarning: invalid value encountered in true_divide
  pdfs = np.gradient(1-survs,axis=1)/norms
[32m[I 2022-04-13 11:59:20,002][0m Trial 605 finished with value: 0.7845783351051312 and parameters: {'splitter': 'best', 'min_samples_split': 0.11932268665402412, 'min_samples_leaf': 0.016809152425685616, 'min_weight_fraction_leaf': 0.008394443807584747, 'max_features': 0.9842240510374162}. Best is trial 448 with value: 0.8888507593246218.[0m
[32m[I 2022-04-13 11:59:22,819][0m Trial 606 finished with value: 0.7803038315629511 and parameters: {'splitter': 'best', 'min_samples_split': 0.23193166547454497, 'min_samples_leaf': 0.03252939843590261, 'min_weight_fraction_leaf': 0.03431986207318688, 'max_features': 0.9995114751987698}. Best is trial 448 with value: 0.8888507593246218.[0m
/media/san2_ssd/data/Workdir/survival/utils.py:305: RuntimeWarning: invalid value encountered in true_divide
  pdfs = np.gradient(1-survs,axis=1)/norms
/media/san2_ssd/data/Workdir/survival/utils.py:305: RuntimeWarning: invalid value encountered in true_divide
  pdfs = np.gradient(1-survs,axis=1)/norms
/media/san2_ssd/data/Workdir/survival/utils.py:305: RuntimeWarning: invalid value encountered in true_divide
  pdfs = np.gradient(1-survs,axis=1)/norms
[32m[I 2022-04-13 11:59:26,492][0m Trial 607 finished with value: 0.8844773994495669 and parameters: {'splitter': 'best', 'min_samples_split': 0.10868873288401518, 'min_samples_leaf': 0.0013350943876834463, 'min_weight_fraction_leaf': 0.05150006051361572, 'max_features': 0.9631183076940851}. Best is trial 448 with value: 0.8888507593246218.[0m
/media/san2_ssd/data/Workdir/survival/utils.py:305: RuntimeWarning: invalid value encountered in true_divide
  pdfs = np.gradient(1-survs,axis=1)/norms
/media/san2_ssd/data/Workdir/survival/utils.py:305: RuntimeWarning: invalid value encountered in true_divide
  pdfs = np.gradient(1-survs,axis=1)/norms
/media/san2_ssd/data/Workdir/survival/utils.py:305: RuntimeWarning: invalid value encountered in true_divide
  pdfs = np.gradient(1-survs,axis=1)/norms
[32m[I 2022-04-13 11:59:27,784][0m Trial 608 finished with value: 0.8843648194054754 and parameters: {'splitter': 'best', 'min_samples_split': 0.07836501738521096, 'min_samples_leaf': 0.0469464402113763, 'min_weight_fraction_leaf': 0.026453515340429265, 'max_features': 0.9323262324453641}. Best is trial 448 with value: 0.8888507593246218.[0m
[32m[I 2022-04-13 11:59:29,396][0m Trial 609 finished with value: 0.5586125818303 and parameters: {'splitter': 'best', 'min_samples_split': 0.12540961941349313, 'min_samples_leaf': 0.02758463579732143, 'min_weight_fraction_leaf': 0.3004229813152401, 'max_features': 0.9829705217388452}. Best is trial 448 with value: 0.8888507593246218.[0m
/media/san2_ssd/data/Workdir/survival/utils.py:305: RuntimeWarning: invalid value encountered in true_divide
  pdfs = np.gradient(1-survs,axis=1)/norms
/media/san2_ssd/data/Workdir/survival/utils.py:305: RuntimeWarning: invalid value encountered in true_divide
  pdfs = np.gradient(1-survs,axis=1)/norms
/media/san2_ssd/data/Workdir/survival/utils.py:305: RuntimeWarning: invalid value encountered in true_divide
  pdfs = np.gradient(1-survs,axis=1)/norms
/media/san2_ssd/data/Workdir/survival/utils.py:305: RuntimeWarning: invalid value encountered in true_divide
  pdfs = np.gradient(1-survs,axis=1)/norms
[32m[I 2022-04-13 11:59:32,720][0m Trial 610 finished with value: 0.8840436661944839 and parameters: {'splitter': 'best', 'min_samples_split': 0.10900040590595148, 'min_samples_leaf': 0.014020832456591916, 'min_weight_fraction_leaf': 0.03894187165338431, 'max_features': 0.9655014032436852}. Best is trial 448 with value: 0.8888507593246218.[0m
/media/san2_ssd/data/Workdir/survival/utils.py:305: RuntimeWarning: invalid value encountered in true_divide
  pdfs = np.gradient(1-survs,axis=1)/norms
/media/san2_ssd/data/Workdir/survival/utils.py:305: RuntimeWarning: invalid value encountered in true_divide
  pdfs = np.gradient(1-survs,axis=1)/norms
/media/san2_ssd/data/Workdir/survival/utils.py:305: RuntimeWarning: invalid value encountered in true_divide
  pdfs = np.gradient(1-survs,axis=1)/norms
/media/san2_ssd/data/Workdir/survival/utils.py:305: RuntimeWarning: invalid value encountered in true_divide
  pdfs = np.gradient(1-survs,axis=1)/norms
[32m[I 2022-04-13 11:59:34,359][0m Trial 611 finished with value: 0.8840767489675043 and parameters: {'splitter': 'best', 'min_samples_split': 0.0878534394463455, 'min_samples_leaf': 0.0403631009267869, 'min_weight_fraction_leaf': 0.015276867729803145, 'max_features': 0.998777645235445}. Best is trial 448 with value: 0.8888507593246218.[0m
/media/san2_ssd/data/Workdir/survival/utils.py:305: RuntimeWarning: invalid value encountered in true_divide
  pdfs = np.gradient(1-survs,axis=1)/norms
/media/san2_ssd/data/Workdir/survival/utils.py:305: RuntimeWarning: invalid value encountered in true_divide
  pdfs = np.gradient(1-survs,axis=1)/norms
/media/san2_ssd/data/Workdir/survival/utils.py:305: RuntimeWarning: invalid value encountered in true_divide
  pdfs = np.gradient(1-survs,axis=1)/norms
[32m[I 2022-04-13 11:59:36,083][0m Trial 612 finished with value: 0.8822258166094403 and parameters: {'splitter': 'best', 'min_samples_split': 0.11683920487860475, 'min_samples_leaf': 0.053486977981988995, 'min_weight_fraction_leaf': 0.029222585569367444, 'max_features': 0.9486543948953242}. Best is trial 448 with value: 0.8888507593246218.[0m
/media/san2_ssd/data/Workdir/survival/utils.py:305: RuntimeWarning: invalid value encountered in true_divide
  pdfs = np.gradient(1-survs,axis=1)/norms
/media/san2_ssd/data/Workdir/survival/utils.py:305: RuntimeWarning: invalid value encountered in true_divide
  pdfs = np.gradient(1-survs,axis=1)/norms
/media/san2_ssd/data/Workdir/survival/utils.py:305: RuntimeWarning: invalid value encountered in true_divide
  pdfs = np.gradient(1-survs,axis=1)/norms
/media/san2_ssd/data/Workdir/survival/utils.py:305: RuntimeWarning: invalid value encountered in true_divide
  pdfs = np.gradient(1-survs,axis=1)/norms
[32m[I 2022-04-13 11:59:37,188][0m Trial 613 finished with value: 0.8859971911404394 and parameters: {'splitter': 'best', 'min_samples_split': 0.10000998823913307, 'min_samples_leaf': 0.022972048874648227, 'min_weight_fraction_leaf': 0.0095880944549471, 'max_features': 0.9995761384336941}. Best is trial 448 with value: 0.8888507593246218.[0m
/media/san2_ssd/data/Workdir/survival/utils.py:305: RuntimeWarning: invalid value encountered in true_divide
  pdfs = np.gradient(1-survs,axis=1)/norms
/media/san2_ssd/data/Workdir/survival/utils.py:305: RuntimeWarning: invalid value encountered in true_divide
  pdfs = np.gradient(1-survs,axis=1)/norms
/media/san2_ssd/data/Workdir/survival/utils.py:305: RuntimeWarning: invalid value encountered in true_divide
  pdfs = np.gradient(1-survs,axis=1)/norms
/media/san2_ssd/data/Workdir/survival/utils.py:305: RuntimeWarning: invalid value encountered in true_divide
  pdfs = np.gradient(1-survs,axis=1)/norms
[32m[I 2022-04-13 11:59:40,631][0m Trial 614 finished with value: 0.8819271976841516 and parameters: {'splitter': 'best', 'min_samples_split': 0.1290467615421056, 'min_samples_leaf': 0.034514256070919624, 'min_weight_fraction_leaf': 0.04481276664370364, 'max_features': 0.967689759881307}. Best is trial 448 with value: 0.8888507593246218.[0m
/media/san2_ssd/data/Workdir/survival/utils.py:305: RuntimeWarning: invalid value encountered in true_divide
  pdfs = np.gradient(1-survs,axis=1)/norms
[32m[I 2022-04-13 11:59:44,024][0m Trial 615 finished with value: 0.7836425012699053 and parameters: {'splitter': 'best', 'min_samples_split': 0.1579373104539889, 'min_samples_leaf': 0.009576047926197385, 'min_weight_fraction_leaf': 0.022110636439007497, 'max_features': 0.9767922353882945}. Best is trial 448 with value: 0.8888507593246218.[0m
[32m[I 2022-04-13 11:59:45,675][0m Trial 616 finished with value: 0.6753576576876776 and parameters: {'splitter': 'best', 'min_samples_split': 0.245008251596689, 'min_samples_leaf': 0.022739078671890737, 'min_weight_fraction_leaf': 0.03800252543027599, 'max_features': 0.9163658328860653}. Best is trial 448 with value: 0.8888507593246218.[0m
/media/san2_ssd/data/Workdir/survival/utils.py:305: RuntimeWarning: invalid value encountered in true_divide
  pdfs = np.gradient(1-survs,axis=1)/norms
/media/san2_ssd/data/Workdir/survival/utils.py:305: RuntimeWarning: invalid value encountered in true_divide
  pdfs = np.gradient(1-survs,axis=1)/norms
/media/san2_ssd/data/Workdir/survival/utils.py:305: RuntimeWarning: invalid value encountered in true_divide
  pdfs = np.gradient(1-survs,axis=1)/norms
[32m[I 2022-04-13 11:59:48,154][0m Trial 617 finished with value: 0.8833628602539747 and parameters: {'splitter': 'best', 'min_samples_split': 0.10935324403462382, 'min_samples_leaf': 0.04491687954656762, 'min_weight_fraction_leaf': 0.0555389344084713, 'max_features': 0.9496664080093987}. Best is trial 448 with value: 0.8888507593246218.[0m
/media/san2_ssd/data/Workdir/survival/utils.py:305: RuntimeWarning: invalid value encountered in true_divide
  pdfs = np.gradient(1-survs,axis=1)/norms
[32m[I 2022-04-13 11:59:49,955][0m Trial 618 finished with value: 0.882398580127773 and parameters: {'splitter': 'best', 'min_samples_split': 0.09767046312531791, 'min_samples_leaf': 0.06333128798056092, 'min_weight_fraction_leaf': 0.0006698939722168812, 'max_features': 0.9691662363756438}. Best is trial 448 with value: 0.8888507593246218.[0m
[32m[I 2022-04-13 11:59:51,587][0m Trial 619 finished with value: 0.5578988092849027 and parameters: {'splitter': 'best', 'min_samples_split': 0.13891158027098, 'min_samples_leaf': 0.1503361229034028, 'min_weight_fraction_leaf': 0.02143619566374428, 'max_features': 0.7305761810747842}. Best is trial 448 with value: 0.8888507593246218.[0m
[32m[I 2022-04-13 11:59:52,117][0m Trial 620 finished with value: 0.7760761807462454 and parameters: {'splitter': 'random', 'min_samples_split': 0.1193092525605169, 'min_samples_leaf': 0.032443621721116984, 'min_weight_fraction_leaf': 0.032234964496035405, 'max_features': 0.9834867069581043}. Best is trial 448 with value: 0.8888507593246218.[0m
[32m[I 2022-04-13 11:59:54,391][0m Trial 621 finished with value: 0.8834568768668272 and parameters: {'splitter': 'best', 'min_samples_split': 0.08929039374263617, 'min_samples_leaf': 0.01910559911444674, 'min_weight_fraction_leaf': 0.0687168316503033, 'max_features': 0.9336287308776944}. Best is trial 448 with value: 0.8888507593246218.[0m
[32m[I 2022-04-13 11:59:55,018][0m Trial 622 finished with value: 0.7074375182362482 and parameters: {'splitter': 'best', 'min_samples_split': 0.10758636850538693, 'min_samples_leaf': 0.030551638772067825, 'min_weight_fraction_leaf': 0.04479151543414385, 'max_features': 0.17060179245348572}. Best is trial 448 with value: 0.8888507593246218.[0m
/media/san2_ssd/data/Workdir/survival/utils.py:305: RuntimeWarning: invalid value encountered in true_divide
  pdfs = np.gradient(1-survs,axis=1)/norms
/media/san2_ssd/data/Workdir/survival/utils.py:305: RuntimeWarning: invalid value encountered in true_divide
  pdfs = np.gradient(1-survs,axis=1)/norms
/media/san2_ssd/data/Workdir/survival/utils.py:305: RuntimeWarning: invalid value encountered in true_divide
  pdfs = np.gradient(1-survs,axis=1)/norms
[32m[I 2022-04-13 11:59:56,923][0m Trial 623 finished with value: 0.7867958172861504 and parameters: {'splitter': 'best', 'min_samples_split': 0.12308434507930209, 'min_samples_leaf': 0.0089072886013318, 'min_weight_fraction_leaf': 0.014252219475497624, 'max_features': 0.9812013655688051}. Best is trial 448 with value: 0.8888507593246218.[0m
[32m[I 2022-04-13 11:59:58,135][0m Trial 624 finished with value: 0.47712705574551634 and parameters: {'splitter': 'best', 'min_samples_split': 0.31365602072030696, 'min_samples_leaf': 0.051477896196162214, 'min_weight_fraction_leaf': 0.02864076590611718, 'max_features': 0.9991271191274177}. Best is trial 448 with value: 0.8888507593246218.[0m
/media/san2_ssd/data/Workdir/survival/utils.py:305: RuntimeWarning: invalid value encountered in true_divide
  pdfs = np.gradient(1-survs,axis=1)/norms
/media/san2_ssd/data/Workdir/survival/utils.py:305: RuntimeWarning: invalid value encountered in true_divide
  pdfs = np.gradient(1-survs,axis=1)/norms
/media/san2_ssd/data/Workdir/survival/utils.py:305: RuntimeWarning: invalid value encountered in true_divide
  pdfs = np.gradient(1-survs,axis=1)/norms
[32m[I 2022-04-13 12:00:01,022][0m Trial 625 finished with value: 0.8832456677635493 and parameters: {'splitter': 'best', 'min_samples_split': 0.10138261864525375, 'min_samples_leaf': 0.04099547135429131, 'min_weight_fraction_leaf': 0.05651609040538272, 'max_features': 0.9596748151764424}. Best is trial 448 with value: 0.8888507593246218.[0m
/media/san2_ssd/data/Workdir/survival/utils.py:305: RuntimeWarning: invalid value encountered in true_divide
  pdfs = np.gradient(1-survs,axis=1)/norms
/media/san2_ssd/data/Workdir/survival/utils.py:305: RuntimeWarning: invalid value encountered in true_divide
  pdfs = np.gradient(1-survs,axis=1)/norms
/media/san2_ssd/data/Workdir/survival/utils.py:305: RuntimeWarning: invalid value encountered in true_divide
  pdfs = np.gradient(1-survs,axis=1)/norms
[32m[I 2022-04-13 12:00:04,130][0m Trial 626 finished with value: 0.8867865494255863 and parameters: {'splitter': 'best', 'min_samples_split': 0.13393313447053123, 'min_samples_leaf': 0.017446320081755666, 'min_weight_fraction_leaf': 0.03856624725670593, 'max_features': 0.9813006434941242}. Best is trial 448 with value: 0.8888507593246218.[0m
[32m[I 2022-04-13 12:00:06,625][0m Trial 627 finished with value: 0.5799943396208072 and parameters: {'splitter': 'best', 'min_samples_split': 0.07385887136506451, 'min_samples_leaf': 0.0014250612212251546, 'min_weight_fraction_leaf': 0.18294587246731348, 'max_features': 0.99997908919016}. Best is trial 448 with value: 0.8888507593246218.[0m
/media/san2_ssd/data/Workdir/survival/utils.py:305: RuntimeWarning: invalid value encountered in true_divide
  pdfs = np.gradient(1-survs,axis=1)/norms
/media/san2_ssd/data/Workdir/survival/utils.py:305: RuntimeWarning: invalid value encountered in true_divide
  pdfs = np.gradient(1-survs,axis=1)/norms
[32m[I 2022-04-13 12:00:09,400][0m Trial 628 finished with value: 0.8846624951350052 and parameters: {'splitter': 'best', 'min_samples_split': 0.11503537795465646, 'min_samples_leaf': 0.02764089139979075, 'min_weight_fraction_leaf': 0.02174265585034204, 'max_features': 0.9530371113512848}. Best is trial 448 with value: 0.8888507593246218.[0m
