[32m[I 2022-04-13 12:04:22,193][0m Trial 762 finished with value: 0.8886920129413529 and parameters: {'splitter': 'best', 'min_samples_split': 0.11676915201460931, 'min_samples_leaf': 0.04449965417992048, 'min_weight_fraction_leaf': 0.04017884806118667, 'max_features': 0.9808793261846455}. Best is trial 448 with value: 0.8888507593246218.[0m
/media/san2_ssd/data/Workdir/survival/utils.py:305: RuntimeWarning: invalid value encountered in true_divide
  pdfs = np.gradient(1-survs,axis=1)/norms
/media/san2_ssd/data/Workdir/survival/utils.py:305: RuntimeWarning: invalid value encountered in true_divide
  pdfs = np.gradient(1-survs,axis=1)/norms
/media/san2_ssd/data/Workdir/survival/utils.py:305: RuntimeWarning: invalid value encountered in true_divide
  pdfs = np.gradient(1-survs,axis=1)/norms
[32m[I 2022-04-13 12:04:24,555][0m Trial 763 finished with value: 0.8824385863220072 and parameters: {'splitter': 'best', 'min_samples_split': 0.12100201330205335, 'min_samples_leaf': 0.05858200368695375, 'min_weight_fraction_leaf': 0.040820306270442835, 'max_features': 0.9624506411200812}. Best is trial 448 with value: 0.8888507593246218.[0m
[32m[I 2022-04-13 12:04:26,752][0m Trial 764 finished with value: 0.7850944955918016 and parameters: {'splitter': 'best', 'min_samples_split': 0.13665814775325508, 'min_samples_leaf': 0.06262159887159231, 'min_weight_fraction_leaf': 0.08491630154913077, 'max_features': 0.9820986063782844}. Best is trial 448 with value: 0.8888507593246218.[0m
[32m[I 2022-04-13 12:04:28,044][0m Trial 765 finished with value: 0.7663187236535511 and parameters: {'splitter': 'best', 'min_samples_split': 0.14036002272242856, 'min_samples_leaf': 0.05041868557026525, 'min_weight_fraction_leaf': 0.008274541566557277, 'max_features': 0.5678496882693923}. Best is trial 448 with value: 0.8888507593246218.[0m
[32m[I 2022-04-13 12:04:29,860][0m Trial 766 finished with value: 0.7854902793362537 and parameters: {'splitter': 'best', 'min_samples_split': 0.16358008451398445, 'min_samples_leaf': 0.07794336029533448, 'min_weight_fraction_leaf': 0.057324169730180216, 'max_features': 0.9999695268318364}. Best is trial 448 with value: 0.8888507593246218.[0m
[32m[I 2022-04-13 12:04:33,582][0m Trial 767 finished with value: 0.8837077431764083 and parameters: {'splitter': 'best', 'min_samples_split': 0.1130343623930645, 'min_samples_leaf': 0.06807279181846203, 'min_weight_fraction_leaf': 0.01872987862568487, 'max_features': 0.9501293252049743}. Best is trial 448 with value: 0.8888507593246218.[0m
/media/san2_ssd/data/Workdir/survival/utils.py:305: RuntimeWarning: invalid value encountered in true_divide
  pdfs = np.gradient(1-survs,axis=1)/norms
/media/san2_ssd/data/Workdir/survival/utils.py:305: RuntimeWarning: invalid value encountered in true_divide
  pdfs = np.gradient(1-survs,axis=1)/norms
/media/san2_ssd/data/Workdir/survival/utils.py:305: RuntimeWarning: invalid value encountered in true_divide
  pdfs = np.gradient(1-survs,axis=1)/norms
[32m[I 2022-04-13 12:04:36,187][0m Trial 768 finished with value: 0.8859210216223972 and parameters: {'splitter': 'best', 'min_samples_split': 0.12526568367488594, 'min_samples_leaf': 0.0443335090785048, 'min_weight_fraction_leaf': 0.04649047684754239, 'max_features': 0.9837839404712747}. Best is trial 448 with value: 0.8888507593246218.[0m
/media/san2_ssd/data/Workdir/survival/utils.py:305: RuntimeWarning: invalid value encountered in true_divide
  pdfs = np.gradient(1-survs,axis=1)/norms
/media/san2_ssd/data/Workdir/survival/utils.py:305: RuntimeWarning: invalid value encountered in true_divide
  pdfs = np.gradient(1-survs,axis=1)/norms
[32m[I 2022-04-13 12:04:37,941][0m Trial 769 finished with value: 0.8850214022960919 and parameters: {'splitter': 'best', 'min_samples_split': 0.09350886377290259, 'min_samples_leaf': 0.055104224951151956, 'min_weight_fraction_leaf': 0.026713420206736813, 'max_features': 0.999568534173811}. Best is trial 448 with value: 0.8888507593246218.[0m
[32m[I 2022-04-13 12:04:40,235][0m Trial 770 finished with value: 0.8780766364180588 and parameters: {'splitter': 'best', 'min_samples_split': 0.19869281091864763, 'min_samples_leaf': 0.04360281407177797, 'min_weight_fraction_leaf': 0.036364715304748364, 'max_features': 0.966514229751188}. Best is trial 448 with value: 0.8888507593246218.[0m
[32m[I 2022-04-13 12:04:42,354][0m Trial 771 finished with value: 0.543929937141474 and parameters: {'splitter': 'best', 'min_samples_split': 0.48281417443377805, 'min_samples_leaf': 0.036278232639866174, 'min_weight_fraction_leaf': 0.066480586289235, 'max_features': 0.9263490726566732}. Best is trial 448 with value: 0.8888507593246218.[0m
/media/san2_ssd/data/Workdir/survival/utils.py:305: RuntimeWarning: invalid value encountered in true_divide
  pdfs = np.gradient(1-survs,axis=1)/norms
/media/san2_ssd/data/Workdir/survival/utils.py:305: RuntimeWarning: invalid value encountered in true_divide
  pdfs = np.gradient(1-survs,axis=1)/norms
/media/san2_ssd/data/Workdir/survival/utils.py:305: RuntimeWarning: invalid value encountered in true_divide
  pdfs = np.gradient(1-survs,axis=1)/norms
[32m[I 2022-04-13 12:04:43,715][0m Trial 772 finished with value: 0.8854690605133584 and parameters: {'splitter': 'best', 'min_samples_split': 0.08146501947314487, 'min_samples_leaf': 0.05229943760460291, 'min_weight_fraction_leaf': 0.027440188728663835, 'max_features': 0.9995930677608146}. Best is trial 448 with value: 0.8888507593246218.[0m
/media/san2_ssd/data/Workdir/survival/utils.py:305: RuntimeWarning: invalid value encountered in true_divide
  pdfs = np.gradient(1-survs,axis=1)/norms
/media/san2_ssd/data/Workdir/survival/utils.py:305: RuntimeWarning: invalid value encountered in true_divide
  pdfs = np.gradient(1-survs,axis=1)/norms
/media/san2_ssd/data/Workdir/survival/utils.py:305: RuntimeWarning: invalid value encountered in true_divide
  pdfs = np.gradient(1-survs,axis=1)/norms
/media/san2_ssd/data/Workdir/survival/utils.py:305: RuntimeWarning: invalid value encountered in true_divide
  pdfs = np.gradient(1-survs,axis=1)/norms
/media/san2_ssd/data/Workdir/survival/utils.py:305: RuntimeWarning: invalid value encountered in true_divide
  pdfs = np.gradient(1-survs,axis=1)/norms
[32m[I 2022-04-13 12:04:44,861][0m Trial 773 finished with value: 0.882861774548859 and parameters: {'splitter': 'best', 'min_samples_split': 0.10360037487849688, 'min_samples_leaf': 0.042249401631854304, 'min_weight_fraction_leaf': 0.013107911450580392, 'max_features': 0.9535558498086819}. Best is trial 448 with value: 0.8888507593246218.[0m
[32m[I 2022-04-13 12:04:45,053][0m Trial 774 finished with value: 0.7832721103973057 and parameters: {'splitter': 'random', 'min_samples_split': 0.11611419966861435, 'min_samples_leaf': 0.03035278452032596, 'min_weight_fraction_leaf': 0.043676781019873434, 'max_features': 0.971192647277546}. Best is trial 448 with value: 0.8888507593246218.[0m
/media/san2_ssd/data/Workdir/survival/utils.py:305: RuntimeWarning: invalid value encountered in true_divide
  pdfs = np.gradient(1-survs,axis=1)/norms
/media/san2_ssd/data/Workdir/survival/utils.py:305: RuntimeWarning: invalid value encountered in true_divide
  pdfs = np.gradient(1-survs,axis=1)/norms
[32m[I 2022-04-13 12:04:46,122][0m Trial 775 finished with value: 0.885628898009227 and parameters: {'splitter': 'best', 'min_samples_split': 0.13415570574726654, 'min_samples_leaf': 0.040168631536584384, 'min_weight_fraction_leaf': 0.05351091511069743, 'max_features': 0.9800258150412265}. Best is trial 448 with value: 0.8888507593246218.[0m
[32m[I 2022-04-13 12:04:46,652][0m Trial 776 finished with value: 0.6966927518301904 and parameters: {'splitter': 'best', 'min_samples_split': 0.11053921672788981, 'min_samples_leaf': 0.06778083837013993, 'min_weight_fraction_leaf': 0.40764184266451864, 'max_features': 0.9399605064066326}. Best is trial 448 with value: 0.8888507593246218.[0m
/media/san2_ssd/data/Workdir/survival/utils.py:305: RuntimeWarning: invalid value encountered in true_divide
  pdfs = np.gradient(1-survs,axis=1)/norms
/media/san2_ssd/data/Workdir/survival/utils.py:305: RuntimeWarning: invalid value encountered in true_divide
  pdfs = np.gradient(1-survs,axis=1)/norms
/media/san2_ssd/data/Workdir/survival/utils.py:305: RuntimeWarning: invalid value encountered in true_divide
  pdfs = np.gradient(1-survs,axis=1)/norms
/media/san2_ssd/data/Workdir/survival/utils.py:305: RuntimeWarning: invalid value encountered in true_divide
  pdfs = np.gradient(1-survs,axis=1)/norms
[32m[I 2022-04-13 12:04:47,657][0m Trial 777 finished with value: 0.8876655840327092 and parameters: {'splitter': 'best', 'min_samples_split': 0.123275281901329, 'min_samples_leaf': 0.028793744277188026, 'min_weight_fraction_leaf': 0.035867239271729114, 'max_features': 0.9996098487823861}. Best is trial 448 with value: 0.8888507593246218.[0m
/media/san2_ssd/data/Workdir/survival/utils.py:305: RuntimeWarning: invalid value encountered in true_divide
  pdfs = np.gradient(1-survs,axis=1)/norms
[32m[I 2022-04-13 12:04:49,965][0m Trial 778 finished with value: 0.882093427096657 and parameters: {'splitter': 'best', 'min_samples_split': 0.14805143895527134, 'min_samples_leaf': 0.023310946789463837, 'min_weight_fraction_leaf': 0.04055620553625442, 'max_features': 0.9655793207146984}. Best is trial 448 with value: 0.8888507593246218.[0m
/media/san2_ssd/data/Workdir/survival/utils.py:305: RuntimeWarning: invalid value encountered in true_divide
  pdfs = np.gradient(1-survs,axis=1)/norms
/media/san2_ssd/data/Workdir/survival/utils.py:305: RuntimeWarning: invalid value encountered in true_divide
  pdfs = np.gradient(1-survs,axis=1)/norms
[32m[I 2022-04-13 12:04:51,639][0m Trial 779 finished with value: 0.7853191577095077 and parameters: {'splitter': 'best', 'min_samples_split': 0.13139515461605814, 'min_samples_leaf': 0.01608928227961358, 'min_weight_fraction_leaf': 0.0581821745472505, 'max_features': 0.9823178008758715}. Best is trial 448 with value: 0.8888507593246218.[0m
[32m[I 2022-04-13 12:04:52,169][0m Trial 780 finished with value: 0.6697310528911552 and parameters: {'splitter': 'best', 'min_samples_split': 0.13969135442174818, 'min_samples_leaf': 0.02755237512419439, 'min_weight_fraction_leaf': 0.07211173338876188, 'max_features': 0.051721319154170664}. Best is trial 448 with value: 0.8888507593246218.[0m
/media/san2_ssd/data/Workdir/survival/utils.py:305: RuntimeWarning: invalid value encountered in true_divide
  pdfs = np.gradient(1-survs,axis=1)/norms
/media/san2_ssd/data/Workdir/survival/utils.py:305: RuntimeWarning: invalid value encountered in true_divide
  pdfs = np.gradient(1-survs,axis=1)/norms
/media/san2_ssd/data/Workdir/survival/utils.py:305: RuntimeWarning: invalid value encountered in true_divide
  pdfs = np.gradient(1-survs,axis=1)/norms
[32m[I 2022-04-13 12:04:55,495][0m Trial 781 finished with value: 0.8854832260262091 and parameters: {'splitter': 'best', 'min_samples_split': 0.12520755305434053, 'min_samples_leaf': 0.02731367917185035, 'min_weight_fraction_leaf': 0.05069520923794237, 'max_features': 0.9996015427999871}. Best is trial 448 with value: 0.8888507593246218.[0m
/media/san2_ssd/data/Workdir/survival/utils.py:305: RuntimeWarning: invalid value encountered in true_divide
  pdfs = np.gradient(1-survs,axis=1)/norms
/media/san2_ssd/data/Workdir/survival/utils.py:305: RuntimeWarning: invalid value encountered in true_divide
  pdfs = np.gradient(1-survs,axis=1)/norms
/media/san2_ssd/data/Workdir/survival/utils.py:305: RuntimeWarning: invalid value encountered in true_divide
  pdfs = np.gradient(1-survs,axis=1)/norms
[32m[I 2022-04-13 12:04:58,669][0m Trial 782 finished with value: 0.8833765513470258 and parameters: {'splitter': 'best', 'min_samples_split': 0.1212232397242863, 'min_samples_leaf': 0.051547856019992316, 'min_weight_fraction_leaf': 0.03822579208698014, 'max_features': 0.9469877598634533}. Best is trial 448 with value: 0.8888507593246218.[0m
/media/san2_ssd/data/Workdir/survival/utils.py:305: RuntimeWarning: invalid value encountered in true_divide
  pdfs = np.gradient(1-survs,axis=1)/norms
[32m[I 2022-04-13 12:05:00,504][0m Trial 783 finished with value: 0.8814810604258095 and parameters: {'splitter': 'best', 'min_samples_split': 0.15418006623842084, 'min_samples_leaf': 0.01429933154785406, 'min_weight_fraction_leaf': 0.033212236017581595, 'max_features': 0.9688994493351661}. Best is trial 448 with value: 0.8888507593246218.[0m
/media/san2_ssd/data/Workdir/survival/utils.py:305: RuntimeWarning: invalid value encountered in true_divide
  pdfs = np.gradient(1-survs,axis=1)/norms
/media/san2_ssd/data/Workdir/survival/utils.py:305: RuntimeWarning: invalid value encountered in true_divide
  pdfs = np.gradient(1-survs,axis=1)/norms
/media/san2_ssd/data/Workdir/survival/utils.py:305: RuntimeWarning: invalid value encountered in true_divide
  pdfs = np.gradient(1-survs,axis=1)/norms
[32m[I 2022-04-13 12:05:02,724][0m Trial 784 finished with value: 0.8857021391844405 and parameters: {'splitter': 'best', 'min_samples_split': 0.12999865604282587, 'min_samples_leaf': 0.03285031228742992, 'min_weight_fraction_leaf': 0.04805048142677363, 'max_features': 0.9812256466590471}. Best is trial 448 with value: 0.8888507593246218.[0m
/media/san2_ssd/data/Workdir/survival/utils.py:305: RuntimeWarning: invalid value encountered in true_divide
  pdfs = np.gradient(1-survs,axis=1)/norms
/media/san2_ssd/data/Workdir/survival/utils.py:305: RuntimeWarning: invalid value encountered in true_divide
  pdfs = np.gradient(1-survs,axis=1)/norms
/media/san2_ssd/data/Workdir/survival/utils.py:305: RuntimeWarning: invalid value encountered in true_divide
  pdfs = np.gradient(1-survs,axis=1)/norms
/media/san2_ssd/data/Workdir/survival/utils.py:305: RuntimeWarning: invalid value encountered in true_divide
  pdfs = np.gradient(1-survs,axis=1)/norms
/media/san2_ssd/data/Workdir/survival/utils.py:305: RuntimeWarning: invalid value encountered in true_divide
  pdfs = np.gradient(1-survs,axis=1)/norms
[32m[I 2022-04-13 12:05:04,366][0m Trial 785 finished with value: 0.8844832325070582 and parameters: {'splitter': 'best', 'min_samples_split': 0.11776434938974188, 'min_samples_leaf': 0.044472697160191296, 'min_weight_fraction_leaf': 0.02130995943337159, 'max_features': 0.9506928247187985}. Best is trial 448 with value: 0.8888507593246218.[0m
[32m[I 2022-04-13 12:05:05,829][0m Trial 786 finished with value: 0.6779733201707778 and parameters: {'splitter': 'best', 'min_samples_split': 0.14223011130881477, 'min_samples_leaf': 0.021230818762285907, 'min_weight_fraction_leaf': 0.1082185144458041, 'max_features': 0.9024066407307815}. Best is trial 448 with value: 0.8888507593246218.[0m
/media/san2_ssd/data/Workdir/survival/utils.py:305: RuntimeWarning: invalid value encountered in true_divide
  pdfs = np.gradient(1-survs,axis=1)/norms
/media/san2_ssd/data/Workdir/survival/utils.py:305: RuntimeWarning: invalid value encountered in true_divide
  pdfs = np.gradient(1-survs,axis=1)/norms
/media/san2_ssd/data/Workdir/survival/utils.py:305: RuntimeWarning: invalid value encountered in true_divide
  pdfs = np.gradient(1-survs,axis=1)/norms
/media/san2_ssd/data/Workdir/survival/utils.py:305: RuntimeWarning: invalid value encountered in true_divide
  pdfs = np.gradient(1-survs,axis=1)/norms
/media/san2_ssd/data/Workdir/survival/utils.py:305: RuntimeWarning: invalid value encountered in true_divide
  pdfs = np.gradient(1-survs,axis=1)/norms
[32m[I 2022-04-13 12:05:09,851][0m Trial 787 finished with value: 0.8808116172383127 and parameters: {'splitter': 'best', 'min_samples_split': 0.1004591267877165, 'min_samples_leaf': 0.008672703886547065, 'min_weight_fraction_leaf': 0.0002369367787021133, 'max_features': 0.98134639601996}. Best is trial 448 with value: 0.8888507593246218.[0m
/media/san2_ssd/data/Workdir/survival/utils.py:305: RuntimeWarning: invalid value encountered in true_divide
  pdfs = np.gradient(1-survs,axis=1)/norms
/media/san2_ssd/data/Workdir/survival/utils.py:305: RuntimeWarning: invalid value encountered in true_divide
  pdfs = np.gradient(1-survs,axis=1)/norms
/media/san2_ssd/data/Workdir/survival/utils.py:305: RuntimeWarning: invalid value encountered in true_divide
  pdfs = np.gradient(1-survs,axis=1)/norms
/media/san2_ssd/data/Workdir/survival/utils.py:305: RuntimeWarning: invalid value encountered in true_divide
  pdfs = np.gradient(1-survs,axis=1)/norms
/media/san2_ssd/data/Workdir/survival/utils.py:305: RuntimeWarning: invalid value encountered in true_divide
  pdfs = np.gradient(1-survs,axis=1)/norms
[32m[I 2022-04-13 12:05:12,187][0m Trial 788 finished with value: 0.8811471895270871 and parameters: {'splitter': 'best', 'min_samples_split': 0.07207931857393479, 'min_samples_leaf': 0.03546649525676513, 'min_weight_fraction_leaf': 0.029817604036364194, 'max_features': 0.9638958620091563}. Best is trial 448 with value: 0.8888507593246218.[0m
/media/san2_ssd/data/Workdir/survival/utils.py:305: RuntimeWarning: invalid value encountered in true_divide
  pdfs = np.gradient(1-survs,axis=1)/norms
/media/san2_ssd/data/Workdir/survival/utils.py:305: RuntimeWarning: invalid value encountered in true_divide
  pdfs = np.gradient(1-survs,axis=1)/norms
[32m[I 2022-04-13 12:05:14,024][0m Trial 789 finished with value: 0.8852406156105745 and parameters: {'splitter': 'best', 'min_samples_split': 0.12556268249276895, 'min_samples_leaf': 0.055484266567080706, 'min_weight_fraction_leaf': 0.015873823221760338, 'max_features': 0.9992821370578696}. Best is trial 448 with value: 0.8888507593246218.[0m
[32m[I 2022-04-13 12:05:15,170][0m Trial 790 finished with value: 0.4584562278120175 and parameters: {'splitter': 'best', 'min_samples_split': 0.11537230082294668, 'min_samples_leaf': 0.18056987900711757, 'min_weight_fraction_leaf': 0.03645097574862846, 'max_features': 0.9286324240171456}. Best is trial 448 with value: 0.8888507593246218.[0m
/media/san2_ssd/data/Workdir/survival/utils.py:305: RuntimeWarning: invalid value encountered in true_divide
  pdfs = np.gradient(1-survs,axis=1)/norms
[32m[I 2022-04-13 12:05:18,453][0m Trial 791 finished with value: 0.8822523710094448 and parameters: {'splitter': 'best', 'min_samples_split': 0.08749542245305073, 'min_samples_leaf': 0.01882313402124565, 'min_weight_fraction_leaf': 0.06408356272151469, 'max_features': 0.9555380220460156}. Best is trial 448 with value: 0.8888507593246218.[0m
/media/san2_ssd/data/Workdir/survival/utils.py:305: RuntimeWarning: invalid value encountered in true_divide
  pdfs = np.gradient(1-survs,axis=1)/norms
/media/san2_ssd/data/Workdir/survival/utils.py:305: RuntimeWarning: invalid value encountered in true_divide
  pdfs = np.gradient(1-survs,axis=1)/norms
/media/san2_ssd/data/Workdir/survival/utils.py:305: RuntimeWarning: invalid value encountered in true_divide
  pdfs = np.gradient(1-survs,axis=1)/norms
[32m[I 2022-04-13 12:05:21,774][0m Trial 792 finished with value: 0.8879455340596806 and parameters: {'splitter': 'best', 'min_samples_split': 0.13261705354934408, 'min_samples_leaf': 0.04360732266611921, 'min_weight_fraction_leaf': 0.04545939709374115, 'max_features': 0.9997197457385557}. Best is trial 448 with value: 0.8888507593246218.[0m
[32m[I 2022-04-13 12:05:23,618][0m Trial 793 finished with value: 0.7865243203470126 and parameters: {'splitter': 'best', 'min_samples_split': 0.14950657185284658, 'min_samples_leaf': 0.06266189370179764, 'min_weight_fraction_leaf': 0.07611076914343516, 'max_features': 0.9832577782172403}. Best is trial 448 with value: 0.8888507593246218.[0m
/media/san2_ssd/data/Workdir/survival/utils.py:305: RuntimeWarning: invalid value encountered in true_divide
  pdfs = np.gradient(1-survs,axis=1)/norms
/media/san2_ssd/data/Workdir/survival/utils.py:305: RuntimeWarning: invalid value encountered in true_divide
  pdfs = np.gradient(1-survs,axis=1)/norms
[32m[I 2022-04-13 12:05:25,643][0m Trial 794 finished with value: 0.8852711515616823 and parameters: {'splitter': 'best', 'min_samples_split': 0.13180983483498973, 'min_samples_leaf': 0.042754870355896285, 'min_weight_fraction_leaf': 0.05494241201376458, 'max_features': 0.983452828872981}. Best is trial 448 with value: 0.8888507593246218.[0m
[32m[I 2022-04-13 12:05:26,042][0m Trial 795 finished with value: 0.767513195700688 and parameters: {'splitter': 'random', 'min_samples_split': 0.14317501524329393, 'min_samples_leaf': 0.050756992857072525, 'min_weight_fraction_leaf': 0.062249124236289435, 'max_features': 0.9835993103719051}. Best is trial 448 with value: 0.8888507593246218.[0m
/media/san2_ssd/data/Workdir/survival/utils.py:305: RuntimeWarning: invalid value encountered in true_divide
  pdfs = np.gradient(1-survs,axis=1)/norms
[32m[I 2022-04-13 12:05:27,814][0m Trial 796 finished with value: 0.8828112740301327 and parameters: {'splitter': 'best', 'min_samples_split': 0.13241852783958302, 'min_samples_leaf': 0.028571402381372103, 'min_weight_fraction_leaf': 0.048260469948563284, 'max_features': 0.963515866043139}. Best is trial 448 with value: 0.8888507593246218.[0m
[32m[I 2022-04-13 12:05:28,940][0m Trial 797 finished with value: 0.8844323819237869 and parameters: {'splitter': 'best', 'min_samples_split': 0.13825740896627303, 'min_samples_leaf': 0.07080982281992099, 'min_weight_fraction_leaf': 0.04612089961801823, 'max_features': 0.999501794917627}. Best is trial 448 with value: 0.8888507593246218.[0m
