[32m[I 2022-04-14 01:18:48,371][0m Trial 370 finished with value: 0.5008984165376957 and parameters: {'loss': 'coxph', 'learning_rate': 1.1546270860209518e-05, 'n_estimators': 903, 'criterion': 'friedman_mse', 'min_samples_split': 9, 'min_samples_leaf': 2, 'min_weight_fraction_leaf': 0.39125396879445445, 'min_impurity_decrease': 0.2792301772427034, 'max_features': 0.8931520524520766, 'subsample': 0.118504425571896, 'dropout_rate': 0.58523546376875, 'ccp_alpha': 0.3320656412344859}. Best is trial 367 with value: 0.7817487788378487.[0m
[32m[I 2022-04-14 01:22:56,763][0m Trial 371 finished with value: 0.7798262689628449 and parameters: {'loss': 'coxph', 'learning_rate': 9.285384061729285e-06, 'n_estimators': 949, 'criterion': 'friedman_mse', 'min_samples_split': 9, 'min_samples_leaf': 2, 'min_weight_fraction_leaf': 0.36663236023724677, 'min_impurity_decrease': 0.3032347005242532, 'max_features': 0.9155278496697321, 'subsample': 0.10774174377545692, 'dropout_rate': 0.5991962418886523, 'ccp_alpha': 0.0775961464006429}. Best is trial 367 with value: 0.7817487788378487.[0m
[32m[I 2022-04-14 01:26:51,474][0m Trial 372 finished with value: 0.7809441459574014 and parameters: {'loss': 'coxph', 'learning_rate': 1.248905231550292e-05, 'n_estimators': 899, 'criterion': 'friedman_mse', 'min_samples_split': 9, 'min_samples_leaf': 2, 'min_weight_fraction_leaf': 0.38439754793379144, 'min_impurity_decrease': 0.3052741903209552, 'max_features': 0.8951783536076856, 'subsample': 0.12799583846309048, 'dropout_rate': 0.5770652350255755, 'ccp_alpha': 0.0015792118420413503}. Best is trial 367 with value: 0.7817487788378487.[0m
[32m[I 2022-04-14 01:30:41,687][0m Trial 373 finished with value: 0.7809146115986637 and parameters: {'loss': 'coxph', 'learning_rate': 1.3488147954808658e-05, 'n_estimators': 904, 'criterion': 'friedman_mse', 'min_samples_split': 9, 'min_samples_leaf': 2, 'min_weight_fraction_leaf': 0.3841375236742672, 'min_impurity_decrease': 0.3033387941624624, 'max_features': 0.8880482311868252, 'subsample': 0.1275377343313715, 'dropout_rate': 0.5826790132931633, 'ccp_alpha': 0.01611287670207387}. Best is trial 367 with value: 0.7817487788378487.[0m
[32m[I 2022-04-14 01:34:24,708][0m Trial 374 finished with value: 0.7805611289372617 and parameters: {'loss': 'coxph', 'learning_rate': 1.1729967704642109e-05, 'n_estimators': 907, 'criterion': 'friedman_mse', 'min_samples_split': 9, 'min_samples_leaf': 2, 'min_weight_fraction_leaf': 0.3850038542026792, 'min_impurity_decrease': 0.2906159482444472, 'max_features': 0.9050186340997957, 'subsample': 0.13394125059144832, 'dropout_rate': 0.5765035470149846, 'ccp_alpha': 0.008060813529890713}. Best is trial 367 with value: 0.7817487788378487.[0m
[32m[I 2022-04-14 01:38:19,097][0m Trial 375 finished with value: 0.7783543433689595 and parameters: {'loss': 'coxph', 'learning_rate': 1.263689731770711e-05, 'n_estimators': 959, 'criterion': 'friedman_mse', 'min_samples_split': 9, 'min_samples_leaf': 2, 'min_weight_fraction_leaf': 0.3961456386784924, 'min_impurity_decrease': 0.2630795591339325, 'max_features': 0.8881548984573606, 'subsample': 0.12341907121564362, 'dropout_rate': 0.6083058930341184, 'ccp_alpha': 0.10411666399473603}. Best is trial 367 with value: 0.7817487788378487.[0m
[32m[I 2022-04-14 01:41:30,920][0m Trial 376 finished with value: 0.5008984165376957 and parameters: {'loss': 'coxph', 'learning_rate': 9.942434882949683e-06, 'n_estimators': 903, 'criterion': 'friedman_mse', 'min_samples_split': 9, 'min_samples_leaf': 2, 'min_weight_fraction_leaf': 0.3859188637976438, 'min_impurity_decrease': 0.3018327044646167, 'max_features': 0.8589705112963489, 'subsample': 0.12464487186040052, 'dropout_rate': 0.5838787498044351, 'ccp_alpha': 0.31686945112695386}. Best is trial 367 with value: 0.7817487788378487.[0m
[32m[I 2022-04-14 01:45:03,907][0m Trial 377 finished with value: 0.7772517676624859 and parameters: {'loss': 'coxph', 'learning_rate': 9.444861552803525e-06, 'n_estimators': 941, 'criterion': 'friedman_mse', 'min_samples_split': 9, 'min_samples_leaf': 2, 'min_weight_fraction_leaf': 0.3828896992757739, 'min_impurity_decrease': 0.2702350530403411, 'max_features': 0.918584117877071, 'subsample': 0.15417203274736213, 'dropout_rate': 0.5844328260571405, 'ccp_alpha': 0.1010111412023281}. Best is trial 367 with value: 0.7817487788378487.[0m
[32m[I 2022-04-14 01:48:53,291][0m Trial 378 finished with value: 0.7802123250433449 and parameters: {'loss': 'coxph', 'learning_rate': 1.4156134901145265e-05, 'n_estimators': 986, 'criterion': 'friedman_mse', 'min_samples_split': 9, 'min_samples_leaf': 2, 'min_weight_fraction_leaf': 0.3660222949718586, 'min_impurity_decrease': 0.3021916915433569, 'max_features': 0.89428594675492, 'subsample': 0.10181190007172526, 'dropout_rate': 0.6096646413861122, 'ccp_alpha': 0.01360275698474521}. Best is trial 367 with value: 0.7817487788378487.[0m
[32m[I 2022-04-14 01:52:13,535][0m Trial 379 finished with value: 0.7797929608672497 and parameters: {'loss': 'coxph', 'learning_rate': 8.655425549977817e-06, 'n_estimators': 887, 'criterion': 'friedman_mse', 'min_samples_split': 9, 'min_samples_leaf': 2, 'min_weight_fraction_leaf': 0.3918380737367519, 'min_impurity_decrease': 0.28293461160527467, 'max_features': 0.8545129687206259, 'subsample': 0.11084381571820615, 'dropout_rate': 0.5794294947872073, 'ccp_alpha': 0.09974169951386941}. Best is trial 367 with value: 0.7817487788378487.[0m
[32m[I 2022-04-14 01:55:38,779][0m Trial 380 finished with value: 0.7784739567073633 and parameters: {'loss': 'coxph', 'learning_rate': 1.1361040698997746e-05, 'n_estimators': 914, 'criterion': 'friedman_mse', 'min_samples_split': 9, 'min_samples_leaf': 2, 'min_weight_fraction_leaf': 0.3812431203231561, 'min_impurity_decrease': 0.30387363464396444, 'max_features': 0.8888569840970989, 'subsample': 0.14214427571522276, 'dropout_rate': 0.5921082888090419, 'ccp_alpha': 0.09465057750046274}. Best is trial 367 with value: 0.7817487788378487.[0m
[32m[I 2022-04-14 01:59:13,522][0m Trial 381 finished with value: 0.6371812073302544 and parameters: {'loss': 'coxph', 'learning_rate': 6.660772470168512e-06, 'n_estimators': 934, 'criterion': 'friedman_mse', 'min_samples_split': 9, 'min_samples_leaf': 2, 'min_weight_fraction_leaf': 0.3675653299348505, 'min_impurity_decrease': 0.3096067558734874, 'max_features': 0.917914701861197, 'subsample': 0.09969024819786249, 'dropout_rate': 0.6181023787426438, 'ccp_alpha': 0.3078354501853311}. Best is trial 367 with value: 0.7817487788378487.[0m
[32m[I 2022-04-14 02:03:04,214][0m Trial 382 finished with value: 0.7807663294357879 and parameters: {'loss': 'coxph', 'learning_rate': 1.35088550998777e-05, 'n_estimators': 877, 'criterion': 'friedman_mse', 'min_samples_split': 9, 'min_samples_leaf': 2, 'min_weight_fraction_leaf': 0.3973449517195057, 'min_impurity_decrease': 0.3437385635275181, 'max_features': 0.8753414103946269, 'subsample': 0.12409775162943101, 'dropout_rate': 0.5743363620679357, 'ccp_alpha': 0.008619556412528156}. Best is trial 367 with value: 0.7817487788378487.[0m
[32m[I 2022-04-14 02:07:14,744][0m Trial 383 finished with value: 0.7788332237355858 and parameters: {'loss': 'coxph', 'learning_rate': 1.6592047227353345e-05, 'n_estimators': 992, 'criterion': 'friedman_mse', 'min_samples_split': 9, 'min_samples_leaf': 2, 'min_weight_fraction_leaf': 0.3992914580175219, 'min_impurity_decrease': 0.26662592821749015, 'max_features': 0.8602982724368121, 'subsample': 0.126097114194081, 'dropout_rate': 0.6023764339948752, 'ccp_alpha': 0.09364239085627002}. Best is trial 367 with value: 0.7817487788378487.[0m
[32m[I 2022-04-14 02:10:53,590][0m Trial 384 finished with value: 0.780207905946433 and parameters: {'loss': 'coxph', 'learning_rate': 1.371821573246445e-05, 'n_estimators': 887, 'criterion': 'friedman_mse', 'min_samples_split': 9, 'min_samples_leaf': 2, 'min_weight_fraction_leaf': 0.388849585891539, 'min_impurity_decrease': 0.3414241603706555, 'max_features': 0.8991392937582741, 'subsample': 0.14001135000735768, 'dropout_rate': 0.5792245917555471, 'ccp_alpha': 0.0012468538577434865}. Best is trial 367 with value: 0.7817487788378487.[0m
[32m[I 2022-04-14 02:14:52,771][0m Trial 385 finished with value: 0.7790949675990799 and parameters: {'loss': 'coxph', 'learning_rate': 9.746021953087422e-06, 'n_estimators': 940, 'criterion': 'friedman_mse', 'min_samples_split': 9, 'min_samples_leaf': 2, 'min_weight_fraction_leaf': 0.39854723772013717, 'min_impurity_decrease': 0.284388881111256, 'max_features': 0.8798470016496728, 'subsample': 0.0898865627807501, 'dropout_rate': 0.5783392579640244, 'ccp_alpha': 0.11933334195998327}. Best is trial 367 with value: 0.7817487788378487.[0m
[32m[I 2022-04-14 02:18:10,803][0m Trial 386 finished with value: 0.6371812073302544 and parameters: {'loss': 'coxph', 'learning_rate': 1.1531538860810475e-05, 'n_estimators': 893, 'criterion': 'friedman_mse', 'min_samples_split': 9, 'min_samples_leaf': 2, 'min_weight_fraction_leaf': 0.366951198888294, 'min_impurity_decrease': 0.3462484617912182, 'max_features': 0.8552048574524722, 'subsample': 0.11581044845069874, 'dropout_rate': 0.6015390466815809, 'ccp_alpha': 0.29667819106159743}. Best is trial 367 with value: 0.7817487788378487.[0m
[32m[I 2022-04-14 02:21:44,848][0m Trial 387 finished with value: 0.7807704630866691 and parameters: {'loss': 'coxph', 'learning_rate': 8.881329965825954e-06, 'n_estimators': 882, 'criterion': 'friedman_mse', 'min_samples_split': 9, 'min_samples_leaf': 2, 'min_weight_fraction_leaf': 0.3836243288469712, 'min_impurity_decrease': 0.3077825023323027, 'max_features': 0.9272508556626766, 'subsample': 0.07222899134662547, 'dropout_rate': 0.5512887350133018, 'ccp_alpha': 0.002940551920314491}. Best is trial 367 with value: 0.7817487788378487.[0m
[32m[I 2022-04-14 02:25:48,353][0m Trial 388 finished with value: 0.780852430330049 and parameters: {'loss': 'coxph', 'learning_rate': 7.086454968868253e-06, 'n_estimators': 937, 'criterion': 'friedman_mse', 'min_samples_split': 9, 'min_samples_leaf': 2, 'min_weight_fraction_leaf': 0.36563933749645694, 'min_impurity_decrease': 0.3084677728180235, 'max_features': 0.92995503921772, 'subsample': 0.07366611446070255, 'dropout_rate': 0.5509845817032011, 'ccp_alpha': 0.0011906516761891594}. Best is trial 367 with value: 0.7817487788378487.[0m
[32m[I 2022-04-14 02:28:48,757][0m Trial 389 finished with value: -0.3687127476875315 and parameters: {'loss': 'squared', 'learning_rate': 6.361523811274842e-06, 'n_estimators': 947, 'criterion': 'friedman_mse', 'min_samples_split': 9, 'min_samples_leaf': 2, 'min_weight_fraction_leaf': 0.364082751567849, 'min_impurity_decrease': 0.2525645739748196, 'max_features': 0.9331909468911126, 'subsample': 0.07539082288953024, 'dropout_rate': 0.5528168489937896, 'ccp_alpha': 0.13984557952669857}. Best is trial 367 with value: 0.7817487788378487.[0m
[32m[I 2022-04-14 02:32:40,795][0m Trial 390 finished with value: 0.25 and parameters: {'loss': 'coxph', 'learning_rate': 1.3547658145632629e-05, 'n_estimators': 925, 'criterion': 'friedman_mse', 'min_samples_split': 9, 'min_samples_leaf': 2, 'min_weight_fraction_leaf': 0.394846971954515, 'min_impurity_decrease': 0.3082883560237, 'max_features': 0.9215548019325829, 'subsample': 0.15241983313248286, 'dropout_rate': 0.5525899680444458, 'ccp_alpha': 0.445599810403229}. Best is trial 367 with value: 0.7817487788378487.[0m
[32m[I 2022-04-14 02:36:56,946][0m Trial 391 finished with value: 0.7803584992106943 and parameters: {'loss': 'coxph', 'learning_rate': 8.697605666767463e-06, 'n_estimators': 999, 'criterion': 'friedman_mse', 'min_samples_split': 9, 'min_samples_leaf': 2, 'min_weight_fraction_leaf': 0.3641310578937149, 'min_impurity_decrease': 0.2859431992884646, 'max_features': 0.9064469815449085, 'subsample': 0.07577304539820062, 'dropout_rate': 0.5755839634114049, 'ccp_alpha': 0.10974655775668885}. Best is trial 367 with value: 0.7817487788378487.[0m
[32m[I 2022-04-14 02:40:11,976][0m Trial 392 finished with value: 0.5203899749418202 and parameters: {'loss': 'coxph', 'learning_rate': 6.408596587302309e-06, 'n_estimators': 879, 'criterion': 'friedman_mse', 'min_samples_split': 9, 'min_samples_leaf': 2, 'min_weight_fraction_leaf': 0.3809406034179265, 'min_impurity_decrease': 0.3417831342355767, 'max_features': 0.9014824463501467, 'subsample': 0.1279956380074861, 'dropout_rate': 0.6200920211963126, 'ccp_alpha': 0.2935550449096539}. Best is trial 367 with value: 0.7817487788378487.[0m
[32m[I 2022-04-14 02:44:09,562][0m Trial 393 finished with value: 0.7807388462918731 and parameters: {'loss': 'coxph', 'learning_rate': 1.0598367783186722e-05, 'n_estimators': 950, 'criterion': 'friedman_mse', 'min_samples_split': 9, 'min_samples_leaf': 2, 'min_weight_fraction_leaf': 0.4026584470827418, 'min_impurity_decrease': 0.30949753260396057, 'max_features': 0.9242172768502017, 'subsample': 0.07389355861037389, 'dropout_rate': 0.549451036013203, 'ccp_alpha': 0.11953535798010868}. Best is trial 367 with value: 0.7817487788378487.[0m
[32m[I 2022-04-14 02:47:47,726][0m Trial 394 finished with value: 0.7804592875263882 and parameters: {'loss': 'coxph', 'learning_rate': 1.813014502169172e-05, 'n_estimators': 904, 'criterion': 'friedman_mse', 'min_samples_split': 9, 'min_samples_leaf': 2, 'min_weight_fraction_leaf': 0.37128286190555293, 'min_impurity_decrease': 0.2837153939247813, 'max_features': 0.9371725321651602, 'subsample': 0.09573805887148495, 'dropout_rate': 0.5733588448405424, 'ccp_alpha': 0.006402294960942853}. Best is trial 367 with value: 0.7817487788378487.[0m
[32m[I 2022-04-14 02:51:13,378][0m Trial 395 finished with value: 0.775673564992021 and parameters: {'loss': 'coxph', 'learning_rate': 8.407268063843717e-06, 'n_estimators': 874, 'criterion': 'friedman_mse', 'min_samples_split': 9, 'min_samples_leaf': 2, 'min_weight_fraction_leaf': 0.3904748292869129, 'min_impurity_decrease': 0.2654632878594714, 'max_features': 0.8513963496942205, 'subsample': 0.12529340762606841, 'dropout_rate': 0.5969004659112054, 'ccp_alpha': 0.12921186461085904}. Best is trial 367 with value: 0.7817487788378487.[0m
[32m[I 2022-04-14 02:55:04,426][0m Trial 396 finished with value: 0.6371812073302544 and parameters: {'loss': 'coxph', 'learning_rate': 1.305976369419698e-05, 'n_estimators': 919, 'criterion': 'friedman_mse', 'min_samples_split': 9, 'min_samples_leaf': 2, 'min_weight_fraction_leaf': 0.36180816654768055, 'min_impurity_decrease': 0.3131061657313179, 'max_features': 0.8962327207884446, 'subsample': 0.0947825101978166, 'dropout_rate': 0.5484612784963098, 'ccp_alpha': 0.2905827145900761}. Best is trial 367 with value: 0.7817487788378487.[0m
[32m[I 2022-04-14 02:58:14,603][0m Trial 397 finished with value: 0.7799041933995129 and parameters: {'loss': 'coxph', 'learning_rate': 6.4716213290633816e-06, 'n_estimators': 867, 'criterion': 'friedman_mse', 'min_samples_split': 9, 'min_samples_leaf': 2, 'min_weight_fraction_leaf': 0.37707046387843157, 'min_impurity_decrease': 0.3389778054199232, 'max_features': 0.8816279359911542, 'subsample': 0.15719764734994707, 'dropout_rate': 0.6001054607770467, 'ccp_alpha': 0.006138496084722098}. Best is trial 367 with value: 0.7817487788378487.[0m
[32m[I 2022-04-14 03:02:11,348][0m Trial 398 finished with value: 0.780613594561385 and parameters: {'loss': 'coxph', 'learning_rate': 8.332701220305989e-06, 'n_estimators': 961, 'criterion': 'friedman_mse', 'min_samples_split': 9, 'min_samples_leaf': 2, 'min_weight_fraction_leaf': 0.38435772708770705, 'min_impurity_decrease': 0.29429540760968464, 'max_features': 0.9115181591118519, 'subsample': 0.07568381956518855, 'dropout_rate': 0.5713987983587248, 'ccp_alpha': 0.11680838561470828}. Best is trial 367 with value: 0.7817487788378487.[0m
[32m[I 2022-04-14 03:05:38,096][0m Trial 399 finished with value: 0.7812703415924904 and parameters: {'loss': 'coxph', 'learning_rate': 1.0904505787680411e-05, 'n_estimators': 860, 'criterion': 'friedman_mse', 'min_samples_split': 9, 'min_samples_leaf': 2, 'min_weight_fraction_leaf': 0.3727506564646241, 'min_impurity_decrease': 0.34496108194587616, 'max_features': 0.8639237216320783, 'subsample': 0.11558318446295442, 'dropout_rate': 0.5479753420177739, 'ccp_alpha': 0.002316608604868148}. Best is trial 367 with value: 0.7817487788378487.[0m
[32m[I 2022-04-14 03:09:14,690][0m Trial 400 finished with value: 0.7766586595495177 and parameters: {'loss': 'coxph', 'learning_rate': 1.5720885901802836e-05, 'n_estimators': 913, 'criterion': 'friedman_mse', 'min_samples_split': 9, 'min_samples_leaf': 2, 'min_weight_fraction_leaf': 0.39685466228110167, 'min_impurity_decrease': 0.26343973383842545, 'max_features': 0.9432849021120472, 'subsample': 0.14168198951759936, 'dropout_rate': 0.5495955064667968, 'ccp_alpha': 0.12288295423462539}. Best is trial 367 with value: 0.7817487788378487.[0m
[32m[I 2022-04-14 03:12:24,604][0m Trial 401 finished with value: 0.6371812073302544 and parameters: {'loss': 'coxph', 'learning_rate': 1.1046054844041594e-05, 'n_estimators': 855, 'criterion': 'friedman_mse', 'min_samples_split': 9, 'min_samples_leaf': 2, 'min_weight_fraction_leaf': 0.36482358404395865, 'min_impurity_decrease': 0.34830218111614875, 'max_features': 0.847680143748813, 'subsample': 0.11827750360853398, 'dropout_rate': 0.6170670692215442, 'ccp_alpha': 0.27789286977750305}. Best is trial 367 with value: 0.7817487788378487.[0m
[32m[I 2022-04-14 03:16:37,989][0m Trial 402 finished with value: 0.7808143276048407 and parameters: {'loss': 'coxph', 'learning_rate': 1.070018232642327e-05, 'n_estimators': 945, 'criterion': 'friedman_mse', 'min_samples_split': 9, 'min_samples_leaf': 2, 'min_weight_fraction_leaf': 0.385345951232672, 'min_impurity_decrease': 0.310533352375785, 'max_features': 0.8941684785490475, 'subsample': 0.07208833356801692, 'dropout_rate': 0.5860221331643198, 'ccp_alpha': 0.1337148710198232}. Best is trial 367 with value: 0.7817487788378487.[0m
[32m[I 2022-04-14 03:20:58,371][0m Trial 403 finished with value: 0.7805017064575894 and parameters: {'loss': 'coxph', 'learning_rate': 1.222190836478578e-05, 'n_estimators': 968, 'criterion': 'friedman_mse', 'min_samples_split': 9, 'min_samples_leaf': 2, 'min_weight_fraction_leaf': 0.40593670881297345, 'min_impurity_decrease': 0.28796395841003447, 'max_features': 0.8961410063221483, 'subsample': 0.07081774809093627, 'dropout_rate': 0.5951279453728464, 'ccp_alpha': 0.1407330939002317}. Best is trial 367 with value: 0.7817487788378487.[0m
[32m[I 2022-04-14 03:25:11,653][0m Trial 404 finished with value: 0.25 and parameters: {'loss': 'coxph', 'learning_rate': 1.006440507134764e-05, 'n_estimators': 947, 'criterion': 'friedman_mse', 'min_samples_split': 9, 'min_samples_leaf': 2, 'min_weight_fraction_leaf': 0.39000708457887695, 'min_impurity_decrease': 0.30855443976591446, 'max_features': 0.9156989657213895, 'subsample': 0.13481409070721817, 'dropout_rate': 0.5826549471958734, 'ccp_alpha': 0.3776278630818439}. Best is trial 367 with value: 0.7817487788378487.[0m
[32m[I 2022-04-14 03:29:00,943][0m Trial 405 finished with value: 0.6371812073302544 and parameters: {'loss': 'coxph', 'learning_rate': 1.6908728855939068e-05, 'n_estimators': 917, 'criterion': 'friedman_mse', 'min_samples_split': 9, 'min_samples_leaf': 2, 'min_weight_fraction_leaf': 0.3852865944567331, 'min_impurity_decrease': 0.30762854817731466, 'max_features': 0.8829032495145767, 'subsample': 0.11340938289471311, 'dropout_rate': 0.6237875998766647, 'ccp_alpha': 0.25768227982725833}. Best is trial 367 with value: 0.7817487788378487.[0m
[32m[I 2022-04-14 03:33:35,639][0m Trial 406 finished with value: 0.7803558080757618 and parameters: {'loss': 'coxph', 'learning_rate': 1.4604453588842082e-05, 'n_estimators': 992, 'criterion': 'friedman_mse', 'min_samples_split': 9, 'min_samples_leaf': 2, 'min_weight_fraction_leaf': 0.3605643856151051, 'min_impurity_decrease': 0.2427022095992019, 'max_features': 0.9278610987242992, 'subsample': 0.06885064213675643, 'dropout_rate': 0.5459298120782065, 'ccp_alpha': 0.11568331344017024}. Best is trial 367 with value: 0.7817487788378487.[0m
[32m[I 2022-04-14 03:37:13,049][0m Trial 407 finished with value: 0.778775774938639 and parameters: {'loss': 'coxph', 'learning_rate': 9.314888609406819e-06, 'n_estimators': 908, 'criterion': 'friedman_mse', 'min_samples_split': 9, 'min_samples_leaf': 2, 'min_weight_fraction_leaf': 0.37007275182263655, 'min_impurity_decrease': 0.34478162346051744, 'max_features': 0.8870254292349752, 'subsample': 0.10258826156443646, 'dropout_rate': 0.5738818224792079, 'ccp_alpha': 0.1173779332410012}. Best is trial 367 with value: 0.7817487788378487.[0m
[32m[I 2022-04-14 03:40:14,887][0m Trial 408 finished with value: 0.6371812073302544 and parameters: {'loss': 'coxph', 'learning_rate': 1.1437773546948538e-05, 'n_estimators': 860, 'criterion': 'friedman_mse', 'min_samples_split': 9, 'min_samples_leaf': 2, 'min_weight_fraction_leaf': 0.39556389870398384, 'min_impurity_decrease': 0.2765385886166373, 'max_features': 0.9057634798210368, 'subsample': 0.15687132258186506, 'dropout_rate': 0.6000445495322939, 'ccp_alpha': 0.26231034165448097}. Best is trial 367 with value: 0.7817487788378487.[0m
[32m[I 2022-04-14 03:42:54,051][0m Trial 409 finished with value: -0.36728804158649886 and parameters: {'loss': 'squared', 'learning_rate': 6.127622533971983e-06, 'n_estimators': 945, 'criterion': 'friedman_mse', 'min_samples_split': 9, 'min_samples_leaf': 2, 'min_weight_fraction_leaf': 0.38048186871670314, 'min_impurity_decrease': 0.2920535876717682, 'max_features': 0.8546266302098412, 'subsample': 0.09167953959125817, 'dropout_rate': 0.5442318579967587, 'ccp_alpha': 0.009995105041937733}. Best is trial 367 with value: 0.7817487788378487.[0m
