[32m[I 2022-04-17 03:21:11,690][0m Trial 967 finished with value: 0.7796322650439065 and parameters: {'n_hidden': 1024, 'mixture_components': 8, 'use_sparse_layer': False, 'use_batchnorm': False, 'use_dropout': True, 'dropout': 0.5825122599120225, 'mlp_size_1': 2, 'mlp_size_2': 4, 'mlp_size_3': 1, 'kernel': 'LogLogistic', 'loss_name': 'AlternativeNLLLoss'}. Best is trial 885 with value: 0.8901518638077398.[0m
[32m[I 2022-04-17 03:23:10,481][0m Trial 968 finished with value: 0.885947932017028 and parameters: {'n_hidden': 1024, 'mixture_components': 8, 'use_sparse_layer': False, 'use_batchnorm': False, 'use_dropout': True, 'dropout': 0.6096629385893774, 'mlp_size_1': 2, 'mlp_size_2': 4, 'mlp_size_3': 1, 'kernel': 'Gamma', 'loss_name': 'AlternativeNLLLoss'}. Best is trial 885 with value: 0.8901518638077398.[0m
[32m[I 2022-04-17 03:25:14,608][0m Trial 969 finished with value: 0.6842568225203228 and parameters: {'n_hidden': 256, 'mixture_components': 8, 'use_sparse_layer': False, 'use_batchnorm': False, 'use_dropout': True, 'dropout': 0.66900372997869, 'mlp_size_1': 2, 'mlp_size_2': 3, 'mlp_size_3': 0, 'kernel': 'Exponential', 'loss_name': 'AlternativeNLLLoss'}. Best is trial 885 with value: 0.8901518638077398.[0m
[32m[I 2022-04-17 03:27:25,664][0m Trial 970 finished with value: 0.8858380948611282 and parameters: {'n_hidden': 1024, 'mixture_components': 8, 'use_sparse_layer': False, 'use_batchnorm': False, 'use_dropout': True, 'dropout': 0.5995328105644155, 'mlp_size_1': 2, 'mlp_size_2': 4, 'mlp_size_3': 1, 'kernel': 'Gamma', 'loss_name': 'AlternativeNLLLoss'}. Best is trial 885 with value: 0.8901518638077398.[0m
[32m[I 2022-04-17 03:29:35,281][0m Trial 971 finished with value: 0.882363105671268 and parameters: {'n_hidden': 128, 'mixture_components': 8, 'use_sparse_layer': False, 'use_batchnorm': False, 'use_dropout': True, 'dropout': 0.6263014673729331, 'mlp_size_1': 2, 'mlp_size_2': 2, 'mlp_size_3': 0, 'kernel': 'Gamma', 'loss_name': 'AlternativeNLLLoss'}. Best is trial 885 with value: 0.8901518638077398.[0m
[32m[I 2022-04-17 03:31:49,768][0m Trial 972 finished with value: 0.8856042451303582 and parameters: {'n_hidden': 1024, 'mixture_components': 8, 'use_sparse_layer': False, 'use_batchnorm': False, 'use_dropout': True, 'dropout': 0.6824230277075888, 'mlp_size_1': 2, 'mlp_size_2': 4, 'mlp_size_3': 1, 'kernel': 'Gamma', 'loss_name': 'AlternativeNLLLoss'}. Best is trial 885 with value: 0.8901518638077398.[0m
[32m[I 2022-04-17 03:34:03,423][0m Trial 973 finished with value: 0.8860276365629003 and parameters: {'n_hidden': 1024, 'mixture_components': 8, 'use_sparse_layer': False, 'use_batchnorm': False, 'use_dropout': True, 'dropout': 0.6519228468322642, 'mlp_size_1': 2, 'mlp_size_2': 4, 'mlp_size_3': 1, 'kernel': 'Gamma', 'loss_name': 'AlternativeNLLLoss'}. Best is trial 885 with value: 0.8901518638077398.[0m
[32m[I 2022-04-17 03:36:11,478][0m Trial 974 finished with value: 0.8855719673942986 and parameters: {'n_hidden': 1024, 'mixture_components': 2, 'use_sparse_layer': False, 'use_batchnorm': False, 'use_dropout': True, 'dropout': 0.5818617804762897, 'mlp_size_1': 5, 'mlp_size_2': 2, 'mlp_size_3': 0, 'kernel': 'Gamma', 'loss_name': 'AlternativeNLLLoss'}. Best is trial 885 with value: 0.8901518638077398.[0m
[32m[I 2022-04-17 03:38:02,372][0m Trial 975 finished with value: 0.8815269906142638 and parameters: {'n_hidden': 1024, 'mixture_components': 8, 'use_sparse_layer': False, 'use_batchnorm': False, 'use_dropout': False, 'mlp_size_1': 4, 'mlp_size_2': 3, 'mlp_size_3': 0, 'kernel': 'Gamma', 'loss_name': 'AlternativeNLLLoss'}. Best is trial 885 with value: 0.8901518638077398.[0m
[32m[I 2022-04-17 03:40:03,884][0m Trial 976 finished with value: 0.5552955107915274 and parameters: {'n_hidden': 64, 'mixture_components': 8, 'use_sparse_layer': False, 'use_batchnorm': True, 'use_dropout': True, 'dropout': 0.7048048267065149, 'mlp_size_1': 2, 'mlp_size_2': 1, 'mlp_size_3': 0, 'kernel': 'Gamma', 'loss_name': 'AlternativeNLLLoss'}. Best is trial 885 with value: 0.8901518638077398.[0m
[32m[I 2022-04-17 03:42:48,405][0m Trial 977 finished with value: 0.8849421834236312 and parameters: {'n_hidden': 2048, 'mixture_components': 8, 'use_sparse_layer': False, 'use_batchnorm': False, 'use_dropout': True, 'dropout': 0.7254526542292961, 'mlp_size_1': 3, 'mlp_size_2': 4, 'mlp_size_3': 1, 'kernel': 'Gamma', 'loss_name': 'AlternativeNLLLoss'}. Best is trial 885 with value: 0.8901518638077398.[0m
[32m[I 2022-04-17 03:44:54,447][0m Trial 978 finished with value: 0.884690536026131 and parameters: {'n_hidden': 1024, 'mixture_components': 8, 'use_sparse_layer': False, 'use_batchnorm': False, 'use_dropout': True, 'dropout': 0.6235612227872189, 'mlp_size_1': 2, 'mlp_size_2': 4, 'mlp_size_3': 1, 'kernel': 'Gamma', 'loss_name': 'AlternativeNLLLoss'}. Best is trial 885 with value: 0.8901518638077398.[0m
[32m[I 2022-04-17 03:46:49,789][0m Trial 979 finished with value: 0.8849620370138584 and parameters: {'n_hidden': 256, 'mixture_components': 8, 'use_sparse_layer': False, 'use_batchnorm': False, 'use_dropout': True, 'dropout': 0.6620545815608524, 'mlp_size_1': 2, 'mlp_size_2': 3, 'mlp_size_3': 0, 'kernel': 'Gamma', 'loss_name': 'AlternativeNLLLoss'}. Best is trial 885 with value: 0.8901518638077398.[0m
[32m[I 2022-04-17 03:48:49,466][0m Trial 980 finished with value: 0.8843026670831936 and parameters: {'n_hidden': 1024, 'mixture_components': 8, 'use_sparse_layer': False, 'use_batchnorm': False, 'use_dropout': True, 'dropout': 0.68895634914106, 'mlp_size_1': 2, 'mlp_size_2': 4, 'mlp_size_3': 1, 'kernel': 'Gamma', 'loss_name': 'AlternativeNLLLoss'}. Best is trial 885 with value: 0.8901518638077398.[0m
[32m[I 2022-04-17 03:50:33,417][0m Trial 981 finished with value: 0.5443682170833226 and parameters: {'n_hidden': 1024, 'mixture_components': 8, 'use_sparse_layer': False, 'use_batchnorm': False, 'use_dropout': True, 'dropout': 0.6395598545235086, 'mlp_size_1': 2, 'mlp_size_2': 4, 'mlp_size_3': 1, 'kernel': 'Gumbel', 'loss_name': 'AlternativeNLLLoss'}. Best is trial 885 with value: 0.8901518638077398.[0m
[32m[I 2022-04-17 03:52:22,843][0m Trial 982 finished with value: 0.5571116929040502 and parameters: {'n_hidden': 512, 'mixture_components': 7, 'use_sparse_layer': False, 'use_batchnorm': False, 'use_dropout': True, 'dropout': 0.6027079387954113, 'mlp_size_1': 2, 'mlp_size_2': 4, 'mlp_size_3': 0, 'kernel': 'Gamma', 'loss_name': 'NLLLoss'}. Best is trial 885 with value: 0.8901518638077398.[0m
[32m[I 2022-04-17 03:54:33,105][0m Trial 983 finished with value: 0.8836587397415693 and parameters: {'n_hidden': 1024, 'mixture_components': 8, 'use_sparse_layer': False, 'use_batchnorm': False, 'use_dropout': True, 'dropout': 0.712949416791716, 'mlp_size_1': 2, 'mlp_size_2': 4, 'mlp_size_3': 1, 'kernel': 'Gamma', 'loss_name': 'AlternativeNLLLoss'}. Best is trial 885 with value: 0.8901518638077398.[0m
[32m[I 2022-04-17 03:56:34,346][0m Trial 984 finished with value: 0.885603703140651 and parameters: {'n_hidden': 1024, 'mixture_components': 6, 'use_sparse_layer': False, 'use_batchnorm': False, 'use_dropout': True, 'dropout': 0.5795439985559828, 'mlp_size_1': 4, 'mlp_size_2': 3, 'mlp_size_3': 0, 'kernel': 'Gamma', 'loss_name': 'AlternativeNLLLoss'}. Best is trial 885 with value: 0.8901518638077398.[0m
/media/san2_ssd/data/Workdir/survival/utils.py:305: RuntimeWarning: invalid value encountered in true_divide
  pdfs = np.gradient(1-survs,axis=1)/norms
[32m[I 2022-04-17 03:59:10,347][0m Trial 985 finished with value: 0.7789158072514095 and parameters: {'n_hidden': 1024, 'mixture_components': 8, 'use_sparse_layer': False, 'use_batchnorm': False, 'use_dropout': True, 'dropout': 0.6703644541118836, 'mlp_size_1': 3, 'mlp_size_2': 4, 'mlp_size_3': 0, 'kernel': 'Normal', 'loss_name': 'AlternativeNLLLoss'}. Best is trial 885 with value: 0.8901518638077398.[0m
[32m[I 2022-04-17 04:00:53,065][0m Trial 986 finished with value: 0.8846440291488227 and parameters: {'n_hidden': 256, 'mixture_components': 5, 'use_sparse_layer': False, 'use_batchnorm': False, 'use_dropout': True, 'dropout': 0.6185143774633776, 'mlp_size_1': 2, 'mlp_size_2': 3, 'mlp_size_3': 0, 'kernel': 'Gamma', 'loss_name': 'AlternativeNLLLoss'}. Best is trial 885 with value: 0.8901518638077398.[0m
[32m[I 2022-04-17 04:03:31,780][0m Trial 987 finished with value: 0.775391897434854 and parameters: {'n_hidden': 1024, 'mixture_components': 7, 'use_sparse_layer': False, 'use_batchnorm': False, 'use_dropout': True, 'dropout': 0.6530835974838555, 'mlp_size_1': 2, 'mlp_size_2': 4, 'mlp_size_3': 1, 'kernel': 'Logistic', 'loss_name': 'AlternativeNLLLoss'}. Best is trial 885 with value: 0.8901518638077398.[0m
[32m[I 2022-04-17 04:05:42,916][0m Trial 988 finished with value: 0.8848393998375583 and parameters: {'n_hidden': 1024, 'mixture_components': 8, 'use_sparse_layer': False, 'use_batchnorm': False, 'use_dropout': True, 'dropout': 0.6815399864223223, 'mlp_size_1': 2, 'mlp_size_2': 4, 'mlp_size_3': 1, 'kernel': 'Gamma', 'loss_name': 'AlternativeNLLLoss'}. Best is trial 885 with value: 0.8901518638077398.[0m
[32m[I 2022-04-17 04:07:57,482][0m Trial 989 finished with value: 0.8850398650052105 and parameters: {'n_hidden': 1024, 'mixture_components': 7, 'use_sparse_layer': False, 'use_batchnorm': False, 'use_dropout': True, 'dropout': 0.5980218237544075, 'mlp_size_1': 2, 'mlp_size_2': 4, 'mlp_size_3': 1, 'kernel': 'Gamma', 'loss_name': 'AlternativeNLLLoss'}. Best is trial 885 with value: 0.8901518638077398.[0m
[32m[I 2022-04-17 04:10:39,493][0m Trial 990 finished with value: 0.879836867622644 and parameters: {'n_hidden': 1024, 'mixture_components': 8, 'use_sparse_layer': False, 'use_batchnorm': False, 'use_dropout': True, 'dropout': 0.6386263530855208, 'mlp_size_1': 2, 'mlp_size_2': 5, 'mlp_size_3': 0, 'kernel': 'LogNormal', 'loss_name': 'AlternativeNLLLoss'}. Best is trial 885 with value: 0.8901518638077398.[0m
[32m[I 2022-04-17 04:13:36,856][0m Trial 991 finished with value: 0.880284829848132 and parameters: {'n_hidden': 32, 'mixture_components': 8, 'use_sparse_layer': False, 'use_batchnorm': False, 'use_dropout': True, 'dropout': 0.7072672855836455, 'mlp_size_1': 2, 'mlp_size_2': 0, 'mlp_size_3': 0, 'kernel': 'Gamma', 'loss_name': 'AlternativeNLLLoss'}. Best is trial 885 with value: 0.8901518638077398.[0m
[32m[I 2022-04-17 04:15:50,083][0m Trial 992 finished with value: 0.8866666784081477 and parameters: {'n_hidden': 1024, 'mixture_components': 7, 'use_sparse_layer': False, 'use_batchnorm': False, 'use_dropout': True, 'dropout': 0.6236172455679762, 'mlp_size_1': 2, 'mlp_size_2': 4, 'mlp_size_3': 1, 'kernel': 'Gamma', 'loss_name': 'AlternativeNLLLoss'}. Best is trial 885 with value: 0.8901518638077398.[0m
[32m[I 2022-04-17 04:17:53,858][0m Trial 993 finished with value: 0.8868956953574927 and parameters: {'n_hidden': 256, 'mixture_components': 8, 'use_sparse_layer': False, 'use_batchnorm': False, 'use_dropout': True, 'dropout': 0.7253587940682409, 'mlp_size_1': 2, 'mlp_size_2': 3, 'mlp_size_3': 0, 'kernel': 'Gamma', 'loss_name': 'AlternativeNLLLoss'}. Best is trial 885 with value: 0.8901518638077398.[0m
[32m[I 2022-04-17 04:20:37,226][0m Trial 994 finished with value: 0.8729436307783203 and parameters: {'n_hidden': 1024, 'mixture_components': 8, 'use_sparse_layer': False, 'use_batchnorm': True, 'use_dropout': False, 'mlp_size_1': 4, 'mlp_size_2': 3, 'mlp_size_3': 0, 'kernel': 'Exponential', 'loss_name': 'AlternativeNLLLoss'}. Best is trial 885 with value: 0.8901518638077398.[0m
[32m[I 2022-04-17 04:22:47,790][0m Trial 995 finished with value: 0.8861514155325635 and parameters: {'n_hidden': 1024, 'mixture_components': 7, 'use_sparse_layer': False, 'use_batchnorm': False, 'use_dropout': True, 'dropout': 0.581452503860046, 'mlp_size_1': 2, 'mlp_size_2': 4, 'mlp_size_3': 1, 'kernel': 'Gamma', 'loss_name': 'AlternativeNLLLoss'}. Best is trial 885 with value: 0.8901518638077398.[0m
[32m[I 2022-04-17 04:25:00,706][0m Trial 996 finished with value: 0.8867449382758329 and parameters: {'n_hidden': 1024, 'mixture_components': 6, 'use_sparse_layer': False, 'use_batchnorm': False, 'use_dropout': True, 'dropout': 0.6572231149304287, 'mlp_size_1': 2, 'mlp_size_2': 4, 'mlp_size_3': 1, 'kernel': 'Gamma', 'loss_name': 'AlternativeNLLLoss'}. Best is trial 885 with value: 0.8901518638077398.[0m
[32m[I 2022-04-17 04:27:47,057][0m Trial 997 finished with value: 0.7683593170651681 and parameters: {'n_hidden': 1024, 'mixture_components': 8, 'use_sparse_layer': False, 'use_batchnorm': False, 'use_dropout': True, 'dropout': 0.6863607237504726, 'mlp_size_1': 2, 'mlp_size_2': 4, 'mlp_size_3': 1, 'kernel': 'LogLogistic', 'loss_name': 'AlternativeNLLLoss'}. Best is trial 885 with value: 0.8901518638077398.[0m
[32m[I 2022-04-17 04:29:41,899][0m Trial 998 finished with value: 0.8863144741295924 and parameters: {'n_hidden': 512, 'mixture_components': 8, 'use_sparse_layer': False, 'use_batchnorm': False, 'use_dropout': True, 'dropout': 0.6071386865262859, 'mlp_size_1': 2, 'mlp_size_2': 4, 'mlp_size_3': 0, 'kernel': 'Gamma', 'loss_name': 'AlternativeNLLLoss'}. Best is trial 885 with value: 0.8901518638077398.[0m
[32m[I 2022-04-17 04:32:13,833][0m Trial 999 finished with value: 0.8825358056760482 and parameters: {'n_hidden': 128, 'mixture_components': 7, 'use_sparse_layer': False, 'use_batchnorm': False, 'use_dropout': True, 'dropout': 0.6407045023472951, 'mlp_size_1': 2, 'mlp_size_2': 2, 'mlp_size_3': 0, 'kernel': 'Gamma', 'loss_name': 'AlternativeNLLLoss'}. Best is trial 885 with value: 0.8901518638077398.[0m
[32m[I 2022-04-17 04:32:13,851][0m A new study created in memory with name: no-name-81e3654d-74a4-4631-9723-b37f218bfea4[0m
[32m[I 2022-04-17 04:35:26,423][0m Trial 0 finished with value: -0.6646563485500199 and parameters: {'n_hidden': 2048, 'mixture_components': 4, 'use_sparse_layer': True, 'use_sparse_loss': False, 'use_batchnorm': True, 'use_dropout': False, 'mlp_size_1': 0, 'mlp_size_2': 6, 'mlp_size_3': 1, 'kernel': 'Gamma', 'loss_name': 'AlternativeNLLLoss'}. Best is trial 0 with value: -0.6646563485500199.[0m
[32m[I 2022-04-17 04:36:50,346][0m Trial 1 finished with value: 0.24537257979088806 and parameters: {'n_hidden': 32, 'mixture_components': 7, 'use_sparse_layer': False, 'use_batchnorm': False, 'use_dropout': True, 'dropout': 0.4056150802119287, 'mlp_size_1': 1, 'mlp_size_2': 1, 'mlp_size_3': 0, 'kernel': 'Gumbel', 'loss_name': 'CensoredNLLLoss'}. Best is trial 1 with value: 0.24537257979088806.[0m
[32m[I 2022-04-17 04:39:14,214][0m Trial 2 finished with value: 0.7532007967269863 and parameters: {'n_hidden': 1024, 'mixture_components': 3, 'use_sparse_layer': False, 'use_batchnorm': False, 'use_dropout': False, 'mlp_size_1': 7, 'mlp_size_2': 0, 'mlp_size_3': 0, 'kernel': 'Normal', 'loss_name': 'CensoredNLLLoss'}. Best is trial 2 with value: 0.7532007967269863.[0m
[32m[I 2022-04-17 04:41:01,761][0m Trial 3 finished with value: 0.7395068349294913 and parameters: {'n_hidden': 64, 'mixture_components': 4, 'use_sparse_layer': False, 'use_batchnorm': False, 'use_dropout': False, 'mlp_size_1': 0, 'mlp_size_2': 2, 'mlp_size_3': 0, 'kernel': 'Weibull', 'loss_name': 'CensoredNLLLoss'}. Best is trial 2 with value: 0.7532007967269863.[0m
[32m[I 2022-04-17 04:43:08,702][0m Trial 4 finished with value: 0.7265171103479562 and parameters: {'n_hidden': 32, 'mixture_components': 3, 'use_sparse_layer': True, 'use_sparse_loss': True, 'lmbd': 0.0010038552858699541, 'use_batchnorm': False, 'use_dropout': False, 'mlp_size_1': 0, 'mlp_size_2': 0, 'mlp_size_3': 0, 'kernel': 'LogLogistic', 'loss_name': 'CensoredNLLLoss'}. Best is trial 2 with value: 0.7532007967269863.[0m
[32m[I 2022-04-17 04:46:07,449][0m Trial 5 finished with value: 0.7387257184365686 and parameters: {'n_hidden': 32, 'mixture_components': 6, 'use_sparse_layer': True, 'use_sparse_loss': True, 'lmbd': 3.0047438933405e-06, 'use_batchnorm': False, 'use_dropout': False, 'mlp_size_1': 1, 'mlp_size_2': 0, 'mlp_size_3': 1, 'kernel': 'Normal', 'loss_name': 'AlternativeNLLLoss'}. Best is trial 2 with value: 0.7532007967269863.[0m
[32m[I 2022-04-17 04:50:34,013][0m Trial 6 finished with value: 0.691611930050631 and parameters: {'n_hidden': 32, 'mixture_components': 3, 'use_sparse_layer': False, 'use_batchnorm': False, 'use_dropout': True, 'dropout': 0.8768217571439116, 'mlp_size_1': 2, 'mlp_size_2': 0, 'mlp_size_3': 0, 'kernel': 'LogNormal', 'loss_name': 'CensoredNLLLoss'}. Best is trial 2 with value: 0.7532007967269863.[0m
[32m[I 2022-04-17 04:54:00,794][0m Trial 7 finished with value: 0.6831368968867529 and parameters: {'n_hidden': 2048, 'mixture_components': 8, 'use_sparse_layer': True, 'use_sparse_loss': False, 'use_batchnorm': True, 'use_dropout': True, 'dropout': 0.7397830518907029, 'mlp_size_1': 3, 'mlp_size_2': 2, 'mlp_size_3': 0, 'kernel': 'LogLogistic', 'loss_name': 'CensoredNLLLoss'}. Best is trial 2 with value: 0.7532007967269863.[0m
[32m[I 2022-04-17 04:56:51,348][0m Trial 8 finished with value: 0.761225552106498 and parameters: {'n_hidden': 2048, 'mixture_components': 6, 'use_sparse_layer': True, 'use_sparse_loss': False, 'use_batchnorm': False, 'use_dropout': False, 'mlp_size_1': 7, 'mlp_size_2': 1, 'mlp_size_3': 0, 'kernel': 'Normal', 'loss_name': 'AlternativeNLLLoss'}. Best is trial 8 with value: 0.761225552106498.[0m
[32m[I 2022-04-17 04:59:49,015][0m Trial 9 finished with value: 0.6897840404937389 and parameters: {'n_hidden': 2048, 'mixture_components': 6, 'use_sparse_layer': True, 'use_sparse_loss': True, 'lmbd': 0.00031605499444919624, 'use_batchnorm': False, 'use_dropout': True, 'dropout': 0.2972146779623499, 'mlp_size_1': 7, 'mlp_size_2': 1, 'mlp_size_3': 0, 'kernel': 'Normal', 'loss_name': 'NLLLoss'}. Best is trial 8 with value: 0.761225552106498.[0m
[32m[I 2022-04-17 05:02:47,521][0m Trial 10 finished with value: 0.7458539862633267 and parameters: {'n_hidden': 256, 'mixture_components': 10, 'use_sparse_layer': True, 'use_sparse_loss': False, 'use_batchnorm': True, 'use_dropout': False, 'mlp_size_1': 4, 'mlp_size_2': 1, 'mlp_size_3': 0, 'kernel': 'Logistic', 'loss_name': 'AlternativeNLLLoss'}. Best is trial 8 with value: 0.761225552106498.[0m
[32m[I 2022-04-17 05:04:24,956][0m Trial 11 finished with value: 0.671845532377836 and parameters: {'n_hidden': 1024, 'mixture_components': 1, 'use_sparse_layer': False, 'use_batchnorm': False, 'use_dropout': False, 'mlp_size_1': 7, 'mlp_size_2': 0, 'mlp_size_3': 0, 'kernel': 'Normal', 'loss_name': 'NLLLoss'}. Best is trial 8 with value: 0.761225552106498.[0m
[32m[I 2022-04-17 05:06:00,604][0m Trial 12 finished with value: 0.7673193132040163 and parameters: {'n_hidden': 512, 'mixture_components': 1, 'use_sparse_layer': False, 'use_batchnorm': False, 'use_dropout': False, 'mlp_size_1': 5, 'mlp_size_2': 1, 'mlp_size_3': 0, 'kernel': 'Exponential', 'loss_name': 'AlternativeNLLLoss'}. Best is trial 12 with value: 0.7673193132040163.[0m
[32m[I 2022-04-17 05:07:42,767][0m Trial 13 finished with value: 0.7634286258123322 and parameters: {'n_hidden': 512, 'mixture_components': 1, 'use_sparse_layer': False, 'use_batchnorm': False, 'use_dropout': False, 'mlp_size_1': 5, 'mlp_size_2': 1, 'mlp_size_3': 0, 'kernel': 'Exponential', 'loss_name': 'AlternativeNLLLoss'}. Best is trial 12 with value: 0.7673193132040163.[0m
[32m[I 2022-04-17 05:09:19,722][0m Trial 14 finished with value: 0.7654861379030644 and parameters: {'n_hidden': 512, 'mixture_components': 1, 'use_sparse_layer': False, 'use_batchnorm': False, 'use_dropout': False, 'mlp_size_1': 5, 'mlp_size_2': 1, 'mlp_size_3': 0, 'kernel': 'Exponential', 'loss_name': 'AlternativeNLLLoss'}. Best is trial 12 with value: 0.7673193132040163.[0m
[32m[I 2022-04-17 05:12:12,486][0m Trial 15 finished with value: 0.748624052333405 and parameters: {'n_hidden': 512, 'mixture_components': 1, 'use_sparse_layer': False, 'use_batchnorm': True, 'use_dropout': False, 'mlp_size_1': 5, 'mlp_size_2': 1, 'mlp_size_3': 0, 'kernel': 'Exponential', 'loss_name': 'AlternativeNLLLoss'}. Best is trial 12 with value: 0.7673193132040163.[0m
[32m[I 2022-04-17 05:13:56,969][0m Trial 16 finished with value: 0.765622295902786 and parameters: {'n_hidden': 512, 'mixture_components': 2, 'use_sparse_layer': False, 'use_batchnorm': False, 'use_dropout': False, 'mlp_size_1': 5, 'mlp_size_2': 1, 'mlp_size_3': 0, 'kernel': 'Exponential', 'loss_name': 'AlternativeNLLLoss'}. Best is trial 12 with value: 0.7673193132040163.[0m
[32m[I 2022-04-17 05:15:34,374][0m Trial 17 finished with value: 0.6995704183755955 and parameters: {'n_hidden': 128, 'mixture_components': 4, 'use_sparse_layer': False, 'use_batchnorm': False, 'use_dropout': False, 'mlp_size_1': 4, 'mlp_size_2': 0, 'mlp_size_3': 0, 'kernel': 'Exponential', 'loss_name': 'NLLLoss'}. Best is trial 12 with value: 0.7673193132040163.[0m
[32m[I 2022-04-17 05:18:22,716][0m Trial 18 finished with value: 0.7547875687921423 and parameters: {'n_hidden': 512, 'mixture_components': 2, 'use_sparse_layer': False, 'use_batchnorm': True, 'use_dropout': True, 'dropout': 0.026326876068641925, 'mlp_size_1': 4, 'mlp_size_2': 2, 'mlp_size_3': 0, 'kernel': 'Exponential', 'loss_name': 'AlternativeNLLLoss'}. Best is trial 12 with value: 0.7673193132040163.[0m
[32m[I 2022-04-17 05:20:52,000][0m Trial 19 finished with value: 0.7590606337855806 and parameters: {'n_hidden': 512, 'mixture_components': 2, 'use_sparse_layer': False, 'use_batchnorm': False, 'use_dropout': False, 'mlp_size_1': 5, 'mlp_size_2': 1, 'mlp_size_3': 0, 'kernel': 'LogNormal', 'loss_name': 'AlternativeNLLLoss'}. Best is trial 12 with value: 0.7673193132040163.[0m
