[32m[I 2022-04-13 11:44:27,157][0m Trial 139 finished with value: 0.7765203462172419 and parameters: {'splitter': 'best', 'min_samples_split': 0.07405075961281529, 'min_samples_leaf': 0.09246651234422526, 'min_weight_fraction_leaf': 0.048156266777837846, 'max_features': 0.9640507959429304}. Best is trial 132 with value: 0.8857694580205372.[0m
[32m[I 2022-04-13 11:44:28,752][0m Trial 140 finished with value: 0.8816455029642585 and parameters: {'splitter': 'best', 'min_samples_split': 0.08522820351601065, 'min_samples_leaf': 0.07479766645784304, 'min_weight_fraction_leaf': 0.039464271973010265, 'max_features': 0.9064802615468807}. Best is trial 132 with value: 0.8857694580205372.[0m
[32m[I 2022-04-13 11:44:29,970][0m Trial 141 finished with value: 0.8838440565679923 and parameters: {'splitter': 'best', 'min_samples_split': 0.06798176531142276, 'min_samples_leaf': 0.06466338874807537, 'min_weight_fraction_leaf': 0.010719202749760626, 'max_features': 0.9993078044259014}. Best is trial 132 with value: 0.8857694580205372.[0m
[32m[I 2022-04-13 11:44:30,901][0m Trial 142 finished with value: 0.8829988242509129 and parameters: {'splitter': 'best', 'min_samples_split': 0.06990651470697976, 'min_samples_leaf': 0.06316132131911105, 'min_weight_fraction_leaf': 0.00040557973576935656, 'max_features': 0.8812968825170823}. Best is trial 132 with value: 0.8857694580205372.[0m
[32m[I 2022-04-13 11:44:32,020][0m Trial 143 finished with value: 0.785450211061244 and parameters: {'splitter': 'best', 'min_samples_split': 0.06424257698619638, 'min_samples_leaf': 0.08089084789279502, 'min_weight_fraction_leaf': 0.016059184460133935, 'max_features': 0.9995840899563774}. Best is trial 132 with value: 0.8857694580205372.[0m
/media/san2_ssd/data/Workdir/survival/utils.py:305: RuntimeWarning: invalid value encountered in true_divide
  pdfs = np.gradient(1-survs,axis=1)/norms
/media/san2_ssd/data/Workdir/survival/utils.py:305: RuntimeWarning: invalid value encountered in true_divide
  pdfs = np.gradient(1-survs,axis=1)/norms
/media/san2_ssd/data/Workdir/survival/utils.py:305: RuntimeWarning: invalid value encountered in true_divide
  pdfs = np.gradient(1-survs,axis=1)/norms
[32m[I 2022-04-13 11:44:33,681][0m Trial 144 finished with value: 0.8822683348413838 and parameters: {'splitter': 'best', 'min_samples_split': 0.10221316722721792, 'min_samples_leaf': 0.053880916280923674, 'min_weight_fraction_leaf': 0.011460108168365166, 'max_features': 0.9230302003972453}. Best is trial 132 with value: 0.8857694580205372.[0m
[32m[I 2022-04-13 11:44:35,075][0m Trial 145 finished with value: 0.8821421099120764 and parameters: {'splitter': 'best', 'min_samples_split': 0.09522166087195418, 'min_samples_leaf': 0.07184660574001048, 'min_weight_fraction_leaf': 0.03257414407781194, 'max_features': 0.9564386408500969}. Best is trial 132 with value: 0.8857694580205372.[0m
[32m[I 2022-04-13 11:44:36,818][0m Trial 146 finished with value: 0.7750604769367001 and parameters: {'splitter': 'best', 'min_samples_split': 0.05921938297102611, 'min_samples_leaf': 0.08946455718500211, 'min_weight_fraction_leaf': 0.009868099931160456, 'max_features': 0.8970889103405257}. Best is trial 132 with value: 0.8857694580205372.[0m
[32m[I 2022-04-13 11:44:37,327][0m Trial 147 finished with value: 0.6954493019226314 and parameters: {'splitter': 'best', 'min_samples_split': 0.03746662112359055, 'min_samples_leaf': 0.4444325447136346, 'min_weight_fraction_leaf': 0.04664726105895108, 'max_features': 0.9804694278751482}. Best is trial 132 with value: 0.8857694580205372.[0m
/media/san2_ssd/data/Workdir/survival/utils.py:305: RuntimeWarning: invalid value encountered in true_divide
  pdfs = np.gradient(1-survs,axis=1)/norms
/media/san2_ssd/data/Workdir/survival/utils.py:305: RuntimeWarning: invalid value encountered in true_divide
  pdfs = np.gradient(1-survs,axis=1)/norms
/media/san2_ssd/data/Workdir/survival/utils.py:305: RuntimeWarning: invalid value encountered in true_divide
  pdfs = np.gradient(1-survs,axis=1)/norms
[32m[I 2022-04-13 11:44:40,601][0m Trial 148 finished with value: 0.8829309641907269 and parameters: {'splitter': 'best', 'min_samples_split': 0.07848277839252482, 'min_samples_leaf': 0.050783799389650254, 'min_weight_fraction_leaf': 0.00013191783860140582, 'max_features': 0.9197871444554587}. Best is trial 132 with value: 0.8857694580205372.[0m
[32m[I 2022-04-13 11:44:42,182][0m Trial 149 finished with value: 0.8816668242936444 and parameters: {'splitter': 'best', 'min_samples_split': 0.08534935611975668, 'min_samples_leaf': 0.06363164727862397, 'min_weight_fraction_leaf': 0.030777741836083748, 'max_features': 0.8565844731087269}. Best is trial 132 with value: 0.8857694580205372.[0m
[32m[I 2022-04-13 11:44:43,391][0m Trial 150 finished with value: 0.5807330753703898 and parameters: {'splitter': 'best', 'min_samples_split': 0.05800958581503361, 'min_samples_leaf': 0.03003791670146201, 'min_weight_fraction_leaf': 0.49948515784139225, 'max_features': 0.8732241903814788}. Best is trial 132 with value: 0.8857694580205372.[0m
/media/san2_ssd/data/Workdir/survival/utils.py:305: RuntimeWarning: invalid value encountered in true_divide
  pdfs = np.gradient(1-survs,axis=1)/norms
/media/san2_ssd/data/Workdir/survival/utils.py:305: RuntimeWarning: invalid value encountered in true_divide
  pdfs = np.gradient(1-survs,axis=1)/norms
/media/san2_ssd/data/Workdir/survival/utils.py:305: RuntimeWarning: invalid value encountered in true_divide
  pdfs = np.gradient(1-survs,axis=1)/norms
/media/san2_ssd/data/Workdir/survival/utils.py:305: RuntimeWarning: invalid value encountered in true_divide
  pdfs = np.gradient(1-survs,axis=1)/norms
[32m[I 2022-04-13 11:44:45,467][0m Trial 151 finished with value: 0.8839724395141657 and parameters: {'splitter': 'best', 'min_samples_split': 0.07100542537497481, 'min_samples_leaf': 0.03291340387135606, 'min_weight_fraction_leaf': 0.02633810500203898, 'max_features': 0.9529261782781818}. Best is trial 132 with value: 0.8857694580205372.[0m
/media/san2_ssd/data/Workdir/survival/utils.py:305: RuntimeWarning: invalid value encountered in true_divide
  pdfs = np.gradient(1-survs,axis=1)/norms
/media/san2_ssd/data/Workdir/survival/utils.py:305: RuntimeWarning: invalid value encountered in true_divide
  pdfs = np.gradient(1-survs,axis=1)/norms
/media/san2_ssd/data/Workdir/survival/utils.py:305: RuntimeWarning: invalid value encountered in true_divide
  pdfs = np.gradient(1-survs,axis=1)/norms
[32m[I 2022-04-13 11:44:47,190][0m Trial 152 finished with value: 0.8838875998978978 and parameters: {'splitter': 'best', 'min_samples_split': 0.07000317923825644, 'min_samples_leaf': 0.050695962526238945, 'min_weight_fraction_leaf': 0.01415658808049363, 'max_features': 0.9456714000005482}. Best is trial 132 with value: 0.8857694580205372.[0m
/media/san2_ssd/data/Workdir/survival/utils.py:305: RuntimeWarning: invalid value encountered in true_divide
  pdfs = np.gradient(1-survs,axis=1)/norms
/media/san2_ssd/data/Workdir/survival/utils.py:305: RuntimeWarning: invalid value encountered in true_divide
  pdfs = np.gradient(1-survs,axis=1)/norms
/media/san2_ssd/data/Workdir/survival/utils.py:305: RuntimeWarning: invalid value encountered in true_divide
  pdfs = np.gradient(1-survs,axis=1)/norms
[32m[I 2022-04-13 11:44:49,214][0m Trial 153 finished with value: 0.8828943436543071 and parameters: {'splitter': 'best', 'min_samples_split': 0.03814156947347115, 'min_samples_leaf': 0.04847086767264543, 'min_weight_fraction_leaf': 0.03947024234264987, 'max_features': 0.9487950927485614}. Best is trial 132 with value: 0.8857694580205372.[0m
/media/san2_ssd/data/Workdir/survival/utils.py:305: RuntimeWarning: invalid value encountered in true_divide
  pdfs = np.gradient(1-survs,axis=1)/norms
/media/san2_ssd/data/Workdir/survival/utils.py:305: RuntimeWarning: invalid value encountered in true_divide
  pdfs = np.gradient(1-survs,axis=1)/norms
[32m[I 2022-04-13 11:44:50,411][0m Trial 154 finished with value: 0.8853466312163196 and parameters: {'splitter': 'best', 'min_samples_split': 0.13123502404535914, 'min_samples_leaf': 0.03213514561226462, 'min_weight_fraction_leaf': 0.05132245734166412, 'max_features': 0.9758018141052867}. Best is trial 132 with value: 0.8857694580205372.[0m
/media/san2_ssd/data/Workdir/survival/utils.py:305: RuntimeWarning: invalid value encountered in true_divide
  pdfs = np.gradient(1-survs,axis=1)/norms
/media/san2_ssd/data/Workdir/survival/utils.py:305: RuntimeWarning: invalid value encountered in true_divide
  pdfs = np.gradient(1-survs,axis=1)/norms
[32m[I 2022-04-13 11:44:53,001][0m Trial 155 finished with value: 0.8853466312163196 and parameters: {'splitter': 'best', 'min_samples_split': 0.13184458114820968, 'min_samples_leaf': 0.005306994782310656, 'min_weight_fraction_leaf': 0.05239486941278608, 'max_features': 0.9998620718456451}. Best is trial 132 with value: 0.8857694580205372.[0m
/media/san2_ssd/data/Workdir/survival/utils.py:305: RuntimeWarning: invalid value encountered in true_divide
  pdfs = np.gradient(1-survs,axis=1)/norms
/media/san2_ssd/data/Workdir/survival/utils.py:305: RuntimeWarning: invalid value encountered in true_divide
  pdfs = np.gradient(1-survs,axis=1)/norms
/media/san2_ssd/data/Workdir/survival/utils.py:305: RuntimeWarning: invalid value encountered in true_divide
  pdfs = np.gradient(1-survs,axis=1)/norms
[32m[I 2022-04-13 11:44:55,392][0m Trial 156 finished with value: 0.8855677635597313 and parameters: {'splitter': 'best', 'min_samples_split': 0.11351337385325655, 'min_samples_leaf': 0.01052256769765432, 'min_weight_fraction_leaf': 0.05119388444000618, 'max_features': 0.9828143309274651}. Best is trial 132 with value: 0.8857694580205372.[0m
/media/san2_ssd/data/Workdir/survival/utils.py:305: RuntimeWarning: invalid value encountered in true_divide
  pdfs = np.gradient(1-survs,axis=1)/norms
/media/san2_ssd/data/Workdir/survival/utils.py:305: RuntimeWarning: invalid value encountered in true_divide
  pdfs = np.gradient(1-survs,axis=1)/norms
/media/san2_ssd/data/Workdir/survival/utils.py:305: RuntimeWarning: invalid value encountered in true_divide
  pdfs = np.gradient(1-survs,axis=1)/norms
[32m[I 2022-04-13 11:44:57,970][0m Trial 157 finished with value: 0.8855619952094068 and parameters: {'splitter': 'best', 'min_samples_split': 0.1160095189965, 'min_samples_leaf': 0.0020406132477763794, 'min_weight_fraction_leaf': 0.051054944942227135, 'max_features': 0.9756887693825124}. Best is trial 132 with value: 0.8857694580205372.[0m
/media/san2_ssd/data/Workdir/survival/utils.py:305: RuntimeWarning: invalid value encountered in true_divide
  pdfs = np.gradient(1-survs,axis=1)/norms
/media/san2_ssd/data/Workdir/survival/utils.py:305: RuntimeWarning: invalid value encountered in true_divide
  pdfs = np.gradient(1-survs,axis=1)/norms
/media/san2_ssd/data/Workdir/survival/utils.py:305: RuntimeWarning: invalid value encountered in true_divide
  pdfs = np.gradient(1-survs,axis=1)/norms
[32m[I 2022-04-13 11:45:00,823][0m Trial 158 finished with value: 0.8858649406553697 and parameters: {'splitter': 'best', 'min_samples_split': 0.11459522429984235, 'min_samples_leaf': 0.006341879838434312, 'min_weight_fraction_leaf': 0.0502307142784251, 'max_features': 0.9823037718193239}. Best is trial 158 with value: 0.8858649406553697.[0m
/media/san2_ssd/data/Workdir/survival/utils.py:305: RuntimeWarning: invalid value encountered in true_divide
  pdfs = np.gradient(1-survs,axis=1)/norms
[32m[I 2022-04-13 11:45:04,020][0m Trial 159 finished with value: 0.8836222514354549 and parameters: {'splitter': 'best', 'min_samples_split': 0.14927326498681506, 'min_samples_leaf': 0.006677089722093624, 'min_weight_fraction_leaf': 0.05470348691938144, 'max_features': 0.9714108222832736}. Best is trial 158 with value: 0.8858649406553697.[0m
/media/san2_ssd/data/Workdir/survival/utils.py:305: RuntimeWarning: invalid value encountered in true_divide
  pdfs = np.gradient(1-survs,axis=1)/norms
/media/san2_ssd/data/Workdir/survival/utils.py:305: RuntimeWarning: invalid value encountered in true_divide
  pdfs = np.gradient(1-survs,axis=1)/norms
/media/san2_ssd/data/Workdir/survival/utils.py:305: RuntimeWarning: invalid value encountered in true_divide
  pdfs = np.gradient(1-survs,axis=1)/norms
/media/san2_ssd/data/Workdir/survival/utils.py:305: RuntimeWarning: invalid value encountered in true_divide
  pdfs = np.gradient(1-survs,axis=1)/norms
[32m[I 2022-04-13 11:45:05,822][0m Trial 160 finished with value: 0.8861698281302243 and parameters: {'splitter': 'best', 'min_samples_split': 0.12696203528955288, 'min_samples_leaf': 0.0015670578717626032, 'min_weight_fraction_leaf': 0.043326524115847996, 'max_features': 0.9983195124809605}. Best is trial 160 with value: 0.8861698281302243.[0m
/media/san2_ssd/data/Workdir/survival/utils.py:305: RuntimeWarning: invalid value encountered in true_divide
  pdfs = np.gradient(1-survs,axis=1)/norms
/media/san2_ssd/data/Workdir/survival/utils.py:305: RuntimeWarning: invalid value encountered in true_divide
  pdfs = np.gradient(1-survs,axis=1)/norms
[32m[I 2022-04-13 11:45:07,730][0m Trial 161 finished with value: 0.8852711515616823 and parameters: {'splitter': 'best', 'min_samples_split': 0.13088533638426741, 'min_samples_leaf': 0.004686915772222196, 'min_weight_fraction_leaf': 0.05532695368389261, 'max_features': 0.9997862197141868}. Best is trial 160 with value: 0.8861698281302243.[0m
/media/san2_ssd/data/Workdir/survival/utils.py:305: RuntimeWarning: invalid value encountered in true_divide
  pdfs = np.gradient(1-survs,axis=1)/norms
/media/san2_ssd/data/Workdir/survival/utils.py:305: RuntimeWarning: invalid value encountered in true_divide
  pdfs = np.gradient(1-survs,axis=1)/norms
/media/san2_ssd/data/Workdir/survival/utils.py:305: RuntimeWarning: invalid value encountered in true_divide
  pdfs = np.gradient(1-survs,axis=1)/norms
[32m[I 2022-04-13 11:45:09,331][0m Trial 162 finished with value: 0.8854832260262091 and parameters: {'splitter': 'best', 'min_samples_split': 0.12664236885103672, 'min_samples_leaf': 0.00243765630157856, 'min_weight_fraction_leaf': 0.052619527687962034, 'max_features': 0.9913493475496168}. Best is trial 160 with value: 0.8861698281302243.[0m
/media/san2_ssd/data/Workdir/survival/utils.py:305: RuntimeWarning: invalid value encountered in true_divide
  pdfs = np.gradient(1-survs,axis=1)/norms
/media/san2_ssd/data/Workdir/survival/utils.py:305: RuntimeWarning: invalid value encountered in true_divide
  pdfs = np.gradient(1-survs,axis=1)/norms
/media/san2_ssd/data/Workdir/survival/utils.py:305: RuntimeWarning: invalid value encountered in true_divide
  pdfs = np.gradient(1-survs,axis=1)/norms
[32m[I 2022-04-13 11:45:11,138][0m Trial 163 finished with value: 0.8857329310766968 and parameters: {'splitter': 'best', 'min_samples_split': 0.12531422195751765, 'min_samples_leaf': 0.0020450233796217073, 'min_weight_fraction_leaf': 0.047106729938533376, 'max_features': 0.9879069347582834}. Best is trial 160 with value: 0.8861698281302243.[0m
/media/san2_ssd/data/Workdir/survival/utils.py:305: RuntimeWarning: invalid value encountered in true_divide
  pdfs = np.gradient(1-survs,axis=1)/norms
/media/san2_ssd/data/Workdir/survival/utils.py:305: RuntimeWarning: invalid value encountered in true_divide
  pdfs = np.gradient(1-survs,axis=1)/norms
/media/san2_ssd/data/Workdir/survival/utils.py:305: RuntimeWarning: invalid value encountered in true_divide
  pdfs = np.gradient(1-survs,axis=1)/norms
[32m[I 2022-04-13 11:45:13,880][0m Trial 164 finished with value: 0.8854832260262091 and parameters: {'splitter': 'best', 'min_samples_split': 0.12805649923030354, 'min_samples_leaf': 0.0017651580298179111, 'min_weight_fraction_leaf': 0.052499059017718744, 'max_features': 0.9990518414362795}. Best is trial 160 with value: 0.8861698281302243.[0m
/media/san2_ssd/data/Workdir/survival/utils.py:305: RuntimeWarning: invalid value encountered in true_divide
  pdfs = np.gradient(1-survs,axis=1)/norms
/media/san2_ssd/data/Workdir/survival/utils.py:305: RuntimeWarning: invalid value encountered in true_divide
  pdfs = np.gradient(1-survs,axis=1)/norms
[32m[I 2022-04-13 11:45:16,493][0m Trial 165 finished with value: 0.8852016416949999 and parameters: {'splitter': 'best', 'min_samples_split': 0.1357217527189634, 'min_samples_leaf': 0.003034865680349705, 'min_weight_fraction_leaf': 0.050296283709178956, 'max_features': 0.997509423049297}. Best is trial 160 with value: 0.8861698281302243.[0m
/media/san2_ssd/data/Workdir/survival/utils.py:305: RuntimeWarning: invalid value encountered in true_divide
  pdfs = np.gradient(1-survs,axis=1)/norms
/media/san2_ssd/data/Workdir/survival/utils.py:305: RuntimeWarning: invalid value encountered in true_divide
  pdfs = np.gradient(1-survs,axis=1)/norms
[32m[I 2022-04-13 11:45:18,550][0m Trial 166 finished with value: 0.885628898009227 and parameters: {'splitter': 'best', 'min_samples_split': 0.1337683369110162, 'min_samples_leaf': 0.0050445961563775656, 'min_weight_fraction_leaf': 0.05481157566199851, 'max_features': 0.9985554997656406}. Best is trial 160 with value: 0.8861698281302243.[0m
/media/san2_ssd/data/Workdir/survival/utils.py:305: RuntimeWarning: invalid value encountered in true_divide
  pdfs = np.gradient(1-survs,axis=1)/norms
/media/san2_ssd/data/Workdir/survival/utils.py:305: RuntimeWarning: invalid value encountered in true_divide
  pdfs = np.gradient(1-survs,axis=1)/norms
[32m[I 2022-04-13 11:45:19,804][0m Trial 167 finished with value: 0.88526113198411 and parameters: {'splitter': 'best', 'min_samples_split': 0.12964427952763097, 'min_samples_leaf': 0.0016434704011516889, 'min_weight_fraction_leaf': 0.056423976463479825, 'max_features': 0.9998538191439379}. Best is trial 160 with value: 0.8861698281302243.[0m
/media/san2_ssd/data/Workdir/survival/utils.py:305: RuntimeWarning: invalid value encountered in true_divide
  pdfs = np.gradient(1-survs,axis=1)/norms
/media/san2_ssd/data/Workdir/survival/utils.py:305: RuntimeWarning: invalid value encountered in true_divide
  pdfs = np.gradient(1-survs,axis=1)/norms
[32m[I 2022-04-13 11:45:20,976][0m Trial 168 finished with value: 0.8856526600049065 and parameters: {'splitter': 'best', 'min_samples_split': 0.13537694299447783, 'min_samples_leaf': 0.004371127361300296, 'min_weight_fraction_leaf': 0.05414051609222463, 'max_features': 0.9988385922965693}. Best is trial 160 with value: 0.8861698281302243.[0m
/media/san2_ssd/data/Workdir/survival/utils.py:305: RuntimeWarning: invalid value encountered in true_divide
  pdfs = np.gradient(1-survs,axis=1)/norms
/media/san2_ssd/data/Workdir/survival/utils.py:305: RuntimeWarning: invalid value encountered in true_divide
  pdfs = np.gradient(1-survs,axis=1)/norms
[32m[I 2022-04-13 11:45:23,169][0m Trial 169 finished with value: 0.8856607911560488 and parameters: {'splitter': 'best', 'min_samples_split': 0.13701023170329032, 'min_samples_leaf': 0.001070470315383759, 'min_weight_fraction_leaf': 0.05430566251376399, 'max_features': 0.9959224605303352}. Best is trial 160 with value: 0.8861698281302243.[0m
/media/san2_ssd/data/Workdir/survival/utils.py:305: RuntimeWarning: invalid value encountered in true_divide
  pdfs = np.gradient(1-survs,axis=1)/norms
/media/san2_ssd/data/Workdir/survival/utils.py:305: RuntimeWarning: invalid value encountered in true_divide
  pdfs = np.gradient(1-survs,axis=1)/norms
[32m[I 2022-04-13 11:45:24,809][0m Trial 170 finished with value: 0.885628898009227 and parameters: {'splitter': 'best', 'min_samples_split': 0.13425188516056846, 'min_samples_leaf': 0.0014918417816274891, 'min_weight_fraction_leaf': 0.05330533465948316, 'max_features': 0.9980318143904652}. Best is trial 160 with value: 0.8861698281302243.[0m
/media/san2_ssd/data/Workdir/survival/utils.py:305: RuntimeWarning: invalid value encountered in true_divide
  pdfs = np.gradient(1-survs,axis=1)/norms
/media/san2_ssd/data/Workdir/survival/utils.py:305: RuntimeWarning: invalid value encountered in true_divide
  pdfs = np.gradient(1-survs,axis=1)/norms
[32m[I 2022-04-13 11:45:28,089][0m Trial 171 finished with value: 0.885628898009227 and parameters: {'splitter': 'best', 'min_samples_split': 0.13314363548727123, 'min_samples_leaf': 0.001913520664919839, 'min_weight_fraction_leaf': 0.05623726414621939, 'max_features': 0.9946743698564402}. Best is trial 160 with value: 0.8861698281302243.[0m
/media/san2_ssd/data/Workdir/survival/utils.py:305: RuntimeWarning: invalid value encountered in true_divide
  pdfs = np.gradient(1-survs,axis=1)/norms
/media/san2_ssd/data/Workdir/survival/utils.py:305: RuntimeWarning: invalid value encountered in true_divide
  pdfs = np.gradient(1-survs,axis=1)/norms
[32m[I 2022-04-13 11:45:30,042][0m Trial 172 finished with value: 0.8854496801240688 and parameters: {'splitter': 'best', 'min_samples_split': 0.1256460793744708, 'min_samples_leaf': 0.003944349271433709, 'min_weight_fraction_leaf': 0.0582807531072846, 'max_features': 0.9781302335698882}. Best is trial 160 with value: 0.8861698281302243.[0m
[32m[I 2022-04-13 11:45:31,891][0m Trial 173 finished with value: 0.7850944955918016 and parameters: {'splitter': 'best', 'min_samples_split': 0.14062383867162276, 'min_samples_leaf': 0.0016929950785488663, 'min_weight_fraction_leaf': 0.08569615119340879, 'max_features': 0.9772159989245547}. Best is trial 160 with value: 0.8861698281302243.[0m
/media/san2_ssd/data/Workdir/survival/utils.py:305: RuntimeWarning: invalid value encountered in true_divide
  pdfs = np.gradient(1-survs,axis=1)/norms
[32m[I 2022-04-13 11:45:34,481][0m Trial 174 finished with value: 0.7827158913784459 and parameters: {'splitter': 'best', 'min_samples_split': 0.15663740597763112, 'min_samples_leaf': 0.010685864214851331, 'min_weight_fraction_leaf': 0.058090731842227954, 'max_features': 0.9766125832530573}. Best is trial 160 with value: 0.8861698281302243.[0m
