[32m[I 2022-04-15 08:42:42,961][0m Trial 655 finished with value: 0.5 and parameters: {'loss': 'coxph', 'learning_rate': 0.0024941647076152425, 'n_estimators': 508, 'criterion': 'friedman_mse', 'min_samples_split': 5, 'min_samples_leaf': 3, 'min_weight_fraction_leaf': 0.029948596854581764, 'min_impurity_decrease': 0.4340657396325784, 'max_features': 0.7897223673883307, 'subsample': 0.9963929039291118, 'dropout_rate': 0.6327511583059703, 'ccp_alpha': 0.21069466572867201}. Best is trial 582 with value: 0.7782421835300739.[0m
[32m[I 2022-04-15 08:43:45,129][0m Trial 656 finished with value: 0.7136759790527287 and parameters: {'loss': 'coxph', 'learning_rate': 0.0034620769021679945, 'n_estimators': 472, 'criterion': 'friedman_mse', 'min_samples_split': 5, 'min_samples_leaf': 3, 'min_weight_fraction_leaf': 0.039876642378127984, 'min_impurity_decrease': 0.41447326206521334, 'max_features': 0.778667355718376, 'subsample': 0.9206678250682981, 'dropout_rate': 0.5602057499170879, 'ccp_alpha': 0.10216941021018541}. Best is trial 582 with value: 0.7782421835300739.[0m
[32m[I 2022-04-15 08:44:23,103][0m Trial 657 finished with value: 0.3224124598704058 and parameters: {'loss': 'squared', 'learning_rate': 0.00126990440203878, 'n_estimators': 484, 'criterion': 'friedman_mse', 'min_samples_split': 5, 'min_samples_leaf': 3, 'min_weight_fraction_leaf': 0.05589459410332488, 'min_impurity_decrease': 0.44192934119861915, 'max_features': 0.798453692252495, 'subsample': 0.9975907118921906, 'dropout_rate': 0.5319031981166883, 'ccp_alpha': 0.17552866244918128}. Best is trial 582 with value: 0.7782421835300739.[0m
[32m[I 2022-04-15 08:45:38,923][0m Trial 658 finished with value: 0.7737015111261464 and parameters: {'loss': 'coxph', 'learning_rate': 0.0019675372351000454, 'n_estimators': 533, 'criterion': 'friedman_mse', 'min_samples_split': 5, 'min_samples_leaf': 3, 'min_weight_fraction_leaf': 0.023382202141349277, 'min_impurity_decrease': 0.3761281359922303, 'max_features': 0.76203155933118, 'subsample': 0.9409713726698957, 'dropout_rate': 0.5851847597837123, 'ccp_alpha': 0.0014159638949550004}. Best is trial 582 with value: 0.7782421835300739.[0m
[32m[I 2022-04-15 08:46:59,777][0m Trial 659 finished with value: 0.7731435086457028 and parameters: {'loss': 'coxph', 'learning_rate': 0.001989276246719268, 'n_estimators': 545, 'criterion': 'friedman_mse', 'min_samples_split': 5, 'min_samples_leaf': 3, 'min_weight_fraction_leaf': 0.0229543336276567, 'min_impurity_decrease': 0.37519736257761255, 'max_features': 0.7742733146811727, 'subsample': 0.9400665532842982, 'dropout_rate': 0.5950411739641001, 'ccp_alpha': 0.0027419991157345467}. Best is trial 582 with value: 0.7782421835300739.[0m
[32m[I 2022-04-15 08:48:08,558][0m Trial 660 finished with value: 0.5 and parameters: {'loss': 'coxph', 'learning_rate': 0.0018343764674585024, 'n_estimators': 526, 'criterion': 'friedman_mse', 'min_samples_split': 5, 'min_samples_leaf': 3, 'min_weight_fraction_leaf': 0.020528058052618273, 'min_impurity_decrease': 0.36690726377946714, 'max_features': 0.7616683450552125, 'subsample': 0.9505666546122727, 'dropout_rate': 0.589293142439048, 'ccp_alpha': 0.2933624905695934}. Best is trial 582 with value: 0.7782421835300739.[0m
[32m[I 2022-04-15 08:49:15,602][0m Trial 661 finished with value: 0.7033802144143462 and parameters: {'loss': 'coxph', 'learning_rate': 0.0016368504706902836, 'n_estimators': 539, 'criterion': 'friedman_mse', 'min_samples_split': 5, 'min_samples_leaf': 3, 'min_weight_fraction_leaf': 0.0017549817536956225, 'min_impurity_decrease': 0.33563872580695137, 'max_features': 0.7651707598786145, 'subsample': 0.931186515618957, 'dropout_rate': 0.6156210945283092, 'ccp_alpha': 0.10534235694505552}. Best is trial 582 with value: 0.7782421835300739.[0m
[32m[I 2022-04-15 08:50:18,509][0m Trial 662 finished with value: 0.7738802945755603 and parameters: {'loss': 'coxph', 'learning_rate': 0.0022415935573119918, 'n_estimators': 507, 'criterion': 'friedman_mse', 'min_samples_split': 5, 'min_samples_leaf': 3, 'min_weight_fraction_leaf': 0.025476719057231277, 'min_impurity_decrease': 0.35145691833953396, 'max_features': 0.7790469668169604, 'subsample': 0.9005999071164609, 'dropout_rate': 0.6745438684281746, 'ccp_alpha': 0.0036835024887040403}. Best is trial 582 with value: 0.7782421835300739.[0m
[32m[I 2022-04-15 08:51:08,684][0m Trial 663 finished with value: 0.5 and parameters: {'loss': 'coxph', 'learning_rate': 0.002049411697445032, 'n_estimators': 491, 'criterion': 'squared_error', 'min_samples_split': 5, 'min_samples_leaf': 3, 'min_weight_fraction_leaf': 0.01546601883492781, 'min_impurity_decrease': 0.3442391890120156, 'max_features': 0.7684466582419625, 'subsample': 0.8961259060288316, 'dropout_rate': 0.6936651671091401, 'ccp_alpha': 0.1979057757686579}. Best is trial 582 with value: 0.7782421835300739.[0m
[32m[I 2022-04-15 08:52:14,207][0m Trial 664 finished with value: 0.7197745256901271 and parameters: {'loss': 'coxph', 'learning_rate': 0.002834089845844921, 'n_estimators': 541, 'criterion': 'friedman_mse', 'min_samples_split': 5, 'min_samples_leaf': 3, 'min_weight_fraction_leaf': 0.01027468465416317, 'min_impurity_decrease': 0.3769537531282766, 'max_features': 0.7612204317684714, 'subsample': 0.9650139826094473, 'dropout_rate': 0.6825706160013182, 'ccp_alpha': 0.09819762239926842}. Best is trial 582 with value: 0.7782421835300739.[0m
[32m[I 2022-04-15 08:53:31,193][0m Trial 665 finished with value: 0.5 and parameters: {'loss': 'coxph', 'learning_rate': 0.0021332081631610534, 'n_estimators': 585, 'criterion': 'friedman_mse', 'min_samples_split': 5, 'min_samples_leaf': 3, 'min_weight_fraction_leaf': 0.024848305091923588, 'min_impurity_decrease': 0.29938772182031537, 'max_features': 0.7823356487454602, 'subsample': 0.905269119082588, 'dropout_rate': 0.5824396193910648, 'ccp_alpha': 3.3611988053905626}. Best is trial 582 with value: 0.7782421835300739.[0m
[32m[I 2022-04-15 08:54:31,592][0m Trial 666 finished with value: 0.7733860713884507 and parameters: {'loss': 'coxph', 'learning_rate': 0.0011978456343956457, 'n_estimators': 512, 'criterion': 'friedman_mse', 'min_samples_split': 5, 'min_samples_leaf': 3, 'min_weight_fraction_leaf': 0.027874821931646983, 'min_impurity_decrease': 0.35500986676770113, 'max_features': 0.7875525608989544, 'subsample': 0.9287790064421126, 'dropout_rate': 0.705996710082052, 'ccp_alpha': 0.004198496785882705}. Best is trial 582 with value: 0.7782421835300739.[0m
[32m[I 2022-04-15 08:55:28,825][0m Trial 667 finished with value: 0.5 and parameters: {'loss': 'coxph', 'learning_rate': 0.000779592522162254, 'n_estimators': 508, 'criterion': 'friedman_mse', 'min_samples_split': 5, 'min_samples_leaf': 3, 'min_weight_fraction_leaf': 0.025453922045927835, 'min_impurity_decrease': 0.3695068211309422, 'max_features': 0.7837934955477843, 'subsample': 0.9294231741027001, 'dropout_rate': 0.6417317136145375, 'ccp_alpha': 0.25313862211714677}. Best is trial 582 with value: 0.7782421835300739.[0m
[32m[I 2022-04-15 08:56:23,118][0m Trial 668 finished with value: 0.5 and parameters: {'loss': 'coxph', 'learning_rate': 0.00220316726025451, 'n_estimators': 512, 'criterion': 'friedman_mse', 'min_samples_split': 5, 'min_samples_leaf': 3, 'min_weight_fraction_leaf': 0.035473304726114416, 'min_impurity_decrease': 0.3357874145375093, 'max_features': 0.7528410170069697, 'subsample': 0.9377085260496044, 'dropout_rate': 0.7155990402831179, 'ccp_alpha': 0.4014686250175316}. Best is trial 582 with value: 0.7782421835300739.[0m
[32m[I 2022-04-15 08:57:10,672][0m Trial 669 finished with value: 0.5 and parameters: {'loss': 'coxph', 'learning_rate': 0.001773602146324771, 'n_estimators': 471, 'criterion': 'friedman_mse', 'min_samples_split': 5, 'min_samples_leaf': 3, 'min_weight_fraction_leaf': 0.029937837430742822, 'min_impurity_decrease': 0.35568004998815433, 'max_features': 0.7604910712765727, 'subsample': 0.9722780332774832, 'dropout_rate': 0.7209005638442646, 'ccp_alpha': 3.1813571468928448}. Best is trial 582 with value: 0.7782421835300739.[0m
[32m[I 2022-04-15 08:58:03,330][0m Trial 670 finished with value: 0.7209970534841478 and parameters: {'loss': 'coxph', 'learning_rate': 0.0011539742640149732, 'n_estimators': 523, 'criterion': 'friedman_mse', 'min_samples_split': 5, 'min_samples_leaf': 3, 'min_weight_fraction_leaf': 0.01156671350454496, 'min_impurity_decrease': 0.32134117137061585, 'max_features': 0.7893341567908987, 'subsample': 0.9161231425120685, 'dropout_rate': 0.7402713586351728, 'ccp_alpha': 0.09573039271222497}. Best is trial 582 with value: 0.7782421835300739.[0m
[32m[I 2022-04-15 08:59:06,244][0m Trial 671 finished with value: 0.5 and parameters: {'loss': 'coxph', 'learning_rate': 0.0022696876445045273, 'n_estimators': 541, 'criterion': 'friedman_mse', 'min_samples_split': 5, 'min_samples_leaf': 3, 'min_weight_fraction_leaf': 0.039017425363037636, 'min_impurity_decrease': 0.3708456340268499, 'max_features': 0.7488003926269411, 'subsample': 0.9490080603588146, 'dropout_rate': 0.656194607915636, 'ccp_alpha': 1.183832816478147}. Best is trial 582 with value: 0.7782421835300739.[0m
[32m[I 2022-04-15 08:59:58,855][0m Trial 672 finished with value: 0.7208934917164525 and parameters: {'loss': 'coxph', 'learning_rate': 0.0027569366474650666, 'n_estimators': 489, 'criterion': 'friedman_mse', 'min_samples_split': 5, 'min_samples_leaf': 3, 'min_weight_fraction_leaf': 0.044136311176290494, 'min_impurity_decrease': 0.3950270385834715, 'max_features': 0.7758079077592489, 'subsample': 0.8954569144102209, 'dropout_rate': 0.7029309453947108, 'ccp_alpha': 0.09632192678444197}. Best is trial 582 with value: 0.7782421835300739.[0m
[32m[I 2022-04-15 09:01:16,493][0m Trial 673 finished with value: 0.5636982531485787 and parameters: {'loss': 'coxph', 'learning_rate': 0.0019546959659719797, 'n_estimators': 556, 'criterion': 'friedman_mse', 'min_samples_split': 5, 'min_samples_leaf': 3, 'min_weight_fraction_leaf': 0.027858180043160263, 'min_impurity_decrease': 0.3822473804499312, 'max_features': 0.7902454670153016, 'subsample': 0.9533954344621288, 'dropout_rate': 0.6085253448948146, 'ccp_alpha': 0.17363226386520852}. Best is trial 582 with value: 0.7782421835300739.[0m
[32m[I 2022-04-15 09:02:47,030][0m Trial 674 finished with value: 0.7746911405500981 and parameters: {'loss': 'coxph', 'learning_rate': 0.0016040186026199288, 'n_estimators': 610, 'criterion': 'friedman_mse', 'min_samples_split': 5, 'min_samples_leaf': 3, 'min_weight_fraction_leaf': 0.05058172615886195, 'min_impurity_decrease': 0.3526173244018111, 'max_features': 0.7978196569622287, 'subsample': 0.9169712434234206, 'dropout_rate': 0.6752284061900558, 'ccp_alpha': 0.003335440217196066}. Best is trial 582 with value: 0.7782421835300739.[0m
[32m[I 2022-04-15 09:04:32,466][0m Trial 675 finished with value: 0.5 and parameters: {'loss': 'coxph', 'learning_rate': 0.0014520083529786212, 'n_estimators': 612, 'criterion': 'absolute_error', 'min_samples_split': 5, 'min_samples_leaf': 3, 'min_weight_fraction_leaf': 0.05064536771130077, 'min_impurity_decrease': 0.3317669290711113, 'max_features': 0.751400004322825, 'subsample': 0.9176527259685604, 'dropout_rate': 0.6701820247004823, 'ccp_alpha': 0.16034057316882916}. Best is trial 582 with value: 0.7782421835300739.[0m
[32m[I 2022-04-15 09:05:29,235][0m Trial 676 finished with value: 0.21474210264116458 and parameters: {'loss': 'squared', 'learning_rate': 0.0016692241725823366, 'n_estimators': 650, 'criterion': 'friedman_mse', 'min_samples_split': 5, 'min_samples_leaf': 3, 'min_weight_fraction_leaf': 0.021199389403570308, 'min_impurity_decrease': 0.35018470512973726, 'max_features': 0.7726858670576894, 'subsample': 0.9013774590404102, 'dropout_rate': 0.6849808150413599, 'ccp_alpha': 0.0013009198393468542}. Best is trial 582 with value: 0.7782421835300739.[0m
[32m[I 2022-04-15 09:06:41,025][0m Trial 677 finished with value: 0.5 and parameters: {'loss': 'coxph', 'learning_rate': 0.0011408218151908508, 'n_estimators': 581, 'criterion': 'friedman_mse', 'min_samples_split': 5, 'min_samples_leaf': 3, 'min_weight_fraction_leaf': 0.03660143482429635, 'min_impurity_decrease': 0.3149558187388257, 'max_features': 0.798914533478064, 'subsample': 0.9759881202800196, 'dropout_rate': 0.6685442683999954, 'ccp_alpha': 0.30270275650009615}. Best is trial 582 with value: 0.7782421835300739.[0m
[32m[I 2022-04-15 09:08:11,394][0m Trial 678 finished with value: 0.720157442611238 and parameters: {'loss': 'coxph', 'learning_rate': 0.0023528306380441177, 'n_estimators': 622, 'criterion': 'friedman_mse', 'min_samples_split': 5, 'min_samples_leaf': 4, 'min_weight_fraction_leaf': 0.04919635582191684, 'min_impurity_decrease': 0.38661273062647483, 'max_features': 0.7966466099899161, 'subsample': 0.9251130590995306, 'dropout_rate': 0.5679611166884625, 'ccp_alpha': 0.10087004848086245}. Best is trial 582 with value: 0.7782421835300739.[0m
[32m[I 2022-04-15 09:09:11,346][0m Trial 679 finished with value: 0.5 and parameters: {'loss': 'coxph', 'learning_rate': 0.0025772827710331798, 'n_estimators': 505, 'criterion': 'friedman_mse', 'min_samples_split': 5, 'min_samples_leaf': 3, 'min_weight_fraction_leaf': 0.06337372643914989, 'min_impurity_decrease': 0.42033883968292696, 'max_features': 0.7784431715613047, 'subsample': 0.8786889201508727, 'dropout_rate': 0.6004432283163851, 'ccp_alpha': 0.2277662699232201}. Best is trial 582 with value: 0.7782421835300739.[0m
[32m[I 2022-04-15 09:10:25,564][0m Trial 680 finished with value: 0.6873462046726432 and parameters: {'loss': 'coxph', 'learning_rate': 0.001901727546496725, 'n_estimators': 551, 'criterion': 'friedman_mse', 'min_samples_split': 5, 'min_samples_leaf': 3, 'min_weight_fraction_leaf': 0.07297072925438008, 'min_impurity_decrease': 0.35674407653905654, 'max_features': 0.7628119343755633, 'subsample': 0.9368438052862521, 'dropout_rate': 0.5661229706525069, 'ccp_alpha': 0.11300603161689275}. Best is trial 582 with value: 0.7782421835300739.[0m
[32m[I 2022-04-15 09:11:31,984][0m Trial 681 finished with value: 0.7734730972012833 and parameters: {'loss': 'coxph', 'learning_rate': 0.0015020700621376343, 'n_estimators': 481, 'criterion': 'friedman_mse', 'min_samples_split': 5, 'min_samples_leaf': 3, 'min_weight_fraction_leaf': 0.03802017746970702, 'min_impurity_decrease': 0.4000979544681167, 'max_features': 0.7982751152667819, 'subsample': 0.8978337423401259, 'dropout_rate': 0.5285227639283078, 'ccp_alpha': 0.004313459629327063}. Best is trial 582 with value: 0.7782421835300739.[0m
[32m[I 2022-04-15 09:12:24,922][0m Trial 682 finished with value: 0.7238513509130382 and parameters: {'loss': 'coxph', 'learning_rate': 0.0015043236375187857, 'n_estimators': 469, 'criterion': 'friedman_mse', 'min_samples_split': 5, 'min_samples_leaf': 3, 'min_weight_fraction_leaf': 0.03396037081366652, 'min_impurity_decrease': 0.37896429709112306, 'max_features': 0.7944213957671469, 'subsample': 0.891548004832082, 'dropout_rate': 0.6301143711927175, 'ccp_alpha': 0.08874511532454232}. Best is trial 582 with value: 0.7782421835300739.[0m
[32m[I 2022-04-15 09:13:24,547][0m Trial 683 finished with value: 0.5301157883717103 and parameters: {'loss': 'coxph', 'learning_rate': 0.001128209606763171, 'n_estimators': 489, 'criterion': 'friedman_mse', 'min_samples_split': 5, 'min_samples_leaf': 3, 'min_weight_fraction_leaf': 0.021402446614481048, 'min_impurity_decrease': 0.40469147812244993, 'max_features': 0.7530068726556609, 'subsample': 0.9079896757560965, 'dropout_rate': 0.5327093412081974, 'ccp_alpha': 0.1876660485960096}. Best is trial 582 with value: 0.7782421835300739.[0m
[32m[I 2022-04-15 09:14:34,861][0m Trial 684 finished with value: 0.7755263368120936 and parameters: {'loss': 'coxph', 'learning_rate': 0.0009217732030069089, 'n_estimators': 528, 'criterion': 'friedman_mse', 'min_samples_split': 5, 'min_samples_leaf': 3, 'min_weight_fraction_leaf': 0.0419190663656594, 'min_impurity_decrease': 0.412967112409642, 'max_features': 0.7772198754049616, 'subsample': 0.8618544163358449, 'dropout_rate': 0.5869353195705134, 'ccp_alpha': 0.00207803554800004}. Best is trial 582 with value: 0.7782421835300739.[0m
[32m[I 2022-04-15 09:15:39,587][0m Trial 685 finished with value: 0.5 and parameters: {'loss': 'coxph', 'learning_rate': 0.0009580489541907333, 'n_estimators': 515, 'criterion': 'squared_error', 'min_samples_split': 5, 'min_samples_leaf': 3, 'min_weight_fraction_leaf': 0.04304603000683204, 'min_impurity_decrease': 0.415895563059591, 'max_features': 0.7976769813248042, 'subsample': 0.8660181563590575, 'dropout_rate': 0.547221773284825, 'ccp_alpha': 1.8613159362773792}. Best is trial 582 with value: 0.7782421835300739.[0m
[32m[I 2022-04-15 09:16:38,517][0m Trial 686 finished with value: 0.5 and parameters: {'loss': 'coxph', 'learning_rate': 0.0007610179931421949, 'n_estimators': 473, 'criterion': 'friedman_mse', 'min_samples_split': 5, 'min_samples_leaf': 4, 'min_weight_fraction_leaf': 0.051741324968042915, 'min_impurity_decrease': 0.4329204009683564, 'max_features': 0.7752924868324953, 'subsample': 0.8527802507820308, 'dropout_rate': 0.49923462688908365, 'ccp_alpha': 4.442690590998887}. Best is trial 582 with value: 0.7782421835300739.[0m
[32m[I 2022-04-15 09:17:44,357][0m Trial 687 finished with value: 0.5 and parameters: {'loss': 'coxph', 'learning_rate': 0.0014121654816340594, 'n_estimators': 521, 'criterion': 'friedman_mse', 'min_samples_split': 5, 'min_samples_leaf': 3, 'min_weight_fraction_leaf': 0.05808246237567594, 'min_impurity_decrease': 0.38911372263349453, 'max_features': 0.7527614421628798, 'subsample': 0.8745731991612541, 'dropout_rate': 0.5259979725777285, 'ccp_alpha': 0.29330949018861296}. Best is trial 582 with value: 0.7782421835300739.[0m
[32m[I 2022-04-15 09:18:59,237][0m Trial 688 finished with value: 0.5 and parameters: {'loss': 'coxph', 'learning_rate': 0.0009739134797813484, 'n_estimators': 581, 'criterion': 'friedman_mse', 'min_samples_split': 5, 'min_samples_leaf': 3, 'min_weight_fraction_leaf': 0.04119344826055403, 'min_impurity_decrease': 0.41749006347219164, 'max_features': 0.799360913006072, 'subsample': 0.832727215508374, 'dropout_rate': 0.5598466998774069, 'ccp_alpha': 2.6645596970265526}. Best is trial 582 with value: 0.7782421835300739.[0m
[32m[I 2022-04-15 09:19:49,664][0m Trial 689 finished with value: 0.5 and parameters: {'loss': 'coxph', 'learning_rate': 0.0028528430410003623, 'n_estimators': 493, 'criterion': 'friedman_mse', 'min_samples_split': 5, 'min_samples_leaf': 3, 'min_weight_fraction_leaf': 0.05099599073344563, 'min_impurity_decrease': 0.4054825308209122, 'max_features': 0.7809954103904414, 'subsample': 0.8903922409492439, 'dropout_rate': 0.707630719501932, 'ccp_alpha': 0.4927096797928839}. Best is trial 582 with value: 0.7782421835300739.[0m
[32m[I 2022-04-15 09:20:50,218][0m Trial 690 finished with value: 0.7249338966839284 and parameters: {'loss': 'coxph', 'learning_rate': 0.0013613457389195054, 'n_estimators': 467, 'criterion': 'friedman_mse', 'min_samples_split': 5, 'min_samples_leaf': 2, 'min_weight_fraction_leaf': 0.06218856702504794, 'min_impurity_decrease': 0.4478341352672621, 'max_features': 0.8012832026589914, 'subsample': 0.9606611851381002, 'dropout_rate': 0.4903494021291182, 'ccp_alpha': 0.09454175586729224}. Best is trial 582 with value: 0.7782421835300739.[0m
[32m[I 2022-04-15 09:22:08,893][0m Trial 691 finished with value: 0.7761486195068443 and parameters: {'loss': 'coxph', 'learning_rate': 0.001729480730730675, 'n_estimators': 534, 'criterion': 'friedman_mse', 'min_samples_split': 5, 'min_samples_leaf': 3, 'min_weight_fraction_leaf': 0.03482281238890095, 'min_impurity_decrease': 0.356486507883981, 'max_features': 0.754284201762197, 'subsample': 0.8192982214946127, 'dropout_rate': 0.5315355457373638, 'ccp_alpha': 0.0014497573556628137}. Best is trial 582 with value: 0.7782421835300739.[0m
[32m[I 2022-04-15 09:23:24,848][0m Trial 692 finished with value: 0.776153412868317 and parameters: {'loss': 'coxph', 'learning_rate': 0.0015531950971768476, 'n_estimators': 539, 'criterion': 'friedman_mse', 'min_samples_split': 5, 'min_samples_leaf': 3, 'min_weight_fraction_leaf': 0.03348229440486676, 'min_impurity_decrease': 0.34107277705559386, 'max_features': 0.7452121627438201, 'subsample': 0.8137625777682177, 'dropout_rate': 0.5728064694017397, 'ccp_alpha': 0.0011996211369816924}. Best is trial 582 with value: 0.7782421835300739.[0m
[32m[I 2022-04-15 09:24:37,737][0m Trial 693 finished with value: 0.6743624146605087 and parameters: {'loss': 'coxph', 'learning_rate': 0.0018058770991495599, 'n_estimators': 565, 'criterion': 'friedman_mse', 'min_samples_split': 5, 'min_samples_leaf': 3, 'min_weight_fraction_leaf': 0.0345826656041623, 'min_impurity_decrease': 0.3065017380938232, 'max_features': 0.7472245572427912, 'subsample': 0.8075078452647506, 'dropout_rate': 0.5735434931636655, 'ccp_alpha': 0.17792239880455893}. Best is trial 582 with value: 0.7782421835300739.[0m
[32m[I 2022-04-15 09:25:56,518][0m Trial 694 finished with value: 0.7159968283451879 and parameters: {'loss': 'coxph', 'learning_rate': 0.0021508823456969734, 'n_estimators': 598, 'criterion': 'friedman_mse', 'min_samples_split': 5, 'min_samples_leaf': 3, 'min_weight_fraction_leaf': 0.043174925896472066, 'min_impurity_decrease': 0.34213691295569204, 'max_features': 0.7450864659208645, 'subsample': 0.8171494342367206, 'dropout_rate': 0.5840203580840208, 'ccp_alpha': 0.10628393763117928}. Best is trial 582 with value: 0.7782421835300739.[0m
