[32m[I 2022-04-18 15:04:34,285][0m Trial 867 finished with value: 0.7652341365863582 and parameters: {'n_hidden': 256, 'mixture_components': 10, 'use_sparse_layer': True, 'use_sparse_loss': True, 'lmbd': 2.3187913961144105e-05, 'use_batchnorm': True, 'use_dropout': True, 'dropout': 0.8170983901216088, 'mlp_size_1': 1, 'mlp_size_2': 4, 'mlp_size_3': 0, 'kernel': 'Exponential', 'loss_name': 'AlternativeNLLLoss'}. Best is trial 861 with value: 0.7786620056496094.[0m
[32m[I 2022-04-18 15:07:15,241][0m Trial 868 finished with value: 0.7449138189884631 and parameters: {'n_hidden': 256, 'mixture_components': 10, 'use_sparse_layer': True, 'use_sparse_loss': True, 'lmbd': 1.5977221514350475e-05, 'use_batchnorm': True, 'use_dropout': False, 'mlp_size_1': 1, 'mlp_size_2': 4, 'mlp_size_3': 0, 'kernel': 'Exponential', 'loss_name': 'AlternativeNLLLoss'}. Best is trial 861 with value: 0.7786620056496094.[0m
[32m[I 2022-04-18 15:11:38,480][0m Trial 869 finished with value: 0.6971225863558235 and parameters: {'n_hidden': 256, 'mixture_components': 10, 'use_sparse_layer': True, 'use_sparse_loss': True, 'lmbd': 9.155179585721754e-06, 'use_batchnorm': True, 'use_dropout': True, 'dropout': 0.8074682594157941, 'mlp_size_1': 1, 'mlp_size_2': 4, 'mlp_size_3': 0, 'kernel': 'Logistic', 'loss_name': 'AlternativeNLLLoss'}. Best is trial 861 with value: 0.7786620056496094.[0m
[32m[I 2022-04-18 15:14:13,719][0m Trial 870 finished with value: 0.7603665994030984 and parameters: {'n_hidden': 256, 'mixture_components': 10, 'use_sparse_layer': True, 'use_sparse_loss': True, 'lmbd': 2.718324433615087e-05, 'use_batchnorm': True, 'use_dropout': True, 'dropout': 0.8337351298335697, 'mlp_size_1': 1, 'mlp_size_2': 4, 'mlp_size_3': 0, 'kernel': 'Exponential', 'loss_name': 'AlternativeNLLLoss'}. Best is trial 861 with value: 0.7786620056496094.[0m
[32m[I 2022-04-18 15:16:59,671][0m Trial 871 finished with value: 0.7668380441481437 and parameters: {'n_hidden': 256, 'mixture_components': 10, 'use_sparse_layer': True, 'use_sparse_loss': True, 'lmbd': 1.6199983976687502e-05, 'use_batchnorm': True, 'use_dropout': True, 'dropout': 0.8030656455896076, 'mlp_size_1': 1, 'mlp_size_2': 4, 'mlp_size_3': 0, 'kernel': 'Exponential', 'loss_name': 'AlternativeNLLLoss'}. Best is trial 861 with value: 0.7786620056496094.[0m
[32m[I 2022-04-18 15:19:46,650][0m Trial 872 finished with value: 0.7674847117776729 and parameters: {'n_hidden': 256, 'mixture_components': 10, 'use_sparse_layer': True, 'use_sparse_loss': True, 'lmbd': 2.205112024281786e-05, 'use_batchnorm': True, 'use_dropout': True, 'dropout': 0.7934347585898003, 'mlp_size_1': 1, 'mlp_size_2': 4, 'mlp_size_3': 0, 'kernel': 'Exponential', 'loss_name': 'AlternativeNLLLoss'}. Best is trial 861 with value: 0.7786620056496094.[0m
[32m[I 2022-04-18 15:22:37,554][0m Trial 873 finished with value: 0.7674425772641289 and parameters: {'n_hidden': 256, 'mixture_components': 10, 'use_sparse_layer': True, 'use_sparse_loss': True, 'lmbd': 1.2472671246654306e-05, 'use_batchnorm': True, 'use_dropout': True, 'dropout': 0.7900115547209964, 'mlp_size_1': 1, 'mlp_size_2': 4, 'mlp_size_3': 0, 'kernel': 'Exponential', 'loss_name': 'AlternativeNLLLoss'}. Best is trial 861 with value: 0.7786620056496094.[0m
[32m[I 2022-04-18 15:28:49,103][0m Trial 874 finished with value: 0.7187439949512101 and parameters: {'n_hidden': 256, 'mixture_components': 10, 'use_sparse_layer': True, 'use_sparse_loss': True, 'lmbd': 3.968775685712072e-05, 'use_batchnorm': True, 'use_dropout': True, 'dropout': 0.8163413893403174, 'mlp_size_1': 1, 'mlp_size_2': 4, 'mlp_size_3': 0, 'kernel': 'Normal', 'loss_name': 'AlternativeNLLLoss'}. Best is trial 861 with value: 0.7786620056496094.[0m
[32m[I 2022-04-18 15:31:26,281][0m Trial 875 finished with value: 0.7576643006333142 and parameters: {'n_hidden': 256, 'mixture_components': 10, 'use_sparse_layer': True, 'use_sparse_loss': True, 'lmbd': 6.04843280081784e-06, 'use_batchnorm': True, 'use_dropout': True, 'dropout': 0.8385277153427289, 'mlp_size_1': 1, 'mlp_size_2': 4, 'mlp_size_3': 0, 'kernel': 'Exponential', 'loss_name': 'AlternativeNLLLoss'}. Best is trial 861 with value: 0.7786620056496094.[0m
[32m[I 2022-04-18 15:34:07,949][0m Trial 876 finished with value: 0.7712614998186094 and parameters: {'n_hidden': 256, 'mixture_components': 10, 'use_sparse_layer': True, 'use_sparse_loss': True, 'lmbd': 9.420759754553412e-06, 'use_batchnorm': True, 'use_dropout': True, 'dropout': 0.790917033230905, 'mlp_size_1': 1, 'mlp_size_2': 4, 'mlp_size_3': 0, 'kernel': 'Exponential', 'loss_name': 'AlternativeNLLLoss'}. Best is trial 861 with value: 0.7786620056496094.[0m
[32m[I 2022-04-18 15:38:00,521][0m Trial 877 finished with value: 0.6206839742957481 and parameters: {'n_hidden': 32, 'mixture_components': 10, 'use_sparse_layer': True, 'use_sparse_loss': True, 'lmbd': 3.056195688114383e-05, 'use_batchnorm': True, 'use_dropout': True, 'dropout': 0.7996342826855547, 'mlp_size_1': 1, 'mlp_size_2': 1, 'mlp_size_3': 0, 'kernel': 'LogLogistic', 'loss_name': 'AlternativeNLLLoss'}. Best is trial 861 with value: 0.7786620056496094.[0m
[32m[I 2022-04-18 15:40:38,234][0m Trial 878 finished with value: 0.7701432074729008 and parameters: {'n_hidden': 256, 'mixture_components': 10, 'use_sparse_layer': True, 'use_sparse_loss': True, 'lmbd': 7.301377176213593e-06, 'use_batchnorm': True, 'use_dropout': True, 'dropout': 0.779730065435535, 'mlp_size_1': 1, 'mlp_size_2': 4, 'mlp_size_3': 0, 'kernel': 'Exponential', 'loss_name': 'AlternativeNLLLoss'}. Best is trial 861 with value: 0.7786620056496094.[0m
[32m[I 2022-04-18 15:42:30,004][0m Trial 879 finished with value: 0.6792808904973573 and parameters: {'n_hidden': 256, 'mixture_components': 10, 'use_sparse_layer': True, 'use_sparse_loss': True, 'lmbd': 2.1002236195349266e-05, 'use_batchnorm': True, 'use_dropout': True, 'dropout': 0.779828317676117, 'mlp_size_1': 1, 'mlp_size_2': 4, 'mlp_size_3': 0, 'kernel': 'Gamma', 'loss_name': 'AlternativeNLLLoss'}. Best is trial 861 with value: 0.7786620056496094.[0m
[32m[I 2022-04-18 15:45:00,386][0m Trial 880 finished with value: 0.762958238376615 and parameters: {'n_hidden': 256, 'mixture_components': 10, 'use_sparse_layer': True, 'use_sparse_loss': True, 'lmbd': 5.518774242424502e-05, 'use_batchnorm': True, 'use_dropout': True, 'dropout': 0.8199484324872033, 'mlp_size_1': 1, 'mlp_size_2': 4, 'mlp_size_3': 0, 'kernel': 'Exponential', 'loss_name': 'AlternativeNLLLoss'}. Best is trial 861 with value: 0.7786620056496094.[0m
[32m[I 2022-04-18 15:48:00,373][0m Trial 881 finished with value: 0.7694056246608408 and parameters: {'n_hidden': 256, 'mixture_components': 10, 'use_sparse_layer': True, 'use_sparse_loss': True, 'lmbd': 1.2308432289289708e-05, 'use_batchnorm': True, 'use_dropout': True, 'dropout': 0.7742774475417575, 'mlp_size_1': 1, 'mlp_size_2': 4, 'mlp_size_3': 0, 'kernel': 'Exponential', 'loss_name': 'AlternativeNLLLoss'}. Best is trial 861 with value: 0.7786620056496094.[0m
[32m[I 2022-04-18 15:50:54,713][0m Trial 882 finished with value: 0.7648221622570407 and parameters: {'n_hidden': 256, 'mixture_components': 10, 'use_sparse_layer': True, 'use_sparse_loss': True, 'lmbd': 3.88742525547018e-06, 'use_batchnorm': True, 'use_dropout': True, 'dropout': 0.8072518785020281, 'mlp_size_1': 1, 'mlp_size_2': 4, 'mlp_size_3': 0, 'kernel': 'Exponential', 'loss_name': 'AlternativeNLLLoss'}. Best is trial 861 with value: 0.7786620056496094.[0m
[32m[I 2022-04-18 15:53:39,297][0m Trial 883 finished with value: 0.7722230818776887 and parameters: {'n_hidden': 256, 'mixture_components': 10, 'use_sparse_layer': True, 'use_sparse_loss': True, 'lmbd': 1.4998345021046424e-05, 'use_batchnorm': True, 'use_dropout': True, 'dropout': 0.7869962333532378, 'mlp_size_1': 1, 'mlp_size_2': 4, 'mlp_size_3': 0, 'kernel': 'Exponential', 'loss_name': 'AlternativeNLLLoss'}. Best is trial 861 with value: 0.7786620056496094.[0m
[32m[I 2022-04-18 15:56:17,097][0m Trial 884 finished with value: 0.7670634050777128 and parameters: {'n_hidden': 2048, 'mixture_components': 10, 'use_sparse_layer': True, 'use_sparse_loss': True, 'lmbd': 3.437404938729257e-05, 'use_batchnorm': True, 'use_dropout': True, 'dropout': 0.7702024485271928, 'mlp_size_1': 2, 'mlp_size_2': 4, 'mlp_size_3': 0, 'kernel': 'Exponential', 'loss_name': 'AlternativeNLLLoss'}. Best is trial 861 with value: 0.7786620056496094.[0m
[32m[I 2022-04-18 15:57:52,858][0m Trial 885 finished with value: -1.0 and parameters: {'n_hidden': 256, 'mixture_components': 10, 'use_sparse_layer': True, 'use_sparse_loss': True, 'lmbd': 1.919718629403625e-05, 'use_batchnorm': True, 'use_dropout': True, 'dropout': 0.8434702467130767, 'mlp_size_1': 1, 'mlp_size_2': 4, 'mlp_size_3': 0, 'kernel': 'Gumbel', 'loss_name': 'AlternativeNLLLoss'}. Best is trial 861 with value: 0.7786620056496094.[0m
[32m[I 2022-04-18 16:00:31,000][0m Trial 886 finished with value: 0.7584794859308517 and parameters: {'n_hidden': 512, 'mixture_components': 10, 'use_sparse_layer': True, 'use_sparse_loss': True, 'lmbd': 2.672212055140802e-05, 'use_batchnorm': True, 'use_dropout': True, 'dropout': 0.7933965850834909, 'mlp_size_1': 4, 'mlp_size_2': 2, 'mlp_size_3': 0, 'kernel': 'Exponential', 'loss_name': 'AlternativeNLLLoss'}. Best is trial 861 with value: 0.7786620056496094.[0m
[32m[I 2022-04-18 16:02:59,064][0m Trial 887 finished with value: 0.754918041365854 and parameters: {'n_hidden': 128, 'mixture_components': 10, 'use_sparse_layer': True, 'use_sparse_loss': True, 'lmbd': 7.387828717563532e-05, 'use_batchnorm': True, 'use_dropout': False, 'mlp_size_1': 1, 'mlp_size_2': 3, 'mlp_size_3': 0, 'kernel': 'Exponential', 'loss_name': 'AlternativeNLLLoss'}. Best is trial 861 with value: 0.7786620056496094.[0m
[32m[I 2022-04-18 16:05:56,593][0m Trial 888 finished with value: 0.7680041763474861 and parameters: {'n_hidden': 256, 'mixture_components': 10, 'use_sparse_layer': True, 'use_sparse_loss': True, 'lmbd': 4.51442568050552e-05, 'use_batchnorm': True, 'use_dropout': True, 'dropout': 0.7671292495277082, 'mlp_size_1': 1, 'mlp_size_2': 4, 'mlp_size_3': 0, 'kernel': 'Exponential', 'loss_name': 'AlternativeNLLLoss'}. Best is trial 861 with value: 0.7786620056496094.[0m
[32m[I 2022-04-18 16:09:02,892][0m Trial 889 finished with value: 0.7733261595501465 and parameters: {'n_hidden': 256, 'mixture_components': 10, 'use_sparse_layer': True, 'use_sparse_loss': True, 'lmbd': 1.0752858556315494e-05, 'use_batchnorm': True, 'use_dropout': True, 'dropout': 0.7694071251252637, 'mlp_size_1': 1, 'mlp_size_2': 4, 'mlp_size_3': 0, 'kernel': 'Exponential', 'loss_name': 'AlternativeNLLLoss'}. Best is trial 861 with value: 0.7786620056496094.[0m
[32m[I 2022-04-18 16:11:38,419][0m Trial 890 finished with value: 0.7601260527474867 and parameters: {'n_hidden': 256, 'mixture_components': 10, 'use_sparse_layer': True, 'use_sparse_loss': True, 'lmbd': 1.558242982507398e-05, 'use_batchnorm': True, 'use_dropout': True, 'dropout': 0.8296480471722752, 'mlp_size_1': 1, 'mlp_size_2': 4, 'mlp_size_3': 0, 'kernel': 'Exponential', 'loss_name': 'AlternativeNLLLoss'}. Best is trial 861 with value: 0.7786620056496094.[0m
[32m[I 2022-04-18 16:16:27,488][0m Trial 891 finished with value: 0.7468345551662512 and parameters: {'n_hidden': 256, 'mixture_components': 10, 'use_sparse_layer': True, 'use_sparse_loss': True, 'lmbd': 4.869137994425804e-06, 'use_batchnorm': True, 'use_dropout': True, 'dropout': 0.8071533045876842, 'mlp_size_1': 1, 'mlp_size_2': 4, 'mlp_size_3': 0, 'kernel': 'Weibull', 'loss_name': 'AlternativeNLLLoss'}. Best is trial 861 with value: 0.7786620056496094.[0m
[32m[I 2022-04-18 16:19:13,769][0m Trial 892 finished with value: 0.766680423592069 and parameters: {'n_hidden': 256, 'mixture_components': 10, 'use_sparse_layer': True, 'use_sparse_loss': True, 'lmbd': 9.176244060457135e-05, 'use_batchnorm': True, 'use_dropout': True, 'dropout': 0.7906214549332582, 'mlp_size_1': 1, 'mlp_size_2': 4, 'mlp_size_3': 0, 'kernel': 'Exponential', 'loss_name': 'AlternativeNLLLoss'}. Best is trial 861 with value: 0.7786620056496094.[0m
[32m[I 2022-04-18 16:22:10,166][0m Trial 893 finished with value: 0.771693146796368 and parameters: {'n_hidden': 256, 'mixture_components': 10, 'use_sparse_layer': True, 'use_sparse_loss': True, 'lmbd': 8.154649937205572e-06, 'use_batchnorm': True, 'use_dropout': True, 'dropout': 0.7646100165300437, 'mlp_size_1': 1, 'mlp_size_2': 4, 'mlp_size_3': 0, 'kernel': 'Exponential', 'loss_name': 'AlternativeNLLLoss'}. Best is trial 861 with value: 0.7786620056496094.[0m
[32m[I 2022-04-18 16:27:11,712][0m Trial 894 finished with value: 0.7636745829483897 and parameters: {'n_hidden': 256, 'mixture_components': 10, 'use_sparse_layer': True, 'use_sparse_loss': True, 'lmbd': 2.262324814827666e-05, 'use_batchnorm': True, 'use_dropout': True, 'dropout': 0.7584524260724337, 'mlp_size_1': 1, 'mlp_size_2': 4, 'mlp_size_3': 0, 'kernel': 'LogNormal', 'loss_name': 'AlternativeNLLLoss'}. Best is trial 861 with value: 0.7786620056496094.[0m
[32m[I 2022-04-18 16:30:01,554][0m Trial 895 finished with value: 0.7650238738900853 and parameters: {'n_hidden': 256, 'mixture_components': 10, 'use_sparse_layer': True, 'use_sparse_loss': True, 'lmbd': 5.9318573379833607e-05, 'use_batchnorm': True, 'use_dropout': True, 'dropout': 0.7744532855103362, 'mlp_size_1': 1, 'mlp_size_2': 4, 'mlp_size_3': 0, 'kernel': 'Exponential', 'loss_name': 'AlternativeNLLLoss'}. Best is trial 861 with value: 0.7786620056496094.[0m
[32m[I 2022-04-18 16:32:39,751][0m Trial 896 finished with value: 0.7590289703035664 and parameters: {'n_hidden': 256, 'mixture_components': 10, 'use_sparse_layer': True, 'use_sparse_loss': True, 'lmbd': 3.6870987665939876e-05, 'use_batchnorm': True, 'use_dropout': True, 'dropout': 0.8208850722835163, 'mlp_size_1': 1, 'mlp_size_2': 4, 'mlp_size_3': 0, 'kernel': 'Exponential', 'loss_name': 'AlternativeNLLLoss'}. Best is trial 861 with value: 0.7786620056496094.[0m
[32m[I 2022-04-18 16:35:00,969][0m Trial 897 finished with value: 0.7514140754970557 and parameters: {'n_hidden': 256, 'mixture_components': 10, 'use_sparse_layer': True, 'use_sparse_loss': True, 'lmbd': 6.257816860125832e-06, 'use_batchnorm': True, 'use_dropout': True, 'dropout': 0.8580071627581943, 'mlp_size_1': 1, 'mlp_size_2': 4, 'mlp_size_3': 0, 'kernel': 'Exponential', 'loss_name': 'AlternativeNLLLoss'}. Best is trial 861 with value: 0.7786620056496094.[0m
[32m[I 2022-04-18 16:39:45,742][0m Trial 898 finished with value: 0.7078571448280271 and parameters: {'n_hidden': 256, 'mixture_components': 10, 'use_sparse_layer': True, 'use_sparse_loss': True, 'lmbd': 1.2820480967842511e-05, 'use_batchnorm': True, 'use_dropout': True, 'dropout': 0.7577294404974023, 'mlp_size_1': 1, 'mlp_size_2': 4, 'mlp_size_3': 0, 'kernel': 'Logistic', 'loss_name': 'AlternativeNLLLoss'}. Best is trial 861 with value: 0.7786620056496094.[0m
[32m[I 2022-04-18 16:42:33,931][0m Trial 899 finished with value: 0.7695127205707102 and parameters: {'n_hidden': 256, 'mixture_components': 10, 'use_sparse_layer': True, 'use_sparse_loss': True, 'lmbd': 1.6274957212836068e-05, 'use_batchnorm': True, 'use_dropout': True, 'dropout': 0.7888564468741769, 'mlp_size_1': 1, 'mlp_size_2': 4, 'mlp_size_3': 0, 'kernel': 'Exponential', 'loss_name': 'AlternativeNLLLoss'}. Best is trial 861 with value: 0.7786620056496094.[0m
[32m[I 2022-04-18 16:45:20,221][0m Trial 900 finished with value: 0.7658209334770908 and parameters: {'n_hidden': 256, 'mixture_components': 10, 'use_sparse_layer': True, 'use_sparse_loss': True, 'lmbd': 2.6531778863110292e-05, 'use_batchnorm': True, 'use_dropout': True, 'dropout': 0.8044126507231978, 'mlp_size_1': 1, 'mlp_size_2': 4, 'mlp_size_3': 0, 'kernel': 'Exponential', 'loss_name': 'AlternativeNLLLoss'}. Best is trial 861 with value: 0.7786620056496094.[0m
[32m[I 2022-04-18 16:48:19,393][0m Trial 901 finished with value: 0.770593971483684 and parameters: {'n_hidden': 256, 'mixture_components': 10, 'use_sparse_layer': True, 'use_sparse_loss': True, 'lmbd': 1.0119262312095926e-05, 'use_batchnorm': True, 'use_dropout': True, 'dropout': 0.7524748482106753, 'mlp_size_1': 1, 'mlp_size_2': 4, 'mlp_size_3': 0, 'kernel': 'Exponential', 'loss_name': 'AlternativeNLLLoss'}. Best is trial 861 with value: 0.7786620056496094.[0m
[32m[I 2022-04-18 16:51:12,118][0m Trial 902 finished with value: 0.7669796483261166 and parameters: {'n_hidden': 256, 'mixture_components': 10, 'use_sparse_layer': True, 'use_sparse_loss': True, 'lmbd': 1.9514000458791442e-05, 'use_batchnorm': True, 'use_dropout': True, 'dropout': 0.7803768869379635, 'mlp_size_1': 1, 'mlp_size_2': 4, 'mlp_size_3': 0, 'kernel': 'Exponential', 'loss_name': 'AlternativeNLLLoss'}. Best is trial 861 with value: 0.7786620056496094.[0m
[32m[I 2022-04-18 16:54:10,826][0m Trial 903 finished with value: 0.7737683050018968 and parameters: {'n_hidden': 256, 'mixture_components': 10, 'use_sparse_layer': True, 'use_sparse_loss': True, 'lmbd': 3.090708929479843e-05, 'use_batchnorm': True, 'use_dropout': True, 'dropout': 0.7494436831202935, 'mlp_size_1': 1, 'mlp_size_2': 4, 'mlp_size_3': 0, 'kernel': 'Exponential', 'loss_name': 'AlternativeNLLLoss'}. Best is trial 861 with value: 0.7786620056496094.[0m
[32m[I 2022-04-18 16:57:39,940][0m Trial 904 finished with value: 0.6216296712622315 and parameters: {'n_hidden': 256, 'mixture_components': 10, 'use_sparse_layer': True, 'use_sparse_loss': True, 'lmbd': 4.4770137035795905e-05, 'use_batchnorm': True, 'use_dropout': True, 'dropout': 0.7678541872108133, 'mlp_size_1': 1, 'mlp_size_2': 4, 'mlp_size_3': 0, 'kernel': 'Normal', 'loss_name': 'NLLLoss'}. Best is trial 861 with value: 0.7786620056496094.[0m
[32m[I 2022-04-18 17:00:28,121][0m Trial 905 finished with value: 0.7613296345572549 and parameters: {'n_hidden': 32, 'mixture_components': 10, 'use_sparse_layer': True, 'use_sparse_loss': True, 'lmbd': 0.00012696228076947255, 'use_batchnorm': True, 'use_dropout': False, 'mlp_size_1': 1, 'mlp_size_2': 0, 'mlp_size_3': 0, 'kernel': 'Exponential', 'loss_name': 'AlternativeNLLLoss'}. Best is trial 861 with value: 0.7786620056496094.[0m
[32m[I 2022-04-18 17:03:11,843][0m Trial 906 finished with value: 0.7681788967808733 and parameters: {'n_hidden': 256, 'mixture_components': 10, 'use_sparse_layer': True, 'use_sparse_loss': True, 'lmbd': 7.94901010965279e-06, 'use_batchnorm': True, 'use_dropout': True, 'dropout': 0.7982458056076528, 'mlp_size_1': 1, 'mlp_size_2': 4, 'mlp_size_3': 0, 'kernel': 'Exponential', 'loss_name': 'AlternativeNLLLoss'}. Best is trial 861 with value: 0.7786620056496094.[0m
[32m[I 2022-04-18 17:06:24,050][0m Trial 907 finished with value: 0.7713207670870936 and parameters: {'n_hidden': 256, 'mixture_components': 7, 'use_sparse_layer': True, 'use_sparse_loss': True, 'lmbd': 1.3946005958867573e-05, 'use_batchnorm': True, 'use_dropout': True, 'dropout': 0.74653717375525, 'mlp_size_1': 1, 'mlp_size_2': 4, 'mlp_size_3': 0, 'kernel': 'Exponential', 'loss_name': 'AlternativeNLLLoss'}. Best is trial 861 with value: 0.7786620056496094.[0m
[32m[I 2022-04-18 17:10:52,570][0m Trial 908 finished with value: 0.7123227602262705 and parameters: {'n_hidden': 256, 'mixture_components': 10, 'use_sparse_layer': True, 'use_sparse_loss': True, 'lmbd': 6.325510717014834e-05, 'use_batchnorm': True, 'use_dropout': True, 'dropout': 0.7762922276998376, 'mlp_size_1': 1, 'mlp_size_2': 4, 'mlp_size_3': 0, 'kernel': 'LogLogistic', 'loss_name': 'AlternativeNLLLoss'}. Best is trial 861 with value: 0.7786620056496094.[0m
[32m[I 2022-04-18 17:14:15,103][0m Trial 909 finished with value: 0.7337842783813382 and parameters: {'n_hidden': 2048, 'mixture_components': 10, 'use_sparse_layer': True, 'use_sparse_loss': True, 'lmbd': 2.2168963469624942e-05, 'use_batchnorm': True, 'use_dropout': True, 'dropout': 0.820608634227699, 'mlp_size_1': 0, 'mlp_size_2': 5, 'mlp_size_3': 3, 'kernel': 'Exponential', 'loss_name': 'AlternativeNLLLoss'}. Best is trial 861 with value: 0.7786620056496094.[0m
[32m[I 2022-04-18 17:16:30,476][0m Trial 910 finished with value: 0.6962423159947297 and parameters: {'n_hidden': 256, 'mixture_components': 10, 'use_sparse_layer': True, 'use_sparse_loss': True, 'lmbd': 3.974661682363461e-05, 'use_batchnorm': True, 'use_dropout': True, 'dropout': 0.7516047430683744, 'mlp_size_1': 1, 'mlp_size_2': 4, 'mlp_size_3': 0, 'kernel': 'Gamma', 'loss_name': 'AlternativeNLLLoss'}. Best is trial 861 with value: 0.7786620056496094.[0m
[32m[I 2022-04-18 17:19:35,117][0m Trial 911 finished with value: 0.7719068943928251 and parameters: {'n_hidden': 256, 'mixture_components': 10, 'use_sparse_layer': True, 'use_sparse_loss': True, 'lmbd': 1.7811547320526025e-05, 'use_batchnorm': True, 'use_dropout': True, 'dropout': 0.7857504584407616, 'mlp_size_1': 1, 'mlp_size_2': 4, 'mlp_size_3': 0, 'kernel': 'Exponential', 'loss_name': 'AlternativeNLLLoss'}. Best is trial 861 with value: 0.7786620056496094.[0m
[32m[I 2022-04-18 17:23:44,176][0m Trial 912 finished with value: 0.7610537793448422 and parameters: {'n_hidden': 512, 'mixture_components': 10, 'use_sparse_layer': True, 'use_sparse_loss': True, 'lmbd': 9.496219886851794e-06, 'use_batchnorm': True, 'use_dropout': True, 'dropout': 0.8461336627357232, 'mlp_size_1': 0, 'mlp_size_2': 4, 'mlp_size_3': 1, 'kernel': 'Exponential', 'loss_name': 'AlternativeNLLLoss'}. Best is trial 861 with value: 0.7786620056496094.[0m
[32m[I 2022-04-18 17:26:37,813][0m Trial 913 finished with value: 0.7711417025208519 and parameters: {'n_hidden': 256, 'mixture_components': 10, 'use_sparse_layer': True, 'use_sparse_loss': True, 'lmbd': 2.767909197426065e-05, 'use_batchnorm': True, 'use_dropout': True, 'dropout': 0.7615013395943122, 'mlp_size_1': 1, 'mlp_size_2': 4, 'mlp_size_3': 0, 'kernel': 'Exponential', 'loss_name': 'AlternativeNLLLoss'}. Best is trial 861 with value: 0.7786620056496094.[0m
