[32m[I 2022-04-13 12:58:20,806][0m Trial 384 finished with value: 0.7453091102287883 and parameters: {'alpha': 1.24191037804551, 'ties': 'breslow'}. Best is trial 183 with value: 0.7453989166660413.[0m
[32m[I 2022-04-13 12:58:22,103][0m Trial 385 finished with value: 0.7452024020829005 and parameters: {'alpha': 1.0128258959455243, 'ties': 'breslow'}. Best is trial 183 with value: 0.7453989166660413.[0m
[32m[I 2022-04-13 12:58:24,353][0m Trial 386 finished with value: 0.7449374105600131 and parameters: {'alpha': 1.4157145583937087, 'ties': 'breslow'}. Best is trial 183 with value: 0.7453989166660413.[0m
[32m[I 2022-04-13 12:58:26,871][0m Trial 387 finished with value: 0.7451625090249575 and parameters: {'alpha': 1.1557582436915106, 'ties': 'breslow'}. Best is trial 183 with value: 0.7453989166660413.[0m
[32m[I 2022-04-13 12:58:29,681][0m Trial 388 finished with value: 0.7453203345679345 and parameters: {'alpha': 1.2680479163686713, 'ties': 'breslow'}. Best is trial 183 with value: 0.7453989166660413.[0m
[32m[I 2022-04-13 12:58:31,161][0m Trial 389 finished with value: 0.7452339678370483 and parameters: {'alpha': 1.0792668713210076, 'ties': 'breslow'}. Best is trial 183 with value: 0.7453989166660413.[0m
[32m[I 2022-04-13 12:58:32,659][0m Trial 390 finished with value: 0.7452099969584014 and parameters: {'alpha': 1.3103242507276955, 'ties': 'breslow'}. Best is trial 183 with value: 0.7453989166660413.[0m
[32m[I 2022-04-13 12:58:35,078][0m Trial 391 finished with value: 0.7450198441111991 and parameters: {'alpha': 1.5523978940495176, 'ties': 'breslow'}. Best is trial 183 with value: 0.7453989166660413.[0m
[32m[I 2022-04-13 12:58:37,896][0m Trial 392 finished with value: 0.7452305971210986 and parameters: {'alpha': 1.1853655426583989, 'ties': 'breslow'}. Best is trial 183 with value: 0.7453989166660413.[0m
[32m[I 2022-04-13 12:58:40,453][0m Trial 393 finished with value: 0.7449987460791059 and parameters: {'alpha': 1.3999781355518561, 'ties': 'breslow'}. Best is trial 183 with value: 0.7453989166660413.[0m
[32m[I 2022-04-13 12:58:42,097][0m Trial 394 finished with value: 0.7430552203339671 and parameters: {'alpha': 0.15818643590998183, 'ties': 'breslow'}. Best is trial 183 with value: 0.7453989166660413.[0m
[32m[I 2022-04-13 12:58:43,301][0m Trial 395 finished with value: 0.7453570910428045 and parameters: {'alpha': 1.2290270057305142, 'ties': 'breslow'}. Best is trial 183 with value: 0.7453989166660413.[0m
[32m[I 2022-04-13 12:58:45,563][0m Trial 396 finished with value: 0.7452847178201967 and parameters: {'alpha': 0.9640793237214058, 'ties': 'breslow'}. Best is trial 183 with value: 0.7453989166660413.[0m
[32m[I 2022-04-13 12:58:47,965][0m Trial 397 finished with value: 0.7452526080614736 and parameters: {'alpha': 1.1345336816722227, 'ties': 'breslow'}. Best is trial 183 with value: 0.7453989166660413.[0m
[32m[I 2022-04-13 12:58:50,395][0m Trial 398 finished with value: 0.7450326612286032 and parameters: {'alpha': 0.8316287729108206, 'ties': 'efron'}. Best is trial 183 with value: 0.7453989166660413.[0m
[32m[I 2022-04-13 12:58:54,536][0m Trial 399 finished with value: 0.7450480300433827 and parameters: {'alpha': 1.3359191937260886, 'ties': 'breslow'}. Best is trial 183 with value: 0.7453989166660413.[0m
[32m[I 2022-04-13 12:58:58,132][0m Trial 400 finished with value: 0.7449624535043116 and parameters: {'alpha': 1.4728978180501244, 'ties': 'breslow'}. Best is trial 183 with value: 0.7453989166660413.[0m
[32m[I 2022-04-13 12:59:01,016][0m Trial 401 finished with value: 0.7451690929668211 and parameters: {'alpha': 1.1915116830391708, 'ties': 'breslow'}. Best is trial 183 with value: 0.7453989166660413.[0m
[32m[I 2022-04-13 12:59:04,390][0m Trial 402 finished with value: 0.7435231677805539 and parameters: {'alpha': 0.43616332790160817, 'ties': 'breslow'}. Best is trial 183 with value: 0.7453989166660413.[0m
[32m[I 2022-04-13 12:59:09,482][0m Trial 403 finished with value: 0.745154727183486 and parameters: {'alpha': 1.0550236267689965, 'ties': 'breslow'}. Best is trial 183 with value: 0.7453989166660413.[0m
[32m[I 2022-04-13 12:59:12,869][0m Trial 404 finished with value: 0.7452214994839786 and parameters: {'alpha': 1.3075516280341253, 'ties': 'breslow'}. Best is trial 183 with value: 0.7453989166660413.[0m
[32m[I 2022-04-13 12:59:16,598][0m Trial 405 finished with value: 0.745337786128796 and parameters: {'alpha': 1.2213168866925237, 'ties': 'breslow'}. Best is trial 183 with value: 0.7453989166660413.[0m
[32m[I 2022-04-13 12:59:20,139][0m Trial 406 finished with value: 0.7448976432296692 and parameters: {'alpha': 1.857112367363806, 'ties': 'breslow'}. Best is trial 183 with value: 0.7453989166660413.[0m
[32m[I 2022-04-13 12:59:23,457][0m Trial 407 finished with value: 0.7452452688385873 and parameters: {'alpha': 1.0815044174749189, 'ties': 'breslow'}. Best is trial 183 with value: 0.7453989166660413.[0m
[32m[I 2022-04-13 12:59:26,634][0m Trial 408 finished with value: 0.7452504539223052 and parameters: {'alpha': 1.2014065192754093, 'ties': 'breslow'}. Best is trial 183 with value: 0.7453989166660413.[0m
[32m[I 2022-04-13 12:59:29,765][0m Trial 409 finished with value: 0.7449459362392495 and parameters: {'alpha': 1.4095863491401177, 'ties': 'breslow'}. Best is trial 183 with value: 0.7453989166660413.[0m
[32m[I 2022-04-13 12:59:33,039][0m Trial 410 finished with value: 0.7452874966620713 and parameters: {'alpha': 0.9708482417157659, 'ties': 'breslow'}. Best is trial 183 with value: 0.7453989166660413.[0m
[32m[I 2022-04-13 12:59:36,808][0m Trial 411 finished with value: 0.7452748865683528 and parameters: {'alpha': 1.274088906887748, 'ties': 'breslow'}. Best is trial 183 with value: 0.7453989166660413.[0m
[32m[I 2022-04-13 12:59:39,735][0m Trial 412 finished with value: 0.7452316731552189 and parameters: {'alpha': 1.1296904608473715, 'ties': 'breslow'}. Best is trial 183 with value: 0.7453989166660413.[0m
[32m[I 2022-04-13 12:59:42,793][0m Trial 413 finished with value: 0.7450496718524804 and parameters: {'alpha': 1.3385445098975992, 'ties': 'breslow'}. Best is trial 183 with value: 0.7453989166660413.[0m
[32m[I 2022-04-13 12:59:45,424][0m Trial 414 finished with value: 0.7453570910428045 and parameters: {'alpha': 1.2278335736524202, 'ties': 'breslow'}. Best is trial 183 with value: 0.7453989166660413.[0m
[32m[I 2022-04-13 12:59:48,951][0m Trial 415 finished with value: 0.745182246065808 and parameters: {'alpha': 1.1897186654190905, 'ties': 'breslow'}. Best is trial 183 with value: 0.7453989166660413.[0m
[32m[I 2022-04-13 12:59:52,090][0m Trial 416 finished with value: 0.7452000999240946 and parameters: {'alpha': 1.0270175331852935, 'ties': 'breslow'}. Best is trial 183 with value: 0.7453989166660413.[0m
[32m[I 2022-04-13 12:59:54,830][0m Trial 417 finished with value: 0.744928724056086 and parameters: {'alpha': 1.4834831431089337, 'ties': 'breslow'}. Best is trial 183 with value: 0.7453989166660413.[0m
[32m[I 2022-04-13 12:59:58,082][0m Trial 418 finished with value: 0.7453483327259411 and parameters: {'alpha': 1.23140701297125, 'ties': 'breslow'}. Best is trial 183 with value: 0.7453989166660413.[0m
[32m[I 2022-04-13 13:00:02,177][0m Trial 419 finished with value: 0.7451803728977665 and parameters: {'alpha': 1.117076819906153, 'ties': 'efron'}. Best is trial 183 with value: 0.7453989166660413.[0m
[32m[I 2022-04-13 13:00:06,215][0m Trial 420 finished with value: 0.7453454108905417 and parameters: {'alpha': 1.219065722816452, 'ties': 'breslow'}. Best is trial 183 with value: 0.7453989166660413.[0m
[32m[I 2022-04-13 13:00:09,354][0m Trial 421 finished with value: 0.7452358304130776 and parameters: {'alpha': 0.9479759664436835, 'ties': 'breslow'}. Best is trial 183 with value: 0.7453989166660413.[0m
[32m[I 2022-04-13 13:00:12,130][0m Trial 422 finished with value: 0.7452392408282164 and parameters: {'alpha': 1.210465577195291, 'ties': 'breslow'}. Best is trial 183 with value: 0.7453989166660413.[0m
[32m[I 2022-04-13 13:00:14,470][0m Trial 423 finished with value: 0.7452148583401925 and parameters: {'alpha': 1.0776551566032757, 'ties': 'breslow'}. Best is trial 183 with value: 0.7453989166660413.[0m
[32m[I 2022-04-13 13:00:17,496][0m Trial 424 finished with value: 0.7450507765216705 and parameters: {'alpha': 1.3529872676204482, 'ties': 'breslow'}. Best is trial 183 with value: 0.7453989166660413.[0m
[32m[I 2022-04-13 13:00:20,470][0m Trial 425 finished with value: 0.7453282106586034 and parameters: {'alpha': 1.2623178386037028, 'ties': 'breslow'}. Best is trial 183 with value: 0.7453989166660413.[0m
[32m[I 2022-04-13 13:00:24,627][0m Trial 426 finished with value: 0.7452007770911889 and parameters: {'alpha': 1.1260582005502722, 'ties': 'breslow'}. Best is trial 183 with value: 0.7453989166660413.[0m
[32m[I 2022-04-13 13:00:28,518][0m Trial 427 finished with value: 0.7449036561701555 and parameters: {'alpha': 1.4176073882243487, 'ties': 'breslow'}. Best is trial 183 with value: 0.7453989166660413.[0m
[32m[I 2022-04-13 13:00:31,878][0m Trial 428 finished with value: 0.7449847010201835 and parameters: {'alpha': 1.5796113702596881, 'ties': 'breslow'}. Best is trial 183 with value: 0.7453989166660413.[0m
[32m[I 2022-04-13 13:00:35,067][0m Trial 429 finished with value: 0.745409816487361 and parameters: {'alpha': 1.2126152404223869, 'ties': 'breslow'}. Best is trial 429 with value: 0.745409816487361.[0m
[32m[I 2022-04-13 13:00:37,909][0m Trial 430 finished with value: 0.7451834234032076 and parameters: {'alpha': 1.0079753766390918, 'ties': 'breslow'}. Best is trial 429 with value: 0.745409816487361.[0m
[32m[I 2022-04-13 13:00:42,137][0m Trial 431 finished with value: 0.7450977458536305 and parameters: {'alpha': 0.8339048197943484, 'ties': 'breslow'}. Best is trial 429 with value: 0.745409816487361.[0m
[32m[I 2022-04-13 13:00:45,377][0m Trial 432 finished with value: 0.7452065493155066 and parameters: {'alpha': 1.3147079112484341, 'ties': 'breslow'}. Best is trial 429 with value: 0.745409816487361.[0m
[32m[I 2022-04-13 13:00:48,999][0m Trial 433 finished with value: 0.7451822431136589 and parameters: {'alpha': 1.159994807241215, 'ties': 'breslow'}. Best is trial 429 with value: 0.745409816487361.[0m
[32m[I 2022-04-13 13:00:52,058][0m Trial 434 finished with value: 0.7452396919595836 and parameters: {'alpha': 1.1882567002746174, 'ties': 'breslow'}. Best is trial 429 with value: 0.745409816487361.[0m
[32m[I 2022-04-13 13:00:54,608][0m Trial 435 finished with value: 0.7451325263075395 and parameters: {'alpha': 1.05248993551343, 'ties': 'breslow'}. Best is trial 429 with value: 0.745409816487361.[0m
[32m[I 2022-04-13 13:00:58,189][0m Trial 436 finished with value: 0.7452065493155066 and parameters: {'alpha': 1.313946786965819, 'ties': 'breslow'}. Best is trial 429 with value: 0.745409816487361.[0m
[32m[I 2022-04-13 13:01:02,142][0m Trial 437 finished with value: 0.7449653625894417 and parameters: {'alpha': 1.4233566669136204, 'ties': 'breslow'}. Best is trial 429 with value: 0.745409816487361.[0m
[32m[I 2022-04-13 13:01:05,077][0m Trial 438 finished with value: 0.745218438029657 and parameters: {'alpha': 1.1801392369669355, 'ties': 'breslow'}. Best is trial 429 with value: 0.745409816487361.[0m
[32m[I 2022-04-13 13:01:09,310][0m Trial 439 finished with value: 0.7453397331622917 and parameters: {'alpha': 1.2544629958538085, 'ties': 'breslow'}. Best is trial 429 with value: 0.745409816487361.[0m
[32m[I 2022-04-13 13:01:13,761][0m Trial 440 finished with value: 0.7452081308614769 and parameters: {'alpha': 0.9058599344052397, 'ties': 'efron'}. Best is trial 429 with value: 0.745409816487361.[0m
[32m[I 2022-04-13 13:01:18,182][0m Trial 441 finished with value: 0.7451579026067834 and parameters: {'alpha': 1.0903955006619304, 'ties': 'breslow'}. Best is trial 429 with value: 0.745409816487361.[0m
[32m[I 2022-04-13 13:01:21,456][0m Trial 442 finished with value: 0.7452042423051831 and parameters: {'alpha': 1.319324637127021, 'ties': 'breslow'}. Best is trial 429 with value: 0.745409816487361.[0m
[32m[I 2022-04-13 13:01:23,882][0m Trial 443 finished with value: 0.7448226971911794 and parameters: {'alpha': 1.978090947825013, 'ties': 'breslow'}. Best is trial 429 with value: 0.745409816487361.[0m
[32m[I 2022-04-13 13:01:26,157][0m Trial 444 finished with value: 0.745323663778475 and parameters: {'alpha': 1.2374623146988268, 'ties': 'breslow'}. Best is trial 429 with value: 0.745409816487361.[0m
[32m[I 2022-04-13 13:01:28,572][0m Trial 445 finished with value: 0.7449588308277046 and parameters: {'alpha': 1.4861516280182516, 'ties': 'breslow'}. Best is trial 429 with value: 0.745409816487361.[0m
[32m[I 2022-04-13 13:01:32,376][0m Trial 446 finished with value: 0.7449492106213075 and parameters: {'alpha': 1.3886644180904886, 'ties': 'breslow'}. Best is trial 429 with value: 0.745409816487361.[0m
[32m[I 2022-04-13 13:01:36,167][0m Trial 447 finished with value: 0.7452007770911889 and parameters: {'alpha': 1.1248197247288585, 'ties': 'breslow'}. Best is trial 429 with value: 0.745409816487361.[0m
[32m[I 2022-04-13 13:01:40,003][0m Trial 448 finished with value: 0.7452000999240946 and parameters: {'alpha': 1.0270142974062297, 'ties': 'breslow'}. Best is trial 429 with value: 0.745409816487361.[0m
[32m[I 2022-04-13 13:01:44,179][0m Trial 449 finished with value: 0.7453212759512853 and parameters: {'alpha': 1.2469652002323173, 'ties': 'breslow'}. Best is trial 429 with value: 0.745409816487361.[0m
[32m[I 2022-04-13 13:01:47,139][0m Trial 450 finished with value: 0.745030762917659 and parameters: {'alpha': 1.3418005243278293, 'ties': 'breslow'}. Best is trial 429 with value: 0.745409816487361.[0m
[32m[I 2022-04-13 13:01:50,816][0m Trial 451 finished with value: 0.745409816487361 and parameters: {'alpha': 1.2130739510699728, 'ties': 'breslow'}. Best is trial 429 with value: 0.745409816487361.[0m
[32m[I 2022-04-13 13:01:54,334][0m Trial 452 finished with value: 0.7451722927625787 and parameters: {'alpha': 1.1623615594704289, 'ties': 'breslow'}. Best is trial 429 with value: 0.745409816487361.[0m
[32m[I 2022-04-13 13:01:58,871][0m Trial 453 finished with value: 0.7451778849371689 and parameters: {'alpha': 0.9965688244871285, 'ties': 'breslow'}. Best is trial 429 with value: 0.745409816487361.[0m
[32m[I 2022-04-13 13:02:02,268][0m Trial 454 finished with value: 0.7446770279112691 and parameters: {'alpha': 0.6943800516721562, 'ties': 'breslow'}. Best is trial 429 with value: 0.745409816487361.[0m
[32m[I 2022-04-13 13:02:05,122][0m Trial 455 finished with value: 0.7449348529496217 and parameters: {'alpha': 1.4967781595396938, 'ties': 'breslow'}. Best is trial 429 with value: 0.745409816487361.[0m
[32m[I 2022-04-13 13:02:08,298][0m Trial 456 finished with value: 0.7452313972162156 and parameters: {'alpha': 1.3036571217855486, 'ties': 'breslow'}. Best is trial 429 with value: 0.745409816487361.[0m
[32m[I 2022-04-13 13:02:10,909][0m Trial 457 finished with value: 0.7451386653194898 and parameters: {'alpha': 1.0994944698725762, 'ties': 'breslow'}. Best is trial 429 with value: 0.745409816487361.[0m
[32m[I 2022-04-13 13:02:14,966][0m Trial 458 finished with value: 0.7449987460791059 and parameters: {'alpha': 1.4008633720099657, 'ties': 'breslow'}. Best is trial 429 with value: 0.745409816487361.[0m
[32m[I 2022-04-13 13:02:19,336][0m Trial 459 finished with value: 0.7453346640339357 and parameters: {'alpha': 1.2399856033791834, 'ties': 'efron'}. Best is trial 429 with value: 0.745409816487361.[0m
[32m[I 2022-04-13 13:02:22,600][0m Trial 460 finished with value: 0.7451527595717933 and parameters: {'alpha': 1.1572245427695984, 'ties': 'breslow'}. Best is trial 429 with value: 0.745409816487361.[0m
[32m[I 2022-04-13 13:02:26,013][0m Trial 461 finished with value: 0.7448176116155251 and parameters: {'alpha': 1.643936270506634, 'ties': 'breslow'}. Best is trial 429 with value: 0.745409816487361.[0m
[32m[I 2022-04-13 13:02:29,008][0m Trial 462 finished with value: 0.7452146207920454 and parameters: {'alpha': 0.9261062109870464, 'ties': 'breslow'}. Best is trial 429 with value: 0.745409816487361.[0m
[32m[I 2022-04-13 13:02:32,203][0m Trial 463 finished with value: 0.7451269026716786 and parameters: {'alpha': 1.3238263943564479, 'ties': 'breslow'}. Best is trial 429 with value: 0.745409816487361.[0m
[32m[I 2022-04-13 13:02:35,413][0m Trial 464 finished with value: 0.7451325263075395 and parameters: {'alpha': 1.0521492820275342, 'ties': 'breslow'}. Best is trial 429 with value: 0.745409816487361.[0m
[32m[I 2022-04-13 13:02:38,346][0m Trial 465 finished with value: 0.7453463118080326 and parameters: {'alpha': 1.2212438592940578, 'ties': 'breslow'}. Best is trial 429 with value: 0.745409816487361.[0m
[32m[I 2022-04-13 13:02:40,469][0m Trial 466 finished with value: 0.7451495882341788 and parameters: {'alpha': 1.1727255880765013, 'ties': 'breslow'}. Best is trial 429 with value: 0.745409816487361.[0m
[32m[I 2022-04-13 13:02:43,594][0m Trial 467 finished with value: 0.7449942566219682 and parameters: {'alpha': 1.396623057650201, 'ties': 'breslow'}. Best is trial 429 with value: 0.745409816487361.[0m
[32m[I 2022-04-13 13:02:45,880][0m Trial 468 finished with value: 0.739859574959732 and parameters: {'alpha': 3.979751329209452, 'ties': 'breslow'}. Best is trial 429 with value: 0.745409816487361.[0m
[32m[I 2022-04-13 13:02:49,454][0m Trial 469 finished with value: 0.7453570910428045 and parameters: {'alpha': 1.2289086628835855, 'ties': 'breslow'}. Best is trial 429 with value: 0.745409816487361.[0m
[32m[I 2022-04-13 13:02:53,349][0m Trial 470 finished with value: 0.7452243871572837 and parameters: {'alpha': 1.079189574407593, 'ties': 'breslow'}. Best is trial 429 with value: 0.745409816487361.[0m
[32m[I 2022-04-13 13:02:57,193][0m Trial 471 finished with value: 0.745331877118789 and parameters: {'alpha': 1.2672724218532223, 'ties': 'breslow'}. Best is trial 429 with value: 0.745409816487361.[0m
[32m[I 2022-04-13 13:03:01,100][0m Trial 472 finished with value: 0.7452715004988285 and parameters: {'alpha': 0.9806710935067846, 'ties': 'breslow'}. Best is trial 429 with value: 0.745409816487361.[0m
[32m[I 2022-04-13 13:03:04,834][0m Trial 473 finished with value: 0.7451822431136589 and parameters: {'alpha': 1.1586662938834413, 'ties': 'breslow'}. Best is trial 429 with value: 0.745409816487361.[0m
[32m[I 2022-04-13 13:03:07,623][0m Trial 474 finished with value: 0.7450533278378381 and parameters: {'alpha': 1.3255118205405763, 'ties': 'breslow'}. Best is trial 429 with value: 0.745409816487361.[0m
[32m[I 2022-04-13 13:03:12,713][0m Trial 475 finished with value: 0.744928724056086 and parameters: {'alpha': 1.4827768639290255, 'ties': 'breslow'}. Best is trial 429 with value: 0.745409816487361.[0m
[32m[I 2022-04-13 13:03:16,911][0m Trial 476 finished with value: 0.7453570910428045 and parameters: {'alpha': 1.229265463561787, 'ties': 'breslow'}. Best is trial 429 with value: 0.745409816487361.[0m
[32m[I 2022-04-13 13:03:20,364][0m Trial 477 finished with value: 0.7451857978419496 and parameters: {'alpha': 1.1229274608608835, 'ties': 'breslow'}. Best is trial 429 with value: 0.745409816487361.[0m
[32m[I 2022-04-13 13:03:23,746][0m Trial 478 finished with value: 0.7450261450372169 and parameters: {'alpha': 1.0400996079594882, 'ties': 'breslow'}. Best is trial 429 with value: 0.745409816487361.[0m
[32m[I 2022-04-13 13:03:26,982][0m Trial 479 finished with value: 0.7453463118080326 and parameters: {'alpha': 1.2202228400216573, 'ties': 'breslow'}. Best is trial 429 with value: 0.745409816487361.[0m
[32m[I 2022-04-13 13:03:29,787][0m Trial 480 finished with value: 0.7450186265781552 and parameters: {'alpha': 0.8251142610944804, 'ties': 'breslow'}. Best is trial 429 with value: 0.745409816487361.[0m
[32m[I 2022-04-13 13:03:34,467][0m Trial 481 finished with value: 0.7451639261001575 and parameters: {'alpha': 1.191218186465832, 'ties': 'efron'}. Best is trial 429 with value: 0.745409816487361.[0m
[32m[I 2022-04-13 13:03:37,519][0m Trial 482 finished with value: 0.74399678154269 and parameters: {'alpha': 2.3697813397650083, 'ties': 'breslow'}. Best is trial 429 with value: 0.745409816487361.[0m
[32m[I 2022-04-13 13:03:40,734][0m Trial 483 finished with value: 0.7450015510027103 and parameters: {'alpha': 1.3723389943507827, 'ties': 'breslow'}. Best is trial 429 with value: 0.745409816487361.[0m
[32m[I 2022-04-13 13:03:44,396][0m Trial 484 finished with value: 0.7451849579818677 and parameters: {'alpha': 1.0726566300001612, 'ties': 'breslow'}. Best is trial 429 with value: 0.745409816487361.[0m
[32m[I 2022-04-13 13:03:47,913][0m Trial 485 finished with value: 0.7452311642700232 and parameters: {'alpha': 1.2037676618730848, 'ties': 'breslow'}. Best is trial 429 with value: 0.745409816487361.[0m
[32m[I 2022-04-13 13:03:51,188][0m Trial 486 finished with value: 0.7453006528406327 and parameters: {'alpha': 0.958977146667334, 'ties': 'breslow'}. Best is trial 429 with value: 0.745409816487361.[0m
[32m[I 2022-04-13 13:03:53,249][0m Trial 487 finished with value: 0.7452174290497625 and parameters: {'alpha': 1.3169911552895124, 'ties': 'breslow'}. Best is trial 429 with value: 0.745409816487361.[0m
[32m[I 2022-04-13 13:03:57,020][0m Trial 488 finished with value: 0.7450004090313975 and parameters: {'alpha': 1.5531436527491531, 'ties': 'breslow'}. Best is trial 429 with value: 0.745409816487361.[0m
[32m[I 2022-04-13 13:04:01,003][0m Trial 489 finished with value: 0.7452429572865894 and parameters: {'alpha': 1.1315349708932956, 'ties': 'breslow'}. Best is trial 429 with value: 0.745409816487361.[0m
