[32m[I 2022-04-13 12:01:23,657][0m Trial 664 finished with value: 0.5801808250038585 and parameters: {'splitter': 'best', 'min_samples_split': 0.09002939529384181, 'min_samples_leaf': 0.03934132585528746, 'min_weight_fraction_leaf': 0.13343938807494587, 'max_features': 0.9823202951308867}. Best is trial 448 with value: 0.8888507593246218.[0m
/media/san2_ssd/data/Workdir/survival/utils.py:305: RuntimeWarning: invalid value encountered in true_divide
  pdfs = np.gradient(1-survs,axis=1)/norms
/media/san2_ssd/data/Workdir/survival/utils.py:305: RuntimeWarning: invalid value encountered in true_divide
  pdfs = np.gradient(1-survs,axis=1)/norms
/media/san2_ssd/data/Workdir/survival/utils.py:305: RuntimeWarning: invalid value encountered in true_divide
  pdfs = np.gradient(1-survs,axis=1)/norms
[32m[I 2022-04-13 12:01:24,779][0m Trial 665 finished with value: 0.8854960649840372 and parameters: {'splitter': 'best', 'min_samples_split': 0.07024581865445673, 'min_samples_leaf': 0.047417728711912605, 'min_weight_fraction_leaf': 0.04857308912441772, 'max_features': 0.9814134622013547}. Best is trial 448 with value: 0.8888507593246218.[0m
/media/san2_ssd/data/Workdir/survival/utils.py:305: RuntimeWarning: invalid value encountered in true_divide
  pdfs = np.gradient(1-survs,axis=1)/norms
/media/san2_ssd/data/Workdir/survival/utils.py:305: RuntimeWarning: invalid value encountered in true_divide
  pdfs = np.gradient(1-survs,axis=1)/norms
/media/san2_ssd/data/Workdir/survival/utils.py:305: RuntimeWarning: invalid value encountered in true_divide
  pdfs = np.gradient(1-survs,axis=1)/norms
/media/san2_ssd/data/Workdir/survival/utils.py:305: RuntimeWarning: invalid value encountered in true_divide
  pdfs = np.gradient(1-survs,axis=1)/norms
/media/san2_ssd/data/Workdir/survival/utils.py:305: RuntimeWarning: invalid value encountered in true_divide
  pdfs = np.gradient(1-survs,axis=1)/norms
[32m[I 2022-04-13 12:01:27,231][0m Trial 666 finished with value: 0.8852976990504038 and parameters: {'splitter': 'best', 'min_samples_split': 0.10688399700193715, 'min_samples_leaf': 0.036032179166898895, 'min_weight_fraction_leaf': 0.04413911831600622, 'max_features': 0.9382675153709313}. Best is trial 448 with value: 0.8888507593246218.[0m
/media/san2_ssd/data/Workdir/survival/utils.py:305: RuntimeWarning: invalid value encountered in true_divide
  pdfs = np.gradient(1-survs,axis=1)/norms
[32m[I 2022-04-13 12:01:29,447][0m Trial 667 finished with value: 0.8835526022431452 and parameters: {'splitter': 'best', 'min_samples_split': 0.14062603451159628, 'min_samples_leaf': 0.03194776678986728, 'min_weight_fraction_leaf': 0.05338257493528094, 'max_features': 0.9645306332960916}. Best is trial 448 with value: 0.8888507593246218.[0m
/media/san2_ssd/data/Workdir/survival/utils.py:305: RuntimeWarning: invalid value encountered in true_divide
  pdfs = np.gradient(1-survs,axis=1)/norms
/media/san2_ssd/data/Workdir/survival/utils.py:305: RuntimeWarning: invalid value encountered in true_divide
  pdfs = np.gradient(1-survs,axis=1)/norms
[32m[I 2022-04-13 12:01:30,899][0m Trial 668 finished with value: 0.8853441609663877 and parameters: {'splitter': 'best', 'min_samples_split': 0.12117969744634757, 'min_samples_leaf': 0.056490568401969296, 'min_weight_fraction_leaf': 0.03866165485365579, 'max_features': 0.9815871471995454}. Best is trial 448 with value: 0.8888507593246218.[0m
/media/san2_ssd/data/Workdir/survival/utils.py:305: RuntimeWarning: invalid value encountered in true_divide
  pdfs = np.gradient(1-survs,axis=1)/norms
/media/san2_ssd/data/Workdir/survival/utils.py:305: RuntimeWarning: invalid value encountered in true_divide
  pdfs = np.gradient(1-survs,axis=1)/norms
/media/san2_ssd/data/Workdir/survival/utils.py:305: RuntimeWarning: invalid value encountered in true_divide
  pdfs = np.gradient(1-survs,axis=1)/norms
/media/san2_ssd/data/Workdir/survival/utils.py:305: RuntimeWarning: invalid value encountered in true_divide
  pdfs = np.gradient(1-survs,axis=1)/norms
[32m[I 2022-04-13 12:01:33,468][0m Trial 669 finished with value: 0.8877004634541252 and parameters: {'splitter': 'best', 'min_samples_split': 0.09923693267551376, 'min_samples_leaf': 0.04532528936518193, 'min_weight_fraction_leaf': 0.036182372572281664, 'max_features': 0.9991086182991826}. Best is trial 448 with value: 0.8888507593246218.[0m
/media/san2_ssd/data/Workdir/survival/utils.py:305: RuntimeWarning: invalid value encountered in true_divide
  pdfs = np.gradient(1-survs,axis=1)/norms
[32m[I 2022-04-13 12:01:35,348][0m Trial 670 finished with value: 0.7846332924217666 and parameters: {'splitter': 'best', 'min_samples_split': 0.11165790515330813, 'min_samples_leaf': 0.06388377752376251, 'min_weight_fraction_leaf': 0.0635897650463321, 'max_features': 0.9987060487327221}. Best is trial 448 with value: 0.8888507593246218.[0m
/media/san2_ssd/data/Workdir/survival/utils.py:305: RuntimeWarning: invalid value encountered in true_divide
  pdfs = np.gradient(1-survs,axis=1)/norms
/media/san2_ssd/data/Workdir/survival/utils.py:305: RuntimeWarning: invalid value encountered in true_divide
  pdfs = np.gradient(1-survs,axis=1)/norms
/media/san2_ssd/data/Workdir/survival/utils.py:305: RuntimeWarning: invalid value encountered in true_divide
  pdfs = np.gradient(1-survs,axis=1)/norms
[32m[I 2022-04-13 12:01:38,323][0m Trial 671 finished with value: 0.8854912790244963 and parameters: {'splitter': 'best', 'min_samples_split': 0.10083203929133383, 'min_samples_leaf': 0.05347726132006642, 'min_weight_fraction_leaf': 0.04761944005263559, 'max_features': 0.9831451985540925}. Best is trial 448 with value: 0.8888507593246218.[0m
/media/san2_ssd/data/Workdir/survival/utils.py:305: RuntimeWarning: invalid value encountered in true_divide
  pdfs = np.gradient(1-survs,axis=1)/norms
/media/san2_ssd/data/Workdir/survival/utils.py:305: RuntimeWarning: invalid value encountered in true_divide
  pdfs = np.gradient(1-survs,axis=1)/norms
/media/san2_ssd/data/Workdir/survival/utils.py:305: RuntimeWarning: invalid value encountered in true_divide
  pdfs = np.gradient(1-survs,axis=1)/norms
[32m[I 2022-04-13 12:01:40,905][0m Trial 672 finished with value: 0.881863467381676 and parameters: {'splitter': 'best', 'min_samples_split': 0.1288191940623034, 'min_samples_leaf': 0.04685800884591005, 'min_weight_fraction_leaf': 0.03931564313187638, 'max_features': 0.9616524960675098}. Best is trial 448 with value: 0.8888507593246218.[0m
[32m[I 2022-04-13 12:01:41,658][0m Trial 673 finished with value: 0.6973123945546231 and parameters: {'splitter': 'best', 'min_samples_split': 0.1133404037548689, 'min_samples_leaf': 0.44947102160034247, 'min_weight_fraction_leaf': 0.08059549784698725, 'max_features': 0.9984792185152236}. Best is trial 448 with value: 0.8888507593246218.[0m
[32m[I 2022-04-13 12:01:44,413][0m Trial 674 finished with value: 0.8840445658458073 and parameters: {'splitter': 'best', 'min_samples_split': 0.12257161485766352, 'min_samples_leaf': 0.06856172859922677, 'min_weight_fraction_leaf': 0.05225165513653343, 'max_features': 0.9989569699634022}. Best is trial 448 with value: 0.8888507593246218.[0m
/media/san2_ssd/data/Workdir/survival/utils.py:305: RuntimeWarning: invalid value encountered in true_divide
  pdfs = np.gradient(1-survs,axis=1)/norms
/media/san2_ssd/data/Workdir/survival/utils.py:305: RuntimeWarning: invalid value encountered in true_divide
  pdfs = np.gradient(1-survs,axis=1)/norms
/media/san2_ssd/data/Workdir/survival/utils.py:305: RuntimeWarning: invalid value encountered in true_divide
  pdfs = np.gradient(1-survs,axis=1)/norms
/media/san2_ssd/data/Workdir/survival/utils.py:305: RuntimeWarning: invalid value encountered in true_divide
  pdfs = np.gradient(1-survs,axis=1)/norms
[32m[I 2022-04-13 12:01:46,988][0m Trial 675 finished with value: 0.8827448474193792 and parameters: {'splitter': 'best', 'min_samples_split': 0.10197648223764379, 'min_samples_leaf': 0.04587994982797614, 'min_weight_fraction_leaf': 0.03397336453614393, 'max_features': 0.9684294987421742}. Best is trial 448 with value: 0.8888507593246218.[0m
[32m[I 2022-04-13 12:01:48,393][0m Trial 676 finished with value: 0.4505336637110111 and parameters: {'splitter': 'best', 'min_samples_split': 0.49787814108448225, 'min_samples_leaf': 0.039955060466159056, 'min_weight_fraction_leaf': 0.05796848710005575, 'max_features': 0.9447686899278753}. Best is trial 448 with value: 0.8888507593246218.[0m
/media/san2_ssd/data/Workdir/survival/utils.py:305: RuntimeWarning: invalid value encountered in true_divide
  pdfs = np.gradient(1-survs,axis=1)/norms
/media/san2_ssd/data/Workdir/survival/utils.py:305: RuntimeWarning: invalid value encountered in true_divide
  pdfs = np.gradient(1-survs,axis=1)/norms
[32m[I 2022-04-13 12:01:49,334][0m Trial 677 finished with value: 0.8857747639504467 and parameters: {'splitter': 'best', 'min_samples_split': 0.11359515870531388, 'min_samples_leaf': 0.05969095798557191, 'min_weight_fraction_leaf': 0.04188211447643553, 'max_features': 0.9800209283532114}. Best is trial 448 with value: 0.8888507593246218.[0m
[32m[I 2022-04-13 12:01:49,550][0m Trial 678 finished with value: 0.7762161662305487 and parameters: {'splitter': 'random', 'min_samples_split': 0.15159926410397348, 'min_samples_leaf': 0.034702103534426695, 'min_weight_fraction_leaf': 0.030465783141045574, 'max_features': 0.9999473758923664}. Best is trial 448 with value: 0.8888507593246218.[0m
/media/san2_ssd/data/Workdir/survival/utils.py:305: RuntimeWarning: invalid value encountered in true_divide
  pdfs = np.gradient(1-survs,axis=1)/norms
/media/san2_ssd/data/Workdir/survival/utils.py:305: RuntimeWarning: invalid value encountered in true_divide
  pdfs = np.gradient(1-survs,axis=1)/norms
[32m[I 2022-04-13 12:01:51,567][0m Trial 679 finished with value: 0.8832035595399841 and parameters: {'splitter': 'best', 'min_samples_split': 0.12995553634699675, 'min_samples_leaf': 0.050380203987865364, 'min_weight_fraction_leaf': 0.045342236460540586, 'max_features': 0.9140548154037134}. Best is trial 448 with value: 0.8888507593246218.[0m
[32m[I 2022-04-13 12:01:53,871][0m Trial 680 finished with value: 0.8815353114705882 and parameters: {'splitter': 'best', 'min_samples_split': 0.09956679503278797, 'min_samples_leaf': 0.027167455217554943, 'min_weight_fraction_leaf': 0.0691613053551639, 'max_features': 0.9661188563236741}. Best is trial 448 with value: 0.8888507593246218.[0m
/media/san2_ssd/data/Workdir/survival/utils.py:305: RuntimeWarning: invalid value encountered in true_divide
  pdfs = np.gradient(1-survs,axis=1)/norms
/media/san2_ssd/data/Workdir/survival/utils.py:305: RuntimeWarning: invalid value encountered in true_divide
  pdfs = np.gradient(1-survs,axis=1)/norms
/media/san2_ssd/data/Workdir/survival/utils.py:305: RuntimeWarning: invalid value encountered in true_divide
  pdfs = np.gradient(1-survs,axis=1)/norms
/media/san2_ssd/data/Workdir/survival/utils.py:305: RuntimeWarning: invalid value encountered in true_divide
  pdfs = np.gradient(1-survs,axis=1)/norms
[32m[I 2022-04-13 12:01:55,752][0m Trial 681 finished with value: 0.8874477662204583 and parameters: {'splitter': 'best', 'min_samples_split': 0.1107512709246052, 'min_samples_leaf': 0.04057282120271818, 'min_weight_fraction_leaf': 0.034222889279140675, 'max_features': 0.999856747287604}. Best is trial 448 with value: 0.8888507593246218.[0m
[32m[I 2022-04-13 12:01:56,025][0m Trial 682 finished with value: 0.6808644012985094 and parameters: {'splitter': 'best', 'min_samples_split': 0.12103928842516344, 'min_samples_leaf': 0.01339299450508263, 'min_weight_fraction_leaf': 0.025671844413997832, 'max_features': 0.004923723516360223}. Best is trial 448 with value: 0.8888507593246218.[0m
/media/san2_ssd/data/Workdir/survival/utils.py:305: RuntimeWarning: invalid value encountered in true_divide
  pdfs = np.gradient(1-survs,axis=1)/norms
[32m[I 2022-04-13 12:01:58,191][0m Trial 683 finished with value: 0.8796836201030386 and parameters: {'splitter': 'best', 'min_samples_split': 0.17654731697904855, 'min_samples_leaf': 0.055152863959264345, 'min_weight_fraction_leaf': 0.052529028541334344, 'max_features': 0.9474730120689384}. Best is trial 448 with value: 0.8888507593246218.[0m
/media/san2_ssd/data/Workdir/survival/utils.py:305: RuntimeWarning: invalid value encountered in true_divide
  pdfs = np.gradient(1-survs,axis=1)/norms
/media/san2_ssd/data/Workdir/survival/utils.py:305: RuntimeWarning: invalid value encountered in true_divide
  pdfs = np.gradient(1-survs,axis=1)/norms
/media/san2_ssd/data/Workdir/survival/utils.py:305: RuntimeWarning: invalid value encountered in true_divide
  pdfs = np.gradient(1-survs,axis=1)/norms
[32m[I 2022-04-13 12:01:59,975][0m Trial 684 finished with value: 0.7873094003261312 and parameters: {'splitter': 'best', 'min_samples_split': 0.13430146282383779, 'min_samples_leaf': 0.025765090981934285, 'min_weight_fraction_leaf': 0.04160309329845825, 'max_features': 0.978851917754756}. Best is trial 448 with value: 0.8888507593246218.[0m
/media/san2_ssd/data/Workdir/survival/utils.py:305: RuntimeWarning: invalid value encountered in true_divide
  pdfs = np.gradient(1-survs,axis=1)/norms
/media/san2_ssd/data/Workdir/survival/utils.py:305: RuntimeWarning: invalid value encountered in true_divide
  pdfs = np.gradient(1-survs,axis=1)/norms
/media/san2_ssd/data/Workdir/survival/utils.py:305: RuntimeWarning: invalid value encountered in true_divide
  pdfs = np.gradient(1-survs,axis=1)/norms
/media/san2_ssd/data/Workdir/survival/utils.py:305: RuntimeWarning: invalid value encountered in true_divide
  pdfs = np.gradient(1-survs,axis=1)/norms
/media/san2_ssd/data/Workdir/survival/utils.py:305: RuntimeWarning: invalid value encountered in true_divide
  pdfs = np.gradient(1-survs,axis=1)/norms
[32m[I 2022-04-13 12:02:02,463][0m Trial 685 finished with value: 0.8828107188595284 and parameters: {'splitter': 'best', 'min_samples_split': 0.09143142424455951, 'min_samples_leaf': 0.03551777384464337, 'min_weight_fraction_leaf': 0.019915092474040316, 'max_features': 0.9633944036053675}. Best is trial 448 with value: 0.8888507593246218.[0m
[32m[I 2022-04-13 12:02:03,880][0m Trial 686 finished with value: 0.45853053504751945 and parameters: {'splitter': 'best', 'min_samples_split': 0.10683333220449283, 'min_samples_leaf': 0.15950312028887964, 'min_weight_fraction_leaf': 0.03194071428078707, 'max_features': 0.929171244837563}. Best is trial 448 with value: 0.8888507593246218.[0m
[32m[I 2022-04-13 12:02:04,952][0m Trial 687 finished with value: 0.46177261967823746 and parameters: {'splitter': 'best', 'min_samples_split': 0.12918267914461065, 'min_samples_leaf': 0.24027701513320826, 'min_weight_fraction_leaf': 0.026481525317392746, 'max_features': 0.9835400521497174}. Best is trial 448 with value: 0.8888507593246218.[0m
/media/san2_ssd/data/Workdir/survival/utils.py:305: RuntimeWarning: invalid value encountered in true_divide
  pdfs = np.gradient(1-survs,axis=1)/norms
/media/san2_ssd/data/Workdir/survival/utils.py:305: RuntimeWarning: invalid value encountered in true_divide
  pdfs = np.gradient(1-survs,axis=1)/norms
[32m[I 2022-04-13 12:02:07,422][0m Trial 688 finished with value: 0.8857747639504467 and parameters: {'splitter': 'best', 'min_samples_split': 0.11789561949741313, 'min_samples_leaf': 0.00922325569345452, 'min_weight_fraction_leaf': 0.05991928869181275, 'max_features': 0.9997364748031744}. Best is trial 448 with value: 0.8888507593246218.[0m
/media/san2_ssd/data/Workdir/survival/utils.py:305: RuntimeWarning: invalid value encountered in true_divide
  pdfs = np.gradient(1-survs,axis=1)/norms
[32m[I 2022-04-13 12:02:08,882][0m Trial 689 finished with value: 0.8819922280820567 and parameters: {'splitter': 'best', 'min_samples_split': 0.144270390536003, 'min_samples_leaf': 0.021454000484517965, 'min_weight_fraction_leaf': 0.008335497226972237, 'max_features': 0.956787150110955}. Best is trial 448 with value: 0.8888507593246218.[0m
/media/san2_ssd/data/Workdir/survival/utils.py:305: RuntimeWarning: invalid value encountered in true_divide
  pdfs = np.gradient(1-survs,axis=1)/norms
/media/san2_ssd/data/Workdir/survival/utils.py:305: RuntimeWarning: invalid value encountered in true_divide
  pdfs = np.gradient(1-survs,axis=1)/norms
/media/san2_ssd/data/Workdir/survival/utils.py:305: RuntimeWarning: invalid value encountered in true_divide
  pdfs = np.gradient(1-survs,axis=1)/norms
/media/san2_ssd/data/Workdir/survival/utils.py:305: RuntimeWarning: invalid value encountered in true_divide
  pdfs = np.gradient(1-survs,axis=1)/norms
[32m[I 2022-04-13 12:02:11,566][0m Trial 690 finished with value: 0.8877004634541252 and parameters: {'splitter': 'best', 'min_samples_split': 0.09934654549021638, 'min_samples_leaf': 0.045093015264029285, 'min_weight_fraction_leaf': 0.041485524468855825, 'max_features': 0.9762769603362017}. Best is trial 448 with value: 0.8888507593246218.[0m
/media/san2_ssd/data/Workdir/survival/utils.py:305: RuntimeWarning: invalid value encountered in true_divide
  pdfs = np.gradient(1-survs,axis=1)/norms
/media/san2_ssd/data/Workdir/survival/utils.py:305: RuntimeWarning: invalid value encountered in true_divide
  pdfs = np.gradient(1-survs,axis=1)/norms
[32m[I 2022-04-13 12:02:14,329][0m Trial 691 finished with value: 0.8825535540005017 and parameters: {'splitter': 'best', 'min_samples_split': 0.08551309539513605, 'min_samples_leaf': 0.060633312968035424, 'min_weight_fraction_leaf': 0.04484525829983005, 'max_features': 0.9456087173261505}. Best is trial 448 with value: 0.8888507593246218.[0m
[32m[I 2022-04-13 12:02:16,895][0m Trial 692 finished with value: 0.8807777191251164 and parameters: {'splitter': 'best', 'min_samples_split': 0.09115696403779314, 'min_samples_leaf': 0.08222365815258406, 'min_weight_fraction_leaf': 0.00012641914074214972, 'max_features': 0.9272405535198612}. Best is trial 448 with value: 0.8888507593246218.[0m
[32m[I 2022-04-13 12:02:18,746][0m Trial 693 finished with value: 0.8834604123687291 and parameters: {'splitter': 'best', 'min_samples_split': 0.10126028630151165, 'min_samples_leaf': 0.06962489691130383, 'min_weight_fraction_leaf': 0.05391225145217949, 'max_features': 0.9800843741323433}. Best is trial 448 with value: 0.8888507593246218.[0m
/media/san2_ssd/data/Workdir/survival/utils.py:305: RuntimeWarning: invalid value encountered in true_divide
  pdfs = np.gradient(1-survs,axis=1)/norms
/media/san2_ssd/data/Workdir/survival/utils.py:305: RuntimeWarning: invalid value encountered in true_divide
  pdfs = np.gradient(1-survs,axis=1)/norms
/media/san2_ssd/data/Workdir/survival/utils.py:305: RuntimeWarning: invalid value encountered in true_divide
  pdfs = np.gradient(1-survs,axis=1)/norms
/media/san2_ssd/data/Workdir/survival/utils.py:305: RuntimeWarning: invalid value encountered in true_divide
  pdfs = np.gradient(1-survs,axis=1)/norms
/media/san2_ssd/data/Workdir/survival/utils.py:305: RuntimeWarning: invalid value encountered in true_divide
  pdfs = np.gradient(1-survs,axis=1)/norms
[32m[I 2022-04-13 12:02:21,045][0m Trial 694 finished with value: 0.8835205226592601 and parameters: {'splitter': 'best', 'min_samples_split': 0.08065163589990167, 'min_samples_leaf': 0.04468334822711713, 'min_weight_fraction_leaf': 0.03384262318634169, 'max_features': 0.9637653591598152}. Best is trial 448 with value: 0.8888507593246218.[0m
/media/san2_ssd/data/Workdir/survival/utils.py:305: RuntimeWarning: invalid value encountered in true_divide
  pdfs = np.gradient(1-survs,axis=1)/norms
/media/san2_ssd/data/Workdir/survival/utils.py:305: RuntimeWarning: invalid value encountered in true_divide
  pdfs = np.gradient(1-survs,axis=1)/norms
/media/san2_ssd/data/Workdir/survival/utils.py:305: RuntimeWarning: invalid value encountered in true_divide
  pdfs = np.gradient(1-survs,axis=1)/norms
[32m[I 2022-04-13 12:02:23,511][0m Trial 695 finished with value: 0.883671464201617 and parameters: {'splitter': 'best', 'min_samples_split': 0.09576287350301185, 'min_samples_leaf': 0.052782199705124634, 'min_weight_fraction_leaf': 0.018537740438729335, 'max_features': 0.9501644606230989}. Best is trial 448 with value: 0.8888507593246218.[0m
/media/san2_ssd/data/Workdir/survival/utils.py:305: RuntimeWarning: invalid value encountered in true_divide
  pdfs = np.gradient(1-survs,axis=1)/norms
/media/san2_ssd/data/Workdir/survival/utils.py:305: RuntimeWarning: invalid value encountered in true_divide
  pdfs = np.gradient(1-survs,axis=1)/norms
[32m[I 2022-04-13 12:02:25,805][0m Trial 696 finished with value: 0.8719462550948751 and parameters: {'splitter': 'best', 'min_samples_split': 0.06305851413572003, 'min_samples_leaf': 0.04540380136950051, 'min_weight_fraction_leaf': 0.04222925722773617, 'max_features': 0.7880104075278893}. Best is trial 448 with value: 0.8888507593246218.[0m
[32m[I 2022-04-13 12:02:26,671][0m Trial 697 finished with value: 0.8741536394705831 and parameters: {'splitter': 'best', 'min_samples_split': 0.10818257849119742, 'min_samples_leaf': 0.057315659737979405, 'min_weight_fraction_leaf': 0.06948022007330142, 'max_features': 0.6050136968302019}. Best is trial 448 with value: 0.8888507593246218.[0m
/media/san2_ssd/data/Workdir/survival/utils.py:305: RuntimeWarning: invalid value encountered in true_divide
  pdfs = np.gradient(1-survs,axis=1)/norms
