[32m[I 2022-04-15 03:59:44,565][0m Trial 175 finished with value: 0.6743624146605087 and parameters: {'loss': 'coxph', 'learning_rate': 0.07198466102391117, 'n_estimators': 144, 'criterion': 'friedman_mse', 'min_samples_split': 3, 'min_samples_leaf': 5, 'min_weight_fraction_leaf': 0.3317084786840283, 'min_impurity_decrease': 0.7286509422240267, 'max_features': 0.7199626744241454, 'subsample': 0.5116218684126905, 'dropout_rate': 0.06756265341553874, 'ccp_alpha': 0.1636611711585692}. Best is trial 159 with value: 0.7654372273354745.[0m
[32m[I 2022-04-15 03:59:56,540][0m Trial 176 finished with value: 0.758890651818455 and parameters: {'loss': 'coxph', 'learning_rate': 0.05964851538107897, 'n_estimators': 124, 'criterion': 'friedman_mse', 'min_samples_split': 2, 'min_samples_leaf': 5, 'min_weight_fraction_leaf': 0.32343699686833527, 'min_impurity_decrease': 0.7620788329636924, 'max_features': 0.6714368724837062, 'subsample': 0.53179440297614, 'dropout_rate': 0.023907339693688662, 'ccp_alpha': 0.0012053478888818386}. Best is trial 159 with value: 0.7654372273354745.[0m
[32m[I 2022-04-15 04:00:06,999][0m Trial 177 finished with value: 0.6743624146605087 and parameters: {'loss': 'coxph', 'learning_rate': 0.045579976655368296, 'n_estimators': 119, 'criterion': 'friedman_mse', 'min_samples_split': 2, 'min_samples_leaf': 5, 'min_weight_fraction_leaf': 0.32012609825648325, 'min_impurity_decrease': 0.8795328778722985, 'max_features': 0.6704457699385928, 'subsample': 0.5361999766446663, 'dropout_rate': 0.028412491595365214, 'ccp_alpha': 0.12773988344295834}. Best is trial 159 with value: 0.7654372273354745.[0m
[32m[I 2022-04-15 04:00:18,291][0m Trial 178 finished with value: 0.5 and parameters: {'loss': 'coxph', 'learning_rate': 0.05959964454560603, 'n_estimators': 127, 'criterion': 'friedman_mse', 'min_samples_split': 2, 'min_samples_leaf': 5, 'min_weight_fraction_leaf': 0.29431306332217105, 'min_impurity_decrease': 0.7022137413354288, 'max_features': 0.7173860385529477, 'subsample': 0.49230549003934576, 'dropout_rate': 0.05667169389116654, 'ccp_alpha': 0.24548989569268112}. Best is trial 159 with value: 0.7654372273354745.[0m
[32m[I 2022-04-15 04:00:28,588][0m Trial 179 finished with value: 0.5 and parameters: {'loss': 'coxph', 'learning_rate': 0.06578341503916617, 'n_estimators': 120, 'criterion': 'friedman_mse', 'min_samples_split': 3, 'min_samples_leaf': 5, 'min_weight_fraction_leaf': 0.30661286171718, 'min_impurity_decrease': 0.9068141391641643, 'max_features': 0.6196325678598521, 'subsample': 0.5496669474765826, 'dropout_rate': 0.07975151270534145, 'ccp_alpha': 0.35564379514428285}. Best is trial 159 with value: 0.7654372273354745.[0m
[32m[I 2022-04-15 04:00:40,281][0m Trial 180 finished with value: 0.7583514210406255 and parameters: {'loss': 'coxph', 'learning_rate': 0.052233835851180827, 'n_estimators': 131, 'criterion': 'friedman_mse', 'min_samples_split': 2, 'min_samples_leaf': 5, 'min_weight_fraction_leaf': 0.32335146149914795, 'min_impurity_decrease': 0.7884795396883123, 'max_features': 0.679861058581863, 'subsample': 0.5747804864529391, 'dropout_rate': 0.042163759523148464, 'ccp_alpha': 0.0061080573019734715}. Best is trial 159 with value: 0.7654372273354745.[0m
[32m[I 2022-04-15 04:00:51,652][0m Trial 181 finished with value: 0.6743624146605087 and parameters: {'loss': 'coxph', 'learning_rate': 0.0978567046318727, 'n_estimators': 131, 'criterion': 'friedman_mse', 'min_samples_split': 2, 'min_samples_leaf': 5, 'min_weight_fraction_leaf': 0.3260409376144245, 'min_impurity_decrease': 0.7669345779283845, 'max_features': 0.6889344067884647, 'subsample': 0.5661656316072031, 'dropout_rate': 0.04630623750223228, 'ccp_alpha': 0.12471509901280843}. Best is trial 159 with value: 0.7654372273354745.[0m
[32m[I 2022-04-15 04:01:02,260][0m Trial 182 finished with value: 0.7545083618049077 and parameters: {'loss': 'coxph', 'learning_rate': 0.05101732553722196, 'n_estimators': 124, 'criterion': 'friedman_mse', 'min_samples_split': 2, 'min_samples_leaf': 5, 'min_weight_fraction_leaf': 0.3368782801643493, 'min_impurity_decrease': 0.7946087626113553, 'max_features': 0.760642774545701, 'subsample': 0.5252338944252288, 'dropout_rate': 0.02545647120178911, 'ccp_alpha': 0.012472700181988181}. Best is trial 159 with value: 0.7654372273354745.[0m
[32m[I 2022-04-15 04:01:14,745][0m Trial 183 finished with value: 0.5660452785959845 and parameters: {'loss': 'coxph', 'learning_rate': 0.04137403771436548, 'n_estimators': 141, 'criterion': 'friedman_mse', 'min_samples_split': 2, 'min_samples_leaf': 5, 'min_weight_fraction_leaf': 0.3656691063875002, 'min_impurity_decrease': 0.8498293340625934, 'max_features': 0.7123514009885975, 'subsample': 0.4772339076061362, 'dropout_rate': 0.06744408662308456, 'ccp_alpha': 0.20885617451964658}. Best is trial 159 with value: 0.7654372273354745.[0m
[32m[I 2022-04-15 04:01:26,089][0m Trial 184 finished with value: 0.6743624146605087 and parameters: {'loss': 'coxph', 'learning_rate': 0.050808029756670876, 'n_estimators': 133, 'criterion': 'friedman_mse', 'min_samples_split': 2, 'min_samples_leaf': 5, 'min_weight_fraction_leaf': 0.34075477440105634, 'min_impurity_decrease': 0.7353043464665129, 'max_features': 0.659619675746484, 'subsample': 0.6037658325546817, 'dropout_rate': 0.04162610030545842, 'ccp_alpha': 0.11898589866839292}. Best is trial 159 with value: 0.7654372273354745.[0m
[32m[I 2022-04-15 04:01:40,239][0m Trial 185 finished with value: 0.76195974642916 and parameters: {'loss': 'coxph', 'learning_rate': 0.07056757132997135, 'n_estimators': 150, 'criterion': 'friedman_mse', 'min_samples_split': 2, 'min_samples_leaf': 5, 'min_weight_fraction_leaf': 0.3099589086695718, 'min_impurity_decrease': 0.7901355005303552, 'max_features': 0.6786450002669051, 'subsample': 0.497262086895505, 'dropout_rate': 0.002130468506399143, 'ccp_alpha': 0.007369878947195801}. Best is trial 159 with value: 0.7654372273354745.[0m
[32m[I 2022-04-15 04:01:50,366][0m Trial 186 finished with value: 0.5301157883717103 and parameters: {'loss': 'coxph', 'learning_rate': 0.06912485912380961, 'n_estimators': 116, 'criterion': 'friedman_mse', 'min_samples_split': 2, 'min_samples_leaf': 6, 'min_weight_fraction_leaf': 0.3109991552270809, 'min_impurity_decrease': 0.8130288368511065, 'max_features': 0.595314508801996, 'subsample': 0.5793763974763166, 'dropout_rate': 0.0015203411796508443, 'ccp_alpha': 0.21248708311634182}. Best is trial 159 with value: 0.7654372273354745.[0m
[32m[I 2022-04-15 04:02:04,141][0m Trial 187 finished with value: 0.5 and parameters: {'loss': 'coxph', 'learning_rate': 0.06001373993342252, 'n_estimators': 148, 'criterion': 'friedman_mse', 'min_samples_split': 2, 'min_samples_leaf': 5, 'min_weight_fraction_leaf': 0.2835795560783101, 'min_impurity_decrease': 0.7805635644083774, 'max_features': 0.639355675628767, 'subsample': 0.49368907138429685, 'dropout_rate': 0.02407368382317991, 'ccp_alpha': 0.4262607461811402}. Best is trial 159 with value: 0.7654372273354745.[0m
[32m[I 2022-04-15 04:02:15,112][0m Trial 188 finished with value: 0.6743624146605087 and parameters: {'loss': 'coxph', 'learning_rate': 0.035673523155370965, 'n_estimators': 123, 'criterion': 'friedman_mse', 'min_samples_split': 2, 'min_samples_leaf': 5, 'min_weight_fraction_leaf': 0.3558303037358772, 'min_impurity_decrease': 0.7955614583431616, 'max_features': 0.7353840505376511, 'subsample': 0.4661403905839283, 'dropout_rate': 0.08828102684560347, 'ccp_alpha': 0.11371038999224858}. Best is trial 159 with value: 0.7654372273354745.[0m
[32m[I 2022-04-15 04:02:26,117][0m Trial 189 finished with value: 0.5 and parameters: {'loss': 'coxph', 'learning_rate': 0.04400538201599484, 'n_estimators': 128, 'criterion': 'friedman_mse', 'min_samples_split': 2, 'min_samples_leaf': 5, 'min_weight_fraction_leaf': 0.37625504541253524, 'min_impurity_decrease': 0.8315464674035483, 'max_features': 0.6722430009467834, 'subsample': 0.5514397518956339, 'dropout_rate': 0.04721258104326302, 'ccp_alpha': 0.32449845285411194}. Best is trial 159 with value: 0.7654372273354745.[0m
[32m[I 2022-04-15 04:02:36,111][0m Trial 190 finished with value: 0.7396762131790561 and parameters: {'loss': 'coxph', 'learning_rate': 0.07332976526295437, 'n_estimators': 118, 'criterion': 'friedman_mse', 'min_samples_split': 2, 'min_samples_leaf': 5, 'min_weight_fraction_leaf': 0.40004597871438474, 'min_impurity_decrease': 0.7180733217583548, 'max_features': 0.62348292115688, 'subsample': 0.530179626352041, 'dropout_rate': 0.02079412941801049, 'ccp_alpha': 0.007770765061230978}. Best is trial 159 with value: 0.7654372273354745.[0m
[32m[I 2022-04-15 04:02:47,868][0m Trial 191 finished with value: 0.754128909104926 and parameters: {'loss': 'coxph', 'learning_rate': 0.09866008902777908, 'n_estimators': 135, 'criterion': 'friedman_mse', 'min_samples_split': 2, 'min_samples_leaf': 5, 'min_weight_fraction_leaf': 0.3630949869581647, 'min_impurity_decrease': 0.7624760865780027, 'max_features': 0.6791447279085586, 'subsample': 0.4865922634908344, 'dropout_rate': 0.06898201140160383, 'ccp_alpha': 0.009670069594071308}. Best is trial 159 with value: 0.7654372273354745.[0m
[32m[I 2022-04-15 04:03:03,075][0m Trial 192 finished with value: 0.6743624146605087 and parameters: {'loss': 'coxph', 'learning_rate': 0.07503910736890276, 'n_estimators': 164, 'criterion': 'friedman_mse', 'min_samples_split': 2, 'min_samples_leaf': 5, 'min_weight_fraction_leaf': 0.32541607720316623, 'min_impurity_decrease': 0.7491616310400432, 'max_features': 0.6000137289413932, 'subsample': 0.5172728228839101, 'dropout_rate': 0.0533363747355376, 'ccp_alpha': 0.11879525989601618}. Best is trial 159 with value: 0.7654372273354745.[0m
[32m[I 2022-04-15 04:03:16,928][0m Trial 193 finished with value: 0.7574009015553822 and parameters: {'loss': 'coxph', 'learning_rate': 0.05754941412202145, 'n_estimators': 150, 'criterion': 'friedman_mse', 'min_samples_split': 2, 'min_samples_leaf': 5, 'min_weight_fraction_leaf': 0.34891459422129445, 'min_impurity_decrease': 0.7826401836796149, 'max_features': 0.5438054587783192, 'subsample': 0.5056565902454495, 'dropout_rate': 0.03437199036058017, 'ccp_alpha': 0.005190733352718253}. Best is trial 159 with value: 0.7654372273354745.[0m
[32m[I 2022-04-15 04:03:29,184][0m Trial 194 finished with value: 0.6386108601811018 and parameters: {'loss': 'coxph', 'learning_rate': 0.056772584475116614, 'n_estimators': 140, 'criterion': 'friedman_mse', 'min_samples_split': 2, 'min_samples_leaf': 6, 'min_weight_fraction_leaf': 0.34725843542502394, 'min_impurity_decrease': 0.7856626356814257, 'max_features': 0.5535146847046061, 'subsample': 0.47037464756751035, 'dropout_rate': 0.03282959026966719, 'ccp_alpha': 0.19378495576409843}. Best is trial 159 with value: 0.7654372273354745.[0m
[32m[I 2022-04-15 04:03:42,347][0m Trial 195 finished with value: 0.6743624146605087 and parameters: {'loss': 'coxph', 'learning_rate': 0.03837979625069547, 'n_estimators': 148, 'criterion': 'friedman_mse', 'min_samples_split': 2, 'min_samples_leaf': 5, 'min_weight_fraction_leaf': 0.37094522838342375, 'min_impurity_decrease': 0.7975375049911898, 'max_features': 0.5834494687230634, 'subsample': 0.5945717087439512, 'dropout_rate': 0.0023143525740416246, 'ccp_alpha': 0.11493484779477636}. Best is trial 159 with value: 0.7654372273354745.[0m
[32m[I 2022-04-15 04:03:53,003][0m Trial 196 finished with value: 0.7548185245796729 and parameters: {'loss': 'coxph', 'learning_rate': 0.045586974679727166, 'n_estimators': 123, 'criterion': 'friedman_mse', 'min_samples_split': 3, 'min_samples_leaf': 5, 'min_weight_fraction_leaf': 0.3525465415217364, 'min_impurity_decrease': 0.8209687149304369, 'max_features': 0.5462611964630302, 'subsample': 0.5003244534861193, 'dropout_rate': 0.13370431460813967, 'ccp_alpha': 0.003550239568605385}. Best is trial 159 with value: 0.7654372273354745.[0m
[32m[I 2022-04-15 04:04:05,318][0m Trial 197 finished with value: 0.5 and parameters: {'loss': 'coxph', 'learning_rate': 0.05829047213559981, 'n_estimators': 131, 'criterion': 'friedman_mse', 'min_samples_split': 2, 'min_samples_leaf': 5, 'min_weight_fraction_leaf': 0.33857909735700625, 'min_impurity_decrease': 0.8589656568062757, 'max_features': 0.5720814556134459, 'subsample': 0.42256398177750143, 'dropout_rate': 0.09090900861510237, 'ccp_alpha': 0.26533145609336484}. Best is trial 159 with value: 0.7654372273354745.[0m
[32m[I 2022-04-15 04:04:15,683][0m Trial 198 finished with value: 0.6743624146605087 and parameters: {'loss': 'coxph', 'learning_rate': 0.036850067869334514, 'n_estimators': 115, 'criterion': 'friedman_mse', 'min_samples_split': 2, 'min_samples_leaf': 5, 'min_weight_fraction_leaf': 0.39558053944512406, 'min_impurity_decrease': 0.7358199579149819, 'max_features': 0.6468409904305267, 'subsample': 0.568591526783658, 'dropout_rate': 0.020601331559041786, 'ccp_alpha': 0.1275953526208041}. Best is trial 159 with value: 0.7654372273354745.[0m
[32m[I 2022-04-15 04:04:29,761][0m Trial 199 finished with value: 0.5660452785959845 and parameters: {'loss': 'coxph', 'learning_rate': 0.04953807266893122, 'n_estimators': 144, 'criterion': 'friedman_mse', 'min_samples_split': 2, 'min_samples_leaf': 6, 'min_weight_fraction_leaf': 0.31364689473587404, 'min_impurity_decrease': 0.780451618770452, 'max_features': 0.5340022974661752, 'subsample': 0.4658459776051975, 'dropout_rate': 0.04484453656443377, 'ccp_alpha': 0.2098917808221463}. Best is trial 159 with value: 0.7654372273354745.[0m
[32m[I 2022-04-15 04:04:41,400][0m Trial 200 finished with value: 0.6743624146605087 and parameters: {'loss': 'coxph', 'learning_rate': 0.06968197676023821, 'n_estimators': 127, 'criterion': 'friedman_mse', 'min_samples_split': 2, 'min_samples_leaf': 5, 'min_weight_fraction_leaf': 0.3781739981326156, 'min_impurity_decrease': 0.808639696603125, 'max_features': 0.6282712567322832, 'subsample': 0.5388965102740733, 'dropout_rate': 0.001697028176548418, 'ccp_alpha': 0.12361192499835526}. Best is trial 159 with value: 0.7654372273354745.[0m
[32m[I 2022-04-15 04:04:56,694][0m Trial 201 finished with value: 0.7577446118284555 and parameters: {'loss': 'coxph', 'learning_rate': 0.08115275180397259, 'n_estimators': 154, 'criterion': 'friedman_mse', 'min_samples_split': 2, 'min_samples_leaf': 5, 'min_weight_fraction_leaf': 0.3356966978437372, 'min_impurity_decrease': 0.7606711480465576, 'max_features': 0.674493705721793, 'subsample': 0.5167847505959098, 'dropout_rate': 0.07449341307904961, 'ccp_alpha': 0.01837516043973675}. Best is trial 159 with value: 0.7654372273354745.[0m
[32m[I 2022-04-15 04:05:12,277][0m Trial 202 finished with value: 0.7571735498664295 and parameters: {'loss': 'coxph', 'learning_rate': 0.05813808554824118, 'n_estimators': 163, 'criterion': 'friedman_mse', 'min_samples_split': 2, 'min_samples_leaf': 5, 'min_weight_fraction_leaf': 0.35970617056628046, 'min_impurity_decrease': 0.7691052585932859, 'max_features': 0.6073993516601928, 'subsample': 0.49715647834581667, 'dropout_rate': 0.0724966801092418, 'ccp_alpha': 0.005503189682035213}. Best is trial 159 with value: 0.7654372273354745.[0m
[32m[I 2022-04-15 04:05:27,760][0m Trial 203 finished with value: 0.6743624146605087 and parameters: {'loss': 'coxph', 'learning_rate': 0.05954107556315531, 'n_estimators': 153, 'criterion': 'friedman_mse', 'min_samples_split': 2, 'min_samples_leaf': 5, 'min_weight_fraction_leaf': 0.3614755882951134, 'min_impurity_decrease': 0.7620318744525058, 'max_features': 0.7059349526639951, 'subsample': 0.516994845814696, 'dropout_rate': 0.034014839080245274, 'ccp_alpha': 0.11005248209712801}. Best is trial 159 with value: 0.7654372273354745.[0m
[32m[I 2022-04-15 04:05:44,063][0m Trial 204 finished with value: 0.7602852535644398 and parameters: {'loss': 'coxph', 'learning_rate': 0.07566425083772906, 'n_estimators': 163, 'criterion': 'friedman_mse', 'min_samples_split': 2, 'min_samples_leaf': 5, 'min_weight_fraction_leaf': 0.3454265601258015, 'min_impurity_decrease': 0.7358396207407797, 'max_features': 0.6574807416776869, 'subsample': 0.43974112055648445, 'dropout_rate': 0.09052648713667083, 'ccp_alpha': 0.009344586786829409}. Best is trial 159 with value: 0.7654372273354745.[0m
[32m[I 2022-04-15 04:06:00,138][0m Trial 205 finished with value: 0.7579175006357206 and parameters: {'loss': 'coxph', 'learning_rate': 0.07782451154618183, 'n_estimators': 165, 'criterion': 'friedman_mse', 'min_samples_split': 2, 'min_samples_leaf': 5, 'min_weight_fraction_leaf': 0.34412083875537147, 'min_impurity_decrease': 0.7450751029997764, 'max_features': 0.6582301248398633, 'subsample': 0.44728227872962495, 'dropout_rate': 0.054046532781119414, 'ccp_alpha': 0.005060854070443094}. Best is trial 159 with value: 0.7654372273354745.[0m
[32m[I 2022-04-15 04:06:16,269][0m Trial 206 finished with value: 0.5 and parameters: {'loss': 'coxph', 'learning_rate': 0.07706265388466343, 'n_estimators': 163, 'criterion': 'friedman_mse', 'min_samples_split': 2, 'min_samples_leaf': 5, 'min_weight_fraction_leaf': 0.3430692210625752, 'min_impurity_decrease': 0.713512984709929, 'max_features': 0.6619238852868247, 'subsample': 0.5004836216363939, 'dropout_rate': 0.08853879346048123, 'ccp_alpha': 0.23323917128448887}. Best is trial 159 with value: 0.7654372273354745.[0m
[32m[I 2022-04-15 04:06:35,626][0m Trial 207 finished with value: 0.6743624146605087 and parameters: {'loss': 'coxph', 'learning_rate': 0.09868648270396171, 'n_estimators': 171, 'criterion': 'friedman_mse', 'min_samples_split': 2, 'min_samples_leaf': 5, 'min_weight_fraction_leaf': 0.3314381202976865, 'min_impurity_decrease': 0.7420661931372723, 'max_features': 0.6759333499692136, 'subsample': 0.4364049715167951, 'dropout_rate': 0.054810127258830846, 'ccp_alpha': 0.13202307954128326}. Best is trial 159 with value: 0.7654372273354745.[0m
[32m[I 2022-04-15 04:06:54,250][0m Trial 208 finished with value: 0.5 and parameters: {'loss': 'coxph', 'learning_rate': 0.07788585737390014, 'n_estimators': 182, 'criterion': 'friedman_mse', 'min_samples_split': 2, 'min_samples_leaf': 5, 'min_weight_fraction_leaf': 0.3509350634499859, 'min_impurity_decrease': 0.7685402684842686, 'max_features': 0.7296916490154944, 'subsample': 0.5513653058590752, 'dropout_rate': 0.07927291778635615, 'ccp_alpha': 0.34216968725114044}. Best is trial 159 with value: 0.7654372273354745.[0m
[32m[I 2022-04-15 04:07:11,608][0m Trial 209 finished with value: 0.7593238291794787 and parameters: {'loss': 'coxph', 'learning_rate': 0.059375598265221964, 'n_estimators': 163, 'criterion': 'friedman_mse', 'min_samples_split': 2, 'min_samples_leaf': 5, 'min_weight_fraction_leaf': 0.33817476214060016, 'min_impurity_decrease': 0.9570537695661101, 'max_features': 0.652447285257027, 'subsample': 0.4662760228855882, 'dropout_rate': 0.030942463619588113, 'ccp_alpha': 0.0028380985703949403}. Best is trial 159 with value: 0.7654372273354745.[0m
[32m[I 2022-04-15 04:07:26,989][0m Trial 210 finished with value: 0.6743624146605087 and parameters: {'loss': 'coxph', 'learning_rate': 0.06011607465119229, 'n_estimators': 154, 'criterion': 'friedman_mse', 'min_samples_split': 2, 'min_samples_leaf': 5, 'min_weight_fraction_leaf': 0.32385321677929557, 'min_impurity_decrease': 0.9570331382557316, 'max_features': 0.6564774986516368, 'subsample': 0.4806552687686973, 'dropout_rate': 0.036609679683090535, 'ccp_alpha': 0.1913875579577714}. Best is trial 159 with value: 0.7654372273354745.[0m
[32m[I 2022-04-15 04:07:43,399][0m Trial 211 finished with value: 0.6743624146605087 and parameters: {'loss': 'coxph', 'learning_rate': 0.0514991671261165, 'n_estimators': 163, 'criterion': 'friedman_mse', 'min_samples_split': 2, 'min_samples_leaf': 5, 'min_weight_fraction_leaf': 0.3377416237994951, 'min_impurity_decrease': 0.9564498234238484, 'max_features': 0.6449026107062622, 'subsample': 0.4583148084846834, 'dropout_rate': 0.022596896329670012, 'ccp_alpha': 0.09260585245675844}. Best is trial 159 with value: 0.7654372273354745.[0m
[32m[I 2022-04-15 04:08:01,021][0m Trial 212 finished with value: 0.6825184655014404 and parameters: {'loss': 'coxph', 'learning_rate': 0.07795636016926255, 'n_estimators': 176, 'criterion': 'friedman_mse', 'min_samples_split': 2, 'min_samples_leaf': 5, 'min_weight_fraction_leaf': 0.34918731733511615, 'min_impurity_decrease': 0.7334940406752397, 'max_features': 0.7056598204053415, 'subsample': 0.42374325503987975, 'dropout_rate': 0.05424327559959287, 'ccp_alpha': 0.10066672602078583}. Best is trial 159 with value: 0.7654372273354745.[0m
[32m[I 2022-04-15 04:08:15,741][0m Trial 213 finished with value: 0.76037220182069 and parameters: {'loss': 'coxph', 'learning_rate': 0.06209362382663241, 'n_estimators': 162, 'criterion': 'friedman_mse', 'min_samples_split': 2, 'min_samples_leaf': 5, 'min_weight_fraction_leaf': 0.36200340964226335, 'min_impurity_decrease': 0.7641510211865572, 'max_features': 0.6041615446258878, 'subsample': 0.5209271224126317, 'dropout_rate': 0.1019991140206713, 'ccp_alpha': 0.016417909943957795}. Best is trial 159 with value: 0.7654372273354745.[0m
[32m[I 2022-04-15 04:08:30,419][0m Trial 214 finished with value: 0.7572614121323722 and parameters: {'loss': 'coxph', 'learning_rate': 0.06783522829085346, 'n_estimators': 161, 'criterion': 'friedman_mse', 'min_samples_split': 2, 'min_samples_leaf': 6, 'min_weight_fraction_leaf': 0.3177975531254341, 'min_impurity_decrease': 0.75203903912324, 'max_features': 0.5966189909975406, 'subsample': 0.5261686875952615, 'dropout_rate': 0.09800247536011063, 'ccp_alpha': 0.007967753664568186}. Best is trial 159 with value: 0.7654372273354745.[0m
