[32m[I 2022-04-13 12:10:53,790][0m Trial 970 finished with value: 0.8832315063640446 and parameters: {'splitter': 'best', 'min_samples_split': 0.11763698558278832, 'min_samples_leaf': 0.015336706032375155, 'min_weight_fraction_leaf': 0.023941263710451938, 'max_features': 0.9663190773040601}. Best is trial 448 with value: 0.8888507593246218.[0m
/media/san2_ssd/data/Workdir/survival/utils.py:305: RuntimeWarning: invalid value encountered in true_divide
  pdfs = np.gradient(1-survs,axis=1)/norms
/media/san2_ssd/data/Workdir/survival/utils.py:305: RuntimeWarning: invalid value encountered in true_divide
  pdfs = np.gradient(1-survs,axis=1)/norms
/media/san2_ssd/data/Workdir/survival/utils.py:305: RuntimeWarning: invalid value encountered in true_divide
  pdfs = np.gradient(1-survs,axis=1)/norms
[32m[I 2022-04-13 12:10:55,934][0m Trial 971 finished with value: 0.8854690605133584 and parameters: {'splitter': 'best', 'min_samples_split': 0.10225193354500443, 'min_samples_leaf': 0.029123250470370923, 'min_weight_fraction_leaf': 0.05241309776748465, 'max_features': 0.9997367472430616}. Best is trial 448 with value: 0.8888507593246218.[0m
/media/san2_ssd/data/Workdir/survival/utils.py:305: RuntimeWarning: invalid value encountered in true_divide
  pdfs = np.gradient(1-survs,axis=1)/norms
/media/san2_ssd/data/Workdir/survival/utils.py:305: RuntimeWarning: invalid value encountered in true_divide
  pdfs = np.gradient(1-survs,axis=1)/norms
/media/san2_ssd/data/Workdir/survival/utils.py:305: RuntimeWarning: invalid value encountered in true_divide
  pdfs = np.gradient(1-survs,axis=1)/norms
[32m[I 2022-04-13 12:10:56,990][0m Trial 972 finished with value: 0.8831973521198314 and parameters: {'splitter': 'best', 'min_samples_split': 0.073913130562476, 'min_samples_leaf': 0.04803420169156326, 'min_weight_fraction_leaf': 0.04141847836308429, 'max_features': 0.964119070118593}. Best is trial 448 with value: 0.8888507593246218.[0m
/media/san2_ssd/data/Workdir/survival/utils.py:305: RuntimeWarning: invalid value encountered in true_divide
  pdfs = np.gradient(1-survs,axis=1)/norms
/media/san2_ssd/data/Workdir/survival/utils.py:305: RuntimeWarning: invalid value encountered in true_divide
  pdfs = np.gradient(1-survs,axis=1)/norms
/media/san2_ssd/data/Workdir/survival/utils.py:305: RuntimeWarning: invalid value encountered in true_divide
  pdfs = np.gradient(1-survs,axis=1)/norms
/media/san2_ssd/data/Workdir/survival/utils.py:305: RuntimeWarning: invalid value encountered in true_divide
  pdfs = np.gradient(1-survs,axis=1)/norms
[32m[I 2022-04-13 12:10:58,061][0m Trial 973 finished with value: 0.8874477662204583 and parameters: {'splitter': 'best', 'min_samples_split': 0.11123917820300426, 'min_samples_leaf': 0.035376733460400996, 'min_weight_fraction_leaf': 0.04062892125212379, 'max_features': 0.9793046124470385}. Best is trial 448 with value: 0.8888507593246218.[0m
/media/san2_ssd/data/Workdir/survival/utils.py:305: RuntimeWarning: invalid value encountered in true_divide
  pdfs = np.gradient(1-survs,axis=1)/norms
/media/san2_ssd/data/Workdir/survival/utils.py:305: RuntimeWarning: invalid value encountered in true_divide
  pdfs = np.gradient(1-survs,axis=1)/norms
[32m[I 2022-04-13 12:10:59,571][0m Trial 974 finished with value: 0.8835733562573596 and parameters: {'splitter': 'best', 'min_samples_split': 0.1260485046409832, 'min_samples_leaf': 0.019986690318050025, 'min_weight_fraction_leaf': 0.010049789718638022, 'max_features': 0.9496245704469111}. Best is trial 448 with value: 0.8888507593246218.[0m
/media/san2_ssd/data/Workdir/survival/utils.py:305: RuntimeWarning: invalid value encountered in true_divide
  pdfs = np.gradient(1-survs,axis=1)/norms
/media/san2_ssd/data/Workdir/survival/utils.py:305: RuntimeWarning: invalid value encountered in true_divide
  pdfs = np.gradient(1-survs,axis=1)/norms
/media/san2_ssd/data/Workdir/survival/utils.py:305: RuntimeWarning: invalid value encountered in true_divide
  pdfs = np.gradient(1-survs,axis=1)/norms
/media/san2_ssd/data/Workdir/survival/utils.py:305: RuntimeWarning: invalid value encountered in true_divide
  pdfs = np.gradient(1-survs,axis=1)/norms
[32m[I 2022-04-13 12:11:00,598][0m Trial 975 finished with value: 0.8849798986221067 and parameters: {'splitter': 'best', 'min_samples_split': 0.09309022086085016, 'min_samples_leaf': 0.04029350696915432, 'min_weight_fraction_leaf': 0.03043692658225898, 'max_features': 0.9806256168172007}. Best is trial 448 with value: 0.8888507593246218.[0m
/media/san2_ssd/data/Workdir/survival/utils.py:305: RuntimeWarning: invalid value encountered in true_divide
  pdfs = np.gradient(1-survs,axis=1)/norms
/media/san2_ssd/data/Workdir/survival/utils.py:305: RuntimeWarning: invalid value encountered in true_divide
  pdfs = np.gradient(1-survs,axis=1)/norms
[32m[I 2022-04-13 12:11:01,723][0m Trial 976 finished with value: 0.8836251863251195 and parameters: {'splitter': 'best', 'min_samples_split': 0.10546298083090447, 'min_samples_leaf': 0.02850829134761773, 'min_weight_fraction_leaf': 0.05768668852576227, 'max_features': 0.9227919354195513}. Best is trial 448 with value: 0.8888507593246218.[0m
/media/san2_ssd/data/Workdir/survival/utils.py:305: RuntimeWarning: invalid value encountered in true_divide
  pdfs = np.gradient(1-survs,axis=1)/norms
/media/san2_ssd/data/Workdir/survival/utils.py:305: RuntimeWarning: invalid value encountered in true_divide
  pdfs = np.gradient(1-survs,axis=1)/norms
[32m[I 2022-04-13 12:11:02,667][0m Trial 977 finished with value: 0.885628898009227 and parameters: {'splitter': 'best', 'min_samples_split': 0.13496846461197778, 'min_samples_leaf': 0.05360818512413503, 'min_weight_fraction_leaf': 0.016100142642173614, 'max_features': 0.9994537004597288}. Best is trial 448 with value: 0.8888507593246218.[0m
/media/san2_ssd/data/Workdir/survival/utils.py:305: RuntimeWarning: invalid value encountered in true_divide
  pdfs = np.gradient(1-survs,axis=1)/norms
/media/san2_ssd/data/Workdir/survival/utils.py:305: RuntimeWarning: invalid value encountered in true_divide
  pdfs = np.gradient(1-survs,axis=1)/norms
[32m[I 2022-04-13 12:11:05,969][0m Trial 978 finished with value: 0.8830839653237639 and parameters: {'splitter': 'best', 'min_samples_split': 0.11841962354974186, 'min_samples_leaf': 0.014256645797024207, 'min_weight_fraction_leaf': 0.025147759739945954, 'max_features': 0.9644196187287253}. Best is trial 448 with value: 0.8888507593246218.[0m
[32m[I 2022-04-13 12:11:07,693][0m Trial 979 finished with value: 0.4762173568334265 and parameters: {'splitter': 'best', 'min_samples_split': 0.3614211778558234, 'min_samples_leaf': 0.040566998622114436, 'min_weight_fraction_leaf': 0.034712435655034415, 'max_features': 0.9816179628737358}. Best is trial 448 with value: 0.8888507593246218.[0m
/media/san2_ssd/data/Workdir/survival/utils.py:305: RuntimeWarning: invalid value encountered in true_divide
  pdfs = np.gradient(1-survs,axis=1)/norms
/media/san2_ssd/data/Workdir/survival/utils.py:305: RuntimeWarning: invalid value encountered in true_divide
  pdfs = np.gradient(1-survs,axis=1)/norms
/media/san2_ssd/data/Workdir/survival/utils.py:305: RuntimeWarning: invalid value encountered in true_divide
  pdfs = np.gradient(1-survs,axis=1)/norms
/media/san2_ssd/data/Workdir/survival/utils.py:305: RuntimeWarning: invalid value encountered in true_divide
  pdfs = np.gradient(1-survs,axis=1)/norms
[32m[I 2022-04-13 12:11:10,138][0m Trial 980 finished with value: 0.8854007546954286 and parameters: {'splitter': 'best', 'min_samples_split': 0.08123060104726613, 'min_samples_leaf': 0.02545127198286887, 'min_weight_fraction_leaf': 0.009706323891692438, 'max_features': 0.9417414494015867}. Best is trial 448 with value: 0.8888507593246218.[0m
[32m[I 2022-04-13 12:11:10,423][0m Trial 981 finished with value: 0.6981432179087999 and parameters: {'splitter': 'best', 'min_samples_split': 0.12626372487923176, 'min_samples_leaf': 0.47433135710440705, 'min_weight_fraction_leaf': 0.3033315896228381, 'max_features': 0.9795998384658376}. Best is trial 448 with value: 0.8888507593246218.[0m
[32m[I 2022-04-13 12:11:11,178][0m Trial 982 finished with value: 0.7816194048697162 and parameters: {'splitter': 'best', 'min_samples_split': 0.21182705296215992, 'min_samples_leaf': 0.06606723261840047, 'min_weight_fraction_leaf': 0.021188195105237527, 'max_features': 0.985799681738395}. Best is trial 448 with value: 0.8888507593246218.[0m
/media/san2_ssd/data/Workdir/survival/utils.py:305: RuntimeWarning: invalid value encountered in true_divide
  pdfs = np.gradient(1-survs,axis=1)/norms
/media/san2_ssd/data/Workdir/survival/utils.py:305: RuntimeWarning: invalid value encountered in true_divide
  pdfs = np.gradient(1-survs,axis=1)/norms
/media/san2_ssd/data/Workdir/survival/utils.py:305: RuntimeWarning: invalid value encountered in true_divide
  pdfs = np.gradient(1-survs,axis=1)/norms
[32m[I 2022-04-13 12:11:13,133][0m Trial 983 finished with value: 0.8837966261383119 and parameters: {'splitter': 'best', 'min_samples_split': 0.09665771666928637, 'min_samples_leaf': 0.04860021984951505, 'min_weight_fraction_leaf': 0.04861825837429674, 'max_features': 0.9531566378249081}. Best is trial 448 with value: 0.8888507593246218.[0m
/media/san2_ssd/data/Workdir/survival/utils.py:305: RuntimeWarning: invalid value encountered in true_divide
  pdfs = np.gradient(1-survs,axis=1)/norms
/media/san2_ssd/data/Workdir/survival/utils.py:305: RuntimeWarning: invalid value encountered in true_divide
  pdfs = np.gradient(1-survs,axis=1)/norms
/media/san2_ssd/data/Workdir/survival/utils.py:305: RuntimeWarning: invalid value encountered in true_divide
  pdfs = np.gradient(1-survs,axis=1)/norms
/media/san2_ssd/data/Workdir/survival/utils.py:305: RuntimeWarning: invalid value encountered in true_divide
  pdfs = np.gradient(1-survs,axis=1)/norms
[32m[I 2022-04-13 12:11:16,141][0m Trial 984 finished with value: 0.8877947855517132 and parameters: {'splitter': 'best', 'min_samples_split': 0.11160734313378809, 'min_samples_leaf': 0.009334789153965756, 'min_weight_fraction_leaf': 0.04248169566615874, 'max_features': 0.9996668199362887}. Best is trial 448 with value: 0.8888507593246218.[0m
[32m[I 2022-04-13 12:11:16,660][0m Trial 985 finished with value: 0.7785432845746924 and parameters: {'splitter': 'random', 'min_samples_split': 0.08965537910758033, 'min_samples_leaf': 0.003183987991517926, 'min_weight_fraction_leaf': 0.07125881617420042, 'max_features': 0.9664544856653995}. Best is trial 448 with value: 0.8888507593246218.[0m
[32m[I 2022-04-13 12:11:19,255][0m Trial 986 finished with value: 0.8827566500887588 and parameters: {'splitter': 'best', 'min_samples_split': 0.10351375488080462, 'min_samples_leaf': 0.0014389106422850132, 'min_weight_fraction_leaf': 0.06526065612421292, 'max_features': 0.9998544965100158}. Best is trial 448 with value: 0.8888507593246218.[0m
/media/san2_ssd/data/Workdir/survival/utils.py:305: RuntimeWarning: invalid value encountered in true_divide
  pdfs = np.gradient(1-survs,axis=1)/norms
/media/san2_ssd/data/Workdir/survival/utils.py:305: RuntimeWarning: invalid value encountered in true_divide
  pdfs = np.gradient(1-survs,axis=1)/norms
/media/san2_ssd/data/Workdir/survival/utils.py:305: RuntimeWarning: invalid value encountered in true_divide
  pdfs = np.gradient(1-survs,axis=1)/norms
/media/san2_ssd/data/Workdir/survival/utils.py:305: RuntimeWarning: invalid value encountered in true_divide
  pdfs = np.gradient(1-survs,axis=1)/norms
[32m[I 2022-04-13 12:11:22,464][0m Trial 987 finished with value: 0.8875313920068091 and parameters: {'splitter': 'best', 'min_samples_split': 0.11039052157003233, 'min_samples_leaf': 0.010131217910699777, 'min_weight_fraction_leaf': 0.04161984930537914, 'max_features': 0.9995721805883434}. Best is trial 448 with value: 0.8888507593246218.[0m
[32m[I 2022-04-13 12:11:24,522][0m Trial 988 finished with value: 0.4675647937883647 and parameters: {'splitter': 'best', 'min_samples_split': 0.4081813885095684, 'min_samples_leaf': 0.007209904050246005, 'min_weight_fraction_leaf': 0.048969768042333994, 'max_features': 0.9989739194503107}. Best is trial 448 with value: 0.8888507593246218.[0m
/media/san2_ssd/data/Workdir/survival/utils.py:305: RuntimeWarning: invalid value encountered in true_divide
  pdfs = np.gradient(1-survs,axis=1)/norms
[32m[I 2022-04-13 12:11:26,639][0m Trial 989 finished with value: 0.8807497968400861 and parameters: {'splitter': 'best', 'min_samples_split': 0.09533409041045399, 'min_samples_leaf': 0.009435251149371406, 'min_weight_fraction_leaf': 0.061994292394002726, 'max_features': 0.9677498376876218}. Best is trial 448 with value: 0.8888507593246218.[0m
/media/san2_ssd/data/Workdir/survival/utils.py:305: RuntimeWarning: invalid value encountered in true_divide
  pdfs = np.gradient(1-survs,axis=1)/norms
/media/san2_ssd/data/Workdir/survival/utils.py:305: RuntimeWarning: invalid value encountered in true_divide
  pdfs = np.gradient(1-survs,axis=1)/norms
/media/san2_ssd/data/Workdir/survival/utils.py:305: RuntimeWarning: invalid value encountered in true_divide
  pdfs = np.gradient(1-survs,axis=1)/norms
[32m[I 2022-04-13 12:11:27,852][0m Trial 990 finished with value: 0.8854690605133584 and parameters: {'splitter': 'best', 'min_samples_split': 0.07773790880220671, 'min_samples_leaf': 0.008044343669983224, 'min_weight_fraction_leaf': 0.05252237698201661, 'max_features': 0.9819774133342677}. Best is trial 448 with value: 0.8888507593246218.[0m
/media/san2_ssd/data/Workdir/survival/utils.py:305: RuntimeWarning: invalid value encountered in true_divide
  pdfs = np.gradient(1-survs,axis=1)/norms
/media/san2_ssd/data/Workdir/survival/utils.py:305: RuntimeWarning: invalid value encountered in true_divide
  pdfs = np.gradient(1-survs,axis=1)/norms
/media/san2_ssd/data/Workdir/survival/utils.py:305: RuntimeWarning: invalid value encountered in true_divide
  pdfs = np.gradient(1-survs,axis=1)/norms
/media/san2_ssd/data/Workdir/survival/utils.py:305: RuntimeWarning: invalid value encountered in true_divide
  pdfs = np.gradient(1-survs,axis=1)/norms
[32m[I 2022-04-13 12:11:29,726][0m Trial 991 finished with value: 0.8878552546585384 and parameters: {'splitter': 'best', 'min_samples_split': 0.10861566267571061, 'min_samples_leaf': 0.005614928204379249, 'min_weight_fraction_leaf': 0.04320657030049634, 'max_features': 0.9991829272027766}. Best is trial 448 with value: 0.8888507593246218.[0m
[32m[I 2022-04-13 12:11:30,943][0m Trial 992 finished with value: 0.7863715606362651 and parameters: {'splitter': 'best', 'min_samples_split': 0.08868525020970724, 'min_samples_leaf': 0.0025632791658624, 'min_weight_fraction_leaf': 0.07419960852558052, 'max_features': 0.9855325429867089}. Best is trial 448 with value: 0.8888507593246218.[0m
/media/san2_ssd/data/Workdir/survival/utils.py:305: RuntimeWarning: invalid value encountered in true_divide
  pdfs = np.gradient(1-survs,axis=1)/norms
[32m[I 2022-04-13 12:11:33,170][0m Trial 993 finished with value: 0.8857694580205372 and parameters: {'splitter': 'best', 'min_samples_split': 0.09943446619699786, 'min_samples_leaf': 0.005354099360726471, 'min_weight_fraction_leaf': 0.06045396416742742, 'max_features': 0.9996178122227548}. Best is trial 448 with value: 0.8888507593246218.[0m
/media/san2_ssd/data/Workdir/survival/utils.py:305: RuntimeWarning: invalid value encountered in true_divide
  pdfs = np.gradient(1-survs,axis=1)/norms
/media/san2_ssd/data/Workdir/survival/utils.py:305: RuntimeWarning: invalid value encountered in true_divide
  pdfs = np.gradient(1-survs,axis=1)/norms
[32m[I 2022-04-13 12:11:35,297][0m Trial 994 finished with value: 0.8850214022960919 and parameters: {'splitter': 'best', 'min_samples_split': 0.10720813303031633, 'min_samples_leaf': 0.001196030409665403, 'min_weight_fraction_leaf': 0.05639671127218647, 'max_features': 0.9992362077067065}. Best is trial 448 with value: 0.8888507593246218.[0m
/media/san2_ssd/data/Workdir/survival/utils.py:305: RuntimeWarning: invalid value encountered in true_divide
  pdfs = np.gradient(1-survs,axis=1)/norms
/media/san2_ssd/data/Workdir/survival/utils.py:305: RuntimeWarning: invalid value encountered in true_divide
  pdfs = np.gradient(1-survs,axis=1)/norms
/media/san2_ssd/data/Workdir/survival/utils.py:305: RuntimeWarning: invalid value encountered in true_divide
  pdfs = np.gradient(1-survs,axis=1)/norms
/media/san2_ssd/data/Workdir/survival/utils.py:305: RuntimeWarning: invalid value encountered in true_divide
  pdfs = np.gradient(1-survs,axis=1)/norms
[32m[I 2022-04-13 12:11:39,217][0m Trial 995 finished with value: 0.8875325633896619 and parameters: {'splitter': 'best', 'min_samples_split': 0.09391706458130646, 'min_samples_leaf': 0.008362737687036537, 'min_weight_fraction_leaf': 0.04557160406675886, 'max_features': 0.9798006854758649}. Best is trial 448 with value: 0.8888507593246218.[0m
[32m[I 2022-04-13 12:11:41,856][0m Trial 996 finished with value: 0.4592016350597861 and parameters: {'splitter': 'best', 'min_samples_split': 0.38510003022088757, 'min_samples_leaf': 0.010315881089228339, 'min_weight_fraction_leaf': 0.08514033017551034, 'max_features': 0.9549275972995759}. Best is trial 448 with value: 0.8888507593246218.[0m
[32m[I 2022-04-13 12:11:45,822][0m Trial 997 finished with value: 0.883265833959627 and parameters: {'splitter': 'best', 'min_samples_split': 0.08257572287637835, 'min_samples_leaf': 0.0036971426456576806, 'min_weight_fraction_leaf': 0.07323097698257452, 'max_features': 0.9666517793178212}. Best is trial 448 with value: 0.8888507593246218.[0m
/media/san2_ssd/data/Workdir/survival/utils.py:305: RuntimeWarning: invalid value encountered in true_divide
  pdfs = np.gradient(1-survs,axis=1)/norms
/media/san2_ssd/data/Workdir/survival/utils.py:305: RuntimeWarning: invalid value encountered in true_divide
  pdfs = np.gradient(1-survs,axis=1)/norms
/media/san2_ssd/data/Workdir/survival/utils.py:305: RuntimeWarning: invalid value encountered in true_divide
  pdfs = np.gradient(1-survs,axis=1)/norms
[32m[I 2022-04-13 12:11:49,069][0m Trial 998 finished with value: 0.8838625758685448 and parameters: {'splitter': 'best', 'min_samples_split': 0.07564971881487896, 'min_samples_leaf': 0.010731211764400339, 'min_weight_fraction_leaf': 0.05371796645006953, 'max_features': 0.930780579585367}. Best is trial 448 with value: 0.8888507593246218.[0m
/media/san2_ssd/data/Workdir/survival/utils.py:305: RuntimeWarning: invalid value encountered in true_divide
  pdfs = np.gradient(1-survs,axis=1)/norms
[32m[I 2022-04-13 12:11:51,596][0m Trial 999 finished with value: 0.8822951209087941 and parameters: {'splitter': 'best', 'min_samples_split': 0.060238510069136435, 'min_samples_leaf': 0.0022365577777404824, 'min_weight_fraction_leaf': 0.06505915428605177, 'max_features': 0.9683744617926742}. Best is trial 448 with value: 0.8888507593246218.[0m
[32m[I 2022-04-13 12:11:51,601][0m A new study created in memory with name: no-name-cc9d6e62-575d-4cad-a390-1ae10f1102a0[0m
[32m[I 2022-04-13 12:11:51,663][0m Trial 0 finished with value: 0.582142030257485 and parameters: {'splitter': 'best', 'min_samples_split': 0.034012079472405844, 'min_samples_leaf': 0.29688957340528205, 'min_weight_fraction_leaf': 0.005962980507583593, 'max_features': 0.3688685168669291}. Best is trial 0 with value: 0.582142030257485.[0m
[32m[I 2022-04-13 12:11:51,756][0m Trial 1 finished with value: 0.6718233822523109 and parameters: {'splitter': 'random', 'min_samples_split': 0.04248041230179634, 'min_samples_leaf': 0.2818639700204966, 'min_weight_fraction_leaf': 0.16022746507942548, 'max_features': 0.7686061765181402}. Best is trial 1 with value: 0.6718233822523109.[0m
[32m[I 2022-04-13 12:11:51,815][0m Trial 2 finished with value: 0.6743624146605087 and parameters: {'splitter': 'random', 'min_samples_split': 0.3888230691858122, 'min_samples_leaf': 0.33549246406062, 'min_weight_fraction_leaf': 0.29349210939170706, 'max_features': 0.8421095435774527}. Best is trial 2 with value: 0.6743624146605087.[0m
[32m[I 2022-04-13 12:11:51,880][0m Trial 3 finished with value: 0.5135577842767057 and parameters: {'splitter': 'random', 'min_samples_split': 0.20683884467251654, 'min_samples_leaf': 0.16111179335524076, 'min_weight_fraction_leaf': 0.44023284040078875, 'max_features': 0.9131333917219109}. Best is trial 2 with value: 0.6743624146605087.[0m
[32m[I 2022-04-13 12:11:52,337][0m Trial 4 finished with value: 0.6183138288246293 and parameters: {'splitter': 'best', 'min_samples_split': 0.003830896866468502, 'min_samples_leaf': 0.1945961237082656, 'min_weight_fraction_leaf': 0.13634375564993267, 'max_features': 0.6948330100617378}. Best is trial 2 with value: 0.6743624146605087.[0m
[32m[I 2022-04-13 12:11:52,397][0m Trial 5 finished with value: 0.5741154210754972 and parameters: {'splitter': 'best', 'min_samples_split': 0.4108898860893435, 'min_samples_leaf': 0.3814131074023682, 'min_weight_fraction_leaf': 0.03220411723450073, 'max_features': 0.46183465250442357}. Best is trial 2 with value: 0.6743624146605087.[0m
[32m[I 2022-04-13 12:11:52,862][0m Trial 6 finished with value: 0.7019868539723896 and parameters: {'splitter': 'best', 'min_samples_split': 0.05347798514136014, 'min_samples_leaf': 0.11467730908409297, 'min_weight_fraction_leaf': 0.2263401394005224, 'max_features': 0.6159115346184679}. Best is trial 6 with value: 0.7019868539723896.[0m
[32m[I 2022-04-13 12:11:52,977][0m Trial 7 finished with value: 0.6175523453162901 and parameters: {'splitter': 'best', 'min_samples_split': 0.09722427524992466, 'min_samples_leaf': 0.16352316761400662, 'min_weight_fraction_leaf': 0.24431082251666247, 'max_features': 0.4338744994853614}. Best is trial 6 with value: 0.7019868539723896.[0m
