[32m[I 2022-04-15 02:56:02,340][0m Trial 52 finished with value: 0.5 and parameters: {'loss': 'coxph', 'learning_rate': 0.0005127943226040884, 'n_estimators': 845, 'criterion': 'friedman_mse', 'min_samples_split': 8, 'min_samples_leaf': 9, 'min_weight_fraction_leaf': 0.09274185739596966, 'min_impurity_decrease': 0.2946384517229129, 'max_features': 0.3215850908186745, 'subsample': 0.6053210626676647, 'dropout_rate': 0.973254277764496, 'ccp_alpha': 2.0207370881983873}. Best is trial 0 with value: 0.5.[0m
[32m[I 2022-04-15 02:57:06,752][0m Trial 53 finished with value: 0.5 and parameters: {'loss': 'coxph', 'learning_rate': 0.0005073860803876055, 'n_estimators': 880, 'criterion': 'friedman_mse', 'min_samples_split': 7, 'min_samples_leaf': 7, 'min_weight_fraction_leaf': 0.06086649788380169, 'min_impurity_decrease': 0.293502072177409, 'max_features': 0.37696947645989154, 'subsample': 0.45147811544437294, 'dropout_rate': 0.9774633425941244, 'ccp_alpha': 1.832765731243848}. Best is trial 0 with value: 0.5.[0m
[32m[I 2022-04-15 02:57:41,201][0m Trial 54 finished with value: 0.5 and parameters: {'loss': 'coxph', 'learning_rate': 0.043182952863589814, 'n_estimators': 504, 'criterion': 'friedman_mse', 'min_samples_split': 10, 'min_samples_leaf': 8, 'min_weight_fraction_leaf': 0.038892456706043174, 'min_impurity_decrease': 0.4362759715267817, 'max_features': 0.35085952595203496, 'subsample': 0.5753802498370107, 'dropout_rate': 0.9551402288043161, 'ccp_alpha': 2.606775244442511}. Best is trial 0 with value: 0.5.[0m
[32m[I 2022-04-15 02:58:27,665][0m Trial 55 finished with value: 0.5 and parameters: {'loss': 'coxph', 'learning_rate': 0.0646327235256203, 'n_estimators': 698, 'criterion': 'friedman_mse', 'min_samples_split': 9, 'min_samples_leaf': 7, 'min_weight_fraction_leaf': 0.09067741624129222, 'min_impurity_decrease': 0.38409932114038353, 'max_features': 0.45682837043367175, 'subsample': 0.6456224776998445, 'dropout_rate': 0.9801166251599918, 'ccp_alpha': 2.788091671546633}. Best is trial 0 with value: 0.5.[0m
[32m[I 2022-04-15 02:59:53,559][0m Trial 56 finished with value: 0.5 and parameters: {'loss': 'coxph', 'learning_rate': 0.013522950133209935, 'n_estimators': 746, 'criterion': 'friedman_mse', 'min_samples_split': 10, 'min_samples_leaf': 5, 'min_weight_fraction_leaf': 0.07186753415345301, 'min_impurity_decrease': 0.1448753265812433, 'max_features': 0.2906967758783841, 'subsample': 0.384349472132807, 'dropout_rate': 0.8161366986404418, 'ccp_alpha': 1.4813450422069068}. Best is trial 0 with value: 0.5.[0m
[32m[I 2022-04-15 03:02:10,626][0m Trial 57 finished with value: 0.5 and parameters: {'loss': 'coxph', 'learning_rate': 0.01922753397407493, 'n_estimators': 943, 'criterion': 'friedman_mse', 'min_samples_split': 10, 'min_samples_leaf': 4, 'min_weight_fraction_leaf': 0.05545577583820796, 'min_impurity_decrease': 0.8019434530531102, 'max_features': 0.270598392464497, 'subsample': 0.3571044128203737, 'dropout_rate': 0.7566337684171353, 'ccp_alpha': 2.489957805466896}. Best is trial 0 with value: 0.5.[0m
[32m[I 2022-04-15 03:02:51,110][0m Trial 58 finished with value: 0.3256375853394913 and parameters: {'loss': 'squared', 'learning_rate': 0.0037524877238661724, 'n_estimators': 408, 'criterion': 'squared_error', 'min_samples_split': 5, 'min_samples_leaf': 1, 'min_weight_fraction_leaf': 0.2673985025955061, 'min_impurity_decrease': 0.10642493172005905, 'max_features': 0.22292004800399773, 'subsample': 0.3330840996186361, 'dropout_rate': 0.23026504385907245, 'ccp_alpha': 0.3103524043857393}. Best is trial 0 with value: 0.5.[0m
[32m[I 2022-04-15 03:03:18,545][0m Trial 59 finished with value: 0.5 and parameters: {'loss': 'squared', 'learning_rate': 0.05082604778236295, 'n_estimators': 380, 'criterion': 'friedman_mse', 'min_samples_split': 10, 'min_samples_leaf': 2, 'min_weight_fraction_leaf': 0.2439626610664237, 'min_impurity_decrease': 0.08531979934085632, 'max_features': 0.26273621485062637, 'subsample': 0.7136404832521268, 'dropout_rate': 0.4027440590305957, 'ccp_alpha': 0.733291712437026}. Best is trial 0 with value: 0.5.[0m
[32m[I 2022-04-15 03:03:22,438][0m Trial 60 finished with value: 0.5 and parameters: {'loss': 'squared', 'learning_rate': 5.944936906637429e-05, 'n_estimators': 124, 'criterion': 'friedman_mse', 'min_samples_split': 2, 'min_samples_leaf': 4, 'min_weight_fraction_leaf': 0.3070900785773271, 'min_impurity_decrease': 0.5478546528281373, 'max_features': 0.4382310353345697, 'subsample': 0.2737798683251604, 'dropout_rate': 0.32128752120900966, 'ccp_alpha': 1.2445519473083315}. Best is trial 0 with value: 0.5.[0m
[32m[I 2022-04-15 03:03:27,749][0m Trial 61 finished with value: 0.5 and parameters: {'loss': 'squared', 'learning_rate': 0.0006654211071440193, 'n_estimators': 178, 'criterion': 'absolute_error', 'min_samples_split': 3, 'min_samples_leaf': 3, 'min_weight_fraction_leaf': 0.3764311283062536, 'min_impurity_decrease': 0.534682437502348, 'max_features': 0.20666482350002952, 'subsample': 0.2518558196667326, 'dropout_rate': 0.5515789849372219, 'ccp_alpha': 3.40661977258873}. Best is trial 0 with value: 0.5.[0m
[32m[I 2022-04-15 03:03:36,206][0m Trial 62 finished with value: 0.5 and parameters: {'loss': 'squared', 'learning_rate': 0.000167211203367241, 'n_estimators': 204, 'criterion': 'absolute_error', 'min_samples_split': 4, 'min_samples_leaf': 8, 'min_weight_fraction_leaf': 0.45105429187247037, 'min_impurity_decrease': 0.6101805101966766, 'max_features': 0.1476458312400205, 'subsample': 0.23131293048051887, 'dropout_rate': 0.3569373161595918, 'ccp_alpha': 1.0338141709821596}. Best is trial 0 with value: 0.5.[0m
[32m[I 2022-04-15 03:03:40,649][0m Trial 63 finished with value: 0.5 and parameters: {'loss': 'squared', 'learning_rate': 3.099014556286945e-05, 'n_estimators': 169, 'criterion': 'squared_error', 'min_samples_split': 6, 'min_samples_leaf': 4, 'min_weight_fraction_leaf': 0.22204032810884616, 'min_impurity_decrease': 0.3972231198412483, 'max_features': 0.19757893563060927, 'subsample': 0.13692235553459553, 'dropout_rate': 0.5255741024631829, 'ccp_alpha': 4.456546821586285}. Best is trial 0 with value: 0.5.[0m
[32m[I 2022-04-15 03:04:00,419][0m Trial 64 finished with value: 0.5 and parameters: {'loss': 'squared', 'learning_rate': 5.128043664513186e-05, 'n_estimators': 342, 'criterion': 'absolute_error', 'min_samples_split': 3, 'min_samples_leaf': 2, 'min_weight_fraction_leaf': 0.3682936435744406, 'min_impurity_decrease': 0.4632890778302531, 'max_features': 0.15865002407533302, 'subsample': 0.16727893039518674, 'dropout_rate': 0.475017782766499, 'ccp_alpha': 3.2157643728969525}. Best is trial 0 with value: 0.5.[0m
[32m[I 2022-04-15 03:04:28,308][0m Trial 65 finished with value: 0.5 and parameters: {'loss': 'squared', 'learning_rate': 0.0010787903983137037, 'n_estimators': 470, 'criterion': 'absolute_error', 'min_samples_split': 6, 'min_samples_leaf': 3, 'min_weight_fraction_leaf': 0.22705889998690373, 'min_impurity_decrease': 0.06566865045937802, 'max_features': 0.05360075978907464, 'subsample': 0.06348828346686675, 'dropout_rate': 0.6383524501433654, 'ccp_alpha': 4.077046555783407}. Best is trial 0 with value: 0.5.[0m
[32m[I 2022-04-15 03:04:34,241][0m Trial 66 finished with value: 0.5 and parameters: {'loss': 'squared', 'learning_rate': 2.1327785928600857e-06, 'n_estimators': 189, 'criterion': 'absolute_error', 'min_samples_split': 5, 'min_samples_leaf': 8, 'min_weight_fraction_leaf': 0.2600328759269893, 'min_impurity_decrease': 0.062123617652670556, 'max_features': 0.08348525848630184, 'subsample': 0.31212676067504114, 'dropout_rate': 0.5727539552153509, 'ccp_alpha': 3.814223157002827}. Best is trial 0 with value: 0.5.[0m
[32m[I 2022-04-15 03:04:44,836][0m Trial 67 finished with value: 0.5 and parameters: {'loss': 'squared', 'learning_rate': 1.71493320071087e-05, 'n_estimators': 290, 'criterion': 'absolute_error', 'min_samples_split': 5, 'min_samples_leaf': 6, 'min_weight_fraction_leaf': 0.17883620042329995, 'min_impurity_decrease': 0.2303883818270404, 'max_features': 0.04238401540302306, 'subsample': 0.20670760721761106, 'dropout_rate': 0.6529512645450494, 'ccp_alpha': 3.9184263763475076}. Best is trial 0 with value: 0.5.[0m
[32m[I 2022-04-15 03:04:53,495][0m Trial 68 finished with value: 0.5 and parameters: {'loss': 'squared', 'learning_rate': 0.00014002625846322542, 'n_estimators': 283, 'criterion': 'absolute_error', 'min_samples_split': 6, 'min_samples_leaf': 6, 'min_weight_fraction_leaf': 0.1922828186699788, 'min_impurity_decrease': 0.2040371328014186, 'max_features': 0.05139876078298668, 'subsample': 0.1630119311068545, 'dropout_rate': 0.7213996181175544, 'ccp_alpha': 3.512116659026183}. Best is trial 0 with value: 0.5.[0m
[32m[I 2022-04-15 03:04:57,013][0m Trial 69 finished with value: 0.5 and parameters: {'loss': 'squared', 'learning_rate': 0.00022402005841825164, 'n_estimators': 151, 'criterion': 'absolute_error', 'min_samples_split': 2, 'min_samples_leaf': 10, 'min_weight_fraction_leaf': 0.1358605098272411, 'min_impurity_decrease': 0.9861439143741023, 'max_features': 0.03930615240754429, 'subsample': 0.2285777905894948, 'dropout_rate': 0.6191332575084979, 'ccp_alpha': 4.3207248683220305}. Best is trial 0 with value: 0.5.[0m
[32m[I 2022-04-15 03:06:29,745][0m Trial 70 finished with value: 0.5 and parameters: {'loss': 'coxph', 'learning_rate': 0.029242180405791688, 'n_estimators': 621, 'criterion': 'absolute_error', 'min_samples_split': 5, 'min_samples_leaf': 6, 'min_weight_fraction_leaf': 0.16921166352134956, 'min_impurity_decrease': 0.3585065272744931, 'max_features': 0.0031633396354136187, 'subsample': 0.013009865704856155, 'dropout_rate': 0.7442173463613546, 'ccp_alpha': 4.100076494332392}. Best is trial 0 with value: 0.5.[0m
[32m[I 2022-04-15 03:07:57,376][0m Trial 71 finished with value: 0.5 and parameters: {'loss': 'coxph', 'learning_rate': 2.0344560968067537e-06, 'n_estimators': 643, 'criterion': 'absolute_error', 'min_samples_split': 4, 'min_samples_leaf': 8, 'min_weight_fraction_leaf': 0.1511701026298359, 'min_impurity_decrease': 0.0011648872006009559, 'max_features': 0.12115125765639577, 'subsample': 0.05918093671221669, 'dropout_rate': 0.7964064270947817, 'ccp_alpha': 4.4943027096103325}. Best is trial 0 with value: 0.5.[0m
[32m[I 2022-04-15 03:08:48,412][0m Trial 72 finished with value: 0.5 and parameters: {'loss': 'coxph', 'learning_rate': 0.002025164794004203, 'n_estimators': 560, 'criterion': 'squared_error', 'min_samples_split': 7, 'min_samples_leaf': 10, 'min_weight_fraction_leaf': 0.07103675029606871, 'min_impurity_decrease': 0.2562992870216551, 'max_features': 0.9065264907021843, 'subsample': 0.9569694755186108, 'dropout_rate': 0.8867077247390386, 'ccp_alpha': 2.2237954473122628}. Best is trial 0 with value: 0.5.[0m
[32m[I 2022-04-15 03:09:58,371][0m Trial 73 finished with value: 0.5 and parameters: {'loss': 'coxph', 'learning_rate': 0.0017990344202158056, 'n_estimators': 685, 'criterion': 'friedman_mse', 'min_samples_split': 9, 'min_samples_leaf': 9, 'min_weight_fraction_leaf': 0.026180716282191208, 'min_impurity_decrease': 0.3423535220664276, 'max_features': 0.9835868460133999, 'subsample': 0.9128962700257449, 'dropout_rate': 0.8585431042909721, 'ccp_alpha': 1.8375275315957447}. Best is trial 0 with value: 0.5.[0m
[32m[I 2022-04-15 03:11:38,686][0m Trial 74 finished with value: 0.5 and parameters: {'loss': 'coxph', 'learning_rate': 0.0026917361031754553, 'n_estimators': 959, 'criterion': 'friedman_mse', 'min_samples_split': 7, 'min_samples_leaf': 9, 'min_weight_fraction_leaf': 0.09263586812322987, 'min_impurity_decrease': 0.278271557075266, 'max_features': 0.7375888735728398, 'subsample': 0.8622632495792285, 'dropout_rate': 0.8744974749540622, 'ccp_alpha': 1.4096470607361484}. Best is trial 0 with value: 0.5.[0m
[32m[I 2022-04-15 03:12:48,913][0m Trial 75 finished with value: 0.5 and parameters: {'loss': 'coxph', 'learning_rate': 1.0744221833975976e-06, 'n_estimators': 843, 'criterion': 'friedman_mse', 'min_samples_split': 9, 'min_samples_leaf': 7, 'min_weight_fraction_leaf': 0.06229276544386222, 'min_impurity_decrease': 0.2772429689666363, 'max_features': 0.36103486474916124, 'subsample': 0.7107014974823486, 'dropout_rate': 0.9358028715342861, 'ccp_alpha': 1.7343971888503735}. Best is trial 0 with value: 0.5.[0m
[32m[I 2022-04-15 03:14:06,391][0m Trial 76 finished with value: 0.5 and parameters: {'loss': 'coxph', 'learning_rate': 0.0004940535417472718, 'n_estimators': 993, 'criterion': 'friedman_mse', 'min_samples_split': 8, 'min_samples_leaf': 7, 'min_weight_fraction_leaf': 0.020218357516019317, 'min_impurity_decrease': 0.2110326200693997, 'max_features': 0.3859771123851538, 'subsample': 0.7449853602281927, 'dropout_rate': 0.9697691846482002, 'ccp_alpha': 1.8413852533223514}. Best is trial 0 with value: 0.5.[0m
[32m[I 2022-04-15 03:15:16,974][0m Trial 77 finished with value: 0.5 and parameters: {'loss': 'coxph', 'learning_rate': 0.036369041411627945, 'n_estimators': 878, 'criterion': 'friedman_mse', 'min_samples_split': 10, 'min_samples_leaf': 7, 'min_weight_fraction_leaf': 0.0383238304196966, 'min_impurity_decrease': 0.42024114025822706, 'max_features': 0.5837680349655238, 'subsample': 0.5875996460319701, 'dropout_rate': 0.9438346188376141, 'ccp_alpha': 2.1360162421743025}. Best is trial 0 with value: 0.5.[0m
[32m[I 2022-04-15 03:16:16,581][0m Trial 78 finished with value: 0.5 and parameters: {'loss': 'coxph', 'learning_rate': 0.00876735819615841, 'n_estimators': 820, 'criterion': 'friedman_mse', 'min_samples_split': 10, 'min_samples_leaf': 8, 'min_weight_fraction_leaf': 0.0388800103511337, 'min_impurity_decrease': 0.16218439596453824, 'max_features': 0.5726033558019796, 'subsample': 0.6692448945425373, 'dropout_rate': 0.9606009569654859, 'ccp_alpha': 2.3469175826929893}. Best is trial 0 with value: 0.5.[0m
[32m[I 2022-04-15 03:17:16,605][0m Trial 79 finished with value: 0.5 and parameters: {'loss': 'coxph', 'learning_rate': 0.06851521872931784, 'n_estimators': 714, 'criterion': 'friedman_mse', 'min_samples_split': 7, 'min_samples_leaf': 8, 'min_weight_fraction_leaf': 0.08512445652765989, 'min_impurity_decrease': 0.372393220755987, 'max_features': 0.49472957612289414, 'subsample': 0.5127453638356996, 'dropout_rate': 0.915474574292429, 'ccp_alpha': 2.8776212220160913}. Best is trial 0 with value: 0.5.[0m
[32m[I 2022-04-15 03:18:26,336][0m Trial 80 finished with value: 0.5 and parameters: {'loss': 'coxph', 'learning_rate': 0.020742809777076248, 'n_estimators': 690, 'criterion': 'friedman_mse', 'min_samples_split': 8, 'min_samples_leaf': 5, 'min_weight_fraction_leaf': 0.10644396203922486, 'min_impurity_decrease': 0.45152916289120815, 'max_features': 0.3050162138954655, 'subsample': 0.4020627747912692, 'dropout_rate': 0.8314559935667446, 'ccp_alpha': 2.680657410628285}. Best is trial 0 with value: 0.5.[0m
[32m[I 2022-04-15 03:19:12,841][0m Trial 81 finished with value: 0.5 and parameters: {'loss': 'coxph', 'learning_rate': 0.044299722764394055, 'n_estimators': 515, 'criterion': 'friedman_mse', 'min_samples_split': 10, 'min_samples_leaf': 9, 'min_weight_fraction_leaf': 0.08813690981931097, 'min_impurity_decrease': 0.8011128778945616, 'max_features': 0.2855994394639416, 'subsample': 0.47840093419007834, 'dropout_rate': 0.7743167418459775, 'ccp_alpha': 2.4629843186368885}. Best is trial 0 with value: 0.5.[0m
[32m[I 2022-04-15 03:19:43,919][0m Trial 82 finished with value: 0.5 and parameters: {'loss': 'coxph', 'learning_rate': 0.014841549048677046, 'n_estimators': 510, 'criterion': 'friedman_mse', 'min_samples_split': 10, 'min_samples_leaf': 2, 'min_weight_fraction_leaf': 0.06988019799296116, 'min_impurity_decrease': 0.9056886925793277, 'max_features': 0.42913375552152516, 'subsample': 0.4357613786068809, 'dropout_rate': 0.9865780579804193, 'ccp_alpha': 2.5530614531533815}. Best is trial 0 with value: 0.5.[0m
[32m[I 2022-04-15 03:19:47,738][0m Trial 83 finished with value: 0.5 and parameters: {'loss': 'squared', 'learning_rate': 0.05511785274067604, 'n_estimators': 133, 'criterion': 'friedman_mse', 'min_samples_split': 10, 'min_samples_leaf': 4, 'min_weight_fraction_leaf': 0.29910566875673195, 'min_impurity_decrease': 0.7540143436636262, 'max_features': 0.46212220284252453, 'subsample': 0.386579390599315, 'dropout_rate': 0.3335196805215298, 'ccp_alpha': 1.5409763347612488}. Best is trial 0 with value: 0.5.[0m
[32m[I 2022-04-15 03:23:31,277][0m Trial 84 finished with value: 0.5 and parameters: {'loss': 'coxph', 'learning_rate': 0.01735804495271995, 'n_estimators': 927, 'criterion': 'friedman_mse', 'min_samples_split': 10, 'min_samples_leaf': 4, 'min_weight_fraction_leaf': 0.31374222534832164, 'min_impurity_decrease': 0.7166472582469515, 'max_features': 0.37330205340777284, 'subsample': 0.6481053322072443, 'dropout_rate': 0.2905901888075567, 'ccp_alpha': 0.7686587493770387}. Best is trial 0 with value: 0.5.[0m
[32m[I 2022-04-15 03:23:34,072][0m Trial 85 finished with value: 0.5 and parameters: {'loss': 'squared', 'learning_rate': 0.0455039343642871, 'n_estimators': 118, 'criterion': 'friedman_mse', 'min_samples_split': 3, 'min_samples_leaf': 3, 'min_weight_fraction_leaf': 0.3685149732594441, 'min_impurity_decrease': 0.5221583628573545, 'max_features': 0.418158567094139, 'subsample': 0.2746203603255832, 'dropout_rate': 0.4096769130624188, 'ccp_alpha': 1.1938490705446103}. Best is trial 0 with value: 0.5.[0m
[32m[I 2022-04-15 03:23:35,788][0m Trial 86 finished with value: 0.5 and parameters: {'loss': 'squared', 'learning_rate': 0.023715292112799803, 'n_estimators': 124, 'criterion': 'friedman_mse', 'min_samples_split': 2, 'min_samples_leaf': 4, 'min_weight_fraction_leaf': 0.4195152721256993, 'min_impurity_decrease': 0.5831694929483502, 'max_features': 0.3537032722236866, 'subsample': 0.2546336173331353, 'dropout_rate': 0.7527701664905004, 'ccp_alpha': 0.6289508708967261}. Best is trial 0 with value: 0.5.[0m
[32m[I 2022-04-15 03:23:41,210][0m Trial 87 finished with value: 0.5 and parameters: {'loss': 'squared', 'learning_rate': 7.082717663813881e-05, 'n_estimators': 153, 'criterion': 'friedman_mse', 'min_samples_split': 2, 'min_samples_leaf': 3, 'min_weight_fraction_leaf': 0.4214825887784409, 'min_impurity_decrease': 0.6665574643426994, 'max_features': 0.47303565637879563, 'subsample': 0.3500327632924923, 'dropout_rate': 0.2371644536087777, 'ccp_alpha': 0.8574376253206438}. Best is trial 0 with value: 0.5.[0m
[32m[I 2022-04-15 03:23:48,051][0m Trial 88 finished with value: 0.5 and parameters: {'loss': 'squared', 'learning_rate': 4.227836476968369e-05, 'n_estimators': 210, 'criterion': 'squared_error', 'min_samples_split': 3, 'min_samples_leaf': 4, 'min_weight_fraction_leaf': 0.4024715696700003, 'min_impurity_decrease': 0.6376056853839341, 'max_features': 0.261692152472669, 'subsample': 0.25971487658054915, 'dropout_rate': 0.515905049246669, 'ccp_alpha': 0.454398015660038}. Best is trial 0 with value: 0.5.[0m
[32m[I 2022-04-15 03:24:07,797][0m Trial 89 finished with value: 0.5 and parameters: {'loss': 'squared', 'learning_rate': 2.974343913486187e-05, 'n_estimators': 340, 'criterion': 'squared_error', 'min_samples_split': 3, 'min_samples_leaf': 2, 'min_weight_fraction_leaf': 0.4922888736866384, 'min_impurity_decrease': 0.4980011726253467, 'max_features': 0.2030637439408174, 'subsample': 0.1795058705329759, 'dropout_rate': 0.43742083544570143, 'ccp_alpha': 3.2646723815660783}. Best is trial 0 with value: 0.5.[0m
[32m[I 2022-04-15 03:24:13,411][0m Trial 90 finished with value: 0.5 and parameters: {'loss': 'squared', 'learning_rate': 7.252644539578364e-05, 'n_estimators': 170, 'criterion': 'squared_error', 'min_samples_split': 3, 'min_samples_leaf': 1, 'min_weight_fraction_leaf': 0.36549885729432313, 'min_impurity_decrease': 0.5937481058717143, 'max_features': 0.15879735660765779, 'subsample': 0.1356493918986459, 'dropout_rate': 0.3711827003111789, 'ccp_alpha': 1.267148912469323}. Best is trial 0 with value: 0.5.[0m
[32m[I 2022-04-15 03:24:19,323][0m Trial 91 finished with value: 0.5 and parameters: {'loss': 'squared', 'learning_rate': 0.0011146985898736143, 'n_estimators': 191, 'criterion': 'absolute_error', 'min_samples_split': 4, 'min_samples_leaf': 3, 'min_weight_fraction_leaf': 0.23203713725814396, 'min_impurity_decrease': 0.537417412490035, 'max_features': 0.08985919975705756, 'subsample': 0.2941547306709609, 'dropout_rate': 0.5538984527575721, 'ccp_alpha': 3.590529439920281}. Best is trial 0 with value: 0.5.[0m
[32m[I 2022-04-15 03:24:39,332][0m Trial 92 finished with value: 0.5 and parameters: {'loss': 'squared', 'learning_rate': 0.0007547008390105165, 'n_estimators': 344, 'criterion': 'absolute_error', 'min_samples_split': 4, 'min_samples_leaf': 2, 'min_weight_fraction_leaf': 0.21963191653136618, 'min_impurity_decrease': 0.06890887083887644, 'max_features': 0.1591038040846262, 'subsample': 0.3200560760112164, 'dropout_rate': 0.4783222438691963, 'ccp_alpha': 3.2064671350951093}. Best is trial 0 with value: 0.5.[0m
[32m[I 2022-04-15 03:24:43,938][0m Trial 93 finished with value: 0.5 and parameters: {'loss': 'squared', 'learning_rate': 1.730221619473163e-05, 'n_estimators': 172, 'criterion': 'absolute_error', 'min_samples_split': 5, 'min_samples_leaf': 3, 'min_weight_fraction_leaf': 0.26032855322356696, 'min_impurity_decrease': 0.6258549760573686, 'max_features': 0.15347847151908556, 'subsample': 0.20637128309424096, 'dropout_rate': 0.5680829365207433, 'ccp_alpha': 3.874969882925599}. Best is trial 0 with value: 0.5.[0m
