[32m[I 2022-04-13 12:09:49,187][0m Trial 935 finished with value: 0.8853606612057081 and parameters: {'splitter': 'best', 'min_samples_split': 0.135488634507834, 'min_samples_leaf': 0.04870125847864442, 'min_weight_fraction_leaf': 0.00014430245164795408, 'max_features': 0.9833311254762142}. Best is trial 448 with value: 0.8888507593246218.[0m
/media/san2_ssd/data/Workdir/survival/utils.py:305: RuntimeWarning: invalid value encountered in true_divide
  pdfs = np.gradient(1-survs,axis=1)/norms
/media/san2_ssd/data/Workdir/survival/utils.py:305: RuntimeWarning: invalid value encountered in true_divide
  pdfs = np.gradient(1-survs,axis=1)/norms
/media/san2_ssd/data/Workdir/survival/utils.py:305: RuntimeWarning: invalid value encountered in true_divide
  pdfs = np.gradient(1-survs,axis=1)/norms
[32m[I 2022-04-13 12:09:50,982][0m Trial 936 finished with value: 0.8838729624563919 and parameters: {'splitter': 'best', 'min_samples_split': 0.10821109215692311, 'min_samples_leaf': 0.03392855756014747, 'min_weight_fraction_leaf': 0.046355776106814, 'max_features': 0.9667969274090947}. Best is trial 448 with value: 0.8888507593246218.[0m
/media/san2_ssd/data/Workdir/survival/utils.py:305: RuntimeWarning: invalid value encountered in true_divide
  pdfs = np.gradient(1-survs,axis=1)/norms
/media/san2_ssd/data/Workdir/survival/utils.py:305: RuntimeWarning: invalid value encountered in true_divide
  pdfs = np.gradient(1-survs,axis=1)/norms
/media/san2_ssd/data/Workdir/survival/utils.py:305: RuntimeWarning: invalid value encountered in true_divide
  pdfs = np.gradient(1-survs,axis=1)/norms
/media/san2_ssd/data/Workdir/survival/utils.py:305: RuntimeWarning: invalid value encountered in true_divide
  pdfs = np.gradient(1-survs,axis=1)/norms
[32m[I 2022-04-13 12:09:52,827][0m Trial 937 finished with value: 0.8849503391683295 and parameters: {'splitter': 'best', 'min_samples_split': 0.08720210577071301, 'min_samples_leaf': 0.020711125144311907, 'min_weight_fraction_leaf': 0.036963836893963015, 'max_features': 0.9829813737860796}. Best is trial 448 with value: 0.8888507593246218.[0m
[32m[I 2022-04-13 12:09:53,755][0m Trial 938 finished with value: 0.5556691941246595 and parameters: {'splitter': 'best', 'min_samples_split': 0.12123318761251023, 'min_samples_leaf': 0.1983414174090376, 'min_weight_fraction_leaf': 0.021942490107748933, 'max_features': 0.953911462590866}. Best is trial 448 with value: 0.8888507593246218.[0m
/media/san2_ssd/data/Workdir/survival/utils.py:305: RuntimeWarning: invalid value encountered in true_divide
  pdfs = np.gradient(1-survs,axis=1)/norms
/media/san2_ssd/data/Workdir/survival/utils.py:305: RuntimeWarning: invalid value encountered in true_divide
  pdfs = np.gradient(1-survs,axis=1)/norms
/media/san2_ssd/data/Workdir/survival/utils.py:305: RuntimeWarning: invalid value encountered in true_divide
  pdfs = np.gradient(1-survs,axis=1)/norms
[32m[I 2022-04-13 12:09:56,808][0m Trial 939 finished with value: 0.8854690605133584 and parameters: {'splitter': 'best', 'min_samples_split': 0.10195734071901996, 'min_samples_leaf': 0.042168650572118, 'min_weight_fraction_leaf': 0.05242677059582101, 'max_features': 0.9803845863879368}. Best is trial 448 with value: 0.8888507593246218.[0m
[32m[I 2022-04-13 12:09:57,765][0m Trial 940 finished with value: 0.8808887021423036 and parameters: {'splitter': 'best', 'min_samples_split': 0.06776027628824197, 'min_samples_leaf': 0.06703084858982178, 'min_weight_fraction_leaf': 0.07998226226369562, 'max_features': 0.9274144708363655}. Best is trial 448 with value: 0.8888507593246218.[0m
/media/san2_ssd/data/Workdir/survival/utils.py:305: RuntimeWarning: invalid value encountered in true_divide
  pdfs = np.gradient(1-survs,axis=1)/norms
[32m[I 2022-04-13 12:09:59,690][0m Trial 941 finished with value: 0.7862429285042403 and parameters: {'splitter': 'best', 'min_samples_split': 0.11273074385629793, 'min_samples_leaf': 0.03555677267546899, 'min_weight_fraction_leaf': 0.0629087679938807, 'max_features': 0.9998491463529232}. Best is trial 448 with value: 0.8888507593246218.[0m
/media/san2_ssd/data/Workdir/survival/utils.py:305: RuntimeWarning: invalid value encountered in true_divide
  pdfs = np.gradient(1-survs,axis=1)/norms
[32m[I 2022-04-13 12:10:01,255][0m Trial 942 finished with value: 0.8820591301652758 and parameters: {'splitter': 'best', 'min_samples_split': 0.12810442948426012, 'min_samples_leaf': 0.054481334607661476, 'min_weight_fraction_leaf': 0.028207582086043435, 'max_features': 0.8101140454726775}. Best is trial 448 with value: 0.8888507593246218.[0m
/media/san2_ssd/data/Workdir/survival/utils.py:305: RuntimeWarning: invalid value encountered in true_divide
  pdfs = np.gradient(1-survs,axis=1)/norms
[32m[I 2022-04-13 12:10:02,576][0m Trial 943 finished with value: 0.7872126373345234 and parameters: {'splitter': 'best', 'min_samples_split': 0.1458801468149662, 'min_samples_leaf': 0.0457186686901191, 'min_weight_fraction_leaf': 0.018762238886627446, 'max_features': 0.9786715435302494}. Best is trial 448 with value: 0.8888507593246218.[0m
[32m[I 2022-04-13 12:10:03,211][0m Trial 944 finished with value: 0.6955563266018491 and parameters: {'splitter': 'best', 'min_samples_split': 0.11661995737718855, 'min_samples_leaf': 0.3004978110039295, 'min_weight_fraction_leaf': 0.15942408604517766, 'max_features': 0.5896179460505782}. Best is trial 448 with value: 0.8888507593246218.[0m
[32m[I 2022-04-13 12:10:03,531][0m Trial 945 finished with value: 0.6981432179087999 and parameters: {'splitter': 'best', 'min_samples_split': 0.09596650861439258, 'min_samples_leaf': 0.4554935433248675, 'min_weight_fraction_leaf': 0.037858199668999476, 'max_features': 0.9999495821631845}. Best is trial 448 with value: 0.8888507593246218.[0m
/media/san2_ssd/data/Workdir/survival/utils.py:305: RuntimeWarning: invalid value encountered in true_divide
  pdfs = np.gradient(1-survs,axis=1)/norms
[32m[I 2022-04-13 12:10:06,137][0m Trial 946 finished with value: 0.884181960771893 and parameters: {'splitter': 'best', 'min_samples_split': 0.13256810696760615, 'min_samples_leaf': 0.05704158289487438, 'min_weight_fraction_leaf': 0.009839290155428379, 'max_features': 0.9639542686931217}. Best is trial 448 with value: 0.8888507593246218.[0m
/media/san2_ssd/data/Workdir/survival/utils.py:305: RuntimeWarning: invalid value encountered in true_divide
  pdfs = np.gradient(1-survs,axis=1)/norms
/media/san2_ssd/data/Workdir/survival/utils.py:305: RuntimeWarning: invalid value encountered in true_divide
  pdfs = np.gradient(1-survs,axis=1)/norms
/media/san2_ssd/data/Workdir/survival/utils.py:305: RuntimeWarning: invalid value encountered in true_divide
  pdfs = np.gradient(1-survs,axis=1)/norms
[32m[I 2022-04-13 12:10:09,043][0m Trial 947 finished with value: 0.8827721496085521 and parameters: {'splitter': 'best', 'min_samples_split': 0.08205112440908871, 'min_samples_leaf': 0.023777430427048697, 'min_weight_fraction_leaf': 0.048459212349788866, 'max_features': 0.9443004433805705}. Best is trial 448 with value: 0.8888507593246218.[0m
/media/san2_ssd/data/Workdir/survival/utils.py:305: RuntimeWarning: invalid value encountered in true_divide
  pdfs = np.gradient(1-survs,axis=1)/norms
/media/san2_ssd/data/Workdir/survival/utils.py:305: RuntimeWarning: invalid value encountered in true_divide
  pdfs = np.gradient(1-survs,axis=1)/norms
/media/san2_ssd/data/Workdir/survival/utils.py:305: RuntimeWarning: invalid value encountered in true_divide
  pdfs = np.gradient(1-survs,axis=1)/norms
[32m[I 2022-04-13 12:10:11,274][0m Trial 948 finished with value: 0.8832697016225941 and parameters: {'splitter': 'best', 'min_samples_split': 0.10266329786403383, 'min_samples_leaf': 0.015712314193209773, 'min_weight_fraction_leaf': 0.02698067113812908, 'max_features': 0.9667043278158337}. Best is trial 448 with value: 0.8888507593246218.[0m
/media/san2_ssd/data/Workdir/survival/utils.py:305: RuntimeWarning: invalid value encountered in true_divide
  pdfs = np.gradient(1-survs,axis=1)/norms
/media/san2_ssd/data/Workdir/survival/utils.py:305: RuntimeWarning: invalid value encountered in true_divide
  pdfs = np.gradient(1-survs,axis=1)/norms
/media/san2_ssd/data/Workdir/survival/utils.py:305: RuntimeWarning: invalid value encountered in true_divide
  pdfs = np.gradient(1-survs,axis=1)/norms
/media/san2_ssd/data/Workdir/survival/utils.py:305: RuntimeWarning: invalid value encountered in true_divide
  pdfs = np.gradient(1-survs,axis=1)/norms
[32m[I 2022-04-13 12:10:14,304][0m Trial 949 finished with value: 0.8874916709878475 and parameters: {'splitter': 'best', 'min_samples_split': 0.10989681127364122, 'min_samples_leaf': 0.03243140512945982, 'min_weight_fraction_leaf': 0.03718437716252966, 'max_features': 0.9803563687006009}. Best is trial 448 with value: 0.8888507593246218.[0m
[32m[I 2022-04-13 12:10:14,838][0m Trial 950 finished with value: 0.7802420382287641 and parameters: {'splitter': 'random', 'min_samples_split': 0.12247167149069653, 'min_samples_leaf': 0.039353459681783394, 'min_weight_fraction_leaf': 0.01639967421139439, 'max_features': 0.9489872426244107}. Best is trial 448 with value: 0.8888507593246218.[0m
/media/san2_ssd/data/Workdir/survival/utils.py:305: RuntimeWarning: invalid value encountered in true_divide
  pdfs = np.gradient(1-survs,axis=1)/norms
/media/san2_ssd/data/Workdir/survival/utils.py:305: RuntimeWarning: invalid value encountered in true_divide
  pdfs = np.gradient(1-survs,axis=1)/norms
/media/san2_ssd/data/Workdir/survival/utils.py:305: RuntimeWarning: invalid value encountered in true_divide
  pdfs = np.gradient(1-survs,axis=1)/norms
[32m[I 2022-04-13 12:10:16,851][0m Trial 951 finished with value: 0.8800070682612446 and parameters: {'splitter': 'best', 'min_samples_split': 0.09198713693563526, 'min_samples_leaf': 0.01812941409718787, 'min_weight_fraction_leaf': 0.02848663765898656, 'max_features': 0.7403638009747655}. Best is trial 448 with value: 0.8888507593246218.[0m
/media/san2_ssd/data/Workdir/survival/utils.py:305: RuntimeWarning: invalid value encountered in true_divide
  pdfs = np.gradient(1-survs,axis=1)/norms
/media/san2_ssd/data/Workdir/survival/utils.py:305: RuntimeWarning: invalid value encountered in true_divide
  pdfs = np.gradient(1-survs,axis=1)/norms
/media/san2_ssd/data/Workdir/survival/utils.py:305: RuntimeWarning: invalid value encountered in true_divide
  pdfs = np.gradient(1-survs,axis=1)/norms
/media/san2_ssd/data/Workdir/survival/utils.py:305: RuntimeWarning: invalid value encountered in true_divide
  pdfs = np.gradient(1-survs,axis=1)/norms
/media/san2_ssd/data/Workdir/survival/utils.py:305: RuntimeWarning: invalid value encountered in true_divide
  pdfs = np.gradient(1-survs,axis=1)/norms
[32m[I 2022-04-13 12:10:19,474][0m Trial 952 finished with value: 0.8868683853853045 and parameters: {'splitter': 'best', 'min_samples_split': 0.028089280190544547, 'min_samples_leaf': 0.02735027929398614, 'min_weight_fraction_leaf': 0.016964857821220737, 'max_features': 0.9998069760014354}. Best is trial 448 with value: 0.8888507593246218.[0m
/media/san2_ssd/data/Workdir/survival/utils.py:305: RuntimeWarning: invalid value encountered in true_divide
  pdfs = np.gradient(1-survs,axis=1)/norms
[32m[I 2022-04-13 12:10:22,665][0m Trial 953 finished with value: 0.7833387939554717 and parameters: {'splitter': 'best', 'min_samples_split': 0.16024393543169452, 'min_samples_leaf': 0.009050579908550432, 'min_weight_fraction_leaf': 0.02897152295634397, 'max_features': 0.9821162134575929}. Best is trial 448 with value: 0.8888507593246218.[0m
/media/san2_ssd/data/Workdir/survival/utils.py:305: RuntimeWarning: invalid value encountered in true_divide
  pdfs = np.gradient(1-survs,axis=1)/norms
/media/san2_ssd/data/Workdir/survival/utils.py:305: RuntimeWarning: invalid value encountered in true_divide
  pdfs = np.gradient(1-survs,axis=1)/norms
/media/san2_ssd/data/Workdir/survival/utils.py:305: RuntimeWarning: invalid value encountered in true_divide
  pdfs = np.gradient(1-survs,axis=1)/norms
[32m[I 2022-04-13 12:10:25,292][0m Trial 954 finished with value: 0.8832456677635493 and parameters: {'splitter': 'best', 'min_samples_split': 0.07473779885340984, 'min_samples_leaf': 0.04720980945025518, 'min_weight_fraction_leaf': 0.05691943422652604, 'max_features': 0.9644121771346402}. Best is trial 448 with value: 0.8888507593246218.[0m
[32m[I 2022-04-13 12:10:27,356][0m Trial 955 finished with value: 0.785546985363923 and parameters: {'splitter': 'best', 'min_samples_split': 0.12790287067465364, 'min_samples_leaf': 0.07687250840421228, 'min_weight_fraction_leaf': 0.008132784778972692, 'max_features': 0.9831277165458361}. Best is trial 448 with value: 0.8888507593246218.[0m
/media/san2_ssd/data/Workdir/survival/utils.py:305: RuntimeWarning: invalid value encountered in true_divide
  pdfs = np.gradient(1-survs,axis=1)/norms
[32m[I 2022-04-13 12:10:29,529][0m Trial 956 finished with value: 0.8857731545091931 and parameters: {'splitter': 'best', 'min_samples_split': 0.11403388090808655, 'min_samples_leaf': 0.06152369718992308, 'min_weight_fraction_leaf': 0.03340238963383256, 'max_features': 0.9804426826309912}. Best is trial 448 with value: 0.8888507593246218.[0m
[32m[I 2022-04-13 12:10:30,754][0m Trial 957 finished with value: 0.6953987916579007 and parameters: {'splitter': 'best', 'min_samples_split': 0.10143293444801776, 'min_samples_leaf': 0.03387887701655889, 'min_weight_fraction_leaf': 0.4357938163820835, 'max_features': 0.9188395262577034}. Best is trial 448 with value: 0.8888507593246218.[0m
/media/san2_ssd/data/Workdir/survival/utils.py:305: RuntimeWarning: invalid value encountered in true_divide
  pdfs = np.gradient(1-survs,axis=1)/norms
/media/san2_ssd/data/Workdir/survival/utils.py:305: RuntimeWarning: invalid value encountered in true_divide
  pdfs = np.gradient(1-survs,axis=1)/norms
/media/san2_ssd/data/Workdir/survival/utils.py:305: RuntimeWarning: invalid value encountered in true_divide
  pdfs = np.gradient(1-survs,axis=1)/norms
/media/san2_ssd/data/Workdir/survival/utils.py:305: RuntimeWarning: invalid value encountered in true_divide
  pdfs = np.gradient(1-survs,axis=1)/norms
/media/san2_ssd/data/Workdir/survival/utils.py:305: RuntimeWarning: invalid value encountered in true_divide
  pdfs = np.gradient(1-survs,axis=1)/norms
[32m[I 2022-04-13 12:10:32,938][0m Trial 958 finished with value: 0.8827419510582957 and parameters: {'splitter': 'best', 'min_samples_split': 0.08596755025839098, 'min_samples_leaf': 0.03937405490226655, 'min_weight_fraction_leaf': 0.020657077436008732, 'max_features': 0.9512842341811928}. Best is trial 448 with value: 0.8888507593246218.[0m
/media/san2_ssd/data/Workdir/survival/utils.py:305: RuntimeWarning: invalid value encountered in true_divide
  pdfs = np.gradient(1-survs,axis=1)/norms
[32m[I 2022-04-13 12:10:35,445][0m Trial 959 finished with value: 0.8799664188898589 and parameters: {'splitter': 'best', 'min_samples_split': 0.13864099407009933, 'min_samples_leaf': 0.022265324136409165, 'min_weight_fraction_leaf': 0.04554216775949775, 'max_features': 0.89850240191131}. Best is trial 448 with value: 0.8888507593246218.[0m
/media/san2_ssd/data/Workdir/survival/utils.py:305: RuntimeWarning: invalid value encountered in true_divide
  pdfs = np.gradient(1-survs,axis=1)/norms
/media/san2_ssd/data/Workdir/survival/utils.py:305: RuntimeWarning: invalid value encountered in true_divide
  pdfs = np.gradient(1-survs,axis=1)/norms
/media/san2_ssd/data/Workdir/survival/utils.py:305: RuntimeWarning: invalid value encountered in true_divide
  pdfs = np.gradient(1-survs,axis=1)/norms
[32m[I 2022-04-13 12:10:36,933][0m Trial 960 finished with value: 0.8858637724394767 and parameters: {'splitter': 'best', 'min_samples_split': 0.12297138575729628, 'min_samples_leaf': 0.05129262866269046, 'min_weight_fraction_leaf': 0.012586313126087875, 'max_features': 0.9847183695202384}. Best is trial 448 with value: 0.8888507593246218.[0m
[32m[I 2022-04-13 12:10:38,043][0m Trial 961 finished with value: 0.8817121438110338 and parameters: {'splitter': 'best', 'min_samples_split': 0.11094266432155275, 'min_samples_leaf': 0.07034159475499624, 'min_weight_fraction_leaf': 0.032278625024617605, 'max_features': 0.9644204436940592}. Best is trial 448 with value: 0.8888507593246218.[0m
/media/san2_ssd/data/Workdir/survival/utils.py:305: RuntimeWarning: invalid value encountered in true_divide
  pdfs = np.gradient(1-survs,axis=1)/norms
/media/san2_ssd/data/Workdir/survival/utils.py:305: RuntimeWarning: invalid value encountered in true_divide
  pdfs = np.gradient(1-survs,axis=1)/norms
/media/san2_ssd/data/Workdir/survival/utils.py:305: RuntimeWarning: invalid value encountered in true_divide
  pdfs = np.gradient(1-survs,axis=1)/norms
/media/san2_ssd/data/Workdir/survival/utils.py:305: RuntimeWarning: invalid value encountered in true_divide
  pdfs = np.gradient(1-survs,axis=1)/norms
/media/san2_ssd/data/Workdir/survival/utils.py:305: RuntimeWarning: invalid value encountered in true_divide
  pdfs = np.gradient(1-survs,axis=1)/norms
[32m[I 2022-04-13 12:10:40,365][0m Trial 962 finished with value: 0.8828773745837838 and parameters: {'splitter': 'best', 'min_samples_split': 0.0635353654095985, 'min_samples_leaf': 0.03161966460305959, 'min_weight_fraction_leaf': 0.025132880446102752, 'max_features': 0.9993956770684851}. Best is trial 448 with value: 0.8888507593246218.[0m
/media/san2_ssd/data/Workdir/survival/utils.py:305: RuntimeWarning: invalid value encountered in true_divide
  pdfs = np.gradient(1-survs,axis=1)/norms
/media/san2_ssd/data/Workdir/survival/utils.py:305: RuntimeWarning: invalid value encountered in true_divide
  pdfs = np.gradient(1-survs,axis=1)/norms
/media/san2_ssd/data/Workdir/survival/utils.py:305: RuntimeWarning: invalid value encountered in true_divide
  pdfs = np.gradient(1-survs,axis=1)/norms
/media/san2_ssd/data/Workdir/survival/utils.py:305: RuntimeWarning: invalid value encountered in true_divide
  pdfs = np.gradient(1-survs,axis=1)/norms
/media/san2_ssd/data/Workdir/survival/utils.py:305: RuntimeWarning: invalid value encountered in true_divide
  pdfs = np.gradient(1-survs,axis=1)/norms
[32m[I 2022-04-13 12:10:41,961][0m Trial 963 finished with value: 0.8849970289439023 and parameters: {'splitter': 'best', 'min_samples_split': 0.09706433577189057, 'min_samples_leaf': 0.011761907409232625, 'min_weight_fraction_leaf': 0.04282746350494805, 'max_features': 0.9423706595613799}. Best is trial 448 with value: 0.8888507593246218.[0m
/media/san2_ssd/data/Workdir/survival/utils.py:305: RuntimeWarning: invalid value encountered in true_divide
  pdfs = np.gradient(1-survs,axis=1)/norms
[32m[I 2022-04-13 12:10:44,148][0m Trial 964 finished with value: 0.787787913516134 and parameters: {'splitter': 'best', 'min_samples_split': 0.14828221986482754, 'min_samples_leaf': 0.04460703565756106, 'min_weight_fraction_leaf': 0.018176966376690515, 'max_features': 0.9991025819282389}. Best is trial 448 with value: 0.8888507593246218.[0m
[32m[I 2022-04-13 12:10:45,968][0m Trial 965 finished with value: 0.770308246790185 and parameters: {'splitter': 'best', 'min_samples_split': 0.10603496610903285, 'min_samples_leaf': 0.025531248898853498, 'min_weight_fraction_leaf': 0.06516141597144395, 'max_features': 0.6809025967352065}. Best is trial 448 with value: 0.8888507593246218.[0m
[32m[I 2022-04-13 12:10:46,410][0m Trial 966 finished with value: 0.751197854880413 and parameters: {'splitter': 'random', 'min_samples_split': 0.1186636145994744, 'min_samples_leaf': 0.038985934052782154, 'min_weight_fraction_leaf': 0.14226150228196172, 'max_features': 0.8681571153164325}. Best is trial 448 with value: 0.8888507593246218.[0m
[32m[I 2022-04-13 12:10:47,852][0m Trial 967 finished with value: 0.6788729567066701 and parameters: {'splitter': 'best', 'min_samples_split': 0.13275044435245714, 'min_samples_leaf': 0.11042198899616999, 'min_weight_fraction_leaf': 0.0005487111958625036, 'max_features': 0.9641944151313191}. Best is trial 448 with value: 0.8888507593246218.[0m
/media/san2_ssd/data/Workdir/survival/utils.py:305: RuntimeWarning: invalid value encountered in true_divide
  pdfs = np.gradient(1-survs,axis=1)/norms
/media/san2_ssd/data/Workdir/survival/utils.py:305: RuntimeWarning: invalid value encountered in true_divide
  pdfs = np.gradient(1-survs,axis=1)/norms
/media/san2_ssd/data/Workdir/survival/utils.py:305: RuntimeWarning: invalid value encountered in true_divide
  pdfs = np.gradient(1-survs,axis=1)/norms
[32m[I 2022-04-13 12:10:49,071][0m Trial 968 finished with value: 0.8833898705950409 and parameters: {'splitter': 'best', 'min_samples_split': 0.08751435263849074, 'min_samples_leaf': 0.0015883826646364632, 'min_weight_fraction_leaf': 0.04984007410017657, 'max_features': 0.9358574933013638}. Best is trial 448 with value: 0.8888507593246218.[0m
[32m[I 2022-04-13 12:10:51,152][0m Trial 969 finished with value: 0.47712705574551634 and parameters: {'splitter': 'best', 'min_samples_split': 0.30820404825429754, 'min_samples_leaf': 0.05774948108024111, 'min_weight_fraction_leaf': 0.03388584280522642, 'max_features': 0.9815554380921357}. Best is trial 448 with value: 0.8888507593246218.[0m
/media/san2_ssd/data/Workdir/survival/utils.py:305: RuntimeWarning: invalid value encountered in true_divide
  pdfs = np.gradient(1-survs,axis=1)/norms
/media/san2_ssd/data/Workdir/survival/utils.py:305: RuntimeWarning: invalid value encountered in true_divide
  pdfs = np.gradient(1-survs,axis=1)/norms
/media/san2_ssd/data/Workdir/survival/utils.py:305: RuntimeWarning: invalid value encountered in true_divide
  pdfs = np.gradient(1-survs,axis=1)/norms
