[32m[I 2022-04-15 03:52:15,560][0m Trial 135 finished with value: 0.5 and parameters: {'loss': 'coxph', 'learning_rate': 0.022290181567677012, 'n_estimators': 125, 'criterion': 'friedman_mse', 'min_samples_split': 2, 'min_samples_leaf': 4, 'min_weight_fraction_leaf': 0.37421518362201567, 'min_impurity_decrease': 0.7377881255744472, 'max_features': 0.45623089636490755, 'subsample': 0.34210724464136466, 'dropout_rate': 0.3055665830214593, 'ccp_alpha': 0.8763589389112142}. Best is trial 120 with value: 0.7572000007384097.[0m
[32m[I 2022-04-15 03:52:25,977][0m Trial 136 finished with value: 0.5 and parameters: {'loss': 'coxph', 'learning_rate': 0.03516263956501974, 'n_estimators': 111, 'criterion': 'friedman_mse', 'min_samples_split': 3, 'min_samples_leaf': 3, 'min_weight_fraction_leaf': 0.41889433031919926, 'min_impurity_decrease': 0.6373001527837158, 'max_features': 0.5517103261319386, 'subsample': 0.26826159858387816, 'dropout_rate': 0.21487492267809127, 'ccp_alpha': 0.4047245620757227}. Best is trial 120 with value: 0.7572000007384097.[0m
[32m[I 2022-04-15 03:52:34,963][0m Trial 137 finished with value: 0.6743624146605087 and parameters: {'loss': 'coxph', 'learning_rate': 0.01098370815847165, 'n_estimators': 102, 'criterion': 'friedman_mse', 'min_samples_split': 2, 'min_samples_leaf': 4, 'min_weight_fraction_leaf': 0.39292774522349194, 'min_impurity_decrease': 0.6912319776319282, 'max_features': 0.486896581559211, 'subsample': 0.2913946020113021, 'dropout_rate': 0.1837568556620178, 'ccp_alpha': 0.16426237087974377}. Best is trial 120 with value: 0.7572000007384097.[0m
[32m[I 2022-04-15 03:52:37,696][0m Trial 138 finished with value: 0.48110739837569005 and parameters: {'loss': 'squared', 'learning_rate': 0.011088031266807893, 'n_estimators': 100, 'criterion': 'friedman_mse', 'min_samples_split': 3, 'min_samples_leaf': 3, 'min_weight_fraction_leaf': 0.47535396612353864, 'min_impurity_decrease': 0.5024714318669642, 'max_features': 0.4832602054977, 'subsample': 0.3505065928935406, 'dropout_rate': 0.17082564519163812, 'ccp_alpha': 0.15509285168818496}. Best is trial 120 with value: 0.7572000007384097.[0m
[32m[I 2022-04-15 03:52:48,778][0m Trial 139 finished with value: 0.7447455642523936 and parameters: {'loss': 'coxph', 'learning_rate': 0.025295382912643716, 'n_estimators': 119, 'criterion': 'friedman_mse', 'min_samples_split': 2, 'min_samples_leaf': 4, 'min_weight_fraction_leaf': 0.4066944086441736, 'min_impurity_decrease': 0.7743166919113765, 'max_features': 0.5047560461486983, 'subsample': 0.25890456290447755, 'dropout_rate': 0.24421942188438764, 'ccp_alpha': 0.006217071535081104}. Best is trial 120 with value: 0.7572000007384097.[0m
[32m[I 2022-04-15 03:52:56,854][0m Trial 140 finished with value: 0.5 and parameters: {'loss': 'coxph', 'learning_rate': 0.0009163099411251081, 'n_estimators': 104, 'criterion': 'friedman_mse', 'min_samples_split': 2, 'min_samples_leaf': 1, 'min_weight_fraction_leaf': 0.3571876193383578, 'min_impurity_decrease': 0.8188261312225367, 'max_features': 0.4967409278854167, 'subsample': 0.2853841516774636, 'dropout_rate': 0.4000598904025644, 'ccp_alpha': 0.28166915426987904}. Best is trial 120 with value: 0.7572000007384097.[0m
[32m[I 2022-04-15 03:53:08,965][0m Trial 141 finished with value: 0.7559579087329678 and parameters: {'loss': 'coxph', 'learning_rate': 0.026080622475772513, 'n_estimators': 121, 'criterion': 'friedman_mse', 'min_samples_split': 2, 'min_samples_leaf': 4, 'min_weight_fraction_leaf': 0.3973141217674777, 'min_impurity_decrease': 0.6931434708333284, 'max_features': 0.5126967324292269, 'subsample': 0.252130284132469, 'dropout_rate': 0.12883580810231787, 'ccp_alpha': 0.029381084551838382}. Best is trial 120 with value: 0.7572000007384097.[0m
[32m[I 2022-04-15 03:53:18,987][0m Trial 142 finished with value: 0.7585466348342933 and parameters: {'loss': 'coxph', 'learning_rate': 0.039669290073840846, 'n_estimators': 111, 'criterion': 'friedman_mse', 'min_samples_split': 2, 'min_samples_leaf': 4, 'min_weight_fraction_leaf': 0.3666659286152312, 'min_impurity_decrease': 0.770723996527983, 'max_features': 0.5179433684676658, 'subsample': 0.29933051157974466, 'dropout_rate': 0.07996674141065482, 'ccp_alpha': 0.013017720335929461}. Best is trial 142 with value: 0.7585466348342933.[0m
[32m[I 2022-04-15 03:53:28,317][0m Trial 143 finished with value: 0.749500106196695 and parameters: {'loss': 'coxph', 'learning_rate': 0.026795178085117544, 'n_estimators': 111, 'criterion': 'friedman_mse', 'min_samples_split': 2, 'min_samples_leaf': 4, 'min_weight_fraction_leaf': 0.3869811486743608, 'min_impurity_decrease': 0.5738435340235785, 'max_features': 0.5091870443782689, 'subsample': 0.45475210905134045, 'dropout_rate': 0.11076410286404209, 'ccp_alpha': 0.024937559543070392}. Best is trial 142 with value: 0.7585466348342933.[0m
[32m[I 2022-04-15 03:53:38,063][0m Trial 144 finished with value: 0.7465658587040443 and parameters: {'loss': 'coxph', 'learning_rate': 0.030101698575515957, 'n_estimators': 108, 'criterion': 'friedman_mse', 'min_samples_split': 2, 'min_samples_leaf': 4, 'min_weight_fraction_leaf': 0.39916461324680536, 'min_impurity_decrease': 0.6900372599240084, 'max_features': 0.5107026281228333, 'subsample': 0.4166909957024117, 'dropout_rate': 0.11429668742000423, 'ccp_alpha': 0.04280639912007127}. Best is trial 142 with value: 0.7585466348342933.[0m
[32m[I 2022-04-15 03:53:48,692][0m Trial 145 finished with value: 0.7494582358013212 and parameters: {'loss': 'coxph', 'learning_rate': 0.028258897731123143, 'n_estimators': 111, 'criterion': 'friedman_mse', 'min_samples_split': 2, 'min_samples_leaf': 4, 'min_weight_fraction_leaf': 0.38601064321341677, 'min_impurity_decrease': 0.7731679964672087, 'max_features': 0.5105565212118088, 'subsample': 0.4484656617570455, 'dropout_rate': 0.11634223334158544, 'ccp_alpha': 0.015259592929904212}. Best is trial 142 with value: 0.7585466348342933.[0m
[32m[I 2022-04-15 03:53:58,478][0m Trial 146 finished with value: 0.7500000286922976 and parameters: {'loss': 'coxph', 'learning_rate': 0.030822832114277027, 'n_estimators': 110, 'criterion': 'friedman_mse', 'min_samples_split': 2, 'min_samples_leaf': 4, 'min_weight_fraction_leaf': 0.38362057431400826, 'min_impurity_decrease': 0.7829131629265632, 'max_features': 0.5122424184043332, 'subsample': 0.44622463334387413, 'dropout_rate': 0.11398198296225594, 'ccp_alpha': 0.06043668708857697}. Best is trial 142 with value: 0.7585466348342933.[0m
[32m[I 2022-04-15 03:54:07,600][0m Trial 147 finished with value: 0.7470726655174144 and parameters: {'loss': 'coxph', 'learning_rate': 0.029351235178325732, 'n_estimators': 109, 'criterion': 'friedman_mse', 'min_samples_split': 2, 'min_samples_leaf': 4, 'min_weight_fraction_leaf': 0.38883041298401405, 'min_impurity_decrease': 0.7737846883017871, 'max_features': 0.5182015166102677, 'subsample': 0.4651645019910403, 'dropout_rate': 0.11342072188466518, 'ccp_alpha': 0.067981075507009}. Best is trial 142 with value: 0.7585466348342933.[0m
[32m[I 2022-04-15 03:54:16,841][0m Trial 148 finished with value: 0.7576351747238042 and parameters: {'loss': 'coxph', 'learning_rate': 0.03228129814088919, 'n_estimators': 112, 'criterion': 'friedman_mse', 'min_samples_split': 2, 'min_samples_leaf': 4, 'min_weight_fraction_leaf': 0.381868565057847, 'min_impurity_decrease': 0.7747820877073757, 'max_features': 0.5193376963603864, 'subsample': 0.4536677765730953, 'dropout_rate': 0.009844220608347512, 'ccp_alpha': 0.006152890835700697}. Best is trial 142 with value: 0.7585466348342933.[0m
[32m[I 2022-04-15 03:54:27,615][0m Trial 149 finished with value: 0.7575201600546464 and parameters: {'loss': 'coxph', 'learning_rate': 0.03652440805833007, 'n_estimators': 118, 'criterion': 'friedman_mse', 'min_samples_split': 2, 'min_samples_leaf': 5, 'min_weight_fraction_leaf': 0.38627311332200387, 'min_impurity_decrease': 0.7835908945849873, 'max_features': 0.6197897280896304, 'subsample': 0.4475360878086652, 'dropout_rate': 0.01626534132803786, 'ccp_alpha': 0.027617646171650877}. Best is trial 142 with value: 0.7585466348342933.[0m
[32m[I 2022-04-15 03:54:38,915][0m Trial 150 finished with value: 0.7305005063162644 and parameters: {'loss': 'coxph', 'learning_rate': 0.03666883224347613, 'n_estimators': 128, 'criterion': 'friedman_mse', 'min_samples_split': 2, 'min_samples_leaf': 5, 'min_weight_fraction_leaf': 0.4064018878268422, 'min_impurity_decrease': 0.7876456611041865, 'max_features': 0.5977599374191606, 'subsample': 0.4590126313171131, 'dropout_rate': 0.01854629026450587, 'ccp_alpha': 0.008207592449304066}. Best is trial 142 with value: 0.7585466348342933.[0m
[32m[I 2022-04-15 03:54:50,497][0m Trial 151 finished with value: 0.756690133738499 and parameters: {'loss': 'coxph', 'learning_rate': 0.0368214476512609, 'n_estimators': 128, 'criterion': 'friedman_mse', 'min_samples_split': 2, 'min_samples_leaf': 5, 'min_weight_fraction_leaf': 0.38873879639922415, 'min_impurity_decrease': 0.7861576912408091, 'max_features': 0.6180869212908975, 'subsample': 0.4510993582116735, 'dropout_rate': 0.004401559507431596, 'ccp_alpha': 0.009120799390031397}. Best is trial 142 with value: 0.7585466348342933.[0m
[32m[I 2022-04-15 03:55:01,587][0m Trial 152 finished with value: 0.758555301026393 and parameters: {'loss': 'coxph', 'learning_rate': 0.036718150406744914, 'n_estimators': 113, 'criterion': 'friedman_mse', 'min_samples_split': 2, 'min_samples_leaf': 5, 'min_weight_fraction_leaf': 0.3821708739216696, 'min_impurity_decrease': 0.7851288285936717, 'max_features': 0.6201050127199458, 'subsample': 0.44950706247862493, 'dropout_rate': 0.018676539904292647, 'ccp_alpha': 0.021509223690520024}. Best is trial 152 with value: 0.758555301026393.[0m
[32m[I 2022-04-15 03:55:11,626][0m Trial 153 finished with value: 0.7557478198550033 and parameters: {'loss': 'coxph', 'learning_rate': 0.031884478792216495, 'n_estimators': 114, 'criterion': 'friedman_mse', 'min_samples_split': 2, 'min_samples_leaf': 5, 'min_weight_fraction_leaf': 0.38171640160266057, 'min_impurity_decrease': 0.8184634613808105, 'max_features': 0.6226750943102857, 'subsample': 0.4863898863574725, 'dropout_rate': 0.06806031250089728, 'ccp_alpha': 0.03339975383563647}. Best is trial 152 with value: 0.758555301026393.[0m
[32m[I 2022-04-15 03:55:21,185][0m Trial 154 finished with value: 0.5 and parameters: {'loss': 'coxph', 'learning_rate': 0.07772545124446908, 'n_estimators': 113, 'criterion': 'friedman_mse', 'min_samples_split': 2, 'min_samples_leaf': 5, 'min_weight_fraction_leaf': 0.3811854236481018, 'min_impurity_decrease': 0.843159273703198, 'max_features': 0.6096899976907986, 'subsample': 0.4771667187497665, 'dropout_rate': 0.06837253208918656, 'ccp_alpha': 0.3436251035109655}. Best is trial 152 with value: 0.758555301026393.[0m
[32m[I 2022-04-15 03:55:35,418][0m Trial 155 finished with value: 0.7517062181419893 and parameters: {'loss': 'coxph', 'learning_rate': 0.03310352462545392, 'n_estimators': 137, 'criterion': 'friedman_mse', 'min_samples_split': 2, 'min_samples_leaf': 5, 'min_weight_fraction_leaf': 0.38981042368738456, 'min_impurity_decrease': 0.8214061016737628, 'max_features': 0.6457481296916103, 'subsample': 0.4449957826684494, 'dropout_rate': 0.09649668269728885, 'ccp_alpha': 0.05354662484302637}. Best is trial 152 with value: 0.758555301026393.[0m
[32m[I 2022-04-15 03:55:48,639][0m Trial 156 finished with value: 0.5 and parameters: {'loss': 'coxph', 'learning_rate': 0.032439743424344365, 'n_estimators': 141, 'criterion': 'friedman_mse', 'min_samples_split': 2, 'min_samples_leaf': 5, 'min_weight_fraction_leaf': 0.38719375766526776, 'min_impurity_decrease': 0.8147454209337822, 'max_features': 0.622932743124593, 'subsample': 0.4466866053865984, 'dropout_rate': 0.045495154737251214, 'ccp_alpha': 0.3332127298821246}. Best is trial 152 with value: 0.758555301026393.[0m
[32m[I 2022-04-15 03:55:57,890][0m Trial 157 finished with value: 0.6958033816304273 and parameters: {'loss': 'coxph', 'learning_rate': 0.040669507406468984, 'n_estimators': 114, 'criterion': 'friedman_mse', 'min_samples_split': 2, 'min_samples_leaf': 5, 'min_weight_fraction_leaf': 0.37728584072320737, 'min_impurity_decrease': 0.836305338309461, 'max_features': 0.6340297784995376, 'subsample': 0.5002881467100532, 'dropout_rate': 0.0055592694898508686, 'ccp_alpha': 0.075323524589916}. Best is trial 152 with value: 0.758555301026393.[0m
[32m[I 2022-04-15 03:56:09,317][0m Trial 158 finished with value: 0.5 and parameters: {'loss': 'coxph', 'learning_rate': 0.050235585894718354, 'n_estimators': 130, 'criterion': 'friedman_mse', 'min_samples_split': 2, 'min_samples_leaf': 5, 'min_weight_fraction_leaf': 0.43347209651251334, 'min_impurity_decrease': 0.7439343308453507, 'max_features': 0.662908704933292, 'subsample': 0.48714858322781646, 'dropout_rate': 0.10524924341228359, 'ccp_alpha': 0.2563752605746991}. Best is trial 152 with value: 0.758555301026393.[0m
[32m[I 2022-04-15 03:56:22,213][0m Trial 159 finished with value: 0.7654372273354745 and parameters: {'loss': 'coxph', 'learning_rate': 0.018717647085482205, 'n_estimators': 138, 'criterion': 'friedman_mse', 'min_samples_split': 2, 'min_samples_leaf': 5, 'min_weight_fraction_leaf': 0.3624198842128111, 'min_impurity_decrease': 0.7732600633563745, 'max_features': 0.5734080512908554, 'subsample': 0.45081178425100615, 'dropout_rate': 0.09070697627144769, 'ccp_alpha': 0.004487649414112865}. Best is trial 159 with value: 0.7654372273354745.[0m
[32m[I 2022-04-15 03:56:35,621][0m Trial 160 finished with value: 0.7570814883476082 and parameters: {'loss': 'coxph', 'learning_rate': 0.06744880171154691, 'n_estimators': 138, 'criterion': 'friedman_mse', 'min_samples_split': 2, 'min_samples_leaf': 5, 'min_weight_fraction_leaf': 0.3631816358794815, 'min_impurity_decrease': 0.7840418783244167, 'max_features': 0.5778069130546512, 'subsample': 0.5462802881298894, 'dropout_rate': 0.08817892690927363, 'ccp_alpha': 0.006811294058284775}. Best is trial 159 with value: 0.7654372273354745.[0m
[32m[I 2022-04-15 03:56:46,561][0m Trial 161 finished with value: 0.5 and parameters: {'loss': 'coxph', 'learning_rate': 0.018736292080024582, 'n_estimators': 125, 'criterion': 'friedman_mse', 'min_samples_split': 2, 'min_samples_leaf': 5, 'min_weight_fraction_leaf': 0.35938456195638113, 'min_impurity_decrease': 0.7897674829166913, 'max_features': 0.5782594215961367, 'subsample': 0.5442384729960068, 'dropout_rate': 0.13972557657154824, 'ccp_alpha': 0.24970197213036688}. Best is trial 159 with value: 0.7654372273354745.[0m
[32m[I 2022-04-15 03:56:59,491][0m Trial 162 finished with value: 0.7572459652402647 and parameters: {'loss': 'coxph', 'learning_rate': 0.0408413259354876, 'n_estimators': 138, 'criterion': 'friedman_mse', 'min_samples_split': 2, 'min_samples_leaf': 5, 'min_weight_fraction_leaf': 0.37597582565134335, 'min_impurity_decrease': 0.8506873059858124, 'max_features': 0.5518132175676849, 'subsample': 0.4482856119619957, 'dropout_rate': 0.08946575677708936, 'ccp_alpha': 0.017730657828872752}. Best is trial 159 with value: 0.7654372273354745.[0m
[32m[I 2022-04-15 03:57:12,175][0m Trial 163 finished with value: 0.7588359924428665 and parameters: {'loss': 'coxph', 'learning_rate': 0.042013172118686985, 'n_estimators': 138, 'criterion': 'friedman_mse', 'min_samples_split': 2, 'min_samples_leaf': 5, 'min_weight_fraction_leaf': 0.3681058311083332, 'min_impurity_decrease': 0.8626568447741196, 'max_features': 0.6133420425369924, 'subsample': 0.5059098804330492, 'dropout_rate': 0.08824613565491572, 'ccp_alpha': 0.0022851180098049685}. Best is trial 159 with value: 0.7654372273354745.[0m
[32m[I 2022-04-15 03:57:23,684][0m Trial 164 finished with value: 0.5 and parameters: {'loss': 'coxph', 'learning_rate': 0.06081662564289449, 'n_estimators': 137, 'criterion': 'friedman_mse', 'min_samples_split': 2, 'min_samples_leaf': 5, 'min_weight_fraction_leaf': 0.3722708333566385, 'min_impurity_decrease': 0.859813773445059, 'max_features': 0.5549035500578179, 'subsample': 0.5039275041201385, 'dropout_rate': 0.08841075039256242, 'ccp_alpha': 0.5378198563415043}. Best is trial 159 with value: 0.7654372273354745.[0m
[32m[I 2022-04-15 03:57:38,423][0m Trial 165 finished with value: 0.5 and parameters: {'loss': 'coxph', 'learning_rate': 0.06939827379506767, 'n_estimators': 159, 'criterion': 'friedman_mse', 'min_samples_split': 2, 'min_samples_leaf': 5, 'min_weight_fraction_leaf': 0.36023055120441944, 'min_impurity_decrease': 0.8194390179970968, 'max_features': 0.6497293836618683, 'subsample': 0.5386695649589781, 'dropout_rate': 0.02929925929567375, 'ccp_alpha': 0.3552024462949427}. Best is trial 159 with value: 0.7654372273354745.[0m
[32m[I 2022-04-15 03:57:51,096][0m Trial 166 finished with value: 0.6743624146605087 and parameters: {'loss': 'coxph', 'learning_rate': 0.04093946518667768, 'n_estimators': 141, 'criterion': 'friedman_mse', 'min_samples_split': 2, 'min_samples_leaf': 5, 'min_weight_fraction_leaf': 0.3678412905606609, 'min_impurity_decrease': 0.8414996052485085, 'max_features': 0.6138014686504757, 'subsample': 0.4326809945070594, 'dropout_rate': 0.05519712424681252, 'ccp_alpha': 0.1123167969010678}. Best is trial 159 with value: 0.7654372273354745.[0m
[32m[I 2022-04-15 03:58:04,843][0m Trial 167 finished with value: 0.5 and parameters: {'loss': 'coxph', 'learning_rate': 0.05182953646837473, 'n_estimators': 148, 'criterion': 'friedman_mse', 'min_samples_split': 2, 'min_samples_leaf': 5, 'min_weight_fraction_leaf': 0.40968688837402045, 'min_impurity_decrease': 0.8877525805641524, 'max_features': 0.5856244322853997, 'subsample': 0.47806941652698404, 'dropout_rate': 0.14841990759037366, 'ccp_alpha': 0.2395296343287714}. Best is trial 159 with value: 0.7654372273354745.[0m
[32m[I 2022-04-15 03:58:16,235][0m Trial 168 finished with value: 0.7532922286577057 and parameters: {'loss': 'coxph', 'learning_rate': 0.08793932987588746, 'n_estimators': 129, 'criterion': 'friedman_mse', 'min_samples_split': 2, 'min_samples_leaf': 5, 'min_weight_fraction_leaf': 0.3776307730353159, 'min_impurity_decrease': 0.7531922204442689, 'max_features': 0.5637563728010256, 'subsample': 0.5102610155364412, 'dropout_rate': 0.003954751526403455, 'ccp_alpha': 0.006431879626722231}. Best is trial 159 with value: 0.7654372273354745.[0m
[32m[I 2022-04-15 03:58:27,880][0m Trial 169 finished with value: 0.7570305408570921 and parameters: {'loss': 'coxph', 'learning_rate': 0.07865697005652691, 'n_estimators': 130, 'criterion': 'friedman_mse', 'min_samples_split': 2, 'min_samples_leaf': 5, 'min_weight_fraction_leaf': 0.33458756671747636, 'min_impurity_decrease': 0.7578270702349613, 'max_features': 0.6806368550205585, 'subsample': 0.520004956990235, 'dropout_rate': 0.0024304965857557953, 'ccp_alpha': 0.002003357253638819}. Best is trial 159 with value: 0.7654372273354745.[0m
[32m[I 2022-04-15 03:58:39,499][0m Trial 170 finished with value: 0.6050283954042335 and parameters: {'loss': 'coxph', 'learning_rate': 0.08354814790547663, 'n_estimators': 137, 'criterion': 'friedman_mse', 'min_samples_split': 2, 'min_samples_leaf': 5, 'min_weight_fraction_leaf': 0.3688591619200514, 'min_impurity_decrease': 0.8044426942015285, 'max_features': 0.694406544994937, 'subsample': 0.5596144639981158, 'dropout_rate': 0.008105072355931272, 'ccp_alpha': 0.19445367661450863}. Best is trial 159 with value: 0.7654372273354745.[0m
[32m[I 2022-04-15 03:58:50,631][0m Trial 171 finished with value: 0.7603678505792184 and parameters: {'loss': 'coxph', 'learning_rate': 0.06215812017146621, 'n_estimators': 130, 'criterion': 'friedman_mse', 'min_samples_split': 2, 'min_samples_leaf': 5, 'min_weight_fraction_leaf': 0.32925222432443285, 'min_impurity_decrease': 0.7585797136389785, 'max_features': 0.6922922426819913, 'subsample': 0.5125530026023916, 'dropout_rate': 0.03503873239781863, 'ccp_alpha': 0.00921929833092544}. Best is trial 159 with value: 0.7654372273354745.[0m
[32m[I 2022-04-15 03:59:05,653][0m Trial 172 finished with value: 0.7553957861023748 and parameters: {'loss': 'coxph', 'learning_rate': 0.09272880999095298, 'n_estimators': 155, 'criterion': 'friedman_mse', 'min_samples_split': 2, 'min_samples_leaf': 5, 'min_weight_fraction_leaf': 0.32903610810398726, 'min_impurity_decrease': 0.7599557091640881, 'max_features': 0.6893515972745005, 'subsample': 0.512889442140303, 'dropout_rate': 0.06825905742587192, 'ccp_alpha': 0.0020980226729031704}. Best is trial 159 with value: 0.7654372273354745.[0m
[32m[I 2022-04-15 03:59:16,849][0m Trial 173 finished with value: 0.7644797283275369 and parameters: {'loss': 'coxph', 'learning_rate': 0.08254170421917265, 'n_estimators': 130, 'criterion': 'friedman_mse', 'min_samples_split': 2, 'min_samples_leaf': 5, 'min_weight_fraction_leaf': 0.3317327372426387, 'min_impurity_decrease': 0.7235449312073718, 'max_features': 0.6999149950112982, 'subsample': 0.5217264755062487, 'dropout_rate': 0.036556191793777996, 'ccp_alpha': 0.004019283554510913}. Best is trial 159 with value: 0.7654372273354745.[0m
[32m[I 2022-04-15 03:59:31,515][0m Trial 174 finished with value: 0.5 and parameters: {'loss': 'coxph', 'learning_rate': 0.09092276491830213, 'n_estimators': 156, 'criterion': 'friedman_mse', 'min_samples_split': 2, 'min_samples_leaf': 5, 'min_weight_fraction_leaf': 0.33334156968476597, 'min_impurity_decrease': 0.7306196380570782, 'max_features': 0.6907586858674057, 'subsample': 0.5260580935545149, 'dropout_rate': 0.03764217089397062, 'ccp_alpha': 0.2823742122976285}. Best is trial 159 with value: 0.7654372273354745.[0m
