[32m[I 2022-04-13 12:02:27,413][0m Trial 698 finished with value: 0.8823631387096336 and parameters: {'splitter': 'random', 'min_samples_split': 0.09415036258739296, 'min_samples_leaf': 0.03775817113425751, 'min_weight_fraction_leaf': 0.026024711266635147, 'max_features': 0.9687132348496241}. Best is trial 448 with value: 0.8888507593246218.[0m
/media/san2_ssd/data/Workdir/survival/utils.py:305: RuntimeWarning: invalid value encountered in true_divide
  pdfs = np.gradient(1-survs,axis=1)/norms
/media/san2_ssd/data/Workdir/survival/utils.py:305: RuntimeWarning: invalid value encountered in true_divide
  pdfs = np.gradient(1-survs,axis=1)/norms
/media/san2_ssd/data/Workdir/survival/utils.py:305: RuntimeWarning: invalid value encountered in true_divide
  pdfs = np.gradient(1-survs,axis=1)/norms
[32m[I 2022-04-13 12:02:29,490][0m Trial 699 finished with value: 0.8857783983670068 and parameters: {'splitter': 'best', 'min_samples_split': 0.1014315168262424, 'min_samples_leaf': 0.04880845541786528, 'min_weight_fraction_leaf': 0.04957648337644197, 'max_features': 0.9803464061628496}. Best is trial 448 with value: 0.8888507593246218.[0m
[32m[I 2022-04-13 12:02:30,216][0m Trial 700 finished with value: 0.4645298474639459 and parameters: {'splitter': 'best', 'min_samples_split': 0.0826591829158176, 'min_samples_leaf': 0.29255269294156283, 'min_weight_fraction_leaf': 0.03817986052298429, 'max_features': 0.9806303366916648}. Best is trial 448 with value: 0.8888507593246218.[0m
[32m[I 2022-04-13 12:02:30,443][0m Trial 701 finished with value: 0.6974470303674303 and parameters: {'splitter': 'best', 'min_samples_split': 0.1190345950996653, 'min_samples_leaf': 0.49816540564366074, 'min_weight_fraction_leaf': 0.21707432098302326, 'max_features': 0.9837412192476408}. Best is trial 448 with value: 0.8888507593246218.[0m
/media/san2_ssd/data/Workdir/survival/utils.py:305: RuntimeWarning: invalid value encountered in true_divide
  pdfs = np.gradient(1-survs,axis=1)/norms
/media/san2_ssd/data/Workdir/survival/utils.py:305: RuntimeWarning: invalid value encountered in true_divide
  pdfs = np.gradient(1-survs,axis=1)/norms
/media/san2_ssd/data/Workdir/survival/utils.py:305: RuntimeWarning: invalid value encountered in true_divide
  pdfs = np.gradient(1-survs,axis=1)/norms
/media/san2_ssd/data/Workdir/survival/utils.py:305: RuntimeWarning: invalid value encountered in true_divide
  pdfs = np.gradient(1-survs,axis=1)/norms
[32m[I 2022-04-13 12:02:32,969][0m Trial 702 finished with value: 0.8849900732969452 and parameters: {'splitter': 'best', 'min_samples_split': 0.1112064550741873, 'min_samples_leaf': 0.035317024949514574, 'min_weight_fraction_leaf': 0.015437131657338626, 'max_features': 0.9409727955411678}. Best is trial 448 with value: 0.8888507593246218.[0m
[32m[I 2022-04-13 12:02:34,800][0m Trial 703 finished with value: 0.5571092383656076 and parameters: {'splitter': 'best', 'min_samples_split': 0.42207549849925674, 'min_samples_leaf': 0.044165228618969994, 'min_weight_fraction_leaf': 0.028497125366425083, 'max_features': 0.9070914222977267}. Best is trial 448 with value: 0.8888507593246218.[0m
[32m[I 2022-04-13 12:02:36,513][0m Trial 704 finished with value: 0.8838180286414937 and parameters: {'splitter': 'best', 'min_samples_split': 0.10657613242327774, 'min_samples_leaf': 0.06643516957150916, 'min_weight_fraction_leaf': 0.01231142821886604, 'max_features': 0.9554187610529545}. Best is trial 448 with value: 0.8888507593246218.[0m
/media/san2_ssd/data/Workdir/survival/utils.py:305: RuntimeWarning: invalid value encountered in true_divide
  pdfs = np.gradient(1-survs,axis=1)/norms
/media/san2_ssd/data/Workdir/survival/utils.py:305: RuntimeWarning: invalid value encountered in true_divide
  pdfs = np.gradient(1-survs,axis=1)/norms
/media/san2_ssd/data/Workdir/survival/utils.py:305: RuntimeWarning: invalid value encountered in true_divide
  pdfs = np.gradient(1-survs,axis=1)/norms
/media/san2_ssd/data/Workdir/survival/utils.py:305: RuntimeWarning: invalid value encountered in true_divide
  pdfs = np.gradient(1-survs,axis=1)/norms
/media/san2_ssd/data/Workdir/survival/utils.py:305: RuntimeWarning: invalid value encountered in true_divide
  pdfs = np.gradient(1-survs,axis=1)/norms
[32m[I 2022-04-13 12:02:37,673][0m Trial 705 finished with value: 0.8848928647805249 and parameters: {'splitter': 'best', 'min_samples_split': 0.09770694719201072, 'min_samples_leaf': 0.031229711248074304, 'min_weight_fraction_leaf': 0.03623548976896597, 'max_features': 0.96664980892402}. Best is trial 448 with value: 0.8888507593246218.[0m
/media/san2_ssd/data/Workdir/survival/utils.py:305: RuntimeWarning: invalid value encountered in true_divide
  pdfs = np.gradient(1-survs,axis=1)/norms
[32m[I 2022-04-13 12:02:38,397][0m Trial 706 finished with value: 0.8828129745560528 and parameters: {'splitter': 'best', 'min_samples_split': 0.12419905712541493, 'min_samples_leaf': 0.05038171004450095, 'min_weight_fraction_leaf': 0.060105285166517974, 'max_features': 0.7076032086331379}. Best is trial 448 with value: 0.8888507593246218.[0m
[32m[I 2022-04-13 12:02:39,290][0m Trial 707 finished with value: 0.7811152225362757 and parameters: {'splitter': 'best', 'min_samples_split': 0.21866061393509853, 'min_samples_leaf': 0.03182300486291693, 'min_weight_fraction_leaf': 0.04777894160848056, 'max_features': 0.9996404054899767}. Best is trial 448 with value: 0.8888507593246218.[0m
/media/san2_ssd/data/Workdir/survival/utils.py:305: RuntimeWarning: invalid value encountered in true_divide
  pdfs = np.gradient(1-survs,axis=1)/norms
/media/san2_ssd/data/Workdir/survival/utils.py:305: RuntimeWarning: invalid value encountered in true_divide
  pdfs = np.gradient(1-survs,axis=1)/norms
/media/san2_ssd/data/Workdir/survival/utils.py:305: RuntimeWarning: invalid value encountered in true_divide
  pdfs = np.gradient(1-survs,axis=1)/norms
[32m[I 2022-04-13 12:02:40,330][0m Trial 708 finished with value: 0.7871889735975512 and parameters: {'splitter': 'best', 'min_samples_split': 0.137684829536048, 'min_samples_leaf': 0.039211072206411825, 'min_weight_fraction_leaf': 0.02254360638133767, 'max_features': 0.9859157269637775}. Best is trial 448 with value: 0.8888507593246218.[0m
/media/san2_ssd/data/Workdir/survival/utils.py:305: RuntimeWarning: invalid value encountered in true_divide
  pdfs = np.gradient(1-survs,axis=1)/norms
/media/san2_ssd/data/Workdir/survival/utils.py:305: RuntimeWarning: invalid value encountered in true_divide
  pdfs = np.gradient(1-survs,axis=1)/norms
[32m[I 2022-04-13 12:02:41,377][0m Trial 709 finished with value: 0.88562319264034 and parameters: {'splitter': 'best', 'min_samples_split': 0.11490559419393925, 'min_samples_leaf': 0.058696123878515735, 'min_weight_fraction_leaf': 0.0380367187455345, 'max_features': 0.9833290335670384}. Best is trial 448 with value: 0.8888507593246218.[0m
/media/san2_ssd/data/Workdir/survival/utils.py:305: RuntimeWarning: invalid value encountered in true_divide
  pdfs = np.gradient(1-survs,axis=1)/norms
/media/san2_ssd/data/Workdir/survival/utils.py:305: RuntimeWarning: invalid value encountered in true_divide
  pdfs = np.gradient(1-survs,axis=1)/norms
/media/san2_ssd/data/Workdir/survival/utils.py:305: RuntimeWarning: invalid value encountered in true_divide
  pdfs = np.gradient(1-survs,axis=1)/norms
/media/san2_ssd/data/Workdir/survival/utils.py:305: RuntimeWarning: invalid value encountered in true_divide
  pdfs = np.gradient(1-survs,axis=1)/norms
[32m[I 2022-04-13 12:02:42,721][0m Trial 710 finished with value: 0.883291744348449 and parameters: {'splitter': 'best', 'min_samples_split': 0.08920043535132458, 'min_samples_leaf': 0.026630191211695898, 'min_weight_fraction_leaf': 0.02597308153259594, 'max_features': 0.9281269880411733}. Best is trial 448 with value: 0.8888507593246218.[0m
/media/san2_ssd/data/Workdir/survival/utils.py:305: RuntimeWarning: invalid value encountered in true_divide
  pdfs = np.gradient(1-survs,axis=1)/norms
/media/san2_ssd/data/Workdir/survival/utils.py:305: RuntimeWarning: invalid value encountered in true_divide
  pdfs = np.gradient(1-survs,axis=1)/norms
/media/san2_ssd/data/Workdir/survival/utils.py:305: RuntimeWarning: invalid value encountered in true_divide
  pdfs = np.gradient(1-survs,axis=1)/norms
/media/san2_ssd/data/Workdir/survival/utils.py:305: RuntimeWarning: invalid value encountered in true_divide
  pdfs = np.gradient(1-survs,axis=1)/norms
[32m[I 2022-04-13 12:02:44,037][0m Trial 711 finished with value: 0.8818873385242594 and parameters: {'splitter': 'best', 'min_samples_split': 0.10472784720558456, 'min_samples_leaf': 0.017659990907066513, 'min_weight_fraction_leaf': 0.009076298848839745, 'max_features': 0.962566678211528}. Best is trial 448 with value: 0.8888507593246218.[0m
[32m[I 2022-04-13 12:02:44,890][0m Trial 712 finished with value: 0.7777450098077562 and parameters: {'splitter': 'best', 'min_samples_split': 0.12561380856404897, 'min_samples_leaf': 0.090933369570351, 'min_weight_fraction_leaf': 0.018198740614163524, 'max_features': 0.9424688439347377}. Best is trial 448 with value: 0.8888507593246218.[0m
/media/san2_ssd/data/Workdir/survival/utils.py:305: RuntimeWarning: invalid value encountered in true_divide
  pdfs = np.gradient(1-survs,axis=1)/norms
/media/san2_ssd/data/Workdir/survival/utils.py:305: RuntimeWarning: invalid value encountered in true_divide
  pdfs = np.gradient(1-survs,axis=1)/norms
[32m[I 2022-04-13 12:02:45,716][0m Trial 713 finished with value: 0.8774200804476899 and parameters: {'splitter': 'best', 'min_samples_split': 0.07741631227060779, 'min_samples_leaf': 0.04344929628706741, 'min_weight_fraction_leaf': 0.0495550856454387, 'max_features': 0.6699761792932128}. Best is trial 448 with value: 0.8888507593246218.[0m
/media/san2_ssd/data/Workdir/survival/utils.py:305: RuntimeWarning: invalid value encountered in true_divide
  pdfs = np.gradient(1-survs,axis=1)/norms
[32m[I 2022-04-13 12:02:46,710][0m Trial 714 finished with value: 0.8800803923225061 and parameters: {'splitter': 'best', 'min_samples_split': 0.1602580824004514, 'min_samples_leaf': 0.03295410145781168, 'min_weight_fraction_leaf': 0.031619974614555874, 'max_features': 0.9717482597414736}. Best is trial 448 with value: 0.8888507593246218.[0m
[32m[I 2022-04-13 12:02:48,351][0m Trial 715 finished with value: 0.7857568027488551 and parameters: {'splitter': 'best', 'min_samples_split': 0.11095848378273117, 'min_samples_leaf': 0.07375481537270913, 'min_weight_fraction_leaf': 0.04316807279377682, 'max_features': 0.9992319606877006}. Best is trial 448 with value: 0.8888507593246218.[0m
/media/san2_ssd/data/Workdir/survival/utils.py:305: RuntimeWarning: invalid value encountered in true_divide
  pdfs = np.gradient(1-survs,axis=1)/norms
/media/san2_ssd/data/Workdir/survival/utils.py:305: RuntimeWarning: invalid value encountered in true_divide
  pdfs = np.gradient(1-survs,axis=1)/norms
/media/san2_ssd/data/Workdir/survival/utils.py:305: RuntimeWarning: invalid value encountered in true_divide
  pdfs = np.gradient(1-survs,axis=1)/norms
[32m[I 2022-04-13 12:02:50,143][0m Trial 716 finished with value: 0.8841848197051373 and parameters: {'splitter': 'best', 'min_samples_split': 0.09766706363863818, 'min_samples_leaf': 0.047807976544392575, 'min_weight_fraction_leaf': 0.022157987937841295, 'max_features': 0.9525174874521832}. Best is trial 448 with value: 0.8888507593246218.[0m
[32m[I 2022-04-13 12:02:50,806][0m Trial 717 finished with value: 0.8774441456765008 and parameters: {'splitter': 'random', 'min_samples_split': 0.11916462300224832, 'min_samples_leaf': 0.02421271736241206, 'min_weight_fraction_leaf': 0.05568849381841895, 'max_features': 0.8865885539754098}. Best is trial 448 with value: 0.8888507593246218.[0m
/media/san2_ssd/data/Workdir/survival/utils.py:305: RuntimeWarning: invalid value encountered in true_divide
  pdfs = np.gradient(1-survs,axis=1)/norms
/media/san2_ssd/data/Workdir/survival/utils.py:305: RuntimeWarning: invalid value encountered in true_divide
  pdfs = np.gradient(1-survs,axis=1)/norms
/media/san2_ssd/data/Workdir/survival/utils.py:305: RuntimeWarning: invalid value encountered in true_divide
  pdfs = np.gradient(1-survs,axis=1)/norms
[32m[I 2022-04-13 12:02:53,302][0m Trial 718 finished with value: 0.8874467938787495 and parameters: {'splitter': 'best', 'min_samples_split': 0.13412843833943394, 'min_samples_leaf': 0.00777530559812096, 'min_weight_fraction_leaf': 0.03323911043057813, 'max_features': 0.9997141582709085}. Best is trial 448 with value: 0.8888507593246218.[0m
/media/san2_ssd/data/Workdir/survival/utils.py:305: RuntimeWarning: invalid value encountered in true_divide
  pdfs = np.gradient(1-survs,axis=1)/norms
/media/san2_ssd/data/Workdir/survival/utils.py:305: RuntimeWarning: invalid value encountered in true_divide
  pdfs = np.gradient(1-survs,axis=1)/norms
/media/san2_ssd/data/Workdir/survival/utils.py:305: RuntimeWarning: invalid value encountered in true_divide
  pdfs = np.gradient(1-survs,axis=1)/norms
/media/san2_ssd/data/Workdir/survival/utils.py:305: RuntimeWarning: invalid value encountered in true_divide
  pdfs = np.gradient(1-survs,axis=1)/norms
/media/san2_ssd/data/Workdir/survival/utils.py:305: RuntimeWarning: invalid value encountered in true_divide
  pdfs = np.gradient(1-survs,axis=1)/norms
[32m[I 2022-04-13 12:02:55,499][0m Trial 719 finished with value: 0.8850813598514764 and parameters: {'splitter': 'best', 'min_samples_split': 0.10704267543186725, 'min_samples_leaf': 0.03438214959855791, 'min_weight_fraction_leaf': 0.000500385445900621, 'max_features': 0.9740323252311976}. Best is trial 448 with value: 0.8888507593246218.[0m
/media/san2_ssd/data/Workdir/survival/utils.py:305: RuntimeWarning: invalid value encountered in true_divide
  pdfs = np.gradient(1-survs,axis=1)/norms
/media/san2_ssd/data/Workdir/survival/utils.py:305: RuntimeWarning: invalid value encountered in true_divide
  pdfs = np.gradient(1-survs,axis=1)/norms
/media/san2_ssd/data/Workdir/survival/utils.py:305: RuntimeWarning: invalid value encountered in true_divide
  pdfs = np.gradient(1-survs,axis=1)/norms
[32m[I 2022-04-13 12:02:57,239][0m Trial 720 finished with value: 0.8833628602539747 and parameters: {'splitter': 'best', 'min_samples_split': 0.09411489855664255, 'min_samples_leaf': 0.056038266745397525, 'min_weight_fraction_leaf': 0.01076802649652087, 'max_features': 0.9292873059359686}. Best is trial 448 with value: 0.8888507593246218.[0m
/media/san2_ssd/data/Workdir/survival/utils.py:305: RuntimeWarning: invalid value encountered in true_divide
  pdfs = np.gradient(1-survs,axis=1)/norms
/media/san2_ssd/data/Workdir/survival/utils.py:305: RuntimeWarning: invalid value encountered in true_divide
  pdfs = np.gradient(1-survs,axis=1)/norms
/media/san2_ssd/data/Workdir/survival/utils.py:305: RuntimeWarning: invalid value encountered in true_divide
  pdfs = np.gradient(1-survs,axis=1)/norms
/media/san2_ssd/data/Workdir/survival/utils.py:305: RuntimeWarning: invalid value encountered in true_divide
  pdfs = np.gradient(1-survs,axis=1)/norms
[32m[I 2022-04-13 12:02:59,056][0m Trial 721 finished with value: 0.887036273064059 and parameters: {'splitter': 'best', 'min_samples_split': 0.12507890566591473, 'min_samples_leaf': 0.02072776545968541, 'min_weight_fraction_leaf': 0.037917213130266775, 'max_features': 0.978314910922675}. Best is trial 448 with value: 0.8888507593246218.[0m
[32m[I 2022-04-13 12:03:02,208][0m Trial 722 finished with value: 0.8821421099120764 and parameters: {'splitter': 'best', 'min_samples_split': 0.08662036751416305, 'min_samples_leaf': 0.04207193862419316, 'min_weight_fraction_leaf': 0.07286690712836147, 'max_features': 0.9554005761016666}. Best is trial 448 with value: 0.8888507593246218.[0m
/media/san2_ssd/data/Workdir/survival/utils.py:305: RuntimeWarning: invalid value encountered in true_divide
  pdfs = np.gradient(1-survs,axis=1)/norms
/media/san2_ssd/data/Workdir/survival/utils.py:305: RuntimeWarning: invalid value encountered in true_divide
  pdfs = np.gradient(1-survs,axis=1)/norms
/media/san2_ssd/data/Workdir/survival/utils.py:305: RuntimeWarning: invalid value encountered in true_divide
  pdfs = np.gradient(1-survs,axis=1)/norms
/media/san2_ssd/data/Workdir/survival/utils.py:305: RuntimeWarning: invalid value encountered in true_divide
  pdfs = np.gradient(1-survs,axis=1)/norms
[32m[I 2022-04-13 12:03:04,413][0m Trial 723 finished with value: 0.8859906248470821 and parameters: {'splitter': 'best', 'min_samples_split': 0.11662143971166344, 'min_samples_leaf': 0.017568119292941765, 'min_weight_fraction_leaf': 0.020774408342464804, 'max_features': 0.9819256509430124}. Best is trial 448 with value: 0.8888507593246218.[0m
/media/san2_ssd/data/Workdir/survival/utils.py:305: RuntimeWarning: invalid value encountered in true_divide
  pdfs = np.gradient(1-survs,axis=1)/norms
[32m[I 2022-04-13 12:03:06,752][0m Trial 724 finished with value: 0.8830587461579571 and parameters: {'splitter': 'best', 'min_samples_split': 0.13836235326610657, 'min_samples_leaf': 0.028901121281326353, 'min_weight_fraction_leaf': 0.04634626216620476, 'max_features': 0.9655083867325474}. Best is trial 448 with value: 0.8888507593246218.[0m
/media/san2_ssd/data/Workdir/survival/utils.py:305: RuntimeWarning: invalid value encountered in true_divide
  pdfs = np.gradient(1-survs,axis=1)/norms
/media/san2_ssd/data/Workdir/survival/utils.py:305: RuntimeWarning: invalid value encountered in true_divide
  pdfs = np.gradient(1-survs,axis=1)/norms
/media/san2_ssd/data/Workdir/survival/utils.py:305: RuntimeWarning: invalid value encountered in true_divide
  pdfs = np.gradient(1-survs,axis=1)/norms
/media/san2_ssd/data/Workdir/survival/utils.py:305: RuntimeWarning: invalid value encountered in true_divide
  pdfs = np.gradient(1-survs,axis=1)/norms
[32m[I 2022-04-13 12:03:09,400][0m Trial 725 finished with value: 0.8866501275984968 and parameters: {'splitter': 'best', 'min_samples_split': 0.10375368700031944, 'min_samples_leaf': 0.038199638697858675, 'min_weight_fraction_leaf': 0.028974572487143576, 'max_features': 0.9987072725266906}. Best is trial 448 with value: 0.8888507593246218.[0m
[32m[I 2022-04-13 12:03:09,940][0m Trial 726 finished with value: 0.8241631916618131 and parameters: {'splitter': 'best', 'min_samples_split': 0.11501680283423876, 'min_samples_leaf': 0.05320557514989805, 'min_weight_fraction_leaf': 0.061550839561727196, 'max_features': 0.22538664634317357}. Best is trial 448 with value: 0.8888507593246218.[0m
/media/san2_ssd/data/Workdir/survival/utils.py:305: RuntimeWarning: invalid value encountered in true_divide
  pdfs = np.gradient(1-survs,axis=1)/norms
[32m[I 2022-04-13 12:03:12,511][0m Trial 727 finished with value: 0.8834660887881881 and parameters: {'splitter': 'best', 'min_samples_split': 0.12942010439761462, 'min_samples_leaf': 0.06404019763671051, 'min_weight_fraction_leaf': 0.014752817919603683, 'max_features': 0.9504925019658225}. Best is trial 448 with value: 0.8888507593246218.[0m
/media/san2_ssd/data/Workdir/survival/utils.py:305: RuntimeWarning: invalid value encountered in true_divide
  pdfs = np.gradient(1-survs,axis=1)/norms
/media/san2_ssd/data/Workdir/survival/utils.py:305: RuntimeWarning: invalid value encountered in true_divide
  pdfs = np.gradient(1-survs,axis=1)/norms
/media/san2_ssd/data/Workdir/survival/utils.py:305: RuntimeWarning: invalid value encountered in true_divide
  pdfs = np.gradient(1-survs,axis=1)/norms
/media/san2_ssd/data/Workdir/survival/utils.py:305: RuntimeWarning: invalid value encountered in true_divide
  pdfs = np.gradient(1-survs,axis=1)/norms
/media/san2_ssd/data/Workdir/survival/utils.py:305: RuntimeWarning: invalid value encountered in true_divide
  pdfs = np.gradient(1-survs,axis=1)/norms
[32m[I 2022-04-13 12:03:13,883][0m Trial 728 finished with value: 0.8848928647805249 and parameters: {'splitter': 'best', 'min_samples_split': 0.09886504372171576, 'min_samples_leaf': 0.02686429008824644, 'min_weight_fraction_leaf': 0.03581890432616369, 'max_features': 0.9690534546183815}. Best is trial 448 with value: 0.8888507593246218.[0m
[32m[I 2022-04-13 12:03:15,647][0m Trial 729 finished with value: 0.557150620326279 and parameters: {'splitter': 'best', 'min_samples_split': 0.10861205423454129, 'min_samples_leaf': 0.041161509750037024, 'min_weight_fraction_leaf': 0.151082885695282, 'max_features': 0.9173919057098983}. Best is trial 448 with value: 0.8888507593246218.[0m
/media/san2_ssd/data/Workdir/survival/utils.py:305: RuntimeWarning: invalid value encountered in true_divide
  pdfs = np.gradient(1-survs,axis=1)/norms
/media/san2_ssd/data/Workdir/survival/utils.py:305: RuntimeWarning: invalid value encountered in true_divide
  pdfs = np.gradient(1-survs,axis=1)/norms
/media/san2_ssd/data/Workdir/survival/utils.py:305: RuntimeWarning: invalid value encountered in true_divide
  pdfs = np.gradient(1-survs,axis=1)/norms
[32m[I 2022-04-13 12:03:18,859][0m Trial 730 finished with value: 0.8866153402657272 and parameters: {'splitter': 'best', 'min_samples_split': 0.12271418213713631, 'min_samples_leaf': 0.01817721529750448, 'min_weight_fraction_leaf': 0.025324418686945863, 'max_features': 0.9998994239091267}. Best is trial 448 with value: 0.8888507593246218.[0m
/media/san2_ssd/data/Workdir/survival/utils.py:305: RuntimeWarning: invalid value encountered in true_divide
  pdfs = np.gradient(1-survs,axis=1)/norms
