[32m[I 2022-04-13 11:56:12,378][0m Trial 500 finished with value: 0.6981432179087999 and parameters: {'splitter': 'best', 'min_samples_split': 0.4097535974227928, 'min_samples_leaf': 0.47576601497327575, 'min_weight_fraction_leaf': 0.11692467984079719, 'max_features': 0.9367776859292956}. Best is trial 448 with value: 0.8888507593246218.[0m
/media/san2_ssd/data/Workdir/survival/utils.py:305: RuntimeWarning: invalid value encountered in true_divide
  pdfs = np.gradient(1-survs,axis=1)/norms
/media/san2_ssd/data/Workdir/survival/utils.py:305: RuntimeWarning: invalid value encountered in true_divide
  pdfs = np.gradient(1-survs,axis=1)/norms
/media/san2_ssd/data/Workdir/survival/utils.py:305: RuntimeWarning: invalid value encountered in true_divide
  pdfs = np.gradient(1-survs,axis=1)/norms
/media/san2_ssd/data/Workdir/survival/utils.py:305: RuntimeWarning: invalid value encountered in true_divide
  pdfs = np.gradient(1-survs,axis=1)/norms
/media/san2_ssd/data/Workdir/survival/utils.py:305: RuntimeWarning: invalid value encountered in true_divide
  pdfs = np.gradient(1-survs,axis=1)/norms
[32m[I 2022-04-13 11:56:14,364][0m Trial 501 finished with value: 0.8868738360009131 and parameters: {'splitter': 'best', 'min_samples_split': 0.09251248691539272, 'min_samples_leaf': 0.02330825138003576, 'min_weight_fraction_leaf': 0.02707651355686678, 'max_features': 0.9829104938124452}. Best is trial 448 with value: 0.8888507593246218.[0m
/media/san2_ssd/data/Workdir/survival/utils.py:305: RuntimeWarning: invalid value encountered in true_divide
  pdfs = np.gradient(1-survs,axis=1)/norms
/media/san2_ssd/data/Workdir/survival/utils.py:305: RuntimeWarning: invalid value encountered in true_divide
  pdfs = np.gradient(1-survs,axis=1)/norms
/media/san2_ssd/data/Workdir/survival/utils.py:305: RuntimeWarning: invalid value encountered in true_divide
  pdfs = np.gradient(1-survs,axis=1)/norms
[32m[I 2022-04-13 11:56:16,170][0m Trial 502 finished with value: 0.88329765623737 and parameters: {'splitter': 'best', 'min_samples_split': 0.11782683073748576, 'min_samples_leaf': 0.05740681537909624, 'min_weight_fraction_leaf': 0.03193929159809388, 'max_features': 0.9546575899944931}. Best is trial 448 with value: 0.8888507593246218.[0m
/media/san2_ssd/data/Workdir/survival/utils.py:305: RuntimeWarning: invalid value encountered in true_divide
  pdfs = np.gradient(1-survs,axis=1)/norms
/media/san2_ssd/data/Workdir/survival/utils.py:305: RuntimeWarning: invalid value encountered in true_divide
  pdfs = np.gradient(1-survs,axis=1)/norms
/media/san2_ssd/data/Workdir/survival/utils.py:305: RuntimeWarning: invalid value encountered in true_divide
  pdfs = np.gradient(1-survs,axis=1)/norms
/media/san2_ssd/data/Workdir/survival/utils.py:305: RuntimeWarning: invalid value encountered in true_divide
  pdfs = np.gradient(1-survs,axis=1)/norms
/media/san2_ssd/data/Workdir/survival/utils.py:305: RuntimeWarning: invalid value encountered in true_divide
  pdfs = np.gradient(1-survs,axis=1)/norms
[32m[I 2022-04-13 11:56:18,376][0m Trial 503 finished with value: 0.8869486054638702 and parameters: {'splitter': 'best', 'min_samples_split': 0.10405971766230242, 'min_samples_leaf': 0.03211691996482699, 'min_weight_fraction_leaf': 0.017210169390671777, 'max_features': 0.9832055946170134}. Best is trial 448 with value: 0.8888507593246218.[0m
/media/san2_ssd/data/Workdir/survival/utils.py:305: RuntimeWarning: invalid value encountered in true_divide
  pdfs = np.gradient(1-survs,axis=1)/norms
[32m[I 2022-04-13 11:56:18,774][0m Trial 504 finished with value: 0.8638791844274882 and parameters: {'splitter': 'best', 'min_samples_split': 0.07487572194338622, 'min_samples_leaf': 0.01319154503531891, 'min_weight_fraction_leaf': 0.03531051430343357, 'max_features': 0.32269174362759157}. Best is trial 448 with value: 0.8888507593246218.[0m
/media/san2_ssd/data/Workdir/survival/utils.py:305: RuntimeWarning: invalid value encountered in true_divide
  pdfs = np.gradient(1-survs,axis=1)/norms
/media/san2_ssd/data/Workdir/survival/utils.py:305: RuntimeWarning: invalid value encountered in true_divide
  pdfs = np.gradient(1-survs,axis=1)/norms
/media/san2_ssd/data/Workdir/survival/utils.py:305: RuntimeWarning: invalid value encountered in true_divide
  pdfs = np.gradient(1-survs,axis=1)/norms
[32m[I 2022-04-13 11:56:21,130][0m Trial 505 finished with value: 0.886012212135423 and parameters: {'splitter': 'best', 'min_samples_split': 0.09308029654569559, 'min_samples_leaf': 0.046759093137834, 'min_weight_fraction_leaf': 0.008113849705328254, 'max_features': 0.9985332766799951}. Best is trial 448 with value: 0.8888507593246218.[0m
[32m[I 2022-04-13 11:56:21,797][0m Trial 506 finished with value: 0.7791428585046046 and parameters: {'splitter': 'random', 'min_samples_split': 0.110475888098054, 'min_samples_leaf': 0.023924533663026083, 'min_weight_fraction_leaf': 0.00028985361555121034, 'max_features': 0.9630351526201226}. Best is trial 448 with value: 0.8888507593246218.[0m
/media/san2_ssd/data/Workdir/survival/utils.py:305: RuntimeWarning: invalid value encountered in true_divide
  pdfs = np.gradient(1-survs,axis=1)/norms
[32m[I 2022-04-13 11:56:24,054][0m Trial 507 finished with value: 0.8827712708477871 and parameters: {'splitter': 'best', 'min_samples_split': 0.12286505977025489, 'min_samples_leaf': 0.007342381146993544, 'min_weight_fraction_leaf': 0.022566565334440694, 'max_features': 0.9329783210979203}. Best is trial 448 with value: 0.8888507593246218.[0m
/media/san2_ssd/data/Workdir/survival/utils.py:305: RuntimeWarning: invalid value encountered in true_divide
  pdfs = np.gradient(1-survs,axis=1)/norms
/media/san2_ssd/data/Workdir/survival/utils.py:305: RuntimeWarning: invalid value encountered in true_divide
  pdfs = np.gradient(1-survs,axis=1)/norms
/media/san2_ssd/data/Workdir/survival/utils.py:305: RuntimeWarning: invalid value encountered in true_divide
  pdfs = np.gradient(1-survs,axis=1)/norms
/media/san2_ssd/data/Workdir/survival/utils.py:305: RuntimeWarning: invalid value encountered in true_divide
  pdfs = np.gradient(1-survs,axis=1)/norms
[32m[I 2022-04-13 11:56:25,224][0m Trial 508 finished with value: 0.8837942780554184 and parameters: {'splitter': 'best', 'min_samples_split': 0.08087639345922382, 'min_samples_leaf': 0.03835643513496566, 'min_weight_fraction_leaf': 0.027414354535626982, 'max_features': 0.9999947647879356}. Best is trial 448 with value: 0.8888507593246218.[0m
/media/san2_ssd/data/Workdir/survival/utils.py:305: RuntimeWarning: invalid value encountered in true_divide
  pdfs = np.gradient(1-survs,axis=1)/norms
/media/san2_ssd/data/Workdir/survival/utils.py:305: RuntimeWarning: invalid value encountered in true_divide
  pdfs = np.gradient(1-survs,axis=1)/norms
/media/san2_ssd/data/Workdir/survival/utils.py:305: RuntimeWarning: invalid value encountered in true_divide
  pdfs = np.gradient(1-survs,axis=1)/norms
/media/san2_ssd/data/Workdir/survival/utils.py:305: RuntimeWarning: invalid value encountered in true_divide
  pdfs = np.gradient(1-survs,axis=1)/norms
/media/san2_ssd/data/Workdir/survival/utils.py:305: RuntimeWarning: invalid value encountered in true_divide
  pdfs = np.gradient(1-survs,axis=1)/norms
[32m[I 2022-04-13 11:56:26,709][0m Trial 509 finished with value: 0.8841034840926432 and parameters: {'splitter': 'best', 'min_samples_split': 0.10403233943823247, 'min_samples_leaf': 0.01843712031534029, 'min_weight_fraction_leaf': 0.03778256211902338, 'max_features': 0.965882653647208}. Best is trial 448 with value: 0.8888507593246218.[0m
/media/san2_ssd/data/Workdir/survival/utils.py:305: RuntimeWarning: invalid value encountered in true_divide
  pdfs = np.gradient(1-survs,axis=1)/norms
/media/san2_ssd/data/Workdir/survival/utils.py:305: RuntimeWarning: invalid value encountered in true_divide
  pdfs = np.gradient(1-survs,axis=1)/norms
/media/san2_ssd/data/Workdir/survival/utils.py:305: RuntimeWarning: invalid value encountered in true_divide
  pdfs = np.gradient(1-survs,axis=1)/norms
/media/san2_ssd/data/Workdir/survival/utils.py:305: RuntimeWarning: invalid value encountered in true_divide
  pdfs = np.gradient(1-survs,axis=1)/norms
/media/san2_ssd/data/Workdir/survival/utils.py:305: RuntimeWarning: invalid value encountered in true_divide
  pdfs = np.gradient(1-survs,axis=1)/norms
[32m[I 2022-04-13 11:56:29,068][0m Trial 510 finished with value: 0.8872135592171737 and parameters: {'splitter': 'best', 'min_samples_split': 0.1149778693117004, 'min_samples_leaf': 0.030807920237513404, 'min_weight_fraction_leaf': 0.018007221462556684, 'max_features': 0.9995247497485537}. Best is trial 448 with value: 0.8888507593246218.[0m
/media/san2_ssd/data/Workdir/survival/utils.py:305: RuntimeWarning: invalid value encountered in true_divide
  pdfs = np.gradient(1-survs,axis=1)/norms
/media/san2_ssd/data/Workdir/survival/utils.py:305: RuntimeWarning: invalid value encountered in true_divide
  pdfs = np.gradient(1-survs,axis=1)/norms
/media/san2_ssd/data/Workdir/survival/utils.py:305: RuntimeWarning: invalid value encountered in true_divide
  pdfs = np.gradient(1-survs,axis=1)/norms
[32m[I 2022-04-13 11:56:31,070][0m Trial 511 finished with value: 0.8852989808395787 and parameters: {'splitter': 'best', 'min_samples_split': 0.12534142806134177, 'min_samples_leaf': 0.042715308196175965, 'min_weight_fraction_leaf': 0.05319250364215708, 'max_features': 0.9763060826394034}. Best is trial 448 with value: 0.8888507593246218.[0m
/media/san2_ssd/data/Workdir/survival/utils.py:305: RuntimeWarning: invalid value encountered in true_divide
  pdfs = np.gradient(1-survs,axis=1)/norms
/media/san2_ssd/data/Workdir/survival/utils.py:305: RuntimeWarning: invalid value encountered in true_divide
  pdfs = np.gradient(1-survs,axis=1)/norms
/media/san2_ssd/data/Workdir/survival/utils.py:305: RuntimeWarning: invalid value encountered in true_divide
  pdfs = np.gradient(1-survs,axis=1)/norms
/media/san2_ssd/data/Workdir/survival/utils.py:305: RuntimeWarning: invalid value encountered in true_divide
  pdfs = np.gradient(1-survs,axis=1)/norms
/media/san2_ssd/data/Workdir/survival/utils.py:305: RuntimeWarning: invalid value encountered in true_divide
  pdfs = np.gradient(1-survs,axis=1)/norms
[32m[I 2022-04-13 11:56:34,342][0m Trial 512 finished with value: 0.8866952077761342 and parameters: {'splitter': 'best', 'min_samples_split': 0.09586857103908962, 'min_samples_leaf': 0.02306657075999163, 'min_weight_fraction_leaf': 0.03395230037046777, 'max_features': 0.9822098707233219}. Best is trial 448 with value: 0.8888507593246218.[0m
/media/san2_ssd/data/Workdir/survival/utils.py:305: RuntimeWarning: invalid value encountered in true_divide
  pdfs = np.gradient(1-survs,axis=1)/norms
/media/san2_ssd/data/Workdir/survival/utils.py:305: RuntimeWarning: invalid value encountered in true_divide
  pdfs = np.gradient(1-survs,axis=1)/norms
[32m[I 2022-04-13 11:56:37,776][0m Trial 513 finished with value: 0.8823490872708216 and parameters: {'splitter': 'best', 'min_samples_split': 0.10984336769384605, 'min_samples_leaf': 0.00174987665803889, 'min_weight_fraction_leaf': 0.0229669762750076, 'max_features': 0.9497809373236796}. Best is trial 448 with value: 0.8888507593246218.[0m
[32m[I 2022-04-13 11:56:39,652][0m Trial 514 finished with value: 0.5511383729410468 and parameters: {'splitter': 'best', 'min_samples_split': 0.1745117240574303, 'min_samples_leaf': 0.05014547509395255, 'min_weight_fraction_leaf': 0.25967404817141404, 'max_features': 0.9669865174331345}. Best is trial 448 with value: 0.8888507593246218.[0m
/media/san2_ssd/data/Workdir/survival/utils.py:305: RuntimeWarning: invalid value encountered in true_divide
  pdfs = np.gradient(1-survs,axis=1)/norms
/media/san2_ssd/data/Workdir/survival/utils.py:305: RuntimeWarning: invalid value encountered in true_divide
  pdfs = np.gradient(1-survs,axis=1)/norms
/media/san2_ssd/data/Workdir/survival/utils.py:305: RuntimeWarning: invalid value encountered in true_divide
  pdfs = np.gradient(1-survs,axis=1)/norms
/media/san2_ssd/data/Workdir/survival/utils.py:305: RuntimeWarning: invalid value encountered in true_divide
  pdfs = np.gradient(1-survs,axis=1)/norms
[32m[I 2022-04-13 11:56:41,251][0m Trial 515 finished with value: 0.8863727033079345 and parameters: {'splitter': 'best', 'min_samples_split': 0.12854131511648126, 'min_samples_leaf': 0.011072124777749843, 'min_weight_fraction_leaf': 0.042228171639378455, 'max_features': 0.9823553819374533}. Best is trial 448 with value: 0.8888507593246218.[0m
/media/san2_ssd/data/Workdir/survival/utils.py:305: RuntimeWarning: invalid value encountered in true_divide
  pdfs = np.gradient(1-survs,axis=1)/norms
/media/san2_ssd/data/Workdir/survival/utils.py:305: RuntimeWarning: invalid value encountered in true_divide
  pdfs = np.gradient(1-survs,axis=1)/norms
/media/san2_ssd/data/Workdir/survival/utils.py:305: RuntimeWarning: invalid value encountered in true_divide
  pdfs = np.gradient(1-survs,axis=1)/norms
/media/san2_ssd/data/Workdir/survival/utils.py:305: RuntimeWarning: invalid value encountered in true_divide
  pdfs = np.gradient(1-survs,axis=1)/norms
/media/san2_ssd/data/Workdir/survival/utils.py:305: RuntimeWarning: invalid value encountered in true_divide
  pdfs = np.gradient(1-survs,axis=1)/norms
[32m[I 2022-04-13 11:56:42,671][0m Trial 516 finished with value: 0.8842900312976727 and parameters: {'splitter': 'best', 'min_samples_split': 0.08601129340106589, 'min_samples_leaf': 0.03323317881168347, 'min_weight_fraction_leaf': 0.01038236383304161, 'max_features': 0.9497702744855718}. Best is trial 448 with value: 0.8888507593246218.[0m
[32m[I 2022-04-13 11:56:43,905][0m Trial 517 finished with value: 0.7798024136467712 and parameters: {'splitter': 'best', 'min_samples_split': 0.1201541390324515, 'min_samples_leaf': 0.018605815304939682, 'min_weight_fraction_leaf': 0.103280428216555, 'max_features': 0.9144817347078408}. Best is trial 448 with value: 0.8888507593246218.[0m
[32m[I 2022-04-13 11:56:44,706][0m Trial 518 finished with value: 0.8827566500887588 and parameters: {'splitter': 'best', 'min_samples_split': 0.10444143283432347, 'min_samples_leaf': 0.06578543973328249, 'min_weight_fraction_leaf': 0.029295652721429463, 'max_features': 0.9991737467812528}. Best is trial 448 with value: 0.8888507593246218.[0m
/media/san2_ssd/data/Workdir/survival/utils.py:305: RuntimeWarning: invalid value encountered in true_divide
  pdfs = np.gradient(1-survs,axis=1)/norms
/media/san2_ssd/data/Workdir/survival/utils.py:305: RuntimeWarning: invalid value encountered in true_divide
  pdfs = np.gradient(1-survs,axis=1)/norms
[32m[I 2022-04-13 11:56:45,860][0m Trial 519 finished with value: 0.8820990189702703 and parameters: {'splitter': 'best', 'min_samples_split': 0.1366500551716798, 'min_samples_leaf': 0.03144809912013742, 'min_weight_fraction_leaf': 0.016964770990300974, 'max_features': 0.9693561753153906}. Best is trial 448 with value: 0.8888507593246218.[0m
/media/san2_ssd/data/Workdir/survival/utils.py:305: RuntimeWarning: invalid value encountered in true_divide
  pdfs = np.gradient(1-survs,axis=1)/norms
/media/san2_ssd/data/Workdir/survival/utils.py:305: RuntimeWarning: invalid value encountered in true_divide
  pdfs = np.gradient(1-survs,axis=1)/norms
/media/san2_ssd/data/Workdir/survival/utils.py:305: RuntimeWarning: invalid value encountered in true_divide
  pdfs = np.gradient(1-survs,axis=1)/norms
[32m[I 2022-04-13 11:56:48,511][0m Trial 520 finished with value: 0.883671464201617 and parameters: {'splitter': 'best', 'min_samples_split': 0.09750959335142226, 'min_samples_leaf': 0.04336675727176906, 'min_weight_fraction_leaf': 0.051856155161209956, 'max_features': 0.9298311478977854}. Best is trial 448 with value: 0.8888507593246218.[0m
[32m[I 2022-04-13 11:56:51,437][0m Trial 521 finished with value: 0.7821046745560404 and parameters: {'splitter': 'best', 'min_samples_split': 0.19047403213979894, 'min_samples_leaf': 0.024145044064639496, 'min_weight_fraction_leaf': 0.03802222596591293, 'max_features': 0.9786417570546287}. Best is trial 448 with value: 0.8888507593246218.[0m
/media/san2_ssd/data/Workdir/survival/utils.py:305: RuntimeWarning: invalid value encountered in true_divide
  pdfs = np.gradient(1-survs,axis=1)/norms
/media/san2_ssd/data/Workdir/survival/utils.py:305: RuntimeWarning: invalid value encountered in true_divide
  pdfs = np.gradient(1-survs,axis=1)/norms
[32m[I 2022-04-13 11:56:53,944][0m Trial 522 finished with value: 0.8823265299663581 and parameters: {'splitter': 'best', 'min_samples_split': 0.11576677251429232, 'min_samples_leaf': 0.009951279409364298, 'min_weight_fraction_leaf': 0.027869583585572972, 'max_features': 0.9503766241181271}. Best is trial 448 with value: 0.8888507593246218.[0m
[32m[I 2022-04-13 11:56:54,555][0m Trial 523 finished with value: 0.6902543881407374 and parameters: {'splitter': 'best', 'min_samples_split': 0.10977806692906877, 'min_samples_leaf': 0.055411866197863896, 'min_weight_fraction_leaf': 0.04340657101290935, 'max_features': 0.08893901724038777}. Best is trial 448 with value: 0.8888507593246218.[0m
[32m[I 2022-04-13 11:56:55,333][0m Trial 524 finished with value: 0.5371812073302544 and parameters: {'splitter': 'best', 'min_samples_split': 0.12834526333362742, 'min_samples_leaf': 0.3724660737582532, 'min_weight_fraction_leaf': 0.008910147723202998, 'max_features': 0.9832351735324325}. Best is trial 448 with value: 0.8888507593246218.[0m
/media/san2_ssd/data/Workdir/survival/utils.py:305: RuntimeWarning: invalid value encountered in true_divide
  pdfs = np.gradient(1-survs,axis=1)/norms
[32m[I 2022-04-13 11:56:55,822][0m Trial 525 finished with value: 0.8828297858836587 and parameters: {'splitter': 'random', 'min_samples_split': 0.08580491985775188, 'min_samples_leaf': 0.03685218620987374, 'min_weight_fraction_leaf': 0.021305604926246308, 'max_features': 0.9649036133423068}. Best is trial 448 with value: 0.8888507593246218.[0m
[32m[I 2022-04-13 11:56:56,685][0m Trial 526 finished with value: 0.6953987916579007 and parameters: {'splitter': 'best', 'min_samples_split': 0.09978903901778373, 'min_samples_leaf': 0.01640898911952359, 'min_weight_fraction_leaf': 0.42036894951831005, 'max_features': 0.9991409146603838}. Best is trial 448 with value: 0.8888507593246218.[0m
[32m[I 2022-04-13 11:56:59,100][0m Trial 527 finished with value: 0.5474145173769144 and parameters: {'splitter': 'best', 'min_samples_split': 0.11930572493936718, 'min_samples_leaf': 0.026137026690638877, 'min_weight_fraction_leaf': 0.23883968233899477, 'max_features': 0.9416201347327331}. Best is trial 448 with value: 0.8888507593246218.[0m
/media/san2_ssd/data/Workdir/survival/utils.py:305: RuntimeWarning: invalid value encountered in true_divide
  pdfs = np.gradient(1-survs,axis=1)/norms
/media/san2_ssd/data/Workdir/survival/utils.py:305: RuntimeWarning: invalid value encountered in true_divide
  pdfs = np.gradient(1-survs,axis=1)/norms
[32m[I 2022-04-13 11:57:01,469][0m Trial 528 finished with value: 0.8860922758784326 and parameters: {'splitter': 'best', 'min_samples_split': 0.14351291636704647, 'min_samples_leaf': 0.0017133075024924182, 'min_weight_fraction_leaf': 0.030917257586388806, 'max_features': 0.9823042570738916}. Best is trial 448 with value: 0.8888507593246218.[0m
/media/san2_ssd/data/Workdir/survival/utils.py:305: RuntimeWarning: invalid value encountered in true_divide
  pdfs = np.gradient(1-survs,axis=1)/norms
/media/san2_ssd/data/Workdir/survival/utils.py:305: RuntimeWarning: invalid value encountered in true_divide
  pdfs = np.gradient(1-survs,axis=1)/norms
[32m[I 2022-04-13 11:57:02,709][0m Trial 529 finished with value: 0.8807000428239695 and parameters: {'splitter': 'best', 'min_samples_split': 0.10733928692508177, 'min_samples_leaf': 0.042703063490799206, 'min_weight_fraction_leaf': 0.05730364279784113, 'max_features': 0.8935843790352844}. Best is trial 448 with value: 0.8888507593246218.[0m
/media/san2_ssd/data/Workdir/survival/utils.py:305: RuntimeWarning: invalid value encountered in true_divide
  pdfs = np.gradient(1-survs,axis=1)/norms
/media/san2_ssd/data/Workdir/survival/utils.py:305: RuntimeWarning: invalid value encountered in true_divide
  pdfs = np.gradient(1-survs,axis=1)/norms
/media/san2_ssd/data/Workdir/survival/utils.py:305: RuntimeWarning: invalid value encountered in true_divide
  pdfs = np.gradient(1-survs,axis=1)/norms
/media/san2_ssd/data/Workdir/survival/utils.py:305: RuntimeWarning: invalid value encountered in true_divide
  pdfs = np.gradient(1-survs,axis=1)/norms
[32m[I 2022-04-13 11:57:04,952][0m Trial 530 finished with value: 0.8849798986221067 and parameters: {'splitter': 'best', 'min_samples_split': 0.09259389520427516, 'min_samples_leaf': 0.0284406941726784, 'min_weight_fraction_leaf': 0.04053328058911142, 'max_features': 0.9997680487625302}. Best is trial 448 with value: 0.8888507593246218.[0m
/media/san2_ssd/data/Workdir/survival/utils.py:305: RuntimeWarning: invalid value encountered in true_divide
  pdfs = np.gradient(1-survs,axis=1)/norms
/media/san2_ssd/data/Workdir/survival/utils.py:305: RuntimeWarning: invalid value encountered in true_divide
  pdfs = np.gradient(1-survs,axis=1)/norms
/media/san2_ssd/data/Workdir/survival/utils.py:305: RuntimeWarning: invalid value encountered in true_divide
  pdfs = np.gradient(1-survs,axis=1)/norms
[32m[I 2022-04-13 11:57:06,946][0m Trial 531 finished with value: 0.8818548579768134 and parameters: {'splitter': 'best', 'min_samples_split': 0.11829189928038225, 'min_samples_leaf': 0.02025985511223597, 'min_weight_fraction_leaf': 0.0002345930995166709, 'max_features': 0.9618313806345753}. Best is trial 448 with value: 0.8888507593246218.[0m
/media/san2_ssd/data/Workdir/survival/utils.py:305: RuntimeWarning: invalid value encountered in true_divide
  pdfs = np.gradient(1-survs,axis=1)/norms
