[32m[I 2022-04-17 16:30:50,518][0m Trial 326 finished with value: 0.7622827522096964 and parameters: {'n_hidden': 256, 'mixture_components': 10, 'use_sparse_layer': True, 'use_sparse_loss': False, 'use_batchnorm': False, 'use_dropout': True, 'dropout': 0.7177922177558486, 'mlp_size_1': 1, 'mlp_size_2': 4, 'mlp_size_3': 0, 'kernel': 'Weibull', 'loss_name': 'CensoredNLLLoss'}. Best is trial 245 with value: 0.7744390497152815.[0m
[32m[I 2022-04-17 16:33:00,289][0m Trial 327 finished with value: 0.7731065511128108 and parameters: {'n_hidden': 256, 'mixture_components': 9, 'use_sparse_layer': True, 'use_sparse_loss': True, 'lmbd': 2.268986322129173e-06, 'use_batchnorm': False, 'use_dropout': True, 'dropout': 0.7769570657149486, 'mlp_size_1': 1, 'mlp_size_2': 4, 'mlp_size_3': 0, 'kernel': 'Exponential', 'loss_name': 'AlternativeNLLLoss'}. Best is trial 245 with value: 0.7744390497152815.[0m
[32m[I 2022-04-17 16:34:58,375][0m Trial 328 finished with value: 0.7711806029379524 and parameters: {'n_hidden': 1024, 'mixture_components': 7, 'use_sparse_layer': True, 'use_sparse_loss': True, 'lmbd': 2.0508958231187844e-06, 'use_batchnorm': False, 'use_dropout': True, 'dropout': 0.8027970459647329, 'mlp_size_1': 2, 'mlp_size_2': 4, 'mlp_size_3': 0, 'kernel': 'Exponential', 'loss_name': 'AlternativeNLLLoss'}. Best is trial 245 with value: 0.7744390497152815.[0m
[32m[I 2022-04-17 16:37:08,668][0m Trial 329 finished with value: 0.7679703418784127 and parameters: {'n_hidden': 256, 'mixture_components': 10, 'use_sparse_layer': True, 'use_sparse_loss': True, 'lmbd': 2.5963801674145044e-06, 'use_batchnorm': False, 'use_dropout': True, 'dropout': 0.7739526530950315, 'mlp_size_1': 1, 'mlp_size_2': 4, 'mlp_size_3': 0, 'kernel': 'Exponential', 'loss_name': 'AlternativeNLLLoss'}. Best is trial 245 with value: 0.7744390497152815.[0m
[32m[I 2022-04-17 16:40:49,690][0m Trial 330 finished with value: 0.7673644959715166 and parameters: {'n_hidden': 256, 'mixture_components': 10, 'use_sparse_layer': False, 'use_batchnorm': False, 'use_dropout': True, 'dropout': 0.8529604121359644, 'mlp_size_1': 1, 'mlp_size_2': 4, 'mlp_size_3': 0, 'kernel': 'LogNormal', 'loss_name': 'AlternativeNLLLoss'}. Best is trial 245 with value: 0.7744390497152815.[0m
[32m[I 2022-04-17 16:44:06,518][0m Trial 331 finished with value: 0.5998216621314392 and parameters: {'n_hidden': 2048, 'mixture_components': 9, 'use_sparse_layer': True, 'use_sparse_loss': True, 'lmbd': 1.3748057238056447e-06, 'use_batchnorm': True, 'use_dropout': True, 'dropout': 0.7857598424893564, 'mlp_size_1': 2, 'mlp_size_2': 5, 'mlp_size_3': 1, 'kernel': 'Logistic', 'loss_name': 'AlternativeNLLLoss'}. Best is trial 245 with value: 0.7744390497152815.[0m
[32m[I 2022-04-17 16:46:11,616][0m Trial 332 finished with value: 0.7685289506383509 and parameters: {'n_hidden': 64, 'mixture_components': 10, 'use_sparse_layer': True, 'use_sparse_loss': True, 'lmbd': 2.7747247510063084e-05, 'use_batchnorm': False, 'use_dropout': False, 'mlp_size_1': 1, 'mlp_size_2': 2, 'mlp_size_3': 0, 'kernel': 'Exponential', 'loss_name': 'AlternativeNLLLoss'}. Best is trial 245 with value: 0.7744390497152815.[0m
[32m[I 2022-04-17 16:48:21,639][0m Trial 333 finished with value: 0.7718320947883388 and parameters: {'n_hidden': 256, 'mixture_components': 8, 'use_sparse_layer': True, 'use_sparse_loss': True, 'lmbd': 1.9684244720512734e-06, 'use_batchnorm': False, 'use_dropout': True, 'dropout': 0.7500410043745277, 'mlp_size_1': 1, 'mlp_size_2': 4, 'mlp_size_3': 0, 'kernel': 'Exponential', 'loss_name': 'AlternativeNLLLoss'}. Best is trial 245 with value: 0.7744390497152815.[0m
[32m[I 2022-04-17 16:50:43,671][0m Trial 334 finished with value: 0.7685071729266486 and parameters: {'n_hidden': 256, 'mixture_components': 2, 'use_sparse_layer': True, 'use_sparse_loss': True, 'lmbd': 4.108652984283777e-06, 'use_batchnorm': False, 'use_dropout': True, 'dropout': 0.8364334371168619, 'mlp_size_1': 1, 'mlp_size_2': 4, 'mlp_size_3': 0, 'kernel': 'Exponential', 'loss_name': 'AlternativeNLLLoss'}. Best is trial 245 with value: 0.7744390497152815.[0m
[32m[I 2022-04-17 16:53:09,212][0m Trial 335 finished with value: 0.7704619320817316 and parameters: {'n_hidden': 128, 'mixture_components': 10, 'use_sparse_layer': False, 'use_batchnorm': False, 'use_dropout': True, 'dropout': 0.7371809103339984, 'mlp_size_1': 1, 'mlp_size_2': 3, 'mlp_size_3': 0, 'kernel': 'Exponential', 'loss_name': 'AlternativeNLLLoss'}. Best is trial 245 with value: 0.7744390497152815.[0m
[32m[I 2022-04-17 16:55:37,707][0m Trial 336 finished with value: 0.7704803556966283 and parameters: {'n_hidden': 256, 'mixture_components': 9, 'use_sparse_layer': True, 'use_sparse_loss': True, 'lmbd': 0.004957297077335572, 'use_batchnorm': False, 'use_dropout': True, 'dropout': 0.7597856524771109, 'mlp_size_1': 1, 'mlp_size_2': 4, 'mlp_size_3': 0, 'kernel': 'Exponential', 'loss_name': 'AlternativeNLLLoss'}. Best is trial 245 with value: 0.7744390497152815.[0m
[32m[I 2022-04-17 16:57:34,710][0m Trial 337 finished with value: 0.7704570858975884 and parameters: {'n_hidden': 256, 'mixture_components': 10, 'use_sparse_layer': True, 'use_sparse_loss': False, 'use_batchnorm': False, 'use_dropout': True, 'dropout': 0.5349121455249616, 'mlp_size_1': 1, 'mlp_size_2': 4, 'mlp_size_3': 0, 'kernel': 'Exponential', 'loss_name': 'CensoredNLLLoss'}. Best is trial 245 with value: 0.7744390497152815.[0m
[32m[I 2022-04-17 16:59:54,181][0m Trial 338 finished with value: 0.7703657694625917 and parameters: {'n_hidden': 256, 'mixture_components': 10, 'use_sparse_layer': True, 'use_sparse_loss': False, 'use_batchnorm': False, 'use_dropout': True, 'dropout': 0.8062472618647286, 'mlp_size_1': 1, 'mlp_size_2': 4, 'mlp_size_3': 0, 'kernel': 'Exponential', 'loss_name': 'AlternativeNLLLoss'}. Best is trial 245 with value: 0.7744390497152815.[0m
[32m[I 2022-04-17 17:02:02,048][0m Trial 339 finished with value: 0.7632457380243253 and parameters: {'n_hidden': 256, 'mixture_components': 9, 'use_sparse_layer': True, 'use_sparse_loss': False, 'use_batchnorm': False, 'use_dropout': False, 'mlp_size_1': 1, 'mlp_size_2': 4, 'mlp_size_3': 0, 'kernel': 'Exponential', 'loss_name': 'CensoredNLLLoss'}. Best is trial 245 with value: 0.7744390497152815.[0m
[32m[I 2022-04-17 17:04:25,370][0m Trial 340 finished with value: 0.7431723984370235 and parameters: {'n_hidden': 1024, 'mixture_components': 10, 'use_sparse_layer': False, 'use_batchnorm': False, 'use_dropout': True, 'dropout': 0.7238951787846621, 'mlp_size_1': 3, 'mlp_size_2': 4, 'mlp_size_3': 0, 'kernel': 'LogLogistic', 'loss_name': 'CensoredNLLLoss'}. Best is trial 245 with value: 0.7744390497152815.[0m
[32m[I 2022-04-17 17:06:08,069][0m Trial 341 finished with value: 0.6982387522609038 and parameters: {'n_hidden': 256, 'mixture_components': 10, 'use_sparse_layer': True, 'use_sparse_loss': False, 'use_batchnorm': False, 'use_dropout': True, 'dropout': 0.5961055432490421, 'mlp_size_1': 1, 'mlp_size_2': 4, 'mlp_size_3': 0, 'kernel': 'Exponential', 'loss_name': 'NLLLoss'}. Best is trial 245 with value: 0.7744390497152815.[0m
[32m[I 2022-04-17 17:08:29,092][0m Trial 342 finished with value: 0.7680012862531174 and parameters: {'n_hidden': 256, 'mixture_components': 9, 'use_sparse_layer': True, 'use_sparse_loss': False, 'use_batchnorm': False, 'use_dropout': True, 'dropout': 0.6252166075427831, 'mlp_size_1': 1, 'mlp_size_2': 4, 'mlp_size_3': 0, 'kernel': 'Gamma', 'loss_name': 'CensoredNLLLoss'}. Best is trial 245 with value: 0.7744390497152815.[0m
[32m[I 2022-04-17 17:10:34,641][0m Trial 343 finished with value: 0.7703621213487253 and parameters: {'n_hidden': 256, 'mixture_components': 4, 'use_sparse_layer': True, 'use_sparse_loss': True, 'lmbd': 1.0254505703698788e-06, 'use_batchnorm': False, 'use_dropout': True, 'dropout': 0.6647821547764311, 'mlp_size_1': 1, 'mlp_size_2': 4, 'mlp_size_3': 0, 'kernel': 'Exponential', 'loss_name': 'AlternativeNLLLoss'}. Best is trial 245 with value: 0.7744390497152815.[0m
[32m[I 2022-04-17 17:13:13,931][0m Trial 344 finished with value: 0.7651749311073897 and parameters: {'n_hidden': 256, 'mixture_components': 3, 'use_sparse_layer': True, 'use_sparse_loss': False, 'use_batchnorm': False, 'use_dropout': True, 'dropout': 0.7072196467948315, 'mlp_size_1': 1, 'mlp_size_2': 4, 'mlp_size_3': 0, 'kernel': 'Normal', 'loss_name': 'CensoredNLLLoss'}. Best is trial 245 with value: 0.7744390497152815.[0m
[32m[I 2022-04-17 17:15:18,843][0m Trial 345 finished with value: 0.7686472908537532 and parameters: {'n_hidden': 256, 'mixture_components': 5, 'use_sparse_layer': False, 'use_batchnorm': False, 'use_dropout': True, 'dropout': 0.7831574867495591, 'mlp_size_1': 1, 'mlp_size_2': 4, 'mlp_size_3': 0, 'kernel': 'Exponential', 'loss_name': 'CensoredNLLLoss'}. Best is trial 245 with value: 0.7744390497152815.[0m
[32m[I 2022-04-17 17:17:56,983][0m Trial 346 finished with value: 0.7650316695898224 and parameters: {'n_hidden': 64, 'mixture_components': 10, 'use_sparse_layer': True, 'use_sparse_loss': False, 'use_batchnorm': False, 'use_dropout': True, 'dropout': 0.6439134614468718, 'mlp_size_1': 1, 'mlp_size_2': 2, 'mlp_size_3': 0, 'kernel': 'Exponential', 'loss_name': 'AlternativeNLLLoss'}. Best is trial 245 with value: 0.7744390497152815.[0m
[32m[I 2022-04-17 17:19:38,663][0m Trial 347 finished with value: 0.7617698621546681 and parameters: {'n_hidden': 256, 'mixture_components': 10, 'use_sparse_layer': True, 'use_sparse_loss': False, 'use_batchnorm': False, 'use_dropout': False, 'mlp_size_1': 1, 'mlp_size_2': 4, 'mlp_size_3': 0, 'kernel': 'Exponential', 'loss_name': 'CensoredNLLLoss'}. Best is trial 245 with value: 0.7744390497152815.[0m
[32m[I 2022-04-17 17:21:37,311][0m Trial 348 finished with value: 0.7696927549748412 and parameters: {'n_hidden': 256, 'mixture_components': 9, 'use_sparse_layer': True, 'use_sparse_loss': False, 'use_batchnorm': False, 'use_dropout': True, 'dropout': 0.4964549719290505, 'mlp_size_1': 1, 'mlp_size_2': 4, 'mlp_size_3': 0, 'kernel': 'Exponential', 'loss_name': 'CensoredNLLLoss'}. Best is trial 245 with value: 0.7744390497152815.[0m
[32m[I 2022-04-17 17:23:26,197][0m Trial 349 finished with value: 0.296925181767271 and parameters: {'n_hidden': 1024, 'mixture_components': 10, 'use_sparse_layer': True, 'use_sparse_loss': False, 'use_batchnorm': False, 'use_dropout': True, 'dropout': 0.6839128503088908, 'mlp_size_1': 4, 'mlp_size_2': 3, 'mlp_size_3': 0, 'kernel': 'Gumbel', 'loss_name': 'CensoredNLLLoss'}. Best is trial 245 with value: 0.7744390497152815.[0m
[32m[I 2022-04-17 17:25:28,547][0m Trial 350 finished with value: 0.7739196386633206 and parameters: {'n_hidden': 256, 'mixture_components': 10, 'use_sparse_layer': False, 'use_batchnorm': False, 'use_dropout': True, 'dropout': 0.7300886029400993, 'mlp_size_1': 1, 'mlp_size_2': 4, 'mlp_size_3': 0, 'kernel': 'Exponential', 'loss_name': 'AlternativeNLLLoss'}. Best is trial 245 with value: 0.7744390497152815.[0m
[32m[I 2022-04-17 17:28:16,249][0m Trial 351 finished with value: 0.7710105653317747 and parameters: {'n_hidden': 256, 'mixture_components': 5, 'use_sparse_layer': False, 'use_batchnorm': True, 'use_dropout': True, 'dropout': 0.7387615694739958, 'mlp_size_1': 1, 'mlp_size_2': 4, 'mlp_size_3': 0, 'kernel': 'Exponential', 'loss_name': 'AlternativeNLLLoss'}. Best is trial 245 with value: 0.7744390497152815.[0m
[32m[I 2022-04-17 17:30:21,478][0m Trial 352 finished with value: 0.77194427653782 and parameters: {'n_hidden': 256, 'mixture_components': 10, 'use_sparse_layer': False, 'use_batchnorm': False, 'use_dropout': True, 'dropout': 0.7630424063217351, 'mlp_size_1': 1, 'mlp_size_2': 4, 'mlp_size_3': 0, 'kernel': 'Exponential', 'loss_name': 'AlternativeNLLLoss'}. Best is trial 245 with value: 0.7744390497152815.[0m
[32m[I 2022-04-17 17:34:08,545][0m Trial 353 finished with value: 0.7686931815063849 and parameters: {'n_hidden': 32, 'mixture_components': 9, 'use_sparse_layer': False, 'use_batchnorm': False, 'use_dropout': True, 'dropout': 0.7188084622040647, 'mlp_size_1': 1, 'mlp_size_2': 1, 'mlp_size_3': 0, 'kernel': 'Exponential', 'loss_name': 'AlternativeNLLLoss'}. Best is trial 245 with value: 0.7744390497152815.[0m
[32m[I 2022-04-17 17:35:59,171][0m Trial 354 finished with value: 0.7714486445437041 and parameters: {'n_hidden': 256, 'mixture_components': 10, 'use_sparse_layer': False, 'use_batchnorm': False, 'use_dropout': True, 'dropout': 0.7489731435620232, 'mlp_size_1': 2, 'mlp_size_2': 3, 'mlp_size_3': 0, 'kernel': 'Exponential', 'loss_name': 'AlternativeNLLLoss'}. Best is trial 245 with value: 0.7744390497152815.[0m
[32m[I 2022-04-17 17:37:49,185][0m Trial 355 finished with value: 0.7530993020824751 and parameters: {'n_hidden': 256, 'mixture_components': 8, 'use_sparse_layer': False, 'use_batchnorm': False, 'use_dropout': False, 'mlp_size_1': 1, 'mlp_size_2': 4, 'mlp_size_3': 0, 'kernel': 'Weibull', 'loss_name': 'AlternativeNLLLoss'}. Best is trial 245 with value: 0.7744390497152815.[0m
[32m[I 2022-04-17 17:39:45,702][0m Trial 356 finished with value: 0.7699930434666463 and parameters: {'n_hidden': 256, 'mixture_components': 5, 'use_sparse_layer': False, 'use_batchnorm': False, 'use_dropout': True, 'dropout': 0.6716813444644177, 'mlp_size_1': 1, 'mlp_size_2': 4, 'mlp_size_3': 0, 'kernel': 'Exponential', 'loss_name': 'AlternativeNLLLoss'}. Best is trial 245 with value: 0.7744390497152815.[0m
[32m[I 2022-04-17 17:41:48,429][0m Trial 357 finished with value: 0.7715786851998314 and parameters: {'n_hidden': 256, 'mixture_components': 10, 'use_sparse_layer': False, 'use_batchnorm': False, 'use_dropout': True, 'dropout': 0.7033740572630681, 'mlp_size_1': 1, 'mlp_size_2': 4, 'mlp_size_3': 0, 'kernel': 'Exponential', 'loss_name': 'AlternativeNLLLoss'}. Best is trial 245 with value: 0.7744390497152815.[0m
[32m[I 2022-04-17 17:44:24,970][0m Trial 358 finished with value: 0.7543185850264109 and parameters: {'n_hidden': 256, 'mixture_components': 4, 'use_sparse_layer': False, 'use_batchnorm': False, 'use_dropout': True, 'dropout': 0.6527685135983929, 'mlp_size_1': 1, 'mlp_size_2': 4, 'mlp_size_3': 0, 'kernel': 'LogNormal', 'loss_name': 'AlternativeNLLLoss'}. Best is trial 245 with value: 0.7744390497152815.[0m
[32m[I 2022-04-17 17:46:29,326][0m Trial 359 finished with value: 0.7715580871321002 and parameters: {'n_hidden': 256, 'mixture_components': 10, 'use_sparse_layer': False, 'use_batchnorm': False, 'use_dropout': True, 'dropout': 0.7332432584130399, 'mlp_size_1': 1, 'mlp_size_2': 4, 'mlp_size_3': 0, 'kernel': 'Exponential', 'loss_name': 'AlternativeNLLLoss'}. Best is trial 245 with value: 0.7744390497152815.[0m
[32m[I 2022-04-17 17:48:36,625][0m Trial 360 finished with value: 0.7701910222923697 and parameters: {'n_hidden': 1024, 'mixture_components': 9, 'use_sparse_layer': True, 'use_sparse_loss': True, 'lmbd': 9.384512033886782e-06, 'use_batchnorm': False, 'use_dropout': True, 'dropout': 0.7734062824750815, 'mlp_size_1': 2, 'mlp_size_2': 4, 'mlp_size_3': 1, 'kernel': 'Exponential', 'loss_name': 'AlternativeNLLLoss'}. Best is trial 245 with value: 0.7744390497152815.[0m
[32m[I 2022-04-17 17:51:20,932][0m Trial 361 finished with value: 0.7684985446050053 and parameters: {'n_hidden': 64, 'mixture_components': 10, 'use_sparse_layer': True, 'use_sparse_loss': False, 'use_batchnorm': False, 'use_dropout': True, 'dropout': 0.7066990191233627, 'mlp_size_1': 1, 'mlp_size_2': 2, 'mlp_size_3': 0, 'kernel': 'Exponential', 'loss_name': 'CensoredNLLLoss'}. Best is trial 245 with value: 0.7744390497152815.[0m
[32m[I 2022-04-17 17:53:40,377][0m Trial 362 finished with value: 0.7557844579902392 and parameters: {'n_hidden': 256, 'mixture_components': 9, 'use_sparse_layer': True, 'use_sparse_loss': False, 'use_batchnorm': False, 'use_dropout': True, 'dropout': 0.6842144423302084, 'mlp_size_1': 1, 'mlp_size_2': 4, 'mlp_size_3': 0, 'kernel': 'Logistic', 'loss_name': 'CensoredNLLLoss'}. Best is trial 245 with value: 0.7744390497152815.[0m
[32m[I 2022-04-17 17:56:47,661][0m Trial 363 finished with value: 0.7711391471035377 and parameters: {'n_hidden': 2048, 'mixture_components': 10, 'use_sparse_layer': False, 'use_batchnorm': False, 'use_dropout': True, 'dropout': 0.737015020198752, 'mlp_size_1': 0, 'mlp_size_2': 5, 'mlp_size_3': 2, 'kernel': 'Exponential', 'loss_name': 'AlternativeNLLLoss'}. Best is trial 245 with value: 0.7744390497152815.[0m
[32m[I 2022-04-17 17:58:31,574][0m Trial 364 finished with value: 0.6988867772458608 and parameters: {'n_hidden': 128, 'mixture_components': 5, 'use_sparse_layer': True, 'use_sparse_loss': True, 'lmbd': 4.466448356797485e-05, 'use_batchnorm': False, 'use_dropout': False, 'mlp_size_1': 1, 'mlp_size_2': 3, 'mlp_size_3': 0, 'kernel': 'Exponential', 'loss_name': 'NLLLoss'}. Best is trial 245 with value: 0.7744390497152815.[0m
[32m[I 2022-04-17 18:00:34,760][0m Trial 365 finished with value: 0.7620675421738399 and parameters: {'n_hidden': 256, 'mixture_components': 10, 'use_sparse_layer': True, 'use_sparse_loss': False, 'use_batchnorm': False, 'use_dropout': True, 'dropout': 0.719130441101761, 'mlp_size_1': 1, 'mlp_size_2': 4, 'mlp_size_3': 0, 'kernel': 'Exponential', 'loss_name': 'CensoredNLLLoss'}. Best is trial 245 with value: 0.7744390497152815.[0m
[32m[I 2022-04-17 18:02:33,744][0m Trial 366 finished with value: 0.7704257146615747 and parameters: {'n_hidden': 256, 'mixture_components': 5, 'use_sparse_layer': True, 'use_sparse_loss': False, 'use_batchnorm': False, 'use_dropout': True, 'dropout': 0.6266926884890294, 'mlp_size_1': 1, 'mlp_size_2': 4, 'mlp_size_3': 0, 'kernel': 'Exponential', 'loss_name': 'CensoredNLLLoss'}. Best is trial 245 with value: 0.7744390497152815.[0m
[32m[I 2022-04-17 18:04:54,413][0m Trial 367 finished with value: 0.7683768358942445 and parameters: {'n_hidden': 256, 'mixture_components': 9, 'use_sparse_layer': True, 'use_sparse_loss': False, 'use_batchnorm': False, 'use_dropout': True, 'dropout': 0.7588965234070945, 'mlp_size_1': 1, 'mlp_size_2': 4, 'mlp_size_3': 0, 'kernel': 'Exponential', 'loss_name': 'AlternativeNLLLoss'}. Best is trial 245 with value: 0.7744390497152815.[0m
[32m[I 2022-04-17 18:06:50,636][0m Trial 368 finished with value: 0.7698327271257657 and parameters: {'n_hidden': 256, 'mixture_components': 10, 'use_sparse_layer': False, 'use_batchnorm': False, 'use_dropout': True, 'dropout': 0.6764741155045982, 'mlp_size_1': 1, 'mlp_size_2': 4, 'mlp_size_3': 0, 'kernel': 'Exponential', 'loss_name': 'CensoredNLLLoss'}. Best is trial 245 with value: 0.7744390497152815.[0m
[32m[I 2022-04-17 18:10:00,234][0m Trial 369 finished with value: 0.7515089610672362 and parameters: {'n_hidden': 256, 'mixture_components': 9, 'use_sparse_layer': True, 'use_sparse_loss': False, 'use_batchnorm': False, 'use_dropout': True, 'dropout': 0.818452513852889, 'mlp_size_1': 1, 'mlp_size_2': 4, 'mlp_size_3': 0, 'kernel': 'Normal', 'loss_name': 'CensoredNLLLoss'}. Best is trial 245 with value: 0.7744390497152815.[0m
[32m[I 2022-04-17 18:11:54,639][0m Trial 370 finished with value: 0.7405971052416414 and parameters: {'n_hidden': 1024, 'mixture_components': 10, 'use_sparse_layer': True, 'use_sparse_loss': False, 'use_batchnorm': False, 'use_dropout': True, 'dropout': 0.6980604119630295, 'mlp_size_1': 6, 'mlp_size_2': 1, 'mlp_size_3': 0, 'kernel': 'Exponential', 'loss_name': 'AlternativeNLLLoss'}. Best is trial 245 with value: 0.7744390497152815.[0m
[32m[I 2022-04-17 18:14:48,544][0m Trial 371 finished with value: 0.7586566205894424 and parameters: {'n_hidden': 512, 'mixture_components': 10, 'use_sparse_layer': True, 'use_sparse_loss': False, 'use_batchnorm': True, 'use_dropout': True, 'dropout': 0.6485571217557937, 'mlp_size_1': 1, 'mlp_size_2': 4, 'mlp_size_3': 0, 'kernel': 'Exponential', 'loss_name': 'CensoredNLLLoss'}. Best is trial 245 with value: 0.7744390497152815.[0m
[32m[I 2022-04-17 18:16:36,460][0m Trial 372 finished with value: 0.770549291187046 and parameters: {'n_hidden': 256, 'mixture_components': 10, 'use_sparse_layer': True, 'use_sparse_loss': True, 'lmbd': 5.3526692314744065e-06, 'use_batchnorm': False, 'use_dropout': False, 'mlp_size_1': 1, 'mlp_size_2': 4, 'mlp_size_3': 0, 'kernel': 'Exponential', 'loss_name': 'CensoredNLLLoss'}. Best is trial 245 with value: 0.7744390497152815.[0m
[32m[I 2022-04-17 18:18:55,005][0m Trial 373 finished with value: 0.7708130262809219 and parameters: {'n_hidden': 256, 'mixture_components': 8, 'use_sparse_layer': False, 'use_batchnorm': False, 'use_dropout': True, 'dropout': 0.7276702432422925, 'mlp_size_1': 1, 'mlp_size_2': 4, 'mlp_size_3': 0, 'kernel': 'Gamma', 'loss_name': 'AlternativeNLLLoss'}. Best is trial 245 with value: 0.7744390497152815.[0m
[32m[I 2022-04-17 18:21:10,328][0m Trial 374 finished with value: 0.7716746557216998 and parameters: {'n_hidden': 256, 'mixture_components': 9, 'use_sparse_layer': True, 'use_sparse_loss': False, 'use_batchnorm': False, 'use_dropout': True, 'dropout': 0.8016480665333745, 'mlp_size_1': 1, 'mlp_size_2': 4, 'mlp_size_3': 0, 'kernel': 'Exponential', 'loss_name': 'CensoredNLLLoss'}. Best is trial 245 with value: 0.7744390497152815.[0m
[32m[I 2022-04-17 18:23:12,198][0m Trial 375 finished with value: 0.7678288745577794 and parameters: {'n_hidden': 256, 'mixture_components': 5, 'use_sparse_layer': True, 'use_sparse_loss': False, 'use_batchnorm': False, 'use_dropout': True, 'dropout': 0.6634901170101851, 'mlp_size_1': 1, 'mlp_size_2': 4, 'mlp_size_3': 0, 'kernel': 'Exponential', 'loss_name': 'CensoredNLLLoss'}. Best is trial 245 with value: 0.7744390497152815.[0m
