[32m[I 2022-04-16 10:34:36,498][0m Trial 549 finished with value: 0.5558867818537683 and parameters: {'n_hidden': 1024, 'mixture_components': 9, 'use_sparse_layer': True, 'use_sparse_loss': False, 'use_batchnorm': False, 'use_dropout': True, 'dropout': 0.5842576278746996, 'mlp_size_1': 1, 'mlp_size_2': 3, 'mlp_size_3': 2, 'kernel': 'Gumbel', 'loss_name': 'CensoredNLLLoss'}. Best is trial 474 with value: 0.887294062722078.[0m
[32m[I 2022-04-16 10:36:40,193][0m Trial 550 finished with value: -0.35049298368117787 and parameters: {'n_hidden': 1024, 'mixture_components': 10, 'use_sparse_layer': True, 'use_sparse_loss': False, 'use_batchnorm': False, 'use_dropout': True, 'dropout': 0.9286560777428253, 'mlp_size_1': 2, 'mlp_size_2': 4, 'mlp_size_3': 1, 'kernel': 'Weibull', 'loss_name': 'CensoredNLLLoss'}. Best is trial 474 with value: 0.887294062722078.[0m
[32m[I 2022-04-16 10:39:05,216][0m Trial 551 finished with value: 0.8853128266072113 and parameters: {'n_hidden': 512, 'mixture_components': 10, 'use_sparse_layer': True, 'use_sparse_loss': False, 'use_batchnorm': False, 'use_dropout': True, 'dropout': 0.5596781629596383, 'mlp_size_1': 2, 'mlp_size_2': 4, 'mlp_size_3': 0, 'kernel': 'Weibull', 'loss_name': 'CensoredNLLLoss'}. Best is trial 474 with value: 0.887294062722078.[0m
[32m[I 2022-04-16 10:41:35,904][0m Trial 552 finished with value: 0.882877575776687 and parameters: {'n_hidden': 1024, 'mixture_components': 10, 'use_sparse_layer': True, 'use_sparse_loss': True, 'lmbd': 0.00011570047343408181, 'use_batchnorm': False, 'use_dropout': True, 'dropout': 0.4518376981743283, 'mlp_size_1': 1, 'mlp_size_2': 3, 'mlp_size_3': 1, 'kernel': 'Weibull', 'loss_name': 'AlternativeNLLLoss'}. Best is trial 474 with value: 0.887294062722078.[0m
[32m[I 2022-04-16 10:44:01,336][0m Trial 553 finished with value: 0.8777063424691252 and parameters: {'n_hidden': 64, 'mixture_components': 9, 'use_sparse_layer': True, 'use_sparse_loss': False, 'use_batchnorm': False, 'use_dropout': True, 'dropout': 0.14067998625462314, 'mlp_size_1': 2, 'mlp_size_2': 1, 'mlp_size_3': 0, 'kernel': 'Weibull', 'loss_name': 'CensoredNLLLoss'}. Best is trial 474 with value: 0.887294062722078.[0m
[32m[I 2022-04-16 10:46:22,517][0m Trial 554 finished with value: 0.8834768354362303 and parameters: {'n_hidden': 256, 'mixture_components': 9, 'use_sparse_layer': True, 'use_sparse_loss': False, 'use_batchnorm': False, 'use_dropout': True, 'dropout': 0.4210409082320997, 'mlp_size_1': 2, 'mlp_size_2': 3, 'mlp_size_3': 0, 'kernel': 'Weibull', 'loss_name': 'CensoredNLLLoss'}. Best is trial 474 with value: 0.887294062722078.[0m
[32m[I 2022-04-16 10:49:08,797][0m Trial 555 finished with value: 0.8847009651473302 and parameters: {'n_hidden': 1024, 'mixture_components': 10, 'use_sparse_layer': True, 'use_sparse_loss': False, 'use_batchnorm': False, 'use_dropout': True, 'dropout': 0.3995921467243423, 'mlp_size_1': 1, 'mlp_size_2': 4, 'mlp_size_3': 1, 'kernel': 'Normal', 'loss_name': 'CensoredNLLLoss'}. Best is trial 474 with value: 0.887294062722078.[0m
[32m[I 2022-04-16 10:52:02,587][0m Trial 556 finished with value: 0.8826113158250248 and parameters: {'n_hidden': 2048, 'mixture_components': 10, 'use_sparse_layer': True, 'use_sparse_loss': False, 'use_batchnorm': False, 'use_dropout': True, 'dropout': 0.3276771111957704, 'mlp_size_1': 3, 'mlp_size_2': 4, 'mlp_size_3': 1, 'kernel': 'Weibull', 'loss_name': 'CensoredNLLLoss'}. Best is trial 474 with value: 0.887294062722078.[0m
[32m[I 2022-04-16 10:54:40,908][0m Trial 557 finished with value: 0.8830785892100218 and parameters: {'n_hidden': 1024, 'mixture_components': 9, 'use_sparse_layer': True, 'use_sparse_loss': False, 'use_batchnorm': False, 'use_dropout': True, 'dropout': 0.5233526651273839, 'mlp_size_1': 1, 'mlp_size_2': 3, 'mlp_size_3': 1, 'kernel': 'Weibull', 'loss_name': 'CensoredNLLLoss'}. Best is trial 474 with value: 0.887294062722078.[0m
[32m[I 2022-04-16 10:57:09,193][0m Trial 558 finished with value: 0.758633191199325 and parameters: {'n_hidden': 1024, 'mixture_components': 10, 'use_sparse_layer': True, 'use_sparse_loss': False, 'use_batchnorm': False, 'use_dropout': True, 'dropout': 0.5698659110873877, 'mlp_size_1': 2, 'mlp_size_2': 4, 'mlp_size_3': 1, 'kernel': 'Weibull', 'loss_name': 'NLLLoss'}. Best is trial 474 with value: 0.887294062722078.[0m
[32m[I 2022-04-16 10:59:42,169][0m Trial 559 finished with value: 0.8840397598594905 and parameters: {'n_hidden': 1024, 'mixture_components': 8, 'use_sparse_layer': True, 'use_sparse_loss': False, 'use_batchnorm': False, 'use_dropout': True, 'dropout': 0.48619624162999364, 'mlp_size_1': 2, 'mlp_size_2': 4, 'mlp_size_3': 1, 'kernel': 'Weibull', 'loss_name': 'CensoredNLLLoss'}. Best is trial 474 with value: 0.887294062722078.[0m
[32m[I 2022-04-16 11:01:56,675][0m Trial 560 finished with value: 0.7802749946213863 and parameters: {'n_hidden': 256, 'mixture_components': 10, 'use_sparse_layer': True, 'use_sparse_loss': True, 'lmbd': 2.5101611655833867e-05, 'use_batchnorm': False, 'use_dropout': True, 'dropout': 0.5495361068588249, 'mlp_size_1': 2, 'mlp_size_2': 3, 'mlp_size_3': 0, 'kernel': 'Logistic', 'loss_name': 'CensoredNLLLoss'}. Best is trial 474 with value: 0.887294062722078.[0m
[32m[I 2022-04-16 11:05:01,944][0m Trial 561 finished with value: 0.780877619707857 and parameters: {'n_hidden': 1024, 'mixture_components': 9, 'use_sparse_layer': True, 'use_sparse_loss': False, 'use_batchnorm': False, 'use_dropout': True, 'dropout': 0.5942701261533329, 'mlp_size_1': 1, 'mlp_size_2': 3, 'mlp_size_3': 1, 'kernel': 'LogNormal', 'loss_name': 'CensoredNLLLoss'}. Best is trial 474 with value: 0.887294062722078.[0m
[32m[I 2022-04-16 11:07:55,835][0m Trial 562 finished with value: 0.8853689558361794 and parameters: {'n_hidden': 1024, 'mixture_components': 10, 'use_sparse_layer': True, 'use_sparse_loss': False, 'use_batchnorm': False, 'use_dropout': True, 'dropout': 0.6423729746097048, 'mlp_size_1': 2, 'mlp_size_2': 4, 'mlp_size_3': 1, 'kernel': 'Weibull', 'loss_name': 'CensoredNLLLoss'}. Best is trial 474 with value: 0.887294062722078.[0m
[32m[I 2022-04-16 11:10:37,272][0m Trial 563 finished with value: 0.8855736682353641 and parameters: {'n_hidden': 1024, 'mixture_components': 10, 'use_sparse_layer': True, 'use_sparse_loss': False, 'use_batchnorm': False, 'use_dropout': True, 'dropout': 0.6144993097511382, 'mlp_size_1': 2, 'mlp_size_2': 4, 'mlp_size_3': 1, 'kernel': 'Weibull', 'loss_name': 'CensoredNLLLoss'}. Best is trial 474 with value: 0.887294062722078.[0m
[32m[I 2022-04-16 11:15:02,526][0m Trial 564 finished with value: 0.7810583467722119 and parameters: {'n_hidden': 1024, 'mixture_components': 7, 'use_sparse_layer': True, 'use_sparse_loss': False, 'use_batchnorm': True, 'use_dropout': True, 'dropout': 0.5114493217557348, 'mlp_size_1': 1, 'mlp_size_2': 3, 'mlp_size_3': 2, 'kernel': 'Weibull', 'loss_name': 'CensoredNLLLoss'}. Best is trial 474 with value: 0.887294062722078.[0m
[32m[I 2022-04-16 11:17:10,874][0m Trial 565 finished with value: 0.8816740190223651 and parameters: {'n_hidden': 1024, 'mixture_components': 10, 'use_sparse_layer': True, 'use_sparse_loss': False, 'use_batchnorm': False, 'use_dropout': False, 'mlp_size_1': 2, 'mlp_size_2': 4, 'mlp_size_3': 1, 'kernel': 'LogLogistic', 'loss_name': 'AlternativeNLLLoss'}. Best is trial 474 with value: 0.887294062722078.[0m
[32m[I 2022-04-16 11:19:35,544][0m Trial 566 finished with value: 0.8843484406500423 and parameters: {'n_hidden': 256, 'mixture_components': 9, 'use_sparse_layer': True, 'use_sparse_loss': False, 'use_batchnorm': False, 'use_dropout': True, 'dropout': 0.5763143431541301, 'mlp_size_1': 2, 'mlp_size_2': 3, 'mlp_size_3': 0, 'kernel': 'Weibull', 'loss_name': 'CensoredNLLLoss'}. Best is trial 474 with value: 0.887294062722078.[0m
[32m[I 2022-04-16 11:23:41,726][0m Trial 567 finished with value: 0.6792535767881284 and parameters: {'n_hidden': 32, 'mixture_components': 10, 'use_sparse_layer': True, 'use_sparse_loss': False, 'use_batchnorm': False, 'use_dropout': True, 'dropout': 0.539333261267601, 'mlp_size_1': 2, 'mlp_size_2': 0, 'mlp_size_3': 0, 'kernel': 'Weibull', 'loss_name': 'CensoredNLLLoss'}. Best is trial 474 with value: 0.887294062722078.[0m
[32m[I 2022-04-16 11:26:14,794][0m Trial 568 finished with value: 0.8841918680625442 and parameters: {'n_hidden': 1024, 'mixture_components': 10, 'use_sparse_layer': True, 'use_sparse_loss': True, 'lmbd': 0.0001634679004762978, 'use_batchnorm': False, 'use_dropout': True, 'dropout': 0.4760038431348255, 'mlp_size_1': 1, 'mlp_size_2': 3, 'mlp_size_3': 1, 'kernel': 'Weibull', 'loss_name': 'CensoredNLLLoss'}. Best is trial 474 with value: 0.887294062722078.[0m
[32m[I 2022-04-16 11:28:45,894][0m Trial 569 finished with value: 0.8846837590025711 and parameters: {'n_hidden': 1024, 'mixture_components': 9, 'use_sparse_layer': True, 'use_sparse_loss': False, 'use_batchnorm': False, 'use_dropout': True, 'dropout': 0.3535047276254169, 'mlp_size_1': 2, 'mlp_size_2': 4, 'mlp_size_3': 1, 'kernel': 'Weibull', 'loss_name': 'CensoredNLLLoss'}. Best is trial 474 with value: 0.887294062722078.[0m
[32m[I 2022-04-16 11:31:20,757][0m Trial 570 finished with value: 0.8854999028945573 and parameters: {'n_hidden': 1024, 'mixture_components': 10, 'use_sparse_layer': True, 'use_sparse_loss': False, 'use_batchnorm': False, 'use_dropout': True, 'dropout': 0.5022372695078103, 'mlp_size_1': 2, 'mlp_size_2': 4, 'mlp_size_3': 1, 'kernel': 'Weibull', 'loss_name': 'CensoredNLLLoss'}. Best is trial 474 with value: 0.887294062722078.[0m
[32m[I 2022-04-16 11:33:59,712][0m Trial 571 finished with value: 0.8840120313534428 and parameters: {'n_hidden': 1024, 'mixture_components': 9, 'use_sparse_layer': True, 'use_sparse_loss': False, 'use_batchnorm': False, 'use_dropout': True, 'dropout': 0.3803128847088096, 'mlp_size_1': 1, 'mlp_size_2': 3, 'mlp_size_3': 1, 'kernel': 'Weibull', 'loss_name': 'CensoredNLLLoss'}. Best is trial 474 with value: 0.887294062722078.[0m
[32m[I 2022-04-16 11:35:57,444][0m Trial 572 finished with value: 0.6832220588214867 and parameters: {'n_hidden': 256, 'mixture_components': 10, 'use_sparse_layer': True, 'use_sparse_loss': False, 'use_batchnorm': False, 'use_dropout': True, 'dropout': 0.5914733952597186, 'mlp_size_1': 2, 'mlp_size_2': 3, 'mlp_size_3': 0, 'kernel': 'Exponential', 'loss_name': 'CensoredNLLLoss'}. Best is trial 474 with value: 0.887294062722078.[0m
[32m[I 2022-04-16 11:38:24,487][0m Trial 573 finished with value: 0.8848197562983444 and parameters: {'n_hidden': 1024, 'mixture_components': 9, 'use_sparse_layer': True, 'use_sparse_loss': False, 'use_batchnorm': False, 'use_dropout': True, 'dropout': 0.5556007904124272, 'mlp_size_1': 3, 'mlp_size_2': 4, 'mlp_size_3': 0, 'kernel': 'Weibull', 'loss_name': 'CensoredNLLLoss'}. Best is trial 474 with value: 0.887294062722078.[0m
[32m[I 2022-04-16 11:40:56,926][0m Trial 574 finished with value: 0.8863855473292016 and parameters: {'n_hidden': 1024, 'mixture_components': 10, 'use_sparse_layer': True, 'use_sparse_loss': False, 'use_batchnorm': False, 'use_dropout': True, 'dropout': 0.45463669374377846, 'mlp_size_1': 2, 'mlp_size_2': 4, 'mlp_size_3': 1, 'kernel': 'Weibull', 'loss_name': 'CensoredNLLLoss'}. Best is trial 474 with value: 0.887294062722078.[0m
[32m[I 2022-04-16 11:43:32,710][0m Trial 575 finished with value: 0.8866893513100355 and parameters: {'n_hidden': 1024, 'mixture_components': 8, 'use_sparse_layer': True, 'use_sparse_loss': False, 'use_batchnorm': False, 'use_dropout': True, 'dropout': 0.45308889712163786, 'mlp_size_1': 2, 'mlp_size_2': 4, 'mlp_size_3': 1, 'kernel': 'Weibull', 'loss_name': 'CensoredNLLLoss'}. Best is trial 474 with value: 0.887294062722078.[0m
[32m[I 2022-04-16 11:46:05,338][0m Trial 576 finished with value: 0.783999965547295 and parameters: {'n_hidden': 1024, 'mixture_components': 8, 'use_sparse_layer': True, 'use_sparse_loss': False, 'use_batchnorm': False, 'use_dropout': True, 'dropout': 0.44222604743301636, 'mlp_size_1': 2, 'mlp_size_2': 4, 'mlp_size_3': 1, 'kernel': 'Weibull', 'loss_name': 'CensoredNLLLoss'}. Best is trial 474 with value: 0.887294062722078.[0m
[32m[I 2022-04-16 11:48:33,072][0m Trial 577 finished with value: 0.8848592764823895 and parameters: {'n_hidden': 1024, 'mixture_components': 7, 'use_sparse_layer': True, 'use_sparse_loss': False, 'use_batchnorm': False, 'use_dropout': True, 'dropout': 0.4487607348987849, 'mlp_size_1': 2, 'mlp_size_2': 4, 'mlp_size_3': 1, 'kernel': 'Weibull', 'loss_name': 'CensoredNLLLoss'}. Best is trial 474 with value: 0.887294062722078.[0m
[32m[I 2022-04-16 11:50:44,720][0m Trial 578 finished with value: 0.880148621942579 and parameters: {'n_hidden': 128, 'mixture_components': 8, 'use_sparse_layer': True, 'use_sparse_loss': True, 'lmbd': 1.548974229145108e-06, 'use_batchnorm': False, 'use_dropout': True, 'dropout': 0.46182144356201993, 'mlp_size_1': 2, 'mlp_size_2': 2, 'mlp_size_3': 0, 'kernel': 'Gamma', 'loss_name': 'AlternativeNLLLoss'}. Best is trial 474 with value: 0.887294062722078.[0m
[32m[I 2022-04-16 11:52:55,207][0m Trial 579 finished with value: 0.8840806852798069 and parameters: {'n_hidden': 256, 'mixture_components': 8, 'use_sparse_layer': True, 'use_sparse_loss': False, 'use_batchnorm': False, 'use_dropout': True, 'dropout': 0.4207713654518018, 'mlp_size_1': 2, 'mlp_size_2': 3, 'mlp_size_3': 0, 'kernel': 'Logistic', 'loss_name': 'CensoredNLLLoss'}. Best is trial 474 with value: 0.887294062722078.[0m
[32m[I 2022-04-16 11:55:32,152][0m Trial 580 finished with value: 0.8838894947391231 and parameters: {'n_hidden': 1024, 'mixture_components': 8, 'use_sparse_layer': True, 'use_sparse_loss': False, 'use_batchnorm': False, 'use_dropout': True, 'dropout': 0.4398547725261654, 'mlp_size_1': 2, 'mlp_size_2': 4, 'mlp_size_3': 1, 'kernel': 'Weibull', 'loss_name': 'CensoredNLLLoss'}. Best is trial 474 with value: 0.887294062722078.[0m
[32m[I 2022-04-16 11:58:02,729][0m Trial 581 finished with value: 0.8849107511317467 and parameters: {'n_hidden': 1024, 'mixture_components': 2, 'use_sparse_layer': True, 'use_sparse_loss': False, 'use_batchnorm': False, 'use_dropout': True, 'dropout': 0.4637777173550859, 'mlp_size_1': 2, 'mlp_size_2': 4, 'mlp_size_3': 1, 'kernel': 'Weibull', 'loss_name': 'CensoredNLLLoss'}. Best is trial 474 with value: 0.887294062722078.[0m
[32m[I 2022-04-16 12:00:19,547][0m Trial 582 finished with value: 0.8479640410059494 and parameters: {'n_hidden': 64, 'mixture_components': 6, 'use_sparse_layer': True, 'use_sparse_loss': False, 'use_batchnorm': False, 'use_dropout': True, 'dropout': 0.4095189753091731, 'mlp_size_1': 2, 'mlp_size_2': 1, 'mlp_size_3': 0, 'kernel': 'Weibull', 'loss_name': 'NLLLoss'}. Best is trial 474 with value: 0.887294062722078.[0m
[32m[I 2022-04-16 12:02:10,833][0m Trial 583 finished with value: 0.8566460811050632 and parameters: {'n_hidden': 512, 'mixture_components': 5, 'use_sparse_layer': True, 'use_sparse_loss': False, 'use_batchnorm': False, 'use_dropout': True, 'dropout': 0.4352638326567423, 'mlp_size_1': 2, 'mlp_size_2': 4, 'mlp_size_3': 0, 'kernel': 'Gumbel', 'loss_name': 'CensoredNLLLoss'}. Best is trial 474 with value: 0.887294062722078.[0m
[32m[I 2022-04-16 12:05:47,583][0m Trial 584 finished with value: 0.8836172273100024 and parameters: {'n_hidden': 1024, 'mixture_components': 7, 'use_sparse_layer': True, 'use_sparse_loss': False, 'use_batchnorm': True, 'use_dropout': True, 'dropout': 0.47925226014979494, 'mlp_size_1': 2, 'mlp_size_2': 4, 'mlp_size_3': 1, 'kernel': 'Weibull', 'loss_name': 'CensoredNLLLoss'}. Best is trial 474 with value: 0.887294062722078.[0m
[32m[I 2022-04-16 12:09:21,929][0m Trial 585 finished with value: 0.8786115913035776 and parameters: {'n_hidden': 2048, 'mixture_components': 8, 'use_sparse_layer': True, 'use_sparse_loss': False, 'use_batchnorm': False, 'use_dropout': True, 'dropout': 0.4281500559892799, 'mlp_size_1': 0, 'mlp_size_2': 5, 'mlp_size_3': 3, 'kernel': 'Weibull', 'loss_name': 'CensoredNLLLoss'}. Best is trial 474 with value: 0.887294062722078.[0m
[32m[I 2022-04-16 12:11:45,583][0m Trial 586 finished with value: 0.8822368343911418 and parameters: {'n_hidden': 1024, 'mixture_components': 7, 'use_sparse_layer': True, 'use_sparse_loss': True, 'lmbd': 0.0006200787317664717, 'use_batchnorm': False, 'use_dropout': False, 'mlp_size_1': 2, 'mlp_size_2': 4, 'mlp_size_3': 1, 'kernel': 'Weibull', 'loss_name': 'CensoredNLLLoss'}. Best is trial 474 with value: 0.887294062722078.[0m
[32m[I 2022-04-16 12:14:14,359][0m Trial 587 finished with value: 0.8785170683952217 and parameters: {'n_hidden': 1024, 'mixture_components': 9, 'use_sparse_layer': True, 'use_sparse_loss': False, 'use_batchnorm': False, 'use_dropout': True, 'dropout': 0.46336782063962917, 'mlp_size_1': 2, 'mlp_size_2': 4, 'mlp_size_3': 1, 'kernel': 'Weibull', 'loss_name': 'CensoredNLLLoss'}. Best is trial 474 with value: 0.887294062722078.[0m
[32m[I 2022-04-16 12:16:58,675][0m Trial 588 finished with value: 0.7836287503431982 and parameters: {'n_hidden': 256, 'mixture_components': 9, 'use_sparse_layer': True, 'use_sparse_loss': False, 'use_batchnorm': False, 'use_dropout': True, 'dropout': 0.4939759867960516, 'mlp_size_1': 2, 'mlp_size_2': 3, 'mlp_size_3': 0, 'kernel': 'Normal', 'loss_name': 'CensoredNLLLoss'}. Best is trial 474 with value: 0.887294062722078.[0m
[32m[I 2022-04-16 12:19:33,281][0m Trial 589 finished with value: 0.8827118362353223 and parameters: {'n_hidden': 1024, 'mixture_components': 9, 'use_sparse_layer': True, 'use_sparse_loss': False, 'use_batchnorm': False, 'use_dropout': True, 'dropout': 0.45592638211263975, 'mlp_size_1': 2, 'mlp_size_2': 4, 'mlp_size_3': 1, 'kernel': 'Weibull', 'loss_name': 'CensoredNLLLoss'}. Best is trial 474 with value: 0.887294062722078.[0m
[32m[I 2022-04-16 12:22:06,949][0m Trial 590 finished with value: 0.8830045685047233 and parameters: {'n_hidden': 1024, 'mixture_components': 8, 'use_sparse_layer': True, 'use_sparse_loss': False, 'use_batchnorm': False, 'use_dropout': True, 'dropout': 0.39224690228936876, 'mlp_size_1': 2, 'mlp_size_2': 4, 'mlp_size_3': 1, 'kernel': 'Weibull', 'loss_name': 'CensoredNLLLoss'}. Best is trial 474 with value: 0.887294062722078.[0m
[32m[I 2022-04-16 12:25:16,176][0m Trial 591 finished with value: 0.6819319941530344 and parameters: {'n_hidden': 1024, 'mixture_components': 9, 'use_sparse_layer': True, 'use_sparse_loss': False, 'use_batchnorm': False, 'use_dropout': True, 'dropout': 0.48421362332767615, 'mlp_size_1': 2, 'mlp_size_2': 4, 'mlp_size_3': 1, 'kernel': 'LogNormal', 'loss_name': 'AlternativeNLLLoss'}. Best is trial 474 with value: 0.887294062722078.[0m
[32m[I 2022-04-16 12:27:51,985][0m Trial 592 finished with value: 0.8846113699649327 and parameters: {'n_hidden': 1024, 'mixture_components': 9, 'use_sparse_layer': True, 'use_sparse_loss': False, 'use_batchnorm': False, 'use_dropout': True, 'dropout': 0.5162675319539721, 'mlp_size_1': 2, 'mlp_size_2': 4, 'mlp_size_3': 1, 'kernel': 'Weibull', 'loss_name': 'CensoredNLLLoss'}. Best is trial 474 with value: 0.887294062722078.[0m
[32m[I 2022-04-16 12:30:08,179][0m Trial 593 finished with value: 0.8831473307938269 and parameters: {'n_hidden': 256, 'mixture_components': 9, 'use_sparse_layer': True, 'use_sparse_loss': False, 'use_batchnorm': False, 'use_dropout': True, 'dropout': 0.29574299201744864, 'mlp_size_1': 2, 'mlp_size_2': 3, 'mlp_size_3': 0, 'kernel': 'Weibull', 'loss_name': 'CensoredNLLLoss'}. Best is trial 474 with value: 0.887294062722078.[0m
[32m[I 2022-04-16 12:32:44,441][0m Trial 594 finished with value: 0.8860779230161867 and parameters: {'n_hidden': 1024, 'mixture_components': 9, 'use_sparse_layer': True, 'use_sparse_loss': True, 'lmbd': 1.509629019305497e-05, 'use_batchnorm': False, 'use_dropout': True, 'dropout': 0.47755177823630557, 'mlp_size_1': 2, 'mlp_size_2': 4, 'mlp_size_3': 1, 'kernel': 'Weibull', 'loss_name': 'CensoredNLLLoss'}. Best is trial 474 with value: 0.887294062722078.[0m
[32m[I 2022-04-16 12:35:09,653][0m Trial 595 finished with value: 0.883638104743253 and parameters: {'n_hidden': 1024, 'mixture_components': 8, 'use_sparse_layer': True, 'use_sparse_loss': False, 'use_batchnorm': False, 'use_dropout': True, 'dropout': 0.4155911848165536, 'mlp_size_1': 2, 'mlp_size_2': 4, 'mlp_size_3': 1, 'kernel': 'Logistic', 'loss_name': 'CensoredNLLLoss'}. Best is trial 474 with value: 0.887294062722078.[0m
[32m[I 2022-04-16 12:37:41,791][0m Trial 596 finished with value: 0.8844279628672453 and parameters: {'n_hidden': 1024, 'mixture_components': 10, 'use_sparse_layer': True, 'use_sparse_loss': False, 'use_batchnorm': False, 'use_dropout': True, 'dropout': 0.43511040114485283, 'mlp_size_1': 2, 'mlp_size_2': 4, 'mlp_size_3': 1, 'kernel': 'Weibull', 'loss_name': 'CensoredNLLLoss'}. Best is trial 474 with value: 0.887294062722078.[0m
[32m[I 2022-04-16 12:40:18,452][0m Trial 597 finished with value: 0.47109730674896255 and parameters: {'n_hidden': 32, 'mixture_components': 10, 'use_sparse_layer': True, 'use_sparse_loss': False, 'use_batchnorm': False, 'use_dropout': True, 'dropout': 0.4600757393643293, 'mlp_size_1': 2, 'mlp_size_2': 0, 'mlp_size_3': 0, 'kernel': 'LogLogistic', 'loss_name': 'CensoredNLLLoss'}. Best is trial 474 with value: 0.887294062722078.[0m
[32m[I 2022-04-16 12:42:32,045][0m Trial 598 finished with value: 0.7862072599901162 and parameters: {'n_hidden': 1024, 'mixture_components': 9, 'use_sparse_layer': True, 'use_sparse_loss': False, 'use_batchnorm': False, 'use_dropout': True, 'dropout': 0.4992245358358956, 'mlp_size_1': 2, 'mlp_size_2': 4, 'mlp_size_3': 1, 'kernel': 'Exponential', 'loss_name': 'CensoredNLLLoss'}. Best is trial 474 with value: 0.887294062722078.[0m
