[32m[I 2022-04-13 12:31:57,189][0m Trial 853 finished with value: 0.7724991008749429 and parameters: {'alpha': 1.6977687081699653, 'ties': 'breslow'}. Best is trial 676 with value: 0.7727038262700389.[0m
[32m[I 2022-04-13 12:32:00,695][0m Trial 854 finished with value: 0.772560493248305 and parameters: {'alpha': 1.0530365041673506, 'ties': 'breslow'}. Best is trial 676 with value: 0.7727038262700389.[0m
[32m[I 2022-04-13 12:32:02,908][0m Trial 855 finished with value: 0.7723592802342034 and parameters: {'alpha': 0.7259744345206138, 'ties': 'breslow'}. Best is trial 676 with value: 0.7727038262700389.[0m
[32m[I 2022-04-13 12:32:07,700][0m Trial 856 finished with value: 0.7726546631540303 and parameters: {'alpha': 0.9183957685534265, 'ties': 'breslow'}. Best is trial 676 with value: 0.7727038262700389.[0m
[32m[I 2022-04-13 12:32:12,152][0m Trial 857 finished with value: 0.7725201952948695 and parameters: {'alpha': 1.3351263992424405, 'ties': 'breslow'}. Best is trial 676 with value: 0.7727038262700389.[0m
[32m[I 2022-04-13 12:32:15,877][0m Trial 858 finished with value: 0.7725813550207153 and parameters: {'alpha': 1.1742130267478745, 'ties': 'breslow'}. Best is trial 676 with value: 0.7727038262700389.[0m
[32m[I 2022-04-13 12:32:20,199][0m Trial 859 finished with value: 0.772482681294721 and parameters: {'alpha': 1.4233596547403857, 'ties': 'breslow'}. Best is trial 676 with value: 0.7727038262700389.[0m
[32m[I 2022-04-13 12:32:24,620][0m Trial 860 finished with value: 0.7726601672839672 and parameters: {'alpha': 1.2687618422323033, 'ties': 'breslow'}. Best is trial 676 with value: 0.7727038262700389.[0m
[32m[I 2022-04-13 12:32:29,607][0m Trial 861 finished with value: 0.7726218478553578 and parameters: {'alpha': 1.0293646254621418, 'ties': 'breslow'}. Best is trial 676 with value: 0.7727038262700389.[0m
[32m[I 2022-04-13 12:32:32,716][0m Trial 862 finished with value: 0.7725741660536368 and parameters: {'alpha': 1.1670368835791887, 'ties': 'breslow'}. Best is trial 676 with value: 0.7727038262700389.[0m
[32m[I 2022-04-13 12:32:36,381][0m Trial 863 finished with value: 0.7726049984792007 and parameters: {'alpha': 1.3088251347777562, 'ties': 'breslow'}. Best is trial 676 with value: 0.7727038262700389.[0m
[32m[I 2022-04-13 12:32:40,040][0m Trial 864 finished with value: 0.772478624373616 and parameters: {'alpha': 1.5590463957251768, 'ties': 'breslow'}. Best is trial 676 with value: 0.7727038262700389.[0m
[32m[I 2022-04-13 12:32:43,033][0m Trial 865 finished with value: 0.772597837520119 and parameters: {'alpha': 1.1236386478686415, 'ties': 'breslow'}. Best is trial 676 with value: 0.7727038262700389.[0m
[32m[I 2022-04-13 12:32:46,254][0m Trial 866 finished with value: 0.7726785455214022 and parameters: {'alpha': 1.2250479352848698, 'ties': 'breslow'}. Best is trial 676 with value: 0.7727038262700389.[0m
[32m[I 2022-04-13 12:32:49,967][0m Trial 867 finished with value: 0.7724770992484857 and parameters: {'alpha': 1.425659018921836, 'ties': 'breslow'}. Best is trial 676 with value: 0.7727038262700389.[0m
[32m[I 2022-04-13 12:32:53,323][0m Trial 868 finished with value: 0.7719785225030644 and parameters: {'alpha': 2.5472682871918066, 'ties': 'breslow'}. Best is trial 676 with value: 0.7727038262700389.[0m
[32m[I 2022-04-13 12:32:56,195][0m Trial 869 finished with value: 0.7726785455214022 and parameters: {'alpha': 1.2243871368435963, 'ties': 'breslow'}. Best is trial 676 with value: 0.7727038262700389.[0m
[32m[I 2022-04-13 12:32:59,029][0m Trial 870 finished with value: 0.7726284836196584 and parameters: {'alpha': 0.9838267968951344, 'ties': 'breslow'}. Best is trial 676 with value: 0.7727038262700389.[0m
[32m[I 2022-04-13 12:33:02,224][0m Trial 871 finished with value: 0.7725317919363037 and parameters: {'alpha': 1.3563908618684595, 'ties': 'breslow'}. Best is trial 676 with value: 0.7727038262700389.[0m
[32m[I 2022-04-13 12:33:06,165][0m Trial 872 finished with value: 0.7725746884637734 and parameters: {'alpha': 1.0910911443953875, 'ties': 'breslow'}. Best is trial 676 with value: 0.7727038262700389.[0m
[32m[I 2022-04-13 12:33:09,986][0m Trial 873 finished with value: 0.7726258796353948 and parameters: {'alpha': 1.2772071129169713, 'ties': 'breslow'}. Best is trial 676 with value: 0.7727038262700389.[0m
[32m[I 2022-04-13 12:33:15,293][0m Trial 874 finished with value: 0.7726198459797918 and parameters: {'alpha': 1.186891306039166, 'ties': 'breslow'}. Best is trial 676 with value: 0.7727038262700389.[0m
[32m[I 2022-04-13 12:33:19,183][0m Trial 875 finished with value: 0.7724663304094948 and parameters: {'alpha': 1.4906397737228396, 'ties': 'breslow'}. Best is trial 676 with value: 0.7727038262700389.[0m
[32m[I 2022-04-13 12:33:23,428][0m Trial 876 finished with value: 0.7726074296447771 and parameters: {'alpha': 1.3185100753199743, 'ties': 'breslow'}. Best is trial 676 with value: 0.7727038262700389.[0m
[32m[I 2022-04-13 12:33:28,215][0m Trial 877 finished with value: 0.7726241291227607 and parameters: {'alpha': 1.2090482995939875, 'ties': 'breslow'}. Best is trial 676 with value: 0.7727038262700389.[0m
[32m[I 2022-04-13 12:33:31,483][0m Trial 878 finished with value: 0.7725585309167715 and parameters: {'alpha': 1.051740002712349, 'ties': 'breslow'}. Best is trial 676 with value: 0.7727038262700389.[0m
[32m[I 2022-04-13 12:33:35,264][0m Trial 879 finished with value: 0.7726002793528967 and parameters: {'alpha': 0.8857360101168867, 'ties': 'breslow'}. Best is trial 676 with value: 0.7727038262700389.[0m
[32m[I 2022-04-13 12:33:38,304][0m Trial 880 finished with value: 0.7726028003579689 and parameters: {'alpha': 1.1207226772378829, 'ties': 'breslow'}. Best is trial 676 with value: 0.7727038262700389.[0m
[32m[I 2022-04-13 12:33:41,448][0m Trial 881 finished with value: 0.7725266639189192 and parameters: {'alpha': 1.326276943110657, 'ties': 'breslow'}. Best is trial 676 with value: 0.7727038262700389.[0m
[32m[I 2022-04-13 12:33:45,942][0m Trial 882 finished with value: 0.7726785455214022 and parameters: {'alpha': 1.2266562667049405, 'ties': 'breslow'}. Best is trial 676 with value: 0.7727038262700389.[0m
[32m[I 2022-04-13 12:33:50,630][0m Trial 883 finished with value: 0.7724818803551947 and parameters: {'alpha': 1.4051086913006017, 'ties': 'breslow'}. Best is trial 676 with value: 0.7727038262700389.[0m
[32m[I 2022-04-13 12:33:54,455][0m Trial 884 finished with value: 0.7726232041954298 and parameters: {'alpha': 0.9786470856272886, 'ties': 'breslow'}. Best is trial 676 with value: 0.7727038262700389.[0m
[32m[I 2022-04-13 12:33:57,757][0m Trial 885 finished with value: 0.7701629125284579 and parameters: {'alpha': 3.78259492295824, 'ties': 'breslow'}. Best is trial 676 with value: 0.7727038262700389.[0m
[32m[I 2022-04-13 12:34:01,398][0m Trial 886 finished with value: 0.7726103169482147 and parameters: {'alpha': 1.1271846269645285, 'ties': 'breslow'}. Best is trial 676 with value: 0.7727038262700389.[0m
[32m[I 2022-04-13 12:34:03,303][0m Trial 887 finished with value: 0.7710702035662624 and parameters: {'alpha': 2.999488108000179, 'ties': 'breslow'}. Best is trial 676 with value: 0.7727038262700389.[0m
[32m[I 2022-04-13 12:34:05,329][0m Trial 888 finished with value: 0.7726737677909801 and parameters: {'alpha': 1.2223971975452965, 'ties': 'breslow'}. Best is trial 676 with value: 0.7727038262700389.[0m
[32m[I 2022-04-13 12:34:08,132][0m Trial 889 finished with value: 0.7724782906046064 and parameters: {'alpha': 1.4224987367180637, 'ties': 'breslow'}. Best is trial 676 with value: 0.7727038262700389.[0m
[32m[I 2022-04-13 12:34:11,037][0m Trial 890 finished with value: 0.7726049984792007 and parameters: {'alpha': 1.3109017170576935, 'ties': 'breslow'}. Best is trial 676 with value: 0.7727038262700389.[0m
[32m[I 2022-04-13 12:34:15,862][0m Trial 891 finished with value: 0.7725755688281408 and parameters: {'alpha': 1.0991303379351887, 'ties': 'breslow'}. Best is trial 676 with value: 0.7727038262700389.[0m
[32m[I 2022-04-13 12:34:19,786][0m Trial 892 finished with value: 0.772665487422714 and parameters: {'alpha': 1.2530629966091416, 'ties': 'breslow'}. Best is trial 676 with value: 0.7727038262700389.[0m
[32m[I 2022-04-13 12:34:23,115][0m Trial 893 finished with value: 0.7724743523364415 and parameters: {'alpha': 1.5963297999501915, 'ties': 'breslow'}. Best is trial 676 with value: 0.7727038262700389.[0m
[32m[I 2022-04-13 12:34:26,814][0m Trial 894 finished with value: 0.7726167339297033 and parameters: {'alpha': 1.02271526102035, 'ties': 'breslow'}. Best is trial 676 with value: 0.7727038262700389.[0m
[32m[I 2022-04-13 12:34:30,086][0m Trial 895 finished with value: 0.7722656360187223 and parameters: {'alpha': 2.0964379871998937, 'ties': 'breslow'}. Best is trial 676 with value: 0.7727038262700389.[0m
[32m[I 2022-04-13 12:34:34,701][0m Trial 896 finished with value: 0.7726016738776098 and parameters: {'alpha': 1.1479699896464164, 'ties': 'breslow'}. Best is trial 676 with value: 0.7727038262700389.[0m
[32m[I 2022-04-13 12:34:37,809][0m Trial 897 finished with value: 0.7725488729268152 and parameters: {'alpha': 0.8329053965590998, 'ties': 'breslow'}. Best is trial 676 with value: 0.7727038262700389.[0m
[32m[I 2022-04-13 12:34:41,150][0m Trial 898 finished with value: 0.7725063452483834 and parameters: {'alpha': 1.3728577116420873, 'ties': 'breslow'}. Best is trial 676 with value: 0.7727038262700389.[0m
[32m[I 2022-04-13 12:34:45,759][0m Trial 899 finished with value: 0.7724827518482911 and parameters: {'alpha': 1.4882865657883124, 'ties': 'breslow'}. Best is trial 676 with value: 0.7727038262700389.[0m
[32m[I 2022-04-13 12:34:48,920][0m Trial 900 finished with value: 0.7726155821350116 and parameters: {'alpha': 1.2030369218179526, 'ties': 'breslow'}. Best is trial 676 with value: 0.7727038262700389.[0m
[32m[I 2022-04-13 12:34:52,154][0m Trial 901 finished with value: 0.7726406648083914 and parameters: {'alpha': 0.9818312932261128, 'ties': 'breslow'}. Best is trial 676 with value: 0.7727038262700389.[0m
[32m[I 2022-04-13 12:34:55,991][0m Trial 902 finished with value: 0.7726509369824843 and parameters: {'alpha': 1.2935247198620936, 'ties': 'breslow'}. Best is trial 676 with value: 0.7727038262700389.[0m
[32m[I 2022-04-13 12:34:59,018][0m Trial 903 finished with value: 0.7709314117519982 and parameters: {'alpha': 3.302168806378437, 'ties': 'breslow'}. Best is trial 676 with value: 0.7727038262700389.[0m
[32m[I 2022-04-13 12:35:02,074][0m Trial 904 finished with value: 0.7725751613435339 and parameters: {'alpha': 1.0955994053643174, 'ties': 'breslow'}. Best is trial 676 with value: 0.7727038262700389.[0m
[32m[I 2022-04-13 12:35:05,032][0m Trial 905 finished with value: 0.7725987249875321 and parameters: {'alpha': 1.1932539234183612, 'ties': 'breslow'}. Best is trial 676 with value: 0.7727038262700389.[0m
[32m[I 2022-04-13 12:35:07,727][0m Trial 906 finished with value: 0.7725191600605636 and parameters: {'alpha': 1.3428283036466342, 'ties': 'breslow'}. Best is trial 676 with value: 0.7727038262700389.[0m
[32m[I 2022-04-13 12:35:11,866][0m Trial 907 finished with value: 0.7724478113906942 and parameters: {'alpha': 1.437801347343094, 'ties': 'breslow'}. Best is trial 676 with value: 0.7727038262700389.[0m
[32m[I 2022-04-13 12:35:15,735][0m Trial 908 finished with value: 0.772666104118343 and parameters: {'alpha': 1.2455033408752585, 'ties': 'breslow'}. Best is trial 676 with value: 0.7727038262700389.[0m
[32m[I 2022-04-13 12:35:20,767][0m Trial 909 finished with value: 0.7725865442971805 and parameters: {'alpha': 1.0701693253321303, 'ties': 'breslow'}. Best is trial 676 with value: 0.7727038262700389.[0m
[32m[I 2022-04-13 12:35:24,842][0m Trial 910 finished with value: 0.7726528777945554 and parameters: {'alpha': 1.2977366937075474, 'ties': 'breslow'}. Best is trial 676 with value: 0.7727038262700389.[0m
[32m[I 2022-04-13 12:35:28,129][0m Trial 911 finished with value: 0.7725911215568294 and parameters: {'alpha': 1.1591677387219885, 'ties': 'breslow'}. Best is trial 676 with value: 0.7727038262700389.[0m
[32m[I 2022-04-13 12:35:31,126][0m Trial 912 finished with value: 0.7726370671112898 and parameters: {'alpha': 0.9609416860445035, 'ties': 'breslow'}. Best is trial 676 with value: 0.7727038262700389.[0m
[32m[I 2022-04-13 12:35:33,683][0m Trial 913 finished with value: 0.7724770549677525 and parameters: {'alpha': 1.4046715507786103, 'ties': 'breslow'}. Best is trial 676 with value: 0.7727038262700389.[0m
[32m[I 2022-04-13 12:35:37,347][0m Trial 914 finished with value: 0.7726198459797918 and parameters: {'alpha': 1.1875621853862364, 'ties': 'breslow'}. Best is trial 676 with value: 0.7727038262700389.[0m
[32m[I 2022-04-13 12:35:41,495][0m Trial 915 finished with value: 0.7724827530105156 and parameters: {'alpha': 1.5384436285826972, 'ties': 'breslow'}. Best is trial 676 with value: 0.7727038262700389.[0m
[32m[I 2022-04-13 12:35:46,109][0m Trial 916 finished with value: 0.7726299279342845 and parameters: {'alpha': 1.2874801304449037, 'ties': 'breslow'}. Best is trial 676 with value: 0.7727038262700389.[0m
[32m[I 2022-04-13 12:35:50,104][0m Trial 917 finished with value: 0.7726130328508638 and parameters: {'alpha': 1.0847366147459558, 'ties': 'breslow'}. Best is trial 676 with value: 0.7727038262700389.[0m
[32m[I 2022-04-13 12:35:52,999][0m Trial 918 finished with value: 0.7726252269611525 and parameters: {'alpha': 1.2012321198534448, 'ties': 'breslow'}. Best is trial 676 with value: 0.7727038262700389.[0m
[32m[I 2022-04-13 12:35:56,876][0m Trial 919 finished with value: 0.7725212907420911 and parameters: {'alpha': 1.3275051549345978, 'ties': 'breslow'}. Best is trial 676 with value: 0.7727038262700389.[0m
[32m[I 2022-04-13 12:36:00,523][0m Trial 920 finished with value: 0.7725034911310029 and parameters: {'alpha': 1.0364116230101086, 'ties': 'breslow'}. Best is trial 676 with value: 0.7727038262700389.[0m
[32m[I 2022-04-13 12:36:04,579][0m Trial 921 finished with value: 0.7726427690969416 and parameters: {'alpha': 1.144522112124605, 'ties': 'breslow'}. Best is trial 676 with value: 0.7727038262700389.[0m
[32m[I 2022-04-13 12:36:08,251][0m Trial 922 finished with value: 0.7726515203119426 and parameters: {'alpha': 0.9133151483925275, 'ties': 'breslow'}. Best is trial 676 with value: 0.7727038262700389.[0m
[32m[I 2022-04-13 12:36:11,989][0m Trial 923 finished with value: 0.772665487422714 and parameters: {'alpha': 1.2533952942292088, 'ties': 'breslow'}. Best is trial 676 with value: 0.7727038262700389.[0m
[32m[I 2022-04-13 12:36:15,195][0m Trial 924 finished with value: 0.7724814474906474 and parameters: {'alpha': 1.3937629160761162, 'ties': 'breslow'}. Best is trial 676 with value: 0.7727038262700389.[0m
[32m[I 2022-04-13 12:36:18,397][0m Trial 925 finished with value: 0.7724368866230976 and parameters: {'alpha': 1.773747767481986, 'ties': 'breslow'}. Best is trial 676 with value: 0.7727038262700389.[0m
[32m[I 2022-04-13 12:36:21,535][0m Trial 926 finished with value: 0.7726214786432947 and parameters: {'alpha': 1.1320523129490423, 'ties': 'breslow'}. Best is trial 676 with value: 0.7727038262700389.[0m
[32m[I 2022-04-13 12:36:25,841][0m Trial 927 finished with value: 0.7726299279342845 and parameters: {'alpha': 1.2866521916022287, 'ties': 'breslow'}. Best is trial 676 with value: 0.7727038262700389.[0m
[32m[I 2022-04-13 12:36:30,491][0m Trial 928 finished with value: 0.772466518398394 and parameters: {'alpha': 1.5096447861059934, 'ties': 'breslow'}. Best is trial 676 with value: 0.7727038262700389.[0m
[32m[I 2022-04-13 12:36:33,580][0m Trial 929 finished with value: 0.7726025002725154 and parameters: {'alpha': 1.074388950089438, 'ties': 'breslow'}. Best is trial 676 with value: 0.7727038262700389.[0m
[32m[I 2022-04-13 12:36:36,129][0m Trial 930 finished with value: 0.7726252269611525 and parameters: {'alpha': 1.20136593557719, 'ties': 'breslow'}. Best is trial 676 with value: 0.7727038262700389.[0m
[32m[I 2022-04-13 12:36:37,904][0m Trial 931 finished with value: 0.7725196505949373 and parameters: {'alpha': 1.3699091730576198, 'ties': 'breslow'}. Best is trial 676 with value: 0.7727038262700389.[0m
[32m[I 2022-04-13 12:36:39,780][0m Trial 932 finished with value: 0.7725959290089293 and parameters: {'alpha': 1.0097090164628024, 'ties': 'breslow'}. Best is trial 676 with value: 0.7727038262700389.[0m
[32m[I 2022-04-13 12:36:41,850][0m Trial 933 finished with value: 0.7726391035857147 and parameters: {'alpha': 1.2791711365110914, 'ties': 'efron'}. Best is trial 676 with value: 0.7727038262700389.[0m
[32m[I 2022-04-13 12:36:44,236][0m Trial 934 finished with value: 0.7724263692399266 and parameters: {'alpha': 1.4391891921654818, 'ties': 'breslow'}. Best is trial 676 with value: 0.7727038262700389.[0m
[32m[I 2022-04-13 12:36:46,750][0m Trial 935 finished with value: 0.7726305203695911 and parameters: {'alpha': 1.1545499212686472, 'ties': 'efron'}. Best is trial 676 with value: 0.7727038262700389.[0m
[32m[I 2022-04-13 12:36:50,604][0m Trial 936 finished with value: 0.7726785455214022 and parameters: {'alpha': 1.2268665857971615, 'ties': 'breslow'}. Best is trial 676 with value: 0.7727038262700389.[0m
[32m[I 2022-04-13 12:36:54,040][0m Trial 937 finished with value: 0.7725141925675403 and parameters: {'alpha': 1.3436613261004748, 'ties': 'breslow'}. Best is trial 676 with value: 0.7727038262700389.[0m
[32m[I 2022-04-13 12:36:58,283][0m Trial 938 finished with value: 0.7725322252718082 and parameters: {'alpha': 0.8227178135661141, 'ties': 'efron'}. Best is trial 676 with value: 0.7727038262700389.[0m
[32m[I 2022-04-13 12:37:00,802][0m Trial 939 finished with value: 0.7726012010414502 and parameters: {'alpha': 1.0129430898600649, 'ties': 'breslow'}. Best is trial 676 with value: 0.7727038262700389.[0m
[32m[I 2022-04-13 12:37:04,420][0m Trial 940 finished with value: 0.7726469764491004 and parameters: {'alpha': 1.1379927822043463, 'ties': 'efron'}. Best is trial 676 with value: 0.7727038262700389.[0m
[32m[I 2022-04-13 12:37:08,214][0m Trial 941 finished with value: 0.7692429862435283 and parameters: {'alpha': 4.398055635612477, 'ties': 'breslow'}. Best is trial 676 with value: 0.7727038262700389.[0m
[32m[I 2022-04-13 12:37:12,036][0m Trial 942 finished with value: 0.7726560852499821 and parameters: {'alpha': 1.2530767147522224, 'ties': 'efron'}. Best is trial 676 with value: 0.7727038262700389.[0m
[32m[I 2022-04-13 12:37:15,832][0m Trial 943 finished with value: 0.772441194974693 and parameters: {'alpha': 1.4374950105767936, 'ties': 'breslow'}. Best is trial 676 with value: 0.7727038262700389.[0m
[32m[I 2022-04-13 12:37:20,016][0m Trial 944 finished with value: 0.7725951623586641 and parameters: {'alpha': 1.0839470967188753, 'ties': 'efron'}. Best is trial 676 with value: 0.7727038262700389.[0m
[32m[I 2022-04-13 12:37:23,703][0m Trial 945 finished with value: 0.7696333036829633 and parameters: {'alpha': 4.076577497321727, 'ties': 'breslow'}. Best is trial 676 with value: 0.7727038262700389.[0m
[32m[I 2022-04-13 12:37:27,070][0m Trial 946 finished with value: 0.7725201963838917 and parameters: {'alpha': 1.339345705346487, 'ties': 'efron'}. Best is trial 676 with value: 0.7727038262700389.[0m
[32m[I 2022-04-13 12:37:30,620][0m Trial 947 finished with value: 0.7726380436112441 and parameters: {'alpha': 0.9111349019269046, 'ties': 'breslow'}. Best is trial 676 with value: 0.7727038262700389.[0m
[32m[I 2022-04-13 12:37:33,286][0m Trial 948 finished with value: 0.7726357768621931 and parameters: {'alpha': 1.2068828323876022, 'ties': 'efron'}. Best is trial 676 with value: 0.7727038262700389.[0m
[32m[I 2022-04-13 12:37:36,004][0m Trial 949 finished with value: 0.7724580437216353 and parameters: {'alpha': 1.5028263127197536, 'ties': 'breslow'}. Best is trial 676 with value: 0.7727038262700389.[0m
[32m[I 2022-04-13 12:37:39,337][0m Trial 950 finished with value: 0.7724592104232275 and parameters: {'alpha': 1.6079521844670928, 'ties': 'breslow'}. Best is trial 676 with value: 0.7727038262700389.[0m
[32m[I 2022-04-13 12:37:43,256][0m Trial 951 finished with value: 0.7725841925677589 and parameters: {'alpha': 1.1600541047478599, 'ties': 'efron'}. Best is trial 676 with value: 0.7727038262700389.[0m
[32m[I 2022-04-13 12:37:46,422][0m Trial 952 finished with value: 0.7726525207563337 and parameters: {'alpha': 1.296875673813418, 'ties': 'breslow'}. Best is trial 676 with value: 0.7727038262700389.[0m
[32m[I 2022-04-13 12:37:49,767][0m Trial 953 finished with value: 0.7725953644685234 and parameters: {'alpha': 1.0650121623611883, 'ties': 'efron'}. Best is trial 676 with value: 0.7727038262700389.[0m
[32m[I 2022-04-13 12:37:53,260][0m Trial 954 finished with value: 0.7724746053106538 and parameters: {'alpha': 1.387599435200364, 'ties': 'breslow'}. Best is trial 676 with value: 0.7727038262700389.[0m
[32m[I 2022-04-13 12:37:56,528][0m Trial 955 finished with value: 0.7726673320169679 and parameters: {'alpha': 1.2412676133369245, 'ties': 'efron'}. Best is trial 676 with value: 0.7727038262700389.[0m
[32m[I 2022-04-13 12:37:59,752][0m Trial 956 finished with value: 0.7726357502494142 and parameters: {'alpha': 0.9802057765071345, 'ties': 'breslow'}. Best is trial 676 with value: 0.7727038262700389.[0m
[32m[I 2022-04-13 12:38:03,432][0m Trial 957 finished with value: 0.7726519053466813 and parameters: {'alpha': 1.140083723604488, 'ties': 'efron'}. Best is trial 676 with value: 0.7727038262700389.[0m
[32m[I 2022-04-13 12:38:06,350][0m Trial 958 finished with value: 0.7726156986081077 and parameters: {'alpha': 1.303478286660111, 'ties': 'breslow'}. Best is trial 676 with value: 0.7727038262700389.[0m
