[32m[I 2022-04-18 12:35:58,017][0m Trial 820 finished with value: 0.7544369208050664 and parameters: {'n_hidden': 256, 'mixture_components': 10, 'use_sparse_layer': True, 'use_sparse_loss': True, 'lmbd': 1.761104370005808e-05, 'use_batchnorm': True, 'use_dropout': True, 'dropout': 0.726631607472145, 'mlp_size_1': 4, 'mlp_size_2': 0, 'mlp_size_3': 0, 'kernel': 'Exponential', 'loss_name': 'AlternativeNLLLoss'}. Best is trial 806 with value: 0.7763959235339837.[0m
[32m[I 2022-04-18 12:38:54,871][0m Trial 821 finished with value: 0.7755416193797563 and parameters: {'n_hidden': 256, 'mixture_components': 10, 'use_sparse_layer': True, 'use_sparse_loss': True, 'lmbd': 3.443175912970673e-05, 'use_batchnorm': True, 'use_dropout': True, 'dropout': 0.7493566559878536, 'mlp_size_1': 1, 'mlp_size_2': 4, 'mlp_size_3': 0, 'kernel': 'Exponential', 'loss_name': 'AlternativeNLLLoss'}. Best is trial 806 with value: 0.7763959235339837.[0m
[32m[I 2022-04-18 12:40:20,982][0m Trial 822 finished with value: -1.0 and parameters: {'n_hidden': 32, 'mixture_components': 10, 'use_sparse_layer': True, 'use_sparse_loss': True, 'lmbd': 3.558217715894622e-05, 'use_batchnorm': True, 'use_dropout': True, 'dropout': 0.7200391656219619, 'mlp_size_1': 1, 'mlp_size_2': 0, 'mlp_size_3': 0, 'kernel': 'Gumbel', 'loss_name': 'AlternativeNLLLoss'}. Best is trial 806 with value: 0.7763959235339837.[0m
[32m[I 2022-04-18 12:43:10,332][0m Trial 823 finished with value: 0.7717359003168883 and parameters: {'n_hidden': 256, 'mixture_components': 10, 'use_sparse_layer': True, 'use_sparse_loss': True, 'lmbd': 2.5654853123064813e-05, 'use_batchnorm': True, 'use_dropout': True, 'dropout': 0.7359732074589416, 'mlp_size_1': 1, 'mlp_size_2': 4, 'mlp_size_3': 0, 'kernel': 'Exponential', 'loss_name': 'AlternativeNLLLoss'}. Best is trial 806 with value: 0.7763959235339837.[0m
[32m[I 2022-04-18 12:45:59,095][0m Trial 824 finished with value: 0.7755176424687585 and parameters: {'n_hidden': 256, 'mixture_components': 10, 'use_sparse_layer': True, 'use_sparse_loss': True, 'lmbd': 3.173219486788152e-05, 'use_batchnorm': True, 'use_dropout': True, 'dropout': 0.7482746045595612, 'mlp_size_1': 1, 'mlp_size_2': 4, 'mlp_size_3': 0, 'kernel': 'Exponential', 'loss_name': 'AlternativeNLLLoss'}. Best is trial 806 with value: 0.7763959235339837.[0m
[32m[I 2022-04-18 12:48:45,655][0m Trial 825 finished with value: 0.7728145394949572 and parameters: {'n_hidden': 256, 'mixture_components': 10, 'use_sparse_layer': True, 'use_sparse_loss': True, 'lmbd': 4.8701953722501384e-05, 'use_batchnorm': True, 'use_dropout': True, 'dropout': 0.7546486363419409, 'mlp_size_1': 1, 'mlp_size_2': 4, 'mlp_size_3': 0, 'kernel': 'Exponential', 'loss_name': 'AlternativeNLLLoss'}. Best is trial 806 with value: 0.7763959235339837.[0m
[32m[I 2022-04-18 12:51:33,293][0m Trial 826 finished with value: 0.7670196728018025 and parameters: {'n_hidden': 256, 'mixture_components': 10, 'use_sparse_layer': True, 'use_sparse_loss': True, 'lmbd': 3.331555974145707e-05, 'use_batchnorm': True, 'use_dropout': True, 'dropout': 0.7492254582460206, 'mlp_size_1': 1, 'mlp_size_2': 4, 'mlp_size_3': 0, 'kernel': 'Exponential', 'loss_name': 'AlternativeNLLLoss'}. Best is trial 806 with value: 0.7763959235339837.[0m
[32m[I 2022-04-18 12:56:53,023][0m Trial 827 finished with value: 0.7338100432875382 and parameters: {'n_hidden': 2048, 'mixture_components': 10, 'use_sparse_layer': True, 'use_sparse_loss': True, 'lmbd': 2.293621875969426e-05, 'use_batchnorm': True, 'use_dropout': True, 'dropout': 0.7338885860343012, 'mlp_size_1': 0, 'mlp_size_2': 5, 'mlp_size_3': 3, 'kernel': 'Weibull', 'loss_name': 'AlternativeNLLLoss'}. Best is trial 806 with value: 0.7763959235339837.[0m
[32m[I 2022-04-18 12:59:31,389][0m Trial 828 finished with value: 0.7517671157982948 and parameters: {'n_hidden': 256, 'mixture_components': 10, 'use_sparse_layer': True, 'use_sparse_loss': True, 'lmbd': 1.4329201166683695e-05, 'use_batchnorm': True, 'use_dropout': False, 'mlp_size_1': 1, 'mlp_size_2': 4, 'mlp_size_3': 0, 'kernel': 'Exponential', 'loss_name': 'AlternativeNLLLoss'}. Best is trial 806 with value: 0.7763959235339837.[0m
[32m[I 2022-04-18 13:02:28,027][0m Trial 829 finished with value: 0.7661919233548423 and parameters: {'n_hidden': 256, 'mixture_components': 10, 'use_sparse_layer': True, 'use_sparse_loss': True, 'lmbd': 4.537677730743821e-05, 'use_batchnorm': True, 'use_dropout': True, 'dropout': 0.7576998094414312, 'mlp_size_1': 1, 'mlp_size_2': 4, 'mlp_size_3': 0, 'kernel': 'Exponential', 'loss_name': 'AlternativeNLLLoss'}. Best is trial 806 with value: 0.7763959235339837.[0m
[32m[I 2022-04-18 13:05:14,852][0m Trial 830 finished with value: 0.7664024782314226 and parameters: {'n_hidden': 256, 'mixture_components': 10, 'use_sparse_layer': True, 'use_sparse_loss': True, 'lmbd': 1.899681065503514e-05, 'use_batchnorm': True, 'use_dropout': True, 'dropout': 0.7168237946010227, 'mlp_size_1': 1, 'mlp_size_2': 4, 'mlp_size_3': 0, 'kernel': 'Exponential', 'loss_name': 'AlternativeNLLLoss'}. Best is trial 806 with value: 0.7763959235339837.[0m
[32m[I 2022-04-18 13:10:52,460][0m Trial 831 finished with value: 0.7631967816336507 and parameters: {'n_hidden': 128, 'mixture_components': 10, 'use_sparse_layer': True, 'use_sparse_loss': True, 'lmbd': 6.659456215721575e-05, 'use_batchnorm': True, 'use_dropout': True, 'dropout': 0.7783647234666673, 'mlp_size_1': 1, 'mlp_size_2': 3, 'mlp_size_3': 0, 'kernel': 'LogNormal', 'loss_name': 'AlternativeNLLLoss'}. Best is trial 806 with value: 0.7763959235339837.[0m
[32m[I 2022-04-18 13:13:46,083][0m Trial 832 finished with value: 0.7700233897540749 and parameters: {'n_hidden': 256, 'mixture_components': 10, 'use_sparse_layer': True, 'use_sparse_loss': True, 'lmbd': 3.4286379748291586e-05, 'use_batchnorm': True, 'use_dropout': True, 'dropout': 0.7391187530072705, 'mlp_size_1': 1, 'mlp_size_2': 4, 'mlp_size_3': 0, 'kernel': 'Exponential', 'loss_name': 'AlternativeNLLLoss'}. Best is trial 806 with value: 0.7763959235339837.[0m
[32m[I 2022-04-18 13:16:40,419][0m Trial 833 finished with value: 0.7712803212933769 and parameters: {'n_hidden': 256, 'mixture_components': 10, 'use_sparse_layer': True, 'use_sparse_loss': True, 'lmbd': 1.216441961494652e-05, 'use_batchnorm': True, 'use_dropout': True, 'dropout': 0.7491872316260194, 'mlp_size_1': 1, 'mlp_size_2': 4, 'mlp_size_3': 0, 'kernel': 'Exponential', 'loss_name': 'AlternativeNLLLoss'}. Best is trial 806 with value: 0.7763959235339837.[0m
[32m[I 2022-04-18 13:19:29,340][0m Trial 834 finished with value: 0.7728501952674685 and parameters: {'n_hidden': 256, 'mixture_components': 10, 'use_sparse_layer': True, 'use_sparse_loss': True, 'lmbd': 1.4630509301349531e-05, 'use_batchnorm': True, 'use_dropout': True, 'dropout': 0.7670344709145818, 'mlp_size_1': 1, 'mlp_size_2': 4, 'mlp_size_3': 0, 'kernel': 'Exponential', 'loss_name': 'AlternativeNLLLoss'}. Best is trial 806 with value: 0.7763959235339837.[0m
[32m[I 2022-04-18 13:24:28,803][0m Trial 835 finished with value: 0.7252966724814086 and parameters: {'n_hidden': 256, 'mixture_components': 10, 'use_sparse_layer': True, 'use_sparse_loss': True, 'lmbd': 2.8483933618925203e-05, 'use_batchnorm': True, 'use_dropout': True, 'dropout': 0.7160552673610594, 'mlp_size_1': 1, 'mlp_size_2': 4, 'mlp_size_3': 0, 'kernel': 'Logistic', 'loss_name': 'AlternativeNLLLoss'}. Best is trial 806 with value: 0.7763959235339837.[0m
[32m[I 2022-04-18 13:27:37,157][0m Trial 836 finished with value: 0.7741609910927891 and parameters: {'n_hidden': 256, 'mixture_components': 10, 'use_sparse_layer': True, 'use_sparse_loss': True, 'lmbd': 8.214286419528373e-06, 'use_batchnorm': True, 'use_dropout': True, 'dropout': 0.7317895465303018, 'mlp_size_1': 1, 'mlp_size_2': 4, 'mlp_size_3': 0, 'kernel': 'Exponential', 'loss_name': 'AlternativeNLLLoss'}. Best is trial 806 with value: 0.7763959235339837.[0m
[32m[I 2022-04-18 13:30:32,705][0m Trial 837 finished with value: 0.773502812267366 and parameters: {'n_hidden': 256, 'mixture_components': 10, 'use_sparse_layer': True, 'use_sparse_loss': True, 'lmbd': 9.877964370982336e-06, 'use_batchnorm': True, 'use_dropout': True, 'dropout': 0.7676514027438848, 'mlp_size_1': 1, 'mlp_size_2': 4, 'mlp_size_3': 0, 'kernel': 'Exponential', 'loss_name': 'AlternativeNLLLoss'}. Best is trial 806 with value: 0.7763959235339837.[0m
[32m[I 2022-04-18 13:33:11,956][0m Trial 838 finished with value: 0.7589082550409144 and parameters: {'n_hidden': 256, 'mixture_components': 10, 'use_sparse_layer': True, 'use_sparse_loss': True, 'lmbd': 6.702952152422639e-06, 'use_batchnorm': True, 'use_dropout': True, 'dropout': 0.7983902163888935, 'mlp_size_1': 1, 'mlp_size_2': 4, 'mlp_size_3': 0, 'kernel': 'Exponential', 'loss_name': 'AlternativeNLLLoss'}. Best is trial 806 with value: 0.7763959235339837.[0m
[32m[I 2022-04-18 13:36:15,404][0m Trial 839 finished with value: 0.7769755958553046 and parameters: {'n_hidden': 256, 'mixture_components': 10, 'use_sparse_layer': True, 'use_sparse_loss': True, 'lmbd': 2.064785947459707e-05, 'use_batchnorm': True, 'use_dropout': True, 'dropout': 0.7457985371044574, 'mlp_size_1': 1, 'mlp_size_2': 4, 'mlp_size_3': 0, 'kernel': 'Exponential', 'loss_name': 'AlternativeNLLLoss'}. Best is trial 839 with value: 0.7769755958553046.[0m
[32m[I 2022-04-18 13:39:10,002][0m Trial 840 finished with value: 0.7685215261287388 and parameters: {'n_hidden': 256, 'mixture_components': 10, 'use_sparse_layer': True, 'use_sparse_loss': True, 'lmbd': 2.348216739294259e-05, 'use_batchnorm': True, 'use_dropout': True, 'dropout': 0.7300966785590592, 'mlp_size_1': 1, 'mlp_size_2': 4, 'mlp_size_3': 0, 'kernel': 'Exponential', 'loss_name': 'AlternativeNLLLoss'}. Best is trial 839 with value: 0.7769755958553046.[0m
[32m[I 2022-04-18 13:45:32,979][0m Trial 841 finished with value: 0.7092770170251089 and parameters: {'n_hidden': 256, 'mixture_components': 10, 'use_sparse_layer': True, 'use_sparse_loss': True, 'lmbd': 8.458707835183478e-06, 'use_batchnorm': True, 'use_dropout': True, 'dropout': 0.7853313333424977, 'mlp_size_1': 1, 'mlp_size_2': 4, 'mlp_size_3': 0, 'kernel': 'Normal', 'loss_name': 'AlternativeNLLLoss'}. Best is trial 839 with value: 0.7769755958553046.[0m
[32m[I 2022-04-18 13:48:14,653][0m Trial 842 finished with value: 0.7651639256297779 and parameters: {'n_hidden': 256, 'mixture_components': 10, 'use_sparse_layer': True, 'use_sparse_loss': True, 'lmbd': 2.003073827624996e-05, 'use_batchnorm': True, 'use_dropout': True, 'dropout': 0.7595540917286959, 'mlp_size_1': 1, 'mlp_size_2': 4, 'mlp_size_3': 0, 'kernel': 'Exponential', 'loss_name': 'AlternativeNLLLoss'}. Best is trial 839 with value: 0.7769755958553046.[0m
[32m[I 2022-04-18 13:51:24,310][0m Trial 843 finished with value: 0.7712555041397195 and parameters: {'n_hidden': 256, 'mixture_components': 2, 'use_sparse_layer': True, 'use_sparse_loss': True, 'lmbd': 4.1317841349642825e-05, 'use_batchnorm': True, 'use_dropout': True, 'dropout': 0.7344104415590113, 'mlp_size_1': 1, 'mlp_size_2': 4, 'mlp_size_3': 0, 'kernel': 'Exponential', 'loss_name': 'AlternativeNLLLoss'}. Best is trial 839 with value: 0.7769755958553046.[0m
[32m[I 2022-04-18 13:55:56,218][0m Trial 844 finished with value: 0.7216048022341145 and parameters: {'n_hidden': 256, 'mixture_components': 10, 'use_sparse_layer': True, 'use_sparse_loss': True, 'lmbd': 1.4495096946009044e-05, 'use_batchnorm': True, 'use_dropout': True, 'dropout': 0.7615485167976473, 'mlp_size_1': 1, 'mlp_size_2': 4, 'mlp_size_3': 0, 'kernel': 'LogLogistic', 'loss_name': 'AlternativeNLLLoss'}. Best is trial 839 with value: 0.7769755958553046.[0m
[32m[I 2022-04-18 13:58:52,437][0m Trial 845 finished with value: 0.7745160516818619 and parameters: {'n_hidden': 256, 'mixture_components': 10, 'use_sparse_layer': True, 'use_sparse_loss': True, 'lmbd': 1.038253306004065e-05, 'use_batchnorm': True, 'use_dropout': True, 'dropout': 0.726486079205681, 'mlp_size_1': 1, 'mlp_size_2': 4, 'mlp_size_3': 0, 'kernel': 'Exponential', 'loss_name': 'AlternativeNLLLoss'}. Best is trial 839 with value: 0.7769755958553046.[0m
[32m[I 2022-04-18 14:02:03,567][0m Trial 846 finished with value: 0.7708606436289964 and parameters: {'n_hidden': 256, 'mixture_components': 10, 'use_sparse_layer': True, 'use_sparse_loss': True, 'lmbd': 1.1195627953501733e-05, 'use_batchnorm': True, 'use_dropout': True, 'dropout': 0.7166997632070384, 'mlp_size_1': 1, 'mlp_size_2': 4, 'mlp_size_3': 0, 'kernel': 'Exponential', 'loss_name': 'AlternativeNLLLoss'}. Best is trial 839 with value: 0.7769755958553046.[0m
[32m[I 2022-04-18 14:04:11,790][0m Trial 847 finished with value: 0.7414262098868256 and parameters: {'n_hidden': 256, 'mixture_components': 10, 'use_sparse_layer': True, 'use_sparse_loss': True, 'lmbd': 5.536013162629194e-06, 'use_batchnorm': True, 'use_dropout': True, 'dropout': 0.7438848652165323, 'mlp_size_1': 1, 'mlp_size_2': 4, 'mlp_size_3': 0, 'kernel': 'Gamma', 'loss_name': 'AlternativeNLLLoss'}. Best is trial 839 with value: 0.7769755958553046.[0m
[32m[I 2022-04-18 14:06:42,773][0m Trial 848 finished with value: 0.7568718287973042 and parameters: {'n_hidden': 256, 'mixture_components': 10, 'use_sparse_layer': True, 'use_sparse_loss': True, 'lmbd': 1.7239783731792032e-05, 'use_batchnorm': True, 'use_dropout': False, 'mlp_size_1': 1, 'mlp_size_2': 4, 'mlp_size_3': 0, 'kernel': 'Exponential', 'loss_name': 'AlternativeNLLLoss'}. Best is trial 839 with value: 0.7769755958553046.[0m
[32m[I 2022-04-18 14:10:33,306][0m Trial 849 finished with value: 0.7626393899174284 and parameters: {'n_hidden': 32, 'mixture_components': 3, 'use_sparse_layer': True, 'use_sparse_loss': True, 'lmbd': 2.5287069575181547e-05, 'use_batchnorm': True, 'use_dropout': True, 'dropout': 0.7244108558594748, 'mlp_size_1': 1, 'mlp_size_2': 0, 'mlp_size_3': 0, 'kernel': 'Exponential', 'loss_name': 'AlternativeNLLLoss'}. Best is trial 839 with value: 0.7769755958553046.[0m
[32m[I 2022-04-18 14:13:32,193][0m Trial 850 finished with value: 0.7705785318566296 and parameters: {'n_hidden': 256, 'mixture_components': 10, 'use_sparse_layer': True, 'use_sparse_loss': True, 'lmbd': 3.151965537274431e-05, 'use_batchnorm': True, 'use_dropout': True, 'dropout': 0.7821508333880376, 'mlp_size_1': 1, 'mlp_size_2': 4, 'mlp_size_3': 0, 'kernel': 'Exponential', 'loss_name': 'AlternativeNLLLoss'}. Best is trial 839 with value: 0.7769755958553046.[0m
[32m[I 2022-04-18 14:16:20,126][0m Trial 851 finished with value: 0.7652837942671068 and parameters: {'n_hidden': 256, 'mixture_components': 10, 'use_sparse_layer': True, 'use_sparse_loss': True, 'lmbd': 5.5467735665932594e-05, 'use_batchnorm': True, 'use_dropout': True, 'dropout': 0.7459819323296419, 'mlp_size_1': 1, 'mlp_size_2': 4, 'mlp_size_3': 0, 'kernel': 'Exponential', 'loss_name': 'AlternativeNLLLoss'}. Best is trial 839 with value: 0.7769755958553046.[0m
[32m[I 2022-04-18 14:19:14,639][0m Trial 852 finished with value: 0.7676373414679 and parameters: {'n_hidden': 256, 'mixture_components': 10, 'use_sparse_layer': True, 'use_sparse_loss': True, 'lmbd': 1.06402176577449e-05, 'use_batchnorm': True, 'use_dropout': True, 'dropout': 0.7127128212646845, 'mlp_size_1': 1, 'mlp_size_2': 4, 'mlp_size_3': 0, 'kernel': 'Exponential', 'loss_name': 'AlternativeNLLLoss'}. Best is trial 839 with value: 0.7769755958553046.[0m
[32m[I 2022-04-18 14:20:56,037][0m Trial 853 finished with value: -1.0 and parameters: {'n_hidden': 256, 'mixture_components': 10, 'use_sparse_layer': True, 'use_sparse_loss': True, 'lmbd': 7.76558626640094e-06, 'use_batchnorm': True, 'use_dropout': True, 'dropout': 0.7591593222784051, 'mlp_size_1': 1, 'mlp_size_2': 4, 'mlp_size_3': 0, 'kernel': 'Gumbel', 'loss_name': 'AlternativeNLLLoss'}. Best is trial 839 with value: 0.7769755958553046.[0m
[32m[I 2022-04-18 14:24:12,361][0m Trial 854 finished with value: 0.7693574927699569 and parameters: {'n_hidden': 2048, 'mixture_components': 10, 'use_sparse_layer': True, 'use_sparse_loss': True, 'lmbd': 1.9679783314978794e-05, 'use_batchnorm': True, 'use_dropout': True, 'dropout': 0.7351504734484111, 'mlp_size_1': 1, 'mlp_size_2': 4, 'mlp_size_3': 0, 'kernel': 'Exponential', 'loss_name': 'AlternativeNLLLoss'}. Best is trial 839 with value: 0.7769755958553046.[0m
[32m[I 2022-04-18 14:27:06,850][0m Trial 855 finished with value: 0.7701558780165388 and parameters: {'n_hidden': 256, 'mixture_components': 10, 'use_sparse_layer': True, 'use_sparse_loss': True, 'lmbd': 3.0096170987876275e-06, 'use_batchnorm': True, 'use_dropout': True, 'dropout': 0.7063088834036583, 'mlp_size_1': 1, 'mlp_size_2': 4, 'mlp_size_3': 0, 'kernel': 'Exponential', 'loss_name': 'AlternativeNLLLoss'}. Best is trial 839 with value: 0.7769755958553046.[0m
[32m[I 2022-04-18 14:30:07,489][0m Trial 856 finished with value: 0.776196567754617 and parameters: {'n_hidden': 256, 'mixture_components': 10, 'use_sparse_layer': True, 'use_sparse_loss': True, 'lmbd': 7.77548612968729e-05, 'use_batchnorm': True, 'use_dropout': True, 'dropout': 0.7732906363823977, 'mlp_size_1': 1, 'mlp_size_2': 4, 'mlp_size_3': 0, 'kernel': 'Exponential', 'loss_name': 'AlternativeNLLLoss'}. Best is trial 839 with value: 0.7769755958553046.[0m
[32m[I 2022-04-18 14:33:06,732][0m Trial 857 finished with value: 0.7690681123230971 and parameters: {'n_hidden': 256, 'mixture_components': 10, 'use_sparse_layer': True, 'use_sparse_loss': True, 'lmbd': 8.339867286835282e-05, 'use_batchnorm': True, 'use_dropout': True, 'dropout': 0.8035043301516632, 'mlp_size_1': 1, 'mlp_size_2': 4, 'mlp_size_3': 0, 'kernel': 'Exponential', 'loss_name': 'AlternativeNLLLoss'}. Best is trial 839 with value: 0.7769755958553046.[0m
[32m[I 2022-04-18 14:36:03,785][0m Trial 858 finished with value: 0.7713429038010535 and parameters: {'n_hidden': 256, 'mixture_components': 10, 'use_sparse_layer': True, 'use_sparse_loss': True, 'lmbd': 4.041165612420234e-05, 'use_batchnorm': True, 'use_dropout': True, 'dropout': 0.787581653030544, 'mlp_size_1': 1, 'mlp_size_2': 4, 'mlp_size_3': 0, 'kernel': 'Exponential', 'loss_name': 'AlternativeNLLLoss'}. Best is trial 839 with value: 0.7769755958553046.[0m
[32m[I 2022-04-18 14:39:17,526][0m Trial 859 finished with value: 0.6359196565523713 and parameters: {'n_hidden': 128, 'mixture_components': 10, 'use_sparse_layer': True, 'use_sparse_loss': True, 'lmbd': 6.842729321982911e-05, 'use_batchnorm': True, 'use_dropout': True, 'dropout': 0.8088494600647894, 'mlp_size_1': 1, 'mlp_size_2': 3, 'mlp_size_3': 0, 'kernel': 'Weibull', 'loss_name': 'AlternativeNLLLoss'}. Best is trial 839 with value: 0.7769755958553046.[0m
[32m[I 2022-04-18 14:42:08,357][0m Trial 860 finished with value: 0.766536741639716 and parameters: {'n_hidden': 256, 'mixture_components': 10, 'use_sparse_layer': True, 'use_sparse_loss': True, 'lmbd': 4.8598517587016864e-05, 'use_batchnorm': True, 'use_dropout': True, 'dropout': 0.7734598505790151, 'mlp_size_1': 1, 'mlp_size_2': 4, 'mlp_size_3': 0, 'kernel': 'Exponential', 'loss_name': 'AlternativeNLLLoss'}. Best is trial 839 with value: 0.7769755958553046.[0m
[32m[I 2022-04-18 14:45:03,975][0m Trial 861 finished with value: 0.7786620056496094 and parameters: {'n_hidden': 256, 'mixture_components': 10, 'use_sparse_layer': True, 'use_sparse_loss': True, 'lmbd': 1.4963805463910381e-05, 'use_batchnorm': True, 'use_dropout': True, 'dropout': 0.7734249900448279, 'mlp_size_1': 1, 'mlp_size_2': 4, 'mlp_size_3': 0, 'kernel': 'Exponential', 'loss_name': 'AlternativeNLLLoss'}. Best is trial 861 with value: 0.7786620056496094.[0m
[32m[I 2022-04-18 14:48:01,701][0m Trial 862 finished with value: 0.7624341057541363 and parameters: {'n_hidden': 256, 'mixture_components': 10, 'use_sparse_layer': True, 'use_sparse_loss': True, 'lmbd': 3.139650398958286e-05, 'use_batchnorm': True, 'use_dropout': True, 'dropout': 0.8168438404528814, 'mlp_size_1': 1, 'mlp_size_2': 4, 'mlp_size_3': 0, 'kernel': 'Exponential', 'loss_name': 'AlternativeNLLLoss'}. Best is trial 861 with value: 0.7786620056496094.[0m
[32m[I 2022-04-18 14:50:56,784][0m Trial 863 finished with value: 0.7750649113878143 and parameters: {'n_hidden': 256, 'mixture_components': 10, 'use_sparse_layer': True, 'use_sparse_loss': True, 'lmbd': 1.3273499545666922e-05, 'use_batchnorm': True, 'use_dropout': True, 'dropout': 0.7915992448127682, 'mlp_size_1': 1, 'mlp_size_2': 4, 'mlp_size_3': 0, 'kernel': 'Exponential', 'loss_name': 'AlternativeNLLLoss'}. Best is trial 861 with value: 0.7786620056496094.[0m
[32m[I 2022-04-18 14:56:08,235][0m Trial 864 finished with value: 0.7573464924063738 and parameters: {'n_hidden': 256, 'mixture_components': 10, 'use_sparse_layer': True, 'use_sparse_loss': True, 'lmbd': 1.3807562180267514e-05, 'use_batchnorm': True, 'use_dropout': True, 'dropout': 0.8514074414706314, 'mlp_size_1': 1, 'mlp_size_2': 4, 'mlp_size_3': 0, 'kernel': 'LogNormal', 'loss_name': 'AlternativeNLLLoss'}. Best is trial 861 with value: 0.7786620056496094.[0m
[32m[I 2022-04-18 14:58:59,713][0m Trial 865 finished with value: 0.7639675730154867 and parameters: {'n_hidden': 256, 'mixture_components': 10, 'use_sparse_layer': True, 'use_sparse_loss': True, 'lmbd': 1.1348532272587685e-05, 'use_batchnorm': True, 'use_dropout': True, 'dropout': 0.8344144885897439, 'mlp_size_1': 1, 'mlp_size_2': 4, 'mlp_size_3': 0, 'kernel': 'Exponential', 'loss_name': 'AlternativeNLLLoss'}. Best is trial 861 with value: 0.7786620056496094.[0m
[32m[I 2022-04-18 15:01:56,079][0m Trial 866 finished with value: 0.775664052378295 and parameters: {'n_hidden': 256, 'mixture_components': 10, 'use_sparse_layer': True, 'use_sparse_loss': True, 'lmbd': 2.286671967506779e-05, 'use_batchnorm': True, 'use_dropout': True, 'dropout': 0.8031891812619267, 'mlp_size_1': 1, 'mlp_size_2': 4, 'mlp_size_3': 0, 'kernel': 'Exponential', 'loss_name': 'AlternativeNLLLoss'}. Best is trial 861 with value: 0.7786620056496094.[0m
