[32m[I 2022-04-22 22:08:02,606][0m Trial 445 finished with value: 0.5 and parameters: {'loss': 'coxph', 'learning_rate': 0.038218283223791415, 'n_estimators': 510, 'criterion': 'friedman_mse', 'min_samples_split': 10, 'min_samples_leaf': 3, 'min_weight_fraction_leaf': 0.07956952069798608, 'min_impurity_decrease': 0.8518297705480949, 'max_features': 0.18921682202445184, 'subsample': 0.22834147914399694, 'dropout_rate': 0.28945877723404384, 'ccp_alpha': 4.364277598244737}. Best is trial 218 with value: 0.6659976583847056.[0m
[32m[I 2022-04-22 22:08:46,319][0m Trial 446 finished with value: 0.6440278581286075 and parameters: {'loss': 'coxph', 'learning_rate': 0.08124834866156214, 'n_estimators': 457, 'criterion': 'friedman_mse', 'min_samples_split': 6, 'min_samples_leaf': 3, 'min_weight_fraction_leaf': 0.05203078634461976, 'min_impurity_decrease': 0.8830547245288785, 'max_features': 0.5895927272473005, 'subsample': 0.31072806496931155, 'dropout_rate': 0.3660454704390868, 'ccp_alpha': 0.09732689137033282}. Best is trial 218 with value: 0.6659976583847056.[0m
[32m[I 2022-04-22 22:11:08,282][0m Trial 447 finished with value: 0.5627641029936182 and parameters: {'loss': 'coxph', 'learning_rate': 0.049197151727395194, 'n_estimators': 791, 'criterion': 'friedman_mse', 'min_samples_split': 10, 'min_samples_leaf': 3, 'min_weight_fraction_leaf': 0.07014711601334371, 'min_impurity_decrease': 0.9291363443281532, 'max_features': 0.11959484595648365, 'subsample': 0.2571907405868961, 'dropout_rate': 0.22412304876162448, 'ccp_alpha': 0.24762086904754632}. Best is trial 218 with value: 0.6659976583847056.[0m
[32m[I 2022-04-22 22:12:25,850][0m Trial 448 finished with value: 0.6568166747456463 and parameters: {'loss': 'coxph', 'learning_rate': 0.0997917143860579, 'n_estimators': 550, 'criterion': 'friedman_mse', 'min_samples_split': 10, 'min_samples_leaf': 3, 'min_weight_fraction_leaf': 0.08573599942679194, 'min_impurity_decrease': 0.8192076136152346, 'max_features': 0.7728641018059025, 'subsample': 0.28004657002510996, 'dropout_rate': 0.18083629679271124, 'ccp_alpha': 0.08665360379338247}. Best is trial 218 with value: 0.6659976583847056.[0m
[32m[I 2022-04-22 22:13:27,081][0m Trial 449 finished with value: 0.6607004028811151 and parameters: {'loss': 'coxph', 'learning_rate': 0.055283572597732235, 'n_estimators': 492, 'criterion': 'friedman_mse', 'min_samples_split': 10, 'min_samples_leaf': 3, 'min_weight_fraction_leaf': 0.06102747888524681, 'min_impurity_decrease': 0.906744487237941, 'max_features': 0.14472222985399963, 'subsample': 0.20165677521752012, 'dropout_rate': 0.24877805830365876, 'ccp_alpha': 0.0011814702166994123}. Best is trial 218 with value: 0.6659976583847056.[0m
[32m[I 2022-04-22 22:14:51,044][0m Trial 450 finished with value: 0.5006540204610004 and parameters: {'loss': 'coxph', 'learning_rate': 0.0299868672635328, 'n_estimators': 618, 'criterion': 'friedman_mse', 'min_samples_split': 10, 'min_samples_leaf': 3, 'min_weight_fraction_leaf': 0.07558577492846244, 'min_impurity_decrease': 0.9455405299682469, 'max_features': 0.5165815861594318, 'subsample': 0.29982200966735073, 'dropout_rate': 0.2762301274435562, 'ccp_alpha': 0.3529046587334811}. Best is trial 218 with value: 0.6659976583847056.[0m
[32m[I 2022-04-22 22:15:58,684][0m Trial 451 finished with value: 0.6508356591232061 and parameters: {'loss': 'coxph', 'learning_rate': 0.024375690189234585, 'n_estimators': 525, 'criterion': 'friedman_mse', 'min_samples_split': 10, 'min_samples_leaf': 3, 'min_weight_fraction_leaf': 0.04124392676731631, 'min_impurity_decrease': 0.8707299611270678, 'max_features': 0.7349146172066673, 'subsample': 0.23975281345095883, 'dropout_rate': 0.2228896441199522, 'ccp_alpha': 0.00360577394839376}. Best is trial 218 with value: 0.6659976583847056.[0m
[32m[I 2022-04-22 22:16:36,869][0m Trial 452 finished with value: 0.5 and parameters: {'loss': 'coxph', 'learning_rate': 0.07595607566970404, 'n_estimators': 444, 'criterion': 'absolute_error', 'min_samples_split': 10, 'min_samples_leaf': 3, 'min_weight_fraction_leaf': 0.09008546320442255, 'min_impurity_decrease': 0.9192491793576851, 'max_features': 0.06576519469849601, 'subsample': 0.27528739642398053, 'dropout_rate': 0.390370082103928, 'ccp_alpha': 0.1409513846332236}. Best is trial 218 with value: 0.6659976583847056.[0m
[32m[I 2022-04-22 22:17:27,330][0m Trial 453 finished with value: 0.6060420189276703 and parameters: {'loss': 'coxph', 'learning_rate': 0.036757975772841955, 'n_estimators': 481, 'criterion': 'friedman_mse', 'min_samples_split': 10, 'min_samples_leaf': 3, 'min_weight_fraction_leaf': 0.057887802286768625, 'min_impurity_decrease': 0.9583101867328743, 'max_features': 0.6424850643192314, 'subsample': 0.3129096148836978, 'dropout_rate': 0.3008417202081781, 'ccp_alpha': 0.18121798638765502}. Best is trial 218 with value: 0.6659976583847056.[0m
[32m[I 2022-04-22 22:19:58,410][0m Trial 454 finished with value: 0.6523685180043184 and parameters: {'loss': 'coxph', 'learning_rate': 0.058893449931222704, 'n_estimators': 856, 'criterion': 'friedman_mse', 'min_samples_split': 10, 'min_samples_leaf': 3, 'min_weight_fraction_leaf': 0.07030192418423245, 'min_impurity_decrease': 0.886606456683133, 'max_features': 0.6679625107689727, 'subsample': 0.29032938186306456, 'dropout_rate': 0.323248049350394, 'ccp_alpha': 0.08756853148055099}. Best is trial 218 with value: 0.6659976583847056.[0m
/media/san2_ssd/data/Workdir/survival/venv/lib/python3.8/site-packages/sksurv/ensemble/boosting.py:955: RuntimeWarning: divide by zero encountered in log
  time = numpy.log(time)
/media/san2_ssd/data/Workdir/survival/venv/lib/python3.8/site-packages/sksurv/ensemble/boosting.py:955: RuntimeWarning: divide by zero encountered in log
  time = numpy.log(time)
/media/san2_ssd/data/Workdir/survival/venv/lib/python3.8/site-packages/sksurv/ensemble/boosting.py:955: RuntimeWarning: divide by zero encountered in log
  time = numpy.log(time)
/media/san2_ssd/data/Workdir/survival/venv/lib/python3.8/site-packages/sksurv/ensemble/boosting.py:955: RuntimeWarning: divide by zero encountered in log
  time = numpy.log(time)
[32m[I 2022-04-22 22:20:29,295][0m Trial 455 finished with value: -0.7 and parameters: {'loss': 'squared', 'learning_rate': 0.01771423000560134, 'n_estimators': 995, 'criterion': 'friedman_mse', 'min_samples_split': 10, 'min_samples_leaf': 3, 'min_weight_fraction_leaf': 0.08123069809720886, 'min_impurity_decrease': 0.9020618474955602, 'max_features': 0.5543530205170623, 'subsample': 0.25762545401155124, 'dropout_rate': 0.4595715732655948, 'ccp_alpha': 3.372552276044054}. Best is trial 218 with value: 0.6659976583847056.[0m
[32m[I 2022-04-22 22:21:55,987][0m Trial 456 finished with value: 0.6559305920539089 and parameters: {'loss': 'coxph', 'learning_rate': 0.04685128034208446, 'n_estimators': 585, 'criterion': 'friedman_mse', 'min_samples_split': 10, 'min_samples_leaf': 3, 'min_weight_fraction_leaf': 0.09789993539896395, 'min_impurity_decrease': 0.9329502755322875, 'max_features': 0.226041849624709, 'subsample': 0.219297095877909, 'dropout_rate': 0.20465928636377717, 'ccp_alpha': 0.0010069099317079923}. Best is trial 218 with value: 0.6659976583847056.[0m
[32m[I 2022-04-22 22:22:43,612][0m Trial 457 finished with value: 0.5 and parameters: {'loss': 'coxph', 'learning_rate': 0.06928441544851921, 'n_estimators': 508, 'criterion': 'squared_error', 'min_samples_split': 10, 'min_samples_leaf': 3, 'min_weight_fraction_leaf': 0.11194921693360918, 'min_impurity_decrease': 0.8437997848400022, 'max_features': 0.691924904529088, 'subsample': 0.3479683748434925, 'dropout_rate': 0.4167800492563154, 'ccp_alpha': 0.22874962896816958}. Best is trial 218 with value: 0.6659976583847056.[0m
[32m[I 2022-04-22 22:23:30,884][0m Trial 458 finished with value: 0.6514435813115849 and parameters: {'loss': 'coxph', 'learning_rate': 0.012483649301167802, 'n_estimators': 470, 'criterion': 'friedman_mse', 'min_samples_split': 10, 'min_samples_leaf': 8, 'min_weight_fraction_leaf': 0.0652079991173837, 'min_impurity_decrease': 0.869665450995475, 'max_features': 0.6118822529287219, 'subsample': 0.2661938510451739, 'dropout_rate': 0.3553414693118195, 'ccp_alpha': 0.10059906580606076}. Best is trial 218 with value: 0.6659976583847056.[0m
[32m[I 2022-04-22 22:24:12,944][0m Trial 459 finished with value: 0.597852044579344 and parameters: {'loss': 'coxph', 'learning_rate': 4.638401463562113e-06, 'n_estimators': 426, 'criterion': 'friedman_mse', 'min_samples_split': 10, 'min_samples_leaf': 3, 'min_weight_fraction_leaf': 0.2905592850700994, 'min_impurity_decrease': 0.9761957013645515, 'max_features': 0.5248390766917191, 'subsample': 0.3001815911696039, 'dropout_rate': 0.25356635339727074, 'ccp_alpha': 0.1000131450359464}. Best is trial 218 with value: 0.6659976583847056.[0m
[32m[I 2022-04-22 22:25:24,638][0m Trial 460 finished with value: 0.5 and parameters: {'loss': 'coxph', 'learning_rate': 0.04065272522735969, 'n_estimators': 546, 'criterion': 'friedman_mse', 'min_samples_split': 10, 'min_samples_leaf': 3, 'min_weight_fraction_leaf': 0.051442578263529395, 'min_impurity_decrease': 0.9146225011715793, 'max_features': 0.5803577324015499, 'subsample': 0.24350146644322357, 'dropout_rate': 0.17883489825552484, 'ccp_alpha': 0.44426187054075417}. Best is trial 218 with value: 0.6659976583847056.[0m
[32m[I 2022-04-22 22:26:26,288][0m Trial 461 finished with value: 0.5177362383394645 and parameters: {'loss': 'coxph', 'learning_rate': 0.05921564762610248, 'n_estimators': 509, 'criterion': 'friedman_mse', 'min_samples_split': 10, 'min_samples_leaf': 3, 'min_weight_fraction_leaf': 0.07788297862412832, 'min_impurity_decrease': 0.5168212341216492, 'max_features': 0.3037170896062501, 'subsample': 0.3345531182760286, 'dropout_rate': 0.23663127069322526, 'ccp_alpha': 0.2784618707369204}. Best is trial 218 with value: 0.6659976583847056.[0m
[32m[I 2022-04-22 22:27:39,581][0m Trial 462 finished with value: 0.5 and parameters: {'loss': 'coxph', 'learning_rate': 0.031181338750575285, 'n_estimators': 567, 'criterion': 'friedman_mse', 'min_samples_split': 10, 'min_samples_leaf': 4, 'min_weight_fraction_leaf': 0.08815061334884046, 'min_impurity_decrease': 0.9429807795233369, 'max_features': 0.7550226887975628, 'subsample': 0.31562145920329426, 'dropout_rate': 0.27995238487740176, 'ccp_alpha': 1.6994626537573043}. Best is trial 218 with value: 0.6659976583847056.[0m
[32m[I 2022-04-22 22:29:18,199][0m Trial 463 finished with value: 0.5990962159709792 and parameters: {'loss': 'coxph', 'learning_rate': 0.021646224700130914, 'n_estimators': 728, 'criterion': 'friedman_mse', 'min_samples_split': 10, 'min_samples_leaf': 3, 'min_weight_fraction_leaf': 0.1573654480261921, 'min_impurity_decrease': 0.8912341451490265, 'max_features': 0.08459376293261874, 'subsample': 0.27514724294838416, 'dropout_rate': 0.3773104873225017, 'ccp_alpha': 0.16672622815819355}. Best is trial 218 with value: 0.6659976583847056.[0m
[32m[I 2022-04-22 22:30:00,530][0m Trial 464 finished with value: 0.6517083718923058 and parameters: {'loss': 'coxph', 'learning_rate': 0.07846894749231736, 'n_estimators': 445, 'criterion': 'friedman_mse', 'min_samples_split': 10, 'min_samples_leaf': 3, 'min_weight_fraction_leaf': 0.07031407984974919, 'min_impurity_decrease': 0.9575476588318187, 'max_features': 0.26385488837868, 'subsample': 0.29365428329757437, 'dropout_rate': 0.33755124954217064, 'ccp_alpha': 0.07772451556161539}. Best is trial 218 with value: 0.6659976583847056.[0m
[32m[I 2022-04-22 22:33:01,593][0m Trial 465 finished with value: 0.6520499064147836 and parameters: {'loss': 'coxph', 'learning_rate': 0.046911521992557756, 'n_estimators': 877, 'criterion': 'friedman_mse', 'min_samples_split': 10, 'min_samples_leaf': 3, 'min_weight_fraction_leaf': 0.05676722256858824, 'min_impurity_decrease': 0.855812052486943, 'max_features': 0.7946407605371931, 'subsample': 0.2583882874137718, 'dropout_rate': 0.20867212493509946, 'ccp_alpha': 0.09544764135566891}. Best is trial 218 with value: 0.6659976583847056.[0m
[32m[I 2022-04-22 22:34:02,576][0m Trial 466 finished with value: 0.6568653122505479 and parameters: {'loss': 'coxph', 'learning_rate': 0.05793792720567841, 'n_estimators': 495, 'criterion': 'friedman_mse', 'min_samples_split': 10, 'min_samples_leaf': 3, 'min_weight_fraction_leaf': 0.09949314723504424, 'min_impurity_decrease': 0.9258371610618984, 'max_features': 0.7248230359331752, 'subsample': 0.23025464750704122, 'dropout_rate': 0.2639561693482125, 'ccp_alpha': 0.0011308559140136652}. Best is trial 218 with value: 0.6659976583847056.[0m
[32m[I 2022-04-22 22:34:05,735][0m Trial 467 finished with value: 0.5135863708685152 and parameters: {'loss': 'coxph', 'learning_rate': 0.07805953910735396, 'n_estimators': 102, 'criterion': 'friedman_mse', 'min_samples_split': 10, 'min_samples_leaf': 3, 'min_weight_fraction_leaf': 0.033653636990100835, 'min_impurity_decrease': 0.9091313276436346, 'max_features': 0.5402902316550363, 'subsample': 0.32454654398451205, 'dropout_rate': 0.30165205221462876, 'ccp_alpha': 0.23654545360289103}. Best is trial 218 with value: 0.6659976583847056.[0m
[32m[I 2022-04-22 22:37:29,327][0m Trial 468 finished with value: 0.5 and parameters: {'loss': 'coxph', 'learning_rate': 0.015788559250312376, 'n_estimators': 940, 'criterion': 'friedman_mse', 'min_samples_split': 10, 'min_samples_leaf': 3, 'min_weight_fraction_leaf': 0.08373726240469263, 'min_impurity_decrease': 0.8747339193530165, 'max_features': 0.6002052216654945, 'subsample': 0.28312836083620313, 'dropout_rate': 0.23395318123149547, 'ccp_alpha': 1.1062983022231705}. Best is trial 218 with value: 0.6659976583847056.[0m
[32m[I 2022-04-22 22:39:57,650][0m Trial 469 finished with value: 0.6533426006634955 and parameters: {'loss': 'coxph', 'learning_rate': 0.038223806026434055, 'n_estimators': 755, 'criterion': 'friedman_mse', 'min_samples_split': 10, 'min_samples_leaf': 3, 'min_weight_fraction_leaf': 0.047001862211497436, 'min_impurity_decrease': 0.8935249591153696, 'max_features': 0.5697075552418969, 'subsample': 0.19962816998063526, 'dropout_rate': 0.19101041709348116, 'ccp_alpha': 0.00496283538327578}. Best is trial 218 with value: 0.6659976583847056.[0m
[32m[I 2022-04-22 22:42:38,946][0m Trial 470 finished with value: 0.6033579901449349 and parameters: {'loss': 'coxph', 'learning_rate': 0.026746424983604723, 'n_estimators': 823, 'criterion': 'friedman_mse', 'min_samples_split': 10, 'min_samples_leaf': 4, 'min_weight_fraction_leaf': 0.07548408844138453, 'min_impurity_decrease': 0.8237081844288333, 'max_features': 0.6855068538694283, 'subsample': 0.3837711720417817, 'dropout_rate': 0.22078930318528756, 'ccp_alpha': 0.16183064054826557}. Best is trial 218 with value: 0.6659976583847056.[0m
[32m[I 2022-04-22 22:44:13,744][0m Trial 471 finished with value: 0.5 and parameters: {'loss': 'coxph', 'learning_rate': 0.05642098799377842, 'n_estimators': 653, 'criterion': 'absolute_error', 'min_samples_split': 10, 'min_samples_leaf': 3, 'min_weight_fraction_leaf': 0.0625465455609399, 'min_impurity_decrease': 0.9406884534858869, 'max_features': 0.648804130107502, 'subsample': 0.30639003309773916, 'dropout_rate': 0.3162716293181905, 'ccp_alpha': 0.0033363828658957324}. Best is trial 218 with value: 0.6659976583847056.[0m
[32m[I 2022-04-22 22:45:05,825][0m Trial 472 finished with value: 0.5181150201957231 and parameters: {'loss': 'coxph', 'learning_rate': 0.08491602514135531, 'n_estimators': 527, 'criterion': 'friedman_mse', 'min_samples_split': 10, 'min_samples_leaf': 3, 'min_weight_fraction_leaf': 0.09168802490059041, 'min_impurity_decrease': 0.9626747705161195, 'max_features': 0.6217805045206662, 'subsample': 0.2532384895698433, 'dropout_rate': 0.40518414734659625, 'ccp_alpha': 0.33963179617996286}. Best is trial 218 with value: 0.6659976583847056.[0m
[32m[I 2022-04-22 22:45:54,720][0m Trial 473 finished with value: 0.6060291613277478 and parameters: {'loss': 'coxph', 'learning_rate': 0.06902359301015586, 'n_estimators': 462, 'criterion': 'friedman_mse', 'min_samples_split': 10, 'min_samples_leaf': 3, 'min_weight_fraction_leaf': 0.06921082294227965, 'min_impurity_decrease': 0.9183070376251921, 'max_features': 0.5163617230915507, 'subsample': 0.27553840586541356, 'dropout_rate': 0.252259774217495, 'ccp_alpha': 0.17383094960776763}. Best is trial 218 with value: 0.6659976583847056.[0m
/media/san2_ssd/data/Workdir/survival/venv/lib/python3.8/site-packages/sksurv/ensemble/boosting.py:955: RuntimeWarning: divide by zero encountered in log
  time = numpy.log(time)
/media/san2_ssd/data/Workdir/survival/venv/lib/python3.8/site-packages/sksurv/ensemble/boosting.py:955: RuntimeWarning: divide by zero encountered in log
  time = numpy.log(time)
/media/san2_ssd/data/Workdir/survival/venv/lib/python3.8/site-packages/sksurv/ensemble/boosting.py:955: RuntimeWarning: divide by zero encountered in log
  time = numpy.log(time)
/media/san2_ssd/data/Workdir/survival/venv/lib/python3.8/site-packages/sksurv/ensemble/boosting.py:955: RuntimeWarning: divide by zero encountered in log
  time = numpy.log(time)
[32m[I 2022-04-22 22:46:04,233][0m Trial 474 finished with value: -0.7343828604102715 and parameters: {'loss': 'squared', 'learning_rate': 4.77831620223705e-05, 'n_estimators': 482, 'criterion': 'friedman_mse', 'min_samples_split': 10, 'min_samples_leaf': 3, 'min_weight_fraction_leaf': 0.10599244938986402, 'min_impurity_decrease': 0.9752893519097474, 'max_features': 0.7413233742128339, 'subsample': 0.3501303226381464, 'dropout_rate': 0.3636198445933638, 'ccp_alpha': 0.09676508364677336}. Best is trial 218 with value: 0.6659976583847056.[0m
[32m[I 2022-04-22 22:47:06,188][0m Trial 475 finished with value: 0.6593775117465114 and parameters: {'loss': 'coxph', 'learning_rate': 0.0988312974059659, 'n_estimators': 516, 'criterion': 'friedman_mse', 'min_samples_split': 10, 'min_samples_leaf': 3, 'min_weight_fraction_leaf': 0.0804399409864754, 'min_impurity_decrease': 0.8857940025689728, 'max_features': 0.5553126639834334, 'subsample': 0.21723891170927917, 'dropout_rate': 0.2871752461703289, 'ccp_alpha': 0.0012265329145595204}. Best is trial 218 with value: 0.6659976583847056.[0m
[32m[I 2022-04-22 22:48:13,508][0m Trial 476 finished with value: 0.5623511703378433 and parameters: {'loss': 'coxph', 'learning_rate': 0.045864664482957125, 'n_estimators': 539, 'criterion': 'friedman_mse', 'min_samples_split': 10, 'min_samples_leaf': 3, 'min_weight_fraction_leaf': 0.05899739842344718, 'min_impurity_decrease': 0.8585233050347406, 'max_features': 0.7168531838455838, 'subsample': 0.29278737956874, 'dropout_rate': 0.24110346162328358, 'ccp_alpha': 0.25244444415484685}. Best is trial 218 with value: 0.6659976583847056.[0m
[32m[I 2022-04-22 22:49:07,790][0m Trial 477 finished with value: 0.6531088916105972 and parameters: {'loss': 'coxph', 'learning_rate': 0.03267002922318515, 'n_estimators': 491, 'criterion': 'friedman_mse', 'min_samples_split': 10, 'min_samples_leaf': 3, 'min_weight_fraction_leaf': 0.09116849867450173, 'min_impurity_decrease': 0.9037000460756365, 'max_features': 0.6777744206273634, 'subsample': 0.24035608109988615, 'dropout_rate': 0.34684560193281144, 'ccp_alpha': 0.0908264935302146}. Best is trial 218 with value: 0.6659976583847056.[0m
[32m[I 2022-04-22 22:49:58,608][0m Trial 478 finished with value: 0.5 and parameters: {'loss': 'coxph', 'learning_rate': 0.019116060561707747, 'n_estimators': 458, 'criterion': 'squared_error', 'min_samples_split': 10, 'min_samples_leaf': 4, 'min_weight_fraction_leaf': 0.07478038236459517, 'min_impurity_decrease': 0.9367286103892323, 'max_features': 0.5280283765847267, 'subsample': 0.32550909183156257, 'dropout_rate': 0.22031210477423668, 'ccp_alpha': 0.0018726932817201844}. Best is trial 218 with value: 0.6659976583847056.[0m
[32m[I 2022-04-22 22:51:01,680][0m Trial 479 finished with value: 0.5 and parameters: {'loss': 'coxph', 'learning_rate': 0.05384383002322223, 'n_estimators': 565, 'criterion': 'friedman_mse', 'min_samples_split': 10, 'min_samples_leaf': 3, 'min_weight_fraction_leaf': 0.05015057302365904, 'min_impurity_decrease': 0.3947665202508118, 'max_features': 0.5792418882976095, 'subsample': 0.26822223294882624, 'dropout_rate': 0.39469180824645544, 'ccp_alpha': 0.626801799068269}. Best is trial 218 with value: 0.6659976583847056.[0m
[32m[I 2022-04-22 22:52:20,988][0m Trial 480 finished with value: 0.6134586441284341 and parameters: {'loss': 'coxph', 'learning_rate': 0.06823302491240443, 'n_estimators': 594, 'criterion': 'friedman_mse', 'min_samples_split': 10, 'min_samples_leaf': 3, 'min_weight_fraction_leaf': 0.06650678539252526, 'min_impurity_decrease': 0.8417625037146484, 'max_features': 0.659952589222467, 'subsample': 0.310031222959912, 'dropout_rate': 0.27186384762402394, 'ccp_alpha': 0.1627566943074705}. Best is trial 218 with value: 0.6659976583847056.[0m
[32m[I 2022-04-22 22:55:33,352][0m Trial 481 finished with value: 0.5 and parameters: {'loss': 'coxph', 'learning_rate': 0.042128070992671025, 'n_estimators': 900, 'criterion': 'friedman_mse', 'min_samples_split': 4, 'min_samples_leaf': 3, 'min_weight_fraction_leaf': 0.08659208798990549, 'min_impurity_decrease': 0.921388515602695, 'max_features': 0.694019297300791, 'subsample': 0.5147338135925407, 'dropout_rate': 0.19792150238583262, 'ccp_alpha': 2.25098107683302}. Best is trial 218 with value: 0.6659976583847056.[0m
