[32m[I 2022-04-21 22:30:25,120][0m Trial 324 finished with value: 0.6784249696958414 and parameters: {'loss': 'coxph', 'learning_rate': 3.995077328555345e-05, 'n_estimators': 257, 'criterion': 'squared_error', 'min_samples_split': 7, 'min_samples_leaf': 10, 'min_weight_fraction_leaf': 0.1824166938406956, 'min_impurity_decrease': 0.1375491691293322, 'max_features': 0.9561571542675988, 'subsample': 0.2634811611948846, 'dropout_rate': 0.057224014484367924, 'ccp_alpha': 0.15942582885891793}. Best is trial 187 with value: 0.6933481836305168.[0m
[32m[I 2022-04-21 22:30:43,602][0m Trial 325 finished with value: 0.5413267380158759 and parameters: {'loss': 'coxph', 'learning_rate': 2.9317669724557774e-05, 'n_estimators': 301, 'criterion': 'squared_error', 'min_samples_split': 7, 'min_samples_leaf': 10, 'min_weight_fraction_leaf': 0.22402702262312932, 'min_impurity_decrease': 0.06196457334778505, 'max_features': 0.9155191401532351, 'subsample': 0.2880113825228959, 'dropout_rate': 0.08907335930684089, 'ccp_alpha': 0.5325101872892704}. Best is trial 187 with value: 0.6933481836305168.[0m
[32m[I 2022-04-21 22:31:15,491][0m Trial 326 finished with value: 0.6885222086516969 and parameters: {'loss': 'coxph', 'learning_rate': 0.00010725788061030854, 'n_estimators': 349, 'criterion': 'squared_error', 'min_samples_split': 7, 'min_samples_leaf': 10, 'min_weight_fraction_leaf': 0.19697756968340824, 'min_impurity_decrease': 0.08801388339418616, 'max_features': 0.9939378511112495, 'subsample': 0.2289696093893363, 'dropout_rate': 0.13288718522954152, 'ccp_alpha': 0.07806411682541052}. Best is trial 187 with value: 0.6933481836305168.[0m
[32m[I 2022-04-21 22:31:40,133][0m Trial 327 finished with value: 0.5 and parameters: {'loss': 'coxph', 'learning_rate': 0.0001036442302713661, 'n_estimators': 359, 'criterion': 'squared_error', 'min_samples_split': 7, 'min_samples_leaf': 9, 'min_weight_fraction_leaf': 0.19354005967508933, 'min_impurity_decrease': 0.09564592415553105, 'max_features': 0.9788065309540016, 'subsample': 0.22164726173215463, 'dropout_rate': 0.15151509716005418, 'ccp_alpha': 0.957745224668549}. Best is trial 187 with value: 0.6933481836305168.[0m
[32m[I 2022-04-21 22:32:06,993][0m Trial 328 finished with value: 0.6881455881162106 and parameters: {'loss': 'coxph', 'learning_rate': 0.00019096355831836397, 'n_estimators': 341, 'criterion': 'squared_error', 'min_samples_split': 7, 'min_samples_leaf': 6, 'min_weight_fraction_leaf': 0.170411875467406, 'min_impurity_decrease': 0.0846164025409622, 'max_features': 0.9943664105861818, 'subsample': 0.19748060413320068, 'dropout_rate': 0.16963947591708037, 'ccp_alpha': 0.004762379720620824}. Best is trial 187 with value: 0.6933481836305168.[0m
[32m[I 2022-04-21 22:32:35,732][0m Trial 329 finished with value: 0.6855777697025461 and parameters: {'loss': 'coxph', 'learning_rate': 0.00015092780552611483, 'n_estimators': 371, 'criterion': 'squared_error', 'min_samples_split': 7, 'min_samples_leaf': 2, 'min_weight_fraction_leaf': 0.16182596399801483, 'min_impurity_decrease': 0.12131073380044217, 'max_features': 0.9919918728090821, 'subsample': 0.18475369953894133, 'dropout_rate': 0.16544585191563546, 'ccp_alpha': 0.07472388695208779}. Best is trial 187 with value: 0.6933481836305168.[0m
[32m[I 2022-04-21 22:33:12,149][0m Trial 330 finished with value: 0.6892939524204629 and parameters: {'loss': 'coxph', 'learning_rate': 0.00019111065850428152, 'n_estimators': 398, 'criterion': 'squared_error', 'min_samples_split': 7, 'min_samples_leaf': 9, 'min_weight_fraction_leaf': 0.16974811886467123, 'min_impurity_decrease': 0.08457179523398209, 'max_features': 0.9946848508421339, 'subsample': 0.195627543092683, 'dropout_rate': 0.12473416047475744, 'ccp_alpha': 0.009057218369592432}. Best is trial 187 with value: 0.6933481836305168.[0m
[32m[I 2022-04-21 22:33:55,544][0m Trial 331 finished with value: 0.6876533036733143 and parameters: {'loss': 'coxph', 'learning_rate': 0.00019615492077212592, 'n_estimators': 461, 'criterion': 'squared_error', 'min_samples_split': 7, 'min_samples_leaf': 9, 'min_weight_fraction_leaf': 0.15582589108062475, 'min_impurity_decrease': 0.0958999958395891, 'max_features': 0.9988356927824914, 'subsample': 0.15519178357063965, 'dropout_rate': 0.1446905498974468, 'ccp_alpha': 0.00817336287702125}. Best is trial 187 with value: 0.6933481836305168.[0m
[32m[I 2022-04-21 22:34:37,884][0m Trial 332 finished with value: 0.688066605660859 and parameters: {'loss': 'coxph', 'learning_rate': 0.00019185098793509108, 'n_estimators': 403, 'criterion': 'squared_error', 'min_samples_split': 8, 'min_samples_leaf': 6, 'min_weight_fraction_leaf': 0.1690016479063038, 'min_impurity_decrease': 0.11996790650603495, 'max_features': 0.9952375286189534, 'subsample': 0.15590494427053725, 'dropout_rate': 0.17784040199013515, 'ccp_alpha': 0.19117000018829267}. Best is trial 187 with value: 0.6933481836305168.[0m
/media/san2_ssd/data/Workdir/survival/venv/lib/python3.8/site-packages/sksurv/ensemble/boosting.py:955: RuntimeWarning: divide by zero encountered in log
  time = numpy.log(time)
/media/san2_ssd/data/Workdir/survival/venv/lib/python3.8/site-packages/sksurv/ensemble/boosting.py:955: RuntimeWarning: divide by zero encountered in log
  time = numpy.log(time)
/media/san2_ssd/data/Workdir/survival/venv/lib/python3.8/site-packages/sksurv/ensemble/boosting.py:955: RuntimeWarning: divide by zero encountered in log
  time = numpy.log(time)
/media/san2_ssd/data/Workdir/survival/venv/lib/python3.8/site-packages/sksurv/ensemble/boosting.py:955: RuntimeWarning: divide by zero encountered in log
  time = numpy.log(time)
[32m[I 2022-04-21 22:34:49,451][0m Trial 333 finished with value: -0.7309394300370865 and parameters: {'loss': 'squared', 'learning_rate': 1.078256776709548e-06, 'n_estimators': 405, 'criterion': 'squared_error', 'min_samples_split': 7, 'min_samples_leaf': 9, 'min_weight_fraction_leaf': 0.1784037149196072, 'min_impurity_decrease': 0.08764393041273628, 'max_features': 0.9729321676888621, 'subsample': 0.18254505272418375, 'dropout_rate': 0.13079076239440585, 'ccp_alpha': 0.0048924197452123175}. Best is trial 187 with value: 0.6933481836305168.[0m
[32m[I 2022-04-21 22:35:21,167][0m Trial 334 finished with value: 0.5 and parameters: {'loss': 'coxph', 'learning_rate': 0.00025804126779613697, 'n_estimators': 376, 'criterion': 'squared_error', 'min_samples_split': 6, 'min_samples_leaf': 4, 'min_weight_fraction_leaf': 0.16940538167306232, 'min_impurity_decrease': 0.07539400461662911, 'max_features': 0.9954070181798428, 'subsample': 0.19473038489894945, 'dropout_rate': 0.1605126801235608, 'ccp_alpha': 1.4287413305964796}. Best is trial 187 with value: 0.6933481836305168.[0m
[32m[I 2022-04-21 22:35:57,401][0m Trial 335 finished with value: 0.5 and parameters: {'loss': 'coxph', 'learning_rate': 0.000230761562545245, 'n_estimators': 385, 'criterion': 'squared_error', 'min_samples_split': 7, 'min_samples_leaf': 9, 'min_weight_fraction_leaf': 0.15179776860868094, 'min_impurity_decrease': 0.11351549060713881, 'max_features': 0.971904821299398, 'subsample': 0.21143832370832122, 'dropout_rate': 0.13675291910358492, 'ccp_alpha': 3.483846976639921}. Best is trial 187 with value: 0.6933481836305168.[0m
[32m[I 2022-04-21 22:36:28,664][0m Trial 336 finished with value: 0.6735400176119255 and parameters: {'loss': 'coxph', 'learning_rate': 0.0003383591630193343, 'n_estimators': 354, 'criterion': 'squared_error', 'min_samples_split': 7, 'min_samples_leaf': 9, 'min_weight_fraction_leaf': 0.17603327488491938, 'min_impurity_decrease': 0.14268484922254096, 'max_features': 0.9704951950273215, 'subsample': 0.2006946090382606, 'dropout_rate': 0.12648509445976996, 'ccp_alpha': 0.23379034757686082}. Best is trial 187 with value: 0.6933481836305168.[0m
[32m[I 2022-04-21 22:37:04,085][0m Trial 337 finished with value: 0.6852950982156015 and parameters: {'loss': 'coxph', 'learning_rate': 0.00016911394388581551, 'n_estimators': 393, 'criterion': 'squared_error', 'min_samples_split': 7, 'min_samples_leaf': 5, 'min_weight_fraction_leaf': 0.18473177749533898, 'min_impurity_decrease': 0.08250565055117609, 'max_features': 0.998798587647865, 'subsample': 0.1798609913093623, 'dropout_rate': 0.11975796571078376, 'ccp_alpha': 0.09388045465878712}. Best is trial 187 with value: 0.6933481836305168.[0m
[32m[I 2022-04-21 22:37:32,970][0m Trial 338 finished with value: 0.5 and parameters: {'loss': 'coxph', 'learning_rate': 0.00024485669709782635, 'n_estimators': 347, 'criterion': 'squared_error', 'min_samples_split': 7, 'min_samples_leaf': 3, 'min_weight_fraction_leaf': 0.16143417658896195, 'min_impurity_decrease': 0.8929023418514905, 'max_features': 0.9616233015509503, 'subsample': 0.2232360210386954, 'dropout_rate': 0.3345562333620803, 'ccp_alpha': 0.009290313836494389}. Best is trial 187 with value: 0.6933481836305168.[0m
[32m[I 2022-04-21 22:38:14,408][0m Trial 339 finished with value: 0.6705147867324227 and parameters: {'loss': 'coxph', 'learning_rate': 0.0006099032587459319, 'n_estimators': 419, 'criterion': 'squared_error', 'min_samples_split': 7, 'min_samples_leaf': 9, 'min_weight_fraction_leaf': 0.19930136717584, 'min_impurity_decrease': 0.07742203047912705, 'max_features': 0.9834975538047285, 'subsample': 0.23237468105571046, 'dropout_rate': 0.17816249602642978, 'ccp_alpha': 0.3336245239010546}. Best is trial 187 with value: 0.6933481836305168.[0m
[32m[I 2022-04-21 22:38:43,429][0m Trial 340 finished with value: 0.6637865011237818 and parameters: {'loss': 'coxph', 'learning_rate': 0.0001354412336717772, 'n_estimators': 366, 'criterion': 'squared_error', 'min_samples_split': 8, 'min_samples_leaf': 9, 'min_weight_fraction_leaf': 0.1802532305989429, 'min_impurity_decrease': 0.096862090882638, 'max_features': 0.999894385156481, 'subsample': 0.12546088196574923, 'dropout_rate': 0.2710498051481076, 'ccp_alpha': 0.1471824938445503}. Best is trial 187 with value: 0.6933481836305168.[0m
[32m[I 2022-04-21 22:39:24,553][0m Trial 341 finished with value: 0.6864337351952289 and parameters: {'loss': 'coxph', 'learning_rate': 0.0001950110153000066, 'n_estimators': 457, 'criterion': 'squared_error', 'min_samples_split': 7, 'min_samples_leaf': 9, 'min_weight_fraction_leaf': 0.17054122761535612, 'min_impurity_decrease': 0.10434045298634663, 'max_features': 0.9614836604892691, 'subsample': 0.2399803370410601, 'dropout_rate': 0.29410362686966574, 'ccp_alpha': 0.195507596359489}. Best is trial 187 with value: 0.6933481836305168.[0m
[32m[I 2022-04-21 22:39:35,454][0m Trial 342 finished with value: 0.6886405728291671 and parameters: {'loss': 'coxph', 'learning_rate': 0.0003613170140753562, 'n_estimators': 239, 'criterion': 'absolute_error', 'min_samples_split': 7, 'min_samples_leaf': 10, 'min_weight_fraction_leaf': 0.18859319397103916, 'min_impurity_decrease': 0.06372566648548544, 'max_features': 0.9394807563646307, 'subsample': 0.2077256159056382, 'dropout_rate': 0.19473218576669973, 'ccp_alpha': 0.0012884052836860532}. Best is trial 187 with value: 0.6933481836305168.[0m
[32m[I 2022-04-21 22:39:45,434][0m Trial 343 finished with value: 0.6776950240386322 and parameters: {'loss': 'coxph', 'learning_rate': 0.00035625551123136484, 'n_estimators': 224, 'criterion': 'squared_error', 'min_samples_split': 7, 'min_samples_leaf': 10, 'min_weight_fraction_leaf': 0.20092534052816813, 'min_impurity_decrease': 0.08042890654738408, 'max_features': 0.9370193733587759, 'subsample': 0.1712141237094705, 'dropout_rate': 0.20238811184737093, 'ccp_alpha': 0.0057085775579667425}. Best is trial 187 with value: 0.6933481836305168.[0m
[32m[I 2022-04-21 22:39:58,418][0m Trial 344 finished with value: 0.6127568729131793 and parameters: {'loss': 'coxph', 'learning_rate': 0.0002996361229845094, 'n_estimators': 210, 'criterion': 'absolute_error', 'min_samples_split': 7, 'min_samples_leaf': 10, 'min_weight_fraction_leaf': 0.19064562099407567, 'min_impurity_decrease': 0.06293275112584282, 'max_features': 0.9436191431195067, 'subsample': 0.9996735087362244, 'dropout_rate': 0.1829157700325177, 'ccp_alpha': 0.0010255199920539183}. Best is trial 187 with value: 0.6933481836305168.[0m
[32m[I 2022-04-21 22:40:13,055][0m Trial 345 finished with value: 0.6693548841287592 and parameters: {'loss': 'coxph', 'learning_rate': 0.0002776667145389657, 'n_estimators': 238, 'criterion': 'absolute_error', 'min_samples_split': 4, 'min_samples_leaf': 9, 'min_weight_fraction_leaf': 0.20575896264493565, 'min_impurity_decrease': 0.12814394504942891, 'max_features': 0.9285549462376159, 'subsample': 0.20240097669451196, 'dropout_rate': 0.1432610589806046, 'ccp_alpha': 0.09543206523899116}. Best is trial 187 with value: 0.6933481836305168.[0m
[32m[I 2022-04-21 22:40:55,571][0m Trial 346 finished with value: 0.5 and parameters: {'loss': 'coxph', 'learning_rate': 0.0005456550356971397, 'n_estimators': 436, 'criterion': 'absolute_error', 'min_samples_split': 7, 'min_samples_leaf': 10, 'min_weight_fraction_leaf': 0.18331822392337074, 'min_impurity_decrease': 0.3539710325758989, 'max_features': 0.9574464974320422, 'subsample': 0.22451976361906156, 'dropout_rate': 0.19898288100939043, 'ccp_alpha': 3.8900930764763424}. Best is trial 187 with value: 0.6933481836305168.[0m
[32m[I 2022-04-21 22:41:14,115][0m Trial 347 finished with value: 0.678828170161717 and parameters: {'loss': 'coxph', 'learning_rate': 0.00037321471248470315, 'n_estimators': 247, 'criterion': 'squared_error', 'min_samples_split': 6, 'min_samples_leaf': 10, 'min_weight_fraction_leaf': 0.16122515650398142, 'min_impurity_decrease': 0.0652873074570668, 'max_features': 0.8711787694732165, 'subsample': 0.19426602402332294, 'dropout_rate': 0.15749635535654796, 'ccp_alpha': 0.0865572360338615}. Best is trial 187 with value: 0.6933481836305168.[0m
[32m[I 2022-04-21 22:41:28,494][0m Trial 348 finished with value: 0.5 and parameters: {'loss': 'coxph', 'learning_rate': 0.00016190731202006962, 'n_estimators': 264, 'criterion': 'absolute_error', 'min_samples_split': 7, 'min_samples_leaf': 10, 'min_weight_fraction_leaf': 0.22847034264255858, 'min_impurity_decrease': 0.5401202092930878, 'max_features': 0.9437044904166019, 'subsample': 0.144657450592795, 'dropout_rate': 0.14430654899010376, 'ccp_alpha': 0.30788579907449665}. Best is trial 187 with value: 0.6933481836305168.[0m
[32m[I 2022-04-21 22:41:44,399][0m Trial 349 finished with value: 0.6688712045138653 and parameters: {'loss': 'coxph', 'learning_rate': 0.0002311650641447483, 'n_estimators': 232, 'criterion': 'absolute_error', 'min_samples_split': 7, 'min_samples_leaf': 9, 'min_weight_fraction_leaf': 0.19660450128769477, 'min_impurity_decrease': 0.1576601122607244, 'max_features': 0.8885475859153074, 'subsample': 0.2136172499977098, 'dropout_rate': 0.11041881941287562, 'ccp_alpha': 0.15543263868884938}. Best is trial 187 with value: 0.6933481836305168.[0m
[32m[I 2022-04-21 22:42:00,755][0m Trial 350 finished with value: 0.6791560810641406 and parameters: {'loss': 'coxph', 'learning_rate': 0.0007484484531990957, 'n_estimators': 239, 'criterion': 'absolute_error', 'min_samples_split': 7, 'min_samples_leaf': 10, 'min_weight_fraction_leaf': 0.21702472504386816, 'min_impurity_decrease': 0.09330268027626906, 'max_features': 0.846987934690119, 'subsample': 0.24769594153532895, 'dropout_rate': 0.19027784972355807, 'ccp_alpha': 0.10117322670305773}. Best is trial 187 with value: 0.6933481836305168.[0m
[32m[I 2022-04-21 22:42:35,175][0m Trial 351 finished with value: 0.6790627627619309 and parameters: {'loss': 'coxph', 'learning_rate': 9.236832031722506e-05, 'n_estimators': 336, 'criterion': 'absolute_error', 'min_samples_split': 7, 'min_samples_leaf': 6, 'min_weight_fraction_leaf': 0.17586772575493698, 'min_impurity_decrease': 0.1077359756595584, 'max_features': 0.9210067767157054, 'subsample': 0.23773404190006142, 'dropout_rate': 0.16291112448756748, 'ccp_alpha': 0.0029164796536833293}. Best is trial 187 with value: 0.6933481836305168.[0m
[32m[I 2022-04-21 22:42:47,052][0m Trial 352 finished with value: 0.6698387758916226 and parameters: {'loss': 'coxph', 'learning_rate': 0.00011999268128207343, 'n_estimators': 251, 'criterion': 'squared_error', 'min_samples_split': 7, 'min_samples_leaf': 10, 'min_weight_fraction_leaf': 0.2055306960598871, 'min_impurity_decrease': 0.05268245412415651, 'max_features': 0.897818334232561, 'subsample': 0.20902596510327964, 'dropout_rate': 0.21813674881489162, 'ccp_alpha': 0.2671720132028591}. Best is trial 187 with value: 0.6933481836305168.[0m
/media/san2_ssd/data/Workdir/survival/venv/lib/python3.8/site-packages/sksurv/ensemble/boosting.py:955: RuntimeWarning: divide by zero encountered in log
  time = numpy.log(time)
/media/san2_ssd/data/Workdir/survival/venv/lib/python3.8/site-packages/sksurv/ensemble/boosting.py:955: RuntimeWarning: divide by zero encountered in log
  time = numpy.log(time)
/media/san2_ssd/data/Workdir/survival/venv/lib/python3.8/site-packages/sksurv/ensemble/boosting.py:955: RuntimeWarning: divide by zero encountered in log
  time = numpy.log(time)
/media/san2_ssd/data/Workdir/survival/venv/lib/python3.8/site-packages/sksurv/ensemble/boosting.py:955: RuntimeWarning: divide by zero encountered in log
  time = numpy.log(time)
[32m[I 2022-04-21 22:42:49,963][0m Trial 353 finished with value: -0.7279070265991173 and parameters: {'loss': 'squared', 'learning_rate': 0.0003994224359259857, 'n_estimators': 277, 'criterion': 'squared_error', 'min_samples_split': 7, 'min_samples_leaf': 10, 'min_weight_fraction_leaf': 0.24311494304188178, 'min_impurity_decrease': 0.0745058227343127, 'max_features': 0.0379441247530527, 'subsample': 0.25560630922052896, 'dropout_rate': 0.12679157268438424, 'ccp_alpha': 0.4114639797344281}. Best is trial 187 with value: 0.6933481836305168.[0m
[32m[I 2022-04-21 22:42:52,265][0m Trial 354 finished with value: 0.5541488513016184 and parameters: {'loss': 'coxph', 'learning_rate': 0.0003198461263155388, 'n_estimators': 111, 'criterion': 'squared_error', 'min_samples_split': 6, 'min_samples_leaf': 9, 'min_weight_fraction_leaf': 0.18984012901746058, 'min_impurity_decrease': 0.582869959084319, 'max_features': 0.9667208366712822, 'subsample': 0.25369002621680603, 'dropout_rate': 0.2643456639101741, 'ccp_alpha': 0.17967683812720303}. Best is trial 187 with value: 0.6933481836305168.[0m
[32m[I 2022-04-21 22:43:20,180][0m Trial 355 finished with value: 0.6837559735730173 and parameters: {'loss': 'coxph', 'learning_rate': 0.00021196701580336144, 'n_estimators': 346, 'criterion': 'squared_error', 'min_samples_split': 8, 'min_samples_leaf': 10, 'min_weight_fraction_leaf': 0.22154154070613064, 'min_impurity_decrease': 0.1284118258560623, 'max_features': 0.9471857647622401, 'subsample': 0.22811103037454922, 'dropout_rate': 0.10614757714499057, 'ccp_alpha': 0.09852180239251829}. Best is trial 187 with value: 0.6933481836305168.[0m
[32m[I 2022-04-21 22:43:53,844][0m Trial 356 finished with value: 0.6740239093747888 and parameters: {'loss': 'coxph', 'learning_rate': 0.00013538805906479568, 'n_estimators': 366, 'criterion': 'squared_error', 'min_samples_split': 7, 'min_samples_leaf': 9, 'min_weight_fraction_leaf': 0.20986750396566128, 'min_impurity_decrease': 0.0486780349878053, 'max_features': 0.977100583634658, 'subsample': 0.1396270027386369, 'dropout_rate': 0.017974571217152728, 'ccp_alpha': 0.2188015868481531}. Best is trial 187 with value: 0.6933481836305168.[0m
[32m[I 2022-04-21 22:44:06,753][0m Trial 357 finished with value: 0.5 and parameters: {'loss': 'coxph', 'learning_rate': 0.0005499477604684106, 'n_estimators': 220, 'criterion': 'squared_error', 'min_samples_split': 7, 'min_samples_leaf': 10, 'min_weight_fraction_leaf': 0.16811208504990477, 'min_impurity_decrease': 0.07332378720713213, 'max_features': 0.692640019731213, 'subsample': 0.17070077074536236, 'dropout_rate': 0.31820159675592885, 'ccp_alpha': 4.446947227370986}. Best is trial 187 with value: 0.6933481836305168.[0m
[32m[I 2022-04-21 22:44:33,959][0m Trial 358 finished with value: 0.6883242479347019 and parameters: {'loss': 'coxph', 'learning_rate': 0.001066918022446437, 'n_estimators': 285, 'criterion': 'squared_error', 'min_samples_split': 7, 'min_samples_leaf': 10, 'min_weight_fraction_leaf': 0.19919166193147428, 'min_impurity_decrease': 0.10002667675135217, 'max_features': 0.6562535566861856, 'subsample': 0.2670925620338624, 'dropout_rate': 0.16006766006731188, 'ccp_alpha': 0.0017043001255136177}. Best is trial 187 with value: 0.6933481836305168.[0m
[32m[I 2022-04-21 22:44:51,194][0m Trial 359 finished with value: 0.6700225282388775 and parameters: {'loss': 'coxph', 'learning_rate': 0.0007813983105699794, 'n_estimators': 266, 'criterion': 'absolute_error', 'min_samples_split': 7, 'min_samples_leaf': 10, 'min_weight_fraction_leaf': 0.1995979055998786, 'min_impurity_decrease': 0.12077600810371528, 'max_features': 0.8601523224587563, 'subsample': 0.26584432939427194, 'dropout_rate': 0.13186398225568613, 'ccp_alpha': 0.0886460182942916}. Best is trial 187 with value: 0.6933481836305168.[0m
[32m[I 2022-04-21 22:45:19,686][0m Trial 360 finished with value: 0.6656696814830418 and parameters: {'loss': 'coxph', 'learning_rate': 0.0015799955713817404, 'n_estimators': 291, 'criterion': 'squared_error', 'min_samples_split': 7, 'min_samples_leaf': 10, 'min_weight_fraction_leaf': 0.21341660515052718, 'min_impurity_decrease': 0.14519239728148345, 'max_features': 0.7175163179125803, 'subsample': 0.29749387784510384, 'dropout_rate': 0.10502983171207082, 'ccp_alpha': 0.2769284041690212}. Best is trial 187 with value: 0.6933481836305168.[0m
