[32m[I 2022-04-21 11:46:39,252][0m Trial 399 finished with value: 0.6134992940754854 and parameters: {'splitter': 'best', 'min_samples_split': 0.09398260572866453, 'min_samples_leaf': 0.015377893113948278, 'min_weight_fraction_leaf': 0.02557476508931639, 'max_features': 0.7697717004644286}. Best is trial 203 with value: 0.6541339470014573.[0m
[32m[I 2022-04-21 11:46:39,848][0m Trial 400 finished with value: 0.6346939102808162 and parameters: {'splitter': 'best', 'min_samples_split': 0.1531007900549455, 'min_samples_leaf': 0.009111348319718288, 'min_weight_fraction_leaf': 0.007788257993202419, 'max_features': 0.5919880730284042}. Best is trial 203 with value: 0.6541339470014573.[0m
[32m[I 2022-04-21 11:46:40,338][0m Trial 401 finished with value: 0.622578896977265 and parameters: {'splitter': 'best', 'min_samples_split': 0.1625976131382718, 'min_samples_leaf': 0.0011244798657358886, 'min_weight_fraction_leaf': 0.01699488323078824, 'max_features': 0.6378454311290696}. Best is trial 203 with value: 0.6541339470014573.[0m
[32m[I 2022-04-21 11:46:40,680][0m Trial 402 finished with value: 0.631922101246029 and parameters: {'splitter': 'best', 'min_samples_split': 0.14001921216895305, 'min_samples_leaf': 0.025721081184538933, 'min_weight_fraction_leaf': 0.007924312166302684, 'max_features': 0.6552430407605973}. Best is trial 203 with value: 0.6541339470014573.[0m
[32m[I 2022-04-21 11:46:41,005][0m Trial 403 finished with value: 0.6228288535111742 and parameters: {'splitter': 'best', 'min_samples_split': 0.11982842152430641, 'min_samples_leaf': 0.04019786212920637, 'min_weight_fraction_leaf': 0.03995600020396898, 'max_features': 0.6090757512150605}. Best is trial 203 with value: 0.6541339470014573.[0m
[32m[I 2022-04-21 11:46:41,503][0m Trial 404 finished with value: 0.6338111104608288 and parameters: {'splitter': 'best', 'min_samples_split': 0.13995518436360407, 'min_samples_leaf': 0.017283636540266815, 'min_weight_fraction_leaf': 0.025723168614850748, 'max_features': 0.5494348256080381}. Best is trial 203 with value: 0.6541339470014573.[0m
[32m[I 2022-04-21 11:46:41,929][0m Trial 405 finished with value: 0.6153514765755157 and parameters: {'splitter': 'best', 'min_samples_split': 0.15109102681989325, 'min_samples_leaf': 0.02696533791526603, 'min_weight_fraction_leaf': 0.01625960468199096, 'max_features': 0.669816919744689}. Best is trial 203 with value: 0.6541339470014573.[0m
[32m[I 2022-04-21 11:46:42,554][0m Trial 406 finished with value: 0.6291290196726494 and parameters: {'splitter': 'best', 'min_samples_split': 0.16755522372582402, 'min_samples_leaf': 0.010558266504429278, 'min_weight_fraction_leaf': 0.008632726813133275, 'max_features': 0.6301946791189529}. Best is trial 203 with value: 0.6541339470014573.[0m
[32m[I 2022-04-21 11:46:43,269][0m Trial 407 finished with value: 0.6469485197126681 and parameters: {'splitter': 'best', 'min_samples_split': 0.12688978498811207, 'min_samples_leaf': 0.018200385911777077, 'min_weight_fraction_leaf': 1.969210557809485e-05, 'max_features': 0.7394163767282139}. Best is trial 203 with value: 0.6541339470014573.[0m
[32m[I 2022-04-21 11:46:44,131][0m Trial 408 finished with value: 0.6410954147858063 and parameters: {'splitter': 'best', 'min_samples_split': 0.11960588201769401, 'min_samples_leaf': 0.009205421045938083, 'min_weight_fraction_leaf': 0.0007700968572911226, 'max_features': 0.7348922271071331}. Best is trial 203 with value: 0.6541339470014573.[0m
[32m[I 2022-04-21 11:46:44,829][0m Trial 409 finished with value: 0.6457663360454544 and parameters: {'splitter': 'best', 'min_samples_split': 0.10166369476608254, 'min_samples_leaf': 0.0011730116582500637, 'min_weight_fraction_leaf': 0.020976905861513614, 'max_features': 0.7645144089198156}. Best is trial 203 with value: 0.6541339470014573.[0m
[32m[I 2022-04-21 11:46:45,654][0m Trial 410 finished with value: 0.6304541859246309 and parameters: {'splitter': 'best', 'min_samples_split': 0.09381066865970802, 'min_samples_leaf': 0.007217818685327064, 'min_weight_fraction_leaf': 0.03258916322870536, 'max_features': 0.7889675549983576}. Best is trial 203 with value: 0.6541339470014573.[0m
[32m[I 2022-04-21 11:46:46,575][0m Trial 411 finished with value: 0.6442202864695106 and parameters: {'splitter': 'best', 'min_samples_split': 0.10464795258157383, 'min_samples_leaf': 0.0014657639567223716, 'min_weight_fraction_leaf': 0.02273207703646282, 'max_features': 0.7630243068227605}. Best is trial 203 with value: 0.6541339470014573.[0m
[32m[I 2022-04-21 11:46:46,663][0m Trial 412 finished with value: 0.506214055937101 and parameters: {'splitter': 'best', 'min_samples_split': 0.10333878242029344, 'min_samples_leaf': 0.49918647241430036, 'min_weight_fraction_leaf': 0.04450474112233776, 'max_features': 0.7683251477013953}. Best is trial 203 with value: 0.6541339470014573.[0m
[32m[I 2022-04-21 11:46:47,306][0m Trial 413 finished with value: 0.6338905046976888 and parameters: {'splitter': 'best', 'min_samples_split': 0.08575273276343982, 'min_samples_leaf': 0.0015245191654132788, 'min_weight_fraction_leaf': 0.025764953126226852, 'max_features': 0.8009978985384874}. Best is trial 203 with value: 0.6541339470014573.[0m
[32m[I 2022-04-21 11:46:47,896][0m Trial 414 finished with value: 0.6058025312172948 and parameters: {'splitter': 'best', 'min_samples_split': 0.09916734972402269, 'min_samples_leaf': 0.01982973512602255, 'min_weight_fraction_leaf': 3.233580601730459e-05, 'max_features': 0.7660249577663676}. Best is trial 203 with value: 0.6541339470014573.[0m
[32m[I 2022-04-21 11:46:49,026][0m Trial 415 finished with value: 0.6068620274434393 and parameters: {'splitter': 'best', 'min_samples_split': 0.11282327492208574, 'min_samples_leaf': 0.010450682791982272, 'min_weight_fraction_leaf': 0.054909691448895834, 'max_features': 0.7455304582452708}. Best is trial 203 with value: 0.6541339470014573.[0m
[32m[I 2022-04-21 11:46:49,873][0m Trial 416 finished with value: 0.6328314367147081 and parameters: {'splitter': 'best', 'min_samples_split': 0.10146329887430657, 'min_samples_leaf': 0.0299330565388909, 'min_weight_fraction_leaf': 0.02289030740835321, 'max_features': 0.7705552119397308}. Best is trial 203 with value: 0.6541339470014573.[0m
[32m[I 2022-04-21 11:46:51,075][0m Trial 417 finished with value: 0.6233147590224425 and parameters: {'splitter': 'best', 'min_samples_split': 0.11062851906677616, 'min_samples_leaf': 0.009806577600847894, 'min_weight_fraction_leaf': 0.03796751696445489, 'max_features': 0.7564879545116826}. Best is trial 203 with value: 0.6541339470014573.[0m
[32m[I 2022-04-21 11:46:52,015][0m Trial 418 finished with value: 0.6324978922811011 and parameters: {'splitter': 'best', 'min_samples_split': 0.12433927381595147, 'min_samples_leaf': 0.021435552910568454, 'min_weight_fraction_leaf': 0.019673416795109804, 'max_features': 0.7932056407011346}. Best is trial 203 with value: 0.6541339470014573.[0m
[32m[I 2022-04-21 11:46:52,583][0m Trial 419 finished with value: 0.6446693719129806 and parameters: {'splitter': 'best', 'min_samples_split': 0.0776239338563005, 'min_samples_leaf': 0.0014463869185319866, 'min_weight_fraction_leaf': 0.02963984990516528, 'max_features': 0.7280622944364542}. Best is trial 203 with value: 0.6541339470014573.[0m
[32m[I 2022-04-21 11:46:52,946][0m Trial 420 finished with value: 0.6102463101463724 and parameters: {'splitter': 'best', 'min_samples_split': 0.08261896285811257, 'min_samples_leaf': 0.003736173344496392, 'min_weight_fraction_leaf': 0.16538474560256042, 'max_features': 0.7526089295377622}. Best is trial 203 with value: 0.6541339470014573.[0m
[32m[I 2022-04-21 11:46:53,822][0m Trial 421 finished with value: 0.6142344796286661 and parameters: {'splitter': 'best', 'min_samples_split': 0.07377828113055834, 'min_samples_leaf': 0.0018484019778275008, 'min_weight_fraction_leaf': 0.03266032737906221, 'max_features': 0.8116573891223984}. Best is trial 203 with value: 0.6541339470014573.[0m
[32m[I 2022-04-21 11:46:54,572][0m Trial 422 finished with value: 0.6445216242851097 and parameters: {'splitter': 'best', 'min_samples_split': 0.1067077937121736, 'min_samples_leaf': 0.00202781951420524, 'min_weight_fraction_leaf': 0.02984444513263458, 'max_features': 0.7318405513587551}. Best is trial 203 with value: 0.6541339470014573.[0m
[32m[I 2022-04-21 11:46:55,242][0m Trial 423 finished with value: 0.6123578909527583 and parameters: {'splitter': 'best', 'min_samples_split': 0.09854633227678582, 'min_samples_leaf': 0.0017153738622067947, 'min_weight_fraction_leaf': 0.04157746089459041, 'max_features': 0.7540119434311326}. Best is trial 203 with value: 0.6541339470014573.[0m
[32m[I 2022-04-21 11:46:55,707][0m Trial 424 finished with value: 0.611803599944373 and parameters: {'splitter': 'best', 'min_samples_split': 0.09138699689745272, 'min_samples_leaf': 0.016218752712696977, 'min_weight_fraction_leaf': 0.05333002627678286, 'max_features': 0.7297085168728537}. Best is trial 203 with value: 0.6541339470014573.[0m
[32m[I 2022-04-21 11:46:56,283][0m Trial 425 finished with value: 0.6143357043280984 and parameters: {'splitter': 'best', 'min_samples_split': 0.11377390074762404, 'min_samples_leaf': 0.02508187668260809, 'min_weight_fraction_leaf': 0.03221234862624534, 'max_features': 0.7803475580458638}. Best is trial 203 with value: 0.6541339470014573.[0m
[32m[I 2022-04-21 11:46:56,388][0m Trial 426 finished with value: 0.5416965513976884 and parameters: {'splitter': 'best', 'min_samples_split': 0.1275179649313931, 'min_samples_leaf': 0.3062222183906338, 'min_weight_fraction_leaf': 0.027165402770634894, 'max_features': 0.7397340336704772}. Best is trial 203 with value: 0.6541339470014573.[0m
[32m[I 2022-04-21 11:46:57,204][0m Trial 427 finished with value: 0.6308717736153069 and parameters: {'splitter': 'best', 'min_samples_split': 0.09057601128205463, 'min_samples_leaf': 0.015492137506042773, 'min_weight_fraction_leaf': 0.04269211415169538, 'max_features': 0.8316808095329707}. Best is trial 203 with value: 0.6541339470014573.[0m
[32m[I 2022-04-21 11:46:58,109][0m Trial 428 finished with value: 0.6323856803264405 and parameters: {'splitter': 'best', 'min_samples_split': 0.07928775407071159, 'min_samples_leaf': 0.0012402249360197568, 'min_weight_fraction_leaf': 0.03275071792674295, 'max_features': 0.7311328092989758}. Best is trial 203 with value: 0.6541339470014573.[0m
[32m[I 2022-04-21 11:46:58,800][0m Trial 429 finished with value: 0.6255784954269322 and parameters: {'splitter': 'best', 'min_samples_split': 0.11029999942014058, 'min_samples_leaf': 0.001315016321809321, 'min_weight_fraction_leaf': 0.02171310479793022, 'max_features': 0.7704616300932134}. Best is trial 203 with value: 0.6541339470014573.[0m
[32m[I 2022-04-21 11:46:59,409][0m Trial 430 finished with value: 0.6210161267703419 and parameters: {'splitter': 'best', 'min_samples_split': 0.10277829325293573, 'min_samples_leaf': 0.0319690547130475, 'min_weight_fraction_leaf': 0.022006602370682724, 'max_features': 0.7205063142448901}. Best is trial 203 with value: 0.6541339470014573.[0m
[32m[I 2022-04-21 11:46:59,721][0m Trial 431 finished with value: 0.5228221887466992 and parameters: {'splitter': 'best', 'min_samples_split': 0.1201336951659765, 'min_samples_leaf': 0.017165925015689823, 'min_weight_fraction_leaf': 0.48081584026387836, 'max_features': 0.754345528463638}. Best is trial 203 with value: 0.6541339470014573.[0m
[32m[I 2022-04-21 11:47:00,447][0m Trial 432 finished with value: 0.6360040719998423 and parameters: {'splitter': 'best', 'min_samples_split': 0.13021339192112072, 'min_samples_leaf': 0.010920821254810805, 'min_weight_fraction_leaf': 0.01812155147702834, 'max_features': 0.5267744387983352}. Best is trial 203 with value: 0.6541339470014573.[0m
[32m[I 2022-04-21 11:47:00,960][0m Trial 433 finished with value: 0.6254297799680831 and parameters: {'splitter': 'best', 'min_samples_split': 0.1079352101109406, 'min_samples_leaf': 0.023791709926288106, 'min_weight_fraction_leaf': 0.03359973657643302, 'max_features': 0.5659752640979295}. Best is trial 203 with value: 0.6541339470014573.[0m
[32m[I 2022-04-21 11:47:01,484][0m Trial 434 finished with value: 0.6166067678288327 and parameters: {'splitter': 'best', 'min_samples_split': 0.1358178699931719, 'min_samples_leaf': 0.036277329568622486, 'min_weight_fraction_leaf': 0.046123122817262545, 'max_features': 0.7868854586995179}. Best is trial 203 with value: 0.6541339470014573.[0m
[32m[I 2022-04-21 11:47:02,302][0m Trial 435 finished with value: 0.6476024145734076 and parameters: {'splitter': 'best', 'min_samples_split': 0.11793336085821632, 'min_samples_leaf': 0.0014063654942885232, 'min_weight_fraction_leaf': 0.015689311306831454, 'max_features': 0.5880056315066269}. Best is trial 203 with value: 0.6541339470014573.[0m
[32m[I 2022-04-21 11:47:03,229][0m Trial 436 finished with value: 0.6339761026556789 and parameters: {'splitter': 'best', 'min_samples_split': 0.08714615278822103, 'min_samples_leaf': 0.0012526305107659376, 'min_weight_fraction_leaf': 0.029922873544756867, 'max_features': 0.5840601876363579}. Best is trial 203 with value: 0.6541339470014573.[0m
[32m[I 2022-04-21 11:47:03,809][0m Trial 437 finished with value: 0.6533825795151853 and parameters: {'splitter': 'best', 'min_samples_split': 0.11907453951035278, 'min_samples_leaf': 0.013123706985968096, 'min_weight_fraction_leaf': 0.017024268426719634, 'max_features': 0.5970725497404784}. Best is trial 203 with value: 0.6541339470014573.[0m
[32m[I 2022-04-21 11:47:04,292][0m Trial 438 finished with value: 0.6335746629174643 and parameters: {'splitter': 'best', 'min_samples_split': 0.1178806354427822, 'min_samples_leaf': 0.018106480314855896, 'min_weight_fraction_leaf': 0.02346137194987801, 'max_features': 0.5685478697174708}. Best is trial 203 with value: 0.6541339470014573.[0m
[32m[I 2022-04-21 11:47:04,694][0m Trial 439 finished with value: 0.6109939683233692 and parameters: {'splitter': 'best', 'min_samples_split': 0.10747995247227317, 'min_samples_leaf': 0.0016214762875163252, 'min_weight_fraction_leaf': 0.03800879644798985, 'max_features': 0.5899610143352602}. Best is trial 203 with value: 0.6541339470014573.[0m
[32m[I 2022-04-21 11:47:05,133][0m Trial 440 finished with value: 0.6359052546326704 and parameters: {'splitter': 'best', 'min_samples_split': 0.11485023849441041, 'min_samples_leaf': 0.022222770610223833, 'min_weight_fraction_leaf': 0.013701841115551098, 'max_features': 0.5540234750460522}. Best is trial 203 with value: 0.6541339470014573.[0m
[32m[I 2022-04-21 11:47:05,541][0m Trial 441 finished with value: 0.6064313173586496 and parameters: {'splitter': 'best', 'min_samples_split': 0.09752038650178502, 'min_samples_leaf': 0.042774183575152336, 'min_weight_fraction_leaf': 0.01868929684170477, 'max_features': 0.6021253822592469}. Best is trial 203 with value: 0.6541339470014573.[0m
[32m[I 2022-04-21 11:47:06,055][0m Trial 442 finished with value: 0.637775505916088 and parameters: {'splitter': 'best', 'min_samples_split': 0.12210584904903612, 'min_samples_leaf': 0.013331641596365813, 'min_weight_fraction_leaf': 0.02851954184789584, 'max_features': 0.5760505884911912}. Best is trial 203 with value: 0.6541339470014573.[0m
[32m[I 2022-04-21 11:47:06,406][0m Trial 443 finished with value: 0.6344458476505073 and parameters: {'splitter': 'best', 'min_samples_split': 0.12776976150322172, 'min_samples_leaf': 0.0288800101422632, 'min_weight_fraction_leaf': 0.009039181236011188, 'max_features': 0.5417494784000629}. Best is trial 203 with value: 0.6541339470014573.[0m
[32m[I 2022-04-21 11:47:06,738][0m Trial 444 finished with value: 0.6341956730802215 and parameters: {'splitter': 'best', 'min_samples_split': 0.1072320003117287, 'min_samples_leaf': 0.01249144681696642, 'min_weight_fraction_leaf': 0.016338845471231777, 'max_features': 0.4914078756952064}. Best is trial 203 with value: 0.6541339470014573.[0m
[32m[I 2022-04-21 11:47:06,818][0m Trial 445 finished with value: 0.5418478284568928 and parameters: {'splitter': 'best', 'min_samples_split': 0.1188455095358207, 'min_samples_leaf': 0.26170274879222594, 'min_weight_fraction_leaf': 0.02541432235414637, 'max_features': 0.5930643391502439}. Best is trial 203 with value: 0.6541339470014573.[0m
[32m[I 2022-04-21 11:47:07,148][0m Trial 446 finished with value: 0.6360870379439391 and parameters: {'splitter': 'best', 'min_samples_split': 0.13138648203835315, 'min_samples_leaf': 0.023756367364353596, 'min_weight_fraction_leaf': 0.00020366546713881765, 'max_features': 0.6047005686237664}. Best is trial 203 with value: 0.6541339470014573.[0m
[32m[I 2022-04-21 11:47:07,213][0m Trial 447 finished with value: 0.5358564240914311 and parameters: {'splitter': 'best', 'min_samples_split': 0.06425880047051971, 'min_samples_leaf': 0.39653556936880774, 'min_weight_fraction_leaf': 0.04894635418750562, 'max_features': 0.6145850792474908}. Best is trial 203 with value: 0.6541339470014573.[0m
[32m[I 2022-04-21 11:47:07,761][0m Trial 448 finished with value: 0.6414556661976705 and parameters: {'splitter': 'best', 'min_samples_split': 0.1020959796504345, 'min_samples_leaf': 0.010608335426021385, 'min_weight_fraction_leaf': 0.009695432103608508, 'max_features': 0.5701460583883816}. Best is trial 203 with value: 0.6541339470014573.[0m
[32m[I 2022-04-21 11:47:08,247][0m Trial 449 finished with value: 0.6039543954179736 and parameters: {'splitter': 'best', 'min_samples_split': 0.08728722473732606, 'min_samples_leaf': 0.0011461816437724481, 'min_weight_fraction_leaf': 0.0384783055646982, 'max_features': 0.5918948786224314}. Best is trial 203 with value: 0.6541339470014573.[0m
[32m[I 2022-04-21 11:47:08,808][0m Trial 450 finished with value: 0.6222080430858633 and parameters: {'splitter': 'best', 'min_samples_split': 0.1340500912321572, 'min_samples_leaf': 0.03431027761934277, 'min_weight_fraction_leaf': 0.016967275112548474, 'max_features': 0.6100408603264057}. Best is trial 203 with value: 0.6541339470014573.[0m
[32m[I 2022-04-21 11:47:09,324][0m Trial 451 finished with value: 0.6364826107948194 and parameters: {'splitter': 'best', 'min_samples_split': 0.11523505678411855, 'min_samples_leaf': 0.0013203852734982, 'min_weight_fraction_leaf': 0.02769642263541874, 'max_features': 0.5794792939410223}. Best is trial 203 with value: 0.6541339470014573.[0m
[32m[I 2022-04-21 11:47:09,694][0m Trial 452 finished with value: 0.6370039560691433 and parameters: {'splitter': 'best', 'min_samples_split': 0.12052931666747878, 'min_samples_leaf': 0.01737479797314795, 'min_weight_fraction_leaf': 0.008720758130002577, 'max_features': 0.5551488812117793}. Best is trial 203 with value: 0.6541339470014573.[0m
[32m[I 2022-04-21 11:47:09,906][0m Trial 453 finished with value: 0.615671504478998 and parameters: {'splitter': 'best', 'min_samples_split': 0.12786996130209133, 'min_samples_leaf': 0.051686708232166104, 'min_weight_fraction_leaf': 0.01739121071646069, 'max_features': 0.6269373297410119}. Best is trial 203 with value: 0.6541339470014573.[0m
[32m[I 2022-04-21 11:47:10,348][0m Trial 454 finished with value: 0.6222415984178277 and parameters: {'splitter': 'best', 'min_samples_split': 0.14333312534514828, 'min_samples_leaf': 0.026973275877640673, 'min_weight_fraction_leaf': 0.00043992335915776955, 'max_features': 0.7507769920029045}. Best is trial 203 with value: 0.6541339470014573.[0m
[32m[I 2022-04-21 11:47:10,914][0m Trial 455 finished with value: 0.627025674834458 and parameters: {'splitter': 'best', 'min_samples_split': 0.09684336110325265, 'min_samples_leaf': 0.013997817633002702, 'min_weight_fraction_leaf': 0.032890068741179036, 'max_features': 0.6157093756621915}. Best is trial 203 with value: 0.6541339470014573.[0m
[32m[I 2022-04-21 11:47:11,412][0m Trial 456 finished with value: 0.6008520556818351 and parameters: {'splitter': 'best', 'min_samples_split': 0.10602276510818807, 'min_samples_leaf': 0.038684971300469564, 'min_weight_fraction_leaf': 0.010325416572036115, 'max_features': 0.5316713856719565}. Best is trial 203 with value: 0.6541339470014573.[0m
[32m[I 2022-04-21 11:47:12,241][0m Trial 457 finished with value: 0.6339008190343092 and parameters: {'splitter': 'best', 'min_samples_split': 0.1291754053177078, 'min_samples_leaf': 0.012033669862667944, 'min_weight_fraction_leaf': 0.024539998389318154, 'max_features': 0.7758185311485386}. Best is trial 203 with value: 0.6541339470014573.[0m
[32m[I 2022-04-21 11:47:12,617][0m Trial 458 finished with value: 0.6050228060753339 and parameters: {'splitter': 'best', 'min_samples_split': 0.07143665446554301, 'min_samples_leaf': 0.022000463600231532, 'min_weight_fraction_leaf': 0.017241006086180018, 'max_features': 0.593101434059584}. Best is trial 203 with value: 0.6541339470014573.[0m
[32m[I 2022-04-21 11:47:12,802][0m Trial 459 finished with value: 0.5966952550950845 and parameters: {'splitter': 'best', 'min_samples_split': 0.13888087601432034, 'min_samples_leaf': 0.18335036235617386, 'min_weight_fraction_leaf': 0.009070774759964779, 'max_features': 0.8167726386163336}. Best is trial 203 with value: 0.6541339470014573.[0m
[32m[I 2022-04-21 11:47:13,326][0m Trial 460 finished with value: 0.6249644849825405 and parameters: {'splitter': 'best', 'min_samples_split': 0.11635673371977402, 'min_samples_leaf': 0.010783950934370371, 'min_weight_fraction_leaf': 0.03826178796037885, 'max_features': 0.6377617891700222}. Best is trial 203 with value: 0.6541339470014573.[0m
[32m[I 2022-04-21 11:47:13,930][0m Trial 461 finished with value: 0.6299966121675799 and parameters: {'splitter': 'best', 'min_samples_split': 0.14508340857975432, 'min_samples_leaf': 0.0014871797062735064, 'min_weight_fraction_leaf': 0.026354688396163593, 'max_features': 0.7379855433690262}. Best is trial 203 with value: 0.6541339470014573.[0m
