[32m[I 2022-04-21 17:28:37,681][0m Trial 366 finished with value: 0.8438095209157357 and parameters: {'loss': 'coxph', 'learning_rate': 8.599724769020168e-05, 'n_estimators': 495, 'criterion': 'friedman_mse', 'min_samples_split': 6, 'min_samples_leaf': 2, 'min_weight_fraction_leaf': 0.18223216209720067, 'min_impurity_decrease': 0.11785051158510329, 'max_features': 0.8653329830193096, 'subsample': 0.10673995598575522, 'dropout_rate': 0.15829792419129254, 'ccp_alpha': 0.2049528185030699}. Best is trial 244 with value: 0.8474070660226068.[0m
[32m[I 2022-04-21 17:29:03,348][0m Trial 367 finished with value: 0.65 and parameters: {'loss': 'coxph', 'learning_rate': 0.00013659225451036439, 'n_estimators': 317, 'criterion': 'absolute_error', 'min_samples_split': 5, 'min_samples_leaf': 5, 'min_weight_fraction_leaf': 0.22633409761128917, 'min_impurity_decrease': 0.4202465190309891, 'max_features': 0.6567087364970133, 'subsample': 0.04996301959244006, 'dropout_rate': 0.18804494842355207, 'ccp_alpha': 0.11414882624340421}. Best is trial 244 with value: 0.8474070660226068.[0m
[32m[I 2022-04-21 17:29:23,935][0m Trial 368 finished with value: 0.8422276594881728 and parameters: {'loss': 'coxph', 'learning_rate': 0.00011125531017526563, 'n_estimators': 278, 'criterion': 'friedman_mse', 'min_samples_split': 3, 'min_samples_leaf': 3, 'min_weight_fraction_leaf': 0.20282110550794813, 'min_impurity_decrease': 0.37447314679217036, 'max_features': 0.6799442510187708, 'subsample': 0.087326456739834, 'dropout_rate': 0.12145074546826645, 'ccp_alpha': 0.33494932724754334}. Best is trial 244 with value: 0.8474070660226068.[0m
[32m[I 2022-04-21 17:29:38,518][0m Trial 369 finished with value: 0.8425937941649279 and parameters: {'loss': 'coxph', 'learning_rate': 4.096584592766339e-05, 'n_estimators': 261, 'criterion': 'friedman_mse', 'min_samples_split': 3, 'min_samples_leaf': 2, 'min_weight_fraction_leaf': 0.21308634898007942, 'min_impurity_decrease': 0.4329004333727819, 'max_features': 0.7268216044560175, 'subsample': 0.16032535344376017, 'dropout_rate': 0.08762690771788352, 'ccp_alpha': 0.19863936952314226}. Best is trial 244 with value: 0.8474070660226068.[0m
[32m[I 2022-04-21 17:30:44,424][0m Trial 370 finished with value: 0.8448827900231501 and parameters: {'loss': 'coxph', 'learning_rate': 0.00027036991418097816, 'n_estimators': 561, 'criterion': 'friedman_mse', 'min_samples_split': 5, 'min_samples_leaf': 2, 'min_weight_fraction_leaf': 0.10525681584256287, 'min_impurity_decrease': 0.45221865907079867, 'max_features': 0.7545792500867405, 'subsample': 0.11931053168371944, 'dropout_rate': 0.25211437794881314, 'ccp_alpha': 0.09697432025861795}. Best is trial 244 with value: 0.8474070660226068.[0m
[32m[I 2022-04-21 17:30:57,258][0m Trial 371 finished with value: 0.8442904377316867 and parameters: {'loss': 'coxph', 'learning_rate': 0.00021164286717729368, 'n_estimators': 232, 'criterion': 'friedman_mse', 'min_samples_split': 3, 'min_samples_leaf': 2, 'min_weight_fraction_leaf': 0.1891318847731113, 'min_impurity_decrease': 0.3454881607483303, 'max_features': 0.4346350201124133, 'subsample': 0.03165672525503235, 'dropout_rate': 0.022077795990908297, 'ccp_alpha': 0.005007565828740876}. Best is trial 244 with value: 0.8474070660226068.[0m
[32m[I 2022-04-21 17:31:27,556][0m Trial 372 finished with value: 0.8411562661901396 and parameters: {'loss': 'coxph', 'learning_rate': 6.483032163717e-05, 'n_estimators': 342, 'criterion': 'friedman_mse', 'min_samples_split': 4, 'min_samples_leaf': 2, 'min_weight_fraction_leaf': 0.15595805567870294, 'min_impurity_decrease': 0.32243330540138554, 'max_features': 0.7820460685130374, 'subsample': 0.07231106173168236, 'dropout_rate': 0.06530375221015938, 'ccp_alpha': 0.24487545348652323}. Best is trial 244 with value: 0.8474070660226068.[0m
[32m[I 2022-04-21 17:31:42,290][0m Trial 373 finished with value: 0.8438936740859584 and parameters: {'loss': 'coxph', 'learning_rate': 0.00010120273965411583, 'n_estimators': 290, 'criterion': 'friedman_mse', 'min_samples_split': 3, 'min_samples_leaf': 3, 'min_weight_fraction_leaf': 0.17790463480759536, 'min_impurity_decrease': 0.3989559698137925, 'max_features': 0.7107714450615438, 'subsample': 0.1082842035496658, 'dropout_rate': 0.3536390575734307, 'ccp_alpha': 0.001417731877026855}. Best is trial 244 with value: 0.8474070660226068.[0m
[32m[I 2022-04-21 17:32:02,474][0m Trial 374 finished with value: 0.8378816755560763 and parameters: {'loss': 'coxph', 'learning_rate': 0.00014077558341881773, 'n_estimators': 249, 'criterion': 'friedman_mse', 'min_samples_split': 3, 'min_samples_leaf': 2, 'min_weight_fraction_leaf': 0.14094753505858842, 'min_impurity_decrease': 0.30470222411142167, 'max_features': 0.3547955779622355, 'subsample': 0.0915452376755622, 'dropout_rate': 0.13627608319356468, 'ccp_alpha': 0.46417953085183805}. Best is trial 244 with value: 0.8474070660226068.[0m
[32m[I 2022-04-21 17:32:16,152][0m Trial 375 finished with value: 0.8428300380153871 and parameters: {'loss': 'coxph', 'learning_rate': 0.00018823277640231582, 'n_estimators': 307, 'criterion': 'friedman_mse', 'min_samples_split': 3, 'min_samples_leaf': 4, 'min_weight_fraction_leaf': 0.19799914302217012, 'min_impurity_decrease': 0.37051329031580216, 'max_features': 0.894916081077252, 'subsample': 0.1433538995166091, 'dropout_rate': 0.44430127842702244, 'ccp_alpha': 0.14194441020606108}. Best is trial 244 with value: 0.8474070660226068.[0m
[32m[I 2022-04-21 17:32:35,047][0m Trial 376 finished with value: 0.65 and parameters: {'loss': 'coxph', 'learning_rate': 7.90348528620095e-05, 'n_estimators': 265, 'criterion': 'friedman_mse', 'min_samples_split': 3, 'min_samples_leaf': 7, 'min_weight_fraction_leaf': 0.2179789034310067, 'min_impurity_decrease': 0.7799034043239912, 'max_features': 0.8326320864598804, 'subsample': 0.057191032518779834, 'dropout_rate': 0.16953935921395877, 'ccp_alpha': 0.08753655254282433}. Best is trial 244 with value: 0.8474070660226068.[0m
[32m[I 2022-04-21 17:32:59,430][0m Trial 377 finished with value: 0.65 and parameters: {'loss': 'coxph', 'learning_rate': 0.00010703246661130583, 'n_estimators': 331, 'criterion': 'friedman_mse', 'min_samples_split': 5, 'min_samples_leaf': 2, 'min_weight_fraction_leaf': 0.17400589356541718, 'min_impurity_decrease': 0.34091985666094154, 'max_features': 0.36990247477269145, 'subsample': 0.014559191495411752, 'dropout_rate': 0.10876345201445575, 'ccp_alpha': 0.37077642851529946}. Best is trial 244 with value: 0.8474070660226068.[0m
[32m[I 2022-04-21 17:33:14,783][0m Trial 378 finished with value: 0.845063908159494 and parameters: {'loss': 'coxph', 'learning_rate': 0.0001408113466635164, 'n_estimators': 279, 'criterion': 'friedman_mse', 'min_samples_split': 3, 'min_samples_leaf': 2, 'min_weight_fraction_leaf': 0.16017174611598883, 'min_impurity_decrease': 0.3271829176807604, 'max_features': 0.4072316464838597, 'subsample': 0.07604342365989031, 'dropout_rate': 0.20447854222999473, 'ccp_alpha': 0.19427934410422507}. Best is trial 244 with value: 0.8474070660226068.[0m
[32m[I 2022-04-21 17:33:30,249][0m Trial 379 finished with value: 0.8389872925718546 and parameters: {'loss': 'coxph', 'learning_rate': 5.679571688229294e-05, 'n_estimators': 246, 'criterion': 'friedman_mse', 'min_samples_split': 4, 'min_samples_leaf': 2, 'min_weight_fraction_leaf': 0.18859759126295175, 'min_impurity_decrease': 0.43825841281424016, 'max_features': 0.3801844616490237, 'subsample': 0.04053053617774024, 'dropout_rate': 0.15234317891550325, 'ccp_alpha': 0.09217119644610629}. Best is trial 244 with value: 0.8474070660226068.[0m
/media/san2_ssd/data/Workdir/survival/venv/lib/python3.8/site-packages/sksurv/ensemble/boosting.py:955: RuntimeWarning: divide by zero encountered in log
  time = numpy.log(time)
/media/san2_ssd/data/Workdir/survival/venv/lib/python3.8/site-packages/sksurv/ensemble/boosting.py:955: RuntimeWarning: divide by zero encountered in log
  time = numpy.log(time)
/media/san2_ssd/data/Workdir/survival/venv/lib/python3.8/site-packages/sksurv/ensemble/boosting.py:955: RuntimeWarning: divide by zero encountered in log
  time = numpy.log(time)
/media/san2_ssd/data/Workdir/survival/venv/lib/python3.8/site-packages/sksurv/ensemble/boosting.py:955: RuntimeWarning: divide by zero encountered in log
  time = numpy.log(time)
[32m[I 2022-04-21 17:33:32,934][0m Trial 380 finished with value: -0.46613378432860025 and parameters: {'loss': 'squared', 'learning_rate': 8.351191879045086e-05, 'n_estimators': 295, 'criterion': 'friedman_mse', 'min_samples_split': 3, 'min_samples_leaf': 3, 'min_weight_fraction_leaf': 0.2037321925636676, 'min_impurity_decrease': 0.3578805818368602, 'max_features': 0.7446844057017361, 'subsample': 0.09831965003226256, 'dropout_rate': 0.18052986862842074, 'ccp_alpha': 0.2757365408519017}. Best is trial 244 with value: 0.8474070660226068.[0m
[32m[I 2022-04-21 17:33:56,645][0m Trial 381 finished with value: 0.8436616202575904 and parameters: {'loss': 'coxph', 'learning_rate': 3.169803342037887e-05, 'n_estimators': 314, 'criterion': 'friedman_mse', 'min_samples_split': 3, 'min_samples_leaf': 2, 'min_weight_fraction_leaf': 0.1296092053467962, 'min_impurity_decrease': 0.2814183944423528, 'max_features': 0.9177823409298368, 'subsample': 0.11988416948898341, 'dropout_rate': 0.129807052318341, 'ccp_alpha': 0.16790278078977308}. Best is trial 244 with value: 0.8474070660226068.[0m
[32m[I 2022-04-21 17:34:08,286][0m Trial 382 finished with value: 0.65 and parameters: {'loss': 'coxph', 'learning_rate': 4.487234783171003e-05, 'n_estimators': 228, 'criterion': 'friedman_mse', 'min_samples_split': 5, 'min_samples_leaf': 1, 'min_weight_fraction_leaf': 0.1474129430119184, 'min_impurity_decrease': 0.30809607233637876, 'max_features': 0.4322647386620295, 'subsample': 0.0026081734830178116, 'dropout_rate': 0.09760724183955956, 'ccp_alpha': 0.08011112658202474}. Best is trial 244 with value: 0.8474070660226068.[0m
[32m[I 2022-04-21 17:34:31,681][0m Trial 383 finished with value: 0.8446151140254792 and parameters: {'loss': 'coxph', 'learning_rate': 0.0002340628288301732, 'n_estimators': 269, 'criterion': 'friedman_mse', 'min_samples_split': 3, 'min_samples_leaf': 2, 'min_weight_fraction_leaf': 0.17908109557348217, 'min_impurity_decrease': 0.46909345778349143, 'max_features': 0.7687232642722448, 'subsample': 0.06762632967119908, 'dropout_rate': 0.04732088604903857, 'ccp_alpha': 0.002782632229048898}. Best is trial 244 with value: 0.8474070660226068.[0m
[32m[I 2022-04-21 17:34:55,024][0m Trial 384 finished with value: 0.7348584802694147 and parameters: {'loss': 'coxph', 'learning_rate': 0.0001526172937027494, 'n_estimators': 255, 'criterion': 'squared_error', 'min_samples_split': 6, 'min_samples_leaf': 2, 'min_weight_fraction_leaf': 0.236597158043406, 'min_impurity_decrease': 0.3866073267241105, 'max_features': 0.7152793705891154, 'subsample': 0.1312275628220501, 'dropout_rate': 0.15906220420653694, 'ccp_alpha': 0.24976496761831213}. Best is trial 244 with value: 0.8474070660226068.[0m
[32m[I 2022-04-21 17:35:17,028][0m Trial 385 finished with value: 0.836950652624419 and parameters: {'loss': 'coxph', 'learning_rate': 0.003135263167992545, 'n_estimators': 286, 'criterion': 'friedman_mse', 'min_samples_split': 4, 'min_samples_leaf': 2, 'min_weight_fraction_leaf': 0.19387350096965725, 'min_impurity_decrease': 0.35153827392600795, 'max_features': 0.6268964071740561, 'subsample': 0.09268991780272823, 'dropout_rate': 0.0797574514360481, 'ccp_alpha': 0.35723922775520567}. Best is trial 244 with value: 0.8474070660226068.[0m
[32m[I 2022-04-21 17:35:42,151][0m Trial 386 finished with value: 0.843424976670818 and parameters: {'loss': 'coxph', 'learning_rate': 0.00011527039916743106, 'n_estimators': 302, 'criterion': 'friedman_mse', 'min_samples_split': 3, 'min_samples_leaf': 2, 'min_weight_fraction_leaf': 0.1644219248446777, 'min_impurity_decrease': 0.32605242412137186, 'max_features': 0.34968457964138017, 'subsample': 0.057120742784757275, 'dropout_rate': 0.12229938654321178, 'ccp_alpha': 0.16349842072808804}. Best is trial 244 with value: 0.8474070660226068.[0m
[32m[I 2022-04-21 17:35:54,663][0m Trial 387 finished with value: 0.843491664609639 and parameters: {'loss': 'coxph', 'learning_rate': 0.00019315085472158868, 'n_estimators': 239, 'criterion': 'friedman_mse', 'min_samples_split': 3, 'min_samples_leaf': 1, 'min_weight_fraction_leaf': 0.21302139122456948, 'min_impurity_decrease': 0.30073270329228824, 'max_features': 0.39241039810330586, 'subsample': 0.08387028958146922, 'dropout_rate': 0.21920068209288499, 'ccp_alpha': 0.11501913213319327}. Best is trial 244 with value: 0.8474070660226068.[0m
[32m[I 2022-04-21 17:36:11,694][0m Trial 388 finished with value: 0.65 and parameters: {'loss': 'coxph', 'learning_rate': 7.120573617099799e-05, 'n_estimators': 220, 'criterion': 'absolute_error', 'min_samples_split': 5, 'min_samples_leaf': 6, 'min_weight_fraction_leaf': 0.1841455496002974, 'min_impurity_decrease': 0.26757596271164463, 'max_features': 0.45798406345404685, 'subsample': 0.042396326414001935, 'dropout_rate': 0.14456743289369345, 'ccp_alpha': 0.006376068050752859}. Best is trial 244 with value: 0.8474070660226068.[0m
[32m[I 2022-04-21 17:36:27,514][0m Trial 389 finished with value: 0.841057287611304 and parameters: {'loss': 'coxph', 'learning_rate': 9.303665868046469e-05, 'n_estimators': 274, 'criterion': 'friedman_mse', 'min_samples_split': 3, 'min_samples_leaf': 3, 'min_weight_fraction_leaf': 0.1706242765939797, 'min_impurity_decrease': 0.33336033741694904, 'max_features': 0.8169673469155805, 'subsample': 0.16364411334981133, 'dropout_rate': 0.1741094291508719, 'ccp_alpha': 0.21226820190721918}. Best is trial 244 with value: 0.8474070660226068.[0m
[32m[I 2022-04-21 17:37:00,617][0m Trial 390 finished with value: 0.8431769009890143 and parameters: {'loss': 'coxph', 'learning_rate': 0.00029882491586076727, 'n_estimators': 350, 'criterion': 'friedman_mse', 'min_samples_split': 3, 'min_samples_leaf': 2, 'min_weight_fraction_leaf': 0.3604877024071084, 'min_impurity_decrease': 0.8595835888126548, 'max_features': 0.6553865201016131, 'subsample': 0.10554856721593506, 'dropout_rate': 0.18968060710436913, 'ccp_alpha': 0.09178168115370854}. Best is trial 244 with value: 0.8474070660226068.[0m
[32m[I 2022-04-21 17:37:25,338][0m Trial 391 finished with value: 0.7380701236440447 and parameters: {'loss': 'coxph', 'learning_rate': 0.0047569946760102335, 'n_estimators': 324, 'criterion': 'friedman_mse', 'min_samples_split': 3, 'min_samples_leaf': 3, 'min_weight_fraction_leaf': 0.2035951451624678, 'min_impurity_decrease': 0.36822802356038553, 'max_features': 0.3301583493097251, 'subsample': 0.13909147083152962, 'dropout_rate': 0.10672432246692995, 'ccp_alpha': 0.29226692213361094}. Best is trial 244 with value: 0.8474070660226068.[0m
[32m[I 2022-04-21 17:37:46,561][0m Trial 392 finished with value: 0.7372009710779427 and parameters: {'loss': 'coxph', 'learning_rate': 0.00013110693787517016, 'n_estimators': 256, 'criterion': 'friedman_mse', 'min_samples_split': 5, 'min_samples_leaf': 2, 'min_weight_fraction_leaf': 0.22963320726522984, 'min_impurity_decrease': 0.40998135693588406, 'max_features': 0.26217901348163164, 'subsample': 0.06798277405729652, 'dropout_rate': 0.13687899028881428, 'ccp_alpha': 0.5608842392143181}. Best is trial 244 with value: 0.8474070660226068.[0m
[32m[I 2022-04-21 17:38:11,749][0m Trial 393 finished with value: 0.65 and parameters: {'loss': 'coxph', 'learning_rate': 0.00016725401518540657, 'n_estimators': 288, 'criterion': 'friedman_mse', 'min_samples_split': 3, 'min_samples_leaf': 2, 'min_weight_fraction_leaf': 0.15581614487256182, 'min_impurity_decrease': 0.30389299929773206, 'max_features': 0.28817124198710214, 'subsample': 0.02673317252470479, 'dropout_rate': 0.06448278762281934, 'ccp_alpha': 0.1002608842376789}. Best is trial 244 with value: 0.8474070660226068.[0m
[32m[I 2022-04-21 17:38:32,903][0m Trial 394 finished with value: 0.8457280900346327 and parameters: {'loss': 'coxph', 'learning_rate': 0.0001017058527959783, 'n_estimators': 267, 'criterion': 'friedman_mse', 'min_samples_split': 4, 'min_samples_leaf': 1, 'min_weight_fraction_leaf': 0.19483664071168338, 'min_impurity_decrease': 0.2872893304618983, 'max_features': 0.6860638542466746, 'subsample': 0.11933317174783498, 'dropout_rate': 0.16179216320782597, 'ccp_alpha': 0.002318773525573388}. Best is trial 244 with value: 0.8474070660226068.[0m
[32m[I 2022-04-21 17:38:54,083][0m Trial 395 finished with value: 0.8423294092879463 and parameters: {'loss': 'coxph', 'learning_rate': 6.940131721096525e-05, 'n_estimators': 312, 'criterion': 'friedman_mse', 'min_samples_split': 4, 'min_samples_leaf': 1, 'min_weight_fraction_leaf': 0.1932841383959153, 'min_impurity_decrease': 0.2767406273750016, 'max_features': 0.3588529642443589, 'subsample': 0.1942613048239697, 'dropout_rate': 0.1166567250696111, 'ccp_alpha': 0.06056725507568901}. Best is trial 244 with value: 0.8474070660226068.[0m
[32m[I 2022-04-21 17:39:17,185][0m Trial 396 finished with value: 0.8458330479692189 and parameters: {'loss': 'coxph', 'learning_rate': 0.0001201403662219949, 'n_estimators': 299, 'criterion': 'friedman_mse', 'min_samples_split': 4, 'min_samples_leaf': 1, 'min_weight_fraction_leaf': 0.18194624139209803, 'min_impurity_decrease': 0.29046927576865245, 'max_features': 0.4238827800000528, 'subsample': 0.1226225414921109, 'dropout_rate': 0.2031880969552034, 'ccp_alpha': 0.010071672839672766}. Best is trial 244 with value: 0.8474070660226068.[0m
[32m[I 2022-04-21 17:39:34,111][0m Trial 397 finished with value: 0.843299138235771 and parameters: {'loss': 'coxph', 'learning_rate': 9.934143711422708e-05, 'n_estimators': 281, 'criterion': 'friedman_mse', 'min_samples_split': 3, 'min_samples_leaf': 1, 'min_weight_fraction_leaf': 0.18158139462535627, 'min_impurity_decrease': 0.28736771984805587, 'max_features': 0.4281468521163523, 'subsample': 0.13631467047708784, 'dropout_rate': 0.20457199024013084, 'ccp_alpha': 0.15906032563028752}. Best is trial 244 with value: 0.8474070660226068.[0m
[32m[I 2022-04-21 17:39:53,287][0m Trial 398 finished with value: 0.8452736204176073 and parameters: {'loss': 'coxph', 'learning_rate': 8.221311969473566e-05, 'n_estimators': 298, 'criterion': 'friedman_mse', 'min_samples_split': 3, 'min_samples_leaf': 1, 'min_weight_fraction_leaf': 0.19357827948841824, 'min_impurity_decrease': 0.25192316481391785, 'max_features': 0.4099802873663707, 'subsample': 0.17614037695824902, 'dropout_rate': 0.21349929531056577, 'ccp_alpha': 0.004110479488442509}. Best is trial 244 with value: 0.8474070660226068.[0m
[32m[I 2022-04-21 17:40:13,264][0m Trial 399 finished with value: 0.8383088299105115 and parameters: {'loss': 'coxph', 'learning_rate': 0.00010284813467721749, 'n_estimators': 271, 'criterion': 'friedman_mse', 'min_samples_split': 4, 'min_samples_leaf': 1, 'min_weight_fraction_leaf': 0.3375738701488131, 'min_impurity_decrease': 0.2707796960909727, 'max_features': 0.43760655737633525, 'subsample': 0.15795845519122448, 'dropout_rate': 0.0825427580040912, 'ccp_alpha': 0.09896407103277291}. Best is trial 244 with value: 0.8474070660226068.[0m
[32m[I 2022-04-21 17:40:30,922][0m Trial 400 finished with value: 0.8433484417722463 and parameters: {'loss': 'coxph', 'learning_rate': 6.0801291972167095e-05, 'n_estimators': 290, 'criterion': 'friedman_mse', 'min_samples_split': 3, 'min_samples_leaf': 1, 'min_weight_fraction_leaf': 0.1843006225425522, 'min_impurity_decrease': 0.2994678458436254, 'max_features': 0.4149867644878858, 'subsample': 0.11828215636563753, 'dropout_rate': 0.19197099741569795, 'ccp_alpha': 0.17452120630872667}. Best is trial 244 with value: 0.8474070660226068.[0m
/media/san2_ssd/data/Workdir/survival/venv/lib/python3.8/site-packages/sksurv/ensemble/boosting.py:955: RuntimeWarning: divide by zero encountered in log
  time = numpy.log(time)
/media/san2_ssd/data/Workdir/survival/venv/lib/python3.8/site-packages/sksurv/ensemble/boosting.py:955: RuntimeWarning: divide by zero encountered in log
  time = numpy.log(time)
/media/san2_ssd/data/Workdir/survival/venv/lib/python3.8/site-packages/sksurv/ensemble/boosting.py:955: RuntimeWarning: divide by zero encountered in log
  time = numpy.log(time)
/media/san2_ssd/data/Workdir/survival/venv/lib/python3.8/site-packages/sksurv/ensemble/boosting.py:955: RuntimeWarning: divide by zero encountered in log
  time = numpy.log(time)
[32m[I 2022-04-21 17:40:33,348][0m Trial 401 finished with value: -0.46631341631689754 and parameters: {'loss': 'squared', 'learning_rate': 0.00012511010801613198, 'n_estimators': 270, 'criterion': 'friedman_mse', 'min_samples_split': 3, 'min_samples_leaf': 1, 'min_weight_fraction_leaf': 0.19970460188801162, 'min_impurity_decrease': 0.28006919406029457, 'max_features': 0.39349855871556644, 'subsample': 0.09946806250125846, 'dropout_rate': 0.14994567322633617, 'ccp_alpha': 0.007672982519199872}. Best is trial 244 with value: 0.8474070660226068.[0m
[32m[I 2022-04-21 17:40:45,016][0m Trial 402 finished with value: 0.8409411419617495 and parameters: {'loss': 'coxph', 'learning_rate': 9.264393404859606e-05, 'n_estimators': 246, 'criterion': 'friedman_mse', 'min_samples_split': 3, 'min_samples_leaf': 1, 'min_weight_fraction_leaf': 0.17488596888802874, 'min_impurity_decrease': 0.32159368731950366, 'max_features': 0.4537956810743357, 'subsample': 0.6026753576812628, 'dropout_rate': 0.2375934818962721, 'ccp_alpha': 0.09036442594169891}. Best is trial 244 with value: 0.8474070660226068.[0m
