[32m[I 2022-04-21 11:41:59,802][0m Trial 744 finished with value: 0.8273029424858442 and parameters: {'splitter': 'best', 'min_samples_split': 0.08858616707794112, 'min_samples_leaf': 0.012484451580059987, 'min_weight_fraction_leaf': 0.009767434468525476, 'max_features': 0.5937373520312982}. Best is trial 691 with value: 0.8340697555858835.[0m
[32m[I 2022-04-21 11:42:00,322][0m Trial 745 finished with value: 0.8174581037837708 and parameters: {'splitter': 'best', 'min_samples_split': 0.08984837978606876, 'min_samples_leaf': 0.01245761344539026, 'min_weight_fraction_leaf': 0.009126000724441113, 'max_features': 0.6162146022679951}. Best is trial 691 with value: 0.8340697555858835.[0m
/media/san2_ssd/data/Workdir/survival/utils.py:305: RuntimeWarning: invalid value encountered in true_divide
  pdfs = np.gradient(1-survs,axis=1)/norms
[32m[I 2022-04-21 11:42:00,822][0m Trial 746 finished with value: 0.8166438611996165 and parameters: {'splitter': 'best', 'min_samples_split': 0.08458601867474959, 'min_samples_leaf': 0.01121270192633566, 'min_weight_fraction_leaf': 0.007556244573854123, 'max_features': 0.6136938116487387}. Best is trial 691 with value: 0.8340697555858835.[0m
[32m[I 2022-04-21 11:42:01,248][0m Trial 747 finished with value: 0.8100184268864528 and parameters: {'splitter': 'best', 'min_samples_split': 0.08931958087455877, 'min_samples_leaf': 0.009110691679964969, 'min_weight_fraction_leaf': 0.025159088786016172, 'max_features': 0.5858278428915921}. Best is trial 691 with value: 0.8340697555858835.[0m
[32m[I 2022-04-21 11:42:01,380][0m Trial 748 finished with value: 0.5683801958776981 and parameters: {'splitter': 'best', 'min_samples_split': 0.15613257350344506, 'min_samples_leaf': 0.37006148871681777, 'min_weight_fraction_leaf': 0.0077149722304006175, 'max_features': 0.5923455671359678}. Best is trial 691 with value: 0.8340697555858835.[0m
[32m[I 2022-04-21 11:42:01,706][0m Trial 749 finished with value: 0.8176858413285911 and parameters: {'splitter': 'best', 'min_samples_split': 0.17953242912600337, 'min_samples_leaf': 0.024782394185247282, 'min_weight_fraction_leaf': 0.009693217144905572, 'max_features': 0.6271119559887292}. Best is trial 691 with value: 0.8340697555858835.[0m
/media/san2_ssd/data/Workdir/survival/utils.py:305: RuntimeWarning: invalid value encountered in true_divide
  pdfs = np.gradient(1-survs,axis=1)/norms
[32m[I 2022-04-21 11:42:02,276][0m Trial 750 finished with value: 0.8081396898830068 and parameters: {'splitter': 'best', 'min_samples_split': 0.09333492315923099, 'min_samples_leaf': 0.011013949049458372, 'min_weight_fraction_leaf': 0.020917616830685312, 'max_features': 0.6452226922683385}. Best is trial 691 with value: 0.8340697555858835.[0m
[32m[I 2022-04-21 11:42:02,831][0m Trial 751 finished with value: 0.8049258561530991 and parameters: {'splitter': 'best', 'min_samples_split': 0.08650549333554673, 'min_samples_leaf': 0.02282074972443726, 'min_weight_fraction_leaf': 0.009918950255615101, 'max_features': 0.5604741152145574}. Best is trial 691 with value: 0.8340697555858835.[0m
[32m[I 2022-04-21 11:42:02,966][0m Trial 752 finished with value: 0.35 and parameters: {'splitter': 'best', 'min_samples_split': 0.1277644403788116, 'min_samples_leaf': 0.04032282209549109, 'min_weight_fraction_leaf': 0.00011572023598363165, 'max_features': 0.00023398187566181505}. Best is trial 691 with value: 0.8340697555858835.[0m
/media/san2_ssd/data/Workdir/survival/utils.py:305: RuntimeWarning: invalid value encountered in true_divide
  pdfs = np.gradient(1-survs,axis=1)/norms
/media/san2_ssd/data/Workdir/survival/utils.py:305: RuntimeWarning: invalid value encountered in true_divide
  pdfs = np.gradient(1-survs,axis=1)/norms
[32m[I 2022-04-21 11:42:03,674][0m Trial 753 finished with value: 0.8145243922874977 and parameters: {'splitter': 'best', 'min_samples_split': 0.09762022098243607, 'min_samples_leaf': 0.009222461328388077, 'min_weight_fraction_leaf': 0.016914961207068698, 'max_features': 0.6094836961515324}. Best is trial 691 with value: 0.8340697555858835.[0m
[32m[I 2022-04-21 11:42:04,199][0m Trial 754 finished with value: 0.6963091602067907 and parameters: {'splitter': 'best', 'min_samples_split': 0.44209444874543324, 'min_samples_leaf': 0.029893080980171256, 'min_weight_fraction_leaf': 0.026944498115099594, 'max_features': 0.5910362943367145}. Best is trial 691 with value: 0.8340697555858835.[0m
[32m[I 2022-04-21 11:42:05,155][0m Trial 755 finished with value: 0.8211221912837194 and parameters: {'splitter': 'best', 'min_samples_split': 0.14451055127735524, 'min_samples_leaf': 0.01882931883215458, 'min_weight_fraction_leaf': 0.00029248321490784636, 'max_features': 0.588989119990039}. Best is trial 691 with value: 0.8340697555858835.[0m
/media/san2_ssd/data/Workdir/survival/utils.py:305: RuntimeWarning: invalid value encountered in true_divide
  pdfs = np.gradient(1-survs,axis=1)/norms
/media/san2_ssd/data/Workdir/survival/utils.py:305: RuntimeWarning: invalid value encountered in true_divide
  pdfs = np.gradient(1-survs,axis=1)/norms
[32m[I 2022-04-21 11:42:05,551][0m Trial 756 finished with value: 0.8208443210182914 and parameters: {'splitter': 'best', 'min_samples_split': 0.11214018145179898, 'min_samples_leaf': 0.009011182781490238, 'min_weight_fraction_leaf': 0.0151241770196034, 'max_features': 0.5345905163483067}. Best is trial 691 with value: 0.8340697555858835.[0m
[32m[I 2022-04-21 11:42:05,811][0m Trial 757 finished with value: 0.8082630106457855 and parameters: {'splitter': 'best', 'min_samples_split': 0.10325740414530618, 'min_samples_leaf': 0.06015069500642141, 'min_weight_fraction_leaf': 0.033825019645872006, 'max_features': 0.6665313950108107}. Best is trial 691 with value: 0.8340697555858835.[0m
[32m[I 2022-04-21 11:42:05,963][0m Trial 758 finished with value: 0.5683801958776981 and parameters: {'splitter': 'best', 'min_samples_split': 0.11928063864710998, 'min_samples_leaf': 0.019416946682999398, 'min_weight_fraction_leaf': 0.37038635702294953, 'max_features': 0.5995083141248411}. Best is trial 691 with value: 0.8340697555858835.[0m
[32m[I 2022-04-21 11:42:06,041][0m Trial 759 finished with value: 0.47495774536239777 and parameters: {'splitter': 'best', 'min_samples_split': 0.28862286018584515, 'min_samples_leaf': 0.4028606327412799, 'min_weight_fraction_leaf': 0.09952247623523197, 'max_features': 0.34311896220865795}. Best is trial 691 with value: 0.8340697555858835.[0m
[32m[I 2022-04-21 11:42:06,474][0m Trial 760 finished with value: 0.8150738256133385 and parameters: {'splitter': 'best', 'min_samples_split': 0.08283273358850884, 'min_samples_leaf': 0.033070782624928394, 'min_weight_fraction_leaf': 0.022732596265597087, 'max_features': 0.627495189006496}. Best is trial 691 with value: 0.8340697555858835.[0m
[32m[I 2022-04-21 11:42:07,343][0m Trial 761 finished with value: 0.8071733667042877 and parameters: {'splitter': 'best', 'min_samples_split': 0.49923382094281954, 'min_samples_leaf': 0.00106769063518692, 'min_weight_fraction_leaf': 0.010253512569125073, 'max_features': 0.5689986477368223}. Best is trial 691 with value: 0.8340697555858835.[0m
[32m[I 2022-04-21 11:42:07,921][0m Trial 762 finished with value: 0.8118227141811136 and parameters: {'splitter': 'best', 'min_samples_split': 0.09750123266022573, 'min_samples_leaf': 0.018123978393482953, 'min_weight_fraction_leaf': 0.15110287651085025, 'max_features': 0.5570364137449624}. Best is trial 691 with value: 0.8340697555858835.[0m
[32m[I 2022-04-21 11:42:08,447][0m Trial 763 finished with value: 0.8075318554162922 and parameters: {'splitter': 'best', 'min_samples_split': 0.13096881881779707, 'min_samples_leaf': 0.045461306109196284, 'min_weight_fraction_leaf': 0.009012180283345068, 'max_features': 0.5429986654541089}. Best is trial 691 with value: 0.8340697555858835.[0m
[32m[I 2022-04-21 11:42:09,664][0m Trial 764 finished with value: 0.813938085730013 and parameters: {'splitter': 'best', 'min_samples_split': 0.11064437336304161, 'min_samples_leaf': 0.0010758021362272177, 'min_weight_fraction_leaf': 0.03131993992630143, 'max_features': 0.5823311210100254}. Best is trial 691 with value: 0.8340697555858835.[0m
[32m[I 2022-04-21 11:42:10,105][0m Trial 765 finished with value: 0.8151990688471041 and parameters: {'splitter': 'best', 'min_samples_split': 0.1480423974931642, 'min_samples_leaf': 0.02682266838719982, 'min_weight_fraction_leaf': 0.019179147888178774, 'max_features': 0.5726023684988238}. Best is trial 691 with value: 0.8340697555858835.[0m
/media/san2_ssd/data/Workdir/survival/utils.py:305: RuntimeWarning: invalid value encountered in true_divide
  pdfs = np.gradient(1-survs,axis=1)/norms
/media/san2_ssd/data/Workdir/survival/utils.py:305: RuntimeWarning: invalid value encountered in true_divide
  pdfs = np.gradient(1-survs,axis=1)/norms
[32m[I 2022-04-21 11:42:10,592][0m Trial 766 finished with value: 0.805598944164274 and parameters: {'splitter': 'best', 'min_samples_split': 0.09135865675558778, 'min_samples_leaf': 0.01246240242534528, 'min_weight_fraction_leaf': 0.009306479643324126, 'max_features': 0.639410225060908}. Best is trial 691 with value: 0.8340697555858835.[0m
[32m[I 2022-04-21 11:42:10,955][0m Trial 767 finished with value: 0.8070411306995254 and parameters: {'splitter': 'best', 'min_samples_split': 0.20560138033544575, 'min_samples_leaf': 0.009303244647790488, 'min_weight_fraction_leaf': 0.008206169817136191, 'max_features': 0.37069829025152423}. Best is trial 691 with value: 0.8340697555858835.[0m
[32m[I 2022-04-21 11:42:11,084][0m Trial 768 finished with value: 0.691510558803943 and parameters: {'splitter': 'best', 'min_samples_split': 0.08397444587545605, 'min_samples_leaf': 0.20060940995327142, 'min_weight_fraction_leaf': 0.017568901618737278, 'max_features': 0.522063645693615}. Best is trial 691 with value: 0.8340697555858835.[0m
[32m[I 2022-04-21 11:42:11,320][0m Trial 769 finished with value: 0.8139435884848456 and parameters: {'splitter': 'best', 'min_samples_split': 0.12159261287306024, 'min_samples_leaf': 0.03511775177425082, 'min_weight_fraction_leaf': 0.04263030453927431, 'max_features': 0.4987768261252537}. Best is trial 691 with value: 0.8340697555858835.[0m
[32m[I 2022-04-21 11:42:11,568][0m Trial 770 finished with value: 0.8057612336793515 and parameters: {'splitter': 'best', 'min_samples_split': 0.10390061487279706, 'min_samples_leaf': 0.0236448044854132, 'min_weight_fraction_leaf': 0.028503236884352877, 'max_features': 0.39004117529397364}. Best is trial 691 with value: 0.8340697555858835.[0m
[32m[I 2022-04-21 11:42:12,204][0m Trial 771 finished with value: 0.8245386544299114 and parameters: {'splitter': 'best', 'min_samples_split': 0.11396845752176071, 'min_samples_leaf': 0.014548136036738258, 'min_weight_fraction_leaf': 0.0007608347469024595, 'max_features': 0.600518062750952}. Best is trial 691 with value: 0.8340697555858835.[0m
/media/san2_ssd/data/Workdir/survival/utils.py:305: RuntimeWarning: invalid value encountered in true_divide
  pdfs = np.gradient(1-survs,axis=1)/norms
[32m[I 2022-04-21 11:42:13,105][0m Trial 772 finished with value: 0.8161487765087276 and parameters: {'splitter': 'best', 'min_samples_split': 0.1396301293978027, 'min_samples_leaf': 0.009618270008789866, 'min_weight_fraction_leaf': 0.00035860882671982786, 'max_features': 0.6162744085094629}. Best is trial 691 with value: 0.8340697555858835.[0m
/media/san2_ssd/data/Workdir/survival/utils.py:305: RuntimeWarning: invalid value encountered in true_divide
  pdfs = np.gradient(1-survs,axis=1)/norms
/media/san2_ssd/data/Workdir/survival/utils.py:305: RuntimeWarning: invalid value encountered in true_divide
  pdfs = np.gradient(1-survs,axis=1)/norms
[32m[I 2022-04-21 11:42:14,181][0m Trial 773 finished with value: 0.8134323094826115 and parameters: {'splitter': 'best', 'min_samples_split': 0.16131391387934124, 'min_samples_leaf': 0.001178171910680573, 'min_weight_fraction_leaf': 0.008260295447809433, 'max_features': 0.5779990425439085}. Best is trial 691 with value: 0.8340697555858835.[0m
/media/san2_ssd/data/Workdir/survival/utils.py:305: RuntimeWarning: invalid value encountered in true_divide
  pdfs = np.gradient(1-survs,axis=1)/norms
/media/san2_ssd/data/Workdir/survival/utils.py:305: RuntimeWarning: invalid value encountered in true_divide
  pdfs = np.gradient(1-survs,axis=1)/norms
[32m[I 2022-04-21 11:42:15,520][0m Trial 774 finished with value: 0.7164190481701709 and parameters: {'splitter': 'best', 'min_samples_split': 0.3882159609495303, 'min_samples_leaf': 0.0011177617480974886, 'min_weight_fraction_leaf': 6.635384668307251e-05, 'max_features': 0.6018088713013211}. Best is trial 691 with value: 0.8340697555858835.[0m
[32m[I 2022-04-21 11:42:15,901][0m Trial 775 finished with value: 0.7170436564794764 and parameters: {'splitter': 'best', 'min_samples_split': 0.3213280091570079, 'min_samples_leaf': 0.016518027123776226, 'min_weight_fraction_leaf': 3.6327691874801435e-05, 'max_features': 0.6018644452242543}. Best is trial 691 with value: 0.8340697555858835.[0m
[32m[I 2022-04-21 11:42:16,332][0m Trial 776 finished with value: 0.8152239455810116 and parameters: {'splitter': 'best', 'min_samples_split': 0.1319193213190925, 'min_samples_leaf': 0.02783327178502009, 'min_weight_fraction_leaf': 4.04923488746458e-05, 'max_features': 0.6504228619731733}. Best is trial 691 with value: 0.8340697555858835.[0m
/media/san2_ssd/data/Workdir/survival/utils.py:305: RuntimeWarning: invalid value encountered in true_divide
  pdfs = np.gradient(1-survs,axis=1)/norms
[32m[I 2022-04-21 11:42:16,820][0m Trial 777 finished with value: 0.8185602156508913 and parameters: {'splitter': 'best', 'min_samples_split': 0.1169946808027868, 'min_samples_leaf': 0.01045669017853846, 'min_weight_fraction_leaf': 0.008829241479303394, 'max_features': 0.6268205574047154}. Best is trial 691 with value: 0.8340697555858835.[0m
[32m[I 2022-04-21 11:42:17,081][0m Trial 778 finished with value: 0.8059128666070974 and parameters: {'splitter': 'best', 'min_samples_split': 0.1265050443223903, 'min_samples_leaf': 0.03875666792649297, 'min_weight_fraction_leaf': 0.016222485973558038, 'max_features': 0.5692520720077111}. Best is trial 691 with value: 0.8340697555858835.[0m
[32m[I 2022-04-21 11:42:17,465][0m Trial 779 finished with value: 0.7130729879298713 and parameters: {'splitter': 'best', 'min_samples_split': 0.34309459371897827, 'min_samples_leaf': 0.017043280351408063, 'min_weight_fraction_leaf': 0.00026098820144463943, 'max_features': 0.6138431274189526}. Best is trial 691 with value: 0.8340697555858835.[0m
[32m[I 2022-04-21 11:42:17,844][0m Trial 780 finished with value: 0.8220114668861409 and parameters: {'splitter': 'best', 'min_samples_split': 0.11135151992879962, 'min_samples_leaf': 0.02688750624295342, 'min_weight_fraction_leaf': 0.01593848387255484, 'max_features': 0.5512935627241978}. Best is trial 691 with value: 0.8340697555858835.[0m
/media/san2_ssd/data/Workdir/survival/utils.py:305: RuntimeWarning: invalid value encountered in true_divide
  pdfs = np.gradient(1-survs,axis=1)/norms
[32m[I 2022-04-21 11:42:18,409][0m Trial 781 finished with value: 0.8134136522681044 and parameters: {'splitter': 'best', 'min_samples_split': 0.1499568983083303, 'min_samples_leaf': 0.01104486891755472, 'min_weight_fraction_leaf': 0.009075564853997764, 'max_features': 0.5789332060353618}. Best is trial 691 with value: 0.8340697555858835.[0m
/media/san2_ssd/data/Workdir/survival/utils.py:305: RuntimeWarning: invalid value encountered in true_divide
  pdfs = np.gradient(1-survs,axis=1)/norms
[32m[I 2022-04-21 11:42:18,832][0m Trial 782 finished with value: 0.8049783807680753 and parameters: {'splitter': 'best', 'min_samples_split': 0.09535155119066877, 'min_samples_leaf': 0.022276517116581084, 'min_weight_fraction_leaf': 0.025129160173252778, 'max_features': 0.6374393208380118}. Best is trial 691 with value: 0.8340697555858835.[0m
/media/san2_ssd/data/Workdir/survival/utils.py:305: RuntimeWarning: invalid value encountered in true_divide
  pdfs = np.gradient(1-survs,axis=1)/norms
[32m[I 2022-04-21 11:42:19,375][0m Trial 783 finished with value: 0.8164330882479671 and parameters: {'splitter': 'best', 'min_samples_split': 0.12088665662865361, 'min_samples_leaf': 0.001018902272911901, 'min_weight_fraction_leaf': 0.011246286713893513, 'max_features': 0.5863638526781044}. Best is trial 691 with value: 0.8340697555858835.[0m
[32m[I 2022-04-21 11:42:19,640][0m Trial 784 finished with value: 0.8123112771657348 and parameters: {'splitter': 'best', 'min_samples_split': 0.13444053447563387, 'min_samples_leaf': 0.053856867331891115, 'min_weight_fraction_leaf': 0.0004916930728705859, 'max_features': 0.6048353251278444}. Best is trial 691 with value: 0.8340697555858835.[0m
/media/san2_ssd/data/Workdir/survival/utils.py:305: RuntimeWarning: invalid value encountered in true_divide
  pdfs = np.gradient(1-survs,axis=1)/norms
[32m[I 2022-04-21 11:42:20,030][0m Trial 785 finished with value: 0.8228573044940146 and parameters: {'splitter': 'best', 'min_samples_split': 0.08049822568013391, 'min_samples_leaf': 0.010589721257155855, 'min_weight_fraction_leaf': 0.02417801880592007, 'max_features': 0.5455128510081131}. Best is trial 691 with value: 0.8340697555858835.[0m
[32m[I 2022-04-21 11:42:20,411][0m Trial 786 finished with value: 0.8056382447569528 and parameters: {'splitter': 'best', 'min_samples_split': 0.07610069160421296, 'min_samples_leaf': 0.036365219777833996, 'min_weight_fraction_leaf': 0.03791291216610741, 'max_features': 0.5539654747774837}. Best is trial 691 with value: 0.8340697555858835.[0m
[32m[I 2022-04-21 11:42:20,714][0m Trial 787 finished with value: 0.8028263782372107 and parameters: {'splitter': 'best', 'min_samples_split': 0.08374778288730009, 'min_samples_leaf': 0.046117266632223604, 'min_weight_fraction_leaf': 0.03529354300189742, 'max_features': 0.5335474116944605}. Best is trial 691 with value: 0.8340697555858835.[0m
[32m[I 2022-04-21 11:42:20,991][0m Trial 788 finished with value: 0.8042938861851698 and parameters: {'splitter': 'best', 'min_samples_split': 0.11356691852254713, 'min_samples_leaf': 0.031007559220084573, 'min_weight_fraction_leaf': 0.045400494527893506, 'max_features': 0.5436630001903795}. Best is trial 691 with value: 0.8340697555858835.[0m
/media/san2_ssd/data/Workdir/survival/utils.py:305: RuntimeWarning: invalid value encountered in true_divide
  pdfs = np.gradient(1-survs,axis=1)/norms
[32m[I 2022-04-21 11:42:21,353][0m Trial 789 finished with value: 0.8173310848008137 and parameters: {'splitter': 'best', 'min_samples_split': 0.09998065931207767, 'min_samples_leaf': 0.018541151031983692, 'min_weight_fraction_leaf': 0.02516954516870807, 'max_features': 0.5477184215805242}. Best is trial 691 with value: 0.8340697555858835.[0m
[32m[I 2022-04-21 11:42:21,445][0m Trial 790 finished with value: 0.5610874747587877 and parameters: {'splitter': 'best', 'min_samples_split': 0.14021633170750206, 'min_samples_leaf': 0.49521805452371237, 'min_weight_fraction_leaf': 0.032766943916022945, 'max_features': 0.5662555469569153}. Best is trial 691 with value: 0.8340697555858835.[0m
[32m[I 2022-04-21 11:42:21,807][0m Trial 791 finished with value: 0.8153928502190348 and parameters: {'splitter': 'best', 'min_samples_split': 0.1213079398500759, 'min_samples_leaf': 0.024506186432084777, 'min_weight_fraction_leaf': 0.022712803625654886, 'max_features': 0.5667863356907517}. Best is trial 691 with value: 0.8340697555858835.[0m
[32m[I 2022-04-21 11:42:22,110][0m Trial 792 finished with value: 0.8142774182807955 and parameters: {'splitter': 'best', 'min_samples_split': 0.08189288749515863, 'min_samples_leaf': 0.013807760404830526, 'min_weight_fraction_leaf': 0.050006617892466576, 'max_features': 0.5296199034511424}. Best is trial 691 with value: 0.8340697555858835.[0m
/media/san2_ssd/data/Workdir/survival/utils.py:305: RuntimeWarning: invalid value encountered in true_divide
  pdfs = np.gradient(1-survs,axis=1)/norms
[32m[I 2022-04-21 11:42:22,484][0m Trial 793 finished with value: 0.8133388819666966 and parameters: {'splitter': 'best', 'min_samples_split': 0.10538374775801188, 'min_samples_leaf': 0.03419241834405369, 'min_weight_fraction_leaf': 0.024510367002840636, 'max_features': 0.5975626840615277}. Best is trial 691 with value: 0.8340697555858835.[0m
[32m[I 2022-04-21 11:42:22,823][0m Trial 794 finished with value: 0.8152785199756707 and parameters: {'splitter': 'best', 'min_samples_split': 0.12917766533659725, 'min_samples_leaf': 0.025542019601597046, 'min_weight_fraction_leaf': 0.01728042349925034, 'max_features': 0.5673925158940508}. Best is trial 691 with value: 0.8340697555858835.[0m
[32m[I 2022-04-21 11:42:23,172][0m Trial 795 finished with value: 0.8091295800719654 and parameters: {'splitter': 'best', 'min_samples_split': 0.17300176497630287, 'min_samples_leaf': 0.01169536622935879, 'min_weight_fraction_leaf': 0.03306846073013873, 'max_features': 0.5215655780348369}. Best is trial 691 with value: 0.8340697555858835.[0m
[32m[I 2022-04-21 11:42:23,519][0m Trial 796 finished with value: 0.812093163452657 and parameters: {'splitter': 'best', 'min_samples_split': 0.09606531957084544, 'min_samples_leaf': 0.043821190202803596, 'min_weight_fraction_leaf': 0.017866401599486704, 'max_features': 0.5334379198890036}. Best is trial 691 with value: 0.8340697555858835.[0m
[32m[I 2022-04-21 11:42:23,956][0m Trial 797 finished with value: 0.8182413053974097 and parameters: {'splitter': 'best', 'min_samples_split': 0.11346125102001349, 'min_samples_leaf': 0.017675639691321948, 'min_weight_fraction_leaf': 0.028249823551485413, 'max_features': 0.582014351895454}. Best is trial 691 with value: 0.8340697555858835.[0m
