[32m[I 2022-04-21 11:44:07,821][0m Trial 147 finished with value: 0.5390425201367111 and parameters: {'splitter': 'random', 'min_samples_split': 0.25730823664393077, 'min_samples_leaf': 0.24832896563768705, 'min_weight_fraction_leaf': 0.020939541156696974, 'max_features': 0.30485934591603825}. Best is trial 97 with value: 0.6416209271025564.[0m
[32m[I 2022-04-21 11:44:07,909][0m Trial 148 finished with value: 0.6315666035860793 and parameters: {'splitter': 'random', 'min_samples_split': 0.23279605947350818, 'min_samples_leaf': 0.008999682905421719, 'min_weight_fraction_leaf': 0.0006220876437507926, 'max_features': 0.40734471028116703}. Best is trial 97 with value: 0.6416209271025564.[0m
[32m[I 2022-04-21 11:44:08,026][0m Trial 149 finished with value: 0.6185623593931456 and parameters: {'splitter': 'random', 'min_samples_split': 0.24999025825889157, 'min_samples_leaf': 0.004864336710878034, 'min_weight_fraction_leaf': 0.0017058294382881005, 'max_features': 0.35276958959172133}. Best is trial 97 with value: 0.6416209271025564.[0m
[32m[I 2022-04-21 11:44:08,092][0m Trial 150 finished with value: 0.6173937666879837 and parameters: {'splitter': 'random', 'min_samples_split': 0.23976222041020473, 'min_samples_leaf': 0.019837419763281905, 'min_weight_fraction_leaf': 0.01063636142418581, 'max_features': 0.4040747930894141}. Best is trial 97 with value: 0.6416209271025564.[0m
[32m[I 2022-04-21 11:44:08,154][0m Trial 151 finished with value: 0.6128608986808802 and parameters: {'splitter': 'random', 'min_samples_split': 0.20636044395339553, 'min_samples_leaf': 0.0352751071913652, 'min_weight_fraction_leaf': 0.03214756909961704, 'max_features': 0.43566389752520746}. Best is trial 97 with value: 0.6416209271025564.[0m
[32m[I 2022-04-21 11:44:08,205][0m Trial 152 finished with value: 0.6202026960984318 and parameters: {'splitter': 'random', 'min_samples_split': 0.01933695867818715, 'min_samples_leaf': 0.04608899342418531, 'min_weight_fraction_leaf': 0.016444770977903492, 'max_features': 0.3304254307501094}. Best is trial 97 with value: 0.6416209271025564.[0m
[32m[I 2022-04-21 11:44:08,281][0m Trial 153 finished with value: 0.6135583584162155 and parameters: {'splitter': 'random', 'min_samples_split': 0.23774730744527342, 'min_samples_leaf': 0.008838346592667622, 'min_weight_fraction_leaf': 0.0015449229552707763, 'max_features': 0.3789174763050221}. Best is trial 97 with value: 0.6416209271025564.[0m
[32m[I 2022-04-21 11:44:08,342][0m Trial 154 finished with value: 0.6047736471249063 and parameters: {'splitter': 'random', 'min_samples_split': 0.3077665407547301, 'min_samples_leaf': 0.03541730773364462, 'min_weight_fraction_leaf': 0.0251115749634979, 'max_features': 0.4200394565301438}. Best is trial 97 with value: 0.6416209271025564.[0m
[32m[I 2022-04-21 11:44:08,395][0m Trial 155 finished with value: 0.6243016065306779 and parameters: {'splitter': 'random', 'min_samples_split': 0.271964856577589, 'min_samples_leaf': 0.02366976248256992, 'min_weight_fraction_leaf': 0.06336203472894486, 'max_features': 0.45042031260426746}. Best is trial 97 with value: 0.6416209271025564.[0m
[32m[I 2022-04-21 11:44:08,508][0m Trial 156 finished with value: 0.6076708775201619 and parameters: {'splitter': 'random', 'min_samples_split': 0.032271680170090286, 'min_samples_leaf': 0.002409568783478904, 'min_weight_fraction_leaf': 0.044013283398353586, 'max_features': 0.5197440003464898}. Best is trial 97 with value: 0.6416209271025564.[0m
[32m[I 2022-04-21 11:44:08,572][0m Trial 157 finished with value: 0.632908526432885 and parameters: {'splitter': 'random', 'min_samples_split': 0.04584266544082209, 'min_samples_leaf': 0.060430834084799934, 'min_weight_fraction_leaf': 0.03295765445821905, 'max_features': 0.7903769734995388}. Best is trial 97 with value: 0.6416209271025564.[0m
[32m[I 2022-04-21 11:44:08,637][0m Trial 158 finished with value: 0.544485725847915 and parameters: {'splitter': 'random', 'min_samples_split': 0.04990646040340143, 'min_samples_leaf': 0.06404540605124771, 'min_weight_fraction_leaf': 0.1689422676973252, 'max_features': 0.3993267517075531}. Best is trial 97 with value: 0.6416209271025564.[0m
[32m[I 2022-04-21 11:44:08,734][0m Trial 159 finished with value: 0.624255931412868 and parameters: {'splitter': 'random', 'min_samples_split': 0.02417380541789335, 'min_samples_leaf': 0.045502749238912996, 'min_weight_fraction_leaf': 0.013416988363832778, 'max_features': 0.7397363413779738}. Best is trial 97 with value: 0.6416209271025564.[0m
[32m[I 2022-04-21 11:44:09,090][0m Trial 160 finished with value: 0.6346696086795918 and parameters: {'splitter': 'best', 'min_samples_split': 0.18558543630554353, 'min_samples_leaf': 0.017497203022109137, 'min_weight_fraction_leaf': 0.028329061589140024, 'max_features': 0.7682535648777392}. Best is trial 97 with value: 0.6416209271025564.[0m
[32m[I 2022-04-21 11:44:09,462][0m Trial 161 finished with value: 0.6171476249244646 and parameters: {'splitter': 'best', 'min_samples_split': 0.18662029219082277, 'min_samples_leaf': 0.013969986250082052, 'min_weight_fraction_leaf': 0.031208372455601548, 'max_features': 0.7825747413568666}. Best is trial 97 with value: 0.6416209271025564.[0m
[32m[I 2022-04-21 11:44:09,870][0m Trial 162 finished with value: 0.6246940160934663 and parameters: {'splitter': 'best', 'min_samples_split': 0.18096830180231605, 'min_samples_leaf': 0.029268488784183852, 'min_weight_fraction_leaf': 0.020140290238283613, 'max_features': 0.8153139073537636}. Best is trial 97 with value: 0.6416209271025564.[0m
[32m[I 2022-04-21 11:44:10,951][0m Trial 163 finished with value: 0.6273202452988866 and parameters: {'splitter': 'best', 'min_samples_split': 0.14518471570764546, 'min_samples_leaf': 0.01878614468594829, 'min_weight_fraction_leaf': 0.0076845831283596944, 'max_features': 0.771709472707163}. Best is trial 97 with value: 0.6416209271025564.[0m
[32m[I 2022-04-21 11:44:11,596][0m Trial 164 finished with value: 0.5989823780986846 and parameters: {'splitter': 'best', 'min_samples_split': 0.1632761314090473, 'min_samples_leaf': 0.041083792809786204, 'min_weight_fraction_leaf': 0.05253813718621219, 'max_features': 0.7098942110242493}. Best is trial 97 with value: 0.6416209271025564.[0m
[32m[I 2022-04-21 11:44:12,811][0m Trial 165 finished with value: 0.6228015047549263 and parameters: {'splitter': 'best', 'min_samples_split': 0.22536913474966447, 'min_samples_leaf': 0.001332965922890627, 'min_weight_fraction_leaf': 0.03307218718086883, 'max_features': 0.6376133990221726}. Best is trial 97 with value: 0.6416209271025564.[0m
[32m[I 2022-04-21 11:44:13,001][0m Trial 166 finished with value: 0.6193726582247118 and parameters: {'splitter': 'random', 'min_samples_split': 0.19498429431052966, 'min_samples_leaf': 0.07211092591625672, 'min_weight_fraction_leaf': 0.024406279330061842, 'max_features': 0.7574374736026008}. Best is trial 97 with value: 0.6416209271025564.[0m
[32m[I 2022-04-21 11:44:13,754][0m Trial 167 finished with value: 0.6342954084391985 and parameters: {'splitter': 'best', 'min_samples_split': 0.12796319666445552, 'min_samples_leaf': 0.029133526322249734, 'min_weight_fraction_leaf': 0.0006059875692392691, 'max_features': 0.6096397471500531}. Best is trial 97 with value: 0.6416209271025564.[0m
[32m[I 2022-04-21 11:44:14,642][0m Trial 168 finished with value: 0.6316693999505693 and parameters: {'splitter': 'best', 'min_samples_split': 0.13634584865401458, 'min_samples_leaf': 0.024028234312871877, 'min_weight_fraction_leaf': 0.0029942479172421813, 'max_features': 0.6096460022519603}. Best is trial 97 with value: 0.6416209271025564.[0m
[32m[I 2022-04-21 11:44:15,387][0m Trial 169 finished with value: 0.6358698614730914 and parameters: {'splitter': 'best', 'min_samples_split': 0.15730813805041047, 'min_samples_leaf': 0.02764267946602219, 'min_weight_fraction_leaf': 0.0004758059380776357, 'max_features': 0.6174920240414721}. Best is trial 97 with value: 0.6416209271025564.[0m
[32m[I 2022-04-21 11:44:15,946][0m Trial 170 finished with value: 0.6229759390711408 and parameters: {'splitter': 'best', 'min_samples_split': 0.1339056568427255, 'min_samples_leaf': 0.027852576531047533, 'min_weight_fraction_leaf': 0.00048038169125005, 'max_features': 0.6187458785815559}. Best is trial 97 with value: 0.6416209271025564.[0m
[32m[I 2022-04-21 11:44:16,754][0m Trial 171 finished with value: 0.6269454325837994 and parameters: {'splitter': 'best', 'min_samples_split': 0.15546761827223798, 'min_samples_leaf': 0.015075701647083122, 'min_weight_fraction_leaf': 0.011554144330201351, 'max_features': 0.6081021418136898}. Best is trial 97 with value: 0.6416209271025564.[0m
[32m[I 2022-04-21 11:44:17,337][0m Trial 172 finished with value: 0.6222455620885837 and parameters: {'splitter': 'best', 'min_samples_split': 0.17533939876455976, 'min_samples_leaf': 0.03552165980870461, 'min_weight_fraction_leaf': 0.00013752288504908713, 'max_features': 0.5715185426683007}. Best is trial 97 with value: 0.6416209271025564.[0m
[32m[I 2022-04-21 11:44:18,066][0m Trial 173 finished with value: 0.6230167422942194 and parameters: {'splitter': 'best', 'min_samples_split': 0.13954007182815947, 'min_samples_leaf': 0.02390046190870477, 'min_weight_fraction_leaf': 0.013955340280043572, 'max_features': 0.6548355497836538}. Best is trial 97 with value: 0.6416209271025564.[0m
[32m[I 2022-04-21 11:44:18,947][0m Trial 174 finished with value: 0.6338654913132448 and parameters: {'splitter': 'best', 'min_samples_split': 0.12071101968374524, 'min_samples_leaf': 0.013989993589526645, 'min_weight_fraction_leaf': 0.010221888302224116, 'max_features': 0.5903256009582694}. Best is trial 97 with value: 0.6416209271025564.[0m
[32m[I 2022-04-21 11:44:19,787][0m Trial 175 finished with value: 0.6456111825904802 and parameters: {'splitter': 'best', 'min_samples_split': 0.1239536919619387, 'min_samples_leaf': 0.01223906747241827, 'min_weight_fraction_leaf': 0.014070986621557605, 'max_features': 0.5852011191233923}. Best is trial 175 with value: 0.6456111825904802.[0m
[32m[I 2022-04-21 11:44:21,486][0m Trial 176 finished with value: 0.6293841340120022 and parameters: {'splitter': 'best', 'min_samples_split': 0.12751156236820582, 'min_samples_leaf': 0.010240479037357971, 'min_weight_fraction_leaf': 0.00030122851956842014, 'max_features': 0.5968676976462709}. Best is trial 175 with value: 0.6456111825904802.[0m
[32m[I 2022-04-21 11:44:23,135][0m Trial 177 finished with value: 0.651426496695159 and parameters: {'splitter': 'best', 'min_samples_split': 0.11801837079860315, 'min_samples_leaf': 0.01169148681018708, 'min_weight_fraction_leaf': 0.015017812052983777, 'max_features': 0.5437686680776086}. Best is trial 177 with value: 0.651426496695159.[0m
[32m[I 2022-04-21 11:44:23,765][0m Trial 178 finished with value: 0.6239257181476867 and parameters: {'splitter': 'best', 'min_samples_split': 0.11579952393383017, 'min_samples_leaf': 0.012658476664171008, 'min_weight_fraction_leaf': 0.011364810296454845, 'max_features': 0.5417666815701754}. Best is trial 177 with value: 0.651426496695159.[0m
[32m[I 2022-04-21 11:44:24,403][0m Trial 179 finished with value: 0.6372855040684837 and parameters: {'splitter': 'best', 'min_samples_split': 0.12097480796219404, 'min_samples_leaf': 0.01844949939932914, 'min_weight_fraction_leaf': 0.017329326284549543, 'max_features': 0.5810207853642897}. Best is trial 177 with value: 0.651426496695159.[0m
[32m[I 2022-04-21 11:44:25,588][0m Trial 180 finished with value: 0.6258442311450015 and parameters: {'splitter': 'best', 'min_samples_split': 0.11949184320811597, 'min_samples_leaf': 0.002060553359642528, 'min_weight_fraction_leaf': 0.017151590194941044, 'max_features': 0.5608294117070517}. Best is trial 177 with value: 0.651426496695159.[0m
[32m[I 2022-04-21 11:44:26,011][0m Trial 181 finished with value: 0.6358073228193467 and parameters: {'splitter': 'best', 'min_samples_split': 0.13394407666641808, 'min_samples_leaf': 0.018770893204441398, 'min_weight_fraction_leaf': 0.008379019216431034, 'max_features': 0.5808591207546938}. Best is trial 177 with value: 0.651426496695159.[0m
[32m[I 2022-04-21 11:44:26,391][0m Trial 182 finished with value: 0.6445491251924775 and parameters: {'splitter': 'best', 'min_samples_split': 0.15552615671580464, 'min_samples_leaf': 0.02046029568850723, 'min_weight_fraction_leaf': 0.007707016122007478, 'max_features': 0.5758873751432664}. Best is trial 177 with value: 0.651426496695159.[0m
[32m[I 2022-04-21 11:44:26,953][0m Trial 183 finished with value: 0.6267309125434977 and parameters: {'splitter': 'best', 'min_samples_split': 0.1477776672535425, 'min_samples_leaf': 0.022051700362584237, 'min_weight_fraction_leaf': 0.011026368656148772, 'max_features': 0.5789213870967389}. Best is trial 177 with value: 0.651426496695159.[0m
[32m[I 2022-04-21 11:44:27,259][0m Trial 184 finished with value: 0.6250199617114678 and parameters: {'splitter': 'best', 'min_samples_split': 0.16199516204250997, 'min_samples_leaf': 0.03145844863239337, 'min_weight_fraction_leaf': 0.02190418565676949, 'max_features': 0.5852671261079514}. Best is trial 177 with value: 0.651426496695159.[0m
[32m[I 2022-04-21 11:44:27,590][0m Trial 185 finished with value: 0.6286075456552462 and parameters: {'splitter': 'best', 'min_samples_split': 0.13200377798432134, 'min_samples_leaf': 0.018241190437718064, 'min_weight_fraction_leaf': 0.0104682265354195, 'max_features': 0.5560710301129044}. Best is trial 177 with value: 0.651426496695159.[0m
[32m[I 2022-04-21 11:44:27,885][0m Trial 186 finished with value: 0.6125259616285078 and parameters: {'splitter': 'best', 'min_samples_split': 0.10971368666770828, 'min_samples_leaf': 0.030209377558635644, 'min_weight_fraction_leaf': 0.02281266193865182, 'max_features': 0.5343450771953632}. Best is trial 177 with value: 0.651426496695159.[0m
[32m[I 2022-04-21 11:44:28,216][0m Trial 187 finished with value: 0.6363867980060902 and parameters: {'splitter': 'best', 'min_samples_split': 0.1394707099560596, 'min_samples_leaf': 0.039443251390081854, 'min_weight_fraction_leaf': 0.008961441053402895, 'max_features': 0.618292779134623}. Best is trial 177 with value: 0.651426496695159.[0m
[32m[I 2022-04-21 11:44:28,511][0m Trial 188 finished with value: 0.6346117570187756 and parameters: {'splitter': 'best', 'min_samples_split': 0.12392764797610292, 'min_samples_leaf': 0.04177742984230583, 'min_weight_fraction_leaf': 0.029700811140555783, 'max_features': 0.5821717382288478}. Best is trial 177 with value: 0.651426496695159.[0m
[32m[I 2022-04-21 11:44:28,748][0m Trial 189 finished with value: 0.6287194100436452 and parameters: {'splitter': 'best', 'min_samples_split': 0.12249291333087282, 'min_samples_leaf': 0.03964562717026657, 'min_weight_fraction_leaf': 0.033258979659742574, 'max_features': 0.5875317030120963}. Best is trial 177 with value: 0.651426496695159.[0m
[32m[I 2022-04-21 11:44:29,008][0m Trial 190 finished with value: 0.6012582160223765 and parameters: {'splitter': 'best', 'min_samples_split': 0.15013422037118526, 'min_samples_leaf': 0.04519076620590103, 'min_weight_fraction_leaf': 0.019025627280136324, 'max_features': 0.6243295154474743}. Best is trial 177 with value: 0.651426496695159.[0m
[32m[I 2022-04-21 11:44:29,421][0m Trial 191 finished with value: 0.6198886651788926 and parameters: {'splitter': 'best', 'min_samples_split': 0.1055062714611954, 'min_samples_leaf': 0.013716736232150865, 'min_weight_fraction_leaf': 0.011298826450686078, 'max_features': 0.5661415806188606}. Best is trial 177 with value: 0.651426496695159.[0m
[32m[I 2022-04-21 11:44:29,472][0m Trial 192 finished with value: 0.5435409113779912 and parameters: {'splitter': 'best', 'min_samples_split': 0.12113946340348945, 'min_samples_leaf': 0.3818586189946206, 'min_weight_fraction_leaf': 0.02979433756461526, 'max_features': 0.6029143197810544}. Best is trial 177 with value: 0.651426496695159.[0m
[32m[I 2022-04-21 11:44:29,625][0m Trial 193 finished with value: 0.6090072399091918 and parameters: {'splitter': 'best', 'min_samples_split': 0.14197035064361255, 'min_samples_leaf': 0.036180448554223754, 'min_weight_fraction_leaf': 0.018220131475668543, 'max_features': 0.26727316528687517}. Best is trial 177 with value: 0.651426496695159.[0m
[32m[I 2022-04-21 11:44:29,987][0m Trial 194 finished with value: 0.643779479098996 and parameters: {'splitter': 'best', 'min_samples_split': 0.15713627978106282, 'min_samples_leaf': 0.02305656106379152, 'min_weight_fraction_leaf': 0.008719333162077916, 'max_features': 0.6380560108015964}. Best is trial 177 with value: 0.651426496695159.[0m
[32m[I 2022-04-21 11:44:30,338][0m Trial 195 finished with value: 0.6202293272811767 and parameters: {'splitter': 'best', 'min_samples_split': 0.15795912214884572, 'min_samples_leaf': 0.010122202130171691, 'min_weight_fraction_leaf': 0.03070374963363428, 'max_features': 0.6462190014789595}. Best is trial 177 with value: 0.651426496695159.[0m
[32m[I 2022-04-21 11:44:30,589][0m Trial 196 finished with value: 0.6175397278015573 and parameters: {'splitter': 'best', 'min_samples_split': 0.16978304588440216, 'min_samples_leaf': 0.04955691718369534, 'min_weight_fraction_leaf': 0.01090283051573834, 'max_features': 0.6326251293744778}. Best is trial 177 with value: 0.651426496695159.[0m
[32m[I 2022-04-21 11:44:30,829][0m Trial 197 finished with value: 0.6111309297291895 and parameters: {'splitter': 'best', 'min_samples_split': 0.13192507422598396, 'min_samples_leaf': 0.03451933390389256, 'min_weight_fraction_leaf': 0.041654512635819416, 'max_features': 0.5446501680261183}. Best is trial 177 with value: 0.651426496695159.[0m
[32m[I 2022-04-21 11:44:31,330][0m Trial 198 finished with value: 0.6333787628325069 and parameters: {'splitter': 'best', 'min_samples_split': 0.15142935187063936, 'min_samples_leaf': 0.018499957932170383, 'min_weight_fraction_leaf': 0.02350742436611847, 'max_features': 0.5846114600413579}. Best is trial 177 with value: 0.651426496695159.[0m
[32m[I 2022-04-21 11:44:31,731][0m Trial 199 finished with value: 0.6304056502214769 and parameters: {'splitter': 'best', 'min_samples_split': 0.14541721696423515, 'min_samples_leaf': 0.017757024170656735, 'min_weight_fraction_leaf': 0.02171201331589624, 'max_features': 0.5811975194751}. Best is trial 177 with value: 0.651426496695159.[0m
[32m[I 2022-04-21 11:44:31,873][0m Trial 200 finished with value: 0.5215500905649788 and parameters: {'splitter': 'best', 'min_samples_split': 0.15259838921663624, 'min_samples_leaf': 0.0013179798505417919, 'min_weight_fraction_leaf': 0.45869365064300194, 'max_features': 0.6097041612387623}. Best is trial 177 with value: 0.651426496695159.[0m
[32m[I 2022-04-21 11:44:32,139][0m Trial 201 finished with value: 0.6225402678791261 and parameters: {'splitter': 'best', 'min_samples_split': 0.12920907459897724, 'min_samples_leaf': 0.025052372906370666, 'min_weight_fraction_leaf': 0.028201703368242688, 'max_features': 0.5645842848698411}. Best is trial 177 with value: 0.651426496695159.[0m
[32m[I 2022-04-21 11:44:32,376][0m Trial 202 finished with value: 0.6109939683233692 and parameters: {'splitter': 'best', 'min_samples_split': 0.10853447286384671, 'min_samples_leaf': 0.038975850151956586, 'min_weight_fraction_leaf': 0.011500330037977593, 'max_features': 0.5938212558771456}. Best is trial 177 with value: 0.651426496695159.[0m
[32m[I 2022-04-21 11:44:32,761][0m Trial 203 finished with value: 0.6541339470014573 and parameters: {'splitter': 'best', 'min_samples_split': 0.1382108416163349, 'min_samples_leaf': 0.017368986889672977, 'min_weight_fraction_leaf': 0.0201772644846007, 'max_features': 0.6240165310033011}. Best is trial 203 with value: 0.6541339470014573.[0m
[32m[I 2022-04-21 11:44:33,489][0m Trial 204 finished with value: 0.6514797901787834 and parameters: {'splitter': 'best', 'min_samples_split': 0.14063993184577675, 'min_samples_leaf': 0.010477884415375997, 'min_weight_fraction_leaf': 0.018918299786182882, 'max_features': 0.6235517589269025}. Best is trial 203 with value: 0.6541339470014573.[0m
[32m[I 2022-04-21 11:44:33,926][0m Trial 205 finished with value: 0.6481365626889224 and parameters: {'splitter': 'best', 'min_samples_split': 0.17182052675479462, 'min_samples_leaf': 0.011702584824414454, 'min_weight_fraction_leaf': 0.01941402591952514, 'max_features': 0.6226428976830697}. Best is trial 203 with value: 0.6541339470014573.[0m
[32m[I 2022-04-21 11:44:34,386][0m Trial 206 finished with value: 0.6242074225961435 and parameters: {'splitter': 'best', 'min_samples_split': 0.16303400865888798, 'min_samples_leaf': 0.00935115296622526, 'min_weight_fraction_leaf': 0.011164726523637529, 'max_features': 0.6227329778034708}. Best is trial 203 with value: 0.6541339470014573.[0m
[32m[I 2022-04-21 11:44:35,857][0m Trial 207 finished with value: 0.6471782540241113 and parameters: {'splitter': 'best', 'min_samples_split': 0.13411817099554071, 'min_samples_leaf': 0.002523455955656874, 'min_weight_fraction_leaf': 0.0001714611188373058, 'max_features': 0.6364322027255322}. Best is trial 203 with value: 0.6541339470014573.[0m
[32m[I 2022-04-21 11:44:36,354][0m Trial 208 finished with value: 0.6294170685662933 and parameters: {'splitter': 'best', 'min_samples_split': 0.1732035312142065, 'min_samples_leaf': 0.002531205719604076, 'min_weight_fraction_leaf': 0.016877227554774357, 'max_features': 0.6406447008161135}. Best is trial 203 with value: 0.6541339470014573.[0m
[32m[I 2022-04-21 11:44:36,732][0m Trial 209 finished with value: 0.6215876711618061 and parameters: {'splitter': 'best', 'min_samples_split': 0.14101793919829958, 'min_samples_leaf': 0.028319123737270066, 'min_weight_fraction_leaf': 0.0029789996396201307, 'max_features': 0.6578783155224502}. Best is trial 203 with value: 0.6541339470014573.[0m
