[32m[I 2022-04-21 11:38:36,104][0m Trial 693 finished with value: 0.8372245618281238 and parameters: {'splitter': 'best', 'min_samples_split': 0.09604774807627678, 'min_samples_leaf': 0.051164297016056445, 'min_weight_fraction_leaf': 0.023225083116880395, 'max_features': 0.7331812730166268}. Best is trial 499 with value: 0.8396174698878165.[0m
[32m[I 2022-04-21 11:38:36,182][0m Trial 694 finished with value: 0.8372245618281238 and parameters: {'splitter': 'best', 'min_samples_split': 0.09755633410134315, 'min_samples_leaf': 0.05513911606897559, 'min_weight_fraction_leaf': 0.022583909750395207, 'max_features': 0.6827150787703584}. Best is trial 499 with value: 0.8396174698878165.[0m
[32m[I 2022-04-21 11:38:36,259][0m Trial 695 finished with value: 0.8391063129816301 and parameters: {'splitter': 'best', 'min_samples_split': 0.08327182142153702, 'min_samples_leaf': 0.04373727704890341, 'min_weight_fraction_leaf': 0.030924757838733753, 'max_features': 0.6819670179206505}. Best is trial 499 with value: 0.8396174698878165.[0m
[32m[I 2022-04-21 11:38:36,331][0m Trial 696 finished with value: 0.65 and parameters: {'splitter': 'best', 'min_samples_split': 0.09359430388372075, 'min_samples_leaf': 0.04106508667031434, 'min_weight_fraction_leaf': 0.4196332228856323, 'max_features': 0.749410763903951}. Best is trial 499 with value: 0.8396174698878165.[0m
[32m[I 2022-04-21 11:38:36,405][0m Trial 697 finished with value: 0.8333498191213747 and parameters: {'splitter': 'best', 'min_samples_split': 0.12624867038745832, 'min_samples_leaf': 0.024930622102386397, 'min_weight_fraction_leaf': 0.0667469658471801, 'max_features': 0.6564870471401172}. Best is trial 499 with value: 0.8396174698878165.[0m
[32m[I 2022-04-21 11:38:36,462][0m Trial 698 finished with value: 0.8372245618281238 and parameters: {'splitter': 'best', 'min_samples_split': 0.08230132547937155, 'min_samples_leaf': 0.04977389695296612, 'min_weight_fraction_leaf': 0.02172596249978582, 'max_features': 0.714365155494032}. Best is trial 499 with value: 0.8396174698878165.[0m
[32m[I 2022-04-21 11:38:36,522][0m Trial 699 finished with value: 0.8372245618281238 and parameters: {'splitter': 'best', 'min_samples_split': 0.1207079156961123, 'min_samples_leaf': 0.02188934570958823, 'min_weight_fraction_leaf': 0.051340248541470866, 'max_features': 0.6505516834778615}. Best is trial 499 with value: 0.8396174698878165.[0m
[32m[I 2022-04-21 11:38:36,578][0m Trial 700 finished with value: 0.8318869790887286 and parameters: {'splitter': 'best', 'min_samples_split': 0.10284756224360055, 'min_samples_leaf': 0.015281900372274972, 'min_weight_fraction_leaf': 0.08062863351132712, 'max_features': 0.63462558986161}. Best is trial 499 with value: 0.8396174698878165.[0m
[32m[I 2022-04-21 11:38:36,688][0m Trial 701 finished with value: 0.8372245618281238 and parameters: {'splitter': 'best', 'min_samples_split': 0.06765784884524015, 'min_samples_leaf': 0.05454201692427056, 'min_weight_fraction_leaf': 0.02219988830381685, 'max_features': 0.7023605259985853}. Best is trial 499 with value: 0.8396174698878165.[0m
[32m[I 2022-04-21 11:38:36,742][0m Trial 702 finished with value: 0.8372245618281238 and parameters: {'splitter': 'best', 'min_samples_split': 0.05861858067749228, 'min_samples_leaf': 0.054650195282649555, 'min_weight_fraction_leaf': 0.02825510858679711, 'max_features': 0.7211072367112326}. Best is trial 499 with value: 0.8396174698878165.[0m
[32m[I 2022-04-21 11:38:36,807][0m Trial 703 finished with value: 0.8391063129816301 and parameters: {'splitter': 'best', 'min_samples_split': 0.0768321589029806, 'min_samples_leaf': 0.044086391825373536, 'min_weight_fraction_leaf': 0.018822347089161657, 'max_features': 0.6924429371325256}. Best is trial 499 with value: 0.8396174698878165.[0m
[32m[I 2022-04-21 11:38:36,862][0m Trial 704 finished with value: 0.8355314144660066 and parameters: {'splitter': 'best', 'min_samples_split': 0.10046222762809362, 'min_samples_leaf': 0.0010891752404937338, 'min_weight_fraction_leaf': 0.03586501715276443, 'max_features': 0.7407575050304898}. Best is trial 499 with value: 0.8396174698878165.[0m
[32m[I 2022-04-21 11:38:36,926][0m Trial 705 finished with value: 0.8391063129816301 and parameters: {'splitter': 'best', 'min_samples_split': 0.09071426320239069, 'min_samples_leaf': 0.010645376402378282, 'min_weight_fraction_leaf': 0.04850550669615493, 'max_features': 0.6037699104417499}. Best is trial 499 with value: 0.8396174698878165.[0m
[32m[I 2022-04-21 11:38:36,986][0m Trial 706 finished with value: 0.8318450474400789 and parameters: {'splitter': 'best', 'min_samples_split': 0.30548056746709706, 'min_samples_leaf': 0.29838690957245667, 'min_weight_fraction_leaf': 0.06268446783770504, 'max_features': 0.6678256370472433}. Best is trial 499 with value: 0.8396174698878165.[0m
[32m[I 2022-04-21 11:38:37,047][0m Trial 707 finished with value: 0.8336394972301212 and parameters: {'splitter': 'random', 'min_samples_split': 0.09101129905419468, 'min_samples_leaf': 0.001599463108230044, 'min_weight_fraction_leaf': 0.03717107778858811, 'max_features': 0.5804439671635353}. Best is trial 499 with value: 0.8396174698878165.[0m
[32m[I 2022-04-21 11:38:37,111][0m Trial 708 finished with value: 0.8391063129816301 and parameters: {'splitter': 'best', 'min_samples_split': 0.10475858337216483, 'min_samples_leaf': 0.03214657700210281, 'min_weight_fraction_leaf': 0.047686167492664924, 'max_features': 0.6717717164110617}. Best is trial 499 with value: 0.8396174698878165.[0m
[32m[I 2022-04-21 11:38:37,193][0m Trial 709 finished with value: 0.8372245618281238 and parameters: {'splitter': 'best', 'min_samples_split': 0.12397121016442476, 'min_samples_leaf': 0.020960451149564577, 'min_weight_fraction_leaf': 0.05130425320390388, 'max_features': 0.6290375798878232}. Best is trial 499 with value: 0.8396174698878165.[0m
[32m[I 2022-04-21 11:38:37,271][0m Trial 710 finished with value: 0.8333369736643199 and parameters: {'splitter': 'best', 'min_samples_split': 0.07096343578659765, 'min_samples_leaf': 0.010108107625955197, 'min_weight_fraction_leaf': 0.02085366766377513, 'max_features': 0.7121816305047506}. Best is trial 499 with value: 0.8396174698878165.[0m
[32m[I 2022-04-21 11:38:37,331][0m Trial 711 finished with value: 0.8329040013833406 and parameters: {'splitter': 'best', 'min_samples_split': 0.04947541382786594, 'min_samples_leaf': 0.030385872179774235, 'min_weight_fraction_leaf': 0.030664103461558477, 'max_features': 0.7041617793474765}. Best is trial 499 with value: 0.8396174698878165.[0m
[32m[I 2022-04-21 11:38:37,390][0m Trial 712 finished with value: 0.8318450474400789 and parameters: {'splitter': 'best', 'min_samples_split': 0.09228094345243303, 'min_samples_leaf': 0.15337185840048137, 'min_weight_fraction_leaf': 0.06002832552316789, 'max_features': 0.731842103247162}. Best is trial 499 with value: 0.8396174698878165.[0m
/media/san2_ssd/data/Workdir/survival/utils.py:305: RuntimeWarning: invalid value encountered in true_divide
  pdfs = np.gradient(1-survs,axis=1)/norms
[32m[I 2022-04-21 11:38:37,450][0m Trial 713 finished with value: 0.8356593949122629 and parameters: {'splitter': 'best', 'min_samples_split': 0.0011748934882740425, 'min_samples_leaf': 0.010192847188201177, 'min_weight_fraction_leaf': 0.018602467264877205, 'max_features': 0.6935381193182768}. Best is trial 499 with value: 0.8396174698878165.[0m
[32m[I 2022-04-21 11:38:37,517][0m Trial 714 finished with value: 0.8320143660942818 and parameters: {'splitter': 'best', 'min_samples_split': 0.08213036895551326, 'min_samples_leaf': 0.04677587397806101, 'min_weight_fraction_leaf': 0.0272074843577848, 'max_features': 0.5543413300540599}. Best is trial 499 with value: 0.8396174698878165.[0m
[32m[I 2022-04-21 11:38:37,593][0m Trial 715 finished with value: 0.8337713431190045 and parameters: {'splitter': 'best', 'min_samples_split': 0.07619343833616822, 'min_samples_leaf': 0.04072182913133324, 'min_weight_fraction_leaf': 0.020907693906418456, 'max_features': 0.729336093680308}. Best is trial 499 with value: 0.8396174698878165.[0m
[32m[I 2022-04-21 11:38:37,653][0m Trial 716 finished with value: 0.8336210332407393 and parameters: {'splitter': 'best', 'min_samples_split': 0.11350707103426133, 'min_samples_leaf': 0.02736710179835684, 'min_weight_fraction_leaf': 0.07272807112458302, 'max_features': 0.6459549143385233}. Best is trial 499 with value: 0.8396174698878165.[0m
[32m[I 2022-04-21 11:38:37,709][0m Trial 717 finished with value: 0.8367316552865305 and parameters: {'splitter': 'best', 'min_samples_split': 0.29148619447787405, 'min_samples_leaf': 0.017033926474529285, 'min_weight_fraction_leaf': 0.03232282021706131, 'max_features': 0.6970533389516821}. Best is trial 499 with value: 0.8396174698878165.[0m
[32m[I 2022-04-21 11:38:37,765][0m Trial 718 finished with value: 0.8391063129816301 and parameters: {'splitter': 'best', 'min_samples_split': 0.10194045700063847, 'min_samples_leaf': 0.037648528446842744, 'min_weight_fraction_leaf': 0.042097263057030515, 'max_features': 0.6767236412024615}. Best is trial 499 with value: 0.8396174698878165.[0m
[32m[I 2022-04-21 11:38:37,825][0m Trial 719 finished with value: 0.8318450474400789 and parameters: {'splitter': 'best', 'min_samples_split': 0.10969516403206449, 'min_samples_leaf': 0.02991106104128154, 'min_weight_fraction_leaf': 0.15604361862772148, 'max_features': 0.6263448312265172}. Best is trial 499 with value: 0.8396174698878165.[0m
[32m[I 2022-04-21 11:38:37,883][0m Trial 720 finished with value: 0.8372245618281238 and parameters: {'splitter': 'best', 'min_samples_split': 0.08162891337099129, 'min_samples_leaf': 0.05511809452681004, 'min_weight_fraction_leaf': 0.027789947978826265, 'max_features': 0.7150699426502956}. Best is trial 499 with value: 0.8396174698878165.[0m
[32m[I 2022-04-21 11:38:37,936][0m Trial 721 finished with value: 0.8391063129816301 and parameters: {'splitter': 'best', 'min_samples_split': 0.07966354522624755, 'min_samples_leaf': 0.04018172645077574, 'min_weight_fraction_leaf': 0.044301829258945685, 'max_features': 0.7494088334884446}. Best is trial 499 with value: 0.8396174698878165.[0m
[32m[I 2022-04-21 11:38:38,016][0m Trial 722 finished with value: 0.8374994682939777 and parameters: {'splitter': 'best', 'min_samples_split': 0.2828223625878809, 'min_samples_leaf': 0.001404464436925287, 'min_weight_fraction_leaf': 0.03318559448648392, 'max_features': 0.6882437820721301}. Best is trial 499 with value: 0.8396174698878165.[0m
[32m[I 2022-04-21 11:38:38,122][0m Trial 723 finished with value: 0.8340130635607796 and parameters: {'splitter': 'best', 'min_samples_split': 0.12135245366265147, 'min_samples_leaf': 0.0010104123147126238, 'min_weight_fraction_leaf': 0.05638332056546026, 'max_features': 0.6548355159299086}. Best is trial 499 with value: 0.8396174698878165.[0m
[32m[I 2022-04-21 11:38:38,238][0m Trial 724 finished with value: 0.832927284713222 and parameters: {'splitter': 'random', 'min_samples_split': 0.1448202317780808, 'min_samples_leaf': 0.017207111900819874, 'min_weight_fraction_leaf': 0.03290018649338102, 'max_features': 0.7519928926995544}. Best is trial 499 with value: 0.8396174698878165.[0m
[32m[I 2022-04-21 11:38:38,340][0m Trial 725 finished with value: 0.8333498191213747 and parameters: {'splitter': 'best', 'min_samples_split': 0.10095483492701898, 'min_samples_leaf': 0.026941862720556323, 'min_weight_fraction_leaf': 0.06627561200169045, 'max_features': 0.6128657978438302}. Best is trial 499 with value: 0.8396174698878165.[0m
[32m[I 2022-04-21 11:38:38,436][0m Trial 726 finished with value: 0.8372245618281238 and parameters: {'splitter': 'best', 'min_samples_split': 0.09871543748787451, 'min_samples_leaf': 0.010262859624242145, 'min_weight_fraction_leaf': 0.052841985278381, 'max_features': 0.6207558851877686}. Best is trial 499 with value: 0.8396174698878165.[0m
[32m[I 2022-04-21 11:38:38,583][0m Trial 727 finished with value: 0.8340130635607796 and parameters: {'splitter': 'best', 'min_samples_split': 0.10253579066393378, 'min_samples_leaf': 0.056347007070966126, 'min_weight_fraction_leaf': 0.03755164122449882, 'max_features': 0.6720525775377227}. Best is trial 499 with value: 0.8396174698878165.[0m
[32m[I 2022-04-21 11:38:38,782][0m Trial 728 finished with value: 0.8372245618281238 and parameters: {'splitter': 'best', 'min_samples_split': 0.06716386319527842, 'min_samples_leaf': 0.049113736353237944, 'min_weight_fraction_leaf': 0.0224573783986611, 'max_features': 0.7165506496293638}. Best is trial 499 with value: 0.8396174698878165.[0m
[32m[I 2022-04-21 11:38:38,906][0m Trial 729 finished with value: 0.8320143660942818 and parameters: {'splitter': 'best', 'min_samples_split': 0.08780047742575331, 'min_samples_leaf': 0.03945547841824017, 'min_weight_fraction_leaf': 0.04552297819647104, 'max_features': 0.598467473773867}. Best is trial 499 with value: 0.8396174698878165.[0m
[32m[I 2022-04-21 11:38:38,999][0m Trial 730 finished with value: 0.8340130635607796 and parameters: {'splitter': 'best', 'min_samples_split': 0.06264042550272424, 'min_samples_leaf': 0.05834081081242824, 'min_weight_fraction_leaf': 0.020682710749840755, 'max_features': 0.709296976841052}. Best is trial 499 with value: 0.8396174698878165.[0m
[32m[I 2022-04-21 11:38:39,080][0m Trial 731 finished with value: 0.8316169921107444 and parameters: {'splitter': 'best', 'min_samples_split': 0.29716177994310733, 'min_samples_leaf': 0.020390755555209687, 'min_weight_fraction_leaf': 0.029471006492342484, 'max_features': 0.7370997440267761}. Best is trial 499 with value: 0.8396174698878165.[0m
[32m[I 2022-04-21 11:38:39,218][0m Trial 732 finished with value: 0.8340130635607796 and parameters: {'splitter': 'best', 'min_samples_split': 0.13521258133853747, 'min_samples_leaf': 0.026693104824252703, 'min_weight_fraction_leaf': 0.05997544124746062, 'max_features': 0.6628368511988073}. Best is trial 499 with value: 0.8396174698878165.[0m
[32m[I 2022-04-21 11:38:39,409][0m Trial 733 finished with value: 0.8391063129816301 and parameters: {'splitter': 'best', 'min_samples_split': 0.09197829967250612, 'min_samples_leaf': 0.00898192278459974, 'min_weight_fraction_leaf': 0.04664061904026933, 'max_features': 0.6765489946921589}. Best is trial 499 with value: 0.8396174698878165.[0m
[32m[I 2022-04-21 11:38:39,597][0m Trial 734 finished with value: 0.8336210332407393 and parameters: {'splitter': 'best', 'min_samples_split': 0.13377027340956388, 'min_samples_leaf': 0.016214322251117512, 'min_weight_fraction_leaf': 0.07228300109119737, 'max_features': 0.648833088043345}. Best is trial 499 with value: 0.8396174698878165.[0m
[32m[I 2022-04-21 11:38:39,763][0m Trial 735 finished with value: 0.8372245618281238 and parameters: {'splitter': 'best', 'min_samples_split': 0.08677895010434881, 'min_samples_leaf': 0.0011605514086546233, 'min_weight_fraction_leaf': 0.054550943441811085, 'max_features': 0.7338194339375581}. Best is trial 499 with value: 0.8396174698878165.[0m
[32m[I 2022-04-21 11:38:39,986][0m Trial 736 finished with value: 0.832312409597251 and parameters: {'splitter': 'best', 'min_samples_split': 0.07880247774158378, 'min_samples_leaf': 0.009605178442242103, 'min_weight_fraction_leaf': 0.03421980688250403, 'max_features': 0.6825247195598937}. Best is trial 499 with value: 0.8396174698878165.[0m
[32m[I 2022-04-21 11:38:40,113][0m Trial 737 finished with value: 0.8391063129816301 and parameters: {'splitter': 'best', 'min_samples_split': 0.08090374395145995, 'min_samples_leaf': 0.04570716584893155, 'min_weight_fraction_leaf': 0.016837630211378806, 'max_features': 0.7009970028941712}. Best is trial 499 with value: 0.8396174698878165.[0m
[32m[I 2022-04-21 11:38:40,226][0m Trial 738 finished with value: 0.8391063129816301 and parameters: {'splitter': 'best', 'min_samples_split': 0.09172459086811528, 'min_samples_leaf': 0.04752742788925871, 'min_weight_fraction_leaf': 0.02502684001853778, 'max_features': 0.7143400898032343}. Best is trial 499 with value: 0.8396174698878165.[0m
[32m[I 2022-04-21 11:38:40,337][0m Trial 739 finished with value: 0.8316149506675705 and parameters: {'splitter': 'best', 'min_samples_split': 0.2874774144545324, 'min_samples_leaf': 0.022924277068288323, 'min_weight_fraction_leaf': 0.08590992498805818, 'max_features': 0.667999441450688}. Best is trial 499 with value: 0.8396174698878165.[0m
[32m[I 2022-04-21 11:38:40,405][0m Trial 740 finished with value: 0.65 and parameters: {'splitter': 'best', 'min_samples_split': 0.4398984943249161, 'min_samples_leaf': 0.38155948865191947, 'min_weight_fraction_leaf': 0.06220826186800481, 'max_features': 0.6532977598201278}. Best is trial 499 with value: 0.8396174698878165.[0m
[32m[I 2022-04-21 11:38:40,510][0m Trial 741 finished with value: 0.8394676524280678 and parameters: {'splitter': 'best', 'min_samples_split': 0.2772260003932321, 'min_samples_leaf': 0.03616379780394782, 'min_weight_fraction_leaf': 0.04601030169077776, 'max_features': 0.7575174576678356}. Best is trial 499 with value: 0.8396174698878165.[0m
[32m[I 2022-04-21 11:38:40,583][0m Trial 742 finished with value: 0.8337713431190045 and parameters: {'splitter': 'best', 'min_samples_split': 0.06107720552780256, 'min_samples_leaf': 0.03984416469786934, 'min_weight_fraction_leaf': 0.037585596142895604, 'max_features': 0.7488529744802073}. Best is trial 499 with value: 0.8396174698878165.[0m
[32m[I 2022-04-21 11:38:40,645][0m Trial 743 finished with value: 0.8337699781920435 and parameters: {'splitter': 'random', 'min_samples_split': 0.2791442381128835, 'min_samples_leaf': 0.03380333822386912, 'min_weight_fraction_leaf': 0.045185371270963594, 'max_features': 0.7579497123816066}. Best is trial 499 with value: 0.8396174698878165.[0m
[32m[I 2022-04-21 11:38:40,897][0m Trial 744 finished with value: 0.65 and parameters: {'splitter': 'best', 'min_samples_split': 0.2842659516576019, 'min_samples_leaf': 0.43039723339510083, 'min_weight_fraction_leaf': 0.030628619380206754, 'max_features': 0.6900147137874034}. Best is trial 499 with value: 0.8396174698878165.[0m
[32m[I 2022-04-21 11:38:41,231][0m Trial 745 finished with value: 0.8330787034261397 and parameters: {'splitter': 'best', 'min_samples_split': 0.29933208437202563, 'min_samples_leaf': 0.01866069694992145, 'min_weight_fraction_leaf': 0.05432067787195305, 'max_features': 0.7649219137815813}. Best is trial 499 with value: 0.8396174698878165.[0m
[32m[I 2022-04-21 11:38:41,545][0m Trial 746 finished with value: 0.8337713431190045 and parameters: {'splitter': 'best', 'min_samples_split': 0.07458585615717993, 'min_samples_leaf': 0.013478340366699513, 'min_weight_fraction_leaf': 0.040399937436933576, 'max_features': 0.6916546715403298}. Best is trial 499 with value: 0.8396174698878165.[0m
[32m[I 2022-04-21 11:38:41,758][0m Trial 747 finished with value: 0.8337713431190045 and parameters: {'splitter': 'best', 'min_samples_split': 0.07434588992277841, 'min_samples_leaf': 0.0408360454220793, 'min_weight_fraction_leaf': 0.036355161465161816, 'max_features': 0.7626826451386397}. Best is trial 499 with value: 0.8396174698878165.[0m
[32m[I 2022-04-21 11:38:41,863][0m Trial 748 finished with value: 0.8396174698878165 and parameters: {'splitter': 'best', 'min_samples_split': 0.27601698726793805, 'min_samples_leaf': 0.03285502407846526, 'min_weight_fraction_leaf': 0.0506743890400961, 'max_features': 0.7626273138741914}. Best is trial 499 with value: 0.8396174698878165.[0m
[32m[I 2022-04-21 11:38:41,967][0m Trial 749 finished with value: 0.6744920180162803 and parameters: {'splitter': 'best', 'min_samples_split': 0.06046787275938134, 'min_samples_leaf': 0.049910986791329166, 'min_weight_fraction_leaf': 0.3373947233290398, 'max_features': 0.7274912159373333}. Best is trial 499 with value: 0.8396174698878165.[0m
[32m[I 2022-04-21 11:38:42,079][0m Trial 750 finished with value: 0.8355801993971674 and parameters: {'splitter': 'best', 'min_samples_split': 0.275396062933793, 'min_samples_leaf': 0.05762762699808341, 'min_weight_fraction_leaf': 0.01902829409532178, 'max_features': 0.7602768244606236}. Best is trial 499 with value: 0.8396174698878165.[0m
[32m[I 2022-04-21 11:38:42,184][0m Trial 751 finished with value: 0.8337666169009493 and parameters: {'splitter': 'best', 'min_samples_split': 0.2960008157254154, 'min_samples_leaf': 0.021425933705414242, 'min_weight_fraction_leaf': 0.0760895487754929, 'max_features': 0.7676169239673849}. Best is trial 499 with value: 0.8396174698878165.[0m
[32m[I 2022-04-21 11:38:42,284][0m Trial 752 finished with value: 0.8318450474400789 and parameters: {'splitter': 'best', 'min_samples_split': 0.3110661698169689, 'min_samples_leaf': 0.03106893474009312, 'min_weight_fraction_leaf': 0.2841037336280984, 'max_features': 0.74640514267877}. Best is trial 499 with value: 0.8396174698878165.[0m
[32m[I 2022-04-21 11:38:42,392][0m Trial 753 finished with value: 0.8340187950162761 and parameters: {'splitter': 'best', 'min_samples_split': 0.289791713781437, 'min_samples_leaf': 0.02122513088790068, 'min_weight_fraction_leaf': 0.06375449395657118, 'max_features': 0.7656138987616125}. Best is trial 499 with value: 0.8396174698878165.[0m
[32m[I 2022-04-21 11:38:42,491][0m Trial 754 finished with value: 0.8394676524280678 and parameters: {'splitter': 'best', 'min_samples_split': 0.2735971010593191, 'min_samples_leaf': 0.04170786489689859, 'min_weight_fraction_leaf': 0.03660715861200596, 'max_features': 0.7334868960631307}. Best is trial 499 with value: 0.8396174698878165.[0m
[32m[I 2022-04-21 11:38:42,593][0m Trial 755 finished with value: 0.8355801993971674 and parameters: {'splitter': 'best', 'min_samples_split': 0.27578790605020453, 'min_samples_leaf': 0.025579704804303008, 'min_weight_fraction_leaf': 0.056216556770428965, 'max_features': 0.7392102201463121}. Best is trial 499 with value: 0.8396174698878165.[0m
