[32m[I 2022-04-21 11:38:58,980][0m Trial 328 finished with value: 0.8146582381332896 and parameters: {'splitter': 'best', 'min_samples_split': 0.17190202833559262, 'min_samples_leaf': 0.03536540576187266, 'min_weight_fraction_leaf': 0.00908624779090181, 'max_features': 0.39457031605845616}. Best is trial 208 with value: 0.8264270922211081.[0m
[32m[I 2022-04-21 11:38:59,219][0m Trial 329 finished with value: 0.7026183465252862 and parameters: {'splitter': 'best', 'min_samples_split': 0.329186281840664, 'min_samples_leaf': 0.0203180231252445, 'min_weight_fraction_leaf': 0.023745300701412942, 'max_features': 0.33982789893705395}. Best is trial 208 with value: 0.8264270922211081.[0m
[32m[I 2022-04-21 11:38:59,350][0m Trial 330 finished with value: 0.8018025679785147 and parameters: {'splitter': 'random', 'min_samples_split': 0.11916990666077747, 'min_samples_leaf': 0.009846140259492295, 'min_weight_fraction_leaf': 0.015655099338474622, 'max_features': 0.4989870621426653}. Best is trial 208 with value: 0.8264270922211081.[0m
[32m[I 2022-04-21 11:38:59,447][0m Trial 331 finished with value: 0.6623763448810197 and parameters: {'splitter': 'best', 'min_samples_split': 0.10756335205473538, 'min_samples_leaf': 0.26156064448349, 'min_weight_fraction_leaf': 0.007951761165591048, 'max_features': 0.409376843748324}. Best is trial 208 with value: 0.8264270922211081.[0m
[32m[I 2022-04-21 11:38:59,664][0m Trial 332 finished with value: 0.7876178177814132 and parameters: {'splitter': 'best', 'min_samples_split': 0.10200565941738977, 'min_samples_leaf': 0.025129784766266754, 'min_weight_fraction_leaf': 0.053393662829266886, 'max_features': 0.3688267951061757}. Best is trial 208 with value: 0.8264270922211081.[0m
[32m[I 2022-04-21 11:38:59,851][0m Trial 333 finished with value: 0.8160473950031266 and parameters: {'splitter': 'best', 'min_samples_split': 0.1240516469418921, 'min_samples_leaf': 0.051633200126291676, 'min_weight_fraction_leaf': 0.0006229409163203727, 'max_features': 0.38680014632093995}. Best is trial 208 with value: 0.8264270922211081.[0m
[32m[I 2022-04-21 11:39:00,145][0m Trial 334 finished with value: 0.7029086197732394 and parameters: {'splitter': 'best', 'min_samples_split': 0.27561545221521994, 'min_samples_leaf': 0.0011048717723880978, 'min_weight_fraction_leaf': 0.038799182272226285, 'max_features': 0.4360452645202686}. Best is trial 208 with value: 0.8264270922211081.[0m
[32m[I 2022-04-21 11:39:00,658][0m Trial 335 finished with value: 0.8100762013622482 and parameters: {'splitter': 'best', 'min_samples_split': 0.14120747275948842, 'min_samples_leaf': 0.018267726402792343, 'min_weight_fraction_leaf': 9.625222606042191e-05, 'max_features': 0.2804356305395171}. Best is trial 208 with value: 0.8264270922211081.[0m
[32m[I 2022-04-21 11:39:01,178][0m Trial 336 finished with value: 0.8142381147734457 and parameters: {'splitter': 'best', 'min_samples_split': 0.15918507384041103, 'min_samples_leaf': 0.010549992283490281, 'min_weight_fraction_leaf': 0.021452599774842672, 'max_features': 0.4014848693744747}. Best is trial 208 with value: 0.8264270922211081.[0m
[32m[I 2022-04-21 11:39:01,420][0m Trial 337 finished with value: 0.7996915631019735 and parameters: {'splitter': 'best', 'min_samples_split': 0.09522023297049327, 'min_samples_leaf': 0.03174288780761926, 'min_weight_fraction_leaf': 0.028822015486906993, 'max_features': 0.34768900889746707}. Best is trial 208 with value: 0.8264270922211081.[0m
[32m[I 2022-04-21 11:39:01,733][0m Trial 338 finished with value: 0.8086302389680725 and parameters: {'splitter': 'best', 'min_samples_split': 0.11404298290077626, 'min_samples_leaf': 0.041790271962232096, 'min_weight_fraction_leaf': 0.014924429925116089, 'max_features': 0.41908039473575787}. Best is trial 208 with value: 0.8264270922211081.[0m
[32m[I 2022-04-21 11:39:02,028][0m Trial 339 finished with value: 0.8178986542503219 and parameters: {'splitter': 'best', 'min_samples_split': 0.10899906761270758, 'min_samples_leaf': 0.018273219455537355, 'min_weight_fraction_leaf': 0.009850626236100404, 'max_features': 0.3753925887525917}. Best is trial 208 with value: 0.8264270922211081.[0m
/media/san2_ssd/data/Workdir/survival/utils.py:305: RuntimeWarning: invalid value encountered in true_divide
  pdfs = np.gradient(1-survs,axis=1)/norms
[32m[I 2022-04-21 11:39:02,658][0m Trial 340 finished with value: 0.8155273968583909 and parameters: {'splitter': 'best', 'min_samples_split': 0.12700617360183455, 'min_samples_leaf': 0.011125086966848528, 'min_weight_fraction_leaf': 0.020081025142210513, 'max_features': 0.4599757766906397}. Best is trial 208 with value: 0.8264270922211081.[0m
[32m[I 2022-04-21 11:39:02,886][0m Trial 341 finished with value: 0.8094306216581083 and parameters: {'splitter': 'random', 'min_samples_split': 0.0994175475706392, 'min_samples_leaf': 0.029745566772707045, 'min_weight_fraction_leaf': 0.02981438480738536, 'max_features': 0.33207894739050314}. Best is trial 208 with value: 0.8264270922211081.[0m
[32m[I 2022-04-21 11:39:03,522][0m Trial 342 finished with value: 0.7152132872201558 and parameters: {'splitter': 'best', 'min_samples_split': 0.3443035985469803, 'min_samples_leaf': 0.019212109629166876, 'min_weight_fraction_leaf': 0.00012138612625108881, 'max_features': 0.3930437412584121}. Best is trial 208 with value: 0.8264270922211081.[0m
/media/san2_ssd/data/Workdir/survival/utils.py:305: RuntimeWarning: invalid value encountered in true_divide
  pdfs = np.gradient(1-survs,axis=1)/norms
[32m[I 2022-04-21 11:39:04,395][0m Trial 343 finished with value: 0.8208765530739097 and parameters: {'splitter': 'best', 'min_samples_split': 0.06547857647808333, 'min_samples_leaf': 0.00835298296300907, 'min_weight_fraction_leaf': 0.01042382269506877, 'max_features': 0.3619297547759834}. Best is trial 208 with value: 0.8264270922211081.[0m
[32m[I 2022-04-21 11:39:04,935][0m Trial 344 finished with value: 0.8045777951091724 and parameters: {'splitter': 'best', 'min_samples_split': 0.06343517843132951, 'min_samples_leaf': 0.0012235290167268644, 'min_weight_fraction_leaf': 0.03976533911295614, 'max_features': 0.3579899443314079}. Best is trial 208 with value: 0.8264270922211081.[0m
/media/san2_ssd/data/Workdir/survival/utils.py:305: RuntimeWarning: invalid value encountered in true_divide
  pdfs = np.gradient(1-survs,axis=1)/norms
/media/san2_ssd/data/Workdir/survival/utils.py:305: RuntimeWarning: invalid value encountered in true_divide
  pdfs = np.gradient(1-survs,axis=1)/norms
[32m[I 2022-04-21 11:39:05,418][0m Trial 345 finished with value: 0.8160934206981685 and parameters: {'splitter': 'best', 'min_samples_split': 0.06698806730469632, 'min_samples_leaf': 0.009073863373807464, 'min_weight_fraction_leaf': 0.01498630775395826, 'max_features': 0.30928285076362866}. Best is trial 208 with value: 0.8264270922211081.[0m
/media/san2_ssd/data/Workdir/survival/utils.py:305: RuntimeWarning: invalid value encountered in true_divide
  pdfs = np.gradient(1-survs,axis=1)/norms
[32m[I 2022-04-21 11:39:05,724][0m Trial 346 finished with value: 0.8038723636250349 and parameters: {'splitter': 'best', 'min_samples_split': 0.09175779239626258, 'min_samples_leaf': 0.0011430930562037825, 'min_weight_fraction_leaf': 0.02749530413350077, 'max_features': 0.3592889055874727}. Best is trial 208 with value: 0.8264270922211081.[0m
[32m[I 2022-04-21 11:39:05,881][0m Trial 347 finished with value: 0.6709180956894722 and parameters: {'splitter': 'best', 'min_samples_split': 0.4901659215963079, 'min_samples_leaf': 0.02570726033657124, 'min_weight_fraction_leaf': 0.0686437181140275, 'max_features': 0.3273696958718055}. Best is trial 208 with value: 0.8264270922211081.[0m
/media/san2_ssd/data/Workdir/survival/utils.py:305: RuntimeWarning: invalid value encountered in true_divide
  pdfs = np.gradient(1-survs,axis=1)/norms
[32m[I 2022-04-21 11:39:06,415][0m Trial 348 finished with value: 0.8160496493716479 and parameters: {'splitter': 'best', 'min_samples_split': 0.07545345195826755, 'min_samples_leaf': 0.01524680351563197, 'min_weight_fraction_leaf': 0.010208650548859683, 'max_features': 0.5370969320349515}. Best is trial 208 with value: 0.8264270922211081.[0m
[32m[I 2022-04-21 11:39:06,515][0m Trial 349 finished with value: 0.5647344285131972 and parameters: {'splitter': 'best', 'min_samples_split': 0.053345292017052515, 'min_samples_leaf': 0.31220251883614386, 'min_weight_fraction_leaf': 0.021311874264842996, 'max_features': 0.37792588815620604}. Best is trial 208 with value: 0.8264270922211081.[0m
[32m[I 2022-04-21 11:39:06,727][0m Trial 350 finished with value: 0.8084637919749411 and parameters: {'splitter': 'best', 'min_samples_split': 0.0428650313776621, 'min_samples_leaf': 0.038451190139849954, 'min_weight_fraction_leaf': 0.04604160469381521, 'max_features': 0.3475918897334283}. Best is trial 208 with value: 0.8264270922211081.[0m
[32m[I 2022-04-21 11:39:07,028][0m Trial 351 finished with value: 0.8025066829853845 and parameters: {'splitter': 'best', 'min_samples_split': 0.07564241592589381, 'min_samples_leaf': 0.02578776249129457, 'min_weight_fraction_leaf': 0.03404491461261395, 'max_features': 0.39217907346460834}. Best is trial 208 with value: 0.8264270922211081.[0m
/media/san2_ssd/data/Workdir/survival/utils.py:305: RuntimeWarning: invalid value encountered in true_divide
  pdfs = np.gradient(1-survs,axis=1)/norms
[32m[I 2022-04-21 11:39:07,382][0m Trial 352 finished with value: 0.8221592381974157 and parameters: {'splitter': 'best', 'min_samples_split': 0.08696415385367594, 'min_samples_leaf': 0.011455766071622856, 'min_weight_fraction_leaf': 0.010002245735388103, 'max_features': 0.2973205866178553}. Best is trial 208 with value: 0.8264270922211081.[0m
[32m[I 2022-04-21 11:39:07,508][0m Trial 353 finished with value: 0.795894134635138 and parameters: {'splitter': 'random', 'min_samples_split': 0.08334951759072062, 'min_samples_leaf': 0.04539136664965428, 'min_weight_fraction_leaf': 0.09756833898089426, 'max_features': 0.3678508854677324}. Best is trial 208 with value: 0.8264270922211081.[0m
[32m[I 2022-04-21 11:39:07,845][0m Trial 354 finished with value: 0.6768588432989715 and parameters: {'splitter': 'best', 'min_samples_split': 0.25714415758546805, 'min_samples_leaf': 0.01840749646396716, 'min_weight_fraction_leaf': 0.19851479359313107, 'max_features': 0.2610803062643533}. Best is trial 208 with value: 0.8264270922211081.[0m
[32m[I 2022-04-21 11:39:08,380][0m Trial 355 finished with value: 0.8120006685273061 and parameters: {'splitter': 'best', 'min_samples_split': 0.06937491967696402, 'min_samples_leaf': 0.032605812276048356, 'min_weight_fraction_leaf': 0.010896155104219124, 'max_features': 0.409070271204228}. Best is trial 208 with value: 0.8264270922211081.[0m
/media/san2_ssd/data/Workdir/survival/utils.py:305: RuntimeWarning: invalid value encountered in true_divide
  pdfs = np.gradient(1-survs,axis=1)/norms
[32m[I 2022-04-21 11:39:08,994][0m Trial 356 finished with value: 0.8075903600831349 and parameters: {'splitter': 'best', 'min_samples_split': 0.09099958134173797, 'min_samples_leaf': 0.013914311345857577, 'min_weight_fraction_leaf': 0.008276706365314152, 'max_features': 0.3844514255437211}. Best is trial 208 with value: 0.8264270922211081.[0m
[32m[I 2022-04-21 11:39:09,205][0m Trial 357 finished with value: 0.8151918769584249 and parameters: {'splitter': 'best', 'min_samples_split': 0.10174322846822445, 'min_samples_leaf': 0.06616150111223308, 'min_weight_fraction_leaf': 0.022890023846239383, 'max_features': 0.33593376208117187}. Best is trial 208 with value: 0.8264270922211081.[0m
[32m[I 2022-04-21 11:39:09,744][0m Trial 358 finished with value: 0.8164243699532511 and parameters: {'splitter': 'best', 'min_samples_split': 0.08404693697421552, 'min_samples_leaf': 0.026810483920028542, 'min_weight_fraction_leaf': 0.007340573606540208, 'max_features': 0.4280168674969091}. Best is trial 208 with value: 0.8264270922211081.[0m
/media/san2_ssd/data/Workdir/survival/utils.py:305: RuntimeWarning: invalid value encountered in true_divide
  pdfs = np.gradient(1-survs,axis=1)/norms
/media/san2_ssd/data/Workdir/survival/utils.py:305: RuntimeWarning: invalid value encountered in true_divide
  pdfs = np.gradient(1-survs,axis=1)/norms
/media/san2_ssd/data/Workdir/survival/utils.py:305: RuntimeWarning: invalid value encountered in true_divide
  pdfs = np.gradient(1-survs,axis=1)/norms
[32m[I 2022-04-21 11:39:10,331][0m Trial 359 finished with value: 0.8166445242301057 and parameters: {'splitter': 'best', 'min_samples_split': 0.06447195359350173, 'min_samples_leaf': 0.011921389663620927, 'min_weight_fraction_leaf': 0.020071590748837766, 'max_features': 0.36456820709241766}. Best is trial 208 with value: 0.8264270922211081.[0m
[32m[I 2022-04-21 11:39:10,988][0m Trial 360 finished with value: 0.7958952044470898 and parameters: {'splitter': 'best', 'min_samples_split': 0.09376883764211039, 'min_samples_leaf': 0.020650778065454657, 'min_weight_fraction_leaf': 0.03085278196093283, 'max_features': 0.28947126950416985}. Best is trial 208 with value: 0.8264270922211081.[0m
[32m[I 2022-04-21 11:39:11,482][0m Trial 361 finished with value: 0.8038636084956009 and parameters: {'splitter': 'best', 'min_samples_split': 0.07552475433894722, 'min_samples_leaf': 0.03682350154495935, 'min_weight_fraction_leaf': 1.7361619596874267e-05, 'max_features': 0.24209149126778762}. Best is trial 208 with value: 0.8264270922211081.[0m
/media/san2_ssd/data/Workdir/survival/utils.py:305: RuntimeWarning: invalid value encountered in true_divide
  pdfs = np.gradient(1-survs,axis=1)/norms
/media/san2_ssd/data/Workdir/survival/utils.py:305: RuntimeWarning: invalid value encountered in true_divide
  pdfs = np.gradient(1-survs,axis=1)/norms
[32m[I 2022-04-21 11:39:12,193][0m Trial 362 finished with value: 0.8103289844038587 and parameters: {'splitter': 'best', 'min_samples_split': 0.10739510547573189, 'min_samples_leaf': 0.009534753162094203, 'min_weight_fraction_leaf': 0.01564076092770733, 'max_features': 0.39821064865883443}. Best is trial 208 with value: 0.8264270922211081.[0m
[32m[I 2022-04-21 11:39:13,856][0m Trial 363 finished with value: 0.8135415557239105 and parameters: {'splitter': 'best', 'min_samples_split': 0.0970819808115228, 'min_samples_leaf': 0.001141713145886708, 'min_weight_fraction_leaf': 0.007847117836885594, 'max_features': 0.4429895392439511}. Best is trial 208 with value: 0.8264270922211081.[0m
[32m[I 2022-04-21 11:39:14,134][0m Trial 364 finished with value: 0.7904962123700974 and parameters: {'splitter': 'random', 'min_samples_split': 0.08216183986287673, 'min_samples_leaf': 0.1221430997581586, 'min_weight_fraction_leaf': 0.00011226038861481512, 'max_features': 0.4141956669976546}. Best is trial 208 with value: 0.8264270922211081.[0m
[32m[I 2022-04-21 11:39:14,557][0m Trial 365 finished with value: 0.779801885174734 and parameters: {'splitter': 'best', 'min_samples_split': 0.11426579795185257, 'min_samples_leaf': 0.022702219821693532, 'min_weight_fraction_leaf': 0.17087926068963502, 'max_features': 0.3792579457073467}. Best is trial 208 with value: 0.8264270922211081.[0m
[32m[I 2022-04-21 11:39:14,924][0m Trial 366 finished with value: 0.7943166405448497 and parameters: {'splitter': 'best', 'min_samples_split': 0.3141643816259918, 'min_samples_leaf': 0.05143848130466072, 'min_weight_fraction_leaf': 0.02672067009669185, 'max_features': 0.3549448359971765}. Best is trial 208 with value: 0.8264270922211081.[0m
[32m[I 2022-04-21 11:39:15,402][0m Trial 367 finished with value: 0.8171438278101156 and parameters: {'splitter': 'best', 'min_samples_split': 0.05497265069129412, 'min_samples_leaf': 0.010871035740584834, 'min_weight_fraction_leaf': 0.03943040395693031, 'max_features': 0.32147929249734686}. Best is trial 208 with value: 0.8264270922211081.[0m
[32m[I 2022-04-21 11:39:15,894][0m Trial 368 finished with value: 0.8194459852554168 and parameters: {'splitter': 'best', 'min_samples_split': 0.10192767036903155, 'min_samples_leaf': 0.03344122864218287, 'min_weight_fraction_leaf': 0.01763151929413499, 'max_features': 0.4017901085859755}. Best is trial 208 with value: 0.8264270922211081.[0m
[32m[I 2022-04-21 11:39:16,286][0m Trial 369 finished with value: 0.8098862624521097 and parameters: {'splitter': 'best', 'min_samples_split': 0.09035759705433083, 'min_samples_leaf': 0.04410110209725725, 'min_weight_fraction_leaf': 0.018300096354464078, 'max_features': 0.4266555280390567}. Best is trial 208 with value: 0.8264270922211081.[0m
[32m[I 2022-04-21 11:39:16,750][0m Trial 370 finished with value: 0.8092692691519383 and parameters: {'splitter': 'best', 'min_samples_split': 0.10213963526796646, 'min_samples_leaf': 0.031619703891084885, 'min_weight_fraction_leaf': 0.008934037703173633, 'max_features': 0.4621623109089531}. Best is trial 208 with value: 0.8264270922211081.[0m
[32m[I 2022-04-21 11:39:17,353][0m Trial 371 finished with value: 0.8023526623717097 and parameters: {'splitter': 'best', 'min_samples_split': 0.07400309676226287, 'min_samples_leaf': 0.04181334016780993, 'min_weight_fraction_leaf': 0.028439048750989782, 'max_features': 0.3983977525779093}. Best is trial 208 with value: 0.8264270922211081.[0m
/media/san2_ssd/data/Workdir/survival/utils.py:305: RuntimeWarning: invalid value encountered in true_divide
  pdfs = np.gradient(1-survs,axis=1)/norms
[32m[I 2022-04-21 11:39:17,905][0m Trial 372 finished with value: 0.8053467395345795 and parameters: {'splitter': 'best', 'min_samples_split': 0.1064122343092242, 'min_samples_leaf': 0.03268575480414593, 'min_weight_fraction_leaf': 0.01707919852685132, 'max_features': 0.43956150955042894}. Best is trial 208 with value: 0.8264270922211081.[0m
[32m[I 2022-04-21 11:39:18,275][0m Trial 373 finished with value: 0.805352812922675 and parameters: {'splitter': 'best', 'min_samples_split': 0.09079191636956391, 'min_samples_leaf': 0.05350251745469766, 'min_weight_fraction_leaf': 0.050803171112451494, 'max_features': 0.4146781432063747}. Best is trial 208 with value: 0.8264270922211081.[0m
[32m[I 2022-04-21 11:39:18,824][0m Trial 374 finished with value: 0.8060270176876468 and parameters: {'splitter': 'best', 'min_samples_split': 0.0814167731115339, 'min_samples_leaf': 0.023606107636055175, 'min_weight_fraction_leaf': 0.00037726826586469836, 'max_features': 0.3811177143348264}. Best is trial 208 with value: 0.8264270922211081.[0m
/media/san2_ssd/data/Workdir/survival/utils.py:305: RuntimeWarning: invalid value encountered in true_divide
  pdfs = np.gradient(1-survs,axis=1)/norms
[32m[I 2022-04-21 11:39:19,538][0m Trial 375 finished with value: 0.7970101877576887 and parameters: {'splitter': 'best', 'min_samples_split': 0.0977799905329986, 'min_samples_leaf': 0.020139115993244465, 'min_weight_fraction_leaf': 0.009196888149127965, 'max_features': 0.4065585598251728}. Best is trial 208 with value: 0.8264270922211081.[0m
[32m[I 2022-04-21 11:39:19,801][0m Trial 376 finished with value: 0.8086254140301218 and parameters: {'splitter': 'random', 'min_samples_split': 0.11415669096267747, 'min_samples_leaf': 0.03379053996801222, 'min_weight_fraction_leaf': 0.03401492095703721, 'max_features': 0.4851963209608474}. Best is trial 208 with value: 0.8264270922211081.[0m
/media/san2_ssd/data/Workdir/survival/utils.py:305: RuntimeWarning: invalid value encountered in true_divide
  pdfs = np.gradient(1-survs,axis=1)/norms
/media/san2_ssd/data/Workdir/survival/utils.py:305: RuntimeWarning: invalid value encountered in true_divide
  pdfs = np.gradient(1-survs,axis=1)/norms
/media/san2_ssd/data/Workdir/survival/utils.py:305: RuntimeWarning: invalid value encountered in true_divide
  pdfs = np.gradient(1-survs,axis=1)/norms
[32m[I 2022-04-21 11:39:20,780][0m Trial 377 finished with value: 0.8192748810502554 and parameters: {'splitter': 'best', 'min_samples_split': 0.06373079816090774, 'min_samples_leaf': 0.01796633386833301, 'min_weight_fraction_leaf': 0.022763321596459097, 'max_features': 0.7613858782378311}. Best is trial 208 with value: 0.8264270922211081.[0m
/media/san2_ssd/data/Workdir/survival/utils.py:305: RuntimeWarning: invalid value encountered in true_divide
  pdfs = np.gradient(1-survs,axis=1)/norms
/media/san2_ssd/data/Workdir/survival/utils.py:305: RuntimeWarning: invalid value encountered in true_divide
  pdfs = np.gradient(1-survs,axis=1)/norms
[32m[I 2022-04-21 11:39:21,662][0m Trial 378 finished with value: 0.7993625220787343 and parameters: {'splitter': 'best', 'min_samples_split': 0.1054314208120633, 'min_samples_leaf': 0.010219331629566564, 'min_weight_fraction_leaf': 0.00960629145528205, 'max_features': 0.3494433591733246}. Best is trial 208 with value: 0.8264270922211081.[0m
/media/san2_ssd/data/Workdir/survival/utils.py:305: RuntimeWarning: invalid value encountered in true_divide
  pdfs = np.gradient(1-survs,axis=1)/norms
[32m[I 2022-04-21 11:39:22,177][0m Trial 379 finished with value: 0.8181615805035841 and parameters: {'splitter': 'best', 'min_samples_split': 0.08797958150844548, 'min_samples_leaf': 0.02812365691023183, 'min_weight_fraction_leaf': 0.017419368127204977, 'max_features': 0.392902214791282}. Best is trial 208 with value: 0.8264270922211081.[0m
[32m[I 2022-04-21 11:39:22,532][0m Trial 380 finished with value: 0.8093046466682878 and parameters: {'splitter': 'best', 'min_samples_split': 0.09749127358074808, 'min_samples_leaf': 0.08967760226326318, 'min_weight_fraction_leaf': 0.026106879301178318, 'max_features': 0.4544440476406765}. Best is trial 208 with value: 0.8264270922211081.[0m
