[32m[I 2022-04-21 14:19:12,309][0m Trial 214 finished with value: 0.835519290914522 and parameters: {'alpha': 3.6210518284628375, 'ties': 'breslow'}. Best is trial 70 with value: 0.835911286090736.[0m
[32m[I 2022-04-21 14:19:55,691][0m Trial 215 finished with value: 0.8352095089409325 and parameters: {'alpha': 4.00998886627954, 'ties': 'breslow'}. Best is trial 70 with value: 0.835911286090736.[0m
[32m[I 2022-04-21 14:20:37,987][0m Trial 216 finished with value: 0.835911286090736 and parameters: {'alpha': 3.776243930513946, 'ties': 'breslow'}. Best is trial 70 with value: 0.835911286090736.[0m
[32m[I 2022-04-21 14:21:19,520][0m Trial 217 finished with value: 0.8357567045863414 and parameters: {'alpha': 3.7546140263462657, 'ties': 'breslow'}. Best is trial 70 with value: 0.835911286090736.[0m
[32m[I 2022-04-21 14:22:02,484][0m Trial 218 finished with value: 0.8355193570680342 and parameters: {'alpha': 3.5622126413343085, 'ties': 'breslow'}. Best is trial 70 with value: 0.835911286090736.[0m
[32m[I 2022-04-21 14:22:44,989][0m Trial 219 finished with value: 0.8356374099959277 and parameters: {'alpha': 3.9342404017369987, 'ties': 'breslow'}. Best is trial 70 with value: 0.835911286090736.[0m
[32m[I 2022-04-21 14:23:26,726][0m Trial 220 finished with value: 0.8356715428291757 and parameters: {'alpha': 3.818425456361846, 'ties': 'breslow'}. Best is trial 70 with value: 0.835911286090736.[0m
[32m[I 2022-04-21 14:24:09,362][0m Trial 221 finished with value: 0.8358321902886627 and parameters: {'alpha': 3.781951228017145, 'ties': 'breslow'}. Best is trial 70 with value: 0.835911286090736.[0m
[32m[I 2022-04-21 14:24:52,223][0m Trial 222 finished with value: 0.83567829895715 and parameters: {'alpha': 3.7180824442635254, 'ties': 'breslow'}. Best is trial 70 with value: 0.835911286090736.[0m
[32m[I 2022-04-21 14:25:35,483][0m Trial 223 finished with value: 0.8354787801983354 and parameters: {'alpha': 3.658117207412704, 'ties': 'breslow'}. Best is trial 70 with value: 0.835911286090736.[0m
[32m[I 2022-04-21 14:26:17,950][0m Trial 224 finished with value: 0.8357048077433703 and parameters: {'alpha': 3.8526173203083047, 'ties': 'breslow'}. Best is trial 70 with value: 0.835911286090736.[0m
[32m[I 2022-04-21 14:27:01,191][0m Trial 225 finished with value: 0.8357914144599559 and parameters: {'alpha': 3.7950901848211944, 'ties': 'breslow'}. Best is trial 70 with value: 0.835911286090736.[0m
[32m[I 2022-04-21 14:27:43,950][0m Trial 226 finished with value: 0.8355987587565291 and parameters: {'alpha': 3.935928500333208, 'ties': 'breslow'}. Best is trial 70 with value: 0.835911286090736.[0m
[32m[I 2022-04-21 14:28:26,646][0m Trial 227 finished with value: 0.8355583611728576 and parameters: {'alpha': 3.6810719531154144, 'ties': 'breslow'}. Best is trial 70 with value: 0.835911286090736.[0m
[32m[I 2022-04-21 14:29:07,794][0m Trial 228 finished with value: 0.8353628700474047 and parameters: {'alpha': 4.075935504275701, 'ties': 'breslow'}. Best is trial 70 with value: 0.835911286090736.[0m
[32m[I 2022-04-21 14:29:51,272][0m Trial 229 finished with value: 0.835911286090736 and parameters: {'alpha': 3.7750669899062994, 'ties': 'breslow'}. Best is trial 70 with value: 0.835911286090736.[0m
[32m[I 2022-04-21 14:30:32,190][0m Trial 230 finished with value: 0.8355959092618619 and parameters: {'alpha': 3.525522368651663, 'ties': 'breslow'}. Best is trial 70 with value: 0.835911286090736.[0m
[32m[I 2022-04-21 14:31:15,430][0m Trial 231 finished with value: 0.835911286090736 and parameters: {'alpha': 3.771367318554326, 'ties': 'breslow'}. Best is trial 70 with value: 0.835911286090736.[0m
[32m[I 2022-04-21 14:31:58,241][0m Trial 232 finished with value: 0.8357953558257399 and parameters: {'alpha': 3.7604154744204146, 'ties': 'breslow'}. Best is trial 70 with value: 0.835911286090736.[0m
[32m[I 2022-04-21 14:32:41,859][0m Trial 233 finished with value: 0.8354787801983354 and parameters: {'alpha': 3.6381805966208978, 'ties': 'breslow'}. Best is trial 70 with value: 0.835911286090736.[0m
[32m[I 2022-04-21 14:33:25,308][0m Trial 234 finished with value: 0.8357190747858569 and parameters: {'alpha': 3.73124943422591, 'ties': 'breslow'}. Best is trial 70 with value: 0.835911286090736.[0m
[32m[I 2022-04-21 14:34:07,919][0m Trial 235 finished with value: 0.8356689341023882 and parameters: {'alpha': 3.8826976056185507, 'ties': 'breslow'}. Best is trial 70 with value: 0.835911286090736.[0m
[32m[I 2022-04-21 14:34:51,268][0m Trial 236 finished with value: 0.8358336757991058 and parameters: {'alpha': 3.7649875508051056, 'ties': 'breslow'}. Best is trial 70 with value: 0.835911286090736.[0m
[32m[I 2022-04-21 14:35:33,232][0m Trial 237 finished with value: 0.8356373692220262 and parameters: {'alpha': 3.6121008197965185, 'ties': 'efron'}. Best is trial 70 with value: 0.835911286090736.[0m
[32m[I 2022-04-21 14:36:16,949][0m Trial 238 finished with value: 0.8357190747858569 and parameters: {'alpha': 3.7303449658378933, 'ties': 'breslow'}. Best is trial 70 with value: 0.835911286090736.[0m
[32m[I 2022-04-21 14:36:57,192][0m Trial 239 finished with value: 0.8354049296341829 and parameters: {'alpha': 3.9573597078350944, 'ties': 'breslow'}. Best is trial 70 with value: 0.835911286090736.[0m
[32m[I 2022-04-21 14:37:39,291][0m Trial 240 finished with value: 0.835588281099821 and parameters: {'alpha': 3.8383227157457713, 'ties': 'breslow'}. Best is trial 70 with value: 0.835911286090736.[0m
[32m[I 2022-04-21 14:38:20,348][0m Trial 241 finished with value: 0.8358336757991058 and parameters: {'alpha': 3.7650034660184906, 'ties': 'breslow'}. Best is trial 70 with value: 0.835911286090736.[0m
[32m[I 2022-04-21 14:39:03,556][0m Trial 242 finished with value: 0.8356396477177512 and parameters: {'alpha': 3.713444197197694, 'ties': 'breslow'}. Best is trial 70 with value: 0.835911286090736.[0m
[32m[I 2022-04-21 14:39:44,358][0m Trial 243 finished with value: 0.8357052929158193 and parameters: {'alpha': 3.8583456066985846, 'ties': 'breslow'}. Best is trial 70 with value: 0.835911286090736.[0m
[32m[I 2022-04-21 14:40:25,170][0m Trial 244 finished with value: 0.8354787801983354 and parameters: {'alpha': 3.6615181340293033, 'ties': 'breslow'}. Best is trial 70 with value: 0.835911286090736.[0m
[32m[I 2022-04-21 14:41:09,427][0m Trial 245 finished with value: 0.835911286090736 and parameters: {'alpha': 3.7761961083124596, 'ties': 'breslow'}. Best is trial 70 with value: 0.835911286090736.[0m
[32m[I 2022-04-21 14:41:52,291][0m Trial 246 finished with value: 0.8356281582736811 and parameters: {'alpha': 3.8997410978728277, 'ties': 'breslow'}. Best is trial 70 with value: 0.835911286090736.[0m
[32m[I 2022-04-21 14:42:38,700][0m Trial 247 finished with value: 0.8348825667765883 and parameters: {'alpha': 2.652034697161433, 'ties': 'breslow'}. Best is trial 70 with value: 0.835911286090736.[0m
[32m[I 2022-04-21 14:43:23,608][0m Trial 248 finished with value: 0.8355193570680342 and parameters: {'alpha': 3.559144191917965, 'ties': 'breslow'}. Best is trial 70 with value: 0.835911286090736.[0m
[32m[I 2022-04-21 14:44:06,499][0m Trial 249 finished with value: 0.8358705102620287 and parameters: {'alpha': 3.7779482572434295, 'ties': 'breslow'}. Best is trial 70 with value: 0.835911286090736.[0m
[32m[I 2022-04-21 14:44:50,566][0m Trial 250 finished with value: 0.8354787801983354 and parameters: {'alpha': 3.6568577315753577, 'ties': 'breslow'}. Best is trial 70 with value: 0.835911286090736.[0m
[32m[I 2022-04-21 14:45:34,557][0m Trial 251 finished with value: 0.8357914144599559 and parameters: {'alpha': 3.794242987461691, 'ties': 'breslow'}. Best is trial 70 with value: 0.835911286090736.[0m
[32m[I 2022-04-21 14:46:18,199][0m Trial 252 finished with value: 0.8354049296341829 and parameters: {'alpha': 3.9700239689311863, 'ties': 'breslow'}. Best is trial 70 with value: 0.835911286090736.[0m
[32m[I 2022-04-21 14:47:02,426][0m Trial 253 finished with value: 0.8357052929158193 and parameters: {'alpha': 3.8607592080398407, 'ties': 'breslow'}. Best is trial 70 with value: 0.835911286090736.[0m
[32m[I 2022-04-21 14:47:45,868][0m Trial 254 finished with value: 0.8355446970634739 and parameters: {'alpha': 3.432709811494965, 'ties': 'breslow'}. Best is trial 70 with value: 0.835911286090736.[0m
[32m[I 2022-04-21 14:48:28,533][0m Trial 255 finished with value: 0.8356396477177512 and parameters: {'alpha': 3.7147532313928804, 'ties': 'breslow'}. Best is trial 70 with value: 0.835911286090736.[0m
[32m[I 2022-04-21 14:49:13,680][0m Trial 256 finished with value: 0.8354805519222193 and parameters: {'alpha': 3.586094334454194, 'ties': 'breslow'}. Best is trial 70 with value: 0.835911286090736.[0m
[32m[I 2022-04-21 14:49:57,693][0m Trial 257 finished with value: 0.8352095089409325 and parameters: {'alpha': 4.011385351660866, 'ties': 'breslow'}. Best is trial 70 with value: 0.835911286090736.[0m
[32m[I 2022-04-21 14:50:40,171][0m Trial 258 finished with value: 0.8357914144599559 and parameters: {'alpha': 3.7893254485224386, 'ties': 'breslow'}. Best is trial 70 with value: 0.835911286090736.[0m
[32m[I 2022-04-21 14:51:22,169][0m Trial 259 finished with value: 0.8356281582736811 and parameters: {'alpha': 3.9126509165816787, 'ties': 'breslow'}. Best is trial 70 with value: 0.835911286090736.[0m
[32m[I 2022-04-21 14:52:07,337][0m Trial 260 finished with value: 0.8354787801983354 and parameters: {'alpha': 3.6556534888215255, 'ties': 'breslow'}. Best is trial 70 with value: 0.835911286090736.[0m
[32m[I 2022-04-21 14:52:49,299][0m Trial 261 finished with value: 0.8357048077433703 and parameters: {'alpha': 3.8511767638132, 'ties': 'breslow'}. Best is trial 70 with value: 0.835911286090736.[0m
[32m[I 2022-04-21 14:53:34,978][0m Trial 262 finished with value: 0.8355572580224632 and parameters: {'alpha': 3.507733209973356, 'ties': 'efron'}. Best is trial 70 with value: 0.835911286090736.[0m
[32m[I 2022-04-21 14:54:19,531][0m Trial 263 finished with value: 0.8356802696400418 and parameters: {'alpha': 3.7425334294937356, 'ties': 'breslow'}. Best is trial 70 with value: 0.835911286090736.[0m
[32m[I 2022-04-21 14:55:03,454][0m Trial 264 finished with value: 0.8354787801983354 and parameters: {'alpha': 3.63991311605116, 'ties': 'breslow'}. Best is trial 70 with value: 0.835911286090736.[0m
[32m[I 2022-04-21 14:55:48,158][0m Trial 265 finished with value: 0.8358336757991058 and parameters: {'alpha': 3.7664590406497935, 'ties': 'breslow'}. Best is trial 70 with value: 0.835911286090736.[0m
[32m[I 2022-04-21 14:56:31,391][0m Trial 266 finished with value: 0.8352854798157032 and parameters: {'alpha': 4.040170486073258, 'ties': 'breslow'}. Best is trial 70 with value: 0.835911286090736.[0m
[32m[I 2022-04-21 14:57:15,046][0m Trial 267 finished with value: 0.8356281582736811 and parameters: {'alpha': 3.9080428795569966, 'ties': 'breslow'}. Best is trial 70 with value: 0.835911286090736.[0m
[32m[I 2022-04-21 14:57:59,328][0m Trial 268 finished with value: 0.8356802696400418 and parameters: {'alpha': 3.745287599688117, 'ties': 'breslow'}. Best is trial 70 with value: 0.835911286090736.[0m
[32m[I 2022-04-21 14:58:44,260][0m Trial 269 finished with value: 0.8356715428291757 and parameters: {'alpha': 3.8191303138423853, 'ties': 'breslow'}. Best is trial 70 with value: 0.835911286090736.[0m
[32m[I 2022-04-21 14:59:25,663][0m Trial 270 finished with value: 0.8355193570680342 and parameters: {'alpha': 3.5632455002307606, 'ties': 'breslow'}. Best is trial 70 with value: 0.835911286090736.[0m
[32m[I 2022-04-21 15:00:07,664][0m Trial 271 finished with value: 0.8355583611728576 and parameters: {'alpha': 3.687033661613617, 'ties': 'breslow'}. Best is trial 70 with value: 0.835911286090736.[0m
[32m[I 2022-04-21 15:01:43,339][0m Trial 272 finished with value: 0.8311944006979249 and parameters: {'alpha': 0.07522144820904897, 'ties': 'breslow'}. Best is trial 70 with value: 0.835911286090736.[0m
[32m[I 2022-04-21 15:02:23,407][0m Trial 273 finished with value: 0.8354049296341829 and parameters: {'alpha': 3.9618296072733368, 'ties': 'breslow'}. Best is trial 70 with value: 0.835911286090736.[0m
[32m[I 2022-04-21 15:03:07,460][0m Trial 274 finished with value: 0.835588281099821 and parameters: {'alpha': 3.8376899854946993, 'ties': 'breslow'}. Best is trial 70 with value: 0.835911286090736.[0m
[32m[I 2022-04-21 15:03:50,271][0m Trial 275 finished with value: 0.835519290914522 and parameters: {'alpha': 3.623684939151164, 'ties': 'breslow'}. Best is trial 70 with value: 0.835911286090736.[0m
[32m[I 2022-04-21 15:04:33,885][0m Trial 276 finished with value: 0.8357190747858569 and parameters: {'alpha': 3.730288125080497, 'ties': 'breslow'}. Best is trial 70 with value: 0.835911286090736.[0m
[32m[I 2022-04-21 15:05:18,632][0m Trial 277 finished with value: 0.8355071273750777 and parameters: {'alpha': 3.4670575629947815, 'ties': 'breslow'}. Best is trial 70 with value: 0.835911286090736.[0m
[32m[I 2022-04-21 15:06:05,488][0m Trial 278 finished with value: 0.8358321902886627 and parameters: {'alpha': 3.7794483244716184, 'ties': 'breslow'}. Best is trial 70 with value: 0.835911286090736.[0m
[32m[I 2022-04-21 15:06:46,985][0m Trial 279 finished with value: 0.8356281582736811 and parameters: {'alpha': 3.9046598237505528, 'ties': 'breslow'}. Best is trial 70 with value: 0.835911286090736.[0m
[32m[I 2022-04-21 15:07:30,809][0m Trial 280 finished with value: 0.8355175853441505 and parameters: {'alpha': 3.6698399952163583, 'ties': 'breslow'}. Best is trial 70 with value: 0.835911286090736.[0m
[32m[I 2022-04-21 15:08:12,943][0m Trial 281 finished with value: 0.8352807670705438 and parameters: {'alpha': 4.126807609855233, 'ties': 'breslow'}. Best is trial 70 with value: 0.835911286090736.[0m
[32m[I 2022-04-21 15:08:58,704][0m Trial 282 finished with value: 0.8355599789903249 and parameters: {'alpha': 3.5467916152502514, 'ties': 'efron'}. Best is trial 70 with value: 0.835911286090736.[0m
[32m[I 2022-04-21 15:09:57,811][0m Trial 283 finished with value: 0.8332146677320701 and parameters: {'alpha': 1.7212206556035405, 'ties': 'breslow'}. Best is trial 70 with value: 0.835911286090736.[0m
[32m[I 2022-04-21 15:10:41,461][0m Trial 284 finished with value: 0.8358705102620287 and parameters: {'alpha': 3.7783134651466415, 'ties': 'breslow'}. Best is trial 70 with value: 0.835911286090736.[0m
[32m[I 2022-04-21 15:11:27,669][0m Trial 285 finished with value: 0.8357052929158193 and parameters: {'alpha': 3.861589296442978, 'ties': 'breslow'}. Best is trial 70 with value: 0.835911286090736.[0m
[32m[I 2022-04-21 15:12:11,352][0m Trial 286 finished with value: 0.8354432496075488 and parameters: {'alpha': 3.9727431058473, 'ties': 'breslow'}. Best is trial 70 with value: 0.835911286090736.[0m
[32m[I 2022-04-21 15:12:53,851][0m Trial 287 finished with value: 0.8356785640696703 and parameters: {'alpha': 3.747065590530318, 'ties': 'breslow'}. Best is trial 70 with value: 0.835911286090736.[0m
[32m[I 2022-04-21 15:13:36,350][0m Trial 288 finished with value: 0.835519290914522 and parameters: {'alpha': 3.6192880291562886, 'ties': 'breslow'}. Best is trial 70 with value: 0.835911286090736.[0m
[32m[I 2022-04-21 15:14:19,999][0m Trial 289 finished with value: 0.8349420036621021 and parameters: {'alpha': 4.919304157364671, 'ties': 'breslow'}. Best is trial 70 with value: 0.835911286090736.[0m
[32m[I 2022-04-21 15:15:03,357][0m Trial 290 finished with value: 0.8352854798157032 and parameters: {'alpha': 4.048281636253366, 'ties': 'breslow'}. Best is trial 70 with value: 0.835911286090736.[0m
[32m[I 2022-04-21 15:15:46,676][0m Trial 291 finished with value: 0.8356281582736811 and parameters: {'alpha': 3.8884582886249204, 'ties': 'breslow'}. Best is trial 70 with value: 0.835911286090736.[0m
[32m[I 2022-04-21 15:16:30,679][0m Trial 292 finished with value: 0.8357190747858569 and parameters: {'alpha': 3.7298266954338057, 'ties': 'breslow'}. Best is trial 70 with value: 0.835911286090736.[0m
[32m[I 2022-04-21 15:17:15,829][0m Trial 293 finished with value: 0.8357103479749908 and parameters: {'alpha': 3.8251779360064697, 'ties': 'breslow'}. Best is trial 70 with value: 0.835911286090736.[0m
[32m[I 2022-04-21 15:17:58,312][0m Trial 294 finished with value: 0.8355039212347668 and parameters: {'alpha': 3.407404237566975, 'ties': 'breslow'}. Best is trial 70 with value: 0.835911286090736.[0m
[32m[I 2022-04-21 15:18:41,632][0m Trial 295 finished with value: 0.8354787801983354 and parameters: {'alpha': 3.6602063435391967, 'ties': 'breslow'}. Best is trial 70 with value: 0.835911286090736.[0m
[32m[I 2022-04-21 15:19:24,237][0m Trial 296 finished with value: 0.8357914144599559 and parameters: {'alpha': 3.7892763617702796, 'ties': 'breslow'}. Best is trial 70 with value: 0.835911286090736.[0m
[32m[I 2022-04-21 15:20:06,836][0m Trial 297 finished with value: 0.8355441689727077 and parameters: {'alpha': 3.519054169438788, 'ties': 'breslow'}. Best is trial 70 with value: 0.835911286090736.[0m
[32m[I 2022-04-21 15:20:49,043][0m Trial 298 finished with value: 0.8354049296341829 and parameters: {'alpha': 3.955072057512726, 'ties': 'breslow'}. Best is trial 70 with value: 0.835911286090736.[0m
[32m[I 2022-04-21 15:21:45,834][0m Trial 299 finished with value: 0.8329836924282279 and parameters: {'alpha': 1.090283816503747, 'ties': 'breslow'}. Best is trial 70 with value: 0.835911286090736.[0m
[32m[I 2022-04-21 15:22:30,634][0m Trial 300 finished with value: 0.8355991370015646 and parameters: {'alpha': 3.6908773703917905, 'ties': 'breslow'}. Best is trial 70 with value: 0.835911286090736.[0m
[32m[I 2022-04-21 15:23:15,549][0m Trial 301 finished with value: 0.835593038904087 and parameters: {'alpha': 3.8531412588842304, 'ties': 'efron'}. Best is trial 70 with value: 0.835911286090736.[0m
[32m[I 2022-04-21 15:23:58,191][0m Trial 302 finished with value: 0.8354805519222193 and parameters: {'alpha': 3.584682998859738, 'ties': 'breslow'}. Best is trial 70 with value: 0.835911286090736.[0m
[32m[I 2022-04-21 15:24:40,342][0m Trial 303 finished with value: 0.8354826511319169 and parameters: {'alpha': 3.947909267270367, 'ties': 'breslow'}. Best is trial 70 with value: 0.835911286090736.[0m
[32m[I 2022-04-21 15:25:23,335][0m Trial 304 finished with value: 0.8356379421473796 and parameters: {'alpha': 3.703286886294189, 'ties': 'breslow'}. Best is trial 70 with value: 0.835911286090736.[0m
[32m[I 2022-04-21 15:26:06,412][0m Trial 305 finished with value: 0.8356695721462838 and parameters: {'alpha': 3.8303083400320412, 'ties': 'breslow'}. Best is trial 70 with value: 0.835911286090736.[0m
[32m[I 2022-04-21 15:26:51,506][0m Trial 306 finished with value: 0.835519290914522 and parameters: {'alpha': 3.613002546676734, 'ties': 'breslow'}. Best is trial 70 with value: 0.835911286090736.[0m
[32m[I 2022-04-21 15:27:36,939][0m Trial 307 finished with value: 0.835911286090736 and parameters: {'alpha': 3.7703463493074856, 'ties': 'breslow'}. Best is trial 70 with value: 0.835911286090736.[0m
[32m[I 2022-04-21 15:28:21,529][0m Trial 308 finished with value: 0.8352854798157032 and parameters: {'alpha': 4.042841766152333, 'ties': 'breslow'}. Best is trial 70 with value: 0.835911286090736.[0m
[32m[I 2022-04-21 15:29:04,452][0m Trial 309 finished with value: 0.8356281582736811 and parameters: {'alpha': 3.9029286977337616, 'ties': 'breslow'}. Best is trial 70 with value: 0.835911286090736.[0m
[32m[I 2022-04-21 15:29:49,549][0m Trial 310 finished with value: 0.8356802696400418 and parameters: {'alpha': 3.7438540750555185, 'ties': 'breslow'}. Best is trial 70 with value: 0.835911286090736.[0m
[32m[I 2022-04-21 15:30:53,879][0m Trial 311 finished with value: 0.8335749028659393 and parameters: {'alpha': 0.42401877949341715, 'ties': 'breslow'}. Best is trial 70 with value: 0.835911286090736.[0m
[32m[I 2022-04-21 15:31:38,355][0m Trial 312 finished with value: 0.8354264219312361 and parameters: {'alpha': 3.5007623172944435, 'ties': 'breslow'}. Best is trial 70 with value: 0.835911286090736.[0m
[32m[I 2022-04-21 15:32:24,892][0m Trial 313 finished with value: 0.8356379421473796 and parameters: {'alpha': 3.6974082092740193, 'ties': 'breslow'}. Best is trial 70 with value: 0.835911286090736.[0m
[32m[I 2022-04-21 15:33:07,980][0m Trial 314 finished with value: 0.8356273513581567 and parameters: {'alpha': 3.839614856349005, 'ties': 'breslow'}. Best is trial 70 with value: 0.835911286090736.[0m
[32m[I 2022-04-21 15:33:50,440][0m Trial 315 finished with value: 0.8354805519222193 and parameters: {'alpha': 3.591875570674756, 'ties': 'breslow'}. Best is trial 70 with value: 0.835911286090736.[0m
[32m[I 2022-04-21 15:34:32,727][0m Trial 316 finished with value: 0.8353196172448814 and parameters: {'alpha': 4.20153268137013, 'ties': 'breslow'}. Best is trial 70 with value: 0.835911286090736.[0m
[32m[I 2022-04-21 15:35:15,741][0m Trial 317 finished with value: 0.8353655281098146 and parameters: {'alpha': 3.975932930837331, 'ties': 'breslow'}. Best is trial 70 with value: 0.835911286090736.[0m
[32m[I 2022-04-21 15:35:59,783][0m Trial 318 finished with value: 0.8357506386312487 and parameters: {'alpha': 3.8001727460664796, 'ties': 'breslow'}. Best is trial 70 with value: 0.835911286090736.[0m
[32m[I 2022-04-21 15:36:43,376][0m Trial 319 finished with value: 0.8357190747858569 and parameters: {'alpha': 3.728851858292413, 'ties': 'breslow'}. Best is trial 70 with value: 0.835911286090736.[0m
[32m[I 2022-04-21 15:37:25,463][0m Trial 320 finished with value: 0.8356281582736811 and parameters: {'alpha': 3.8958532967941926, 'ties': 'breslow'}. Best is trial 70 with value: 0.835911286090736.[0m
