[32m[I 2022-04-22 16:20:30,514][0m Trial 621 finished with value: 0.8232532212122768 and parameters: {'n_hidden': 128, 'mixture_components': 5, 'use_sparse_layer': True, 'use_sparse_loss': True, 'lmbd': 5.854888614336782e-05, 'use_batchnorm': True, 'use_dropout': True, 'dropout': 0.4949041702504793, 'mlp_size_1': 0, 'mlp_size_2': 4, 'mlp_size_3': 0, 'kernel': 'Normal', 'loss_name': 'NLLLoss'}. Best is trial 22 with value: 0.8433318468070169.[0m
[32m[I 2022-04-22 16:21:35,097][0m Trial 622 finished with value: -0.23400730262960462 and parameters: {'n_hidden': 64, 'mixture_components': 6, 'use_sparse_layer': True, 'use_sparse_loss': True, 'lmbd': 0.005841159313639461, 'use_batchnorm': True, 'use_dropout': True, 'dropout': 0.5565649916742803, 'mlp_size_1': 0, 'mlp_size_2': 1, 'mlp_size_3': 1, 'kernel': 'Exponential', 'loss_name': 'AlternativeNLLLoss'}. Best is trial 22 with value: 0.8433318468070169.[0m
[32m[I 2022-04-22 16:22:31,257][0m Trial 623 finished with value: 0.8293726880659161 and parameters: {'n_hidden': 256, 'mixture_components': 2, 'use_sparse_layer': True, 'use_sparse_loss': True, 'lmbd': 0.0006245421773567127, 'use_batchnorm': False, 'use_dropout': True, 'dropout': 0.5519581890010951, 'mlp_size_1': 3, 'mlp_size_2': 1, 'mlp_size_3': 1, 'kernel': 'Exponential', 'loss_name': 'NLLLoss'}. Best is trial 22 with value: 0.8433318468070169.[0m
[32m[I 2022-04-22 16:23:32,060][0m Trial 624 finished with value: -0.23216822753198504 and parameters: {'n_hidden': 512, 'mixture_components': 10, 'use_sparse_layer': True, 'use_sparse_loss': True, 'lmbd': 0.002056511109352606, 'use_batchnorm': True, 'use_dropout': True, 'dropout': 0.5107694494956749, 'mlp_size_1': 1, 'mlp_size_2': 5, 'mlp_size_3': 0, 'kernel': 'Exponential', 'loss_name': 'CensoredNLLLoss'}. Best is trial 22 with value: 0.8433318468070169.[0m
[32m[I 2022-04-22 16:26:13,527][0m Trial 625 finished with value: 0.322136568451877 and parameters: {'n_hidden': 256, 'mixture_components': 5, 'use_sparse_layer': True, 'use_sparse_loss': True, 'lmbd': 0.00015931997160287205, 'use_batchnorm': True, 'use_dropout': True, 'dropout': 0.614504808576991, 'mlp_size_1': 3, 'mlp_size_2': 1, 'mlp_size_3': 1, 'kernel': 'Exponential', 'loss_name': 'NLLLoss'}. Best is trial 22 with value: 0.8433318468070169.[0m
[32m[I 2022-04-22 16:28:25,806][0m Trial 626 finished with value: 0.8342475892764971 and parameters: {'n_hidden': 512, 'mixture_components': 6, 'use_sparse_layer': True, 'use_sparse_loss': True, 'lmbd': 0.00043711897177345414, 'use_batchnorm': True, 'use_dropout': True, 'dropout': 0.5655998109967766, 'mlp_size_1': 0, 'mlp_size_2': 1, 'mlp_size_3': 1, 'kernel': 'Exponential', 'loss_name': 'NLLLoss'}. Best is trial 22 with value: 0.8433318468070169.[0m
[32m[I 2022-04-22 16:29:17,137][0m Trial 627 finished with value: 0.8257755140741677 and parameters: {'n_hidden': 1024, 'mixture_components': 5, 'use_sparse_layer': True, 'use_sparse_loss': True, 'lmbd': 3.5185049201222225e-06, 'use_batchnorm': False, 'use_dropout': False, 'mlp_size_1': 4, 'mlp_size_2': 3, 'mlp_size_3': 0, 'kernel': 'Logistic', 'loss_name': 'NLLLoss'}. Best is trial 22 with value: 0.8433318468070169.[0m
[32m[I 2022-04-22 16:32:33,387][0m Trial 628 finished with value: 0.4231608020869359 and parameters: {'n_hidden': 512, 'mixture_components': 4, 'use_sparse_layer': True, 'use_sparse_loss': True, 'lmbd': 0.0002736524428394454, 'use_batchnorm': True, 'use_dropout': True, 'dropout': 0.5726696379770628, 'mlp_size_1': 0, 'mlp_size_2': 1, 'mlp_size_3': 1, 'kernel': 'Normal', 'loss_name': 'NLLLoss'}. Best is trial 22 with value: 0.8433318468070169.[0m
[32m[I 2022-04-22 16:35:09,991][0m Trial 629 finished with value: 0.7157477119722262 and parameters: {'n_hidden': 256, 'mixture_components': 8, 'use_sparse_layer': True, 'use_sparse_loss': True, 'lmbd': 0.0010450472481914577, 'use_batchnorm': True, 'use_dropout': True, 'dropout': 0.1281052093181789, 'mlp_size_1': 3, 'mlp_size_2': 1, 'mlp_size_3': 1, 'kernel': 'Exponential', 'loss_name': 'NLLLoss'}. Best is trial 22 with value: 0.8433318468070169.[0m
[32m[I 2022-04-22 16:36:02,786][0m Trial 630 finished with value: 0.8358434250451646 and parameters: {'n_hidden': 512, 'mixture_components': 5, 'use_sparse_layer': True, 'use_sparse_loss': True, 'lmbd': 8.301390721136929e-05, 'use_batchnorm': False, 'use_dropout': True, 'dropout': 0.60387676214246, 'mlp_size_1': 0, 'mlp_size_2': 1, 'mlp_size_3': 2, 'kernel': 'Exponential', 'loss_name': 'NLLLoss'}. Best is trial 22 with value: 0.8433318468070169.[0m
[32m[I 2022-04-22 16:36:40,684][0m Trial 631 finished with value: -0.5 and parameters: {'n_hidden': 128, 'mixture_components': 2, 'use_sparse_layer': True, 'use_sparse_loss': True, 'lmbd': 0.00012836823937657085, 'use_batchnorm': True, 'use_dropout': True, 'dropout': 0.6313651816460415, 'mlp_size_1': 0, 'mlp_size_2': 4, 'mlp_size_3': 0, 'kernel': 'Gumbel', 'loss_name': 'NLLLoss'}. Best is trial 22 with value: 0.8433318468070169.[0m
[32m[I 2022-04-22 16:38:35,287][0m Trial 632 finished with value: 0.8327883826317366 and parameters: {'n_hidden': 256, 'mixture_components': 7, 'use_sparse_layer': True, 'use_sparse_loss': False, 'use_batchnorm': True, 'use_dropout': True, 'dropout': 0.524467087431817, 'mlp_size_1': 0, 'mlp_size_2': 5, 'mlp_size_3': 0, 'kernel': 'Exponential', 'loss_name': 'NLLLoss'}. Best is trial 22 with value: 0.8433318468070169.[0m
[32m[I 2022-04-22 16:40:59,443][0m Trial 633 finished with value: 0.625206495906079 and parameters: {'n_hidden': 512, 'mixture_components': 5, 'use_sparse_layer': True, 'use_sparse_loss': True, 'lmbd': 1.01812238733756e-05, 'use_batchnorm': True, 'use_dropout': False, 'mlp_size_1': 0, 'mlp_size_2': 1, 'mlp_size_3': 1, 'kernel': 'LogLogistic', 'loss_name': 'CensoredNLLLoss'}. Best is trial 22 with value: 0.8433318468070169.[0m
[32m[I 2022-04-22 16:42:24,066][0m Trial 634 finished with value: 0.8250215007712207 and parameters: {'n_hidden': 256, 'mixture_components': 6, 'use_sparse_layer': True, 'use_sparse_loss': False, 'use_batchnorm': False, 'use_dropout': True, 'dropout': 0.44770155681693236, 'mlp_size_1': 0, 'mlp_size_2': 5, 'mlp_size_3': 0, 'kernel': 'Exponential', 'loss_name': 'NLLLoss'}. Best is trial 22 with value: 0.8433318468070169.[0m
[32m[I 2022-04-22 16:44:53,507][0m Trial 635 finished with value: 0.7276506767501698 and parameters: {'n_hidden': 512, 'mixture_components': 1, 'use_sparse_layer': True, 'use_sparse_loss': False, 'use_batchnorm': True, 'use_dropout': True, 'dropout': 0.6502444352499972, 'mlp_size_1': 1, 'mlp_size_2': 5, 'mlp_size_3': 0, 'kernel': 'Logistic', 'loss_name': 'NLLLoss'}. Best is trial 22 with value: 0.8433318468070169.[0m
[32m[I 2022-04-22 16:47:24,321][0m Trial 636 finished with value: 0.8273798721305795 and parameters: {'n_hidden': 64, 'mixture_components': 5, 'use_sparse_layer': True, 'use_sparse_loss': False, 'use_batchnorm': True, 'use_dropout': True, 'dropout': 0.5784468073203118, 'mlp_size_1': 0, 'mlp_size_2': 3, 'mlp_size_3': 0, 'kernel': 'Normal', 'loss_name': 'NLLLoss'}. Best is trial 22 with value: 0.8433318468070169.[0m
[32m[I 2022-04-22 16:49:34,525][0m Trial 637 finished with value: 0.820630671830975 and parameters: {'n_hidden': 256, 'mixture_components': 7, 'use_sparse_layer': False, 'use_batchnorm': True, 'use_dropout': True, 'dropout': 0.6112920343278423, 'mlp_size_1': 3, 'mlp_size_2': 2, 'mlp_size_3': 0, 'kernel': 'Exponential', 'loss_name': 'NLLLoss'}. Best is trial 22 with value: 0.8433318468070169.[0m
[32m[I 2022-04-22 16:50:30,472][0m Trial 638 finished with value: 0.8253880254523824 and parameters: {'n_hidden': 512, 'mixture_components': 5, 'use_sparse_layer': True, 'use_sparse_loss': True, 'lmbd': 1.0330823897826706e-06, 'use_batchnorm': False, 'use_dropout': True, 'dropout': 0.5496276189112724, 'mlp_size_1': 1, 'mlp_size_2': 5, 'mlp_size_3': 0, 'kernel': 'Exponential', 'loss_name': 'NLLLoss'}. Best is trial 22 with value: 0.8433318468070169.[0m
[32m[I 2022-04-22 16:52:43,473][0m Trial 639 finished with value: 0.8290365341557951 and parameters: {'n_hidden': 512, 'mixture_components': 4, 'use_sparse_layer': True, 'use_sparse_loss': False, 'use_batchnorm': True, 'use_dropout': False, 'mlp_size_1': 0, 'mlp_size_2': 1, 'mlp_size_3': 1, 'kernel': 'Exponential', 'loss_name': 'NLLLoss'}. Best is trial 22 with value: 0.8433318468070169.[0m
[32m[I 2022-04-22 16:55:50,300][0m Trial 640 finished with value: 0.722576140439565 and parameters: {'n_hidden': 2048, 'mixture_components': 2, 'use_sparse_layer': True, 'use_sparse_loss': False, 'use_batchnorm': True, 'use_dropout': True, 'dropout': 0.6586994533825993, 'mlp_size_1': 4, 'mlp_size_2': 4, 'mlp_size_3': 0, 'kernel': 'Exponential', 'loss_name': 'NLLLoss'}. Best is trial 22 with value: 0.8433318468070169.[0m
[32m[I 2022-04-22 16:56:49,232][0m Trial 641 finished with value: -0.23248512972696403 and parameters: {'n_hidden': 256, 'mixture_components': 5, 'use_sparse_layer': True, 'use_sparse_loss': True, 'lmbd': 0.00031890801475031145, 'use_batchnorm': True, 'use_dropout': True, 'dropout': 0.6259905482931692, 'mlp_size_1': 0, 'mlp_size_2': 5, 'mlp_size_3': 0, 'kernel': 'Exponential', 'loss_name': 'CensoredNLLLoss'}. Best is trial 22 with value: 0.8433318468070169.[0m
[32m[I 2022-04-22 16:58:06,154][0m Trial 642 finished with value: 0.8218832012534099 and parameters: {'n_hidden': 128, 'mixture_components': 6, 'use_sparse_layer': True, 'use_sparse_loss': False, 'use_batchnorm': False, 'use_dropout': True, 'dropout': 0.5936871156310275, 'mlp_size_1': 0, 'mlp_size_2': 4, 'mlp_size_3': 0, 'kernel': 'Logistic', 'loss_name': 'NLLLoss'}. Best is trial 22 with value: 0.8433318468070169.[0m
[32m[I 2022-04-22 17:00:18,129][0m Trial 643 finished with value: 0.5924675209018895 and parameters: {'n_hidden': 1024, 'mixture_components': 5, 'use_sparse_layer': False, 'use_batchnorm': True, 'use_dropout': True, 'dropout': 0.6412446776328417, 'mlp_size_1': 2, 'mlp_size_2': 5, 'mlp_size_3': 0, 'kernel': 'Normal', 'loss_name': 'NLLLoss'}. Best is trial 22 with value: 0.8433318468070169.[0m
[32m[I 2022-04-22 17:02:08,996][0m Trial 644 finished with value: 0.8256867540121757 and parameters: {'n_hidden': 512, 'mixture_components': 5, 'use_sparse_layer': True, 'use_sparse_loss': False, 'use_batchnorm': True, 'use_dropout': True, 'dropout': 0.17806187281234293, 'mlp_size_1': 1, 'mlp_size_2': 5, 'mlp_size_3': 0, 'kernel': 'Exponential', 'loss_name': 'NLLLoss'}. Best is trial 22 with value: 0.8433318468070169.[0m
[32m[I 2022-04-22 17:03:16,709][0m Trial 645 finished with value: 0.8169220388395843 and parameters: {'n_hidden': 32, 'mixture_components': 6, 'use_sparse_layer': True, 'use_sparse_loss': True, 'lmbd': 1.9936943560459485e-06, 'use_batchnorm': False, 'use_dropout': False, 'mlp_size_1': 0, 'mlp_size_2': 1, 'mlp_size_3': 1, 'kernel': 'Exponential', 'loss_name': 'NLLLoss'}. Best is trial 22 with value: 0.8433318468070169.[0m
[32m[I 2022-04-22 17:04:07,468][0m Trial 646 finished with value: -0.3365998584187649 and parameters: {'n_hidden': 256, 'mixture_components': 5, 'use_sparse_layer': True, 'use_sparse_loss': False, 'use_batchnorm': True, 'use_dropout': True, 'dropout': 0.6743914192268144, 'mlp_size_1': 3, 'mlp_size_2': 2, 'mlp_size_3': 0, 'kernel': 'Exponential', 'loss_name': 'AlternativeNLLLoss'}. Best is trial 22 with value: 0.8433318468070169.[0m
[32m[I 2022-04-22 17:07:04,485][0m Trial 647 finished with value: 0.43342197595358556 and parameters: {'n_hidden': 512, 'mixture_components': 4, 'use_sparse_layer': True, 'use_sparse_loss': False, 'use_batchnorm': True, 'use_dropout': True, 'dropout': 0.5748172489274279, 'mlp_size_1': 0, 'mlp_size_2': 1, 'mlp_size_3': 1, 'kernel': 'LogLogistic', 'loss_name': 'NLLLoss'}. Best is trial 22 with value: 0.8433318468070169.[0m
[32m[I 2022-04-22 17:09:04,573][0m Trial 648 finished with value: 0.8330755424278659 and parameters: {'n_hidden': 256, 'mixture_components': 2, 'use_sparse_layer': True, 'use_sparse_loss': True, 'lmbd': 0.0002113491633395754, 'use_batchnorm': True, 'use_dropout': True, 'dropout': 0.6151058125291838, 'mlp_size_1': 0, 'mlp_size_2': 5, 'mlp_size_3': 0, 'kernel': 'Exponential', 'loss_name': 'NLLLoss'}. Best is trial 22 with value: 0.8433318468070169.[0m
[32m[I 2022-04-22 17:09:52,853][0m Trial 649 finished with value: 0.8160411003294484 and parameters: {'n_hidden': 512, 'mixture_components': 3, 'use_sparse_layer': False, 'use_batchnorm': False, 'use_dropout': True, 'dropout': 0.5056593549478866, 'mlp_size_1': 1, 'mlp_size_2': 5, 'mlp_size_3': 0, 'kernel': 'Logistic', 'loss_name': 'NLLLoss'}. Best is trial 22 with value: 0.8433318468070169.[0m
[32m[I 2022-04-22 17:10:55,110][0m Trial 650 finished with value: -0.23669328816059837 and parameters: {'n_hidden': 512, 'mixture_components': 6, 'use_sparse_layer': True, 'use_sparse_loss': False, 'use_batchnorm': True, 'use_dropout': True, 'dropout': 0.281217862190558, 'mlp_size_1': 0, 'mlp_size_2': 1, 'mlp_size_3': 1, 'kernel': 'Exponential', 'loss_name': 'CensoredNLLLoss'}. Best is trial 22 with value: 0.8433318468070169.[0m
[32m[I 2022-04-22 17:13:32,180][0m Trial 651 finished with value: 0.715085525431019 and parameters: {'n_hidden': 256, 'mixture_components': 5, 'use_sparse_layer': True, 'use_sparse_loss': False, 'use_batchnorm': True, 'use_dropout': True, 'dropout': 0.541459308920523, 'mlp_size_1': 3, 'mlp_size_2': 2, 'mlp_size_3': 0, 'kernel': 'Normal', 'loss_name': 'NLLLoss'}. Best is trial 22 with value: 0.8433318468070169.[0m
[32m[I 2022-04-22 17:15:17,472][0m Trial 652 finished with value: 0.8231446784968535 and parameters: {'n_hidden': 128, 'mixture_components': 5, 'use_sparse_layer': True, 'use_sparse_loss': True, 'lmbd': 0.012399328132259203, 'use_batchnorm': True, 'use_dropout': False, 'mlp_size_1': 0, 'mlp_size_2': 4, 'mlp_size_3': 0, 'kernel': 'Exponential', 'loss_name': 'NLLLoss'}. Best is trial 22 with value: 0.8433318468070169.[0m
[32m[I 2022-04-22 17:16:06,878][0m Trial 653 finished with value: 0.8293649325478393 and parameters: {'n_hidden': 512, 'mixture_components': 1, 'use_sparse_layer': True, 'use_sparse_loss': False, 'use_batchnorm': False, 'use_dropout': True, 'dropout': 0.31908029069890176, 'mlp_size_1': 1, 'mlp_size_2': 5, 'mlp_size_3': 0, 'kernel': 'Exponential', 'loss_name': 'NLLLoss'}. Best is trial 22 with value: 0.8433318468070169.[0m
[32m[I 2022-04-22 17:17:51,503][0m Trial 654 finished with value: 0.8296608426716094 and parameters: {'n_hidden': 64, 'mixture_components': 6, 'use_sparse_layer': True, 'use_sparse_loss': False, 'use_batchnorm': True, 'use_dropout': True, 'dropout': 0.14710534389404156, 'mlp_size_1': 0, 'mlp_size_2': 3, 'mlp_size_3': 0, 'kernel': 'Exponential', 'loss_name': 'NLLLoss'}. Best is trial 22 with value: 0.8433318468070169.[0m
[32m[I 2022-04-22 17:19:52,017][0m Trial 655 finished with value: 0.8367226597047873 and parameters: {'n_hidden': 256, 'mixture_components': 5, 'use_sparse_layer': False, 'use_batchnorm': True, 'use_dropout': True, 'dropout': 0.6598467707741714, 'mlp_size_1': 0, 'mlp_size_2': 5, 'mlp_size_3': 0, 'kernel': 'Exponential', 'loss_name': 'NLLLoss'}. Best is trial 22 with value: 0.8433318468070169.[0m
[32m[I 2022-04-22 17:21:54,682][0m Trial 656 finished with value: 0.8344509132533127 and parameters: {'n_hidden': 256, 'mixture_components': 5, 'use_sparse_layer': True, 'use_sparse_loss': True, 'lmbd': 0.017830663131658674, 'use_batchnorm': True, 'use_dropout': True, 'dropout': 0.6626362745943489, 'mlp_size_1': 0, 'mlp_size_2': 5, 'mlp_size_3': 0, 'kernel': 'Exponential', 'loss_name': 'NLLLoss'}. Best is trial 22 with value: 0.8433318468070169.[0m
[32m[I 2022-04-22 17:22:35,233][0m Trial 657 finished with value: -0.5 and parameters: {'n_hidden': 256, 'mixture_components': 5, 'use_sparse_layer': False, 'use_batchnorm': True, 'use_dropout': True, 'dropout': 0.6878416060935256, 'mlp_size_1': 0, 'mlp_size_2': 5, 'mlp_size_3': 0, 'kernel': 'Gumbel', 'loss_name': 'NLLLoss'}. Best is trial 22 with value: 0.8433318468070169.[0m
[32m[I 2022-04-22 17:23:35,845][0m Trial 658 finished with value: 0.2655742744133539 and parameters: {'n_hidden': 256, 'mixture_components': 5, 'use_sparse_layer': True, 'use_sparse_loss': False, 'use_batchnorm': True, 'use_dropout': True, 'dropout': 0.9132051673725371, 'mlp_size_1': 0, 'mlp_size_2': 5, 'mlp_size_3': 0, 'kernel': 'Logistic', 'loss_name': 'NLLLoss'}. Best is trial 22 with value: 0.8433318468070169.[0m
[32m[I 2022-04-22 17:26:53,728][0m Trial 659 finished with value: 0.724078329010896 and parameters: {'n_hidden': 256, 'mixture_components': 5, 'use_sparse_layer': True, 'use_sparse_loss': False, 'use_batchnorm': True, 'use_dropout': True, 'dropout': 0.6403526316588715, 'mlp_size_1': 0, 'mlp_size_2': 5, 'mlp_size_3': 0, 'kernel': 'Normal', 'loss_name': 'CensoredNLLLoss'}. Best is trial 22 with value: 0.8433318468070169.[0m
[32m[I 2022-04-22 17:29:07,636][0m Trial 660 finished with value: 0.837459043233386 and parameters: {'n_hidden': 256, 'mixture_components': 5, 'use_sparse_layer': True, 'use_sparse_loss': True, 'lmbd': 3.1543261842729884e-05, 'use_batchnorm': True, 'use_dropout': True, 'dropout': 0.668172894709666, 'mlp_size_1': 0, 'mlp_size_2': 5, 'mlp_size_3': 0, 'kernel': 'Exponential', 'loss_name': 'NLLLoss'}. Best is trial 22 with value: 0.8433318468070169.[0m
[32m[I 2022-04-22 17:31:11,826][0m Trial 661 finished with value: 0.8335358186155754 and parameters: {'n_hidden': 256, 'mixture_components': 5, 'use_sparse_layer': True, 'use_sparse_loss': False, 'use_batchnorm': True, 'use_dropout': True, 'dropout': 0.6844862749954499, 'mlp_size_1': 0, 'mlp_size_2': 5, 'mlp_size_3': 0, 'kernel': 'Exponential', 'loss_name': 'NLLLoss'}. Best is trial 22 with value: 0.8433318468070169.[0m
[32m[I 2022-04-22 17:33:10,602][0m Trial 662 finished with value: 0.8316615820791078 and parameters: {'n_hidden': 256, 'mixture_components': 5, 'use_sparse_layer': True, 'use_sparse_loss': False, 'use_batchnorm': True, 'use_dropout': True, 'dropout': 0.6685256597819964, 'mlp_size_1': 0, 'mlp_size_2': 5, 'mlp_size_3': 0, 'kernel': 'Exponential', 'loss_name': 'NLLLoss'}. Best is trial 22 with value: 0.8433318468070169.[0m
[32m[I 2022-04-22 17:35:45,707][0m Trial 663 finished with value: 0.8265232680515954 and parameters: {'n_hidden': 256, 'mixture_components': 5, 'use_sparse_layer': True, 'use_sparse_loss': True, 'lmbd': 3.165652103453554e-05, 'use_batchnorm': True, 'use_dropout': True, 'dropout': 0.6650731853982218, 'mlp_size_1': 0, 'mlp_size_2': 5, 'mlp_size_3': 0, 'kernel': 'LogLogistic', 'loss_name': 'NLLLoss'}. Best is trial 22 with value: 0.8433318468070169.[0m
[32m[I 2022-04-22 17:38:06,724][0m Trial 664 finished with value: 0.8360412534557182 and parameters: {'n_hidden': 256, 'mixture_components': 5, 'use_sparse_layer': False, 'use_batchnorm': True, 'use_dropout': True, 'dropout': 0.6884661846469009, 'mlp_size_1': 0, 'mlp_size_2': 5, 'mlp_size_3': 0, 'kernel': 'Exponential', 'loss_name': 'NLLLoss'}. Best is trial 22 with value: 0.8433318468070169.[0m
[32m[I 2022-04-22 17:40:07,879][0m Trial 665 finished with value: 0.830520881971698 and parameters: {'n_hidden': 256, 'mixture_components': 5, 'use_sparse_layer': True, 'use_sparse_loss': False, 'use_batchnorm': True, 'use_dropout': True, 'dropout': 0.6565096243229601, 'mlp_size_1': 0, 'mlp_size_2': 5, 'mlp_size_3': 0, 'kernel': 'Exponential', 'loss_name': 'NLLLoss'}. Best is trial 22 with value: 0.8433318468070169.[0m
[32m[I 2022-04-22 17:42:33,070][0m Trial 666 finished with value: 0.8284481058154503 and parameters: {'n_hidden': 256, 'mixture_components': 5, 'use_sparse_layer': True, 'use_sparse_loss': False, 'use_batchnorm': True, 'use_dropout': True, 'dropout': 0.696040551935282, 'mlp_size_1': 0, 'mlp_size_2': 5, 'mlp_size_3': 0, 'kernel': 'Logistic', 'loss_name': 'NLLLoss'}. Best is trial 22 with value: 0.8433318468070169.[0m
[32m[I 2022-04-22 17:46:33,932][0m Trial 667 finished with value: 0.41954773845076965 and parameters: {'n_hidden': 256, 'mixture_components': 5, 'use_sparse_layer': True, 'use_sparse_loss': True, 'lmbd': 1.9713632802445493e-05, 'use_batchnorm': True, 'use_dropout': True, 'dropout': 0.6467986794023042, 'mlp_size_1': 3, 'mlp_size_2': 2, 'mlp_size_3': 0, 'kernel': 'Normal', 'loss_name': 'AlternativeNLLLoss'}. Best is trial 22 with value: 0.8433318468070169.[0m
[32m[I 2022-04-22 17:48:40,655][0m Trial 668 finished with value: 0.8347310711004351 and parameters: {'n_hidden': 256, 'mixture_components': 4, 'use_sparse_layer': True, 'use_sparse_loss': False, 'use_batchnorm': True, 'use_dropout': True, 'dropout': 0.6764824337879608, 'mlp_size_1': 0, 'mlp_size_2': 5, 'mlp_size_3': 0, 'kernel': 'Exponential', 'loss_name': 'NLLLoss'}. Best is trial 22 with value: 0.8433318468070169.[0m
[32m[I 2022-04-22 17:49:25,789][0m Trial 669 finished with value: -0.5 and parameters: {'n_hidden': 256, 'mixture_components': 5, 'use_sparse_layer': True, 'use_sparse_loss': False, 'use_batchnorm': True, 'use_dropout': True, 'dropout': 0.9996401323122797, 'mlp_size_1': 0, 'mlp_size_2': 5, 'mlp_size_3': 0, 'kernel': 'Exponential', 'loss_name': 'CensoredNLLLoss'}. Best is trial 22 with value: 0.8433318468070169.[0m
[32m[I 2022-04-22 17:51:22,717][0m Trial 670 finished with value: 0.8374894246957437 and parameters: {'n_hidden': 256, 'mixture_components': 5, 'use_sparse_layer': False, 'use_batchnorm': True, 'use_dropout': True, 'dropout': 0.6169878502411779, 'mlp_size_1': 0, 'mlp_size_2': 5, 'mlp_size_3': 0, 'kernel': 'Exponential', 'loss_name': 'NLLLoss'}. Best is trial 22 with value: 0.8433318468070169.[0m
