[32m[I 2022-04-22 13:33:32,770][0m Trial 878 finished with value: 0.8314303521328276 and parameters: {'n_hidden': 2048, 'mixture_components': 3, 'use_sparse_layer': False, 'use_batchnorm': False, 'use_dropout': False, 'mlp_size_1': 7, 'mlp_size_2': 1, 'mlp_size_3': 0, 'kernel': 'Normal', 'loss_name': 'CensoredNLLLoss'}. Best is trial 468 with value: 0.8545388812039783.[0m
[32m[I 2022-04-22 13:34:35,759][0m Trial 879 finished with value: 0.7421082805267669 and parameters: {'n_hidden': 2048, 'mixture_components': 3, 'use_sparse_layer': False, 'use_batchnorm': False, 'use_dropout': False, 'mlp_size_1': 7, 'mlp_size_2': 1, 'mlp_size_3': 0, 'kernel': 'Normal', 'loss_name': 'CensoredNLLLoss'}. Best is trial 468 with value: 0.8545388812039783.[0m
[32m[I 2022-04-22 13:35:34,506][0m Trial 880 finished with value: 0.7390299385512143 and parameters: {'n_hidden': 2048, 'mixture_components': 3, 'use_sparse_layer': False, 'use_batchnorm': False, 'use_dropout': False, 'mlp_size_1': 7, 'mlp_size_2': 1, 'mlp_size_3': 0, 'kernel': 'Normal', 'loss_name': 'CensoredNLLLoss'}. Best is trial 468 with value: 0.8545388812039783.[0m
[32m[I 2022-04-22 13:37:18,670][0m Trial 881 finished with value: 0.8395193722757185 and parameters: {'n_hidden': 2048, 'mixture_components': 3, 'use_sparse_layer': False, 'use_batchnorm': False, 'use_dropout': False, 'mlp_size_1': 7, 'mlp_size_2': 1, 'mlp_size_3': 0, 'kernel': 'Normal', 'loss_name': 'CensoredNLLLoss'}. Best is trial 468 with value: 0.8545388812039783.[0m
[32m[I 2022-04-22 13:38:56,097][0m Trial 882 finished with value: 0.8424295210553019 and parameters: {'n_hidden': 2048, 'mixture_components': 3, 'use_sparse_layer': False, 'use_batchnorm': False, 'use_dropout': False, 'mlp_size_1': 8, 'mlp_size_2': 0, 'mlp_size_3': 0, 'kernel': 'Normal', 'loss_name': 'CensoredNLLLoss'}. Best is trial 468 with value: 0.8545388812039783.[0m
[32m[I 2022-04-22 13:40:17,462][0m Trial 883 finished with value: 0.7385985719434758 and parameters: {'n_hidden': 2048, 'mixture_components': 3, 'use_sparse_layer': False, 'use_batchnorm': False, 'use_dropout': False, 'mlp_size_1': 7, 'mlp_size_2': 1, 'mlp_size_3': 0, 'kernel': 'Normal', 'loss_name': 'CensoredNLLLoss'}. Best is trial 468 with value: 0.8545388812039783.[0m
[32m[I 2022-04-22 13:41:36,899][0m Trial 884 finished with value: 0.8471053342538791 and parameters: {'n_hidden': 2048, 'mixture_components': 3, 'use_sparse_layer': False, 'use_batchnorm': False, 'use_dropout': False, 'mlp_size_1': 7, 'mlp_size_2': 1, 'mlp_size_3': 0, 'kernel': 'Normal', 'loss_name': 'CensoredNLLLoss'}. Best is trial 468 with value: 0.8545388812039783.[0m
[32m[I 2022-04-22 13:42:49,793][0m Trial 885 finished with value: 0.8370090287911763 and parameters: {'n_hidden': 2048, 'mixture_components': 3, 'use_sparse_layer': False, 'use_batchnorm': False, 'use_dropout': False, 'mlp_size_1': 7, 'mlp_size_2': 1, 'mlp_size_3': 0, 'kernel': 'Normal', 'loss_name': 'CensoredNLLLoss'}. Best is trial 468 with value: 0.8545388812039783.[0m
[32m[I 2022-04-22 13:44:35,073][0m Trial 886 finished with value: 0.8377896220820904 and parameters: {'n_hidden': 64, 'mixture_components': 3, 'use_sparse_layer': False, 'use_batchnorm': False, 'use_dropout': False, 'mlp_size_1': 3, 'mlp_size_2': 0, 'mlp_size_3': 0, 'kernel': 'Normal', 'loss_name': 'CensoredNLLLoss'}. Best is trial 468 with value: 0.8545388812039783.[0m
[32m[I 2022-04-22 13:45:53,363][0m Trial 887 finished with value: 0.8370989041183481 and parameters: {'n_hidden': 256, 'mixture_components': 3, 'use_sparse_layer': False, 'use_batchnorm': False, 'use_dropout': False, 'mlp_size_1': 5, 'mlp_size_2': 0, 'mlp_size_3': 0, 'kernel': 'Normal', 'loss_name': 'CensoredNLLLoss'}. Best is trial 468 with value: 0.8545388812039783.[0m
[32m[I 2022-04-22 13:47:12,200][0m Trial 888 finished with value: 0.8516186616641322 and parameters: {'n_hidden': 2048, 'mixture_components': 3, 'use_sparse_layer': False, 'use_batchnorm': False, 'use_dropout': False, 'mlp_size_1': 7, 'mlp_size_2': 1, 'mlp_size_3': 0, 'kernel': 'Normal', 'loss_name': 'CensoredNLLLoss'}. Best is trial 468 with value: 0.8545388812039783.[0m
[32m[I 2022-04-22 13:48:45,836][0m Trial 889 finished with value: 0.7383222787548893 and parameters: {'n_hidden': 2048, 'mixture_components': 3, 'use_sparse_layer': False, 'use_batchnorm': False, 'use_dropout': False, 'mlp_size_1': 7, 'mlp_size_2': 1, 'mlp_size_3': 0, 'kernel': 'Normal', 'loss_name': 'CensoredNLLLoss'}. Best is trial 468 with value: 0.8545388812039783.[0m
[32m[I 2022-04-22 13:49:45,841][0m Trial 890 finished with value: 0.7414736296735718 and parameters: {'n_hidden': 2048, 'mixture_components': 3, 'use_sparse_layer': False, 'use_batchnorm': False, 'use_dropout': False, 'mlp_size_1': 7, 'mlp_size_2': 1, 'mlp_size_3': 0, 'kernel': 'Normal', 'loss_name': 'CensoredNLLLoss'}. Best is trial 468 with value: 0.8545388812039783.[0m
[32m[I 2022-04-22 13:50:50,736][0m Trial 891 finished with value: 0.7191721129051745 and parameters: {'n_hidden': 2048, 'mixture_components': 3, 'use_sparse_layer': False, 'use_batchnorm': False, 'use_dropout': False, 'mlp_size_1': 7, 'mlp_size_2': 1, 'mlp_size_3': 0, 'kernel': 'Normal', 'loss_name': 'CensoredNLLLoss'}. Best is trial 468 with value: 0.8545388812039783.[0m
[32m[I 2022-04-22 13:52:03,355][0m Trial 892 finished with value: 0.8433775581626511 and parameters: {'n_hidden': 2048, 'mixture_components': 3, 'use_sparse_layer': False, 'use_batchnorm': False, 'use_dropout': False, 'mlp_size_1': 7, 'mlp_size_2': 1, 'mlp_size_3': 0, 'kernel': 'Normal', 'loss_name': 'CensoredNLLLoss'}. Best is trial 468 with value: 0.8545388812039783.[0m
[32m[I 2022-04-22 13:52:42,431][0m Trial 893 finished with value: -0.23555849265150092 and parameters: {'n_hidden': 2048, 'mixture_components': 3, 'use_sparse_layer': False, 'use_batchnorm': False, 'use_dropout': False, 'mlp_size_1': 7, 'mlp_size_2': 1, 'mlp_size_3': 0, 'kernel': 'Exponential', 'loss_name': 'CensoredNLLLoss'}. Best is trial 468 with value: 0.8545388812039783.[0m
[32m[I 2022-04-22 13:53:55,529][0m Trial 894 finished with value: 0.7414907870881335 and parameters: {'n_hidden': 2048, 'mixture_components': 2, 'use_sparse_layer': False, 'use_batchnorm': False, 'use_dropout': False, 'mlp_size_1': 7, 'mlp_size_2': 1, 'mlp_size_3': 0, 'kernel': 'Normal', 'loss_name': 'CensoredNLLLoss'}. Best is trial 468 with value: 0.8545388812039783.[0m
[32m[I 2022-04-22 13:55:05,252][0m Trial 895 finished with value: 0.741026964403957 and parameters: {'n_hidden': 2048, 'mixture_components': 3, 'use_sparse_layer': False, 'use_batchnorm': False, 'use_dropout': False, 'mlp_size_1': 7, 'mlp_size_2': 1, 'mlp_size_3': 0, 'kernel': 'Normal', 'loss_name': 'CensoredNLLLoss'}. Best is trial 468 with value: 0.8545388812039783.[0m
[32m[I 2022-04-22 13:56:29,482][0m Trial 896 finished with value: 0.7299562454421707 and parameters: {'n_hidden': 2048, 'mixture_components': 3, 'use_sparse_layer': False, 'use_batchnorm': False, 'use_dropout': False, 'mlp_size_1': 7, 'mlp_size_2': 1, 'mlp_size_3': 0, 'kernel': 'Normal', 'loss_name': 'CensoredNLLLoss'}. Best is trial 468 with value: 0.8545388812039783.[0m
[32m[I 2022-04-22 13:57:49,644][0m Trial 897 finished with value: 0.7370313253329916 and parameters: {'n_hidden': 2048, 'mixture_components': 3, 'use_sparse_layer': False, 'use_batchnorm': False, 'use_dropout': False, 'mlp_size_1': 7, 'mlp_size_2': 1, 'mlp_size_3': 0, 'kernel': 'Normal', 'loss_name': 'CensoredNLLLoss'}. Best is trial 468 with value: 0.8545388812039783.[0m
[32m[I 2022-04-22 13:59:41,237][0m Trial 898 finished with value: 0.40607777370405335 and parameters: {'n_hidden': 2048, 'mixture_components': 3, 'use_sparse_layer': False, 'use_batchnorm': True, 'use_dropout': False, 'mlp_size_1': 8, 'mlp_size_2': 0, 'mlp_size_3': 0, 'kernel': 'Normal', 'loss_name': 'CensoredNLLLoss'}. Best is trial 468 with value: 0.8545388812039783.[0m
[32m[I 2022-04-22 14:00:56,338][0m Trial 899 finished with value: 0.8347357794261112 and parameters: {'n_hidden': 2048, 'mixture_components': 3, 'use_sparse_layer': False, 'use_batchnorm': False, 'use_dropout': False, 'mlp_size_1': 7, 'mlp_size_2': 1, 'mlp_size_3': 0, 'kernel': 'LogLogistic', 'loss_name': 'CensoredNLLLoss'}. Best is trial 468 with value: 0.8545388812039783.[0m
[32m[I 2022-04-22 14:01:53,996][0m Trial 900 finished with value: 0.8455513614262099 and parameters: {'n_hidden': 2048, 'mixture_components': 3, 'use_sparse_layer': False, 'use_batchnorm': False, 'use_dropout': False, 'mlp_size_1': 7, 'mlp_size_2': 1, 'mlp_size_3': 0, 'kernel': 'LogLogistic', 'loss_name': 'CensoredNLLLoss'}. Best is trial 468 with value: 0.8545388812039783.[0m
[32m[I 2022-04-22 14:03:04,682][0m Trial 901 finished with value: 0.8435849030755115 and parameters: {'n_hidden': 2048, 'mixture_components': 3, 'use_sparse_layer': False, 'use_batchnorm': False, 'use_dropout': False, 'mlp_size_1': 7, 'mlp_size_2': 1, 'mlp_size_3': 0, 'kernel': 'Normal', 'loss_name': 'CensoredNLLLoss'}. Best is trial 468 with value: 0.8545388812039783.[0m
[32m[I 2022-04-22 14:04:02,599][0m Trial 902 finished with value: 0.7461387781808334 and parameters: {'n_hidden': 2048, 'mixture_components': 3, 'use_sparse_layer': False, 'use_batchnorm': False, 'use_dropout': False, 'mlp_size_1': 7, 'mlp_size_2': 1, 'mlp_size_3': 0, 'kernel': 'LogLogistic', 'loss_name': 'CensoredNLLLoss'}. Best is trial 468 with value: 0.8545388812039783.[0m
[32m[I 2022-04-22 14:05:07,013][0m Trial 903 finished with value: 0.8435701444484984 and parameters: {'n_hidden': 2048, 'mixture_components': 3, 'use_sparse_layer': False, 'use_batchnorm': False, 'use_dropout': False, 'mlp_size_1': 7, 'mlp_size_2': 1, 'mlp_size_3': 0, 'kernel': 'LogLogistic', 'loss_name': 'CensoredNLLLoss'}. Best is trial 468 with value: 0.8545388812039783.[0m
[32m[I 2022-04-22 14:06:22,398][0m Trial 904 finished with value: 0.8475877844746391 and parameters: {'n_hidden': 2048, 'mixture_components': 3, 'use_sparse_layer': False, 'use_batchnorm': False, 'use_dropout': False, 'mlp_size_1': 8, 'mlp_size_2': 0, 'mlp_size_3': 0, 'kernel': 'Normal', 'loss_name': 'CensoredNLLLoss'}. Best is trial 468 with value: 0.8545388812039783.[0m
[32m[I 2022-04-22 14:07:29,363][0m Trial 905 finished with value: 0.8470208942481413 and parameters: {'n_hidden': 2048, 'mixture_components': 3, 'use_sparse_layer': False, 'use_batchnorm': False, 'use_dropout': False, 'mlp_size_1': 7, 'mlp_size_2': 1, 'mlp_size_3': 0, 'kernel': 'LogLogistic', 'loss_name': 'CensoredNLLLoss'}. Best is trial 468 with value: 0.8545388812039783.[0m
[32m[I 2022-04-22 14:08:35,607][0m Trial 906 finished with value: 0.7390337040764144 and parameters: {'n_hidden': 2048, 'mixture_components': 3, 'use_sparse_layer': False, 'use_batchnorm': False, 'use_dropout': False, 'mlp_size_1': 7, 'mlp_size_2': 1, 'mlp_size_3': 0, 'kernel': 'LogLogistic', 'loss_name': 'CensoredNLLLoss'}. Best is trial 468 with value: 0.8545388812039783.[0m
[32m[I 2022-04-22 14:09:41,084][0m Trial 907 finished with value: 0.838663882659947 and parameters: {'n_hidden': 2048, 'mixture_components': 3, 'use_sparse_layer': False, 'use_batchnorm': False, 'use_dropout': False, 'mlp_size_1': 7, 'mlp_size_2': 1, 'mlp_size_3': 0, 'kernel': 'LogLogistic', 'loss_name': 'CensoredNLLLoss'}. Best is trial 468 with value: 0.8545388812039783.[0m
[32m[I 2022-04-22 14:10:22,009][0m Trial 908 finished with value: -0.23483996469831164 and parameters: {'n_hidden': 2048, 'mixture_components': 2, 'use_sparse_layer': False, 'use_batchnorm': False, 'use_dropout': False, 'mlp_size_1': 7, 'mlp_size_2': 1, 'mlp_size_3': 0, 'kernel': 'Exponential', 'loss_name': 'CensoredNLLLoss'}. Best is trial 468 with value: 0.8545388812039783.[0m
[32m[I 2022-04-22 14:11:23,999][0m Trial 909 finished with value: 0.7447912715736701 and parameters: {'n_hidden': 128, 'mixture_components': 3, 'use_sparse_layer': False, 'use_batchnorm': False, 'use_dropout': False, 'mlp_size_1': 4, 'mlp_size_2': 0, 'mlp_size_3': 0, 'kernel': 'Normal', 'loss_name': 'CensoredNLLLoss'}. Best is trial 468 with value: 0.8545388812039783.[0m
[32m[I 2022-04-22 14:12:37,134][0m Trial 910 finished with value: 0.8318972491930536 and parameters: {'n_hidden': 2048, 'mixture_components': 3, 'use_sparse_layer': True, 'use_sparse_loss': True, 'lmbd': 2.8576008742200117e-06, 'use_batchnorm': False, 'use_dropout': False, 'mlp_size_1': 8, 'mlp_size_2': 0, 'mlp_size_3': 0, 'kernel': 'LogLogistic', 'loss_name': 'CensoredNLLLoss'}. Best is trial 468 with value: 0.8545388812039783.[0m
[32m[I 2022-04-22 14:13:44,251][0m Trial 911 finished with value: 0.8419973893241668 and parameters: {'n_hidden': 2048, 'mixture_components': 2, 'use_sparse_layer': False, 'use_batchnorm': False, 'use_dropout': False, 'mlp_size_1': 7, 'mlp_size_2': 1, 'mlp_size_3': 0, 'kernel': 'LogLogistic', 'loss_name': 'CensoredNLLLoss'}. Best is trial 468 with value: 0.8545388812039783.[0m
[32m[I 2022-04-22 14:14:59,945][0m Trial 912 finished with value: 0.8103684297145936 and parameters: {'n_hidden': 2048, 'mixture_components': 3, 'use_sparse_layer': True, 'use_sparse_loss': True, 'lmbd': 3.3995401736780445e-06, 'use_batchnorm': False, 'use_dropout': False, 'mlp_size_1': 7, 'mlp_size_2': 1, 'mlp_size_3': 0, 'kernel': 'Normal', 'loss_name': 'CensoredNLLLoss'}. Best is trial 468 with value: 0.8545388812039783.[0m
[32m[I 2022-04-22 14:16:00,903][0m Trial 913 finished with value: 0.8396881009867491 and parameters: {'n_hidden': 32, 'mixture_components': 3, 'use_sparse_layer': False, 'use_batchnorm': False, 'use_dropout': False, 'mlp_size_1': 2, 'mlp_size_2': 0, 'mlp_size_3': 0, 'kernel': 'LogLogistic', 'loss_name': 'CensoredNLLLoss'}. Best is trial 468 with value: 0.8545388812039783.[0m
[32m[I 2022-04-22 14:17:05,457][0m Trial 914 finished with value: 0.8443590206503984 and parameters: {'n_hidden': 2048, 'mixture_components': 3, 'use_sparse_layer': True, 'use_sparse_loss': True, 'lmbd': 0.00020675736890705176, 'use_batchnorm': False, 'use_dropout': False, 'mlp_size_1': 7, 'mlp_size_2': 1, 'mlp_size_3': 0, 'kernel': 'LogLogistic', 'loss_name': 'CensoredNLLLoss'}. Best is trial 468 with value: 0.8545388812039783.[0m
[32m[I 2022-04-22 14:18:08,007][0m Trial 915 finished with value: 0.8381385025405106 and parameters: {'n_hidden': 2048, 'mixture_components': 3, 'use_sparse_layer': False, 'use_batchnorm': False, 'use_dropout': False, 'mlp_size_1': 7, 'mlp_size_2': 1, 'mlp_size_3': 0, 'kernel': 'LogLogistic', 'loss_name': 'CensoredNLLLoss'}. Best is trial 468 with value: 0.8545388812039783.[0m
[32m[I 2022-04-22 14:19:26,917][0m Trial 916 finished with value: 0.7462576541192627 and parameters: {'n_hidden': 2048, 'mixture_components': 3, 'use_sparse_layer': True, 'use_sparse_loss': True, 'lmbd': 3.9155628141220116e-05, 'use_batchnorm': False, 'use_dropout': False, 'mlp_size_1': 7, 'mlp_size_2': 1, 'mlp_size_3': 0, 'kernel': 'Normal', 'loss_name': 'CensoredNLLLoss'}. Best is trial 468 with value: 0.8545388812039783.[0m
[32m[I 2022-04-22 14:20:31,523][0m Trial 917 finished with value: 0.8451918316834994 and parameters: {'n_hidden': 2048, 'mixture_components': 3, 'use_sparse_layer': False, 'use_batchnorm': False, 'use_dropout': False, 'mlp_size_1': 7, 'mlp_size_2': 1, 'mlp_size_3': 0, 'kernel': 'LogLogistic', 'loss_name': 'CensoredNLLLoss'}. Best is trial 468 with value: 0.8545388812039783.[0m
[32m[I 2022-04-22 14:22:57,739][0m Trial 918 finished with value: 0.5232741953839151 and parameters: {'n_hidden': 2048, 'mixture_components': 2, 'use_sparse_layer': True, 'use_sparse_loss': True, 'lmbd': 2.119874514358676e-05, 'use_batchnorm': True, 'use_dropout': False, 'mlp_size_1': 8, 'mlp_size_2': 0, 'mlp_size_3': 0, 'kernel': 'LogLogistic', 'loss_name': 'CensoredNLLLoss'}. Best is trial 468 with value: 0.8545388812039783.[0m
[32m[I 2022-04-22 14:23:53,036][0m Trial 919 finished with value: 0.8422278626177171 and parameters: {'n_hidden': 64, 'mixture_components': 3, 'use_sparse_layer': False, 'use_batchnorm': False, 'use_dropout': False, 'mlp_size_1': 3, 'mlp_size_2': 0, 'mlp_size_3': 0, 'kernel': 'Normal', 'loss_name': 'CensoredNLLLoss'}. Best is trial 468 with value: 0.8545388812039783.[0m
[32m[I 2022-04-22 14:25:05,715][0m Trial 920 finished with value: 0.839343362962713 and parameters: {'n_hidden': 2048, 'mixture_components': 3, 'use_sparse_layer': False, 'use_batchnorm': False, 'use_dropout': False, 'mlp_size_1': 7, 'mlp_size_2': 1, 'mlp_size_3': 0, 'kernel': 'LogLogistic', 'loss_name': 'CensoredNLLLoss'}. Best is trial 468 with value: 0.8545388812039783.[0m
[32m[I 2022-04-22 14:26:23,193][0m Trial 921 finished with value: 0.724730088261985 and parameters: {'n_hidden': 2048, 'mixture_components': 3, 'use_sparse_layer': True, 'use_sparse_loss': True, 'lmbd': 0.00011946228069645046, 'use_batchnorm': False, 'use_dropout': False, 'mlp_size_1': 7, 'mlp_size_2': 1, 'mlp_size_3': 0, 'kernel': 'LogLogistic', 'loss_name': 'CensoredNLLLoss'}. Best is trial 468 with value: 0.8545388812039783.[0m
[32m[I 2022-04-22 14:27:39,741][0m Trial 922 finished with value: 0.7405748198410755 and parameters: {'n_hidden': 2048, 'mixture_components': 3, 'use_sparse_layer': False, 'use_batchnorm': False, 'use_dropout': False, 'mlp_size_1': 8, 'mlp_size_2': 0, 'mlp_size_3': 0, 'kernel': 'Normal', 'loss_name': 'CensoredNLLLoss'}. Best is trial 468 with value: 0.8545388812039783.[0m
[32m[I 2022-04-22 14:28:26,335][0m Trial 923 finished with value: 0.8436349048623966 and parameters: {'n_hidden': 256, 'mixture_components': 3, 'use_sparse_layer': True, 'use_sparse_loss': True, 'lmbd': 1.4898653176465393e-05, 'use_batchnorm': False, 'use_dropout': False, 'mlp_size_1': 5, 'mlp_size_2': 0, 'mlp_size_3': 0, 'kernel': 'LogLogistic', 'loss_name': 'CensoredNLLLoss'}. Best is trial 468 with value: 0.8545388812039783.[0m
[32m[I 2022-04-22 14:29:25,951][0m Trial 924 finished with value: 0.8402254797497223 and parameters: {'n_hidden': 2048, 'mixture_components': 3, 'use_sparse_layer': False, 'use_batchnorm': False, 'use_dropout': False, 'mlp_size_1': 7, 'mlp_size_2': 1, 'mlp_size_3': 0, 'kernel': 'LogLogistic', 'loss_name': 'CensoredNLLLoss'}. Best is trial 468 with value: 0.8545388812039783.[0m
[32m[I 2022-04-22 14:30:34,076][0m Trial 925 finished with value: 0.835270920732856 and parameters: {'n_hidden': 2048, 'mixture_components': 3, 'use_sparse_layer': True, 'use_sparse_loss': True, 'lmbd': 4.041301492065206e-06, 'use_batchnorm': False, 'use_dropout': False, 'mlp_size_1': 7, 'mlp_size_2': 1, 'mlp_size_3': 0, 'kernel': 'LogLogistic', 'loss_name': 'CensoredNLLLoss'}. Best is trial 468 with value: 0.8545388812039783.[0m
[32m[I 2022-04-22 14:31:52,197][0m Trial 926 finished with value: 0.8387016298503724 and parameters: {'n_hidden': 2048, 'mixture_components': 3, 'use_sparse_layer': False, 'use_batchnorm': False, 'use_dropout': False, 'mlp_size_1': 7, 'mlp_size_2': 1, 'mlp_size_3': 0, 'kernel': 'Normal', 'loss_name': 'CensoredNLLLoss'}. Best is trial 468 with value: 0.8545388812039783.[0m
[32m[I 2022-04-22 14:32:59,251][0m Trial 927 finished with value: 0.8455544622299852 and parameters: {'n_hidden': 2048, 'mixture_components': 6, 'use_sparse_layer': True, 'use_sparse_loss': True, 'lmbd': 8.866850078603126e-06, 'use_batchnorm': False, 'use_dropout': False, 'mlp_size_1': 7, 'mlp_size_2': 1, 'mlp_size_3': 0, 'kernel': 'LogLogistic', 'loss_name': 'CensoredNLLLoss'}. Best is trial 468 with value: 0.8545388812039783.[0m
[32m[I 2022-04-22 14:34:04,582][0m Trial 928 finished with value: 0.8373489108975598 and parameters: {'n_hidden': 2048, 'mixture_components': 3, 'use_sparse_layer': False, 'use_batchnorm': False, 'use_dropout': False, 'mlp_size_1': 7, 'mlp_size_2': 1, 'mlp_size_3': 0, 'kernel': 'LogLogistic', 'loss_name': 'CensoredNLLLoss'}. Best is trial 468 with value: 0.8545388812039783.[0m
[32m[I 2022-04-22 14:35:05,719][0m Trial 929 finished with value: 0.7420039662801124 and parameters: {'n_hidden': 2048, 'mixture_components': 3, 'use_sparse_layer': False, 'use_batchnorm': False, 'use_dropout': False, 'mlp_size_1': 7, 'mlp_size_2': 1, 'mlp_size_3': 0, 'kernel': 'Normal', 'loss_name': 'CensoredNLLLoss'}. Best is trial 468 with value: 0.8545388812039783.[0m
[32m[I 2022-04-22 14:35:58,627][0m Trial 930 finished with value: 0.8033848854304024 and parameters: {'n_hidden': 128, 'mixture_components': 3, 'use_sparse_layer': True, 'use_sparse_loss': True, 'lmbd': 5.5472716831733715e-05, 'use_batchnorm': False, 'use_dropout': False, 'mlp_size_1': 4, 'mlp_size_2': 0, 'mlp_size_3': 0, 'kernel': 'LogLogistic', 'loss_name': 'CensoredNLLLoss'}. Best is trial 468 with value: 0.8545388812039783.[0m
[32m[I 2022-04-22 14:36:41,333][0m Trial 931 finished with value: -0.23290445448224215 and parameters: {'n_hidden': 2048, 'mixture_components': 3, 'use_sparse_layer': False, 'use_batchnorm': False, 'use_dropout': False, 'mlp_size_1': 8, 'mlp_size_2': 0, 'mlp_size_3': 0, 'kernel': 'Exponential', 'loss_name': 'CensoredNLLLoss'}. Best is trial 468 with value: 0.8545388812039783.[0m
[32m[I 2022-04-22 14:37:50,191][0m Trial 932 finished with value: 0.8431107022834894 and parameters: {'n_hidden': 2048, 'mixture_components': 3, 'use_sparse_layer': True, 'use_sparse_loss': True, 'lmbd': 1.1393412664012646e-05, 'use_batchnorm': False, 'use_dropout': False, 'mlp_size_1': 7, 'mlp_size_2': 1, 'mlp_size_3': 0, 'kernel': 'LogLogistic', 'loss_name': 'CensoredNLLLoss'}. Best is trial 468 with value: 0.8545388812039783.[0m
[32m[I 2022-04-22 14:38:48,459][0m Trial 933 finished with value: 0.8393607219532264 and parameters: {'n_hidden': 2048, 'mixture_components': 2, 'use_sparse_layer': False, 'use_batchnorm': False, 'use_dropout': False, 'mlp_size_1': 7, 'mlp_size_2': 1, 'mlp_size_3': 0, 'kernel': 'Logistic', 'loss_name': 'CensoredNLLLoss'}. Best is trial 468 with value: 0.8545388812039783.[0m
