[32m[I 2022-04-21 21:56:09,989][0m Trial 250 finished with value: 0.6865430884322762 and parameters: {'loss': 'coxph', 'learning_rate': 5.6009401410251953e-05, 'n_estimators': 318, 'criterion': 'squared_error', 'min_samples_split': 7, 'min_samples_leaf': 10, 'min_weight_fraction_leaf': 0.19225208768189458, 'min_impurity_decrease': 0.02367163038355735, 'max_features': 0.9821670998539617, 'subsample': 0.2999301631411271, 'dropout_rate': 0.029601336370148168, 'ccp_alpha': 0.06138166299626546}. Best is trial 187 with value: 0.6933481836305168.[0m
[32m[I 2022-04-21 21:56:47,513][0m Trial 251 finished with value: 0.686424243709244 and parameters: {'loss': 'coxph', 'learning_rate': 4.480532043481022e-05, 'n_estimators': 349, 'criterion': 'squared_error', 'min_samples_split': 7, 'min_samples_leaf': 3, 'min_weight_fraction_leaf': 0.1812430216518819, 'min_impurity_decrease': 0.0015787585607538318, 'max_features': 0.8838170703277933, 'subsample': 0.3267512480786165, 'dropout_rate': 0.0694201945774747, 'ccp_alpha': 0.002758653503952588}. Best is trial 187 with value: 0.6933481836305168.[0m
[32m[I 2022-04-21 21:57:06,681][0m Trial 252 finished with value: 0.6648185145580262 and parameters: {'loss': 'coxph', 'learning_rate': 7.022565423460948e-05, 'n_estimators': 293, 'criterion': 'squared_error', 'min_samples_split': 7, 'min_samples_leaf': 10, 'min_weight_fraction_leaf': 0.21408497491805456, 'min_impurity_decrease': 0.05868960911333104, 'max_features': 0.999448734601352, 'subsample': 0.26769684037549657, 'dropout_rate': 0.1103013163491334, 'ccp_alpha': 0.2717508059353694}. Best is trial 187 with value: 0.6933481836305168.[0m
[32m[I 2022-04-21 21:57:32,117][0m Trial 253 finished with value: 0.687775053516124 and parameters: {'loss': 'coxph', 'learning_rate': 0.0001263404099990672, 'n_estimators': 332, 'criterion': 'squared_error', 'min_samples_split': 7, 'min_samples_leaf': 10, 'min_weight_fraction_leaf': 0.2322633989254108, 'min_impurity_decrease': 0.0762645232716471, 'max_features': 0.94718903952233, 'subsample': 0.28706935939239653, 'dropout_rate': 0.06038845989549949, 'ccp_alpha': 0.001012997278684341}. Best is trial 187 with value: 0.6933481836305168.[0m
[32m[I 2022-04-21 21:57:58,798][0m Trial 254 finished with value: 0.6814687100015528 and parameters: {'loss': 'coxph', 'learning_rate': 0.00011934814966921675, 'n_estimators': 338, 'criterion': 'squared_error', 'min_samples_split': 7, 'min_samples_leaf': 10, 'min_weight_fraction_leaf': 0.23644541465845417, 'min_impurity_decrease': 0.08555462694967679, 'max_features': 0.9479103990783406, 'subsample': 0.24406905070162976, 'dropout_rate': 0.08186380261457238, 'ccp_alpha': 0.17012894766421544}. Best is trial 187 with value: 0.6933481836305168.[0m
/media/san2_ssd/data/Workdir/survival/venv/lib/python3.8/site-packages/sksurv/ensemble/boosting.py:955: RuntimeWarning: divide by zero encountered in log
  time = numpy.log(time)
/media/san2_ssd/data/Workdir/survival/venv/lib/python3.8/site-packages/sksurv/ensemble/boosting.py:955: RuntimeWarning: divide by zero encountered in log
  time = numpy.log(time)
/media/san2_ssd/data/Workdir/survival/venv/lib/python3.8/site-packages/sksurv/ensemble/boosting.py:955: RuntimeWarning: divide by zero encountered in log
  time = numpy.log(time)
/media/san2_ssd/data/Workdir/survival/venv/lib/python3.8/site-packages/sksurv/ensemble/boosting.py:955: RuntimeWarning: divide by zero encountered in log
  time = numpy.log(time)
[32m[I 2022-04-21 21:58:03,043][0m Trial 255 finished with value: -0.7300626104586849 and parameters: {'loss': 'squared', 'learning_rate': 9.75713676687151e-05, 'n_estimators': 325, 'criterion': 'squared_error', 'min_samples_split': 7, 'min_samples_leaf': 10, 'min_weight_fraction_leaf': 0.22544970935482828, 'min_impurity_decrease': 0.07087541735706435, 'max_features': 0.9622155769761528, 'subsample': 0.33286926723931426, 'dropout_rate': 0.022199994780284137, 'ccp_alpha': 0.40772224374163246}. Best is trial 187 with value: 0.6933481836305168.[0m
[32m[I 2022-04-21 21:58:37,044][0m Trial 256 finished with value: 0.6842694854968377 and parameters: {'loss': 'coxph', 'learning_rate': 7.550701193928166e-05, 'n_estimators': 363, 'criterion': 'squared_error', 'min_samples_split': 7, 'min_samples_leaf': 10, 'min_weight_fraction_leaf': 0.23467458581980102, 'min_impurity_decrease': 0.04721040330123563, 'max_features': 0.9429979303930018, 'subsample': 0.312265196453894, 'dropout_rate': 0.059474890675652314, 'ccp_alpha': 0.17403023783433216}. Best is trial 187 with value: 0.6933481836305168.[0m
[32m[I 2022-04-21 21:58:52,654][0m Trial 257 finished with value: 0.6789430380195445 and parameters: {'loss': 'coxph', 'learning_rate': 0.00013923232245690437, 'n_estimators': 309, 'criterion': 'squared_error', 'min_samples_split': 7, 'min_samples_leaf': 10, 'min_weight_fraction_leaf': 0.19421716634955902, 'min_impurity_decrease': 0.08310399253891584, 'max_features': 0.9765852019071677, 'subsample': 0.647528293819015, 'dropout_rate': 0.4863104592937965, 'ccp_alpha': 0.008704081552362146}. Best is trial 187 with value: 0.6933481836305168.[0m
[32m[I 2022-04-21 21:59:20,395][0m Trial 258 finished with value: 0.6874969106579255 and parameters: {'loss': 'coxph', 'learning_rate': 0.00011659330075780481, 'n_estimators': 341, 'criterion': 'squared_error', 'min_samples_split': 7, 'min_samples_leaf': 10, 'min_weight_fraction_leaf': 0.22243765230053741, 'min_impurity_decrease': 0.04482088629281937, 'max_features': 0.9070765959819344, 'subsample': 0.284239690668397, 'dropout_rate': 0.09902003648538127, 'ccp_alpha': 0.0030474686403966765}. Best is trial 187 with value: 0.6933481836305168.[0m
[32m[I 2022-04-21 21:59:48,485][0m Trial 259 finished with value: 0.5 and parameters: {'loss': 'coxph', 'learning_rate': 5.955637772676685e-05, 'n_estimators': 322, 'criterion': 'absolute_error', 'min_samples_split': 7, 'min_samples_leaf': 10, 'min_weight_fraction_leaf': 0.20849583084691226, 'min_impurity_decrease': 0.46581005488659105, 'max_features': 0.9292338710604602, 'subsample': 0.2633251106504053, 'dropout_rate': 0.07723991200929171, 'ccp_alpha': 0.2577646491220803}. Best is trial 187 with value: 0.6933481836305168.[0m
[32m[I 2022-04-21 22:00:11,225][0m Trial 260 finished with value: 0.689525180203219 and parameters: {'loss': 'coxph', 'learning_rate': 3.130555713660028e-05, 'n_estimators': 303, 'criterion': 'squared_error', 'min_samples_split': 7, 'min_samples_leaf': 10, 'min_weight_fraction_leaf': 0.18170298182287062, 'min_impurity_decrease': 0.025807324424096507, 'max_features': 0.8505255089365649, 'subsample': 0.30403167334310693, 'dropout_rate': 0.05426454349012408, 'ccp_alpha': 0.10609905891970396}. Best is trial 187 with value: 0.6933481836305168.[0m
[32m[I 2022-04-21 22:00:34,993][0m Trial 261 finished with value: 0.6314304272258378 and parameters: {'loss': 'coxph', 'learning_rate': 2.0126205834450108e-05, 'n_estimators': 301, 'criterion': 'squared_error', 'min_samples_split': 2, 'min_samples_leaf': 10, 'min_weight_fraction_leaf': 0.18381043038645264, 'min_impurity_decrease': 0.0213058140974603, 'max_features': 0.851066050502017, 'subsample': 0.3138214798933128, 'dropout_rate': 0.030010980131191682, 'ccp_alpha': 0.35808435074071576}. Best is trial 187 with value: 0.6933481836305168.[0m
[32m[I 2022-04-21 22:00:56,432][0m Trial 262 finished with value: 0.6879059587818231 and parameters: {'loss': 'coxph', 'learning_rate': 3.0790952076842896e-05, 'n_estimators': 306, 'criterion': 'squared_error', 'min_samples_split': 7, 'min_samples_leaf': 10, 'min_weight_fraction_leaf': 0.19458747601231327, 'min_impurity_decrease': 0.0017412903601603281, 'max_features': 0.795726512988405, 'subsample': 0.34735661143159013, 'dropout_rate': 0.1279804214865949, 'ccp_alpha': 0.15834653854243638}. Best is trial 187 with value: 0.6933481836305168.[0m
[32m[I 2022-04-21 22:01:17,113][0m Trial 263 finished with value: 0.6865132268532863 and parameters: {'loss': 'coxph', 'learning_rate': 3.859862306464329e-05, 'n_estimators': 296, 'criterion': 'squared_error', 'min_samples_split': 7, 'min_samples_leaf': 10, 'min_weight_fraction_leaf': 0.17976376759260834, 'min_impurity_decrease': 0.01721463186602741, 'max_features': 0.7998768400939051, 'subsample': 0.35897166767070604, 'dropout_rate': 0.1407862568063445, 'ccp_alpha': 0.1792754951835803}. Best is trial 187 with value: 0.6933481836305168.[0m
[32m[I 2022-04-21 22:01:35,950][0m Trial 264 finished with value: 0.5 and parameters: {'loss': 'coxph', 'learning_rate': 2.510780101938312e-05, 'n_estimators': 312, 'criterion': 'squared_error', 'min_samples_split': 7, 'min_samples_leaf': 10, 'min_weight_fraction_leaf': 0.19147073732266948, 'min_impurity_decrease': 0.03551049133226393, 'max_features': 0.8381186075523008, 'subsample': 0.33801317652358054, 'dropout_rate': 0.11438500030000504, 'ccp_alpha': 2.6210512420236745}. Best is trial 187 with value: 0.6933481836305168.[0m
[32m[I 2022-04-21 22:02:07,302][0m Trial 265 finished with value: 0.5217151934164563 and parameters: {'loss': 'coxph', 'learning_rate': 3.125881640698942e-05, 'n_estimators': 351, 'criterion': 'squared_error', 'min_samples_split': 7, 'min_samples_leaf': 10, 'min_weight_fraction_leaf': 0.1974968592975584, 'min_impurity_decrease': 0.004198632485366231, 'max_features': 0.8679642016883425, 'subsample': 0.7140670573245057, 'dropout_rate': 0.12444945832998289, 'ccp_alpha': 0.2921764869527686}. Best is trial 187 with value: 0.6933481836305168.[0m
[32m[I 2022-04-21 22:02:31,055][0m Trial 266 finished with value: 0.5827751132342576 and parameters: {'loss': 'coxph', 'learning_rate': 1.3030039048300147e-05, 'n_estimators': 291, 'criterion': 'squared_error', 'min_samples_split': 7, 'min_samples_leaf': 10, 'min_weight_fraction_leaf': 0.21047306900988713, 'min_impurity_decrease': 0.021195029088617978, 'max_features': 0.8222822629482217, 'subsample': 0.3017251648561054, 'dropout_rate': 0.09341067319641856, 'ccp_alpha': 0.46529453934972026}. Best is trial 187 with value: 0.6933481836305168.[0m
[32m[I 2022-04-21 22:03:22,113][0m Trial 267 finished with value: 0.6866696451470079 and parameters: {'loss': 'coxph', 'learning_rate': 5.794337558704759e-06, 'n_estimators': 390, 'criterion': 'squared_error', 'min_samples_split': 7, 'min_samples_leaf': 10, 'min_weight_fraction_leaf': 0.18442079806159017, 'min_impurity_decrease': 0.04194577222895893, 'max_features': 0.7744877065166349, 'subsample': 0.34483935510150393, 'dropout_rate': 0.04963897359724456, 'ccp_alpha': 0.13378652883260167}. Best is trial 187 with value: 0.6933481836305168.[0m
[32m[I 2022-04-21 22:03:49,942][0m Trial 268 finished with value: 0.5241670916226966 and parameters: {'loss': 'coxph', 'learning_rate': 3.382179326343336e-05, 'n_estimators': 326, 'criterion': 'squared_error', 'min_samples_split': 7, 'min_samples_leaf': 10, 'min_weight_fraction_leaf': 0.20347709811197093, 'min_impurity_decrease': 0.6444126111313948, 'max_features': 0.8906776838317213, 'subsample': 0.269621638814001, 'dropout_rate': 0.07912890130231208, 'ccp_alpha': 0.1889201943865679}. Best is trial 187 with value: 0.6933481836305168.[0m
[32m[I 2022-04-21 22:04:17,472][0m Trial 269 finished with value: 0.6841146226431294 and parameters: {'loss': 'coxph', 'learning_rate': 2.5913194771521293e-05, 'n_estimators': 304, 'criterion': 'squared_error', 'min_samples_split': 8, 'min_samples_leaf': 10, 'min_weight_fraction_leaf': 0.17768034529163818, 'min_impurity_decrease': 0.023850960568603363, 'max_features': 0.8411500499665174, 'subsample': 0.3267125392849277, 'dropout_rate': 0.1533543356067533, 'ccp_alpha': 0.11690446198638862}. Best is trial 187 with value: 0.6933481836305168.[0m
[32m[I 2022-04-21 22:04:45,266][0m Trial 270 finished with value: 0.6635807151369472 and parameters: {'loss': 'coxph', 'learning_rate': 5.897483526816758e-05, 'n_estimators': 287, 'criterion': 'squared_error', 'min_samples_split': 7, 'min_samples_leaf': 10, 'min_weight_fraction_leaf': 0.21773431942329852, 'min_impurity_decrease': 0.001543589926901328, 'max_features': 0.7525343728954584, 'subsample': 0.2450017249640887, 'dropout_rate': 0.021844812434881185, 'ccp_alpha': 0.26658069071609913}. Best is trial 187 with value: 0.6933481836305168.[0m
[32m[I 2022-04-21 22:05:09,660][0m Trial 271 finished with value: 0.5 and parameters: {'loss': 'coxph', 'learning_rate': 2.86981627308803e-05, 'n_estimators': 318, 'criterion': 'squared_error', 'min_samples_split': 7, 'min_samples_leaf': 10, 'min_weight_fraction_leaf': 0.19309652498419083, 'min_impurity_decrease': 0.05053019617511285, 'max_features': 0.8612391981633831, 'subsample': 0.2892096349546467, 'dropout_rate': 0.05569196270084226, 'ccp_alpha': 4.838218787818958}. Best is trial 187 with value: 0.6933481836305168.[0m
[32m[I 2022-04-21 22:05:43,225][0m Trial 272 finished with value: 0.5 and parameters: {'loss': 'coxph', 'learning_rate': 4.390501364825532e-05, 'n_estimators': 343, 'criterion': 'squared_error', 'min_samples_split': 7, 'min_samples_leaf': 10, 'min_weight_fraction_leaf': 0.20704106848266837, 'min_impurity_decrease': 0.03876936777243583, 'max_features': 0.6808065549760406, 'subsample': 0.11363549450755847, 'dropout_rate': 0.10088884406220266, 'ccp_alpha': 0.3552253278820951}. Best is trial 187 with value: 0.6933481836305168.[0m
[32m[I 2022-04-21 22:06:17,054][0m Trial 273 finished with value: 0.6861404912612297 and parameters: {'loss': 'coxph', 'learning_rate': 7.110846557374782e-05, 'n_estimators': 370, 'criterion': 'squared_error', 'min_samples_split': 7, 'min_samples_leaf': 10, 'min_weight_fraction_leaf': 0.1622536218595374, 'min_impurity_decrease': 0.018338248132293528, 'max_features': 0.9161497993709649, 'subsample': 0.368312172560905, 'dropout_rate': 0.04096533216147801, 'ccp_alpha': 0.10256087782546111}. Best is trial 187 with value: 0.6933481836305168.[0m
/media/san2_ssd/data/Workdir/survival/venv/lib/python3.8/site-packages/sksurv/ensemble/boosting.py:955: RuntimeWarning: divide by zero encountered in log
  time = numpy.log(time)
/media/san2_ssd/data/Workdir/survival/venv/lib/python3.8/site-packages/sksurv/ensemble/boosting.py:955: RuntimeWarning: divide by zero encountered in log
  time = numpy.log(time)
/media/san2_ssd/data/Workdir/survival/venv/lib/python3.8/site-packages/sksurv/ensemble/boosting.py:955: RuntimeWarning: divide by zero encountered in log
  time = numpy.log(time)
/media/san2_ssd/data/Workdir/survival/venv/lib/python3.8/site-packages/sksurv/ensemble/boosting.py:955: RuntimeWarning: divide by zero encountered in log
  time = numpy.log(time)
[32m[I 2022-04-21 22:06:18,475][0m Trial 274 finished with value: -0.7297033464820903 and parameters: {'loss': 'squared', 'learning_rate': 8.44539196131476e-05, 'n_estimators': 268, 'criterion': 'squared_error', 'min_samples_split': 7, 'min_samples_leaf': 10, 'min_weight_fraction_leaf': 0.2198110340643468, 'min_impurity_decrease': 0.0020166216926218172, 'max_features': 0.8781497699848129, 'subsample': 0.30967980359090963, 'dropout_rate': 0.529754708238582, 'ccp_alpha': 0.2406153643401423}. Best is trial 187 with value: 0.6933481836305168.[0m
[32m[I 2022-04-21 22:06:44,446][0m Trial 275 finished with value: 0.6818624984225002 and parameters: {'loss': 'coxph', 'learning_rate': 2.2150241002654055e-05, 'n_estimators': 300, 'criterion': 'squared_error', 'min_samples_split': 7, 'min_samples_leaf': 10, 'min_weight_fraction_leaf': 0.19073012668684267, 'min_impurity_decrease': 0.05708081583771436, 'max_features': 0.7961427901714894, 'subsample': 0.26565781860628385, 'dropout_rate': 0.0745634832672769, 'ccp_alpha': 0.10471002661470494}. Best is trial 187 with value: 0.6933481836305168.[0m
[32m[I 2022-04-21 22:07:14,534][0m Trial 276 finished with value: 0.6865132268532863 and parameters: {'loss': 'coxph', 'learning_rate': 5.3257064190098104e-05, 'n_estimators': 327, 'criterion': 'squared_error', 'min_samples_split': 7, 'min_samples_leaf': 10, 'min_weight_fraction_leaf': 0.21064718259948592, 'min_impurity_decrease': 0.034064044688565324, 'max_features': 0.9635915233902165, 'subsample': 0.2919983759624154, 'dropout_rate': 0.09026852340272398, 'ccp_alpha': 0.1771136211867979}. Best is trial 187 with value: 0.6933481836305168.[0m
[32m[I 2022-04-21 22:07:34,923][0m Trial 277 finished with value: 0.6871976998830512 and parameters: {'loss': 'coxph', 'learning_rate': 3.832771719656243e-05, 'n_estimators': 283, 'criterion': 'squared_error', 'min_samples_split': 8, 'min_samples_leaf': 10, 'min_weight_fraction_leaf': 0.19933666874908854, 'min_impurity_decrease': 0.06215817463529707, 'max_features': 0.8324721561409049, 'subsample': 0.3225009705005905, 'dropout_rate': 0.12907657395513805, 'ccp_alpha': 0.10739560883370156}. Best is trial 187 with value: 0.6933481836305168.[0m
[32m[I 2022-04-21 22:07:53,927][0m Trial 278 finished with value: 0.6756945410097407 and parameters: {'loss': 'coxph', 'learning_rate': 1.54004563964138e-05, 'n_estimators': 310, 'criterion': 'squared_error', 'min_samples_split': 7, 'min_samples_leaf': 10, 'min_weight_fraction_leaf': 0.17946368847498856, 'min_impurity_decrease': 0.02046078073180903, 'max_features': 0.8992110309322551, 'subsample': 0.23384537953931983, 'dropout_rate': 0.06401534235884951, 'ccp_alpha': 0.25681794812481906}. Best is trial 187 with value: 0.6933481836305168.[0m
[32m[I 2022-04-21 22:08:10,422][0m Trial 279 finished with value: 0.5 and parameters: {'loss': 'coxph', 'learning_rate': 9.517675925892168e-05, 'n_estimators': 261, 'criterion': 'absolute_error', 'min_samples_split': 7, 'min_samples_leaf': 10, 'min_weight_fraction_leaf': 0.22293258030726934, 'min_impurity_decrease': 0.3160976495320229, 'max_features': 0.9805575001250453, 'subsample': 0.343274165719479, 'dropout_rate': 0.02039418648669141, 'ccp_alpha': 0.3731848318723209}. Best is trial 187 with value: 0.6933481836305168.[0m
[32m[I 2022-04-21 22:08:45,343][0m Trial 280 finished with value: 0.6879356248829855 and parameters: {'loss': 'coxph', 'learning_rate': 7.253412928207084e-05, 'n_estimators': 350, 'criterion': 'squared_error', 'min_samples_split': 7, 'min_samples_leaf': 10, 'min_weight_fraction_leaf': 0.1970661515296828, 'min_impurity_decrease': 0.04061414189680297, 'max_features': 0.9297155500331583, 'subsample': 0.2761670994250428, 'dropout_rate': 0.040683141388697046, 'ccp_alpha': 0.07461091181157316}. Best is trial 187 with value: 0.6933481836305168.[0m
[32m[I 2022-04-21 22:09:17,090][0m Trial 281 finished with value: 0.6889256950157886 and parameters: {'loss': 'coxph', 'learning_rate': 5.943310907905389e-05, 'n_estimators': 354, 'criterion': 'squared_error', 'min_samples_split': 7, 'min_samples_leaf': 10, 'min_weight_fraction_leaf': 0.20819701388655484, 'min_impurity_decrease': 0.05088961237160118, 'max_features': 0.9255313164688459, 'subsample': 0.2503417404785627, 'dropout_rate': 0.042274307902835165, 'ccp_alpha': 0.0020806283122860175}. Best is trial 187 with value: 0.6933481836305168.[0m
[32m[I 2022-04-21 22:09:53,526][0m Trial 282 finished with value: 0.6869962238053798 and parameters: {'loss': 'coxph', 'learning_rate': 8.502803806078193e-05, 'n_estimators': 384, 'criterion': 'squared_error', 'min_samples_split': 7, 'min_samples_leaf': 10, 'min_weight_fraction_leaf': 0.21677946616664068, 'min_impurity_decrease': 0.08242974884530171, 'max_features': 0.9252719935020088, 'subsample': 0.22100709864255424, 'dropout_rate': 0.04777550860344942, 'ccp_alpha': 0.002729072701733546}. Best is trial 187 with value: 0.6933481836305168.[0m
[32m[I 2022-04-21 22:10:35,360][0m Trial 283 finished with value: 0.6847588858705541 and parameters: {'loss': 'coxph', 'learning_rate': 6.596049402855315e-05, 'n_estimators': 356, 'criterion': 'squared_error', 'min_samples_split': 7, 'min_samples_leaf': 10, 'min_weight_fraction_leaf': 0.20280136871294138, 'min_impurity_decrease': 0.056875132332254635, 'max_features': 0.902538197303736, 'subsample': 0.24474032572896176, 'dropout_rate': 0.03383021778149172, 'ccp_alpha': 0.13168309314993315}. Best is trial 187 with value: 0.6933481836305168.[0m
[32m[I 2022-04-21 22:11:05,291][0m Trial 284 finished with value: 0.5 and parameters: {'loss': 'coxph', 'learning_rate': 0.00010538933238931353, 'n_estimators': 363, 'criterion': 'squared_error', 'min_samples_split': 7, 'min_samples_leaf': 10, 'min_weight_fraction_leaf': 0.22632318544650806, 'min_impurity_decrease': 0.07165839087264417, 'max_features': 0.9449187046258222, 'subsample': 0.26913029785218395, 'dropout_rate': 0.06627059975217536, 'ccp_alpha': 1.7175586973953467}. Best is trial 187 with value: 0.6933481836305168.[0m
[32m[I 2022-04-21 22:11:48,808][0m Trial 285 finished with value: 0.6896149493697684 and parameters: {'loss': 'coxph', 'learning_rate': 5.024390909445367e-05, 'n_estimators': 398, 'criterion': 'squared_error', 'min_samples_split': 7, 'min_samples_leaf': 10, 'min_weight_fraction_leaf': 0.18451816916326805, 'min_impurity_decrease': 0.04548949308384998, 'max_features': 0.8784414551036986, 'subsample': 0.25692868993242385, 'dropout_rate': 0.010567920711619778, 'ccp_alpha': 0.10461034009473788}. Best is trial 187 with value: 0.6933481836305168.[0m
[32m[I 2022-04-21 22:12:33,918][0m Trial 286 finished with value: 0.6837472988064728 and parameters: {'loss': 'coxph', 'learning_rate': 6.135513082634535e-05, 'n_estimators': 399, 'criterion': 'squared_error', 'min_samples_split': 7, 'min_samples_leaf': 10, 'min_weight_fraction_leaf': 0.18264244498113166, 'min_impurity_decrease': 0.08957171118663612, 'max_features': 0.8721437738433022, 'subsample': 0.20829495277088733, 'dropout_rate': 0.0014449428877601114, 'ccp_alpha': 0.06060906421326581}. Best is trial 187 with value: 0.6933481836305168.[0m
