[32m[I 2022-04-22 18:18:00,362][0m Trial 159 finished with value: 0.6844252295509715 and parameters: {'n_hidden': 512, 'mixture_components': 3, 'use_sparse_layer': False, 'use_batchnorm': False, 'use_dropout': False, 'mlp_size_1': 6, 'mlp_size_2': 0, 'mlp_size_3': 0, 'kernel': 'Gumbel', 'loss_name': 'NLLLoss'}. Best is trial 135 with value: 0.7009567952772325.[0m
[32m[I 2022-04-22 18:18:53,908][0m Trial 160 finished with value: 0.6497388600066993 and parameters: {'n_hidden': 2048, 'mixture_components': 3, 'use_sparse_layer': True, 'use_sparse_loss': False, 'use_batchnorm': False, 'use_dropout': False, 'mlp_size_1': 8, 'mlp_size_2': 0, 'mlp_size_3': 0, 'kernel': 'Gumbel', 'loss_name': 'NLLLoss'}. Best is trial 135 with value: 0.7009567952772325.[0m
[32m[I 2022-04-22 18:19:33,379][0m Trial 161 finished with value: 0.6780807150848771 and parameters: {'n_hidden': 1024, 'mixture_components': 6, 'use_sparse_layer': False, 'use_batchnorm': False, 'use_dropout': False, 'mlp_size_1': 7, 'mlp_size_2': 0, 'mlp_size_3': 0, 'kernel': 'Gumbel', 'loss_name': 'NLLLoss'}. Best is trial 135 with value: 0.7009567952772325.[0m
[32m[I 2022-04-22 18:20:16,449][0m Trial 162 finished with value: 0.6990221724587731 and parameters: {'n_hidden': 1024, 'mixture_components': 2, 'use_sparse_layer': False, 'use_batchnorm': False, 'use_dropout': False, 'mlp_size_1': 7, 'mlp_size_2': 0, 'mlp_size_3': 0, 'kernel': 'Gumbel', 'loss_name': 'NLLLoss'}. Best is trial 135 with value: 0.7009567952772325.[0m
[32m[I 2022-04-22 18:21:09,257][0m Trial 163 finished with value: 0.6802677787042082 and parameters: {'n_hidden': 1024, 'mixture_components': 3, 'use_sparse_layer': False, 'use_batchnorm': False, 'use_dropout': False, 'mlp_size_1': 7, 'mlp_size_2': 0, 'mlp_size_3': 0, 'kernel': 'Gumbel', 'loss_name': 'NLLLoss'}. Best is trial 135 with value: 0.7009567952772325.[0m
[32m[I 2022-04-22 18:21:52,822][0m Trial 164 finished with value: 0.7011621788753918 and parameters: {'n_hidden': 1024, 'mixture_components': 3, 'use_sparse_layer': False, 'use_batchnorm': False, 'use_dropout': False, 'mlp_size_1': 7, 'mlp_size_2': 0, 'mlp_size_3': 0, 'kernel': 'Gumbel', 'loss_name': 'NLLLoss'}. Best is trial 164 with value: 0.7011621788753918.[0m
[32m[I 2022-04-22 18:22:33,142][0m Trial 165 finished with value: 0.684878767608077 and parameters: {'n_hidden': 1024, 'mixture_components': 3, 'use_sparse_layer': False, 'use_batchnorm': False, 'use_dropout': False, 'mlp_size_1': 7, 'mlp_size_2': 0, 'mlp_size_3': 0, 'kernel': 'Gumbel', 'loss_name': 'NLLLoss'}. Best is trial 164 with value: 0.7011621788753918.[0m
[32m[I 2022-04-22 18:23:15,285][0m Trial 166 finished with value: 0.6748373713150226 and parameters: {'n_hidden': 1024, 'mixture_components': 3, 'use_sparse_layer': False, 'use_batchnorm': False, 'use_dropout': False, 'mlp_size_1': 7, 'mlp_size_2': 0, 'mlp_size_3': 0, 'kernel': 'Gumbel', 'loss_name': 'NLLLoss'}. Best is trial 164 with value: 0.7011621788753918.[0m
[32m[I 2022-04-22 18:24:10,556][0m Trial 167 finished with value: 0.6922172172696416 and parameters: {'n_hidden': 1024, 'mixture_components': 3, 'use_sparse_layer': False, 'use_batchnorm': False, 'use_dropout': False, 'mlp_size_1': 7, 'mlp_size_2': 0, 'mlp_size_3': 0, 'kernel': 'Gumbel', 'loss_name': 'NLLLoss'}. Best is trial 164 with value: 0.7011621788753918.[0m
[32m[I 2022-04-22 18:24:58,437][0m Trial 168 finished with value: 0.683437306708776 and parameters: {'n_hidden': 1024, 'mixture_components': 3, 'use_sparse_layer': False, 'use_batchnorm': False, 'use_dropout': False, 'mlp_size_1': 7, 'mlp_size_2': 0, 'mlp_size_3': 0, 'kernel': 'Gumbel', 'loss_name': 'NLLLoss'}. Best is trial 164 with value: 0.7011621788753918.[0m
[32m[I 2022-04-22 18:25:49,918][0m Trial 169 finished with value: 0.6708453901879514 and parameters: {'n_hidden': 1024, 'mixture_components': 2, 'use_sparse_layer': False, 'use_batchnorm': False, 'use_dropout': False, 'mlp_size_1': 7, 'mlp_size_2': 0, 'mlp_size_3': 0, 'kernel': 'Gumbel', 'loss_name': 'NLLLoss'}. Best is trial 164 with value: 0.7011621788753918.[0m
[32m[I 2022-04-22 18:27:01,779][0m Trial 170 finished with value: 0.6589624708854436 and parameters: {'n_hidden': 32, 'mixture_components': 3, 'use_sparse_layer': False, 'use_batchnorm': False, 'use_dropout': False, 'mlp_size_1': 2, 'mlp_size_2': 0, 'mlp_size_3': 0, 'kernel': 'Gumbel', 'loss_name': 'AlternativeNLLLoss'}. Best is trial 164 with value: 0.7011621788753918.[0m
[32m[I 2022-04-22 18:27:59,898][0m Trial 171 finished with value: 0.6792233966218313 and parameters: {'n_hidden': 1024, 'mixture_components': 3, 'use_sparse_layer': False, 'use_batchnorm': False, 'use_dropout': False, 'mlp_size_1': 7, 'mlp_size_2': 0, 'mlp_size_3': 0, 'kernel': 'Gumbel', 'loss_name': 'NLLLoss'}. Best is trial 164 with value: 0.7011621788753918.[0m
[32m[I 2022-04-22 18:28:38,750][0m Trial 172 finished with value: 0.6709771659820061 and parameters: {'n_hidden': 1024, 'mixture_components': 3, 'use_sparse_layer': False, 'use_batchnorm': False, 'use_dropout': False, 'mlp_size_1': 7, 'mlp_size_2': 0, 'mlp_size_3': 0, 'kernel': 'Gumbel', 'loss_name': 'NLLLoss'}. Best is trial 164 with value: 0.7011621788753918.[0m
[32m[I 2022-04-22 18:29:22,913][0m Trial 173 finished with value: 0.6811512787547247 and parameters: {'n_hidden': 1024, 'mixture_components': 3, 'use_sparse_layer': False, 'use_batchnorm': False, 'use_dropout': False, 'mlp_size_1': 7, 'mlp_size_2': 0, 'mlp_size_3': 0, 'kernel': 'Gumbel', 'loss_name': 'NLLLoss'}. Best is trial 164 with value: 0.7011621788753918.[0m
[32m[I 2022-04-22 18:30:32,803][0m Trial 174 finished with value: 0.6820376785723024 and parameters: {'n_hidden': 1024, 'mixture_components': 4, 'use_sparse_layer': False, 'use_batchnorm': False, 'use_dropout': False, 'mlp_size_1': 7, 'mlp_size_2': 0, 'mlp_size_3': 0, 'kernel': 'Gumbel', 'loss_name': 'NLLLoss'}. Best is trial 164 with value: 0.7011621788753918.[0m
[32m[I 2022-04-22 18:31:18,900][0m Trial 175 finished with value: 0.6882966651677953 and parameters: {'n_hidden': 1024, 'mixture_components': 2, 'use_sparse_layer': False, 'use_batchnorm': False, 'use_dropout': False, 'mlp_size_1': 7, 'mlp_size_2': 0, 'mlp_size_3': 0, 'kernel': 'Gumbel', 'loss_name': 'NLLLoss'}. Best is trial 164 with value: 0.7011621788753918.[0m
[32m[I 2022-04-22 18:32:06,101][0m Trial 176 finished with value: 0.6888297179673865 and parameters: {'n_hidden': 1024, 'mixture_components': 3, 'use_sparse_layer': False, 'use_batchnorm': False, 'use_dropout': False, 'mlp_size_1': 7, 'mlp_size_2': 0, 'mlp_size_3': 0, 'kernel': 'Gumbel', 'loss_name': 'NLLLoss'}. Best is trial 164 with value: 0.7011621788753918.[0m
[32m[I 2022-04-22 18:32:48,134][0m Trial 177 finished with value: 0.6820102259829868 and parameters: {'n_hidden': 256, 'mixture_components': 10, 'use_sparse_layer': False, 'use_batchnorm': False, 'use_dropout': True, 'dropout': 0.39261516844032385, 'mlp_size_1': 5, 'mlp_size_2': 0, 'mlp_size_3': 0, 'kernel': 'Logistic', 'loss_name': 'NLLLoss'}. Best is trial 164 with value: 0.7011621788753918.[0m
[32m[I 2022-04-22 18:33:34,497][0m Trial 178 finished with value: 0.6808676220802619 and parameters: {'n_hidden': 1024, 'mixture_components': 3, 'use_sparse_layer': False, 'use_batchnorm': False, 'use_dropout': False, 'mlp_size_1': 7, 'mlp_size_2': 0, 'mlp_size_3': 0, 'kernel': 'Gumbel', 'loss_name': 'NLLLoss'}. Best is trial 164 with value: 0.7011621788753918.[0m
[32m[I 2022-04-22 18:34:13,163][0m Trial 179 finished with value: 0.689569834028983 and parameters: {'n_hidden': 1024, 'mixture_components': 4, 'use_sparse_layer': True, 'use_sparse_loss': True, 'lmbd': 0.00021344295687716113, 'use_batchnorm': False, 'use_dropout': False, 'mlp_size_1': 7, 'mlp_size_2': 0, 'mlp_size_3': 0, 'kernel': 'LogLogistic', 'loss_name': 'NLLLoss'}. Best is trial 164 with value: 0.7011621788753918.[0m
[32m[I 2022-04-22 18:35:01,212][0m Trial 180 finished with value: 0.6886932222818845 and parameters: {'n_hidden': 512, 'mixture_components': 2, 'use_sparse_layer': False, 'use_batchnorm': False, 'use_dropout': False, 'mlp_size_1': 6, 'mlp_size_2': 0, 'mlp_size_3': 0, 'kernel': 'Gumbel', 'loss_name': 'NLLLoss'}. Best is trial 164 with value: 0.7011621788753918.[0m
[32m[I 2022-04-22 18:35:46,456][0m Trial 181 finished with value: 0.670166821203774 and parameters: {'n_hidden': 1024, 'mixture_components': 3, 'use_sparse_layer': False, 'use_batchnorm': False, 'use_dropout': False, 'mlp_size_1': 7, 'mlp_size_2': 0, 'mlp_size_3': 0, 'kernel': 'Exponential', 'loss_name': 'NLLLoss'}. Best is trial 164 with value: 0.7011621788753918.[0m
[32m[I 2022-04-22 18:36:37,183][0m Trial 182 finished with value: 0.6777597644134083 and parameters: {'n_hidden': 1024, 'mixture_components': 8, 'use_sparse_layer': False, 'use_batchnorm': False, 'use_dropout': False, 'mlp_size_1': 7, 'mlp_size_2': 0, 'mlp_size_3': 0, 'kernel': 'Normal', 'loss_name': 'NLLLoss'}. Best is trial 164 with value: 0.7011621788753918.[0m
[32m[I 2022-04-22 18:37:19,136][0m Trial 183 finished with value: 0.6917104519578663 and parameters: {'n_hidden': 1024, 'mixture_components': 3, 'use_sparse_layer': False, 'use_batchnorm': False, 'use_dropout': False, 'mlp_size_1': 7, 'mlp_size_2': 0, 'mlp_size_3': 0, 'kernel': 'Normal', 'loss_name': 'NLLLoss'}. Best is trial 164 with value: 0.7011621788753918.[0m
[32m[I 2022-04-22 18:37:57,695][0m Trial 184 finished with value: 0.6899510847177014 and parameters: {'n_hidden': 1024, 'mixture_components': 3, 'use_sparse_layer': False, 'use_batchnorm': False, 'use_dropout': False, 'mlp_size_1': 7, 'mlp_size_2': 0, 'mlp_size_3': 0, 'kernel': 'Gumbel', 'loss_name': 'NLLLoss'}. Best is trial 164 with value: 0.7011621788753918.[0m
[32m[I 2022-04-22 18:38:39,892][0m Trial 185 finished with value: 0.6813405050417781 and parameters: {'n_hidden': 1024, 'mixture_components': 3, 'use_sparse_layer': False, 'use_batchnorm': False, 'use_dropout': False, 'mlp_size_1': 7, 'mlp_size_2': 0, 'mlp_size_3': 0, 'kernel': 'Gumbel', 'loss_name': 'NLLLoss'}. Best is trial 164 with value: 0.7011621788753918.[0m
[32m[I 2022-04-22 18:39:30,832][0m Trial 186 finished with value: 0.6850627734539226 and parameters: {'n_hidden': 1024, 'mixture_components': 3, 'use_sparse_layer': False, 'use_batchnorm': False, 'use_dropout': False, 'mlp_size_1': 7, 'mlp_size_2': 0, 'mlp_size_3': 0, 'kernel': 'Gumbel', 'loss_name': 'NLLLoss'}. Best is trial 164 with value: 0.7011621788753918.[0m
[32m[I 2022-04-22 18:40:16,160][0m Trial 187 finished with value: 0.6866723909449916 and parameters: {'n_hidden': 1024, 'mixture_components': 3, 'use_sparse_layer': False, 'use_batchnorm': False, 'use_dropout': False, 'mlp_size_1': 6, 'mlp_size_2': 0, 'mlp_size_3': 1, 'kernel': 'Gumbel', 'loss_name': 'NLLLoss'}. Best is trial 164 with value: 0.7011621788753918.[0m
[32m[I 2022-04-22 18:41:08,050][0m Trial 188 finished with value: 0.6329769218858334 and parameters: {'n_hidden': 64, 'mixture_components': 3, 'use_sparse_layer': False, 'use_batchnorm': False, 'use_dropout': False, 'mlp_size_1': 3, 'mlp_size_2': 0, 'mlp_size_3': 0, 'kernel': 'Gumbel', 'loss_name': 'CensoredNLLLoss'}. Best is trial 164 with value: 0.7011621788753918.[0m
[32m[I 2022-04-22 18:42:46,298][0m Trial 189 finished with value: 0.5807828033458435 and parameters: {'n_hidden': 1024, 'mixture_components': 3, 'use_sparse_layer': False, 'use_batchnorm': True, 'use_dropout': False, 'mlp_size_1': 7, 'mlp_size_2': 0, 'mlp_size_3': 0, 'kernel': 'Logistic', 'loss_name': 'NLLLoss'}. Best is trial 164 with value: 0.7011621788753918.[0m
[32m[I 2022-04-22 18:43:29,248][0m Trial 190 finished with value: 0.6896424393261249 and parameters: {'n_hidden': 1024, 'mixture_components': 2, 'use_sparse_layer': False, 'use_batchnorm': False, 'use_dropout': False, 'mlp_size_1': 6, 'mlp_size_2': 0, 'mlp_size_3': 1, 'kernel': 'Gumbel', 'loss_name': 'NLLLoss'}. Best is trial 164 with value: 0.7011621788753918.[0m
[32m[I 2022-04-22 18:44:12,681][0m Trial 191 finished with value: 0.6743759006036718 and parameters: {'n_hidden': 1024, 'mixture_components': 3, 'use_sparse_layer': False, 'use_batchnorm': False, 'use_dropout': False, 'mlp_size_1': 7, 'mlp_size_2': 0, 'mlp_size_3': 0, 'kernel': 'Normal', 'loss_name': 'NLLLoss'}. Best is trial 164 with value: 0.7011621788753918.[0m
[32m[I 2022-04-22 18:45:00,155][0m Trial 192 finished with value: 0.6797519330518492 and parameters: {'n_hidden': 1024, 'mixture_components': 3, 'use_sparse_layer': False, 'use_batchnorm': False, 'use_dropout': False, 'mlp_size_1': 7, 'mlp_size_2': 0, 'mlp_size_3': 0, 'kernel': 'Normal', 'loss_name': 'NLLLoss'}. Best is trial 164 with value: 0.7011621788753918.[0m
[32m[I 2022-04-22 18:45:46,665][0m Trial 193 finished with value: 0.6733812606899582 and parameters: {'n_hidden': 1024, 'mixture_components': 3, 'use_sparse_layer': False, 'use_batchnorm': False, 'use_dropout': False, 'mlp_size_1': 7, 'mlp_size_2': 0, 'mlp_size_3': 0, 'kernel': 'Normal', 'loss_name': 'NLLLoss'}. Best is trial 164 with value: 0.7011621788753918.[0m
[32m[I 2022-04-22 18:47:22,097][0m Trial 194 finished with value: 0.6861596047417214 and parameters: {'n_hidden': 1024, 'mixture_components': 4, 'use_sparse_layer': False, 'use_batchnorm': False, 'use_dropout': False, 'mlp_size_1': 7, 'mlp_size_2': 0, 'mlp_size_3': 0, 'kernel': 'LogLogistic', 'loss_name': 'NLLLoss'}. Best is trial 164 with value: 0.7011621788753918.[0m
[32m[I 2022-04-22 18:48:03,992][0m Trial 195 finished with value: 0.6710644948352734 and parameters: {'n_hidden': 1024, 'mixture_components': 3, 'use_sparse_layer': False, 'use_batchnorm': False, 'use_dropout': False, 'mlp_size_1': 7, 'mlp_size_2': 0, 'mlp_size_3': 0, 'kernel': 'Normal', 'loss_name': 'NLLLoss'}. Best is trial 164 with value: 0.7011621788753918.[0m
[32m[I 2022-04-22 18:48:50,995][0m Trial 196 finished with value: 0.6335459841078916 and parameters: {'n_hidden': 128, 'mixture_components': 4, 'use_sparse_layer': False, 'use_batchnorm': False, 'use_dropout': False, 'mlp_size_1': 4, 'mlp_size_2': 0, 'mlp_size_3': 0, 'kernel': 'Normal', 'loss_name': 'NLLLoss'}. Best is trial 164 with value: 0.7011621788753918.[0m
[32m[I 2022-04-22 18:49:54,599][0m Trial 197 finished with value: 0.6929675183978177 and parameters: {'n_hidden': 1024, 'mixture_components': 1, 'use_sparse_layer': False, 'use_batchnorm': False, 'use_dropout': False, 'mlp_size_1': 7, 'mlp_size_2': 0, 'mlp_size_3': 0, 'kernel': 'Gumbel', 'loss_name': 'NLLLoss'}. Best is trial 164 with value: 0.7011621788753918.[0m
[32m[I 2022-04-22 18:50:41,635][0m Trial 198 finished with value: 0.6030226160371143 and parameters: {'n_hidden': 1024, 'mixture_components': 2, 'use_sparse_layer': True, 'use_sparse_loss': False, 'use_batchnorm': False, 'use_dropout': False, 'mlp_size_1': 6, 'mlp_size_2': 0, 'mlp_size_3': 1, 'kernel': 'Gumbel', 'loss_name': 'NLLLoss'}. Best is trial 164 with value: 0.7011621788753918.[0m
[32m[I 2022-04-22 18:51:25,030][0m Trial 199 finished with value: 0.688898351304662 and parameters: {'n_hidden': 1024, 'mixture_components': 1, 'use_sparse_layer': False, 'use_batchnorm': False, 'use_dropout': False, 'mlp_size_1': 7, 'mlp_size_2': 0, 'mlp_size_3': 0, 'kernel': 'Gumbel', 'loss_name': 'NLLLoss'}. Best is trial 164 with value: 0.7011621788753918.[0m
[32m[I 2022-04-22 18:52:05,247][0m Trial 200 finished with value: 0.6416510485589357 and parameters: {'n_hidden': 1024, 'mixture_components': 1, 'use_sparse_layer': False, 'use_batchnorm': False, 'use_dropout': False, 'mlp_size_1': 7, 'mlp_size_2': 0, 'mlp_size_3': 0, 'kernel': 'Gumbel', 'loss_name': 'NLLLoss'}. Best is trial 164 with value: 0.7011621788753918.[0m
[32m[I 2022-04-22 18:52:44,481][0m Trial 201 finished with value: 0.6859972235207874 and parameters: {'n_hidden': 1024, 'mixture_components': 1, 'use_sparse_layer': False, 'use_batchnorm': False, 'use_dropout': False, 'mlp_size_1': 7, 'mlp_size_2': 0, 'mlp_size_3': 0, 'kernel': 'Gumbel', 'loss_name': 'NLLLoss'}. Best is trial 164 with value: 0.7011621788753918.[0m
[32m[I 2022-04-22 18:53:20,061][0m Trial 202 finished with value: 0.6862619406515845 and parameters: {'n_hidden': 1024, 'mixture_components': 1, 'use_sparse_layer': False, 'use_batchnorm': False, 'use_dropout': False, 'mlp_size_1': 7, 'mlp_size_2': 0, 'mlp_size_3': 0, 'kernel': 'Normal', 'loss_name': 'NLLLoss'}. Best is trial 164 with value: 0.7011621788753918.[0m
[32m[I 2022-04-22 18:54:03,567][0m Trial 203 finished with value: 0.674679290286682 and parameters: {'n_hidden': 1024, 'mixture_components': 3, 'use_sparse_layer': False, 'use_batchnorm': False, 'use_dropout': False, 'mlp_size_1': 7, 'mlp_size_2': 0, 'mlp_size_3': 0, 'kernel': 'Gumbel', 'loss_name': 'NLLLoss'}. Best is trial 164 with value: 0.7011621788753918.[0m
[32m[I 2022-04-22 18:54:53,438][0m Trial 204 finished with value: 0.6855361096292021 and parameters: {'n_hidden': 2048, 'mixture_components': 1, 'use_sparse_layer': False, 'use_batchnorm': False, 'use_dropout': False, 'mlp_size_1': 8, 'mlp_size_2': 0, 'mlp_size_3': 0, 'kernel': 'Normal', 'loss_name': 'NLLLoss'}. Best is trial 164 with value: 0.7011621788753918.[0m
[32m[I 2022-04-22 18:55:39,244][0m Trial 205 finished with value: 0.6892225183841132 and parameters: {'n_hidden': 1024, 'mixture_components': 3, 'use_sparse_layer': False, 'use_batchnorm': False, 'use_dropout': False, 'mlp_size_1': 6, 'mlp_size_2': 0, 'mlp_size_3': 1, 'kernel': 'Logistic', 'loss_name': 'AlternativeNLLLoss'}. Best is trial 164 with value: 0.7011621788753918.[0m
[32m[I 2022-04-22 18:56:29,439][0m Trial 206 finished with value: 0.6840729272606246 and parameters: {'n_hidden': 512, 'mixture_components': 10, 'use_sparse_layer': False, 'use_batchnorm': False, 'use_dropout': False, 'mlp_size_1': 6, 'mlp_size_2': 0, 'mlp_size_3': 0, 'kernel': 'Normal', 'loss_name': 'NLLLoss'}. Best is trial 164 with value: 0.7011621788753918.[0m
[32m[I 2022-04-22 18:57:15,266][0m Trial 207 finished with value: 0.6884462851533559 and parameters: {'n_hidden': 1024, 'mixture_components': 2, 'use_sparse_layer': False, 'use_batchnorm': False, 'use_dropout': False, 'mlp_size_1': 7, 'mlp_size_2': 0, 'mlp_size_3': 0, 'kernel': 'Gumbel', 'loss_name': 'NLLLoss'}. Best is trial 164 with value: 0.7011621788753918.[0m
[32m[I 2022-04-22 18:57:56,959][0m Trial 208 finished with value: 0.664345048537562 and parameters: {'n_hidden': 1024, 'mixture_components': 3, 'use_sparse_layer': False, 'use_batchnorm': False, 'use_dropout': True, 'dropout': 0.6163674822456663, 'mlp_size_1': 7, 'mlp_size_2': 0, 'mlp_size_3': 0, 'kernel': 'Normal', 'loss_name': 'NLLLoss'}. Best is trial 164 with value: 0.7011621788753918.[0m
[32m[I 2022-04-22 18:58:42,967][0m Trial 209 finished with value: 0.6884705583901589 and parameters: {'n_hidden': 1024, 'mixture_components': 9, 'use_sparse_layer': False, 'use_batchnorm': False, 'use_dropout': False, 'mlp_size_1': 7, 'mlp_size_2': 0, 'mlp_size_3': 0, 'kernel': 'LogLogistic', 'loss_name': 'NLLLoss'}. Best is trial 164 with value: 0.7011621788753918.[0m
[32m[I 2022-04-22 18:59:25,707][0m Trial 210 finished with value: 0.6864364734261906 and parameters: {'n_hidden': 1024, 'mixture_components': 2, 'use_sparse_layer': False, 'use_batchnorm': False, 'use_dropout': False, 'mlp_size_1': 6, 'mlp_size_2': 0, 'mlp_size_3': 1, 'kernel': 'Gumbel', 'loss_name': 'NLLLoss'}. Best is trial 164 with value: 0.7011621788753918.[0m
[32m[I 2022-04-22 19:00:31,818][0m Trial 211 finished with value: 0.6644541032450946 and parameters: {'n_hidden': 1024, 'mixture_components': 3, 'use_sparse_layer': False, 'use_batchnorm': False, 'use_dropout': False, 'mlp_size_1': 7, 'mlp_size_2': 0, 'mlp_size_3': 0, 'kernel': 'Normal', 'loss_name': 'NLLLoss'}. Best is trial 164 with value: 0.7011621788753918.[0m
[32m[I 2022-04-22 19:01:33,139][0m Trial 212 finished with value: 0.6789961700914637 and parameters: {'n_hidden': 1024, 'mixture_components': 3, 'use_sparse_layer': False, 'use_batchnorm': False, 'use_dropout': False, 'mlp_size_1': 7, 'mlp_size_2': 0, 'mlp_size_3': 0, 'kernel': 'Normal', 'loss_name': 'NLLLoss'}. Best is trial 164 with value: 0.7011621788753918.[0m
[32m[I 2022-04-22 19:02:20,710][0m Trial 213 finished with value: 0.6910563720899253 and parameters: {'n_hidden': 1024, 'mixture_components': 5, 'use_sparse_layer': False, 'use_batchnorm': False, 'use_dropout': False, 'mlp_size_1': 7, 'mlp_size_2': 0, 'mlp_size_3': 0, 'kernel': 'Normal', 'loss_name': 'NLLLoss'}. Best is trial 164 with value: 0.7011621788753918.[0m
[32m[I 2022-04-22 19:02:56,704][0m Trial 214 finished with value: 0.6775067006616372 and parameters: {'n_hidden': 1024, 'mixture_components': 5, 'use_sparse_layer': False, 'use_batchnorm': False, 'use_dropout': False, 'mlp_size_1': 0, 'mlp_size_2': 1, 'mlp_size_3': 2, 'kernel': 'Normal', 'loss_name': 'NLLLoss'}. Best is trial 164 with value: 0.7011621788753918.[0m
[32m[I 2022-04-22 19:03:39,279][0m Trial 215 finished with value: 0.6899690801618444 and parameters: {'n_hidden': 1024, 'mixture_components': 5, 'use_sparse_layer': False, 'use_batchnorm': False, 'use_dropout': False, 'mlp_size_1': 7, 'mlp_size_2': 0, 'mlp_size_3': 0, 'kernel': 'Normal', 'loss_name': 'NLLLoss'}. Best is trial 164 with value: 0.7011621788753918.[0m
[32m[I 2022-04-22 19:04:40,341][0m Trial 216 finished with value: 0.6769494652534647 and parameters: {'n_hidden': 32, 'mixture_components': 5, 'use_sparse_layer': False, 'use_batchnorm': False, 'use_dropout': False, 'mlp_size_1': 2, 'mlp_size_2': 0, 'mlp_size_3': 0, 'kernel': 'Normal', 'loss_name': 'NLLLoss'}. Best is trial 164 with value: 0.7011621788753918.[0m
