[32m[I 2022-04-24 00:47:22,847][0m Trial 882 finished with value: 0.6565816299143775 and parameters: {'n_hidden': 2048, 'mixture_components': 2, 'use_sparse_layer': False, 'use_batchnorm': False, 'use_dropout': True, 'dropout': 0.13067910571809338, 'mlp_size_1': 6, 'mlp_size_2': 2, 'mlp_size_3': 0, 'kernel': 'LogLogistic', 'loss_name': 'CensoredNLLLoss'}. Best is trial 551 with value: 0.6925048594105658.[0m
[32m[I 2022-04-24 00:48:20,068][0m Trial 883 finished with value: 0.6668978193248977 and parameters: {'n_hidden': 1024, 'mixture_components': 2, 'use_sparse_layer': False, 'use_batchnorm': False, 'use_dropout': True, 'dropout': 0.19302282925116812, 'mlp_size_1': 6, 'mlp_size_2': 1, 'mlp_size_3': 0, 'kernel': 'LogLogistic', 'loss_name': 'AlternativeNLLLoss'}. Best is trial 551 with value: 0.6925048594105658.[0m
[32m[I 2022-04-24 00:49:30,119][0m Trial 884 finished with value: 0.6705045081999991 and parameters: {'n_hidden': 2048, 'mixture_components': 1, 'use_sparse_layer': False, 'use_batchnorm': False, 'use_dropout': True, 'dropout': 0.23803568873918704, 'mlp_size_1': 1, 'mlp_size_2': 4, 'mlp_size_3': 2, 'kernel': 'LogLogistic', 'loss_name': 'CensoredNLLLoss'}. Best is trial 551 with value: 0.6925048594105658.[0m
[32m[I 2022-04-24 00:50:47,639][0m Trial 885 finished with value: 0.6728533004690261 and parameters: {'n_hidden': 2048, 'mixture_components': 7, 'use_sparse_layer': False, 'use_batchnorm': False, 'use_dropout': True, 'dropout': 0.15482291585871957, 'mlp_size_1': 6, 'mlp_size_2': 2, 'mlp_size_3': 0, 'kernel': 'LogLogistic', 'loss_name': 'CensoredNLLLoss'}. Best is trial 551 with value: 0.6925048594105658.[0m
[32m[I 2022-04-24 00:51:39,680][0m Trial 886 finished with value: 0.6493466867382484 and parameters: {'n_hidden': 512, 'mixture_components': 2, 'use_sparse_layer': False, 'use_batchnorm': False, 'use_dropout': True, 'dropout': 0.07418609229096906, 'mlp_size_1': 3, 'mlp_size_2': 3, 'mlp_size_3': 0, 'kernel': 'LogLogistic', 'loss_name': 'AlternativeNLLLoss'}. Best is trial 551 with value: 0.6925048594105658.[0m
[32m[I 2022-04-24 00:52:37,230][0m Trial 887 finished with value: -0.6649771014299559 and parameters: {'n_hidden': 2048, 'mixture_components': 3, 'use_sparse_layer': False, 'use_batchnorm': False, 'use_dropout': True, 'dropout': 0.11013674688142802, 'mlp_size_1': 3, 'mlp_size_2': 3, 'mlp_size_3': 2, 'kernel': 'Exponential', 'loss_name': 'CensoredNLLLoss'}. Best is trial 551 with value: 0.6925048594105658.[0m
[32m[I 2022-04-24 00:54:12,092][0m Trial 888 finished with value: 0.6676037277344702 and parameters: {'n_hidden': 2048, 'mixture_components': 2, 'use_sparse_layer': False, 'use_batchnorm': False, 'use_dropout': True, 'dropout': 0.21815773493174373, 'mlp_size_1': 6, 'mlp_size_2': 2, 'mlp_size_3': 0, 'kernel': 'LogLogistic', 'loss_name': 'CensoredNLLLoss'}. Best is trial 551 with value: 0.6925048594105658.[0m
[32m[I 2022-04-24 00:55:29,233][0m Trial 889 finished with value: 0.671880368485016 and parameters: {'n_hidden': 2048, 'mixture_components': 2, 'use_sparse_layer': False, 'use_batchnorm': False, 'use_dropout': True, 'dropout': 0.25576033950181265, 'mlp_size_1': 3, 'mlp_size_2': 3, 'mlp_size_3': 2, 'kernel': 'LogLogistic', 'loss_name': 'AlternativeNLLLoss'}. Best is trial 551 with value: 0.6925048594105658.[0m
[32m[I 2022-04-24 00:56:49,432][0m Trial 890 finished with value: 0.6565178407100787 and parameters: {'n_hidden': 2048, 'mixture_components': 2, 'use_sparse_layer': False, 'use_batchnorm': False, 'use_dropout': True, 'dropout': 0.19991177746046107, 'mlp_size_1': 7, 'mlp_size_2': 1, 'mlp_size_3': 0, 'kernel': 'LogLogistic', 'loss_name': 'CensoredNLLLoss'}. Best is trial 551 with value: 0.6925048594105658.[0m
[32m[I 2022-04-24 00:57:44,871][0m Trial 891 finished with value: 0.6585786545721435 and parameters: {'n_hidden': 512, 'mixture_components': 3, 'use_sparse_layer': False, 'use_batchnorm': False, 'use_dropout': True, 'dropout': 0.08938863202184448, 'mlp_size_1': 3, 'mlp_size_2': 3, 'mlp_size_3': 0, 'kernel': 'LogLogistic', 'loss_name': 'CensoredNLLLoss'}. Best is trial 551 with value: 0.6925048594105658.[0m
[32m[I 2022-04-24 00:59:05,166][0m Trial 892 finished with value: 0.6336552353496989 and parameters: {'n_hidden': 2048, 'mixture_components': 1, 'use_sparse_layer': False, 'use_batchnorm': False, 'use_dropout': True, 'dropout': 0.24959928856800673, 'mlp_size_1': 8, 'mlp_size_2': 0, 'mlp_size_3': 0, 'kernel': 'LogLogistic', 'loss_name': 'AlternativeNLLLoss'}. Best is trial 551 with value: 0.6925048594105658.[0m
[32m[I 2022-04-24 01:00:17,452][0m Trial 893 finished with value: 0.6805053398741487 and parameters: {'n_hidden': 2048, 'mixture_components': 2, 'use_sparse_layer': False, 'use_batchnorm': False, 'use_dropout': True, 'dropout': 0.29796110667445447, 'mlp_size_1': 3, 'mlp_size_2': 3, 'mlp_size_3': 2, 'kernel': 'LogLogistic', 'loss_name': 'CensoredNLLLoss'}. Best is trial 551 with value: 0.6925048594105658.[0m
[32m[I 2022-04-24 01:01:30,258][0m Trial 894 finished with value: 0.6797683620314523 and parameters: {'n_hidden': 2048, 'mixture_components': 2, 'use_sparse_layer': False, 'use_batchnorm': False, 'use_dropout': True, 'dropout': 0.1723366646041059, 'mlp_size_1': 3, 'mlp_size_2': 3, 'mlp_size_3': 2, 'kernel': 'LogLogistic', 'loss_name': 'CensoredNLLLoss'}. Best is trial 551 with value: 0.6925048594105658.[0m
[32m[I 2022-04-24 01:04:55,807][0m Trial 895 finished with value: 0.6589796383477896 and parameters: {'n_hidden': 2048, 'mixture_components': 2, 'use_sparse_layer': False, 'use_batchnorm': True, 'use_dropout': True, 'dropout': 0.270831404789991, 'mlp_size_1': 2, 'mlp_size_2': 3, 'mlp_size_3': 2, 'kernel': 'LogLogistic', 'loss_name': 'CensoredNLLLoss'}. Best is trial 551 with value: 0.6925048594105658.[0m
[32m[I 2022-04-24 01:05:51,977][0m Trial 896 finished with value: 0.660146475407605 and parameters: {'n_hidden': 1024, 'mixture_components': 3, 'use_sparse_layer': False, 'use_batchnorm': False, 'use_dropout': False, 'mlp_size_1': 3, 'mlp_size_2': 3, 'mlp_size_3': 1, 'kernel': 'LogLogistic', 'loss_name': 'AlternativeNLLLoss'}. Best is trial 551 with value: 0.6925048594105658.[0m
[32m[I 2022-04-24 01:07:03,014][0m Trial 897 finished with value: 0.6314542126009576 and parameters: {'n_hidden': 32, 'mixture_components': 2, 'use_sparse_layer': False, 'use_batchnorm': False, 'use_dropout': True, 'dropout': 0.13099890579404194, 'mlp_size_1': 2, 'mlp_size_2': 0, 'mlp_size_3': 0, 'kernel': 'Logistic', 'loss_name': 'CensoredNLLLoss'}. Best is trial 551 with value: 0.6925048594105658.[0m
[32m[I 2022-04-24 01:07:57,964][0m Trial 898 finished with value: 0.6661676674439868 and parameters: {'n_hidden': 512, 'mixture_components': 4, 'use_sparse_layer': False, 'use_batchnorm': False, 'use_dropout': True, 'dropout': 0.22403660831667566, 'mlp_size_1': 3, 'mlp_size_2': 3, 'mlp_size_3': 0, 'kernel': 'LogLogistic', 'loss_name': 'CensoredNLLLoss'}. Best is trial 551 with value: 0.6925048594105658.[0m
[32m[I 2022-04-24 01:08:54,543][0m Trial 899 finished with value: 0.6505043228170946 and parameters: {'n_hidden': 64, 'mixture_components': 2, 'use_sparse_layer': False, 'use_batchnorm': False, 'use_dropout': True, 'dropout': 0.28507886823535666, 'mlp_size_1': 3, 'mlp_size_2': 0, 'mlp_size_3': 0, 'kernel': 'LogLogistic', 'loss_name': 'AlternativeNLLLoss'}. Best is trial 551 with value: 0.6925048594105658.[0m
[32m[I 2022-04-24 01:10:05,715][0m Trial 900 finished with value: 0.667168160960651 and parameters: {'n_hidden': 2048, 'mixture_components': 2, 'use_sparse_layer': False, 'use_batchnorm': False, 'use_dropout': True, 'dropout': 0.10941095700656366, 'mlp_size_1': 3, 'mlp_size_2': 3, 'mlp_size_3': 2, 'kernel': 'LogLogistic', 'loss_name': 'CensoredNLLLoss'}. Best is trial 551 with value: 0.6925048594105658.[0m
[32m[I 2022-04-24 01:11:22,131][0m Trial 901 finished with value: 0.6793280462903927 and parameters: {'n_hidden': 2048, 'mixture_components': 3, 'use_sparse_layer': False, 'use_batchnorm': False, 'use_dropout': True, 'dropout': 0.24046988946346262, 'mlp_size_1': 3, 'mlp_size_2': 3, 'mlp_size_3': 2, 'kernel': 'LogLogistic', 'loss_name': 'CensoredNLLLoss'}. Best is trial 551 with value: 0.6925048594105658.[0m
[32m[I 2022-04-24 01:12:44,029][0m Trial 902 finished with value: 0.6698995345529505 and parameters: {'n_hidden': 2048, 'mixture_components': 2, 'use_sparse_layer': False, 'use_batchnorm': False, 'use_dropout': True, 'dropout': 0.19308503014691383, 'mlp_size_1': 3, 'mlp_size_2': 3, 'mlp_size_3': 2, 'kernel': 'LogLogistic', 'loss_name': 'AlternativeNLLLoss'}. Best is trial 551 with value: 0.6925048594105658.[0m
[32m[I 2022-04-24 01:13:59,900][0m Trial 903 finished with value: 0.6672419488706808 and parameters: {'n_hidden': 2048, 'mixture_components': 2, 'use_sparse_layer': False, 'use_batchnorm': False, 'use_dropout': True, 'dropout': 0.33813212867168063, 'mlp_size_1': 4, 'mlp_size_2': 3, 'mlp_size_3': 1, 'kernel': 'LogLogistic', 'loss_name': 'CensoredNLLLoss'}. Best is trial 551 with value: 0.6925048594105658.[0m
[32m[I 2022-04-24 01:15:00,349][0m Trial 904 finished with value: 0.6734677559093439 and parameters: {'n_hidden': 512, 'mixture_components': 2, 'use_sparse_layer': False, 'use_batchnorm': False, 'use_dropout': True, 'dropout': 0.3686883021975397, 'mlp_size_1': 3, 'mlp_size_2': 3, 'mlp_size_3': 0, 'kernel': 'LogLogistic', 'loss_name': 'CensoredNLLLoss'}. Best is trial 551 with value: 0.6925048594105658.[0m
[32m[I 2022-04-24 01:15:53,648][0m Trial 905 finished with value: 0.6589541717727208 and parameters: {'n_hidden': 128, 'mixture_components': 2, 'use_sparse_layer': False, 'use_batchnorm': False, 'use_dropout': True, 'dropout': 0.07159729354922956, 'mlp_size_1': 3, 'mlp_size_2': 1, 'mlp_size_3': 0, 'kernel': 'LogLogistic', 'loss_name': 'AlternativeNLLLoss'}. Best is trial 551 with value: 0.6925048594105658.[0m
[32m[I 2022-04-24 01:16:51,039][0m Trial 906 finished with value: -0.6640698179750723 and parameters: {'n_hidden': 2048, 'mixture_components': 3, 'use_sparse_layer': False, 'use_batchnorm': False, 'use_dropout': True, 'dropout': 0.14858300170491517, 'mlp_size_1': 7, 'mlp_size_2': 1, 'mlp_size_3': 0, 'kernel': 'Exponential', 'loss_name': 'CensoredNLLLoss'}. Best is trial 551 with value: 0.6925048594105658.[0m
[32m[I 2022-04-24 01:18:11,025][0m Trial 907 finished with value: 0.6687489263280603 and parameters: {'n_hidden': 2048, 'mixture_components': 1, 'use_sparse_layer': False, 'use_batchnorm': False, 'use_dropout': True, 'dropout': 0.26194247404118953, 'mlp_size_1': 6, 'mlp_size_2': 2, 'mlp_size_3': 0, 'kernel': 'LogLogistic', 'loss_name': 'CensoredNLLLoss'}. Best is trial 551 with value: 0.6925048594105658.[0m
[32m[I 2022-04-24 01:19:27,055][0m Trial 908 finished with value: 0.6744904452118523 and parameters: {'n_hidden': 2048, 'mixture_components': 6, 'use_sparse_layer': False, 'use_batchnorm': False, 'use_dropout': True, 'dropout': 0.2133705565749456, 'mlp_size_1': 4, 'mlp_size_2': 3, 'mlp_size_3': 1, 'kernel': 'LogLogistic', 'loss_name': 'AlternativeNLLLoss'}. Best is trial 551 with value: 0.6925048594105658.[0m
[32m[I 2022-04-24 01:20:52,250][0m Trial 909 finished with value: 0.6893688106393387 and parameters: {'n_hidden': 2048, 'mixture_components': 2, 'use_sparse_layer': False, 'use_batchnorm': False, 'use_dropout': True, 'dropout': 0.23147512765098954, 'mlp_size_1': 3, 'mlp_size_2': 3, 'mlp_size_3': 2, 'kernel': 'LogLogistic', 'loss_name': 'CensoredNLLLoss'}. Best is trial 551 with value: 0.6925048594105658.[0m
[32m[I 2022-04-24 01:21:42,206][0m Trial 910 finished with value: 0.6657280051869313 and parameters: {'n_hidden': 512, 'mixture_components': 2, 'use_sparse_layer': False, 'use_batchnorm': False, 'use_dropout': True, 'dropout': 0.3164070256630484, 'mlp_size_1': 3, 'mlp_size_2': 3, 'mlp_size_3': 0, 'kernel': 'LogLogistic', 'loss_name': 'CensoredNLLLoss'}. Best is trial 551 with value: 0.6925048594105658.[0m
[32m[I 2022-04-24 01:23:04,255][0m Trial 911 finished with value: 0.6811080862754849 and parameters: {'n_hidden': 2048, 'mixture_components': 7, 'use_sparse_layer': False, 'use_batchnorm': False, 'use_dropout': True, 'dropout': 0.28411010983894164, 'mlp_size_1': 3, 'mlp_size_2': 3, 'mlp_size_3': 2, 'kernel': 'LogLogistic', 'loss_name': 'AlternativeNLLLoss'}. Best is trial 551 with value: 0.6925048594105658.[0m
[32m[I 2022-04-24 01:24:17,670][0m Trial 912 finished with value: 0.678003006073536 and parameters: {'n_hidden': 2048, 'mixture_components': 2, 'use_sparse_layer': False, 'use_batchnorm': False, 'use_dropout': True, 'dropout': 0.2538854993240852, 'mlp_size_1': 3, 'mlp_size_2': 3, 'mlp_size_3': 2, 'kernel': 'LogLogistic', 'loss_name': 'CensoredNLLLoss'}. Best is trial 551 with value: 0.6925048594105658.[0m
[32m[I 2022-04-24 01:26:58,499][0m Trial 913 finished with value: 0.6488036653892044 and parameters: {'n_hidden': 1024, 'mixture_components': 4, 'use_sparse_layer': False, 'use_batchnorm': True, 'use_dropout': True, 'dropout': 0.2489068599035042, 'mlp_size_1': 3, 'mlp_size_2': 3, 'mlp_size_3': 1, 'kernel': 'LogLogistic', 'loss_name': 'CensoredNLLLoss'}. Best is trial 551 with value: 0.6925048594105658.[0m
[32m[I 2022-04-24 01:28:17,006][0m Trial 914 finished with value: 0.67418564340717 and parameters: {'n_hidden': 2048, 'mixture_components': 3, 'use_sparse_layer': False, 'use_batchnorm': False, 'use_dropout': True, 'dropout': 0.11922445906088612, 'mlp_size_1': 3, 'mlp_size_2': 3, 'mlp_size_3': 2, 'kernel': 'LogLogistic', 'loss_name': 'CensoredNLLLoss'}. Best is trial 551 with value: 0.6925048594105658.[0m
[32m[I 2022-04-24 01:29:28,745][0m Trial 915 finished with value: 0.672651029795259 and parameters: {'n_hidden': 2048, 'mixture_components': 2, 'use_sparse_layer': False, 'use_batchnorm': False, 'use_dropout': True, 'dropout': 0.09931664680296065, 'mlp_size_1': 3, 'mlp_size_2': 3, 'mlp_size_3': 2, 'kernel': 'LogLogistic', 'loss_name': 'AlternativeNLLLoss'}. Best is trial 551 with value: 0.6925048594105658.[0m
[32m[I 2022-04-24 01:30:12,342][0m Trial 916 finished with value: 0.6204946355844155 and parameters: {'n_hidden': 512, 'mixture_components': 2, 'use_sparse_layer': False, 'use_batchnorm': False, 'use_dropout': False, 'mlp_size_1': 3, 'mlp_size_2': 3, 'mlp_size_3': 0, 'kernel': 'LogLogistic', 'loss_name': 'CensoredNLLLoss'}. Best is trial 551 with value: 0.6925048594105658.[0m
[32m[I 2022-04-24 01:31:49,042][0m Trial 917 finished with value: 0.6673474305972547 and parameters: {'n_hidden': 2048, 'mixture_components': 2, 'use_sparse_layer': False, 'use_batchnorm': False, 'use_dropout': True, 'dropout': 0.2669304483652152, 'mlp_size_1': 3, 'mlp_size_2': 3, 'mlp_size_3': 2, 'kernel': 'LogLogistic', 'loss_name': 'CensoredNLLLoss'}. Best is trial 551 with value: 0.6925048594105658.[0m
[32m[I 2022-04-24 01:33:08,225][0m Trial 918 finished with value: 0.66527885363619 and parameters: {'n_hidden': 2048, 'mixture_components': 3, 'use_sparse_layer': False, 'use_batchnorm': False, 'use_dropout': True, 'dropout': 0.23211849279509777, 'mlp_size_1': 3, 'mlp_size_2': 3, 'mlp_size_3': 2, 'kernel': 'LogLogistic', 'loss_name': 'AlternativeNLLLoss'}. Best is trial 551 with value: 0.6925048594105658.[0m
[32m[I 2022-04-24 01:34:21,529][0m Trial 919 finished with value: 0.6853723051539925 and parameters: {'n_hidden': 2048, 'mixture_components': 1, 'use_sparse_layer': False, 'use_batchnorm': False, 'use_dropout': True, 'dropout': 0.17045582947138893, 'mlp_size_1': 3, 'mlp_size_2': 3, 'mlp_size_3': 2, 'kernel': 'LogLogistic', 'loss_name': 'CensoredNLLLoss'}. Best is trial 551 with value: 0.6925048594105658.[0m
[32m[I 2022-04-24 01:35:36,634][0m Trial 920 finished with value: 0.6785456571824996 and parameters: {'n_hidden': 2048, 'mixture_components': 1, 'use_sparse_layer': False, 'use_batchnorm': False, 'use_dropout': True, 'dropout': 0.14577707360156333, 'mlp_size_1': 3, 'mlp_size_2': 3, 'mlp_size_3': 2, 'kernel': 'LogLogistic', 'loss_name': 'CensoredNLLLoss'}. Best is trial 551 with value: 0.6925048594105658.[0m
[32m[I 2022-04-24 01:36:52,742][0m Trial 921 finished with value: 0.672482204191376 and parameters: {'n_hidden': 2048, 'mixture_components': 1, 'use_sparse_layer': False, 'use_batchnorm': False, 'use_dropout': True, 'dropout': 0.16707444054850104, 'mlp_size_1': 3, 'mlp_size_2': 3, 'mlp_size_3': 2, 'kernel': 'LogLogistic', 'loss_name': 'AlternativeNLLLoss'}. Best is trial 551 with value: 0.6925048594105658.[0m
[32m[I 2022-04-24 01:38:05,604][0m Trial 922 finished with value: 0.6708860216478705 and parameters: {'n_hidden': 2048, 'mixture_components': 1, 'use_sparse_layer': False, 'use_batchnorm': False, 'use_dropout': True, 'dropout': 0.1281391964044222, 'mlp_size_1': 3, 'mlp_size_2': 3, 'mlp_size_3': 2, 'kernel': 'LogLogistic', 'loss_name': 'CensoredNLLLoss'}. Best is trial 551 with value: 0.6925048594105658.[0m
[32m[I 2022-04-24 01:39:15,895][0m Trial 923 finished with value: 0.6581979526181956 and parameters: {'n_hidden': 2048, 'mixture_components': 1, 'use_sparse_layer': False, 'use_batchnorm': False, 'use_dropout': True, 'dropout': 0.09070561352642167, 'mlp_size_1': 3, 'mlp_size_2': 3, 'mlp_size_3': 2, 'kernel': 'LogLogistic', 'loss_name': 'CensoredNLLLoss'}. Best is trial 551 with value: 0.6925048594105658.[0m
[32m[I 2022-04-24 01:40:37,045][0m Trial 924 finished with value: 0.6654205792327261 and parameters: {'n_hidden': 2048, 'mixture_components': 2, 'use_sparse_layer': False, 'use_batchnorm': False, 'use_dropout': True, 'dropout': 0.3028070108748425, 'mlp_size_1': 3, 'mlp_size_2': 3, 'mlp_size_3': 2, 'kernel': 'LogLogistic', 'loss_name': 'CensoredNLLLoss'}. Best is trial 551 with value: 0.6925048594105658.[0m
[32m[I 2022-04-24 01:41:55,014][0m Trial 925 finished with value: 0.6731396935324316 and parameters: {'n_hidden': 2048, 'mixture_components': 1, 'use_sparse_layer': False, 'use_batchnorm': False, 'use_dropout': True, 'dropout': 0.287967744509694, 'mlp_size_1': 3, 'mlp_size_2': 3, 'mlp_size_3': 2, 'kernel': 'LogLogistic', 'loss_name': 'AlternativeNLLLoss'}. Best is trial 551 with value: 0.6925048594105658.[0m
[32m[I 2022-04-24 01:43:14,931][0m Trial 926 finished with value: 0.6762458224139583 and parameters: {'n_hidden': 2048, 'mixture_components': 1, 'use_sparse_layer': False, 'use_batchnorm': False, 'use_dropout': True, 'dropout': 0.20815374154191418, 'mlp_size_1': 3, 'mlp_size_2': 3, 'mlp_size_3': 2, 'kernel': 'LogLogistic', 'loss_name': 'CensoredNLLLoss'}. Best is trial 551 with value: 0.6925048594105658.[0m
[32m[I 2022-04-24 01:44:35,811][0m Trial 927 finished with value: 0.6603773432723796 and parameters: {'n_hidden': 2048, 'mixture_components': 1, 'use_sparse_layer': False, 'use_batchnorm': False, 'use_dropout': True, 'dropout': 0.1818341868585341, 'mlp_size_1': 3, 'mlp_size_2': 3, 'mlp_size_3': 2, 'kernel': 'LogLogistic', 'loss_name': 'CensoredNLLLoss'}. Best is trial 551 with value: 0.6925048594105658.[0m
[32m[I 2022-04-24 01:45:48,461][0m Trial 928 finished with value: 0.669047882342314 and parameters: {'n_hidden': 2048, 'mixture_components': 1, 'use_sparse_layer': False, 'use_batchnorm': False, 'use_dropout': True, 'dropout': 0.14926764770945417, 'mlp_size_1': 3, 'mlp_size_2': 3, 'mlp_size_3': 2, 'kernel': 'LogLogistic', 'loss_name': 'AlternativeNLLLoss'}. Best is trial 551 with value: 0.6925048594105658.[0m
[32m[I 2022-04-24 01:46:59,220][0m Trial 929 finished with value: 0.6756155629878029 and parameters: {'n_hidden': 2048, 'mixture_components': 1, 'use_sparse_layer': False, 'use_batchnorm': False, 'use_dropout': True, 'dropout': 0.07704571728751727, 'mlp_size_1': 3, 'mlp_size_2': 3, 'mlp_size_3': 2, 'kernel': 'LogLogistic', 'loss_name': 'CensoredNLLLoss'}. Best is trial 551 with value: 0.6925048594105658.[0m
[32m[I 2022-04-24 01:48:18,204][0m Trial 930 finished with value: 0.6699210748795037 and parameters: {'n_hidden': 2048, 'mixture_components': 1, 'use_sparse_layer': False, 'use_batchnorm': False, 'use_dropout': True, 'dropout': 0.40136970200074124, 'mlp_size_1': 3, 'mlp_size_2': 3, 'mlp_size_3': 2, 'kernel': 'LogLogistic', 'loss_name': 'CensoredNLLLoss'}. Best is trial 551 with value: 0.6925048594105658.[0m
[32m[I 2022-04-24 01:49:28,328][0m Trial 931 finished with value: 0.6811155304146168 and parameters: {'n_hidden': 2048, 'mixture_components': 1, 'use_sparse_layer': False, 'use_batchnorm': False, 'use_dropout': True, 'dropout': 0.2663108487823202, 'mlp_size_1': 3, 'mlp_size_2': 3, 'mlp_size_3': 2, 'kernel': 'LogLogistic', 'loss_name': 'AlternativeNLLLoss'}. Best is trial 551 with value: 0.6925048594105658.[0m
[32m[I 2022-04-24 01:50:36,332][0m Trial 932 finished with value: 0.6677511664909697 and parameters: {'n_hidden': 2048, 'mixture_components': 1, 'use_sparse_layer': False, 'use_batchnorm': False, 'use_dropout': True, 'dropout': 0.12065522491240366, 'mlp_size_1': 3, 'mlp_size_2': 3, 'mlp_size_3': 2, 'kernel': 'LogLogistic', 'loss_name': 'CensoredNLLLoss'}. Best is trial 551 with value: 0.6925048594105658.[0m
[32m[I 2022-04-24 01:53:04,775][0m Trial 933 finished with value: 0.5997582441712271 and parameters: {'n_hidden': 2048, 'mixture_components': 1, 'use_sparse_layer': True, 'use_sparse_loss': False, 'use_batchnorm': True, 'use_dropout': True, 'dropout': 0.24362711270374282, 'mlp_size_1': 3, 'mlp_size_2': 3, 'mlp_size_3': 2, 'kernel': 'LogLogistic', 'loss_name': 'CensoredNLLLoss'}. Best is trial 551 with value: 0.6925048594105658.[0m
[32m[I 2022-04-24 01:54:20,189][0m Trial 934 finished with value: 0.6772728804147595 and parameters: {'n_hidden': 2048, 'mixture_components': 2, 'use_sparse_layer': False, 'use_batchnorm': False, 'use_dropout': True, 'dropout': 0.2320007916400777, 'mlp_size_1': 2, 'mlp_size_2': 3, 'mlp_size_3': 3, 'kernel': 'LogLogistic', 'loss_name': 'AlternativeNLLLoss'}. Best is trial 551 with value: 0.6925048594105658.[0m
