[32m[I 2022-04-21 11:39:04,412][0m Trial 945 finished with value: 0.8318450474400789 and parameters: {'splitter': 'best', 'min_samples_split': 0.30719419258912134, 'min_samples_leaf': 0.017535801311453582, 'min_weight_fraction_leaf': 0.19274430776496074, 'max_features': 0.6620433624719844}. Best is trial 499 with value: 0.8396174698878165.[0m
[32m[I 2022-04-21 11:39:04,563][0m Trial 946 finished with value: 0.65 and parameters: {'splitter': 'best', 'min_samples_split': 0.296053128498808, 'min_samples_leaf': 0.3621272481654613, 'min_weight_fraction_leaf': 0.032700970451010655, 'max_features': 0.8249834407701977}. Best is trial 499 with value: 0.8396174698878165.[0m
[32m[I 2022-04-21 11:39:04,818][0m Trial 947 finished with value: 0.8355801993971674 and parameters: {'splitter': 'best', 'min_samples_split': 0.28354348363876375, 'min_samples_leaf': 0.007488844458013959, 'min_weight_fraction_leaf': 0.055617748606953586, 'max_features': 0.7964614629933278}. Best is trial 499 with value: 0.8396174698878165.[0m
[32m[I 2022-04-21 11:39:05,027][0m Trial 948 finished with value: 0.8342213889050052 and parameters: {'splitter': 'best', 'min_samples_split': 0.27079871701431346, 'min_samples_leaf': 0.03459523272332374, 'min_weight_fraction_leaf': 0.06204348992646032, 'max_features': 0.723308208696942}. Best is trial 499 with value: 0.8396174698878165.[0m
[32m[I 2022-04-21 11:39:05,266][0m Trial 949 finished with value: 0.8394676524280678 and parameters: {'splitter': 'best', 'min_samples_split': 0.27757469759443965, 'min_samples_leaf': 0.0010434407759832853, 'min_weight_fraction_leaf': 0.04220993779160306, 'max_features': 0.6966247261293426}. Best is trial 499 with value: 0.8396174698878165.[0m
[32m[I 2022-04-21 11:39:05,525][0m Trial 950 finished with value: 0.8348703389712995 and parameters: {'splitter': 'best', 'min_samples_split': 0.2908491878029322, 'min_samples_leaf': 0.019284254210503206, 'min_weight_fraction_leaf': 0.04479216184368815, 'max_features': 0.6860201138093783}. Best is trial 499 with value: 0.8396174698878165.[0m
[32m[I 2022-04-21 11:39:05,867][0m Trial 951 finished with value: 0.8317800212049976 and parameters: {'splitter': 'best', 'min_samples_split': 0.3190470826456978, 'min_samples_leaf': 0.00815465955490282, 'min_weight_fraction_leaf': 0.032385640367336634, 'max_features': 0.6971708190744877}. Best is trial 499 with value: 0.8396174698878165.[0m
[32m[I 2022-04-21 11:39:06,152][0m Trial 952 finished with value: 0.8330787034261397 and parameters: {'splitter': 'best', 'min_samples_split': 0.3037215608819708, 'min_samples_leaf': 0.024733288044627103, 'min_weight_fraction_leaf': 0.04989984667357553, 'max_features': 0.6704438135992046}. Best is trial 499 with value: 0.8396174698878165.[0m
[32m[I 2022-04-21 11:39:06,231][0m Trial 953 finished with value: 0.8342711778095314 and parameters: {'splitter': 'best', 'min_samples_split': 0.27892865339886475, 'min_samples_leaf': 0.0012184476779910063, 'min_weight_fraction_leaf': 0.04111049612941806, 'max_features': 0.7025812233638031}. Best is trial 499 with value: 0.8396174698878165.[0m
[32m[I 2022-04-21 11:39:06,314][0m Trial 954 finished with value: 0.8318869790887286 and parameters: {'splitter': 'best', 'min_samples_split': 0.2825408985375945, 'min_samples_leaf': 0.01625457993779761, 'min_weight_fraction_leaf': 0.08255930713191176, 'max_features': 0.6614898161560313}. Best is trial 499 with value: 0.8396174698878165.[0m
[32m[I 2022-04-21 11:39:06,403][0m Trial 955 finished with value: 0.8327613710981948 and parameters: {'splitter': 'best', 'min_samples_split': 0.2922513413439271, 'min_samples_leaf': 0.034499153260602815, 'min_weight_fraction_leaf': 0.059720904080514815, 'max_features': 0.6913205494681425}. Best is trial 499 with value: 0.8396174698878165.[0m
[32m[I 2022-04-21 11:39:06,489][0m Trial 956 finished with value: 0.8334107142154489 and parameters: {'splitter': 'random', 'min_samples_split': 0.2619993164342101, 'min_samples_leaf': 0.0010795985598404181, 'min_weight_fraction_leaf': 0.06884428221224026, 'max_features': 0.7124092505150099}. Best is trial 499 with value: 0.8396174698878165.[0m
[32m[I 2022-04-21 11:39:06,559][0m Trial 957 finished with value: 0.8396174698878165 and parameters: {'splitter': 'best', 'min_samples_split': 0.27547491667998214, 'min_samples_leaf': 0.025578080160000283, 'min_weight_fraction_leaf': 0.05025798992071069, 'max_features': 0.6795958109442766}. Best is trial 499 with value: 0.8396174698878165.[0m
[32m[I 2022-04-21 11:39:06,615][0m Trial 958 finished with value: 0.8322570148675416 and parameters: {'splitter': 'best', 'min_samples_split': 0.30108740950879515, 'min_samples_leaf': 0.036676064440947814, 'min_weight_fraction_leaf': 0.05595337091919429, 'max_features': 0.701626980925881}. Best is trial 499 with value: 0.8396174698878165.[0m
[32m[I 2022-04-21 11:39:06,669][0m Trial 959 finished with value: 0.8328255155375228 and parameters: {'splitter': 'best', 'min_samples_split': 0.27057164048304505, 'min_samples_leaf': 0.0348287313441189, 'min_weight_fraction_leaf': 0.06828644602035358, 'max_features': 0.6592752187518578}. Best is trial 499 with value: 0.8396174698878165.[0m
[32m[I 2022-04-21 11:39:06,747][0m Trial 960 finished with value: 0.8375392239614191 and parameters: {'splitter': 'best', 'min_samples_split': 0.25655511290811844, 'min_samples_leaf': 0.026200407199637343, 'min_weight_fraction_leaf': 0.05242947976100776, 'max_features': 0.6748910538476967}. Best is trial 499 with value: 0.8396174698878165.[0m
[32m[I 2022-04-21 11:39:06,820][0m Trial 961 finished with value: 0.8318869790887286 and parameters: {'splitter': 'best', 'min_samples_split': 0.28218304525907856, 'min_samples_leaf': 0.027804032004323152, 'min_weight_fraction_leaf': 0.08056520657435154, 'max_features': 0.685955560403537}. Best is trial 499 with value: 0.8396174698878165.[0m
[32m[I 2022-04-21 11:39:06,889][0m Trial 962 finished with value: 0.833502860951816 and parameters: {'splitter': 'best', 'min_samples_split': 0.25011804401599114, 'min_samples_leaf': 0.03832613838914411, 'min_weight_fraction_leaf': 0.062038860519920684, 'max_features': 0.6608577212845473}. Best is trial 499 with value: 0.8396174698878165.[0m
[32m[I 2022-04-21 11:39:06,960][0m Trial 963 finished with value: 0.8367316552865305 and parameters: {'splitter': 'best', 'min_samples_split': 0.2860208098583082, 'min_samples_leaf': 0.010825430649171896, 'min_weight_fraction_leaf': 0.030880362815720992, 'max_features': 0.7235626476930795}. Best is trial 499 with value: 0.8396174698878165.[0m
[32m[I 2022-04-21 11:39:07,034][0m Trial 964 finished with value: 0.8394676524280678 and parameters: {'splitter': 'best', 'min_samples_split': 0.27167762597576106, 'min_samples_leaf': 0.026678320567008924, 'min_weight_fraction_leaf': 0.04253792755943346, 'max_features': 0.6795725889272325}. Best is trial 499 with value: 0.8396174698878165.[0m
[32m[I 2022-04-21 11:39:07,110][0m Trial 965 finished with value: 0.8342213889050052 and parameters: {'splitter': 'best', 'min_samples_split': 0.26331528661336995, 'min_samples_leaf': 0.02341038054038378, 'min_weight_fraction_leaf': 0.05654523116854057, 'max_features': 0.7170425182436002}. Best is trial 499 with value: 0.8396174698878165.[0m
[32m[I 2022-04-21 11:39:07,188][0m Trial 966 finished with value: 0.8313466605567467 and parameters: {'splitter': 'best', 'min_samples_split': 0.292878771429489, 'min_samples_leaf': 0.012830615882862422, 'min_weight_fraction_leaf': 0.03613238138871355, 'max_features': 0.6571092917507455}. Best is trial 499 with value: 0.8396174698878165.[0m
[32m[I 2022-04-21 11:39:07,250][0m Trial 967 finished with value: 0.8386460587152798 and parameters: {'splitter': 'best', 'min_samples_split': 0.24013593767762292, 'min_samples_leaf': 0.01053714577700812, 'min_weight_fraction_leaf': 0.046733761129384634, 'max_features': 0.6789897830192502}. Best is trial 499 with value: 0.8396174698878165.[0m
[32m[I 2022-04-21 11:39:07,305][0m Trial 968 finished with value: 0.8337666169009493 and parameters: {'splitter': 'best', 'min_samples_split': 0.27910009754876514, 'min_samples_leaf': 0.0015791196532939766, 'min_weight_fraction_leaf': 0.0715726176415262, 'max_features': 0.6746917313103545}. Best is trial 499 with value: 0.8396174698878165.[0m
[32m[I 2022-04-21 11:39:07,401][0m Trial 969 finished with value: 0.8394667449470219 and parameters: {'splitter': 'best', 'min_samples_split': 0.2673214900630721, 'min_samples_leaf': 0.03766840025485908, 'min_weight_fraction_leaf': 0.04208229404045942, 'max_features': 0.6623868620371332}. Best is trial 499 with value: 0.8396174698878165.[0m
[32m[I 2022-04-21 11:39:07,490][0m Trial 970 finished with value: 0.65 and parameters: {'splitter': 'best', 'min_samples_split': 0.25016527875801337, 'min_samples_leaf': 0.023527151205561266, 'min_weight_fraction_leaf': 0.4030570527560199, 'max_features': 0.6832742396951978}. Best is trial 499 with value: 0.8396174698878165.[0m
[32m[I 2022-04-21 11:39:07,588][0m Trial 971 finished with value: 0.8377936034458976 and parameters: {'splitter': 'best', 'min_samples_split': 0.27280901313374123, 'min_samples_leaf': 0.019384526492655353, 'min_weight_fraction_leaf': 0.03258522317870072, 'max_features': 0.7408164159878987}. Best is trial 499 with value: 0.8396174698878165.[0m
[32m[I 2022-04-21 11:39:07,669][0m Trial 972 finished with value: 0.8335033648020842 and parameters: {'splitter': 'best', 'min_samples_split': 0.28799317411840025, 'min_samples_leaf': 0.03570744157387007, 'min_weight_fraction_leaf': 0.030844138915278575, 'max_features': 0.6954994333195568}. Best is trial 499 with value: 0.8396174698878165.[0m
[32m[I 2022-04-21 11:39:07,747][0m Trial 973 finished with value: 0.8382577519146084 and parameters: {'splitter': 'best', 'min_samples_split': 0.2591098336834699, 'min_samples_leaf': 0.03738086762770748, 'min_weight_fraction_leaf': 0.052611602741482605, 'max_features': 0.6504837051717572}. Best is trial 499 with value: 0.8396174698878165.[0m
[32m[I 2022-04-21 11:39:07,825][0m Trial 974 finished with value: 0.8315096896509999 and parameters: {'splitter': 'best', 'min_samples_split': 0.31326265748330795, 'min_samples_leaf': 0.001493796190627188, 'min_weight_fraction_leaf': 0.04062929987976627, 'max_features': 0.6977012395967769}. Best is trial 499 with value: 0.8396174698878165.[0m
[32m[I 2022-04-21 11:39:07,905][0m Trial 975 finished with value: 0.8337699781920435 and parameters: {'splitter': 'random', 'min_samples_split': 0.3011937314239568, 'min_samples_leaf': 0.014337605505502928, 'min_weight_fraction_leaf': 0.062277057529173466, 'max_features': 0.668573703005876}. Best is trial 499 with value: 0.8396174698878165.[0m
[32m[I 2022-04-21 11:39:07,976][0m Trial 976 finished with value: 0.8374994682939777 and parameters: {'splitter': 'best', 'min_samples_split': 0.2783619200090061, 'min_samples_leaf': 0.028614097167130294, 'min_weight_fraction_leaf': 0.02865623622461958, 'max_features': 0.7311347086991788}. Best is trial 499 with value: 0.8396174698878165.[0m
[32m[I 2022-04-21 11:39:08,053][0m Trial 977 finished with value: 0.8356453536097854 and parameters: {'splitter': 'best', 'min_samples_split': 0.28895696019196865, 'min_samples_leaf': 0.01409142651129326, 'min_weight_fraction_leaf': 0.05129122064850438, 'max_features': 0.7035547850073711}. Best is trial 499 with value: 0.8396174698878165.[0m
[32m[I 2022-04-21 11:39:08,167][0m Trial 978 finished with value: 0.8394667449470219 and parameters: {'splitter': 'best', 'min_samples_split': 0.2641752086256444, 'min_samples_leaf': 0.027516318058760397, 'min_weight_fraction_leaf': 0.04689824623866286, 'max_features': 0.7201044295906102}. Best is trial 499 with value: 0.8396174698878165.[0m
[32m[I 2022-04-21 11:39:08,256][0m Trial 979 finished with value: 0.8316149506675705 and parameters: {'splitter': 'best', 'min_samples_split': 0.2702503403137696, 'min_samples_leaf': 0.03929459809733452, 'min_weight_fraction_leaf': 0.09385508133316892, 'max_features': 0.7127943893873417}. Best is trial 499 with value: 0.8396174698878165.[0m
[32m[I 2022-04-21 11:39:08,315][0m Trial 980 finished with value: 0.8355801993971674 and parameters: {'splitter': 'best', 'min_samples_split': 0.2811592791451181, 'min_samples_leaf': 0.020292216483540893, 'min_weight_fraction_leaf': 0.06176893359135057, 'max_features': 0.7570233405354316}. Best is trial 499 with value: 0.8396174698878165.[0m
[32m[I 2022-04-21 11:39:08,433][0m Trial 981 finished with value: 0.8337666169009493 and parameters: {'splitter': 'best', 'min_samples_split': 0.24741948021379354, 'min_samples_leaf': 0.027708602472833403, 'min_weight_fraction_leaf': 0.07592202231628715, 'max_features': 0.7409883809652622}. Best is trial 499 with value: 0.8396174698878165.[0m
[32m[I 2022-04-21 11:39:08,507][0m Trial 982 finished with value: 0.65 and parameters: {'splitter': 'best', 'min_samples_split': 0.25877340319722275, 'min_samples_leaf': 0.4912236411366714, 'min_weight_fraction_leaf': 0.05247880732220232, 'max_features': 0.6837753922808498}. Best is trial 499 with value: 0.8396174698878165.[0m
[32m[I 2022-04-21 11:39:08,569][0m Trial 983 finished with value: 0.8385374292394825 and parameters: {'splitter': 'best', 'min_samples_split': 0.27276002080253164, 'min_samples_leaf': 0.001407089646963386, 'min_weight_fraction_leaf': 0.03619277093926007, 'max_features': 0.6547789782721136}. Best is trial 499 with value: 0.8396174698878165.[0m
[32m[I 2022-04-21 11:39:08,662][0m Trial 984 finished with value: 0.8318450474400789 and parameters: {'splitter': 'best', 'min_samples_split': 0.297415581644124, 'min_samples_leaf': 0.18623947432225815, 'min_weight_fraction_leaf': 0.06837392731747433, 'max_features': 0.7383591613266423}. Best is trial 499 with value: 0.8396174698878165.[0m
[32m[I 2022-04-21 11:39:08,880][0m Trial 985 finished with value: 0.8356453536097854 and parameters: {'splitter': 'best', 'min_samples_split': 0.28561459932680944, 'min_samples_leaf': 0.010382460409657537, 'min_weight_fraction_leaf': 0.0553641703230818, 'max_features': 0.693742026816692}. Best is trial 499 with value: 0.8396174698878165.[0m
[32m[I 2022-04-21 11:39:09,032][0m Trial 986 finished with value: 0.8394676524280678 and parameters: {'splitter': 'best', 'min_samples_split': 0.27571363029090096, 'min_samples_leaf': 0.021450689522258662, 'min_weight_fraction_leaf': 0.04761532642623867, 'max_features': 0.7189453036662233}. Best is trial 499 with value: 0.8396174698878165.[0m
[32m[I 2022-04-21 11:39:09,179][0m Trial 987 finished with value: 0.8340187950162761 and parameters: {'splitter': 'best', 'min_samples_split': 0.29249589416696553, 'min_samples_leaf': 0.019185052461152857, 'min_weight_fraction_leaf': 0.06327710384605206, 'max_features': 0.714297663140505}. Best is trial 499 with value: 0.8396174698878165.[0m
[32m[I 2022-04-21 11:39:09,399][0m Trial 988 finished with value: 0.8318450474400789 and parameters: {'splitter': 'best', 'min_samples_split': 0.27890527170279467, 'min_samples_leaf': 0.03703075557635908, 'min_weight_fraction_leaf': 0.3048936471265652, 'max_features': 0.7666324365738056}. Best is trial 499 with value: 0.8396174698878165.[0m
[32m[I 2022-04-21 11:39:09,593][0m Trial 989 finished with value: 0.8318450474400789 and parameters: {'splitter': 'best', 'min_samples_split': 0.2655332164041244, 'min_samples_leaf': 0.11632228611352263, 'min_weight_fraction_leaf': 0.14050023442239584, 'max_features': 0.7442821725399081}. Best is trial 499 with value: 0.8396174698878165.[0m
[32m[I 2022-04-21 11:39:09,815][0m Trial 990 finished with value: 0.8211043863124367 and parameters: {'splitter': 'best', 'min_samples_split': 0.4628777966854194, 'min_samples_leaf': 0.029558711996774296, 'min_weight_fraction_leaf': 0.04121900478244862, 'max_features': 0.4969248313857688}. Best is trial 499 with value: 0.8396174698878165.[0m
[32m[I 2022-04-21 11:39:10,015][0m Trial 991 finished with value: 0.832166576566759 and parameters: {'splitter': 'best', 'min_samples_split': 0.28136151018126637, 'min_samples_leaf': 0.017223787600880447, 'min_weight_fraction_leaf': 0.026551097606822945, 'max_features': 0.7065304430758}. Best is trial 499 with value: 0.8396174698878165.[0m
[32m[I 2022-04-21 11:39:10,206][0m Trial 992 finished with value: 0.8123359030993946 and parameters: {'splitter': 'best', 'min_samples_split': 0.2984927698617777, 'min_samples_leaf': 0.018075678250737737, 'min_weight_fraction_leaf': 0.0514252549570538, 'max_features': 0.0017751062836376952}. Best is trial 499 with value: 0.8396174698878165.[0m
[32m[I 2022-04-21 11:39:10,456][0m Trial 993 finished with value: 0.8318869790887286 and parameters: {'splitter': 'best', 'min_samples_split': 0.2501192138885568, 'min_samples_leaf': 0.030457525997508658, 'min_weight_fraction_leaf': 0.08103539807105234, 'max_features': 0.7282260670435635}. Best is trial 499 with value: 0.8396174698878165.[0m
[32m[I 2022-04-21 11:39:11,175][0m Trial 994 finished with value: 0.8337699781920435 and parameters: {'splitter': 'random', 'min_samples_split': 0.26103292743116274, 'min_samples_leaf': 0.04116085827211335, 'min_weight_fraction_leaf': 0.039671946094860966, 'max_features': 0.7219783439416512}. Best is trial 499 with value: 0.8396174698878165.[0m
[32m[I 2022-04-21 11:39:11,300][0m Trial 995 finished with value: 0.8367316552865305 and parameters: {'splitter': 'best', 'min_samples_split': 0.28710623661494533, 'min_samples_leaf': 0.00939086863243482, 'min_weight_fraction_leaf': 0.029807766232342717, 'max_features': 0.7708280919241348}. Best is trial 499 with value: 0.8396174698878165.[0m
[32m[I 2022-04-21 11:39:11,461][0m Trial 996 finished with value: 0.8355801993971674 and parameters: {'splitter': 'best', 'min_samples_split': 0.27516104714162326, 'min_samples_leaf': 0.012006741041858832, 'min_weight_fraction_leaf': 0.061480403586605836, 'max_features': 0.6774715114112649}. Best is trial 499 with value: 0.8396174698878165.[0m
[32m[I 2022-04-21 11:39:11,632][0m Trial 997 finished with value: 0.8394667449470219 and parameters: {'splitter': 'best', 'min_samples_split': 0.2700419382007181, 'min_samples_leaf': 0.018773076335191034, 'min_weight_fraction_leaf': 0.045624239333976524, 'max_features': 0.7522441645808309}. Best is trial 499 with value: 0.8396174698878165.[0m
[32m[I 2022-04-21 11:39:11,857][0m Trial 998 finished with value: 0.8374613873228913 and parameters: {'splitter': 'best', 'min_samples_split': 0.2568335178187054, 'min_samples_leaf': 0.0302938938261728, 'min_weight_fraction_leaf': 0.03976921343187479, 'max_features': 0.6929664841623601}. Best is trial 499 with value: 0.8396174698878165.[0m
[32m[I 2022-04-21 11:39:12,051][0m Trial 999 finished with value: 0.833502860951816 and parameters: {'splitter': 'best', 'min_samples_split': 0.2397789368392545, 'min_samples_leaf': 0.04011205617561982, 'min_weight_fraction_leaf': 0.05762774528474441, 'max_features': 0.6784869011481032}. Best is trial 499 with value: 0.8396174698878165.[0m
[32m[I 2022-04-21 11:39:12,058][0m A new study created in memory with name: no-name-4abf42d4-8a34-4c7a-8854-5b8f3c145cd2[0m
[32m[I 2022-04-21 11:39:12,109][0m Trial 0 finished with value: 0.5 and parameters: {'splitter': 'random', 'min_samples_split': 0.3548176300759761, 'min_samples_leaf': 0.22178210161098627, 'min_weight_fraction_leaf': 0.30960505166679186, 'max_features': 0.06035563344994099}. Best is trial 0 with value: 0.5.[0m
[32m[I 2022-04-21 11:39:12,152][0m Trial 1 finished with value: 0.5 and parameters: {'splitter': 'best', 'min_samples_split': 0.21237869085491015, 'min_samples_leaf': 0.3345187963010706, 'min_weight_fraction_leaf': 0.21772157189137664, 'max_features': 0.28852980786682725}. Best is trial 0 with value: 0.5.[0m
[32m[I 2022-04-21 11:39:12,204][0m Trial 2 finished with value: 0.5459256471788827 and parameters: {'splitter': 'random', 'min_samples_split': 0.4634034402971694, 'min_samples_leaf': 0.14011337845011268, 'min_weight_fraction_leaf': 0.15468473744558342, 'max_features': 0.4174939994111815}. Best is trial 2 with value: 0.5459256471788827.[0m
[32m[I 2022-04-21 11:39:12,252][0m Trial 3 finished with value: 0.6136073090060808 and parameters: {'splitter': 'random', 'min_samples_split': 0.007184306155584376, 'min_samples_leaf': 0.007492261452815385, 'min_weight_fraction_leaf': 0.15202824418439453, 'max_features': 0.6050271145001537}. Best is trial 3 with value: 0.6136073090060808.[0m
[32m[I 2022-04-21 11:39:12,331][0m Trial 4 finished with value: 0.5 and parameters: {'splitter': 'random', 'min_samples_split': 0.13494036023537545, 'min_samples_leaf': 0.4219461101861142, 'min_weight_fraction_leaf': 0.22303668410773136, 'max_features': 0.31518348728244894}. Best is trial 3 with value: 0.6136073090060808.[0m
[32m[I 2022-04-21 11:39:12,407][0m Trial 5 finished with value: 0.6738476114655684 and parameters: {'splitter': 'random', 'min_samples_split': 0.12883414969221754, 'min_samples_leaf': 0.02179423948264031, 'min_weight_fraction_leaf': 0.19301547842873767, 'max_features': 0.9828824383591866}. Best is trial 5 with value: 0.6738476114655684.[0m
[32m[I 2022-04-21 11:39:12,452][0m Trial 6 finished with value: 0.5 and parameters: {'splitter': 'random', 'min_samples_split': 0.2653112882324809, 'min_samples_leaf': 0.21006736870430068, 'min_weight_fraction_leaf': 0.3637056355084846, 'max_features': 0.42737156581538505}. Best is trial 5 with value: 0.6738476114655684.[0m
[32m[I 2022-04-21 11:39:12,483][0m Trial 7 finished with value: 0.5 and parameters: {'splitter': 'best', 'min_samples_split': 0.3403947187302073, 'min_samples_leaf': 0.3017463542341145, 'min_weight_fraction_leaf': 0.24533847132811476, 'max_features': 0.10572407251758076}. Best is trial 5 with value: 0.6738476114655684.[0m
