[32m[I 2022-04-21 20:22:55,839][0m Trial 773 finished with value: 0.8365204461634207 and parameters: {'loss': 'coxph', 'learning_rate': 0.00038455102606756587, 'n_estimators': 322, 'criterion': 'friedman_mse', 'min_samples_split': 3, 'min_samples_leaf': 1, 'min_weight_fraction_leaf': 0.1223189102139745, 'min_impurity_decrease': 0.11093342861914583, 'max_features': 0.3507509667927599, 'subsample': 0.08035804625528759, 'dropout_rate': 0.0673942446419524, 'ccp_alpha': 0.3647664958934164}. Best is trial 583 with value: 0.8480221917497749.[0m
[32m[I 2022-04-21 20:23:12,169][0m Trial 774 finished with value: 0.65 and parameters: {'loss': 'coxph', 'learning_rate': 0.03033951591130884, 'n_estimators': 345, 'criterion': 'absolute_error', 'min_samples_split': 3, 'min_samples_leaf': 1, 'min_weight_fraction_leaf': 0.12975295803715464, 'min_impurity_decrease': 0.999471614690723, 'max_features': 0.2767800829039739, 'subsample': 0.33008411950659255, 'dropout_rate': 0.5512295499426195, 'ccp_alpha': 0.1807738186798812}. Best is trial 583 with value: 0.8480221917497749.[0m
[32m[I 2022-04-21 20:23:42,455][0m Trial 775 finished with value: 0.846355949428976 and parameters: {'loss': 'coxph', 'learning_rate': 0.00030977144484599465, 'n_estimators': 293, 'criterion': 'friedman_mse', 'min_samples_split': 2, 'min_samples_leaf': 1, 'min_weight_fraction_leaf': 0.1420166665421215, 'min_impurity_decrease': 0.5121774176452687, 'max_features': 0.3235870929239128, 'subsample': 0.055423203460435895, 'dropout_rate': 0.09954518589613699, 'ccp_alpha': 0.09550216486049604}. Best is trial 583 with value: 0.8480221917497749.[0m
[32m[I 2022-04-21 20:24:10,117][0m Trial 776 finished with value: 0.8417749254658136 and parameters: {'loss': 'coxph', 'learning_rate': 0.00047444370688501456, 'n_estimators': 313, 'criterion': 'friedman_mse', 'min_samples_split': 2, 'min_samples_leaf': 1, 'min_weight_fraction_leaf': 0.1434364310249267, 'min_impurity_decrease': 0.46708236663791436, 'max_features': 0.34475244794296306, 'subsample': 0.05353271278710217, 'dropout_rate': 0.10810365304390712, 'ccp_alpha': 0.2966123119079564}. Best is trial 583 with value: 0.8480221917497749.[0m
[32m[I 2022-04-21 20:24:32,008][0m Trial 777 finished with value: 0.8374939261816369 and parameters: {'loss': 'coxph', 'learning_rate': 0.0003327915328807603, 'n_estimators': 296, 'criterion': 'friedman_mse', 'min_samples_split': 2, 'min_samples_leaf': 1, 'min_weight_fraction_leaf': 0.08297014395016761, 'min_impurity_decrease': 0.2105976379058519, 'max_features': 0.3250902522295241, 'subsample': 0.04556671860159264, 'dropout_rate': 0.0939797416094851, 'ccp_alpha': 0.6005314753092779}. Best is trial 583 with value: 0.8480221917497749.[0m
[32m[I 2022-04-21 20:24:50,441][0m Trial 778 finished with value: 0.8358025298013324 and parameters: {'loss': 'coxph', 'learning_rate': 0.0004427540820085167, 'n_estimators': 285, 'criterion': 'friedman_mse', 'min_samples_split': 2, 'min_samples_leaf': 1, 'min_weight_fraction_leaf': 0.15059930057685822, 'min_impurity_decrease': 0.18384448407072657, 'max_features': 0.34683888765593346, 'subsample': 0.059119933459332, 'dropout_rate': 0.11928413093462456, 'ccp_alpha': 0.44966126043705734}. Best is trial 583 with value: 0.8480221917497749.[0m
[32m[I 2022-04-21 20:25:10,777][0m Trial 779 finished with value: 0.8439245307533477 and parameters: {'loss': 'coxph', 'learning_rate': 0.0003214789608398488, 'n_estimators': 294, 'criterion': 'friedman_mse', 'min_samples_split': 2, 'min_samples_leaf': 1, 'min_weight_fraction_leaf': 0.15176288044412858, 'min_impurity_decrease': 0.19005524458204767, 'max_features': 0.33265200167026854, 'subsample': 0.034106138800955685, 'dropout_rate': 0.10376518376514161, 'ccp_alpha': 0.21982941625847283}. Best is trial 583 with value: 0.8480221917497749.[0m
[32m[I 2022-04-21 20:25:34,363][0m Trial 780 finished with value: 0.8382106094555646 and parameters: {'loss': 'coxph', 'learning_rate': 0.00021468687270131213, 'n_estimators': 298, 'criterion': 'friedman_mse', 'min_samples_split': 2, 'min_samples_leaf': 1, 'min_weight_fraction_leaf': 0.14322191550610103, 'min_impurity_decrease': 0.45441382326412183, 'max_features': 0.31311242737786366, 'subsample': 0.06984522747534015, 'dropout_rate': 0.09861855524546828, 'ccp_alpha': 0.3326920050645323}. Best is trial 583 with value: 0.8480221917497749.[0m
[32m[I 2022-04-21 20:26:01,733][0m Trial 781 finished with value: 0.735271805336587 and parameters: {'loss': 'coxph', 'learning_rate': 0.00028669107706345273, 'n_estimators': 296, 'criterion': 'friedman_mse', 'min_samples_split': 2, 'min_samples_leaf': 1, 'min_weight_fraction_leaf': 0.15298047022034716, 'min_impurity_decrease': 0.20271217225074584, 'max_features': 0.34982704802407993, 'subsample': 0.5822032737651789, 'dropout_rate': 0.11693616042654688, 'ccp_alpha': 0.15907295665229132}. Best is trial 583 with value: 0.8480221917497749.[0m
[32m[I 2022-04-21 20:26:29,344][0m Trial 782 finished with value: 0.8463049204011422 and parameters: {'loss': 'coxph', 'learning_rate': 0.0004357754376607302, 'n_estimators': 308, 'criterion': 'friedman_mse', 'min_samples_split': 2, 'min_samples_leaf': 1, 'min_weight_fraction_leaf': 0.13959917357414514, 'min_impurity_decrease': 0.20263926367067603, 'max_features': 0.3282021887346288, 'subsample': 0.0519866196374042, 'dropout_rate': 0.07945999469768557, 'ccp_alpha': 0.09129357545789765}. Best is trial 583 with value: 0.8480221917497749.[0m
[32m[I 2022-04-21 20:27:00,936][0m Trial 783 finished with value: 0.8452080614241902 and parameters: {'loss': 'coxph', 'learning_rate': 0.00015592300336705978, 'n_estimators': 357, 'criterion': 'friedman_mse', 'min_samples_split': 2, 'min_samples_leaf': 1, 'min_weight_fraction_leaf': 0.15368093249123777, 'min_impurity_decrease': 0.16842969901415827, 'max_features': 0.30217519085891703, 'subsample': 0.023032529811993364, 'dropout_rate': 0.1354588582850657, 'ccp_alpha': 0.0016206048702973415}. Best is trial 583 with value: 0.8480221917497749.[0m
[32m[I 2022-04-21 20:27:32,301][0m Trial 784 finished with value: 0.8419696453468809 and parameters: {'loss': 'coxph', 'learning_rate': 0.00035525059270117356, 'n_estimators': 320, 'criterion': 'friedman_mse', 'min_samples_split': 2, 'min_samples_leaf': 1, 'min_weight_fraction_leaf': 0.13760618316411913, 'min_impurity_decrease': 0.17251193501720508, 'max_features': 0.34701005272911756, 'subsample': 0.08039333592631648, 'dropout_rate': 0.10304158677756847, 'ccp_alpha': 0.24449849353940378}. Best is trial 583 with value: 0.8480221917497749.[0m
[32m[I 2022-04-21 20:28:05,472][0m Trial 785 finished with value: 0.8460939339925384 and parameters: {'loss': 'coxph', 'learning_rate': 0.00021156454179143525, 'n_estimators': 372, 'criterion': 'friedman_mse', 'min_samples_split': 5, 'min_samples_leaf': 1, 'min_weight_fraction_leaf': 0.14685593698142269, 'min_impurity_decrease': 0.4782852501250534, 'max_features': 0.31924964406895084, 'subsample': 0.06319313376432967, 'dropout_rate': 0.12077536224899799, 'ccp_alpha': 0.0016159003220882519}. Best is trial 583 with value: 0.8480221917497749.[0m
[32m[I 2022-04-21 20:28:11,026][0m Trial 786 finished with value: 0.8468286426741656 and parameters: {'loss': 'coxph', 'learning_rate': 0.00013866006918786632, 'n_estimators': 292, 'criterion': 'friedman_mse', 'min_samples_split': 2, 'min_samples_leaf': 1, 'min_weight_fraction_leaf': 0.12586723581659798, 'min_impurity_decrease': 0.21559667405936708, 'max_features': 0.35193384729231825, 'subsample': 0.038495575561668875, 'dropout_rate': 0.7938595920676057, 'ccp_alpha': 0.16588953822763497}. Best is trial 583 with value: 0.8480221917497749.[0m
[32m[I 2022-04-21 20:28:20,810][0m Trial 787 finished with value: 0.8435352277726602 and parameters: {'loss': 'coxph', 'learning_rate': 0.0002567799435851009, 'n_estimators': 289, 'criterion': 'friedman_mse', 'min_samples_split': 2, 'min_samples_leaf': 1, 'min_weight_fraction_leaf': 0.11609051726309555, 'min_impurity_decrease': 0.21238895892656373, 'max_features': 0.30141155089903304, 'subsample': 0.016095157776480146, 'dropout_rate': 0.6649746870630396, 'ccp_alpha': 0.16541411855879132}. Best is trial 583 with value: 0.8480221917497749.[0m
[32m[I 2022-04-21 20:28:34,138][0m Trial 788 finished with value: 0.8451440398561374 and parameters: {'loss': 'coxph', 'learning_rate': 0.00018262896882573418, 'n_estimators': 294, 'criterion': 'friedman_mse', 'min_samples_split': 2, 'min_samples_leaf': 1, 'min_weight_fraction_leaf': 0.11174166719944204, 'min_impurity_decrease': 0.20851198988698028, 'max_features': 0.33411230913575907, 'subsample': 0.0301367935271932, 'dropout_rate': 0.38900447484488865, 'ccp_alpha': 0.10013002655561218}. Best is trial 583 with value: 0.8480221917497749.[0m
[32m[I 2022-04-21 20:28:43,336][0m Trial 789 finished with value: 0.847311014609368 and parameters: {'loss': 'coxph', 'learning_rate': 0.00030505274089704146, 'n_estimators': 281, 'criterion': 'friedman_mse', 'min_samples_split': 2, 'min_samples_leaf': 1, 'min_weight_fraction_leaf': 0.1049720970275866, 'min_impurity_decrease': 0.19569080104249612, 'max_features': 0.352584772924348, 'subsample': 0.03707317158975362, 'dropout_rate': 0.5856731966777413, 'ccp_alpha': 0.17162699783453783}. Best is trial 583 with value: 0.8480221917497749.[0m
[32m[I 2022-04-21 20:28:49,248][0m Trial 790 finished with value: 0.838502856512911 and parameters: {'loss': 'coxph', 'learning_rate': 0.00028846700386386234, 'n_estimators': 278, 'criterion': 'friedman_mse', 'min_samples_split': 2, 'min_samples_leaf': 1, 'min_weight_fraction_leaf': 0.09548451417950587, 'min_impurity_decrease': 0.18551260389933946, 'max_features': 0.3193628102494827, 'subsample': 0.02044879871135518, 'dropout_rate': 0.7821160668525893, 'ccp_alpha': 0.3191945760240391}. Best is trial 583 with value: 0.8480221917497749.[0m
/media/san2_ssd/data/Workdir/survival/venv/lib/python3.8/site-packages/sksurv/ensemble/boosting.py:955: RuntimeWarning: divide by zero encountered in log
  time = numpy.log(time)
/media/san2_ssd/data/Workdir/survival/venv/lib/python3.8/site-packages/sksurv/ensemble/boosting.py:955: RuntimeWarning: divide by zero encountered in log
  time = numpy.log(time)
/media/san2_ssd/data/Workdir/survival/venv/lib/python3.8/site-packages/sksurv/ensemble/boosting.py:955: RuntimeWarning: divide by zero encountered in log
  time = numpy.log(time)
/media/san2_ssd/data/Workdir/survival/venv/lib/python3.8/site-packages/sksurv/ensemble/boosting.py:955: RuntimeWarning: divide by zero encountered in log
  time = numpy.log(time)
[32m[I 2022-04-21 20:28:51,633][0m Trial 791 finished with value: -0.45 and parameters: {'loss': 'squared', 'learning_rate': 0.00024941277863895167, 'n_estimators': 289, 'criterion': 'friedman_mse', 'min_samples_split': 2, 'min_samples_leaf': 1, 'min_weight_fraction_leaf': 0.09589818353190446, 'min_impurity_decrease': 0.875760300382968, 'max_features': 0.3513639958941948, 'subsample': 0.003646052707028641, 'dropout_rate': 0.7386075528433007, 'ccp_alpha': 0.08663768751676926}. Best is trial 583 with value: 0.8480221917497749.[0m
[32m[I 2022-04-21 20:29:00,530][0m Trial 792 finished with value: 0.8444598068700625 and parameters: {'loss': 'coxph', 'learning_rate': 0.00019951430370968072, 'n_estimators': 276, 'criterion': 'squared_error', 'min_samples_split': 2, 'min_samples_leaf': 1, 'min_weight_fraction_leaf': 0.07722309691944934, 'min_impurity_decrease': 0.19683219733040647, 'max_features': 0.3027953686935667, 'subsample': 0.036250810669842856, 'dropout_rate': 0.7191739789017791, 'ccp_alpha': 0.0012826304597062521}. Best is trial 583 with value: 0.8480221917497749.[0m
[32m[I 2022-04-21 20:29:11,419][0m Trial 793 finished with value: 0.8455599567082214 and parameters: {'loss': 'coxph', 'learning_rate': 0.00013738465814241513, 'n_estimators': 286, 'criterion': 'friedman_mse', 'min_samples_split': 2, 'min_samples_leaf': 1, 'min_weight_fraction_leaf': 0.10912076121482464, 'min_impurity_decrease': 0.15931081871188105, 'max_features': 0.33413004136141383, 'subsample': 0.03737112826428644, 'dropout_rate': 0.6345981034956745, 'ccp_alpha': 0.1768098216415509}. Best is trial 583 with value: 0.8480221917497749.[0m
[32m[I 2022-04-21 20:29:31,822][0m Trial 794 finished with value: 0.8443738349467818 and parameters: {'loss': 'coxph', 'learning_rate': 0.0003068033856260732, 'n_estimators': 277, 'criterion': 'friedman_mse', 'min_samples_split': 2, 'min_samples_leaf': 1, 'min_weight_fraction_leaf': 0.10753749543398486, 'min_impurity_decrease': 0.19068808901453804, 'max_features': 0.35370783644872955, 'subsample': 0.023877924158246536, 'dropout_rate': 0.3605127474574956, 'ccp_alpha': 0.27088422814981095}. Best is trial 583 with value: 0.8480221917497749.[0m
[32m[I 2022-04-21 20:29:42,291][0m Trial 795 finished with value: 0.65 and parameters: {'loss': 'coxph', 'learning_rate': 0.00021712573496906237, 'n_estimators': 300, 'criterion': 'friedman_mse', 'min_samples_split': 2, 'min_samples_leaf': 1, 'min_weight_fraction_leaf': 0.10015790714889303, 'min_impurity_decrease': 0.16720618115073976, 'max_features': 0.3236038002976291, 'subsample': 0.0010209732801252647, 'dropout_rate': 0.5799315634293047, 'ccp_alpha': 0.09273246211054166}. Best is trial 583 with value: 0.8480221917497749.[0m
[32m[I 2022-04-21 20:29:51,268][0m Trial 796 finished with value: 0.8433513932164581 and parameters: {'loss': 'coxph', 'learning_rate': 0.00014335369656248354, 'n_estimators': 290, 'criterion': 'friedman_mse', 'min_samples_split': 2, 'min_samples_leaf': 1, 'min_weight_fraction_leaf': 0.12259645842185879, 'min_impurity_decrease': 0.5161773146332558, 'max_features': 0.30085085844866416, 'subsample': 0.04750630612980734, 'dropout_rate': 0.8752091219030292, 'ccp_alpha': 0.3638396555486406}. Best is trial 583 with value: 0.8480221917497749.[0m
[32m[I 2022-04-21 20:30:00,476][0m Trial 797 finished with value: 0.8433410306572583 and parameters: {'loss': 'coxph', 'learning_rate': 1.8145106546243544e-06, 'n_estimators': 305, 'criterion': 'absolute_error', 'min_samples_split': 2, 'min_samples_leaf': 1, 'min_weight_fraction_leaf': 0.12669959175248355, 'min_impurity_decrease': 0.2072523155272383, 'max_features': 0.2857993309431231, 'subsample': 0.042471580430007934, 'dropout_rate': 0.6776274200298177, 'ccp_alpha': 0.14612326227494127}. Best is trial 583 with value: 0.8480221917497749.[0m
[32m[I 2022-04-21 20:30:05,484][0m Trial 798 finished with value: 0.8461181884900256 and parameters: {'loss': 'coxph', 'learning_rate': 0.00017754022822032156, 'n_estimators': 277, 'criterion': 'friedman_mse', 'min_samples_split': 2, 'min_samples_leaf': 1, 'min_weight_fraction_leaf': 0.09068458463701787, 'min_impurity_decrease': 0.17498914943079727, 'max_features': 0.34812827729759444, 'subsample': 0.03413803437974243, 'dropout_rate': 0.9047033316006894, 'ccp_alpha': 0.22228443600962466}. Best is trial 583 with value: 0.8480221917497749.[0m
[32m[I 2022-04-21 20:30:14,525][0m Trial 799 finished with value: 0.843198990285558 and parameters: {'loss': 'coxph', 'learning_rate': 0.0003631751579181471, 'n_estimators': 305, 'criterion': 'friedman_mse', 'min_samples_split': 2, 'min_samples_leaf': 1, 'min_weight_fraction_leaf': 0.3493290397518245, 'min_impurity_decrease': 0.4906793218894622, 'max_features': 0.3152675785056633, 'subsample': 0.01762869386581429, 'dropout_rate': 0.6404501591702558, 'ccp_alpha': 0.08924507462755206}. Best is trial 583 with value: 0.8480221917497749.[0m
[32m[I 2022-04-21 20:30:21,432][0m Trial 800 finished with value: 0.8376247602430957 and parameters: {'loss': 'coxph', 'learning_rate': 0.0002493121434805661, 'n_estimators': 289, 'criterion': 'friedman_mse', 'min_samples_split': 2, 'min_samples_leaf': 1, 'min_weight_fraction_leaf': 0.08379333251812207, 'min_impurity_decrease': 0.1562507129315165, 'max_features': 0.32384150570771075, 'subsample': 0.051778850015363406, 'dropout_rate': 0.6991036978484229, 'ccp_alpha': 0.47830943736854814}. Best is trial 583 with value: 0.8480221917497749.[0m
[32m[I 2022-04-21 20:30:29,877][0m Trial 801 finished with value: 0.8405486542636849 and parameters: {'loss': 'coxph', 'learning_rate': 0.00019628172819143077, 'n_estimators': 310, 'criterion': 'friedman_mse', 'min_samples_split': 8, 'min_samples_leaf': 1, 'min_weight_fraction_leaf': 0.11605320259773068, 'min_impurity_decrease': 0.18416312019977044, 'max_features': 0.35546929617949635, 'subsample': 0.05751607482417423, 'dropout_rate': 0.7619585278229928, 'ccp_alpha': 0.19417998146043738}. Best is trial 583 with value: 0.8480221917497749.[0m
[32m[I 2022-04-21 20:30:33,363][0m Trial 802 finished with value: 0.8492679411913457 and parameters: {'loss': 'coxph', 'learning_rate': 0.0002975823019942587, 'n_estimators': 278, 'criterion': 'friedman_mse', 'min_samples_split': 2, 'min_samples_leaf': 1, 'min_weight_fraction_leaf': 0.10533061925790277, 'min_impurity_decrease': 0.21953648705564402, 'max_features': 0.29658403576874476, 'subsample': 0.04571590739283327, 'dropout_rate': 0.9435815263047356, 'ccp_alpha': 0.08715819457118601}. Best is trial 802 with value: 0.8492679411913457.[0m
[32m[I 2022-04-21 20:30:37,569][0m Trial 803 finished with value: 0.8428571877820449 and parameters: {'loss': 'coxph', 'learning_rate': 0.0002917440678422547, 'n_estimators': 279, 'criterion': 'friedman_mse', 'min_samples_split': 2, 'min_samples_leaf': 1, 'min_weight_fraction_leaf': 0.10486119560609662, 'min_impurity_decrease': 0.2101155769795484, 'max_features': 0.264058341169361, 'subsample': 0.015937499022752762, 'dropout_rate': 0.925090006352341, 'ccp_alpha': 0.004474158395943547}. Best is trial 802 with value: 0.8492679411913457.[0m
[32m[I 2022-04-21 20:30:42,020][0m Trial 804 finished with value: 0.8385246690611246 and parameters: {'loss': 'coxph', 'learning_rate': 0.00023597719604389976, 'n_estimators': 268, 'criterion': 'friedman_mse', 'min_samples_split': 2, 'min_samples_leaf': 1, 'min_weight_fraction_leaf': 0.0754076398904916, 'min_impurity_decrease': 0.14517401050521594, 'max_features': 0.2944412553184854, 'subsample': 0.736000091700292, 'dropout_rate': 0.8221953851632116, 'ccp_alpha': 0.08293972615162148}. Best is trial 802 with value: 0.8492679411913457.[0m
[32m[I 2022-04-21 20:30:46,728][0m Trial 805 finished with value: 0.8489121724259394 and parameters: {'loss': 'coxph', 'learning_rate': 0.00030485817553111175, 'n_estimators': 273, 'criterion': 'friedman_mse', 'min_samples_split': 2, 'min_samples_leaf': 1, 'min_weight_fraction_leaf': 0.10571737987656835, 'min_impurity_decrease': 0.16953264628257209, 'max_features': 0.27857596127602713, 'subsample': 0.04631247179743588, 'dropout_rate': 0.9772931261356345, 'ccp_alpha': 0.07930749313737394}. Best is trial 802 with value: 0.8492679411913457.[0m
[32m[I 2022-04-21 20:30:52,132][0m Trial 806 finished with value: 0.8449119721262743 and parameters: {'loss': 'coxph', 'learning_rate': 0.00018095197578325755, 'n_estimators': 270, 'criterion': 'friedman_mse', 'min_samples_split': 2, 'min_samples_leaf': 1, 'min_weight_fraction_leaf': 0.09153545963360174, 'min_impurity_decrease': 0.17867951608526605, 'max_features': 0.22819492865561777, 'subsample': 0.025605547934781932, 'dropout_rate': 0.9519016875619973, 'ccp_alpha': 0.08611311315944961}. Best is trial 802 with value: 0.8492679411913457.[0m
[32m[I 2022-04-21 20:30:57,374][0m Trial 807 finished with value: 0.8410162251630198 and parameters: {'loss': 'coxph', 'learning_rate': 0.00023305626199426316, 'n_estimators': 266, 'criterion': 'friedman_mse', 'min_samples_split': 2, 'min_samples_leaf': 1, 'min_weight_fraction_leaf': 0.10618315225035416, 'min_impurity_decrease': 0.16255931001085208, 'max_features': 0.26438536053083733, 'subsample': 0.03728209068712078, 'dropout_rate': 0.9666683401395397, 'ccp_alpha': 0.28021217221215916}. Best is trial 802 with value: 0.8492679411913457.[0m
[32m[I 2022-04-21 20:31:09,634][0m Trial 808 finished with value: 0.65 and parameters: {'loss': 'coxph', 'learning_rate': 0.04601941577446598, 'n_estimators': 273, 'criterion': 'friedman_mse', 'min_samples_split': 2, 'min_samples_leaf': 1, 'min_weight_fraction_leaf': 0.107046557081925, 'min_impurity_decrease': 0.19429107128971454, 'max_features': 0.2504679781560246, 'subsample': 0.005184444437234967, 'dropout_rate': 0.611767186847143, 'ccp_alpha': 0.07689160198442196}. Best is trial 802 with value: 0.8492679411913457.[0m
[32m[I 2022-04-21 20:31:15,833][0m Trial 809 finished with value: 0.8460479815816692 and parameters: {'loss': 'coxph', 'learning_rate': 4.700619338067775e-06, 'n_estimators': 264, 'criterion': 'friedman_mse', 'min_samples_split': 2, 'min_samples_leaf': 1, 'min_weight_fraction_leaf': 0.08850949901752977, 'min_impurity_decrease': 0.17072076951518278, 'max_features': 0.2860165574866773, 'subsample': 0.03565344131722155, 'dropout_rate': 0.9265662770281178, 'ccp_alpha': 0.18097042269018504}. Best is trial 802 with value: 0.8492679411913457.[0m
/media/san2_ssd/data/Workdir/survival/venv/lib/python3.8/site-packages/sksurv/ensemble/boosting.py:955: RuntimeWarning: divide by zero encountered in log
  time = numpy.log(time)
/media/san2_ssd/data/Workdir/survival/venv/lib/python3.8/site-packages/sksurv/ensemble/boosting.py:955: RuntimeWarning: divide by zero encountered in log
  time = numpy.log(time)
/media/san2_ssd/data/Workdir/survival/venv/lib/python3.8/site-packages/sksurv/ensemble/boosting.py:955: RuntimeWarning: divide by zero encountered in log
  time = numpy.log(time)
/media/san2_ssd/data/Workdir/survival/venv/lib/python3.8/site-packages/sksurv/ensemble/boosting.py:955: RuntimeWarning: divide by zero encountered in log
  time = numpy.log(time)
