[32m[I 2022-04-21 11:37:26,220][0m Trial 118 finished with value: 0.8001347473592928 and parameters: {'splitter': 'best', 'min_samples_split': 0.07686159637200711, 'min_samples_leaf': 0.0016952380470734024, 'min_weight_fraction_leaf': 0.020226357750201852, 'max_features': 0.37325109124066036}. Best is trial 105 with value: 0.8252433813646162.[0m
/media/san2_ssd/data/Workdir/survival/utils.py:305: RuntimeWarning: invalid value encountered in true_divide
  pdfs = np.gradient(1-survs,axis=1)/norms
/media/san2_ssd/data/Workdir/survival/utils.py:305: RuntimeWarning: invalid value encountered in true_divide
  pdfs = np.gradient(1-survs,axis=1)/norms
/media/san2_ssd/data/Workdir/survival/utils.py:305: RuntimeWarning: invalid value encountered in true_divide
  pdfs = np.gradient(1-survs,axis=1)/norms
[32m[I 2022-04-21 11:37:26,627][0m Trial 119 finished with value: 0.8106750566022314 and parameters: {'splitter': 'best', 'min_samples_split': 0.10162874184513049, 'min_samples_leaf': 0.010566352550237159, 'min_weight_fraction_leaf': 0.0007314906694159855, 'max_features': 0.27517217268633654}. Best is trial 105 with value: 0.8252433813646162.[0m
[32m[I 2022-04-21 11:37:26,955][0m Trial 120 finished with value: 0.8141590234571343 and parameters: {'splitter': 'best', 'min_samples_split': 0.08565246430193907, 'min_samples_leaf': 0.033590319531260834, 'min_weight_fraction_leaf': 0.019247926729411283, 'max_features': 0.34888822622739585}. Best is trial 105 with value: 0.8252433813646162.[0m
[32m[I 2022-04-21 11:37:27,479][0m Trial 121 finished with value: 0.8136735677963112 and parameters: {'splitter': 'best', 'min_samples_split': 0.12384706695017955, 'min_samples_leaf': 0.00876022720437614, 'min_weight_fraction_leaf': 0.0013633871152254112, 'max_features': 0.3720219467694714}. Best is trial 105 with value: 0.8252433813646162.[0m
[32m[I 2022-04-21 11:37:28,031][0m Trial 122 finished with value: 0.806117980988654 and parameters: {'splitter': 'best', 'min_samples_split': 0.11676511877580868, 'min_samples_leaf': 0.0028249181973389074, 'min_weight_fraction_leaf': 0.045843156065822274, 'max_features': 0.42041240122115253}. Best is trial 105 with value: 0.8252433813646162.[0m
/media/san2_ssd/data/Workdir/survival/utils.py:305: RuntimeWarning: invalid value encountered in true_divide
  pdfs = np.gradient(1-survs,axis=1)/norms
[32m[I 2022-04-21 11:37:28,670][0m Trial 123 finished with value: 0.8064074017484911 and parameters: {'splitter': 'best', 'min_samples_split': 0.12907492874968807, 'min_samples_leaf': 0.011357217895163774, 'min_weight_fraction_leaf': 0.015596087137647168, 'max_features': 0.3224372265876766}. Best is trial 105 with value: 0.8252433813646162.[0m
[32m[I 2022-04-21 11:37:29,126][0m Trial 124 finished with value: 0.8025737095599096 and parameters: {'splitter': 'best', 'min_samples_split': 0.11121181322623237, 'min_samples_leaf': 0.025871847656395847, 'min_weight_fraction_leaf': 0.06020512845350153, 'max_features': 0.37743215082587495}. Best is trial 105 with value: 0.8252433813646162.[0m
[32m[I 2022-04-21 11:37:29,522][0m Trial 125 finished with value: 0.7967744853399552 and parameters: {'splitter': 'best', 'min_samples_split': 0.09211375947261533, 'min_samples_leaf': 0.036499610212727525, 'min_weight_fraction_leaf': 0.011558654497547376, 'max_features': 0.3435137340594908}. Best is trial 105 with value: 0.8252433813646162.[0m
[32m[I 2022-04-21 11:37:30,217][0m Trial 126 finished with value: 0.8202848370209473 and parameters: {'splitter': 'best', 'min_samples_split': 0.06807658001369132, 'min_samples_leaf': 0.001387787167753821, 'min_weight_fraction_leaf': 0.03697621548839484, 'max_features': 0.47531648638733226}. Best is trial 105 with value: 0.8252433813646162.[0m
[32m[I 2022-04-21 11:37:30,633][0m Trial 127 finished with value: 0.8029310447161937 and parameters: {'splitter': 'best', 'min_samples_split': 0.07020251448474402, 'min_samples_leaf': 0.00166531865961891, 'min_weight_fraction_leaf': 0.038970887678342336, 'max_features': 0.25768969090086463}. Best is trial 105 with value: 0.8252433813646162.[0m
/media/san2_ssd/data/Workdir/survival/utils.py:305: RuntimeWarning: invalid value encountered in true_divide
  pdfs = np.gradient(1-survs,axis=1)/norms
[32m[I 2022-04-21 11:37:31,353][0m Trial 128 finished with value: 0.8074735257055734 and parameters: {'splitter': 'best', 'min_samples_split': 0.058299716571914836, 'min_samples_leaf': 0.02476471086217439, 'min_weight_fraction_leaf': 0.024056777797752674, 'max_features': 0.48583714315125326}. Best is trial 105 with value: 0.8252433813646162.[0m
/media/san2_ssd/data/Workdir/survival/utils.py:305: RuntimeWarning: invalid value encountered in true_divide
  pdfs = np.gradient(1-survs,axis=1)/norms
[32m[I 2022-04-21 11:37:32,123][0m Trial 129 finished with value: 0.8119789705476433 and parameters: {'splitter': 'best', 'min_samples_split': 0.10490149155360509, 'min_samples_leaf': 0.017881770779862687, 'min_weight_fraction_leaf': 0.0003382038031541993, 'max_features': 0.5584527398855711}. Best is trial 105 with value: 0.8252433813646162.[0m
[32m[I 2022-04-21 11:37:32,486][0m Trial 130 finished with value: 0.8093241429038771 and parameters: {'splitter': 'best', 'min_samples_split': 0.09190559927017043, 'min_samples_leaf': 0.03709720821313014, 'min_weight_fraction_leaf': 0.0512739536266405, 'max_features': 0.3860770049061505}. Best is trial 105 with value: 0.8252433813646162.[0m
/media/san2_ssd/data/Workdir/survival/utils.py:305: RuntimeWarning: invalid value encountered in true_divide
  pdfs = np.gradient(1-survs,axis=1)/norms
[32m[I 2022-04-21 11:37:33,290][0m Trial 131 finished with value: 0.8132423142117677 and parameters: {'splitter': 'best', 'min_samples_split': 0.12023677876691792, 'min_samples_leaf': 0.01150489584469961, 'min_weight_fraction_leaf': 0.017733559051031307, 'max_features': 0.41939162729602913}. Best is trial 105 with value: 0.8252433813646162.[0m
[32m[I 2022-04-21 11:37:33,724][0m Trial 132 finished with value: 0.8121703712461985 and parameters: {'splitter': 'best', 'min_samples_split': 0.07739257618467471, 'min_samples_leaf': 0.025077749061036637, 'min_weight_fraction_leaf': 0.010196750449026685, 'max_features': 0.31103338819954485}. Best is trial 105 with value: 0.8252433813646162.[0m
[32m[I 2022-04-21 11:37:34,137][0m Trial 133 finished with value: 0.7986785400304875 and parameters: {'splitter': 'best', 'min_samples_split': 0.1308008452784054, 'min_samples_leaf': 0.0021530995166935763, 'min_weight_fraction_leaf': 0.033397751976489504, 'max_features': 0.35837971416300757}. Best is trial 105 with value: 0.8252433813646162.[0m
[32m[I 2022-04-21 11:37:34,469][0m Trial 134 finished with value: 0.810680951872776 and parameters: {'splitter': 'best', 'min_samples_split': 0.11099363224178994, 'min_samples_leaf': 0.012821608953695818, 'min_weight_fraction_leaf': 0.026614472944463393, 'max_features': 0.47942431146736586}. Best is trial 105 with value: 0.8252433813646162.[0m
[32m[I 2022-04-21 11:37:34,732][0m Trial 135 finished with value: 0.8035461503620185 and parameters: {'splitter': 'best', 'min_samples_split': 0.1022116283413011, 'min_samples_leaf': 0.02845528735423156, 'min_weight_fraction_leaf': 0.017744034535085718, 'max_features': 0.42201447021745103}. Best is trial 105 with value: 0.8252433813646162.[0m
[32m[I 2022-04-21 11:37:35,019][0m Trial 136 finished with value: 0.8172286347643352 and parameters: {'splitter': 'best', 'min_samples_split': 0.11989126752798993, 'min_samples_leaf': 0.017749205746453365, 'min_weight_fraction_leaf': 0.00017098527351595144, 'max_features': 0.3972628825616871}. Best is trial 105 with value: 0.8252433813646162.[0m
[32m[I 2022-04-21 11:37:35,252][0m Trial 137 finished with value: 0.7946705190658577 and parameters: {'splitter': 'best', 'min_samples_split': 0.13200473734451104, 'min_samples_leaf': 0.020674615700095825, 'min_weight_fraction_leaf': 0.04042535073826917, 'max_features': 0.34039395190907995}. Best is trial 105 with value: 0.8252433813646162.[0m
[32m[I 2022-04-21 11:37:35,494][0m Trial 138 finished with value: 0.8004468889460125 and parameters: {'splitter': 'best', 'min_samples_split': 0.07926589988580743, 'min_samples_leaf': 0.03731895748953459, 'min_weight_fraction_leaf': 0.0012300505811256883, 'max_features': 0.3884102811257383}. Best is trial 105 with value: 0.8252433813646162.[0m
[32m[I 2022-04-21 11:37:35,642][0m Trial 139 finished with value: 0.7991004552369775 and parameters: {'splitter': 'best', 'min_samples_split': 0.11408791919811, 'min_samples_leaf': 0.0162016966370786, 'min_weight_fraction_leaf': 0.07205416090168762, 'max_features': 0.18829261033338812}. Best is trial 105 with value: 0.8252433813646162.[0m
/media/san2_ssd/data/Workdir/survival/utils.py:305: RuntimeWarning: invalid value encountered in true_divide
  pdfs = np.gradient(1-survs,axis=1)/norms
/media/san2_ssd/data/Workdir/survival/utils.py:305: RuntimeWarning: invalid value encountered in true_divide
  pdfs = np.gradient(1-survs,axis=1)/norms
[32m[I 2022-04-21 11:37:36,146][0m Trial 140 finished with value: 0.8079328187096945 and parameters: {'splitter': 'best', 'min_samples_split': 0.06178289794973111, 'min_samples_leaf': 0.001752183027098505, 'min_weight_fraction_leaf': 0.023083573340070752, 'max_features': 0.44945794527365734}. Best is trial 105 with value: 0.8252433813646162.[0m
/media/san2_ssd/data/Workdir/survival/utils.py:305: RuntimeWarning: invalid value encountered in true_divide
  pdfs = np.gradient(1-survs,axis=1)/norms
[32m[I 2022-04-21 11:37:36,593][0m Trial 141 finished with value: 0.811801697064619 and parameters: {'splitter': 'best', 'min_samples_split': 0.12597588423345835, 'min_samples_leaf': 0.011389314780005847, 'min_weight_fraction_leaf': 0.01009956250187176, 'max_features': 0.42397850630211564}. Best is trial 105 with value: 0.8252433813646162.[0m
[32m[I 2022-04-21 11:37:37,118][0m Trial 142 finished with value: 0.8203943678576202 and parameters: {'splitter': 'best', 'min_samples_split': 0.10178657722672979, 'min_samples_leaf': 0.027004141922593643, 'min_weight_fraction_leaf': 0.012081140542123957, 'max_features': 0.40059841575093774}. Best is trial 105 with value: 0.8252433813646162.[0m
[32m[I 2022-04-21 11:37:37,465][0m Trial 143 finished with value: 0.8164083905429196 and parameters: {'splitter': 'best', 'min_samples_split': 0.10377817361976191, 'min_samples_leaf': 0.026263254503605036, 'min_weight_fraction_leaf': 0.030930655626161166, 'max_features': 0.39851589455163744}. Best is trial 105 with value: 0.8252433813646162.[0m
[32m[I 2022-04-21 11:37:37,833][0m Trial 144 finished with value: 0.7997009268492594 and parameters: {'splitter': 'best', 'min_samples_split': 0.0977474301343662, 'min_samples_leaf': 0.05538681175237975, 'min_weight_fraction_leaf': 0.0001249359095324698, 'max_features': 0.36331487722861633}. Best is trial 105 with value: 0.8252433813646162.[0m
[32m[I 2022-04-21 11:37:38,187][0m Trial 145 finished with value: 0.8095071783303833 and parameters: {'splitter': 'best', 'min_samples_split': 0.1515952060896467, 'min_samples_leaf': 0.03828672044262875, 'min_weight_fraction_leaf': 0.016770636538552385, 'max_features': 0.46207855392801606}. Best is trial 105 with value: 0.8252433813646162.[0m
[32m[I 2022-04-21 11:37:38,610][0m Trial 146 finished with value: 0.8112026025688264 and parameters: {'splitter': 'best', 'min_samples_split': 0.09083920486705255, 'min_samples_leaf': 0.020505788543229053, 'min_weight_fraction_leaf': 0.03471882940453397, 'max_features': 0.49692827277897755}. Best is trial 105 with value: 0.8252433813646162.[0m
[32m[I 2022-04-21 11:37:39,000][0m Trial 147 finished with value: 0.8141288774677846 and parameters: {'splitter': 'best', 'min_samples_split': 0.13998919589174363, 'min_samples_leaf': 0.030150270869939252, 'min_weight_fraction_leaf': 0.02099933933661851, 'max_features': 0.32167743845240204}. Best is trial 105 with value: 0.8252433813646162.[0m
[32m[I 2022-04-21 11:37:39,557][0m Trial 148 finished with value: 0.813822048277137 and parameters: {'splitter': 'best', 'min_samples_split': 0.11495807245875844, 'min_samples_leaf': 0.001576430904508543, 'min_weight_fraction_leaf': 0.010852719069177202, 'max_features': 0.38302968238053914}. Best is trial 105 with value: 0.8252433813646162.[0m
[32m[I 2022-04-21 11:37:39,832][0m Trial 149 finished with value: 0.80322333385598 and parameters: {'splitter': 'best', 'min_samples_split': 0.07232781098187048, 'min_samples_leaf': 0.01582309827449487, 'min_weight_fraction_leaf': 0.049123957503927264, 'max_features': 0.4322374476760027}. Best is trial 105 with value: 0.8252433813646162.[0m
[32m[I 2022-04-21 11:37:40,020][0m Trial 150 finished with value: 0.8056699214972507 and parameters: {'splitter': 'best', 'min_samples_split': 0.10774580747272423, 'min_samples_leaf': 0.04933535759169595, 'min_weight_fraction_leaf': 0.029308800386345, 'max_features': 0.34492191360833974}. Best is trial 105 with value: 0.8252433813646162.[0m
[32m[I 2022-04-21 11:37:40,263][0m Trial 151 finished with value: 0.8022111836460072 and parameters: {'splitter': 'best', 'min_samples_split': 0.10153051838956118, 'min_samples_leaf': 0.02779973790733656, 'min_weight_fraction_leaf': 0.03277948825167616, 'max_features': 0.3905552800904389}. Best is trial 105 with value: 0.8252433813646162.[0m
/media/san2_ssd/data/Workdir/survival/utils.py:305: RuntimeWarning: invalid value encountered in true_divide
  pdfs = np.gradient(1-survs,axis=1)/norms
[32m[I 2022-04-21 11:37:40,621][0m Trial 152 finished with value: 0.8084478243957915 and parameters: {'splitter': 'best', 'min_samples_split': 0.08710962319939997, 'min_samples_leaf': 0.022654611864465143, 'min_weight_fraction_leaf': 0.01013608901272684, 'max_features': 0.40519114750067203}. Best is trial 105 with value: 0.8252433813646162.[0m
[32m[I 2022-04-21 11:37:40,901][0m Trial 153 finished with value: 0.8134762339876623 and parameters: {'splitter': 'best', 'min_samples_split': 0.12204306219712999, 'min_samples_leaf': 0.03937966662472364, 'min_weight_fraction_leaf': 0.0009631843773939762, 'max_features': 0.3735761789599086}. Best is trial 105 with value: 0.8252433813646162.[0m
[32m[I 2022-04-21 11:37:41,308][0m Trial 154 finished with value: 0.8102943475185084 and parameters: {'splitter': 'best', 'min_samples_split': 0.2643418487734736, 'min_samples_leaf': 0.009851615555476242, 'min_weight_fraction_leaf': 0.022703287256877647, 'max_features': 0.40343001811541784}. Best is trial 105 with value: 0.8252433813646162.[0m
[32m[I 2022-04-21 11:37:41,974][0m Trial 155 finished with value: 0.8176281539852237 and parameters: {'splitter': 'best', 'min_samples_split': 0.13241660541183592, 'min_samples_leaf': 0.0013019351224565468, 'min_weight_fraction_leaf': 0.04237462704726265, 'max_features': 0.5181084070387882}. Best is trial 105 with value: 0.8252433813646162.[0m
[32m[I 2022-04-21 11:37:42,274][0m Trial 156 finished with value: 0.8042667948741353 and parameters: {'splitter': 'best', 'min_samples_split': 0.13849102749453354, 'min_samples_leaf': 0.011215837485427146, 'min_weight_fraction_leaf': 0.05878210178440402, 'max_features': 0.461558051044974}. Best is trial 105 with value: 0.8252433813646162.[0m
[32m[I 2022-04-21 11:37:42,507][0m Trial 157 finished with value: 0.8107999805410809 and parameters: {'splitter': 'best', 'min_samples_split': 0.15600836345531613, 'min_samples_leaf': 0.015996703566870836, 'min_weight_fraction_leaf': 0.04014087789995241, 'max_features': 0.23581074541489738}. Best is trial 105 with value: 0.8252433813646162.[0m
[32m[I 2022-04-21 11:37:42,928][0m Trial 158 finished with value: 0.8159433403492251 and parameters: {'splitter': 'best', 'min_samples_split': 0.13556050375686118, 'min_samples_leaf': 0.001375638921854566, 'min_weight_fraction_leaf': 0.01604847417597473, 'max_features': 0.3607101764135175}. Best is trial 105 with value: 0.8252433813646162.[0m
[32m[I 2022-04-21 11:37:43,256][0m Trial 159 finished with value: 0.8080818811205532 and parameters: {'splitter': 'best', 'min_samples_split': 0.11512524249238307, 'min_samples_leaf': 0.02960134427345138, 'min_weight_fraction_leaf': 0.00876064514394071, 'max_features': 0.5101682265676337}. Best is trial 105 with value: 0.8252433813646162.[0m
[32m[I 2022-04-21 11:37:43,371][0m Trial 160 finished with value: 0.35 and parameters: {'splitter': 'best', 'min_samples_split': 0.1269150984300024, 'min_samples_leaf': 0.0016233376503134826, 'min_weight_fraction_leaf': 0.022569520160986227, 'max_features': 0.0120305583729714}. Best is trial 105 with value: 0.8252433813646162.[0m
[32m[I 2022-04-21 11:37:43,860][0m Trial 161 finished with value: 0.8182147235904973 and parameters: {'splitter': 'best', 'min_samples_split': 0.09562425770202308, 'min_samples_leaf': 0.022192066124125887, 'min_weight_fraction_leaf': 0.03164880052690135, 'max_features': 0.43570857239071725}. Best is trial 105 with value: 0.8252433813646162.[0m
[32m[I 2022-04-21 11:37:44,431][0m Trial 162 finished with value: 0.8184465960724857 and parameters: {'splitter': 'best', 'min_samples_split': 0.08359953922216308, 'min_samples_leaf': 0.016858407421958183, 'min_weight_fraction_leaf': 0.001099944004647373, 'max_features': 0.4379095416941037}. Best is trial 105 with value: 0.8252433813646162.[0m
/media/san2_ssd/data/Workdir/survival/utils.py:305: RuntimeWarning: invalid value encountered in true_divide
  pdfs = np.gradient(1-survs,axis=1)/norms
/media/san2_ssd/data/Workdir/survival/utils.py:305: RuntimeWarning: invalid value encountered in true_divide
  pdfs = np.gradient(1-survs,axis=1)/norms
[32m[I 2022-04-21 11:37:44,978][0m Trial 163 finished with value: 0.8100777038429932 and parameters: {'splitter': 'best', 'min_samples_split': 0.08250622906152971, 'min_samples_leaf': 0.01920504690068236, 'min_weight_fraction_leaf': 0.0005571228619270218, 'max_features': 0.43538637940121083}. Best is trial 105 with value: 0.8252433813646162.[0m
/media/san2_ssd/data/Workdir/survival/utils.py:305: RuntimeWarning: invalid value encountered in true_divide
  pdfs = np.gradient(1-survs,axis=1)/norms
[32m[I 2022-04-21 11:37:45,471][0m Trial 164 finished with value: 0.8015651603932765 and parameters: {'splitter': 'best', 'min_samples_split': 0.06544814465588296, 'min_samples_leaf': 0.03416779105128866, 'min_weight_fraction_leaf': 0.00969881482978598, 'max_features': 0.4403573771935668}. Best is trial 105 with value: 0.8252433813646162.[0m
[32m[I 2022-04-21 11:37:45,986][0m Trial 165 finished with value: 0.8084749063924926 and parameters: {'splitter': 'best', 'min_samples_split': 0.09560808794359447, 'min_samples_leaf': 0.04295968275552147, 'min_weight_fraction_leaf': 0.044040037951849784, 'max_features': 0.5421545588250579}. Best is trial 105 with value: 0.8252433813646162.[0m
/media/san2_ssd/data/Workdir/survival/utils.py:305: RuntimeWarning: invalid value encountered in true_divide
  pdfs = np.gradient(1-survs,axis=1)/norms
/media/san2_ssd/data/Workdir/survival/utils.py:305: RuntimeWarning: invalid value encountered in true_divide
  pdfs = np.gradient(1-survs,axis=1)/norms
[32m[I 2022-04-21 11:37:46,653][0m Trial 166 finished with value: 0.8133806136945821 and parameters: {'splitter': 'best', 'min_samples_split': 0.1095198716977899, 'min_samples_leaf': 0.013648131208609554, 'min_weight_fraction_leaf': 0.03073212262244502, 'max_features': 0.4720348966730919}. Best is trial 105 with value: 0.8252433813646162.[0m
/media/san2_ssd/data/Workdir/survival/utils.py:305: RuntimeWarning: invalid value encountered in true_divide
  pdfs = np.gradient(1-survs,axis=1)/norms
[32m[I 2022-04-21 11:37:47,249][0m Trial 167 finished with value: 0.8139782226081664 and parameters: {'splitter': 'best', 'min_samples_split': 0.09561783738054778, 'min_samples_leaf': 0.02362767348719986, 'min_weight_fraction_leaf': 0.00012708590881837026, 'max_features': 0.4185401831534333}. Best is trial 105 with value: 0.8252433813646162.[0m
/media/san2_ssd/data/Workdir/survival/utils.py:305: RuntimeWarning: invalid value encountered in true_divide
  pdfs = np.gradient(1-survs,axis=1)/norms
/media/san2_ssd/data/Workdir/survival/utils.py:305: RuntimeWarning: invalid value encountered in true_divide
  pdfs = np.gradient(1-survs,axis=1)/norms
/media/san2_ssd/data/Workdir/survival/utils.py:305: RuntimeWarning: invalid value encountered in true_divide
  pdfs = np.gradient(1-survs,axis=1)/norms
[32m[I 2022-04-21 11:37:47,933][0m Trial 168 finished with value: 0.8109129924442318 and parameters: {'splitter': 'best', 'min_samples_split': 0.07548808125511042, 'min_samples_leaf': 0.010951919606925813, 'min_weight_fraction_leaf': 0.010869843999371393, 'max_features': 0.454949098940597}. Best is trial 105 with value: 0.8252433813646162.[0m
[32m[I 2022-04-21 11:37:48,134][0m Trial 169 finished with value: 0.8005099080631466 and parameters: {'splitter': 'best', 'min_samples_split': 0.08310025904298293, 'min_samples_leaf': 0.05898930853857512, 'min_weight_fraction_leaf': 0.021111305324580686, 'max_features': 0.2799475180509587}. Best is trial 105 with value: 0.8252433813646162.[0m
[32m[I 2022-04-21 11:37:48,481][0m Trial 170 finished with value: 0.8154928414617496 and parameters: {'splitter': 'best', 'min_samples_split': 0.04871409756764052, 'min_samples_leaf': 0.03145078923039214, 'min_weight_fraction_leaf': 0.00894176393381583, 'max_features': 0.40380814559897116}. Best is trial 105 with value: 0.8252433813646162.[0m
[32m[I 2022-04-21 11:37:48,855][0m Trial 171 finished with value: 0.8189219163832322 and parameters: {'splitter': 'best', 'min_samples_split': 0.11722354131083247, 'min_samples_leaf': 0.009905339550540942, 'min_weight_fraction_leaf': 0.018809607863631974, 'max_features': 0.3761787789186718}. Best is trial 105 with value: 0.8252433813646162.[0m
