[32m[I 2022-04-22 15:39:15,386][0m Trial 33 finished with value: 0.5 and parameters: {'loss': 'coxph', 'learning_rate': 3.046555592901685e-06, 'n_estimators': 129, 'criterion': 'friedman_mse', 'min_samples_split': 6, 'min_samples_leaf': 3, 'min_weight_fraction_leaf': 0.38203310746394764, 'min_impurity_decrease': 0.3127128948609148, 'max_features': 0.9197405011679145, 'subsample': 0.3892216728613995, 'dropout_rate': 0.9838404242276665, 'ccp_alpha': 4.481341737940998}. Best is trial 0 with value: 0.5.[0m
[32m[I 2022-04-22 15:39:31,399][0m Trial 34 finished with value: 0.5 and parameters: {'loss': 'coxph', 'learning_rate': 0.0007589522116979515, 'n_estimators': 321, 'criterion': 'absolute_error', 'min_samples_split': 5, 'min_samples_leaf': 4, 'min_weight_fraction_leaf': 0.38606196702642637, 'min_impurity_decrease': 0.2204562494872013, 'max_features': 0.9577129227538815, 'subsample': 0.5023984165044453, 'dropout_rate': 0.7128609038548647, 'ccp_alpha': 3.5019952629462754}. Best is trial 0 with value: 0.5.[0m
[32m[I 2022-04-22 15:39:33,914][0m Trial 35 finished with value: 0.5 and parameters: {'loss': 'coxph', 'learning_rate': 1.5598367970461273e-05, 'n_estimators': 121, 'criterion': 'absolute_error', 'min_samples_split': 9, 'min_samples_leaf': 5, 'min_weight_fraction_leaf': 0.3148478092912214, 'min_impurity_decrease': 0.07173466344997613, 'max_features': 0.8425471773885713, 'subsample': 0.25679493294233574, 'dropout_rate': 0.848028566544593, 'ccp_alpha': 4.939735901762078}. Best is trial 0 with value: 0.5.[0m
/media/san2_ssd/data/Workdir/survival/venv/lib/python3.8/site-packages/sksurv/ensemble/boosting.py:955: RuntimeWarning: divide by zero encountered in log
  time = numpy.log(time)
/media/san2_ssd/data/Workdir/survival/venv/lib/python3.8/site-packages/sksurv/ensemble/boosting.py:955: RuntimeWarning: divide by zero encountered in log
  time = numpy.log(time)
/media/san2_ssd/data/Workdir/survival/venv/lib/python3.8/site-packages/sksurv/ensemble/boosting.py:955: RuntimeWarning: divide by zero encountered in log
  time = numpy.log(time)
/media/san2_ssd/data/Workdir/survival/venv/lib/python3.8/site-packages/sksurv/ensemble/boosting.py:955: RuntimeWarning: divide by zero encountered in log
  time = numpy.log(time)
[32m[I 2022-04-22 15:39:34,390][0m Trial 36 finished with value: -0.7 and parameters: {'loss': 'squared', 'learning_rate': 3.383048096527249e-06, 'n_estimators': 195, 'criterion': 'absolute_error', 'min_samples_split': 9, 'min_samples_leaf': 6, 'min_weight_fraction_leaf': 0.32010134079542574, 'min_impurity_decrease': 0.46413141148951864, 'max_features': 0.7928626362832916, 'subsample': 0.3783360715001655, 'dropout_rate': 0.9951793830919641, 'ccp_alpha': 2.679399280358426}. Best is trial 0 with value: 0.5.[0m
[32m[I 2022-04-22 15:40:36,253][0m Trial 37 finished with value: 0.5 and parameters: {'loss': 'coxph', 'learning_rate': 0.0006914376001389232, 'n_estimators': 678, 'criterion': 'absolute_error', 'min_samples_split': 2, 'min_samples_leaf': 9, 'min_weight_fraction_leaf': 0.2160602274993912, 'min_impurity_decrease': 0.607706695163182, 'max_features': 0.2344643889848697, 'subsample': 0.5977899866642312, 'dropout_rate': 0.608000634944176, 'ccp_alpha': 2.799830824599129}. Best is trial 0 with value: 0.5.[0m
[32m[I 2022-04-22 15:40:56,606][0m Trial 38 finished with value: 0.5 and parameters: {'loss': 'coxph', 'learning_rate': 0.004585587298954978, 'n_estimators': 271, 'criterion': 'absolute_error', 'min_samples_split': 3, 'min_samples_leaf': 7, 'min_weight_fraction_leaf': 0.2589173967291329, 'min_impurity_decrease': 0.8518351650094069, 'max_features': 0.2807680939397765, 'subsample': 0.9235632685641673, 'dropout_rate': 0.250237487620928, 'ccp_alpha': 0.42344786155896263}. Best is trial 0 with value: 0.5.[0m
/media/san2_ssd/data/Workdir/survival/venv/lib/python3.8/site-packages/sksurv/ensemble/boosting.py:955: RuntimeWarning: divide by zero encountered in log
  time = numpy.log(time)
/media/san2_ssd/data/Workdir/survival/venv/lib/python3.8/site-packages/sksurv/ensemble/boosting.py:955: RuntimeWarning: divide by zero encountered in log
  time = numpy.log(time)
/media/san2_ssd/data/Workdir/survival/venv/lib/python3.8/site-packages/sksurv/ensemble/boosting.py:955: RuntimeWarning: divide by zero encountered in log
  time = numpy.log(time)
/media/san2_ssd/data/Workdir/survival/venv/lib/python3.8/site-packages/sksurv/ensemble/boosting.py:955: RuntimeWarning: divide by zero encountered in log
  time = numpy.log(time)
[32m[I 2022-04-22 15:40:59,856][0m Trial 39 finished with value: -0.7 and parameters: {'loss': 'squared', 'learning_rate': 0.0005088689252423822, 'n_estimators': 363, 'criterion': 'friedman_mse', 'min_samples_split': 8, 'min_samples_leaf': 6, 'min_weight_fraction_leaf': 0.12785741499645237, 'min_impurity_decrease': 0.7582794565211305, 'max_features': 0.5067830239374751, 'subsample': 0.7938867404818573, 'dropout_rate': 0.658030595231335, 'ccp_alpha': 1.973126963333773}. Best is trial 0 with value: 0.5.[0m
[32m[I 2022-04-22 15:41:13,001][0m Trial 40 finished with value: 0.5 and parameters: {'loss': 'coxph', 'learning_rate': 0.0301490367617417, 'n_estimators': 237, 'criterion': 'absolute_error', 'min_samples_split': 5, 'min_samples_leaf': 10, 'min_weight_fraction_leaf': 0.09594917087278208, 'min_impurity_decrease': 0.5722616784464302, 'max_features': 0.45310929292148056, 'subsample': 0.787937134878155, 'dropout_rate': 0.4484286242445509, 'ccp_alpha': 0.7853610310759186}. Best is trial 0 with value: 0.5.[0m
[32m[I 2022-04-22 15:41:16,225][0m Trial 41 finished with value: 0.5 and parameters: {'loss': 'coxph', 'learning_rate': 1.1380487113390427e-06, 'n_estimators': 148, 'criterion': 'friedman_mse', 'min_samples_split': 7, 'min_samples_leaf': 1, 'min_weight_fraction_leaf': 0.18703605047014993, 'min_impurity_decrease': 0.18069157264210423, 'max_features': 0.6149190376299902, 'subsample': 0.10394230608400472, 'dropout_rate': 0.7966344615864568, 'ccp_alpha': 3.953659814359065}. Best is trial 0 with value: 0.5.[0m
[32m[I 2022-04-22 15:41:18,779][0m Trial 42 finished with value: 0.5 and parameters: {'loss': 'coxph', 'learning_rate': 0.0011566215309083653, 'n_estimators': 100, 'criterion': 'friedman_mse', 'min_samples_split': 7, 'min_samples_leaf': 1, 'min_weight_fraction_leaf': 0.16797451442781267, 'min_impurity_decrease': 0.3923931282319729, 'max_features': 0.7318527358739104, 'subsample': 0.07257940187926143, 'dropout_rate': 0.519018361427749, 'ccp_alpha': 3.952631894582499}. Best is trial 0 with value: 0.5.[0m
[32m[I 2022-04-22 15:41:22,706][0m Trial 43 finished with value: 0.5 and parameters: {'loss': 'coxph', 'learning_rate': 1.047542265218225e-06, 'n_estimators': 147, 'criterion': 'friedman_mse', 'min_samples_split': 8, 'min_samples_leaf': 2, 'min_weight_fraction_leaf': 0.18991818704470947, 'min_impurity_decrease': 0.1465133723986669, 'max_features': 0.6067462774539315, 'subsample': 0.13664782674402998, 'dropout_rate': 0.648599469462702, 'ccp_alpha': 3.8028708184363555}. Best is trial 0 with value: 0.5.[0m
[32m[I 2022-04-22 15:41:27,197][0m Trial 44 finished with value: 0.5 and parameters: {'loss': 'coxph', 'learning_rate': 0.00011780485933779514, 'n_estimators': 166, 'criterion': 'friedman_mse', 'min_samples_split': 10, 'min_samples_leaf': 6, 'min_weight_fraction_leaf': 0.007584749060876389, 'min_impurity_decrease': 0.005679160649779302, 'max_features': 0.8786946141521595, 'subsample': 0.8647837235231672, 'dropout_rate': 0.7252268182120779, 'ccp_alpha': 3.339189447160833}. Best is trial 0 with value: 0.5.[0m
[32m[I 2022-04-22 15:41:29,987][0m Trial 45 finished with value: 0.5 and parameters: {'loss': 'coxph', 'learning_rate': 4.923671832767875e-06, 'n_estimators': 110, 'criterion': 'friedman_mse', 'min_samples_split': 8, 'min_samples_leaf': 2, 'min_weight_fraction_leaf': 0.22767488832276536, 'min_impurity_decrease': 0.12447456330893258, 'max_features': 0.6663037077101237, 'subsample': 0.16388131000504658, 'dropout_rate': 0.5559330342791936, 'ccp_alpha': 3.902815343342164}. Best is trial 0 with value: 0.5.[0m
[32m[I 2022-04-22 15:41:31,951][0m Trial 46 finished with value: 0.5 and parameters: {'loss': 'coxph', 'learning_rate': 1.8848635344491286e-06, 'n_estimators': 140, 'criterion': 'friedman_mse', 'min_samples_split': 6, 'min_samples_leaf': 3, 'min_weight_fraction_leaf': 0.26208929792914654, 'min_impurity_decrease': 0.3778104138813658, 'max_features': 0.8802620551535049, 'subsample': 0.3364013935347404, 'dropout_rate': 0.9400052150678827, 'ccp_alpha': 4.2948705609823215}. Best is trial 0 with value: 0.5.[0m
/media/san2_ssd/data/Workdir/survival/venv/lib/python3.8/site-packages/sksurv/ensemble/boosting.py:955: RuntimeWarning: divide by zero encountered in log
  time = numpy.log(time)
/media/san2_ssd/data/Workdir/survival/venv/lib/python3.8/site-packages/sksurv/ensemble/boosting.py:955: RuntimeWarning: divide by zero encountered in log
  time = numpy.log(time)
/media/san2_ssd/data/Workdir/survival/venv/lib/python3.8/site-packages/sksurv/ensemble/boosting.py:955: RuntimeWarning: divide by zero encountered in log
  time = numpy.log(time)
/media/san2_ssd/data/Workdir/survival/venv/lib/python3.8/site-packages/sksurv/ensemble/boosting.py:955: RuntimeWarning: divide by zero encountered in log
  time = numpy.log(time)
[32m[I 2022-04-22 15:41:32,220][0m Trial 47 finished with value: -0.7 and parameters: {'loss': 'squared', 'learning_rate': 4.8321843448353075e-06, 'n_estimators': 114, 'criterion': 'friedman_mse', 'min_samples_split': 8, 'min_samples_leaf': 2, 'min_weight_fraction_leaf': 0.22837176365062425, 'min_impurity_decrease': 0.09958793765697618, 'max_features': 0.6723581340784474, 'subsample': 0.17547693601488396, 'dropout_rate': 0.8118065696375808, 'ccp_alpha': 4.705420638922359}. Best is trial 0 with value: 0.5.[0m
[32m[I 2022-04-22 15:41:35,305][0m Trial 48 finished with value: 0.5 and parameters: {'loss': 'coxph', 'learning_rate': 0.00016549850458959716, 'n_estimators': 134, 'criterion': 'absolute_error', 'min_samples_split': 10, 'min_samples_leaf': 4, 'min_weight_fraction_leaf': 0.44458959273313076, 'min_impurity_decrease': 0.26817998479501726, 'max_features': 0.9416754851663833, 'subsample': 0.4304233430238571, 'dropout_rate': 0.9116998125564197, 'ccp_alpha': 3.6439517907176047}. Best is trial 0 with value: 0.5.[0m
[32m[I 2022-04-22 15:41:42,485][0m Trial 49 finished with value: 0.5 and parameters: {'loss': 'coxph', 'learning_rate': 0.00037974006561691543, 'n_estimators': 216, 'criterion': 'absolute_error', 'min_samples_split': 6, 'min_samples_leaf': 3, 'min_weight_fraction_leaf': 0.4600615028659779, 'min_impurity_decrease': 0.32602910594131185, 'max_features': 0.9946471871815638, 'subsample': 0.5314067675388131, 'dropout_rate': 0.8633572585004663, 'ccp_alpha': 4.261046138138084}. Best is trial 0 with value: 0.5.[0m
[32m[I 2022-04-22 15:41:45,308][0m Trial 50 finished with value: 0.5 and parameters: {'loss': 'coxph', 'learning_rate': 0.00015192616125539603, 'n_estimators': 135, 'criterion': 'absolute_error', 'min_samples_split': 10, 'min_samples_leaf': 4, 'min_weight_fraction_leaf': 0.43851863615812026, 'min_impurity_decrease': 0.28913588032724546, 'max_features': 0.9977672920842398, 'subsample': 0.27939150060883766, 'dropout_rate': 0.9069249425006799, 'ccp_alpha': 3.6487084809331516}. Best is trial 0 with value: 0.5.[0m
[32m[I 2022-04-22 15:41:52,363][0m Trial 51 finished with value: 0.5 and parameters: {'loss': 'coxph', 'learning_rate': 0.0003341274222608283, 'n_estimators': 216, 'criterion': 'absolute_error', 'min_samples_split': 6, 'min_samples_leaf': 3, 'min_weight_fraction_leaf': 0.372872857075769, 'min_impurity_decrease': 0.3174642588986021, 'max_features': 0.9168105505898161, 'subsample': 0.5252879049240091, 'dropout_rate': 0.8534980841146944, 'ccp_alpha': 4.252140447390647}. Best is trial 0 with value: 0.5.[0m
[32m[I 2022-04-22 15:41:55,291][0m Trial 52 finished with value: 0.5 and parameters: {'loss': 'coxph', 'learning_rate': 9.413811424265674e-05, 'n_estimators': 124, 'criterion': 'absolute_error', 'min_samples_split': 5, 'min_samples_leaf': 4, 'min_weight_fraction_leaf': 0.399732479209831, 'min_impurity_decrease': 0.4420389097768185, 'max_features': 0.9550484677940645, 'subsample': 0.44932966362535554, 'dropout_rate': 0.9196442582883657, 'ccp_alpha': 3.323031564333219}. Best is trial 0 with value: 0.5.[0m
[32m[I 2022-04-22 15:42:00,371][0m Trial 53 finished with value: 0.5 and parameters: {'loss': 'coxph', 'learning_rate': 1.3234974888291162e-05, 'n_estimators': 160, 'criterion': 'absolute_error', 'min_samples_split': 6, 'min_samples_leaf': 3, 'min_weight_fraction_leaf': 0.3615841908620796, 'min_impurity_decrease': 0.21363149363407208, 'max_features': 0.9173024280952976, 'subsample': 0.5525020189607639, 'dropout_rate': 0.820104341669742, 'ccp_alpha': 4.51178788149124}. Best is trial 0 with value: 0.5.[0m
[32m[I 2022-04-22 15:42:07,510][0m Trial 54 finished with value: 0.5 and parameters: {'loss': 'coxph', 'learning_rate': 3.0040447030802245e-05, 'n_estimators': 192, 'criterion': 'absolute_error', 'min_samples_split': 9, 'min_samples_leaf': 5, 'min_weight_fraction_leaf': 0.3389024023430461, 'min_impurity_decrease': 0.20274270426141097, 'max_features': 0.8484393241804657, 'subsample': 0.3410963683585592, 'dropout_rate': 0.6918015166636198, 'ccp_alpha': 3.4613977693578315}. Best is trial 0 with value: 0.5.[0m
[32m[I 2022-04-22 15:42:10,306][0m Trial 55 finished with value: 0.5 and parameters: {'loss': 'coxph', 'learning_rate': 3.279407127033142e-06, 'n_estimators': 182, 'criterion': 'squared_error', 'min_samples_split': 10, 'min_samples_leaf': 5, 'min_weight_fraction_leaf': 0.38510086348756223, 'min_impurity_decrease': 0.24891927648505568, 'max_features': 0.7766820310365397, 'subsample': 0.23093176785508243, 'dropout_rate': 0.9731808925786807, 'ccp_alpha': 2.4825024004486}. Best is trial 0 with value: 0.5.[0m
[32m[I 2022-04-22 15:42:13,369][0m Trial 56 finished with value: 0.5 and parameters: {'loss': 'coxph', 'learning_rate': 1.9505718419214686e-05, 'n_estimators': 124, 'criterion': 'absolute_error', 'min_samples_split': 4, 'min_samples_leaf': 5, 'min_weight_fraction_leaf': 0.3265134359100176, 'min_impurity_decrease': 0.058982723018193725, 'max_features': 0.8349655131658824, 'subsample': 0.2871208975650697, 'dropout_rate': 0.7479383933730238, 'ccp_alpha': 4.562628989392086}. Best is trial 0 with value: 0.5.[0m
[32m[I 2022-04-22 15:42:21,521][0m Trial 57 finished with value: 0.5 and parameters: {'loss': 'coxph', 'learning_rate': 1.2322495815405215e-05, 'n_estimators': 294, 'criterion': 'absolute_error', 'min_samples_split': 5, 'min_samples_leaf': 5, 'min_weight_fraction_leaf': 0.3892553291214372, 'min_impurity_decrease': 0.21138369800413956, 'max_features': 0.9531685337011035, 'subsample': 0.4744662860457719, 'dropout_rate': 0.9445803879051606, 'ccp_alpha': 4.805297776518958}. Best is trial 0 with value: 0.5.[0m
[32m[I 2022-04-22 15:42:40,294][0m Trial 58 finished with value: 0.5 and parameters: {'loss': 'coxph', 'learning_rate': 2.8806622445097216e-06, 'n_estimators': 516, 'criterion': 'squared_error', 'min_samples_split': 5, 'min_samples_leaf': 4, 'min_weight_fraction_leaf': 0.41956447549553155, 'min_impurity_decrease': 0.28852795337696435, 'max_features': 0.9289034718009903, 'subsample': 0.39393955513554135, 'dropout_rate': 0.87893871700695, 'ccp_alpha': 2.6302541286483216}. Best is trial 0 with value: 0.5.[0m
[32m[I 2022-04-22 15:42:49,609][0m Trial 59 finished with value: 0.5 and parameters: {'loss': 'coxph', 'learning_rate': 0.05137044553973913, 'n_estimators': 332, 'criterion': 'friedman_mse', 'min_samples_split': 5, 'min_samples_leaf': 6, 'min_weight_fraction_leaf': 0.3437655567774281, 'min_impurity_decrease': 0.5182079362917844, 'max_features': 0.8680231732216331, 'subsample': 0.6115290101121834, 'dropout_rate': 0.832842003770869, 'ccp_alpha': 1.3801581472955027}. Best is trial 0 with value: 0.5.[0m
/media/san2_ssd/data/Workdir/survival/venv/lib/python3.8/site-packages/sksurv/ensemble/boosting.py:955: RuntimeWarning: divide by zero encountered in log
  time = numpy.log(time)
/media/san2_ssd/data/Workdir/survival/venv/lib/python3.8/site-packages/sksurv/ensemble/boosting.py:955: RuntimeWarning: divide by zero encountered in log
  time = numpy.log(time)
/media/san2_ssd/data/Workdir/survival/venv/lib/python3.8/site-packages/sksurv/ensemble/boosting.py:955: RuntimeWarning: divide by zero encountered in log
  time = numpy.log(time)
/media/san2_ssd/data/Workdir/survival/venv/lib/python3.8/site-packages/sksurv/ensemble/boosting.py:955: RuntimeWarning: divide by zero encountered in log
  time = numpy.log(time)
[32m[I 2022-04-22 15:42:51,699][0m Trial 60 finished with value: -0.7 and parameters: {'loss': 'squared', 'learning_rate': 3.074293412934139e-05, 'n_estimators': 431, 'criterion': 'absolute_error', 'min_samples_split': 4, 'min_samples_leaf': 3, 'min_weight_fraction_leaf': 0.38469935917682596, 'min_impurity_decrease': 0.4217511685764584, 'max_features': 0.806684666957445, 'subsample': 0.6539434000372927, 'dropout_rate': 0.9972167719220468, 'ccp_alpha': 4.4385736869750465}. Best is trial 0 with value: 0.5.[0m
[32m[I 2022-04-22 15:43:44,364][0m Trial 61 finished with value: 0.5 and parameters: {'loss': 'coxph', 'learning_rate': 0.0005831729416070349, 'n_estimators': 638, 'criterion': 'absolute_error', 'min_samples_split': 9, 'min_samples_leaf': 5, 'min_weight_fraction_leaf': 0.3082051127792062, 'min_impurity_decrease': 0.08016300744511062, 'max_features': 0.08550655120714956, 'subsample': 0.5866330125030729, 'dropout_rate': 0.6246770862862827, 'ccp_alpha': 2.8570818487164287}. Best is trial 0 with value: 0.5.[0m
[32m[I 2022-04-22 15:46:32,945][0m Trial 62 finished with value: 0.5 and parameters: {'loss': 'coxph', 'learning_rate': 0.005192896520400513, 'n_estimators': 796, 'criterion': 'absolute_error', 'min_samples_split': 2, 'min_samples_leaf': 8, 'min_weight_fraction_leaf': 0.26541580866547637, 'min_impurity_decrease': 0.8876942240743511, 'max_features': 0.20524412923433402, 'subsample': 0.49510421903345375, 'dropout_rate': 0.09198365545224407, 'ccp_alpha': 0.2073520528391061}. Best is trial 0 with value: 0.5.[0m
[32m[I 2022-04-22 15:47:24,362][0m Trial 63 finished with value: 0.5 and parameters: {'loss': 'coxph', 'learning_rate': 0.015641917747266667, 'n_estimators': 634, 'criterion': 'absolute_error', 'min_samples_split': 2, 'min_samples_leaf': 9, 'min_weight_fraction_leaf': 0.2788854543821142, 'min_impurity_decrease': 0.9947437070419274, 'max_features': 0.30092096436456994, 'subsample': 0.276253423116133, 'dropout_rate': 0.6734284053669064, 'ccp_alpha': 4.845383548628887}. Best is trial 0 with value: 0.5.[0m
[32m[I 2022-04-22 15:48:03,345][0m Trial 64 finished with value: 0.5 and parameters: {'loss': 'coxph', 'learning_rate': 0.003764498409549495, 'n_estimators': 397, 'criterion': 'absolute_error', 'min_samples_split': 2, 'min_samples_leaf': 7, 'min_weight_fraction_leaf': 0.30770164562247493, 'min_impurity_decrease': 0.8695378795841202, 'max_features': 0.2730742073791389, 'subsample': 0.4086024637441553, 'dropout_rate': 0.21149847959280133, 'ccp_alpha': 4.989598692098101}. Best is trial 0 with value: 0.5.[0m
[32m[I 2022-04-22 15:49:22,788][0m Trial 65 finished with value: 0.5 and parameters: {'loss': 'coxph', 'learning_rate': 0.016006280113198858, 'n_estimators': 620, 'criterion': 'absolute_error', 'min_samples_split': 2, 'min_samples_leaf': 9, 'min_weight_fraction_leaf': 0.20777019771298738, 'min_impurity_decrease': 0.9489331040191077, 'max_features': 0.3628874154507285, 'subsample': 0.9148529078990717, 'dropout_rate': 0.3830320818511316, 'ccp_alpha': 0.447411961268247}. Best is trial 0 with value: 0.5.[0m
[32m[I 2022-04-22 15:49:37,018][0m Trial 66 finished with value: 0.5 and parameters: {'loss': 'coxph', 'learning_rate': 0.02926993555258771, 'n_estimators': 270, 'criterion': 'absolute_error', 'min_samples_split': 3, 'min_samples_leaf': 8, 'min_weight_fraction_leaf': 0.030015713944728045, 'min_impurity_decrease': 0.5835560226653839, 'max_features': 0.13107379434906252, 'subsample': 0.7379881876594151, 'dropout_rate': 0.4628217546687141, 'ccp_alpha': 0.6254625330094488}. Best is trial 0 with value: 0.5.[0m
[32m[I 2022-04-22 15:50:28,570][0m Trial 67 finished with value: 0.5 and parameters: {'loss': 'coxph', 'learning_rate': 0.0066526562755382015, 'n_estimators': 469, 'criterion': 'absolute_error', 'min_samples_split': 2, 'min_samples_leaf': 10, 'min_weight_fraction_leaf': 0.09959108251771343, 'min_impurity_decrease': 0.8337452631963528, 'max_features': 0.3355311310052258, 'subsample': 0.9309749930901121, 'dropout_rate': 0.36790904321200685, 'ccp_alpha': 0.4530601384766974}. Best is trial 0 with value: 0.5.[0m
[32m[I 2022-04-22 15:51:39,048][0m Trial 68 finished with value: 0.5 and parameters: {'loss': 'coxph', 'learning_rate': 0.05916181087009486, 'n_estimators': 718, 'criterion': 'absolute_error', 'min_samples_split': 3, 'min_samples_leaf': 10, 'min_weight_fraction_leaf': 0.24787695443481378, 'min_impurity_decrease': 0.6551361337041379, 'max_features': 0.2545709042791169, 'subsample': 0.8301883978015752, 'dropout_rate': 0.6113713655198483, 'ccp_alpha': 0.7494631708322691}. Best is trial 0 with value: 0.5.[0m
[32m[I 2022-04-22 15:52:34,966][0m Trial 69 finished with value: 0.5 and parameters: {'loss': 'coxph', 'learning_rate': 0.00933699536016924, 'n_estimators': 473, 'criterion': 'absolute_error', 'min_samples_split': 3, 'min_samples_leaf': 10, 'min_weight_fraction_leaf': 0.10380896170904189, 'min_impurity_decrease': 0.8202510391117741, 'max_features': 0.4212989259175127, 'subsample': 0.9505106345782601, 'dropout_rate': 0.28798032863117434, 'ccp_alpha': 0.032202430761326895}. Best is trial 0 with value: 0.5.[0m
