[32m[I 2022-04-21 11:39:15,910][0m Trial 72 finished with value: 0.5 and parameters: {'splitter': 'random', 'min_samples_split': 0.13093774927416255, 'min_samples_leaf': 0.2816816273021071, 'min_weight_fraction_leaf': 0.021921580508624753, 'max_features': 0.9403162528035742}. Best is trial 11 with value: 0.6773038119717333.[0m
[32m[I 2022-04-21 11:39:15,942][0m Trial 73 finished with value: 0.6738476114655684 and parameters: {'splitter': 'random', 'min_samples_split': 0.3792824548318835, 'min_samples_leaf': 0.18350158002883063, 'min_weight_fraction_leaf': 0.09405337875668618, 'max_features': 0.8995028122205894}. Best is trial 11 with value: 0.6773038119717333.[0m
[32m[I 2022-04-21 11:39:15,971][0m Trial 74 finished with value: 0.6640701022932763 and parameters: {'splitter': 'random', 'min_samples_split': 0.11433050726134776, 'min_samples_leaf': 0.13498918507600538, 'min_weight_fraction_leaf': 0.12021980660997958, 'max_features': 0.8027275013093942}. Best is trial 11 with value: 0.6773038119717333.[0m
[32m[I 2022-04-21 11:39:15,997][0m Trial 75 finished with value: 0.662800366349585 and parameters: {'splitter': 'random', 'min_samples_split': 0.4648630961500159, 'min_samples_leaf': 0.16000329067708902, 'min_weight_fraction_leaf': 0.09453427123321734, 'max_features': 0.8826358837739858}. Best is trial 11 with value: 0.6773038119717333.[0m
[32m[I 2022-04-21 11:39:16,023][0m Trial 76 finished with value: 0.6738476114655684 and parameters: {'splitter': 'random', 'min_samples_split': 0.023499261235940497, 'min_samples_leaf': 0.013380699676780398, 'min_weight_fraction_leaf': 0.17144026734923287, 'max_features': 0.9432904662645869}. Best is trial 11 with value: 0.6773038119717333.[0m
[32m[I 2022-04-21 11:39:16,049][0m Trial 77 finished with value: 0.6215155824977587 and parameters: {'splitter': 'random', 'min_samples_split': 0.14282182819657205, 'min_samples_leaf': 0.02971947572330951, 'min_weight_fraction_leaf': 0.2235575918240617, 'max_features': 0.9968026873981457}. Best is trial 11 with value: 0.6773038119717333.[0m
[32m[I 2022-04-21 11:39:16,075][0m Trial 78 finished with value: 0.5 and parameters: {'splitter': 'random', 'min_samples_split': 0.005145765791270802, 'min_samples_leaf': 0.33533304015603327, 'min_weight_fraction_leaf': 0.04567694807696427, 'max_features': 0.8562764224239624}. Best is trial 11 with value: 0.6773038119717333.[0m
[32m[I 2022-04-21 11:39:16,101][0m Trial 79 finished with value: 0.6738476114655684 and parameters: {'splitter': 'random', 'min_samples_split': 0.1546231687006855, 'min_samples_leaf': 0.0884725100192166, 'min_weight_fraction_leaf': 0.18119852411132903, 'max_features': 0.966306162914893}. Best is trial 11 with value: 0.6773038119717333.[0m
[32m[I 2022-04-21 11:39:16,133][0m Trial 80 finished with value: 0.6551405301163737 and parameters: {'splitter': 'random', 'min_samples_split': 0.19793456651987176, 'min_samples_leaf': 0.21798532153139927, 'min_weight_fraction_leaf': 0.18492571092462787, 'max_features': 0.9279251512817276}. Best is trial 11 with value: 0.6773038119717333.[0m
[32m[I 2022-04-21 11:39:16,178][0m Trial 81 finished with value: 0.6586187582319654 and parameters: {'splitter': 'random', 'min_samples_split': 0.18290341628241197, 'min_samples_leaf': 0.08246178941483519, 'min_weight_fraction_leaf': 0.20192983791418842, 'max_features': 0.9735427459229145}. Best is trial 11 with value: 0.6773038119717333.[0m
[32m[I 2022-04-21 11:39:16,210][0m Trial 82 finished with value: 0.5931624331547747 and parameters: {'splitter': 'random', 'min_samples_split': 0.17228195338177707, 'min_samples_leaf': 0.24623005034598464, 'min_weight_fraction_leaf': 0.06561148334537222, 'max_features': 0.9045142994528104}. Best is trial 11 with value: 0.6773038119717333.[0m
[32m[I 2022-04-21 11:39:16,236][0m Trial 83 finished with value: 0.6738476114655684 and parameters: {'splitter': 'random', 'min_samples_split': 0.2327194119717042, 'min_samples_leaf': 0.1913576113017531, 'min_weight_fraction_leaf': 0.08109626611221024, 'max_features': 0.9916856898434201}. Best is trial 11 with value: 0.6773038119717333.[0m
[32m[I 2022-04-21 11:39:16,263][0m Trial 84 finished with value: 0.6502080893344752 and parameters: {'splitter': 'random', 'min_samples_split': 0.1642579937611313, 'min_samples_leaf': 0.05017288567091649, 'min_weight_fraction_leaf': 0.1461462459826163, 'max_features': 0.9843985419088125}. Best is trial 11 with value: 0.6773038119717333.[0m
[32m[I 2022-04-21 11:39:16,289][0m Trial 85 finished with value: 0.6650367998115423 and parameters: {'splitter': 'random', 'min_samples_split': 0.2396859727056185, 'min_samples_leaf': 0.03522669805525883, 'min_weight_fraction_leaf': 0.11339894366095907, 'max_features': 0.9986701233395661}. Best is trial 11 with value: 0.6773038119717333.[0m
[32m[I 2022-04-21 11:39:16,316][0m Trial 86 finished with value: 0.6659051364114569 and parameters: {'splitter': 'best', 'min_samples_split': 0.3232592166079102, 'min_samples_leaf': 0.10627901760000957, 'min_weight_fraction_leaf': 0.13235946480437305, 'max_features': 0.9335699080460544}. Best is trial 11 with value: 0.6773038119717333.[0m
[32m[I 2022-04-21 11:39:16,351][0m Trial 87 finished with value: 0.6543938115635641 and parameters: {'splitter': 'random', 'min_samples_split': 0.1391942758470808, 'min_samples_leaf': 0.12867882378733161, 'min_weight_fraction_leaf': 0.15967677481911113, 'max_features': 0.9510837932912927}. Best is trial 11 with value: 0.6773038119717333.[0m
[32m[I 2022-04-21 11:39:16,411][0m Trial 88 finished with value: 0.6586187582319654 and parameters: {'splitter': 'random', 'min_samples_split': 0.27023672699161183, 'min_samples_leaf': 0.001056768618847794, 'min_weight_fraction_leaf': 0.20936162929154126, 'max_features': 0.913469288347606}. Best is trial 11 with value: 0.6773038119717333.[0m
[32m[I 2022-04-21 11:39:16,457][0m Trial 89 finished with value: 0.5 and parameters: {'splitter': 'random', 'min_samples_split': 0.19418832506186082, 'min_samples_leaf': 0.052017053883393075, 'min_weight_fraction_leaf': 0.18843064930331702, 'max_features': 0.13087979963655116}. Best is trial 11 with value: 0.6773038119717333.[0m
[32m[I 2022-04-21 11:39:16,511][0m Trial 90 finished with value: 0.5889594645659965 and parameters: {'splitter': 'random', 'min_samples_split': 0.21941074892942092, 'min_samples_leaf': 0.11345490371349824, 'min_weight_fraction_leaf': 0.22994764299780598, 'max_features': 0.881574830197188}. Best is trial 11 with value: 0.6773038119717333.[0m
[32m[I 2022-04-21 11:39:16,568][0m Trial 91 finished with value: 0.6738476114655684 and parameters: {'splitter': 'random', 'min_samples_split': 0.16073194951548683, 'min_samples_leaf': 0.06228126884806671, 'min_weight_fraction_leaf': 0.19592976757448452, 'max_features': 0.9597695019176331}. Best is trial 11 with value: 0.6773038119717333.[0m
[32m[I 2022-04-21 11:39:16,617][0m Trial 92 finished with value: 0.662800366349585 and parameters: {'splitter': 'random', 'min_samples_split': 0.09702061928195535, 'min_samples_leaf': 0.0718650335912344, 'min_weight_fraction_leaf': 0.16212997160038095, 'max_features': 0.9416213116655018}. Best is trial 11 with value: 0.6773038119717333.[0m
[32m[I 2022-04-21 11:39:16,671][0m Trial 93 finished with value: 0.6738476114655684 and parameters: {'splitter': 'random', 'min_samples_split': 0.20744172135949954, 'min_samples_leaf': 0.011002877875034258, 'min_weight_fraction_leaf': 0.18118879370426647, 'max_features': 0.971256101982532}. Best is trial 11 with value: 0.6773038119717333.[0m
[32m[I 2022-04-21 11:39:16,725][0m Trial 94 finished with value: 0.5931624331547747 and parameters: {'splitter': 'random', 'min_samples_split': 0.20683706454137024, 'min_samples_leaf': 0.014210690226165612, 'min_weight_fraction_leaf': 0.24655459998077867, 'max_features': 0.9756301747761059}. Best is trial 11 with value: 0.6773038119717333.[0m
[32m[I 2022-04-21 11:39:16,776][0m Trial 95 finished with value: 0.6738476114655684 and parameters: {'splitter': 'random', 'min_samples_split': 0.028166956806175356, 'min_samples_leaf': 0.036722245169967034, 'min_weight_fraction_leaf': 0.17061305496193624, 'max_features': 0.9267501059611889}. Best is trial 11 with value: 0.6773038119717333.[0m
[32m[I 2022-04-21 11:39:16,834][0m Trial 96 finished with value: 0.5 and parameters: {'splitter': 'random', 'min_samples_split': 0.29272007950064827, 'min_samples_leaf': 0.06489946596694632, 'min_weight_fraction_leaf': 0.21350784534512612, 'max_features': 0.5703616942560557}. Best is trial 11 with value: 0.6773038119717333.[0m
[32m[I 2022-04-21 11:39:16,882][0m Trial 97 finished with value: 0.6360776294262513 and parameters: {'splitter': 'random', 'min_samples_split': 0.39827168722205897, 'min_samples_leaf': 0.09661372800736456, 'min_weight_fraction_leaf': 0.024590548165744408, 'max_features': 0.2090567957197187}. Best is trial 11 with value: 0.6773038119717333.[0m
[32m[I 2022-04-21 11:39:16,947][0m Trial 98 finished with value: 0.5 and parameters: {'splitter': 'random', 'min_samples_split': 0.1780967884126775, 'min_samples_leaf': 0.1450840408796555, 'min_weight_fraction_leaf': 0.17662615831673514, 'max_features': 0.3597231051920219}. Best is trial 11 with value: 0.6773038119717333.[0m
[32m[I 2022-04-21 11:39:16,990][0m Trial 99 finished with value: 0.6636900948801576 and parameters: {'splitter': 'best', 'min_samples_split': 0.2459225078339346, 'min_samples_leaf': 0.024987067298056775, 'min_weight_fraction_leaf': 0.20226674806532147, 'max_features': 0.9451211327143434}. Best is trial 11 with value: 0.6773038119717333.[0m
[32m[I 2022-04-21 11:39:17,044][0m Trial 100 finished with value: 0.6640701022932763 and parameters: {'splitter': 'random', 'min_samples_split': 0.019197238158775852, 'min_samples_leaf': 0.043145991449927895, 'min_weight_fraction_leaf': 0.14249709806529112, 'max_features': 0.9751175746021513}. Best is trial 11 with value: 0.6773038119717333.[0m
[32m[I 2022-04-21 11:39:17,114][0m Trial 101 finished with value: 0.6738476114655684 and parameters: {'splitter': 'random', 'min_samples_split': 0.04670395777367005, 'min_samples_leaf': 0.19571433869549285, 'min_weight_fraction_leaf': 0.08070247007660254, 'max_features': 0.9984758848316581}. Best is trial 11 with value: 0.6773038119717333.[0m
[32m[I 2022-04-21 11:39:17,176][0m Trial 102 finished with value: 0.6640701022932763 and parameters: {'splitter': 'random', 'min_samples_split': 0.15628801051843358, 'min_samples_leaf': 0.0817942591991883, 'min_weight_fraction_leaf': 0.12557326261709523, 'max_features': 0.9769480645861173}. Best is trial 11 with value: 0.6773038119717333.[0m
[32m[I 2022-04-21 11:39:17,232][0m Trial 103 finished with value: 0.6738476114655684 and parameters: {'splitter': 'random', 'min_samples_split': 0.12412853436964373, 'min_samples_leaf': 0.08374404912538033, 'min_weight_fraction_leaf': 0.1829875211913921, 'max_features': 0.8875787453059869}. Best is trial 11 with value: 0.6773038119717333.[0m
[32m[I 2022-04-21 11:39:17,288][0m Trial 104 finished with value: 0.6738476114655684 and parameters: {'splitter': 'random', 'min_samples_split': 0.15056774195353093, 'min_samples_leaf': 0.03562164658451644, 'min_weight_fraction_leaf': 0.19879514073867074, 'max_features': 0.9224318633689257}. Best is trial 11 with value: 0.6773038119717333.[0m
[32m[I 2022-04-21 11:39:17,354][0m Trial 105 finished with value: 0.6543938115635641 and parameters: {'splitter': 'random', 'min_samples_split': 0.2771365738250419, 'min_samples_leaf': 0.05848938158772313, 'min_weight_fraction_leaf': 0.15608967723371941, 'max_features': 0.8913792572487319}. Best is trial 11 with value: 0.6773038119717333.[0m
[32m[I 2022-04-21 11:39:17,399][0m Trial 106 finished with value: 0.6650367998115423 and parameters: {'splitter': 'random', 'min_samples_split': 0.07143431367430197, 'min_samples_leaf': 0.008731664506518917, 'min_weight_fraction_leaf': 0.10581064388199903, 'max_features': 0.9824125638002362}. Best is trial 11 with value: 0.6773038119717333.[0m
[32m[I 2022-04-21 11:39:17,460][0m Trial 107 finished with value: 0.6502080893344752 and parameters: {'splitter': 'random', 'min_samples_split': 0.30261532157941107, 'min_samples_leaf': 0.1510527938431087, 'min_weight_fraction_leaf': 0.1386511537395055, 'max_features': 0.8634470037917279}. Best is trial 11 with value: 0.6773038119717333.[0m
[32m[I 2022-04-21 11:39:17,516][0m Trial 108 finished with value: 0.6738476114655684 and parameters: {'splitter': 'random', 'min_samples_split': 0.0856369140005298, 'min_samples_leaf': 0.02291622281991462, 'min_weight_fraction_leaf': 0.16946938646632667, 'max_features': 0.9538240410094007}. Best is trial 11 with value: 0.6773038119717333.[0m
[32m[I 2022-04-21 11:39:17,617][0m Trial 109 finished with value: 0.6738476114655684 and parameters: {'splitter': 'random', 'min_samples_split': 0.3777530773418755, 'min_samples_leaf': 0.1800896711979737, 'min_weight_fraction_leaf': 0.16771142661660465, 'max_features': 0.8383016862857451}. Best is trial 11 with value: 0.6773038119717333.[0m
[32m[I 2022-04-21 11:39:17,678][0m Trial 110 finished with value: 0.6738476114655684 and parameters: {'splitter': 'random', 'min_samples_split': 0.3714375192559483, 'min_samples_leaf': 0.17531079888883613, 'min_weight_fraction_leaf': 0.14818650488984347, 'max_features': 0.8241091428148422}. Best is trial 11 with value: 0.6773038119717333.[0m
[32m[I 2022-04-21 11:39:17,763][0m Trial 111 finished with value: 0.6738476114655684 and parameters: {'splitter': 'random', 'min_samples_split': 0.2284758652889577, 'min_samples_leaf': 0.16795378036864006, 'min_weight_fraction_leaf': 0.15508034607371582, 'max_features': 0.9419576174896792}. Best is trial 11 with value: 0.6773038119717333.[0m
[32m[I 2022-04-21 11:39:17,819][0m Trial 112 finished with value: 0.6738476114655684 and parameters: {'splitter': 'random', 'min_samples_split': 0.2531846973382194, 'min_samples_leaf': 0.06757089566573704, 'min_weight_fraction_leaf': 0.19417233667768857, 'max_features': 0.950899940855723}. Best is trial 11 with value: 0.6773038119717333.[0m
[32m[I 2022-04-21 11:39:17,848][0m Trial 113 finished with value: 0.6738476114655684 and parameters: {'splitter': 'random', 'min_samples_split': 0.20599582737938824, 'min_samples_leaf': 0.04355112435598924, 'min_weight_fraction_leaf': 0.1955394544222495, 'max_features': 0.917323948978664}. Best is trial 11 with value: 0.6773038119717333.[0m
[32m[I 2022-04-21 11:39:17,875][0m Trial 114 finished with value: 0.5283695882293453 and parameters: {'splitter': 'random', 'min_samples_split': 0.039568798052718734, 'min_samples_leaf': 0.0731640237522464, 'min_weight_fraction_leaf': 0.2582855445826593, 'max_features': 0.9201535429100224}. Best is trial 11 with value: 0.6773038119717333.[0m
[32m[I 2022-04-21 11:39:17,902][0m Trial 115 finished with value: 0.6738476114655684 and parameters: {'splitter': 'random', 'min_samples_split': 0.05579394790479874, 'min_samples_leaf': 0.20089596636699106, 'min_weight_fraction_leaf': 0.09616270726338005, 'max_features': 0.9011630849427201}. Best is trial 11 with value: 0.6773038119717333.[0m
[32m[I 2022-04-21 11:39:17,928][0m Trial 116 finished with value: 0.5931624331547747 and parameters: {'splitter': 'random', 'min_samples_split': 0.16222960962333588, 'min_samples_leaf': 0.23758242996671666, 'min_weight_fraction_leaf': 0.22076750512025278, 'max_features': 0.9669844739189685}. Best is trial 11 with value: 0.6773038119717333.[0m
[32m[I 2022-04-21 11:39:17,954][0m Trial 117 finished with value: 0.6738476114655684 and parameters: {'splitter': 'random', 'min_samples_split': 0.21420439958051513, 'min_samples_leaf': 0.19561038606621411, 'min_weight_fraction_leaf': 0.09065082111868468, 'max_features': 0.9866408701644869}. Best is trial 11 with value: 0.6773038119717333.[0m
[32m[I 2022-04-21 11:39:17,981][0m Trial 118 finished with value: 0.6215155824977587 and parameters: {'splitter': 'random', 'min_samples_split': 0.22005434721040282, 'min_samples_leaf': 0.22777750472535557, 'min_weight_fraction_leaf': 0.07351274880357574, 'max_features': 0.9982684664121183}. Best is trial 11 with value: 0.6773038119717333.[0m
[32m[I 2022-04-21 11:39:18,008][0m Trial 119 finished with value: 0.6636900948801576 and parameters: {'splitter': 'best', 'min_samples_split': 0.016591411720009636, 'min_samples_leaf': 0.1905264504315531, 'min_weight_fraction_leaf': 0.0790674803163853, 'max_features': 0.9292174652319675}. Best is trial 11 with value: 0.6773038119717333.[0m
[32m[I 2022-04-21 11:39:18,036][0m Trial 120 finished with value: 0.6684429832432761 and parameters: {'splitter': 'random', 'min_samples_split': 0.18713948805016983, 'min_samples_leaf': 0.015840975687208474, 'min_weight_fraction_leaf': 0.052205883609989595, 'max_features': 0.9673972975176189}. Best is trial 11 with value: 0.6773038119717333.[0m
[32m[I 2022-04-21 11:39:18,065][0m Trial 121 finished with value: 0.6586187582319654 and parameters: {'splitter': 'random', 'min_samples_split': 0.11615633353194443, 'min_samples_leaf': 0.029704087969196987, 'min_weight_fraction_leaf': 0.20537017489830686, 'max_features': 0.9985725212599816}. Best is trial 11 with value: 0.6773038119717333.[0m
[32m[I 2022-04-21 11:39:18,092][0m Trial 122 finished with value: 0.6738476114655684 and parameters: {'splitter': 'random', 'min_samples_split': 0.02559407863155534, 'min_samples_leaf': 0.03737812127370019, 'min_weight_fraction_leaf': 0.1751410058125249, 'max_features': 0.9277215479283448}. Best is trial 11 with value: 0.6773038119717333.[0m
[32m[I 2022-04-21 11:39:18,119][0m Trial 123 finished with value: 0.6738476114655684 and parameters: {'splitter': 'random', 'min_samples_split': 0.34176691379598795, 'min_samples_leaf': 0.11659388271855911, 'min_weight_fraction_leaf': 0.18405902895713266, 'max_features': 0.9005243109372547}. Best is trial 11 with value: 0.6773038119717333.[0m
[32m[I 2022-04-21 11:39:18,146][0m Trial 124 finished with value: 0.6738476114655684 and parameters: {'splitter': 'random', 'min_samples_split': 0.3907120738358559, 'min_samples_leaf': 0.1328987921361613, 'min_weight_fraction_leaf': 0.17166594327914186, 'max_features': 0.8709916470697312}. Best is trial 11 with value: 0.6773038119717333.[0m
[32m[I 2022-04-21 11:39:18,173][0m Trial 125 finished with value: 0.6738476114655684 and parameters: {'splitter': 'random', 'min_samples_split': 0.33812256952829634, 'min_samples_leaf': 0.11080719750757739, 'min_weight_fraction_leaf': 0.1872258517610327, 'max_features': 0.9039164411170107}. Best is trial 11 with value: 0.6773038119717333.[0m
[32m[I 2022-04-21 11:39:18,200][0m Trial 126 finished with value: 0.6738476114655684 and parameters: {'splitter': 'random', 'min_samples_split': 0.40399118754797214, 'min_samples_leaf': 0.13181123170506498, 'min_weight_fraction_leaf': 0.17417038423843198, 'max_features': 0.9497051179381378}. Best is trial 11 with value: 0.6773038119717333.[0m
[32m[I 2022-04-21 11:39:18,226][0m Trial 127 finished with value: 0.5 and parameters: {'splitter': 'random', 'min_samples_split': 0.3198094924442288, 'min_samples_leaf': 0.26426804522849673, 'min_weight_fraction_leaf': 0.11451781680727934, 'max_features': 0.9616634391900633}. Best is trial 11 with value: 0.6773038119717333.[0m
[32m[I 2022-04-21 11:39:18,272][0m Trial 128 finished with value: 0.5 and parameters: {'splitter': 'random', 'min_samples_split': 0.4580733350155692, 'min_samples_leaf': 0.046010363401760235, 'min_weight_fraction_leaf': 0.2169902089433392, 'max_features': 0.48566642559224604}. Best is trial 11 with value: 0.6773038119717333.[0m
[32m[I 2022-04-21 11:39:18,329][0m Trial 129 finished with value: 0.5889594645659965 and parameters: {'splitter': 'random', 'min_samples_split': 0.1473995340434373, 'min_samples_leaf': 0.09326991931873231, 'min_weight_fraction_leaf': 0.23371787578274908, 'max_features': 0.8547022845024029}. Best is trial 11 with value: 0.6773038119717333.[0m
[32m[I 2022-04-21 11:39:18,382][0m Trial 130 finished with value: 0.6738476114655684 and parameters: {'splitter': 'random', 'min_samples_split': 0.25702620267765675, 'min_samples_leaf': 0.168495485459688, 'min_weight_fraction_leaf': 0.15513701871466837, 'max_features': 0.9441002811839969}. Best is trial 11 with value: 0.6773038119717333.[0m
[32m[I 2022-04-21 11:39:18,440][0m Trial 131 finished with value: 0.662800366349585 and parameters: {'splitter': 'random', 'min_samples_split': 0.12554360338284767, 'min_samples_leaf': 0.16025326706926876, 'min_weight_fraction_leaf': 0.1590004254006435, 'max_features': 0.8903905694381135}. Best is trial 11 with value: 0.6773038119717333.[0m
[32m[I 2022-04-21 11:39:18,502][0m Trial 132 finished with value: 0.6640701022932763 and parameters: {'splitter': 'random', 'min_samples_split': 0.10566595224893993, 'min_samples_leaf': 0.034404870756548474, 'min_weight_fraction_leaf': 0.1334018608905541, 'max_features': 0.9772469086329467}. Best is trial 11 with value: 0.6773038119717333.[0m
[32m[I 2022-04-21 11:39:18,559][0m Trial 133 finished with value: 0.6738476114655684 and parameters: {'splitter': 'random', 'min_samples_split': 0.23071083108682597, 'min_samples_leaf': 0.182797547869297, 'min_weight_fraction_leaf': 0.14960915712893344, 'max_features': 0.8067033546506664}. Best is trial 11 with value: 0.6773038119717333.[0m
[32m[I 2022-04-21 11:39:18,617][0m Trial 134 finished with value: 0.6640701022932763 and parameters: {'splitter': 'random', 'min_samples_split': 0.08366726934087226, 'min_samples_leaf': 0.02029249876481945, 'min_weight_fraction_leaf': 0.14569109368109573, 'max_features': 0.8121144990583273}. Best is trial 11 with value: 0.6773038119717333.[0m
