[32m[I 2022-04-22 17:15:33,509][0m Trial 221 finished with value: 0.6615138227010202 and parameters: {'loss': 'coxph', 'learning_rate': 0.01256194409001035, 'n_estimators': 496, 'criterion': 'friedman_mse', 'min_samples_split': 10, 'min_samples_leaf': 3, 'min_weight_fraction_leaf': 0.07139905531796097, 'min_impurity_decrease': 0.9219975772358452, 'max_features': 0.5261810967720557, 'subsample': 0.26254435145475663, 'dropout_rate': 0.22674506498160057, 'ccp_alpha': 0.016140768948601197}. Best is trial 218 with value: 0.6659976583847056.[0m
[32m[I 2022-04-22 17:16:34,588][0m Trial 222 finished with value: 0.6595637414713875 and parameters: {'loss': 'coxph', 'learning_rate': 0.01203274197117982, 'n_estimators': 499, 'criterion': 'friedman_mse', 'min_samples_split': 10, 'min_samples_leaf': 3, 'min_weight_fraction_leaf': 0.07230217998098325, 'min_impurity_decrease': 0.9287257943168272, 'max_features': 0.5333857009284128, 'subsample': 0.2703279680941881, 'dropout_rate': 0.22900887682666823, 'ccp_alpha': 0.03603776390104159}. Best is trial 218 with value: 0.6659976583847056.[0m
[32m[I 2022-04-22 17:17:37,252][0m Trial 223 finished with value: 0.661459935122428 and parameters: {'loss': 'coxph', 'learning_rate': 0.011209278681221912, 'n_estimators': 500, 'criterion': 'friedman_mse', 'min_samples_split': 10, 'min_samples_leaf': 3, 'min_weight_fraction_leaf': 0.07103229991710436, 'min_impurity_decrease': 0.9394092569145214, 'max_features': 0.5168709284665567, 'subsample': 0.2710548384729709, 'dropout_rate': 0.23143627496029062, 'ccp_alpha': 0.009028638015577248}. Best is trial 218 with value: 0.6659976583847056.[0m
[32m[I 2022-04-22 17:18:35,270][0m Trial 224 finished with value: 0.5994803960542174 and parameters: {'loss': 'coxph', 'learning_rate': 0.011627002059382593, 'n_estimators': 497, 'criterion': 'friedman_mse', 'min_samples_split': 10, 'min_samples_leaf': 3, 'min_weight_fraction_leaf': 0.07080011520554806, 'min_impurity_decrease': 0.936407831664645, 'max_features': 0.5366680766549341, 'subsample': 0.2651431177232509, 'dropout_rate': 0.2257209392949648, 'ccp_alpha': 0.22268762511175266}. Best is trial 218 with value: 0.6659976583847056.[0m
[32m[I 2022-04-22 17:19:33,079][0m Trial 225 finished with value: 0.6030215851797142 and parameters: {'loss': 'coxph', 'learning_rate': 0.011940517913583875, 'n_estimators': 493, 'criterion': 'friedman_mse', 'min_samples_split': 10, 'min_samples_leaf': 3, 'min_weight_fraction_leaf': 0.09464523284292367, 'min_impurity_decrease': 0.9205723670192196, 'max_features': 0.5295329221364956, 'subsample': 0.2749529493943731, 'dropout_rate': 0.23913584341455676, 'ccp_alpha': 0.18588620307379}. Best is trial 218 with value: 0.6659976583847056.[0m
[32m[I 2022-04-22 17:20:43,802][0m Trial 226 finished with value: 0.651961352392495 and parameters: {'loss': 'coxph', 'learning_rate': 0.009410250801394028, 'n_estimators': 536, 'criterion': 'friedman_mse', 'min_samples_split': 10, 'min_samples_leaf': 4, 'min_weight_fraction_leaf': 0.07238556279302753, 'min_impurity_decrease': 0.8995927756234643, 'max_features': 0.502190778461128, 'subsample': 0.3032028001154569, 'dropout_rate': 0.2278396864052519, 'ccp_alpha': 0.09822556763677225}. Best is trial 218 with value: 0.6659976583847056.[0m
/media/san2_ssd/data/Workdir/survival/venv/lib/python3.8/site-packages/sksurv/ensemble/boosting.py:955: RuntimeWarning: divide by zero encountered in log
  time = numpy.log(time)
/media/san2_ssd/data/Workdir/survival/venv/lib/python3.8/site-packages/sksurv/ensemble/boosting.py:955: RuntimeWarning: divide by zero encountered in log
  time = numpy.log(time)
/media/san2_ssd/data/Workdir/survival/venv/lib/python3.8/site-packages/sksurv/ensemble/boosting.py:955: RuntimeWarning: divide by zero encountered in log
  time = numpy.log(time)
/media/san2_ssd/data/Workdir/survival/venv/lib/python3.8/site-packages/sksurv/ensemble/boosting.py:955: RuntimeWarning: divide by zero encountered in log
  time = numpy.log(time)
[32m[I 2022-04-22 17:20:58,811][0m Trial 227 finished with value: -0.733181558328746 and parameters: {'loss': 'squared', 'learning_rate': 0.009197146612269303, 'n_estimators': 564, 'criterion': 'friedman_mse', 'min_samples_split': 10, 'min_samples_leaf': 4, 'min_weight_fraction_leaf': 0.07051004978136996, 'min_impurity_decrease': 0.9038718732105102, 'max_features': 0.5191116546742705, 'subsample': 0.24449080934973508, 'dropout_rate': 0.24968292779932638, 'ccp_alpha': 0.1722349546926268}. Best is trial 218 with value: 0.6659976583847056.[0m
[32m[I 2022-04-22 17:21:59,139][0m Trial 228 finished with value: 0.656238977806076 and parameters: {'loss': 'coxph', 'learning_rate': 0.017732301151120154, 'n_estimators': 500, 'criterion': 'friedman_mse', 'min_samples_split': 10, 'min_samples_leaf': 3, 'min_weight_fraction_leaf': 0.07471787704692802, 'min_impurity_decrease': 0.9560490549471681, 'max_features': 0.4979520902142695, 'subsample': 0.23657823173971054, 'dropout_rate': 0.22479479666243318, 'ccp_alpha': 0.08944471030121502}. Best is trial 218 with value: 0.6659976583847056.[0m
[32m[I 2022-04-22 17:22:59,698][0m Trial 229 finished with value: 0.5006540204610004 and parameters: {'loss': 'coxph', 'learning_rate': 0.01972050848539104, 'n_estimators': 498, 'criterion': 'friedman_mse', 'min_samples_split': 10, 'min_samples_leaf': 3, 'min_weight_fraction_leaf': 0.11115165686335682, 'min_impurity_decrease': 0.9399159546313905, 'max_features': 0.501031599141867, 'subsample': 0.2997641219036768, 'dropout_rate': 0.22102434627889306, 'ccp_alpha': 0.291174748793438}. Best is trial 218 with value: 0.6659976583847056.[0m
[32m[I 2022-04-22 17:24:03,407][0m Trial 230 finished with value: 0.6469838507591705 and parameters: {'loss': 'coxph', 'learning_rate': 0.010720915106485717, 'n_estimators': 530, 'criterion': 'friedman_mse', 'min_samples_split': 10, 'min_samples_leaf': 3, 'min_weight_fraction_leaf': 0.07538282536242023, 'min_impurity_decrease': 0.9141184736778857, 'max_features': 0.551059602234056, 'subsample': 0.24845813205094397, 'dropout_rate': 0.2594784620980008, 'ccp_alpha': 0.11193529807255748}. Best is trial 218 with value: 0.6659976583847056.[0m
[32m[I 2022-04-22 17:25:02,593][0m Trial 231 finished with value: 0.6603750269325666 and parameters: {'loss': 'coxph', 'learning_rate': 0.014082820313364606, 'n_estimators': 478, 'criterion': 'friedman_mse', 'min_samples_split': 10, 'min_samples_leaf': 3, 'min_weight_fraction_leaf': 0.09159143499085275, 'min_impurity_decrease': 0.9666678217446807, 'max_features': 0.49375614082768293, 'subsample': 0.32238461500808796, 'dropout_rate': 0.23146557437917217, 'ccp_alpha': 0.011450060575086398}. Best is trial 218 with value: 0.6659976583847056.[0m
[32m[I 2022-04-22 17:25:57,291][0m Trial 232 finished with value: 0.6514413438303679 and parameters: {'loss': 'coxph', 'learning_rate': 0.014625631233065478, 'n_estimators': 480, 'criterion': 'friedman_mse', 'min_samples_split': 10, 'min_samples_leaf': 4, 'min_weight_fraction_leaf': 0.09365699297280297, 'min_impurity_decrease': 0.9625089850201352, 'max_features': 0.49633171482972893, 'subsample': 0.3145997233001794, 'dropout_rate': 0.23483927503403157, 'ccp_alpha': 0.09959811374235777}. Best is trial 218 with value: 0.6659976583847056.[0m
[32m[I 2022-04-22 17:26:51,294][0m Trial 233 finished with value: 0.6392857607375928 and parameters: {'loss': 'coxph', 'learning_rate': 0.015260767321519026, 'n_estimators': 477, 'criterion': 'friedman_mse', 'min_samples_split': 10, 'min_samples_leaf': 4, 'min_weight_fraction_leaf': 0.09364703007509181, 'min_impurity_decrease': 0.9648787780520046, 'max_features': 0.4922589094021652, 'subsample': 0.31114174945149103, 'dropout_rate': 0.23230255212300785, 'ccp_alpha': 0.11053241946188105}. Best is trial 218 with value: 0.6659976583847056.[0m
[32m[I 2022-04-22 17:28:06,947][0m Trial 234 finished with value: 0.6092959110186491 and parameters: {'loss': 'coxph', 'learning_rate': 0.007896971583285064, 'n_estimators': 567, 'criterion': 'friedman_mse', 'min_samples_split': 10, 'min_samples_leaf': 3, 'min_weight_fraction_leaf': 0.07720670006908117, 'min_impurity_decrease': 0.9567562242906775, 'max_features': 0.5284648641758855, 'subsample': 0.2821744544231143, 'dropout_rate': 0.23061113244139983, 'ccp_alpha': 0.20964590092728635}. Best is trial 218 with value: 0.6659976583847056.[0m
[32m[I 2022-04-22 17:29:08,601][0m Trial 235 finished with value: 0.6559914725512489 and parameters: {'loss': 'coxph', 'learning_rate': 0.013510228226341169, 'n_estimators': 507, 'criterion': 'friedman_mse', 'min_samples_split': 10, 'min_samples_leaf': 4, 'min_weight_fraction_leaf': 0.10373700217484326, 'min_impurity_decrease': 0.9329320116696525, 'max_features': 0.5056677041549441, 'subsample': 0.22971894972864856, 'dropout_rate': 0.26371117998675186, 'ccp_alpha': 0.08012631073166827}. Best is trial 218 with value: 0.6659976583847056.[0m
[32m[I 2022-04-22 17:30:19,150][0m Trial 236 finished with value: 0.6568856593363781 and parameters: {'loss': 'coxph', 'learning_rate': 0.013294723045383152, 'n_estimators': 537, 'criterion': 'friedman_mse', 'min_samples_split': 10, 'min_samples_leaf': 4, 'min_weight_fraction_leaf': 0.1103192602153307, 'min_impurity_decrease': 0.9798939935591113, 'max_features': 0.5032166496208418, 'subsample': 0.32791802305170886, 'dropout_rate': 0.25975742505645677, 'ccp_alpha': 0.0016420977231801307}. Best is trial 218 with value: 0.6659976583847056.[0m
[32m[I 2022-04-22 17:31:25,802][0m Trial 237 finished with value: 0.6535389153484384 and parameters: {'loss': 'coxph', 'learning_rate': 0.01334476352080045, 'n_estimators': 538, 'criterion': 'friedman_mse', 'min_samples_split': 10, 'min_samples_leaf': 4, 'min_weight_fraction_leaf': 0.10754660530230538, 'min_impurity_decrease': 0.9710646634943976, 'max_features': 0.5044004890611157, 'subsample': 0.23472121966414528, 'dropout_rate': 0.3124408101798593, 'ccp_alpha': 0.006191606291693877}. Best is trial 218 with value: 0.6659976583847056.[0m
[32m[I 2022-04-22 17:32:29,778][0m Trial 238 finished with value: 0.5803920573495199 and parameters: {'loss': 'coxph', 'learning_rate': 0.013195592543151082, 'n_estimators': 538, 'criterion': 'friedman_mse', 'min_samples_split': 10, 'min_samples_leaf': 4, 'min_weight_fraction_leaf': 0.11523223589313354, 'min_impurity_decrease': 0.9299343925551642, 'max_features': 0.5116897000011739, 'subsample': 0.36289006601176876, 'dropout_rate': 0.27644701268915234, 'ccp_alpha': 0.19447141972084697}. Best is trial 218 with value: 0.6659976583847056.[0m
[32m[I 2022-04-22 17:33:19,809][0m Trial 239 finished with value: 0.6531217333608158 and parameters: {'loss': 'coxph', 'learning_rate': 0.021211726171868363, 'n_estimators': 482, 'criterion': 'friedman_mse', 'min_samples_split': 10, 'min_samples_leaf': 4, 'min_weight_fraction_leaf': 0.10848136355258708, 'min_impurity_decrease': 0.9998555732190849, 'max_features': 0.5451200550636143, 'subsample': 0.2593688843267756, 'dropout_rate': 0.31883634842986974, 'ccp_alpha': 0.08647083138082508}. Best is trial 218 with value: 0.6659976583847056.[0m
[32m[I 2022-04-22 17:34:08,333][0m Trial 240 finished with value: 0.548129588481702 and parameters: {'loss': 'coxph', 'learning_rate': 0.02516711697898237, 'n_estimators': 480, 'criterion': 'friedman_mse', 'min_samples_split': 10, 'min_samples_leaf': 4, 'min_weight_fraction_leaf': 0.10299723401452733, 'min_impurity_decrease': 0.9795939491335044, 'max_features': 0.5481191087658853, 'subsample': 0.2653185084386261, 'dropout_rate': 0.32019376754211004, 'ccp_alpha': 0.274219909208799}. Best is trial 218 with value: 0.6659976583847056.[0m
[32m[I 2022-04-22 17:35:05,836][0m Trial 241 finished with value: 0.6549790390064494 and parameters: {'loss': 'coxph', 'learning_rate': 0.01738333030369082, 'n_estimators': 514, 'criterion': 'friedman_mse', 'min_samples_split': 10, 'min_samples_leaf': 4, 'min_weight_fraction_leaf': 0.13291675198279151, 'min_impurity_decrease': 0.9995366266101801, 'max_features': 0.49748245500420274, 'subsample': 0.23753460249677671, 'dropout_rate': 0.3065548277576309, 'ccp_alpha': 0.09161885399347736}. Best is trial 218 with value: 0.6659976583847056.[0m
[32m[I 2022-04-22 17:36:10,299][0m Trial 242 finished with value: 0.6521669505582652 and parameters: {'loss': 'coxph', 'learning_rate': 0.016153866774523327, 'n_estimators': 521, 'criterion': 'friedman_mse', 'min_samples_split': 10, 'min_samples_leaf': 4, 'min_weight_fraction_leaf': 0.13376230315035925, 'min_impurity_decrease': 0.9925710788498013, 'max_features': 0.5008125994767557, 'subsample': 0.24289678724317998, 'dropout_rate': 0.29037153214029543, 'ccp_alpha': 0.002070529513430411}. Best is trial 218 with value: 0.6659976583847056.[0m
[32m[I 2022-04-22 17:37:12,751][0m Trial 243 finished with value: 0.6509483354883675 and parameters: {'loss': 'coxph', 'learning_rate': 0.018431546146453686, 'n_estimators': 523, 'criterion': 'friedman_mse', 'min_samples_split': 10, 'min_samples_leaf': 4, 'min_weight_fraction_leaf': 0.13459858898570937, 'min_impurity_decrease': 0.989712613710958, 'max_features': 0.5244306517058244, 'subsample': 0.23501536917517374, 'dropout_rate': 0.29371843246614254, 'ccp_alpha': 0.0020246118100587813}. Best is trial 218 with value: 0.6659976583847056.[0m
[32m[I 2022-04-22 17:38:12,893][0m Trial 244 finished with value: 0.6533642883027617 and parameters: {'loss': 'coxph', 'learning_rate': 0.010422895416943011, 'n_estimators': 509, 'criterion': 'friedman_mse', 'min_samples_split': 10, 'min_samples_leaf': 4, 'min_weight_fraction_leaf': 0.11807672553759607, 'min_impurity_decrease': 0.9464240194796231, 'max_features': 0.5128852238326516, 'subsample': 0.24500752555978075, 'dropout_rate': 0.2589972918788264, 'ccp_alpha': 0.0858593896826919}. Best is trial 218 with value: 0.6659976583847056.[0m
[32m[I 2022-04-22 17:39:22,355][0m Trial 245 finished with value: 0.6494997547861455 and parameters: {'loss': 'coxph', 'learning_rate': 0.00961918480566533, 'n_estimators': 550, 'criterion': 'friedman_mse', 'min_samples_split': 10, 'min_samples_leaf': 4, 'min_weight_fraction_leaf': 0.13257609524109104, 'min_impurity_decrease': 0.9949245969693377, 'max_features': 0.5131697043218022, 'subsample': 0.2551591966537248, 'dropout_rate': 0.2582125194008779, 'ccp_alpha': 0.09159451884139952}. Best is trial 218 with value: 0.6659976583847056.[0m
[32m[I 2022-04-22 17:40:17,466][0m Trial 246 finished with value: 0.6288661584707145 and parameters: {'loss': 'coxph', 'learning_rate': 0.012645412674471817, 'n_estimators': 506, 'criterion': 'friedman_mse', 'min_samples_split': 10, 'min_samples_leaf': 4, 'min_weight_fraction_leaf': 0.11075593663272423, 'min_impurity_decrease': 0.9477075982459171, 'max_features': 0.5394911260879196, 'subsample': 0.2311559245945855, 'dropout_rate': 0.2983223079398465, 'ccp_alpha': 0.1772605269548201}. Best is trial 218 with value: 0.6659976583847056.[0m
[32m[I 2022-04-22 17:41:07,036][0m Trial 247 finished with value: 0.6452800347679576 and parameters: {'loss': 'coxph', 'learning_rate': 0.01687326116265258, 'n_estimators': 468, 'criterion': 'friedman_mse', 'min_samples_split': 10, 'min_samples_leaf': 4, 'min_weight_fraction_leaf': 0.12423718820945855, 'min_impurity_decrease': 0.9802096607170817, 'max_features': 0.4918523000220046, 'subsample': 0.33002446689674786, 'dropout_rate': 0.3120311907549638, 'ccp_alpha': 0.08458279872931684}. Best is trial 218 with value: 0.6659976583847056.[0m
[32m[I 2022-04-22 17:42:23,064][0m Trial 248 finished with value: 0.6508741113626788 and parameters: {'loss': 'coxph', 'learning_rate': 0.00795930277503083, 'n_estimators': 578, 'criterion': 'friedman_mse', 'min_samples_split': 10, 'min_samples_leaf': 4, 'min_weight_fraction_leaf': 0.10483392433871724, 'min_impurity_decrease': 0.928954573223318, 'max_features': 0.5106089133688773, 'subsample': 0.28449984309647636, 'dropout_rate': 0.26836002766796696, 'ccp_alpha': 0.09767013498795568}. Best is trial 218 with value: 0.6659976583847056.[0m
[32m[I 2022-04-22 17:43:23,140][0m Trial 249 finished with value: 0.564957587124969 and parameters: {'loss': 'coxph', 'learning_rate': 0.011273642310703429, 'n_estimators': 514, 'criterion': 'friedman_mse', 'min_samples_split': 10, 'min_samples_leaf': 4, 'min_weight_fraction_leaf': 0.1510923765090004, 'min_impurity_decrease': 0.9714622224154579, 'max_features': 0.49207102035781786, 'subsample': 0.2486019595941047, 'dropout_rate': 0.24429733788893435, 'ccp_alpha': 0.2308535063177346}. Best is trial 218 with value: 0.6659976583847056.[0m
[32m[I 2022-04-22 17:44:33,624][0m Trial 250 finished with value: 0.6552278938011995 and parameters: {'loss': 'coxph', 'learning_rate': 0.022497531940193858, 'n_estimators': 541, 'criterion': 'friedman_mse', 'min_samples_split': 10, 'min_samples_leaf': 3, 'min_weight_fraction_leaf': 0.08936261116318066, 'min_impurity_decrease': 0.9484416793552687, 'max_features': 0.5277553165704458, 'subsample': 0.2326357601998051, 'dropout_rate': 0.2571755870179548, 'ccp_alpha': 0.011524281575407094}. Best is trial 218 with value: 0.6659976583847056.[0m
[32m[I 2022-04-22 17:45:44,721][0m Trial 251 finished with value: 0.6563190732992362 and parameters: {'loss': 'coxph', 'learning_rate': 0.018112390956425486, 'n_estimators': 550, 'criterion': 'friedman_mse', 'min_samples_split': 10, 'min_samples_leaf': 4, 'min_weight_fraction_leaf': 0.0888324819416574, 'min_impurity_decrease': 0.9994684518740806, 'max_features': 0.5993652579272822, 'subsample': 0.2305689871409161, 'dropout_rate': 0.27156881062167815, 'ccp_alpha': 0.0037755604046380217}. Best is trial 218 with value: 0.6659976583847056.[0m
[32m[I 2022-04-22 17:46:37,704][0m Trial 252 finished with value: 0.6587803242298956 and parameters: {'loss': 'coxph', 'learning_rate': 0.022139123284859143, 'n_estimators': 459, 'criterion': 'friedman_mse', 'min_samples_split': 10, 'min_samples_leaf': 3, 'min_weight_fraction_leaf': 0.08618142068191767, 'min_impurity_decrease': 0.945084200613708, 'max_features': 0.605552018658925, 'subsample': 0.2246697000929136, 'dropout_rate': 0.2662969452039419, 'ccp_alpha': 0.014527443518708907}. Best is trial 218 with value: 0.6659976583847056.[0m
[32m[I 2022-04-22 17:47:28,074][0m Trial 253 finished with value: 0.6182234926672676 and parameters: {'loss': 'coxph', 'learning_rate': 0.025463125133573468, 'n_estimators': 458, 'criterion': 'friedman_mse', 'min_samples_split': 10, 'min_samples_leaf': 3, 'min_weight_fraction_leaf': 0.091812223535293, 'min_impurity_decrease': 0.9521643442275105, 'max_features': 0.5561274341894772, 'subsample': 0.22156586729147332, 'dropout_rate': 0.25685562574151505, 'ccp_alpha': 0.18754448808161514}. Best is trial 218 with value: 0.6659976583847056.[0m
[32m[I 2022-04-22 17:48:25,572][0m Trial 254 finished with value: 0.6575817481309386 and parameters: {'loss': 'coxph', 'learning_rate': 0.03662712689608212, 'n_estimators': 493, 'criterion': 'friedman_mse', 'min_samples_split': 10, 'min_samples_leaf': 3, 'min_weight_fraction_leaf': 0.10074982503643513, 'min_impurity_decrease': 0.9417264442762872, 'max_features': 0.6057858488573121, 'subsample': 0.2172203961522341, 'dropout_rate': 0.27612374217845087, 'ccp_alpha': 0.010173282451404581}. Best is trial 218 with value: 0.6659976583847056.[0m
[32m[I 2022-04-22 17:49:24,066][0m Trial 255 finished with value: 0.6577558016862359 and parameters: {'loss': 'coxph', 'learning_rate': 0.03627161227668067, 'n_estimators': 498, 'criterion': 'friedman_mse', 'min_samples_split': 10, 'min_samples_leaf': 3, 'min_weight_fraction_leaf': 0.10541953728313272, 'min_impurity_decrease': 0.9465330079731105, 'max_features': 0.5788416060408101, 'subsample': 0.26660839361225525, 'dropout_rate': 0.2745521588269155, 'ccp_alpha': 0.004020725393474649}. Best is trial 218 with value: 0.6659976583847056.[0m
[32m[I 2022-04-22 17:50:17,170][0m Trial 256 finished with value: 0.6209614966873995 and parameters: {'loss': 'coxph', 'learning_rate': 0.041384200131328285, 'n_estimators': 491, 'criterion': 'friedman_mse', 'min_samples_split': 10, 'min_samples_leaf': 3, 'min_weight_fraction_leaf': 0.10693636974734874, 'min_impurity_decrease': 0.9434309328880169, 'max_features': 0.6021393635219452, 'subsample': 0.26305773125313536, 'dropout_rate': 0.2759130937165975, 'ccp_alpha': 0.17820825809740276}. Best is trial 218 with value: 0.6659976583847056.[0m
[32m[I 2022-04-22 17:51:25,121][0m Trial 257 finished with value: 0.6548672457599437 and parameters: {'loss': 'coxph', 'learning_rate': 0.019851451806963107, 'n_estimators': 551, 'criterion': 'friedman_mse', 'min_samples_split': 10, 'min_samples_leaf': 3, 'min_weight_fraction_leaf': 0.08698403987400932, 'min_impurity_decrease': 0.9697425810455266, 'max_features': 0.5799046063712308, 'subsample': 0.22512630097926953, 'dropout_rate': 0.3153547312779557, 'ccp_alpha': 0.004215576621506359}. Best is trial 218 with value: 0.6659976583847056.[0m
/media/san2_ssd/data/Workdir/survival/venv/lib/python3.8/site-packages/sksurv/ensemble/boosting.py:955: RuntimeWarning: divide by zero encountered in log
  time = numpy.log(time)
/media/san2_ssd/data/Workdir/survival/venv/lib/python3.8/site-packages/sksurv/ensemble/boosting.py:955: RuntimeWarning: divide by zero encountered in log
  time = numpy.log(time)
/media/san2_ssd/data/Workdir/survival/venv/lib/python3.8/site-packages/sksurv/ensemble/boosting.py:955: RuntimeWarning: divide by zero encountered in log
  time = numpy.log(time)
/media/san2_ssd/data/Workdir/survival/venv/lib/python3.8/site-packages/sksurv/ensemble/boosting.py:955: RuntimeWarning: divide by zero encountered in log
  time = numpy.log(time)
