[32m[I 2022-04-21 14:41:37,174][0m Trial 295 finished with value: 0.25 and parameters: {'loss': 'coxph', 'learning_rate': 0.003918742847600929, 'n_estimators': 118, 'criterion': 'absolute_error', 'min_samples_split': 3, 'min_samples_leaf': 2, 'min_weight_fraction_leaf': 0.08674288127746922, 'min_impurity_decrease': 0.44318773231775516, 'max_features': 0.6594995578622951, 'subsample': 0.2625601298049174, 'dropout_rate': 0.9044404766401772, 'ccp_alpha': 0.16744349976194695}. Best is trial 290 with value: 0.8297644701144975.[0m
[32m[I 2022-04-21 14:41:44,605][0m Trial 296 finished with value: 0.8130504428154511 and parameters: {'loss': 'coxph', 'learning_rate': 0.001916511269223154, 'n_estimators': 128, 'criterion': 'friedman_mse', 'min_samples_split': 3, 'min_samples_leaf': 3, 'min_weight_fraction_leaf': 0.05688416265592856, 'min_impurity_decrease': 0.3755902230146131, 'max_features': 0.6977221792556054, 'subsample': 0.2921049625402882, 'dropout_rate': 0.8658646541287399, 'ccp_alpha': 0.14714683999354838}. Best is trial 290 with value: 0.8297644701144975.[0m
[32m[I 2022-04-21 14:41:49,152][0m Trial 297 finished with value: 0.8258760881580693 and parameters: {'loss': 'coxph', 'learning_rate': 0.006248209682606513, 'n_estimators': 136, 'criterion': 'friedman_mse', 'min_samples_split': 3, 'min_samples_leaf': 2, 'min_weight_fraction_leaf': 0.07640556350615453, 'min_impurity_decrease': 0.4176558025884104, 'max_features': 0.679647561916742, 'subsample': 0.3319224767904395, 'dropout_rate': 0.9394999339268999, 'ccp_alpha': 0.005632436795515297}. Best is trial 290 with value: 0.8297644701144975.[0m
[32m[I 2022-04-21 14:41:53,396][0m Trial 298 finished with value: 0.8256208274924542 and parameters: {'loss': 'coxph', 'learning_rate': 0.006306197343089201, 'n_estimators': 139, 'criterion': 'friedman_mse', 'min_samples_split': 3, 'min_samples_leaf': 2, 'min_weight_fraction_leaf': 0.07774778416242768, 'min_impurity_decrease': 0.40756792015368176, 'max_features': 0.6469285517316645, 'subsample': 0.3249486321704993, 'dropout_rate': 0.9476766982586584, 'ccp_alpha': 0.0021979179373120892}. Best is trial 290 with value: 0.8297644701144975.[0m
[32m[I 2022-04-21 14:41:58,194][0m Trial 299 finished with value: 0.25 and parameters: {'loss': 'coxph', 'learning_rate': 0.008155423267666854, 'n_estimators': 135, 'criterion': 'friedman_mse', 'min_samples_split': 5, 'min_samples_leaf': 2, 'min_weight_fraction_leaf': 0.08719301312209772, 'min_impurity_decrease': 0.38389444105471615, 'max_features': 0.6757545044076065, 'subsample': 0.34136715406397944, 'dropout_rate': 0.9145833889956838, 'ccp_alpha': 0.27512801437319856}. Best is trial 290 with value: 0.8297644701144975.[0m
[32m[I 2022-04-21 14:42:03,812][0m Trial 300 finished with value: 0.8233536931710626 and parameters: {'loss': 'coxph', 'learning_rate': 0.004498583944179311, 'n_estimators': 142, 'criterion': 'friedman_mse', 'min_samples_split': 3, 'min_samples_leaf': 2, 'min_weight_fraction_leaf': 0.05387652588021936, 'min_impurity_decrease': 0.439469448042196, 'max_features': 0.7369093826735895, 'subsample': 0.31074485301480764, 'dropout_rate': 0.932233298109828, 'ccp_alpha': 0.11840914543549524}. Best is trial 290 with value: 0.8297644701144975.[0m
[32m[I 2022-04-21 14:42:07,952][0m Trial 301 finished with value: 0.7005243632568379 and parameters: {'loss': 'coxph', 'learning_rate': 0.0031571983235374793, 'n_estimators': 129, 'criterion': 'friedman_mse', 'min_samples_split': 3, 'min_samples_leaf': 2, 'min_weight_fraction_leaf': 0.06980052393045738, 'min_impurity_decrease': 0.3594301203147307, 'max_features': 0.5994116631273746, 'subsample': 0.2602383438210071, 'dropout_rate': 0.9057020001267888, 'ccp_alpha': 0.18383059793609918}. Best is trial 290 with value: 0.8297644701144975.[0m
[32m[I 2022-04-21 14:42:10,313][0m Trial 302 finished with value: 0.8264837199333241 and parameters: {'loss': 'coxph', 'learning_rate': 0.004779534402436929, 'n_estimators': 111, 'criterion': 'friedman_mse', 'min_samples_split': 3, 'min_samples_leaf': 2, 'min_weight_fraction_leaf': 0.09157366117353646, 'min_impurity_decrease': 0.4190305711712906, 'max_features': 0.6874297671642968, 'subsample': 0.30013398970850885, 'dropout_rate': 0.9543460620988854, 'ccp_alpha': 0.001120509566824919}. Best is trial 290 with value: 0.8297644701144975.[0m
[32m[I 2022-04-21 14:42:12,696][0m Trial 303 finished with value: 0.8151607250799764 and parameters: {'loss': 'coxph', 'learning_rate': 0.004726111244629871, 'n_estimators': 111, 'criterion': 'friedman_mse', 'min_samples_split': 3, 'min_samples_leaf': 2, 'min_weight_fraction_leaf': 0.09044734919867861, 'min_impurity_decrease': 0.3955490742998441, 'max_features': 0.7090007386607559, 'subsample': 0.3068171927931397, 'dropout_rate': 0.9724234659751585, 'ccp_alpha': 0.1345061841246904}. Best is trial 290 with value: 0.8297644701144975.[0m
[32m[I 2022-04-21 14:42:26,933][0m Trial 304 finished with value: 0.8282215105337871 and parameters: {'loss': 'coxph', 'learning_rate': 0.003592184714302322, 'n_estimators': 275, 'criterion': 'friedman_mse', 'min_samples_split': 3, 'min_samples_leaf': 2, 'min_weight_fraction_leaf': 0.08322190694458534, 'min_impurity_decrease': 0.4445038436456407, 'max_features': 0.6615305829710578, 'subsample': 0.2903056690707075, 'dropout_rate': 0.8620017312501995, 'ccp_alpha': 0.0017145766247107074}. Best is trial 290 with value: 0.8297644701144975.[0m
[32m[I 2022-04-21 14:42:43,410][0m Trial 305 finished with value: 0.25 and parameters: {'loss': 'coxph', 'learning_rate': 0.0038494793068533932, 'n_estimators': 307, 'criterion': 'friedman_mse', 'min_samples_split': 3, 'min_samples_leaf': 3, 'min_weight_fraction_leaf': 0.0936003089139054, 'min_impurity_decrease': 0.44086835792768503, 'max_features': 0.6394324899941373, 'subsample': 0.24969134077163804, 'dropout_rate': 0.8782242919630737, 'ccp_alpha': 0.37376299422554526}. Best is trial 290 with value: 0.8297644701144975.[0m
[32m[I 2022-04-21 14:42:55,625][0m Trial 306 finished with value: 0.26533429437348965 and parameters: {'loss': 'coxph', 'learning_rate': 0.011263208028224074, 'n_estimators': 272, 'criterion': 'friedman_mse', 'min_samples_split': 3, 'min_samples_leaf': 2, 'min_weight_fraction_leaf': 0.06737408321304955, 'min_impurity_decrease': 0.42390241672969836, 'max_features': 0.655840814068391, 'subsample': 0.2847056333602478, 'dropout_rate': 0.8572050453896898, 'ccp_alpha': 0.2736481225142757}. Best is trial 290 with value: 0.8297644701144975.[0m
[32m[I 2022-04-21 14:43:07,374][0m Trial 307 finished with value: 0.8243915105842751 and parameters: {'loss': 'coxph', 'learning_rate': 0.0034194728057657495, 'n_estimators': 211, 'criterion': 'friedman_mse', 'min_samples_split': 3, 'min_samples_leaf': 2, 'min_weight_fraction_leaf': 0.052375941573783474, 'min_impurity_decrease': 0.4427530749492143, 'max_features': 0.7261634854306502, 'subsample': 0.2647992232989135, 'dropout_rate': 0.8668089850953703, 'ccp_alpha': 0.11241120159197178}. Best is trial 290 with value: 0.8297644701144975.[0m
[32m[I 2022-04-21 14:43:09,502][0m Trial 308 finished with value: 0.49607401136220675 and parameters: {'loss': 'coxph', 'learning_rate': 0.0018271890319687253, 'n_estimators': 110, 'criterion': 'friedman_mse', 'min_samples_split': 3, 'min_samples_leaf': 2, 'min_weight_fraction_leaf': 0.0844261588031725, 'min_impurity_decrease': 0.4086099428288348, 'max_features': 0.6945732821117341, 'subsample': 0.2749524198183069, 'dropout_rate': 0.8592784997788786, 'ccp_alpha': 0.18487227191396244}. Best is trial 290 with value: 0.8297644701144975.[0m
[32m[I 2022-04-21 14:43:18,558][0m Trial 309 finished with value: 0.25 and parameters: {'loss': 'coxph', 'learning_rate': 0.004998714726406488, 'n_estimators': 253, 'criterion': 'friedman_mse', 'min_samples_split': 3, 'min_samples_leaf': 2, 'min_weight_fraction_leaf': 0.09474717863762129, 'min_impurity_decrease': 0.44523762555534824, 'max_features': 0.6663861194580489, 'subsample': 0.29720280964312196, 'dropout_rate': 0.8994227790433084, 'ccp_alpha': 2.322010550467652}. Best is trial 290 with value: 0.8297644701144975.[0m
[32m[I 2022-04-21 14:43:23,667][0m Trial 310 finished with value: 0.8224123950481573 and parameters: {'loss': 'coxph', 'learning_rate': 0.0029660062636808217, 'n_estimators': 113, 'criterion': 'friedman_mse', 'min_samples_split': 3, 'min_samples_leaf': 2, 'min_weight_fraction_leaf': 0.06879211083458045, 'min_impurity_decrease': 0.42556346887456786, 'max_features': 0.7489875555431641, 'subsample': 0.2901108546900394, 'dropout_rate': 0.924623484945311, 'ccp_alpha': 0.12058192487384119}. Best is trial 290 with value: 0.8297644701144975.[0m
[32m[I 2022-04-21 14:43:27,080][0m Trial 311 finished with value: 0.37026039651078374 and parameters: {'loss': 'coxph', 'learning_rate': 0.001860599314039148, 'n_estimators': 124, 'criterion': 'friedman_mse', 'min_samples_split': 3, 'min_samples_leaf': 3, 'min_weight_fraction_leaf': 0.0830626221541379, 'min_impurity_decrease': 0.40816403760070025, 'max_features': 0.7053729530541498, 'subsample': 0.2538573768473438, 'dropout_rate': 0.8804045723196364, 'ccp_alpha': 0.25733265992597276}. Best is trial 290 with value: 0.8297644701144975.[0m
[32m[I 2022-04-21 14:43:30,061][0m Trial 312 finished with value: 0.8234442938269995 and parameters: {'loss': 'coxph', 'learning_rate': 0.004212596524600281, 'n_estimators': 120, 'criterion': 'friedman_mse', 'min_samples_split': 3, 'min_samples_leaf': 2, 'min_weight_fraction_leaf': 0.05763890662476942, 'min_impurity_decrease': 0.3707232190902462, 'max_features': 0.7829544853789904, 'subsample': 0.24798946145450354, 'dropout_rate': 0.9563161567770824, 'ccp_alpha': 0.10304901160883462}. Best is trial 290 with value: 0.8297644701144975.[0m
[32m[I 2022-04-21 14:43:32,806][0m Trial 313 finished with value: 0.829020641512234 and parameters: {'loss': 'coxph', 'learning_rate': 0.005673433221598684, 'n_estimators': 110, 'criterion': 'friedman_mse', 'min_samples_split': 3, 'min_samples_leaf': 2, 'min_weight_fraction_leaf': 0.07601470750751792, 'min_impurity_decrease': 0.45084258600115523, 'max_features': 0.6330437875418294, 'subsample': 0.3799596817551509, 'dropout_rate': 0.9001557257372984, 'ccp_alpha': 0.0037928295577337613}. Best is trial 290 with value: 0.8297644701144975.[0m
/media/san2_ssd/data/Workdir/survival/venv/lib/python3.8/site-packages/sksurv/ensemble/boosting.py:955: RuntimeWarning: divide by zero encountered in log
  time = numpy.log(time)
/media/san2_ssd/data/Workdir/survival/venv/lib/python3.8/site-packages/sksurv/ensemble/boosting.py:955: RuntimeWarning: divide by zero encountered in log
  time = numpy.log(time)
/media/san2_ssd/data/Workdir/survival/venv/lib/python3.8/site-packages/sksurv/ensemble/boosting.py:955: RuntimeWarning: divide by zero encountered in log
  time = numpy.log(time)
/media/san2_ssd/data/Workdir/survival/venv/lib/python3.8/site-packages/sksurv/ensemble/boosting.py:955: RuntimeWarning: divide by zero encountered in log
  time = numpy.log(time)
[32m[I 2022-04-21 14:43:33,301][0m Trial 314 finished with value: -0.4661074812131198 and parameters: {'loss': 'squared', 'learning_rate': 0.006038680473027161, 'n_estimators': 109, 'criterion': 'friedman_mse', 'min_samples_split': 3, 'min_samples_leaf': 2, 'min_weight_fraction_leaf': 0.02844322483270443, 'min_impurity_decrease': 0.45096407657707727, 'max_features': 0.6155851168071758, 'subsample': 0.3960999604530762, 'dropout_rate': 0.9023569442586659, 'ccp_alpha': 0.0908751312986894}. Best is trial 290 with value: 0.8297644701144975.[0m
[32m[I 2022-04-21 14:43:37,327][0m Trial 315 finished with value: 0.8256667282604585 and parameters: {'loss': 'coxph', 'learning_rate': 0.00776422181376634, 'n_estimators': 113, 'criterion': 'friedman_mse', 'min_samples_split': 3, 'min_samples_leaf': 2, 'min_weight_fraction_leaf': 0.0693276658282748, 'min_impurity_decrease': 0.4285887933242496, 'max_features': 0.633796598604595, 'subsample': 0.35993802835307814, 'dropout_rate': 0.8555463448412811, 'ccp_alpha': 0.01555375586652102}. Best is trial 290 with value: 0.8297644701144975.[0m
[32m[I 2022-04-21 14:43:40,783][0m Trial 316 finished with value: 0.8256838255947752 and parameters: {'loss': 'coxph', 'learning_rate': 0.0037741532088844333, 'n_estimators': 109, 'criterion': 'friedman_mse', 'min_samples_split': 3, 'min_samples_leaf': 2, 'min_weight_fraction_leaf': 0.09629866900999846, 'min_impurity_decrease': 0.40301810694692713, 'max_features': 0.7319070571750584, 'subsample': 0.3274970644780855, 'dropout_rate': 0.8805593402004029, 'ccp_alpha': 0.0070629673728145395}. Best is trial 290 with value: 0.8297644701144975.[0m
[32m[I 2022-04-21 14:43:44,459][0m Trial 317 finished with value: 0.25 and parameters: {'loss': 'coxph', 'learning_rate': 0.0031594360452386616, 'n_estimators': 113, 'criterion': 'absolute_error', 'min_samples_split': 3, 'min_samples_leaf': 2, 'min_weight_fraction_leaf': 0.05903346674593711, 'min_impurity_decrease': 0.3479580932022905, 'max_features': 0.6571067528967728, 'subsample': 0.2928007876428198, 'dropout_rate': 0.9232688167649451, 'ccp_alpha': 0.20666259416062627}. Best is trial 290 with value: 0.8297644701144975.[0m
[32m[I 2022-04-21 14:43:47,045][0m Trial 318 finished with value: 0.8249046411935197 and parameters: {'loss': 'coxph', 'learning_rate': 0.005163729925693705, 'n_estimators': 116, 'criterion': 'friedman_mse', 'min_samples_split': 3, 'min_samples_leaf': 3, 'min_weight_fraction_leaf': 0.08770488332793035, 'min_impurity_decrease': 0.4440633672001124, 'max_features': 0.5646822049347633, 'subsample': 0.2727732796167751, 'dropout_rate': 0.903016288644521, 'ccp_alpha': 0.10572138713881495}. Best is trial 290 with value: 0.8297644701144975.[0m
[32m[I 2022-04-21 14:44:04,974][0m Trial 319 finished with value: 0.3815030876467311 and parameters: {'loss': 'coxph', 'learning_rate': 0.0021701245610160303, 'n_estimators': 336, 'criterion': 'friedman_mse', 'min_samples_split': 3, 'min_samples_leaf': 2, 'min_weight_fraction_leaf': 0.04823257437222859, 'min_impurity_decrease': 0.4571493396736841, 'max_features': 0.48775837866480853, 'subsample': 0.41791032713312426, 'dropout_rate': 0.8809865950187672, 'ccp_alpha': 0.19259310713607805}. Best is trial 290 with value: 0.8297644701144975.[0m
[32m[I 2022-04-21 14:44:07,851][0m Trial 320 finished with value: 0.25 and parameters: {'loss': 'coxph', 'learning_rate': 0.0027300509588334084, 'n_estimators': 128, 'criterion': 'friedman_mse', 'min_samples_split': 3, 'min_samples_leaf': 2, 'min_weight_fraction_leaf': 0.07450082664628743, 'min_impurity_decrease': 0.42092124007633686, 'max_features': 0.6983348408404818, 'subsample': 0.3154741730785084, 'dropout_rate': 0.9360518255255713, 'ccp_alpha': 0.35382950678297753}. Best is trial 290 with value: 0.8297644701144975.[0m
[32m[I 2022-04-21 14:44:12,273][0m Trial 321 finished with value: 0.8218568055585507 and parameters: {'loss': 'coxph', 'learning_rate': 0.0042465556471689, 'n_estimators': 120, 'criterion': 'friedman_mse', 'min_samples_split': 3, 'min_samples_leaf': 4, 'min_weight_fraction_leaf': 0.09988391223772466, 'min_impurity_decrease': 0.3836732440739943, 'max_features': 0.743695092388657, 'subsample': 0.2931198215985162, 'dropout_rate': 0.860623184384556, 'ccp_alpha': 0.09940136012301276}. Best is trial 290 with value: 0.8297644701144975.[0m
[32m[I 2022-04-21 14:44:16,057][0m Trial 322 finished with value: 0.2503270102305002 and parameters: {'loss': 'coxph', 'learning_rate': 0.007075806240506512, 'n_estimators': 109, 'criterion': 'friedman_mse', 'min_samples_split': 3, 'min_samples_leaf': 2, 'min_weight_fraction_leaf': 0.06509573294024351, 'min_impurity_decrease': 0.40172015998738303, 'max_features': 0.6045645822091595, 'subsample': 0.33972278774870696, 'dropout_rate': 0.8986700117517603, 'ccp_alpha': 0.2501260824758134}. Best is trial 290 with value: 0.8297644701144975.[0m
[32m[I 2022-04-21 14:44:19,711][0m Trial 323 finished with value: 0.8257929314031115 and parameters: {'loss': 'coxph', 'learning_rate': 0.002156352851892026, 'n_estimators': 116, 'criterion': 'friedman_mse', 'min_samples_split': 3, 'min_samples_leaf': 2, 'min_weight_fraction_leaf': 0.08384773630531812, 'min_impurity_decrease': 0.4264679514341264, 'max_features': 0.6858964531810168, 'subsample': 0.24321155626572258, 'dropout_rate': 0.9160955238675919, 'ccp_alpha': 0.01051478490563396}. Best is trial 290 with value: 0.8297644701144975.[0m
[32m[I 2022-04-21 14:44:24,536][0m Trial 324 finished with value: 0.8292859225620299 and parameters: {'loss': 'coxph', 'learning_rate': 0.0032286166482822843, 'n_estimators': 123, 'criterion': 'friedman_mse', 'min_samples_split': 3, 'min_samples_leaf': 2, 'min_weight_fraction_leaf': 0.07451474857998305, 'min_impurity_decrease': 0.4554497825024388, 'max_features': 0.6444560248771706, 'subsample': 0.2688229140207414, 'dropout_rate': 0.8768888802371285, 'ccp_alpha': 0.001720390896999562}. Best is trial 290 with value: 0.8297644701144975.[0m
[32m[I 2022-04-21 14:44:29,425][0m Trial 325 finished with value: 0.25 and parameters: {'loss': 'coxph', 'learning_rate': 0.005256398283094135, 'n_estimators': 127, 'criterion': 'friedman_mse', 'min_samples_split': 3, 'min_samples_leaf': 3, 'min_weight_fraction_leaf': 0.052388378187903824, 'min_impurity_decrease': 0.45967529725965517, 'max_features': 0.6460292433714651, 'subsample': 0.26661752791105703, 'dropout_rate': 0.8502973970683945, 'ccp_alpha': 1.3251160639739656}. Best is trial 290 with value: 0.8297644701144975.[0m
[32m[I 2022-04-21 14:44:33,193][0m Trial 326 finished with value: 0.8234585427389597 and parameters: {'loss': 'coxph', 'learning_rate': 0.0027629974223983157, 'n_estimators': 124, 'criterion': 'friedman_mse', 'min_samples_split': 3, 'min_samples_leaf': 2, 'min_weight_fraction_leaf': 0.09249416995834372, 'min_impurity_decrease': 0.4536595162837421, 'max_features': 0.6321797680742635, 'subsample': 0.27041005552586, 'dropout_rate': 0.9547735913312061, 'ccp_alpha': 0.10404809404811875}. Best is trial 290 with value: 0.8297644701144975.[0m
[32m[I 2022-04-21 14:44:36,536][0m Trial 327 finished with value: 0.38469125586836633 and parameters: {'loss': 'coxph', 'learning_rate': 0.001738937067194043, 'n_estimators': 132, 'criterion': 'friedman_mse', 'min_samples_split': 3, 'min_samples_leaf': 2, 'min_weight_fraction_leaf': 0.06402573693622877, 'min_impurity_decrease': 0.4378169406645787, 'max_features': 0.784475999686482, 'subsample': 0.2885622849020481, 'dropout_rate': 0.888941740507434, 'ccp_alpha': 0.19460534413337177}. Best is trial 290 with value: 0.8297644701144975.[0m
[32m[I 2022-04-21 14:44:40,858][0m Trial 328 finished with value: 0.8252702422420111 and parameters: {'loss': 'coxph', 'learning_rate': 0.0039613783760878065, 'n_estimators': 108, 'criterion': 'friedman_mse', 'min_samples_split': 3, 'min_samples_leaf': 2, 'min_weight_fraction_leaf': 0.07881124497493257, 'min_impurity_decrease': 0.4108585292346647, 'max_features': 0.6627353010802323, 'subsample': 0.24130687065359455, 'dropout_rate': 0.9230889982334634, 'ccp_alpha': 0.01044857813584356}. Best is trial 290 with value: 0.8297644701144975.[0m
[32m[I 2022-04-21 14:44:45,671][0m Trial 329 finished with value: 0.802583856233498 and parameters: {'loss': 'coxph', 'learning_rate': 0.00892845252757109, 'n_estimators': 122, 'criterion': 'friedman_mse', 'min_samples_split': 3, 'min_samples_leaf': 2, 'min_weight_fraction_leaf': 0.02172251678875731, 'min_impurity_decrease': 0.46326578089658754, 'max_features': 0.7694505606909605, 'subsample': 0.3729373673593072, 'dropout_rate': 0.9012214536981624, 'ccp_alpha': 0.12210614833589775}. Best is trial 290 with value: 0.8297644701144975.[0m
[32m[I 2022-04-21 14:44:49,928][0m Trial 330 finished with value: 0.2503270102305002 and parameters: {'loss': 'coxph', 'learning_rate': 0.0023464049369957534, 'n_estimators': 114, 'criterion': 'friedman_mse', 'min_samples_split': 3, 'min_samples_leaf': 2, 'min_weight_fraction_leaf': 0.040989497789270676, 'min_impurity_decrease': 0.4359636801813451, 'max_features': 0.7134028892796778, 'subsample': 0.25947955019906693, 'dropout_rate': 0.8616386216180715, 'ccp_alpha': 0.27988530256223115}. Best is trial 290 with value: 0.8297644701144975.[0m
[32m[I 2022-04-21 14:44:54,078][0m Trial 331 finished with value: 0.8279682571336604 and parameters: {'loss': 'coxph', 'learning_rate': 0.002949822900411474, 'n_estimators': 125, 'criterion': 'friedman_mse', 'min_samples_split': 3, 'min_samples_leaf': 2, 'min_weight_fraction_leaf': 0.05771776440180685, 'min_impurity_decrease': 0.3958360414545602, 'max_features': 0.6154000149980622, 'subsample': 0.29521817664053657, 'dropout_rate': 0.8723799385857411, 'ccp_alpha': 0.001823663505582945}. Best is trial 290 with value: 0.8297644701144975.[0m
