[32m[I 2022-04-21 11:43:14,356][0m Trial 907 finished with value: 0.8087976880537863 and parameters: {'splitter': 'best', 'min_samples_split': 0.07141496384431648, 'min_samples_leaf': 0.001043143961249141, 'min_weight_fraction_leaf': 0.016208949931954653, 'max_features': 0.5563800821020616}. Best is trial 691 with value: 0.8340697555858835.[0m
[32m[I 2022-04-21 11:43:14,477][0m Trial 908 finished with value: 0.8142973418937551 and parameters: {'splitter': 'random', 'min_samples_split': 0.11018982115821421, 'min_samples_leaf': 0.018704215636395523, 'min_weight_fraction_leaf': 0.00014203795135550416, 'max_features': 0.6241994582097831}. Best is trial 691 with value: 0.8340697555858835.[0m
[32m[I 2022-04-21 11:43:14,752][0m Trial 909 finished with value: 0.8089273936013732 and parameters: {'splitter': 'best', 'min_samples_split': 0.2149458803559392, 'min_samples_leaf': 0.025249971474111836, 'min_weight_fraction_leaf': 0.049721887316021174, 'max_features': 0.391501837263077}. Best is trial 691 with value: 0.8340697555858835.[0m
[32m[I 2022-04-21 11:43:15,054][0m Trial 910 finished with value: 0.8148887803757716 and parameters: {'splitter': 'best', 'min_samples_split': 0.13007341558527505, 'min_samples_leaf': 0.012203703863338668, 'min_weight_fraction_leaf': 0.02427163208950644, 'max_features': 0.4217355856143071}. Best is trial 691 with value: 0.8340697555858835.[0m
[32m[I 2022-04-21 11:43:15,447][0m Trial 911 finished with value: 0.8054043913696912 and parameters: {'splitter': 'best', 'min_samples_split': 0.10322299795846394, 'min_samples_leaf': 0.03609378803209501, 'min_weight_fraction_leaf': 0.01567562876845278, 'max_features': 0.4955512915521611}. Best is trial 691 with value: 0.8340697555858835.[0m
/media/san2_ssd/data/Workdir/survival/utils.py:305: RuntimeWarning: invalid value encountered in true_divide
  pdfs = np.gradient(1-survs,axis=1)/norms
[32m[I 2022-04-21 11:43:15,939][0m Trial 912 finished with value: 0.8062355702670724 and parameters: {'splitter': 'best', 'min_samples_split': 0.08179170814606145, 'min_samples_leaf': 0.023457193954928852, 'min_weight_fraction_leaf': 0.04031016250321712, 'max_features': 0.6624779275905127}. Best is trial 691 with value: 0.8340697555858835.[0m
/media/san2_ssd/data/Workdir/survival/utils.py:305: RuntimeWarning: invalid value encountered in true_divide
  pdfs = np.gradient(1-survs,axis=1)/norms
[32m[I 2022-04-21 11:43:16,272][0m Trial 913 finished with value: 0.8129758649153906 and parameters: {'splitter': 'best', 'min_samples_split': 0.11948924820417373, 'min_samples_leaf': 0.010089245124667735, 'min_weight_fraction_leaf': 0.00019769953702512139, 'max_features': 0.16961124289311869}. Best is trial 691 with value: 0.8340697555858835.[0m
[32m[I 2022-04-21 11:43:16,503][0m Trial 914 finished with value: 0.6841288176587561 and parameters: {'splitter': 'best', 'min_samples_split': 0.09333518275377863, 'min_samples_leaf': 0.02029144158995859, 'min_weight_fraction_leaf': 0.2187185135406306, 'max_features': 0.5335419145071152}. Best is trial 691 with value: 0.8340697555858835.[0m
/media/san2_ssd/data/Workdir/survival/utils.py:305: RuntimeWarning: invalid value encountered in true_divide
  pdfs = np.gradient(1-survs,axis=1)/norms
[32m[I 2022-04-21 11:43:16,883][0m Trial 915 finished with value: 0.8158103883158319 and parameters: {'splitter': 'best', 'min_samples_split': 0.10830307233736816, 'min_samples_leaf': 0.032091605171842084, 'min_weight_fraction_leaf': 0.029989784130494804, 'max_features': 0.6044660322848859}. Best is trial 691 with value: 0.8340697555858835.[0m
[32m[I 2022-04-21 11:43:17,111][0m Trial 916 finished with value: 0.8053210012577194 and parameters: {'splitter': 'best', 'min_samples_split': 0.14163002280697928, 'min_samples_leaf': 0.061046340089118065, 'min_weight_fraction_leaf': 0.011043482418078164, 'max_features': 0.4801955266101538}. Best is trial 691 with value: 0.8340697555858835.[0m
[32m[I 2022-04-21 11:43:17,687][0m Trial 917 finished with value: 0.8108634212630695 and parameters: {'splitter': 'best', 'min_samples_split': 0.1253291938797094, 'min_samples_leaf': 0.008645846222009538, 'min_weight_fraction_leaf': 0.021564908133664976, 'max_features': 0.4627606241710805}. Best is trial 691 with value: 0.8340697555858835.[0m
[32m[I 2022-04-21 11:43:18,073][0m Trial 918 finished with value: 0.8155377039623056 and parameters: {'splitter': 'best', 'min_samples_split': 0.15568108599097824, 'min_samples_leaf': 0.046210682211537145, 'min_weight_fraction_leaf': 0.014539647937974493, 'max_features': 0.40861146345747684}. Best is trial 691 with value: 0.8340697555858835.[0m
[32m[I 2022-04-21 11:43:18,417][0m Trial 919 finished with value: 0.7994244507971309 and parameters: {'splitter': 'best', 'min_samples_split': 0.09771997511189287, 'min_samples_leaf': 0.01521365634182741, 'min_weight_fraction_leaf': 0.010134928166821513, 'max_features': 0.38655684393676404}. Best is trial 691 with value: 0.8340697555858835.[0m
[32m[I 2022-04-21 11:43:18,556][0m Trial 920 finished with value: 0.8067690397902124 and parameters: {'splitter': 'random', 'min_samples_split': 0.17985023651931617, 'min_samples_leaf': 0.02614048464133161, 'min_weight_fraction_leaf': 0.0001585736387470192, 'max_features': 0.43364716231469413}. Best is trial 691 with value: 0.8340697555858835.[0m
[32m[I 2022-04-21 11:43:19,120][0m Trial 921 finished with value: 0.8139109324481663 and parameters: {'splitter': 'best', 'min_samples_split': 0.08124114780243866, 'min_samples_leaf': 0.001497719542269002, 'min_weight_fraction_leaf': 0.033527446895973215, 'max_features': 0.5833277212630074}. Best is trial 691 with value: 0.8340697555858835.[0m
[32m[I 2022-04-21 11:43:19,590][0m Trial 922 finished with value: 0.8124730297109013 and parameters: {'splitter': 'best', 'min_samples_split': 0.1100073977960009, 'min_samples_leaf': 0.016977746060908162, 'min_weight_fraction_leaf': 0.025191216505151284, 'max_features': 0.50916688306364}. Best is trial 691 with value: 0.8340697555858835.[0m
[32m[I 2022-04-21 11:43:19,773][0m Trial 923 finished with value: 0.7900912709631142 and parameters: {'splitter': 'best', 'min_samples_split': 0.11891667842938097, 'min_samples_leaf': 0.22074603943904242, 'min_weight_fraction_leaf': 0.016636279521434427, 'max_features': 0.5587655182834042}. Best is trial 691 with value: 0.8340697555858835.[0m
[32m[I 2022-04-21 11:43:20,065][0m Trial 924 finished with value: 0.8045878451242785 and parameters: {'splitter': 'best', 'min_samples_split': 0.07189639733582362, 'min_samples_leaf': 0.03861332997468116, 'min_weight_fraction_leaf': 0.00826560521742631, 'max_features': 0.44209730567368916}. Best is trial 691 with value: 0.8340697555858835.[0m
[32m[I 2022-04-21 11:43:20,525][0m Trial 925 finished with value: 0.8017684149862607 and parameters: {'splitter': 'best', 'min_samples_split': 0.089406375267348, 'min_samples_leaf': 0.009522489119696912, 'min_weight_fraction_leaf': 0.022064852428525718, 'max_features': 0.36957393939233213}. Best is trial 691 with value: 0.8340697555858835.[0m
[32m[I 2022-04-21 11:43:21,267][0m Trial 926 finished with value: 0.8088477934615078 and parameters: {'splitter': 'best', 'min_samples_split': 0.14366553156061174, 'min_samples_leaf': 0.027717146052242028, 'min_weight_fraction_leaf': 0.055989604665297815, 'max_features': 0.41443374028297814}. Best is trial 691 with value: 0.8340697555858835.[0m
[32m[I 2022-04-21 11:43:22,136][0m Trial 927 finished with value: 0.8065625418612618 and parameters: {'splitter': 'best', 'min_samples_split': 0.12901369476291044, 'min_samples_leaf': 0.017048540231416456, 'min_weight_fraction_leaf': 0.04073914279977463, 'max_features': 0.5385251965477388}. Best is trial 691 with value: 0.8340697555858835.[0m
/media/san2_ssd/data/Workdir/survival/utils.py:305: RuntimeWarning: invalid value encountered in true_divide
  pdfs = np.gradient(1-survs,axis=1)/norms
[32m[I 2022-04-21 11:43:23,166][0m Trial 928 finished with value: 0.8131717857820326 and parameters: {'splitter': 'best', 'min_samples_split': 0.10209587265283096, 'min_samples_leaf': 0.010010580254616354, 'min_weight_fraction_leaf': 0.00838716590517825, 'max_features': 0.46869519287224404}. Best is trial 691 with value: 0.8340697555858835.[0m
[32m[I 2022-04-21 11:43:23,696][0m Trial 929 finished with value: 0.8098165558685173 and parameters: {'splitter': 'best', 'min_samples_split': 0.16689759224807837, 'min_samples_leaf': 0.03262896676649303, 'min_weight_fraction_leaf': 0.0302385031614345, 'max_features': 0.6082672602156738}. Best is trial 691 with value: 0.8340697555858835.[0m
[32m[I 2022-04-21 11:43:23,990][0m Trial 930 finished with value: 0.8145345280043743 and parameters: {'splitter': 'best', 'min_samples_split': 0.11460467091969478, 'min_samples_leaf': 0.05339982255914876, 'min_weight_fraction_leaf': 0.00012149885303824187, 'max_features': 0.4022898782249371}. Best is trial 691 with value: 0.8340697555858835.[0m
[32m[I 2022-04-21 11:43:24,129][0m Trial 931 finished with value: 0.8129839783231148 and parameters: {'splitter': 'random', 'min_samples_split': 0.13776434251864775, 'min_samples_leaf': 0.1284451261084259, 'min_weight_fraction_leaf': 0.016104110402636325, 'max_features': 0.5686717057566257}. Best is trial 691 with value: 0.8340697555858835.[0m
/media/san2_ssd/data/Workdir/survival/utils.py:305: RuntimeWarning: invalid value encountered in true_divide
  pdfs = np.gradient(1-survs,axis=1)/norms
/media/san2_ssd/data/Workdir/survival/utils.py:305: RuntimeWarning: invalid value encountered in true_divide
  pdfs = np.gradient(1-survs,axis=1)/norms
[32m[I 2022-04-21 11:43:24,569][0m Trial 932 finished with value: 0.8159277823079709 and parameters: {'splitter': 'best', 'min_samples_split': 0.09239409223763566, 'min_samples_leaf': 0.024240558339328838, 'min_weight_fraction_leaf': 0.00811503718073301, 'max_features': 0.5175903917284935}. Best is trial 691 with value: 0.8340697555858835.[0m
/media/san2_ssd/data/Workdir/survival/utils.py:305: RuntimeWarning: invalid value encountered in true_divide
  pdfs = np.gradient(1-survs,axis=1)/norms
[32m[I 2022-04-21 11:43:25,107][0m Trial 933 finished with value: 0.8174858145226283 and parameters: {'splitter': 'best', 'min_samples_split': 0.1553943210798232, 'min_samples_leaf': 0.013624912816397272, 'min_weight_fraction_leaf': 0.02271602144124357, 'max_features': 0.4495435426548238}. Best is trial 691 with value: 0.8340697555858835.[0m
[32m[I 2022-04-21 11:43:25,563][0m Trial 934 finished with value: 0.8098607133166762 and parameters: {'splitter': 'best', 'min_samples_split': 0.1021382799555038, 'min_samples_leaf': 0.03921332246986112, 'min_weight_fraction_leaf': 0.009114611991482101, 'max_features': 0.4943959973010673}. Best is trial 691 with value: 0.8340697555858835.[0m
[32m[I 2022-04-21 11:43:25,793][0m Trial 935 finished with value: 0.7015480818003701 and parameters: {'splitter': 'best', 'min_samples_split': 0.08121467807985348, 'min_samples_leaf': 0.0089980971436034, 'min_weight_fraction_leaf': 0.17897807990982936, 'max_features': 0.42608720904594144}. Best is trial 691 with value: 0.8340697555858835.[0m
[32m[I 2022-04-21 11:43:26,059][0m Trial 936 finished with value: 0.8115539338544057 and parameters: {'splitter': 'best', 'min_samples_split': 0.12372222306295073, 'min_samples_leaf': 0.023887302732474462, 'min_weight_fraction_leaf': 0.03643141758358297, 'max_features': 0.3806672726395532}. Best is trial 691 with value: 0.8340697555858835.[0m
[32m[I 2022-04-21 11:43:26,202][0m Trial 937 finished with value: 0.8066937468912723 and parameters: {'splitter': 'best', 'min_samples_split': 0.0719091989275514, 'min_samples_leaf': 0.15100638953209292, 'min_weight_fraction_leaf': 0.01689696828243205, 'max_features': 0.5992318014338749}. Best is trial 691 with value: 0.8340697555858835.[0m
[32m[I 2022-04-21 11:43:26,487][0m Trial 938 finished with value: 0.8020035506423288 and parameters: {'splitter': 'best', 'min_samples_split': 0.11295088868891909, 'min_samples_leaf': 0.00897608451346774, 'min_weight_fraction_leaf': 0.02770165609805461, 'max_features': 0.36413730434693253}. Best is trial 691 with value: 0.8340697555858835.[0m
[32m[I 2022-04-21 11:43:26,646][0m Trial 939 finished with value: 0.5491011968859408 and parameters: {'splitter': 'best', 'min_samples_split': 0.09300109185306053, 'min_samples_leaf': 0.02077131884084105, 'min_weight_fraction_leaf': 0.48714600166277194, 'max_features': 0.5450554722976765}. Best is trial 691 with value: 0.8340697555858835.[0m
[32m[I 2022-04-21 11:43:26,814][0m Trial 940 finished with value: 0.572315614132625 and parameters: {'splitter': 'best', 'min_samples_split': 0.13224774812024312, 'min_samples_leaf': 0.0018660114072855116, 'min_weight_fraction_leaf': 0.32202720997545065, 'max_features': 0.4589600498540851}. Best is trial 691 with value: 0.8340697555858835.[0m
[32m[I 2022-04-21 11:43:27,198][0m Trial 941 finished with value: 0.8203888201418753 and parameters: {'splitter': 'best', 'min_samples_split': 0.18953462644441532, 'min_samples_leaf': 0.03261674760756728, 'min_weight_fraction_leaf': 8.805477400743167e-05, 'max_features': 0.619479122909508}. Best is trial 691 with value: 0.8340697555858835.[0m
[32m[I 2022-04-21 11:43:27,329][0m Trial 942 finished with value: 0.4660693107389731 and parameters: {'splitter': 'random', 'min_samples_split': 0.14872896483997977, 'min_samples_leaf': 0.3313784124323146, 'min_weight_fraction_leaf': 0.01886162020251329, 'max_features': 0.6409794650453886}. Best is trial 691 with value: 0.8340697555858835.[0m
[32m[I 2022-04-21 11:43:28,060][0m Trial 943 finished with value: 0.8148523529024561 and parameters: {'splitter': 'best', 'min_samples_split': 0.010157604798304017, 'min_samples_leaf': 0.0012192596514035798, 'min_weight_fraction_leaf': 0.046639752748130994, 'max_features': 0.40272395429008395}. Best is trial 691 with value: 0.8340697555858835.[0m
/media/san2_ssd/data/Workdir/survival/utils.py:305: RuntimeWarning: invalid value encountered in true_divide
  pdfs = np.gradient(1-survs,axis=1)/norms
[32m[I 2022-04-21 11:43:28,623][0m Trial 944 finished with value: 0.8213327703646633 and parameters: {'splitter': 'best', 'min_samples_split': 0.10197312975833134, 'min_samples_leaf': 0.017513841298226866, 'min_weight_fraction_leaf': 0.009985922233061625, 'max_features': 0.4284002289328448}. Best is trial 691 with value: 0.8340697555858835.[0m
[32m[I 2022-04-21 11:43:28,875][0m Trial 945 finished with value: 0.8147999007206405 and parameters: {'splitter': 'best', 'min_samples_split': 0.11855155291146847, 'min_samples_leaf': 0.047294332232032416, 'min_weight_fraction_leaf': 0.0290684224196759, 'max_features': 0.5262640762712942}. Best is trial 691 with value: 0.8340697555858835.[0m
/media/san2_ssd/data/Workdir/survival/utils.py:305: RuntimeWarning: invalid value encountered in true_divide
  pdfs = np.gradient(1-survs,axis=1)/norms
/media/san2_ssd/data/Workdir/survival/utils.py:305: RuntimeWarning: invalid value encountered in true_divide
  pdfs = np.gradient(1-survs,axis=1)/norms
[32m[I 2022-04-21 11:43:29,443][0m Trial 946 finished with value: 0.7976050860265993 and parameters: {'splitter': 'best', 'min_samples_split': 0.08376100350629583, 'min_samples_leaf': 0.0013400992614879155, 'min_weight_fraction_leaf': 0.008362918594913107, 'max_features': 0.4816310614788934}. Best is trial 691 with value: 0.8340697555858835.[0m
[32m[I 2022-04-21 11:43:29,770][0m Trial 947 finished with value: 0.8186529462985437 and parameters: {'splitter': 'best', 'min_samples_split': 0.105433502758622, 'min_samples_leaf': 0.030625450103442482, 'min_weight_fraction_leaf': 0.016093190202590497, 'max_features': 0.5859757115124368}. Best is trial 691 with value: 0.8340697555858835.[0m
[32m[I 2022-04-21 11:43:30,065][0m Trial 948 finished with value: 0.8065943387052761 and parameters: {'splitter': 'best', 'min_samples_split': 0.1414522654718511, 'min_samples_leaf': 0.01668603148163842, 'min_weight_fraction_leaf': 0.023819222031476198, 'max_features': 0.3905990226498623}. Best is trial 691 with value: 0.8340697555858835.[0m
/media/san2_ssd/data/Workdir/survival/utils.py:305: RuntimeWarning: invalid value encountered in true_divide
  pdfs = np.gradient(1-survs,axis=1)/norms
[32m[I 2022-04-21 11:43:30,310][0m Trial 949 finished with value: 0.8056878802939735 and parameters: {'splitter': 'best', 'min_samples_split': 0.07048976168727228, 'min_samples_leaf': 0.0263682273775859, 'min_weight_fraction_leaf': 0.008236685036113701, 'max_features': 0.35844244251812635}. Best is trial 691 with value: 0.8340697555858835.[0m
[32m[I 2022-04-21 11:43:30,759][0m Trial 950 finished with value: 0.8154963961844649 and parameters: {'splitter': 'best', 'min_samples_split': 0.1260870368072012, 'min_samples_leaf': 0.010097244354295595, 'min_weight_fraction_leaf': 0.0378504979584853, 'max_features': 0.4427180248809516}. Best is trial 691 with value: 0.8340697555858835.[0m
[32m[I 2022-04-21 11:43:31,063][0m Trial 951 finished with value: 0.7096106719846094 and parameters: {'splitter': 'best', 'min_samples_split': 0.1630909105730275, 'min_samples_leaf': 0.018424477308356606, 'min_weight_fraction_leaf': 0.12063464876530072, 'max_features': 0.41889169728761316}. Best is trial 691 with value: 0.8340697555858835.[0m
[32m[I 2022-04-21 11:43:31,324][0m Trial 952 finished with value: 0.8076933688726993 and parameters: {'splitter': 'best', 'min_samples_split': 0.09136557324467903, 'min_samples_leaf': 0.04128636380883046, 'min_weight_fraction_leaf': 0.01979807250646735, 'max_features': 0.5694786375261913}. Best is trial 691 with value: 0.8340697555858835.[0m
[32m[I 2022-04-21 11:43:31,482][0m Trial 953 finished with value: 0.8049394707462614 and parameters: {'splitter': 'random', 'min_samples_split': 0.17371407468754715, 'min_samples_leaf': 0.0013213547982584284, 'min_weight_fraction_leaf': 0.008134882399986033, 'max_features': 0.5008127505500359}. Best is trial 691 with value: 0.8340697555858835.[0m
/media/san2_ssd/data/Workdir/survival/utils.py:305: RuntimeWarning: invalid value encountered in true_divide
  pdfs = np.gradient(1-survs,axis=1)/norms
[32m[I 2022-04-21 11:43:31,804][0m Trial 954 finished with value: 0.8062876699605394 and parameters: {'splitter': 'best', 'min_samples_split': 0.11151673060099161, 'min_samples_leaf': 0.0229568784832926, 'min_weight_fraction_leaf': 0.0001375879861102412, 'max_features': 0.47712213120458075}. Best is trial 691 with value: 0.8340697555858835.[0m
[32m[I 2022-04-21 11:43:32,090][0m Trial 955 finished with value: 0.8056461949313645 and parameters: {'splitter': 'best', 'min_samples_split': 0.0985631275186111, 'min_samples_leaf': 0.035354052228829376, 'min_weight_fraction_leaf': 0.02983222774815126, 'max_features': 0.5509833345916503}. Best is trial 691 with value: 0.8340697555858835.[0m
[32m[I 2022-04-21 11:43:32,411][0m Trial 956 finished with value: 0.8097137102808493 and parameters: {'splitter': 'best', 'min_samples_split': 0.079326254967735, 'min_samples_leaf': 0.010183719333283813, 'min_weight_fraction_leaf': 0.01685497909560119, 'max_features': 0.3786744418517665}. Best is trial 691 with value: 0.8340697555858835.[0m
[32m[I 2022-04-21 11:43:32,497][0m Trial 957 finished with value: 0.47310948437849526 and parameters: {'splitter': 'best', 'min_samples_split': 0.11744370088463521, 'min_samples_leaf': 0.47160675142071906, 'min_weight_fraction_leaf': 0.015726010223340903, 'max_features': 0.40329395961906817}. Best is trial 691 with value: 0.8340697555858835.[0m
/media/san2_ssd/data/Workdir/survival/utils.py:305: RuntimeWarning: invalid value encountered in true_divide
  pdfs = np.gradient(1-survs,axis=1)/norms
[32m[I 2022-04-21 11:43:32,892][0m Trial 958 finished with value: 0.8136473874749566 and parameters: {'splitter': 'best', 'min_samples_split': 0.14723860710216372, 'min_samples_leaf': 0.01542300418372011, 'min_weight_fraction_leaf': 0.008991401354960552, 'max_features': 0.4554229421106974}. Best is trial 691 with value: 0.8340697555858835.[0m
[32m[I 2022-04-21 11:43:33,186][0m Trial 959 finished with value: 0.8047873395970042 and parameters: {'splitter': 'best', 'min_samples_split': 0.13358215115600441, 'min_samples_leaf': 0.06456869605406827, 'min_weight_fraction_leaf': 0.03069580288991427, 'max_features': 0.5241243834011448}. Best is trial 691 with value: 0.8340697555858835.[0m
[32m[I 2022-04-21 11:43:33,675][0m Trial 960 finished with value: 0.8141100097801381 and parameters: {'splitter': 'best', 'min_samples_split': 0.08748850317138171, 'min_samples_leaf': 0.027717815458576624, 'min_weight_fraction_leaf': 0.04623249926605119, 'max_features': 0.8327708696726487}. Best is trial 691 with value: 0.8340697555858835.[0m
[32m[I 2022-04-21 11:43:33,774][0m Trial 961 finished with value: 0.5650822463647891 and parameters: {'splitter': 'best', 'min_samples_split': 0.37837745605604833, 'min_samples_leaf': 0.3162956583774941, 'min_weight_fraction_leaf': 0.023969870150094406, 'max_features': 0.4271122200839509}. Best is trial 691 with value: 0.8340697555858835.[0m
/media/san2_ssd/data/Workdir/survival/utils.py:305: RuntimeWarning: invalid value encountered in true_divide
  pdfs = np.gradient(1-survs,axis=1)/norms
/media/san2_ssd/data/Workdir/survival/utils.py:305: RuntimeWarning: invalid value encountered in true_divide
  pdfs = np.gradient(1-survs,axis=1)/norms
[32m[I 2022-04-21 11:43:34,515][0m Trial 962 finished with value: 0.8139238018472905 and parameters: {'splitter': 'best', 'min_samples_split': 0.10203833702819637, 'min_samples_leaf': 0.010022251712059067, 'min_weight_fraction_leaf': 0.00843745858078546, 'max_features': 0.4941192286688512}. Best is trial 691 with value: 0.8340697555858835.[0m
