[32m[I 2022-04-21 11:37:02,649][0m Trial 63 finished with value: 0.8017552549732356 and parameters: {'splitter': 'best', 'min_samples_split': 0.0704655927669707, 'min_samples_leaf': 0.08071992117450755, 'min_weight_fraction_leaf': 0.15942301130786812, 'max_features': 0.8705917628529891}. Best is trial 48 with value: 0.8120167347509565.[0m
[32m[I 2022-04-21 11:37:02,838][0m Trial 64 finished with value: 0.802916843500898 and parameters: {'splitter': 'best', 'min_samples_split': 0.0137073201011123, 'min_samples_leaf': 0.13439604082961115, 'min_weight_fraction_leaf': 0.11640632497314109, 'max_features': 0.9432477547834871}. Best is trial 48 with value: 0.8120167347509565.[0m
[32m[I 2022-04-21 11:37:03,035][0m Trial 65 finished with value: 0.7998507477597078 and parameters: {'splitter': 'best', 'min_samples_split': 0.05193827162824737, 'min_samples_leaf': 0.1362307081260577, 'min_weight_fraction_leaf': 0.07276906634251279, 'max_features': 0.9403292266983747}. Best is trial 48 with value: 0.8120167347509565.[0m
[32m[I 2022-04-21 11:37:03,262][0m Trial 66 finished with value: 0.8041104073159794 and parameters: {'splitter': 'best', 'min_samples_split': 0.020729768823779495, 'min_samples_leaf': 0.10054269662084744, 'min_weight_fraction_leaf': 0.11871690791366481, 'max_features': 0.968505317854758}. Best is trial 48 with value: 0.8120167347509565.[0m
[32m[I 2022-04-21 11:37:03,609][0m Trial 67 finished with value: 0.8026589246483397 and parameters: {'splitter': 'best', 'min_samples_split': 0.026497963006962073, 'min_samples_leaf': 0.10248035087898046, 'min_weight_fraction_leaf': 0.03875342764158539, 'max_features': 0.9145975147064306}. Best is trial 48 with value: 0.8120167347509565.[0m
[32m[I 2022-04-21 11:37:03,799][0m Trial 68 finished with value: 0.6743350097870714 and parameters: {'splitter': 'best', 'min_samples_split': 0.0949099658785981, 'min_samples_leaf': 0.07657170459761872, 'min_weight_fraction_leaf': 0.29347234967295976, 'max_features': 0.9642369077564757}. Best is trial 48 with value: 0.8120167347509565.[0m
[32m[I 2022-04-21 11:37:04,227][0m Trial 69 finished with value: 0.6936262001752912 and parameters: {'splitter': 'best', 'min_samples_split': 0.052113902070404436, 'min_samples_leaf': 0.013668999427388334, 'min_weight_fraction_leaf': 0.2001445545983801, 'max_features': 0.9939052046216836}. Best is trial 48 with value: 0.8120167347509565.[0m
[32m[I 2022-04-21 11:37:04,506][0m Trial 70 finished with value: 0.8054845130646126 and parameters: {'splitter': 'best', 'min_samples_split': 0.20498586887168024, 'min_samples_leaf': 0.05735329095408928, 'min_weight_fraction_leaf': 0.05292877197500097, 'max_features': 0.8949361617288458}. Best is trial 48 with value: 0.8120167347509565.[0m
[32m[I 2022-04-21 11:37:04,907][0m Trial 71 finished with value: 0.806382078602965 and parameters: {'splitter': 'best', 'min_samples_split': 0.20375546743818906, 'min_samples_leaf': 0.05698264535772585, 'min_weight_fraction_leaf': 0.05627654924551825, 'max_features': 0.8881605122912081}. Best is trial 48 with value: 0.8120167347509565.[0m
[32m[I 2022-04-21 11:37:05,198][0m Trial 72 finished with value: 0.8012903656715679 and parameters: {'splitter': 'best', 'min_samples_split': 0.2168399724337252, 'min_samples_leaf': 0.05263699644743865, 'min_weight_fraction_leaf': 0.05198496911461047, 'max_features': 0.8875419564498838}. Best is trial 48 with value: 0.8120167347509565.[0m
[32m[I 2022-04-21 11:37:05,546][0m Trial 73 finished with value: 0.8099674177082642 and parameters: {'splitter': 'best', 'min_samples_split': 0.19049844569968827, 'min_samples_leaf': 0.06077394371919091, 'min_weight_fraction_leaf': 0.026241852915844223, 'max_features': 0.9155049296808211}. Best is trial 48 with value: 0.8120167347509565.[0m
/media/san2_ssd/data/Workdir/survival/utils.py:305: RuntimeWarning: invalid value encountered in true_divide
  pdfs = np.gradient(1-survs,axis=1)/norms
[32m[I 2022-04-21 11:37:06,041][0m Trial 74 finished with value: 0.8120407147636118 and parameters: {'splitter': 'best', 'min_samples_split': 0.20071614983632302, 'min_samples_leaf': 0.0206430194870596, 'min_weight_fraction_leaf': 0.02381714965151005, 'max_features': 0.9701360468325563}. Best is trial 74 with value: 0.8120407147636118.[0m
[32m[I 2022-04-21 11:37:06,514][0m Trial 75 finished with value: 0.8144749653797488 and parameters: {'splitter': 'best', 'min_samples_split': 0.1915218594610225, 'min_samples_leaf': 0.022762821422902677, 'min_weight_fraction_leaf': 0.028511445479733943, 'max_features': 0.9259164959373236}. Best is trial 75 with value: 0.8144749653797488.[0m
[32m[I 2022-04-21 11:37:07,268][0m Trial 76 finished with value: 0.7105989120981311 and parameters: {'splitter': 'best', 'min_samples_split': 0.1739573837666942, 'min_samples_leaf': 0.02364356124583393, 'min_weight_fraction_leaf': 0.02181551373275873, 'max_features': 0.9996240917129817}. Best is trial 75 with value: 0.8144749653797488.[0m
[32m[I 2022-04-21 11:37:08,063][0m Trial 77 finished with value: 0.8065989164765949 and parameters: {'splitter': 'best', 'min_samples_split': 0.24367778377820315, 'min_samples_leaf': 0.0023319977761810697, 'min_weight_fraction_leaf': 0.04078863695312812, 'max_features': 0.9199736784604964}. Best is trial 75 with value: 0.8144749653797488.[0m
[32m[I 2022-04-21 11:37:08,830][0m Trial 78 finished with value: 0.7118100138322422 and parameters: {'splitter': 'best', 'min_samples_split': 0.24780236045926443, 'min_samples_leaf': 0.0013759348457195765, 'min_weight_fraction_leaf': 0.016018492216248483, 'max_features': 0.9248299010006625}. Best is trial 75 with value: 0.8144749653797488.[0m
[32m[I 2022-04-21 11:37:09,241][0m Trial 79 finished with value: 0.8100131500992609 and parameters: {'splitter': 'best', 'min_samples_split': 0.17309927361806346, 'min_samples_leaf': 0.04214679116067718, 'min_weight_fraction_leaf': 0.0385903070066472, 'max_features': 0.8672887522914325}. Best is trial 75 with value: 0.8144749653797488.[0m
[32m[I 2022-04-21 11:37:09,795][0m Trial 80 finished with value: 0.8077605391894032 and parameters: {'splitter': 'best', 'min_samples_split': 0.17628665366930116, 'min_samples_leaf': 0.017674077831855546, 'min_weight_fraction_leaf': 0.03008011858058535, 'max_features': 0.9151231540725665}. Best is trial 75 with value: 0.8144749653797488.[0m
[32m[I 2022-04-21 11:37:10,198][0m Trial 81 finished with value: 0.8156887432675266 and parameters: {'splitter': 'best', 'min_samples_split': 0.17421067626420444, 'min_samples_leaf': 0.018224530757805914, 'min_weight_fraction_leaf': 0.034965299358768465, 'max_features': 0.8580183058961891}. Best is trial 81 with value: 0.8156887432675266.[0m
[32m[I 2022-04-21 11:37:10,871][0m Trial 82 finished with value: 0.8199891815076967 and parameters: {'splitter': 'best', 'min_samples_split': 0.1662212567257665, 'min_samples_leaf': 0.02032587224898303, 'min_weight_fraction_leaf': 0.0004316300112643043, 'max_features': 0.9678459903633372}. Best is trial 82 with value: 0.8199891815076967.[0m
[32m[I 2022-04-21 11:37:11,334][0m Trial 83 finished with value: 0.8021768296956753 and parameters: {'splitter': 'best', 'min_samples_split': 0.16175154338469025, 'min_samples_leaf': 0.041857846381163084, 'min_weight_fraction_leaf': 0.0015689579089218017, 'max_features': 0.8663048337066779}. Best is trial 82 with value: 0.8199891815076967.[0m
[32m[I 2022-04-21 11:37:12,032][0m Trial 84 finished with value: 0.8010738877928321 and parameters: {'splitter': 'best', 'min_samples_split': 0.12375657403066859, 'min_samples_leaf': 0.0323989555740862, 'min_weight_fraction_leaf': 0.0754807526061796, 'max_features': 0.9678133030413762}. Best is trial 82 with value: 0.8199891815076967.[0m
[32m[I 2022-04-21 11:37:12,610][0m Trial 85 finished with value: 0.8127457608749001 and parameters: {'splitter': 'best', 'min_samples_split': 0.19442810865467888, 'min_samples_leaf': 0.019145607788543562, 'min_weight_fraction_leaf': 0.029480692905839708, 'max_features': 0.9574448060691219}. Best is trial 82 with value: 0.8199891815076967.[0m
[32m[I 2022-04-21 11:37:13,136][0m Trial 86 finished with value: 0.8096817295922081 and parameters: {'splitter': 'best', 'min_samples_split': 0.1938259014757388, 'min_samples_leaf': 0.020671602092582703, 'min_weight_fraction_leaf': 0.019407115148430836, 'max_features': 0.8542380462047988}. Best is trial 82 with value: 0.8199891815076967.[0m
[32m[I 2022-04-21 11:37:13,724][0m Trial 87 finished with value: 0.8021355360818706 and parameters: {'splitter': 'best', 'min_samples_split': 0.15905933184116622, 'min_samples_leaf': 0.01894598714416731, 'min_weight_fraction_leaf': 0.04074495775421355, 'max_features': 0.9401121728363344}. Best is trial 82 with value: 0.8199891815076967.[0m
[32m[I 2022-04-21 11:37:14,258][0m Trial 88 finished with value: 0.7063059585677629 and parameters: {'splitter': 'best', 'min_samples_split': 0.23072800354049722, 'min_samples_leaf': 0.06349453502523203, 'min_weight_fraction_leaf': 0.028145255922149864, 'max_features': 0.9728921566982828}. Best is trial 82 with value: 0.8199891815076967.[0m
[32m[I 2022-04-21 11:37:14,481][0m Trial 89 finished with value: 0.813363062092128 and parameters: {'splitter': 'best', 'min_samples_split': 0.14232816402805107, 'min_samples_leaf': 0.04681558828327713, 'min_weight_fraction_leaf': 0.008873385453623577, 'max_features': 0.4463659251979273}. Best is trial 82 with value: 0.8199891815076967.[0m
[32m[I 2022-04-21 11:37:14,701][0m Trial 90 finished with value: 0.8111691635208164 and parameters: {'splitter': 'best', 'min_samples_split': 0.1448062802114063, 'min_samples_leaf': 0.04492891154031178, 'min_weight_fraction_leaf': 0.012252850105111845, 'max_features': 0.4667545826123028}. Best is trial 82 with value: 0.8199891815076967.[0m
[32m[I 2022-04-21 11:37:14,936][0m Trial 91 finished with value: 0.8106902804688396 and parameters: {'splitter': 'best', 'min_samples_split': 0.13769914475290465, 'min_samples_leaf': 0.04590742056680718, 'min_weight_fraction_leaf': 0.007771696724388936, 'max_features': 0.43688943167719935}. Best is trial 82 with value: 0.8199891815076967.[0m
[32m[I 2022-04-21 11:37:15,281][0m Trial 92 finished with value: 0.8060296137797327 and parameters: {'splitter': 'best', 'min_samples_split': 0.13674012169365193, 'min_samples_leaf': 0.01281345037575611, 'min_weight_fraction_leaf': 0.013934182738993066, 'max_features': 0.44250653936149875}. Best is trial 82 with value: 0.8199891815076967.[0m
[32m[I 2022-04-21 11:37:15,686][0m Trial 93 finished with value: 0.8079275347763257 and parameters: {'splitter': 'best', 'min_samples_split': 0.15541223388019557, 'min_samples_leaf': 0.02995299430360247, 'min_weight_fraction_leaf': 0.0017514547259218768, 'max_features': 0.36010015423361486}. Best is trial 82 with value: 0.8199891815076967.[0m
[32m[I 2022-04-21 11:37:15,920][0m Trial 94 finished with value: 0.8089069307579446 and parameters: {'splitter': 'best', 'min_samples_split': 0.11209336711138634, 'min_samples_leaf': 0.08715202178851739, 'min_weight_fraction_leaf': 0.06380741208550963, 'max_features': 0.45030089200550966}. Best is trial 82 with value: 0.8199891815076967.[0m
[32m[I 2022-04-21 11:37:16,121][0m Trial 95 finished with value: 0.8097768518024318 and parameters: {'splitter': 'best', 'min_samples_split': 0.2099079758612947, 'min_samples_leaf': 0.0730000313534091, 'min_weight_fraction_leaf': 0.014186759557801529, 'max_features': 0.3940184266815244}. Best is trial 82 with value: 0.8199891815076967.[0m
[32m[I 2022-04-21 11:37:16,417][0m Trial 96 finished with value: 0.8193170217615668 and parameters: {'splitter': 'best', 'min_samples_split': 0.18258623661395035, 'min_samples_leaf': 0.04787779880467639, 'min_weight_fraction_leaf': 0.00772175679968717, 'max_features': 0.402847019464398}. Best is trial 82 with value: 0.8199891815076967.[0m
[32m[I 2022-04-21 11:37:16,957][0m Trial 97 finished with value: 0.8059446249650677 and parameters: {'splitter': 'best', 'min_samples_split': 0.182375182388342, 'min_samples_leaf': 0.01150276419326994, 'min_weight_fraction_leaf': 0.04723957117033589, 'max_features': 0.33259829067738494}. Best is trial 82 with value: 0.8199891815076967.[0m
[32m[I 2022-04-21 11:37:17,106][0m Trial 98 finished with value: 0.8041089836442354 and parameters: {'splitter': 'best', 'min_samples_split': 0.21944320393755265, 'min_samples_leaf': 0.026648644565273327, 'min_weight_fraction_leaf': 0.08697446817071694, 'max_features': 0.2981096558661276}. Best is trial 82 with value: 0.8199891815076967.[0m
[32m[I 2022-04-21 11:37:17,163][0m Trial 99 finished with value: 0.468348556469091 and parameters: {'splitter': 'best', 'min_samples_split': 0.19595995267396152, 'min_samples_leaf': 0.4448753430150997, 'min_weight_fraction_leaf': 0.3601495782305437, 'max_features': 0.39658876393740106}. Best is trial 82 with value: 0.8199891815076967.[0m
[32m[I 2022-04-21 11:37:17,408][0m Trial 100 finished with value: 0.8052636516907329 and parameters: {'splitter': 'best', 'min_samples_split': 0.16663457186320657, 'min_samples_leaf': 0.03399831137130056, 'min_weight_fraction_leaf': 0.024942339845761788, 'max_features': 0.5238704032155043}. Best is trial 82 with value: 0.8199891815076967.[0m
[32m[I 2022-04-21 11:37:17,745][0m Trial 101 finished with value: 0.8129889378216598 and parameters: {'splitter': 'best', 'min_samples_split': 0.14564907115634135, 'min_samples_leaf': 0.04776030714292943, 'min_weight_fraction_leaf': 0.008544679273767248, 'max_features': 0.4080724666755057}. Best is trial 82 with value: 0.8199891815076967.[0m
[32m[I 2022-04-21 11:37:17,917][0m Trial 102 finished with value: 0.8100052922710969 and parameters: {'splitter': 'best', 'min_samples_split': 0.15023810721158187, 'min_samples_leaf': 0.06884542635526791, 'min_weight_fraction_leaf': 0.010172258246525172, 'max_features': 0.469203528881566}. Best is trial 82 with value: 0.8199891815076967.[0m
[32m[I 2022-04-21 11:37:18,032][0m Trial 103 finished with value: 0.5667538961089289 and parameters: {'splitter': 'best', 'min_samples_split': 0.13218624884971636, 'min_samples_leaf': 0.05058179984540158, 'min_weight_fraction_leaf': 0.47399919100000587, 'max_features': 0.5192488698338}. Best is trial 82 with value: 0.8199891815076967.[0m
[32m[I 2022-04-21 11:37:18,433][0m Trial 104 finished with value: 0.8194212857632633 and parameters: {'splitter': 'best', 'min_samples_split': 0.10171795742944192, 'min_samples_leaf': 0.008396143974840073, 'min_weight_fraction_leaf': 0.000401660221813498, 'max_features': 0.39705312870790915}. Best is trial 82 with value: 0.8199891815076967.[0m
[32m[I 2022-04-21 11:37:18,838][0m Trial 105 finished with value: 0.8252433813646162 and parameters: {'splitter': 'best', 'min_samples_split': 0.10466458024020991, 'min_samples_leaf': 0.007214707610059984, 'min_weight_fraction_leaf': 0.00045342205961474563, 'max_features': 0.4062052021059565}. Best is trial 105 with value: 0.8252433813646162.[0m
[32m[I 2022-04-21 11:37:19,107][0m Trial 106 finished with value: 0.8086357947491287 and parameters: {'splitter': 'best', 'min_samples_split': 0.10708389997286756, 'min_samples_leaf': 0.011042133797902426, 'min_weight_fraction_leaf': 0.04636865639843615, 'max_features': 0.40783164175572123}. Best is trial 105 with value: 0.8252433813646162.[0m
/media/san2_ssd/data/Workdir/survival/utils.py:305: RuntimeWarning: invalid value encountered in true_divide
  pdfs = np.gradient(1-survs,axis=1)/norms
[32m[I 2022-04-21 11:37:19,345][0m Trial 107 finished with value: 0.8171823859335638 and parameters: {'splitter': 'best', 'min_samples_split': 0.10370472078682552, 'min_samples_leaf': 0.024278733508523314, 'min_weight_fraction_leaf': 0.0009445520782180548, 'max_features': 0.37790708718633437}. Best is trial 105 with value: 0.8252433813646162.[0m
/media/san2_ssd/data/Workdir/survival/utils.py:305: RuntimeWarning: invalid value encountered in true_divide
  pdfs = np.gradient(1-survs,axis=1)/norms
/media/san2_ssd/data/Workdir/survival/utils.py:305: RuntimeWarning: invalid value encountered in true_divide
  pdfs = np.gradient(1-survs,axis=1)/norms
/media/san2_ssd/data/Workdir/survival/utils.py:305: RuntimeWarning: invalid value encountered in true_divide
  pdfs = np.gradient(1-survs,axis=1)/norms
[32m[I 2022-04-21 11:37:20,594][0m Trial 108 finished with value: 0.8175529962585181 and parameters: {'splitter': 'best', 'min_samples_split': 0.10216986087493608, 'min_samples_leaf': 0.001994648604520248, 'min_weight_fraction_leaf': 0.0016061104690824023, 'max_features': 0.2867114001978885}. Best is trial 105 with value: 0.8252433813646162.[0m
/media/san2_ssd/data/Workdir/survival/utils.py:305: RuntimeWarning: invalid value encountered in true_divide
  pdfs = np.gradient(1-survs,axis=1)/norms
/media/san2_ssd/data/Workdir/survival/utils.py:305: RuntimeWarning: invalid value encountered in true_divide
  pdfs = np.gradient(1-survs,axis=1)/norms
[32m[I 2022-04-21 11:37:21,399][0m Trial 109 finished with value: 0.8061543983656392 and parameters: {'splitter': 'best', 'min_samples_split': 0.08669505948159767, 'min_samples_leaf': 0.0034123849155868226, 'min_weight_fraction_leaf': 0.00020492381006251704, 'max_features': 0.2330700747160802}. Best is trial 105 with value: 0.8252433813646162.[0m
[32m[I 2022-04-21 11:37:21,693][0m Trial 110 finished with value: 0.8004507864589158 and parameters: {'splitter': 'best', 'min_samples_split': 0.09836454852419102, 'min_samples_leaf': 0.03072545816183335, 'min_weight_fraction_leaf': 0.032619176518466124, 'max_features': 0.2922273416620439}. Best is trial 105 with value: 0.8252433813646162.[0m
[32m[I 2022-04-21 11:37:22,195][0m Trial 111 finished with value: 0.8195303190856759 and parameters: {'splitter': 'best', 'min_samples_split': 0.11979570220054343, 'min_samples_leaf': 0.010473969121217392, 'min_weight_fraction_leaf': 0.021195630191151747, 'max_features': 0.41633532510956084}. Best is trial 105 with value: 0.8252433813646162.[0m
/media/san2_ssd/data/Workdir/survival/utils.py:305: RuntimeWarning: invalid value encountered in true_divide
  pdfs = np.gradient(1-survs,axis=1)/norms
/media/san2_ssd/data/Workdir/survival/utils.py:305: RuntimeWarning: invalid value encountered in true_divide
  pdfs = np.gradient(1-survs,axis=1)/norms
[32m[I 2022-04-21 11:37:23,018][0m Trial 112 finished with value: 0.8190131248961174 and parameters: {'splitter': 'best', 'min_samples_split': 0.12421479415804078, 'min_samples_leaf': 0.0098496719840275, 'min_weight_fraction_leaf': 0.00058855792138637, 'max_features': 0.42037336748121634}. Best is trial 105 with value: 0.8252433813646162.[0m
/media/san2_ssd/data/Workdir/survival/utils.py:305: RuntimeWarning: invalid value encountered in true_divide
  pdfs = np.gradient(1-survs,axis=1)/norms
[32m[I 2022-04-21 11:37:23,540][0m Trial 113 finished with value: 0.8162590842389872 and parameters: {'splitter': 'best', 'min_samples_split': 0.12209409450087984, 'min_samples_leaf': 0.009755721761122058, 'min_weight_fraction_leaf': 0.008853068664478589, 'max_features': 0.4148135415527287}. Best is trial 105 with value: 0.8252433813646162.[0m
[32m[I 2022-04-21 11:37:24,148][0m Trial 114 finished with value: 0.8192961828667442 and parameters: {'splitter': 'best', 'min_samples_split': 0.1262375172702047, 'min_samples_leaf': 0.0018297772041399284, 'min_weight_fraction_leaf': 0.016500998185412553, 'max_features': 0.3753188754435566}. Best is trial 105 with value: 0.8252433813646162.[0m
[32m[I 2022-04-21 11:37:24,561][0m Trial 115 finished with value: 0.8166850422460022 and parameters: {'splitter': 'best', 'min_samples_split': 0.12319855435893762, 'min_samples_leaf': 0.0011539356042805302, 'min_weight_fraction_leaf': 0.01829276249383496, 'max_features': 0.37612114007830777}. Best is trial 105 with value: 0.8252433813646162.[0m
/media/san2_ssd/data/Workdir/survival/utils.py:305: RuntimeWarning: invalid value encountered in true_divide
  pdfs = np.gradient(1-survs,axis=1)/norms
[32m[I 2022-04-21 11:37:25,030][0m Trial 116 finished with value: 0.8167020176101986 and parameters: {'splitter': 'best', 'min_samples_split': 0.12133877363830806, 'min_samples_leaf': 0.006941658936479236, 'min_weight_fraction_leaf': 0.019682910801039767, 'max_features': 0.35393121901538255}. Best is trial 105 with value: 0.8252433813646162.[0m
/media/san2_ssd/data/Workdir/survival/utils.py:305: RuntimeWarning: invalid value encountered in true_divide
  pdfs = np.gradient(1-survs,axis=1)/norms
/media/san2_ssd/data/Workdir/survival/utils.py:305: RuntimeWarning: invalid value encountered in true_divide
  pdfs = np.gradient(1-survs,axis=1)/norms
/media/san2_ssd/data/Workdir/survival/utils.py:305: RuntimeWarning: invalid value encountered in true_divide
  pdfs = np.gradient(1-survs,axis=1)/norms
[32m[I 2022-04-21 11:37:25,736][0m Trial 117 finished with value: 0.8195536242863977 and parameters: {'splitter': 'best', 'min_samples_split': 0.12086988252892483, 'min_samples_leaf': 0.005153996764411993, 'min_weight_fraction_leaf': 0.00019805351686567508, 'max_features': 0.3799751497154364}. Best is trial 105 with value: 0.8252433813646162.[0m
/media/san2_ssd/data/Workdir/survival/utils.py:305: RuntimeWarning: invalid value encountered in true_divide
  pdfs = np.gradient(1-survs,axis=1)/norms
/media/san2_ssd/data/Workdir/survival/utils.py:305: RuntimeWarning: invalid value encountered in true_divide
  pdfs = np.gradient(1-survs,axis=1)/norms
