[32m[I 2022-04-22 14:39:52,631][0m Trial 934 finished with value: 0.844631090779961 and parameters: {'n_hidden': 2048, 'mixture_components': 3, 'use_sparse_layer': True, 'use_sparse_loss': True, 'lmbd': 2.0745952871219164e-06, 'use_batchnorm': False, 'use_dropout': False, 'mlp_size_1': 7, 'mlp_size_2': 1, 'mlp_size_3': 0, 'kernel': 'Normal', 'loss_name': 'CensoredNLLLoss'}. Best is trial 468 with value: 0.8545388812039783.[0m
[32m[I 2022-04-22 14:41:07,227][0m Trial 935 finished with value: 0.8413866655312828 and parameters: {'n_hidden': 2048, 'mixture_components': 3, 'use_sparse_layer': False, 'use_batchnorm': False, 'use_dropout': False, 'mlp_size_1': 8, 'mlp_size_2': 0, 'mlp_size_3': 0, 'kernel': 'LogLogistic', 'loss_name': 'CensoredNLLLoss'}. Best is trial 468 with value: 0.8545388812039783.[0m
[32m[I 2022-04-22 14:42:10,016][0m Trial 936 finished with value: 0.8318157642664854 and parameters: {'n_hidden': 32, 'mixture_components': 3, 'use_sparse_layer': True, 'use_sparse_loss': True, 'lmbd': 6.451376667053953e-06, 'use_batchnorm': False, 'use_dropout': False, 'mlp_size_1': 2, 'mlp_size_2': 0, 'mlp_size_3': 0, 'kernel': 'LogLogistic', 'loss_name': 'CensoredNLLLoss'}. Best is trial 468 with value: 0.8545388812039783.[0m
[32m[I 2022-04-22 14:43:06,083][0m Trial 937 finished with value: 0.7415240822930651 and parameters: {'n_hidden': 2048, 'mixture_components': 2, 'use_sparse_layer': False, 'use_batchnorm': False, 'use_dropout': False, 'mlp_size_1': 7, 'mlp_size_2': 1, 'mlp_size_3': 0, 'kernel': 'LogLogistic', 'loss_name': 'CensoredNLLLoss'}. Best is trial 468 with value: 0.8545388812039783.[0m
[32m[I 2022-04-22 14:45:36,453][0m Trial 938 finished with value: 0.6158003711427644 and parameters: {'n_hidden': 2048, 'mixture_components': 3, 'use_sparse_layer': True, 'use_sparse_loss': True, 'lmbd': 5.244451099406564e-06, 'use_batchnorm': True, 'use_dropout': False, 'mlp_size_1': 7, 'mlp_size_2': 1, 'mlp_size_3': 0, 'kernel': 'Normal', 'loss_name': 'CensoredNLLLoss'}. Best is trial 468 with value: 0.8545388812039783.[0m
[32m[I 2022-04-22 14:46:41,434][0m Trial 939 finished with value: 0.7417696592158391 and parameters: {'n_hidden': 512, 'mixture_components': 3, 'use_sparse_layer': False, 'use_batchnorm': False, 'use_dropout': False, 'mlp_size_1': 6, 'mlp_size_2': 0, 'mlp_size_3': 0, 'kernel': 'LogLogistic', 'loss_name': 'CensoredNLLLoss'}. Best is trial 468 with value: 0.8545388812039783.[0m
[32m[I 2022-04-22 14:47:47,550][0m Trial 940 finished with value: 0.8424674889411474 and parameters: {'n_hidden': 2048, 'mixture_components': 3, 'use_sparse_layer': False, 'use_batchnorm': False, 'use_dropout': False, 'mlp_size_1': 7, 'mlp_size_2': 1, 'mlp_size_3': 0, 'kernel': 'LogLogistic', 'loss_name': 'CensoredNLLLoss'}. Best is trial 468 with value: 0.8545388812039783.[0m
[32m[I 2022-04-22 14:48:53,617][0m Trial 941 finished with value: 0.8328474523193237 and parameters: {'n_hidden': 2048, 'mixture_components': 3, 'use_sparse_layer': True, 'use_sparse_loss': True, 'lmbd': 1.4441508625765312e-06, 'use_batchnorm': False, 'use_dropout': False, 'mlp_size_1': 7, 'mlp_size_2': 1, 'mlp_size_3': 0, 'kernel': 'Normal', 'loss_name': 'CensoredNLLLoss'}. Best is trial 468 with value: 0.8545388812039783.[0m
[32m[I 2022-04-22 14:49:55,020][0m Trial 942 finished with value: 0.8391926166618209 and parameters: {'n_hidden': 2048, 'mixture_components': 3, 'use_sparse_layer': False, 'use_batchnorm': False, 'use_dropout': False, 'mlp_size_1': 7, 'mlp_size_2': 1, 'mlp_size_3': 0, 'kernel': 'LogLogistic', 'loss_name': 'CensoredNLLLoss'}. Best is trial 468 with value: 0.8545388812039783.[0m
[32m[I 2022-04-22 14:50:57,812][0m Trial 943 finished with value: 0.7415226170814132 and parameters: {'n_hidden': 64, 'mixture_components': 3, 'use_sparse_layer': True, 'use_sparse_loss': True, 'lmbd': 0.0003976424911288006, 'use_batchnorm': False, 'use_dropout': False, 'mlp_size_1': 3, 'mlp_size_2': 0, 'mlp_size_3': 0, 'kernel': 'LogLogistic', 'loss_name': 'CensoredNLLLoss'}. Best is trial 468 with value: 0.8545388812039783.[0m
[32m[I 2022-04-22 14:52:32,710][0m Trial 944 finished with value: 0.842366611207012 and parameters: {'n_hidden': 2048, 'mixture_components': 3, 'use_sparse_layer': False, 'use_batchnorm': False, 'use_dropout': False, 'mlp_size_1': 8, 'mlp_size_2': 0, 'mlp_size_3': 0, 'kernel': 'Normal', 'loss_name': 'CensoredNLLLoss'}. Best is trial 468 with value: 0.8545388812039783.[0m
[32m[I 2022-04-22 14:53:52,534][0m Trial 945 finished with value: 0.8403467962320631 and parameters: {'n_hidden': 2048, 'mixture_components': 3, 'use_sparse_layer': True, 'use_sparse_loss': True, 'lmbd': 0.0517816693668593, 'use_batchnorm': False, 'use_dropout': False, 'mlp_size_1': 7, 'mlp_size_2': 1, 'mlp_size_3': 0, 'kernel': 'LogLogistic', 'loss_name': 'CensoredNLLLoss'}. Best is trial 468 with value: 0.8545388812039783.[0m
[32m[I 2022-04-22 14:55:00,942][0m Trial 946 finished with value: 0.8447291666894821 and parameters: {'n_hidden': 2048, 'mixture_components': 3, 'use_sparse_layer': False, 'use_batchnorm': False, 'use_dropout': False, 'mlp_size_1': 7, 'mlp_size_2': 1, 'mlp_size_3': 0, 'kernel': 'LogLogistic', 'loss_name': 'CensoredNLLLoss'}. Best is trial 468 with value: 0.8545388812039783.[0m
[32m[I 2022-04-22 14:55:53,135][0m Trial 947 finished with value: 0.8426647528129587 and parameters: {'n_hidden': 256, 'mixture_components': 3, 'use_sparse_layer': True, 'use_sparse_loss': True, 'lmbd': 0.001161090344453242, 'use_batchnorm': False, 'use_dropout': False, 'mlp_size_1': 5, 'mlp_size_2': 0, 'mlp_size_3': 0, 'kernel': 'LogLogistic', 'loss_name': 'CensoredNLLLoss'}. Best is trial 468 with value: 0.8545388812039783.[0m
[32m[I 2022-04-22 14:57:06,337][0m Trial 948 finished with value: 0.7454981798269686 and parameters: {'n_hidden': 2048, 'mixture_components': 2, 'use_sparse_layer': False, 'use_batchnorm': False, 'use_dropout': False, 'mlp_size_1': 7, 'mlp_size_2': 1, 'mlp_size_3': 0, 'kernel': 'Normal', 'loss_name': 'CensoredNLLLoss'}. Best is trial 468 with value: 0.8545388812039783.[0m
[32m[I 2022-04-22 14:58:19,978][0m Trial 949 finished with value: 0.8439006309783513 and parameters: {'n_hidden': 2048, 'mixture_components': 3, 'use_sparse_layer': False, 'use_batchnorm': False, 'use_dropout': False, 'mlp_size_1': 8, 'mlp_size_2': 0, 'mlp_size_3': 0, 'kernel': 'LogLogistic', 'loss_name': 'CensoredNLLLoss'}. Best is trial 468 with value: 0.8545388812039783.[0m
[32m[I 2022-04-22 14:59:17,488][0m Trial 950 finished with value: 0.8034063007467529 and parameters: {'n_hidden': 512, 'mixture_components': 3, 'use_sparse_layer': True, 'use_sparse_loss': True, 'lmbd': 0.0007314840343352457, 'use_batchnorm': False, 'use_dropout': False, 'mlp_size_1': 6, 'mlp_size_2': 0, 'mlp_size_3': 0, 'kernel': 'LogLogistic', 'loss_name': 'CensoredNLLLoss'}. Best is trial 468 with value: 0.8545388812039783.[0m
[32m[I 2022-04-22 15:00:53,278][0m Trial 951 finished with value: 0.8381416072199718 and parameters: {'n_hidden': 2048, 'mixture_components': 3, 'use_sparse_layer': False, 'use_batchnorm': False, 'use_dropout': False, 'mlp_size_1': 7, 'mlp_size_2': 1, 'mlp_size_3': 0, 'kernel': 'Normal', 'loss_name': 'CensoredNLLLoss'}. Best is trial 468 with value: 0.8545388812039783.[0m
[32m[I 2022-04-22 15:02:04,452][0m Trial 952 finished with value: 0.8391997111392271 and parameters: {'n_hidden': 2048, 'mixture_components': 3, 'use_sparse_layer': True, 'use_sparse_loss': True, 'lmbd': 0.0020416079642689338, 'use_batchnorm': False, 'use_dropout': False, 'mlp_size_1': 7, 'mlp_size_2': 1, 'mlp_size_3': 0, 'kernel': 'LogLogistic', 'loss_name': 'CensoredNLLLoss'}. Best is trial 468 with value: 0.8545388812039783.[0m
[32m[I 2022-04-22 15:04:23,386][0m Trial 953 finished with value: 0.729473816173488 and parameters: {'n_hidden': 2048, 'mixture_components': 3, 'use_sparse_layer': False, 'use_batchnorm': True, 'use_dropout': False, 'mlp_size_1': 7, 'mlp_size_2': 1, 'mlp_size_3': 0, 'kernel': 'LogLogistic', 'loss_name': 'CensoredNLLLoss'}. Best is trial 468 with value: 0.8545388812039783.[0m
[32m[I 2022-04-22 15:05:06,307][0m Trial 954 finished with value: -0.23636683659883878 and parameters: {'n_hidden': 2048, 'mixture_components': 3, 'use_sparse_layer': True, 'use_sparse_loss': True, 'lmbd': 7.755043997302175e-05, 'use_batchnorm': False, 'use_dropout': False, 'mlp_size_1': 7, 'mlp_size_2': 1, 'mlp_size_3': 0, 'kernel': 'Exponential', 'loss_name': 'CensoredNLLLoss'}. Best is trial 468 with value: 0.8545388812039783.[0m
[32m[I 2022-04-22 15:06:07,251][0m Trial 955 finished with value: 0.8393257135032173 and parameters: {'n_hidden': 128, 'mixture_components': 2, 'use_sparse_layer': False, 'use_batchnorm': False, 'use_dropout': False, 'mlp_size_1': 4, 'mlp_size_2': 0, 'mlp_size_3': 0, 'kernel': 'Normal', 'loss_name': 'CensoredNLLLoss'}. Best is trial 468 with value: 0.8545388812039783.[0m
[32m[I 2022-04-22 15:07:09,658][0m Trial 956 finished with value: 0.8452119922772189 and parameters: {'n_hidden': 2048, 'mixture_components': 3, 'use_sparse_layer': True, 'use_sparse_loss': True, 'lmbd': 0.00014564437109558924, 'use_batchnorm': False, 'use_dropout': False, 'mlp_size_1': 7, 'mlp_size_2': 1, 'mlp_size_3': 0, 'kernel': 'LogLogistic', 'loss_name': 'CensoredNLLLoss'}. Best is trial 468 with value: 0.8545388812039783.[0m
[32m[I 2022-04-22 15:08:00,070][0m Trial 957 finished with value: 0.8402281809498042 and parameters: {'n_hidden': 512, 'mixture_components': 3, 'use_sparse_layer': False, 'use_batchnorm': False, 'use_dropout': False, 'mlp_size_1': 6, 'mlp_size_2': 0, 'mlp_size_3': 0, 'kernel': 'LogLogistic', 'loss_name': 'CensoredNLLLoss'}. Best is trial 468 with value: 0.8545388812039783.[0m
[32m[I 2022-04-22 15:09:01,943][0m Trial 958 finished with value: 0.8383503455395444 and parameters: {'n_hidden': 2048, 'mixture_components': 10, 'use_sparse_layer': False, 'use_batchnorm': False, 'use_dropout': False, 'mlp_size_1': 7, 'mlp_size_2': 1, 'mlp_size_3': 0, 'kernel': 'Logistic', 'loss_name': 'CensoredNLLLoss'}. Best is trial 468 with value: 0.8545388812039783.[0m
[32m[I 2022-04-22 15:10:04,657][0m Trial 959 finished with value: 0.8471370033039107 and parameters: {'n_hidden': 2048, 'mixture_components': 3, 'use_sparse_layer': True, 'use_sparse_loss': True, 'lmbd': 3.189723444337679e-05, 'use_batchnorm': False, 'use_dropout': False, 'mlp_size_1': 7, 'mlp_size_2': 1, 'mlp_size_3': 0, 'kernel': 'LogLogistic', 'loss_name': 'CensoredNLLLoss'}. Best is trial 468 with value: 0.8545388812039783.[0m
[32m[I 2022-04-22 15:11:13,897][0m Trial 960 finished with value: 0.8400750098729375 and parameters: {'n_hidden': 2048, 'mixture_components': 3, 'use_sparse_layer': False, 'use_batchnorm': False, 'use_dropout': False, 'mlp_size_1': 7, 'mlp_size_2': 1, 'mlp_size_3': 0, 'kernel': 'Normal', 'loss_name': 'CensoredNLLLoss'}. Best is trial 468 with value: 0.8545388812039783.[0m
[32m[I 2022-04-22 15:12:24,318][0m Trial 961 finished with value: 0.8067640686908881 and parameters: {'n_hidden': 32, 'mixture_components': 3, 'use_sparse_layer': True, 'use_sparse_loss': True, 'lmbd': 0.0005024389399030854, 'use_batchnorm': False, 'use_dropout': False, 'mlp_size_1': 2, 'mlp_size_2': 0, 'mlp_size_3': 0, 'kernel': 'LogLogistic', 'loss_name': 'CensoredNLLLoss'}. Best is trial 468 with value: 0.8545388812039783.[0m
[32m[I 2022-04-22 15:13:42,471][0m Trial 962 finished with value: 0.6421387768948609 and parameters: {'n_hidden': 2048, 'mixture_components': 3, 'use_sparse_layer': False, 'use_batchnorm': False, 'use_dropout': False, 'mlp_size_1': 8, 'mlp_size_2': 0, 'mlp_size_3': 0, 'kernel': 'LogLogistic', 'loss_name': 'CensoredNLLLoss'}. Best is trial 468 with value: 0.8545388812039783.[0m
[32m[I 2022-04-22 15:15:09,782][0m Trial 963 finished with value: 0.8422872468455667 and parameters: {'n_hidden': 2048, 'mixture_components': 3, 'use_sparse_layer': True, 'use_sparse_loss': False, 'use_batchnorm': False, 'use_dropout': False, 'mlp_size_1': 7, 'mlp_size_2': 1, 'mlp_size_3': 0, 'kernel': 'Normal', 'loss_name': 'CensoredNLLLoss'}. Best is trial 468 with value: 0.8545388812039783.[0m
[32m[I 2022-04-22 15:16:15,914][0m Trial 964 finished with value: 0.7469915132644541 and parameters: {'n_hidden': 2048, 'mixture_components': 6, 'use_sparse_layer': False, 'use_batchnorm': False, 'use_dropout': True, 'dropout': 0.2966801538372873, 'mlp_size_1': 7, 'mlp_size_2': 1, 'mlp_size_3': 0, 'kernel': 'LogLogistic', 'loss_name': 'CensoredNLLLoss'}. Best is trial 468 with value: 0.8545388812039783.[0m
[32m[I 2022-04-22 15:17:36,095][0m Trial 965 finished with value: 0.8475660332162537 and parameters: {'n_hidden': 2048, 'mixture_components': 3, 'use_sparse_layer': True, 'use_sparse_loss': False, 'use_batchnorm': False, 'use_dropout': False, 'mlp_size_1': 7, 'mlp_size_2': 1, 'mlp_size_3': 0, 'kernel': 'LogLogistic', 'loss_name': 'CensoredNLLLoss'}. Best is trial 468 with value: 0.8545388812039783.[0m
[32m[I 2022-04-22 15:18:47,904][0m Trial 966 finished with value: 0.7425541918649171 and parameters: {'n_hidden': 2048, 'mixture_components': 3, 'use_sparse_layer': False, 'use_batchnorm': False, 'use_dropout': False, 'mlp_size_1': 8, 'mlp_size_2': 0, 'mlp_size_3': 0, 'kernel': 'Normal', 'loss_name': 'CensoredNLLLoss'}. Best is trial 468 with value: 0.8545388812039783.[0m
[32m[I 2022-04-22 15:19:47,145][0m Trial 967 finished with value: 0.7287703937299772 and parameters: {'n_hidden': 512, 'mixture_components': 3, 'use_sparse_layer': False, 'use_batchnorm': False, 'use_dropout': False, 'mlp_size_1': 6, 'mlp_size_2': 0, 'mlp_size_3': 0, 'kernel': 'LogLogistic', 'loss_name': 'CensoredNLLLoss'}. Best is trial 468 with value: 0.8545388812039783.[0m
[32m[I 2022-04-22 15:20:54,375][0m Trial 968 finished with value: 0.7990376912123616 and parameters: {'n_hidden': 64, 'mixture_components': 3, 'use_sparse_layer': True, 'use_sparse_loss': True, 'lmbd': 1.0598311227337953e-06, 'use_batchnorm': False, 'use_dropout': False, 'mlp_size_1': 3, 'mlp_size_2': 0, 'mlp_size_3': 0, 'kernel': 'LogLogistic', 'loss_name': 'CensoredNLLLoss'}. Best is trial 468 with value: 0.8545388812039783.[0m
[32m[I 2022-04-22 15:22:08,135][0m Trial 969 finished with value: 0.8402097992250525 and parameters: {'n_hidden': 2048, 'mixture_components': 3, 'use_sparse_layer': False, 'use_batchnorm': False, 'use_dropout': False, 'mlp_size_1': 7, 'mlp_size_2': 1, 'mlp_size_3': 0, 'kernel': 'LogLogistic', 'loss_name': 'CensoredNLLLoss'}. Best is trial 468 with value: 0.8545388812039783.[0m
[32m[I 2022-04-22 15:23:27,057][0m Trial 970 finished with value: 0.8383819408900557 and parameters: {'n_hidden': 2048, 'mixture_components': 3, 'use_sparse_layer': True, 'use_sparse_loss': False, 'use_batchnorm': False, 'use_dropout': False, 'mlp_size_1': 7, 'mlp_size_2': 1, 'mlp_size_3': 0, 'kernel': 'Normal', 'loss_name': 'CensoredNLLLoss'}. Best is trial 468 with value: 0.8545388812039783.[0m
[32m[I 2022-04-22 15:24:31,339][0m Trial 971 finished with value: 0.8425451606511066 and parameters: {'n_hidden': 2048, 'mixture_components': 2, 'use_sparse_layer': False, 'use_batchnorm': False, 'use_dropout': False, 'mlp_size_1': 7, 'mlp_size_2': 1, 'mlp_size_3': 0, 'kernel': 'LogLogistic', 'loss_name': 'CensoredNLLLoss'}. Best is trial 468 with value: 0.8545388812039783.[0m
[32m[I 2022-04-22 15:26:37,977][0m Trial 972 finished with value: 0.522241056317293 and parameters: {'n_hidden': 2048, 'mixture_components': 3, 'use_sparse_layer': True, 'use_sparse_loss': False, 'use_batchnorm': True, 'use_dropout': False, 'mlp_size_1': 7, 'mlp_size_2': 1, 'mlp_size_3': 0, 'kernel': 'LogLogistic', 'loss_name': 'CensoredNLLLoss'}. Best is trial 468 with value: 0.8545388812039783.[0m
[32m[I 2022-04-22 15:27:50,331][0m Trial 973 finished with value: 0.7378200249067944 and parameters: {'n_hidden': 256, 'mixture_components': 3, 'use_sparse_layer': False, 'use_batchnorm': False, 'use_dropout': False, 'mlp_size_1': 5, 'mlp_size_2': 0, 'mlp_size_3': 0, 'kernel': 'Normal', 'loss_name': 'CensoredNLLLoss'}. Best is trial 468 with value: 0.8545388812039783.[0m
[32m[I 2022-04-22 15:29:00,959][0m Trial 974 finished with value: 0.8441461065179053 and parameters: {'n_hidden': 2048, 'mixture_components': 3, 'use_sparse_layer': True, 'use_sparse_loss': True, 'lmbd': 0.004779720163370762, 'use_batchnorm': False, 'use_dropout': False, 'mlp_size_1': 7, 'mlp_size_2': 1, 'mlp_size_3': 0, 'kernel': 'LogLogistic', 'loss_name': 'CensoredNLLLoss'}. Best is trial 468 with value: 0.8545388812039783.[0m
[32m[I 2022-04-22 15:30:01,384][0m Trial 975 finished with value: 0.7453887970473375 and parameters: {'n_hidden': 2048, 'mixture_components': 2, 'use_sparse_layer': False, 'use_batchnorm': False, 'use_dropout': False, 'mlp_size_1': 7, 'mlp_size_2': 1, 'mlp_size_3': 0, 'kernel': 'LogLogistic', 'loss_name': 'CensoredNLLLoss'}. Best is trial 468 with value: 0.8545388812039783.[0m
[32m[I 2022-04-22 15:31:12,426][0m Trial 976 finished with value: 0.7411884171304008 and parameters: {'n_hidden': 512, 'mixture_components': 3, 'use_sparse_layer': False, 'use_batchnorm': False, 'use_dropout': False, 'mlp_size_1': 6, 'mlp_size_2': 0, 'mlp_size_3': 0, 'kernel': 'Normal', 'loss_name': 'CensoredNLLLoss'}. Best is trial 468 with value: 0.8545388812039783.[0m
[32m[I 2022-04-22 15:32:14,188][0m Trial 977 finished with value: 0.8438063676470884 and parameters: {'n_hidden': 2048, 'mixture_components': 3, 'use_sparse_layer': True, 'use_sparse_loss': False, 'use_batchnorm': False, 'use_dropout': False, 'mlp_size_1': 8, 'mlp_size_2': 0, 'mlp_size_3': 0, 'kernel': 'LogLogistic', 'loss_name': 'CensoredNLLLoss'}. Best is trial 468 with value: 0.8545388812039783.[0m
[32m[I 2022-04-22 15:33:21,673][0m Trial 978 finished with value: 0.838045123315451 and parameters: {'n_hidden': 2048, 'mixture_components': 6, 'use_sparse_layer': False, 'use_batchnorm': False, 'use_dropout': False, 'mlp_size_1': 7, 'mlp_size_2': 1, 'mlp_size_3': 0, 'kernel': 'LogLogistic', 'loss_name': 'CensoredNLLLoss'}. Best is trial 468 with value: 0.8545388812039783.[0m
[32m[I 2022-04-22 15:34:04,541][0m Trial 979 finished with value: -0.23600757262224414 and parameters: {'n_hidden': 2048, 'mixture_components': 3, 'use_sparse_layer': True, 'use_sparse_loss': True, 'lmbd': 2.3462315125148262e-05, 'use_batchnorm': False, 'use_dropout': False, 'mlp_size_1': 7, 'mlp_size_2': 1, 'mlp_size_3': 0, 'kernel': 'Exponential', 'loss_name': 'CensoredNLLLoss'}. Best is trial 468 with value: 0.8545388812039783.[0m
[32m[I 2022-04-22 15:34:54,103][0m Trial 980 finished with value: 0.8437659550529016 and parameters: {'n_hidden': 128, 'mixture_components': 3, 'use_sparse_layer': False, 'use_batchnorm': False, 'use_dropout': False, 'mlp_size_1': 4, 'mlp_size_2': 0, 'mlp_size_3': 0, 'kernel': 'LogLogistic', 'loss_name': 'CensoredNLLLoss'}. Best is trial 468 with value: 0.8545388812039783.[0m
[32m[I 2022-04-22 15:36:06,058][0m Trial 981 finished with value: 0.8426911023560294 and parameters: {'n_hidden': 2048, 'mixture_components': 3, 'use_sparse_layer': True, 'use_sparse_loss': False, 'use_batchnorm': False, 'use_dropout': False, 'mlp_size_1': 7, 'mlp_size_2': 1, 'mlp_size_3': 0, 'kernel': 'Normal', 'loss_name': 'CensoredNLLLoss'}. Best is trial 468 with value: 0.8545388812039783.[0m
[32m[I 2022-04-22 15:37:21,300][0m Trial 982 finished with value: 0.7364741654156944 and parameters: {'n_hidden': 2048, 'mixture_components': 1, 'use_sparse_layer': False, 'use_batchnorm': False, 'use_dropout': False, 'mlp_size_1': 8, 'mlp_size_2': 0, 'mlp_size_3': 0, 'kernel': 'LogLogistic', 'loss_name': 'CensoredNLLLoss'}. Best is trial 468 with value: 0.8545388812039783.[0m
[32m[I 2022-04-22 15:38:22,363][0m Trial 983 finished with value: 0.7432579560191124 and parameters: {'n_hidden': 2048, 'mixture_components': 3, 'use_sparse_layer': True, 'use_sparse_loss': False, 'use_batchnorm': False, 'use_dropout': True, 'dropout': 0.17321881568490904, 'mlp_size_1': 7, 'mlp_size_2': 1, 'mlp_size_3': 0, 'kernel': 'Logistic', 'loss_name': 'CensoredNLLLoss'}. Best is trial 468 with value: 0.8545388812039783.[0m
[32m[I 2022-04-22 15:39:47,358][0m Trial 984 finished with value: 0.8419872754152706 and parameters: {'n_hidden': 2048, 'mixture_components': 3, 'use_sparse_layer': False, 'use_batchnorm': False, 'use_dropout': False, 'mlp_size_1': 7, 'mlp_size_2': 1, 'mlp_size_3': 0, 'kernel': 'LogLogistic', 'loss_name': 'AlternativeNLLLoss'}. Best is trial 468 with value: 0.8545388812039783.[0m
[32m[I 2022-04-22 15:40:57,679][0m Trial 985 finished with value: 0.8388205234791763 and parameters: {'n_hidden': 512, 'mixture_components': 3, 'use_sparse_layer': False, 'use_batchnorm': False, 'use_dropout': False, 'mlp_size_1': 6, 'mlp_size_2': 0, 'mlp_size_3': 0, 'kernel': 'Normal', 'loss_name': 'CensoredNLLLoss'}. Best is trial 468 with value: 0.8545388812039783.[0m
[32m[I 2022-04-22 15:41:59,407][0m Trial 986 finished with value: 0.7976081650228657 and parameters: {'n_hidden': 32, 'mixture_components': 2, 'use_sparse_layer': True, 'use_sparse_loss': True, 'lmbd': 4.9844429886542514e-05, 'use_batchnorm': False, 'use_dropout': False, 'mlp_size_1': 2, 'mlp_size_2': 0, 'mlp_size_3': 0, 'kernel': 'LogLogistic', 'loss_name': 'CensoredNLLLoss'}. Best is trial 468 with value: 0.8545388812039783.[0m
[32m[I 2022-04-22 15:43:08,754][0m Trial 987 finished with value: 0.8409627523991114 and parameters: {'n_hidden': 2048, 'mixture_components': 3, 'use_sparse_layer': False, 'use_batchnorm': False, 'use_dropout': False, 'mlp_size_1': 7, 'mlp_size_2': 1, 'mlp_size_3': 0, 'kernel': 'LogLogistic', 'loss_name': 'AlternativeNLLLoss'}. Best is trial 468 with value: 0.8545388812039783.[0m
