[32m[I 2022-04-21 11:39:55,166][0m Trial 702 finished with value: 0.6738476114655684 and parameters: {'splitter': 'random', 'min_samples_split': 0.3817665173386662, 'min_samples_leaf': 0.16070060846247433, 'min_weight_fraction_leaf': 0.19111415188322362, 'max_features': 0.9788355991600735}. Best is trial 11 with value: 0.6773038119717333.[0m
[32m[I 2022-04-21 11:39:55,292][0m Trial 703 finished with value: 0.6551405301163737 and parameters: {'splitter': 'random', 'min_samples_split': 0.004414977123399508, 'min_samples_leaf': 0.05128857079536574, 'min_weight_fraction_leaf': 0.216399840108134, 'max_features': 0.9980115300506476}. Best is trial 11 with value: 0.6773038119717333.[0m
[32m[I 2022-04-21 11:39:55,434][0m Trial 704 finished with value: 0.6647456324911225 and parameters: {'splitter': 'random', 'min_samples_split': 0.021082049542201636, 'min_samples_leaf': 0.09004419455564994, 'min_weight_fraction_leaf': 0.010093437697079231, 'max_features': 0.948071901446136}. Best is trial 11 with value: 0.6773038119717333.[0m
[32m[I 2022-04-21 11:39:55,552][0m Trial 705 finished with value: 0.6738476114655684 and parameters: {'splitter': 'random', 'min_samples_split': 0.4643187425344753, 'min_samples_leaf': 0.10698548829091187, 'min_weight_fraction_leaf': 0.1682131622603229, 'max_features': 0.9219831326129242}. Best is trial 11 with value: 0.6773038119717333.[0m
[32m[I 2022-04-21 11:39:55,638][0m Trial 706 finished with value: 0.6640701022932763 and parameters: {'splitter': 'random', 'min_samples_split': 0.3218456008700646, 'min_samples_leaf': 0.12295759989752791, 'min_weight_fraction_leaf': 0.10160136246965656, 'max_features': 0.8662524321998665}. Best is trial 11 with value: 0.6773038119717333.[0m
[32m[I 2022-04-21 11:39:55,691][0m Trial 707 finished with value: 0.6543938115635641 and parameters: {'splitter': 'random', 'min_samples_split': 0.38774287642248123, 'min_samples_leaf': 0.11717724929582919, 'min_weight_fraction_leaf': 0.15720975929300549, 'max_features': 0.8967758693464792}. Best is trial 11 with value: 0.6773038119717333.[0m
[32m[I 2022-04-21 11:39:55,751][0m Trial 708 finished with value: 0.662800366349585 and parameters: {'splitter': 'random', 'min_samples_split': 0.24250683867641956, 'min_samples_leaf': 0.1632070414472258, 'min_weight_fraction_leaf': 0.14225606686751, 'max_features': 0.8452307807184618}. Best is trial 11 with value: 0.6773038119717333.[0m
[32m[I 2022-04-21 11:39:55,839][0m Trial 709 finished with value: 0.6360776294262513 and parameters: {'splitter': 'best', 'min_samples_split': 0.15902242439445724, 'min_samples_leaf': 0.008008210374258508, 'min_weight_fraction_leaf': 0.11724525124734601, 'max_features': 0.595921699937399}. Best is trial 11 with value: 0.6773038119717333.[0m
[32m[I 2022-04-21 11:39:55,966][0m Trial 710 finished with value: 0.6586187582319654 and parameters: {'splitter': 'random', 'min_samples_split': 0.1391906991131962, 'min_samples_leaf': 0.030696273659879664, 'min_weight_fraction_leaf': 0.20502070154846608, 'max_features': 0.8727658902545731}. Best is trial 11 with value: 0.6773038119717333.[0m
[32m[I 2022-04-21 11:39:56,049][0m Trial 711 finished with value: 0.6738476114655684 and parameters: {'splitter': 'random', 'min_samples_split': 0.1714343685206751, 'min_samples_leaf': 0.17045149167609394, 'min_weight_fraction_leaf': 0.12905619140726704, 'max_features': 0.8106230944412156}. Best is trial 11 with value: 0.6773038119717333.[0m
[32m[I 2022-04-21 11:39:56,126][0m Trial 712 finished with value: 0.5962367254829114 and parameters: {'splitter': 'random', 'min_samples_split': 0.17843405937024284, 'min_samples_leaf': 0.1663120195467096, 'min_weight_fraction_leaf': 0.1375043814753511, 'max_features': 0.7997875081302231}. Best is trial 11 with value: 0.6773038119717333.[0m
[32m[I 2022-04-21 11:39:56,193][0m Trial 713 finished with value: 0.6703693833499768 and parameters: {'splitter': 'random', 'min_samples_split': 0.4685249046175411, 'min_samples_leaf': 0.0032242282961246933, 'min_weight_fraction_leaf': 0.19604269446500489, 'max_features': 0.9690532201705887}. Best is trial 11 with value: 0.6773038119717333.[0m
[32m[I 2022-04-21 11:39:56,277][0m Trial 714 finished with value: 0.6543938115635641 and parameters: {'splitter': 'random', 'min_samples_split': 0.43716403142141697, 'min_samples_leaf': 0.1470746587659687, 'min_weight_fraction_leaf': 0.15698345109658385, 'max_features': 0.9557635419156398}. Best is trial 11 with value: 0.6773038119717333.[0m
[32m[I 2022-04-21 11:39:56,334][0m Trial 715 finished with value: 0.6738476114655684 and parameters: {'splitter': 'random', 'min_samples_split': 0.3441220740277233, 'min_samples_leaf': 0.1115037280713449, 'min_weight_fraction_leaf': 0.18216228029958248, 'max_features': 0.8640027234489284}. Best is trial 11 with value: 0.6773038119717333.[0m
[32m[I 2022-04-21 11:39:56,416][0m Trial 716 finished with value: 0.6738476114655684 and parameters: {'splitter': 'random', 'min_samples_split': 0.05258918145827003, 'min_samples_leaf': 0.17286525397076688, 'min_weight_fraction_leaf': 0.1192235388040611, 'max_features': 0.855822558189256}. Best is trial 11 with value: 0.6773038119717333.[0m
[32m[I 2022-04-21 11:39:56,501][0m Trial 717 finished with value: 0.6738476114655684 and parameters: {'splitter': 'random', 'min_samples_split': 0.3936770205382843, 'min_samples_leaf': 0.09897581258603336, 'min_weight_fraction_leaf': 0.17148381407682894, 'max_features': 0.8495609420485835}. Best is trial 11 with value: 0.6773038119717333.[0m
[32m[I 2022-04-21 11:39:56,578][0m Trial 718 finished with value: 0.6738476114655684 and parameters: {'splitter': 'random', 'min_samples_split': 0.393583666845567, 'min_samples_leaf': 0.10315478818327246, 'min_weight_fraction_leaf': 0.17480902551098793, 'max_features': 0.8872450247593646}. Best is trial 11 with value: 0.6773038119717333.[0m
[32m[I 2022-04-21 11:39:56,664][0m Trial 719 finished with value: 0.5 and parameters: {'splitter': 'random', 'min_samples_split': 0.3770812979575839, 'min_samples_leaf': 0.2100330282035444, 'min_weight_fraction_leaf': 0.08102023002772632, 'max_features': 0.7999734953758153}. Best is trial 11 with value: 0.6773038119717333.[0m
[32m[I 2022-04-21 11:39:56,745][0m Trial 720 finished with value: 0.6543938115635641 and parameters: {'splitter': 'random', 'min_samples_split': 0.1422315170850968, 'min_samples_leaf': 0.14404970408217488, 'min_weight_fraction_leaf': 0.15534924904870098, 'max_features': 0.9583828591193102}. Best is trial 11 with value: 0.6773038119717333.[0m
[32m[I 2022-04-21 11:39:56,844][0m Trial 721 finished with value: 0.6738476114655684 and parameters: {'splitter': 'random', 'min_samples_split': 0.3755919075981419, 'min_samples_leaf': 0.017351509030488255, 'min_weight_fraction_leaf': 0.18671347266134258, 'max_features': 0.9971413603733511}. Best is trial 11 with value: 0.6773038119717333.[0m
[32m[I 2022-04-21 11:39:56,952][0m Trial 722 finished with value: 0.5931624331547747 and parameters: {'splitter': 'random', 'min_samples_split': 0.014677690901109564, 'min_samples_leaf': 0.24255033364105494, 'min_weight_fraction_leaf': 0.22880294332687323, 'max_features': 0.939943621624568}. Best is trial 11 with value: 0.6773038119717333.[0m
[32m[I 2022-04-21 11:39:57,055][0m Trial 723 finished with value: 0.6738476114655684 and parameters: {'splitter': 'random', 'min_samples_split': 0.2721251114214226, 'min_samples_leaf': 0.14027625103175675, 'min_weight_fraction_leaf': 0.18328195714150725, 'max_features': 0.8874964379804127}. Best is trial 11 with value: 0.6773038119717333.[0m
[32m[I 2022-04-21 11:39:57,147][0m Trial 724 finished with value: 0.6640701022932763 and parameters: {'splitter': 'random', 'min_samples_split': 0.25421502709233723, 'min_samples_leaf': 0.12998267267770378, 'min_weight_fraction_leaf': 0.022884076768693334, 'max_features': 0.9100558060769549}. Best is trial 11 with value: 0.6773038119717333.[0m
[32m[I 2022-04-21 11:39:57,246][0m Trial 725 finished with value: 0.6738476114655684 and parameters: {'splitter': 'random', 'min_samples_split': 0.23352830244600434, 'min_samples_leaf': 0.02682734941217563, 'min_weight_fraction_leaf': 0.19944171367631003, 'max_features': 0.9787090778340778}. Best is trial 11 with value: 0.6773038119717333.[0m
[32m[I 2022-04-21 11:39:57,323][0m Trial 726 finished with value: 0.6738476114655684 and parameters: {'splitter': 'random', 'min_samples_split': 0.3580915091979778, 'min_samples_leaf': 0.20129726526832323, 'min_weight_fraction_leaf': 0.18721203577125728, 'max_features': 0.8072614908598836}. Best is trial 11 with value: 0.6773038119717333.[0m
[32m[I 2022-04-21 11:39:57,416][0m Trial 727 finished with value: 0.6738476114655684 and parameters: {'splitter': 'random', 'min_samples_split': 0.40519633705121066, 'min_samples_leaf': 0.17919524101684267, 'min_weight_fraction_leaf': 0.15500305336414388, 'max_features': 0.9340049434084486}. Best is trial 11 with value: 0.6773038119717333.[0m
[32m[I 2022-04-21 11:39:57,505][0m Trial 728 finished with value: 0.6738476114655684 and parameters: {'splitter': 'random', 'min_samples_split': 0.3984987481675089, 'min_samples_leaf': 0.18474555558117658, 'min_weight_fraction_leaf': 0.15280073874181008, 'max_features': 0.9281742079794119}. Best is trial 11 with value: 0.6773038119717333.[0m
[32m[I 2022-04-21 11:39:57,567][0m Trial 729 finished with value: 0.5889594645659965 and parameters: {'splitter': 'random', 'min_samples_split': 0.35329891141567954, 'min_samples_leaf': 0.2339320310947738, 'min_weight_fraction_leaf': 0.06282126759194129, 'max_features': 0.8800536958698468}. Best is trial 11 with value: 0.6773038119717333.[0m
[32m[I 2022-04-21 11:39:57,630][0m Trial 730 finished with value: 0.6665385065440175 and parameters: {'splitter': 'best', 'min_samples_split': 0.41665468138355627, 'min_samples_leaf': 0.13314210847252525, 'min_weight_fraction_leaf': 0.1621447537795249, 'max_features': 0.9629577792698075}. Best is trial 11 with value: 0.6773038119717333.[0m
[32m[I 2022-04-21 11:39:57,687][0m Trial 731 finished with value: 0.6640701022932763 and parameters: {'splitter': 'random', 'min_samples_split': 0.03500727783246652, 'min_samples_leaf': 0.015324689704536574, 'min_weight_fraction_leaf': 0.14380007112509, 'max_features': 0.9821905131006549}. Best is trial 11 with value: 0.6773038119717333.[0m
[32m[I 2022-04-21 11:39:57,760][0m Trial 732 finished with value: 0.6738476114655684 and parameters: {'splitter': 'random', 'min_samples_split': 0.33311894658087093, 'min_samples_leaf': 0.11389018863476556, 'min_weight_fraction_leaf': 0.181395808903643, 'max_features': 0.9113512417528653}. Best is trial 11 with value: 0.6773038119717333.[0m
[32m[I 2022-04-21 11:39:57,827][0m Trial 733 finished with value: 0.6738476114655684 and parameters: {'splitter': 'random', 'min_samples_split': 0.3633436382473734, 'min_samples_leaf': 0.19524844678670178, 'min_weight_fraction_leaf': 0.1999506762804828, 'max_features': 0.8468193790124328}. Best is trial 11 with value: 0.6773038119717333.[0m
[32m[I 2022-04-21 11:39:57,895][0m Trial 734 finished with value: 0.6738476114655684 and parameters: {'splitter': 'random', 'min_samples_split': 0.3440021325601303, 'min_samples_leaf': 0.12339358826745025, 'min_weight_fraction_leaf': 0.1921109038845543, 'max_features': 0.8691146152821684}. Best is trial 11 with value: 0.6773038119717333.[0m
[32m[I 2022-04-21 11:39:57,957][0m Trial 735 finished with value: 0.6586187582319654 and parameters: {'splitter': 'random', 'min_samples_split': 0.22982446154134145, 'min_samples_leaf': 0.01112395478531245, 'min_weight_fraction_leaf': 0.20673643882568316, 'max_features': 0.9950408252648095}. Best is trial 11 with value: 0.6773038119717333.[0m
[32m[I 2022-04-21 11:39:58,027][0m Trial 736 finished with value: 0.6582523737876749 and parameters: {'splitter': 'random', 'min_samples_split': 0.014519417661297308, 'min_samples_leaf': 0.11966532948326947, 'min_weight_fraction_leaf': 0.009472250735760268, 'max_features': 0.7475828659830167}. Best is trial 11 with value: 0.6773038119717333.[0m
[32m[I 2022-04-21 11:39:58,088][0m Trial 737 finished with value: 0.6640701022932763 and parameters: {'splitter': 'random', 'min_samples_split': 0.006944294679479511, 'min_samples_leaf': 0.07839075400587651, 'min_weight_fraction_leaf': 0.13415331946225395, 'max_features': 0.9466774171659174}. Best is trial 11 with value: 0.6773038119717333.[0m
[32m[I 2022-04-21 11:39:58,148][0m Trial 738 finished with value: 0.6738476114655684 and parameters: {'splitter': 'random', 'min_samples_split': 0.3671349604301024, 'min_samples_leaf': 0.002746092589508555, 'min_weight_fraction_leaf': 0.18390688249697687, 'max_features': 0.9887164827243667}. Best is trial 11 with value: 0.6773038119717333.[0m
[32m[I 2022-04-21 11:39:58,208][0m Trial 739 finished with value: 0.5 and parameters: {'splitter': 'random', 'min_samples_split': 0.35035627121877594, 'min_samples_leaf': 0.2753337976921995, 'min_weight_fraction_leaf': 0.19239649976795842, 'max_features': 0.851197734288037}. Best is trial 11 with value: 0.6773038119717333.[0m
[32m[I 2022-04-21 11:39:58,293][0m Trial 740 finished with value: 0.6738476114655684 and parameters: {'splitter': 'random', 'min_samples_split': 0.29116591636930306, 'min_samples_leaf': 0.18481730191529125, 'min_weight_fraction_leaf': 0.1498999274661641, 'max_features': 0.9403096756214799}. Best is trial 11 with value: 0.6773038119717333.[0m
[32m[I 2022-04-21 11:39:58,385][0m Trial 741 finished with value: 0.5 and parameters: {'splitter': 'random', 'min_samples_split': 0.35037039791256347, 'min_samples_leaf': 0.4472141144424726, 'min_weight_fraction_leaf': 0.172791238396201, 'max_features': 0.8315751432491559}. Best is trial 11 with value: 0.6773038119717333.[0m
[32m[I 2022-04-21 11:39:58,476][0m Trial 742 finished with value: 0.6586187582319654 and parameters: {'splitter': 'random', 'min_samples_split': 0.38153847356864257, 'min_samples_leaf': 0.2131843934243235, 'min_weight_fraction_leaf': 0.2080278442867795, 'max_features': 0.9086964292215871}. Best is trial 11 with value: 0.6773038119717333.[0m
[32m[I 2022-04-21 11:39:58,561][0m Trial 743 finished with value: 0.6738476114655684 and parameters: {'splitter': 'random', 'min_samples_split': 0.034895010717816914, 'min_samples_leaf': 0.18844344235919872, 'min_weight_fraction_leaf': 0.11119457578759268, 'max_features': 0.9662913516425647}. Best is trial 11 with value: 0.6773038119717333.[0m
[32m[I 2022-04-21 11:39:58,640][0m Trial 744 finished with value: 0.6738476114655684 and parameters: {'splitter': 'random', 'min_samples_split': 0.3568388431253132, 'min_samples_leaf': 0.032200156377593686, 'min_weight_fraction_leaf': 0.19529002465860132, 'max_features': 0.8659901084464333}. Best is trial 11 with value: 0.6773038119717333.[0m
[32m[I 2022-04-21 11:39:58,720][0m Trial 745 finished with value: 0.6738476114655684 and parameters: {'splitter': 'random', 'min_samples_split': 0.36825856855721145, 'min_samples_leaf': 0.11314059885141911, 'min_weight_fraction_leaf': 0.1865783398576345, 'max_features': 0.9001754507624513}. Best is trial 11 with value: 0.6773038119717333.[0m
[32m[I 2022-04-21 11:39:58,788][0m Trial 746 finished with value: 0.6586187582319654 and parameters: {'splitter': 'random', 'min_samples_split': 0.18865297645888532, 'min_samples_leaf': 0.20179483964967124, 'min_weight_fraction_leaf': 0.09680853081586152, 'max_features': 0.8245893417139131}. Best is trial 11 with value: 0.6773038119717333.[0m
[32m[I 2022-04-21 11:39:58,852][0m Trial 747 finished with value: 0.5 and parameters: {'splitter': 'random', 'min_samples_split': 0.0033633042029273235, 'min_samples_leaf': 0.06460029784451793, 'min_weight_fraction_leaf': 0.4176035547876547, 'max_features': 0.2471780553377459}. Best is trial 11 with value: 0.6773038119717333.[0m
[32m[I 2022-04-21 11:39:58,917][0m Trial 748 finished with value: 0.5 and parameters: {'splitter': 'random', 'min_samples_split': 0.18678388109980526, 'min_samples_leaf': 0.19239492307120715, 'min_weight_fraction_leaf': 0.08304983278556803, 'max_features': 0.787795522350577}. Best is trial 11 with value: 0.6773038119717333.[0m
[32m[I 2022-04-21 11:39:58,987][0m Trial 749 finished with value: 0.5467050366078425 and parameters: {'splitter': 'random', 'min_samples_split': 0.28934160594320146, 'min_samples_leaf': 0.252671612411289, 'min_weight_fraction_leaf': 0.16130959033977352, 'max_features': 0.82247354511667}. Best is trial 11 with value: 0.6773038119717333.[0m
[32m[I 2022-04-21 11:39:59,051][0m Trial 750 finished with value: 0.6598137568019723 and parameters: {'splitter': 'best', 'min_samples_split': 0.41333250436503477, 'min_samples_leaf': 0.0021196731653395137, 'min_weight_fraction_leaf': 0.1749148590135339, 'max_features': 0.9191858559764005}. Best is trial 11 with value: 0.6773038119717333.[0m
[32m[I 2022-04-21 11:39:59,117][0m Trial 751 finished with value: 0.662800366349585 and parameters: {'splitter': 'random', 'min_samples_split': 0.012509497208298382, 'min_samples_leaf': 0.10373471301672361, 'min_weight_fraction_leaf': 0.16181828927227504, 'max_features': 0.8975263888464478}. Best is trial 11 with value: 0.6773038119717333.[0m
[32m[I 2022-04-21 11:39:59,178][0m Trial 752 finished with value: 0.6738476114655684 and parameters: {'splitter': 'random', 'min_samples_split': 0.04408344916114079, 'min_samples_leaf': 0.02133442811793797, 'min_weight_fraction_leaf': 0.17521584535986734, 'max_features': 0.9993405217398031}. Best is trial 11 with value: 0.6773038119717333.[0m
[32m[I 2022-04-21 11:39:59,235][0m Trial 753 finished with value: 0.6430339026308982 and parameters: {'splitter': 'random', 'min_samples_split': 0.3448341429435977, 'min_samples_leaf': 0.026906256834257843, 'min_weight_fraction_leaf': 0.01497080757405535, 'max_features': 0.16742111685463223}. Best is trial 11 with value: 0.6773038119717333.[0m
[32m[I 2022-04-21 11:39:59,295][0m Trial 754 finished with value: 0.6215155824977587 and parameters: {'splitter': 'random', 'min_samples_split': 0.4474687797281263, 'min_samples_leaf': 0.1566931212010213, 'min_weight_fraction_leaf': 0.22536826842600716, 'max_features': 0.9520820449257784}. Best is trial 11 with value: 0.6773038119717333.[0m
[32m[I 2022-04-21 11:39:59,365][0m Trial 755 finished with value: 0.6738476114655684 and parameters: {'splitter': 'random', 'min_samples_split': 0.2209103370804067, 'min_samples_leaf': 0.012347609676467712, 'min_weight_fraction_leaf': 0.18448941902603766, 'max_features': 0.9921302371149104}. Best is trial 11 with value: 0.6773038119717333.[0m
[32m[I 2022-04-21 11:39:59,431][0m Trial 756 finished with value: 0.6612249417592866 and parameters: {'splitter': 'random', 'min_samples_split': 0.34730128627218, 'min_samples_leaf': 0.031705057246824195, 'min_weight_fraction_leaf': 7.748004390457745e-06, 'max_features': 0.8711082558430627}. Best is trial 11 with value: 0.6773038119717333.[0m
[32m[I 2022-04-21 11:39:59,501][0m Trial 757 finished with value: 0.6586187582319654 and parameters: {'splitter': 'random', 'min_samples_split': 0.20840259480845116, 'min_samples_leaf': 0.17159649382866637, 'min_weight_fraction_leaf': 0.21084573255263492, 'max_features': 0.9690614594003594}. Best is trial 11 with value: 0.6773038119717333.[0m
[32m[I 2022-04-21 11:39:59,583][0m Trial 758 finished with value: 0.5 and parameters: {'splitter': 'random', 'min_samples_split': 0.01899905355119008, 'min_samples_leaf': 0.1775959193756002, 'min_weight_fraction_leaf': 0.1322577298892876, 'max_features': 0.43709806065716084}. Best is trial 11 with value: 0.6773038119717333.[0m
[32m[I 2022-04-21 11:39:59,671][0m Trial 759 finished with value: 0.6738476114655684 and parameters: {'splitter': 'random', 'min_samples_split': 0.3862030082289021, 'min_samples_leaf': 0.17736220730662067, 'min_weight_fraction_leaf': 0.12319123920485928, 'max_features': 0.9220507880791416}. Best is trial 11 with value: 0.6773038119717333.[0m
[32m[I 2022-04-21 11:39:59,820][0m Trial 760 finished with value: 0.6654264366649357 and parameters: {'splitter': 'random', 'min_samples_split': 0.3324698466003535, 'min_samples_leaf': 0.025325149616571445, 'min_weight_fraction_leaf': 0.001195967594348495, 'max_features': 0.8845246205053832}. Best is trial 11 with value: 0.6773038119717333.[0m
[32m[I 2022-04-21 11:39:59,925][0m Trial 761 finished with value: 0.662800366349585 and parameters: {'splitter': 'random', 'min_samples_split': 0.03344221995169466, 'min_samples_leaf': 0.002425704729309579, 'min_weight_fraction_leaf': 0.16281350583541643, 'max_features': 0.9695031014971284}. Best is trial 11 with value: 0.6773038119717333.[0m
[32m[I 2022-04-21 11:40:00,007][0m Trial 762 finished with value: 0.6738476114655684 and parameters: {'splitter': 'random', 'min_samples_split': 0.32946493108795943, 'min_samples_leaf': 0.08548118692097693, 'min_weight_fraction_leaf': 0.18676247551049444, 'max_features': 0.88174008511453}. Best is trial 11 with value: 0.6773038119717333.[0m
[32m[I 2022-04-21 11:40:00,081][0m Trial 763 finished with value: 0.662800366349585 and parameters: {'splitter': 'random', 'min_samples_split': 0.06302157180983839, 'min_samples_leaf': 0.15981865739871032, 'min_weight_fraction_leaf': 0.14004469617695864, 'max_features': 0.969503871732081}. Best is trial 11 with value: 0.6773038119717333.[0m
[32m[I 2022-04-21 11:40:00,161][0m Trial 764 finished with value: 0.6637859212129908 and parameters: {'splitter': 'random', 'min_samples_split': 0.18685712443500926, 'min_samples_leaf': 0.014180982795827978, 'min_weight_fraction_leaf': 0.025579356575754296, 'max_features': 0.959027469368087}. Best is trial 11 with value: 0.6773038119717333.[0m
