No protocol specified
[32m[I 2022-04-21 11:37:34,503][0m A new study created in memory with name: no-name-e667012f-e431-4b9e-9bda-3e02e314798a[0m
[32m[I 2022-04-21 11:37:34,534][0m Trial 0 finished with value: 0.65 and parameters: {'splitter': 'random', 'min_samples_split': 0.4159540251147411, 'min_samples_leaf': 0.32988292121793594, 'min_weight_fraction_leaf': 0.45541113332577754, 'max_features': 0.6402098643457095}. Best is trial 0 with value: 0.65.[0m
[32m[I 2022-04-21 11:37:34,568][0m Trial 1 finished with value: 0.65 and parameters: {'splitter': 'best', 'min_samples_split': 0.08953396244173113, 'min_samples_leaf': 0.1577023053866163, 'min_weight_fraction_leaf': 0.0894971834442766, 'max_features': 0.3471510000699547}. Best is trial 0 with value: 0.65.[0m
[32m[I 2022-04-21 11:37:34,599][0m Trial 2 finished with value: 0.65 and parameters: {'splitter': 'best', 'min_samples_split': 0.4373757712264652, 'min_samples_leaf': 0.044704346189523264, 'min_weight_fraction_leaf': 0.2495737112632484, 'max_features': 0.4388570509105667}. Best is trial 0 with value: 0.65.[0m
[32m[I 2022-04-21 11:37:34,630][0m Trial 3 finished with value: 0.65 and parameters: {'splitter': 'best', 'min_samples_split': 0.20954385724531577, 'min_samples_leaf': 0.4164440882538961, 'min_weight_fraction_leaf': 0.2658794073090513, 'max_features': 0.36488207211109813}. Best is trial 0 with value: 0.65.[0m
[32m[I 2022-04-21 11:37:34,665][0m Trial 4 finished with value: 0.8318450474400789 and parameters: {'splitter': 'best', 'min_samples_split': 0.03920766374217067, 'min_samples_leaf': 0.03447057155455245, 'min_weight_fraction_leaf': 0.28539833509217427, 'max_features': 0.6574944218957823}. Best is trial 4 with value: 0.8318450474400789.[0m
[32m[I 2022-04-21 11:37:34,696][0m Trial 5 finished with value: 0.65 and parameters: {'splitter': 'random', 'min_samples_split': 0.2620771624727105, 'min_samples_leaf': 0.11528620102539837, 'min_weight_fraction_leaf': 0.44385034172378557, 'max_features': 0.89123930220888}. Best is trial 4 with value: 0.8318450474400789.[0m
[32m[I 2022-04-21 11:37:34,726][0m Trial 6 finished with value: 0.65 and parameters: {'splitter': 'random', 'min_samples_split': 0.04245976157096169, 'min_samples_leaf': 0.11250421631806404, 'min_weight_fraction_leaf': 0.3688035881967618, 'max_features': 0.9836094182022508}. Best is trial 4 with value: 0.8318450474400789.[0m
[32m[I 2022-04-21 11:37:34,800][0m Trial 7 finished with value: 0.65 and parameters: {'splitter': 'best', 'min_samples_split': 0.20225009919501347, 'min_samples_leaf': 0.11977593245385927, 'min_weight_fraction_leaf': 0.2701948273875362, 'max_features': 0.2596363863585929}. Best is trial 4 with value: 0.8318450474400789.[0m
[32m[I 2022-04-21 11:37:34,864][0m Trial 8 finished with value: 0.65 and parameters: {'splitter': 'random', 'min_samples_split': 0.214005278193943, 'min_samples_leaf': 0.42332111258766003, 'min_weight_fraction_leaf': 0.09510884848331991, 'max_features': 0.4037585727027051}. Best is trial 4 with value: 0.8318450474400789.[0m
[32m[I 2022-04-21 11:37:34,896][0m Trial 9 finished with value: 0.65 and parameters: {'splitter': 'random', 'min_samples_split': 0.4880627055328612, 'min_samples_leaf': 0.4795126958222792, 'min_weight_fraction_leaf': 0.4855715893005729, 'max_features': 0.028464592779068765}. Best is trial 4 with value: 0.8318450474400789.[0m
[32m[I 2022-04-21 11:37:34,939][0m Trial 10 finished with value: 0.8318450474400789 and parameters: {'splitter': 'best', 'min_samples_split': 0.007754676991341025, 'min_samples_leaf': 0.2605994159821688, 'min_weight_fraction_leaf': 0.007773676438136423, 'max_features': 0.6885453283668677}. Best is trial 4 with value: 0.8318450474400789.[0m
[32m[I 2022-04-21 11:37:34,987][0m Trial 11 finished with value: 0.8318450474400789 and parameters: {'splitter': 'best', 'min_samples_split': 0.003729102900337025, 'min_samples_leaf': 0.2541513337995756, 'min_weight_fraction_leaf': 0.006455909007490471, 'max_features': 0.6821574483739737}. Best is trial 4 with value: 0.8318450474400789.[0m
[32m[I 2022-04-21 11:37:35,036][0m Trial 12 finished with value: 0.8318450474400789 and parameters: {'splitter': 'best', 'min_samples_split': 0.11107003971937002, 'min_samples_leaf': 0.25124424215737534, 'min_weight_fraction_leaf': 0.1651419355018704, 'max_features': 0.7059979779067022}. Best is trial 4 with value: 0.8318450474400789.[0m
[32m[I 2022-04-21 11:37:35,084][0m Trial 13 finished with value: 0.703831508598297 and parameters: {'splitter': 'best', 'min_samples_split': 0.11339829258149028, 'min_samples_leaf': 0.015098515683637855, 'min_weight_fraction_leaf': 0.32275972119596336, 'max_features': 0.7869038733313314}. Best is trial 4 with value: 0.8318450474400789.[0m
[32m[I 2022-04-21 11:37:35,123][0m Trial 14 finished with value: 0.703831508598297 and parameters: {'splitter': 'best', 'min_samples_split': 0.0012682582505963644, 'min_samples_leaf': 0.31981391643026313, 'min_weight_fraction_leaf': 0.178077927932289, 'max_features': 0.6059220002881381}. Best is trial 4 with value: 0.8318450474400789.[0m
[32m[I 2022-04-21 11:37:35,171][0m Trial 15 finished with value: 0.65 and parameters: {'splitter': 'best', 'min_samples_split': 0.1574814915235952, 'min_samples_leaf': 0.19630392358809123, 'min_weight_fraction_leaf': 0.36682929915906215, 'max_features': 0.5555643170237794}. Best is trial 4 with value: 0.8318450474400789.[0m
[32m[I 2022-04-21 11:37:35,223][0m Trial 16 finished with value: 0.6744920180162803 and parameters: {'splitter': 'best', 'min_samples_split': 0.2979184442224869, 'min_samples_leaf': 0.32703228620098856, 'min_weight_fraction_leaf': 0.19548213285645197, 'max_features': 0.7782620956481142}. Best is trial 4 with value: 0.8318450474400789.[0m
[32m[I 2022-04-21 11:37:35,271][0m Trial 17 finished with value: 0.8318450474400789 and parameters: {'splitter': 'best', 'min_samples_split': 0.09458193113922028, 'min_samples_leaf': 0.19804820416976626, 'min_weight_fraction_leaf': 0.14960153436114715, 'max_features': 0.8452155769048847}. Best is trial 4 with value: 0.8318450474400789.[0m
[32m[I 2022-04-21 11:37:35,324][0m Trial 18 finished with value: 0.8348090784895354 and parameters: {'splitter': 'best', 'min_samples_split': 0.32055042982050513, 'min_samples_leaf': 0.05775387190628076, 'min_weight_fraction_leaf': 0.1108387529933258, 'max_features': 0.8488994592896353}. Best is trial 18 with value: 0.8348090784895354.[0m
[32m[I 2022-04-21 11:37:35,383][0m Trial 19 finished with value: 0.8365872183644096 and parameters: {'splitter': 'best', 'min_samples_split': 0.33305786389083253, 'min_samples_leaf': 0.057243481891471326, 'min_weight_fraction_leaf': 0.09520705825172257, 'max_features': 0.9379602988905407}. Best is trial 19 with value: 0.8365872183644096.[0m
[32m[I 2022-04-21 11:37:35,473][0m Trial 20 finished with value: 0.8366717314767083 and parameters: {'splitter': 'best', 'min_samples_split': 0.3540322633856762, 'min_samples_leaf': 0.08133772335562667, 'min_weight_fraction_leaf': 0.07327582075557912, 'max_features': 0.9902128896671065}. Best is trial 20 with value: 0.8366717314767083.[0m
[32m[I 2022-04-21 11:37:35,575][0m Trial 21 finished with value: 0.837083811404636 and parameters: {'splitter': 'best', 'min_samples_split': 0.33699975836225393, 'min_samples_leaf': 0.06959572029804688, 'min_weight_fraction_leaf': 0.06626438815798075, 'max_features': 0.9788894532642581}. Best is trial 21 with value: 0.837083811404636.[0m
[32m[I 2022-04-21 11:37:35,750][0m Trial 22 finished with value: 0.8329615567419848 and parameters: {'splitter': 'best', 'min_samples_split': 0.3712691242610666, 'min_samples_leaf': 0.08756895982902085, 'min_weight_fraction_leaf': 0.048060273419556564, 'max_features': 0.9678987628983567}. Best is trial 21 with value: 0.837083811404636.[0m
[32m[I 2022-04-21 11:37:35,861][0m Trial 23 finished with value: 0.8332692532720088 and parameters: {'splitter': 'best', 'min_samples_split': 0.35129101873246177, 'min_samples_leaf': 0.16604718242159128, 'min_weight_fraction_leaf': 0.051231458708034104, 'max_features': 0.9186707993138543}. Best is trial 21 with value: 0.837083811404636.[0m
[32m[I 2022-04-21 11:37:35,927][0m Trial 24 finished with value: 0.8335232647944558 and parameters: {'splitter': 'best', 'min_samples_split': 0.39163585645788845, 'min_samples_leaf': 0.08144137872711796, 'min_weight_fraction_leaf': 0.13286165777327769, 'max_features': 0.9802548112991228}. Best is trial 21 with value: 0.837083811404636.[0m
[32m[I 2022-04-21 11:37:35,989][0m Trial 25 finished with value: 0.8355801993971674 and parameters: {'splitter': 'best', 'min_samples_split': 0.28379975460953855, 'min_samples_leaf': 0.007535269433100511, 'min_weight_fraction_leaf': 0.05931363001794562, 'max_features': 0.7723086036470505}. Best is trial 21 with value: 0.837083811404636.[0m
[32m[I 2022-04-21 11:37:36,061][0m Trial 26 finished with value: 0.8369238057327841 and parameters: {'splitter': 'random', 'min_samples_split': 0.3408048576921468, 'min_samples_leaf': 0.15862291067924736, 'min_weight_fraction_leaf': 0.20125197352031274, 'max_features': 0.8993066529316025}. Best is trial 21 with value: 0.837083811404636.[0m
[32m[I 2022-04-21 11:37:36,170][0m Trial 27 finished with value: 0.8275702650581869 and parameters: {'splitter': 'random', 'min_samples_split': 0.4608346214683221, 'min_samples_leaf': 0.16178584805957105, 'min_weight_fraction_leaf': 0.22205831401688597, 'max_features': 0.8568918310360855}. Best is trial 21 with value: 0.837083811404636.[0m
[32m[I 2022-04-21 11:37:36,218][0m Trial 28 finished with value: 0.65 and parameters: {'splitter': 'random', 'min_samples_split': 0.3786636404912824, 'min_samples_leaf': 0.2080864189957028, 'min_weight_fraction_leaf': 0.21842258690926425, 'max_features': 0.19547212665089958}. Best is trial 21 with value: 0.837083811404636.[0m
[32m[I 2022-04-21 11:37:36,261][0m Trial 29 finished with value: 0.8251040446672375 and parameters: {'splitter': 'random', 'min_samples_split': 0.4175626451250187, 'min_samples_leaf': 0.14910022660654185, 'min_weight_fraction_leaf': 0.13704298817936644, 'max_features': 0.9950577758561904}. Best is trial 21 with value: 0.837083811404636.[0m
[32m[I 2022-04-21 11:37:36,311][0m Trial 30 finished with value: 0.8328986713538862 and parameters: {'splitter': 'random', 'min_samples_split': 0.3115460837063791, 'min_samples_leaf': 0.08261465307396694, 'min_weight_fraction_leaf': 0.03629712694739939, 'max_features': 0.8003044399327384}. Best is trial 21 with value: 0.837083811404636.[0m
[32m[I 2022-04-21 11:37:36,438][0m Trial 31 finished with value: 0.8320350511466381 and parameters: {'splitter': 'random', 'min_samples_split': 0.34610821350443066, 'min_samples_leaf': 0.062479839418534903, 'min_weight_fraction_leaf': 0.0965252837293965, 'max_features': 0.9426776734855603}. Best is trial 21 with value: 0.837083811404636.[0m
[32m[I 2022-04-21 11:37:36,558][0m Trial 32 finished with value: 0.8320350511466381 and parameters: {'splitter': 'random', 'min_samples_split': 0.33952070470929246, 'min_samples_leaf': 0.11854805087626552, 'min_weight_fraction_leaf': 0.08121815819384443, 'max_features': 0.9248222150136264}. Best is trial 21 with value: 0.837083811404636.[0m
[32m[I 2022-04-21 11:37:36,649][0m Trial 33 finished with value: 0.8343194359041494 and parameters: {'splitter': 'best', 'min_samples_split': 0.26561056924981713, 'min_samples_leaf': 0.0381996331490119, 'min_weight_fraction_leaf': 0.12357678902693182, 'max_features': 0.8834513790894067}. Best is trial 21 with value: 0.837083811404636.[0m
[32m[I 2022-04-21 11:37:36,741][0m Trial 34 finished with value: 0.8332692532720088 and parameters: {'splitter': 'best', 'min_samples_split': 0.4030177595166252, 'min_samples_leaf': 0.14973554656507912, 'min_weight_fraction_leaf': 0.07902546931719294, 'max_features': 0.9970709165089597}. Best is trial 21 with value: 0.837083811404636.[0m
[32m[I 2022-04-21 11:37:36,836][0m Trial 35 finished with value: 0.65 and parameters: {'splitter': 'best', 'min_samples_split': 0.42779386205160985, 'min_samples_leaf': 0.08510646502222305, 'min_weight_fraction_leaf': 0.19705072466181586, 'max_features': 0.4964164781136916}. Best is trial 21 with value: 0.837083811404636.[0m
[32m[I 2022-04-21 11:37:36,928][0m Trial 36 finished with value: 0.8343319615060419 and parameters: {'splitter': 'best', 'min_samples_split': 0.23847484743807343, 'min_samples_leaf': 0.005118483810983676, 'min_weight_fraction_leaf': 0.026811152051304875, 'max_features': 0.9160553267991077}. Best is trial 21 with value: 0.837083811404636.[0m
[32m[I 2022-04-21 11:37:37,046][0m Trial 37 finished with value: 0.8328283795746092 and parameters: {'splitter': 'random', 'min_samples_split': 0.3257301602454648, 'min_samples_leaf': 0.05016659459566808, 'min_weight_fraction_leaf': 0.06508281868108307, 'max_features': 0.7482424709394062}. Best is trial 21 with value: 0.837083811404636.[0m
[32m[I 2022-04-21 11:37:37,149][0m Trial 38 finished with value: 0.720122309788786 and parameters: {'splitter': 'best', 'min_samples_split': 0.35965862785997216, 'min_samples_leaf': 0.29056438157216335, 'min_weight_fraction_leaf': 0.3087932873460761, 'max_features': 0.830309608650596}. Best is trial 21 with value: 0.837083811404636.[0m
[32m[I 2022-04-21 11:37:37,219][0m Trial 39 finished with value: 0.65 and parameters: {'splitter': 'random', 'min_samples_split': 0.4497144442852081, 'min_samples_leaf': 0.13545617874397553, 'min_weight_fraction_leaf': 0.23212268251946774, 'max_features': 0.6189155714163174}. Best is trial 21 with value: 0.837083811404636.[0m
[32m[I 2022-04-21 11:37:37,332][0m Trial 40 finished with value: 0.8342186517555936 and parameters: {'splitter': 'best', 'min_samples_split': 0.290145114820031, 'min_samples_leaf': 0.10740257405286745, 'min_weight_fraction_leaf': 0.1092481373945181, 'max_features': 0.8868869933557019}. Best is trial 21 with value: 0.837083811404636.[0m
[32m[I 2022-04-21 11:37:37,429][0m Trial 41 finished with value: 0.8340187950162761 and parameters: {'splitter': 'best', 'min_samples_split': 0.28313561623825384, 'min_samples_leaf': 0.024652088602920882, 'min_weight_fraction_leaf': 0.06567614941621085, 'max_features': 0.7386639042302483}. Best is trial 21 with value: 0.837083811404636.[0m
[32m[I 2022-04-21 11:37:37,526][0m Trial 42 finished with value: 0.8368835244060235 and parameters: {'splitter': 'best', 'min_samples_split': 0.23338041971705886, 'min_samples_leaf': 0.0066237577370590476, 'min_weight_fraction_leaf': 0.031206880549370965, 'max_features': 0.9382983436966967}. Best is trial 21 with value: 0.837083811404636.[0m
[32m[I 2022-04-21 11:37:37,645][0m Trial 43 finished with value: 0.8332692532720088 and parameters: {'splitter': 'best', 'min_samples_split': 0.237904652884179, 'min_samples_leaf': 0.04046228772099479, 'min_weight_fraction_leaf': 0.16049616122568294, 'max_features': 0.9450704659813773}. Best is trial 21 with value: 0.837083811404636.[0m
[32m[I 2022-04-21 11:37:37,686][0m Trial 44 finished with value: 0.8370547382698911 and parameters: {'splitter': 'best', 'min_samples_split': 0.21612768599564824, 'min_samples_leaf': 0.060421912155625465, 'min_weight_fraction_leaf': 0.02237076309810597, 'max_features': 0.8940746211360964}. Best is trial 21 with value: 0.837083811404636.[0m
[32m[I 2022-04-21 11:37:37,725][0m Trial 45 finished with value: 0.833988554983085 and parameters: {'splitter': 'best', 'min_samples_split': 0.17504110235824544, 'min_samples_leaf': 0.09616958397423583, 'min_weight_fraction_leaf': 0.04505205178248278, 'max_features': 0.8210773523541379}. Best is trial 21 with value: 0.837083811404636.[0m
[32m[I 2022-04-21 11:37:37,906][0m Trial 46 finished with value: 0.8318450474400789 and parameters: {'splitter': 'best', 'min_samples_split': 0.21319531442391984, 'min_samples_leaf': 0.21846246100871364, 'min_weight_fraction_leaf': 0.01936875885222152, 'max_features': 0.8844163034560112}. Best is trial 21 with value: 0.837083811404636.[0m
[32m[I 2022-04-21 11:37:38,021][0m Trial 47 finished with value: 0.65 and parameters: {'splitter': 'random', 'min_samples_split': 0.16436325508814814, 'min_samples_leaf': 0.1795876192079235, 'min_weight_fraction_leaf': 0.005190858980262003, 'max_features': 0.2714888392824366}. Best is trial 21 with value: 0.837083811404636.[0m
[32m[I 2022-04-21 11:37:38,233][0m Trial 48 finished with value: 0.8328978783341231 and parameters: {'splitter': 'best', 'min_samples_split': 0.19116127199546287, 'min_samples_leaf': 0.13264424939122937, 'min_weight_fraction_leaf': 0.028623326228069106, 'max_features': 0.8836031571032777}. Best is trial 21 with value: 0.837083811404636.[0m
[32m[I 2022-04-21 11:37:38,331][0m Trial 49 finished with value: 0.65 and parameters: {'splitter': 'best', 'min_samples_split': 0.2574848788232192, 'min_samples_leaf': 0.07532363619788812, 'min_weight_fraction_leaf': 0.3556748792759264, 'max_features': 0.9991162445436962}. Best is trial 21 with value: 0.837083811404636.[0m
[32m[I 2022-04-21 11:37:38,378][0m Trial 50 finished with value: 0.65 and parameters: {'splitter': 'best', 'min_samples_split': 0.14362545654190845, 'min_samples_leaf': 0.025016997875653882, 'min_weight_fraction_leaf': 0.41711416778828025, 'max_features': 0.10528172048598211}. Best is trial 21 with value: 0.837083811404636.[0m
[32m[I 2022-04-21 11:37:38,417][0m Trial 51 finished with value: 0.8294029951776167 and parameters: {'splitter': 'best', 'min_samples_split': 0.3892235253287549, 'min_samples_leaf': 0.06834416474902655, 'min_weight_fraction_leaf': 0.0009030410236146556, 'max_features': 0.9542865450818973}. Best is trial 21 with value: 0.837083811404636.[0m
[32m[I 2022-04-21 11:37:38,471][0m Trial 52 finished with value: 0.8336507898841621 and parameters: {'splitter': 'best', 'min_samples_split': 0.30817812980232995, 'min_samples_leaf': 0.04763518287698352, 'min_weight_fraction_leaf': 0.09057823927761202, 'max_features': 0.9219548466548602}. Best is trial 21 with value: 0.837083811404636.[0m
[32m[I 2022-04-21 11:37:38,565][0m Trial 53 finished with value: 0.833988554983085 and parameters: {'splitter': 'best', 'min_samples_split': 0.23109972053731376, 'min_samples_leaf': 0.10010969246719859, 'min_weight_fraction_leaf': 0.07428196264195436, 'max_features': 0.9507504292741307}. Best is trial 21 with value: 0.837083811404636.[0m
[32m[I 2022-04-21 11:37:38,662][0m Trial 54 finished with value: 0.65 and parameters: {'splitter': 'best', 'min_samples_split': 0.32750671058726916, 'min_samples_leaf': 0.3925135833053207, 'min_weight_fraction_leaf': 0.10563807356025665, 'max_features': 0.8597675778260744}. Best is trial 21 with value: 0.837083811404636.[0m
[32m[I 2022-04-21 11:37:38,748][0m Trial 55 finished with value: 0.8318450474400789 and parameters: {'splitter': 'best', 'min_samples_split': 0.26914587010978874, 'min_samples_leaf': 0.0261108691770797, 'min_weight_fraction_leaf': 0.2552279861812108, 'max_features': 0.814582543305097}. Best is trial 21 with value: 0.837083811404636.[0m
[32m[I 2022-04-21 11:37:38,846][0m Trial 56 finished with value: 0.8318450474400789 and parameters: {'splitter': 'best', 'min_samples_split': 0.3700432382688035, 'min_samples_leaf': 0.22846876384691533, 'min_weight_fraction_leaf': 0.0481444511525877, 'max_features': 0.9184740326661123}. Best is trial 21 with value: 0.837083811404636.[0m
[32m[I 2022-04-21 11:37:38,903][0m Trial 57 finished with value: 0.8370547382698911 and parameters: {'splitter': 'best', 'min_samples_split': 0.19461164648042933, 'min_samples_leaf': 0.059817428627270935, 'min_weight_fraction_leaf': 0.02202939478738987, 'max_features': 0.9651058623385035}. Best is trial 21 with value: 0.837083811404636.[0m
[32m[I 2022-04-21 11:37:39,036][0m Trial 58 finished with value: 0.8333153638448335 and parameters: {'splitter': 'random', 'min_samples_split': 0.19522552448134728, 'min_samples_leaf': 0.004793188823238471, 'min_weight_fraction_leaf': 0.020735150608766198, 'max_features': 0.7268489062112363}. Best is trial 21 with value: 0.837083811404636.[0m
[32m[I 2022-04-21 11:37:39,230][0m Trial 59 finished with value: 0.8328978783341231 and parameters: {'splitter': 'best', 'min_samples_split': 0.14542478978389597, 'min_samples_leaf': 0.13346986597394894, 'min_weight_fraction_leaf': 0.01880360402733618, 'max_features': 0.9633971212179714}. Best is trial 21 with value: 0.837083811404636.[0m
[32m[I 2022-04-21 11:37:39,352][0m Trial 60 finished with value: 0.8363914938304864 and parameters: {'splitter': 'best', 'min_samples_split': 0.22310643403959304, 'min_samples_leaf': 0.06766167330413997, 'min_weight_fraction_leaf': 0.038804436091025886, 'max_features': 0.8586230749649469}. Best is trial 21 with value: 0.837083811404636.[0m
[32m[I 2022-04-21 11:37:39,481][0m Trial 61 finished with value: 0.8344061516113556 and parameters: {'splitter': 'best', 'min_samples_split': 0.29847354746264787, 'min_samples_leaf': 0.04985560653257283, 'min_weight_fraction_leaf': 0.06021264995557156, 'max_features': 0.9691982844317698}. Best is trial 21 with value: 0.837083811404636.[0m
[32m[I 2022-04-21 11:37:39,611][0m Trial 62 finished with value: 0.8345423504159257 and parameters: {'splitter': 'best', 'min_samples_split': 0.33602846781497164, 'min_samples_leaf': 0.10307013552404085, 'min_weight_fraction_leaf': 0.12657855984150637, 'max_features': 0.9045376495594333}. Best is trial 21 with value: 0.837083811404636.[0m
[32m[I 2022-04-21 11:37:39,771][0m Trial 63 finished with value: 0.833988554983085 and parameters: {'splitter': 'best', 'min_samples_split': 0.24362377440997432, 'min_samples_leaf': 0.030768181398468437, 'min_weight_fraction_leaf': 0.08420324960640381, 'max_features': 0.9424235122427047}. Best is trial 21 with value: 0.837083811404636.[0m
