[32m[I 2022-04-21 15:14:30,213][0m Trial 443 finished with value: 0.8275872951427626 and parameters: {'loss': 'coxph', 'learning_rate': 0.012871468175118556, 'n_estimators': 646, 'criterion': 'friedman_mse', 'min_samples_split': 2, 'min_samples_leaf': 4, 'min_weight_fraction_leaf': 0.043411638862465976, 'min_impurity_decrease': 0.468956255755305, 'max_features': 0.5536828309725851, 'subsample': 0.42444691761039116, 'dropout_rate': 0.9899291864600239, 'ccp_alpha': 0.006734196816155119}. Best is trial 434 with value: 0.8310153865446737.[0m
[32m[I 2022-04-21 15:14:47,900][0m Trial 444 finished with value: 0.8268924126144164 and parameters: {'loss': 'coxph', 'learning_rate': 0.017960130213460147, 'n_estimators': 576, 'criterion': 'friedman_mse', 'min_samples_split': 2, 'min_samples_leaf': 4, 'min_weight_fraction_leaf': 0.031224570039613583, 'min_impurity_decrease': 0.4540061170343851, 'max_features': 0.5225241516882094, 'subsample': 0.44428364653445657, 'dropout_rate': 0.993796665384846, 'ccp_alpha': 0.001904793543610248}. Best is trial 434 with value: 0.8310153865446737.[0m
[32m[I 2022-04-21 15:15:12,489][0m Trial 445 finished with value: 0.8125919834033326 and parameters: {'loss': 'coxph', 'learning_rate': 0.027784583145149474, 'n_estimators': 605, 'criterion': 'friedman_mse', 'min_samples_split': 2, 'min_samples_leaf': 4, 'min_weight_fraction_leaf': 0.050954679986075585, 'min_impurity_decrease': 0.4848049568168385, 'max_features': 0.5745381518541987, 'subsample': 0.4522776207897162, 'dropout_rate': 0.9664960029957324, 'ccp_alpha': 0.1440271178341262}. Best is trial 434 with value: 0.8310153865446737.[0m
[32m[I 2022-04-21 15:15:42,661][0m Trial 446 finished with value: 0.8279655195993257 and parameters: {'loss': 'coxph', 'learning_rate': 0.01704300708474327, 'n_estimators': 714, 'criterion': 'friedman_mse', 'min_samples_split': 2, 'min_samples_leaf': 4, 'min_weight_fraction_leaf': 0.03893430520096487, 'min_impurity_decrease': 0.45540339193215684, 'max_features': 0.5449151238805334, 'subsample': 0.43989895629863834, 'dropout_rate': 0.9660072942538949, 'ccp_alpha': 0.0013220140108353294}. Best is trial 434 with value: 0.8310153865446737.[0m
[32m[I 2022-04-21 15:16:00,610][0m Trial 447 finished with value: 0.8301505596595351 and parameters: {'loss': 'coxph', 'learning_rate': 0.01327761401203714, 'n_estimators': 535, 'criterion': 'friedman_mse', 'min_samples_split': 2, 'min_samples_leaf': 4, 'min_weight_fraction_leaf': 0.05592228733183703, 'min_impurity_decrease': 0.4773664016936586, 'max_features': 0.6064388891053318, 'subsample': 0.3906599783281325, 'dropout_rate': 0.9774482111889112, 'ccp_alpha': 0.0012548292357316831}. Best is trial 434 with value: 0.8310153865446737.[0m
[32m[I 2022-04-21 15:16:17,293][0m Trial 448 finished with value: 0.3822220862371197 and parameters: {'loss': 'coxph', 'learning_rate': 0.014601869230076748, 'n_estimators': 593, 'criterion': 'friedman_mse', 'min_samples_split': 2, 'min_samples_leaf': 4, 'min_weight_fraction_leaf': 0.04882635157138783, 'min_impurity_decrease': 0.47977335405514115, 'max_features': 0.6015121640463652, 'subsample': 0.38377695723237976, 'dropout_rate': 0.9847301102461263, 'ccp_alpha': 0.18716346722100918}. Best is trial 434 with value: 0.8310153865446737.[0m
[32m[I 2022-04-21 15:16:32,781][0m Trial 449 finished with value: 0.4829759631521161 and parameters: {'loss': 'coxph', 'learning_rate': 0.021978133735855533, 'n_estimators': 613, 'criterion': 'friedman_mse', 'min_samples_split': 2, 'min_samples_leaf': 4, 'min_weight_fraction_leaf': 0.062059533350411755, 'min_impurity_decrease': 0.475233144799728, 'max_features': 0.5650208991313314, 'subsample': 0.4057759114231681, 'dropout_rate': 0.9983274568906305, 'ccp_alpha': 0.18278459679200096}. Best is trial 434 with value: 0.8310153865446737.[0m
[32m[I 2022-04-21 15:17:00,047][0m Trial 450 finished with value: 0.8282502102210298 and parameters: {'loss': 'coxph', 'learning_rate': 0.016274317609269846, 'n_estimators': 560, 'criterion': 'friedman_mse', 'min_samples_split': 2, 'min_samples_leaf': 4, 'min_weight_fraction_leaf': 0.06716014357884237, 'min_impurity_decrease': 0.45440116480681775, 'max_features': 0.5815860488910978, 'subsample': 0.39653995969242684, 'dropout_rate': 0.9588561434314693, 'ccp_alpha': 0.004938102495466364}. Best is trial 434 with value: 0.8310153865446737.[0m
[32m[I 2022-04-21 15:17:17,737][0m Trial 451 finished with value: 0.25 and parameters: {'loss': 'coxph', 'learning_rate': 0.014532367955164844, 'n_estimators': 529, 'criterion': 'friedman_mse', 'min_samples_split': 2, 'min_samples_leaf': 4, 'min_weight_fraction_leaf': 0.03750705775123243, 'min_impurity_decrease': 0.4883897962109783, 'max_features': 0.5933830681930926, 'subsample': 0.004991337641499782, 'dropout_rate': 0.9685892589410932, 'ccp_alpha': 0.11338154432075079}. Best is trial 434 with value: 0.8310153865446737.[0m
[32m[I 2022-04-21 15:17:46,391][0m Trial 452 finished with value: 0.8255266574635873 and parameters: {'loss': 'coxph', 'learning_rate': 0.018944302202543343, 'n_estimators': 571, 'criterion': 'friedman_mse', 'min_samples_split': 2, 'min_samples_leaf': 4, 'min_weight_fraction_leaf': 0.05909564802024779, 'min_impurity_decrease': 0.4578633587449259, 'max_features': 0.5694288941240803, 'subsample': 0.3970529414096544, 'dropout_rate': 0.9569028259425121, 'ccp_alpha': 0.0917199959359323}. Best is trial 434 with value: 0.8310153865446737.[0m
[32m[I 2022-04-21 15:18:03,050][0m Trial 453 finished with value: 0.25 and parameters: {'loss': 'coxph', 'learning_rate': 0.016251874380587544, 'n_estimators': 549, 'criterion': 'absolute_error', 'min_samples_split': 2, 'min_samples_leaf': 4, 'min_weight_fraction_leaf': 0.04811624235472706, 'min_impurity_decrease': 0.4683731569644699, 'max_features': 0.5535965580340061, 'subsample': 0.4236825638754993, 'dropout_rate': 0.9999742726309739, 'ccp_alpha': 0.1984107442394506}. Best is trial 434 with value: 0.8310153865446737.[0m
/media/san2_ssd/data/Workdir/survival/venv/lib/python3.8/site-packages/sksurv/ensemble/boosting.py:955: RuntimeWarning: divide by zero encountered in log
  time = numpy.log(time)
/media/san2_ssd/data/Workdir/survival/venv/lib/python3.8/site-packages/sksurv/ensemble/boosting.py:955: RuntimeWarning: divide by zero encountered in log
  time = numpy.log(time)
/media/san2_ssd/data/Workdir/survival/venv/lib/python3.8/site-packages/sksurv/ensemble/boosting.py:955: RuntimeWarning: divide by zero encountered in log
  time = numpy.log(time)
/media/san2_ssd/data/Workdir/survival/venv/lib/python3.8/site-packages/sksurv/ensemble/boosting.py:955: RuntimeWarning: divide by zero encountered in log
  time = numpy.log(time)
[32m[I 2022-04-21 15:18:05,751][0m Trial 454 finished with value: -0.4663865189650063 and parameters: {'loss': 'squared', 'learning_rate': 0.04136853686257003, 'n_estimators': 535, 'criterion': 'squared_error', 'min_samples_split': 2, 'min_samples_leaf': 4, 'min_weight_fraction_leaf': 0.06776214805084729, 'min_impurity_decrease': 0.5002297808573422, 'max_features': 0.5785475668274981, 'subsample': 0.46633513092896045, 'dropout_rate': 0.9753025971030356, 'ccp_alpha': 0.0021771447886228274}. Best is trial 434 with value: 0.8310153865446737.[0m
[32m[I 2022-04-21 15:18:36,232][0m Trial 455 finished with value: 0.2503270102305002 and parameters: {'loss': 'coxph', 'learning_rate': 0.02488747162629478, 'n_estimators': 621, 'criterion': 'friedman_mse', 'min_samples_split': 2, 'min_samples_leaf': 4, 'min_weight_fraction_leaf': 0.06817424755592802, 'min_impurity_decrease': 0.4524919851908538, 'max_features': 0.5282524764416368, 'subsample': 0.4067808020748117, 'dropout_rate': 0.9495139619800871, 'ccp_alpha': 0.3361175174411381}. Best is trial 434 with value: 0.8310153865446737.[0m
[32m[I 2022-04-21 15:18:58,753][0m Trial 456 finished with value: 0.82889226491084 and parameters: {'loss': 'coxph', 'learning_rate': 0.010663988929080943, 'n_estimators': 572, 'criterion': 'friedman_mse', 'min_samples_split': 2, 'min_samples_leaf': 4, 'min_weight_fraction_leaf': 0.05666002343565289, 'min_impurity_decrease': 0.47918137710799197, 'max_features': 0.583197671133721, 'subsample': 0.39117991964466753, 'dropout_rate': 0.9735623518197299, 'ccp_alpha': 0.0033331917632067184}. Best is trial 434 with value: 0.8310153865446737.[0m
[32m[I 2022-04-21 15:19:18,957][0m Trial 457 finished with value: 0.8231875298155957 and parameters: {'loss': 'coxph', 'learning_rate': 0.020455091275934017, 'n_estimators': 516, 'criterion': 'friedman_mse', 'min_samples_split': 2, 'min_samples_leaf': 4, 'min_weight_fraction_leaf': 0.03787782925759156, 'min_impurity_decrease': 0.4914211894136954, 'max_features': 0.5835922065498039, 'subsample': 0.3841592295073977, 'dropout_rate': 0.9766403105815052, 'ccp_alpha': 0.11122461592731454}. Best is trial 434 with value: 0.8310153865446737.[0m
[32m[I 2022-04-21 15:19:45,221][0m Trial 458 finished with value: 0.37227935557930786 and parameters: {'loss': 'coxph', 'learning_rate': 0.00995606220713053, 'n_estimators': 559, 'criterion': 'friedman_mse', 'min_samples_split': 2, 'min_samples_leaf': 4, 'min_weight_fraction_leaf': 0.0545437260781298, 'min_impurity_decrease': 0.47019301017672027, 'max_features': 0.5446421852683061, 'subsample': 0.387372793147121, 'dropout_rate': 0.9602082502703853, 'ccp_alpha': 0.22334719443936785}. Best is trial 434 with value: 0.8310153865446737.[0m
[32m[I 2022-04-21 15:20:03,243][0m Trial 459 finished with value: 0.8290409520127422 and parameters: {'loss': 'coxph', 'learning_rate': 0.01502371899645076, 'n_estimators': 587, 'criterion': 'friedman_mse', 'min_samples_split': 2, 'min_samples_leaf': 4, 'min_weight_fraction_leaf': 0.04903118940682421, 'min_impurity_decrease': 0.4828860936350635, 'max_features': 0.5123884327394876, 'subsample': 0.4154638965687045, 'dropout_rate': 0.9988231188606125, 'ccp_alpha': 0.002978547882693929}. Best is trial 434 with value: 0.8310153865446737.[0m
[32m[I 2022-04-21 15:20:21,375][0m Trial 460 finished with value: 0.8240387245775047 and parameters: {'loss': 'coxph', 'learning_rate': 0.015343792702257109, 'n_estimators': 582, 'criterion': 'friedman_mse', 'min_samples_split': 2, 'min_samples_leaf': 4, 'min_weight_fraction_leaf': 0.028462254167784657, 'min_impurity_decrease': 0.5137826865653261, 'max_features': 0.5303010030590947, 'subsample': 0.42757869272104787, 'dropout_rate': 0.9960478585082264, 'ccp_alpha': 0.10990290240057092}. Best is trial 434 with value: 0.8310153865446737.[0m
[32m[I 2022-04-21 15:20:40,446][0m Trial 461 finished with value: 0.8287030637169648 and parameters: {'loss': 'coxph', 'learning_rate': 0.03534870116912703, 'n_estimators': 583, 'criterion': 'friedman_mse', 'min_samples_split': 2, 'min_samples_leaf': 5, 'min_weight_fraction_leaf': 0.043491889999802746, 'min_impurity_decrease': 0.4956385136054446, 'max_features': 0.47470123771678047, 'subsample': 0.43561561129858917, 'dropout_rate': 0.9846531964024168, 'ccp_alpha': 0.0017736815024866376}. Best is trial 434 with value: 0.8310153865446737.[0m
[32m[I 2022-04-21 15:20:59,589][0m Trial 462 finished with value: 0.8246598456915096 and parameters: {'loss': 'coxph', 'learning_rate': 0.05130676693267424, 'n_estimators': 587, 'criterion': 'friedman_mse', 'min_samples_split': 2, 'min_samples_leaf': 5, 'min_weight_fraction_leaf': 0.016872751396694093, 'min_impurity_decrease': 0.5035753163659599, 'max_features': 0.4785681726238648, 'subsample': 0.418983041797753, 'dropout_rate': 0.9999202288667977, 'ccp_alpha': 0.09675691449915957}. Best is trial 434 with value: 0.8310153865446737.[0m
[32m[I 2022-04-21 15:21:25,844][0m Trial 463 finished with value: 0.8296034043579157 and parameters: {'loss': 'coxph', 'learning_rate': 0.03316916980101741, 'n_estimators': 555, 'criterion': 'friedman_mse', 'min_samples_split': 2, 'min_samples_leaf': 5, 'min_weight_fraction_leaf': 0.03653929330148208, 'min_impurity_decrease': 0.4886767225201218, 'max_features': 0.48786012279679686, 'subsample': 0.4065636830213825, 'dropout_rate': 0.9785977891504241, 'ccp_alpha': 0.0016403777078141419}. Best is trial 434 with value: 0.8310153865446737.[0m
[32m[I 2022-04-21 15:21:46,342][0m Trial 464 finished with value: 0.829339462605408 and parameters: {'loss': 'coxph', 'learning_rate': 0.09719668685641449, 'n_estimators': 551, 'criterion': 'friedman_mse', 'min_samples_split': 2, 'min_samples_leaf': 5, 'min_weight_fraction_leaf': 0.045262422319266964, 'min_impurity_decrease': 0.4895065798109158, 'max_features': 0.44231116185640895, 'subsample': 0.46949343181103254, 'dropout_rate': 0.9767894004354081, 'ccp_alpha': 0.004923944851221984}. Best is trial 434 with value: 0.8310153865446737.[0m
[32m[I 2022-04-21 15:22:01,098][0m Trial 465 finished with value: 0.2503270102305002 and parameters: {'loss': 'coxph', 'learning_rate': 0.09453011467647253, 'n_estimators': 516, 'criterion': 'friedman_mse', 'min_samples_split': 2, 'min_samples_leaf': 5, 'min_weight_fraction_leaf': 0.049792009392229816, 'min_impurity_decrease': 0.5121681195537363, 'max_features': 0.4406539660645661, 'subsample': 0.4563099170946186, 'dropout_rate': 0.9760664298654526, 'ccp_alpha': 0.24332386231128528}. Best is trial 434 with value: 0.8310153865446737.[0m
[32m[I 2022-04-21 15:22:23,322][0m Trial 466 finished with value: 0.8274967467591263 and parameters: {'loss': 'coxph', 'learning_rate': 0.03460534237893392, 'n_estimators': 550, 'criterion': 'friedman_mse', 'min_samples_split': 2, 'min_samples_leaf': 5, 'min_weight_fraction_leaf': 0.04160837951004192, 'min_impurity_decrease': 0.4934736368443114, 'max_features': 0.45332789238279825, 'subsample': 0.47683645053114027, 'dropout_rate': 0.9758077909234131, 'ccp_alpha': 0.0022264080310981553}. Best is trial 434 with value: 0.8310153865446737.[0m
[32m[I 2022-04-21 15:22:41,336][0m Trial 467 finished with value: 0.3821132553092424 and parameters: {'loss': 'coxph', 'learning_rate': 0.08262108645059446, 'n_estimators': 564, 'criterion': 'friedman_mse', 'min_samples_split': 2, 'min_samples_leaf': 5, 'min_weight_fraction_leaf': 0.0462639616161855, 'min_impurity_decrease': 0.5129294794642945, 'max_features': 0.41294849409372225, 'subsample': 0.434097544232636, 'dropout_rate': 0.9968950857418197, 'ccp_alpha': 0.17023985282814103}. Best is trial 434 with value: 0.8310153865446737.[0m
[32m[I 2022-04-21 15:23:10,300][0m Trial 468 finished with value: 0.8234680023214356 and parameters: {'loss': 'coxph', 'learning_rate': 0.030997574241451158, 'n_estimators': 592, 'criterion': 'friedman_mse', 'min_samples_split': 2, 'min_samples_leaf': 5, 'min_weight_fraction_leaf': 0.02609160772883831, 'min_impurity_decrease': 0.49151760734385075, 'max_features': 0.4816401527138821, 'subsample': 0.46556247932555983, 'dropout_rate': 0.9730805603145701, 'ccp_alpha': 0.10603103604868053}. Best is trial 434 with value: 0.8310153865446737.[0m
[32m[I 2022-04-21 15:23:26,155][0m Trial 469 finished with value: 0.8278685369190768 and parameters: {'loss': 'coxph', 'learning_rate': 0.04022566625180213, 'n_estimators': 492, 'criterion': 'friedman_mse', 'min_samples_split': 2, 'min_samples_leaf': 5, 'min_weight_fraction_leaf': 0.03688809172456611, 'min_impurity_decrease': 0.487428394638782, 'max_features': 0.45514284888222134, 'subsample': 0.4396917207511223, 'dropout_rate': 0.9803568741086923, 'ccp_alpha': 0.0017614782808113684}. Best is trial 434 with value: 0.8310153865446737.[0m
[32m[I 2022-04-21 15:23:47,376][0m Trial 470 finished with value: 0.3811755851689217 and parameters: {'loss': 'coxph', 'learning_rate': 0.027763771042699645, 'n_estimators': 632, 'criterion': 'friedman_mse', 'min_samples_split': 2, 'min_samples_leaf': 5, 'min_weight_fraction_leaf': 0.04890302402396278, 'min_impurity_decrease': 0.4768416183284189, 'max_features': 0.36314301322954656, 'subsample': 0.49867911209962135, 'dropout_rate': 0.9976427565615095, 'ccp_alpha': 0.1712905761446208}. Best is trial 434 with value: 0.8310153865446737.[0m
[32m[I 2022-04-21 15:24:08,553][0m Trial 471 finished with value: 0.2503270102305002 and parameters: {'loss': 'coxph', 'learning_rate': 0.018786375361866336, 'n_estimators': 536, 'criterion': 'friedman_mse', 'min_samples_split': 2, 'min_samples_leaf': 5, 'min_weight_fraction_leaf': 0.05766837394249105, 'min_impurity_decrease': 0.5155384071582755, 'max_features': 0.4678159008982159, 'subsample': 0.4150325769558098, 'dropout_rate': 0.9597550064543742, 'ccp_alpha': 0.27973316070239296}. Best is trial 434 with value: 0.8310153865446737.[0m
[32m[I 2022-04-21 15:24:27,195][0m Trial 472 finished with value: 0.825766407252328 and parameters: {'loss': 'coxph', 'learning_rate': 0.03331733057362588, 'n_estimators': 575, 'criterion': 'friedman_mse', 'min_samples_split': 2, 'min_samples_leaf': 6, 'min_weight_fraction_leaf': 0.04156072598492271, 'min_impurity_decrease': 0.49518932022378176, 'max_features': 0.49243166824802553, 'subsample': 0.398223037601814, 'dropout_rate': 0.9999559916104431, 'ccp_alpha': 0.09559159972192326}. Best is trial 434 with value: 0.8310153865446737.[0m
[32m[I 2022-04-21 15:24:57,826][0m Trial 473 finished with value: 0.3724450853015603 and parameters: {'loss': 'coxph', 'learning_rate': 0.06197339493445946, 'n_estimators': 665, 'criterion': 'friedman_mse', 'min_samples_split': 2, 'min_samples_leaf': 5, 'min_weight_fraction_leaf': 0.04694435169445055, 'min_impurity_decrease': 0.5334993000439116, 'max_features': 0.5038553013987339, 'subsample': 0.4384934524920723, 'dropout_rate': 0.9784547419003184, 'ccp_alpha': 0.19878521691448459}. Best is trial 434 with value: 0.8310153865446737.[0m
/media/san2_ssd/data/Workdir/survival/venv/lib/python3.8/site-packages/sksurv/ensemble/boosting.py:955: RuntimeWarning: divide by zero encountered in log
  time = numpy.log(time)
/media/san2_ssd/data/Workdir/survival/venv/lib/python3.8/site-packages/sksurv/ensemble/boosting.py:955: RuntimeWarning: divide by zero encountered in log
  time = numpy.log(time)
/media/san2_ssd/data/Workdir/survival/venv/lib/python3.8/site-packages/sksurv/ensemble/boosting.py:955: RuntimeWarning: divide by zero encountered in log
  time = numpy.log(time)
/media/san2_ssd/data/Workdir/survival/venv/lib/python3.8/site-packages/sksurv/ensemble/boosting.py:955: RuntimeWarning: divide by zero encountered in log
  time = numpy.log(time)
[32m[I 2022-04-21 15:25:05,019][0m Trial 474 finished with value: -0.46657912094588677 and parameters: {'loss': 'squared', 'learning_rate': 0.062194824488192364, 'n_estimators': 625, 'criterion': 'friedman_mse', 'min_samples_split': 2, 'min_samples_leaf': 5, 'min_weight_fraction_leaf': 0.05417236532746749, 'min_impurity_decrease': 0.47366323944054856, 'max_features': 0.5115867106349163, 'subsample': 0.41206682175926385, 'dropout_rate': 0.9563550029981402, 'ccp_alpha': 0.09518611437726508}. Best is trial 434 with value: 0.8310153865446737.[0m
[32m[I 2022-04-21 15:25:31,307][0m Trial 475 finished with value: 0.8272939405901006 and parameters: {'loss': 'coxph', 'learning_rate': 0.013679857941832633, 'n_estimators': 608, 'criterion': 'friedman_mse', 'min_samples_split': 2, 'min_samples_leaf': 4, 'min_weight_fraction_leaf': 0.022221290015103708, 'min_impurity_decrease': 0.49759228122421556, 'max_features': 0.45293161774001656, 'subsample': 0.44701828345224415, 'dropout_rate': 0.9732021421238478, 'ccp_alpha': 0.002564112458010771}. Best is trial 434 with value: 0.8310153865446737.[0m
[32m[I 2022-04-21 15:25:52,806][0m Trial 476 finished with value: 0.25 and parameters: {'loss': 'coxph', 'learning_rate': 0.019464229327340484, 'n_estimators': 545, 'criterion': 'squared_error', 'min_samples_split': 2, 'min_samples_leaf': 4, 'min_weight_fraction_leaf': 0.060339734778229306, 'min_impurity_decrease': 0.4670343884384502, 'max_features': 0.5164452816465814, 'subsample': 0.4785190183428755, 'dropout_rate': 0.9562094710590479, 'ccp_alpha': 0.36903266533114676}. Best is trial 434 with value: 0.8310153865446737.[0m
[32m[I 2022-04-21 15:26:17,846][0m Trial 477 finished with value: 0.25 and parameters: {'loss': 'coxph', 'learning_rate': 0.011429309528295897, 'n_estimators': 579, 'criterion': 'absolute_error', 'min_samples_split': 2, 'min_samples_leaf': 5, 'min_weight_fraction_leaf': 0.03335725419633047, 'min_impurity_decrease': 0.5160224206830446, 'max_features': 0.42530650722749247, 'subsample': 0.40125931534985404, 'dropout_rate': 0.975802094631778, 'ccp_alpha': 0.15634462942615118}. Best is trial 434 with value: 0.8310153865446737.[0m
[32m[I 2022-04-21 15:26:31,313][0m Trial 478 finished with value: 0.25 and parameters: {'loss': 'coxph', 'learning_rate': 0.047473821189548016, 'n_estimators': 509, 'criterion': 'friedman_mse', 'min_samples_split': 2, 'min_samples_leaf': 4, 'min_weight_fraction_leaf': 0.056512703878210405, 'min_impurity_decrease': 0.4819878068462871, 'max_features': 0.4963435909149633, 'subsample': 0.42924543938527465, 'dropout_rate': 0.9825883653932486, 'ccp_alpha': 0.5626268328478641}. Best is trial 434 with value: 0.8310153865446737.[0m
[32m[I 2022-04-21 15:26:48,070][0m Trial 479 finished with value: 0.8258433872099158 and parameters: {'loss': 'coxph', 'learning_rate': 0.02382510349854098, 'n_estimators': 669, 'criterion': 'friedman_mse', 'min_samples_split': 2, 'min_samples_leaf': 4, 'min_weight_fraction_leaf': 0.06608649349254586, 'min_impurity_decrease': 0.46122955071626914, 'max_features': 0.4923477697929813, 'subsample': 0.38931262779724635, 'dropout_rate': 0.9996246061545163, 'ccp_alpha': 0.09264674834665358}. Best is trial 434 with value: 0.8310153865446737.[0m
