[32m[I 2022-04-21 11:38:51,869][0m Trial 819 finished with value: 0.8342213889050052 and parameters: {'splitter': 'best', 'min_samples_split': 0.25763826738319695, 'min_samples_leaf': 0.017133981261825526, 'min_weight_fraction_leaf': 0.058363049765580065, 'max_features': 0.6780748095822378}. Best is trial 499 with value: 0.8396174698878165.[0m
[32m[I 2022-04-21 11:38:51,930][0m Trial 820 finished with value: 0.8396174698878165 and parameters: {'splitter': 'best', 'min_samples_split': 0.27169865299222173, 'min_samples_leaf': 0.009107784892317991, 'min_weight_fraction_leaf': 0.05220524604011113, 'max_features': 0.7208776758257098}. Best is trial 499 with value: 0.8396174698878165.[0m
[32m[I 2022-04-21 11:38:51,995][0m Trial 821 finished with value: 0.8278342304953921 and parameters: {'splitter': 'random', 'min_samples_split': 0.2721125021426879, 'min_samples_leaf': 0.1274742611562555, 'min_weight_fraction_leaf': 0.06807507873443634, 'max_features': 0.7236203394452358}. Best is trial 499 with value: 0.8396174698878165.[0m
[32m[I 2022-04-21 11:38:52,050][0m Trial 822 finished with value: 0.8374664321313142 and parameters: {'splitter': 'best', 'min_samples_split': 0.24205892012893576, 'min_samples_leaf': 0.0019933585392185047, 'min_weight_fraction_leaf': 0.053724076989304065, 'max_features': 0.73900154184304}. Best is trial 499 with value: 0.8396174698878165.[0m
[32m[I 2022-04-21 11:38:52,145][0m Trial 823 finished with value: 0.8382577519146084 and parameters: {'splitter': 'best', 'min_samples_split': 0.26590026319902627, 'min_samples_leaf': 0.022032385628388936, 'min_weight_fraction_leaf': 0.05037140499717701, 'max_features': 0.7127490445345525}. Best is trial 499 with value: 0.8396174698878165.[0m
[32m[I 2022-04-21 11:38:52,294][0m Trial 824 finished with value: 0.8318869790887286 and parameters: {'splitter': 'best', 'min_samples_split': 0.27889418221177936, 'min_samples_leaf': 0.001167579692599112, 'min_weight_fraction_leaf': 0.07657544212947012, 'max_features': 0.7772230381458886}. Best is trial 499 with value: 0.8396174698878165.[0m
[32m[I 2022-04-21 11:38:52,379][0m Trial 825 finished with value: 0.6864017167921991 and parameters: {'splitter': 'best', 'min_samples_split': 0.2880785240875915, 'min_samples_leaf': 0.009519613062037614, 'min_weight_fraction_leaf': 0.08445725002957985, 'max_features': 0.16073610200095434}. Best is trial 499 with value: 0.8396174698878165.[0m
[32m[I 2022-04-21 11:38:52,449][0m Trial 826 finished with value: 0.8374613873228913 and parameters: {'splitter': 'best', 'min_samples_split': 0.2536322605252203, 'min_samples_leaf': 0.01779628980995391, 'min_weight_fraction_leaf': 0.03895438291065125, 'max_features': 0.7517091018220008}. Best is trial 499 with value: 0.8396174698878165.[0m
[32m[I 2022-04-21 11:38:52,556][0m Trial 827 finished with value: 0.8385374292394825 and parameters: {'splitter': 'best', 'min_samples_split': 0.27138627809632004, 'min_samples_leaf': 0.010639208326536743, 'min_weight_fraction_leaf': 0.03564700780795758, 'max_features': 0.7322089980037441}. Best is trial 499 with value: 0.8396174698878165.[0m
[32m[I 2022-04-21 11:38:52,644][0m Trial 828 finished with value: 0.8340130635607796 and parameters: {'splitter': 'best', 'min_samples_split': 0.026096258859543364, 'min_samples_leaf': 0.0010509850915750274, 'min_weight_fraction_leaf': 0.06053466846677938, 'max_features': 0.7209184901374011}. Best is trial 499 with value: 0.8396174698878165.[0m
[32m[I 2022-04-21 11:38:52,710][0m Trial 829 finished with value: 0.8328255155375228 and parameters: {'splitter': 'best', 'min_samples_split': 0.2615066546000831, 'min_samples_leaf': 0.02302335359274273, 'min_weight_fraction_leaf': 0.06484755440534304, 'max_features': 0.74969413321914}. Best is trial 499 with value: 0.8396174698878165.[0m
[32m[I 2022-04-21 11:38:52,773][0m Trial 830 finished with value: 0.8352014009981168 and parameters: {'splitter': 'best', 'min_samples_split': 0.28229480355811587, 'min_samples_leaf': 0.025692944000547516, 'min_weight_fraction_leaf': 0.04519493110738518, 'max_features': 0.78524408318162}. Best is trial 499 with value: 0.8396174698878165.[0m
[32m[I 2022-04-21 11:38:52,843][0m Trial 831 finished with value: 0.8336775755076221 and parameters: {'splitter': 'best', 'min_samples_split': 0.2964129683730016, 'min_samples_leaf': 0.011492551727658135, 'min_weight_fraction_leaf': 0.017885796416193703, 'max_features': 0.7130725370797062}. Best is trial 499 with value: 0.8396174698878165.[0m
[32m[I 2022-04-21 11:38:52,910][0m Trial 832 finished with value: 0.8396174698878165 and parameters: {'splitter': 'best', 'min_samples_split': 0.2775255125446605, 'min_samples_leaf': 0.02823896768049759, 'min_weight_fraction_leaf': 0.05308852944130216, 'max_features': 0.7661561261421047}. Best is trial 499 with value: 0.8396174698878165.[0m
[32m[I 2022-04-21 11:38:52,977][0m Trial 833 finished with value: 0.8396174698878165 and parameters: {'splitter': 'best', 'min_samples_split': 0.27485157475535865, 'min_samples_leaf': 0.01566926679570803, 'min_weight_fraction_leaf': 0.055381015977170864, 'max_features': 0.791939584929014}. Best is trial 499 with value: 0.8396174698878165.[0m
[32m[I 2022-04-21 11:38:53,046][0m Trial 834 finished with value: 0.8318450474400789 and parameters: {'splitter': 'best', 'min_samples_split': 0.273177527806632, 'min_samples_leaf': 0.015452367661090542, 'min_weight_fraction_leaf': 0.10725301255493949, 'max_features': 0.796813520087207}. Best is trial 499 with value: 0.8396174698878165.[0m
[32m[I 2022-04-21 11:38:53,134][0m Trial 835 finished with value: 0.8359946375562541 and parameters: {'splitter': 'best', 'min_samples_split': 0.28856968207186706, 'min_samples_leaf': 0.016241276069907714, 'min_weight_fraction_leaf': 0.07299668967129697, 'max_features': 0.8136853543480355}. Best is trial 499 with value: 0.8396174698878165.[0m
[32m[I 2022-04-21 11:38:53,211][0m Trial 836 finished with value: 0.8322570148675416 and parameters: {'splitter': 'best', 'min_samples_split': 0.30459549309848943, 'min_samples_leaf': 0.009940717566375303, 'min_weight_fraction_leaf': 0.06136752436052774, 'max_features': 0.7791381261030734}. Best is trial 499 with value: 0.8396174698878165.[0m
[32m[I 2022-04-21 11:38:53,284][0m Trial 837 finished with value: 0.8316149506675705 and parameters: {'splitter': 'best', 'min_samples_split': 0.2807849855304781, 'min_samples_leaf': 0.001148867734653631, 'min_weight_fraction_leaf': 0.09121905310586598, 'max_features': 0.7833059351597967}. Best is trial 499 with value: 0.8396174698878165.[0m
[32m[I 2022-04-21 11:38:53,357][0m Trial 838 finished with value: 0.8318869790887286 and parameters: {'splitter': 'best', 'min_samples_split': 0.2677081550825708, 'min_samples_leaf': 0.011923863457877737, 'min_weight_fraction_leaf': 0.08076520561800994, 'max_features': 0.7593110947285848}. Best is trial 499 with value: 0.8396174698878165.[0m
[32m[I 2022-04-21 11:38:53,413][0m Trial 839 finished with value: 0.8328255155375228 and parameters: {'splitter': 'best', 'min_samples_split': 0.258222167923016, 'min_samples_leaf': 0.026309618275544303, 'min_weight_fraction_leaf': 0.06655907576501517, 'max_features': 0.7938502659199781}. Best is trial 499 with value: 0.8396174698878165.[0m
[32m[I 2022-04-21 11:38:53,499][0m Trial 840 finished with value: 0.8363902693902048 and parameters: {'splitter': 'random', 'min_samples_split': 0.27564293340170615, 'min_samples_leaf': 0.024193648804143084, 'min_weight_fraction_leaf': 0.057970144877147384, 'max_features': 0.8113035888150607}. Best is trial 499 with value: 0.8396174698878165.[0m
[32m[I 2022-04-21 11:38:53,567][0m Trial 841 finished with value: 0.8356453536097854 and parameters: {'splitter': 'best', 'min_samples_split': 0.2889774000620098, 'min_samples_leaf': 0.021000101177453892, 'min_weight_fraction_leaf': 0.05454002187139549, 'max_features': 0.7626721683215691}. Best is trial 499 with value: 0.8396174698878165.[0m
[32m[I 2022-04-21 11:38:53,641][0m Trial 842 finished with value: 0.8337666169009493 and parameters: {'splitter': 'best', 'min_samples_split': 0.24611472622818956, 'min_samples_leaf': 0.016727969017560466, 'min_weight_fraction_leaf': 0.07004413499724135, 'max_features': 0.7990153960180849}. Best is trial 499 with value: 0.8396174698878165.[0m
[32m[I 2022-04-21 11:38:53,705][0m Trial 843 finished with value: 0.8316115992823697 and parameters: {'splitter': 'best', 'min_samples_split': 0.3119736748587772, 'min_samples_leaf': 0.007871074121317032, 'min_weight_fraction_leaf': 0.053665365089435674, 'max_features': 0.7670913385005815}. Best is trial 499 with value: 0.8396174698878165.[0m
[32m[I 2022-04-21 11:38:53,771][0m Trial 844 finished with value: 0.8180388147131256 and parameters: {'splitter': 'best', 'min_samples_split': 0.2650703829365658, 'min_samples_leaf': 0.027221490428501867, 'min_weight_fraction_leaf': 0.062095804876302715, 'max_features': 0.4171699366838361}. Best is trial 499 with value: 0.8396174698878165.[0m
[32m[I 2022-04-21 11:38:53,835][0m Trial 845 finished with value: 0.8356453536097854 and parameters: {'splitter': 'best', 'min_samples_split': 0.28227186361959106, 'min_samples_leaf': 0.017587847833103777, 'min_weight_fraction_leaf': 0.04992449895505668, 'max_features': 0.7430712017411388}. Best is trial 499 with value: 0.8396174698878165.[0m
[32m[I 2022-04-21 11:38:53,890][0m Trial 846 finished with value: 0.8359946375562541 and parameters: {'splitter': 'best', 'min_samples_split': 0.25294261228297077, 'min_samples_leaf': 0.0010068284115722923, 'min_weight_fraction_leaf': 0.07394001185457191, 'max_features': 0.8118126376734776}. Best is trial 499 with value: 0.8396174698878165.[0m
[32m[I 2022-04-21 11:38:53,953][0m Trial 847 finished with value: 0.8327136347259619 and parameters: {'splitter': 'best', 'min_samples_split': 0.2935669731677661, 'min_samples_leaf': 0.028804433482629656, 'min_weight_fraction_leaf': 0.047922773527846865, 'max_features': 0.7682961634441635}. Best is trial 499 with value: 0.8396174698878165.[0m
[32m[I 2022-04-21 11:38:54,016][0m Trial 848 finished with value: 0.8385374292394825 and parameters: {'splitter': 'best', 'min_samples_split': 0.2724314743968408, 'min_samples_leaf': 0.010352324606362706, 'min_weight_fraction_leaf': 0.041284521096936505, 'max_features': 0.7397794286532667}. Best is trial 499 with value: 0.8396174698878165.[0m
[32m[I 2022-04-21 11:38:54,077][0m Trial 849 finished with value: 0.8342213889050052 and parameters: {'splitter': 'best', 'min_samples_split': 0.26002585312843723, 'min_samples_leaf': 0.0114702882053577, 'min_weight_fraction_leaf': 0.05709519023545581, 'max_features': 0.7727708494276264}. Best is trial 499 with value: 0.8396174698878165.[0m
[32m[I 2022-04-21 11:38:54,147][0m Trial 850 finished with value: 0.8340187950162761 and parameters: {'splitter': 'best', 'min_samples_split': 0.27899510267719585, 'min_samples_leaf': 0.028585555359491165, 'min_weight_fraction_leaf': 0.06250280225565008, 'max_features': 0.7284602275829924}. Best is trial 499 with value: 0.8396174698878165.[0m
[32m[I 2022-04-21 11:38:54,226][0m Trial 851 finished with value: 0.8359946375562541 and parameters: {'splitter': 'best', 'min_samples_split': 0.2679783197802507, 'min_samples_leaf': 0.019468948236057482, 'min_weight_fraction_leaf': 0.06967804564033492, 'max_features': 0.8033208507520124}. Best is trial 499 with value: 0.8396174698878165.[0m
[32m[I 2022-04-21 11:38:54,307][0m Trial 852 finished with value: 0.8356453536097854 and parameters: {'splitter': 'best', 'min_samples_split': 0.29023009732846106, 'min_samples_leaf': 0.001025689427777761, 'min_weight_fraction_leaf': 0.05153209544581985, 'max_features': 0.7838540827827399}. Best is trial 499 with value: 0.8396174698878165.[0m
[32m[I 2022-04-21 11:38:54,391][0m Trial 853 finished with value: 0.8313466605567467 and parameters: {'splitter': 'best', 'min_samples_split': 0.2980781723398234, 'min_samples_leaf': 0.01721892617954935, 'min_weight_fraction_leaf': 0.040496009343221236, 'max_features': 0.756852518316885}. Best is trial 499 with value: 0.8396174698878165.[0m
[32m[I 2022-04-21 11:38:54,461][0m Trial 854 finished with value: 0.8396174698878165 and parameters: {'splitter': 'best', 'min_samples_split': 0.2750209921592026, 'min_samples_leaf': 0.024953647679845026, 'min_weight_fraction_leaf': 0.053617337084837964, 'max_features': 0.7533952117444325}. Best is trial 499 with value: 0.8396174698878165.[0m
[32m[I 2022-04-21 11:38:54,757][0m Trial 855 finished with value: 0.65 and parameters: {'splitter': 'best', 'min_samples_split': 0.2747688493424578, 'min_samples_leaf': 0.008762006206687697, 'min_weight_fraction_leaf': 0.43276497935576697, 'max_features': 0.7584708529058357}. Best is trial 499 with value: 0.8396174698878165.[0m
[32m[I 2022-04-21 11:38:54,836][0m Trial 856 finished with value: 0.8318869790887286 and parameters: {'splitter': 'best', 'min_samples_split': 0.2613697157353803, 'min_samples_leaf': 0.0278447805008342, 'min_weight_fraction_leaf': 0.08073509801361328, 'max_features': 0.778688605811951}. Best is trial 499 with value: 0.8396174698878165.[0m
[32m[I 2022-04-21 11:38:54,898][0m Trial 857 finished with value: 0.8318450474400789 and parameters: {'splitter': 'best', 'min_samples_split': 0.28338276180151356, 'min_samples_leaf': 0.016835654335871558, 'min_weight_fraction_leaf': 0.1749173739465076, 'max_features': 0.7423614073932767}. Best is trial 499 with value: 0.8396174698878165.[0m
[32m[I 2022-04-21 11:38:54,954][0m Trial 858 finished with value: 0.8318450474400789 and parameters: {'splitter': 'best', 'min_samples_split': 0.251747683097758, 'min_samples_leaf': 0.20657198039569097, 'min_weight_fraction_leaf': 0.0591955809473724, 'max_features': 0.7900697711540455}. Best is trial 499 with value: 0.8396174698878165.[0m
[32m[I 2022-04-21 11:38:55,013][0m Trial 859 finished with value: 0.8326827959143992 and parameters: {'splitter': 'random', 'min_samples_split': 0.2424757638837448, 'min_samples_leaf': 0.019675015586596834, 'min_weight_fraction_leaf': 0.06855520092682585, 'max_features': 0.751708062545092}. Best is trial 499 with value: 0.8396174698878165.[0m
[32m[I 2022-04-21 11:38:55,072][0m Trial 860 finished with value: 0.8382577519146084 and parameters: {'splitter': 'best', 'min_samples_split': 0.266077371448162, 'min_samples_leaf': 0.008410585944641648, 'min_weight_fraction_leaf': 0.053711969807178364, 'max_features': 0.7703245708381282}. Best is trial 499 with value: 0.8396174698878165.[0m
[32m[I 2022-04-21 11:38:55,130][0m Trial 861 finished with value: 0.65 and parameters: {'splitter': 'best', 'min_samples_split': 0.2755953190195604, 'min_samples_leaf': 0.0014388593139311387, 'min_weight_fraction_leaf': 0.499880353280745, 'max_features': 0.8095419432031387}. Best is trial 499 with value: 0.8396174698878165.[0m
[32m[I 2022-04-21 11:38:55,189][0m Trial 862 finished with value: 0.65 and parameters: {'splitter': 'best', 'min_samples_split': 0.28572583569047366, 'min_samples_leaf': 0.0287129098553139, 'min_weight_fraction_leaf': 0.3674641729047513, 'max_features': 0.7317044439739457}. Best is trial 499 with value: 0.8396174698878165.[0m
[32m[I 2022-04-21 11:38:55,252][0m Trial 863 finished with value: 0.8330787034261397 and parameters: {'splitter': 'best', 'min_samples_split': 0.3013553670716729, 'min_samples_leaf': 0.014800740874513458, 'min_weight_fraction_leaf': 0.049202813247551574, 'max_features': 0.7242694618552729}. Best is trial 499 with value: 0.8396174698878165.[0m
[32m[I 2022-04-21 11:38:55,313][0m Trial 864 finished with value: 0.8328255155375228 and parameters: {'splitter': 'best', 'min_samples_split': 0.2699311893165229, 'min_samples_leaf': 0.02037621279970135, 'min_weight_fraction_leaf': 0.06280375305418617, 'max_features': 0.7117826492899167}. Best is trial 499 with value: 0.8396174698878165.[0m
[32m[I 2022-04-21 11:38:55,399][0m Trial 865 finished with value: 0.8382577519146084 and parameters: {'splitter': 'best', 'min_samples_split': 0.2573889685909788, 'min_samples_leaf': 0.025838875024730402, 'min_weight_fraction_leaf': 0.05489961838693182, 'max_features': 0.7626694326806971}. Best is trial 499 with value: 0.8396174698878165.[0m
[32m[I 2022-04-21 11:38:55,494][0m Trial 866 finished with value: 0.8318869790887286 and parameters: {'splitter': 'best', 'min_samples_split': 0.27878724648202985, 'min_samples_leaf': 0.03247174944691285, 'min_weight_fraction_leaf': 0.07983395086407252, 'max_features': 0.788599573383359}. Best is trial 499 with value: 0.8396174698878165.[0m
[32m[I 2022-04-21 11:38:55,599][0m Trial 867 finished with value: 0.8327136347259619 and parameters: {'splitter': 'best', 'min_samples_split': 0.2935356918635062, 'min_samples_leaf': 0.01286396416320363, 'min_weight_fraction_leaf': 0.04525592576820872, 'max_features': 0.7449347383309204}. Best is trial 499 with value: 0.8396174698878165.[0m
[32m[I 2022-04-21 11:38:55,672][0m Trial 868 finished with value: 0.8328255155375228 and parameters: {'splitter': 'best', 'min_samples_split': 0.26433746046597173, 'min_samples_leaf': 0.01053706535361684, 'min_weight_fraction_leaf': 0.06875795423173207, 'max_features': 0.7047658039545448}. Best is trial 499 with value: 0.8396174698878165.[0m
[32m[I 2022-04-21 11:38:55,737][0m Trial 869 finished with value: 0.8352014009981168 and parameters: {'splitter': 'best', 'min_samples_split': 0.2838709623021822, 'min_samples_leaf': 0.001213847348289757, 'min_weight_fraction_leaf': 0.044193909914318756, 'max_features': 0.7332063360689116}. Best is trial 499 with value: 0.8396174698878165.[0m
[32m[I 2022-04-21 11:38:55,798][0m Trial 870 finished with value: 0.8318450474400789 and parameters: {'splitter': 'best', 'min_samples_split': 0.2723979518476193, 'min_samples_leaf': 0.010760934401416008, 'min_weight_fraction_leaf': 0.23086798363527417, 'max_features': 0.7721631262664854}. Best is trial 499 with value: 0.8396174698878165.[0m
[32m[I 2022-04-21 11:38:55,872][0m Trial 871 finished with value: 0.8363268199688415 and parameters: {'splitter': 'best', 'min_samples_split': 0.25273835526329214, 'min_samples_leaf': 0.031188590814096133, 'min_weight_fraction_leaf': 0.059558825673308474, 'max_features': 0.8199317762011094}. Best is trial 499 with value: 0.8396174698878165.[0m
[32m[I 2022-04-21 11:38:55,943][0m Trial 872 finished with value: 0.8385374292394825 and parameters: {'splitter': 'best', 'min_samples_split': 0.27442667742070453, 'min_samples_leaf': 0.0011233667982628297, 'min_weight_fraction_leaf': 0.038379132766886086, 'max_features': 0.7552487481386173}. Best is trial 499 with value: 0.8396174698878165.[0m
[32m[I 2022-04-21 11:38:56,058][0m Trial 873 finished with value: 0.8382577519146084 and parameters: {'splitter': 'best', 'min_samples_split': 0.2610398983879819, 'min_samples_leaf': 0.022102765206861094, 'min_weight_fraction_leaf': 0.05245849043924292, 'max_features': 0.6998868200503935}. Best is trial 499 with value: 0.8396174698878165.[0m
[32m[I 2022-04-21 11:38:56,119][0m Trial 874 finished with value: 0.8340187950162761 and parameters: {'splitter': 'best', 'min_samples_split': 0.29333814925649915, 'min_samples_leaf': 0.021664513948394346, 'min_weight_fraction_leaf': 0.06491956993886712, 'max_features': 0.7845290325561991}. Best is trial 499 with value: 0.8396174698878165.[0m
[32m[I 2022-04-21 11:38:56,175][0m Trial 875 finished with value: 0.8337666169009493 and parameters: {'splitter': 'best', 'min_samples_split': 0.2843703496542678, 'min_samples_leaf': 0.030190749692439157, 'min_weight_fraction_leaf': 0.07573389185417997, 'max_features': 0.7301560474575034}. Best is trial 499 with value: 0.8396174698878165.[0m
[32m[I 2022-04-21 11:38:56,269][0m Trial 876 finished with value: 0.8374664321313142 and parameters: {'splitter': 'best', 'min_samples_split': 0.242330117768447, 'min_samples_leaf': 0.011089036475406693, 'min_weight_fraction_leaf': 0.050667641553149484, 'max_features': 0.7991613907560028}. Best is trial 499 with value: 0.8396174698878165.[0m
[32m[I 2022-04-21 11:38:56,368][0m Trial 877 finished with value: 0.8316149506675705 and parameters: {'splitter': 'best', 'min_samples_split': 0.2692191737111521, 'min_samples_leaf': 0.019118811655552268, 'min_weight_fraction_leaf': 0.08900123382183175, 'max_features': 0.7510730551556914}. Best is trial 499 with value: 0.8396174698878165.[0m
[32m[I 2022-04-21 11:38:56,433][0m Trial 878 finished with value: 0.8331876435512038 and parameters: {'splitter': 'random', 'min_samples_split': 0.3087116580605182, 'min_samples_leaf': 0.03159069245228197, 'min_weight_fraction_leaf': 0.042902431549720337, 'max_features': 0.7638819116492322}. Best is trial 499 with value: 0.8396174698878165.[0m
[32m[I 2022-04-21 11:38:56,514][0m Trial 879 finished with value: 0.8342711778095314 and parameters: {'splitter': 'best', 'min_samples_split': 0.28062101711244913, 'min_samples_leaf': 0.010669316323177169, 'min_weight_fraction_leaf': 0.040693303945535844, 'max_features': 0.7127888325533921}. Best is trial 499 with value: 0.8396174698878165.[0m
[32m[I 2022-04-21 11:38:56,598][0m Trial 880 finished with value: 0.65 and parameters: {'splitter': 'best', 'min_samples_split': 0.2592079529254952, 'min_samples_leaf': 0.009476234939223054, 'min_weight_fraction_leaf': 0.3864417764789613, 'max_features': 0.7418943801403292}. Best is trial 499 with value: 0.8396174698878165.[0m
[32m[I 2022-04-21 11:38:56,676][0m Trial 881 finished with value: 0.8355801993971674 and parameters: {'splitter': 'best', 'min_samples_split': 0.2725074465709407, 'min_samples_leaf': 0.021743847059744244, 'min_weight_fraction_leaf': 0.061072335942626926, 'max_features': 0.6867866442981094}. Best is trial 499 with value: 0.8396174698878165.[0m
