[32m[I 2022-04-21 16:03:16,600][0m Trial 554 finished with value: 0.8279846569775747 and parameters: {'loss': 'coxph', 'learning_rate': 0.03947007799777139, 'n_estimators': 529, 'criterion': 'friedman_mse', 'min_samples_split': 2, 'min_samples_leaf': 5, 'min_weight_fraction_leaf': 0.07656706469615304, 'min_impurity_decrease': 0.5819781760034277, 'max_features': 0.5568100602902428, 'subsample': 0.36113864926776, 'dropout_rate': 0.9237479935508354, 'ccp_alpha': 0.09025141666146204}. Best is trial 486 with value: 0.8320137528916117.[0m
[32m[I 2022-04-21 16:03:42,870][0m Trial 555 finished with value: 0.25 and parameters: {'loss': 'coxph', 'learning_rate': 0.01411485393952928, 'n_estimators': 674, 'criterion': 'friedman_mse', 'min_samples_split': 2, 'min_samples_leaf': 4, 'min_weight_fraction_leaf': 0.34055653592316204, 'min_impurity_decrease': 0.5301107659982935, 'max_features': 0.5806373411143089, 'subsample': 0.388317921447244, 'dropout_rate': 0.9850261821796434, 'ccp_alpha': 1.2289387396673206}. Best is trial 486 with value: 0.8320137528916117.[0m
[32m[I 2022-04-21 16:04:30,060][0m Trial 556 finished with value: 0.3811755851689217 and parameters: {'loss': 'coxph', 'learning_rate': 0.017434113707321616, 'n_estimators': 821, 'criterion': 'friedman_mse', 'min_samples_split': 2, 'min_samples_leaf': 4, 'min_weight_fraction_leaf': 0.06346794691526524, 'min_impurity_decrease': 0.871079387166397, 'max_features': 0.41185632630565966, 'subsample': 0.4519102282881725, 'dropout_rate': 0.9595698260716029, 'ccp_alpha': 0.17933407289652156}. Best is trial 486 with value: 0.8320137528916117.[0m
[32m[I 2022-04-21 16:04:54,836][0m Trial 557 finished with value: 0.2503270102305002 and parameters: {'loss': 'coxph', 'learning_rate': 0.007059206946054191, 'n_estimators': 765, 'criterion': 'friedman_mse', 'min_samples_split': 2, 'min_samples_leaf': 4, 'min_weight_fraction_leaf': 0.046588496072258484, 'min_impurity_decrease': 0.4496633999440203, 'max_features': 0.5237962061225926, 'subsample': 0.4203330796626261, 'dropout_rate': 0.9999376421133535, 'ccp_alpha': 0.26435291250097737}. Best is trial 486 with value: 0.8320137528916117.[0m
[32m[I 2022-04-21 16:05:20,005][0m Trial 558 finished with value: 0.25 and parameters: {'loss': 'coxph', 'learning_rate': 0.011298265936389293, 'n_estimators': 495, 'criterion': 'friedman_mse', 'min_samples_split': 6, 'min_samples_leaf': 5, 'min_weight_fraction_leaf': 0.08757200359256559, 'min_impurity_decrease': 0.5012029870167432, 'max_features': 0.3780708171881802, 'subsample': 0.3502286595840526, 'dropout_rate': 0.9448644785072046, 'ccp_alpha': 1.8165240458981802}. Best is trial 486 with value: 0.8320137528916117.[0m
[32m[I 2022-04-21 16:05:56,713][0m Trial 559 finished with value: 0.8239524413306525 and parameters: {'loss': 'coxph', 'learning_rate': 0.0299936222153163, 'n_estimators': 643, 'criterion': 'friedman_mse', 'min_samples_split': 2, 'min_samples_leaf': 4, 'min_weight_fraction_leaf': 0.0565111684570392, 'min_impurity_decrease': 0.5474678901610716, 'max_features': 0.4383856829230771, 'subsample': 0.37817115950730673, 'dropout_rate': 0.9182376830739286, 'ccp_alpha': 0.08167095834525283}. Best is trial 486 with value: 0.8320137528916117.[0m
[32m[I 2022-04-21 16:06:15,123][0m Trial 560 finished with value: 0.8272283062027125 and parameters: {'loss': 'coxph', 'learning_rate': 0.023176051024480348, 'n_estimators': 592, 'criterion': 'friedman_mse', 'min_samples_split': 2, 'min_samples_leaf': 4, 'min_weight_fraction_leaf': 0.0377828058097712, 'min_impurity_decrease': 0.48153771594699485, 'max_features': 0.6126945834595108, 'subsample': 0.441525485206017, 'dropout_rate': 0.9778612215727119, 'ccp_alpha': 0.002604129118114586}. Best is trial 486 with value: 0.8320137528916117.[0m
[32m[I 2022-04-21 16:06:56,505][0m Trial 561 finished with value: 0.8294546889929899 and parameters: {'loss': 'coxph', 'learning_rate': 0.013852527071624278, 'n_estimators': 713, 'criterion': 'friedman_mse', 'min_samples_split': 2, 'min_samples_leaf': 5, 'min_weight_fraction_leaf': 0.07303776503896633, 'min_impurity_decrease': 0.4435499789813801, 'max_features': 0.46158918281025485, 'subsample': 0.41372752987804323, 'dropout_rate': 0.9370494780861687, 'ccp_alpha': 0.004179558451995067}. Best is trial 486 with value: 0.8320137528916117.[0m
[32m[I 2022-04-21 16:07:50,953][0m Trial 562 finished with value: 0.2503270102305002 and parameters: {'loss': 'coxph', 'learning_rate': 0.010633618787988908, 'n_estimators': 741, 'criterion': 'friedman_mse', 'min_samples_split': 2, 'min_samples_leaf': 5, 'min_weight_fraction_leaf': 0.07595408416549948, 'min_impurity_decrease': 0.4463321473289123, 'max_features': 0.4673930117761778, 'subsample': 0.4079839305933722, 'dropout_rate': 0.9308064615431343, 'ccp_alpha': 0.3337472321204395}. Best is trial 486 with value: 0.8320137528916117.[0m
[32m[I 2022-04-21 16:08:33,444][0m Trial 563 finished with value: 0.8139037535380037 and parameters: {'loss': 'coxph', 'learning_rate': 0.013786444604206662, 'n_estimators': 714, 'criterion': 'friedman_mse', 'min_samples_split': 2, 'min_samples_leaf': 5, 'min_weight_fraction_leaf': 0.08706914644225855, 'min_impurity_decrease': 0.44747842715922964, 'max_features': 0.4838451002520058, 'subsample': 0.3818318774371112, 'dropout_rate': 0.9171750086564086, 'ccp_alpha': 0.1583134290468245}. Best is trial 486 with value: 0.8320137528916117.[0m
[32m[I 2022-04-21 16:08:52,821][0m Trial 564 finished with value: 0.25 and parameters: {'loss': 'coxph', 'learning_rate': 1.3368785926019471e-05, 'n_estimators': 570, 'criterion': 'friedman_mse', 'min_samples_split': 2, 'min_samples_leaf': 5, 'min_weight_fraction_leaf': 0.3666347754247591, 'min_impurity_decrease': 0.46580199774533027, 'max_features': 0.4548654264963268, 'subsample': 0.3442428484339999, 'dropout_rate': 0.9357647525855164, 'ccp_alpha': 2.126151384452938}. Best is trial 486 with value: 0.8320137528916117.[0m
[32m[I 2022-04-21 16:09:43,014][0m Trial 565 finished with value: 0.7926982260151494 and parameters: {'loss': 'coxph', 'learning_rate': 0.00918992932431914, 'n_estimators': 784, 'criterion': 'friedman_mse', 'min_samples_split': 2, 'min_samples_leaf': 5, 'min_weight_fraction_leaf': 0.07146680847336193, 'min_impurity_decrease': 0.743437468181259, 'max_features': 0.4990356380824431, 'subsample': 0.0374042985740896, 'dropout_rate': 0.9112913390908731, 'ccp_alpha': 0.004601227392613008}. Best is trial 486 with value: 0.8320137528916117.[0m
[32m[I 2022-04-21 16:10:06,699][0m Trial 566 finished with value: 0.25 and parameters: {'loss': 'coxph', 'learning_rate': 0.0067908962164264135, 'n_estimators': 528, 'criterion': 'squared_error', 'min_samples_split': 2, 'min_samples_leaf': 5, 'min_weight_fraction_leaf': 0.09255410346739026, 'min_impurity_decrease': 0.43140299465576437, 'max_features': 0.45870382723504377, 'subsample': 0.40371372003598593, 'dropout_rate': 0.9640070824424409, 'ccp_alpha': 0.11338712625673156}. Best is trial 486 with value: 0.8320137528916117.[0m
[32m[I 2022-04-21 16:10:18,664][0m Trial 567 finished with value: 0.36451414402483967 and parameters: {'loss': 'coxph', 'learning_rate': 0.01304487529463075, 'n_estimators': 442, 'criterion': 'friedman_mse', 'min_samples_split': 2, 'min_samples_leaf': 5, 'min_weight_fraction_leaf': 0.079360039878727, 'min_impurity_decrease': 0.4468182436453852, 'max_features': 0.5138332683203923, 'subsample': 0.35899861840309266, 'dropout_rate': 0.941883692623653, 'ccp_alpha': 0.23034676118890576}. Best is trial 486 with value: 0.8320137528916117.[0m
[32m[I 2022-04-21 16:10:38,271][0m Trial 568 finished with value: 0.816553206403373 and parameters: {'loss': 'coxph', 'learning_rate': 0.007895205708707387, 'n_estimators': 650, 'criterion': 'friedman_mse', 'min_samples_split': 2, 'min_samples_leaf': 5, 'min_weight_fraction_leaf': 0.0679444899036331, 'min_impurity_decrease': 0.47133234252121065, 'max_features': 0.4797055168928055, 'subsample': 0.6717505952626677, 'dropout_rate': 0.9779546826739683, 'ccp_alpha': 0.0929950231037577}. Best is trial 486 with value: 0.8320137528916117.[0m
[32m[I 2022-04-21 16:10:53,519][0m Trial 569 finished with value: 0.25 and parameters: {'loss': 'coxph', 'learning_rate': 0.00924083242667872, 'n_estimators': 610, 'criterion': 'absolute_error', 'min_samples_split': 2, 'min_samples_leaf': 6, 'min_weight_fraction_leaf': 0.054501126254941634, 'min_impurity_decrease': 0.4621741082151614, 'max_features': 0.5910900432882152, 'subsample': 0.39756636866560585, 'dropout_rate': 0.9998998986594592, 'ccp_alpha': 0.17660804138081015}. Best is trial 486 with value: 0.8320137528916117.[0m
[32m[I 2022-04-21 16:11:26,400][0m Trial 570 finished with value: 0.8289315087687325 and parameters: {'loss': 'coxph', 'learning_rate': 0.01589629797959226, 'n_estimators': 702, 'criterion': 'friedman_mse', 'min_samples_split': 2, 'min_samples_leaf': 5, 'min_weight_fraction_leaf': 0.08162232358258333, 'min_impurity_decrease': 0.48516376670211725, 'max_features': 0.5464934956989733, 'subsample': 0.37068392129950956, 'dropout_rate': 0.9508309746625049, 'ccp_alpha': 0.003312788814597542}. Best is trial 486 with value: 0.8320137528916117.[0m
[32m[I 2022-04-21 16:12:02,354][0m Trial 571 finished with value: 0.82196757737784 and parameters: {'loss': 'coxph', 'learning_rate': 0.014461658450769287, 'n_estimators': 708, 'criterion': 'friedman_mse', 'min_samples_split': 2, 'min_samples_leaf': 5, 'min_weight_fraction_leaf': 0.04766661931530614, 'min_impurity_decrease': 0.48856045722840424, 'max_features': 0.5384871492358371, 'subsample': 0.5156490706594465, 'dropout_rate': 0.9459947831052905, 'ccp_alpha': 0.08617470928261745}. Best is trial 486 with value: 0.8320137528916117.[0m
/media/san2_ssd/data/Workdir/survival/venv/lib/python3.8/site-packages/sksurv/ensemble/boosting.py:955: RuntimeWarning: divide by zero encountered in log
  time = numpy.log(time)
/media/san2_ssd/data/Workdir/survival/venv/lib/python3.8/site-packages/sksurv/ensemble/boosting.py:955: RuntimeWarning: divide by zero encountered in log
  time = numpy.log(time)
/media/san2_ssd/data/Workdir/survival/venv/lib/python3.8/site-packages/sksurv/ensemble/boosting.py:955: RuntimeWarning: divide by zero encountered in log
  time = numpy.log(time)
/media/san2_ssd/data/Workdir/survival/venv/lib/python3.8/site-packages/sksurv/ensemble/boosting.py:955: RuntimeWarning: divide by zero encountered in log
  time = numpy.log(time)
[32m[I 2022-04-21 16:12:09,415][0m Trial 572 finished with value: -0.46709915577002625 and parameters: {'loss': 'squared', 'learning_rate': 0.01810071957285143, 'n_estimators': 725, 'criterion': 'friedman_mse', 'min_samples_split': 2, 'min_samples_leaf': 5, 'min_weight_fraction_leaf': 0.03317430069668026, 'min_impurity_decrease': 0.49456180721866827, 'max_features': 0.5507799403978824, 'subsample': 0.48551924659233403, 'dropout_rate': 0.9596190381906504, 'ccp_alpha': 0.0024892417409294607}. Best is trial 486 with value: 0.8320137528916117.[0m
[32m[I 2022-04-21 16:12:39,710][0m Trial 573 finished with value: 0.8263049511615759 and parameters: {'loss': 'coxph', 'learning_rate': 0.015525101664577472, 'n_estimators': 682, 'criterion': 'friedman_mse', 'min_samples_split': 2, 'min_samples_leaf': 5, 'min_weight_fraction_leaf': 0.07299491780559332, 'min_impurity_decrease': 0.48002404720506275, 'max_features': 0.4936070057786987, 'subsample': 0.41770831099368144, 'dropout_rate': 0.9347252024148969, 'ccp_alpha': 0.0861812604533024}. Best is trial 486 with value: 0.8320137528916117.[0m
[32m[I 2022-04-21 16:13:02,713][0m Trial 574 finished with value: 0.2651685646512371 and parameters: {'loss': 'coxph', 'learning_rate': 0.02166475044041646, 'n_estimators': 629, 'criterion': 'friedman_mse', 'min_samples_split': 2, 'min_samples_leaf': 5, 'min_weight_fraction_leaf': 0.0900345991012699, 'min_impurity_decrease': 0.5041209925919067, 'max_features': 0.521799493157207, 'subsample': 0.38200122794183744, 'dropout_rate': 0.9785374263832249, 'ccp_alpha': 0.252248473964744}. Best is trial 486 with value: 0.8320137528916117.[0m
[32m[I 2022-04-21 16:13:42,061][0m Trial 575 finished with value: 0.8220170181651527 and parameters: {'loss': 'coxph', 'learning_rate': 0.011767203540794831, 'n_estimators': 746, 'criterion': 'friedman_mse', 'min_samples_split': 2, 'min_samples_leaf': 5, 'min_weight_fraction_leaf': 0.06086823929077128, 'min_impurity_decrease': 0.4768308368636376, 'max_features': 0.44071711436648975, 'subsample': 0.4554957308170807, 'dropout_rate': 0.959415407095436, 'ccp_alpha': 0.08248536070315557}. Best is trial 486 with value: 0.8320137528916117.[0m
[32m[I 2022-04-21 16:14:31,913][0m Trial 576 finished with value: 0.8282025480945577 and parameters: {'loss': 'coxph', 'learning_rate': 0.026967587782765617, 'n_estimators': 773, 'criterion': 'friedman_mse', 'min_samples_split': 2, 'min_samples_leaf': 6, 'min_weight_fraction_leaf': 0.08031008858299347, 'min_impurity_decrease': 0.4624480925145773, 'max_features': 0.5681710172795068, 'subsample': 0.43791379985733614, 'dropout_rate': 0.9189368583751558, 'ccp_alpha': 0.0024069587010434276}. Best is trial 486 with value: 0.8320137528916117.[0m
[32m[I 2022-04-21 16:15:04,787][0m Trial 577 finished with value: 0.25 and parameters: {'loss': 'coxph', 'learning_rate': 0.016033969713931246, 'n_estimators': 678, 'criterion': 'friedman_mse', 'min_samples_split': 2, 'min_samples_leaf': 5, 'min_weight_fraction_leaf': 0.06641583427045027, 'min_impurity_decrease': 0.49897180098703664, 'max_features': 0.5073237828870231, 'subsample': 0.40092660574851074, 'dropout_rate': 0.9440511555598865, 'ccp_alpha': 1.6849950198894392}. Best is trial 486 with value: 0.8320137528916117.[0m
[32m[I 2022-04-21 16:15:33,653][0m Trial 578 finished with value: 0.8304532153401052 and parameters: {'loss': 'coxph', 'learning_rate': 0.011482881189586977, 'n_estimators': 706, 'criterion': 'friedman_mse', 'min_samples_split': 2, 'min_samples_leaf': 5, 'min_weight_fraction_leaf': 0.04451993610291673, 'min_impurity_decrease': 0.5176016318508161, 'max_features': 0.5305424210825528, 'subsample': 0.37192198661000003, 'dropout_rate': 0.9806424788482827, 'ccp_alpha': 0.0020534226401804274}. Best is trial 486 with value: 0.8320137528916117.[0m
[32m[I 2022-04-21 16:15:53,479][0m Trial 579 finished with value: 0.82863276516152 and parameters: {'loss': 'coxph', 'learning_rate': 0.019760291729089895, 'n_estimators': 707, 'criterion': 'friedman_mse', 'min_samples_split': 2, 'min_samples_leaf': 5, 'min_weight_fraction_leaf': 0.03966189108578089, 'min_impurity_decrease': 0.5243230415168855, 'max_features': 0.538387294037088, 'subsample': 0.3669935137309134, 'dropout_rate': 0.9855400578119433, 'ccp_alpha': 0.006490723752823458}. Best is trial 486 with value: 0.8320137528916117.[0m
[32m[I 2022-04-21 16:16:34,670][0m Trial 580 finished with value: 0.25 and parameters: {'loss': 'coxph', 'learning_rate': 0.010563626476559555, 'n_estimators': 748, 'criterion': 'friedman_mse', 'min_samples_split': 2, 'min_samples_leaf': 5, 'min_weight_fraction_leaf': 0.02954678061736294, 'min_impurity_decrease': 0.6508786197147827, 'max_features': 0.5246931580130818, 'subsample': 0.4692735489941025, 'dropout_rate': 0.9581792436639159, 'ccp_alpha': 2.5146983483212364}. Best is trial 486 with value: 0.8320137528916117.[0m
[32m[I 2022-04-21 16:17:08,170][0m Trial 581 finished with value: 0.25 and parameters: {'loss': 'coxph', 'learning_rate': 0.01415253537177914, 'n_estimators': 660, 'criterion': 'friedman_mse', 'min_samples_split': 2, 'min_samples_leaf': 5, 'min_weight_fraction_leaf': 0.01687524308276655, 'min_impurity_decrease': 0.5306172270321965, 'max_features': 0.4999197102717747, 'subsample': 0.33580346012185075, 'dropout_rate': 0.9313753830645806, 'ccp_alpha': 4.1408674743730955}. Best is trial 486 with value: 0.8320137528916117.[0m
[32m[I 2022-04-21 16:18:55,339][0m Trial 582 finished with value: 0.5942496571381456 and parameters: {'loss': 'coxph', 'learning_rate': 0.06273975104987485, 'n_estimators': 718, 'criterion': 'friedman_mse', 'min_samples_split': 2, 'min_samples_leaf': 5, 'min_weight_fraction_leaf': 0.0472720840849508, 'min_impurity_decrease': 0.5516325260308466, 'max_features': 0.48144942342384556, 'subsample': 0.3675115835204809, 'dropout_rate': 0.621081078155435, 'ccp_alpha': 0.17503483466133987}. Best is trial 486 with value: 0.8320137528916117.[0m
[32m[I 2022-04-21 16:19:27,099][0m Trial 583 finished with value: 0.8283878804163821 and parameters: {'loss': 'coxph', 'learning_rate': 0.022298528248897536, 'n_estimators': 857, 'criterion': 'friedman_mse', 'min_samples_split': 2, 'min_samples_leaf': 5, 'min_weight_fraction_leaf': 0.0375273521769562, 'min_impurity_decrease': 0.570712580359496, 'max_features': 0.54352112477371, 'subsample': 0.32692585857302014, 'dropout_rate': 0.9824317832999783, 'ccp_alpha': 0.002618685581701955}. Best is trial 486 with value: 0.8320137528916117.[0m
[32m[I 2022-04-21 16:19:53,347][0m Trial 584 finished with value: 0.4837293238207415 and parameters: {'loss': 'coxph', 'learning_rate': 0.03413532866417091, 'n_estimators': 809, 'criterion': 'friedman_mse', 'min_samples_split': 2, 'min_samples_leaf': 5, 'min_weight_fraction_leaf': 0.09369955090160847, 'min_impurity_decrease': 0.5126191890913252, 'max_features': 0.528095029587329, 'subsample': 0.42051899555626326, 'dropout_rate': 0.9990349733230767, 'ccp_alpha': 0.16938461553055661}. Best is trial 486 with value: 0.8320137528916117.[0m
[32m[I 2022-04-21 16:20:40,514][0m Trial 585 finished with value: 0.8278719958757035 and parameters: {'loss': 'coxph', 'learning_rate': 0.012370941454475507, 'n_estimators': 690, 'criterion': 'friedman_mse', 'min_samples_split': 2, 'min_samples_leaf': 5, 'min_weight_fraction_leaf': 0.0016628619621295929, 'min_impurity_decrease': 0.5162429862984355, 'max_features': 0.45813138967759054, 'subsample': 0.3843196927324683, 'dropout_rate': 0.9191355352892643, 'ccp_alpha': 0.0012345627175854386}. Best is trial 486 with value: 0.8320137528916117.[0m
[32m[I 2022-04-21 16:21:08,669][0m Trial 586 finished with value: 0.25 and parameters: {'loss': 'coxph', 'learning_rate': 0.017691400827223123, 'n_estimators': 633, 'criterion': 'friedman_mse', 'min_samples_split': 2, 'min_samples_leaf': 5, 'min_weight_fraction_leaf': 0.05523578670219789, 'min_impurity_decrease': 0.49212336901646675, 'max_features': 0.49515298646519135, 'subsample': 0.4122731372576264, 'dropout_rate': 0.9516942177005098, 'ccp_alpha': 2.3684220601949795}. Best is trial 486 with value: 0.8320137528916117.[0m
[32m[I 2022-04-21 16:21:52,789][0m Trial 587 finished with value: 0.2503270102305002 and parameters: {'loss': 'coxph', 'learning_rate': 0.008758367177728984, 'n_estimators': 664, 'criterion': 'friedman_mse', 'min_samples_split': 2, 'min_samples_leaf': 5, 'min_weight_fraction_leaf': 0.08037908122667815, 'min_impurity_decrease': 0.539242992744915, 'max_features': 0.5570375556971247, 'subsample': 0.3400998859173903, 'dropout_rate': 0.9098554192755556, 'ccp_alpha': 0.29716433063943537}. Best is trial 486 with value: 0.8320137528916117.[0m
[32m[I 2022-04-21 16:22:20,727][0m Trial 588 finished with value: 0.25 and parameters: {'loss': 'coxph', 'learning_rate': 0.012824904470944998, 'n_estimators': 699, 'criterion': 'squared_error', 'min_samples_split': 2, 'min_samples_leaf': 5, 'min_weight_fraction_leaf': 0.027178756764526173, 'min_impurity_decrease': 0.43614904628453044, 'max_features': 0.42555986880885127, 'subsample': 0.4395233355771281, 'dropout_rate': 0.9680954209177751, 'ccp_alpha': 0.09954854095770682}. Best is trial 486 with value: 0.8320137528916117.[0m
[32m[I 2022-04-21 16:23:03,835][0m Trial 589 finished with value: 0.25 and parameters: {'loss': 'coxph', 'learning_rate': 0.015779772207595768, 'n_estimators': 658, 'criterion': 'friedman_mse', 'min_samples_split': 2, 'min_samples_leaf': 6, 'min_weight_fraction_leaf': 0.06866618708695303, 'min_impurity_decrease': 0.4600149039670361, 'max_features': 0.5156511945018877, 'subsample': 0.37539857759684236, 'dropout_rate': 0.9388141504147489, 'ccp_alpha': 0.3797614805329841}. Best is trial 486 with value: 0.8320137528916117.[0m
/media/san2_ssd/data/Workdir/survival/venv/lib/python3.8/site-packages/sksurv/ensemble/boosting.py:955: RuntimeWarning: divide by zero encountered in log
  time = numpy.log(time)
/media/san2_ssd/data/Workdir/survival/venv/lib/python3.8/site-packages/sksurv/ensemble/boosting.py:955: RuntimeWarning: divide by zero encountered in log
  time = numpy.log(time)
/media/san2_ssd/data/Workdir/survival/venv/lib/python3.8/site-packages/sksurv/ensemble/boosting.py:955: RuntimeWarning: divide by zero encountered in log
  time = numpy.log(time)
/media/san2_ssd/data/Workdir/survival/venv/lib/python3.8/site-packages/sksurv/ensemble/boosting.py:955: RuntimeWarning: divide by zero encountered in log
  time = numpy.log(time)
[32m[I 2022-04-21 16:23:08,433][0m Trial 590 finished with value: -0.45 and parameters: {'loss': 'squared', 'learning_rate': 2.972211285819994e-05, 'n_estimators': 770, 'criterion': 'absolute_error', 'min_samples_split': 2, 'min_samples_leaf': 4, 'min_weight_fraction_leaf': 0.04443066465643956, 'min_impurity_decrease': 0.511654762998653, 'max_features': 0.46748109858786885, 'subsample': 0.40745919054329766, 'dropout_rate': 0.9660982523520727, 'ccp_alpha': 0.10302852279773543}. Best is trial 486 with value: 0.8320137528916117.[0m
[32m[I 2022-04-21 16:23:45,180][0m Trial 591 finished with value: 0.7982164494795694 and parameters: {'loss': 'coxph', 'learning_rate': 4.647510555997544e-05, 'n_estimators': 749, 'criterion': 'friedman_mse', 'min_samples_split': 2, 'min_samples_leaf': 5, 'min_weight_fraction_leaf': 0.07329201377560812, 'min_impurity_decrease': 0.5617440013052163, 'max_features': 0.5514858462327887, 'subsample': 0.04480828944852916, 'dropout_rate': 0.9832100007222884, 'ccp_alpha': 0.20092422516534567}. Best is trial 486 with value: 0.8320137528916117.[0m
