[32m[I 2022-04-23 02:00:24,363][0m Trial 630 finished with value: -0.7347104108305815 and parameters: {'loss': 'squared', 'learning_rate': 0.051905017430483924, 'n_estimators': 484, 'criterion': 'friedman_mse', 'min_samples_split': 10, 'min_samples_leaf': 3, 'min_weight_fraction_leaf': 0.0434644461162029, 'min_impurity_decrease': 0.9107223979402475, 'max_features': 0.6292674922795951, 'subsample': 0.3276841835055416, 'dropout_rate': 0.21058662555427832, 'ccp_alpha': 0.23393674590074892}. Best is trial 218 with value: 0.6659976583847056.[0m
[32m[I 2022-04-23 02:01:09,914][0m Trial 631 finished with value: 0.6438866354296634 and parameters: {'loss': 'coxph', 'learning_rate': 0.0771731521286589, 'n_estimators': 446, 'criterion': 'friedman_mse', 'min_samples_split': 10, 'min_samples_leaf': 2, 'min_weight_fraction_leaf': 0.058248093979158054, 'min_impurity_decrease': 0.864100152376684, 'max_features': 0.6465219491156432, 'subsample': 0.35475477944585215, 'dropout_rate': 0.2980142370346528, 'ccp_alpha': 0.08793072073904391}. Best is trial 218 with value: 0.6659976583847056.[0m
[32m[I 2022-04-23 02:01:53,858][0m Trial 632 finished with value: 0.6018230743045424 and parameters: {'loss': 'coxph', 'learning_rate': 0.05732197187253798, 'n_estimators': 414, 'criterion': 'friedman_mse', 'min_samples_split': 10, 'min_samples_leaf': 3, 'min_weight_fraction_leaf': 0.04838848030406906, 'min_impurity_decrease': 0.7927097594030672, 'max_features': 0.6232528702430047, 'subsample': 0.21903408053040713, 'dropout_rate': 0.17846213660792856, 'ccp_alpha': 0.1950808132243512}. Best is trial 218 with value: 0.6659976583847056.[0m
[32m[I 2022-04-23 02:03:16,277][0m Trial 633 finished with value: 0.6616615283247225 and parameters: {'loss': 'coxph', 'learning_rate': 0.06934203907290008, 'n_estimators': 578, 'criterion': 'friedman_mse', 'min_samples_split': 10, 'min_samples_leaf': 4, 'min_weight_fraction_leaf': 0.035689994027743005, 'min_impurity_decrease': 0.2559422340210723, 'max_features': 0.6541366401762164, 'subsample': 0.30769009764752436, 'dropout_rate': 0.2324920080043039, 'ccp_alpha': 0.0019216851730960252}. Best is trial 218 with value: 0.6659976583847056.[0m
[32m[I 2022-04-23 02:04:59,148][0m Trial 634 finished with value: 0.656500179063837 and parameters: {'loss': 'coxph', 'learning_rate': 0.07711832081845973, 'n_estimators': 652, 'criterion': 'friedman_mse', 'min_samples_split': 10, 'min_samples_leaf': 5, 'min_weight_fraction_leaf': 0.02779735119698515, 'min_impurity_decrease': 0.12342782309914577, 'max_features': 0.6649031354444368, 'subsample': 0.30013713515921714, 'dropout_rate': 0.199500803981959, 'ccp_alpha': 0.09061916387780415}. Best is trial 218 with value: 0.6659976583847056.[0m
[32m[I 2022-04-23 02:06:22,877][0m Trial 635 finished with value: 0.6479207701801186 and parameters: {'loss': 'coxph', 'learning_rate': 0.06629988430931161, 'n_estimators': 605, 'criterion': 'squared_error', 'min_samples_split': 10, 'min_samples_leaf': 4, 'min_weight_fraction_leaf': 0.03357068200546282, 'min_impurity_decrease': 0.16965850904274055, 'max_features': 0.6498833829719385, 'subsample': 0.24689654471572867, 'dropout_rate': 0.23441693177294476, 'ccp_alpha': 0.0034433128571509323}. Best is trial 218 with value: 0.6659976583847056.[0m
[32m[I 2022-04-23 02:07:50,150][0m Trial 636 finished with value: 0.5 and parameters: {'loss': 'coxph', 'learning_rate': 0.08440879251236487, 'n_estimators': 606, 'criterion': 'friedman_mse', 'min_samples_split': 10, 'min_samples_leaf': 5, 'min_weight_fraction_leaf': 0.03616576395571295, 'min_impurity_decrease': 0.0517610920238703, 'max_features': 0.6662925896627572, 'subsample': 0.2705997961674715, 'dropout_rate': 0.2234814201361014, 'ccp_alpha': 0.4874581279775385}. Best is trial 218 with value: 0.6659976583847056.[0m
[32m[I 2022-04-23 02:09:34,316][0m Trial 637 finished with value: 0.6667613972396281 and parameters: {'loss': 'coxph', 'learning_rate': 0.0973108655723576, 'n_estimators': 632, 'criterion': 'friedman_mse', 'min_samples_split': 9, 'min_samples_leaf': 4, 'min_weight_fraction_leaf': 0.020616668471354967, 'min_impurity_decrease': 0.35782818551420664, 'max_features': 0.6077778120802103, 'subsample': 0.30592699894643127, 'dropout_rate': 0.19957886216285844, 'ccp_alpha': 0.005245682476013536}. Best is trial 637 with value: 0.6667613972396281.[0m
[32m[I 2022-04-23 02:11:06,742][0m Trial 638 finished with value: 0.5006540204610004 and parameters: {'loss': 'coxph', 'learning_rate': 0.0957197704138689, 'n_estimators': 609, 'criterion': 'friedman_mse', 'min_samples_split': 8, 'min_samples_leaf': 4, 'min_weight_fraction_leaf': 0.020496822273610715, 'min_impurity_decrease': 0.26285867607541813, 'max_features': 0.5920334143141157, 'subsample': 0.41669008528933194, 'dropout_rate': 0.16174892873089575, 'ccp_alpha': 0.2756427881637006}. Best is trial 637 with value: 0.6667613972396281.[0m
[32m[I 2022-04-23 02:12:00,522][0m Trial 639 finished with value: 0.6460215985159181 and parameters: {'loss': 'coxph', 'learning_rate': 0.09986097984747162, 'n_estimators': 659, 'criterion': 'friedman_mse', 'min_samples_split': 9, 'min_samples_leaf': 4, 'min_weight_fraction_leaf': 0.046486737041995393, 'min_impurity_decrease': 0.38407047321740917, 'max_features': 0.6089086178064717, 'subsample': 0.28501502107394927, 'dropout_rate': 0.6677893844019209, 'ccp_alpha': 0.15542212492715432}. Best is trial 637 with value: 0.6667613972396281.[0m
[32m[I 2022-04-23 02:12:07,639][0m Trial 640 finished with value: 0.6429217983582409 and parameters: {'loss': 'coxph', 'learning_rate': 0.09911630742536118, 'n_estimators': 148, 'criterion': 'friedman_mse', 'min_samples_split': 7, 'min_samples_leaf': 5, 'min_weight_fraction_leaf': 0.017143013414042892, 'min_impurity_decrease': 0.3277114185426522, 'max_features': 0.5995823947061848, 'subsample': 0.4588024967349879, 'dropout_rate': 0.14827024766556096, 'ccp_alpha': 0.09765988454842381}. Best is trial 637 with value: 0.6667613972396281.[0m
[32m[I 2022-04-23 02:13:50,179][0m Trial 641 finished with value: 0.6637607593919219 and parameters: {'loss': 'coxph', 'learning_rate': 0.07347008942487372, 'n_estimators': 620, 'criterion': 'friedman_mse', 'min_samples_split': 9, 'min_samples_leaf': 4, 'min_weight_fraction_leaf': 0.015506163407712367, 'min_impurity_decrease': 0.504503079645804, 'max_features': 0.5816240148647056, 'subsample': 0.23684587431682708, 'dropout_rate': 0.17141347409614385, 'ccp_alpha': 0.0017651146050010704}. Best is trial 637 with value: 0.6667613972396281.[0m
[32m[I 2022-04-23 02:15:32,355][0m Trial 642 finished with value: 0.6414161639645038 and parameters: {'loss': 'coxph', 'learning_rate': 0.08137732970074756, 'n_estimators': 637, 'criterion': 'friedman_mse', 'min_samples_split': 9, 'min_samples_leaf': 4, 'min_weight_fraction_leaf': 0.014971826497393672, 'min_impurity_decrease': 0.6159947596091713, 'max_features': 0.5835359221120262, 'subsample': 0.20764759239700634, 'dropout_rate': 0.13413241933866846, 'ccp_alpha': 0.1571721663046926}. Best is trial 637 with value: 0.6667613972396281.[0m
[32m[I 2022-04-23 02:17:35,084][0m Trial 643 finished with value: 0.6650407615455485 and parameters: {'loss': 'coxph', 'learning_rate': 0.08290261585495888, 'n_estimators': 693, 'criterion': 'friedman_mse', 'min_samples_split': 9, 'min_samples_leaf': 4, 'min_weight_fraction_leaf': 0.011190584689197827, 'min_impurity_decrease': 0.5017312300091901, 'max_features': 0.5778546457152979, 'subsample': 0.22859945981800406, 'dropout_rate': 0.18781028911715514, 'ccp_alpha': 0.003755883355472202}. Best is trial 637 with value: 0.6667613972396281.[0m
[32m[I 2022-04-23 02:19:23,016][0m Trial 644 finished with value: 0.6572396659482421 and parameters: {'loss': 'coxph', 'learning_rate': 0.08194634091293497, 'n_estimators': 634, 'criterion': 'friedman_mse', 'min_samples_split': 9, 'min_samples_leaf': 4, 'min_weight_fraction_leaf': 0.00915356127289494, 'min_impurity_decrease': 0.5803458861206094, 'max_features': 0.6027067296426724, 'subsample': 0.18032425888013012, 'dropout_rate': 0.1732264497516159, 'ccp_alpha': 0.0025968008970030016}. Best is trial 637 with value: 0.6667613972396281.[0m
[32m[I 2022-04-23 02:21:21,992][0m Trial 645 finished with value: 0.5793179654254356 and parameters: {'loss': 'coxph', 'learning_rate': 0.07997917982705251, 'n_estimators': 682, 'criterion': 'friedman_mse', 'min_samples_split': 9, 'min_samples_leaf': 4, 'min_weight_fraction_leaf': 0.014994118140321581, 'min_impurity_decrease': 0.5208122227433347, 'max_features': 0.6160727684916238, 'subsample': 0.19830301923103794, 'dropout_rate': 0.14247847836853955, 'ccp_alpha': 0.25919515309415986}. Best is trial 637 with value: 0.6667613972396281.[0m
[32m[I 2022-04-23 02:23:23,247][0m Trial 646 finished with value: 0.6676264917109616 and parameters: {'loss': 'coxph', 'learning_rate': 0.098917357759929, 'n_estimators': 685, 'criterion': 'friedman_mse', 'min_samples_split': 9, 'min_samples_leaf': 4, 'min_weight_fraction_leaf': 0.02584201125691275, 'min_impurity_decrease': 0.4987094071592657, 'max_features': 0.5781723106874859, 'subsample': 0.21526022390816185, 'dropout_rate': 0.1829529423927989, 'ccp_alpha': 0.0014739788467765468}. Best is trial 646 with value: 0.6676264917109616.[0m
[32m[I 2022-04-23 02:25:01,822][0m Trial 647 finished with value: 0.6498820793959024 and parameters: {'loss': 'coxph', 'learning_rate': 0.0940846498145124, 'n_estimators': 633, 'criterion': 'friedman_mse', 'min_samples_split': 9, 'min_samples_leaf': 4, 'min_weight_fraction_leaf': 0.002032836282025186, 'min_impurity_decrease': 0.4923973965707618, 'max_features': 0.5835026607232605, 'subsample': 0.18695553333662884, 'dropout_rate': 0.18406275339946604, 'ccp_alpha': 0.1528010153820289}. Best is trial 646 with value: 0.6676264917109616.[0m
[32m[I 2022-04-23 02:27:02,672][0m Trial 648 finished with value: 0.5274764932801516 and parameters: {'loss': 'coxph', 'learning_rate': 0.07150574269799534, 'n_estimators': 688, 'criterion': 'friedman_mse', 'min_samples_split': 9, 'min_samples_leaf': 4, 'min_weight_fraction_leaf': 0.01948813364816479, 'min_impurity_decrease': 0.5284973971872069, 'max_features': 0.5687581229954372, 'subsample': 0.21421123562813388, 'dropout_rate': 0.14502157462904938, 'ccp_alpha': 0.36523443516856574}. Best is trial 646 with value: 0.6676264917109616.[0m
[32m[I 2022-04-23 02:29:09,178][0m Trial 649 finished with value: 0.653743894549492 and parameters: {'loss': 'coxph', 'learning_rate': 0.09496890567928035, 'n_estimators': 708, 'criterion': 'friedman_mse', 'min_samples_split': 9, 'min_samples_leaf': 4, 'min_weight_fraction_leaf': 0.009403172062338771, 'min_impurity_decrease': 0.5063391220072231, 'max_features': 0.5831128787779991, 'subsample': 0.20536612125480863, 'dropout_rate': 0.17010998831576013, 'ccp_alpha': 0.0934586788722518}. Best is trial 646 with value: 0.6676264917109616.[0m
/media/san2_ssd/data/Workdir/survival/venv/lib/python3.8/site-packages/sksurv/ensemble/boosting.py:955: RuntimeWarning: divide by zero encountered in log
  time = numpy.log(time)
/media/san2_ssd/data/Workdir/survival/venv/lib/python3.8/site-packages/sksurv/ensemble/boosting.py:955: RuntimeWarning: divide by zero encountered in log
  time = numpy.log(time)
/media/san2_ssd/data/Workdir/survival/venv/lib/python3.8/site-packages/sksurv/ensemble/boosting.py:955: RuntimeWarning: divide by zero encountered in log
  time = numpy.log(time)
/media/san2_ssd/data/Workdir/survival/venv/lib/python3.8/site-packages/sksurv/ensemble/boosting.py:955: RuntimeWarning: divide by zero encountered in log
  time = numpy.log(time)
[32m[I 2022-04-23 02:29:33,999][0m Trial 650 finished with value: -0.7359262390225056 and parameters: {'loss': 'squared', 'learning_rate': 0.06912998800786117, 'n_estimators': 695, 'criterion': 'friedman_mse', 'min_samples_split': 9, 'min_samples_leaf': 4, 'min_weight_fraction_leaf': 0.021508593937962672, 'min_impurity_decrease': 0.47863592085588935, 'max_features': 0.6059627294722764, 'subsample': 0.22109153230162565, 'dropout_rate': 0.1623322318022598, 'ccp_alpha': 0.1832658003476821}. Best is trial 646 with value: 0.6676264917109616.[0m
[32m[I 2022-04-23 02:31:28,508][0m Trial 651 finished with value: 0.6555480349107713 and parameters: {'loss': 'coxph', 'learning_rate': 0.09751272756053994, 'n_estimators': 683, 'criterion': 'friedman_mse', 'min_samples_split': 9, 'min_samples_leaf': 4, 'min_weight_fraction_leaf': 0.010165043722468332, 'min_impurity_decrease': 0.5584755750169086, 'max_features': 0.5683955996916743, 'subsample': 0.2306752451102689, 'dropout_rate': 0.19219407915698494, 'ccp_alpha': 0.0893601853916876}. Best is trial 646 with value: 0.6676264917109616.[0m
[32m[I 2022-04-23 02:33:14,955][0m Trial 652 finished with value: 0.5 and parameters: {'loss': 'coxph', 'learning_rate': 0.06828420796847504, 'n_estimators': 651, 'criterion': 'absolute_error', 'min_samples_split': 9, 'min_samples_leaf': 4, 'min_weight_fraction_leaf': 0.013375795875170963, 'min_impurity_decrease': 0.46580364754245807, 'max_features': 0.591871240815534, 'subsample': 0.17610395793615957, 'dropout_rate': 0.182521768934154, 'ccp_alpha': 0.3071805660894617}. Best is trial 646 with value: 0.6676264917109616.[0m
[32m[I 2022-04-23 02:35:02,465][0m Trial 653 finished with value: 0.6438185130131779 and parameters: {'loss': 'coxph', 'learning_rate': 0.00021370436301759913, 'n_estimators': 650, 'criterion': 'friedman_mse', 'min_samples_split': 9, 'min_samples_leaf': 4, 'min_weight_fraction_leaf': 0.0010306931632211407, 'min_impurity_decrease': 0.3581816904257813, 'max_features': 0.6265409855994997, 'subsample': 0.1881001452713078, 'dropout_rate': 0.1575242015435922, 'ccp_alpha': 0.10617074609735097}. Best is trial 646 with value: 0.6676264917109616.[0m
[32m[I 2022-04-23 02:36:48,758][0m Trial 654 finished with value: 0.6608694782004798 and parameters: {'loss': 'coxph', 'learning_rate': 0.05837533026951689, 'n_estimators': 646, 'criterion': 'friedman_mse', 'min_samples_split': 9, 'min_samples_leaf': 4, 'min_weight_fraction_leaf': 0.013908379151635196, 'min_impurity_decrease': 0.5398782807265159, 'max_features': 0.6021055335756765, 'subsample': 0.22489742325383397, 'dropout_rate': 0.2007049312890716, 'ccp_alpha': 0.006653039689491318}. Best is trial 646 with value: 0.6676264917109616.[0m
[32m[I 2022-04-23 02:38:42,582][0m Trial 655 finished with value: 0.6617019692445582 and parameters: {'loss': 'coxph', 'learning_rate': 0.09970447529344353, 'n_estimators': 662, 'criterion': 'friedman_mse', 'min_samples_split': 9, 'min_samples_leaf': 4, 'min_weight_fraction_leaf': 0.02498789733235395, 'min_impurity_decrease': 0.4911026978001396, 'max_features': 0.571338365458877, 'subsample': 0.20444003033470431, 'dropout_rate': 0.17835114567017352, 'ccp_alpha': 0.0013514501313556778}. Best is trial 646 with value: 0.6676264917109616.[0m
[32m[I 2022-04-23 02:40:39,893][0m Trial 656 finished with value: 0.6011269338931935 and parameters: {'loss': 'coxph', 'learning_rate': 0.07313187339325174, 'n_estimators': 706, 'criterion': 'friedman_mse', 'min_samples_split': 8, 'min_samples_leaf': 5, 'min_weight_fraction_leaf': 0.03775702348268242, 'min_impurity_decrease': 0.5077159795538914, 'max_features': 0.6264759363151393, 'subsample': 0.2290191520206059, 'dropout_rate': 0.19872310200749116, 'ccp_alpha': 0.24570630498762153}. Best is trial 646 with value: 0.6676264917109616.[0m
[32m[I 2022-04-23 02:42:17,538][0m Trial 657 finished with value: 0.6334996032738796 and parameters: {'loss': 'coxph', 'learning_rate': 0.05604121305472508, 'n_estimators': 629, 'criterion': 'friedman_mse', 'min_samples_split': 9, 'min_samples_leaf': 4, 'min_weight_fraction_leaf': 0.026846325543276792, 'min_impurity_decrease': 0.37760191914955266, 'max_features': 0.5895638970703296, 'subsample': 0.24127707728953438, 'dropout_rate': 0.1568343156003168, 'ccp_alpha': 0.17317983687167587}. Best is trial 646 with value: 0.6676264917109616.[0m
[32m[I 2022-04-23 02:43:30,873][0m Trial 658 finished with value: 0.6510666605085071 and parameters: {'loss': 'coxph', 'learning_rate': 0.07981191841071414, 'n_estimators': 745, 'criterion': 'friedman_mse', 'min_samples_split': 9, 'min_samples_leaf': 4, 'min_weight_fraction_leaf': 0.015122956088889108, 'min_impurity_decrease': 0.5359842481378354, 'max_features': 0.612954756732788, 'subsample': 0.23736759598757198, 'dropout_rate': 0.6081781146757836, 'ccp_alpha': 0.09897001577262896}. Best is trial 646 with value: 0.6676264917109616.[0m
[32m[I 2022-04-23 02:45:41,457][0m Trial 659 finished with value: 0.6016146608564903 and parameters: {'loss': 'coxph', 'learning_rate': 3.690450962211376e-05, 'n_estimators': 720, 'criterion': 'squared_error', 'min_samples_split': 9, 'min_samples_leaf': 4, 'min_weight_fraction_leaf': 0.023608538153504346, 'min_impurity_decrease': 0.24097185791240744, 'max_features': 0.5594799584636094, 'subsample': 0.21072009212293766, 'dropout_rate': 0.11598592496811454, 'ccp_alpha': 0.18763100107249808}. Best is trial 646 with value: 0.6676264917109616.[0m
[32m[I 2022-04-23 02:47:27,032][0m Trial 660 finished with value: 0.6585557726363696 and parameters: {'loss': 'coxph', 'learning_rate': 0.043576205193402974, 'n_estimators': 666, 'criterion': 'friedman_mse', 'min_samples_split': 9, 'min_samples_leaf': 4, 'min_weight_fraction_leaf': 0.00791833523644196, 'min_impurity_decrease': 0.49170487067937174, 'max_features': 0.585593296519719, 'subsample': 0.24168322766574596, 'dropout_rate': 0.201695154477362, 'ccp_alpha': 0.09620383249580088}. Best is trial 646 with value: 0.6676264917109616.[0m
[32m[I 2022-04-23 02:49:03,114][0m Trial 661 finished with value: 0.6633299287658965 and parameters: {'loss': 'coxph', 'learning_rate': 0.0584296426003008, 'n_estimators': 607, 'criterion': 'friedman_mse', 'min_samples_split': 9, 'min_samples_leaf': 4, 'min_weight_fraction_leaf': 0.026711234843147448, 'min_impurity_decrease': 0.5166543620494313, 'max_features': 0.6295970275087475, 'subsample': 0.2501344335194275, 'dropout_rate': 0.1764276343619188, 'ccp_alpha': 0.001923133139278917}. Best is trial 646 with value: 0.6676264917109616.[0m
[32m[I 2022-04-23 02:50:45,081][0m Trial 662 finished with value: 0.6641734656681031 and parameters: {'loss': 'coxph', 'learning_rate': 0.055776250046325276, 'n_estimators': 621, 'criterion': 'friedman_mse', 'min_samples_split': 9, 'min_samples_leaf': 5, 'min_weight_fraction_leaf': 0.025403863581680567, 'min_impurity_decrease': 0.5126230229215694, 'max_features': 0.6344420367305855, 'subsample': 0.25253171644392314, 'dropout_rate': 0.15256989628410136, 'ccp_alpha': 0.004934707826548375}. Best is trial 646 with value: 0.6676264917109616.[0m
[32m[I 2022-04-23 02:52:27,376][0m Trial 663 finished with value: 0.5 and parameters: {'loss': 'coxph', 'learning_rate': 0.0577802637627228, 'n_estimators': 623, 'criterion': 'friedman_mse', 'min_samples_split': 9, 'min_samples_leaf': 5, 'min_weight_fraction_leaf': 0.02202067995749381, 'min_impurity_decrease': 0.5168287422339283, 'max_features': 0.6396673855134575, 'subsample': 0.25477277184125946, 'dropout_rate': 0.12151641188640254, 'ccp_alpha': 2.38438516781903}. Best is trial 646 with value: 0.6676264917109616.[0m
[32m[I 2022-04-23 02:54:25,478][0m Trial 664 finished with value: 0.6609174206822974 and parameters: {'loss': 'coxph', 'learning_rate': 0.0685568155091375, 'n_estimators': 677, 'criterion': 'friedman_mse', 'min_samples_split': 9, 'min_samples_leaf': 5, 'min_weight_fraction_leaf': 0.026498995946489516, 'min_impurity_decrease': 0.5023818124354799, 'max_features': 0.640754664230497, 'subsample': 0.2511805115973613, 'dropout_rate': 0.13254778869532874, 'ccp_alpha': 0.09002169192259835}. Best is trial 646 with value: 0.6676264917109616.[0m
[32m[I 2022-04-23 02:56:02,033][0m Trial 665 finished with value: 0.5856106520818946 and parameters: {'loss': 'coxph', 'learning_rate': 0.05320386317194848, 'n_estimators': 619, 'criterion': 'friedman_mse', 'min_samples_split': 9, 'min_samples_leaf': 5, 'min_weight_fraction_leaf': 0.014739079565184629, 'min_impurity_decrease': 0.4621039495696757, 'max_features': 0.636484655601795, 'subsample': 0.25605023498069507, 'dropout_rate': 0.1504174222578162, 'ccp_alpha': 0.23950903157211884}. Best is trial 646 with value: 0.6676264917109616.[0m
[32m[I 2022-04-23 02:58:03,093][0m Trial 666 finished with value: 0.6580224026356909 and parameters: {'loss': 'coxph', 'learning_rate': 0.07997654690448665, 'n_estimators': 665, 'criterion': 'friedman_mse', 'min_samples_split': 9, 'min_samples_leaf': 6, 'min_weight_fraction_leaf': 0.030315282040717297, 'min_impurity_decrease': 0.2804808069921143, 'max_features': 0.6169834380557863, 'subsample': 0.23889762134046574, 'dropout_rate': 0.1460611880449305, 'ccp_alpha': 0.0890211773603683}. Best is trial 646 with value: 0.6676264917109616.[0m
[32m[I 2022-04-23 02:59:39,565][0m Trial 667 finished with value: 0.633115734335182 and parameters: {'loss': 'coxph', 'learning_rate': 0.0646405120016187, 'n_estimators': 628, 'criterion': 'friedman_mse', 'min_samples_split': 8, 'min_samples_leaf': 4, 'min_weight_fraction_leaf': 0.022766417899082195, 'min_impurity_decrease': 0.48881635727200873, 'max_features': 0.6271927214708608, 'subsample': 0.25591285040610234, 'dropout_rate': 0.16973708407908217, 'ccp_alpha': 0.16262214330882696}. Best is trial 646 with value: 0.6676264917109616.[0m
[32m[I 2022-04-23 03:01:16,823][0m Trial 668 finished with value: 0.6623789392032327 and parameters: {'loss': 'coxph', 'learning_rate': 0.041445006051564086, 'n_estimators': 591, 'criterion': 'friedman_mse', 'min_samples_split': 9, 'min_samples_leaf': 4, 'min_weight_fraction_leaf': 0.00939145149286481, 'min_impurity_decrease': 0.4952111718096027, 'max_features': 0.6445649164451991, 'subsample': 0.25946310706490566, 'dropout_rate': 0.1302717935266154, 'ccp_alpha': 0.00619976246399446}. Best is trial 646 with value: 0.6676264917109616.[0m
