[32m[I 2022-04-21 12:15:48,614][0m Trial 32 finished with value: 0.25 and parameters: {'loss': 'coxph', 'learning_rate': 2.680364746015461e-05, 'n_estimators': 461, 'criterion': 'friedman_mse', 'min_samples_split': 2, 'min_samples_leaf': 8, 'min_weight_fraction_leaf': 0.332598493036932, 'min_impurity_decrease': 0.10953151840918537, 'max_features': 0.19084886889121758, 'subsample': 0.3115538897499621, 'dropout_rate': 0.2896278364215234, 'ccp_alpha': 0.6098384670321892}. Best is trial 0 with value: 0.25.[0m
[32m[I 2022-04-21 12:15:52,744][0m Trial 33 finished with value: 0.25 and parameters: {'loss': 'coxph', 'learning_rate': 3.2696429448535474e-06, 'n_estimators': 105, 'criterion': 'friedman_mse', 'min_samples_split': 10, 'min_samples_leaf': 6, 'min_weight_fraction_leaf': 0.38485591518275847, 'min_impurity_decrease': 0.1520610155081256, 'max_features': 0.35092530428665003, 'subsample': 0.386633472160577, 'dropout_rate': 0.4604124844923946, 'ccp_alpha': 4.439928481431541}. Best is trial 0 with value: 0.25.[0m
[32m[I 2022-04-21 12:16:18,869][0m Trial 34 finished with value: 0.25 and parameters: {'loss': 'coxph', 'learning_rate': 4.098715063164187e-06, 'n_estimators': 253, 'criterion': 'friedman_mse', 'min_samples_split': 8, 'min_samples_leaf': 5, 'min_weight_fraction_leaf': 0.43651928049830285, 'min_impurity_decrease': 0.23996640287859833, 'max_features': 0.08950505592325195, 'subsample': 0.5383312925645023, 'dropout_rate': 0.17133780492170722, 'ccp_alpha': 4.512942643582472}. Best is trial 0 with value: 0.25.[0m
/media/san2_ssd/data/Workdir/survival/venv/lib/python3.8/site-packages/sksurv/ensemble/boosting.py:955: RuntimeWarning: divide by zero encountered in log
  time = numpy.log(time)
/media/san2_ssd/data/Workdir/survival/venv/lib/python3.8/site-packages/sksurv/ensemble/boosting.py:955: RuntimeWarning: divide by zero encountered in log
  time = numpy.log(time)
/media/san2_ssd/data/Workdir/survival/venv/lib/python3.8/site-packages/sksurv/ensemble/boosting.py:955: RuntimeWarning: divide by zero encountered in log
  time = numpy.log(time)
/media/san2_ssd/data/Workdir/survival/venv/lib/python3.8/site-packages/sksurv/ensemble/boosting.py:955: RuntimeWarning: divide by zero encountered in log
  time = numpy.log(time)
[32m[I 2022-04-21 12:17:34,323][0m Trial 35 finished with value: -0.45 and parameters: {'loss': 'squared', 'learning_rate': 0.001467201890412339, 'n_estimators': 997, 'criterion': 'squared_error', 'min_samples_split': 3, 'min_samples_leaf': 8, 'min_weight_fraction_leaf': 0.28607114498361025, 'min_impurity_decrease': 0.7916514964383701, 'max_features': 0.5079545905946629, 'subsample': 0.1719448005734372, 'dropout_rate': 0.058979695538041166, 'ccp_alpha': 3.6480837900878247}. Best is trial 0 with value: 0.25.[0m
[32m[I 2022-04-21 12:20:55,000][0m Trial 36 finished with value: 0.25 and parameters: {'loss': 'coxph', 'learning_rate': 0.00426599769143724, 'n_estimators': 669, 'criterion': 'squared_error', 'min_samples_split': 7, 'min_samples_leaf': 9, 'min_weight_fraction_leaf': 0.28871892129346843, 'min_impurity_decrease': 0.608376480687927, 'max_features': 0.4232696378234573, 'subsample': 0.5760888654375679, 'dropout_rate': 0.08979910995753947, 'ccp_alpha': 1.9208177013089816}. Best is trial 0 with value: 0.25.[0m
/media/san2_ssd/data/Workdir/survival/venv/lib/python3.8/site-packages/sksurv/ensemble/boosting.py:955: RuntimeWarning: divide by zero encountered in log
  time = numpy.log(time)
/media/san2_ssd/data/Workdir/survival/venv/lib/python3.8/site-packages/sksurv/ensemble/boosting.py:955: RuntimeWarning: divide by zero encountered in log
  time = numpy.log(time)
/media/san2_ssd/data/Workdir/survival/venv/lib/python3.8/site-packages/sksurv/ensemble/boosting.py:955: RuntimeWarning: divide by zero encountered in log
  time = numpy.log(time)
/media/san2_ssd/data/Workdir/survival/venv/lib/python3.8/site-packages/sksurv/ensemble/boosting.py:955: RuntimeWarning: divide by zero encountered in log
  time = numpy.log(time)
[32m[I 2022-04-21 12:21:38,597][0m Trial 37 finished with value: -0.45 and parameters: {'loss': 'squared', 'learning_rate': 0.00021894652506102894, 'n_estimators': 659, 'criterion': 'squared_error', 'min_samples_split': 4, 'min_samples_leaf': 9, 'min_weight_fraction_leaf': 0.48661382220324156, 'min_impurity_decrease': 0.5268653033842128, 'max_features': 0.8933219205272509, 'subsample': 0.4690294550384494, 'dropout_rate': 0.1293491509038192, 'ccp_alpha': 3.2922662557360995}. Best is trial 0 with value: 0.25.[0m
[32m[I 2022-04-21 12:27:33,641][0m Trial 38 finished with value: 0.25 and parameters: {'loss': 'coxph', 'learning_rate': 0.02299761935900418, 'n_estimators': 849, 'criterion': 'squared_error', 'min_samples_split': 3, 'min_samples_leaf': 6, 'min_weight_fraction_leaf': 0.23919566102934275, 'min_impurity_decrease': 0.9313441678466432, 'max_features': 0.02906242051541346, 'subsample': 0.5457099883552206, 'dropout_rate': 0.04446170093949481, 'ccp_alpha': 2.609786183999622}. Best is trial 0 with value: 0.25.[0m
/media/san2_ssd/data/Workdir/survival/venv/lib/python3.8/site-packages/sksurv/ensemble/boosting.py:955: RuntimeWarning: divide by zero encountered in log
  time = numpy.log(time)
/media/san2_ssd/data/Workdir/survival/venv/lib/python3.8/site-packages/sksurv/ensemble/boosting.py:955: RuntimeWarning: divide by zero encountered in log
  time = numpy.log(time)
/media/san2_ssd/data/Workdir/survival/venv/lib/python3.8/site-packages/sksurv/ensemble/boosting.py:955: RuntimeWarning: divide by zero encountered in log
  time = numpy.log(time)
/media/san2_ssd/data/Workdir/survival/venv/lib/python3.8/site-packages/sksurv/ensemble/boosting.py:955: RuntimeWarning: divide by zero encountered in log
  time = numpy.log(time)
[32m[I 2022-04-21 12:27:49,393][0m Trial 39 finished with value: -0.45 and parameters: {'loss': 'squared', 'learning_rate': 0.0007497538202835202, 'n_estimators': 552, 'criterion': 'squared_error', 'min_samples_split': 6, 'min_samples_leaf': 10, 'min_weight_fraction_leaf': 0.3795263323603125, 'min_impurity_decrease': 0.22744584290198006, 'max_features': 0.5383909117547375, 'subsample': 0.7287534296064697, 'dropout_rate': 0.4529752661156111, 'ccp_alpha': 1.469295079854055}. Best is trial 0 with value: 0.25.[0m
[32m[I 2022-04-21 12:29:20,939][0m Trial 40 finished with value: 0.25 and parameters: {'loss': 'coxph', 'learning_rate': 0.007220655699229576, 'n_estimators': 515, 'criterion': 'squared_error', 'min_samples_split': 7, 'min_samples_leaf': 9, 'min_weight_fraction_leaf': 0.33895619540052135, 'min_impurity_decrease': 0.7163545324401326, 'max_features': 0.8133199952462076, 'subsample': 0.6096637523144418, 'dropout_rate': 0.3264802441216405, 'ccp_alpha': 0.3316360415036912}. Best is trial 0 with value: 0.25.[0m
[32m[I 2022-04-21 12:30:18,554][0m Trial 41 finished with value: 0.25 and parameters: {'loss': 'coxph', 'learning_rate': 2.491751242424396e-05, 'n_estimators': 369, 'criterion': 'squared_error', 'min_samples_split': 7, 'min_samples_leaf': 8, 'min_weight_fraction_leaf': 0.4623054455217729, 'min_impurity_decrease': 0.8705291391974593, 'max_features': 0.022225233010620005, 'subsample': 0.2767224126571847, 'dropout_rate': 0.23515188305510165, 'ccp_alpha': 1.1910593981831592}. Best is trial 0 with value: 0.25.[0m
[32m[I 2022-04-21 12:31:42,954][0m Trial 42 finished with value: 0.25 and parameters: {'loss': 'coxph', 'learning_rate': 0.0003723502907174799, 'n_estimators': 393, 'criterion': 'squared_error', 'min_samples_split': 4, 'min_samples_leaf': 7, 'min_weight_fraction_leaf': 0.3305462060209595, 'min_impurity_decrease': 0.9915391515995889, 'max_features': 0.4327680790580158, 'subsample': 0.44768646955041436, 'dropout_rate': 0.10039584360127246, 'ccp_alpha': 1.9220535156300738}. Best is trial 0 with value: 0.25.[0m
[32m[I 2022-04-21 12:34:30,078][0m Trial 43 finished with value: 0.25 and parameters: {'loss': 'coxph', 'learning_rate': 0.0004115045160125809, 'n_estimators': 643, 'criterion': 'squared_error', 'min_samples_split': 9, 'min_samples_leaf': 8, 'min_weight_fraction_leaf': 0.45765953374891893, 'min_impurity_decrease': 0.8127095913464439, 'max_features': 0.04699471892829761, 'subsample': 0.25589432887694663, 'dropout_rate': 0.2181885475279587, 'ccp_alpha': 0.9528340400616138}. Best is trial 0 with value: 0.25.[0m
[32m[I 2022-04-21 12:35:14,156][0m Trial 44 finished with value: 0.25 and parameters: {'loss': 'coxph', 'learning_rate': 0.002401315753824928, 'n_estimators': 336, 'criterion': 'squared_error', 'min_samples_split': 7, 'min_samples_leaf': 9, 'min_weight_fraction_leaf': 0.4964243607110972, 'min_impurity_decrease': 0.04628194520131226, 'max_features': 0.06195794180307995, 'subsample': 0.10113574811623044, 'dropout_rate': 0.2714754061606793, 'ccp_alpha': 0.39151324957054634}. Best is trial 0 with value: 0.25.[0m
/media/san2_ssd/data/Workdir/survival/venv/lib/python3.8/site-packages/sksurv/ensemble/boosting.py:955: RuntimeWarning: divide by zero encountered in log
  time = numpy.log(time)
/media/san2_ssd/data/Workdir/survival/venv/lib/python3.8/site-packages/sksurv/ensemble/boosting.py:955: RuntimeWarning: divide by zero encountered in log
  time = numpy.log(time)
/media/san2_ssd/data/Workdir/survival/venv/lib/python3.8/site-packages/sksurv/ensemble/boosting.py:955: RuntimeWarning: divide by zero encountered in log
  time = numpy.log(time)
/media/san2_ssd/data/Workdir/survival/venv/lib/python3.8/site-packages/sksurv/ensemble/boosting.py:955: RuntimeWarning: divide by zero encountered in log
  time = numpy.log(time)
[32m[I 2022-04-21 12:35:31,429][0m Trial 45 finished with value: -0.45 and parameters: {'loss': 'squared', 'learning_rate': 4.7007703401891216e-05, 'n_estimators': 448, 'criterion': 'squared_error', 'min_samples_split': 5, 'min_samples_leaf': 7, 'min_weight_fraction_leaf': 0.39568722528558764, 'min_impurity_decrease': 0.9045672280409668, 'max_features': 0.30785810170248457, 'subsample': 0.6817907998883522, 'dropout_rate': 0.07005262221236017, 'ccp_alpha': 1.477423297072795}. Best is trial 0 with value: 0.25.[0m
[32m[I 2022-04-21 12:36:37,421][0m Trial 46 finished with value: 0.25 and parameters: {'loss': 'coxph', 'learning_rate': 7.012667359911603e-06, 'n_estimators': 416, 'criterion': 'squared_error', 'min_samples_split': 6, 'min_samples_leaf': 9, 'min_weight_fraction_leaf': 0.44788913801774505, 'min_impurity_decrease': 0.774318728890465, 'max_features': 0.4839810545373142, 'subsample': 0.6120656353169659, 'dropout_rate': 0.2646825420148486, 'ccp_alpha': 0.8881071147730994}. Best is trial 0 with value: 0.25.[0m
[32m[I 2022-04-21 12:37:34,828][0m Trial 47 finished with value: 0.25 and parameters: {'loss': 'coxph', 'learning_rate': 1.6560928321567692e-05, 'n_estimators': 335, 'criterion': 'absolute_error', 'min_samples_split': 5, 'min_samples_leaf': 7, 'min_weight_fraction_leaf': 0.35895557793119015, 'min_impurity_decrease': 0.35526499767896136, 'max_features': 0.2744981147505543, 'subsample': 0.36933730805296305, 'dropout_rate': 0.1535113790010112, 'ccp_alpha': 2.4359331404903264}. Best is trial 0 with value: 0.25.[0m
[32m[I 2022-04-21 12:37:59,472][0m Trial 48 finished with value: 0.25 and parameters: {'loss': 'coxph', 'learning_rate': 1.0880269603912613e-05, 'n_estimators': 236, 'criterion': 'squared_error', 'min_samples_split': 4, 'min_samples_leaf': 7, 'min_weight_fraction_leaf': 0.41935489983920954, 'min_impurity_decrease': 0.4618313806526712, 'max_features': 0.3775255001707309, 'subsample': 0.4013212677282062, 'dropout_rate': 0.20575550925539404, 'ccp_alpha': 3.231057472048607}. Best is trial 0 with value: 0.25.[0m
[32m[I 2022-04-21 12:38:23,657][0m Trial 49 finished with value: 0.25 and parameters: {'loss': 'coxph', 'learning_rate': 2.3564946509283975e-05, 'n_estimators': 292, 'criterion': 'absolute_error', 'min_samples_split': 5, 'min_samples_leaf': 1, 'min_weight_fraction_leaf': 0.36764059446038055, 'min_impurity_decrease': 0.3677597087068763, 'max_features': 0.26401790974058437, 'subsample': 0.34234207220014073, 'dropout_rate': 0.578240027384681, 'ccp_alpha': 2.4193690834020223}. Best is trial 0 with value: 0.25.[0m
/media/san2_ssd/data/Workdir/survival/venv/lib/python3.8/site-packages/sksurv/ensemble/boosting.py:955: RuntimeWarning: divide by zero encountered in log
  time = numpy.log(time)
/media/san2_ssd/data/Workdir/survival/venv/lib/python3.8/site-packages/sksurv/ensemble/boosting.py:955: RuntimeWarning: divide by zero encountered in log
  time = numpy.log(time)
/media/san2_ssd/data/Workdir/survival/venv/lib/python3.8/site-packages/sksurv/ensemble/boosting.py:955: RuntimeWarning: divide by zero encountered in log
  time = numpy.log(time)
/media/san2_ssd/data/Workdir/survival/venv/lib/python3.8/site-packages/sksurv/ensemble/boosting.py:955: RuntimeWarning: divide by zero encountered in log
  time = numpy.log(time)
[32m[I 2022-04-21 12:38:25,574][0m Trial 50 finished with value: -0.45 and parameters: {'loss': 'squared', 'learning_rate': 2.2310164313152478e-06, 'n_estimators': 165, 'criterion': 'squared_error', 'min_samples_split': 2, 'min_samples_leaf': 8, 'min_weight_fraction_leaf': 0.4785453036884947, 'min_impurity_decrease': 0.7342555003032529, 'max_features': 0.1383620626097255, 'subsample': 0.20782520360907142, 'dropout_rate': 0.3640709533920687, 'ccp_alpha': 1.2569304640181267}. Best is trial 0 with value: 0.25.[0m
[32m[I 2022-04-21 12:39:26,319][0m Trial 51 finished with value: 0.25 and parameters: {'loss': 'coxph', 'learning_rate': 0.00013447118601047622, 'n_estimators': 498, 'criterion': 'friedman_mse', 'min_samples_split': 5, 'min_samples_leaf': 1, 'min_weight_fraction_leaf': 0.42632088017176956, 'min_impurity_decrease': 0.15761496621988777, 'max_features': 0.23763463645766106, 'subsample': 0.32031163757075354, 'dropout_rate': 0.555049872450619, 'ccp_alpha': 0.7325743525953757}. Best is trial 0 with value: 0.25.[0m
[32m[I 2022-04-21 12:39:59,955][0m Trial 52 finished with value: 0.25 and parameters: {'loss': 'coxph', 'learning_rate': 5.760313001679966e-06, 'n_estimators': 298, 'criterion': 'friedman_mse', 'min_samples_split': 8, 'min_samples_leaf': 5, 'min_weight_fraction_leaf': 0.4061980474156728, 'min_impurity_decrease': 0.4132896358735042, 'max_features': 0.736152978838738, 'subsample': 0.6626605264049136, 'dropout_rate': 0.2909330539801268, 'ccp_alpha': 4.78176983949288}. Best is trial 0 with value: 0.25.[0m
[32m[I 2022-04-21 12:41:00,074][0m Trial 53 finished with value: 0.25 and parameters: {'loss': 'coxph', 'learning_rate': 1.0769606898012706e-06, 'n_estimators': 492, 'criterion': 'friedman_mse', 'min_samples_split': 6, 'min_samples_leaf': 4, 'min_weight_fraction_leaf': 0.2195675569099345, 'min_impurity_decrease': 0.16814928642833463, 'max_features': 0.18448437004252977, 'subsample': 0.32836255489969063, 'dropout_rate': 0.5248148321236242, 'ccp_alpha': 0.6530635853467694}. Best is trial 0 with value: 0.25.[0m
[32m[I 2022-04-21 12:41:07,776][0m Trial 54 finished with value: 0.25 and parameters: {'loss': 'coxph', 'learning_rate': 5.89970613544411e-06, 'n_estimators': 140, 'criterion': 'friedman_mse', 'min_samples_split': 8, 'min_samples_leaf': 5, 'min_weight_fraction_leaf': 0.31494336507332, 'min_impurity_decrease': 0.426913868342933, 'max_features': 0.7541671703117985, 'subsample': 0.7855010124619658, 'dropout_rate': 0.40432641471267255, 'ccp_alpha': 4.862114508987042}. Best is trial 0 with value: 0.25.[0m
[32m[I 2022-04-21 12:41:26,023][0m Trial 55 finished with value: 0.25 and parameters: {'loss': 'coxph', 'learning_rate': 1.0193640634785096e-06, 'n_estimators': 175, 'criterion': 'friedman_mse', 'min_samples_split': 2, 'min_samples_leaf': 4, 'min_weight_fraction_leaf': 0.21629875636382834, 'min_impurity_decrease': 0.14855847218142743, 'max_features': 0.17168039510762662, 'subsample': 0.5108261971290856, 'dropout_rate': 0.17768343788127033, 'ccp_alpha': 0.5328305191167627}. Best is trial 0 with value: 0.25.[0m
[32m[I 2022-04-21 12:41:35,115][0m Trial 56 finished with value: 0.25 and parameters: {'loss': 'coxph', 'learning_rate': 1.8016167674675463e-06, 'n_estimators': 133, 'criterion': 'friedman_mse', 'min_samples_split': 2, 'min_samples_leaf': 5, 'min_weight_fraction_leaf': 0.31174848049701565, 'min_impurity_decrease': 0.48053132944388843, 'max_features': 0.1051345825736393, 'subsample': 0.839270678169473, 'dropout_rate': 0.42671756965571483, 'ccp_alpha': 4.183231248319778}. Best is trial 0 with value: 0.25.[0m
[32m[I 2022-04-21 12:41:48,535][0m Trial 57 finished with value: 0.25 and parameters: {'loss': 'coxph', 'learning_rate': 2.8837296233646913e-06, 'n_estimators': 166, 'criterion': 'friedman_mse', 'min_samples_split': 2, 'min_samples_leaf': 3, 'min_weight_fraction_leaf': 0.23318011457338253, 'min_impurity_decrease': 0.10725364954217448, 'max_features': 0.18694011748495637, 'subsample': 0.5048466910827991, 'dropout_rate': 0.19140402522906141, 'ccp_alpha': 0.5037696948333057}. Best is trial 0 with value: 0.25.[0m
[32m[I 2022-04-21 12:42:03,818][0m Trial 58 finished with value: 0.25 and parameters: {'loss': 'coxph', 'learning_rate': 1.9472976037458446e-06, 'n_estimators': 204, 'criterion': 'friedman_mse', 'min_samples_split': 2, 'min_samples_leaf': 2, 'min_weight_fraction_leaf': 0.2701636171863442, 'min_impurity_decrease': 0.4837220949160166, 'max_features': 0.1081476499001448, 'subsample': 0.8794064679469504, 'dropout_rate': 0.4676916430878166, 'ccp_alpha': 3.925778188342818}. Best is trial 0 with value: 0.25.[0m
[32m[I 2022-04-21 12:42:12,346][0m Trial 59 finished with value: 0.25 and parameters: {'loss': 'coxph', 'learning_rate': 3.112047600987255e-06, 'n_estimators': 111, 'criterion': 'friedman_mse', 'min_samples_split': 10, 'min_samples_leaf': 2, 'min_weight_fraction_leaf': 0.38408253975213846, 'min_impurity_decrease': 0.047663011871819226, 'max_features': 0.21741453615628406, 'subsample': 0.38438916015649777, 'dropout_rate': 0.19188007863610446, 'ccp_alpha': 4.681589146444528}. Best is trial 0 with value: 0.25.[0m
[32m[I 2022-04-21 12:42:33,226][0m Trial 60 finished with value: 0.25 and parameters: {'loss': 'coxph', 'learning_rate': 3.951812202433117e-06, 'n_estimators': 191, 'criterion': 'friedman_mse', 'min_samples_split': 3, 'min_samples_leaf': 2, 'min_weight_fraction_leaf': 0.2694650542593945, 'min_impurity_decrease': 0.20593051483854435, 'max_features': 0.9939618215394738, 'subsample': 0.9601064765636116, 'dropout_rate': 0.445512024010835, 'ccp_alpha': 4.529627930759925}. Best is trial 0 with value: 0.25.[0m
[32m[I 2022-04-21 12:42:42,894][0m Trial 61 finished with value: 0.25 and parameters: {'loss': 'coxph', 'learning_rate': 0.004234735899576229, 'n_estimators': 107, 'criterion': 'friedman_mse', 'min_samples_split': 10, 'min_samples_leaf': 6, 'min_weight_fraction_leaf': 0.38886817481619723, 'min_impurity_decrease': 0.06197287970243276, 'max_features': 0.1343526493410645, 'subsample': 0.5335841871526765, 'dropout_rate': 0.1828025085212927, 'ccp_alpha': 4.589255915905369}. Best is trial 0 with value: 0.25.[0m
[32m[I 2022-04-21 12:42:53,916][0m Trial 62 finished with value: 0.25 and parameters: {'loss': 'coxph', 'learning_rate': 3.6517479228841666e-06, 'n_estimators': 229, 'criterion': 'friedman_mse', 'min_samples_split': 9, 'min_samples_leaf': 6, 'min_weight_fraction_leaf': 0.26956266016260644, 'min_impurity_decrease': 0.21283234802637452, 'max_features': 0.09117049955041907, 'subsample': 0.4777023109103381, 'dropout_rate': 0.6304279310031378, 'ccp_alpha': 4.339035798404824}. Best is trial 0 with value: 0.25.[0m
[32m[I 2022-04-21 12:48:36,269][0m Trial 63 finished with value: 0.25 and parameters: {'loss': 'coxph', 'learning_rate': 0.0037448897267888088, 'n_estimators': 807, 'criterion': 'friedman_mse', 'min_samples_split': 10, 'min_samples_leaf': 6, 'min_weight_fraction_leaf': 0.157435810469922, 'min_impurity_decrease': 0.06806353550669693, 'max_features': 0.0846671686857691, 'subsample': 0.5719602497915978, 'dropout_rate': 0.15628187897475881, 'ccp_alpha': 4.424699079881298}. Best is trial 0 with value: 0.25.[0m
[32m[I 2022-04-21 12:51:37,534][0m Trial 64 finished with value: 0.25 and parameters: {'loss': 'coxph', 'learning_rate': 0.0313854984567196, 'n_estimators': 883, 'criterion': 'friedman_mse', 'min_samples_split': 9, 'min_samples_leaf': 6, 'min_weight_fraction_leaf': 0.24590746407140415, 'min_impurity_decrease': 0.24452682208820625, 'max_features': 0.07421838339370515, 'subsample': 0.559232871934372, 'dropout_rate': 0.6282884206866473, 'ccp_alpha': 4.213660028141361}. Best is trial 0 with value: 0.25.[0m
[32m[I 2022-04-21 12:57:52,420][0m Trial 65 finished with value: 0.25 and parameters: {'loss': 'coxph', 'learning_rate': 0.007343508311555223, 'n_estimators': 843, 'criterion': 'friedman_mse', 'min_samples_split': 10, 'min_samples_leaf': 6, 'min_weight_fraction_leaf': 0.13100254546178663, 'min_impurity_decrease': 0.6278997186679913, 'max_features': 0.3822726296164062, 'subsample': 0.5980208314181715, 'dropout_rate': 0.065165925283174, 'ccp_alpha': 4.3606133537112095}. Best is trial 0 with value: 0.25.[0m
[32m[I 2022-04-21 13:02:18,728][0m Trial 66 finished with value: 0.25 and parameters: {'loss': 'coxph', 'learning_rate': 0.03644655138554349, 'n_estimators': 871, 'criterion': 'absolute_error', 'min_samples_split': 9, 'min_samples_leaf': 10, 'min_weight_fraction_leaf': 0.24135236299976254, 'min_impurity_decrease': 0.25143527990934805, 'max_features': 0.06571568387029736, 'subsample': 0.6145497552476944, 'dropout_rate': 0.33736466358520284, 'ccp_alpha': 3.500983837830752}. Best is trial 0 with value: 0.25.[0m
