[32m[I 2022-04-23 00:58:44,038][0m Trial 621 finished with value: 0.6901017197399888 and parameters: {'n_hidden': 1024, 'mixture_components': 2, 'use_sparse_layer': False, 'use_batchnorm': False, 'use_dropout': False, 'mlp_size_1': 6, 'mlp_size_2': 0, 'mlp_size_3': 1, 'kernel': 'Logistic', 'loss_name': 'NLLLoss'}. Best is trial 530 with value: 0.7027982899957603.[0m
[32m[I 2022-04-23 00:59:29,694][0m Trial 622 finished with value: 0.6732773891864292 and parameters: {'n_hidden': 512, 'mixture_components': 3, 'use_sparse_layer': False, 'use_batchnorm': False, 'use_dropout': False, 'mlp_size_1': 6, 'mlp_size_2': 0, 'mlp_size_3': 0, 'kernel': 'Normal', 'loss_name': 'NLLLoss'}. Best is trial 530 with value: 0.7027982899957603.[0m
[32m[I 2022-04-23 01:00:15,390][0m Trial 623 finished with value: 0.677096371016837 and parameters: {'n_hidden': 1024, 'mixture_components': 9, 'use_sparse_layer': False, 'use_batchnorm': False, 'use_dropout': False, 'mlp_size_1': 7, 'mlp_size_2': 0, 'mlp_size_3': 0, 'kernel': 'LogLogistic', 'loss_name': 'AlternativeNLLLoss'}. Best is trial 530 with value: 0.7027982899957603.[0m
[32m[I 2022-04-23 01:02:15,169][0m Trial 624 finished with value: 0.6040303071280966 and parameters: {'n_hidden': 1024, 'mixture_components': 8, 'use_sparse_layer': False, 'use_batchnorm': True, 'use_dropout': False, 'mlp_size_1': 6, 'mlp_size_2': 0, 'mlp_size_3': 1, 'kernel': 'Normal', 'loss_name': 'NLLLoss'}. Best is trial 530 with value: 0.7027982899957603.[0m
[32m[I 2022-04-23 01:02:58,459][0m Trial 625 finished with value: 0.6700315125357487 and parameters: {'n_hidden': 2048, 'mixture_components': 10, 'use_sparse_layer': False, 'use_batchnorm': False, 'use_dropout': False, 'mlp_size_1': 8, 'mlp_size_2': 0, 'mlp_size_3': 0, 'kernel': 'Gumbel', 'loss_name': 'NLLLoss'}. Best is trial 530 with value: 0.7027982899957603.[0m
[32m[I 2022-04-23 01:03:30,676][0m Trial 626 finished with value: 0.6683357090312204 and parameters: {'n_hidden': 1024, 'mixture_components': 1, 'use_sparse_layer': False, 'use_batchnorm': False, 'use_dropout': False, 'mlp_size_1': 6, 'mlp_size_2': 0, 'mlp_size_3': 1, 'kernel': 'Normal', 'loss_name': 'NLLLoss'}. Best is trial 530 with value: 0.7027982899957603.[0m
[32m[I 2022-04-23 01:04:07,634][0m Trial 627 finished with value: 0.6642858940325976 and parameters: {'n_hidden': 1024, 'mixture_components': 2, 'use_sparse_layer': False, 'use_batchnorm': False, 'use_dropout': False, 'mlp_size_1': 6, 'mlp_size_2': 0, 'mlp_size_3': 1, 'kernel': 'Logistic', 'loss_name': 'CensoredNLLLoss'}. Best is trial 530 with value: 0.7027982899957603.[0m
[32m[I 2022-04-23 01:05:10,121][0m Trial 628 finished with value: 0.6699212680218951 and parameters: {'n_hidden': 1024, 'mixture_components': 3, 'use_sparse_layer': True, 'use_sparse_loss': True, 'lmbd': 0.029835302887983108, 'use_batchnorm': False, 'use_dropout': False, 'mlp_size_1': 6, 'mlp_size_2': 0, 'mlp_size_3': 1, 'kernel': 'Normal', 'loss_name': 'NLLLoss'}. Best is trial 530 with value: 0.7027982899957603.[0m
[32m[I 2022-04-23 01:06:18,537][0m Trial 629 finished with value: 0.6764458168460352 and parameters: {'n_hidden': 1024, 'mixture_components': 8, 'use_sparse_layer': False, 'use_batchnorm': False, 'use_dropout': False, 'mlp_size_1': 6, 'mlp_size_2': 0, 'mlp_size_3': 1, 'kernel': 'Gumbel', 'loss_name': 'AlternativeNLLLoss'}. Best is trial 530 with value: 0.7027982899957603.[0m
[32m[I 2022-04-23 01:06:58,530][0m Trial 630 finished with value: 0.6479668604848945 and parameters: {'n_hidden': 128, 'mixture_components': 9, 'use_sparse_layer': False, 'use_batchnorm': False, 'use_dropout': False, 'mlp_size_1': 4, 'mlp_size_2': 0, 'mlp_size_3': 0, 'kernel': 'Normal', 'loss_name': 'NLLLoss'}. Best is trial 530 with value: 0.7027982899957603.[0m
[32m[I 2022-04-23 01:07:44,916][0m Trial 631 finished with value: 0.6851487012417491 and parameters: {'n_hidden': 1024, 'mixture_components': 3, 'use_sparse_layer': False, 'use_batchnorm': False, 'use_dropout': False, 'mlp_size_1': 7, 'mlp_size_2': 0, 'mlp_size_3': 0, 'kernel': 'Logistic', 'loss_name': 'NLLLoss'}. Best is trial 530 with value: 0.7027982899957603.[0m
[32m[I 2022-04-23 01:08:37,621][0m Trial 632 finished with value: 0.6844534855047137 and parameters: {'n_hidden': 64, 'mixture_components': 4, 'use_sparse_layer': False, 'use_batchnorm': False, 'use_dropout': False, 'mlp_size_1': 3, 'mlp_size_2': 0, 'mlp_size_3': 0, 'kernel': 'LogLogistic', 'loss_name': 'NLLLoss'}. Best is trial 530 with value: 0.7027982899957603.[0m
[32m[I 2022-04-23 01:09:17,653][0m Trial 633 finished with value: 0.6885683570728197 and parameters: {'n_hidden': 1024, 'mixture_components': 2, 'use_sparse_layer': False, 'use_batchnorm': False, 'use_dropout': False, 'mlp_size_1': 6, 'mlp_size_2': 0, 'mlp_size_3': 1, 'kernel': 'Normal', 'loss_name': 'NLLLoss'}. Best is trial 530 with value: 0.7027982899957603.[0m
[32m[I 2022-04-23 01:10:06,171][0m Trial 634 finished with value: 0.6907041578076101 and parameters: {'n_hidden': 1024, 'mixture_components': 7, 'use_sparse_layer': False, 'use_batchnorm': False, 'use_dropout': False, 'mlp_size_1': 6, 'mlp_size_2': 0, 'mlp_size_3': 1, 'kernel': 'Gumbel', 'loss_name': 'NLLLoss'}. Best is trial 530 with value: 0.7027982899957603.[0m
[32m[I 2022-04-23 01:11:05,275][0m Trial 635 finished with value: 0.6852853434900292 and parameters: {'n_hidden': 1024, 'mixture_components': 5, 'use_sparse_layer': False, 'use_batchnorm': False, 'use_dropout': False, 'mlp_size_1': 6, 'mlp_size_2': 0, 'mlp_size_3': 1, 'kernel': 'Normal', 'loss_name': 'AlternativeNLLLoss'}. Best is trial 530 with value: 0.7027982899957603.[0m
[32m[I 2022-04-23 01:11:59,864][0m Trial 636 finished with value: 0.6531790737175978 and parameters: {'n_hidden': 1024, 'mixture_components': 2, 'use_sparse_layer': False, 'use_batchnorm': False, 'use_dropout': False, 'mlp_size_1': 6, 'mlp_size_2': 0, 'mlp_size_3': 1, 'kernel': 'Logistic', 'loss_name': 'NLLLoss'}. Best is trial 530 with value: 0.7027982899957603.[0m
[32m[I 2022-04-23 01:12:34,245][0m Trial 637 finished with value: 0.6740985595991011 and parameters: {'n_hidden': 512, 'mixture_components': 8, 'use_sparse_layer': False, 'use_batchnorm': False, 'use_dropout': False, 'mlp_size_1': 6, 'mlp_size_2': 0, 'mlp_size_3': 0, 'kernel': 'Gumbel', 'loss_name': 'NLLLoss'}. Best is trial 530 with value: 0.7027982899957603.[0m
[32m[I 2022-04-23 01:13:07,017][0m Trial 638 finished with value: 0.5669406181778781 and parameters: {'n_hidden': 1024, 'mixture_components': 8, 'use_sparse_layer': False, 'use_batchnorm': False, 'use_dropout': True, 'dropout': 0.9920433233147727, 'mlp_size_1': 7, 'mlp_size_2': 0, 'mlp_size_3': 0, 'kernel': 'Normal', 'loss_name': 'NLLLoss'}. Best is trial 530 with value: 0.7027982899957603.[0m
[32m[I 2022-04-23 01:13:45,934][0m Trial 639 finished with value: 0.6800409945499054 and parameters: {'n_hidden': 1024, 'mixture_components': 2, 'use_sparse_layer': True, 'use_sparse_loss': True, 'lmbd': 0.0003690244960542011, 'use_batchnorm': False, 'use_dropout': False, 'mlp_size_1': 6, 'mlp_size_2': 0, 'mlp_size_3': 1, 'kernel': 'Exponential', 'loss_name': 'NLLLoss'}. Best is trial 530 with value: 0.7027982899957603.[0m
[32m[I 2022-04-23 01:14:52,435][0m Trial 640 finished with value: 0.6866277326065031 and parameters: {'n_hidden': 2048, 'mixture_components': 9, 'use_sparse_layer': False, 'use_batchnorm': False, 'use_dropout': False, 'mlp_size_1': 8, 'mlp_size_2': 0, 'mlp_size_3': 0, 'kernel': 'Normal', 'loss_name': 'AlternativeNLLLoss'}. Best is trial 530 with value: 0.7027982899957603.[0m
[32m[I 2022-04-23 01:15:28,231][0m Trial 641 finished with value: 0.6889844608594339 and parameters: {'n_hidden': 1024, 'mixture_components': 3, 'use_sparse_layer': False, 'use_batchnorm': False, 'use_dropout': False, 'mlp_size_1': 6, 'mlp_size_2': 0, 'mlp_size_3': 1, 'kernel': 'Logistic', 'loss_name': 'NLLLoss'}. Best is trial 530 with value: 0.7027982899957603.[0m
[32m[I 2022-04-23 01:16:15,692][0m Trial 642 finished with value: 0.6429874132693935 and parameters: {'n_hidden': 1024, 'mixture_components': 1, 'use_sparse_layer': False, 'use_batchnorm': False, 'use_dropout': False, 'mlp_size_1': 6, 'mlp_size_2': 0, 'mlp_size_3': 1, 'kernel': 'Gumbel', 'loss_name': 'NLLLoss'}. Best is trial 530 with value: 0.7027982899957603.[0m
[32m[I 2022-04-23 01:17:47,118][0m Trial 643 finished with value: 0.5591081645047623 and parameters: {'n_hidden': 1024, 'mixture_components': 4, 'use_sparse_layer': False, 'use_batchnorm': True, 'use_dropout': False, 'mlp_size_1': 5, 'mlp_size_2': 1, 'mlp_size_3': 1, 'kernel': 'Normal', 'loss_name': 'NLLLoss'}. Best is trial 530 with value: 0.7027982899957603.[0m
[32m[I 2022-04-23 01:18:26,148][0m Trial 644 finished with value: 0.6866167636399683 and parameters: {'n_hidden': 1024, 'mixture_components': 8, 'use_sparse_layer': False, 'use_batchnorm': False, 'use_dropout': False, 'mlp_size_1': 6, 'mlp_size_2': 0, 'mlp_size_3': 1, 'kernel': 'LogLogistic', 'loss_name': 'NLLLoss'}. Best is trial 530 with value: 0.7027982899957603.[0m
[32m[I 2022-04-23 01:19:25,073][0m Trial 645 finished with value: 0.6837578151255006 and parameters: {'n_hidden': 1024, 'mixture_components': 9, 'use_sparse_layer': False, 'use_batchnorm': False, 'use_dropout': False, 'mlp_size_1': 6, 'mlp_size_2': 0, 'mlp_size_3': 1, 'kernel': 'Normal', 'loss_name': 'AlternativeNLLLoss'}. Best is trial 530 with value: 0.7027982899957603.[0m
[32m[I 2022-04-23 01:20:10,635][0m Trial 646 finished with value: 0.6850514330067121 and parameters: {'n_hidden': 1024, 'mixture_components': 3, 'use_sparse_layer': False, 'use_batchnorm': False, 'use_dropout': False, 'mlp_size_1': 6, 'mlp_size_2': 0, 'mlp_size_3': 1, 'kernel': 'Gumbel', 'loss_name': 'NLLLoss'}. Best is trial 530 with value: 0.7027982899957603.[0m
[32m[I 2022-04-23 01:20:59,413][0m Trial 647 finished with value: 0.6742776557903023 and parameters: {'n_hidden': 32, 'mixture_components': 2, 'use_sparse_layer': False, 'use_batchnorm': False, 'use_dropout': False, 'mlp_size_1': 2, 'mlp_size_2': 0, 'mlp_size_3': 0, 'kernel': 'Logistic', 'loss_name': 'NLLLoss'}. Best is trial 530 with value: 0.7027982899957603.[0m
[32m[I 2022-04-23 01:21:44,095][0m Trial 648 finished with value: 0.6686483685899695 and parameters: {'n_hidden': 1024, 'mixture_components': 10, 'use_sparse_layer': False, 'use_batchnorm': False, 'use_dropout': False, 'mlp_size_1': 1, 'mlp_size_2': 4, 'mlp_size_3': 2, 'kernel': 'Normal', 'loss_name': 'NLLLoss'}. Best is trial 530 with value: 0.7027982899957603.[0m
[32m[I 2022-04-23 01:22:44,212][0m Trial 649 finished with value: 0.6829265961844251 and parameters: {'n_hidden': 1024, 'mixture_components': 8, 'use_sparse_layer': False, 'use_batchnorm': False, 'use_dropout': False, 'mlp_size_1': 6, 'mlp_size_2': 0, 'mlp_size_3': 1, 'kernel': 'Normal', 'loss_name': 'CensoredNLLLoss'}. Best is trial 530 with value: 0.7027982899957603.[0m
[32m[I 2022-04-23 01:23:54,600][0m Trial 650 finished with value: 0.6730624437584471 and parameters: {'n_hidden': 1024, 'mixture_components': 3, 'use_sparse_layer': True, 'use_sparse_loss': False, 'use_batchnorm': False, 'use_dropout': False, 'mlp_size_1': 7, 'mlp_size_2': 0, 'mlp_size_3': 0, 'kernel': 'Gumbel', 'loss_name': 'NLLLoss'}. Best is trial 530 with value: 0.7027982899957603.[0m
[32m[I 2022-04-23 01:24:44,977][0m Trial 651 finished with value: 0.6815539150358545 and parameters: {'n_hidden': 512, 'mixture_components': 2, 'use_sparse_layer': False, 'use_batchnorm': False, 'use_dropout': False, 'mlp_size_1': 6, 'mlp_size_2': 0, 'mlp_size_3': 0, 'kernel': 'Logistic', 'loss_name': 'AlternativeNLLLoss'}. Best is trial 530 with value: 0.7027982899957603.[0m
[32m[I 2022-04-23 01:25:29,223][0m Trial 652 finished with value: 0.6841302821882704 and parameters: {'n_hidden': 1024, 'mixture_components': 8, 'use_sparse_layer': False, 'use_batchnorm': False, 'use_dropout': False, 'mlp_size_1': 6, 'mlp_size_2': 0, 'mlp_size_3': 1, 'kernel': 'Normal', 'loss_name': 'NLLLoss'}. Best is trial 530 with value: 0.7027982899957603.[0m
[32m[I 2022-04-23 01:26:10,390][0m Trial 653 finished with value: 0.6908420483837816 and parameters: {'n_hidden': 1024, 'mixture_components': 2, 'use_sparse_layer': False, 'use_batchnorm': False, 'use_dropout': False, 'mlp_size_1': 7, 'mlp_size_2': 0, 'mlp_size_3': 0, 'kernel': 'LogLogistic', 'loss_name': 'NLLLoss'}. Best is trial 530 with value: 0.7027982899957603.[0m
[32m[I 2022-04-23 01:27:16,693][0m Trial 654 finished with value: 0.6849689724705141 and parameters: {'n_hidden': 2048, 'mixture_components': 3, 'use_sparse_layer': False, 'use_batchnorm': False, 'use_dropout': False, 'mlp_size_1': 7, 'mlp_size_2': 0, 'mlp_size_3': 1, 'kernel': 'Normal', 'loss_name': 'NLLLoss'}. Best is trial 530 with value: 0.7027982899957603.[0m
[32m[I 2022-04-23 01:28:14,353][0m Trial 655 finished with value: 0.6807789184127677 and parameters: {'n_hidden': 1024, 'mixture_components': 1, 'use_sparse_layer': False, 'use_batchnorm': False, 'use_dropout': False, 'mlp_size_1': 6, 'mlp_size_2': 0, 'mlp_size_3': 1, 'kernel': 'Gumbel', 'loss_name': 'NLLLoss'}. Best is trial 530 with value: 0.7027982899957603.[0m
[32m[I 2022-04-23 01:29:04,224][0m Trial 656 finished with value: 0.7038239344068009 and parameters: {'n_hidden': 1024, 'mixture_components': 6, 'use_sparse_layer': False, 'use_batchnorm': False, 'use_dropout': False, 'mlp_size_1': 6, 'mlp_size_2': 0, 'mlp_size_3': 1, 'kernel': 'Logistic', 'loss_name': 'AlternativeNLLLoss'}. Best is trial 656 with value: 0.7038239344068009.[0m
[32m[I 2022-04-23 01:29:48,514][0m Trial 657 finished with value: 0.6688918711024014 and parameters: {'n_hidden': 1024, 'mixture_components': 6, 'use_sparse_layer': False, 'use_batchnorm': False, 'use_dropout': True, 'dropout': 0.4577784141497611, 'mlp_size_1': 5, 'mlp_size_2': 0, 'mlp_size_3': 1, 'kernel': 'Logistic', 'loss_name': 'AlternativeNLLLoss'}. Best is trial 656 with value: 0.7038239344068009.[0m
[32m[I 2022-04-23 01:30:49,563][0m Trial 658 finished with value: 0.6794914557589418 and parameters: {'n_hidden': 128, 'mixture_components': 7, 'use_sparse_layer': False, 'use_batchnorm': False, 'use_dropout': False, 'mlp_size_1': 4, 'mlp_size_2': 0, 'mlp_size_3': 0, 'kernel': 'Logistic', 'loss_name': 'AlternativeNLLLoss'}. Best is trial 656 with value: 0.7038239344068009.[0m
[32m[I 2022-04-23 01:31:43,120][0m Trial 659 finished with value: 0.6854863380214594 and parameters: {'n_hidden': 1024, 'mixture_components': 7, 'use_sparse_layer': False, 'use_batchnorm': False, 'use_dropout': False, 'mlp_size_1': 6, 'mlp_size_2': 0, 'mlp_size_3': 1, 'kernel': 'Logistic', 'loss_name': 'AlternativeNLLLoss'}. Best is trial 656 with value: 0.7038239344068009.[0m
[32m[I 2022-04-23 01:32:52,927][0m Trial 660 finished with value: 0.6847906590389901 and parameters: {'n_hidden': 1024, 'mixture_components': 6, 'use_sparse_layer': False, 'use_batchnorm': False, 'use_dropout': False, 'mlp_size_1': 6, 'mlp_size_2': 0, 'mlp_size_3': 1, 'kernel': 'Logistic', 'loss_name': 'AlternativeNLLLoss'}. Best is trial 656 with value: 0.7038239344068009.[0m
[32m[I 2022-04-23 01:33:53,580][0m Trial 661 finished with value: 0.6794669128069473 and parameters: {'n_hidden': 64, 'mixture_components': 6, 'use_sparse_layer': False, 'use_batchnorm': False, 'use_dropout': False, 'mlp_size_1': 3, 'mlp_size_2': 0, 'mlp_size_3': 0, 'kernel': 'Logistic', 'loss_name': 'AlternativeNLLLoss'}. Best is trial 656 with value: 0.7038239344068009.[0m
[32m[I 2022-04-23 01:36:11,529][0m Trial 662 finished with value: 0.6507752345281117 and parameters: {'n_hidden': 1024, 'mixture_components': 7, 'use_sparse_layer': True, 'use_sparse_loss': True, 'lmbd': 0.00904065864391792, 'use_batchnorm': True, 'use_dropout': False, 'mlp_size_1': 6, 'mlp_size_2': 0, 'mlp_size_3': 1, 'kernel': 'Logistic', 'loss_name': 'AlternativeNLLLoss'}. Best is trial 656 with value: 0.7038239344068009.[0m
[32m[I 2022-04-23 01:37:00,137][0m Trial 663 finished with value: 0.6780258540753143 and parameters: {'n_hidden': 1024, 'mixture_components': 7, 'use_sparse_layer': False, 'use_batchnorm': False, 'use_dropout': False, 'mlp_size_1': 6, 'mlp_size_2': 0, 'mlp_size_3': 1, 'kernel': 'Logistic', 'loss_name': 'AlternativeNLLLoss'}. Best is trial 656 with value: 0.7038239344068009.[0m
[32m[I 2022-04-23 01:37:56,236][0m Trial 664 finished with value: 0.6823546659441713 and parameters: {'n_hidden': 1024, 'mixture_components': 6, 'use_sparse_layer': False, 'use_batchnorm': False, 'use_dropout': False, 'mlp_size_1': 7, 'mlp_size_2': 0, 'mlp_size_3': 0, 'kernel': 'Logistic', 'loss_name': 'AlternativeNLLLoss'}. Best is trial 656 with value: 0.7038239344068009.[0m
[32m[I 2022-04-23 01:38:43,602][0m Trial 665 finished with value: 0.6967935835214529 and parameters: {'n_hidden': 1024, 'mixture_components': 7, 'use_sparse_layer': False, 'use_batchnorm': False, 'use_dropout': False, 'mlp_size_1': 6, 'mlp_size_2': 0, 'mlp_size_3': 1, 'kernel': 'Logistic', 'loss_name': 'AlternativeNLLLoss'}. Best is trial 656 with value: 0.7038239344068009.[0m
[32m[I 2022-04-23 01:39:30,938][0m Trial 666 finished with value: 0.6920243406917972 and parameters: {'n_hidden': 256, 'mixture_components': 7, 'use_sparse_layer': False, 'use_batchnorm': False, 'use_dropout': False, 'mlp_size_1': 5, 'mlp_size_2': 0, 'mlp_size_3': 0, 'kernel': 'Logistic', 'loss_name': 'AlternativeNLLLoss'}. Best is trial 656 with value: 0.7038239344068009.[0m
[32m[I 2022-04-23 01:40:26,551][0m Trial 667 finished with value: 0.6906946943750261 and parameters: {'n_hidden': 1024, 'mixture_components': 6, 'use_sparse_layer': False, 'use_batchnorm': False, 'use_dropout': False, 'mlp_size_1': 6, 'mlp_size_2': 0, 'mlp_size_3': 1, 'kernel': 'Logistic', 'loss_name': 'AlternativeNLLLoss'}. Best is trial 656 with value: 0.7038239344068009.[0m
[32m[I 2022-04-23 01:41:21,733][0m Trial 668 finished with value: 0.678189500987981 and parameters: {'n_hidden': 512, 'mixture_components': 7, 'use_sparse_layer': False, 'use_batchnorm': False, 'use_dropout': False, 'mlp_size_1': 6, 'mlp_size_2': 0, 'mlp_size_3': 0, 'kernel': 'Logistic', 'loss_name': 'AlternativeNLLLoss'}. Best is trial 656 with value: 0.7038239344068009.[0m
[32m[I 2022-04-23 01:42:14,142][0m Trial 669 finished with value: 0.6886774012867091 and parameters: {'n_hidden': 1024, 'mixture_components': 7, 'use_sparse_layer': False, 'use_batchnorm': False, 'use_dropout': False, 'mlp_size_1': 6, 'mlp_size_2': 0, 'mlp_size_3': 1, 'kernel': 'Logistic', 'loss_name': 'AlternativeNLLLoss'}. Best is trial 656 with value: 0.7038239344068009.[0m
[32m[I 2022-04-23 01:43:10,500][0m Trial 670 finished with value: 0.6894757105819267 and parameters: {'n_hidden': 1024, 'mixture_components': 8, 'use_sparse_layer': False, 'use_batchnorm': False, 'use_dropout': False, 'mlp_size_1': 6, 'mlp_size_2': 0, 'mlp_size_3': 1, 'kernel': 'Logistic', 'loss_name': 'AlternativeNLLLoss'}. Best is trial 656 with value: 0.7038239344068009.[0m
[32m[I 2022-04-23 01:43:59,232][0m Trial 671 finished with value: 0.6864048843770829 and parameters: {'n_hidden': 1024, 'mixture_components': 6, 'use_sparse_layer': False, 'use_batchnorm': False, 'use_dropout': False, 'mlp_size_1': 6, 'mlp_size_2': 0, 'mlp_size_3': 1, 'kernel': 'Logistic', 'loss_name': 'AlternativeNLLLoss'}. Best is trial 656 with value: 0.7038239344068009.[0m
[32m[I 2022-04-23 01:45:07,841][0m Trial 672 finished with value: 0.6753739503453605 and parameters: {'n_hidden': 2048, 'mixture_components': 7, 'use_sparse_layer': False, 'use_batchnorm': False, 'use_dropout': False, 'mlp_size_1': 8, 'mlp_size_2': 0, 'mlp_size_3': 0, 'kernel': 'Logistic', 'loss_name': 'AlternativeNLLLoss'}. Best is trial 656 with value: 0.7038239344068009.[0m
[32m[I 2022-04-23 01:45:55,823][0m Trial 673 finished with value: 0.6825294987988093 and parameters: {'n_hidden': 1024, 'mixture_components': 7, 'use_sparse_layer': False, 'use_batchnorm': False, 'use_dropout': False, 'mlp_size_1': 6, 'mlp_size_2': 0, 'mlp_size_3': 1, 'kernel': 'Logistic', 'loss_name': 'AlternativeNLLLoss'}. Best is trial 656 with value: 0.7038239344068009.[0m
[32m[I 2022-04-23 01:46:40,989][0m Trial 674 finished with value: 0.6351871122637522 and parameters: {'n_hidden': 1024, 'mixture_components': 6, 'use_sparse_layer': False, 'use_batchnorm': False, 'use_dropout': False, 'mlp_size_1': 6, 'mlp_size_2': 0, 'mlp_size_3': 1, 'kernel': 'Logistic', 'loss_name': 'AlternativeNLLLoss'}. Best is trial 656 with value: 0.7038239344068009.[0m
[32m[I 2022-04-23 01:47:36,852][0m Trial 675 finished with value: 0.6932121162312522 and parameters: {'n_hidden': 1024, 'mixture_components': 8, 'use_sparse_layer': True, 'use_sparse_loss': False, 'use_batchnorm': False, 'use_dropout': False, 'mlp_size_1': 6, 'mlp_size_2': 0, 'mlp_size_3': 1, 'kernel': 'Logistic', 'loss_name': 'AlternativeNLLLoss'}. Best is trial 656 with value: 0.7038239344068009.[0m
[32m[I 2022-04-23 01:48:29,727][0m Trial 676 finished with value: 0.6978140423698038 and parameters: {'n_hidden': 1024, 'mixture_components': 8, 'use_sparse_layer': False, 'use_batchnorm': False, 'use_dropout': False, 'mlp_size_1': 6, 'mlp_size_2': 0, 'mlp_size_3': 1, 'kernel': 'Logistic', 'loss_name': 'AlternativeNLLLoss'}. Best is trial 656 with value: 0.7038239344068009.[0m
[32m[I 2022-04-23 01:49:27,889][0m Trial 677 finished with value: 0.6876996773527055 and parameters: {'n_hidden': 1024, 'mixture_components': 8, 'use_sparse_layer': False, 'use_batchnorm': False, 'use_dropout': False, 'mlp_size_1': 7, 'mlp_size_2': 0, 'mlp_size_3': 0, 'kernel': 'Logistic', 'loss_name': 'AlternativeNLLLoss'}. Best is trial 656 with value: 0.7038239344068009.[0m
