[32m[I 2022-04-21 17:49:59,463][0m Trial 535 finished with value: 0.8351729822908422 and parameters: {'alpha': 3.9850132350466883, 'ties': 'breslow'}. Best is trial 70 with value: 0.835911286090736.[0m
[32m[I 2022-04-21 17:50:30,621][0m Trial 536 finished with value: 0.8355959092618619 and parameters: {'alpha': 3.525459402697667, 'ties': 'breslow'}. Best is trial 70 with value: 0.835911286090736.[0m
[32m[I 2022-04-21 17:51:02,871][0m Trial 537 finished with value: 0.8357190747858569 and parameters: {'alpha': 3.7322672968636197, 'ties': 'breslow'}. Best is trial 70 with value: 0.835911286090736.[0m
[32m[I 2022-04-21 17:51:34,806][0m Trial 538 finished with value: 0.8354804857687071 and parameters: {'alpha': 3.6290224252167924, 'ties': 'breslow'}. Best is trial 70 with value: 0.835911286090736.[0m
[32m[I 2022-04-21 17:52:05,037][0m Trial 539 finished with value: 0.8356695721462838 and parameters: {'alpha': 3.8293772860193886, 'ties': 'breslow'}. Best is trial 70 with value: 0.835911286090736.[0m
[32m[I 2022-04-21 17:52:35,145][0m Trial 540 finished with value: 0.8356281582736811 and parameters: {'alpha': 3.890038665128179, 'ties': 'breslow'}. Best is trial 70 with value: 0.835911286090736.[0m
[32m[I 2022-04-21 17:53:07,309][0m Trial 541 finished with value: 0.8356785640696703 and parameters: {'alpha': 3.748879404785628, 'ties': 'breslow'}. Best is trial 70 with value: 0.835911286090736.[0m
[32m[I 2022-04-21 17:53:38,758][0m Trial 542 finished with value: 0.835160371526715 and parameters: {'alpha': 3.3105425445213195, 'ties': 'breslow'}. Best is trial 70 with value: 0.835911286090736.[0m
[32m[I 2022-04-21 17:54:11,245][0m Trial 543 finished with value: 0.8351729822908422 and parameters: {'alpha': 3.9860751684860753, 'ties': 'breslow'}. Best is trial 70 with value: 0.835911286090736.[0m
[32m[I 2022-04-21 17:54:43,283][0m Trial 544 finished with value: 0.8354787801983354 and parameters: {'alpha': 3.6362567750440364, 'ties': 'breslow'}. Best is trial 70 with value: 0.835911286090736.[0m
[32m[I 2022-04-21 17:55:17,496][0m Trial 545 finished with value: 0.8357914144599559 and parameters: {'alpha': 3.797141715551564, 'ties': 'breslow'}. Best is trial 70 with value: 0.835911286090736.[0m
[32m[I 2022-04-21 17:55:49,514][0m Trial 546 finished with value: 0.8355446970634739 and parameters: {'alpha': 3.4316989062920005, 'ties': 'breslow'}. Best is trial 70 with value: 0.835911286090736.[0m
[32m[I 2022-04-21 17:56:22,521][0m Trial 547 finished with value: 0.8355193570680342 and parameters: {'alpha': 3.562106657718072, 'ties': 'breslow'}. Best is trial 70 with value: 0.835911286090736.[0m
[32m[I 2022-04-21 17:56:54,420][0m Trial 548 finished with value: 0.8353196172448814 and parameters: {'alpha': 4.205237807002785, 'ties': 'breslow'}. Best is trial 70 with value: 0.835911286090736.[0m
[32m[I 2022-04-21 17:57:26,238][0m Trial 549 finished with value: 0.8356379421473796 and parameters: {'alpha': 3.700495280010755, 'ties': 'breslow'}. Best is trial 70 with value: 0.835911286090736.[0m
[32m[I 2022-04-21 17:57:58,230][0m Trial 550 finished with value: 0.8356281582736811 and parameters: {'alpha': 3.9093931530157704, 'ties': 'breslow'}. Best is trial 70 with value: 0.835911286090736.[0m
[32m[I 2022-04-21 17:58:30,128][0m Trial 551 finished with value: 0.8353628700474047 and parameters: {'alpha': 4.074094023768807, 'ties': 'breslow'}. Best is trial 70 with value: 0.835911286090736.[0m
[32m[I 2022-04-21 17:59:02,185][0m Trial 552 finished with value: 0.8357123186578829 and parameters: {'alpha': 3.810614778993752, 'ties': 'breslow'}. Best is trial 70 with value: 0.835911286090736.[0m
[32m[I 2022-04-21 17:59:35,268][0m Trial 553 finished with value: 0.835597012412256 and parameters: {'alpha': 3.690289632499333, 'ties': 'efron'}. Best is trial 70 with value: 0.835911286090736.[0m
[32m[I 2022-04-21 18:00:06,272][0m Trial 554 finished with value: 0.8355601075171306 and parameters: {'alpha': 3.9391253612796406, 'ties': 'breslow'}. Best is trial 70 with value: 0.835911286090736.[0m
[32m[I 2022-04-21 18:00:37,933][0m Trial 555 finished with value: 0.8357914144599559 and parameters: {'alpha': 3.7961969029296663, 'ties': 'breslow'}. Best is trial 70 with value: 0.835911286090736.[0m
[32m[I 2022-04-21 18:01:10,215][0m Trial 556 finished with value: 0.8354805519222193 and parameters: {'alpha': 3.594144452437177, 'ties': 'breslow'}. Best is trial 70 with value: 0.835911286090736.[0m
[32m[I 2022-04-21 18:01:39,880][0m Trial 557 finished with value: 0.8357052929158193 and parameters: {'alpha': 3.865292055027201, 'ties': 'breslow'}. Best is trial 70 with value: 0.835911286090736.[0m
[32m[I 2022-04-21 18:02:09,634][0m Trial 558 finished with value: 0.8357190747858569 and parameters: {'alpha': 3.728557581899089, 'ties': 'breslow'}. Best is trial 70 with value: 0.835911286090736.[0m
[32m[I 2022-04-21 18:02:41,088][0m Trial 559 finished with value: 0.8355966595468315 and parameters: {'alpha': 3.541470246590659, 'ties': 'breslow'}. Best is trial 70 with value: 0.835911286090736.[0m
[32m[I 2022-04-21 18:03:09,839][0m Trial 560 finished with value: 0.8352116335302411 and parameters: {'alpha': 3.999311021029147, 'ties': 'breslow'}. Best is trial 70 with value: 0.835911286090736.[0m
[32m[I 2022-04-21 18:03:39,203][0m Trial 561 finished with value: 0.8355175853441505 and parameters: {'alpha': 3.6713138518267323, 'ties': 'breslow'}. Best is trial 70 with value: 0.835911286090736.[0m
[32m[I 2022-04-21 18:04:08,565][0m Trial 562 finished with value: 0.8356273513581567 and parameters: {'alpha': 3.8395062889417058, 'ties': 'breslow'}. Best is trial 70 with value: 0.835911286090736.[0m
[32m[I 2022-04-21 18:04:39,350][0m Trial 563 finished with value: 0.8356785640696703 and parameters: {'alpha': 3.7465333963982066, 'ties': 'breslow'}. Best is trial 70 with value: 0.835911286090736.[0m
[32m[I 2022-04-21 18:05:11,649][0m Trial 564 finished with value: 0.8356281582736811 and parameters: {'alpha': 3.916151322056971, 'ties': 'breslow'}. Best is trial 70 with value: 0.835911286090736.[0m
[32m[I 2022-04-21 18:05:41,081][0m Trial 565 finished with value: 0.8354683222292627 and parameters: {'alpha': 3.480315049856386, 'ties': 'breslow'}. Best is trial 70 with value: 0.835911286090736.[0m
[32m[I 2022-04-21 18:06:11,249][0m Trial 566 finished with value: 0.8355175853441505 and parameters: {'alpha': 3.6720256536485643, 'ties': 'breslow'}. Best is trial 70 with value: 0.835911286090736.[0m
[32m[I 2022-04-21 18:06:42,090][0m Trial 567 finished with value: 0.8352422931907615 and parameters: {'alpha': 4.100430317727316, 'ties': 'breslow'}. Best is trial 70 with value: 0.835911286090736.[0m
[32m[I 2022-04-21 18:07:14,574][0m Trial 568 finished with value: 0.8358321902886627 and parameters: {'alpha': 3.785890882211469, 'ties': 'breslow'}. Best is trial 70 with value: 0.835911286090736.[0m
[32m[I 2022-04-21 18:07:45,933][0m Trial 569 finished with value: 0.8357069984861909 and parameters: {'alpha': 3.8724621380482445, 'ties': 'breslow'}. Best is trial 70 with value: 0.835911286090736.[0m
[32m[I 2022-04-21 18:08:15,988][0m Trial 570 finished with value: 0.835519290914522 and parameters: {'alpha': 3.6115421269767825, 'ties': 'breslow'}. Best is trial 70 with value: 0.835911286090736.[0m
[32m[I 2022-04-21 18:08:50,182][0m Trial 571 finished with value: 0.8354049296341829 and parameters: {'alpha': 3.968738361856007, 'ties': 'breslow'}. Best is trial 70 with value: 0.835911286090736.[0m
[32m[I 2022-04-21 18:09:21,175][0m Trial 572 finished with value: 0.8358321902886627 and parameters: {'alpha': 3.786018409431779, 'ties': 'breslow'}. Best is trial 70 with value: 0.835911286090736.[0m
[32m[I 2022-04-21 18:09:52,809][0m Trial 573 finished with value: 0.8355583611728576 and parameters: {'alpha': 3.6919920222018, 'ties': 'efron'}. Best is trial 70 with value: 0.835911286090736.[0m
[32m[I 2022-04-21 18:10:23,666][0m Trial 574 finished with value: 0.8355193570680342 and parameters: {'alpha': 3.5552597447618206, 'ties': 'breslow'}. Best is trial 70 with value: 0.835911286090736.[0m
[32m[I 2022-04-21 18:10:56,205][0m Trial 575 finished with value: 0.8356661565039716 and parameters: {'alpha': 3.8471059382448933, 'ties': 'breslow'}. Best is trial 70 with value: 0.835911286090736.[0m
[32m[I 2022-04-21 18:11:28,043][0m Trial 576 finished with value: 0.8356802696400418 and parameters: {'alpha': 3.74130000071455, 'ties': 'breslow'}. Best is trial 70 with value: 0.835911286090736.[0m
[32m[I 2022-04-21 18:12:00,798][0m Trial 577 finished with value: 0.8355601075171306 and parameters: {'alpha': 3.9424089993277978, 'ties': 'breslow'}. Best is trial 70 with value: 0.835911286090736.[0m
[32m[I 2022-04-21 18:12:33,865][0m Trial 578 finished with value: 0.8354787801983354 and parameters: {'alpha': 3.6376335880915023, 'ties': 'breslow'}. Best is trial 70 with value: 0.835911286090736.[0m
[32m[I 2022-04-21 18:13:03,695][0m Trial 579 finished with value: 0.8355063770901081 and parameters: {'alpha': 3.438090267253078, 'ties': 'breslow'}. Best is trial 70 with value: 0.835911286090736.[0m
[32m[I 2022-04-21 18:13:38,404][0m Trial 580 finished with value: 0.8353262556444102 and parameters: {'alpha': 4.031965508048572, 'ties': 'breslow'}. Best is trial 70 with value: 0.835911286090736.[0m
[32m[I 2022-04-21 18:14:09,747][0m Trial 581 finished with value: 0.8357506386312487 and parameters: {'alpha': 3.798456437718889, 'ties': 'breslow'}. Best is trial 70 with value: 0.835911286090736.[0m
[32m[I 2022-04-21 18:14:41,552][0m Trial 582 finished with value: 0.8355583611728576 and parameters: {'alpha': 3.6865093234678215, 'ties': 'breslow'}. Best is trial 70 with value: 0.835911286090736.[0m
[32m[I 2022-04-21 18:15:12,986][0m Trial 583 finished with value: 0.8357069984861909 and parameters: {'alpha': 3.875845828322138, 'ties': 'breslow'}. Best is trial 70 with value: 0.835911286090736.[0m
[32m[I 2022-04-21 18:15:46,444][0m Trial 584 finished with value: 0.8355193570680342 and parameters: {'alpha': 3.562165233990959, 'ties': 'breslow'}. Best is trial 70 with value: 0.835911286090736.[0m
[32m[I 2022-04-21 18:16:17,651][0m Trial 585 finished with value: 0.8357567045863414 and parameters: {'alpha': 3.757513378679932, 'ties': 'breslow'}. Best is trial 70 with value: 0.835911286090736.[0m
[32m[I 2022-04-21 18:16:47,384][0m Trial 586 finished with value: 0.8356281582736811 and parameters: {'alpha': 3.9042853226888585, 'ties': 'breslow'}. Best is trial 70 with value: 0.835911286090736.[0m
[32m[I 2022-04-21 18:17:20,920][0m Trial 587 finished with value: 0.8347694271995957 and parameters: {'alpha': 2.520634964308886, 'ties': 'breslow'}. Best is trial 70 with value: 0.835911286090736.[0m
[32m[I 2022-04-21 18:17:54,107][0m Trial 588 finished with value: 0.8354787801983354 and parameters: {'alpha': 3.6414568663725193, 'ties': 'breslow'}. Best is trial 70 with value: 0.835911286090736.[0m
[32m[I 2022-04-21 18:18:24,620][0m Trial 589 finished with value: 0.8353262556444102 and parameters: {'alpha': 4.028435445160024, 'ties': 'breslow'}. Best is trial 70 with value: 0.835911286090736.[0m
[32m[I 2022-04-21 18:18:56,129][0m Trial 590 finished with value: 0.8357506386312487 and parameters: {'alpha': 3.8010659486119245, 'ties': 'breslow'}. Best is trial 70 with value: 0.835911286090736.[0m
[32m[I 2022-04-21 18:19:28,422][0m Trial 591 finished with value: 0.8357173692154853 and parameters: {'alpha': 3.729743724469279, 'ties': 'efron'}. Best is trial 70 with value: 0.835911286090736.[0m
[32m[I 2022-04-21 18:19:57,691][0m Trial 592 finished with value: 0.8352812311180031 and parameters: {'alpha': 4.177228145139883, 'ties': 'breslow'}. Best is trial 70 with value: 0.835911286090736.[0m
[32m[I 2022-04-21 18:20:27,216][0m Trial 593 finished with value: 0.8357069984861909 and parameters: {'alpha': 3.87383834894362, 'ties': 'breslow'}. Best is trial 70 with value: 0.835911286090736.[0m
[32m[I 2022-04-21 18:20:57,852][0m Trial 594 finished with value: 0.8350399762107896 and parameters: {'alpha': 3.2168579762007763, 'ties': 'breslow'}. Best is trial 70 with value: 0.835911286090736.[0m
[32m[I 2022-04-21 18:21:26,895][0m Trial 595 finished with value: 0.8355058489993418 and parameters: {'alpha': 3.5155337109579987, 'ties': 'breslow'}. Best is trial 70 with value: 0.835911286090736.[0m
[32m[I 2022-04-21 18:21:56,414][0m Trial 596 finished with value: 0.835519290914522 and parameters: {'alpha': 3.6245425089211016, 'ties': 'breslow'}. Best is trial 70 with value: 0.835911286090736.[0m
[32m[I 2022-04-21 18:22:26,944][0m Trial 597 finished with value: 0.835521456277732 and parameters: {'alpha': 3.9454361442535326, 'ties': 'breslow'}. Best is trial 70 with value: 0.835911286090736.[0m
[32m[I 2022-04-21 18:22:56,796][0m Trial 598 finished with value: 0.8357567045863414 and parameters: {'alpha': 3.7561900030684843, 'ties': 'breslow'}. Best is trial 70 with value: 0.835911286090736.[0m
[32m[I 2022-04-21 18:23:37,186][0m Trial 599 finished with value: 0.83426431290439 and parameters: {'alpha': 0.7799990236537588, 'ties': 'breslow'}. Best is trial 70 with value: 0.835911286090736.[0m
[32m[I 2022-04-21 18:24:06,279][0m Trial 600 finished with value: 0.8356715428291757 and parameters: {'alpha': 3.8224878764218935, 'ties': 'breslow'}. Best is trial 70 with value: 0.835911286090736.[0m
[32m[I 2022-04-21 18:24:36,786][0m Trial 601 finished with value: 0.8351915222794067 and parameters: {'alpha': 4.3691122201015204, 'ties': 'breslow'}. Best is trial 70 with value: 0.835911286090736.[0m
[32m[I 2022-04-21 18:25:06,476][0m Trial 602 finished with value: 0.8355175853441505 and parameters: {'alpha': 3.6652792140426578, 'ties': 'breslow'}. Best is trial 70 with value: 0.835911286090736.[0m
[32m[I 2022-04-21 18:25:37,007][0m Trial 603 finished with value: 0.8353262556444102 and parameters: {'alpha': 4.029353595255521, 'ties': 'breslow'}. Best is trial 70 with value: 0.835911286090736.[0m
[32m[I 2022-04-21 18:26:06,342][0m Trial 604 finished with value: 0.8356309209068851 and parameters: {'alpha': 3.836477066497091, 'ties': 'breslow'}. Best is trial 70 with value: 0.835911286090736.[0m
[32m[I 2022-04-21 18:26:35,777][0m Trial 605 finished with value: 0.8357190747858569 and parameters: {'alpha': 3.722066438471044, 'ties': 'breslow'}. Best is trial 70 with value: 0.835911286090736.[0m
[32m[I 2022-04-21 18:27:04,285][0m Trial 606 finished with value: 0.8355898383003153 and parameters: {'alpha': 3.9204631354855013, 'ties': 'breslow'}. Best is trial 70 with value: 0.835911286090736.[0m
[32m[I 2022-04-21 18:27:33,228][0m Trial 607 finished with value: 0.8355022818179076 and parameters: {'alpha': 3.3920285429849026, 'ties': 'breslow'}. Best is trial 70 with value: 0.835911286090736.[0m
[32m[I 2022-04-21 18:28:03,384][0m Trial 608 finished with value: 0.8355193570680342 and parameters: {'alpha': 3.56050282466239, 'ties': 'breslow'}. Best is trial 70 with value: 0.835911286090736.[0m
[32m[I 2022-04-21 18:28:35,226][0m Trial 609 finished with value: 0.8357190747858569 and parameters: {'alpha': 3.735659789404322, 'ties': 'breslow'}. Best is trial 70 with value: 0.835911286090736.[0m
[32m[I 2022-04-21 18:29:07,055][0m Trial 610 finished with value: 0.8355900978762966 and parameters: {'alpha': 3.825322294826093, 'ties': 'efron'}. Best is trial 70 with value: 0.835911286090736.[0m
[32m[I 2022-04-21 18:29:37,939][0m Trial 611 finished with value: 0.8354804857687071 and parameters: {'alpha': 3.629939658626208, 'ties': 'breslow'}. Best is trial 70 with value: 0.835911286090736.[0m
[32m[I 2022-04-21 18:30:08,778][0m Trial 612 finished with value: 0.835521456277732 and parameters: {'alpha': 3.9454270879146884, 'ties': 'breslow'}. Best is trial 70 with value: 0.835911286090736.[0m
[32m[I 2022-04-21 18:30:38,745][0m Trial 613 finished with value: 0.835598871889044 and parameters: {'alpha': 3.707842374723706, 'ties': 'breslow'}. Best is trial 70 with value: 0.835911286090736.[0m
[32m[I 2022-04-21 18:31:07,926][0m Trial 614 finished with value: 0.8352033768388424 and parameters: {'alpha': 4.137067782370295, 'ties': 'breslow'}. Best is trial 70 with value: 0.835911286090736.[0m
[32m[I 2022-04-21 18:31:38,988][0m Trial 615 finished with value: 0.8356715428291757 and parameters: {'alpha': 3.820840110780082, 'ties': 'breslow'}. Best is trial 70 with value: 0.835911286090736.[0m
[32m[I 2022-04-21 18:32:08,655][0m Trial 616 finished with value: 0.8355966595468315 and parameters: {'alpha': 3.543224289102583, 'ties': 'breslow'}. Best is trial 70 with value: 0.835911286090736.[0m
[32m[I 2022-04-21 18:32:38,290][0m Trial 617 finished with value: 0.8352095089409325 and parameters: {'alpha': 4.012268834523748, 'ties': 'breslow'}. Best is trial 70 with value: 0.835911286090736.[0m
[32m[I 2022-04-21 18:33:09,347][0m Trial 618 finished with value: 0.8356281582736811 and parameters: {'alpha': 3.9029360966506226, 'ties': 'breslow'}. Best is trial 70 with value: 0.835911286090736.[0m
[32m[I 2022-04-21 18:33:38,908][0m Trial 619 finished with value: 0.8355583611728576 and parameters: {'alpha': 3.678749418823346, 'ties': 'breslow'}. Best is trial 70 with value: 0.835911286090736.[0m
[32m[I 2022-04-21 18:34:07,758][0m Trial 620 finished with value: 0.8356661565039716 and parameters: {'alpha': 3.8461908269071565, 'ties': 'breslow'}. Best is trial 70 with value: 0.835911286090736.[0m
[32m[I 2022-04-21 18:34:37,730][0m Trial 621 finished with value: 0.835911286090736 and parameters: {'alpha': 3.7694464199018616, 'ties': 'breslow'}. Best is trial 70 with value: 0.835911286090736.[0m
[32m[I 2022-04-21 18:35:06,948][0m Trial 622 finished with value: 0.835519290914522 and parameters: {'alpha': 3.6220119399584854, 'ties': 'breslow'}. Best is trial 70 with value: 0.835911286090736.[0m
[32m[I 2022-04-21 18:35:36,614][0m Trial 623 finished with value: 0.8357176343280059 and parameters: {'alpha': 3.7522388056367246, 'ties': 'breslow'}. Best is trial 70 with value: 0.835911286090736.[0m
[32m[I 2022-04-21 18:36:06,823][0m Trial 624 finished with value: 0.8355071273750777 and parameters: {'alpha': 3.4695514363119075, 'ties': 'breslow'}. Best is trial 70 with value: 0.835911286090736.[0m
[32m[I 2022-04-21 18:36:37,720][0m Trial 625 finished with value: 0.8354049296341829 and parameters: {'alpha': 3.9575937867591877, 'ties': 'breslow'}. Best is trial 70 with value: 0.835911286090736.[0m
[32m[I 2022-04-21 18:37:07,503][0m Trial 626 finished with value: 0.8358705102620287 and parameters: {'alpha': 3.777611562878266, 'ties': 'breslow'}. Best is trial 70 with value: 0.835911286090736.[0m
[32m[I 2022-04-21 18:37:38,455][0m Trial 627 finished with value: 0.835519290914522 and parameters: {'alpha': 3.61809133135277, 'ties': 'breslow'}. Best is trial 70 with value: 0.835911286090736.[0m
[32m[I 2022-04-21 18:38:08,202][0m Trial 628 finished with value: 0.8357567045863414 and parameters: {'alpha': 3.759877910406623, 'ties': 'breslow'}. Best is trial 70 with value: 0.835911286090736.[0m
[32m[I 2022-04-21 18:38:37,231][0m Trial 629 finished with value: 0.8357052929158193 and parameters: {'alpha': 3.862458298724501, 'ties': 'breslow'}. Best is trial 70 with value: 0.835911286090736.[0m
[32m[I 2022-04-21 18:39:05,838][0m Trial 630 finished with value: 0.8353628700474047 and parameters: {'alpha': 4.078781394095118, 'ties': 'breslow'}. Best is trial 70 with value: 0.835911286090736.[0m
[32m[I 2022-04-21 18:39:35,554][0m Trial 631 finished with value: 0.8354787801983354 and parameters: {'alpha': 3.6597183414017582, 'ties': 'breslow'}. Best is trial 70 with value: 0.835911286090736.[0m
[32m[I 2022-04-21 18:40:06,307][0m Trial 632 finished with value: 0.8357130538833563 and parameters: {'alpha': 3.76233775003703, 'ties': 'efron'}. Best is trial 70 with value: 0.835911286090736.[0m
[32m[I 2022-04-21 18:40:36,972][0m Trial 633 finished with value: 0.8355959092618619 and parameters: {'alpha': 3.523686260362181, 'ties': 'breslow'}. Best is trial 70 with value: 0.835911286090736.[0m
[32m[I 2022-04-21 18:41:07,438][0m Trial 634 finished with value: 0.8354049296341829 and parameters: {'alpha': 3.954319262902155, 'ties': 'breslow'}. Best is trial 70 with value: 0.835911286090736.[0m
[32m[I 2022-04-21 18:41:38,389][0m Trial 635 finished with value: 0.8356661565039716 and parameters: {'alpha': 3.844466373074863, 'ties': 'breslow'}. Best is trial 70 with value: 0.835911286090736.[0m
[32m[I 2022-04-21 18:42:08,533][0m Trial 636 finished with value: 0.8355583611728576 and parameters: {'alpha': 3.6850402487793192, 'ties': 'breslow'}. Best is trial 70 with value: 0.835911286090736.[0m
[32m[I 2022-04-21 18:42:39,534][0m Trial 637 finished with value: 0.8356281582736811 and parameters: {'alpha': 3.891264996389104, 'ties': 'breslow'}. Best is trial 70 with value: 0.835911286090736.[0m
[32m[I 2022-04-21 18:43:10,054][0m Trial 638 finished with value: 0.8354805519222193 and parameters: {'alpha': 3.5797753078110097, 'ties': 'breslow'}. Best is trial 70 with value: 0.835911286090736.[0m
[32m[I 2022-04-21 18:43:38,947][0m Trial 639 finished with value: 0.8355991370015646 and parameters: {'alpha': 3.6921605902528647, 'ties': 'breslow'}. Best is trial 70 with value: 0.835911286090736.[0m
[32m[I 2022-04-21 18:44:06,385][0m Trial 640 finished with value: 0.8356695721462838 and parameters: {'alpha': 3.82914637875623, 'ties': 'breslow'}. Best is trial 70 with value: 0.835911286090736.[0m
[32m[I 2022-04-21 18:44:35,999][0m Trial 641 finished with value: 0.8352095089409325 and parameters: {'alpha': 4.0087481871326, 'ties': 'breslow'}. Best is trial 70 with value: 0.835911286090736.[0m
