[32m[I 2022-04-21 11:43:34,375][0m Trial 392 finished with value: 0.6829090813866752 and parameters: {'alpha': 0.9496572254292988, 'ties': 'breslow'}. Best is trial 26 with value: 0.6847054012696481.[0m
[32m[I 2022-04-21 11:43:34,600][0m Trial 393 finished with value: 0.684367348820454 and parameters: {'alpha': 0.6217054730290668, 'ties': 'breslow'}. Best is trial 26 with value: 0.6847054012696481.[0m
[32m[I 2022-04-21 11:43:34,851][0m Trial 394 finished with value: 0.6847054012696481 and parameters: {'alpha': 0.6943012889341509, 'ties': 'efron'}. Best is trial 26 with value: 0.6847054012696481.[0m
[32m[I 2022-04-21 11:43:34,985][0m Trial 395 finished with value: 0.6829090813866752 and parameters: {'alpha': 1.6321773578073147, 'ties': 'efron'}. Best is trial 26 with value: 0.6847054012696481.[0m
[32m[I 2022-04-21 11:43:35,119][0m Trial 396 finished with value: 0.6847054012696481 and parameters: {'alpha': 0.7574396748428752, 'ties': 'efron'}. Best is trial 26 with value: 0.6847054012696481.[0m
[32m[I 2022-04-21 11:43:35,355][0m Trial 397 finished with value: 0.6847054012696481 and parameters: {'alpha': 0.7558486943200627, 'ties': 'efron'}. Best is trial 26 with value: 0.6847054012696481.[0m
[32m[I 2022-04-21 11:43:35,490][0m Trial 398 finished with value: 0.684367348820454 and parameters: {'alpha': 0.49337272088562556, 'ties': 'efron'}. Best is trial 26 with value: 0.6847054012696481.[0m
[32m[I 2022-04-21 11:43:35,625][0m Trial 399 finished with value: 0.6847054012696481 and parameters: {'alpha': 0.8113536479881374, 'ties': 'efron'}. Best is trial 26 with value: 0.6847054012696481.[0m
[32m[I 2022-04-21 11:43:35,882][0m Trial 400 finished with value: 0.682613451992282 and parameters: {'alpha': 2.184597994350335, 'ties': 'efron'}. Best is trial 26 with value: 0.6847054012696481.[0m
[32m[I 2022-04-21 11:43:36,017][0m Trial 401 finished with value: 0.684367348820454 and parameters: {'alpha': 0.6102622205233728, 'ties': 'efron'}. Best is trial 26 with value: 0.6847054012696481.[0m
[32m[I 2022-04-21 11:43:36,225][0m Trial 402 finished with value: 0.6829090813866752 and parameters: {'alpha': 1.2718008166229091, 'ties': 'breslow'}. Best is trial 26 with value: 0.6847054012696481.[0m
[32m[I 2022-04-21 11:43:36,377][0m Trial 403 finished with value: 0.6829090813866752 and parameters: {'alpha': 1.059154324524814, 'ties': 'efron'}. Best is trial 26 with value: 0.6847054012696481.[0m
[32m[I 2022-04-21 11:43:36,515][0m Trial 404 finished with value: 0.6847054012696481 and parameters: {'alpha': 0.8365855209984043, 'ties': 'efron'}. Best is trial 26 with value: 0.6847054012696481.[0m
[32m[I 2022-04-21 11:43:36,656][0m Trial 405 finished with value: 0.684367348820454 and parameters: {'alpha': 0.6685352593106025, 'ties': 'efron'}. Best is trial 26 with value: 0.6847054012696481.[0m
[32m[I 2022-04-21 11:43:36,797][0m Trial 406 finished with value: 0.6814469677485105 and parameters: {'alpha': 4.282112496467855, 'ties': 'breslow'}. Best is trial 26 with value: 0.6847054012696481.[0m
[32m[I 2022-04-21 11:43:36,936][0m Trial 407 finished with value: 0.6847054012696481 and parameters: {'alpha': 0.8223628955570067, 'ties': 'efron'}. Best is trial 26 with value: 0.6847054012696481.[0m
[32m[I 2022-04-21 11:43:37,074][0m Trial 408 finished with value: 0.6847054012696481 and parameters: {'alpha': 0.7049780317167668, 'ties': 'efron'}. Best is trial 26 with value: 0.6847054012696481.[0m
[32m[I 2022-04-21 11:43:37,267][0m Trial 409 finished with value: 0.684367348820454 and parameters: {'alpha': 0.376705533459491, 'ties': 'efron'}. Best is trial 26 with value: 0.6847054012696481.[0m
[32m[I 2022-04-21 11:43:37,511][0m Trial 410 finished with value: 0.684367348820454 and parameters: {'alpha': 0.5617180859703251, 'ties': 'breslow'}. Best is trial 26 with value: 0.6847054012696481.[0m
[32m[I 2022-04-21 11:43:37,761][0m Trial 411 finished with value: 0.684367348820454 and parameters: {'alpha': 0.022340576319543115, 'ties': 'breslow'}. Best is trial 26 with value: 0.6847054012696481.[0m
[32m[I 2022-04-21 11:43:38,017][0m Trial 412 finished with value: 0.6829090813866752 and parameters: {'alpha': 0.9437059414241649, 'ties': 'breslow'}. Best is trial 26 with value: 0.6847054012696481.[0m
[32m[I 2022-04-21 11:43:38,292][0m Trial 413 finished with value: 0.6847054012696481 and parameters: {'alpha': 0.7657646800494564, 'ties': 'efron'}. Best is trial 26 with value: 0.6847054012696481.[0m
[32m[I 2022-04-21 11:43:38,556][0m Trial 414 finished with value: 0.684367348820454 and parameters: {'alpha': 0.6337217730985306, 'ties': 'efron'}. Best is trial 26 with value: 0.6847054012696481.[0m
[32m[I 2022-04-21 11:43:38,834][0m Trial 415 finished with value: 0.6847054012696481 and parameters: {'alpha': 0.7229649150540897, 'ties': 'efron'}. Best is trial 26 with value: 0.6847054012696481.[0m
[32m[I 2022-04-21 11:43:39,193][0m Trial 416 finished with value: 0.684367348820454 and parameters: {'alpha': 0.5395405828736513, 'ties': 'efron'}. Best is trial 26 with value: 0.6847054012696481.[0m
[32m[I 2022-04-21 11:43:39,520][0m Trial 417 finished with value: 0.6847054012696481 and parameters: {'alpha': 0.6958080580755173, 'ties': 'efron'}. Best is trial 26 with value: 0.6847054012696481.[0m
[32m[I 2022-04-21 11:43:39,793][0m Trial 418 finished with value: 0.684367348820454 and parameters: {'alpha': 0.45896334471448463, 'ties': 'efron'}. Best is trial 26 with value: 0.6847054012696481.[0m
[32m[I 2022-04-21 11:43:40,055][0m Trial 419 finished with value: 0.684367348820454 and parameters: {'alpha': 0.6193324500523432, 'ties': 'efron'}. Best is trial 26 with value: 0.6847054012696481.[0m
[32m[I 2022-04-21 11:43:40,240][0m Trial 420 finished with value: 0.6829090813866752 and parameters: {'alpha': 0.8912031996478343, 'ties': 'efron'}. Best is trial 26 with value: 0.6847054012696481.[0m
[32m[I 2022-04-21 11:43:40,403][0m Trial 421 finished with value: 0.6829090813866752 and parameters: {'alpha': 0.8821246202849718, 'ties': 'efron'}. Best is trial 26 with value: 0.6847054012696481.[0m
[32m[I 2022-04-21 11:43:40,675][0m Trial 422 finished with value: 0.6847054012696481 and parameters: {'alpha': 0.7980841246866126, 'ties': 'efron'}. Best is trial 26 with value: 0.6847054012696481.[0m
[32m[I 2022-04-21 11:43:40,823][0m Trial 423 finished with value: 0.6829090813866752 and parameters: {'alpha': 1.017849206371182, 'ties': 'efron'}. Best is trial 26 with value: 0.6847054012696481.[0m
[32m[I 2022-04-21 11:43:40,959][0m Trial 424 finished with value: 0.6829090813866752 and parameters: {'alpha': 0.8674802286070286, 'ties': 'efron'}. Best is trial 26 with value: 0.6847054012696481.[0m
[32m[I 2022-04-21 11:43:41,110][0m Trial 425 finished with value: 0.6829496894793843 and parameters: {'alpha': 2.464609179237324, 'ties': 'efron'}. Best is trial 26 with value: 0.6847054012696481.[0m
[32m[I 2022-04-21 11:43:41,278][0m Trial 426 finished with value: 0.684367348820454 and parameters: {'alpha': 0.6696121871460315, 'ties': 'efron'}. Best is trial 26 with value: 0.6847054012696481.[0m
[32m[I 2022-04-21 11:43:41,475][0m Trial 427 finished with value: 0.6829090813866752 and parameters: {'alpha': 1.0581048662518702, 'ties': 'efron'}. Best is trial 26 with value: 0.6847054012696481.[0m
[32m[I 2022-04-21 11:43:41,634][0m Trial 428 finished with value: 0.6829090813866752 and parameters: {'alpha': 0.9696365253031554, 'ties': 'efron'}. Best is trial 26 with value: 0.6847054012696481.[0m
[32m[I 2022-04-21 11:43:41,886][0m Trial 429 finished with value: 0.6847054012696481 and parameters: {'alpha': 0.8266205102806168, 'ties': 'efron'}. Best is trial 26 with value: 0.6847054012696481.[0m
[32m[I 2022-04-21 11:43:42,227][0m Trial 430 finished with value: 0.6847054012696481 and parameters: {'alpha': 0.7702988119773643, 'ties': 'efron'}. Best is trial 26 with value: 0.6847054012696481.[0m
[32m[I 2022-04-21 11:43:42,523][0m Trial 431 finished with value: 0.6829090813866752 and parameters: {'alpha': 1.140241843112429, 'ties': 'efron'}. Best is trial 26 with value: 0.6847054012696481.[0m
[32m[I 2022-04-21 11:43:42,770][0m Trial 432 finished with value: 0.6847054012696481 and parameters: {'alpha': 0.9326528074959649, 'ties': 'breslow'}. Best is trial 26 with value: 0.6847054012696481.[0m
[32m[I 2022-04-21 11:43:43,008][0m Trial 433 finished with value: 0.6829090813866752 and parameters: {'alpha': 0.9671333955986078, 'ties': 'breslow'}. Best is trial 26 with value: 0.6847054012696481.[0m
[32m[I 2022-04-21 11:43:43,312][0m Trial 434 finished with value: 0.6829090813866752 and parameters: {'alpha': 0.8960877612384822, 'ties': 'efron'}. Best is trial 26 with value: 0.6847054012696481.[0m
[32m[I 2022-04-21 11:43:43,528][0m Trial 435 finished with value: 0.6829090813866752 and parameters: {'alpha': 1.1799541078041083, 'ties': 'breslow'}. Best is trial 26 with value: 0.6847054012696481.[0m
[32m[I 2022-04-21 11:43:43,816][0m Trial 436 finished with value: 0.6847054012696481 and parameters: {'alpha': 0.8581628947829196, 'ties': 'efron'}. Best is trial 26 with value: 0.6847054012696481.[0m
[32m[I 2022-04-21 11:43:44,005][0m Trial 437 finished with value: 0.6814469677485105 and parameters: {'alpha': 3.5386254738216403, 'ties': 'efron'}. Best is trial 26 with value: 0.6847054012696481.[0m
[32m[I 2022-04-21 11:43:44,170][0m Trial 438 finished with value: 0.684367348820454 and parameters: {'alpha': 0.5735727627284721, 'ties': 'efron'}. Best is trial 26 with value: 0.6847054012696481.[0m
[32m[I 2022-04-21 11:43:44,330][0m Trial 439 finished with value: 0.6829090813866752 and parameters: {'alpha': 1.0260714478026596, 'ties': 'efron'}. Best is trial 26 with value: 0.6847054012696481.[0m
[32m[I 2022-04-21 11:43:44,483][0m Trial 440 finished with value: 0.6847054012696481 and parameters: {'alpha': 0.7204283469758576, 'ties': 'efron'}. Best is trial 26 with value: 0.6847054012696481.[0m
[32m[I 2022-04-21 11:43:44,638][0m Trial 441 finished with value: 0.684367348820454 and parameters: {'alpha': 0.6774410989996431, 'ties': 'efron'}. Best is trial 26 with value: 0.6847054012696481.[0m
[32m[I 2022-04-21 11:43:44,773][0m Trial 442 finished with value: 0.6829090813866752 and parameters: {'alpha': 0.996423237798962, 'ties': 'breslow'}. Best is trial 26 with value: 0.6847054012696481.[0m
[32m[I 2022-04-21 11:43:44,914][0m Trial 443 finished with value: 0.6847054012696481 and parameters: {'alpha': 0.7768584431585852, 'ties': 'efron'}. Best is trial 26 with value: 0.6847054012696481.[0m
[32m[I 2022-04-21 11:43:45,048][0m Trial 444 finished with value: 0.684367348820454 and parameters: {'alpha': 0.5395621311731309, 'ties': 'efron'}. Best is trial 26 with value: 0.6847054012696481.[0m
[32m[I 2022-04-21 11:43:45,182][0m Trial 445 finished with value: 0.6829090813866752 and parameters: {'alpha': 1.040740065329554, 'ties': 'breslow'}. Best is trial 26 with value: 0.6847054012696481.[0m
[32m[I 2022-04-21 11:43:45,336][0m Trial 446 finished with value: 0.6847054012696481 and parameters: {'alpha': 0.765374253501665, 'ties': 'efron'}. Best is trial 26 with value: 0.6847054012696481.[0m
[32m[I 2022-04-21 11:43:45,467][0m Trial 447 finished with value: 0.6847054012696481 and parameters: {'alpha': 0.910038817560459, 'ties': 'breslow'}. Best is trial 26 with value: 0.6847054012696481.[0m
[32m[I 2022-04-21 11:43:45,607][0m Trial 448 finished with value: 0.6847054012696481 and parameters: {'alpha': 0.9274014989661798, 'ties': 'breslow'}. Best is trial 26 with value: 0.6847054012696481.[0m
[32m[I 2022-04-21 11:43:45,783][0m Trial 449 finished with value: 0.684367348820454 and parameters: {'alpha': 0.6682732221122963, 'ties': 'efron'}. Best is trial 26 with value: 0.6847054012696481.[0m
[32m[I 2022-04-21 11:43:46,044][0m Trial 450 finished with value: 0.6847054012696481 and parameters: {'alpha': 0.8430066559621529, 'ties': 'breslow'}. Best is trial 26 with value: 0.6847054012696481.[0m
[32m[I 2022-04-21 11:43:46,388][0m Trial 451 finished with value: 0.684367348820454 and parameters: {'alpha': 0.6083945012879997, 'ties': 'breslow'}. Best is trial 26 with value: 0.6847054012696481.[0m
[32m[I 2022-04-21 11:43:46,658][0m Trial 452 finished with value: 0.684367348820454 and parameters: {'alpha': 0.19119736003794596, 'ties': 'breslow'}. Best is trial 26 with value: 0.6847054012696481.[0m
[32m[I 2022-04-21 11:43:47,024][0m Trial 453 finished with value: 0.6847054012696481 and parameters: {'alpha': 0.8340086496374726, 'ties': 'breslow'}. Best is trial 26 with value: 0.6847054012696481.[0m
[32m[I 2022-04-21 11:43:47,318][0m Trial 454 finished with value: 0.6847054012696481 and parameters: {'alpha': 0.7562870961496885, 'ties': 'breslow'}. Best is trial 26 with value: 0.6847054012696481.[0m
[32m[I 2022-04-21 11:43:47,660][0m Trial 455 finished with value: 0.684367348820454 and parameters: {'alpha': 0.4563087874259944, 'ties': 'breslow'}. Best is trial 26 with value: 0.6847054012696481.[0m
[32m[I 2022-04-21 11:43:47,921][0m Trial 456 finished with value: 0.6847054012696481 and parameters: {'alpha': 0.9263670487193777, 'ties': 'breslow'}. Best is trial 26 with value: 0.6847054012696481.[0m
[32m[I 2022-04-21 11:43:48,163][0m Trial 457 finished with value: 0.684367348820454 and parameters: {'alpha': 0.320615517632947, 'ties': 'breslow'}. Best is trial 26 with value: 0.6847054012696481.[0m
[32m[I 2022-04-21 11:43:48,438][0m Trial 458 finished with value: 0.684367348820454 and parameters: {'alpha': 0.6615961348558923, 'ties': 'efron'}. Best is trial 26 with value: 0.6847054012696481.[0m
[32m[I 2022-04-21 11:43:48,701][0m Trial 459 finished with value: 0.684367348820454 and parameters: {'alpha': 0.5236937193443423, 'ties': 'efron'}. Best is trial 26 with value: 0.6847054012696481.[0m
[32m[I 2022-04-21 11:43:48,934][0m Trial 460 finished with value: 0.6847054012696481 and parameters: {'alpha': 0.8140931471963286, 'ties': 'efron'}. Best is trial 26 with value: 0.6847054012696481.[0m
[32m[I 2022-04-21 11:43:49,058][0m Trial 461 finished with value: 0.6847054012696481 and parameters: {'alpha': 0.8089525454402227, 'ties': 'breslow'}. Best is trial 26 with value: 0.6847054012696481.[0m
[32m[I 2022-04-21 11:43:49,315][0m Trial 462 finished with value: 0.6847054012696481 and parameters: {'alpha': 0.7852170263491175, 'ties': 'breslow'}. Best is trial 26 with value: 0.6847054012696481.[0m
[32m[I 2022-04-21 11:43:49,458][0m Trial 463 finished with value: 0.684367348820454 and parameters: {'alpha': 0.6833448759914189, 'ties': 'efron'}. Best is trial 26 with value: 0.6847054012696481.[0m
[32m[I 2022-04-21 11:43:49,598][0m Trial 464 finished with value: 0.6829496894793843 and parameters: {'alpha': 2.5756738394034966, 'ties': 'efron'}. Best is trial 26 with value: 0.6847054012696481.[0m
[32m[I 2022-04-21 11:43:49,736][0m Trial 465 finished with value: 0.6829090813866752 and parameters: {'alpha': 0.88142708555217, 'ties': 'efron'}. Best is trial 26 with value: 0.6847054012696481.[0m
[32m[I 2022-04-21 11:43:49,874][0m Trial 466 finished with value: 0.6829090813866752 and parameters: {'alpha': 1.0836686186370814, 'ties': 'efron'}. Best is trial 26 with value: 0.6847054012696481.[0m
[32m[I 2022-04-21 11:43:50,140][0m Trial 467 finished with value: 0.684367348820454 and parameters: {'alpha': 0.5978917079151841, 'ties': 'efron'}. Best is trial 26 with value: 0.6847054012696481.[0m
[32m[I 2022-04-21 11:43:50,700][0m Trial 468 finished with value: 0.684367348820454 and parameters: {'alpha': 0.6811114951328797, 'ties': 'efron'}. Best is trial 26 with value: 0.6847054012696481.[0m
[32m[I 2022-04-21 11:43:51,217][0m Trial 469 finished with value: 0.6847054012696481 and parameters: {'alpha': 0.7214602076743101, 'ties': 'efron'}. Best is trial 26 with value: 0.6847054012696481.[0m
[32m[I 2022-04-21 11:43:51,648][0m Trial 470 finished with value: 0.6829090813866752 and parameters: {'alpha': 1.4746588886576495, 'ties': 'efron'}. Best is trial 26 with value: 0.6847054012696481.[0m
[32m[I 2022-04-21 11:43:52,053][0m Trial 471 finished with value: 0.6829090813866752 and parameters: {'alpha': 0.8751925150393189, 'ties': 'efron'}. Best is trial 26 with value: 0.6847054012696481.[0m
[32m[I 2022-04-21 11:43:52,415][0m Trial 472 finished with value: 0.684367348820454 and parameters: {'alpha': 0.5989311328517377, 'ties': 'efron'}. Best is trial 26 with value: 0.6847054012696481.[0m
[32m[I 2022-04-21 11:43:52,714][0m Trial 473 finished with value: 0.6829090813866752 and parameters: {'alpha': 0.9911493885723361, 'ties': 'breslow'}. Best is trial 26 with value: 0.6847054012696481.[0m
[32m[I 2022-04-21 11:43:53,006][0m Trial 474 finished with value: 0.6847054012696481 and parameters: {'alpha': 0.8379116513996605, 'ties': 'efron'}. Best is trial 26 with value: 0.6847054012696481.[0m
[32m[I 2022-04-21 11:43:53,296][0m Trial 475 finished with value: 0.6829496894793843 and parameters: {'alpha': 2.937619732955307, 'ties': 'efron'}. Best is trial 26 with value: 0.6847054012696481.[0m
[32m[I 2022-04-21 11:43:53,594][0m Trial 476 finished with value: 0.6847054012696481 and parameters: {'alpha': 0.7758637194798683, 'ties': 'efron'}. Best is trial 26 with value: 0.6847054012696481.[0m
[32m[I 2022-04-21 11:43:53,891][0m Trial 477 finished with value: 0.6847054012696481 and parameters: {'alpha': 0.7366310766665962, 'ties': 'efron'}. Best is trial 26 with value: 0.6847054012696481.[0m
[32m[I 2022-04-21 11:43:54,218][0m Trial 478 finished with value: 0.684367348820454 and parameters: {'alpha': 0.4885371161648621, 'ties': 'efron'}. Best is trial 26 with value: 0.6847054012696481.[0m
[32m[I 2022-04-21 11:43:54,525][0m Trial 479 finished with value: 0.684367348820454 and parameters: {'alpha': 0.6923342869274826, 'ties': 'breslow'}. Best is trial 26 with value: 0.6847054012696481.[0m
[32m[I 2022-04-21 11:43:54,738][0m Trial 480 finished with value: 0.684367348820454 and parameters: {'alpha': 0.573565825003853, 'ties': 'efron'}. Best is trial 26 with value: 0.6847054012696481.[0m
[32m[I 2022-04-21 11:43:54,980][0m Trial 481 finished with value: 0.684367348820454 and parameters: {'alpha': 0.45186344101585235, 'ties': 'efron'}. Best is trial 26 with value: 0.6847054012696481.[0m
[32m[I 2022-04-21 11:43:55,423][0m Trial 482 finished with value: 0.6847054012696481 and parameters: {'alpha': 0.710621744496144, 'ties': 'efron'}. Best is trial 26 with value: 0.6847054012696481.[0m
[32m[I 2022-04-21 11:43:55,788][0m Trial 483 finished with value: 0.6847054012696481 and parameters: {'alpha': 0.7518007196013556, 'ties': 'breslow'}. Best is trial 26 with value: 0.6847054012696481.[0m
[32m[I 2022-04-21 11:43:56,230][0m Trial 484 finished with value: 0.684367348820454 and parameters: {'alpha': 0.5613697464247829, 'ties': 'breslow'}. Best is trial 26 with value: 0.6847054012696481.[0m
[32m[I 2022-04-21 11:43:56,565][0m Trial 485 finished with value: 0.6847054012696481 and parameters: {'alpha': 0.8423294083459638, 'ties': 'efron'}. Best is trial 26 with value: 0.6847054012696481.[0m
[32m[I 2022-04-21 11:43:56,902][0m Trial 486 finished with value: 0.684367348820454 and parameters: {'alpha': 0.6469100411555635, 'ties': 'breslow'}. Best is trial 26 with value: 0.6847054012696481.[0m
[32m[I 2022-04-21 11:43:57,189][0m Trial 487 finished with value: 0.6829090813866752 and parameters: {'alpha': 0.9360372653201139, 'ties': 'efron'}. Best is trial 26 with value: 0.6847054012696481.[0m
[32m[I 2022-04-21 11:43:57,451][0m Trial 488 finished with value: 0.6814469677485105 and parameters: {'alpha': 3.9871929031626316, 'ties': 'efron'}. Best is trial 26 with value: 0.6847054012696481.[0m
[32m[I 2022-04-21 11:43:57,638][0m Trial 489 finished with value: 0.6829090813866752 and parameters: {'alpha': 1.158288649090499, 'ties': 'breslow'}. Best is trial 26 with value: 0.6847054012696481.[0m
[32m[I 2022-04-21 11:43:57,820][0m Trial 490 finished with value: 0.6829090813866752 and parameters: {'alpha': 0.9913516145744727, 'ties': 'breslow'}. Best is trial 26 with value: 0.6847054012696481.[0m
[32m[I 2022-04-21 11:43:57,980][0m Trial 491 finished with value: 0.6829090813866752 and parameters: {'alpha': 1.1113774152445495, 'ties': 'efron'}. Best is trial 26 with value: 0.6847054012696481.[0m
[32m[I 2022-04-21 11:43:58,202][0m Trial 492 finished with value: 0.6829090813866752 and parameters: {'alpha': 0.8907017853444177, 'ties': 'efron'}. Best is trial 26 with value: 0.6847054012696481.[0m
[32m[I 2022-04-21 11:43:58,416][0m Trial 493 finished with value: 0.6829090813866752 and parameters: {'alpha': 0.9365914117203487, 'ties': 'efron'}. Best is trial 26 with value: 0.6847054012696481.[0m
[32m[I 2022-04-21 11:43:58,554][0m Trial 494 finished with value: 0.6829090813866752 and parameters: {'alpha': 1.054428074521097, 'ties': 'breslow'}. Best is trial 26 with value: 0.6847054012696481.[0m
[32m[I 2022-04-21 11:43:58,690][0m Trial 495 finished with value: 0.6847054012696481 and parameters: {'alpha': 0.8054070430612136, 'ties': 'efron'}. Best is trial 26 with value: 0.6847054012696481.[0m
[32m[I 2022-04-21 11:43:58,980][0m Trial 496 finished with value: 0.6847054012696481 and parameters: {'alpha': 0.8398414008427455, 'ties': 'efron'}. Best is trial 26 with value: 0.6847054012696481.[0m
[32m[I 2022-04-21 11:43:59,105][0m Trial 497 finished with value: 0.6847054012696481 and parameters: {'alpha': 0.7379537381788247, 'ties': 'breslow'}. Best is trial 26 with value: 0.6847054012696481.[0m
[32m[I 2022-04-21 11:43:59,229][0m Trial 498 finished with value: 0.684367348820454 and parameters: {'alpha': 0.6529511910981386, 'ties': 'breslow'}. Best is trial 26 with value: 0.6847054012696481.[0m
