[32m[I 2022-04-23 08:14:59,060][0m Trial 891 finished with value: 0.5 and parameters: {'loss': 'coxph', 'learning_rate': 0.03450506250690074, 'n_estimators': 701, 'criterion': 'friedman_mse', 'min_samples_split': 9, 'min_samples_leaf': 5, 'min_weight_fraction_leaf': 0.021601215585290087, 'min_impurity_decrease': 0.5890250414474695, 'max_features': 0.4940537194529153, 'subsample': 0.2588290566074367, 'dropout_rate': 0.12617469325133704, 'ccp_alpha': 2.041652101830177}. Best is trial 690 with value: 0.6691837560454439.[0m
[32m[I 2022-04-23 08:16:45,807][0m Trial 892 finished with value: 0.6577769654539221 and parameters: {'loss': 'coxph', 'learning_rate': 0.047350866343612796, 'n_estimators': 648, 'criterion': 'friedman_mse', 'min_samples_split': 9, 'min_samples_leaf': 6, 'min_weight_fraction_leaf': 0.02777232292169136, 'min_impurity_decrease': 0.5738545309587614, 'max_features': 0.49895794693118545, 'subsample': 0.24510648559330978, 'dropout_rate': 0.13972553991791462, 'ccp_alpha': 0.09175687257059541}. Best is trial 690 with value: 0.6691837560454439.[0m
[32m[I 2022-04-23 08:18:24,992][0m Trial 893 finished with value: 0.5275372143659631 and parameters: {'loss': 'coxph', 'learning_rate': 0.024180039924633467, 'n_estimators': 633, 'criterion': 'friedman_mse', 'min_samples_split': 9, 'min_samples_leaf': 6, 'min_weight_fraction_leaf': 0.013519623570084755, 'min_impurity_decrease': 0.6020397324157969, 'max_features': 0.4871768664511519, 'subsample': 0.28737629026628714, 'dropout_rate': 0.14168708637541189, 'ccp_alpha': 0.285880939693256}. Best is trial 690 with value: 0.6691837560454439.[0m
[32m[I 2022-04-23 08:20:32,621][0m Trial 894 finished with value: 0.6630006137689046 and parameters: {'loss': 'coxph', 'learning_rate': 0.0555186301670683, 'n_estimators': 680, 'criterion': 'friedman_mse', 'min_samples_split': 9, 'min_samples_leaf': 6, 'min_weight_fraction_leaf': 0.033014420193570815, 'min_impurity_decrease': 0.5776571473017534, 'max_features': 0.958319212321161, 'subsample': 0.22632869637456454, 'dropout_rate': 0.09827517971737051, 'ccp_alpha': 0.003419073535192728}. Best is trial 690 with value: 0.6691837560454439.[0m
[32m[I 2022-04-23 08:22:40,215][0m Trial 895 finished with value: 0.6563641908482951 and parameters: {'loss': 'coxph', 'learning_rate': 0.05714020041240009, 'n_estimators': 663, 'criterion': 'friedman_mse', 'min_samples_split': 9, 'min_samples_leaf': 6, 'min_weight_fraction_leaf': 0.030423525045982502, 'min_impurity_decrease': 0.6154664322367881, 'max_features': 0.9999734034138559, 'subsample': 0.20210586707274647, 'dropout_rate': 0.0860190202984408, 'ccp_alpha': 0.0017305379278322254}. Best is trial 690 with value: 0.6691837560454439.[0m
[32m[I 2022-04-23 08:24:42,392][0m Trial 896 finished with value: 0.6518917929678567 and parameters: {'loss': 'coxph', 'learning_rate': 0.056019279189793325, 'n_estimators': 681, 'criterion': 'friedman_mse', 'min_samples_split': 9, 'min_samples_leaf': 6, 'min_weight_fraction_leaf': 0.03673976153645844, 'min_impurity_decrease': 0.5881820907354022, 'max_features': 0.8696597526560923, 'subsample': 0.19348526289681767, 'dropout_rate': 0.08971542249658586, 'ccp_alpha': 0.15924548640182262}. Best is trial 690 with value: 0.6691837560454439.[0m
[32m[I 2022-04-23 08:26:28,316][0m Trial 897 finished with value: 0.5 and parameters: {'loss': 'coxph', 'learning_rate': 0.06644768653500212, 'n_estimators': 628, 'criterion': 'absolute_error', 'min_samples_split': 9, 'min_samples_leaf': 6, 'min_weight_fraction_leaf': 0.019423353260863137, 'min_impurity_decrease': 0.5689951586991875, 'max_features': 0.8921794188570978, 'subsample': 0.2133319735407136, 'dropout_rate': 0.0850061326848208, 'ccp_alpha': 0.0029714626284684685}. Best is trial 690 with value: 0.6691837560454439.[0m
[32m[I 2022-04-23 08:28:29,414][0m Trial 898 finished with value: 0.5148756023171417 and parameters: {'loss': 'coxph', 'learning_rate': 0.07776759328092143, 'n_estimators': 686, 'criterion': 'friedman_mse', 'min_samples_split': 9, 'min_samples_leaf': 6, 'min_weight_fraction_leaf': 0.033447642606833874, 'min_impurity_decrease': 0.5847805543710798, 'max_features': 0.4717497100936005, 'subsample': 0.22850896213225808, 'dropout_rate': 0.11682523273900328, 'ccp_alpha': 0.4067184154403865}. Best is trial 690 with value: 0.6691837560454439.[0m
[32m[I 2022-04-23 08:30:04,645][0m Trial 899 finished with value: 0.6349334655258182 and parameters: {'loss': 'coxph', 'learning_rate': 0.04715450194136009, 'n_estimators': 595, 'criterion': 'friedman_mse', 'min_samples_split': 9, 'min_samples_leaf': 6, 'min_weight_fraction_leaf': 0.02614128602574597, 'min_impurity_decrease': 0.6154207416401687, 'max_features': 0.9639557142405569, 'subsample': 0.2261341643415443, 'dropout_rate': 0.07959588839638922, 'ccp_alpha': 0.17007598226659632}. Best is trial 690 with value: 0.6691837560454439.[0m
[32m[I 2022-04-23 08:30:11,536][0m Trial 900 finished with value: 0.6521848507784923 and parameters: {'loss': 'coxph', 'learning_rate': 0.0800707195412925, 'n_estimators': 144, 'criterion': 'friedman_mse', 'min_samples_split': 9, 'min_samples_leaf': 6, 'min_weight_fraction_leaf': 0.008057519716629118, 'min_impurity_decrease': 0.6253064048128345, 'max_features': 0.8844347133500386, 'subsample': 0.232776996297206, 'dropout_rate': 0.11165052099059442, 'ccp_alpha': 0.09366531589285823}. Best is trial 690 with value: 0.6691837560454439.[0m
[32m[I 2022-04-23 08:31:54,747][0m Trial 901 finished with value: 0.6370441732393992 and parameters: {'loss': 'coxph', 'learning_rate': 0.05705379475595894, 'n_estimators': 646, 'criterion': 'friedman_mse', 'min_samples_split': 9, 'min_samples_leaf': 6, 'min_weight_fraction_leaf': 0.04184441956594129, 'min_impurity_decrease': 0.5601114302735865, 'max_features': 0.9265708056396209, 'subsample': 0.19282158754330206, 'dropout_rate': 0.14750830204064486, 'ccp_alpha': 0.22301072166577035}. Best is trial 690 with value: 0.6691837560454439.[0m
/media/san2_ssd/data/Workdir/survival/venv/lib/python3.8/site-packages/sksurv/ensemble/boosting.py:955: RuntimeWarning: divide by zero encountered in log
  time = numpy.log(time)
/media/san2_ssd/data/Workdir/survival/venv/lib/python3.8/site-packages/sksurv/ensemble/boosting.py:955: RuntimeWarning: divide by zero encountered in log
  time = numpy.log(time)
/media/san2_ssd/data/Workdir/survival/venv/lib/python3.8/site-packages/sksurv/ensemble/boosting.py:955: RuntimeWarning: divide by zero encountered in log
  time = numpy.log(time)
/media/san2_ssd/data/Workdir/survival/venv/lib/python3.8/site-packages/sksurv/ensemble/boosting.py:955: RuntimeWarning: divide by zero encountered in log
  time = numpy.log(time)
[32m[I 2022-04-23 08:32:15,734][0m Trial 902 finished with value: -0.7347244950442565 and parameters: {'loss': 'squared', 'learning_rate': 0.06862016201441436, 'n_estimators': 619, 'criterion': 'friedman_mse', 'min_samples_split': 9, 'min_samples_leaf': 6, 'min_weight_fraction_leaf': 0.03176522530258631, 'min_impurity_decrease': 0.6439897975326132, 'max_features': 0.4631198584161304, 'subsample': 0.21075876484751244, 'dropout_rate': 0.0629815310707618, 'ccp_alpha': 0.09218087103830445}. Best is trial 690 with value: 0.6691837560454439.[0m
[32m[I 2022-04-23 08:33:54,105][0m Trial 903 finished with value: 0.6619993664052919 and parameters: {'loss': 'coxph', 'learning_rate': 0.045197493866351426, 'n_estimators': 586, 'criterion': 'friedman_mse', 'min_samples_split': 9, 'min_samples_leaf': 6, 'min_weight_fraction_leaf': 0.02280110601205928, 'min_impurity_decrease': 0.5775995504736129, 'max_features': 0.9812195725590094, 'subsample': 0.1692987188681154, 'dropout_rate': 0.07166207542671353, 'ccp_alpha': 0.0025760696122537766}. Best is trial 690 with value: 0.6691837560454439.[0m
[32m[I 2022-04-23 08:35:42,592][0m Trial 904 finished with value: 0.562411891423655 and parameters: {'loss': 'coxph', 'learning_rate': 0.0812890739357159, 'n_estimators': 651, 'criterion': 'friedman_mse', 'min_samples_split': 9, 'min_samples_leaf': 6, 'min_weight_fraction_leaf': 0.04173967909765732, 'min_impurity_decrease': 0.5873012004531584, 'max_features': 0.8747835206839684, 'subsample': 0.2495343464698316, 'dropout_rate': 0.11538375587892735, 'ccp_alpha': 0.2790598611924852}. Best is trial 690 with value: 0.6691837560454439.[0m
[32m[I 2022-04-23 08:35:46,770][0m Trial 905 finished with value: 0.6577078468826731 and parameters: {'loss': 'coxph', 'learning_rate': 0.05686292906126583, 'n_estimators': 108, 'criterion': 'friedman_mse', 'min_samples_split': 9, 'min_samples_leaf': 6, 'min_weight_fraction_leaf': 0.03443605425948903, 'min_impurity_decrease': 0.558269370203158, 'max_features': 0.516665379980379, 'subsample': 0.2369175164878834, 'dropout_rate': 0.10019143017357024, 'ccp_alpha': 0.10668545199333399}. Best is trial 690 with value: 0.6691837560454439.[0m
[32m[I 2022-04-23 08:38:13,088][0m Trial 906 finished with value: 0.5 and parameters: {'loss': 'coxph', 'learning_rate': 0.09912991938767567, 'n_estimators': 726, 'criterion': 'squared_error', 'min_samples_split': 9, 'min_samples_leaf': 7, 'min_weight_fraction_leaf': 0.009925373870373367, 'min_impurity_decrease': 0.5948856480465222, 'max_features': 0.9567881149828391, 'subsample': 0.2593028135105938, 'dropout_rate': 0.03481141899188689, 'ccp_alpha': 0.1765603135247538}. Best is trial 690 with value: 0.6691837560454439.[0m
[32m[I 2022-04-23 08:39:56,116][0m Trial 907 finished with value: 0.6008593418877173 and parameters: {'loss': 'coxph', 'learning_rate': 0.06345379028853534, 'n_estimators': 622, 'criterion': 'friedman_mse', 'min_samples_split': 9, 'min_samples_leaf': 6, 'min_weight_fraction_leaf': 0.3377243370493606, 'min_impurity_decrease': 0.5440677658859461, 'max_features': 0.5637421562397033, 'subsample': 0.2246406559182611, 'dropout_rate': 0.10079291145232844, 'ccp_alpha': 0.003679143306785234}. Best is trial 690 with value: 0.6691837560454439.[0m
[32m[I 2022-04-23 08:41:39,478][0m Trial 908 finished with value: 0.6531526905821673 and parameters: {'loss': 'coxph', 'learning_rate': 0.004364779767077807, 'n_estimators': 606, 'criterion': 'friedman_mse', 'min_samples_split': 9, 'min_samples_leaf': 7, 'min_weight_fraction_leaf': 0.01686393300737117, 'min_impurity_decrease': 0.5415089936633194, 'max_features': 0.5391305970421677, 'subsample': 0.2595165325655202, 'dropout_rate': 0.046154943618690714, 'ccp_alpha': 0.08930358291650284}. Best is trial 690 with value: 0.6691837560454439.[0m
[32m[I 2022-04-23 08:43:37,283][0m Trial 909 finished with value: 0.5 and parameters: {'loss': 'coxph', 'learning_rate': 0.0429522445522882, 'n_estimators': 679, 'criterion': 'friedman_mse', 'min_samples_split': 9, 'min_samples_leaf': 6, 'min_weight_fraction_leaf': 0.21345035198363155, 'min_impurity_decrease': 0.5184791758075703, 'max_features': 0.9762092727390879, 'subsample': 0.20575487125154887, 'dropout_rate': 0.12180014275782007, 'ccp_alpha': 0.6177905751217297}. Best is trial 690 with value: 0.6691837560454439.[0m
[32m[I 2022-04-23 08:45:07,218][0m Trial 910 finished with value: 0.5623511703378433 and parameters: {'loss': 'coxph', 'learning_rate': 0.0765548013218038, 'n_estimators': 585, 'criterion': 'friedman_mse', 'min_samples_split': 9, 'min_samples_leaf': 6, 'min_weight_fraction_leaf': 0.04502568572158921, 'min_impurity_decrease': 0.5676632510350312, 'max_features': 0.8912033228246816, 'subsample': 0.2387524096711524, 'dropout_rate': 0.09752384263366003, 'ccp_alpha': 0.3105997539679383}. Best is trial 690 with value: 0.6691837560454439.[0m
[32m[I 2022-04-23 08:46:55,377][0m Trial 911 finished with value: 0.6548454203340467 and parameters: {'loss': 'coxph', 'learning_rate': 0.05600304695409949, 'n_estimators': 648, 'criterion': 'friedman_mse', 'min_samples_split': 9, 'min_samples_leaf': 6, 'min_weight_fraction_leaf': 0.001495992664379036, 'min_impurity_decrease': 0.5497374196633121, 'max_features': 0.4497537055539162, 'subsample': 0.2605885126918803, 'dropout_rate': 0.13380460107802866, 'ccp_alpha': 0.09496426916302758}. Best is trial 690 with value: 0.6691837560454439.[0m
[32m[I 2022-04-23 08:48:59,829][0m Trial 912 finished with value: 0.6447626943484381 and parameters: {'loss': 'coxph', 'learning_rate': 0.0822711252942343, 'n_estimators': 707, 'criterion': 'friedman_mse', 'min_samples_split': 8, 'min_samples_leaf': 6, 'min_weight_fraction_leaf': 0.019554537718376442, 'min_impurity_decrease': 0.5220080310460008, 'max_features': 0.38876340006157517, 'subsample': 0.21990072686158735, 'dropout_rate': 0.1428656134905239, 'ccp_alpha': 0.18144081803985973}. Best is trial 690 with value: 0.6691837560454439.[0m
[32m[I 2022-04-23 08:50:38,531][0m Trial 913 finished with value: 0.6624325294700972 and parameters: {'loss': 'coxph', 'learning_rate': 0.04860135230652155, 'n_estimators': 601, 'criterion': 'friedman_mse', 'min_samples_split': 9, 'min_samples_leaf': 6, 'min_weight_fraction_leaf': 0.036709393259383216, 'min_impurity_decrease': 0.5006263100238387, 'max_features': 0.9180115863702073, 'subsample': 0.27386072609041173, 'dropout_rate': 0.13576843638944974, 'ccp_alpha': 0.004234201193423208}. Best is trial 690 with value: 0.6691837560454439.[0m
[32m[I 2022-04-23 08:52:03,398][0m Trial 914 finished with value: 0.6588930849047425 and parameters: {'loss': 'coxph', 'learning_rate': 0.06580615257518264, 'n_estimators': 574, 'criterion': 'friedman_mse', 'min_samples_split': 9, 'min_samples_leaf': 6, 'min_weight_fraction_leaf': 0.021425123354098515, 'min_impurity_decrease': 0.5512273667864266, 'max_features': 0.5580380545704334, 'subsample': 0.24081335135844095, 'dropout_rate': 0.15164644370817895, 'ccp_alpha': 0.08977384254297327}. Best is trial 690 with value: 0.6691837560454439.[0m
[32m[I 2022-04-23 08:53:56,579][0m Trial 915 finished with value: 0.614933485214025 and parameters: {'loss': 'coxph', 'learning_rate': 0.08109614277443018, 'n_estimators': 662, 'criterion': 'friedman_mse', 'min_samples_split': 9, 'min_samples_leaf': 6, 'min_weight_fraction_leaf': 0.02839545458685342, 'min_impurity_decrease': 0.598332583250339, 'max_features': 0.9434194289900123, 'subsample': 0.2529737456251587, 'dropout_rate': 0.1113330817736632, 'ccp_alpha': 0.21773540437895567}. Best is trial 690 with value: 0.6691837560454439.[0m
[32m[I 2022-04-23 08:55:46,433][0m Trial 916 finished with value: 0.6583158757820164 and parameters: {'loss': 'coxph', 'learning_rate': 0.03811269944805423, 'n_estimators': 631, 'criterion': 'friedman_mse', 'min_samples_split': 9, 'min_samples_leaf': 6, 'min_weight_fraction_leaf': 0.045812206540985764, 'min_impurity_decrease': 0.5364638495244474, 'max_features': 0.9172779106150525, 'subsample': 0.19392078363977566, 'dropout_rate': 0.06852114593694691, 'ccp_alpha': 0.09771574291475804}. Best is trial 690 with value: 0.6691837560454439.[0m
[32m[I 2022-04-23 08:57:22,489][0m Trial 917 finished with value: 0.6150276173468058 and parameters: {'loss': 'coxph', 'learning_rate': 0.05836063215696519, 'n_estimators': 622, 'criterion': 'friedman_mse', 'min_samples_split': 9, 'min_samples_leaf': 7, 'min_weight_fraction_leaf': 0.050203850423950286, 'min_impurity_decrease': 0.5113386925345302, 'max_features': 0.9333694797530846, 'subsample': 0.2759129582372332, 'dropout_rate': 0.15384236405970028, 'ccp_alpha': 0.17646179223869352}. Best is trial 690 with value: 0.6691837560454439.[0m
[32m[I 2022-04-23 08:58:52,021][0m Trial 918 finished with value: 0.6604188397044054 and parameters: {'loss': 'coxph', 'learning_rate': 0.0981899004746005, 'n_estimators': 572, 'criterion': 'friedman_mse', 'min_samples_split': 9, 'min_samples_leaf': 6, 'min_weight_fraction_leaf': 0.009230842387574243, 'min_impurity_decrease': 0.4953286423557444, 'max_features': 0.5767433300019881, 'subsample': 0.21827382899239808, 'dropout_rate': 0.1271149361185388, 'ccp_alpha': 0.005524546538866833}. Best is trial 690 with value: 0.6691837560454439.[0m
[32m[I 2022-04-23 09:00:46,677][0m Trial 919 finished with value: 0.5 and parameters: {'loss': 'coxph', 'learning_rate': 0.09917073911810849, 'n_estimators': 680, 'criterion': 'absolute_error', 'min_samples_split': 8, 'min_samples_leaf': 6, 'min_weight_fraction_leaf': 0.030044092797074862, 'min_impurity_decrease': 0.5780684947621643, 'max_features': 0.9155333318943544, 'subsample': 0.2433912676413872, 'dropout_rate': 0.16702884946630633, 'ccp_alpha': 0.31002739855198874}. Best is trial 690 with value: 0.6691837560454439.[0m
[32m[I 2022-04-23 09:02:10,926][0m Trial 920 finished with value: 0.6600783834392573 and parameters: {'loss': 'coxph', 'learning_rate': 0.06830770439933447, 'n_estimators': 561, 'criterion': 'friedman_mse', 'min_samples_split': 9, 'min_samples_leaf': 6, 'min_weight_fraction_leaf': 0.039201952673661715, 'min_impurity_decrease': 0.5226454288167836, 'max_features': 0.5297209343148785, 'subsample': 0.2699306373399252, 'dropout_rate': 0.15578888525041848, 'ccp_alpha': 0.002859265469319067}. Best is trial 690 with value: 0.6691837560454439.[0m
[32m[I 2022-04-23 09:03:50,492][0m Trial 921 finished with value: 0.5 and parameters: {'loss': 'coxph', 'learning_rate': 0.048914302426865355, 'n_estimators': 613, 'criterion': 'friedman_mse', 'min_samples_split': 9, 'min_samples_leaf': 6, 'min_weight_fraction_leaf': 0.018811051206007866, 'min_impurity_decrease': 0.4872089903610628, 'max_features': 0.9488401656702831, 'subsample': 0.2915766550038037, 'dropout_rate': 0.09191528168310574, 'ccp_alpha': 0.47977293915496816}. Best is trial 690 with value: 0.6691837560454439.[0m
/media/san2_ssd/data/Workdir/survival/venv/lib/python3.8/site-packages/sksurv/ensemble/boosting.py:955: RuntimeWarning: divide by zero encountered in log
  time = numpy.log(time)
/media/san2_ssd/data/Workdir/survival/venv/lib/python3.8/site-packages/sksurv/ensemble/boosting.py:955: RuntimeWarning: divide by zero encountered in log
  time = numpy.log(time)
/media/san2_ssd/data/Workdir/survival/venv/lib/python3.8/site-packages/sksurv/ensemble/boosting.py:955: RuntimeWarning: divide by zero encountered in log
  time = numpy.log(time)
/media/san2_ssd/data/Workdir/survival/venv/lib/python3.8/site-packages/sksurv/ensemble/boosting.py:955: RuntimeWarning: divide by zero encountered in log
  time = numpy.log(time)
[32m[I 2022-04-23 09:04:13,032][0m Trial 922 finished with value: -0.7327819930123007 and parameters: {'loss': 'squared', 'learning_rate': 0.09974600958835557, 'n_estimators': 653, 'criterion': 'friedman_mse', 'min_samples_split': 9, 'min_samples_leaf': 6, 'min_weight_fraction_leaf': 0.052619489034646014, 'min_impurity_decrease': 0.5326024446256167, 'max_features': 0.4888794748626977, 'subsample': 0.1775778278943273, 'dropout_rate': 0.13016347830511307, 'ccp_alpha': 0.0957315597817309}. Best is trial 690 with value: 0.6691837560454439.[0m
[32m[I 2022-04-23 09:05:45,348][0m Trial 923 finished with value: 0.6591655912146913 and parameters: {'loss': 'coxph', 'learning_rate': 0.06711679984586098, 'n_estimators': 594, 'criterion': 'friedman_mse', 'min_samples_split': 9, 'min_samples_leaf': 7, 'min_weight_fraction_leaf': 0.02990588204830164, 'min_impurity_decrease': 0.5577445929872196, 'max_features': 0.5603447828545982, 'subsample': 0.23346910207670007, 'dropout_rate': 0.160627200547557, 'ccp_alpha': 0.002367263168536571}. Best is trial 690 with value: 0.6691837560454439.[0m
[32m[I 2022-04-23 09:07:25,958][0m Trial 924 finished with value: 0.6053243404617591 and parameters: {'loss': 'coxph', 'learning_rate': 0.041199225190883294, 'n_estimators': 632, 'criterion': 'friedman_mse', 'min_samples_split': 9, 'min_samples_leaf': 6, 'min_weight_fraction_leaf': 0.01421430830565421, 'min_impurity_decrease': 0.6457317847744781, 'max_features': 0.5145407054030253, 'subsample': 0.25245182867399485, 'dropout_rate': 0.14045383041605636, 'ccp_alpha': 0.22803077590556686}. Best is trial 690 with value: 0.6691837560454439.[0m
[32m[I 2022-04-23 09:09:36,178][0m Trial 925 finished with value: 0.5 and parameters: {'loss': 'coxph', 'learning_rate': 0.05417007733652448, 'n_estimators': 710, 'criterion': 'friedman_mse', 'min_samples_split': 9, 'min_samples_leaf': 7, 'min_weight_fraction_leaf': 0.04036609695898229, 'min_impurity_decrease': 0.50953029999187, 'max_features': 0.5823593277590515, 'subsample': 0.26589383280724926, 'dropout_rate': 0.10406530851108603, 'ccp_alpha': 2.4771025779322455}. Best is trial 690 with value: 0.6691837560454439.[0m
[32m[I 2022-04-23 09:11:08,047][0m Trial 926 finished with value: 0.6620740063846724 and parameters: {'loss': 'coxph', 'learning_rate': 0.07940021650729298, 'n_estimators': 594, 'criterion': 'friedman_mse', 'min_samples_split': 9, 'min_samples_leaf': 6, 'min_weight_fraction_leaf': 0.026052706855285053, 'min_impurity_decrease': 0.47038560142731645, 'max_features': 0.5428781543211713, 'subsample': 0.284380336945462, 'dropout_rate': 0.16281433874842674, 'ccp_alpha': 0.0014841537671990029}. Best is trial 690 with value: 0.6691837560454439.[0m
[32m[I 2022-04-23 09:13:04,989][0m Trial 927 finished with value: 0.6488570395703148 and parameters: {'loss': 'coxph', 'learning_rate': 0.06793783728693897, 'n_estimators': 679, 'criterion': 'friedman_mse', 'min_samples_split': 8, 'min_samples_leaf': 6, 'min_weight_fraction_leaf': 0.0019548511039529162, 'min_impurity_decrease': 0.4948940512155438, 'max_features': 0.6664124320622303, 'subsample': 0.20953994148420677, 'dropout_rate': 0.12657282686648955, 'ccp_alpha': 0.15588026997247512}. Best is trial 690 with value: 0.6691837560454439.[0m
