[32m[I 2022-04-21 11:44:01,396][0m Trial 84 finished with value: 0.6091404438052792 and parameters: {'splitter': 'best', 'min_samples_split': 0.06604167408915207, 'min_samples_leaf': 0.03844892082371642, 'min_weight_fraction_leaf': 0.0011937113228503004, 'max_features': 0.4732367480322489}. Best is trial 11 with value: 0.6395144477369629.[0m
[32m[I 2022-04-21 11:44:01,450][0m Trial 85 finished with value: 0.6239949172231215 and parameters: {'splitter': 'random', 'min_samples_split': 0.014483490406584238, 'min_samples_leaf': 0.04893924712788955, 'min_weight_fraction_leaf': 0.045326131909544314, 'max_features': 0.45527528863911265}. Best is trial 11 with value: 0.6395144477369629.[0m
[32m[I 2022-04-21 11:44:01,500][0m Trial 86 finished with value: 0.6282625938209199 and parameters: {'splitter': 'random', 'min_samples_split': 0.08111441848103944, 'min_samples_leaf': 0.06861535800779607, 'min_weight_fraction_leaf': 0.025214725961261994, 'max_features': 0.42896651153497717}. Best is trial 11 with value: 0.6395144477369629.[0m
[32m[I 2022-04-21 11:44:01,547][0m Trial 87 finished with value: 0.6052491416142752 and parameters: {'splitter': 'random', 'min_samples_split': 0.08227175818853016, 'min_samples_leaf': 0.07404482135806092, 'min_weight_fraction_leaf': 0.028050831165544254, 'max_features': 0.35140709622243255}. Best is trial 11 with value: 0.6395144477369629.[0m
[32m[I 2022-04-21 11:44:01,630][0m Trial 88 finished with value: 0.6001673162538905 and parameters: {'splitter': 'random', 'min_samples_split': 0.04576330292325742, 'min_samples_leaf': 0.11236625149379606, 'min_weight_fraction_leaf': 0.10276348972950425, 'max_features': 0.3290384142720694}. Best is trial 11 with value: 0.6395144477369629.[0m
[32m[I 2022-04-21 11:44:01,712][0m Trial 89 finished with value: 0.6091049390645018 and parameters: {'splitter': 'random', 'min_samples_split': 0.08541677478295182, 'min_samples_leaf': 0.09993578684659768, 'min_weight_fraction_leaf': 0.07375016366620746, 'max_features': 0.4264742421161398}. Best is trial 11 with value: 0.6395144477369629.[0m
[32m[I 2022-04-21 11:44:01,750][0m Trial 90 finished with value: 0.5291868199758252 and parameters: {'splitter': 'random', 'min_samples_split': 0.06640125302531985, 'min_samples_leaf': 0.1688733549272937, 'min_weight_fraction_leaf': 0.03944966304656651, 'max_features': 0.39217310969120717}. Best is trial 11 with value: 0.6395144477369629.[0m
[32m[I 2022-04-21 11:44:01,877][0m Trial 91 finished with value: 0.6408363317233412 and parameters: {'splitter': 'random', 'min_samples_split': 0.03173509866577226, 'min_samples_leaf': 0.02612363932810623, 'min_weight_fraction_leaf': 0.013977576155390452, 'max_features': 0.6020475001428189}. Best is trial 91 with value: 0.6408363317233412.[0m
[32m[I 2022-04-21 11:44:01,949][0m Trial 92 finished with value: 0.6221244994139485 and parameters: {'splitter': 'random', 'min_samples_split': 0.028032349035336218, 'min_samples_leaf': 0.013419576611893884, 'min_weight_fraction_leaf': 0.0549505714016629, 'max_features': 0.6076445740271923}. Best is trial 91 with value: 0.6408363317233412.[0m
[32m[I 2022-04-21 11:44:02,052][0m Trial 93 finished with value: 0.6256774542788924 and parameters: {'splitter': 'random', 'min_samples_split': 0.056052672275868014, 'min_samples_leaf': 0.02747758705558333, 'min_weight_fraction_leaf': 0.025093463370499558, 'max_features': 0.6410067584417138}. Best is trial 91 with value: 0.6408363317233412.[0m
[32m[I 2022-04-21 11:44:02,160][0m Trial 94 finished with value: 0.626127386261863 and parameters: {'splitter': 'random', 'min_samples_split': 0.04458381823344222, 'min_samples_leaf': 0.06868514827200797, 'min_weight_fraction_leaf': 0.009387415941102532, 'max_features': 0.6969362588572442}. Best is trial 91 with value: 0.6408363317233412.[0m
[32m[I 2022-04-21 11:44:02,227][0m Trial 95 finished with value: 0.6167687966329867 and parameters: {'splitter': 'random', 'min_samples_split': 0.027813742617559256, 'min_samples_leaf': 0.053114218155602244, 'min_weight_fraction_leaf': 0.039081305940915675, 'max_features': 0.5147134474890475}. Best is trial 91 with value: 0.6408363317233412.[0m
[32m[I 2022-04-21 11:44:02,335][0m Trial 96 finished with value: 0.5964483152430895 and parameters: {'splitter': 'random', 'min_samples_split': 0.33216681047359903, 'min_samples_leaf': 0.08813811801035983, 'min_weight_fraction_leaf': 0.00027864862214093886, 'max_features': 0.4361847588949153}. Best is trial 91 with value: 0.6408363317233412.[0m
[32m[I 2022-04-21 11:44:02,442][0m Trial 97 finished with value: 0.6416209271025564 and parameters: {'splitter': 'random', 'min_samples_split': 0.11733962241500642, 'min_samples_leaf': 0.02815480771707887, 'min_weight_fraction_leaf': 0.02414551033880858, 'max_features': 0.6032748364462781}. Best is trial 97 with value: 0.6416209271025564.[0m
[32m[I 2022-04-21 11:44:02,532][0m Trial 98 finished with value: 0.6135923311232065 and parameters: {'splitter': 'random', 'min_samples_split': 0.1159019184281718, 'min_samples_leaf': 0.010735021938768914, 'min_weight_fraction_leaf': 0.04918196300543212, 'max_features': 0.5982074718536918}. Best is trial 97 with value: 0.6416209271025564.[0m
[32m[I 2022-04-21 11:44:02,652][0m Trial 99 finished with value: 0.6184328427234007 and parameters: {'splitter': 'random', 'min_samples_split': 0.014308651122922815, 'min_samples_leaf': 0.03305015335320471, 'min_weight_fraction_leaf': 0.06424147780702555, 'max_features': 0.4796571761353736}. Best is trial 97 with value: 0.6416209271025564.[0m
[32m[I 2022-04-21 11:44:02,745][0m Trial 100 finished with value: 0.5327933879775991 and parameters: {'splitter': 'random', 'min_samples_split': 0.07265308266172837, 'min_samples_leaf': 0.021783865036195886, 'min_weight_fraction_leaf': 0.31315025332839036, 'max_features': 0.5765930178053532}. Best is trial 97 with value: 0.6416209271025564.[0m
[32m[I 2022-04-21 11:44:02,824][0m Trial 101 finished with value: 0.6255247028445632 and parameters: {'splitter': 'random', 'min_samples_split': 0.13687076624230926, 'min_samples_leaf': 0.06269544102570719, 'min_weight_fraction_leaf': 0.027624259637970806, 'max_features': 0.6859791615955179}. Best is trial 97 with value: 0.6416209271025564.[0m
[32m[I 2022-04-21 11:44:02,892][0m Trial 102 finished with value: 0.6076037087933749 and parameters: {'splitter': 'random', 'min_samples_split': 0.09786277470344687, 'min_samples_leaf': 0.046747431977429685, 'min_weight_fraction_leaf': 0.013605801247946006, 'max_features': 0.5524375435684437}. Best is trial 97 with value: 0.6416209271025564.[0m
[32m[I 2022-04-21 11:44:02,977][0m Trial 103 finished with value: 0.6103899844802255 and parameters: {'splitter': 'random', 'min_samples_split': 0.10791628658200969, 'min_samples_leaf': 0.08034305119514794, 'min_weight_fraction_leaf': 0.02218705127343213, 'max_features': 0.6637476909736435}. Best is trial 97 with value: 0.6416209271025564.[0m
[32m[I 2022-04-21 11:44:03,325][0m Trial 104 finished with value: 0.6158797740798574 and parameters: {'splitter': 'random', 'min_samples_split': 0.03915000269806063, 'min_samples_leaf': 0.0022617025707054837, 'min_weight_fraction_leaf': 0.010500593238550519, 'max_features': 0.7317648966866802}. Best is trial 97 with value: 0.6416209271025564.[0m
[32m[I 2022-04-21 11:44:03,395][0m Trial 105 finished with value: 0.608182081690628 and parameters: {'splitter': 'random', 'min_samples_split': 0.15168842220805917, 'min_samples_leaf': 0.12449282118229446, 'min_weight_fraction_leaf': 0.03511762656562861, 'max_features': 0.6211594480074386}. Best is trial 97 with value: 0.6416209271025564.[0m
[32m[I 2022-04-21 11:44:03,470][0m Trial 106 finished with value: 0.6154885823607863 and parameters: {'splitter': 'random', 'min_samples_split': 0.1243661465885289, 'min_samples_leaf': 0.02859827230777228, 'min_weight_fraction_leaf': 0.07970506505279931, 'max_features': 0.6531131896693344}. Best is trial 97 with value: 0.6416209271025564.[0m
[32m[I 2022-04-21 11:44:03,524][0m Trial 107 finished with value: 0.5982306915884252 and parameters: {'splitter': 'random', 'min_samples_split': 0.48920179830684385, 'min_samples_leaf': 0.09372790121350699, 'min_weight_fraction_leaf': 0.050578032525731224, 'max_features': 0.5611469497075758}. Best is trial 97 with value: 0.6416209271025564.[0m
[32m[I 2022-04-21 11:44:03,570][0m Trial 108 finished with value: 0.5226417722234425 and parameters: {'splitter': 'random', 'min_samples_split': 0.06479850313892713, 'min_samples_leaf': 0.053925680910300824, 'min_weight_fraction_leaf': 0.35421286783228756, 'max_features': 0.6404168588406225}. Best is trial 97 with value: 0.6416209271025564.[0m
[32m[I 2022-04-21 11:44:03,651][0m Trial 109 finished with value: 0.6144923893732306 and parameters: {'splitter': 'random', 'min_samples_split': 0.05649708762041371, 'min_samples_leaf': 0.014094104739014221, 'min_weight_fraction_leaf': 0.09362567971040359, 'max_features': 0.5308479054340376}. Best is trial 97 with value: 0.6416209271025564.[0m
[32m[I 2022-04-21 11:44:03,775][0m Trial 110 finished with value: 0.6070495735818234 and parameters: {'splitter': 'random', 'min_samples_split': 0.2207635231460755, 'min_samples_leaf': 0.06464249648512574, 'min_weight_fraction_leaf': 0.03394186352046999, 'max_features': 0.45639759673811364}. Best is trial 97 with value: 0.6416209271025564.[0m
[32m[I 2022-04-21 11:44:04,016][0m Trial 111 finished with value: 0.6211071986339087 and parameters: {'splitter': 'best', 'min_samples_split': 0.009283350848504734, 'min_samples_leaf': 0.04178981441144221, 'min_weight_fraction_leaf': 0.01916823109075226, 'max_features': 0.49405884982646264}. Best is trial 97 with value: 0.6416209271025564.[0m
[32m[I 2022-04-21 11:44:04,150][0m Trial 112 finished with value: 0.6068254813503124 and parameters: {'splitter': 'best', 'min_samples_split': 0.0014590156449369412, 'min_samples_leaf': 0.03502110488126517, 'min_weight_fraction_leaf': 0.009939547467185861, 'max_features': 0.13417878344897183}. Best is trial 97 with value: 0.6416209271025564.[0m
[32m[I 2022-04-21 11:44:04,570][0m Trial 113 finished with value: 0.620083068462103 and parameters: {'splitter': 'best', 'min_samples_split': 0.019058272854554154, 'min_samples_leaf': 0.022586030989589993, 'min_weight_fraction_leaf': 0.03962678980284112, 'max_features': 0.7659238487244252}. Best is trial 97 with value: 0.6416209271025564.[0m
[32m[I 2022-04-21 11:44:04,780][0m Trial 114 finished with value: 0.6235968862312768 and parameters: {'splitter': 'best', 'min_samples_split': 0.030266603764318254, 'min_samples_leaf': 0.06913678946622741, 'min_weight_fraction_leaf': 0.02006048652798962, 'max_features': 0.6020529740123073}. Best is trial 97 with value: 0.6416209271025564.[0m
[32m[I 2022-04-21 11:44:04,860][0m Trial 115 finished with value: 0.6020235972979607 and parameters: {'splitter': 'random', 'min_samples_split': 0.04104676700282971, 'min_samples_leaf': 0.10568864965222002, 'min_weight_fraction_leaf': 0.0625194998225283, 'max_features': 0.9975959252945512}. Best is trial 97 with value: 0.6416209271025564.[0m
[32m[I 2022-04-21 11:44:05,180][0m Trial 116 finished with value: 0.6149454927171863 and parameters: {'splitter': 'best', 'min_samples_split': 0.08467259788793427, 'min_samples_leaf': 0.04756240306419935, 'min_weight_fraction_leaf': 0.009965519429891448, 'max_features': 0.7047645788458323}. Best is trial 97 with value: 0.6416209271025564.[0m
[32m[I 2022-04-21 11:44:05,272][0m Trial 117 finished with value: 0.6123418894376201 and parameters: {'splitter': 'random', 'min_samples_split': 0.049777739420573425, 'min_samples_leaf': 0.08325149480120234, 'min_weight_fraction_leaf': 0.02932662287403135, 'max_features': 0.629901561037462}. Best is trial 97 with value: 0.6416209271025564.[0m
[32m[I 2022-04-21 11:44:05,396][0m Trial 118 finished with value: 0.6402093332695966 and parameters: {'splitter': 'random', 'min_samples_split': 0.012822545769686585, 'min_samples_leaf': 0.06059552014103854, 'min_weight_fraction_leaf': 0.04872708636226254, 'max_features': 0.7958476031267548}. Best is trial 97 with value: 0.6416209271025564.[0m
[32m[I 2022-04-21 11:44:05,499][0m Trial 119 finished with value: 0.5989860324900411 and parameters: {'splitter': 'random', 'min_samples_split': 0.025086584405261177, 'min_samples_leaf': 0.0760366843519428, 'min_weight_fraction_leaf': 0.04850834940935973, 'max_features': 0.3722404892744137}. Best is trial 97 with value: 0.6416209271025564.[0m
[32m[I 2022-04-21 11:44:05,593][0m Trial 120 finished with value: 0.6252857549319082 and parameters: {'splitter': 'random', 'min_samples_split': 0.09351575181674118, 'min_samples_leaf': 0.13149594844860768, 'min_weight_fraction_leaf': 0.057555970940348325, 'max_features': 0.5839123231739818}. Best is trial 97 with value: 0.6416209271025564.[0m
[32m[I 2022-04-21 11:44:05,702][0m Trial 121 finished with value: 0.6281692749386212 and parameters: {'splitter': 'random', 'min_samples_split': 0.01069118325393173, 'min_samples_leaf': 0.05705223397128624, 'min_weight_fraction_leaf': 0.04239137266668323, 'max_features': 0.8503502338116606}. Best is trial 97 with value: 0.6416209271025564.[0m
[32m[I 2022-04-21 11:44:05,838][0m Trial 122 finished with value: 0.6288991808317272 and parameters: {'splitter': 'random', 'min_samples_split': 0.011430217498764932, 'min_samples_leaf': 0.05842541271772132, 'min_weight_fraction_leaf': 0.07123159281807818, 'max_features': 0.8790446263432539}. Best is trial 97 with value: 0.6416209271025564.[0m
[32m[I 2022-04-21 11:44:05,963][0m Trial 123 finished with value: 0.6256399719168735 and parameters: {'splitter': 'random', 'min_samples_split': 0.014679941646481814, 'min_samples_leaf': 0.05567283132727932, 'min_weight_fraction_leaf': 0.06738806459600527, 'max_features': 0.8080109409541798}. Best is trial 97 with value: 0.6416209271025564.[0m
[32m[I 2022-04-21 11:44:06,082][0m Trial 124 finished with value: 0.6176616811167719 and parameters: {'splitter': 'random', 'min_samples_split': 0.01069773039873028, 'min_samples_leaf': 0.062238346686339166, 'min_weight_fraction_leaf': 0.08398289177077228, 'max_features': 0.8341658518832047}. Best is trial 97 with value: 0.6416209271025564.[0m
[32m[I 2022-04-21 11:44:06,193][0m Trial 125 finished with value: 0.6225780849915659 and parameters: {'splitter': 'random', 'min_samples_split': 0.2561983871999497, 'min_samples_leaf': 0.029501702339734964, 'min_weight_fraction_leaf': 0.04381803586725989, 'max_features': 0.8568712425457181}. Best is trial 97 with value: 0.6416209271025564.[0m
[32m[I 2022-04-21 11:44:06,300][0m Trial 126 finished with value: 0.6215084671975568 and parameters: {'splitter': 'random', 'min_samples_split': 0.025939780843239155, 'min_samples_leaf': 0.041595276741169605, 'min_weight_fraction_leaf': 0.05420850076509137, 'max_features': 0.89741597547957}. Best is trial 97 with value: 0.6416209271025564.[0m
[32m[I 2022-04-21 11:44:06,421][0m Trial 127 finished with value: 0.6163685764498166 and parameters: {'splitter': 'random', 'min_samples_split': 0.03986344900337921, 'min_samples_leaf': 0.010487470747477301, 'min_weight_fraction_leaf': 0.0722868436807459, 'max_features': 0.9224904304733447}. Best is trial 97 with value: 0.6416209271025564.[0m
[32m[I 2022-04-21 11:44:06,507][0m Trial 128 finished with value: 0.5978971837001026 and parameters: {'splitter': 'random', 'min_samples_split': 0.02972256483343262, 'min_samples_leaf': 0.054836975156010694, 'min_weight_fraction_leaf': 0.2011441250192752, 'max_features': 0.8569515744078718}. Best is trial 97 with value: 0.6416209271025564.[0m
[32m[I 2022-04-21 11:44:06,581][0m Trial 129 finished with value: 0.6102029426864649 and parameters: {'splitter': 'random', 'min_samples_split': 0.001670530908446691, 'min_samples_leaf': 0.07756895819032014, 'min_weight_fraction_leaf': 0.03513653858606491, 'max_features': 0.41366798616141337}. Best is trial 97 with value: 0.6416209271025564.[0m
[32m[I 2022-04-21 11:44:06,672][0m Trial 130 finished with value: 0.6208938749388632 and parameters: {'splitter': 'random', 'min_samples_split': 0.019138996993976514, 'min_samples_leaf': 0.1476776620162298, 'min_weight_fraction_leaf': 0.02357578825793698, 'max_features': 0.9286855428614849}. Best is trial 97 with value: 0.6416209271025564.[0m
[32m[I 2022-04-21 11:44:06,761][0m Trial 131 finished with value: 0.6171945055675205 and parameters: {'splitter': 'random', 'min_samples_split': 0.05375119135184501, 'min_samples_leaf': 0.09074886040418594, 'min_weight_fraction_leaf': 0.00020114182881125243, 'max_features': 0.8691003780686402}. Best is trial 97 with value: 0.6416209271025564.[0m
[32m[I 2022-04-21 11:44:06,863][0m Trial 132 finished with value: 0.619195121623753 and parameters: {'splitter': 'random', 'min_samples_split': 0.07594135165734368, 'min_samples_leaf': 0.0936930547170313, 'min_weight_fraction_leaf': 0.04358105384514009, 'max_features': 0.8862439244765207}. Best is trial 97 with value: 0.6416209271025564.[0m
[32m[I 2022-04-21 11:44:06,943][0m Trial 133 finished with value: 0.6115281738902988 and parameters: {'splitter': 'random', 'min_samples_split': 0.034804530855129065, 'min_samples_leaf': 0.1039006457095675, 'min_weight_fraction_leaf': 0.028689905846216484, 'max_features': 0.6150526526942187}. Best is trial 97 with value: 0.6416209271025564.[0m
[32m[I 2022-04-21 11:44:07,053][0m Trial 134 finished with value: 0.6203528816315329 and parameters: {'splitter': 'random', 'min_samples_split': 0.012489589462529824, 'min_samples_leaf': 0.019533069858463373, 'min_weight_fraction_leaf': 0.02029953870802645, 'max_features': 0.6719621493733301}. Best is trial 97 with value: 0.6416209271025564.[0m
[32m[I 2022-04-21 11:44:07,099][0m Trial 135 finished with value: 0.6058773962877262 and parameters: {'splitter': 'random', 'min_samples_split': 0.043157890549774786, 'min_samples_leaf': 0.11753230924633783, 'min_weight_fraction_leaf': 0.05708264805114033, 'max_features': 0.5482515907345799}. Best is trial 97 with value: 0.6416209271025564.[0m
[32m[I 2022-04-21 11:44:07,158][0m Trial 136 finished with value: 0.6077727125206327 and parameters: {'splitter': 'random', 'min_samples_split': 0.06359932790068702, 'min_samples_leaf': 0.07121021164667632, 'min_weight_fraction_leaf': 0.038340096033676, 'max_features': 0.4387218431395158}. Best is trial 97 with value: 0.6416209271025564.[0m
[32m[I 2022-04-21 11:44:07,228][0m Trial 137 finished with value: 0.6064253215268182 and parameters: {'splitter': 'random', 'min_samples_split': 0.0014903971613873489, 'min_samples_leaf': 0.037849975913977534, 'min_weight_fraction_leaf': 0.07464273333328879, 'max_features': 0.5054920105685327}. Best is trial 97 with value: 0.6416209271025564.[0m
[32m[I 2022-04-21 11:44:07,289][0m Trial 138 finished with value: 0.6356100838214068 and parameters: {'splitter': 'random', 'min_samples_split': 0.27592426609377096, 'min_samples_leaf': 0.046020211986686654, 'min_weight_fraction_leaf': 0.007005840255449248, 'max_features': 0.6509485848291271}. Best is trial 97 with value: 0.6416209271025564.[0m
[32m[I 2022-04-21 11:44:07,352][0m Trial 139 finished with value: 0.6075650145658898 and parameters: {'splitter': 'random', 'min_samples_split': 0.2871726862318332, 'min_samples_leaf': 0.029639951328338864, 'min_weight_fraction_leaf': 0.013369831026434919, 'max_features': 0.5693621680702527}. Best is trial 97 with value: 0.6416209271025564.[0m
[32m[I 2022-04-21 11:44:07,406][0m Trial 140 finished with value: 0.6154527716098354 and parameters: {'splitter': 'random', 'min_samples_split': 0.29433871316115123, 'min_samples_leaf': 0.0515064363737303, 'min_weight_fraction_leaf': 0.007034970636034345, 'max_features': 0.5939178223729121}. Best is trial 97 with value: 0.6416209271025564.[0m
[32m[I 2022-04-21 11:44:07,473][0m Trial 141 finished with value: 0.6197786100225641 and parameters: {'splitter': 'random', 'min_samples_split': 0.2998152255917226, 'min_samples_leaf': 0.061786107505609755, 'min_weight_fraction_leaf': 0.028764478862896674, 'max_features': 0.6882709537480838}. Best is trial 97 with value: 0.6416209271025564.[0m
[32m[I 2022-04-21 11:44:07,526][0m Trial 142 finished with value: 0.6178681583853254 and parameters: {'splitter': 'random', 'min_samples_split': 0.31387217710554527, 'min_samples_leaf': 0.04614788159103487, 'min_weight_fraction_leaf': 0.048747944850124236, 'max_features': 0.6546437506056818}. Best is trial 97 with value: 0.6416209271025564.[0m
[32m[I 2022-04-21 11:44:07,586][0m Trial 143 finished with value: 0.6173743781287298 and parameters: {'splitter': 'random', 'min_samples_split': 0.28455569569656536, 'min_samples_leaf': 0.08111160848756274, 'min_weight_fraction_leaf': 0.018427161794389323, 'max_features': 0.6289093441170569}. Best is trial 97 with value: 0.6416209271025564.[0m
[32m[I 2022-04-21 11:44:07,651][0m Trial 144 finished with value: 0.631879413175033 and parameters: {'splitter': 'random', 'min_samples_split': 0.26313637304860416, 'min_samples_leaf': 0.023019158133983704, 'min_weight_fraction_leaf': 0.0007180188743324267, 'max_features': 0.3944764154088803}. Best is trial 97 with value: 0.6416209271025564.[0m
[32m[I 2022-04-21 11:44:07,723][0m Trial 145 finished with value: 0.6214858593660015 and parameters: {'splitter': 'random', 'min_samples_split': 0.2698153199157683, 'min_samples_leaf': 0.015621547784241688, 'min_weight_fraction_leaf': 0.006503260051462113, 'max_features': 0.3908513524745368}. Best is trial 97 with value: 0.6416209271025564.[0m
[32m[I 2022-04-21 11:44:07,785][0m Trial 146 finished with value: 0.6149760713270153 and parameters: {'splitter': 'random', 'min_samples_split': 0.2758607693088695, 'min_samples_leaf': 0.026919161541877373, 'min_weight_fraction_leaf': 0.03922037249926554, 'max_features': 0.47579653302833397}. Best is trial 97 with value: 0.6416209271025564.[0m
