[32m[I 2022-04-21 19:44:39,705][0m Trial 699 finished with value: 0.8445741847244557 and parameters: {'loss': 'coxph', 'learning_rate': 0.00021963131993681166, 'n_estimators': 575, 'criterion': 'friedman_mse', 'min_samples_split': 3, 'min_samples_leaf': 1, 'min_weight_fraction_leaf': 0.12288881687538006, 'min_impurity_decrease': 0.16039065592777174, 'max_features': 0.322429875441657, 'subsample': 0.08745724731462268, 'dropout_rate': 0.07895546877874302, 'ccp_alpha': 0.011292742208729056}. Best is trial 583 with value: 0.8480221917497749.[0m
[32m[I 2022-04-21 19:45:02,787][0m Trial 700 finished with value: 0.8468103294045273 and parameters: {'loss': 'coxph', 'learning_rate': 0.0002903391526869938, 'n_estimators': 332, 'criterion': 'friedman_mse', 'min_samples_split': 3, 'min_samples_leaf': 1, 'min_weight_fraction_leaf': 0.12841226479569043, 'min_impurity_decrease': 0.14115704822486194, 'max_features': 0.28878717727462244, 'subsample': 0.09453155522894392, 'dropout_rate': 0.09810828660617821, 'ccp_alpha': 0.003632835309129029}. Best is trial 583 with value: 0.8480221917497749.[0m
[32m[I 2022-04-21 19:45:27,878][0m Trial 701 finished with value: 0.8427662687201904 and parameters: {'loss': 'coxph', 'learning_rate': 0.0002931734347025405, 'n_estimators': 345, 'criterion': 'squared_error', 'min_samples_split': 3, 'min_samples_leaf': 1, 'min_weight_fraction_leaf': 0.1073940535827173, 'min_impurity_decrease': 0.10543829397942926, 'max_features': 0.29140172921321306, 'subsample': 0.1134969071413446, 'dropout_rate': 0.089662248114707, 'ccp_alpha': 0.0017850309903279528}. Best is trial 583 with value: 0.8480221917497749.[0m
[32m[I 2022-04-21 19:46:03,726][0m Trial 702 finished with value: 0.8443389129651919 and parameters: {'loss': 'coxph', 'learning_rate': 0.00028087219620044385, 'n_estimators': 377, 'criterion': 'friedman_mse', 'min_samples_split': 3, 'min_samples_leaf': 1, 'min_weight_fraction_leaf': 0.0957018838522835, 'min_impurity_decrease': 0.12244687142099593, 'max_features': 0.27483391900994103, 'subsample': 0.09794311432479569, 'dropout_rate': 0.07469683725365997, 'ccp_alpha': 0.002970341214340453}. Best is trial 583 with value: 0.8480221917497749.[0m
[32m[I 2022-04-21 19:46:33,184][0m Trial 703 finished with value: 0.8462875244387593 and parameters: {'loss': 'coxph', 'learning_rate': 0.00024482540327094496, 'n_estimators': 333, 'criterion': 'friedman_mse', 'min_samples_split': 3, 'min_samples_leaf': 1, 'min_weight_fraction_leaf': 0.13132092742753593, 'min_impurity_decrease': 0.1343670236771793, 'max_features': 0.2793865954834901, 'subsample': 0.12388682989336522, 'dropout_rate': 0.05616334032967566, 'ccp_alpha': 0.0020430386422890037}. Best is trial 583 with value: 0.8480221917497749.[0m
[32m[I 2022-04-21 19:47:11,299][0m Trial 704 finished with value: 0.8425018413833616 and parameters: {'loss': 'coxph', 'learning_rate': 0.00023894072989980272, 'n_estimators': 354, 'criterion': 'friedman_mse', 'min_samples_split': 3, 'min_samples_leaf': 1, 'min_weight_fraction_leaf': 0.11621455339255629, 'min_impurity_decrease': 0.14246508151218867, 'max_features': 0.24307845179971588, 'subsample': 0.12248678945555855, 'dropout_rate': 0.02322032244527427, 'ccp_alpha': 0.08666434319390191}. Best is trial 583 with value: 0.8480221917497749.[0m
[32m[I 2022-04-21 19:47:46,664][0m Trial 705 finished with value: 0.8385451609473142 and parameters: {'loss': 'coxph', 'learning_rate': 0.0003188055339189457, 'n_estimators': 342, 'criterion': 'absolute_error', 'min_samples_split': 3, 'min_samples_leaf': 1, 'min_weight_fraction_leaf': 0.12502969717500464, 'min_impurity_decrease': 0.08563479049671174, 'max_features': 0.2710499916583912, 'subsample': 0.13220168960962275, 'dropout_rate': 0.04593984985811256, 'ccp_alpha': 0.11674417991906805}. Best is trial 583 with value: 0.8480221917497749.[0m
[32m[I 2022-04-21 19:48:20,514][0m Trial 706 finished with value: 0.8449351054553397 and parameters: {'loss': 'coxph', 'learning_rate': 0.00023300687303274385, 'n_estimators': 370, 'criterion': 'friedman_mse', 'min_samples_split': 3, 'min_samples_leaf': 1, 'min_weight_fraction_leaf': 0.11703749467505183, 'min_impurity_decrease': 0.1265835630993356, 'max_features': 0.2910484200580137, 'subsample': 0.1156394521271148, 'dropout_rate': 0.05686278099860202, 'ccp_alpha': 0.11537916073467683}. Best is trial 583 with value: 0.8480221917497749.[0m
[32m[I 2022-04-21 19:48:46,138][0m Trial 707 finished with value: 0.65 and parameters: {'loss': 'coxph', 'learning_rate': 0.000333826449886997, 'n_estimators': 334, 'criterion': 'friedman_mse', 'min_samples_split': 3, 'min_samples_leaf': 1, 'min_weight_fraction_leaf': 0.12109620864850384, 'min_impurity_decrease': 0.14263089567390363, 'max_features': 0.25726136331296734, 'subsample': 0.1219567482582064, 'dropout_rate': 0.07917029050750385, 'ccp_alpha': 2.2743377514868133}. Best is trial 583 with value: 0.8480221917497749.[0m
[32m[I 2022-04-21 19:49:23,401][0m Trial 708 finished with value: 0.8440328390451782 and parameters: {'loss': 'coxph', 'learning_rate': 0.00023902229416654236, 'n_estimators': 389, 'criterion': 'friedman_mse', 'min_samples_split': 3, 'min_samples_leaf': 1, 'min_weight_fraction_leaf': 0.10743369331986141, 'min_impurity_decrease': 0.10479773568057563, 'max_features': 0.2832051824940988, 'subsample': 0.0960607130687914, 'dropout_rate': 0.040288637983048034, 'ccp_alpha': 0.004447306510000473}. Best is trial 583 with value: 0.8480221917497749.[0m
[32m[I 2022-04-21 19:49:53,537][0m Trial 709 finished with value: 0.846497785678695 and parameters: {'loss': 'coxph', 'learning_rate': 0.00019021920024141998, 'n_estimators': 349, 'criterion': 'friedman_mse', 'min_samples_split': 3, 'min_samples_leaf': 1, 'min_weight_fraction_leaf': 0.12969620024249465, 'min_impurity_decrease': 0.15879661527736394, 'max_features': 0.3044284348156143, 'subsample': 0.11057397885878284, 'dropout_rate': 0.0021444998471853854, 'ccp_alpha': 0.09008898498413506}. Best is trial 583 with value: 0.8480221917497749.[0m
[32m[I 2022-04-21 19:50:35,656][0m Trial 710 finished with value: 0.8435694379440715 and parameters: {'loss': 'coxph', 'learning_rate': 0.00020590827911734836, 'n_estimators': 359, 'criterion': 'friedman_mse', 'min_samples_split': 3, 'min_samples_leaf': 1, 'min_weight_fraction_leaf': 0.12966799968871637, 'min_impurity_decrease': 0.13728711923732276, 'max_features': 0.2998557715598596, 'subsample': 0.1387886571881457, 'dropout_rate': 0.0007886747714120081, 'ccp_alpha': 0.00149586237109295}. Best is trial 583 with value: 0.8480221917497749.[0m
[32m[I 2022-04-21 19:51:21,845][0m Trial 711 finished with value: 0.8445520918504215 and parameters: {'loss': 'coxph', 'learning_rate': 0.00018386950471731465, 'n_estimators': 406, 'criterion': 'friedman_mse', 'min_samples_split': 3, 'min_samples_leaf': 1, 'min_weight_fraction_leaf': 0.08975065613414365, 'min_impurity_decrease': 0.1126319697354865, 'max_features': 0.27907624003502385, 'subsample': 0.12688738424111784, 'dropout_rate': 0.007661648005334171, 'ccp_alpha': 0.14970276417967174}. Best is trial 583 with value: 0.8480221917497749.[0m
[32m[I 2022-04-21 19:51:56,795][0m Trial 712 finished with value: 0.8427157353808068 and parameters: {'loss': 'coxph', 'learning_rate': 0.000283108523401055, 'n_estimators': 379, 'criterion': 'friedman_mse', 'min_samples_split': 3, 'min_samples_leaf': 1, 'min_weight_fraction_leaf': 0.10410502222320629, 'min_impurity_decrease': 0.1311279756342184, 'max_features': 0.23054958044651788, 'subsample': 0.11094974671819305, 'dropout_rate': 0.040938792356175376, 'ccp_alpha': 0.09598492601728804}. Best is trial 583 with value: 0.8480221917497749.[0m
/media/san2_ssd/data/Workdir/survival/venv/lib/python3.8/site-packages/sksurv/ensemble/boosting.py:955: RuntimeWarning: divide by zero encountered in log
  time = numpy.log(time)
/media/san2_ssd/data/Workdir/survival/venv/lib/python3.8/site-packages/sksurv/ensemble/boosting.py:955: RuntimeWarning: divide by zero encountered in log
  time = numpy.log(time)
/media/san2_ssd/data/Workdir/survival/venv/lib/python3.8/site-packages/sksurv/ensemble/boosting.py:955: RuntimeWarning: divide by zero encountered in log
  time = numpy.log(time)
/media/san2_ssd/data/Workdir/survival/venv/lib/python3.8/site-packages/sksurv/ensemble/boosting.py:955: RuntimeWarning: divide by zero encountered in log
  time = numpy.log(time)
[32m[I 2022-04-21 19:52:03,392][0m Trial 713 finished with value: -0.46721157625838405 and parameters: {'loss': 'squared', 'learning_rate': 0.0001888871412021971, 'n_estimators': 363, 'criterion': 'friedman_mse', 'min_samples_split': 3, 'min_samples_leaf': 1, 'min_weight_fraction_leaf': 0.12646176730993486, 'min_impurity_decrease': 0.15858873519760644, 'max_features': 0.3106544808686698, 'subsample': 0.10918633400484666, 'dropout_rate': 0.031028635926445447, 'ccp_alpha': 0.1563788337556899}. Best is trial 583 with value: 0.8480221917497749.[0m
[32m[I 2022-04-21 19:52:56,758][0m Trial 714 finished with value: 0.65 and parameters: {'loss': 'coxph', 'learning_rate': 0.0002631911758200615, 'n_estimators': 397, 'criterion': 'friedman_mse', 'min_samples_split': 3, 'min_samples_leaf': 1, 'min_weight_fraction_leaf': 0.1291485254059662, 'min_impurity_decrease': 0.15611543549141554, 'max_features': 0.26423857436618003, 'subsample': 0.13861867287849755, 'dropout_rate': 0.012186963045170446, 'ccp_alpha': 3.2991684856467534}. Best is trial 583 with value: 0.8480221917497749.[0m
[32m[I 2022-04-21 19:53:36,823][0m Trial 715 finished with value: 0.8425715349975175 and parameters: {'loss': 'coxph', 'learning_rate': 0.00036026646218683994, 'n_estimators': 351, 'criterion': 'friedman_mse', 'min_samples_split': 3, 'min_samples_leaf': 1, 'min_weight_fraction_leaf': 0.11320867972717744, 'min_impurity_decrease': 0.14727445047501475, 'max_features': 0.29732944237623177, 'subsample': 0.10009404950158646, 'dropout_rate': 0.016162403219495657, 'ccp_alpha': 0.11319774507666311}. Best is trial 583 with value: 0.8480221917497749.[0m
[32m[I 2022-04-21 19:54:17,269][0m Trial 716 finished with value: 0.7224198366690289 and parameters: {'loss': 'coxph', 'learning_rate': 0.00019381914288596754, 'n_estimators': 380, 'criterion': 'friedman_mse', 'min_samples_split': 3, 'min_samples_leaf': 1, 'min_weight_fraction_leaf': 0.12982962180353413, 'min_impurity_decrease': 0.16104490254095832, 'max_features': 0.2568375398499191, 'subsample': 0.6605126920938293, 'dropout_rate': 0.038356944855151065, 'ccp_alpha': 0.1850876754485345}. Best is trial 583 with value: 0.8480221917497749.[0m
[32m[I 2022-04-21 19:54:55,708][0m Trial 717 finished with value: 0.8414979243271631 and parameters: {'loss': 'coxph', 'learning_rate': 0.0002401931982123578, 'n_estimators': 367, 'criterion': 'friedman_mse', 'min_samples_split': 3, 'min_samples_leaf': 1, 'min_weight_fraction_leaf': 0.11571745533112371, 'min_impurity_decrease': 0.12049280325748185, 'max_features': 0.3087408001155453, 'subsample': 0.1545496565506839, 'dropout_rate': 0.02083689246227327, 'ccp_alpha': 0.003009032375732787}. Best is trial 583 with value: 0.8480221917497749.[0m
[32m[I 2022-04-21 19:55:22,379][0m Trial 718 finished with value: 0.8393252989251507 and parameters: {'loss': 'coxph', 'learning_rate': 0.0003222351548685706, 'n_estimators': 342, 'criterion': 'friedman_mse', 'min_samples_split': 3, 'min_samples_leaf': 1, 'min_weight_fraction_leaf': 0.1001472473533776, 'min_impurity_decrease': 0.1723170306938118, 'max_features': 0.2812585026051133, 'subsample': 0.12133854261057761, 'dropout_rate': 0.10203867101410016, 'ccp_alpha': 0.0877946624750922}. Best is trial 583 with value: 0.8480221917497749.[0m
[32m[I 2022-04-21 19:55:56,880][0m Trial 719 finished with value: 0.8438644133795792 and parameters: {'loss': 'coxph', 'learning_rate': 0.0002218351388193447, 'n_estimators': 352, 'criterion': 'friedman_mse', 'min_samples_split': 3, 'min_samples_leaf': 1, 'min_weight_fraction_leaf': 0.13668807184144516, 'min_impurity_decrease': 0.13854989113781588, 'max_features': 0.24304308831146548, 'subsample': 0.09111142523363008, 'dropout_rate': 0.11239904161905144, 'ccp_alpha': 0.22176262939746688}. Best is trial 583 with value: 0.8480221917497749.[0m
[32m[I 2022-04-21 19:56:10,054][0m Trial 720 finished with value: 0.8450423133754821 and parameters: {'loss': 'coxph', 'learning_rate': 0.00017928602876289334, 'n_estimators': 330, 'criterion': 'friedman_mse', 'min_samples_split': 3, 'min_samples_leaf': 1, 'min_weight_fraction_leaf': 0.1266395807614713, 'min_impurity_decrease': 0.09803472520588585, 'max_features': 0.29811769913910846, 'subsample': 0.1044753109818842, 'dropout_rate': 0.7095317755783652, 'ccp_alpha': 0.07854034303218638}. Best is trial 583 with value: 0.8480221917497749.[0m
[32m[I 2022-04-21 19:56:41,273][0m Trial 721 finished with value: 0.8455934226657427 and parameters: {'loss': 'coxph', 'learning_rate': 0.0003807635784415672, 'n_estimators': 363, 'criterion': 'friedman_mse', 'min_samples_split': 3, 'min_samples_leaf': 1, 'min_weight_fraction_leaf': 0.1329303000863527, 'min_impurity_decrease': 0.15442656791992015, 'max_features': 0.27258444490331835, 'subsample': 0.0862752973384027, 'dropout_rate': 0.12162217598213515, 'ccp_alpha': 0.17745857776066343}. Best is trial 583 with value: 0.8480221917497749.[0m
[32m[I 2022-04-21 19:57:16,297][0m Trial 722 finished with value: 0.65 and parameters: {'loss': 'coxph', 'learning_rate': 0.00041002485539118994, 'n_estimators': 392, 'criterion': 'friedman_mse', 'min_samples_split': 3, 'min_samples_leaf': 1, 'min_weight_fraction_leaf': 0.12241576021801236, 'min_impurity_decrease': 0.07178960372481141, 'max_features': 0.3108110630547299, 'subsample': 0.1298264582005714, 'dropout_rate': 0.008643347956525084, 'ccp_alpha': 1.6360170474788376}. Best is trial 583 with value: 0.8480221917497749.[0m
[32m[I 2022-04-21 19:57:42,238][0m Trial 723 finished with value: 0.8452885459363824 and parameters: {'loss': 'coxph', 'learning_rate': 0.000291045398888583, 'n_estimators': 333, 'criterion': 'squared_error', 'min_samples_split': 3, 'min_samples_leaf': 1, 'min_weight_fraction_leaf': 0.1309339385314395, 'min_impurity_decrease': 0.18079376645725975, 'max_features': 0.28827138643788386, 'subsample': 0.1071907054818068, 'dropout_rate': 0.10412163230496321, 'ccp_alpha': 0.27352780312828895}. Best is trial 583 with value: 0.8480221917497749.[0m
[32m[I 2022-04-21 19:58:25,146][0m Trial 724 finished with value: 0.8466783287942861 and parameters: {'loss': 'coxph', 'learning_rate': 0.00018217065504760283, 'n_estimators': 342, 'criterion': 'friedman_mse', 'min_samples_split': 3, 'min_samples_leaf': 1, 'min_weight_fraction_leaf': 0.14278653719522033, 'min_impurity_decrease': 0.16522174871649004, 'max_features': 0.3126022715650443, 'subsample': 0.08793850474547452, 'dropout_rate': 0.05510830124735866, 'ccp_alpha': 0.09729051913775394}. Best is trial 583 with value: 0.8480221917497749.[0m
[32m[I 2022-04-21 19:58:59,599][0m Trial 725 finished with value: 0.8453997700372792 and parameters: {'loss': 'coxph', 'learning_rate': 0.000190494375959419, 'n_estimators': 351, 'criterion': 'friedman_mse', 'min_samples_split': 3, 'min_samples_leaf': 1, 'min_weight_fraction_leaf': 0.14089272766998054, 'min_impurity_decrease': 0.15977924952573047, 'max_features': 0.31139159117510284, 'subsample': 0.08223253551846807, 'dropout_rate': 0.00047869966367832667, 'ccp_alpha': 0.09636801054586208}. Best is trial 583 with value: 0.8480221917497749.[0m
[32m[I 2022-04-21 19:59:45,128][0m Trial 726 finished with value: 0.8425101325401603 and parameters: {'loss': 'coxph', 'learning_rate': 0.00016798424649678087, 'n_estimators': 378, 'criterion': 'friedman_mse', 'min_samples_split': 3, 'min_samples_leaf': 1, 'min_weight_fraction_leaf': 0.06720944123478322, 'min_impurity_decrease': 0.12734933390301856, 'max_features': 0.21785945252534947, 'subsample': 0.08745436558313296, 'dropout_rate': 0.027252162521810765, 'ccp_alpha': 0.18027460351012123}. Best is trial 583 with value: 0.8480221917497749.[0m
[32m[I 2022-04-21 20:00:29,322][0m Trial 727 finished with value: 0.8471582002665109 and parameters: {'loss': 'coxph', 'learning_rate': 0.00022304657935571623, 'n_estimators': 343, 'criterion': 'friedman_mse', 'min_samples_split': 3, 'min_samples_leaf': 1, 'min_weight_fraction_leaf': 0.1377270242386844, 'min_impurity_decrease': 0.16888054558949048, 'max_features': 0.31541668714616783, 'subsample': 0.07898693524108001, 'dropout_rate': 0.05129947482948957, 'ccp_alpha': 0.003924074872738671}. Best is trial 583 with value: 0.8480221917497749.[0m
[32m[I 2022-04-21 20:01:04,413][0m Trial 728 finished with value: 0.842962636318847 and parameters: {'loss': 'coxph', 'learning_rate': 0.00024299041138779634, 'n_estimators': 339, 'criterion': 'friedman_mse', 'min_samples_split': 3, 'min_samples_leaf': 1, 'min_weight_fraction_leaf': 0.11798821924352522, 'min_impurity_decrease': 0.16373690969502724, 'max_features': 0.28930933541593795, 'subsample': 0.09754266886038825, 'dropout_rate': 0.047751522653941905, 'ccp_alpha': 0.004941668536850408}. Best is trial 583 with value: 0.8480221917497749.[0m
[32m[I 2022-04-21 20:01:32,750][0m Trial 729 finished with value: 0.8466530225094451 and parameters: {'loss': 'coxph', 'learning_rate': 0.00020655533151283425, 'n_estimators': 334, 'criterion': 'friedman_mse', 'min_samples_split': 3, 'min_samples_leaf': 1, 'min_weight_fraction_leaf': 0.13514925444212425, 'min_impurity_decrease': 0.13401208097598352, 'max_features': 0.31582386675844165, 'subsample': 0.08051954707173696, 'dropout_rate': 0.054776947478528015, 'ccp_alpha': 0.09907739630476055}. Best is trial 583 with value: 0.8480221917497749.[0m
[32m[I 2022-04-21 20:01:59,759][0m Trial 730 finished with value: 0.8431352418650496 and parameters: {'loss': 'coxph', 'learning_rate': 0.0001891583032186082, 'n_estimators': 330, 'criterion': 'absolute_error', 'min_samples_split': 3, 'min_samples_leaf': 1, 'min_weight_fraction_leaf': 0.13226726211753362, 'min_impurity_decrease': 0.049000431401414746, 'max_features': 0.3162693112247885, 'subsample': 0.07782955742482192, 'dropout_rate': 0.027086496842373818, 'ccp_alpha': 0.08376371556908484}. Best is trial 583 with value: 0.8480221917497749.[0m
[32m[I 2022-04-21 20:02:29,634][0m Trial 731 finished with value: 0.8454493434400048 and parameters: {'loss': 'coxph', 'learning_rate': 0.0002680510959016633, 'n_estimators': 348, 'criterion': 'friedman_mse', 'min_samples_split': 3, 'min_samples_leaf': 1, 'min_weight_fraction_leaf': 0.11767611542377245, 'min_impurity_decrease': 0.1338629981207758, 'max_features': 0.3054245619269358, 'subsample': 0.11265791465660752, 'dropout_rate': 0.05581941904177488, 'ccp_alpha': 0.09146294492521112}. Best is trial 583 with value: 0.8480221917497749.[0m
[32m[I 2022-04-21 20:03:02,937][0m Trial 732 finished with value: 0.8452825299825353 and parameters: {'loss': 'coxph', 'learning_rate': 0.00021297322150365606, 'n_estimators': 329, 'criterion': 'friedman_mse', 'min_samples_split': 3, 'min_samples_leaf': 1, 'min_weight_fraction_leaf': 0.13757375262312135, 'min_impurity_decrease': 0.09668726389856853, 'max_features': 0.32184928147799313, 'subsample': 0.09662808905291895, 'dropout_rate': 0.041945694544509304, 'ccp_alpha': 0.0864139605513124}. Best is trial 583 with value: 0.8480221917497749.[0m
[32m[I 2022-04-21 20:03:34,867][0m Trial 733 finished with value: 0.65 and parameters: {'loss': 'coxph', 'learning_rate': 0.000171742833711988, 'n_estimators': 341, 'criterion': 'friedman_mse', 'min_samples_split': 3, 'min_samples_leaf': 1, 'min_weight_fraction_leaf': 0.12965869440945868, 'min_impurity_decrease': 0.14107158658297425, 'max_features': 0.26805515593300233, 'subsample': 0.07520961195127468, 'dropout_rate': 0.053221105359862374, 'ccp_alpha': 1.8025356108649677}. Best is trial 583 with value: 0.8480221917497749.[0m
/media/san2_ssd/data/Workdir/survival/venv/lib/python3.8/site-packages/sksurv/ensemble/boosting.py:955: RuntimeWarning: divide by zero encountered in log
  time = numpy.log(time)
/media/san2_ssd/data/Workdir/survival/venv/lib/python3.8/site-packages/sksurv/ensemble/boosting.py:955: RuntimeWarning: divide by zero encountered in log
  time = numpy.log(time)
/media/san2_ssd/data/Workdir/survival/venv/lib/python3.8/site-packages/sksurv/ensemble/boosting.py:955: RuntimeWarning: divide by zero encountered in log
  time = numpy.log(time)
/media/san2_ssd/data/Workdir/survival/venv/lib/python3.8/site-packages/sksurv/ensemble/boosting.py:955: RuntimeWarning: divide by zero encountered in log
  time = numpy.log(time)
[32m[I 2022-04-21 20:03:39,419][0m Trial 734 finished with value: -0.4659047780013551 and parameters: {'loss': 'squared', 'learning_rate': 0.00025461629172079286, 'n_estimators': 327, 'criterion': 'friedman_mse', 'min_samples_split': 3, 'min_samples_leaf': 1, 'min_weight_fraction_leaf': 0.12267893850218146, 'min_impurity_decrease': 0.10167621418344219, 'max_features': 0.2905268747904521, 'subsample': 0.09430036091116616, 'dropout_rate': 0.05221806838889922, 'ccp_alpha': 0.005657122485652921}. Best is trial 583 with value: 0.8480221917497749.[0m
[32m[I 2022-04-21 20:04:14,014][0m Trial 735 finished with value: 0.8396077962142448 and parameters: {'loss': 'coxph', 'learning_rate': 0.0001546707004186134, 'n_estimators': 357, 'criterion': 'friedman_mse', 'min_samples_split': 3, 'min_samples_leaf': 1, 'min_weight_fraction_leaf': 0.10976895328842157, 'min_impurity_decrease': 0.13633563713143246, 'max_features': 0.324815265082541, 'subsample': 0.11658560777755456, 'dropout_rate': 0.025371692652801994, 'ccp_alpha': 0.2727563021415862}. Best is trial 583 with value: 0.8480221917497749.[0m
