[32m[I 2022-04-21 11:49:49,866][0m Trial 714 finished with value: 0.6409267796400903 and parameters: {'splitter': 'best', 'min_samples_split': 0.2000024544950125, 'min_samples_leaf': 0.017097257991172645, 'min_weight_fraction_leaf': 0.00970745157954115, 'max_features': 0.6220791487260533}. Best is trial 688 with value: 0.6612018755665507.[0m
[32m[I 2022-04-21 11:49:51,049][0m Trial 715 finished with value: 0.6183103174075769 and parameters: {'splitter': 'best', 'min_samples_split': 0.16086758323489828, 'min_samples_leaf': 0.009536165618069534, 'min_weight_fraction_leaf': 0.020431373507216886, 'max_features': 0.84186162204724}. Best is trial 688 with value: 0.6612018755665507.[0m
[32m[I 2022-04-21 11:49:52,415][0m Trial 716 finished with value: 0.6374949169230645 and parameters: {'splitter': 'best', 'min_samples_split': 0.2820797589334831, 'min_samples_leaf': 0.0013539294404582656, 'min_weight_fraction_leaf': 0.010076197610219384, 'max_features': 0.9142318599438524}. Best is trial 688 with value: 0.6612018755665507.[0m
[32m[I 2022-04-21 11:49:52,766][0m Trial 717 finished with value: 0.6169504362460058 and parameters: {'splitter': 'best', 'min_samples_split': 0.18548320186515138, 'min_samples_leaf': 0.05049440077650686, 'min_weight_fraction_leaf': 0.04824270748380312, 'max_features': 0.6950024690312708}. Best is trial 688 with value: 0.6612018755665507.[0m
[32m[I 2022-04-21 11:49:53,127][0m Trial 718 finished with value: 0.6320878808989592 and parameters: {'splitter': 'best', 'min_samples_split': 0.1711268522903455, 'min_samples_leaf': 0.03730095090243431, 'min_weight_fraction_leaf': 0.027671405118431042, 'max_features': 0.6357481937341117}. Best is trial 688 with value: 0.6612018755665507.[0m
[32m[I 2022-04-21 11:49:53,511][0m Trial 719 finished with value: 0.6303002591661011 and parameters: {'splitter': 'best', 'min_samples_split': 0.20945074229202534, 'min_samples_leaf': 0.022652279415732446, 'min_weight_fraction_leaf': 0.014331976367652722, 'max_features': 0.7131025043381536}. Best is trial 688 with value: 0.6612018755665507.[0m
[32m[I 2022-04-21 11:49:54,288][0m Trial 720 finished with value: 0.6358344481481583 and parameters: {'splitter': 'best', 'min_samples_split': 0.15678974121804795, 'min_samples_leaf': 0.001050963471105915, 'min_weight_fraction_leaf': 0.01922054307737519, 'max_features': 0.6827566043588363}. Best is trial 688 with value: 0.6612018755665507.[0m
[32m[I 2022-04-21 11:49:54,606][0m Trial 721 finished with value: 0.5502830255103971 and parameters: {'splitter': 'best', 'min_samples_split': 0.37766949128138394, 'min_samples_leaf': 0.01636535318268513, 'min_weight_fraction_leaf': 0.30441405519326176, 'max_features': 0.6543360595082648}. Best is trial 688 with value: 0.6612018755665507.[0m
[32m[I 2022-04-21 11:49:54,998][0m Trial 722 finished with value: 0.5795742513652888 and parameters: {'splitter': 'best', 'min_samples_split': 0.19119372058877038, 'min_samples_leaf': 0.028000038262878855, 'min_weight_fraction_leaf': 0.18960410776723616, 'max_features': 0.6070580300103827}. Best is trial 688 with value: 0.6612018755665507.[0m
[32m[I 2022-04-21 11:49:55,161][0m Trial 723 finished with value: 0.5427636476134123 and parameters: {'splitter': 'random', 'min_samples_split': 0.14828398769930753, 'min_samples_leaf': 0.2572117180116589, 'min_weight_fraction_leaf': 0.00877656907514411, 'max_features': 0.6709658098459391}. Best is trial 688 with value: 0.6612018755665507.[0m
[32m[I 2022-04-21 11:49:55,824][0m Trial 724 finished with value: 0.6275365831935502 and parameters: {'splitter': 'best', 'min_samples_split': 0.1631073462558517, 'min_samples_leaf': 0.00961558853956899, 'min_weight_fraction_leaf': 0.03408920175870861, 'max_features': 0.6336291618466056}. Best is trial 688 with value: 0.6612018755665507.[0m
[32m[I 2022-04-21 11:49:56,611][0m Trial 725 finished with value: 0.6323709630752717 and parameters: {'splitter': 'best', 'min_samples_split': 0.1773239619195429, 'min_samples_leaf': 0.017695706593552636, 'min_weight_fraction_leaf': 0.026116185596664482, 'max_features': 0.8858229657837433}. Best is trial 688 with value: 0.6612018755665507.[0m
[32m[I 2022-04-21 11:49:57,020][0m Trial 726 finished with value: 0.6200432197838285 and parameters: {'splitter': 'best', 'min_samples_split': 0.15318321523602169, 'min_samples_leaf': 0.034735767497016935, 'min_weight_fraction_leaf': 0.009031413237928377, 'max_features': 0.7271710530138509}. Best is trial 688 with value: 0.6612018755665507.[0m
[32m[I 2022-04-21 11:49:57,088][0m Trial 727 finished with value: 0.536760391755396 and parameters: {'splitter': 'best', 'min_samples_split': 0.17190924534657404, 'min_samples_leaf': 0.37459151013983044, 'min_weight_fraction_leaf': 0.016830883528100964, 'max_features': 0.5881846947868636}. Best is trial 688 with value: 0.6612018755665507.[0m
[32m[I 2022-04-21 11:49:58,140][0m Trial 728 finished with value: 0.6400830803500144 and parameters: {'splitter': 'best', 'min_samples_split': 0.12620819680326292, 'min_samples_leaf': 0.009782244471323545, 'min_weight_fraction_leaf': 0.00730896911896982, 'max_features': 0.6209021220667352}. Best is trial 688 with value: 0.6612018755665507.[0m
[32m[I 2022-04-21 11:49:58,570][0m Trial 729 finished with value: 0.6185796494914555 and parameters: {'splitter': 'best', 'min_samples_split': 0.19977081762405283, 'min_samples_leaf': 0.023848504576992214, 'min_weight_fraction_leaf': 0.0003881473695270977, 'max_features': 0.538085926639035}. Best is trial 688 with value: 0.6612018755665507.[0m
[32m[I 2022-04-21 11:49:59,296][0m Trial 730 finished with value: 0.642211413055455 and parameters: {'splitter': 'best', 'min_samples_split': 0.14444991965458737, 'min_samples_leaf': 0.010703207684673068, 'min_weight_fraction_leaf': 0.02268341100313222, 'max_features': 0.6471673156332273}. Best is trial 688 with value: 0.6612018755665507.[0m
[32m[I 2022-04-21 11:50:00,159][0m Trial 731 finished with value: 0.6284333186120092 and parameters: {'splitter': 'best', 'min_samples_split': 0.1148411009794031, 'min_samples_leaf': 0.020966956119177784, 'min_weight_fraction_leaf': 0.04028999034330208, 'max_features': 0.7123717782203175}. Best is trial 688 with value: 0.6612018755665507.[0m
[32m[I 2022-04-21 11:50:00,802][0m Trial 732 finished with value: 0.6342249407369255 and parameters: {'splitter': 'best', 'min_samples_split': 0.16147452072345803, 'min_samples_leaf': 0.04088030521157563, 'min_weight_fraction_leaf': 0.01635415695144315, 'max_features': 0.8282682319891652}. Best is trial 688 with value: 0.6612018755665507.[0m
[32m[I 2022-04-21 11:50:01,398][0m Trial 733 finished with value: 0.6394043745300035 and parameters: {'splitter': 'best', 'min_samples_split': 0.18222326689333096, 'min_samples_leaf': 0.001330395708199112, 'min_weight_fraction_leaf': 0.02990105980233181, 'max_features': 0.6008475523932797}. Best is trial 688 with value: 0.6612018755665507.[0m
[32m[I 2022-04-21 11:50:01,771][0m Trial 734 finished with value: 0.6326162511013075 and parameters: {'splitter': 'best', 'min_samples_split': 0.12977629200551882, 'min_samples_leaf': 0.02874295985248961, 'min_weight_fraction_leaf': 0.0004759216414691389, 'max_features': 0.6662929509211067}. Best is trial 688 with value: 0.6612018755665507.[0m
[32m[I 2022-04-21 11:50:02,395][0m Trial 735 finished with value: 0.6239142934268569 and parameters: {'splitter': 'best', 'min_samples_split': 0.14857383739789987, 'min_samples_leaf': 0.016290413305344174, 'min_weight_fraction_leaf': 9.885970424524317e-05, 'max_features': 0.5673318153291008}. Best is trial 688 with value: 0.6612018755665507.[0m
[32m[I 2022-04-21 11:50:03,296][0m Trial 736 finished with value: 0.6356703674992377 and parameters: {'splitter': 'best', 'min_samples_split': 0.1175259701310869, 'min_samples_leaf': 0.009304079418925804, 'min_weight_fraction_leaf': 0.017064105895842216, 'max_features': 0.6822788711205546}. Best is trial 688 with value: 0.6612018755665507.[0m
[32m[I 2022-04-21 11:50:03,907][0m Trial 737 finished with value: 0.6293840094372725 and parameters: {'splitter': 'best', 'min_samples_split': 0.1378471366903398, 'min_samples_leaf': 0.017235305131309067, 'min_weight_fraction_leaf': 0.010474793226828604, 'max_features': 0.6172299683488695}. Best is trial 688 with value: 0.6612018755665507.[0m
[32m[I 2022-04-21 11:50:04,300][0m Trial 738 finished with value: 0.615555894884879 and parameters: {'splitter': 'best', 'min_samples_split': 0.1701288823739277, 'min_samples_leaf': 0.05998693187771772, 'min_weight_fraction_leaf': 0.024714420011972348, 'max_features': 0.8046550722454628}. Best is trial 688 with value: 0.6612018755665507.[0m
[32m[I 2022-04-21 11:50:04,903][0m Trial 739 finished with value: 0.6384411941894266 and parameters: {'splitter': 'best', 'min_samples_split': 0.10542444303313095, 'min_samples_leaf': 0.030431678968154338, 'min_weight_fraction_leaf': 0.008872706207094062, 'max_features': 0.636290576407782}. Best is trial 688 with value: 0.6612018755665507.[0m
[32m[I 2022-04-21 11:50:07,926][0m Trial 740 finished with value: 0.6281200809136623 and parameters: {'splitter': 'best', 'min_samples_split': 0.19289199332120108, 'min_samples_leaf': 0.001039333158949234, 'min_weight_fraction_leaf': 1.4993965807997417e-05, 'max_features': 0.7454371859018617}. Best is trial 688 with value: 0.6612018755665507.[0m
[32m[I 2022-04-21 11:50:08,363][0m Trial 741 finished with value: 0.6113176230135295 and parameters: {'splitter': 'best', 'min_samples_split': 0.1588927379124006, 'min_samples_leaf': 0.022478461254595874, 'min_weight_fraction_leaf': 0.044611702505646625, 'max_features': 0.7067583913914377}. Best is trial 688 with value: 0.6612018755665507.[0m
[32m[I 2022-04-21 11:50:08,514][0m Trial 742 finished with value: 0.6152784131795805 and parameters: {'splitter': 'random', 'min_samples_split': 0.18009135241765453, 'min_samples_leaf': 0.00928321177487096, 'min_weight_fraction_leaf': 0.033101126740503035, 'max_features': 0.6558858166614461}. Best is trial 688 with value: 0.6612018755665507.[0m
[32m[I 2022-04-21 11:50:09,594][0m Trial 743 finished with value: 0.651801394789672 and parameters: {'splitter': 'best', 'min_samples_split': 0.1322258646227094, 'min_samples_leaf': 0.016800635569819967, 'min_weight_fraction_leaf': 0.019233252761525068, 'max_features': 0.691401766199041}. Best is trial 688 with value: 0.6612018755665507.[0m
[32m[I 2022-04-21 11:50:10,091][0m Trial 744 finished with value: 0.6213363039159866 and parameters: {'splitter': 'best', 'min_samples_split': 0.14763426794702525, 'min_samples_leaf': 0.04875785778585195, 'min_weight_fraction_leaf': 0.033492101078648855, 'max_features': 0.7267265977599358}. Best is trial 688 with value: 0.6612018755665507.[0m
[32m[I 2022-04-21 11:50:10,489][0m Trial 745 finished with value: 0.6126494497301228 and parameters: {'splitter': 'best', 'min_samples_split': 0.13496668136821174, 'min_samples_leaf': 0.03507874549580057, 'min_weight_fraction_leaf': 0.02271367124333597, 'max_features': 0.6914485038738966}. Best is trial 688 with value: 0.6612018755665507.[0m
[32m[I 2022-04-21 11:50:10,692][0m Trial 746 finished with value: 0.6002541726563647 and parameters: {'splitter': 'best', 'min_samples_split': 0.16942161854754217, 'min_samples_leaf': 0.15700483149120883, 'min_weight_fraction_leaf': 0.04358381696347156, 'max_features': 0.6883227861284581}. Best is trial 688 with value: 0.6612018755665507.[0m
[32m[I 2022-04-21 11:50:11,278][0m Trial 747 finished with value: 0.64531546139172 and parameters: {'splitter': 'best', 'min_samples_split': 0.12192098886120406, 'min_samples_leaf': 0.013999453328212213, 'min_weight_fraction_leaf': 0.02069833855359139, 'max_features': 0.7273920577355109}. Best is trial 688 with value: 0.6612018755665507.[0m
[32m[I 2022-04-21 11:50:11,756][0m Trial 748 finished with value: 0.6274868612147637 and parameters: {'splitter': 'best', 'min_samples_split': 0.18766301345968722, 'min_samples_leaf': 0.02602732177244818, 'min_weight_fraction_leaf': 0.028237993811252245, 'max_features': 0.6969687365761075}. Best is trial 688 with value: 0.6612018755665507.[0m
[32m[I 2022-04-21 11:50:12,710][0m Trial 749 finished with value: 0.640234624618362 and parameters: {'splitter': 'best', 'min_samples_split': 0.15338057333078767, 'min_samples_leaf': 0.009195563098510476, 'min_weight_fraction_leaf': 0.015930018487773277, 'max_features': 0.7231360264583119}. Best is trial 688 with value: 0.6612018755665507.[0m
[32m[I 2022-04-21 11:50:13,311][0m Trial 750 finished with value: 0.6068453066416728 and parameters: {'splitter': 'best', 'min_samples_split': 0.1630390800216676, 'min_samples_leaf': 0.0013679518330816497, 'min_weight_fraction_leaf': 0.015617119651419108, 'max_features': 0.6719458937291232}. Best is trial 688 with value: 0.6612018755665507.[0m
[32m[I 2022-04-21 11:50:13,612][0m Trial 751 finished with value: 0.6195326294597711 and parameters: {'splitter': 'best', 'min_samples_split': 0.21186256586547172, 'min_samples_leaf': 0.020262714772989788, 'min_weight_fraction_leaf': 0.03807120395135652, 'max_features': 0.704195912936888}. Best is trial 688 with value: 0.6612018755665507.[0m
[32m[I 2022-04-21 11:50:14,549][0m Trial 752 finished with value: 0.6316085200068247 and parameters: {'splitter': 'best', 'min_samples_split': 0.10996964258992016, 'min_samples_leaf': 0.001101503994219915, 'min_weight_fraction_leaf': 0.026443892183711726, 'max_features': 0.8549766869008871}. Best is trial 688 with value: 0.6612018755665507.[0m
[32m[I 2022-04-21 11:50:15,183][0m Trial 753 finished with value: 0.6022362604225009 and parameters: {'splitter': 'best', 'min_samples_split': 0.14255659420293357, 'min_samples_leaf': 0.038489579588580076, 'min_weight_fraction_leaf': 0.05761890249869462, 'max_features': 0.7536814897015627}. Best is trial 688 with value: 0.6612018755665507.[0m
[32m[I 2022-04-21 11:50:15,791][0m Trial 754 finished with value: 0.6279334614809591 and parameters: {'splitter': 'best', 'min_samples_split': 0.41716636445224486, 'min_samples_leaf': 0.016637305721875034, 'min_weight_fraction_leaf': 0.009246534652205502, 'max_features': 0.6840373160955889}. Best is trial 688 with value: 0.6612018755665507.[0m
[32m[I 2022-04-21 11:50:16,575][0m Trial 755 finished with value: 0.6319677733727443 and parameters: {'splitter': 'best', 'min_samples_split': 0.1302391779446228, 'min_samples_leaf': 0.02562430076177214, 'min_weight_fraction_leaf': 0.015731965104597456, 'max_features': 0.7162321467713434}. Best is trial 688 with value: 0.6612018755665507.[0m
[32m[I 2022-04-21 11:50:16,855][0m Trial 756 finished with value: 0.536760391755396 and parameters: {'splitter': 'best', 'min_samples_split': 0.17762839954272897, 'min_samples_leaf': 0.010592544614019067, 'min_weight_fraction_leaf': 0.3443989082054087, 'max_features': 0.6625767672370205}. Best is trial 688 with value: 0.6612018755665507.[0m
[32m[I 2022-04-21 11:50:17,581][0m Trial 757 finished with value: 0.6421759659480174 and parameters: {'splitter': 'best', 'min_samples_split': 0.2014204019557732, 'min_samples_leaf': 0.010684587132735502, 'min_weight_fraction_leaf': 0.0002808926027318484, 'max_features': 0.498746533380033}. Best is trial 688 with value: 0.6612018755665507.[0m
[32m[I 2022-04-21 11:50:18,165][0m Trial 758 finished with value: 0.5878076178491458 and parameters: {'splitter': 'best', 'min_samples_split': 0.11799516356075505, 'min_samples_leaf': 0.03074929360555515, 'min_weight_fraction_leaf': 0.21527883979670043, 'max_features': 0.7402163673531152}. Best is trial 688 with value: 0.6612018755665507.[0m
[32m[I 2022-04-21 11:50:18,816][0m Trial 759 finished with value: 0.6105194272717369 and parameters: {'splitter': 'best', 'min_samples_split': 0.09368882809044786, 'min_samples_leaf': 0.019214253341449328, 'min_weight_fraction_leaf': 0.031136331593249973, 'max_features': 0.6734290148764512}. Best is trial 688 with value: 0.6612018755665507.[0m
[32m[I 2022-04-21 11:50:19,808][0m Trial 760 finished with value: 0.6302784121506374 and parameters: {'splitter': 'best', 'min_samples_split': 0.15661120697278966, 'min_samples_leaf': 0.009175054393141419, 'min_weight_fraction_leaf': 4.668551364572329e-05, 'max_features': 0.6938000179198087}. Best is trial 688 with value: 0.6612018755665507.[0m
[32m[I 2022-04-21 11:50:19,892][0m Trial 761 finished with value: 0.6183942749520621 and parameters: {'splitter': 'random', 'min_samples_split': 0.1358511991672027, 'min_samples_leaf': 0.04097426731395893, 'min_weight_fraction_leaf': 0.020118087989554154, 'max_features': 0.816849298547112}. Best is trial 688 with value: 0.6612018755665507.[0m
[32m[I 2022-04-21 11:50:20,244][0m Trial 762 finished with value: 0.6180936511210835 and parameters: {'splitter': 'best', 'min_samples_split': 0.18737729883167265, 'min_samples_leaf': 0.02395312492188885, 'min_weight_fraction_leaf': 0.010454093544256426, 'max_features': 0.7078785574888461}. Best is trial 688 with value: 0.6612018755665507.[0m
[32m[I 2022-04-21 11:50:20,983][0m Trial 763 finished with value: 0.6287160571887073 and parameters: {'splitter': 'best', 'min_samples_split': 0.1679621378768094, 'min_samples_leaf': 0.00947851567086313, 'min_weight_fraction_leaf': 0.02513444252858009, 'max_features': 0.6501233745033609}. Best is trial 688 with value: 0.6612018755665507.[0m
[32m[I 2022-04-21 11:50:22,001][0m Trial 764 finished with value: 0.6470256776526311 and parameters: {'splitter': 'best', 'min_samples_split': 0.11000685022445475, 'min_samples_leaf': 0.0014994781213697982, 'min_weight_fraction_leaf': 0.010455383328621141, 'max_features': 0.7601503386495907}. Best is trial 688 with value: 0.6612018755665507.[0m
[32m[I 2022-04-21 11:50:23,215][0m Trial 765 finished with value: 0.6370121250408831 and parameters: {'splitter': 'best', 'min_samples_split': 0.09401951101131559, 'min_samples_leaf': 0.0012948375658962188, 'min_weight_fraction_leaf': 0.009673929291179334, 'max_features': 0.7671556488199769}. Best is trial 688 with value: 0.6612018755665507.[0m
[32m[I 2022-04-21 11:50:24,145][0m Trial 766 finished with value: 0.6226917264820653 and parameters: {'splitter': 'best', 'min_samples_split': 0.10522445448561751, 'min_samples_leaf': 0.0014526147595443784, 'min_weight_fraction_leaf': 0.008152112376628967, 'max_features': 0.7932053577887005}. Best is trial 688 with value: 0.6612018755665507.[0m
[32m[I 2022-04-21 11:50:24,923][0m Trial 767 finished with value: 0.6397899928894495 and parameters: {'splitter': 'best', 'min_samples_split': 0.11086313825280843, 'min_samples_leaf': 0.015198049213926562, 'min_weight_fraction_leaf': 0.019671406546185828, 'max_features': 0.7938616974918988}. Best is trial 688 with value: 0.6612018755665507.[0m
[32m[I 2022-04-21 11:50:26,159][0m Trial 768 finished with value: 0.6314708156694171 and parameters: {'splitter': 'best', 'min_samples_split': 0.12134538847742364, 'min_samples_leaf': 0.01584055130052965, 'min_weight_fraction_leaf': 0.008132021976582377, 'max_features': 0.7735505332618475}. Best is trial 688 with value: 0.6612018755665507.[0m
[32m[I 2022-04-21 11:50:27,214][0m Trial 769 finished with value: 0.6328314367147081 and parameters: {'splitter': 'best', 'min_samples_split': 0.10170865394099471, 'min_samples_leaf': 0.028641839331266912, 'min_weight_fraction_leaf': 0.017187681990081027, 'max_features': 0.7663557109412616}. Best is trial 688 with value: 0.6612018755665507.[0m
[32m[I 2022-04-21 11:50:28,269][0m Trial 770 finished with value: 0.6168921650953078 and parameters: {'splitter': 'best', 'min_samples_split': 0.11530329015049949, 'min_samples_leaf': 0.010494518848958764, 'min_weight_fraction_leaf': 0.032285657110531295, 'max_features': 0.7521519196086293}. Best is trial 688 with value: 0.6612018755665507.[0m
[32m[I 2022-04-21 11:50:30,254][0m Trial 771 finished with value: 0.6306035295022931 and parameters: {'splitter': 'best', 'min_samples_split': 0.12923126744830063, 'min_samples_leaf': 0.0013271579697803765, 'min_weight_fraction_leaf': 0.00019855012699662548, 'max_features': 0.7539179107579433}. Best is trial 688 with value: 0.6612018755665507.[0m
[32m[I 2022-04-21 11:50:30,314][0m Trial 772 finished with value: 0.5398373364311787 and parameters: {'splitter': 'best', 'min_samples_split': 0.10999363514465788, 'min_samples_leaf': 0.423361046138362, 'min_weight_fraction_leaf': 0.047255764415188056, 'max_features': 0.8117119219974027}. Best is trial 688 with value: 0.6612018755665507.[0m
[32m[I 2022-04-21 11:50:30,712][0m Trial 773 finished with value: 0.6273787479896222 and parameters: {'splitter': 'best', 'min_samples_split': 0.12419015723221644, 'min_samples_leaf': 0.021932588237317915, 'min_weight_fraction_leaf': 0.010322502448576331, 'max_features': 0.7827978775699157}. Best is trial 688 with value: 0.6612018755665507.[0m
[32m[I 2022-04-21 11:50:30,785][0m Trial 774 finished with value: 0.5470115668594827 and parameters: {'splitter': 'best', 'min_samples_split': 0.09445309400556215, 'min_samples_leaf': 0.272548159959632, 'min_weight_fraction_leaf': 0.024648000653798297, 'max_features': 0.7363662915116468}. Best is trial 688 with value: 0.6612018755665507.[0m
[32m[I 2022-04-21 11:50:31,330][0m Trial 775 finished with value: 0.6230077721704896 and parameters: {'splitter': 'best', 'min_samples_split': 0.14154999351794417, 'min_samples_leaf': 0.03286908837474744, 'min_weight_fraction_leaf': 0.0001720844055705599, 'max_features': 0.7624061609957627}. Best is trial 688 with value: 0.6612018755665507.[0m
[32m[I 2022-04-21 11:50:32,071][0m Trial 776 finished with value: 0.6190917161988637 and parameters: {'splitter': 'best', 'min_samples_split': 0.1061903453227469, 'min_samples_leaf': 0.0011838857291031827, 'min_weight_fraction_leaf': 0.03805177419610168, 'max_features': 0.8006166163462465}. Best is trial 688 with value: 0.6612018755665507.[0m
