[32m[I 2022-04-21 11:41:51,093][0m Trial 963 finished with value: 0.842183674410227 and parameters: {'alpha': 0.6735450481341422, 'ties': 'efron'}. Best is trial 13 with value: 0.8423527006348241.[0m
[32m[I 2022-04-21 11:41:51,248][0m Trial 964 finished with value: 0.8423527006348241 and parameters: {'alpha': 0.8624517202854263, 'ties': 'efron'}. Best is trial 13 with value: 0.8423527006348241.[0m
[32m[I 2022-04-21 11:41:51,734][0m Trial 965 finished with value: 0.8414545406933376 and parameters: {'alpha': 0.8867948100707335, 'ties': 'efron'}. Best is trial 13 with value: 0.8423527006348241.[0m
[32m[I 2022-04-21 11:41:51,983][0m Trial 966 finished with value: 0.842183674410227 and parameters: {'alpha': 0.503825178963845, 'ties': 'breslow'}. Best is trial 13 with value: 0.8423527006348241.[0m
[32m[I 2022-04-21 11:41:52,140][0m Trial 967 finished with value: 0.8423527006348241 and parameters: {'alpha': 0.8274103702406705, 'ties': 'efron'}. Best is trial 13 with value: 0.8423527006348241.[0m
[32m[I 2022-04-21 11:41:52,344][0m Trial 968 finished with value: 0.841474844739692 and parameters: {'alpha': 2.4653328248772057, 'ties': 'breslow'}. Best is trial 13 with value: 0.8423527006348241.[0m
[32m[I 2022-04-21 11:41:52,558][0m Trial 969 finished with value: 0.842183674410227 and parameters: {'alpha': 0.5844316522140762, 'ties': 'breslow'}. Best is trial 13 with value: 0.8423527006348241.[0m
[32m[I 2022-04-21 11:41:52,711][0m Trial 970 finished with value: 0.842183674410227 and parameters: {'alpha': 0.3862759109192505, 'ties': 'breslow'}. Best is trial 13 with value: 0.8423527006348241.[0m
[32m[I 2022-04-21 11:41:52,975][0m Trial 971 finished with value: 0.8418138046699323 and parameters: {'alpha': 2.040112850299004, 'ties': 'efron'}. Best is trial 13 with value: 0.8423527006348241.[0m
[32m[I 2022-04-21 11:41:53,216][0m Trial 972 finished with value: 0.8414545406933376 and parameters: {'alpha': 0.9801064094512248, 'ties': 'efron'}. Best is trial 13 with value: 0.8423527006348241.[0m
[32m[I 2022-04-21 11:41:53,543][0m Trial 973 finished with value: 0.8414545406933376 and parameters: {'alpha': 0.9557202369039643, 'ties': 'breslow'}. Best is trial 13 with value: 0.8423527006348241.[0m
[32m[I 2022-04-21 11:41:53,714][0m Trial 974 finished with value: 0.8414545406933376 and parameters: {'alpha': 1.0935031807549196, 'ties': 'breslow'}. Best is trial 13 with value: 0.8423527006348241.[0m
[32m[I 2022-04-21 11:41:53,984][0m Trial 975 finished with value: 0.842183674410227 and parameters: {'alpha': 0.6933758312976146, 'ties': 'breslow'}. Best is trial 13 with value: 0.8423527006348241.[0m
[32m[I 2022-04-21 11:41:54,263][0m Trial 976 finished with value: 0.842183674410227 and parameters: {'alpha': 0.6412899323065168, 'ties': 'breslow'}. Best is trial 13 with value: 0.8423527006348241.[0m
[32m[I 2022-04-21 11:41:54,436][0m Trial 977 finished with value: 0.8423527006348241 and parameters: {'alpha': 0.7685124508587409, 'ties': 'efron'}. Best is trial 13 with value: 0.8423527006348241.[0m
[32m[I 2022-04-21 11:41:54,667][0m Trial 978 finished with value: 0.8423527006348241 and parameters: {'alpha': 0.7587447485223043, 'ties': 'efron'}. Best is trial 13 with value: 0.8423527006348241.[0m
[32m[I 2022-04-21 11:41:55,078][0m Trial 979 finished with value: 0.8423527006348241 and parameters: {'alpha': 0.8677757503651409, 'ties': 'breslow'}. Best is trial 13 with value: 0.8423527006348241.[0m
[32m[I 2022-04-21 11:41:55,435][0m Trial 980 finished with value: 0.8414545406933376 and parameters: {'alpha': 1.2460448422615997, 'ties': 'breslow'}. Best is trial 13 with value: 0.8423527006348241.[0m
[32m[I 2022-04-21 11:41:55,723][0m Trial 981 finished with value: 0.8414545406933376 and parameters: {'alpha': 1.5417115772981655, 'ties': 'efron'}. Best is trial 13 with value: 0.8423527006348241.[0m
[32m[I 2022-04-21 11:41:55,988][0m Trial 982 finished with value: 0.8423527006348241 and parameters: {'alpha': 0.7472714992539328, 'ties': 'efron'}. Best is trial 13 with value: 0.8423527006348241.[0m
[32m[I 2022-04-21 11:41:56,268][0m Trial 983 finished with value: 0.842183674410227 and parameters: {'alpha': 0.5247841064516433, 'ties': 'efron'}. Best is trial 13 with value: 0.8423527006348241.[0m
[32m[I 2022-04-21 11:41:56,667][0m Trial 984 finished with value: 0.842183674410227 and parameters: {'alpha': 0.6577274022941466, 'ties': 'efron'}. Best is trial 13 with value: 0.8423527006348241.[0m
[32m[I 2022-04-21 11:41:56,922][0m Trial 985 finished with value: 0.8414545406933376 and parameters: {'alpha': 0.9467209044326435, 'ties': 'efron'}. Best is trial 13 with value: 0.8423527006348241.[0m
[32m[I 2022-04-21 11:41:57,131][0m Trial 986 finished with value: 0.8414545406933376 and parameters: {'alpha': 1.1280868026376716, 'ties': 'breslow'}. Best is trial 13 with value: 0.8423527006348241.[0m
[32m[I 2022-04-21 11:41:57,328][0m Trial 987 finished with value: 0.8414545406933376 and parameters: {'alpha': 1.0311831979167743, 'ties': 'breslow'}. Best is trial 13 with value: 0.8423527006348241.[0m
[32m[I 2022-04-21 11:41:57,542][0m Trial 988 finished with value: 0.8414545406933376 and parameters: {'alpha': 0.9437059742172519, 'ties': 'breslow'}. Best is trial 13 with value: 0.8423527006348241.[0m
[32m[I 2022-04-21 11:41:57,893][0m Trial 989 finished with value: 0.8414545406933376 and parameters: {'alpha': 1.0550208293813887, 'ties': 'breslow'}. Best is trial 13 with value: 0.8423527006348241.[0m
[32m[I 2022-04-21 11:41:58,272][0m Trial 990 finished with value: 0.8414545406933376 and parameters: {'alpha': 0.9615961806281789, 'ties': 'breslow'}. Best is trial 13 with value: 0.8423527006348241.[0m
[32m[I 2022-04-21 11:41:58,606][0m Trial 991 finished with value: 0.8414545406933376 and parameters: {'alpha': 1.1724388680567637, 'ties': 'breslow'}. Best is trial 13 with value: 0.8423527006348241.[0m
[32m[I 2022-04-21 11:41:58,965][0m Trial 992 finished with value: 0.8423527006348241 and parameters: {'alpha': 0.9164211791747318, 'ties': 'breslow'}. Best is trial 13 with value: 0.8423527006348241.[0m
[32m[I 2022-04-21 11:41:59,415][0m Trial 993 finished with value: 0.8423527006348241 and parameters: {'alpha': 0.8802565331449045, 'ties': 'breslow'}. Best is trial 13 with value: 0.8423527006348241.[0m
[32m[I 2022-04-21 11:41:59,744][0m Trial 994 finished with value: 0.8414545406933376 and parameters: {'alpha': 1.043136669582501, 'ties': 'breslow'}. Best is trial 13 with value: 0.8423527006348241.[0m
[32m[I 2022-04-21 11:42:00,079][0m Trial 995 finished with value: 0.8423527006348241 and parameters: {'alpha': 0.8877535546159533, 'ties': 'breslow'}. Best is trial 13 with value: 0.8423527006348241.[0m
[32m[I 2022-04-21 11:42:00,365][0m Trial 996 finished with value: 0.8412855144687406 and parameters: {'alpha': 1.7173824654374519, 'ties': 'efron'}. Best is trial 13 with value: 0.8423527006348241.[0m
[32m[I 2022-04-21 11:42:00,633][0m Trial 997 finished with value: 0.8423527006348241 and parameters: {'alpha': 0.7817784685355995, 'ties': 'efron'}. Best is trial 13 with value: 0.8423527006348241.[0m
[32m[I 2022-04-21 11:42:00,985][0m Trial 998 finished with value: 0.8423527006348241 and parameters: {'alpha': 0.7860412281996819, 'ties': 'breslow'}. Best is trial 13 with value: 0.8423527006348241.[0m
[32m[I 2022-04-21 11:42:01,531][0m Trial 999 finished with value: 0.8423527006348241 and parameters: {'alpha': 0.8200971592170103, 'ties': 'breslow'}. Best is trial 13 with value: 0.8423527006348241.[0m
[32m[I 2022-04-21 11:42:01,535][0m A new study created in memory with name: no-name-2a446bf7-f0b7-447b-ae4b-cab9397faf14[0m
[32m[I 2022-04-21 11:42:01,887][0m Trial 0 finished with value: 0.6829496894793843 and parameters: {'alpha': 2.520249314508773, 'ties': 'efron'}. Best is trial 0 with value: 0.6829496894793843.[0m
[32m[I 2022-04-21 11:42:02,182][0m Trial 1 finished with value: 0.684367348820454 and parameters: {'alpha': 0.4463571541920371, 'ties': 'efron'}. Best is trial 1 with value: 0.684367348820454.[0m
[32m[I 2022-04-21 11:42:02,466][0m Trial 2 finished with value: 0.6836276093398644 and parameters: {'alpha': 2.151711351110465, 'ties': 'breslow'}. Best is trial 1 with value: 0.684367348820454.[0m
[32m[I 2022-04-21 11:42:02,780][0m Trial 3 finished with value: 0.684367348820454 and parameters: {'alpha': 0.010507573724342464, 'ties': 'efron'}. Best is trial 1 with value: 0.684367348820454.[0m
[32m[I 2022-04-21 11:42:03,089][0m Trial 4 finished with value: 0.682571028937481 and parameters: {'alpha': 1.9229405039525833, 'ties': 'efron'}. Best is trial 1 with value: 0.684367348820454.[0m
[32m[I 2022-04-21 11:42:03,422][0m Trial 5 finished with value: 0.6811159057216931 and parameters: {'alpha': 4.822996951750004, 'ties': 'breslow'}. Best is trial 1 with value: 0.684367348820454.[0m
[32m[I 2022-04-21 11:42:03,776][0m Trial 6 finished with value: 0.6814469677485105 and parameters: {'alpha': 4.119801554221725, 'ties': 'efron'}. Best is trial 1 with value: 0.684367348820454.[0m
[32m[I 2022-04-21 11:42:04,237][0m Trial 7 finished with value: 0.6829090813866752 and parameters: {'alpha': 1.5685071676700388, 'ties': 'efron'}. Best is trial 1 with value: 0.684367348820454.[0m
[32m[I 2022-04-21 11:42:04,500][0m Trial 8 finished with value: 0.684367348820454 and parameters: {'alpha': 0.606021391921001, 'ties': 'breslow'}. Best is trial 1 with value: 0.684367348820454.[0m
[32m[I 2022-04-21 11:42:04,845][0m Trial 9 finished with value: 0.6829496894793843 and parameters: {'alpha': 2.444931164020759, 'ties': 'efron'}. Best is trial 1 with value: 0.684367348820454.[0m
[32m[I 2022-04-21 11:42:05,125][0m Trial 10 finished with value: 0.6829090813866752 and parameters: {'alpha': 0.9852114606590994, 'ties': 'breslow'}. Best is trial 1 with value: 0.684367348820454.[0m
[32m[I 2022-04-21 11:42:05,269][0m Trial 11 finished with value: 0.684367348820454 and parameters: {'alpha': 0.01803964497389765, 'ties': 'efron'}. Best is trial 1 with value: 0.684367348820454.[0m
[32m[I 2022-04-21 11:42:05,623][0m Trial 12 finished with value: 0.684367348820454 and parameters: {'alpha': 0.00636214201478673, 'ties': 'efron'}. Best is trial 1 with value: 0.684367348820454.[0m
[32m[I 2022-04-21 11:42:05,909][0m Trial 13 finished with value: 0.6829090813866752 and parameters: {'alpha': 0.9871953924426204, 'ties': 'efron'}. Best is trial 1 with value: 0.684367348820454.[0m
[32m[I 2022-04-21 11:42:06,409][0m Trial 14 finished with value: 0.6826116370301901 and parameters: {'alpha': 3.3759655219304934, 'ties': 'efron'}. Best is trial 1 with value: 0.684367348820454.[0m
[32m[I 2022-04-21 11:42:06,907][0m Trial 15 finished with value: 0.684367348820454 and parameters: {'alpha': 0.6077757380981286, 'ties': 'efron'}. Best is trial 1 with value: 0.684367348820454.[0m
[32m[I 2022-04-21 11:42:07,305][0m Trial 16 finished with value: 0.6829090813866752 and parameters: {'alpha': 1.245561554800189, 'ties': 'efron'}. Best is trial 1 with value: 0.684367348820454.[0m
[32m[I 2022-04-21 11:42:07,667][0m Trial 17 finished with value: 0.6826116370301901 and parameters: {'alpha': 3.0954566951930196, 'ties': 'breslow'}. Best is trial 1 with value: 0.684367348820454.[0m
[32m[I 2022-04-21 11:42:07,998][0m Trial 18 finished with value: 0.6829090813866752 and parameters: {'alpha': 1.5302186399741111, 'ties': 'breslow'}. Best is trial 1 with value: 0.684367348820454.[0m
[32m[I 2022-04-21 11:42:08,287][0m Trial 19 finished with value: 0.684367348820454 and parameters: {'alpha': 0.46606888248417244, 'ties': 'efron'}. Best is trial 1 with value: 0.684367348820454.[0m
[32m[I 2022-04-21 11:42:08,428][0m Trial 20 finished with value: 0.684367348820454 and parameters: {'alpha': 0.5848286919556858, 'ties': 'efron'}. Best is trial 1 with value: 0.684367348820454.[0m
[32m[I 2022-04-21 11:42:08,587][0m Trial 21 finished with value: 0.684367348820454 and parameters: {'alpha': 0.34639866398818264, 'ties': 'efron'}. Best is trial 1 with value: 0.684367348820454.[0m
[32m[I 2022-04-21 11:42:08,781][0m Trial 22 finished with value: 0.684367348820454 and parameters: {'alpha': 0.13563426537033724, 'ties': 'efron'}. Best is trial 1 with value: 0.684367348820454.[0m
[32m[I 2022-04-21 11:42:08,969][0m Trial 23 finished with value: 0.6829090813866752 and parameters: {'alpha': 0.9062396677443808, 'ties': 'efron'}. Best is trial 1 with value: 0.684367348820454.[0m
[32m[I 2022-04-21 11:42:09,104][0m Trial 24 finished with value: 0.684367348820454 and parameters: {'alpha': 0.20190477222529019, 'ties': 'efron'}. Best is trial 1 with value: 0.684367348820454.[0m
[32m[I 2022-04-21 11:42:09,235][0m Trial 25 finished with value: 0.6829090813866752 and parameters: {'alpha': 1.315948022517235, 'ties': 'efron'}. Best is trial 1 with value: 0.684367348820454.[0m
[32m[I 2022-04-21 11:42:09,448][0m Trial 26 finished with value: 0.6847054012696481 and parameters: {'alpha': 0.7532346161291328, 'ties': 'efron'}. Best is trial 26 with value: 0.6847054012696481.[0m
[32m[I 2022-04-21 11:42:09,584][0m Trial 27 finished with value: 0.6847054012696481 and parameters: {'alpha': 0.8407292536282092, 'ties': 'efron'}. Best is trial 26 with value: 0.6847054012696481.[0m
[32m[I 2022-04-21 11:42:09,736][0m Trial 28 finished with value: 0.682571028937481 and parameters: {'alpha': 1.8190603812581405, 'ties': 'efron'}. Best is trial 26 with value: 0.6847054012696481.[0m
[32m[I 2022-04-21 11:42:09,984][0m Trial 29 finished with value: 0.6829090813866752 and parameters: {'alpha': 0.8934906322835336, 'ties': 'efron'}. Best is trial 26 with value: 0.6847054012696481.[0m
[32m[I 2022-04-21 11:42:10,105][0m Trial 30 finished with value: 0.6829496894793843 and parameters: {'alpha': 2.747308407747537, 'ties': 'breslow'}. Best is trial 26 with value: 0.6847054012696481.[0m
[32m[I 2022-04-21 11:42:10,323][0m Trial 31 finished with value: 0.684367348820454 and parameters: {'alpha': 0.6735638954656844, 'ties': 'efron'}. Best is trial 26 with value: 0.6847054012696481.[0m
[32m[I 2022-04-21 11:42:10,532][0m Trial 32 finished with value: 0.6829090813866752 and parameters: {'alpha': 1.2378508388923894, 'ties': 'efron'}. Best is trial 26 with value: 0.6847054012696481.[0m
[32m[I 2022-04-21 11:42:10,874][0m Trial 33 finished with value: 0.684367348820454 and parameters: {'alpha': 0.4504459924488788, 'ties': 'efron'}. Best is trial 26 with value: 0.6847054012696481.[0m
[32m[I 2022-04-21 11:42:11,077][0m Trial 34 finished with value: 0.6847054012696481 and parameters: {'alpha': 0.7533735517847084, 'ties': 'efron'}. Best is trial 26 with value: 0.6847054012696481.[0m
[32m[I 2022-04-21 11:42:11,209][0m Trial 35 finished with value: 0.6836276093398644 and parameters: {'alpha': 2.1028315442979593, 'ties': 'efron'}. Best is trial 26 with value: 0.6847054012696481.[0m
[32m[I 2022-04-21 11:42:11,360][0m Trial 36 finished with value: 0.6829090813866752 and parameters: {'alpha': 1.5523554773682338, 'ties': 'efron'}. Best is trial 26 with value: 0.6847054012696481.[0m
[32m[I 2022-04-21 11:42:11,583][0m Trial 37 finished with value: 0.6847054012696481 and parameters: {'alpha': 0.8360193778140124, 'ties': 'efron'}. Best is trial 26 with value: 0.6847054012696481.[0m
[32m[I 2022-04-21 11:42:11,750][0m Trial 38 finished with value: 0.682571028937481 and parameters: {'alpha': 1.716360513563733, 'ties': 'efron'}. Best is trial 26 with value: 0.6847054012696481.[0m
[32m[I 2022-04-21 11:42:12,078][0m Trial 39 finished with value: 0.6829090813866752 and parameters: {'alpha': 1.1888189921861494, 'ties': 'efron'}. Best is trial 26 with value: 0.6847054012696481.[0m
[32m[I 2022-04-21 11:42:12,227][0m Trial 40 finished with value: 0.6814469677485105 and parameters: {'alpha': 3.8573190702074784, 'ties': 'breslow'}. Best is trial 26 with value: 0.6847054012696481.[0m
[32m[I 2022-04-21 11:42:12,366][0m Trial 41 finished with value: 0.684367348820454 and parameters: {'alpha': 0.6904745686515721, 'ties': 'efron'}. Best is trial 26 with value: 0.6847054012696481.[0m
[32m[I 2022-04-21 11:42:12,515][0m Trial 42 finished with value: 0.6847054012696481 and parameters: {'alpha': 0.857723801572202, 'ties': 'efron'}. Best is trial 26 with value: 0.6847054012696481.[0m
[32m[I 2022-04-21 11:42:12,664][0m Trial 43 finished with value: 0.6829090813866752 and parameters: {'alpha': 0.9682926236164526, 'ties': 'efron'}. Best is trial 26 with value: 0.6847054012696481.[0m
[32m[I 2022-04-21 11:42:12,799][0m Trial 44 finished with value: 0.6836276093398644 and parameters: {'alpha': 2.049554782771348, 'ties': 'efron'}. Best is trial 26 with value: 0.6847054012696481.[0m
[32m[I 2022-04-21 11:42:12,950][0m Trial 45 finished with value: 0.684367348820454 and parameters: {'alpha': 0.3168413515780616, 'ties': 'efron'}. Best is trial 26 with value: 0.6847054012696481.[0m
[32m[I 2022-04-21 11:42:13,086][0m Trial 46 finished with value: 0.6847054012696481 and parameters: {'alpha': 0.7889680918644402, 'ties': 'efron'}. Best is trial 26 with value: 0.6847054012696481.[0m
[32m[I 2022-04-21 11:42:13,232][0m Trial 47 finished with value: 0.6829496894793843 and parameters: {'alpha': 2.4296906474619777, 'ties': 'efron'}. Best is trial 26 with value: 0.6847054012696481.[0m
[32m[I 2022-04-21 11:42:13,355][0m Trial 48 finished with value: 0.6829090813866752 and parameters: {'alpha': 1.422545139998499, 'ties': 'breslow'}. Best is trial 26 with value: 0.6847054012696481.[0m
[32m[I 2022-04-21 11:42:13,507][0m Trial 49 finished with value: 0.6829090813866752 and parameters: {'alpha': 1.1033788047150452, 'ties': 'efron'}. Best is trial 26 with value: 0.6847054012696481.[0m
[32m[I 2022-04-21 11:42:13,638][0m Trial 50 finished with value: 0.6811159057216931 and parameters: {'alpha': 4.928995031515609, 'ties': 'efron'}. Best is trial 26 with value: 0.6847054012696481.[0m
[32m[I 2022-04-21 11:42:13,770][0m Trial 51 finished with value: 0.6847054012696481 and parameters: {'alpha': 0.7713721443461031, 'ties': 'efron'}. Best is trial 26 with value: 0.6847054012696481.[0m
[32m[I 2022-04-21 11:42:13,903][0m Trial 52 finished with value: 0.6847054012696481 and parameters: {'alpha': 0.8666419576204338, 'ties': 'efron'}. Best is trial 26 with value: 0.6847054012696481.[0m
[32m[I 2022-04-21 11:42:14,034][0m Trial 53 finished with value: 0.6829090813866752 and parameters: {'alpha': 1.101078159867685, 'ties': 'efron'}. Best is trial 26 with value: 0.6847054012696481.[0m
[32m[I 2022-04-21 11:42:14,168][0m Trial 54 finished with value: 0.684367348820454 and parameters: {'alpha': 0.48525842388293716, 'ties': 'efron'}. Best is trial 26 with value: 0.6847054012696481.[0m
[32m[I 2022-04-21 11:42:14,301][0m Trial 55 finished with value: 0.684367348820454 and parameters: {'alpha': 0.2956613678178658, 'ties': 'efron'}. Best is trial 26 with value: 0.6847054012696481.[0m
[32m[I 2022-04-21 11:42:14,446][0m Trial 56 finished with value: 0.6847054012696481 and parameters: {'alpha': 0.7539054206570378, 'ties': 'efron'}. Best is trial 26 with value: 0.6847054012696481.[0m
[32m[I 2022-04-21 11:42:14,575][0m Trial 57 finished with value: 0.6829090813866752 and parameters: {'alpha': 1.3340871410236748, 'ties': 'breslow'}. Best is trial 26 with value: 0.6847054012696481.[0m
[32m[I 2022-04-21 11:42:14,719][0m Trial 58 finished with value: 0.682571028937481 and parameters: {'alpha': 1.7494697689842287, 'ties': 'efron'}. Best is trial 26 with value: 0.6847054012696481.[0m
[32m[I 2022-04-21 11:42:14,854][0m Trial 59 finished with value: 0.684367348820454 and parameters: {'alpha': 0.586748116174179, 'ties': 'efron'}. Best is trial 26 with value: 0.6847054012696481.[0m
[32m[I 2022-04-21 11:42:14,989][0m Trial 60 finished with value: 0.684367348820454 and parameters: {'alpha': 0.12013889973362846, 'ties': 'efron'}. Best is trial 26 with value: 0.6847054012696481.[0m
[32m[I 2022-04-21 11:42:15,125][0m Trial 61 finished with value: 0.6847054012696481 and parameters: {'alpha': 0.8392455382707814, 'ties': 'efron'}. Best is trial 26 with value: 0.6847054012696481.[0m
[32m[I 2022-04-21 11:42:15,258][0m Trial 62 finished with value: 0.6829090813866752 and parameters: {'alpha': 1.0316496107026536, 'ties': 'efron'}. Best is trial 26 with value: 0.6847054012696481.[0m
[32m[I 2022-04-21 11:42:15,393][0m Trial 63 finished with value: 0.6814469677485105 and parameters: {'alpha': 4.512147041234103, 'ties': 'efron'}. Best is trial 26 with value: 0.6847054012696481.[0m
[32m[I 2022-04-21 11:42:15,529][0m Trial 64 finished with value: 0.6847054012696481 and parameters: {'alpha': 0.7661099428216478, 'ties': 'efron'}. Best is trial 26 with value: 0.6847054012696481.[0m
[32m[I 2022-04-21 11:42:15,663][0m Trial 65 finished with value: 0.6847054012696481 and parameters: {'alpha': 0.7037668384553095, 'ties': 'efron'}. Best is trial 26 with value: 0.6847054012696481.[0m
[32m[I 2022-04-21 11:42:15,798][0m Trial 66 finished with value: 0.684367348820454 and parameters: {'alpha': 0.550161688953064, 'ties': 'efron'}. Best is trial 26 with value: 0.6847054012696481.[0m
[32m[I 2022-04-21 11:42:15,932][0m Trial 67 finished with value: 0.684367348820454 and parameters: {'alpha': 0.32838880113183205, 'ties': 'efron'}. Best is trial 26 with value: 0.6847054012696481.[0m
[32m[I 2022-04-21 11:42:16,094][0m Trial 68 finished with value: 0.6829090813866752 and parameters: {'alpha': 1.3942593466923325, 'ties': 'breslow'}. Best is trial 26 with value: 0.6847054012696481.[0m
[32m[I 2022-04-21 11:42:16,229][0m Trial 69 finished with value: 0.6829090813866752 and parameters: {'alpha': 1.138308603904613, 'ties': 'efron'}. Best is trial 26 with value: 0.6847054012696481.[0m
