[32m[I 2022-04-22 13:27:42,704][0m Trial 964 finished with value: 0.6977800958093784 and parameters: {'loss': 'coxph', 'learning_rate': 0.0015680590413983712, 'n_estimators': 895, 'criterion': 'friedman_mse', 'min_samples_split': 9, 'min_samples_leaf': 6, 'min_weight_fraction_leaf': 0.034179750511893266, 'min_impurity_decrease': 0.9290768601132712, 'max_features': 0.21515132503436935, 'subsample': 0.31838194378855417, 'dropout_rate': 0.19469835465803476, 'ccp_alpha': 0.1661893754088385}. Best is trial 867 with value: 0.8349451173694054.[0m
[32m[I 2022-04-22 13:31:25,953][0m Trial 965 finished with value: 0.2503270102305002 and parameters: {'loss': 'coxph', 'learning_rate': 0.0008199362593260958, 'n_estimators': 996, 'criterion': 'friedman_mse', 'min_samples_split': 2, 'min_samples_leaf': 6, 'min_weight_fraction_leaf': 0.015401457861277366, 'min_impurity_decrease': 0.9799616664379898, 'max_features': 0.10036399666974194, 'subsample': 0.2978870380021268, 'dropout_rate': 0.22676120569598804, 'ccp_alpha': 0.27400171348075164}. Best is trial 867 with value: 0.8349451173694054.[0m
[32m[I 2022-04-22 13:34:31,469][0m Trial 966 finished with value: 0.8265605774867687 and parameters: {'loss': 'coxph', 'learning_rate': 0.0011248805559975204, 'n_estimators': 855, 'criterion': 'friedman_mse', 'min_samples_split': 2, 'min_samples_leaf': 7, 'min_weight_fraction_leaf': 0.026513981108552416, 'min_impurity_decrease': 0.9498947956738336, 'max_features': 0.19103682346193437, 'subsample': 0.274596433375509, 'dropout_rate': 0.1708943292591762, 'ccp_alpha': 0.09180348218775278}. Best is trial 867 with value: 0.8349451173694054.[0m
[32m[I 2022-04-22 13:37:57,060][0m Trial 967 finished with value: 0.6956991921906515 and parameters: {'loss': 'coxph', 'learning_rate': 0.0015826477375457406, 'n_estimators': 915, 'criterion': 'friedman_mse', 'min_samples_split': 2, 'min_samples_leaf': 6, 'min_weight_fraction_leaf': 0.04285948151050525, 'min_impurity_decrease': 0.964134825858062, 'max_features': 0.22012670216029787, 'subsample': 0.3601289007468381, 'dropout_rate': 0.15411356555988048, 'ccp_alpha': 0.17030116755475763}. Best is trial 867 with value: 0.8349451173694054.[0m
[32m[I 2022-04-22 13:41:32,780][0m Trial 968 finished with value: 0.25 and parameters: {'loss': 'coxph', 'learning_rate': 0.0018840709991211283, 'n_estimators': 957, 'criterion': 'friedman_mse', 'min_samples_split': 2, 'min_samples_leaf': 7, 'min_weight_fraction_leaf': 0.01865422903116524, 'min_impurity_decrease': 0.9187588499899689, 'max_features': 0.20852057504380458, 'subsample': 0.324531951372143, 'dropout_rate': 0.21224786539724527, 'ccp_alpha': 3.1137675238424993}. Best is trial 867 with value: 0.8349451173694054.[0m
[32m[I 2022-04-22 13:44:57,793][0m Trial 969 finished with value: 0.25 and parameters: {'loss': 'coxph', 'learning_rate': 0.001423421856120131, 'n_estimators': 919, 'criterion': 'friedman_mse', 'min_samples_split': 2, 'min_samples_leaf': 6, 'min_weight_fraction_leaf': 0.010298054283490565, 'min_impurity_decrease': 0.9838838488855229, 'max_features': 0.23254301906447442, 'subsample': 0.3425056084290496, 'dropout_rate': 0.18568952127394875, 'ccp_alpha': 1.1587033392480202}. Best is trial 867 with value: 0.8349451173694054.[0m
[32m[I 2022-04-22 13:47:51,712][0m Trial 970 finished with value: 0.7986189160188782 and parameters: {'loss': 'coxph', 'learning_rate': 0.002087114338286757, 'n_estimators': 865, 'criterion': 'friedman_mse', 'min_samples_split': 2, 'min_samples_leaf': 6, 'min_weight_fraction_leaf': 0.34149774608524325, 'min_impurity_decrease': 0.9475165710584081, 'max_features': 0.17972997603598387, 'subsample': 0.29852619449405504, 'dropout_rate': 0.23121741614883792, 'ccp_alpha': 0.08403763394217383}. Best is trial 867 with value: 0.8349451173694054.[0m
[32m[I 2022-04-22 13:51:45,166][0m Trial 971 finished with value: 0.25 and parameters: {'loss': 'coxph', 'learning_rate': 0.002060520485346054, 'n_estimators': 998, 'criterion': 'friedman_mse', 'min_samples_split': 2, 'min_samples_leaf': 6, 'min_weight_fraction_leaf': 0.03761066116476491, 'min_impurity_decrease': 0.9692738464786925, 'max_features': 0.22649322964547774, 'subsample': 0.2802413045689335, 'dropout_rate': 0.19430525144723187, 'ccp_alpha': 4.99446124872393}. Best is trial 867 with value: 0.8349451173694054.[0m
[32m[I 2022-04-22 13:55:40,270][0m Trial 972 finished with value: 0.8318296166651475 and parameters: {'loss': 'coxph', 'learning_rate': 0.0017179018863837622, 'n_estimators': 934, 'criterion': 'friedman_mse', 'min_samples_split': 2, 'min_samples_leaf': 7, 'min_weight_fraction_leaf': 0.027870704416746737, 'min_impurity_decrease': 0.934717482336757, 'max_features': 0.16030296646526793, 'subsample': 0.31889330926158643, 'dropout_rate': 0.1373921543773544, 'ccp_alpha': 0.001253880261726788}. Best is trial 867 with value: 0.8349451173694054.[0m
[32m[I 2022-04-22 14:00:02,699][0m Trial 973 finished with value: 0.25 and parameters: {'loss': 'coxph', 'learning_rate': 0.0015301580027541318, 'n_estimators': 1000, 'criterion': 'squared_error', 'min_samples_split': 2, 'min_samples_leaf': 7, 'min_weight_fraction_leaf': 0.044232660183709145, 'min_impurity_decrease': 0.9120026211342392, 'max_features': 0.13907681580097453, 'subsample': 0.2366223764486871, 'dropout_rate': 0.11003322996212628, 'ccp_alpha': 0.004707371531054005}. Best is trial 867 with value: 0.8349451173694054.[0m
[32m[I 2022-04-22 14:03:55,324][0m Trial 974 finished with value: 0.795346093444722 and parameters: {'loss': 'coxph', 'learning_rate': 0.0011057787318534775, 'n_estimators': 927, 'criterion': 'friedman_mse', 'min_samples_split': 2, 'min_samples_leaf': 7, 'min_weight_fraction_leaf': 0.3174945485093178, 'min_impurity_decrease': 0.903648734540958, 'max_features': 0.16956485295266122, 'subsample': 0.2650480259107854, 'dropout_rate': 0.0869639366260318, 'ccp_alpha': 0.002951552306178814}. Best is trial 867 with value: 0.8349451173694054.[0m
[32m[I 2022-04-22 14:07:53,245][0m Trial 975 finished with value: 0.37443648352327663 and parameters: {'loss': 'coxph', 'learning_rate': 0.0016352557375433696, 'n_estimators': 959, 'criterion': 'friedman_mse', 'min_samples_split': 2, 'min_samples_leaf': 7, 'min_weight_fraction_leaf': 0.03072332236435233, 'min_impurity_decrease': 0.9310228235522062, 'max_features': 0.16467091109802326, 'subsample': 0.3120744651056995, 'dropout_rate': 0.14254777134832594, 'ccp_alpha': 0.25028942987175284}. Best is trial 867 with value: 0.8349451173694054.[0m
[32m[I 2022-04-22 14:11:25,944][0m Trial 976 finished with value: 0.8109997454222144 and parameters: {'loss': 'coxph', 'learning_rate': 0.0010317030926789675, 'n_estimators': 886, 'criterion': 'friedman_mse', 'min_samples_split': 2, 'min_samples_leaf': 7, 'min_weight_fraction_leaf': 0.028460895901024023, 'min_impurity_decrease': 0.941363889519838, 'max_features': 0.14441942162593469, 'subsample': 0.292539771265677, 'dropout_rate': 0.107523380069488, 'ccp_alpha': 0.16160685067822075}. Best is trial 867 with value: 0.8349451173694054.[0m
[32m[I 2022-04-22 14:14:56,290][0m Trial 977 finished with value: 0.25 and parameters: {'loss': 'coxph', 'learning_rate': 0.0021588289003914183, 'n_estimators': 920, 'criterion': 'absolute_error', 'min_samples_split': 2, 'min_samples_leaf': 7, 'min_weight_fraction_leaf': 0.03717827390539612, 'min_impurity_decrease': 0.923554221442394, 'max_features': 0.15768771557501432, 'subsample': 0.3124363040639631, 'dropout_rate': 0.1294447032585314, 'ccp_alpha': 0.3892855689976366}. Best is trial 867 with value: 0.8349451173694054.[0m
[32m[I 2022-04-22 14:18:58,452][0m Trial 978 finished with value: 0.829289485465894 and parameters: {'loss': 'coxph', 'learning_rate': 0.0013719779298063414, 'n_estimators': 952, 'criterion': 'friedman_mse', 'min_samples_split': 2, 'min_samples_leaf': 7, 'min_weight_fraction_leaf': 0.04477506403287528, 'min_impurity_decrease': 0.9613370599378288, 'max_features': 0.12909802720935412, 'subsample': 0.28365211959196723, 'dropout_rate': 0.1474952115030263, 'ccp_alpha': 0.0030412534080401336}. Best is trial 867 with value: 0.8349451173694054.[0m
[32m[I 2022-04-22 14:21:53,131][0m Trial 979 finished with value: 0.8269465642101663 and parameters: {'loss': 'coxph', 'learning_rate': 0.0016930360859034113, 'n_estimators': 841, 'criterion': 'friedman_mse', 'min_samples_split': 2, 'min_samples_leaf': 7, 'min_weight_fraction_leaf': 0.01992567269745292, 'min_impurity_decrease': 0.8962662019452262, 'max_features': 0.1944696995079223, 'subsample': 0.3259257825039721, 'dropout_rate': 0.16307068481583728, 'ccp_alpha': 0.0997105030710734}. Best is trial 867 with value: 0.8349451173694054.[0m
/media/san2_ssd/data/Workdir/survival/venv/lib/python3.8/site-packages/sksurv/ensemble/boosting.py:955: RuntimeWarning: divide by zero encountered in log
  time = numpy.log(time)
/media/san2_ssd/data/Workdir/survival/venv/lib/python3.8/site-packages/sksurv/ensemble/boosting.py:955: RuntimeWarning: divide by zero encountered in log
  time = numpy.log(time)
/media/san2_ssd/data/Workdir/survival/venv/lib/python3.8/site-packages/sksurv/ensemble/boosting.py:955: RuntimeWarning: divide by zero encountered in log
  time = numpy.log(time)
/media/san2_ssd/data/Workdir/survival/venv/lib/python3.8/site-packages/sksurv/ensemble/boosting.py:955: RuntimeWarning: divide by zero encountered in log
  time = numpy.log(time)
[32m[I 2022-04-22 14:22:36,966][0m Trial 980 finished with value: -0.45988379219994924 and parameters: {'loss': 'squared', 'learning_rate': 0.002299425158430162, 'n_estimators': 893, 'criterion': 'friedman_mse', 'min_samples_split': 2, 'min_samples_leaf': 7, 'min_weight_fraction_leaf': 0.19729979875076972, 'min_impurity_decrease': 0.9993496518217523, 'max_features': 0.20948781218501325, 'subsample': 0.3007322956956681, 'dropout_rate': 0.1165303072206982, 'ccp_alpha': 0.003621300930938396}. Best is trial 867 with value: 0.8349451173694054.[0m
[32m[I 2022-04-22 14:26:12,569][0m Trial 981 finished with value: 0.8104460739058114 and parameters: {'loss': 'coxph', 'learning_rate': 0.0009464428748117685, 'n_estimators': 952, 'criterion': 'friedman_mse', 'min_samples_split': 2, 'min_samples_leaf': 7, 'min_weight_fraction_leaf': 0.010867179653290768, 'min_impurity_decrease': 0.943883294364684, 'max_features': 0.18934989093573157, 'subsample': 0.2577088080852979, 'dropout_rate': 0.1751041829329491, 'ccp_alpha': 0.17989866199506757}. Best is trial 867 with value: 0.8349451173694054.[0m
[32m[I 2022-04-22 14:29:18,430][0m Trial 982 finished with value: 0.2503270102305002 and parameters: {'loss': 'coxph', 'learning_rate': 0.0018533994203091798, 'n_estimators': 859, 'criterion': 'friedman_mse', 'min_samples_split': 2, 'min_samples_leaf': 7, 'min_weight_fraction_leaf': 0.027884784193280828, 'min_impurity_decrease': 0.9808524619652658, 'max_features': 0.16839486639341242, 'subsample': 0.3249779024003082, 'dropout_rate': 0.13154110144541467, 'ccp_alpha': 0.3176664414192113}. Best is trial 867 with value: 0.8349451173694054.[0m
[32m[I 2022-04-22 14:32:39,812][0m Trial 983 finished with value: 0.8272562053349454 and parameters: {'loss': 'coxph', 'learning_rate': 0.0012628277155431712, 'n_estimators': 914, 'criterion': 'friedman_mse', 'min_samples_split': 6, 'min_samples_leaf': 6, 'min_weight_fraction_leaf': 0.001560973435711599, 'min_impurity_decrease': 0.9544190333596766, 'max_features': 0.24199008039081785, 'subsample': 0.2747755708496778, 'dropout_rate': 0.202955116304579, 'ccp_alpha': 0.09981100707932751}. Best is trial 867 with value: 0.8349451173694054.[0m
[32m[I 2022-04-22 14:36:05,611][0m Trial 984 finished with value: 0.8310719762888572 and parameters: {'loss': 'coxph', 'learning_rate': 0.0024417068343276487, 'n_estimators': 885, 'criterion': 'friedman_mse', 'min_samples_split': 2, 'min_samples_leaf': 6, 'min_weight_fraction_leaf': 0.018276515426249817, 'min_impurity_decrease': 0.9286029088382646, 'max_features': 0.21593450659446373, 'subsample': 0.3076811606029387, 'dropout_rate': 0.16174371764039475, 'ccp_alpha': 0.004154239855458429}. Best is trial 867 with value: 0.8349451173694054.[0m
[32m[I 2022-04-22 14:39:34,081][0m Trial 985 finished with value: 0.2635985584722028 and parameters: {'loss': 'coxph', 'learning_rate': 0.002557409745620062, 'n_estimators': 964, 'criterion': 'friedman_mse', 'min_samples_split': 2, 'min_samples_leaf': 7, 'min_weight_fraction_leaf': 0.033899538030931806, 'min_impurity_decrease': 0.9673891600054314, 'max_features': 0.1201168792554627, 'subsample': 0.33788821530096486, 'dropout_rate': 0.22933419779815928, 'ccp_alpha': 0.23774941734006344}. Best is trial 867 with value: 0.8349451173694054.[0m
[32m[I 2022-04-22 14:42:22,763][0m Trial 986 finished with value: 0.8111816799216187 and parameters: {'loss': 'coxph', 'learning_rate': 0.0016795334535932651, 'n_estimators': 836, 'criterion': 'friedman_mse', 'min_samples_split': 5, 'min_samples_leaf': 6, 'min_weight_fraction_leaf': 0.010720660354026579, 'min_impurity_decrease': 0.9473417540368502, 'max_features': 0.23038280025872834, 'subsample': 0.2889401761483731, 'dropout_rate': 0.17705260110130885, 'ccp_alpha': 0.1642219283539783}. Best is trial 867 with value: 0.8349451173694054.[0m
[32m[I 2022-04-22 14:45:42,246][0m Trial 987 finished with value: 0.8256785792739073 and parameters: {'loss': 'coxph', 'learning_rate': 0.0019536596851667818, 'n_estimators': 922, 'criterion': 'friedman_mse', 'min_samples_split': 2, 'min_samples_leaf': 7, 'min_weight_fraction_leaf': 0.046466147428614046, 'min_impurity_decrease': 0.9831785199178786, 'max_features': 0.1968098715033075, 'subsample': 0.2165906591374931, 'dropout_rate': 0.2109047507599576, 'ccp_alpha': 0.08663346474928367}. Best is trial 867 with value: 0.8349451173694054.[0m
[32m[I 2022-04-22 14:50:03,065][0m Trial 988 finished with value: 0.25 and parameters: {'loss': 'coxph', 'learning_rate': 0.0009299432268118036, 'n_estimators': 1000, 'criterion': 'friedman_mse', 'min_samples_split': 2, 'min_samples_leaf': 6, 'min_weight_fraction_leaf': 0.0012529723830609144, 'min_impurity_decrease': 0.9127323020781132, 'max_features': 0.24958603690182943, 'subsample': 0.32002942080947894, 'dropout_rate': 0.09164122457067272, 'ccp_alpha': 0.5498259741537708}. Best is trial 867 with value: 0.8349451173694054.[0m
[32m[I 2022-04-22 14:53:14,891][0m Trial 989 finished with value: 0.8278762199738207 and parameters: {'loss': 'coxph', 'learning_rate': 0.0024614392421205638, 'n_estimators': 876, 'criterion': 'friedman_mse', 'min_samples_split': 2, 'min_samples_leaf': 6, 'min_weight_fraction_leaf': 0.02415647409566258, 'min_impurity_decrease': 0.9642445268232616, 'max_features': 0.18402418698946665, 'subsample': 0.2410270088197497, 'dropout_rate': 0.140352874136577, 'ccp_alpha': 0.09935645583750456}. Best is trial 867 with value: 0.8349451173694054.[0m
[32m[I 2022-04-22 14:56:41,344][0m Trial 990 finished with value: 0.25 and parameters: {'loss': 'coxph', 'learning_rate': 0.0007580072902437467, 'n_estimators': 951, 'criterion': 'friedman_mse', 'min_samples_split': 2, 'min_samples_leaf': 7, 'min_weight_fraction_leaf': 0.2955021867554167, 'min_impurity_decrease': 0.21816135764010985, 'max_features': 0.1517011669730352, 'subsample': 0.33898189378600313, 'dropout_rate': 0.24413547971611682, 'ccp_alpha': 3.7232606617810706}. Best is trial 867 with value: 0.8349451173694054.[0m
[32m[I 2022-04-22 15:00:17,524][0m Trial 991 finished with value: 0.8308361468076063 and parameters: {'loss': 'coxph', 'learning_rate': 0.0014185424952510557, 'n_estimators': 912, 'criterion': 'friedman_mse', 'min_samples_split': 2, 'min_samples_leaf': 6, 'min_weight_fraction_leaf': 0.01729210862844937, 'min_impurity_decrease': 0.9327278443666889, 'max_features': 0.2298932537211639, 'subsample': 0.29724122069704934, 'dropout_rate': 0.1884159959490995, 'ccp_alpha': 0.0011867763726702274}. Best is trial 867 with value: 0.8349451173694054.[0m
[32m[I 2022-04-22 15:03:27,092][0m Trial 992 finished with value: 0.8062486269696765 and parameters: {'loss': 'coxph', 'learning_rate': 0.0011780947294519155, 'n_estimators': 819, 'criterion': 'friedman_mse', 'min_samples_split': 2, 'min_samples_leaf': 6, 'min_weight_fraction_leaf': 0.035143202350230024, 'min_impurity_decrease': 0.9795228541520594, 'max_features': 0.2550247466961618, 'subsample': 0.2700992741012086, 'dropout_rate': 0.005300970416350526, 'ccp_alpha': 0.18784543637081566}. Best is trial 867 with value: 0.8349451173694054.[0m
[32m[I 2022-04-22 15:06:40,489][0m Trial 993 finished with value: 0.8334057377184628 and parameters: {'loss': 'coxph', 'learning_rate': 0.002922471517842709, 'n_estimators': 879, 'criterion': 'friedman_mse', 'min_samples_split': 2, 'min_samples_leaf': 7, 'min_weight_fraction_leaf': 0.0262678141068158, 'min_impurity_decrease': 0.9480437588322214, 'max_features': 0.20020615368466854, 'subsample': 0.3133235267218009, 'dropout_rate': 0.21368699505112557, 'ccp_alpha': 0.0016843979930604254}. Best is trial 867 with value: 0.8349451173694054.[0m
[32m[I 2022-04-22 15:10:17,807][0m Trial 994 finished with value: 0.8286034926981412 and parameters: {'loss': 'coxph', 'learning_rate': 0.0028310086256185286, 'n_estimators': 964, 'criterion': 'friedman_mse', 'min_samples_split': 2, 'min_samples_leaf': 7, 'min_weight_fraction_leaf': 0.04597699368264154, 'min_impurity_decrease': 0.9513622971647494, 'max_features': 0.2013495868396677, 'subsample': 0.358499518565161, 'dropout_rate': 0.21492467850178162, 'ccp_alpha': 0.10225845426603761}. Best is trial 867 with value: 0.8349451173694054.[0m
[32m[I 2022-04-22 15:13:38,085][0m Trial 995 finished with value: 0.25 and parameters: {'loss': 'coxph', 'learning_rate': 0.002128009674624711, 'n_estimators': 920, 'criterion': 'squared_error', 'min_samples_split': 2, 'min_samples_leaf': 6, 'min_weight_fraction_leaf': 0.03130232311318819, 'min_impurity_decrease': 0.9864649903227525, 'max_features': 0.21455931993616847, 'subsample': 0.32927892598782726, 'dropout_rate': 0.19811010919816258, 'ccp_alpha': 0.3028020707030315}. Best is trial 867 with value: 0.8349451173694054.[0m
[32m[I 2022-04-22 15:17:45,145][0m Trial 996 finished with value: 0.4934212751786916 and parameters: {'loss': 'coxph', 'learning_rate': 0.002637934155898331, 'n_estimators': 999, 'criterion': 'friedman_mse', 'min_samples_split': 2, 'min_samples_leaf': 6, 'min_weight_fraction_leaf': 0.010646335284577448, 'min_impurity_decrease': 0.9656554587769001, 'max_features': 0.18091064537041418, 'subsample': 0.3428201005312013, 'dropout_rate': 0.15688615525809352, 'ccp_alpha': 0.18331025704897713}. Best is trial 867 with value: 0.8349451173694054.[0m
[32m[I 2022-04-22 15:20:54,940][0m Trial 997 finished with value: 0.8309847158959434 and parameters: {'loss': 'coxph', 'learning_rate': 0.0017909204574891322, 'n_estimators': 854, 'criterion': 'friedman_mse', 'min_samples_split': 2, 'min_samples_leaf': 6, 'min_weight_fraction_leaf': 0.026157477521641097, 'min_impurity_decrease': 0.9973543957188352, 'max_features': 0.15687805500868138, 'subsample': 0.3158936894625387, 'dropout_rate': 0.1791816581459898, 'ccp_alpha': 0.0012800968007363317}. Best is trial 867 with value: 0.8349451173694054.[0m
[32m[I 2022-04-22 15:24:01,478][0m Trial 998 finished with value: 0.25 and parameters: {'loss': 'coxph', 'learning_rate': 0.002741432024567939, 'n_estimators': 895, 'criterion': 'friedman_mse', 'min_samples_split': 2, 'min_samples_leaf': 7, 'min_weight_fraction_leaf': 0.03900343844555153, 'min_impurity_decrease': 0.9426063113819524, 'max_features': 0.20011795591239206, 'subsample': 0.3634584126839213, 'dropout_rate': 0.22309355419746166, 'ccp_alpha': 2.2756315191344436}. Best is trial 867 with value: 0.8349451173694054.[0m
/media/san2_ssd/data/Workdir/survival/venv/lib/python3.8/site-packages/sksurv/ensemble/boosting.py:955: RuntimeWarning: divide by zero encountered in log
  time = numpy.log(time)
/media/san2_ssd/data/Workdir/survival/venv/lib/python3.8/site-packages/sksurv/ensemble/boosting.py:955: RuntimeWarning: divide by zero encountered in log
  time = numpy.log(time)
/media/san2_ssd/data/Workdir/survival/venv/lib/python3.8/site-packages/sksurv/ensemble/boosting.py:955: RuntimeWarning: divide by zero encountered in log
  time = numpy.log(time)
/media/san2_ssd/data/Workdir/survival/venv/lib/python3.8/site-packages/sksurv/ensemble/boosting.py:955: RuntimeWarning: divide by zero encountered in log
  time = numpy.log(time)
[32m[I 2022-04-22 15:24:44,557][0m Trial 999 finished with value: -0.4654818598594395 and parameters: {'loss': 'squared', 'learning_rate': 0.0020656573394261923, 'n_estimators': 956, 'criterion': 'friedman_mse', 'min_samples_split': 2, 'min_samples_leaf': 6, 'min_weight_fraction_leaf': 0.001203878224191112, 'min_impurity_decrease': 0.9666121437580181, 'max_features': 0.10565954053287308, 'subsample': 0.3155410413865524, 'dropout_rate': 0.20511228189183153, 'ccp_alpha': 0.09056135059693857}. Best is trial 867 with value: 0.8349451173694054.[0m
[32m[I 2022-04-22 15:24:44,564][0m A new study created in memory with name: no-name-33bd2b5d-0cba-401b-8c8c-ade12f59ac9e[0m
