[32m[I 2022-04-21 11:48:33,667][0m Trial 588 finished with value: 0.6181089814343983 and parameters: {'splitter': 'best', 'min_samples_split': 0.10801830058060771, 'min_samples_leaf': 0.027607097756138715, 'min_weight_fraction_leaf': 0.019072487698990396, 'max_features': 0.7527854343844896}. Best is trial 507 with value: 0.6585778818712512.[0m
[32m[I 2022-04-21 11:48:34,690][0m Trial 589 finished with value: 0.6179571862141497 and parameters: {'splitter': 'best', 'min_samples_split': 0.14144678731224913, 'min_samples_leaf': 0.010307253316493747, 'min_weight_fraction_leaf': 0.009540993232977487, 'max_features': 0.5603956894368015}. Best is trial 507 with value: 0.6585778818712512.[0m
[32m[I 2022-04-21 11:48:35,242][0m Trial 590 finished with value: 0.6270963746501705 and parameters: {'splitter': 'best', 'min_samples_split': 0.12498939520761615, 'min_samples_leaf': 0.017794903389558626, 'min_weight_fraction_leaf': 0.026448192579479453, 'max_features': 0.6267213790661856}. Best is trial 507 with value: 0.6585778818712512.[0m
[32m[I 2022-04-21 11:48:35,730][0m Trial 591 finished with value: 0.6244061877503272 and parameters: {'splitter': 'best', 'min_samples_split': 0.25901582515747973, 'min_samples_leaf': 0.0010383740402979643, 'min_weight_fraction_leaf': 0.016235611147090424, 'max_features': 0.6519874606189513}. Best is trial 507 with value: 0.6585778818712512.[0m
[32m[I 2022-04-21 11:48:36,020][0m Trial 592 finished with value: 0.6118838072202273 and parameters: {'splitter': 'best', 'min_samples_split': 0.09613828588028178, 'min_samples_leaf': 0.0349723048429689, 'min_weight_fraction_leaf': 0.03831404887324659, 'max_features': 0.6873371902393421}. Best is trial 507 with value: 0.6585778818712512.[0m
[32m[I 2022-04-21 11:48:36,247][0m Trial 593 finished with value: 0.5421960700702187 and parameters: {'splitter': 'best', 'min_samples_split': 0.16657318796986342, 'min_samples_leaf': 0.009192493133319775, 'min_weight_fraction_leaf': 0.3325151373529711, 'max_features': 0.5783339013508875}. Best is trial 507 with value: 0.6585778818712512.[0m
[32m[I 2022-04-21 11:48:36,997][0m Trial 594 finished with value: 0.6390142490823665 and parameters: {'splitter': 'best', 'min_samples_split': 0.07471156668962024, 'min_samples_leaf': 0.02502437019370607, 'min_weight_fraction_leaf': 0.00016042054466491873, 'max_features': 0.7372148974825995}. Best is trial 507 with value: 0.6585778818712512.[0m
[32m[I 2022-04-21 11:48:37,804][0m Trial 595 finished with value: 0.6294656468054428 and parameters: {'splitter': 'best', 'min_samples_split': 0.11435257277996917, 'min_samples_leaf': 0.01693916038300091, 'min_weight_fraction_leaf': 0.008524548285201043, 'max_features': 0.7724669295392482}. Best is trial 507 with value: 0.6585778818712512.[0m
[32m[I 2022-04-21 11:48:38,469][0m Trial 596 finished with value: 0.6241184905687194 and parameters: {'splitter': 'best', 'min_samples_split': 0.13403439204169365, 'min_samples_leaf': 0.038982526859353925, 'min_weight_fraction_leaf': 0.024720799664102074, 'max_features': 0.7113058368127526}. Best is trial 507 with value: 0.6585778818712512.[0m
[32m[I 2022-04-21 11:48:38,772][0m Trial 597 finished with value: 0.6119117963998638 and parameters: {'splitter': 'best', 'min_samples_split': 0.3224724434770637, 'min_samples_leaf': 0.058320484709209267, 'min_weight_fraction_leaf': 0.01598512048627754, 'max_features': 0.4743624759400859}. Best is trial 507 with value: 0.6585778818712512.[0m
[32m[I 2022-04-21 11:48:39,715][0m Trial 598 finished with value: 0.6369738595086947 and parameters: {'splitter': 'best', 'min_samples_split': 0.10701569171708677, 'min_samples_leaf': 0.009408722709580262, 'min_weight_fraction_leaf': 9.745721986587823e-05, 'max_features': 0.597195424678208}. Best is trial 507 with value: 0.6585778818712512.[0m
[32m[I 2022-04-21 11:48:40,423][0m Trial 599 finished with value: 0.6164735194909092 and parameters: {'splitter': 'best', 'min_samples_split': 0.1487344122155199, 'min_samples_leaf': 0.02658446530994043, 'min_weight_fraction_leaf': 0.04555124067023526, 'max_features': 0.6466069646341432}. Best is trial 507 with value: 0.6585778818712512.[0m
[32m[I 2022-04-21 11:48:40,614][0m Trial 600 finished with value: 0.5796723061935467 and parameters: {'splitter': 'best', 'min_samples_split': 0.1743743582463882, 'min_samples_leaf': 0.2229763766747038, 'min_weight_fraction_leaf': 0.029984678176927747, 'max_features': 0.5494238110478065}. Best is trial 507 with value: 0.6585778818712512.[0m
[32m[I 2022-04-21 11:48:41,784][0m Trial 601 finished with value: 0.64163743286682 and parameters: {'splitter': 'best', 'min_samples_split': 0.12005886894963431, 'min_samples_leaf': 0.00994428787074992, 'min_weight_fraction_leaf': 0.010058428314323752, 'max_features': 0.6107151132214225}. Best is trial 507 with value: 0.6585778818712512.[0m
[32m[I 2022-04-21 11:48:42,336][0m Trial 602 finished with value: 0.6270671719948552 and parameters: {'splitter': 'best', 'min_samples_split': 0.1572968412332963, 'min_samples_leaf': 0.0013610300865466547, 'min_weight_fraction_leaf': 0.020385227168192632, 'max_features': 0.6348744503510683}. Best is trial 507 with value: 0.6585778818712512.[0m
[32m[I 2022-04-21 11:48:42,761][0m Trial 603 finished with value: 0.6069258895537786 and parameters: {'splitter': 'best', 'min_samples_split': 0.4879246880763438, 'min_samples_leaf': 0.019623585761915953, 'min_weight_fraction_leaf': 0.008314849008838346, 'max_features': 0.6631629049809595}. Best is trial 507 with value: 0.6585778818712512.[0m
[32m[I 2022-04-21 11:48:43,024][0m Trial 604 finished with value: 0.5529443255704848 and parameters: {'splitter': 'best', 'min_samples_split': 0.351608025706181, 'min_samples_leaf': 0.02905024015537041, 'min_weight_fraction_leaf': 0.2472215986928041, 'max_features': 0.7002343912950587}. Best is trial 507 with value: 0.6585778818712512.[0m
[32m[I 2022-04-21 11:48:43,472][0m Trial 605 finished with value: 0.6066611911712801 and parameters: {'splitter': 'best', 'min_samples_split': 0.1349033120842943, 'min_samples_leaf': 0.04549396455848848, 'min_weight_fraction_leaf': 0.031342375042310675, 'max_features': 0.8117250652268755}. Best is trial 507 with value: 0.6585778818712512.[0m
[32m[I 2022-04-21 11:48:43,906][0m Trial 606 finished with value: 0.6130731763289404 and parameters: {'splitter': 'best', 'min_samples_split': 0.09800068034285978, 'min_samples_leaf': 0.01589339306080968, 'min_weight_fraction_leaf': 0.019351988598401763, 'max_features': 0.5093226795789687}. Best is trial 507 with value: 0.6585778818712512.[0m
[32m[I 2022-04-21 11:48:44,055][0m Trial 607 finished with value: 0.5215500905649788 and parameters: {'splitter': 'best', 'min_samples_split': 0.12506709857698606, 'min_samples_leaf': 0.009256723290762596, 'min_weight_fraction_leaf': 0.46362111148867235, 'max_features': 0.5762258499816407}. Best is trial 507 with value: 0.6585778818712512.[0m
[32m[I 2022-04-21 11:48:44,138][0m Trial 608 finished with value: 0.5502830255103971 and parameters: {'splitter': 'best', 'min_samples_split': 0.08381578967287297, 'min_samples_leaf': 0.3032918997131153, 'min_weight_fraction_leaf': 0.009821453296176235, 'max_features': 0.7584629831105224}. Best is trial 507 with value: 0.6585778818712512.[0m
[32m[I 2022-04-21 11:48:44,840][0m Trial 609 finished with value: 0.643211900588159 and parameters: {'splitter': 'best', 'min_samples_split': 0.14347129975495582, 'min_samples_leaf': 0.0011480734003252021, 'min_weight_fraction_leaf': 0.017097087303188638, 'max_features': 0.7903788105170542}. Best is trial 507 with value: 0.6585778818712512.[0m
[32m[I 2022-04-21 11:48:45,232][0m Trial 610 finished with value: 0.6364969744563436 and parameters: {'splitter': 'best', 'min_samples_split': 0.10823160035807422, 'min_samples_leaf': 0.022916875311780934, 'min_weight_fraction_leaf': 0.007631088706588423, 'max_features': 0.7246454709039031}. Best is trial 507 with value: 0.6585778818712512.[0m
[32m[I 2022-04-21 11:48:46,028][0m Trial 611 finished with value: 0.6279031962526712 and parameters: {'splitter': 'best', 'min_samples_split': 0.1175735669855712, 'min_samples_leaf': 0.0010290218080908674, 'min_weight_fraction_leaf': 0.039893737429637824, 'max_features': 0.671268749864289}. Best is trial 507 with value: 0.6585778818712512.[0m
[32m[I 2022-04-21 11:48:46,463][0m Trial 612 finished with value: 0.6184739034153834 and parameters: {'splitter': 'best', 'min_samples_split': 0.13140238292174622, 'min_samples_leaf': 0.019342281073544576, 'min_weight_fraction_leaf': 0.02653754025184546, 'max_features': 0.6013109852531333}. Best is trial 507 with value: 0.6585778818712512.[0m
[32m[I 2022-04-21 11:48:46,802][0m Trial 613 finished with value: 0.6456154950832458 and parameters: {'splitter': 'best', 'min_samples_split': 0.15260585037034982, 'min_samples_leaf': 0.03222951072649575, 'min_weight_fraction_leaf': 0.00821941805395799, 'max_features': 0.6147207159595326}. Best is trial 507 with value: 0.6585778818712512.[0m
[32m[I 2022-04-21 11:48:47,520][0m Trial 614 finished with value: 0.606129037437258 and parameters: {'splitter': 'best', 'min_samples_split': 0.0616495793908933, 'min_samples_leaf': 0.03898912122438036, 'min_weight_fraction_leaf': 0.01708021278806428, 'max_features': 0.626377956806656}. Best is trial 507 with value: 0.6585778818712512.[0m
[32m[I 2022-04-21 11:48:48,171][0m Trial 615 finished with value: 0.6215268036760759 and parameters: {'splitter': 'best', 'min_samples_split': 0.15093499728570134, 'min_samples_leaf': 0.0296385180631889, 'min_weight_fraction_leaf': 0.00021242497496304705, 'max_features': 0.6514912613980404}. Best is trial 507 with value: 0.6585778818712512.[0m
[32m[I 2022-04-21 11:48:48,806][0m Trial 616 finished with value: 0.607989924115783 and parameters: {'splitter': 'best', 'min_samples_split': 0.10199869754283722, 'min_samples_leaf': 0.011325093891589543, 'min_weight_fraction_leaf': 0.031752620851551006, 'max_features': 0.6291611145190608}. Best is trial 507 with value: 0.6585778818712512.[0m
[32m[I 2022-04-21 11:48:49,258][0m Trial 617 finished with value: 0.6124952408981883 and parameters: {'splitter': 'best', 'min_samples_split': 0.13788959146449273, 'min_samples_leaf': 0.033368618236236436, 'min_weight_fraction_leaf': 0.022169714348336683, 'max_features': 0.6836034060770124}. Best is trial 507 with value: 0.6585778818712512.[0m
[32m[I 2022-04-21 11:48:49,957][0m Trial 618 finished with value: 0.6441638736449744 and parameters: {'splitter': 'best', 'min_samples_split': 0.1171991146255625, 'min_samples_leaf': 0.015618072336851868, 'min_weight_fraction_leaf': 0.00993600403613666, 'max_features': 0.645937931722609}. Best is trial 507 with value: 0.6585778818712512.[0m
[32m[I 2022-04-21 11:48:50,725][0m Trial 619 finished with value: 0.6463934759427743 and parameters: {'splitter': 'best', 'min_samples_split': 0.16035507565148593, 'min_samples_leaf': 0.010068919387670568, 'min_weight_fraction_leaf': 0.015207201420957531, 'max_features': 0.6231666954920115}. Best is trial 507 with value: 0.6585778818712512.[0m
[32m[I 2022-04-21 11:48:50,988][0m Trial 620 finished with value: 0.605720260276337 and parameters: {'splitter': 'best', 'min_samples_split': 0.16554909175337473, 'min_samples_leaf': 0.1368074629523431, 'min_weight_fraction_leaf': 0.009139468142090048, 'max_features': 0.6272131409471823}. Best is trial 507 with value: 0.6585778818712512.[0m
[32m[I 2022-04-21 11:48:51,291][0m Trial 621 finished with value: 0.6054501621378472 and parameters: {'splitter': 'best', 'min_samples_split': 0.17837339625749646, 'min_samples_leaf': 0.04820039805536605, 'min_weight_fraction_leaf': 0.016367405680583817, 'max_features': 0.6148704378172248}. Best is trial 507 with value: 0.6585778818712512.[0m
[32m[I 2022-04-21 11:48:51,606][0m Trial 622 finished with value: 0.6263251924172655 and parameters: {'splitter': 'best', 'min_samples_split': 0.15716093994618824, 'min_samples_leaf': 0.026574037094616008, 'min_weight_fraction_leaf': 0.005755848570604701, 'max_features': 0.6083335368859709}. Best is trial 507 with value: 0.6585778818712512.[0m
[32m[I 2022-04-21 11:48:51,756][0m Trial 623 finished with value: 0.5911733537361427 and parameters: {'splitter': 'best', 'min_samples_split': 0.1696053779247376, 'min_samples_leaf': 0.19149670022434861, 'min_weight_fraction_leaf': 0.02196647817276462, 'max_features': 0.6520657739144916}. Best is trial 507 with value: 0.6585778818712512.[0m
[32m[I 2022-04-21 11:48:52,082][0m Trial 624 finished with value: 0.6261714443706492 and parameters: {'splitter': 'best', 'min_samples_split': 0.16281742404544752, 'min_samples_leaf': 0.036909104654812314, 'min_weight_fraction_leaf': 0.000547962518737748, 'max_features': 0.6348622056156069}. Best is trial 507 with value: 0.6585778818712512.[0m
[32m[I 2022-04-21 11:48:52,429][0m Trial 625 finished with value: 0.6432616001508503 and parameters: {'splitter': 'best', 'min_samples_split': 0.14217327722060819, 'min_samples_leaf': 0.021003502956993825, 'min_weight_fraction_leaf': 0.015406434818597435, 'max_features': 0.6135022266929185}. Best is trial 507 with value: 0.6585778818712512.[0m
[32m[I 2022-04-21 11:48:53,245][0m Trial 626 finished with value: 0.641906325662273 and parameters: {'splitter': 'best', 'min_samples_split': 0.18302827339957636, 'min_samples_leaf': 0.01178681221245432, 'min_weight_fraction_leaf': 0.008501857327314996, 'max_features': 0.5957870857493398}. Best is trial 507 with value: 0.6585778818712512.[0m
[32m[I 2022-04-21 11:48:53,796][0m Trial 627 finished with value: 0.6282758148538928 and parameters: {'splitter': 'best', 'min_samples_split': 0.15509834603601633, 'min_samples_leaf': 0.027742109192394337, 'min_weight_fraction_leaf': 0.0003733556075945568, 'max_features': 0.6647483449390064}. Best is trial 507 with value: 0.6585778818712512.[0m
[32m[I 2022-04-21 11:48:54,006][0m Trial 628 finished with value: 0.6168199405592307 and parameters: {'splitter': 'best', 'min_samples_split': 0.15113130902577504, 'min_samples_leaf': 0.11235666537045094, 'min_weight_fraction_leaf': 0.025455237474628113, 'max_features': 0.6419640465696436}. Best is trial 507 with value: 0.6585778818712512.[0m
[32m[I 2022-04-21 11:48:54,500][0m Trial 629 finished with value: 0.6338505995612566 and parameters: {'splitter': 'best', 'min_samples_split': 0.13222254501661357, 'min_samples_leaf': 0.017449999837569483, 'min_weight_fraction_leaf': 0.03900405802296537, 'max_features': 0.6146637975741621}. Best is trial 507 with value: 0.6585778818712512.[0m
[32m[I 2022-04-21 11:48:55,159][0m Trial 630 finished with value: 0.6325153858234259 and parameters: {'splitter': 'best', 'min_samples_split': 0.16839274387587236, 'min_samples_leaf': 0.01000610637467988, 'min_weight_fraction_leaf': 0.015909915015537446, 'max_features': 0.5935697726602582}. Best is trial 507 with value: 0.6585778818712512.[0m
[32m[I 2022-04-21 11:48:55,419][0m Trial 631 finished with value: 0.6083472492451328 and parameters: {'splitter': 'best', 'min_samples_split': 0.14525749032292748, 'min_samples_leaf': 0.04127265889220863, 'min_weight_fraction_leaf': 1.04807523413665e-06, 'max_features': 0.625302440372098}. Best is trial 507 with value: 0.6585778818712512.[0m
[32m[I 2022-04-21 11:48:55,798][0m Trial 632 finished with value: 0.6109338577496233 and parameters: {'splitter': 'best', 'min_samples_split': 0.1300551397758424, 'min_samples_leaf': 0.023727493031552655, 'min_weight_fraction_leaf': 0.04870389026610113, 'max_features': 0.6645361904837862}. Best is trial 507 with value: 0.6585778818712512.[0m
[32m[I 2022-04-21 11:48:56,310][0m Trial 633 finished with value: 0.6390621930991743 and parameters: {'splitter': 'best', 'min_samples_split': 0.12129965491254918, 'min_samples_leaf': 0.009925257608989716, 'min_weight_fraction_leaf': 0.029943336108091377, 'max_features': 0.6389046375580756}. Best is trial 507 with value: 0.6585778818712512.[0m
[32m[I 2022-04-21 11:48:56,909][0m Trial 634 finished with value: 0.6391504957543532 and parameters: {'splitter': 'best', 'min_samples_split': 0.1398852650313292, 'min_samples_leaf': 0.03384379388986276, 'min_weight_fraction_leaf': 0.014948140400545243, 'max_features': 0.8287583154519312}. Best is trial 507 with value: 0.6585778818712512.[0m
[32m[I 2022-04-21 11:48:57,714][0m Trial 635 finished with value: 0.6437701440045185 and parameters: {'splitter': 'best', 'min_samples_split': 0.17784901658098445, 'min_samples_leaf': 0.01950928834641478, 'min_weight_fraction_leaf': 0.008393298914227715, 'max_features': 0.5984207905261223}. Best is trial 507 with value: 0.6585778818712512.[0m
[32m[I 2022-04-21 11:48:58,171][0m Trial 636 finished with value: 0.6392372789519062 and parameters: {'splitter': 'best', 'min_samples_split': 0.16114672401652783, 'min_samples_leaf': 0.0010305754549347276, 'min_weight_fraction_leaf': 0.024485254181755053, 'max_features': 0.5771690283640071}. Best is trial 507 with value: 0.6585778818712512.[0m
[32m[I 2022-04-21 11:48:58,626][0m Trial 637 finished with value: 0.6182643120339524 and parameters: {'splitter': 'best', 'min_samples_split': 0.10862402567386771, 'min_samples_leaf': 0.01071500906923139, 'min_weight_fraction_leaf': 0.008296237022771973, 'max_features': 0.6580043328249937}. Best is trial 507 with value: 0.6585778818712512.[0m
[32m[I 2022-04-21 11:48:59,043][0m Trial 638 finished with value: 0.6393247034802176 and parameters: {'splitter': 'best', 'min_samples_split': 0.12525004276639054, 'min_samples_leaf': 0.027614469290297504, 'min_weight_fraction_leaf': 0.02003093179210029, 'max_features': 0.6263040293752469}. Best is trial 507 with value: 0.6585778818712512.[0m
[32m[I 2022-04-21 11:48:59,461][0m Trial 639 finished with value: 0.5341629278396185 and parameters: {'splitter': 'best', 'min_samples_split': 0.15343472802379868, 'min_samples_leaf': 0.017403675583558688, 'min_weight_fraction_leaf': 0.2743944596645869, 'max_features': 0.6039051883947807}. Best is trial 507 with value: 0.6585778818712512.[0m
[32m[I 2022-04-21 11:49:00,426][0m Trial 640 finished with value: 0.6163266768116893 and parameters: {'splitter': 'best', 'min_samples_split': 0.11391781356736193, 'min_samples_leaf': 0.009687903120395646, 'min_weight_fraction_leaf': 0.03489347802046775, 'max_features': 0.6755338054445571}. Best is trial 507 with value: 0.6585778818712512.[0m
[32m[I 2022-04-21 11:49:00,969][0m Trial 641 finished with value: 0.5979157103160713 and parameters: {'splitter': 'best', 'min_samples_split': 0.145965564010861, 'min_samples_leaf': 0.032331094571521404, 'min_weight_fraction_leaf': 0.08468546174091884, 'max_features': 0.6199872728037661}. Best is trial 507 with value: 0.6585778818712512.[0m
[32m[I 2022-04-21 11:49:01,564][0m Trial 642 finished with value: 0.6090998039879651 and parameters: {'splitter': 'best', 'min_samples_split': 0.12900044463104932, 'min_samples_leaf': 0.05706953995343931, 'min_weight_fraction_leaf': 0.014439327188130159, 'max_features': 0.6476190983813965}. Best is trial 507 with value: 0.6585778818712512.[0m
[32m[I 2022-04-21 11:49:02,590][0m Trial 643 finished with value: 0.6489583726648162 and parameters: {'splitter': 'best', 'min_samples_split': 0.17300849454686157, 'min_samples_leaf': 0.020544240362314985, 'min_weight_fraction_leaf': 0.009330852097465106, 'max_features': 0.7958822785514595}. Best is trial 507 with value: 0.6585778818712512.[0m
[32m[I 2022-04-21 11:49:02,812][0m Trial 644 finished with value: 0.5358564240914311 and parameters: {'splitter': 'best', 'min_samples_split': 0.1842481205674767, 'min_samples_leaf': 0.04934757439212765, 'min_weight_fraction_leaf': 0.3972680078019041, 'max_features': 0.7651081529666015}. Best is trial 507 with value: 0.6585778818712512.[0m
[32m[I 2022-04-21 11:49:03,442][0m Trial 645 finished with value: 0.6172098177213259 and parameters: {'splitter': 'best', 'min_samples_split': 0.16933616177344096, 'min_samples_leaf': 0.024447834145960662, 'min_weight_fraction_leaf': 0.024128499427101317, 'max_features': 0.7813882476744474}. Best is trial 507 with value: 0.6585778818712512.[0m
[32m[I 2022-04-21 11:49:03,889][0m Trial 646 finished with value: 0.6182683606206212 and parameters: {'splitter': 'best', 'min_samples_split': 0.17161408703718722, 'min_samples_leaf': 0.041958360231427266, 'min_weight_fraction_leaf': 0.1493133404706677, 'max_features': 0.7944278151836702}. Best is trial 507 with value: 0.6585778818712512.[0m
[32m[I 2022-04-21 11:49:04,410][0m Trial 647 finished with value: 0.5818573406056935 and parameters: {'splitter': 'best', 'min_samples_split': 0.1890851647908701, 'min_samples_leaf': 0.010207506514297263, 'min_weight_fraction_leaf': 0.0077367693576950525, 'max_features': 0.09905398434474488}. Best is trial 507 with value: 0.6585778818712512.[0m
[32m[I 2022-04-21 11:49:05,946][0m Trial 648 finished with value: 0.6102434232257714 and parameters: {'splitter': 'best', 'min_samples_split': 0.17671793835883393, 'min_samples_leaf': 0.0013456582677643, 'min_weight_fraction_leaf': 0.0005787222706319477, 'max_features': 0.5817032452681652}. Best is trial 507 with value: 0.6585778818712512.[0m
[32m[I 2022-04-21 11:49:06,315][0m Trial 649 finished with value: 0.6410051849472334 and parameters: {'splitter': 'best', 'min_samples_split': 0.16130782887466033, 'min_samples_leaf': 0.021397542886520713, 'min_weight_fraction_leaf': 0.00015645510619993213, 'max_features': 0.6344313598637644}. Best is trial 507 with value: 0.6585778818712512.[0m
[32m[I 2022-04-21 11:49:06,639][0m Trial 650 finished with value: 0.6250145887994251 and parameters: {'splitter': 'best', 'min_samples_split': 0.15958170252636952, 'min_samples_leaf': 0.03419507173247921, 'min_weight_fraction_leaf': 0.031059529048392136, 'max_features': 0.609671490602492}. Best is trial 507 with value: 0.6585778818712512.[0m
