[32m[I 2022-04-21 11:45:09,942][0m Trial 820 finished with value: 0.684367348820454 and parameters: {'alpha': 0.5385509342925332, 'ties': 'breslow'}. Best is trial 26 with value: 0.6847054012696481.[0m
[32m[I 2022-04-21 11:45:10,142][0m Trial 821 finished with value: 0.6847054012696481 and parameters: {'alpha': 0.7438321141298808, 'ties': 'breslow'}. Best is trial 26 with value: 0.6847054012696481.[0m
[32m[I 2022-04-21 11:45:10,357][0m Trial 822 finished with value: 0.6847054012696481 and parameters: {'alpha': 0.7347529469996337, 'ties': 'breslow'}. Best is trial 26 with value: 0.6847054012696481.[0m
[32m[I 2022-04-21 11:45:10,570][0m Trial 823 finished with value: 0.684367348820454 and parameters: {'alpha': 0.6615790390613594, 'ties': 'breslow'}. Best is trial 26 with value: 0.6847054012696481.[0m
[32m[I 2022-04-21 11:45:10,750][0m Trial 824 finished with value: 0.684367348820454 and parameters: {'alpha': 0.6078796873506122, 'ties': 'efron'}. Best is trial 26 with value: 0.6847054012696481.[0m
[32m[I 2022-04-21 11:45:10,955][0m Trial 825 finished with value: 0.6847054012696481 and parameters: {'alpha': 0.8086920091365526, 'ties': 'efron'}. Best is trial 26 with value: 0.6847054012696481.[0m
[32m[I 2022-04-21 11:45:11,178][0m Trial 826 finished with value: 0.6829090813866752 and parameters: {'alpha': 1.2418873436790043, 'ties': 'breslow'}. Best is trial 26 with value: 0.6847054012696481.[0m
[32m[I 2022-04-21 11:45:11,375][0m Trial 827 finished with value: 0.6847054012696481 and parameters: {'alpha': 0.8962975419791113, 'ties': 'breslow'}. Best is trial 26 with value: 0.6847054012696481.[0m
[32m[I 2022-04-21 11:45:11,609][0m Trial 828 finished with value: 0.6847054012696481 and parameters: {'alpha': 0.8503821998488784, 'ties': 'efron'}. Best is trial 26 with value: 0.6847054012696481.[0m
[32m[I 2022-04-21 11:45:11,783][0m Trial 829 finished with value: 0.6847054012696481 and parameters: {'alpha': 0.8570132339623096, 'ties': 'breslow'}. Best is trial 26 with value: 0.6847054012696481.[0m
[32m[I 2022-04-21 11:45:12,012][0m Trial 830 finished with value: 0.6847054012696481 and parameters: {'alpha': 0.8180069551146832, 'ties': 'breslow'}. Best is trial 26 with value: 0.6847054012696481.[0m
[32m[I 2022-04-21 11:45:12,223][0m Trial 831 finished with value: 0.6829090813866752 and parameters: {'alpha': 0.9974864066713789, 'ties': 'efron'}. Best is trial 26 with value: 0.6847054012696481.[0m
[32m[I 2022-04-21 11:45:12,499][0m Trial 832 finished with value: 0.6814469677485105 and parameters: {'alpha': 3.492356653492675, 'ties': 'efron'}. Best is trial 26 with value: 0.6847054012696481.[0m
[32m[I 2022-04-21 11:45:12,743][0m Trial 833 finished with value: 0.6829090813866752 and parameters: {'alpha': 1.0465747112560575, 'ties': 'efron'}. Best is trial 26 with value: 0.6847054012696481.[0m
[32m[I 2022-04-21 11:45:13,044][0m Trial 834 finished with value: 0.6829090813866752 and parameters: {'alpha': 1.1441595349550877, 'ties': 'efron'}. Best is trial 26 with value: 0.6847054012696481.[0m
[32m[I 2022-04-21 11:45:13,337][0m Trial 835 finished with value: 0.6829090813866752 and parameters: {'alpha': 0.9009891706144887, 'ties': 'efron'}. Best is trial 26 with value: 0.6847054012696481.[0m
[32m[I 2022-04-21 11:45:13,605][0m Trial 836 finished with value: 0.6847054012696481 and parameters: {'alpha': 0.845334866924204, 'ties': 'efron'}. Best is trial 26 with value: 0.6847054012696481.[0m
[32m[I 2022-04-21 11:45:13,958][0m Trial 837 finished with value: 0.6847054012696481 and parameters: {'alpha': 0.6994233213292471, 'ties': 'efron'}. Best is trial 26 with value: 0.6847054012696481.[0m
[32m[I 2022-04-21 11:45:14,300][0m Trial 838 finished with value: 0.684367348820454 and parameters: {'alpha': 0.6669588936792735, 'ties': 'efron'}. Best is trial 26 with value: 0.6847054012696481.[0m
[32m[I 2022-04-21 11:45:14,623][0m Trial 839 finished with value: 0.6847054012696481 and parameters: {'alpha': 0.7687202557102194, 'ties': 'efron'}. Best is trial 26 with value: 0.6847054012696481.[0m
[32m[I 2022-04-21 11:45:15,012][0m Trial 840 finished with value: 0.684367348820454 and parameters: {'alpha': 0.5467727210483393, 'ties': 'efron'}. Best is trial 26 with value: 0.6847054012696481.[0m
[32m[I 2022-04-21 11:45:15,287][0m Trial 841 finished with value: 0.6829090813866752 and parameters: {'alpha': 1.090385967699853, 'ties': 'breslow'}. Best is trial 26 with value: 0.6847054012696481.[0m
[32m[I 2022-04-21 11:45:15,600][0m Trial 842 finished with value: 0.6829090813866752 and parameters: {'alpha': 0.9661261021874606, 'ties': 'efron'}. Best is trial 26 with value: 0.6847054012696481.[0m
[32m[I 2022-04-21 11:45:15,866][0m Trial 843 finished with value: 0.6829090813866752 and parameters: {'alpha': 1.1391841080021186, 'ties': 'efron'}. Best is trial 26 with value: 0.6847054012696481.[0m
[32m[I 2022-04-21 11:45:16,158][0m Trial 844 finished with value: 0.6829090813866752 and parameters: {'alpha': 0.9594382435546427, 'ties': 'efron'}. Best is trial 26 with value: 0.6847054012696481.[0m
[32m[I 2022-04-21 11:45:16,284][0m Trial 845 finished with value: 0.6847054012696481 and parameters: {'alpha': 0.7970989736175952, 'ties': 'breslow'}. Best is trial 26 with value: 0.6847054012696481.[0m
[32m[I 2022-04-21 11:45:16,409][0m Trial 846 finished with value: 0.6829090813866752 and parameters: {'alpha': 0.9828760209920591, 'ties': 'breslow'}. Best is trial 26 with value: 0.6847054012696481.[0m
[32m[I 2022-04-21 11:45:16,535][0m Trial 847 finished with value: 0.6847054012696481 and parameters: {'alpha': 0.8703322321579353, 'ties': 'breslow'}. Best is trial 26 with value: 0.6847054012696481.[0m
[32m[I 2022-04-21 11:45:16,660][0m Trial 848 finished with value: 0.6847054012696481 and parameters: {'alpha': 0.760678783199171, 'ties': 'breslow'}. Best is trial 26 with value: 0.6847054012696481.[0m
[32m[I 2022-04-21 11:45:16,787][0m Trial 849 finished with value: 0.6847054012696481 and parameters: {'alpha': 0.7418288923834033, 'ties': 'breslow'}. Best is trial 26 with value: 0.6847054012696481.[0m
[32m[I 2022-04-21 11:45:16,924][0m Trial 850 finished with value: 0.684367348820454 and parameters: {'alpha': 0.6137909600582548, 'ties': 'efron'}. Best is trial 26 with value: 0.6847054012696481.[0m
[32m[I 2022-04-21 11:45:17,062][0m Trial 851 finished with value: 0.6829090813866752 and parameters: {'alpha': 0.8867425103370543, 'ties': 'efron'}. Best is trial 26 with value: 0.6847054012696481.[0m
[32m[I 2022-04-21 11:45:17,206][0m Trial 852 finished with value: 0.6829090813866752 and parameters: {'alpha': 1.0420526025047512, 'ties': 'efron'}. Best is trial 26 with value: 0.6847054012696481.[0m
[32m[I 2022-04-21 11:45:17,345][0m Trial 853 finished with value: 0.6829090813866752 and parameters: {'alpha': 0.962584074877172, 'ties': 'efron'}. Best is trial 26 with value: 0.6847054012696481.[0m
[32m[I 2022-04-21 11:45:17,483][0m Trial 854 finished with value: 0.6847054012696481 and parameters: {'alpha': 0.8513173069935331, 'ties': 'efron'}. Best is trial 26 with value: 0.6847054012696481.[0m
[32m[I 2022-04-21 11:45:17,624][0m Trial 855 finished with value: 0.6829496894793843 and parameters: {'alpha': 2.8036296459837278, 'ties': 'efron'}. Best is trial 26 with value: 0.6847054012696481.[0m
[32m[I 2022-04-21 11:45:17,763][0m Trial 856 finished with value: 0.6829090813866752 and parameters: {'alpha': 0.9619317389879903, 'ties': 'efron'}. Best is trial 26 with value: 0.6847054012696481.[0m
[32m[I 2022-04-21 11:45:17,936][0m Trial 857 finished with value: 0.6829090813866752 and parameters: {'alpha': 1.1770303730588236, 'ties': 'breslow'}. Best is trial 26 with value: 0.6847054012696481.[0m
[32m[I 2022-04-21 11:45:18,119][0m Trial 858 finished with value: 0.6847054012696481 and parameters: {'alpha': 0.850979020759985, 'ties': 'breslow'}. Best is trial 26 with value: 0.6847054012696481.[0m
[32m[I 2022-04-21 11:45:18,249][0m Trial 859 finished with value: 0.6829090813866752 and parameters: {'alpha': 1.0354437676291968, 'ties': 'breslow'}. Best is trial 26 with value: 0.6847054012696481.[0m
[32m[I 2022-04-21 11:45:18,390][0m Trial 860 finished with value: 0.6847054012696481 and parameters: {'alpha': 0.7660530247892678, 'ties': 'efron'}. Best is trial 26 with value: 0.6847054012696481.[0m
[32m[I 2022-04-21 11:45:18,519][0m Trial 861 finished with value: 0.682613451992282 and parameters: {'alpha': 2.3984465471665093, 'ties': 'breslow'}. Best is trial 26 with value: 0.6847054012696481.[0m
[32m[I 2022-04-21 11:45:18,646][0m Trial 862 finished with value: 0.6829090813866752 and parameters: {'alpha': 1.0733545758848677, 'ties': 'breslow'}. Best is trial 26 with value: 0.6847054012696481.[0m
[32m[I 2022-04-21 11:45:18,787][0m Trial 863 finished with value: 0.6847054012696481 and parameters: {'alpha': 0.8205326284379726, 'ties': 'efron'}. Best is trial 26 with value: 0.6847054012696481.[0m
[32m[I 2022-04-21 11:45:18,926][0m Trial 864 finished with value: 0.6847054012696481 and parameters: {'alpha': 0.6957027046674213, 'ties': 'efron'}. Best is trial 26 with value: 0.6847054012696481.[0m
[32m[I 2022-04-21 11:45:19,055][0m Trial 865 finished with value: 0.6847054012696481 and parameters: {'alpha': 0.9369355496277452, 'ties': 'breslow'}. Best is trial 26 with value: 0.6847054012696481.[0m
[32m[I 2022-04-21 11:45:19,182][0m Trial 866 finished with value: 0.684367348820454 and parameters: {'alpha': 0.6636733781413444, 'ties': 'breslow'}. Best is trial 26 with value: 0.6847054012696481.[0m
[32m[I 2022-04-21 11:45:19,333][0m Trial 867 finished with value: 0.6847054012696481 and parameters: {'alpha': 0.8042988067510838, 'ties': 'efron'}. Best is trial 26 with value: 0.6847054012696481.[0m
[32m[I 2022-04-21 11:45:19,472][0m Trial 868 finished with value: 0.6829090813866752 and parameters: {'alpha': 1.2622726789181562, 'ties': 'breslow'}. Best is trial 26 with value: 0.6847054012696481.[0m
[32m[I 2022-04-21 11:45:19,617][0m Trial 869 finished with value: 0.6814469677485105 and parameters: {'alpha': 3.84400944893563, 'ties': 'efron'}. Best is trial 26 with value: 0.6847054012696481.[0m
[32m[I 2022-04-21 11:45:19,746][0m Trial 870 finished with value: 0.684367348820454 and parameters: {'alpha': 0.3936846606190285, 'ties': 'breslow'}. Best is trial 26 with value: 0.6847054012696481.[0m
[32m[I 2022-04-21 11:45:19,889][0m Trial 871 finished with value: 0.6847054012696481 and parameters: {'alpha': 0.8466587857592293, 'ties': 'efron'}. Best is trial 26 with value: 0.6847054012696481.[0m
[32m[I 2022-04-21 11:45:20,030][0m Trial 872 finished with value: 0.6847054012696481 and parameters: {'alpha': 0.8296315439679988, 'ties': 'efron'}. Best is trial 26 with value: 0.6847054012696481.[0m
[32m[I 2022-04-21 11:45:20,160][0m Trial 873 finished with value: 0.6847054012696481 and parameters: {'alpha': 0.9010897578705059, 'ties': 'breslow'}. Best is trial 26 with value: 0.6847054012696481.[0m
[32m[I 2022-04-21 11:45:20,424][0m Trial 874 finished with value: 0.6847054012696481 and parameters: {'alpha': 0.7847398917111362, 'ties': 'breslow'}. Best is trial 26 with value: 0.6847054012696481.[0m
[32m[I 2022-04-21 11:45:20,844][0m Trial 875 finished with value: 0.6847054012696481 and parameters: {'alpha': 0.8394246745356868, 'ties': 'efron'}. Best is trial 26 with value: 0.6847054012696481.[0m
[32m[I 2022-04-21 11:45:21,178][0m Trial 876 finished with value: 0.6829090813866752 and parameters: {'alpha': 0.8858524060580956, 'ties': 'efron'}. Best is trial 26 with value: 0.6847054012696481.[0m
[32m[I 2022-04-21 11:45:21,512][0m Trial 877 finished with value: 0.684367348820454 and parameters: {'alpha': 0.47083684692355465, 'ties': 'efron'}. Best is trial 26 with value: 0.6847054012696481.[0m
[32m[I 2022-04-21 11:45:21,896][0m Trial 878 finished with value: 0.684367348820454 and parameters: {'alpha': 0.5608327293417202, 'ties': 'efron'}. Best is trial 26 with value: 0.6847054012696481.[0m
[32m[I 2022-04-21 11:45:22,245][0m Trial 879 finished with value: 0.684367348820454 and parameters: {'alpha': 0.6722536000871437, 'ties': 'efron'}. Best is trial 26 with value: 0.6847054012696481.[0m
[32m[I 2022-04-21 11:45:22,480][0m Trial 880 finished with value: 0.684367348820454 and parameters: {'alpha': 0.5831270553914552, 'ties': 'efron'}. Best is trial 26 with value: 0.6847054012696481.[0m
[32m[I 2022-04-21 11:45:22,676][0m Trial 881 finished with value: 0.684367348820454 and parameters: {'alpha': 0.699558989646179, 'ties': 'breslow'}. Best is trial 26 with value: 0.6847054012696481.[0m
[32m[I 2022-04-21 11:45:23,040][0m Trial 882 finished with value: 0.684367348820454 and parameters: {'alpha': 0.6213813242270746, 'ties': 'breslow'}. Best is trial 26 with value: 0.6847054012696481.[0m
[32m[I 2022-04-21 11:45:23,308][0m Trial 883 finished with value: 0.6847054012696481 and parameters: {'alpha': 0.7285667753823274, 'ties': 'breslow'}. Best is trial 26 with value: 0.6847054012696481.[0m
[32m[I 2022-04-21 11:45:23,440][0m Trial 884 finished with value: 0.6847054012696481 and parameters: {'alpha': 0.719837625383206, 'ties': 'breslow'}. Best is trial 26 with value: 0.6847054012696481.[0m
[32m[I 2022-04-21 11:45:23,578][0m Trial 885 finished with value: 0.6847054012696481 and parameters: {'alpha': 0.7370904210203756, 'ties': 'efron'}. Best is trial 26 with value: 0.6847054012696481.[0m
[32m[I 2022-04-21 11:45:23,838][0m Trial 886 finished with value: 0.6829090813866752 and parameters: {'alpha': 0.9242819806517643, 'ties': 'efron'}. Best is trial 26 with value: 0.6847054012696481.[0m
[32m[I 2022-04-21 11:45:24,106][0m Trial 887 finished with value: 0.6829090813866752 and parameters: {'alpha': 0.9839716741550253, 'ties': 'efron'}. Best is trial 26 with value: 0.6847054012696481.[0m
[32m[I 2022-04-21 11:45:24,460][0m Trial 888 finished with value: 0.6829090813866752 and parameters: {'alpha': 0.9367033961720588, 'ties': 'efron'}. Best is trial 26 with value: 0.6847054012696481.[0m
[32m[I 2022-04-21 11:45:24,722][0m Trial 889 finished with value: 0.6829090813866752 and parameters: {'alpha': 1.0124900278956288, 'ties': 'breslow'}. Best is trial 26 with value: 0.6847054012696481.[0m
[32m[I 2022-04-21 11:45:24,985][0m Trial 890 finished with value: 0.6847054012696481 and parameters: {'alpha': 0.903148657548887, 'ties': 'breslow'}. Best is trial 26 with value: 0.6847054012696481.[0m
[32m[I 2022-04-21 11:45:25,259][0m Trial 891 finished with value: 0.6829090813866752 and parameters: {'alpha': 1.2051881267773026, 'ties': 'efron'}. Best is trial 26 with value: 0.6847054012696481.[0m
[32m[I 2022-04-21 11:45:25,499][0m Trial 892 finished with value: 0.684367348820454 and parameters: {'alpha': 0.2632767540297256, 'ties': 'breslow'}. Best is trial 26 with value: 0.6847054012696481.[0m
[32m[I 2022-04-21 11:45:25,781][0m Trial 893 finished with value: 0.6829090813866752 and parameters: {'alpha': 1.0601584593323672, 'ties': 'efron'}. Best is trial 26 with value: 0.6847054012696481.[0m
[32m[I 2022-04-21 11:45:25,922][0m Trial 894 finished with value: 0.6847054012696481 and parameters: {'alpha': 0.8625207735070569, 'ties': 'efron'}. Best is trial 26 with value: 0.6847054012696481.[0m
[32m[I 2022-04-21 11:45:26,064][0m Trial 895 finished with value: 0.6829090813866752 and parameters: {'alpha': 1.0948368946047742, 'ties': 'breslow'}. Best is trial 26 with value: 0.6847054012696481.[0m
[32m[I 2022-04-21 11:45:26,228][0m Trial 896 finished with value: 0.6829090813866752 and parameters: {'alpha': 1.151753592148142, 'ties': 'efron'}. Best is trial 26 with value: 0.6847054012696481.[0m
[32m[I 2022-04-21 11:45:26,374][0m Trial 897 finished with value: 0.6829090813866752 and parameters: {'alpha': 1.009056019662183, 'ties': 'efron'}. Best is trial 26 with value: 0.6847054012696481.[0m
[32m[I 2022-04-21 11:45:26,516][0m Trial 898 finished with value: 0.6829090813866752 and parameters: {'alpha': 0.9408283603934064, 'ties': 'efron'}. Best is trial 26 with value: 0.6847054012696481.[0m
[32m[I 2022-04-21 11:45:26,657][0m Trial 899 finished with value: 0.6829090813866752 and parameters: {'alpha': 0.8933182614556535, 'ties': 'efron'}. Best is trial 26 with value: 0.6847054012696481.[0m
[32m[I 2022-04-21 11:45:26,797][0m Trial 900 finished with value: 0.6829090813866752 and parameters: {'alpha': 0.9805206594735444, 'ties': 'efron'}. Best is trial 26 with value: 0.6847054012696481.[0m
[32m[I 2022-04-21 11:45:27,085][0m Trial 901 finished with value: 0.6829090813866752 and parameters: {'alpha': 0.895373270265468, 'ties': 'efron'}. Best is trial 26 with value: 0.6847054012696481.[0m
[32m[I 2022-04-21 11:45:27,358][0m Trial 902 finished with value: 0.6847054012696481 and parameters: {'alpha': 0.842008960012533, 'ties': 'efron'}. Best is trial 26 with value: 0.6847054012696481.[0m
[32m[I 2022-04-21 11:45:27,619][0m Trial 903 finished with value: 0.684367348820454 and parameters: {'alpha': 0.48336272169902916, 'ties': 'breslow'}. Best is trial 26 with value: 0.6847054012696481.[0m
[32m[I 2022-04-21 11:45:27,896][0m Trial 904 finished with value: 0.684367348820454 and parameters: {'alpha': 0.5737383697691641, 'ties': 'breslow'}. Best is trial 26 with value: 0.6847054012696481.[0m
[32m[I 2022-04-21 11:45:28,153][0m Trial 905 finished with value: 0.684367348820454 and parameters: {'alpha': 0.6647397734453866, 'ties': 'breslow'}. Best is trial 26 with value: 0.6847054012696481.[0m
[32m[I 2022-04-21 11:45:28,486][0m Trial 906 finished with value: 0.6847054012696481 and parameters: {'alpha': 0.7981273182670495, 'ties': 'efron'}. Best is trial 26 with value: 0.6847054012696481.[0m
[32m[I 2022-04-21 11:45:28,868][0m Trial 907 finished with value: 0.6847054012696481 and parameters: {'alpha': 0.810293515052352, 'ties': 'breslow'}. Best is trial 26 with value: 0.6847054012696481.[0m
[32m[I 2022-04-21 11:45:29,176][0m Trial 908 finished with value: 0.6847054012696481 and parameters: {'alpha': 0.7862745325613018, 'ties': 'breslow'}. Best is trial 26 with value: 0.6847054012696481.[0m
[32m[I 2022-04-21 11:45:29,487][0m Trial 909 finished with value: 0.6847054012696481 and parameters: {'alpha': 0.8107797181421922, 'ties': 'breslow'}. Best is trial 26 with value: 0.6847054012696481.[0m
[32m[I 2022-04-21 11:45:29,905][0m Trial 910 finished with value: 0.6847054012696481 and parameters: {'alpha': 0.7559832028288358, 'ties': 'breslow'}. Best is trial 26 with value: 0.6847054012696481.[0m
[32m[I 2022-04-21 11:45:30,321][0m Trial 911 finished with value: 0.6829090813866752 and parameters: {'alpha': 1.01307185464038, 'ties': 'breslow'}. Best is trial 26 with value: 0.6847054012696481.[0m
[32m[I 2022-04-21 11:45:30,665][0m Trial 912 finished with value: 0.684367348820454 and parameters: {'alpha': 0.4147027480646252, 'ties': 'efron'}. Best is trial 26 with value: 0.6847054012696481.[0m
[32m[I 2022-04-21 11:45:30,805][0m Trial 913 finished with value: 0.6829090813866752 and parameters: {'alpha': 1.0860365792877933, 'ties': 'breslow'}. Best is trial 26 with value: 0.6847054012696481.[0m
[32m[I 2022-04-21 11:45:30,946][0m Trial 914 finished with value: 0.6829090813866752 and parameters: {'alpha': 0.9522735128392553, 'ties': 'breslow'}. Best is trial 26 with value: 0.6847054012696481.[0m
[32m[I 2022-04-21 11:45:31,104][0m Trial 915 finished with value: 0.684367348820454 and parameters: {'alpha': 0.552530657687474, 'ties': 'efron'}. Best is trial 26 with value: 0.6847054012696481.[0m
[32m[I 2022-04-21 11:45:31,437][0m Trial 916 finished with value: 0.684367348820454 and parameters: {'alpha': 0.662770221445764, 'ties': 'breslow'}. Best is trial 26 with value: 0.6847054012696481.[0m
[32m[I 2022-04-21 11:45:31,828][0m Trial 917 finished with value: 0.684367348820454 and parameters: {'alpha': 0.6416796258131843, 'ties': 'breslow'}. Best is trial 26 with value: 0.6847054012696481.[0m
[32m[I 2022-04-21 11:45:32,220][0m Trial 918 finished with value: 0.6847054012696481 and parameters: {'alpha': 0.7099554516976244, 'ties': 'efron'}. Best is trial 26 with value: 0.6847054012696481.[0m
[32m[I 2022-04-21 11:45:32,812][0m Trial 919 finished with value: 0.6814469677485105 and parameters: {'alpha': 4.399097687045099, 'ties': 'breslow'}. Best is trial 26 with value: 0.6847054012696481.[0m
[32m[I 2022-04-21 11:45:33,138][0m Trial 920 finished with value: 0.6847054012696481 and parameters: {'alpha': 0.6990143266583813, 'ties': 'efron'}. Best is trial 26 with value: 0.6847054012696481.[0m
[32m[I 2022-04-21 11:45:33,409][0m Trial 921 finished with value: 0.6836276093398644 and parameters: {'alpha': 2.0815858246725223, 'ties': 'breslow'}. Best is trial 26 with value: 0.6847054012696481.[0m
[32m[I 2022-04-21 11:45:33,727][0m Trial 922 finished with value: 0.6829090813866752 and parameters: {'alpha': 0.9347755777189528, 'ties': 'efron'}. Best is trial 26 with value: 0.6847054012696481.[0m
[32m[I 2022-04-21 11:45:34,291][0m Trial 923 finished with value: 0.6847054012696481 and parameters: {'alpha': 0.7572940897494836, 'ties': 'efron'}. Best is trial 26 with value: 0.6847054012696481.[0m
[32m[I 2022-04-21 11:45:34,470][0m Trial 924 finished with value: 0.6847054012696481 and parameters: {'alpha': 0.8127244368852528, 'ties': 'breslow'}. Best is trial 26 with value: 0.6847054012696481.[0m
[32m[I 2022-04-21 11:45:34,646][0m Trial 925 finished with value: 0.6847054012696481 and parameters: {'alpha': 0.7678538516184058, 'ties': 'breslow'}. Best is trial 26 with value: 0.6847054012696481.[0m
[32m[I 2022-04-21 11:45:34,854][0m Trial 926 finished with value: 0.6847054012696481 and parameters: {'alpha': 0.810079383193214, 'ties': 'breslow'}. Best is trial 26 with value: 0.6847054012696481.[0m
