[32m[I 2022-04-21 17:40:53,969][0m Trial 403 finished with value: 0.8402944371034883 and parameters: {'loss': 'coxph', 'learning_rate': 5.58619576090583e-05, 'n_estimators': 212, 'criterion': 'friedman_mse', 'min_samples_split': 3, 'min_samples_leaf': 1, 'min_weight_fraction_leaf': 0.18934654447013127, 'min_impurity_decrease': 0.3403404652659913, 'max_features': 0.22874024598251028, 'subsample': 0.14396610224178918, 'dropout_rate': 0.10291512043280121, 'ccp_alpha': 0.18444287847472224}. Best is trial 244 with value: 0.8474070660226068.[0m
[32m[I 2022-04-21 17:41:06,448][0m Trial 404 finished with value: 0.8418545165647519 and parameters: {'loss': 'coxph', 'learning_rate': 7.447621938429435e-05, 'n_estimators': 280, 'criterion': 'friedman_mse', 'min_samples_split': 4, 'min_samples_leaf': 1, 'min_weight_fraction_leaf': 0.20633553977782781, 'min_impurity_decrease': 0.2621979304606868, 'max_features': 0.46945232225318345, 'subsample': 0.23051092479210245, 'dropout_rate': 0.5710105660049345, 'ccp_alpha': 0.15316646020346336}. Best is trial 244 with value: 0.8474070660226068.[0m
[32m[I 2022-04-21 17:41:34,413][0m Trial 405 finished with value: 0.8426832178018753 and parameters: {'loss': 'coxph', 'learning_rate': 0.00010945004867116427, 'n_estimators': 300, 'criterion': 'friedman_mse', 'min_samples_split': 3, 'min_samples_leaf': 1, 'min_weight_fraction_leaf': 0.3729339790509747, 'min_impurity_decrease': 0.2884814832971929, 'max_features': 0.6731851435029208, 'subsample': 0.054116435599067654, 'dropout_rate': 0.034205884392738486, 'ccp_alpha': 0.0034637537778542697}. Best is trial 244 with value: 0.8474070660226068.[0m
[32m[I 2022-04-21 17:41:51,052][0m Trial 406 finished with value: 0.8386541561942943 and parameters: {'loss': 'coxph', 'learning_rate': 4.9115880061033515e-05, 'n_estimators': 269, 'criterion': 'friedman_mse', 'min_samples_split': 3, 'min_samples_leaf': 1, 'min_weight_fraction_leaf': 0.1744381915342375, 'min_impurity_decrease': 0.3097283647181205, 'max_features': 0.3312947887467307, 'subsample': 0.10200175071811811, 'dropout_rate': 0.2293938402553452, 'ccp_alpha': 0.2727374596464177}. Best is trial 244 with value: 0.8474070660226068.[0m
[32m[I 2022-04-21 17:42:04,218][0m Trial 407 finished with value: 0.65 and parameters: {'loss': 'coxph', 'learning_rate': 0.00012432401522096737, 'n_estimators': 232, 'criterion': 'friedman_mse', 'min_samples_split': 6, 'min_samples_leaf': 1, 'min_weight_fraction_leaf': 0.1957206211766472, 'min_impurity_decrease': 0.22310907466646737, 'max_features': 0.3700379307454884, 'subsample': 0.12154873899312327, 'dropout_rate': 0.1296878676796583, 'ccp_alpha': 3.1189677566156275}. Best is trial 244 with value: 0.8474070660226068.[0m
[32m[I 2022-04-21 17:42:37,719][0m Trial 408 finished with value: 0.844438701750543 and parameters: {'loss': 'coxph', 'learning_rate': 8.666765560792108e-05, 'n_estimators': 335, 'criterion': 'friedman_mse', 'min_samples_split': 3, 'min_samples_leaf': 1, 'min_weight_fraction_leaf': 0.1835513281951078, 'min_impurity_decrease': 0.34876743033782587, 'max_features': 0.9462814468796558, 'subsample': 0.08118923257057542, 'dropout_rate': 0.15717973115490916, 'ccp_alpha': 0.09060504804877433}. Best is trial 244 with value: 0.8474070660226068.[0m
[32m[I 2022-04-21 17:42:51,950][0m Trial 409 finished with value: 0.6849083140363815 and parameters: {'loss': 'coxph', 'learning_rate': 0.00014120755311148185, 'n_estimators': 290, 'criterion': 'absolute_error', 'min_samples_split': 3, 'min_samples_leaf': 2, 'min_weight_fraction_leaf': 0.16977467813827868, 'min_impurity_decrease': 0.8031398171903394, 'max_features': 0.27440194585354966, 'subsample': 0.042401237669387346, 'dropout_rate': 0.30330883807835607, 'ccp_alpha': 0.4051863436179707}. Best is trial 244 with value: 0.8474070660226068.[0m
[32m[I 2022-04-21 17:43:01,844][0m Trial 410 finished with value: 0.65 and parameters: {'loss': 'coxph', 'learning_rate': 0.0062560423246269346, 'n_estimators': 260, 'criterion': 'squared_error', 'min_samples_split': 4, 'min_samples_leaf': 1, 'min_weight_fraction_leaf': 0.2053244443732534, 'min_impurity_decrease': 0.3234099289779928, 'max_features': 0.3183466789123317, 'subsample': 0.07001076157879926, 'dropout_rate': 0.384577432125103, 'ccp_alpha': 2.135076444222937}. Best is trial 244 with value: 0.8474070660226068.[0m
[32m[I 2022-04-21 17:43:28,252][0m Trial 411 finished with value: 0.65 and parameters: {'loss': 'coxph', 'learning_rate': 6.724800674974687e-05, 'n_estimators': 306, 'criterion': 'friedman_mse', 'min_samples_split': 3, 'min_samples_leaf': 2, 'min_weight_fraction_leaf': 0.1856109378921622, 'min_impurity_decrease': 0.17743900808047217, 'max_features': 0.38501993228397047, 'subsample': 0.47232401747796166, 'dropout_rate': 0.09180144532578458, 'ccp_alpha': 4.269424435031257}. Best is trial 244 with value: 0.8474070660226068.[0m
[32m[I 2022-04-21 17:43:45,506][0m Trial 412 finished with value: 0.8447619207072599 and parameters: {'loss': 'coxph', 'learning_rate': 0.013505049036470916, 'n_estimators': 243, 'criterion': 'friedman_mse', 'min_samples_split': 3, 'min_samples_leaf': 2, 'min_weight_fraction_leaf': 0.1959593626983908, 'min_impurity_decrease': 0.2923380500794654, 'max_features': 0.2873560441076284, 'subsample': 0.10444818967722845, 'dropout_rate': 0.1852365398039808, 'ccp_alpha': 0.09010865123092374}. Best is trial 244 with value: 0.8474070660226068.[0m
[32m[I 2022-04-21 17:44:13,334][0m Trial 413 finished with value: 0.8415702207406979 and parameters: {'loss': 'coxph', 'learning_rate': 0.00010994513833027161, 'n_estimators': 280, 'criterion': 'friedman_mse', 'min_samples_split': 3, 'min_samples_leaf': 2, 'min_weight_fraction_leaf': 0.16548020700960453, 'min_impurity_decrease': 0.36328784966139316, 'max_features': 0.2502048894986559, 'subsample': 0.08675077160167893, 'dropout_rate': 0.06485035573380235, 'ccp_alpha': 0.0017965137892150774}. Best is trial 244 with value: 0.8474070660226068.[0m
[32m[I 2022-04-21 17:44:44,466][0m Trial 414 finished with value: 0.8416965614647065 and parameters: {'loss': 'coxph', 'learning_rate': 3.348050356918982e-05, 'n_estimators': 318, 'criterion': 'friedman_mse', 'min_samples_split': 3, 'min_samples_leaf': 2, 'min_weight_fraction_leaf': 0.21334834717368784, 'min_impurity_decrease': 0.2604530244901704, 'max_features': 0.41041875662311694, 'subsample': 0.12766479090365535, 'dropout_rate': 0.12423729051811642, 'ccp_alpha': 0.22169327500555078}. Best is trial 244 with value: 0.8474070660226068.[0m
[32m[I 2022-04-21 17:44:59,884][0m Trial 415 finished with value: 0.65 and parameters: {'loss': 'coxph', 'learning_rate': 0.003606465458901327, 'n_estimators': 254, 'criterion': 'friedman_mse', 'min_samples_split': 4, 'min_samples_leaf': 1, 'min_weight_fraction_leaf': 0.17948606842972203, 'min_impurity_decrease': 0.3868807554707334, 'max_features': 0.3485552315208642, 'subsample': 0.026272702768236546, 'dropout_rate': 0.17001525825447666, 'ccp_alpha': 0.32660869379442886}. Best is trial 244 with value: 0.8474070660226068.[0m
[32m[I 2022-04-21 17:45:21,841][0m Trial 416 finished with value: 0.845455889044452 and parameters: {'loss': 'coxph', 'learning_rate': 0.0001397340555745931, 'n_estimators': 296, 'criterion': 'friedman_mse', 'min_samples_split': 3, 'min_samples_leaf': 2, 'min_weight_fraction_leaf': 0.19149994259626454, 'min_impurity_decrease': 0.33829430364296864, 'max_features': 0.30050750550322963, 'subsample': 0.05746607872171907, 'dropout_rate': 0.14297038519128907, 'ccp_alpha': 0.14982238972833256}. Best is trial 244 with value: 0.8474070660226068.[0m
[32m[I 2022-04-21 17:45:36,969][0m Trial 417 finished with value: 0.8434624745886243 and parameters: {'loss': 'coxph', 'learning_rate': 7.982769471181288e-05, 'n_estimators': 277, 'criterion': 'friedman_mse', 'min_samples_split': 3, 'min_samples_leaf': 2, 'min_weight_fraction_leaf': 0.20182141327488096, 'min_impurity_decrease': 0.31185910199757616, 'max_features': 0.6477304161204835, 'subsample': 0.3804334961167842, 'dropout_rate': 0.20790626362401515, 'ccp_alpha': 0.08151403273411444}. Best is trial 244 with value: 0.8474070660226068.[0m
/media/san2_ssd/data/Workdir/survival/venv/lib/python3.8/site-packages/sksurv/ensemble/boosting.py:955: RuntimeWarning: divide by zero encountered in log
  time = numpy.log(time)
/media/san2_ssd/data/Workdir/survival/venv/lib/python3.8/site-packages/sksurv/ensemble/boosting.py:955: RuntimeWarning: divide by zero encountered in log
  time = numpy.log(time)
/media/san2_ssd/data/Workdir/survival/venv/lib/python3.8/site-packages/sksurv/ensemble/boosting.py:955: RuntimeWarning: divide by zero encountered in log
  time = numpy.log(time)
/media/san2_ssd/data/Workdir/survival/venv/lib/python3.8/site-packages/sksurv/ensemble/boosting.py:955: RuntimeWarning: divide by zero encountered in log
  time = numpy.log(time)
[32m[I 2022-04-21 17:45:39,349][0m Trial 418 finished with value: -0.46505599239881634 and parameters: {'loss': 'squared', 'learning_rate': 4.342045549827848e-05, 'n_estimators': 264, 'criterion': 'friedman_mse', 'min_samples_split': 8, 'min_samples_leaf': 2, 'min_weight_fraction_leaf': 0.17237299575579124, 'min_impurity_decrease': 0.24290656227061805, 'max_features': 0.3625587124258935, 'subsample': 0.15306684817159755, 'dropout_rate': 0.10920634761655164, 'ccp_alpha': 0.2382109065906366}. Best is trial 244 with value: 0.8474070660226068.[0m
[32m[I 2022-04-21 17:45:50,624][0m Trial 419 finished with value: 0.7140430716543434 and parameters: {'loss': 'coxph', 'learning_rate': 0.00010497289976387571, 'n_estimators': 229, 'criterion': 'friedman_mse', 'min_samples_split': 6, 'min_samples_leaf': 1, 'min_weight_fraction_leaf': 0.15860421157871138, 'min_impurity_decrease': 0.35693825324265616, 'max_features': 0.33436780459618354, 'subsample': 0.8640884288856407, 'dropout_rate': 0.25677147450309834, 'ccp_alpha': 0.16405995295923456}. Best is trial 244 with value: 0.8474070660226068.[0m
[32m[I 2022-04-21 17:46:10,134][0m Trial 420 finished with value: 0.7425029696984659 and parameters: {'loss': 'coxph', 'learning_rate': 0.00015533005433243047, 'n_estimators': 326, 'criterion': 'friedman_mse', 'min_samples_split': 3, 'min_samples_leaf': 2, 'min_weight_fraction_leaf': 0.45594045438901926, 'min_impurity_decrease': 0.29372877993471846, 'max_features': 0.6106106128577028, 'subsample': 0.10543746469091343, 'dropout_rate': 0.16204316897515939, 'ccp_alpha': 0.10457200767358693}. Best is trial 244 with value: 0.8474070660226068.[0m
[32m[I 2022-04-21 17:46:42,403][0m Trial 421 finished with value: 0.8416961068650242 and parameters: {'loss': 'coxph', 'learning_rate': 0.009991251731825032, 'n_estimators': 361, 'criterion': 'friedman_mse', 'min_samples_split': 2, 'min_samples_leaf': 2, 'min_weight_fraction_leaf': 0.18058564415510944, 'min_impurity_decrease': 0.33035448484269914, 'max_features': 0.2591810230642947, 'subsample': 0.07709285496656412, 'dropout_rate': 0.05017531649298382, 'ccp_alpha': 0.3439425087766749}. Best is trial 244 with value: 0.8474070660226068.[0m
[32m[I 2022-04-21 17:47:51,815][0m Trial 422 finished with value: 0.8436079150606346 and parameters: {'loss': 'coxph', 'learning_rate': 5.681423952553965e-05, 'n_estimators': 587, 'criterion': 'friedman_mse', 'min_samples_split': 3, 'min_samples_leaf': 2, 'min_weight_fraction_leaf': 0.2085222087381941, 'min_impurity_decrease': 0.27082942181350783, 'max_features': 0.302870661718703, 'subsample': 0.1262698630829946, 'dropout_rate': 0.1338182357219446, 'ccp_alpha': 0.07569905007561042}. Best is trial 244 with value: 0.8474070660226068.[0m
[32m[I 2022-04-21 17:48:19,390][0m Trial 423 finished with value: 0.65 and parameters: {'loss': 'coxph', 'learning_rate': 8.510980370415196e-05, 'n_estimators': 306, 'criterion': 'friedman_mse', 'min_samples_split': 3, 'min_samples_leaf': 8, 'min_weight_fraction_leaf': 0.1905436277450756, 'min_impurity_decrease': 0.3773632284151829, 'max_features': 0.863131990946089, 'subsample': 0.04865799461381071, 'dropout_rate': 0.07807466017211259, 'ccp_alpha': 0.8905554959942061}. Best is trial 244 with value: 0.8474070660226068.[0m
[32m[I 2022-04-21 17:48:32,448][0m Trial 424 finished with value: 0.8449449930734236 and parameters: {'loss': 'coxph', 'learning_rate': 0.0001200605200812733, 'n_estimators': 244, 'criterion': 'friedman_mse', 'min_samples_split': 3, 'min_samples_leaf': 1, 'min_weight_fraction_leaf': 0.2192870033079793, 'min_impurity_decrease': 0.3173593084966274, 'max_features': 0.4256833562265422, 'subsample': 0.08793939986212726, 'dropout_rate': 0.010134951723270724, 'ccp_alpha': 0.009227674266681404}. Best is trial 244 with value: 0.8474070660226068.[0m
[32m[I 2022-04-21 17:48:43,729][0m Trial 425 finished with value: 0.846097995697658 and parameters: {'loss': 'coxph', 'learning_rate': 0.0047952471628248455, 'n_estimators': 291, 'criterion': 'friedman_mse', 'min_samples_split': 4, 'min_samples_leaf': 2, 'min_weight_fraction_leaf': 0.16752600115648827, 'min_impurity_decrease': 0.29268117004485333, 'max_features': 0.3179157279657821, 'subsample': 0.06985401507899709, 'dropout_rate': 0.4846084148178013, 'ccp_alpha': 0.24369007355560707}. Best is trial 244 with value: 0.8474070660226068.[0m
[32m[I 2022-04-21 17:49:03,275][0m Trial 426 finished with value: 0.65 and parameters: {'loss': 'coxph', 'learning_rate': 0.00294952819556052, 'n_estimators': 291, 'criterion': 'friedman_mse', 'min_samples_split': 4, 'min_samples_leaf': 2, 'min_weight_fraction_leaf': 0.16788236559599287, 'min_impurity_decrease': 0.2553843425844179, 'max_features': 0.34199765444902647, 'subsample': 0.934513398040745, 'dropout_rate': 0.19427650196994073, 'ccp_alpha': 0.37316315163927927}. Best is trial 244 with value: 0.8474070660226068.[0m
[32m[I 2022-04-21 17:49:18,310][0m Trial 427 finished with value: 0.65 and parameters: {'loss': 'coxph', 'learning_rate': 0.005163151768484886, 'n_estimators': 309, 'criterion': 'friedman_mse', 'min_samples_split': 4, 'min_samples_leaf': 2, 'min_weight_fraction_leaf': 0.15928818446661736, 'min_impurity_decrease': 0.0889404161375806, 'max_features': 0.3137798113790352, 'subsample': 0.016844907612422307, 'dropout_rate': 0.6637706287415885, 'ccp_alpha': 0.43145367608633056}. Best is trial 244 with value: 0.8474070660226068.[0m
[32m[I 2022-04-21 17:49:31,764][0m Trial 428 finished with value: 0.837838348739538 and parameters: {'loss': 'coxph', 'learning_rate': 0.004179826524570907, 'n_estimators': 290, 'criterion': 'friedman_mse', 'min_samples_split': 4, 'min_samples_leaf': 2, 'min_weight_fraction_leaf': 0.1444776989063376, 'min_impurity_decrease': 0.28151442511096353, 'max_features': 0.39409491722277024, 'subsample': 0.06319822196257363, 'dropout_rate': 0.47620967290053023, 'ccp_alpha': 0.6567447532694588}. Best is trial 244 with value: 0.8474070660226068.[0m
[32m[I 2022-04-21 17:49:57,500][0m Trial 429 finished with value: 0.8427201302075407 and parameters: {'loss': 'coxph', 'learning_rate': 0.00556657327249562, 'n_estimators': 322, 'criterion': 'squared_error', 'min_samples_split': 4, 'min_samples_leaf': 1, 'min_weight_fraction_leaf': 0.16368115838649927, 'min_impurity_decrease': 0.2113052153600934, 'max_features': 0.37245689943870147, 'subsample': 0.02805193261252028, 'dropout_rate': 0.1813331737872287, 'ccp_alpha': 0.26235849599175826}. Best is trial 244 with value: 0.8474070660226068.[0m
[32m[I 2022-04-21 17:50:20,289][0m Trial 430 finished with value: 0.7245783925366106 and parameters: {'loss': 'coxph', 'learning_rate': 0.007501114441009828, 'n_estimators': 342, 'criterion': 'friedman_mse', 'min_samples_split': 4, 'min_samples_leaf': 2, 'min_weight_fraction_leaf': 0.17314022803915413, 'min_impurity_decrease': 0.29437289163257735, 'max_features': 0.9047934367746302, 'subsample': 0.17215043607163188, 'dropout_rate': 0.22735000408389533, 'ccp_alpha': 0.482862648968158}. Best is trial 244 with value: 0.8474070660226068.[0m
[32m[I 2022-04-21 17:50:40,643][0m Trial 431 finished with value: 0.8437853371086561 and parameters: {'loss': 'coxph', 'learning_rate': 0.004340780808192147, 'n_estimators': 283, 'criterion': 'friedman_mse', 'min_samples_split': 4, 'min_samples_leaf': 1, 'min_weight_fraction_leaf': 0.15082759247427804, 'min_impurity_decrease': 0.30871977683192353, 'max_features': 0.44600765434288714, 'subsample': 0.04488345240516978, 'dropout_rate': 0.14980718295026144, 'ccp_alpha': 0.24731482730342558}. Best is trial 244 with value: 0.8474070660226068.[0m
[32m[I 2022-04-21 17:51:01,594][0m Trial 432 finished with value: 0.8439719389379652 and parameters: {'loss': 'coxph', 'learning_rate': 0.05792586373976121, 'n_estimators': 302, 'criterion': 'friedman_mse', 'min_samples_split': 4, 'min_samples_leaf': 2, 'min_weight_fraction_leaf': 0.17916502298370157, 'min_impurity_decrease': 0.2839275806734877, 'max_features': 0.323960134530753, 'subsample': 0.10628461684316362, 'dropout_rate': 0.17102501346667306, 'ccp_alpha': 0.1866989644096887}. Best is trial 244 with value: 0.8474070660226068.[0m
[32m[I 2022-04-21 17:51:15,043][0m Trial 433 finished with value: 0.7375603701943161 and parameters: {'loss': 'coxph', 'learning_rate': 0.008555967472007082, 'n_estimators': 273, 'criterion': 'friedman_mse', 'min_samples_split': 7, 'min_samples_leaf': 2, 'min_weight_fraction_leaf': 0.11721885345994737, 'min_impurity_decrease': 0.718238573627323, 'max_features': 0.35244406471628875, 'subsample': 0.14239055724967792, 'dropout_rate': 0.5931895087900416, 'ccp_alpha': 0.3306632490181962}. Best is trial 244 with value: 0.8474070660226068.[0m
[32m[I 2022-04-21 17:51:37,722][0m Trial 434 finished with value: 0.8434288171415044 and parameters: {'loss': 'coxph', 'learning_rate': 0.0037185481216237873, 'n_estimators': 301, 'criterion': 'friedman_mse', 'min_samples_split': 4, 'min_samples_leaf': 2, 'min_weight_fraction_leaf': 0.16256956410275492, 'min_impurity_decrease': 0.8307134061997062, 'max_features': 0.2947716340805663, 'subsample': 0.07073912591481486, 'dropout_rate': 0.2073834230763603, 'ccp_alpha': 0.17208009732873222}. Best is trial 244 with value: 0.8474070660226068.[0m
[32m[I 2022-04-21 17:52:03,160][0m Trial 435 finished with value: 0.8417665052060126 and parameters: {'loss': 'coxph', 'learning_rate': 0.006347167337381835, 'n_estimators': 318, 'criterion': 'absolute_error', 'min_samples_split': 2, 'min_samples_leaf': 2, 'min_weight_fraction_leaf': 0.1319096757298472, 'min_impurity_decrease': 0.2657820841488586, 'max_features': 0.6851702506468154, 'subsample': 0.09333945608451448, 'dropout_rate': 0.14445756500987847, 'ccp_alpha': 0.24800018998143952}. Best is trial 244 with value: 0.8474070660226068.[0m
[32m[I 2022-04-21 17:52:09,524][0m Trial 436 finished with value: 0.8472198891267928 and parameters: {'loss': 'coxph', 'learning_rate': 7.351009695835648e-05, 'n_estimators': 216, 'criterion': 'friedman_mse', 'min_samples_split': 5, 'min_samples_leaf': 1, 'min_weight_fraction_leaf': 0.1842781883230513, 'min_impurity_decrease': 0.23609496066272395, 'max_features': 0.3261934949776207, 'subsample': 0.06147070992193572, 'dropout_rate': 0.5142129190375493, 'ccp_alpha': 0.1063898379606942}. Best is trial 244 with value: 0.8474070660226068.[0m
[32m[I 2022-04-21 17:52:15,855][0m Trial 437 finished with value: 0.8410297686650615 and parameters: {'loss': 'coxph', 'learning_rate': 5.038683900300813e-05, 'n_estimators': 200, 'criterion': 'friedman_mse', 'min_samples_split': 4, 'min_samples_leaf': 1, 'min_weight_fraction_leaf': 0.186998859698192, 'min_impurity_decrease': 0.2258784371663634, 'max_features': 0.3244708421473509, 'subsample': 0.4392479392156963, 'dropout_rate': 0.5406141579706021, 'ccp_alpha': 0.002809125540101447}. Best is trial 244 with value: 0.8474070660226068.[0m
/media/san2_ssd/data/Workdir/survival/venv/lib/python3.8/site-packages/sksurv/ensemble/boosting.py:955: RuntimeWarning: divide by zero encountered in log
  time = numpy.log(time)
/media/san2_ssd/data/Workdir/survival/venv/lib/python3.8/site-packages/sksurv/ensemble/boosting.py:955: RuntimeWarning: divide by zero encountered in log
  time = numpy.log(time)
/media/san2_ssd/data/Workdir/survival/venv/lib/python3.8/site-packages/sksurv/ensemble/boosting.py:955: RuntimeWarning: divide by zero encountered in log
  time = numpy.log(time)
/media/san2_ssd/data/Workdir/survival/venv/lib/python3.8/site-packages/sksurv/ensemble/boosting.py:955: RuntimeWarning: divide by zero encountered in log
  time = numpy.log(time)
[32m[I 2022-04-21 17:52:17,711][0m Trial 438 finished with value: -0.4670319442700867 and parameters: {'loss': 'squared', 'learning_rate': 7.123939359027649e-05, 'n_estimators': 220, 'criterion': 'friedman_mse', 'min_samples_split': 3, 'min_samples_leaf': 1, 'min_weight_fraction_leaf': 0.1985799418005165, 'min_impurity_decrease': 0.23747132168912358, 'max_features': 0.35845653967008956, 'subsample': 0.13132915157052952, 'dropout_rate': 0.5343269415913626, 'ccp_alpha': 0.14272200229314538}. Best is trial 244 with value: 0.8474070660226068.[0m
[32m[I 2022-04-21 17:52:24,462][0m Trial 439 finished with value: 0.8402930068457302 and parameters: {'loss': 'coxph', 'learning_rate': 4.044165254221947e-05, 'n_estimators': 220, 'criterion': 'friedman_mse', 'min_samples_split': 5, 'min_samples_leaf': 1, 'min_weight_fraction_leaf': 0.18332060841101214, 'min_impurity_decrease': 0.19330300399099712, 'max_features': 0.3372427523170803, 'subsample': 0.11411579143110714, 'dropout_rate': 0.4921537865815255, 'ccp_alpha': 0.2934192704162837}. Best is trial 244 with value: 0.8474070660226068.[0m
