[32m[I 2022-04-21 11:41:28,974][0m Trial 687 finished with value: 0.46991866821558936 and parameters: {'splitter': 'best', 'min_samples_split': 0.16336530626830126, 'min_samples_leaf': 0.00860520483110383, 'min_weight_fraction_leaf': 0.40264420797200573, 'max_features': 0.3769631189451666}. Best is trial 656 with value: 0.8329453957568111.[0m
/media/san2_ssd/data/Workdir/survival/utils.py:305: RuntimeWarning: invalid value encountered in true_divide
  pdfs = np.gradient(1-survs,axis=1)/norms
[32m[I 2022-04-21 11:41:29,481][0m Trial 688 finished with value: 0.8215831991778421 and parameters: {'splitter': 'best', 'min_samples_split': 0.14891446156059984, 'min_samples_leaf': 0.0017194190907676027, 'min_weight_fraction_leaf': 0.01628994899277606, 'max_features': 0.3729875417170922}. Best is trial 656 with value: 0.8329453957568111.[0m
[32m[I 2022-04-21 11:41:29,630][0m Trial 689 finished with value: 0.778343939513652 and parameters: {'splitter': 'best', 'min_samples_split': 0.1481522638420476, 'min_samples_leaf': 0.21388287945051576, 'min_weight_fraction_leaf': 0.010352393414105553, 'max_features': 0.3988286763283318}. Best is trial 656 with value: 0.8329453957568111.[0m
[32m[I 2022-04-21 11:41:30,100][0m Trial 690 finished with value: 0.8046716074032212 and parameters: {'splitter': 'best', 'min_samples_split': 0.1428294349362334, 'min_samples_leaf': 0.01848047172566137, 'min_weight_fraction_leaf': 0.025990592326606148, 'max_features': 0.3636639198221195}. Best is trial 656 with value: 0.8329453957568111.[0m
/media/san2_ssd/data/Workdir/survival/utils.py:305: RuntimeWarning: invalid value encountered in true_divide
  pdfs = np.gradient(1-survs,axis=1)/norms
[32m[I 2022-04-21 11:41:30,717][0m Trial 691 finished with value: 0.8340697555858835 and parameters: {'splitter': 'best', 'min_samples_split': 0.1450919885972804, 'min_samples_leaf': 0.009625987665255971, 'min_weight_fraction_leaf': 0.008849383628667822, 'max_features': 0.42417252129869437}. Best is trial 691 with value: 0.8340697555858835.[0m
[32m[I 2022-04-21 11:41:31,034][0m Trial 692 finished with value: 0.8150033909614007 and parameters: {'splitter': 'best', 'min_samples_split': 0.1541408446313344, 'min_samples_leaf': 0.008815264411642355, 'min_weight_fraction_leaf': 0.03177537394300139, 'max_features': 0.4461593033397067}. Best is trial 691 with value: 0.8340697555858835.[0m
/media/san2_ssd/data/Workdir/survival/utils.py:305: RuntimeWarning: invalid value encountered in true_divide
  pdfs = np.gradient(1-survs,axis=1)/norms
[32m[I 2022-04-21 11:41:32,007][0m Trial 693 finished with value: 0.8084342747606621 and parameters: {'splitter': 'best', 'min_samples_split': 0.16047893631124166, 'min_samples_leaf': 0.0010551413231788282, 'min_weight_fraction_leaf': 0.020747634566149843, 'max_features': 0.43164487906527466}. Best is trial 691 with value: 0.8340697555858835.[0m
[32m[I 2022-04-21 11:41:32,630][0m Trial 694 finished with value: 0.8161875027088972 and parameters: {'splitter': 'best', 'min_samples_split': 0.1767559999193823, 'min_samples_leaf': 0.00978093146603487, 'min_weight_fraction_leaf': 0.04136810692831725, 'max_features': 0.45175490804614404}. Best is trial 691 with value: 0.8340697555858835.[0m
/media/san2_ssd/data/Workdir/survival/utils.py:305: RuntimeWarning: invalid value encountered in true_divide
  pdfs = np.gradient(1-survs,axis=1)/norms
[32m[I 2022-04-21 11:41:33,452][0m Trial 695 finished with value: 0.8130301624954994 and parameters: {'splitter': 'best', 'min_samples_split': 0.1484388445855997, 'min_samples_leaf': 0.01067727260994405, 'min_weight_fraction_leaf': 0.02320249629406966, 'max_features': 0.4183801737350851}. Best is trial 691 with value: 0.8340697555858835.[0m
[32m[I 2022-04-21 11:41:34,504][0m Trial 696 finished with value: 0.8179326205325088 and parameters: {'splitter': 'best', 'min_samples_split': 0.16896617678212358, 'min_samples_leaf': 0.002093546161248183, 'min_weight_fraction_leaf': 0.009763624692210272, 'max_features': 0.479133131571987}. Best is trial 691 with value: 0.8340697555858835.[0m
[32m[I 2022-04-21 11:41:34,947][0m Trial 697 finished with value: 0.8136489689973432 and parameters: {'splitter': 'best', 'min_samples_split': 0.14437785424208555, 'min_samples_leaf': 0.018667188746483668, 'min_weight_fraction_leaf': 0.01603430274481618, 'max_features': 0.390371139584893}. Best is trial 691 with value: 0.8340697555858835.[0m
[32m[I 2022-04-21 11:41:35,308][0m Trial 698 finished with value: 0.8076224626438853 and parameters: {'splitter': 'best', 'min_samples_split': 0.13511899774365038, 'min_samples_leaf': 0.0013382894619949678, 'min_weight_fraction_leaf': 0.05307923928988622, 'max_features': 0.43318674847377153}. Best is trial 691 with value: 0.8340697555858835.[0m
[32m[I 2022-04-21 11:41:35,771][0m Trial 699 finished with value: 0.8013180370021444 and parameters: {'splitter': 'best', 'min_samples_split': 0.1529647699110349, 'min_samples_leaf': 0.0012363783376326196, 'min_weight_fraction_leaf': 0.034177647617949315, 'max_features': 0.46168979396193144}. Best is trial 691 with value: 0.8340697555858835.[0m
[32m[I 2022-04-21 11:41:36,293][0m Trial 700 finished with value: 0.8217948709153596 and parameters: {'splitter': 'best', 'min_samples_split': 0.13897658754167508, 'min_samples_leaf': 0.016411026361957355, 'min_weight_fraction_leaf': 0.008589217631247714, 'max_features': 0.5861921491178999}. Best is trial 691 with value: 0.8340697555858835.[0m
[32m[I 2022-04-21 11:41:36,722][0m Trial 701 finished with value: 0.8105327379971593 and parameters: {'splitter': 'best', 'min_samples_split': 0.13519566569852143, 'min_samples_leaf': 0.02643301755471038, 'min_weight_fraction_leaf': 0.02420483315098405, 'max_features': 0.5072202838498963}. Best is trial 691 with value: 0.8340697555858835.[0m
[32m[I 2022-04-21 11:41:37,429][0m Trial 702 finished with value: 0.8022800261928381 and parameters: {'splitter': 'best', 'min_samples_split': 0.16483771342216405, 'min_samples_leaf': 0.01702987157291789, 'min_weight_fraction_leaf': 0.01446409532238961, 'max_features': 0.4133840179706073}. Best is trial 691 with value: 0.8340697555858835.[0m
[32m[I 2022-04-21 11:41:37,842][0m Trial 703 finished with value: 0.6706767931670151 and parameters: {'splitter': 'best', 'min_samples_split': 0.15517860785333093, 'min_samples_leaf': 0.010288508127288664, 'min_weight_fraction_leaf': 0.2283222417485626, 'max_features': 0.36675316044310924}. Best is trial 691 with value: 0.8340697555858835.[0m
/media/san2_ssd/data/Workdir/survival/utils.py:305: RuntimeWarning: invalid value encountered in true_divide
  pdfs = np.gradient(1-survs,axis=1)/norms
[32m[I 2022-04-21 11:41:38,500][0m Trial 704 finished with value: 0.8177462410578474 and parameters: {'splitter': 'best', 'min_samples_split': 0.12580355384188027, 'min_samples_leaf': 0.027037259923581535, 'min_weight_fraction_leaf': 0.008251197401186417, 'max_features': 0.5501016098532416}. Best is trial 691 with value: 0.8340697555858835.[0m
[32m[I 2022-04-21 11:41:38,707][0m Trial 705 finished with value: 0.8004846918598302 and parameters: {'splitter': 'best', 'min_samples_split': 0.13816677314217102, 'min_samples_leaf': 0.011247349731229447, 'min_weight_fraction_leaf': 0.16527798766815716, 'max_features': 0.42952658577544733}. Best is trial 691 with value: 0.8340697555858835.[0m
[32m[I 2022-04-21 11:41:39,020][0m Trial 706 finished with value: 0.8058641265176799 and parameters: {'splitter': 'best', 'min_samples_split': 0.15592119597965717, 'min_samples_leaf': 0.0220727368420068, 'min_weight_fraction_leaf': 0.023080786074056947, 'max_features': 0.3868927657074826}. Best is trial 691 with value: 0.8340697555858835.[0m
[32m[I 2022-04-21 11:41:39,395][0m Trial 707 finished with value: 0.8199201421275605 and parameters: {'splitter': 'best', 'min_samples_split': 0.13056878236299144, 'min_samples_leaf': 0.0015067899641606605, 'min_weight_fraction_leaf': 0.032782987132610714, 'max_features': 0.4501033227899757}. Best is trial 691 with value: 0.8340697555858835.[0m
[32m[I 2022-04-21 11:41:39,750][0m Trial 708 finished with value: 0.8089112641957561 and parameters: {'splitter': 'best', 'min_samples_split': 0.13278080222404579, 'min_samples_leaf': 0.03243136741315604, 'min_weight_fraction_leaf': 0.000270073516135963, 'max_features': 0.40875672772855676}. Best is trial 691 with value: 0.8340697555858835.[0m
[32m[I 2022-04-21 11:41:40,405][0m Trial 709 finished with value: 0.8145931224921705 and parameters: {'splitter': 'best', 'min_samples_split': 0.12263443346860023, 'min_samples_leaf': 0.0010131573267692824, 'min_weight_fraction_leaf': 0.009493443698290582, 'max_features': 0.48052221916636084}. Best is trial 691 with value: 0.8340697555858835.[0m
[32m[I 2022-04-21 11:41:40,860][0m Trial 710 finished with value: 0.7093030013643288 and parameters: {'splitter': 'best', 'min_samples_split': 0.3612703466900174, 'min_samples_leaf': 0.015801848336349837, 'min_weight_fraction_leaf': 0.01768204590883196, 'max_features': 0.5327185755643943}. Best is trial 691 with value: 0.8340697555858835.[0m
[32m[I 2022-04-21 11:41:41,184][0m Trial 711 finished with value: 0.7940707974378967 and parameters: {'splitter': 'best', 'min_samples_split': 0.12072896960066692, 'min_samples_leaf': 0.01847075072822217, 'min_weight_fraction_leaf': 0.04343081125421514, 'max_features': 0.3648144016313323}. Best is trial 691 with value: 0.8340697555858835.[0m
/media/san2_ssd/data/Workdir/survival/utils.py:305: RuntimeWarning: invalid value encountered in true_divide
  pdfs = np.gradient(1-survs,axis=1)/norms
[32m[I 2022-04-21 11:41:41,489][0m Trial 712 finished with value: 0.8108344640636785 and parameters: {'splitter': 'best', 'min_samples_split': 0.11339524212014256, 'min_samples_leaf': 0.02562752343079835, 'min_weight_fraction_leaf': 7.734151787342076e-05, 'max_features': 0.39872287980626164}. Best is trial 691 with value: 0.8340697555858835.[0m
[32m[I 2022-04-21 11:41:41,975][0m Trial 713 finished with value: 0.8194684947739306 and parameters: {'splitter': 'best', 'min_samples_split': 0.1465076574619211, 'min_samples_leaf': 0.010437616319236304, 'min_weight_fraction_leaf': 1.1204727532934758e-05, 'max_features': 0.42620780882395887}. Best is trial 691 with value: 0.8340697555858835.[0m
[32m[I 2022-04-21 11:41:42,254][0m Trial 714 finished with value: 0.8172904964122683 and parameters: {'splitter': 'best', 'min_samples_split': 0.13900609699328212, 'min_samples_leaf': 0.03500613802213902, 'min_weight_fraction_leaf': 0.024728731312400422, 'max_features': 0.49939057057410946}. Best is trial 691 with value: 0.8340697555858835.[0m
[32m[I 2022-04-21 11:41:42,647][0m Trial 715 finished with value: 0.8208984189701753 and parameters: {'splitter': 'best', 'min_samples_split': 0.11203922472851507, 'min_samples_leaf': 0.010926394385505769, 'min_weight_fraction_leaf': 0.014263937850445763, 'max_features': 0.45968459437135417}. Best is trial 691 with value: 0.8340697555858835.[0m
[32m[I 2022-04-21 11:41:43,004][0m Trial 716 finished with value: 0.8022111836460072 and parameters: {'splitter': 'best', 'min_samples_split': 0.10491733762907804, 'min_samples_leaf': 0.023739064738577755, 'min_weight_fraction_leaf': 0.031105826183111748, 'max_features': 0.38775346599748206}. Best is trial 691 with value: 0.8340697555858835.[0m
[32m[I 2022-04-21 11:41:43,907][0m Trial 717 finished with value: 0.8214421045500104 and parameters: {'splitter': 'best', 'min_samples_split': 0.12876949009777197, 'min_samples_leaf': 0.010297522425257485, 'min_weight_fraction_leaf': 0.009331786166728593, 'max_features': 0.4409392796187545}. Best is trial 691 with value: 0.8340697555858835.[0m
/media/san2_ssd/data/Workdir/survival/utils.py:305: RuntimeWarning: invalid value encountered in true_divide
  pdfs = np.gradient(1-survs,axis=1)/norms
[32m[I 2022-04-21 11:41:44,726][0m Trial 718 finished with value: 0.8147357151604634 and parameters: {'splitter': 'best', 'min_samples_split': 0.11679738041721804, 'min_samples_leaf': 0.018996149398207006, 'min_weight_fraction_leaf': 0.01975708131667725, 'max_features': 0.41207775829271537}. Best is trial 691 with value: 0.8340697555858835.[0m
[32m[I 2022-04-21 11:41:45,184][0m Trial 719 finished with value: 0.7993288955201908 and parameters: {'splitter': 'best', 'min_samples_split': 0.10765584495763246, 'min_samples_leaf': 0.03220291169996484, 'min_weight_fraction_leaf': 0.009169916460583719, 'max_features': 0.35977287722223505}. Best is trial 691 with value: 0.8340697555858835.[0m
[32m[I 2022-04-21 11:41:45,595][0m Trial 720 finished with value: 0.8003779531974626 and parameters: {'splitter': 'best', 'min_samples_split': 0.11888497472605221, 'min_samples_leaf': 0.0014475614036481912, 'min_weight_fraction_leaf': 0.05717686043909749, 'max_features': 0.38170435711577}. Best is trial 691 with value: 0.8340697555858835.[0m
[32m[I 2022-04-21 11:41:45,842][0m Trial 721 finished with value: 0.8045158311097694 and parameters: {'splitter': 'best', 'min_samples_split': 0.09855809349465842, 'min_samples_leaf': 0.04139670488289371, 'min_weight_fraction_leaf': 0.024934011215938377, 'max_features': 0.4765103427004272}. Best is trial 691 with value: 0.8340697555858835.[0m
[32m[I 2022-04-21 11:41:46,111][0m Trial 722 finished with value: 0.8071802769054987 and parameters: {'splitter': 'best', 'min_samples_split': 0.14226186201373803, 'min_samples_leaf': 0.01684185052977738, 'min_weight_fraction_leaf': 0.03988046184454285, 'max_features': 0.42733484772344493}. Best is trial 691 with value: 0.8340697555858835.[0m
[32m[I 2022-04-21 11:41:46,479][0m Trial 723 finished with value: 0.8181221132891338 and parameters: {'splitter': 'best', 'min_samples_split': 0.12347073082312988, 'min_samples_leaf': 0.027452764433081162, 'min_weight_fraction_leaf': 0.014486951970585017, 'max_features': 0.5761140944094628}. Best is trial 691 with value: 0.8340697555858835.[0m
[32m[I 2022-04-21 11:41:47,517][0m Trial 724 finished with value: 0.8119897066782403 and parameters: {'splitter': 'best', 'min_samples_split': 0.10501461593033837, 'min_samples_leaf': 0.011144090665756518, 'min_weight_fraction_leaf': 0.01036333940871911, 'max_features': 0.44712538723146494}. Best is trial 691 with value: 0.8340697555858835.[0m
[32m[I 2022-04-21 11:41:48,052][0m Trial 725 finished with value: 0.5667538961089289 and parameters: {'splitter': 'best', 'min_samples_split': 0.1566347180693794, 'min_samples_leaf': 0.001491087425259551, 'min_weight_fraction_leaf': 0.47431740411177514, 'max_features': 0.5207282202005002}. Best is trial 691 with value: 0.8340697555858835.[0m
[32m[I 2022-04-21 11:41:48,581][0m Trial 726 finished with value: 0.778343939513652 and parameters: {'splitter': 'best', 'min_samples_split': 0.09435934448671543, 'min_samples_leaf': 0.02424479499369238, 'min_weight_fraction_leaf': 0.20819832478352202, 'max_features': 0.3998883664737567}. Best is trial 691 with value: 0.8340697555858835.[0m
[32m[I 2022-04-21 11:41:49,296][0m Trial 727 finished with value: 0.8141667198027619 and parameters: {'splitter': 'best', 'min_samples_split': 0.19198989329192767, 'min_samples_leaf': 0.0113146164560297, 'min_weight_fraction_leaf': 0.029214944143847385, 'max_features': 0.46121011841991705}. Best is trial 691 with value: 0.8340697555858835.[0m
[32m[I 2022-04-21 11:41:49,736][0m Trial 728 finished with value: 0.6987986855686871 and parameters: {'splitter': 'best', 'min_samples_split': 0.11340379144983026, 'min_samples_leaf': 0.033351597108851105, 'min_weight_fraction_leaf': 0.18686686010108622, 'max_features': 0.4975041149310945}. Best is trial 691 with value: 0.8340697555858835.[0m
[32m[I 2022-04-21 11:41:50,103][0m Trial 729 finished with value: 0.472473435287635 and parameters: {'splitter': 'best', 'min_samples_split': 0.12419148502634535, 'min_samples_leaf': 0.46292411414561807, 'min_weight_fraction_leaf': 0.019232811070519676, 'max_features': 0.40966057484354507}. Best is trial 691 with value: 0.8340697555858835.[0m
/media/san2_ssd/data/Workdir/survival/utils.py:305: RuntimeWarning: invalid value encountered in true_divide
  pdfs = np.gradient(1-survs,axis=1)/norms
/media/san2_ssd/data/Workdir/survival/utils.py:305: RuntimeWarning: invalid value encountered in true_divide
  pdfs = np.gradient(1-survs,axis=1)/norms
/media/san2_ssd/data/Workdir/survival/utils.py:305: RuntimeWarning: invalid value encountered in true_divide
  pdfs = np.gradient(1-survs,axis=1)/norms
[32m[I 2022-04-21 11:41:52,195][0m Trial 730 finished with value: 0.8136510228505092 and parameters: {'splitter': 'best', 'min_samples_split': 0.09889486871152008, 'min_samples_leaf': 0.0012648724948212285, 'min_weight_fraction_leaf': 0.0007259184952715294, 'max_features': 0.3568733843193332}. Best is trial 691 with value: 0.8340697555858835.[0m
[32m[I 2022-04-21 11:41:52,871][0m Trial 731 finished with value: 0.7800244555309161 and parameters: {'splitter': 'best', 'min_samples_split': 0.2526911501697634, 'min_samples_leaf': 0.174163217296745, 'min_weight_fraction_leaf': 0.008554098916345483, 'max_features': 0.3764263622126218}. Best is trial 691 with value: 0.8340697555858835.[0m
[32m[I 2022-04-21 11:41:53,911][0m Trial 732 finished with value: 0.8223989545193173 and parameters: {'splitter': 'best', 'min_samples_split': 0.1057154208908437, 'min_samples_leaf': 0.01904700920696852, 'min_weight_fraction_leaf': 0.01815389893048211, 'max_features': 0.42942455288070774}. Best is trial 691 with value: 0.8340697555858835.[0m
[32m[I 2022-04-21 11:41:54,267][0m Trial 733 finished with value: 0.8140041277514328 and parameters: {'splitter': 'best', 'min_samples_split': 0.1684675102494349, 'min_samples_leaf': 0.04058868796827053, 'min_weight_fraction_leaf': 0.015595927326996545, 'max_features': 0.44484871924248953}. Best is trial 691 with value: 0.8340697555858835.[0m
/media/san2_ssd/data/Workdir/survival/utils.py:305: RuntimeWarning: invalid value encountered in true_divide
  pdfs = np.gradient(1-survs,axis=1)/norms
[32m[I 2022-04-21 11:41:54,662][0m Trial 734 finished with value: 0.8148158643184606 and parameters: {'splitter': 'best', 'min_samples_split': 0.134686362876227, 'min_samples_leaf': 0.02751928041304963, 'min_weight_fraction_leaf': 0.007904578609263377, 'max_features': 0.4693280221728357}. Best is trial 691 with value: 0.8340697555858835.[0m
[32m[I 2022-04-21 11:41:54,960][0m Trial 735 finished with value: 0.8098636224666226 and parameters: {'splitter': 'best', 'min_samples_split': 0.1145596775527621, 'min_samples_leaf': 0.04121828900901498, 'min_weight_fraction_leaf': 0.019211403204816044, 'max_features': 0.43964323496535124}. Best is trial 691 with value: 0.8340697555858835.[0m
[32m[I 2022-04-21 11:41:55,633][0m Trial 736 finished with value: 0.8151285251994416 and parameters: {'splitter': 'best', 'min_samples_split': 0.12465480401750542, 'min_samples_leaf': 0.023469222682668493, 'min_weight_fraction_leaf': 0.00017731973257500457, 'max_features': 0.42495744371448285}. Best is trial 691 with value: 0.8340697555858835.[0m
[32m[I 2022-04-21 11:41:56,280][0m Trial 737 finished with value: 0.8143731925386879 and parameters: {'splitter': 'best', 'min_samples_split': 0.10691476726450662, 'min_samples_leaf': 0.032603893133312634, 'min_weight_fraction_leaf': 6.65232075452906e-05, 'max_features': 0.48707600701303816}. Best is trial 691 with value: 0.8340697555858835.[0m
/media/san2_ssd/data/Workdir/survival/utils.py:305: RuntimeWarning: invalid value encountered in true_divide
  pdfs = np.gradient(1-survs,axis=1)/norms
/media/san2_ssd/data/Workdir/survival/utils.py:305: RuntimeWarning: invalid value encountered in true_divide
  pdfs = np.gradient(1-survs,axis=1)/norms
[32m[I 2022-04-21 11:41:57,006][0m Trial 738 finished with value: 0.8115130471756897 and parameters: {'splitter': 'best', 'min_samples_split': 0.0910785360296874, 'min_samples_leaf': 0.018580165151491954, 'min_weight_fraction_leaf': 0.01826418541923293, 'max_features': 0.4588808305831384}. Best is trial 691 with value: 0.8340697555858835.[0m
[32m[I 2022-04-21 11:41:57,414][0m Trial 739 finished with value: 0.8022193942718013 and parameters: {'splitter': 'best', 'min_samples_split': 0.10907365960604082, 'min_samples_leaf': 0.048290627090596144, 'min_weight_fraction_leaf': 0.008882961197364146, 'max_features': 0.55539586775593}. Best is trial 691 with value: 0.8340697555858835.[0m
[32m[I 2022-04-21 11:41:57,812][0m Trial 740 finished with value: 0.815578052217008 and parameters: {'splitter': 'best', 'min_samples_split': 0.1404173400062888, 'min_samples_leaf': 0.016920662990857642, 'min_weight_fraction_leaf': 0.026945189434559244, 'max_features': 0.42754526176971874}. Best is trial 691 with value: 0.8340697555858835.[0m
[32m[I 2022-04-21 11:41:58,269][0m Trial 741 finished with value: 0.8120346112582679 and parameters: {'splitter': 'best', 'min_samples_split': 0.1311145655430233, 'min_samples_leaf': 0.029394354562945424, 'min_weight_fraction_leaf': 7.287746180123858e-05, 'max_features': 0.5112955320450713}. Best is trial 691 with value: 0.8340697555858835.[0m
[32m[I 2022-04-21 11:41:58,864][0m Trial 742 finished with value: 0.8117326382257399 and parameters: {'splitter': 'best', 'min_samples_split': 0.1006475913131167, 'min_samples_leaf': 0.02011354493950875, 'min_weight_fraction_leaf': 0.01681467763702274, 'max_features': 0.4706149218410953}. Best is trial 691 with value: 0.8340697555858835.[0m
[32m[I 2022-04-21 11:41:59,242][0m Trial 743 finished with value: 0.8096220723149667 and parameters: {'splitter': 'best', 'min_samples_split': 0.11775059048780613, 'min_samples_leaf': 0.03519717305750969, 'min_weight_fraction_leaf': 0.03718038643294781, 'max_features': 0.4169922331171999}. Best is trial 691 with value: 0.8340697555858835.[0m
