[32m[I 2022-04-22 01:30:05,702][0m Trial 990 finished with value: 0.6892049959681408 and parameters: {'loss': 'coxph', 'learning_rate': 3.7127399281316525e-05, 'n_estimators': 227, 'criterion': 'squared_error', 'min_samples_split': 7, 'min_samples_leaf': 1, 'min_weight_fraction_leaf': 0.2268358248363948, 'min_impurity_decrease': 0.04556382212397633, 'max_features': 0.7302598815552133, 'subsample': 0.2534943723321248, 'dropout_rate': 0.7036379785343976, 'ccp_alpha': 0.10093711979632691}. Best is trial 187 with value: 0.6933481836305168.[0m
[32m[I 2022-04-22 01:30:12,280][0m Trial 991 finished with value: 0.6818459809609586 and parameters: {'loss': 'coxph', 'learning_rate': 2.4684108207935355e-05, 'n_estimators': 269, 'criterion': 'squared_error', 'min_samples_split': 7, 'min_samples_leaf': 6, 'min_weight_fraction_leaf': 0.26151434603570456, 'min_impurity_decrease': 0.06499375398393899, 'max_features': 0.5425188734100903, 'subsample': 0.19358013049979195, 'dropout_rate': 0.6665824804653927, 'ccp_alpha': 0.17851198404002888}. Best is trial 187 with value: 0.6933481836305168.[0m
[32m[I 2022-04-22 01:30:16,937][0m Trial 992 finished with value: 0.6868724747503951 and parameters: {'loss': 'coxph', 'learning_rate': 1.3302943720682715e-05, 'n_estimators': 241, 'criterion': 'squared_error', 'min_samples_split': 7, 'min_samples_leaf': 2, 'min_weight_fraction_leaf': 0.24138795285082587, 'min_impurity_decrease': 0.10258068303705059, 'max_features': 0.7642766651995908, 'subsample': 0.28320534702622235, 'dropout_rate': 0.7283934719397601, 'ccp_alpha': 0.09826041411218789}. Best is trial 187 with value: 0.6933481836305168.[0m
/media/san2_ssd/data/Workdir/survival/venv/lib/python3.8/site-packages/sksurv/ensemble/boosting.py:955: RuntimeWarning: divide by zero encountered in log
  time = numpy.log(time)
/media/san2_ssd/data/Workdir/survival/venv/lib/python3.8/site-packages/sksurv/ensemble/boosting.py:955: RuntimeWarning: divide by zero encountered in log
  time = numpy.log(time)
/media/san2_ssd/data/Workdir/survival/venv/lib/python3.8/site-packages/sksurv/ensemble/boosting.py:955: RuntimeWarning: divide by zero encountered in log
  time = numpy.log(time)
/media/san2_ssd/data/Workdir/survival/venv/lib/python3.8/site-packages/sksurv/ensemble/boosting.py:955: RuntimeWarning: divide by zero encountered in log
  time = numpy.log(time)
[32m[I 2022-04-22 01:30:18,107][0m Trial 993 finished with value: -0.7317286726923086 and parameters: {'loss': 'squared', 'learning_rate': 1.7927412273129267e-05, 'n_estimators': 255, 'criterion': 'squared_error', 'min_samples_split': 6, 'min_samples_leaf': 5, 'min_weight_fraction_leaf': 0.2276704258538295, 'min_impurity_decrease': 0.03963997320437384, 'max_features': 0.7968230566494765, 'subsample': 0.23763297065585118, 'dropout_rate': 0.6354112234399913, 'ccp_alpha': 0.3385210509555008}. Best is trial 187 with value: 0.6933481836305168.[0m
[32m[I 2022-04-22 01:30:21,090][0m Trial 994 finished with value: 0.688054034043504 and parameters: {'loss': 'coxph', 'learning_rate': 7.3152953094378134e-06, 'n_estimators': 188, 'criterion': 'squared_error', 'min_samples_split': 7, 'min_samples_leaf': 6, 'min_weight_fraction_leaf': 0.24923944426141684, 'min_impurity_decrease': 0.07536130246946018, 'max_features': 0.6607731472961043, 'subsample': 0.26360465768091895, 'dropout_rate': 0.8435610250757479, 'ccp_alpha': 0.08593565967055156}. Best is trial 187 with value: 0.6933481836305168.[0m
[32m[I 2022-04-22 01:30:24,046][0m Trial 995 finished with value: 0.6648314880576127 and parameters: {'loss': 'coxph', 'learning_rate': 4.980880740749468e-06, 'n_estimators': 217, 'criterion': 'squared_error', 'min_samples_split': 7, 'min_samples_leaf': 5, 'min_weight_fraction_leaf': 0.2675630039157378, 'min_impurity_decrease': 0.04111122234133843, 'max_features': 0.6950237906995965, 'subsample': 0.22029694894659016, 'dropout_rate': 0.8826378705968964, 'ccp_alpha': 0.24771852144557377}. Best is trial 187 with value: 0.6933481836305168.[0m
[32m[I 2022-04-22 01:30:27,271][0m Trial 996 finished with value: 0.5 and parameters: {'loss': 'coxph', 'learning_rate': 1.1107675553287558e-05, 'n_estimators': 199, 'criterion': 'squared_error', 'min_samples_split': 7, 'min_samples_leaf': 6, 'min_weight_fraction_leaf': 0.23932341628463008, 'min_impurity_decrease': 0.06044811624403674, 'max_features': 0.5777284206736848, 'subsample': 0.23786959403732386, 'dropout_rate': 0.8584292054089149, 'ccp_alpha': 1.8152645956584839}. Best is trial 187 with value: 0.6933481836305168.[0m
[32m[I 2022-04-22 01:30:33,059][0m Trial 997 finished with value: 0.6806812116909883 and parameters: {'loss': 'coxph', 'learning_rate': 1.8815385515625073e-06, 'n_estimators': 230, 'criterion': 'squared_error', 'min_samples_split': 8, 'min_samples_leaf': 2, 'min_weight_fraction_leaf': 0.2571304986335469, 'min_impurity_decrease': 0.15673300126381504, 'max_features': 0.36339643286709367, 'subsample': 0.20973306672419986, 'dropout_rate': 0.6396444716097401, 'ccp_alpha': 0.1631025943473332}. Best is trial 187 with value: 0.6933481836305168.[0m
[32m[I 2022-04-22 01:30:36,502][0m Trial 998 finished with value: 0.6869879679237858 and parameters: {'loss': 'coxph', 'learning_rate': 3.901660767953493e-05, 'n_estimators': 268, 'criterion': 'squared_error', 'min_samples_split': 7, 'min_samples_leaf': 7, 'min_weight_fraction_leaf': 0.23567576470107598, 'min_impurity_decrease': 0.09169582326641881, 'max_features': 0.7231608581482983, 'subsample': 0.28338184051641196, 'dropout_rate': 0.8982448325322616, 'ccp_alpha': 0.0886888216889949}. Best is trial 187 with value: 0.6933481836305168.[0m
[32m[I 2022-04-22 01:30:39,890][0m Trial 999 finished with value: 0.6904654196191029 and parameters: {'loss': 'coxph', 'learning_rate': 0.0032918039042883897, 'n_estimators': 242, 'criterion': 'squared_error', 'min_samples_split': 10, 'min_samples_leaf': 6, 'min_weight_fraction_leaf': 0.24981275024662233, 'min_impurity_decrease': 0.036227025669344534, 'max_features': 0.7429893755936392, 'subsample': 0.2589649404622198, 'dropout_rate': 0.9066249298535672, 'ccp_alpha': 0.008874806428303178}. Best is trial 187 with value: 0.6933481836305168.[0m
BoostingSurvival
Running Optimizer with LogRank binary scoring
{'loss': 'coxph', 'learning_rate': 0.00033995758940316977, 'n_estimators': 259, 'criterion': 'friedman_mse', 'min_samples_split': 2, 'min_samples_leaf': 1, 'min_weight_fraction_leaf': 0.05186153197318359, 'min_impurity_decrease': 0.25534755583477253, 'max_features': 0.12119539925669612, 'subsample': 0.04662493655183525, 'dropout_rate': 0.840223517523193, 'ccp_alpha': 0.08419353011339853, 'UnoC_LR': 0.8497573035489246}
Running Optimizer normaly
{'loss': 'coxph', 'learning_rate': 0.00018771369015567628, 'n_estimators': 361, 'criterion': 'squared_error', 'min_samples_split': 7, 'min_samples_leaf': 10, 'min_weight_fraction_leaf': 0.18467613089226587, 'min_impurity_decrease': 0.03892003884009698, 'max_features': 0.8430994376111369, 'subsample': 0.25481491532164796, 'dropout_rate': 0.13028118858724377, 'ccp_alpha': 0.014966792041178607, 'UnoC': 0.6933481836305168}
