[32m[I 2022-04-23 05:50:58,046][0m Trial 780 finished with value: 0.5303371293024742 and parameters: {'loss': 'coxph', 'learning_rate': 0.06922126173122203, 'n_estimators': 606, 'criterion': 'friedman_mse', 'min_samples_split': 9, 'min_samples_leaf': 4, 'min_weight_fraction_leaf': 0.04085246160105221, 'min_impurity_decrease': 0.6694289583204965, 'max_features': 0.5552113038149737, 'subsample': 0.29571695941245113, 'dropout_rate': 0.20882305144845012, 'ccp_alpha': 0.29131546878675396}. Best is trial 690 with value: 0.6691837560454439.[0m
[32m[I 2022-04-23 05:52:39,654][0m Trial 781 finished with value: 0.6505429302754715 and parameters: {'loss': 'coxph', 'learning_rate': 0.03261954863835304, 'n_estimators': 655, 'criterion': 'friedman_mse', 'min_samples_split': 9, 'min_samples_leaf': 5, 'min_weight_fraction_leaf': 0.020415477715076447, 'min_impurity_decrease': 0.4526679440462832, 'max_features': 0.5803355372359901, 'subsample': 0.21224745874648074, 'dropout_rate': 0.22725709744951605, 'ccp_alpha': 0.1724214261041676}. Best is trial 690 with value: 0.6691837560454439.[0m
[32m[I 2022-04-23 05:54:04,366][0m Trial 782 finished with value: 0.646457426988033 and parameters: {'loss': 'coxph', 'learning_rate': 0.05513141643110331, 'n_estimators': 583, 'criterion': 'friedman_mse', 'min_samples_split': 9, 'min_samples_leaf': 4, 'min_weight_fraction_leaf': 0.06298108947849317, 'min_impurity_decrease': 0.531760665163555, 'max_features': 0.15597408508987431, 'subsample': 0.3541593737942014, 'dropout_rate': 0.16736651750699647, 'ccp_alpha': 0.098707727430215}. Best is trial 690 with value: 0.6691837560454439.[0m
[32m[I 2022-04-23 05:55:21,350][0m Trial 783 finished with value: 0.5922505911179392 and parameters: {'loss': 'coxph', 'learning_rate': 0.07994103311301949, 'n_estimators': 559, 'criterion': 'friedman_mse', 'min_samples_split': 8, 'min_samples_leaf': 5, 'min_weight_fraction_leaf': 0.031775682909565464, 'min_impurity_decrease': 0.529072670336271, 'max_features': 0.8455811233583005, 'subsample': 0.2548927573510117, 'dropout_rate': 0.18911612459604324, 'ccp_alpha': 0.22573901915225308}. Best is trial 690 with value: 0.6691837560454439.[0m
[32m[I 2022-04-23 05:56:30,446][0m Trial 784 finished with value: 0.6268133818110297 and parameters: {'loss': 'coxph', 'learning_rate': 0.045379551465335385, 'n_estimators': 539, 'criterion': 'friedman_mse', 'min_samples_split': 9, 'min_samples_leaf': 4, 'min_weight_fraction_leaf': 0.050092011653878915, 'min_impurity_decrease': 0.49780607885887584, 'max_features': 0.34785643504079994, 'subsample': 0.6266598009461466, 'dropout_rate': 0.24232550891456894, 'ccp_alpha': 0.09510826488871933}. Best is trial 690 with value: 0.6691837560454439.[0m
[32m[I 2022-04-23 05:58:13,433][0m Trial 785 finished with value: 0.5 and parameters: {'loss': 'coxph', 'learning_rate': 0.06826825898274823, 'n_estimators': 644, 'criterion': 'absolute_error', 'min_samples_split': 9, 'min_samples_leaf': 4, 'min_weight_fraction_leaf': 0.0643190230261671, 'min_impurity_decrease': 0.4839158756410165, 'max_features': 0.6204261792901281, 'subsample': 0.31349197087905323, 'dropout_rate': 0.2099259097226521, 'ccp_alpha': 0.08378528762437894}. Best is trial 690 with value: 0.6691837560454439.[0m
/media/san2_ssd/data/Workdir/survival/venv/lib/python3.8/site-packages/sksurv/ensemble/boosting.py:955: RuntimeWarning: divide by zero encountered in log
  time = numpy.log(time)
/media/san2_ssd/data/Workdir/survival/venv/lib/python3.8/site-packages/sksurv/ensemble/boosting.py:955: RuntimeWarning: divide by zero encountered in log
  time = numpy.log(time)
/media/san2_ssd/data/Workdir/survival/venv/lib/python3.8/site-packages/sksurv/ensemble/boosting.py:955: RuntimeWarning: divide by zero encountered in log
  time = numpy.log(time)
/media/san2_ssd/data/Workdir/survival/venv/lib/python3.8/site-packages/sksurv/ensemble/boosting.py:955: RuntimeWarning: divide by zero encountered in log
  time = numpy.log(time)
[32m[I 2022-04-23 05:58:31,610][0m Trial 786 finished with value: -0.7142215818561414 and parameters: {'loss': 'squared', 'learning_rate': 2.8373029926703078e-06, 'n_estimators': 601, 'criterion': 'friedman_mse', 'min_samples_split': 9, 'min_samples_leaf': 5, 'min_weight_fraction_leaf': 0.04063077854603203, 'min_impurity_decrease': 0.3559531045153607, 'max_features': 0.5656948705119095, 'subsample': 0.28130802246161796, 'dropout_rate': 0.17167922183458387, 'ccp_alpha': 0.9951725659643765}. Best is trial 690 with value: 0.6691837560454439.[0m
[32m[I 2022-04-23 06:00:36,318][0m Trial 787 finished with value: 0.6581391412657215 and parameters: {'loss': 'coxph', 'learning_rate': 0.006228242391837205, 'n_estimators': 698, 'criterion': 'friedman_mse', 'min_samples_split': 9, 'min_samples_leaf': 4, 'min_weight_fraction_leaf': 0.024508252645029448, 'min_impurity_decrease': 0.8498191174085152, 'max_features': 0.5187632385508356, 'subsample': 0.233551209453665, 'dropout_rate': 0.19854540268080437, 'ccp_alpha': 0.007179998332258849}. Best is trial 690 with value: 0.6691837560454439.[0m
[32m[I 2022-04-23 06:02:52,380][0m Trial 788 finished with value: 0.628051740690789 and parameters: {'loss': 'coxph', 'learning_rate': 0.0998462855700319, 'n_estimators': 786, 'criterion': 'friedman_mse', 'min_samples_split': 9, 'min_samples_leaf': 4, 'min_weight_fraction_leaf': 0.19897469899728545, 'min_impurity_decrease': 0.5129330380852676, 'max_features': 0.5986837540283418, 'subsample': 0.26146534727573123, 'dropout_rate': 0.24366295409448913, 'ccp_alpha': 0.17903833555503607}. Best is trial 690 with value: 0.6691837560454439.[0m
[32m[I 2022-04-23 06:04:19,730][0m Trial 789 finished with value: 0.5936511608358416 and parameters: {'loss': 'coxph', 'learning_rate': 0.06190642633810484, 'n_estimators': 607, 'criterion': 'friedman_mse', 'min_samples_split': 9, 'min_samples_leaf': 4, 'min_weight_fraction_leaf': 0.29672830146816254, 'min_impurity_decrease': 0.5663752122924419, 'max_features': 0.19553501811010127, 'subsample': 0.293554440614349, 'dropout_rate': 0.22042872404495262, 'ccp_alpha': 0.0029870751268444686}. Best is trial 690 with value: 0.6691837560454439.[0m
[32m[I 2022-04-23 06:05:46,022][0m Trial 790 finished with value: 0.6652350409607106 and parameters: {'loss': 'coxph', 'learning_rate': 0.0802436658760245, 'n_estimators': 578, 'criterion': 'friedman_mse', 'min_samples_split': 9, 'min_samples_leaf': 4, 'min_weight_fraction_leaf': 0.05373859681297754, 'min_impurity_decrease': 0.46970905817712394, 'max_features': 0.5413755764273122, 'subsample': 0.22086084601575068, 'dropout_rate': 0.18156227791309196, 'ccp_alpha': 0.0026905502407990364}. Best is trial 690 with value: 0.6691837560454439.[0m
[32m[I 2022-04-23 06:07:14,630][0m Trial 791 finished with value: 0.5797976911489482 and parameters: {'loss': 'coxph', 'learning_rate': 0.09892493809550697, 'n_estimators': 584, 'criterion': 'friedman_mse', 'min_samples_split': 9, 'min_samples_leaf': 4, 'min_weight_fraction_leaf': 0.048394181367528766, 'min_impurity_decrease': 0.44536577742866035, 'max_features': 0.5030548210227046, 'subsample': 0.1738773508698, 'dropout_rate': 0.15169068958740542, 'ccp_alpha': 0.2898013865544912}. Best is trial 690 with value: 0.6691837560454439.[0m
[32m[I 2022-04-23 06:08:36,650][0m Trial 792 finished with value: 0.5 and parameters: {'loss': 'coxph', 'learning_rate': 0.08133381314026751, 'n_estimators': 570, 'criterion': 'friedman_mse', 'min_samples_split': 9, 'min_samples_leaf': 4, 'min_weight_fraction_leaf': 0.04191414972655822, 'min_impurity_decrease': 0.4582425937765448, 'max_features': 0.5275209495305822, 'subsample': 0.9867699535316328, 'dropout_rate': 0.1746891184758724, 'ccp_alpha': 0.44404138021072687}. Best is trial 690 with value: 0.6691837560454439.[0m
[32m[I 2022-04-23 06:10:10,691][0m Trial 793 finished with value: 0.6350036005329411 and parameters: {'loss': 'coxph', 'learning_rate': 0.07698321827789081, 'n_estimators': 627, 'criterion': 'friedman_mse', 'min_samples_split': 9, 'min_samples_leaf': 4, 'min_weight_fraction_leaf': 0.1716312785257434, 'min_impurity_decrease': 0.42543066330662904, 'max_features': 0.5404932177512236, 'subsample': 0.19254666555610161, 'dropout_rate': 0.19007007041829108, 'ccp_alpha': 0.1599424429789197}. Best is trial 690 with value: 0.6691837560454439.[0m
[32m[I 2022-04-23 06:11:39,623][0m Trial 794 finished with value: 0.6149387185713782 and parameters: {'loss': 'coxph', 'learning_rate': 0.08003157891531389, 'n_estimators': 591, 'criterion': 'friedman_mse', 'min_samples_split': 9, 'min_samples_leaf': 4, 'min_weight_fraction_leaf': 0.05602915796911766, 'min_impurity_decrease': 0.4684856061394607, 'max_features': 0.5485293355848425, 'subsample': 0.6633903965880272, 'dropout_rate': 0.1574104369425228, 'ccp_alpha': 0.09493165858160983}. Best is trial 690 with value: 0.6691837560454439.[0m
[32m[I 2022-04-23 06:13:22,561][0m Trial 795 finished with value: 0.5 and parameters: {'loss': 'coxph', 'learning_rate': 0.06800327214336505, 'n_estimators': 642, 'criterion': 'squared_error', 'min_samples_split': 9, 'min_samples_leaf': 4, 'min_weight_fraction_leaf': 0.037062407067194124, 'min_impurity_decrease': 0.47722846032589006, 'max_features': 0.5218365181020627, 'subsample': 0.19981035187011345, 'dropout_rate': 0.17399144228090918, 'ccp_alpha': 3.2566573848807634}. Best is trial 690 with value: 0.6691837560454439.[0m
[32m[I 2022-04-23 06:14:34,443][0m Trial 796 finished with value: 0.5 and parameters: {'loss': 'coxph', 'learning_rate': 0.08016288083427213, 'n_estimators': 555, 'criterion': 'friedman_mse', 'min_samples_split': 9, 'min_samples_leaf': 4, 'min_weight_fraction_leaf': 0.02931421676943776, 'min_impurity_decrease': 0.4938204206523828, 'max_features': 0.4751742145496309, 'subsample': 0.22193379080661835, 'dropout_rate': 0.20762349042461617, 'ccp_alpha': 3.854980587056771}. Best is trial 690 with value: 0.6691837560454439.[0m
[32m[I 2022-04-23 06:16:07,078][0m Trial 797 finished with value: 0.5 and parameters: {'loss': 'coxph', 'learning_rate': 0.05753006269261473, 'n_estimators': 616, 'criterion': 'friedman_mse', 'min_samples_split': 9, 'min_samples_leaf': 5, 'min_weight_fraction_leaf': 0.2829604970865611, 'min_impurity_decrease': 0.43855844756127377, 'max_features': 0.5094296658244345, 'subsample': 0.2227413607824767, 'dropout_rate': 0.18568258986541777, 'ccp_alpha': 0.3379780435160965}. Best is trial 690 with value: 0.6691837560454439.[0m
[32m[I 2022-04-23 06:18:05,744][0m Trial 798 finished with value: 0.6596215004994901 and parameters: {'loss': 'coxph', 'learning_rate': 0.08215621382347339, 'n_estimators': 683, 'criterion': 'friedman_mse', 'min_samples_split': 9, 'min_samples_leaf': 4, 'min_weight_fraction_leaf': 0.0580146053006657, 'min_impurity_decrease': 0.4094797804319529, 'max_features': 0.53523572985033, 'subsample': 0.20852545724355165, 'dropout_rate': 0.1602137429222244, 'ccp_alpha': 0.09255607160039564}. Best is trial 690 with value: 0.6691837560454439.[0m
[32m[I 2022-04-23 06:19:36,126][0m Trial 799 finished with value: 0.6619576296884992 and parameters: {'loss': 'coxph', 'learning_rate': 0.09941868760926902, 'n_estimators': 594, 'criterion': 'friedman_mse', 'min_samples_split': 9, 'min_samples_leaf': 4, 'min_weight_fraction_leaf': 0.021651052392960474, 'min_impurity_decrease': 0.4778700501474728, 'max_features': 0.5514511395316344, 'subsample': 0.23882010627905045, 'dropout_rate': 0.22655742453508107, 'ccp_alpha': 0.004951871403765391}. Best is trial 690 with value: 0.6691837560454439.[0m
[32m[I 2022-04-23 06:20:52,508][0m Trial 800 finished with value: 0.5950469495210223 and parameters: {'loss': 'coxph', 'learning_rate': 0.0663893695771796, 'n_estimators': 570, 'criterion': 'friedman_mse', 'min_samples_split': 9, 'min_samples_leaf': 4, 'min_weight_fraction_leaf': 0.047870647584456735, 'min_impurity_decrease': 0.4903882924112739, 'max_features': 0.4938867025019038, 'subsample': 0.2501761113953808, 'dropout_rate': 0.20393295759388014, 'ccp_alpha': 0.21884753079511107}. Best is trial 690 with value: 0.6691837560454439.[0m
[32m[I 2022-04-23 06:20:56,756][0m Trial 801 finished with value: 0.620370813463501 and parameters: {'loss': 'coxph', 'learning_rate': 0.05592370423533331, 'n_estimators': 118, 'criterion': 'friedman_mse', 'min_samples_split': 9, 'min_samples_leaf': 4, 'min_weight_fraction_leaf': 0.03540720415173316, 'min_impurity_decrease': 0.5858038551197319, 'max_features': 0.27424834745485194, 'subsample': 0.22780826846031718, 'dropout_rate': 0.18999386065846174, 'ccp_alpha': 0.15302582138352594}. Best is trial 690 with value: 0.6691837560454439.[0m
[32m[I 2022-04-23 06:21:30,044][0m Trial 802 finished with value: 0.6513465136282945 and parameters: {'loss': 'coxph', 'learning_rate': 0.07843878153751856, 'n_estimators': 664, 'criterion': 'friedman_mse', 'min_samples_split': 8, 'min_samples_leaf': 4, 'min_weight_fraction_leaf': 0.011781818337623198, 'min_impurity_decrease': 0.45805165151138055, 'max_features': 0.5662936367864192, 'subsample': 0.1884253631652303, 'dropout_rate': 0.8568788414325779, 'ccp_alpha': 0.002678823528593245}. Best is trial 690 with value: 0.6691837560454439.[0m
[32m[I 2022-04-23 06:22:44,774][0m Trial 803 finished with value: 0.6513879326605936 and parameters: {'loss': 'coxph', 'learning_rate': 0.05663295458237429, 'n_estimators': 550, 'criterion': 'friedman_mse', 'min_samples_split': 9, 'min_samples_leaf': 5, 'min_weight_fraction_leaf': 0.06352303335429568, 'min_impurity_decrease': 0.5082172329512042, 'max_features': 0.5704966118438006, 'subsample': 0.21224310901792698, 'dropout_rate': 0.24349127634078202, 'ccp_alpha': 0.09542684857980659}. Best is trial 690 with value: 0.6691837560454439.[0m
[32m[I 2022-04-23 06:24:13,963][0m Trial 804 finished with value: 0.605003809001506 and parameters: {'loss': 'coxph', 'learning_rate': 0.06962257659612041, 'n_estimators': 621, 'criterion': 'friedman_mse', 'min_samples_split': 9, 'min_samples_leaf': 6, 'min_weight_fraction_leaf': 0.04591428821225607, 'min_impurity_decrease': 0.41209592178912324, 'max_features': 0.5455697921720022, 'subsample': 0.24969172019563424, 'dropout_rate': 0.22065554593749012, 'ccp_alpha': 0.2268445594785396}. Best is trial 690 with value: 0.6691837560454439.[0m
/media/san2_ssd/data/Workdir/survival/venv/lib/python3.8/site-packages/sksurv/ensemble/boosting.py:955: RuntimeWarning: divide by zero encountered in log
  time = numpy.log(time)
/media/san2_ssd/data/Workdir/survival/venv/lib/python3.8/site-packages/sksurv/ensemble/boosting.py:955: RuntimeWarning: divide by zero encountered in log
  time = numpy.log(time)
/media/san2_ssd/data/Workdir/survival/venv/lib/python3.8/site-packages/sksurv/ensemble/boosting.py:955: RuntimeWarning: divide by zero encountered in log
  time = numpy.log(time)
/media/san2_ssd/data/Workdir/survival/venv/lib/python3.8/site-packages/sksurv/ensemble/boosting.py:955: RuntimeWarning: divide by zero encountered in log
  time = numpy.log(time)
[32m[I 2022-04-23 06:24:28,539][0m Trial 805 finished with value: -0.7358838822898187 and parameters: {'loss': 'squared', 'learning_rate': 0.047158623424244345, 'n_estimators': 541, 'criterion': 'friedman_mse', 'min_samples_split': 9, 'min_samples_leaf': 4, 'min_weight_fraction_leaf': 0.02876233279301022, 'min_impurity_decrease': 0.4730118735575073, 'max_features': 0.5203126092650272, 'subsample': 0.27243535037899985, 'dropout_rate': 0.15602605423614344, 'ccp_alpha': 0.08630815123429304}. Best is trial 690 with value: 0.6691837560454439.[0m
[32m[I 2022-04-23 06:25:57,181][0m Trial 806 finished with value: 0.6598280678136804 and parameters: {'loss': 'coxph', 'learning_rate': 0.08511386558755629, 'n_estimators': 743, 'criterion': 'friedman_mse', 'min_samples_split': 9, 'min_samples_leaf': 4, 'min_weight_fraction_leaf': 0.01726499305623423, 'min_impurity_decrease': 0.3062614729170533, 'max_features': 0.5585296211361894, 'subsample': 0.23645322152177956, 'dropout_rate': 0.5306167727971545, 'ccp_alpha': 0.004659121234063143}. Best is trial 690 with value: 0.6691837560454439.[0m
[32m[I 2022-04-23 06:27:37,753][0m Trial 807 finished with value: 0.6398700297302184 and parameters: {'loss': 'coxph', 'learning_rate': 0.0664500194687782, 'n_estimators': 645, 'criterion': 'friedman_mse', 'min_samples_split': 9, 'min_samples_leaf': 4, 'min_weight_fraction_leaf': 0.052949928155431675, 'min_impurity_decrease': 0.5321926786988016, 'max_features': 0.5843544689937163, 'subsample': 0.25200113240633615, 'dropout_rate': 0.17937118524461224, 'ccp_alpha': 0.18274467544534018}. Best is trial 690 with value: 0.6691837560454439.[0m
[32m[I 2022-04-23 06:29:03,624][0m Trial 808 finished with value: 0.6560485937958027 and parameters: {'loss': 'coxph', 'learning_rate': 0.05423314771499833, 'n_estimators': 581, 'criterion': 'friedman_mse', 'min_samples_split': 8, 'min_samples_leaf': 4, 'min_weight_fraction_leaf': 0.06490277663581825, 'min_impurity_decrease': 0.4446365666963651, 'max_features': 0.5341655018462383, 'subsample': 0.17986931823854574, 'dropout_rate': 0.20580933483858735, 'ccp_alpha': 0.002058402129671814}. Best is trial 690 with value: 0.6691837560454439.[0m
[32m[I 2022-04-23 06:30:34,167][0m Trial 809 finished with value: 0.5175782077396875 and parameters: {'loss': 'coxph', 'learning_rate': 0.08501067270443592, 'n_estimators': 602, 'criterion': 'absolute_error', 'min_samples_split': 9, 'min_samples_leaf': 5, 'min_weight_fraction_leaf': 0.03139650655767631, 'min_impurity_decrease': 0.2827599103935825, 'max_features': 0.5783185413072663, 'subsample': 0.21994914809748145, 'dropout_rate': 0.1679352936059618, 'ccp_alpha': 0.0018289417460302796}. Best is trial 690 with value: 0.6691837560454439.[0m
[32m[I 2022-04-23 06:32:21,091][0m Trial 810 finished with value: 0.5006540204610004 and parameters: {'loss': 'coxph', 'learning_rate': 0.09874782254744763, 'n_estimators': 637, 'criterion': 'friedman_mse', 'min_samples_split': 9, 'min_samples_leaf': 4, 'min_weight_fraction_leaf': 0.04185257761938672, 'min_impurity_decrease': 0.5105326872941284, 'max_features': 0.4983843127618165, 'subsample': 0.2801140949536812, 'dropout_rate': 0.14593176007182385, 'ccp_alpha': 0.34669307453105785}. Best is trial 690 with value: 0.6691837560454439.[0m
[32m[I 2022-04-23 06:34:11,211][0m Trial 811 finished with value: 0.6508310577593737 and parameters: {'loss': 'coxph', 'learning_rate': 0.03892684708509242, 'n_estimators': 671, 'criterion': 'friedman_mse', 'min_samples_split': 9, 'min_samples_leaf': 4, 'min_weight_fraction_leaf': 0.056518320690085624, 'min_impurity_decrease': 0.49387509101941335, 'max_features': 0.5941379786044425, 'subsample': 0.26741799422040125, 'dropout_rate': 0.19736755061136024, 'ccp_alpha': 0.15507000737086035}. Best is trial 690 with value: 0.6691837560454439.[0m
[32m[I 2022-04-23 06:35:30,390][0m Trial 812 finished with value: 0.6563289637041032 and parameters: {'loss': 'coxph', 'learning_rate': 0.07154856954790385, 'n_estimators': 579, 'criterion': 'friedman_mse', 'min_samples_split': 9, 'min_samples_leaf': 4, 'min_weight_fraction_leaf': 0.06990496955910601, 'min_impurity_decrease': 0.38948016191728413, 'max_features': 0.5515880680244656, 'subsample': 0.19648031525141194, 'dropout_rate': 0.23139525035545405, 'ccp_alpha': 0.10188955421960147}. Best is trial 690 with value: 0.6691837560454439.[0m
[32m[I 2022-04-23 06:37:35,124][0m Trial 813 finished with value: 0.561535583774356 and parameters: {'loss': 'coxph', 'learning_rate': 0.09959770889411328, 'n_estimators': 717, 'criterion': 'friedman_mse', 'min_samples_split': 6, 'min_samples_leaf': 4, 'min_weight_fraction_leaf': 0.014027891033157418, 'min_impurity_decrease': 0.46277823441253263, 'max_features': 0.5187113972848804, 'subsample': 0.23104930913507443, 'dropout_rate': 0.21503455476816813, 'ccp_alpha': 0.2670569720276336}. Best is trial 690 with value: 0.6691837560454439.[0m
[32m[I 2022-04-23 06:38:45,795][0m Trial 814 finished with value: 0.5803927438009696 and parameters: {'loss': 'coxph', 'learning_rate': 0.05627582541246646, 'n_estimators': 539, 'criterion': 'friedman_mse', 'min_samples_split': 2, 'min_samples_leaf': 5, 'min_weight_fraction_leaf': 0.40922291594902505, 'min_impurity_decrease': 0.48889608736682605, 'max_features': 0.6269084747691799, 'subsample': 0.24972939084501497, 'dropout_rate': 0.24720064162506772, 'ccp_alpha': 0.002199370710154618}. Best is trial 690 with value: 0.6691837560454439.[0m
[32m[I 2022-04-23 06:40:14,839][0m Trial 815 finished with value: 0.5680790465210606 and parameters: {'loss': 'coxph', 'learning_rate': 0.0693281557549033, 'n_estimators': 611, 'criterion': 'friedman_mse', 'min_samples_split': 9, 'min_samples_leaf': 4, 'min_weight_fraction_leaf': 0.3623304298698422, 'min_impurity_decrease': 0.6327306919043851, 'max_features': 0.8682826907641353, 'subsample': 0.26268874656121055, 'dropout_rate': 0.18407084823773498, 'ccp_alpha': 0.1577402353961444}. Best is trial 690 with value: 0.6691837560454439.[0m
[32m[I 2022-04-23 06:41:35,311][0m Trial 816 finished with value: 0.5 and parameters: {'loss': 'coxph', 'learning_rate': 0.043847293411243056, 'n_estimators': 565, 'criterion': 'squared_error', 'min_samples_split': 9, 'min_samples_leaf': 4, 'min_weight_fraction_leaf': 0.024399446183916568, 'min_impurity_decrease': 0.5504538156674454, 'max_features': 0.5701274114854942, 'subsample': 0.2831983510725343, 'dropout_rate': 0.13245792726393568, 'ccp_alpha': 0.08738917963812083}. Best is trial 690 with value: 0.6691837560454439.[0m
