[32m[I 2022-04-21 16:45:18,682][0m Trial 255 finished with value: 0.8442147784385738 and parameters: {'loss': 'coxph', 'learning_rate': 0.0002069213773887265, 'n_estimators': 223, 'criterion': 'friedman_mse', 'min_samples_split': 3, 'min_samples_leaf': 2, 'min_weight_fraction_leaf': 0.14744242215503622, 'min_impurity_decrease': 0.406687822258775, 'max_features': 0.2565177083313521, 'subsample': 0.09787357442137745, 'dropout_rate': 0.11563510044880203, 'ccp_alpha': 0.0036426201535119523}. Best is trial 244 with value: 0.8474070660226068.[0m
[32m[I 2022-04-21 16:45:38,107][0m Trial 256 finished with value: 0.8461543149161198 and parameters: {'loss': 'coxph', 'learning_rate': 0.005948488895087866, 'n_estimators': 291, 'criterion': 'friedman_mse', 'min_samples_split': 3, 'min_samples_leaf': 2, 'min_weight_fraction_leaf': 0.17071237313608792, 'min_impurity_decrease': 0.2694305803333223, 'max_features': 0.8914235472491681, 'subsample': 0.16227257354177754, 'dropout_rate': 0.15306100367038733, 'ccp_alpha': 0.11652611837099468}. Best is trial 244 with value: 0.8474070660226068.[0m
[32m[I 2022-04-21 16:46:03,182][0m Trial 257 finished with value: 0.8451698700310353 and parameters: {'loss': 'coxph', 'learning_rate': 0.005753164015190496, 'n_estimators': 290, 'criterion': 'friedman_mse', 'min_samples_split': 3, 'min_samples_leaf': 2, 'min_weight_fraction_leaf': 0.2330040302680917, 'min_impurity_decrease': 0.2522311297977377, 'max_features': 0.9186287462774287, 'subsample': 0.16087701774161522, 'dropout_rate': 0.12976660391006045, 'ccp_alpha': 0.16343455174846744}. Best is trial 244 with value: 0.8474070660226068.[0m
[32m[I 2022-04-21 16:46:28,103][0m Trial 258 finished with value: 0.8418592262414168 and parameters: {'loss': 'coxph', 'learning_rate': 0.012076422406636422, 'n_estimators': 300, 'criterion': 'friedman_mse', 'min_samples_split': 3, 'min_samples_leaf': 2, 'min_weight_fraction_leaf': 0.1875715738318973, 'min_impurity_decrease': 0.21961807824871415, 'max_features': 0.7126050816395214, 'subsample': 0.07112256751653498, 'dropout_rate': 0.14939622212599565, 'ccp_alpha': 0.3681445850847972}. Best is trial 244 with value: 0.8474070660226068.[0m
[32m[I 2022-04-21 16:47:16,849][0m Trial 259 finished with value: 0.8441360601201836 and parameters: {'loss': 'coxph', 'learning_rate': 0.0038417789465288563, 'n_estimators': 419, 'criterion': 'friedman_mse', 'min_samples_split': 3, 'min_samples_leaf': 3, 'min_weight_fraction_leaf': 0.16744739747492157, 'min_impurity_decrease': 0.27077383764134344, 'max_features': 0.8838598735006005, 'subsample': 0.09560222146395687, 'dropout_rate': 0.07730577404517597, 'ccp_alpha': 0.11497936947182016}. Best is trial 244 with value: 0.8474070660226068.[0m
[32m[I 2022-04-21 16:47:34,584][0m Trial 260 finished with value: 0.8411004626600495 and parameters: {'loss': 'coxph', 'learning_rate': 0.00842968306548862, 'n_estimators': 284, 'criterion': 'friedman_mse', 'min_samples_split': 4, 'min_samples_leaf': 2, 'min_weight_fraction_leaf': 0.15542471609113245, 'min_impurity_decrease': 0.3564182146525576, 'max_features': 0.9472328340864397, 'subsample': 0.11113525999702681, 'dropout_rate': 0.16742326282909714, 'ccp_alpha': 0.2593941838304719}. Best is trial 244 with value: 0.8474070660226068.[0m
/media/san2_ssd/data/Workdir/survival/venv/lib/python3.8/site-packages/sksurv/ensemble/boosting.py:955: RuntimeWarning: divide by zero encountered in log
  time = numpy.log(time)
/media/san2_ssd/data/Workdir/survival/venv/lib/python3.8/site-packages/sksurv/ensemble/boosting.py:955: RuntimeWarning: divide by zero encountered in log
  time = numpy.log(time)
/media/san2_ssd/data/Workdir/survival/venv/lib/python3.8/site-packages/sksurv/ensemble/boosting.py:955: RuntimeWarning: divide by zero encountered in log
  time = numpy.log(time)
/media/san2_ssd/data/Workdir/survival/venv/lib/python3.8/site-packages/sksurv/ensemble/boosting.py:955: RuntimeWarning: divide by zero encountered in log
  time = numpy.log(time)
[32m[I 2022-04-21 16:47:37,531][0m Trial 261 finished with value: -0.46667268029349207 and parameters: {'loss': 'squared', 'learning_rate': 0.007925652566502689, 'n_estimators': 273, 'criterion': 'friedman_mse', 'min_samples_split': 3, 'min_samples_leaf': 2, 'min_weight_fraction_leaf': 0.20966117852450541, 'min_impurity_decrease': 0.19343497950044142, 'max_features': 0.7948696776909838, 'subsample': 0.181419028498788, 'dropout_rate': 0.12054470789831565, 'ccp_alpha': 0.11221805579850544}. Best is trial 244 with value: 0.8474070660226068.[0m
[32m[I 2022-04-21 16:48:02,022][0m Trial 262 finished with value: 0.65 and parameters: {'loss': 'coxph', 'learning_rate': 0.006706376762729559, 'n_estimators': 313, 'criterion': 'friedman_mse', 'min_samples_split': 3, 'min_samples_leaf': 2, 'min_weight_fraction_leaf': 0.19394899406249444, 'min_impurity_decrease': 0.27505321626129836, 'max_features': 0.1818783250648555, 'subsample': 0.06284629313981388, 'dropout_rate': 0.09922270974913865, 'ccp_alpha': 1.6819812714140818}. Best is trial 244 with value: 0.8474070660226068.[0m
[32m[I 2022-04-21 16:48:24,423][0m Trial 263 finished with value: 0.8427855051198092 and parameters: {'loss': 'coxph', 'learning_rate': 0.005009850364236149, 'n_estimators': 256, 'criterion': 'friedman_mse', 'min_samples_split': 3, 'min_samples_leaf': 2, 'min_weight_fraction_leaf': 0.1752090750345956, 'min_impurity_decrease': 0.32862873383685, 'max_features': 0.04232853022525407, 'subsample': 0.031942315522393724, 'dropout_rate': 0.055858424729346996, 'ccp_alpha': 0.18059860098605546}. Best is trial 244 with value: 0.8474070660226068.[0m
[32m[I 2022-04-21 16:48:43,181][0m Trial 264 finished with value: 0.8434065353375411 and parameters: {'loss': 'coxph', 'learning_rate': 0.01074485107882155, 'n_estimators': 281, 'criterion': 'friedman_mse', 'min_samples_split': 3, 'min_samples_leaf': 5, 'min_weight_fraction_leaf': 0.218979442560855, 'min_impurity_decrease': 0.2388947892153682, 'max_features': 0.7365575671470639, 'subsample': 0.15754521167035684, 'dropout_rate': 0.15155537867476207, 'ccp_alpha': 0.25672233108658765}. Best is trial 244 with value: 0.8474070660226068.[0m
[32m[I 2022-04-21 16:49:11,970][0m Trial 265 finished with value: 0.8464581312325679 and parameters: {'loss': 'coxph', 'learning_rate': 7.940614898851428e-05, 'n_estimators': 327, 'criterion': 'friedman_mse', 'min_samples_split': 3, 'min_samples_leaf': 2, 'min_weight_fraction_leaf': 0.14607769160957987, 'min_impurity_decrease': 0.28559176160750666, 'max_features': 0.9260857014631675, 'subsample': 0.08653590759981572, 'dropout_rate': 0.134163388600339, 'ccp_alpha': 0.091656893014671}. Best is trial 244 with value: 0.8474070660226068.[0m
[32m[I 2022-04-21 16:49:44,828][0m Trial 266 finished with value: 0.8445068373415244 and parameters: {'loss': 'coxph', 'learning_rate': 7.365295469947283e-05, 'n_estimators': 343, 'criterion': 'friedman_mse', 'min_samples_split': 3, 'min_samples_leaf': 2, 'min_weight_fraction_leaf': 0.1442369521773496, 'min_impurity_decrease': 0.29025998907945205, 'max_features': 0.9846844361577994, 'subsample': 0.08647540980659679, 'dropout_rate': 0.1265249306534166, 'ccp_alpha': 0.09850986812312547}. Best is trial 244 with value: 0.8474070660226068.[0m
[32m[I 2022-04-21 16:50:07,115][0m Trial 267 finished with value: 0.842639149613056 and parameters: {'loss': 'coxph', 'learning_rate': 8.82885547299855e-05, 'n_estimators': 327, 'criterion': 'friedman_mse', 'min_samples_split': 3, 'min_samples_leaf': 2, 'min_weight_fraction_leaf': 0.13204817216843645, 'min_impurity_decrease': 0.2589272704874574, 'max_features': 0.8838464167599016, 'subsample': 0.05538678258895889, 'dropout_rate': 0.10213331463108107, 'ccp_alpha': 0.1993053833960287}. Best is trial 244 with value: 0.8474070660226068.[0m
[32m[I 2022-04-21 16:50:22,514][0m Trial 268 finished with value: 0.8377619042139696 and parameters: {'loss': 'coxph', 'learning_rate': 5.810591124834379e-05, 'n_estimators': 299, 'criterion': 'friedman_mse', 'min_samples_split': 3, 'min_samples_leaf': 3, 'min_weight_fraction_leaf': 0.1604131412262358, 'min_impurity_decrease': 0.48510838154757824, 'max_features': 0.9312019684804986, 'subsample': 0.12503829510237496, 'dropout_rate': 0.14167423989393196, 'ccp_alpha': 0.3857079035714529}. Best is trial 244 with value: 0.8474070660226068.[0m
[32m[I 2022-04-21 16:50:55,392][0m Trial 269 finished with value: 0.8433297367106757 and parameters: {'loss': 'coxph', 'learning_rate': 0.00010709955352111405, 'n_estimators': 384, 'criterion': 'friedman_mse', 'min_samples_split': 3, 'min_samples_leaf': 2, 'min_weight_fraction_leaf': 0.1491432923710355, 'min_impurity_decrease': 0.30957056402943206, 'max_features': 0.9091318857649703, 'subsample': 0.08014009698417249, 'dropout_rate': 0.07384948462339153, 'ccp_alpha': 0.0054870495984429835}. Best is trial 244 with value: 0.8474070660226068.[0m
[32m[I 2022-04-21 16:51:18,261][0m Trial 270 finished with value: 0.7324571694760255 and parameters: {'loss': 'coxph', 'learning_rate': 0.00034044595696929215, 'n_estimators': 311, 'criterion': 'friedman_mse', 'min_samples_split': 3, 'min_samples_leaf': 2, 'min_weight_fraction_leaf': 0.18286649073265193, 'min_impurity_decrease': 0.5174599036382742, 'max_features': 0.8478298626408818, 'subsample': 0.3412055431418469, 'dropout_rate': 0.12919908180222905, 'ccp_alpha': 0.2914797761015924}. Best is trial 244 with value: 0.8474070660226068.[0m
[32m[I 2022-04-21 16:51:46,600][0m Trial 271 finished with value: 0.65 and parameters: {'loss': 'coxph', 'learning_rate': 7.299550345583716e-05, 'n_estimators': 324, 'criterion': 'friedman_mse', 'min_samples_split': 3, 'min_samples_leaf': 6, 'min_weight_fraction_leaf': 0.17007495078366747, 'min_impurity_decrease': 0.2729991167894283, 'max_features': 0.9046396315570797, 'subsample': 0.005961447679907042, 'dropout_rate': 0.09804706562329588, 'ccp_alpha': 0.11569545720663174}. Best is trial 244 with value: 0.8474070660226068.[0m
[32m[I 2022-04-21 16:52:00,286][0m Trial 272 finished with value: 0.8440005695750109 and parameters: {'loss': 'coxph', 'learning_rate': 4.743072147621365e-05, 'n_estimators': 276, 'criterion': 'friedman_mse', 'min_samples_split': 3, 'min_samples_leaf': 1, 'min_weight_fraction_leaf': 0.19958734751798007, 'min_impurity_decrease': 0.4513811145567025, 'max_features': 0.9408854413606283, 'subsample': 0.036874088232969726, 'dropout_rate': 0.474317918340647, 'ccp_alpha': 0.17919883363489064}. Best is trial 244 with value: 0.8474070660226068.[0m
[32m[I 2022-04-21 16:52:16,626][0m Trial 273 finished with value: 0.65 and parameters: {'loss': 'coxph', 'learning_rate': 0.00014339257026790663, 'n_estimators': 293, 'criterion': 'friedman_mse', 'min_samples_split': 3, 'min_samples_leaf': 7, 'min_weight_fraction_leaf': 0.1370110660743245, 'min_impurity_decrease': 0.14078019737915037, 'max_features': 0.9605673262366363, 'subsample': 0.0698764018902734, 'dropout_rate': 0.15254765982430565, 'ccp_alpha': 0.08724402599360961}. Best is trial 244 with value: 0.8474070660226068.[0m
[32m[I 2022-04-21 16:52:46,505][0m Trial 274 finished with value: 0.65 and parameters: {'loss': 'coxph', 'learning_rate': 9.954670009647229e-05, 'n_estimators': 350, 'criterion': 'friedman_mse', 'min_samples_split': 3, 'min_samples_leaf': 2, 'min_weight_fraction_leaf': 0.16195093630085125, 'min_impurity_decrease': 0.2880816676447217, 'max_features': 0.2779665025420685, 'subsample': 0.095754059081765, 'dropout_rate': 0.052111972528785605, 'ccp_alpha': 2.5465365712893426}. Best is trial 244 with value: 0.8474070660226068.[0m
[32m[I 2022-04-21 16:53:05,427][0m Trial 275 finished with value: 0.7163430607501293 and parameters: {'loss': 'coxph', 'learning_rate': 0.00023341077487869274, 'n_estimators': 260, 'criterion': 'absolute_error', 'min_samples_split': 3, 'min_samples_leaf': 2, 'min_weight_fraction_leaf': 0.18660125525383747, 'min_impurity_decrease': 0.33569273690000967, 'max_features': 0.23785890666145545, 'subsample': 0.13701787366046211, 'dropout_rate': 0.17133824982604304, 'ccp_alpha': 0.00457627749389611}. Best is trial 244 with value: 0.8474070660226068.[0m
[32m[I 2022-04-21 16:53:29,180][0m Trial 276 finished with value: 0.8403404918702277 and parameters: {'loss': 'coxph', 'learning_rate': 8.061367823023038e-05, 'n_estimators': 308, 'criterion': 'friedman_mse', 'min_samples_split': 3, 'min_samples_leaf': 2, 'min_weight_fraction_leaf': 0.17520199211591786, 'min_impurity_decrease': 0.24821654912467128, 'max_features': 0.9715482500716689, 'subsample': 0.11533548033693067, 'dropout_rate': 0.1150674402923203, 'ccp_alpha': 0.32354273977369896}. Best is trial 244 with value: 0.8474070660226068.[0m
[32m[I 2022-04-21 16:53:48,130][0m Trial 277 finished with value: 0.7224378553108805 and parameters: {'loss': 'coxph', 'learning_rate': 0.00013246953820289183, 'n_estimators': 245, 'criterion': 'friedman_mse', 'min_samples_split': 2, 'min_samples_leaf': 1, 'min_weight_fraction_leaf': 0.156560980233341, 'min_impurity_decrease': 0.3039251487530978, 'max_features': 0.9981162702207832, 'subsample': 0.7330087238353593, 'dropout_rate': 0.0881290431352222, 'ccp_alpha': 0.19323615789042717}. Best is trial 244 with value: 0.8474070660226068.[0m
[32m[I 2022-04-21 16:54:48,887][0m Trial 278 finished with value: 0.8426534694360879 and parameters: {'loss': 'coxph', 'learning_rate': 0.00016656296629440984, 'n_estimators': 467, 'criterion': 'friedman_mse', 'min_samples_split': 3, 'min_samples_leaf': 2, 'min_weight_fraction_leaf': 0.20060798983507086, 'min_impurity_decrease': 0.21074432941153082, 'max_features': 0.8310497849088133, 'subsample': 0.4907656939570072, 'dropout_rate': 0.1478413913293389, 'ccp_alpha': 0.08530830899622681}. Best is trial 244 with value: 0.8474070660226068.[0m
[32m[I 2022-04-21 16:54:51,756][0m Trial 279 finished with value: 0.832872087503517 and parameters: {'loss': 'coxph', 'learning_rate': 0.00011186775296715879, 'n_estimators': 101, 'criterion': 'friedman_mse', 'min_samples_split': 3, 'min_samples_leaf': 2, 'min_weight_fraction_leaf': 0.1873650824442554, 'min_impurity_decrease': 0.3191752247326924, 'max_features': 0.3398668041783339, 'subsample': 0.0572582927246108, 'dropout_rate': 0.026052984960104282, 'ccp_alpha': 0.46468238464397316}. Best is trial 244 with value: 0.8474070660226068.[0m
[32m[I 2022-04-21 16:55:13,161][0m Trial 280 finished with value: 0.8433816323060048 and parameters: {'loss': 'coxph', 'learning_rate': 6.099401188591866e-05, 'n_estimators': 337, 'criterion': 'friedman_mse', 'min_samples_split': 2, 'min_samples_leaf': 3, 'min_weight_fraction_leaf': 0.16883645416552925, 'min_impurity_decrease': 0.2724243346005793, 'max_features': 0.28658485291157476, 'subsample': 0.08650430144259469, 'dropout_rate': 0.1376158350378703, 'ccp_alpha': 0.2415447241465343}. Best is trial 244 with value: 0.8474070660226068.[0m
[32m[I 2022-04-21 16:55:31,215][0m Trial 281 finished with value: 0.65 and parameters: {'loss': 'coxph', 'learning_rate': 0.00019343312120896739, 'n_estimators': 270, 'criterion': 'friedman_mse', 'min_samples_split': 3, 'min_samples_leaf': 2, 'min_weight_fraction_leaf': 0.17672138344255406, 'min_impurity_decrease': 0.34202113960066605, 'max_features': 0.31818992353310727, 'subsample': 0.01993824756996715, 'dropout_rate': 0.21071940150241422, 'ccp_alpha': 0.15490542112012706}. Best is trial 244 with value: 0.8474070660226068.[0m
/media/san2_ssd/data/Workdir/survival/venv/lib/python3.8/site-packages/sksurv/ensemble/boosting.py:955: RuntimeWarning: divide by zero encountered in log
  time = numpy.log(time)
/media/san2_ssd/data/Workdir/survival/venv/lib/python3.8/site-packages/sksurv/ensemble/boosting.py:955: RuntimeWarning: divide by zero encountered in log
  time = numpy.log(time)
/media/san2_ssd/data/Workdir/survival/venv/lib/python3.8/site-packages/sksurv/ensemble/boosting.py:955: RuntimeWarning: divide by zero encountered in log
  time = numpy.log(time)
/media/san2_ssd/data/Workdir/survival/venv/lib/python3.8/site-packages/sksurv/ensemble/boosting.py:955: RuntimeWarning: divide by zero encountered in log
  time = numpy.log(time)
[32m[I 2022-04-21 16:55:39,467][0m Trial 282 finished with value: -0.46667268029349207 and parameters: {'loss': 'squared', 'learning_rate': 8.748515301330234e-05, 'n_estimators': 291, 'criterion': 'friedman_mse', 'min_samples_split': 3, 'min_samples_leaf': 1, 'min_weight_fraction_leaf': 0.14655070989709149, 'min_impurity_decrease': 0.29348172454672683, 'max_features': 0.37317388577070454, 'subsample': 0.10779825798484363, 'dropout_rate': 0.11369801122947924, 'ccp_alpha': 0.00140126368267421}. Best is trial 244 with value: 0.8474070660226068.[0m
[32m[I 2022-04-21 16:56:11,876][0m Trial 283 finished with value: 0.843738092351958 and parameters: {'loss': 'coxph', 'learning_rate': 0.0005069031374937265, 'n_estimators': 364, 'criterion': 'friedman_mse', 'min_samples_split': 3, 'min_samples_leaf': 2, 'min_weight_fraction_leaf': 0.20799617414935534, 'min_impurity_decrease': 0.3184958178038345, 'max_features': 0.2591706482266455, 'subsample': 0.15196672964035995, 'dropout_rate': 0.07861685328733549, 'ccp_alpha': 0.09667465255230448}. Best is trial 244 with value: 0.8474070660226068.[0m
[32m[I 2022-04-21 16:56:30,903][0m Trial 284 finished with value: 0.65 and parameters: {'loss': 'coxph', 'learning_rate': 0.00028025379186961415, 'n_estimators': 252, 'criterion': 'friedman_mse', 'min_samples_split': 3, 'min_samples_leaf': 8, 'min_weight_fraction_leaf': 0.19253766902559857, 'min_impurity_decrease': 0.23416630926008997, 'max_features': 0.12870307489890184, 'subsample': 0.04251688761204837, 'dropout_rate': 0.17869694094385374, 'ccp_alpha': 0.3075746781583284}. Best is trial 244 with value: 0.8474070660226068.[0m
[32m[I 2022-04-21 16:56:51,749][0m Trial 285 finished with value: 0.8448345919618122 and parameters: {'loss': 'coxph', 'learning_rate': 4.7003452650788126e-05, 'n_estimators': 309, 'criterion': 'friedman_mse', 'min_samples_split': 4, 'min_samples_leaf': 2, 'min_weight_fraction_leaf': 0.1651839882143405, 'min_impurity_decrease': 0.26429789060149844, 'max_features': 0.2277080019918392, 'subsample': 0.07003283268201443, 'dropout_rate': 0.16114941340817418, 'ccp_alpha': 0.08431054255427314}. Best is trial 244 with value: 0.8474070660226068.[0m
[32m[I 2022-04-21 16:57:20,671][0m Trial 286 finished with value: 0.8449601145147222 and parameters: {'loss': 'coxph', 'learning_rate': 0.002097429756126811, 'n_estimators': 323, 'criterion': 'friedman_mse', 'min_samples_split': 2, 'min_samples_leaf': 2, 'min_weight_fraction_leaf': 0.18082943937401644, 'min_impurity_decrease': 0.28680534352774234, 'max_features': 0.35283821609649846, 'subsample': 0.2739464015770108, 'dropout_rate': 0.13479039012526933, 'ccp_alpha': 0.0023786564232702034}. Best is trial 244 with value: 0.8474070660226068.[0m
[32m[I 2022-04-21 16:57:37,493][0m Trial 287 finished with value: 0.8450353730405865 and parameters: {'loss': 'coxph', 'learning_rate': 0.00011858442863862743, 'n_estimators': 280, 'criterion': 'friedman_mse', 'min_samples_split': 3, 'min_samples_leaf': 3, 'min_weight_fraction_leaf': 0.15158842626143096, 'min_impurity_decrease': 0.38221271471821106, 'max_features': 0.30148931681665375, 'subsample': 0.12975870563561342, 'dropout_rate': 0.08752721919426978, 'ccp_alpha': 0.2169586074587782}. Best is trial 244 with value: 0.8474070660226068.[0m
[32m[I 2022-04-21 16:58:04,199][0m Trial 288 finished with value: 0.8437348895574489 and parameters: {'loss': 'coxph', 'learning_rate': 6.873106821433695e-05, 'n_estimators': 293, 'criterion': 'friedman_mse', 'min_samples_split': 2, 'min_samples_leaf': 1, 'min_weight_fraction_leaf': 0.1976085392863571, 'min_impurity_decrease': 0.3501669673093802, 'max_features': 0.8957146783080231, 'subsample': 0.09419902435783255, 'dropout_rate': 0.05536224266717505, 'ccp_alpha': 0.1495350212751726}. Best is trial 244 with value: 0.8474070660226068.[0m
[32m[I 2022-04-21 16:58:19,503][0m Trial 289 finished with value: 0.7210032970556891 and parameters: {'loss': 'coxph', 'learning_rate': 0.00015086239522948565, 'n_estimators': 265, 'criterion': 'friedman_mse', 'min_samples_split': 3, 'min_samples_leaf': 2, 'min_weight_fraction_leaf': 0.1808611866569697, 'min_impurity_decrease': 0.31288482597316514, 'max_features': 0.3256275468290813, 'subsample': 0.17272408421230614, 'dropout_rate': 0.19578772666823466, 'ccp_alpha': 0.3832402778486023}. Best is trial 244 with value: 0.8474070660226068.[0m
[32m[I 2022-04-21 16:58:31,762][0m Trial 290 finished with value: 0.838429551406372 and parameters: {'loss': 'coxph', 'learning_rate': 0.0002121249367671875, 'n_estimators': 238, 'criterion': 'friedman_mse', 'min_samples_split': 3, 'min_samples_leaf': 2, 'min_weight_fraction_leaf': 0.2109133477453324, 'min_impurity_decrease': 0.33195642918113205, 'max_features': 0.3861057731803531, 'subsample': 0.049551757257510376, 'dropout_rate': 0.11318268323131311, 'ccp_alpha': 0.24131434889332526}. Best is trial 244 with value: 0.8474070660226068.[0m
[32m[I 2022-04-21 16:58:53,204][0m Trial 291 finished with value: 0.8426642213690828 and parameters: {'loss': 'coxph', 'learning_rate': 9.09046736057098e-05, 'n_estimators': 302, 'criterion': 'friedman_mse', 'min_samples_split': 3, 'min_samples_leaf': 2, 'min_weight_fraction_leaf': 0.16452329612809963, 'min_impurity_decrease': 0.301475666034345, 'max_features': 0.28458561414236155, 'subsample': 0.19667636636428606, 'dropout_rate': 0.16152008845289018, 'ccp_alpha': 0.09559297155287606}. Best is trial 244 with value: 0.8474070660226068.[0m
