[32m[I 2022-04-22 01:25:49,228][0m Trial 953 finished with value: 0.6647221083144021 and parameters: {'loss': 'coxph', 'learning_rate': 2.565835286477609e-05, 'n_estimators': 252, 'criterion': 'squared_error', 'min_samples_split': 6, 'min_samples_leaf': 5, 'min_weight_fraction_leaf': 0.23203330163176428, 'min_impurity_decrease': 0.09934167026394711, 'max_features': 0.7856610264168894, 'subsample': 0.27271218866157265, 'dropout_rate': 0.6635535229666332, 'ccp_alpha': 0.2279242647433414}. Best is trial 187 with value: 0.6933481836305168.[0m
[32m[I 2022-04-22 01:25:58,850][0m Trial 954 finished with value: 0.6764920119241592 and parameters: {'loss': 'coxph', 'learning_rate': 2.709874789847244e-05, 'n_estimators': 239, 'criterion': 'squared_error', 'min_samples_split': 10, 'min_samples_leaf': 5, 'min_weight_fraction_leaf': 0.24297040721536817, 'min_impurity_decrease': 0.0909694111712447, 'max_features': 0.7652114004631575, 'subsample': 0.2753193277901544, 'dropout_rate': 0.4486805405914976, 'ccp_alpha': 0.16653248525416817}. Best is trial 187 with value: 0.6933481836305168.[0m
/media/san2_ssd/data/Workdir/survival/venv/lib/python3.8/site-packages/sksurv/ensemble/boosting.py:955: RuntimeWarning: divide by zero encountered in log
  time = numpy.log(time)
/media/san2_ssd/data/Workdir/survival/venv/lib/python3.8/site-packages/sksurv/ensemble/boosting.py:955: RuntimeWarning: divide by zero encountered in log
  time = numpy.log(time)
/media/san2_ssd/data/Workdir/survival/venv/lib/python3.8/site-packages/sksurv/ensemble/boosting.py:955: RuntimeWarning: divide by zero encountered in log
  time = numpy.log(time)
/media/san2_ssd/data/Workdir/survival/venv/lib/python3.8/site-packages/sksurv/ensemble/boosting.py:955: RuntimeWarning: divide by zero encountered in log
  time = numpy.log(time)
[32m[I 2022-04-22 01:26:01,274][0m Trial 955 finished with value: -0.7309394300370865 and parameters: {'loss': 'squared', 'learning_rate': 3.3560377923021135e-05, 'n_estimators': 262, 'criterion': 'squared_error', 'min_samples_split': 7, 'min_samples_leaf': 5, 'min_weight_fraction_leaf': 0.25057503659572716, 'min_impurity_decrease': 0.11350559633267782, 'max_features': 0.7866078931547429, 'subsample': 0.2538340607583586, 'dropout_rate': 0.68774105124064, 'ccp_alpha': 0.2792011615033109}. Best is trial 187 with value: 0.6933481836305168.[0m
[32m[I 2022-04-22 01:26:08,586][0m Trial 956 finished with value: 0.6842076872261743 and parameters: {'loss': 'coxph', 'learning_rate': 3.131305392084086e-05, 'n_estimators': 245, 'criterion': 'squared_error', 'min_samples_split': 7, 'min_samples_leaf': 5, 'min_weight_fraction_leaf': 0.23148775064922067, 'min_impurity_decrease': 0.08572569107827364, 'max_features': 0.6083032016671042, 'subsample': 0.26881939623592727, 'dropout_rate': 0.6645097885708883, 'ccp_alpha': 0.09384904771812848}. Best is trial 187 with value: 0.6933481836305168.[0m
[32m[I 2022-04-22 01:26:15,155][0m Trial 957 finished with value: 0.6799138466580763 and parameters: {'loss': 'coxph', 'learning_rate': 2.3297145205832348e-05, 'n_estimators': 234, 'criterion': 'squared_error', 'min_samples_split': 7, 'min_samples_leaf': 6, 'min_weight_fraction_leaf': 0.2456567687523039, 'min_impurity_decrease': 0.13295353464587806, 'max_features': 0.7579056577256511, 'subsample': 0.24168530286392637, 'dropout_rate': 0.6789322066908217, 'ccp_alpha': 0.17080599671197594}. Best is trial 187 with value: 0.6933481836305168.[0m
[32m[I 2022-04-22 01:26:23,121][0m Trial 958 finished with value: 0.6652535759877798 and parameters: {'loss': 'coxph', 'learning_rate': 1.8200526058617998e-05, 'n_estimators': 247, 'criterion': 'squared_error', 'min_samples_split': 7, 'min_samples_leaf': 6, 'min_weight_fraction_leaf': 0.231377505603628, 'min_impurity_decrease': 0.08382409445830315, 'max_features': 0.7734379439000945, 'subsample': 0.2533117824800038, 'dropout_rate': 0.6941445595666275, 'ccp_alpha': 0.3333913452877351}. Best is trial 187 with value: 0.6933481836305168.[0m
[32m[I 2022-04-22 01:26:32,357][0m Trial 959 finished with value: 0.6885876425665944 and parameters: {'loss': 'coxph', 'learning_rate': 2.7320159236699682e-05, 'n_estimators': 264, 'criterion': 'squared_error', 'min_samples_split': 7, 'min_samples_leaf': 5, 'min_weight_fraction_leaf': 0.24313697165128015, 'min_impurity_decrease': 0.07372663022220494, 'max_features': 0.7901197820386326, 'subsample': 0.2792729560537479, 'dropout_rate': 0.6532227356669689, 'ccp_alpha': 0.07844041996151424}. Best is trial 187 with value: 0.6933481836305168.[0m
[32m[I 2022-04-22 01:26:37,688][0m Trial 960 finished with value: 0.6787693023562275 and parameters: {'loss': 'coxph', 'learning_rate': 2.0723093929954426e-05, 'n_estimators': 235, 'criterion': 'squared_error', 'min_samples_split': 6, 'min_samples_leaf': 5, 'min_weight_fraction_leaf': 0.23135510404444992, 'min_impurity_decrease': 0.09753306371126161, 'max_features': 0.7582182138430772, 'subsample': 0.2304773820516775, 'dropout_rate': 0.8960661242958304, 'ccp_alpha': 0.177575254782898}. Best is trial 187 with value: 0.6933481836305168.[0m
[32m[I 2022-04-22 01:26:45,069][0m Trial 961 finished with value: 0.5827751132342576 and parameters: {'loss': 'coxph', 'learning_rate': 3.3876495389234386e-06, 'n_estimators': 252, 'criterion': 'squared_error', 'min_samples_split': 7, 'min_samples_leaf': 6, 'min_weight_fraction_leaf': 0.2545251328151332, 'min_impurity_decrease': 0.06778015187656347, 'max_features': 0.7453580662737482, 'subsample': 0.24508065755109792, 'dropout_rate': 0.6586329261920142, 'ccp_alpha': 0.43700211700267766}. Best is trial 187 with value: 0.6933481836305168.[0m
[32m[I 2022-04-22 01:26:48,185][0m Trial 962 finished with value: 0.6864002935656758 and parameters: {'loss': 'coxph', 'learning_rate': 5.719991426157681e-06, 'n_estimators': 217, 'criterion': 'squared_error', 'min_samples_split': 6, 'min_samples_leaf': 7, 'min_weight_fraction_leaf': 0.2551556775313082, 'min_impurity_decrease': 0.067123686364405, 'max_features': 0.6471173313678984, 'subsample': 0.27081515443409354, 'dropout_rate': 0.8857963778787113, 'ccp_alpha': 0.10057450583773292}. Best is trial 187 with value: 0.6933481836305168.[0m
[32m[I 2022-04-22 01:26:53,559][0m Trial 963 finished with value: 0.6649278943012369 and parameters: {'loss': 'coxph', 'learning_rate': 7.902027595747722e-06, 'n_estimators': 226, 'criterion': 'squared_error', 'min_samples_split': 7, 'min_samples_leaf': 6, 'min_weight_fraction_leaf': 0.2564952398013364, 'min_impurity_decrease': 0.11269569733527966, 'max_features': 0.7088061542097174, 'subsample': 0.22659220035187558, 'dropout_rate': 0.8780169270255129, 'ccp_alpha': 0.25903407753909996}. Best is trial 187 with value: 0.6933481836305168.[0m
[32m[I 2022-04-22 01:26:57,660][0m Trial 964 finished with value: 0.6868019472625411 and parameters: {'loss': 'coxph', 'learning_rate': 1.1865477435335896e-05, 'n_estimators': 218, 'criterion': 'squared_error', 'min_samples_split': 5, 'min_samples_leaf': 2, 'min_weight_fraction_leaf': 0.24272301881263508, 'min_impurity_decrease': 0.08808201510142954, 'max_features': 0.6841920982268309, 'subsample': 0.2567711005193703, 'dropout_rate': 0.7175008578145579, 'ccp_alpha': 0.10741874441793077}. Best is trial 187 with value: 0.6933481836305168.[0m
[32m[I 2022-04-22 01:27:03,663][0m Trial 965 finished with value: 0.6800114786286692 and parameters: {'loss': 'coxph', 'learning_rate': 3.445426307038393e-05, 'n_estimators': 208, 'criterion': 'squared_error', 'min_samples_split': 7, 'min_samples_leaf': 5, 'min_weight_fraction_leaf': 0.26322704879883246, 'min_impurity_decrease': 0.053730215918543156, 'max_features': 0.32136422403161635, 'subsample': 0.20570934097519597, 'dropout_rate': 0.915412518979902, 'ccp_alpha': 0.08573331426322345}. Best is trial 187 with value: 0.6933481836305168.[0m
[32m[I 2022-04-22 01:27:13,241][0m Trial 966 finished with value: 0.6909951101775996 and parameters: {'loss': 'coxph', 'learning_rate': 8.896513073657007e-06, 'n_estimators': 264, 'criterion': 'squared_error', 'min_samples_split': 7, 'min_samples_leaf': 1, 'min_weight_fraction_leaf': 0.2401988662267325, 'min_impurity_decrease': 0.06570706166247137, 'max_features': 0.726492336699788, 'subsample': 0.2474025560272769, 'dropout_rate': 0.6989360103396207, 'ccp_alpha': 0.005002349853683393}. Best is trial 187 with value: 0.6933481836305168.[0m
[32m[I 2022-04-22 01:27:22,605][0m Trial 967 finished with value: 0.6695351157145703 and parameters: {'loss': 'coxph', 'learning_rate': 7.101639135133032e-06, 'n_estimators': 263, 'criterion': 'squared_error', 'min_samples_split': 7, 'min_samples_leaf': 6, 'min_weight_fraction_leaf': 0.23680351900399818, 'min_impurity_decrease': 0.13921031489607166, 'max_features': 0.6609097065980493, 'subsample': 0.2770139239584923, 'dropout_rate': 0.6931535415267862, 'ccp_alpha': 0.1901592686755668}. Best is trial 187 with value: 0.6933481836305168.[0m
[32m[I 2022-04-22 01:27:31,069][0m Trial 968 finished with value: 0.6652535759877798 and parameters: {'loss': 'coxph', 'learning_rate': 4.389178614170712e-06, 'n_estimators': 261, 'criterion': 'squared_error', 'min_samples_split': 6, 'min_samples_leaf': 1, 'min_weight_fraction_leaf': 0.23117487122466907, 'min_impurity_decrease': 0.0926118301036456, 'max_features': 0.6312346678345785, 'subsample': 0.25505936676756025, 'dropout_rate': 0.7066897622330398, 'ccp_alpha': 0.3195350586455622}. Best is trial 187 with value: 0.6933481836305168.[0m
[32m[I 2022-04-22 01:27:40,827][0m Trial 969 finished with value: 0.6866709064532832 and parameters: {'loss': 'coxph', 'learning_rate': 2.651447064052935e-05, 'n_estimators': 266, 'criterion': 'squared_error', 'min_samples_split': 7, 'min_samples_leaf': 1, 'min_weight_fraction_leaf': 0.24119413894042335, 'min_impurity_decrease': 0.1080016312268721, 'max_features': 0.7741925831152163, 'subsample': 0.28248712382999275, 'dropout_rate': 0.6644307354248964, 'ccp_alpha': 0.001477220691856681}. Best is trial 187 with value: 0.6933481836305168.[0m
[32m[I 2022-04-22 01:27:47,319][0m Trial 970 finished with value: 0.6701312187111274 and parameters: {'loss': 'coxph', 'learning_rate': 5.27090032304785e-06, 'n_estimators': 269, 'criterion': 'squared_error', 'min_samples_split': 7, 'min_samples_leaf': 1, 'min_weight_fraction_leaf': 0.22821794992710048, 'min_impurity_decrease': 0.07763781993157438, 'max_features': 0.7912876756978762, 'subsample': 0.24999442550712678, 'dropout_rate': 0.6845556720089081, 'ccp_alpha': 0.22705926862484646}. Best is trial 187 with value: 0.6933481836305168.[0m
[32m[I 2022-04-22 01:28:02,120][0m Trial 971 finished with value: 0.6886194786729145 and parameters: {'loss': 'coxph', 'learning_rate': 6.73152236254263e-06, 'n_estimators': 256, 'criterion': 'squared_error', 'min_samples_split': 7, 'min_samples_leaf': 1, 'min_weight_fraction_leaf': 0.24712204692414674, 'min_impurity_decrease': 0.07831865239991664, 'max_features': 0.7096568283191593, 'subsample': 0.27461196791830844, 'dropout_rate': 0.698859957438109, 'ccp_alpha': 0.10445361548641313}. Best is trial 187 with value: 0.6933481836305168.[0m
[32m[I 2022-04-22 01:28:07,728][0m Trial 972 finished with value: 0.6750559228090333 and parameters: {'loss': 'coxph', 'learning_rate': 3.3590969812016205e-05, 'n_estimators': 250, 'criterion': 'squared_error', 'min_samples_split': 7, 'min_samples_leaf': 1, 'min_weight_fraction_leaf': 0.23732679684325106, 'min_impurity_decrease': 0.09275683954472991, 'max_features': 0.5655469203562428, 'subsample': 0.2398700870329929, 'dropout_rate': 0.649185262495534, 'ccp_alpha': 0.1767296173849932}. Best is trial 187 with value: 0.6933481836305168.[0m
[32m[I 2022-04-22 01:28:12,887][0m Trial 973 finished with value: 0.5 and parameters: {'loss': 'coxph', 'learning_rate': 9.885930282654596e-06, 'n_estimators': 245, 'criterion': 'squared_error', 'min_samples_split': 6, 'min_samples_leaf': 1, 'min_weight_fraction_leaf': 0.24830914946345264, 'min_impurity_decrease': 0.06679381400592918, 'max_features': 0.7306636566677823, 'subsample': 0.2702156101298115, 'dropout_rate': 0.7129213909819839, 'ccp_alpha': 1.115325008015782}. Best is trial 187 with value: 0.6933481836305168.[0m
/media/san2_ssd/data/Workdir/survival/venv/lib/python3.8/site-packages/sksurv/ensemble/boosting.py:955: RuntimeWarning: divide by zero encountered in log
  time = numpy.log(time)
/media/san2_ssd/data/Workdir/survival/venv/lib/python3.8/site-packages/sksurv/ensemble/boosting.py:955: RuntimeWarning: divide by zero encountered in log
  time = numpy.log(time)
/media/san2_ssd/data/Workdir/survival/venv/lib/python3.8/site-packages/sksurv/ensemble/boosting.py:955: RuntimeWarning: divide by zero encountered in log
  time = numpy.log(time)
/media/san2_ssd/data/Workdir/survival/venv/lib/python3.8/site-packages/sksurv/ensemble/boosting.py:955: RuntimeWarning: divide by zero encountered in log
  time = numpy.log(time)
[32m[I 2022-04-22 01:28:26,405][0m Trial 974 finished with value: -0.7 and parameters: {'loss': 'squared', 'learning_rate': 5.5104827856454575e-06, 'n_estimators': 913, 'criterion': 'squared_error', 'min_samples_split': 10, 'min_samples_leaf': 1, 'min_weight_fraction_leaf': 0.22768887649062264, 'min_impurity_decrease': 0.11899117912561533, 'max_features': 0.6873484974815105, 'subsample': 0.2535831213245782, 'dropout_rate': 0.7019848495514082, 'ccp_alpha': 2.451287952012753}. Best is trial 187 with value: 0.6933481836305168.[0m
[32m[I 2022-04-22 01:28:31,661][0m Trial 975 finished with value: 0.5827751132342576 and parameters: {'loss': 'coxph', 'learning_rate': 7.802530534870468e-06, 'n_estimators': 268, 'criterion': 'squared_error', 'min_samples_split': 7, 'min_samples_leaf': 6, 'min_weight_fraction_leaf': 0.2529365037735343, 'min_impurity_decrease': 0.5084478727448255, 'max_features': 0.670895332565619, 'subsample': 0.24280634096463294, 'dropout_rate': 0.8666065746528223, 'ccp_alpha': 0.0018670483352644337}. Best is trial 187 with value: 0.6933481836305168.[0m
[32m[I 2022-04-22 01:28:38,417][0m Trial 976 finished with value: 0.6863632710857419 and parameters: {'loss': 'coxph', 'learning_rate': 2.2349828075013496e-05, 'n_estimators': 256, 'criterion': 'squared_error', 'min_samples_split': 9, 'min_samples_leaf': 1, 'min_weight_fraction_leaf': 0.22707477153196148, 'min_impurity_decrease': 0.061931187428985277, 'max_features': 0.7511157225555135, 'subsample': 0.2756959310751859, 'dropout_rate': 0.6571190537941762, 'ccp_alpha': 0.09649195467308733}. Best is trial 187 with value: 0.6933481836305168.[0m
[32m[I 2022-04-22 01:28:43,419][0m Trial 977 finished with value: 0.5 and parameters: {'loss': 'coxph', 'learning_rate': 9.245803641865706e-06, 'n_estimators': 244, 'criterion': 'squared_error', 'min_samples_split': 7, 'min_samples_leaf': 1, 'min_weight_fraction_leaf': 0.2407692782195003, 'min_impurity_decrease': 0.08041849554958387, 'max_features': 0.6035545751244504, 'subsample': 0.5764963433749772, 'dropout_rate': 0.8943024320050906, 'ccp_alpha': 1.6030691370822436}. Best is trial 187 with value: 0.6933481836305168.[0m
[32m[I 2022-04-22 01:28:49,510][0m Trial 978 finished with value: 0.6636900948801576 and parameters: {'loss': 'coxph', 'learning_rate': 3.479269675688605e-05, 'n_estimators': 267, 'criterion': 'squared_error', 'min_samples_split': 7, 'min_samples_leaf': 1, 'min_weight_fraction_leaf': 0.4333657853851184, 'min_impurity_decrease': 0.061452237848685934, 'max_features': 0.7134655628060979, 'subsample': 0.2261898421910626, 'dropout_rate': 0.726871116857834, 'ccp_alpha': 0.25135425049637233}. Best is trial 187 with value: 0.6933481836305168.[0m
[32m[I 2022-04-22 01:28:56,266][0m Trial 979 finished with value: 0.6869946137522416 and parameters: {'loss': 'coxph', 'learning_rate': 6.8949206969626355e-06, 'n_estimators': 267, 'criterion': 'squared_error', 'min_samples_split': 6, 'min_samples_leaf': 1, 'min_weight_fraction_leaf': 0.23771831442547198, 'min_impurity_decrease': 0.05062052523479413, 'max_features': 0.6466882960716693, 'subsample': 0.25613905139209714, 'dropout_rate': 0.8504932282049279, 'ccp_alpha': 0.08490862052092561}. Best is trial 187 with value: 0.6933481836305168.[0m
[32m[I 2022-04-22 01:29:05,300][0m Trial 980 finished with value: 0.6791003643830449 and parameters: {'loss': 'coxph', 'learning_rate': 1.9250383656118963e-05, 'n_estimators': 251, 'criterion': 'squared_error', 'min_samples_split': 7, 'min_samples_leaf': 1, 'min_weight_fraction_leaf': 0.2282746857337827, 'min_impurity_decrease': 0.10324867209579176, 'max_features': 0.7920860483640714, 'subsample': 0.2352988917724273, 'dropout_rate': 0.6772588525361496, 'ccp_alpha': 0.17450644442352709}. Best is trial 187 with value: 0.6933481836305168.[0m
[32m[I 2022-04-22 01:29:13,481][0m Trial 981 finished with value: 0.644875710621761 and parameters: {'loss': 'coxph', 'learning_rate': 9.121172483863527e-06, 'n_estimators': 237, 'criterion': 'squared_error', 'min_samples_split': 7, 'min_samples_leaf': 1, 'min_weight_fraction_leaf': 0.25320733936963735, 'min_impurity_decrease': 0.07378162240364725, 'max_features': 0.6971631916512867, 'subsample': 0.27763407013584074, 'dropout_rate': 0.7214979193183205, 'ccp_alpha': 0.3386434461282639}. Best is trial 187 with value: 0.6933481836305168.[0m
[32m[I 2022-04-22 01:29:20,329][0m Trial 982 finished with value: 0.6872591840407244 and parameters: {'loss': 'coxph', 'learning_rate': 1.3385338865283013e-05, 'n_estimators': 242, 'criterion': 'squared_error', 'min_samples_split': 8, 'min_samples_leaf': 6, 'min_weight_fraction_leaf': 0.24602702214068978, 'min_impurity_decrease': 0.05227857528211089, 'max_features': 0.7336892857738267, 'subsample': 0.20515102383638242, 'dropout_rate': 0.6703250844281184, 'ccp_alpha': 0.09871055853357232}. Best is trial 187 with value: 0.6933481836305168.[0m
[32m[I 2022-04-22 01:29:34,191][0m Trial 983 finished with value: 0.6698387758916226 and parameters: {'loss': 'coxph', 'learning_rate': 1.664146891907232e-05, 'n_estimators': 553, 'criterion': 'squared_error', 'min_samples_split': 6, 'min_samples_leaf': 5, 'min_weight_fraction_leaf': 0.3725187680179092, 'min_impurity_decrease': 0.1945012042130866, 'max_features': 0.7704073583963598, 'subsample': 0.22797837802243348, 'dropout_rate': 0.940174296687671, 'ccp_alpha': 0.16713265377967623}. Best is trial 187 with value: 0.6933481836305168.[0m
[32m[I 2022-04-22 01:29:38,803][0m Trial 984 finished with value: 0.5 and parameters: {'loss': 'coxph', 'learning_rate': 6.108722072956805e-06, 'n_estimators': 269, 'criterion': 'squared_error', 'min_samples_split': 7, 'min_samples_leaf': 6, 'min_weight_fraction_leaf': 0.25766992027468133, 'min_impurity_decrease': 0.09240638211576822, 'max_features': 0.7155918345917123, 'subsample': 0.2630166599968637, 'dropout_rate': 0.8767376298208868, 'ccp_alpha': 2.1302740535477738}. Best is trial 187 with value: 0.6933481836305168.[0m
[32m[I 2022-04-22 01:29:45,187][0m Trial 985 finished with value: 0.5 and parameters: {'loss': 'coxph', 'learning_rate': 2.716502692741377e-05, 'n_estimators': 256, 'criterion': 'squared_error', 'min_samples_split': 7, 'min_samples_leaf': 6, 'min_weight_fraction_leaf': 0.22712508914363444, 'min_impurity_decrease': 0.12444245398581313, 'max_features': 0.7989329491394053, 'subsample': 0.24806725712990002, 'dropout_rate': 0.6505329377014858, 'ccp_alpha': 2.69165097503831}. Best is trial 187 with value: 0.6933481836305168.[0m
[32m[I 2022-04-22 01:29:48,308][0m Trial 986 finished with value: 0.5827751132342576 and parameters: {'loss': 'coxph', 'learning_rate': 3.85961689439231e-06, 'n_estimators': 236, 'criterion': 'squared_error', 'min_samples_split': 7, 'min_samples_leaf': 5, 'min_weight_fraction_leaf': 0.2422409581543763, 'min_impurity_decrease': 0.05012766110733064, 'max_features': 0.6730429290008771, 'subsample': 0.22833289104678156, 'dropout_rate': 0.8975737501889177, 'ccp_alpha': 0.4926050450143409}. Best is trial 187 with value: 0.6933481836305168.[0m
[32m[I 2022-04-22 01:29:53,037][0m Trial 987 finished with value: 0.6635807151369472 and parameters: {'loss': 'coxph', 'learning_rate': 3.310557579950376e-05, 'n_estimators': 231, 'criterion': 'squared_error', 'min_samples_split': 7, 'min_samples_leaf': 7, 'min_weight_fraction_leaf': 0.25842824807807785, 'min_impurity_decrease': 0.0635446044211507, 'max_features': 0.6114145032300741, 'subsample': 0.28077316940632246, 'dropout_rate': 0.6962679883791004, 'ccp_alpha': 0.24609319736476598}. Best is trial 187 with value: 0.6933481836305168.[0m
[32m[I 2022-04-22 01:29:57,419][0m Trial 988 finished with value: 0.6879197099595223 and parameters: {'loss': 'coxph', 'learning_rate': 8.611760400230818e-06, 'n_estimators': 248, 'criterion': 'squared_error', 'min_samples_split': 6, 'min_samples_leaf': 1, 'min_weight_fraction_leaf': 0.2364784365779389, 'min_impurity_decrease': 0.04404901777970295, 'max_features': 0.6345875133943465, 'subsample': 0.18253161156568426, 'dropout_rate': 0.8699856819715273, 'ccp_alpha': 0.003616026495137751}. Best is trial 187 with value: 0.6933481836305168.[0m
[32m[I 2022-04-22 01:30:01,026][0m Trial 989 finished with value: 0.6876095225027152 and parameters: {'loss': 'coxph', 'learning_rate': 1.0498371516008658e-05, 'n_estimators': 254, 'criterion': 'squared_error', 'min_samples_split': 9, 'min_samples_leaf': 6, 'min_weight_fraction_leaf': 0.25069738205182684, 'min_impurity_decrease': 0.08422424929676639, 'max_features': 0.6950666592725643, 'subsample': 0.21061086779149513, 'dropout_rate': 0.8538758765393755, 'ccp_alpha': 0.002910002240804133}. Best is trial 187 with value: 0.6933481836305168.[0m
