[32m[I 2022-04-23 01:18:52,618][0m Trial 593 finished with value: 0.5006540204610004 and parameters: {'loss': 'coxph', 'learning_rate': 0.09988937369345405, 'n_estimators': 467, 'criterion': 'friedman_mse', 'min_samples_split': 10, 'min_samples_leaf': 3, 'min_weight_fraction_leaf': 0.028638260081061146, 'min_impurity_decrease': 0.9959796426867343, 'max_features': 0.6340767167634402, 'subsample': 0.25630382314061445, 'dropout_rate': 0.22623245298708963, 'ccp_alpha': 0.4093029623355734}. Best is trial 218 with value: 0.6659976583847056.[0m
[32m[I 2022-04-23 01:20:35,623][0m Trial 594 finished with value: 0.5014956984807133 and parameters: {'loss': 'coxph', 'learning_rate': 0.05746094554593369, 'n_estimators': 653, 'criterion': 'friedman_mse', 'min_samples_split': 10, 'min_samples_leaf': 3, 'min_weight_fraction_leaf': 0.37357690798560605, 'min_impurity_decrease': 0.9988502375225846, 'max_features': 0.5565852657456761, 'subsample': 0.20269607875200535, 'dropout_rate': 0.1653680451576244, 'ccp_alpha': 0.2677383309969571}. Best is trial 218 with value: 0.6659976583847056.[0m
[32m[I 2022-04-23 01:21:18,739][0m Trial 595 finished with value: 0.6370958915691739 and parameters: {'loss': 'coxph', 'learning_rate': 0.06694500209356934, 'n_estimators': 435, 'criterion': 'friedman_mse', 'min_samples_split': 10, 'min_samples_leaf': 3, 'min_weight_fraction_leaf': 0.055376987345294344, 'min_impurity_decrease': 0.9558313674432103, 'max_features': 0.5847343817281704, 'subsample': 0.22616379999044958, 'dropout_rate': 0.2570541218004785, 'ccp_alpha': 0.1602542351020041}. Best is trial 218 with value: 0.6659976583847056.[0m
[32m[I 2022-04-23 01:24:06,590][0m Trial 596 finished with value: 0.6543654086205442 and parameters: {'loss': 'coxph', 'learning_rate': 0.04606534635462267, 'n_estimators': 917, 'criterion': 'friedman_mse', 'min_samples_split': 10, 'min_samples_leaf': 4, 'min_weight_fraction_leaf': 0.06988007528665777, 'min_impurity_decrease': 0.8983735152739574, 'max_features': 0.6483100775686548, 'subsample': 0.2768968053842544, 'dropout_rate': 0.3496401797081673, 'ccp_alpha': 0.08726400427747252}. Best is trial 218 with value: 0.6659976583847056.[0m
[32m[I 2022-04-23 01:25:25,174][0m Trial 597 finished with value: 0.6223287599881446 and parameters: {'loss': 'coxph', 'learning_rate': 0.035745338891367204, 'n_estimators': 572, 'criterion': 'friedman_mse', 'min_samples_split': 10, 'min_samples_leaf': 3, 'min_weight_fraction_leaf': 0.1013186443704971, 'min_impurity_decrease': 0.9232901388338413, 'max_features': 0.6137395877758337, 'subsample': 0.8135359137468876, 'dropout_rate': 0.19155676356206458, 'ccp_alpha': 0.09319665501404732}. Best is trial 218 with value: 0.6659976583847056.[0m
[32m[I 2022-04-23 01:26:29,751][0m Trial 598 finished with value: 0.6415627535578294 and parameters: {'loss': 'coxph', 'learning_rate': 0.07797625182056041, 'n_estimators': 517, 'criterion': 'friedman_mse', 'min_samples_split': 10, 'min_samples_leaf': 3, 'min_weight_fraction_leaf': 0.18349403594115396, 'min_impurity_decrease': 0.89318770906551, 'max_features': 0.5508575613106959, 'subsample': 0.3034444638481086, 'dropout_rate': 0.2765472535101738, 'ccp_alpha': 0.003041059113618196}. Best is trial 218 with value: 0.6659976583847056.[0m
[32m[I 2022-04-23 01:27:24,766][0m Trial 599 finished with value: 0.6104274555853183 and parameters: {'loss': 'coxph', 'learning_rate': 0.05309992937507986, 'n_estimators': 542, 'criterion': 'friedman_mse', 'min_samples_split': 4, 'min_samples_leaf': 3, 'min_weight_fraction_leaf': 0.07999457025478357, 'min_impurity_decrease': 0.942617828551055, 'max_features': 0.6687334182855825, 'subsample': 0.25175299015411456, 'dropout_rate': 0.4472554085604365, 'ccp_alpha': 0.2032448222731225}. Best is trial 218 with value: 0.6659976583847056.[0m
[32m[I 2022-04-23 01:28:11,050][0m Trial 600 finished with value: 0.648878638629059 and parameters: {'loss': 'coxph', 'learning_rate': 0.06715555984554436, 'n_estimators': 492, 'criterion': 'friedman_mse', 'min_samples_split': 10, 'min_samples_leaf': 5, 'min_weight_fraction_leaf': 0.05944808665783069, 'min_impurity_decrease': 0.9758242258068575, 'max_features': 0.5792840510937316, 'subsample': 0.31950363288174777, 'dropout_rate': 0.4128651812425689, 'ccp_alpha': 0.100082728009022}. Best is trial 218 with value: 0.6659976583847056.[0m
[32m[I 2022-04-23 01:29:02,341][0m Trial 601 finished with value: 0.5006540204610004 and parameters: {'loss': 'coxph', 'learning_rate': 0.03960961214372079, 'n_estimators': 470, 'criterion': 'friedman_mse', 'min_samples_split': 10, 'min_samples_leaf': 3, 'min_weight_fraction_leaf': 0.09299456956834162, 'min_impurity_decrease': 0.5222041251245292, 'max_features': 0.6314889854337721, 'subsample': 0.2908991750719569, 'dropout_rate': 0.2366138347067376, 'ccp_alpha': 0.34264179997091804}. Best is trial 218 with value: 0.6659976583847056.[0m
[32m[I 2022-04-23 01:30:10,299][0m Trial 602 finished with value: 0.6239966924144367 and parameters: {'loss': 'coxph', 'learning_rate': 0.05204305806279294, 'n_estimators': 590, 'criterion': 'friedman_mse', 'min_samples_split': 9, 'min_samples_leaf': 2, 'min_weight_fraction_leaf': 0.11436831254034868, 'min_impurity_decrease': 0.9168762649123213, 'max_features': 0.5684178393220538, 'subsample': 0.34287673560109644, 'dropout_rate': 0.37006342816367244, 'ccp_alpha': 0.17272105158682102}. Best is trial 218 with value: 0.6659976583847056.[0m
[32m[I 2022-04-23 01:31:05,244][0m Trial 603 finished with value: 0.5 and parameters: {'loss': 'coxph', 'learning_rate': 0.08230341478950344, 'n_estimators': 501, 'criterion': 'friedman_mse', 'min_samples_split': 10, 'min_samples_leaf': 3, 'min_weight_fraction_leaf': 0.07385962487439536, 'min_impurity_decrease': 0.8805265810481968, 'max_features': 0.5988187353984973, 'subsample': 0.2684651716851575, 'dropout_rate': 0.32154955008055613, 'ccp_alpha': 1.8052397365700767}. Best is trial 218 with value: 0.6659976583847056.[0m
[32m[I 2022-04-23 01:32:10,368][0m Trial 604 finished with value: 0.6521819625577223 and parameters: {'loss': 'coxph', 'learning_rate': 0.0626048296619252, 'n_estimators': 514, 'criterion': 'friedman_mse', 'min_samples_split': 7, 'min_samples_leaf': 4, 'min_weight_fraction_leaf': 0.04266756372826417, 'min_impurity_decrease': 0.4642861104177199, 'max_features': 0.5409922520241413, 'subsample': 0.2362374684367936, 'dropout_rate': 0.2578833285528684, 'ccp_alpha': 0.08849780429930268}. Best is trial 218 with value: 0.6659976583847056.[0m
[32m[I 2022-04-23 01:33:47,735][0m Trial 605 finished with value: 0.6610104586547609 and parameters: {'loss': 'coxph', 'learning_rate': 0.03231556550744235, 'n_estimators': 616, 'criterion': 'friedman_mse', 'min_samples_split': 10, 'min_samples_leaf': 3, 'min_weight_fraction_leaf': 0.08494605327740301, 'min_impurity_decrease': 0.4980743917998383, 'max_features': 0.7782053612008767, 'subsample': 0.30466902414087865, 'dropout_rate': 0.2188878870473512, 'ccp_alpha': 0.003333943394851196}. Best is trial 218 with value: 0.6659976583847056.[0m
[32m[I 2022-04-23 01:34:19,468][0m Trial 606 finished with value: 0.5677498872431116 and parameters: {'loss': 'coxph', 'learning_rate': 0.046840124881360225, 'n_estimators': 549, 'criterion': 'friedman_mse', 'min_samples_split': 10, 'min_samples_leaf': 3, 'min_weight_fraction_leaf': 0.0688696483352529, 'min_impurity_decrease': 0.9593700950578764, 'max_features': 0.6118092968813794, 'subsample': 0.2824697354448534, 'dropout_rate': 0.7331772341685638, 'ccp_alpha': 0.259626951347443}. Best is trial 218 with value: 0.6659976583847056.[0m
[32m[I 2022-04-23 01:36:48,216][0m Trial 607 finished with value: 0.5 and parameters: {'loss': 'coxph', 'learning_rate': 0.09927227151560057, 'n_estimators': 834, 'criterion': 'absolute_error', 'min_samples_split': 10, 'min_samples_leaf': 3, 'min_weight_fraction_leaf': 0.10204156248548386, 'min_impurity_decrease': 0.9325828148068155, 'max_features': 0.6526051816341033, 'subsample': 0.22084740689163584, 'dropout_rate': 0.3036222069066251, 'ccp_alpha': 0.1670193513921038}. Best is trial 218 with value: 0.6659976583847056.[0m
[32m[I 2022-04-23 01:37:44,811][0m Trial 608 finished with value: 0.6512410765594551 and parameters: {'loss': 'coxph', 'learning_rate': 0.06311607995129491, 'n_estimators': 471, 'criterion': 'friedman_mse', 'min_samples_split': 10, 'min_samples_leaf': 3, 'min_weight_fraction_leaf': 0.05374161710731911, 'min_impurity_decrease': 0.9016381611716342, 'max_features': 0.6854065879200715, 'subsample': 0.33244565319577873, 'dropout_rate': 0.20307845872084904, 'ccp_alpha': 0.09620725384954609}. Best is trial 218 with value: 0.6659976583847056.[0m
[32m[I 2022-04-23 01:38:29,000][0m Trial 609 finished with value: 0.6580429906766583 and parameters: {'loss': 'coxph', 'learning_rate': 0.0791052308201418, 'n_estimators': 418, 'criterion': 'friedman_mse', 'min_samples_split': 10, 'min_samples_leaf': 2, 'min_weight_fraction_leaf': 0.08010286550549321, 'min_impurity_decrease': 0.5387747105068021, 'max_features': 0.57590852620095, 'subsample': 0.26100090140023197, 'dropout_rate': 0.17882803844127843, 'ccp_alpha': 0.09099305226526141}. Best is trial 218 with value: 0.6659976583847056.[0m
[32m[I 2022-04-23 01:39:15,321][0m Trial 610 finished with value: 0.6614418417725754 and parameters: {'loss': 'coxph', 'learning_rate': 0.0477355557009405, 'n_estimators': 444, 'criterion': 'friedman_mse', 'min_samples_split': 10, 'min_samples_leaf': 3, 'min_weight_fraction_leaf': 0.06531969414766656, 'min_impurity_decrease': 0.447529015387226, 'max_features': 0.55003128120229, 'subsample': 0.3134423517416671, 'dropout_rate': 0.2733828095304177, 'ccp_alpha': 0.005156235932213023}. Best is trial 218 with value: 0.6659976583847056.[0m
[32m[I 2022-04-23 01:40:10,609][0m Trial 611 finished with value: 0.5806854604149627 and parameters: {'loss': 'coxph', 'learning_rate': 0.03801376065436065, 'n_estimators': 537, 'criterion': 'friedman_mse', 'min_samples_split': 10, 'min_samples_leaf': 6, 'min_weight_fraction_leaf': 0.09366050122410262, 'min_impurity_decrease': 0.9995379569715529, 'max_features': 0.8081532289714904, 'subsample': 0.24614068239153764, 'dropout_rate': 0.39552351765360805, 'ccp_alpha': 0.2588571594301785}. Best is trial 218 with value: 0.6659976583847056.[0m
/media/san2_ssd/data/Workdir/survival/venv/lib/python3.8/site-packages/sksurv/ensemble/boosting.py:955: RuntimeWarning: divide by zero encountered in log
  time = numpy.log(time)
/media/san2_ssd/data/Workdir/survival/venv/lib/python3.8/site-packages/sksurv/ensemble/boosting.py:955: RuntimeWarning: divide by zero encountered in log
  time = numpy.log(time)
/media/san2_ssd/data/Workdir/survival/venv/lib/python3.8/site-packages/sksurv/ensemble/boosting.py:955: RuntimeWarning: divide by zero encountered in log
  time = numpy.log(time)
/media/san2_ssd/data/Workdir/survival/venv/lib/python3.8/site-packages/sksurv/ensemble/boosting.py:955: RuntimeWarning: divide by zero encountered in log
  time = numpy.log(time)
[32m[I 2022-04-23 01:40:22,098][0m Trial 612 finished with value: -0.7 and parameters: {'loss': 'squared', 'learning_rate': 0.02746539319999038, 'n_estimators': 494, 'criterion': 'squared_error', 'min_samples_split': 9, 'min_samples_leaf': 3, 'min_weight_fraction_leaf': 0.08144135278802446, 'min_impurity_decrease': 0.8593363031016378, 'max_features': 0.619343681934471, 'subsample': 0.8894599477203973, 'dropout_rate': 0.23872608913878673, 'ccp_alpha': 0.16584773958576582}. Best is trial 218 with value: 0.6659976583847056.[0m
[32m[I 2022-04-23 01:41:39,530][0m Trial 613 finished with value: 0.6591107659527585 and parameters: {'loss': 'coxph', 'learning_rate': 0.058264263746650106, 'n_estimators': 571, 'criterion': 'friedman_mse', 'min_samples_split': 10, 'min_samples_leaf': 4, 'min_weight_fraction_leaf': 0.06291177581777233, 'min_impurity_decrease': 0.8830695647877349, 'max_features': 0.5943508817134393, 'subsample': 0.3739252370587668, 'dropout_rate': 0.28694410175870344, 'ccp_alpha': 0.004624066347422715}. Best is trial 218 with value: 0.6659976583847056.[0m
[32m[I 2022-04-23 01:42:44,376][0m Trial 614 finished with value: 0.6529207777681523 and parameters: {'loss': 'coxph', 'learning_rate': 0.07612775715096433, 'n_estimators': 523, 'criterion': 'friedman_mse', 'min_samples_split': 10, 'min_samples_leaf': 3, 'min_weight_fraction_leaf': 0.10392478090323065, 'min_impurity_decrease': 0.9148339122386623, 'max_features': 0.855157424966865, 'subsample': 0.1930437979689162, 'dropout_rate': 0.2550176701295504, 'ccp_alpha': 0.09614533357787701}. Best is trial 218 with value: 0.6659976583847056.[0m
[32m[I 2022-04-23 01:43:30,152][0m Trial 615 finished with value: 0.5009854799055053 and parameters: {'loss': 'coxph', 'learning_rate': 0.0453528016494299, 'n_estimators': 455, 'criterion': 'friedman_mse', 'min_samples_split': 3, 'min_samples_leaf': 3, 'min_weight_fraction_leaf': 0.07623482563373753, 'min_impurity_decrease': 0.936390870167511, 'max_features': 0.7500505491290061, 'subsample': 0.28844826801720913, 'dropout_rate': 0.34066582631372233, 'ccp_alpha': 0.32442506248096536}. Best is trial 218 with value: 0.6659976583847056.[0m
[32m[I 2022-04-23 01:47:05,164][0m Trial 616 finished with value: 0.6257592702616083 and parameters: {'loss': 'coxph', 'learning_rate': 0.0618035644635268, 'n_estimators': 955, 'criterion': 'friedman_mse', 'min_samples_split': 10, 'min_samples_leaf': 3, 'min_weight_fraction_leaf': 0.09005694258789021, 'min_impurity_decrease': 0.9681130873831341, 'max_features': 0.6890685458889362, 'subsample': 0.26983834248101873, 'dropout_rate': 0.22064485699196965, 'ccp_alpha': 0.18602522120037457}. Best is trial 218 with value: 0.6659976583847056.[0m
[32m[I 2022-04-23 01:48:07,746][0m Trial 617 finished with value: 0.6655349470277188 and parameters: {'loss': 'coxph', 'learning_rate': 0.08342763516963907, 'n_estimators': 480, 'criterion': 'friedman_mse', 'min_samples_split': 10, 'min_samples_leaf': 3, 'min_weight_fraction_leaf': 0.0542831545037121, 'min_impurity_decrease': 0.8845818092317173, 'max_features': 0.6289903983451072, 'subsample': 0.3010693898401965, 'dropout_rate': 0.1938314901850388, 'ccp_alpha': 0.003312795583604598}. Best is trial 218 with value: 0.6659976583847056.[0m
[32m[I 2022-04-23 01:49:07,684][0m Trial 618 finished with value: 0.646365402885029 and parameters: {'loss': 'coxph', 'learning_rate': 1.5784674172319174e-05, 'n_estimators': 491, 'criterion': 'friedman_mse', 'min_samples_split': 10, 'min_samples_leaf': 3, 'min_weight_fraction_leaf': 0.04717831631571942, 'min_impurity_decrease': 0.8683650002424448, 'max_features': 0.6370353946462382, 'subsample': 0.3494882342864483, 'dropout_rate': 0.18680583113175223, 'ccp_alpha': 0.08719251042225473}. Best is trial 218 with value: 0.6659976583847056.[0m
[32m[I 2022-04-23 01:50:02,956][0m Trial 619 finished with value: 0.5699673986693702 and parameters: {'loss': 'coxph', 'learning_rate': 0.08436197611411321, 'n_estimators': 466, 'criterion': 'friedman_mse', 'min_samples_split': 10, 'min_samples_leaf': 3, 'min_weight_fraction_leaf': 0.03434891369958122, 'min_impurity_decrease': 0.8867780568635701, 'max_features': 0.6581312598476637, 'subsample': 0.33299303766851723, 'dropout_rate': 0.15741268989483345, 'ccp_alpha': 0.22399810401959896}. Best is trial 218 with value: 0.6659976583847056.[0m
[32m[I 2022-04-23 01:50:42,679][0m Trial 620 finished with value: 0.6517731920282575 and parameters: {'loss': 'coxph', 'learning_rate': 0.08381727587670997, 'n_estimators': 432, 'criterion': 'friedman_mse', 'min_samples_split': 10, 'min_samples_leaf': 2, 'min_weight_fraction_leaf': 0.05195889692237125, 'min_impurity_decrease': 0.8486243466689442, 'max_features': 0.6241274589259088, 'subsample': 0.3131880604067352, 'dropout_rate': 0.3791092654877379, 'ccp_alpha': 0.08720227144176206}. Best is trial 218 with value: 0.6659976583847056.[0m
[32m[I 2022-04-23 01:51:57,166][0m Trial 621 finished with value: 0.662081833414908 and parameters: {'loss': 'coxph', 'learning_rate': 0.0990203472922749, 'n_estimators': 517, 'criterion': 'friedman_mse', 'min_samples_split': 10, 'min_samples_leaf': 3, 'min_weight_fraction_leaf': 0.031053239768099834, 'min_impurity_decrease': 0.18162927406491913, 'max_features': 0.6354561731201652, 'subsample': 0.4074119861627914, 'dropout_rate': 0.16586492852095547, 'ccp_alpha': 0.005321060811990379}. Best is trial 218 with value: 0.6659976583847056.[0m
[32m[I 2022-04-23 01:52:55,781][0m Trial 622 finished with value: 0.6121479303794948 and parameters: {'loss': 'coxph', 'learning_rate': 0.09840697828831954, 'n_estimators': 481, 'criterion': 'friedman_mse', 'min_samples_split': 10, 'min_samples_leaf': 3, 'min_weight_fraction_leaf': 0.027698958518421232, 'min_impurity_decrease': 0.19662637026564952, 'max_features': 0.6402156805794015, 'subsample': 0.3762208871402501, 'dropout_rate': 0.15897412412194709, 'ccp_alpha': 0.16627255103058025}. Best is trial 218 with value: 0.6659976583847056.[0m
[32m[I 2022-04-23 01:54:00,099][0m Trial 623 finished with value: 0.6463037775266417 and parameters: {'loss': 'coxph', 'learning_rate': 0.0951880456924507, 'n_estimators': 503, 'criterion': 'friedman_mse', 'min_samples_split': 10, 'min_samples_leaf': 3, 'min_weight_fraction_leaf': 0.035358900885442, 'min_impurity_decrease': 0.020169315969032542, 'max_features': 0.6136865973971988, 'subsample': 0.4542588228674714, 'dropout_rate': 0.14870751604604698, 'ccp_alpha': 0.09492478683624174}. Best is trial 218 with value: 0.6659976583847056.[0m
[32m[I 2022-04-23 01:54:55,023][0m Trial 624 finished with value: 0.5006540204610004 and parameters: {'loss': 'coxph', 'learning_rate': 0.07944326394307472, 'n_estimators': 467, 'criterion': 'friedman_mse', 'min_samples_split': 9, 'min_samples_leaf': 3, 'min_weight_fraction_leaf': 0.029541746710584006, 'min_impurity_decrease': 0.2116655166079296, 'max_features': 0.6338398954443568, 'subsample': 0.40147142072917735, 'dropout_rate': 0.16463876353674686, 'ccp_alpha': 0.2591644327286775}. Best is trial 218 with value: 0.6659976583847056.[0m
[32m[I 2022-04-23 01:55:46,900][0m Trial 625 finished with value: 0.6505357165934893 and parameters: {'loss': 'coxph', 'learning_rate': 0.08358354441661035, 'n_estimators': 452, 'criterion': 'friedman_mse', 'min_samples_split': 10, 'min_samples_leaf': 3, 'min_weight_fraction_leaf': 0.05282307437263698, 'min_impurity_decrease': 0.815311554449361, 'max_features': 0.6045907063243786, 'subsample': 0.36843034132287467, 'dropout_rate': 0.17698496778143263, 'ccp_alpha': 0.08356677820025753}. Best is trial 218 with value: 0.6659976583847056.[0m
[32m[I 2022-04-23 01:56:51,989][0m Trial 626 finished with value: 0.5622179867457678 and parameters: {'loss': 'coxph', 'learning_rate': 0.06886267234012791, 'n_estimators': 511, 'criterion': 'friedman_mse', 'min_samples_split': 10, 'min_samples_leaf': 4, 'min_weight_fraction_leaf': 0.040148320457158146, 'min_impurity_decrease': 0.3009454041312567, 'max_features': 0.9342299391900073, 'subsample': 0.5033031017390909, 'dropout_rate': 0.191138050505112, 'ccp_alpha': 0.16786845664425562}. Best is trial 218 with value: 0.6659976583847056.[0m
[32m[I 2022-04-23 01:57:54,955][0m Trial 627 finished with value: 0.5181150201957231 and parameters: {'loss': 'coxph', 'learning_rate': 0.09598898366607626, 'n_estimators': 480, 'criterion': 'absolute_error', 'min_samples_split': 10, 'min_samples_leaf': 3, 'min_weight_fraction_leaf': 0.029346940285800628, 'min_impurity_decrease': 0.17025646834475083, 'max_features': 0.6266775168902489, 'subsample': 0.3986365582303843, 'dropout_rate': 0.16940452249397517, 'ccp_alpha': 0.005578178171842551}. Best is trial 218 with value: 0.6659976583847056.[0m
[32m[I 2022-04-23 01:59:11,042][0m Trial 628 finished with value: 0.5 and parameters: {'loss': 'coxph', 'learning_rate': 0.06606419066768812, 'n_estimators': 535, 'criterion': 'friedman_mse', 'min_samples_split': 10, 'min_samples_leaf': 3, 'min_weight_fraction_leaf': 0.043280902198864046, 'min_impurity_decrease': 0.21901685768309936, 'max_features': 0.6630193682284391, 'subsample': 0.3501223089156359, 'dropout_rate': 0.13861093298872787, 'ccp_alpha': 0.3747946760946753}. Best is trial 218 with value: 0.6659976583847056.[0m
[32m[I 2022-04-23 02:00:13,009][0m Trial 629 finished with value: 0.6474608105760635 and parameters: {'loss': 'coxph', 'learning_rate': 0.09879348313078362, 'n_estimators': 504, 'criterion': 'friedman_mse', 'min_samples_split': 10, 'min_samples_leaf': 3, 'min_weight_fraction_leaf': 0.022349309031628604, 'min_impurity_decrease': 0.0642338533877469, 'max_features': 0.5957745210020772, 'subsample': 0.43271423253276126, 'dropout_rate': 0.1921275666261048, 'ccp_alpha': 0.10815232672740818}. Best is trial 218 with value: 0.6659976583847056.[0m
/media/san2_ssd/data/Workdir/survival/venv/lib/python3.8/site-packages/sksurv/ensemble/boosting.py:955: RuntimeWarning: divide by zero encountered in log
  time = numpy.log(time)
/media/san2_ssd/data/Workdir/survival/venv/lib/python3.8/site-packages/sksurv/ensemble/boosting.py:955: RuntimeWarning: divide by zero encountered in log
  time = numpy.log(time)
/media/san2_ssd/data/Workdir/survival/venv/lib/python3.8/site-packages/sksurv/ensemble/boosting.py:955: RuntimeWarning: divide by zero encountered in log
  time = numpy.log(time)
/media/san2_ssd/data/Workdir/survival/venv/lib/python3.8/site-packages/sksurv/ensemble/boosting.py:955: RuntimeWarning: divide by zero encountered in log
  time = numpy.log(time)
