[32m[I 2022-04-21 20:39:28,731][0m Trial 960 finished with value: 0.848103331291405 and parameters: {'loss': 'coxph', 'learning_rate': 0.07274813013594249, 'n_estimators': 114, 'criterion': 'friedman_mse', 'min_samples_split': 2, 'min_samples_leaf': 1, 'min_weight_fraction_leaf': 0.04819105827596199, 'min_impurity_decrease': 0.27023034611386865, 'max_features': 0.11857048738719646, 'subsample': 0.04335963419041617, 'dropout_rate': 0.8301045500558634, 'ccp_alpha': 0.007830169335280185}. Best is trial 935 with value: 0.8497573035489246.[0m
[32m[I 2022-04-21 20:39:31,461][0m Trial 961 finished with value: 0.8476286080934863 and parameters: {'loss': 'coxph', 'learning_rate': 4.0667222739703815e-06, 'n_estimators': 131, 'criterion': 'friedman_mse', 'min_samples_split': 2, 'min_samples_leaf': 1, 'min_weight_fraction_leaf': 0.03077219282494463, 'min_impurity_decrease': 0.27955332002459543, 'max_features': 0.11748804999658691, 'subsample': 0.04291607157930252, 'dropout_rate': 0.8341571001535307, 'ccp_alpha': 0.002811235058988684}. Best is trial 935 with value: 0.8497573035489246.[0m
[32m[I 2022-04-21 20:39:33,318][0m Trial 962 finished with value: 0.8423787413868608 and parameters: {'loss': 'coxph', 'learning_rate': 0.06927318251182751, 'n_estimators': 113, 'criterion': 'friedman_mse', 'min_samples_split': 2, 'min_samples_leaf': 1, 'min_weight_fraction_leaf': 0.030319264028307553, 'min_impurity_decrease': 0.27471375652504143, 'max_features': 0.11279132378132752, 'subsample': 0.04863736284670771, 'dropout_rate': 0.8303494316489729, 'ccp_alpha': 0.007044160204924738}. Best is trial 935 with value: 0.8497573035489246.[0m
[32m[I 2022-04-21 20:39:34,865][0m Trial 963 finished with value: 0.8399877424900456 and parameters: {'loss': 'coxph', 'learning_rate': 1.416472483786526e-05, 'n_estimators': 132, 'criterion': 'friedman_mse', 'min_samples_split': 2, 'min_samples_leaf': 1, 'min_weight_fraction_leaf': 0.032051204423381316, 'min_impurity_decrease': 0.2728967431659726, 'max_features': 0.12146280800506572, 'subsample': 0.3611525778642988, 'dropout_rate': 0.7963407642616013, 'ccp_alpha': 0.010018066423857483}. Best is trial 935 with value: 0.8497573035489246.[0m
[32m[I 2022-04-21 20:39:36,390][0m Trial 964 finished with value: 0.8482231462826156 and parameters: {'loss': 'coxph', 'learning_rate': 1.0700719710142458e-05, 'n_estimators': 135, 'criterion': 'friedman_mse', 'min_samples_split': 2, 'min_samples_leaf': 1, 'min_weight_fraction_leaf': 0.018958826981824592, 'min_impurity_decrease': 0.28021299553227674, 'max_features': 0.1838386391918315, 'subsample': 0.04554700357030331, 'dropout_rate': 0.8386867957049957, 'ccp_alpha': 0.005392970314679023}. Best is trial 935 with value: 0.8497573035489246.[0m
[32m[I 2022-04-21 20:39:38,845][0m Trial 965 finished with value: 0.8448576026950144 and parameters: {'loss': 'coxph', 'learning_rate': 0.042086479875208825, 'n_estimators': 138, 'criterion': 'friedman_mse', 'min_samples_split': 2, 'min_samples_leaf': 1, 'min_weight_fraction_leaf': 0.020587184928843573, 'min_impurity_decrease': 0.28255906115093066, 'max_features': 0.18881865812926585, 'subsample': 0.04097253832982427, 'dropout_rate': 0.8209080226585571, 'ccp_alpha': 0.003328810014531683}. Best is trial 935 with value: 0.8497573035489246.[0m
[32m[I 2022-04-21 20:39:42,552][0m Trial 966 finished with value: 0.8473981990758496 and parameters: {'loss': 'coxph', 'learning_rate': 6.244966316258962e-06, 'n_estimators': 145, 'criterion': 'friedman_mse', 'min_samples_split': 2, 'min_samples_leaf': 1, 'min_weight_fraction_leaf': 0.009871432343813193, 'min_impurity_decrease': 0.2790601858769284, 'max_features': 0.18201991524289263, 'subsample': 0.04377861667746054, 'dropout_rate': 0.8345543668484275, 'ccp_alpha': 0.10085402387152283}. Best is trial 935 with value: 0.8497573035489246.[0m
[32m[I 2022-04-21 20:39:45,896][0m Trial 967 finished with value: 0.8471911027051569 and parameters: {'loss': 'coxph', 'learning_rate': 3.308470323855091e-06, 'n_estimators': 130, 'criterion': 'friedman_mse', 'min_samples_split': 2, 'min_samples_leaf': 1, 'min_weight_fraction_leaf': 0.0182299262151613, 'min_impurity_decrease': 0.27981036526017844, 'max_features': 0.15569916832413674, 'subsample': 0.021765108907210978, 'dropout_rate': 0.8118719680526824, 'ccp_alpha': 0.0887236799373725}. Best is trial 935 with value: 0.8497573035489246.[0m
[32m[I 2022-04-21 20:39:48,791][0m Trial 968 finished with value: 0.8486190106315533 and parameters: {'loss': 'coxph', 'learning_rate': 5.9174504329438245e-06, 'n_estimators': 140, 'criterion': 'friedman_mse', 'min_samples_split': 2, 'min_samples_leaf': 1, 'min_weight_fraction_leaf': 0.003086434089831773, 'min_impurity_decrease': 0.2709425563031189, 'max_features': 0.19209241678839975, 'subsample': 0.04318530513874561, 'dropout_rate': 0.7775896852177957, 'ccp_alpha': 0.08420442889648994}. Best is trial 935 with value: 0.8497573035489246.[0m
[32m[I 2022-04-21 20:39:52,996][0m Trial 969 finished with value: 0.8484757781384651 and parameters: {'loss': 'coxph', 'learning_rate': 0.0004286555043926257, 'n_estimators': 136, 'criterion': 'friedman_mse', 'min_samples_split': 2, 'min_samples_leaf': 1, 'min_weight_fraction_leaf': 0.005195011177278644, 'min_impurity_decrease': 0.2674004521779684, 'max_features': 0.17231241229461447, 'subsample': 0.047854743065614644, 'dropout_rate': 0.7833713276110628, 'ccp_alpha': 0.007806152807697309}. Best is trial 935 with value: 0.8497573035489246.[0m
[32m[I 2022-04-21 20:39:55,967][0m Trial 970 finished with value: 0.84416499565552 and parameters: {'loss': 'coxph', 'learning_rate': 4.811639246794647e-06, 'n_estimators': 149, 'criterion': 'friedman_mse', 'min_samples_split': 2, 'min_samples_leaf': 1, 'min_weight_fraction_leaf': 0.002854801913772074, 'min_impurity_decrease': 0.26935810529787374, 'max_features': 0.21014323347860686, 'subsample': 0.06870068721061116, 'dropout_rate': 0.7747770530542983, 'ccp_alpha': 0.003537692469553202}. Best is trial 935 with value: 0.8497573035489246.[0m
/media/san2_ssd/data/Workdir/survival/venv/lib/python3.8/site-packages/sksurv/ensemble/boosting.py:955: RuntimeWarning: divide by zero encountered in log
  time = numpy.log(time)
/media/san2_ssd/data/Workdir/survival/venv/lib/python3.8/site-packages/sksurv/ensemble/boosting.py:955: RuntimeWarning: divide by zero encountered in log
  time = numpy.log(time)
/media/san2_ssd/data/Workdir/survival/venv/lib/python3.8/site-packages/sksurv/ensemble/boosting.py:955: RuntimeWarning: divide by zero encountered in log
  time = numpy.log(time)
/media/san2_ssd/data/Workdir/survival/venv/lib/python3.8/site-packages/sksurv/ensemble/boosting.py:955: RuntimeWarning: divide by zero encountered in log
  time = numpy.log(time)
[32m[I 2022-04-21 20:39:56,477][0m Trial 971 finished with value: -0.4657887472607289 and parameters: {'loss': 'squared', 'learning_rate': 2.1273085949196e-05, 'n_estimators': 141, 'criterion': 'friedman_mse', 'min_samples_split': 2, 'min_samples_leaf': 1, 'min_weight_fraction_leaf': 0.006984596860867632, 'min_impurity_decrease': 0.257785453096479, 'max_features': 0.17380007616080606, 'subsample': 0.059474803410043464, 'dropout_rate': 0.7784681375935683, 'ccp_alpha': 0.002432805580122795}. Best is trial 935 with value: 0.8497573035489246.[0m
[32m[I 2022-04-21 20:39:58,756][0m Trial 972 finished with value: 0.8478188101595971 and parameters: {'loss': 'coxph', 'learning_rate': 1.2299495123050186e-06, 'n_estimators': 139, 'criterion': 'friedman_mse', 'min_samples_split': 2, 'min_samples_leaf': 1, 'min_weight_fraction_leaf': 0.0038620026290464606, 'min_impurity_decrease': 0.27836133381999717, 'max_features': 0.1899478819894608, 'subsample': 0.048211105998445004, 'dropout_rate': 0.8047386016313965, 'ccp_alpha': 0.001394345877890171}. Best is trial 935 with value: 0.8497573035489246.[0m
[32m[I 2022-04-21 20:40:01,424][0m Trial 973 finished with value: 0.8403840562950897 and parameters: {'loss': 'coxph', 'learning_rate': 2.4816599543218527e-06, 'n_estimators': 138, 'criterion': 'friedman_mse', 'min_samples_split': 2, 'min_samples_leaf': 1, 'min_weight_fraction_leaf': 0.0034975046577354688, 'min_impurity_decrease': 0.28616501608100087, 'max_features': 0.1982592110466044, 'subsample': 0.5943077019325729, 'dropout_rate': 0.8075260490962897, 'ccp_alpha': 0.08466318281840059}. Best is trial 935 with value: 0.8497573035489246.[0m
[32m[I 2022-04-21 20:40:04,311][0m Trial 974 finished with value: 0.843938163034295 and parameters: {'loss': 'coxph', 'learning_rate': 9.2838524938978e-06, 'n_estimators': 124, 'criterion': 'friedman_mse', 'min_samples_split': 2, 'min_samples_leaf': 1, 'min_weight_fraction_leaf': 0.010440644528869064, 'min_impurity_decrease': 0.28013541138543846, 'max_features': 0.19656456102317976, 'subsample': 0.06928695909850079, 'dropout_rate': 0.7454836091469372, 'ccp_alpha': 0.08765056375024348}. Best is trial 935 with value: 0.8497573035489246.[0m
[32m[I 2022-04-21 20:40:06,385][0m Trial 975 finished with value: 0.8387428728669727 and parameters: {'loss': 'coxph', 'learning_rate': 1.018178098365419e-06, 'n_estimators': 141, 'criterion': 'squared_error', 'min_samples_split': 2, 'min_samples_leaf': 1, 'min_weight_fraction_leaf': 0.015944976140388027, 'min_impurity_decrease': 0.27256867355653497, 'max_features': 0.21228942519681493, 'subsample': 0.04929199462144967, 'dropout_rate': 0.791790851845432, 'ccp_alpha': 0.09398661548001759}. Best is trial 935 with value: 0.8497573035489246.[0m
[32m[I 2022-04-21 20:40:08,963][0m Trial 976 finished with value: 0.8446447827966518 and parameters: {'loss': 'coxph', 'learning_rate': 2.434501319973722e-06, 'n_estimators': 149, 'criterion': 'friedman_mse', 'min_samples_split': 2, 'min_samples_leaf': 1, 'min_weight_fraction_leaf': 0.0023023955430120585, 'min_impurity_decrease': 0.2611920807009248, 'max_features': 0.18125731489372812, 'subsample': 0.06804809799517476, 'dropout_rate': 0.7660191575321246, 'ccp_alpha': 0.01228289057083971}. Best is trial 935 with value: 0.8497573035489246.[0m
[32m[I 2022-04-21 20:40:10,400][0m Trial 977 finished with value: 0.8476741531309525 and parameters: {'loss': 'coxph', 'learning_rate': 1.593571579886016e-06, 'n_estimators': 125, 'criterion': 'friedman_mse', 'min_samples_split': 2, 'min_samples_leaf': 1, 'min_weight_fraction_leaf': 0.012102524445186575, 'min_impurity_decrease': 0.25576917363348584, 'max_features': 0.1686088213848498, 'subsample': 0.04759704371934941, 'dropout_rate': 0.8481362043068102, 'ccp_alpha': 0.09748834811262093}. Best is trial 935 with value: 0.8497573035489246.[0m
[32m[I 2022-04-21 20:40:12,386][0m Trial 978 finished with value: 0.8447402209845818 and parameters: {'loss': 'coxph', 'learning_rate': 1.1650296252031557e-05, 'n_estimators': 135, 'criterion': 'friedman_mse', 'min_samples_split': 2, 'min_samples_leaf': 1, 'min_weight_fraction_leaf': 0.022351798066018762, 'min_impurity_decrease': 0.28400646431065507, 'max_features': 0.2099462673601867, 'subsample': 0.03827598847326695, 'dropout_rate': 0.8105881943029116, 'ccp_alpha': 0.006344538121340532}. Best is trial 935 with value: 0.8497573035489246.[0m
[32m[I 2022-04-21 20:40:13,849][0m Trial 979 finished with value: 0.8429315065025605 and parameters: {'loss': 'coxph', 'learning_rate': 9.234589191564718e-06, 'n_estimators': 115, 'criterion': 'friedman_mse', 'min_samples_split': 2, 'min_samples_leaf': 1, 'min_weight_fraction_leaf': 0.006643739325656992, 'min_impurity_decrease': 0.25365897843605284, 'max_features': 0.18351706253496047, 'subsample': 0.06695336042181296, 'dropout_rate': 0.7950857174245916, 'ccp_alpha': 0.13810089800684433}. Best is trial 935 with value: 0.8497573035489246.[0m
[32m[I 2022-04-21 20:40:15,573][0m Trial 980 finished with value: 0.65 and parameters: {'loss': 'coxph', 'learning_rate': 4.757570212900154e-06, 'n_estimators': 141, 'criterion': 'absolute_error', 'min_samples_split': 2, 'min_samples_leaf': 7, 'min_weight_fraction_leaf': 0.021814586016602657, 'min_impurity_decrease': 0.2780370366351111, 'max_features': 0.16589174394782769, 'subsample': 0.018865293367196855, 'dropout_rate': 0.8284498069445573, 'ccp_alpha': 0.002915588539567578}. Best is trial 935 with value: 0.8497573035489246.[0m
[32m[I 2022-04-21 20:40:19,065][0m Trial 981 finished with value: 0.8467635740460878 and parameters: {'loss': 'coxph', 'learning_rate': 1.3877335864271711e-06, 'n_estimators': 154, 'criterion': 'friedman_mse', 'min_samples_split': 2, 'min_samples_leaf': 1, 'min_weight_fraction_leaf': 0.004773029863361551, 'min_impurity_decrease': 0.2537532636367725, 'max_features': 0.1889494428526187, 'subsample': 0.053621378027421104, 'dropout_rate': 0.8588010749061649, 'ccp_alpha': 0.00278651228355933}. Best is trial 935 with value: 0.8497573035489246.[0m
[32m[I 2022-04-21 20:40:21,884][0m Trial 982 finished with value: 0.65 and parameters: {'loss': 'coxph', 'learning_rate': 1.6848805742824307e-05, 'n_estimators': 132, 'criterion': 'friedman_mse', 'min_samples_split': 2, 'min_samples_leaf': 1, 'min_weight_fraction_leaf': 0.04100279374263569, 'min_impurity_decrease': 0.26387255770997936, 'max_features': 0.21204255611112832, 'subsample': 0.0013840463507426327, 'dropout_rate': 0.8179685431420953, 'ccp_alpha': 0.15066672926886504}. Best is trial 935 with value: 0.8497573035489246.[0m
[32m[I 2022-04-21 20:40:23,330][0m Trial 983 finished with value: 0.7229553929828194 and parameters: {'loss': 'coxph', 'learning_rate': 0.09021092963498345, 'n_estimators': 131, 'criterion': 'friedman_mse', 'min_samples_split': 2, 'min_samples_leaf': 1, 'min_weight_fraction_leaf': 0.01427940061008742, 'min_impurity_decrease': 0.2892391802886672, 'max_features': 0.17486751177684207, 'subsample': 0.03738216949728334, 'dropout_rate': 0.8430292219089713, 'ccp_alpha': 0.9650162530252246}. Best is trial 935 with value: 0.8497573035489246.[0m
[32m[I 2022-04-21 20:40:25,306][0m Trial 984 finished with value: 0.8453224104327767 and parameters: {'loss': 'coxph', 'learning_rate': 1.9842558753913846e-06, 'n_estimators': 119, 'criterion': 'friedman_mse', 'min_samples_split': 2, 'min_samples_leaf': 1, 'min_weight_fraction_leaf': 0.03226642496999811, 'min_impurity_decrease': 0.24788807580889358, 'max_features': 0.1959365131709967, 'subsample': 0.07007998528256452, 'dropout_rate': 0.7587437216483794, 'ccp_alpha': 0.005705704601802568}. Best is trial 935 with value: 0.8497573035489246.[0m
[32m[I 2022-04-21 20:40:27,334][0m Trial 985 finished with value: 0.8462252635311135 and parameters: {'loss': 'coxph', 'learning_rate': 1.4260471969965034e-06, 'n_estimators': 143, 'criterion': 'friedman_mse', 'min_samples_split': 2, 'min_samples_leaf': 1, 'min_weight_fraction_leaf': 0.01845957949213913, 'min_impurity_decrease': 0.2672763084860601, 'max_features': 0.1551394300508453, 'subsample': 0.021887116241911933, 'dropout_rate': 0.779457855448369, 'ccp_alpha': 0.0034977852332847403}. Best is trial 935 with value: 0.8497573035489246.[0m
[32m[I 2022-04-21 20:40:29,590][0m Trial 986 finished with value: 0.8439619375223846 and parameters: {'loss': 'coxph', 'learning_rate': 2.445815717895451e-06, 'n_estimators': 125, 'criterion': 'friedman_mse', 'min_samples_split': 2, 'min_samples_leaf': 1, 'min_weight_fraction_leaf': 0.04395720289478177, 'min_impurity_decrease': 0.24962149548380175, 'max_features': 0.15778828871550116, 'subsample': 0.050465657501582654, 'dropout_rate': 0.8040616642407805, 'ccp_alpha': 0.002615743213634633}. Best is trial 935 with value: 0.8497573035489246.[0m
[32m[I 2022-04-21 20:40:31,166][0m Trial 987 finished with value: 0.8447741300731451 and parameters: {'loss': 'coxph', 'learning_rate': 0.000611001490244667, 'n_estimators': 136, 'criterion': 'friedman_mse', 'min_samples_split': 2, 'min_samples_leaf': 1, 'min_weight_fraction_leaf': 0.0013575635208846364, 'min_impurity_decrease': 0.2874867700941317, 'max_features': 0.22185538951396344, 'subsample': 0.07079704667431026, 'dropout_rate': 0.8471686722296552, 'ccp_alpha': 0.17020777464008321}. Best is trial 935 with value: 0.8497573035489246.[0m
/media/san2_ssd/data/Workdir/survival/venv/lib/python3.8/site-packages/sksurv/ensemble/boosting.py:955: RuntimeWarning: divide by zero encountered in log
  time = numpy.log(time)
/media/san2_ssd/data/Workdir/survival/venv/lib/python3.8/site-packages/sksurv/ensemble/boosting.py:955: RuntimeWarning: divide by zero encountered in log
  time = numpy.log(time)
/media/san2_ssd/data/Workdir/survival/venv/lib/python3.8/site-packages/sksurv/ensemble/boosting.py:955: RuntimeWarning: divide by zero encountered in log
  time = numpy.log(time)
/media/san2_ssd/data/Workdir/survival/venv/lib/python3.8/site-packages/sksurv/ensemble/boosting.py:955: RuntimeWarning: divide by zero encountered in log
  time = numpy.log(time)
[32m[I 2022-04-21 20:40:31,652][0m Trial 988 finished with value: -0.4682893681881678 and parameters: {'loss': 'squared', 'learning_rate': 0.0005273442805173534, 'n_estimators': 151, 'criterion': 'friedman_mse', 'min_samples_split': 2, 'min_samples_leaf': 1, 'min_weight_fraction_leaf': 0.02777456536900419, 'min_impurity_decrease': 0.26479935970235385, 'max_features': 0.20090835139460256, 'subsample': 0.03419172824026835, 'dropout_rate': 0.820774080860606, 'ccp_alpha': 0.12788753719334106}. Best is trial 935 with value: 0.8497573035489246.[0m
[32m[I 2022-04-21 20:40:33,201][0m Trial 989 finished with value: 0.8399195973905655 and parameters: {'loss': 'coxph', 'learning_rate': 6.805798395998401e-06, 'n_estimators': 136, 'criterion': 'friedman_mse', 'min_samples_split': 2, 'min_samples_leaf': 1, 'min_weight_fraction_leaf': 0.04558730533057648, 'min_impurity_decrease': 0.24476617092840916, 'max_features': 0.162846570400471, 'subsample': 0.017632436983474782, 'dropout_rate': 0.8788328811931808, 'ccp_alpha': 0.1777339191487356}. Best is trial 935 with value: 0.8497573035489246.[0m
[32m[I 2022-04-21 20:40:34,895][0m Trial 990 finished with value: 0.8477268416607202 and parameters: {'loss': 'coxph', 'learning_rate': 1.1319211176933113e-06, 'n_estimators': 126, 'criterion': 'friedman_mse', 'min_samples_split': 2, 'min_samples_leaf': 1, 'min_weight_fraction_leaf': 0.03533220351516396, 'min_impurity_decrease': 0.2889745560169308, 'max_features': 0.14860393991931353, 'subsample': 0.04821796518891869, 'dropout_rate': 0.8324906115179498, 'ccp_alpha': 0.10110940601926305}. Best is trial 935 with value: 0.8497573035489246.[0m
[32m[I 2022-04-21 20:40:36,721][0m Trial 991 finished with value: 0.8452665326242187 and parameters: {'loss': 'coxph', 'learning_rate': 1.1968610644452957e-06, 'n_estimators': 127, 'criterion': 'friedman_mse', 'min_samples_split': 2, 'min_samples_leaf': 1, 'min_weight_fraction_leaf': 0.026324534903263492, 'min_impurity_decrease': 0.28824583271486576, 'max_features': 0.148134030032247, 'subsample': 0.03522487887556454, 'dropout_rate': 0.7880482359296994, 'ccp_alpha': 0.1892556468771945}. Best is trial 935 with value: 0.8497573035489246.[0m
[32m[I 2022-04-21 20:40:38,098][0m Trial 992 finished with value: 0.8457002110766563 and parameters: {'loss': 'coxph', 'learning_rate': 1.0845459562711416e-06, 'n_estimators': 123, 'criterion': 'friedman_mse', 'min_samples_split': 2, 'min_samples_leaf': 1, 'min_weight_fraction_leaf': 0.03915348838557409, 'min_impurity_decrease': 0.28537506020437436, 'max_features': 0.19670002649472773, 'subsample': 0.0734051102301109, 'dropout_rate': 0.8647336616566166, 'ccp_alpha': 0.10481169434981896}. Best is trial 935 with value: 0.8497573035489246.[0m
[32m[I 2022-04-21 20:40:39,324][0m Trial 993 finished with value: 0.8428043543839687 and parameters: {'loss': 'coxph', 'learning_rate': 1.6081340542815362e-06, 'n_estimators': 110, 'criterion': 'friedman_mse', 'min_samples_split': 2, 'min_samples_leaf': 1, 'min_weight_fraction_leaf': 0.0015721503057399486, 'min_impurity_decrease': 0.2774186530785262, 'max_features': 0.1769914678879595, 'subsample': 0.019363297875648916, 'dropout_rate': 0.8222544971036272, 'ccp_alpha': 0.17671985655947892}. Best is trial 935 with value: 0.8497573035489246.[0m
[32m[I 2022-04-21 20:40:40,963][0m Trial 994 finished with value: 0.8443044041827277 and parameters: {'loss': 'coxph', 'learning_rate': 2.007767412153163e-06, 'n_estimators': 129, 'criterion': 'friedman_mse', 'min_samples_split': 2, 'min_samples_leaf': 1, 'min_weight_fraction_leaf': 0.03671940694283529, 'min_impurity_decrease': 0.2697283392261076, 'max_features': 0.14936322267786076, 'subsample': 0.05102669673325468, 'dropout_rate': 0.8041632255811418, 'ccp_alpha': 0.11408064914892961}. Best is trial 935 with value: 0.8497573035489246.[0m
[32m[I 2022-04-21 20:40:42,364][0m Trial 995 finished with value: 0.8440033753010612 and parameters: {'loss': 'coxph', 'learning_rate': 1.0072513977090098e-06, 'n_estimators': 133, 'criterion': 'friedman_mse', 'min_samples_split': 2, 'min_samples_leaf': 1, 'min_weight_fraction_leaf': 0.0318683423116244, 'min_impurity_decrease': 0.2905471469723888, 'max_features': 0.2209207233177342, 'subsample': 0.07098812954887697, 'dropout_rate': 0.8901655489131108, 'ccp_alpha': 0.0013929220826436573}. Best is trial 935 with value: 0.8497573035489246.[0m
[32m[I 2022-04-21 20:40:43,853][0m Trial 996 finished with value: 0.8451697802777437 and parameters: {'loss': 'coxph', 'learning_rate': 7.814298083432385e-06, 'n_estimators': 116, 'criterion': 'friedman_mse', 'min_samples_split': 2, 'min_samples_leaf': 1, 'min_weight_fraction_leaf': 0.01833015608774333, 'min_impurity_decrease': 0.26730048191378447, 'max_features': 0.1578893583924114, 'subsample': 0.03692182337281256, 'dropout_rate': 0.8281758342724163, 'ccp_alpha': 0.23512385852841494}. Best is trial 935 with value: 0.8497573035489246.[0m
