[32m[I 2022-04-21 18:30:26,877][0m Trial 668 finished with value: 0.825074332918371 and parameters: {'loss': 'coxph', 'learning_rate': 0.006077986200250286, 'n_estimators': 930, 'criterion': 'friedman_mse', 'min_samples_split': 2, 'min_samples_leaf': 7, 'min_weight_fraction_leaf': 0.021203578535963222, 'min_impurity_decrease': 0.9467320274025512, 'max_features': 0.25924972965128734, 'subsample': 0.3061082363946203, 'dropout_rate': 0.35007961056576564, 'ccp_alpha': 0.09551294237554833}. Best is trial 664 with value: 0.8342316538423719.[0m
/media/san2_ssd/data/Workdir/survival/venv/lib/python3.8/site-packages/sksurv/ensemble/boosting.py:955: RuntimeWarning: divide by zero encountered in log
  time = numpy.log(time)
/media/san2_ssd/data/Workdir/survival/venv/lib/python3.8/site-packages/sksurv/ensemble/boosting.py:955: RuntimeWarning: divide by zero encountered in log
  time = numpy.log(time)
/media/san2_ssd/data/Workdir/survival/venv/lib/python3.8/site-packages/sksurv/ensemble/boosting.py:955: RuntimeWarning: divide by zero encountered in log
  time = numpy.log(time)
/media/san2_ssd/data/Workdir/survival/venv/lib/python3.8/site-packages/sksurv/ensemble/boosting.py:955: RuntimeWarning: divide by zero encountered in log
  time = numpy.log(time)
[32m[I 2022-04-21 18:31:05,623][0m Trial 669 finished with value: -0.4668556849862607 and parameters: {'loss': 'squared', 'learning_rate': 0.008885489809708434, 'n_estimators': 814, 'criterion': 'friedman_mse', 'min_samples_split': 2, 'min_samples_leaf': 7, 'min_weight_fraction_leaf': 0.008269087947670051, 'min_impurity_decrease': 0.9145089807896039, 'max_features': 0.27021641111887146, 'subsample': 0.33224387417260093, 'dropout_rate': 0.2833843949347574, 'ccp_alpha': 0.003247493650866588}. Best is trial 664 with value: 0.8342316538423719.[0m
[32m[I 2022-04-21 18:34:27,427][0m Trial 670 finished with value: 0.38236996615777286 and parameters: {'loss': 'coxph', 'learning_rate': 0.005454067256018398, 'n_estimators': 833, 'criterion': 'friedman_mse', 'min_samples_split': 2, 'min_samples_leaf': 7, 'min_weight_fraction_leaf': 0.021701545888966074, 'min_impurity_decrease': 0.8560762708767372, 'max_features': 0.2872047746054676, 'subsample': 0.3606068039092738, 'dropout_rate': 0.2673173650998937, 'ccp_alpha': 0.20521876702041403}. Best is trial 664 with value: 0.8342316538423719.[0m
[32m[I 2022-04-21 18:38:15,893][0m Trial 671 finished with value: 0.8302183288325944 and parameters: {'loss': 'coxph', 'learning_rate': 0.0042170191026552825, 'n_estimators': 857, 'criterion': 'friedman_mse', 'min_samples_split': 2, 'min_samples_leaf': 7, 'min_weight_fraction_leaf': 0.023648555904429935, 'min_impurity_decrease': 0.9322202855719172, 'max_features': 0.3049585698360085, 'subsample': 0.29479132047656426, 'dropout_rate': 0.254458801217393, 'ccp_alpha': 0.0023098955376795877}. Best is trial 664 with value: 0.8342316538423719.[0m
[32m[I 2022-04-21 18:43:07,170][0m Trial 672 finished with value: 0.811820995114477 and parameters: {'loss': 'coxph', 'learning_rate': 0.003839125623075905, 'n_estimators': 898, 'criterion': 'friedman_mse', 'min_samples_split': 2, 'min_samples_leaf': 7, 'min_weight_fraction_leaf': 0.0021672180623577737, 'min_impurity_decrease': 0.9410341168719929, 'max_features': 0.29747905385164913, 'subsample': 0.2960794389032571, 'dropout_rate': 0.14292138250462774, 'ccp_alpha': 0.16077989058497805}. Best is trial 664 with value: 0.8342316538423719.[0m
[32m[I 2022-04-21 18:49:02,637][0m Trial 673 finished with value: 0.8301850174381571 and parameters: {'loss': 'coxph', 'learning_rate': 0.005254829199021113, 'n_estimators': 994, 'criterion': 'friedman_mse', 'min_samples_split': 2, 'min_samples_leaf': 7, 'min_weight_fraction_leaf': 0.02021331109673633, 'min_impurity_decrease': 0.9622590910873414, 'max_features': 0.3111508859921684, 'subsample': 0.2900833488258742, 'dropout_rate': 0.1955454926359713, 'ccp_alpha': 0.001844020379975244}. Best is trial 664 with value: 0.8342316538423719.[0m
[32m[I 2022-04-21 18:53:44,795][0m Trial 674 finished with value: 0.8257605721547382 and parameters: {'loss': 'coxph', 'learning_rate': 0.004292736854875506, 'n_estimators': 944, 'criterion': 'friedman_mse', 'min_samples_split': 2, 'min_samples_leaf': 7, 'min_weight_fraction_leaf': 0.0019828633442554038, 'min_impurity_decrease': 0.9319859237642728, 'max_features': 0.30700212189613874, 'subsample': 0.29649383836550347, 'dropout_rate': 0.19697272838929916, 'ccp_alpha': 0.11708137272195024}. Best is trial 664 with value: 0.8342316538423719.[0m
[32m[I 2022-04-21 18:58:42,335][0m Trial 675 finished with value: 0.37338275544188104 and parameters: {'loss': 'coxph', 'learning_rate': 0.004007136609300384, 'n_estimators': 965, 'criterion': 'friedman_mse', 'min_samples_split': 2, 'min_samples_leaf': 7, 'min_weight_fraction_leaf': 0.015855540949256584, 'min_impurity_decrease': 0.9659369343783959, 'max_features': 0.2753275513559363, 'subsample': 0.2936984848422246, 'dropout_rate': 0.2958138525694491, 'ccp_alpha': 0.24121555756146068}. Best is trial 664 with value: 0.8342316538423719.[0m
[32m[I 2022-04-21 19:04:23,737][0m Trial 676 finished with value: 0.8227762311406603 and parameters: {'loss': 'coxph', 'learning_rate': 0.005478551794884718, 'n_estimators': 984, 'criterion': 'friedman_mse', 'min_samples_split': 2, 'min_samples_leaf': 7, 'min_weight_fraction_leaf': 0.021172156427847654, 'min_impurity_decrease': 0.9622671602908723, 'max_features': 0.3053357952212564, 'subsample': 0.2823318647993061, 'dropout_rate': 0.17262049471817698, 'ccp_alpha': 0.09582535508504174}. Best is trial 664 with value: 0.8342316538423719.[0m
[32m[I 2022-04-21 19:08:07,577][0m Trial 677 finished with value: 0.698941980582876 and parameters: {'loss': 'coxph', 'learning_rate': 0.005220440293861599, 'n_estimators': 848, 'criterion': 'friedman_mse', 'min_samples_split': 2, 'min_samples_leaf': 7, 'min_weight_fraction_leaf': 0.024939614856247246, 'min_impurity_decrease': 0.8893951711013287, 'max_features': 0.23136065529315314, 'subsample': 0.31483178326616307, 'dropout_rate': 0.2334351454074144, 'ccp_alpha': 0.1743005149205294}. Best is trial 664 with value: 0.8342316538423719.[0m
[32m[I 2022-04-21 19:12:21,676][0m Trial 678 finished with value: 0.8324088909761423 and parameters: {'loss': 'coxph', 'learning_rate': 0.00682288264131012, 'n_estimators': 850, 'criterion': 'friedman_mse', 'min_samples_split': 2, 'min_samples_leaf': 7, 'min_weight_fraction_leaf': 0.013602735597974123, 'min_impurity_decrease': 0.9505999064410473, 'max_features': 0.3142089547445252, 'subsample': 0.32392216512045613, 'dropout_rate': 0.2125933339479882, 'ccp_alpha': 0.0027430875062025937}. Best is trial 664 with value: 0.8342316538423719.[0m
[32m[I 2022-04-21 19:16:43,416][0m Trial 679 finished with value: 0.8323495136662235 and parameters: {'loss': 'coxph', 'learning_rate': 0.006643652530704406, 'n_estimators': 878, 'criterion': 'friedman_mse', 'min_samples_split': 2, 'min_samples_leaf': 8, 'min_weight_fraction_leaf': 0.013302473097595267, 'min_impurity_decrease': 0.9777464013496302, 'max_features': 0.3123249376577978, 'subsample': 0.3175413391533804, 'dropout_rate': 0.22869671888319676, 'ccp_alpha': 0.0011602951611106435}. Best is trial 664 with value: 0.8342316538423719.[0m
[32m[I 2022-04-21 19:21:23,599][0m Trial 680 finished with value: 0.2503270102305002 and parameters: {'loss': 'coxph', 'learning_rate': 0.006731963330164693, 'n_estimators': 925, 'criterion': 'friedman_mse', 'min_samples_split': 2, 'min_samples_leaf': 8, 'min_weight_fraction_leaf': 0.012819132147934023, 'min_impurity_decrease': 0.9829063364548853, 'max_features': 0.31795441541666797, 'subsample': 0.3168807119940408, 'dropout_rate': 0.22227028830009557, 'ccp_alpha': 0.3137088799970799}. Best is trial 664 with value: 0.8342316538423719.[0m
[32m[I 2022-04-21 19:26:19,556][0m Trial 681 finished with value: 0.25 and parameters: {'loss': 'coxph', 'learning_rate': 0.006916778434745686, 'n_estimators': 990, 'criterion': 'squared_error', 'min_samples_split': 8, 'min_samples_leaf': 7, 'min_weight_fraction_leaf': 0.0033941953492024335, 'min_impurity_decrease': 0.9726584503734734, 'max_features': 0.2541656612029944, 'subsample': 0.3281212910235738, 'dropout_rate': 0.20191438332887038, 'ccp_alpha': 0.09685155437642336}. Best is trial 664 with value: 0.8342316538423719.[0m
[32m[I 2022-04-21 19:30:46,366][0m Trial 682 finished with value: 0.25 and parameters: {'loss': 'coxph', 'learning_rate': 0.004369031706380827, 'n_estimators': 882, 'criterion': 'friedman_mse', 'min_samples_split': 2, 'min_samples_leaf': 7, 'min_weight_fraction_leaf': 0.01055367302972251, 'min_impurity_decrease': 0.9436830348949465, 'max_features': 0.28156824407432723, 'subsample': 0.31317948275961466, 'dropout_rate': 0.18633094627647562, 'ccp_alpha': 1.948473091015793}. Best is trial 664 with value: 0.8342316538423719.[0m
[32m[I 2022-04-21 19:34:35,733][0m Trial 683 finished with value: 0.25 and parameters: {'loss': 'coxph', 'learning_rate': 9.074792665685485e-06, 'n_estimators': 846, 'criterion': 'absolute_error', 'min_samples_split': 2, 'min_samples_leaf': 8, 'min_weight_fraction_leaf': 0.0011741155517783416, 'min_impurity_decrease': 0.9617405346256539, 'max_features': 0.306607363970004, 'subsample': 0.3358314011072293, 'dropout_rate': 0.26048364702923776, 'ccp_alpha': 0.10091300799893374}. Best is trial 664 with value: 0.8342316538423719.[0m
[32m[I 2022-04-21 19:39:03,306][0m Trial 684 finished with value: 0.3672033443974033 and parameters: {'loss': 'coxph', 'learning_rate': 0.006420378778048931, 'n_estimators': 872, 'criterion': 'friedman_mse', 'min_samples_split': 2, 'min_samples_leaf': 8, 'min_weight_fraction_leaf': 0.017794836612821347, 'min_impurity_decrease': 0.9153691101355318, 'max_features': 0.32598000958519613, 'subsample': 0.30356614327138637, 'dropout_rate': 0.2203232336250151, 'ccp_alpha': 0.24267539293082377}. Best is trial 664 with value: 0.8342316538423719.[0m
[32m[I 2022-04-21 19:43:50,525][0m Trial 685 finished with value: 0.8264379503653336 and parameters: {'loss': 'coxph', 'learning_rate': 0.00544952565928746, 'n_estimators': 947, 'criterion': 'friedman_mse', 'min_samples_split': 2, 'min_samples_leaf': 8, 'min_weight_fraction_leaf': 0.027482617803041197, 'min_impurity_decrease': 0.9297142265771592, 'max_features': 0.2829764738725495, 'subsample': 0.34442850770008165, 'dropout_rate': 0.24167093002597248, 'ccp_alpha': 0.09220331397353275}. Best is trial 664 with value: 0.8342316538423719.[0m
[32m[I 2022-04-21 19:47:16,771][0m Trial 686 finished with value: 0.6940049030625135 and parameters: {'loss': 'coxph', 'learning_rate': 0.007547787534341997, 'n_estimators': 794, 'criterion': 'friedman_mse', 'min_samples_split': 2, 'min_samples_leaf': 7, 'min_weight_fraction_leaf': 0.01365812984599057, 'min_impurity_decrease': 0.9782462008756883, 'max_features': 0.30522522610465963, 'subsample': 0.3206527419844144, 'dropout_rate': 0.21077092643588438, 'ccp_alpha': 0.16874851844544164}. Best is trial 664 with value: 0.8342316538423719.[0m
[32m[I 2022-04-21 19:51:49,013][0m Trial 687 finished with value: 0.8253588099856035 and parameters: {'loss': 'coxph', 'learning_rate': 0.004072438841612576, 'n_estimators': 916, 'criterion': 'friedman_mse', 'min_samples_split': 2, 'min_samples_leaf': 9, 'min_weight_fraction_leaf': 0.020269003104775182, 'min_impurity_decrease': 0.9117203469767248, 'max_features': 0.2508306699557422, 'subsample': 0.2927152325065808, 'dropout_rate': 0.24565471194737257, 'ccp_alpha': 0.09062076696630073}. Best is trial 664 with value: 0.8342316538423719.[0m
[32m[I 2022-04-21 19:56:25,084][0m Trial 688 finished with value: 0.25 and parameters: {'loss': 'coxph', 'learning_rate': 0.007644082519841529, 'n_estimators': 870, 'criterion': 'friedman_mse', 'min_samples_split': 2, 'min_samples_leaf': 7, 'min_weight_fraction_leaf': 0.02458647167598578, 'min_impurity_decrease': 0.998059539053816, 'max_features': 0.32758938797508486, 'subsample': 0.33677262991901513, 'dropout_rate': 0.16466712439872375, 'ccp_alpha': 0.960515263496813}. Best is trial 664 with value: 0.8342316538423719.[0m
/media/san2_ssd/data/Workdir/survival/venv/lib/python3.8/site-packages/sksurv/ensemble/boosting.py:955: RuntimeWarning: divide by zero encountered in log
  time = numpy.log(time)
/media/san2_ssd/data/Workdir/survival/venv/lib/python3.8/site-packages/sksurv/ensemble/boosting.py:955: RuntimeWarning: divide by zero encountered in log
  time = numpy.log(time)
/media/san2_ssd/data/Workdir/survival/venv/lib/python3.8/site-packages/sksurv/ensemble/boosting.py:955: RuntimeWarning: divide by zero encountered in log
  time = numpy.log(time)
/media/san2_ssd/data/Workdir/survival/venv/lib/python3.8/site-packages/sksurv/ensemble/boosting.py:955: RuntimeWarning: divide by zero encountered in log
  time = numpy.log(time)
[32m[I 2022-04-21 19:57:11,231][0m Trial 689 finished with value: -0.46647489985532753 and parameters: {'loss': 'squared', 'learning_rate': 0.005754772304229207, 'n_estimators': 804, 'criterion': 'friedman_mse', 'min_samples_split': 2, 'min_samples_leaf': 7, 'min_weight_fraction_leaf': 0.0014281154436730885, 'min_impurity_decrease': 0.94913561410964, 'max_features': 0.2783263408031891, 'subsample': 0.3115583420852663, 'dropout_rate': 0.2021333628552727, 'ccp_alpha': 0.1938302701681998}. Best is trial 664 with value: 0.8342316538423719.[0m
[32m[I 2022-04-21 20:01:00,663][0m Trial 690 finished with value: 0.2503270102305002 and parameters: {'loss': 'coxph', 'learning_rate': 0.008413212863220193, 'n_estimators': 836, 'criterion': 'friedman_mse', 'min_samples_split': 2, 'min_samples_leaf': 8, 'min_weight_fraction_leaf': 0.012274206899058707, 'min_impurity_decrease': 0.8782949187923459, 'max_features': 0.30874197572200923, 'subsample': 0.2851711626838533, 'dropout_rate': 0.25500663792929323, 'ccp_alpha': 0.3512514291747385}. Best is trial 664 with value: 0.8342316538423719.[0m
[32m[I 2022-04-21 20:06:29,553][0m Trial 691 finished with value: 0.8246215590216686 and parameters: {'loss': 'coxph', 'learning_rate': 0.004577859732581938, 'n_estimators': 911, 'criterion': 'friedman_mse', 'min_samples_split': 2, 'min_samples_leaf': 7, 'min_weight_fraction_leaf': 0.02730693597450474, 'min_impurity_decrease': 0.8308025845585157, 'max_features': 0.26313892581322396, 'subsample': 0.3470007572219073, 'dropout_rate': 0.1921443914504141, 'ccp_alpha': 0.08519764244268876}. Best is trial 664 with value: 0.8342316538423719.[0m
[32m[I 2022-04-21 20:10:35,929][0m Trial 692 finished with value: 0.8258066117515923 and parameters: {'loss': 'coxph', 'learning_rate': 0.006872925316986626, 'n_estimators': 807, 'criterion': 'friedman_mse', 'min_samples_split': 2, 'min_samples_leaf': 7, 'min_weight_fraction_leaf': 0.011362173499618487, 'min_impurity_decrease': 0.9537324689470802, 'max_features': 0.2903063117841178, 'subsample': 0.3197298255818085, 'dropout_rate': 0.23498053822152434, 'ccp_alpha': 0.09220447059579723}. Best is trial 664 with value: 0.8342316538423719.[0m
[32m[I 2022-04-21 20:15:13,557][0m Trial 693 finished with value: 0.8318223383670105 and parameters: {'loss': 'coxph', 'learning_rate': 0.005711989331232287, 'n_estimators': 872, 'criterion': 'friedman_mse', 'min_samples_split': 2, 'min_samples_leaf': 7, 'min_weight_fraction_leaf': 0.021764875024342704, 'min_impurity_decrease': 0.9215998928893153, 'max_features': 0.33624658618450254, 'subsample': 0.29911520763777755, 'dropout_rate': 0.2807548278640131, 'ccp_alpha': 0.007297447289405602}. Best is trial 664 with value: 0.8342316538423719.[0m
[32m[I 2022-04-21 20:19:18,514][0m Trial 694 finished with value: 0.37454736495044594 and parameters: {'loss': 'coxph', 'learning_rate': 0.005369409960101467, 'n_estimators': 880, 'criterion': 'friedman_mse', 'min_samples_split': 2, 'min_samples_leaf': 7, 'min_weight_fraction_leaf': 0.023690927660313457, 'min_impurity_decrease': 0.9252977664688032, 'max_features': 0.33323210531713277, 'subsample': 0.2738612325152003, 'dropout_rate': 0.28319462318137567, 'ccp_alpha': 0.24618612732163866}. Best is trial 664 with value: 0.8342316538423719.[0m
[32m[I 2022-04-21 20:25:03,070][0m Trial 695 finished with value: 0.8310512196636355 and parameters: {'loss': 'coxph', 'learning_rate': 0.005083942316084048, 'n_estimators': 995, 'criterion': 'friedman_mse', 'min_samples_split': 2, 'min_samples_leaf': 7, 'min_weight_fraction_leaf': 0.012590303428457551, 'min_impurity_decrease': 0.902918990696275, 'max_features': 0.3180523014814116, 'subsample': 0.32994119753387846, 'dropout_rate': 0.2994565942293516, 'ccp_alpha': 0.0012962269745124544}. Best is trial 664 with value: 0.8342316538423719.[0m
[32m[I 2022-04-21 20:30:05,308][0m Trial 696 finished with value: 0.3984052358554031 and parameters: {'loss': 'coxph', 'learning_rate': 0.003800863099025029, 'n_estimators': 943, 'criterion': 'friedman_mse', 'min_samples_split': 2, 'min_samples_leaf': 7, 'min_weight_fraction_leaf': 0.014515148788405687, 'min_impurity_decrease': 0.9086737649431699, 'max_features': 0.3362571707965843, 'subsample': 0.3289787515515893, 'dropout_rate': 0.2681169524544297, 'ccp_alpha': 0.1851670660619625}. Best is trial 664 with value: 0.8342316538423719.[0m
[32m[I 2022-04-21 20:35:27,484][0m Trial 697 finished with value: 0.8315747612466099 and parameters: {'loss': 'coxph', 'learning_rate': 0.004103477094275381, 'n_estimators': 958, 'criterion': 'friedman_mse', 'min_samples_split': 2, 'min_samples_leaf': 7, 'min_weight_fraction_leaf': 0.026376415525160776, 'min_impurity_decrease': 0.9360138757477983, 'max_features': 0.31730085372623723, 'subsample': 0.30828299058115854, 'dropout_rate': 0.3022885839816091, 'ccp_alpha': 0.004098420629743727}. Best is trial 664 with value: 0.8342316538423719.[0m
[32m[I 2022-04-21 20:40:31,521][0m Trial 698 finished with value: 0.25 and parameters: {'loss': 'coxph', 'learning_rate': 0.00368647024554979, 'n_estimators': 1000, 'criterion': 'friedman_mse', 'min_samples_split': 2, 'min_samples_leaf': 7, 'min_weight_fraction_leaf': 0.023145279030475502, 'min_impurity_decrease': 0.9329126663876705, 'max_features': 0.31728196769324357, 'subsample': 0.30237418360409296, 'dropout_rate': 0.3255143853226732, 'ccp_alpha': 0.44805570550182094}. Best is trial 664 with value: 0.8342316538423719.[0m
[32m[I 2022-04-21 20:46:09,395][0m Trial 699 finished with value: 0.8259453090038195 and parameters: {'loss': 'coxph', 'learning_rate': 0.003940420615091917, 'n_estimators': 989, 'criterion': 'friedman_mse', 'min_samples_split': 2, 'min_samples_leaf': 7, 'min_weight_fraction_leaf': 0.002039669904009493, 'min_impurity_decrease': 0.8929852572913735, 'max_features': 0.3098064185299883, 'subsample': 0.2973370724065125, 'dropout_rate': 0.2990654464220769, 'ccp_alpha': 0.08796447118738615}. Best is trial 664 with value: 0.8342316538423719.[0m
[32m[I 2022-04-21 20:50:27,313][0m Trial 700 finished with value: 0.8092820912600901 and parameters: {'loss': 'coxph', 'learning_rate': 0.004653883013832898, 'n_estimators': 933, 'criterion': 'friedman_mse', 'min_samples_split': 2, 'min_samples_leaf': 7, 'min_weight_fraction_leaf': 0.012380262919863575, 'min_impurity_decrease': 0.9497843600869699, 'max_features': 0.34357122941724144, 'subsample': 0.3150895657390811, 'dropout_rate': 0.30741983599848677, 'ccp_alpha': 0.16708056098249585}. Best is trial 664 with value: 0.8342316538423719.[0m
[32m[I 2022-04-21 20:55:22,920][0m Trial 701 finished with value: 0.8302283344753894 and parameters: {'loss': 'coxph', 'learning_rate': 0.004810100603867431, 'n_estimators': 947, 'criterion': 'friedman_mse', 'min_samples_split': 2, 'min_samples_leaf': 7, 'min_weight_fraction_leaf': 0.02567331428764178, 'min_impurity_decrease': 0.9739665561685443, 'max_features': 0.29443713158374024, 'subsample': 0.2817402663783272, 'dropout_rate': 0.2885891326070932, 'ccp_alpha': 0.0058186196552916045}. Best is trial 664 with value: 0.8342316538423719.[0m
[32m[I 2022-04-21 21:00:20,474][0m Trial 702 finished with value: 0.26549606712904655 and parameters: {'loss': 'coxph', 'learning_rate': 0.003995470080766387, 'n_estimators': 952, 'criterion': 'friedman_mse', 'min_samples_split': 2, 'min_samples_leaf': 7, 'min_weight_fraction_leaf': 0.027411205767347166, 'min_impurity_decrease': 0.9749624232289038, 'max_features': 0.2918449276061503, 'subsample': 0.2699162646441942, 'dropout_rate': 0.2712413651619879, 'ccp_alpha': 0.28151554413092}. Best is trial 664 with value: 0.8342316538423719.[0m
[32m[I 2022-04-21 21:05:12,500][0m Trial 703 finished with value: 0.8271272464175123 and parameters: {'loss': 'coxph', 'learning_rate': 0.004972804150809851, 'n_estimators': 996, 'criterion': 'friedman_mse', 'min_samples_split': 2, 'min_samples_leaf': 7, 'min_weight_fraction_leaf': 0.016202022114519894, 'min_impurity_decrease': 0.9712220963791317, 'max_features': 0.27383529334402434, 'subsample': 0.27742342125852326, 'dropout_rate': 0.33346894866201554, 'ccp_alpha': 0.08140914430711033}. Best is trial 664 with value: 0.8342316538423719.[0m
[32m[I 2022-04-21 21:09:24,719][0m Trial 704 finished with value: 0.25 and parameters: {'loss': 'coxph', 'learning_rate': 0.004922018432953403, 'n_estimators': 914, 'criterion': 'squared_error', 'min_samples_split': 2, 'min_samples_leaf': 7, 'min_weight_fraction_leaf': 0.02756583198335519, 'min_impurity_decrease': 0.9561094286684616, 'max_features': 0.2064598371804088, 'subsample': 0.29696074361286035, 'dropout_rate': 0.3048592017286071, 'ccp_alpha': 0.17102358433713027}. Best is trial 664 with value: 0.8342316538423719.[0m
