[32m[I 2022-04-21 15:44:38,904][0m Trial 517 finished with value: 0.8253574934758057 and parameters: {'loss': 'coxph', 'learning_rate': 0.015800128244291323, 'n_estimators': 580, 'criterion': 'friedman_mse', 'min_samples_split': 2, 'min_samples_leaf': 4, 'min_weight_fraction_leaf': 0.03901617775207509, 'min_impurity_decrease': 0.5430669667343971, 'max_features': 0.43223028033482436, 'subsample': 0.367540409334028, 'dropout_rate': 0.9995002547648671, 'ccp_alpha': 0.08995170424185835}. Best is trial 486 with value: 0.8320137528916117.[0m
[32m[I 2022-04-21 15:44:54,213][0m Trial 518 finished with value: 0.8289722152771223 and parameters: {'loss': 'coxph', 'learning_rate': 0.01871992925009388, 'n_estimators': 461, 'criterion': 'friedman_mse', 'min_samples_split': 2, 'min_samples_leaf': 4, 'min_weight_fraction_leaf': 0.060841147617091, 'min_impurity_decrease': 0.4665582983397677, 'max_features': 0.5361472823508816, 'subsample': 0.4070487368152213, 'dropout_rate': 0.9717581318021055, 'ccp_alpha': 0.005983720816967216}. Best is trial 486 with value: 0.8320137528916117.[0m
[32m[I 2022-04-21 15:45:09,060][0m Trial 519 finished with value: 0.3724450853015603 and parameters: {'loss': 'coxph', 'learning_rate': 0.027338175723102886, 'n_estimators': 467, 'criterion': 'friedman_mse', 'min_samples_split': 2, 'min_samples_leaf': 4, 'min_weight_fraction_leaf': 0.06548297162067283, 'min_impurity_decrease': 0.4817648735762444, 'max_features': 0.5413669929424971, 'subsample': 0.39817934141183403, 'dropout_rate': 0.9532743889098926, 'ccp_alpha': 0.20276743422306515}. Best is trial 486 with value: 0.8320137528916117.[0m
[32m[I 2022-04-21 15:45:36,542][0m Trial 520 finished with value: 0.8252091565214867 and parameters: {'loss': 'coxph', 'learning_rate': 0.023811001472146865, 'n_estimators': 537, 'criterion': 'friedman_mse', 'min_samples_split': 2, 'min_samples_leaf': 4, 'min_weight_fraction_leaf': 0.07719382066609429, 'min_impurity_decrease': 0.5351852973611256, 'max_features': 0.51819233656219, 'subsample': 0.3783518093537786, 'dropout_rate': 0.9292508803951891, 'ccp_alpha': 0.08156682489991554}. Best is trial 486 with value: 0.8320137528916117.[0m
[32m[I 2022-04-21 15:45:56,338][0m Trial 521 finished with value: 0.25 and parameters: {'loss': 'coxph', 'learning_rate': 0.008048902761466475, 'n_estimators': 496, 'criterion': 'squared_error', 'min_samples_split': 2, 'min_samples_leaf': 4, 'min_weight_fraction_leaf': 0.06098384078360902, 'min_impurity_decrease': 0.47116328913649796, 'max_features': 0.388907933283529, 'subsample': 0.36681273396201813, 'dropout_rate': 0.9687440618597407, 'ccp_alpha': 0.006719388059441894}. Best is trial 486 with value: 0.8320137528916117.[0m
[32m[I 2022-04-21 15:46:21,034][0m Trial 522 finished with value: 0.8299598668203213 and parameters: {'loss': 'coxph', 'learning_rate': 0.01255695704687411, 'n_estimators': 669, 'criterion': 'friedman_mse', 'min_samples_split': 2, 'min_samples_leaf': 4, 'min_weight_fraction_leaf': 0.07438228964373532, 'min_impurity_decrease': 0.6973460200789438, 'max_features': 0.5117916631343942, 'subsample': 0.4087586480724778, 'dropout_rate': 0.9497742861535018, 'ccp_alpha': 0.002572292735791678}. Best is trial 486 with value: 0.8320137528916117.[0m
[32m[I 2022-04-21 15:49:04,988][0m Trial 523 finished with value: 0.5972171548624052 and parameters: {'loss': 'coxph', 'learning_rate': 0.009742364997850434, 'n_estimators': 678, 'criterion': 'friedman_mse', 'min_samples_split': 2, 'min_samples_leaf': 4, 'min_weight_fraction_leaf': 0.07951083520005503, 'min_impurity_decrease': 0.6636567331435215, 'max_features': 0.49668781405832957, 'subsample': 0.4143017012101772, 'dropout_rate': 0.3794456389326277, 'ccp_alpha': 0.17605261473720385}. Best is trial 486 with value: 0.8320137528916117.[0m
[32m[I 2022-04-21 15:49:51,191][0m Trial 524 finished with value: 0.25 and parameters: {'loss': 'coxph', 'learning_rate': 0.01141439557725175, 'n_estimators': 720, 'criterion': 'absolute_error', 'min_samples_split': 2, 'min_samples_leaf': 4, 'min_weight_fraction_leaf': 0.05614356531395167, 'min_impurity_decrease': 0.7092728712245859, 'max_features': 0.32765380561306273, 'subsample': 0.41240830291119474, 'dropout_rate': 0.9271508611638364, 'ccp_alpha': 0.24692054578649247}. Best is trial 486 with value: 0.8320137528916117.[0m
[32m[I 2022-04-21 15:50:26,763][0m Trial 525 finished with value: 0.8213861528548259 and parameters: {'loss': 'coxph', 'learning_rate': 0.019953036620845518, 'n_estimators': 673, 'criterion': 'friedman_mse', 'min_samples_split': 2, 'min_samples_leaf': 4, 'min_weight_fraction_leaf': 0.0661545139936379, 'min_impurity_decrease': 0.8001578508168231, 'max_features': 0.531776482699958, 'subsample': 0.454823497146441, 'dropout_rate': 0.9438235280193856, 'ccp_alpha': 0.09151280558589268}. Best is trial 486 with value: 0.8320137528916117.[0m
[32m[I 2022-04-21 15:50:59,807][0m Trial 526 finished with value: 0.8282360379603189 and parameters: {'loss': 'coxph', 'learning_rate': 0.011914986278774561, 'n_estimators': 696, 'criterion': 'friedman_mse', 'min_samples_split': 2, 'min_samples_leaf': 4, 'min_weight_fraction_leaf': 0.07933748367862253, 'min_impurity_decrease': 0.761504619490729, 'max_features': 0.46634805059760054, 'subsample': 0.4029692363094219, 'dropout_rate': 0.9500231654967581, 'ccp_alpha': 0.00646093250719281}. Best is trial 486 with value: 0.8320137528916117.[0m
[32m[I 2022-04-21 15:51:16,136][0m Trial 527 finished with value: 0.39239476023237785 and parameters: {'loss': 'coxph', 'learning_rate': 0.008496480084268104, 'n_estimators': 450, 'criterion': 'friedman_mse', 'min_samples_split': 2, 'min_samples_leaf': 4, 'min_weight_fraction_leaf': 0.046939759557544425, 'min_impurity_decrease': 0.9742015384584115, 'max_features': 0.5062874221719593, 'subsample': 0.38976979234710896, 'dropout_rate': 0.93308008787806, 'ccp_alpha': 0.16858789328011287}. Best is trial 486 with value: 0.8320137528916117.[0m
[32m[I 2022-04-21 15:51:44,234][0m Trial 528 finished with value: 0.2503270102305002 and parameters: {'loss': 'coxph', 'learning_rate': 0.007894530961441049, 'n_estimators': 637, 'criterion': 'friedman_mse', 'min_samples_split': 2, 'min_samples_leaf': 4, 'min_weight_fraction_leaf': 0.03635019492603917, 'min_impurity_decrease': 0.7135660459345607, 'max_features': 0.3485437180065882, 'subsample': 0.4236606804673426, 'dropout_rate': 0.961022993768969, 'ccp_alpha': 0.3249769686638265}. Best is trial 486 with value: 0.8320137528916117.[0m
[32m[I 2022-04-21 15:52:33,763][0m Trial 529 finished with value: 0.8252924896329553 and parameters: {'loss': 'coxph', 'learning_rate': 0.0994635936541155, 'n_estimators': 742, 'criterion': 'friedman_mse', 'min_samples_split': 2, 'min_samples_leaf': 4, 'min_weight_fraction_leaf': 0.05877500110390238, 'min_impurity_decrease': 0.7778145272450008, 'max_features': 0.5155533127296271, 'subsample': 0.36241164324822844, 'dropout_rate': 0.9281643225068364, 'ccp_alpha': 0.09388335268436201}. Best is trial 486 with value: 0.8320137528916117.[0m
[32m[I 2022-04-21 15:53:03,588][0m Trial 530 finished with value: 0.25 and parameters: {'loss': 'coxph', 'learning_rate': 0.012903409672105707, 'n_estimators': 652, 'criterion': 'friedman_mse', 'min_samples_split': 2, 'min_samples_leaf': 6, 'min_weight_fraction_leaf': 0.39658775461082646, 'min_impurity_decrease': 0.51690627052613, 'max_features': 0.5292618379960088, 'subsample': 0.46222296970463, 'dropout_rate': 0.9739389898813228, 'ccp_alpha': 1.1219877064282266}. Best is trial 486 with value: 0.8320137528916117.[0m
[32m[I 2022-04-21 15:53:27,090][0m Trial 531 finished with value: 0.3811755851689217 and parameters: {'loss': 'coxph', 'learning_rate': 0.021167138843194263, 'n_estimators': 478, 'criterion': 'friedman_mse', 'min_samples_split': 2, 'min_samples_leaf': 4, 'min_weight_fraction_leaf': 0.07417211800907984, 'min_impurity_decrease': 0.49192406289009877, 'max_features': 0.48522434724826363, 'subsample': 0.44068336687047965, 'dropout_rate': 0.9513167026733278, 'ccp_alpha': 0.17167715994322824}. Best is trial 486 with value: 0.8320137528916117.[0m
/media/san2_ssd/data/Workdir/survival/venv/lib/python3.8/site-packages/sksurv/ensemble/boosting.py:955: RuntimeWarning: divide by zero encountered in log
  time = numpy.log(time)
/media/san2_ssd/data/Workdir/survival/venv/lib/python3.8/site-packages/sksurv/ensemble/boosting.py:955: RuntimeWarning: divide by zero encountered in log
  time = numpy.log(time)
/media/san2_ssd/data/Workdir/survival/venv/lib/python3.8/site-packages/sksurv/ensemble/boosting.py:955: RuntimeWarning: divide by zero encountered in log
  time = numpy.log(time)
/media/san2_ssd/data/Workdir/survival/venv/lib/python3.8/site-packages/sksurv/ensemble/boosting.py:955: RuntimeWarning: divide by zero encountered in log
  time = numpy.log(time)
[32m[I 2022-04-21 15:53:36,944][0m Trial 532 finished with value: -0.46667863900593376 and parameters: {'loss': 'squared', 'learning_rate': 0.017097360811385638, 'n_estimators': 611, 'criterion': 'friedman_mse', 'min_samples_split': 2, 'min_samples_leaf': 4, 'min_weight_fraction_leaf': 0.08554353480570422, 'min_impurity_decrease': 0.5047377201896023, 'max_features': 0.4456364307846626, 'subsample': 0.39268513623306794, 'dropout_rate': 0.9253364835189284, 'ccp_alpha': 0.08835590095948702}. Best is trial 486 with value: 0.8320137528916117.[0m
[32m[I 2022-04-21 15:54:12,897][0m Trial 533 finished with value: 0.8281898953311078 and parameters: {'loss': 'coxph', 'learning_rate': 0.03169588010321738, 'n_estimators': 786, 'criterion': 'friedman_mse', 'min_samples_split': 2, 'min_samples_leaf': 7, 'min_weight_fraction_leaf': 0.06545531425427675, 'min_impurity_decrease': 0.4691091541825844, 'max_features': 0.5339144388874426, 'subsample': 0.4166371523763582, 'dropout_rate': 0.9794981701468963, 'ccp_alpha': 0.0018085574297509162}. Best is trial 486 with value: 0.8320137528916117.[0m
[32m[I 2022-04-21 15:54:53,097][0m Trial 534 finished with value: 0.8058724048888244 and parameters: {'loss': 'coxph', 'learning_rate': 0.011041461293325155, 'n_estimators': 708, 'criterion': 'friedman_mse', 'min_samples_split': 2, 'min_samples_leaf': 4, 'min_weight_fraction_leaf': 0.05441007840353311, 'min_impurity_decrease': 0.4888721794320433, 'max_features': 0.41214740494217983, 'subsample': 0.06985779128711338, 'dropout_rate': 0.9566413151857656, 'ccp_alpha': 0.25642366734582245}. Best is trial 486 with value: 0.8320137528916117.[0m
[32m[I 2022-04-21 15:55:26,697][0m Trial 535 finished with value: 0.8274643667881036 and parameters: {'loss': 'coxph', 'learning_rate': 0.007453062705806216, 'n_estimators': 674, 'criterion': 'friedman_mse', 'min_samples_split': 2, 'min_samples_leaf': 4, 'min_weight_fraction_leaf': 0.07371589401108664, 'min_impurity_decrease': 0.5183328388570428, 'max_features': 0.5481914625372379, 'subsample': 0.38402843467977227, 'dropout_rate': 0.9244483635697711, 'ccp_alpha': 0.003166490397662175}. Best is trial 486 with value: 0.8320137528916117.[0m
[32m[I 2022-04-21 15:55:39,477][0m Trial 536 finished with value: 0.25 and parameters: {'loss': 'coxph', 'learning_rate': 0.07150987171183314, 'n_estimators': 505, 'criterion': 'friedman_mse', 'min_samples_split': 2, 'min_samples_leaf': 4, 'min_weight_fraction_leaf': 0.0402783326356285, 'min_impurity_decrease': 0.9213387783439245, 'max_features': 0.3925658360961755, 'subsample': 0.4125485648748516, 'dropout_rate': 0.9778682398530583, 'ccp_alpha': 2.237861112925261}. Best is trial 486 with value: 0.8320137528916117.[0m
[32m[I 2022-04-21 15:56:01,203][0m Trial 537 finished with value: 0.8253459403164319 and parameters: {'loss': 'coxph', 'learning_rate': 0.01009445328129772, 'n_estimators': 549, 'criterion': 'friedman_mse', 'min_samples_split': 2, 'min_samples_leaf': 4, 'min_weight_fraction_leaf': 0.08520800899859765, 'min_impurity_decrease': 0.4628986927275163, 'max_features': 0.4336041169522319, 'subsample': 0.4797349717431303, 'dropout_rate': 0.9431553208507052, 'ccp_alpha': 0.10273394880737598}. Best is trial 486 with value: 0.8320137528916117.[0m
[32m[I 2022-04-21 15:56:27,914][0m Trial 538 finished with value: 0.5992442328711688 and parameters: {'loss': 'coxph', 'learning_rate': 0.014147550315112676, 'n_estimators': 629, 'criterion': 'friedman_mse', 'min_samples_split': 2, 'min_samples_leaf': 5, 'min_weight_fraction_leaf': 0.049099462167763584, 'min_impurity_decrease': 0.7235630774245051, 'max_features': 0.48375395226844675, 'subsample': 0.3568546827660407, 'dropout_rate': 0.9603343119268599, 'ccp_alpha': 0.17487007505701072}. Best is trial 486 with value: 0.8320137528916117.[0m
[32m[I 2022-04-21 15:56:48,112][0m Trial 539 finished with value: 0.8273470789714615 and parameters: {'loss': 'coxph', 'learning_rate': 0.028042137606366146, 'n_estimators': 608, 'criterion': 'friedman_mse', 'min_samples_split': 2, 'min_samples_leaf': 4, 'min_weight_fraction_leaf': 0.06725414405953037, 'min_impurity_decrease': 0.6937176379952715, 'max_features': 0.5118881948296223, 'subsample': 0.5386775307271554, 'dropout_rate': 0.9817575300088714, 'ccp_alpha': 0.0017204243893544212}. Best is trial 486 with value: 0.8320137528916117.[0m
[32m[I 2022-04-21 15:57:33,528][0m Trial 540 finished with value: 0.8226894669340215 and parameters: {'loss': 'coxph', 'learning_rate': 0.020369721450119106, 'n_estimators': 747, 'criterion': 'friedman_mse', 'min_samples_split': 2, 'min_samples_leaf': 4, 'min_weight_fraction_leaf': 0.07918741002886304, 'min_impurity_decrease': 0.7381858904586407, 'max_features': 0.5607097310622423, 'subsample': 0.40235941930235797, 'dropout_rate': 0.9226331504744132, 'ccp_alpha': 0.10227956076509842}. Best is trial 486 with value: 0.8320137528916117.[0m
[32m[I 2022-04-21 15:58:03,085][0m Trial 541 finished with value: 0.8283932417733044 and parameters: {'loss': 'coxph', 'learning_rate': 0.007304147590349801, 'n_estimators': 693, 'criterion': 'friedman_mse', 'min_samples_split': 2, 'min_samples_leaf': 4, 'min_weight_fraction_leaf': 0.05822652403828544, 'min_impurity_decrease': 0.48425213375350407, 'max_features': 0.4230762419581211, 'subsample': 0.4528107112824531, 'dropout_rate': 0.9459227022582013, 'ccp_alpha': 0.004289414131512808}. Best is trial 486 with value: 0.8320137528916117.[0m
[32m[I 2022-04-21 15:58:24,447][0m Trial 542 finished with value: 0.2503270102305002 and parameters: {'loss': 'coxph', 'learning_rate': 0.00975517250488768, 'n_estimators': 649, 'criterion': 'friedman_mse', 'min_samples_split': 2, 'min_samples_leaf': 4, 'min_weight_fraction_leaf': 0.047957448883218345, 'min_impurity_decrease': 0.5451067392672473, 'max_features': 0.45785328163639805, 'subsample': 0.4315998096516091, 'dropout_rate': 0.9675987160655234, 'ccp_alpha': 0.25708246068669444}. Best is trial 486 with value: 0.8320137528916117.[0m
[32m[I 2022-04-21 15:58:46,374][0m Trial 543 finished with value: 0.2503270102305002 and parameters: {'loss': 'coxph', 'learning_rate': 0.051531000948708945, 'n_estimators': 543, 'criterion': 'friedman_mse', 'min_samples_split': 2, 'min_samples_leaf': 4, 'min_weight_fraction_leaf': 0.07011503057382909, 'min_impurity_decrease': 0.5024641577462152, 'max_features': 0.3615648924706285, 'subsample': 0.37503744025774804, 'dropout_rate': 0.9469787403545475, 'ccp_alpha': 0.36118407586208484}. Best is trial 486 with value: 0.8320137528916117.[0m
[32m[I 2022-04-21 15:59:00,032][0m Trial 544 finished with value: 0.25 and parameters: {'loss': 'coxph', 'learning_rate': 0.018541246114382678, 'n_estimators': 515, 'criterion': 'squared_error', 'min_samples_split': 2, 'min_samples_leaf': 5, 'min_weight_fraction_leaf': 0.05961720298538851, 'min_impurity_decrease': 0.6390552038091795, 'max_features': 0.4021216388814991, 'subsample': 0.3529094088010583, 'dropout_rate': 0.9841535200074287, 'ccp_alpha': 0.14659950165653343}. Best is trial 486 with value: 0.8320137528916117.[0m
[32m[I 2022-04-21 15:59:43,932][0m Trial 545 finished with value: 0.25 and parameters: {'loss': 'coxph', 'learning_rate': 0.01298518440514182, 'n_estimators': 666, 'criterion': 'absolute_error', 'min_samples_split': 2, 'min_samples_leaf': 6, 'min_weight_fraction_leaf': 0.029884571320080194, 'min_impurity_decrease': 0.4620029747830846, 'max_features': 0.5314174213786573, 'subsample': 0.42840954388673425, 'dropout_rate': 0.9230468241225768, 'ccp_alpha': 0.0036933695590210583}. Best is trial 486 with value: 0.8320137528916117.[0m
[32m[I 2022-04-21 15:59:59,429][0m Trial 546 finished with value: 0.3870317452955863 and parameters: {'loss': 'coxph', 'learning_rate': 0.008649110564885619, 'n_estimators': 598, 'criterion': 'friedman_mse', 'min_samples_split': 2, 'min_samples_leaf': 4, 'min_weight_fraction_leaf': 0.08365347294247749, 'min_impurity_decrease': 0.5245080904277296, 'max_features': 0.5655797255533458, 'subsample': 0.39018040722484065, 'dropout_rate': 0.9993790040889922, 'ccp_alpha': 0.17984754333773662}. Best is trial 486 with value: 0.8320137528916117.[0m
[32m[I 2022-04-21 16:00:32,374][0m Trial 547 finished with value: 0.25 and parameters: {'loss': 'coxph', 'learning_rate': 0.024151693588136527, 'n_estimators': 731, 'criterion': 'friedman_mse', 'min_samples_split': 2, 'min_samples_leaf': 4, 'min_weight_fraction_leaf': 0.28833183240924354, 'min_impurity_decrease': 0.48475680652742353, 'max_features': 0.49595687561658264, 'subsample': 0.4080138223156566, 'dropout_rate': 0.9610636246635866, 'ccp_alpha': 0.4687257233506022}. Best is trial 486 with value: 0.8320137528916117.[0m
[32m[I 2022-04-21 16:00:57,856][0m Trial 548 finished with value: 0.25 and parameters: {'loss': 'coxph', 'learning_rate': 2.038799572636117e-05, 'n_estimators': 555, 'criterion': 'friedman_mse', 'min_samples_split': 2, 'min_samples_leaf': 4, 'min_weight_fraction_leaf': 0.04017172898268505, 'min_impurity_decrease': 0.6872985132827548, 'max_features': 0.585576842574666, 'subsample': 0.4428978252208814, 'dropout_rate': 0.945188764732377, 'ccp_alpha': 0.6869703860182282}. Best is trial 486 with value: 0.8320137528916117.[0m
[32m[I 2022-04-21 16:01:21,587][0m Trial 549 finished with value: 0.8199828273142863 and parameters: {'loss': 'coxph', 'learning_rate': 0.016718251165103958, 'n_estimators': 629, 'criterion': 'friedman_mse', 'min_samples_split': 2, 'min_samples_leaf': 5, 'min_weight_fraction_leaf': 0.07271375341802638, 'min_impurity_decrease': 0.44890192003609575, 'max_features': 0.3790598788535501, 'subsample': 0.47099523308658475, 'dropout_rate': 0.9714935768866821, 'ccp_alpha': 0.09892095157398371}. Best is trial 486 with value: 0.8320137528916117.[0m
[32m[I 2022-04-21 16:01:59,883][0m Trial 550 finished with value: 0.2503270102305002 and parameters: {'loss': 'coxph', 'learning_rate': 0.0069940127338928015, 'n_estimators': 703, 'criterion': 'friedman_mse', 'min_samples_split': 2, 'min_samples_leaf': 4, 'min_weight_fraction_leaf': 0.06319406831156565, 'min_impurity_decrease': 0.5031303762819477, 'max_features': 0.5427259090175502, 'subsample': 0.5002998433691552, 'dropout_rate': 0.9224842901213839, 'ccp_alpha': 0.2356533525409352}. Best is trial 486 with value: 0.8320137528916117.[0m
[32m[I 2022-04-21 16:02:23,051][0m Trial 551 finished with value: 0.8245640286787163 and parameters: {'loss': 'coxph', 'learning_rate': 0.012434667499224044, 'n_estimators': 569, 'criterion': 'friedman_mse', 'min_samples_split': 2, 'min_samples_leaf': 4, 'min_weight_fraction_leaf': 0.08908194739786161, 'min_impurity_decrease': 0.47946329004703003, 'max_features': 0.5109002239618126, 'subsample': 0.37048801828193934, 'dropout_rate': 0.9371528480286849, 'ccp_alpha': 0.09996064241392935}. Best is trial 486 with value: 0.8320137528916117.[0m
/media/san2_ssd/data/Workdir/survival/venv/lib/python3.8/site-packages/sksurv/ensemble/boosting.py:955: RuntimeWarning: divide by zero encountered in log
  time = numpy.log(time)
/media/san2_ssd/data/Workdir/survival/venv/lib/python3.8/site-packages/sksurv/ensemble/boosting.py:955: RuntimeWarning: divide by zero encountered in log
  time = numpy.log(time)
/media/san2_ssd/data/Workdir/survival/venv/lib/python3.8/site-packages/sksurv/ensemble/boosting.py:955: RuntimeWarning: divide by zero encountered in log
  time = numpy.log(time)
/media/san2_ssd/data/Workdir/survival/venv/lib/python3.8/site-packages/sksurv/ensemble/boosting.py:955: RuntimeWarning: divide by zero encountered in log
  time = numpy.log(time)
[32m[I 2022-04-21 16:02:25,530][0m Trial 552 finished with value: -0.46689032464432706 and parameters: {'loss': 'squared', 'learning_rate': 0.01018796071152133, 'n_estimators': 466, 'criterion': 'friedman_mse', 'min_samples_split': 2, 'min_samples_leaf': 4, 'min_weight_fraction_leaf': 0.051755348806519455, 'min_impurity_decrease': 0.8379282511061721, 'max_features': 0.6071366244700198, 'subsample': 0.3977018955581653, 'dropout_rate': 0.974780742754129, 'ccp_alpha': 0.08648497115126866}. Best is trial 486 with value: 0.8320137528916117.[0m
[32m[I 2022-04-21 16:02:52,484][0m Trial 553 finished with value: 0.3815030876467311 and parameters: {'loss': 'coxph', 'learning_rate': 0.008285837322917955, 'n_estimators': 605, 'criterion': 'friedman_mse', 'min_samples_split': 2, 'min_samples_leaf': 4, 'min_weight_fraction_leaf': 0.022917329741774094, 'min_impurity_decrease': 0.4646842008656505, 'max_features': 0.4737952566955007, 'subsample': 0.42376660206251465, 'dropout_rate': 0.9561079128282739, 'ccp_alpha': 0.18209444279199066}. Best is trial 486 with value: 0.8320137528916117.[0m
