[32m[I 2022-04-21 14:44:56,164][0m Trial 332 finished with value: 0.25 and parameters: {'loss': 'coxph', 'learning_rate': 0.004260407708713247, 'n_estimators': 116, 'criterion': 'friedman_mse', 'min_samples_split': 3, 'min_samples_leaf': 3, 'min_weight_fraction_leaf': 0.08756976519077862, 'min_impurity_decrease': 0.39503648229185423, 'max_features': 0.5735449751096481, 'subsample': 0.3000777417903489, 'dropout_rate': 0.8684874553132886, 'ccp_alpha': 2.5269099499677754}. Best is trial 290 with value: 0.8297644701144975.[0m
/media/san2_ssd/data/Workdir/survival/venv/lib/python3.8/site-packages/sksurv/ensemble/boosting.py:955: RuntimeWarning: divide by zero encountered in log
  time = numpy.log(time)
/media/san2_ssd/data/Workdir/survival/venv/lib/python3.8/site-packages/sksurv/ensemble/boosting.py:955: RuntimeWarning: divide by zero encountered in log
  time = numpy.log(time)
/media/san2_ssd/data/Workdir/survival/venv/lib/python3.8/site-packages/sksurv/ensemble/boosting.py:955: RuntimeWarning: divide by zero encountered in log
  time = numpy.log(time)
/media/san2_ssd/data/Workdir/survival/venv/lib/python3.8/site-packages/sksurv/ensemble/boosting.py:955: RuntimeWarning: divide by zero encountered in log
  time = numpy.log(time)
[32m[I 2022-04-21 14:44:56,438][0m Trial 333 finished with value: -0.46553763684215677 and parameters: {'loss': 'squared', 'learning_rate': 0.006002859259532916, 'n_estimators': 107, 'criterion': 'friedman_mse', 'min_samples_split': 3, 'min_samples_leaf': 2, 'min_weight_fraction_leaf': 0.0520862686397436, 'min_impurity_decrease': 0.4687827371191097, 'max_features': 0.6131068502856645, 'subsample': 0.3200261873558489, 'dropout_rate': 0.8499958757641684, 'ccp_alpha': 0.1663747185151318}. Best is trial 290 with value: 0.8297644701144975.[0m
[32m[I 2022-04-21 14:44:59,020][0m Trial 334 finished with value: 0.8272222399586825 and parameters: {'loss': 'coxph', 'learning_rate': 0.0033329473077787237, 'n_estimators': 133, 'criterion': 'friedman_mse', 'min_samples_split': 3, 'min_samples_leaf': 2, 'min_weight_fraction_leaf': 0.09817250301535305, 'min_impurity_decrease': 0.3813296629815739, 'max_features': 0.6671560964607741, 'subsample': 0.35091007892108417, 'dropout_rate': 0.9090211155559482, 'ccp_alpha': 0.007440544344320772}. Best is trial 290 with value: 0.8297644701144975.[0m
[32m[I 2022-04-21 14:45:02,307][0m Trial 335 finished with value: 0.8262930247793415 and parameters: {'loss': 'coxph', 'learning_rate': 0.0035678033039740903, 'n_estimators': 144, 'criterion': 'friedman_mse', 'min_samples_split': 3, 'min_samples_leaf': 2, 'min_weight_fraction_leaf': 0.10323782564943697, 'min_impurity_decrease': 0.38155347165906384, 'max_features': 0.6450679681613493, 'subsample': 0.3481217656329431, 'dropout_rate': 0.9378966886801933, 'ccp_alpha': 0.0016411249179207627}. Best is trial 290 with value: 0.8297644701144975.[0m
[32m[I 2022-04-21 14:45:05,885][0m Trial 336 finished with value: 0.8194372281365698 and parameters: {'loss': 'coxph', 'learning_rate': 0.0048582544283627075, 'n_estimators': 132, 'criterion': 'friedman_mse', 'min_samples_split': 3, 'min_samples_leaf': 2, 'min_weight_fraction_leaf': 0.09902466126312603, 'min_impurity_decrease': 0.35748476737911405, 'max_features': 0.6616135810354097, 'subsample': 0.3366256154913826, 'dropout_rate': 0.965318278215177, 'ccp_alpha': 0.1101219036784795}. Best is trial 290 with value: 0.8297644701144975.[0m
[32m[I 2022-04-21 14:45:09,208][0m Trial 337 finished with value: 0.25662745571200507 and parameters: {'loss': 'coxph', 'learning_rate': 0.0014846062348109759, 'n_estimators': 137, 'criterion': 'friedman_mse', 'min_samples_split': 3, 'min_samples_leaf': 2, 'min_weight_fraction_leaf': 0.07410094728813937, 'min_impurity_decrease': 0.39651326477219145, 'max_features': 0.6370826331149569, 'subsample': 0.3854257612893294, 'dropout_rate': 0.9148902072077116, 'ccp_alpha': 0.22316148596178945}. Best is trial 290 with value: 0.8297644701144975.[0m
[32m[I 2022-04-21 14:45:11,841][0m Trial 338 finished with value: 0.8213138498422478 and parameters: {'loss': 'coxph', 'learning_rate': 0.0033094919654434547, 'n_estimators': 128, 'criterion': 'friedman_mse', 'min_samples_split': 3, 'min_samples_leaf': 2, 'min_weight_fraction_leaf': 0.09076108912529349, 'min_impurity_decrease': 0.37328694414274527, 'max_features': 0.5926775750137364, 'subsample': 0.3082746257043699, 'dropout_rate': 0.9294874066768843, 'ccp_alpha': 0.10985352143043023}. Best is trial 290 with value: 0.8297644701144975.[0m
[32m[I 2022-04-21 14:45:16,747][0m Trial 339 finished with value: 0.25 and parameters: {'loss': 'coxph', 'learning_rate': 0.007228789494828072, 'n_estimators': 132, 'criterion': 'absolute_error', 'min_samples_split': 3, 'min_samples_leaf': 2, 'min_weight_fraction_leaf': 0.07836936555708214, 'min_impurity_decrease': 0.39720548749590995, 'max_features': 0.6720176281740394, 'subsample': 0.291016834891398, 'dropout_rate': 0.9013734095534847, 'ccp_alpha': 0.3978805224914559}. Best is trial 290 with value: 0.8297644701144975.[0m
[32m[I 2022-04-21 14:45:18,801][0m Trial 340 finished with value: 0.8200905788331525 and parameters: {'loss': 'coxph', 'learning_rate': 0.0020249979650721296, 'n_estimators': 122, 'criterion': 'friedman_mse', 'min_samples_split': 3, 'min_samples_leaf': 2, 'min_weight_fraction_leaf': 0.10049277863101645, 'min_impurity_decrease': 0.41740887944680516, 'max_features': 0.6253689903055337, 'subsample': 0.3525650354597828, 'dropout_rate': 0.9039531206966238, 'ccp_alpha': 0.10896037683797319}. Best is trial 290 with value: 0.8297644701144975.[0m
[32m[I 2022-04-21 14:45:22,068][0m Trial 341 finished with value: 0.3634112364095756 and parameters: {'loss': 'coxph', 'learning_rate': 0.005843872798125259, 'n_estimators': 126, 'criterion': 'friedman_mse', 'min_samples_split': 3, 'min_samples_leaf': 3, 'min_weight_fraction_leaf': 0.08754370123951452, 'min_impurity_decrease': 0.44869730840779304, 'max_features': 0.6910482489080227, 'subsample': 0.24050345362517797, 'dropout_rate': 0.8754705995160394, 'ccp_alpha': 0.3097763704636223}. Best is trial 290 with value: 0.8297644701144975.[0m
[32m[I 2022-04-21 14:45:24,137][0m Trial 342 finished with value: 0.3840718932482675 and parameters: {'loss': 'coxph', 'learning_rate': 0.0029616824433060466, 'n_estimators': 111, 'criterion': 'friedman_mse', 'min_samples_split': 3, 'min_samples_leaf': 2, 'min_weight_fraction_leaf': 0.07084630856739887, 'min_impurity_decrease': 0.4700918874675889, 'max_features': 0.6675359544344699, 'subsample': 0.3277183983102492, 'dropout_rate': 0.9428615624777135, 'ccp_alpha': 0.18893952678134776}. Best is trial 290 with value: 0.8297644701144975.[0m
[32m[I 2022-04-21 14:45:27,181][0m Trial 343 finished with value: 0.8233334271823379 and parameters: {'loss': 'coxph', 'learning_rate': 0.00455912639604564, 'n_estimators': 120, 'criterion': 'friedman_mse', 'min_samples_split': 5, 'min_samples_leaf': 2, 'min_weight_fraction_leaf': 0.07858400410650188, 'min_impurity_decrease': 0.4170250607503395, 'max_features': 0.6483158236084815, 'subsample': 0.3063957397986464, 'dropout_rate': 0.9145341965268324, 'ccp_alpha': 0.10657277307173758}. Best is trial 290 with value: 0.8297644701144975.[0m
[32m[I 2022-04-21 14:45:32,525][0m Trial 344 finished with value: 0.824974043736165 and parameters: {'loss': 'coxph', 'learning_rate': 0.00378296300932267, 'n_estimators': 142, 'criterion': 'friedman_mse', 'min_samples_split': 3, 'min_samples_leaf': 4, 'min_weight_fraction_leaf': 0.056752269646144556, 'min_impurity_decrease': 0.3844091605001291, 'max_features': 0.7238933899180526, 'subsample': 0.265481499381978, 'dropout_rate': 0.850297795838661, 'ccp_alpha': 0.09640995740554867}. Best is trial 290 with value: 0.8297644701144975.[0m
[32m[I 2022-04-21 14:45:37,245][0m Trial 345 finished with value: 0.25 and parameters: {'loss': 'coxph', 'learning_rate': 0.012006554633614195, 'n_estimators': 128, 'criterion': 'friedman_mse', 'min_samples_split': 3, 'min_samples_leaf': 2, 'min_weight_fraction_leaf': 0.094667836352686, 'min_impurity_decrease': 0.4343517638538692, 'max_features': 0.6087428341771665, 'subsample': 0.2904754891223136, 'dropout_rate': 0.8937471521526033, 'ccp_alpha': 1.0777296193441979}. Best is trial 290 with value: 0.8297644701144975.[0m
[32m[I 2022-04-21 14:45:41,144][0m Trial 346 finished with value: 0.8251681927806394 and parameters: {'loss': 'coxph', 'learning_rate': 0.001804135803474694, 'n_estimators': 114, 'criterion': 'friedman_mse', 'min_samples_split': 3, 'min_samples_leaf': 2, 'min_weight_fraction_leaf': 0.0019065805841745054, 'min_impurity_decrease': 0.3451162035525462, 'max_features': 0.7079022207658333, 'subsample': 0.2487616391686344, 'dropout_rate': 0.9795743346784488, 'ccp_alpha': 0.005737024336813373}. Best is trial 290 with value: 0.8297644701144975.[0m
[32m[I 2022-04-21 14:45:45,654][0m Trial 347 finished with value: 0.26552368530161896 and parameters: {'loss': 'coxph', 'learning_rate': 0.0024134284529111405, 'n_estimators': 134, 'criterion': 'friedman_mse', 'min_samples_split': 3, 'min_samples_leaf': 2, 'min_weight_fraction_leaf': 0.046589109545775796, 'min_impurity_decrease': 0.45014677344178367, 'max_features': 0.6843244668645938, 'subsample': 0.31224592901528536, 'dropout_rate': 0.8731548538188302, 'ccp_alpha': 0.21736916286732308}. Best is trial 290 with value: 0.8297644701144975.[0m
[32m[I 2022-04-21 14:45:47,504][0m Trial 348 finished with value: 0.25 and parameters: {'loss': 'coxph', 'learning_rate': 0.008721173914484822, 'n_estimators': 105, 'criterion': 'friedman_mse', 'min_samples_split': 3, 'min_samples_leaf': 2, 'min_weight_fraction_leaf': 0.10374959524090818, 'min_impurity_decrease': 0.4012107879729118, 'max_features': 0.650349402137874, 'subsample': 0.28291720643348284, 'dropout_rate': 0.923868902454323, 'ccp_alpha': 1.8317899211812056}. Best is trial 290 with value: 0.8297644701144975.[0m
[32m[I 2022-04-21 14:45:51,203][0m Trial 349 finished with value: 0.8253242428103983 and parameters: {'loss': 'coxph', 'learning_rate': 0.003196312552856709, 'n_estimators': 120, 'criterion': 'friedman_mse', 'min_samples_split': 3, 'min_samples_leaf': 2, 'min_weight_fraction_leaf': 0.08336806291091975, 'min_impurity_decrease': 0.4217505410678674, 'max_features': 0.5110166473492723, 'subsample': 0.3740746174218516, 'dropout_rate': 0.8879010416610235, 'ccp_alpha': 0.0040253617024482435}. Best is trial 290 with value: 0.8297644701144975.[0m
[32m[I 2022-04-21 14:45:58,490][0m Trial 350 finished with value: 0.8043850355453369 and parameters: {'loss': 'coxph', 'learning_rate': 0.005267730723224083, 'n_estimators': 227, 'criterion': 'friedman_mse', 'min_samples_split': 3, 'min_samples_leaf': 3, 'min_weight_fraction_leaf': 0.06740266696599698, 'min_impurity_decrease': 0.3795659548235517, 'max_features': 0.6254902211406986, 'subsample': 0.330603605736211, 'dropout_rate': 0.8654678560538236, 'ccp_alpha': 0.16115566031491368}. Best is trial 290 with value: 0.8297644701144975.[0m
[32m[I 2022-04-21 14:46:01,707][0m Trial 351 finished with value: 0.8253653626885074 and parameters: {'loss': 'coxph', 'learning_rate': 0.0013871542836467216, 'n_estimators': 111, 'criterion': 'friedman_mse', 'min_samples_split': 3, 'min_samples_leaf': 2, 'min_weight_fraction_leaf': 0.07012609049497548, 'min_impurity_decrease': 0.44828798692184035, 'max_features': 0.6657244386510797, 'subsample': 0.2590432977304588, 'dropout_rate': 0.8495063895726701, 'ccp_alpha': 0.0046079707576734815}. Best is trial 290 with value: 0.8297644701144975.[0m
/media/san2_ssd/data/Workdir/survival/venv/lib/python3.8/site-packages/sksurv/ensemble/boosting.py:955: RuntimeWarning: divide by zero encountered in log
  time = numpy.log(time)
/media/san2_ssd/data/Workdir/survival/venv/lib/python3.8/site-packages/sksurv/ensemble/boosting.py:955: RuntimeWarning: divide by zero encountered in log
  time = numpy.log(time)
/media/san2_ssd/data/Workdir/survival/venv/lib/python3.8/site-packages/sksurv/ensemble/boosting.py:955: RuntimeWarning: divide by zero encountered in log
  time = numpy.log(time)
/media/san2_ssd/data/Workdir/survival/venv/lib/python3.8/site-packages/sksurv/ensemble/boosting.py:955: RuntimeWarning: divide by zero encountered in log
  time = numpy.log(time)
[32m[I 2022-04-21 14:46:02,113][0m Trial 352 finished with value: -0.46665480987046665 and parameters: {'loss': 'squared', 'learning_rate': 0.004211534183974639, 'n_estimators': 125, 'criterion': 'friedman_mse', 'min_samples_split': 3, 'min_samples_leaf': 2, 'min_weight_fraction_leaf': 0.08418024763027686, 'min_impurity_decrease': 0.4047084610412266, 'max_features': 0.7008396918617057, 'subsample': 0.2946623689634347, 'dropout_rate': 0.9051146556894789, 'ccp_alpha': 0.2856699406819521}. Best is trial 290 with value: 0.8297644701144975.[0m
[32m[I 2022-04-21 14:46:07,753][0m Trial 353 finished with value: 0.8232694165192767 and parameters: {'loss': 'coxph', 'learning_rate': 0.001972902360530012, 'n_estimators': 197, 'criterion': 'friedman_mse', 'min_samples_split': 3, 'min_samples_leaf': 2, 'min_weight_fraction_leaf': 0.05976901109119304, 'min_impurity_decrease': 0.3708085841029598, 'max_features': 0.7259877206770118, 'subsample': 0.274708658259777, 'dropout_rate': 0.9497432555761309, 'ccp_alpha': 0.11210872397106136}. Best is trial 290 with value: 0.8297644701144975.[0m
[32m[I 2022-04-21 14:46:11,418][0m Trial 354 finished with value: 0.8250411129774781 and parameters: {'loss': 'coxph', 'learning_rate': 0.003065221643191527, 'n_estimators': 116, 'criterion': 'friedman_mse', 'min_samples_split': 3, 'min_samples_leaf': 2, 'min_weight_fraction_leaf': 0.09293174541714778, 'min_impurity_decrease': 0.4708276657654457, 'max_features': 0.7671300336009563, 'subsample': 0.23816574763179604, 'dropout_rate': 0.9247313188854979, 'ccp_alpha': 0.09927514053895987}. Best is trial 290 with value: 0.8297644701144975.[0m
[32m[I 2022-04-21 14:46:14,437][0m Trial 355 finished with value: 0.8226919480971093 and parameters: {'loss': 'coxph', 'learning_rate': 0.006577417729286673, 'n_estimators': 119, 'criterion': 'friedman_mse', 'min_samples_split': 3, 'min_samples_leaf': 3, 'min_weight_fraction_leaf': 0.0409344076710651, 'min_impurity_decrease': 0.4324778557893114, 'max_features': 0.6338382646479738, 'subsample': 0.3121937986599186, 'dropout_rate': 0.8840005817035841, 'ccp_alpha': 0.002602648914436981}. Best is trial 290 with value: 0.8297644701144975.[0m
[32m[I 2022-04-21 14:46:18,750][0m Trial 356 finished with value: 0.373244643892201 and parameters: {'loss': 'coxph', 'learning_rate': 0.002285461685755947, 'n_estimators': 105, 'criterion': 'friedman_mse', 'min_samples_split': 3, 'min_samples_leaf': 2, 'min_weight_fraction_leaf': 0.07741749759438256, 'min_impurity_decrease': 0.4161571257528377, 'max_features': 0.680499704002143, 'subsample': 0.346025673836545, 'dropout_rate': 0.8411095916014084, 'ccp_alpha': 0.19394829497395485}. Best is trial 290 with value: 0.8297644701144975.[0m
[32m[I 2022-04-21 14:46:46,932][0m Trial 357 finished with value: 0.25 and parameters: {'loss': 'coxph', 'learning_rate': 0.003861421825438822, 'n_estimators': 471, 'criterion': 'friedman_mse', 'min_samples_split': 3, 'min_samples_leaf': 2, 'min_weight_fraction_leaf': 0.10597918475667248, 'min_impurity_decrease': 0.47191349987765446, 'max_features': 0.6525107845571856, 'subsample': 0.26456799329613273, 'dropout_rate': 0.9009169745618334, 'ccp_alpha': 3.405886289632626}. Best is trial 290 with value: 0.8297644701144975.[0m
[32m[I 2022-04-21 14:46:50,832][0m Trial 358 finished with value: 0.25 and parameters: {'loss': 'coxph', 'learning_rate': 0.0028542262292383827, 'n_estimators': 133, 'criterion': 'friedman_mse', 'min_samples_split': 5, 'min_samples_leaf': 2, 'min_weight_fraction_leaf': 0.05396686364150005, 'min_impurity_decrease': 0.35253053746393814, 'max_features': 0.786625321762503, 'subsample': 0.290172025667654, 'dropout_rate': 0.8738294472287774, 'ccp_alpha': 0.3380051066409589}. Best is trial 290 with value: 0.8297644701144975.[0m
[32m[I 2022-04-21 14:46:55,045][0m Trial 359 finished with value: 0.8254423661065878 and parameters: {'loss': 'coxph', 'learning_rate': 0.00510053778973719, 'n_estimators': 126, 'criterion': 'friedman_mse', 'min_samples_split': 3, 'min_samples_leaf': 3, 'min_weight_fraction_leaf': 0.07247222850727265, 'min_impurity_decrease': 0.44766664499577197, 'max_features': 0.7487605671479356, 'subsample': 0.32172352669228665, 'dropout_rate': 0.9133971387534184, 'ccp_alpha': 0.0030879345549927467}. Best is trial 290 with value: 0.8297644701144975.[0m
[32m[I 2022-04-21 14:46:59,332][0m Trial 360 finished with value: 0.693737402012781 and parameters: {'loss': 'coxph', 'learning_rate': 0.0015321071945061393, 'n_estimators': 112, 'criterion': 'friedman_mse', 'min_samples_split': 3, 'min_samples_leaf': 2, 'min_weight_fraction_leaf': 0.09359571443269034, 'min_impurity_decrease': 0.3876208959092615, 'max_features': 0.6990965330072259, 'subsample': 0.24531104938495507, 'dropout_rate': 0.935601818332745, 'ccp_alpha': 0.195163137020012}. Best is trial 290 with value: 0.8297644701144975.[0m
[32m[I 2022-04-21 14:47:03,358][0m Trial 361 finished with value: 0.25 and parameters: {'loss': 'coxph', 'learning_rate': 0.003630737802869375, 'n_estimators': 121, 'criterion': 'absolute_error', 'min_samples_split': 3, 'min_samples_leaf': 2, 'min_weight_fraction_leaf': 0.06391762573674356, 'min_impurity_decrease': 0.42395505396097954, 'max_features': 0.6085445127836546, 'subsample': 0.2788740830683608, 'dropout_rate': 0.8614964502607487, 'ccp_alpha': 0.09835682995855813}. Best is trial 290 with value: 0.8297644701144975.[0m
[32m[I 2022-04-21 14:47:05,655][0m Trial 362 finished with value: 0.2503270102305002 and parameters: {'loss': 'coxph', 'learning_rate': 0.0074469687165689726, 'n_estimators': 108, 'criterion': 'friedman_mse', 'min_samples_split': 3, 'min_samples_leaf': 2, 'min_weight_fraction_leaf': 0.0843827798747712, 'min_impurity_decrease': 0.4048536839917872, 'max_features': 0.7361000858185791, 'subsample': 0.30286864325923074, 'dropout_rate': 0.8849816556754119, 'ccp_alpha': 0.25338403270683774}. Best is trial 290 with value: 0.8297644701144975.[0m
[32m[I 2022-04-21 14:47:11,128][0m Trial 363 finished with value: 0.823507006241662 and parameters: {'loss': 'coxph', 'learning_rate': 0.002395660597367493, 'n_estimators': 116, 'criterion': 'friedman_mse', 'min_samples_split': 3, 'min_samples_leaf': 2, 'min_weight_fraction_leaf': 0.07426361955652455, 'min_impurity_decrease': 0.4578900195707102, 'max_features': 0.657926208979703, 'subsample': 0.25683132236337824, 'dropout_rate': 0.8965940949292608, 'ccp_alpha': 0.09955791461673855}. Best is trial 290 with value: 0.8297644701144975.[0m
[32m[I 2022-04-21 14:47:13,737][0m Trial 364 finished with value: 0.8215033278502988 and parameters: {'loss': 'coxph', 'learning_rate': 0.004617165388054115, 'n_estimators': 140, 'criterion': 'friedman_mse', 'min_samples_split': 3, 'min_samples_leaf': 2, 'min_weight_fraction_leaf': 0.10264942611563864, 'min_impurity_decrease': 0.3706063294870059, 'max_features': 0.5871625982873008, 'subsample': 0.3331724775138176, 'dropout_rate': 0.965410137561975, 'ccp_alpha': 0.0938677567651777}. Best is trial 290 with value: 0.8297644701144975.[0m
[32m[I 2022-04-21 14:47:17,944][0m Trial 365 finished with value: 0.827535761775769 and parameters: {'loss': 'coxph', 'learning_rate': 0.0017634209458194136, 'n_estimators': 129, 'criterion': 'friedman_mse', 'min_samples_split': 3, 'min_samples_leaf': 3, 'min_weight_fraction_leaf': 0.052580814459851966, 'min_impurity_decrease': 0.4388237224325804, 'max_features': 0.6737102539101282, 'subsample': 0.28678347199352516, 'dropout_rate': 0.8492869481924368, 'ccp_alpha': 0.005449525510534835}. Best is trial 290 with value: 0.8297644701144975.[0m
[32m[I 2022-04-21 14:47:20,834][0m Trial 366 finished with value: 0.3779134588720262 and parameters: {'loss': 'coxph', 'learning_rate': 0.0017637117372806548, 'n_estimators': 132, 'criterion': 'friedman_mse', 'min_samples_split': 3, 'min_samples_leaf': 3, 'min_weight_fraction_leaf': 0.037204089803845715, 'min_impurity_decrease': 0.40032832319620004, 'max_features': 0.6746186999597769, 'subsample': 0.3093129022276136, 'dropout_rate': 0.8435312046250898, 'ccp_alpha': 0.18787382712892647}. Best is trial 290 with value: 0.8297644701144975.[0m
[32m[I 2022-04-21 14:47:25,298][0m Trial 367 finished with value: 0.25 and parameters: {'loss': 'coxph', 'learning_rate': 0.005715233292964821, 'n_estimators': 127, 'criterion': 'friedman_mse', 'min_samples_split': 3, 'min_samples_leaf': 4, 'min_weight_fraction_leaf': 0.04496354639299245, 'min_impurity_decrease': 0.47620555318387203, 'max_features': 0.691337763600417, 'subsample': 0.23552443416121005, 'dropout_rate': 0.8570992042506457, 'ccp_alpha': 0.4281270754840723}. Best is trial 290 with value: 0.8297644701144975.[0m
[32m[I 2022-04-21 14:47:31,289][0m Trial 368 finished with value: 0.2503270102305002 and parameters: {'loss': 'coxph', 'learning_rate': 0.0012832085589699186, 'n_estimators': 134, 'criterion': 'friedman_mse', 'min_samples_split': 3, 'min_samples_leaf': 3, 'min_weight_fraction_leaf': 0.05345976512441014, 'min_impurity_decrease': 0.43692825790580586, 'max_features': 0.4363191699907749, 'subsample': 0.3016469610190797, 'dropout_rate': 0.8369089084096447, 'ccp_alpha': 0.29568516368948244}. Best is trial 290 with value: 0.8297644701144975.[0m
