[32m[I 2022-04-23 04:28:26,838][0m Trial 848 finished with value: 0.6852747949035003 and parameters: {'n_hidden': 1024, 'mixture_components': 7, 'use_sparse_layer': True, 'use_sparse_loss': True, 'lmbd': 8.568874723815213e-05, 'use_batchnorm': False, 'use_dropout': False, 'mlp_size_1': 6, 'mlp_size_2': 0, 'mlp_size_3': 1, 'kernel': 'Logistic', 'loss_name': 'NLLLoss'}. Best is trial 761 with value: 0.7068620691332198.[0m
[32m[I 2022-04-23 04:29:28,464][0m Trial 849 finished with value: 0.6891918903948571 and parameters: {'n_hidden': 1024, 'mixture_components': 9, 'use_sparse_layer': False, 'use_batchnorm': False, 'use_dropout': False, 'mlp_size_1': 6, 'mlp_size_2': 0, 'mlp_size_3': 1, 'kernel': 'Logistic', 'loss_name': 'AlternativeNLLLoss'}. Best is trial 761 with value: 0.7068620691332198.[0m
[32m[I 2022-04-23 04:30:07,914][0m Trial 850 finished with value: 0.6730155229557159 and parameters: {'n_hidden': 1024, 'mixture_components': 1, 'use_sparse_layer': False, 'use_batchnorm': False, 'use_dropout': False, 'mlp_size_1': 6, 'mlp_size_2': 0, 'mlp_size_3': 1, 'kernel': 'Exponential', 'loss_name': 'NLLLoss'}. Best is trial 761 with value: 0.7068620691332198.[0m
[32m[I 2022-04-23 04:31:03,927][0m Trial 851 finished with value: 0.6834814911831648 and parameters: {'n_hidden': 1024, 'mixture_components': 8, 'use_sparse_layer': False, 'use_batchnorm': False, 'use_dropout': False, 'mlp_size_1': 6, 'mlp_size_2': 0, 'mlp_size_3': 1, 'kernel': 'Gumbel', 'loss_name': 'NLLLoss'}. Best is trial 761 with value: 0.7068620691332198.[0m
[32m[I 2022-04-23 04:31:53,456][0m Trial 852 finished with value: 0.6872837474880134 and parameters: {'n_hidden': 1024, 'mixture_components': 9, 'use_sparse_layer': False, 'use_batchnorm': False, 'use_dropout': False, 'mlp_size_1': 6, 'mlp_size_2': 0, 'mlp_size_3': 1, 'kernel': 'Logistic', 'loss_name': 'AlternativeNLLLoss'}. Best is trial 761 with value: 0.7068620691332198.[0m
[32m[I 2022-04-23 04:32:38,269][0m Trial 853 finished with value: 0.6813032332872059 and parameters: {'n_hidden': 1024, 'mixture_components': 8, 'use_sparse_layer': False, 'use_batchnorm': False, 'use_dropout': False, 'mlp_size_1': 6, 'mlp_size_2': 0, 'mlp_size_3': 1, 'kernel': 'Logistic', 'loss_name': 'NLLLoss'}. Best is trial 761 with value: 0.7068620691332198.[0m
[32m[I 2022-04-23 04:33:33,975][0m Trial 854 finished with value: 0.6807855910255001 and parameters: {'n_hidden': 1024, 'mixture_components': 8, 'use_sparse_layer': False, 'use_batchnorm': False, 'use_dropout': True, 'dropout': 0.7950318169543902, 'mlp_size_1': 7, 'mlp_size_2': 0, 'mlp_size_3': 0, 'kernel': 'Gumbel', 'loss_name': 'AlternativeNLLLoss'}. Best is trial 761 with value: 0.7068620691332198.[0m
[32m[I 2022-04-23 04:34:28,827][0m Trial 855 finished with value: 0.6903187032429472 and parameters: {'n_hidden': 1024, 'mixture_components': 8, 'use_sparse_layer': False, 'use_batchnorm': False, 'use_dropout': False, 'mlp_size_1': 6, 'mlp_size_2': 0, 'mlp_size_3': 1, 'kernel': 'Logistic', 'loss_name': 'CensoredNLLLoss'}. Best is trial 761 with value: 0.7068620691332198.[0m
[32m[I 2022-04-23 04:35:09,131][0m Trial 856 finished with value: 0.6674287123607426 and parameters: {'n_hidden': 512, 'mixture_components': 7, 'use_sparse_layer': False, 'use_batchnorm': False, 'use_dropout': False, 'mlp_size_1': 6, 'mlp_size_2': 0, 'mlp_size_3': 0, 'kernel': 'Logistic', 'loss_name': 'NLLLoss'}. Best is trial 761 with value: 0.7068620691332198.[0m
[32m[I 2022-04-23 04:36:22,324][0m Trial 857 finished with value: 0.6377060195199341 and parameters: {'n_hidden': 2048, 'mixture_components': 9, 'use_sparse_layer': False, 'use_batchnorm': False, 'use_dropout': False, 'mlp_size_1': 8, 'mlp_size_2': 0, 'mlp_size_3': 0, 'kernel': 'Logistic', 'loss_name': 'AlternativeNLLLoss'}. Best is trial 761 with value: 0.7068620691332198.[0m
[32m[I 2022-04-23 04:37:20,357][0m Trial 858 finished with value: 0.6413331700663083 and parameters: {'n_hidden': 1024, 'mixture_components': 8, 'use_sparse_layer': False, 'use_batchnorm': False, 'use_dropout': False, 'mlp_size_1': 6, 'mlp_size_2': 0, 'mlp_size_3': 1, 'kernel': 'LogLogistic', 'loss_name': 'NLLLoss'}. Best is trial 761 with value: 0.7068620691332198.[0m
[32m[I 2022-04-23 04:38:39,512][0m Trial 859 finished with value: 0.5350051283917725 and parameters: {'n_hidden': 1024, 'mixture_components': 8, 'use_sparse_layer': False, 'use_batchnorm': True, 'use_dropout': False, 'mlp_size_1': 6, 'mlp_size_2': 0, 'mlp_size_3': 1, 'kernel': 'Gumbel', 'loss_name': 'NLLLoss'}. Best is trial 761 with value: 0.7068620691332198.[0m
[32m[I 2022-04-23 04:39:41,808][0m Trial 860 finished with value: 0.6693394331297429 and parameters: {'n_hidden': 32, 'mixture_components': 8, 'use_sparse_layer': True, 'use_sparse_loss': True, 'lmbd': 4.677493752075599e-06, 'use_batchnorm': False, 'use_dropout': False, 'mlp_size_1': 2, 'mlp_size_2': 0, 'mlp_size_3': 0, 'kernel': 'Logistic', 'loss_name': 'AlternativeNLLLoss'}. Best is trial 761 with value: 0.7068620691332198.[0m
[32m[I 2022-04-23 04:40:19,062][0m Trial 861 finished with value: 0.6867935754678477 and parameters: {'n_hidden': 1024, 'mixture_components': 9, 'use_sparse_layer': False, 'use_batchnorm': False, 'use_dropout': False, 'mlp_size_1': 6, 'mlp_size_2': 0, 'mlp_size_3': 1, 'kernel': 'Logistic', 'loss_name': 'NLLLoss'}. Best is trial 761 with value: 0.7068620691332198.[0m
[32m[I 2022-04-23 04:41:18,507][0m Trial 862 finished with value: 0.6785964707530366 and parameters: {'n_hidden': 1024, 'mixture_components': 5, 'use_sparse_layer': False, 'use_batchnorm': False, 'use_dropout': False, 'mlp_size_1': 7, 'mlp_size_2': 0, 'mlp_size_3': 0, 'kernel': 'Gumbel', 'loss_name': 'CensoredNLLLoss'}. Best is trial 761 with value: 0.7068620691332198.[0m
[32m[I 2022-04-23 04:42:25,254][0m Trial 863 finished with value: 0.6775654312105086 and parameters: {'n_hidden': 1024, 'mixture_components': 7, 'use_sparse_layer': False, 'use_batchnorm': False, 'use_dropout': False, 'mlp_size_1': 6, 'mlp_size_2': 0, 'mlp_size_3': 1, 'kernel': 'Logistic', 'loss_name': 'AlternativeNLLLoss'}. Best is trial 761 with value: 0.7068620691332198.[0m
[32m[I 2022-04-23 04:43:05,190][0m Trial 864 finished with value: 0.689536098427204 and parameters: {'n_hidden': 1024, 'mixture_components': 1, 'use_sparse_layer': False, 'use_batchnorm': False, 'use_dropout': False, 'mlp_size_1': 6, 'mlp_size_2': 0, 'mlp_size_3': 1, 'kernel': 'Logistic', 'loss_name': 'NLLLoss'}. Best is trial 761 with value: 0.7068620691332198.[0m
[32m[I 2022-04-23 04:43:45,997][0m Trial 865 finished with value: 0.6919460019171251 and parameters: {'n_hidden': 1024, 'mixture_components': 8, 'use_sparse_layer': False, 'use_batchnorm': False, 'use_dropout': False, 'mlp_size_1': 6, 'mlp_size_2': 0, 'mlp_size_3': 1, 'kernel': 'LogLogistic', 'loss_name': 'NLLLoss'}. Best is trial 761 with value: 0.7068620691332198.[0m
[32m[I 2022-04-23 04:44:48,810][0m Trial 866 finished with value: 0.6121449238799335 and parameters: {'n_hidden': 2048, 'mixture_components': 8, 'use_sparse_layer': False, 'use_batchnorm': False, 'use_dropout': False, 'mlp_size_1': 8, 'mlp_size_2': 0, 'mlp_size_3': 0, 'kernel': 'Gumbel', 'loss_name': 'AlternativeNLLLoss'}. Best is trial 761 with value: 0.7068620691332198.[0m
[32m[I 2022-04-23 04:45:36,292][0m Trial 867 finished with value: 0.689698588087733 and parameters: {'n_hidden': 1024, 'mixture_components': 8, 'use_sparse_layer': False, 'use_batchnorm': False, 'use_dropout': False, 'mlp_size_1': 6, 'mlp_size_2': 0, 'mlp_size_3': 1, 'kernel': 'Logistic', 'loss_name': 'NLLLoss'}. Best is trial 761 with value: 0.7068620691332198.[0m
[32m[I 2022-04-23 04:46:33,454][0m Trial 868 finished with value: 0.6869871477004394 and parameters: {'n_hidden': 128, 'mixture_components': 9, 'use_sparse_layer': False, 'use_batchnorm': False, 'use_dropout': False, 'mlp_size_1': 4, 'mlp_size_2': 0, 'mlp_size_3': 0, 'kernel': 'Logistic', 'loss_name': 'AlternativeNLLLoss'}. Best is trial 761 with value: 0.7068620691332198.[0m
[32m[I 2022-04-23 04:47:05,486][0m Trial 869 finished with value: -0.6658089089644843 and parameters: {'n_hidden': 1024, 'mixture_components': 7, 'use_sparse_layer': False, 'use_batchnorm': False, 'use_dropout': False, 'mlp_size_1': 5, 'mlp_size_2': 1, 'mlp_size_3': 1, 'kernel': 'Exponential', 'loss_name': 'CensoredNLLLoss'}. Best is trial 761 with value: 0.7068620691332198.[0m
[32m[I 2022-04-23 04:47:55,061][0m Trial 870 finished with value: 0.6806242358649743 and parameters: {'n_hidden': 64, 'mixture_components': 8, 'use_sparse_layer': False, 'use_batchnorm': False, 'use_dropout': False, 'mlp_size_1': 3, 'mlp_size_2': 0, 'mlp_size_3': 0, 'kernel': 'Logistic', 'loss_name': 'NLLLoss'}. Best is trial 761 with value: 0.7068620691332198.[0m
[32m[I 2022-04-23 04:48:42,947][0m Trial 871 finished with value: 0.6848170042512648 and parameters: {'n_hidden': 1024, 'mixture_components': 8, 'use_sparse_layer': True, 'use_sparse_loss': False, 'use_batchnorm': False, 'use_dropout': False, 'mlp_size_1': 6, 'mlp_size_2': 0, 'mlp_size_3': 1, 'kernel': 'Gumbel', 'loss_name': 'AlternativeNLLLoss'}. Best is trial 761 with value: 0.7068620691332198.[0m
[32m[I 2022-04-23 04:49:35,353][0m Trial 872 finished with value: 0.6860136565594026 and parameters: {'n_hidden': 1024, 'mixture_components': 8, 'use_sparse_layer': False, 'use_batchnorm': False, 'use_dropout': True, 'dropout': 0.14077704917927047, 'mlp_size_1': 7, 'mlp_size_2': 0, 'mlp_size_3': 0, 'kernel': 'Logistic', 'loss_name': 'NLLLoss'}. Best is trial 761 with value: 0.7068620691332198.[0m
[32m[I 2022-04-23 04:50:18,245][0m Trial 873 finished with value: 0.7038172354086116 and parameters: {'n_hidden': 1024, 'mixture_components': 9, 'use_sparse_layer': False, 'use_batchnorm': False, 'use_dropout': False, 'mlp_size_1': 6, 'mlp_size_2': 0, 'mlp_size_3': 1, 'kernel': 'Logistic', 'loss_name': 'NLLLoss'}. Best is trial 761 with value: 0.7068620691332198.[0m
[32m[I 2022-04-23 04:50:53,054][0m Trial 874 finished with value: 0.6849610372979921 and parameters: {'n_hidden': 512, 'mixture_components': 9, 'use_sparse_layer': False, 'use_batchnorm': False, 'use_dropout': False, 'mlp_size_1': 6, 'mlp_size_2': 0, 'mlp_size_3': 0, 'kernel': 'Gumbel', 'loss_name': 'NLLLoss'}. Best is trial 761 with value: 0.7068620691332198.[0m
[32m[I 2022-04-23 04:51:48,818][0m Trial 875 finished with value: 0.6910036231965138 and parameters: {'n_hidden': 1024, 'mixture_components': 9, 'use_sparse_layer': False, 'use_batchnorm': False, 'use_dropout': False, 'mlp_size_1': 6, 'mlp_size_2': 0, 'mlp_size_3': 1, 'kernel': 'Logistic', 'loss_name': 'NLLLoss'}. Best is trial 761 with value: 0.7068620691332198.[0m
[32m[I 2022-04-23 04:53:18,601][0m Trial 876 finished with value: 0.6463733131634866 and parameters: {'n_hidden': 256, 'mixture_components': 9, 'use_sparse_layer': False, 'use_batchnorm': True, 'use_dropout': False, 'mlp_size_1': 5, 'mlp_size_2': 0, 'mlp_size_3': 0, 'kernel': 'Logistic', 'loss_name': 'NLLLoss'}. Best is trial 761 with value: 0.7068620691332198.[0m
[32m[I 2022-04-23 04:54:09,944][0m Trial 877 finished with value: 0.688551988338401 and parameters: {'n_hidden': 1024, 'mixture_components': 9, 'use_sparse_layer': False, 'use_batchnorm': False, 'use_dropout': False, 'mlp_size_1': 6, 'mlp_size_2': 0, 'mlp_size_3': 1, 'kernel': 'LogLogistic', 'loss_name': 'NLLLoss'}. Best is trial 761 with value: 0.7068620691332198.[0m
[32m[I 2022-04-23 04:55:13,845][0m Trial 878 finished with value: 0.6867297162510206 and parameters: {'n_hidden': 2048, 'mixture_components': 9, 'use_sparse_layer': False, 'use_batchnorm': False, 'use_dropout': False, 'mlp_size_1': 8, 'mlp_size_2': 0, 'mlp_size_3': 0, 'kernel': 'Gumbel', 'loss_name': 'NLLLoss'}. Best is trial 761 with value: 0.7068620691332198.[0m
[32m[I 2022-04-23 04:55:54,861][0m Trial 879 finished with value: 0.6708840040494698 and parameters: {'n_hidden': 1024, 'mixture_components': 9, 'use_sparse_layer': False, 'use_batchnorm': False, 'use_dropout': False, 'mlp_size_1': 6, 'mlp_size_2': 0, 'mlp_size_3': 1, 'kernel': 'Logistic', 'loss_name': 'NLLLoss'}. Best is trial 761 with value: 0.7068620691332198.[0m
[32m[I 2022-04-23 04:56:50,850][0m Trial 880 finished with value: 0.696794562693745 and parameters: {'n_hidden': 1024, 'mixture_components': 9, 'use_sparse_layer': False, 'use_batchnorm': False, 'use_dropout': False, 'mlp_size_1': 6, 'mlp_size_2': 0, 'mlp_size_3': 1, 'kernel': 'Logistic', 'loss_name': 'NLLLoss'}. Best is trial 761 with value: 0.7068620691332198.[0m
[32m[I 2022-04-23 04:57:40,274][0m Trial 881 finished with value: 0.6876878473520427 and parameters: {'n_hidden': 1024, 'mixture_components': 9, 'use_sparse_layer': False, 'use_batchnorm': False, 'use_dropout': False, 'mlp_size_1': 6, 'mlp_size_2': 0, 'mlp_size_3': 1, 'kernel': 'Logistic', 'loss_name': 'NLLLoss'}. Best is trial 761 with value: 0.7068620691332198.[0m
[32m[I 2022-04-23 04:58:32,033][0m Trial 882 finished with value: 0.6782681180384588 and parameters: {'n_hidden': 1024, 'mixture_components': 9, 'use_sparse_layer': False, 'use_batchnorm': False, 'use_dropout': False, 'mlp_size_1': 6, 'mlp_size_2': 0, 'mlp_size_3': 1, 'kernel': 'Logistic', 'loss_name': 'NLLLoss'}. Best is trial 761 with value: 0.7068620691332198.[0m
[32m[I 2022-04-23 04:59:17,388][0m Trial 883 finished with value: 0.6797752795383335 and parameters: {'n_hidden': 1024, 'mixture_components': 9, 'use_sparse_layer': False, 'use_batchnorm': False, 'use_dropout': False, 'mlp_size_1': 6, 'mlp_size_2': 0, 'mlp_size_3': 1, 'kernel': 'Gumbel', 'loss_name': 'NLLLoss'}. Best is trial 761 with value: 0.7068620691332198.[0m
[32m[I 2022-04-23 05:00:06,301][0m Trial 884 finished with value: 0.6606835735025479 and parameters: {'n_hidden': 1024, 'mixture_components': 9, 'use_sparse_layer': False, 'use_batchnorm': False, 'use_dropout': False, 'mlp_size_1': 7, 'mlp_size_2': 0, 'mlp_size_3': 0, 'kernel': 'Logistic', 'loss_name': 'NLLLoss'}. Best is trial 761 with value: 0.7068620691332198.[0m
[32m[I 2022-04-23 05:00:43,532][0m Trial 885 finished with value: 0.6858128067500208 and parameters: {'n_hidden': 1024, 'mixture_components': 9, 'use_sparse_layer': False, 'use_batchnorm': False, 'use_dropout': False, 'mlp_size_1': 6, 'mlp_size_2': 0, 'mlp_size_3': 1, 'kernel': 'Logistic', 'loss_name': 'NLLLoss'}. Best is trial 761 with value: 0.7068620691332198.[0m
[32m[I 2022-04-23 05:01:31,776][0m Trial 886 finished with value: 0.684457510674862 and parameters: {'n_hidden': 1024, 'mixture_components': 1, 'use_sparse_layer': False, 'use_batchnorm': False, 'use_dropout': False, 'mlp_size_1': 6, 'mlp_size_2': 0, 'mlp_size_3': 1, 'kernel': 'Gumbel', 'loss_name': 'NLLLoss'}. Best is trial 761 with value: 0.7068620691332198.[0m
[32m[I 2022-04-23 05:02:20,275][0m Trial 887 finished with value: 0.686856126455597 and parameters: {'n_hidden': 1024, 'mixture_components': 9, 'use_sparse_layer': False, 'use_batchnorm': False, 'use_dropout': False, 'mlp_size_1': 6, 'mlp_size_2': 0, 'mlp_size_3': 1, 'kernel': 'Logistic', 'loss_name': 'NLLLoss'}. Best is trial 761 with value: 0.7068620691332198.[0m
[32m[I 2022-04-23 05:03:07,370][0m Trial 888 finished with value: 0.6945835315500618 and parameters: {'n_hidden': 1024, 'mixture_components': 9, 'use_sparse_layer': False, 'use_batchnorm': False, 'use_dropout': False, 'mlp_size_1': 7, 'mlp_size_2': 0, 'mlp_size_3': 0, 'kernel': 'LogLogistic', 'loss_name': 'NLLLoss'}. Best is trial 761 with value: 0.7068620691332198.[0m
[32m[I 2022-04-23 05:03:46,987][0m Trial 889 finished with value: 0.6929344703349555 and parameters: {'n_hidden': 1024, 'mixture_components': 9, 'use_sparse_layer': False, 'use_batchnorm': False, 'use_dropout': False, 'mlp_size_1': 1, 'mlp_size_2': 4, 'mlp_size_3': 1, 'kernel': 'Logistic', 'loss_name': 'NLLLoss'}. Best is trial 761 with value: 0.7068620691332198.[0m
[32m[I 2022-04-23 05:04:23,055][0m Trial 890 finished with value: 0.6790629707733375 and parameters: {'n_hidden': 1024, 'mixture_components': 9, 'use_sparse_layer': False, 'use_batchnorm': False, 'use_dropout': False, 'mlp_size_1': 6, 'mlp_size_2': 0, 'mlp_size_3': 1, 'kernel': 'Exponential', 'loss_name': 'NLLLoss'}. Best is trial 761 with value: 0.7068620691332198.[0m
[32m[I 2022-04-23 05:05:08,229][0m Trial 891 finished with value: 0.6792357926545781 and parameters: {'n_hidden': 1024, 'mixture_components': 7, 'use_sparse_layer': False, 'use_batchnorm': False, 'use_dropout': True, 'dropout': 0.04592606578937558, 'mlp_size_1': 6, 'mlp_size_2': 0, 'mlp_size_3': 1, 'kernel': 'Gumbel', 'loss_name': 'CensoredNLLLoss'}. Best is trial 761 with value: 0.7068620691332198.[0m
[32m[I 2022-04-23 05:06:04,418][0m Trial 892 finished with value: 0.6693220702307213 and parameters: {'n_hidden': 1024, 'mixture_components': 9, 'use_sparse_layer': False, 'use_batchnorm': False, 'use_dropout': False, 'mlp_size_1': 7, 'mlp_size_2': 0, 'mlp_size_3': 0, 'kernel': 'Logistic', 'loss_name': 'NLLLoss'}. Best is trial 761 with value: 0.7068620691332198.[0m
[32m[I 2022-04-23 05:06:46,449][0m Trial 893 finished with value: 0.682264383711183 and parameters: {'n_hidden': 1024, 'mixture_components': 1, 'use_sparse_layer': False, 'use_batchnorm': False, 'use_dropout': False, 'mlp_size_1': 6, 'mlp_size_2': 0, 'mlp_size_3': 1, 'kernel': 'Logistic', 'loss_name': 'NLLLoss'}. Best is trial 761 with value: 0.7068620691332198.[0m
[32m[I 2022-04-23 05:07:26,319][0m Trial 894 finished with value: 0.607212136498004 and parameters: {'n_hidden': 1024, 'mixture_components': 5, 'use_sparse_layer': False, 'use_batchnorm': False, 'use_dropout': False, 'mlp_size_1': 7, 'mlp_size_2': 0, 'mlp_size_3': 0, 'kernel': 'Gumbel', 'loss_name': 'NLLLoss'}. Best is trial 761 with value: 0.7068620691332198.[0m
[32m[I 2022-04-23 05:09:25,062][0m Trial 895 finished with value: 0.6139591220946243 and parameters: {'n_hidden': 1024, 'mixture_components': 7, 'use_sparse_layer': False, 'use_batchnorm': True, 'use_dropout': False, 'mlp_size_1': 6, 'mlp_size_2': 0, 'mlp_size_3': 1, 'kernel': 'Logistic', 'loss_name': 'NLLLoss'}. Best is trial 761 with value: 0.7068620691332198.[0m
[32m[I 2022-04-23 05:10:19,768][0m Trial 896 finished with value: 0.6776267960849414 and parameters: {'n_hidden': 1024, 'mixture_components': 9, 'use_sparse_layer': False, 'use_batchnorm': False, 'use_dropout': False, 'mlp_size_1': 6, 'mlp_size_2': 0, 'mlp_size_3': 1, 'kernel': 'Logistic', 'loss_name': 'CensoredNLLLoss'}. Best is trial 761 with value: 0.7068620691332198.[0m
[32m[I 2022-04-23 05:11:14,449][0m Trial 897 finished with value: 0.6529140082364975 and parameters: {'n_hidden': 1024, 'mixture_components': 1, 'use_sparse_layer': False, 'use_batchnorm': False, 'use_dropout': False, 'mlp_size_1': 6, 'mlp_size_2': 0, 'mlp_size_3': 1, 'kernel': 'Logistic', 'loss_name': 'NLLLoss'}. Best is trial 761 with value: 0.7068620691332198.[0m
[32m[I 2022-04-23 05:11:56,878][0m Trial 898 finished with value: 0.6816970866322467 and parameters: {'n_hidden': 1024, 'mixture_components': 5, 'use_sparse_layer': False, 'use_batchnorm': False, 'use_dropout': False, 'mlp_size_1': 5, 'mlp_size_2': 2, 'mlp_size_3': 0, 'kernel': 'Gumbel', 'loss_name': 'NLLLoss'}. Best is trial 761 with value: 0.7068620691332198.[0m
[32m[I 2022-04-23 05:12:49,972][0m Trial 899 finished with value: 0.6811133914308124 and parameters: {'n_hidden': 1024, 'mixture_components': 9, 'use_sparse_layer': False, 'use_batchnorm': False, 'use_dropout': False, 'mlp_size_1': 7, 'mlp_size_2': 0, 'mlp_size_3': 0, 'kernel': 'Logistic', 'loss_name': 'NLLLoss'}. Best is trial 761 with value: 0.7068620691332198.[0m
[32m[I 2022-04-23 05:13:44,656][0m Trial 900 finished with value: 0.6808465186978467 and parameters: {'n_hidden': 32, 'mixture_components': 7, 'use_sparse_layer': False, 'use_batchnorm': False, 'use_dropout': False, 'mlp_size_1': 2, 'mlp_size_2': 0, 'mlp_size_3': 0, 'kernel': 'LogLogistic', 'loss_name': 'CensoredNLLLoss'}. Best is trial 761 with value: 0.7068620691332198.[0m
[32m[I 2022-04-23 05:14:42,526][0m Trial 901 finished with value: 0.6873071517738267 and parameters: {'n_hidden': 1024, 'mixture_components': 8, 'use_sparse_layer': False, 'use_batchnorm': False, 'use_dropout': False, 'mlp_size_1': 6, 'mlp_size_2': 0, 'mlp_size_3': 1, 'kernel': 'Logistic', 'loss_name': 'NLLLoss'}. Best is trial 761 with value: 0.7068620691332198.[0m
[32m[I 2022-04-23 05:15:30,465][0m Trial 902 finished with value: 0.685721852822186 and parameters: {'n_hidden': 2048, 'mixture_components': 8, 'use_sparse_layer': False, 'use_batchnorm': False, 'use_dropout': False, 'mlp_size_1': 8, 'mlp_size_2': 0, 'mlp_size_3': 0, 'kernel': 'Gumbel', 'loss_name': 'NLLLoss'}. Best is trial 761 with value: 0.7068620691332198.[0m
[32m[I 2022-04-23 05:16:13,526][0m Trial 903 finished with value: 0.6753742667973193 and parameters: {'n_hidden': 1024, 'mixture_components': 9, 'use_sparse_layer': False, 'use_batchnorm': False, 'use_dropout': False, 'mlp_size_1': 6, 'mlp_size_2': 0, 'mlp_size_3': 1, 'kernel': 'Logistic', 'loss_name': 'NLLLoss'}. Best is trial 761 with value: 0.7068620691332198.[0m
[32m[I 2022-04-23 05:17:09,625][0m Trial 904 finished with value: 0.6616951829201361 and parameters: {'n_hidden': 1024, 'mixture_components': 8, 'use_sparse_layer': False, 'use_batchnorm': False, 'use_dropout': False, 'mlp_size_1': 6, 'mlp_size_2': 0, 'mlp_size_3': 1, 'kernel': 'Logistic', 'loss_name': 'NLLLoss'}. Best is trial 761 with value: 0.7068620691332198.[0m
[32m[I 2022-04-23 05:18:24,503][0m Trial 905 finished with value: 0.6814823109259668 and parameters: {'n_hidden': 1024, 'mixture_components': 7, 'use_sparse_layer': False, 'use_batchnorm': False, 'use_dropout': False, 'mlp_size_1': 6, 'mlp_size_2': 0, 'mlp_size_3': 1, 'kernel': 'Normal', 'loss_name': 'CensoredNLLLoss'}. Best is trial 761 with value: 0.7068620691332198.[0m
