[32m[I 2022-04-21 23:49:46,061][0m Trial 509 finished with value: 0.6835457305093608 and parameters: {'loss': 'coxph', 'learning_rate': 0.0006518537398133026, 'n_estimators': 329, 'criterion': 'squared_error', 'min_samples_split': 7, 'min_samples_leaf': 9, 'min_weight_fraction_leaf': 0.21420349047463016, 'min_impurity_decrease': 0.016303815929592694, 'max_features': 0.9562333763348374, 'subsample': 0.178949322330574, 'dropout_rate': 0.04674652279700392, 'ccp_alpha': 0.2020857707458864}. Best is trial 187 with value: 0.6933481836305168.[0m
[32m[I 2022-04-21 23:50:05,042][0m Trial 510 finished with value: 0.672171430720546 and parameters: {'loss': 'coxph', 'learning_rate': 0.0003215131503277281, 'n_estimators': 280, 'criterion': 'squared_error', 'min_samples_split': 6, 'min_samples_leaf': 10, 'min_weight_fraction_leaf': 0.19757209262450853, 'min_impurity_decrease': 0.15642860258582797, 'max_features': 0.9120038445565453, 'subsample': 0.2327746188140551, 'dropout_rate': 0.014711674261933594, 'ccp_alpha': 0.07726190453625578}. Best is trial 187 with value: 0.6933481836305168.[0m
[32m[I 2022-04-21 23:50:28,553][0m Trial 511 finished with value: 0.6636900948801576 and parameters: {'loss': 'coxph', 'learning_rate': 0.00019806835563548734, 'n_estimators': 310, 'criterion': 'squared_error', 'min_samples_split': 7, 'min_samples_leaf': 10, 'min_weight_fraction_leaf': 0.24012557339035503, 'min_impurity_decrease': 0.05433339909783965, 'max_features': 0.8626064171668806, 'subsample': 0.3908396270217548, 'dropout_rate': 0.07876133161554685, 'ccp_alpha': 0.2906279851906749}. Best is trial 187 with value: 0.6933481836305168.[0m
[32m[I 2022-04-21 23:50:53,795][0m Trial 512 finished with value: 0.6884054554564354 and parameters: {'loss': 'coxph', 'learning_rate': 9.611682199040192e-05, 'n_estimators': 375, 'criterion': 'squared_error', 'min_samples_split': 7, 'min_samples_leaf': 10, 'min_weight_fraction_leaf': 0.22509666516289584, 'min_impurity_decrease': 0.07889284765201461, 'max_features': 0.8937854331761966, 'subsample': 0.279749909387134, 'dropout_rate': 0.244679416119937, 'ccp_alpha': 0.15743318430956593}. Best is trial 187 with value: 0.6933481836305168.[0m
[32m[I 2022-04-21 23:51:16,905][0m Trial 513 finished with value: 0.6858794643362676 and parameters: {'loss': 'coxph', 'learning_rate': 0.00014270802160821429, 'n_estimators': 411, 'criterion': 'squared_error', 'min_samples_split': 7, 'min_samples_leaf': 9, 'min_weight_fraction_leaf': 0.1897490472676014, 'min_impurity_decrease': 0.09870397699120594, 'max_features': 0.9482223175462183, 'subsample': 0.2639370082754792, 'dropout_rate': 0.5810475572312196, 'ccp_alpha': 0.07476971165890958}. Best is trial 187 with value: 0.6933481836305168.[0m
[32m[I 2022-04-21 23:51:41,625][0m Trial 514 finished with value: 0.59146376742689 and parameters: {'loss': 'coxph', 'learning_rate': 0.005400307612895923, 'n_estimators': 337, 'criterion': 'absolute_error', 'min_samples_split': 8, 'min_samples_leaf': 10, 'min_weight_fraction_leaf': 0.16967402644437343, 'min_impurity_decrease': 0.038188633342235836, 'max_features': 0.7968499431008194, 'subsample': 0.35363689145622956, 'dropout_rate': 0.34883692926160204, 'ccp_alpha': 0.23614776980682653}. Best is trial 187 with value: 0.6933481836305168.[0m
[32m[I 2022-04-21 23:51:57,509][0m Trial 515 finished with value: 0.687456122827585 and parameters: {'loss': 'coxph', 'learning_rate': 2.062250326872389e-05, 'n_estimators': 294, 'criterion': 'squared_error', 'min_samples_split': 7, 'min_samples_leaf': 9, 'min_weight_fraction_leaf': 0.1820491451266955, 'min_impurity_decrease': 0.06823588420513751, 'max_features': 0.9989620227176333, 'subsample': 0.29509844178324446, 'dropout_rate': 0.2843717594405909, 'ccp_alpha': 0.15283328480982755}. Best is trial 187 with value: 0.6933481836305168.[0m
[32m[I 2022-04-21 23:52:17,882][0m Trial 516 finished with value: 0.6873275198389213 and parameters: {'loss': 'coxph', 'learning_rate': 7.476621568118314e-05, 'n_estimators': 236, 'criterion': 'friedman_mse', 'min_samples_split': 7, 'min_samples_leaf': 10, 'min_weight_fraction_leaf': 0.15358516749064047, 'min_impurity_decrease': 0.0018438398186313553, 'max_features': 0.9327982159844185, 'subsample': 0.3074564820248733, 'dropout_rate': 0.09550727566476427, 'ccp_alpha': 0.08634769860929034}. Best is trial 187 with value: 0.6933481836305168.[0m
[32m[I 2022-04-21 23:52:44,122][0m Trial 517 finished with value: 0.545882285039153 and parameters: {'loss': 'coxph', 'learning_rate': 0.00025823557844588206, 'n_estimators': 313, 'criterion': 'squared_error', 'min_samples_split': 6, 'min_samples_leaf': 10, 'min_weight_fraction_leaf': 0.20162267515295965, 'min_impurity_decrease': 0.6047313431743082, 'max_features': 0.8798232615600852, 'subsample': 0.2448846296403237, 'dropout_rate': 0.16843387015028752, 'ccp_alpha': 0.009625056887011246}. Best is trial 187 with value: 0.6933481836305168.[0m
[32m[I 2022-04-21 23:53:21,723][0m Trial 518 finished with value: 0.6262675259249353 and parameters: {'loss': 'coxph', 'learning_rate': 4.349375359287853e-05, 'n_estimators': 352, 'criterion': 'squared_error', 'min_samples_split': 7, 'min_samples_leaf': 10, 'min_weight_fraction_leaf': 0.21163627158099868, 'min_impurity_decrease': 0.11633577176705931, 'max_features': 0.9700282972650125, 'subsample': 0.33583775919054176, 'dropout_rate': 0.06352249821405084, 'ccp_alpha': 0.35777891940094186}. Best is trial 187 with value: 0.6933481836305168.[0m
[32m[I 2022-04-21 23:53:49,014][0m Trial 519 finished with value: 0.678828170161717 and parameters: {'loss': 'coxph', 'learning_rate': 5.9605375614833226e-05, 'n_estimators': 326, 'criterion': 'squared_error', 'min_samples_split': 7, 'min_samples_leaf': 10, 'min_weight_fraction_leaf': 0.23054894850942123, 'min_impurity_decrease': 0.052044580206809445, 'max_features': 0.82585516729127, 'subsample': 0.21900082741419596, 'dropout_rate': 0.2088121140368483, 'ccp_alpha': 0.218060649277592}. Best is trial 187 with value: 0.6933481836305168.[0m
[32m[I 2022-04-21 23:54:10,742][0m Trial 520 finished with value: 0.5 and parameters: {'loss': 'coxph', 'learning_rate': 0.0004755671468224432, 'n_estimators': 258, 'criterion': 'squared_error', 'min_samples_split': 7, 'min_samples_leaf': 9, 'min_weight_fraction_leaf': 0.19144845906357946, 'min_impurity_decrease': 0.020431670156436824, 'max_features': 0.9010917541936029, 'subsample': 0.8288222654576497, 'dropout_rate': 0.11407919496927249, 'ccp_alpha': 3.697645910259613}. Best is trial 187 with value: 0.6933481836305168.[0m
[32m[I 2022-04-21 23:54:29,341][0m Trial 521 finished with value: 0.6847769730986524 and parameters: {'loss': 'coxph', 'learning_rate': 0.00016129408876391227, 'n_estimators': 282, 'criterion': 'squared_error', 'min_samples_split': 7, 'min_samples_leaf': 10, 'min_weight_fraction_leaf': 0.17731658834800432, 'min_impurity_decrease': 0.09545611430878742, 'max_features': 0.08903607758479765, 'subsample': 0.27937770213090884, 'dropout_rate': 0.31666398954646685, 'ccp_alpha': 0.09728897653743804}. Best is trial 187 with value: 0.6933481836305168.[0m
[32m[I 2022-04-21 23:54:56,475][0m Trial 522 finished with value: 0.5 and parameters: {'loss': 'coxph', 'learning_rate': 0.00011557376126828349, 'n_estimators': 308, 'criterion': 'squared_error', 'min_samples_split': 7, 'min_samples_leaf': 9, 'min_weight_fraction_leaf': 0.21783138885015155, 'min_impurity_decrease': 0.07522047623142983, 'max_features': 0.8583097098782206, 'subsample': 0.32090449285640116, 'dropout_rate': 0.02213762976241612, 'ccp_alpha': 3.161661017090797}. Best is trial 187 with value: 0.6933481836305168.[0m
[32m[I 2022-04-21 23:55:24,636][0m Trial 523 finished with value: 0.5610599198178012 and parameters: {'loss': 'coxph', 'learning_rate': 3.603754909875105e-05, 'n_estimators': 349, 'criterion': 'absolute_error', 'min_samples_split': 7, 'min_samples_leaf': 10, 'min_weight_fraction_leaf': 0.40384285886576465, 'min_impurity_decrease': 0.00101837009441905, 'max_features': 0.9230381665661637, 'subsample': 0.25933804505633895, 'dropout_rate': 0.2596782515003182, 'ccp_alpha': 0.27863353812931607}. Best is trial 187 with value: 0.6933481836305168.[0m
[32m[I 2022-04-21 23:56:13,500][0m Trial 524 finished with value: 0.6636900948801576 and parameters: {'loss': 'coxph', 'learning_rate': 0.00021161372058154632, 'n_estimators': 394, 'criterion': 'squared_error', 'min_samples_split': 7, 'min_samples_leaf': 8, 'min_weight_fraction_leaf': 0.20071286576630823, 'min_impurity_decrease': 0.03562130050615464, 'max_features': 0.9583413976273241, 'subsample': 0.6694611993557409, 'dropout_rate': 0.05303819652674312, 'ccp_alpha': 0.1807479154340596}. Best is trial 187 with value: 0.6933481836305168.[0m
[32m[I 2022-04-21 23:56:49,907][0m Trial 525 finished with value: 0.6875460165918421 and parameters: {'loss': 'coxph', 'learning_rate': 8.412184750333866e-05, 'n_estimators': 367, 'criterion': 'squared_error', 'min_samples_split': 7, 'min_samples_leaf': 10, 'min_weight_fraction_leaf': 0.1628323830600871, 'min_impurity_decrease': 0.05626079274037108, 'max_features': 0.7696016520849172, 'subsample': 0.2914091269157067, 'dropout_rate': 0.03329493970343636, 'ccp_alpha': 0.002148569307028253}. Best is trial 187 with value: 0.6933481836305168.[0m
[32m[I 2022-04-21 23:57:16,739][0m Trial 526 finished with value: 0.6856237164282594 and parameters: {'loss': 'coxph', 'learning_rate': 0.00036844155942060826, 'n_estimators': 298, 'criterion': 'squared_error', 'min_samples_split': 7, 'min_samples_leaf': 10, 'min_weight_fraction_leaf': 0.1865960523468196, 'min_impurity_decrease': 0.14419900819266418, 'max_features': 0.8795945153643449, 'subsample': 0.20382084858042615, 'dropout_rate': 0.07902922341461655, 'ccp_alpha': 0.0025150017500000666}. Best is trial 187 with value: 0.6933481836305168.[0m
/media/san2_ssd/data/Workdir/survival/venv/lib/python3.8/site-packages/sksurv/ensemble/boosting.py:955: RuntimeWarning: divide by zero encountered in log
  time = numpy.log(time)
/media/san2_ssd/data/Workdir/survival/venv/lib/python3.8/site-packages/sksurv/ensemble/boosting.py:955: RuntimeWarning: divide by zero encountered in log
  time = numpy.log(time)
/media/san2_ssd/data/Workdir/survival/venv/lib/python3.8/site-packages/sksurv/ensemble/boosting.py:955: RuntimeWarning: divide by zero encountered in log
  time = numpy.log(time)
/media/san2_ssd/data/Workdir/survival/venv/lib/python3.8/site-packages/sksurv/ensemble/boosting.py:955: RuntimeWarning: divide by zero encountered in log
  time = numpy.log(time)
[32m[I 2022-04-21 23:57:20,663][0m Trial 527 finished with value: -0.7 and parameters: {'loss': 'squared', 'learning_rate': 5.888665692597846e-05, 'n_estimators': 336, 'criterion': 'squared_error', 'min_samples_split': 7, 'min_samples_leaf': 10, 'min_weight_fraction_leaf': 0.2028575745209639, 'min_impurity_decrease': 0.0862535948800468, 'max_features': 0.9383938979515594, 'subsample': 0.2680321356462522, 'dropout_rate': 0.2949805825505933, 'ccp_alpha': 3.406346750657578}. Best is trial 187 with value: 0.6933481836305168.[0m
[32m[I 2022-04-21 23:57:38,503][0m Trial 528 finished with value: 0.6242068938044875 and parameters: {'loss': 'coxph', 'learning_rate': 0.0002808194810712459, 'n_estimators': 269, 'criterion': 'friedman_mse', 'min_samples_split': 8, 'min_samples_leaf': 9, 'min_weight_fraction_leaf': 0.17098734788142692, 'min_impurity_decrease': 0.028515144312195054, 'max_features': 0.8435342167613661, 'subsample': 0.24095388356341424, 'dropout_rate': 0.10115188190175341, 'ccp_alpha': 0.4323341696834312}. Best is trial 187 with value: 0.6933481836305168.[0m
[32m[I 2022-04-21 23:58:17,739][0m Trial 529 finished with value: 0.677528443427377 and parameters: {'loss': 'coxph', 'learning_rate': 4.6156564605863585e-05, 'n_estimators': 430, 'criterion': 'squared_error', 'min_samples_split': 7, 'min_samples_leaf': 10, 'min_weight_fraction_leaf': 0.21155512967063753, 'min_impurity_decrease': 0.1134127996595311, 'max_features': 0.9823839600278426, 'subsample': 0.3067384261047908, 'dropout_rate': 0.04665568015655945, 'ccp_alpha': 0.1524343996607037}. Best is trial 187 with value: 0.6933481836305168.[0m
[32m[I 2022-04-21 23:58:40,880][0m Trial 530 finished with value: 0.6860606188762747 and parameters: {'loss': 'coxph', 'learning_rate': 0.0001801337977262927, 'n_estimators': 318, 'criterion': 'squared_error', 'min_samples_split': 7, 'min_samples_leaf': 7, 'min_weight_fraction_leaf': 0.24650655905476043, 'min_impurity_decrease': 0.051091520094133674, 'max_features': 0.3897319176632121, 'subsample': 0.34305020597882646, 'dropout_rate': 0.41825702439852774, 'ccp_alpha': 0.0025484664654165847}. Best is trial 187 with value: 0.6933481836305168.[0m
[32m[I 2022-04-21 23:59:01,656][0m Trial 531 finished with value: 0.6641855252698322 and parameters: {'loss': 'coxph', 'learning_rate': 0.00011938766117219744, 'n_estimators': 292, 'criterion': 'squared_error', 'min_samples_split': 7, 'min_samples_leaf': 10, 'min_weight_fraction_leaf': 0.19303192975483982, 'min_impurity_decrease': 0.08091095732735462, 'max_features': 0.056174750373039734, 'subsample': 0.2814715190171754, 'dropout_rate': 0.13925428694834616, 'ccp_alpha': 0.26801276684106856}. Best is trial 187 with value: 0.6933481836305168.[0m
[32m[I 2022-04-21 23:59:34,412][0m Trial 532 finished with value: 0.6876877309617322 and parameters: {'loss': 'coxph', 'learning_rate': 7.378882339422236e-05, 'n_estimators': 377, 'criterion': 'absolute_error', 'min_samples_split': 6, 'min_samples_leaf': 9, 'min_weight_fraction_leaf': 0.2257651092945909, 'min_impurity_decrease': 0.06628555342269535, 'max_features': 0.9026396807464853, 'subsample': 0.2302679738900514, 'dropout_rate': 0.00820489617058553, 'ccp_alpha': 0.09939060248273632}. Best is trial 187 with value: 0.6933481836305168.[0m
[32m[I 2022-04-21 23:59:56,933][0m Trial 533 finished with value: 0.6825470378235282 and parameters: {'loss': 'coxph', 'learning_rate': 0.0002366672150326944, 'n_estimators': 325, 'criterion': 'squared_error', 'min_samples_split': 7, 'min_samples_leaf': 10, 'min_weight_fraction_leaf': 0.18120321134771666, 'min_impurity_decrease': 0.02057307666914514, 'max_features': 0.919413601240691, 'subsample': 0.3275063574219411, 'dropout_rate': 0.19463444855128487, 'ccp_alpha': 0.1720211618126652}. Best is trial 187 with value: 0.6933481836305168.[0m
[32m[I 2022-04-22 00:00:27,428][0m Trial 534 finished with value: 0.6836979387494906 and parameters: {'loss': 'coxph', 'learning_rate': 2.8873014498680068e-05, 'n_estimators': 339, 'criterion': 'squared_error', 'min_samples_split': 7, 'min_samples_leaf': 10, 'min_weight_fraction_leaf': 0.156782384720185, 'min_impurity_decrease': 0.18531939979065176, 'max_features': 0.9497255674665019, 'subsample': 0.25356804210048633, 'dropout_rate': 0.06973350427537889, 'ccp_alpha': 0.09495827029269314}. Best is trial 187 with value: 0.6933481836305168.[0m
[32m[I 2022-04-22 00:00:40,260][0m Trial 535 finished with value: 0.6643179687971595 and parameters: {'loss': 'coxph', 'learning_rate': 0.000558189331377726, 'n_estimators': 223, 'criterion': 'squared_error', 'min_samples_split': 7, 'min_samples_leaf': 9, 'min_weight_fraction_leaf': 0.20648167377741483, 'min_impurity_decrease': 0.03858475286579406, 'max_features': 0.8672505599270234, 'subsample': 0.1665548946856599, 'dropout_rate': 0.32420887039072166, 'ccp_alpha': 0.3182522403688144}. Best is trial 187 with value: 0.6933481836305168.[0m
[32m[I 2022-04-22 00:01:02,288][0m Trial 536 finished with value: 0.6683706587529986 and parameters: {'loss': 'coxph', 'learning_rate': 9.076951052564418e-05, 'n_estimators': 305, 'criterion': 'squared_error', 'min_samples_split': 7, 'min_samples_leaf': 3, 'min_weight_fraction_leaf': 0.194185255411226, 'min_impurity_decrease': 0.10407379623252812, 'max_features': 0.1043832873436816, 'subsample': 0.30493637591914746, 'dropout_rate': 0.12310679191331297, 'ccp_alpha': 0.21052859784329575}. Best is trial 187 with value: 0.6933481836305168.[0m
[32m[I 2022-04-22 00:01:30,892][0m Trial 537 finished with value: 0.5 and parameters: {'loss': 'coxph', 'learning_rate': 0.00015587545282429313, 'n_estimators': 357, 'criterion': 'squared_error', 'min_samples_split': 7, 'min_samples_leaf': 10, 'min_weight_fraction_leaf': 0.2354849739083342, 'min_impurity_decrease': 0.4566819542060592, 'max_features': 0.9669338063051961, 'subsample': 0.27724438324468903, 'dropout_rate': 0.04180131022304629, 'ccp_alpha': 1.424629025034828}. Best is trial 187 with value: 0.6933481836305168.[0m
[32m[I 2022-04-22 00:01:38,318][0m Trial 538 finished with value: 0.6689072417975683 and parameters: {'loss': 'coxph', 'learning_rate': 4.7653805653956356e-05, 'n_estimators': 214, 'criterion': 'squared_error', 'min_samples_split': 7, 'min_samples_leaf': 10, 'min_weight_fraction_leaf': 0.17591517989880817, 'min_impurity_decrease': 0.12816430320486194, 'max_features': 0.0738147909955311, 'subsample': 0.5089590714648047, 'dropout_rate': 0.23022268952225727, 'ccp_alpha': 0.09224742075484553}. Best is trial 187 with value: 0.6933481836305168.[0m
[32m[I 2022-04-22 00:01:58,446][0m Trial 539 finished with value: 0.6829338165314414 and parameters: {'loss': 'coxph', 'learning_rate': 0.00038044525544462897, 'n_estimators': 279, 'criterion': 'friedman_mse', 'min_samples_split': 8, 'min_samples_leaf': 10, 'min_weight_fraction_leaf': 0.219627207249043, 'min_impurity_decrease': 0.06110981383445057, 'max_features': 0.8220559774495213, 'subsample': 0.19548906086562937, 'dropout_rate': 0.08902150635117184, 'ccp_alpha': 0.13838170939754754}. Best is trial 187 with value: 0.6933481836305168.[0m
[32m[I 2022-04-22 00:02:10,256][0m Trial 540 finished with value: 0.5683194905228547 and parameters: {'loss': 'coxph', 'learning_rate': 5.4521730791645855e-05, 'n_estimators': 252, 'criterion': 'squared_error', 'min_samples_split': 7, 'min_samples_leaf': 10, 'min_weight_fraction_leaf': 0.3622246915323923, 'min_impurity_decrease': 0.04401403542990871, 'max_features': 0.8937660139953578, 'subsample': 0.29736718650019894, 'dropout_rate': 0.266617788396867, 'ccp_alpha': 0.36211847541370706}. Best is trial 187 with value: 0.6933481836305168.[0m
[32m[I 2022-04-22 00:02:35,954][0m Trial 541 finished with value: 0.5 and parameters: {'loss': 'coxph', 'learning_rate': 0.00013764348168411912, 'n_estimators': 312, 'criterion': 'absolute_error', 'min_samples_split': 7, 'min_samples_leaf': 9, 'min_weight_fraction_leaf': 0.18930693854485697, 'min_impurity_decrease': 0.019095531832997517, 'max_features': 0.024443361105418594, 'subsample': 0.37214266507406907, 'dropout_rate': 0.0016848502869200657, 'ccp_alpha': 0.5615834348388327}. Best is trial 187 with value: 0.6933481836305168.[0m
[32m[I 2022-04-22 00:03:13,579][0m Trial 542 finished with value: 0.6726794891502523 and parameters: {'loss': 'coxph', 'learning_rate': 3.678853929521196e-05, 'n_estimators': 409, 'criterion': 'squared_error', 'min_samples_split': 7, 'min_samples_leaf': 10, 'min_weight_fraction_leaf': 0.20134969910786246, 'min_impurity_decrease': 0.087322005206038, 'max_features': 0.9382575279355851, 'subsample': 0.21200435201858722, 'dropout_rate': 0.024353911210777054, 'ccp_alpha': 0.23827207182726012}. Best is trial 187 with value: 0.6933481836305168.[0m
[32m[I 2022-04-22 00:03:37,276][0m Trial 543 finished with value: 0.6866019002220864 and parameters: {'loss': 'coxph', 'learning_rate': 0.00021022962726791256, 'n_estimators': 340, 'criterion': 'squared_error', 'min_samples_split': 7, 'min_samples_leaf': 10, 'min_weight_fraction_leaf': 0.17384751968316048, 'min_impurity_decrease': 0.060898761882251386, 'max_features': 0.9089755859425346, 'subsample': 0.3212963100178959, 'dropout_rate': 0.16783089368089776, 'ccp_alpha': 0.004056721063332646}. Best is trial 187 with value: 0.6933481836305168.[0m
[32m[I 2022-04-22 00:04:10,389][0m Trial 544 finished with value: 0.683996326152527 and parameters: {'loss': 'coxph', 'learning_rate': 0.00010286664392359895, 'n_estimators': 388, 'criterion': 'squared_error', 'min_samples_split': 6, 'min_samples_leaf': 9, 'min_weight_fraction_leaf': 0.21128256419976565, 'min_impurity_decrease': 0.03614270737031812, 'max_features': 0.8451500051287512, 'subsample': 0.2671088087697521, 'dropout_rate': 0.29947185183513, 'ccp_alpha': 0.08956330278296518}. Best is trial 187 with value: 0.6933481836305168.[0m
[32m[I 2022-04-22 00:04:33,151][0m Trial 545 finished with value: 0.6637865011237818 and parameters: {'loss': 'coxph', 'learning_rate': 7.10769986356981e-05, 'n_estimators': 289, 'criterion': 'squared_error', 'min_samples_split': 7, 'min_samples_leaf': 10, 'min_weight_fraction_leaf': 0.18424926578728312, 'min_impurity_decrease': 0.09732401587817674, 'max_features': 0.12825457721333527, 'subsample': 0.23422122389146852, 'dropout_rate': 0.06274607290763665, 'ccp_alpha': 0.16965965221787238}. Best is trial 187 with value: 0.6933481836305168.[0m
