[32m[I 2022-04-22 15:52:47,738][0m Trial 70 finished with value: 0.5428540092122314 and parameters: {'loss': 'coxph', 'learning_rate': 0.0014970134003657544, 'n_estimators': 251, 'criterion': 'friedman_mse', 'min_samples_split': 7, 'min_samples_leaf': 1, 'min_weight_fraction_leaf': 0.17235472862041204, 'min_impurity_decrease': 0.5704712235555605, 'max_features': 0.7231475962908183, 'subsample': 0.03693167157540875, 'dropout_rate': 0.4891386497840396, 'ccp_alpha': 1.186209052841201}. Best is trial 70 with value: 0.5428540092122314.[0m
[32m[I 2022-04-22 15:52:59,836][0m Trial 71 finished with value: 0.6157334456616026 and parameters: {'loss': 'coxph', 'learning_rate': 0.001250374010214506, 'n_estimators': 235, 'criterion': 'friedman_mse', 'min_samples_split': 7, 'min_samples_leaf': 1, 'min_weight_fraction_leaf': 0.16538340782567884, 'min_impurity_decrease': 0.5727078288772305, 'max_features': 0.5524902136505476, 'subsample': 0.0693443323454989, 'dropout_rate': 0.45521722691459543, 'ccp_alpha': 0.14039264482925728}. Best is trial 71 with value: 0.6157334456616026.[0m
[32m[I 2022-04-22 15:53:13,097][0m Trial 72 finished with value: 0.5 and parameters: {'loss': 'coxph', 'learning_rate': 0.0014648164262957178, 'n_estimators': 254, 'criterion': 'friedman_mse', 'min_samples_split': 7, 'min_samples_leaf': 1, 'min_weight_fraction_leaf': 0.16361276437367808, 'min_impurity_decrease': 0.5868045798812263, 'max_features': 0.6213373429371941, 'subsample': 0.07734009785792458, 'dropout_rate': 0.45850738219932863, 'ccp_alpha': 1.062623653474354}. Best is trial 71 with value: 0.6157334456616026.[0m
[32m[I 2022-04-22 15:53:17,620][0m Trial 73 finished with value: 0.5 and parameters: {'loss': 'coxph', 'learning_rate': 0.0003431380071753046, 'n_estimators': 215, 'criterion': 'friedman_mse', 'min_samples_split': 6, 'min_samples_leaf': 2, 'min_weight_fraction_leaf': 0.45947375363949666, 'min_impurity_decrease': 0.37980076595240575, 'max_features': 0.6945837874413263, 'subsample': 0.04163928091629274, 'dropout_rate': 0.9164642416341269, 'ccp_alpha': 4.300041375454029}. Best is trial 71 with value: 0.6157334456616026.[0m
[32m[I 2022-04-22 15:53:21,398][0m Trial 74 finished with value: 0.5 and parameters: {'loss': 'coxph', 'learning_rate': 0.00017753582878595253, 'n_estimators': 211, 'criterion': 'friedman_mse', 'min_samples_split': 6, 'min_samples_leaf': 3, 'min_weight_fraction_leaf': 0.43606641378119015, 'min_impurity_decrease': 0.47962903472198165, 'max_features': 0.995128614550626, 'subsample': 0.34550445157023135, 'dropout_rate': 0.9125604798468044, 'ccp_alpha': 4.159748929851908}. Best is trial 71 with value: 0.6157334456616026.[0m
[32m[I 2022-04-22 15:53:27,109][0m Trial 75 finished with value: 0.5 and parameters: {'loss': 'coxph', 'learning_rate': 0.00038827825179754086, 'n_estimators': 226, 'criterion': 'absolute_error', 'min_samples_split': 5, 'min_samples_leaf': 4, 'min_weight_fraction_leaf': 0.46653277188900155, 'min_impurity_decrease': 0.43607963869598343, 'max_features': 0.9463677679924029, 'subsample': 0.42418665876490114, 'dropout_rate': 0.9348708360439422, 'ccp_alpha': 3.7067141166573974}. Best is trial 71 with value: 0.6157334456616026.[0m
[32m[I 2022-04-22 15:53:32,290][0m Trial 76 finished with value: 0.5 and parameters: {'loss': 'coxph', 'learning_rate': 0.0002254784187147235, 'n_estimators': 161, 'criterion': 'absolute_error', 'min_samples_split': 6, 'min_samples_leaf': 3, 'min_weight_fraction_leaf': 0.49662327233961395, 'min_impurity_decrease': 0.3401487562342693, 'max_features': 0.9003761187259514, 'subsample': 0.5519625259669102, 'dropout_rate': 0.8238634065820143, 'ccp_alpha': 0.1771143203918732}. Best is trial 71 with value: 0.6157334456616026.[0m
/media/san2_ssd/data/Workdir/survival/venv/lib/python3.8/site-packages/sksurv/ensemble/boosting.py:955: RuntimeWarning: divide by zero encountered in log
  time = numpy.log(time)
/media/san2_ssd/data/Workdir/survival/venv/lib/python3.8/site-packages/sksurv/ensemble/boosting.py:955: RuntimeWarning: divide by zero encountered in log
  time = numpy.log(time)
/media/san2_ssd/data/Workdir/survival/venv/lib/python3.8/site-packages/sksurv/ensemble/boosting.py:955: RuntimeWarning: divide by zero encountered in log
  time = numpy.log(time)
/media/san2_ssd/data/Workdir/survival/venv/lib/python3.8/site-packages/sksurv/ensemble/boosting.py:955: RuntimeWarning: divide by zero encountered in log
  time = numpy.log(time)
[32m[I 2022-04-22 15:53:35,856][0m Trial 77 finished with value: -0.7 and parameters: {'loss': 'squared', 'learning_rate': 7.29344727486878e-05, 'n_estimators': 291, 'criterion': 'absolute_error', 'min_samples_split': 6, 'min_samples_leaf': 2, 'min_weight_fraction_leaf': 0.40538286777607396, 'min_impurity_decrease': 0.5409119853249329, 'max_features': 0.982214534440482, 'subsample': 0.5250980238257201, 'dropout_rate': 0.4907994444104557, 'ccp_alpha': 2.315762178049826}. Best is trial 71 with value: 0.6157334456616026.[0m
[32m[I 2022-04-22 15:53:42,813][0m Trial 78 finished with value: 0.5 and parameters: {'loss': 'coxph', 'learning_rate': 3.349206431130461e-05, 'n_estimators': 194, 'criterion': 'squared_error', 'min_samples_split': 7, 'min_samples_leaf': 4, 'min_weight_fraction_leaf': 0.35196070958600817, 'min_impurity_decrease': 0.28416478893456737, 'max_features': 0.8547176591271806, 'subsample': 0.20689575155106443, 'dropout_rate': 0.5550179014381684, 'ccp_alpha': 3.2194490038842267}. Best is trial 71 with value: 0.6157334456616026.[0m
[32m[I 2022-04-22 15:53:50,623][0m Trial 79 finished with value: 0.5 and parameters: {'loss': 'coxph', 'learning_rate': 1.0911640963155454e-05, 'n_estimators': 192, 'criterion': 'squared_error', 'min_samples_split': 7, 'min_samples_leaf': 5, 'min_weight_fraction_leaf': 0.40193465911282716, 'min_impurity_decrease': 0.23640359132627597, 'max_features': 0.7797219015186792, 'subsample': 0.45110498095550144, 'dropout_rate': 0.41991330932010446, 'ccp_alpha': 1.6253565841730313}. Best is trial 71 with value: 0.6157334456616026.[0m
[32m[I 2022-04-22 15:53:55,677][0m Trial 80 finished with value: 0.5 and parameters: {'loss': 'coxph', 'learning_rate': 4.828686031155449e-05, 'n_estimators': 158, 'criterion': 'absolute_error', 'min_samples_split': 5, 'min_samples_leaf': 1, 'min_weight_fraction_leaf': 0.3666691131683587, 'min_impurity_decrease': 0.6397562850952084, 'max_features': 0.5519226509979285, 'subsample': 0.6383645248738777, 'dropout_rate': 0.7779597630771752, 'ccp_alpha': 3.3171907767853925}. Best is trial 71 with value: 0.6157334456616026.[0m
[32m[I 2022-04-22 15:53:58,277][0m Trial 81 finished with value: 0.5 and parameters: {'loss': 'coxph', 'learning_rate': 0.002842389498253734, 'n_estimators': 188, 'criterion': 'squared_error', 'min_samples_split': 10, 'min_samples_leaf': 6, 'min_weight_fraction_leaf': 0.4247684808161641, 'min_impurity_decrease': 0.26577102714309364, 'max_features': 0.7544664183408634, 'subsample': 0.3097781794053661, 'dropout_rate': 0.9686271706377299, 'ccp_alpha': 4.0831702858171655}. Best is trial 71 with value: 0.6157334456616026.[0m
[32m[I 2022-04-22 15:54:00,899][0m Trial 82 finished with value: 0.5 and parameters: {'loss': 'coxph', 'learning_rate': 2.727576917904003e-05, 'n_estimators': 119, 'criterion': 'squared_error', 'min_samples_split': 4, 'min_samples_leaf': 5, 'min_weight_fraction_leaf': 0.3436123748501074, 'min_impurity_decrease': 0.17720642195955164, 'max_features': 0.8276755342849944, 'subsample': 0.2639056980611073, 'dropout_rate': 0.7568933635557604, 'ccp_alpha': 4.602917393359791}. Best is trial 71 with value: 0.6157334456616026.[0m
[32m[I 2022-04-22 15:54:06,408][0m Trial 83 finished with value: 0.5 and parameters: {'loss': 'coxph', 'learning_rate': 9.469841418181202e-06, 'n_estimators': 289, 'criterion': 'squared_error', 'min_samples_split': 4, 'min_samples_leaf': 5, 'min_weight_fraction_leaf': 0.39517230905685213, 'min_impurity_decrease': 0.1953579597799762, 'max_features': 0.9025111329653307, 'subsample': 0.4760016140178692, 'dropout_rate': 0.9528760846388923, 'ccp_alpha': 4.735342032851928}. Best is trial 71 with value: 0.6157334456616026.[0m
[32m[I 2022-04-22 15:54:17,025][0m Trial 84 finished with value: 0.5 and parameters: {'loss': 'coxph', 'learning_rate': 1.2969643839609858e-05, 'n_estimators': 288, 'criterion': 'squared_error', 'min_samples_split': 4, 'min_samples_leaf': 5, 'min_weight_fraction_leaf': 0.3332144009392503, 'min_impurity_decrease': 0.49705362786307516, 'max_features': 0.7621094889025796, 'subsample': 0.006421481679681932, 'dropout_rate': 0.744590265022956, 'ccp_alpha': 1.2317781491987303}. Best is trial 71 with value: 0.6157334456616026.[0m
[32m[I 2022-04-22 15:54:40,682][0m Trial 85 finished with value: 0.5 and parameters: {'loss': 'coxph', 'learning_rate': 1.966280054564661e-06, 'n_estimators': 517, 'criterion': 'squared_error', 'min_samples_split': 5, 'min_samples_leaf': 5, 'min_weight_fraction_leaf': 0.3577276684010956, 'min_impurity_decrease': 0.2475296438316819, 'max_features': 0.851154091459592, 'subsample': 0.3516820573226196, 'dropout_rate': 0.807193370235216, 'ccp_alpha': 1.7344345699594608}. Best is trial 71 with value: 0.6157334456616026.[0m
[32m[I 2022-04-22 15:54:48,153][0m Trial 86 finished with value: 0.5 and parameters: {'loss': 'coxph', 'learning_rate': 0.047696422891393274, 'n_estimators': 315, 'criterion': 'squared_error', 'min_samples_split': 5, 'min_samples_leaf': 6, 'min_weight_fraction_leaf': 0.14791599797219696, 'min_impurity_decrease': 0.526753589173171, 'max_features': 0.8675569639714421, 'subsample': 0.2940426839985232, 'dropout_rate': 0.8856399561144157, 'ccp_alpha': 1.4356677382915826}. Best is trial 71 with value: 0.6157334456616026.[0m
[32m[I 2022-04-22 15:55:04,593][0m Trial 87 finished with value: 0.5 and parameters: {'loss': 'coxph', 'learning_rate': 6.900755941755717e-06, 'n_estimators': 348, 'criterion': 'squared_error', 'min_samples_split': 5, 'min_samples_leaf': 6, 'min_weight_fraction_leaf': 0.42023488512207, 'min_impurity_decrease': 0.036105390568144116, 'max_features': 0.033708786659638335, 'subsample': 0.5737572433064597, 'dropout_rate': 0.6375142779198459, 'ccp_alpha': 2.5472636512658084}. Best is trial 71 with value: 0.6157334456616026.[0m
[32m[I 2022-04-22 15:55:27,289][0m Trial 88 finished with value: 0.5 and parameters: {'loss': 'coxph', 'learning_rate': 0.000539768778955388, 'n_estimators': 550, 'criterion': 'friedman_mse', 'min_samples_split': 4, 'min_samples_leaf': 6, 'min_weight_fraction_leaf': 0.3233122731755871, 'min_impurity_decrease': 0.06874202211364204, 'max_features': 0.6985542964865037, 'subsample': 0.5998673567341225, 'dropout_rate': 0.8400539920139733, 'ccp_alpha': 1.9373303739484569}. Best is trial 71 with value: 0.6157334456616026.[0m
/media/san2_ssd/data/Workdir/survival/venv/lib/python3.8/site-packages/sksurv/ensemble/boosting.py:955: RuntimeWarning: divide by zero encountered in log
  time = numpy.log(time)
/media/san2_ssd/data/Workdir/survival/venv/lib/python3.8/site-packages/sksurv/ensemble/boosting.py:955: RuntimeWarning: divide by zero encountered in log
  time = numpy.log(time)
/media/san2_ssd/data/Workdir/survival/venv/lib/python3.8/site-packages/sksurv/ensemble/boosting.py:955: RuntimeWarning: divide by zero encountered in log
  time = numpy.log(time)
/media/san2_ssd/data/Workdir/survival/venv/lib/python3.8/site-packages/sksurv/ensemble/boosting.py:955: RuntimeWarning: divide by zero encountered in log
  time = numpy.log(time)
[32m[I 2022-04-22 15:55:46,530][0m Trial 89 finished with value: -0.7080032317645519 and parameters: {'loss': 'squared', 'learning_rate': 0.0009567334315715616, 'n_estimators': 838, 'criterion': 'friedman_mse', 'min_samples_split': 5, 'min_samples_leaf': 7, 'min_weight_fraction_leaf': 0.29872777574983583, 'min_impurity_decrease': 0.6986391424863342, 'max_features': 0.1148460002365551, 'subsample': 0.6790035019387033, 'dropout_rate': 0.5783453464857006, 'ccp_alpha': 0.22550052054999903}. Best is trial 71 with value: 0.6157334456616026.[0m
[32m[I 2022-04-22 15:57:27,511][0m Trial 90 finished with value: 0.5 and parameters: {'loss': 'coxph', 'learning_rate': 0.02335651629727807, 'n_estimators': 605, 'criterion': 'friedman_mse', 'min_samples_split': 2, 'min_samples_leaf': 8, 'min_weight_fraction_leaf': 0.27597622133944866, 'min_impurity_decrease': 0.9244465309900802, 'max_features': 0.1860209654138287, 'subsample': 0.4836052530936431, 'dropout_rate': 0.06836051164014117, 'ccp_alpha': 2.12878826176527}. Best is trial 71 with value: 0.6157334456616026.[0m
[32m[I 2022-04-22 15:58:09,274][0m Trial 91 finished with value: 0.5 and parameters: {'loss': 'coxph', 'learning_rate': 0.0037006843464549347, 'n_estimators': 396, 'criterion': 'absolute_error', 'min_samples_split': 2, 'min_samples_leaf': 8, 'min_weight_fraction_leaf': 0.3078763105026418, 'min_impurity_decrease': 0.9143827260531014, 'max_features': 0.08694461981280276, 'subsample': 0.39553220031957625, 'dropout_rate': 0.16476356683545373, 'ccp_alpha': 4.8162053333461285}. Best is trial 71 with value: 0.6157334456616026.[0m
[32m[I 2022-04-22 15:59:12,702][0m Trial 92 finished with value: 0.5 and parameters: {'loss': 'coxph', 'learning_rate': 0.005207101890244085, 'n_estimators': 739, 'criterion': 'absolute_error', 'min_samples_split': 2, 'min_samples_leaf': 7, 'min_weight_fraction_leaf': 0.27640672115889464, 'min_impurity_decrease': 0.8614113827518912, 'max_features': 0.2010478936471986, 'subsample': 0.5103554984711578, 'dropout_rate': 0.6791361480150832, 'ccp_alpha': 4.940046717524795}. Best is trial 71 with value: 0.6157334456616026.[0m
[32m[I 2022-04-22 16:01:01,387][0m Trial 93 finished with value: 0.5 and parameters: {'loss': 'coxph', 'learning_rate': 0.0020000896217198826, 'n_estimators': 638, 'criterion': 'friedman_mse', 'min_samples_split': 2, 'min_samples_leaf': 7, 'min_weight_fraction_leaf': 0.2747243473650243, 'min_impurity_decrease': 0.9852112449984946, 'max_features': 0.2719801677903914, 'subsample': 0.42199275531281766, 'dropout_rate': 0.07987653790766519, 'ccp_alpha': 1.4011575114328978}. Best is trial 71 with value: 0.6157334456616026.[0m
[32m[I 2022-04-22 16:03:04,836][0m Trial 94 finished with value: 0.5 and parameters: {'loss': 'coxph', 'learning_rate': 0.014095562026980625, 'n_estimators': 796, 'criterion': 'absolute_error', 'min_samples_split': 3, 'min_samples_leaf': 9, 'min_weight_fraction_leaf': 0.04839499111729337, 'min_impurity_decrease': 0.8916145223830941, 'max_features': 0.3774775240925382, 'subsample': 0.7535958640836445, 'dropout_rate': 0.3904358622629051, 'ccp_alpha': 0.5862119586085057}. Best is trial 71 with value: 0.6157334456616026.[0m
[32m[I 2022-04-22 16:04:14,972][0m Trial 95 finished with value: 0.5 and parameters: {'loss': 'coxph', 'learning_rate': 0.014045572319107903, 'n_estimators': 589, 'criterion': 'absolute_error', 'min_samples_split': 2, 'min_samples_leaf': 9, 'min_weight_fraction_leaf': 0.20870649694168256, 'min_impurity_decrease': 0.9660325160556369, 'max_features': 0.32338956980402833, 'subsample': 0.8869139032868931, 'dropout_rate': 0.3772103477375155, 'ccp_alpha': 0.445623215680084}. Best is trial 71 with value: 0.6157334456616026.[0m
[32m[I 2022-04-22 16:06:22,840][0m Trial 96 finished with value: 0.5 and parameters: {'loss': 'coxph', 'learning_rate': 0.031963430077592114, 'n_estimators': 879, 'criterion': 'absolute_error', 'min_samples_split': 2, 'min_samples_leaf': 9, 'min_weight_fraction_leaf': 0.24693799330484614, 'min_impurity_decrease': 0.7875362627060137, 'max_features': 0.24211480102956248, 'subsample': 0.8343447351711425, 'dropout_rate': 0.4818216415893357, 'ccp_alpha': 0.6895916417611118}. Best is trial 71 with value: 0.6157334456616026.[0m
[32m[I 2022-04-22 16:08:10,362][0m Trial 97 finished with value: 0.5 and parameters: {'loss': 'coxph', 'learning_rate': 0.006524566154977469, 'n_estimators': 713, 'criterion': 'absolute_error', 'min_samples_split': 3, 'min_samples_leaf': 10, 'min_weight_fraction_leaf': 0.024714821413590406, 'min_impurity_decrease': 0.9546958982873445, 'max_features': 0.3375268168293257, 'subsample': 0.9150809364891852, 'dropout_rate': 0.3587129791672341, 'ccp_alpha': 0.3205518243217621}. Best is trial 71 with value: 0.6157334456616026.[0m
[32m[I 2022-04-22 16:09:03,715][0m Trial 98 finished with value: 0.5 and parameters: {'loss': 'coxph', 'learning_rate': 0.009391510547990152, 'n_estimators': 464, 'criterion': 'absolute_error', 'min_samples_split': 3, 'min_samples_leaf': 10, 'min_weight_fraction_leaf': 0.10462165168030854, 'min_impurity_decrease': 0.8369339931297768, 'max_features': 0.4138954576212548, 'subsample': 0.9379738158801637, 'dropout_rate': 0.2945449270793146, 'ccp_alpha': 0.020494969651075945}. Best is trial 71 with value: 0.6157334456616026.[0m
[32m[I 2022-04-22 16:09:56,752][0m Trial 99 finished with value: 0.5 and parameters: {'loss': 'coxph', 'learning_rate': 0.017880605042199432, 'n_estimators': 452, 'criterion': 'absolute_error', 'min_samples_split': 3, 'min_samples_leaf': 10, 'min_weight_fraction_leaf': 0.061060131517818285, 'min_impurity_decrease': 0.7384904603628558, 'max_features': 0.38459548107306873, 'subsample': 0.9985687426361972, 'dropout_rate': 0.2438065771605696, 'ccp_alpha': 0.8516269352333387}. Best is trial 71 with value: 0.6157334456616026.[0m
[32m[I 2022-04-22 16:10:49,071][0m Trial 100 finished with value: 0.5 and parameters: {'loss': 'coxph', 'learning_rate': 0.07192364232739655, 'n_estimators': 476, 'criterion': 'absolute_error', 'min_samples_split': 2, 'min_samples_leaf': 9, 'min_weight_fraction_leaf': 0.120862799521406, 'min_impurity_decrease': 0.9884011192748253, 'max_features': 0.2608818672573336, 'subsample': 0.9679513159007862, 'dropout_rate': 0.2995575636026977, 'ccp_alpha': 0.6524387627165354}. Best is trial 71 with value: 0.6157334456616026.[0m
[32m[I 2022-04-22 16:11:01,406][0m Trial 101 finished with value: 0.5 and parameters: {'loss': 'coxph', 'learning_rate': 0.009971961401435931, 'n_estimators': 246, 'criterion': 'absolute_error', 'min_samples_split': 3, 'min_samples_leaf': 10, 'min_weight_fraction_leaf': 0.16863252135986634, 'min_impurity_decrease': 0.5813025551198733, 'max_features': 0.34904353414331213, 'subsample': 0.08821579352186391, 'dropout_rate': 0.4514944574088914, 'ccp_alpha': 1.0851432000987402}. Best is trial 71 with value: 0.6157334456616026.[0m
[32m[I 2022-04-22 16:11:19,202][0m Trial 102 finished with value: 0.5 and parameters: {'loss': 'coxph', 'learning_rate': 0.0013558204413885984, 'n_estimators': 275, 'criterion': 'absolute_error', 'min_samples_split': 3, 'min_samples_leaf': 9, 'min_weight_fraction_leaf': 0.2016574724479689, 'min_impurity_decrease': 0.8073267481777887, 'max_features': 0.5336482286640131, 'subsample': 0.8274931794395972, 'dropout_rate': 0.4307771408033577, 'ccp_alpha': 0.973671274212622}. Best is trial 71 with value: 0.6157334456616026.[0m
[32m[I 2022-04-22 16:11:31,917][0m Trial 103 finished with value: 0.5767169854035138 and parameters: {'loss': 'coxph', 'learning_rate': 0.024169359514751323, 'n_estimators': 254, 'criterion': 'friedman_mse', 'min_samples_split': 7, 'min_samples_leaf': 1, 'min_weight_fraction_leaf': 0.08252291528185465, 'min_impurity_decrease': 0.6514531371492442, 'max_features': 0.646985106482733, 'subsample': 0.048506651095731275, 'dropout_rate': 0.4704696520699305, 'ccp_alpha': 0.5506404063482717}. Best is trial 71 with value: 0.6157334456616026.[0m
[32m[I 2022-04-22 16:11:44,296][0m Trial 104 finished with value: 0.6002908613066571 and parameters: {'loss': 'coxph', 'learning_rate': 0.03480500853760997, 'n_estimators': 230, 'criterion': 'friedman_mse', 'min_samples_split': 7, 'min_samples_leaf': 1, 'min_weight_fraction_leaf': 0.06993587190316292, 'min_impurity_decrease': 0.6629986767553178, 'max_features': 0.6366777041329161, 'subsample': 0.034857754997976456, 'dropout_rate': 0.3449785380630623, 'ccp_alpha': 0.46272365532375376}. Best is trial 71 with value: 0.6157334456616026.[0m
[32m[I 2022-04-22 16:11:48,930][0m Trial 105 finished with value: 0.5775949168654 and parameters: {'loss': 'coxph', 'learning_rate': 0.0004373647618294506, 'n_estimators': 245, 'criterion': 'friedman_mse', 'min_samples_split': 7, 'min_samples_leaf': 1, 'min_weight_fraction_leaf': 0.46157576283893176, 'min_impurity_decrease': 0.483969084341824, 'max_features': 0.6433055278735289, 'subsample': 0.04942422006550036, 'dropout_rate': 0.9278327137795922, 'ccp_alpha': 0.12407002077283025}. Best is trial 71 with value: 0.6157334456616026.[0m
[32m[I 2022-04-22 16:11:58,406][0m Trial 106 finished with value: 0.5 and parameters: {'loss': 'coxph', 'learning_rate': 0.00033082121246466085, 'n_estimators': 228, 'criterion': 'friedman_mse', 'min_samples_split': 7, 'min_samples_leaf': 1, 'min_weight_fraction_leaf': 0.4556200715604088, 'min_impurity_decrease': 0.6198652393897675, 'max_features': 0.642848591335617, 'subsample': 0.03787730291633968, 'dropout_rate': 0.5401890027807768, 'ccp_alpha': 0.10698441932687064}. Best is trial 71 with value: 0.6157334456616026.[0m
[32m[I 2022-04-22 16:12:10,249][0m Trial 107 finished with value: 0.5452344645095222 and parameters: {'loss': 'coxph', 'learning_rate': 0.0004403589170266774, 'n_estimators': 254, 'criterion': 'friedman_mse', 'min_samples_split': 7, 'min_samples_leaf': 1, 'min_weight_fraction_leaf': 0.4637268444434085, 'min_impurity_decrease': 0.48831867996275813, 'max_features': 0.7004930995463617, 'subsample': 0.06248462579017794, 'dropout_rate': 0.5026461276907002, 'ccp_alpha': 0.3047970903552478}. Best is trial 71 with value: 0.6157334456616026.[0m
