[32m[I 2022-04-23 01:50:44,298][0m Trial 877 finished with value: 0.8289245409665462 and parameters: {'n_hidden': 256, 'mixture_components': 8, 'use_sparse_layer': False, 'use_batchnorm': True, 'use_dropout': True, 'dropout': 0.6195498634009442, 'mlp_size_1': 0, 'mlp_size_2': 5, 'mlp_size_3': 0, 'kernel': 'LogLogistic', 'loss_name': 'CensoredNLLLoss'}. Best is trial 22 with value: 0.8433318468070169.[0m
[32m[I 2022-04-23 01:53:28,257][0m Trial 878 finished with value: 0.8281594865089801 and parameters: {'n_hidden': 256, 'mixture_components': 6, 'use_sparse_layer': False, 'use_batchnorm': True, 'use_dropout': True, 'dropout': 0.6636474351753985, 'mlp_size_1': 0, 'mlp_size_2': 5, 'mlp_size_3': 0, 'kernel': 'LogLogistic', 'loss_name': 'CensoredNLLLoss'}. Best is trial 22 with value: 0.8433318468070169.[0m
[32m[I 2022-04-23 01:55:58,582][0m Trial 879 finished with value: 0.8241685155696847 and parameters: {'n_hidden': 256, 'mixture_components': 6, 'use_sparse_layer': False, 'use_batchnorm': True, 'use_dropout': True, 'dropout': 0.5624062056741993, 'mlp_size_1': 0, 'mlp_size_2': 5, 'mlp_size_3': 0, 'kernel': 'LogLogistic', 'loss_name': 'CensoredNLLLoss'}. Best is trial 22 with value: 0.8433318468070169.[0m
[32m[I 2022-04-23 01:58:38,936][0m Trial 880 finished with value: 0.8296871550163007 and parameters: {'n_hidden': 256, 'mixture_components': 6, 'use_sparse_layer': False, 'use_batchnorm': True, 'use_dropout': True, 'dropout': 0.5954395552200457, 'mlp_size_1': 0, 'mlp_size_2': 5, 'mlp_size_3': 0, 'kernel': 'LogLogistic', 'loss_name': 'CensoredNLLLoss'}. Best is trial 22 with value: 0.8433318468070169.[0m
[32m[I 2022-04-23 02:01:27,560][0m Trial 881 finished with value: 0.7279936656780672 and parameters: {'n_hidden': 256, 'mixture_components': 10, 'use_sparse_layer': False, 'use_batchnorm': True, 'use_dropout': True, 'dropout': 0.6443142183520618, 'mlp_size_1': 0, 'mlp_size_2': 5, 'mlp_size_3': 0, 'kernel': 'LogLogistic', 'loss_name': 'CensoredNLLLoss'}. Best is trial 22 with value: 0.8433318468070169.[0m
[32m[I 2022-04-23 02:04:07,995][0m Trial 882 finished with value: 0.8321071467919886 and parameters: {'n_hidden': 256, 'mixture_components': 4, 'use_sparse_layer': False, 'use_batchnorm': True, 'use_dropout': True, 'dropout': 0.6276289154716834, 'mlp_size_1': 0, 'mlp_size_2': 5, 'mlp_size_3': 0, 'kernel': 'LogLogistic', 'loss_name': 'CensoredNLLLoss'}. Best is trial 22 with value: 0.8433318468070169.[0m
[32m[I 2022-04-23 02:06:42,745][0m Trial 883 finished with value: 0.8284060675434656 and parameters: {'n_hidden': 256, 'mixture_components': 9, 'use_sparse_layer': False, 'use_batchnorm': True, 'use_dropout': True, 'dropout': 0.678035592158133, 'mlp_size_1': 0, 'mlp_size_2': 5, 'mlp_size_3': 0, 'kernel': 'LogLogistic', 'loss_name': 'CensoredNLLLoss'}. Best is trial 22 with value: 0.8433318468070169.[0m
[32m[I 2022-04-23 02:09:11,058][0m Trial 884 finished with value: 0.7310407022240214 and parameters: {'n_hidden': 1024, 'mixture_components': 6, 'use_sparse_layer': False, 'use_batchnorm': True, 'use_dropout': True, 'dropout': 0.2998438975252935, 'mlp_size_1': 2, 'mlp_size_2': 5, 'mlp_size_3': 0, 'kernel': 'LogLogistic', 'loss_name': 'CensoredNLLLoss'}. Best is trial 22 with value: 0.8433318468070169.[0m
[32m[I 2022-04-23 02:10:01,637][0m Trial 885 finished with value: -0.5 and parameters: {'n_hidden': 256, 'mixture_components': 6, 'use_sparse_layer': False, 'use_batchnorm': True, 'use_dropout': True, 'dropout': 0.5875676151905689, 'mlp_size_1': 0, 'mlp_size_2': 5, 'mlp_size_3': 0, 'kernel': 'Gumbel', 'loss_name': 'CensoredNLLLoss'}. Best is trial 22 with value: 0.8433318468070169.[0m
[32m[I 2022-04-23 02:12:33,281][0m Trial 886 finished with value: 0.8296147605071852 and parameters: {'n_hidden': 256, 'mixture_components': 4, 'use_sparse_layer': False, 'use_batchnorm': True, 'use_dropout': True, 'dropout': 0.6155247771396215, 'mlp_size_1': 0, 'mlp_size_2': 5, 'mlp_size_3': 0, 'kernel': 'LogLogistic', 'loss_name': 'CensoredNLLLoss'}. Best is trial 22 with value: 0.8433318468070169.[0m
[32m[I 2022-04-23 02:15:18,264][0m Trial 887 finished with value: 0.820448264358429 and parameters: {'n_hidden': 256, 'mixture_components': 7, 'use_sparse_layer': False, 'use_batchnorm': True, 'use_dropout': True, 'dropout': 0.6491612500303684, 'mlp_size_1': 0, 'mlp_size_2': 5, 'mlp_size_3': 0, 'kernel': 'LogLogistic', 'loss_name': 'CensoredNLLLoss'}. Best is trial 22 with value: 0.8433318468070169.[0m
[32m[I 2022-04-23 02:17:56,243][0m Trial 888 finished with value: 0.837986560344752 and parameters: {'n_hidden': 256, 'mixture_components': 6, 'use_sparse_layer': False, 'use_batchnorm': True, 'use_dropout': True, 'dropout': 0.5687076578481663, 'mlp_size_1': 0, 'mlp_size_2': 5, 'mlp_size_3': 0, 'kernel': 'LogLogistic', 'loss_name': 'CensoredNLLLoss'}. Best is trial 22 with value: 0.8433318468070169.[0m
[32m[I 2022-04-23 02:20:48,644][0m Trial 889 finished with value: 0.8297787889841249 and parameters: {'n_hidden': 256, 'mixture_components': 6, 'use_sparse_layer': False, 'use_batchnorm': True, 'use_dropout': True, 'dropout': 0.5836086174872951, 'mlp_size_1': 0, 'mlp_size_2': 5, 'mlp_size_3': 0, 'kernel': 'LogLogistic', 'loss_name': 'CensoredNLLLoss'}. Best is trial 22 with value: 0.8433318468070169.[0m
[32m[I 2022-04-23 02:23:12,315][0m Trial 890 finished with value: 0.829483173772457 and parameters: {'n_hidden': 256, 'mixture_components': 6, 'use_sparse_layer': False, 'use_batchnorm': True, 'use_dropout': True, 'dropout': 0.20435961409918052, 'mlp_size_1': 0, 'mlp_size_2': 5, 'mlp_size_3': 0, 'kernel': 'LogLogistic', 'loss_name': 'CensoredNLLLoss'}. Best is trial 22 with value: 0.8433318468070169.[0m
[32m[I 2022-04-23 02:25:37,931][0m Trial 891 finished with value: 0.7268446560844033 and parameters: {'n_hidden': 256, 'mixture_components': 6, 'use_sparse_layer': False, 'use_batchnorm': True, 'use_dropout': True, 'dropout': 0.5660256180097073, 'mlp_size_1': 0, 'mlp_size_2': 5, 'mlp_size_3': 0, 'kernel': 'LogLogistic', 'loss_name': 'CensoredNLLLoss'}. Best is trial 22 with value: 0.8433318468070169.[0m
[32m[I 2022-04-23 02:28:23,705][0m Trial 892 finished with value: 0.8360838454486703 and parameters: {'n_hidden': 256, 'mixture_components': 6, 'use_sparse_layer': False, 'use_batchnorm': True, 'use_dropout': True, 'dropout': 0.5484581648878405, 'mlp_size_1': 0, 'mlp_size_2': 5, 'mlp_size_3': 0, 'kernel': 'LogLogistic', 'loss_name': 'CensoredNLLLoss'}. Best is trial 22 with value: 0.8433318468070169.[0m
[32m[I 2022-04-23 02:30:55,888][0m Trial 893 finished with value: 0.630694872454311 and parameters: {'n_hidden': 256, 'mixture_components': 6, 'use_sparse_layer': False, 'use_batchnorm': True, 'use_dropout': True, 'dropout': 0.5850481282032308, 'mlp_size_1': 0, 'mlp_size_2': 5, 'mlp_size_3': 0, 'kernel': 'LogLogistic', 'loss_name': 'CensoredNLLLoss'}. Best is trial 22 with value: 0.8433318468070169.[0m
[32m[I 2022-04-23 02:33:23,949][0m Trial 894 finished with value: 0.8331447535227114 and parameters: {'n_hidden': 256, 'mixture_components': 6, 'use_sparse_layer': False, 'use_batchnorm': True, 'use_dropout': True, 'dropout': 0.5642580823805172, 'mlp_size_1': 0, 'mlp_size_2': 5, 'mlp_size_3': 0, 'kernel': 'LogLogistic', 'loss_name': 'CensoredNLLLoss'}. Best is trial 22 with value: 0.8433318468070169.[0m
[32m[I 2022-04-23 02:35:58,088][0m Trial 895 finished with value: 0.625956073480717 and parameters: {'n_hidden': 256, 'mixture_components': 6, 'use_sparse_layer': False, 'use_batchnorm': True, 'use_dropout': True, 'dropout': 0.14522692079791463, 'mlp_size_1': 0, 'mlp_size_2': 5, 'mlp_size_3': 0, 'kernel': 'LogLogistic', 'loss_name': 'CensoredNLLLoss'}. Best is trial 22 with value: 0.8433318468070169.[0m
[32m[I 2022-04-23 02:38:29,839][0m Trial 896 finished with value: 0.7264145897337061 and parameters: {'n_hidden': 256, 'mixture_components': 6, 'use_sparse_layer': False, 'use_batchnorm': True, 'use_dropout': True, 'dropout': 0.5606499710506903, 'mlp_size_1': 0, 'mlp_size_2': 5, 'mlp_size_3': 0, 'kernel': 'LogLogistic', 'loss_name': 'CensoredNLLLoss'}. Best is trial 22 with value: 0.8433318468070169.[0m
[32m[I 2022-04-23 02:40:54,734][0m Trial 897 finished with value: 0.7277490799136552 and parameters: {'n_hidden': 256, 'mixture_components': 6, 'use_sparse_layer': False, 'use_batchnorm': True, 'use_dropout': True, 'dropout': 0.5693658761463485, 'mlp_size_1': 0, 'mlp_size_2': 5, 'mlp_size_3': 0, 'kernel': 'LogLogistic', 'loss_name': 'CensoredNLLLoss'}. Best is trial 22 with value: 0.8433318468070169.[0m
[32m[I 2022-04-23 02:43:23,170][0m Trial 898 finished with value: 0.8373130611966253 and parameters: {'n_hidden': 256, 'mixture_components': 6, 'use_sparse_layer': False, 'use_batchnorm': True, 'use_dropout': True, 'dropout': 0.6026866332299562, 'mlp_size_1': 0, 'mlp_size_2': 5, 'mlp_size_3': 0, 'kernel': 'LogLogistic', 'loss_name': 'CensoredNLLLoss'}. Best is trial 22 with value: 0.8433318468070169.[0m
[32m[I 2022-04-23 02:46:17,753][0m Trial 899 finished with value: 0.8321478588881147 and parameters: {'n_hidden': 256, 'mixture_components': 6, 'use_sparse_layer': False, 'use_batchnorm': True, 'use_dropout': True, 'dropout': 0.5972094850129872, 'mlp_size_1': 0, 'mlp_size_2': 5, 'mlp_size_3': 0, 'kernel': 'LogLogistic', 'loss_name': 'CensoredNLLLoss'}. Best is trial 22 with value: 0.8433318468070169.[0m
[32m[I 2022-04-23 02:48:38,959][0m Trial 900 finished with value: 0.728053404821585 and parameters: {'n_hidden': 256, 'mixture_components': 6, 'use_sparse_layer': False, 'use_batchnorm': True, 'use_dropout': True, 'dropout': 0.5766698217542726, 'mlp_size_1': 0, 'mlp_size_2': 5, 'mlp_size_3': 0, 'kernel': 'LogLogistic', 'loss_name': 'CensoredNLLLoss'}. Best is trial 22 with value: 0.8433318468070169.[0m
[32m[I 2022-04-23 02:51:17,024][0m Trial 901 finished with value: 0.7316112737255109 and parameters: {'n_hidden': 256, 'mixture_components': 6, 'use_sparse_layer': False, 'use_batchnorm': True, 'use_dropout': True, 'dropout': 0.6000432015855721, 'mlp_size_1': 0, 'mlp_size_2': 5, 'mlp_size_3': 0, 'kernel': 'LogLogistic', 'loss_name': 'CensoredNLLLoss'}. Best is trial 22 with value: 0.8433318468070169.[0m
[32m[I 2022-04-23 02:53:46,387][0m Trial 902 finished with value: 0.625028411034114 and parameters: {'n_hidden': 256, 'mixture_components': 6, 'use_sparse_layer': False, 'use_batchnorm': True, 'use_dropout': True, 'dropout': 0.5524742828677818, 'mlp_size_1': 0, 'mlp_size_2': 5, 'mlp_size_3': 0, 'kernel': 'LogLogistic', 'loss_name': 'CensoredNLLLoss'}. Best is trial 22 with value: 0.8433318468070169.[0m
[32m[I 2022-04-23 02:56:16,494][0m Trial 903 finished with value: 0.8299430050165924 and parameters: {'n_hidden': 256, 'mixture_components': 6, 'use_sparse_layer': False, 'use_batchnorm': True, 'use_dropout': True, 'dropout': 0.5984392060766386, 'mlp_size_1': 0, 'mlp_size_2': 5, 'mlp_size_3': 0, 'kernel': 'LogLogistic', 'loss_name': 'CensoredNLLLoss'}. Best is trial 22 with value: 0.8433318468070169.[0m
[32m[I 2022-04-23 02:58:59,535][0m Trial 904 finished with value: 0.7366249533614372 and parameters: {'n_hidden': 256, 'mixture_components': 6, 'use_sparse_layer': False, 'use_batchnorm': True, 'use_dropout': True, 'dropout': 0.5789218179704675, 'mlp_size_1': 0, 'mlp_size_2': 5, 'mlp_size_3': 0, 'kernel': 'LogLogistic', 'loss_name': 'CensoredNLLLoss'}. Best is trial 22 with value: 0.8433318468070169.[0m
[32m[I 2022-04-23 03:01:20,720][0m Trial 905 finished with value: 0.6391744870987692 and parameters: {'n_hidden': 256, 'mixture_components': 6, 'use_sparse_layer': False, 'use_batchnorm': True, 'use_dropout': True, 'dropout': 0.5707188263316362, 'mlp_size_1': 0, 'mlp_size_2': 5, 'mlp_size_3': 0, 'kernel': 'LogLogistic', 'loss_name': 'CensoredNLLLoss'}. Best is trial 22 with value: 0.8433318468070169.[0m
[32m[I 2022-04-23 03:04:17,978][0m Trial 906 finished with value: 0.7266336822924164 and parameters: {'n_hidden': 256, 'mixture_components': 7, 'use_sparse_layer': False, 'use_batchnorm': True, 'use_dropout': True, 'dropout': 0.6075099205044372, 'mlp_size_1': 0, 'mlp_size_2': 5, 'mlp_size_3': 0, 'kernel': 'LogLogistic', 'loss_name': 'CensoredNLLLoss'}. Best is trial 22 with value: 0.8433318468070169.[0m
[32m[I 2022-04-23 03:06:33,818][0m Trial 907 finished with value: 0.41867469782878536 and parameters: {'n_hidden': 1024, 'mixture_components': 6, 'use_sparse_layer': False, 'use_batchnorm': True, 'use_dropout': True, 'dropout': 0.07094631778503031, 'mlp_size_1': 1, 'mlp_size_2': 5, 'mlp_size_3': 0, 'kernel': 'LogLogistic', 'loss_name': 'CensoredNLLLoss'}. Best is trial 22 with value: 0.8433318468070169.[0m
[32m[I 2022-04-23 03:08:11,177][0m Trial 908 finished with value: 0.6192763466778353 and parameters: {'n_hidden': 32, 'mixture_components': 6, 'use_sparse_layer': False, 'use_batchnorm': True, 'use_dropout': True, 'dropout': 0.031125213754217423, 'mlp_size_1': 0, 'mlp_size_2': 2, 'mlp_size_3': 0, 'kernel': 'LogLogistic', 'loss_name': 'CensoredNLLLoss'}. Best is trial 22 with value: 0.8433318468070169.[0m
[32m[I 2022-04-23 03:10:30,290][0m Trial 909 finished with value: 0.7215950520913934 and parameters: {'n_hidden': 256, 'mixture_components': 7, 'use_sparse_layer': False, 'use_batchnorm': True, 'use_dropout': True, 'dropout': 0.6096295514248296, 'mlp_size_1': 3, 'mlp_size_2': 2, 'mlp_size_3': 0, 'kernel': 'LogLogistic', 'loss_name': 'CensoredNLLLoss'}. Best is trial 22 with value: 0.8433318468070169.[0m
[32m[I 2022-04-23 03:13:14,745][0m Trial 910 finished with value: 0.7279368738441019 and parameters: {'n_hidden': 256, 'mixture_components': 6, 'use_sparse_layer': False, 'use_batchnorm': True, 'use_dropout': True, 'dropout': 0.5470398009757674, 'mlp_size_1': 0, 'mlp_size_2': 5, 'mlp_size_3': 0, 'kernel': 'LogLogistic', 'loss_name': 'CensoredNLLLoss'}. Best is trial 22 with value: 0.8433318468070169.[0m
[32m[I 2022-04-23 03:15:47,159][0m Trial 911 finished with value: 0.7378514879284017 and parameters: {'n_hidden': 256, 'mixture_components': 6, 'use_sparse_layer': False, 'use_batchnorm': True, 'use_dropout': True, 'dropout': 0.5838592348598638, 'mlp_size_1': 0, 'mlp_size_2': 5, 'mlp_size_3': 0, 'kernel': 'LogLogistic', 'loss_name': 'CensoredNLLLoss'}. Best is trial 22 with value: 0.8433318468070169.[0m
[32m[I 2022-04-23 03:18:26,842][0m Trial 912 finished with value: 0.8289470138981162 and parameters: {'n_hidden': 256, 'mixture_components': 6, 'use_sparse_layer': False, 'use_batchnorm': True, 'use_dropout': True, 'dropout': 0.6197285328781187, 'mlp_size_1': 0, 'mlp_size_2': 5, 'mlp_size_3': 0, 'kernel': 'LogLogistic', 'loss_name': 'CensoredNLLLoss'}. Best is trial 22 with value: 0.8433318468070169.[0m
[32m[I 2022-04-23 03:20:55,221][0m Trial 913 finished with value: 0.7293863883906628 and parameters: {'n_hidden': 256, 'mixture_components': 6, 'use_sparse_layer': False, 'use_batchnorm': True, 'use_dropout': True, 'dropout': 0.17460404412096006, 'mlp_size_1': 0, 'mlp_size_2': 5, 'mlp_size_3': 0, 'kernel': 'LogLogistic', 'loss_name': 'CensoredNLLLoss'}. Best is trial 22 with value: 0.8433318468070169.[0m
[32m[I 2022-04-23 03:23:24,108][0m Trial 914 finished with value: 0.8276603468783259 and parameters: {'n_hidden': 256, 'mixture_components': 6, 'use_sparse_layer': False, 'use_batchnorm': True, 'use_dropout': True, 'dropout': 0.6106861914104588, 'mlp_size_1': 0, 'mlp_size_2': 5, 'mlp_size_3': 0, 'kernel': 'LogLogistic', 'loss_name': 'CensoredNLLLoss'}. Best is trial 22 with value: 0.8433318468070169.[0m
[32m[I 2022-04-23 03:26:05,575][0m Trial 915 finished with value: 0.832063850028528 and parameters: {'n_hidden': 256, 'mixture_components': 8, 'use_sparse_layer': False, 'use_batchnorm': True, 'use_dropout': True, 'dropout': 0.5862508258483893, 'mlp_size_1': 0, 'mlp_size_2': 5, 'mlp_size_3': 0, 'kernel': 'LogLogistic', 'loss_name': 'CensoredNLLLoss'}. Best is trial 22 with value: 0.8433318468070169.[0m
[32m[I 2022-04-23 03:28:26,086][0m Trial 916 finished with value: 0.6330521627226772 and parameters: {'n_hidden': 256, 'mixture_components': 6, 'use_sparse_layer': False, 'use_batchnorm': True, 'use_dropout': True, 'dropout': 0.10132789614124794, 'mlp_size_1': 0, 'mlp_size_2': 5, 'mlp_size_3': 0, 'kernel': 'LogLogistic', 'loss_name': 'CensoredNLLLoss'}. Best is trial 22 with value: 0.8433318468070169.[0m
[32m[I 2022-04-23 03:31:10,054][0m Trial 917 finished with value: 0.411875035393287 and parameters: {'n_hidden': 1024, 'mixture_components': 6, 'use_sparse_layer': False, 'use_batchnorm': True, 'use_dropout': True, 'dropout': 0.6276930664128251, 'mlp_size_1': 5, 'mlp_size_2': 2, 'mlp_size_3': 0, 'kernel': 'LogLogistic', 'loss_name': 'CensoredNLLLoss'}. Best is trial 22 with value: 0.8433318468070169.[0m
[32m[I 2022-04-23 03:33:40,783][0m Trial 918 finished with value: 0.7353633660594369 and parameters: {'n_hidden': 256, 'mixture_components': 6, 'use_sparse_layer': False, 'use_batchnorm': True, 'use_dropout': True, 'dropout': 0.5629829812541123, 'mlp_size_1': 0, 'mlp_size_2': 5, 'mlp_size_3': 0, 'kernel': 'LogLogistic', 'loss_name': 'CensoredNLLLoss'}. Best is trial 22 with value: 0.8433318468070169.[0m
[32m[I 2022-04-23 03:36:26,179][0m Trial 919 finished with value: 0.8325384677285147 and parameters: {'n_hidden': 256, 'mixture_components': 7, 'use_sparse_layer': False, 'use_batchnorm': True, 'use_dropout': True, 'dropout': 0.5998631410333437, 'mlp_size_1': 0, 'mlp_size_2': 5, 'mlp_size_3': 0, 'kernel': 'LogLogistic', 'loss_name': 'AlternativeNLLLoss'}. Best is trial 22 with value: 0.8433318468070169.[0m
[32m[I 2022-04-23 03:37:14,167][0m Trial 920 finished with value: -0.5 and parameters: {'n_hidden': 256, 'mixture_components': 4, 'use_sparse_layer': False, 'use_batchnorm': True, 'use_dropout': True, 'dropout': 0.6391728880541858, 'mlp_size_1': 0, 'mlp_size_2': 5, 'mlp_size_3': 0, 'kernel': 'Gumbel', 'loss_name': 'CensoredNLLLoss'}. Best is trial 22 with value: 0.8433318468070169.[0m
[32m[I 2022-04-23 03:39:34,172][0m Trial 921 finished with value: 0.3231996466931597 and parameters: {'n_hidden': 256, 'mixture_components': 6, 'use_sparse_layer': False, 'use_batchnorm': True, 'use_dropout': True, 'dropout': 0.5972040575559714, 'mlp_size_1': 3, 'mlp_size_2': 2, 'mlp_size_3': 0, 'kernel': 'LogLogistic', 'loss_name': 'CensoredNLLLoss'}. Best is trial 22 with value: 0.8433318468070169.[0m
[32m[I 2022-04-23 03:42:03,707][0m Trial 922 finished with value: 0.8369082572601204 and parameters: {'n_hidden': 256, 'mixture_components': 4, 'use_sparse_layer': False, 'use_batchnorm': True, 'use_dropout': True, 'dropout': 0.6223741367278397, 'mlp_size_1': 0, 'mlp_size_2': 5, 'mlp_size_3': 0, 'kernel': 'LogLogistic', 'loss_name': 'CensoredNLLLoss'}. Best is trial 22 with value: 0.8433318468070169.[0m
[32m[I 2022-04-23 03:44:48,329][0m Trial 923 finished with value: 0.5273435722543945 and parameters: {'n_hidden': 256, 'mixture_components': 4, 'use_sparse_layer': False, 'use_batchnorm': True, 'use_dropout': True, 'dropout': 0.6189932660787506, 'mlp_size_1': 3, 'mlp_size_2': 2, 'mlp_size_3': 0, 'kernel': 'LogLogistic', 'loss_name': 'CensoredNLLLoss'}. Best is trial 22 with value: 0.8433318468070169.[0m
[32m[I 2022-04-23 03:47:20,749][0m Trial 924 finished with value: 0.7424752306272107 and parameters: {'n_hidden': 256, 'mixture_components': 4, 'use_sparse_layer': False, 'use_batchnorm': True, 'use_dropout': True, 'dropout': 0.6246579848912512, 'mlp_size_1': 0, 'mlp_size_2': 5, 'mlp_size_3': 0, 'kernel': 'LogLogistic', 'loss_name': 'CensoredNLLLoss'}. Best is trial 22 with value: 0.8433318468070169.[0m
[32m[I 2022-04-23 03:49:50,981][0m Trial 925 finished with value: 0.7338105357249046 and parameters: {'n_hidden': 256, 'mixture_components': 4, 'use_sparse_layer': False, 'use_batchnorm': True, 'use_dropout': True, 'dropout': 0.5828168100492166, 'mlp_size_1': 0, 'mlp_size_2': 5, 'mlp_size_3': 0, 'kernel': 'LogLogistic', 'loss_name': 'CensoredNLLLoss'}. Best is trial 22 with value: 0.8433318468070169.[0m
[32m[I 2022-04-23 03:52:16,618][0m Trial 926 finished with value: 0.8344485413067322 and parameters: {'n_hidden': 256, 'mixture_components': 4, 'use_sparse_layer': False, 'use_batchnorm': True, 'use_dropout': True, 'dropout': 0.6010488131895536, 'mlp_size_1': 0, 'mlp_size_2': 5, 'mlp_size_3': 0, 'kernel': 'LogLogistic', 'loss_name': 'CensoredNLLLoss'}. Best is trial 22 with value: 0.8433318468070169.[0m
[32m[I 2022-04-23 03:54:42,842][0m Trial 927 finished with value: 0.8369108932157152 and parameters: {'n_hidden': 256, 'mixture_components': 4, 'use_sparse_layer': False, 'use_batchnorm': True, 'use_dropout': True, 'dropout': 0.6284944820060783, 'mlp_size_1': 0, 'mlp_size_2': 5, 'mlp_size_3': 0, 'kernel': 'LogLogistic', 'loss_name': 'CensoredNLLLoss'}. Best is trial 22 with value: 0.8433318468070169.[0m
[32m[I 2022-04-23 03:57:15,013][0m Trial 928 finished with value: 0.8344299928898671 and parameters: {'n_hidden': 256, 'mixture_components': 4, 'use_sparse_layer': False, 'use_batchnorm': True, 'use_dropout': True, 'dropout': 0.574103786813819, 'mlp_size_1': 0, 'mlp_size_2': 5, 'mlp_size_3': 0, 'kernel': 'LogLogistic', 'loss_name': 'CensoredNLLLoss'}. Best is trial 22 with value: 0.8433318468070169.[0m
[32m[I 2022-04-23 03:59:54,716][0m Trial 929 finished with value: 0.7261374357938025 and parameters: {'n_hidden': 256, 'mixture_components': 4, 'use_sparse_layer': False, 'use_batchnorm': True, 'use_dropout': True, 'dropout': 0.6362536021782301, 'mlp_size_1': 0, 'mlp_size_2': 5, 'mlp_size_3': 0, 'kernel': 'LogLogistic', 'loss_name': 'CensoredNLLLoss'}. Best is trial 22 with value: 0.8433318468070169.[0m
