[32m[I 2022-04-22 19:59:25,343][0m Trial 274 finished with value: -0.6658089089644843 and parameters: {'n_hidden': 1024, 'mixture_components': 2, 'use_sparse_layer': False, 'use_batchnorm': False, 'use_dropout': False, 'mlp_size_1': 6, 'mlp_size_2': 0, 'mlp_size_3': 1, 'kernel': 'Exponential', 'loss_name': 'AlternativeNLLLoss'}. Best is trial 164 with value: 0.7011621788753918.[0m
[32m[I 2022-04-22 20:00:32,460][0m Trial 275 finished with value: 0.6840534372221638 and parameters: {'n_hidden': 1024, 'mixture_components': 3, 'use_sparse_layer': False, 'use_batchnorm': False, 'use_dropout': False, 'mlp_size_1': 6, 'mlp_size_2': 0, 'mlp_size_3': 1, 'kernel': 'Logistic', 'loss_name': 'AlternativeNLLLoss'}. Best is trial 164 with value: 0.7011621788753918.[0m
[32m[I 2022-04-22 20:01:26,152][0m Trial 276 finished with value: 0.6872185032956569 and parameters: {'n_hidden': 1024, 'mixture_components': 3, 'use_sparse_layer': False, 'use_batchnorm': False, 'use_dropout': False, 'mlp_size_1': 6, 'mlp_size_2': 0, 'mlp_size_3': 1, 'kernel': 'Logistic', 'loss_name': 'CensoredNLLLoss'}. Best is trial 164 with value: 0.7011621788753918.[0m
[32m[I 2022-04-22 20:02:27,856][0m Trial 277 finished with value: 0.6756579680059034 and parameters: {'n_hidden': 1024, 'mixture_components': 3, 'use_sparse_layer': False, 'use_batchnorm': False, 'use_dropout': False, 'mlp_size_1': 6, 'mlp_size_2': 0, 'mlp_size_3': 1, 'kernel': 'Gumbel', 'loss_name': 'AlternativeNLLLoss'}. Best is trial 164 with value: 0.7011621788753918.[0m
[32m[I 2022-04-22 20:03:25,138][0m Trial 278 finished with value: 0.6859425580479728 and parameters: {'n_hidden': 1024, 'mixture_components': 1, 'use_sparse_layer': False, 'use_batchnorm': False, 'use_dropout': False, 'mlp_size_1': 6, 'mlp_size_2': 0, 'mlp_size_3': 1, 'kernel': 'Gumbel', 'loss_name': 'AlternativeNLLLoss'}. Best is trial 164 with value: 0.7011621788753918.[0m
[32m[I 2022-04-22 20:04:35,082][0m Trial 279 finished with value: 0.6725674971283984 and parameters: {'n_hidden': 1024, 'mixture_components': 2, 'use_sparse_layer': True, 'use_sparse_loss': True, 'lmbd': 0.000321970128441713, 'use_batchnorm': False, 'use_dropout': False, 'mlp_size_1': 6, 'mlp_size_2': 0, 'mlp_size_3': 1, 'kernel': 'Logistic', 'loss_name': 'AlternativeNLLLoss'}. Best is trial 164 with value: 0.7011621788753918.[0m
[32m[I 2022-04-22 20:05:14,779][0m Trial 280 finished with value: 0.680128859780119 and parameters: {'n_hidden': 1024, 'mixture_components': 3, 'use_sparse_layer': False, 'use_batchnorm': False, 'use_dropout': False, 'mlp_size_1': 6, 'mlp_size_2': 0, 'mlp_size_3': 1, 'kernel': 'Gumbel', 'loss_name': 'NLLLoss'}. Best is trial 164 with value: 0.7011621788753918.[0m
[32m[I 2022-04-22 20:06:04,897][0m Trial 281 finished with value: 0.68565200863857 and parameters: {'n_hidden': 2048, 'mixture_components': 3, 'use_sparse_layer': False, 'use_batchnorm': False, 'use_dropout': False, 'mlp_size_1': 5, 'mlp_size_2': 2, 'mlp_size_3': 1, 'kernel': 'Normal', 'loss_name': 'NLLLoss'}. Best is trial 164 with value: 0.7011621788753918.[0m
[32m[I 2022-04-22 20:07:15,284][0m Trial 282 finished with value: 0.6845184965591746 and parameters: {'n_hidden': 1024, 'mixture_components': 3, 'use_sparse_layer': False, 'use_batchnorm': False, 'use_dropout': False, 'mlp_size_1': 6, 'mlp_size_2': 0, 'mlp_size_3': 1, 'kernel': 'Normal', 'loss_name': 'CensoredNLLLoss'}. Best is trial 164 with value: 0.7011621788753918.[0m
[32m[I 2022-04-22 20:07:55,562][0m Trial 283 finished with value: 0.6829645501169074 and parameters: {'n_hidden': 1024, 'mixture_components': 10, 'use_sparse_layer': False, 'use_batchnorm': False, 'use_dropout': False, 'mlp_size_1': 6, 'mlp_size_2': 0, 'mlp_size_3': 1, 'kernel': 'Gumbel', 'loss_name': 'NLLLoss'}. Best is trial 164 with value: 0.7011621788753918.[0m
[32m[I 2022-04-22 20:08:54,965][0m Trial 284 finished with value: 0.6772754328963491 and parameters: {'n_hidden': 512, 'mixture_components': 2, 'use_sparse_layer': False, 'use_batchnorm': False, 'use_dropout': False, 'mlp_size_1': 6, 'mlp_size_2': 0, 'mlp_size_3': 0, 'kernel': 'Normal', 'loss_name': 'NLLLoss'}. Best is trial 164 with value: 0.7011621788753918.[0m
[32m[I 2022-04-22 20:09:34,978][0m Trial 285 finished with value: 0.6818836274055349 and parameters: {'n_hidden': 1024, 'mixture_components': 3, 'use_sparse_layer': False, 'use_batchnorm': False, 'use_dropout': False, 'mlp_size_1': 6, 'mlp_size_2': 0, 'mlp_size_3': 1, 'kernel': 'Logistic', 'loss_name': 'NLLLoss'}. Best is trial 164 with value: 0.7011621788753918.[0m
[32m[I 2022-04-22 20:10:18,998][0m Trial 286 finished with value: 0.6811555165973407 and parameters: {'n_hidden': 1024, 'mixture_components': 3, 'use_sparse_layer': False, 'use_batchnorm': False, 'use_dropout': True, 'dropout': 0.5154772567468175, 'mlp_size_1': 6, 'mlp_size_2': 0, 'mlp_size_3': 1, 'kernel': 'Gumbel', 'loss_name': 'NLLLoss'}. Best is trial 164 with value: 0.7011621788753918.[0m
[32m[I 2022-04-22 20:11:21,979][0m Trial 287 finished with value: 0.6685161427374448 and parameters: {'n_hidden': 32, 'mixture_components': 1, 'use_sparse_layer': False, 'use_batchnorm': False, 'use_dropout': False, 'mlp_size_1': 2, 'mlp_size_2': 0, 'mlp_size_3': 0, 'kernel': 'Normal', 'loss_name': 'AlternativeNLLLoss'}. Best is trial 164 with value: 0.7011621788753918.[0m
[32m[I 2022-04-22 20:11:57,283][0m Trial 288 finished with value: 0.6781581904950126 and parameters: {'n_hidden': 1024, 'mixture_components': 3, 'use_sparse_layer': False, 'use_batchnorm': False, 'use_dropout': False, 'mlp_size_1': 7, 'mlp_size_2': 0, 'mlp_size_3': 0, 'kernel': 'Exponential', 'loss_name': 'NLLLoss'}. Best is trial 164 with value: 0.7011621788753918.[0m
[32m[I 2022-04-22 20:12:59,164][0m Trial 289 finished with value: 0.6754330966471589 and parameters: {'n_hidden': 128, 'mixture_components': 2, 'use_sparse_layer': False, 'use_batchnorm': False, 'use_dropout': False, 'mlp_size_1': 4, 'mlp_size_2': 0, 'mlp_size_3': 0, 'kernel': 'Gumbel', 'loss_name': 'NLLLoss'}. Best is trial 164 with value: 0.7011621788753918.[0m
[32m[I 2022-04-22 20:14:27,811][0m Trial 290 finished with value: 0.6340855337208485 and parameters: {'n_hidden': 1024, 'mixture_components': 3, 'use_sparse_layer': True, 'use_sparse_loss': False, 'use_batchnorm': True, 'use_dropout': False, 'mlp_size_1': 7, 'mlp_size_2': 0, 'mlp_size_3': 0, 'kernel': 'Normal', 'loss_name': 'NLLLoss'}. Best is trial 164 with value: 0.7011621788753918.[0m
[32m[I 2022-04-22 20:15:14,881][0m Trial 291 finished with value: 0.6359704737314684 and parameters: {'n_hidden': 1024, 'mixture_components': 1, 'use_sparse_layer': False, 'use_batchnorm': False, 'use_dropout': False, 'mlp_size_1': 6, 'mlp_size_2': 0, 'mlp_size_3': 1, 'kernel': 'Normal', 'loss_name': 'NLLLoss'}. Best is trial 164 with value: 0.7011621788753918.[0m
[32m[I 2022-04-22 20:16:20,477][0m Trial 292 finished with value: 0.6678923845571497 and parameters: {'n_hidden': 256, 'mixture_components': 3, 'use_sparse_layer': False, 'use_batchnorm': False, 'use_dropout': False, 'mlp_size_1': 5, 'mlp_size_2': 0, 'mlp_size_3': 0, 'kernel': 'Gumbel', 'loss_name': 'AlternativeNLLLoss'}. Best is trial 164 with value: 0.7011621788753918.[0m
[32m[I 2022-04-22 20:17:09,351][0m Trial 293 finished with value: 0.6924174695623112 and parameters: {'n_hidden': 1024, 'mixture_components': 3, 'use_sparse_layer': False, 'use_batchnorm': False, 'use_dropout': False, 'mlp_size_1': 7, 'mlp_size_2': 0, 'mlp_size_3': 0, 'kernel': 'Logistic', 'loss_name': 'NLLLoss'}. Best is trial 164 with value: 0.7011621788753918.[0m
[32m[I 2022-04-22 20:18:17,380][0m Trial 294 finished with value: 0.6785548252901056 and parameters: {'n_hidden': 1024, 'mixture_components': 2, 'use_sparse_layer': False, 'use_batchnorm': False, 'use_dropout': False, 'mlp_size_1': 7, 'mlp_size_2': 0, 'mlp_size_3': 0, 'kernel': 'Normal', 'loss_name': 'NLLLoss'}. Best is trial 164 with value: 0.7011621788753918.[0m
[32m[I 2022-04-22 20:18:56,873][0m Trial 295 finished with value: 0.6787295865231358 and parameters: {'n_hidden': 1024, 'mixture_components': 9, 'use_sparse_layer': False, 'use_batchnorm': False, 'use_dropout': False, 'mlp_size_1': 7, 'mlp_size_2': 0, 'mlp_size_3': 0, 'kernel': 'Gumbel', 'loss_name': 'NLLLoss'}. Best is trial 164 with value: 0.7011621788753918.[0m
[32m[I 2022-04-22 20:19:41,372][0m Trial 296 finished with value: 0.6792849184614254 and parameters: {'n_hidden': 1024, 'mixture_components': 3, 'use_sparse_layer': False, 'use_batchnorm': False, 'use_dropout': False, 'mlp_size_1': 7, 'mlp_size_2': 0, 'mlp_size_3': 0, 'kernel': 'Normal', 'loss_name': 'NLLLoss'}. Best is trial 164 with value: 0.7011621788753918.[0m
[32m[I 2022-04-22 20:20:29,210][0m Trial 297 finished with value: 0.6731350993474946 and parameters: {'n_hidden': 1024, 'mixture_components': 3, 'use_sparse_layer': False, 'use_batchnorm': False, 'use_dropout': False, 'mlp_size_1': 7, 'mlp_size_2': 0, 'mlp_size_3': 0, 'kernel': 'Gumbel', 'loss_name': 'NLLLoss'}. Best is trial 164 with value: 0.7011621788753918.[0m
[32m[I 2022-04-22 20:21:04,614][0m Trial 298 finished with value: 0.6863861050506606 and parameters: {'n_hidden': 1024, 'mixture_components': 1, 'use_sparse_layer': False, 'use_batchnorm': False, 'use_dropout': False, 'mlp_size_1': 7, 'mlp_size_2': 0, 'mlp_size_3': 0, 'kernel': 'Normal', 'loss_name': 'NLLLoss'}. Best is trial 164 with value: 0.7011621788753918.[0m
[32m[I 2022-04-22 20:21:56,277][0m Trial 299 finished with value: 0.6888154560892551 and parameters: {'n_hidden': 64, 'mixture_components': 3, 'use_sparse_layer': False, 'use_batchnorm': False, 'use_dropout': False, 'mlp_size_1': 3, 'mlp_size_2': 0, 'mlp_size_3': 0, 'kernel': 'Logistic', 'loss_name': 'NLLLoss'}. Best is trial 164 with value: 0.7011621788753918.[0m
[32m[I 2022-04-22 20:22:35,055][0m Trial 300 finished with value: 0.6725422439524479 and parameters: {'n_hidden': 512, 'mixture_components': 10, 'use_sparse_layer': False, 'use_batchnorm': False, 'use_dropout': False, 'mlp_size_1': 6, 'mlp_size_2': 0, 'mlp_size_3': 0, 'kernel': 'Normal', 'loss_name': 'NLLLoss'}. Best is trial 164 with value: 0.7011621788753918.[0m
[32m[I 2022-04-22 20:23:17,543][0m Trial 301 finished with value: 0.6910627904475537 and parameters: {'n_hidden': 1024, 'mixture_components': 2, 'use_sparse_layer': False, 'use_batchnorm': False, 'use_dropout': False, 'mlp_size_1': 7, 'mlp_size_2': 0, 'mlp_size_3': 0, 'kernel': 'Gumbel', 'loss_name': 'NLLLoss'}. Best is trial 164 with value: 0.7011621788753918.[0m
[32m[I 2022-04-22 20:24:13,847][0m Trial 302 finished with value: 0.6872323417813047 and parameters: {'n_hidden': 1024, 'mixture_components': 2, 'use_sparse_layer': True, 'use_sparse_loss': True, 'lmbd': 5.8078593705306235e-06, 'use_batchnorm': False, 'use_dropout': False, 'mlp_size_1': 1, 'mlp_size_2': 1, 'mlp_size_3': 3, 'kernel': 'Gumbel', 'loss_name': 'NLLLoss'}. Best is trial 164 with value: 0.7011621788753918.[0m
[32m[I 2022-04-22 20:25:01,883][0m Trial 303 finished with value: 0.6909604813497779 and parameters: {'n_hidden': 1024, 'mixture_components': 2, 'use_sparse_layer': False, 'use_batchnorm': False, 'use_dropout': False, 'mlp_size_1': 7, 'mlp_size_2': 0, 'mlp_size_3': 0, 'kernel': 'Gumbel', 'loss_name': 'NLLLoss'}. Best is trial 164 with value: 0.7011621788753918.[0m
[32m[I 2022-04-22 20:25:42,465][0m Trial 304 finished with value: 0.6889964823520981 and parameters: {'n_hidden': 1024, 'mixture_components': 2, 'use_sparse_layer': False, 'use_batchnorm': False, 'use_dropout': False, 'mlp_size_1': 7, 'mlp_size_2': 0, 'mlp_size_3': 0, 'kernel': 'Gumbel', 'loss_name': 'NLLLoss'}. Best is trial 164 with value: 0.7011621788753918.[0m
[32m[I 2022-04-22 20:26:20,631][0m Trial 305 finished with value: 0.6789691123347665 and parameters: {'n_hidden': 128, 'mixture_components': 2, 'use_sparse_layer': False, 'use_batchnorm': False, 'use_dropout': True, 'dropout': 0.33130103886952644, 'mlp_size_1': 4, 'mlp_size_2': 0, 'mlp_size_3': 0, 'kernel': 'Gumbel', 'loss_name': 'NLLLoss'}. Best is trial 164 with value: 0.7011621788753918.[0m
[32m[I 2022-04-22 20:27:05,318][0m Trial 306 finished with value: 0.6783755749344779 and parameters: {'n_hidden': 1024, 'mixture_components': 3, 'use_sparse_layer': False, 'use_batchnorm': False, 'use_dropout': False, 'mlp_size_1': 7, 'mlp_size_2': 0, 'mlp_size_3': 0, 'kernel': 'Gumbel', 'loss_name': 'NLLLoss'}. Best is trial 164 with value: 0.7011621788753918.[0m
[32m[I 2022-04-22 20:27:46,601][0m Trial 307 finished with value: 0.6437221654626077 and parameters: {'n_hidden': 1024, 'mixture_components': 2, 'use_sparse_layer': False, 'use_batchnorm': False, 'use_dropout': False, 'mlp_size_1': 7, 'mlp_size_2': 0, 'mlp_size_3': 0, 'kernel': 'Gumbel', 'loss_name': 'NLLLoss'}. Best is trial 164 with value: 0.7011621788753918.[0m
[32m[I 2022-04-22 20:28:34,373][0m Trial 308 finished with value: 0.682631187365151 and parameters: {'n_hidden': 1024, 'mixture_components': 3, 'use_sparse_layer': False, 'use_batchnorm': False, 'use_dropout': False, 'mlp_size_1': 7, 'mlp_size_2': 0, 'mlp_size_3': 0, 'kernel': 'Gumbel', 'loss_name': 'NLLLoss'}. Best is trial 164 with value: 0.7011621788753918.[0m
[32m[I 2022-04-22 20:29:40,350][0m Trial 309 finished with value: 0.679968499637187 and parameters: {'n_hidden': 1024, 'mixture_components': 1, 'use_sparse_layer': False, 'use_batchnorm': False, 'use_dropout': False, 'mlp_size_1': 7, 'mlp_size_2': 0, 'mlp_size_3': 0, 'kernel': 'Logistic', 'loss_name': 'NLLLoss'}. Best is trial 164 with value: 0.7011621788753918.[0m
[32m[I 2022-04-22 20:30:33,879][0m Trial 310 finished with value: 0.6021891528215598 and parameters: {'n_hidden': 2048, 'mixture_components': 3, 'use_sparse_layer': False, 'use_batchnorm': True, 'use_dropout': False, 'mlp_size_1': 7, 'mlp_size_2': 0, 'mlp_size_3': 1, 'kernel': 'Gumbel', 'loss_name': 'CensoredNLLLoss'}. Best is trial 164 with value: 0.7011621788753918.[0m
[32m[I 2022-04-22 20:31:15,716][0m Trial 311 finished with value: 0.6941542535073351 and parameters: {'n_hidden': 1024, 'mixture_components': 2, 'use_sparse_layer': False, 'use_batchnorm': False, 'use_dropout': False, 'mlp_size_1': 6, 'mlp_size_2': 0, 'mlp_size_3': 1, 'kernel': 'Gumbel', 'loss_name': 'NLLLoss'}. Best is trial 164 with value: 0.7011621788753918.[0m
[32m[I 2022-04-22 20:31:54,758][0m Trial 312 finished with value: 0.6812755273689833 and parameters: {'n_hidden': 1024, 'mixture_components': 3, 'use_sparse_layer': False, 'use_batchnorm': False, 'use_dropout': False, 'mlp_size_1': 6, 'mlp_size_2': 0, 'mlp_size_3': 1, 'kernel': 'Logistic', 'loss_name': 'NLLLoss'}. Best is trial 164 with value: 0.7011621788753918.[0m
[32m[I 2022-04-22 20:32:47,650][0m Trial 313 finished with value: 0.6903575864722388 and parameters: {'n_hidden': 1024, 'mixture_components': 3, 'use_sparse_layer': True, 'use_sparse_loss': True, 'lmbd': 0.03111312628945222, 'use_batchnorm': False, 'use_dropout': False, 'mlp_size_1': 6, 'mlp_size_2': 0, 'mlp_size_3': 1, 'kernel': 'Gumbel', 'loss_name': 'NLLLoss'}. Best is trial 164 with value: 0.7011621788753918.[0m
[32m[I 2022-04-22 20:33:31,844][0m Trial 314 finished with value: 0.6716700438818477 and parameters: {'n_hidden': 1024, 'mixture_components': 2, 'use_sparse_layer': False, 'use_batchnorm': False, 'use_dropout': False, 'mlp_size_1': 6, 'mlp_size_2': 0, 'mlp_size_3': 1, 'kernel': 'Exponential', 'loss_name': 'NLLLoss'}. Best is trial 164 with value: 0.7011621788753918.[0m
[32m[I 2022-04-22 20:34:27,899][0m Trial 315 finished with value: 0.689962129319236 and parameters: {'n_hidden': 1024, 'mixture_components': 1, 'use_sparse_layer': False, 'use_batchnorm': False, 'use_dropout': False, 'mlp_size_1': 6, 'mlp_size_2': 0, 'mlp_size_3': 1, 'kernel': 'Gumbel', 'loss_name': 'NLLLoss'}. Best is trial 164 with value: 0.7011621788753918.[0m
[32m[I 2022-04-22 20:35:11,959][0m Trial 316 finished with value: 0.6384178223668686 and parameters: {'n_hidden': 512, 'mixture_components': 9, 'use_sparse_layer': False, 'use_batchnorm': False, 'use_dropout': False, 'mlp_size_1': 6, 'mlp_size_2': 0, 'mlp_size_3': 0, 'kernel': 'Normal', 'loss_name': 'NLLLoss'}. Best is trial 164 with value: 0.7011621788753918.[0m
[32m[I 2022-04-22 20:35:58,177][0m Trial 317 finished with value: 0.6906641263276672 and parameters: {'n_hidden': 1024, 'mixture_components': 3, 'use_sparse_layer': False, 'use_batchnorm': False, 'use_dropout': False, 'mlp_size_1': 6, 'mlp_size_2': 0, 'mlp_size_3': 1, 'kernel': 'Logistic', 'loss_name': 'NLLLoss'}. Best is trial 164 with value: 0.7011621788753918.[0m
[32m[I 2022-04-22 20:36:52,212][0m Trial 318 finished with value: 0.6813987398571852 and parameters: {'n_hidden': 32, 'mixture_components': 3, 'use_sparse_layer': False, 'use_batchnorm': False, 'use_dropout': False, 'mlp_size_1': 2, 'mlp_size_2': 0, 'mlp_size_3': 0, 'kernel': 'Gumbel', 'loss_name': 'NLLLoss'}. Best is trial 164 with value: 0.7011621788753918.[0m
[32m[I 2022-04-22 20:37:37,535][0m Trial 319 finished with value: 0.7002944202414662 and parameters: {'n_hidden': 1024, 'mixture_components': 2, 'use_sparse_layer': False, 'use_batchnorm': False, 'use_dropout': False, 'mlp_size_1': 6, 'mlp_size_2': 0, 'mlp_size_3': 1, 'kernel': 'Normal', 'loss_name': 'NLLLoss'}. Best is trial 164 with value: 0.7011621788753918.[0m
[32m[I 2022-04-22 20:38:17,982][0m Trial 320 finished with value: 0.6675566525503921 and parameters: {'n_hidden': 1024, 'mixture_components': 2, 'use_sparse_layer': False, 'use_batchnorm': False, 'use_dropout': False, 'mlp_size_1': 0, 'mlp_size_2': 4, 'mlp_size_3': 2, 'kernel': 'Normal', 'loss_name': 'NLLLoss'}. Best is trial 164 with value: 0.7011621788753918.[0m
[32m[I 2022-04-22 20:39:15,186][0m Trial 321 finished with value: 0.6795957587422922 and parameters: {'n_hidden': 128, 'mixture_components': 2, 'use_sparse_layer': False, 'use_batchnorm': False, 'use_dropout': False, 'mlp_size_1': 4, 'mlp_size_2': 0, 'mlp_size_3': 0, 'kernel': 'Gumbel', 'loss_name': 'NLLLoss'}. Best is trial 164 with value: 0.7011621788753918.[0m
[32m[I 2022-04-22 20:40:01,964][0m Trial 322 finished with value: 0.6928489951218318 and parameters: {'n_hidden': 256, 'mixture_components': 2, 'use_sparse_layer': False, 'use_batchnorm': False, 'use_dropout': False, 'mlp_size_1': 5, 'mlp_size_2': 0, 'mlp_size_3': 0, 'kernel': 'Normal', 'loss_name': 'NLLLoss'}. Best is trial 164 with value: 0.7011621788753918.[0m
[32m[I 2022-04-22 20:40:40,145][0m Trial 323 finished with value: 0.6406710660961951 and parameters: {'n_hidden': 256, 'mixture_components': 2, 'use_sparse_layer': False, 'use_batchnorm': False, 'use_dropout': False, 'mlp_size_1': 5, 'mlp_size_2': 0, 'mlp_size_3': 0, 'kernel': 'Normal', 'loss_name': 'NLLLoss'}. Best is trial 164 with value: 0.7011621788753918.[0m
[32m[I 2022-04-22 20:41:27,322][0m Trial 324 finished with value: 0.6725340811344577 and parameters: {'n_hidden': 256, 'mixture_components': 2, 'use_sparse_layer': False, 'use_batchnorm': False, 'use_dropout': False, 'mlp_size_1': 5, 'mlp_size_2': 0, 'mlp_size_3': 0, 'kernel': 'Normal', 'loss_name': 'NLLLoss'}. Best is trial 164 with value: 0.7011621788753918.[0m
[32m[I 2022-04-22 20:42:09,159][0m Trial 325 finished with value: 0.6729723090441472 and parameters: {'n_hidden': 256, 'mixture_components': 2, 'use_sparse_layer': True, 'use_sparse_loss': False, 'use_batchnorm': False, 'use_dropout': False, 'mlp_size_1': 5, 'mlp_size_2': 0, 'mlp_size_3': 0, 'kernel': 'Normal', 'loss_name': 'NLLLoss'}. Best is trial 164 with value: 0.7011621788753918.[0m
[32m[I 2022-04-22 20:42:52,939][0m Trial 326 finished with value: 0.6895217958304134 and parameters: {'n_hidden': 256, 'mixture_components': 2, 'use_sparse_layer': False, 'use_batchnorm': False, 'use_dropout': True, 'dropout': 0.6855523347960927, 'mlp_size_1': 5, 'mlp_size_2': 0, 'mlp_size_3': 0, 'kernel': 'Normal', 'loss_name': 'NLLLoss'}. Best is trial 164 with value: 0.7011621788753918.[0m
[32m[I 2022-04-22 20:43:46,020][0m Trial 327 finished with value: 0.6847389067438379 and parameters: {'n_hidden': 1024, 'mixture_components': 2, 'use_sparse_layer': False, 'use_batchnorm': False, 'use_dropout': False, 'mlp_size_1': 6, 'mlp_size_2': 0, 'mlp_size_3': 1, 'kernel': 'Normal', 'loss_name': 'NLLLoss'}. Best is trial 164 with value: 0.7011621788753918.[0m
[32m[I 2022-04-22 20:44:27,700][0m Trial 328 finished with value: 0.6948107371285565 and parameters: {'n_hidden': 1024, 'mixture_components': 2, 'use_sparse_layer': False, 'use_batchnorm': False, 'use_dropout': False, 'mlp_size_1': 6, 'mlp_size_2': 0, 'mlp_size_3': 1, 'kernel': 'Normal', 'loss_name': 'NLLLoss'}. Best is trial 164 with value: 0.7011621788753918.[0m
[32m[I 2022-04-22 20:45:07,192][0m Trial 329 finished with value: 0.6830381503339576 and parameters: {'n_hidden': 1024, 'mixture_components': 2, 'use_sparse_layer': False, 'use_batchnorm': False, 'use_dropout': False, 'mlp_size_1': 6, 'mlp_size_2': 0, 'mlp_size_3': 1, 'kernel': 'Normal', 'loss_name': 'NLLLoss'}. Best is trial 164 with value: 0.7011621788753918.[0m
[32m[I 2022-04-22 20:46:41,651][0m Trial 330 finished with value: 0.6409086666102848 and parameters: {'n_hidden': 256, 'mixture_components': 2, 'use_sparse_layer': False, 'use_batchnorm': True, 'use_dropout': False, 'mlp_size_1': 5, 'mlp_size_2': 0, 'mlp_size_3': 0, 'kernel': 'Normal', 'loss_name': 'NLLLoss'}. Best is trial 164 with value: 0.7011621788753918.[0m
[32m[I 2022-04-22 20:47:28,485][0m Trial 331 finished with value: 0.6799738003089951 and parameters: {'n_hidden': 256, 'mixture_components': 2, 'use_sparse_layer': False, 'use_batchnorm': False, 'use_dropout': False, 'mlp_size_1': 5, 'mlp_size_2': 0, 'mlp_size_3': 0, 'kernel': 'Normal', 'loss_name': 'NLLLoss'}. Best is trial 164 with value: 0.7011621788753918.[0m
