[32m[I 2022-04-21 11:38:35,551][0m Trial 273 finished with value: 0.8080787351015702 and parameters: {'splitter': 'best', 'min_samples_split': 0.1107002442195261, 'min_samples_leaf': 0.038472024988547154, 'min_weight_fraction_leaf': 0.02622147072894113, 'max_features': 0.3336846569118799}. Best is trial 208 with value: 0.8264270922211081.[0m
/media/san2_ssd/data/Workdir/survival/utils.py:305: RuntimeWarning: invalid value encountered in true_divide
  pdfs = np.gradient(1-survs,axis=1)/norms
/media/san2_ssd/data/Workdir/survival/utils.py:305: RuntimeWarning: invalid value encountered in true_divide
  pdfs = np.gradient(1-survs,axis=1)/norms
[32m[I 2022-04-21 11:38:35,916][0m Trial 274 finished with value: 0.8250200820814142 and parameters: {'splitter': 'best', 'min_samples_split': 0.08148945156500517, 'min_samples_leaf': 0.011191171023478424, 'min_weight_fraction_leaf': 0.009252253138195977, 'max_features': 0.44230332150001045}. Best is trial 208 with value: 0.8264270922211081.[0m
[32m[I 2022-04-21 11:38:36,372][0m Trial 275 finished with value: 0.8129756092296226 and parameters: {'splitter': 'best', 'min_samples_split': 0.08168388095850222, 'min_samples_leaf': 0.009780725019966394, 'min_weight_fraction_leaf': 0.009295243876538996, 'max_features': 0.47067286695238625}. Best is trial 208 with value: 0.8264270922211081.[0m
/media/san2_ssd/data/Workdir/survival/utils.py:305: RuntimeWarning: invalid value encountered in true_divide
  pdfs = np.gradient(1-survs,axis=1)/norms
/media/san2_ssd/data/Workdir/survival/utils.py:305: RuntimeWarning: invalid value encountered in true_divide
  pdfs = np.gradient(1-survs,axis=1)/norms
/media/san2_ssd/data/Workdir/survival/utils.py:305: RuntimeWarning: invalid value encountered in true_divide
  pdfs = np.gradient(1-survs,axis=1)/norms
[32m[I 2022-04-21 11:38:37,312][0m Trial 276 finished with value: 0.8086352410474864 and parameters: {'splitter': 'best', 'min_samples_split': 0.08708561390176678, 'min_samples_leaf': 0.0015128866586527957, 'min_weight_fraction_leaf': 1.5125076197967588e-05, 'max_features': 0.4056314657760709}. Best is trial 208 with value: 0.8264270922211081.[0m
[32m[I 2022-04-21 11:38:37,631][0m Trial 277 finished with value: 0.8097137102808493 and parameters: {'splitter': 'best', 'min_samples_split': 0.08231582299379199, 'min_samples_leaf': 0.001035788786547213, 'min_weight_fraction_leaf': 0.01659525957046512, 'max_features': 0.3786378258205769}. Best is trial 208 with value: 0.8264270922211081.[0m
/media/san2_ssd/data/Workdir/survival/utils.py:305: RuntimeWarning: invalid value encountered in true_divide
  pdfs = np.gradient(1-survs,axis=1)/norms
[32m[I 2022-04-21 11:38:37,963][0m Trial 278 finished with value: 0.8166260418783164 and parameters: {'splitter': 'best', 'min_samples_split': 0.1249562780861677, 'min_samples_leaf': 0.016339334469385007, 'min_weight_fraction_leaf': 0.010020353598664843, 'max_features': 0.4458281840140449}. Best is trial 208 with value: 0.8264270922211081.[0m
[32m[I 2022-04-21 11:38:38,369][0m Trial 279 finished with value: 0.812503295837471 and parameters: {'splitter': 'best', 'min_samples_split': 0.10212696596507952, 'min_samples_leaf': 0.028670262531374044, 'min_weight_fraction_leaf': 0.01796950690210319, 'max_features': 0.4267704112821539}. Best is trial 208 with value: 0.8264270922211081.[0m
[32m[I 2022-04-21 11:38:38,885][0m Trial 280 finished with value: 0.8112696890406358 and parameters: {'splitter': 'best', 'min_samples_split': 0.14040857706938942, 'min_samples_leaf': 0.012739012289181905, 'min_weight_fraction_leaf': 0.009017913306164244, 'max_features': 0.35943373476009893}. Best is trial 208 with value: 0.8264270922211081.[0m
/media/san2_ssd/data/Workdir/survival/utils.py:305: RuntimeWarning: invalid value encountered in true_divide
  pdfs = np.gradient(1-survs,axis=1)/norms
[32m[I 2022-04-21 11:38:39,232][0m Trial 281 finished with value: 0.8108344640636785 and parameters: {'splitter': 'best', 'min_samples_split': 0.11148611251718166, 'min_samples_leaf': 0.024121107235514423, 'min_weight_fraction_leaf': 0.0232543489618775, 'max_features': 0.3950560411845099}. Best is trial 208 with value: 0.8264270922211081.[0m
[32m[I 2022-04-21 11:38:39,684][0m Trial 282 finished with value: 0.8106641917623436 and parameters: {'splitter': 'best', 'min_samples_split': 0.2408701716505076, 'min_samples_leaf': 0.011184660300359708, 'min_weight_fraction_leaf': 0.01175060001731042, 'max_features': 0.4173749864304896}. Best is trial 208 with value: 0.8264270922211081.[0m
[32m[I 2022-04-21 11:38:39,979][0m Trial 283 finished with value: 0.8024203177790147 and parameters: {'splitter': 'best', 'min_samples_split': 0.0714421716577888, 'min_samples_leaf': 0.03432209486206054, 'min_weight_fraction_leaf': 0.007291100619534858, 'max_features': 0.30577584187277884}. Best is trial 208 with value: 0.8264270922211081.[0m
/media/san2_ssd/data/Workdir/survival/utils.py:305: RuntimeWarning: invalid value encountered in true_divide
  pdfs = np.gradient(1-survs,axis=1)/norms
/media/san2_ssd/data/Workdir/survival/utils.py:305: RuntimeWarning: invalid value encountered in true_divide
  pdfs = np.gradient(1-survs,axis=1)/norms
/media/san2_ssd/data/Workdir/survival/utils.py:305: RuntimeWarning: invalid value encountered in true_divide
  pdfs = np.gradient(1-survs,axis=1)/norms
[32m[I 2022-04-21 11:38:41,516][0m Trial 284 finished with value: 0.8149787271265572 and parameters: {'splitter': 'best', 'min_samples_split': 0.09385031686627646, 'min_samples_leaf': 0.0011675214736634296, 'min_weight_fraction_leaf': 0.0003726501000963365, 'max_features': 0.44928074964018355}. Best is trial 208 with value: 0.8264270922211081.[0m
[32m[I 2022-04-21 11:38:41,862][0m Trial 285 finished with value: 0.8143778259988537 and parameters: {'splitter': 'best', 'min_samples_split': 0.12004959281566947, 'min_samples_leaf': 0.017120317529428292, 'min_weight_fraction_leaf': 0.021832750641894494, 'max_features': 0.3750996843340638}. Best is trial 208 with value: 0.8264270922211081.[0m
[32m[I 2022-04-21 11:38:42,284][0m Trial 286 finished with value: 0.8023526623717097 and parameters: {'splitter': 'best', 'min_samples_split': 0.0823468668343454, 'min_samples_leaf': 0.02614810077496927, 'min_weight_fraction_leaf': 0.04360958559768127, 'max_features': 0.39867129489293257}. Best is trial 208 with value: 0.8264270922211081.[0m
[32m[I 2022-04-21 11:38:42,736][0m Trial 287 finished with value: 0.7960312469405614 and parameters: {'splitter': 'best', 'min_samples_split': 0.10323745313815091, 'min_samples_leaf': 0.009858913563302563, 'min_weight_fraction_leaf': 0.0326715569656877, 'max_features': 0.3410846587737581}. Best is trial 208 with value: 0.8264270922211081.[0m
[32m[I 2022-04-21 11:38:42,876][0m Trial 288 finished with value: 0.5710980350351094 and parameters: {'splitter': 'best', 'min_samples_split': 0.09213106698589382, 'min_samples_leaf': 0.3389872616576811, 'min_weight_fraction_leaf': 0.22998922468973504, 'max_features': 0.4799875390452852}. Best is trial 208 with value: 0.8264270922211081.[0m
[32m[I 2022-04-21 11:38:43,169][0m Trial 289 finished with value: 0.8077002872983245 and parameters: {'splitter': 'best', 'min_samples_split': 0.1352460946491035, 'min_samples_leaf': 0.0558940100306564, 'min_weight_fraction_leaf': 0.0005221690172072455, 'max_features': 0.4277856983859341}. Best is trial 208 with value: 0.8264270922211081.[0m
[32m[I 2022-04-21 11:38:43,593][0m Trial 290 finished with value: 0.7988851852698272 and parameters: {'splitter': 'best', 'min_samples_split': 0.22013745895623604, 'min_samples_leaf': 0.04114022160821588, 'min_weight_fraction_leaf': 0.016190643289570816, 'max_features': 0.35960824589445034}. Best is trial 208 with value: 0.8264270922211081.[0m
/media/san2_ssd/data/Workdir/survival/utils.py:305: RuntimeWarning: invalid value encountered in true_divide
  pdfs = np.gradient(1-survs,axis=1)/norms
/media/san2_ssd/data/Workdir/survival/utils.py:305: RuntimeWarning: invalid value encountered in true_divide
  pdfs = np.gradient(1-survs,axis=1)/norms
[32m[I 2022-04-21 11:38:44,624][0m Trial 291 finished with value: 0.8046782376797971 and parameters: {'splitter': 'best', 'min_samples_split': 0.07301992789484554, 'min_samples_leaf': 0.017067178589064872, 'min_weight_fraction_leaf': 0.023714632902445014, 'max_features': 0.40691557716368837}. Best is trial 208 with value: 0.8264270922211081.[0m
[32m[I 2022-04-21 11:38:45,124][0m Trial 292 finished with value: 0.8202423933272286 and parameters: {'splitter': 'random', 'min_samples_split': 0.1057678736359989, 'min_samples_leaf': 0.02817635272305976, 'min_weight_fraction_leaf': 0.010040985424031357, 'max_features': 0.37874807940371796}. Best is trial 208 with value: 0.8264270922211081.[0m
[32m[I 2022-04-21 11:38:45,728][0m Trial 293 finished with value: 0.8136183683509197 and parameters: {'splitter': 'best', 'min_samples_split': 0.11439254583350844, 'min_samples_leaf': 0.033566157409582215, 'min_weight_fraction_leaf': 0.034167397938787945, 'max_features': 0.37871171630535483}. Best is trial 208 with value: 0.8264270922211081.[0m
[32m[I 2022-04-21 11:38:46,013][0m Trial 294 finished with value: 0.8109760674086225 and parameters: {'splitter': 'random', 'min_samples_split': 0.12787612015916847, 'min_samples_leaf': 0.02553670879831724, 'min_weight_fraction_leaf': 0.0161316365052129, 'max_features': 0.3557109861672707}. Best is trial 208 with value: 0.8264270922211081.[0m
[32m[I 2022-04-21 11:38:46,324][0m Trial 295 finished with value: 0.8056035488804956 and parameters: {'splitter': 'random', 'min_samples_split': 0.1517586779956051, 'min_samples_leaf': 0.009250482428269959, 'min_weight_fraction_leaf': 0.02510979840050833, 'max_features': 0.32466760580945936}. Best is trial 208 with value: 0.8264270922211081.[0m
[32m[I 2022-04-21 11:38:46,446][0m Trial 296 finished with value: 0.5741729088565009 and parameters: {'splitter': 'random', 'min_samples_split': 0.10733249219929626, 'min_samples_leaf': 0.287523122780306, 'min_weight_fraction_leaf': 0.00862030447156581, 'max_features': 0.3854938951111919}. Best is trial 208 with value: 0.8264270922211081.[0m
[32m[I 2022-04-21 11:38:46,578][0m Trial 297 finished with value: 0.8104331991482947 and parameters: {'splitter': 'random', 'min_samples_split': 0.11777358176288641, 'min_samples_leaf': 0.04575090412146866, 'min_weight_fraction_leaf': 0.013996508537258852, 'max_features': 0.3744251220998043}. Best is trial 208 with value: 0.8264270922211081.[0m
[32m[I 2022-04-21 11:38:46,984][0m Trial 298 finished with value: 0.8037651043355114 and parameters: {'splitter': 'best', 'min_samples_split': 0.09904243490553448, 'min_samples_leaf': 0.024002794499466906, 'min_weight_fraction_leaf': 0.00024301877191386378, 'max_features': 0.4067751520968868}. Best is trial 208 with value: 0.8264270922211081.[0m
[32m[I 2022-04-21 11:38:47,170][0m Trial 299 finished with value: 0.7917240764097206 and parameters: {'splitter': 'random', 'min_samples_split': 0.10531519744770326, 'min_samples_leaf': 0.001932586516234687, 'min_weight_fraction_leaf': 0.040013993779912285, 'max_features': 0.3479509738623168}. Best is trial 208 with value: 0.8264270922211081.[0m
[32m[I 2022-04-21 11:38:47,308][0m Trial 300 finished with value: 0.8126267025454572 and parameters: {'splitter': 'random', 'min_samples_split': 0.09480149706004498, 'min_samples_leaf': 0.01570366579031157, 'min_weight_fraction_leaf': 0.02114308868438697, 'max_features': 0.39554057356166084}. Best is trial 208 with value: 0.8264270922211081.[0m
[32m[I 2022-04-21 11:38:47,405][0m Trial 301 finished with value: 0.7754591596643645 and parameters: {'splitter': 'random', 'min_samples_split': 0.1252353825235021, 'min_samples_leaf': 0.1822009736209439, 'min_weight_fraction_leaf': 0.009295914522933336, 'max_features': 0.42122032296215023}. Best is trial 208 with value: 0.8264270922211081.[0m
[32m[I 2022-04-21 11:38:47,702][0m Trial 302 finished with value: 0.7985016707054309 and parameters: {'splitter': 'best', 'min_samples_split': 0.11330116001047418, 'min_samples_leaf': 0.034634847096615115, 'min_weight_fraction_leaf': 0.029463333084689045, 'max_features': 0.3632648243251588}. Best is trial 208 with value: 0.8264270922211081.[0m
/media/san2_ssd/data/Workdir/survival/utils.py:305: RuntimeWarning: invalid value encountered in true_divide
  pdfs = np.gradient(1-survs,axis=1)/norms
[32m[I 2022-04-21 11:38:48,268][0m Trial 303 finished with value: 0.8061061895849087 and parameters: {'splitter': 'best', 'min_samples_split': 0.08810149493934492, 'min_samples_leaf': 0.01116667518200821, 'min_weight_fraction_leaf': 0.01732650301521315, 'max_features': 0.38760410612016694}. Best is trial 208 with value: 0.8264270922211081.[0m
[32m[I 2022-04-21 11:38:48,707][0m Trial 304 finished with value: 0.8227100855358958 and parameters: {'splitter': 'best', 'min_samples_split': 0.10464541932801613, 'min_samples_leaf': 0.024777323321899514, 'min_weight_fraction_leaf': 0.010197858060368326, 'max_features': 0.34216379364848076}. Best is trial 208 with value: 0.8264270922211081.[0m
[32m[I 2022-04-21 11:38:49,041][0m Trial 305 finished with value: 0.8073760468873331 and parameters: {'splitter': 'best', 'min_samples_split': 0.1162949767436512, 'min_samples_leaf': 0.03163895423582412, 'min_weight_fraction_leaf': 0.009003779742190823, 'max_features': 0.3315686323739915}. Best is trial 208 with value: 0.8264270922211081.[0m
/media/san2_ssd/data/Workdir/survival/utils.py:305: RuntimeWarning: invalid value encountered in true_divide
  pdfs = np.gradient(1-survs,axis=1)/norms
[32m[I 2022-04-21 11:38:49,490][0m Trial 306 finished with value: 0.8234062454846299 and parameters: {'splitter': 'best', 'min_samples_split': 0.1350492552746875, 'min_samples_leaf': 0.0014585777982751083, 'min_weight_fraction_leaf': 0.007483026890945344, 'max_features': 0.3054346419682354}. Best is trial 208 with value: 0.8264270922211081.[0m
[32m[I 2022-04-21 11:38:49,988][0m Trial 307 finished with value: 0.8190214884218087 and parameters: {'splitter': 'best', 'min_samples_split': 0.15179395470524457, 'min_samples_leaf': 0.0015800525902008797, 'min_weight_fraction_leaf': 0.015184512413894277, 'max_features': 0.305343091668048}. Best is trial 208 with value: 0.8264270922211081.[0m
/media/san2_ssd/data/Workdir/survival/utils.py:305: RuntimeWarning: invalid value encountered in true_divide
  pdfs = np.gradient(1-survs,axis=1)/norms
[32m[I 2022-04-21 11:38:50,665][0m Trial 308 finished with value: 0.8138656281410169 and parameters: {'splitter': 'best', 'min_samples_split': 0.16490906761730825, 'min_samples_leaf': 0.002096679583989399, 'min_weight_fraction_leaf': 0.009677958776668867, 'max_features': 0.2917676661689614}. Best is trial 208 with value: 0.8264270922211081.[0m
[32m[I 2022-04-21 11:38:50,970][0m Trial 309 finished with value: 0.5691218506833169 and parameters: {'splitter': 'best', 'min_samples_split': 0.16347449204313774, 'min_samples_leaf': 0.0022665296784962936, 'min_weight_fraction_leaf': 0.3267038214471111, 'max_features': 0.30389154838616284}. Best is trial 208 with value: 0.8264270922211081.[0m
[32m[I 2022-04-21 11:38:51,941][0m Trial 310 finished with value: 0.810721541561293 and parameters: {'splitter': 'best', 'min_samples_split': 0.13650970699771328, 'min_samples_leaf': 0.0016176917146967958, 'min_weight_fraction_leaf': 0.017508043494937345, 'max_features': 0.3130116611587955}. Best is trial 208 with value: 0.8264270922211081.[0m
/media/san2_ssd/data/Workdir/survival/utils.py:305: RuntimeWarning: invalid value encountered in true_divide
  pdfs = np.gradient(1-survs,axis=1)/norms
[32m[I 2022-04-21 11:38:52,706][0m Trial 311 finished with value: 0.7978700109265212 and parameters: {'splitter': 'best', 'min_samples_split': 0.15113280397960902, 'min_samples_leaf': 0.010415307844049742, 'min_weight_fraction_leaf': 0.007573591941602277, 'max_features': 0.29067538601667553}. Best is trial 208 with value: 0.8264270922211081.[0m
[32m[I 2022-04-21 11:38:53,185][0m Trial 312 finished with value: 0.8005091417789083 and parameters: {'splitter': 'best', 'min_samples_split': 0.17670199392159394, 'min_samples_leaf': 0.026008223186450772, 'min_weight_fraction_leaf': 5.708956468943212e-05, 'max_features': 0.27459852875686763}. Best is trial 208 with value: 0.8264270922211081.[0m
[32m[I 2022-04-21 11:38:53,464][0m Trial 313 finished with value: 0.8173358443711194 and parameters: {'splitter': 'best', 'min_samples_split': 0.14586542254914606, 'min_samples_leaf': 0.01721003712909352, 'min_weight_fraction_leaf': 0.025027371532973616, 'max_features': 0.31707782496134107}. Best is trial 208 with value: 0.8264270922211081.[0m
[32m[I 2022-04-21 11:38:53,767][0m Trial 314 finished with value: 0.8028211543821488 and parameters: {'splitter': 'best', 'min_samples_split': 0.15809287059209398, 'min_samples_leaf': 0.04397400710502011, 'min_weight_fraction_leaf': 0.015097572596881286, 'max_features': 0.3389191357529101}. Best is trial 208 with value: 0.8264270922211081.[0m
[32m[I 2022-04-21 11:38:54,191][0m Trial 315 finished with value: 0.812320856237989 and parameters: {'splitter': 'best', 'min_samples_split': 0.1350821330119674, 'min_samples_leaf': 0.011441078894605022, 'min_weight_fraction_leaf': 0.03379039571535006, 'max_features': 0.32201077464693695}. Best is trial 208 with value: 0.8264270922211081.[0m
[32m[I 2022-04-21 11:38:54,388][0m Trial 316 finished with value: 0.8104538690357461 and parameters: {'splitter': 'random', 'min_samples_split': 0.12881820271690878, 'min_samples_leaf': 0.024058295851690142, 'min_weight_fraction_leaf': 0.00994158402090788, 'max_features': 0.3414767144090002}. Best is trial 208 with value: 0.8264270922211081.[0m
[32m[I 2022-04-21 11:38:55,050][0m Trial 317 finished with value: 0.811962207149304 and parameters: {'splitter': 'best', 'min_samples_split': 0.14451538444412437, 'min_samples_leaf': 0.0018545612631944769, 'min_weight_fraction_leaf': 0.023945742475873014, 'max_features': 0.35611357364528395}. Best is trial 208 with value: 0.8264270922211081.[0m
[32m[I 2022-04-21 11:38:55,177][0m Trial 318 finished with value: 0.47495774536239777 and parameters: {'splitter': 'best', 'min_samples_split': 0.12597873969550383, 'min_samples_leaf': 0.425061116997032, 'min_weight_fraction_leaf': 0.01013054592273612, 'max_features': 0.32350911672958055}. Best is trial 208 with value: 0.8264270922211081.[0m
/media/san2_ssd/data/Workdir/survival/utils.py:305: RuntimeWarning: invalid value encountered in true_divide
  pdfs = np.gradient(1-survs,axis=1)/norms
[32m[I 2022-04-21 11:38:55,728][0m Trial 319 finished with value: 0.8239006728303029 and parameters: {'splitter': 'best', 'min_samples_split': 0.15705957643092416, 'min_samples_leaf': 0.010553332380485028, 'min_weight_fraction_leaf': 0.0007712370163680916, 'max_features': 0.3712881542836141}. Best is trial 208 with value: 0.8264270922211081.[0m
[32m[I 2022-04-21 11:38:56,079][0m Trial 320 finished with value: 0.8075185243527452 and parameters: {'splitter': 'best', 'min_samples_split': 0.1439366105233521, 'min_samples_leaf': 0.03642588880213525, 'min_weight_fraction_leaf': 0.045136603534120495, 'max_features': 0.3735768895843516}. Best is trial 208 with value: 0.8264270922211081.[0m
[32m[I 2022-04-21 11:38:56,428][0m Trial 321 finished with value: 0.8073341418576477 and parameters: {'splitter': 'best', 'min_samples_split': 0.1542422236251419, 'min_samples_leaf': 0.02082528433394569, 'min_weight_fraction_leaf': 0.00010616499858475932, 'max_features': 0.2555384523759681}. Best is trial 208 with value: 0.8264270922211081.[0m
[32m[I 2022-04-21 11:38:57,244][0m Trial 322 finished with value: 0.81298089827919 and parameters: {'splitter': 'best', 'min_samples_split': 0.1701903128958977, 'min_samples_leaf': 0.0012031251821012787, 'min_weight_fraction_leaf': 0.01785565731333831, 'max_features': 0.39110655425317636}. Best is trial 208 with value: 0.8264270922211081.[0m
[32m[I 2022-04-21 11:38:57,730][0m Trial 323 finished with value: 0.81140294717058 and parameters: {'splitter': 'best', 'min_samples_split': 0.1594279825239264, 'min_samples_leaf': 0.014038643560063428, 'min_weight_fraction_leaf': 0.02830940171250565, 'max_features': 0.30309610196898906}. Best is trial 208 with value: 0.8264270922211081.[0m
[32m[I 2022-04-21 11:38:58,184][0m Trial 324 finished with value: 0.8056675779985248 and parameters: {'splitter': 'best', 'min_samples_split': 0.181564287837513, 'min_samples_leaf': 0.02711548432571613, 'min_weight_fraction_leaf': 0.009859908982981641, 'max_features': 0.35983365426870173}. Best is trial 208 with value: 0.8264270922211081.[0m
[32m[I 2022-04-21 11:38:58,282][0m Trial 325 finished with value: 0.5596035542014499 and parameters: {'splitter': 'best', 'min_samples_split': 0.13644232128247388, 'min_samples_leaf': 0.14585120396018372, 'min_weight_fraction_leaf': 0.39071102438999816, 'max_features': 0.41495714132647915}. Best is trial 208 with value: 0.8264270922211081.[0m
[32m[I 2022-04-21 11:38:58,491][0m Trial 326 finished with value: 0.7978320566461661 and parameters: {'splitter': 'best', 'min_samples_split': 0.15126045320125253, 'min_samples_leaf': 0.058000950511443855, 'min_weight_fraction_leaf': 0.019349255084663834, 'max_features': 0.3727563098770545}. Best is trial 208 with value: 0.8264270922211081.[0m
[32m[I 2022-04-21 11:38:58,751][0m Trial 327 finished with value: 0.8141496853599577 and parameters: {'splitter': 'best', 'min_samples_split': 0.13307760050260567, 'min_samples_leaf': 0.011540401517539716, 'min_weight_fraction_leaf': 0.035218746115164706, 'max_features': 0.43212968554244263}. Best is trial 208 with value: 0.8264270922211081.[0m
