[32m[I 2022-04-22 15:25:28,443][0m Trial 0 finished with value: 0.5 and parameters: {'loss': 'coxph', 'learning_rate': 0.02403476257795001, 'n_estimators': 602, 'criterion': 'absolute_error', 'min_samples_split': 5, 'min_samples_leaf': 6, 'min_weight_fraction_leaf': 0.38060351625386823, 'min_impurity_decrease': 0.3270368379222339, 'max_features': 0.8760614025516781, 'subsample': 0.37647112767947505, 'dropout_rate': 0.689283141584415, 'ccp_alpha': 0.7749074332891901}. Best is trial 0 with value: 0.5.[0m
/media/san2_ssd/data/Workdir/survival/venv/lib/python3.8/site-packages/sksurv/ensemble/boosting.py:955: RuntimeWarning: divide by zero encountered in log
  time = numpy.log(time)
/media/san2_ssd/data/Workdir/survival/venv/lib/python3.8/site-packages/sksurv/ensemble/boosting.py:955: RuntimeWarning: divide by zero encountered in log
  time = numpy.log(time)
/media/san2_ssd/data/Workdir/survival/venv/lib/python3.8/site-packages/sksurv/ensemble/boosting.py:955: RuntimeWarning: divide by zero encountered in log
  time = numpy.log(time)
/media/san2_ssd/data/Workdir/survival/venv/lib/python3.8/site-packages/sksurv/ensemble/boosting.py:955: RuntimeWarning: divide by zero encountered in log
  time = numpy.log(time)
[32m[I 2022-04-22 15:25:30,551][0m Trial 1 finished with value: -0.7 and parameters: {'loss': 'squared', 'learning_rate': 8.29630532328643e-06, 'n_estimators': 337, 'criterion': 'absolute_error', 'min_samples_split': 2, 'min_samples_leaf': 6, 'min_weight_fraction_leaf': 0.01364890977202532, 'min_impurity_decrease': 0.9472338092636268, 'max_features': 0.22291704458834727, 'subsample': 0.3079032148740087, 'dropout_rate': 0.7675359031314241, 'ccp_alpha': 0.3142062893627377}. Best is trial 0 with value: 0.5.[0m
[32m[I 2022-04-22 15:26:08,624][0m Trial 2 finished with value: 0.5 and parameters: {'loss': 'coxph', 'learning_rate': 0.04225173176034639, 'n_estimators': 385, 'criterion': 'squared_error', 'min_samples_split': 5, 'min_samples_leaf': 6, 'min_weight_fraction_leaf': 0.4125550005897419, 'min_impurity_decrease': 0.5426339184194162, 'max_features': 0.16344217001176767, 'subsample': 0.5413602525172694, 'dropout_rate': 0.13790439566127655, 'ccp_alpha': 0.042816666790541066}. Best is trial 0 with value: 0.5.[0m
/media/san2_ssd/data/Workdir/survival/venv/lib/python3.8/site-packages/sksurv/ensemble/boosting.py:955: RuntimeWarning: divide by zero encountered in log
  time = numpy.log(time)
/media/san2_ssd/data/Workdir/survival/venv/lib/python3.8/site-packages/sksurv/ensemble/boosting.py:955: RuntimeWarning: divide by zero encountered in log
  time = numpy.log(time)
/media/san2_ssd/data/Workdir/survival/venv/lib/python3.8/site-packages/sksurv/ensemble/boosting.py:955: RuntimeWarning: divide by zero encountered in log
  time = numpy.log(time)
/media/san2_ssd/data/Workdir/survival/venv/lib/python3.8/site-packages/sksurv/ensemble/boosting.py:955: RuntimeWarning: divide by zero encountered in log
  time = numpy.log(time)
[32m[I 2022-04-22 15:26:13,589][0m Trial 3 finished with value: -0.7 and parameters: {'loss': 'squared', 'learning_rate': 0.0021190519376718623, 'n_estimators': 374, 'criterion': 'friedman_mse', 'min_samples_split': 3, 'min_samples_leaf': 2, 'min_weight_fraction_leaf': 0.23820548094577598, 'min_impurity_decrease': 0.7158160826342963, 'max_features': 0.5605599102653283, 'subsample': 0.40549540617544116, 'dropout_rate': 0.4250882513776896, 'ccp_alpha': 4.886712884790104}. Best is trial 0 with value: 0.5.[0m
[32m[I 2022-04-22 15:26:21,385][0m Trial 4 finished with value: 0.5 and parameters: {'loss': 'coxph', 'learning_rate': 0.00022109268788092121, 'n_estimators': 125, 'criterion': 'absolute_error', 'min_samples_split': 10, 'min_samples_leaf': 2, 'min_weight_fraction_leaf': 0.22506743501219115, 'min_impurity_decrease': 0.1328344910353771, 'max_features': 0.8940652390956404, 'subsample': 0.801899634918629, 'dropout_rate': 0.18917193886617123, 'ccp_alpha': 0.7556198269612678}. Best is trial 0 with value: 0.5.[0m
/media/san2_ssd/data/Workdir/survival/venv/lib/python3.8/site-packages/sksurv/ensemble/boosting.py:955: RuntimeWarning: divide by zero encountered in log
  time = numpy.log(time)
/media/san2_ssd/data/Workdir/survival/venv/lib/python3.8/site-packages/sksurv/ensemble/boosting.py:955: RuntimeWarning: divide by zero encountered in log
  time = numpy.log(time)
/media/san2_ssd/data/Workdir/survival/venv/lib/python3.8/site-packages/sksurv/ensemble/boosting.py:955: RuntimeWarning: divide by zero encountered in log
  time = numpy.log(time)
/media/san2_ssd/data/Workdir/survival/venv/lib/python3.8/site-packages/sksurv/ensemble/boosting.py:955: RuntimeWarning: divide by zero encountered in log
  time = numpy.log(time)
[32m[I 2022-04-22 15:26:33,933][0m Trial 5 finished with value: -0.7 and parameters: {'loss': 'squared', 'learning_rate': 0.0002518282546611535, 'n_estimators': 494, 'criterion': 'friedman_mse', 'min_samples_split': 8, 'min_samples_leaf': 10, 'min_weight_fraction_leaf': 0.15850692429460156, 'min_impurity_decrease': 0.9362022620494881, 'max_features': 0.8158681562906172, 'subsample': 0.8682750037787315, 'dropout_rate': 0.08200670315205105, 'ccp_alpha': 2.4674194913035303}. Best is trial 0 with value: 0.5.[0m
[32m[I 2022-04-22 15:26:44,610][0m Trial 6 finished with value: 0.5 and parameters: {'loss': 'coxph', 'learning_rate': 0.021226712115838015, 'n_estimators': 204, 'criterion': 'absolute_error', 'min_samples_split': 4, 'min_samples_leaf': 6, 'min_weight_fraction_leaf': 0.4775060840855049, 'min_impurity_decrease': 0.7703159927695327, 'max_features': 0.6350415601654757, 'subsample': 0.5739762827700468, 'dropout_rate': 0.45898118965043666, 'ccp_alpha': 0.31092469105160814}. Best is trial 0 with value: 0.5.[0m
[32m[I 2022-04-22 15:27:24,400][0m Trial 7 finished with value: 0.5 and parameters: {'loss': 'coxph', 'learning_rate': 0.02028757442855036, 'n_estimators': 835, 'criterion': 'absolute_error', 'min_samples_split': 8, 'min_samples_leaf': 5, 'min_weight_fraction_leaf': 0.06806294462979107, 'min_impurity_decrease': 0.40450056203586365, 'max_features': 0.1683063174380499, 'subsample': 0.13999180172369322, 'dropout_rate': 0.8927484079344301, 'ccp_alpha': 0.5526356845973377}. Best is trial 0 with value: 0.5.[0m
/media/san2_ssd/data/Workdir/survival/venv/lib/python3.8/site-packages/sksurv/ensemble/boosting.py:955: RuntimeWarning: divide by zero encountered in log
  time = numpy.log(time)
/media/san2_ssd/data/Workdir/survival/venv/lib/python3.8/site-packages/sksurv/ensemble/boosting.py:955: RuntimeWarning: divide by zero encountered in log
  time = numpy.log(time)
/media/san2_ssd/data/Workdir/survival/venv/lib/python3.8/site-packages/sksurv/ensemble/boosting.py:955: RuntimeWarning: divide by zero encountered in log
  time = numpy.log(time)
/media/san2_ssd/data/Workdir/survival/venv/lib/python3.8/site-packages/sksurv/ensemble/boosting.py:955: RuntimeWarning: divide by zero encountered in log
  time = numpy.log(time)
[32m[I 2022-04-22 15:27:38,816][0m Trial 8 finished with value: -0.7 and parameters: {'loss': 'squared', 'learning_rate': 0.00784155115179803, 'n_estimators': 548, 'criterion': 'friedman_mse', 'min_samples_split': 8, 'min_samples_leaf': 5, 'min_weight_fraction_leaf': 0.35973979585368254, 'min_impurity_decrease': 0.9380853973853772, 'max_features': 0.17411280623189532, 'subsample': 0.6153840451666579, 'dropout_rate': 0.1317235275681541, 'ccp_alpha': 3.740180073096952}. Best is trial 0 with value: 0.5.[0m
/media/san2_ssd/data/Workdir/survival/venv/lib/python3.8/site-packages/sksurv/ensemble/boosting.py:955: RuntimeWarning: divide by zero encountered in log
  time = numpy.log(time)
/media/san2_ssd/data/Workdir/survival/venv/lib/python3.8/site-packages/sksurv/ensemble/boosting.py:955: RuntimeWarning: divide by zero encountered in log
  time = numpy.log(time)
/media/san2_ssd/data/Workdir/survival/venv/lib/python3.8/site-packages/sksurv/ensemble/boosting.py:955: RuntimeWarning: divide by zero encountered in log
  time = numpy.log(time)
/media/san2_ssd/data/Workdir/survival/venv/lib/python3.8/site-packages/sksurv/ensemble/boosting.py:955: RuntimeWarning: divide by zero encountered in log
  time = numpy.log(time)
[32m[I 2022-04-22 15:27:42,096][0m Trial 9 finished with value: -0.7 and parameters: {'loss': 'squared', 'learning_rate': 0.00027836330709587575, 'n_estimators': 307, 'criterion': 'absolute_error', 'min_samples_split': 2, 'min_samples_leaf': 9, 'min_weight_fraction_leaf': 0.08728167814382154, 'min_impurity_decrease': 0.0330747381884967, 'max_features': 0.009993490719861262, 'subsample': 0.12002812643642542, 'dropout_rate': 0.40412574577746285, 'ccp_alpha': 1.2558650187385891}. Best is trial 0 with value: 0.5.[0m
[32m[I 2022-04-22 15:28:59,564][0m Trial 10 finished with value: 0.5 and parameters: {'loss': 'coxph', 'learning_rate': 6.609859279099009e-06, 'n_estimators': 831, 'criterion': 'squared_error', 'min_samples_split': 6, 'min_samples_leaf': 8, 'min_weight_fraction_leaf': 0.3461367581282381, 'min_impurity_decrease': 0.3437323090611041, 'max_features': 0.7272517671009426, 'subsample': 0.31119924537012134, 'dropout_rate': 0.6786977750816726, 'ccp_alpha': 1.8996009801491733}. Best is trial 0 with value: 0.5.[0m
[32m[I 2022-04-22 15:29:44,816][0m Trial 11 finished with value: 0.5 and parameters: {'loss': 'coxph', 'learning_rate': 0.08228697426647985, 'n_estimators': 559, 'criterion': 'squared_error', 'min_samples_split': 5, 'min_samples_leaf': 7, 'min_weight_fraction_leaf': 0.4726064632567676, 'min_impurity_decrease': 0.5571820642385692, 'max_features': 0.4376460742504812, 'subsample': 0.6714971513322866, 'dropout_rate': 0.5855572872250142, 'ccp_alpha': 1.4931292232309692}. Best is trial 0 with value: 0.5.[0m
[32m[I 2022-04-22 15:29:47,871][0m Trial 12 finished with value: 0.5 and parameters: {'loss': 'coxph', 'learning_rate': 0.09802820497630921, 'n_estimators': 210, 'criterion': 'squared_error', 'min_samples_split': 5, 'min_samples_leaf': 4, 'min_weight_fraction_leaf': 0.345084868688926, 'min_impurity_decrease': 0.24716576566237974, 'max_features': 0.9692245718537131, 'subsample': 0.4679421408006139, 'dropout_rate': 0.9704285381484937, 'ccp_alpha': 0.04517334709515103}. Best is trial 0 with value: 0.5.[0m
[32m[I 2022-04-22 15:31:36,174][0m Trial 13 finished with value: 0.5 and parameters: {'loss': 'coxph', 'learning_rate': 0.0022824256307510866, 'n_estimators': 687, 'criterion': 'squared_error', 'min_samples_split': 6, 'min_samples_leaf': 4, 'min_weight_fraction_leaf': 0.41591079195400127, 'min_impurity_decrease': 0.5144720586291195, 'max_features': 0.39961857186744115, 'subsample': 0.3207874191848296, 'dropout_rate': 0.21537627150605798, 'ccp_alpha': 3.075090104435823}. Best is trial 0 with value: 0.5.[0m
[32m[I 2022-04-22 15:32:14,347][0m Trial 14 finished with value: 0.5 and parameters: {'loss': 'coxph', 'learning_rate': 0.0027618256618682177, 'n_estimators': 419, 'criterion': 'squared_error', 'min_samples_split': 4, 'min_samples_leaf': 8, 'min_weight_fraction_leaf': 0.3012812932092783, 'min_impurity_decrease': 0.6674191309195706, 'max_features': 0.3567061753719658, 'subsample': 0.9753746051795849, 'dropout_rate': 0.325825056465929, 'ccp_alpha': 1.1142224866984893}. Best is trial 0 with value: 0.5.[0m
[32m[I 2022-04-22 15:32:37,222][0m Trial 15 finished with value: 0.5 and parameters: {'loss': 'coxph', 'learning_rate': 0.012659052898092448, 'n_estimators': 270, 'criterion': 'squared_error', 'min_samples_split': 7, 'min_samples_leaf': 3, 'min_weight_fraction_leaf': 0.4078332479583705, 'min_impurity_decrease': 0.29155557839798896, 'max_features': 0.03026299117870529, 'subsample': 0.014750571149013625, 'dropout_rate': 0.01451552999832327, 'ccp_alpha': 2.2067218662608292}. Best is trial 0 with value: 0.5.[0m
[32m[I 2022-04-22 15:35:04,932][0m Trial 16 finished with value: 0.5 and parameters: {'loss': 'coxph', 'learning_rate': 4.658532588762131e-05, 'n_estimators': 991, 'criterion': 'absolute_error', 'min_samples_split': 4, 'min_samples_leaf': 7, 'min_weight_fraction_leaf': 0.4223139083088362, 'min_impurity_decrease': 0.45354479454341556, 'max_features': 0.6760243251002507, 'subsample': 0.7272715955020566, 'dropout_rate': 0.5691332318069243, 'ccp_alpha': 1.6153729494117566}. Best is trial 0 with value: 0.5.[0m
[32m[I 2022-04-22 15:35:43,750][0m Trial 17 finished with value: 0.5 and parameters: {'loss': 'coxph', 'learning_rate': 0.0017039388752927878, 'n_estimators': 437, 'criterion': 'squared_error', 'min_samples_split': 3, 'min_samples_leaf': 8, 'min_weight_fraction_leaf': 0.2881461510433797, 'min_impurity_decrease': 0.6794330959062524, 'max_features': 0.3157535447905495, 'subsample': 0.992507686374738, 'dropout_rate': 0.3360369003513067, 'ccp_alpha': 0.9766043418736239}. Best is trial 0 with value: 0.5.[0m
[32m[I 2022-04-22 15:36:01,526][0m Trial 18 finished with value: 0.5 and parameters: {'loss': 'coxph', 'learning_rate': 0.009174815274625114, 'n_estimators': 239, 'criterion': 'absolute_error', 'min_samples_split': 7, 'min_samples_leaf': 1, 'min_weight_fraction_leaf': 0.49073566170761995, 'min_impurity_decrease': 0.2627400371459002, 'max_features': 0.5063020812783143, 'subsample': 0.02345334116537153, 'dropout_rate': 0.008642951640576053, 'ccp_alpha': 2.2658935834044613}. Best is trial 0 with value: 0.5.[0m
[32m[I 2022-04-22 15:38:23,680][0m Trial 19 finished with value: 0.5 and parameters: {'loss': 'coxph', 'learning_rate': 3.532794458483846e-05, 'n_estimators': 992, 'criterion': 'absolute_error', 'min_samples_split': 4, 'min_samples_leaf': 7, 'min_weight_fraction_leaf': 0.1958350684813526, 'min_impurity_decrease': 0.40682014806686795, 'max_features': 0.7314349560549636, 'subsample': 0.7241877815225561, 'dropout_rate': 0.6023757323662905, 'ccp_alpha': 2.960550790396481}. Best is trial 0 with value: 0.5.[0m
[32m[I 2022-04-22 15:38:27,540][0m Trial 20 finished with value: 0.5 and parameters: {'loss': 'coxph', 'learning_rate': 1.3264781117173516e-06, 'n_estimators': 107, 'criterion': 'friedman_mse', 'min_samples_split': 3, 'min_samples_leaf': 10, 'min_weight_fraction_leaf': 0.29020777008382387, 'min_impurity_decrease': 0.623234847604982, 'max_features': 0.2997373963137506, 'subsample': 0.9672258109570677, 'dropout_rate': 0.3137481604650574, 'ccp_alpha': 0.9051658863818378}. Best is trial 0 with value: 0.5.[0m
[32m[I 2022-04-22 15:38:34,834][0m Trial 21 finished with value: 0.5 and parameters: {'loss': 'coxph', 'learning_rate': 0.0009119944836061138, 'n_estimators': 240, 'criterion': 'absolute_error', 'min_samples_split': 7, 'min_samples_leaf': 1, 'min_weight_fraction_leaf': 0.48518859330057074, 'min_impurity_decrease': 0.22135319803498646, 'max_features': 0.4651242296353827, 'subsample': 0.1914784024081726, 'dropout_rate': 0.7733226426301751, 'ccp_alpha': 3.0934823959243998}. Best is trial 0 with value: 0.5.[0m
[32m[I 2022-04-22 15:38:42,661][0m Trial 22 finished with value: 0.5 and parameters: {'loss': 'coxph', 'learning_rate': 5.5965573868263345e-05, 'n_estimators': 175, 'criterion': 'absolute_error', 'min_samples_split': 10, 'min_samples_leaf': 7, 'min_weight_fraction_leaf': 0.17740765021982297, 'min_impurity_decrease': 0.15836825132334287, 'max_features': 0.7601604808775756, 'subsample': 0.7823600503293269, 'dropout_rate': 0.6441882398309768, 'ccp_alpha': 3.1501333589230285}. Best is trial 0 with value: 0.5.[0m
[32m[I 2022-04-22 15:38:45,491][0m Trial 23 finished with value: 0.5 and parameters: {'loss': 'coxph', 'learning_rate': 1.4841458860702897e-06, 'n_estimators': 106, 'criterion': 'friedman_mse', 'min_samples_split': 3, 'min_samples_leaf': 10, 'min_weight_fraction_leaf': 0.18485371003378492, 'min_impurity_decrease': 0.3643427054704988, 'max_features': 0.8738781219820477, 'subsample': 0.8793328289516343, 'dropout_rate': 0.5242520734889604, 'ccp_alpha': 3.9694507272537276}. Best is trial 0 with value: 0.5.[0m
[32m[I 2022-04-22 15:38:48,705][0m Trial 24 finished with value: 0.5 and parameters: {'loss': 'coxph', 'learning_rate': 1.0510928155238533e-06, 'n_estimators': 147, 'criterion': 'friedman_mse', 'min_samples_split': 7, 'min_samples_leaf': 1, 'min_weight_fraction_leaf': 0.2877861202930858, 'min_impurity_decrease': 0.1552298145751682, 'max_features': 0.5852814040832033, 'subsample': 0.14901646744431912, 'dropout_rate': 0.764692394773804, 'ccp_alpha': 3.975241923514645}. Best is trial 0 with value: 0.5.[0m
[32m[I 2022-04-22 15:38:53,629][0m Trial 25 finished with value: 0.5 and parameters: {'loss': 'coxph', 'learning_rate': 6.951072575475355e-05, 'n_estimators': 172, 'criterion': 'absolute_error', 'min_samples_split': 10, 'min_samples_leaf': 4, 'min_weight_fraction_leaf': 0.4512645335911477, 'min_impurity_decrease': 0.16203003981494435, 'max_features': 0.9997681693510959, 'subsample': 0.23550167655760745, 'dropout_rate': 0.7403201756034727, 'ccp_alpha': 3.058113343267354}. Best is trial 0 with value: 0.5.[0m
/media/san2_ssd/data/Workdir/survival/venv/lib/python3.8/site-packages/sksurv/ensemble/boosting.py:955: RuntimeWarning: divide by zero encountered in log
  time = numpy.log(time)
/media/san2_ssd/data/Workdir/survival/venv/lib/python3.8/site-packages/sksurv/ensemble/boosting.py:955: RuntimeWarning: divide by zero encountered in log
  time = numpy.log(time)
/media/san2_ssd/data/Workdir/survival/venv/lib/python3.8/site-packages/sksurv/ensemble/boosting.py:955: RuntimeWarning: divide by zero encountered in log
  time = numpy.log(time)
/media/san2_ssd/data/Workdir/survival/venv/lib/python3.8/site-packages/sksurv/ensemble/boosting.py:955: RuntimeWarning: divide by zero encountered in log
  time = numpy.log(time)
[32m[I 2022-04-22 15:38:54,122][0m Trial 26 finished with value: -0.7 and parameters: {'loss': 'squared', 'learning_rate': 8.125234320999674e-06, 'n_estimators': 106, 'criterion': 'friedman_mse', 'min_samples_split': 9, 'min_samples_leaf': 9, 'min_weight_fraction_leaf': 0.14241449765977865, 'min_impurity_decrease': 0.0387917457309907, 'max_features': 0.8171235850224409, 'subsample': 0.8623554125572844, 'dropout_rate': 0.5228989001075904, 'ccp_alpha': 4.165490273215309}. Best is trial 0 with value: 0.5.[0m
[32m[I 2022-04-22 15:38:56,512][0m Trial 27 finished with value: 0.5 and parameters: {'loss': 'coxph', 'learning_rate': 1.692192568094977e-06, 'n_estimators': 139, 'criterion': 'friedman_mse', 'min_samples_split': 6, 'min_samples_leaf': 3, 'min_weight_fraction_leaf': 0.257639711400992, 'min_impurity_decrease': 0.3398306656231752, 'max_features': 0.9095040419333887, 'subsample': 0.43345256717401803, 'dropout_rate': 0.8688280346707147, 'ccp_alpha': 4.180501644173271}. Best is trial 0 with value: 0.5.[0m
[32m[I 2022-04-22 15:39:01,788][0m Trial 28 finished with value: 0.5 and parameters: {'loss': 'coxph', 'learning_rate': 0.00010531606444194816, 'n_estimators': 174, 'criterion': 'absolute_error', 'min_samples_split': 10, 'min_samples_leaf': 4, 'min_weight_fraction_leaf': 0.36816104332635513, 'min_impurity_decrease': 0.1510963574804113, 'max_features': 0.9898011278995551, 'subsample': 0.22645815545195205, 'dropout_rate': 0.7113184217882623, 'ccp_alpha': 3.496651746719834}. Best is trial 0 with value: 0.5.[0m
/media/san2_ssd/data/Workdir/survival/venv/lib/python3.8/site-packages/sksurv/ensemble/boosting.py:955: RuntimeWarning: divide by zero encountered in log
  time = numpy.log(time)
/media/san2_ssd/data/Workdir/survival/venv/lib/python3.8/site-packages/sksurv/ensemble/boosting.py:955: RuntimeWarning: divide by zero encountered in log
  time = numpy.log(time)
/media/san2_ssd/data/Workdir/survival/venv/lib/python3.8/site-packages/sksurv/ensemble/boosting.py:955: RuntimeWarning: divide by zero encountered in log
  time = numpy.log(time)
/media/san2_ssd/data/Workdir/survival/venv/lib/python3.8/site-packages/sksurv/ensemble/boosting.py:955: RuntimeWarning: divide by zero encountered in log
  time = numpy.log(time)
[32m[I 2022-04-22 15:39:02,400][0m Trial 29 finished with value: -0.7 and parameters: {'loss': 'squared', 'learning_rate': 1.9831698468688625e-05, 'n_estimators': 152, 'criterion': 'absolute_error', 'min_samples_split': 9, 'min_samples_leaf': 2, 'min_weight_fraction_leaf': 0.44411476976809905, 'min_impurity_decrease': 0.09644432769837213, 'max_features': 0.5872890039720221, 'subsample': 0.37154401679983867, 'dropout_rate': 0.7829594469853464, 'ccp_alpha': 4.634384812887307}. Best is trial 0 with value: 0.5.[0m
[32m[I 2022-04-22 15:39:04,281][0m Trial 30 finished with value: 0.5 and parameters: {'loss': 'coxph', 'learning_rate': 3.7090724845475224e-06, 'n_estimators': 126, 'criterion': 'friedman_mse', 'min_samples_split': 6, 'min_samples_leaf': 3, 'min_weight_fraction_leaf': 0.3759678710382947, 'min_impurity_decrease': 0.3144931770645193, 'max_features': 0.9273399642423892, 'subsample': 0.46868800662051946, 'dropout_rate': 0.8772764315114572, 'ccp_alpha': 4.43473229885003}. Best is trial 0 with value: 0.5.[0m
[32m[I 2022-04-22 15:39:09,416][0m Trial 31 finished with value: 0.5 and parameters: {'loss': 'coxph', 'learning_rate': 0.00010833936985448762, 'n_estimators': 170, 'criterion': 'absolute_error', 'min_samples_split': 9, 'min_samples_leaf': 4, 'min_weight_fraction_leaf': 0.37988454259244797, 'min_impurity_decrease': 0.20855271868661354, 'max_features': 0.971004775436666, 'subsample': 0.24091750319595046, 'dropout_rate': 0.7103085129583463, 'ccp_alpha': 3.5109423449080723}. Best is trial 0 with value: 0.5.[0m
[32m[I 2022-04-22 15:39:13,952][0m Trial 32 finished with value: 0.5 and parameters: {'loss': 'coxph', 'learning_rate': 1.9334948231113656e-05, 'n_estimators': 193, 'criterion': 'absolute_error', 'min_samples_split': 10, 'min_samples_leaf': 5, 'min_weight_fraction_leaf': 0.32890886748323855, 'min_impurity_decrease': 0.08765942082027439, 'max_features': 0.8324172662340936, 'subsample': 0.24285244234747766, 'dropout_rate': 0.8537671696775386, 'ccp_alpha': 3.4863728520051778}. Best is trial 0 with value: 0.5.[0m
