[32m[I 2022-04-21 11:42:24,404][0m Trial 798 finished with value: 0.8126539011214916 and parameters: {'splitter': 'best', 'min_samples_split': 0.07609351039765226, 'min_samples_leaf': 0.03001927639113877, 'min_weight_fraction_leaf': 0.012016365320796887, 'max_features': 0.5525321336515032}. Best is trial 691 with value: 0.8340697555858835.[0m
/media/san2_ssd/data/Workdir/survival/utils.py:305: RuntimeWarning: invalid value encountered in true_divide
  pdfs = np.gradient(1-survs,axis=1)/norms
[32m[I 2022-04-21 11:42:24,845][0m Trial 799 finished with value: 0.807836613083769 and parameters: {'splitter': 'best', 'min_samples_split': 0.09048177864469312, 'min_samples_leaf': 0.01080838518887279, 'min_weight_fraction_leaf': 0.019761047562135575, 'max_features': 0.5116358490659921}. Best is trial 691 with value: 0.8340697555858835.[0m
[32m[I 2022-04-21 11:42:25,234][0m Trial 800 finished with value: 0.8127203461786172 and parameters: {'splitter': 'best', 'min_samples_split': 0.15519191899770646, 'min_samples_leaf': 0.02070502348078388, 'min_weight_fraction_leaf': 0.009992220514179199, 'max_features': 0.5894556631026467}. Best is trial 691 with value: 0.8340697555858835.[0m
[32m[I 2022-04-21 11:42:25,382][0m Trial 801 finished with value: 0.7739072802619453 and parameters: {'splitter': 'best', 'min_samples_split': 0.10881408379280652, 'min_samples_leaf': 0.14454169863927108, 'min_weight_fraction_leaf': 0.03706773618757776, 'max_features': 0.3482691103201307}. Best is trial 691 with value: 0.8340697555858835.[0m
[32m[I 2022-04-21 11:42:25,614][0m Trial 802 finished with value: 0.8114633644017581 and parameters: {'splitter': 'best', 'min_samples_split': 0.12537617465208814, 'min_samples_leaf': 0.10192490497275447, 'min_weight_fraction_leaf': 0.025121852823830032, 'max_features': 0.5602939527512154}. Best is trial 691 with value: 0.8340697555858835.[0m
/media/san2_ssd/data/Workdir/survival/utils.py:305: RuntimeWarning: invalid value encountered in true_divide
  pdfs = np.gradient(1-survs,axis=1)/norms
/media/san2_ssd/data/Workdir/survival/utils.py:305: RuntimeWarning: invalid value encountered in true_divide
  pdfs = np.gradient(1-survs,axis=1)/norms
[32m[I 2022-04-21 11:42:26,110][0m Trial 803 finished with value: 0.814692830006581 and parameters: {'splitter': 'best', 'min_samples_split': 0.14175047211093308, 'min_samples_leaf': 0.01248415862625552, 'min_weight_fraction_leaf': 0.010318033376697509, 'max_features': 0.5371604886269288}. Best is trial 691 with value: 0.8340697555858835.[0m
[32m[I 2022-04-21 11:42:26,414][0m Trial 804 finished with value: 0.8004357944832277 and parameters: {'splitter': 'best', 'min_samples_split': 0.09749514822829183, 'min_samples_leaf': 0.03741369862983927, 'min_weight_fraction_leaf': 0.017814662170211052, 'max_features': 0.365287533697994}. Best is trial 691 with value: 0.8340697555858835.[0m
/media/san2_ssd/data/Workdir/survival/utils.py:305: RuntimeWarning: invalid value encountered in true_divide
  pdfs = np.gradient(1-survs,axis=1)/norms
/media/san2_ssd/data/Workdir/survival/utils.py:305: RuntimeWarning: invalid value encountered in true_divide
  pdfs = np.gradient(1-survs,axis=1)/norms
[32m[I 2022-04-21 11:42:26,907][0m Trial 805 finished with value: 0.8014847339349304 and parameters: {'splitter': 'best', 'min_samples_split': 0.08183316703645283, 'min_samples_leaf': 0.023871804248315434, 'min_weight_fraction_leaf': 0.008673995608052742, 'max_features': 0.6041778159707316}. Best is trial 691 with value: 0.8340697555858835.[0m
[32m[I 2022-04-21 11:42:27,248][0m Trial 806 finished with value: 0.8022831454617412 and parameters: {'splitter': 'best', 'min_samples_split': 0.11991096065966117, 'min_samples_leaf': 0.014084776588177757, 'min_weight_fraction_leaf': 0.028660341029687855, 'max_features': 0.3400318126937284}. Best is trial 691 with value: 0.8340697555858835.[0m
[32m[I 2022-04-21 11:42:27,588][0m Trial 807 finished with value: 0.8053728959171117 and parameters: {'splitter': 'best', 'min_samples_split': 0.2196296164534806, 'min_samples_leaf': 0.0011545048494491115, 'min_weight_fraction_leaf': 0.045192173949881884, 'max_features': 0.568760690878024}. Best is trial 691 with value: 0.8340697555858835.[0m
[32m[I 2022-04-21 11:42:27,888][0m Trial 808 finished with value: 0.8056883399418773 and parameters: {'splitter': 'best', 'min_samples_split': 0.10581729555447607, 'min_samples_leaf': 0.029577037447919702, 'min_weight_fraction_leaf': 0.06376787518943768, 'max_features': 0.5026512858874106}. Best is trial 691 with value: 0.8340697555858835.[0m
[32m[I 2022-04-21 11:42:28,571][0m Trial 809 finished with value: 0.8088004761650675 and parameters: {'splitter': 'best', 'min_samples_split': 0.09342576183415367, 'min_samples_leaf': 0.05259993896388131, 'min_weight_fraction_leaf': 0.016430818221553796, 'max_features': 0.5286815705831354}. Best is trial 691 with value: 0.8340697555858835.[0m
[32m[I 2022-04-21 11:42:28,956][0m Trial 810 finished with value: 0.8007718271646956 and parameters: {'splitter': 'best', 'min_samples_split': 0.13115263770822647, 'min_samples_leaf': 0.0702372132844427, 'min_weight_fraction_leaf': 0.00012528947692818317, 'max_features': 0.33156940916130007}. Best is trial 691 with value: 0.8340697555858835.[0m
/media/san2_ssd/data/Workdir/survival/utils.py:305: RuntimeWarning: invalid value encountered in true_divide
  pdfs = np.gradient(1-survs,axis=1)/norms
[32m[I 2022-04-21 11:42:29,653][0m Trial 811 finished with value: 0.8215183659402916 and parameters: {'splitter': 'best', 'min_samples_split': 0.10342975795723296, 'min_samples_leaf': 0.009119401916700885, 'min_weight_fraction_leaf': 0.0079645315508728, 'max_features': 0.6237818675515912}. Best is trial 691 with value: 0.8340697555858835.[0m
[32m[I 2022-04-21 11:42:29,986][0m Trial 812 finished with value: 0.6682177381066242 and parameters: {'splitter': 'best', 'min_samples_split': 0.07833118949231739, 'min_samples_leaf': 0.02124042580886587, 'min_weight_fraction_leaf': 0.25790924210218547, 'max_features': 0.381896938570157}. Best is trial 691 with value: 0.8340697555858835.[0m
/media/san2_ssd/data/Workdir/survival/utils.py:305: RuntimeWarning: invalid value encountered in true_divide
  pdfs = np.gradient(1-survs,axis=1)/norms
[32m[I 2022-04-21 11:42:30,597][0m Trial 813 finished with value: 0.8163918323442705 and parameters: {'splitter': 'best', 'min_samples_split': 0.1103328118102185, 'min_samples_leaf': 0.009764878576651662, 'min_weight_fraction_leaf': 0.025591696681330572, 'max_features': 0.5492287613110013}. Best is trial 691 with value: 0.8340697555858835.[0m
[32m[I 2022-04-21 11:42:31,227][0m Trial 814 finished with value: 0.8104501387104964 and parameters: {'splitter': 'best', 'min_samples_split': 0.1174297760365037, 'min_samples_leaf': 0.037624440654367625, 'min_weight_fraction_leaf': 0.036368960317393784, 'max_features': 0.5976790356328315}. Best is trial 691 with value: 0.8340697555858835.[0m
/media/san2_ssd/data/Workdir/survival/utils.py:305: RuntimeWarning: invalid value encountered in true_divide
  pdfs = np.gradient(1-survs,axis=1)/norms
[32m[I 2022-04-21 11:42:32,208][0m Trial 815 finished with value: 0.8093946578777297 and parameters: {'splitter': 'best', 'min_samples_split': 0.08810937636764055, 'min_samples_leaf': 0.024403498075251343, 'min_weight_fraction_leaf': 0.01716579701952949, 'max_features': 0.3559160104198293}. Best is trial 691 with value: 0.8340697555858835.[0m
/media/san2_ssd/data/Workdir/survival/utils.py:305: RuntimeWarning: invalid value encountered in true_divide
  pdfs = np.gradient(1-survs,axis=1)/norms
[32m[I 2022-04-21 11:42:33,321][0m Trial 816 finished with value: 0.8122143888746882 and parameters: {'splitter': 'best', 'min_samples_split': 0.13565955504396224, 'min_samples_leaf': 0.010539863308242706, 'min_weight_fraction_leaf': 0.00885841713567142, 'max_features': 0.392519759811539}. Best is trial 691 with value: 0.8340697555858835.[0m
[32m[I 2022-04-21 11:42:33,752][0m Trial 817 finished with value: 0.8254548786490268 and parameters: {'splitter': 'best', 'min_samples_split': 0.14794041331820892, 'min_samples_leaf': 0.019207381394676003, 'min_weight_fraction_leaf': 0.023406194032229807, 'max_features': 0.5716102964961888}. Best is trial 691 with value: 0.8340697555858835.[0m
[32m[I 2022-04-21 11:42:34,137][0m Trial 818 finished with value: 0.8132589104344902 and parameters: {'splitter': 'best', 'min_samples_split': 0.15514947518639932, 'min_samples_leaf': 0.03046834419037291, 'min_weight_fraction_leaf': 0.04980796397024946, 'max_features': 0.6125075071792265}. Best is trial 691 with value: 0.8340697555858835.[0m
[32m[I 2022-04-21 11:42:34,600][0m Trial 819 finished with value: 0.8122501836807707 and parameters: {'splitter': 'best', 'min_samples_split': 0.16876887720808356, 'min_samples_leaf': 0.008852744659473628, 'min_weight_fraction_leaf': 0.041229957039285114, 'max_features': 0.577166358516515}. Best is trial 691 with value: 0.8340697555858835.[0m
[32m[I 2022-04-21 11:42:35,000][0m Trial 820 finished with value: 0.8084440166644932 and parameters: {'splitter': 'best', 'min_samples_split': 0.14226361369366058, 'min_samples_leaf': 0.046528985072257695, 'min_weight_fraction_leaf': 0.03374452759416719, 'max_features': 0.5840194220964564}. Best is trial 691 with value: 0.8340697555858835.[0m
[32m[I 2022-04-21 11:42:35,426][0m Trial 821 finished with value: 0.8089144310094201 and parameters: {'splitter': 'best', 'min_samples_split': 0.17237579525697905, 'min_samples_leaf': 0.019367457415305822, 'min_weight_fraction_leaf': 0.05775849359589154, 'max_features': 0.5498985150642921}. Best is trial 691 with value: 0.8340697555858835.[0m
[32m[I 2022-04-21 11:42:35,978][0m Trial 822 finished with value: 0.8128380154318832 and parameters: {'splitter': 'best', 'min_samples_split': 0.1489898460530643, 'min_samples_leaf': 0.009505916914439166, 'min_weight_fraction_leaf': 0.029664938907155644, 'max_features': 0.5644562787701353}. Best is trial 691 with value: 0.8340697555858835.[0m
[32m[I 2022-04-21 11:42:36,379][0m Trial 823 finished with value: 0.8230577405231962 and parameters: {'splitter': 'best', 'min_samples_split': 0.15000856333092413, 'min_samples_leaf': 0.039496254024516, 'min_weight_fraction_leaf': 0.0243369844337844, 'max_features': 0.5181089125464582}. Best is trial 691 with value: 0.8340697555858835.[0m
[32m[I 2022-04-21 11:42:36,688][0m Trial 824 finished with value: 0.8106793308015183 and parameters: {'splitter': 'best', 'min_samples_split': 0.16747874223540396, 'min_samples_leaf': 0.0466138560249882, 'min_weight_fraction_leaf': 0.04307367518756091, 'max_features': 0.5186346016567738}. Best is trial 691 with value: 0.8340697555858835.[0m
[32m[I 2022-04-21 11:42:37,113][0m Trial 825 finished with value: 0.80729525150287 and parameters: {'splitter': 'best', 'min_samples_split': 0.15390578364771534, 'min_samples_leaf': 0.039651769981591055, 'min_weight_fraction_leaf': 0.03305516388442153, 'max_features': 0.539825108441247}. Best is trial 691 with value: 0.8340697555858835.[0m
[32m[I 2022-04-21 11:42:37,431][0m Trial 826 finished with value: 0.8128912105875143 and parameters: {'splitter': 'best', 'min_samples_split': 0.15409896157935477, 'min_samples_leaf': 0.06141764483442233, 'min_weight_fraction_leaf': 0.04339352445041349, 'max_features': 0.5156767202802549}. Best is trial 691 with value: 0.8340697555858835.[0m
/media/san2_ssd/data/Workdir/survival/utils.py:305: RuntimeWarning: invalid value encountered in true_divide
  pdfs = np.gradient(1-survs,axis=1)/norms
[32m[I 2022-04-21 11:42:37,868][0m Trial 827 finished with value: 0.8123304550320697 and parameters: {'splitter': 'best', 'min_samples_split': 0.14913766801758174, 'min_samples_leaf': 0.03405511388373773, 'min_weight_fraction_leaf': 0.02420088430962239, 'max_features': 0.5383051254834832}. Best is trial 691 with value: 0.8340697555858835.[0m
[32m[I 2022-04-21 11:42:38,170][0m Trial 828 finished with value: 0.8041645045516195 and parameters: {'splitter': 'best', 'min_samples_split': 0.14747170069159388, 'min_samples_leaf': 0.05521935209502231, 'min_weight_fraction_leaf': 0.08024091966879461, 'max_features': 0.5180256594066627}. Best is trial 691 with value: 0.8340697555858835.[0m
[32m[I 2022-04-21 11:42:38,797][0m Trial 829 finished with value: 0.8151965283335268 and parameters: {'splitter': 'best', 'min_samples_split': 0.15597611686310464, 'min_samples_leaf': 0.0011590292469201256, 'min_weight_fraction_leaf': 0.02554564904231921, 'max_features': 0.5739022710426326}. Best is trial 691 with value: 0.8340697555858835.[0m
[32m[I 2022-04-21 11:42:39,191][0m Trial 830 finished with value: 0.8183623026651852 and parameters: {'splitter': 'best', 'min_samples_split': 0.1647902391775914, 'min_samples_leaf': 0.03148642748254897, 'min_weight_fraction_leaf': 0.03369892729448953, 'max_features': 0.5540847596956358}. Best is trial 691 with value: 0.8340697555858835.[0m
/media/san2_ssd/data/Workdir/survival/utils.py:305: RuntimeWarning: invalid value encountered in true_divide
  pdfs = np.gradient(1-survs,axis=1)/norms
[32m[I 2022-04-21 11:42:39,607][0m Trial 831 finished with value: 0.8230611495459375 and parameters: {'splitter': 'best', 'min_samples_split': 0.17938882477796375, 'min_samples_leaf': 0.0175421217861874, 'min_weight_fraction_leaf': 0.02644627452682674, 'max_features': 0.5147917625382252}. Best is trial 691 with value: 0.8340697555858835.[0m
[32m[I 2022-04-21 11:42:40,020][0m Trial 832 finished with value: 0.8073677689033809 and parameters: {'splitter': 'best', 'min_samples_split': 0.1700214938735843, 'min_samples_leaf': 0.04366502153447501, 'min_weight_fraction_leaf': 0.038749856320104054, 'max_features': 0.5009410433916592}. Best is trial 691 with value: 0.8340697555858835.[0m
[32m[I 2022-04-21 11:42:40,608][0m Trial 833 finished with value: 0.8179148482695254 and parameters: {'splitter': 'best', 'min_samples_split': 0.15461977773180213, 'min_samples_leaf': 0.029143389528354872, 'min_weight_fraction_leaf': 0.020122572525180515, 'max_features': 0.4879624998771297}. Best is trial 691 with value: 0.8340697555858835.[0m
[32m[I 2022-04-21 11:42:41,282][0m Trial 834 finished with value: 0.8150282482573367 and parameters: {'splitter': 'best', 'min_samples_split': 0.17778864506429246, 'min_samples_leaf': 0.0203410792611968, 'min_weight_fraction_leaf': 0.025244143341579185, 'max_features': 0.5242183340410055}. Best is trial 691 with value: 0.8340697555858835.[0m
[32m[I 2022-04-21 11:42:41,674][0m Trial 835 finished with value: 0.8194903195122343 and parameters: {'splitter': 'best', 'min_samples_split': 0.16900749373180207, 'min_samples_leaf': 0.037444826643171926, 'min_weight_fraction_leaf': 0.03277311289486015, 'max_features': 0.4881804392648133}. Best is trial 691 with value: 0.8340697555858835.[0m
[32m[I 2022-04-21 11:42:41,964][0m Trial 836 finished with value: 0.8074122559012225 and parameters: {'splitter': 'best', 'min_samples_split': 0.17983208851692808, 'min_samples_leaf': 0.051567045066059, 'min_weight_fraction_leaf': 0.018115315300345554, 'max_features': 0.6303689954697278}. Best is trial 691 with value: 0.8340697555858835.[0m
[32m[I 2022-04-21 11:42:42,288][0m Trial 837 finished with value: 0.8033842074232022 and parameters: {'splitter': 'best', 'min_samples_split': 0.1654618708530879, 'min_samples_leaf': 0.020655187556523725, 'min_weight_fraction_leaf': 0.05541939361574994, 'max_features': 0.5038893032954005}. Best is trial 691 with value: 0.8340697555858835.[0m
[32m[I 2022-04-21 11:42:42,462][0m Trial 838 finished with value: 0.7804428529313009 and parameters: {'splitter': 'best', 'min_samples_split': 0.144744501177114, 'min_samples_leaf': 0.027312424879455045, 'min_weight_fraction_leaf': 0.018936660544817952, 'max_features': 0.04148261355936289}. Best is trial 691 with value: 0.8340697555858835.[0m
[32m[I 2022-04-21 11:42:42,615][0m Trial 839 finished with value: 0.46991866821558936 and parameters: {'splitter': 'best', 'min_samples_split': 0.19493861038429483, 'min_samples_leaf': 0.017922995476697564, 'min_weight_fraction_leaf': 0.4170567336451841, 'max_features': 0.5086588557689719}. Best is trial 691 with value: 0.8340697555858835.[0m
[32m[I 2022-04-21 11:42:42,948][0m Trial 840 finished with value: 0.8210548961078873 and parameters: {'splitter': 'best', 'min_samples_split': 0.15757793119765484, 'min_samples_leaf': 0.04070777831318096, 'min_weight_fraction_leaf': 0.03988812090559943, 'max_features': 0.4827522333520651}. Best is trial 691 with value: 0.8340697555858835.[0m
[32m[I 2022-04-21 11:42:43,526][0m Trial 841 finished with value: 0.8163868011353973 and parameters: {'splitter': 'best', 'min_samples_split': 0.16345402396070424, 'min_samples_leaf': 0.0014019809648677054, 'min_weight_fraction_leaf': 0.053776661302065557, 'max_features': 0.49260742417903636}. Best is trial 691 with value: 0.8340697555858835.[0m
[32m[I 2022-04-21 11:42:43,667][0m Trial 842 finished with value: 0.8144500394051576 and parameters: {'splitter': 'random', 'min_samples_split': 0.13125716747248556, 'min_samples_leaf': 0.01682062349592402, 'min_weight_fraction_leaf': 0.015421363346399892, 'max_features': 0.6734802297216295}. Best is trial 691 with value: 0.8340697555858835.[0m
[32m[I 2022-04-21 11:42:44,015][0m Trial 843 finished with value: 0.8084005191718038 and parameters: {'splitter': 'best', 'min_samples_split': 0.18043887433263828, 'min_samples_leaf': 0.029477121944887788, 'min_weight_fraction_leaf': 0.028286989547868898, 'max_features': 0.6482981069413348}. Best is trial 691 with value: 0.8340697555858835.[0m
[32m[I 2022-04-21 11:42:44,810][0m Trial 844 finished with value: 0.8162576929117129 and parameters: {'splitter': 'best', 'min_samples_split': 0.16166867572947194, 'min_samples_leaf': 0.009883905551598467, 'min_weight_fraction_leaf': 0.014945110938984894, 'max_features': 0.5929167809825548}. Best is trial 691 with value: 0.8340697555858835.[0m
[32m[I 2022-04-21 11:42:45,048][0m Trial 845 finished with value: 0.5626700029029573 and parameters: {'splitter': 'best', 'min_samples_split': 0.18492535947872574, 'min_samples_leaf': 0.001178748138276826, 'min_weight_fraction_leaf': 0.3419462745832062, 'max_features': 0.102309744347435}. Best is trial 691 with value: 0.8340697555858835.[0m
[32m[I 2022-04-21 11:42:45,539][0m Trial 846 finished with value: 0.8095209616982654 and parameters: {'splitter': 'best', 'min_samples_split': 0.1437512648447132, 'min_samples_leaf': 0.016689611332744787, 'min_weight_fraction_leaf': 0.010273465003407478, 'max_features': 0.5084588256475022}. Best is trial 691 with value: 0.8340697555858835.[0m
[32m[I 2022-04-21 11:42:45,763][0m Trial 847 finished with value: 0.8054296913870509 and parameters: {'splitter': 'best', 'min_samples_split': 0.16059861471649745, 'min_samples_leaf': 0.06849923595400792, 'min_weight_fraction_leaf': 0.02781797402502576, 'max_features': 0.5984321132992053}. Best is trial 691 with value: 0.8340697555858835.[0m
[32m[I 2022-04-21 11:42:45,977][0m Trial 848 finished with value: 0.6743350097870714 and parameters: {'splitter': 'best', 'min_samples_split': 0.15457122381925306, 'min_samples_leaf': 0.026893445612622316, 'min_weight_fraction_leaf': 0.29263332700663075, 'max_features': 0.6212216299131076}. Best is trial 691 with value: 0.8340697555858835.[0m
[32m[I 2022-04-21 11:42:46,326][0m Trial 849 finished with value: 0.8130891316910113 and parameters: {'splitter': 'best', 'min_samples_split': 0.1403887648009111, 'min_samples_leaf': 0.03879549081000877, 'min_weight_fraction_leaf': 0.044833795742606486, 'max_features': 0.526465394294227}. Best is trial 691 with value: 0.8340697555858835.[0m
[32m[I 2022-04-21 11:42:46,793][0m Trial 850 finished with value: 0.8151025153497198 and parameters: {'splitter': 'best', 'min_samples_split': 0.14403219346637275, 'min_samples_leaf': 0.008502280579128116, 'min_weight_fraction_leaf': 0.008577876446250661, 'max_features': 0.4700998947387197}. Best is trial 691 with value: 0.8340697555858835.[0m
[32m[I 2022-04-21 11:42:47,044][0m Trial 851 finished with value: 0.8129072821191453 and parameters: {'splitter': 'best', 'min_samples_split': 0.14754985602659854, 'min_samples_leaf': 0.018034685229167062, 'min_weight_fraction_leaf': 0.13489002202001948, 'max_features': 0.48730906304469446}. Best is trial 691 with value: 0.8340697555858835.[0m
[32m[I 2022-04-21 11:42:47,174][0m Trial 852 finished with value: 0.8134194116747346 and parameters: {'splitter': 'random', 'min_samples_split': 0.14867208534991896, 'min_samples_leaf': 0.05855312197185565, 'min_weight_fraction_leaf': 0.020631501552299373, 'max_features': 0.5755436412019178}. Best is trial 691 with value: 0.8340697555858835.[0m
/media/san2_ssd/data/Workdir/survival/utils.py:305: RuntimeWarning: invalid value encountered in true_divide
  pdfs = np.gradient(1-survs,axis=1)/norms
[32m[I 2022-04-21 11:42:47,509][0m Trial 853 finished with value: 0.8121450450405157 and parameters: {'splitter': 'best', 'min_samples_split': 0.14138709525153015, 'min_samples_leaf': 0.03072764660045882, 'min_weight_fraction_leaf': 0.03192593856710318, 'max_features': 0.5394445441171267}. Best is trial 691 with value: 0.8340697555858835.[0m
/media/san2_ssd/data/Workdir/survival/utils.py:305: RuntimeWarning: invalid value encountered in true_divide
  pdfs = np.gradient(1-survs,axis=1)/norms
/media/san2_ssd/data/Workdir/survival/utils.py:305: RuntimeWarning: invalid value encountered in true_divide
  pdfs = np.gradient(1-survs,axis=1)/norms
[32m[I 2022-04-21 11:42:48,046][0m Trial 854 finished with value: 0.8132403999567789 and parameters: {'splitter': 'best', 'min_samples_split': 0.1349402515863566, 'min_samples_leaf': 0.009245769471122465, 'min_weight_fraction_leaf': 0.009234600207628296, 'max_features': 0.5124682845352678}. Best is trial 691 with value: 0.8340697555858835.[0m
