[32m[I 2022-04-22 05:12:20,031][0m Trial 816 finished with value: 0.381299011669762 and parameters: {'loss': 'coxph', 'learning_rate': 0.0022431290469064474, 'n_estimators': 896, 'criterion': 'friedman_mse', 'min_samples_split': 2, 'min_samples_leaf': 7, 'min_weight_fraction_leaf': 0.019607281718685907, 'min_impurity_decrease': 0.972118921099948, 'max_features': 0.2794493551682324, 'subsample': 0.32365252812901585, 'dropout_rate': 0.17174492454010412, 'ccp_alpha': 0.23534625975244083}. Best is trial 664 with value: 0.8342316538423719.[0m
[32m[I 2022-04-22 05:17:44,701][0m Trial 817 finished with value: 0.25 and parameters: {'loss': 'coxph', 'learning_rate': 0.0033274388309667397, 'n_estimators': 952, 'criterion': 'squared_error', 'min_samples_split': 2, 'min_samples_leaf': 7, 'min_weight_fraction_leaf': 0.023965399952154465, 'min_impurity_decrease': 0.9826908871605329, 'max_features': 0.332957996298541, 'subsample': 0.30119711226891305, 'dropout_rate': 0.1722440921466312, 'ccp_alpha': 0.08348419831618868}. Best is trial 664 with value: 0.8342316538423719.[0m
[32m[I 2022-04-22 05:22:09,949][0m Trial 818 finished with value: 0.7927128074298004 and parameters: {'loss': 'coxph', 'learning_rate': 0.004026239379794773, 'n_estimators': 853, 'criterion': 'friedman_mse', 'min_samples_split': 2, 'min_samples_leaf': 6, 'min_weight_fraction_leaf': 0.035564663520903456, 'min_impurity_decrease': 0.9576423175284351, 'max_features': 0.31453387742673483, 'subsample': 0.32444433232188635, 'dropout_rate': 0.19673080499531945, 'ccp_alpha': 0.17277283977721095}. Best is trial 664 with value: 0.8342316538423719.[0m
[32m[I 2022-04-22 05:26:26,764][0m Trial 819 finished with value: 0.25 and parameters: {'loss': 'coxph', 'learning_rate': 0.004327416290832231, 'n_estimators': 913, 'criterion': 'absolute_error', 'min_samples_split': 2, 'min_samples_leaf': 7, 'min_weight_fraction_leaf': 0.009903059231126138, 'min_impurity_decrease': 0.9986703792482778, 'max_features': 0.2685868420688288, 'subsample': 0.2925157169654199, 'dropout_rate': 0.15747484089522895, 'ccp_alpha': 0.09812394328076814}. Best is trial 664 with value: 0.8342316538423719.[0m
[32m[I 2022-04-22 05:29:49,457][0m Trial 820 finished with value: 0.25 and parameters: {'loss': 'coxph', 'learning_rate': 0.005436771306547568, 'n_estimators': 951, 'criterion': 'friedman_mse', 'min_samples_split': 2, 'min_samples_leaf': 7, 'min_weight_fraction_leaf': 0.017105791018765915, 'min_impurity_decrease': 0.9446902304778954, 'max_features': 0.34284767870829497, 'subsample': 0.31378004446521446, 'dropout_rate': 0.5197134826754658, 'ccp_alpha': 1.3239714634540343}. Best is trial 664 with value: 0.8342316538423719.[0m
[32m[I 2022-04-22 05:33:35,367][0m Trial 821 finished with value: 0.25 and parameters: {'loss': 'coxph', 'learning_rate': 0.0031571697642298153, 'n_estimators': 823, 'criterion': 'friedman_mse', 'min_samples_split': 2, 'min_samples_leaf': 7, 'min_weight_fraction_leaf': 0.02657473838092162, 'min_impurity_decrease': 0.978049574423105, 'max_features': 0.29892937005821874, 'subsample': 0.33690865586503294, 'dropout_rate': 0.2048080616608981, 'ccp_alpha': 2.968304207281655}. Best is trial 664 with value: 0.8342316538423719.[0m
[32m[I 2022-04-22 05:37:48,949][0m Trial 822 finished with value: 0.8244801924573547 and parameters: {'loss': 'coxph', 'learning_rate': 0.006192676879479279, 'n_estimators': 870, 'criterion': 'friedman_mse', 'min_samples_split': 2, 'min_samples_leaf': 7, 'min_weight_fraction_leaf': 0.0010039655732574267, 'min_impurity_decrease': 0.9421474895725839, 'max_features': 0.24580150153841226, 'subsample': 0.3216829417897758, 'dropout_rate': 0.23678284645198272, 'ccp_alpha': 0.08733507863588685}. Best is trial 664 with value: 0.8342316538423719.[0m
[32m[I 2022-04-22 05:42:16,659][0m Trial 823 finished with value: 0.25662745571200507 and parameters: {'loss': 'coxph', 'learning_rate': 0.004221547368947128, 'n_estimators': 907, 'criterion': 'friedman_mse', 'min_samples_split': 2, 'min_samples_leaf': 7, 'min_weight_fraction_leaf': 0.010277638748769182, 'min_impurity_decrease': 0.9589950870299184, 'max_features': 0.3254280273386926, 'subsample': 0.351881578582063, 'dropout_rate': 0.18629217257692482, 'ccp_alpha': 0.28350912937955103}. Best is trial 664 with value: 0.8342316538423719.[0m
[32m[I 2022-04-22 05:46:05,754][0m Trial 824 finished with value: 0.7053253807195805 and parameters: {'loss': 'coxph', 'learning_rate': 0.005177054109927861, 'n_estimators': 825, 'criterion': 'friedman_mse', 'min_samples_split': 2, 'min_samples_leaf': 6, 'min_weight_fraction_leaf': 0.019412333071575527, 'min_impurity_decrease': 0.9996904849220993, 'max_features': 0.28562432534999405, 'subsample': 0.29496796983526763, 'dropout_rate': 0.2223733824123527, 'ccp_alpha': 0.17890081953949152}. Best is trial 664 with value: 0.8342316538423719.[0m
[32m[I 2022-04-22 05:51:47,172][0m Trial 825 finished with value: 0.8329176243540225 and parameters: {'loss': 'coxph', 'learning_rate': 0.006820836454357513, 'n_estimators': 956, 'criterion': 'friedman_mse', 'min_samples_split': 2, 'min_samples_leaf': 6, 'min_weight_fraction_leaf': 0.03383952225289391, 'min_impurity_decrease': 0.9793761669764999, 'max_features': 0.2087374258691876, 'subsample': 0.3340939810116751, 'dropout_rate': 0.16451331116202578, 'ccp_alpha': 0.0038317881413304864}. Best is trial 664 with value: 0.8342316538423719.[0m
/media/san2_ssd/data/Workdir/survival/venv/lib/python3.8/site-packages/sksurv/ensemble/boosting.py:955: RuntimeWarning: divide by zero encountered in log
  time = numpy.log(time)
/media/san2_ssd/data/Workdir/survival/venv/lib/python3.8/site-packages/sksurv/ensemble/boosting.py:955: RuntimeWarning: divide by zero encountered in log
  time = numpy.log(time)
/media/san2_ssd/data/Workdir/survival/venv/lib/python3.8/site-packages/sksurv/ensemble/boosting.py:955: RuntimeWarning: divide by zero encountered in log
  time = numpy.log(time)
/media/san2_ssd/data/Workdir/survival/venv/lib/python3.8/site-packages/sksurv/ensemble/boosting.py:955: RuntimeWarning: divide by zero encountered in log
  time = numpy.log(time)
[32m[I 2022-04-22 05:52:48,126][0m Trial 826 finished with value: -0.4659630620490699 and parameters: {'loss': 'squared', 'learning_rate': 0.007683957474917356, 'n_estimators': 864, 'criterion': 'friedman_mse', 'min_samples_split': 2, 'min_samples_leaf': 6, 'min_weight_fraction_leaf': 0.03572638446247962, 'min_impurity_decrease': 0.9803631606854164, 'max_features': 0.18616404278551002, 'subsample': 0.31132015952072445, 'dropout_rate': 0.145417850641544, 'ccp_alpha': 0.39575138115574854}. Best is trial 664 with value: 0.8342316538423719.[0m
[32m[I 2022-04-22 05:56:12,314][0m Trial 827 finished with value: 0.823976998079759 and parameters: {'loss': 'coxph', 'learning_rate': 0.006787897780132654, 'n_estimators': 799, 'criterion': 'friedman_mse', 'min_samples_split': 2, 'min_samples_leaf': 6, 'min_weight_fraction_leaf': 0.03613421295086256, 'min_impurity_decrease': 0.9358168448757775, 'max_features': 0.1974038334514933, 'subsample': 0.2870314427062118, 'dropout_rate': 0.23569368982612912, 'ccp_alpha': 0.09597379682732209}. Best is trial 664 with value: 0.8342316538423719.[0m
[32m[I 2022-04-22 06:01:23,907][0m Trial 828 finished with value: 0.25 and parameters: {'loss': 'coxph', 'learning_rate': 0.006633611876113433, 'n_estimators': 928, 'criterion': 'friedman_mse', 'min_samples_split': 2, 'min_samples_leaf': 6, 'min_weight_fraction_leaf': 0.27759112173640405, 'min_impurity_decrease': 0.9798403764876761, 'max_features': 0.21260752017293383, 'subsample': 0.34015007704608025, 'dropout_rate': 0.13431241583991554, 'ccp_alpha': 0.23711103134656966}. Best is trial 664 with value: 0.8342316538423719.[0m
[32m[I 2022-04-22 06:06:22,258][0m Trial 829 finished with value: 0.806194714106175 and parameters: {'loss': 'coxph', 'learning_rate': 0.003566927102614715, 'n_estimators': 882, 'criterion': 'friedman_mse', 'min_samples_split': 2, 'min_samples_leaf': 6, 'min_weight_fraction_leaf': 0.24403363965803188, 'min_impurity_decrease': 0.9529316592662846, 'max_features': 0.14764073144978615, 'subsample': 0.35624888723407083, 'dropout_rate': 0.10872356483169782, 'ccp_alpha': 0.0924821233979827}. Best is trial 664 with value: 0.8342316538423719.[0m
[32m[I 2022-04-22 06:11:08,202][0m Trial 830 finished with value: 0.8257530175065853 and parameters: {'loss': 'coxph', 'learning_rate': 0.0046560185590809235, 'n_estimators': 837, 'criterion': 'friedman_mse', 'min_samples_split': 2, 'min_samples_leaf': 6, 'min_weight_fraction_leaf': 0.0296748257058737, 'min_impurity_decrease': 0.9261947037758663, 'max_features': 0.3461186485265994, 'subsample': 0.7015675128191297, 'dropout_rate': 0.15951269134798107, 'ccp_alpha': 0.00122776372642609}. Best is trial 664 with value: 0.8342316538423719.[0m
[32m[I 2022-04-22 06:16:24,049][0m Trial 831 finished with value: 0.701240433990229 and parameters: {'loss': 'coxph', 'learning_rate': 0.007510010267132086, 'n_estimators': 956, 'criterion': 'friedman_mse', 'min_samples_split': 2, 'min_samples_leaf': 6, 'min_weight_fraction_leaf': 0.00998091619882642, 'min_impurity_decrease': 0.9809193915474882, 'max_features': 0.3121539706682715, 'subsample': 0.30640603766005936, 'dropout_rate': 0.20308595801899967, 'ccp_alpha': 0.1837802919791496}. Best is trial 664 with value: 0.8342316538423719.[0m
[32m[I 2022-04-22 06:20:49,547][0m Trial 832 finished with value: 0.8238446002894111 and parameters: {'loss': 'coxph', 'learning_rate': 0.009568260958139901, 'n_estimators': 885, 'criterion': 'friedman_mse', 'min_samples_split': 2, 'min_samples_leaf': 7, 'min_weight_fraction_leaf': 0.01677197070940639, 'min_impurity_decrease': 0.9632260056522928, 'max_features': 0.32751559939329544, 'subsample': 0.32946197097620566, 'dropout_rate': 0.24933681105767502, 'ccp_alpha': 0.08740029621608707}. Best is trial 664 with value: 0.8342316538423719.[0m
[32m[I 2022-04-22 06:23:04,889][0m Trial 833 finished with value: 0.8125631554115579 and parameters: {'loss': 'coxph', 'learning_rate': 0.005684086107883251, 'n_estimators': 766, 'criterion': 'friedman_mse', 'min_samples_split': 2, 'min_samples_leaf': 7, 'min_weight_fraction_leaf': 0.0011148575159074022, 'min_impurity_decrease': 0.9487503737370899, 'max_features': 0.22045835821955836, 'subsample': 0.2807293670499228, 'dropout_rate': 0.4524864286459382, 'ccp_alpha': 0.17329160083341724}. Best is trial 664 with value: 0.8342316538423719.[0m
[32m[I 2022-04-22 06:26:40,966][0m Trial 834 finished with value: 0.8325259975553619 and parameters: {'loss': 'coxph', 'learning_rate': 0.0026828454564472104, 'n_estimators': 922, 'criterion': 'friedman_mse', 'min_samples_split': 2, 'min_samples_leaf': 6, 'min_weight_fraction_leaf': 0.028630544302433475, 'min_impurity_decrease': 0.9996771441471791, 'max_features': 0.2980528195317692, 'subsample': 0.3514015054117189, 'dropout_rate': 0.2100793470277267, 'ccp_alpha': 0.003759748022563962}. Best is trial 664 with value: 0.8342316538423719.[0m
[32m[I 2022-04-22 06:29:54,771][0m Trial 835 finished with value: 0.25 and parameters: {'loss': 'coxph', 'learning_rate': 0.0026179658889679525, 'n_estimators': 917, 'criterion': 'friedman_mse', 'min_samples_split': 2, 'min_samples_leaf': 6, 'min_weight_fraction_leaf': 0.029506019373600874, 'min_impurity_decrease': 0.9967533879836358, 'max_features': 0.17292903753419409, 'subsample': 0.35301471857820055, 'dropout_rate': 0.20806683171867568, 'ccp_alpha': 3.5518113550641397}. Best is trial 664 with value: 0.8342316538423719.[0m
[32m[I 2022-04-22 06:33:59,727][0m Trial 836 finished with value: 0.8310814603637894 and parameters: {'loss': 'coxph', 'learning_rate': 0.0027535983727625508, 'n_estimators': 956, 'criterion': 'friedman_mse', 'min_samples_split': 2, 'min_samples_leaf': 6, 'min_weight_fraction_leaf': 0.03593409186980111, 'min_impurity_decrease': 0.24548578564658735, 'max_features': 0.2781323420183488, 'subsample': 0.36128062957523155, 'dropout_rate': 0.18730980177275436, 'ccp_alpha': 0.0041131008106069615}. Best is trial 664 with value: 0.8342316538423719.[0m
[32m[I 2022-04-22 06:36:54,199][0m Trial 837 finished with value: 0.2503270102305002 and parameters: {'loss': 'coxph', 'learning_rate': 0.0031501696567961595, 'n_estimators': 860, 'criterion': 'friedman_mse', 'min_samples_split': 2, 'min_samples_leaf': 6, 'min_weight_fraction_leaf': 0.02317222970900873, 'min_impurity_decrease': 0.9843891499932266, 'max_features': 0.2983252642761012, 'subsample': 0.37970145261285515, 'dropout_rate': 0.2373407102460218, 'ccp_alpha': 0.3140787220357182}. Best is trial 664 with value: 0.8342316538423719.[0m
[32m[I 2022-04-22 06:40:21,629][0m Trial 838 finished with value: 0.8325284089710575 and parameters: {'loss': 'coxph', 'learning_rate': 0.002494363064453804, 'n_estimators': 921, 'criterion': 'friedman_mse', 'min_samples_split': 2, 'min_samples_leaf': 6, 'min_weight_fraction_leaf': 0.016882067142929016, 'min_impurity_decrease': 0.9789059315624519, 'max_features': 0.26683022227997877, 'subsample': 0.34513353047011375, 'dropout_rate': 0.2206023341546658, 'ccp_alpha': 0.0021425482604439804}. Best is trial 664 with value: 0.8342316538423719.[0m
[32m[I 2022-04-22 06:43:33,505][0m Trial 839 finished with value: 0.8281039943967352 and parameters: {'loss': 'coxph', 'learning_rate': 0.0018926898422440316, 'n_estimators': 926, 'criterion': 'friedman_mse', 'min_samples_split': 2, 'min_samples_leaf': 6, 'min_weight_fraction_leaf': 0.027634476414753972, 'min_impurity_decrease': 0.9784768258041312, 'max_features': 0.23342943116404508, 'subsample': 0.3651954789196274, 'dropout_rate': 0.22553970838274262, 'ccp_alpha': 0.09778464488753497}. Best is trial 664 with value: 0.8342316538423719.[0m
[32m[I 2022-04-22 06:47:02,416][0m Trial 840 finished with value: 0.25 and parameters: {'loss': 'coxph', 'learning_rate': 0.0021896591903678513, 'n_estimators': 949, 'criterion': 'squared_error', 'min_samples_split': 2, 'min_samples_leaf': 6, 'min_weight_fraction_leaf': 0.036227913607446614, 'min_impurity_decrease': 0.996885555765822, 'max_features': 0.29477493279209527, 'subsample': 0.3497616538254154, 'dropout_rate': 0.20776962254695275, 'ccp_alpha': 0.1581277094608992}. Best is trial 664 with value: 0.8342316538423719.[0m
[32m[I 2022-04-22 06:50:08,641][0m Trial 841 finished with value: 0.25 and parameters: {'loss': 'coxph', 'learning_rate': 0.0020852794355386618, 'n_estimators': 893, 'criterion': 'absolute_error', 'min_samples_split': 2, 'min_samples_leaf': 6, 'min_weight_fraction_leaf': 0.012320731527379015, 'min_impurity_decrease': 0.9715999554614864, 'max_features': 0.34776109894843976, 'subsample': 0.3736228043404515, 'dropout_rate': 0.1874160056132451, 'ccp_alpha': 0.24566100177669223}. Best is trial 664 with value: 0.8342316538423719.[0m
[32m[I 2022-04-22 06:53:31,708][0m Trial 842 finished with value: 0.8334867687366755 and parameters: {'loss': 'coxph', 'learning_rate': 0.0023646646375202187, 'n_estimators': 913, 'criterion': 'friedman_mse', 'min_samples_split': 2, 'min_samples_leaf': 6, 'min_weight_fraction_leaf': 0.018414711623777866, 'min_impurity_decrease': 0.9638593271154448, 'max_features': 0.2591003472074568, 'subsample': 0.3484451710730553, 'dropout_rate': 0.2283835715806296, 'ccp_alpha': 0.003893483825512143}. Best is trial 664 with value: 0.8342316538423719.[0m
[32m[I 2022-04-22 06:57:18,881][0m Trial 843 finished with value: 0.8259000408929873 and parameters: {'loss': 'coxph', 'learning_rate': 0.0018701302779723585, 'n_estimators': 954, 'criterion': 'friedman_mse', 'min_samples_split': 2, 'min_samples_leaf': 6, 'min_weight_fraction_leaf': 0.010648489000360766, 'min_impurity_decrease': 0.9513756748390383, 'max_features': 0.205107965769654, 'subsample': 0.3566640190003414, 'dropout_rate': 0.16530979908513876, 'ccp_alpha': 0.09644481610179792}. Best is trial 664 with value: 0.8342316538423719.[0m
[32m[I 2022-04-22 07:00:37,158][0m Trial 844 finished with value: 0.3596132632793025 and parameters: {'loss': 'coxph', 'learning_rate': 0.0022841389692022864, 'n_estimators': 915, 'criterion': 'friedman_mse', 'min_samples_split': 2, 'min_samples_leaf': 6, 'min_weight_fraction_leaf': 0.3273200492397668, 'min_impurity_decrease': 0.03823121604495766, 'max_features': 0.24833986672236757, 'subsample': 0.35109271405620807, 'dropout_rate': 0.2081555505783837, 'ccp_alpha': 0.16125820929107748}. Best is trial 664 with value: 0.8342316538423719.[0m
/media/san2_ssd/data/Workdir/survival/venv/lib/python3.8/site-packages/sksurv/ensemble/boosting.py:955: RuntimeWarning: divide by zero encountered in log
  time = numpy.log(time)
/media/san2_ssd/data/Workdir/survival/venv/lib/python3.8/site-packages/sksurv/ensemble/boosting.py:955: RuntimeWarning: divide by zero encountered in log
  time = numpy.log(time)
/media/san2_ssd/data/Workdir/survival/venv/lib/python3.8/site-packages/sksurv/ensemble/boosting.py:955: RuntimeWarning: divide by zero encountered in log
  time = numpy.log(time)
/media/san2_ssd/data/Workdir/survival/venv/lib/python3.8/site-packages/sksurv/ensemble/boosting.py:955: RuntimeWarning: divide by zero encountered in log
  time = numpy.log(time)
[32m[I 2022-04-22 07:01:23,065][0m Trial 845 finished with value: -0.4666750405033214 and parameters: {'loss': 'squared', 'learning_rate': 0.001558166189245433, 'n_estimators': 958, 'criterion': 'friedman_mse', 'min_samples_split': 2, 'min_samples_leaf': 6, 'min_weight_fraction_leaf': 0.017691739369521738, 'min_impurity_decrease': 0.9638122129534356, 'max_features': 0.3591183173164653, 'subsample': 0.3822241576248763, 'dropout_rate': 0.22402987482210077, 'ccp_alpha': 0.08991381694435512}. Best is trial 664 with value: 0.8342316538423719.[0m
[32m[I 2022-04-22 07:04:57,715][0m Trial 846 finished with value: 0.8312595246098586 and parameters: {'loss': 'coxph', 'learning_rate': 0.002506175343152191, 'n_estimators': 902, 'criterion': 'friedman_mse', 'min_samples_split': 2, 'min_samples_leaf': 6, 'min_weight_fraction_leaf': 0.009460363649124188, 'min_impurity_decrease': 0.9394075819811858, 'max_features': 0.3296530392642463, 'subsample': 0.3808561203531163, 'dropout_rate': 0.1906271113457636, 'ccp_alpha': 0.0038377662951179572}. Best is trial 664 with value: 0.8342316538423719.[0m
[32m[I 2022-04-22 07:08:18,934][0m Trial 847 finished with value: 0.25 and parameters: {'loss': 'coxph', 'learning_rate': 0.001946007147238082, 'n_estimators': 912, 'criterion': 'friedman_mse', 'min_samples_split': 2, 'min_samples_leaf': 6, 'min_weight_fraction_leaf': 0.019279402270729072, 'min_impurity_decrease': 0.9434533925314573, 'max_features': 0.33430486514737545, 'subsample': 0.38600663326303103, 'dropout_rate': 0.17199166708361333, 'ccp_alpha': 0.7526585721350177}. Best is trial 664 with value: 0.8342316538423719.[0m
[32m[I 2022-04-22 07:11:54,680][0m Trial 848 finished with value: 0.25 and parameters: {'loss': 'coxph', 'learning_rate': 0.0022795134699529034, 'n_estimators': 960, 'criterion': 'friedman_mse', 'min_samples_split': 2, 'min_samples_leaf': 6, 'min_weight_fraction_leaf': 0.0017472048469939962, 'min_impurity_decrease': 0.9663078947372672, 'max_features': 0.362129389572848, 'subsample': 0.37603581410763104, 'dropout_rate': 0.22039316061065484, 'ccp_alpha': 0.4921488651440133}. Best is trial 664 with value: 0.8342316538423719.[0m
[32m[I 2022-04-22 07:15:02,917][0m Trial 849 finished with value: 0.3724450853015603 and parameters: {'loss': 'coxph', 'learning_rate': 0.0015908905297280698, 'n_estimators': 898, 'criterion': 'friedman_mse', 'min_samples_split': 2, 'min_samples_leaf': 6, 'min_weight_fraction_leaf': 0.0010370526658694396, 'min_impurity_decrease': 0.9389242453348936, 'max_features': 0.32625357817319756, 'subsample': 0.38138631450581245, 'dropout_rate': 0.20078648749276437, 'ccp_alpha': 0.21412491470908424}. Best is trial 664 with value: 0.8342316538423719.[0m
[32m[I 2022-04-22 07:18:26,711][0m Trial 850 finished with value: 0.8238495170585323 and parameters: {'loss': 'coxph', 'learning_rate': 0.0023847563195345113, 'n_estimators': 958, 'criterion': 'friedman_mse', 'min_samples_split': 2, 'min_samples_leaf': 6, 'min_weight_fraction_leaf': 0.03658396319162449, 'min_impurity_decrease': 0.9638684842647203, 'max_features': 0.34655119705502163, 'subsample': 0.36353285652480927, 'dropout_rate': 0.23957987574725836, 'ccp_alpha': 0.08364637558815755}. Best is trial 664 with value: 0.8342316538423719.[0m
[32m[I 2022-04-22 07:21:43,054][0m Trial 851 finished with value: 0.25 and parameters: {'loss': 'coxph', 'learning_rate': 0.0024535425747101184, 'n_estimators': 916, 'criterion': 'friedman_mse', 'min_samples_split': 2, 'min_samples_leaf': 6, 'min_weight_fraction_leaf': 0.025576131830426597, 'min_impurity_decrease': 0.983803534259253, 'max_features': 0.38487442008338346, 'subsample': 0.36293178156298816, 'dropout_rate': 0.1889532674631882, 'ccp_alpha': 0.3376992432485349}. Best is trial 664 with value: 0.8342316538423719.[0m
[32m[I 2022-04-22 07:25:31,785][0m Trial 852 finished with value: 0.5956740730486556 and parameters: {'loss': 'coxph', 'learning_rate': 0.002131255307994721, 'n_estimators': 999, 'criterion': 'friedman_mse', 'min_samples_split': 2, 'min_samples_leaf': 6, 'min_weight_fraction_leaf': 0.011872816371022579, 'min_impurity_decrease': 0.9310834530418137, 'max_features': 0.3167257833595718, 'subsample': 0.38359176685544316, 'dropout_rate': 0.2172527306802561, 'ccp_alpha': 0.1652089380598687}. Best is trial 664 with value: 0.8342316538423719.[0m
