[32m[I 2022-04-21 21:25:37,048][0m Trial 174 finished with value: 0.6878349631071197 and parameters: {'loss': 'coxph', 'learning_rate': 0.0004538207809557572, 'n_estimators': 311, 'criterion': 'squared_error', 'min_samples_split': 7, 'min_samples_leaf': 10, 'min_weight_fraction_leaf': 0.20195779441657155, 'min_impurity_decrease': 0.0713533055852019, 'max_features': 0.08598746053835027, 'subsample': 0.31516094581672033, 'dropout_rate': 0.23944539458063754, 'ccp_alpha': 0.008106072840815102}. Best is trial 74 with value: 0.6902043616759457.[0m
[32m[I 2022-04-21 21:25:53,353][0m Trial 175 finished with value: 0.6876095225027152 and parameters: {'loss': 'coxph', 'learning_rate': 0.00044648311315799406, 'n_estimators': 308, 'criterion': 'squared_error', 'min_samples_split': 7, 'min_samples_leaf': 10, 'min_weight_fraction_leaf': 0.19911904804695882, 'min_impurity_decrease': 0.07443504903633993, 'max_features': 0.10814503697702782, 'subsample': 0.31955948742622453, 'dropout_rate': 0.23221355813926212, 'ccp_alpha': 0.010401641555661572}. Best is trial 74 with value: 0.6902043616759457.[0m
[32m[I 2022-04-21 21:26:10,106][0m Trial 176 finished with value: 0.674448756244709 and parameters: {'loss': 'coxph', 'learning_rate': 0.00048743384049443675, 'n_estimators': 314, 'criterion': 'squared_error', 'min_samples_split': 7, 'min_samples_leaf': 10, 'min_weight_fraction_leaf': 0.20075140181080323, 'min_impurity_decrease': 0.07093366322017064, 'max_features': 0.09849953168495215, 'subsample': 0.326383935316918, 'dropout_rate': 0.23280195570196702, 'ccp_alpha': 0.2223253474189208}. Best is trial 74 with value: 0.6902043616759457.[0m
[32m[I 2022-04-21 21:26:37,661][0m Trial 177 finished with value: 0.6002832618163076 and parameters: {'loss': 'coxph', 'learning_rate': 0.00022463896140036835, 'n_estimators': 328, 'criterion': 'squared_error', 'min_samples_split': 7, 'min_samples_leaf': 10, 'min_weight_fraction_leaf': 0.23365817351228, 'min_impurity_decrease': 0.09146613803296204, 'max_features': 0.11423112275381034, 'subsample': 0.3113195213403985, 'dropout_rate': 0.22334810702792834, 'ccp_alpha': 0.37429517899442055}. Best is trial 74 with value: 0.6902043616759457.[0m
[32m[I 2022-04-21 21:26:54,984][0m Trial 178 finished with value: 0.5 and parameters: {'loss': 'coxph', 'learning_rate': 0.0004620267116286846, 'n_estimators': 309, 'criterion': 'squared_error', 'min_samples_split': 7, 'min_samples_leaf': 10, 'min_weight_fraction_leaf': 0.18036942132006936, 'min_impurity_decrease': 0.06305101500028562, 'max_features': 0.10379473656779398, 'subsample': 0.06550547852844985, 'dropout_rate': 0.1941546591961133, 'ccp_alpha': 0.001680380542788254}. Best is trial 74 with value: 0.6902043616759457.[0m
[32m[I 2022-04-21 21:27:17,416][0m Trial 179 finished with value: 0.6863662592876107 and parameters: {'loss': 'coxph', 'learning_rate': 0.0002866001141730958, 'n_estimators': 321, 'criterion': 'squared_error', 'min_samples_split': 7, 'min_samples_leaf': 10, 'min_weight_fraction_leaf': 0.18898483661564988, 'min_impurity_decrease': 0.10876851142681851, 'max_features': 0.06684199844684197, 'subsample': 0.3492116279697058, 'dropout_rate': 0.2423092773063396, 'ccp_alpha': 0.0015412043546193382}. Best is trial 74 with value: 0.6902043616759457.[0m
[32m[I 2022-04-21 21:27:45,173][0m Trial 180 finished with value: 0.6740714852853033 and parameters: {'loss': 'coxph', 'learning_rate': 0.0002839648978385361, 'n_estimators': 355, 'criterion': 'squared_error', 'min_samples_split': 7, 'min_samples_leaf': 10, 'min_weight_fraction_leaf': 0.19769680358665506, 'min_impurity_decrease': 0.080164620764077, 'max_features': 0.08235812551000983, 'subsample': 0.34567659401775874, 'dropout_rate': 0.177607962167266, 'ccp_alpha': 0.20051864942553516}. Best is trial 74 with value: 0.6902043616759457.[0m
[32m[I 2022-04-21 21:28:08,996][0m Trial 181 finished with value: 0.6886529203024677 and parameters: {'loss': 'coxph', 'learning_rate': 0.00040992363837181746, 'n_estimators': 320, 'criterion': 'squared_error', 'min_samples_split': 7, 'min_samples_leaf': 10, 'min_weight_fraction_leaf': 0.188805923303183, 'min_impurity_decrease': 0.11106305850478233, 'max_features': 0.060638563233333, 'subsample': 0.31997681258311295, 'dropout_rate': 0.24124977110059764, 'ccp_alpha': 0.09344030031776024}. Best is trial 74 with value: 0.6902043616759457.[0m
[32m[I 2022-04-21 21:28:31,335][0m Trial 182 finished with value: 0.6863662592876107 and parameters: {'loss': 'coxph', 'learning_rate': 0.00032683643863066884, 'n_estimators': 320, 'criterion': 'squared_error', 'min_samples_split': 7, 'min_samples_leaf': 10, 'min_weight_fraction_leaf': 0.1870492017696604, 'min_impurity_decrease': 0.10664999880004081, 'max_features': 0.06207196580966466, 'subsample': 0.35198669836040025, 'dropout_rate': 0.24297302066032458, 'ccp_alpha': 0.002487660606608502}. Best is trial 74 with value: 0.6902043616759457.[0m
[32m[I 2022-04-21 21:28:48,965][0m Trial 183 finished with value: 0.6869514461556436 and parameters: {'loss': 'coxph', 'learning_rate': 0.00017694251590300443, 'n_estimators': 328, 'criterion': 'squared_error', 'min_samples_split': 7, 'min_samples_leaf': 10, 'min_weight_fraction_leaf': 0.18742412457194296, 'min_impurity_decrease': 0.10073194860666487, 'max_features': 0.06292331802665706, 'subsample': 0.25806988498341027, 'dropout_rate': 0.24578583059806572, 'ccp_alpha': 0.0015912223241830864}. Best is trial 74 with value: 0.6902043616759457.[0m
[32m[I 2022-04-21 21:29:14,869][0m Trial 184 finished with value: 0.6867859151422349 and parameters: {'loss': 'coxph', 'learning_rate': 0.0001886513628703013, 'n_estimators': 327, 'criterion': 'squared_error', 'min_samples_split': 7, 'min_samples_leaf': 10, 'min_weight_fraction_leaf': 0.1720495188005729, 'min_impurity_decrease': 0.045126963497957084, 'max_features': 0.07219174922094142, 'subsample': 0.25426335866547445, 'dropout_rate': 0.24190148812880197, 'ccp_alpha': 0.003172361533376522}. Best is trial 74 with value: 0.6902043616759457.[0m
[32m[I 2022-04-21 21:29:36,104][0m Trial 185 finished with value: 0.6873810164300279 and parameters: {'loss': 'coxph', 'learning_rate': 0.0001686229771428702, 'n_estimators': 331, 'criterion': 'squared_error', 'min_samples_split': 7, 'min_samples_leaf': 10, 'min_weight_fraction_leaf': 0.1682232563079871, 'min_impurity_decrease': 0.04079236262637037, 'max_features': 0.8209503496990347, 'subsample': 0.25316898236032664, 'dropout_rate': 0.20938748723924172, 'ccp_alpha': 0.008490769724960937}. Best is trial 74 with value: 0.6902043616759457.[0m
[32m[I 2022-04-21 21:30:07,447][0m Trial 186 finished with value: 0.6843349731645828 and parameters: {'loss': 'coxph', 'learning_rate': 0.00016780017703523642, 'n_estimators': 334, 'criterion': 'squared_error', 'min_samples_split': 7, 'min_samples_leaf': 10, 'min_weight_fraction_leaf': 0.1633783844527365, 'min_impurity_decrease': 0.04487348395117647, 'max_features': 0.8110910626809104, 'subsample': 0.22865609387421182, 'dropout_rate': 0.2124572154220731, 'ccp_alpha': 0.028591891288939863}. Best is trial 74 with value: 0.6902043616759457.[0m
[32m[I 2022-04-21 21:30:31,735][0m Trial 187 finished with value: 0.6933481836305168 and parameters: {'loss': 'coxph', 'learning_rate': 0.00018771369015567628, 'n_estimators': 361, 'criterion': 'squared_error', 'min_samples_split': 7, 'min_samples_leaf': 10, 'min_weight_fraction_leaf': 0.18467613089226587, 'min_impurity_decrease': 0.03892003884009698, 'max_features': 0.8430994376111369, 'subsample': 0.25481491532164796, 'dropout_rate': 0.13028118858724377, 'ccp_alpha': 0.014966792041178607}. Best is trial 187 with value: 0.6933481836305168.[0m
/media/san2_ssd/data/Workdir/survival/venv/lib/python3.8/site-packages/sksurv/ensemble/boosting.py:955: RuntimeWarning: divide by zero encountered in log
  time = numpy.log(time)
/media/san2_ssd/data/Workdir/survival/venv/lib/python3.8/site-packages/sksurv/ensemble/boosting.py:955: RuntimeWarning: divide by zero encountered in log
  time = numpy.log(time)
/media/san2_ssd/data/Workdir/survival/venv/lib/python3.8/site-packages/sksurv/ensemble/boosting.py:955: RuntimeWarning: divide by zero encountered in log
  time = numpy.log(time)
/media/san2_ssd/data/Workdir/survival/venv/lib/python3.8/site-packages/sksurv/ensemble/boosting.py:955: RuntimeWarning: divide by zero encountered in log
  time = numpy.log(time)
[32m[I 2022-04-21 21:30:36,963][0m Trial 188 finished with value: -0.7297033464820903 and parameters: {'loss': 'squared', 'learning_rate': 0.00010470308526247685, 'n_estimators': 342, 'criterion': 'squared_error', 'min_samples_split': 7, 'min_samples_leaf': 10, 'min_weight_fraction_leaf': 0.15933971612361308, 'min_impurity_decrease': 0.053385200751185954, 'max_features': 0.8348307903838326, 'subsample': 0.2449266087868117, 'dropout_rate': 0.19416896250946372, 'ccp_alpha': 0.007863868815838532}. Best is trial 187 with value: 0.6933481836305168.[0m
[32m[I 2022-04-21 21:31:01,951][0m Trial 189 finished with value: 0.6766015920466202 and parameters: {'loss': 'coxph', 'learning_rate': 0.00016964170509140976, 'n_estimators': 362, 'criterion': 'squared_error', 'min_samples_split': 7, 'min_samples_leaf': 10, 'min_weight_fraction_leaf': 0.17574679160373413, 'min_impurity_decrease': 0.03551599830919977, 'max_features': 0.8409643291040433, 'subsample': 0.2610392390550121, 'dropout_rate': 0.17013498567600832, 'ccp_alpha': 0.24381626078850022}. Best is trial 187 with value: 0.6933481836305168.[0m
[32m[I 2022-04-21 21:31:22,793][0m Trial 190 finished with value: 0.678828170161717 and parameters: {'loss': 'coxph', 'learning_rate': 0.00012716798172748725, 'n_estimators': 358, 'criterion': 'squared_error', 'min_samples_split': 7, 'min_samples_leaf': 10, 'min_weight_fraction_leaf': 0.17518874017762492, 'min_impurity_decrease': 0.031842042792409306, 'max_features': 0.8870276134455714, 'subsample': 0.2019755634181748, 'dropout_rate': 0.25299918389322074, 'ccp_alpha': 0.1920581958091593}. Best is trial 187 with value: 0.6933481836305168.[0m
[32m[I 2022-04-21 21:31:52,299][0m Trial 191 finished with value: 0.6894505915961366 and parameters: {'loss': 'coxph', 'learning_rate': 0.00021398825469301887, 'n_estimators': 335, 'criterion': 'squared_error', 'min_samples_split': 7, 'min_samples_leaf': 10, 'min_weight_fraction_leaf': 0.18546192006372964, 'min_impurity_decrease': 0.06863776998595397, 'max_features': 0.8633127182589473, 'subsample': 0.2572661600693562, 'dropout_rate': 0.14263112903765693, 'ccp_alpha': 0.0010403510767349553}. Best is trial 187 with value: 0.6933481836305168.[0m
[32m[I 2022-04-21 21:32:13,473][0m Trial 192 finished with value: 0.6872491111876486 and parameters: {'loss': 'coxph', 'learning_rate': 0.00019425074403329218, 'n_estimators': 323, 'criterion': 'squared_error', 'min_samples_split': 7, 'min_samples_leaf': 10, 'min_weight_fraction_leaf': 0.18591012812905808, 'min_impurity_decrease': 0.06880675008093405, 'max_features': 0.8142518468237231, 'subsample': 0.257083089214994, 'dropout_rate': 0.12993433295523826, 'ccp_alpha': 0.14099526810820698}. Best is trial 187 with value: 0.6933481836305168.[0m
[32m[I 2022-04-21 21:32:43,549][0m Trial 193 finished with value: 0.679969563339172 and parameters: {'loss': 'coxph', 'learning_rate': 0.00021140124343191694, 'n_estimators': 348, 'criterion': 'squared_error', 'min_samples_split': 7, 'min_samples_leaf': 10, 'min_weight_fraction_leaf': 0.16723981695841234, 'min_impurity_decrease': 0.06532959966408386, 'max_features': 0.8174612327873114, 'subsample': 0.2540043363672616, 'dropout_rate': 0.10719075346151406, 'ccp_alpha': 0.15769892451368495}. Best is trial 187 with value: 0.6933481836305168.[0m
[32m[I 2022-04-21 21:33:16,873][0m Trial 194 finished with value: 0.5 and parameters: {'loss': 'coxph', 'learning_rate': 0.00015512408152668216, 'n_estimators': 395, 'criterion': 'squared_error', 'min_samples_split': 7, 'min_samples_leaf': 10, 'min_weight_fraction_leaf': 0.1836071773464699, 'min_impurity_decrease': 0.01570748090796849, 'max_features': 0.7804186856954736, 'subsample': 0.2200019259715668, 'dropout_rate': 0.10733369909787754, 'ccp_alpha': 3.5478962290209695}. Best is trial 187 with value: 0.6933481836305168.[0m
[32m[I 2022-04-21 21:33:38,875][0m Trial 195 finished with value: 0.667875228363324 and parameters: {'loss': 'coxph', 'learning_rate': 8.077182262720514e-05, 'n_estimators': 298, 'criterion': 'squared_error', 'min_samples_split': 7, 'min_samples_leaf': 10, 'min_weight_fraction_leaf': 0.14747882924327585, 'min_impurity_decrease': 0.0786325470506759, 'max_features': 0.736033492337517, 'subsample': 0.262496079668615, 'dropout_rate': 0.07635906671820697, 'ccp_alpha': 0.27585192184137675}. Best is trial 187 with value: 0.6933481836305168.[0m
[32m[I 2022-04-21 21:33:59,380][0m Trial 196 finished with value: 0.6872950077365688 and parameters: {'loss': 'coxph', 'learning_rate': 0.00020266842841706534, 'n_estimators': 330, 'criterion': 'squared_error', 'min_samples_split': 7, 'min_samples_leaf': 10, 'min_weight_fraction_leaf': 0.1962330254391113, 'min_impurity_decrease': 0.05319844165008663, 'max_features': 0.8620867012309147, 'subsample': 0.27728958042944685, 'dropout_rate': 0.12665274627316056, 'ccp_alpha': 0.12449161057638768}. Best is trial 187 with value: 0.6933481836305168.[0m
[32m[I 2022-04-21 21:34:23,088][0m Trial 197 finished with value: 0.6845083505009397 and parameters: {'loss': 'coxph', 'learning_rate': 0.00019995190770312303, 'n_estimators': 328, 'criterion': 'squared_error', 'min_samples_split': 7, 'min_samples_leaf': 10, 'min_weight_fraction_leaf': 0.20246481021987955, 'min_impurity_decrease': 0.05288169739685687, 'max_features': 0.8620125296741242, 'subsample': 0.2829430399333243, 'dropout_rate': 0.122199509672525, 'ccp_alpha': 0.1451649919595619}. Best is trial 187 with value: 0.6933481836305168.[0m
[32m[I 2022-04-21 21:35:01,838][0m Trial 198 finished with value: 0.6132883405865569 and parameters: {'loss': 'coxph', 'learning_rate': 0.00014024862290831785, 'n_estimators': 373, 'criterion': 'absolute_error', 'min_samples_split': 7, 'min_samples_leaf': 10, 'min_weight_fraction_leaf': 0.19613211064893937, 'min_impurity_decrease': 0.03472107879658297, 'max_features': 0.8656024221411082, 'subsample': 0.23792005527934, 'dropout_rate': 0.13588279846886944, 'ccp_alpha': 0.29901838827995797}. Best is trial 187 with value: 0.6933481836305168.[0m
[32m[I 2022-04-21 21:35:28,883][0m Trial 199 finished with value: 0.6880662208365439 and parameters: {'loss': 'coxph', 'learning_rate': 0.00011592596073399241, 'n_estimators': 339, 'criterion': 'squared_error', 'min_samples_split': 7, 'min_samples_leaf': 10, 'min_weight_fraction_leaf': 0.18985840459972825, 'min_impurity_decrease': 0.00726589467806605, 'max_features': 0.8273340596300113, 'subsample': 0.2792026542822802, 'dropout_rate': 0.06920297443236767, 'ccp_alpha': 0.10232344987090934}. Best is trial 187 with value: 0.6933481836305168.[0m
[32m[I 2022-04-21 21:36:01,457][0m Trial 200 finished with value: 0.6814687100015528 and parameters: {'loss': 'coxph', 'learning_rate': 0.0001097843511371481, 'n_estimators': 342, 'criterion': 'squared_error', 'min_samples_split': 7, 'min_samples_leaf': 10, 'min_weight_fraction_leaf': 0.19398035307277955, 'min_impurity_decrease': 0.003982273774753464, 'max_features': 0.8900346002141983, 'subsample': 0.24760906430067942, 'dropout_rate': 0.08456857528976386, 'ccp_alpha': 0.16689655819389146}. Best is trial 187 with value: 0.6933481836305168.[0m
[32m[I 2022-04-21 21:36:28,503][0m Trial 201 finished with value: 0.6921059342981418 and parameters: {'loss': 'coxph', 'learning_rate': 0.0002416826976886122, 'n_estimators': 330, 'criterion': 'squared_error', 'min_samples_split': 7, 'min_samples_leaf': 10, 'min_weight_fraction_leaf': 0.17341211263796918, 'min_impurity_decrease': 0.025687453532337666, 'max_features': 0.8188493419993839, 'subsample': 0.28072604945541857, 'dropout_rate': 0.021547817385474233, 'ccp_alpha': 0.09936341113604248}. Best is trial 187 with value: 0.6933481836305168.[0m
[32m[I 2022-04-21 21:36:58,981][0m Trial 202 finished with value: 0.6850476351896976 and parameters: {'loss': 'coxph', 'learning_rate': 0.00022097751183582502, 'n_estimators': 330, 'criterion': 'squared_error', 'min_samples_split': 7, 'min_samples_leaf': 10, 'min_weight_fraction_leaf': 0.17347948432985827, 'min_impurity_decrease': 0.023975826344180898, 'max_features': 0.8181762867838379, 'subsample': 0.27497471865555734, 'dropout_rate': 0.04229622391985366, 'ccp_alpha': 0.09966298788468483}. Best is trial 187 with value: 0.6933481836305168.[0m
[32m[I 2022-04-21 21:37:21,961][0m Trial 203 finished with value: 0.5 and parameters: {'loss': 'coxph', 'learning_rate': 0.0001726788299154715, 'n_estimators': 301, 'criterion': 'squared_error', 'min_samples_split': 7, 'min_samples_leaf': 10, 'min_weight_fraction_leaf': 0.20619036656269069, 'min_impurity_decrease': 0.00326880178956037, 'max_features': 0.8476245050260484, 'subsample': 0.3005697102819721, 'dropout_rate': 0.15710187833629669, 'ccp_alpha': 1.2858391352230614}. Best is trial 187 with value: 0.6933481836305168.[0m
[32m[I 2022-04-21 21:37:55,958][0m Trial 204 finished with value: 0.6716088767996088 and parameters: {'loss': 'coxph', 'learning_rate': 0.0002381877387952318, 'n_estimators': 350, 'criterion': 'squared_error', 'min_samples_split': 7, 'min_samples_leaf': 10, 'min_weight_fraction_leaf': 0.18583884669257072, 'min_impurity_decrease': 0.04872749073487263, 'max_features': 0.7898585120633923, 'subsample': 0.2238824941077983, 'dropout_rate': 0.014342115254639316, 'ccp_alpha': 0.20611278847401457}. Best is trial 187 with value: 0.6933481836305168.[0m
[32m[I 2022-04-21 21:38:29,013][0m Trial 205 finished with value: 0.5 and parameters: {'loss': 'coxph', 'learning_rate': 6.139351970036895e-05, 'n_estimators': 327, 'criterion': 'squared_error', 'min_samples_split': 7, 'min_samples_leaf': 10, 'min_weight_fraction_leaf': 0.1718861330982073, 'min_impurity_decrease': 0.025153171798886247, 'max_features': 0.8376773853733336, 'subsample': 0.27417466798919077, 'dropout_rate': 0.04874666954934766, 'ccp_alpha': 2.16920775268133}. Best is trial 187 with value: 0.6933481836305168.[0m
[32m[I 2022-04-21 21:38:47,362][0m Trial 206 finished with value: 0.6877731842980875 and parameters: {'loss': 'coxph', 'learning_rate': 0.0001969635151331137, 'n_estimators': 285, 'criterion': 'squared_error', 'min_samples_split': 7, 'min_samples_leaf': 10, 'min_weight_fraction_leaf': 0.21533868819106827, 'min_impurity_decrease': 0.058702729704519056, 'max_features': 0.9322523092693078, 'subsample': 0.2888922838457015, 'dropout_rate': 0.04394634172553649, 'ccp_alpha': 0.08302788149272006}. Best is trial 187 with value: 0.6933481836305168.[0m
[32m[I 2022-04-21 21:39:03,564][0m Trial 207 finished with value: 0.6894133810726565 and parameters: {'loss': 'coxph', 'learning_rate': 0.0001251484333180334, 'n_estimators': 288, 'criterion': 'squared_error', 'min_samples_split': 7, 'min_samples_leaf': 10, 'min_weight_fraction_leaf': 0.21803606000482811, 'min_impurity_decrease': 0.05618973830855886, 'max_features': 0.9342176496815674, 'subsample': 0.2917352720363534, 'dropout_rate': 0.07333281387377155, 'ccp_alpha': 0.1085334657286156}. Best is trial 187 with value: 0.6933481836305168.[0m
[32m[I 2022-04-21 21:39:19,996][0m Trial 208 finished with value: 0.6493332755992979 and parameters: {'loss': 'coxph', 'learning_rate': 0.0001174435212970486, 'n_estimators': 283, 'criterion': 'squared_error', 'min_samples_split': 7, 'min_samples_leaf': 10, 'min_weight_fraction_leaf': 0.22153821241981844, 'min_impurity_decrease': 0.06207075632798209, 'max_features': 0.9344929399594111, 'subsample': 0.291110120996172, 'dropout_rate': 0.06150303516167748, 'ccp_alpha': 0.3503638597214525}. Best is trial 187 with value: 0.6933481836305168.[0m
[32m[I 2022-04-21 21:39:42,632][0m Trial 209 finished with value: 0.6706257710359198 and parameters: {'loss': 'coxph', 'learning_rate': 0.00014028384229752228, 'n_estimators': 296, 'criterion': 'squared_error', 'min_samples_split': 7, 'min_samples_leaf': 10, 'min_weight_fraction_leaf': 0.21357311800504591, 'min_impurity_decrease': 0.07067656933396421, 'max_features': 0.9949902751697681, 'subsample': 0.3062205553639402, 'dropout_rate': 0.03851114135025877, 'ccp_alpha': 0.24732936208481449}. Best is trial 187 with value: 0.6933481836305168.[0m
[32m[I 2022-04-21 21:40:04,656][0m Trial 210 finished with value: 0.6899061166901883 and parameters: {'loss': 'coxph', 'learning_rate': 8.470480436327811e-05, 'n_estimators': 288, 'criterion': 'squared_error', 'min_samples_split': 7, 'min_samples_leaf': 10, 'min_weight_fraction_leaf': 0.19811796447583732, 'min_impurity_decrease': 0.032069847933714035, 'max_features': 0.9527989548332938, 'subsample': 0.2850719968184872, 'dropout_rate': 0.07244786413688559, 'ccp_alpha': 0.11941684459591322}. Best is trial 187 with value: 0.6933481836305168.[0m
[32m[I 2022-04-21 21:40:22,278][0m Trial 211 finished with value: 0.6899061166901883 and parameters: {'loss': 'coxph', 'learning_rate': 8.441420894998518e-05, 'n_estimators': 301, 'criterion': 'squared_error', 'min_samples_split': 7, 'min_samples_leaf': 10, 'min_weight_fraction_leaf': 0.20156274698452786, 'min_impurity_decrease': 0.028855344833062457, 'max_features': 0.9050746875558545, 'subsample': 0.29091558882413665, 'dropout_rate': 0.06832224275284832, 'ccp_alpha': 0.114268084364132}. Best is trial 187 with value: 0.6933481836305168.[0m
