[32m[I 2022-04-21 17:12:58,416][0m Trial 329 finished with value: 0.8415477144157826 and parameters: {'loss': 'coxph', 'learning_rate': 0.007065457551017345, 'n_estimators': 271, 'criterion': 'friedman_mse', 'min_samples_split': 3, 'min_samples_leaf': 2, 'min_weight_fraction_leaf': 0.1932700651680519, 'min_impurity_decrease': 0.3245868145401098, 'max_features': 0.5784350967823154, 'subsample': 0.09319181841815721, 'dropout_rate': 0.11820057843852033, 'ccp_alpha': 0.3925061016482482}. Best is trial 244 with value: 0.8474070660226068.[0m
[32m[I 2022-04-21 17:13:04,603][0m Trial 330 finished with value: 0.8439797236213658 and parameters: {'loss': 'coxph', 'learning_rate': 0.007639252561343495, 'n_estimators': 131, 'criterion': 'friedman_mse', 'min_samples_split': 3, 'min_samples_leaf': 2, 'min_weight_fraction_leaf': 0.19935735658404827, 'min_impurity_decrease': 0.6746567269020994, 'max_features': 0.8418429460968444, 'subsample': 0.10528875847712567, 'dropout_rate': 0.2026593694672723, 'ccp_alpha': 0.005890395964005896}. Best is trial 244 with value: 0.8474070660226068.[0m
[32m[I 2022-04-21 17:13:23,645][0m Trial 331 finished with value: 0.65 and parameters: {'loss': 'coxph', 'learning_rate': 0.004643431970977061, 'n_estimators': 246, 'criterion': 'friedman_mse', 'min_samples_split': 3, 'min_samples_leaf': 2, 'min_weight_fraction_leaf': 0.22577263252901358, 'min_impurity_decrease': 0.6113201389436834, 'max_features': 0.6734505342769007, 'subsample': 0.30802916942745195, 'dropout_rate': 0.14900888761495787, 'ccp_alpha': 1.045276626811065}. Best is trial 244 with value: 0.8474070660226068.[0m
[32m[I 2022-04-21 17:13:42,238][0m Trial 332 finished with value: 0.8412813536996488 and parameters: {'loss': 'coxph', 'learning_rate': 0.007420629761702574, 'n_estimators': 301, 'criterion': 'friedman_mse', 'min_samples_split': 5, 'min_samples_leaf': 2, 'min_weight_fraction_leaf': 0.21491963678546475, 'min_impurity_decrease': 0.32098295960131956, 'max_features': 0.6147976897221523, 'subsample': 0.06720576915446187, 'dropout_rate': 0.1790951072837987, 'ccp_alpha': 0.22800963710756583}. Best is trial 244 with value: 0.8474070660226068.[0m
[32m[I 2022-04-21 17:13:55,823][0m Trial 333 finished with value: 0.8420637698607422 and parameters: {'loss': 'coxph', 'learning_rate': 0.0064484961466059415, 'n_estimators': 259, 'criterion': 'friedman_mse', 'min_samples_split': 3, 'min_samples_leaf': 2, 'min_weight_fraction_leaf': 0.20259517705291835, 'min_impurity_decrease': 0.4157559619673829, 'max_features': 0.704954288378888, 'subsample': 0.04331075371429449, 'dropout_rate': 0.12181796661776967, 'ccp_alpha': 0.002397862756058863}. Best is trial 244 with value: 0.8474070660226068.[0m
[32m[I 2022-04-21 17:14:11,678][0m Trial 334 finished with value: 0.8444073645316534 and parameters: {'loss': 'coxph', 'learning_rate': 0.01003268060727977, 'n_estimators': 281, 'criterion': 'friedman_mse', 'min_samples_split': 3, 'min_samples_leaf': 2, 'min_weight_fraction_leaf': 0.1865165156645622, 'min_impurity_decrease': 0.36410290285205, 'max_features': 0.7688860383512037, 'subsample': 0.11869197935035632, 'dropout_rate': 0.1582066672991705, 'ccp_alpha': 0.11234653558146154}. Best is trial 244 with value: 0.8474070660226068.[0m
[32m[I 2022-04-21 17:14:28,344][0m Trial 335 finished with value: 0.65 and parameters: {'loss': 'coxph', 'learning_rate': 0.0054375360853866845, 'n_estimators': 294, 'criterion': 'friedman_mse', 'min_samples_split': 10, 'min_samples_leaf': 2, 'min_weight_fraction_leaf': 0.19551579102066088, 'min_impurity_decrease': 0.3448537871143754, 'max_features': 0.7266897968838892, 'subsample': 0.0243677344192589, 'dropout_rate': 0.12964583868988722, 'ccp_alpha': 0.2726225450975007}. Best is trial 244 with value: 0.8474070660226068.[0m
[32m[I 2022-04-21 17:14:50,047][0m Trial 336 finished with value: 0.65 and parameters: {'loss': 'coxph', 'learning_rate': 7.524693587015297e-05, 'n_estimators': 273, 'criterion': 'friedman_mse', 'min_samples_split': 3, 'min_samples_leaf': 9, 'min_weight_fraction_leaf': 0.20952237041621055, 'min_impurity_decrease': 0.46355978285075583, 'max_features': 0.6864592649269324, 'subsample': 0.5405568606804215, 'dropout_rate': 0.10519751925491658, 'ccp_alpha': 2.344223195869306}. Best is trial 244 with value: 0.8474070660226068.[0m
[32m[I 2022-04-21 17:15:09,647][0m Trial 337 finished with value: 0.8447740659257859 and parameters: {'loss': 'coxph', 'learning_rate': 4.944587912335382e-05, 'n_estimators': 247, 'criterion': 'friedman_mse', 'min_samples_split': 3, 'min_samples_leaf': 2, 'min_weight_fraction_leaf': 0.18788151823595767, 'min_impurity_decrease': 0.31473408998785507, 'max_features': 0.6631963112800578, 'subsample': 0.08277007248734264, 'dropout_rate': 0.14360503597392588, 'ccp_alpha': 0.11642653649781123}. Best is trial 244 with value: 0.8474070660226068.[0m
[32m[I 2022-04-21 17:15:36,742][0m Trial 338 finished with value: 0.8389137925997968 and parameters: {'loss': 'coxph', 'learning_rate': 9.385043718321754e-05, 'n_estimators': 328, 'criterion': 'squared_error', 'min_samples_split': 3, 'min_samples_leaf': 4, 'min_weight_fraction_leaf': 0.21712816672371055, 'min_impurity_decrease': 0.24505659486280215, 'max_features': 0.37891251400200543, 'subsample': 0.10269717418101354, 'dropout_rate': 0.2622998444992649, 'ccp_alpha': 0.08466939349199487}. Best is trial 244 with value: 0.8474070660226068.[0m
/media/san2_ssd/data/Workdir/survival/venv/lib/python3.8/site-packages/sksurv/ensemble/boosting.py:955: RuntimeWarning: divide by zero encountered in log
  time = numpy.log(time)
/media/san2_ssd/data/Workdir/survival/venv/lib/python3.8/site-packages/sksurv/ensemble/boosting.py:955: RuntimeWarning: divide by zero encountered in log
  time = numpy.log(time)
/media/san2_ssd/data/Workdir/survival/venv/lib/python3.8/site-packages/sksurv/ensemble/boosting.py:955: RuntimeWarning: divide by zero encountered in log
  time = numpy.log(time)
/media/san2_ssd/data/Workdir/survival/venv/lib/python3.8/site-packages/sksurv/ensemble/boosting.py:955: RuntimeWarning: divide by zero encountered in log
  time = numpy.log(time)
[32m[I 2022-04-21 17:15:39,961][0m Trial 339 finished with value: -0.46554551402476047 and parameters: {'loss': 'squared', 'learning_rate': 6.131413875467958e-05, 'n_estimators': 235, 'criterion': 'friedman_mse', 'min_samples_split': 3, 'min_samples_leaf': 2, 'min_weight_fraction_leaf': 0.19831427080229025, 'min_impurity_decrease': 0.37554941566461375, 'max_features': 0.3921886885890016, 'subsample': 0.06058141680945497, 'dropout_rate': 0.5459963711118008, 'ccp_alpha': 0.1932024697431092}. Best is trial 244 with value: 0.8474070660226068.[0m
[32m[I 2022-04-21 17:18:38,640][0m Trial 340 finished with value: 0.8401682625638263 and parameters: {'loss': 'coxph', 'learning_rate': 0.0038980128404314945, 'n_estimators': 905, 'criterion': 'friedman_mse', 'min_samples_split': 6, 'min_samples_leaf': 2, 'min_weight_fraction_leaf': 0.16595276534865336, 'min_impurity_decrease': 0.3402423763738386, 'max_features': 0.26115602255903947, 'subsample': 0.08097703088780439, 'dropout_rate': 0.19229377665099112, 'ccp_alpha': 0.31411080481062126}. Best is trial 244 with value: 0.8474070660226068.[0m
[32m[I 2022-04-21 17:18:56,663][0m Trial 341 finished with value: 0.8455484580463353 and parameters: {'loss': 'coxph', 'learning_rate': 0.00021324602663884111, 'n_estimators': 313, 'criterion': 'friedman_mse', 'min_samples_split': 4, 'min_samples_leaf': 3, 'min_weight_fraction_leaf': 0.1490548943120394, 'min_impurity_decrease': 0.31394907614822126, 'max_features': 0.743161034148193, 'subsample': 0.11886720131809791, 'dropout_rate': 0.17490024198636575, 'ccp_alpha': 0.0022149006425404155}. Best is trial 244 with value: 0.8474070660226068.[0m
[32m[I 2022-04-21 17:19:26,440][0m Trial 342 finished with value: 0.8445293724248657 and parameters: {'loss': 'coxph', 'learning_rate': 0.00021555175968554767, 'n_estimators': 308, 'criterion': 'friedman_mse', 'min_samples_split': 4, 'min_samples_leaf': 3, 'min_weight_fraction_leaf': 0.13952020281199073, 'min_impurity_decrease': 0.3555769106838741, 'max_features': 0.7797241320151963, 'subsample': 0.122937954271432, 'dropout_rate': 0.22118911626755605, 'ccp_alpha': 0.001327005751059321}. Best is trial 244 with value: 0.8474070660226068.[0m
[32m[I 2022-04-21 17:19:50,638][0m Trial 343 finished with value: 0.65 and parameters: {'loss': 'coxph', 'learning_rate': 0.0002368952025169104, 'n_estimators': 261, 'criterion': 'absolute_error', 'min_samples_split': 4, 'min_samples_leaf': 3, 'min_weight_fraction_leaf': 0.15229364781621052, 'min_impurity_decrease': 0.32652200969214623, 'max_features': 0.6870309875581195, 'subsample': 0.03763719136837229, 'dropout_rate': 0.17158796919884056, 'ccp_alpha': 0.0893806634150606}. Best is trial 244 with value: 0.8474070660226068.[0m
[32m[I 2022-04-21 17:20:15,524][0m Trial 344 finished with value: 0.8454787575880491 and parameters: {'loss': 'coxph', 'learning_rate': 0.00015618918635812665, 'n_estimators': 288, 'criterion': 'friedman_mse', 'min_samples_split': 5, 'min_samples_leaf': 3, 'min_weight_fraction_leaf': 0.1370166256673961, 'min_impurity_decrease': 0.39408385097608667, 'max_features': 0.7405961934700913, 'subsample': 0.061015445806052865, 'dropout_rate': 0.19431995111821387, 'ccp_alpha': 0.0034619712599973963}. Best is trial 244 with value: 0.8474070660226068.[0m
[32m[I 2022-04-21 17:20:32,990][0m Trial 345 finished with value: 0.840839827588925 and parameters: {'loss': 'coxph', 'learning_rate': 0.00016669722837976163, 'n_estimators': 289, 'criterion': 'friedman_mse', 'min_samples_split': 5, 'min_samples_leaf': 3, 'min_weight_fraction_leaf': 0.1319162423077091, 'min_impurity_decrease': 0.38841331084029473, 'max_features': 0.6556584436403384, 'subsample': 0.0635921256248688, 'dropout_rate': 0.23873334594242254, 'ccp_alpha': 0.1764842861497677}. Best is trial 244 with value: 0.8474070660226068.[0m
[32m[I 2022-04-21 17:20:51,965][0m Trial 346 finished with value: 0.65 and parameters: {'loss': 'coxph', 'learning_rate': 0.0002082646888782153, 'n_estimators': 302, 'criterion': 'friedman_mse', 'min_samples_split': 5, 'min_samples_leaf': 3, 'min_weight_fraction_leaf': 0.13229159447404262, 'min_impurity_decrease': 0.4013130532923336, 'max_features': 0.7415080386807014, 'subsample': 0.014998378697278292, 'dropout_rate': 0.20162182139945256, 'ccp_alpha': 0.008293397275122788}. Best is trial 244 with value: 0.8474070660226068.[0m
[32m[I 2022-04-21 17:21:10,237][0m Trial 347 finished with value: 0.8455601980279634 and parameters: {'loss': 'coxph', 'learning_rate': 0.00014575651365374663, 'n_estimators': 284, 'criterion': 'friedman_mse', 'min_samples_split': 5, 'min_samples_leaf': 3, 'min_weight_fraction_leaf': 0.14904920184870094, 'min_impurity_decrease': 0.3751475657345858, 'max_features': 0.743765064867657, 'subsample': 0.05547077722452329, 'dropout_rate': 0.19263021921778367, 'ccp_alpha': 0.08305996344431234}. Best is trial 244 with value: 0.8474070660226068.[0m
[32m[I 2022-04-21 17:21:25,140][0m Trial 348 finished with value: 0.8429548067487879 and parameters: {'loss': 'coxph', 'learning_rate': 0.00015678166172237212, 'n_estimators': 288, 'criterion': 'friedman_mse', 'min_samples_split': 5, 'min_samples_leaf': 3, 'min_weight_fraction_leaf': 0.12340575146710449, 'min_impurity_decrease': 0.4240656895121077, 'max_features': 0.7388968139610756, 'subsample': 0.06080998742826153, 'dropout_rate': 0.6322597872037329, 'ccp_alpha': 0.008036681032000078}. Best is trial 244 with value: 0.8474070660226068.[0m
[32m[I 2022-04-21 17:21:40,940][0m Trial 349 finished with value: 0.8433406014372838 and parameters: {'loss': 'coxph', 'learning_rate': 0.0001503457615341168, 'n_estimators': 273, 'criterion': 'friedman_mse', 'min_samples_split': 5, 'min_samples_leaf': 3, 'min_weight_fraction_leaf': 0.13722001219034263, 'min_impurity_decrease': 0.3818971967934748, 'max_features': 0.753378166828636, 'subsample': 0.07888451151985822, 'dropout_rate': 0.2199859698542881, 'ccp_alpha': 0.1882943979984233}. Best is trial 244 with value: 0.8474070660226068.[0m
[32m[I 2022-04-21 17:22:05,841][0m Trial 350 finished with value: 0.8457551479403433 and parameters: {'loss': 'coxph', 'learning_rate': 0.000129685170460273, 'n_estimators': 283, 'criterion': 'friedman_mse', 'min_samples_split': 5, 'min_samples_leaf': 3, 'min_weight_fraction_leaf': 0.12713938862392987, 'min_impurity_decrease': 0.39610631611764335, 'max_features': 0.7211277460635701, 'subsample': 0.09242621362615924, 'dropout_rate': 0.19537605292645238, 'ccp_alpha': 0.0931317853153159}. Best is trial 244 with value: 0.8474070660226068.[0m
[32m[I 2022-04-21 17:22:22,347][0m Trial 351 finished with value: 0.8380885784139451 and parameters: {'loss': 'coxph', 'learning_rate': 0.00010616663313688743, 'n_estimators': 273, 'criterion': 'friedman_mse', 'min_samples_split': 5, 'min_samples_leaf': 3, 'min_weight_fraction_leaf': 0.11128307791875022, 'min_impurity_decrease': 0.4151621256479807, 'max_features': 0.7909166683820192, 'subsample': 0.09738305339773906, 'dropout_rate': 0.1801777761068986, 'ccp_alpha': 0.40763225972122796}. Best is trial 244 with value: 0.8474070660226068.[0m
[32m[I 2022-04-21 17:24:57,457][0m Trial 352 finished with value: 0.8408351207655915 and parameters: {'loss': 'coxph', 'learning_rate': 0.00013415410900652146, 'n_estimators': 854, 'criterion': 'friedman_mse', 'min_samples_split': 5, 'min_samples_leaf': 3, 'min_weight_fraction_leaf': 0.1198102485899365, 'min_impurity_decrease': 0.35765401629387333, 'max_features': 0.7565167926853557, 'subsample': 0.18406990311716637, 'dropout_rate': 0.20163501104202292, 'ccp_alpha': 0.27203086365758816}. Best is trial 244 with value: 0.8474070660226068.[0m
[32m[I 2022-04-21 17:25:12,086][0m Trial 353 finished with value: 0.8436289814463924 and parameters: {'loss': 'coxph', 'learning_rate': 0.005836335612807101, 'n_estimators': 266, 'criterion': 'friedman_mse', 'min_samples_split': 5, 'min_samples_leaf': 3, 'min_weight_fraction_leaf': 0.14789606208733552, 'min_impurity_decrease': 0.36789379889842283, 'max_features': 0.691600527072104, 'subsample': 0.09809104926804094, 'dropout_rate': 0.23169764632692202, 'ccp_alpha': 0.1608080151974136}. Best is trial 244 with value: 0.8474070660226068.[0m
[32m[I 2022-04-21 17:25:20,015][0m Trial 354 finished with value: 0.65 and parameters: {'loss': 'coxph', 'learning_rate': 0.008492258294344864, 'n_estimators': 298, 'criterion': 'friedman_mse', 'min_samples_split': 5, 'min_samples_leaf': 3, 'min_weight_fraction_leaf': 0.2462258153379117, 'min_impurity_decrease': 0.40198855900161173, 'max_features': 0.7139173953654566, 'subsample': 0.1486756336456444, 'dropout_rate': 0.6956527924231504, 'ccp_alpha': 2.7973006315979605}. Best is trial 244 with value: 0.8474070660226068.[0m
[32m[I 2022-04-21 17:25:39,216][0m Trial 355 finished with value: 0.8444599522127503 and parameters: {'loss': 'coxph', 'learning_rate': 0.00012364405871826903, 'n_estimators': 279, 'criterion': 'friedman_mse', 'min_samples_split': 5, 'min_samples_leaf': 3, 'min_weight_fraction_leaf': 0.14504970029503855, 'min_impurity_decrease': 0.3758201405751559, 'max_features': 0.7186688264632377, 'subsample': 0.11799451346559875, 'dropout_rate': 0.17351101606922248, 'ccp_alpha': 0.10898265181150346}. Best is trial 244 with value: 0.8474070660226068.[0m
[32m[I 2022-04-21 17:25:56,930][0m Trial 356 finished with value: 0.8455335347355046 and parameters: {'loss': 'coxph', 'learning_rate': 0.00018416648870526813, 'n_estimators': 259, 'criterion': 'friedman_mse', 'min_samples_split': 5, 'min_samples_leaf': 3, 'min_weight_fraction_leaf': 0.2285771331750624, 'min_impurity_decrease': 0.44065769960227247, 'max_features': 0.6969156741355498, 'subsample': 0.0825123793677635, 'dropout_rate': 0.1617133696203869, 'ccp_alpha': 0.23811894026914537}. Best is trial 244 with value: 0.8474070660226068.[0m
[32m[I 2022-04-21 17:26:14,210][0m Trial 357 finished with value: 0.724643721670837 and parameters: {'loss': 'coxph', 'learning_rate': 0.00018153434025083157, 'n_estimators': 255, 'criterion': 'friedman_mse', 'min_samples_split': 5, 'min_samples_leaf': 3, 'min_weight_fraction_leaf': 0.20699953097118065, 'min_impurity_decrease': 0.4099481469192457, 'max_features': 0.705191805939106, 'subsample': 0.08104853037577986, 'dropout_rate': 0.1602219491606042, 'ccp_alpha': 0.5521620185870773}. Best is trial 244 with value: 0.8474070660226068.[0m
[32m[I 2022-04-21 17:26:29,087][0m Trial 358 finished with value: 0.843346992813434 and parameters: {'loss': 'coxph', 'learning_rate': 0.00017521095705047484, 'n_estimators': 261, 'criterion': 'friedman_mse', 'min_samples_split': 4, 'min_samples_leaf': 3, 'min_weight_fraction_leaf': 0.22265616617808695, 'min_impurity_decrease': 0.4304854639431048, 'max_features': 0.6957306702936312, 'subsample': 0.04459114652278028, 'dropout_rate': 0.1531777027767889, 'ccp_alpha': 0.3368593933208772}. Best is trial 244 with value: 0.8474070660226068.[0m
[32m[I 2022-04-21 17:26:45,939][0m Trial 359 finished with value: 0.65 and parameters: {'loss': 'coxph', 'learning_rate': 0.0001237717091588915, 'n_estimators': 283, 'criterion': 'friedman_mse', 'min_samples_split': 6, 'min_samples_leaf': 3, 'min_weight_fraction_leaf': 0.4919721887857411, 'min_impurity_decrease': 0.34458847816162674, 'max_features': 0.7322121108810726, 'subsample': 0.0790510438889562, 'dropout_rate': 0.14162254403229518, 'ccp_alpha': 0.2522264684153269}. Best is trial 244 with value: 0.8474070660226068.[0m
[32m[I 2022-04-21 17:27:00,890][0m Trial 360 finished with value: 0.65 and parameters: {'loss': 'coxph', 'learning_rate': 0.0003053690595483593, 'n_estimators': 270, 'criterion': 'friedman_mse', 'min_samples_split': 4, 'min_samples_leaf': 3, 'min_weight_fraction_leaf': 0.1999716300334923, 'min_impurity_decrease': 0.455194436328732, 'max_features': 0.6730678054086782, 'subsample': 0.028042653725168593, 'dropout_rate': 0.19150744215413623, 'ccp_alpha': 0.23480975029413978}. Best is trial 244 with value: 0.8474070660226068.[0m
/media/san2_ssd/data/Workdir/survival/venv/lib/python3.8/site-packages/sksurv/ensemble/boosting.py:955: RuntimeWarning: divide by zero encountered in log
  time = numpy.log(time)
/media/san2_ssd/data/Workdir/survival/venv/lib/python3.8/site-packages/sksurv/ensemble/boosting.py:955: RuntimeWarning: divide by zero encountered in log
  time = numpy.log(time)
/media/san2_ssd/data/Workdir/survival/venv/lib/python3.8/site-packages/sksurv/ensemble/boosting.py:955: RuntimeWarning: divide by zero encountered in log
  time = numpy.log(time)
/media/san2_ssd/data/Workdir/survival/venv/lib/python3.8/site-packages/sksurv/ensemble/boosting.py:955: RuntimeWarning: divide by zero encountered in log
  time = numpy.log(time)
[32m[I 2022-04-21 17:27:04,262][0m Trial 361 finished with value: -0.4657745203520056 and parameters: {'loss': 'squared', 'learning_rate': 0.00023803829515324084, 'n_estimators': 250, 'criterion': 'friedman_mse', 'min_samples_split': 4, 'min_samples_leaf': 4, 'min_weight_fraction_leaf': 0.18749660829808515, 'min_impurity_decrease': 0.4850282288923141, 'max_features': 0.7225339672414278, 'subsample': 0.21242601001625008, 'dropout_rate': 0.21507188289519777, 'ccp_alpha': 0.43936147068146825}. Best is trial 244 with value: 0.8474070660226068.[0m
[32m[I 2022-04-21 17:27:20,351][0m Trial 362 finished with value: 0.8365410760400204 and parameters: {'loss': 'coxph', 'learning_rate': 0.018656339974968513, 'n_estimators': 237, 'criterion': 'squared_error', 'min_samples_split': 5, 'min_samples_leaf': 3, 'min_weight_fraction_leaf': 0.21043471172449743, 'min_impurity_decrease': 0.3843713740091479, 'max_features': 0.8087416870615667, 'subsample': 0.09228854951705767, 'dropout_rate': 0.1685357888387534, 'ccp_alpha': 0.1446288770381131}. Best is trial 244 with value: 0.8474070660226068.[0m
[32m[I 2022-04-21 17:27:37,597][0m Trial 363 finished with value: 0.8426922138205912 and parameters: {'loss': 'coxph', 'learning_rate': 0.00010955718023709056, 'n_estimators': 298, 'criterion': 'friedman_mse', 'min_samples_split': 5, 'min_samples_leaf': 4, 'min_weight_fraction_leaf': 0.12534252358878983, 'min_impurity_decrease': 0.356272726050899, 'max_features': 0.6931800870750507, 'subsample': 0.05849622649790739, 'dropout_rate': 0.41866630733204413, 'ccp_alpha': 0.0036852951548168207}. Best is trial 244 with value: 0.8474070660226068.[0m
[32m[I 2022-04-21 17:27:41,148][0m Trial 364 finished with value: 0.836754390273898 and parameters: {'loss': 'coxph', 'learning_rate': 0.00015785242096211783, 'n_estimators': 111, 'criterion': 'friedman_mse', 'min_samples_split': 5, 'min_samples_leaf': 3, 'min_weight_fraction_leaf': 0.19377117934926819, 'min_impurity_decrease': 0.33492223657271525, 'max_features': 0.7578003820966854, 'subsample': 0.1333106931828511, 'dropout_rate': 0.1411774035122423, 'ccp_alpha': 0.30440605466413184}. Best is trial 244 with value: 0.8474070660226068.[0m
[32m[I 2022-04-21 17:27:47,357][0m Trial 365 finished with value: 0.8424019429505606 and parameters: {'loss': 'coxph', 'learning_rate': 0.00018740194227345413, 'n_estimators': 151, 'criterion': 'friedman_mse', 'min_samples_split': 4, 'min_samples_leaf': 3, 'min_weight_fraction_leaf': 0.15249067986499568, 'min_impurity_decrease': 0.3160031079184964, 'max_features': 0.7000678353607941, 'subsample': 0.07155010468196181, 'dropout_rate': 0.2760921980957322, 'ccp_alpha': 0.09464685411560296}. Best is trial 244 with value: 0.8474070660226068.[0m
