[32m[I 2022-04-22 00:49:23,033][0m Trial 335 finished with value: 0.7383567136863668 and parameters: {'n_hidden': 512, 'mixture_components': 4, 'use_sparse_layer': True, 'use_sparse_loss': False, 'use_batchnorm': False, 'use_dropout': False, 'mlp_size_1': 6, 'mlp_size_2': 0, 'mlp_size_3': 0, 'kernel': 'Normal', 'loss_name': 'AlternativeNLLLoss'}. Best is trial 17 with value: 0.8538600001453517.[0m
[32m[I 2022-04-22 00:52:12,764][0m Trial 336 finished with value: 0.8487746831129585 and parameters: {'n_hidden': 2048, 'mixture_components': 5, 'use_sparse_layer': True, 'use_sparse_loss': False, 'use_batchnorm': False, 'use_dropout': False, 'mlp_size_1': 7, 'mlp_size_2': 1, 'mlp_size_3': 0, 'kernel': 'Normal', 'loss_name': 'AlternativeNLLLoss'}. Best is trial 17 with value: 0.8538600001453517.[0m
[32m[I 2022-04-22 00:54:33,841][0m Trial 337 finished with value: 0.8394486656463467 and parameters: {'n_hidden': 2048, 'mixture_components': 4, 'use_sparse_layer': True, 'use_sparse_loss': False, 'use_batchnorm': False, 'use_dropout': False, 'mlp_size_1': 7, 'mlp_size_2': 1, 'mlp_size_3': 0, 'kernel': 'LogLogistic', 'loss_name': 'AlternativeNLLLoss'}. Best is trial 17 with value: 0.8538600001453517.[0m
[32m[I 2022-04-22 00:57:36,842][0m Trial 338 finished with value: 0.8443585533381137 and parameters: {'n_hidden': 512, 'mixture_components': 9, 'use_sparse_layer': True, 'use_sparse_loss': False, 'use_batchnorm': False, 'use_dropout': False, 'mlp_size_1': 6, 'mlp_size_2': 0, 'mlp_size_3': 0, 'kernel': 'Normal', 'loss_name': 'AlternativeNLLLoss'}. Best is trial 17 with value: 0.8538600001453517.[0m
[32m[I 2022-04-22 00:59:55,734][0m Trial 339 finished with value: 0.8477090807927643 and parameters: {'n_hidden': 1024, 'mixture_components': 4, 'use_sparse_layer': True, 'use_sparse_loss': False, 'use_batchnorm': False, 'use_dropout': False, 'mlp_size_1': 5, 'mlp_size_2': 1, 'mlp_size_3': 1, 'kernel': 'LogLogistic', 'loss_name': 'AlternativeNLLLoss'}. Best is trial 17 with value: 0.8538600001453517.[0m
[32m[I 2022-04-22 01:01:59,234][0m Trial 340 finished with value: 0.845849010786581 and parameters: {'n_hidden': 1024, 'mixture_components': 4, 'use_sparse_layer': True, 'use_sparse_loss': False, 'use_batchnorm': False, 'use_dropout': False, 'mlp_size_1': 5, 'mlp_size_2': 1, 'mlp_size_3': 1, 'kernel': 'LogLogistic', 'loss_name': 'AlternativeNLLLoss'}. Best is trial 17 with value: 0.8538600001453517.[0m
[32m[I 2022-04-22 01:03:56,633][0m Trial 341 finished with value: 0.845755692535838 and parameters: {'n_hidden': 1024, 'mixture_components': 4, 'use_sparse_layer': True, 'use_sparse_loss': False, 'use_batchnorm': False, 'use_dropout': False, 'mlp_size_1': 5, 'mlp_size_2': 1, 'mlp_size_3': 1, 'kernel': 'LogLogistic', 'loss_name': 'AlternativeNLLLoss'}. Best is trial 17 with value: 0.8538600001453517.[0m
[32m[I 2022-04-22 01:05:57,669][0m Trial 342 finished with value: 0.844444330555798 and parameters: {'n_hidden': 1024, 'mixture_components': 4, 'use_sparse_layer': True, 'use_sparse_loss': False, 'use_batchnorm': False, 'use_dropout': False, 'mlp_size_1': 5, 'mlp_size_2': 1, 'mlp_size_3': 1, 'kernel': 'LogLogistic', 'loss_name': 'AlternativeNLLLoss'}. Best is trial 17 with value: 0.8538600001453517.[0m
[32m[I 2022-04-22 01:07:56,747][0m Trial 343 finished with value: 0.8428106697462606 and parameters: {'n_hidden': 1024, 'mixture_components': 4, 'use_sparse_layer': True, 'use_sparse_loss': False, 'use_batchnorm': False, 'use_dropout': False, 'mlp_size_1': 5, 'mlp_size_2': 1, 'mlp_size_3': 1, 'kernel': 'LogLogistic', 'loss_name': 'AlternativeNLLLoss'}. Best is trial 17 with value: 0.8538600001453517.[0m
[32m[I 2022-04-22 01:10:04,914][0m Trial 344 finished with value: 0.540549154096521 and parameters: {'n_hidden': 1024, 'mixture_components': 4, 'use_sparse_layer': True, 'use_sparse_loss': False, 'use_batchnorm': False, 'use_dropout': True, 'dropout': 0.551609917049112, 'mlp_size_1': 5, 'mlp_size_2': 1, 'mlp_size_3': 1, 'kernel': 'LogLogistic', 'loss_name': 'AlternativeNLLLoss'}. Best is trial 17 with value: 0.8538600001453517.[0m
[32m[I 2022-04-22 01:12:37,264][0m Trial 345 finished with value: 0.837816985443725 and parameters: {'n_hidden': 1024, 'mixture_components': 4, 'use_sparse_layer': True, 'use_sparse_loss': False, 'use_batchnorm': False, 'use_dropout': False, 'mlp_size_1': 5, 'mlp_size_2': 1, 'mlp_size_3': 1, 'kernel': 'LogLogistic', 'loss_name': 'AlternativeNLLLoss'}. Best is trial 17 with value: 0.8538600001453517.[0m
[32m[I 2022-04-22 01:14:54,855][0m Trial 346 finished with value: 0.8421958397136109 and parameters: {'n_hidden': 1024, 'mixture_components': 4, 'use_sparse_layer': True, 'use_sparse_loss': False, 'use_batchnorm': False, 'use_dropout': False, 'mlp_size_1': 5, 'mlp_size_2': 1, 'mlp_size_3': 1, 'kernel': 'LogLogistic', 'loss_name': 'AlternativeNLLLoss'}. Best is trial 17 with value: 0.8538600001453517.[0m
[32m[I 2022-04-22 01:16:55,424][0m Trial 347 finished with value: 0.8391383879752619 and parameters: {'n_hidden': 1024, 'mixture_components': 7, 'use_sparse_layer': True, 'use_sparse_loss': False, 'use_batchnorm': False, 'use_dropout': False, 'mlp_size_1': 5, 'mlp_size_2': 1, 'mlp_size_3': 1, 'kernel': 'LogLogistic', 'loss_name': 'AlternativeNLLLoss'}. Best is trial 17 with value: 0.8538600001453517.[0m
[32m[I 2022-04-22 01:19:04,163][0m Trial 348 finished with value: 0.839660694995452 and parameters: {'n_hidden': 1024, 'mixture_components': 4, 'use_sparse_layer': True, 'use_sparse_loss': False, 'use_batchnorm': False, 'use_dropout': False, 'mlp_size_1': 5, 'mlp_size_2': 1, 'mlp_size_3': 1, 'kernel': 'LogLogistic', 'loss_name': 'AlternativeNLLLoss'}. Best is trial 17 with value: 0.8538600001453517.[0m
[32m[I 2022-04-22 01:21:05,412][0m Trial 349 finished with value: 0.8383055096368899 and parameters: {'n_hidden': 1024, 'mixture_components': 3, 'use_sparse_layer': True, 'use_sparse_loss': False, 'use_batchnorm': False, 'use_dropout': False, 'mlp_size_1': 5, 'mlp_size_2': 1, 'mlp_size_3': 1, 'kernel': 'LogLogistic', 'loss_name': 'AlternativeNLLLoss'}. Best is trial 17 with value: 0.8538600001453517.[0m
[32m[I 2022-04-22 01:27:04,088][0m Trial 350 finished with value: 0.6312793550910747 and parameters: {'n_hidden': 1024, 'mixture_components': 4, 'use_sparse_layer': True, 'use_sparse_loss': False, 'use_batchnorm': True, 'use_dropout': False, 'mlp_size_1': 5, 'mlp_size_2': 1, 'mlp_size_3': 1, 'kernel': 'LogLogistic', 'loss_name': 'AlternativeNLLLoss'}. Best is trial 17 with value: 0.8538600001453517.[0m
[32m[I 2022-04-22 01:29:05,920][0m Trial 351 finished with value: 0.8380605443943381 and parameters: {'n_hidden': 1024, 'mixture_components': 4, 'use_sparse_layer': True, 'use_sparse_loss': False, 'use_batchnorm': False, 'use_dropout': False, 'mlp_size_1': 5, 'mlp_size_2': 1, 'mlp_size_3': 1, 'kernel': 'LogLogistic', 'loss_name': 'AlternativeNLLLoss'}. Best is trial 17 with value: 0.8538600001453517.[0m
[32m[I 2022-04-22 01:31:06,563][0m Trial 352 finished with value: 0.8465397044591784 and parameters: {'n_hidden': 1024, 'mixture_components': 3, 'use_sparse_layer': True, 'use_sparse_loss': False, 'use_batchnorm': False, 'use_dropout': False, 'mlp_size_1': 5, 'mlp_size_2': 1, 'mlp_size_3': 1, 'kernel': 'LogLogistic', 'loss_name': 'AlternativeNLLLoss'}. Best is trial 17 with value: 0.8538600001453517.[0m
[32m[I 2022-04-22 01:32:57,380][0m Trial 353 finished with value: 0.8372291739299393 and parameters: {'n_hidden': 1024, 'mixture_components': 3, 'use_sparse_layer': True, 'use_sparse_loss': False, 'use_batchnorm': False, 'use_dropout': False, 'mlp_size_1': 5, 'mlp_size_2': 1, 'mlp_size_3': 1, 'kernel': 'LogLogistic', 'loss_name': 'AlternativeNLLLoss'}. Best is trial 17 with value: 0.8538600001453517.[0m
[32m[I 2022-04-22 01:34:27,182][0m Trial 354 finished with value: 0.8455941745894551 and parameters: {'n_hidden': 1024, 'mixture_components': 3, 'use_sparse_layer': True, 'use_sparse_loss': False, 'use_batchnorm': False, 'use_dropout': False, 'mlp_size_1': 5, 'mlp_size_2': 1, 'mlp_size_3': 1, 'kernel': 'LogLogistic', 'loss_name': 'AlternativeNLLLoss'}. Best is trial 17 with value: 0.8538600001453517.[0m
[32m[I 2022-04-22 01:36:14,178][0m Trial 355 finished with value: 0.8421887152738833 and parameters: {'n_hidden': 1024, 'mixture_components': 3, 'use_sparse_layer': True, 'use_sparse_loss': False, 'use_batchnorm': False, 'use_dropout': False, 'mlp_size_1': 5, 'mlp_size_2': 1, 'mlp_size_3': 1, 'kernel': 'LogLogistic', 'loss_name': 'AlternativeNLLLoss'}. Best is trial 17 with value: 0.8538600001453517.[0m
[32m[I 2022-04-22 01:37:31,932][0m Trial 356 finished with value: -0.23717518054617664 and parameters: {'n_hidden': 1024, 'mixture_components': 3, 'use_sparse_layer': True, 'use_sparse_loss': False, 'use_batchnorm': False, 'use_dropout': False, 'mlp_size_1': 5, 'mlp_size_2': 1, 'mlp_size_3': 1, 'kernel': 'Exponential', 'loss_name': 'AlternativeNLLLoss'}. Best is trial 17 with value: 0.8538600001453517.[0m
[32m[I 2022-04-22 01:39:55,263][0m Trial 357 finished with value: 0.8402537767580366 and parameters: {'n_hidden': 1024, 'mixture_components': 3, 'use_sparse_layer': True, 'use_sparse_loss': False, 'use_batchnorm': False, 'use_dropout': False, 'mlp_size_1': 5, 'mlp_size_2': 1, 'mlp_size_3': 1, 'kernel': 'LogLogistic', 'loss_name': 'AlternativeNLLLoss'}. Best is trial 17 with value: 0.8538600001453517.[0m
[32m[I 2022-04-22 01:42:32,415][0m Trial 358 finished with value: 0.7351061336827468 and parameters: {'n_hidden': 64, 'mixture_components': 3, 'use_sparse_layer': True, 'use_sparse_loss': True, 'lmbd': 1.4807283640367169e-05, 'use_batchnorm': False, 'use_dropout': False, 'mlp_size_1': 3, 'mlp_size_2': 0, 'mlp_size_3': 0, 'kernel': 'Logistic', 'loss_name': 'AlternativeNLLLoss'}. Best is trial 17 with value: 0.8538600001453517.[0m
[32m[I 2022-04-22 01:44:25,598][0m Trial 359 finished with value: 0.847409098526424 and parameters: {'n_hidden': 1024, 'mixture_components': 3, 'use_sparse_layer': True, 'use_sparse_loss': False, 'use_batchnorm': False, 'use_dropout': False, 'mlp_size_1': 5, 'mlp_size_2': 1, 'mlp_size_3': 1, 'kernel': 'LogLogistic', 'loss_name': 'AlternativeNLLLoss'}. Best is trial 17 with value: 0.8538600001453517.[0m
[32m[I 2022-04-22 01:46:25,030][0m Trial 360 finished with value: 0.8376107245622949 and parameters: {'n_hidden': 256, 'mixture_components': 3, 'use_sparse_layer': True, 'use_sparse_loss': False, 'use_batchnorm': False, 'use_dropout': False, 'mlp_size_1': 5, 'mlp_size_2': 0, 'mlp_size_3': 0, 'kernel': 'LogLogistic', 'loss_name': 'AlternativeNLLLoss'}. Best is trial 17 with value: 0.8538600001453517.[0m
[32m[I 2022-04-22 01:48:04,437][0m Trial 361 finished with value: 0.8422329950082222 and parameters: {'n_hidden': 1024, 'mixture_components': 3, 'use_sparse_layer': True, 'use_sparse_loss': False, 'use_batchnorm': False, 'use_dropout': False, 'mlp_size_1': 5, 'mlp_size_2': 1, 'mlp_size_3': 1, 'kernel': 'LogLogistic', 'loss_name': 'AlternativeNLLLoss'}. Best is trial 17 with value: 0.8538600001453517.[0m
[32m[I 2022-04-22 01:49:49,303][0m Trial 362 finished with value: 0.8425602696753012 and parameters: {'n_hidden': 1024, 'mixture_components': 3, 'use_sparse_layer': True, 'use_sparse_loss': False, 'use_batchnorm': False, 'use_dropout': False, 'mlp_size_1': 4, 'mlp_size_2': 2, 'mlp_size_3': 0, 'kernel': 'Gumbel', 'loss_name': 'AlternativeNLLLoss'}. Best is trial 17 with value: 0.8538600001453517.[0m
[32m[I 2022-04-22 01:51:41,753][0m Trial 363 finished with value: 0.8477903582890434 and parameters: {'n_hidden': 1024, 'mixture_components': 3, 'use_sparse_layer': True, 'use_sparse_loss': False, 'use_batchnorm': False, 'use_dropout': False, 'mlp_size_1': 5, 'mlp_size_2': 1, 'mlp_size_3': 0, 'kernel': 'LogLogistic', 'loss_name': 'AlternativeNLLLoss'}. Best is trial 17 with value: 0.8538600001453517.[0m
[32m[I 2022-04-22 01:53:41,510][0m Trial 364 finished with value: 0.8403835516720963 and parameters: {'n_hidden': 1024, 'mixture_components': 3, 'use_sparse_layer': True, 'use_sparse_loss': False, 'use_batchnorm': False, 'use_dropout': False, 'mlp_size_1': 5, 'mlp_size_2': 1, 'mlp_size_3': 0, 'kernel': 'LogLogistic', 'loss_name': 'AlternativeNLLLoss'}. Best is trial 17 with value: 0.8538600001453517.[0m
[32m[I 2022-04-22 01:55:16,521][0m Trial 365 finished with value: 0.7438183863301944 and parameters: {'n_hidden': 1024, 'mixture_components': 2, 'use_sparse_layer': True, 'use_sparse_loss': False, 'use_batchnorm': False, 'use_dropout': True, 'dropout': 0.3924623085068773, 'mlp_size_1': 5, 'mlp_size_2': 1, 'mlp_size_3': 0, 'kernel': 'LogLogistic', 'loss_name': 'AlternativeNLLLoss'}. Best is trial 17 with value: 0.8538600001453517.[0m
[32m[I 2022-04-22 01:57:10,309][0m Trial 366 finished with value: 0.8449105292197776 and parameters: {'n_hidden': 1024, 'mixture_components': 3, 'use_sparse_layer': True, 'use_sparse_loss': False, 'use_batchnorm': False, 'use_dropout': False, 'mlp_size_1': 5, 'mlp_size_2': 1, 'mlp_size_3': 1, 'kernel': 'LogLogistic', 'loss_name': 'AlternativeNLLLoss'}. Best is trial 17 with value: 0.8538600001453517.[0m
[32m[I 2022-04-22 01:59:26,209][0m Trial 367 finished with value: 0.8446395690501081 and parameters: {'n_hidden': 1024, 'mixture_components': 3, 'use_sparse_layer': True, 'use_sparse_loss': False, 'use_batchnorm': False, 'use_dropout': False, 'mlp_size_1': 4, 'mlp_size_2': 1, 'mlp_size_3': 0, 'kernel': 'LogLogistic', 'loss_name': 'AlternativeNLLLoss'}. Best is trial 17 with value: 0.8538600001453517.[0m
[32m[I 2022-04-22 02:01:29,006][0m Trial 368 finished with value: 0.7424846145516381 and parameters: {'n_hidden': 1024, 'mixture_components': 3, 'use_sparse_layer': True, 'use_sparse_loss': False, 'use_batchnorm': False, 'use_dropout': False, 'mlp_size_1': 5, 'mlp_size_2': 1, 'mlp_size_3': 0, 'kernel': 'Normal', 'loss_name': 'AlternativeNLLLoss'}. Best is trial 17 with value: 0.8538600001453517.[0m
[32m[I 2022-04-22 02:03:15,864][0m Trial 369 finished with value: 0.843737496388612 and parameters: {'n_hidden': 1024, 'mixture_components': 10, 'use_sparse_layer': True, 'use_sparse_loss': False, 'use_batchnorm': False, 'use_dropout': False, 'mlp_size_1': 5, 'mlp_size_2': 1, 'mlp_size_3': 0, 'kernel': 'LogLogistic', 'loss_name': 'AlternativeNLLLoss'}. Best is trial 17 with value: 0.8538600001453517.[0m
[32m[I 2022-04-22 02:05:20,187][0m Trial 370 finished with value: 0.7415443300283249 and parameters: {'n_hidden': 1024, 'mixture_components': 1, 'use_sparse_layer': True, 'use_sparse_loss': False, 'use_batchnorm': False, 'use_dropout': False, 'mlp_size_1': 5, 'mlp_size_2': 1, 'mlp_size_3': 0, 'kernel': 'Normal', 'loss_name': 'AlternativeNLLLoss'}. Best is trial 17 with value: 0.8538600001453517.[0m
[32m[I 2022-04-22 02:09:47,197][0m Trial 371 finished with value: 0.6321352014084237 and parameters: {'n_hidden': 128, 'mixture_components': 8, 'use_sparse_layer': True, 'use_sparse_loss': False, 'use_batchnorm': True, 'use_dropout': False, 'mlp_size_1': 4, 'mlp_size_2': 0, 'mlp_size_3': 0, 'kernel': 'LogLogistic', 'loss_name': 'AlternativeNLLLoss'}. Best is trial 17 with value: 0.8538600001453517.[0m
[32m[I 2022-04-22 02:11:35,114][0m Trial 372 finished with value: 0.7415801083858741 and parameters: {'n_hidden': 1024, 'mixture_components': 3, 'use_sparse_layer': True, 'use_sparse_loss': False, 'use_batchnorm': False, 'use_dropout': False, 'mlp_size_1': 5, 'mlp_size_2': 1, 'mlp_size_3': 0, 'kernel': 'Normal', 'loss_name': 'AlternativeNLLLoss'}. Best is trial 17 with value: 0.8538600001453517.[0m
[32m[I 2022-04-22 02:13:24,302][0m Trial 373 finished with value: 0.837936347896021 and parameters: {'n_hidden': 2048, 'mixture_components': 2, 'use_sparse_layer': True, 'use_sparse_loss': True, 'lmbd': 6.405885765927575e-05, 'use_batchnorm': False, 'use_dropout': False, 'mlp_size_1': 1, 'mlp_size_2': 4, 'mlp_size_3': 3, 'kernel': 'LogLogistic', 'loss_name': 'AlternativeNLLLoss'}. Best is trial 17 with value: 0.8538600001453517.[0m
[32m[I 2022-04-22 02:17:04,086][0m Trial 374 finished with value: 0.8379509287520559 and parameters: {'n_hidden': 32, 'mixture_components': 5, 'use_sparse_layer': True, 'use_sparse_loss': False, 'use_batchnorm': False, 'use_dropout': False, 'mlp_size_1': 2, 'mlp_size_2': 0, 'mlp_size_3': 0, 'kernel': 'Normal', 'loss_name': 'AlternativeNLLLoss'}. Best is trial 17 with value: 0.8538600001453517.[0m
[32m[I 2022-04-22 02:18:15,444][0m Trial 375 finished with value: -0.23546867665735222 and parameters: {'n_hidden': 1024, 'mixture_components': 3, 'use_sparse_layer': True, 'use_sparse_loss': False, 'use_batchnorm': False, 'use_dropout': False, 'mlp_size_1': 7, 'mlp_size_2': 0, 'mlp_size_3': 0, 'kernel': 'Exponential', 'loss_name': 'AlternativeNLLLoss'}. Best is trial 17 with value: 0.8538600001453517.[0m
[32m[I 2022-04-22 02:20:00,649][0m Trial 376 finished with value: 0.8388095390991481 and parameters: {'n_hidden': 2048, 'mixture_components': 3, 'use_sparse_layer': True, 'use_sparse_loss': False, 'use_batchnorm': False, 'use_dropout': False, 'mlp_size_1': 7, 'mlp_size_2': 1, 'mlp_size_3': 0, 'kernel': 'LogLogistic', 'loss_name': 'AlternativeNLLLoss'}. Best is trial 17 with value: 0.8538600001453517.[0m
[32m[I 2022-04-22 02:22:10,193][0m Trial 377 finished with value: 0.8383225250151971 and parameters: {'n_hidden': 1024, 'mixture_components': 5, 'use_sparse_layer': True, 'use_sparse_loss': False, 'use_batchnorm': False, 'use_dropout': False, 'mlp_size_1': 5, 'mlp_size_2': 1, 'mlp_size_3': 1, 'kernel': 'Normal', 'loss_name': 'AlternativeNLLLoss'}. Best is trial 17 with value: 0.8538600001453517.[0m
[32m[I 2022-04-22 02:24:23,310][0m Trial 378 finished with value: 0.8419120020109961 and parameters: {'n_hidden': 2048, 'mixture_components': 7, 'use_sparse_layer': True, 'use_sparse_loss': False, 'use_batchnorm': False, 'use_dropout': False, 'mlp_size_1': 7, 'mlp_size_2': 1, 'mlp_size_3': 0, 'kernel': 'LogLogistic', 'loss_name': 'AlternativeNLLLoss'}. Best is trial 17 with value: 0.8538600001453517.[0m
[32m[I 2022-04-22 02:26:42,513][0m Trial 379 finished with value: 0.8268050350068503 and parameters: {'n_hidden': 1024, 'mixture_components': 3, 'use_sparse_layer': True, 'use_sparse_loss': False, 'use_batchnorm': False, 'use_dropout': False, 'mlp_size_1': 5, 'mlp_size_2': 1, 'mlp_size_3': 0, 'kernel': 'Logistic', 'loss_name': 'AlternativeNLLLoss'}. Best is trial 17 with value: 0.8538600001453517.[0m
[32m[I 2022-04-22 02:29:35,533][0m Trial 380 finished with value: 0.8340976824793804 and parameters: {'n_hidden': 64, 'mixture_components': 5, 'use_sparse_layer': True, 'use_sparse_loss': False, 'use_batchnorm': False, 'use_dropout': False, 'mlp_size_1': 3, 'mlp_size_2': 0, 'mlp_size_3': 0, 'kernel': 'Normal', 'loss_name': 'AlternativeNLLLoss'}. Best is trial 17 with value: 0.8538600001453517.[0m
[32m[I 2022-04-22 02:31:20,433][0m Trial 381 finished with value: 0.8422841085046416 and parameters: {'n_hidden': 2048, 'mixture_components': 4, 'use_sparse_layer': True, 'use_sparse_loss': False, 'use_batchnorm': False, 'use_dropout': False, 'mlp_size_1': 7, 'mlp_size_2': 1, 'mlp_size_3': 0, 'kernel': 'LogLogistic', 'loss_name': 'AlternativeNLLLoss'}. Best is trial 17 with value: 0.8538600001453517.[0m
[32m[I 2022-04-22 02:33:34,593][0m Trial 382 finished with value: 0.7437506124193506 and parameters: {'n_hidden': 256, 'mixture_components': 3, 'use_sparse_layer': True, 'use_sparse_loss': False, 'use_batchnorm': False, 'use_dropout': False, 'mlp_size_1': 5, 'mlp_size_2': 0, 'mlp_size_3': 0, 'kernel': 'Normal', 'loss_name': 'AlternativeNLLLoss'}. Best is trial 17 with value: 0.8538600001453517.[0m
[32m[I 2022-04-22 02:35:17,151][0m Trial 383 finished with value: 0.8382057298837697 and parameters: {'n_hidden': 1024, 'mixture_components': 5, 'use_sparse_layer': True, 'use_sparse_loss': False, 'use_batchnorm': False, 'use_dropout': False, 'mlp_size_1': 5, 'mlp_size_2': 1, 'mlp_size_3': 1, 'kernel': 'LogLogistic', 'loss_name': 'AlternativeNLLLoss'}. Best is trial 17 with value: 0.8538600001453517.[0m
[32m[I 2022-04-22 02:37:25,101][0m Trial 384 finished with value: 0.8414429270725396 and parameters: {'n_hidden': 2048, 'mixture_components': 4, 'use_sparse_layer': True, 'use_sparse_loss': True, 'lmbd': 0.0004082043988698142, 'use_batchnorm': False, 'use_dropout': False, 'mlp_size_1': 4, 'mlp_size_2': 1, 'mlp_size_3': 0, 'kernel': 'Normal', 'loss_name': 'AlternativeNLLLoss'}. Best is trial 17 with value: 0.8538600001453517.[0m
[32m[I 2022-04-22 02:39:24,221][0m Trial 385 finished with value: 0.8370942251675955 and parameters: {'n_hidden': 1024, 'mixture_components': 8, 'use_sparse_layer': True, 'use_sparse_loss': False, 'use_batchnorm': False, 'use_dropout': False, 'mlp_size_1': 7, 'mlp_size_2': 0, 'mlp_size_3': 0, 'kernel': 'LogLogistic', 'loss_name': 'AlternativeNLLLoss'}. Best is trial 17 with value: 0.8538600001453517.[0m
[32m[I 2022-04-22 02:40:56,221][0m Trial 386 finished with value: 0.34079460245122456 and parameters: {'n_hidden': 1024, 'mixture_components': 5, 'use_sparse_layer': True, 'use_sparse_loss': False, 'use_batchnorm': False, 'use_dropout': True, 'dropout': 0.6738248562867221, 'mlp_size_1': 5, 'mlp_size_2': 1, 'mlp_size_3': 1, 'kernel': 'Gumbel', 'loss_name': 'AlternativeNLLLoss'}. Best is trial 17 with value: 0.8538600001453517.[0m
[32m[I 2022-04-22 02:43:06,846][0m Trial 387 finished with value: 0.8412021071317388 and parameters: {'n_hidden': 2048, 'mixture_components': 10, 'use_sparse_layer': True, 'use_sparse_loss': False, 'use_batchnorm': False, 'use_dropout': False, 'mlp_size_1': 8, 'mlp_size_2': 0, 'mlp_size_3': 0, 'kernel': 'Normal', 'loss_name': 'AlternativeNLLLoss'}. Best is trial 17 with value: 0.8538600001453517.[0m
