[32m[I 2022-04-21 11:38:29,755][0m Trial 631 finished with value: 0.8340130635607796 and parameters: {'splitter': 'best', 'min_samples_split': 0.08710464611448893, 'min_samples_leaf': 0.041205536345624155, 'min_weight_fraction_leaf': 0.05851091694205135, 'max_features': 0.6220188455582756}. Best is trial 499 with value: 0.8396174698878165.[0m
[32m[I 2022-04-21 11:38:29,812][0m Trial 632 finished with value: 0.8318450474400789 and parameters: {'splitter': 'best', 'min_samples_split': 0.10095658607483374, 'min_samples_leaf': 0.18351720184860792, 'min_weight_fraction_leaf': 0.04972937111886921, 'max_features': 0.6333514688953895}. Best is trial 499 with value: 0.8396174698878165.[0m
[32m[I 2022-04-21 11:38:29,917][0m Trial 633 finished with value: 0.8336210332407393 and parameters: {'splitter': 'best', 'min_samples_split': 0.11089697474045368, 'min_samples_leaf': 0.02258473190489823, 'min_weight_fraction_leaf': 0.0735085518411752, 'max_features': 0.6555539349702493}. Best is trial 499 with value: 0.8396174698878165.[0m
[32m[I 2022-04-21 11:38:30,003][0m Trial 634 finished with value: 0.8318450474400789 and parameters: {'splitter': 'best', 'min_samples_split': 0.018013213292485092, 'min_samples_leaf': 0.26471038625467674, 'min_weight_fraction_leaf': 0.043041273669689885, 'max_features': 0.6781835967001567}. Best is trial 499 with value: 0.8396174698878165.[0m
[32m[I 2022-04-21 11:38:30,059][0m Trial 635 finished with value: 0.8372245618281238 and parameters: {'splitter': 'best', 'min_samples_split': 0.08492019527339757, 'min_samples_leaf': 0.05112226466110796, 'min_weight_fraction_leaf': 0.028273215334491612, 'max_features': 0.7072265430698609}. Best is trial 499 with value: 0.8396174698878165.[0m
[32m[I 2022-04-21 11:38:30,120][0m Trial 636 finished with value: 0.8352402471455868 and parameters: {'splitter': 'best', 'min_samples_split': 0.10886804945236309, 'min_samples_leaf': 0.03522265193129483, 'min_weight_fraction_leaf': 0.035112784244711856, 'max_features': 0.690583493188578}. Best is trial 499 with value: 0.8396174698878165.[0m
[32m[I 2022-04-21 11:38:30,216][0m Trial 637 finished with value: 0.8333498191213747 and parameters: {'splitter': 'best', 'min_samples_split': 0.12214868421660854, 'min_samples_leaf': 0.031933776091046605, 'min_weight_fraction_leaf': 0.0632260048638322, 'max_features': 0.6519894710895093}. Best is trial 499 with value: 0.8396174698878165.[0m
[32m[I 2022-04-21 11:38:30,349][0m Trial 638 finished with value: 0.8284678611023908 and parameters: {'splitter': 'best', 'min_samples_split': 0.097116170192193, 'min_samples_leaf': 0.01252394440698817, 'min_weight_fraction_leaf': 0.03855122936796695, 'max_features': 0.5850817422463452}. Best is trial 499 with value: 0.8396174698878165.[0m
[32m[I 2022-04-21 11:38:30,459][0m Trial 639 finished with value: 0.8372245618281238 and parameters: {'splitter': 'best', 'min_samples_split': 0.08405873704038085, 'min_samples_leaf': 0.04832960678195508, 'min_weight_fraction_leaf': 0.05209418458262638, 'max_features': 0.679505418681194}. Best is trial 499 with value: 0.8396174698878165.[0m
[32m[I 2022-04-21 11:38:30,549][0m Trial 640 finished with value: 0.65 and parameters: {'splitter': 'best', 'min_samples_split': 0.05379000697554102, 'min_samples_leaf': 0.36919498225156555, 'min_weight_fraction_leaf': 0.06505603905235552, 'max_features': 0.6662041499543268}. Best is trial 499 with value: 0.8396174698878165.[0m
[32m[I 2022-04-21 11:38:30,606][0m Trial 641 finished with value: 0.8372245618281238 and parameters: {'splitter': 'best', 'min_samples_split': 0.04054926650402252, 'min_samples_leaf': 0.04926138490312421, 'min_weight_fraction_leaf': 0.03416224460029325, 'max_features': 0.7048934088855651}. Best is trial 499 with value: 0.8396174698878165.[0m
[32m[I 2022-04-21 11:38:30,673][0m Trial 642 finished with value: 0.8296510446745703 and parameters: {'splitter': 'best', 'min_samples_split': 0.1105770278900647, 'min_samples_leaf': 0.039742813144525616, 'min_weight_fraction_leaf': 0.03694554162761451, 'max_features': 0.5970589830627514}. Best is trial 499 with value: 0.8396174698878165.[0m
[32m[I 2022-04-21 11:38:30,795][0m Trial 643 finished with value: 0.8372245618281238 and parameters: {'splitter': 'best', 'min_samples_split': 0.07065650521042677, 'min_samples_leaf': 0.049426368774912646, 'min_weight_fraction_leaf': 0.024846061013654278, 'max_features': 0.7152526073391167}. Best is trial 499 with value: 0.8396174698878165.[0m
[32m[I 2022-04-21 11:38:30,924][0m Trial 644 finished with value: 0.8318450474400789 and parameters: {'splitter': 'best', 'min_samples_split': 0.06654070984595034, 'min_samples_leaf': 0.012404308887429938, 'min_weight_fraction_leaf': 0.19034614260257393, 'max_features': 0.7193398595996788}. Best is trial 499 with value: 0.8396174698878165.[0m
[32m[I 2022-04-21 11:38:31,104][0m Trial 645 finished with value: 0.8381929163139727 and parameters: {'splitter': 'best', 'min_samples_split': 0.13379381376693597, 'min_samples_leaf': 0.02295033527200948, 'min_weight_fraction_leaf': 0.047910222779346506, 'max_features': 0.6238047019966657}. Best is trial 499 with value: 0.8396174698878165.[0m
[32m[I 2022-04-21 11:38:31,315][0m Trial 646 finished with value: 0.8316149506675705 and parameters: {'splitter': 'best', 'min_samples_split': 0.05418203280625564, 'min_samples_leaf': 0.03526943900048321, 'min_weight_fraction_leaf': 0.08382239001530911, 'max_features': 0.648462083766273}. Best is trial 499 with value: 0.8396174698878165.[0m
[32m[I 2022-04-21 11:38:31,446][0m Trial 647 finished with value: 0.8318450474400789 and parameters: {'splitter': 'best', 'min_samples_split': 0.4791969720661501, 'min_samples_leaf': 0.010998335765367037, 'min_weight_fraction_leaf': 0.02541109881292467, 'max_features': 0.7240878739062676}. Best is trial 499 with value: 0.8396174698878165.[0m
[32m[I 2022-04-21 11:38:31,591][0m Trial 648 finished with value: 0.8391063129816301 and parameters: {'splitter': 'best', 'min_samples_split': 0.1218717799874979, 'min_samples_leaf': 0.025442123550685588, 'min_weight_fraction_leaf': 0.047593149084455146, 'max_features': 0.6379454513088514}. Best is trial 499 with value: 0.8396174698878165.[0m
[32m[I 2022-04-21 11:38:31,698][0m Trial 649 finished with value: 0.8293305586137363 and parameters: {'splitter': 'random', 'min_samples_split': 0.13971597224814883, 'min_samples_leaf': 0.021565325069857925, 'min_weight_fraction_leaf': 0.0579257599926397, 'max_features': 0.6532791472931342}. Best is trial 499 with value: 0.8396174698878165.[0m
[32m[I 2022-04-21 11:38:31,839][0m Trial 650 finished with value: 0.8372245618281238 and parameters: {'splitter': 'best', 'min_samples_split': 0.06685282349842384, 'min_samples_leaf': 0.04906925453559573, 'min_weight_fraction_leaf': 0.02550532473405855, 'max_features': 0.6951176392503489}. Best is trial 499 with value: 0.8396174698878165.[0m
[32m[I 2022-04-21 11:38:31,944][0m Trial 651 finished with value: 0.8333498191213747 and parameters: {'splitter': 'best', 'min_samples_split': 0.030303139068220394, 'min_samples_leaf': 0.026068891718133265, 'min_weight_fraction_leaf': 0.06781679639819516, 'max_features': 0.6081644753353849}. Best is trial 499 with value: 0.8396174698878165.[0m
[32m[I 2022-04-21 11:38:32,058][0m Trial 652 finished with value: 0.8372245618281238 and parameters: {'splitter': 'best', 'min_samples_split': 0.09973891896301218, 'min_samples_leaf': 0.014684499900836695, 'min_weight_fraction_leaf': 0.054574158246944324, 'max_features': 0.6387115133113587}. Best is trial 499 with value: 0.8396174698878165.[0m
[32m[I 2022-04-21 11:38:32,173][0m Trial 653 finished with value: 0.8391063129816301 and parameters: {'splitter': 'best', 'min_samples_split': 0.10533860171916667, 'min_samples_leaf': 0.03974292406491782, 'min_weight_fraction_leaf': 0.044354473067071076, 'max_features': 0.6063568839107499}. Best is trial 499 with value: 0.8396174698878165.[0m
[32m[I 2022-04-21 11:38:32,285][0m Trial 654 finished with value: 0.8331975496664612 and parameters: {'splitter': 'best', 'min_samples_split': 0.0990356875963409, 'min_samples_leaf': 0.03658585739201201, 'min_weight_fraction_leaf': 0.04337437182317484, 'max_features': 0.5624395434962273}. Best is trial 499 with value: 0.8396174698878165.[0m
[32m[I 2022-04-21 11:38:32,381][0m Trial 655 finished with value: 0.8318450474400789 and parameters: {'splitter': 'best', 'min_samples_split': 0.04834737221558966, 'min_samples_leaf': 0.28262324073678724, 'min_weight_fraction_leaf': 0.20915952447022634, 'max_features': 0.6853877566224057}. Best is trial 499 with value: 0.8396174698878165.[0m
[32m[I 2022-04-21 11:38:32,486][0m Trial 656 finished with value: 0.8391063129816301 and parameters: {'splitter': 'best', 'min_samples_split': 0.09196482773681125, 'min_samples_leaf': 0.04493098548776968, 'min_weight_fraction_leaf': 0.028080159468838795, 'max_features': 0.7139040785961382}. Best is trial 499 with value: 0.8396174698878165.[0m
[32m[I 2022-04-21 11:38:32,618][0m Trial 657 finished with value: 0.8340130635607796 and parameters: {'splitter': 'best', 'min_samples_split': 0.09437166589293408, 'min_samples_leaf': 0.03443085750332342, 'min_weight_fraction_leaf': 0.0604182586463112, 'max_features': 0.6737206937991354}. Best is trial 499 with value: 0.8396174698878165.[0m
[32m[I 2022-04-21 11:38:32,740][0m Trial 658 finished with value: 0.8350747161321781 and parameters: {'splitter': 'best', 'min_samples_split': 0.11886060699663016, 'min_samples_leaf': 0.009648459778652646, 'min_weight_fraction_leaf': 0.03742559177863731, 'max_features': 0.6543768296027264}. Best is trial 499 with value: 0.8396174698878165.[0m
[32m[I 2022-04-21 11:38:32,864][0m Trial 659 finished with value: 0.8251016149358383 and parameters: {'splitter': 'best', 'min_samples_split': 0.11602730437674744, 'min_samples_leaf': 0.01702673610807566, 'min_weight_fraction_leaf': 0.03087581365235672, 'max_features': 0.05735237254820019}. Best is trial 499 with value: 0.8396174698878165.[0m
[32m[I 2022-04-21 11:38:32,995][0m Trial 660 finished with value: 0.8337713431190045 and parameters: {'splitter': 'best', 'min_samples_split': 0.0809648048953874, 'min_samples_leaf': 0.0010122353915458376, 'min_weight_fraction_leaf': 0.03674314927038992, 'max_features': 0.6671619514260602}. Best is trial 499 with value: 0.8396174698878165.[0m
[32m[I 2022-04-21 11:38:33,117][0m Trial 661 finished with value: 0.8372245618281238 and parameters: {'splitter': 'best', 'min_samples_split': 0.12934698566499728, 'min_samples_leaf': 0.027644726008843108, 'min_weight_fraction_leaf': 0.05143270183908217, 'max_features': 0.6879548153319154}. Best is trial 499 with value: 0.8396174698878165.[0m
[32m[I 2022-04-21 11:38:33,244][0m Trial 662 finished with value: 0.8336210332407393 and parameters: {'splitter': 'best', 'min_samples_split': 0.12014644419509311, 'min_samples_leaf': 0.018683769038544233, 'min_weight_fraction_leaf': 0.07441043121532301, 'max_features': 0.664168814627488}. Best is trial 499 with value: 0.8396174698878165.[0m
[32m[I 2022-04-21 11:38:33,363][0m Trial 663 finished with value: 0.8372245618281238 and parameters: {'splitter': 'best', 'min_samples_split': 0.07948775927728413, 'min_samples_leaf': 0.008985368410237251, 'min_weight_fraction_leaf': 0.051119885732106005, 'max_features': 0.7206088769711358}. Best is trial 499 with value: 0.8396174698878165.[0m
[32m[I 2022-04-21 11:38:33,434][0m Trial 664 finished with value: 0.8333498191213747 and parameters: {'splitter': 'best', 'min_samples_split': 0.14277815939054173, 'min_samples_leaf': 0.02914516089351935, 'min_weight_fraction_leaf': 0.06422124789383289, 'max_features': 0.6302934937161948}. Best is trial 499 with value: 0.8396174698878165.[0m
[32m[I 2022-04-21 11:38:33,535][0m Trial 665 finished with value: 0.8391063129816301 and parameters: {'splitter': 'best', 'min_samples_split': 0.10333520242410243, 'min_samples_leaf': 0.04751096592873222, 'min_weight_fraction_leaf': 0.023607472636309558, 'max_features': 0.6853549228144679}. Best is trial 499 with value: 0.8396174698878165.[0m
[32m[I 2022-04-21 11:38:33,666][0m Trial 666 finished with value: 0.8391063129816301 and parameters: {'splitter': 'best', 'min_samples_split': 0.09008477242891334, 'min_samples_leaf': 0.04741938961949464, 'min_weight_fraction_leaf': 0.025680059606358344, 'max_features': 0.6951967495093604}. Best is trial 499 with value: 0.8396174698878165.[0m
[32m[I 2022-04-21 11:38:33,793][0m Trial 667 finished with value: 0.8338545264018 and parameters: {'splitter': 'random', 'min_samples_split': 0.09291102632805556, 'min_samples_leaf': 0.018627481020905376, 'min_weight_fraction_leaf': 0.04780395685255332, 'max_features': 0.5271002429881123}. Best is trial 499 with value: 0.8396174698878165.[0m
[32m[I 2022-04-21 11:38:33,912][0m Trial 668 finished with value: 0.8372245618281238 and parameters: {'splitter': 'best', 'min_samples_split': 0.08033058352213654, 'min_samples_leaf': 0.05239726745837779, 'min_weight_fraction_leaf': 0.02212066812523267, 'max_features': 0.7052205286825595}. Best is trial 499 with value: 0.8396174698878165.[0m
[32m[I 2022-04-21 11:38:34,040][0m Trial 669 finished with value: 0.8372245618281238 and parameters: {'splitter': 'best', 'min_samples_split': 0.09052230272827749, 'min_samples_leaf': 0.05514079276705315, 'min_weight_fraction_leaf': 0.022861266297350136, 'max_features': 0.7192566750828987}. Best is trial 499 with value: 0.8396174698878165.[0m
[32m[I 2022-04-21 11:38:34,193][0m Trial 670 finished with value: 0.8391063129816301 and parameters: {'splitter': 'best', 'min_samples_split': 0.06893407178070395, 'min_samples_leaf': 0.045960673709027705, 'min_weight_fraction_leaf': 0.022920516106028074, 'max_features': 0.6979200275147704}. Best is trial 499 with value: 0.8396174698878165.[0m
[32m[I 2022-04-21 11:38:34,295][0m Trial 671 finished with value: 0.8318450474400789 and parameters: {'splitter': 'best', 'min_samples_split': 0.13218471467301335, 'min_samples_leaf': 0.13761907023634423, 'min_weight_fraction_leaf': 0.05662092303683417, 'max_features': 0.6495590073818439}. Best is trial 499 with value: 0.8396174698878165.[0m
[32m[I 2022-04-21 11:38:34,423][0m Trial 672 finished with value: 0.65 and parameters: {'splitter': 'best', 'min_samples_split': 0.06333735869080082, 'min_samples_leaf': 0.02940055447088877, 'min_weight_fraction_leaf': 0.4751339555793844, 'max_features': 0.7306048080310722}. Best is trial 499 with value: 0.8396174698878165.[0m
[32m[I 2022-04-21 11:38:34,557][0m Trial 673 finished with value: 0.832312409597251 and parameters: {'splitter': 'best', 'min_samples_split': 0.07352358779474849, 'min_samples_leaf': 0.009467485446950936, 'min_weight_fraction_leaf': 0.03404427097368931, 'max_features': 0.6011026237891592}. Best is trial 499 with value: 0.8396174698878165.[0m
[32m[I 2022-04-21 11:38:34,659][0m Trial 674 finished with value: 0.8331975496664612 and parameters: {'splitter': 'best', 'min_samples_split': 0.10774951982997867, 'min_samples_leaf': 0.041742021887070976, 'min_weight_fraction_leaf': 0.031291118955419264, 'max_features': 0.5775147472191652}. Best is trial 499 with value: 0.8396174698878165.[0m
[32m[I 2022-04-21 11:38:34,788][0m Trial 675 finished with value: 0.8350747161321781 and parameters: {'splitter': 'best', 'min_samples_split': 0.11547634517931331, 'min_samples_leaf': 0.009927045141660635, 'min_weight_fraction_leaf': 0.0365284913950026, 'max_features': 0.668902612623951}. Best is trial 499 with value: 0.8396174698878165.[0m
[32m[I 2022-04-21 11:38:34,915][0m Trial 676 finished with value: 0.8352402471455868 and parameters: {'splitter': 'best', 'min_samples_split': 0.1099151335784345, 'min_samples_leaf': 0.03082685943868701, 'min_weight_fraction_leaf': 0.041384055229023886, 'max_features': 0.6333387182960508}. Best is trial 499 with value: 0.8396174698878165.[0m
[32m[I 2022-04-21 11:38:35,036][0m Trial 677 finished with value: 0.8391063129816301 and parameters: {'splitter': 'best', 'min_samples_split': 0.10008022499933003, 'min_samples_leaf': 0.03346197546861425, 'min_weight_fraction_leaf': 0.04323193451121301, 'max_features': 0.6190471007231219}. Best is trial 499 with value: 0.8396174698878165.[0m
[32m[I 2022-04-21 11:38:35,143][0m Trial 678 finished with value: 0.8357932440853674 and parameters: {'splitter': 'best', 'min_samples_split': 0.13030745405953442, 'min_samples_leaf': 0.02233015508740481, 'min_weight_fraction_leaf': 0.03583729139695227, 'max_features': 0.6379865385739736}. Best is trial 499 with value: 0.8396174698878165.[0m
[32m[I 2022-04-21 11:38:35,219][0m Trial 679 finished with value: 0.8372245618281238 and parameters: {'splitter': 'best', 'min_samples_split': 0.07169013984939349, 'min_samples_leaf': 0.05096248550027151, 'min_weight_fraction_leaf': 0.02446525188711551, 'max_features': 0.6947621673949164}. Best is trial 499 with value: 0.8396174698878165.[0m
[32m[I 2022-04-21 11:38:35,280][0m Trial 680 finished with value: 0.8372245618281238 and parameters: {'splitter': 'best', 'min_samples_split': 0.11501212752443012, 'min_samples_leaf': 0.009661994790652339, 'min_weight_fraction_leaf': 0.05450520660589063, 'max_features': 0.6756529394491921}. Best is trial 499 with value: 0.8396174698878165.[0m
[32m[I 2022-04-21 11:38:35,359][0m Trial 681 finished with value: 0.8355314144660066 and parameters: {'splitter': 'best', 'min_samples_split': 0.09915221072565293, 'min_samples_leaf': 0.03794308843507721, 'min_weight_fraction_leaf': 0.03317093563389142, 'max_features': 0.6179967169322729}. Best is trial 499 with value: 0.8396174698878165.[0m
[32m[I 2022-04-21 11:38:35,421][0m Trial 682 finished with value: 0.8331975496664612 and parameters: {'splitter': 'best', 'min_samples_split': 0.10598352016712703, 'min_samples_leaf': 0.037180361327994786, 'min_weight_fraction_leaf': 0.04303655963263393, 'max_features': 0.5962722668825907}. Best is trial 499 with value: 0.8396174698878165.[0m
[32m[I 2022-04-21 11:38:35,473][0m Trial 683 finished with value: 0.8372245618281238 and parameters: {'splitter': 'best', 'min_samples_split': 0.08681296628504052, 'min_samples_leaf': 0.05138528290106398, 'min_weight_fraction_leaf': 0.02212654512119796, 'max_features': 0.7369483727700811}. Best is trial 499 with value: 0.8396174698878165.[0m
[32m[I 2022-04-21 11:38:35,522][0m Trial 684 finished with value: 0.8318450474400789 and parameters: {'splitter': 'best', 'min_samples_split': 0.11123039212686665, 'min_samples_leaf': 0.19730579874851786, 'min_weight_fraction_leaf': 0.07011345969472045, 'max_features': 0.6309988390007851}. Best is trial 499 with value: 0.8396174698878165.[0m
[32m[I 2022-04-21 11:38:35,588][0m Trial 685 finished with value: 0.8391063129816301 and parameters: {'splitter': 'best', 'min_samples_split': 0.09077218177120236, 'min_samples_leaf': 0.04442993000314788, 'min_weight_fraction_leaf': 0.030645042258716077, 'max_features': 0.7157562546957662}. Best is trial 499 with value: 0.8396174698878165.[0m
[32m[I 2022-04-21 11:38:35,642][0m Trial 686 finished with value: 0.8292464992419608 and parameters: {'splitter': 'random', 'min_samples_split': 0.12750292350063705, 'min_samples_leaf': 0.0189282896508635, 'min_weight_fraction_leaf': 0.05856094076957866, 'max_features': 0.6146497712296226}. Best is trial 499 with value: 0.8396174698878165.[0m
/media/san2_ssd/data/Workdir/survival/utils.py:305: RuntimeWarning: invalid value encountered in true_divide
  pdfs = np.gradient(1-survs,axis=1)/norms
[32m[I 2022-04-21 11:38:35,699][0m Trial 687 finished with value: 0.837556430214408 and parameters: {'splitter': 'best', 'min_samples_split': 0.13711209111104822, 'min_samples_leaf': 0.019028970362366962, 'min_weight_fraction_leaf': 0.018126243340630954, 'max_features': 0.689160202385143}. Best is trial 499 with value: 0.8396174698878165.[0m
[32m[I 2022-04-21 11:38:35,764][0m Trial 688 finished with value: 0.8180388147131256 and parameters: {'splitter': 'best', 'min_samples_split': 0.11785204546289789, 'min_samples_leaf': 0.002017275668579944, 'min_weight_fraction_leaf': 0.09377580496642063, 'max_features': 0.5821089693068003}. Best is trial 499 with value: 0.8396174698878165.[0m
[32m[I 2022-04-21 11:38:35,822][0m Trial 689 finished with value: 0.6744920180162803 and parameters: {'splitter': 'best', 'min_samples_split': 0.047021070484357476, 'min_samples_leaf': 0.33300547639234335, 'min_weight_fraction_leaf': 0.04462936613607092, 'max_features': 0.6931928094945595}. Best is trial 499 with value: 0.8396174698878165.[0m
[32m[I 2022-04-21 11:38:35,885][0m Trial 690 finished with value: 0.8287316840033583 and parameters: {'splitter': 'best', 'min_samples_split': 0.07034659718637098, 'min_samples_leaf': 0.04036148275605797, 'min_weight_fraction_leaf': 0.03734817446957765, 'max_features': 0.5636283400915971}. Best is trial 499 with value: 0.8396174698878165.[0m
[32m[I 2022-04-21 11:38:35,950][0m Trial 691 finished with value: 0.8372245618281238 and parameters: {'splitter': 'best', 'min_samples_split': 0.14709387003682933, 'min_samples_leaf': 0.010544137619976857, 'min_weight_fraction_leaf': 0.053392215451860625, 'max_features': 0.6650545903086715}. Best is trial 499 with value: 0.8396174698878165.[0m
[32m[I 2022-04-21 11:38:36,032][0m Trial 692 finished with value: 0.8352402471455868 and parameters: {'splitter': 'best', 'min_samples_split': 0.10951434031671123, 'min_samples_leaf': 0.027052789313412557, 'min_weight_fraction_leaf': 0.0361648603426613, 'max_features': 0.6004852355563645}. Best is trial 499 with value: 0.8396174698878165.[0m
