[32m[I 2022-04-21 20:37:45,562][0m Trial 923 finished with value: 0.8464790062835021 and parameters: {'loss': 'coxph', 'learning_rate': 0.00027425993973969324, 'n_estimators': 283, 'criterion': 'friedman_mse', 'min_samples_split': 2, 'min_samples_leaf': 1, 'min_weight_fraction_leaf': 0.07875204777583832, 'min_impurity_decrease': 0.2370203653358774, 'max_features': 0.15564750512695946, 'subsample': 0.06558204446723843, 'dropout_rate': 0.8916844525346853, 'ccp_alpha': 0.08964581063266988}. Best is trial 802 with value: 0.8492679411913457.[0m
[32m[I 2022-04-21 20:37:50,762][0m Trial 924 finished with value: 0.8474047400680377 and parameters: {'loss': 'coxph', 'learning_rate': 0.00022160317139377953, 'n_estimators': 275, 'criterion': 'friedman_mse', 'min_samples_split': 2, 'min_samples_leaf': 1, 'min_weight_fraction_leaf': 0.08725731202640581, 'min_impurity_decrease': 0.21711268070752646, 'max_features': 0.10146877361250983, 'subsample': 0.05177314712872866, 'dropout_rate': 0.857063436916231, 'ccp_alpha': 0.017950417434929946}. Best is trial 802 with value: 0.8492679411913457.[0m
[32m[I 2022-04-21 20:37:55,796][0m Trial 925 finished with value: 0.8476984951185997 and parameters: {'loss': 'coxph', 'learning_rate': 0.00027670292203686215, 'n_estimators': 273, 'criterion': 'friedman_mse', 'min_samples_split': 2, 'min_samples_leaf': 1, 'min_weight_fraction_leaf': 0.08910679922034018, 'min_impurity_decrease': 0.23602355314562665, 'max_features': 0.15150506745040776, 'subsample': 0.048658526759456845, 'dropout_rate': 0.8549338009523278, 'ccp_alpha': 0.001443771349780419}. Best is trial 802 with value: 0.8492679411913457.[0m
[32m[I 2022-04-21 20:38:01,567][0m Trial 926 finished with value: 0.8475303763750489 and parameters: {'loss': 'coxph', 'learning_rate': 0.0003051398146206076, 'n_estimators': 278, 'criterion': 'friedman_mse', 'min_samples_split': 2, 'min_samples_leaf': 1, 'min_weight_fraction_leaf': 0.07277517863152538, 'min_impurity_decrease': 0.23462587638555288, 'max_features': 0.1363424398080923, 'subsample': 0.052223342176866756, 'dropout_rate': 0.8560641491029625, 'ccp_alpha': 0.0049496832016818525}. Best is trial 802 with value: 0.8492679411913457.[0m
[32m[I 2022-04-21 20:38:06,676][0m Trial 927 finished with value: 0.8463939578015083 and parameters: {'loss': 'coxph', 'learning_rate': 0.00021119256802633373, 'n_estimators': 282, 'criterion': 'friedman_mse', 'min_samples_split': 2, 'min_samples_leaf': 1, 'min_weight_fraction_leaf': 0.05999606260012723, 'min_impurity_decrease': 0.22234418350458499, 'max_features': 0.11509395864396672, 'subsample': 0.05273965630842978, 'dropout_rate': 0.8705606837891104, 'ccp_alpha': 0.057837805899814014}. Best is trial 802 with value: 0.8492679411913457.[0m
[32m[I 2022-04-21 20:38:11,682][0m Trial 928 finished with value: 0.8476959073884576 and parameters: {'loss': 'coxph', 'learning_rate': 0.00030033118342768047, 'n_estimators': 278, 'criterion': 'friedman_mse', 'min_samples_split': 2, 'min_samples_leaf': 1, 'min_weight_fraction_leaf': 0.07601929545677591, 'min_impurity_decrease': 0.24086052745447423, 'max_features': 0.1312743036555438, 'subsample': 0.050213164107361076, 'dropout_rate': 0.8419705066223606, 'ccp_alpha': 0.018850164893212867}. Best is trial 802 with value: 0.8492679411913457.[0m
[32m[I 2022-04-21 20:38:12,729][0m Trial 929 finished with value: 0.8402972958013416 and parameters: {'loss': 'coxph', 'learning_rate': 0.00029344532748152137, 'n_estimators': 106, 'criterion': 'friedman_mse', 'min_samples_split': 2, 'min_samples_leaf': 1, 'min_weight_fraction_leaf': 0.07401276554780845, 'min_impurity_decrease': 0.24519117499379572, 'max_features': 0.13219606215000307, 'subsample': 0.5553132204968735, 'dropout_rate': 0.8672038182520578, 'ccp_alpha': 0.018889560652044127}. Best is trial 802 with value: 0.8492679411913457.[0m
/media/san2_ssd/data/Workdir/survival/venv/lib/python3.8/site-packages/sksurv/ensemble/boosting.py:955: RuntimeWarning: divide by zero encountered in log
  time = numpy.log(time)
/media/san2_ssd/data/Workdir/survival/venv/lib/python3.8/site-packages/sksurv/ensemble/boosting.py:955: RuntimeWarning: divide by zero encountered in log
  time = numpy.log(time)
/media/san2_ssd/data/Workdir/survival/venv/lib/python3.8/site-packages/sksurv/ensemble/boosting.py:955: RuntimeWarning: divide by zero encountered in log
  time = numpy.log(time)
/media/san2_ssd/data/Workdir/survival/venv/lib/python3.8/site-packages/sksurv/ensemble/boosting.py:955: RuntimeWarning: divide by zero encountered in log
  time = numpy.log(time)
[32m[I 2022-04-21 20:38:13,719][0m Trial 930 finished with value: -0.465415256375411 and parameters: {'loss': 'squared', 'learning_rate': 0.0002085342221168887, 'n_estimators': 272, 'criterion': 'squared_error', 'min_samples_split': 2, 'min_samples_leaf': 1, 'min_weight_fraction_leaf': 0.062528416244322, 'min_impurity_decrease': 0.24574842771911393, 'max_features': 0.13722552308490302, 'subsample': 0.05823298412309238, 'dropout_rate': 0.8229647771123365, 'ccp_alpha': 0.0011289811185101646}. Best is trial 802 with value: 0.8492679411913457.[0m
[32m[I 2022-04-21 20:38:20,268][0m Trial 931 finished with value: 0.8470701828300318 and parameters: {'loss': 'coxph', 'learning_rate': 0.00027447737164888985, 'n_estimators': 287, 'criterion': 'friedman_mse', 'min_samples_split': 2, 'min_samples_leaf': 1, 'min_weight_fraction_leaf': 0.07180817584041596, 'min_impurity_decrease': 0.23712298910074722, 'max_features': 0.13991344735535033, 'subsample': 0.05172150974818482, 'dropout_rate': 0.8517869287824547, 'ccp_alpha': 0.00550172981122494}. Best is trial 802 with value: 0.8492679411913457.[0m
[32m[I 2022-04-21 20:38:26,693][0m Trial 932 finished with value: 0.8468171788628315 and parameters: {'loss': 'coxph', 'learning_rate': 0.0003301331681493099, 'n_estimators': 292, 'criterion': 'friedman_mse', 'min_samples_split': 2, 'min_samples_leaf': 1, 'min_weight_fraction_leaf': 0.08376699626380613, 'min_impurity_decrease': 0.2400020093664169, 'max_features': 0.16679892738038782, 'subsample': 0.06474950839755184, 'dropout_rate': 0.8597671098397881, 'ccp_alpha': 0.0018750632445129478}. Best is trial 802 with value: 0.8492679411913457.[0m
[32m[I 2022-04-21 20:38:32,248][0m Trial 933 finished with value: 0.8412973515566924 and parameters: {'loss': 'coxph', 'learning_rate': 0.00020820156081943072, 'n_estimators': 272, 'criterion': 'friedman_mse', 'min_samples_split': 2, 'min_samples_leaf': 1, 'min_weight_fraction_leaf': 0.07120485943383384, 'min_impurity_decrease': 0.2259794281216528, 'max_features': 0.13650603374678694, 'subsample': 0.4905297000479445, 'dropout_rate': 0.8440583336747096, 'ccp_alpha': 0.01618293684424174}. Best is trial 802 with value: 0.8492679411913457.[0m
[32m[I 2022-04-21 20:38:33,736][0m Trial 934 finished with value: 0.8488899900762709 and parameters: {'loss': 'coxph', 'learning_rate': 0.0002601552386888145, 'n_estimators': 130, 'criterion': 'friedman_mse', 'min_samples_split': 2, 'min_samples_leaf': 1, 'min_weight_fraction_leaf': 0.05823921425672962, 'min_impurity_decrease': 0.2530750599633932, 'max_features': 0.10506965169642918, 'subsample': 0.04463002063052444, 'dropout_rate': 0.8374544248930152, 'ccp_alpha': 0.0018968819380098256}. Best is trial 802 with value: 0.8492679411913457.[0m
[32m[I 2022-04-21 20:38:38,724][0m Trial 935 finished with value: 0.8497573035489246 and parameters: {'loss': 'coxph', 'learning_rate': 0.00033995758940316977, 'n_estimators': 259, 'criterion': 'friedman_mse', 'min_samples_split': 2, 'min_samples_leaf': 1, 'min_weight_fraction_leaf': 0.05186153197318359, 'min_impurity_decrease': 0.25534755583477253, 'max_features': 0.12119539925669612, 'subsample': 0.04662493655183525, 'dropout_rate': 0.840223517523193, 'ccp_alpha': 0.08419353011339853}. Best is trial 935 with value: 0.8497573035489246.[0m
[32m[I 2022-04-21 20:38:42,135][0m Trial 936 finished with value: 0.8468965085710194 and parameters: {'loss': 'coxph', 'learning_rate': 0.0003521198454201951, 'n_estimators': 107, 'criterion': 'friedman_mse', 'min_samples_split': 2, 'min_samples_leaf': 1, 'min_weight_fraction_leaf': 0.05552227080730352, 'min_impurity_decrease': 0.25394999087881215, 'max_features': 0.10788508612299369, 'subsample': 0.04101830606364679, 'dropout_rate': 0.7994837091766482, 'ccp_alpha': 0.0042769629529411015}. Best is trial 935 with value: 0.8497573035489246.[0m
[32m[I 2022-04-21 20:38:45,723][0m Trial 937 finished with value: 0.8428705058335698 and parameters: {'loss': 'coxph', 'learning_rate': 0.00035760055434795585, 'n_estimators': 110, 'criterion': 'absolute_error', 'min_samples_split': 2, 'min_samples_leaf': 1, 'min_weight_fraction_leaf': 0.034940985083985014, 'min_impurity_decrease': 0.2576150822593035, 'max_features': 0.0935756057960857, 'subsample': 0.017673779196457726, 'dropout_rate': 0.8391800837862665, 'ccp_alpha': 0.09967613710901765}. Best is trial 935 with value: 0.8497573035489246.[0m
[32m[I 2022-04-21 20:38:48,091][0m Trial 938 finished with value: 0.8478474658498973 and parameters: {'loss': 'coxph', 'learning_rate': 0.0004204804943152045, 'n_estimators': 136, 'criterion': 'friedman_mse', 'min_samples_split': 2, 'min_samples_leaf': 1, 'min_weight_fraction_leaf': 0.042886763946827625, 'min_impurity_decrease': 0.25181771502739164, 'max_features': 0.11875424509366062, 'subsample': 0.041766425854935896, 'dropout_rate': 0.8272955963225624, 'ccp_alpha': 0.004294284577810533}. Best is trial 935 with value: 0.8497573035489246.[0m
[32m[I 2022-04-21 20:38:50,119][0m Trial 939 finished with value: 0.8455526340362838 and parameters: {'loss': 'coxph', 'learning_rate': 0.0004034383393916945, 'n_estimators': 117, 'criterion': 'friedman_mse', 'min_samples_split': 2, 'min_samples_leaf': 1, 'min_weight_fraction_leaf': 0.029346908613024785, 'min_impurity_decrease': 0.25474229784217806, 'max_features': 0.10151614414282607, 'subsample': 0.02199226118912118, 'dropout_rate': 0.8122508097013164, 'ccp_alpha': 0.10376317486366109}. Best is trial 935 with value: 0.8497573035489246.[0m
[32m[I 2022-04-21 20:38:51,612][0m Trial 940 finished with value: 0.8482075230414747 and parameters: {'loss': 'coxph', 'learning_rate': 0.0004434717315658463, 'n_estimators': 133, 'criterion': 'friedman_mse', 'min_samples_split': 2, 'min_samples_leaf': 1, 'min_weight_fraction_leaf': 0.03885632773842095, 'min_impurity_decrease': 0.26170600183407433, 'max_features': 0.11959170881236152, 'subsample': 0.041992813426542416, 'dropout_rate': 0.8349453418324754, 'ccp_alpha': 0.10862058318495757}. Best is trial 935 with value: 0.8497573035489246.[0m
[32m[I 2022-04-21 20:38:53,667][0m Trial 941 finished with value: 0.8488503860121994 and parameters: {'loss': 'coxph', 'learning_rate': 0.0004627724367319943, 'n_estimators': 129, 'criterion': 'friedman_mse', 'min_samples_split': 2, 'min_samples_leaf': 1, 'min_weight_fraction_leaf': 0.04338805083872826, 'min_impurity_decrease': 0.2575358615566242, 'max_features': 0.11233196230745104, 'subsample': 0.02160419996096819, 'dropout_rate': 0.8332402738088929, 'ccp_alpha': 0.002663914939933609}. Best is trial 935 with value: 0.8497573035489246.[0m
[32m[I 2022-04-21 20:38:55,671][0m Trial 942 finished with value: 0.8485159634871892 and parameters: {'loss': 'coxph', 'learning_rate': 0.0004867781167087625, 'n_estimators': 128, 'criterion': 'friedman_mse', 'min_samples_split': 2, 'min_samples_leaf': 1, 'min_weight_fraction_leaf': 0.03149618093092036, 'min_impurity_decrease': 0.2556423602176209, 'max_features': 0.10955994564556851, 'subsample': 0.02275433390449662, 'dropout_rate': 0.8425387745014515, 'ccp_alpha': 0.00372033686774971}. Best is trial 935 with value: 0.8497573035489246.[0m
[32m[I 2022-04-21 20:38:57,958][0m Trial 943 finished with value: 0.65 and parameters: {'loss': 'coxph', 'learning_rate': 0.00047195760225324056, 'n_estimators': 129, 'criterion': 'friedman_mse', 'min_samples_split': 2, 'min_samples_leaf': 1, 'min_weight_fraction_leaf': 0.050773085224791306, 'min_impurity_decrease': 0.2570721501482301, 'max_features': 0.12694513004468322, 'subsample': 0.004060826293410577, 'dropout_rate': 0.8464839818281467, 'ccp_alpha': 0.09117954397318304}. Best is trial 935 with value: 0.8497573035489246.[0m
[32m[I 2022-04-21 20:39:00,232][0m Trial 944 finished with value: 0.65 and parameters: {'loss': 'coxph', 'learning_rate': 0.00048691336497120084, 'n_estimators': 127, 'criterion': 'friedman_mse', 'min_samples_split': 2, 'min_samples_leaf': 1, 'min_weight_fraction_leaf': 0.01815941886959776, 'min_impurity_decrease': 0.26047643315825886, 'max_features': 0.1190109487678528, 'subsample': 0.012381009098780482, 'dropout_rate': 0.8259171266407681, 'ccp_alpha': 0.09183967804096828}. Best is trial 935 with value: 0.8497573035489246.[0m
[32m[I 2022-04-21 20:39:02,771][0m Trial 945 finished with value: 0.8416049375254087 and parameters: {'loss': 'coxph', 'learning_rate': 0.00048502040352904087, 'n_estimators': 136, 'criterion': 'friedman_mse', 'min_samples_split': 2, 'min_samples_leaf': 1, 'min_weight_fraction_leaf': 0.026549177257285558, 'min_impurity_decrease': 0.26001968238488715, 'max_features': 0.10378563455384705, 'subsample': 0.020060044171168766, 'dropout_rate': 0.8174816704433018, 'ccp_alpha': 0.0016689406768655175}. Best is trial 935 with value: 0.8497573035489246.[0m
[32m[I 2022-04-21 20:39:05,045][0m Trial 946 finished with value: 0.65 and parameters: {'loss': 'coxph', 'learning_rate': 0.0004225243601366773, 'n_estimators': 127, 'criterion': 'friedman_mse', 'min_samples_split': 2, 'min_samples_leaf': 1, 'min_weight_fraction_leaf': 0.03522658705824766, 'min_impurity_decrease': 0.24897113960373418, 'max_features': 0.12335507682658593, 'subsample': 0.0015265387973103402, 'dropout_rate': 0.8299925881890082, 'ccp_alpha': 0.08772041476244441}. Best is trial 935 with value: 0.8497573035489246.[0m
[32m[I 2022-04-21 20:39:07,249][0m Trial 947 finished with value: 0.8400255157808832 and parameters: {'loss': 'coxph', 'learning_rate': 0.0005443152786297587, 'n_estimators': 123, 'criterion': 'friedman_mse', 'min_samples_split': 2, 'min_samples_leaf': 1, 'min_weight_fraction_leaf': 0.013652417170335662, 'min_impurity_decrease': 0.26131405478758024, 'max_features': 0.12036071453346336, 'subsample': 0.017756184481729425, 'dropout_rate': 0.8391007045127183, 'ccp_alpha': 0.10216644686144491}. Best is trial 935 with value: 0.8497573035489246.[0m
[32m[I 2022-04-21 20:39:09,021][0m Trial 948 finished with value: 0.65 and parameters: {'loss': 'coxph', 'learning_rate': 0.0004821442097841688, 'n_estimators': 134, 'criterion': 'friedman_mse', 'min_samples_split': 2, 'min_samples_leaf': 1, 'min_weight_fraction_leaf': 0.03945452741740515, 'min_impurity_decrease': 0.24303695195894165, 'max_features': 0.16870671070721005, 'subsample': 0.0019370704430092672, 'dropout_rate': 0.8420586119162825, 'ccp_alpha': 4.11320535463173}. Best is trial 935 with value: 0.8497573035489246.[0m
/media/san2_ssd/data/Workdir/survival/venv/lib/python3.8/site-packages/sksurv/ensemble/boosting.py:955: RuntimeWarning: divide by zero encountered in log
  time = numpy.log(time)
/media/san2_ssd/data/Workdir/survival/venv/lib/python3.8/site-packages/sksurv/ensemble/boosting.py:955: RuntimeWarning: divide by zero encountered in log
  time = numpy.log(time)
/media/san2_ssd/data/Workdir/survival/venv/lib/python3.8/site-packages/sksurv/ensemble/boosting.py:955: RuntimeWarning: divide by zero encountered in log
  time = numpy.log(time)
/media/san2_ssd/data/Workdir/survival/venv/lib/python3.8/site-packages/sksurv/ensemble/boosting.py:955: RuntimeWarning: divide by zero encountered in log
  time = numpy.log(time)
[32m[I 2022-04-21 20:39:09,348][0m Trial 949 finished with value: -0.46666222003274155 and parameters: {'loss': 'squared', 'learning_rate': 0.0003923489304670849, 'n_estimators': 125, 'criterion': 'friedman_mse', 'min_samples_split': 2, 'min_samples_leaf': 9, 'min_weight_fraction_leaf': 0.031882182103697594, 'min_impurity_decrease': 0.2711413092446991, 'max_features': 0.09516846367393608, 'subsample': 0.9240952541900396, 'dropout_rate': 0.8009709256563484, 'ccp_alpha': 0.08642358668945808}. Best is trial 935 with value: 0.8497573035489246.[0m
[32m[I 2022-04-21 20:39:11,100][0m Trial 950 finished with value: 0.8449693351215929 and parameters: {'loss': 'coxph', 'learning_rate': 0.00036062327905382694, 'n_estimators': 144, 'criterion': 'friedman_mse', 'min_samples_split': 2, 'min_samples_leaf': 1, 'min_weight_fraction_leaf': 0.044901450656370155, 'min_impurity_decrease': 0.24829402178066173, 'max_features': 0.14530942226592028, 'subsample': 0.028178538751648212, 'dropout_rate': 0.854137343317148, 'ccp_alpha': 0.001956228950582022}. Best is trial 935 with value: 0.8497573035489246.[0m
[32m[I 2022-04-21 20:39:12,434][0m Trial 951 finished with value: 0.8454393868748122 and parameters: {'loss': 'coxph', 'learning_rate': 0.0005159825933685766, 'n_estimators': 120, 'criterion': 'friedman_mse', 'min_samples_split': 2, 'min_samples_leaf': 1, 'min_weight_fraction_leaf': 0.04526742584493456, 'min_impurity_decrease': 0.2660497093578607, 'max_features': 0.08897670075578129, 'subsample': 0.028353565947099056, 'dropout_rate': 0.8356081179766119, 'ccp_alpha': 0.004372684648836278}. Best is trial 935 with value: 0.8497573035489246.[0m
[32m[I 2022-04-21 20:39:14,265][0m Trial 952 finished with value: 0.65 and parameters: {'loss': 'coxph', 'learning_rate': 0.00042654723925210955, 'n_estimators': 138, 'criterion': 'squared_error', 'min_samples_split': 2, 'min_samples_leaf': 1, 'min_weight_fraction_leaf': 0.02150311934055584, 'min_impurity_decrease': 0.2414697283134817, 'max_features': 0.11125204095759098, 'subsample': 0.0012239352896898092, 'dropout_rate': 0.8636899098481088, 'ccp_alpha': 0.13790640534212564}. Best is trial 935 with value: 0.8497573035489246.[0m
[32m[I 2022-04-21 20:39:16,701][0m Trial 953 finished with value: 0.8432872882790526 and parameters: {'loss': 'coxph', 'learning_rate': 0.0003451072161666885, 'n_estimators': 100, 'criterion': 'friedman_mse', 'min_samples_split': 2, 'min_samples_leaf': 1, 'min_weight_fraction_leaf': 0.035742944135756315, 'min_impurity_decrease': 0.22868132105322364, 'max_features': 0.14723772997533074, 'subsample': 0.025920582368165624, 'dropout_rate': 0.7865284916808889, 'ccp_alpha': 0.14769878656738167}. Best is trial 935 with value: 0.8497573035489246.[0m
[32m[I 2022-04-21 20:39:18,322][0m Trial 954 finished with value: 0.8451025985998198 and parameters: {'loss': 'coxph', 'learning_rate': 0.0005567372205185057, 'n_estimators': 132, 'criterion': 'friedman_mse', 'min_samples_split': 2, 'min_samples_leaf': 1, 'min_weight_fraction_leaf': 0.012706294910635449, 'min_impurity_decrease': 0.2569748458782432, 'max_features': 0.1244244517302411, 'subsample': 0.03323315153911858, 'dropout_rate': 0.8109163202368005, 'ccp_alpha': 0.09582923320323358}. Best is trial 935 with value: 0.8497573035489246.[0m
[32m[I 2022-04-21 20:39:19,626][0m Trial 955 finished with value: 0.8450475856038814 and parameters: {'loss': 'coxph', 'learning_rate': 0.00044421435834805697, 'n_estimators': 119, 'criterion': 'friedman_mse', 'min_samples_split': 2, 'min_samples_leaf': 1, 'min_weight_fraction_leaf': 0.0450869368141707, 'min_impurity_decrease': 0.23703846160901412, 'max_features': 0.10272013792664064, 'subsample': 0.03877622558171231, 'dropout_rate': 0.8261582176212697, 'ccp_alpha': 0.16372138443726697}. Best is trial 935 with value: 0.8497573035489246.[0m
[32m[I 2022-04-21 20:39:21,511][0m Trial 956 finished with value: 0.8417030613563024 and parameters: {'loss': 'coxph', 'learning_rate': 0.0003334380999922665, 'n_estimators': 137, 'criterion': 'friedman_mse', 'min_samples_split': 2, 'min_samples_leaf': 1, 'min_weight_fraction_leaf': 0.02570429880963551, 'min_impurity_decrease': 0.2332674369971015, 'max_features': 0.08012445325172556, 'subsample': 0.01890894466832097, 'dropout_rate': 0.8550465546623144, 'ccp_alpha': 0.0073588799117529835}. Best is trial 935 with value: 0.8497573035489246.[0m
[32m[I 2022-04-21 20:39:22,727][0m Trial 957 finished with value: 0.8410034207734969 and parameters: {'loss': 'coxph', 'learning_rate': 0.0006003020084771186, 'n_estimators': 128, 'criterion': 'friedman_mse', 'min_samples_split': 2, 'min_samples_leaf': 1, 'min_weight_fraction_leaf': 0.039725166912511115, 'min_impurity_decrease': 0.257763182368194, 'max_features': 0.16440914642049342, 'subsample': 0.3858267657457701, 'dropout_rate': 0.8873693738149236, 'ccp_alpha': 0.0960867968549857}. Best is trial 935 with value: 0.8497573035489246.[0m
[32m[I 2022-04-21 20:39:24,493][0m Trial 958 finished with value: 0.8474447973728566 and parameters: {'loss': 'coxph', 'learning_rate': 0.00034501825546852567, 'n_estimators': 122, 'criterion': 'friedman_mse', 'min_samples_split': 2, 'min_samples_leaf': 1, 'min_weight_fraction_leaf': 0.05168907723076144, 'min_impurity_decrease': 0.26641134895716545, 'max_features': 0.13915749926567178, 'subsample': 0.041747225946661394, 'dropout_rate': 0.8757577987574287, 'ccp_alpha': 0.1652646959173419}. Best is trial 935 with value: 0.8497573035489246.[0m
[32m[I 2022-04-21 20:39:26,481][0m Trial 959 finished with value: 0.65 and parameters: {'loss': 'coxph', 'learning_rate': 0.0003901879095645315, 'n_estimators': 119, 'criterion': 'absolute_error', 'min_samples_split': 2, 'min_samples_leaf': 1, 'min_weight_fraction_leaf': 0.04911511295493015, 'min_impurity_decrease': 0.26976040728492845, 'max_features': 0.14321633999550618, 'subsample': 0.0402501696868512, 'dropout_rate': 0.8763055396498567, 'ccp_alpha': 2.6409294643241092}. Best is trial 935 with value: 0.8497573035489246.[0m
