[32m[I 2022-04-21 11:37:39,913][0m Trial 64 finished with value: 0.8318450474400789 and parameters: {'splitter': 'best', 'min_samples_split': 0.18313450990312435, 'min_samples_leaf': 0.05475212595419982, 'min_weight_fraction_leaf': 0.18245487458526194, 'max_features': 0.7949313023503837}. Best is trial 21 with value: 0.837083811404636.[0m
[32m[I 2022-04-21 11:37:40,072][0m Trial 65 finished with value: 0.8251040446672375 and parameters: {'splitter': 'random', 'min_samples_split': 0.2050902413632582, 'min_samples_leaf': 0.11935747037014882, 'min_weight_fraction_leaf': 0.14847919391553566, 'max_features': 0.9995226788711534}. Best is trial 21 with value: 0.837083811404636.[0m
[32m[I 2022-04-21 11:37:40,222][0m Trial 66 finished with value: 0.65 and parameters: {'splitter': 'best', 'min_samples_split': 0.3566349907496251, 'min_samples_leaf': 0.016993189874646278, 'min_weight_fraction_leaf': 0.28702514616801844, 'max_features': 0.4468007009598382}. Best is trial 21 with value: 0.837083811404636.[0m
[32m[I 2022-04-21 11:37:40,378][0m Trial 67 finished with value: 0.8316149506675705 and parameters: {'splitter': 'best', 'min_samples_split': 0.26955154918337876, 'min_samples_leaf': 0.07395313117015748, 'min_weight_fraction_leaf': 0.10016952375702563, 'max_features': 0.6555265397502053}. Best is trial 21 with value: 0.837083811404636.[0m
[32m[I 2022-04-21 11:37:40,500][0m Trial 68 finished with value: 0.8323728162455613 and parameters: {'splitter': 'random', 'min_samples_split': 0.2523115486424933, 'min_samples_leaf': 0.08976151620224371, 'min_weight_fraction_leaf': 0.03753496047933997, 'max_features': 0.8611648969941196}. Best is trial 21 with value: 0.837083811404636.[0m
[32m[I 2022-04-21 11:37:40,573][0m Trial 69 finished with value: 0.65 and parameters: {'splitter': 'best', 'min_samples_split': 0.4069861075289437, 'min_samples_leaf': 0.49959178718281394, 'min_weight_fraction_leaf': 0.07063723556914422, 'max_features': 0.9700341631490591}. Best is trial 21 with value: 0.837083811404636.[0m
[32m[I 2022-04-21 11:37:40,637][0m Trial 70 finished with value: 0.8332692532720088 and parameters: {'splitter': 'best', 'min_samples_split': 0.03460622192291388, 'min_samples_leaf': 0.17044297160775426, 'min_weight_fraction_leaf': 0.05268962692649419, 'max_features': 0.9037431634458097}. Best is trial 21 with value: 0.837083811404636.[0m
[32m[I 2022-04-21 11:37:40,696][0m Trial 71 finished with value: 0.8363914938304864 and parameters: {'splitter': 'best', 'min_samples_split': 0.2086366806569209, 'min_samples_leaf': 0.06305609793426492, 'min_weight_fraction_leaf': 0.03279380715223913, 'max_features': 0.8421901395885988}. Best is trial 21 with value: 0.837083811404636.[0m
[32m[I 2022-04-21 11:37:40,752][0m Trial 72 finished with value: 0.8180388147131256 and parameters: {'splitter': 'best', 'min_samples_split': 0.21554996703635565, 'min_samples_leaf': 0.06230253091724102, 'min_weight_fraction_leaf': 0.01528604534955124, 'max_features': 0.5656778837009631}. Best is trial 21 with value: 0.837083811404636.[0m
[32m[I 2022-04-21 11:37:40,816][0m Trial 73 finished with value: 0.8348082114676366 and parameters: {'splitter': 'best', 'min_samples_split': 0.31519232657352286, 'min_samples_leaf': 0.04101319812600618, 'min_weight_fraction_leaf': 0.032734610023464145, 'max_features': 0.9349918516076989}. Best is trial 21 with value: 0.837083811404636.[0m
/media/san2_ssd/data/Workdir/survival/utils.py:305: RuntimeWarning: invalid value encountered in true_divide
  pdfs = np.gradient(1-survs,axis=1)/norms
[32m[I 2022-04-21 11:37:40,941][0m Trial 74 finished with value: 0.8314343095518417 and parameters: {'splitter': 'best', 'min_samples_split': 0.1733731783740694, 'min_samples_leaf': 0.001406686231527102, 'min_weight_fraction_leaf': 0.001533226849199501, 'max_features': 0.7704887547866649}. Best is trial 21 with value: 0.837083811404636.[0m
[32m[I 2022-04-21 11:37:41,113][0m Trial 75 finished with value: 0.8342605834042434 and parameters: {'splitter': 'best', 'min_samples_split': 0.21818999638229006, 'min_samples_leaf': 0.07866324041126135, 'min_weight_fraction_leaf': 0.04721451000473187, 'max_features': 0.8698457187372926}. Best is trial 21 with value: 0.837083811404636.[0m
[32m[I 2022-04-21 11:37:41,292][0m Trial 76 finished with value: 0.8343194359041494 and parameters: {'splitter': 'best', 'min_samples_split': 0.131933708934249, 'min_samples_leaf': 0.035274570670456605, 'min_weight_fraction_leaf': 0.12110331430921442, 'max_features': 0.8363824867690001}. Best is trial 21 with value: 0.837083811404636.[0m
[32m[I 2022-04-21 11:37:41,376][0m Trial 77 finished with value: 0.8323728162455613 and parameters: {'splitter': 'random', 'min_samples_split': 0.2773342341214466, 'min_samples_leaf': 0.016301603563061918, 'min_weight_fraction_leaf': 0.08832632459248799, 'max_features': 0.9763116701721797}. Best is trial 21 with value: 0.837083811404636.[0m
[32m[I 2022-04-21 11:37:41,449][0m Trial 78 finished with value: 0.8304220807990864 and parameters: {'splitter': 'best', 'min_samples_split': 0.3797039428487888, 'min_samples_leaf': 0.05975245916332957, 'min_weight_fraction_leaf': 0.06343146110917008, 'max_features': 0.902213769570875}. Best is trial 21 with value: 0.837083811404636.[0m
[32m[I 2022-04-21 11:37:41,570][0m Trial 79 finished with value: 0.833505206223952 and parameters: {'splitter': 'best', 'min_samples_split': 0.30345687719416814, 'min_samples_leaf': 0.0968873889390611, 'min_weight_fraction_leaf': 0.037898313312274674, 'max_features': 0.9329572218790777}. Best is trial 21 with value: 0.837083811404636.[0m
[32m[I 2022-04-21 11:37:41,641][0m Trial 80 finished with value: 0.8325183999057713 and parameters: {'splitter': 'random', 'min_samples_split': 0.22351417880483673, 'min_samples_leaf': 0.11633832667294544, 'min_weight_fraction_leaf': 0.07328916157603324, 'max_features': 0.8805137840972557}. Best is trial 21 with value: 0.837083811404636.[0m
[32m[I 2022-04-21 11:37:41,710][0m Trial 81 finished with value: 0.8363914938304864 and parameters: {'splitter': 'best', 'min_samples_split': 0.22804871051439632, 'min_samples_leaf': 0.06811881923159707, 'min_weight_fraction_leaf': 0.029831392534476198, 'max_features': 0.8466463520291386}. Best is trial 21 with value: 0.837083811404636.[0m
[32m[I 2022-04-21 11:37:41,864][0m Trial 82 finished with value: 0.833988554983085 and parameters: {'splitter': 'best', 'min_samples_split': 0.19928513927517183, 'min_samples_leaf': 0.08849324616206716, 'min_weight_fraction_leaf': 0.014165942595510574, 'max_features': 0.8243953459396522}. Best is trial 21 with value: 0.837083811404636.[0m
[32m[I 2022-04-21 11:37:42,094][0m Trial 83 finished with value: 0.8363268199688415 and parameters: {'splitter': 'best', 'min_samples_split': 0.24922485982356202, 'min_samples_leaf': 0.051686956795012715, 'min_weight_fraction_leaf': 0.05409683715178676, 'max_features': 0.9749642868143269}. Best is trial 21 with value: 0.837083811404636.[0m
[32m[I 2022-04-21 11:37:42,303][0m Trial 84 finished with value: 0.8318450474400789 and parameters: {'splitter': 'best', 'min_samples_split': 0.22812103852816012, 'min_samples_leaf': 0.27657103791158216, 'min_weight_fraction_leaf': 0.03476062108763066, 'max_features': 0.907590624871455}. Best is trial 21 with value: 0.837083811404636.[0m
[32m[I 2022-04-21 11:37:42,469][0m Trial 85 finished with value: 0.8332692532720088 and parameters: {'splitter': 'best', 'min_samples_split': 0.34708635492632395, 'min_samples_leaf': 0.14823386293610594, 'min_weight_fraction_leaf': 0.024964803655958656, 'max_features': 0.8422718592416538}. Best is trial 21 with value: 0.837083811404636.[0m
[32m[I 2022-04-21 11:37:42,628][0m Trial 86 finished with value: 0.8342186517555936 and parameters: {'splitter': 'best', 'min_samples_split': 0.18702257611061035, 'min_samples_leaf': 0.06734142552768785, 'min_weight_fraction_leaf': 0.11071868695869373, 'max_features': 0.9444066586912122}. Best is trial 21 with value: 0.837083811404636.[0m
[32m[I 2022-04-21 11:37:42,751][0m Trial 87 finished with value: 0.8318869790887286 and parameters: {'splitter': 'best', 'min_samples_split': 0.1606721245252162, 'min_samples_leaf': 0.01808480980465023, 'min_weight_fraction_leaf': 0.08172312183419309, 'max_features': 0.7677445691265714}. Best is trial 21 with value: 0.837083811404636.[0m
[32m[I 2022-04-21 11:37:42,938][0m Trial 88 finished with value: 0.8287186985059606 and parameters: {'splitter': 'best', 'min_samples_split': 0.49778831696523285, 'min_samples_leaf': 0.07319142080856475, 'min_weight_fraction_leaf': 0.0601387349817405, 'max_features': 0.8821554863412805}. Best is trial 21 with value: 0.837083811404636.[0m
[32m[I 2022-04-21 11:37:43,044][0m Trial 89 finished with value: 0.8366717314767083 and parameters: {'splitter': 'best', 'min_samples_split': 0.336248445322705, 'min_samples_leaf': 0.10808227735224546, 'min_weight_fraction_leaf': 0.010087170863789588, 'max_features': 0.8093644369535872}. Best is trial 21 with value: 0.837083811404636.[0m
[32m[I 2022-04-21 11:37:43,195][0m Trial 90 finished with value: 0.8320350511466381 and parameters: {'splitter': 'random', 'min_samples_split': 0.3348515919180769, 'min_samples_leaf': 0.1312539835954899, 'min_weight_fraction_leaf': 0.011659478773996148, 'max_features': 0.804982480205095}. Best is trial 21 with value: 0.837083811404636.[0m
[32m[I 2022-04-21 11:37:43,300][0m Trial 91 finished with value: 0.8329615567419848 and parameters: {'splitter': 'best', 'min_samples_split': 0.3639225058330981, 'min_samples_leaf': 0.10304681453621202, 'min_weight_fraction_leaf': 0.04332427736531691, 'max_features': 0.9232472593530926}. Best is trial 21 with value: 0.837083811404636.[0m
[32m[I 2022-04-21 11:37:43,411][0m Trial 92 finished with value: 0.8367527493778185 and parameters: {'splitter': 'best', 'min_samples_split': 0.326809223228881, 'min_samples_leaf': 0.04231154430790665, 'min_weight_fraction_leaf': 0.010044841943240616, 'max_features': 0.984494521034672}. Best is trial 21 with value: 0.837083811404636.[0m
[32m[I 2022-04-21 11:37:43,615][0m Trial 93 finished with value: 0.8366420850753015 and parameters: {'splitter': 'best', 'min_samples_split': 0.28830747201369916, 'min_samples_leaf': 0.03992479265898848, 'min_weight_fraction_leaf': 0.0031927263224356857, 'max_features': 0.9826625924044179}. Best is trial 21 with value: 0.837083811404636.[0m
[32m[I 2022-04-21 11:37:43,850][0m Trial 94 finished with value: 0.8344489474910419 and parameters: {'splitter': 'best', 'min_samples_split': 0.32386057516988265, 'min_samples_leaf': 0.043423674622142736, 'min_weight_fraction_leaf': 0.00023494757202135487, 'max_features': 0.9834540770839596}. Best is trial 21 with value: 0.837083811404636.[0m
[32m[I 2022-04-21 11:37:44,091][0m Trial 95 finished with value: 0.836837262490117 and parameters: {'splitter': 'best', 'min_samples_split': 0.341625452742304, 'min_samples_leaf': 0.03209100532410171, 'min_weight_fraction_leaf': 0.012610795821551238, 'max_features': 0.9938437242959705}. Best is trial 21 with value: 0.837083811404636.[0m
[32m[I 2022-04-21 11:37:44,210][0m Trial 96 finished with value: 0.836837262490117 and parameters: {'splitter': 'best', 'min_samples_split': 0.3458890626093412, 'min_samples_leaf': 0.03312461922277227, 'min_weight_fraction_leaf': 0.0208113221633294, 'max_features': 0.9547025214106748}. Best is trial 21 with value: 0.837083811404636.[0m
[32m[I 2022-04-21 11:37:44,338][0m Trial 97 finished with value: 0.836837262490117 and parameters: {'splitter': 'best', 'min_samples_split': 0.34486689708813034, 'min_samples_leaf': 0.029990066491250165, 'min_weight_fraction_leaf': 0.016461233155294262, 'max_features': 0.9432052193382398}. Best is trial 21 with value: 0.837083811404636.[0m
[32m[I 2022-04-21 11:37:44,523][0m Trial 98 finished with value: 0.8366717314767083 and parameters: {'splitter': 'best', 'min_samples_split': 0.34841729704249597, 'min_samples_leaf': 0.030560886491330652, 'min_weight_fraction_leaf': 0.01988223460769983, 'max_features': 0.9532918487037598}. Best is trial 21 with value: 0.837083811404636.[0m
[32m[I 2022-04-21 11:37:44,628][0m Trial 99 finished with value: 0.8294029951776167 and parameters: {'splitter': 'best', 'min_samples_split': 0.3941310936827841, 'min_samples_leaf': 0.026165956653200716, 'min_weight_fraction_leaf': 0.02087821395615714, 'max_features': 0.9571339146998514}. Best is trial 21 with value: 0.837083811404636.[0m
[32m[I 2022-04-21 11:37:44,754][0m Trial 100 finished with value: 0.8255642736990714 and parameters: {'splitter': 'best', 'min_samples_split': 0.37340985417793593, 'min_samples_leaf': 0.011039250958841309, 'min_weight_fraction_leaf': 0.02133771185042565, 'max_features': 0.33642557199195045}. Best is trial 21 with value: 0.837083811404636.[0m
[32m[I 2022-04-21 11:37:44,848][0m Trial 101 finished with value: 0.836837262490117 and parameters: {'splitter': 'best', 'min_samples_split': 0.34449860466082816, 'min_samples_leaf': 0.03175169225875157, 'min_weight_fraction_leaf': 0.011155052861622036, 'max_features': 0.9582931122241629}. Best is trial 21 with value: 0.837083811404636.[0m
[32m[I 2022-04-21 11:37:44,989][0m Trial 102 finished with value: 0.8348741151925644 and parameters: {'splitter': 'best', 'min_samples_split': 0.34353867552497314, 'min_samples_leaf': 0.025305700164147495, 'min_weight_fraction_leaf': 0.01098252319711022, 'max_features': 0.9541924735568112}. Best is trial 21 with value: 0.837083811404636.[0m
[32m[I 2022-04-21 11:37:45,122][0m Trial 103 finished with value: 0.8353797750782629 and parameters: {'splitter': 'best', 'min_samples_split': 0.35998298420902153, 'min_samples_leaf': 0.013668218003103017, 'min_weight_fraction_leaf': 0.05085231315128293, 'max_features': 0.9932410795878502}. Best is trial 21 with value: 0.837083811404636.[0m
[32m[I 2022-04-21 11:37:45,236][0m Trial 104 finished with value: 0.8348082114676366 and parameters: {'splitter': 'best', 'min_samples_split': 0.316850838506922, 'min_samples_leaf': 0.04851039882479059, 'min_weight_fraction_leaf': 0.011745849723395176, 'max_features': 0.9292766722453824}. Best is trial 21 with value: 0.837083811404636.[0m
[32m[I 2022-04-21 11:37:45,345][0m Trial 105 finished with value: 0.65 and parameters: {'splitter': 'best', 'min_samples_split': 0.3890566218858251, 'min_samples_leaf': 0.363709774371966, 'min_weight_fraction_leaf': 0.40952436271939474, 'max_features': 0.8989629670953385}. Best is trial 21 with value: 0.837083811404636.[0m
[32m[I 2022-04-21 11:37:45,455][0m Trial 106 finished with value: 0.8367527493778185 and parameters: {'splitter': 'best', 'min_samples_split': 0.3290038394855038, 'min_samples_leaf': 0.03489570744953857, 'min_weight_fraction_leaf': 0.028044193630483764, 'max_features': 0.9646630062138449}. Best is trial 21 with value: 0.837083811404636.[0m
[32m[I 2022-04-21 11:37:45,577][0m Trial 107 finished with value: 0.8356426064051348 and parameters: {'splitter': 'random', 'min_samples_split': 0.31127217286590253, 'min_samples_leaf': 0.0032745459680906877, 'min_weight_fraction_leaf': 0.025517480215483244, 'max_features': 0.9649055110392118}. Best is trial 21 with value: 0.837083811404636.[0m
[32m[I 2022-04-21 11:37:45,696][0m Trial 108 finished with value: 0.821547241131856 and parameters: {'splitter': 'best', 'min_samples_split': 0.32816997448476937, 'min_samples_leaf': 0.037894863854218745, 'min_weight_fraction_leaf': 0.04083669379128193, 'max_features': 0.011139985649658124}. Best is trial 21 with value: 0.837083811404636.[0m
[32m[I 2022-04-21 11:37:45,815][0m Trial 109 finished with value: 0.8329615567419848 and parameters: {'splitter': 'best', 'min_samples_split': 0.36630686295762815, 'min_samples_leaf': 0.054713054890339, 'min_weight_fraction_leaf': 0.030463986327214535, 'max_features': 0.9227582961523194}. Best is trial 21 with value: 0.837083811404636.[0m
[32m[I 2022-04-21 11:37:45,931][0m Trial 110 finished with value: 0.8366717314767083 and parameters: {'splitter': 'best', 'min_samples_split': 0.3479229886306333, 'min_samples_leaf': 0.020307820518624172, 'min_weight_fraction_leaf': 0.05465453226528323, 'max_features': 0.9852272770404888}. Best is trial 21 with value: 0.837083811404636.[0m
[32m[I 2022-04-21 11:37:46,041][0m Trial 111 finished with value: 0.8347180703991794 and parameters: {'splitter': 'best', 'min_samples_split': 0.29612704217255037, 'min_samples_leaf': 0.030903806423009172, 'min_weight_fraction_leaf': 0.042849369038808115, 'max_features': 0.9415190247453806}. Best is trial 21 with value: 0.837083811404636.[0m
[32m[I 2022-04-21 11:37:46,157][0m Trial 112 finished with value: 0.65 and parameters: {'splitter': 'best', 'min_samples_split': 0.3352235637751323, 'min_samples_leaf': 0.04528899232718625, 'min_weight_fraction_leaf': 0.49239101376185224, 'max_features': 0.9997091276422023}. Best is trial 21 with value: 0.837083811404636.[0m
[32m[I 2022-04-21 11:37:46,266][0m Trial 113 finished with value: 0.8347245653772368 and parameters: {'splitter': 'best', 'min_samples_split': 0.3213484720684271, 'min_samples_leaf': 0.08565456891116671, 'min_weight_fraction_leaf': 0.009046309707282466, 'max_features': 0.913557077370308}. Best is trial 21 with value: 0.837083811404636.[0m
[32m[I 2022-04-21 11:37:46,425][0m Trial 114 finished with value: 0.8353797750782629 and parameters: {'splitter': 'best', 'min_samples_split': 0.3549165773700905, 'min_samples_leaf': 0.03637360507214627, 'min_weight_fraction_leaf': 0.021882703186934253, 'max_features': 0.9586786801417404}. Best is trial 21 with value: 0.837083811404636.[0m
[32m[I 2022-04-21 11:37:46,655][0m Trial 115 finished with value: 0.8318450474400789 and parameters: {'splitter': 'best', 'min_samples_split': 0.30660127545786303, 'min_samples_leaf': 0.1864850905036074, 'min_weight_fraction_leaf': 0.005100449090201714, 'max_features': 0.8719497099802109}. Best is trial 21 with value: 0.837083811404636.[0m
[32m[I 2022-04-21 11:37:46,875][0m Trial 116 finished with value: 0.8304220807990864 and parameters: {'splitter': 'best', 'min_samples_split': 0.38146109908240416, 'min_samples_leaf': 0.010856876362929434, 'min_weight_fraction_leaf': 0.00019360542505566028, 'max_features': 0.9026459962937614}. Best is trial 21 with value: 0.837083811404636.[0m
[32m[I 2022-04-21 11:37:47,038][0m Trial 117 finished with value: 0.8293093791159827 and parameters: {'splitter': 'random', 'min_samples_split': 0.33660410979615024, 'min_samples_leaf': 0.05609922100028325, 'min_weight_fraction_leaf': 0.21006652602338846, 'max_features': 0.9702875133746731}. Best is trial 21 with value: 0.837083811404636.[0m
[32m[I 2022-04-21 11:37:47,205][0m Trial 118 finished with value: 0.8366717314767083 and parameters: {'splitter': 'best', 'min_samples_split': 0.3522532948215013, 'min_samples_leaf': 0.029865928400484347, 'min_weight_fraction_leaf': 0.026895686323147268, 'max_features': 0.9495445418292878}. Best is trial 21 with value: 0.837083811404636.[0m
[32m[I 2022-04-21 11:37:47,326][0m Trial 119 finished with value: 0.8294029951776167 and parameters: {'splitter': 'best', 'min_samples_split': 0.40597091273887576, 'min_samples_leaf': 0.031895495233203404, 'min_weight_fraction_leaf': 0.06776904252433494, 'max_features': 0.9336576916582319}. Best is trial 21 with value: 0.837083811404636.[0m
[32m[I 2022-04-21 11:37:47,441][0m Trial 120 finished with value: 0.8294029951776167 and parameters: {'splitter': 'best', 'min_samples_split': 0.42176781223868776, 'min_samples_leaf': 0.0021469088840196937, 'min_weight_fraction_leaf': 0.03182099118613518, 'max_features': 0.8897349404945947}. Best is trial 21 with value: 0.837083811404636.[0m
[32m[I 2022-04-21 11:37:47,649][0m Trial 121 finished with value: 0.6656426807671247 and parameters: {'splitter': 'best', 'min_samples_split': 0.3278055415218745, 'min_samples_leaf': 0.07946236528286453, 'min_weight_fraction_leaf': 0.34363277001117587, 'max_features': 0.9858080656365519}. Best is trial 21 with value: 0.837083811404636.[0m
[32m[I 2022-04-21 11:37:47,763][0m Trial 122 finished with value: 0.836837262490117 and parameters: {'splitter': 'best', 'min_samples_split': 0.34348517315277616, 'min_samples_leaf': 0.01921269308373963, 'min_weight_fraction_leaf': 0.05443704673548432, 'max_features': 0.9737790982934607}. Best is trial 21 with value: 0.837083811404636.[0m
[32m[I 2022-04-21 11:37:47,857][0m Trial 123 finished with value: 0.8353797750782629 and parameters: {'splitter': 'best', 'min_samples_split': 0.35865085733059066, 'min_samples_leaf': 0.012421726191896736, 'min_weight_fraction_leaf': 0.04382279124830222, 'max_features': 0.9632265002802058}. Best is trial 21 with value: 0.837083811404636.[0m
[32m[I 2022-04-21 11:37:47,973][0m Trial 124 finished with value: 0.836837262490117 and parameters: {'splitter': 'best', 'min_samples_split': 0.34485092593204236, 'min_samples_leaf': 0.018956499491786717, 'min_weight_fraction_leaf': 0.05662881516160313, 'max_features': 0.970095494629878}. Best is trial 21 with value: 0.837083811404636.[0m
[32m[I 2022-04-21 11:37:48,095][0m Trial 125 finished with value: 0.8329615567419848 and parameters: {'splitter': 'best', 'min_samples_split': 0.371461130281926, 'min_samples_leaf': 0.04766598986584997, 'min_weight_fraction_leaf': 0.0630721148546332, 'max_features': 0.997988449754957}. Best is trial 21 with value: 0.837083811404636.[0m
[32m[I 2022-04-21 11:37:48,136][0m Trial 126 finished with value: 0.836837262490117 and parameters: {'splitter': 'best', 'min_samples_split': 0.34188739601535895, 'min_samples_leaf': 0.02100222722646558, 'min_weight_fraction_leaf': 0.05383315212870027, 'max_features': 0.9313888562214823}. Best is trial 21 with value: 0.837083811404636.[0m
