[32m[I 2022-04-22 01:22:09,967][0m Trial 916 finished with value: 0.6813897441514895 and parameters: {'loss': 'coxph', 'learning_rate': 1.4562430995861762e-05, 'n_estimators': 227, 'criterion': 'friedman_mse', 'min_samples_split': 6, 'min_samples_leaf': 6, 'min_weight_fraction_leaf': 0.23802199390432136, 'min_impurity_decrease': 0.03853107458086623, 'max_features': 0.7263883554989458, 'subsample': 0.17654644541070025, 'dropout_rate': 0.7114413242726552, 'ccp_alpha': 0.15226653262778622}. Best is trial 187 with value: 0.6933481836305168.[0m
[32m[I 2022-04-22 01:22:19,937][0m Trial 917 finished with value: 0.685775057576868 and parameters: {'loss': 'coxph', 'learning_rate': 1.1367996207482351e-05, 'n_estimators': 250, 'criterion': 'friedman_mse', 'min_samples_split': 6, 'min_samples_leaf': 6, 'min_weight_fraction_leaf': 0.25289235818281114, 'min_impurity_decrease': 0.09288465268662086, 'max_features': 0.5683407849690404, 'subsample': 0.2505258318733113, 'dropout_rate': 0.8708930207372568, 'ccp_alpha': 0.002164721553207974}. Best is trial 187 with value: 0.6933481836305168.[0m
/media/san2_ssd/data/Workdir/survival/venv/lib/python3.8/site-packages/sksurv/ensemble/boosting.py:955: RuntimeWarning: divide by zero encountered in log
  time = numpy.log(time)
/media/san2_ssd/data/Workdir/survival/venv/lib/python3.8/site-packages/sksurv/ensemble/boosting.py:955: RuntimeWarning: divide by zero encountered in log
  time = numpy.log(time)
/media/san2_ssd/data/Workdir/survival/venv/lib/python3.8/site-packages/sksurv/ensemble/boosting.py:955: RuntimeWarning: divide by zero encountered in log
  time = numpy.log(time)
/media/san2_ssd/data/Workdir/survival/venv/lib/python3.8/site-packages/sksurv/ensemble/boosting.py:955: RuntimeWarning: divide by zero encountered in log
  time = numpy.log(time)
[32m[I 2022-04-22 01:22:20,552][0m Trial 918 finished with value: -0.7260203013923309 and parameters: {'loss': 'squared', 'learning_rate': 2.1115628803363762e-05, 'n_estimators': 199, 'criterion': 'friedman_mse', 'min_samples_split': 6, 'min_samples_leaf': 3, 'min_weight_fraction_leaf': 0.2984769595246525, 'min_impurity_decrease': 0.05053607322609613, 'max_features': 0.6356972886525143, 'subsample': 0.23480791959202124, 'dropout_rate': 0.8832240615097507, 'ccp_alpha': 1.3061921209060752}. Best is trial 187 with value: 0.6933481836305168.[0m
[32m[I 2022-04-22 01:22:28,573][0m Trial 919 finished with value: 0.6750401118276708 and parameters: {'loss': 'coxph', 'learning_rate': 9.330371034527408e-06, 'n_estimators': 235, 'criterion': 'friedman_mse', 'min_samples_split': 6, 'min_samples_leaf': 5, 'min_weight_fraction_leaf': 0.25641807274283085, 'min_impurity_decrease': 0.7792091339405312, 'max_features': 0.7475696552644369, 'subsample': 0.20786025625432217, 'dropout_rate': 0.7999197524300842, 'ccp_alpha': 0.20823667869348192}. Best is trial 187 with value: 0.6933481836305168.[0m
[32m[I 2022-04-22 01:22:35,895][0m Trial 920 finished with value: 0.6846667991110442 and parameters: {'loss': 'coxph', 'learning_rate': 2.916989817167029e-05, 'n_estimators': 218, 'criterion': 'squared_error', 'min_samples_split': 6, 'min_samples_leaf': 3, 'min_weight_fraction_leaf': 0.28433662042916896, 'min_impurity_decrease': 0.034323971398806025, 'max_features': 0.7052255943739985, 'subsample': 0.2575935644413393, 'dropout_rate': 0.73614262957309, 'ccp_alpha': 0.09873103103249713}. Best is trial 187 with value: 0.6933481836305168.[0m
[32m[I 2022-04-22 01:22:42,213][0m Trial 921 finished with value: 0.6635807151369472 and parameters: {'loss': 'coxph', 'learning_rate': 1.1838983527979861e-05, 'n_estimators': 174, 'criterion': 'squared_error', 'min_samples_split': 6, 'min_samples_leaf': 7, 'min_weight_fraction_leaf': 0.2677975536694668, 'min_impurity_decrease': 0.07177055254109445, 'max_features': 0.7773610617026454, 'subsample': 0.19108964154201663, 'dropout_rate': 0.6991482000069199, 'ccp_alpha': 0.3341797461778617}. Best is trial 187 with value: 0.6933481836305168.[0m
[32m[I 2022-04-22 01:22:47,347][0m Trial 922 finished with value: 0.6821204698289056 and parameters: {'loss': 'coxph', 'learning_rate': 1.647456074218349e-05, 'n_estimators': 206, 'criterion': 'squared_error', 'min_samples_split': 6, 'min_samples_leaf': 1, 'min_weight_fraction_leaf': 0.24114653060665225, 'min_impurity_decrease': 0.12404456263329594, 'max_features': 0.7208061219836981, 'subsample': 0.1599230565063327, 'dropout_rate': 0.7724905292531772, 'ccp_alpha': 0.16850103273657374}. Best is trial 187 with value: 0.6933481836305168.[0m
[32m[I 2022-04-22 01:22:53,843][0m Trial 923 finished with value: 0.6889406899734671 and parameters: {'loss': 'coxph', 'learning_rate': 2.3505997733274793e-05, 'n_estimators': 257, 'criterion': 'friedman_mse', 'min_samples_split': 6, 'min_samples_leaf': 2, 'min_weight_fraction_leaf': 0.2773294912255213, 'min_impurity_decrease': 0.056450042403074864, 'max_features': 0.7768015370816292, 'subsample': 0.22686240417055398, 'dropout_rate': 0.8602800657852123, 'ccp_alpha': 0.08970394973219345}. Best is trial 187 with value: 0.6933481836305168.[0m
[32m[I 2022-04-22 01:22:58,942][0m Trial 924 finished with value: 0.6652535759877798 and parameters: {'loss': 'coxph', 'learning_rate': 1.460029558922437e-05, 'n_estimators': 243, 'criterion': 'squared_error', 'min_samples_split': 6, 'min_samples_leaf': 6, 'min_weight_fraction_leaf': 0.237213979844501, 'min_impurity_decrease': 0.030324110377361588, 'max_features': 0.6819254950761938, 'subsample': 0.2120551904603443, 'dropout_rate': 0.9634706972526673, 'ccp_alpha': 0.24470853272648974}. Best is trial 187 with value: 0.6933481836305168.[0m
[32m[I 2022-04-22 01:23:04,226][0m Trial 925 finished with value: 0.6841532614568392 and parameters: {'loss': 'coxph', 'learning_rate': 8.744908044006816e-06, 'n_estimators': 230, 'criterion': 'squared_error', 'min_samples_split': 6, 'min_samples_leaf': 3, 'min_weight_fraction_leaf': 0.25286522257119437, 'min_impurity_decrease': 0.08306309038674117, 'max_features': 0.46285085854540364, 'subsample': 0.2597771303554125, 'dropout_rate': 0.7962419338421108, 'ccp_alpha': 0.08178236226604009}. Best is trial 187 with value: 0.6933481836305168.[0m
[32m[I 2022-04-22 01:23:13,020][0m Trial 926 finished with value: 0.6787693023562275 and parameters: {'loss': 'coxph', 'learning_rate': 1.8370574334778905e-05, 'n_estimators': 221, 'criterion': 'squared_error', 'min_samples_split': 6, 'min_samples_leaf': 2, 'min_weight_fraction_leaf': 0.24675612859511137, 'min_impurity_decrease': 0.020214342398439687, 'max_features': 0.605016713855749, 'subsample': 0.22747954449065727, 'dropout_rate': 0.6850851424649016, 'ccp_alpha': 0.18930704104320964}. Best is trial 187 with value: 0.6933481836305168.[0m
[32m[I 2022-04-22 01:23:16,025][0m Trial 927 finished with value: 0.6855996495794844 and parameters: {'loss': 'coxph', 'learning_rate': 1.1301710342829871e-05, 'n_estimators': 209, 'criterion': 'squared_error', 'min_samples_split': 5, 'min_samples_leaf': 6, 'min_weight_fraction_leaf': 0.2781083851124224, 'min_impurity_decrease': 0.041797693617565745, 'max_features': 0.7425427486559212, 'subsample': 0.23977051937188223, 'dropout_rate': 0.8931747085894312, 'ccp_alpha': 0.09334008835866232}. Best is trial 187 with value: 0.6933481836305168.[0m
[32m[I 2022-04-22 01:23:21,447][0m Trial 928 finished with value: 0.6641121828103248 and parameters: {'loss': 'coxph', 'learning_rate': 2.7711355104463934e-05, 'n_estimators': 237, 'criterion': 'friedman_mse', 'min_samples_split': 6, 'min_samples_leaf': 5, 'min_weight_fraction_leaf': 0.26036291072693313, 'min_impurity_decrease': 0.10781137267098378, 'max_features': 0.7624908708105506, 'subsample': 0.19847723086902308, 'dropout_rate': 0.7516970949574501, 'ccp_alpha': 0.32772897514948496}. Best is trial 187 with value: 0.6933481836305168.[0m
[32m[I 2022-04-22 01:23:25,859][0m Trial 929 finished with value: 0.6841064009645963 and parameters: {'loss': 'coxph', 'learning_rate': 8.071151319221298e-06, 'n_estimators': 196, 'criterion': 'squared_error', 'min_samples_split': 10, 'min_samples_leaf': 5, 'min_weight_fraction_leaf': 0.26688436217143136, 'min_impurity_decrease': 0.06133787104500968, 'max_features': 0.6464496276571764, 'subsample': 0.17496515057807144, 'dropout_rate': 0.8126561899457606, 'ccp_alpha': 0.09172594670198964}. Best is trial 187 with value: 0.6933481836305168.[0m
[32m[I 2022-04-22 01:23:32,393][0m Trial 930 finished with value: 0.6908489109876967 and parameters: {'loss': 'coxph', 'learning_rate': 1.41506878179473e-05, 'n_estimators': 255, 'criterion': 'squared_error', 'min_samples_split': 6, 'min_samples_leaf': 6, 'min_weight_fraction_leaf': 0.2392951412879133, 'min_impurity_decrease': 0.02319705885302135, 'max_features': 0.7034538581864332, 'subsample': 0.24895824466616068, 'dropout_rate': 0.8528554913916824, 'ccp_alpha': 0.003121428659665665}. Best is trial 187 with value: 0.6933481836305168.[0m
[32m[I 2022-04-22 01:23:38,755][0m Trial 931 finished with value: 0.6702621455932636 and parameters: {'loss': 'coxph', 'learning_rate': 2.1556476071498915e-05, 'n_estimators': 260, 'criterion': 'squared_error', 'min_samples_split': 7, 'min_samples_leaf': 6, 'min_weight_fraction_leaf': 0.2368131971664706, 'min_impurity_decrease': 0.021860660302981418, 'max_features': 0.6939998043232704, 'subsample': 0.26296969870125436, 'dropout_rate': 0.8623152673278354, 'ccp_alpha': 0.1927842471035278}. Best is trial 187 with value: 0.6933481836305168.[0m
[32m[I 2022-04-22 01:23:49,169][0m Trial 932 finished with value: 0.6890194381981207 and parameters: {'loss': 'coxph', 'learning_rate': 0.007374210973258996, 'n_estimators': 253, 'criterion': 'squared_error', 'min_samples_split': 7, 'min_samples_leaf': 6, 'min_weight_fraction_leaf': 0.23988921873711672, 'min_impurity_decrease': 0.016434483006758177, 'max_features': 0.6790404658407757, 'subsample': 0.2595255784917772, 'dropout_rate': 0.8449925800061135, 'ccp_alpha': 0.0019900602432679367}. Best is trial 187 with value: 0.6933481836305168.[0m
[32m[I 2022-04-22 01:23:56,145][0m Trial 933 finished with value: 0.6653139449477008 and parameters: {'loss': 'coxph', 'learning_rate': 9.118845970903967e-06, 'n_estimators': 260, 'criterion': 'squared_error', 'min_samples_split': 6, 'min_samples_leaf': 6, 'min_weight_fraction_leaf': 0.23543820904264845, 'min_impurity_decrease': 0.022102428993391335, 'max_features': 0.7064857300929482, 'subsample': 0.245127239184354, 'dropout_rate': 0.8741742849606728, 'ccp_alpha': 0.24438808222603414}. Best is trial 187 with value: 0.6933481836305168.[0m
[32m[I 2022-04-22 01:23:59,757][0m Trial 934 finished with value: 0.6660557321295059 and parameters: {'loss': 'coxph', 'learning_rate': 3.063020609239354e-05, 'n_estimators': 246, 'criterion': 'squared_error', 'min_samples_split': 7, 'min_samples_leaf': 6, 'min_weight_fraction_leaf': 0.10256763204546165, 'min_impurity_decrease': 0.286270087841334, 'max_features': 0.6515126713211878, 'subsample': 0.2470493236082384, 'dropout_rate': 0.9109882466513061, 'ccp_alpha': 0.15539368405535922}. Best is trial 187 with value: 0.6933481836305168.[0m
[32m[I 2022-04-22 01:24:06,359][0m Trial 935 finished with value: 0.6881123999991232 and parameters: {'loss': 'coxph', 'learning_rate': 2.551198512660914e-06, 'n_estimators': 249, 'criterion': 'squared_error', 'min_samples_split': 7, 'min_samples_leaf': 6, 'min_weight_fraction_leaf': 0.2485040019660695, 'min_impurity_decrease': 0.030131983604431364, 'max_features': 0.6595301880964627, 'subsample': 0.26441816636808335, 'dropout_rate': 0.8311840338683013, 'ccp_alpha': 0.09533720849516356}. Best is trial 187 with value: 0.6933481836305168.[0m
/media/san2_ssd/data/Workdir/survival/venv/lib/python3.8/site-packages/sksurv/ensemble/boosting.py:955: RuntimeWarning: divide by zero encountered in log
  time = numpy.log(time)
/media/san2_ssd/data/Workdir/survival/venv/lib/python3.8/site-packages/sksurv/ensemble/boosting.py:955: RuntimeWarning: divide by zero encountered in log
  time = numpy.log(time)
/media/san2_ssd/data/Workdir/survival/venv/lib/python3.8/site-packages/sksurv/ensemble/boosting.py:955: RuntimeWarning: divide by zero encountered in log
  time = numpy.log(time)
/media/san2_ssd/data/Workdir/survival/venv/lib/python3.8/site-packages/sksurv/ensemble/boosting.py:955: RuntimeWarning: divide by zero encountered in log
  time = numpy.log(time)
[32m[I 2022-04-22 01:24:07,635][0m Trial 936 finished with value: -0.7302422424469823 and parameters: {'loss': 'squared', 'learning_rate': 1.746005434680179e-05, 'n_estimators': 239, 'criterion': 'squared_error', 'min_samples_split': 5, 'min_samples_leaf': 6, 'min_weight_fraction_leaf': 0.25270187231625957, 'min_impurity_decrease': 0.019686836065483753, 'max_features': 0.6986801234982636, 'subsample': 0.26705078097628127, 'dropout_rate': 0.8524438165584558, 'ccp_alpha': 0.0016967695912864789}. Best is trial 187 with value: 0.6933481836305168.[0m
[32m[I 2022-04-22 01:24:11,840][0m Trial 937 finished with value: 0.5 and parameters: {'loss': 'coxph', 'learning_rate': 1.3023951639424173e-05, 'n_estimators': 261, 'criterion': 'squared_error', 'min_samples_split': 7, 'min_samples_leaf': 6, 'min_weight_fraction_leaf': 0.23737360911860791, 'min_impurity_decrease': 0.03797188425220549, 'max_features': 0.5136068153661675, 'subsample': 0.2372040777323706, 'dropout_rate': 0.8821626043001719, 'ccp_alpha': 3.9962662096474437}. Best is trial 187 with value: 0.6933481836305168.[0m
[32m[I 2022-04-22 01:24:19,216][0m Trial 938 finished with value: 0.5934149392682608 and parameters: {'loss': 'coxph', 'learning_rate': 2.210987301898049e-05, 'n_estimators': 247, 'criterion': 'squared_error', 'min_samples_split': 7, 'min_samples_leaf': 6, 'min_weight_fraction_leaf': 0.2444768645166133, 'min_impurity_decrease': 0.018768992928703425, 'max_features': 0.6811190218124488, 'subsample': 0.2262576228787493, 'dropout_rate': 0.8374200527729011, 'ccp_alpha': 0.4767527921583031}. Best is trial 187 with value: 0.6933481836305168.[0m
[32m[I 2022-04-22 01:24:25,251][0m Trial 939 finished with value: 0.6635807151369472 and parameters: {'loss': 'coxph', 'learning_rate': 1.0412735162715595e-05, 'n_estimators': 259, 'criterion': 'squared_error', 'min_samples_split': 6, 'min_samples_leaf': 7, 'min_weight_fraction_leaf': 0.2507467820530882, 'min_impurity_decrease': 0.0010986311778676452, 'max_features': 0.720078989077943, 'subsample': 0.26757761314514206, 'dropout_rate': 0.8622212733880878, 'ccp_alpha': 0.3068459593920053}. Best is trial 187 with value: 0.6933481836305168.[0m
[32m[I 2022-04-22 01:24:32,082][0m Trial 940 finished with value: 0.6819870654398523 and parameters: {'loss': 'coxph', 'learning_rate': 3.0946911764691984e-05, 'n_estimators': 236, 'criterion': 'squared_error', 'min_samples_split': 7, 'min_samples_leaf': 6, 'min_weight_fraction_leaf': 0.23474609086402834, 'min_impurity_decrease': 0.03782827714293411, 'max_features': 0.6748564385891805, 'subsample': 0.2440409183048059, 'dropout_rate': 0.816406744028619, 'ccp_alpha': 0.17527859333768306}. Best is trial 187 with value: 0.6933481836305168.[0m
[32m[I 2022-04-22 01:24:38,042][0m Trial 941 finished with value: 0.6878777208981363 and parameters: {'loss': 'coxph', 'learning_rate': 1.3503208218910237e-05, 'n_estimators': 225, 'criterion': 'squared_error', 'min_samples_split': 7, 'min_samples_leaf': 6, 'min_weight_fraction_leaf': 0.25819937359025125, 'min_impurity_decrease': 0.0017308917469492091, 'max_features': 0.6247394856549592, 'subsample': 0.21835106331137524, 'dropout_rate': 0.8836877692524805, 'ccp_alpha': 0.1293645551733682}. Best is trial 187 with value: 0.6933481836305168.[0m
[32m[I 2022-04-22 01:24:40,912][0m Trial 942 finished with value: 0.6899716884696909 and parameters: {'loss': 'coxph', 'learning_rate': 1.766099584371455e-05, 'n_estimators': 250, 'criterion': 'squared_error', 'min_samples_split': 7, 'min_samples_leaf': 5, 'min_weight_fraction_leaf': 0.24429474620425948, 'min_impurity_decrease': 0.04177416527028734, 'max_features': 0.7106414270574035, 'subsample': 0.26909270337020164, 'dropout_rate': 0.9296276663735176, 'ccp_alpha': 0.09423149590514948}. Best is trial 187 with value: 0.6933481836305168.[0m
[32m[I 2022-04-22 01:24:44,443][0m Trial 943 finished with value: 0.689082789986681 and parameters: {'loss': 'coxph', 'learning_rate': 7.562334220655819e-06, 'n_estimators': 232, 'criterion': 'squared_error', 'min_samples_split': 7, 'min_samples_leaf': 1, 'min_weight_fraction_leaf': 0.23544410592295634, 'min_impurity_decrease': 0.0715493213200983, 'max_features': 0.6659818818687904, 'subsample': 0.24343156289955328, 'dropout_rate': 0.8463425341748544, 'ccp_alpha': 0.00204449516148493}. Best is trial 187 with value: 0.6933481836305168.[0m
[32m[I 2022-04-22 01:24:47,229][0m Trial 944 finished with value: 0.6648185145580262 and parameters: {'loss': 'coxph', 'learning_rate': 3.0025175457109634e-05, 'n_estimators': 238, 'criterion': 'squared_error', 'min_samples_split': 4, 'min_samples_leaf': 6, 'min_weight_fraction_leaf': 0.2618492403522587, 'min_impurity_decrease': 0.020729271136338177, 'max_features': 0.7306334752896789, 'subsample': 0.22978343683593855, 'dropout_rate': 0.9069159905348536, 'ccp_alpha': 0.25094063278466405}. Best is trial 187 with value: 0.6933481836305168.[0m
[32m[I 2022-04-22 01:24:52,897][0m Trial 945 finished with value: 0.5 and parameters: {'loss': 'coxph', 'learning_rate': 4.557943150557737e-06, 'n_estimators': 227, 'criterion': 'squared_error', 'min_samples_split': 7, 'min_samples_leaf': 7, 'min_weight_fraction_leaf': 0.24924235303794637, 'min_impurity_decrease': 0.046397818388710474, 'max_features': 0.7009888416271731, 'subsample': 0.26365392732315535, 'dropout_rate': 0.8293363658628533, 'ccp_alpha': 0.7536087243648274}. Best is trial 187 with value: 0.6933481836305168.[0m
[32m[I 2022-04-22 01:25:00,646][0m Trial 946 finished with value: 0.6377489970187712 and parameters: {'loss': 'coxph', 'learning_rate': 1.4606277016725927e-06, 'n_estimators': 260, 'criterion': 'squared_error', 'min_samples_split': 6, 'min_samples_leaf': 6, 'min_weight_fraction_leaf': 0.25918686848094236, 'min_impurity_decrease': 0.0332847546295404, 'max_features': 0.7278747449246992, 'subsample': 0.21939624412714803, 'dropout_rate': 0.8648603242731032, 'ccp_alpha': 0.394910198856985}. Best is trial 187 with value: 0.6933481836305168.[0m
[32m[I 2022-04-22 01:25:07,643][0m Trial 947 finished with value: 0.6814592022530455 and parameters: {'loss': 'coxph', 'learning_rate': 9.968524390393569e-06, 'n_estimators': 245, 'criterion': 'squared_error', 'min_samples_split': 7, 'min_samples_leaf': 5, 'min_weight_fraction_leaf': 0.23468570114524082, 'min_impurity_decrease': 0.061634519117350704, 'max_features': 0.6893475895616958, 'subsample': 0.24711624632630952, 'dropout_rate': 0.8437915554057449, 'ccp_alpha': 0.16915722874678815}. Best is trial 187 with value: 0.6933481836305168.[0m
[32m[I 2022-04-22 01:25:12,839][0m Trial 948 finished with value: 0.6873617938582433 and parameters: {'loss': 'coxph', 'learning_rate': 2.10894458724578e-05, 'n_estimators': 259, 'criterion': 'squared_error', 'min_samples_split': 7, 'min_samples_leaf': 2, 'min_weight_fraction_leaf': 0.24772253483208653, 'min_impurity_decrease': 0.002134451317022181, 'max_features': 0.5883474919768888, 'subsample': 0.21021128533171857, 'dropout_rate': 0.8198469817581302, 'ccp_alpha': 0.08307149152492455}. Best is trial 187 with value: 0.6933481836305168.[0m
[32m[I 2022-04-22 01:25:16,234][0m Trial 949 finished with value: 0.6636900948801576 and parameters: {'loss': 'coxph', 'learning_rate': 1.5494850950997327e-05, 'n_estimators': 223, 'criterion': 'squared_error', 'min_samples_split': 6, 'min_samples_leaf': 4, 'min_weight_fraction_leaf': 0.26590604927954564, 'min_impurity_decrease': 0.019527929423670556, 'max_features': 0.6326185604716585, 'subsample': 0.2396809000492997, 'dropout_rate': 0.8633149687601699, 'ccp_alpha': 0.25865631066876854}. Best is trial 187 with value: 0.6933481836305168.[0m
[32m[I 2022-04-22 01:25:23,431][0m Trial 950 finished with value: 0.6908284257321384 and parameters: {'loss': 'coxph', 'learning_rate': 2.591303487409412e-05, 'n_estimators': 243, 'criterion': 'squared_error', 'min_samples_split': 7, 'min_samples_leaf': 5, 'min_weight_fraction_leaf': 0.23889451486391014, 'min_impurity_decrease': 0.09083839119084944, 'max_features': 0.772275148436787, 'subsample': 0.26233183129901794, 'dropout_rate': 0.670761171836449, 'ccp_alpha': 0.08957289422217536}. Best is trial 187 with value: 0.6933481836305168.[0m
[32m[I 2022-04-22 01:25:28,552][0m Trial 951 finished with value: 0.5217151934164563 and parameters: {'loss': 'coxph', 'learning_rate': 3.023704025362529e-05, 'n_estimators': 246, 'criterion': 'squared_error', 'min_samples_split': 7, 'min_samples_leaf': 5, 'min_weight_fraction_leaf': 0.234139223171526, 'min_impurity_decrease': 0.12405265613156963, 'max_features': 0.6633487288725181, 'subsample': 0.26918193479649266, 'dropout_rate': 0.6775338423770672, 'ccp_alpha': 0.5868063477968876}. Best is trial 187 with value: 0.6933481836305168.[0m
[32m[I 2022-04-22 01:25:39,149][0m Trial 952 finished with value: 0.6449850903649714 and parameters: {'loss': 'coxph', 'learning_rate': 2.324403705829547e-05, 'n_estimators': 260, 'criterion': 'squared_error', 'min_samples_split': 7, 'min_samples_leaf': 5, 'min_weight_fraction_leaf': 0.2387950792453018, 'min_impurity_decrease': 0.10596208220334882, 'max_features': 0.787376747775992, 'subsample': 0.2654455992400115, 'dropout_rate': 0.671364735833372, 'ccp_alpha': 0.3697915185638681}. Best is trial 187 with value: 0.6933481836305168.[0m
