[32m[I 2022-04-22 01:10:03,855][0m Trial 768 finished with value: 0.6870166409489883 and parameters: {'loss': 'coxph', 'learning_rate': 1.6124461287052078e-05, 'n_estimators': 204, 'criterion': 'squared_error', 'min_samples_split': 7, 'min_samples_leaf': 4, 'min_weight_fraction_leaf': 0.28557649221368664, 'min_impurity_decrease': 0.0074025063412416015, 'max_features': 0.7059553184922855, 'subsample': 0.20767045278121418, 'dropout_rate': 0.7594899473949346, 'ccp_alpha': 0.009861233909802931}. Best is trial 187 with value: 0.6933481836305168.[0m
[32m[I 2022-04-22 01:10:10,620][0m Trial 769 finished with value: 0.6870747673132241 and parameters: {'loss': 'coxph', 'learning_rate': 1.3131514940138803e-05, 'n_estimators': 233, 'criterion': 'squared_error', 'min_samples_split': 7, 'min_samples_leaf': 4, 'min_weight_fraction_leaf': 0.30392637304385706, 'min_impurity_decrease': 0.012779054308536176, 'max_features': 0.7443654761755392, 'subsample': 0.19529400325731502, 'dropout_rate': 0.7432302747465023, 'ccp_alpha': 0.004583168086359751}. Best is trial 187 with value: 0.6933481836305168.[0m
[32m[I 2022-04-22 01:10:15,456][0m Trial 770 finished with value: 0.6900399785479991 and parameters: {'loss': 'coxph', 'learning_rate': 1.1680014667028209e-05, 'n_estimators': 216, 'criterion': 'squared_error', 'min_samples_split': 7, 'min_samples_leaf': 4, 'min_weight_fraction_leaf': 0.2728156731402503, 'min_impurity_decrease': 0.0035457678682855286, 'max_features': 0.7268473684302402, 'subsample': 0.2204510027550583, 'dropout_rate': 0.8463187073026627, 'ccp_alpha': 0.002143691864656766}. Best is trial 187 with value: 0.6933481836305168.[0m
[32m[I 2022-04-22 01:10:21,278][0m Trial 771 finished with value: 0.6911056492261798 and parameters: {'loss': 'coxph', 'learning_rate': 2.4934841287758403e-05, 'n_estimators': 216, 'criterion': 'absolute_error', 'min_samples_split': 7, 'min_samples_leaf': 4, 'min_weight_fraction_leaf': 0.26299560463337546, 'min_impurity_decrease': 0.005744857437719363, 'max_features': 0.7244268120734719, 'subsample': 0.21492299747494237, 'dropout_rate': 0.78494724081691, 'ccp_alpha': 0.002795181578449678}. Best is trial 187 with value: 0.6933481836305168.[0m
[32m[I 2022-04-22 01:10:26,409][0m Trial 772 finished with value: 0.6716125765076718 and parameters: {'loss': 'coxph', 'learning_rate': 1.0914846974326168e-05, 'n_estimators': 208, 'criterion': 'absolute_error', 'min_samples_split': 7, 'min_samples_leaf': 4, 'min_weight_fraction_leaf': 0.27725138865702814, 'min_impurity_decrease': 0.0024781725932524292, 'max_features': 0.7207706156817204, 'subsample': 0.19737243072525784, 'dropout_rate': 0.8443951896170656, 'ccp_alpha': 0.16633814187222162}. Best is trial 187 with value: 0.6933481836305168.[0m
[32m[I 2022-04-22 01:10:30,335][0m Trial 773 finished with value: 0.6752406773811723 and parameters: {'loss': 'coxph', 'learning_rate': 1.3236951261230234e-05, 'n_estimators': 197, 'criterion': 'absolute_error', 'min_samples_split': 7, 'min_samples_leaf': 3, 'min_weight_fraction_leaf': 0.29429597420652276, 'min_impurity_decrease': 0.005144348991585168, 'max_features': 0.6926500893518492, 'subsample': 0.1703661462265108, 'dropout_rate': 0.7824032726298504, 'ccp_alpha': 0.14142714453219699}. Best is trial 187 with value: 0.6933481836305168.[0m
[32m[I 2022-04-22 01:10:36,432][0m Trial 774 finished with value: 0.689974213346363 and parameters: {'loss': 'coxph', 'learning_rate': 6.548097290297815e-06, 'n_estimators': 222, 'criterion': 'absolute_error', 'min_samples_split': 8, 'min_samples_leaf': 4, 'min_weight_fraction_leaf': 0.28703811780978483, 'min_impurity_decrease': 0.003429032367635129, 'max_features': 0.705349118197786, 'subsample': 0.21799310937876584, 'dropout_rate': 0.8289011474942034, 'ccp_alpha': 0.001250959062476003}. Best is trial 187 with value: 0.6933481836305168.[0m
[32m[I 2022-04-22 01:10:42,661][0m Trial 775 finished with value: 0.6778344278274062 and parameters: {'loss': 'coxph', 'learning_rate': 6.782365345263e-06, 'n_estimators': 218, 'criterion': 'absolute_error', 'min_samples_split': 9, 'min_samples_leaf': 4, 'min_weight_fraction_leaf': 0.3154667768865121, 'min_impurity_decrease': 0.006223951311162358, 'max_features': 0.7374641430165583, 'subsample': 0.18154337500078388, 'dropout_rate': 0.7883711643013436, 'ccp_alpha': 0.06907610776771474}. Best is trial 187 with value: 0.6933481836305168.[0m
[32m[I 2022-04-22 01:10:45,710][0m Trial 776 finished with value: 0.6871855099399775 and parameters: {'loss': 'coxph', 'learning_rate': 1.0174718891118258e-05, 'n_estimators': 223, 'criterion': 'absolute_error', 'min_samples_split': 9, 'min_samples_leaf': 4, 'min_weight_fraction_leaf': 0.27686882852173794, 'min_impurity_decrease': 0.0016655792464047546, 'max_features': 0.7090375633719957, 'subsample': 0.2038345277960807, 'dropout_rate': 0.86612006430312, 'ccp_alpha': 0.08948342429083819}. Best is trial 187 with value: 0.6933481836305168.[0m
[32m[I 2022-04-22 01:10:48,630][0m Trial 777 finished with value: 0.6824257482808254 and parameters: {'loss': 'coxph', 'learning_rate': 4.3361975314691814e-06, 'n_estimators': 201, 'criterion': 'absolute_error', 'min_samples_split': 10, 'min_samples_leaf': 3, 'min_weight_fraction_leaf': 0.26931469665940655, 'min_impurity_decrease': 0.0030336806882369158, 'max_features': 0.7219564393682455, 'subsample': 0.2135443861172493, 'dropout_rate': 0.8192843982812594, 'ccp_alpha': 0.09705450805261254}. Best is trial 187 with value: 0.6933481836305168.[0m
[32m[I 2022-04-22 01:10:52,231][0m Trial 778 finished with value: 0.6847588858705541 and parameters: {'loss': 'coxph', 'learning_rate': 8.735177038159472e-06, 'n_estimators': 226, 'criterion': 'absolute_error', 'min_samples_split': 8, 'min_samples_leaf': 4, 'min_weight_fraction_leaf': 0.3006802007871723, 'min_impurity_decrease': 0.002180543153129634, 'max_features': 0.7177452305827741, 'subsample': 0.21062408272959593, 'dropout_rate': 0.8175823083145222, 'ccp_alpha': 0.008336151262711172}. Best is trial 187 with value: 0.6933481836305168.[0m
[32m[I 2022-04-22 01:10:55,305][0m Trial 779 finished with value: 0.6857226952627649 and parameters: {'loss': 'coxph', 'learning_rate': 1.172246364714165e-05, 'n_estimators': 209, 'criterion': 'squared_error', 'min_samples_split': 8, 'min_samples_leaf': 4, 'min_weight_fraction_leaf': 0.285458170525039, 'min_impurity_decrease': 0.01852787201314974, 'max_features': 0.6970148392477726, 'subsample': 0.22232240522797866, 'dropout_rate': 0.8031068354449993, 'ccp_alpha': 0.003030578732258843}. Best is trial 187 with value: 0.6933481836305168.[0m
[32m[I 2022-04-22 01:10:59,859][0m Trial 780 finished with value: 0.6789866816347018 and parameters: {'loss': 'coxph', 'learning_rate': 1.4831911804535403e-05, 'n_estimators': 217, 'criterion': 'friedman_mse', 'min_samples_split': 8, 'min_samples_leaf': 4, 'min_weight_fraction_leaf': 0.275636165404418, 'min_impurity_decrease': 0.020922529679397915, 'max_features': 0.7263477973053997, 'subsample': 0.19157693136110873, 'dropout_rate': 0.8340091266221876, 'ccp_alpha': 0.17506453916270548}. Best is trial 187 with value: 0.6933481836305168.[0m
[32m[I 2022-04-22 01:11:05,106][0m Trial 781 finished with value: 0.5 and parameters: {'loss': 'coxph', 'learning_rate': 1.757036275561716e-05, 'n_estimators': 242, 'criterion': 'absolute_error', 'min_samples_split': 8, 'min_samples_leaf': 4, 'min_weight_fraction_leaf': 0.2690144716834532, 'min_impurity_decrease': 0.5372767885518444, 'max_features': 0.7505202524335887, 'subsample': 0.1832565610377674, 'dropout_rate': 0.8574104437384371, 'ccp_alpha': 0.1682086214395181}. Best is trial 187 with value: 0.6933481836305168.[0m
/media/san2_ssd/data/Workdir/survival/venv/lib/python3.8/site-packages/sksurv/ensemble/boosting.py:955: RuntimeWarning: divide by zero encountered in log
  time = numpy.log(time)
/media/san2_ssd/data/Workdir/survival/venv/lib/python3.8/site-packages/sksurv/ensemble/boosting.py:955: RuntimeWarning: divide by zero encountered in log
  time = numpy.log(time)
/media/san2_ssd/data/Workdir/survival/venv/lib/python3.8/site-packages/sksurv/ensemble/boosting.py:955: RuntimeWarning: divide by zero encountered in log
  time = numpy.log(time)
/media/san2_ssd/data/Workdir/survival/venv/lib/python3.8/site-packages/sksurv/ensemble/boosting.py:955: RuntimeWarning: divide by zero encountered in log
  time = numpy.log(time)
[32m[I 2022-04-22 01:11:06,501][0m Trial 782 finished with value: -0.7 and parameters: {'loss': 'squared', 'learning_rate': 6.4198124993513514e-06, 'n_estimators': 224, 'criterion': 'absolute_error', 'min_samples_split': 9, 'min_samples_leaf': 4, 'min_weight_fraction_leaf': 0.2842124423420365, 'min_impurity_decrease': 0.0013527339956372064, 'max_features': 0.7281967303972773, 'subsample': 0.22641579137036558, 'dropout_rate': 0.8296653304924315, 'ccp_alpha': 3.833440101986753}. Best is trial 187 with value: 0.6933481836305168.[0m
[32m[I 2022-04-22 01:11:11,100][0m Trial 783 finished with value: 0.6890643316024774 and parameters: {'loss': 'coxph', 'learning_rate': 3.79545229176798e-06, 'n_estimators': 229, 'criterion': 'friedman_mse', 'min_samples_split': 9, 'min_samples_leaf': 5, 'min_weight_fraction_leaf': 0.2868930280102498, 'min_impurity_decrease': 0.015900157710620047, 'max_features': 0.6965398107262267, 'subsample': 0.21963421024369673, 'dropout_rate': 0.8961797738260613, 'ccp_alpha': 0.00734061670397495}. Best is trial 187 with value: 0.6933481836305168.[0m
[32m[I 2022-04-22 01:11:14,521][0m Trial 784 finished with value: 0.6842866510464258 and parameters: {'loss': 'coxph', 'learning_rate': 5.390210796892681e-06, 'n_estimators': 210, 'criterion': 'absolute_error', 'min_samples_split': 8, 'min_samples_leaf': 4, 'min_weight_fraction_leaf': 0.2780935793369907, 'min_impurity_decrease': 0.01708491734305837, 'max_features': 0.749136370973107, 'subsample': 0.1620724776192518, 'dropout_rate': 0.7408259824772745, 'ccp_alpha': 0.10098751004327253}. Best is trial 187 with value: 0.6933481836305168.[0m
[32m[I 2022-04-22 01:11:17,534][0m Trial 785 finished with value: 0.6201853856810399 and parameters: {'loss': 'coxph', 'learning_rate': 1.7784608674325316e-05, 'n_estimators': 191, 'criterion': 'absolute_error', 'min_samples_split': 8, 'min_samples_leaf': 3, 'min_weight_fraction_leaf': 0.2729029183645709, 'min_impurity_decrease': 0.00130735076578814, 'max_features': 0.709316086967708, 'subsample': 0.21978185337716907, 'dropout_rate': 0.7999296039461576, 'ccp_alpha': 0.2292335062614172}. Best is trial 187 with value: 0.6933481836305168.[0m
[32m[I 2022-04-22 01:11:21,326][0m Trial 786 finished with value: 0.6751312976379618 and parameters: {'loss': 'coxph', 'learning_rate': 1.945513112256294e-05, 'n_estimators': 218, 'criterion': 'absolute_error', 'min_samples_split': 9, 'min_samples_leaf': 4, 'min_weight_fraction_leaf': 0.3023466409006582, 'min_impurity_decrease': 0.0019028436101872423, 'max_features': 0.7389489177183622, 'subsample': 0.19941333247948506, 'dropout_rate': 0.8129251205301767, 'ccp_alpha': 0.0955024709045294}. Best is trial 187 with value: 0.6933481836305168.[0m
[32m[I 2022-04-22 01:11:30,986][0m Trial 787 finished with value: 0.5 and parameters: {'loss': 'coxph', 'learning_rate': 1.180234641861002e-05, 'n_estimators': 235, 'criterion': 'absolute_error', 'min_samples_split': 6, 'min_samples_leaf': 4, 'min_weight_fraction_leaf': 0.26628601268959373, 'min_impurity_decrease': 0.023645888102522786, 'max_features': 0.6812077078423195, 'subsample': 0.22196905527641608, 'dropout_rate': 0.7263091868401671, 'ccp_alpha': 1.8797845776513302}. Best is trial 187 with value: 0.6933481836305168.[0m
[32m[I 2022-04-22 01:11:33,839][0m Trial 788 finished with value: 0.688298639240274 and parameters: {'loss': 'coxph', 'learning_rate': 1.3547768364551173e-05, 'n_estimators': 211, 'criterion': 'absolute_error', 'min_samples_split': 5, 'min_samples_leaf': 3, 'min_weight_fraction_leaf': 0.2930658950746284, 'min_impurity_decrease': 0.02223627751644513, 'max_features': 0.7508315356017449, 'subsample': 0.23024445390162085, 'dropout_rate': 0.8805876916897357, 'ccp_alpha': 0.00520916444658813}. Best is trial 187 with value: 0.6933481836305168.[0m
[32m[I 2022-04-22 01:11:36,921][0m Trial 789 finished with value: 0.686426181348774 and parameters: {'loss': 'coxph', 'learning_rate': 8.191259512923368e-06, 'n_estimators': 205, 'criterion': 'absolute_error', 'min_samples_split': 8, 'min_samples_leaf': 4, 'min_weight_fraction_leaf': 0.2910479732670449, 'min_impurity_decrease': 0.02232980199716082, 'max_features': 0.7259018854514113, 'subsample': 0.18414859855111573, 'dropout_rate': 0.7751284831793746, 'ccp_alpha': 0.0036756799189531786}. Best is trial 187 with value: 0.6933481836305168.[0m
[32m[I 2022-04-22 01:11:41,198][0m Trial 790 finished with value: 0.6700225282388775 and parameters: {'loss': 'coxph', 'learning_rate': 1.909808865805802e-05, 'n_estimators': 231, 'criterion': 'absolute_error', 'min_samples_split': 6, 'min_samples_leaf': 4, 'min_weight_fraction_leaf': 0.26481604953097143, 'min_impurity_decrease': 0.023100449646629335, 'max_features': 0.6665756172285637, 'subsample': 0.20936533240788863, 'dropout_rate': 0.8494318753598704, 'ccp_alpha': 0.16367941890425658}. Best is trial 187 with value: 0.6933481836305168.[0m
[32m[I 2022-04-22 01:11:44,666][0m Trial 791 finished with value: 0.63858825152535 and parameters: {'loss': 'coxph', 'learning_rate': 7.608620378794716e-06, 'n_estimators': 224, 'criterion': 'absolute_error', 'min_samples_split': 6, 'min_samples_leaf': 5, 'min_weight_fraction_leaf': 0.2687680671444757, 'min_impurity_decrease': 0.0017351713954552688, 'max_features': 0.7623727265413285, 'subsample': 0.2311420993417942, 'dropout_rate': 0.8369005089688226, 'ccp_alpha': 0.21503770647826442}. Best is trial 187 with value: 0.6933481836305168.[0m
[32m[I 2022-04-22 01:11:48,846][0m Trial 792 finished with value: 0.6840033709997361 and parameters: {'loss': 'coxph', 'learning_rate': 1.22262655708023e-05, 'n_estimators': 237, 'criterion': 'absolute_error', 'min_samples_split': 4, 'min_samples_leaf': 4, 'min_weight_fraction_leaf': 0.2682799712376523, 'min_impurity_decrease': 0.02718821083441942, 'max_features': 0.6973869351842972, 'subsample': 0.14796205116690195, 'dropout_rate': 0.7549309009727252, 'ccp_alpha': 0.10621182032117149}. Best is trial 187 with value: 0.6933481836305168.[0m
[32m[I 2022-04-22 01:11:52,071][0m Trial 793 finished with value: 0.6343732628990925 and parameters: {'loss': 'coxph', 'learning_rate': 1.8071581405882423e-05, 'n_estimators': 215, 'criterion': 'absolute_error', 'min_samples_split': 8, 'min_samples_leaf': 4, 'min_weight_fraction_leaf': 0.3220521199939539, 'min_impurity_decrease': 0.026611917870520845, 'max_features': 0.7299132321673657, 'subsample': 0.20430104706168156, 'dropout_rate': 0.7992199175548629, 'ccp_alpha': 0.2677548380727346}. Best is trial 187 with value: 0.6933481836305168.[0m
[32m[I 2022-04-22 01:11:57,551][0m Trial 794 finished with value: 0.6858395596446358 and parameters: {'loss': 'coxph', 'learning_rate': 2.09420521988341e-05, 'n_estimators': 225, 'criterion': 'absolute_error', 'min_samples_split': 8, 'min_samples_leaf': 4, 'min_weight_fraction_leaf': 0.31075257472277806, 'min_impurity_decrease': 0.01968405130433042, 'max_features': 0.7595660774464889, 'subsample': 0.2279460701367768, 'dropout_rate': 0.8187064390697865, 'ccp_alpha': 0.0038837220421571728}. Best is trial 187 with value: 0.6933481836305168.[0m
[32m[I 2022-04-22 01:12:03,434][0m Trial 795 finished with value: 0.6642215625535354 and parameters: {'loss': 'coxph', 'learning_rate': 9.516013177794762e-06, 'n_estimators': 243, 'criterion': 'absolute_error', 'min_samples_split': 6, 'min_samples_leaf': 3, 'min_weight_fraction_leaf': 0.286933333128802, 'min_impurity_decrease': 0.003600207167412151, 'max_features': 0.7072143876616267, 'subsample': 0.23776270663800494, 'dropout_rate': 0.7767227994082812, 'ccp_alpha': 0.16249061323434766}. Best is trial 187 with value: 0.6933481836305168.[0m
[32m[I 2022-04-22 01:12:06,779][0m Trial 796 finished with value: 0.6833814996518706 and parameters: {'loss': 'coxph', 'learning_rate': 1.4656204610642164e-05, 'n_estimators': 199, 'criterion': 'absolute_error', 'min_samples_split': 7, 'min_samples_leaf': 4, 'min_weight_fraction_leaf': 0.27530744055556056, 'min_impurity_decrease': 0.032391634660104474, 'max_features': 0.7478326556763226, 'subsample': 0.16896168510041093, 'dropout_rate': 0.7570305226109451, 'ccp_alpha': 0.11667436977429434}. Best is trial 187 with value: 0.6933481836305168.[0m
[32m[I 2022-04-22 01:12:14,273][0m Trial 797 finished with value: 0.6127568729131793 and parameters: {'loss': 'coxph', 'learning_rate': 2.141720948119728e-05, 'n_estimators': 230, 'criterion': 'absolute_error', 'min_samples_split': 8, 'min_samples_leaf': 5, 'min_weight_fraction_leaf': 0.27992046157275746, 'min_impurity_decrease': 0.03226694073851032, 'max_features': 0.7283913467412758, 'subsample': 0.20628129699074016, 'dropout_rate': 0.7253826179843382, 'ccp_alpha': 0.2933888912155596}. Best is trial 187 with value: 0.6933481836305168.[0m
[32m[I 2022-04-22 01:12:17,889][0m Trial 798 finished with value: 0.6828122073683112 and parameters: {'loss': 'coxph', 'learning_rate': 1.1909000069770093e-05, 'n_estimators': 237, 'criterion': 'absolute_error', 'min_samples_split': 7, 'min_samples_leaf': 2, 'min_weight_fraction_leaf': 0.26311778475382586, 'min_impurity_decrease': 0.01813926656577794, 'max_features': 0.7631795134323677, 'subsample': 0.18875119714509841, 'dropout_rate': 0.8453966820289414, 'ccp_alpha': 0.09898426004885574}. Best is trial 187 with value: 0.6933481836305168.[0m
[32m[I 2022-04-22 01:12:24,049][0m Trial 799 finished with value: 0.6449850903649714 and parameters: {'loss': 'coxph', 'learning_rate': 1.899834905089931e-05, 'n_estimators': 214, 'criterion': 'absolute_error', 'min_samples_split': 7, 'min_samples_leaf': 3, 'min_weight_fraction_leaf': 0.29757686238942394, 'min_impurity_decrease': 0.0017437381216016574, 'max_features': 0.6827380827901275, 'subsample': 0.23407667689622158, 'dropout_rate': 0.8005110810839288, 'ccp_alpha': 0.21208769031601493}. Best is trial 187 with value: 0.6933481836305168.[0m
[32m[I 2022-04-22 01:12:29,971][0m Trial 800 finished with value: 0.6859212039778437 and parameters: {'loss': 'coxph', 'learning_rate': 1.5288149183979352e-05, 'n_estimators': 232, 'criterion': 'absolute_error', 'min_samples_split': 6, 'min_samples_leaf': 4, 'min_weight_fraction_leaf': 0.26080643386525065, 'min_impurity_decrease': 0.0304032951230062, 'max_features': 0.7395585484840355, 'subsample': 0.2414570622504951, 'dropout_rate': 0.8674424989721575, 'ccp_alpha': 0.09447620151042757}. Best is trial 187 with value: 0.6933481836305168.[0m
/media/san2_ssd/data/Workdir/survival/venv/lib/python3.8/site-packages/sksurv/ensemble/boosting.py:955: RuntimeWarning: divide by zero encountered in log
  time = numpy.log(time)
/media/san2_ssd/data/Workdir/survival/venv/lib/python3.8/site-packages/sksurv/ensemble/boosting.py:955: RuntimeWarning: divide by zero encountered in log
  time = numpy.log(time)
/media/san2_ssd/data/Workdir/survival/venv/lib/python3.8/site-packages/sksurv/ensemble/boosting.py:955: RuntimeWarning: divide by zero encountered in log
  time = numpy.log(time)
/media/san2_ssd/data/Workdir/survival/venv/lib/python3.8/site-packages/sksurv/ensemble/boosting.py:955: RuntimeWarning: divide by zero encountered in log
  time = numpy.log(time)
[32m[I 2022-04-22 01:12:30,974][0m Trial 801 finished with value: -0.7322675686572004 and parameters: {'loss': 'squared', 'learning_rate': 8.382282563401734e-06, 'n_estimators': 221, 'criterion': 'absolute_error', 'min_samples_split': 7, 'min_samples_leaf': 4, 'min_weight_fraction_leaf': 0.25853548893782996, 'min_impurity_decrease': 0.0029722662776369415, 'max_features': 0.7576442946298008, 'subsample': 0.21488982519313896, 'dropout_rate': 0.7740890575958701, 'ccp_alpha': 0.191426345773227}. Best is trial 187 with value: 0.6933481836305168.[0m
[32m[I 2022-04-22 01:12:34,023][0m Trial 802 finished with value: 0.6907974269757531 and parameters: {'loss': 'coxph', 'learning_rate': 5.9455603489385515e-06, 'n_estimators': 216, 'criterion': 'absolute_error', 'min_samples_split': 8, 'min_samples_leaf': 5, 'min_weight_fraction_leaf': 0.2745822133727573, 'min_impurity_decrease': 0.03554978453373597, 'max_features': 0.6411029157062278, 'subsample': 0.2198301542319443, 'dropout_rate': 0.8273746638941428, 'ccp_alpha': 0.004819628188264069}. Best is trial 187 with value: 0.6933481836305168.[0m
[32m[I 2022-04-22 01:12:37,867][0m Trial 803 finished with value: 0.6862973798788311 and parameters: {'loss': 'coxph', 'learning_rate': 6.390921609540241e-06, 'n_estimators': 205, 'criterion': 'absolute_error', 'min_samples_split': 8, 'min_samples_leaf': 5, 'min_weight_fraction_leaf': 0.28344260580643627, 'min_impurity_decrease': 0.036201316784313965, 'max_features': 0.7178406431343173, 'subsample': 0.24125351521082378, 'dropout_rate': 0.8681932022838841, 'ccp_alpha': 0.0032919298323398653}. Best is trial 187 with value: 0.6933481836305168.[0m
[32m[I 2022-04-22 01:12:43,417][0m Trial 804 finished with value: 0.6775820739936349 and parameters: {'loss': 'coxph', 'learning_rate': 6.207327825510988e-06, 'n_estimators': 241, 'criterion': 'absolute_error', 'min_samples_split': 8, 'min_samples_leaf': 4, 'min_weight_fraction_leaf': 0.2871134175057579, 'min_impurity_decrease': 0.03896547046184028, 'max_features': 0.6790506418975373, 'subsample': 0.18740387429916597, 'dropout_rate': 0.8274017214165825, 'ccp_alpha': 0.08511434826558781}. Best is trial 187 with value: 0.6933481836305168.[0m
