[32m[I 2022-04-21 16:29:44,947][0m Trial 217 finished with value: 0.8448670575575271 and parameters: {'loss': 'coxph', 'learning_rate': 0.009658737191676276, 'n_estimators': 241, 'criterion': 'friedman_mse', 'min_samples_split': 3, 'min_samples_leaf': 2, 'min_weight_fraction_leaf': 0.14890933544131263, 'min_impurity_decrease': 0.3294353143106437, 'max_features': 0.27412199359008615, 'subsample': 0.0848224556558203, 'dropout_rate': 0.07582510738798987, 'ccp_alpha': 0.00203887793341178}. Best is trial 149 with value: 0.8471440992916224.[0m
[32m[I 2022-04-21 16:30:22,849][0m Trial 218 finished with value: 0.8456546345352132 and parameters: {'loss': 'coxph', 'learning_rate': 9.490410785031178e-05, 'n_estimators': 288, 'criterion': 'friedman_mse', 'min_samples_split': 3, 'min_samples_leaf': 2, 'min_weight_fraction_leaf': 0.22576793004358275, 'min_impurity_decrease': 0.3830221308928375, 'max_features': 0.2863624655230573, 'subsample': 0.13382494153477525, 'dropout_rate': 0.10808679310719016, 'ccp_alpha': 0.0018433435611169852}. Best is trial 149 with value: 0.8471440992916224.[0m
[32m[I 2022-04-21 16:30:53,521][0m Trial 219 finished with value: 0.6977605368549431 and parameters: {'loss': 'coxph', 'learning_rate': 0.00012217317238363945, 'n_estimators': 286, 'criterion': 'absolute_error', 'min_samples_split': 3, 'min_samples_leaf': 2, 'min_weight_fraction_leaf': 0.22965207516351693, 'min_impurity_decrease': 0.38788000330187533, 'max_features': 0.22806544558974912, 'subsample': 0.14850554738091393, 'dropout_rate': 0.1147830461443407, 'ccp_alpha': 0.19461180142252185}. Best is trial 149 with value: 0.8471440992916224.[0m
[32m[I 2022-04-21 16:31:24,482][0m Trial 220 finished with value: 0.8445449066992972 and parameters: {'loss': 'coxph', 'learning_rate': 0.00020624959375460585, 'n_estimators': 300, 'criterion': 'friedman_mse', 'min_samples_split': 2, 'min_samples_leaf': 3, 'min_weight_fraction_leaf': 0.21923652868881166, 'min_impurity_decrease': 0.37081351441233235, 'max_features': 0.2796273019882197, 'subsample': 0.13202055215422384, 'dropout_rate': 0.08164466346819019, 'ccp_alpha': 0.009547562832013634}. Best is trial 149 with value: 0.8471440992916224.[0m
[32m[I 2022-04-21 16:31:48,922][0m Trial 221 finished with value: 0.8444012103349798 and parameters: {'loss': 'coxph', 'learning_rate': 8.643986328062967e-05, 'n_estimators': 269, 'criterion': 'friedman_mse', 'min_samples_split': 3, 'min_samples_leaf': 2, 'min_weight_fraction_leaf': 0.20988917951225128, 'min_impurity_decrease': 0.35253711899494505, 'max_features': 0.3047525833583708, 'subsample': 0.10972608376807388, 'dropout_rate': 0.04768740888078702, 'ccp_alpha': 0.08978270702160045}. Best is trial 149 with value: 0.8471440992916224.[0m
[32m[I 2022-04-21 16:32:13,931][0m Trial 222 finished with value: 0.8442780359132446 and parameters: {'loss': 'coxph', 'learning_rate': 0.00010447974223327953, 'n_estimators': 291, 'criterion': 'friedman_mse', 'min_samples_split': 3, 'min_samples_leaf': 2, 'min_weight_fraction_leaf': 0.19302007282356407, 'min_impurity_decrease': 0.3421203505104151, 'max_features': 0.2683274664632297, 'subsample': 0.0535226999389023, 'dropout_rate': 0.15548671410611306, 'ccp_alpha': 0.002086542699646572}. Best is trial 149 with value: 0.8471440992916224.[0m
[32m[I 2022-04-21 16:32:48,661][0m Trial 223 finished with value: 0.8459498847678557 and parameters: {'loss': 'coxph', 'learning_rate': 7.047206767781759e-05, 'n_estimators': 318, 'criterion': 'friedman_mse', 'min_samples_split': 3, 'min_samples_leaf': 2, 'min_weight_fraction_leaf': 0.17951130167082377, 'min_impurity_decrease': 0.3143910622685065, 'max_features': 0.3232343782095146, 'subsample': 0.0916563562787627, 'dropout_rate': 0.11562590479080087, 'ccp_alpha': 0.17477220067679045}. Best is trial 149 with value: 0.8471440992916224.[0m
[32m[I 2022-04-21 16:33:26,258][0m Trial 224 finished with value: 0.8429410042795096 and parameters: {'loss': 'coxph', 'learning_rate': 6.788242467379247e-05, 'n_estimators': 339, 'criterion': 'friedman_mse', 'min_samples_split': 3, 'min_samples_leaf': 2, 'min_weight_fraction_leaf': 0.17117649038600685, 'min_impurity_decrease': 0.31549738752347195, 'max_features': 0.3219952448359282, 'subsample': 0.0829073836960208, 'dropout_rate': 0.10985694204408696, 'ccp_alpha': 0.20146900564232093}. Best is trial 149 with value: 0.8471440992916224.[0m
[32m[I 2022-04-21 16:34:12,853][0m Trial 225 finished with value: 0.842996185334362 and parameters: {'loss': 'coxph', 'learning_rate': 4.8503275579762426e-05, 'n_estimators': 370, 'criterion': 'friedman_mse', 'min_samples_split': 3, 'min_samples_leaf': 2, 'min_weight_fraction_leaf': 0.18052250943704584, 'min_impurity_decrease': 0.28832840067384663, 'max_features': 0.2938195766829548, 'subsample': 0.07186381857663585, 'dropout_rate': 0.09076816072865675, 'ccp_alpha': 0.3236933883071954}. Best is trial 149 with value: 0.8471440992916224.[0m
[32m[I 2022-04-21 16:34:44,841][0m Trial 226 finished with value: 0.8423223103631059 and parameters: {'loss': 'coxph', 'learning_rate': 0.0001665296130755011, 'n_estimators': 308, 'criterion': 'friedman_mse', 'min_samples_split': 3, 'min_samples_leaf': 2, 'min_weight_fraction_leaf': 0.15631757512842978, 'min_impurity_decrease': 0.32108627702994424, 'max_features': 0.3329233530037915, 'subsample': 0.1690913743427991, 'dropout_rate': 0.1288380375130126, 'ccp_alpha': 0.1635594456113979}. Best is trial 149 with value: 0.8471440992916224.[0m
[32m[I 2022-04-21 16:35:27,847][0m Trial 227 finished with value: 0.7370119546873944 and parameters: {'loss': 'coxph', 'learning_rate': 7.731080685630547e-05, 'n_estimators': 326, 'criterion': 'friedman_mse', 'min_samples_split': 2, 'min_samples_leaf': 2, 'min_weight_fraction_leaf': 0.4053969493125832, 'min_impurity_decrease': 0.2504721310406105, 'max_features': 0.31520479501380944, 'subsample': 0.1321494563508352, 'dropout_rate': 0.06844546453472733, 'ccp_alpha': 0.09879555314221267}. Best is trial 149 with value: 0.8471440992916224.[0m
[32m[I 2022-04-21 16:35:50,132][0m Trial 228 finished with value: 0.8437455732576116 and parameters: {'loss': 'coxph', 'learning_rate': 0.00012837517647930975, 'n_estimators': 228, 'criterion': 'friedman_mse', 'min_samples_split': 3, 'min_samples_leaf': 2, 'min_weight_fraction_leaf': 0.16625832673073304, 'min_impurity_decrease': 0.30628255414754824, 'max_features': 0.2843600411696609, 'subsample': 0.09395948596986708, 'dropout_rate': 0.14231251048196325, 'ccp_alpha': 0.27958643262478455}. Best is trial 149 with value: 0.8471440992916224.[0m
[32m[I 2022-04-21 16:36:07,239][0m Trial 229 finished with value: 0.65 and parameters: {'loss': 'coxph', 'learning_rate': 5.546736332767193e-05, 'n_estimators': 259, 'criterion': 'friedman_mse', 'min_samples_split': 4, 'min_samples_leaf': 2, 'min_weight_fraction_leaf': 0.20288113725248175, 'min_impurity_decrease': 0.6276110020884806, 'max_features': 0.3573735357116249, 'subsample': 0.026757992237748437, 'dropout_rate': 0.11218575456734628, 'ccp_alpha': 0.0019615483849171125}. Best is trial 149 with value: 0.8471440992916224.[0m
[32m[I 2022-04-21 16:36:35,583][0m Trial 230 finished with value: 0.8422160983112456 and parameters: {'loss': 'coxph', 'learning_rate': 0.0001603786704931056, 'n_estimators': 314, 'criterion': 'friedman_mse', 'min_samples_split': 3, 'min_samples_leaf': 2, 'min_weight_fraction_leaf': 0.18081816436541565, 'min_impurity_decrease': 0.38896864076036153, 'max_features': 0.2442666256739415, 'subsample': 0.05724307737033273, 'dropout_rate': 0.16279884329602623, 'ccp_alpha': 0.18551905312037764}. Best is trial 149 with value: 0.8471440992916224.[0m
[32m[I 2022-04-21 16:37:00,216][0m Trial 231 finished with value: 0.8432710753437636 and parameters: {'loss': 'coxph', 'learning_rate': 9.79241057373855e-05, 'n_estimators': 284, 'criterion': 'friedman_mse', 'min_samples_split': 3, 'min_samples_leaf': 2, 'min_weight_fraction_leaf': 0.19042247920069155, 'min_impurity_decrease': 0.3503667608731824, 'max_features': 0.30292881398038135, 'subsample': 0.11221737825769558, 'dropout_rate': 0.17995475180904635, 'ccp_alpha': 0.09966838300220746}. Best is trial 149 with value: 0.8471440992916224.[0m
[32m[I 2022-04-21 16:37:27,325][0m Trial 232 finished with value: 0.8440590936073006 and parameters: {'loss': 'coxph', 'learning_rate': 0.014333925284216264, 'n_estimators': 276, 'criterion': 'friedman_mse', 'min_samples_split': 3, 'min_samples_leaf': 2, 'min_weight_fraction_leaf': 0.22425592148191342, 'min_impurity_decrease': 0.330315534683774, 'max_features': 0.26821425143553235, 'subsample': 0.09874893972348919, 'dropout_rate': 0.1994539477190169, 'ccp_alpha': 0.12162917558393035}. Best is trial 149 with value: 0.8471440992916224.[0m
[32m[I 2022-04-21 16:37:40,721][0m Trial 233 finished with value: 0.8444773962290529 and parameters: {'loss': 'coxph', 'learning_rate': 8.213057715818695e-05, 'n_estimators': 237, 'criterion': 'friedman_mse', 'min_samples_split': 3, 'min_samples_leaf': 2, 'min_weight_fraction_leaf': 0.20324109400477555, 'min_impurity_decrease': 0.36491542700946444, 'max_features': 0.33203289108967493, 'subsample': 0.12565008084007054, 'dropout_rate': 0.14602573457848475, 'ccp_alpha': 0.0774170727345059}. Best is trial 149 with value: 0.8471440992916224.[0m
[32m[I 2022-04-21 16:38:12,147][0m Trial 234 finished with value: 0.8456004592536553 and parameters: {'loss': 'coxph', 'learning_rate': 0.00012285562217433945, 'n_estimators': 297, 'criterion': 'friedman_mse', 'min_samples_split': 3, 'min_samples_leaf': 2, 'min_weight_fraction_leaf': 0.1868709912563233, 'min_impurity_decrease': 0.28983110167554693, 'max_features': 0.798554346640109, 'subsample': 0.07416711938425842, 'dropout_rate': 0.0966328800061957, 'ccp_alpha': 0.0027484010897400653}. Best is trial 149 with value: 0.8471440992916224.[0m
[32m[I 2022-04-21 16:38:37,511][0m Trial 235 finished with value: 0.8414787937210539 and parameters: {'loss': 'coxph', 'learning_rate': 0.00012377600621891118, 'n_estimators': 299, 'criterion': 'friedman_mse', 'min_samples_split': 3, 'min_samples_leaf': 2, 'min_weight_fraction_leaf': 0.17592623026068366, 'min_impurity_decrease': 0.27453751812722416, 'max_features': 0.8532068461766832, 'subsample': 0.06707621489820598, 'dropout_rate': 0.09421306251041085, 'ccp_alpha': 0.2171684471162526}. Best is trial 149 with value: 0.8471440992916224.[0m
[32m[I 2022-04-21 16:39:10,246][0m Trial 236 finished with value: 0.8454102010904062 and parameters: {'loss': 'coxph', 'learning_rate': 0.00021724540750949208, 'n_estimators': 313, 'criterion': 'friedman_mse', 'min_samples_split': 3, 'min_samples_leaf': 2, 'min_weight_fraction_leaf': 0.16381745882398174, 'min_impurity_decrease': 0.29403007548729615, 'max_features': 0.3059404746915371, 'subsample': 0.04437173294125442, 'dropout_rate': 0.12010770672604253, 'ccp_alpha': 0.08620683074371893}. Best is trial 149 with value: 0.8471440992916224.[0m
/media/san2_ssd/data/Workdir/survival/venv/lib/python3.8/site-packages/sksurv/ensemble/boosting.py:955: RuntimeWarning: divide by zero encountered in log
  time = numpy.log(time)
/media/san2_ssd/data/Workdir/survival/venv/lib/python3.8/site-packages/sksurv/ensemble/boosting.py:955: RuntimeWarning: divide by zero encountered in log
  time = numpy.log(time)
/media/san2_ssd/data/Workdir/survival/venv/lib/python3.8/site-packages/sksurv/ensemble/boosting.py:955: RuntimeWarning: divide by zero encountered in log
  time = numpy.log(time)
/media/san2_ssd/data/Workdir/survival/venv/lib/python3.8/site-packages/sksurv/ensemble/boosting.py:955: RuntimeWarning: divide by zero encountered in log
  time = numpy.log(time)
[32m[I 2022-04-21 16:39:19,953][0m Trial 237 finished with value: -0.46721157625838405 and parameters: {'loss': 'squared', 'learning_rate': 0.00019550758435020205, 'n_estimators': 348, 'criterion': 'friedman_mse', 'min_samples_split': 3, 'min_samples_leaf': 2, 'min_weight_fraction_leaf': 0.16199842920483568, 'min_impurity_decrease': 0.2855255685625922, 'max_features': 0.9415911789286899, 'subsample': 0.08103330376212342, 'dropout_rate': 0.1202318124626294, 'ccp_alpha': 0.2863916784788695}. Best is trial 149 with value: 0.8471440992916224.[0m
[32m[I 2022-04-21 16:39:52,600][0m Trial 238 finished with value: 0.8443231942047005 and parameters: {'loss': 'coxph', 'learning_rate': 0.0002542381423519742, 'n_estimators': 326, 'criterion': 'friedman_mse', 'min_samples_split': 2, 'min_samples_leaf': 2, 'min_weight_fraction_leaf': 0.15275960386939022, 'min_impurity_decrease': 0.24343983236683245, 'max_features': 0.7614128382549159, 'subsample': 0.03750400557427838, 'dropout_rate': 0.09761694401863832, 'ccp_alpha': 0.1706222921835932}. Best is trial 149 with value: 0.8471440992916224.[0m
[32m[I 2022-04-21 16:40:20,929][0m Trial 239 finished with value: 0.65 and parameters: {'loss': 'coxph', 'learning_rate': 0.0001470665896055865, 'n_estimators': 313, 'criterion': 'friedman_mse', 'min_samples_split': 4, 'min_samples_leaf': 2, 'min_weight_fraction_leaf': 0.1716451934603233, 'min_impurity_decrease': 0.2987924780605949, 'max_features': 0.08963286531460246, 'subsample': 0.013283259615978663, 'dropout_rate': 0.12543621898517143, 'ccp_alpha': 0.0750253517523885}. Best is trial 149 with value: 0.8471440992916224.[0m
[32m[I 2022-04-21 16:40:47,919][0m Trial 240 finished with value: 0.8425428522103996 and parameters: {'loss': 'coxph', 'learning_rate': 0.0002232613214806574, 'n_estimators': 295, 'criterion': 'friedman_mse', 'min_samples_split': 3, 'min_samples_leaf': 2, 'min_weight_fraction_leaf': 0.18418681132715278, 'min_impurity_decrease': 0.2657270081180416, 'max_features': 0.28715093447020634, 'subsample': 0.08591688700586997, 'dropout_rate': 0.06769105560676658, 'ccp_alpha': 0.18560557438727288}. Best is trial 149 with value: 0.8471440992916224.[0m
[32m[I 2022-04-21 16:40:59,715][0m Trial 241 finished with value: 0.8445221255205405 and parameters: {'loss': 'coxph', 'learning_rate': 0.0001182276011157049, 'n_estimators': 219, 'criterion': 'friedman_mse', 'min_samples_split': 3, 'min_samples_leaf': 2, 'min_weight_fraction_leaf': 0.16645946431693823, 'min_impurity_decrease': 0.3055577710319977, 'max_features': 0.2987986380548284, 'subsample': 0.04737806603272363, 'dropout_rate': 0.04103071333534665, 'ccp_alpha': 0.004823590359421705}. Best is trial 149 with value: 0.8471440992916224.[0m
[32m[I 2022-04-21 16:41:25,552][0m Trial 242 finished with value: 0.8440419938668736 and parameters: {'loss': 'coxph', 'learning_rate': 6.617781597845596e-05, 'n_estimators': 305, 'criterion': 'friedman_mse', 'min_samples_split': 3, 'min_samples_leaf': 2, 'min_weight_fraction_leaf': 0.18381405411211105, 'min_impurity_decrease': 0.32277701105233003, 'max_features': 0.8058237620682395, 'subsample': 0.058350862318506884, 'dropout_rate': 0.13514357175086658, 'ccp_alpha': 0.0685540802312277}. Best is trial 149 with value: 0.8471440992916224.[0m
[32m[I 2022-04-21 16:41:52,586][0m Trial 243 finished with value: 0.8429373667375917 and parameters: {'loss': 'coxph', 'learning_rate': 9.674864141585502e-05, 'n_estimators': 325, 'criterion': 'friedman_mse', 'min_samples_split': 3, 'min_samples_leaf': 2, 'min_weight_fraction_leaf': 0.21442892224977517, 'min_impurity_decrease': 0.2951875571303721, 'max_features': 0.32007339201116697, 'subsample': 0.03947247297647895, 'dropout_rate': 0.08863384558022258, 'ccp_alpha': 0.00909998114943901}. Best is trial 149 with value: 0.8471440992916224.[0m
[32m[I 2022-04-21 16:42:07,715][0m Trial 244 finished with value: 0.8474070660226068 and parameters: {'loss': 'coxph', 'learning_rate': 0.0001641598903010561, 'n_estimators': 253, 'criterion': 'friedman_mse', 'min_samples_split': 3, 'min_samples_leaf': 2, 'min_weight_fraction_leaf': 0.197616992630623, 'min_impurity_decrease': 0.33500135428814465, 'max_features': 0.3460734351205195, 'subsample': 0.07107492975991862, 'dropout_rate': 0.16415300178174477, 'ccp_alpha': 0.12066025403917378}. Best is trial 244 with value: 0.8474070660226068.[0m
[32m[I 2022-04-21 16:42:19,899][0m Trial 245 finished with value: 0.8435499546873014 and parameters: {'loss': 'coxph', 'learning_rate': 0.00016112760041713951, 'n_estimators': 257, 'criterion': 'friedman_mse', 'min_samples_split': 2, 'min_samples_leaf': 2, 'min_weight_fraction_leaf': 0.19282853034603836, 'min_impurity_decrease': 0.33119960222182343, 'max_features': 0.3513446818602385, 'subsample': 0.09536949331854207, 'dropout_rate': 0.17050215028779056, 'ccp_alpha': 0.1608474489314022}. Best is trial 244 with value: 0.8474070660226068.[0m
[32m[I 2022-04-21 16:42:33,044][0m Trial 246 finished with value: 0.8436209430167555 and parameters: {'loss': 'coxph', 'learning_rate': 0.00013786482264751935, 'n_estimators': 242, 'criterion': 'friedman_mse', 'min_samples_split': 3, 'min_samples_leaf': 3, 'min_weight_fraction_leaf': 0.17621234241248726, 'min_impurity_decrease': 0.33816334937102444, 'max_features': 0.3331153104179755, 'subsample': 0.07644354742072915, 'dropout_rate': 0.15850260058137544, 'ccp_alpha': 0.2656250446260357}. Best is trial 244 with value: 0.8474070660226068.[0m
[32m[I 2022-04-21 16:42:50,510][0m Trial 247 finished with value: 0.8451971633449367 and parameters: {'loss': 'coxph', 'learning_rate': 0.00029200919440501203, 'n_estimators': 289, 'criterion': 'friedman_mse', 'min_samples_split': 3, 'min_samples_leaf': 2, 'min_weight_fraction_leaf': 0.15727857326227873, 'min_impurity_decrease': 0.2794269219398147, 'max_features': 0.9864023387490335, 'subsample': 0.10718311854174112, 'dropout_rate': 0.11353293695752172, 'ccp_alpha': 0.11785369765148242}. Best is trial 244 with value: 0.8474070660226068.[0m
[32m[I 2022-04-21 16:43:03,451][0m Trial 248 finished with value: 0.8429725751849197 and parameters: {'loss': 'coxph', 'learning_rate': 0.0004138057055866889, 'n_estimators': 250, 'criterion': 'friedman_mse', 'min_samples_split': 3, 'min_samples_leaf': 2, 'min_weight_fraction_leaf': 0.15277547600717448, 'min_impurity_decrease': 0.608046914951, 'max_features': 0.9723314025360483, 'subsample': 0.683159869064391, 'dropout_rate': 0.1125164572146144, 'ccp_alpha': 0.10038222546715285}. Best is trial 244 with value: 0.8474070660226068.[0m
[32m[I 2022-04-21 16:43:31,371][0m Trial 249 finished with value: 0.8438536388024932 and parameters: {'loss': 'coxph', 'learning_rate': 0.0072217671536465855, 'n_estimators': 283, 'criterion': 'friedman_mse', 'min_samples_split': 2, 'min_samples_leaf': 2, 'min_weight_fraction_leaf': 0.1611466350129579, 'min_impurity_decrease': 0.27916133861891546, 'max_features': 0.992122525473686, 'subsample': 0.11952942469265804, 'dropout_rate': 0.08083290016917784, 'ccp_alpha': 0.10541426218993356}. Best is trial 244 with value: 0.8474070660226068.[0m
[32m[I 2022-04-21 16:43:46,931][0m Trial 250 finished with value: 0.7324992959897794 and parameters: {'loss': 'coxph', 'learning_rate': 0.0002623435927622133, 'n_estimators': 268, 'criterion': 'friedman_mse', 'min_samples_split': 3, 'min_samples_leaf': 2, 'min_weight_fraction_leaf': 0.14067675959318487, 'min_impurity_decrease': 0.259104770412099, 'max_features': 0.26958396302844, 'subsample': 0.14694583142485335, 'dropout_rate': 0.10798364056985192, 'ccp_alpha': 0.37902415385339655}. Best is trial 244 with value: 0.8474070660226068.[0m
[32m[I 2022-04-21 16:44:08,614][0m Trial 251 finished with value: 0.7401420033819083 and parameters: {'loss': 'coxph', 'learning_rate': 0.000331551916135893, 'n_estimators': 339, 'criterion': 'friedman_mse', 'min_samples_split': 3, 'min_samples_leaf': 2, 'min_weight_fraction_leaf': 0.43222009024542535, 'min_impurity_decrease': 0.23498604591902664, 'max_features': 0.31303011209380377, 'subsample': 0.10555290488007217, 'dropout_rate': 0.13769117744787837, 'ccp_alpha': 0.009032232857399698}. Best is trial 244 with value: 0.8474070660226068.[0m
[32m[I 2022-04-21 16:44:33,131][0m Trial 252 finished with value: 0.65 and parameters: {'loss': 'coxph', 'learning_rate': 0.00018665280233697804, 'n_estimators': 312, 'criterion': 'friedman_mse', 'min_samples_split': 2, 'min_samples_leaf': 2, 'min_weight_fraction_leaf': 0.16946964498170836, 'min_impurity_decrease': 0.28866070262279414, 'max_features': 0.8193806261740342, 'subsample': 0.13752421265032355, 'dropout_rate': 0.06484911041191542, 'ccp_alpha': 1.2459868585268252}. Best is trial 244 with value: 0.8474070660226068.[0m
[32m[I 2022-04-21 16:44:49,624][0m Trial 253 finished with value: 0.844061320621796 and parameters: {'loss': 'coxph', 'learning_rate': 0.00027761184860014614, 'n_estimators': 235, 'criterion': 'friedman_mse', 'min_samples_split': 4, 'min_samples_leaf': 2, 'min_weight_fraction_leaf': 0.1597858903398944, 'min_impurity_decrease': 0.37493651735284494, 'max_features': 0.6681196356992949, 'subsample': 0.11706483971789741, 'dropout_rate': 0.17367384698125415, 'ccp_alpha': 0.16817500765912588}. Best is trial 244 with value: 0.8474070660226068.[0m
[32m[I 2022-04-21 16:45:06,937][0m Trial 254 finished with value: 0.8289781608401394 and parameters: {'loss': 'coxph', 'learning_rate': 0.00017341612285166856, 'n_estimators': 263, 'criterion': 'absolute_error', 'min_samples_split': 3, 'min_samples_leaf': 3, 'min_weight_fraction_leaf': 0.18154671142239628, 'min_impurity_decrease': 0.3107268692365258, 'max_features': 0.29557537275835394, 'subsample': 0.08043531993550013, 'dropout_rate': 0.09552847073702544, 'ccp_alpha': 0.2778325951808963}. Best is trial 244 with value: 0.8474070660226068.[0m
