[32m[I 2022-04-23 06:43:19,311][0m Trial 817 finished with value: 0.5652330350505753 and parameters: {'loss': 'coxph', 'learning_rate': 0.0536863762017478, 'n_estimators': 651, 'criterion': 'friedman_mse', 'min_samples_split': 9, 'min_samples_leaf': 4, 'min_weight_fraction_leaf': 0.038021548694300286, 'min_impurity_decrease': 0.6926982782462077, 'max_features': 0.24468351908616004, 'subsample': 0.21710739609954788, 'dropout_rate': 0.16679710043559992, 'ccp_alpha': 0.26149059627255183}. Best is trial 690 with value: 0.6691837560454439.[0m
[32m[I 2022-04-23 06:44:43,950][0m Trial 818 finished with value: 0.5 and parameters: {'loss': 'coxph', 'learning_rate': 0.08118050826951981, 'n_estimators': 606, 'criterion': 'friedman_mse', 'min_samples_split': 9, 'min_samples_leaf': 1, 'min_weight_fraction_leaf': 0.053472281930181546, 'min_impurity_decrease': 0.4328064526747152, 'max_features': 0.4739455830266496, 'subsample': 0.2425634156001102, 'dropout_rate': 0.22124551426209932, 'ccp_alpha': 1.8762873350564466}. Best is trial 690 with value: 0.6691837560454439.[0m
[32m[I 2022-04-23 06:46:05,292][0m Trial 819 finished with value: 0.6353565144493587 and parameters: {'loss': 'coxph', 'learning_rate': 0.06481933255399752, 'n_estimators': 539, 'criterion': 'friedman_mse', 'min_samples_split': 9, 'min_samples_leaf': 4, 'min_weight_fraction_leaf': 0.06983227472568385, 'min_impurity_decrease': 0.8347019321538822, 'max_features': 0.13166778148605057, 'subsample': 0.3009217174911209, 'dropout_rate': 0.015108613800398463, 'ccp_alpha': 0.1133300762569364}. Best is trial 690 with value: 0.6691837560454439.[0m
[32m[I 2022-04-23 06:48:12,769][0m Trial 820 finished with value: 0.659391466507638 and parameters: {'loss': 'coxph', 'learning_rate': 0.09995776014297518, 'n_estimators': 687, 'criterion': 'friedman_mse', 'min_samples_split': 8, 'min_samples_leaf': 4, 'min_weight_fraction_leaf': 0.018762377128572254, 'min_impurity_decrease': 0.5203979112270977, 'max_features': 0.6016115048736251, 'subsample': 0.27003980415986895, 'dropout_rate': 0.06666524056816826, 'ccp_alpha': 0.08850732020764389}. Best is trial 690 with value: 0.6691837560454439.[0m
[32m[I 2022-04-23 06:49:39,844][0m Trial 821 finished with value: 0.6599379408319769 and parameters: {'loss': 'coxph', 'learning_rate': 6.123382093405656e-06, 'n_estimators': 589, 'criterion': 'friedman_mse', 'min_samples_split': 9, 'min_samples_leaf': 5, 'min_weight_fraction_leaf': 0.002049751347610887, 'min_impurity_decrease': 0.45675319964750827, 'max_features': 0.5355039236499054, 'subsample': 0.2916778151648343, 'dropout_rate': 0.19888179663902172, 'ccp_alpha': 0.001504979715966193}. Best is trial 690 with value: 0.6691837560454439.[0m
[32m[I 2022-04-23 06:51:05,095][0m Trial 822 finished with value: 0.6405287916632308 and parameters: {'loss': 'coxph', 'learning_rate': 0.03705520745245859, 'n_estimators': 621, 'criterion': 'friedman_mse', 'min_samples_split': 4, 'min_samples_leaf': 6, 'min_weight_fraction_leaf': 0.04402940800294, 'min_impurity_decrease': 0.807891153463314, 'max_features': 0.583116199053078, 'subsample': 0.24636479101379372, 'dropout_rate': 0.24728801054091065, 'ccp_alpha': 0.17829667393013554}. Best is trial 690 with value: 0.6691837560454439.[0m
[32m[I 2022-04-23 06:51:15,408][0m Trial 823 finished with value: 0.6169855360287351 and parameters: {'loss': 'coxph', 'learning_rate': 0.04861871495265946, 'n_estimators': 564, 'criterion': 'friedman_mse', 'min_samples_split': 9, 'min_samples_leaf': 4, 'min_weight_fraction_leaf': 0.06347385989060655, 'min_impurity_decrease': 0.5006681023561609, 'max_features': 0.5560679189059308, 'subsample': 0.20471785560952588, 'dropout_rate': 0.9903167693249677, 'ccp_alpha': 0.23245995718725052}. Best is trial 690 with value: 0.6691837560454439.[0m
/media/san2_ssd/data/Workdir/survival/venv/lib/python3.8/site-packages/sksurv/ensemble/boosting.py:955: RuntimeWarning: divide by zero encountered in log
  time = numpy.log(time)
/media/san2_ssd/data/Workdir/survival/venv/lib/python3.8/site-packages/sksurv/ensemble/boosting.py:955: RuntimeWarning: divide by zero encountered in log
  time = numpy.log(time)
/media/san2_ssd/data/Workdir/survival/venv/lib/python3.8/site-packages/sksurv/ensemble/boosting.py:955: RuntimeWarning: divide by zero encountered in log
  time = numpy.log(time)
/media/san2_ssd/data/Workdir/survival/venv/lib/python3.8/site-packages/sksurv/ensemble/boosting.py:955: RuntimeWarning: divide by zero encountered in log
  time = numpy.log(time)
[32m[I 2022-04-23 06:51:35,676][0m Trial 824 finished with value: -0.7381125760550434 and parameters: {'loss': 'squared', 'learning_rate': 0.0819344506936892, 'n_estimators': 633, 'criterion': 'friedman_mse', 'min_samples_split': 7, 'min_samples_leaf': 4, 'min_weight_fraction_leaf': 0.031087488758414328, 'min_impurity_decrease': 0.4720860855962268, 'max_features': 0.6222569611379433, 'subsample': 0.26948204831275996, 'dropout_rate': 0.14766029224187938, 'ccp_alpha': 0.0037930627248167633}. Best is trial 690 with value: 0.6691837560454439.[0m
[32m[I 2022-04-23 06:52:56,083][0m Trial 825 finished with value: 0.5 and parameters: {'loss': 'coxph', 'learning_rate': 0.06477023196651441, 'n_estimators': 581, 'criterion': 'friedman_mse', 'min_samples_split': 9, 'min_samples_leaf': 4, 'min_weight_fraction_leaf': 0.05388401343269605, 'min_impurity_decrease': 0.5212900627471777, 'max_features': 0.6570393523322418, 'subsample': 0.22981104974732763, 'dropout_rate': 0.18238920516506976, 'ccp_alpha': 4.507761388537939}. Best is trial 690 with value: 0.6691837560454439.[0m
[32m[I 2022-04-23 06:54:37,430][0m Trial 826 finished with value: 0.653277550798683 and parameters: {'loss': 'coxph', 'learning_rate': 0.0578425483401293, 'n_estimators': 659, 'criterion': 'friedman_mse', 'min_samples_split': 9, 'min_samples_leaf': 4, 'min_weight_fraction_leaf': 0.011284852999265186, 'min_impurity_decrease': 0.4753469346225792, 'max_features': 0.5045047691458414, 'subsample': 0.3030895050114021, 'dropout_rate': 0.20826907803572847, 'ccp_alpha': 0.09658001679793583}. Best is trial 690 with value: 0.6691837560454439.[0m
[32m[I 2022-04-23 06:55:43,108][0m Trial 827 finished with value: 0.6350408868540304 and parameters: {'loss': 'coxph', 'learning_rate': 0.07927975493522003, 'n_estimators': 532, 'criterion': 'friedman_mse', 'min_samples_split': 8, 'min_samples_leaf': 5, 'min_weight_fraction_leaf': 0.024112418556849726, 'min_impurity_decrease': 0.5468425779731906, 'max_features': 0.6094507595357677, 'subsample': 0.2566947344162247, 'dropout_rate': 0.22808061355609527, 'ccp_alpha': 0.17269694704389316}. Best is trial 690 with value: 0.6691837560454439.[0m
[32m[I 2022-04-23 06:57:48,268][0m Trial 828 finished with value: 0.5481655817814963 and parameters: {'loss': 'coxph', 'learning_rate': 0.04519522400525218, 'n_estimators': 720, 'criterion': 'friedman_mse', 'min_samples_split': 9, 'min_samples_leaf': 8, 'min_weight_fraction_leaf': 0.067077129622549, 'min_impurity_decrease': 0.43440059620491034, 'max_features': 0.5873400483541849, 'subsample': 0.16808733850300323, 'dropout_rate': 0.16357992732132984, 'ccp_alpha': 0.378993856854989}. Best is trial 690 with value: 0.6691837560454439.[0m
[32m[I 2022-04-23 06:59:22,499][0m Trial 829 finished with value: 0.6603548820024828 and parameters: {'loss': 'coxph', 'learning_rate': 0.0006788230547828809, 'n_estimators': 606, 'criterion': 'friedman_mse', 'min_samples_split': 9, 'min_samples_leaf': 4, 'min_weight_fraction_leaf': 0.03828080436509454, 'min_impurity_decrease': 0.8351213663875879, 'max_features': 0.5642376843344377, 'subsample': 0.2799483785573857, 'dropout_rate': 0.1906887076148941, 'ccp_alpha': 0.0011769202696929836}. Best is trial 690 with value: 0.6691837560454439.[0m
[32m[I 2022-04-23 07:00:35,376][0m Trial 830 finished with value: 0.5 and parameters: {'loss': 'coxph', 'learning_rate': 0.03166823039300182, 'n_estimators': 564, 'criterion': 'absolute_error', 'min_samples_split': 9, 'min_samples_leaf': 4, 'min_weight_fraction_leaf': 0.05576649378257823, 'min_impurity_decrease': 0.48823514321024386, 'max_features': 0.6400319667640377, 'subsample': 0.3124438124936097, 'dropout_rate': 0.24637090369727327, 'ccp_alpha': 0.0014550166919874517}. Best is trial 690 with value: 0.6691837560454439.[0m
[32m[I 2022-04-23 07:02:57,202][0m Trial 831 finished with value: 0.6540341976229824 and parameters: {'loss': 'coxph', 'learning_rate': 0.06755977161848632, 'n_estimators': 777, 'criterion': 'friedman_mse', 'min_samples_split': 9, 'min_samples_leaf': 4, 'min_weight_fraction_leaf': 0.06850617743223632, 'min_impurity_decrease': 0.5125538982916102, 'max_features': 0.5212462989080627, 'subsample': 0.23066700244639876, 'dropout_rate': 0.20942490511453224, 'ccp_alpha': 0.15824127145991249}. Best is trial 690 with value: 0.6691837560454439.[0m
[32m[I 2022-04-23 07:03:14,489][0m Trial 832 finished with value: 0.6548195931602854 and parameters: {'loss': 'coxph', 'learning_rate': 0.05483445599134729, 'n_estimators': 533, 'criterion': 'friedman_mse', 'min_samples_split': 9, 'min_samples_leaf': 5, 'min_weight_fraction_leaf': 0.04624251676842009, 'min_impurity_decrease': 0.8480823227290214, 'max_features': 0.5404682971782777, 'subsample': 0.26187072808582246, 'dropout_rate': 0.8978311295897845, 'ccp_alpha': 0.09497468513805885}. Best is trial 690 with value: 0.6691837560454439.[0m
[32m[I 2022-04-23 07:04:52,203][0m Trial 833 finished with value: 0.5132549114240101 and parameters: {'loss': 'coxph', 'learning_rate': 0.0809011975813558, 'n_estimators': 638, 'criterion': 'friedman_mse', 'min_samples_split': 9, 'min_samples_leaf': 4, 'min_weight_fraction_leaf': 0.03332524739476338, 'min_impurity_decrease': 0.5313075279123819, 'max_features': 0.5982401713811004, 'subsample': 0.28938643200139225, 'dropout_rate': 0.18319682701384227, 'ccp_alpha': 0.3108774848825137}. Best is trial 690 with value: 0.6691837560454439.[0m
[32m[I 2022-04-23 07:06:44,797][0m Trial 834 finished with value: 0.5649055129696675 and parameters: {'loss': 'coxph', 'learning_rate': 8.696780486221821e-05, 'n_estimators': 675, 'criterion': 'friedman_mse', 'min_samples_split': 9, 'min_samples_leaf': 4, 'min_weight_fraction_leaf': 0.4545558573642833, 'min_impurity_decrease': 0.4502293762171057, 'max_features': 0.0966149748867548, 'subsample': 0.20714822865560634, 'dropout_rate': 0.15007718652957702, 'ccp_alpha': 0.0015049311998356224}. Best is trial 690 with value: 0.6691837560454439.[0m
[32m[I 2022-04-23 07:08:10,320][0m Trial 835 finished with value: 0.58370324378999 and parameters: {'loss': 'coxph', 'learning_rate': 0.04193197746131444, 'n_estimators': 602, 'criterion': 'friedman_mse', 'min_samples_split': 9, 'min_samples_leaf': 4, 'min_weight_fraction_leaf': 0.017269725011106678, 'min_impurity_decrease': 0.3350329275836846, 'max_features': 0.3656719898546388, 'subsample': 0.2420050246049733, 'dropout_rate': 0.22393999078949592, 'ccp_alpha': 0.2279233728617232}. Best is trial 690 with value: 0.6691837560454439.[0m
[32m[I 2022-04-23 07:09:27,861][0m Trial 836 finished with value: 0.6155915831008706 and parameters: {'loss': 'coxph', 'learning_rate': 0.06549057980823557, 'n_estimators': 560, 'criterion': 'friedman_mse', 'min_samples_split': 9, 'min_samples_leaf': 4, 'min_weight_fraction_leaf': 0.02581515270420783, 'min_impurity_decrease': 0.41724698213003775, 'max_features': 0.8204481060806638, 'subsample': 0.7086302575818421, 'dropout_rate': 0.1738502120811271, 'ccp_alpha': 0.09584311875462567}. Best is trial 690 with value: 0.6691837560454439.[0m
[32m[I 2022-04-23 07:10:48,034][0m Trial 837 finished with value: 0.6441860067851822 and parameters: {'loss': 'coxph', 'learning_rate': 0.08274593961294234, 'n_estimators': 584, 'criterion': 'friedman_mse', 'min_samples_split': 9, 'min_samples_leaf': 4, 'min_weight_fraction_leaf': 0.14812708385164478, 'min_impurity_decrease': 0.569037175907495, 'max_features': 0.5713301008541096, 'subsample': 0.2760949978507282, 'dropout_rate': 0.20021975399711983, 'ccp_alpha': 0.14681549045180392}. Best is trial 690 with value: 0.6691837560454439.[0m
[32m[I 2022-04-23 07:12:28,284][0m Trial 838 finished with value: 0.6495926593184542 and parameters: {'loss': 'coxph', 'learning_rate': 0.05061356784305512, 'n_estimators': 624, 'criterion': 'friedman_mse', 'min_samples_split': 9, 'min_samples_leaf': 5, 'min_weight_fraction_leaf': 0.05819650046510637, 'min_impurity_decrease': 0.5002041563977953, 'max_features': 0.6200660435317106, 'subsample': 0.31587379734349563, 'dropout_rate': 0.1314289732252307, 'ccp_alpha': 0.08808543339886146}. Best is trial 690 with value: 0.6691837560454439.[0m
[32m[I 2022-04-23 07:13:17,227][0m Trial 839 finished with value: 0.5 and parameters: {'loss': 'coxph', 'learning_rate': 0.06379671994841278, 'n_estimators': 545, 'criterion': 'squared_error', 'min_samples_split': 9, 'min_samples_leaf': 4, 'min_weight_fraction_leaf': 0.009072628372079169, 'min_impurity_decrease': 0.4769490848884676, 'max_features': 0.6390579058326055, 'subsample': 0.22370847821158246, 'dropout_rate': 0.48484297751915817, 'ccp_alpha': 0.21304101504238682}. Best is trial 690 with value: 0.6691837560454439.[0m
[32m[I 2022-04-23 07:13:29,206][0m Trial 840 finished with value: 0.6641836436365874 and parameters: {'loss': 'coxph', 'learning_rate': 0.0343994002659896, 'n_estimators': 216, 'criterion': 'friedman_mse', 'min_samples_split': 8, 'min_samples_leaf': 4, 'min_weight_fraction_leaf': 0.07193219690690338, 'min_impurity_decrease': 0.39249621556468356, 'max_features': 0.5424195697670973, 'subsample': 0.2554529269892536, 'dropout_rate': 0.24796286455747782, 'ccp_alpha': 0.10118846128738432}. Best is trial 690 with value: 0.6691837560454439.[0m
[32m[I 2022-04-23 07:15:39,704][0m Trial 841 finished with value: 0.6573295960332513 and parameters: {'loss': 'coxph', 'learning_rate': 0.030394481360611687, 'n_estimators': 752, 'criterion': 'friedman_mse', 'min_samples_split': 8, 'min_samples_leaf': 4, 'min_weight_fraction_leaf': 0.0724634053705504, 'min_impurity_decrease': 0.3568449142904598, 'max_features': 0.556481514811567, 'subsample': 0.24537965062907446, 'dropout_rate': 0.22375213388298787, 'ccp_alpha': 0.09727076125052585}. Best is trial 690 with value: 0.6691837560454439.[0m
[32m[I 2022-04-23 07:15:54,629][0m Trial 842 finished with value: 0.5875007675449703 and parameters: {'loss': 'coxph', 'learning_rate': 0.026317947354532897, 'n_estimators': 235, 'criterion': 'friedman_mse', 'min_samples_split': 8, 'min_samples_leaf': 4, 'min_weight_fraction_leaf': 0.07344520422733129, 'min_impurity_decrease': 0.3259732458413427, 'max_features': 0.594155177389993, 'subsample': 0.19574492860492115, 'dropout_rate': 0.1627163293813806, 'ccp_alpha': 0.2612561427209248}. Best is trial 690 with value: 0.6691837560454439.[0m
[32m[I 2022-04-23 07:16:07,792][0m Trial 843 finished with value: 0.6553441263841313 and parameters: {'loss': 'coxph', 'learning_rate': 0.034897326471831094, 'n_estimators': 220, 'criterion': 'friedman_mse', 'min_samples_split': 7, 'min_samples_leaf': 4, 'min_weight_fraction_leaf': 0.06745356925485904, 'min_impurity_decrease': 0.40732066160027414, 'max_features': 0.5482750586148938, 'subsample': 0.22698586526242015, 'dropout_rate': 0.1971221872285406, 'ccp_alpha': 0.0878371489216041}. Best is trial 690 with value: 0.6691837560454439.[0m
/media/san2_ssd/data/Workdir/survival/venv/lib/python3.8/site-packages/sksurv/ensemble/boosting.py:955: RuntimeWarning: divide by zero encountered in log
  time = numpy.log(time)
/media/san2_ssd/data/Workdir/survival/venv/lib/python3.8/site-packages/sksurv/ensemble/boosting.py:955: RuntimeWarning: divide by zero encountered in log
  time = numpy.log(time)
/media/san2_ssd/data/Workdir/survival/venv/lib/python3.8/site-packages/sksurv/ensemble/boosting.py:955: RuntimeWarning: divide by zero encountered in log
  time = numpy.log(time)
/media/san2_ssd/data/Workdir/survival/venv/lib/python3.8/site-packages/sksurv/ensemble/boosting.py:955: RuntimeWarning: divide by zero encountered in log
  time = numpy.log(time)
[32m[I 2022-04-23 07:16:33,359][0m Trial 844 finished with value: -0.7362530568822494 and parameters: {'loss': 'squared', 'learning_rate': 0.03176645009219495, 'n_estimators': 702, 'criterion': 'friedman_mse', 'min_samples_split': 8, 'min_samples_leaf': 4, 'min_weight_fraction_leaf': 0.07355050246168589, 'min_impurity_decrease': 0.3723486073487609, 'max_features': 0.573349634277453, 'subsample': 0.25661068602975073, 'dropout_rate': 0.11421731868073598, 'ccp_alpha': 0.1941344439552173}. Best is trial 690 with value: 0.6691837560454439.[0m
[32m[I 2022-04-23 07:18:12,333][0m Trial 845 finished with value: 0.5 and parameters: {'loss': 'coxph', 'learning_rate': 0.04190350066050696, 'n_estimators': 667, 'criterion': 'friedman_mse', 'min_samples_split': 8, 'min_samples_leaf': 4, 'min_weight_fraction_leaf': 0.02082162571058801, 'min_impurity_decrease': 0.36696671448376006, 'max_features': 0.5406164414232323, 'subsample': 0.2942144765979565, 'dropout_rate': 0.2381356682299995, 'ccp_alpha': 0.4733364378158169}. Best is trial 690 with value: 0.6691837560454439.[0m
[32m[I 2022-04-23 07:19:52,422][0m Trial 846 finished with value: 0.6566274634691088 and parameters: {'loss': 'coxph', 'learning_rate': 0.03660033776003267, 'n_estimators': 637, 'criterion': 'friedman_mse', 'min_samples_split': 9, 'min_samples_leaf': 4, 'min_weight_fraction_leaf': 0.06344397351882734, 'min_impurity_decrease': 0.3975050667758747, 'max_features': 0.5783774180648819, 'subsample': 0.2140993564422337, 'dropout_rate': 0.1766931820268361, 'ccp_alpha': 0.09150528495338028}. Best is trial 690 with value: 0.6691837560454439.[0m
[32m[I 2022-04-23 07:20:04,227][0m Trial 847 finished with value: 0.6553642910880533 and parameters: {'loss': 'coxph', 'learning_rate': 0.023883573872847577, 'n_estimators': 203, 'criterion': 'friedman_mse', 'min_samples_split': 9, 'min_samples_leaf': 4, 'min_weight_fraction_leaf': 0.033357203942625854, 'min_impurity_decrease': 0.3844755210941264, 'max_features': 0.6097906825236388, 'subsample': 0.18034288885287647, 'dropout_rate': 0.21373250499734667, 'ccp_alpha': 0.002360249046335347}. Best is trial 690 with value: 0.6691837560454439.[0m
[32m[I 2022-04-23 07:20:12,020][0m Trial 848 finished with value: 0.5148756023171417 and parameters: {'loss': 'coxph', 'learning_rate': 0.037913820759795436, 'n_estimators': 162, 'criterion': 'friedman_mse', 'min_samples_split': 9, 'min_samples_leaf': 4, 'min_weight_fraction_leaf': 0.012076605228445128, 'min_impurity_decrease': 0.41101794967862215, 'max_features': 0.5573848018781368, 'subsample': 0.2730856807003228, 'dropout_rate': 0.14143895415792468, 'ccp_alpha': 0.34466231500914163}. Best is trial 690 with value: 0.6691837560454439.[0m
[32m[I 2022-04-23 07:20:23,073][0m Trial 849 finished with value: 0.6582449018166054 and parameters: {'loss': 'coxph', 'learning_rate': 0.04779761685193442, 'n_estimators': 195, 'criterion': 'friedman_mse', 'min_samples_split': 7, 'min_samples_leaf': 5, 'min_weight_fraction_leaf': 0.0016466606350983206, 'min_impurity_decrease': 0.3642893874758652, 'max_features': 0.588091516373218, 'subsample': 0.2463461376222554, 'dropout_rate': 0.19266979125368255, 'ccp_alpha': 0.0014903039026203536}. Best is trial 690 with value: 0.6691837560454439.[0m
[32m[I 2022-04-23 07:22:09,944][0m Trial 850 finished with value: 0.6004714397560619 and parameters: {'loss': 'coxph', 'learning_rate': 0.04265718522515901, 'n_estimators': 690, 'criterion': 'friedman_mse', 'min_samples_split': 8, 'min_samples_leaf': 4, 'min_weight_fraction_leaf': 0.04602586089349339, 'min_impurity_decrease': 0.4476861069472638, 'max_features': 0.6251006258886289, 'subsample': 0.3325265334466525, 'dropout_rate': 0.23345952987590837, 'ccp_alpha': 0.17014423782081606}. Best is trial 690 with value: 0.6691837560454439.[0m
[32m[I 2022-04-23 07:23:53,694][0m Trial 851 finished with value: 0.6443690180696753 and parameters: {'loss': 'coxph', 'learning_rate': 0.030437592454699434, 'n_estimators': 643, 'criterion': 'friedman_mse', 'min_samples_split': 6, 'min_samples_leaf': 4, 'min_weight_fraction_leaf': 0.06902779144128003, 'min_impurity_decrease': 0.3942964856534241, 'max_features': 0.6503241820326007, 'subsample': 0.2915294785764959, 'dropout_rate': 0.1596541740201397, 'ccp_alpha': 0.11159487514169919}. Best is trial 690 with value: 0.6691837560454439.[0m
[32m[I 2022-04-23 07:24:55,114][0m Trial 852 finished with value: 0.5 and parameters: {'loss': 'coxph', 'learning_rate': 0.0504285866430869, 'n_estimators': 517, 'criterion': 'absolute_error', 'min_samples_split': 9, 'min_samples_leaf': 4, 'min_weight_fraction_leaf': 0.05989035272688521, 'min_impurity_decrease': 0.34227664908602395, 'max_features': 0.533603036094019, 'subsample': 0.3052425236580931, 'dropout_rate': 0.2522718225757268, 'ccp_alpha': 0.2644572152053448}. Best is trial 690 with value: 0.6691837560454439.[0m
[32m[I 2022-04-23 07:25:04,151][0m Trial 853 finished with value: 0.6131518265211905 and parameters: {'loss': 'coxph', 'learning_rate': 0.03710676151216075, 'n_estimators': 181, 'criterion': 'friedman_mse', 'min_samples_split': 9, 'min_samples_leaf': 4, 'min_weight_fraction_leaf': 0.2713550455083582, 'min_impurity_decrease': 0.4214417150264745, 'max_features': 0.6709782631873499, 'subsample': 0.25842981206977766, 'dropout_rate': 0.20843490956455965, 'ccp_alpha': 0.09273208876213543}. Best is trial 690 with value: 0.6691837560454439.[0m
