[32m[I 2022-04-21 18:18:34,161][0m Trial 514 finished with value: 0.8404933842993623 and parameters: {'loss': 'coxph', 'learning_rate': 8.025214488282967e-05, 'n_estimators': 216, 'criterion': 'friedman_mse', 'min_samples_split': 3, 'min_samples_leaf': 2, 'min_weight_fraction_leaf': 0.17647210512506586, 'min_impurity_decrease': 0.2988645489021671, 'max_features': 0.3856230319853805, 'subsample': 0.06206849165029928, 'dropout_rate': 0.11222794108871369, 'ccp_alpha': 0.2743382213868736}. Best is trial 244 with value: 0.8474070660226068.[0m
/media/san2_ssd/data/Workdir/survival/venv/lib/python3.8/site-packages/sksurv/ensemble/boosting.py:955: RuntimeWarning: divide by zero encountered in log
  time = numpy.log(time)
/media/san2_ssd/data/Workdir/survival/venv/lib/python3.8/site-packages/sksurv/ensemble/boosting.py:955: RuntimeWarning: divide by zero encountered in log
  time = numpy.log(time)
/media/san2_ssd/data/Workdir/survival/venv/lib/python3.8/site-packages/sksurv/ensemble/boosting.py:955: RuntimeWarning: divide by zero encountered in log
  time = numpy.log(time)
/media/san2_ssd/data/Workdir/survival/venv/lib/python3.8/site-packages/sksurv/ensemble/boosting.py:955: RuntimeWarning: divide by zero encountered in log
  time = numpy.log(time)
[32m[I 2022-04-21 18:19:09,534][0m Trial 515 finished with value: -0.46613378432860025 and parameters: {'loss': 'squared', 'learning_rate': 0.00015793900555108095, 'n_estimators': 773, 'criterion': 'friedman_mse', 'min_samples_split': 6, 'min_samples_leaf': 2, 'min_weight_fraction_leaf': 0.19017026972115061, 'min_impurity_decrease': 0.5471391940810644, 'max_features': 0.3455876368882502, 'subsample': 0.3409874136176818, 'dropout_rate': 0.14870512144294123, 'ccp_alpha': 0.002312527927487623}. Best is trial 244 with value: 0.8474070660226068.[0m
[32m[I 2022-04-21 18:22:48,359][0m Trial 516 finished with value: 0.8431605331417303 and parameters: {'loss': 'coxph', 'learning_rate': 0.006382085522892884, 'n_estimators': 966, 'criterion': 'friedman_mse', 'min_samples_split': 8, 'min_samples_leaf': 5, 'min_weight_fraction_leaf': 0.21365114522596382, 'min_impurity_decrease': 0.7881468450031945, 'max_features': 0.4558935090960645, 'subsample': 0.12304681773537722, 'dropout_rate': 0.22571684636891676, 'ccp_alpha': 0.1635532609845587}. Best is trial 244 with value: 0.8474070660226068.[0m
[32m[I 2022-04-21 18:22:59,325][0m Trial 517 finished with value: 0.65 and parameters: {'loss': 'coxph', 'learning_rate': 6.425675717891091e-05, 'n_estimators': 273, 'criterion': 'friedman_mse', 'min_samples_split': 3, 'min_samples_leaf': 2, 'min_weight_fraction_leaf': 0.16435344730639526, 'min_impurity_decrease': 0.2569753253766057, 'max_features': 0.2873757665355308, 'subsample': 0.035187138179448296, 'dropout_rate': 0.5744451209337467, 'ccp_alpha': 1.9221168117818705}. Best is trial 244 with value: 0.8474070660226068.[0m
[32m[I 2022-04-21 18:23:11,379][0m Trial 518 finished with value: 0.65 and parameters: {'loss': 'coxph', 'learning_rate': 0.0002194337950168982, 'n_estimators': 234, 'criterion': 'friedman_mse', 'min_samples_split': 4, 'min_samples_leaf': 1, 'min_weight_fraction_leaf': 0.1797336445615948, 'min_impurity_decrease': 0.3242614590864073, 'max_features': 0.964287190671848, 'subsample': 0.08402933815064974, 'dropout_rate': 0.1688725521638903, 'ccp_alpha': 1.394303848607552}. Best is trial 244 with value: 0.8474070660226068.[0m
[32m[I 2022-04-21 18:23:17,919][0m Trial 519 finished with value: 0.65 and parameters: {'loss': 'coxph', 'learning_rate': 9.784865077953293e-05, 'n_estimators': 328, 'criterion': 'squared_error', 'min_samples_split': 5, 'min_samples_leaf': 2, 'min_weight_fraction_leaf': 0.1949063921551616, 'min_impurity_decrease': 0.37074802629757564, 'max_features': 0.3245887873931998, 'subsample': 0.009988907463312796, 'dropout_rate': 0.9597292672539922, 'ccp_alpha': 0.08812146636359873}. Best is trial 244 with value: 0.8474070660226068.[0m
[32m[I 2022-04-21 18:25:48,149][0m Trial 520 finished with value: 0.6758484765476891 and parameters: {'loss': 'coxph', 'learning_rate': 0.00014639497971366845, 'n_estimators': 834, 'criterion': 'friedman_mse', 'min_samples_split': 2, 'min_samples_leaf': 7, 'min_weight_fraction_leaf': 0.2040791533059374, 'min_impurity_decrease': 0.2311429225444327, 'max_features': 0.4935254642558872, 'subsample': 0.5646382776156657, 'dropout_rate': 0.12860994270358272, 'ccp_alpha': 0.3338590373707028}. Best is trial 244 with value: 0.8474070660226068.[0m
[32m[I 2022-04-21 18:25:59,993][0m Trial 521 finished with value: 0.8445582200291133 and parameters: {'loss': 'coxph', 'learning_rate': 9.920450824034604e-05, 'n_estimators': 250, 'criterion': 'friedman_mse', 'min_samples_split': 4, 'min_samples_leaf': 2, 'min_weight_fraction_leaf': 0.1672273607463073, 'min_impurity_decrease': 0.7377274551920817, 'max_features': 0.34982459769783925, 'subsample': 0.1075900696475697, 'dropout_rate': 0.14651629793009252, 'ccp_alpha': 0.17293189992829094}. Best is trial 244 with value: 0.8474070660226068.[0m
[32m[I 2022-04-21 18:27:57,245][0m Trial 522 finished with value: 0.8392754938153646 and parameters: {'loss': 'coxph', 'learning_rate': 4.6322932222931995e-05, 'n_estimators': 712, 'criterion': 'friedman_mse', 'min_samples_split': 3, 'min_samples_leaf': 2, 'min_weight_fraction_leaf': 0.15411779677805768, 'min_impurity_decrease': 0.1289059843173385, 'max_features': 0.37018697034664877, 'subsample': 0.06573898946823079, 'dropout_rate': 0.2061259504310493, 'ccp_alpha': 0.5800613162068721}. Best is trial 244 with value: 0.8474070660226068.[0m
[32m[I 2022-04-21 18:27:58,902][0m Trial 523 finished with value: 0.8398568350738479 and parameters: {'loss': 'coxph', 'learning_rate': 0.000126425389338961, 'n_estimators': 121, 'criterion': 'friedman_mse', 'min_samples_split': 3, 'min_samples_leaf': 4, 'min_weight_fraction_leaf': 0.18099561107894058, 'min_impurity_decrease': 0.2836835965052441, 'max_features': 0.2578165657810526, 'subsample': 0.085112872334105, 'dropout_rate': 0.99389891932312, 'ccp_alpha': 0.24708132858248394}. Best is trial 244 with value: 0.8474070660226068.[0m
[32m[I 2022-04-21 18:28:13,243][0m Trial 524 finished with value: 0.8400109772565468 and parameters: {'loss': 'coxph', 'learning_rate': 6.079021880741649e-05, 'n_estimators': 269, 'criterion': 'absolute_error', 'min_samples_split': 3, 'min_samples_leaf': 2, 'min_weight_fraction_leaf': 0.14278052083710396, 'min_impurity_decrease': 0.3480559601717685, 'max_features': 0.2166633487171404, 'subsample': 0.04716220633681236, 'dropout_rate': 0.11342549409827732, 'ccp_alpha': 0.09351959870235847}. Best is trial 244 with value: 0.8474070660226068.[0m
[32m[I 2022-04-21 18:28:16,569][0m Trial 525 finished with value: 0.8414421813144918 and parameters: {'loss': 'coxph', 'learning_rate': 0.020400177602592495, 'n_estimators': 150, 'criterion': 'friedman_mse', 'min_samples_split': 4, 'min_samples_leaf': 1, 'min_weight_fraction_leaf': 0.18949833199780997, 'min_impurity_decrease': 0.3085640077915093, 'max_features': 0.2993567192705064, 'subsample': 0.1352752854265157, 'dropout_rate': 0.6431731486922608, 'ccp_alpha': 0.16762926421810043}. Best is trial 244 with value: 0.8474070660226068.[0m
[32m[I 2022-04-21 18:28:29,287][0m Trial 526 finished with value: 0.8418059345612635 and parameters: {'loss': 'coxph', 'learning_rate': 7.824923630136e-05, 'n_estimators': 226, 'criterion': 'friedman_mse', 'min_samples_split': 3, 'min_samples_leaf': 2, 'min_weight_fraction_leaf': 0.21174902328853853, 'min_impurity_decrease': 0.3984594796014825, 'max_features': 0.38745817448151765, 'subsample': 0.15590273472925942, 'dropout_rate': 0.07921925880351804, 'ccp_alpha': 0.0020408328430796866}. Best is trial 244 with value: 0.8474070660226068.[0m
[32m[I 2022-04-21 18:30:01,163][0m Trial 527 finished with value: 0.7165493504977476 and parameters: {'loss': 'coxph', 'learning_rate': 0.004976441001828895, 'n_estimators': 672, 'criterion': 'friedman_mse', 'min_samples_split': 5, 'min_samples_leaf': 2, 'min_weight_fraction_leaf': 0.17221378274721472, 'min_impurity_decrease': 0.3214955615813657, 'max_features': 0.4072972548617432, 'subsample': 0.11203919568859068, 'dropout_rate': 0.16439472894932952, 'ccp_alpha': 0.7223074885163427}. Best is trial 244 with value: 0.8474070660226068.[0m
[32m[I 2022-04-21 18:30:31,081][0m Trial 528 finished with value: 0.8427134762865673 and parameters: {'loss': 'coxph', 'learning_rate': 0.0002808692983780061, 'n_estimators': 311, 'criterion': 'friedman_mse', 'min_samples_split': 2, 'min_samples_leaf': 2, 'min_weight_fraction_leaf': 0.19873299331632338, 'min_impurity_decrease': 0.278833832081712, 'max_features': 0.441553048784467, 'subsample': 0.06838945273307369, 'dropout_rate': 0.13400079855294572, 'ccp_alpha': 0.38900602151576064}. Best is trial 244 with value: 0.8474070660226068.[0m
[32m[I 2022-04-21 18:30:49,026][0m Trial 529 finished with value: 0.8447905228428555 and parameters: {'loss': 'coxph', 'learning_rate': 0.00011706517018847198, 'n_estimators': 284, 'criterion': 'friedman_mse', 'min_samples_split': 3, 'min_samples_leaf': 1, 'min_weight_fraction_leaf': 0.16195880400623547, 'min_impurity_decrease': 0.8876768450612789, 'max_features': 0.32010256087665223, 'subsample': 0.03215786438731589, 'dropout_rate': 0.1837272306488674, 'ccp_alpha': 0.08405730037046716}. Best is trial 244 with value: 0.8474070660226068.[0m
[32m[I 2022-04-21 18:31:03,141][0m Trial 530 finished with value: 0.65 and parameters: {'loss': 'coxph', 'learning_rate': 0.00017264751710482026, 'n_estimators': 261, 'criterion': 'friedman_mse', 'min_samples_split': 5, 'min_samples_leaf': 8, 'min_weight_fraction_leaf': 0.12753951547459885, 'min_impurity_decrease': 0.3372121036101114, 'max_features': 0.33924332901379395, 'subsample': 0.09817120098400423, 'dropout_rate': 0.10005090439784799, 'ccp_alpha': 0.2610483804613743}. Best is trial 244 with value: 0.8474070660226068.[0m
[32m[I 2022-04-21 18:31:16,863][0m Trial 531 finished with value: 0.8452492218268969 and parameters: {'loss': 'coxph', 'learning_rate': 0.007165309639117222, 'n_estimators': 240, 'criterion': 'friedman_mse', 'min_samples_split': 4, 'min_samples_leaf': 2, 'min_weight_fraction_leaf': 0.18614277420443878, 'min_impurity_decrease': 0.7604881585899596, 'max_features': 0.3632919104793532, 'subsample': 0.07714132201189589, 'dropout_rate': 0.1560072430831151, 'ccp_alpha': 0.16184596832016673}. Best is trial 244 with value: 0.8474070660226068.[0m
[32m[I 2022-04-21 18:31:38,134][0m Trial 532 finished with value: 0.8443696891054222 and parameters: {'loss': 'coxph', 'learning_rate': 3.541084998002871e-05, 'n_estimators': 304, 'criterion': 'friedman_mse', 'min_samples_split': 3, 'min_samples_leaf': 2, 'min_weight_fraction_leaf': 0.1761133672678075, 'min_impurity_decrease': 0.24808929078792383, 'max_features': 0.2768034565037567, 'subsample': 0.05755409888153637, 'dropout_rate': 0.024024122107025148, 'ccp_alpha': 0.09250135297593316}. Best is trial 244 with value: 0.8474070660226068.[0m
[32m[I 2022-04-21 18:31:45,853][0m Trial 533 finished with value: 0.8411822823431304 and parameters: {'loss': 'coxph', 'learning_rate': 8.217577705739998e-05, 'n_estimators': 210, 'criterion': 'friedman_mse', 'min_samples_split': 3, 'min_samples_leaf': 2, 'min_weight_fraction_leaf': 0.1536104141120397, 'min_impurity_decrease': 0.352376275984066, 'max_features': 0.3033946007164655, 'subsample': 0.12217756622640216, 'dropout_rate': 0.4475233156076105, 'ccp_alpha': 0.0029022097863995178}. Best is trial 244 with value: 0.8474070660226068.[0m
/media/san2_ssd/data/Workdir/survival/venv/lib/python3.8/site-packages/sksurv/ensemble/boosting.py:955: RuntimeWarning: divide by zero encountered in log
  time = numpy.log(time)
/media/san2_ssd/data/Workdir/survival/venv/lib/python3.8/site-packages/sksurv/ensemble/boosting.py:955: RuntimeWarning: divide by zero encountered in log
  time = numpy.log(time)
/media/san2_ssd/data/Workdir/survival/venv/lib/python3.8/site-packages/sksurv/ensemble/boosting.py:955: RuntimeWarning: divide by zero encountered in log
  time = numpy.log(time)
/media/san2_ssd/data/Workdir/survival/venv/lib/python3.8/site-packages/sksurv/ensemble/boosting.py:955: RuntimeWarning: divide by zero encountered in log
  time = numpy.log(time)
[32m[I 2022-04-21 18:31:49,094][0m Trial 534 finished with value: -0.4598665909009626 and parameters: {'loss': 'squared', 'learning_rate': 0.011805799245433892, 'n_estimators': 252, 'criterion': 'friedman_mse', 'min_samples_split': 2, 'min_samples_leaf': 1, 'min_weight_fraction_leaf': 0.19765647816918672, 'min_impurity_decrease': 0.29800216385852835, 'max_features': 0.4200849283444543, 'subsample': 0.212284415479068, 'dropout_rate': 0.18993702140337548, 'ccp_alpha': 1.77073694468548}. Best is trial 244 with value: 0.8474070660226068.[0m
[32m[I 2022-04-21 18:33:46,073][0m Trial 535 finished with value: 0.65 and parameters: {'loss': 'coxph', 'learning_rate': 0.00020160213744283898, 'n_estimators': 888, 'criterion': 'friedman_mse', 'min_samples_split': 3, 'min_samples_leaf': 2, 'min_weight_fraction_leaf': 0.1860138950629439, 'min_impurity_decrease': 0.677577525104381, 'max_features': 0.33483489961293406, 'subsample': 0.9953278965052824, 'dropout_rate': 0.5118511925160738, 'ccp_alpha': 0.2333638146446231}. Best is trial 244 with value: 0.8474070660226068.[0m
[32m[I 2022-04-21 18:33:53,591][0m Trial 536 finished with value: 0.703384338601931 and parameters: {'loss': 'coxph', 'learning_rate': 5.849047359379377e-05, 'n_estimators': 196, 'criterion': 'friedman_mse', 'min_samples_split': 4, 'min_samples_leaf': 2, 'min_weight_fraction_leaf': 0.4266367849122726, 'min_impurity_decrease': 0.31214518126325885, 'max_features': 0.36828390474601735, 'subsample': 0.09228132534524347, 'dropout_rate': 0.060628131706756516, 'ccp_alpha': 0.4706889174963621}. Best is trial 244 with value: 0.8474070660226068.[0m
[32m[I 2022-04-21 18:34:13,512][0m Trial 537 finished with value: 0.65 and parameters: {'loss': 'coxph', 'learning_rate': 0.00010495536224418636, 'n_estimators': 324, 'criterion': 'friedman_mse', 'min_samples_split': 7, 'min_samples_leaf': 1, 'min_weight_fraction_leaf': 0.20530780756383507, 'min_impurity_decrease': 0.2719812777424161, 'max_features': 0.24202005524827408, 'subsample': 0.02418486159627658, 'dropout_rate': 0.12406783264299098, 'ccp_alpha': 0.296187149076122}. Best is trial 244 with value: 0.8474070660226068.[0m
[32m[I 2022-04-21 18:34:28,014][0m Trial 538 finished with value: 0.8424136938021526 and parameters: {'loss': 'coxph', 'learning_rate': 0.0001384425470979103, 'n_estimators': 283, 'criterion': 'friedman_mse', 'min_samples_split': 5, 'min_samples_leaf': 2, 'min_weight_fraction_leaf': 0.009069922263478608, 'min_impurity_decrease': 0.32971115398463674, 'max_features': 0.39059054165858037, 'subsample': 0.0559684335819884, 'dropout_rate': 0.16780722516223487, 'ccp_alpha': 0.14881130695217282}. Best is trial 244 with value: 0.8474070660226068.[0m
[32m[I 2022-04-21 18:34:44,510][0m Trial 539 finished with value: 0.843401448781951 and parameters: {'loss': 'coxph', 'learning_rate': 0.003678226923327458, 'n_estimators': 231, 'criterion': 'friedman_mse', 'min_samples_split': 3, 'min_samples_leaf': 2, 'min_weight_fraction_leaf': 0.17062410615304743, 'min_impurity_decrease': 0.29134787757453845, 'max_features': 0.29060464934700947, 'subsample': 0.14159864945849374, 'dropout_rate': 0.0018554664290292983, 'ccp_alpha': 0.09363980147690687}. Best is trial 244 with value: 0.8474070660226068.[0m
[32m[I 2022-04-21 18:35:02,494][0m Trial 540 finished with value: 0.84014963288835 and parameters: {'loss': 'coxph', 'learning_rate': 7.122319124642692e-05, 'n_estimators': 296, 'criterion': 'squared_error', 'min_samples_split': 3, 'min_samples_leaf': 2, 'min_weight_fraction_leaf': 0.041365193790346005, 'min_impurity_decrease': 0.2201547856216109, 'max_features': 0.5126219552138239, 'subsample': 0.08034324193794015, 'dropout_rate': 0.23665998779607705, 'ccp_alpha': 0.33950181826326903}. Best is trial 244 with value: 0.8474070660226068.[0m
[32m[I 2022-04-21 18:35:17,101][0m Trial 541 finished with value: 0.8437236778184353 and parameters: {'loss': 'coxph', 'learning_rate': 4.878278467167485e-05, 'n_estimators': 273, 'criterion': 'friedman_mse', 'min_samples_split': 4, 'min_samples_leaf': 1, 'min_weight_fraction_leaf': 0.21552615996747637, 'min_impurity_decrease': 0.3755208294595526, 'max_features': 0.3545916470329788, 'subsample': 0.10768625377098962, 'dropout_rate': 0.14100635274540513, 'ccp_alpha': 0.19837248795739}. Best is trial 244 with value: 0.8474070660226068.[0m
[32m[I 2022-04-21 18:35:28,535][0m Trial 542 finished with value: 0.8438256340940118 and parameters: {'loss': 'coxph', 'learning_rate': 8.825782425381306e-05, 'n_estimators': 222, 'criterion': 'friedman_mse', 'min_samples_split': 3, 'min_samples_leaf': 2, 'min_weight_fraction_leaf': 0.14279852013107813, 'min_impurity_decrease': 0.2574985444995152, 'max_features': 0.31723253195334616, 'subsample': 0.04735039306973519, 'dropout_rate': 0.21319039483097701, 'ccp_alpha': 0.07975923526403914}. Best is trial 244 with value: 0.8474070660226068.[0m
[32m[I 2022-04-21 18:35:58,420][0m Trial 543 finished with value: 0.8441260102966783 and parameters: {'loss': 'coxph', 'learning_rate': 0.00015829020686647586, 'n_estimators': 349, 'criterion': 'friedman_mse', 'min_samples_split': 6, 'min_samples_leaf': 2, 'min_weight_fraction_leaf': 0.284935007992695, 'min_impurity_decrease': 0.34676518153943936, 'max_features': 0.39796899553927245, 'subsample': 0.0919458010124205, 'dropout_rate': 0.09878054381205426, 'ccp_alpha': 0.0017382236466381164}. Best is trial 244 with value: 0.8474070660226068.[0m
[32m[I 2022-04-21 18:36:20,872][0m Trial 544 finished with value: 0.65 and parameters: {'loss': 'coxph', 'learning_rate': 0.008509306822914776, 'n_estimators': 473, 'criterion': 'friedman_mse', 'min_samples_split': 2, 'min_samples_leaf': 1, 'min_weight_fraction_leaf': 0.11192038350177586, 'min_impurity_decrease': 0.3080788525284112, 'max_features': 0.267557910740617, 'subsample': 0.17750291306421495, 'dropout_rate': 0.6125844297628591, 'ccp_alpha': 3.956681121555396}. Best is trial 244 with value: 0.8474070660226068.[0m
[32m[I 2022-04-21 18:36:35,429][0m Trial 545 finished with value: 0.834442524784716 and parameters: {'loss': 'coxph', 'learning_rate': 0.0001113267113315553, 'n_estimators': 263, 'criterion': 'absolute_error', 'min_samples_split': 4, 'min_samples_leaf': 2, 'min_weight_fraction_leaf': 0.16293625250215102, 'min_impurity_decrease': 0.3237115651439372, 'max_features': 0.4432349990429984, 'subsample': 0.06611895104584822, 'dropout_rate': 0.11753361790509545, 'ccp_alpha': 0.2402395417133926}. Best is trial 244 with value: 0.8474070660226068.[0m
[32m[I 2022-04-21 18:36:47,879][0m Trial 546 finished with value: 0.7318450474400788 and parameters: {'loss': 'coxph', 'learning_rate': 0.00022892530388056207, 'n_estimators': 245, 'criterion': 'friedman_mse', 'min_samples_split': 3, 'min_samples_leaf': 2, 'min_weight_fraction_leaf': 0.19083493849355238, 'min_impurity_decrease': 0.36630562530961436, 'max_features': 0.4238428638118626, 'subsample': 0.7944193559833901, 'dropout_rate': 0.04799102446530382, 'ccp_alpha': 0.15343018647334938}. Best is trial 244 with value: 0.8474070660226068.[0m
[32m[I 2022-04-21 18:37:11,071][0m Trial 547 finished with value: 0.8437228849065516 and parameters: {'loss': 'coxph', 'learning_rate': 3.165340605684029e-05, 'n_estimators': 312, 'criterion': 'friedman_mse', 'min_samples_split': 3, 'min_samples_leaf': 2, 'min_weight_fraction_leaf': 0.18001552522425618, 'min_impurity_decrease': 0.7876002827483023, 'max_features': 0.4725062829138959, 'subsample': 0.12796182048676463, 'dropout_rate': 0.14914347021210192, 'ccp_alpha': 0.08270292253032463}. Best is trial 244 with value: 0.8474070660226068.[0m
[32m[I 2022-04-21 18:37:30,209][0m Trial 548 finished with value: 0.8428619018947096 and parameters: {'loss': 'coxph', 'learning_rate': 0.0005461349710894001, 'n_estimators': 374, 'criterion': 'friedman_mse', 'min_samples_split': 5, 'min_samples_leaf': 2, 'min_weight_fraction_leaf': 0.19847206986818947, 'min_impurity_decrease': 0.6490594311464026, 'max_features': 0.33748801938724693, 'subsample': 0.04057493460270641, 'dropout_rate': 0.5506456806719939, 'ccp_alpha': 0.0013189487653863866}. Best is trial 244 with value: 0.8474070660226068.[0m
[32m[I 2022-04-21 18:37:48,742][0m Trial 549 finished with value: 0.65 and parameters: {'loss': 'coxph', 'learning_rate': 6.453317260109317e-05, 'n_estimators': 290, 'criterion': 'friedman_mse', 'min_samples_split': 3, 'min_samples_leaf': 1, 'min_weight_fraction_leaf': 0.3885096268633902, 'min_impurity_decrease': 0.16740818348155528, 'max_features': 0.8962093136909706, 'subsample': 0.005274613169042007, 'dropout_rate': 0.17659674998826913, 'ccp_alpha': 0.30733013407035037}. Best is trial 244 with value: 0.8474070660226068.[0m
[32m[I 2022-04-21 18:38:21,936][0m Trial 550 finished with value: 0.8438447625615975 and parameters: {'loss': 'coxph', 'learning_rate': 0.006438451826519179, 'n_estimators': 332, 'criterion': 'friedman_mse', 'min_samples_split': 3, 'min_samples_leaf': 2, 'min_weight_fraction_leaf': 0.1720457114246052, 'min_impurity_decrease': 0.2906661933301829, 'max_features': 0.37832997986230676, 'subsample': 0.10984775051701806, 'dropout_rate': 0.19613868510419522, 'ccp_alpha': 0.18126182141244224}. Best is trial 244 with value: 0.8474070660226068.[0m
