No protocol specified
[32m[I 2022-04-21 11:37:11,153][0m A new study created in memory with name: no-name-7a948838-8493-4f4a-8b73-d29ffac55f10[0m
[32m[I 2022-04-21 11:38:41,832][0m Trial 0 finished with value: 0.25 and parameters: {'loss': 'coxph', 'learning_rate': 0.002089694986057101, 'n_estimators': 469, 'criterion': 'squared_error', 'min_samples_split': 3, 'min_samples_leaf': 8, 'min_weight_fraction_leaf': 0.2974660172118987, 'min_impurity_decrease': 0.17230890977022792, 'max_features': 0.04793530734916888, 'subsample': 0.560482133832246, 'dropout_rate': 0.2406099334639653, 'ccp_alpha': 4.081879017088199}. Best is trial 0 with value: 0.25.[0m
/media/san2_ssd/data/Workdir/survival/venv/lib/python3.8/site-packages/sksurv/ensemble/boosting.py:955: RuntimeWarning: divide by zero encountered in log
  time = numpy.log(time)
/media/san2_ssd/data/Workdir/survival/venv/lib/python3.8/site-packages/sksurv/ensemble/boosting.py:955: RuntimeWarning: divide by zero encountered in log
  time = numpy.log(time)
/media/san2_ssd/data/Workdir/survival/venv/lib/python3.8/site-packages/sksurv/ensemble/boosting.py:955: RuntimeWarning: divide by zero encountered in log
  time = numpy.log(time)
/media/san2_ssd/data/Workdir/survival/venv/lib/python3.8/site-packages/sksurv/ensemble/boosting.py:955: RuntimeWarning: divide by zero encountered in log
  time = numpy.log(time)
[32m[I 2022-04-21 11:38:45,538][0m Trial 1 finished with value: -0.45 and parameters: {'loss': 'squared', 'learning_rate': 5.418975025114371e-05, 'n_estimators': 125, 'criterion': 'friedman_mse', 'min_samples_split': 9, 'min_samples_leaf': 1, 'min_weight_fraction_leaf': 0.1199080351865277, 'min_impurity_decrease': 0.1887268869957363, 'max_features': 0.8131707718398541, 'subsample': 0.36391031307343846, 'dropout_rate': 0.15248047194807357, 'ccp_alpha': 3.9364440169160084}. Best is trial 0 with value: 0.25.[0m
[32m[I 2022-04-21 11:38:58,132][0m Trial 2 finished with value: 0.25 and parameters: {'loss': 'coxph', 'learning_rate': 0.004471763724572777, 'n_estimators': 150, 'criterion': 'absolute_error', 'min_samples_split': 4, 'min_samples_leaf': 3, 'min_weight_fraction_leaf': 0.12659264697891243, 'min_impurity_decrease': 0.0874779763173592, 'max_features': 0.2567472065324172, 'subsample': 0.9540338739181409, 'dropout_rate': 0.6036073623544067, 'ccp_alpha': 4.308766554403985}. Best is trial 0 with value: 0.25.[0m
/media/san2_ssd/data/Workdir/survival/venv/lib/python3.8/site-packages/sksurv/ensemble/boosting.py:955: RuntimeWarning: divide by zero encountered in log
  time = numpy.log(time)
/media/san2_ssd/data/Workdir/survival/venv/lib/python3.8/site-packages/sksurv/ensemble/boosting.py:955: RuntimeWarning: divide by zero encountered in log
  time = numpy.log(time)
/media/san2_ssd/data/Workdir/survival/venv/lib/python3.8/site-packages/sksurv/ensemble/boosting.py:955: RuntimeWarning: divide by zero encountered in log
  time = numpy.log(time)
/media/san2_ssd/data/Workdir/survival/venv/lib/python3.8/site-packages/sksurv/ensemble/boosting.py:955: RuntimeWarning: divide by zero encountered in log
  time = numpy.log(time)
[32m[I 2022-04-21 11:39:02,565][0m Trial 3 finished with value: -0.45 and parameters: {'loss': 'squared', 'learning_rate': 0.00033324447037233636, 'n_estimators': 274, 'criterion': 'squared_error', 'min_samples_split': 9, 'min_samples_leaf': 4, 'min_weight_fraction_leaf': 0.3500768066027881, 'min_impurity_decrease': 0.3998362352520315, 'max_features': 0.8357734591474678, 'subsample': 0.5957243428260823, 'dropout_rate': 0.24586496309201156, 'ccp_alpha': 1.533955144493294}. Best is trial 0 with value: 0.25.[0m
/media/san2_ssd/data/Workdir/survival/venv/lib/python3.8/site-packages/sksurv/ensemble/boosting.py:955: RuntimeWarning: divide by zero encountered in log
  time = numpy.log(time)
/media/san2_ssd/data/Workdir/survival/venv/lib/python3.8/site-packages/sksurv/ensemble/boosting.py:955: RuntimeWarning: divide by zero encountered in log
  time = numpy.log(time)
/media/san2_ssd/data/Workdir/survival/venv/lib/python3.8/site-packages/sksurv/ensemble/boosting.py:955: RuntimeWarning: divide by zero encountered in log
  time = numpy.log(time)
/media/san2_ssd/data/Workdir/survival/venv/lib/python3.8/site-packages/sksurv/ensemble/boosting.py:955: RuntimeWarning: divide by zero encountered in log
  time = numpy.log(time)
[32m[I 2022-04-21 11:39:03,364][0m Trial 4 finished with value: -0.45 and parameters: {'loss': 'squared', 'learning_rate': 1.5205426286113736e-05, 'n_estimators': 182, 'criterion': 'squared_error', 'min_samples_split': 10, 'min_samples_leaf': 7, 'min_weight_fraction_leaf': 0.09739395094865311, 'min_impurity_decrease': 0.20306029159721314, 'max_features': 0.9526294945425163, 'subsample': 0.3231570336879274, 'dropout_rate': 0.8187012951976135, 'ccp_alpha': 3.389150714509438}. Best is trial 0 with value: 0.25.[0m
/media/san2_ssd/data/Workdir/survival/venv/lib/python3.8/site-packages/sksurv/ensemble/boosting.py:955: RuntimeWarning: divide by zero encountered in log
  time = numpy.log(time)
/media/san2_ssd/data/Workdir/survival/venv/lib/python3.8/site-packages/sksurv/ensemble/boosting.py:955: RuntimeWarning: divide by zero encountered in log
  time = numpy.log(time)
/media/san2_ssd/data/Workdir/survival/venv/lib/python3.8/site-packages/sksurv/ensemble/boosting.py:955: RuntimeWarning: divide by zero encountered in log
  time = numpy.log(time)
/media/san2_ssd/data/Workdir/survival/venv/lib/python3.8/site-packages/sksurv/ensemble/boosting.py:955: RuntimeWarning: divide by zero encountered in log
  time = numpy.log(time)
[32m[I 2022-04-21 11:39:04,021][0m Trial 5 finished with value: -0.45 and parameters: {'loss': 'squared', 'learning_rate': 0.004241004185483962, 'n_estimators': 130, 'criterion': 'absolute_error', 'min_samples_split': 9, 'min_samples_leaf': 2, 'min_weight_fraction_leaf': 0.3632432968761586, 'min_impurity_decrease': 0.4350069503395795, 'max_features': 0.014990763124350676, 'subsample': 0.3451123898549989, 'dropout_rate': 0.41327040402638204, 'ccp_alpha': 1.6458955616874875}. Best is trial 0 with value: 0.25.[0m
/media/san2_ssd/data/Workdir/survival/venv/lib/python3.8/site-packages/sksurv/ensemble/boosting.py:955: RuntimeWarning: divide by zero encountered in log
  time = numpy.log(time)
/media/san2_ssd/data/Workdir/survival/venv/lib/python3.8/site-packages/sksurv/ensemble/boosting.py:955: RuntimeWarning: divide by zero encountered in log
  time = numpy.log(time)
/media/san2_ssd/data/Workdir/survival/venv/lib/python3.8/site-packages/sksurv/ensemble/boosting.py:955: RuntimeWarning: divide by zero encountered in log
  time = numpy.log(time)
/media/san2_ssd/data/Workdir/survival/venv/lib/python3.8/site-packages/sksurv/ensemble/boosting.py:955: RuntimeWarning: divide by zero encountered in log
  time = numpy.log(time)
[32m[I 2022-04-21 11:39:08,253][0m Trial 6 finished with value: -0.45 and parameters: {'loss': 'squared', 'learning_rate': 1.636807162491539e-06, 'n_estimators': 211, 'criterion': 'friedman_mse', 'min_samples_split': 8, 'min_samples_leaf': 1, 'min_weight_fraction_leaf': 0.36648509437609605, 'min_impurity_decrease': 0.48802345230086036, 'max_features': 0.11209425879321633, 'subsample': 0.8972086722639947, 'dropout_rate': 0.24150413563261808, 'ccp_alpha': 2.8651574994090767}. Best is trial 0 with value: 0.25.[0m
[32m[I 2022-04-21 11:39:47,525][0m Trial 7 finished with value: 0.25 and parameters: {'loss': 'coxph', 'learning_rate': 0.010186504071035687, 'n_estimators': 443, 'criterion': 'absolute_error', 'min_samples_split': 8, 'min_samples_leaf': 6, 'min_weight_fraction_leaf': 0.1374193400605576, 'min_impurity_decrease': 0.8350540160652322, 'max_features': 0.9658245961138643, 'subsample': 0.8413814774040216, 'dropout_rate': 0.9651393738926569, 'ccp_alpha': 1.770055254567912}. Best is trial 0 with value: 0.25.[0m
/media/san2_ssd/data/Workdir/survival/venv/lib/python3.8/site-packages/sksurv/ensemble/boosting.py:955: RuntimeWarning: divide by zero encountered in log
  time = numpy.log(time)
/media/san2_ssd/data/Workdir/survival/venv/lib/python3.8/site-packages/sksurv/ensemble/boosting.py:955: RuntimeWarning: divide by zero encountered in log
  time = numpy.log(time)
/media/san2_ssd/data/Workdir/survival/venv/lib/python3.8/site-packages/sksurv/ensemble/boosting.py:955: RuntimeWarning: divide by zero encountered in log
  time = numpy.log(time)
/media/san2_ssd/data/Workdir/survival/venv/lib/python3.8/site-packages/sksurv/ensemble/boosting.py:955: RuntimeWarning: divide by zero encountered in log
  time = numpy.log(time)
[32m[I 2022-04-21 11:39:57,913][0m Trial 8 finished with value: -0.45 and parameters: {'loss': 'squared', 'learning_rate': 0.010194150375646286, 'n_estimators': 807, 'criterion': 'friedman_mse', 'min_samples_split': 6, 'min_samples_leaf': 9, 'min_weight_fraction_leaf': 0.08777476622590609, 'min_impurity_decrease': 0.4091393834581767, 'max_features': 0.867435002077594, 'subsample': 0.020688995564553166, 'dropout_rate': 0.8882787107008837, 'ccp_alpha': 0.7737282541313515}. Best is trial 0 with value: 0.25.[0m
/media/san2_ssd/data/Workdir/survival/venv/lib/python3.8/site-packages/sksurv/ensemble/boosting.py:955: RuntimeWarning: divide by zero encountered in log
  time = numpy.log(time)
/media/san2_ssd/data/Workdir/survival/venv/lib/python3.8/site-packages/sksurv/ensemble/boosting.py:955: RuntimeWarning: divide by zero encountered in log
  time = numpy.log(time)
/media/san2_ssd/data/Workdir/survival/venv/lib/python3.8/site-packages/sksurv/ensemble/boosting.py:955: RuntimeWarning: divide by zero encountered in log
  time = numpy.log(time)
/media/san2_ssd/data/Workdir/survival/venv/lib/python3.8/site-packages/sksurv/ensemble/boosting.py:955: RuntimeWarning: divide by zero encountered in log
  time = numpy.log(time)
[32m[I 2022-04-21 11:39:58,519][0m Trial 9 finished with value: -0.45 and parameters: {'loss': 'squared', 'learning_rate': 9.485961310867465e-06, 'n_estimators': 123, 'criterion': 'friedman_mse', 'min_samples_split': 5, 'min_samples_leaf': 7, 'min_weight_fraction_leaf': 0.35046385683469444, 'min_impurity_decrease': 0.7238983230985373, 'max_features': 0.08813864596357301, 'subsample': 0.6406898174754477, 'dropout_rate': 0.5518455245406273, 'ccp_alpha': 2.1811641365060908}. Best is trial 0 with value: 0.25.[0m
[32m[I 2022-04-21 11:42:35,396][0m Trial 10 finished with value: 0.25 and parameters: {'loss': 'coxph', 'learning_rate': 0.0697702084233253, 'n_estimators': 537, 'criterion': 'squared_error', 'min_samples_split': 2, 'min_samples_leaf': 10, 'min_weight_fraction_leaf': 0.48601612157916796, 'min_impurity_decrease': 0.012087332326927602, 'max_features': 0.45835843422197514, 'subsample': 0.07520446948286358, 'dropout_rate': 0.007814221142506905, 'ccp_alpha': 4.9584070496409876}. Best is trial 0 with value: 0.25.[0m
[32m[I 2022-04-21 11:43:32,230][0m Trial 11 finished with value: 0.25 and parameters: {'loss': 'coxph', 'learning_rate': 0.000797357897440017, 'n_estimators': 413, 'criterion': 'absolute_error', 'min_samples_split': 3, 'min_samples_leaf': 4, 'min_weight_fraction_leaf': 0.2048416504712452, 'min_impurity_decrease': 0.0013187122691493552, 'max_features': 0.35775594589625115, 'subsample': 0.9642094339022691, 'dropout_rate': 0.6658921711264166, 'ccp_alpha': 4.731461614871585}. Best is trial 0 with value: 0.25.[0m
[32m[I 2022-04-21 11:46:33,194][0m Trial 12 finished with value: 0.25 and parameters: {'loss': 'coxph', 'learning_rate': 0.0017975914069122735, 'n_estimators': 754, 'criterion': 'squared_error', 'min_samples_split': 4, 'min_samples_leaf': 4, 'min_weight_fraction_leaf': 0.00722343030679623, 'min_impurity_decrease': 0.19078081893825322, 'max_features': 0.27257750614438275, 'subsample': 0.7582002081088568, 'dropout_rate': 0.41336910297395335, 'ccp_alpha': 4.032865376361755}. Best is trial 0 with value: 0.25.[0m
[32m[I 2022-04-21 11:46:56,054][0m Trial 13 finished with value: 0.25 and parameters: {'loss': 'coxph', 'learning_rate': 0.05550194705503042, 'n_estimators': 292, 'criterion': 'absolute_error', 'min_samples_split': 2, 'min_samples_leaf': 8, 'min_weight_fraction_leaf': 0.2513727845582169, 'min_impurity_decrease': 0.26905673347550524, 'max_features': 0.2327033611038667, 'subsample': 0.7058844448763545, 'dropout_rate': 0.670400250686424, 'ccp_alpha': 4.101741054594766}. Best is trial 0 with value: 0.25.[0m
[32m[I 2022-04-21 11:47:12,196][0m Trial 14 finished with value: 0.25 and parameters: {'loss': 'coxph', 'learning_rate': 0.00017935259841833496, 'n_estimators': 200, 'criterion': 'squared_error', 'min_samples_split': 4, 'min_samples_leaf': 3, 'min_weight_fraction_leaf': 0.25250591661071725, 'min_impurity_decrease': 0.6142388837999945, 'max_features': 0.62398326668393, 'subsample': 0.47145099828726345, 'dropout_rate': 0.5264638281027493, 'ccp_alpha': 3.105642581425414}. Best is trial 0 with value: 0.25.[0m
[32m[I 2022-04-21 11:49:21,007][0m Trial 15 finished with value: 0.25 and parameters: {'loss': 'coxph', 'learning_rate': 0.01016754695068919, 'n_estimators': 578, 'criterion': 'absolute_error', 'min_samples_split': 4, 'min_samples_leaf': 5, 'min_weight_fraction_leaf': 0.19393906885156992, 'min_impurity_decrease': 0.10117549752364467, 'max_features': 0.20174199666298342, 'subsample': 0.9950361321839919, 'dropout_rate': 0.3567319574098629, 'ccp_alpha': 0.021591368450296855}. Best is trial 0 with value: 0.25.[0m
[32m[I 2022-04-21 11:52:23,180][0m Trial 16 finished with value: 0.25 and parameters: {'loss': 'coxph', 'learning_rate': 0.0019106087737077644, 'n_estimators': 982, 'criterion': 'squared_error', 'min_samples_split': 6, 'min_samples_leaf': 10, 'min_weight_fraction_leaf': 0.008694753636784569, 'min_impurity_decrease': 0.2940587122841308, 'max_features': 0.5640754004031638, 'subsample': 0.15849987598829451, 'dropout_rate': 0.7090238659906772, 'ccp_alpha': 3.6328854456836224}. Best is trial 0 with value: 0.25.[0m
[32m[I 2022-04-21 11:52:49,180][0m Trial 17 finished with value: 0.25 and parameters: {'loss': 'coxph', 'learning_rate': 0.00011044580903822146, 'n_estimators': 218, 'criterion': 'squared_error', 'min_samples_split': 3, 'min_samples_leaf': 6, 'min_weight_fraction_leaf': 0.2804997027076718, 'min_impurity_decrease': 0.6800119921741274, 'max_features': 0.6510328462229815, 'subsample': 0.49937683196859434, 'dropout_rate': 0.018406151328738518, 'ccp_alpha': 2.9607791851713054}. Best is trial 0 with value: 0.25.[0m
[32m[I 2022-04-21 11:54:55,642][0m Trial 18 finished with value: 0.25 and parameters: {'loss': 'coxph', 'learning_rate': 0.029195220490373423, 'n_estimators': 577, 'criterion': 'absolute_error', 'min_samples_split': 6, 'min_samples_leaf': 8, 'min_weight_fraction_leaf': 0.1878056600510279, 'min_impurity_decrease': 0.9863930526049377, 'max_features': 0.15125368567631325, 'subsample': 0.8087392747933273, 'dropout_rate': 0.3811935984519332, 'ccp_alpha': 0.12120704340572441}. Best is trial 0 with value: 0.25.[0m
[32m[I 2022-04-21 11:57:10,688][0m Trial 19 finished with value: 0.25 and parameters: {'loss': 'coxph', 'learning_rate': 0.0007796614296804124, 'n_estimators': 974, 'criterion': 'squared_error', 'min_samples_split': 7, 'min_samples_leaf': 10, 'min_weight_fraction_leaf': 0.006565587778867288, 'min_impurity_decrease': 0.30595193198539095, 'max_features': 0.5858576726647051, 'subsample': 0.18510172680020032, 'dropout_rate': 0.7539877775718585, 'ccp_alpha': 3.7627934948481}. Best is trial 0 with value: 0.25.[0m
[32m[I 2022-04-21 11:58:21,306][0m Trial 20 finished with value: 0.25 and parameters: {'loss': 'coxph', 'learning_rate': 8.237289391330672e-05, 'n_estimators': 373, 'criterion': 'squared_error', 'min_samples_split': 3, 'min_samples_leaf': 6, 'min_weight_fraction_leaf': 0.2890882790580294, 'min_impurity_decrease': 0.5968721190339165, 'max_features': 0.706736390971625, 'subsample': 0.5544320921274449, 'dropout_rate': 0.017423700650904678, 'ccp_alpha': 2.2150545284031375}. Best is trial 0 with value: 0.25.[0m
[32m[I 2022-04-21 12:00:40,864][0m Trial 21 finished with value: 0.25 and parameters: {'loss': 'coxph', 'learning_rate': 0.028184289473047474, 'n_estimators': 567, 'criterion': 'squared_error', 'min_samples_split': 3, 'min_samples_leaf': 8, 'min_weight_fraction_leaf': 0.30219123128535763, 'min_impurity_decrease': 0.9435990811698717, 'max_features': 0.4116146696711602, 'subsample': 0.44751705628715077, 'dropout_rate': 0.13696736790750666, 'ccp_alpha': 2.751830558470216}. Best is trial 0 with value: 0.25.[0m
[32m[I 2022-04-21 12:03:44,470][0m Trial 22 finished with value: 0.25 and parameters: {'loss': 'coxph', 'learning_rate': 0.0006389756904017765, 'n_estimators': 728, 'criterion': 'squared_error', 'min_samples_split': 7, 'min_samples_leaf': 9, 'min_weight_fraction_leaf': 0.4613950496331234, 'min_impurity_decrease': 0.30553522516911075, 'max_features': 0.030749263781363813, 'subsample': 0.24218451502163857, 'dropout_rate': 0.32669492610527173, 'ccp_alpha': 0.14263185710323123}. Best is trial 0 with value: 0.25.[0m
[32m[I 2022-04-21 12:04:59,752][0m Trial 23 finished with value: 0.25 and parameters: {'loss': 'coxph', 'learning_rate': 4.447758668462336e-05, 'n_estimators': 372, 'criterion': 'squared_error', 'min_samples_split': 5, 'min_samples_leaf': 9, 'min_weight_fraction_leaf': 0.40423958108277974, 'min_impurity_decrease': 0.5489851266848588, 'max_features': 0.7145363310820464, 'subsample': 0.5957045756710041, 'dropout_rate': 0.1109384701493992, 'ccp_alpha': 2.2794132711551893}. Best is trial 0 with value: 0.25.[0m
[32m[I 2022-04-21 12:05:59,197][0m Trial 24 finished with value: 0.25 and parameters: {'loss': 'coxph', 'learning_rate': 1.2348840802586608e-05, 'n_estimators': 361, 'criterion': 'squared_error', 'min_samples_split': 3, 'min_samples_leaf': 7, 'min_weight_fraction_leaf': 0.3069177319952395, 'min_impurity_decrease': 0.9842701852536704, 'max_features': 0.45862287175742955, 'subsample': 0.4275266739901932, 'dropout_rate': 0.1108170917224732, 'ccp_alpha': 2.647080940427648}. Best is trial 0 with value: 0.25.[0m
[32m[I 2022-04-21 12:09:14,421][0m Trial 25 finished with value: 0.25 and parameters: {'loss': 'coxph', 'learning_rate': 0.0004296467157768193, 'n_estimators': 714, 'criterion': 'squared_error', 'min_samples_split': 7, 'min_samples_leaf': 8, 'min_weight_fraction_leaf': 0.4798658928007346, 'min_impurity_decrease': 0.8602058713933619, 'max_features': 0.003972421605797256, 'subsample': 0.23907236379052205, 'dropout_rate': 0.2355280949121989, 'ccp_alpha': 1.0952266633434287}. Best is trial 0 with value: 0.25.[0m
[32m[I 2022-04-21 12:10:37,030][0m Trial 26 finished with value: 0.25 and parameters: {'loss': 'coxph', 'learning_rate': 5.5066439804357576e-05, 'n_estimators': 470, 'criterion': 'squared_error', 'min_samples_split': 5, 'min_samples_leaf': 9, 'min_weight_fraction_leaf': 0.43039483114198557, 'min_impurity_decrease': 0.3496727834016109, 'max_features': 0.31702216577880366, 'subsample': 0.6576759816801113, 'dropout_rate': 0.30117789602680056, 'ccp_alpha': 0.7652467079664113}. Best is trial 0 with value: 0.25.[0m
[32m[I 2022-04-21 12:11:33,743][0m Trial 27 finished with value: 0.25 and parameters: {'loss': 'coxph', 'learning_rate': 1.2932637192166099e-05, 'n_estimators': 353, 'criterion': 'squared_error', 'min_samples_split': 5, 'min_samples_leaf': 7, 'min_weight_fraction_leaf': 0.4096541378736581, 'min_impurity_decrease': 0.5332753726795576, 'max_features': 0.7265193648792796, 'subsample': 0.42385544545775405, 'dropout_rate': 0.1283048517097186, 'ccp_alpha': 2.4068335978874336}. Best is trial 0 with value: 0.25.[0m
[32m[I 2022-04-21 12:11:39,361][0m Trial 28 finished with value: 0.25 and parameters: {'loss': 'coxph', 'learning_rate': 1.0455152415065637e-06, 'n_estimators': 100, 'criterion': 'squared_error', 'min_samples_split': 2, 'min_samples_leaf': 7, 'min_weight_fraction_leaf': 0.3155172628782012, 'min_impurity_decrease': 0.8669928491990399, 'max_features': 0.1608234961044821, 'subsample': 0.27738112074556687, 'dropout_rate': 0.2349642727071501, 'ccp_alpha': 1.149267075142437}. Best is trial 0 with value: 0.25.[0m
[32m[I 2022-04-21 12:13:02,335][0m Trial 29 finished with value: 0.25 and parameters: {'loss': 'coxph', 'learning_rate': 4.6990984428229996e-05, 'n_estimators': 480, 'criterion': 'friedman_mse', 'min_samples_split': 8, 'min_samples_leaf': 9, 'min_weight_fraction_leaf': 0.4331130537444876, 'min_impurity_decrease': 0.11934676160747842, 'max_features': 0.32889850975888313, 'subsample': 0.6609944796898013, 'dropout_rate': 0.3095659663656593, 'ccp_alpha': 0.6450445622494291}. Best is trial 0 with value: 0.25.[0m
[32m[I 2022-04-21 12:13:52,955][0m Trial 30 finished with value: 0.25 and parameters: {'loss': 'coxph', 'learning_rate': 4.3808011762926834e-06, 'n_estimators': 316, 'criterion': 'squared_error', 'min_samples_split': 5, 'min_samples_leaf': 5, 'min_weight_fraction_leaf': 0.40361188594179587, 'min_impurity_decrease': 0.44914101968424014, 'max_features': 0.7569580713610848, 'subsample': 0.393144964372221, 'dropout_rate': 0.18134916430162906, 'ccp_alpha': 4.524874603309282}. Best is trial 0 with value: 0.25.[0m
[32m[I 2022-04-21 12:14:21,602][0m Trial 31 finished with value: 0.25 and parameters: {'loss': 'coxph', 'learning_rate': 1.152967380341504e-06, 'n_estimators': 268, 'criterion': 'squared_error', 'min_samples_split': 2, 'min_samples_leaf': 7, 'min_weight_fraction_leaf': 0.41737090691575573, 'min_impurity_decrease': 0.3595551803911501, 'max_features': 0.12226483115459325, 'subsample': 0.5324593782201607, 'dropout_rate': 0.19157189933378937, 'ccp_alpha': 1.2342733228895069}. Best is trial 0 with value: 0.25.[0m
