[32m[I 2022-04-21 12:36:50,803][0m Trial 67 finished with value: 0.8440974994430608 and parameters: {'loss': 'coxph', 'learning_rate': 1.2973545201260432e-06, 'n_estimators': 999, 'criterion': 'friedman_mse', 'min_samples_split': 7, 'min_samples_leaf': 3, 'min_weight_fraction_leaf': 0.11138667794666768, 'min_impurity_decrease': 0.6404394977563141, 'max_features': 0.44713465393134894, 'subsample': 0.195563419360919, 'dropout_rate': 0.22469886865532174, 'ccp_alpha': 0.17066197706157374}. Best is trial 11 with value: 0.8450457333064163.[0m
/media/san2_ssd/data/Workdir/survival/venv/lib/python3.8/site-packages/sksurv/ensemble/boosting.py:955: RuntimeWarning: divide by zero encountered in log
  time = numpy.log(time)
/media/san2_ssd/data/Workdir/survival/venv/lib/python3.8/site-packages/sksurv/ensemble/boosting.py:955: RuntimeWarning: divide by zero encountered in log
  time = numpy.log(time)
/media/san2_ssd/data/Workdir/survival/venv/lib/python3.8/site-packages/sksurv/ensemble/boosting.py:955: RuntimeWarning: divide by zero encountered in log
  time = numpy.log(time)
/media/san2_ssd/data/Workdir/survival/venv/lib/python3.8/site-packages/sksurv/ensemble/boosting.py:955: RuntimeWarning: divide by zero encountered in log
  time = numpy.log(time)
[32m[I 2022-04-21 12:37:33,364][0m Trial 68 finished with value: -0.46685231228178947 and parameters: {'loss': 'squared', 'learning_rate': 1.115880403214875e-06, 'n_estimators': 998, 'criterion': 'friedman_mse', 'min_samples_split': 8, 'min_samples_leaf': 4, 'min_weight_fraction_leaf': 0.09327803943912033, 'min_impurity_decrease': 0.6488985515750189, 'max_features': 0.4223468254248417, 'subsample': 0.19688041482628615, 'dropout_rate': 0.2377016873815473, 'ccp_alpha': 0.453134973582326}. Best is trial 11 with value: 0.8450457333064163.[0m
[32m[I 2022-04-21 12:37:35,325][0m Trial 69 finished with value: 0.8388847103268467 and parameters: {'loss': 'coxph', 'learning_rate': 2.637471315665153e-06, 'n_estimators': 106, 'criterion': 'friedman_mse', 'min_samples_split': 7, 'min_samples_leaf': 3, 'min_weight_fraction_leaf': 0.11640846580451367, 'min_impurity_decrease': 0.5832181199425879, 'max_features': 0.46896577754650914, 'subsample': 0.3207011558648548, 'dropout_rate': 0.4251348957449877, 'ccp_alpha': 0.13627118732271776}. Best is trial 11 with value: 0.8450457333064163.[0m
[32m[I 2022-04-21 12:39:41,676][0m Trial 70 finished with value: 0.7321660021556056 and parameters: {'loss': 'coxph', 'learning_rate': 1.0922253741723069e-06, 'n_estimators': 757, 'criterion': 'friedman_mse', 'min_samples_split': 8, 'min_samples_leaf': 6, 'min_weight_fraction_leaf': 0.14436791923098027, 'min_impurity_decrease': 0.6889926621443699, 'max_features': 0.4453727962202168, 'subsample': 0.1854025824837353, 'dropout_rate': 0.25691488781526656, 'ccp_alpha': 0.37095600258457223}. Best is trial 11 with value: 0.8450457333064163.[0m
[32m[I 2022-04-21 12:42:30,388][0m Trial 71 finished with value: 0.8426030532937443 and parameters: {'loss': 'coxph', 'learning_rate': 0.04416608624031892, 'n_estimators': 843, 'criterion': 'friedman_mse', 'min_samples_split': 7, 'min_samples_leaf': 3, 'min_weight_fraction_leaf': 0.15796500267043043, 'min_impurity_decrease': 0.5137010540809122, 'max_features': 0.3855767772703658, 'subsample': 0.15171860108055937, 'dropout_rate': 0.3343253042843158, 'ccp_alpha': 0.20101024057100395}. Best is trial 11 with value: 0.8450457333064163.[0m
[32m[I 2022-04-21 12:46:37,724][0m Trial 72 finished with value: 0.8423560485532334 and parameters: {'loss': 'coxph', 'learning_rate': 0.06406303393969305, 'n_estimators': 931, 'criterion': 'friedman_mse', 'min_samples_split': 7, 'min_samples_leaf': 3, 'min_weight_fraction_leaf': 0.15505486253161307, 'min_impurity_decrease': 0.5923280190424186, 'max_features': 0.39410226830046047, 'subsample': 0.14701143044532677, 'dropout_rate': 0.3013583584051387, 'ccp_alpha': 0.18608898513080183}. Best is trial 11 with value: 0.8450457333064163.[0m
[32m[I 2022-04-21 12:50:21,315][0m Trial 73 finished with value: 0.65 and parameters: {'loss': 'coxph', 'learning_rate': 0.06894652765104929, 'n_estimators': 906, 'criterion': 'friedman_mse', 'min_samples_split': 9, 'min_samples_leaf': 3, 'min_weight_fraction_leaf': 0.15542596766240221, 'min_impurity_decrease': 0.4730878199566741, 'max_features': 0.3833746142294042, 'subsample': 0.0348406053682558, 'dropout_rate': 0.30820507660769797, 'ccp_alpha': 0.35861080295419956}. Best is trial 11 with value: 0.8450457333064163.[0m
[32m[I 2022-04-21 12:54:02,599][0m Trial 74 finished with value: 0.8439679413766326 and parameters: {'loss': 'coxph', 'learning_rate': 0.04001422526120272, 'n_estimators': 943, 'criterion': 'friedman_mse', 'min_samples_split': 7, 'min_samples_leaf': 3, 'min_weight_fraction_leaf': 0.1849221185561661, 'min_impurity_decrease': 0.583571612900961, 'max_features': 0.43302629611026167, 'subsample': 0.13717445278249468, 'dropout_rate': 0.37866798208757596, 'ccp_alpha': 0.16341206776887834}. Best is trial 11 with value: 0.8450457333064163.[0m
[32m[I 2022-04-21 12:56:18,752][0m Trial 75 finished with value: 0.8417944302287943 and parameters: {'loss': 'coxph', 'learning_rate': 0.03648108914695992, 'n_estimators': 788, 'criterion': 'friedman_mse', 'min_samples_split': 7, 'min_samples_leaf': 3, 'min_weight_fraction_leaf': 0.17928953521914925, 'min_impurity_decrease': 0.6274629771428933, 'max_features': 0.4282253410624173, 'subsample': 0.08823467559645529, 'dropout_rate': 0.3901611768472114, 'ccp_alpha': 0.5084475340831724}. Best is trial 11 with value: 0.8450457333064163.[0m
[32m[I 2022-04-21 12:58:54,615][0m Trial 76 finished with value: 0.65 and parameters: {'loss': 'coxph', 'learning_rate': 0.0345342547579231, 'n_estimators': 859, 'criterion': 'friedman_mse', 'min_samples_split': 8, 'min_samples_leaf': 5, 'min_weight_fraction_leaf': 0.16702540273648897, 'min_impurity_decrease': 0.7015454760584013, 'max_features': 0.3494621440445161, 'subsample': 0.030669453917542125, 'dropout_rate': 0.4027429475772186, 'ccp_alpha': 0.7718541725192402}. Best is trial 11 with value: 0.8450457333064163.[0m
[32m[I 2022-04-21 13:01:20,572][0m Trial 77 finished with value: 0.65 and parameters: {'loss': 'coxph', 'learning_rate': 0.017150039143655472, 'n_estimators': 951, 'criterion': 'friedman_mse', 'min_samples_split': 7, 'min_samples_leaf': 4, 'min_weight_fraction_leaf': 0.09779722094928017, 'min_impurity_decrease': 0.3997412214118534, 'max_features': 0.3683518475297434, 'subsample': 0.1243260262344451, 'dropout_rate': 0.5034547768188042, 'ccp_alpha': 3.2016027333821673}. Best is trial 11 with value: 0.8450457333064163.[0m
[32m[I 2022-04-21 13:05:54,659][0m Trial 78 finished with value: 0.65 and parameters: {'loss': 'coxph', 'learning_rate': 0.05097196176235871, 'n_estimators': 996, 'criterion': 'squared_error', 'min_samples_split': 9, 'min_samples_leaf': 3, 'min_weight_fraction_leaf': 0.1978040071732305, 'min_impurity_decrease': 0.49492437187421984, 'max_features': 0.5469987875871665, 'subsample': 0.153575103998717, 'dropout_rate': 0.2066297915429945, 'ccp_alpha': 0.910713186206936}. Best is trial 11 with value: 0.8450457333064163.[0m
/media/san2_ssd/data/Workdir/survival/venv/lib/python3.8/site-packages/sksurv/ensemble/boosting.py:955: RuntimeWarning: divide by zero encountered in log
  time = numpy.log(time)
/media/san2_ssd/data/Workdir/survival/venv/lib/python3.8/site-packages/sksurv/ensemble/boosting.py:955: RuntimeWarning: divide by zero encountered in log
  time = numpy.log(time)
/media/san2_ssd/data/Workdir/survival/venv/lib/python3.8/site-packages/sksurv/ensemble/boosting.py:955: RuntimeWarning: divide by zero encountered in log
  time = numpy.log(time)
/media/san2_ssd/data/Workdir/survival/venv/lib/python3.8/site-packages/sksurv/ensemble/boosting.py:955: RuntimeWarning: divide by zero encountered in log
  time = numpy.log(time)
[32m[I 2022-04-21 13:06:15,385][0m Trial 79 finished with value: -0.46613378432860025 and parameters: {'loss': 'squared', 'learning_rate': 0.0044308473656326074, 'n_estimators': 757, 'criterion': 'friedman_mse', 'min_samples_split': 7, 'min_samples_leaf': 3, 'min_weight_fraction_leaf': 0.2132183714628673, 'min_impurity_decrease': 0.5537288644699676, 'max_features': 0.457899629320097, 'subsample': 0.24119525581579196, 'dropout_rate': 0.34875216259231057, 'ccp_alpha': 0.1186373617527782}. Best is trial 11 with value: 0.8450457333064163.[0m
[32m[I 2022-04-21 13:08:50,604][0m Trial 80 finished with value: 0.65 and parameters: {'loss': 'coxph', 'learning_rate': 0.013020219677035325, 'n_estimators': 882, 'criterion': 'friedman_mse', 'min_samples_split': 8, 'min_samples_leaf': 2, 'min_weight_fraction_leaf': 0.17753219645613633, 'min_impurity_decrease': 0.6400615218730877, 'max_features': 0.32728145622461424, 'subsample': 0.022044275057825913, 'dropout_rate': 0.46500232821984966, 'ccp_alpha': 0.3116081145583719}. Best is trial 11 with value: 0.8450457333064163.[0m
[32m[I 2022-04-21 13:12:20,001][0m Trial 81 finished with value: 0.8431191949123237 and parameters: {'loss': 'coxph', 'learning_rate': 0.09569272012825278, 'n_estimators': 935, 'criterion': 'friedman_mse', 'min_samples_split': 7, 'min_samples_leaf': 3, 'min_weight_fraction_leaf': 0.14915035449425554, 'min_impurity_decrease': 0.5903034887743164, 'max_features': 0.3864929179637264, 'subsample': 0.14300824103470058, 'dropout_rate': 0.2964231936320058, 'ccp_alpha': 0.16873233993154196}. Best is trial 11 with value: 0.8450457333064163.[0m
[32m[I 2022-04-21 13:15:10,646][0m Trial 82 finished with value: 0.7212298777703542 and parameters: {'loss': 'coxph', 'learning_rate': 0.0861464748646001, 'n_estimators': 794, 'criterion': 'friedman_mse', 'min_samples_split': 7, 'min_samples_leaf': 3, 'min_weight_fraction_leaf': 0.14415529331423968, 'min_impurity_decrease': 0.5668449015084982, 'max_features': 0.4230153522130316, 'subsample': 0.20201331702992043, 'dropout_rate': 0.12951250745604445, 'ccp_alpha': 0.46784273527526843}. Best is trial 11 with value: 0.8450457333064163.[0m
[32m[I 2022-04-21 13:19:14,766][0m Trial 83 finished with value: 0.8438447132878896 and parameters: {'loss': 'coxph', 'learning_rate': 0.0069940301802202285, 'n_estimators': 946, 'criterion': 'friedman_mse', 'min_samples_split': 7, 'min_samples_leaf': 3, 'min_weight_fraction_leaf': 0.11325722379962352, 'min_impurity_decrease': 0.6160855870754922, 'max_features': 0.4811462154701808, 'subsample': 0.13513232377395143, 'dropout_rate': 0.2771032388726121, 'ccp_alpha': 0.10153021891088793}. Best is trial 11 with value: 0.8450457333064163.[0m
[32m[I 2022-04-21 13:23:29,071][0m Trial 84 finished with value: 0.65 and parameters: {'loss': 'coxph', 'learning_rate': 0.02645994709249691, 'n_estimators': 949, 'criterion': 'friedman_mse', 'min_samples_split': 7, 'min_samples_leaf': 4, 'min_weight_fraction_leaf': 0.10877706695318463, 'min_impurity_decrease': 0.6700192475661753, 'max_features': 0.4809940033109344, 'subsample': 0.05087121200259616, 'dropout_rate': 0.2135334633237933, 'ccp_alpha': 0.09871142572631572}. Best is trial 11 with value: 0.8450457333064163.[0m
[32m[I 2022-04-21 13:27:18,717][0m Trial 85 finished with value: 0.8418421335524213 and parameters: {'loss': 'coxph', 'learning_rate': 1.6533600886993635e-06, 'n_estimators': 922, 'criterion': 'friedman_mse', 'min_samples_split': 6, 'min_samples_leaf': 2, 'min_weight_fraction_leaf': 0.0813106044540215, 'min_impurity_decrease': 0.7238841866194619, 'max_features': 0.5728736699657371, 'subsample': 0.08775037781541595, 'dropout_rate': 0.26652214963336557, 'ccp_alpha': 0.3339380350051557}. Best is trial 11 with value: 0.8450457333064163.[0m
[32m[I 2022-04-21 13:28:54,253][0m Trial 86 finished with value: 0.706007575560706 and parameters: {'loss': 'coxph', 'learning_rate': 0.002201523126086364, 'n_estimators': 662, 'criterion': 'friedman_mse', 'min_samples_split': 7, 'min_samples_leaf': 2, 'min_weight_fraction_leaf': 0.1341594038507962, 'min_impurity_decrease': 0.5972529772586562, 'max_features': 0.5373418872412161, 'subsample': 0.12499413275687667, 'dropout_rate': 0.3680197239009742, 'ccp_alpha': 0.6871282961453986}. Best is trial 11 with value: 0.8450457333064163.[0m
[32m[I 2022-04-21 13:32:12,796][0m Trial 87 finished with value: 0.8461097132289419 and parameters: {'loss': 'coxph', 'learning_rate': 0.007353392358887965, 'n_estimators': 876, 'criterion': 'friedman_mse', 'min_samples_split': 6, 'min_samples_leaf': 3, 'min_weight_fraction_leaf': 0.18693878961233257, 'min_impurity_decrease': 0.6133206049378412, 'max_features': 0.4468580927336727, 'subsample': 0.1716408994566772, 'dropout_rate': 0.277575178320488, 'ccp_alpha': 0.022900749986997093}. Best is trial 87 with value: 0.8461097132289419.[0m
[32m[I 2022-04-21 13:32:31,588][0m Trial 88 finished with value: 0.7178996345687966 and parameters: {'loss': 'coxph', 'learning_rate': 0.0068531452216589635, 'n_estimators': 267, 'criterion': 'squared_error', 'min_samples_split': 8, 'min_samples_leaf': 4, 'min_weight_fraction_leaf': 0.18286876816285286, 'min_impurity_decrease': 0.6112840797347219, 'max_features': 0.4612577221702226, 'subsample': 0.10007365954435213, 'dropout_rate': 0.28863532104137524, 'ccp_alpha': 0.01991170325298358}. Best is trial 87 with value: 0.8461097132289419.[0m
[32m[I 2022-04-21 13:34:51,737][0m Trial 89 finished with value: 0.7318450474400788 and parameters: {'loss': 'coxph', 'learning_rate': 0.018235791033269447, 'n_estimators': 734, 'criterion': 'friedman_mse', 'min_samples_split': 6, 'min_samples_leaf': 10, 'min_weight_fraction_leaf': 0.18915391145033028, 'min_impurity_decrease': 0.48315950327904467, 'max_features': 0.5951256656324329, 'subsample': 0.16842105831487839, 'dropout_rate': 0.153634468348174, 'ccp_alpha': 0.4617221570490106}. Best is trial 87 with value: 0.8461097132289419.[0m
[32m[I 2022-04-21 13:38:30,855][0m Trial 90 finished with value: 0.8391570922733106 and parameters: {'loss': 'coxph', 'learning_rate': 0.09366995412596686, 'n_estimators': 888, 'criterion': 'friedman_mse', 'min_samples_split': 7, 'min_samples_leaf': 2, 'min_weight_fraction_leaf': 0.21336432793622892, 'min_impurity_decrease': 0.4458502720230385, 'max_features': 0.4033971241791746, 'subsample': 0.07086382854397626, 'dropout_rate': 0.21760224875198267, 'ccp_alpha': 0.5538115688439684}. Best is trial 87 with value: 0.8461097132289419.[0m
[32m[I 2022-04-21 13:41:10,103][0m Trial 91 finished with value: 0.8439692352417036 and parameters: {'loss': 'coxph', 'learning_rate': 5.685513090837094e-06, 'n_estimators': 819, 'criterion': 'friedman_mse', 'min_samples_split': 6, 'min_samples_leaf': 3, 'min_weight_fraction_leaf': 0.14561201004111743, 'min_impurity_decrease': 0.6488406168338661, 'max_features': 0.44323859571787, 'subsample': 0.13421484191270996, 'dropout_rate': 0.27429759524693426, 'ccp_alpha': 0.1550620015968876}. Best is trial 87 with value: 0.8461097132289419.[0m
[32m[I 2022-04-21 13:44:14,746][0m Trial 92 finished with value: 0.8440128320314406 and parameters: {'loss': 'coxph', 'learning_rate': 0.006604023071883529, 'n_estimators': 799, 'criterion': 'friedman_mse', 'min_samples_split': 6, 'min_samples_leaf': 3, 'min_weight_fraction_leaf': 0.14325308627487682, 'min_impurity_decrease': 0.5699033007863934, 'max_features': 0.5094606326911364, 'subsample': 0.13411222261628225, 'dropout_rate': 0.24324627243131763, 'ccp_alpha': 0.08829599194720873}. Best is trial 87 with value: 0.8461097132289419.[0m
[32m[I 2022-04-21 13:47:32,727][0m Trial 93 finished with value: 0.845519028923898 and parameters: {'loss': 'coxph', 'learning_rate': 0.0072924239767433756, 'n_estimators': 805, 'criterion': 'friedman_mse', 'min_samples_split': 5, 'min_samples_leaf': 3, 'min_weight_fraction_leaf': 0.23349165970130586, 'min_impurity_decrease': 0.5709231886993508, 'max_features': 0.5046738692962144, 'subsample': 0.10546115486650733, 'dropout_rate': 0.17966291364579873, 'ccp_alpha': 0.10413870065689587}. Best is trial 87 with value: 0.8461097132289419.[0m
[32m[I 2022-04-21 13:51:05,731][0m Trial 94 finished with value: 0.65 and parameters: {'loss': 'coxph', 'learning_rate': 0.0010333176445990885, 'n_estimators': 801, 'criterion': 'friedman_mse', 'min_samples_split': 5, 'min_samples_leaf': 4, 'min_weight_fraction_leaf': 0.1688717523737307, 'min_impurity_decrease': 0.5690132977742449, 'max_features': 0.499374772243659, 'subsample': 0.04891743028264744, 'dropout_rate': 0.1033240329201117, 'ccp_alpha': 0.31083980253457133}. Best is trial 87 with value: 0.8461097132289419.[0m
[32m[I 2022-04-21 13:53:18,405][0m Trial 95 finished with value: 0.8439226450755768 and parameters: {'loss': 'coxph', 'learning_rate': 0.010876028511392247, 'n_estimators': 673, 'criterion': 'friedman_mse', 'min_samples_split': 5, 'min_samples_leaf': 2, 'min_weight_fraction_leaf': 0.22712928856212822, 'min_impurity_decrease': 0.3519647972191726, 'max_features': 0.45126531907571854, 'subsample': 0.10169352658064812, 'dropout_rate': 0.18389291341277944, 'ccp_alpha': 0.027584784805634283}. Best is trial 87 with value: 0.8461097132289419.[0m
[32m[I 2022-04-21 13:55:56,475][0m Trial 96 finished with value: 0.65 and parameters: {'loss': 'coxph', 'learning_rate': 4.984419130047843e-06, 'n_estimators': 769, 'criterion': 'friedman_mse', 'min_samples_split': 5, 'min_samples_leaf': 3, 'min_weight_fraction_leaf': 0.2364611018889531, 'min_impurity_decrease': 0.537932571442121, 'max_features': 0.5263523382984945, 'subsample': 0.003685864388285831, 'dropout_rate': 0.2394589202795898, 'ccp_alpha': 0.2716978954300295}. Best is trial 87 with value: 0.8461097132289419.[0m
/media/san2_ssd/data/Workdir/survival/venv/lib/python3.8/site-packages/sksurv/ensemble/boosting.py:955: RuntimeWarning: divide by zero encountered in log
  time = numpy.log(time)
/media/san2_ssd/data/Workdir/survival/venv/lib/python3.8/site-packages/sksurv/ensemble/boosting.py:955: RuntimeWarning: divide by zero encountered in log
  time = numpy.log(time)
/media/san2_ssd/data/Workdir/survival/venv/lib/python3.8/site-packages/sksurv/ensemble/boosting.py:955: RuntimeWarning: divide by zero encountered in log
  time = numpy.log(time)
/media/san2_ssd/data/Workdir/survival/venv/lib/python3.8/site-packages/sksurv/ensemble/boosting.py:955: RuntimeWarning: divide by zero encountered in log
  time = numpy.log(time)
[32m[I 2022-04-21 13:56:24,503][0m Trial 97 finished with value: -0.46613378432860025 and parameters: {'loss': 'squared', 'learning_rate': 0.003663096851473759, 'n_estimators': 611, 'criterion': 'friedman_mse', 'min_samples_split': 6, 'min_samples_leaf': 2, 'min_weight_fraction_leaf': 0.13413478389519284, 'min_impurity_decrease': 0.7522831853264665, 'max_features': 0.43747955778092595, 'subsample': 0.2122811706713525, 'dropout_rate': 0.16154264788210804, 'ccp_alpha': 0.38971002653727016}. Best is trial 87 with value: 0.8461097132289419.[0m
[32m[I 2022-04-21 13:59:20,168][0m Trial 98 finished with value: 0.65 and parameters: {'loss': 'coxph', 'learning_rate': 1.0003847038062163e-05, 'n_estimators': 808, 'criterion': 'friedman_mse', 'min_samples_split': 5, 'min_samples_leaf': 7, 'min_weight_fraction_leaf': 0.19731976965241654, 'min_impurity_decrease': 0.5063566398017749, 'max_features': 0.565723645871923, 'subsample': 0.07474641843119688, 'dropout_rate': 0.25193162395562985, 'ccp_alpha': 0.5525348060862327}. Best is trial 87 with value: 0.8461097132289419.[0m
[32m[I 2022-04-21 14:02:31,734][0m Trial 99 finished with value: 0.8432038760419094 and parameters: {'loss': 'coxph', 'learning_rate': 0.006007911928758124, 'n_estimators': 740, 'criterion': 'friedman_mse', 'min_samples_split': 6, 'min_samples_leaf': 3, 'min_weight_fraction_leaf': 0.1743097155465674, 'min_impurity_decrease': 0.5611516641771908, 'max_features': 0.35410501864842836, 'subsample': 0.17397910360321608, 'dropout_rate': 0.025538415476342946, 'ccp_alpha': 0.00557279992568116}. Best is trial 87 with value: 0.8461097132289419.[0m
[32m[I 2022-04-21 14:06:08,313][0m Trial 100 finished with value: 0.65 and parameters: {'loss': 'coxph', 'learning_rate': 0.00261530396699062, 'n_estimators': 867, 'criterion': 'friedman_mse', 'min_samples_split': 5, 'min_samples_leaf': 4, 'min_weight_fraction_leaf': 0.1645367095874368, 'min_impurity_decrease': 0.6690075011032943, 'max_features': 0.71897870714892, 'subsample': 0.249501801772692, 'dropout_rate': 0.22250811416044808, 'ccp_alpha': 2.2094800136965227}. Best is trial 87 with value: 0.8461097132289419.[0m
[32m[I 2022-04-21 14:08:31,958][0m Trial 101 finished with value: 0.8451905546272229 and parameters: {'loss': 'coxph', 'learning_rate': 0.008702780976695941, 'n_estimators': 685, 'criterion': 'friedman_mse', 'min_samples_split': 4, 'min_samples_leaf': 2, 'min_weight_fraction_leaf': 0.23018583176034768, 'min_impurity_decrease': 0.36269921035815633, 'max_features': 0.4483742571766191, 'subsample': 0.1059920122954498, 'dropout_rate': 0.18545510357538458, 'ccp_alpha': 0.08687121506347768}. Best is trial 87 with value: 0.8461097132289419.[0m
[32m[I 2022-04-21 14:08:40,938][0m Trial 102 finished with value: 0.734247177833543 and parameters: {'loss': 'coxph', 'learning_rate': 0.008882643126039957, 'n_estimators': 153, 'criterion': 'friedman_mse', 'min_samples_split': 4, 'min_samples_leaf': 8, 'min_weight_fraction_leaf': 0.2138764610731846, 'min_impurity_decrease': 0.4491201129806724, 'max_features': 0.41055037770404545, 'subsample': 0.11203811129189586, 'dropout_rate': 0.18254882122381846, 'ccp_alpha': 0.11860019200025249}. Best is trial 87 with value: 0.8461097132289419.[0m
