[32m[I 2022-04-22 18:24:35,544][0m Trial 297 finished with value: 0.6449296826319774 and parameters: {'loss': 'coxph', 'learning_rate': 0.03007808302476257, 'n_estimators': 486, 'criterion': 'friedman_mse', 'min_samples_split': 10, 'min_samples_leaf': 3, 'min_weight_fraction_leaf': 0.08711916449218843, 'min_impurity_decrease': 0.8872368257057204, 'max_features': 0.734964782938831, 'subsample': 0.3221645255619494, 'dropout_rate': 0.3880139797378593, 'ccp_alpha': 0.09665476211671073}. Best is trial 218 with value: 0.6659976583847056.[0m
/media/san2_ssd/data/Workdir/survival/venv/lib/python3.8/site-packages/sksurv/ensemble/boosting.py:955: RuntimeWarning: divide by zero encountered in log
  time = numpy.log(time)
/media/san2_ssd/data/Workdir/survival/venv/lib/python3.8/site-packages/sksurv/ensemble/boosting.py:955: RuntimeWarning: divide by zero encountered in log
  time = numpy.log(time)
/media/san2_ssd/data/Workdir/survival/venv/lib/python3.8/site-packages/sksurv/ensemble/boosting.py:955: RuntimeWarning: divide by zero encountered in log
  time = numpy.log(time)
/media/san2_ssd/data/Workdir/survival/venv/lib/python3.8/site-packages/sksurv/ensemble/boosting.py:955: RuntimeWarning: divide by zero encountered in log
  time = numpy.log(time)
[32m[I 2022-04-22 18:24:43,689][0m Trial 298 finished with value: -0.7329268425756945 and parameters: {'loss': 'squared', 'learning_rate': 0.08486935963871384, 'n_estimators': 446, 'criterion': 'friedman_mse', 'min_samples_split': 10, 'min_samples_leaf': 3, 'min_weight_fraction_leaf': 0.06069985767303285, 'min_impurity_decrease': 0.9204406201702013, 'max_features': 0.659833235202056, 'subsample': 0.3778507635368028, 'dropout_rate': 0.3306673475380937, 'ccp_alpha': 0.18738123768332132}. Best is trial 218 with value: 0.6659976583847056.[0m
[32m[I 2022-04-22 18:25:48,575][0m Trial 299 finished with value: 0.6610881271325525 and parameters: {'loss': 'coxph', 'learning_rate': 0.041242485269437995, 'n_estimators': 507, 'criterion': 'friedman_mse', 'min_samples_split': 10, 'min_samples_leaf': 3, 'min_weight_fraction_leaf': 0.073800263836686, 'min_impurity_decrease': 0.896670306541501, 'max_features': 0.724871194325739, 'subsample': 0.3623236294173443, 'dropout_rate': 0.21297131895849392, 'ccp_alpha': 0.0020808592087141102}. Best is trial 218 with value: 0.6659976583847056.[0m
[32m[I 2022-04-22 18:26:48,504][0m Trial 300 finished with value: 0.5 and parameters: {'loss': 'coxph', 'learning_rate': 0.007775901795659624, 'n_estimators': 505, 'criterion': 'squared_error', 'min_samples_split': 10, 'min_samples_leaf': 3, 'min_weight_fraction_leaf': 0.0710594352000959, 'min_impurity_decrease': 0.8770928648428841, 'max_features': 0.7325098359285019, 'subsample': 0.3579575470451275, 'dropout_rate': 0.19859723196640966, 'ccp_alpha': 0.09568572651371862}. Best is trial 218 with value: 0.6659976583847056.[0m
[32m[I 2022-04-22 18:27:50,343][0m Trial 301 finished with value: 0.530715911158733 and parameters: {'loss': 'coxph', 'learning_rate': 0.04237156205278826, 'n_estimators': 516, 'criterion': 'friedman_mse', 'min_samples_split': 10, 'min_samples_leaf': 3, 'min_weight_fraction_leaf': 0.09166285543538358, 'min_impurity_decrease': 0.9020578056426714, 'max_features': 0.6769001284874449, 'subsample': 0.30730803151912367, 'dropout_rate': 0.21188016058299475, 'ccp_alpha': 0.2780934863461502}. Best is trial 218 with value: 0.6659976583847056.[0m
[32m[I 2022-04-22 18:28:49,506][0m Trial 302 finished with value: 0.6615896726490262 and parameters: {'loss': 'coxph', 'learning_rate': 0.028203801541148703, 'n_estimators': 487, 'criterion': 'friedman_mse', 'min_samples_split': 10, 'min_samples_leaf': 3, 'min_weight_fraction_leaf': 0.06375854833254908, 'min_impurity_decrease': 0.8639265988444775, 'max_features': 0.7173449648820183, 'subsample': 0.3358565674900069, 'dropout_rate': 0.21587347709087137, 'ccp_alpha': 0.00657599700350134}. Best is trial 218 with value: 0.6659976583847056.[0m
[32m[I 2022-04-22 18:29:54,389][0m Trial 303 finished with value: 0.5844388262724459 and parameters: {'loss': 'coxph', 'learning_rate': 0.0620891741861924, 'n_estimators': 523, 'criterion': 'friedman_mse', 'min_samples_split': 10, 'min_samples_leaf': 3, 'min_weight_fraction_leaf': 0.062486166762266836, 'min_impurity_decrease': 0.8526759451968853, 'max_features': 0.7197904362433245, 'subsample': 0.3923742082963448, 'dropout_rate': 0.2098544976619977, 'ccp_alpha': 0.17596110360431516}. Best is trial 218 with value: 0.6659976583847056.[0m
[32m[I 2022-04-22 18:30:40,035][0m Trial 304 finished with value: 0.5 and parameters: {'loss': 'coxph', 'learning_rate': 0.040923857612470936, 'n_estimators': 492, 'criterion': 'friedman_mse', 'min_samples_split': 10, 'min_samples_leaf': 3, 'min_weight_fraction_leaf': 0.0693488438989544, 'min_impurity_decrease': 0.8689240784248298, 'max_features': 0.7367516402909319, 'subsample': 0.3482229005104373, 'dropout_rate': 0.4182027919246015, 'ccp_alpha': 1.572509363578623}. Best is trial 218 with value: 0.6659976583847056.[0m
[32m[I 2022-04-22 18:31:36,274][0m Trial 305 finished with value: 0.6478198267685853 and parameters: {'loss': 'coxph', 'learning_rate': 0.008569375838840125, 'n_estimators': 480, 'criterion': 'friedman_mse', 'min_samples_split': 10, 'min_samples_leaf': 3, 'min_weight_fraction_leaf': 0.05631646285619796, 'min_impurity_decrease': 0.8937131827291817, 'max_features': 0.7017997226557044, 'subsample': 0.3414533268544473, 'dropout_rate': 0.2115570175996286, 'ccp_alpha': 0.1011294449897927}. Best is trial 218 with value: 0.6659976583847056.[0m
[32m[I 2022-04-22 18:32:32,549][0m Trial 306 finished with value: 0.5006540204610004 and parameters: {'loss': 'coxph', 'learning_rate': 0.03279059139058452, 'n_estimators': 528, 'criterion': 'friedman_mse', 'min_samples_split': 10, 'min_samples_leaf': 3, 'min_weight_fraction_leaf': 0.07718609258086426, 'min_impurity_decrease': 0.860530122305974, 'max_features': 0.7547756885757956, 'subsample': 0.3249960529975587, 'dropout_rate': 0.38248679540123076, 'ccp_alpha': 0.35435204780371465}. Best is trial 218 with value: 0.6659976583847056.[0m
[32m[I 2022-04-22 18:33:18,291][0m Trial 307 finished with value: 0.6562466561073685 and parameters: {'loss': 'coxph', 'learning_rate': 0.0621562329386484, 'n_estimators': 501, 'criterion': 'friedman_mse', 'min_samples_split': 10, 'min_samples_leaf': 3, 'min_weight_fraction_leaf': 0.06369138396791627, 'min_impurity_decrease': 0.9145263484093084, 'max_features': 0.5530740719184964, 'subsample': 0.3638355144606754, 'dropout_rate': 0.4410398515553505, 'ccp_alpha': 0.09863235649470453}. Best is trial 218 with value: 0.6659976583847056.[0m
[32m[I 2022-04-22 18:34:02,804][0m Trial 308 finished with value: 0.6579785823826356 and parameters: {'loss': 'coxph', 'learning_rate': 0.09701848752707831, 'n_estimators': 417, 'criterion': 'friedman_mse', 'min_samples_split': 10, 'min_samples_leaf': 3, 'min_weight_fraction_leaf': 0.07271032889690769, 'min_impurity_decrease': 0.8916332921162423, 'max_features': 0.7205508020903042, 'subsample': 0.30079379198298295, 'dropout_rate': 0.23763225435213522, 'ccp_alpha': 0.005021309896335905}. Best is trial 218 with value: 0.6659976583847056.[0m
[32m[I 2022-04-22 18:34:57,551][0m Trial 309 finished with value: 0.59760807656137 and parameters: {'loss': 'coxph', 'learning_rate': 0.04650345781594152, 'n_estimators': 478, 'criterion': 'friedman_mse', 'min_samples_split': 10, 'min_samples_leaf': 3, 'min_weight_fraction_leaf': 0.0925214873092001, 'min_impurity_decrease': 0.8429393587957574, 'max_features': 0.6497717826935362, 'subsample': 0.2844763263317444, 'dropout_rate': 0.1985245747433862, 'ccp_alpha': 0.21861455315282408}. Best is trial 218 with value: 0.6659976583847056.[0m
[32m[I 2022-04-22 18:35:46,734][0m Trial 310 finished with value: 0.6509817493678148 and parameters: {'loss': 'coxph', 'learning_rate': 0.027489155952286622, 'n_estimators': 501, 'criterion': 'friedman_mse', 'min_samples_split': 10, 'min_samples_leaf': 3, 'min_weight_fraction_leaf': 0.0799516518276696, 'min_impurity_decrease': 0.8741870469029959, 'max_features': 0.6950840116852047, 'subsample': 0.33392143105685, 'dropout_rate': 0.40022004892408247, 'ccp_alpha': 0.09754984290318955}. Best is trial 218 with value: 0.6659976583847056.[0m
[32m[I 2022-04-22 18:36:49,795][0m Trial 311 finished with value: 0.659153988408479 and parameters: {'loss': 'coxph', 'learning_rate': 0.010430871389093333, 'n_estimators': 536, 'criterion': 'friedman_mse', 'min_samples_split': 10, 'min_samples_leaf': 3, 'min_weight_fraction_leaf': 0.060004857267207876, 'min_impurity_decrease': 0.9139021904353273, 'max_features': 0.6710379927688062, 'subsample': 0.307544650632187, 'dropout_rate': 0.365863411518306, 'ccp_alpha': 0.003363659730415344}. Best is trial 218 with value: 0.6659976583847056.[0m
[32m[I 2022-04-22 18:37:36,721][0m Trial 312 finished with value: 0.5 and parameters: {'loss': 'coxph', 'learning_rate': 0.007531799890357688, 'n_estimators': 436, 'criterion': 'friedman_mse', 'min_samples_split': 10, 'min_samples_leaf': 3, 'min_weight_fraction_leaf': 0.07176539490453658, 'min_impurity_decrease': 0.8957813652318775, 'max_features': 0.7689935838099725, 'subsample': 0.36874659632599766, 'dropout_rate': 0.22530403496482126, 'ccp_alpha': 2.9925355369467836}. Best is trial 218 with value: 0.6659976583847056.[0m
[32m[I 2022-04-22 18:38:55,600][0m Trial 313 finished with value: 0.6249625289801244 and parameters: {'loss': 'coxph', 'learning_rate': 0.03897289296651705, 'n_estimators': 558, 'criterion': 'friedman_mse', 'min_samples_split': 10, 'min_samples_leaf': 3, 'min_weight_fraction_leaf': 0.08406107628216417, 'min_impurity_decrease': 0.8698242325316704, 'max_features': 0.539230736068627, 'subsample': 0.2922494903089745, 'dropout_rate': 0.19714861679927248, 'ccp_alpha': 0.1788447317407293}. Best is trial 218 with value: 0.6659976583847056.[0m
[32m[I 2022-04-22 18:39:48,860][0m Trial 314 finished with value: 0.5303371293024742 and parameters: {'loss': 'coxph', 'learning_rate': 0.07398485731106555, 'n_estimators': 478, 'criterion': 'friedman_mse', 'min_samples_split': 10, 'min_samples_leaf': 3, 'min_weight_fraction_leaf': 0.09328058123488996, 'min_impurity_decrease': 0.9283702547093132, 'max_features': 0.5637719907464719, 'subsample': 0.32631583809436826, 'dropout_rate': 0.2438961942189582, 'ccp_alpha': 0.2902174914139213}. Best is trial 218 with value: 0.6659976583847056.[0m
[32m[I 2022-04-22 18:40:46,500][0m Trial 315 finished with value: 0.6472850614888446 and parameters: {'loss': 'coxph', 'learning_rate': 0.03292003488568951, 'n_estimators': 513, 'criterion': 'friedman_mse', 'min_samples_split': 10, 'min_samples_leaf': 3, 'min_weight_fraction_leaf': 0.054082642374559106, 'min_impurity_decrease': 0.9030577094473963, 'max_features': 0.6265205388756526, 'subsample': 0.28110098479456314, 'dropout_rate': 0.3259908300107858, 'ccp_alpha': 0.1022020917516239}. Best is trial 218 with value: 0.6659976583847056.[0m
[32m[I 2022-04-22 18:41:34,624][0m Trial 316 finished with value: 0.5985560724266957 and parameters: {'loss': 'coxph', 'learning_rate': 0.05252085672062738, 'n_estimators': 451, 'criterion': 'friedman_mse', 'min_samples_split': 10, 'min_samples_leaf': 3, 'min_weight_fraction_leaf': 0.0725465266422535, 'min_impurity_decrease': 0.8458021855494011, 'max_features': 0.5251704367412872, 'subsample': 0.34248926216693315, 'dropout_rate': 0.21602346977897025, 'ccp_alpha': 0.1751989398614137}. Best is trial 218 with value: 0.6659976583847056.[0m
[32m[I 2022-04-22 18:42:33,200][0m Trial 317 finished with value: 0.6419638860358226 and parameters: {'loss': 'coxph', 'learning_rate': 0.04176561446548686, 'n_estimators': 497, 'criterion': 'friedman_mse', 'min_samples_split': 10, 'min_samples_leaf': 3, 'min_weight_fraction_leaf': 0.06285750120198162, 'min_impurity_decrease': 0.9256111718246125, 'max_features': 0.7154467061688122, 'subsample': 0.4077181902195009, 'dropout_rate': 0.23758069137150525, 'ccp_alpha': 0.09685731854216831}. Best is trial 218 with value: 0.6659976583847056.[0m
/media/san2_ssd/data/Workdir/survival/venv/lib/python3.8/site-packages/sksurv/ensemble/boosting.py:955: RuntimeWarning: divide by zero encountered in log
  time = numpy.log(time)
/media/san2_ssd/data/Workdir/survival/venv/lib/python3.8/site-packages/sksurv/ensemble/boosting.py:955: RuntimeWarning: divide by zero encountered in log
  time = numpy.log(time)
/media/san2_ssd/data/Workdir/survival/venv/lib/python3.8/site-packages/sksurv/ensemble/boosting.py:955: RuntimeWarning: divide by zero encountered in log
  time = numpy.log(time)
/media/san2_ssd/data/Workdir/survival/venv/lib/python3.8/site-packages/sksurv/ensemble/boosting.py:955: RuntimeWarning: divide by zero encountered in log
  time = numpy.log(time)
[32m[I 2022-04-22 18:42:42,234][0m Trial 318 finished with value: -0.7349095577644817 and parameters: {'loss': 'squared', 'learning_rate': 0.009127640586901816, 'n_estimators': 472, 'criterion': 'friedman_mse', 'min_samples_split': 10, 'min_samples_leaf': 3, 'min_weight_fraction_leaf': 0.08398763950634794, 'min_impurity_decrease': 0.8759428681919227, 'max_features': 0.6322586001304422, 'subsample': 0.3124651533407814, 'dropout_rate': 0.37387894817980216, 'ccp_alpha': 0.002972901778312679}. Best is trial 218 with value: 0.6659976583847056.[0m
[32m[I 2022-04-22 18:43:41,914][0m Trial 319 finished with value: 0.6616376069209892 and parameters: {'loss': 'coxph', 'learning_rate': 0.06347837179852063, 'n_estimators': 529, 'criterion': 'friedman_mse', 'min_samples_split': 10, 'min_samples_leaf': 3, 'min_weight_fraction_leaf': 0.0971248605513179, 'min_impurity_decrease': 0.8919135518512263, 'max_features': 0.686501481040892, 'subsample': 0.27993135005070113, 'dropout_rate': 0.40256014431962384, 'ccp_alpha': 0.0011000376681955873}. Best is trial 218 with value: 0.6659976583847056.[0m
[32m[I 2022-04-22 18:44:33,457][0m Trial 320 finished with value: 0.5 and parameters: {'loss': 'coxph', 'learning_rate': 0.010397253284987916, 'n_estimators': 526, 'criterion': 'friedman_mse', 'min_samples_split': 10, 'min_samples_leaf': 3, 'min_weight_fraction_leaf': 0.09797206664513218, 'min_impurity_decrease': 0.927763950029792, 'max_features': 0.6717278595070563, 'subsample': 0.25539763297793405, 'dropout_rate': 0.42418922549903654, 'ccp_alpha': 2.811849772486704}. Best is trial 218 with value: 0.6659976583847056.[0m
[32m[I 2022-04-22 18:45:37,737][0m Trial 321 finished with value: 0.5713786331848324 and parameters: {'loss': 'coxph', 'learning_rate': 0.025798982364471052, 'n_estimators': 585, 'criterion': 'friedman_mse', 'min_samples_split': 10, 'min_samples_leaf': 3, 'min_weight_fraction_leaf': 0.052062264942727754, 'min_impurity_decrease': 0.9533141940784666, 'max_features': 0.5381095079286484, 'subsample': 0.2832056532202664, 'dropout_rate': 0.4015479973527968, 'ccp_alpha': 0.244093251358417}. Best is trial 218 with value: 0.6659976583847056.[0m
[32m[I 2022-04-22 18:46:44,299][0m Trial 322 finished with value: 0.647500803640001 and parameters: {'loss': 'coxph', 'learning_rate': 0.06795674748983659, 'n_estimators': 560, 'criterion': 'friedman_mse', 'min_samples_split': 10, 'min_samples_leaf': 3, 'min_weight_fraction_leaf': 0.0711085638375508, 'min_impurity_decrease': 0.836819458966126, 'max_features': 0.5858021261643847, 'subsample': 0.2593322663984847, 'dropout_rate': 0.3066272557838896, 'ccp_alpha': 0.11293616575464857}. Best is trial 218 with value: 0.6659976583847056.[0m
[32m[I 2022-04-22 18:48:32,695][0m Trial 323 finished with value: 0.5 and parameters: {'loss': 'coxph', 'learning_rate': 0.007080101745404128, 'n_estimators': 669, 'criterion': 'squared_error', 'min_samples_split': 10, 'min_samples_leaf': 3, 'min_weight_fraction_leaf': 0.09534856121029016, 'min_impurity_decrease': 0.8777265803306793, 'max_features': 0.7443722276213539, 'subsample': 0.3013668200973371, 'dropout_rate': 0.19592713451846533, 'ccp_alpha': 0.0013507769672153188}. Best is trial 218 with value: 0.6659976583847056.[0m
[32m[I 2022-04-22 18:49:36,385][0m Trial 324 finished with value: 0.6216688400550694 and parameters: {'loss': 'coxph', 'learning_rate': 0.04850453131961839, 'n_estimators': 520, 'criterion': 'friedman_mse', 'min_samples_split': 10, 'min_samples_leaf': 3, 'min_weight_fraction_leaf': 0.06266180605828389, 'min_impurity_decrease': 0.9134007268950087, 'max_features': 0.6972403158631878, 'subsample': 0.2793464359199404, 'dropout_rate': 0.21319415269544412, 'ccp_alpha': 0.17758008447280266}. Best is trial 218 with value: 0.6659976583847056.[0m
[32m[I 2022-04-22 18:50:39,128][0m Trial 325 finished with value: 0.6517412223177111 and parameters: {'loss': 'coxph', 'learning_rate': 0.015680253545428173, 'n_estimators': 503, 'criterion': 'friedman_mse', 'min_samples_split': 10, 'min_samples_leaf': 3, 'min_weight_fraction_leaf': 0.08511402858359896, 'min_impurity_decrease': 0.8593443854845004, 'max_features': 0.7905039113716886, 'subsample': 0.2593550779093905, 'dropout_rate': 0.2340756743778906, 'ccp_alpha': 0.09409857561811616}. Best is trial 218 with value: 0.6659976583847056.[0m
[32m[I 2022-04-22 18:51:38,768][0m Trial 326 finished with value: 0.5006540204610004 and parameters: {'loss': 'coxph', 'learning_rate': 0.03420035332772435, 'n_estimators': 543, 'criterion': 'friedman_mse', 'min_samples_split': 10, 'min_samples_leaf': 3, 'min_weight_fraction_leaf': 0.07499016707055792, 'min_impurity_decrease': 0.8941873040069541, 'max_features': 0.5573454899724928, 'subsample': 0.31251046892764356, 'dropout_rate': 0.38846020315465496, 'ccp_alpha': 0.3505688004239832}. Best is trial 218 with value: 0.6659976583847056.[0m
[32m[I 2022-04-22 18:52:22,477][0m Trial 327 finished with value: 0.6617102157755793 and parameters: {'loss': 'coxph', 'learning_rate': 0.08571810040515083, 'n_estimators': 449, 'criterion': 'friedman_mse', 'min_samples_split': 10, 'min_samples_leaf': 3, 'min_weight_fraction_leaf': 0.057831709019000165, 'min_impurity_decrease': 0.9356218364989534, 'max_features': 0.7134825625222495, 'subsample': 0.2893272951728116, 'dropout_rate': 0.4140310016692414, 'ccp_alpha': 0.0012152901608428052}. Best is trial 218 with value: 0.6659976583847056.[0m
[32m[I 2022-04-22 18:53:03,525][0m Trial 328 finished with value: 0.6553120586508691 and parameters: {'loss': 'coxph', 'learning_rate': 0.08474197683622652, 'n_estimators': 425, 'criterion': 'friedman_mse', 'min_samples_split': 10, 'min_samples_leaf': 3, 'min_weight_fraction_leaf': 0.04736404478201321, 'min_impurity_decrease': 0.949508675862457, 'max_features': 0.7227621017611795, 'subsample': 0.2885998856353777, 'dropout_rate': 0.3415989153170989, 'ccp_alpha': 0.005227888327914568}. Best is trial 218 with value: 0.6659976583847056.[0m
[32m[I 2022-04-22 18:53:39,873][0m Trial 329 finished with value: 0.5917749736396494 and parameters: {'loss': 'coxph', 'learning_rate': 0.09415522276431426, 'n_estimators': 446, 'criterion': 'friedman_mse', 'min_samples_split': 10, 'min_samples_leaf': 3, 'min_weight_fraction_leaf': 0.058637340343725114, 'min_impurity_decrease': 0.8849289557567486, 'max_features': 0.6858501716163915, 'subsample': 0.3034758431650027, 'dropout_rate': 0.44111514197246593, 'ccp_alpha': 0.19373366260266836}. Best is trial 218 with value: 0.6659976583847056.[0m
[32m[I 2022-04-22 18:54:22,646][0m Trial 330 finished with value: 0.6423264596771106 and parameters: {'loss': 'coxph', 'learning_rate': 0.06532476591586694, 'n_estimators': 461, 'criterion': 'friedman_mse', 'min_samples_split': 10, 'min_samples_leaf': 3, 'min_weight_fraction_leaf': 0.08763401562995721, 'min_impurity_decrease': 0.915529383551368, 'max_features': 0.7106911973419593, 'subsample': 0.32128370281882834, 'dropout_rate': 0.40541625876528814, 'ccp_alpha': 0.11552182153665126}. Best is trial 218 with value: 0.6659976583847056.[0m
[32m[I 2022-04-22 18:55:08,597][0m Trial 331 finished with value: 0.6584588008846867 and parameters: {'loss': 'coxph', 'learning_rate': 0.046293990427170924, 'n_estimators': 472, 'criterion': 'friedman_mse', 'min_samples_split': 10, 'min_samples_leaf': 3, 'min_weight_fraction_leaf': 0.06553158949191866, 'min_impurity_decrease': 0.9357844591922718, 'max_features': 0.6416052702611729, 'subsample': 0.356505985637719, 'dropout_rate': 0.416977004771346, 'ccp_alpha': 0.0012949310439002715}. Best is trial 218 with value: 0.6659976583847056.[0m
[32m[I 2022-04-22 18:55:46,371][0m Trial 332 finished with value: 0.5006540204610004 and parameters: {'loss': 'coxph', 'learning_rate': 0.07439451113984498, 'n_estimators': 438, 'criterion': 'friedman_mse', 'min_samples_split': 10, 'min_samples_leaf': 3, 'min_weight_fraction_leaf': 0.05121731007893213, 'min_impurity_decrease': 0.9637548297299456, 'max_features': 0.7546008084388247, 'subsample': 0.3874574609343678, 'dropout_rate': 0.38321143269268293, 'ccp_alpha': 0.2612380980236772}. Best is trial 218 with value: 0.6659976583847056.[0m
[32m[I 2022-04-22 18:56:47,527][0m Trial 333 finished with value: 0.6525163291346221 and parameters: {'loss': 'coxph', 'learning_rate': 0.06112150472416822, 'n_estimators': 526, 'criterion': 'friedman_mse', 'min_samples_split': 10, 'min_samples_leaf': 3, 'min_weight_fraction_leaf': 0.07850767406518923, 'min_impurity_decrease': 0.8610146841393574, 'max_features': 0.6790172232952385, 'subsample': 0.2570552549639989, 'dropout_rate': 0.2996414410710716, 'ccp_alpha': 0.10876637059266825}. Best is trial 218 with value: 0.6659976583847056.[0m
