[32m[I 2022-04-23 11:15:23,817][0m Trial 249 finished with value: 0.6334684426087737 and parameters: {'n_hidden': 512, 'mixture_components': 3, 'use_sparse_layer': False, 'use_batchnorm': False, 'use_dropout': False, 'mlp_size_1': 4, 'mlp_size_2': 1, 'mlp_size_3': 1, 'kernel': 'Normal', 'loss_name': 'NLLLoss'}. Best is trial 123 with value: 0.6857038111174789.[0m
[32m[I 2022-04-23 11:16:47,030][0m Trial 250 finished with value: 0.6795566292874213 and parameters: {'n_hidden': 2048, 'mixture_components': 9, 'use_sparse_layer': False, 'use_batchnorm': False, 'use_dropout': True, 'dropout': 0.10970680373377195, 'mlp_size_1': 7, 'mlp_size_2': 1, 'mlp_size_3': 0, 'kernel': 'Normal', 'loss_name': 'NLLLoss'}. Best is trial 123 with value: 0.6857038111174789.[0m
[32m[I 2022-04-23 11:18:28,379][0m Trial 251 finished with value: 0.6629050198773014 and parameters: {'n_hidden': 2048, 'mixture_components': 9, 'use_sparse_layer': False, 'use_batchnorm': False, 'use_dropout': True, 'dropout': 0.10462581401844559, 'mlp_size_1': 7, 'mlp_size_2': 1, 'mlp_size_3': 0, 'kernel': 'Normal', 'loss_name': 'CensoredNLLLoss'}. Best is trial 123 with value: 0.6857038111174789.[0m
[32m[I 2022-04-23 11:19:51,454][0m Trial 252 finished with value: 0.6784236328364261 and parameters: {'n_hidden': 2048, 'mixture_components': 9, 'use_sparse_layer': False, 'use_batchnorm': False, 'use_dropout': True, 'dropout': 0.13493612619534093, 'mlp_size_1': 7, 'mlp_size_2': 1, 'mlp_size_3': 0, 'kernel': 'Normal', 'loss_name': 'NLLLoss'}. Best is trial 123 with value: 0.6857038111174789.[0m
[32m[I 2022-04-23 11:21:17,879][0m Trial 253 finished with value: 0.6710524988820187 and parameters: {'n_hidden': 2048, 'mixture_components': 10, 'use_sparse_layer': False, 'use_batchnorm': False, 'use_dropout': True, 'dropout': 0.13866299310249416, 'mlp_size_1': 7, 'mlp_size_2': 1, 'mlp_size_3': 0, 'kernel': 'Normal', 'loss_name': 'NLLLoss'}. Best is trial 123 with value: 0.6857038111174789.[0m
[32m[I 2022-04-23 11:23:01,239][0m Trial 254 finished with value: 0.6694949706662885 and parameters: {'n_hidden': 2048, 'mixture_components': 9, 'use_sparse_layer': True, 'use_sparse_loss': True, 'lmbd': 0.00028500025407766737, 'use_batchnorm': False, 'use_dropout': True, 'dropout': 0.10795294361238905, 'mlp_size_1': 6, 'mlp_size_2': 1, 'mlp_size_3': 1, 'kernel': 'Normal', 'loss_name': 'CensoredNLLLoss'}. Best is trial 123 with value: 0.6857038111174789.[0m
[32m[I 2022-04-23 11:23:55,728][0m Trial 255 finished with value: 0.609116213271087 and parameters: {'n_hidden': 2048, 'mixture_components': 9, 'use_sparse_layer': False, 'use_batchnorm': False, 'use_dropout': True, 'dropout': 0.08350949349929965, 'mlp_size_1': 7, 'mlp_size_2': 1, 'mlp_size_3': 0, 'kernel': 'Exponential', 'loss_name': 'NLLLoss'}. Best is trial 123 with value: 0.6857038111174789.[0m
[32m[I 2022-04-23 11:24:52,426][0m Trial 256 finished with value: 0.5926789834570941 and parameters: {'n_hidden': 2048, 'mixture_components': 7, 'use_sparse_layer': False, 'use_batchnorm': False, 'use_dropout': True, 'dropout': 0.14675947919020754, 'mlp_size_1': 7, 'mlp_size_2': 1, 'mlp_size_3': 0, 'kernel': 'Gumbel', 'loss_name': 'NLLLoss'}. Best is trial 123 with value: 0.6857038111174789.[0m
[32m[I 2022-04-23 11:26:20,523][0m Trial 257 finished with value: 0.6628242167470655 and parameters: {'n_hidden': 2048, 'mixture_components': 9, 'use_sparse_layer': False, 'use_batchnorm': False, 'use_dropout': True, 'dropout': 0.13175617323320912, 'mlp_size_1': 7, 'mlp_size_2': 1, 'mlp_size_3': 0, 'kernel': 'Normal', 'loss_name': 'CensoredNLLLoss'}. Best is trial 123 with value: 0.6857038111174789.[0m
[32m[I 2022-04-23 11:27:51,997][0m Trial 258 finished with value: 0.630207058324613 and parameters: {'n_hidden': 2048, 'mixture_components': 10, 'use_sparse_layer': False, 'use_batchnorm': False, 'use_dropout': True, 'dropout': 0.11540820936643328, 'mlp_size_1': 7, 'mlp_size_2': 1, 'mlp_size_3': 0, 'kernel': 'Logistic', 'loss_name': 'NLLLoss'}. Best is trial 123 with value: 0.6857038111174789.[0m
[32m[I 2022-04-23 11:29:34,533][0m Trial 259 finished with value: 0.6673491853595099 and parameters: {'n_hidden': 2048, 'mixture_components': 9, 'use_sparse_layer': False, 'use_batchnorm': False, 'use_dropout': True, 'dropout': 0.09706219370619287, 'mlp_size_1': 7, 'mlp_size_2': 1, 'mlp_size_3': 0, 'kernel': 'Normal', 'loss_name': 'CensoredNLLLoss'}. Best is trial 123 with value: 0.6857038111174789.[0m
[32m[I 2022-04-23 11:30:44,167][0m Trial 260 finished with value: 0.6736327690391178 and parameters: {'n_hidden': 2048, 'mixture_components': 9, 'use_sparse_layer': True, 'use_sparse_loss': False, 'use_batchnorm': False, 'use_dropout': False, 'mlp_size_1': 8, 'mlp_size_2': 0, 'mlp_size_3': 0, 'kernel': 'Normal', 'loss_name': 'NLLLoss'}. Best is trial 123 with value: 0.6857038111174789.[0m
[32m[I 2022-04-23 11:32:00,055][0m Trial 261 finished with value: 0.6548215826187318 and parameters: {'n_hidden': 1024, 'mixture_components': 6, 'use_sparse_layer': False, 'use_batchnorm': False, 'use_dropout': True, 'dropout': 0.17581873013730914, 'mlp_size_1': 7, 'mlp_size_2': 0, 'mlp_size_3': 0, 'kernel': 'LogLogistic', 'loss_name': 'AlternativeNLLLoss'}. Best is trial 123 with value: 0.6857038111174789.[0m
[32m[I 2022-04-23 11:32:51,341][0m Trial 262 finished with value: 0.6664154078169596 and parameters: {'n_hidden': 256, 'mixture_components': 9, 'use_sparse_layer': False, 'use_batchnorm': False, 'use_dropout': True, 'dropout': 0.12688346950851048, 'mlp_size_1': 5, 'mlp_size_2': 0, 'mlp_size_3': 0, 'kernel': 'Normal', 'loss_name': 'NLLLoss'}. Best is trial 123 with value: 0.6857038111174789.[0m
[32m[I 2022-04-23 11:34:12,295][0m Trial 263 finished with value: 0.675843708093454 and parameters: {'n_hidden': 2048, 'mixture_components': 2, 'use_sparse_layer': False, 'use_batchnorm': False, 'use_dropout': True, 'dropout': 0.15552442806175196, 'mlp_size_1': 4, 'mlp_size_2': 3, 'mlp_size_3': 1, 'kernel': 'Normal', 'loss_name': 'CensoredNLLLoss'}. Best is trial 123 with value: 0.6857038111174789.[0m
[32m[I 2022-04-23 11:35:32,350][0m Trial 264 finished with value: 0.6812182718347823 and parameters: {'n_hidden': 2048, 'mixture_components': 2, 'use_sparse_layer': False, 'use_batchnorm': False, 'use_dropout': True, 'dropout': 0.16942524302689776, 'mlp_size_1': 4, 'mlp_size_2': 1, 'mlp_size_3': 2, 'kernel': 'Normal', 'loss_name': 'CensoredNLLLoss'}. Best is trial 123 with value: 0.6857038111174789.[0m
[32m[I 2022-04-23 11:36:45,361][0m Trial 265 finished with value: 0.6537594794941937 and parameters: {'n_hidden': 2048, 'mixture_components': 2, 'use_sparse_layer': False, 'use_batchnorm': False, 'use_dropout': True, 'dropout': 0.15843461852089438, 'mlp_size_1': 4, 'mlp_size_2': 4, 'mlp_size_3': 0, 'kernel': 'Normal', 'loss_name': 'CensoredNLLLoss'}. Best is trial 123 with value: 0.6857038111174789.[0m
[32m[I 2022-04-23 11:38:11,291][0m Trial 266 finished with value: 0.6768246497113248 and parameters: {'n_hidden': 2048, 'mixture_components': 2, 'use_sparse_layer': False, 'use_batchnorm': False, 'use_dropout': True, 'dropout': 0.16746180913908454, 'mlp_size_1': 4, 'mlp_size_2': 1, 'mlp_size_3': 2, 'kernel': 'Normal', 'loss_name': 'CensoredNLLLoss'}. Best is trial 123 with value: 0.6857038111174789.[0m
[32m[I 2022-04-23 11:41:17,475][0m Trial 267 finished with value: 0.6324810819685175 and parameters: {'n_hidden': 2048, 'mixture_components': 2, 'use_sparse_layer': True, 'use_sparse_loss': True, 'lmbd': 0.09080157257449666, 'use_batchnorm': True, 'use_dropout': True, 'dropout': 0.16676125386452673, 'mlp_size_1': 4, 'mlp_size_2': 1, 'mlp_size_3': 2, 'kernel': 'Normal', 'loss_name': 'CensoredNLLLoss'}. Best is trial 123 with value: 0.6857038111174789.[0m
[32m[I 2022-04-23 11:42:51,897][0m Trial 268 finished with value: 0.6608023184255765 and parameters: {'n_hidden': 2048, 'mixture_components': 2, 'use_sparse_layer': False, 'use_batchnorm': False, 'use_dropout': True, 'dropout': 0.15200845524005546, 'mlp_size_1': 4, 'mlp_size_2': 3, 'mlp_size_3': 1, 'kernel': 'Normal', 'loss_name': 'CensoredNLLLoss'}. Best is trial 123 with value: 0.6857038111174789.[0m
[32m[I 2022-04-23 11:44:12,603][0m Trial 269 finished with value: 0.6685452827791207 and parameters: {'n_hidden': 2048, 'mixture_components': 2, 'use_sparse_layer': False, 'use_batchnorm': False, 'use_dropout': True, 'dropout': 0.18370851275249137, 'mlp_size_1': 4, 'mlp_size_2': 1, 'mlp_size_3': 3, 'kernel': 'Normal', 'loss_name': 'CensoredNLLLoss'}. Best is trial 123 with value: 0.6857038111174789.[0m
[32m[I 2022-04-23 11:45:35,665][0m Trial 270 finished with value: 0.6811887090346106 and parameters: {'n_hidden': 2048, 'mixture_components': 2, 'use_sparse_layer': False, 'use_batchnorm': False, 'use_dropout': True, 'dropout': 0.14075392490209548, 'mlp_size_1': 4, 'mlp_size_2': 3, 'mlp_size_3': 1, 'kernel': 'Normal', 'loss_name': 'CensoredNLLLoss'}. Best is trial 123 with value: 0.6857038111174789.[0m
[32m[I 2022-04-23 11:47:02,950][0m Trial 271 finished with value: 0.6619380653263944 and parameters: {'n_hidden': 2048, 'mixture_components': 1, 'use_sparse_layer': False, 'use_batchnorm': False, 'use_dropout': True, 'dropout': 0.1342932221932268, 'mlp_size_1': 4, 'mlp_size_2': 3, 'mlp_size_3': 1, 'kernel': 'Normal', 'loss_name': 'CensoredNLLLoss'}. Best is trial 123 with value: 0.6857038111174789.[0m
[32m[I 2022-04-23 11:48:27,060][0m Trial 272 finished with value: 0.6637832216863557 and parameters: {'n_hidden': 2048, 'mixture_components': 2, 'use_sparse_layer': False, 'use_batchnorm': False, 'use_dropout': True, 'dropout': 0.11870698265624176, 'mlp_size_1': 4, 'mlp_size_2': 1, 'mlp_size_3': 2, 'kernel': 'Normal', 'loss_name': 'CensoredNLLLoss'}. Best is trial 123 with value: 0.6857038111174789.[0m
[32m[I 2022-04-23 11:49:23,975][0m Trial 273 finished with value: 0.6541584483997223 and parameters: {'n_hidden': 2048, 'mixture_components': 2, 'use_sparse_layer': False, 'use_batchnorm': False, 'use_dropout': False, 'mlp_size_1': 4, 'mlp_size_2': 4, 'mlp_size_3': 0, 'kernel': 'Normal', 'loss_name': 'NLLLoss'}. Best is trial 123 with value: 0.6857038111174789.[0m
[32m[I 2022-04-23 11:50:35,545][0m Trial 274 finished with value: 0.6646589146607613 and parameters: {'n_hidden': 2048, 'mixture_components': 2, 'use_sparse_layer': True, 'use_sparse_loss': False, 'use_batchnorm': False, 'use_dropout': True, 'dropout': 0.1714995320185815, 'mlp_size_1': 4, 'mlp_size_2': 1, 'mlp_size_3': 2, 'kernel': 'Normal', 'loss_name': 'NLLLoss'}. Best is trial 123 with value: 0.6857038111174789.[0m
[32m[I 2022-04-23 11:52:05,742][0m Trial 275 finished with value: 0.6645879238062291 and parameters: {'n_hidden': 2048, 'mixture_components': 3, 'use_sparse_layer': False, 'use_batchnorm': False, 'use_dropout': True, 'dropout': 0.1399418781769779, 'mlp_size_1': 4, 'mlp_size_2': 3, 'mlp_size_3': 1, 'kernel': 'Normal', 'loss_name': 'CensoredNLLLoss'}. Best is trial 123 with value: 0.6857038111174789.[0m
[32m[I 2022-04-23 11:53:12,682][0m Trial 276 finished with value: 0.6766419655274324 and parameters: {'n_hidden': 2048, 'mixture_components': 2, 'use_sparse_layer': False, 'use_batchnorm': False, 'use_dropout': True, 'dropout': 0.19304292150723856, 'mlp_size_1': 4, 'mlp_size_2': 1, 'mlp_size_3': 1, 'kernel': 'Gumbel', 'loss_name': 'NLLLoss'}. Best is trial 123 with value: 0.6857038111174789.[0m
[32m[I 2022-04-23 11:54:19,300][0m Trial 277 finished with value: 0.6647135826771978 and parameters: {'n_hidden': 2048, 'mixture_components': 2, 'use_sparse_layer': False, 'use_batchnorm': False, 'use_dropout': True, 'dropout': 0.18913601594551926, 'mlp_size_1': 4, 'mlp_size_2': 1, 'mlp_size_3': 3, 'kernel': 'Gumbel', 'loss_name': 'NLLLoss'}. Best is trial 123 with value: 0.6857038111174789.[0m
[32m[I 2022-04-23 11:55:33,327][0m Trial 278 finished with value: 0.6767989159316075 and parameters: {'n_hidden': 2048, 'mixture_components': 2, 'use_sparse_layer': False, 'use_batchnorm': False, 'use_dropout': True, 'dropout': 0.17183136336342955, 'mlp_size_1': 4, 'mlp_size_2': 1, 'mlp_size_3': 1, 'kernel': 'Gumbel', 'loss_name': 'CensoredNLLLoss'}. Best is trial 123 with value: 0.6857038111174789.[0m
[32m[I 2022-04-23 11:56:42,841][0m Trial 279 finished with value: 0.6675781338800063 and parameters: {'n_hidden': 2048, 'mixture_components': 2, 'use_sparse_layer': False, 'use_batchnorm': False, 'use_dropout': True, 'dropout': 0.16891646234194704, 'mlp_size_1': 7, 'mlp_size_2': 1, 'mlp_size_3': 0, 'kernel': 'Gumbel', 'loss_name': 'CensoredNLLLoss'}. Best is trial 123 with value: 0.6857038111174789.[0m
[32m[I 2022-04-23 11:57:57,149][0m Trial 280 finished with value: 0.6745226112438942 and parameters: {'n_hidden': 2048, 'mixture_components': 2, 'use_sparse_layer': False, 'use_batchnorm': False, 'use_dropout': True, 'dropout': 0.14648053692657517, 'mlp_size_1': 4, 'mlp_size_2': 1, 'mlp_size_3': 1, 'kernel': 'Gumbel', 'loss_name': 'CensoredNLLLoss'}. Best is trial 123 with value: 0.6857038111174789.[0m
[32m[I 2022-04-23 11:59:09,574][0m Trial 281 finished with value: 0.6403826057197818 and parameters: {'n_hidden': 2048, 'mixture_components': 2, 'use_sparse_layer': False, 'use_batchnorm': False, 'use_dropout': True, 'dropout': 0.18570066879095198, 'mlp_size_1': 4, 'mlp_size_2': 1, 'mlp_size_3': 2, 'kernel': 'Gumbel', 'loss_name': 'CensoredNLLLoss'}. Best is trial 123 with value: 0.6857038111174789.[0m
[32m[I 2022-04-23 12:00:17,619][0m Trial 282 finished with value: 0.5900903671076858 and parameters: {'n_hidden': 2048, 'mixture_components': 2, 'use_sparse_layer': False, 'use_batchnorm': False, 'use_dropout': True, 'dropout': 0.12426441755218082, 'mlp_size_1': 7, 'mlp_size_2': 1, 'mlp_size_3': 0, 'kernel': 'Gumbel', 'loss_name': 'CensoredNLLLoss'}. Best is trial 123 with value: 0.6857038111174789.[0m
[32m[I 2022-04-23 12:01:38,009][0m Trial 283 finished with value: 0.6695094915194654 and parameters: {'n_hidden': 2048, 'mixture_components': 2, 'use_sparse_layer': False, 'use_batchnorm': False, 'use_dropout': True, 'dropout': 0.162623919043389, 'mlp_size_1': 4, 'mlp_size_2': 1, 'mlp_size_3': 2, 'kernel': 'Gumbel', 'loss_name': 'CensoredNLLLoss'}. Best is trial 123 with value: 0.6857038111174789.[0m
[32m[I 2022-04-23 12:02:59,393][0m Trial 284 finished with value: 0.32956655830169473 and parameters: {'n_hidden': 2048, 'mixture_components': 1, 'use_sparse_layer': False, 'use_batchnorm': False, 'use_dropout': True, 'dropout': 0.7000157243144596, 'mlp_size_1': 4, 'mlp_size_2': 1, 'mlp_size_3': 2, 'kernel': 'Gumbel', 'loss_name': 'CensoredNLLLoss'}. Best is trial 123 with value: 0.6857038111174789.[0m
[32m[I 2022-04-23 12:04:32,751][0m Trial 285 finished with value: 0.6600763908172157 and parameters: {'n_hidden': 2048, 'mixture_components': 2, 'use_sparse_layer': False, 'use_batchnorm': False, 'use_dropout': False, 'mlp_size_1': 8, 'mlp_size_2': 0, 'mlp_size_3': 0, 'kernel': 'Gumbel', 'loss_name': 'CensoredNLLLoss'}. Best is trial 123 with value: 0.6857038111174789.[0m
[32m[I 2022-04-23 12:05:42,885][0m Trial 286 finished with value: 0.6630054532305986 and parameters: {'n_hidden': 2048, 'mixture_components': 2, 'use_sparse_layer': False, 'use_batchnorm': False, 'use_dropout': True, 'dropout': 0.039926467108853836, 'mlp_size_1': 4, 'mlp_size_2': 1, 'mlp_size_3': 2, 'kernel': 'Gumbel', 'loss_name': 'CensoredNLLLoss'}. Best is trial 123 with value: 0.6857038111174789.[0m
[32m[I 2022-04-23 12:06:59,176][0m Trial 287 finished with value: 0.6711937262833945 and parameters: {'n_hidden': 2048, 'mixture_components': 2, 'use_sparse_layer': False, 'use_batchnorm': False, 'use_dropout': True, 'dropout': 0.06978296160407527, 'mlp_size_1': 4, 'mlp_size_2': 4, 'mlp_size_3': 0, 'kernel': 'Gumbel', 'loss_name': 'CensoredNLLLoss'}. Best is trial 123 with value: 0.6857038111174789.[0m
[32m[I 2022-04-23 12:09:30,829][0m Trial 288 finished with value: 0.6468254483415576 and parameters: {'n_hidden': 64, 'mixture_components': 5, 'use_sparse_layer': False, 'use_batchnorm': True, 'use_dropout': True, 'dropout': 0.14386059188596065, 'mlp_size_1': 3, 'mlp_size_2': 0, 'mlp_size_3': 0, 'kernel': 'Normal', 'loss_name': 'AlternativeNLLLoss'}. Best is trial 123 with value: 0.6857038111174789.[0m
[32m[I 2022-04-23 12:10:38,218][0m Trial 289 finished with value: 0.6531459436005002 and parameters: {'n_hidden': 2048, 'mixture_components': 2, 'use_sparse_layer': False, 'use_batchnorm': False, 'use_dropout': True, 'dropout': 0.2003753258113462, 'mlp_size_1': 0, 'mlp_size_2': 3, 'mlp_size_3': 1, 'kernel': 'Gumbel', 'loss_name': 'NLLLoss'}. Best is trial 123 with value: 0.6857038111174789.[0m
[32m[I 2022-04-23 12:11:38,856][0m Trial 290 finished with value: 0.6598091041475476 and parameters: {'n_hidden': 128, 'mixture_components': 2, 'use_sparse_layer': False, 'use_batchnorm': False, 'use_dropout': True, 'dropout': 0.10861573345067226, 'mlp_size_1': 4, 'mlp_size_2': 0, 'mlp_size_3': 0, 'kernel': 'Exponential', 'loss_name': 'NLLLoss'}. Best is trial 123 with value: 0.6857038111174789.[0m
[32m[I 2022-04-23 12:13:25,115][0m Trial 291 finished with value: 0.6586410731600136 and parameters: {'n_hidden': 2048, 'mixture_components': 5, 'use_sparse_layer': False, 'use_batchnorm': False, 'use_dropout': True, 'dropout': 0.1590491735013646, 'mlp_size_1': 7, 'mlp_size_2': 1, 'mlp_size_3': 0, 'kernel': 'Normal', 'loss_name': 'CensoredNLLLoss'}. Best is trial 123 with value: 0.6857038111174789.[0m
[32m[I 2022-04-23 12:14:28,252][0m Trial 292 finished with value: 0.6619969977975192 and parameters: {'n_hidden': 32, 'mixture_components': 3, 'use_sparse_layer': False, 'use_batchnorm': False, 'use_dropout': True, 'dropout': 0.17629160752089618, 'mlp_size_1': 2, 'mlp_size_2': 0, 'mlp_size_3': 0, 'kernel': 'Normal', 'loss_name': 'NLLLoss'}. Best is trial 123 with value: 0.6857038111174789.[0m
[32m[I 2022-04-23 12:15:49,533][0m Trial 293 finished with value: 0.6611755306564695 and parameters: {'n_hidden': 2048, 'mixture_components': 4, 'use_sparse_layer': False, 'use_batchnorm': False, 'use_dropout': True, 'dropout': 0.09004010179302926, 'mlp_size_1': 6, 'mlp_size_2': 1, 'mlp_size_3': 1, 'kernel': 'LogLogistic', 'loss_name': 'CensoredNLLLoss'}. Best is trial 123 with value: 0.6857038111174789.[0m
[32m[I 2022-04-23 12:16:58,680][0m Trial 294 finished with value: 0.6767143314324228 and parameters: {'n_hidden': 2048, 'mixture_components': 3, 'use_sparse_layer': False, 'use_batchnorm': False, 'use_dropout': True, 'dropout': 0.13261598063848562, 'mlp_size_1': 4, 'mlp_size_2': 1, 'mlp_size_3': 1, 'kernel': 'Normal', 'loss_name': 'NLLLoss'}. Best is trial 123 with value: 0.6857038111174789.[0m
[32m[I 2022-04-23 12:18:03,829][0m Trial 295 finished with value: 0.6582993115848399 and parameters: {'n_hidden': 1024, 'mixture_components': 3, 'use_sparse_layer': False, 'use_batchnorm': False, 'use_dropout': True, 'dropout': 0.1301730567455261, 'mlp_size_1': 4, 'mlp_size_2': 1, 'mlp_size_3': 1, 'kernel': 'Normal', 'loss_name': 'NLLLoss'}. Best is trial 123 with value: 0.6857038111174789.[0m
[32m[I 2022-04-23 12:19:08,986][0m Trial 296 finished with value: 0.6498910732098745 and parameters: {'n_hidden': 256, 'mixture_components': 3, 'use_sparse_layer': False, 'use_batchnorm': False, 'use_dropout': True, 'dropout': 0.11244710022427659, 'mlp_size_1': 5, 'mlp_size_2': 0, 'mlp_size_3': 0, 'kernel': 'Normal', 'loss_name': 'CensoredNLLLoss'}. Best is trial 123 with value: 0.6857038111174789.[0m
[32m[I 2022-04-23 12:20:25,321][0m Trial 297 finished with value: 0.6766055862315413 and parameters: {'n_hidden': 2048, 'mixture_components': 3, 'use_sparse_layer': False, 'use_batchnorm': False, 'use_dropout': True, 'dropout': 0.13769912977333068, 'mlp_size_1': 4, 'mlp_size_2': 1, 'mlp_size_3': 2, 'kernel': 'Normal', 'loss_name': 'NLLLoss'}. Best is trial 123 with value: 0.6857038111174789.[0m
[32m[I 2022-04-23 12:21:25,860][0m Trial 298 finished with value: 0.6730162002220206 and parameters: {'n_hidden': 2048, 'mixture_components': 5, 'use_sparse_layer': False, 'use_batchnorm': False, 'use_dropout': False, 'mlp_size_1': 7, 'mlp_size_2': 1, 'mlp_size_3': 0, 'kernel': 'Normal', 'loss_name': 'NLLLoss'}. Best is trial 123 with value: 0.6857038111174789.[0m
[32m[I 2022-04-23 12:22:45,203][0m Trial 299 finished with value: 0.6782240754946619 and parameters: {'n_hidden': 2048, 'mixture_components': 3, 'use_sparse_layer': False, 'use_batchnorm': False, 'use_dropout': True, 'dropout': 0.0803087465049175, 'mlp_size_1': 4, 'mlp_size_2': 1, 'mlp_size_3': 1, 'kernel': 'Normal', 'loss_name': 'CensoredNLLLoss'}. Best is trial 123 with value: 0.6857038111174789.[0m
[32m[I 2022-04-23 12:23:59,809][0m Trial 300 finished with value: 0.6450551269992733 and parameters: {'n_hidden': 2048, 'mixture_components': 3, 'use_sparse_layer': False, 'use_batchnorm': False, 'use_dropout': True, 'dropout': 0.015127577226712291, 'mlp_size_1': 4, 'mlp_size_2': 1, 'mlp_size_3': 2, 'kernel': 'Normal', 'loss_name': 'CensoredNLLLoss'}. Best is trial 123 with value: 0.6857038111174789.[0m
[32m[I 2022-04-23 12:25:11,468][0m Trial 301 finished with value: 0.6497057922165661 and parameters: {'n_hidden': 512, 'mixture_components': 10, 'use_sparse_layer': False, 'use_batchnorm': False, 'use_dropout': True, 'dropout': 0.06278872605380792, 'mlp_size_1': 6, 'mlp_size_2': 0, 'mlp_size_3': 0, 'kernel': 'Normal', 'loss_name': 'CensoredNLLLoss'}. Best is trial 123 with value: 0.6857038111174789.[0m
[32m[I 2022-04-23 12:26:25,655][0m Trial 302 finished with value: 0.6317250417676468 and parameters: {'n_hidden': 64, 'mixture_components': 4, 'use_sparse_layer': False, 'use_batchnorm': False, 'use_dropout': True, 'dropout': 0.08779045510504217, 'mlp_size_1': 3, 'mlp_size_2': 0, 'mlp_size_3': 0, 'kernel': 'Normal', 'loss_name': 'CensoredNLLLoss'}. Best is trial 123 with value: 0.6857038111174789.[0m
