[32m[I 2022-04-21 11:50:32,730][0m Trial 777 finished with value: 0.6336943362975 and parameters: {'splitter': 'best', 'min_samples_split': 0.1210816484480581, 'min_samples_leaf': 0.017400016827888647, 'min_weight_fraction_leaf': 0.016108857366430397, 'max_features': 0.7481604226719091}. Best is trial 688 with value: 0.6612018755665507.[0m
[32m[I 2022-04-21 11:50:33,472][0m Trial 778 finished with value: 0.644470167885398 and parameters: {'splitter': 'best', 'min_samples_split': 0.14957402286273794, 'min_samples_leaf': 0.009541170727362935, 'min_weight_fraction_leaf': 0.010670183689035315, 'max_features': 0.7832568248537919}. Best is trial 688 with value: 0.6612018755665507.[0m
[32m[I 2022-04-21 11:50:33,778][0m Trial 779 finished with value: 0.6206892142498164 and parameters: {'splitter': 'best', 'min_samples_split': 0.13416245666144455, 'min_samples_leaf': 0.046024869036282647, 'min_weight_fraction_leaf': 0.024076946312791066, 'max_features': 0.8364268722252065}. Best is trial 688 with value: 0.6612018755665507.[0m
[32m[I 2022-04-21 11:50:33,850][0m Trial 780 finished with value: 0.5918541549819327 and parameters: {'splitter': 'random', 'min_samples_split': 0.4997791180940589, 'min_samples_leaf': 0.025257201930261434, 'min_weight_fraction_leaf': 0.01645516237674253, 'max_features': 0.5251568093145174}. Best is trial 688 with value: 0.6612018755665507.[0m
[32m[I 2022-04-21 11:50:34,219][0m Trial 781 finished with value: 0.6311018209272417 and parameters: {'splitter': 'best', 'min_samples_split': 0.24826665093945355, 'min_samples_leaf': 0.011711067259884536, 'min_weight_fraction_leaf': 1.1356160241456081e-05, 'max_features': 0.5571568296138101}. Best is trial 688 with value: 0.6612018755665507.[0m
[32m[I 2022-04-21 11:50:34,697][0m Trial 782 finished with value: 0.6301555930040121 and parameters: {'splitter': 'best', 'min_samples_split': 0.11201796133140104, 'min_samples_leaf': 0.001253410006595213, 'min_weight_fraction_leaf': 0.03321732318131519, 'max_features': 0.733687538728925}. Best is trial 688 with value: 0.6612018755665507.[0m
[32m[I 2022-04-21 11:50:35,069][0m Trial 783 finished with value: 0.6435397041943084 and parameters: {'splitter': 'best', 'min_samples_split': 0.14403752640903225, 'min_samples_leaf': 0.01977964156351461, 'min_weight_fraction_leaf': 0.008221917976078016, 'max_features': 0.5838405509476055}. Best is trial 688 with value: 0.6612018755665507.[0m
[32m[I 2022-04-21 11:50:35,381][0m Trial 784 finished with value: 0.6213650884303068 and parameters: {'splitter': 'best', 'min_samples_split': 0.09644981523463662, 'min_samples_leaf': 0.03315960337197951, 'min_weight_fraction_leaf': 0.025091974708654808, 'max_features': 0.764278714026}. Best is trial 688 with value: 0.6612018755665507.[0m
[32m[I 2022-04-21 11:50:35,732][0m Trial 785 finished with value: 0.6428808665912904 and parameters: {'splitter': 'best', 'min_samples_split': 0.26995770038277406, 'min_samples_leaf': 0.00937530914938826, 'min_weight_fraction_leaf': 0.015138806051958097, 'max_features': 0.6234016739053211}. Best is trial 688 with value: 0.6612018755665507.[0m
[32m[I 2022-04-21 11:50:35,856][0m Trial 786 finished with value: 0.5800574587083871 and parameters: {'splitter': 'best', 'min_samples_split': 0.12697294682352045, 'min_samples_leaf': 0.1749388085518095, 'min_weight_fraction_leaf': 0.00012026681889219792, 'max_features': 0.5960131904507119}. Best is trial 688 with value: 0.6612018755665507.[0m
[32m[I 2022-04-21 11:50:36,299][0m Trial 787 finished with value: 0.6367191114098877 and parameters: {'splitter': 'best', 'min_samples_split': 0.13567510406822494, 'min_samples_leaf': 0.021879282919822936, 'min_weight_fraction_leaf': 0.009185706617828956, 'max_features': 0.8030253295576997}. Best is trial 688 with value: 0.6612018755665507.[0m
[32m[I 2022-04-21 11:50:36,717][0m Trial 788 finished with value: 0.6208758904918839 and parameters: {'splitter': 'best', 'min_samples_split': 0.11736032855199056, 'min_samples_leaf': 0.01677138899804531, 'min_weight_fraction_leaf': 0.025137900518212585, 'max_features': 0.6419036304963619}. Best is trial 688 with value: 0.6612018755665507.[0m
[32m[I 2022-04-21 11:50:37,010][0m Trial 789 finished with value: 0.62372365610999 and parameters: {'splitter': 'best', 'min_samples_split': 0.15395134352380213, 'min_samples_leaf': 0.03157099282894671, 'min_weight_fraction_leaf': 0.04023427014815918, 'max_features': 0.7273131011477619}. Best is trial 688 with value: 0.6612018755665507.[0m
[32m[I 2022-04-21 11:50:37,227][0m Trial 790 finished with value: 0.6138517216164472 and parameters: {'splitter': 'best', 'min_samples_split': 0.11007881388893048, 'min_samples_leaf': 0.06741184480519301, 'min_weight_fraction_leaf': 0.018340312069671422, 'max_features': 0.784719459708897}. Best is trial 688 with value: 0.6612018755665507.[0m
[32m[I 2022-04-21 11:50:37,849][0m Trial 791 finished with value: 0.6309940313237157 and parameters: {'splitter': 'best', 'min_samples_split': 0.10017274742971463, 'min_samples_leaf': 0.001180224803422534, 'min_weight_fraction_leaf': 0.007916550929351696, 'max_features': 0.6053831202796361}. Best is trial 688 with value: 0.6612018755665507.[0m
[32m[I 2022-04-21 11:50:38,315][0m Trial 792 finished with value: 0.6504310229289885 and parameters: {'splitter': 'best', 'min_samples_split': 0.08789516177378524, 'min_samples_leaf': 0.011293486780525143, 'min_weight_fraction_leaf': 0.03084914408927518, 'max_features': 0.8260795076418564}. Best is trial 688 with value: 0.6612018755665507.[0m
[32m[I 2022-04-21 11:50:38,622][0m Trial 793 finished with value: 0.6239584726689003 and parameters: {'splitter': 'best', 'min_samples_split': 0.08827050267777514, 'min_samples_leaf': 0.040721967868586194, 'min_weight_fraction_leaf': 0.04916236873322469, 'max_features': 0.8478281274628116}. Best is trial 688 with value: 0.6612018755665507.[0m
[32m[I 2022-04-21 11:50:39,068][0m Trial 794 finished with value: 0.6220842447218858 and parameters: {'splitter': 'best', 'min_samples_split': 0.084485676016685, 'min_samples_leaf': 0.023764365559350905, 'min_weight_fraction_leaf': 0.03393546836864286, 'max_features': 0.8291374794065532}. Best is trial 688 with value: 0.6612018755665507.[0m
[32m[I 2022-04-21 11:50:39,513][0m Trial 795 finished with value: 0.6440881900747641 and parameters: {'splitter': 'best', 'min_samples_split': 0.07092874682589037, 'min_samples_leaf': 0.01579623603682441, 'min_weight_fraction_leaf': 0.028820221135132988, 'max_features': 0.8242756253495134}. Best is trial 688 with value: 0.6612018755665507.[0m
[32m[I 2022-04-21 11:50:40,279][0m Trial 796 finished with value: 0.6365822848741186 and parameters: {'splitter': 'best', 'min_samples_split': 0.08527999227583583, 'min_samples_leaf': 0.011057438121289828, 'min_weight_fraction_leaf': 0.019082075271693224, 'max_features': 0.8496341226094488}. Best is trial 688 with value: 0.6612018755665507.[0m
[32m[I 2022-04-21 11:50:41,162][0m Trial 797 finished with value: 0.6499163510663469 and parameters: {'splitter': 'best', 'min_samples_split': 0.09019071711573427, 'min_samples_leaf': 0.027701827896095925, 'min_weight_fraction_leaf': 0.007637766291273955, 'max_features': 0.8230893314200907}. Best is trial 688 with value: 0.6612018755665507.[0m
[32m[I 2022-04-21 11:50:41,780][0m Trial 798 finished with value: 0.628999112884442 and parameters: {'splitter': 'best', 'min_samples_split': 0.073937079375882, 'min_samples_leaf': 0.04655335748392479, 'min_weight_fraction_leaf': 0.03508876812924132, 'max_features': 0.8709591775682851}. Best is trial 688 with value: 0.6612018755665507.[0m
[32m[I 2022-04-21 11:50:42,478][0m Trial 799 finished with value: 0.6358252080385027 and parameters: {'splitter': 'best', 'min_samples_split': 0.07956524570688595, 'min_samples_leaf': 0.032165061802532514, 'min_weight_fraction_leaf': 0.02599148844820641, 'max_features': 0.8258394107398073}. Best is trial 688 with value: 0.6612018755665507.[0m
[32m[I 2022-04-21 11:50:42,591][0m Trial 800 finished with value: 0.6212433724694838 and parameters: {'splitter': 'random', 'min_samples_split': 0.08774081384794147, 'min_samples_leaf': 0.025371070513476375, 'min_weight_fraction_leaf': 0.04463816704803414, 'max_features': 0.8638478921377696}. Best is trial 688 with value: 0.6612018755665507.[0m
[32m[I 2022-04-21 11:50:43,088][0m Trial 801 finished with value: 0.621032327221383 and parameters: {'splitter': 'best', 'min_samples_split': 0.10261528433948124, 'min_samples_leaf': 0.03740370861384429, 'min_weight_fraction_leaf': 0.01731585927390028, 'max_features': 0.8320312278185802}. Best is trial 688 with value: 0.6612018755665507.[0m
[32m[I 2022-04-21 11:50:43,777][0m Trial 802 finished with value: 0.6153127310735023 and parameters: {'splitter': 'best', 'min_samples_split': 0.09697015237724649, 'min_samples_leaf': 0.009898057075324915, 'min_weight_fraction_leaf': 0.0264526275830798, 'max_features': 0.8085478845940066}. Best is trial 688 with value: 0.6612018755665507.[0m
[32m[I 2022-04-21 11:50:44,356][0m Trial 803 finished with value: 0.6147900334828721 and parameters: {'splitter': 'best', 'min_samples_split': 0.30230601102931115, 'min_samples_leaf': 0.05478138772328512, 'min_weight_fraction_leaf': 0.010592707921897584, 'max_features': 0.8445427366942291}. Best is trial 688 with value: 0.6612018755665507.[0m
[32m[I 2022-04-21 11:50:44,865][0m Trial 804 finished with value: 0.5398373364311787 and parameters: {'splitter': 'best', 'min_samples_split': 0.08839334255802063, 'min_samples_leaf': 0.0220704359791291, 'min_weight_fraction_leaf': 0.4241014283005111, 'max_features': 0.8071638009039721}. Best is trial 688 with value: 0.6612018755665507.[0m
[32m[I 2022-04-21 11:50:49,862][0m Trial 805 finished with value: 0.625711399486147 and parameters: {'splitter': 'best', 'min_samples_split': 0.09197962441956159, 'min_samples_leaf': 0.00127525171742327, 'min_weight_fraction_leaf': 9.338654103946929e-05, 'max_features': 0.823025701989927}. Best is trial 688 with value: 0.6612018755665507.[0m
[32m[I 2022-04-21 11:50:50,553][0m Trial 806 finished with value: 0.6063943552782205 and parameters: {'splitter': 'best', 'min_samples_split': 0.0738278840268549, 'min_samples_leaf': 0.01416434361056714, 'min_weight_fraction_leaf': 0.03650309305997668, 'max_features': 0.812295166310083}. Best is trial 688 with value: 0.6612018755665507.[0m
[32m[I 2022-04-21 11:50:50,955][0m Trial 807 finished with value: 0.6405799819104354 and parameters: {'splitter': 'best', 'min_samples_split': 0.09637186014814542, 'min_samples_leaf': 0.029925267097095913, 'min_weight_fraction_leaf': 0.020305927710459252, 'max_features': 0.8661700655062191}. Best is trial 688 with value: 0.6612018755665507.[0m
[32m[I 2022-04-21 11:50:52,084][0m Trial 808 finished with value: 0.626808830369699 and parameters: {'splitter': 'best', 'min_samples_split': 0.06676527677945235, 'min_samples_leaf': 0.010347682855082141, 'min_weight_fraction_leaf': 0.0114138845335205, 'max_features': 0.8396773709814045}. Best is trial 688 with value: 0.6612018755665507.[0m
[32m[I 2022-04-21 11:50:52,971][0m Trial 809 finished with value: 0.642008590997359 and parameters: {'splitter': 'best', 'min_samples_split': 0.08055745656427292, 'min_samples_leaf': 0.018733958260439998, 'min_weight_fraction_leaf': 0.009223795221065059, 'max_features': 0.7892475184285583}. Best is trial 688 with value: 0.6612018755665507.[0m
[32m[I 2022-04-21 11:50:53,286][0m Trial 810 finished with value: 0.6140391836458519 and parameters: {'splitter': 'best', 'min_samples_split': 0.1038122064317008, 'min_samples_leaf': 0.03936161308022143, 'min_weight_fraction_leaf': 0.024992481704861035, 'max_features': 0.8091043315909628}. Best is trial 688 with value: 0.6612018755665507.[0m
[32m[I 2022-04-21 11:50:53,975][0m Trial 811 finished with value: 0.5985624684953283 and parameters: {'splitter': 'best', 'min_samples_split': 0.09886894271813988, 'min_samples_leaf': 0.026203839444481236, 'min_weight_fraction_leaf': 0.06835965451253886, 'max_features': 0.8597521112999321}. Best is trial 688 with value: 0.6612018755665507.[0m
[32m[I 2022-04-21 11:50:55,519][0m Trial 812 finished with value: 0.6412112449301951 and parameters: {'splitter': 'best', 'min_samples_split': 0.11003431348899888, 'min_samples_leaf': 0.0011228757255849504, 'min_weight_fraction_leaf': 0.008855071829510727, 'max_features': 0.8335222373365038}. Best is trial 688 with value: 0.6612018755665507.[0m
[32m[I 2022-04-21 11:50:56,142][0m Trial 813 finished with value: 0.6156157532328381 and parameters: {'splitter': 'best', 'min_samples_split': 0.08705996516040758, 'min_samples_leaf': 0.009885380123204977, 'min_weight_fraction_leaf': 0.019265253157621707, 'max_features': 0.8934311391879535}. Best is trial 688 with value: 0.6612018755665507.[0m
[32m[I 2022-04-21 11:50:56,834][0m Trial 814 finished with value: 0.6361944522901813 and parameters: {'splitter': 'best', 'min_samples_split': 0.1169719861821098, 'min_samples_leaf': 0.018283718142937513, 'min_weight_fraction_leaf': 0.02776906117981625, 'max_features': 0.7965598809612335}. Best is trial 688 with value: 0.6612018755665507.[0m
[32m[I 2022-04-21 11:50:57,524][0m Trial 815 finished with value: 0.6030476395567662 and parameters: {'splitter': 'best', 'min_samples_split': 0.10457859367676792, 'min_samples_leaf': 0.0012652598477932771, 'min_weight_fraction_leaf': 0.052412501396374635, 'max_features': 0.8224768649471622}. Best is trial 688 with value: 0.6612018755665507.[0m
[32m[I 2022-04-21 11:50:57,919][0m Trial 816 finished with value: 0.6234974524226835 and parameters: {'splitter': 'best', 'min_samples_split': 0.09436048055390746, 'min_samples_leaf': 0.03233436247807892, 'min_weight_fraction_leaf': 7.502179626370405e-05, 'max_features': 0.7778587211464632}. Best is trial 688 with value: 0.6612018755665507.[0m
[32m[I 2022-04-21 11:50:57,968][0m Trial 817 finished with value: 0.5341181029738987 and parameters: {'splitter': 'best', 'min_samples_split': 0.12602325471403925, 'min_samples_leaf': 0.47769455834615426, 'min_weight_fraction_leaf': 0.03500412276797527, 'max_features': 0.8527771859096895}. Best is trial 688 with value: 0.6612018755665507.[0m
[32m[I 2022-04-21 11:50:58,138][0m Trial 818 finished with value: 0.6315747688852404 and parameters: {'splitter': 'random', 'min_samples_split': 0.10895401198828457, 'min_samples_leaf': 0.01753293355097811, 'min_weight_fraction_leaf': 0.015878784850663484, 'max_features': 0.7939182213287055}. Best is trial 688 with value: 0.6612018755665507.[0m
[32m[I 2022-04-21 11:50:59,159][0m Trial 819 finished with value: 0.648676313485702 and parameters: {'splitter': 'best', 'min_samples_split': 0.08621489690264844, 'min_samples_leaf': 0.010541680779184836, 'min_weight_fraction_leaf': 0.008179626858827402, 'max_features': 0.8159394506096601}. Best is trial 688 with value: 0.6612018755665507.[0m
[32m[I 2022-04-21 11:50:59,751][0m Trial 820 finished with value: 0.6425921716648781 and parameters: {'splitter': 'best', 'min_samples_split': 0.06344154873795882, 'min_samples_leaf': 0.02460012346062408, 'min_weight_fraction_leaf': 0.009132379102297788, 'max_features': 0.8267493426330007}. Best is trial 688 with value: 0.6612018755665507.[0m
[32m[I 2022-04-21 11:51:00,225][0m Trial 821 finished with value: 0.5983049839055128 and parameters: {'splitter': 'best', 'min_samples_split': 0.07630744340156437, 'min_samples_leaf': 0.046819823583021704, 'min_weight_fraction_leaf': 0.0086054656853824, 'max_features': 0.8094911140930074}. Best is trial 688 with value: 0.6612018755665507.[0m
[32m[I 2022-04-21 11:51:01,424][0m Trial 822 finished with value: 0.6315613270793108 and parameters: {'splitter': 'best', 'min_samples_split': 0.08454626647782276, 'min_samples_leaf': 0.010231764830738685, 'min_weight_fraction_leaf': 0.00936276878952818, 'max_features': 0.8292221140587563}. Best is trial 688 with value: 0.6612018755665507.[0m
[32m[I 2022-04-21 11:51:02,178][0m Trial 823 finished with value: 0.6388402029414981 and parameters: {'splitter': 'best', 'min_samples_split': 0.08272360678598367, 'min_samples_leaf': 0.027289483584764872, 'min_weight_fraction_leaf': 0.007862990938848955, 'max_features': 0.8594978489859466}. Best is trial 688 with value: 0.6612018755665507.[0m
[32m[I 2022-04-21 11:51:02,806][0m Trial 824 finished with value: 0.6198891662117025 and parameters: {'splitter': 'best', 'min_samples_split': 0.0710139017956598, 'min_samples_leaf': 0.018068991725392263, 'min_weight_fraction_leaf': 0.01748088520938683, 'max_features': 0.838841495558233}. Best is trial 688 with value: 0.6612018755665507.[0m
[32m[I 2022-04-21 11:51:03,463][0m Trial 825 finished with value: 0.6224466835895263 and parameters: {'splitter': 'best', 'min_samples_split': 0.05532855199338355, 'min_samples_leaf': 0.03819705100119178, 'min_weight_fraction_leaf': 0.007824725636693206, 'max_features': 0.8814815998941566}. Best is trial 688 with value: 0.6612018755665507.[0m
[32m[I 2022-04-21 11:51:04,200][0m Trial 826 finished with value: 0.6325052231698898 and parameters: {'splitter': 'best', 'min_samples_split': 0.09291628872912686, 'min_samples_leaf': 0.010634712582457614, 'min_weight_fraction_leaf': 0.02244152527757454, 'max_features': 0.799316222734904}. Best is trial 688 with value: 0.6612018755665507.[0m
[32m[I 2022-04-21 11:51:05,138][0m Trial 827 finished with value: 0.6503419492013129 and parameters: {'splitter': 'best', 'min_samples_split': 0.09520267221709007, 'min_samples_leaf': 0.009067037860263086, 'min_weight_fraction_leaf': 0.00011056547539139115, 'max_features': 0.8109665571089983}. Best is trial 688 with value: 0.6612018755665507.[0m
[32m[I 2022-04-21 11:51:06,074][0m Trial 828 finished with value: 0.6402029055425194 and parameters: {'splitter': 'best', 'min_samples_split': 0.0783214339315377, 'min_samples_leaf': 0.0011493918678599988, 'min_weight_fraction_leaf': 0.017220808048659757, 'max_features': 0.8153429867759366}. Best is trial 688 with value: 0.6612018755665507.[0m
[32m[I 2022-04-21 11:51:06,931][0m Trial 829 finished with value: 0.6027429475977527 and parameters: {'splitter': 'best', 'min_samples_split': 0.09850224430518446, 'min_samples_leaf': 0.0011372945468568242, 'min_weight_fraction_leaf': 0.10934175251462258, 'max_features': 0.8395122026408336}. Best is trial 688 with value: 0.6612018755665507.[0m
[32m[I 2022-04-21 11:51:08,335][0m Trial 830 finished with value: 0.6465232945107651 and parameters: {'splitter': 'best', 'min_samples_split': 0.08857949559897499, 'min_samples_leaf': 0.009508152300354213, 'min_weight_fraction_leaf': 0.00028205935752762077, 'max_features': 0.8011286069417883}. Best is trial 688 with value: 0.6612018755665507.[0m
[32m[I 2022-04-21 11:51:09,488][0m Trial 831 finished with value: 0.6311220492139338 and parameters: {'splitter': 'best', 'min_samples_split': 0.11285846695448522, 'min_samples_leaf': 0.01776295012122222, 'min_weight_fraction_leaf': 0.02927382171841488, 'max_features': 0.8494097547412112}. Best is trial 688 with value: 0.6612018755665507.[0m
[32m[I 2022-04-21 11:51:09,755][0m Trial 832 finished with value: 0.5527425222171012 and parameters: {'splitter': 'best', 'min_samples_split': 0.10395998139238487, 'min_samples_leaf': 0.24338819683831717, 'min_weight_fraction_leaf': 0.008580723564237908, 'max_features': 0.8216201520859951}. Best is trial 688 with value: 0.6612018755665507.[0m
[32m[I 2022-04-21 11:51:11,193][0m Trial 833 finished with value: 0.6457152015864931 and parameters: {'splitter': 'best', 'min_samples_split': 0.12070297129948107, 'min_samples_leaf': 0.009673535111948458, 'min_weight_fraction_leaf': 0.0004720747035190542, 'max_features': 0.8091767752647209}. Best is trial 688 with value: 0.6612018755665507.[0m
[32m[I 2022-04-21 11:51:11,911][0m Trial 834 finished with value: 0.6283121217723798 and parameters: {'splitter': 'best', 'min_samples_split': 0.10285000344565473, 'min_samples_leaf': 0.025557278866729982, 'min_weight_fraction_leaf': 0.019563160045312923, 'max_features': 0.8727743734199898}. Best is trial 688 with value: 0.6612018755665507.[0m
[32m[I 2022-04-21 11:51:12,187][0m Trial 835 finished with value: 0.5613525784991639 and parameters: {'splitter': 'best', 'min_samples_split': 0.08081091640674123, 'min_samples_leaf': 0.009579758218328103, 'min_weight_fraction_leaf': 0.23063054420350776, 'max_features': 0.8478378451484261}. Best is trial 688 with value: 0.6612018755665507.[0m
[32m[I 2022-04-21 11:51:12,380][0m Trial 836 finished with value: 0.5174275190875536 and parameters: {'splitter': 'best', 'min_samples_split': 0.0929646505603302, 'min_samples_leaf': 0.021035272148034762, 'min_weight_fraction_leaf': 0.45489485060971, 'max_features': 0.8227073604210002}. Best is trial 688 with value: 0.6612018755665507.[0m
[32m[I 2022-04-21 11:51:12,458][0m Trial 837 finished with value: 0.5274907761584957 and parameters: {'splitter': 'random', 'min_samples_split': 0.1180669073485331, 'min_samples_leaf': 0.009374472145064292, 'min_weight_fraction_leaf': 0.28594458186856386, 'max_features': 0.7888966468047919}. Best is trial 688 with value: 0.6612018755665507.[0m
[32m[I 2022-04-21 11:51:12,514][0m Trial 838 finished with value: 0.5133003329278907 and parameters: {'splitter': 'best', 'min_samples_split': 0.1274303169324063, 'min_samples_leaf': 0.4412957551756035, 'min_weight_fraction_leaf': 0.04131712408147705, 'max_features': 0.7835590112234248}. Best is trial 688 with value: 0.6612018755665507.[0m
[32m[I 2022-04-21 11:51:12,985][0m Trial 839 finished with value: 0.6262160507545405 and parameters: {'splitter': 'best', 'min_samples_split': 0.11160004748724807, 'min_samples_leaf': 0.03193416517492635, 'min_weight_fraction_leaf': 0.014900568639548053, 'max_features': 0.8174994058574861}. Best is trial 688 with value: 0.6612018755665507.[0m
