[32m[I 2022-04-21 21:18:12,519][0m Trial 136 finished with value: 0.6805924909317635 and parameters: {'loss': 'coxph', 'learning_rate': 0.0001378699355696275, 'n_estimators': 162, 'criterion': 'squared_error', 'min_samples_split': 6, 'min_samples_leaf': 7, 'min_weight_fraction_leaf': 0.13916851777942135, 'min_impurity_decrease': 0.05372397014049961, 'max_features': 0.15120786874907838, 'subsample': 0.3554500280548045, 'dropout_rate': 0.4114849132040837, 'ccp_alpha': 0.10804764709567108}. Best is trial 74 with value: 0.6902043616759457.[0m
[32m[I 2022-04-21 21:18:32,211][0m Trial 137 finished with value: 0.5930236911112541 and parameters: {'loss': 'coxph', 'learning_rate': 0.017253798417657132, 'n_estimators': 286, 'criterion': 'squared_error', 'min_samples_split': 7, 'min_samples_leaf': 8, 'min_weight_fraction_leaf': 0.1827686747916811, 'min_impurity_decrease': 0.10088755386899151, 'max_features': 0.17942976691198392, 'subsample': 0.2959943299328731, 'dropout_rate': 0.28298615151087225, 'ccp_alpha': 0.39834985696522673}. Best is trial 74 with value: 0.6902043616759457.[0m
[32m[I 2022-04-21 21:18:47,367][0m Trial 138 finished with value: 0.663544677853244 and parameters: {'loss': 'coxph', 'learning_rate': 0.0003181177640365195, 'n_estimators': 245, 'criterion': 'squared_error', 'min_samples_split': 6, 'min_samples_leaf': 8, 'min_weight_fraction_leaf': 0.0761168243527023, 'min_impurity_decrease': 0.020685595415416924, 'max_features': 0.11042886238786706, 'subsample': 0.3938626405330333, 'dropout_rate': 0.14972902857660564, 'ccp_alpha': 0.2523682253217139}. Best is trial 74 with value: 0.6902043616759457.[0m
[32m[I 2022-04-21 21:18:53,615][0m Trial 139 finished with value: 0.6449850903649714 and parameters: {'loss': 'coxph', 'learning_rate': 0.0010583251220885018, 'n_estimators': 136, 'criterion': 'squared_error', 'min_samples_split': 7, 'min_samples_leaf': 8, 'min_weight_fraction_leaf': 0.20996330592990958, 'min_impurity_decrease': 0.04602262166231594, 'max_features': 0.2408867992940188, 'subsample': 0.41421749888977283, 'dropout_rate': 0.24455566166955672, 'ccp_alpha': 0.19929139091051257}. Best is trial 74 with value: 0.6902043616759457.[0m
[32m[I 2022-04-21 21:19:00,198][0m Trial 140 finished with value: 0.6847767397064333 and parameters: {'loss': 'coxph', 'learning_rate': 0.0004348939837519945, 'n_estimators': 182, 'criterion': 'squared_error', 'min_samples_split': 7, 'min_samples_leaf': 9, 'min_weight_fraction_leaf': 0.06081854571093187, 'min_impurity_decrease': 0.12883737357818703, 'max_features': 0.0058727629594693825, 'subsample': 0.31539219696345855, 'dropout_rate': 0.2809959080550403, 'ccp_alpha': 0.08693597744525973}. Best is trial 74 with value: 0.6902043616759457.[0m
[32m[I 2022-04-21 21:19:09,711][0m Trial 141 finished with value: 0.6874965760336808 and parameters: {'loss': 'coxph', 'learning_rate': 0.0004357996368537891, 'n_estimators': 177, 'criterion': 'squared_error', 'min_samples_split': 7, 'min_samples_leaf': 9, 'min_weight_fraction_leaf': 0.041342739070437576, 'min_impurity_decrease': 0.10980706255821115, 'max_features': 0.00875955739407973, 'subsample': 0.31583130245861, 'dropout_rate': 0.2149109986649961, 'ccp_alpha': 0.08369752463817282}. Best is trial 74 with value: 0.6902043616759457.[0m
[32m[I 2022-04-21 21:19:23,507][0m Trial 142 finished with value: 0.5 and parameters: {'loss': 'coxph', 'learning_rate': 0.00040250779387380163, 'n_estimators': 182, 'criterion': 'squared_error', 'min_samples_split': 7, 'min_samples_leaf': 9, 'min_weight_fraction_leaf': 0.04893950092266003, 'min_impurity_decrease': 0.09339367653662858, 'max_features': 0.0020068418707361417, 'subsample': 0.31561739002006434, 'dropout_rate': 0.20592536647748386, 'ccp_alpha': 4.634521665671217}. Best is trial 74 with value: 0.6902043616759457.[0m
[32m[I 2022-04-21 21:19:29,980][0m Trial 143 finished with value: 0.6829326871318636 and parameters: {'loss': 'coxph', 'learning_rate': 0.00043344315638555505, 'n_estimators': 200, 'criterion': 'squared_error', 'min_samples_split': 7, 'min_samples_leaf': 9, 'min_weight_fraction_leaf': 0.020102105595038566, 'min_impurity_decrease': 0.11431070674086061, 'max_features': 0.016549450673255164, 'subsample': 0.33950528649775313, 'dropout_rate': 0.28652041416889285, 'ccp_alpha': 0.0021793670681930777}. Best is trial 74 with value: 0.6902043616759457.[0m
[32m[I 2022-04-21 21:19:35,152][0m Trial 144 finished with value: 0.6805321172601092 and parameters: {'loss': 'coxph', 'learning_rate': 0.0008905904295364306, 'n_estimators': 174, 'criterion': 'squared_error', 'min_samples_split': 6, 'min_samples_leaf': 9, 'min_weight_fraction_leaf': 0.08477492325839259, 'min_impurity_decrease': 0.1405359824523877, 'max_features': 0.03169018452686073, 'subsample': 0.2624851287031353, 'dropout_rate': 0.219313724986398, 'ccp_alpha': 0.10787532653490788}. Best is trial 74 with value: 0.6902043616759457.[0m
[32m[I 2022-04-21 21:19:41,145][0m Trial 145 finished with value: 0.6637865011237818 and parameters: {'loss': 'coxph', 'learning_rate': 0.0004937827939525942, 'n_estimators': 187, 'criterion': 'squared_error', 'min_samples_split': 7, 'min_samples_leaf': 9, 'min_weight_fraction_leaf': 0.059309684355522155, 'min_impurity_decrease': 0.1853820148860806, 'max_features': 0.039387589606905984, 'subsample': 0.22874147741917072, 'dropout_rate': 0.16900068355238534, 'ccp_alpha': 0.19635521754502297}. Best is trial 74 with value: 0.6902043616759457.[0m
[32m[I 2022-04-21 21:19:46,206][0m Trial 146 finished with value: 0.5 and parameters: {'loss': 'coxph', 'learning_rate': 0.0002888045587898575, 'n_estimators': 152, 'criterion': 'squared_error', 'min_samples_split': 7, 'min_samples_leaf': 10, 'min_weight_fraction_leaf': 0.008815927141790594, 'min_impurity_decrease': 0.12027467482732866, 'max_features': 0.057849843903659326, 'subsample': 0.9066960963156032, 'dropout_rate': 0.14185917359313172, 'ccp_alpha': 0.33357099682702196}. Best is trial 74 with value: 0.6902043616759457.[0m
[32m[I 2022-04-21 21:19:51,485][0m Trial 147 finished with value: 0.5 and parameters: {'loss': 'coxph', 'learning_rate': 0.000711168484110546, 'n_estimators': 169, 'criterion': 'squared_error', 'min_samples_split': 6, 'min_samples_leaf': 9, 'min_weight_fraction_leaf': 0.03971983872133995, 'min_impurity_decrease': 0.530994747027437, 'max_features': 0.9090614477885759, 'subsample': 0.312704256900626, 'dropout_rate': 0.31022868547559646, 'ccp_alpha': 0.09224389827384039}. Best is trial 74 with value: 0.6902043616759457.[0m
[32m[I 2022-04-21 21:19:55,816][0m Trial 148 finished with value: 0.5 and parameters: {'loss': 'coxph', 'learning_rate': 0.001339241373212507, 'n_estimators': 155, 'criterion': 'squared_error', 'min_samples_split': 7, 'min_samples_leaf': 9, 'min_weight_fraction_leaf': 0.025356904850719095, 'min_impurity_decrease': 0.16805084023906774, 'max_features': 0.002124064138057366, 'subsample': 0.27920267717935865, 'dropout_rate': 0.3447673289788513, 'ccp_alpha': 0.49986107915465033}. Best is trial 74 with value: 0.6902043616759457.[0m
[32m[I 2022-04-21 21:20:07,863][0m Trial 149 finished with value: 0.6790109422723483 and parameters: {'loss': 'coxph', 'learning_rate': 0.0006046503941246905, 'n_estimators': 211, 'criterion': 'absolute_error', 'min_samples_split': 6, 'min_samples_leaf': 8, 'min_weight_fraction_leaf': 0.06476692302413911, 'min_impurity_decrease': 0.08151858913330472, 'max_features': 0.025756457896955222, 'subsample': 0.37017050109476907, 'dropout_rate': 0.2675653375591242, 'ccp_alpha': 0.011448096316024114}. Best is trial 74 with value: 0.6902043616759457.[0m
/media/san2_ssd/data/Workdir/survival/venv/lib/python3.8/site-packages/sksurv/ensemble/boosting.py:955: RuntimeWarning: divide by zero encountered in log
  time = numpy.log(time)
/media/san2_ssd/data/Workdir/survival/venv/lib/python3.8/site-packages/sksurv/ensemble/boosting.py:955: RuntimeWarning: divide by zero encountered in log
  time = numpy.log(time)
/media/san2_ssd/data/Workdir/survival/venv/lib/python3.8/site-packages/sksurv/ensemble/boosting.py:955: RuntimeWarning: divide by zero encountered in log
  time = numpy.log(time)
/media/san2_ssd/data/Workdir/survival/venv/lib/python3.8/site-packages/sksurv/ensemble/boosting.py:955: RuntimeWarning: divide by zero encountered in log
  time = numpy.log(time)
[32m[I 2022-04-21 21:20:09,476][0m Trial 150 finished with value: -0.7260203013923309 and parameters: {'loss': 'squared', 'learning_rate': 0.0003599896541029691, 'n_estimators': 177, 'criterion': 'squared_error', 'min_samples_split': 7, 'min_samples_leaf': 9, 'min_weight_fraction_leaf': 0.05148072208740227, 'min_impurity_decrease': 0.8665494803659657, 'max_features': 0.1023269321578647, 'subsample': 0.3307146356241449, 'dropout_rate': 0.24386836759963737, 'ccp_alpha': 0.21064807189527598}. Best is trial 74 with value: 0.6902043616759457.[0m
[32m[I 2022-04-21 21:20:19,687][0m Trial 151 finished with value: 0.6838109000541439 and parameters: {'loss': 'coxph', 'learning_rate': 0.0005403237216622955, 'n_estimators': 266, 'criterion': 'squared_error', 'min_samples_split': 7, 'min_samples_leaf': 9, 'min_weight_fraction_leaf': 0.2476394698402461, 'min_impurity_decrease': 0.13886905198070432, 'max_features': 0.07414864709599822, 'subsample': 0.32474599307478785, 'dropout_rate': 0.3712013429764649, 'ccp_alpha': 0.10838100767113637}. Best is trial 74 with value: 0.6902043616759457.[0m
[32m[I 2022-04-21 21:20:37,313][0m Trial 152 finished with value: 0.6845750222721929 and parameters: {'loss': 'coxph', 'learning_rate': 0.0008510538255969499, 'n_estimators': 263, 'criterion': 'squared_error', 'min_samples_split': 7, 'min_samples_leaf': 9, 'min_weight_fraction_leaf': 0.2443183586410953, 'min_impurity_decrease': 0.14229005006312734, 'max_features': 0.1274457101642934, 'subsample': 0.29343922882150614, 'dropout_rate': 0.3726273710823249, 'ccp_alpha': 0.1631781612496582}. Best is trial 74 with value: 0.6902043616759457.[0m
[32m[I 2022-04-21 21:20:46,056][0m Trial 153 finished with value: 0.6882399244430267 and parameters: {'loss': 'coxph', 'learning_rate': 0.0008101757361283179, 'n_estimators': 234, 'criterion': 'squared_error', 'min_samples_split': 7, 'min_samples_leaf': 9, 'min_weight_fraction_leaf': 0.22202920027277287, 'min_impurity_decrease': 0.11637344796195624, 'max_features': 0.13281128213040694, 'subsample': 0.2920136843350604, 'dropout_rate': 0.30159698190747214, 'ccp_alpha': 0.00604985264671383}. Best is trial 74 with value: 0.6902043616759457.[0m
[32m[I 2022-04-21 21:20:55,531][0m Trial 154 finished with value: 0.6886623327640214 and parameters: {'loss': 'coxph', 'learning_rate': 0.0009388893670927779, 'n_estimators': 232, 'criterion': 'squared_error', 'min_samples_split': 7, 'min_samples_leaf': 9, 'min_weight_fraction_leaf': 0.21464512388179538, 'min_impurity_decrease': 0.10655065778635374, 'max_features': 0.13260306912348363, 'subsample': 0.293956470364138, 'dropout_rate': 0.3280488837746939, 'ccp_alpha': 0.0016897713795678156}. Best is trial 74 with value: 0.6902043616759457.[0m
[32m[I 2022-04-21 21:21:04,280][0m Trial 155 finished with value: 0.6208265726036334 and parameters: {'loss': 'coxph', 'learning_rate': 0.0018306709496853152, 'n_estimators': 232, 'criterion': 'squared_error', 'min_samples_split': 7, 'min_samples_leaf': 9, 'min_weight_fraction_leaf': 0.21843243318188987, 'min_impurity_decrease': 0.10014859356018514, 'max_features': 0.12816567098751425, 'subsample': 0.2893715337853622, 'dropout_rate': 0.3209845949924148, 'ccp_alpha': 0.3178747697182708}. Best is trial 74 with value: 0.6902043616759457.[0m
[32m[I 2022-04-21 21:21:11,671][0m Trial 156 finished with value: 0.6746814107893806 and parameters: {'loss': 'coxph', 'learning_rate': 0.000886191490305874, 'n_estimators': 205, 'criterion': 'squared_error', 'min_samples_split': 7, 'min_samples_leaf': 10, 'min_weight_fraction_leaf': 0.2045091291974583, 'min_impurity_decrease': 0.15868511469319702, 'max_features': 0.1311190302512109, 'subsample': 0.2660757720903134, 'dropout_rate': 0.3049621426246603, 'ccp_alpha': 0.15852006181354977}. Best is trial 74 with value: 0.6902043616759457.[0m
[32m[I 2022-04-21 21:21:23,417][0m Trial 157 finished with value: 0.5 and parameters: {'loss': 'coxph', 'learning_rate': 0.0015670785698325995, 'n_estimators': 223, 'criterion': 'squared_error', 'min_samples_split': 7, 'min_samples_leaf': 8, 'min_weight_fraction_leaf': 0.23168988017042932, 'min_impurity_decrease': 0.11970061507320989, 'max_features': 0.09634160306579578, 'subsample': 0.24902183774910433, 'dropout_rate': 0.33541128288422695, 'ccp_alpha': 2.9170369942438032}. Best is trial 74 with value: 0.6902043616759457.[0m
[32m[I 2022-04-21 21:21:32,004][0m Trial 158 finished with value: 0.681004527761246 and parameters: {'loss': 'coxph', 'learning_rate': 0.001174059835672411, 'n_estimators': 243, 'criterion': 'squared_error', 'min_samples_split': 7, 'min_samples_leaf': 8, 'min_weight_fraction_leaf': 0.19694193116190348, 'min_impurity_decrease': 0.18930342024935948, 'max_features': 0.16584103203239509, 'subsample': 0.2985666010335288, 'dropout_rate': 0.28219408096752885, 'ccp_alpha': 0.005023983015657069}. Best is trial 74 with value: 0.6902043616759457.[0m
[32m[I 2022-04-21 21:21:37,234][0m Trial 159 finished with value: 0.6677658486201136 and parameters: {'loss': 'coxph', 'learning_rate': 0.0007278803521207005, 'n_estimators': 191, 'criterion': 'squared_error', 'min_samples_split': 7, 'min_samples_leaf': 9, 'min_weight_fraction_leaf': 0.2232137872468612, 'min_impurity_decrease': 0.06110810261834919, 'max_features': 0.05535708177330273, 'subsample': 0.23697464380288005, 'dropout_rate': 0.37618291985857805, 'ccp_alpha': 0.2469953281162917}. Best is trial 74 with value: 0.6902043616759457.[0m
[32m[I 2022-04-21 21:21:45,426][0m Trial 160 finished with value: 0.5885897812904826 and parameters: {'loss': 'coxph', 'learning_rate': 0.009569248113533763, 'n_estimators': 254, 'criterion': 'squared_error', 'min_samples_split': 5, 'min_samples_leaf': 9, 'min_weight_fraction_leaf': 0.17363308080420192, 'min_impurity_decrease': 0.08675097663300099, 'max_features': 0.19719902786364654, 'subsample': 0.27193439314734114, 'dropout_rate': 0.4412832540347693, 'ccp_alpha': 0.4047112061391386}. Best is trial 74 with value: 0.6902043616759457.[0m
[32m[I 2022-04-21 21:21:53,325][0m Trial 161 finished with value: 0.6739172885713315 and parameters: {'loss': 'coxph', 'learning_rate': 0.0008331358585413286, 'n_estimators': 217, 'criterion': 'squared_error', 'min_samples_split': 7, 'min_samples_leaf': 9, 'min_weight_fraction_leaf': 0.24357308326860452, 'min_impurity_decrease': 0.14136846512700812, 'max_features': 0.14123138898091706, 'subsample': 0.3395459531777075, 'dropout_rate': 0.3997528631969172, 'ccp_alpha': 0.00136934477836256}. Best is trial 74 with value: 0.6902043616759457.[0m
[32m[I 2022-04-21 21:22:10,462][0m Trial 162 finished with value: 0.6735098905554658 and parameters: {'loss': 'coxph', 'learning_rate': 0.0010052185087535766, 'n_estimators': 272, 'criterion': 'squared_error', 'min_samples_split': 7, 'min_samples_leaf': 9, 'min_weight_fraction_leaf': 0.2576607362146474, 'min_impurity_decrease': 0.11364534826980568, 'max_features': 0.11443292470914188, 'subsample': 0.3583685134219248, 'dropout_rate': 0.35034704809798645, 'ccp_alpha': 0.14762795333780668}. Best is trial 74 with value: 0.6902043616759457.[0m
[32m[I 2022-04-21 21:22:24,538][0m Trial 163 finished with value: 0.6884179103758026 and parameters: {'loss': 'coxph', 'learning_rate': 0.00046600952851333496, 'n_estimators': 291, 'criterion': 'squared_error', 'min_samples_split': 7, 'min_samples_leaf': 10, 'min_weight_fraction_leaf': 0.21030451276818612, 'min_impurity_decrease': 0.10405484471733471, 'max_features': 0.8215830089051851, 'subsample': 0.3121068157543377, 'dropout_rate': 0.30258434390357286, 'ccp_alpha': 0.10510645327875698}. Best is trial 74 with value: 0.6902043616759457.[0m
[32m[I 2022-04-21 21:22:47,530][0m Trial 164 finished with value: 0.6892814975010958 and parameters: {'loss': 'coxph', 'learning_rate': 0.0004787761351473524, 'n_estimators': 286, 'criterion': 'squared_error', 'min_samples_split': 7, 'min_samples_leaf': 9, 'min_weight_fraction_leaf': 0.21613527460575527, 'min_impurity_decrease': 0.057241638269081734, 'max_features': 0.09513959142158325, 'subsample': 0.30602063382296235, 'dropout_rate': 0.2932367605613105, 'ccp_alpha': 0.10751085197152203}. Best is trial 74 with value: 0.6902043616759457.[0m
[32m[I 2022-04-21 21:23:09,600][0m Trial 165 finished with value: 0.5 and parameters: {'loss': 'coxph', 'learning_rate': 0.0004278696950969576, 'n_estimators': 296, 'criterion': 'squared_error', 'min_samples_split': 7, 'min_samples_leaf': 8, 'min_weight_fraction_leaf': 0.21890876966407602, 'min_impurity_decrease': 0.06560124767601769, 'max_features': 0.08825502240771083, 'subsample': 0.2929292858832334, 'dropout_rate': 0.2962794622475302, 'ccp_alpha': 4.2978352017632755}. Best is trial 74 with value: 0.6902043616759457.[0m
[32m[I 2022-04-21 21:23:28,332][0m Trial 166 finished with value: 0.6622197222040663 and parameters: {'loss': 'coxph', 'learning_rate': 3.0239125447583136e-06, 'n_estimators': 284, 'criterion': 'squared_error', 'min_samples_split': 7, 'min_samples_leaf': 9, 'min_weight_fraction_leaf': 0.2084014491206746, 'min_impurity_decrease': 0.09610894405207837, 'max_features': 0.05255302638528433, 'subsample': 0.3015315867821718, 'dropout_rate': 0.26911430811477305, 'ccp_alpha': 0.2662800877996662}. Best is trial 74 with value: 0.6902043616759457.[0m
[32m[I 2022-04-21 21:23:37,763][0m Trial 167 finished with value: 0.6746430366785507 and parameters: {'loss': 'coxph', 'learning_rate': 0.0002615317481464099, 'n_estimators': 238, 'criterion': 'squared_error', 'min_samples_split': 7, 'min_samples_leaf': 10, 'min_weight_fraction_leaf': 0.1941859134197912, 'min_impurity_decrease': 0.08512382238703685, 'max_features': 0.030396176732561023, 'subsample': 0.21240344738882758, 'dropout_rate': 0.32216371620697437, 'ccp_alpha': 0.12889747182947608}. Best is trial 74 with value: 0.6902043616759457.[0m
[32m[I 2022-04-21 21:23:42,302][0m Trial 168 finished with value: 0.6755691180074684 and parameters: {'loss': 'coxph', 'learning_rate': 0.0003389058677367079, 'n_estimators': 164, 'criterion': 'squared_error', 'min_samples_split': 7, 'min_samples_leaf': 8, 'min_weight_fraction_leaf': 0.1861256798466405, 'min_impurity_decrease': 0.046377476693166914, 'max_features': 0.0010553077164842661, 'subsample': 0.3127616349454959, 'dropout_rate': 0.29366337302516893, 'ccp_alpha': 0.18416389904427455}. Best is trial 74 with value: 0.6902043616759457.[0m
[32m[I 2022-04-21 21:23:53,004][0m Trial 169 finished with value: 0.6385583963822589 and parameters: {'loss': 'coxph', 'learning_rate': 0.0005319149416646653, 'n_estimators': 184, 'criterion': 'squared_error', 'min_samples_split': 7, 'min_samples_leaf': 9, 'min_weight_fraction_leaf': 0.21231008310942484, 'min_impurity_decrease': 0.12562657399882501, 'max_features': 0.07170035439518875, 'subsample': 0.18753055281779316, 'dropout_rate': 0.21217566210288036, 'ccp_alpha': 0.2971493220029724}. Best is trial 74 with value: 0.6902043616759457.[0m
[32m[I 2022-04-21 21:24:13,885][0m Trial 170 finished with value: 0.6837615399971617 and parameters: {'loss': 'coxph', 'learning_rate': 0.0006458117759617485, 'n_estimators': 268, 'criterion': 'squared_error', 'min_samples_split': 7, 'min_samples_leaf': 7, 'min_weight_fraction_leaf': 0.22904695037925565, 'min_impurity_decrease': 0.1518999381580291, 'max_features': 0.16051286436520207, 'subsample': 0.27567453355713856, 'dropout_rate': 0.2600701358485845, 'ccp_alpha': 0.08349256645842175}. Best is trial 74 with value: 0.6902043616759457.[0m
[32m[I 2022-04-21 21:24:38,822][0m Trial 171 finished with value: 0.6859664839137115 and parameters: {'loss': 'coxph', 'learning_rate': 0.0004784338986410779, 'n_estimators': 312, 'criterion': 'squared_error', 'min_samples_split': 7, 'min_samples_leaf': 10, 'min_weight_fraction_leaf': 0.2371689774403353, 'min_impurity_decrease': 0.11083345927522255, 'max_features': 0.11436954205734005, 'subsample': 0.345454782659455, 'dropout_rate': 0.2366000303642078, 'ccp_alpha': 0.10214624899808128}. Best is trial 74 with value: 0.6902043616759457.[0m
[32m[I 2022-04-21 21:24:57,051][0m Trial 172 finished with value: 0.6859664839137115 and parameters: {'loss': 'coxph', 'learning_rate': 0.00043809203333551545, 'n_estimators': 310, 'criterion': 'squared_error', 'min_samples_split': 7, 'min_samples_leaf': 10, 'min_weight_fraction_leaf': 0.23548955397461968, 'min_impurity_decrease': 0.10552351516647968, 'max_features': 0.1041864364982148, 'subsample': 0.3141328843786837, 'dropout_rate': 0.2347791074344714, 'ccp_alpha': 0.1129003300332107}. Best is trial 74 with value: 0.6902043616759457.[0m
[32m[I 2022-04-21 21:25:14,900][0m Trial 173 finished with value: 0.6886529203024677 and parameters: {'loss': 'coxph', 'learning_rate': 0.0004314626989361819, 'n_estimators': 312, 'criterion': 'squared_error', 'min_samples_split': 7, 'min_samples_leaf': 10, 'min_weight_fraction_leaf': 0.1997450741944427, 'min_impurity_decrease': 0.10459538452419519, 'max_features': 0.09829154721857428, 'subsample': 0.3223961211327259, 'dropout_rate': 0.2406632741646576, 'ccp_alpha': 0.07346775019423799}. Best is trial 74 with value: 0.6902043616759457.[0m
