[32m[I 2022-04-22 04:50:15,509][0m Trial 819 finished with value: 0.6712563165473625 and parameters: {'alpha': 3.894523694202919, 'ties': 'breslow'}. Best is trial 51 with value: 0.6718225721814719.[0m
[32m[I 2022-04-22 04:50:46,149][0m Trial 820 finished with value: 0.6710908946968871 and parameters: {'alpha': 3.4445650642295047, 'ties': 'breslow'}. Best is trial 51 with value: 0.6718225721814719.[0m
[32m[I 2022-04-22 04:51:16,328][0m Trial 821 finished with value: 0.6706525112888204 and parameters: {'alpha': 4.0302496476940535, 'ties': 'breslow'}. Best is trial 51 with value: 0.6718225721814719.[0m
[32m[I 2022-04-22 04:51:45,443][0m Trial 822 finished with value: 0.6714381495717138 and parameters: {'alpha': 3.7214979369468817, 'ties': 'breslow'}. Best is trial 51 with value: 0.6718225721814719.[0m
[32m[I 2022-04-22 04:52:15,350][0m Trial 823 finished with value: 0.6702584666594028 and parameters: {'alpha': 4.677509368859029, 'ties': 'breslow'}. Best is trial 51 with value: 0.6718225721814719.[0m
[32m[I 2022-04-22 04:52:47,038][0m Trial 824 finished with value: 0.6697615469066253 and parameters: {'alpha': 2.6272364199757066, 'ties': 'breslow'}. Best is trial 51 with value: 0.6718225721814719.[0m
[32m[I 2022-04-22 04:53:16,924][0m Trial 825 finished with value: 0.6714206959499815 and parameters: {'alpha': 3.823635052220743, 'ties': 'breslow'}. Best is trial 51 with value: 0.6718225721814719.[0m
[32m[I 2022-04-22 04:53:46,308][0m Trial 826 finished with value: 0.670957560396671 and parameters: {'alpha': 3.639665166763962, 'ties': 'breslow'}. Best is trial 51 with value: 0.6718225721814719.[0m
[32m[I 2022-04-22 04:54:14,661][0m Trial 827 finished with value: 0.6711918185237238 and parameters: {'alpha': 3.5273313590944633, 'ties': 'breslow'}. Best is trial 51 with value: 0.6718225721814719.[0m
[32m[I 2022-04-22 04:54:42,829][0m Trial 828 finished with value: 0.6715134091726827 and parameters: {'alpha': 3.7568961176574778, 'ties': 'breslow'}. Best is trial 51 with value: 0.6718225721814719.[0m
[32m[I 2022-04-22 04:55:10,741][0m Trial 829 finished with value: 0.6711796766006307 and parameters: {'alpha': 3.9285255151414313, 'ties': 'breslow'}. Best is trial 51 with value: 0.6718225721814719.[0m
[32m[I 2022-04-22 04:55:36,847][0m Trial 830 finished with value: 0.6704843217193354 and parameters: {'alpha': 4.192961688345562, 'ties': 'breslow'}. Best is trial 51 with value: 0.6718225721814719.[0m
[32m[I 2022-04-22 04:56:03,506][0m Trial 831 finished with value: 0.6711124731670982 and parameters: {'alpha': 3.6588672125843273, 'ties': 'efron'}. Best is trial 51 with value: 0.6718225721814719.[0m
[32m[I 2022-04-22 04:56:30,511][0m Trial 832 finished with value: 0.6715012772624975 and parameters: {'alpha': 3.8062846324050077, 'ties': 'breslow'}. Best is trial 51 with value: 0.6718225721814719.[0m
[32m[I 2022-04-22 04:56:57,217][0m Trial 833 finished with value: 0.6712563165473625 and parameters: {'alpha': 3.9071423215672807, 'ties': 'breslow'}. Best is trial 51 with value: 0.6718225721814719.[0m
[32m[I 2022-04-22 04:57:23,768][0m Trial 834 finished with value: 0.670419017881865 and parameters: {'alpha': 4.015270853848861, 'ties': 'breslow'}. Best is trial 51 with value: 0.6718225721814719.[0m
[32m[I 2022-04-22 04:57:51,048][0m Trial 835 finished with value: 0.6713565979142997 and parameters: {'alpha': 3.7184634631076694, 'ties': 'breslow'}. Best is trial 51 with value: 0.6718225721814719.[0m
[32m[I 2022-04-22 04:58:18,299][0m Trial 836 finished with value: 0.6714105858316386 and parameters: {'alpha': 3.85728198429043, 'ties': 'breslow'}. Best is trial 51 with value: 0.6718225721814719.[0m
[32m[I 2022-04-22 04:58:45,747][0m Trial 837 finished with value: 0.6711160166148658 and parameters: {'alpha': 3.54911178553371, 'ties': 'breslow'}. Best is trial 51 with value: 0.6718225721814719.[0m
[32m[I 2022-04-22 04:59:11,843][0m Trial 838 finished with value: 0.6713608470929167 and parameters: {'alpha': 3.7304927546511593, 'ties': 'breslow'}. Best is trial 51 with value: 0.6718225721814719.[0m
[32m[I 2022-04-22 04:59:39,215][0m Trial 839 finished with value: 0.670957560396671 and parameters: {'alpha': 3.6465011741343254, 'ties': 'breslow'}. Best is trial 51 with value: 0.6718225721814719.[0m
[32m[I 2022-04-22 05:00:05,963][0m Trial 840 finished with value: 0.6715828289199117 and parameters: {'alpha': 3.7955883308236564, 'ties': 'breslow'}. Best is trial 51 with value: 0.6718225721814719.[0m
[32m[I 2022-04-22 05:00:34,432][0m Trial 841 finished with value: 0.6705534885276953 and parameters: {'alpha': 3.351463136774182, 'ties': 'breslow'}. Best is trial 51 with value: 0.6718225721814719.[0m
[32m[I 2022-04-22 05:01:01,540][0m Trial 842 finished with value: 0.6703828690530049 and parameters: {'alpha': 4.339186581724476, 'ties': 'breslow'}. Best is trial 51 with value: 0.6718225721814719.[0m
[32m[I 2022-04-22 05:01:29,519][0m Trial 843 finished with value: 0.6708098592683656 and parameters: {'alpha': 3.9533737292476854, 'ties': 'breslow'}. Best is trial 51 with value: 0.6718225721814719.[0m
[32m[I 2022-04-22 05:01:57,151][0m Trial 844 finished with value: 0.6714096154867404 and parameters: {'alpha': 3.8532284661173297, 'ties': 'breslow'}. Best is trial 51 with value: 0.6718225721814719.[0m
[32m[I 2022-04-22 05:02:25,738][0m Trial 845 finished with value: 0.6708528438624721 and parameters: {'alpha': 3.4886519528727424, 'ties': 'breslow'}. Best is trial 51 with value: 0.6718225721814719.[0m
[32m[I 2022-04-22 05:02:54,291][0m Trial 846 finished with value: 0.670957560396671 and parameters: {'alpha': 3.6406047454157298, 'ties': 'breslow'}. Best is trial 51 with value: 0.6718225721814719.[0m
[32m[I 2022-04-22 05:03:23,226][0m Trial 847 finished with value: 0.6707257400948092 and parameters: {'alpha': 4.08030217165979, 'ties': 'breslow'}. Best is trial 51 with value: 0.6718225721814719.[0m
[32m[I 2022-04-22 05:03:51,015][0m Trial 848 finished with value: 0.6715134091726827 and parameters: {'alpha': 3.759889569438719, 'ties': 'breslow'}. Best is trial 51 with value: 0.6718225721814719.[0m
[32m[I 2022-04-22 05:04:19,147][0m Trial 849 finished with value: 0.6713378682047766 and parameters: {'alpha': 3.8858386114163834, 'ties': 'breslow'}. Best is trial 51 with value: 0.6718225721814719.[0m
[32m[I 2022-04-22 05:04:46,155][0m Trial 850 finished with value: 0.6712758842947594 and parameters: {'alpha': 3.7006833047752283, 'ties': 'breslow'}. Best is trial 51 with value: 0.6718225721814719.[0m
[32m[I 2022-04-22 05:05:11,563][0m Trial 851 finished with value: 0.6710392443611095 and parameters: {'alpha': 3.6047963442271906, 'ties': 'breslow'}. Best is trial 51 with value: 0.6718225721814719.[0m
[32m[I 2022-04-22 05:05:38,969][0m Trial 852 finished with value: 0.6708098592683656 and parameters: {'alpha': 3.962824476726868, 'ties': 'breslow'}. Best is trial 51 with value: 0.6718225721814719.[0m
[32m[I 2022-04-22 05:06:08,738][0m Trial 853 finished with value: 0.67118145279447 and parameters: {'alpha': 3.7793850585833386, 'ties': 'efron'}. Best is trial 51 with value: 0.6718225721814719.[0m
[32m[I 2022-04-22 05:06:38,085][0m Trial 854 finished with value: 0.6713430856583515 and parameters: {'alpha': 3.821787573431646, 'ties': 'breslow'}. Best is trial 51 with value: 0.6718225721814719.[0m
[32m[I 2022-04-22 05:07:07,256][0m Trial 855 finished with value: 0.6711982740031293 and parameters: {'alpha': 3.693229554028372, 'ties': 'breslow'}. Best is trial 51 with value: 0.6718225721814719.[0m
[32m[I 2022-04-22 05:07:34,577][0m Trial 856 finished with value: 0.6710387141360685 and parameters: {'alpha': 3.5600975874929848, 'ties': 'breslow'}. Best is trial 51 with value: 0.6718225721814719.[0m
[32m[I 2022-04-22 05:08:02,834][0m Trial 857 finished with value: 0.6704072839027255 and parameters: {'alpha': 4.1064925011381, 'ties': 'breslow'}. Best is trial 51 with value: 0.6718225721814719.[0m
[32m[I 2022-04-22 05:08:31,847][0m Trial 858 finished with value: 0.6713378682047766 and parameters: {'alpha': 3.8805384796044, 'ties': 'breslow'}. Best is trial 51 with value: 0.6718225721814719.[0m
[32m[I 2022-04-22 05:09:01,849][0m Trial 859 finished with value: 0.6713571281393407 and parameters: {'alpha': 3.74716474262046, 'ties': 'breslow'}. Best is trial 51 with value: 0.6718225721814719.[0m
[32m[I 2022-04-22 05:09:29,743][0m Trial 860 finished with value: 0.6708098592683656 and parameters: {'alpha': 3.961068468368296, 'ties': 'breslow'}. Best is trial 51 with value: 0.6718225721814719.[0m
[32m[I 2022-04-22 05:10:04,674][0m Trial 861 finished with value: 0.6653256119095825 and parameters: {'alpha': 1.1284292889201344, 'ties': 'breslow'}. Best is trial 51 with value: 0.6718225721814719.[0m
[32m[I 2022-04-22 05:10:33,302][0m Trial 862 finished with value: 0.670957560396671 and parameters: {'alpha': 3.643632622058223, 'ties': 'breslow'}. Best is trial 51 with value: 0.6718225721814719.[0m
[32m[I 2022-04-22 05:11:02,031][0m Trial 863 finished with value: 0.6713430856583515 and parameters: {'alpha': 3.8230240757710243, 'ties': 'breslow'}. Best is trial 51 with value: 0.6718225721814719.[0m
[32m[I 2022-04-22 05:11:30,261][0m Trial 864 finished with value: 0.6709366444585252 and parameters: {'alpha': 3.4810593076545886, 'ties': 'breslow'}. Best is trial 51 with value: 0.6718225721814719.[0m
[32m[I 2022-04-22 05:12:00,036][0m Trial 865 finished with value: 0.670419017881865 and parameters: {'alpha': 4.007029506976277, 'ties': 'breslow'}. Best is trial 51 with value: 0.6718225721814719.[0m
[32m[I 2022-04-22 05:12:31,206][0m Trial 866 finished with value: 0.6711167223457152 and parameters: {'alpha': 3.6803188861633975, 'ties': 'breslow'}. Best is trial 51 with value: 0.6718225721814719.[0m
[32m[I 2022-04-22 05:13:00,498][0m Trial 867 finished with value: 0.6715012772624975 and parameters: {'alpha': 3.805084236338527, 'ties': 'breslow'}. Best is trial 51 with value: 0.6718225721814719.[0m
[32m[I 2022-04-22 05:13:32,163][0m Trial 868 finished with value: 0.6712563165473625 and parameters: {'alpha': 3.8939428884100677, 'ties': 'breslow'}. Best is trial 51 with value: 0.6718225721814719.[0m
[32m[I 2022-04-22 05:14:00,561][0m Trial 869 finished with value: 0.6715120409097679 and parameters: {'alpha': 3.7384534195788355, 'ties': 'efron'}. Best is trial 51 with value: 0.6718225721814719.[0m
[32m[I 2022-04-22 05:14:34,670][0m Trial 870 finished with value: 0.6678800227295769 and parameters: {'alpha': 2.095747989071066, 'ties': 'breslow'}. Best is trial 51 with value: 0.6718225721814719.[0m
[32m[I 2022-04-22 05:15:02,850][0m Trial 871 finished with value: 0.6709611038444385 and parameters: {'alpha': 3.5734233015476273, 'ties': 'breslow'}. Best is trial 51 with value: 0.6718225721814719.[0m
[32m[I 2022-04-22 05:15:31,602][0m Trial 872 finished with value: 0.6712563165473625 and parameters: {'alpha': 3.8901918771273385, 'ties': 'breslow'}. Best is trial 51 with value: 0.6718225721814719.[0m
[32m[I 2022-04-22 05:16:01,747][0m Trial 873 finished with value: 0.6713565979142997 and parameters: {'alpha': 3.7174152445615594, 'ties': 'breslow'}. Best is trial 51 with value: 0.6718225721814719.[0m
[32m[I 2022-04-22 05:16:29,873][0m Trial 874 finished with value: 0.6704196804139302 and parameters: {'alpha': 4.02102505692398, 'ties': 'breslow'}. Best is trial 51 with value: 0.6718225721814719.[0m
[32m[I 2022-04-22 05:16:57,962][0m Trial 875 finished with value: 0.6709609715374141 and parameters: {'alpha': 3.628513359437703, 'ties': 'breslow'}. Best is trial 51 with value: 0.6718225721814719.[0m
[32m[I 2022-04-22 05:17:26,664][0m Trial 876 finished with value: 0.6691462412450326 and parameters: {'alpha': 2.4396662911502274, 'ties': 'breslow'}. Best is trial 51 with value: 0.6718225721814719.[0m
[32m[I 2022-04-22 05:17:55,312][0m Trial 877 finished with value: 0.6715828289199117 and parameters: {'alpha': 3.7919259074188254, 'ties': 'breslow'}. Best is trial 51 with value: 0.6718225721814719.[0m
[32m[I 2022-04-22 05:18:25,462][0m Trial 878 finished with value: 0.6713323130079433 and parameters: {'alpha': 3.8431126614018005, 'ties': 'breslow'}. Best is trial 51 with value: 0.6718225721814719.[0m
[32m[I 2022-04-22 05:18:57,847][0m Trial 879 finished with value: 0.6710883379454154 and parameters: {'alpha': 3.515843124195338, 'ties': 'breslow'}. Best is trial 51 with value: 0.6718225721814719.[0m
[32m[I 2022-04-22 05:19:29,308][0m Trial 880 finished with value: 0.6714381495717138 and parameters: {'alpha': 3.727678981665115, 'ties': 'breslow'}. Best is trial 51 with value: 0.6718225721814719.[0m
[32m[I 2022-04-22 05:20:00,526][0m Trial 881 finished with value: 0.6710392443611095 and parameters: {'alpha': 3.6052539579220824, 'ties': 'breslow'}. Best is trial 51 with value: 0.6718225721814719.[0m
[32m[I 2022-04-22 05:20:31,799][0m Trial 882 finished with value: 0.6708098592683656 and parameters: {'alpha': 3.9578506853189204, 'ties': 'breslow'}. Best is trial 51 with value: 0.6718225721814719.[0m
[32m[I 2022-04-22 05:21:01,671][0m Trial 883 finished with value: 0.6713391442925675 and parameters: {'alpha': 3.829885671212232, 'ties': 'breslow'}. Best is trial 51 with value: 0.6718225721814719.[0m
[32m[I 2022-04-22 05:21:31,469][0m Trial 884 finished with value: 0.6712758842947594 and parameters: {'alpha': 3.701197343230971, 'ties': 'breslow'}. Best is trial 51 with value: 0.6718225721814719.[0m
[32m[I 2022-04-22 05:22:00,275][0m Trial 885 finished with value: 0.669679765977033 and parameters: {'alpha': 4.997020654310584, 'ties': 'breslow'}. Best is trial 51 with value: 0.6718225721814719.[0m
[32m[I 2022-04-22 05:22:30,625][0m Trial 886 finished with value: 0.6710859829862048 and parameters: {'alpha': 3.416219864037304, 'ties': 'breslow'}. Best is trial 51 with value: 0.6718225721814719.[0m
[32m[I 2022-04-22 05:23:01,818][0m Trial 887 finished with value: 0.6706400725276364 and parameters: {'alpha': 4.17013986198374, 'ties': 'breslow'}. Best is trial 51 with value: 0.6718225721814719.[0m
[32m[I 2022-04-22 05:23:27,815][0m Trial 888 finished with value: 0.6710232632602642 and parameters: {'alpha': 3.9100990344391264, 'ties': 'efron'}. Best is trial 51 with value: 0.6718225721814719.[0m
[32m[I 2022-04-22 05:29:04,356][0m Trial 889 finished with value: 0.6624917769946312 and parameters: {'alpha': 0.0911042885637583, 'ties': 'breslow'}. Best is trial 51 with value: 0.6718225721814719.[0m
[32m[I 2022-04-22 05:29:32,058][0m Trial 890 finished with value: 0.6716643805773258 and parameters: {'alpha': 3.779747851588902, 'ties': 'breslow'}. Best is trial 51 with value: 0.6718225721814719.[0m
[32m[I 2022-04-22 05:30:01,992][0m Trial 891 finished with value: 0.6711982740031293 and parameters: {'alpha': 3.695227151770922, 'ties': 'breslow'}. Best is trial 51 with value: 0.6718225721814719.[0m
[32m[I 2022-04-22 05:30:30,609][0m Trial 892 finished with value: 0.6707257400948092 and parameters: {'alpha': 4.066033037867405, 'ties': 'breslow'}. Best is trial 51 with value: 0.6718225721814719.[0m
[32m[I 2022-04-22 05:31:00,291][0m Trial 893 finished with value: 0.6709609715374141 and parameters: {'alpha': 3.625718603579666, 'ties': 'breslow'}. Best is trial 51 with value: 0.6718225721814719.[0m
[32m[I 2022-04-22 05:31:28,672][0m Trial 894 finished with value: 0.6714105858316386 and parameters: {'alpha': 3.861009946891207, 'ties': 'breslow'}. Best is trial 51 with value: 0.6718225721814719.[0m
[32m[I 2022-04-22 05:31:58,576][0m Trial 895 finished with value: 0.6711160166148658 and parameters: {'alpha': 3.5460354162870185, 'ties': 'breslow'}. Best is trial 51 with value: 0.6718225721814719.[0m
[32m[I 2022-04-22 05:32:27,503][0m Trial 896 finished with value: 0.6708098592683656 and parameters: {'alpha': 3.954593507472257, 'ties': 'breslow'}. Best is trial 51 with value: 0.6718225721814719.[0m
[32m[I 2022-04-22 05:32:57,754][0m Trial 897 finished with value: 0.6717410205240577 and parameters: {'alpha': 3.777414218869093, 'ties': 'breslow'}. Best is trial 51 with value: 0.6718225721814719.[0m
[32m[I 2022-04-22 05:33:27,770][0m Trial 898 finished with value: 0.6714352686560117 and parameters: {'alpha': 3.753636025780808, 'ties': 'breslow'}. Best is trial 51 with value: 0.6718225721814719.[0m
[32m[I 2022-04-22 05:33:57,345][0m Trial 899 finished with value: 0.670957560396671 and parameters: {'alpha': 3.635676958094587, 'ties': 'breslow'}. Best is trial 51 with value: 0.6718225721814719.[0m
[32m[I 2022-04-22 05:34:28,181][0m Trial 900 finished with value: 0.6714206959499815 and parameters: {'alpha': 3.8263766926933287, 'ties': 'breslow'}. Best is trial 51 with value: 0.6718225721814719.[0m
[32m[I 2022-04-22 05:34:55,700][0m Trial 901 finished with value: 0.6711796766006307 and parameters: {'alpha': 3.923640623789371, 'ties': 'breslow'}. Best is trial 51 with value: 0.6718225721814719.[0m
[32m[I 2022-04-22 05:35:25,103][0m Trial 902 finished with value: 0.6711977437780883 and parameters: {'alpha': 3.705649203473057, 'ties': 'breslow'}. Best is trial 51 with value: 0.6718225721814719.[0m
[32m[I 2022-04-22 05:35:55,398][0m Trial 903 finished with value: 0.6715828289199117 and parameters: {'alpha': 3.795514542178285, 'ties': 'breslow'}. Best is trial 51 with value: 0.6718225721814719.[0m
[32m[I 2022-04-22 05:36:24,759][0m Trial 904 finished with value: 0.6703423779351331 and parameters: {'alpha': 4.016031835213422, 'ties': 'breslow'}. Best is trial 51 with value: 0.6718225721814719.[0m
[32m[I 2022-04-22 05:36:54,853][0m Trial 905 finished with value: 0.6711918185237238 and parameters: {'alpha': 3.5224544320729487, 'ties': 'breslow'}. Best is trial 51 with value: 0.6718225721814719.[0m
[32m[I 2022-04-22 05:37:25,476][0m Trial 906 finished with value: 0.6713378682047766 and parameters: {'alpha': 3.881554650499645, 'ties': 'breslow'}. Best is trial 51 with value: 0.6718225721814719.[0m
[32m[I 2022-04-22 05:37:56,306][0m Trial 907 finished with value: 0.670957560396671 and parameters: {'alpha': 3.6378718915723676, 'ties': 'breslow'}. Best is trial 51 with value: 0.6718225721814719.[0m
[32m[I 2022-04-22 05:38:28,040][0m Trial 908 finished with value: 0.6714313272902276 and parameters: {'alpha': 3.7154430145419814, 'ties': 'efron'}. Best is trial 51 with value: 0.6718225721814719.[0m
[32m[I 2022-04-22 05:38:55,929][0m Trial 909 finished with value: 0.6714105858316386 and parameters: {'alpha': 3.8644906049762886, 'ties': 'breslow'}. Best is trial 51 with value: 0.6718225721814719.[0m
[32m[I 2022-04-22 05:39:25,549][0m Trial 910 finished with value: 0.6708098592683656 and parameters: {'alpha': 3.9666820331888593, 'ties': 'breslow'}. Best is trial 51 with value: 0.6718225721814719.[0m
[32m[I 2022-04-22 05:40:03,558][0m Trial 911 finished with value: 0.6670676216463262 and parameters: {'alpha': 1.4467061498879545, 'ties': 'breslow'}. Best is trial 51 with value: 0.6718225721814719.[0m
[32m[I 2022-04-22 05:40:34,456][0m Trial 912 finished with value: 0.6716673515982117 and parameters: {'alpha': 3.7652611014462867, 'ties': 'breslow'}. Best is trial 51 with value: 0.6718225721814719.[0m
[32m[I 2022-04-22 05:41:05,106][0m Trial 913 finished with value: 0.6710392443611095 and parameters: {'alpha': 3.5996216636953133, 'ties': 'breslow'}. Best is trial 51 with value: 0.6718225721814719.[0m
[32m[I 2022-04-22 05:41:33,978][0m Trial 914 finished with value: 0.6708033503864392 and parameters: {'alpha': 4.084509527038752, 'ties': 'breslow'}. Best is trial 51 with value: 0.6718225721814719.[0m
[32m[I 2022-04-22 05:42:03,021][0m Trial 915 finished with value: 0.6716643805773258 and parameters: {'alpha': 3.7857143730815843, 'ties': 'breslow'}. Best is trial 51 with value: 0.6718225721814719.[0m
[32m[I 2022-04-22 05:42:32,085][0m Trial 916 finished with value: 0.6711724463543013 and parameters: {'alpha': 3.4563497204605826, 'ties': 'breslow'}. Best is trial 51 with value: 0.6718225721814719.[0m
[32m[I 2022-04-22 05:43:02,372][0m Trial 917 finished with value: 0.6711167223457152 and parameters: {'alpha': 3.68246558381897, 'ties': 'breslow'}. Best is trial 51 with value: 0.6718225721814719.[0m
[32m[I 2022-04-22 05:43:32,106][0m Trial 918 finished with value: 0.6702426025367588 and parameters: {'alpha': 3.308497240825561, 'ties': 'breslow'}. Best is trial 51 with value: 0.6718225721814719.[0m
[32m[I 2022-04-22 05:44:02,027][0m Trial 919 finished with value: 0.6714105858316386 and parameters: {'alpha': 3.8629338809137526, 'ties': 'breslow'}. Best is trial 51 with value: 0.6718225721814719.[0m
[32m[I 2022-04-22 05:44:33,203][0m Trial 920 finished with value: 0.6710387141360685 and parameters: {'alpha': 3.555194025433362, 'ties': 'breslow'}. Best is trial 51 with value: 0.6718225721814719.[0m
[32m[I 2022-04-22 05:45:03,751][0m Trial 921 finished with value: 0.6714352686560117 and parameters: {'alpha': 3.7528023526940006, 'ties': 'breslow'}. Best is trial 51 with value: 0.6718225721814719.[0m
[32m[I 2022-04-22 05:45:32,888][0m Trial 922 finished with value: 0.6712563165473625 and parameters: {'alpha': 3.890781296286012, 'ties': 'breslow'}. Best is trial 51 with value: 0.6718225721814719.[0m
[32m[I 2022-04-22 05:46:01,891][0m Trial 923 finished with value: 0.670957560396671 and parameters: {'alpha': 3.6590570500904107, 'ties': 'breslow'}. Best is trial 51 with value: 0.6718225721814719.[0m
[32m[I 2022-04-22 05:46:31,268][0m Trial 924 finished with value: 0.6707310562196291 and parameters: {'alpha': 3.9774346137653818, 'ties': 'breslow'}. Best is trial 51 with value: 0.6718225721814719.[0m
[32m[I 2022-04-22 05:47:01,402][0m Trial 925 finished with value: 0.6717410205240577 and parameters: {'alpha': 3.777314229216047, 'ties': 'breslow'}. Best is trial 51 with value: 0.6718225721814719.[0m
