[32m[I 2022-04-21 11:40:03,329][0m Trial 482 finished with value: 0.8154653424629297 and parameters: {'splitter': 'best', 'min_samples_split': 0.04058845949189335, 'min_samples_leaf': 0.04567343052433883, 'min_weight_fraction_leaf': 0.017153025324104246, 'max_features': 0.4498582717331871}. Best is trial 435 with value: 0.8271205444415821.[0m
/media/san2_ssd/data/Workdir/survival/utils.py:305: RuntimeWarning: invalid value encountered in true_divide
  pdfs = np.gradient(1-survs,axis=1)/norms
/media/san2_ssd/data/Workdir/survival/utils.py:305: RuntimeWarning: invalid value encountered in true_divide
  pdfs = np.gradient(1-survs,axis=1)/norms
/media/san2_ssd/data/Workdir/survival/utils.py:305: RuntimeWarning: invalid value encountered in true_divide
  pdfs = np.gradient(1-survs,axis=1)/norms
[32m[I 2022-04-21 11:40:04,800][0m Trial 483 finished with value: 0.823745410924362 and parameters: {'splitter': 'best', 'min_samples_split': 0.06967785759338126, 'min_samples_leaf': 0.012238676049816169, 'min_weight_fraction_leaf': 0.009593356289783021, 'max_features': 0.5157031505737278}. Best is trial 435 with value: 0.8271205444415821.[0m
[32m[I 2022-04-21 11:40:05,320][0m Trial 484 finished with value: 0.5960591977586911 and parameters: {'splitter': 'best', 'min_samples_split': 0.05787928506169793, 'min_samples_leaf': 0.1956092148212299, 'min_weight_fraction_leaf': 0.0003740810476598178, 'max_features': 0.5115334587782314}. Best is trial 435 with value: 0.8271205444415821.[0m
[32m[I 2022-04-21 11:40:05,592][0m Trial 485 finished with value: 0.8084292249418823 and parameters: {'splitter': 'random', 'min_samples_split': 0.06761903689357564, 'min_samples_leaf': 0.009177794390675238, 'min_weight_fraction_leaf': 0.03141145688407998, 'max_features': 0.5603226194389126}. Best is trial 435 with value: 0.8271205444415821.[0m
[32m[I 2022-04-21 11:40:06,376][0m Trial 486 finished with value: 0.8128715718587264 and parameters: {'splitter': 'best', 'min_samples_split': 0.07011895411031113, 'min_samples_leaf': 0.0010180733533303472, 'min_weight_fraction_leaf': 0.02103099447414898, 'max_features': 0.4770257989598481}. Best is trial 435 with value: 0.8271205444415821.[0m
[32m[I 2022-04-21 11:40:06,831][0m Trial 487 finished with value: 0.805764449957735 and parameters: {'splitter': 'best', 'min_samples_split': 0.05852198924834004, 'min_samples_leaf': 0.026831455729455715, 'min_weight_fraction_leaf': 0.0431179310526827, 'max_features': 0.5435549234119207}. Best is trial 435 with value: 0.8271205444415821.[0m
/media/san2_ssd/data/Workdir/survival/utils.py:305: RuntimeWarning: invalid value encountered in true_divide
  pdfs = np.gradient(1-survs,axis=1)/norms
/media/san2_ssd/data/Workdir/survival/utils.py:305: RuntimeWarning: invalid value encountered in true_divide
  pdfs = np.gradient(1-survs,axis=1)/norms
/media/san2_ssd/data/Workdir/survival/utils.py:305: RuntimeWarning: invalid value encountered in true_divide
  pdfs = np.gradient(1-survs,axis=1)/norms
/media/san2_ssd/data/Workdir/survival/utils.py:305: RuntimeWarning: invalid value encountered in true_divide
  pdfs = np.gradient(1-survs,axis=1)/norms
[32m[I 2022-04-21 11:40:07,578][0m Trial 488 finished with value: 0.8111817678794928 and parameters: {'splitter': 'best', 'min_samples_split': 0.04167341997638695, 'min_samples_leaf': 0.0117824038494937, 'min_weight_fraction_leaf': 0.00929748988321196, 'max_features': 0.5210785759280091}. Best is trial 435 with value: 0.8271205444415821.[0m
/media/san2_ssd/data/Workdir/survival/utils.py:305: RuntimeWarning: invalid value encountered in true_divide
  pdfs = np.gradient(1-survs,axis=1)/norms
[32m[I 2022-04-21 11:40:07,969][0m Trial 489 finished with value: 0.8117796556552552 and parameters: {'splitter': 'best', 'min_samples_split': 0.07217957530707253, 'min_samples_leaf': 0.03330687436089971, 'min_weight_fraction_leaf': 0.02450584968641928, 'max_features': 0.49611315320770205}. Best is trial 435 with value: 0.8271205444415821.[0m
/media/san2_ssd/data/Workdir/survival/utils.py:305: RuntimeWarning: invalid value encountered in true_divide
  pdfs = np.gradient(1-survs,axis=1)/norms
[32m[I 2022-04-21 11:40:08,547][0m Trial 490 finished with value: 0.8093002850067164 and parameters: {'splitter': 'best', 'min_samples_split': 0.07657581917969797, 'min_samples_leaf': 0.01777239950543192, 'min_weight_fraction_leaf': 0.0002919279423578544, 'max_features': 0.5471043621104024}. Best is trial 435 with value: 0.8271205444415821.[0m
/media/san2_ssd/data/Workdir/survival/utils.py:305: RuntimeWarning: invalid value encountered in true_divide
  pdfs = np.gradient(1-survs,axis=1)/norms
/media/san2_ssd/data/Workdir/survival/utils.py:305: RuntimeWarning: invalid value encountered in true_divide
  pdfs = np.gradient(1-survs,axis=1)/norms
[32m[I 2022-04-21 11:40:09,104][0m Trial 491 finished with value: 0.8203350915056007 and parameters: {'splitter': 'best', 'min_samples_split': 0.053434385782308004, 'min_samples_leaf': 0.00990121296654821, 'min_weight_fraction_leaf': 0.014680909913609782, 'max_features': 0.5035127279617352}. Best is trial 435 with value: 0.8271205444415821.[0m
/media/san2_ssd/data/Workdir/survival/utils.py:305: RuntimeWarning: invalid value encountered in true_divide
  pdfs = np.gradient(1-survs,axis=1)/norms
/media/san2_ssd/data/Workdir/survival/utils.py:305: RuntimeWarning: invalid value encountered in true_divide
  pdfs = np.gradient(1-survs,axis=1)/norms
[32m[I 2022-04-21 11:40:09,514][0m Trial 492 finished with value: 0.810538191267827 and parameters: {'splitter': 'best', 'min_samples_split': 0.045208933308718814, 'min_samples_leaf': 0.026599802919303847, 'min_weight_fraction_leaf': 0.009912106374837854, 'max_features': 0.49620660109088155}. Best is trial 435 with value: 0.8271205444415821.[0m
/media/san2_ssd/data/Workdir/survival/utils.py:305: RuntimeWarning: invalid value encountered in true_divide
  pdfs = np.gradient(1-survs,axis=1)/norms
[32m[I 2022-04-21 11:40:09,758][0m Trial 493 finished with value: 0.8012490318807848 and parameters: {'splitter': 'random', 'min_samples_split': 0.06145802428289142, 'min_samples_leaf': 0.01033866571973651, 'min_weight_fraction_leaf': 0.015250141973197151, 'max_features': 0.5097093741693622}. Best is trial 435 with value: 0.8271205444415821.[0m
[32m[I 2022-04-21 11:40:10,384][0m Trial 494 finished with value: 0.8133920087929513 and parameters: {'splitter': 'best', 'min_samples_split': 0.02163037557484896, 'min_samples_leaf': 0.03602685418963381, 'min_weight_fraction_leaf': 0.008949449665361459, 'max_features': 0.5419769606971616}. Best is trial 435 with value: 0.8271205444415821.[0m
/media/san2_ssd/data/Workdir/survival/utils.py:305: RuntimeWarning: invalid value encountered in true_divide
  pdfs = np.gradient(1-survs,axis=1)/norms
/media/san2_ssd/data/Workdir/survival/utils.py:305: RuntimeWarning: invalid value encountered in true_divide
  pdfs = np.gradient(1-survs,axis=1)/norms
[32m[I 2022-04-21 11:40:11,250][0m Trial 495 finished with value: 0.814236070094619 and parameters: {'splitter': 'best', 'min_samples_split': 0.040756885927479496, 'min_samples_leaf': 0.024634855105403156, 'min_weight_fraction_leaf': 0.01871965712956307, 'max_features': 0.5205543655591037}. Best is trial 435 with value: 0.8271205444415821.[0m
/media/san2_ssd/data/Workdir/survival/utils.py:305: RuntimeWarning: invalid value encountered in true_divide
  pdfs = np.gradient(1-survs,axis=1)/norms
/media/san2_ssd/data/Workdir/survival/utils.py:305: RuntimeWarning: invalid value encountered in true_divide
  pdfs = np.gradient(1-survs,axis=1)/norms
[32m[I 2022-04-21 11:40:11,893][0m Trial 496 finished with value: 0.8077741717099218 and parameters: {'splitter': 'best', 'min_samples_split': 0.05179492131962205, 'min_samples_leaf': 0.017621884610741895, 'min_weight_fraction_leaf': 0.0008360953060029028, 'max_features': 0.2855299603256545}. Best is trial 435 with value: 0.8271205444415821.[0m
[32m[I 2022-04-21 11:40:12,300][0m Trial 497 finished with value: 0.8036107549528593 and parameters: {'splitter': 'best', 'min_samples_split': 0.05439912065382485, 'min_samples_leaf': 0.04543993681860692, 'min_weight_fraction_leaf': 0.009404213614736305, 'max_features': 0.42980785086116413}. Best is trial 435 with value: 0.8271205444415821.[0m
[32m[I 2022-04-21 11:40:13,012][0m Trial 498 finished with value: 0.8077342135028024 and parameters: {'splitter': 'best', 'min_samples_split': 0.08072551214374843, 'min_samples_leaf': 0.009811347884530744, 'min_weight_fraction_leaf': 0.02711106683589936, 'max_features': 0.5262877297264118}. Best is trial 435 with value: 0.8271205444415821.[0m
/media/san2_ssd/data/Workdir/survival/utils.py:305: RuntimeWarning: invalid value encountered in true_divide
  pdfs = np.gradient(1-survs,axis=1)/norms
[32m[I 2022-04-21 11:40:13,592][0m Trial 499 finished with value: 0.8169850138103965 and parameters: {'splitter': 'best', 'min_samples_split': 0.030406407264215597, 'min_samples_leaf': 0.026967315001072675, 'min_weight_fraction_leaf': 0.01643566489795159, 'max_features': 0.4622025611780526}. Best is trial 435 with value: 0.8271205444415821.[0m
[32m[I 2022-04-21 11:40:13,814][0m Trial 500 finished with value: 0.7949950369567372 and parameters: {'splitter': 'random', 'min_samples_split': 0.062042192469193326, 'min_samples_leaf': 0.017078191597219697, 'min_weight_fraction_leaf': 0.0008489079244727617, 'max_features': 0.4175379383689445}. Best is trial 435 with value: 0.8271205444415821.[0m
/media/san2_ssd/data/Workdir/survival/utils.py:305: RuntimeWarning: invalid value encountered in true_divide
  pdfs = np.gradient(1-survs,axis=1)/norms
/media/san2_ssd/data/Workdir/survival/utils.py:305: RuntimeWarning: invalid value encountered in true_divide
  pdfs = np.gradient(1-survs,axis=1)/norms
[32m[I 2022-04-21 11:40:14,615][0m Trial 501 finished with value: 0.8112495989295304 and parameters: {'splitter': 'best', 'min_samples_split': 0.07526801698573847, 'min_samples_leaf': 0.009246301548268727, 'min_weight_fraction_leaf': 0.0166126619207363, 'max_features': 0.4860435679745774}. Best is trial 435 with value: 0.8271205444415821.[0m
[32m[I 2022-04-21 11:40:14,968][0m Trial 502 finished with value: 0.7735429762986096 and parameters: {'splitter': 'best', 'min_samples_split': 0.0488227591222371, 'min_samples_leaf': 0.06073973328849991, 'min_weight_fraction_leaf': 0.13706675388675543, 'max_features': 0.31352583288492664}. Best is trial 435 with value: 0.8271205444415821.[0m
/media/san2_ssd/data/Workdir/survival/utils.py:305: RuntimeWarning: invalid value encountered in true_divide
  pdfs = np.gradient(1-survs,axis=1)/norms
/media/san2_ssd/data/Workdir/survival/utils.py:305: RuntimeWarning: invalid value encountered in true_divide
  pdfs = np.gradient(1-survs,axis=1)/norms
/media/san2_ssd/data/Workdir/survival/utils.py:305: RuntimeWarning: invalid value encountered in true_divide
  pdfs = np.gradient(1-survs,axis=1)/norms
/media/san2_ssd/data/Workdir/survival/utils.py:305: RuntimeWarning: invalid value encountered in true_divide
  pdfs = np.gradient(1-survs,axis=1)/norms
/media/san2_ssd/data/Workdir/survival/utils.py:305: RuntimeWarning: invalid value encountered in true_divide
  pdfs = np.gradient(1-survs,axis=1)/norms
[32m[I 2022-04-21 11:40:16,957][0m Trial 503 finished with value: 0.8099907524074693 and parameters: {'splitter': 'best', 'min_samples_split': 0.01343061866525586, 'min_samples_leaf': 0.001110129798257491, 'min_weight_fraction_leaf': 0.0003869506932477479, 'max_features': 0.4483213778490332}. Best is trial 435 with value: 0.8271205444415821.[0m
[32m[I 2022-04-21 11:40:17,422][0m Trial 504 finished with value: 0.8112274136615423 and parameters: {'splitter': 'best', 'min_samples_split': 0.06503284835617788, 'min_samples_leaf': 0.035949459031302644, 'min_weight_fraction_leaf': 0.029884690748995975, 'max_features': 0.4195162162798995}. Best is trial 435 with value: 0.8271205444415821.[0m
/media/san2_ssd/data/Workdir/survival/utils.py:305: RuntimeWarning: invalid value encountered in true_divide
  pdfs = np.gradient(1-survs,axis=1)/norms
[32m[I 2022-04-21 11:40:17,890][0m Trial 505 finished with value: 0.811002157955216 and parameters: {'splitter': 'best', 'min_samples_split': 0.0827130780454876, 'min_samples_leaf': 0.01956715263289204, 'min_weight_fraction_leaf': 0.009912990918772088, 'max_features': 0.2695395223061505}. Best is trial 435 with value: 0.8271205444415821.[0m
[32m[I 2022-04-21 11:40:18,467][0m Trial 506 finished with value: 0.8065319069143145 and parameters: {'splitter': 'best', 'min_samples_split': 0.09069924683516119, 'min_samples_leaf': 0.028555537285775874, 'min_weight_fraction_leaf': 0.02253374124824793, 'max_features': 0.24911457632659406}. Best is trial 435 with value: 0.8271205444415821.[0m
/media/san2_ssd/data/Workdir/survival/utils.py:305: RuntimeWarning: invalid value encountered in true_divide
  pdfs = np.gradient(1-survs,axis=1)/norms
[32m[I 2022-04-21 11:40:18,950][0m Trial 507 finished with value: 0.802092443825412 and parameters: {'splitter': 'random', 'min_samples_split': 0.07480205875339471, 'min_samples_leaf': 0.010221437564568413, 'min_weight_fraction_leaf': 0.011204271747757653, 'max_features': 0.4991586596404541}. Best is trial 435 with value: 0.8271205444415821.[0m
/media/san2_ssd/data/Workdir/survival/utils.py:305: RuntimeWarning: invalid value encountered in true_divide
  pdfs = np.gradient(1-survs,axis=1)/norms
/media/san2_ssd/data/Workdir/survival/utils.py:305: RuntimeWarning: invalid value encountered in true_divide
  pdfs = np.gradient(1-survs,axis=1)/norms
/media/san2_ssd/data/Workdir/survival/utils.py:305: RuntimeWarning: invalid value encountered in true_divide
  pdfs = np.gradient(1-survs,axis=1)/norms
/media/san2_ssd/data/Workdir/survival/utils.py:305: RuntimeWarning: invalid value encountered in true_divide
  pdfs = np.gradient(1-survs,axis=1)/norms
[32m[I 2022-04-21 11:40:19,844][0m Trial 508 finished with value: 0.8068912140889211 and parameters: {'splitter': 'best', 'min_samples_split': 0.03487199335079911, 'min_samples_leaf': 0.0014457975564151695, 'min_weight_fraction_leaf': 0.019059430352946497, 'max_features': 0.46876623456246275}. Best is trial 435 with value: 0.8271205444415821.[0m
[32m[I 2022-04-21 11:40:20,039][0m Trial 509 finished with value: 0.6707081802724992 and parameters: {'splitter': 'best', 'min_samples_split': 0.05909864046116096, 'min_samples_leaf': 0.25248544329216743, 'min_weight_fraction_leaf': 0.009242805640702656, 'max_features': 0.43942469888108243}. Best is trial 435 with value: 0.8271205444415821.[0m
[32m[I 2022-04-21 11:40:20,445][0m Trial 510 finished with value: 0.7969256776385436 and parameters: {'splitter': 'best', 'min_samples_split': 0.08662715277437849, 'min_samples_leaf': 0.04370405901760564, 'min_weight_fraction_leaf': 0.03229874292609613, 'max_features': 0.3041451788214568}. Best is trial 435 with value: 0.8271205444415821.[0m
/media/san2_ssd/data/Workdir/survival/utils.py:305: RuntimeWarning: invalid value encountered in true_divide
  pdfs = np.gradient(1-survs,axis=1)/norms
[32m[I 2022-04-21 11:40:20,849][0m Trial 511 finished with value: 0.8079192712937932 and parameters: {'splitter': 'best', 'min_samples_split': 0.07286915666480076, 'min_samples_leaf': 0.020787634459273438, 'min_weight_fraction_leaf': 0.0005435576255659625, 'max_features': 0.4146701125209701}. Best is trial 435 with value: 0.8271205444415821.[0m
/media/san2_ssd/data/Workdir/survival/utils.py:305: RuntimeWarning: invalid value encountered in true_divide
  pdfs = np.gradient(1-survs,axis=1)/norms
/media/san2_ssd/data/Workdir/survival/utils.py:305: RuntimeWarning: invalid value encountered in true_divide
  pdfs = np.gradient(1-survs,axis=1)/norms
/media/san2_ssd/data/Workdir/survival/utils.py:305: RuntimeWarning: invalid value encountered in true_divide
  pdfs = np.gradient(1-survs,axis=1)/norms
[32m[I 2022-04-21 11:40:21,508][0m Trial 512 finished with value: 0.8036701501308915 and parameters: {'splitter': 'best', 'min_samples_split': 0.04968583173185572, 'min_samples_leaf': 0.010574218366591726, 'min_weight_fraction_leaf': 0.000273917652817838, 'max_features': 0.32358955605052}. Best is trial 435 with value: 0.8271205444415821.[0m
[32m[I 2022-04-21 11:40:21,713][0m Trial 513 finished with value: 0.810741552722865 and parameters: {'splitter': 'random', 'min_samples_split': 0.09213788927887598, 'min_samples_leaf': 0.032636157262985334, 'min_weight_fraction_leaf': 0.022326845929165166, 'max_features': 0.4588352815030569}. Best is trial 435 with value: 0.8271205444415821.[0m
[32m[I 2022-04-21 11:40:21,857][0m Trial 514 finished with value: 0.5647344285131972 and parameters: {'splitter': 'best', 'min_samples_split': 0.06844807345976418, 'min_samples_leaf': 0.3189335302153585, 'min_weight_fraction_leaf': 0.014351626848477544, 'max_features': 0.4311931767658479}. Best is trial 435 with value: 0.8271205444415821.[0m
[32m[I 2022-04-21 11:40:22,636][0m Trial 515 finished with value: 0.804104867966126 and parameters: {'splitter': 'best', 'min_samples_split': 0.0377474151691775, 'min_samples_leaf': 0.0011013402841413313, 'min_weight_fraction_leaf': 0.03665439793305353, 'max_features': 0.5281358853427263}. Best is trial 435 with value: 0.8271205444415821.[0m
[32m[I 2022-04-21 11:40:23,010][0m Trial 516 finished with value: 0.8152197236532761 and parameters: {'splitter': 'best', 'min_samples_split': 0.08168869714222389, 'min_samples_leaf': 0.01803276713700524, 'min_weight_fraction_leaf': 0.009601019102149127, 'max_features': 0.4030035092387333}. Best is trial 435 with value: 0.8271205444415821.[0m
[32m[I 2022-04-21 11:40:23,527][0m Trial 517 finished with value: 0.8232534688165949 and parameters: {'splitter': 'best', 'min_samples_split': 0.09525530874838464, 'min_samples_leaf': 0.025441955732971352, 'min_weight_fraction_leaf': 0.02408008113531918, 'max_features': 0.5736546845862224}. Best is trial 435 with value: 0.8271205444415821.[0m
[32m[I 2022-04-21 11:40:23,906][0m Trial 518 finished with value: 0.8052453049328807 and parameters: {'splitter': 'best', 'min_samples_split': 0.09814985657564586, 'min_samples_leaf': 0.03627030020308201, 'min_weight_fraction_leaf': 0.04087981810812045, 'max_features': 0.5928714876814658}. Best is trial 435 with value: 0.8271205444415821.[0m
[32m[I 2022-04-21 11:40:24,038][0m Trial 519 finished with value: 0.46132088611172134 and parameters: {'splitter': 'random', 'min_samples_split': 0.002346048942918462, 'min_samples_leaf': 0.05148013131696204, 'min_weight_fraction_leaf': 0.3461261784622217, 'max_features': 0.6183238338135358}. Best is trial 435 with value: 0.8271205444415821.[0m
[32m[I 2022-04-21 11:40:24,306][0m Trial 520 finished with value: 0.8107952692580692 and parameters: {'splitter': 'best', 'min_samples_split': 0.09153373160858111, 'min_samples_leaf': 0.0283917431140739, 'min_weight_fraction_leaf': 0.02977017531392411, 'max_features': 0.3370623340162961}. Best is trial 435 with value: 0.8271205444415821.[0m
[32m[I 2022-04-21 11:40:24,880][0m Trial 521 finished with value: 0.8037272656415405 and parameters: {'splitter': 'best', 'min_samples_split': 0.09894644268962965, 'min_samples_leaf': 0.04782102311153716, 'min_weight_fraction_leaf': 0.025197408070051167, 'max_features': 0.6346932385568202}. Best is trial 435 with value: 0.8271205444415821.[0m
[32m[I 2022-04-21 11:40:25,477][0m Trial 522 finished with value: 0.8102207529673064 and parameters: {'splitter': 'best', 'min_samples_split': 0.08375082130989009, 'min_samples_leaf': 0.03935485306593164, 'min_weight_fraction_leaf': 0.008641505356962452, 'max_features': 0.4188118212223035}. Best is trial 435 with value: 0.8271205444415821.[0m
[32m[I 2022-04-21 11:40:25,595][0m Trial 523 finished with value: 0.46991866821558936 and parameters: {'splitter': 'best', 'min_samples_split': 0.10376281710889135, 'min_samples_leaf': 0.42187562745633944, 'min_weight_fraction_leaf': 0.022018474162522127, 'max_features': 0.5568965169584326}. Best is trial 435 with value: 0.8271205444415821.[0m
/media/san2_ssd/data/Workdir/survival/utils.py:305: RuntimeWarning: invalid value encountered in true_divide
  pdfs = np.gradient(1-survs,axis=1)/norms
/media/san2_ssd/data/Workdir/survival/utils.py:305: RuntimeWarning: invalid value encountered in true_divide
  pdfs = np.gradient(1-survs,axis=1)/norms
[32m[I 2022-04-21 11:40:25,980][0m Trial 524 finished with value: 0.8207223193206923 and parameters: {'splitter': 'best', 'min_samples_split': 0.08934382080167858, 'min_samples_leaf': 0.022524848279588602, 'min_weight_fraction_leaf': 0.008003071470586386, 'max_features': 0.6118912420095086}. Best is trial 435 with value: 0.8271205444415821.[0m
/media/san2_ssd/data/Workdir/survival/utils.py:305: RuntimeWarning: invalid value encountered in true_divide
  pdfs = np.gradient(1-survs,axis=1)/norms
[32m[I 2022-04-21 11:40:26,376][0m Trial 525 finished with value: 0.8236223896583542 and parameters: {'splitter': 'best', 'min_samples_split': 0.08065240780950855, 'min_samples_leaf': 0.022264796135406672, 'min_weight_fraction_leaf': 0.0076084332363250285, 'max_features': 0.6164324058178121}. Best is trial 435 with value: 0.8271205444415821.[0m
/media/san2_ssd/data/Workdir/survival/utils.py:305: RuntimeWarning: invalid value encountered in true_divide
  pdfs = np.gradient(1-survs,axis=1)/norms
[32m[I 2022-04-21 11:40:26,479][0m Trial 526 finished with value: 0.819861832621342 and parameters: {'splitter': 'random', 'min_samples_split': 0.07771906782133786, 'min_samples_leaf': 0.026216217006494912, 'min_weight_fraction_leaf': 0.0007612752502440282, 'max_features': 0.6516722420382284}. Best is trial 435 with value: 0.8271205444415821.[0m
