[32m[I 2022-04-23 14:35:17,558][0m Trial 411 finished with value: 0.6780807444543193 and parameters: {'n_hidden': 2048, 'mixture_components': 9, 'use_sparse_layer': False, 'use_batchnorm': False, 'use_dropout': True, 'dropout': 0.057189691753137296, 'mlp_size_1': 4, 'mlp_size_2': 3, 'mlp_size_3': 1, 'kernel': 'Normal', 'loss_name': 'CensoredNLLLoss'}. Best is trial 123 with value: 0.6857038111174789.[0m
[32m[I 2022-04-23 14:36:32,721][0m Trial 412 finished with value: 0.663188196155746 and parameters: {'n_hidden': 2048, 'mixture_components': 9, 'use_sparse_layer': False, 'use_batchnorm': False, 'use_dropout': True, 'dropout': 0.03409881375756961, 'mlp_size_1': 4, 'mlp_size_2': 3, 'mlp_size_3': 1, 'kernel': 'Normal', 'loss_name': 'CensoredNLLLoss'}. Best is trial 123 with value: 0.6857038111174789.[0m
[32m[I 2022-04-23 14:38:02,502][0m Trial 413 finished with value: 0.6827374708250612 and parameters: {'n_hidden': 2048, 'mixture_components': 9, 'use_sparse_layer': False, 'use_batchnorm': False, 'use_dropout': True, 'dropout': 0.05876766178397087, 'mlp_size_1': 4, 'mlp_size_2': 3, 'mlp_size_3': 1, 'kernel': 'Normal', 'loss_name': 'CensoredNLLLoss'}. Best is trial 123 with value: 0.6857038111174789.[0m
[32m[I 2022-04-23 14:39:21,193][0m Trial 414 finished with value: 0.6662245427306348 and parameters: {'n_hidden': 2048, 'mixture_components': 9, 'use_sparse_layer': False, 'use_batchnorm': False, 'use_dropout': True, 'dropout': 0.054433040067096664, 'mlp_size_1': 4, 'mlp_size_2': 3, 'mlp_size_3': 1, 'kernel': 'Normal', 'loss_name': 'CensoredNLLLoss'}. Best is trial 123 with value: 0.6857038111174789.[0m
[32m[I 2022-04-23 14:40:50,079][0m Trial 415 finished with value: 0.662178990227729 and parameters: {'n_hidden': 2048, 'mixture_components': 9, 'use_sparse_layer': False, 'use_batchnorm': False, 'use_dropout': True, 'dropout': 0.014503032865595927, 'mlp_size_1': 4, 'mlp_size_2': 3, 'mlp_size_3': 1, 'kernel': 'Normal', 'loss_name': 'CensoredNLLLoss'}. Best is trial 123 with value: 0.6857038111174789.[0m
[32m[I 2022-04-23 14:42:06,580][0m Trial 416 finished with value: 0.6339579295322864 and parameters: {'n_hidden': 2048, 'mixture_components': 9, 'use_sparse_layer': False, 'use_batchnorm': False, 'use_dropout': True, 'dropout': 0.06869787323048779, 'mlp_size_1': 4, 'mlp_size_2': 3, 'mlp_size_3': 1, 'kernel': 'Normal', 'loss_name': 'CensoredNLLLoss'}. Best is trial 123 with value: 0.6857038111174789.[0m
[32m[I 2022-04-23 14:43:32,766][0m Trial 417 finished with value: 0.6747124528089816 and parameters: {'n_hidden': 2048, 'mixture_components': 9, 'use_sparse_layer': False, 'use_batchnorm': False, 'use_dropout': True, 'dropout': 0.06412481592531052, 'mlp_size_1': 4, 'mlp_size_2': 3, 'mlp_size_3': 1, 'kernel': 'Normal', 'loss_name': 'CensoredNLLLoss'}. Best is trial 123 with value: 0.6857038111174789.[0m
[32m[I 2022-04-23 14:44:51,205][0m Trial 418 finished with value: 0.6549876077293872 and parameters: {'n_hidden': 2048, 'mixture_components': 10, 'use_sparse_layer': False, 'use_batchnorm': False, 'use_dropout': False, 'mlp_size_1': 4, 'mlp_size_2': 3, 'mlp_size_3': 1, 'kernel': 'Normal', 'loss_name': 'CensoredNLLLoss'}. Best is trial 123 with value: 0.6857038111174789.[0m
[32m[I 2022-04-23 14:46:16,784][0m Trial 419 finished with value: 0.682400957066811 and parameters: {'n_hidden': 2048, 'mixture_components': 9, 'use_sparse_layer': False, 'use_batchnorm': False, 'use_dropout': True, 'dropout': 0.06044552675019639, 'mlp_size_1': 4, 'mlp_size_2': 3, 'mlp_size_3': 1, 'kernel': 'Normal', 'loss_name': 'CensoredNLLLoss'}. Best is trial 123 with value: 0.6857038111174789.[0m
[32m[I 2022-04-23 14:47:48,199][0m Trial 420 finished with value: 0.6556693322684792 and parameters: {'n_hidden': 2048, 'mixture_components': 9, 'use_sparse_layer': False, 'use_batchnorm': False, 'use_dropout': True, 'dropout': 0.06422615910200766, 'mlp_size_1': 4, 'mlp_size_2': 3, 'mlp_size_3': 1, 'kernel': 'Normal', 'loss_name': 'CensoredNLLLoss'}. Best is trial 123 with value: 0.6857038111174789.[0m
[32m[I 2022-04-23 14:48:45,537][0m Trial 421 finished with value: -0.6630492810444284 and parameters: {'n_hidden': 2048, 'mixture_components': 9, 'use_sparse_layer': False, 'use_batchnorm': False, 'use_dropout': True, 'dropout': 0.026199222668168702, 'mlp_size_1': 4, 'mlp_size_2': 3, 'mlp_size_3': 1, 'kernel': 'Exponential', 'loss_name': 'CensoredNLLLoss'}. Best is trial 123 with value: 0.6857038111174789.[0m
[32m[I 2022-04-23 14:50:15,038][0m Trial 422 finished with value: 0.6635950655667904 and parameters: {'n_hidden': 2048, 'mixture_components': 9, 'use_sparse_layer': False, 'use_batchnorm': False, 'use_dropout': True, 'dropout': 0.039404518745720284, 'mlp_size_1': 4, 'mlp_size_2': 3, 'mlp_size_3': 1, 'kernel': 'Normal', 'loss_name': 'CensoredNLLLoss'}. Best is trial 123 with value: 0.6857038111174789.[0m
[32m[I 2022-04-23 14:51:39,818][0m Trial 423 finished with value: 0.6413839177059132 and parameters: {'n_hidden': 2048, 'mixture_components': 9, 'use_sparse_layer': False, 'use_batchnorm': False, 'use_dropout': True, 'dropout': 0.08101741632079004, 'mlp_size_1': 4, 'mlp_size_2': 3, 'mlp_size_3': 1, 'kernel': 'Normal', 'loss_name': 'CensoredNLLLoss'}. Best is trial 123 with value: 0.6857038111174789.[0m
[32m[I 2022-04-23 14:53:05,480][0m Trial 424 finished with value: 0.6624667687892332 and parameters: {'n_hidden': 2048, 'mixture_components': 9, 'use_sparse_layer': False, 'use_batchnorm': False, 'use_dropout': True, 'dropout': 0.0468108727409916, 'mlp_size_1': 4, 'mlp_size_2': 3, 'mlp_size_3': 1, 'kernel': 'Normal', 'loss_name': 'CensoredNLLLoss'}. Best is trial 123 with value: 0.6857038111174789.[0m
[32m[I 2022-04-23 14:56:22,899][0m Trial 425 finished with value: 0.6325272186301686 and parameters: {'n_hidden': 2048, 'mixture_components': 9, 'use_sparse_layer': False, 'use_batchnorm': True, 'use_dropout': True, 'dropout': 0.0027057623532567437, 'mlp_size_1': 4, 'mlp_size_2': 3, 'mlp_size_3': 1, 'kernel': 'LogLogistic', 'loss_name': 'CensoredNLLLoss'}. Best is trial 123 with value: 0.6857038111174789.[0m
[32m[I 2022-04-23 14:57:47,793][0m Trial 426 finished with value: 0.683321024075141 and parameters: {'n_hidden': 2048, 'mixture_components': 9, 'use_sparse_layer': False, 'use_batchnorm': False, 'use_dropout': True, 'dropout': 0.06598289287349732, 'mlp_size_1': 4, 'mlp_size_2': 3, 'mlp_size_3': 1, 'kernel': 'Normal', 'loss_name': 'CensoredNLLLoss'}. Best is trial 123 with value: 0.6857038111174789.[0m
[32m[I 2022-04-23 14:59:51,341][0m Trial 427 finished with value: 0.6692827736337664 and parameters: {'n_hidden': 2048, 'mixture_components': 9, 'use_sparse_layer': False, 'use_batchnorm': False, 'use_dropout': True, 'dropout': 0.0863164374862859, 'mlp_size_1': 4, 'mlp_size_2': 3, 'mlp_size_3': 1, 'kernel': 'Normal', 'loss_name': 'CensoredNLLLoss'}. Best is trial 123 with value: 0.6857038111174789.[0m
[32m[I 2022-04-23 15:00:51,347][0m Trial 428 finished with value: 0.5405751330980227 and parameters: {'n_hidden': 2048, 'mixture_components': 10, 'use_sparse_layer': False, 'use_batchnorm': False, 'use_dropout': True, 'dropout': 0.7421715756476344, 'mlp_size_1': 4, 'mlp_size_2': 3, 'mlp_size_3': 1, 'kernel': 'Gumbel', 'loss_name': 'CensoredNLLLoss'}. Best is trial 123 with value: 0.6857038111174789.[0m
[32m[I 2022-04-23 15:02:21,582][0m Trial 429 finished with value: 0.670970451420629 and parameters: {'n_hidden': 2048, 'mixture_components': 9, 'use_sparse_layer': False, 'use_batchnorm': False, 'use_dropout': True, 'dropout': 0.07589681568105755, 'mlp_size_1': 4, 'mlp_size_2': 3, 'mlp_size_3': 1, 'kernel': 'Normal', 'loss_name': 'CensoredNLLLoss'}. Best is trial 123 with value: 0.6857038111174789.[0m
[32m[I 2022-04-23 15:04:19,810][0m Trial 430 finished with value: 0.6796232268586444 and parameters: {'n_hidden': 2048, 'mixture_components': 9, 'use_sparse_layer': False, 'use_batchnorm': False, 'use_dropout': True, 'dropout': 0.107935716198429, 'mlp_size_1': 4, 'mlp_size_2': 3, 'mlp_size_3': 1, 'kernel': 'Normal', 'loss_name': 'CensoredNLLLoss'}. Best is trial 123 with value: 0.6857038111174789.[0m
[32m[I 2022-04-23 15:06:00,315][0m Trial 431 finished with value: 0.6734876487466316 and parameters: {'n_hidden': 2048, 'mixture_components': 9, 'use_sparse_layer': False, 'use_batchnorm': False, 'use_dropout': True, 'dropout': 0.09714131311640425, 'mlp_size_1': 4, 'mlp_size_2': 3, 'mlp_size_3': 1, 'kernel': 'Normal', 'loss_name': 'CensoredNLLLoss'}. Best is trial 123 with value: 0.6857038111174789.[0m
[32m[I 2022-04-23 15:07:21,547][0m Trial 432 finished with value: 0.6627343977122713 and parameters: {'n_hidden': 2048, 'mixture_components': 9, 'use_sparse_layer': False, 'use_batchnorm': False, 'use_dropout': True, 'dropout': 0.085671723971077, 'mlp_size_1': 4, 'mlp_size_2': 3, 'mlp_size_3': 1, 'kernel': 'Normal', 'loss_name': 'CensoredNLLLoss'}. Best is trial 123 with value: 0.6857038111174789.[0m
[32m[I 2022-04-23 15:08:41,830][0m Trial 433 finished with value: 0.6677424245740007 and parameters: {'n_hidden': 2048, 'mixture_components': 9, 'use_sparse_layer': False, 'use_batchnorm': False, 'use_dropout': True, 'dropout': 0.10828115852757542, 'mlp_size_1': 4, 'mlp_size_2': 3, 'mlp_size_3': 1, 'kernel': 'Normal', 'loss_name': 'CensoredNLLLoss'}. Best is trial 123 with value: 0.6857038111174789.[0m
[32m[I 2022-04-23 15:10:07,468][0m Trial 434 finished with value: 0.6716746439074772 and parameters: {'n_hidden': 2048, 'mixture_components': 10, 'use_sparse_layer': False, 'use_batchnorm': False, 'use_dropout': True, 'dropout': 0.06734171305262765, 'mlp_size_1': 4, 'mlp_size_2': 3, 'mlp_size_3': 1, 'kernel': 'Normal', 'loss_name': 'CensoredNLLLoss'}. Best is trial 123 with value: 0.6857038111174789.[0m
[32m[I 2022-04-23 15:11:19,960][0m Trial 435 finished with value: 0.6743859482064596 and parameters: {'n_hidden': 2048, 'mixture_components': 9, 'use_sparse_layer': False, 'use_batchnorm': False, 'use_dropout': True, 'dropout': 0.037087217636319364, 'mlp_size_1': 4, 'mlp_size_2': 3, 'mlp_size_3': 1, 'kernel': 'Logistic', 'loss_name': 'CensoredNLLLoss'}. Best is trial 123 with value: 0.6857038111174789.[0m
[32m[I 2022-04-23 15:12:44,350][0m Trial 436 finished with value: 0.6191605194338046 and parameters: {'n_hidden': 2048, 'mixture_components': 9, 'use_sparse_layer': False, 'use_batchnorm': False, 'use_dropout': True, 'dropout': 0.11204761717823972, 'mlp_size_1': 4, 'mlp_size_2': 3, 'mlp_size_3': 1, 'kernel': 'Normal', 'loss_name': 'CensoredNLLLoss'}. Best is trial 123 with value: 0.6857038111174789.[0m
[32m[I 2022-04-23 15:14:06,661][0m Trial 437 finished with value: 0.6698201940108062 and parameters: {'n_hidden': 2048, 'mixture_components': 9, 'use_sparse_layer': False, 'use_batchnorm': False, 'use_dropout': True, 'dropout': 0.08497148748876138, 'mlp_size_1': 4, 'mlp_size_2': 3, 'mlp_size_3': 1, 'kernel': 'Normal', 'loss_name': 'CensoredNLLLoss'}. Best is trial 123 with value: 0.6857038111174789.[0m
[32m[I 2022-04-23 15:15:38,930][0m Trial 438 finished with value: 0.6648629806767044 and parameters: {'n_hidden': 2048, 'mixture_components': 9, 'use_sparse_layer': False, 'use_batchnorm': False, 'use_dropout': True, 'dropout': 0.05835909498815592, 'mlp_size_1': 7, 'mlp_size_2': 1, 'mlp_size_3': 0, 'kernel': 'Normal', 'loss_name': 'CensoredNLLLoss'}. Best is trial 123 with value: 0.6857038111174789.[0m
[32m[I 2022-04-23 15:17:08,894][0m Trial 439 finished with value: 0.6709388528352083 and parameters: {'n_hidden': 2048, 'mixture_components': 9, 'use_sparse_layer': False, 'use_batchnorm': False, 'use_dropout': True, 'dropout': 0.09717925621257514, 'mlp_size_1': 4, 'mlp_size_2': 3, 'mlp_size_3': 1, 'kernel': 'Normal', 'loss_name': 'CensoredNLLLoss'}. Best is trial 123 with value: 0.6857038111174789.[0m
[32m[I 2022-04-23 15:18:48,593][0m Trial 440 finished with value: 0.6742581209810297 and parameters: {'n_hidden': 2048, 'mixture_components': 10, 'use_sparse_layer': False, 'use_batchnorm': False, 'use_dropout': True, 'dropout': 0.12546173646233716, 'mlp_size_1': 4, 'mlp_size_2': 3, 'mlp_size_3': 1, 'kernel': 'Normal', 'loss_name': 'AlternativeNLLLoss'}. Best is trial 123 with value: 0.6857038111174789.[0m
[32m[I 2022-04-23 15:20:27,087][0m Trial 441 finished with value: 0.6505597780925797 and parameters: {'n_hidden': 2048, 'mixture_components': 9, 'use_sparse_layer': False, 'use_batchnorm': False, 'use_dropout': True, 'dropout': 0.07726029122587327, 'mlp_size_1': 7, 'mlp_size_2': 1, 'mlp_size_3': 0, 'kernel': 'Normal', 'loss_name': 'CensoredNLLLoss'}. Best is trial 123 with value: 0.6857038111174789.[0m
[32m[I 2022-04-23 15:21:15,133][0m Trial 442 finished with value: 0.5269331730900555 and parameters: {'n_hidden': 256, 'mixture_components': 9, 'use_sparse_layer': False, 'use_batchnorm': False, 'use_dropout': True, 'dropout': 0.04595521242032207, 'mlp_size_1': 5, 'mlp_size_2': 0, 'mlp_size_3': 0, 'kernel': 'Gumbel', 'loss_name': 'CensoredNLLLoss'}. Best is trial 123 with value: 0.6857038111174789.[0m
[32m[I 2022-04-23 15:22:39,293][0m Trial 443 finished with value: 0.6700570750387416 and parameters: {'n_hidden': 2048, 'mixture_components': 9, 'use_sparse_layer': False, 'use_batchnorm': False, 'use_dropout': True, 'dropout': 0.11453547669675207, 'mlp_size_1': 4, 'mlp_size_2': 3, 'mlp_size_3': 1, 'kernel': 'Normal', 'loss_name': 'CensoredNLLLoss'}. Best is trial 123 with value: 0.6857038111174789.[0m
[32m[I 2022-04-23 15:24:09,545][0m Trial 444 finished with value: 0.6709414726237828 and parameters: {'n_hidden': 2048, 'mixture_components': 1, 'use_sparse_layer': False, 'use_batchnorm': False, 'use_dropout': True, 'dropout': 0.10486383124082353, 'mlp_size_1': 4, 'mlp_size_2': 3, 'mlp_size_3': 1, 'kernel': 'Normal', 'loss_name': 'CensoredNLLLoss'}. Best is trial 123 with value: 0.6857038111174789.[0m
[32m[I 2022-04-23 15:27:36,338][0m Trial 445 finished with value: 0.6385446779575042 and parameters: {'n_hidden': 2048, 'mixture_components': 9, 'use_sparse_layer': False, 'use_batchnorm': True, 'use_dropout': True, 'dropout': 0.07680412258897101, 'mlp_size_1': 4, 'mlp_size_2': 3, 'mlp_size_3': 1, 'kernel': 'Normal', 'loss_name': 'CensoredNLLLoss'}. Best is trial 123 with value: 0.6857038111174789.[0m
[32m[I 2022-04-23 15:28:57,808][0m Trial 446 finished with value: 0.6709360934437585 and parameters: {'n_hidden': 2048, 'mixture_components': 9, 'use_sparse_layer': False, 'use_batchnorm': False, 'use_dropout': True, 'dropout': 0.056989959111281074, 'mlp_size_1': 4, 'mlp_size_2': 3, 'mlp_size_3': 1, 'kernel': 'Normal', 'loss_name': 'CensoredNLLLoss'}. Best is trial 123 with value: 0.6857038111174789.[0m
[32m[I 2022-04-23 15:30:23,951][0m Trial 447 finished with value: 0.6606194134772535 and parameters: {'n_hidden': 2048, 'mixture_components': 2, 'use_sparse_layer': False, 'use_batchnorm': False, 'use_dropout': True, 'dropout': 0.11981974354588643, 'mlp_size_1': 7, 'mlp_size_2': 1, 'mlp_size_3': 0, 'kernel': 'Normal', 'loss_name': 'CensoredNLLLoss'}. Best is trial 123 with value: 0.6857038111174789.[0m
[32m[I 2022-04-23 15:30:57,901][0m Trial 448 finished with value: -0.6679881581935609 and parameters: {'n_hidden': 128, 'mixture_components': 8, 'use_sparse_layer': False, 'use_batchnorm': False, 'use_dropout': True, 'dropout': 0.10305176509954679, 'mlp_size_1': 4, 'mlp_size_2': 0, 'mlp_size_3': 0, 'kernel': 'Exponential', 'loss_name': 'CensoredNLLLoss'}. Best is trial 123 with value: 0.6857038111174789.[0m
[32m[I 2022-04-23 15:32:22,129][0m Trial 449 finished with value: 0.6491735471160209 and parameters: {'n_hidden': 64, 'mixture_components': 9, 'use_sparse_layer': False, 'use_batchnorm': False, 'use_dropout': True, 'dropout': 0.13428759531001996, 'mlp_size_1': 3, 'mlp_size_2': 0, 'mlp_size_3': 0, 'kernel': 'Normal', 'loss_name': 'CensoredNLLLoss'}. Best is trial 123 with value: 0.6857038111174789.[0m
[32m[I 2022-04-23 15:33:34,330][0m Trial 450 finished with value: 0.6291193505725736 and parameters: {'n_hidden': 32, 'mixture_components': 9, 'use_sparse_layer': False, 'use_batchnorm': False, 'use_dropout': True, 'dropout': 0.024938547154936742, 'mlp_size_1': 2, 'mlp_size_2': 0, 'mlp_size_3': 0, 'kernel': 'Normal', 'loss_name': 'CensoredNLLLoss'}. Best is trial 123 with value: 0.6857038111174789.[0m
[32m[I 2022-04-23 15:35:05,027][0m Trial 451 finished with value: 0.6647121070668368 and parameters: {'n_hidden': 2048, 'mixture_components': 10, 'use_sparse_layer': False, 'use_batchnorm': False, 'use_dropout': True, 'dropout': 0.09143231671740362, 'mlp_size_1': 4, 'mlp_size_2': 3, 'mlp_size_3': 1, 'kernel': 'Normal', 'loss_name': 'CensoredNLLLoss'}. Best is trial 123 with value: 0.6857038111174789.[0m
[32m[I 2022-04-23 15:36:21,338][0m Trial 452 finished with value: 0.6826769027277593 and parameters: {'n_hidden': 2048, 'mixture_components': 2, 'use_sparse_layer': False, 'use_batchnorm': False, 'use_dropout': True, 'dropout': 0.07467014933221937, 'mlp_size_1': 4, 'mlp_size_2': 3, 'mlp_size_3': 1, 'kernel': 'LogLogistic', 'loss_name': 'AlternativeNLLLoss'}. Best is trial 123 with value: 0.6857038111174789.[0m
[32m[I 2022-04-23 15:37:26,923][0m Trial 453 finished with value: 0.6671953354143376 and parameters: {'n_hidden': 2048, 'mixture_components': 2, 'use_sparse_layer': False, 'use_batchnorm': False, 'use_dropout': True, 'dropout': 0.06131727429868912, 'mlp_size_1': 7, 'mlp_size_2': 1, 'mlp_size_3': 0, 'kernel': 'LogLogistic', 'loss_name': 'NLLLoss'}. Best is trial 123 with value: 0.6857038111174789.[0m
[32m[I 2022-04-23 15:38:50,400][0m Trial 454 finished with value: 0.6727014086555935 and parameters: {'n_hidden': 2048, 'mixture_components': 2, 'use_sparse_layer': False, 'use_batchnorm': False, 'use_dropout': True, 'dropout': 0.12549010735207478, 'mlp_size_1': 8, 'mlp_size_2': 0, 'mlp_size_3': 0, 'kernel': 'Gumbel', 'loss_name': 'AlternativeNLLLoss'}. Best is trial 123 with value: 0.6857038111174789.[0m
[32m[I 2022-04-23 15:40:25,028][0m Trial 455 finished with value: 0.20682800784314992 and parameters: {'n_hidden': 2048, 'mixture_components': 2, 'use_sparse_layer': False, 'use_batchnorm': False, 'use_dropout': True, 'dropout': 0.9463784515875928, 'mlp_size_1': 4, 'mlp_size_2': 3, 'mlp_size_3': 1, 'kernel': 'LogLogistic', 'loss_name': 'AlternativeNLLLoss'}. Best is trial 123 with value: 0.6857038111174789.[0m
[32m[I 2022-04-23 15:41:44,041][0m Trial 456 finished with value: 0.6719659475420023 and parameters: {'n_hidden': 2048, 'mixture_components': 2, 'use_sparse_layer': False, 'use_batchnorm': False, 'use_dropout': True, 'dropout': 0.22984816954355933, 'mlp_size_1': 4, 'mlp_size_2': 3, 'mlp_size_3': 1, 'kernel': 'LogLogistic', 'loss_name': 'AlternativeNLLLoss'}. Best is trial 123 with value: 0.6857038111174789.[0m
[32m[I 2022-04-23 15:42:40,318][0m Trial 457 finished with value: 0.669361876166382 and parameters: {'n_hidden': 256, 'mixture_components': 2, 'use_sparse_layer': False, 'use_batchnorm': False, 'use_dropout': True, 'dropout': 0.14490577321860748, 'mlp_size_1': 5, 'mlp_size_2': 0, 'mlp_size_3': 0, 'kernel': 'LogLogistic', 'loss_name': 'AlternativeNLLLoss'}. Best is trial 123 with value: 0.6857038111174789.[0m
[32m[I 2022-04-23 15:43:57,807][0m Trial 458 finished with value: 0.6354934060028413 and parameters: {'n_hidden': 2048, 'mixture_components': 2, 'use_sparse_layer': False, 'use_batchnorm': False, 'use_dropout': True, 'dropout': 0.5513331392844618, 'mlp_size_1': 7, 'mlp_size_2': 1, 'mlp_size_3': 0, 'kernel': 'LogLogistic', 'loss_name': 'AlternativeNLLLoss'}. Best is trial 123 with value: 0.6857038111174789.[0m
[32m[I 2022-04-23 15:44:50,436][0m Trial 459 finished with value: 0.6584379620431784 and parameters: {'n_hidden': 1024, 'mixture_components': 1, 'use_sparse_layer': False, 'use_batchnorm': False, 'use_dropout': True, 'dropout': 0.03291134667984953, 'mlp_size_1': 4, 'mlp_size_2': 3, 'mlp_size_3': 0, 'kernel': 'LogLogistic', 'loss_name': 'AlternativeNLLLoss'}. Best is trial 123 with value: 0.6857038111174789.[0m
[32m[I 2022-04-23 15:46:02,658][0m Trial 460 finished with value: 0.6739399435933051 and parameters: {'n_hidden': 2048, 'mixture_components': 2, 'use_sparse_layer': False, 'use_batchnorm': False, 'use_dropout': True, 'dropout': 0.09557838102654076, 'mlp_size_1': 4, 'mlp_size_2': 3, 'mlp_size_3': 1, 'kernel': 'LogLogistic', 'loss_name': 'AlternativeNLLLoss'}. Best is trial 123 with value: 0.6857038111174789.[0m
[32m[I 2022-04-23 15:47:20,680][0m Trial 461 finished with value: 0.677823167382767 and parameters: {'n_hidden': 2048, 'mixture_components': 9, 'use_sparse_layer': False, 'use_batchnorm': False, 'use_dropout': True, 'dropout': 0.04857676591730619, 'mlp_size_1': 4, 'mlp_size_2': 3, 'mlp_size_3': 1, 'kernel': 'LogLogistic', 'loss_name': 'AlternativeNLLLoss'}. Best is trial 123 with value: 0.6857038111174789.[0m
[32m[I 2022-04-23 15:48:41,909][0m Trial 462 finished with value: 0.6508984975454757 and parameters: {'n_hidden': 2048, 'mixture_components': 9, 'use_sparse_layer': False, 'use_batchnorm': False, 'use_dropout': True, 'dropout': 0.0701754430310741, 'mlp_size_1': 7, 'mlp_size_2': 1, 'mlp_size_3': 0, 'kernel': 'Normal', 'loss_name': 'AlternativeNLLLoss'}. Best is trial 123 with value: 0.6857038111174789.[0m
[32m[I 2022-04-23 15:50:07,922][0m Trial 463 finished with value: 0.6727406772125673 and parameters: {'n_hidden': 2048, 'mixture_components': 9, 'use_sparse_layer': False, 'use_batchnorm': False, 'use_dropout': True, 'dropout': 0.1171750637121092, 'mlp_size_1': 4, 'mlp_size_2': 3, 'mlp_size_3': 1, 'kernel': 'Normal', 'loss_name': 'CensoredNLLLoss'}. Best is trial 123 with value: 0.6857038111174789.[0m
