[32m[I 2022-04-23 18:09:50,614][0m Trial 568 finished with value: 0.6832691062625436 and parameters: {'n_hidden': 2048, 'mixture_components': 2, 'use_sparse_layer': False, 'use_batchnorm': False, 'use_dropout': True, 'dropout': 0.2746881612284306, 'mlp_size_1': 3, 'mlp_size_2': 3, 'mlp_size_3': 2, 'kernel': 'LogLogistic', 'loss_name': 'CensoredNLLLoss'}. Best is trial 551 with value: 0.6925048594105658.[0m
[32m[I 2022-04-23 18:11:11,565][0m Trial 569 finished with value: 0.6704514514263257 and parameters: {'n_hidden': 2048, 'mixture_components': 2, 'use_sparse_layer': False, 'use_batchnorm': False, 'use_dropout': True, 'dropout': 0.276045050218531, 'mlp_size_1': 3, 'mlp_size_2': 3, 'mlp_size_3': 2, 'kernel': 'LogLogistic', 'loss_name': 'CensoredNLLLoss'}. Best is trial 551 with value: 0.6925048594105658.[0m
[32m[I 2022-04-23 18:12:35,142][0m Trial 570 finished with value: 0.6744468841595866 and parameters: {'n_hidden': 2048, 'mixture_components': 2, 'use_sparse_layer': False, 'use_batchnorm': False, 'use_dropout': True, 'dropout': 0.31382525103860986, 'mlp_size_1': 3, 'mlp_size_2': 3, 'mlp_size_3': 2, 'kernel': 'LogLogistic', 'loss_name': 'CensoredNLLLoss'}. Best is trial 551 with value: 0.6925048594105658.[0m
[32m[I 2022-04-23 18:13:58,135][0m Trial 571 finished with value: 0.6812582840042406 and parameters: {'n_hidden': 2048, 'mixture_components': 2, 'use_sparse_layer': False, 'use_batchnorm': False, 'use_dropout': True, 'dropout': 0.3461473362022481, 'mlp_size_1': 3, 'mlp_size_2': 3, 'mlp_size_3': 2, 'kernel': 'LogLogistic', 'loss_name': 'CensoredNLLLoss'}. Best is trial 551 with value: 0.6925048594105658.[0m
[32m[I 2022-04-23 18:15:05,293][0m Trial 572 finished with value: 0.6753255421832736 and parameters: {'n_hidden': 2048, 'mixture_components': 2, 'use_sparse_layer': False, 'use_batchnorm': False, 'use_dropout': True, 'dropout': 0.4176302166677869, 'mlp_size_1': 3, 'mlp_size_2': 3, 'mlp_size_3': 2, 'kernel': 'LogLogistic', 'loss_name': 'CensoredNLLLoss'}. Best is trial 551 with value: 0.6925048594105658.[0m
[32m[I 2022-04-23 18:16:49,234][0m Trial 573 finished with value: 0.677998574718633 and parameters: {'n_hidden': 2048, 'mixture_components': 2, 'use_sparse_layer': False, 'use_batchnorm': False, 'use_dropout': True, 'dropout': 0.3267810446622516, 'mlp_size_1': 3, 'mlp_size_2': 3, 'mlp_size_3': 2, 'kernel': 'LogLogistic', 'loss_name': 'CensoredNLLLoss'}. Best is trial 551 with value: 0.6925048594105658.[0m
[32m[I 2022-04-23 18:18:15,141][0m Trial 574 finished with value: 0.6719090087068507 and parameters: {'n_hidden': 2048, 'mixture_components': 2, 'use_sparse_layer': True, 'use_sparse_loss': True, 'lmbd': 0.042739884634571616, 'use_batchnorm': False, 'use_dropout': True, 'dropout': 0.35702905701948345, 'mlp_size_1': 3, 'mlp_size_2': 3, 'mlp_size_3': 2, 'kernel': 'LogLogistic', 'loss_name': 'CensoredNLLLoss'}. Best is trial 551 with value: 0.6925048594105658.[0m
[32m[I 2022-04-23 18:19:20,479][0m Trial 575 finished with value: 0.6521732891240397 and parameters: {'n_hidden': 2048, 'mixture_components': 2, 'use_sparse_layer': False, 'use_batchnorm': False, 'use_dropout': False, 'mlp_size_1': 3, 'mlp_size_2': 3, 'mlp_size_3': 2, 'kernel': 'LogLogistic', 'loss_name': 'CensoredNLLLoss'}. Best is trial 551 with value: 0.6925048594105658.[0m
[32m[I 2022-04-23 18:20:46,031][0m Trial 576 finished with value: 0.6907532969059914 and parameters: {'n_hidden': 2048, 'mixture_components': 2, 'use_sparse_layer': False, 'use_batchnorm': False, 'use_dropout': True, 'dropout': 0.3392516967351076, 'mlp_size_1': 3, 'mlp_size_2': 3, 'mlp_size_3': 2, 'kernel': 'LogLogistic', 'loss_name': 'CensoredNLLLoss'}. Best is trial 551 with value: 0.6925048594105658.[0m
[32m[I 2022-04-23 18:21:58,755][0m Trial 577 finished with value: 0.6769444521564069 and parameters: {'n_hidden': 2048, 'mixture_components': 2, 'use_sparse_layer': False, 'use_batchnorm': False, 'use_dropout': True, 'dropout': 0.3504941111951048, 'mlp_size_1': 3, 'mlp_size_2': 3, 'mlp_size_3': 2, 'kernel': 'LogLogistic', 'loss_name': 'CensoredNLLLoss'}. Best is trial 551 with value: 0.6925048594105658.[0m
[32m[I 2022-04-23 18:23:20,836][0m Trial 578 finished with value: 0.6587794136963872 and parameters: {'n_hidden': 2048, 'mixture_components': 2, 'use_sparse_layer': False, 'use_batchnorm': False, 'use_dropout': True, 'dropout': 0.3386772313603189, 'mlp_size_1': 3, 'mlp_size_2': 3, 'mlp_size_3': 2, 'kernel': 'LogLogistic', 'loss_name': 'CensoredNLLLoss'}. Best is trial 551 with value: 0.6925048594105658.[0m
[32m[I 2022-04-23 18:24:48,745][0m Trial 579 finished with value: 0.6725103338090483 and parameters: {'n_hidden': 2048, 'mixture_components': 2, 'use_sparse_layer': False, 'use_batchnorm': False, 'use_dropout': True, 'dropout': 0.30990294920264855, 'mlp_size_1': 3, 'mlp_size_2': 3, 'mlp_size_3': 2, 'kernel': 'LogLogistic', 'loss_name': 'CensoredNLLLoss'}. Best is trial 551 with value: 0.6925048594105658.[0m
[32m[I 2022-04-23 18:26:16,514][0m Trial 580 finished with value: 0.6735400981981016 and parameters: {'n_hidden': 2048, 'mixture_components': 2, 'use_sparse_layer': False, 'use_batchnorm': False, 'use_dropout': True, 'dropout': 0.3725411150406638, 'mlp_size_1': 3, 'mlp_size_2': 3, 'mlp_size_3': 2, 'kernel': 'LogLogistic', 'loss_name': 'CensoredNLLLoss'}. Best is trial 551 with value: 0.6925048594105658.[0m
[32m[I 2022-04-23 18:27:36,843][0m Trial 581 finished with value: 0.6651836852786768 and parameters: {'n_hidden': 2048, 'mixture_components': 2, 'use_sparse_layer': False, 'use_batchnorm': False, 'use_dropout': True, 'dropout': 0.3711864452087799, 'mlp_size_1': 3, 'mlp_size_2': 3, 'mlp_size_3': 2, 'kernel': 'LogLogistic', 'loss_name': 'CensoredNLLLoss'}. Best is trial 551 with value: 0.6925048594105658.[0m
[32m[I 2022-04-23 18:28:43,105][0m Trial 582 finished with value: 0.6649603235590777 and parameters: {'n_hidden': 2048, 'mixture_components': 1, 'use_sparse_layer': False, 'use_batchnorm': False, 'use_dropout': True, 'dropout': 0.299784801728347, 'mlp_size_1': 3, 'mlp_size_2': 3, 'mlp_size_3': 2, 'kernel': 'LogLogistic', 'loss_name': 'CensoredNLLLoss'}. Best is trial 551 with value: 0.6925048594105658.[0m
[32m[I 2022-04-23 18:29:55,247][0m Trial 583 finished with value: 0.6724147090252302 and parameters: {'n_hidden': 2048, 'mixture_components': 2, 'use_sparse_layer': False, 'use_batchnorm': False, 'use_dropout': True, 'dropout': 0.31940462171712164, 'mlp_size_1': 3, 'mlp_size_2': 3, 'mlp_size_3': 2, 'kernel': 'LogLogistic', 'loss_name': 'CensoredNLLLoss'}. Best is trial 551 with value: 0.6925048594105658.[0m
[32m[I 2022-04-23 18:31:19,497][0m Trial 584 finished with value: 0.6750321388544254 and parameters: {'n_hidden': 2048, 'mixture_components': 2, 'use_sparse_layer': True, 'use_sparse_loss': True, 'lmbd': 0.00020642230657767912, 'use_batchnorm': False, 'use_dropout': True, 'dropout': 0.33193821393622236, 'mlp_size_1': 3, 'mlp_size_2': 3, 'mlp_size_3': 2, 'kernel': 'LogLogistic', 'loss_name': 'CensoredNLLLoss'}. Best is trial 551 with value: 0.6925048594105658.[0m
[32m[I 2022-04-23 18:33:21,696][0m Trial 585 finished with value: 0.5986878105202005 and parameters: {'n_hidden': 2048, 'mixture_components': 2, 'use_sparse_layer': False, 'use_batchnorm': True, 'use_dropout': True, 'dropout': 0.27629057895684606, 'mlp_size_1': 3, 'mlp_size_2': 3, 'mlp_size_3': 2, 'kernel': 'LogLogistic', 'loss_name': 'CensoredNLLLoss'}. Best is trial 551 with value: 0.6925048594105658.[0m
[32m[I 2022-04-23 18:34:37,393][0m Trial 586 finished with value: 0.6650782787544662 and parameters: {'n_hidden': 2048, 'mixture_components': 1, 'use_sparse_layer': False, 'use_batchnorm': False, 'use_dropout': True, 'dropout': 0.3924213426801654, 'mlp_size_1': 3, 'mlp_size_2': 3, 'mlp_size_3': 2, 'kernel': 'LogLogistic', 'loss_name': 'CensoredNLLLoss'}. Best is trial 551 with value: 0.6925048594105658.[0m
[32m[I 2022-04-23 18:35:43,786][0m Trial 587 finished with value: 0.673999294228668 and parameters: {'n_hidden': 2048, 'mixture_components': 2, 'use_sparse_layer': False, 'use_batchnorm': False, 'use_dropout': False, 'mlp_size_1': 0, 'mlp_size_2': 2, 'mlp_size_3': 4, 'kernel': 'LogLogistic', 'loss_name': 'CensoredNLLLoss'}. Best is trial 551 with value: 0.6925048594105658.[0m
[32m[I 2022-04-23 18:37:01,455][0m Trial 588 finished with value: 0.6522975385143922 and parameters: {'n_hidden': 32, 'mixture_components': 2, 'use_sparse_layer': False, 'use_batchnorm': False, 'use_dropout': True, 'dropout': 0.2951583323134011, 'mlp_size_1': 2, 'mlp_size_2': 0, 'mlp_size_3': 0, 'kernel': 'LogLogistic', 'loss_name': 'CensoredNLLLoss'}. Best is trial 551 with value: 0.6925048594105658.[0m
[32m[I 2022-04-23 18:38:25,608][0m Trial 589 finished with value: 0.6739250386427147 and parameters: {'n_hidden': 2048, 'mixture_components': 2, 'use_sparse_layer': False, 'use_batchnorm': False, 'use_dropout': True, 'dropout': 0.3399337643495551, 'mlp_size_1': 3, 'mlp_size_2': 3, 'mlp_size_3': 2, 'kernel': 'LogLogistic', 'loss_name': 'CensoredNLLLoss'}. Best is trial 551 with value: 0.6925048594105658.[0m
[32m[I 2022-04-23 18:39:25,666][0m Trial 590 finished with value: 0.6069263761791819 and parameters: {'n_hidden': 64, 'mixture_components': 2, 'use_sparse_layer': False, 'use_batchnorm': False, 'use_dropout': True, 'dropout': 0.2801387785861429, 'mlp_size_1': 3, 'mlp_size_2': 0, 'mlp_size_3': 0, 'kernel': 'LogLogistic', 'loss_name': 'CensoredNLLLoss'}. Best is trial 551 with value: 0.6925048594105658.[0m
[32m[I 2022-04-23 18:40:51,183][0m Trial 591 finished with value: 0.675698895092793 and parameters: {'n_hidden': 2048, 'mixture_components': 2, 'use_sparse_layer': False, 'use_batchnorm': False, 'use_dropout': True, 'dropout': 0.30382602112892687, 'mlp_size_1': 3, 'mlp_size_2': 3, 'mlp_size_3': 2, 'kernel': 'LogLogistic', 'loss_name': 'CensoredNLLLoss'}. Best is trial 551 with value: 0.6925048594105658.[0m
[32m[I 2022-04-23 18:41:45,129][0m Trial 592 finished with value: 0.6207738179634251 and parameters: {'n_hidden': 128, 'mixture_components': 2, 'use_sparse_layer': False, 'use_batchnorm': False, 'use_dropout': True, 'dropout': 0.2630673154091464, 'mlp_size_1': 4, 'mlp_size_2': 0, 'mlp_size_3': 0, 'kernel': 'LogLogistic', 'loss_name': 'CensoredNLLLoss'}. Best is trial 551 with value: 0.6925048594105658.[0m
[32m[I 2022-04-23 18:42:48,049][0m Trial 593 finished with value: 0.6831808311021674 and parameters: {'n_hidden': 256, 'mixture_components': 2, 'use_sparse_layer': True, 'use_sparse_loss': True, 'lmbd': 2.780606133387218e-06, 'use_batchnorm': False, 'use_dropout': True, 'dropout': 0.2527208089358782, 'mlp_size_1': 3, 'mlp_size_2': 2, 'mlp_size_3': 0, 'kernel': 'LogLogistic', 'loss_name': 'AlternativeNLLLoss'}. Best is trial 551 with value: 0.6925048594105658.[0m
[32m[I 2022-04-23 18:43:48,653][0m Trial 594 finished with value: 0.6675951765604619 and parameters: {'n_hidden': 256, 'mixture_components': 1, 'use_sparse_layer': True, 'use_sparse_loss': True, 'lmbd': 3.6626121064251923e-06, 'use_batchnorm': False, 'use_dropout': True, 'dropout': 0.25541987240837827, 'mlp_size_1': 3, 'mlp_size_2': 2, 'mlp_size_3': 0, 'kernel': 'LogLogistic', 'loss_name': 'AlternativeNLLLoss'}. Best is trial 551 with value: 0.6925048594105658.[0m
[32m[I 2022-04-23 18:44:53,659][0m Trial 595 finished with value: 0.665516405697349 and parameters: {'n_hidden': 256, 'mixture_components': 2, 'use_sparse_layer': True, 'use_sparse_loss': True, 'lmbd': 1.7362142692036968e-06, 'use_batchnorm': False, 'use_dropout': True, 'dropout': 0.28146560415345395, 'mlp_size_1': 3, 'mlp_size_2': 2, 'mlp_size_3': 0, 'kernel': 'LogLogistic', 'loss_name': 'AlternativeNLLLoss'}. Best is trial 551 with value: 0.6925048594105658.[0m
[32m[I 2022-04-23 18:45:50,337][0m Trial 596 finished with value: 0.6753174442661469 and parameters: {'n_hidden': 256, 'mixture_components': 2, 'use_sparse_layer': True, 'use_sparse_loss': True, 'lmbd': 2.114168546493997e-05, 'use_batchnorm': False, 'use_dropout': True, 'dropout': 0.25421356452619337, 'mlp_size_1': 3, 'mlp_size_2': 2, 'mlp_size_3': 0, 'kernel': 'LogLogistic', 'loss_name': 'AlternativeNLLLoss'}. Best is trial 551 with value: 0.6925048594105658.[0m
[32m[I 2022-04-23 18:47:09,226][0m Trial 597 finished with value: 0.6588423930233155 and parameters: {'n_hidden': 256, 'mixture_components': 2, 'use_sparse_layer': True, 'use_sparse_loss': True, 'lmbd': 7.890401412422943e-06, 'use_batchnorm': False, 'use_dropout': True, 'dropout': 0.24115787724900334, 'mlp_size_1': 3, 'mlp_size_2': 2, 'mlp_size_3': 0, 'kernel': 'LogLogistic', 'loss_name': 'AlternativeNLLLoss'}. Best is trial 551 with value: 0.6925048594105658.[0m
[32m[I 2022-04-23 18:47:58,105][0m Trial 598 finished with value: 0.6616063084543268 and parameters: {'n_hidden': 256, 'mixture_components': 2, 'use_sparse_layer': True, 'use_sparse_loss': True, 'lmbd': 1.8161726755489353e-06, 'use_batchnorm': False, 'use_dropout': False, 'mlp_size_1': 3, 'mlp_size_2': 2, 'mlp_size_3': 0, 'kernel': 'LogLogistic', 'loss_name': 'AlternativeNLLLoss'}. Best is trial 551 with value: 0.6925048594105658.[0m
[32m[I 2022-04-23 18:49:01,879][0m Trial 599 finished with value: 0.6684656495099264 and parameters: {'n_hidden': 256, 'mixture_components': 2, 'use_sparse_layer': True, 'use_sparse_loss': True, 'lmbd': 1.5094450855593903e-05, 'use_batchnorm': False, 'use_dropout': True, 'dropout': 0.3080720105893595, 'mlp_size_1': 3, 'mlp_size_2': 2, 'mlp_size_3': 0, 'kernel': 'LogLogistic', 'loss_name': 'CensoredNLLLoss'}. Best is trial 551 with value: 0.6925048594105658.[0m
[32m[I 2022-04-23 18:49:54,624][0m Trial 600 finished with value: 0.6649127170723709 and parameters: {'n_hidden': 256, 'mixture_components': 1, 'use_sparse_layer': True, 'use_sparse_loss': True, 'lmbd': 0.0004679489982555385, 'use_batchnorm': False, 'use_dropout': True, 'dropout': 0.2752504682173068, 'mlp_size_1': 3, 'mlp_size_2': 2, 'mlp_size_3': 0, 'kernel': 'LogLogistic', 'loss_name': 'AlternativeNLLLoss'}. Best is trial 551 with value: 0.6925048594105658.[0m
[32m[I 2022-04-23 18:50:55,951][0m Trial 601 finished with value: 0.6774606588016348 and parameters: {'n_hidden': 256, 'mixture_components': 2, 'use_sparse_layer': True, 'use_sparse_loss': True, 'lmbd': 4.052538753884995e-06, 'use_batchnorm': False, 'use_dropout': True, 'dropout': 0.35471412499233435, 'mlp_size_1': 3, 'mlp_size_2': 2, 'mlp_size_3': 0, 'kernel': 'LogLogistic', 'loss_name': 'AlternativeNLLLoss'}. Best is trial 551 with value: 0.6925048594105658.[0m
[32m[I 2022-04-23 18:51:55,704][0m Trial 602 finished with value: 0.681057191284219 and parameters: {'n_hidden': 256, 'mixture_components': 2, 'use_sparse_layer': True, 'use_sparse_loss': True, 'lmbd': 2.532554937602623e-06, 'use_batchnorm': False, 'use_dropout': True, 'dropout': 0.25386049939683136, 'mlp_size_1': 3, 'mlp_size_2': 2, 'mlp_size_3': 0, 'kernel': 'LogLogistic', 'loss_name': 'AlternativeNLLLoss'}. Best is trial 551 with value: 0.6925048594105658.[0m
[32m[I 2022-04-23 18:53:03,001][0m Trial 603 finished with value: 0.675950437055744 and parameters: {'n_hidden': 1024, 'mixture_components': 2, 'use_sparse_layer': True, 'use_sparse_loss': True, 'lmbd': 1.1392588357245275e-05, 'use_batchnorm': False, 'use_dropout': True, 'dropout': 0.31645489344836014, 'mlp_size_1': 3, 'mlp_size_2': 3, 'mlp_size_3': 1, 'kernel': 'LogLogistic', 'loss_name': 'AlternativeNLLLoss'}. Best is trial 551 with value: 0.6925048594105658.[0m
[32m[I 2022-04-23 18:54:02,891][0m Trial 604 finished with value: 0.6746068158894576 and parameters: {'n_hidden': 256, 'mixture_components': 2, 'use_sparse_layer': True, 'use_sparse_loss': True, 'lmbd': 2.364658508747815e-05, 'use_batchnorm': False, 'use_dropout': True, 'dropout': 0.28678797009269497, 'mlp_size_1': 3, 'mlp_size_2': 2, 'mlp_size_3': 0, 'kernel': 'LogLogistic', 'loss_name': 'AlternativeNLLLoss'}. Best is trial 551 with value: 0.6925048594105658.[0m
[32m[I 2022-04-23 18:56:46,937][0m Trial 605 finished with value: 0.6617909179442967 and parameters: {'n_hidden': 2048, 'mixture_components': 1, 'use_sparse_layer': True, 'use_sparse_loss': False, 'use_batchnorm': True, 'use_dropout': True, 'dropout': 0.23485649608598572, 'mlp_size_1': 3, 'mlp_size_2': 3, 'mlp_size_3': 1, 'kernel': 'LogLogistic', 'loss_name': 'AlternativeNLLLoss'}. Best is trial 551 with value: 0.6925048594105658.[0m
[32m[I 2022-04-23 18:58:04,670][0m Trial 606 finished with value: 0.6722634239551868 and parameters: {'n_hidden': 2048, 'mixture_components': 2, 'use_sparse_layer': True, 'use_sparse_loss': True, 'lmbd': 7.436502418989726e-05, 'use_batchnorm': False, 'use_dropout': True, 'dropout': 0.4613861041764441, 'mlp_size_1': 3, 'mlp_size_2': 3, 'mlp_size_3': 1, 'kernel': 'LogLogistic', 'loss_name': 'CensoredNLLLoss'}. Best is trial 551 with value: 0.6925048594105658.[0m
[32m[I 2022-04-23 18:59:37,127][0m Trial 607 finished with value: 0.6726749711816501 and parameters: {'n_hidden': 2048, 'mixture_components': 2, 'use_sparse_layer': False, 'use_batchnorm': False, 'use_dropout': True, 'dropout': 0.38429355807329707, 'mlp_size_1': 3, 'mlp_size_2': 3, 'mlp_size_3': 1, 'kernel': 'LogLogistic', 'loss_name': 'CensoredNLLLoss'}. Best is trial 551 with value: 0.6925048594105658.[0m
[32m[I 2022-04-23 19:00:37,975][0m Trial 608 finished with value: 0.6747672661916495 and parameters: {'n_hidden': 1024, 'mixture_components': 2, 'use_sparse_layer': False, 'use_batchnorm': False, 'use_dropout': True, 'dropout': 0.329210603402537, 'mlp_size_1': 3, 'mlp_size_2': 3, 'mlp_size_3': 1, 'kernel': 'LogLogistic', 'loss_name': 'CensoredNLLLoss'}. Best is trial 551 with value: 0.6925048594105658.[0m
[32m[I 2022-04-23 19:01:56,179][0m Trial 609 finished with value: 0.6784384865594053 and parameters: {'n_hidden': 2048, 'mixture_components': 2, 'use_sparse_layer': True, 'use_sparse_loss': True, 'lmbd': 1.2926549750324206e-06, 'use_batchnorm': False, 'use_dropout': True, 'dropout': 0.26716179693396946, 'mlp_size_1': 3, 'mlp_size_2': 3, 'mlp_size_3': 1, 'kernel': 'LogLogistic', 'loss_name': 'CensoredNLLLoss'}. Best is trial 551 with value: 0.6925048594105658.[0m
[32m[I 2022-04-23 19:02:39,365][0m Trial 610 finished with value: 0.6541444293220305 and parameters: {'n_hidden': 256, 'mixture_components': 1, 'use_sparse_layer': False, 'use_batchnorm': False, 'use_dropout': False, 'mlp_size_1': 3, 'mlp_size_2': 2, 'mlp_size_3': 0, 'kernel': 'LogLogistic', 'loss_name': 'CensoredNLLLoss'}. Best is trial 551 with value: 0.6925048594105658.[0m
[32m[I 2022-04-23 19:03:52,095][0m Trial 611 finished with value: 0.6774500620851364 and parameters: {'n_hidden': 2048, 'mixture_components': 2, 'use_sparse_layer': False, 'use_batchnorm': False, 'use_dropout': True, 'dropout': 0.2354387967149691, 'mlp_size_1': 3, 'mlp_size_2': 3, 'mlp_size_3': 1, 'kernel': 'LogLogistic', 'loss_name': 'CensoredNLLLoss'}. Best is trial 551 with value: 0.6925048594105658.[0m
[32m[I 2022-04-23 19:04:54,426][0m Trial 612 finished with value: 0.610019585203019 and parameters: {'n_hidden': 32, 'mixture_components': 2, 'use_sparse_layer': False, 'use_batchnorm': False, 'use_dropout': True, 'dropout': 0.2967351581329192, 'mlp_size_1': 2, 'mlp_size_2': 0, 'mlp_size_3': 0, 'kernel': 'LogLogistic', 'loss_name': 'CensoredNLLLoss'}. Best is trial 551 with value: 0.6925048594105658.[0m
[32m[I 2022-04-23 19:06:12,784][0m Trial 613 finished with value: 0.6729720571446048 and parameters: {'n_hidden': 2048, 'mixture_components': 2, 'use_sparse_layer': False, 'use_batchnorm': False, 'use_dropout': True, 'dropout': 0.2524208817484138, 'mlp_size_1': 3, 'mlp_size_2': 3, 'mlp_size_3': 1, 'kernel': 'LogLogistic', 'loss_name': 'AlternativeNLLLoss'}. Best is trial 551 with value: 0.6925048594105658.[0m
[32m[I 2022-04-23 19:07:07,421][0m Trial 614 finished with value: 0.6217223555636957 and parameters: {'n_hidden': 64, 'mixture_components': 2, 'use_sparse_layer': False, 'use_batchnorm': False, 'use_dropout': True, 'dropout': 0.2818667670266614, 'mlp_size_1': 3, 'mlp_size_2': 0, 'mlp_size_3': 0, 'kernel': 'LogLogistic', 'loss_name': 'CensoredNLLLoss'}. Best is trial 551 with value: 0.6925048594105658.[0m
[32m[I 2022-04-23 19:08:20,070][0m Trial 615 finished with value: 0.6787845438299319 and parameters: {'n_hidden': 2048, 'mixture_components': 1, 'use_sparse_layer': False, 'use_batchnorm': False, 'use_dropout': True, 'dropout': 0.3437027984206067, 'mlp_size_1': 3, 'mlp_size_2': 5, 'mlp_size_3': 0, 'kernel': 'LogLogistic', 'loss_name': 'CensoredNLLLoss'}. Best is trial 551 with value: 0.6925048594105658.[0m
[32m[I 2022-04-23 19:09:16,265][0m Trial 616 finished with value: 0.6079888994195215 and parameters: {'n_hidden': 128, 'mixture_components': 2, 'use_sparse_layer': True, 'use_sparse_loss': False, 'use_batchnorm': False, 'use_dropout': True, 'dropout': 0.3172616168747437, 'mlp_size_1': 4, 'mlp_size_2': 0, 'mlp_size_3': 0, 'kernel': 'LogLogistic', 'loss_name': 'CensoredNLLLoss'}. Best is trial 551 with value: 0.6925048594105658.[0m
[32m[I 2022-04-23 19:10:10,849][0m Trial 617 finished with value: -0.6692011943266436 and parameters: {'n_hidden': 2048, 'mixture_components': 2, 'use_sparse_layer': False, 'use_batchnorm': False, 'use_dropout': True, 'dropout': 0.228806145745528, 'mlp_size_1': 3, 'mlp_size_2': 3, 'mlp_size_3': 1, 'kernel': 'Exponential', 'loss_name': 'CensoredNLLLoss'}. Best is trial 551 with value: 0.6925048594105658.[0m
[32m[I 2022-04-23 19:11:20,779][0m Trial 618 finished with value: 0.6802845167434736 and parameters: {'n_hidden': 2048, 'mixture_components': 2, 'use_sparse_layer': False, 'use_batchnorm': False, 'use_dropout': True, 'dropout': 0.2604658388979917, 'mlp_size_1': 3, 'mlp_size_2': 3, 'mlp_size_3': 1, 'kernel': 'LogLogistic', 'loss_name': 'CensoredNLLLoss'}. Best is trial 551 with value: 0.6925048594105658.[0m
