[32m[I 2022-04-21 22:59:54,464][0m Trial 398 finished with value: 0.5 and parameters: {'loss': 'coxph', 'learning_rate': 0.00013411475427642944, 'n_estimators': 336, 'criterion': 'squared_error', 'min_samples_split': 7, 'min_samples_leaf': 9, 'min_weight_fraction_leaf': 0.18445260120825177, 'min_impurity_decrease': 0.4953407190789405, 'max_features': 0.9501078145287497, 'subsample': 0.7003099069198885, 'dropout_rate': 0.27846590259006254, 'ccp_alpha': 0.39224725101001556}. Best is trial 187 with value: 0.6933481836305168.[0m
[32m[I 2022-04-21 23:00:26,958][0m Trial 399 finished with value: 0.6127568729131793 and parameters: {'loss': 'coxph', 'learning_rate': 0.00011187222196713088, 'n_estimators': 399, 'criterion': 'absolute_error', 'min_samples_split': 8, 'min_samples_leaf': 9, 'min_weight_fraction_leaf': 0.1873504991545374, 'min_impurity_decrease': 0.11051036276649687, 'max_features': 0.9056748605896354, 'subsample': 0.8719641449332562, 'dropout_rate': 0.1237096413485915, 'ccp_alpha': 0.003123271825470361}. Best is trial 187 with value: 0.6933481836305168.[0m
[32m[I 2022-04-21 23:00:49,067][0m Trial 400 finished with value: 0.6865326237386545 and parameters: {'loss': 'coxph', 'learning_rate': 0.00018065869125549088, 'n_estimators': 364, 'criterion': 'squared_error', 'min_samples_split': 4, 'min_samples_leaf': 10, 'min_weight_fraction_leaf': 0.1722466002561632, 'min_impurity_decrease': 0.03392125124138708, 'max_features': 0.9528713968207039, 'subsample': 0.256647588063482, 'dropout_rate': 0.42544954275327906, 'ccp_alpha': 0.09407845567662079}. Best is trial 187 with value: 0.6933481836305168.[0m
[32m[I 2022-04-21 23:01:22,789][0m Trial 401 finished with value: 0.6690036480411925 and parameters: {'loss': 'coxph', 'learning_rate': 9.893820091460691e-05, 'n_estimators': 328, 'criterion': 'squared_error', 'min_samples_split': 7, 'min_samples_leaf': 10, 'min_weight_fraction_leaf': 0.15451300527552406, 'min_impurity_decrease': 0.08475476019637646, 'max_features': 0.9120655146108941, 'subsample': 0.28229895332819444, 'dropout_rate': 0.09832344016164603, 'ccp_alpha': 0.24549283094616708}. Best is trial 187 with value: 0.6933481836305168.[0m
[32m[I 2022-04-21 23:02:02,714][0m Trial 402 finished with value: 0.6856237164282594 and parameters: {'loss': 'coxph', 'learning_rate': 0.00016186387272708707, 'n_estimators': 382, 'criterion': 'friedman_mse', 'min_samples_split': 7, 'min_samples_leaf': 9, 'min_weight_fraction_leaf': 0.1831401309813848, 'min_impurity_decrease': 0.05461666613523976, 'max_features': 0.8910109684260007, 'subsample': 0.1981898264350751, 'dropout_rate': 0.03313883085079877, 'ccp_alpha': 0.15617950513598233}. Best is trial 187 with value: 0.6933481836305168.[0m
[32m[I 2022-04-21 23:02:37,762][0m Trial 403 finished with value: 0.6860606188762747 and parameters: {'loss': 'coxph', 'learning_rate': 0.000287752947845813, 'n_estimators': 335, 'criterion': 'squared_error', 'min_samples_split': 7, 'min_samples_leaf': 10, 'min_weight_fraction_leaf': 0.16483802860855631, 'min_impurity_decrease': 0.02516629589880954, 'max_features': 0.310150970653735, 'subsample': 0.24967769796991154, 'dropout_rate': 0.07219462084475983, 'ccp_alpha': 0.0910398252864623}. Best is trial 187 with value: 0.6933481836305168.[0m
[32m[I 2022-04-21 23:03:11,163][0m Trial 404 finished with value: 0.6642215625535354 and parameters: {'loss': 'coxph', 'learning_rate': 0.00022352887650517827, 'n_estimators': 352, 'criterion': 'squared_error', 'min_samples_split': 6, 'min_samples_leaf': 10, 'min_weight_fraction_leaf': 0.19163243230441707, 'min_impurity_decrease': 0.12444896008289524, 'max_features': 0.9310155345557487, 'subsample': 0.29145820283713914, 'dropout_rate': 0.014816369079235149, 'ccp_alpha': 0.3133500152803005}. Best is trial 187 with value: 0.6933481836305168.[0m
[32m[I 2022-04-21 23:03:36,577][0m Trial 405 finished with value: 0.690257806229447 and parameters: {'loss': 'coxph', 'learning_rate': 5.660342180746044e-05, 'n_estimators': 317, 'criterion': 'squared_error', 'min_samples_split': 7, 'min_samples_leaf': 9, 'min_weight_fraction_leaf': 0.1785302406142915, 'min_impurity_decrease': 0.08535536138453527, 'max_features': 0.9591877178141265, 'subsample': 0.22355123357440007, 'dropout_rate': 0.046308635829656435, 'ccp_alpha': 0.0029570197310078983}. Best is trial 187 with value: 0.6933481836305168.[0m
[32m[I 2022-04-21 23:03:56,073][0m Trial 406 finished with value: 0.6493332755992979 and parameters: {'loss': 'coxph', 'learning_rate': 5.142247025611336e-05, 'n_estimators': 317, 'criterion': 'squared_error', 'min_samples_split': 7, 'min_samples_leaf': 9, 'min_weight_fraction_leaf': 0.17452472365383523, 'min_impurity_decrease': 0.39604752510387664, 'max_features': 0.06747102240979301, 'subsample': 0.18277653952268447, 'dropout_rate': 0.137718099212844, 'ccp_alpha': 0.0013800816144595622}. Best is trial 187 with value: 0.6933481836305168.[0m
[32m[I 2022-04-21 23:04:16,783][0m Trial 407 finished with value: 0.6801379684960716 and parameters: {'loss': 'coxph', 'learning_rate': 0.0002428936785332961, 'n_estimators': 310, 'criterion': 'squared_error', 'min_samples_split': 7, 'min_samples_leaf': 9, 'min_weight_fraction_leaf': 0.18018050382024575, 'min_impurity_decrease': 0.15601110499122395, 'max_features': 0.9651758251618425, 'subsample': 0.22099732080070475, 'dropout_rate': 0.11234232085348667, 'ccp_alpha': 0.07937933649244128}. Best is trial 187 with value: 0.6933481836305168.[0m
[32m[I 2022-04-21 23:04:46,014][0m Trial 408 finished with value: 0.5 and parameters: {'loss': 'coxph', 'learning_rate': 0.0001224832342931488, 'n_estimators': 321, 'criterion': 'squared_error', 'min_samples_split': 7, 'min_samples_leaf': 9, 'min_weight_fraction_leaf': 0.1633952207142683, 'min_impurity_decrease': 0.7779399161270819, 'max_features': 0.9684277560262438, 'subsample': 0.23667926552265392, 'dropout_rate': 0.08027026729980066, 'ccp_alpha': 0.16873752328317648}. Best is trial 187 with value: 0.6933481836305168.[0m
[32m[I 2022-04-21 23:05:25,742][0m Trial 409 finished with value: 0.6882399244430267 and parameters: {'loss': 'coxph', 'learning_rate': 3.713261883661101e-05, 'n_estimators': 427, 'criterion': 'squared_error', 'min_samples_split': 8, 'min_samples_leaf': 9, 'min_weight_fraction_leaf': 0.1485314545296313, 'min_impurity_decrease': 0.09607264037019769, 'max_features': 0.9092271418948453, 'subsample': 0.2041271873051144, 'dropout_rate': 0.045329691987395566, 'ccp_alpha': 0.0013302916066272874}. Best is trial 187 with value: 0.6933481836305168.[0m
[32m[I 2022-04-21 23:05:36,694][0m Trial 410 finished with value: 0.6636900948801576 and parameters: {'loss': 'coxph', 'learning_rate': 8.295094900387296e-05, 'n_estimators': 245, 'criterion': 'squared_error', 'min_samples_split': 7, 'min_samples_leaf': 9, 'min_weight_fraction_leaf': 0.18963855329024065, 'min_impurity_decrease': 0.11017217787831403, 'max_features': 0.027523914614351625, 'subsample': 0.2295094481808625, 'dropout_rate': 0.18869706533987918, 'ccp_alpha': 0.23244474228600243}. Best is trial 187 with value: 0.6933481836305168.[0m
[32m[I 2022-04-21 23:05:51,421][0m Trial 411 finished with value: 0.6846450931159551 and parameters: {'loss': 'coxph', 'learning_rate': 0.0001651641103427427, 'n_estimators': 303, 'criterion': 'squared_error', 'min_samples_split': 7, 'min_samples_leaf': 9, 'min_weight_fraction_leaf': 0.16881687983371044, 'min_impurity_decrease': 0.07684124801633903, 'max_features': 0.8677027895227285, 'subsample': 0.1846397074239452, 'dropout_rate': 0.6334451502839298, 'ccp_alpha': 0.0910561751495675}. Best is trial 187 with value: 0.6933481836305168.[0m
[32m[I 2022-04-21 23:06:23,822][0m Trial 412 finished with value: 0.6564305241751043 and parameters: {'loss': 'coxph', 'learning_rate': 0.06481169220573081, 'n_estimators': 327, 'criterion': 'absolute_error', 'min_samples_split': 7, 'min_samples_leaf': 9, 'min_weight_fraction_leaf': 0.18133589994737478, 'min_impurity_decrease': 0.0883191868296122, 'max_features': 0.0850898006494056, 'subsample': 0.2571912192362437, 'dropout_rate': 0.02023776151371632, 'ccp_alpha': 0.17738160633313776}. Best is trial 187 with value: 0.6933481836305168.[0m
[32m[I 2022-04-21 23:06:50,133][0m Trial 413 finished with value: 0.6833480137074746 and parameters: {'loss': 'coxph', 'learning_rate': 4.346959756630683e-05, 'n_estimators': 345, 'criterion': 'squared_error', 'min_samples_split': 7, 'min_samples_leaf': 9, 'min_weight_fraction_leaf': 0.19298921069231992, 'min_impurity_decrease': 0.06732829309532423, 'max_features': 0.9387923194381353, 'subsample': 0.21247478845301385, 'dropout_rate': 0.30094748754669676, 'ccp_alpha': 0.08385720717669543}. Best is trial 187 with value: 0.6933481836305168.[0m
/media/san2_ssd/data/Workdir/survival/venv/lib/python3.8/site-packages/sksurv/ensemble/boosting.py:955: RuntimeWarning: divide by zero encountered in log
  time = numpy.log(time)
/media/san2_ssd/data/Workdir/survival/venv/lib/python3.8/site-packages/sksurv/ensemble/boosting.py:955: RuntimeWarning: divide by zero encountered in log
  time = numpy.log(time)
/media/san2_ssd/data/Workdir/survival/venv/lib/python3.8/site-packages/sksurv/ensemble/boosting.py:955: RuntimeWarning: divide by zero encountered in log
  time = numpy.log(time)
/media/san2_ssd/data/Workdir/survival/venv/lib/python3.8/site-packages/sksurv/ensemble/boosting.py:955: RuntimeWarning: divide by zero encountered in log
  time = numpy.log(time)
[32m[I 2022-04-21 23:06:54,084][0m Trial 414 finished with value: -0.7 and parameters: {'loss': 'squared', 'learning_rate': 0.000280862366481002, 'n_estimators': 313, 'criterion': 'squared_error', 'min_samples_split': 7, 'min_samples_leaf': 10, 'min_weight_fraction_leaf': 0.18148296729460872, 'min_impurity_decrease': 0.6554236452078497, 'max_features': 0.8901680031843311, 'subsample': 0.3109609260590862, 'dropout_rate': 0.06138037280298029, 'ccp_alpha': 3.2676151847851456}. Best is trial 187 with value: 0.6933481836305168.[0m
[32m[I 2022-04-21 23:07:39,435][0m Trial 415 finished with value: 0.624702324194162 and parameters: {'loss': 'coxph', 'learning_rate': 1.9766811017643465e-06, 'n_estimators': 370, 'criterion': 'friedman_mse', 'min_samples_split': 8, 'min_samples_leaf': 9, 'min_weight_fraction_leaf': 0.1577607714626207, 'min_impurity_decrease': 0.12334834202720299, 'max_features': 0.9234743526893409, 'subsample': 0.2541197884457044, 'dropout_rate': 0.09096592261328892, 'ccp_alpha': 0.3897265874211632}. Best is trial 187 with value: 0.6933481836305168.[0m
[32m[I 2022-04-21 23:08:08,942][0m Trial 416 finished with value: 0.6872915667143679 and parameters: {'loss': 'coxph', 'learning_rate': 7.217731866144228e-05, 'n_estimators': 414, 'criterion': 'squared_error', 'min_samples_split': 7, 'min_samples_leaf': 10, 'min_weight_fraction_leaf': 0.17261942456098764, 'min_impurity_decrease': 0.0971700299812164, 'max_features': 0.9712839344422974, 'subsample': 0.2811307740833754, 'dropout_rate': 0.26853555775571997, 'ccp_alpha': 0.0071923112245702026}. Best is trial 187 with value: 0.6933481836305168.[0m
[32m[I 2022-04-21 23:08:42,522][0m Trial 417 finished with value: 0.6697423696479984 and parameters: {'loss': 'coxph', 'learning_rate': 0.0001055858469752238, 'n_estimators': 389, 'criterion': 'squared_error', 'min_samples_split': 7, 'min_samples_leaf': 10, 'min_weight_fraction_leaf': 0.19812337852149414, 'min_impurity_decrease': 0.047373433096550586, 'max_features': 0.9463855122719967, 'subsample': 0.2386980688290919, 'dropout_rate': 0.03615664472266203, 'ccp_alpha': 0.25951680733409455}. Best is trial 187 with value: 0.6933481836305168.[0m
[32m[I 2022-04-21 23:09:02,308][0m Trial 418 finished with value: 0.5 and parameters: {'loss': 'coxph', 'learning_rate': 0.00021268699926927672, 'n_estimators': 339, 'criterion': 'squared_error', 'min_samples_split': 7, 'min_samples_leaf': 10, 'min_weight_fraction_leaf': 0.18911325094864379, 'min_impurity_decrease': 0.2744923035572137, 'max_features': 0.9047965763476165, 'subsample': 0.3022963901148811, 'dropout_rate': 0.46299776740170234, 'ccp_alpha': 2.6873907173626477}. Best is trial 187 with value: 0.6933481836305168.[0m
[32m[I 2022-04-21 23:09:15,476][0m Trial 419 finished with value: 0.5 and parameters: {'loss': 'coxph', 'learning_rate': 0.00013063211596343877, 'n_estimators': 233, 'criterion': 'squared_error', 'min_samples_split': 6, 'min_samples_leaf': 9, 'min_weight_fraction_leaf': 0.19936163397952214, 'min_impurity_decrease': 0.14029078493045027, 'max_features': 0.048450059263968864, 'subsample': 0.26701324198707893, 'dropout_rate': 0.06584021262592343, 'ccp_alpha': 2.237743995289172}. Best is trial 187 with value: 0.6933481836305168.[0m
[32m[I 2022-04-21 23:09:39,540][0m Trial 420 finished with value: 0.6863510582658189 and parameters: {'loss': 'coxph', 'learning_rate': 0.0003629125425563565, 'n_estimators': 308, 'criterion': 'squared_error', 'min_samples_split': 7, 'min_samples_leaf': 10, 'min_weight_fraction_leaf': 0.17717774488338198, 'min_impurity_decrease': 0.024558369986595108, 'max_features': 0.8734044201071332, 'subsample': 0.3296656664437152, 'dropout_rate': 0.1442278505149515, 'ccp_alpha': 0.0028102726628495694}. Best is trial 187 with value: 0.6933481836305168.[0m
[32m[I 2022-04-21 23:10:03,947][0m Trial 421 finished with value: 0.6825669365968116 and parameters: {'loss': 'coxph', 'learning_rate': 5.436857925909601e-05, 'n_estimators': 323, 'criterion': 'squared_error', 'min_samples_split': 7, 'min_samples_leaf': 10, 'min_weight_fraction_leaf': 0.22201792818120045, 'min_impurity_decrease': 0.06990083595998708, 'max_features': 0.9784168627515525, 'subsample': 0.3707281881699967, 'dropout_rate': 0.11714197263472187, 'ccp_alpha': 0.1548746651736872}. Best is trial 187 with value: 0.6933481836305168.[0m
[32m[I 2022-04-21 23:10:52,032][0m Trial 422 finished with value: 0.545882285039153 and parameters: {'loss': 'coxph', 'learning_rate': 9.392429186433964e-05, 'n_estimators': 367, 'criterion': 'squared_error', 'min_samples_split': 7, 'min_samples_leaf': 10, 'min_weight_fraction_leaf': 0.14277769730096154, 'min_impurity_decrease': 0.08060672971536148, 'max_features': 0.9561740758170587, 'subsample': 0.287084253738757, 'dropout_rate': 0.0013484241390871211, 'ccp_alpha': 0.5048423960681261}. Best is trial 187 with value: 0.6933481836305168.[0m
[32m[I 2022-04-21 23:11:15,848][0m Trial 423 finished with value: 0.6826187890216444 and parameters: {'loss': 'coxph', 'learning_rate': 6.662852397022341e-05, 'n_estimators': 301, 'criterion': 'squared_error', 'min_samples_split': 7, 'min_samples_leaf': 9, 'min_weight_fraction_leaf': 0.16462635444843612, 'min_impurity_decrease': 0.04382453744514231, 'max_features': 0.9327097702437185, 'subsample': 0.2042268535800949, 'dropout_rate': 0.09835150757467385, 'ccp_alpha': 0.165551054413289}. Best is trial 187 with value: 0.6933481836305168.[0m
[32m[I 2022-04-21 23:11:38,424][0m Trial 424 finished with value: 0.6679716346069482 and parameters: {'loss': 'coxph', 'learning_rate': 0.00017142683310876583, 'n_estimators': 335, 'criterion': 'squared_error', 'min_samples_split': 7, 'min_samples_leaf': 10, 'min_weight_fraction_leaf': 0.19233536865660128, 'min_impurity_decrease': 0.11466446855152271, 'max_features': 0.8829285416573773, 'subsample': 0.22452810070985313, 'dropout_rate': 0.33831072330405443, 'ccp_alpha': 0.2893400456585918}. Best is trial 187 with value: 0.6933481836305168.[0m
[32m[I 2022-04-21 23:12:08,012][0m Trial 425 finished with value: 0.6905958586786412 and parameters: {'loss': 'coxph', 'learning_rate': 3.606485033716421e-05, 'n_estimators': 355, 'criterion': 'absolute_error', 'min_samples_split': 7, 'min_samples_leaf': 10, 'min_weight_fraction_leaf': 0.2064995102292407, 'min_impurity_decrease': 0.02383382691688376, 'max_features': 0.8551811476005232, 'subsample': 0.3152611095004756, 'dropout_rate': 0.3174638866758468, 'ccp_alpha': 0.09427256763435639}. Best is trial 187 with value: 0.6933481836305168.[0m
[32m[I 2022-04-21 23:12:22,717][0m Trial 426 finished with value: 0.6190439925035849 and parameters: {'loss': 'coxph', 'learning_rate': 3.388213114485588e-05, 'n_estimators': 274, 'criterion': 'absolute_error', 'min_samples_split': 7, 'min_samples_leaf': 10, 'min_weight_fraction_leaf': 0.23314675456950573, 'min_impurity_decrease': 0.01960914689360372, 'max_features': 0.856740540063978, 'subsample': 0.35643565035028746, 'dropout_rate': 0.3147296942447596, 'ccp_alpha': 0.21747674230897068}. Best is trial 187 with value: 0.6933481836305168.[0m
[32m[I 2022-04-21 23:12:35,957][0m Trial 427 finished with value: 0.6846843640678062 and parameters: {'loss': 'coxph', 'learning_rate': 3.163655417201259e-05, 'n_estimators': 252, 'criterion': 'friedman_mse', 'min_samples_split': 7, 'min_samples_leaf': 9, 'min_weight_fraction_leaf': 0.21522605154396293, 'min_impurity_decrease': 0.022664943310019267, 'max_features': 0.8471119665021632, 'subsample': 0.32099379252701477, 'dropout_rate': 0.34159297875565087, 'ccp_alpha': 0.002499467938913749}. Best is trial 187 with value: 0.6933481836305168.[0m
[32m[I 2022-04-21 23:13:02,383][0m Trial 428 finished with value: 0.6865132268532863 and parameters: {'loss': 'coxph', 'learning_rate': 2.3479264853079735e-05, 'n_estimators': 400, 'criterion': 'absolute_error', 'min_samples_split': 6, 'min_samples_leaf': 9, 'min_weight_fraction_leaf': 0.22221721426397034, 'min_impurity_decrease': 0.0011827146821789397, 'max_features': 0.8407943462558422, 'subsample': 0.34471441715132795, 'dropout_rate': 0.3630398105596392, 'ccp_alpha': 0.10499174519240177}. Best is trial 187 with value: 0.6933481836305168.[0m
[32m[I 2022-04-21 23:13:31,394][0m Trial 429 finished with value: 0.5 and parameters: {'loss': 'coxph', 'learning_rate': 4.10936720773669e-05, 'n_estimators': 314, 'criterion': 'absolute_error', 'min_samples_split': 3, 'min_samples_leaf': 10, 'min_weight_fraction_leaf': 0.20595944244136258, 'min_impurity_decrease': 0.03450195899803666, 'max_features': 0.8752481040226653, 'subsample': 0.30341495901466714, 'dropout_rate': 0.2996348199680151, 'ccp_alpha': 0.3628980575468037}. Best is trial 187 with value: 0.6933481836305168.[0m
[32m[I 2022-04-21 23:14:14,080][0m Trial 430 finished with value: 0.6651484139342921 and parameters: {'loss': 'coxph', 'learning_rate': 4.910410553926775e-05, 'n_estimators': 446, 'criterion': 'absolute_error', 'min_samples_split': 8, 'min_samples_leaf': 10, 'min_weight_fraction_leaf': 0.18314338006179862, 'min_impurity_decrease': 0.053040990178953355, 'max_features': 0.8984549289798985, 'subsample': 0.32057057945294404, 'dropout_rate': 0.28333396556153045, 'ccp_alpha': 0.17109304873884154}. Best is trial 187 with value: 0.6933481836305168.[0m
[32m[I 2022-04-21 23:14:44,065][0m Trial 431 finished with value: 0.5 and parameters: {'loss': 'coxph', 'learning_rate': 2.686712225716258e-05, 'n_estimators': 358, 'criterion': 'absolute_error', 'min_samples_split': 7, 'min_samples_leaf': 10, 'min_weight_fraction_leaf': 0.20962542312308624, 'min_impurity_decrease': 0.015162147637996722, 'max_features': 0.7485010265676817, 'subsample': 0.29333770894729055, 'dropout_rate': 0.3096699625169767, 'ccp_alpha': 1.1882752518180364}. Best is trial 187 with value: 0.6933481836305168.[0m
[32m[I 2022-04-21 23:15:08,925][0m Trial 432 finished with value: 0.6845114210245218 and parameters: {'loss': 'coxph', 'learning_rate': 3.886317395659029e-05, 'n_estimators': 377, 'criterion': 'absolute_error', 'min_samples_split': 7, 'min_samples_leaf': 10, 'min_weight_fraction_leaf': 0.24311056838035677, 'min_impurity_decrease': 0.04378457320824752, 'max_features': 0.8200374449994259, 'subsample': 0.3839946310181312, 'dropout_rate': 0.327794941902461, 'ccp_alpha': 0.08701635764868185}. Best is trial 187 with value: 0.6933481836305168.[0m
/media/san2_ssd/data/Workdir/survival/venv/lib/python3.8/site-packages/sksurv/ensemble/boosting.py:955: RuntimeWarning: divide by zero encountered in log
  time = numpy.log(time)
/media/san2_ssd/data/Workdir/survival/venv/lib/python3.8/site-packages/sksurv/ensemble/boosting.py:955: RuntimeWarning: divide by zero encountered in log
  time = numpy.log(time)
/media/san2_ssd/data/Workdir/survival/venv/lib/python3.8/site-packages/sksurv/ensemble/boosting.py:955: RuntimeWarning: divide by zero encountered in log
  time = numpy.log(time)
/media/san2_ssd/data/Workdir/survival/venv/lib/python3.8/site-packages/sksurv/ensemble/boosting.py:955: RuntimeWarning: divide by zero encountered in log
  time = numpy.log(time)
[32m[I 2022-04-21 23:15:11,684][0m Trial 433 finished with value: -0.7 and parameters: {'loss': 'squared', 'learning_rate': 0.000288365291892134, 'n_estimators': 299, 'criterion': 'absolute_error', 'min_samples_split': 7, 'min_samples_leaf': 10, 'min_weight_fraction_leaf': 0.1755084961037496, 'min_impurity_decrease': 0.05597014837279381, 'max_features': 0.8568999290382147, 'subsample': 0.08883051219426524, 'dropout_rate': 0.2837009464963366, 'ccp_alpha': 0.2598192584635831}. Best is trial 187 with value: 0.6933481836305168.[0m
[32m[I 2022-04-21 23:15:39,836][0m Trial 434 finished with value: 0.6819509348269711 and parameters: {'loss': 'coxph', 'learning_rate': 5.2925672380950795e-05, 'n_estimators': 327, 'criterion': 'absolute_error', 'min_samples_split': 7, 'min_samples_leaf': 10, 'min_weight_fraction_leaf': 0.20204172674971008, 'min_impurity_decrease': 0.03320986138795886, 'max_features': 0.9127906767116435, 'subsample': 0.2702100049379811, 'dropout_rate': 0.029498926418164546, 'ccp_alpha': 0.08521066691338629}. Best is trial 187 with value: 0.6933481836305168.[0m
