[32m[I 2022-04-21 14:36:24,068][0m Trial 220 finished with value: 0.8128601803719399 and parameters: {'loss': 'coxph', 'learning_rate': 0.0004426009241857461, 'n_estimators': 108, 'criterion': 'friedman_mse', 'min_samples_split': 4, 'min_samples_leaf': 1, 'min_weight_fraction_leaf': 0.09959164373252828, 'min_impurity_decrease': 0.609765425065158, 'max_features': 0.8089869288052078, 'subsample': 0.08359512856967694, 'dropout_rate': 0.8289103464929801, 'ccp_alpha': 0.09877142544037834}. Best is trial 202 with value: 0.8278350672519472.[0m
[32m[I 2022-04-21 14:36:29,984][0m Trial 221 finished with value: 0.8195417315127502 and parameters: {'loss': 'coxph', 'learning_rate': 0.0007425524539037521, 'n_estimators': 111, 'criterion': 'friedman_mse', 'min_samples_split': 4, 'min_samples_leaf': 1, 'min_weight_fraction_leaf': 0.12930396371468805, 'min_impurity_decrease': 0.4881458923245027, 'max_features': 0.9189964230239326, 'subsample': 0.14013157992966496, 'dropout_rate': 0.6646874482282813, 'ccp_alpha': 0.08913536648622288}. Best is trial 202 with value: 0.8278350672519472.[0m
[32m[I 2022-04-21 14:36:35,434][0m Trial 222 finished with value: 0.8216537111588998 and parameters: {'loss': 'coxph', 'learning_rate': 0.0007025640930307547, 'n_estimators': 101, 'criterion': 'friedman_mse', 'min_samples_split': 4, 'min_samples_leaf': 1, 'min_weight_fraction_leaf': 0.12500580685876925, 'min_impurity_decrease': 0.4799296706467204, 'max_features': 0.908262483376634, 'subsample': 0.16669873559687612, 'dropout_rate': 0.6741318259006155, 'ccp_alpha': 0.09939174173051135}. Best is trial 202 with value: 0.8278350672519472.[0m
[32m[I 2022-04-21 14:36:39,547][0m Trial 223 finished with value: 0.8206745097808092 and parameters: {'loss': 'coxph', 'learning_rate': 0.0007457763703407333, 'n_estimators': 102, 'criterion': 'friedman_mse', 'min_samples_split': 4, 'min_samples_leaf': 1, 'min_weight_fraction_leaf': 0.12622623679098044, 'min_impurity_decrease': 0.48915467960452513, 'max_features': 0.9046341460962478, 'subsample': 0.16667537952974698, 'dropout_rate': 0.6551291497497687, 'ccp_alpha': 0.08332371096953839}. Best is trial 202 with value: 0.8278350672519472.[0m
[32m[I 2022-04-21 14:36:42,158][0m Trial 224 finished with value: 0.7950639816929194 and parameters: {'loss': 'coxph', 'learning_rate': 0.0007605521671098441, 'n_estimators': 101, 'criterion': 'friedman_mse', 'min_samples_split': 4, 'min_samples_leaf': 1, 'min_weight_fraction_leaf': 0.12367788352503137, 'min_impurity_decrease': 0.48723770246046044, 'max_features': 0.9169372373845739, 'subsample': 0.16153268856827685, 'dropout_rate': 0.676929677442769, 'ccp_alpha': 0.22523309699410637}. Best is trial 202 with value: 0.8278350672519472.[0m
[32m[I 2022-04-21 14:36:44,905][0m Trial 225 finished with value: 0.8183534203411849 and parameters: {'loss': 'coxph', 'learning_rate': 0.0008981218833358754, 'n_estimators': 100, 'criterion': 'friedman_mse', 'min_samples_split': 4, 'min_samples_leaf': 1, 'min_weight_fraction_leaf': 0.15165805994514783, 'min_impurity_decrease': 0.4599109418578033, 'max_features': 0.8924348331771281, 'subsample': 0.16980779765383533, 'dropout_rate': 0.6434699671615299, 'ccp_alpha': 0.07857669533622795}. Best is trial 202 with value: 0.8278350672519472.[0m
[32m[I 2022-04-21 14:36:50,116][0m Trial 226 finished with value: 0.36950182922797353 and parameters: {'loss': 'coxph', 'learning_rate': 0.0010878688165313372, 'n_estimators': 105, 'criterion': 'friedman_mse', 'min_samples_split': 4, 'min_samples_leaf': 1, 'min_weight_fraction_leaf': 0.1271879075279352, 'min_impurity_decrease': 0.502636411005372, 'max_features': 0.9321931484057396, 'subsample': 0.14849883939505254, 'dropout_rate': 0.6470987859247855, 'ccp_alpha': 0.34070013394130527}. Best is trial 202 with value: 0.8278350672519472.[0m
[32m[I 2022-04-21 14:36:55,730][0m Trial 227 finished with value: 0.8129837896351748 and parameters: {'loss': 'coxph', 'learning_rate': 0.0006897379374458102, 'n_estimators': 128, 'criterion': 'friedman_mse', 'min_samples_split': 4, 'min_samples_leaf': 1, 'min_weight_fraction_leaf': 0.14527260768715589, 'min_impurity_decrease': 0.5174599374119344, 'max_features': 0.8532457183956579, 'subsample': 0.11569196995555746, 'dropout_rate': 0.6710544070231315, 'ccp_alpha': 0.223829307155391}. Best is trial 202 with value: 0.8278350672519472.[0m
[32m[I 2022-04-21 14:37:00,753][0m Trial 228 finished with value: 0.8188655317645651 and parameters: {'loss': 'coxph', 'learning_rate': 0.0004506810657675912, 'n_estimators': 118, 'criterion': 'friedman_mse', 'min_samples_split': 5, 'min_samples_leaf': 1, 'min_weight_fraction_leaf': 0.12069670059195593, 'min_impurity_decrease': 0.48268643566649966, 'max_features': 0.824930093670215, 'subsample': 0.17491456456283083, 'dropout_rate': 0.6613497581491269, 'ccp_alpha': 0.08074186963886668}. Best is trial 202 with value: 0.8278350672519472.[0m
[32m[I 2022-04-21 14:37:04,384][0m Trial 229 finished with value: 0.8175609267287232 and parameters: {'loss': 'coxph', 'learning_rate': 0.0006965989160000125, 'n_estimators': 109, 'criterion': 'friedman_mse', 'min_samples_split': 4, 'min_samples_leaf': 2, 'min_weight_fraction_leaf': 0.06913284687880808, 'min_impurity_decrease': 0.544486207933669, 'max_features': 0.8829615200568831, 'subsample': 0.20791092631497227, 'dropout_rate': 0.7022450213750506, 'ccp_alpha': 0.005399053771212234}. Best is trial 202 with value: 0.8278350672519472.[0m
[32m[I 2022-04-21 14:37:10,403][0m Trial 230 finished with value: 0.7985168261736002 and parameters: {'loss': 'coxph', 'learning_rate': 0.0009275924003663338, 'n_estimators': 104, 'criterion': 'friedman_mse', 'min_samples_split': 4, 'min_samples_leaf': 1, 'min_weight_fraction_leaf': 0.15393085681498808, 'min_impurity_decrease': 0.5801577722361082, 'max_features': 0.7886253992094405, 'subsample': 0.18356920108568764, 'dropout_rate': 0.7711241324393154, 'ccp_alpha': 0.21507461879772533}. Best is trial 202 with value: 0.8278350672519472.[0m
[32m[I 2022-04-21 14:37:13,739][0m Trial 231 finished with value: 0.8174290323376484 and parameters: {'loss': 'coxph', 'learning_rate': 0.000564237984782189, 'n_estimators': 113, 'criterion': 'friedman_mse', 'min_samples_split': 4, 'min_samples_leaf': 1, 'min_weight_fraction_leaf': 0.11248459138522326, 'min_impurity_decrease': 0.5312629486045023, 'max_features': 0.9085964141190599, 'subsample': 0.13045150597260352, 'dropout_rate': 0.7390085986074836, 'ccp_alpha': 0.09083040498713166}. Best is trial 202 with value: 0.8278350672519472.[0m
[32m[I 2022-04-21 14:37:17,855][0m Trial 232 finished with value: 0.8290981242143094 and parameters: {'loss': 'coxph', 'learning_rate': 0.0004380487293408102, 'n_estimators': 117, 'criterion': 'friedman_mse', 'min_samples_split': 4, 'min_samples_leaf': 1, 'min_weight_fraction_leaf': 0.10625680041167566, 'min_impurity_decrease': 0.5032871627150111, 'max_features': 0.86058637123056, 'subsample': 0.14450471242015328, 'dropout_rate': 0.8035711315922744, 'ccp_alpha': 0.09699567942825682}. Best is trial 232 with value: 0.8290981242143094.[0m
[32m[I 2022-04-21 14:37:22,426][0m Trial 233 finished with value: 0.8162582521068528 and parameters: {'loss': 'coxph', 'learning_rate': 0.0012277090174300687, 'n_estimators': 122, 'criterion': 'friedman_mse', 'min_samples_split': 4, 'min_samples_leaf': 1, 'min_weight_fraction_leaf': 0.10271609276808279, 'min_impurity_decrease': 0.5077254412570604, 'max_features': 0.8555572497966708, 'subsample': 0.15243547577577402, 'dropout_rate': 0.8158481292064954, 'ccp_alpha': 0.19306870102758025}. Best is trial 232 with value: 0.8290981242143094.[0m
[32m[I 2022-04-21 14:37:27,745][0m Trial 234 finished with value: 0.3744645892571819 and parameters: {'loss': 'coxph', 'learning_rate': 0.0003992313508464374, 'n_estimators': 100, 'criterion': 'friedman_mse', 'min_samples_split': 4, 'min_samples_leaf': 1, 'min_weight_fraction_leaf': 0.13097072292777806, 'min_impurity_decrease': 0.4641212004220411, 'max_features': 0.8326013669816191, 'subsample': 0.16900180572587348, 'dropout_rate': 0.7940871194112642, 'ccp_alpha': 0.3003603797342207}. Best is trial 232 with value: 0.8290981242143094.[0m
[32m[I 2022-04-21 14:37:32,315][0m Trial 235 finished with value: 0.8231478229186878 and parameters: {'loss': 'coxph', 'learning_rate': 0.0007372463565978402, 'n_estimators': 118, 'criterion': 'friedman_mse', 'min_samples_split': 3, 'min_samples_leaf': 1, 'min_weight_fraction_leaf': 0.13997469029990733, 'min_impurity_decrease': 0.4953656101276075, 'max_features': 0.8907828618723065, 'subsample': 0.14445710035410575, 'dropout_rate': 0.8289655024059777, 'ccp_alpha': 0.0024844296787554093}. Best is trial 232 with value: 0.8290981242143094.[0m
[32m[I 2022-04-21 14:37:36,498][0m Trial 236 finished with value: 0.823285646422887 and parameters: {'loss': 'coxph', 'learning_rate': 0.0004442250781925734, 'n_estimators': 131, 'criterion': 'friedman_mse', 'min_samples_split': 3, 'min_samples_leaf': 1, 'min_weight_fraction_leaf': 0.13994043917217833, 'min_impurity_decrease': 0.503843885672988, 'max_features': 0.875147042857132, 'subsample': 0.1889386848109848, 'dropout_rate': 0.812595488380822, 'ccp_alpha': 0.002442075292094989}. Best is trial 232 with value: 0.8290981242143094.[0m
[32m[I 2022-04-21 14:37:42,689][0m Trial 237 finished with value: 0.8203007517387316 and parameters: {'loss': 'coxph', 'learning_rate': 0.00026842800310793776, 'n_estimators': 134, 'criterion': 'friedman_mse', 'min_samples_split': 3, 'min_samples_leaf': 1, 'min_weight_fraction_leaf': 0.13933636021153306, 'min_impurity_decrease': 0.5189511004178385, 'max_features': 0.8778823071510766, 'subsample': 0.20025422599727963, 'dropout_rate': 0.8031286325429509, 'ccp_alpha': 0.003202695567455824}. Best is trial 232 with value: 0.8290981242143094.[0m
[32m[I 2022-04-21 14:37:48,344][0m Trial 238 finished with value: 0.8212497783029182 and parameters: {'loss': 'coxph', 'learning_rate': 0.0002613521181713629, 'n_estimators': 135, 'criterion': 'friedman_mse', 'min_samples_split': 3, 'min_samples_leaf': 1, 'min_weight_fraction_leaf': 0.14052536125124412, 'min_impurity_decrease': 0.5037073275016307, 'max_features': 0.8750773195711173, 'subsample': 0.2062608873253109, 'dropout_rate': 0.8046434692736911, 'ccp_alpha': 0.016533907866416717}. Best is trial 232 with value: 0.8290981242143094.[0m
[32m[I 2022-04-21 14:37:53,567][0m Trial 239 finished with value: 0.8200745408621216 and parameters: {'loss': 'coxph', 'learning_rate': 0.0004028297498717519, 'n_estimators': 129, 'criterion': 'friedman_mse', 'min_samples_split': 3, 'min_samples_leaf': 1, 'min_weight_fraction_leaf': 0.14819881282313763, 'min_impurity_decrease': 0.5013868525168573, 'max_features': 0.8703093739908212, 'subsample': 0.24052210030209828, 'dropout_rate': 0.7816697528249842, 'ccp_alpha': 0.012936124645738442}. Best is trial 232 with value: 0.8290981242143094.[0m
[32m[I 2022-04-21 14:37:57,049][0m Trial 240 finished with value: 0.6910722006299744 and parameters: {'loss': 'coxph', 'learning_rate': 0.00031797048269450415, 'n_estimators': 126, 'criterion': 'friedman_mse', 'min_samples_split': 3, 'min_samples_leaf': 1, 'min_weight_fraction_leaf': 0.09349164736642325, 'min_impurity_decrease': 0.5630781783430596, 'max_features': 0.8835469814979053, 'subsample': 0.21980347125204372, 'dropout_rate': 0.8350445078895798, 'ccp_alpha': 0.2069797908782935}. Best is trial 232 with value: 0.8290981242143094.[0m
[32m[I 2022-04-21 14:38:02,646][0m Trial 241 finished with value: 0.8192293166587665 and parameters: {'loss': 'coxph', 'learning_rate': 0.00044475767094111077, 'n_estimators': 134, 'criterion': 'friedman_mse', 'min_samples_split': 3, 'min_samples_leaf': 1, 'min_weight_fraction_leaf': 0.14100899410111664, 'min_impurity_decrease': 0.5142673300434576, 'max_features': 0.8878378374772568, 'subsample': 0.1959097908981298, 'dropout_rate': 0.8076854653611805, 'ccp_alpha': 0.010152355056402343}. Best is trial 232 with value: 0.8290981242143094.[0m
[32m[I 2022-04-21 14:38:10,129][0m Trial 242 finished with value: 0.8226232578076628 and parameters: {'loss': 'coxph', 'learning_rate': 0.00032090409534005297, 'n_estimators': 132, 'criterion': 'friedman_mse', 'min_samples_split': 3, 'min_samples_leaf': 1, 'min_weight_fraction_leaf': 0.1213617158018485, 'min_impurity_decrease': 0.5004251915068294, 'max_features': 0.8618992779791844, 'subsample': 0.215141891441166, 'dropout_rate': 0.8200784770680399, 'ccp_alpha': 0.0637639269187047}. Best is trial 232 with value: 0.8290981242143094.[0m
[32m[I 2022-04-21 14:38:17,231][0m Trial 243 finished with value: 0.8277125458473578 and parameters: {'loss': 'coxph', 'learning_rate': 0.0002660614987256956, 'n_estimators': 122, 'criterion': 'friedman_mse', 'min_samples_split': 3, 'min_samples_leaf': 1, 'min_weight_fraction_leaf': 0.11711292070947571, 'min_impurity_decrease': 0.4979875267785513, 'max_features': 0.8566280846889607, 'subsample': 0.21615885695755854, 'dropout_rate': 0.8221118539179972, 'ccp_alpha': 0.10146809637567226}. Best is trial 232 with value: 0.8290981242143094.[0m
[32m[I 2022-04-21 14:38:22,125][0m Trial 244 finished with value: 0.8243658022733769 and parameters: {'loss': 'coxph', 'learning_rate': 0.0002482517388726814, 'n_estimators': 124, 'criterion': 'friedman_mse', 'min_samples_split': 3, 'min_samples_leaf': 1, 'min_weight_fraction_leaf': 0.1191977846401513, 'min_impurity_decrease': 0.46042250234475274, 'max_features': 0.8510096312366363, 'subsample': 0.19123333327340364, 'dropout_rate': 0.8338787582238332, 'ccp_alpha': 0.07885605085549187}. Best is trial 232 with value: 0.8290981242143094.[0m
[32m[I 2022-04-21 14:38:29,030][0m Trial 245 finished with value: 0.821381779957771 and parameters: {'loss': 'coxph', 'learning_rate': 0.0002525640193896783, 'n_estimators': 126, 'criterion': 'friedman_mse', 'min_samples_split': 3, 'min_samples_leaf': 1, 'min_weight_fraction_leaf': 0.1166570240884628, 'min_impurity_decrease': 0.457849815211523, 'max_features': 0.9019565128119035, 'subsample': 0.18660216178678635, 'dropout_rate': 0.8255336821572666, 'ccp_alpha': 0.07479470532886795}. Best is trial 232 with value: 0.8290981242143094.[0m
[32m[I 2022-04-21 14:38:34,034][0m Trial 246 finished with value: 0.8034639014178413 and parameters: {'loss': 'coxph', 'learning_rate': 0.00024129317530657894, 'n_estimators': 130, 'criterion': 'friedman_mse', 'min_samples_split': 3, 'min_samples_leaf': 1, 'min_weight_fraction_leaf': 0.10984609559874078, 'min_impurity_decrease': 0.4547352337943205, 'max_features': 0.8462783327107575, 'subsample': 0.1872717439532569, 'dropout_rate': 0.8345983363018341, 'ccp_alpha': 0.20115978888869956}. Best is trial 232 with value: 0.8290981242143094.[0m
[32m[I 2022-04-21 14:38:38,479][0m Trial 247 finished with value: 0.8244709202675586 and parameters: {'loss': 'coxph', 'learning_rate': 0.000262186600381407, 'n_estimators': 124, 'criterion': 'friedman_mse', 'min_samples_split': 3, 'min_samples_leaf': 1, 'min_weight_fraction_leaf': 0.11673323182564586, 'min_impurity_decrease': 0.4687872671403625, 'max_features': 0.8724019816290336, 'subsample': 0.21595458536816228, 'dropout_rate': 0.8236577407151658, 'ccp_alpha': 0.06523206794959435}. Best is trial 232 with value: 0.8290981242143094.[0m
[32m[I 2022-04-21 14:38:43,266][0m Trial 248 finished with value: 0.3639039763623283 and parameters: {'loss': 'coxph', 'learning_rate': 0.0002920536279281939, 'n_estimators': 124, 'criterion': 'friedman_mse', 'min_samples_split': 3, 'min_samples_leaf': 1, 'min_weight_fraction_leaf': 0.11782956011566499, 'min_impurity_decrease': 0.46595693024543994, 'max_features': 0.8615746004456365, 'subsample': 0.25380899126748774, 'dropout_rate': 0.8301060880080634, 'ccp_alpha': 0.29645173026295796}. Best is trial 232 with value: 0.8290981242143094.[0m
[32m[I 2022-04-21 14:38:47,449][0m Trial 249 finished with value: 0.8171973805201477 and parameters: {'loss': 'coxph', 'learning_rate': 0.0003399062059298071, 'n_estimators': 126, 'criterion': 'friedman_mse', 'min_samples_split': 3, 'min_samples_leaf': 1, 'min_weight_fraction_leaf': 0.10452205079842423, 'min_impurity_decrease': 0.45057608440516395, 'max_features': 0.8923140298820712, 'subsample': 0.1160410873449338, 'dropout_rate': 0.8463341698874345, 'ccp_alpha': 0.18417437990645102}. Best is trial 232 with value: 0.8290981242143094.[0m
[32m[I 2022-04-21 14:38:52,486][0m Trial 250 finished with value: 0.8240680445748236 and parameters: {'loss': 'coxph', 'learning_rate': 0.000239695098831833, 'n_estimators': 121, 'criterion': 'friedman_mse', 'min_samples_split': 3, 'min_samples_leaf': 2, 'min_weight_fraction_leaf': 0.1181552988017239, 'min_impurity_decrease': 0.4311234524097979, 'max_features': 0.8435568403536868, 'subsample': 0.18333595481965315, 'dropout_rate': 0.8552897094403433, 'ccp_alpha': 0.08521830117295896}. Best is trial 232 with value: 0.8290981242143094.[0m
/media/san2_ssd/data/Workdir/survival/venv/lib/python3.8/site-packages/sksurv/ensemble/boosting.py:955: RuntimeWarning: divide by zero encountered in log
  time = numpy.log(time)
/media/san2_ssd/data/Workdir/survival/venv/lib/python3.8/site-packages/sksurv/ensemble/boosting.py:955: RuntimeWarning: divide by zero encountered in log
  time = numpy.log(time)
/media/san2_ssd/data/Workdir/survival/venv/lib/python3.8/site-packages/sksurv/ensemble/boosting.py:955: RuntimeWarning: divide by zero encountered in log
  time = numpy.log(time)
/media/san2_ssd/data/Workdir/survival/venv/lib/python3.8/site-packages/sksurv/ensemble/boosting.py:955: RuntimeWarning: divide by zero encountered in log
  time = numpy.log(time)
[32m[I 2022-04-21 14:38:52,930][0m Trial 251 finished with value: -0.466546061405191 and parameters: {'loss': 'squared', 'learning_rate': 0.0003747453305600424, 'n_estimators': 120, 'criterion': 'friedman_mse', 'min_samples_split': 3, 'min_samples_leaf': 2, 'min_weight_fraction_leaf': 0.11898589045179052, 'min_impurity_decrease': 0.5493334289292521, 'max_features': 0.8455584569802561, 'subsample': 0.1450242297442877, 'dropout_rate': 0.8544597192191031, 'ccp_alpha': 0.17443326875704968}. Best is trial 232 with value: 0.8290981242143094.[0m
[32m[I 2022-04-21 14:38:58,342][0m Trial 252 finished with value: 0.3811755851689217 and parameters: {'loss': 'coxph', 'learning_rate': 0.0002956267130942298, 'n_estimators': 121, 'criterion': 'friedman_mse', 'min_samples_split': 3, 'min_samples_leaf': 2, 'min_weight_fraction_leaf': 0.0852318523049731, 'min_impurity_decrease': 0.43267565646373013, 'max_features': 0.839100331060844, 'subsample': 0.21624572470056191, 'dropout_rate': 0.7573727125876668, 'ccp_alpha': 0.27753147795386585}. Best is trial 232 with value: 0.8290981242143094.[0m
[32m[I 2022-04-21 14:39:02,570][0m Trial 253 finished with value: 0.8264501659237957 and parameters: {'loss': 'coxph', 'learning_rate': 0.0018578355207872416, 'n_estimators': 116, 'criterion': 'friedman_mse', 'min_samples_split': 3, 'min_samples_leaf': 2, 'min_weight_fraction_leaf': 0.10492630278720984, 'min_impurity_decrease': 0.48028338530529374, 'max_features': 0.8197379161073319, 'subsample': 0.23460633904973477, 'dropout_rate': 0.8825858079941264, 'ccp_alpha': 0.08374155542528533}. Best is trial 232 with value: 0.8290981242143094.[0m
[32m[I 2022-04-21 14:39:05,600][0m Trial 254 finished with value: 0.8280320630942206 and parameters: {'loss': 'coxph', 'learning_rate': 0.0017012462883483751, 'n_estimators': 130, 'criterion': 'friedman_mse', 'min_samples_split': 3, 'min_samples_leaf': 2, 'min_weight_fraction_leaf': 0.10527711201276682, 'min_impurity_decrease': 0.43426600644331953, 'max_features': 0.8232496583588002, 'subsample': 0.27282691509555906, 'dropout_rate': 0.8917532383599972, 'ccp_alpha': 0.003253977063262928}. Best is trial 232 with value: 0.8290981242143094.[0m
[32m[I 2022-04-21 14:39:09,254][0m Trial 255 finished with value: 0.825303852082004 and parameters: {'loss': 'coxph', 'learning_rate': 0.002431321655408084, 'n_estimators': 117, 'criterion': 'friedman_mse', 'min_samples_split': 3, 'min_samples_leaf': 2, 'min_weight_fraction_leaf': 0.09174796871549615, 'min_impurity_decrease': 0.4236668449320795, 'max_features': 0.8196381710618367, 'subsample': 0.2741701727802498, 'dropout_rate': 0.8924665151405952, 'ccp_alpha': 0.06404138923674349}. Best is trial 232 with value: 0.8290981242143094.[0m
[32m[I 2022-04-21 14:39:13,726][0m Trial 256 finished with value: 0.8253711419916417 and parameters: {'loss': 'coxph', 'learning_rate': 0.0026376153591621595, 'n_estimators': 118, 'criterion': 'friedman_mse', 'min_samples_split': 3, 'min_samples_leaf': 2, 'min_weight_fraction_leaf': 0.07738376328533438, 'min_impurity_decrease': 0.4138925157948279, 'max_features': 0.8235942776907519, 'subsample': 0.2804286855053838, 'dropout_rate': 0.8868124611288158, 'ccp_alpha': 0.01711805848957279}. Best is trial 232 with value: 0.8290981242143094.[0m
[32m[I 2022-04-21 14:39:17,065][0m Trial 257 finished with value: 0.8276295748865012 and parameters: {'loss': 'coxph', 'learning_rate': 0.0025444379637074347, 'n_estimators': 118, 'criterion': 'friedman_mse', 'min_samples_split': 3, 'min_samples_leaf': 2, 'min_weight_fraction_leaf': 0.07306410476140446, 'min_impurity_decrease': 0.43850464203415745, 'max_features': 0.8097453745079163, 'subsample': 0.2728785195424972, 'dropout_rate': 0.881592768279508, 'ccp_alpha': 0.013621496024356333}. Best is trial 232 with value: 0.8290981242143094.[0m
