[32m[I 2022-04-21 11:39:21,274][0m Trial 198 finished with value: 0.6738476114655684 and parameters: {'splitter': 'random', 'min_samples_split': 0.2887889734395247, 'min_samples_leaf': 0.051466316155390775, 'min_weight_fraction_leaf': 0.19702824452371512, 'max_features': 0.9383378939155229}. Best is trial 11 with value: 0.6773038119717333.[0m
[32m[I 2022-04-21 11:39:21,302][0m Trial 199 finished with value: 0.6738476114655684 and parameters: {'splitter': 'random', 'min_samples_split': 0.284956346377596, 'min_samples_leaf': 0.12120304943900348, 'min_weight_fraction_leaf': 0.19170608302808778, 'max_features': 0.9041162548712166}. Best is trial 11 with value: 0.6773038119717333.[0m
[32m[I 2022-04-21 11:39:21,331][0m Trial 200 finished with value: 0.6636900948801576 and parameters: {'splitter': 'best', 'min_samples_split': 0.2706955501639305, 'min_samples_leaf': 0.12610760449668018, 'min_weight_fraction_leaf': 0.19013372474941942, 'max_features': 0.9329769424377943}. Best is trial 11 with value: 0.6773038119717333.[0m
[32m[I 2022-04-21 11:39:21,360][0m Trial 201 finished with value: 0.6586187582319654 and parameters: {'splitter': 'random', 'min_samples_split': 0.14811621077375905, 'min_samples_leaf': 0.07787133558027559, 'min_weight_fraction_leaf': 0.2047772710826051, 'max_features': 0.9759752502942135}. Best is trial 11 with value: 0.6773038119717333.[0m
[32m[I 2022-04-21 11:39:21,389][0m Trial 202 finished with value: 0.6569812493504692 and parameters: {'splitter': 'random', 'min_samples_split': 0.12137550292658333, 'min_samples_leaf': 0.06749466538320195, 'min_weight_fraction_leaf': 0.019689824957596254, 'max_features': 0.8703079456775218}. Best is trial 11 with value: 0.6773038119717333.[0m
[32m[I 2022-04-21 11:39:21,417][0m Trial 203 finished with value: 0.6738476114655684 and parameters: {'splitter': 'random', 'min_samples_split': 0.3656842563094589, 'min_samples_leaf': 0.19075012986343334, 'min_weight_fraction_leaf': 0.030799413233817623, 'max_features': 0.9978148907750581}. Best is trial 11 with value: 0.6773038119717333.[0m
[32m[I 2022-04-21 11:39:21,446][0m Trial 204 finished with value: 0.662800366349585 and parameters: {'splitter': 'random', 'min_samples_split': 0.21757907698200876, 'min_samples_leaf': 0.16389414064384766, 'min_weight_fraction_leaf': 0.1479087196002726, 'max_features': 0.8163925570252438}. Best is trial 11 with value: 0.6773038119717333.[0m
[32m[I 2022-04-21 11:39:21,475][0m Trial 205 finished with value: 0.6586187582319654 and parameters: {'splitter': 'random', 'min_samples_split': 0.20857875399023748, 'min_samples_leaf': 0.0215411249446683, 'min_weight_fraction_leaf': 0.21396145574702888, 'max_features': 0.9880856895096631}. Best is trial 11 with value: 0.6773038119717333.[0m
[32m[I 2022-04-21 11:39:21,503][0m Trial 206 finished with value: 0.6586187582319654 and parameters: {'splitter': 'random', 'min_samples_split': 0.26752826372592325, 'min_samples_leaf': 0.2110809203606464, 'min_weight_fraction_leaf': 0.00027019162424609603, 'max_features': 0.9544603464177563}. Best is trial 11 with value: 0.6773038119717333.[0m
[32m[I 2022-04-21 11:39:21,533][0m Trial 207 finished with value: 0.6738476114655684 and parameters: {'splitter': 'random', 'min_samples_split': 0.3601434530540184, 'min_samples_leaf': 0.11252654927839165, 'min_weight_fraction_leaf': 0.18011713009174438, 'max_features': 0.9143602951643219}. Best is trial 11 with value: 0.6773038119717333.[0m
[32m[I 2022-04-21 11:39:21,561][0m Trial 208 finished with value: 0.6738476114655684 and parameters: {'splitter': 'random', 'min_samples_split': 0.199985817216972, 'min_samples_leaf': 0.020611869303915238, 'min_weight_fraction_leaf': 0.1698928841575533, 'max_features': 0.8258645999416034}. Best is trial 11 with value: 0.6773038119717333.[0m
[32m[I 2022-04-21 11:39:21,590][0m Trial 209 finished with value: 0.6738476114655684 and parameters: {'splitter': 'random', 'min_samples_split': 0.22262843546013086, 'min_samples_leaf': 0.1069359417948311, 'min_weight_fraction_leaf': 0.1995856926348249, 'max_features': 0.8673166135319803}. Best is trial 11 with value: 0.6773038119717333.[0m
[32m[I 2022-04-21 11:39:21,618][0m Trial 210 finished with value: 0.6738476114655684 and parameters: {'splitter': 'random', 'min_samples_split': 0.20067636131084585, 'min_samples_leaf': 0.022813727654033195, 'min_weight_fraction_leaf': 0.16826722419807089, 'max_features': 0.8129379077684035}. Best is trial 11 with value: 0.6773038119717333.[0m
[32m[I 2022-04-21 11:39:21,647][0m Trial 211 finished with value: 0.662800366349585 and parameters: {'splitter': 'random', 'min_samples_split': 0.017601790774311635, 'min_samples_leaf': 0.008685153360633427, 'min_weight_fraction_leaf': 0.16489081386256718, 'max_features': 0.9699372757821909}. Best is trial 11 with value: 0.6773038119717333.[0m
[32m[I 2022-04-21 11:39:21,676][0m Trial 212 finished with value: 0.6738476114655684 and parameters: {'splitter': 'random', 'min_samples_split': 0.2967142444614503, 'min_samples_leaf': 0.14108259011954594, 'min_weight_fraction_leaf': 0.17651934835616714, 'max_features': 0.8476701116017624}. Best is trial 11 with value: 0.6773038119717333.[0m
[32m[I 2022-04-21 11:39:21,716][0m Trial 213 finished with value: 0.6738476114655684 and parameters: {'splitter': 'random', 'min_samples_split': 0.25558114154767997, 'min_samples_leaf': 0.1306771387799651, 'min_weight_fraction_leaf': 0.17593499028547815, 'max_features': 0.9409035260899277}. Best is trial 11 with value: 0.6773038119717333.[0m
[32m[I 2022-04-21 11:39:21,752][0m Trial 214 finished with value: 0.6738476114655684 and parameters: {'splitter': 'random', 'min_samples_split': 0.2552987975831806, 'min_samples_leaf': 0.12842813979811263, 'min_weight_fraction_leaf': 0.176891416536358, 'max_features': 0.9422911110785579}. Best is trial 11 with value: 0.6773038119717333.[0m
[32m[I 2022-04-21 11:39:21,795][0m Trial 215 finished with value: 0.6543938115635641 and parameters: {'splitter': 'random', 'min_samples_split': 0.23915906211724683, 'min_samples_leaf': 0.1536850124627971, 'min_weight_fraction_leaf': 0.13756242070198432, 'max_features': 0.961238486122469}. Best is trial 11 with value: 0.6773038119717333.[0m
[32m[I 2022-04-21 11:39:21,833][0m Trial 216 finished with value: 0.6738476114655684 and parameters: {'splitter': 'random', 'min_samples_split': 0.42203807087789097, 'min_samples_leaf': 0.17837877510116854, 'min_weight_fraction_leaf': 0.08762293411737102, 'max_features': 0.8918270217880206}. Best is trial 11 with value: 0.6773038119717333.[0m
[32m[I 2022-04-21 11:39:21,875][0m Trial 217 finished with value: 0.6738476114655684 and parameters: {'splitter': 'random', 'min_samples_split': 0.23129170465447554, 'min_samples_leaf': 0.17085314015723396, 'min_weight_fraction_leaf': 0.15230778337302425, 'max_features': 0.9151203085154714}. Best is trial 11 with value: 0.6773038119717333.[0m
[32m[I 2022-04-21 11:39:21,917][0m Trial 218 finished with value: 0.5 and parameters: {'splitter': 'random', 'min_samples_split': 0.01212112682066728, 'min_samples_leaf': 0.17050093753967285, 'min_weight_fraction_leaf': 0.16158432429008968, 'max_features': 0.5386236074792752}. Best is trial 11 with value: 0.6773038119717333.[0m
[32m[I 2022-04-21 11:39:21,962][0m Trial 219 finished with value: 0.6738476114655684 and parameters: {'splitter': 'random', 'min_samples_split': 0.3732681690207306, 'min_samples_leaf': 0.06232046277859904, 'min_weight_fraction_leaf': 0.19219919289580079, 'max_features': 0.9275956620673843}. Best is trial 11 with value: 0.6773038119717333.[0m
[32m[I 2022-04-21 11:39:21,996][0m Trial 220 finished with value: 0.6738476114655684 and parameters: {'splitter': 'random', 'min_samples_split': 0.021727386919968818, 'min_samples_leaf': 0.20042821217409076, 'min_weight_fraction_leaf': 0.1859239589847313, 'max_features': 0.9491385519696076}. Best is trial 11 with value: 0.6773038119717333.[0m
[32m[I 2022-04-21 11:39:22,025][0m Trial 221 finished with value: 0.6738476114655684 and parameters: {'splitter': 'random', 'min_samples_split': 0.033872838636275465, 'min_samples_leaf': 0.09858624193761556, 'min_weight_fraction_leaf': 0.1889817347773866, 'max_features': 0.9115059098762023}. Best is trial 11 with value: 0.6773038119717333.[0m
[32m[I 2022-04-21 11:39:22,055][0m Trial 222 finished with value: 0.6586187582319654 and parameters: {'splitter': 'random', 'min_samples_split': 0.2219449325645368, 'min_samples_leaf': 0.20453497016584332, 'min_weight_fraction_leaf': 0.04355216224525588, 'max_features': 0.9777775687086826}. Best is trial 11 with value: 0.6773038119717333.[0m
[32m[I 2022-04-21 11:39:22,127][0m Trial 223 finished with value: 0.6502080893344752 and parameters: {'splitter': 'random', 'min_samples_split': 0.16009183066318458, 'min_samples_leaf': 0.14837980595244687, 'min_weight_fraction_leaf': 0.14011022943348425, 'max_features': 0.986883037457877}. Best is trial 11 with value: 0.6773038119717333.[0m
[32m[I 2022-04-21 11:39:22,156][0m Trial 224 finished with value: 0.6360776294262513 and parameters: {'splitter': 'random', 'min_samples_split': 0.06961191639741088, 'min_samples_leaf': 0.03392935743256835, 'min_weight_fraction_leaf': 0.07457063751457071, 'max_features': 0.3915533625873928}. Best is trial 11 with value: 0.6773038119717333.[0m
[32m[I 2022-04-21 11:39:22,186][0m Trial 225 finished with value: 0.662800366349585 and parameters: {'splitter': 'random', 'min_samples_split': 0.05178377211845538, 'min_samples_leaf': 0.03369679951417853, 'min_weight_fraction_leaf': 0.16612634148525174, 'max_features': 0.9271980464505029}. Best is trial 11 with value: 0.6773038119717333.[0m
[32m[I 2022-04-21 11:39:22,215][0m Trial 226 finished with value: 0.6738476114655684 and parameters: {'splitter': 'random', 'min_samples_split': 0.3519842090601351, 'min_samples_leaf': 0.11656552275889774, 'min_weight_fraction_leaf': 0.18636708586649253, 'max_features': 0.8528017124624067}. Best is trial 11 with value: 0.6773038119717333.[0m
[32m[I 2022-04-21 11:39:22,246][0m Trial 227 finished with value: 0.6586187582319654 and parameters: {'splitter': 'random', 'min_samples_split': 0.21031633324622617, 'min_samples_leaf': 0.06796136216037546, 'min_weight_fraction_leaf': 0.201851225623483, 'max_features': 0.9748525415107013}. Best is trial 11 with value: 0.6773038119717333.[0m
[32m[I 2022-04-21 11:39:22,313][0m Trial 228 finished with value: 0.6738476114655684 and parameters: {'splitter': 'random', 'min_samples_split': 0.38795719434297843, 'min_samples_leaf': 0.05108034628027447, 'min_weight_fraction_leaf': 0.1810279236802313, 'max_features': 0.9874587436160982}. Best is trial 11 with value: 0.6773038119717333.[0m
[32m[I 2022-04-21 11:39:22,363][0m Trial 229 finished with value: 0.6586187582319654 and parameters: {'splitter': 'random', 'min_samples_split': 0.3840797160819639, 'min_samples_leaf': 0.18546656395637, 'min_weight_fraction_leaf': 0.21026744610371428, 'max_features': 0.8842028478149503}. Best is trial 11 with value: 0.6773038119717333.[0m
[32m[I 2022-04-21 11:39:22,426][0m Trial 230 finished with value: 0.6738476114655684 and parameters: {'splitter': 'random', 'min_samples_split': 0.37325619482639405, 'min_samples_leaf': 0.1947140540004557, 'min_weight_fraction_leaf': 0.15342099908636428, 'max_features': 0.8880059002538244}. Best is trial 11 with value: 0.6773038119717333.[0m
[32m[I 2022-04-21 11:39:22,476][0m Trial 231 finished with value: 0.6738476114655684 and parameters: {'splitter': 'random', 'min_samples_split': 0.19603658307510735, 'min_samples_leaf': 0.003341472172606429, 'min_weight_fraction_leaf': 0.19749581544939201, 'max_features': 0.9035368517856817}. Best is trial 11 with value: 0.6773038119717333.[0m
[32m[I 2022-04-21 11:39:22,506][0m Trial 232 finished with value: 0.6738476114655684 and parameters: {'splitter': 'random', 'min_samples_split': 0.17701259637487776, 'min_samples_leaf': 0.014233038026003566, 'min_weight_fraction_leaf': 0.17781379373099762, 'max_features': 0.9431749098639608}. Best is trial 11 with value: 0.6773038119717333.[0m
[32m[I 2022-04-21 11:39:22,551][0m Trial 233 finished with value: 0.5305100038533069 and parameters: {'splitter': 'random', 'min_samples_split': 0.41530412666128436, 'min_samples_leaf': 0.10499142106311221, 'min_weight_fraction_leaf': 0.17566846093330088, 'max_features': 0.7997088409305276}. Best is trial 11 with value: 0.6773038119717333.[0m
[32m[I 2022-04-21 11:39:22,600][0m Trial 234 finished with value: 0.6738476114655684 and parameters: {'splitter': 'random', 'min_samples_split': 0.2431372909414186, 'min_samples_leaf': 0.025115679765143773, 'min_weight_fraction_leaf': 0.18399205798660018, 'max_features': 0.9673999542645775}. Best is trial 11 with value: 0.6773038119717333.[0m
[32m[I 2022-04-21 11:39:22,646][0m Trial 235 finished with value: 0.6738476114655684 and parameters: {'splitter': 'random', 'min_samples_split': 0.18944878095908105, 'min_samples_leaf': 0.004994336993743169, 'min_weight_fraction_leaf': 0.19141946463216827, 'max_features': 0.9776751725513954}. Best is trial 11 with value: 0.6773038119717333.[0m
[32m[I 2022-04-21 11:39:22,693][0m Trial 236 finished with value: 0.6586187582319654 and parameters: {'splitter': 'random', 'min_samples_split': 0.4016939914494867, 'min_samples_leaf': 0.13036878624940482, 'min_weight_fraction_leaf': 0.2032165075893452, 'max_features': 0.9414370834888935}. Best is trial 11 with value: 0.6773038119717333.[0m
[32m[I 2022-04-21 11:39:22,812][0m Trial 237 finished with value: 0.6738476114655684 and parameters: {'splitter': 'random', 'min_samples_split': 0.44161385524102104, 'min_samples_leaf': 0.046008073251631976, 'min_weight_fraction_leaf': 0.1907787688014232, 'max_features': 0.9175855757509274}. Best is trial 11 with value: 0.6773038119717333.[0m
[32m[I 2022-04-21 11:39:22,911][0m Trial 238 finished with value: 0.6640701022932763 and parameters: {'splitter': 'random', 'min_samples_split': 0.42887428547664963, 'min_samples_leaf': 0.04153637158373065, 'min_weight_fraction_leaf': 0.09737382339210206, 'max_features': 0.9208729236544062}. Best is trial 11 with value: 0.6773038119717333.[0m
[32m[I 2022-04-21 11:39:23,009][0m Trial 239 finished with value: 0.5 and parameters: {'splitter': 'random', 'min_samples_split': 0.3550812678079511, 'min_samples_leaf': 0.18651761832686606, 'min_weight_fraction_leaf': 0.11488428532200518, 'max_features': 0.29243940154557535}. Best is trial 11 with value: 0.6773038119717333.[0m
[32m[I 2022-04-21 11:39:23,162][0m Trial 240 finished with value: 0.6598137568019723 and parameters: {'splitter': 'best', 'min_samples_split': 0.2591578129488472, 'min_samples_leaf': 0.12915549021625958, 'min_weight_fraction_leaf': 0.17481053200565325, 'max_features': 0.8349085417128158}. Best is trial 11 with value: 0.6773038119717333.[0m
[32m[I 2022-04-21 11:39:23,274][0m Trial 241 finished with value: 0.662800366349585 and parameters: {'splitter': 'random', 'min_samples_split': 0.3014912829826991, 'min_samples_leaf': 0.1616604821143569, 'min_weight_fraction_leaf': 0.017431679534059698, 'max_features': 0.9491265182919052}. Best is trial 11 with value: 0.6773038119717333.[0m
[32m[I 2022-04-21 11:39:23,366][0m Trial 242 finished with value: 0.6543938115635641 and parameters: {'splitter': 'random', 'min_samples_split': 0.29127516287955524, 'min_samples_leaf': 0.05154704622361371, 'min_weight_fraction_leaf': 0.1545149539078936, 'max_features': 0.9608471771187914}. Best is trial 11 with value: 0.6773038119717333.[0m
[32m[I 2022-04-21 11:39:23,470][0m Trial 243 finished with value: 0.662800366349585 and parameters: {'splitter': 'random', 'min_samples_split': 0.10038803537184522, 'min_samples_leaf': 0.04301622489123696, 'min_weight_fraction_leaf': 0.16355794495040374, 'max_features': 0.9237791030520336}. Best is trial 11 with value: 0.6773038119717333.[0m
[32m[I 2022-04-21 11:39:23,565][0m Trial 244 finished with value: 0.6738476114655684 and parameters: {'splitter': 'random', 'min_samples_split': 0.3664098990402966, 'min_samples_leaf': 0.181816496929168, 'min_weight_fraction_leaf': 0.18667632945321025, 'max_features': 0.9006521567903485}. Best is trial 11 with value: 0.6773038119717333.[0m
[32m[I 2022-04-21 11:39:23,699][0m Trial 245 finished with value: 0.6738476114655684 and parameters: {'splitter': 'random', 'min_samples_split': 0.03068210228145632, 'min_samples_leaf': 0.0034710586157367766, 'min_weight_fraction_leaf': 0.17023270703677648, 'max_features': 0.9523724167980052}. Best is trial 11 with value: 0.6773038119717333.[0m
[32m[I 2022-04-21 11:39:23,797][0m Trial 246 finished with value: 0.6738476114655684 and parameters: {'splitter': 'random', 'min_samples_split': 0.18140731189605674, 'min_samples_leaf': 0.0010293448824148666, 'min_weight_fraction_leaf': 0.19589715125050577, 'max_features': 0.9598310849180393}. Best is trial 11 with value: 0.6773038119717333.[0m
[32m[I 2022-04-21 11:39:23,899][0m Trial 247 finished with value: 0.6738476114655684 and parameters: {'splitter': 'random', 'min_samples_split': 0.19700228403653564, 'min_samples_leaf': 0.009048414645261786, 'min_weight_fraction_leaf': 0.1872824031434339, 'max_features': 0.9984977230063348}. Best is trial 11 with value: 0.6773038119717333.[0m
[32m[I 2022-04-21 11:39:23,985][0m Trial 248 finished with value: 0.662800366349585 and parameters: {'splitter': 'random', 'min_samples_split': 0.1910596096163853, 'min_samples_leaf': 0.1146536344110967, 'min_weight_fraction_leaf': 0.16187233296904358, 'max_features': 0.9444602139854238}. Best is trial 11 with value: 0.6773038119717333.[0m
[32m[I 2022-04-21 11:39:24,099][0m Trial 249 finished with value: 0.6640701022932763 and parameters: {'splitter': 'random', 'min_samples_split': 0.07874423202044352, 'min_samples_leaf': 0.14418932843394322, 'min_weight_fraction_leaf': 0.13773328454417075, 'max_features': 0.9667330078958054}. Best is trial 11 with value: 0.6773038119717333.[0m
[32m[I 2022-04-21 11:39:24,190][0m Trial 250 finished with value: 0.6640701022932763 and parameters: {'splitter': 'random', 'min_samples_split': 0.39140932795051825, 'min_samples_leaf': 0.14074222881213888, 'min_weight_fraction_leaf': 0.08894273322627397, 'max_features': 0.8551303439864415}. Best is trial 11 with value: 0.6773038119717333.[0m
[32m[I 2022-04-21 11:39:24,307][0m Trial 251 finished with value: 0.6738476114655684 and parameters: {'splitter': 'random', 'min_samples_split': 0.3633848357118037, 'min_samples_leaf': 0.1785291022456598, 'min_weight_fraction_leaf': 0.11146004866317916, 'max_features': 0.9963190161860066}. Best is trial 11 with value: 0.6773038119717333.[0m
[32m[I 2022-04-21 11:39:24,407][0m Trial 252 finished with value: 0.6738476114655684 and parameters: {'splitter': 'random', 'min_samples_split': 0.039332282678823716, 'min_samples_leaf': 0.173656030607168, 'min_weight_fraction_leaf': 0.15845115627108428, 'max_features': 0.9779511794173837}. Best is trial 11 with value: 0.6773038119717333.[0m
[32m[I 2022-04-21 11:39:24,516][0m Trial 253 finished with value: 0.662800366349585 and parameters: {'splitter': 'random', 'min_samples_split': 0.20206327571912036, 'min_samples_leaf': 0.1666495568794501, 'min_weight_fraction_leaf': 0.16495197013719712, 'max_features': 0.9972031088978989}. Best is trial 11 with value: 0.6773038119717333.[0m
[32m[I 2022-04-21 11:39:24,616][0m Trial 254 finished with value: 0.6738476114655684 and parameters: {'splitter': 'random', 'min_samples_split': 0.4143669172094049, 'min_samples_leaf': 0.15751342607561233, 'min_weight_fraction_leaf': 0.1717141501991856, 'max_features': 0.9271793206898793}. Best is trial 11 with value: 0.6773038119717333.[0m
[32m[I 2022-04-21 11:39:24,726][0m Trial 255 finished with value: 0.5 and parameters: {'splitter': 'random', 'min_samples_split': 0.3442236786763364, 'min_samples_leaf': 0.21764092335142818, 'min_weight_fraction_leaf': 0.17640901382015112, 'max_features': 0.6826139603766801}. Best is trial 11 with value: 0.6773038119717333.[0m
[32m[I 2022-04-21 11:39:24,819][0m Trial 256 finished with value: 0.6738476114655684 and parameters: {'splitter': 'random', 'min_samples_split': 0.3223173934512899, 'min_samples_leaf': 0.11616173929852644, 'min_weight_fraction_leaf': 0.18256660139554473, 'max_features': 0.8840141879565416}. Best is trial 11 with value: 0.6773038119717333.[0m
[32m[I 2022-04-21 11:39:24,925][0m Trial 257 finished with value: 0.6738476114655684 and parameters: {'splitter': 'random', 'min_samples_split': 0.21128781923913034, 'min_samples_leaf': 0.017213381776784633, 'min_weight_fraction_leaf': 0.17927246494012328, 'max_features': 0.8654477539067057}. Best is trial 11 with value: 0.6773038119717333.[0m
[32m[I 2022-04-21 11:39:25,037][0m Trial 258 finished with value: 0.5 and parameters: {'splitter': 'random', 'min_samples_split': 0.02561966245122045, 'min_samples_leaf': 0.015508134647572384, 'min_weight_fraction_leaf': 0.47389251320229697, 'max_features': 0.8766885060168861}. Best is trial 11 with value: 0.6773038119717333.[0m
[32m[I 2022-04-21 11:39:25,139][0m Trial 259 finished with value: 0.6640701022932763 and parameters: {'splitter': 'random', 'min_samples_split': 0.2374406435377595, 'min_samples_leaf': 0.022866140322303708, 'min_weight_fraction_leaf': 0.14535626413870806, 'max_features': 0.8946987736325254}. Best is trial 11 with value: 0.6773038119717333.[0m
[32m[I 2022-04-21 11:39:25,216][0m Trial 260 finished with value: 0.6738476114655684 and parameters: {'splitter': 'random', 'min_samples_split': 0.17104819294417603, 'min_samples_leaf': 0.011311667396948496, 'min_weight_fraction_leaf': 0.19280294445479318, 'max_features': 0.944239505699531}. Best is trial 11 with value: 0.6773038119717333.[0m
