[32m[I 2022-04-22 16:26:40,192][0m Trial 145 finished with value: 0.6166019024238286 and parameters: {'loss': 'coxph', 'learning_rate': 0.0016290314498095828, 'n_estimators': 348, 'criterion': 'friedman_mse', 'min_samples_split': 9, 'min_samples_leaf': 3, 'min_weight_fraction_leaf': 0.014301015004511796, 'min_impurity_decrease': 0.7618375871343642, 'max_features': 0.3986476376300387, 'subsample': 0.17976825496771898, 'dropout_rate': 0.035083022008294856, 'ccp_alpha': 0.20205183029424262}. Best is trial 143 with value: 0.6514796499186757.[0m
[32m[I 2022-04-22 16:27:18,218][0m Trial 146 finished with value: 0.5528743798690204 and parameters: {'loss': 'coxph', 'learning_rate': 0.003655449823108737, 'n_estimators': 374, 'criterion': 'friedman_mse', 'min_samples_split': 9, 'min_samples_leaf': 3, 'min_weight_fraction_leaf': 0.01893488963708612, 'min_impurity_decrease': 0.7913245282593802, 'max_features': 0.424103740564232, 'subsample': 0.13861820687222381, 'dropout_rate': 0.10961516960471235, 'ccp_alpha': 0.3888936717306069}. Best is trial 143 with value: 0.6514796499186757.[0m
[32m[I 2022-04-22 16:28:09,654][0m Trial 147 finished with value: 0.6413827703503177 and parameters: {'loss': 'coxph', 'learning_rate': 0.0029673947938200274, 'n_estimators': 419, 'criterion': 'friedman_mse', 'min_samples_split': 9, 'min_samples_leaf': 3, 'min_weight_fraction_leaf': 0.001966754474068893, 'min_impurity_decrease': 0.744850848459284, 'max_features': 0.4533449173954077, 'subsample': 0.20496953685349917, 'dropout_rate': 0.056407254291866556, 'ccp_alpha': 0.18306853192811778}. Best is trial 143 with value: 0.6514796499186757.[0m
[32m[I 2022-04-22 16:28:59,627][0m Trial 148 finished with value: 0.5847664570467714 and parameters: {'loss': 'coxph', 'learning_rate': 0.0017589940288339852, 'n_estimators': 412, 'criterion': 'friedman_mse', 'min_samples_split': 9, 'min_samples_leaf': 3, 'min_weight_fraction_leaf': 0.020239585845109067, 'min_impurity_decrease': 0.7849968898932684, 'max_features': 0.5123672525196483, 'subsample': 0.2141385465049852, 'dropout_rate': 0.04661676616027685, 'ccp_alpha': 0.21889198090211084}. Best is trial 143 with value: 0.6514796499186757.[0m
[32m[I 2022-04-22 16:29:31,312][0m Trial 149 finished with value: 0.6381904198916184 and parameters: {'loss': 'coxph', 'learning_rate': 0.002416284530771921, 'n_estimators': 330, 'criterion': 'friedman_mse', 'min_samples_split': 9, 'min_samples_leaf': 3, 'min_weight_fraction_leaf': 0.009445386493134325, 'min_impurity_decrease': 0.7126620209412142, 'max_features': 0.4569236282863606, 'subsample': 0.15805707188644416, 'dropout_rate': 0.15336632465051003, 'ccp_alpha': 0.19830283198712406}. Best is trial 143 with value: 0.6514796499186757.[0m
[32m[I 2022-04-22 16:30:10,092][0m Trial 150 finished with value: 0.644333331622174 and parameters: {'loss': 'coxph', 'learning_rate': 0.004512428368883124, 'n_estimators': 380, 'criterion': 'friedman_mse', 'min_samples_split': 9, 'min_samples_leaf': 2, 'min_weight_fraction_leaf': 0.02609294738381763, 'min_impurity_decrease': 0.7459142006904096, 'max_features': 0.3942389717816916, 'subsample': 0.18676923611412757, 'dropout_rate': 0.21143701410816135, 'ccp_alpha': 0.004629628735882197}. Best is trial 143 with value: 0.6514796499186757.[0m
[32m[I 2022-04-22 16:30:50,419][0m Trial 151 finished with value: 0.6510249293683064 and parameters: {'loss': 'coxph', 'learning_rate': 0.0035639628250716342, 'n_estimators': 389, 'criterion': 'friedman_mse', 'min_samples_split': 9, 'min_samples_leaf': 2, 'min_weight_fraction_leaf': 0.038926062920966946, 'min_impurity_decrease': 0.7451181079207734, 'max_features': 0.39210622934211736, 'subsample': 0.18189629271777016, 'dropout_rate': 0.20817859682208323, 'ccp_alpha': 0.009780318245855096}. Best is trial 143 with value: 0.6514796499186757.[0m
[32m[I 2022-04-22 16:31:28,311][0m Trial 152 finished with value: 0.6354605001646949 and parameters: {'loss': 'coxph', 'learning_rate': 0.004560029184271369, 'n_estimators': 387, 'criterion': 'friedman_mse', 'min_samples_split': 9, 'min_samples_leaf': 2, 'min_weight_fraction_leaf': 0.04012785071004328, 'min_impurity_decrease': 0.7423491340972965, 'max_features': 0.3960926080337577, 'subsample': 0.18312244521182838, 'dropout_rate': 0.207709254686716, 'ccp_alpha': 0.15883678177737048}. Best is trial 143 with value: 0.6514796499186757.[0m
[32m[I 2022-04-22 16:32:14,459][0m Trial 153 finished with value: 0.6325257175798865 and parameters: {'loss': 'coxph', 'learning_rate': 0.001503360231810268, 'n_estimators': 415, 'criterion': 'friedman_mse', 'min_samples_split': 9, 'min_samples_leaf': 2, 'min_weight_fraction_leaf': 0.024504587333653346, 'min_impurity_decrease': 0.747691301894997, 'max_features': 0.4467086846539826, 'subsample': 0.1924233503571846, 'dropout_rate': 0.14978740004912414, 'ccp_alpha': 0.20372217279090804}. Best is trial 143 with value: 0.6514796499186757.[0m
[32m[I 2022-04-22 16:32:46,174][0m Trial 154 finished with value: 0.5206057786669149 and parameters: {'loss': 'coxph', 'learning_rate': 0.0021419268033096113, 'n_estimators': 347, 'criterion': 'friedman_mse', 'min_samples_split': 9, 'min_samples_leaf': 2, 'min_weight_fraction_leaf': 0.03030756526043643, 'min_impurity_decrease': 0.7156789270286803, 'max_features': 0.3720318500879043, 'subsample': 0.15063678449827653, 'dropout_rate': 0.20717408781567206, 'ccp_alpha': 0.39612478722082445}. Best is trial 143 with value: 0.6514796499186757.[0m
[32m[I 2022-04-22 16:33:43,876][0m Trial 155 finished with value: 0.6366113495842589 and parameters: {'loss': 'coxph', 'learning_rate': 0.004137624282931256, 'n_estimators': 429, 'criterion': 'friedman_mse', 'min_samples_split': 9, 'min_samples_leaf': 2, 'min_weight_fraction_leaf': 0.04093095137594263, 'min_impurity_decrease': 0.7079035558198371, 'max_features': 0.537980110790144, 'subsample': 0.1418085957197767, 'dropout_rate': 0.054781224356455605, 'ccp_alpha': 0.09468445699376393}. Best is trial 143 with value: 0.6514796499186757.[0m
[32m[I 2022-04-22 16:34:23,844][0m Trial 156 finished with value: 0.5148756023171417 and parameters: {'loss': 'coxph', 'learning_rate': 0.006750235283613255, 'n_estimators': 383, 'criterion': 'friedman_mse', 'min_samples_split': 10, 'min_samples_leaf': 2, 'min_weight_fraction_leaf': 0.014304521367045266, 'min_impurity_decrease': 0.7994621735274792, 'max_features': 0.4407878696847742, 'subsample': 0.22853573435838706, 'dropout_rate': 0.09417565718053539, 'ccp_alpha': 0.3763541526898723}. Best is trial 143 with value: 0.6514796499186757.[0m
[32m[I 2022-04-22 16:34:56,834][0m Trial 157 finished with value: 0.6154356105661588 and parameters: {'loss': 'coxph', 'learning_rate': 0.0017440911506081428, 'n_estimators': 319, 'criterion': 'friedman_mse', 'min_samples_split': 9, 'min_samples_leaf': 2, 'min_weight_fraction_leaf': 0.016404769441360028, 'min_impurity_decrease': 0.6348758016899682, 'max_features': 0.40581704405339236, 'subsample': 0.17483526947258282, 'dropout_rate': 0.0011120961371073115, 'ccp_alpha': 0.18441912047963627}. Best is trial 143 with value: 0.6514796499186757.[0m
[32m[I 2022-04-22 16:35:22,003][0m Trial 158 finished with value: 0.6441986009905836 and parameters: {'loss': 'coxph', 'learning_rate': 0.0025763321049138634, 'n_estimators': 294, 'criterion': 'friedman_mse', 'min_samples_split': 9, 'min_samples_leaf': 2, 'min_weight_fraction_leaf': 0.03205199097937893, 'min_impurity_decrease': 0.6672094669275114, 'max_features': 0.5037790822729102, 'subsample': 0.1640518432370929, 'dropout_rate': 0.15378228238725414, 'ccp_alpha': 0.0856333063487933}. Best is trial 143 with value: 0.6514796499186757.[0m
/media/san2_ssd/data/Workdir/survival/venv/lib/python3.8/site-packages/sksurv/ensemble/boosting.py:955: RuntimeWarning: divide by zero encountered in log
  time = numpy.log(time)
/media/san2_ssd/data/Workdir/survival/venv/lib/python3.8/site-packages/sksurv/ensemble/boosting.py:955: RuntimeWarning: divide by zero encountered in log
  time = numpy.log(time)
/media/san2_ssd/data/Workdir/survival/venv/lib/python3.8/site-packages/sksurv/ensemble/boosting.py:955: RuntimeWarning: divide by zero encountered in log
  time = numpy.log(time)
/media/san2_ssd/data/Workdir/survival/venv/lib/python3.8/site-packages/sksurv/ensemble/boosting.py:955: RuntimeWarning: divide by zero encountered in log
  time = numpy.log(time)
[32m[I 2022-04-22 16:35:27,114][0m Trial 159 finished with value: -0.733588404393821 and parameters: {'loss': 'squared', 'learning_rate': 0.0022759812411162037, 'n_estimators': 298, 'criterion': 'friedman_mse', 'min_samples_split': 9, 'min_samples_leaf': 2, 'min_weight_fraction_leaf': 0.028594971182232753, 'min_impurity_decrease': 0.6641460590146289, 'max_features': 0.5139777182344905, 'subsample': 0.157942894790609, 'dropout_rate': 0.22392250985899365, 'ccp_alpha': 0.015370551899195728}. Best is trial 143 with value: 0.6514796499186757.[0m
[32m[I 2022-04-22 16:36:03,990][0m Trial 160 finished with value: 0.6399071765248234 and parameters: {'loss': 'coxph', 'learning_rate': 0.0013445940377180478, 'n_estimators': 359, 'criterion': 'friedman_mse', 'min_samples_split': 8, 'min_samples_leaf': 2, 'min_weight_fraction_leaf': 0.12113674879140991, 'min_impurity_decrease': 0.6370482299004667, 'max_features': 0.38803110549861797, 'subsample': 0.14173004786669116, 'dropout_rate': 0.14928933363332303, 'ccp_alpha': 0.09206995594423037}. Best is trial 143 with value: 0.6514796499186757.[0m
[32m[I 2022-04-22 16:36:45,321][0m Trial 161 finished with value: 0.6235564328167968 and parameters: {'loss': 'coxph', 'learning_rate': 0.00533438579337718, 'n_estimators': 405, 'criterion': 'friedman_mse', 'min_samples_split': 9, 'min_samples_leaf': 2, 'min_weight_fraction_leaf': 0.04023696116784009, 'min_impurity_decrease': 0.7768988263500157, 'max_features': 0.45522904480088905, 'subsample': 0.25000508020421747, 'dropout_rate': 0.2026728113949229, 'ccp_alpha': 0.19481306182419744}. Best is trial 143 with value: 0.6514796499186757.[0m
[32m[I 2022-04-22 16:37:12,870][0m Trial 162 finished with value: 0.583553072956433 and parameters: {'loss': 'coxph', 'learning_rate': 0.0033931479297570274, 'n_estimators': 291, 'criterion': 'friedman_mse', 'min_samples_split': 9, 'min_samples_leaf': 2, 'min_weight_fraction_leaf': 0.06651322987835051, 'min_impurity_decrease': 0.7274532539642212, 'max_features': 0.5059610470192752, 'subsample': 0.20176652731867845, 'dropout_rate': 0.07528177407259329, 'ccp_alpha': 0.2377223643562542}. Best is trial 143 with value: 0.6514796499186757.[0m
[32m[I 2022-04-22 16:37:43,920][0m Trial 163 finished with value: 0.6469395941543026 and parameters: {'loss': 'coxph', 'learning_rate': 0.0025280905813297124, 'n_estimators': 336, 'criterion': 'friedman_mse', 'min_samples_split': 9, 'min_samples_leaf': 2, 'min_weight_fraction_leaf': 0.022505144018626116, 'min_impurity_decrease': 0.7454823063764633, 'max_features': 0.4321574290758126, 'subsample': 0.21802128860535575, 'dropout_rate': 0.14874010152219208, 'ccp_alpha': 0.0023526509831112985}. Best is trial 143 with value: 0.6514796499186757.[0m
[32m[I 2022-04-22 16:38:17,663][0m Trial 164 finished with value: 0.6436109182431062 and parameters: {'loss': 'coxph', 'learning_rate': 0.0024938963967179335, 'n_estimators': 340, 'criterion': 'friedman_mse', 'min_samples_split': 8, 'min_samples_leaf': 2, 'min_weight_fraction_leaf': 0.023161454394401367, 'min_impurity_decrease': 0.7051040250106565, 'max_features': 0.40597983860758435, 'subsample': 0.1687462572855425, 'dropout_rate': 0.15215139730265606, 'ccp_alpha': 0.09053696837777661}. Best is trial 143 with value: 0.6514796499186757.[0m
[32m[I 2022-04-22 16:38:51,035][0m Trial 165 finished with value: 0.6433788604668671 and parameters: {'loss': 'coxph', 'learning_rate': 0.002392917422142801, 'n_estimators': 339, 'criterion': 'friedman_mse', 'min_samples_split': 10, 'min_samples_leaf': 2, 'min_weight_fraction_leaf': 0.021040508432679322, 'min_impurity_decrease': 0.7079897198029224, 'max_features': 0.3692226305394847, 'subsample': 0.16803200366945614, 'dropout_rate': 0.14803236953544766, 'ccp_alpha': 0.07608998292308097}. Best is trial 143 with value: 0.6514796499186757.[0m
[32m[I 2022-04-22 16:39:23,487][0m Trial 166 finished with value: 0.5177362383394645 and parameters: {'loss': 'coxph', 'learning_rate': 0.0024101939621153016, 'n_estimators': 341, 'criterion': 'friedman_mse', 'min_samples_split': 10, 'min_samples_leaf': 2, 'min_weight_fraction_leaf': 0.02044780446319247, 'min_impurity_decrease': 0.8113220200507099, 'max_features': 0.3670256811449716, 'subsample': 0.17097483569461275, 'dropout_rate': 0.14375130111891604, 'ccp_alpha': 0.37289861850200734}. Best is trial 143 with value: 0.6514796499186757.[0m
[32m[I 2022-04-22 16:40:00,815][0m Trial 167 finished with value: 0.6409444752747269 and parameters: {'loss': 'coxph', 'learning_rate': 0.0017967023102671946, 'n_estimators': 360, 'criterion': 'friedman_mse', 'min_samples_split': 10, 'min_samples_leaf': 2, 'min_weight_fraction_leaf': 0.02873373409882638, 'min_impurity_decrease': 0.6663057114220468, 'max_features': 0.3481670598379088, 'subsample': 0.13219563547396057, 'dropout_rate': 0.12037839570833632, 'ccp_alpha': 0.09433692979065475}. Best is trial 143 with value: 0.6514796499186757.[0m
[32m[I 2022-04-22 16:40:26,712][0m Trial 168 finished with value: 0.5889555702100269 and parameters: {'loss': 'coxph', 'learning_rate': 0.004289528302276982, 'n_estimators': 314, 'criterion': 'friedman_mse', 'min_samples_split': 10, 'min_samples_leaf': 2, 'min_weight_fraction_leaf': 0.01190506756537113, 'min_impurity_decrease': 0.7213461989976361, 'max_features': 0.3982128945664752, 'subsample': 0.22428224206406666, 'dropout_rate': 0.15353263664147854, 'ccp_alpha': 0.2303325691913409}. Best is trial 143 with value: 0.6514796499186757.[0m
[32m[I 2022-04-22 16:41:05,959][0m Trial 169 finished with value: 0.5657348587526054 and parameters: {'loss': 'coxph', 'learning_rate': 0.0026484179421168413, 'n_estimators': 381, 'criterion': 'friedman_mse', 'min_samples_split': 9, 'min_samples_leaf': 2, 'min_weight_fraction_leaf': 0.035704688309015575, 'min_impurity_decrease': 0.7449002464859028, 'max_features': 0.42799035339346336, 'subsample': 0.18781576717889417, 'dropout_rate': 0.09401511963787121, 'ccp_alpha': 0.28605490589554633}. Best is trial 143 with value: 0.6514796499186757.[0m
[32m[I 2022-04-22 16:41:37,672][0m Trial 170 finished with value: 0.6503184723076438 and parameters: {'loss': 'coxph', 'learning_rate': 0.0013306280601590047, 'n_estimators': 336, 'criterion': 'friedman_mse', 'min_samples_split': 9, 'min_samples_leaf': 2, 'min_weight_fraction_leaf': 0.023052096737644568, 'min_impurity_decrease': 0.7736497682406791, 'max_features': 0.40856961141580467, 'subsample': 0.15766164183297976, 'dropout_rate': 0.13495796728858508, 'ccp_alpha': 0.003342029815726552}. Best is trial 143 with value: 0.6514796499186757.[0m
[32m[I 2022-04-22 16:42:09,305][0m Trial 171 finished with value: 0.6476379495993598 and parameters: {'loss': 'coxph', 'learning_rate': 0.0014174884488338496, 'n_estimators': 338, 'criterion': 'friedman_mse', 'min_samples_split': 9, 'min_samples_leaf': 2, 'min_weight_fraction_leaf': 0.02235016199398187, 'min_impurity_decrease': 0.7651578879713126, 'max_features': 0.4080682688346552, 'subsample': 0.16014220044679434, 'dropout_rate': 0.1279113049368338, 'ccp_alpha': 0.08686080466915685}. Best is trial 143 with value: 0.6514796499186757.[0m
[32m[I 2022-04-22 16:42:35,775][0m Trial 172 finished with value: 0.6496450111092548 and parameters: {'loss': 'coxph', 'learning_rate': 0.0013239324193299485, 'n_estimators': 307, 'criterion': 'friedman_mse', 'min_samples_split': 9, 'min_samples_leaf': 2, 'min_weight_fraction_leaf': 0.044421013721363506, 'min_impurity_decrease': 0.7727658771548759, 'max_features': 0.41251549430701184, 'subsample': 0.14794154062370451, 'dropout_rate': 0.12712499512556544, 'ccp_alpha': 0.13081855620213248}. Best is trial 143 with value: 0.6514796499186757.[0m
[32m[I 2022-04-22 16:43:03,196][0m Trial 173 finished with value: 0.6305342556319227 and parameters: {'loss': 'coxph', 'learning_rate': 0.001408985951286855, 'n_estimators': 311, 'criterion': 'friedman_mse', 'min_samples_split': 9, 'min_samples_leaf': 2, 'min_weight_fraction_leaf': 0.04107511258380076, 'min_impurity_decrease': 0.7722721793078593, 'max_features': 0.43629826305251995, 'subsample': 0.1472180331020891, 'dropout_rate': 0.0886273808150433, 'ccp_alpha': 0.15304749908328652}. Best is trial 143 with value: 0.6514796499186757.[0m
[32m[I 2022-04-22 16:43:27,825][0m Trial 174 finished with value: 0.643210967918224 and parameters: {'loss': 'coxph', 'learning_rate': 0.0006011520843529097, 'n_estimators': 286, 'criterion': 'friedman_mse', 'min_samples_split': 9, 'min_samples_leaf': 2, 'min_weight_fraction_leaf': 0.0475470596586033, 'min_impurity_decrease': 0.7936262665330782, 'max_features': 0.4109292790522379, 'subsample': 0.12472460542577986, 'dropout_rate': 0.12677792893564413, 'ccp_alpha': 0.024780341662572397}. Best is trial 143 with value: 0.6514796499186757.[0m
[32m[I 2022-04-22 16:43:50,975][0m Trial 175 finished with value: 0.5006540204610004 and parameters: {'loss': 'coxph', 'learning_rate': 0.001713627191077665, 'n_estimators': 300, 'criterion': 'friedman_mse', 'min_samples_split': 9, 'min_samples_leaf': 2, 'min_weight_fraction_leaf': 0.011629441979895062, 'min_impurity_decrease': 0.8186678702068139, 'max_features': 0.38632087474706817, 'subsample': 0.18820971196886396, 'dropout_rate': 0.20160594782516608, 'ccp_alpha': 0.46494769236867706}. Best is trial 143 with value: 0.6514796499186757.[0m
[32m[I 2022-04-22 16:44:12,341][0m Trial 176 finished with value: 0.6501790784358035 and parameters: {'loss': 'coxph', 'learning_rate': 0.0013392704170087516, 'n_estimators': 267, 'criterion': 'friedman_mse', 'min_samples_split': 9, 'min_samples_leaf': 2, 'min_weight_fraction_leaf': 0.001829361347480702, 'min_impurity_decrease': 0.753856429579969, 'max_features': 0.43410199737906624, 'subsample': 0.14853995066965123, 'dropout_rate': 0.11011511120306156, 'ccp_alpha': 0.0055932308015528565}. Best is trial 143 with value: 0.6514796499186757.[0m
[32m[I 2022-04-22 16:44:48,420][0m Trial 177 finished with value: 0.5957049846063219 and parameters: {'loss': 'coxph', 'learning_rate': 0.0014179464073809233, 'n_estimators': 354, 'criterion': 'friedman_mse', 'min_samples_split': 9, 'min_samples_leaf': 2, 'min_weight_fraction_leaf': 0.010041367668666448, 'min_impurity_decrease': 0.832203593140644, 'max_features': 0.4371718996292585, 'subsample': 0.14960165512384216, 'dropout_rate': 0.1015173418843755, 'ccp_alpha': 0.2828796528130426}. Best is trial 143 with value: 0.6514796499186757.[0m
[32m[I 2022-04-22 16:45:15,914][0m Trial 178 finished with value: 0.6437123683384254 and parameters: {'loss': 'coxph', 'learning_rate': 0.0019342401211533075, 'n_estimators': 318, 'criterion': 'friedman_mse', 'min_samples_split': 9, 'min_samples_leaf': 2, 'min_weight_fraction_leaf': 0.029566692442586102, 'min_impurity_decrease': 0.7763602526546872, 'max_features': 0.41134903262979367, 'subsample': 0.2074747439790429, 'dropout_rate': 0.12398796938163438, 'ccp_alpha': 0.15347454449484255}. Best is trial 143 with value: 0.6514796499186757.[0m
[32m[I 2022-04-22 16:46:02,140][0m Trial 179 finished with value: 0.6436416690207996 and parameters: {'loss': 'coxph', 'learning_rate': 0.0035806870540260934, 'n_estimators': 392, 'criterion': 'friedman_mse', 'min_samples_split': 9, 'min_samples_leaf': 2, 'min_weight_fraction_leaf': 0.0014603520553081724, 'min_impurity_decrease': 0.7543748908353938, 'max_features': 0.3775379498157113, 'subsample': 0.13145465281013907, 'dropout_rate': 0.07102863133702203, 'ccp_alpha': 0.0020425084072145244}. Best is trial 143 with value: 0.6514796499186757.[0m
[32m[I 2022-04-22 16:46:25,117][0m Trial 180 finished with value: 0.6265505354413172 and parameters: {'loss': 'coxph', 'learning_rate': 0.0012471783011098819, 'n_estimators': 284, 'criterion': 'friedman_mse', 'min_samples_split': 9, 'min_samples_leaf': 3, 'min_weight_fraction_leaf': 0.045428181304840484, 'min_impurity_decrease': 0.7421261217001359, 'max_features': 0.4548540438600815, 'subsample': 0.07269885170147408, 'dropout_rate': 0.1288650736008729, 'ccp_alpha': 0.2553354341794306}. Best is trial 143 with value: 0.6514796499186757.[0m
[32m[I 2022-04-22 16:46:46,748][0m Trial 181 finished with value: 0.6476986965961719 and parameters: {'loss': 'coxph', 'learning_rate': 0.0019370756925395796, 'n_estimators': 267, 'criterion': 'friedman_mse', 'min_samples_split': 9, 'min_samples_leaf': 2, 'min_weight_fraction_leaf': 0.09594523554005943, 'min_impurity_decrease': 0.7760099864689372, 'max_features': 0.4351379474385245, 'subsample': 0.11943786483203556, 'dropout_rate': 0.15789749422005436, 'ccp_alpha': 0.004513873822807921}. Best is trial 143 with value: 0.6514796499186757.[0m
[32m[I 2022-04-22 16:47:08,178][0m Trial 182 finished with value: 0.6477640128380451 and parameters: {'loss': 'coxph', 'learning_rate': 0.0019197095651135444, 'n_estimators': 270, 'criterion': 'friedman_mse', 'min_samples_split': 9, 'min_samples_leaf': 2, 'min_weight_fraction_leaf': 0.017294147108258936, 'min_impurity_decrease': 0.7712177014666544, 'max_features': 0.43608986884981865, 'subsample': 0.15562714712483094, 'dropout_rate': 0.15927381206383368, 'ccp_alpha': 0.12461799425043019}. Best is trial 143 with value: 0.6514796499186757.[0m
