[32m[I 2022-04-21 11:39:18,682][0m Trial 135 finished with value: 0.6586187582319654 and parameters: {'splitter': 'random', 'min_samples_split': 0.23092181199231634, 'min_samples_leaf': 0.20253199036736594, 'min_weight_fraction_leaf': 0.11886047202986763, 'max_features': 0.9538457860961695}. Best is trial 11 with value: 0.6773038119717333.[0m
[32m[I 2022-04-21 11:39:18,746][0m Trial 136 finished with value: 0.6738476114655684 and parameters: {'splitter': 'random', 'min_samples_split': 0.1986465180054064, 'min_samples_leaf': 0.0033531677457181754, 'min_weight_fraction_leaf': 0.19301033899626488, 'max_features': 0.9752707016805475}. Best is trial 11 with value: 0.6773038119717333.[0m
[32m[I 2022-04-21 11:39:18,805][0m Trial 137 finished with value: 0.6738476114655684 and parameters: {'splitter': 'random', 'min_samples_split': 0.19541675052494759, 'min_samples_leaf': 0.059000526670697384, 'min_weight_fraction_leaf': 0.19643598063755816, 'max_features': 0.9770934634016116}. Best is trial 11 with value: 0.6773038119717333.[0m
[32m[I 2022-04-21 11:39:18,864][0m Trial 138 finished with value: 0.5305100038533069 and parameters: {'splitter': 'random', 'min_samples_split': 0.42965293742362876, 'min_samples_leaf': 0.17543540360793314, 'min_weight_fraction_leaf': 0.16610159277146896, 'max_features': 0.7375611265019261}. Best is trial 11 with value: 0.6773038119717333.[0m
[32m[I 2022-04-21 11:39:18,924][0m Trial 139 finished with value: 0.6738476114655684 and parameters: {'splitter': 'random', 'min_samples_split': 0.02707784121073958, 'min_samples_leaf': 0.023786529083933913, 'min_weight_fraction_leaf': 0.1736088461577111, 'max_features': 0.9333993303248832}. Best is trial 11 with value: 0.6773038119717333.[0m
[32m[I 2022-04-21 11:39:18,990][0m Trial 140 finished with value: 0.6726536399376829 and parameters: {'splitter': 'best', 'min_samples_split': 0.27686241157377495, 'min_samples_leaf': 0.052623168661350805, 'min_weight_fraction_leaf': 0.0396027648057403, 'max_features': 0.9168708446080932}. Best is trial 11 with value: 0.6773038119717333.[0m
[32m[I 2022-04-21 11:39:19,050][0m Trial 141 finished with value: 0.6551405301163737 and parameters: {'splitter': 'random', 'min_samples_split': 0.4277674726962064, 'min_samples_leaf': 0.21580554604455637, 'min_weight_fraction_leaf': 0.2103313587056979, 'max_features': 0.8339358792577259}. Best is trial 11 with value: 0.6773038119717333.[0m
[32m[I 2022-04-21 11:39:19,109][0m Trial 142 finished with value: 0.6586187582319654 and parameters: {'splitter': 'random', 'min_samples_split': 0.05011022861973653, 'min_samples_leaf': 0.2098197535116635, 'min_weight_fraction_leaf': 0.09876941579334984, 'max_features': 0.999713082857801}. Best is trial 11 with value: 0.6773038119717333.[0m
[32m[I 2022-04-21 11:39:19,152][0m Trial 143 finished with value: 0.6738476114655684 and parameters: {'splitter': 'random', 'min_samples_split': 0.26707334053027804, 'min_samples_leaf': 0.17309494806739392, 'min_weight_fraction_leaf': 0.163742667946555, 'max_features': 0.9449722626685716}. Best is trial 11 with value: 0.6773038119717333.[0m
[32m[I 2022-04-21 11:39:19,208][0m Trial 144 finished with value: 0.6738476114655684 and parameters: {'splitter': 'random', 'min_samples_split': 0.03381751994003915, 'min_samples_leaf': 0.06130198592116005, 'min_weight_fraction_leaf': 0.1815060804384472, 'max_features': 0.9621158415001855}. Best is trial 11 with value: 0.6773038119717333.[0m
[32m[I 2022-04-21 11:39:19,267][0m Trial 145 finished with value: 0.5 and parameters: {'splitter': 'random', 'min_samples_split': 0.035071992234557606, 'min_samples_leaf': 0.03563115098325628, 'min_weight_fraction_leaf': 0.18153336218274438, 'max_features': 0.030900870948788572}. Best is trial 11 with value: 0.6773038119717333.[0m
[32m[I 2022-04-21 11:39:19,319][0m Trial 146 finished with value: 0.5 and parameters: {'splitter': 'random', 'min_samples_split': 0.1728776106547661, 'min_samples_leaf': 0.010446054368744573, 'min_weight_fraction_leaf': 0.40446255873100057, 'max_features': 0.9804686748063107}. Best is trial 11 with value: 0.6773038119717333.[0m
[32m[I 2022-04-21 11:39:19,371][0m Trial 147 finished with value: 0.6640701022932763 and parameters: {'splitter': 'random', 'min_samples_split': 0.0013576127170508712, 'min_samples_leaf': 0.049058215080178824, 'min_weight_fraction_leaf': 0.12670994421400114, 'max_features': 0.9282699572517089}. Best is trial 11 with value: 0.6773038119717333.[0m
[32m[I 2022-04-21 11:39:19,412][0m Trial 148 finished with value: 0.6502080893344752 and parameters: {'splitter': 'random', 'min_samples_split': 0.0674281509240689, 'min_samples_leaf': 0.15212227811667128, 'min_weight_fraction_leaf': 0.0628389322582367, 'max_features': 0.8909600845535773}. Best is trial 11 with value: 0.6773038119717333.[0m
[32m[I 2022-04-21 11:39:19,440][0m Trial 149 finished with value: 0.6738476114655684 and parameters: {'splitter': 'random', 'min_samples_split': 0.15210035944025835, 'min_samples_leaf': 0.1233908742308499, 'min_weight_fraction_leaf': 0.1755225985709938, 'max_features': 0.9082121746800254}. Best is trial 11 with value: 0.6773038119717333.[0m
[32m[I 2022-04-21 11:39:19,467][0m Trial 150 finished with value: 0.662800366349585 and parameters: {'splitter': 'random', 'min_samples_split': 0.1437956912405452, 'min_samples_leaf': 0.0878594220836616, 'min_weight_fraction_leaf': 0.16407219944167384, 'max_features': 0.8817582303946471}. Best is trial 11 with value: 0.6773038119717333.[0m
[32m[I 2022-04-21 11:39:19,494][0m Trial 151 finished with value: 0.6738476114655684 and parameters: {'splitter': 'random', 'min_samples_split': 0.3617272317055095, 'min_samples_leaf': 0.19741408878995134, 'min_weight_fraction_leaf': 0.1943782493153452, 'max_features': 0.9480100628200726}. Best is trial 11 with value: 0.6773038119717333.[0m
[32m[I 2022-04-21 11:39:19,524][0m Trial 152 finished with value: 0.6738476114655684 and parameters: {'splitter': 'random', 'min_samples_split': 0.20962604521714043, 'min_samples_leaf': 0.19551040960062555, 'min_weight_fraction_leaf': 0.0009548618506192152, 'max_features': 0.9520810136480427}. Best is trial 11 with value: 0.6773038119717333.[0m
[32m[I 2022-04-21 11:39:19,562][0m Trial 153 finished with value: 0.6640701022932763 and parameters: {'splitter': 'random', 'min_samples_split': 0.38434289329924887, 'min_samples_leaf': 0.08034007900337138, 'min_weight_fraction_leaf': 0.07877123152631654, 'max_features': 0.9225424556412911}. Best is trial 11 with value: 0.6773038119717333.[0m
[32m[I 2022-04-21 11:39:19,593][0m Trial 154 finished with value: 0.6502080893344752 and parameters: {'splitter': 'random', 'min_samples_split': 0.3752161286363842, 'min_samples_leaf': 0.02343082305511821, 'min_weight_fraction_leaf': 0.15021576361424352, 'max_features': 0.8453464013570515}. Best is trial 11 with value: 0.6773038119717333.[0m
[32m[I 2022-04-21 11:39:19,627][0m Trial 155 finished with value: 0.6647456324911225 and parameters: {'splitter': 'random', 'min_samples_split': 0.052375208242506535, 'min_samples_leaf': 0.10202059528775898, 'min_weight_fraction_leaf': 0.10341541894199506, 'max_features': 0.9030529887020011}. Best is trial 11 with value: 0.6773038119717333.[0m
[32m[I 2022-04-21 11:39:19,657][0m Trial 156 finished with value: 0.6586187582319654 and parameters: {'splitter': 'random', 'min_samples_split': 0.05800935549497259, 'min_samples_leaf': 0.20662057046644616, 'min_weight_fraction_leaf': 0.0960709347817023, 'max_features': 0.9775314744683568}. Best is trial 11 with value: 0.6773038119717333.[0m
[32m[I 2022-04-21 11:39:19,692][0m Trial 157 finished with value: 0.6738476114655684 and parameters: {'splitter': 'random', 'min_samples_split': 0.18156546875769852, 'min_samples_leaf': 0.06806975300218107, 'min_weight_fraction_leaf': 0.19215005276883124, 'max_features': 0.9805380831470134}. Best is trial 11 with value: 0.6773038119717333.[0m
[32m[I 2022-04-21 11:39:19,723][0m Trial 158 finished with value: 0.6738476114655684 and parameters: {'splitter': 'random', 'min_samples_split': 0.1309758495771296, 'min_samples_leaf': 0.02524073883492086, 'min_weight_fraction_leaf': 0.20055041435545665, 'max_features': 0.8758002048094509}. Best is trial 11 with value: 0.6773038119717333.[0m
[32m[I 2022-04-21 11:39:19,754][0m Trial 159 finished with value: 0.655668460990784 and parameters: {'splitter': 'random', 'min_samples_split': 0.37216313330112466, 'min_samples_leaf': 0.012438120282297219, 'min_weight_fraction_leaf': 0.012350691719317151, 'max_features': 0.7787204612761662}. Best is trial 11 with value: 0.6773038119717333.[0m
[32m[I 2022-04-21 11:39:19,781][0m Trial 160 finished with value: 0.6738476114655684 and parameters: {'splitter': 'random', 'min_samples_split': 0.35763485763861613, 'min_samples_leaf': 0.13934152455372262, 'min_weight_fraction_leaf': 0.18343434987459473, 'max_features': 0.9069508809477066}. Best is trial 11 with value: 0.6773038119717333.[0m
[32m[I 2022-04-21 11:39:19,809][0m Trial 161 finished with value: 0.6543938115635641 and parameters: {'splitter': 'random', 'min_samples_split': 0.23250442597431764, 'min_samples_leaf': 0.15907961724974662, 'min_weight_fraction_leaf': 0.14734699492806058, 'max_features': 0.939017644646789}. Best is trial 11 with value: 0.6773038119717333.[0m
[32m[I 2022-04-21 11:39:19,836][0m Trial 162 finished with value: 0.6738476114655684 and parameters: {'splitter': 'random', 'min_samples_split': 0.19189769159296477, 'min_samples_leaf': 0.0019066500804386752, 'min_weight_fraction_leaf': 0.18901885999180687, 'max_features': 0.9878342536562521}. Best is trial 11 with value: 0.6773038119717333.[0m
[32m[I 2022-04-21 11:39:19,867][0m Trial 163 finished with value: 0.6738476114655684 and parameters: {'splitter': 'random', 'min_samples_split': 0.3948474725635843, 'min_samples_leaf': 0.13265827497699922, 'min_weight_fraction_leaf': 0.17354829164218086, 'max_features': 0.9121288765181518}. Best is trial 11 with value: 0.6773038119717333.[0m
[32m[I 2022-04-21 11:39:19,899][0m Trial 164 finished with value: 0.6543938115635641 and parameters: {'splitter': 'random', 'min_samples_split': 0.39949444180492405, 'min_samples_leaf': 0.1327862221352486, 'min_weight_fraction_leaf': 0.15806150412407458, 'max_features': 0.8675011830240746}. Best is trial 11 with value: 0.6773038119717333.[0m
[32m[I 2022-04-21 11:39:19,928][0m Trial 165 finished with value: 0.5 and parameters: {'splitter': 'random', 'min_samples_split': 0.010423497310377318, 'min_samples_leaf': 0.4991375481571433, 'min_weight_fraction_leaf': 0.17304554355923055, 'max_features': 0.9635355980184789}. Best is trial 11 with value: 0.6773038119717333.[0m
[32m[I 2022-04-21 11:39:19,956][0m Trial 166 finished with value: 0.6586187582319654 and parameters: {'splitter': 'random', 'min_samples_split': 0.34388465841605687, 'min_samples_leaf': 0.1059111426838649, 'min_weight_fraction_leaf': 0.20542853182993379, 'max_features': 0.9604998186935012}. Best is trial 11 with value: 0.6773038119717333.[0m
[32m[I 2022-04-21 11:39:19,982][0m Trial 167 finished with value: 0.5 and parameters: {'splitter': 'random', 'min_samples_split': 0.3334353835747518, 'min_samples_leaf': 0.1227246490763771, 'min_weight_fraction_leaf': 0.21723530091011606, 'max_features': 0.636188091076143}. Best is trial 11 with value: 0.6773038119717333.[0m
[32m[I 2022-04-21 11:39:20,014][0m Trial 168 finished with value: 0.6738476114655684 and parameters: {'splitter': 'random', 'min_samples_split': 0.26472893207038073, 'min_samples_leaf': 0.18385244663129677, 'min_weight_fraction_leaf': 0.15968868274280149, 'max_features': 0.9559222806413674}. Best is trial 11 with value: 0.6773038119717333.[0m
[32m[I 2022-04-21 11:39:20,066][0m Trial 169 finished with value: 0.6738476114655684 and parameters: {'splitter': 'random', 'min_samples_split': 0.26379177204520227, 'min_samples_leaf': 0.1860460147805368, 'min_weight_fraction_leaf': 0.15819783344031157, 'max_features': 0.9414582302778949}. Best is trial 11 with value: 0.6773038119717333.[0m
[32m[I 2022-04-21 11:39:20,102][0m Trial 170 finished with value: 0.6636900948801576 and parameters: {'splitter': 'best', 'min_samples_split': 0.2537869312347991, 'min_samples_leaf': 0.1841733001037505, 'min_weight_fraction_leaf': 0.1334544274084039, 'max_features': 0.9355594420986798}. Best is trial 11 with value: 0.6773038119717333.[0m
[32m[I 2022-04-21 11:39:20,140][0m Trial 171 finished with value: 0.6738476114655684 and parameters: {'splitter': 'random', 'min_samples_split': 0.3864660015510561, 'min_samples_leaf': 0.1148725608590921, 'min_weight_fraction_leaf': 0.16926128049635472, 'max_features': 0.8365747780606501}. Best is trial 11 with value: 0.6773038119717333.[0m
[32m[I 2022-04-21 11:39:20,199][0m Trial 172 finished with value: 0.6738476114655684 and parameters: {'splitter': 'random', 'min_samples_split': 0.08422322709177592, 'min_samples_leaf': 0.17199611787807645, 'min_weight_fraction_leaf': 0.13645965210961397, 'max_features': 0.8472627758018836}. Best is trial 11 with value: 0.6773038119717333.[0m
[32m[I 2022-04-21 11:39:20,267][0m Trial 173 finished with value: 0.6738476114655684 and parameters: {'splitter': 'random', 'min_samples_split': 0.08329627559998026, 'min_samples_leaf': 0.17398961995691428, 'min_weight_fraction_leaf': 0.13932634885348466, 'max_features': 0.8481212560271753}. Best is trial 11 with value: 0.6773038119717333.[0m
[32m[I 2022-04-21 11:39:20,307][0m Trial 174 finished with value: 0.6215155824977587 and parameters: {'splitter': 'random', 'min_samples_split': 0.0912555633802164, 'min_samples_leaf': 0.2250834755113371, 'min_weight_fraction_leaf': 0.12185574370293265, 'max_features': 0.8828763514445777}. Best is trial 11 with value: 0.6773038119717333.[0m
[32m[I 2022-04-21 11:39:20,367][0m Trial 175 finished with value: 0.6738476114655684 and parameters: {'splitter': 'random', 'min_samples_split': 0.028827387937741623, 'min_samples_leaf': 0.05335345875576039, 'min_weight_fraction_leaf': 0.19605692523792703, 'max_features': 0.9668681778328921}. Best is trial 11 with value: 0.6773038119717333.[0m
[32m[I 2022-04-21 11:39:20,412][0m Trial 176 finished with value: 0.5 and parameters: {'splitter': 'random', 'min_samples_split': 0.031199150064521817, 'min_samples_leaf': 0.05871171520857357, 'min_weight_fraction_leaf': 0.1975019122304357, 'max_features': 0.07041550532582347}. Best is trial 11 with value: 0.6773038119717333.[0m
[32m[I 2022-04-21 11:39:20,481][0m Trial 177 finished with value: 0.6738476114655684 and parameters: {'splitter': 'random', 'min_samples_split': 0.33492631264262673, 'min_samples_leaf': 0.13830910764319762, 'min_weight_fraction_leaf': 0.18405716034815195, 'max_features': 0.9074299392115014}. Best is trial 11 with value: 0.6773038119717333.[0m
[32m[I 2022-04-21 11:39:20,541][0m Trial 178 finished with value: 0.6738476114655684 and parameters: {'splitter': 'random', 'min_samples_split': 0.28938133547639594, 'min_samples_leaf': 0.13963935337458402, 'min_weight_fraction_leaf': 0.1860945409163588, 'max_features': 0.9424320643265512}. Best is trial 11 with value: 0.6773038119717333.[0m
[32m[I 2022-04-21 11:39:20,589][0m Trial 179 finished with value: 0.6215155824977587 and parameters: {'splitter': 'random', 'min_samples_split': 0.3589424118177086, 'min_samples_leaf': 0.013793123446553562, 'min_weight_fraction_leaf': 0.22700275472988024, 'max_features': 0.9259591912650351}. Best is trial 11 with value: 0.6773038119717333.[0m
[32m[I 2022-04-21 11:39:20,643][0m Trial 180 finished with value: 0.6738476114655684 and parameters: {'splitter': 'random', 'min_samples_split': 0.24132804388336843, 'min_samples_leaf': 0.15174542355384069, 'min_weight_fraction_leaf': 0.17536491269107662, 'max_features': 0.996329376872611}. Best is trial 11 with value: 0.6773038119717333.[0m
[32m[I 2022-04-21 11:39:20,696][0m Trial 181 finished with value: 0.662800366349585 and parameters: {'splitter': 'random', 'min_samples_split': 0.24553988083956924, 'min_samples_leaf': 0.16017595437691096, 'min_weight_fraction_leaf': 0.1495731929533619, 'max_features': 0.9455838619078047}. Best is trial 11 with value: 0.6773038119717333.[0m
[32m[I 2022-04-21 11:39:20,745][0m Trial 182 finished with value: 0.6586187582319654 and parameters: {'splitter': 'random', 'min_samples_split': 0.13489657218498052, 'min_samples_leaf': 0.1216657950829138, 'min_weight_fraction_leaf': 0.20843546544296876, 'max_features': 0.9793937927093476}. Best is trial 11 with value: 0.6773038119717333.[0m
[32m[I 2022-04-21 11:39:20,773][0m Trial 183 finished with value: 0.6738476114655684 and parameters: {'splitter': 'random', 'min_samples_split': 0.16382450219530786, 'min_samples_leaf': 0.07302878199296262, 'min_weight_fraction_leaf': 0.18061837561823108, 'max_features': 0.9621309861805472}. Best is trial 11 with value: 0.6773038119717333.[0m
[32m[I 2022-04-21 11:39:20,802][0m Trial 184 finished with value: 0.6521005858480151 and parameters: {'splitter': 'random', 'min_samples_split': 0.059648421273731114, 'min_samples_leaf': 0.042374674641169376, 'min_weight_fraction_leaf': 0.08246999817253928, 'max_features': 0.8709618963427955}. Best is trial 11 with value: 0.6773038119717333.[0m
[32m[I 2022-04-21 11:39:20,831][0m Trial 185 finished with value: 0.6657887496440227 and parameters: {'splitter': 'random', 'min_samples_split': 0.30964908262854357, 'min_samples_leaf': 0.059828795434944765, 'min_weight_fraction_leaf': 0.002225250664864762, 'max_features': 0.9816667640286638}. Best is trial 11 with value: 0.6773038119717333.[0m
[32m[I 2022-04-21 11:39:20,859][0m Trial 186 finished with value: 0.6738476114655684 and parameters: {'splitter': 'random', 'min_samples_split': 0.29963980731653633, 'min_samples_leaf': 0.03267547747426307, 'min_weight_fraction_leaf': 0.16972749780085258, 'max_features': 0.9309048280826006}. Best is trial 11 with value: 0.6773038119717333.[0m
[32m[I 2022-04-21 11:39:20,928][0m Trial 187 finished with value: 0.6738476114655684 and parameters: {'splitter': 'random', 'min_samples_split': 0.045787859963104055, 'min_samples_leaf': 0.19641702720109036, 'min_weight_fraction_leaf': 0.06070442884484922, 'max_features': 0.8920279610229618}. Best is trial 11 with value: 0.6773038119717333.[0m
[32m[I 2022-04-21 11:39:20,969][0m Trial 188 finished with value: 0.6738476114655684 and parameters: {'splitter': 'random', 'min_samples_split': 0.07055832322054828, 'min_samples_leaf': 0.03826377506746106, 'min_weight_fraction_leaf': 0.16772965525444897, 'max_features': 0.9251399499945239}. Best is trial 11 with value: 0.6773038119717333.[0m
[32m[I 2022-04-21 11:39:20,997][0m Trial 189 finished with value: 0.5 and parameters: {'splitter': 'random', 'min_samples_split': 0.0418791551075321, 'min_samples_leaf': 0.4041765726398657, 'min_weight_fraction_leaf': 0.05972900401337203, 'max_features': 0.9963875072466332}. Best is trial 11 with value: 0.6773038119717333.[0m
[32m[I 2022-04-21 11:39:21,026][0m Trial 190 finished with value: 0.662800366349585 and parameters: {'splitter': 'random', 'min_samples_split': 0.1826696139744456, 'min_samples_leaf': 0.09021995637011852, 'min_weight_fraction_leaf': 0.16308649257783828, 'max_features': 0.9608838692440367}. Best is trial 11 with value: 0.6773038119717333.[0m
[32m[I 2022-04-21 11:39:21,054][0m Trial 191 finished with value: 0.6738476114655684 and parameters: {'splitter': 'random', 'min_samples_split': 0.2749087361085785, 'min_samples_leaf': 0.1778000269796278, 'min_weight_fraction_leaf': 0.14928092438055054, 'max_features': 0.9486411200123963}. Best is trial 11 with value: 0.6773038119717333.[0m
[32m[I 2022-04-21 11:39:21,090][0m Trial 192 finished with value: 0.6738476114655684 and parameters: {'splitter': 'random', 'min_samples_split': 0.4136292069335838, 'min_samples_leaf': 0.04255816423328236, 'min_weight_fraction_leaf': 0.18903222463142974, 'max_features': 0.8972181150305557}. Best is trial 11 with value: 0.6773038119717333.[0m
[32m[I 2022-04-21 11:39:21,131][0m Trial 193 finished with value: 0.6738476114655684 and parameters: {'splitter': 'random', 'min_samples_split': 0.42229744706881894, 'min_samples_leaf': 0.18442108063006002, 'min_weight_fraction_leaf': 0.15659899417065712, 'max_features': 0.9569661855371631}. Best is trial 11 with value: 0.6773038119717333.[0m
[32m[I 2022-04-21 11:39:21,160][0m Trial 194 finished with value: 0.6543938115635641 and parameters: {'splitter': 'random', 'min_samples_split': 0.4614273954338267, 'min_samples_leaf': 0.0036244603568749804, 'min_weight_fraction_leaf': 0.15892659337366583, 'max_features': 0.9666133896656632}. Best is trial 11 with value: 0.6773038119717333.[0m
[32m[I 2022-04-21 11:39:21,188][0m Trial 195 finished with value: 0.6738476114655684 and parameters: {'splitter': 'random', 'min_samples_split': 0.40032791011733376, 'min_samples_leaf': 0.15276493282845863, 'min_weight_fraction_leaf': 0.17664534266795606, 'max_features': 0.9202049151283852}. Best is trial 11 with value: 0.6773038119717333.[0m
[32m[I 2022-04-21 11:39:21,216][0m Trial 196 finished with value: 0.5 and parameters: {'splitter': 'random', 'min_samples_split': 0.3838368289097578, 'min_samples_leaf': 0.1949269877356575, 'min_weight_fraction_leaf': 0.01148803818887021, 'max_features': 0.792024182254376}. Best is trial 11 with value: 0.6773038119717333.[0m
[32m[I 2022-04-21 11:39:21,245][0m Trial 197 finished with value: 0.6738476114655684 and parameters: {'splitter': 'random', 'min_samples_split': 0.3471140586713543, 'min_samples_leaf': 0.14319444616333568, 'min_weight_fraction_leaf': 0.18365262854036554, 'max_features': 0.9063954550259016}. Best is trial 11 with value: 0.6773038119717333.[0m
