[32m[I 2022-04-21 11:41:21,439][0m Trial 856 finished with value: 0.842183674410227 and parameters: {'alpha': 0.649795459144825, 'ties': 'breslow'}. Best is trial 13 with value: 0.8423527006348241.[0m
[32m[I 2022-04-21 11:41:21,727][0m Trial 857 finished with value: 0.8423527006348241 and parameters: {'alpha': 0.8939457406611877, 'ties': 'breslow'}. Best is trial 13 with value: 0.8423527006348241.[0m
[32m[I 2022-04-21 11:41:22,035][0m Trial 858 finished with value: 0.8423527006348241 and parameters: {'alpha': 0.8983380862583125, 'ties': 'breslow'}. Best is trial 13 with value: 0.8423527006348241.[0m
[32m[I 2022-04-21 11:41:22,211][0m Trial 859 finished with value: 0.842183674410227 and parameters: {'alpha': 0.5550258738495113, 'ties': 'breslow'}. Best is trial 13 with value: 0.8423527006348241.[0m
[32m[I 2022-04-21 11:41:22,567][0m Trial 860 finished with value: 0.8423527006348241 and parameters: {'alpha': 0.7304984817511014, 'ties': 'breslow'}. Best is trial 13 with value: 0.8423527006348241.[0m
[32m[I 2022-04-21 11:41:22,945][0m Trial 861 finished with value: 0.842183674410227 and parameters: {'alpha': 0.5017396112588957, 'ties': 'breslow'}. Best is trial 13 with value: 0.8423527006348241.[0m
[32m[I 2022-04-21 11:41:23,348][0m Trial 862 finished with value: 0.842183674410227 and parameters: {'alpha': 0.40644301327120225, 'ties': 'breslow'}. Best is trial 13 with value: 0.8423527006348241.[0m
[32m[I 2022-04-21 11:41:23,644][0m Trial 863 finished with value: 0.842183674410227 and parameters: {'alpha': 0.6269514221975192, 'ties': 'breslow'}. Best is trial 13 with value: 0.8423527006348241.[0m
[32m[I 2022-04-21 11:41:23,916][0m Trial 864 finished with value: 0.842183674410227 and parameters: {'alpha': 0.6824408925050461, 'ties': 'breslow'}. Best is trial 13 with value: 0.8423527006348241.[0m
[32m[I 2022-04-21 11:41:24,221][0m Trial 865 finished with value: 0.8423527006348241 and parameters: {'alpha': 0.7289715478604535, 'ties': 'breslow'}. Best is trial 13 with value: 0.8423527006348241.[0m
[32m[I 2022-04-21 11:41:24,499][0m Trial 866 finished with value: 0.842183674410227 and parameters: {'alpha': 0.5263313064154684, 'ties': 'breslow'}. Best is trial 13 with value: 0.8423527006348241.[0m
[32m[I 2022-04-21 11:41:24,937][0m Trial 867 finished with value: 0.842183674410227 and parameters: {'alpha': 0.3015643209960725, 'ties': 'breslow'}. Best is trial 13 with value: 0.8423527006348241.[0m
[32m[I 2022-04-21 11:41:25,191][0m Trial 868 finished with value: 0.8423527006348241 and parameters: {'alpha': 0.7636873766075556, 'ties': 'breslow'}. Best is trial 13 with value: 0.8423527006348241.[0m
[32m[I 2022-04-21 11:41:25,424][0m Trial 869 finished with value: 0.842183674410227 and parameters: {'alpha': 0.5556691379745171, 'ties': 'breslow'}. Best is trial 13 with value: 0.8423527006348241.[0m
[32m[I 2022-04-21 11:41:25,662][0m Trial 870 finished with value: 0.842183674410227 and parameters: {'alpha': 0.6764541753571764, 'ties': 'breslow'}. Best is trial 13 with value: 0.8423527006348241.[0m
[32m[I 2022-04-21 11:41:25,946][0m Trial 871 finished with value: 0.842183674410227 and parameters: {'alpha': 0.41858191534896094, 'ties': 'breslow'}. Best is trial 13 with value: 0.8423527006348241.[0m
[32m[I 2022-04-21 11:41:26,179][0m Trial 872 finished with value: 0.842183674410227 and parameters: {'alpha': 0.5897788473649602, 'ties': 'breslow'}. Best is trial 13 with value: 0.8423527006348241.[0m
[32m[I 2022-04-21 11:41:26,465][0m Trial 873 finished with value: 0.8423527006348241 and parameters: {'alpha': 0.7093154320138184, 'ties': 'breslow'}. Best is trial 13 with value: 0.8423527006348241.[0m
[32m[I 2022-04-21 11:41:26,671][0m Trial 874 finished with value: 0.842183674410227 and parameters: {'alpha': 0.6967658163022185, 'ties': 'breslow'}. Best is trial 13 with value: 0.8423527006348241.[0m
[32m[I 2022-04-21 11:41:26,870][0m Trial 875 finished with value: 0.8423527006348241 and parameters: {'alpha': 0.8137072020180646, 'ties': 'efron'}. Best is trial 13 with value: 0.8423527006348241.[0m
[32m[I 2022-04-21 11:41:27,170][0m Trial 876 finished with value: 0.8423527006348241 and parameters: {'alpha': 0.8063684077466675, 'ties': 'efron'}. Best is trial 13 with value: 0.8423527006348241.[0m
[32m[I 2022-04-21 11:41:27,410][0m Trial 877 finished with value: 0.8423527006348241 and parameters: {'alpha': 0.788090293105958, 'ties': 'efron'}. Best is trial 13 with value: 0.8423527006348241.[0m
[32m[I 2022-04-21 11:41:27,827][0m Trial 878 finished with value: 0.8423527006348241 and parameters: {'alpha': 0.7472036775241421, 'ties': 'efron'}. Best is trial 13 with value: 0.8423527006348241.[0m
[32m[I 2022-04-21 11:41:28,145][0m Trial 879 finished with value: 0.842183674410227 and parameters: {'alpha': 0.6267134604810024, 'ties': 'efron'}. Best is trial 13 with value: 0.8423527006348241.[0m
[32m[I 2022-04-21 11:41:28,303][0m Trial 880 finished with value: 0.842183674410227 and parameters: {'alpha': 0.629861413191225, 'ties': 'breslow'}. Best is trial 13 with value: 0.8423527006348241.[0m
[32m[I 2022-04-21 11:41:28,453][0m Trial 881 finished with value: 0.8414545406933376 and parameters: {'alpha': 0.9969542820400119, 'ties': 'breslow'}. Best is trial 13 with value: 0.8423527006348241.[0m
[32m[I 2022-04-21 11:41:28,596][0m Trial 882 finished with value: 0.8423527006348241 and parameters: {'alpha': 0.7925713677056376, 'ties': 'breslow'}. Best is trial 13 with value: 0.8423527006348241.[0m
[32m[I 2022-04-21 11:41:28,869][0m Trial 883 finished with value: 0.8414545406933376 and parameters: {'alpha': 0.9732695735529812, 'ties': 'breslow'}. Best is trial 13 with value: 0.8423527006348241.[0m
[32m[I 2022-04-21 11:41:29,272][0m Trial 884 finished with value: 0.8423527006348241 and parameters: {'alpha': 0.8000077145896501, 'ties': 'efron'}. Best is trial 13 with value: 0.8423527006348241.[0m
[32m[I 2022-04-21 11:41:29,520][0m Trial 885 finished with value: 0.842183674410227 and parameters: {'alpha': 0.4521099590431729, 'ties': 'efron'}. Best is trial 13 with value: 0.8423527006348241.[0m
[32m[I 2022-04-21 11:41:29,860][0m Trial 886 finished with value: 0.8413067259961411 and parameters: {'alpha': 2.333887956430982, 'ties': 'breslow'}. Best is trial 13 with value: 0.8423527006348241.[0m
[32m[I 2022-04-21 11:41:30,179][0m Trial 887 finished with value: 0.8423527006348241 and parameters: {'alpha': 0.8026744503360718, 'ties': 'breslow'}. Best is trial 13 with value: 0.8423527006348241.[0m
[32m[I 2022-04-21 11:41:30,378][0m Trial 888 finished with value: 0.8423527006348241 and parameters: {'alpha': 0.9207592056882999, 'ties': 'breslow'}. Best is trial 13 with value: 0.8423527006348241.[0m
[32m[I 2022-04-21 11:41:30,554][0m Trial 889 finished with value: 0.842183674410227 and parameters: {'alpha': 0.567486042862578, 'ties': 'efron'}. Best is trial 13 with value: 0.8423527006348241.[0m
[32m[I 2022-04-21 11:41:30,862][0m Trial 890 finished with value: 0.8414545406933376 and parameters: {'alpha': 1.115556511024308, 'ties': 'breslow'}. Best is trial 13 with value: 0.8423527006348241.[0m
[32m[I 2022-04-21 11:41:31,153][0m Trial 891 finished with value: 0.8423527006348241 and parameters: {'alpha': 0.7125931523230049, 'ties': 'breslow'}. Best is trial 13 with value: 0.8423527006348241.[0m
[32m[I 2022-04-21 11:41:31,461][0m Trial 892 finished with value: 0.8414545406933376 and parameters: {'alpha': 1.0615240215836974, 'ties': 'breslow'}. Best is trial 13 with value: 0.8423527006348241.[0m
[32m[I 2022-04-21 11:41:31,760][0m Trial 893 finished with value: 0.8423527006348241 and parameters: {'alpha': 0.8589768674316702, 'ties': 'breslow'}. Best is trial 13 with value: 0.8423527006348241.[0m
[32m[I 2022-04-21 11:41:32,062][0m Trial 894 finished with value: 0.842183674410227 and parameters: {'alpha': 0.6450917995871142, 'ties': 'efron'}. Best is trial 13 with value: 0.8423527006348241.[0m
[32m[I 2022-04-21 11:41:32,317][0m Trial 895 finished with value: 0.8423527006348241 and parameters: {'alpha': 0.847603578881646, 'ties': 'breslow'}. Best is trial 13 with value: 0.8423527006348241.[0m
[32m[I 2022-04-21 11:41:32,527][0m Trial 896 finished with value: 0.8414545406933376 and parameters: {'alpha': 1.1983677521346432, 'ties': 'breslow'}. Best is trial 13 with value: 0.8423527006348241.[0m
[32m[I 2022-04-21 11:41:32,686][0m Trial 897 finished with value: 0.8423527006348241 and parameters: {'alpha': 0.9030248074052033, 'ties': 'breslow'}. Best is trial 13 with value: 0.8423527006348241.[0m
[32m[I 2022-04-21 11:41:32,846][0m Trial 898 finished with value: 0.8423527006348241 and parameters: {'alpha': 0.6943710392803314, 'ties': 'efron'}. Best is trial 13 with value: 0.8423527006348241.[0m
[32m[I 2022-04-21 11:41:33,001][0m Trial 899 finished with value: 0.842183674410227 and parameters: {'alpha': 0.5306501058469761, 'ties': 'efron'}. Best is trial 13 with value: 0.8423527006348241.[0m
[32m[I 2022-04-21 11:41:33,183][0m Trial 900 finished with value: 0.8414545406933376 and parameters: {'alpha': 1.0379253657039884, 'ties': 'breslow'}. Best is trial 13 with value: 0.8423527006348241.[0m
[32m[I 2022-04-21 11:41:33,327][0m Trial 901 finished with value: 0.8423527006348241 and parameters: {'alpha': 0.912846456156529, 'ties': 'breslow'}. Best is trial 13 with value: 0.8423527006348241.[0m
[32m[I 2022-04-21 11:41:33,475][0m Trial 902 finished with value: 0.8423527006348241 and parameters: {'alpha': 0.8936555224343613, 'ties': 'breslow'}. Best is trial 13 with value: 0.8423527006348241.[0m
[32m[I 2022-04-21 11:41:33,650][0m Trial 903 finished with value: 0.8423527006348241 and parameters: {'alpha': 0.8510597993867177, 'ties': 'breslow'}. Best is trial 13 with value: 0.8423527006348241.[0m
[32m[I 2022-04-21 11:41:33,881][0m Trial 904 finished with value: 0.8423527006348241 and parameters: {'alpha': 0.7682411224830159, 'ties': 'breslow'}. Best is trial 13 with value: 0.8423527006348241.[0m
[32m[I 2022-04-21 11:41:34,045][0m Trial 905 finished with value: 0.8414545406933376 and parameters: {'alpha': 0.971762100426804, 'ties': 'breslow'}. Best is trial 13 with value: 0.8423527006348241.[0m
[32m[I 2022-04-21 11:41:34,289][0m Trial 906 finished with value: 0.842183674410227 and parameters: {'alpha': 0.6565354539268132, 'ties': 'breslow'}. Best is trial 13 with value: 0.8423527006348241.[0m
[32m[I 2022-04-21 11:41:34,500][0m Trial 907 finished with value: 0.842183674410227 and parameters: {'alpha': 0.47283494869810255, 'ties': 'efron'}. Best is trial 13 with value: 0.8423527006348241.[0m
[32m[I 2022-04-21 11:41:34,867][0m Trial 908 finished with value: 0.8423527006348241 and parameters: {'alpha': 0.7216274877090716, 'ties': 'efron'}. Best is trial 13 with value: 0.8423527006348241.[0m
[32m[I 2022-04-21 11:41:35,137][0m Trial 909 finished with value: 0.8423527006348241 and parameters: {'alpha': 0.8934124012594995, 'ties': 'breslow'}. Best is trial 13 with value: 0.8423527006348241.[0m
[32m[I 2022-04-21 11:41:35,437][0m Trial 910 finished with value: 0.8423527006348241 and parameters: {'alpha': 0.8780803761664561, 'ties': 'breslow'}. Best is trial 13 with value: 0.8423527006348241.[0m
[32m[I 2022-04-21 11:41:36,152][0m Trial 911 finished with value: 0.8414545406933376 and parameters: {'alpha': 0.9940434407419592, 'ties': 'breslow'}. Best is trial 13 with value: 0.8423527006348241.[0m
[32m[I 2022-04-21 11:41:36,870][0m Trial 912 finished with value: 0.842183674410227 and parameters: {'alpha': 0.5909263414094177, 'ties': 'efron'}. Best is trial 13 with value: 0.8423527006348241.[0m
[32m[I 2022-04-21 11:41:37,175][0m Trial 913 finished with value: 0.8423527006348241 and parameters: {'alpha': 0.8167176982800904, 'ties': 'breslow'}. Best is trial 13 with value: 0.8423527006348241.[0m
[32m[I 2022-04-21 11:41:37,509][0m Trial 914 finished with value: 0.8423527006348241 and parameters: {'alpha': 0.6976531461082884, 'ties': 'efron'}. Best is trial 13 with value: 0.8423527006348241.[0m
[32m[I 2022-04-21 11:41:37,767][0m Trial 915 finished with value: 0.8423527006348241 and parameters: {'alpha': 0.7862093993150739, 'ties': 'breslow'}. Best is trial 13 with value: 0.8423527006348241.[0m
[32m[I 2022-04-21 11:41:37,907][0m Trial 916 finished with value: 0.842183674410227 and parameters: {'alpha': 0.6217686750317355, 'ties': 'breslow'}. Best is trial 13 with value: 0.8423527006348241.[0m
[32m[I 2022-04-21 11:41:38,238][0m Trial 917 finished with value: 0.8423527006348241 and parameters: {'alpha': 0.7059080106885198, 'ties': 'breslow'}. Best is trial 13 with value: 0.8423527006348241.[0m
[32m[I 2022-04-21 11:41:38,435][0m Trial 918 finished with value: 0.842183674410227 and parameters: {'alpha': 0.508286260605235, 'ties': 'breslow'}. Best is trial 13 with value: 0.8423527006348241.[0m
[32m[I 2022-04-21 11:41:38,627][0m Trial 919 finished with value: 0.8414545406933376 and parameters: {'alpha': 1.0504923391431493, 'ties': 'breslow'}. Best is trial 13 with value: 0.8423527006348241.[0m
[32m[I 2022-04-21 11:41:38,806][0m Trial 920 finished with value: 0.8423527006348241 and parameters: {'alpha': 0.7721953196593148, 'ties': 'breslow'}. Best is trial 13 with value: 0.8423527006348241.[0m
[32m[I 2022-04-21 11:41:39,003][0m Trial 921 finished with value: 0.842183674410227 and parameters: {'alpha': 0.6090294610034378, 'ties': 'breslow'}. Best is trial 13 with value: 0.8423527006348241.[0m
[32m[I 2022-04-21 11:41:39,242][0m Trial 922 finished with value: 0.8423527006348241 and parameters: {'alpha': 0.7224893512723612, 'ties': 'efron'}. Best is trial 13 with value: 0.8423527006348241.[0m
[32m[I 2022-04-21 11:41:39,425][0m Trial 923 finished with value: 0.8423527006348241 and parameters: {'alpha': 0.8753134958497283, 'ties': 'breslow'}. Best is trial 13 with value: 0.8423527006348241.[0m
[32m[I 2022-04-21 11:41:39,623][0m Trial 924 finished with value: 0.841305818515095 and parameters: {'alpha': 3.069891379781301, 'ties': 'breslow'}. Best is trial 13 with value: 0.8423527006348241.[0m
[32m[I 2022-04-21 11:41:39,830][0m Trial 925 finished with value: 0.841474844739692 and parameters: {'alpha': 2.6583601692453875, 'ties': 'efron'}. Best is trial 13 with value: 0.8423527006348241.[0m
[32m[I 2022-04-21 11:41:40,031][0m Trial 926 finished with value: 0.8414545406933376 and parameters: {'alpha': 0.9822774438016432, 'ties': 'breslow'}. Best is trial 13 with value: 0.8423527006348241.[0m
[32m[I 2022-04-21 11:41:40,469][0m Trial 927 finished with value: 0.8423527006348241 and parameters: {'alpha': 0.7991344351360616, 'ties': 'efron'}. Best is trial 13 with value: 0.8423527006348241.[0m
[32m[I 2022-04-21 11:41:40,740][0m Trial 928 finished with value: 0.8414545406933376 and parameters: {'alpha': 0.9436924210550915, 'ties': 'breslow'}. Best is trial 13 with value: 0.8423527006348241.[0m
[32m[I 2022-04-21 11:41:40,925][0m Trial 929 finished with value: 0.842183674410227 and parameters: {'alpha': 0.6988953964389285, 'ties': 'breslow'}. Best is trial 13 with value: 0.8423527006348241.[0m
[32m[I 2022-04-21 11:41:41,212][0m Trial 930 finished with value: 0.8423527006348241 and parameters: {'alpha': 0.7857535643503895, 'ties': 'breslow'}. Best is trial 13 with value: 0.8423527006348241.[0m
[32m[I 2022-04-21 11:41:41,411][0m Trial 931 finished with value: 0.842183674410227 and parameters: {'alpha': 0.6066603070067152, 'ties': 'breslow'}. Best is trial 13 with value: 0.8423527006348241.[0m
[32m[I 2022-04-21 11:41:41,785][0m Trial 932 finished with value: 0.842183674410227 and parameters: {'alpha': 0.40734525393103393, 'ties': 'efron'}. Best is trial 13 with value: 0.8423527006348241.[0m
[32m[I 2022-04-21 11:41:41,994][0m Trial 933 finished with value: 0.841305818515095 and parameters: {'alpha': 3.280782955159019, 'ties': 'efron'}. Best is trial 13 with value: 0.8423527006348241.[0m
[32m[I 2022-04-21 11:41:42,227][0m Trial 934 finished with value: 0.8423527006348241 and parameters: {'alpha': 0.7085975692952532, 'ties': 'breslow'}. Best is trial 13 with value: 0.8423527006348241.[0m
[32m[I 2022-04-21 11:41:42,478][0m Trial 935 finished with value: 0.842183674410227 and parameters: {'alpha': 0.5138416493505655, 'ties': 'breslow'}. Best is trial 13 with value: 0.8423527006348241.[0m
[32m[I 2022-04-21 11:41:42,663][0m Trial 936 finished with value: 0.8423527006348241 and parameters: {'alpha': 0.8260927281330056, 'ties': 'efron'}. Best is trial 13 with value: 0.8423527006348241.[0m
[32m[I 2022-04-21 11:41:43,091][0m Trial 937 finished with value: 0.8423527006348241 and parameters: {'alpha': 0.8387257858322834, 'ties': 'efron'}. Best is trial 13 with value: 0.8423527006348241.[0m
[32m[I 2022-04-21 11:41:43,449][0m Trial 938 finished with value: 0.842183674410227 and parameters: {'alpha': 0.6224320027480494, 'ties': 'efron'}. Best is trial 13 with value: 0.8423527006348241.[0m
[32m[I 2022-04-21 11:41:43,842][0m Trial 939 finished with value: 0.8423527006348241 and parameters: {'alpha': 0.7290787635155268, 'ties': 'efron'}. Best is trial 13 with value: 0.8423527006348241.[0m
[32m[I 2022-04-21 11:41:44,169][0m Trial 940 finished with value: 0.8423527006348241 and parameters: {'alpha': 0.9105260111586527, 'ties': 'breslow'}. Best is trial 13 with value: 0.8423527006348241.[0m
[32m[I 2022-04-21 11:41:44,486][0m Trial 941 finished with value: 0.8414545406933376 and parameters: {'alpha': 0.8925268170880363, 'ties': 'efron'}. Best is trial 13 with value: 0.8423527006348241.[0m
[32m[I 2022-04-21 11:41:44,756][0m Trial 942 finished with value: 0.8414545406933376 and parameters: {'alpha': 1.1231776333356058, 'ties': 'efron'}. Best is trial 13 with value: 0.8423527006348241.[0m
[32m[I 2022-04-21 11:41:45,065][0m Trial 943 finished with value: 0.8414545406933376 and parameters: {'alpha': 0.9816256293251359, 'ties': 'efron'}. Best is trial 13 with value: 0.8423527006348241.[0m
[32m[I 2022-04-21 11:41:45,220][0m Trial 944 finished with value: 0.841474844739692 and parameters: {'alpha': 2.811769341294142, 'ties': 'efron'}. Best is trial 13 with value: 0.8423527006348241.[0m
[32m[I 2022-04-21 11:41:45,499][0m Trial 945 finished with value: 0.8423527006348241 and parameters: {'alpha': 0.8438197046784238, 'ties': 'efron'}. Best is trial 13 with value: 0.8423527006348241.[0m
[32m[I 2022-04-21 11:41:45,669][0m Trial 946 finished with value: 0.8423527006348241 and parameters: {'alpha': 0.8647257608047472, 'ties': 'breslow'}. Best is trial 13 with value: 0.8423527006348241.[0m
[32m[I 2022-04-21 11:41:46,035][0m Trial 947 finished with value: 0.8423527006348241 and parameters: {'alpha': 0.855570374349773, 'ties': 'efron'}. Best is trial 13 with value: 0.8423527006348241.[0m
[32m[I 2022-04-21 11:41:46,610][0m Trial 948 finished with value: 0.8414545406933376 and parameters: {'alpha': 0.915101960577072, 'ties': 'efron'}. Best is trial 13 with value: 0.8423527006348241.[0m
[32m[I 2022-04-21 11:41:47,041][0m Trial 949 finished with value: 0.8407234838742553 and parameters: {'alpha': 3.7260817810329625, 'ties': 'efron'}. Best is trial 13 with value: 0.8423527006348241.[0m
[32m[I 2022-04-21 11:41:47,265][0m Trial 950 finished with value: 0.842183674410227 and parameters: {'alpha': 0.23407265957709744, 'ties': 'efron'}. Best is trial 13 with value: 0.8423527006348241.[0m
[32m[I 2022-04-21 11:41:47,499][0m Trial 951 finished with value: 0.842183674410227 and parameters: {'alpha': 0.5352329828525291, 'ties': 'efron'}. Best is trial 13 with value: 0.8423527006348241.[0m
[32m[I 2022-04-21 11:41:47,791][0m Trial 952 finished with value: 0.842183674410227 and parameters: {'alpha': 0.5938493031091598, 'ties': 'efron'}. Best is trial 13 with value: 0.8423527006348241.[0m
[32m[I 2022-04-21 11:41:48,322][0m Trial 953 finished with value: 0.8423527006348241 and parameters: {'alpha': 0.7982494872394702, 'ties': 'efron'}. Best is trial 13 with value: 0.8423527006348241.[0m
[32m[I 2022-04-21 11:41:48,704][0m Trial 954 finished with value: 0.8407234838742553 and parameters: {'alpha': 4.4582678368334285, 'ties': 'breslow'}. Best is trial 13 with value: 0.8423527006348241.[0m
[32m[I 2022-04-21 11:41:49,171][0m Trial 955 finished with value: 0.842183674410227 and parameters: {'alpha': 0.6912826911795671, 'ties': 'efron'}. Best is trial 13 with value: 0.8423527006348241.[0m
[32m[I 2022-04-21 11:41:49,400][0m Trial 956 finished with value: 0.8423527006348241 and parameters: {'alpha': 0.7517175762114741, 'ties': 'breslow'}. Best is trial 13 with value: 0.8423527006348241.[0m
[32m[I 2022-04-21 11:41:49,820][0m Trial 957 finished with value: 0.8423527006348241 and parameters: {'alpha': 0.741623166514551, 'ties': 'efron'}. Best is trial 13 with value: 0.8423527006348241.[0m
[32m[I 2022-04-21 11:41:50,031][0m Trial 958 finished with value: 0.8423527006348241 and parameters: {'alpha': 0.7368693337372081, 'ties': 'efron'}. Best is trial 13 with value: 0.8423527006348241.[0m
[32m[I 2022-04-21 11:41:50,296][0m Trial 959 finished with value: 0.8414545406933376 and parameters: {'alpha': 1.045182814916493, 'ties': 'breslow'}. Best is trial 13 with value: 0.8423527006348241.[0m
[32m[I 2022-04-21 11:41:50,451][0m Trial 960 finished with value: 0.842183674410227 and parameters: {'alpha': 0.631615210631531, 'ties': 'efron'}. Best is trial 13 with value: 0.8423527006348241.[0m
[32m[I 2022-04-21 11:41:50,683][0m Trial 961 finished with value: 0.8423527006348241 and parameters: {'alpha': 0.7585351833113122, 'ties': 'efron'}. Best is trial 13 with value: 0.8423527006348241.[0m
[32m[I 2022-04-21 11:41:50,839][0m Trial 962 finished with value: 0.8414545406933376 and parameters: {'alpha': 1.022275419666723, 'ties': 'efron'}. Best is trial 13 with value: 0.8423527006348241.[0m
