[32m[I 2022-04-21 12:05:15,615][0m Trial 31 finished with value: 0.7063784364565897 and parameters: {'loss': 'coxph', 'learning_rate': 0.00010490494323060465, 'n_estimators': 619, 'criterion': 'absolute_error', 'min_samples_split': 7, 'min_samples_leaf': 1, 'min_weight_fraction_leaf': 0.29659307360250875, 'min_impurity_decrease': 0.10890585103804454, 'max_features': 0.20343359739632394, 'subsample': 0.8237759587261504, 'dropout_rate': 0.7239349094174542, 'ccp_alpha': 0.017974084184477324}. Best is trial 11 with value: 0.8450457333064163.[0m
[32m[I 2022-04-21 12:05:53,438][0m Trial 32 finished with value: 0.7063784364565897 and parameters: {'loss': 'coxph', 'learning_rate': 7.292905970838798e-05, 'n_estimators': 626, 'criterion': 'absolute_error', 'min_samples_split': 6, 'min_samples_leaf': 1, 'min_weight_fraction_leaf': 0.30734683413889063, 'min_impurity_decrease': 0.11445495827816071, 'max_features': 0.22957389616364066, 'subsample': 0.815738890032908, 'dropout_rate': 0.7466293488661905, 'ccp_alpha': 0.004333266198572883}. Best is trial 11 with value: 0.8450457333064163.[0m
[32m[I 2022-04-21 12:06:41,592][0m Trial 33 finished with value: 0.7318450474400788 and parameters: {'loss': 'coxph', 'learning_rate': 9.406166542475209e-05, 'n_estimators': 668, 'criterion': 'absolute_error', 'min_samples_split': 6, 'min_samples_leaf': 1, 'min_weight_fraction_leaf': 0.28800966653239773, 'min_impurity_decrease': 0.08376917555993543, 'max_features': 0.18579570542342175, 'subsample': 0.6063347772037162, 'dropout_rate': 0.7281050792777558, 'ccp_alpha': 0.003327898781520816}. Best is trial 11 with value: 0.8450457333064163.[0m
[32m[I 2022-04-21 12:07:50,640][0m Trial 34 finished with value: 0.65 and parameters: {'loss': 'coxph', 'learning_rate': 0.00015629872503459904, 'n_estimators': 708, 'criterion': 'absolute_error', 'min_samples_split': 7, 'min_samples_leaf': 1, 'min_weight_fraction_leaf': 0.12921925366035003, 'min_impurity_decrease': 0.046572767991586106, 'max_features': 0.11687903493040876, 'subsample': 0.40549765582001973, 'dropout_rate': 0.7144802105047813, 'ccp_alpha': 0.5676167907676278}. Best is trial 11 with value: 0.8450457333064163.[0m
[32m[I 2022-04-21 12:08:44,000][0m Trial 35 finished with value: 0.65 and parameters: {'loss': 'coxph', 'learning_rate': 5.646637768920723e-05, 'n_estimators': 822, 'criterion': 'absolute_error', 'min_samples_split': 6, 'min_samples_leaf': 1, 'min_weight_fraction_leaf': 0.25501239671499953, 'min_impurity_decrease': 0.1981983583513366, 'max_features': 0.9664703997279154, 'subsample': 0.6130767086578817, 'dropout_rate': 0.8167806395121049, 'ccp_alpha': 0.4420417768553491}. Best is trial 11 with value: 0.8450457333064163.[0m
[32m[I 2022-04-21 12:08:59,621][0m Trial 36 finished with value: 0.65 and parameters: {'loss': 'coxph', 'learning_rate': 2.2965350778766654e-05, 'n_estimators': 509, 'criterion': 'squared_error', 'min_samples_split': 6, 'min_samples_leaf': 3, 'min_weight_fraction_leaf': 0.34633455115104406, 'min_impurity_decrease': 0.013921982786174056, 'max_features': 0.22167416684032065, 'subsample': 0.7156938867277233, 'dropout_rate': 0.8990041688561674, 'ccp_alpha': 0.7571632464537875}. Best is trial 11 with value: 0.8450457333064163.[0m
/media/san2_ssd/data/Workdir/survival/venv/lib/python3.8/site-packages/sksurv/ensemble/boosting.py:955: RuntimeWarning: divide by zero encountered in log
  time = numpy.log(time)
/media/san2_ssd/data/Workdir/survival/venv/lib/python3.8/site-packages/sksurv/ensemble/boosting.py:955: RuntimeWarning: divide by zero encountered in log
  time = numpy.log(time)
/media/san2_ssd/data/Workdir/survival/venv/lib/python3.8/site-packages/sksurv/ensemble/boosting.py:955: RuntimeWarning: divide by zero encountered in log
  time = numpy.log(time)
/media/san2_ssd/data/Workdir/survival/venv/lib/python3.8/site-packages/sksurv/ensemble/boosting.py:955: RuntimeWarning: divide by zero encountered in log
  time = numpy.log(time)
[32m[I 2022-04-21 12:09:00,986][0m Trial 37 finished with value: -0.4598665909009626 and parameters: {'loss': 'squared', 'learning_rate': 0.00013399037496993415, 'n_estimators': 258, 'criterion': 'absolute_error', 'min_samples_split': 7, 'min_samples_leaf': 1, 'min_weight_fraction_leaf': 0.2907999149632394, 'min_impurity_decrease': 0.10041544762556481, 'max_features': 0.1769800433911998, 'subsample': 0.9056112610485285, 'dropout_rate': 0.8858575454022104, 'ccp_alpha': 0.3059656475472645}. Best is trial 11 with value: 0.8450457333064163.[0m
[32m[I 2022-04-21 12:09:28,029][0m Trial 38 finished with value: 0.65 and parameters: {'loss': 'coxph', 'learning_rate': 4.40768085654087e-06, 'n_estimators': 444, 'criterion': 'friedman_mse', 'min_samples_split': 5, 'min_samples_leaf': 9, 'min_weight_fraction_leaf': 0.2026192495901471, 'min_impurity_decrease': 0.3071090101002885, 'max_features': 0.10438881920623888, 'subsample': 0.5041411439720156, 'dropout_rate': 0.6966155790070633, 'ccp_alpha': 0.6273405797054215}. Best is trial 11 with value: 0.8450457333064163.[0m
[32m[I 2022-04-21 12:10:15,484][0m Trial 39 finished with value: 0.65 and parameters: {'loss': 'coxph', 'learning_rate': 3.4549103494664537e-05, 'n_estimators': 658, 'criterion': 'absolute_error', 'min_samples_split': 5, 'min_samples_leaf': 4, 'min_weight_fraction_leaf': 0.3738358170520099, 'min_impurity_decrease': 0.2062341152329968, 'max_features': 0.2652195556944701, 'subsample': 0.22422825011488898, 'dropout_rate': 0.7698216497089616, 'ccp_alpha': 1.0663635636275963}. Best is trial 11 with value: 0.8450457333064163.[0m
/media/san2_ssd/data/Workdir/survival/venv/lib/python3.8/site-packages/sksurv/ensemble/boosting.py:955: RuntimeWarning: divide by zero encountered in log
  time = numpy.log(time)
/media/san2_ssd/data/Workdir/survival/venv/lib/python3.8/site-packages/sksurv/ensemble/boosting.py:955: RuntimeWarning: divide by zero encountered in log
  time = numpy.log(time)
/media/san2_ssd/data/Workdir/survival/venv/lib/python3.8/site-packages/sksurv/ensemble/boosting.py:955: RuntimeWarning: divide by zero encountered in log
  time = numpy.log(time)
/media/san2_ssd/data/Workdir/survival/venv/lib/python3.8/site-packages/sksurv/ensemble/boosting.py:955: RuntimeWarning: divide by zero encountered in log
  time = numpy.log(time)
[32m[I 2022-04-21 12:10:28,472][0m Trial 40 finished with value: -0.45 and parameters: {'loss': 'squared', 'learning_rate': 8.593759363888058e-05, 'n_estimators': 544, 'criterion': 'squared_error', 'min_samples_split': 6, 'min_samples_leaf': 2, 'min_weight_fraction_leaf': 0.10334111214368948, 'min_impurity_decrease': 0.7321010590080123, 'max_features': 0.3518797470281283, 'subsample': 0.39816019262551605, 'dropout_rate': 0.08355451050704321, 'ccp_alpha': 2.9263874962127083}. Best is trial 11 with value: 0.8450457333064163.[0m
[32m[I 2022-04-21 12:11:16,408][0m Trial 41 finished with value: 0.7063784364565897 and parameters: {'loss': 'coxph', 'learning_rate': 1.1137806202196927e-05, 'n_estimators': 607, 'criterion': 'absolute_error', 'min_samples_split': 7, 'min_samples_leaf': 1, 'min_weight_fraction_leaf': 0.30296408724789964, 'min_impurity_decrease': 0.11848184372878844, 'max_features': 0.21459498475019814, 'subsample': 0.8186367972305962, 'dropout_rate': 0.7685917182315295, 'ccp_alpha': 0.016546142309198097}. Best is trial 11 with value: 0.8450457333064163.[0m
[32m[I 2022-04-21 12:12:23,144][0m Trial 42 finished with value: 0.65 and parameters: {'loss': 'coxph', 'learning_rate': 1.3527807869313063e-05, 'n_estimators': 854, 'criterion': 'absolute_error', 'min_samples_split': 7, 'min_samples_leaf': 1, 'min_weight_fraction_leaf': 0.22902759140906404, 'min_impurity_decrease': 0.07252712657093956, 'max_features': 0.08226765583768793, 'subsample': 0.8808386680209308, 'dropout_rate': 0.7735739822689823, 'ccp_alpha': 0.2760712903255229}. Best is trial 11 with value: 0.8450457333064163.[0m
[32m[I 2022-04-21 12:12:52,504][0m Trial 43 finished with value: 0.7184576953372587 and parameters: {'loss': 'coxph', 'learning_rate': 0.00010062322750163032, 'n_estimators': 634, 'criterion': 'absolute_error', 'min_samples_split': 6, 'min_samples_leaf': 1, 'min_weight_fraction_leaf': 0.26624703897184204, 'min_impurity_decrease': 0.10872636892810517, 'max_features': 0.149487944138478, 'subsample': 0.6337280388223885, 'dropout_rate': 0.8544850215118691, 'ccp_alpha': 0.10889456283372656}. Best is trial 11 with value: 0.8450457333064163.[0m
[32m[I 2022-04-21 12:13:27,547][0m Trial 44 finished with value: 0.65 and parameters: {'loss': 'coxph', 'learning_rate': 0.00039014802652984217, 'n_estimators': 699, 'criterion': 'absolute_error', 'min_samples_split': 8, 'min_samples_leaf': 2, 'min_weight_fraction_leaf': 0.26638782698067315, 'min_impurity_decrease': 0.0017237408893972933, 'max_features': 0.13793221960230623, 'subsample': 0.6215006167153028, 'dropout_rate': 0.8472632474560677, 'ccp_alpha': 0.5373471153448564}. Best is trial 11 with value: 0.8450457333064163.[0m
[32m[I 2022-04-21 12:14:07,690][0m Trial 45 finished with value: 0.7065714617798216 and parameters: {'loss': 'coxph', 'learning_rate': 0.0002402964008274283, 'n_estimators': 898, 'criterion': 'absolute_error', 'min_samples_split': 6, 'min_samples_leaf': 1, 'min_weight_fraction_leaf': 0.15295282197873608, 'min_impurity_decrease': 0.047702560084991213, 'max_features': 0.3020189797136257, 'subsample': 0.4946134639809664, 'dropout_rate': 0.9306869905069474, 'ccp_alpha': 0.18934693317825005}. Best is trial 11 with value: 0.8450457333064163.[0m
[32m[I 2022-04-21 12:14:42,157][0m Trial 46 finished with value: 0.65 and parameters: {'loss': 'coxph', 'learning_rate': 0.00024789719614778336, 'n_estimators': 897, 'criterion': 'friedman_mse', 'min_samples_split': 5, 'min_samples_leaf': 2, 'min_weight_fraction_leaf': 0.060151087650298085, 'min_impurity_decrease': 0.03528050278548556, 'max_features': 0.29588639933733063, 'subsample': 0.5211858996469074, 'dropout_rate': 0.9278009654263687, 'ccp_alpha': 0.7822685101771573}. Best is trial 11 with value: 0.8450457333064163.[0m
[32m[I 2022-04-21 12:15:01,431][0m Trial 47 finished with value: 0.65 and parameters: {'loss': 'coxph', 'learning_rate': 0.0007004090343186146, 'n_estimators': 784, 'criterion': 'absolute_error', 'min_samples_split': 6, 'min_samples_leaf': 4, 'min_weight_fraction_leaf': 0.13843985229842534, 'min_impurity_decrease': 0.2505407244340153, 'max_features': 0.4427415951398282, 'subsample': 0.4555950088212194, 'dropout_rate': 0.9886907327899244, 'ccp_alpha': 3.6828457227771896}. Best is trial 11 with value: 0.8450457333064163.[0m
[32m[I 2022-04-21 12:16:09,087][0m Trial 48 finished with value: 0.8447111760684105 and parameters: {'loss': 'coxph', 'learning_rate': 4.5026480396999076e-05, 'n_estimators': 948, 'criterion': 'friedman_mse', 'min_samples_split': 5, 'min_samples_leaf': 1, 'min_weight_fraction_leaf': 0.15920122543365456, 'min_impurity_decrease': 0.9038967046203528, 'max_features': 0.39489934587049835, 'subsample': 0.07609249540973317, 'dropout_rate': 0.8483404461542263, 'ccp_alpha': 0.23297508274287201}. Best is trial 11 with value: 0.8450457333064163.[0m
[32m[I 2022-04-21 12:16:55,641][0m Trial 49 finished with value: 0.65 and parameters: {'loss': 'coxph', 'learning_rate': 0.010932034236426556, 'n_estimators': 755, 'criterion': 'friedman_mse', 'min_samples_split': 4, 'min_samples_leaf': 3, 'min_weight_fraction_leaf': 0.2047312831654977, 'min_impurity_decrease': 0.8144077161055282, 'max_features': 0.3872344321880715, 'subsample': 0.0636168945508329, 'dropout_rate': 0.8404805640647441, 'ccp_alpha': 4.6685079756678345}. Best is trial 11 with value: 0.8450457333064163.[0m
[32m[I 2022-04-21 12:17:10,858][0m Trial 50 finished with value: 0.65 and parameters: {'loss': 'coxph', 'learning_rate': 4.571204848481035e-05, 'n_estimators': 350, 'criterion': 'friedman_mse', 'min_samples_split': 5, 'min_samples_leaf': 2, 'min_weight_fraction_leaf': 0.19190388331259053, 'min_impurity_decrease': 0.4227467137065098, 'max_features': 0.643143631994357, 'subsample': 0.09800080038345288, 'dropout_rate': 0.6685398979667684, 'ccp_alpha': 1.268026363391108}. Best is trial 11 with value: 0.8450457333064163.[0m
[32m[I 2022-04-21 12:18:07,305][0m Trial 51 finished with value: 0.7347013360936214 and parameters: {'loss': 'coxph', 'learning_rate': 0.0001854602877824734, 'n_estimators': 922, 'criterion': 'friedman_mse', 'min_samples_split': 6, 'min_samples_leaf': 1, 'min_weight_fraction_leaf': 0.1650881706210826, 'min_impurity_decrease': 0.7762646427738927, 'max_features': 0.3002527675265874, 'subsample': 0.28452096313148667, 'dropout_rate': 0.8881716233195839, 'ccp_alpha': 0.2608958362021064}. Best is trial 11 with value: 0.8450457333064163.[0m
[32m[I 2022-04-21 12:19:06,710][0m Trial 52 finished with value: 0.7137639036402658 and parameters: {'loss': 'coxph', 'learning_rate': 0.00015024764990076637, 'n_estimators': 955, 'criterion': 'friedman_mse', 'min_samples_split': 5, 'min_samples_leaf': 1, 'min_weight_fraction_leaf': 0.10815594326058373, 'min_impurity_decrease': 0.8900162080786269, 'max_features': 0.36987784834742865, 'subsample': 0.2407934021296311, 'dropout_rate': 0.859728547662517, 'ccp_alpha': 0.4097552741629241}. Best is trial 11 with value: 0.8450457333064163.[0m
[32m[I 2022-04-21 12:19:39,017][0m Trial 53 finished with value: 0.8395425806204566 and parameters: {'loss': 'coxph', 'learning_rate': 2.307063343599534e-05, 'n_estimators': 704, 'criterion': 'friedman_mse', 'min_samples_split': 6, 'min_samples_leaf': 1, 'min_weight_fraction_leaf': 0.05955214453099139, 'min_impurity_decrease': 0.8935390588616122, 'max_features': 0.16667158197254034, 'subsample': 0.06623013822955616, 'dropout_rate': 0.8895811144557275, 'ccp_alpha': 0.6267242106279649}. Best is trial 11 with value: 0.8450457333064163.[0m
[32m[I 2022-04-21 12:20:15,545][0m Trial 54 finished with value: 0.7199611074232295 and parameters: {'loss': 'coxph', 'learning_rate': 2.727592783701999e-05, 'n_estimators': 719, 'criterion': 'friedman_mse', 'min_samples_split': 5, 'min_samples_leaf': 2, 'min_weight_fraction_leaf': 0.06026883465074519, 'min_impurity_decrease': 0.9912699879590349, 'max_features': 0.5232347286383155, 'subsample': 0.11276271299994761, 'dropout_rate': 0.8931556753371187, 'ccp_alpha': 0.6224868859005966}. Best is trial 11 with value: 0.8450457333064163.[0m
[32m[I 2022-04-21 12:21:00,095][0m Trial 55 finished with value: 0.6553199130170017 and parameters: {'loss': 'coxph', 'learning_rate': 2.35986796995981e-05, 'n_estimators': 893, 'criterion': 'friedman_mse', 'min_samples_split': 4, 'min_samples_leaf': 1, 'min_weight_fraction_leaf': 0.015444767604842972, 'min_impurity_decrease': 0.9171128118867831, 'max_features': 0.06519574844006634, 'subsample': 0.11080433192650647, 'dropout_rate': 0.9420903566068252, 'ccp_alpha': 0.9595937130259306}. Best is trial 11 with value: 0.8450457333064163.[0m
/media/san2_ssd/data/Workdir/survival/venv/lib/python3.8/site-packages/sksurv/ensemble/boosting.py:955: RuntimeWarning: divide by zero encountered in log
  time = numpy.log(time)
/media/san2_ssd/data/Workdir/survival/venv/lib/python3.8/site-packages/sksurv/ensemble/boosting.py:955: RuntimeWarning: divide by zero encountered in log
  time = numpy.log(time)
/media/san2_ssd/data/Workdir/survival/venv/lib/python3.8/site-packages/sksurv/ensemble/boosting.py:955: RuntimeWarning: divide by zero encountered in log
  time = numpy.log(time)
/media/san2_ssd/data/Workdir/survival/venv/lib/python3.8/site-packages/sksurv/ensemble/boosting.py:955: RuntimeWarning: divide by zero encountered in log
  time = numpy.log(time)
[32m[I 2022-04-21 12:21:06,997][0m Trial 56 finished with value: -0.46566001718838307 and parameters: {'loss': 'squared', 'learning_rate': 3.4262870193058477e-06, 'n_estimators': 718, 'criterion': 'friedman_mse', 'min_samples_split': 5, 'min_samples_leaf': 2, 'min_weight_fraction_leaf': 0.059795925326671676, 'min_impurity_decrease': 0.9819713430450501, 'max_features': 0.5242795119721504, 'subsample': 0.051282243026997604, 'dropout_rate': 0.9077578269392007, 'ccp_alpha': 0.6097624166280291}. Best is trial 11 with value: 0.8450457333064163.[0m
[32m[I 2022-04-21 12:22:01,817][0m Trial 57 finished with value: 0.65 and parameters: {'loss': 'coxph', 'learning_rate': 1.6118776258732868e-05, 'n_estimators': 795, 'criterion': 'friedman_mse', 'min_samples_split': 5, 'min_samples_leaf': 2, 'min_weight_fraction_leaf': 0.036517398231444426, 'min_impurity_decrease': 0.7875257085021077, 'max_features': 0.2655214343904956, 'subsample': 0.12848889765565552, 'dropout_rate': 0.8240645273995681, 'ccp_alpha': 1.7093752472447334}. Best is trial 11 with value: 0.8450457333064163.[0m
[32m[I 2022-04-21 12:23:28,561][0m Trial 58 finished with value: 0.65 and parameters: {'loss': 'coxph', 'learning_rate': 1.6669966583154889e-06, 'n_estimators': 985, 'criterion': 'friedman_mse', 'min_samples_split': 4, 'min_samples_leaf': 1, 'min_weight_fraction_leaf': 0.07671451683604863, 'min_impurity_decrease': 0.8307992579293513, 'max_features': 0.5913311309154354, 'subsample': 0.00522222282336432, 'dropout_rate': 0.8795642338401594, 'ccp_alpha': 1.120934366176619}. Best is trial 11 with value: 0.8450457333064163.[0m
[32m[I 2022-04-21 12:24:50,090][0m Trial 59 finished with value: 0.7130790730908624 and parameters: {'loss': 'coxph', 'learning_rate': 9.042738805406353e-06, 'n_estimators': 570, 'criterion': 'friedman_mse', 'min_samples_split': 5, 'min_samples_leaf': 5, 'min_weight_fraction_leaf': 0.08446834270735507, 'min_impurity_decrease': 0.9375560644914088, 'max_features': 0.3207167595280769, 'subsample': 0.21778908962145532, 'dropout_rate': 0.32094592724276705, 'ccp_alpha': 0.39900967732628595}. Best is trial 11 with value: 0.8450457333064163.[0m
[32m[I 2022-04-21 12:24:53,415][0m Trial 60 finished with value: 0.65 and parameters: {'loss': 'coxph', 'learning_rate': 2.797032718484699e-05, 'n_estimators': 198, 'criterion': 'friedman_mse', 'min_samples_split': 7, 'min_samples_leaf': 1, 'min_weight_fraction_leaf': 0.02749434726096414, 'min_impurity_decrease': 0.8589156280664585, 'max_features': 0.4092287306745457, 'subsample': 0.2655494351812248, 'dropout_rate': 0.9698231225913143, 'ccp_alpha': 2.512379835500711}. Best is trial 11 with value: 0.8450457333064163.[0m
[32m[I 2022-04-21 12:26:08,960][0m Trial 61 finished with value: 0.8446681003756943 and parameters: {'loss': 'coxph', 'learning_rate': 4.974866118072741e-05, 'n_estimators': 838, 'criterion': 'friedman_mse', 'min_samples_split': 6, 'min_samples_leaf': 2, 'min_weight_fraction_leaf': 0.12205189621992063, 'min_impurity_decrease': 0.5684460223537933, 'max_features': 0.44944565834138117, 'subsample': 0.08238652775820385, 'dropout_rate': 0.7952554115796422, 'ccp_alpha': 0.221315053984052}. Best is trial 11 with value: 0.8450457333064163.[0m
[32m[I 2022-04-21 12:27:01,804][0m Trial 62 finished with value: 0.8417445344701392 and parameters: {'loss': 'coxph', 'learning_rate': 5.6471728405184e-05, 'n_estimators': 838, 'criterion': 'friedman_mse', 'min_samples_split': 6, 'min_samples_leaf': 3, 'min_weight_fraction_leaf': 0.12254214934937507, 'min_impurity_decrease': 0.5276762974496935, 'max_features': 0.5080042247296229, 'subsample': 0.15006317973395655, 'dropout_rate': 0.8067778009861477, 'ccp_alpha': 0.2235979339747223}. Best is trial 11 with value: 0.8450457333064163.[0m
[32m[I 2022-04-21 12:28:14,495][0m Trial 63 finished with value: 0.8443722648965325 and parameters: {'loss': 'coxph', 'learning_rate': 5.6782571536287494e-05, 'n_estimators': 852, 'criterion': 'friedman_mse', 'min_samples_split': 6, 'min_samples_leaf': 3, 'min_weight_fraction_leaf': 0.11825262690243861, 'min_impurity_decrease': 0.5460321471422314, 'max_features': 0.42736272424294375, 'subsample': 0.0714755331270864, 'dropout_rate': 0.7980246288588609, 'ccp_alpha': 0.19215936793580626}. Best is trial 11 with value: 0.8450457333064163.[0m
[32m[I 2022-04-21 12:29:14,098][0m Trial 64 finished with value: 0.8420733888541182 and parameters: {'loss': 'coxph', 'learning_rate': 1.8928986477704467e-05, 'n_estimators': 842, 'criterion': 'friedman_mse', 'min_samples_split': 6, 'min_samples_leaf': 4, 'min_weight_fraction_leaf': 0.12370735417835348, 'min_impurity_decrease': 0.5279178513370955, 'max_features': 0.4866325340561785, 'subsample': 0.18561750176452108, 'dropout_rate': 0.7980576115773832, 'ccp_alpha': 0.20111951585909243}. Best is trial 11 with value: 0.8450457333064163.[0m
[32m[I 2022-04-21 12:30:24,648][0m Trial 65 finished with value: 0.7227700176986012 and parameters: {'loss': 'coxph', 'learning_rate': 5.189742505825291e-05, 'n_estimators': 833, 'criterion': 'friedman_mse', 'min_samples_split': 6, 'min_samples_leaf': 4, 'min_weight_fraction_leaf': 0.12431750498938403, 'min_impurity_decrease': 0.545104350320435, 'max_features': 0.49740949190544476, 'subsample': 0.07981015437049264, 'dropout_rate': 0.7989417033653592, 'ccp_alpha': 0.7865856754431225}. Best is trial 11 with value: 0.8450457333064163.[0m
[32m[I 2022-04-21 12:32:44,237][0m Trial 66 finished with value: 0.8428099156224425 and parameters: {'loss': 'coxph', 'learning_rate': 1.1306456038586455e-06, 'n_estimators': 844, 'criterion': 'friedman_mse', 'min_samples_split': 6, 'min_samples_leaf': 3, 'min_weight_fraction_leaf': 0.10922107624396589, 'min_impurity_decrease': 0.6524486927789639, 'max_features': 0.4295418484696497, 'subsample': 0.19433798416187642, 'dropout_rate': 0.4095207049916406, 'ccp_alpha': 0.20495254921084985}. Best is trial 11 with value: 0.8450457333064163.[0m
