[32m[I 2022-04-21 11:47:51,577][0m Trial 525 finished with value: 0.5497720037386303 and parameters: {'splitter': 'best', 'min_samples_split': 0.10503346599903202, 'min_samples_leaf': 0.2789193180304875, 'min_weight_fraction_leaf': 0.02081994769915238, 'max_features': 0.8155073421927754}. Best is trial 507 with value: 0.6585778818712512.[0m
[32m[I 2022-04-21 11:47:52,167][0m Trial 526 finished with value: 0.6175448380105643 and parameters: {'splitter': 'best', 'min_samples_split': 0.1265879622976743, 'min_samples_leaf': 0.026855783685047502, 'min_weight_fraction_leaf': 0.028424676265891097, 'max_features': 0.8696406432301927}. Best is trial 507 with value: 0.6585778818712512.[0m
[32m[I 2022-04-21 11:47:52,752][0m Trial 527 finished with value: 0.6136302839926767 and parameters: {'splitter': 'best', 'min_samples_split': 0.07685487964911891, 'min_samples_leaf': 0.03549408704267462, 'min_weight_fraction_leaf': 0.01555693687329025, 'max_features': 0.5894487076733399}. Best is trial 507 with value: 0.6585778818712512.[0m
[32m[I 2022-04-21 11:47:53,304][0m Trial 528 finished with value: 0.6353254297771785 and parameters: {'splitter': 'best', 'min_samples_split': 0.13652359133014746, 'min_samples_leaf': 0.016486841919460708, 'min_weight_fraction_leaf': 0.009372132877962694, 'max_features': 0.7627059889329507}. Best is trial 507 with value: 0.6585778818712512.[0m
[32m[I 2022-04-21 11:47:53,690][0m Trial 529 finished with value: 0.6355422165958642 and parameters: {'splitter': 'best', 'min_samples_split': 0.1052789530323667, 'min_samples_leaf': 0.009967604090725203, 'min_weight_fraction_leaf': 0.04507498615481019, 'max_features': 0.6168613731074657}. Best is trial 507 with value: 0.6585778818712512.[0m
[32m[I 2022-04-21 11:47:54,033][0m Trial 530 finished with value: 0.622751346377331 and parameters: {'splitter': 'best', 'min_samples_split': 0.1176408037409814, 'min_samples_leaf': 0.025280413970330137, 'min_weight_fraction_leaf': 0.02257301484773193, 'max_features': 0.5929340442915881}. Best is trial 507 with value: 0.6585778818712512.[0m
[32m[I 2022-04-21 11:47:54,559][0m Trial 531 finished with value: 0.6058983239697411 and parameters: {'splitter': 'best', 'min_samples_split': 0.08581299255036837, 'min_samples_leaf': 0.04846128310586173, 'min_weight_fraction_leaf': 0.008647619633523583, 'max_features': 0.5407775157131214}. Best is trial 507 with value: 0.6585778818712512.[0m
[32m[I 2022-04-21 11:47:55,260][0m Trial 532 finished with value: 0.6280028736894275 and parameters: {'splitter': 'best', 'min_samples_split': 0.13909200971395072, 'min_samples_leaf': 0.011232870438609608, 'min_weight_fraction_leaf': 0.03013202058095145, 'max_features': 0.4952854047774094}. Best is trial 507 with value: 0.6585778818712512.[0m
[32m[I 2022-04-21 11:47:56,006][0m Trial 533 finished with value: 0.6019081538694827 and parameters: {'splitter': 'best', 'min_samples_split': 0.4381263519011559, 'min_samples_leaf': 0.019088693010088444, 'min_weight_fraction_leaf': 0.0002893134733901569, 'max_features': 0.5609712248571768}. Best is trial 507 with value: 0.6585778818712512.[0m
[32m[I 2022-04-21 11:47:56,765][0m Trial 534 finished with value: 0.6343856116339397 and parameters: {'splitter': 'best', 'min_samples_split': 0.12585267032538625, 'min_samples_leaf': 0.03410004217692611, 'min_weight_fraction_leaf': 0.021260904355620704, 'max_features': 0.7315970475322766}. Best is trial 507 with value: 0.6585778818712512.[0m
[32m[I 2022-04-21 11:47:57,736][0m Trial 535 finished with value: 0.6265814928699474 and parameters: {'splitter': 'best', 'min_samples_split': 0.09531256746525157, 'min_samples_leaf': 0.007890714799944897, 'min_weight_fraction_leaf': 2.6736520604780933e-05, 'max_features': 0.6694581405304847}. Best is trial 507 with value: 0.6585778818712512.[0m
[32m[I 2022-04-21 11:47:58,318][0m Trial 536 finished with value: 0.6325905092917943 and parameters: {'splitter': 'best', 'min_samples_split': 0.11471265135896977, 'min_samples_leaf': 0.02445010412851792, 'min_weight_fraction_leaf': 0.014913252833799752, 'max_features': 0.6361122561026193}. Best is trial 507 with value: 0.6585778818712512.[0m
[32m[I 2022-04-21 11:47:58,540][0m Trial 537 finished with value: 0.5802218862199039 and parameters: {'splitter': 'best', 'min_samples_split': 0.10462237124878326, 'min_samples_leaf': 0.20939606007359013, 'min_weight_fraction_leaf': 0.05689281467756202, 'max_features': 0.7019126646786313}. Best is trial 507 with value: 0.6585778818712512.[0m
[32m[I 2022-04-21 11:47:59,603][0m Trial 538 finished with value: 0.6322010767441562 and parameters: {'splitter': 'best', 'min_samples_split': 0.1447224243294126, 'min_samples_leaf': 0.009220555536788862, 'min_weight_fraction_leaf': 0.03048884829484866, 'max_features': 0.771793860386513}. Best is trial 507 with value: 0.6585778818712512.[0m
[32m[I 2022-04-21 11:48:00,577][0m Trial 539 finished with value: 0.6321224415420537 and parameters: {'splitter': 'best', 'min_samples_split': 0.12799710651787566, 'min_samples_leaf': 0.019108096998240117, 'min_weight_fraction_leaf': 0.014888823014626308, 'max_features': 0.6169704852044684}. Best is trial 507 with value: 0.6585778818712512.[0m
[32m[I 2022-04-21 11:48:02,045][0m Trial 540 finished with value: 0.6249335692759154 and parameters: {'splitter': 'best', 'min_samples_split': 0.11586049141319092, 'min_samples_leaf': 0.03860481683192955, 'min_weight_fraction_leaf': 0.03670834651324584, 'max_features': 0.8246000369865867}. Best is trial 507 with value: 0.6585778818712512.[0m
[32m[I 2022-04-21 11:48:02,532][0m Trial 541 finished with value: 0.6241640446650566 and parameters: {'splitter': 'best', 'min_samples_split': 0.13878460549833724, 'min_samples_leaf': 0.0010953025685400148, 'min_weight_fraction_leaf': 0.011184852334927008, 'max_features': 0.5834320899398294}. Best is trial 507 with value: 0.6585778818712512.[0m
[32m[I 2022-04-21 11:48:03,141][0m Trial 542 finished with value: 0.6134562876244364 and parameters: {'splitter': 'best', 'min_samples_split': 0.05696096305756018, 'min_samples_leaf': 0.001262918066700149, 'min_weight_fraction_leaf': 0.018521479733407606, 'max_features': 0.6553094575442204}. Best is trial 507 with value: 0.6585778818712512.[0m
[32m[I 2022-04-21 11:48:04,031][0m Trial 543 finished with value: 0.6468422158025382 and parameters: {'splitter': 'best', 'min_samples_split': 0.0958180658246095, 'min_samples_leaf': 0.016901561668366337, 'min_weight_fraction_leaf': 0.0001017564530974048, 'max_features': 0.7513046621057298}. Best is trial 507 with value: 0.6585778818712512.[0m
[32m[I 2022-04-21 11:48:04,600][0m Trial 544 finished with value: 0.5981932588534749 and parameters: {'splitter': 'best', 'min_samples_split': 0.07718997052000526, 'min_samples_leaf': 0.05424770288689945, 'min_weight_fraction_leaf': 0.007434410435435985, 'max_features': 0.7152039736684378}. Best is trial 507 with value: 0.6585778818712512.[0m
[32m[I 2022-04-21 11:48:05,455][0m Trial 545 finished with value: 0.6286443022028044 and parameters: {'splitter': 'best', 'min_samples_split': 0.10092483173956446, 'min_samples_leaf': 0.03362038021862756, 'min_weight_fraction_leaf': 0.0007202284082698362, 'max_features': 0.7350243170875015}. Best is trial 507 with value: 0.6585778818712512.[0m
[32m[I 2022-04-21 11:48:06,411][0m Trial 546 finished with value: 0.6305098131309188 and parameters: {'splitter': 'best', 'min_samples_split': 0.09201453143004996, 'min_samples_leaf': 0.02723430736268443, 'min_weight_fraction_leaf': 5.1844575028582585e-05, 'max_features': 0.6092195274866707}. Best is trial 507 with value: 0.6585778818712512.[0m
[32m[I 2022-04-21 11:48:06,852][0m Trial 547 finished with value: 0.5948639871150506 and parameters: {'splitter': 'best', 'min_samples_split': 0.3859314489665775, 'min_samples_leaf': 0.044806693771532596, 'min_weight_fraction_leaf': 0.009143731673482544, 'max_features': 0.6816374968797504}. Best is trial 507 with value: 0.6585778818712512.[0m
[32m[I 2022-04-21 11:48:07,573][0m Trial 548 finished with value: 0.6139269414314285 and parameters: {'splitter': 'best', 'min_samples_split': 0.08052843540257817, 'min_samples_leaf': 0.01872083075251018, 'min_weight_fraction_leaf': 0.009819387624062363, 'max_features': 0.6323929440334767}. Best is trial 507 with value: 0.6585778818712512.[0m
[32m[I 2022-04-21 11:48:08,103][0m Trial 549 finished with value: 0.6146581467045233 and parameters: {'splitter': 'best', 'min_samples_split': 0.08805495615518912, 'min_samples_leaf': 0.026957832575015165, 'min_weight_fraction_leaf': 0.008175744500662581, 'max_features': 0.7036294693886815}. Best is trial 507 with value: 0.6585778818712512.[0m
[32m[I 2022-04-21 11:48:08,705][0m Trial 550 finished with value: 0.6251462546097092 and parameters: {'splitter': 'best', 'min_samples_split': 0.1515118591373224, 'min_samples_leaf': 0.017618395553243866, 'min_weight_fraction_leaf': 0.10081232129720527, 'max_features': 0.5681299962418054}. Best is trial 507 with value: 0.6585778818712512.[0m
[32m[I 2022-04-21 11:48:08,837][0m Trial 551 finished with value: 0.6288396542600303 and parameters: {'splitter': 'best', 'min_samples_split': 0.12736872959411003, 'min_samples_leaf': 0.013698113591864552, 'min_weight_fraction_leaf': 0.018196669792334908, 'max_features': 0.0323881986936192}. Best is trial 507 with value: 0.6585778818712512.[0m
[32m[I 2022-04-21 11:48:09,165][0m Trial 552 finished with value: 0.536760391755396 and parameters: {'splitter': 'best', 'min_samples_split': 0.06742392187583209, 'min_samples_leaf': 0.03254147930905088, 'min_weight_fraction_leaf': 0.3771232587377523, 'max_features': 0.9940570731893614}. Best is trial 507 with value: 0.6585778818712512.[0m
[32m[I 2022-04-21 11:48:10,171][0m Trial 553 finished with value: 0.6496911812564605 and parameters: {'splitter': 'best', 'min_samples_split': 0.11177181912147606, 'min_samples_leaf': 0.0169662640505994, 'min_weight_fraction_leaf': 0.0006946220815490803, 'max_features': 0.7504034512025584}. Best is trial 507 with value: 0.6585778818712512.[0m
[32m[I 2022-04-21 11:48:10,675][0m Trial 554 finished with value: 0.6223107191269737 and parameters: {'splitter': 'best', 'min_samples_split': 0.13533092560410973, 'min_samples_leaf': 0.02666554830207015, 'min_weight_fraction_leaf': 0.0004608834544487638, 'max_features': 0.7529282063994812}. Best is trial 507 with value: 0.6585778818712512.[0m
[32m[I 2022-04-21 11:48:11,022][0m Trial 555 finished with value: 0.6189461883148748 and parameters: {'splitter': 'best', 'min_samples_split': 0.1207368953828597, 'min_samples_leaf': 0.044335751055237474, 'min_weight_fraction_leaf': 0.01116931205248757, 'max_features': 0.8000361100578365}. Best is trial 507 with value: 0.6585778818712512.[0m
[32m[I 2022-04-21 11:48:11,572][0m Trial 556 finished with value: 0.6113237644337862 and parameters: {'splitter': 'best', 'min_samples_split': 0.14528509836213396, 'min_samples_leaf': 0.03553155928814028, 'min_weight_fraction_leaf': 0.007528047642933794, 'max_features': 0.5995954010582475}. Best is trial 507 with value: 0.6585778818712512.[0m
[32m[I 2022-04-21 11:48:12,712][0m Trial 557 finished with value: 0.6340830342780924 and parameters: {'splitter': 'best', 'min_samples_split': 0.16678576774476453, 'min_samples_leaf': 0.020798767339317896, 'min_weight_fraction_leaf': 0.008126463137529474, 'max_features': 0.9047869978173146}. Best is trial 507 with value: 0.6585778818712512.[0m
[32m[I 2022-04-21 11:48:13,517][0m Trial 558 finished with value: 0.6386681769450879 and parameters: {'splitter': 'best', 'min_samples_split': 0.11575177482387848, 'min_samples_leaf': 0.016817845959972298, 'min_weight_fraction_leaf': 0.0009957282896175777, 'max_features': 0.635252914736213}. Best is trial 507 with value: 0.6585778818712512.[0m
[32m[I 2022-04-21 11:48:14,214][0m Trial 559 finished with value: 0.6188076924916086 and parameters: {'splitter': 'best', 'min_samples_split': 0.13363264210490503, 'min_samples_leaf': 0.02684586504179233, 'min_weight_fraction_leaf': 0.016318557234657645, 'max_features': 0.6693146539815461}. Best is trial 507 with value: 0.6585778818712512.[0m
[32m[I 2022-04-21 11:48:14,938][0m Trial 560 finished with value: 0.6274991704974381 and parameters: {'splitter': 'best', 'min_samples_split': 0.09575478386807515, 'min_samples_leaf': 0.011955429704243067, 'min_weight_fraction_leaf': 0.017428381739494764, 'max_features': 0.6493991977267614}. Best is trial 507 with value: 0.6585778818712512.[0m
[32m[I 2022-04-21 11:48:15,446][0m Trial 561 finished with value: 0.6338541896098095 and parameters: {'splitter': 'best', 'min_samples_split': 0.16212600852680792, 'min_samples_leaf': 0.038512257254249053, 'min_weight_fraction_leaf': 0.0003862547829907581, 'max_features': 0.5802518850471561}. Best is trial 507 with value: 0.6585778818712512.[0m
[32m[I 2022-04-21 11:48:15,593][0m Trial 562 finished with value: 0.536760391755396 and parameters: {'splitter': 'best', 'min_samples_split': 0.11085866328143872, 'min_samples_leaf': 0.3517093986954135, 'min_weight_fraction_leaf': 0.00015786668281908556, 'max_features': 0.7808510154308177}. Best is trial 507 with value: 0.6585778818712512.[0m
[32m[I 2022-04-21 11:48:16,163][0m Trial 563 finished with value: 0.6372127907181449 and parameters: {'splitter': 'best', 'min_samples_split': 0.1262130078455372, 'min_samples_leaf': 0.02521859416165217, 'min_weight_fraction_leaf': 6.784969303881908e-05, 'max_features': 0.6110705182970061}. Best is trial 507 with value: 0.6585778818712512.[0m
[32m[I 2022-04-21 11:48:16,807][0m Trial 564 finished with value: 0.6162136373061418 and parameters: {'splitter': 'best', 'min_samples_split': 0.14257237427748157, 'min_samples_leaf': 0.011798398665767491, 'min_weight_fraction_leaf': 0.01629288936302792, 'max_features': 0.5446618470232055}. Best is trial 507 with value: 0.6585778818712512.[0m
[32m[I 2022-04-21 11:48:17,564][0m Trial 565 finished with value: 0.6323111644623065 and parameters: {'splitter': 'best', 'min_samples_split': 0.15150865608174346, 'min_samples_leaf': 0.01753468204759816, 'min_weight_fraction_leaf': 0.023711833474251067, 'max_features': 0.7525880994885615}. Best is trial 507 with value: 0.6585778818712512.[0m
[32m[I 2022-04-21 11:48:18,599][0m Trial 566 finished with value: 0.6199308441911099 and parameters: {'splitter': 'best', 'min_samples_split': 0.11144961356616748, 'min_samples_leaf': 0.02967709856861241, 'min_weight_fraction_leaf': 0.01168430906466005, 'max_features': 0.6282238969891746}. Best is trial 507 with value: 0.6585778818712512.[0m
[32m[I 2022-04-21 11:48:19,187][0m Trial 567 finished with value: 0.6094315239026058 and parameters: {'splitter': 'best', 'min_samples_split': 0.09584136479008565, 'min_samples_leaf': 0.012207750999227858, 'min_weight_fraction_leaf': 0.1412009391786499, 'max_features': 0.5953454520195002}. Best is trial 507 with value: 0.6585778818712512.[0m
[32m[I 2022-04-21 11:48:19,690][0m Trial 568 finished with value: 0.6237504593086062 and parameters: {'splitter': 'best', 'min_samples_split': 0.12520960690252506, 'min_samples_leaf': 0.02114949610956285, 'min_weight_fraction_leaf': 0.0093165497946145, 'max_features': 0.6532869732525051}. Best is trial 507 with value: 0.6585778818712512.[0m
[32m[I 2022-04-21 11:48:20,397][0m Trial 569 finished with value: 0.6309071927053286 and parameters: {'splitter': 'best', 'min_samples_split': 0.1586010243791467, 'min_samples_leaf': 0.010136847545745486, 'min_weight_fraction_leaf': 0.024591773634068094, 'max_features': 0.6879003290715987}. Best is trial 507 with value: 0.6585778818712512.[0m
[32m[I 2022-04-21 11:48:20,506][0m Trial 570 finished with value: 0.6045629097037528 and parameters: {'splitter': 'best', 'min_samples_split': 0.13408738760707356, 'min_samples_leaf': 0.17154222577860279, 'min_weight_fraction_leaf': 0.12488573360845653, 'max_features': 0.560784340239075}. Best is trial 507 with value: 0.6585778818712512.[0m
[32m[I 2022-04-21 11:48:20,820][0m Trial 571 finished with value: 0.6188441442934817 and parameters: {'splitter': 'best', 'min_samples_split': 0.1024101161512189, 'min_samples_leaf': 0.04404294102062682, 'min_weight_fraction_leaf': 0.016141083435411034, 'max_features': 0.71841633820676}. Best is trial 507 with value: 0.6585778818712512.[0m
[32m[I 2022-04-21 11:48:21,181][0m Trial 572 finished with value: 0.5913276078610287 and parameters: {'splitter': 'best', 'min_samples_split': 0.11907712226840242, 'min_samples_leaf': 0.032406611200844135, 'min_weight_fraction_leaf': 0.180295070735191, 'max_features': 0.5208725162481442}. Best is trial 507 with value: 0.6585778818712512.[0m
[32m[I 2022-04-21 11:48:23,270][0m Trial 573 finished with value: 0.6271708646111701 and parameters: {'splitter': 'best', 'min_samples_split': 0.08432829472632851, 'min_samples_leaf': 0.0010087973915619032, 'min_weight_fraction_leaf': 0.008299188588264707, 'max_features': 0.7706006125011546}. Best is trial 507 with value: 0.6585778818712512.[0m
[32m[I 2022-04-21 11:48:23,998][0m Trial 574 finished with value: 0.6332514784954584 and parameters: {'splitter': 'best', 'min_samples_split': 0.1423504737874278, 'min_samples_leaf': 0.019444162821769473, 'min_weight_fraction_leaf': 0.024473650822708637, 'max_features': 0.6202417845550662}. Best is trial 507 with value: 0.6585778818712512.[0m
[32m[I 2022-04-21 11:48:24,740][0m Trial 575 finished with value: 0.6300387863334421 and parameters: {'splitter': 'best', 'min_samples_split': 0.10949111561488128, 'min_samples_leaf': 0.010166413138981568, 'min_weight_fraction_leaf': 0.00960370768567306, 'max_features': 0.7428415582753427}. Best is trial 507 with value: 0.6585778818712512.[0m
[32m[I 2022-04-21 11:48:25,326][0m Trial 576 finished with value: 0.624564207291939 and parameters: {'splitter': 'best', 'min_samples_split': 0.12405093453880964, 'min_samples_leaf': 0.026505433002274602, 'min_weight_fraction_leaf': 0.017678505378346497, 'max_features': 0.8084862730900548}. Best is trial 507 with value: 0.6585778818712512.[0m
[32m[I 2022-04-21 11:48:26,288][0m Trial 577 finished with value: 0.6188682033435093 and parameters: {'splitter': 'best', 'min_samples_split': 0.16750443996982345, 'min_samples_leaf': 0.010202621774688978, 'min_weight_fraction_leaf': 0.026526761487052804, 'max_features': 0.6666617867959381}. Best is trial 507 with value: 0.6585778818712512.[0m
[32m[I 2022-04-21 11:48:26,937][0m Trial 578 finished with value: 0.6239154021229232 and parameters: {'splitter': 'best', 'min_samples_split': 0.1519468795292474, 'min_samples_leaf': 0.01804465429249389, 'min_weight_fraction_leaf': 0.009128403322130121, 'max_features': 0.6058946416035054}. Best is trial 507 with value: 0.6585778818712512.[0m
[32m[I 2022-04-21 11:48:27,230][0m Trial 579 finished with value: 0.6253553956381818 and parameters: {'splitter': 'best', 'min_samples_split': 0.1344822192083505, 'min_samples_leaf': 0.038104834992116546, 'min_weight_fraction_leaf': 0.0332082187327848, 'max_features': 0.5843654307477579}. Best is trial 507 with value: 0.6585778818712512.[0m
[32m[I 2022-04-21 11:48:28,250][0m Trial 580 finished with value: 0.623172573258475 and parameters: {'splitter': 'best', 'min_samples_split': 0.11482042043885785, 'min_samples_leaf': 0.009107956742265362, 'min_weight_fraction_leaf': 0.0009001448131629982, 'max_features': 0.6413719629380752}. Best is trial 507 with value: 0.6585778818712512.[0m
[32m[I 2022-04-21 11:48:28,702][0m Trial 581 finished with value: 0.6298931849630712 and parameters: {'splitter': 'best', 'min_samples_split': 0.09985124860114258, 'min_samples_leaf': 0.05095437997824394, 'min_weight_fraction_leaf': 0.01852873169271791, 'max_features': 0.790660524856066}. Best is trial 507 with value: 0.6585778818712512.[0m
[32m[I 2022-04-21 11:48:29,254][0m Trial 582 finished with value: 0.6290796061135039 and parameters: {'splitter': 'best', 'min_samples_split': 0.13058152967782316, 'min_samples_leaf': 0.02465994641423219, 'min_weight_fraction_leaf': 0.00048211175386892504, 'max_features': 0.7030022222350099}. Best is trial 507 with value: 0.6585778818712512.[0m
[32m[I 2022-04-21 11:48:29,929][0m Trial 583 finished with value: 0.6261237631417282 and parameters: {'splitter': 'best', 'min_samples_split': 0.17949787435610612, 'min_samples_leaf': 0.00909890823853673, 'min_weight_fraction_leaf': 0.014711608676349127, 'max_features': 0.6778022264697385}. Best is trial 507 with value: 0.6585778818712512.[0m
[32m[I 2022-04-21 11:48:30,736][0m Trial 584 finished with value: 0.6281892273832241 and parameters: {'splitter': 'best', 'min_samples_split': 0.14604815923006176, 'min_samples_leaf': 0.01869191306898837, 'min_weight_fraction_leaf': 0.00016557145325318492, 'max_features': 0.6196002156518245}. Best is trial 507 with value: 0.6585778818712512.[0m
[32m[I 2022-04-21 11:48:31,535][0m Trial 585 finished with value: 0.6378367100527885 and parameters: {'splitter': 'best', 'min_samples_split': 0.12085673226158011, 'min_samples_leaf': 0.0013411434632068613, 'min_weight_fraction_leaf': 0.025230202292751504, 'max_features': 0.8375136707007662}. Best is trial 507 with value: 0.6585778818712512.[0m
[32m[I 2022-04-21 11:48:31,942][0m Trial 586 finished with value: 0.6238014121979367 and parameters: {'splitter': 'best', 'min_samples_split': 0.15854327371820034, 'min_samples_leaf': 0.03278134625690029, 'min_weight_fraction_leaf': 0.036648560613415065, 'max_features': 0.7257240515529865}. Best is trial 507 with value: 0.6585778818712512.[0m
[32m[I 2022-04-21 11:48:32,599][0m Trial 587 finished with value: 0.6320619949515242 and parameters: {'splitter': 'best', 'min_samples_split': 0.0891680059752495, 'min_samples_leaf': 0.018258894082180954, 'min_weight_fraction_leaf': 0.009851030411198235, 'max_features': 0.5913989809328863}. Best is trial 507 with value: 0.6585778818712512.[0m
