[32m[I 2022-04-22 01:18:12,573][0m Trial 879 finished with value: 0.5 and parameters: {'loss': 'coxph', 'learning_rate': 1.4084422961397886e-05, 'n_estimators': 204, 'criterion': 'friedman_mse', 'min_samples_split': 9, 'min_samples_leaf': 6, 'min_weight_fraction_leaf': 0.2531015092594456, 'min_impurity_decrease': 0.04033952783428071, 'max_features': 0.5683276155037529, 'subsample': 0.04208656356347823, 'dropout_rate': 0.8548772265102111, 'ccp_alpha': 0.09042849449879228}. Best is trial 187 with value: 0.6933481836305168.[0m
/media/san2_ssd/data/Workdir/survival/venv/lib/python3.8/site-packages/sksurv/ensemble/boosting.py:955: RuntimeWarning: divide by zero encountered in log
  time = numpy.log(time)
/media/san2_ssd/data/Workdir/survival/venv/lib/python3.8/site-packages/sksurv/ensemble/boosting.py:955: RuntimeWarning: divide by zero encountered in log
  time = numpy.log(time)
/media/san2_ssd/data/Workdir/survival/venv/lib/python3.8/site-packages/sksurv/ensemble/boosting.py:955: RuntimeWarning: divide by zero encountered in log
  time = numpy.log(time)
/media/san2_ssd/data/Workdir/survival/venv/lib/python3.8/site-packages/sksurv/ensemble/boosting.py:955: RuntimeWarning: divide by zero encountered in log
  time = numpy.log(time)
[32m[I 2022-04-22 01:18:13,241][0m Trial 880 finished with value: -0.7309607704001715 and parameters: {'loss': 'squared', 'learning_rate': 1.0997898462876161e-05, 'n_estimators': 187, 'criterion': 'friedman_mse', 'min_samples_split': 9, 'min_samples_leaf': 6, 'min_weight_fraction_leaf': 0.27115187075248715, 'min_impurity_decrease': 0.07207247238676322, 'max_features': 0.6463877923648264, 'subsample': 0.09787961836864056, 'dropout_rate': 0.9153261421760179, 'ccp_alpha': 0.2248625900602902}. Best is trial 187 with value: 0.6933481836305168.[0m
[32m[I 2022-04-22 01:18:19,452][0m Trial 881 finished with value: 0.6844541516964446 and parameters: {'loss': 'coxph', 'learning_rate': 1.520175959791738e-05, 'n_estimators': 219, 'criterion': 'friedman_mse', 'min_samples_split': 9, 'min_samples_leaf': 6, 'min_weight_fraction_leaf': 0.26210078763230876, 'min_impurity_decrease': 0.018670528329696595, 'max_features': 0.6011109263578431, 'subsample': 0.18090663687183187, 'dropout_rate': 0.892766214750321, 'ccp_alpha': 0.0899118411110206}. Best is trial 187 with value: 0.6933481836305168.[0m
[32m[I 2022-04-22 01:18:26,271][0m Trial 882 finished with value: 0.646716642713814 and parameters: {'loss': 'coxph', 'learning_rate': 5.8115338127022035e-06, 'n_estimators': 227, 'criterion': 'friedman_mse', 'min_samples_split': 9, 'min_samples_leaf': 6, 'min_weight_fraction_leaf': 0.24530050846110513, 'min_impurity_decrease': 0.06021037963633433, 'max_features': 0.5961211732848871, 'subsample': 0.21234374516549126, 'dropout_rate': 0.8389093964930019, 'ccp_alpha': 0.3705220059799501}. Best is trial 187 with value: 0.6933481836305168.[0m
[32m[I 2022-04-22 01:18:30,384][0m Trial 883 finished with value: 0.6698387758916226 and parameters: {'loss': 'coxph', 'learning_rate': 9.305304925902141e-06, 'n_estimators': 194, 'criterion': 'friedman_mse', 'min_samples_split': 10, 'min_samples_leaf': 6, 'min_weight_fraction_leaf': 0.27731235923300157, 'min_impurity_decrease': 0.0010965646860627704, 'max_features': 0.546954352076626, 'subsample': 0.23435637520585062, 'dropout_rate': 0.873391325451538, 'ccp_alpha': 0.17976391734012762}. Best is trial 187 with value: 0.6933481836305168.[0m
[32m[I 2022-04-22 01:18:37,810][0m Trial 884 finished with value: 0.6892333209499029 and parameters: {'loss': 'coxph', 'learning_rate': 1.2415398081490205e-05, 'n_estimators': 207, 'criterion': 'friedman_mse', 'min_samples_split': 9, 'min_samples_leaf': 6, 'min_weight_fraction_leaf': 0.25035215230909047, 'min_impurity_decrease': 0.0338882193625914, 'max_features': 0.6255067598551173, 'subsample': 0.19805950181777823, 'dropout_rate': 0.8163032572626614, 'ccp_alpha': 0.09305330042616745}. Best is trial 187 with value: 0.6933481836305168.[0m
[32m[I 2022-04-22 01:18:41,265][0m Trial 885 finished with value: 0.6636900948801576 and parameters: {'loss': 'coxph', 'learning_rate': 6.9909247624252835e-06, 'n_estimators': 236, 'criterion': 'friedman_mse', 'min_samples_split': 9, 'min_samples_leaf': 6, 'min_weight_fraction_leaf': 0.29878845605986415, 'min_impurity_decrease': 0.09182486803077053, 'max_features': 0.6089645886830938, 'subsample': 0.24501219185464718, 'dropout_rate': 0.9267183896272471, 'ccp_alpha': 0.2806878800399254}. Best is trial 187 with value: 0.6933481836305168.[0m
[32m[I 2022-04-22 01:18:45,993][0m Trial 886 finished with value: 0.6904896470111022 and parameters: {'loss': 'coxph', 'learning_rate': 1.749968719402476e-05, 'n_estimators': 228, 'criterion': 'friedman_mse', 'min_samples_split': 10, 'min_samples_leaf': 6, 'min_weight_fraction_leaf': 0.2602246547287702, 'min_impurity_decrease': 0.001563540745746302, 'max_features': 0.6063837973777094, 'subsample': 0.20968664070798052, 'dropout_rate': 0.8562581408394238, 'ccp_alpha': 0.004056975250442131}. Best is trial 187 with value: 0.6933481836305168.[0m
[32m[I 2022-04-22 01:18:49,984][0m Trial 887 finished with value: 0.6884750406407999 and parameters: {'loss': 'coxph', 'learning_rate': 1.8707785344479948e-05, 'n_estimators': 238, 'criterion': 'friedman_mse', 'min_samples_split': 6, 'min_samples_leaf': 6, 'min_weight_fraction_leaf': 0.26756205420182905, 'min_impurity_decrease': 0.016813277298559887, 'max_features': 0.644335280359398, 'subsample': 0.15408052724103674, 'dropout_rate': 0.8516784935214623, 'ccp_alpha': 0.0035810278820691275}. Best is trial 187 with value: 0.6933481836305168.[0m
[32m[I 2022-04-22 01:18:53,758][0m Trial 888 finished with value: 0.6819977577625689 and parameters: {'loss': 'coxph', 'learning_rate': 1.663474699735723e-05, 'n_estimators': 231, 'criterion': 'friedman_mse', 'min_samples_split': 10, 'min_samples_leaf': 6, 'min_weight_fraction_leaf': 0.282056614864699, 'min_impurity_decrease': 0.003594202849499398, 'max_features': 0.5370740232115325, 'subsample': 0.20748897358874532, 'dropout_rate': 0.8285676738258629, 'ccp_alpha': 0.08222519541092924}. Best is trial 187 with value: 0.6933481836305168.[0m
[32m[I 2022-04-22 01:18:59,982][0m Trial 889 finished with value: 0.6842082681032632 and parameters: {'loss': 'coxph', 'learning_rate': 2.1027218990878007e-05, 'n_estimators': 246, 'criterion': 'friedman_mse', 'min_samples_split': 10, 'min_samples_leaf': 4, 'min_weight_fraction_leaf': 0.3484424367446257, 'min_impurity_decrease': 0.034877984018731364, 'max_features': 0.6669368874893453, 'subsample': 0.18301139509763933, 'dropout_rate': 0.8167386104854095, 'ccp_alpha': 0.0043128328401921545}. Best is trial 187 with value: 0.6933481836305168.[0m
[32m[I 2022-04-22 01:19:06,085][0m Trial 890 finished with value: 0.6866740428773396 and parameters: {'loss': 'coxph', 'learning_rate': 1.5576565585367726e-05, 'n_estimators': 211, 'criterion': 'absolute_error', 'min_samples_split': 10, 'min_samples_leaf': 6, 'min_weight_fraction_leaf': 0.2586263152494984, 'min_impurity_decrease': 0.0025790871787415635, 'max_features': 0.6768958050171582, 'subsample': 0.170453700360783, 'dropout_rate': 0.7914974234908072, 'ccp_alpha': 0.005506821324331376}. Best is trial 187 with value: 0.6933481836305168.[0m
[32m[I 2022-04-22 01:19:10,540][0m Trial 891 finished with value: 0.6632086174154759 and parameters: {'loss': 'coxph', 'learning_rate': 2.1212668154140352e-05, 'n_estimators': 226, 'criterion': 'absolute_error', 'min_samples_split': 10, 'min_samples_leaf': 5, 'min_weight_fraction_leaf': 0.2739614320080041, 'min_impurity_decrease': 0.0015820119437942631, 'max_features': 0.5923344735068048, 'subsample': 0.2034184997335253, 'dropout_rate': 0.8574394457994027, 'ccp_alpha': 0.16947357435606333}. Best is trial 187 with value: 0.6933481836305168.[0m
[32m[I 2022-04-22 01:19:18,372][0m Trial 892 finished with value: 0.5 and parameters: {'loss': 'coxph', 'learning_rate': 1.354409099729064e-05, 'n_estimators': 243, 'criterion': 'friedman_mse', 'min_samples_split': 5, 'min_samples_leaf': 7, 'min_weight_fraction_leaf': 0.2435951261952029, 'min_impurity_decrease': 0.04901783566271183, 'max_features': 0.6938001407943193, 'subsample': 0.2195601015352449, 'dropout_rate': 0.8313370306467318, 'ccp_alpha': 2.8651580847450475}. Best is trial 187 with value: 0.6933481836305168.[0m
[32m[I 2022-04-22 01:19:22,365][0m Trial 893 finished with value: 0.6836256896433425 and parameters: {'loss': 'coxph', 'learning_rate': 1.952902267728959e-05, 'n_estimators': 215, 'criterion': 'absolute_error', 'min_samples_split': 10, 'min_samples_leaf': 6, 'min_weight_fraction_leaf': 0.2630410449547808, 'min_impurity_decrease': 0.033668154753881206, 'max_features': 0.6593774341165163, 'subsample': 0.1877445397060856, 'dropout_rate': 0.8487095650974016, 'ccp_alpha': 0.09060355266026741}. Best is trial 187 with value: 0.6933481836305168.[0m
[32m[I 2022-04-22 01:19:29,456][0m Trial 894 finished with value: 0.6709801690690773 and parameters: {'loss': 'coxph', 'learning_rate': 1.2659680656711128e-05, 'n_estimators': 234, 'criterion': 'friedman_mse', 'min_samples_split': 6, 'min_samples_leaf': 4, 'min_weight_fraction_leaf': 0.29053123461214625, 'min_impurity_decrease': 0.06944743647375627, 'max_features': 0.7401486611244514, 'subsample': 0.21924284513684994, 'dropout_rate': 0.8026822262083613, 'ccp_alpha': 0.19543070787135502}. Best is trial 187 with value: 0.6933481836305168.[0m
[32m[I 2022-04-22 01:19:37,133][0m Trial 895 finished with value: 0.682570623873647 and parameters: {'loss': 'coxph', 'learning_rate': 3.830119333438696e-06, 'n_estimators': 254, 'criterion': 'absolute_error', 'min_samples_split': 6, 'min_samples_leaf': 3, 'min_weight_fraction_leaf': 0.2761671340616353, 'min_impurity_decrease': 0.0017034145609096316, 'max_features': 0.71218703239954, 'subsample': 0.19982275321355208, 'dropout_rate': 0.7695559466626782, 'ccp_alpha': 0.08365147038374376}. Best is trial 187 with value: 0.6933481836305168.[0m
[32m[I 2022-04-22 01:19:41,910][0m Trial 896 finished with value: 0.6754071588965999 and parameters: {'loss': 'coxph', 'learning_rate': 2.413084542193419e-05, 'n_estimators': 222, 'criterion': 'friedman_mse', 'min_samples_split': 10, 'min_samples_leaf': 4, 'min_weight_fraction_leaf': 0.25817634786657523, 'min_impurity_decrease': 0.02546722808993198, 'max_features': 0.4940319074761531, 'subsample': 0.25056970853161864, 'dropout_rate': 0.8298019775909791, 'ccp_alpha': 0.17490027192120122}. Best is trial 187 with value: 0.6933481836305168.[0m
[32m[I 2022-04-22 01:19:46,456][0m Trial 897 finished with value: 0.686018900953297 and parameters: {'loss': 'coxph', 'learning_rate': 1.6236926300113245e-05, 'n_estimators': 244, 'criterion': 'squared_error', 'min_samples_split': 10, 'min_samples_leaf': 6, 'min_weight_fraction_leaf': 0.26813847252336226, 'min_impurity_decrease': 0.047412424112912854, 'max_features': 0.6215754440935821, 'subsample': 0.16849481727890858, 'dropout_rate': 0.8766728193534431, 'ccp_alpha': 0.08227847720786}. Best is trial 187 with value: 0.6933481836305168.[0m
/media/san2_ssd/data/Workdir/survival/venv/lib/python3.8/site-packages/sksurv/ensemble/boosting.py:955: RuntimeWarning: divide by zero encountered in log
  time = numpy.log(time)
/media/san2_ssd/data/Workdir/survival/venv/lib/python3.8/site-packages/sksurv/ensemble/boosting.py:955: RuntimeWarning: divide by zero encountered in log
  time = numpy.log(time)
/media/san2_ssd/data/Workdir/survival/venv/lib/python3.8/site-packages/sksurv/ensemble/boosting.py:955: RuntimeWarning: divide by zero encountered in log
  time = numpy.log(time)
/media/san2_ssd/data/Workdir/survival/venv/lib/python3.8/site-packages/sksurv/ensemble/boosting.py:955: RuntimeWarning: divide by zero encountered in log
  time = numpy.log(time)
[32m[I 2022-04-22 01:19:47,230][0m Trial 898 finished with value: -0.7197331818019252 and parameters: {'loss': 'squared', 'learning_rate': 1.1137758721071659e-05, 'n_estimators': 232, 'criterion': 'absolute_error', 'min_samples_split': 5, 'min_samples_leaf': 5, 'min_weight_fraction_leaf': 0.241304364864363, 'min_impurity_decrease': 0.0944618395133649, 'max_features': 0.7382773770679565, 'subsample': 0.7463520271748411, 'dropout_rate': 0.8123371105804146, 'ccp_alpha': 0.2757281928501969}. Best is trial 187 with value: 0.6933481836305168.[0m
[32m[I 2022-04-22 01:19:51,274][0m Trial 899 finished with value: 0.6865191498840557 and parameters: {'loss': 'coxph', 'learning_rate': 8.23820597597225e-06, 'n_estimators': 206, 'criterion': 'squared_error', 'min_samples_split': 10, 'min_samples_leaf': 2, 'min_weight_fraction_leaf': 0.3070194600849456, 'min_impurity_decrease': 0.019996174395726624, 'max_features': 0.6930769649732209, 'subsample': 0.22646396930371177, 'dropout_rate': 0.8574285926286607, 'ccp_alpha': 0.0011095804929994613}. Best is trial 187 with value: 0.6933481836305168.[0m
[32m[I 2022-04-22 01:19:57,322][0m Trial 900 finished with value: 0.6842082681032632 and parameters: {'loss': 'coxph', 'learning_rate': 5.978697286353837e-06, 'n_estimators': 219, 'criterion': 'squared_error', 'min_samples_split': 10, 'min_samples_leaf': 7, 'min_weight_fraction_leaf': 0.2872233279586272, 'min_impurity_decrease': 0.06319579864403976, 'max_features': 0.7148644058331878, 'subsample': 0.2280366083188224, 'dropout_rate': 0.7261443500331272, 'ccp_alpha': 0.002887352418811207}. Best is trial 187 with value: 0.6933481836305168.[0m
[32m[I 2022-04-22 01:20:01,225][0m Trial 901 finished with value: 0.678828170161717 and parameters: {'loss': 'coxph', 'learning_rate': 1.8876859892596882e-05, 'n_estimators': 254, 'criterion': 'squared_error', 'min_samples_split': 10, 'min_samples_leaf': 4, 'min_weight_fraction_leaf': 0.254934886051597, 'min_impurity_decrease': 0.03617239487322718, 'max_features': 0.6411350318018014, 'subsample': 0.8218115701394935, 'dropout_rate': 0.8429074693107599, 'ccp_alpha': 0.0013815310826610396}. Best is trial 187 with value: 0.6933481836305168.[0m
[32m[I 2022-04-22 01:20:06,830][0m Trial 902 finished with value: 0.6797843529283706 and parameters: {'loss': 'coxph', 'learning_rate': 2.5019409673651365e-05, 'n_estimators': 228, 'criterion': 'squared_error', 'min_samples_split': 10, 'min_samples_leaf': 6, 'min_weight_fraction_leaf': 0.2431541241405108, 'min_impurity_decrease': 0.08059489958056718, 'max_features': 0.6592194103213201, 'subsample': 0.252603648353761, 'dropout_rate': 0.8986708422511221, 'ccp_alpha': 0.1730428796954067}. Best is trial 187 with value: 0.6933481836305168.[0m
[32m[I 2022-04-22 01:20:11,228][0m Trial 903 finished with value: 0.6900263356973355 and parameters: {'loss': 'coxph', 'learning_rate': 1.4270594715860895e-05, 'n_estimators': 213, 'criterion': 'friedman_mse', 'min_samples_split': 6, 'min_samples_leaf': 3, 'min_weight_fraction_leaf': 0.2785536366795461, 'min_impurity_decrease': 0.05389689731761753, 'max_features': 0.7465782676205973, 'subsample': 0.20077090973649386, 'dropout_rate': 0.7523810711637016, 'ccp_alpha': 0.0017006688679150062}. Best is trial 187 with value: 0.6933481836305168.[0m
[32m[I 2022-04-22 01:20:15,599][0m Trial 904 finished with value: 0.6853988356875872 and parameters: {'loss': 'coxph', 'learning_rate': 1.6498500475286187e-05, 'n_estimators': 200, 'criterion': 'friedman_mse', 'min_samples_split': 6, 'min_samples_leaf': 3, 'min_weight_fraction_leaf': 0.26294623725298194, 'min_impurity_decrease': 0.10517185012581255, 'max_features': 0.7556193390203232, 'subsample': 0.12526301242765844, 'dropout_rate': 0.7530004037405591, 'ccp_alpha': 0.1662455380943927}. Best is trial 187 with value: 0.6933481836305168.[0m
[32m[I 2022-04-22 01:20:19,347][0m Trial 905 finished with value: 0.6127568729131793 and parameters: {'loss': 'coxph', 'learning_rate': 1.386250938166136e-05, 'n_estimators': 213, 'criterion': 'friedman_mse', 'min_samples_split': 6, 'min_samples_leaf': 3, 'min_weight_fraction_leaf': 0.2731935451044045, 'min_impurity_decrease': 0.07720463047014774, 'max_features': 0.7448888836423083, 'subsample': 0.6253074709232729, 'dropout_rate': 0.7316754050945257, 'ccp_alpha': 0.2603541286708452}. Best is trial 187 with value: 0.6933481836305168.[0m
[32m[I 2022-04-22 01:20:22,203][0m Trial 906 finished with value: 0.5 and parameters: {'loss': 'coxph', 'learning_rate': 2.0125924262744198e-05, 'n_estimators': 187, 'criterion': 'friedman_mse', 'min_samples_split': 6, 'min_samples_leaf': 3, 'min_weight_fraction_leaf': 0.24101043879557146, 'min_impurity_decrease': 0.06154686135545869, 'max_features': 0.5556636918286683, 'subsample': 0.17081072651659435, 'dropout_rate': 0.7474308745783754, 'ccp_alpha': 3.148930085235735}. Best is trial 187 with value: 0.6933481836305168.[0m
[32m[I 2022-04-22 01:20:28,080][0m Trial 907 finished with value: 0.6852501666536691 and parameters: {'loss': 'coxph', 'learning_rate': 1.1977442936659024e-05, 'n_estimators': 204, 'criterion': 'friedman_mse', 'min_samples_split': 6, 'min_samples_leaf': 3, 'min_weight_fraction_leaf': 0.2614350272706958, 'min_impurity_decrease': 0.0919079754874284, 'max_features': 0.7304316177677155, 'subsample': 0.15144391251370798, 'dropout_rate': 0.7814698161609289, 'ccp_alpha': 0.09588587035422952}. Best is trial 187 with value: 0.6933481836305168.[0m
[32m[I 2022-04-22 01:20:32,211][0m Trial 908 finished with value: 0.6874132977425825 and parameters: {'loss': 'coxph', 'learning_rate': 1.5547359010980163e-05, 'n_estimators': 194, 'criterion': 'friedman_mse', 'min_samples_split': 6, 'min_samples_leaf': 3, 'min_weight_fraction_leaf': 0.27651482621082074, 'min_impurity_decrease': 0.059262206922316915, 'max_features': 0.741057378039057, 'subsample': 0.19090108456813493, 'dropout_rate': 0.706870514587264, 'ccp_alpha': 0.09242533910252969}. Best is trial 187 with value: 0.6933481836305168.[0m
[32m[I 2022-04-22 01:20:37,686][0m Trial 909 finished with value: 0.6752576402432735 and parameters: {'loss': 'coxph', 'learning_rate': 2.6181295344778065e-05, 'n_estimators': 241, 'criterion': 'friedman_mse', 'min_samples_split': 6, 'min_samples_leaf': 2, 'min_weight_fraction_leaf': 0.24983014832446906, 'min_impurity_decrease': 0.10878169939068533, 'max_features': 0.758151307205779, 'subsample': 0.18763501369969388, 'dropout_rate': 0.7572037846151538, 'ccp_alpha': 0.23312244608224147}. Best is trial 187 with value: 0.6933481836305168.[0m
[32m[I 2022-04-22 01:20:41,399][0m Trial 910 finished with value: 0.6529688876710681 and parameters: {'loss': 'coxph', 'learning_rate': 2.273901299212311e-05, 'n_estimators': 211, 'criterion': 'friedman_mse', 'min_samples_split': 5, 'min_samples_leaf': 3, 'min_weight_fraction_leaf': 0.26586251487003293, 'min_impurity_decrease': 0.3875947631550289, 'max_features': 0.726844823847563, 'subsample': 0.20108751982896927, 'dropout_rate': 0.7438058912293662, 'ccp_alpha': 0.3883569693864163}. Best is trial 187 with value: 0.6933481836305168.[0m
[32m[I 2022-04-22 01:20:50,667][0m Trial 911 finished with value: 0.6813297885537782 and parameters: {'loss': 'coxph', 'learning_rate': 1.3474702648800722e-05, 'n_estimators': 254, 'criterion': 'friedman_mse', 'min_samples_split': 6, 'min_samples_leaf': 3, 'min_weight_fraction_leaf': 0.2419278930988909, 'min_impurity_decrease': 0.07792955368839878, 'max_features': 0.6147907978488937, 'subsample': 0.24186649734003404, 'dropout_rate': 0.6856851136636971, 'ccp_alpha': 0.14878824642304028}. Best is trial 187 with value: 0.6933481836305168.[0m
[32m[I 2022-04-22 01:20:57,681][0m Trial 912 finished with value: 0.6890194381981207 and parameters: {'loss': 'coxph', 'learning_rate': 1.0911739227284096e-05, 'n_estimators': 230, 'criterion': 'friedman_mse', 'min_samples_split': 5, 'min_samples_leaf': 3, 'min_weight_fraction_leaf': 0.2500852911223963, 'min_impurity_decrease': 0.05197845488885122, 'max_features': 0.7698553200046004, 'subsample': 0.2063324417038707, 'dropout_rate': 0.7209631340732319, 'ccp_alpha': 0.001893168178226229}. Best is trial 187 with value: 0.6933481836305168.[0m
[32m[I 2022-04-22 01:21:52,408][0m Trial 913 finished with value: 0.6872724600403594 and parameters: {'loss': 'coxph', 'learning_rate': 1.6942447345268475e-05, 'n_estimators': 770, 'criterion': 'friedman_mse', 'min_samples_split': 6, 'min_samples_leaf': 3, 'min_weight_fraction_leaf': 0.25983272684895636, 'min_impurity_decrease': 0.04783302775256347, 'max_features': 0.7553245253774818, 'subsample': 0.25988082825082914, 'dropout_rate': 0.7810221246826314, 'ccp_alpha': 0.08847054622609204}. Best is trial 187 with value: 0.6933481836305168.[0m
[32m[I 2022-04-22 01:21:56,842][0m Trial 914 finished with value: 0.676970537397976 and parameters: {'loss': 'coxph', 'learning_rate': 2.7697421453144898e-05, 'n_estimators': 241, 'criterion': 'friedman_mse', 'min_samples_split': 6, 'min_samples_leaf': 1, 'min_weight_fraction_leaf': 0.27816560897248477, 'min_impurity_decrease': 0.07772828431325773, 'max_features': 0.5913649052314055, 'subsample': 0.13372221621936975, 'dropout_rate': 0.9083724272072945, 'ccp_alpha': 0.289291147457213}. Best is trial 187 with value: 0.6933481836305168.[0m
[32m[I 2022-04-22 01:22:03,106][0m Trial 915 finished with value: 0.6891664765867395 and parameters: {'loss': 'coxph', 'learning_rate': 1.9593772973658066e-05, 'n_estimators': 215, 'criterion': 'friedman_mse', 'min_samples_split': 6, 'min_samples_leaf': 6, 'min_weight_fraction_leaf': 0.26898519546990163, 'min_impurity_decrease': 0.061731712009728934, 'max_features': 0.6789782689705982, 'subsample': 0.22417739996533453, 'dropout_rate': 0.7683191543866262, 'ccp_alpha': 0.0019333225049421587}. Best is trial 187 with value: 0.6933481836305168.[0m
