[32m[I 2022-04-21 11:43:52,296][0m Trial 21 finished with value: 0.6164619417903798 and parameters: {'splitter': 'best', 'min_samples_split': 0.11312366752933686, 'min_samples_leaf': 0.10118440686598386, 'min_weight_fraction_leaf': 0.007141223371416646, 'max_features': 0.605894974603972}. Best is trial 11 with value: 0.6395144477369629.[0m
[32m[I 2022-04-21 11:43:52,422][0m Trial 22 finished with value: 0.614167250622836 and parameters: {'splitter': 'best', 'min_samples_split': 0.12790271400115388, 'min_samples_leaf': 0.1411237147874474, 'min_weight_fraction_leaf': 0.04745446469707555, 'max_features': 0.47639451409307815}. Best is trial 11 with value: 0.6395144477369629.[0m
[32m[I 2022-04-21 11:43:52,688][0m Trial 23 finished with value: 0.5901635207723265 and parameters: {'splitter': 'best', 'min_samples_split': 0.0804996391344002, 'min_samples_leaf': 0.04433132835845756, 'min_weight_fraction_leaf': 0.10537636735903178, 'max_features': 0.5345865323425372}. Best is trial 11 with value: 0.6395144477369629.[0m
[32m[I 2022-04-21 11:43:52,792][0m Trial 24 finished with value: 0.5543369279091901 and parameters: {'splitter': 'best', 'min_samples_split': 0.009073660655286524, 'min_samples_leaf': 0.10936176644457338, 'min_weight_fraction_leaf': 0.030966020378271862, 'max_features': 0.23055265909697376}. Best is trial 11 with value: 0.6395144477369629.[0m
[32m[I 2022-04-21 11:43:52,823][0m Trial 25 finished with value: 0.5 and parameters: {'splitter': 'best', 'min_samples_split': 0.15661175779511805, 'min_samples_leaf': 0.045673819873312205, 'min_weight_fraction_leaf': 0.010719005417342007, 'max_features': 0.00760829140247582}. Best is trial 11 with value: 0.6395144477369629.[0m
[32m[I 2022-04-21 11:43:53,027][0m Trial 26 finished with value: 0.6228424287532351 and parameters: {'splitter': 'best', 'min_samples_split': 0.054010174028010303, 'min_samples_leaf': 0.04540640427234977, 'min_weight_fraction_leaf': 0.05543685614782337, 'max_features': 0.5647201886031108}. Best is trial 11 with value: 0.6395144477369629.[0m
[32m[I 2022-04-21 11:43:53,121][0m Trial 27 finished with value: 0.5866817413425028 and parameters: {'splitter': 'best', 'min_samples_split': 0.21141059684356966, 'min_samples_leaf': 0.1843450140694987, 'min_weight_fraction_leaf': 0.0942990175929784, 'max_features': 0.7168804703219458}. Best is trial 11 with value: 0.6395144477369629.[0m
[32m[I 2022-04-21 11:43:53,207][0m Trial 28 finished with value: 0.5998192247656132 and parameters: {'splitter': 'best', 'min_samples_split': 0.11731301879811352, 'min_samples_leaf': 0.11515786480056742, 'min_weight_fraction_leaf': 0.14516851383642077, 'max_features': 0.3651456605740876}. Best is trial 11 with value: 0.6395144477369629.[0m
[32m[I 2022-04-21 11:43:53,266][0m Trial 29 finished with value: 0.5935750918053395 and parameters: {'splitter': 'random', 'min_samples_split': 0.293519685089324, 'min_samples_leaf': 0.20345770377064526, 'min_weight_fraction_leaf': 0.05796209727839724, 'max_features': 0.9681959896549579}. Best is trial 11 with value: 0.6395144477369629.[0m
[32m[I 2022-04-21 11:43:53,348][0m Trial 30 finished with value: 0.5358564240914311 and parameters: {'splitter': 'best', 'min_samples_split': 0.04345801163545944, 'min_samples_leaf': 0.0717778486201693, 'min_weight_fraction_leaf': 0.39743883441759353, 'max_features': 0.42169400852283695}. Best is trial 11 with value: 0.6395144477369629.[0m
[32m[I 2022-04-21 11:43:53,764][0m Trial 31 finished with value: 0.61239007741351 and parameters: {'splitter': 'best', 'min_samples_split': 0.08199764426586888, 'min_samples_leaf': 0.034903604525012795, 'min_weight_fraction_leaf': 0.04871261682895954, 'max_features': 0.556189535049642}. Best is trial 11 with value: 0.6395144477369629.[0m
[32m[I 2022-04-21 11:43:54,135][0m Trial 32 finished with value: 0.6057418974374122 and parameters: {'splitter': 'best', 'min_samples_split': 0.03775675446620884, 'min_samples_leaf': 0.062421512434407384, 'min_weight_fraction_leaf': 0.06625528428741129, 'max_features': 0.5877843352656635}. Best is trial 11 with value: 0.6395144477369629.[0m
[32m[I 2022-04-21 11:43:54,396][0m Trial 33 finished with value: 0.6151447780407227 and parameters: {'splitter': 'best', 'min_samples_split': 0.10428301591871351, 'min_samples_leaf': 0.0045445675786005765, 'min_weight_fraction_leaf': 0.039598288012353586, 'max_features': 0.2925576305783061}. Best is trial 11 with value: 0.6395144477369629.[0m
[32m[I 2022-04-21 11:43:54,456][0m Trial 34 finished with value: 0.6237371285052631 and parameters: {'splitter': 'random', 'min_samples_split': 0.14304997615196, 'min_samples_leaf': 0.040668502024991, 'min_weight_fraction_leaf': 0.002040946489500095, 'max_features': 0.7103228065707864}. Best is trial 11 with value: 0.6395144477369629.[0m
[32m[I 2022-04-21 11:43:54,521][0m Trial 35 finished with value: 0.6138834355739998 and parameters: {'splitter': 'random', 'min_samples_split': 0.14442281873574375, 'min_samples_leaf': 0.12393563087061174, 'min_weight_fraction_leaf': 0.005428208700181009, 'max_features': 0.8209793335401803}. Best is trial 11 with value: 0.6395144477369629.[0m
[32m[I 2022-04-21 11:43:54,578][0m Trial 36 finished with value: 0.5970533647111503 and parameters: {'splitter': 'random', 'min_samples_split': 0.22999295092916816, 'min_samples_leaf': 0.1558813941661976, 'min_weight_fraction_leaf': 0.08330727940376786, 'max_features': 0.7164997324683157}. Best is trial 11 with value: 0.6395144477369629.[0m
[32m[I 2022-04-21 11:43:54,621][0m Trial 37 finished with value: 0.5371026920482621 and parameters: {'splitter': 'random', 'min_samples_split': 0.1693430280954417, 'min_samples_leaf': 0.3345950176917994, 'min_weight_fraction_leaf': 0.002348581270122052, 'max_features': 0.7793027307831583}. Best is trial 11 with value: 0.6395144477369629.[0m
[32m[I 2022-04-21 11:43:54,667][0m Trial 38 finished with value: 0.5954401330618928 and parameters: {'splitter': 'random', 'min_samples_split': 0.345131214034205, 'min_samples_leaf': 0.02736479757048004, 'min_weight_fraction_leaf': 0.13569561324787294, 'max_features': 0.4564763195975762}. Best is trial 11 with value: 0.6395144477369629.[0m
[32m[I 2022-04-21 11:43:54,704][0m Trial 39 finished with value: 0.5367913695535471 and parameters: {'splitter': 'random', 'min_samples_split': 0.2639129743631648, 'min_samples_leaf': 0.2281833939962685, 'min_weight_fraction_leaf': 0.3177079591200827, 'max_features': 0.708378416928089}. Best is trial 11 with value: 0.6395144477369629.[0m
[32m[I 2022-04-21 11:43:54,744][0m Trial 40 finished with value: 0.5309391352916017 and parameters: {'splitter': 'random', 'min_samples_split': 0.13461198608595148, 'min_samples_leaf': 0.27968273702284857, 'min_weight_fraction_leaf': 0.03186402568007626, 'max_features': 0.906402830644288}. Best is trial 11 with value: 0.6395144477369629.[0m
[32m[I 2022-04-21 11:43:54,812][0m Trial 41 finished with value: 0.6264473772972716 and parameters: {'splitter': 'random', 'min_samples_split': 0.049369816333671546, 'min_samples_leaf': 0.05646718942858211, 'min_weight_fraction_leaf': 0.03818118000018696, 'max_features': 0.5465139664974442}. Best is trial 11 with value: 0.6395144477369629.[0m
[32m[I 2022-04-21 11:43:54,926][0m Trial 42 finished with value: 0.6332185449761559 and parameters: {'splitter': 'random', 'min_samples_split': 0.0020911864133162546, 'min_samples_leaf': 0.08692917755992749, 'min_weight_fraction_leaf': 0.03131635343543952, 'max_features': 0.6688385432311397}. Best is trial 11 with value: 0.6395144477369629.[0m
[32m[I 2022-04-21 11:43:55,042][0m Trial 43 finished with value: 0.5818657326562071 and parameters: {'splitter': 'random', 'min_samples_split': 0.022106588977682102, 'min_samples_leaf': 0.09101460990640571, 'min_weight_fraction_leaf': 0.09429923092006529, 'max_features': 0.5124867287617141}. Best is trial 11 with value: 0.6395144477369629.[0m
[32m[I 2022-04-21 11:43:55,135][0m Trial 44 finished with value: 0.5979223848870269 and parameters: {'splitter': 'random', 'min_samples_split': 0.09072628395193505, 'min_samples_leaf': 0.17142217598002457, 'min_weight_fraction_leaf': 0.04253497017640504, 'max_features': 0.660407209360092}. Best is trial 11 with value: 0.6395144477369629.[0m
[32m[I 2022-04-21 11:43:55,219][0m Trial 45 finished with value: 0.507219254387351 and parameters: {'splitter': 'random', 'min_samples_split': 0.03594477052656214, 'min_samples_leaf': 0.48088494227393985, 'min_weight_fraction_leaf': 0.07218354820288536, 'max_features': 0.40936012656550524}. Best is trial 11 with value: 0.6395144477369629.[0m
[32m[I 2022-04-21 11:43:55,293][0m Trial 46 finished with value: 0.585615499142949 and parameters: {'splitter': 'random', 'min_samples_split': 0.005780355911888815, 'min_samples_leaf': 0.06607875022816961, 'min_weight_fraction_leaf': 0.12112505236759985, 'max_features': 0.48840456484083966}. Best is trial 11 with value: 0.6395144477369629.[0m
[32m[I 2022-04-21 11:43:55,392][0m Trial 47 finished with value: 0.5554446413847055 and parameters: {'splitter': 'random', 'min_samples_split': 0.05698618748470628, 'min_samples_leaf': 0.01957870516603297, 'min_weight_fraction_leaf': 0.18705781216156595, 'max_features': 0.3117732588649584}. Best is trial 11 with value: 0.6395144477369629.[0m
[32m[I 2022-04-21 11:43:55,520][0m Trial 48 finished with value: 0.6279004026504758 and parameters: {'splitter': 'random', 'min_samples_split': 0.09819391183337803, 'min_samples_leaf': 0.09127381448725733, 'min_weight_fraction_leaf': 0.026268168044428178, 'max_features': 0.6674408507481905}. Best is trial 11 with value: 0.6395144477369629.[0m
[32m[I 2022-04-21 11:43:55,758][0m Trial 49 finished with value: 0.614079972744002 and parameters: {'splitter': 'random', 'min_samples_split': 0.06369549371849534, 'min_samples_leaf': 0.0037636124208873835, 'min_weight_fraction_leaf': 0.032225045117784415, 'max_features': 0.8261720123557759}. Best is trial 11 with value: 0.6395144477369629.[0m
[32m[I 2022-04-21 11:43:55,831][0m Trial 50 finished with value: 0.4864500423430857 and parameters: {'splitter': 'random', 'min_samples_split': 0.093894696275825, 'min_samples_leaf': 0.21291242922779974, 'min_weight_fraction_leaf': 0.41069074249973514, 'max_features': 0.6732122369206645}. Best is trial 11 with value: 0.6395144477369629.[0m
[32m[I 2022-04-21 11:43:55,914][0m Trial 51 finished with value: 0.6285862983446123 and parameters: {'splitter': 'random', 'min_samples_split': 0.026861527492598194, 'min_samples_leaf': 0.09810486326621724, 'min_weight_fraction_leaf': 0.02562591594473125, 'max_features': 0.5934385097200251}. Best is trial 11 with value: 0.6395144477369629.[0m
[32m[I 2022-04-21 11:43:56,046][0m Trial 52 finished with value: 0.6241526310003603 and parameters: {'splitter': 'random', 'min_samples_split': 0.023211958147202658, 'min_samples_leaf': 0.07551726565816351, 'min_weight_fraction_leaf': 0.02683549463799279, 'max_features': 0.7756565979838569}. Best is trial 11 with value: 0.6395144477369629.[0m
[32m[I 2022-04-21 11:43:56,137][0m Trial 53 finished with value: 0.6352011131669604 and parameters: {'splitter': 'random', 'min_samples_split': 0.034559559884291165, 'min_samples_leaf': 0.12849552588610935, 'min_weight_fraction_leaf': 0.07030372281098342, 'max_features': 0.5987788961289109}. Best is trial 11 with value: 0.6395144477369629.[0m
[32m[I 2022-04-21 11:43:56,246][0m Trial 54 finished with value: 0.6104178846419102 and parameters: {'splitter': 'random', 'min_samples_split': 0.0024745123134663483, 'min_samples_leaf': 0.1007286543123026, 'min_weight_fraction_leaf': 0.07296375991878787, 'max_features': 0.6233120384539241}. Best is trial 11 with value: 0.6395144477369629.[0m
[32m[I 2022-04-21 11:43:56,373][0m Trial 55 finished with value: 0.6090194521190403 and parameters: {'splitter': 'random', 'min_samples_split': 0.0241092209194364, 'min_samples_leaf': 0.12139260842137656, 'min_weight_fraction_leaf': 0.02269645871553053, 'max_features': 0.5877008760544302}. Best is trial 11 with value: 0.6395144477369629.[0m
[32m[I 2022-04-21 11:43:56,479][0m Trial 56 finished with value: 0.6013005311194857 and parameters: {'splitter': 'random', 'min_samples_split': 0.07267837545086535, 'min_samples_leaf': 0.1582311737196314, 'min_weight_fraction_leaf': 0.10322562617887969, 'max_features': 0.6746442810812263}. Best is trial 11 with value: 0.6395144477369629.[0m
[32m[I 2022-04-21 11:43:56,549][0m Trial 57 finished with value: 0.5896948041738103 and parameters: {'splitter': 'random', 'min_samples_split': 0.033040873639239916, 'min_samples_leaf': 0.13678691318996394, 'min_weight_fraction_leaf': 0.1790934445390537, 'max_features': 0.6301342764267471}. Best is trial 11 with value: 0.6395144477369629.[0m
[32m[I 2022-04-21 11:43:56,621][0m Trial 58 finished with value: 0.5203259052528477 and parameters: {'splitter': 'random', 'min_samples_split': 0.06232306391921886, 'min_samples_leaf': 0.08773356707335742, 'min_weight_fraction_leaf': 0.4865396509757592, 'max_features': 0.4946398007027698}. Best is trial 11 with value: 0.6395144477369629.[0m
[32m[I 2022-04-21 11:43:56,787][0m Trial 59 finished with value: 0.5274595493506146 and parameters: {'splitter': 'random', 'min_samples_split': 0.10272665798271546, 'min_samples_leaf': 0.022645582251676594, 'min_weight_fraction_leaf': 0.2695799381353762, 'max_features': 0.7478989244989811}. Best is trial 11 with value: 0.6395144477369629.[0m
[32m[I 2022-04-21 11:43:56,875][0m Trial 60 finished with value: 0.5596721197678048 and parameters: {'splitter': 'random', 'min_samples_split': 0.004651172152451578, 'min_samples_leaf': 0.2531995635765131, 'min_weight_fraction_leaf': 0.06073088062548272, 'max_features': 0.5684501680581133}. Best is trial 11 with value: 0.6395144477369629.[0m
[32m[I 2022-04-21 11:43:56,997][0m Trial 61 finished with value: 0.615884471037422 and parameters: {'splitter': 'random', 'min_samples_split': 0.0506296917527203, 'min_samples_leaf': 0.05310300187803643, 'min_weight_fraction_leaf': 0.02457015682325784, 'max_features': 0.5334502035772836}. Best is trial 11 with value: 0.6395144477369629.[0m
[32m[I 2022-04-21 11:43:57,101][0m Trial 62 finished with value: 0.6133959847807955 and parameters: {'splitter': 'random', 'min_samples_split': 0.04475713861948202, 'min_samples_leaf': 0.05816911575996386, 'min_weight_fraction_leaf': 0.04648472617072462, 'max_features': 0.4572986933840244}. Best is trial 11 with value: 0.6395144477369629.[0m
[32m[I 2022-04-21 11:43:57,206][0m Trial 63 finished with value: 0.6217289086209904 and parameters: {'splitter': 'random', 'min_samples_split': 0.07511782049185474, 'min_samples_leaf': 0.10317936034352687, 'min_weight_fraction_leaf': 0.015860043222533107, 'max_features': 0.6028996763777552}. Best is trial 11 with value: 0.6395144477369629.[0m
[32m[I 2022-04-21 11:43:57,317][0m Trial 64 finished with value: 0.6177457770851398 and parameters: {'splitter': 'random', 'min_samples_split': 0.02425912952902787, 'min_samples_leaf': 0.08056205973664424, 'min_weight_fraction_leaf': 0.08401004039750563, 'max_features': 0.5491499043059098}. Best is trial 11 with value: 0.6395144477369629.[0m
[32m[I 2022-04-21 11:43:57,452][0m Trial 65 finished with value: 0.6300316886577252 and parameters: {'splitter': 'random', 'min_samples_split': 0.0487248685707273, 'min_samples_leaf': 0.02647367283475439, 'min_weight_fraction_leaf': 0.06067913937509049, 'max_features': 0.6716502157979547}. Best is trial 11 with value: 0.6395144477369629.[0m
[32m[I 2022-04-21 11:43:57,808][0m Trial 66 finished with value: 0.5933449346978046 and parameters: {'splitter': 'best', 'min_samples_split': 0.42474785612510924, 'min_samples_leaf': 0.02987116614859247, 'min_weight_fraction_leaf': 0.06183664202940824, 'max_features': 0.671530949756055}. Best is trial 11 with value: 0.6395144477369629.[0m
[32m[I 2022-04-21 11:43:58,053][0m Trial 67 finished with value: 0.6101890453219968 and parameters: {'splitter': 'best', 'min_samples_split': 0.08896940488826198, 'min_samples_leaf': 0.12630876016127895, 'min_weight_fraction_leaf': 0.11499119678846076, 'max_features': 0.6935545845579907}. Best is trial 11 with value: 0.6395144477369629.[0m
[32m[I 2022-04-21 11:43:58,191][0m Trial 68 finished with value: 0.6206237278634977 and parameters: {'splitter': 'random', 'min_samples_split': 0.019117725206185793, 'min_samples_leaf': 0.014387106741874975, 'min_weight_fraction_leaf': 0.09205938116063912, 'max_features': 0.6465818442771122}. Best is trial 11 with value: 0.6395144477369629.[0m
[32m[I 2022-04-21 11:43:58,653][0m Trial 69 finished with value: 0.618381938377898 and parameters: {'splitter': 'best', 'min_samples_split': 0.12513724908177917, 'min_samples_leaf': 0.035269662328426675, 'min_weight_fraction_leaf': 0.017811739451302017, 'max_features': 0.7497348401901478}. Best is trial 11 with value: 0.6395144477369629.[0m
[32m[I 2022-04-21 11:43:58,738][0m Trial 70 finished with value: 0.5874615002735752 and parameters: {'splitter': 'random', 'min_samples_split': 0.03679776528047738, 'min_samples_leaf': 0.09416794049227976, 'min_weight_fraction_leaf': 0.1343461514491578, 'max_features': 0.3763855437459691}. Best is trial 11 with value: 0.6395144477369629.[0m
[32m[I 2022-04-21 11:43:58,836][0m Trial 71 finished with value: 0.624319154522075 and parameters: {'splitter': 'random', 'min_samples_split': 0.05756086581368515, 'min_samples_leaf': 0.05563622548135583, 'min_weight_fraction_leaf': 0.04683338301968357, 'max_features': 0.5863169363664826}. Best is trial 11 with value: 0.6395144477369629.[0m
[32m[I 2022-04-21 11:43:58,939][0m Trial 72 finished with value: 0.6223106701828113 and parameters: {'splitter': 'random', 'min_samples_split': 0.05065980131898262, 'min_samples_leaf': 0.0728850565784397, 'min_weight_fraction_leaf': 0.0003850359077347265, 'max_features': 0.6222064391502273}. Best is trial 11 with value: 0.6395144477369629.[0m
[32m[I 2022-04-21 11:43:59,034][0m Trial 73 finished with value: 0.5992935604108155 and parameters: {'splitter': 'random', 'min_samples_split': 0.07362417022203753, 'min_samples_leaf': 0.1121802839811771, 'min_weight_fraction_leaf': 0.03716637648869854, 'max_features': 0.5299263207090752}. Best is trial 11 with value: 0.6395144477369629.[0m
[32m[I 2022-04-21 11:43:59,225][0m Trial 74 finished with value: 0.6248480865968067 and parameters: {'splitter': 'random', 'min_samples_split': 0.1126391030347784, 'min_samples_leaf': 0.002318698885657628, 'min_weight_fraction_leaf': 0.05788424414812901, 'max_features': 0.5735525221514901}. Best is trial 11 with value: 0.6395144477369629.[0m
[32m[I 2022-04-21 11:43:59,599][0m Trial 75 finished with value: 0.626565874333304 and parameters: {'splitter': 'best', 'min_samples_split': 0.012791327741376642, 'min_samples_leaf': 0.041844821106465147, 'min_weight_fraction_leaf': 0.01427274152891228, 'max_features': 0.7991200778055939}. Best is trial 11 with value: 0.6395144477369629.[0m
[32m[I 2022-04-21 11:44:00,036][0m Trial 76 finished with value: 0.6095446357475034 and parameters: {'splitter': 'best', 'min_samples_split': 0.01580514899105869, 'min_samples_leaf': 0.03955509573692374, 'min_weight_fraction_leaf': 0.017029084049266452, 'max_features': 0.9509650054025289}. Best is trial 11 with value: 0.6395144477369629.[0m
[32m[I 2022-04-21 11:44:00,129][0m Trial 77 finished with value: 0.5155975170068372 and parameters: {'splitter': 'best', 'min_samples_split': 0.0017765395107558618, 'min_samples_leaf': 0.42921214135068686, 'min_weight_fraction_leaf': 0.08041185146649708, 'max_features': 0.878506691216615}. Best is trial 11 with value: 0.6395144477369629.[0m
[32m[I 2022-04-21 11:44:00,427][0m Trial 78 finished with value: 0.567663473284861 and parameters: {'splitter': 'best', 'min_samples_split': 0.16523108176710544, 'min_samples_leaf': 0.02024113001398651, 'min_weight_fraction_leaf': 0.23643389229534917, 'max_features': 0.7953910088987122}. Best is trial 11 with value: 0.6395144477369629.[0m
[32m[I 2022-04-21 11:44:00,487][0m Trial 79 finished with value: 0.5415004343670349 and parameters: {'splitter': 'best', 'min_samples_split': 0.03474296549022644, 'min_samples_leaf': 0.32176709070909504, 'min_weight_fraction_leaf': 0.05423358849621103, 'max_features': 0.8444812693738635}. Best is trial 11 with value: 0.6395144477369629.[0m
[32m[I 2022-04-21 11:44:00,683][0m Trial 80 finished with value: 0.6088767983836343 and parameters: {'splitter': 'best', 'min_samples_split': 0.0986381721721004, 'min_samples_leaf': 0.13926677902195633, 'min_weight_fraction_leaf': 0.015555486595353486, 'max_features': 0.725443906966435}. Best is trial 11 with value: 0.6395144477369629.[0m
[32m[I 2022-04-21 11:44:00,774][0m Trial 81 finished with value: 0.6290117892532813 and parameters: {'splitter': 'random', 'min_samples_split': 0.04697497703739499, 'min_samples_leaf': 0.062096786632036494, 'min_weight_fraction_leaf': 0.036216413503335654, 'max_features': 0.4551374827151386}. Best is trial 11 with value: 0.6395144477369629.[0m
[32m[I 2022-04-21 11:44:00,941][0m Trial 82 finished with value: 0.5959458657628074 and parameters: {'splitter': 'best', 'min_samples_split': 0.1855421727750624, 'min_samples_leaf': 0.08370787796834439, 'min_weight_fraction_leaf': 0.031839765356163265, 'max_features': 0.5081537556411871}. Best is trial 11 with value: 0.6395144477369629.[0m
[32m[I 2022-04-21 11:44:01,077][0m Trial 83 finished with value: 0.6052655110129816 and parameters: {'splitter': 'random', 'min_samples_split': 0.03569190848578731, 'min_samples_leaf': 0.06441080394900872, 'min_weight_fraction_leaf': 0.06871346684394547, 'max_features': 0.4036007987900887}. Best is trial 11 with value: 0.6395144477369629.[0m
