[32m[I 2022-04-21 22:13:02,165][0m Trial 287 finished with value: 0.6867306061317607 and parameters: {'loss': 'coxph', 'learning_rate': 5.316132431663652e-05, 'n_estimators': 373, 'criterion': 'squared_error', 'min_samples_split': 7, 'min_samples_leaf': 10, 'min_weight_fraction_leaf': 0.17542709726830633, 'min_impurity_decrease': 0.05152703446508, 'max_features': 0.856938294670853, 'subsample': 0.1687094544500886, 'dropout_rate': 0.023634915836549596, 'ccp_alpha': 0.0024887407577103005}. Best is trial 187 with value: 0.6933481836305168.[0m
[32m[I 2022-04-21 22:13:36,493][0m Trial 288 finished with value: 0.6725743270967646 and parameters: {'loss': 'coxph', 'learning_rate': 7.312102774426738e-05, 'n_estimators': 338, 'criterion': 'squared_error', 'min_samples_split': 7, 'min_samples_leaf': 10, 'min_weight_fraction_leaf': 0.16808521612240127, 'min_impurity_decrease': 0.08680030263092675, 'max_features': 0.9236452047332667, 'subsample': 0.24716057009489, 'dropout_rate': 0.018875338640091794, 'ccp_alpha': 0.23672910495882726}. Best is trial 187 with value: 0.6933481836305168.[0m
[32m[I 2022-04-21 22:14:19,964][0m Trial 289 finished with value: 0.6697293961484119 and parameters: {'loss': 'coxph', 'learning_rate': 4.82753701217728e-05, 'n_estimators': 422, 'criterion': 'squared_error', 'min_samples_split': 7, 'min_samples_leaf': 10, 'min_weight_fraction_leaf': 0.19181364952798519, 'min_impurity_decrease': 0.05277812652226442, 'max_features': 0.8829307909426163, 'subsample': 0.25409559169151263, 'dropout_rate': 0.04585583129552729, 'ccp_alpha': 0.21131210724865007}. Best is trial 187 with value: 0.6933481836305168.[0m
[32m[I 2022-04-21 22:15:23,687][0m Trial 290 finished with value: 0.6860142463549714 and parameters: {'loss': 'coxph', 'learning_rate': 7.289564880727238e-05, 'n_estimators': 440, 'criterion': 'squared_error', 'min_samples_split': 7, 'min_samples_leaf': 9, 'min_weight_fraction_leaf': 0.18669290846607978, 'min_impurity_decrease': 0.06653152947441113, 'max_features': 0.4064375324378406, 'subsample': 0.22611101426263225, 'dropout_rate': 0.0009570220491342592, 'ccp_alpha': 0.09180660007406671}. Best is trial 187 with value: 0.6933481836305168.[0m
[32m[I 2022-04-21 22:15:51,173][0m Trial 291 finished with value: 0.6677658486201136 and parameters: {'loss': 'coxph', 'learning_rate': 9.460407857249111e-05, 'n_estimators': 349, 'criterion': 'squared_error', 'min_samples_split': 7, 'min_samples_leaf': 10, 'min_weight_fraction_leaf': 0.16094218401042598, 'min_impurity_decrease': 0.039455961735395007, 'max_features': 0.9618297325499416, 'subsample': 0.2785592555243479, 'dropout_rate': 0.08978791166348453, 'ccp_alpha': 0.3128246470763405}. Best is trial 187 with value: 0.6933481836305168.[0m
[32m[I 2022-04-21 22:16:23,355][0m Trial 292 finished with value: 0.5 and parameters: {'loss': 'coxph', 'learning_rate': 0.0002603504927017951, 'n_estimators': 372, 'criterion': 'squared_error', 'min_samples_split': 7, 'min_samples_leaf': 10, 'min_weight_fraction_leaf': 0.24281770562009458, 'min_impurity_decrease': 0.04394415249701647, 'max_features': 0.9805133448296427, 'subsample': 0.5694566990222325, 'dropout_rate': 0.04920124713546178, 'ccp_alpha': 1.9955257099806456}. Best is trial 187 with value: 0.6933481836305168.[0m
[32m[I 2022-04-21 22:17:15,045][0m Trial 293 finished with value: 0.6853006941627617 and parameters: {'loss': 'coxph', 'learning_rate': 3.886444399362383e-05, 'n_estimators': 403, 'criterion': 'squared_error', 'min_samples_split': 7, 'min_samples_leaf': 10, 'min_weight_fraction_leaf': 0.1972248568734457, 'min_impurity_decrease': 0.08856119303352654, 'max_features': 0.9981253961407603, 'subsample': 0.265996402769583, 'dropout_rate': 0.07862618217055184, 'ccp_alpha': 0.002552691813113128}. Best is trial 187 with value: 0.6933481836305168.[0m
[32m[I 2022-04-21 22:17:47,888][0m Trial 294 finished with value: 0.6663271575205115 and parameters: {'loss': 'coxph', 'learning_rate': 5.7483531418871166e-05, 'n_estimators': 336, 'criterion': 'squared_error', 'min_samples_split': 7, 'min_samples_leaf': 10, 'min_weight_fraction_leaf': 0.20819320849408984, 'min_impurity_decrease': 0.025367276095039235, 'max_features': 0.9326615573376014, 'subsample': 0.2835893415859917, 'dropout_rate': 0.10971949521069449, 'ccp_alpha': 0.18250348833035357}. Best is trial 187 with value: 0.6933481836305168.[0m
/media/san2_ssd/data/Workdir/survival/venv/lib/python3.8/site-packages/sksurv/ensemble/boosting.py:955: RuntimeWarning: divide by zero encountered in log
  time = numpy.log(time)
/media/san2_ssd/data/Workdir/survival/venv/lib/python3.8/site-packages/sksurv/ensemble/boosting.py:955: RuntimeWarning: divide by zero encountered in log
  time = numpy.log(time)
/media/san2_ssd/data/Workdir/survival/venv/lib/python3.8/site-packages/sksurv/ensemble/boosting.py:955: RuntimeWarning: divide by zero encountered in log
  time = numpy.log(time)
/media/san2_ssd/data/Workdir/survival/venv/lib/python3.8/site-packages/sksurv/ensemble/boosting.py:955: RuntimeWarning: divide by zero encountered in log
  time = numpy.log(time)
[32m[I 2022-04-21 22:17:54,653][0m Trial 295 finished with value: -0.7333453605869843 and parameters: {'loss': 'squared', 'learning_rate': 8.083265412759549e-05, 'n_estimators': 351, 'criterion': 'squared_error', 'min_samples_split': 8, 'min_samples_leaf': 4, 'min_weight_fraction_leaf': 0.17383287363378505, 'min_impurity_decrease': 0.06631090038581211, 'max_features': 0.5032251154284707, 'subsample': 0.23978754146356365, 'dropout_rate': 0.019967784119248988, 'ccp_alpha': 0.001536949967474133}. Best is trial 187 with value: 0.6933481836305168.[0m
[32m[I 2022-04-21 22:18:19,731][0m Trial 296 finished with value: 0.6855976730773967 and parameters: {'loss': 'coxph', 'learning_rate': 0.00015756782126505458, 'n_estimators': 329, 'criterion': 'squared_error', 'min_samples_split': 3, 'min_samples_leaf': 9, 'min_weight_fraction_leaf': 0.18584141540356203, 'min_impurity_decrease': 0.043546920495309595, 'max_features': 0.3220893051576843, 'subsample': 0.25627673997312667, 'dropout_rate': 0.3076975727395781, 'ccp_alpha': 0.08533092494275367}. Best is trial 187 with value: 0.6933481836305168.[0m
[32m[I 2022-04-21 22:18:51,931][0m Trial 297 finished with value: 0.6873786049173543 and parameters: {'loss': 'coxph', 'learning_rate': 6.512248765293284e-05, 'n_estimators': 382, 'criterion': 'squared_error', 'min_samples_split': 7, 'min_samples_leaf': 10, 'min_weight_fraction_leaf': 0.21020349353256906, 'min_impurity_decrease': 0.019234619365776563, 'max_features': 0.8888317718126378, 'subsample': 0.2851891576300857, 'dropout_rate': 0.05785415536472397, 'ccp_alpha': 0.19501624250783894}. Best is trial 187 with value: 0.6933481836305168.[0m
[32m[I 2022-04-21 22:19:27,488][0m Trial 298 finished with value: 0.6233687003790582 and parameters: {'loss': 'coxph', 'learning_rate': 4.6018096417935273e-05, 'n_estimators': 360, 'criterion': 'squared_error', 'min_samples_split': 7, 'min_samples_leaf': 10, 'min_weight_fraction_leaf': 0.19809018547902166, 'min_impurity_decrease': 0.09329725420479144, 'max_features': 0.8532657143120407, 'subsample': 0.274632508941886, 'dropout_rate': 0.03714506461945488, 'ccp_alpha': 0.4619643647218361}. Best is trial 187 with value: 0.6933481836305168.[0m
[32m[I 2022-04-21 22:19:52,344][0m Trial 299 finished with value: 0.6556203951897036 and parameters: {'loss': 'coxph', 'learning_rate': 3.2561454252473305e-05, 'n_estimators': 319, 'criterion': 'squared_error', 'min_samples_split': 7, 'min_samples_leaf': 5, 'min_weight_fraction_leaf': 0.22858598121303042, 'min_impurity_decrease': 0.06481238338951656, 'max_features': 0.5655562461487227, 'subsample': 0.29697094362785553, 'dropout_rate': 0.07711436155267931, 'ccp_alpha': 0.295197607404896}. Best is trial 187 with value: 0.6933481836305168.[0m
[32m[I 2022-04-21 22:20:18,292][0m Trial 300 finished with value: 0.5 and parameters: {'loss': 'coxph', 'learning_rate': 0.00030008194401849787, 'n_estimators': 341, 'criterion': 'absolute_error', 'min_samples_split': 7, 'min_samples_leaf': 10, 'min_weight_fraction_leaf': 0.21707784943306088, 'min_impurity_decrease': 0.8173294147418434, 'max_features': 0.9649251182198081, 'subsample': 0.22571382382709831, 'dropout_rate': 0.09817619982153558, 'ccp_alpha': 0.10503847022922522}. Best is trial 187 with value: 0.6933481836305168.[0m
[32m[I 2022-04-21 22:20:46,521][0m Trial 301 finished with value: 0.5 and parameters: {'loss': 'coxph', 'learning_rate': 0.00010010123972969387, 'n_estimators': 323, 'criterion': 'squared_error', 'min_samples_split': 7, 'min_samples_leaf': 9, 'min_weight_fraction_leaf': 0.1892709513374588, 'min_impurity_decrease': 0.001871759297182871, 'max_features': 0.6200913585333793, 'subsample': 0.2592589186302378, 'dropout_rate': 0.059097001088911645, 'ccp_alpha': 3.0339049025627807}. Best is trial 187 with value: 0.6933481836305168.[0m
[32m[I 2022-04-21 22:20:59,188][0m Trial 302 finished with value: 0.678828170161717 and parameters: {'loss': 'coxph', 'learning_rate': 5.4160853043462484e-05, 'n_estimators': 247, 'criterion': 'squared_error', 'min_samples_split': 8, 'min_samples_leaf': 10, 'min_weight_fraction_leaf': 0.20487247943813588, 'min_impurity_decrease': 0.039976881566041955, 'max_features': 0.9482430100333902, 'subsample': 0.19118495595057838, 'dropout_rate': 0.03725331050990974, 'ccp_alpha': 0.19398116383588074}. Best is trial 187 with value: 0.6933481836305168.[0m
[32m[I 2022-04-21 22:21:35,290][0m Trial 303 finished with value: 0.6875734852190123 and parameters: {'loss': 'coxph', 'learning_rate': 0.00012947675994505383, 'n_estimators': 353, 'criterion': 'squared_error', 'min_samples_split': 7, 'min_samples_leaf': 10, 'min_weight_fraction_leaf': 0.23471363526766945, 'min_impurity_decrease': 0.07332895836188492, 'max_features': 0.913469846275581, 'subsample': 0.2935929029514823, 'dropout_rate': 0.06811875232737807, 'ccp_alpha': 0.0866675819795148}. Best is trial 187 with value: 0.6933481836305168.[0m
[32m[I 2022-04-21 22:22:04,810][0m Trial 304 finished with value: 0.5 and parameters: {'loss': 'coxph', 'learning_rate': 7.073918916207092e-05, 'n_estimators': 411, 'criterion': 'squared_error', 'min_samples_split': 7, 'min_samples_leaf': 10, 'min_weight_fraction_leaf': 0.17655082224863047, 'min_impurity_decrease': 0.7478356998895158, 'max_features': 0.930330693648124, 'subsample': 0.2723407500851844, 'dropout_rate': 0.5821574597840045, 'ccp_alpha': 0.3537119464828525}. Best is trial 187 with value: 0.6933481836305168.[0m
[32m[I 2022-04-21 22:22:38,874][0m Trial 305 finished with value: 0.6834241213462307 and parameters: {'loss': 'coxph', 'learning_rate': 0.00024945226016301266, 'n_estimators': 334, 'criterion': 'squared_error', 'min_samples_split': 7, 'min_samples_leaf': 10, 'min_weight_fraction_leaf': 0.19797228778504883, 'min_impurity_decrease': 0.12380466699289856, 'max_features': 0.8311153371009298, 'subsample': 0.32000251511333483, 'dropout_rate': 0.01803830121452655, 'ccp_alpha': 0.08292806586380645}. Best is trial 187 with value: 0.6933481836305168.[0m
[32m[I 2022-04-21 22:23:05,194][0m Trial 306 finished with value: 0.6730046411129227 and parameters: {'loss': 'coxph', 'learning_rate': 3.283689841900112e-05, 'n_estimators': 318, 'criterion': 'squared_error', 'min_samples_split': 7, 'min_samples_leaf': 10, 'min_weight_fraction_leaf': 0.21188216482389807, 'min_impurity_decrease': 0.0227948960047444, 'max_features': 0.8944657178100928, 'subsample': 0.2464034713402915, 'dropout_rate': 0.08888730509027287, 'ccp_alpha': 0.22628140268549848}. Best is trial 187 with value: 0.6933481836305168.[0m
[32m[I 2022-04-21 22:23:23,200][0m Trial 307 finished with value: 0.6879003123806964 and parameters: {'loss': 'coxph', 'learning_rate': 0.0003269696654105558, 'n_estimators': 288, 'criterion': 'squared_error', 'min_samples_split': 7, 'min_samples_leaf': 9, 'min_weight_fraction_leaf': 0.22252562171202672, 'min_impurity_decrease': 0.05278029735964452, 'max_features': 0.9520251802741683, 'subsample': 0.30217909973383794, 'dropout_rate': 0.04873828393558066, 'ccp_alpha': 0.0069460330064286535}. Best is trial 187 with value: 0.6933481836305168.[0m
[32m[I 2022-04-21 22:23:40,027][0m Trial 308 finished with value: 0.6845683682571128 and parameters: {'loss': 'coxph', 'learning_rate': 4.531050325253248e-05, 'n_estimators': 303, 'criterion': 'squared_error', 'min_samples_split': 7, 'min_samples_leaf': 3, 'min_weight_fraction_leaf': 0.18409404923531705, 'min_impurity_decrease': 0.10203355607130533, 'max_features': 0.9171504809729226, 'subsample': 0.28124363318470175, 'dropout_rate': 0.29210339763943244, 'ccp_alpha': 0.1493092816857797}. Best is trial 187 with value: 0.6933481836305168.[0m
[32m[I 2022-04-21 22:24:09,329][0m Trial 309 finished with value: 0.6652972018322468 and parameters: {'loss': 'coxph', 'learning_rate': 0.00015594305042328612, 'n_estimators': 336, 'criterion': 'squared_error', 'min_samples_split': 6, 'min_samples_leaf': 2, 'min_weight_fraction_leaf': 0.15344768833489508, 'min_impurity_decrease': 0.022498302458970717, 'max_features': 0.8776299706403792, 'subsample': 0.32292791057976167, 'dropout_rate': 0.15472699429242526, 'ccp_alpha': 0.24906207187975038}. Best is trial 187 with value: 0.6933481836305168.[0m
[32m[I 2022-04-21 22:24:29,272][0m Trial 310 finished with value: 0.6855901624083867 and parameters: {'loss': 'coxph', 'learning_rate': 8.711002181040786e-05, 'n_estimators': 271, 'criterion': 'squared_error', 'min_samples_split': 7, 'min_samples_leaf': 10, 'min_weight_fraction_leaf': 0.16591138794339888, 'min_impurity_decrease': 0.04297645096616324, 'max_features': 0.9760588961485418, 'subsample': 0.25599683474511786, 'dropout_rate': 0.0758754603022159, 'ccp_alpha': 0.11011136647144867}. Best is trial 187 with value: 0.6933481836305168.[0m
[32m[I 2022-04-21 22:25:02,161][0m Trial 311 finished with value: 0.628086143308687 and parameters: {'loss': 'coxph', 'learning_rate': 5.652175792441846e-05, 'n_estimators': 364, 'criterion': 'squared_error', 'min_samples_split': 7, 'min_samples_leaf': 10, 'min_weight_fraction_leaf': 0.20075716832494356, 'min_impurity_decrease': 0.0012921432451519776, 'max_features': 0.8479892229727183, 'subsample': 0.30421785169560966, 'dropout_rate': 0.10897163406733897, 'ccp_alpha': 0.39947066119661334}. Best is trial 187 with value: 0.6933481836305168.[0m
[32m[I 2022-04-21 22:25:43,571][0m Trial 312 finished with value: 0.6906846151065403 and parameters: {'loss': 'coxph', 'learning_rate': 3.9701552668168525e-05, 'n_estimators': 386, 'criterion': 'squared_error', 'min_samples_split': 7, 'min_samples_leaf': 9, 'min_weight_fraction_leaf': 0.1901652205587742, 'min_impurity_decrease': 0.07556359865222174, 'max_features': 0.9342139526793872, 'subsample': 0.2796114438608358, 'dropout_rate': 0.034959357511256936, 'ccp_alpha': 0.007351271739757145}. Best is trial 187 with value: 0.6933481836305168.[0m
/media/san2_ssd/data/Workdir/survival/venv/lib/python3.8/site-packages/sksurv/ensemble/boosting.py:955: RuntimeWarning: divide by zero encountered in log
  time = numpy.log(time)
/media/san2_ssd/data/Workdir/survival/venv/lib/python3.8/site-packages/sksurv/ensemble/boosting.py:955: RuntimeWarning: divide by zero encountered in log
  time = numpy.log(time)
/media/san2_ssd/data/Workdir/survival/venv/lib/python3.8/site-packages/sksurv/ensemble/boosting.py:955: RuntimeWarning: divide by zero encountered in log
  time = numpy.log(time)
/media/san2_ssd/data/Workdir/survival/venv/lib/python3.8/site-packages/sksurv/ensemble/boosting.py:955: RuntimeWarning: divide by zero encountered in log
  time = numpy.log(time)
[32m[I 2022-04-21 22:25:50,545][0m Trial 313 finished with value: -0.7278576522601694 and parameters: {'loss': 'squared', 'learning_rate': 3.844057141844305e-05, 'n_estimators': 395, 'criterion': 'squared_error', 'min_samples_split': 8, 'min_samples_leaf': 9, 'min_weight_fraction_leaf': 0.18878461550042544, 'min_impurity_decrease': 0.08570473958381564, 'max_features': 0.9648011300018474, 'subsample': 0.3339089786990273, 'dropout_rate': 0.019144320334785657, 'ccp_alpha': 0.002032105913709989}. Best is trial 187 with value: 0.6933481836305168.[0m
[32m[I 2022-04-21 22:26:32,112][0m Trial 314 finished with value: 0.5 and parameters: {'loss': 'coxph', 'learning_rate': 2.3042089707365326e-05, 'n_estimators': 380, 'criterion': 'squared_error', 'min_samples_split': 7, 'min_samples_leaf': 9, 'min_weight_fraction_leaf': 0.17866562031548686, 'min_impurity_decrease': 0.9309394105503858, 'max_features': 0.9029102283439594, 'subsample': 0.29347713855116075, 'dropout_rate': 0.05909990796929241, 'ccp_alpha': 0.18983359031627384}. Best is trial 187 with value: 0.6933481836305168.[0m
[32m[I 2022-04-21 22:26:49,089][0m Trial 315 finished with value: 0.6868113220433191 and parameters: {'loss': 'coxph', 'learning_rate': 3.821481883004111e-05, 'n_estimators': 294, 'criterion': 'squared_error', 'min_samples_split': 7, 'min_samples_leaf': 9, 'min_weight_fraction_leaf': 0.21478730461891116, 'min_impurity_decrease': 0.12044725042586268, 'max_features': 0.8217785256575736, 'subsample': 0.2613702117231256, 'dropout_rate': 0.09561578106329341, 'ccp_alpha': 0.0036525452058199237}. Best is trial 187 with value: 0.6933481836305168.[0m
[32m[I 2022-04-21 22:27:18,701][0m Trial 316 finished with value: 0.6697423696479984 and parameters: {'loss': 'coxph', 'learning_rate': 1.7415843582038765e-05, 'n_estimators': 320, 'criterion': 'squared_error', 'min_samples_split': 7, 'min_samples_leaf': 9, 'min_weight_fraction_leaf': 0.2303192349842501, 'min_impurity_decrease': 0.06699363332058089, 'max_features': 0.9465125057618662, 'subsample': 0.20979004172057292, 'dropout_rate': 5.3290842346870315e-05, 'ccp_alpha': 0.3207263759764443}. Best is trial 187 with value: 0.6933481836305168.[0m
[32m[I 2022-04-21 22:27:36,805][0m Trial 317 finished with value: 0.6867383460148699 and parameters: {'loss': 'coxph', 'learning_rate': 3.009757515563952e-05, 'n_estimators': 281, 'criterion': 'squared_error', 'min_samples_split': 7, 'min_samples_leaf': 9, 'min_weight_fraction_leaf': 0.20499226418668082, 'min_impurity_decrease': 0.09508452113813211, 'max_features': 0.8619318715730236, 'subsample': 0.23711139164866077, 'dropout_rate': 0.027824863020694552, 'ccp_alpha': 0.1585501402379092}. Best is trial 187 with value: 0.6933481836305168.[0m
[32m[I 2022-04-21 22:27:51,128][0m Trial 318 finished with value: 0.5 and parameters: {'loss': 'coxph', 'learning_rate': 0.0002307159876528924, 'n_estimators': 228, 'criterion': 'squared_error', 'min_samples_split': 7, 'min_samples_leaf': 9, 'min_weight_fraction_leaf': 0.2199491567490367, 'min_impurity_decrease': 0.0762851342619984, 'max_features': 0.9362313380748195, 'subsample': 0.03334398599673949, 'dropout_rate': 0.18273663595840758, 'ccp_alpha': 0.09643598549629312}. Best is trial 187 with value: 0.6933481836305168.[0m
[32m[I 2022-04-21 22:28:26,004][0m Trial 319 finished with value: 0.6644189085623763 and parameters: {'loss': 'coxph', 'learning_rate': 4.546083807417025e-05, 'n_estimators': 422, 'criterion': 'squared_error', 'min_samples_split': 7, 'min_samples_leaf': 10, 'min_weight_fraction_leaf': 0.1920783789781924, 'min_impurity_decrease': 0.05706126320471845, 'max_features': 0.9054537447031206, 'subsample': 0.31417246320719566, 'dropout_rate': 0.45376857791605923, 'ccp_alpha': 0.2651193603928815}. Best is trial 187 with value: 0.6933481836305168.[0m
[32m[I 2022-04-21 22:28:48,495][0m Trial 320 finished with value: 0.6864213877219283 and parameters: {'loss': 'coxph', 'learning_rate': 0.00011797468277105534, 'n_estimators': 306, 'criterion': 'squared_error', 'min_samples_split': 7, 'min_samples_leaf': 10, 'min_weight_fraction_leaf': 0.25121596358493026, 'min_impurity_decrease': 0.025787882871154136, 'max_features': 0.9814236398495985, 'subsample': 0.28310102664755976, 'dropout_rate': 0.07540381830791645, 'ccp_alpha': 0.1729982119356827}. Best is trial 187 with value: 0.6933481836305168.[0m
[32m[I 2022-04-21 22:29:20,450][0m Trial 321 finished with value: 0.6771056429580987 and parameters: {'loss': 'coxph', 'learning_rate': 0.0003444134964631795, 'n_estimators': 383, 'criterion': 'absolute_error', 'min_samples_split': 7, 'min_samples_leaf': 10, 'min_weight_fraction_leaf': 0.2087108755351292, 'min_impurity_decrease': 0.10589758933012233, 'max_features': 0.8809118857152596, 'subsample': 0.3637311662656494, 'dropout_rate': 0.30985828367160084, 'ccp_alpha': 0.005175925364017174}. Best is trial 187 with value: 0.6933481836305168.[0m
[32m[I 2022-04-21 22:29:39,793][0m Trial 322 finished with value: 0.6855019767309994 and parameters: {'loss': 'coxph', 'learning_rate': 5.546146895674767e-05, 'n_estimators': 328, 'criterion': 'squared_error', 'min_samples_split': 7, 'min_samples_leaf': 9, 'min_weight_fraction_leaf': 0.1705590170512701, 'min_impurity_decrease': 0.020466348596572904, 'max_features': 0.8047162341429415, 'subsample': 0.32852242600791914, 'dropout_rate': 0.11387284397576733, 'ccp_alpha': 0.09658365621094461}. Best is trial 187 with value: 0.6933481836305168.[0m
[32m[I 2022-04-21 22:30:04,278][0m Trial 323 finished with value: 0.5 and parameters: {'loss': 'coxph', 'learning_rate': 0.00015581381140850886, 'n_estimators': 312, 'criterion': 'squared_error', 'min_samples_split': 6, 'min_samples_leaf': 10, 'min_weight_fraction_leaf': 0.23864876404803753, 'min_impurity_decrease': 0.9826583631319099, 'max_features': 0.43936627347341484, 'subsample': 0.30519620054951757, 'dropout_rate': 0.04225289234817948, 'ccp_alpha': 0.26513390236568496}. Best is trial 187 with value: 0.6933481836305168.[0m
