[32m[I 2022-04-21 11:38:42,684][0m Trial 756 finished with value: 0.8348703389712995 and parameters: {'splitter': 'best', 'min_samples_split': 0.28652871884925757, 'min_samples_leaf': 0.03585640086404007, 'min_weight_fraction_leaf': 0.04480468241072959, 'max_features': 0.7413100281358387}. Best is trial 499 with value: 0.8396174698878165.[0m
[32m[I 2022-04-21 11:38:42,793][0m Trial 757 finished with value: 0.8318450474400789 and parameters: {'splitter': 'best', 'min_samples_split': 0.2737671951529744, 'min_samples_leaf': 0.036543224107886005, 'min_weight_fraction_leaf': 0.2657502566878282, 'max_features': 0.770647969939996}. Best is trial 499 with value: 0.8396174698878165.[0m
[32m[I 2022-04-21 11:38:42,915][0m Trial 758 finished with value: 0.8385374292394825 and parameters: {'splitter': 'best', 'min_samples_split': 0.27686955700881377, 'min_samples_leaf': 0.0013285789003153528, 'min_weight_fraction_leaf': 0.04161289829884603, 'max_features': 0.7527056513527367}. Best is trial 499 with value: 0.8396174698878165.[0m
[32m[I 2022-04-21 11:38:43,010][0m Trial 759 finished with value: 0.65 and parameters: {'splitter': 'best', 'min_samples_split': 0.287639919287609, 'min_samples_leaf': 0.4719458640400344, 'min_weight_fraction_leaf': 0.06599102636786822, 'max_features': 0.6524692243310021}. Best is trial 499 with value: 0.8396174698878165.[0m
[32m[I 2022-04-21 11:38:43,110][0m Trial 760 finished with value: 0.8355801993971674 and parameters: {'splitter': 'best', 'min_samples_split': 0.27600359835507365, 'min_samples_leaf': 0.015846761008313864, 'min_weight_fraction_leaf': 0.05629556597259268, 'max_features': 0.6446645083452458}. Best is trial 499 with value: 0.8396174698878165.[0m
[32m[I 2022-04-21 11:38:43,213][0m Trial 761 finished with value: 0.8335033648020842 and parameters: {'splitter': 'best', 'min_samples_split': 0.290424032922908, 'min_samples_leaf': 0.030934834520771032, 'min_weight_fraction_leaf': 0.03884338577298767, 'max_features': 0.7293111463217375}. Best is trial 499 with value: 0.8396174698878165.[0m
[32m[I 2022-04-21 11:38:43,314][0m Trial 762 finished with value: 0.8396174698878165 and parameters: {'splitter': 'best', 'min_samples_split': 0.2717536750865411, 'min_samples_leaf': 0.009811571281100905, 'min_weight_fraction_leaf': 0.051046152320214505, 'max_features': 0.6749659995271817}. Best is trial 499 with value: 0.8396174698878165.[0m
[32m[I 2022-04-21 11:38:43,409][0m Trial 763 finished with value: 0.8337699781920435 and parameters: {'splitter': 'random', 'min_samples_split': 0.2716930120625149, 'min_samples_leaf': 0.001479008112440325, 'min_weight_fraction_leaf': 0.052604180018761285, 'max_features': 0.7294588622723814}. Best is trial 499 with value: 0.8396174698878165.[0m
[32m[I 2022-04-21 11:38:43,550][0m Trial 764 finished with value: 0.8318869790887286 and parameters: {'splitter': 'best', 'min_samples_split': 0.28261779312143553, 'min_samples_leaf': 0.012728589416627398, 'min_weight_fraction_leaf': 0.07748283595114078, 'max_features': 0.6693905253783226}. Best is trial 499 with value: 0.8396174698878165.[0m
[32m[I 2022-04-21 11:38:43,784][0m Trial 765 finished with value: 0.8335144387856227 and parameters: {'splitter': 'best', 'min_samples_split': 0.3037629328064124, 'min_samples_leaf': 0.010087883545001798, 'min_weight_fraction_leaf': 0.06373824117574912, 'max_features': 0.7780110942464205}. Best is trial 499 with value: 0.8396174698878165.[0m
[32m[I 2022-04-21 11:38:44,065][0m Trial 766 finished with value: 0.8394676524280678 and parameters: {'splitter': 'best', 'min_samples_split': 0.272949435328105, 'min_samples_leaf': 0.022174442374992526, 'min_weight_fraction_leaf': 0.046647987624318175, 'max_features': 0.6769948451518609}. Best is trial 499 with value: 0.8396174698878165.[0m
[32m[I 2022-04-21 11:38:44,223][0m Trial 767 finished with value: 0.6864017167921991 and parameters: {'splitter': 'best', 'min_samples_split': 0.26692277731646485, 'min_samples_leaf': 0.00920623935834136, 'min_weight_fraction_leaf': 0.12301124520797262, 'max_features': 0.38130930999532797}. Best is trial 499 with value: 0.8396174698878165.[0m
[32m[I 2022-04-21 11:38:44,353][0m Trial 768 finished with value: 0.8382577519146084 and parameters: {'splitter': 'best', 'min_samples_split': 0.2674904308431119, 'min_samples_leaf': 0.008047795520135872, 'min_weight_fraction_leaf': 0.051430709802031904, 'max_features': 0.7039859042832863}. Best is trial 499 with value: 0.8396174698878165.[0m
[32m[I 2022-04-21 11:38:44,453][0m Trial 769 finished with value: 0.8340187950162761 and parameters: {'splitter': 'best', 'min_samples_split': 0.27904171602539846, 'min_samples_leaf': 0.02013258863457291, 'min_weight_fraction_leaf': 0.06689277253426573, 'max_features': 0.7220934393928408}. Best is trial 499 with value: 0.8396174698878165.[0m
[32m[I 2022-04-21 11:38:44,555][0m Trial 770 finished with value: 0.8327613710981948 and parameters: {'splitter': 'best', 'min_samples_split': 0.29415505847806145, 'min_samples_leaf': 0.02100860229431986, 'min_weight_fraction_leaf': 0.05748475278709101, 'max_features': 0.7206084590032867}. Best is trial 499 with value: 0.8396174698878165.[0m
[32m[I 2022-04-21 11:38:44,669][0m Trial 771 finished with value: 0.720122309788786 and parameters: {'splitter': 'best', 'min_samples_split': 0.27123846769596194, 'min_samples_leaf': 0.009379751770318683, 'min_weight_fraction_leaf': 0.3114512486963541, 'max_features': 0.7473120462209669}. Best is trial 499 with value: 0.8396174698878165.[0m
[32m[I 2022-04-21 11:38:44,858][0m Trial 772 finished with value: 0.825849160299934 and parameters: {'splitter': 'best', 'min_samples_split': 0.28457931300921074, 'min_samples_leaf': 0.042072041338400826, 'min_weight_fraction_leaf': 0.034914669054170296, 'max_features': 0.5164556432873314}. Best is trial 499 with value: 0.8396174698878165.[0m
[32m[I 2022-04-21 11:38:44,968][0m Trial 773 finished with value: 0.8180388147131256 and parameters: {'splitter': 'best', 'min_samples_split': 0.26872025060418425, 'min_samples_leaf': 0.001293489425909708, 'min_weight_fraction_leaf': 0.09969953379517688, 'max_features': 0.43899768577245046}. Best is trial 499 with value: 0.8396174698878165.[0m
[32m[I 2022-04-21 11:38:45,095][0m Trial 774 finished with value: 0.8356453536097854 and parameters: {'splitter': 'best', 'min_samples_split': 0.27908045997812403, 'min_samples_leaf': 0.009483614836583215, 'min_weight_fraction_leaf': 0.050661081334667096, 'max_features': 0.7112441737647996}. Best is trial 499 with value: 0.8396174698878165.[0m
[32m[I 2022-04-21 11:38:45,223][0m Trial 775 finished with value: 0.6864017167921991 and parameters: {'splitter': 'best', 'min_samples_split': 0.2953961156781831, 'min_samples_leaf': 0.01588420091438779, 'min_weight_fraction_leaf': 0.07045041922860591, 'max_features': 0.31413690245029213}. Best is trial 499 with value: 0.8396174698878165.[0m
[32m[I 2022-04-21 11:38:45,356][0m Trial 776 finished with value: 0.8221016854899492 and parameters: {'splitter': 'best', 'min_samples_split': 0.2633071285444526, 'min_samples_leaf': 0.036343753656661364, 'min_weight_fraction_leaf': 0.04133748185529454, 'max_features': 0.2174126537561047}. Best is trial 499 with value: 0.8396174698878165.[0m
[32m[I 2022-04-21 11:38:45,486][0m Trial 777 finished with value: 0.8356453536097854 and parameters: {'splitter': 'best', 'min_samples_split': 0.28565311320681813, 'min_samples_leaf': 0.013563431746050094, 'min_weight_fraction_leaf': 0.05468946823958869, 'max_features': 0.7637880784871565}. Best is trial 499 with value: 0.8396174698878165.[0m
[32m[I 2022-04-21 11:38:45,721][0m Trial 778 finished with value: 0.8394676524280678 and parameters: {'splitter': 'best', 'min_samples_split': 0.27240240739080523, 'min_samples_leaf': 0.025535514382675432, 'min_weight_fraction_leaf': 0.0471819285951307, 'max_features': 0.6944125756246569}. Best is trial 499 with value: 0.8396174698878165.[0m
[32m[I 2022-04-21 11:38:45,906][0m Trial 779 finished with value: 0.8355801993971674 and parameters: {'splitter': 'best', 'min_samples_split': 0.27181063760091806, 'min_samples_leaf': 0.025198378384721942, 'min_weight_fraction_leaf': 0.06168872718431474, 'max_features': 0.7425783900837426}. Best is trial 499 with value: 0.8396174698878165.[0m
[32m[I 2022-04-21 11:38:46,198][0m Trial 780 finished with value: 0.8356453536097854 and parameters: {'splitter': 'best', 'min_samples_split': 0.2792134354423775, 'min_samples_leaf': 0.02686771221160303, 'min_weight_fraction_leaf': 0.04971689040282326, 'max_features': 0.6865475715214537}. Best is trial 499 with value: 0.8396174698878165.[0m
[32m[I 2022-04-21 11:38:46,544][0m Trial 781 finished with value: 0.8324518559681714 and parameters: {'splitter': 'best', 'min_samples_split': 0.2617892053347655, 'min_samples_leaf': 0.0014071665352688792, 'min_weight_fraction_leaf': 0.016168612243366055, 'max_features': 0.7095036932521476}. Best is trial 499 with value: 0.8396174698878165.[0m
[32m[I 2022-04-21 11:38:46,773][0m Trial 782 finished with value: 0.8314838917877992 and parameters: {'splitter': 'best', 'min_samples_split': 0.31111534698849214, 'min_samples_leaf': 0.018442198192204478, 'min_weight_fraction_leaf': 0.03350801237153343, 'max_features': 0.7481144667790811}. Best is trial 499 with value: 0.8396174698878165.[0m
[32m[I 2022-04-21 11:38:46,966][0m Trial 783 finished with value: 0.8337699781920435 and parameters: {'splitter': 'random', 'min_samples_split': 0.26862174698043123, 'min_samples_leaf': 0.010758721754022198, 'min_weight_fraction_leaf': 0.030999262160897517, 'max_features': 0.7112572201806989}. Best is trial 499 with value: 0.8396174698878165.[0m
[32m[I 2022-04-21 11:38:47,132][0m Trial 784 finished with value: 0.8337666169009493 and parameters: {'splitter': 'best', 'min_samples_split': 0.29033792761798316, 'min_samples_leaf': 0.010292795166637551, 'min_weight_fraction_leaf': 0.07479933080900837, 'max_features': 0.7335263763800597}. Best is trial 499 with value: 0.8396174698878165.[0m
[32m[I 2022-04-21 11:38:47,309][0m Trial 785 finished with value: 0.8372430118325767 and parameters: {'splitter': 'best', 'min_samples_split': 0.2496021146145836, 'min_samples_leaf': 0.021799058799243536, 'min_weight_fraction_leaf': 0.040770644026041934, 'max_features': 0.781744122620564}. Best is trial 499 with value: 0.8396174698878165.[0m
[32m[I 2022-04-21 11:38:47,494][0m Trial 786 finished with value: 0.8333588716601653 and parameters: {'splitter': 'best', 'min_samples_split': 0.27667400724641233, 'min_samples_leaf': 0.0012263493082600124, 'min_weight_fraction_leaf': 0.027574643374641106, 'max_features': 0.6997893753632817}. Best is trial 499 with value: 0.8396174698878165.[0m
[32m[I 2022-04-21 11:38:47,673][0m Trial 787 finished with value: 0.65 and parameters: {'splitter': 'best', 'min_samples_split': 0.2661968610772867, 'min_samples_leaf': 0.017946820551124194, 'min_weight_fraction_leaf': 0.353714422638717, 'max_features': 0.6788225619190766}. Best is trial 499 with value: 0.8396174698878165.[0m
[32m[I 2022-04-21 11:38:47,856][0m Trial 788 finished with value: 0.8318450474400789 and parameters: {'splitter': 'best', 'min_samples_split': 0.3017688531525767, 'min_samples_leaf': 0.16752049487674198, 'min_weight_fraction_leaf': 0.08673833582090623, 'max_features': 0.7534399408031833}. Best is trial 499 with value: 0.8396174698878165.[0m
[32m[I 2022-04-21 11:38:48,036][0m Trial 789 finished with value: 0.8340187950162761 and parameters: {'splitter': 'best', 'min_samples_split': 0.2844321187273046, 'min_samples_leaf': 0.026464933384602242, 'min_weight_fraction_leaf': 0.06262935131979779, 'max_features': 0.7304128349669714}. Best is trial 499 with value: 0.8396174698878165.[0m
[32m[I 2022-04-21 11:38:48,240][0m Trial 790 finished with value: 0.833502860951816 and parameters: {'splitter': 'best', 'min_samples_split': 0.2543117617550229, 'min_samples_leaf': 0.00982374107789031, 'min_weight_fraction_leaf': 0.05668601528751537, 'max_features': 0.6731563960212067}. Best is trial 499 with value: 0.8396174698878165.[0m
[32m[I 2022-04-21 11:38:48,438][0m Trial 791 finished with value: 0.8394676524280678 and parameters: {'splitter': 'best', 'min_samples_split': 0.27430640727633254, 'min_samples_leaf': 0.014470356918936767, 'min_weight_fraction_leaf': 0.04770347110094452, 'max_features': 0.6769753788042435}. Best is trial 499 with value: 0.8396174698878165.[0m
[32m[I 2022-04-21 11:38:48,640][0m Trial 792 finished with value: 0.8355801993971674 and parameters: {'splitter': 'best', 'min_samples_split': 0.27286105972941566, 'min_samples_leaf': 0.02160335404706766, 'min_weight_fraction_leaf': 0.05911302808581323, 'max_features': 0.664055129307536}. Best is trial 499 with value: 0.8396174698878165.[0m
[32m[I 2022-04-21 11:38:48,861][0m Trial 793 finished with value: 0.8264151704867025 and parameters: {'splitter': 'best', 'min_samples_split': 0.41258381429641555, 'min_samples_leaf': 0.010736361282309856, 'min_weight_fraction_leaf': 0.03425000165475283, 'max_features': 0.46546836249052814}. Best is trial 499 with value: 0.8396174698878165.[0m
[32m[I 2022-04-21 11:38:48,940][0m Trial 794 finished with value: 0.8318450474400789 and parameters: {'splitter': 'best', 'min_samples_split': 0.2941971121865779, 'min_samples_leaf': 0.018641665056769657, 'min_weight_fraction_leaf': 0.13373830473020637, 'max_features': 0.7725492117025882}. Best is trial 499 with value: 0.8396174698878165.[0m
[32m[I 2022-04-21 11:38:49,023][0m Trial 795 finished with value: 0.8337666169009493 and parameters: {'splitter': 'best', 'min_samples_split': 0.2802919809817822, 'min_samples_leaf': 0.009140259794794981, 'min_weight_fraction_leaf': 0.0716258781346752, 'max_features': 0.6844037449459981}. Best is trial 499 with value: 0.8396174698878165.[0m
[32m[I 2022-04-21 11:38:49,115][0m Trial 796 finished with value: 0.8386460587152798 and parameters: {'splitter': 'best', 'min_samples_split': 0.2632315082194874, 'min_samples_leaf': 0.0011820849194207799, 'min_weight_fraction_leaf': 0.04849125343600759, 'max_features': 0.7118883045249661}. Best is trial 499 with value: 0.8396174698878165.[0m
[32m[I 2022-04-21 11:38:49,205][0m Trial 797 finished with value: 0.8356453536097854 and parameters: {'splitter': 'best', 'min_samples_split': 0.28400384703509973, 'min_samples_leaf': 0.020735494433862182, 'min_weight_fraction_leaf': 0.05241880341557732, 'max_features': 0.6702889674206659}. Best is trial 499 with value: 0.8396174698878165.[0m
[32m[I 2022-04-21 11:38:49,394][0m Trial 798 finished with value: 0.8394676524280678 and parameters: {'splitter': 'best', 'min_samples_split': 0.27292705024997294, 'min_samples_leaf': 0.01754327420791979, 'min_weight_fraction_leaf': 0.04842400675074015, 'max_features': 0.6961952713800229}. Best is trial 499 with value: 0.8396174698878165.[0m
[32m[I 2022-04-21 11:38:49,584][0m Trial 799 finished with value: 0.8340187950162761 and parameters: {'splitter': 'best', 'min_samples_split': 0.2719481546363679, 'min_samples_leaf': 0.01480071981197422, 'min_weight_fraction_leaf': 0.06632110679126742, 'max_features': 0.7010776029310928}. Best is trial 499 with value: 0.8396174698878165.[0m
[32m[I 2022-04-21 11:38:49,767][0m Trial 800 finished with value: 0.8315292021552642 and parameters: {'splitter': 'best', 'min_samples_split': 0.25608698192692286, 'min_samples_leaf': 0.0021976665870924016, 'min_weight_fraction_leaf': 0.013882488483805851, 'max_features': 0.7202011222945816}. Best is trial 499 with value: 0.8396174698878165.[0m
[32m[I 2022-04-21 11:38:49,991][0m Trial 801 finished with value: 0.8337699781920435 and parameters: {'splitter': 'random', 'min_samples_split': 0.26425608641107706, 'min_samples_leaf': 0.0012523795590160623, 'min_weight_fraction_leaf': 0.0429672701499413, 'max_features': 0.7249145565946724}. Best is trial 499 with value: 0.8396174698878165.[0m
[32m[I 2022-04-21 11:38:50,234][0m Trial 802 finished with value: 0.8355801993971674 and parameters: {'splitter': 'best', 'min_samples_split': 0.2884089266199736, 'min_samples_leaf': 0.02566231602505562, 'min_weight_fraction_leaf': 0.060066950698086125, 'max_features': 0.6883487506663961}. Best is trial 499 with value: 0.8396174698878165.[0m
[32m[I 2022-04-21 11:38:50,436][0m Trial 803 finished with value: 0.8318869790887286 and parameters: {'splitter': 'best', 'min_samples_split': 0.2749289826073617, 'min_samples_leaf': 0.01138136794280233, 'min_weight_fraction_leaf': 0.07758745079982797, 'max_features': 0.7012520357030403}. Best is trial 499 with value: 0.8396174698878165.[0m
[32m[I 2022-04-21 11:38:50,599][0m Trial 804 finished with value: 0.8375392239614191 and parameters: {'splitter': 'best', 'min_samples_split': 0.2502534495536792, 'min_samples_leaf': 0.027286826946645002, 'min_weight_fraction_leaf': 0.05105287352189792, 'max_features': 0.6663635736977268}. Best is trial 499 with value: 0.8396174698878165.[0m
[32m[I 2022-04-21 11:38:50,754][0m Trial 805 finished with value: 0.8340187950162761 and parameters: {'splitter': 'best', 'min_samples_split': 0.29708616584733744, 'min_samples_leaf': 0.017375760415815483, 'min_weight_fraction_leaf': 0.06756273598855572, 'max_features': 0.68066642956076}. Best is trial 499 with value: 0.8396174698878165.[0m
[32m[I 2022-04-21 11:38:50,836][0m Trial 806 finished with value: 0.8396174698878165 and parameters: {'splitter': 'best', 'min_samples_split': 0.2767830052846276, 'min_samples_leaf': 0.014525563878815316, 'min_weight_fraction_leaf': 0.05510570126884392, 'max_features': 0.7326975707138884}. Best is trial 499 with value: 0.8396174698878165.[0m
[32m[I 2022-04-21 11:38:50,890][0m Trial 807 finished with value: 0.8355801993971674 and parameters: {'splitter': 'best', 'min_samples_split': 0.2800744118529097, 'min_samples_leaf': 0.009962086781371254, 'min_weight_fraction_leaf': 0.05641480806543754, 'max_features': 0.758931793443952}. Best is trial 499 with value: 0.8396174698878165.[0m
[32m[I 2022-04-21 11:38:50,974][0m Trial 808 finished with value: 0.8335144387856227 and parameters: {'splitter': 'best', 'min_samples_split': 0.3053423409999073, 'min_samples_leaf': 0.00942281565956403, 'min_weight_fraction_leaf': 0.0685134376708344, 'max_features': 0.6880898911226563}. Best is trial 499 with value: 0.8396174698878165.[0m
[32m[I 2022-04-21 11:38:51,123][0m Trial 809 finished with value: 0.8316149506675705 and parameters: {'splitter': 'best', 'min_samples_split': 0.26491607449307597, 'min_samples_leaf': 0.013115536871058094, 'min_weight_fraction_leaf': 0.0833498711503993, 'max_features': 0.7319896360667857}. Best is trial 499 with value: 0.8396174698878165.[0m
[32m[I 2022-04-21 11:38:51,186][0m Trial 810 finished with value: 0.8356453536097854 and parameters: {'splitter': 'best', 'min_samples_split': 0.28865330987962223, 'min_samples_leaf': 0.007670419974078687, 'min_weight_fraction_leaf': 0.04962439632691775, 'max_features': 0.7445279869141672}. Best is trial 499 with value: 0.8396174698878165.[0m
[32m[I 2022-04-21 11:38:51,297][0m Trial 811 finished with value: 0.8355801993971674 and parameters: {'splitter': 'best', 'min_samples_split': 0.2742787507533472, 'min_samples_leaf': 0.019278226779774213, 'min_weight_fraction_leaf': 0.06061379126441329, 'max_features': 0.6951216087286197}. Best is trial 499 with value: 0.8396174698878165.[0m
[32m[I 2022-04-21 11:38:51,402][0m Trial 812 finished with value: 0.8382577519146084 and parameters: {'splitter': 'best', 'min_samples_split': 0.261834124475576, 'min_samples_leaf': 0.0014712873105411674, 'min_weight_fraction_leaf': 0.05049357031369572, 'max_features': 0.6910094010085804}. Best is trial 499 with value: 0.8396174698878165.[0m
[32m[I 2022-04-21 11:38:51,496][0m Trial 813 finished with value: 0.8385374292394825 and parameters: {'splitter': 'best', 'min_samples_split': 0.27707322407745055, 'min_samples_leaf': 0.017270213621927773, 'min_weight_fraction_leaf': 0.03516545190901375, 'max_features': 0.6992910519522945}. Best is trial 499 with value: 0.8396174698878165.[0m
[32m[I 2022-04-21 11:38:51,559][0m Trial 814 finished with value: 0.8358862945558443 and parameters: {'splitter': 'best', 'min_samples_split': 0.2477804107319196, 'min_samples_leaf': 0.008954572504073773, 'min_weight_fraction_leaf': 0.029409622573742255, 'max_features': 0.7289709753564813}. Best is trial 499 with value: 0.8396174698878165.[0m
[32m[I 2022-04-21 11:38:51,620][0m Trial 815 finished with value: 0.8348703389712995 and parameters: {'splitter': 'best', 'min_samples_split': 0.28956184564745, 'min_samples_leaf': 0.025120846060141207, 'min_weight_fraction_leaf': 0.044744474850745786, 'max_features': 0.7692792723417393}. Best is trial 499 with value: 0.8396174698878165.[0m
[32m[I 2022-04-21 11:38:51,681][0m Trial 816 finished with value: 0.8342213889050052 and parameters: {'splitter': 'best', 'min_samples_split': 0.2676137191965745, 'min_samples_leaf': 0.010183102374434181, 'min_weight_fraction_leaf': 0.05944310313009994, 'max_features': 0.719625704463527}. Best is trial 499 with value: 0.8396174698878165.[0m
[32m[I 2022-04-21 11:38:51,745][0m Trial 817 finished with value: 0.8352014009981168 and parameters: {'splitter': 'best', 'min_samples_split': 0.2818193022234979, 'min_samples_leaf': 0.015915293609575408, 'min_weight_fraction_leaf': 0.04342347966017242, 'max_features': 0.7453658603421407}. Best is trial 499 with value: 0.8396174698878165.[0m
[32m[I 2022-04-21 11:38:51,805][0m Trial 818 finished with value: 0.8337666169009493 and parameters: {'splitter': 'best', 'min_samples_split': 0.29932154963326757, 'min_samples_leaf': 0.0016695092639618632, 'min_weight_fraction_leaf': 0.07354717149866774, 'max_features': 0.6993624116442932}. Best is trial 499 with value: 0.8396174698878165.[0m
