[32m[I 2022-04-22 21:27:03,661][0m Trial 772 finished with value: 0.8356735271354196 and parameters: {'n_hidden': 256, 'mixture_components': 6, 'use_sparse_layer': True, 'use_sparse_loss': True, 'lmbd': 2.2116299833703557e-05, 'use_batchnorm': True, 'use_dropout': True, 'dropout': 0.577860081122964, 'mlp_size_1': 0, 'mlp_size_2': 5, 'mlp_size_3': 0, 'kernel': 'LogLogistic', 'loss_name': 'NLLLoss'}. Best is trial 22 with value: 0.8433318468070169.[0m
[32m[I 2022-04-22 21:29:30,417][0m Trial 773 finished with value: 0.8234734372002569 and parameters: {'n_hidden': 256, 'mixture_components': 6, 'use_sparse_layer': True, 'use_sparse_loss': False, 'use_batchnorm': True, 'use_dropout': True, 'dropout': 0.6372356051361046, 'mlp_size_1': 0, 'mlp_size_2': 5, 'mlp_size_3': 0, 'kernel': 'LogLogistic', 'loss_name': 'NLLLoss'}. Best is trial 22 with value: 0.8433318468070169.[0m
[32m[I 2022-04-22 21:32:03,768][0m Trial 774 finished with value: 0.8280738988338963 and parameters: {'n_hidden': 256, 'mixture_components': 6, 'use_sparse_layer': True, 'use_sparse_loss': False, 'use_batchnorm': True, 'use_dropout': True, 'dropout': 0.6872678443235264, 'mlp_size_1': 0, 'mlp_size_2': 5, 'mlp_size_3': 0, 'kernel': 'LogLogistic', 'loss_name': 'NLLLoss'}. Best is trial 22 with value: 0.8433318468070169.[0m
[32m[I 2022-04-22 21:34:38,957][0m Trial 775 finished with value: 0.834515007670164 and parameters: {'n_hidden': 256, 'mixture_components': 5, 'use_sparse_layer': True, 'use_sparse_loss': True, 'lmbd': 9.548239894707707e-05, 'use_batchnorm': True, 'use_dropout': True, 'dropout': 0.5964284634167031, 'mlp_size_1': 0, 'mlp_size_2': 5, 'mlp_size_3': 0, 'kernel': 'LogLogistic', 'loss_name': 'NLLLoss'}. Best is trial 22 with value: 0.8433318468070169.[0m
[32m[I 2022-04-22 21:37:48,735][0m Trial 776 finished with value: 0.7271657923299963 and parameters: {'n_hidden': 512, 'mixture_components': 6, 'use_sparse_layer': True, 'use_sparse_loss': False, 'use_batchnorm': True, 'use_dropout': True, 'dropout': 0.6552931906114642, 'mlp_size_1': 0, 'mlp_size_2': 6, 'mlp_size_3': 0, 'kernel': 'LogLogistic', 'loss_name': 'CensoredNLLLoss'}. Best is trial 22 with value: 0.8433318468070169.[0m
[32m[I 2022-04-22 21:40:04,743][0m Trial 777 finished with value: 0.8250970154294365 and parameters: {'n_hidden': 256, 'mixture_components': 5, 'use_sparse_layer': True, 'use_sparse_loss': True, 'lmbd': 1.1680915453626826e-05, 'use_batchnorm': True, 'use_dropout': True, 'dropout': 0.5270547935350762, 'mlp_size_1': 0, 'mlp_size_2': 5, 'mlp_size_3': 0, 'kernel': 'LogLogistic', 'loss_name': 'NLLLoss'}. Best is trial 22 with value: 0.8433318468070169.[0m
[32m[I 2022-04-22 21:40:46,691][0m Trial 778 finished with value: -0.5 and parameters: {'n_hidden': 512, 'mixture_components': 5, 'use_sparse_layer': True, 'use_sparse_loss': False, 'use_batchnorm': True, 'use_dropout': True, 'dropout': 0.616921048332073, 'mlp_size_1': 0, 'mlp_size_2': 6, 'mlp_size_3': 0, 'kernel': 'Gumbel', 'loss_name': 'NLLLoss'}. Best is trial 22 with value: 0.8433318468070169.[0m
[32m[I 2022-04-22 21:42:35,098][0m Trial 779 finished with value: 0.8311423802363468 and parameters: {'n_hidden': 256, 'mixture_components': 6, 'use_sparse_layer': False, 'use_batchnorm': True, 'use_dropout': True, 'dropout': 0.5610069117036027, 'mlp_size_1': 0, 'mlp_size_2': 5, 'mlp_size_3': 0, 'kernel': 'Exponential', 'loss_name': 'NLLLoss'}. Best is trial 22 with value: 0.8433318468070169.[0m
[32m[I 2022-04-22 21:43:39,539][0m Trial 780 finished with value: -0.23383596828491862 and parameters: {'n_hidden': 1024, 'mixture_components': 5, 'use_sparse_layer': True, 'use_sparse_loss': False, 'use_batchnorm': True, 'use_dropout': True, 'dropout': 0.6657873689551765, 'mlp_size_1': 0, 'mlp_size_2': 7, 'mlp_size_3': 0, 'kernel': 'Exponential', 'loss_name': 'AlternativeNLLLoss'}. Best is trial 22 with value: 0.8433318468070169.[0m
[32m[I 2022-04-22 21:46:25,088][0m Trial 781 finished with value: 0.8265702074354287 and parameters: {'n_hidden': 512, 'mixture_components': 5, 'use_sparse_layer': True, 'use_sparse_loss': True, 'lmbd': 4.9584302390442606e-05, 'use_batchnorm': True, 'use_dropout': True, 'dropout': 0.5959073896223165, 'mlp_size_1': 0, 'mlp_size_2': 6, 'mlp_size_3': 0, 'kernel': 'Logistic', 'loss_name': 'NLLLoss'}. Best is trial 22 with value: 0.8433318468070169.[0m
[32m[I 2022-04-22 21:48:20,943][0m Trial 782 finished with value: 0.8347952216552251 and parameters: {'n_hidden': 256, 'mixture_components': 6, 'use_sparse_layer': True, 'use_sparse_loss': False, 'use_batchnorm': True, 'use_dropout': True, 'dropout': 0.6362021307595873, 'mlp_size_1': 0, 'mlp_size_2': 5, 'mlp_size_3': 0, 'kernel': 'Exponential', 'loss_name': 'NLLLoss'}. Best is trial 22 with value: 0.8433318468070169.[0m
[32m[I 2022-04-22 21:50:32,716][0m Trial 783 finished with value: 0.8330566684438565 and parameters: {'n_hidden': 512, 'mixture_components': 5, 'use_sparse_layer': True, 'use_sparse_loss': True, 'lmbd': 2.4553458308586856e-06, 'use_batchnorm': True, 'use_dropout': True, 'dropout': 0.6950517267582081, 'mlp_size_1': 0, 'mlp_size_2': 6, 'mlp_size_3': 0, 'kernel': 'Exponential', 'loss_name': 'NLLLoss'}. Best is trial 22 with value: 0.8433318468070169.[0m
[32m[I 2022-04-22 21:52:26,474][0m Trial 784 finished with value: 0.831231381611992 and parameters: {'n_hidden': 256, 'mixture_components': 5, 'use_sparse_layer': False, 'use_batchnorm': True, 'use_dropout': True, 'dropout': 0.13383224836087174, 'mlp_size_1': 0, 'mlp_size_2': 5, 'mlp_size_3': 0, 'kernel': 'Exponential', 'loss_name': 'NLLLoss'}. Best is trial 22 with value: 0.8433318468070169.[0m
[32m[I 2022-04-22 21:55:13,233][0m Trial 785 finished with value: 0.8324844250450993 and parameters: {'n_hidden': 256, 'mixture_components': 5, 'use_sparse_layer': True, 'use_sparse_loss': False, 'use_batchnorm': True, 'use_dropout': True, 'dropout': 0.6166270166136765, 'mlp_size_1': 0, 'mlp_size_2': 5, 'mlp_size_3': 0, 'kernel': 'LogLogistic', 'loss_name': 'CensoredNLLLoss'}. Best is trial 22 with value: 0.8433318468070169.[0m
[32m[I 2022-04-22 21:57:55,494][0m Trial 786 finished with value: 0.8291504937296106 and parameters: {'n_hidden': 512, 'mixture_components': 4, 'use_sparse_layer': True, 'use_sparse_loss': False, 'use_batchnorm': True, 'use_dropout': True, 'dropout': 0.5780679154465191, 'mlp_size_1': 0, 'mlp_size_2': 6, 'mlp_size_3': 0, 'kernel': 'Logistic', 'loss_name': 'NLLLoss'}. Best is trial 22 with value: 0.8433318468070169.[0m
[32m[I 2022-04-22 22:01:02,256][0m Trial 787 finished with value: 0.7236794712277946 and parameters: {'n_hidden': 2048, 'mixture_components': 5, 'use_sparse_layer': True, 'use_sparse_loss': True, 'lmbd': 0.000195777501316967, 'use_batchnorm': True, 'use_dropout': True, 'dropout': 0.5447409901789867, 'mlp_size_1': 0, 'mlp_size_2': 0, 'mlp_size_3': 4, 'kernel': 'Exponential', 'loss_name': 'NLLLoss'}. Best is trial 22 with value: 0.8433318468070169.[0m
[32m[I 2022-04-22 22:03:01,596][0m Trial 788 finished with value: 0.8294815177637151 and parameters: {'n_hidden': 32, 'mixture_components': 6, 'use_sparse_layer': True, 'use_sparse_loss': False, 'use_batchnorm': True, 'use_dropout': True, 'dropout': 0.6519673023741921, 'mlp_size_1': 0, 'mlp_size_2': 2, 'mlp_size_3': 0, 'kernel': 'Exponential', 'loss_name': 'NLLLoss'}. Best is trial 22 with value: 0.8433318468070169.[0m
[32m[I 2022-04-22 22:04:54,666][0m Trial 789 finished with value: 0.8343043772883358 and parameters: {'n_hidden': 256, 'mixture_components': 5, 'use_sparse_layer': False, 'use_batchnorm': True, 'use_dropout': True, 'dropout': 0.6743542144482687, 'mlp_size_1': 0, 'mlp_size_2': 5, 'mlp_size_3': 0, 'kernel': 'Exponential', 'loss_name': 'NLLLoss'}. Best is trial 22 with value: 0.8433318468070169.[0m
[32m[I 2022-04-22 22:07:03,841][0m Trial 790 finished with value: 0.834188604921253 and parameters: {'n_hidden': 512, 'mixture_components': 5, 'use_sparse_layer': True, 'use_sparse_loss': True, 'lmbd': 5.6285152030263e-06, 'use_batchnorm': True, 'use_dropout': True, 'dropout': 0.7089880596703944, 'mlp_size_1': 0, 'mlp_size_2': 6, 'mlp_size_3': 0, 'kernel': 'Exponential', 'loss_name': 'NLLLoss'}. Best is trial 22 with value: 0.8433318468070169.[0m
[32m[I 2022-04-22 22:09:21,300][0m Trial 791 finished with value: 0.8241733287625775 and parameters: {'n_hidden': 256, 'mixture_components': 5, 'use_sparse_layer': True, 'use_sparse_loss': False, 'use_batchnorm': True, 'use_dropout': True, 'dropout': 0.6259836108814739, 'mlp_size_1': 0, 'mlp_size_2': 5, 'mlp_size_3': 0, 'kernel': 'Logistic', 'loss_name': 'NLLLoss'}. Best is trial 22 with value: 0.8433318468070169.[0m
[32m[I 2022-04-22 22:11:42,548][0m Trial 792 finished with value: 0.8295094094294189 and parameters: {'n_hidden': 512, 'mixture_components': 6, 'use_sparse_layer': True, 'use_sparse_loss': False, 'use_batchnorm': True, 'use_dropout': True, 'dropout': 0.27042695831188707, 'mlp_size_1': 0, 'mlp_size_2': 6, 'mlp_size_3': 0, 'kernel': 'Exponential', 'loss_name': 'NLLLoss'}. Best is trial 22 with value: 0.8433318468070169.[0m
[32m[I 2022-04-22 22:14:32,212][0m Trial 793 finished with value: 0.8375875731150708 and parameters: {'n_hidden': 256, 'mixture_components': 5, 'use_sparse_layer': True, 'use_sparse_loss': True, 'lmbd': 0.0022006057948894065, 'use_batchnorm': True, 'use_dropout': True, 'dropout': 0.6003778977141612, 'mlp_size_1': 0, 'mlp_size_2': 5, 'mlp_size_3': 0, 'kernel': 'LogLogistic', 'loss_name': 'CensoredNLLLoss'}. Best is trial 22 with value: 0.8433318468070169.[0m
[32m[I 2022-04-22 22:17:16,541][0m Trial 794 finished with value: 0.8398246623659806 and parameters: {'n_hidden': 256, 'mixture_components': 4, 'use_sparse_layer': True, 'use_sparse_loss': True, 'lmbd': 0.00267506815792241, 'use_batchnorm': True, 'use_dropout': True, 'dropout': 0.6067579951964926, 'mlp_size_1': 0, 'mlp_size_2': 5, 'mlp_size_3': 0, 'kernel': 'LogLogistic', 'loss_name': 'CensoredNLLLoss'}. Best is trial 22 with value: 0.8433318468070169.[0m
[32m[I 2022-04-22 22:20:04,072][0m Trial 795 finished with value: 0.8392027345597699 and parameters: {'n_hidden': 256, 'mixture_components': 4, 'use_sparse_layer': False, 'use_batchnorm': True, 'use_dropout': True, 'dropout': 0.6072718762856842, 'mlp_size_1': 0, 'mlp_size_2': 5, 'mlp_size_3': 0, 'kernel': 'LogLogistic', 'loss_name': 'CensoredNLLLoss'}. Best is trial 22 with value: 0.8433318468070169.[0m
[32m[I 2022-04-22 22:22:40,328][0m Trial 796 finished with value: 0.8362579402403562 and parameters: {'n_hidden': 256, 'mixture_components': 4, 'use_sparse_layer': False, 'use_batchnorm': True, 'use_dropout': True, 'dropout': 0.5957475102992437, 'mlp_size_1': 0, 'mlp_size_2': 5, 'mlp_size_3': 0, 'kernel': 'LogLogistic', 'loss_name': 'CensoredNLLLoss'}. Best is trial 22 with value: 0.8433318468070169.[0m
[32m[I 2022-04-22 22:25:10,571][0m Trial 797 finished with value: 0.8339467778487997 and parameters: {'n_hidden': 256, 'mixture_components': 4, 'use_sparse_layer': False, 'use_batchnorm': True, 'use_dropout': True, 'dropout': 0.6048391152004126, 'mlp_size_1': 0, 'mlp_size_2': 5, 'mlp_size_3': 0, 'kernel': 'LogLogistic', 'loss_name': 'CensoredNLLLoss'}. Best is trial 22 with value: 0.8433318468070169.[0m
[32m[I 2022-04-22 22:27:39,272][0m Trial 798 finished with value: 0.729934627910113 and parameters: {'n_hidden': 256, 'mixture_components': 4, 'use_sparse_layer': False, 'use_batchnorm': True, 'use_dropout': True, 'dropout': 0.5930002711493687, 'mlp_size_1': 0, 'mlp_size_2': 5, 'mlp_size_3': 0, 'kernel': 'LogLogistic', 'loss_name': 'CensoredNLLLoss'}. Best is trial 22 with value: 0.8433318468070169.[0m
[32m[I 2022-04-22 22:30:05,052][0m Trial 799 finished with value: 0.8307564336989459 and parameters: {'n_hidden': 256, 'mixture_components': 4, 'use_sparse_layer': False, 'use_batchnorm': True, 'use_dropout': True, 'dropout': 0.6136686800826886, 'mlp_size_1': 0, 'mlp_size_2': 5, 'mlp_size_3': 0, 'kernel': 'LogLogistic', 'loss_name': 'CensoredNLLLoss'}. Best is trial 22 with value: 0.8433318468070169.[0m
[32m[I 2022-04-22 22:32:30,841][0m Trial 800 finished with value: 0.832610804486345 and parameters: {'n_hidden': 256, 'mixture_components': 4, 'use_sparse_layer': False, 'use_batchnorm': True, 'use_dropout': True, 'dropout': 0.5828040985708514, 'mlp_size_1': 0, 'mlp_size_2': 5, 'mlp_size_3': 0, 'kernel': 'LogLogistic', 'loss_name': 'CensoredNLLLoss'}. Best is trial 22 with value: 0.8433318468070169.[0m
[32m[I 2022-04-22 22:35:05,229][0m Trial 801 finished with value: 0.8342376511251887 and parameters: {'n_hidden': 256, 'mixture_components': 4, 'use_sparse_layer': False, 'use_batchnorm': True, 'use_dropout': True, 'dropout': 0.6104202924808255, 'mlp_size_1': 0, 'mlp_size_2': 5, 'mlp_size_3': 0, 'kernel': 'LogLogistic', 'loss_name': 'CensoredNLLLoss'}. Best is trial 22 with value: 0.8433318468070169.[0m
[32m[I 2022-04-22 22:37:41,747][0m Trial 802 finished with value: 0.7327861786990023 and parameters: {'n_hidden': 256, 'mixture_components': 4, 'use_sparse_layer': False, 'use_batchnorm': True, 'use_dropout': True, 'dropout': 0.5782766189040722, 'mlp_size_1': 0, 'mlp_size_2': 5, 'mlp_size_3': 0, 'kernel': 'LogLogistic', 'loss_name': 'CensoredNLLLoss'}. Best is trial 22 with value: 0.8433318468070169.[0m
[32m[I 2022-04-22 22:40:14,853][0m Trial 803 finished with value: 0.7259234932858318 and parameters: {'n_hidden': 256, 'mixture_components': 4, 'use_sparse_layer': False, 'use_batchnorm': True, 'use_dropout': True, 'dropout': 0.6267660726343965, 'mlp_size_1': 0, 'mlp_size_2': 5, 'mlp_size_3': 0, 'kernel': 'LogLogistic', 'loss_name': 'CensoredNLLLoss'}. Best is trial 22 with value: 0.8433318468070169.[0m
[32m[I 2022-04-22 22:42:49,346][0m Trial 804 finished with value: 0.8320034647243079 and parameters: {'n_hidden': 256, 'mixture_components': 4, 'use_sparse_layer': False, 'use_batchnorm': True, 'use_dropout': True, 'dropout': 0.6032660245477598, 'mlp_size_1': 0, 'mlp_size_2': 5, 'mlp_size_3': 0, 'kernel': 'LogLogistic', 'loss_name': 'CensoredNLLLoss'}. Best is trial 22 with value: 0.8433318468070169.[0m
[32m[I 2022-04-22 22:45:15,808][0m Trial 805 finished with value: 0.7240274353875664 and parameters: {'n_hidden': 256, 'mixture_components': 4, 'use_sparse_layer': False, 'use_batchnorm': True, 'use_dropout': True, 'dropout': 0.5907279850344833, 'mlp_size_1': 0, 'mlp_size_2': 5, 'mlp_size_3': 0, 'kernel': 'LogLogistic', 'loss_name': 'CensoredNLLLoss'}. Best is trial 22 with value: 0.8433318468070169.[0m
[32m[I 2022-04-22 22:47:56,825][0m Trial 806 finished with value: 0.8303322361153093 and parameters: {'n_hidden': 256, 'mixture_components': 6, 'use_sparse_layer': False, 'use_batchnorm': True, 'use_dropout': True, 'dropout': 0.6244002294979051, 'mlp_size_1': 0, 'mlp_size_2': 5, 'mlp_size_3': 0, 'kernel': 'LogLogistic', 'loss_name': 'CensoredNLLLoss'}. Best is trial 22 with value: 0.8433318468070169.[0m
[32m[I 2022-04-22 22:50:48,058][0m Trial 807 finished with value: 0.8379930653095103 and parameters: {'n_hidden': 256, 'mixture_components': 4, 'use_sparse_layer': False, 'use_batchnorm': True, 'use_dropout': True, 'dropout': 0.6383879340475759, 'mlp_size_1': 0, 'mlp_size_2': 5, 'mlp_size_3': 0, 'kernel': 'LogLogistic', 'loss_name': 'CensoredNLLLoss'}. Best is trial 22 with value: 0.8433318468070169.[0m
[32m[I 2022-04-22 22:53:14,973][0m Trial 808 finished with value: 0.8300663482807968 and parameters: {'n_hidden': 256, 'mixture_components': 4, 'use_sparse_layer': False, 'use_batchnorm': True, 'use_dropout': True, 'dropout': 0.631968934035737, 'mlp_size_1': 0, 'mlp_size_2': 5, 'mlp_size_3': 0, 'kernel': 'LogLogistic', 'loss_name': 'CensoredNLLLoss'}. Best is trial 22 with value: 0.8433318468070169.[0m
[32m[I 2022-04-22 22:55:57,933][0m Trial 809 finished with value: 0.8322200862865984 and parameters: {'n_hidden': 256, 'mixture_components': 4, 'use_sparse_layer': False, 'use_batchnorm': True, 'use_dropout': True, 'dropout': 0.6410955810830087, 'mlp_size_1': 0, 'mlp_size_2': 5, 'mlp_size_3': 0, 'kernel': 'LogLogistic', 'loss_name': 'CensoredNLLLoss'}. Best is trial 22 with value: 0.8433318468070169.[0m
[32m[I 2022-04-22 22:58:48,798][0m Trial 810 finished with value: 0.7170280393057308 and parameters: {'n_hidden': 256, 'mixture_components': 4, 'use_sparse_layer': False, 'use_batchnorm': True, 'use_dropout': True, 'dropout': 0.6104483414245111, 'mlp_size_1': 0, 'mlp_size_2': 5, 'mlp_size_3': 0, 'kernel': 'LogLogistic', 'loss_name': 'CensoredNLLLoss'}. Best is trial 22 with value: 0.8433318468070169.[0m
[32m[I 2022-04-22 23:01:33,228][0m Trial 811 finished with value: 0.7272560808082827 and parameters: {'n_hidden': 256, 'mixture_components': 4, 'use_sparse_layer': False, 'use_batchnorm': True, 'use_dropout': True, 'dropout': 0.6410464077462645, 'mlp_size_1': 0, 'mlp_size_2': 5, 'mlp_size_3': 0, 'kernel': 'LogLogistic', 'loss_name': 'CensoredNLLLoss'}. Best is trial 22 with value: 0.8433318468070169.[0m
[32m[I 2022-04-22 23:04:08,171][0m Trial 812 finished with value: 0.7384186298312578 and parameters: {'n_hidden': 256, 'mixture_components': 4, 'use_sparse_layer': False, 'use_batchnorm': True, 'use_dropout': True, 'dropout': 0.5716766357338283, 'mlp_size_1': 0, 'mlp_size_2': 5, 'mlp_size_3': 0, 'kernel': 'LogLogistic', 'loss_name': 'CensoredNLLLoss'}. Best is trial 22 with value: 0.8433318468070169.[0m
[32m[I 2022-04-22 23:06:38,478][0m Trial 813 finished with value: 0.8318231402851831 and parameters: {'n_hidden': 256, 'mixture_components': 4, 'use_sparse_layer': False, 'use_batchnorm': True, 'use_dropout': True, 'dropout': 0.6475639409542154, 'mlp_size_1': 0, 'mlp_size_2': 5, 'mlp_size_3': 0, 'kernel': 'LogLogistic', 'loss_name': 'CensoredNLLLoss'}. Best is trial 22 with value: 0.8433318468070169.[0m
[32m[I 2022-04-22 23:09:10,959][0m Trial 814 finished with value: 0.7269848651139142 and parameters: {'n_hidden': 256, 'mixture_components': 4, 'use_sparse_layer': False, 'use_batchnorm': True, 'use_dropout': True, 'dropout': 0.6199979864944432, 'mlp_size_1': 0, 'mlp_size_2': 5, 'mlp_size_3': 0, 'kernel': 'LogLogistic', 'loss_name': 'CensoredNLLLoss'}. Best is trial 22 with value: 0.8433318468070169.[0m
[32m[I 2022-04-22 23:11:40,793][0m Trial 815 finished with value: 0.7382671858796671 and parameters: {'n_hidden': 256, 'mixture_components': 4, 'use_sparse_layer': False, 'use_batchnorm': True, 'use_dropout': True, 'dropout': 0.6003605134354458, 'mlp_size_1': 0, 'mlp_size_2': 5, 'mlp_size_3': 0, 'kernel': 'LogLogistic', 'loss_name': 'CensoredNLLLoss'}. Best is trial 22 with value: 0.8433318468070169.[0m
[32m[I 2022-04-22 23:14:35,022][0m Trial 816 finished with value: 0.8271781372961641 and parameters: {'n_hidden': 256, 'mixture_components': 4, 'use_sparse_layer': False, 'use_batchnorm': True, 'use_dropout': True, 'dropout': 0.6282897507679149, 'mlp_size_1': 0, 'mlp_size_2': 5, 'mlp_size_3': 0, 'kernel': 'LogLogistic', 'loss_name': 'CensoredNLLLoss'}. Best is trial 22 with value: 0.8433318468070169.[0m
[32m[I 2022-04-22 23:17:13,861][0m Trial 817 finished with value: 0.8335284707680393 and parameters: {'n_hidden': 256, 'mixture_components': 4, 'use_sparse_layer': False, 'use_batchnorm': True, 'use_dropout': True, 'dropout': 0.6546336114999226, 'mlp_size_1': 0, 'mlp_size_2': 5, 'mlp_size_3': 0, 'kernel': 'LogLogistic', 'loss_name': 'CensoredNLLLoss'}. Best is trial 22 with value: 0.8433318468070169.[0m
[32m[I 2022-04-22 23:20:03,820][0m Trial 818 finished with value: 0.7326275931232985 and parameters: {'n_hidden': 256, 'mixture_components': 4, 'use_sparse_layer': False, 'use_batchnorm': True, 'use_dropout': True, 'dropout': 0.5903828912840741, 'mlp_size_1': 0, 'mlp_size_2': 5, 'mlp_size_3': 0, 'kernel': 'LogLogistic', 'loss_name': 'CensoredNLLLoss'}. Best is trial 22 with value: 0.8433318468070169.[0m
[32m[I 2022-04-22 23:22:49,271][0m Trial 819 finished with value: 0.7320142994971721 and parameters: {'n_hidden': 256, 'mixture_components': 4, 'use_sparse_layer': False, 'use_batchnorm': True, 'use_dropout': True, 'dropout': 0.5724672557951698, 'mlp_size_1': 0, 'mlp_size_2': 5, 'mlp_size_3': 0, 'kernel': 'LogLogistic', 'loss_name': 'CensoredNLLLoss'}. Best is trial 22 with value: 0.8433318468070169.[0m
[32m[I 2022-04-22 23:26:14,474][0m Trial 820 finished with value: 0.5210943710492443 and parameters: {'n_hidden': 1024, 'mixture_components': 10, 'use_sparse_layer': False, 'use_batchnorm': True, 'use_dropout': True, 'dropout': 0.6113102687909234, 'mlp_size_1': 0, 'mlp_size_2': 4, 'mlp_size_3': 2, 'kernel': 'LogLogistic', 'loss_name': 'CensoredNLLLoss'}. Best is trial 22 with value: 0.8433318468070169.[0m
[32m[I 2022-04-22 23:28:57,091][0m Trial 821 finished with value: 0.7343187977815508 and parameters: {'n_hidden': 256, 'mixture_components': 4, 'use_sparse_layer': False, 'use_batchnorm': True, 'use_dropout': True, 'dropout': 0.6383650510801264, 'mlp_size_1': 0, 'mlp_size_2': 5, 'mlp_size_3': 0, 'kernel': 'LogLogistic', 'loss_name': 'CensoredNLLLoss'}. Best is trial 22 with value: 0.8433318468070169.[0m
[32m[I 2022-04-22 23:31:32,978][0m Trial 822 finished with value: 0.7338748488927982 and parameters: {'n_hidden': 256, 'mixture_components': 6, 'use_sparse_layer': False, 'use_batchnorm': True, 'use_dropout': True, 'dropout': 0.6796916333706006, 'mlp_size_1': 0, 'mlp_size_2': 5, 'mlp_size_3': 0, 'kernel': 'LogLogistic', 'loss_name': 'CensoredNLLLoss'}. Best is trial 22 with value: 0.8433318468070169.[0m
[32m[I 2022-04-22 23:34:15,474][0m Trial 823 finished with value: 0.7326046614220536 and parameters: {'n_hidden': 256, 'mixture_components': 3, 'use_sparse_layer': False, 'use_batchnorm': True, 'use_dropout': True, 'dropout': 0.657103556277713, 'mlp_size_1': 0, 'mlp_size_2': 5, 'mlp_size_3': 0, 'kernel': 'LogLogistic', 'loss_name': 'CensoredNLLLoss'}. Best is trial 22 with value: 0.8433318468070169.[0m
