[32m[I 2022-04-22 16:12:25,875][0m Trial 108 finished with value: 0.5178339026157877 and parameters: {'loss': 'coxph', 'learning_rate': 0.0002693177581319078, 'n_estimators': 254, 'criterion': 'friedman_mse', 'min_samples_split': 7, 'min_samples_leaf': 1, 'min_weight_fraction_leaf': 0.47541356088805115, 'min_impurity_decrease': 0.4649140706645628, 'max_features': 0.703645943118166, 'subsample': 0.061659169369208004, 'dropout_rate': 0.2720876561464357, 'ccp_alpha': 0.33243760100444836}. Best is trial 71 with value: 0.6157334456616026.[0m
/media/san2_ssd/data/Workdir/survival/venv/lib/python3.8/site-packages/sksurv/ensemble/boosting.py:955: RuntimeWarning: divide by zero encountered in log
  time = numpy.log(time)
/media/san2_ssd/data/Workdir/survival/venv/lib/python3.8/site-packages/sksurv/ensemble/boosting.py:955: RuntimeWarning: divide by zero encountered in log
  time = numpy.log(time)
/media/san2_ssd/data/Workdir/survival/venv/lib/python3.8/site-packages/sksurv/ensemble/boosting.py:955: RuntimeWarning: divide by zero encountered in log
  time = numpy.log(time)
/media/san2_ssd/data/Workdir/survival/venv/lib/python3.8/site-packages/sksurv/ensemble/boosting.py:955: RuntimeWarning: divide by zero encountered in log
  time = numpy.log(time)
[32m[I 2022-04-22 16:12:27,640][0m Trial 109 finished with value: -0.7110810502043453 and parameters: {'loss': 'squared', 'learning_rate': 0.00022215350807943738, 'n_estimators': 206, 'criterion': 'friedman_mse', 'min_samples_split': 7, 'min_samples_leaf': 1, 'min_weight_fraction_leaf': 0.4999422308057151, 'min_impurity_decrease': 0.483456687394363, 'max_features': 0.7056068935619944, 'subsample': 0.043783711921876224, 'dropout_rate': 0.3402513015222921, 'ccp_alpha': 0.16761458108935656}. Best is trial 71 with value: 0.6157334456616026.[0m
[32m[I 2022-04-22 16:12:37,617][0m Trial 110 finished with value: 0.5252025537027925 and parameters: {'loss': 'coxph', 'learning_rate': 0.00017239274692315587, 'n_estimators': 233, 'criterion': 'friedman_mse', 'min_samples_split': 7, 'min_samples_leaf': 1, 'min_weight_fraction_leaf': 0.4737209287154598, 'min_impurity_decrease': 0.4701074515686548, 'max_features': 0.58113250721344, 'subsample': 0.13114476349029927, 'dropout_rate': 0.5082419364561733, 'ccp_alpha': 0.29626975737118627}. Best is trial 71 with value: 0.6157334456616026.[0m
[32m[I 2022-04-22 16:12:47,288][0m Trial 111 finished with value: 0.5 and parameters: {'loss': 'coxph', 'learning_rate': 0.00017198997985469393, 'n_estimators': 227, 'criterion': 'friedman_mse', 'min_samples_split': 7, 'min_samples_leaf': 1, 'min_weight_fraction_leaf': 0.4716086086017228, 'min_impurity_decrease': 0.4222029970250615, 'max_features': 0.646418813884745, 'subsample': 0.0588252236626846, 'dropout_rate': 0.509891165873205, 'ccp_alpha': 0.3227264795032586}. Best is trial 71 with value: 0.6157334456616026.[0m
[32m[I 2022-04-22 16:12:57,532][0m Trial 112 finished with value: 0.5 and parameters: {'loss': 'coxph', 'learning_rate': 0.0004404782732112793, 'n_estimators': 228, 'criterion': 'friedman_mse', 'min_samples_split': 7, 'min_samples_leaf': 1, 'min_weight_fraction_leaf': 0.4761667784310084, 'min_impurity_decrease': 0.4926991832601815, 'max_features': 0.5872903384306626, 'subsample': 0.11727387745564766, 'dropout_rate': 0.47673402293397354, 'ccp_alpha': 0.5377344179371251}. Best is trial 71 with value: 0.6157334456616026.[0m
[32m[I 2022-04-22 16:13:13,260][0m Trial 113 finished with value: 0.622412064208475 and parameters: {'loss': 'coxph', 'learning_rate': 0.0007520935681144905, 'n_estimators': 253, 'criterion': 'friedman_mse', 'min_samples_split': 8, 'min_samples_leaf': 1, 'min_weight_fraction_leaf': 0.07370184644880082, 'min_impurity_decrease': 0.5484079840076735, 'max_features': 0.6253448349275618, 'subsample': 0.0822488050819447, 'dropout_rate': 0.2827190140433961, 'ccp_alpha': 0.26991265430854255}. Best is trial 113 with value: 0.622412064208475.[0m
[32m[I 2022-04-22 16:13:30,665][0m Trial 114 finished with value: 0.6447165324021841 and parameters: {'loss': 'coxph', 'learning_rate': 0.0008389781809892707, 'n_estimators': 258, 'criterion': 'friedman_mse', 'min_samples_split': 8, 'min_samples_leaf': 2, 'min_weight_fraction_leaf': 0.08177115584223864, 'min_impurity_decrease': 0.5552687436133616, 'max_features': 0.5775040805903834, 'subsample': 0.10265230354537933, 'dropout_rate': 0.25159309123078144, 'ccp_alpha': 0.09804858291232121}. Best is trial 114 with value: 0.6447165324021841.[0m
[32m[I 2022-04-22 16:13:47,081][0m Trial 115 finished with value: 0.5531694353893418 and parameters: {'loss': 'coxph', 'learning_rate': 0.00026787221004385373, 'n_estimators': 256, 'criterion': 'friedman_mse', 'min_samples_split': 8, 'min_samples_leaf': 2, 'min_weight_fraction_leaf': 0.07853613264436239, 'min_impurity_decrease': 0.559061843495306, 'max_features': 0.5723824893285504, 'subsample': 0.20339467165063257, 'dropout_rate': 0.24871541729750668, 'ccp_alpha': 0.2631760118297446}. Best is trial 114 with value: 0.6447165324021841.[0m
[32m[I 2022-04-22 16:14:03,190][0m Trial 116 finished with value: 0.6189465297048766 and parameters: {'loss': 'coxph', 'learning_rate': 0.0008312547301810441, 'n_estimators': 257, 'criterion': 'friedman_mse', 'min_samples_split': 8, 'min_samples_leaf': 2, 'min_weight_fraction_leaf': 0.08482600313889994, 'min_impurity_decrease': 0.555585156846316, 'max_features': 0.5661716403527335, 'subsample': 0.09712474746732008, 'dropout_rate': 0.2676977908221858, 'ccp_alpha': 0.3011466633931686}. Best is trial 114 with value: 0.6447165324021841.[0m
[32m[I 2022-04-22 16:14:19,533][0m Trial 117 finished with value: 0.6191774870331793 and parameters: {'loss': 'coxph', 'learning_rate': 0.0007465358341892943, 'n_estimators': 257, 'criterion': 'friedman_mse', 'min_samples_split': 8, 'min_samples_leaf': 2, 'min_weight_fraction_leaf': 0.08428454739974096, 'min_impurity_decrease': 0.5568662396183489, 'max_features': 0.4925464677356784, 'subsample': 0.09892076080377527, 'dropout_rate': 0.267800434782287, 'ccp_alpha': 0.31509033579499773}. Best is trial 114 with value: 0.6447165324021841.[0m
[32m[I 2022-04-22 16:14:36,598][0m Trial 118 finished with value: 0.5 and parameters: {'loss': 'coxph', 'learning_rate': 0.0006970133206821802, 'n_estimators': 260, 'criterion': 'friedman_mse', 'min_samples_split': 8, 'min_samples_leaf': 2, 'min_weight_fraction_leaf': 0.07510279969388776, 'min_impurity_decrease': 0.5563485846315017, 'max_features': 0.5210170314334797, 'subsample': 0.14121599108404523, 'dropout_rate': 0.23297525893137985, 'ccp_alpha': 0.5148620553803498}. Best is trial 114 with value: 0.6447165324021841.[0m
[32m[I 2022-04-22 16:14:52,774][0m Trial 119 finished with value: 0.6390241916358123 and parameters: {'loss': 'coxph', 'learning_rate': 0.0008935033917604851, 'n_estimators': 245, 'criterion': 'friedman_mse', 'min_samples_split': 8, 'min_samples_leaf': 2, 'min_weight_fraction_leaf': 0.08307429077709572, 'min_impurity_decrease': 0.6007590355271286, 'max_features': 0.5667721830480215, 'subsample': 0.09416003635553408, 'dropout_rate': 0.18823079068933957, 'ccp_alpha': 0.26355613884679363}. Best is trial 114 with value: 0.6447165324021841.[0m
[32m[I 2022-04-22 16:15:09,781][0m Trial 120 finished with value: 0.644072113161699 and parameters: {'loss': 'coxph', 'learning_rate': 0.0008216637368732108, 'n_estimators': 248, 'criterion': 'friedman_mse', 'min_samples_split': 8, 'min_samples_leaf': 2, 'min_weight_fraction_leaf': 0.0879507786418212, 'min_impurity_decrease': 0.6801826217468429, 'max_features': 0.48171858083625124, 'subsample': 0.09822296223981097, 'dropout_rate': 0.1884821623670217, 'ccp_alpha': 0.11977654663151083}. Best is trial 114 with value: 0.6447165324021841.[0m
[32m[I 2022-04-22 16:15:26,951][0m Trial 121 finished with value: 0.6366429939593068 and parameters: {'loss': 'coxph', 'learning_rate': 0.0008844167537338663, 'n_estimators': 244, 'criterion': 'friedman_mse', 'min_samples_split': 8, 'min_samples_leaf': 2, 'min_weight_fraction_leaf': 0.08163566792598846, 'min_impurity_decrease': 0.6078991487869706, 'max_features': 0.48701377426678866, 'subsample': 0.10181238533227994, 'dropout_rate': 0.18046212583134025, 'ccp_alpha': 0.09384136698738618}. Best is trial 114 with value: 0.6447165324021841.[0m
[32m[I 2022-04-22 16:15:46,890][0m Trial 122 finished with value: 0.6438437478530146 and parameters: {'loss': 'coxph', 'learning_rate': 0.001073409310251883, 'n_estimators': 263, 'criterion': 'friedman_mse', 'min_samples_split': 8, 'min_samples_leaf': 2, 'min_weight_fraction_leaf': 0.084892077432764, 'min_impurity_decrease': 0.6086188161537777, 'max_features': 0.5563988498816779, 'subsample': 0.09841718750080701, 'dropout_rate': 0.18231066660533954, 'ccp_alpha': 0.07557023777394148}. Best is trial 114 with value: 0.6447165324021841.[0m
[32m[I 2022-04-22 16:16:03,232][0m Trial 123 finished with value: 0.6419848967731242 and parameters: {'loss': 'coxph', 'learning_rate': 0.0009509059144065858, 'n_estimators': 242, 'criterion': 'friedman_mse', 'min_samples_split': 8, 'min_samples_leaf': 2, 'min_weight_fraction_leaf': 0.0830467582544658, 'min_impurity_decrease': 0.6034137447613785, 'max_features': 0.4787674326712894, 'subsample': 0.09808479436704526, 'dropout_rate': 0.18211006915988903, 'ccp_alpha': 0.10677868979049805}. Best is trial 114 with value: 0.6447165324021841.[0m
[32m[I 2022-04-22 16:16:23,804][0m Trial 124 finished with value: 0.6307128221444993 and parameters: {'loss': 'coxph', 'learning_rate': 0.0008731590750432158, 'n_estimators': 277, 'criterion': 'friedman_mse', 'min_samples_split': 8, 'min_samples_leaf': 2, 'min_weight_fraction_leaf': 0.05807917621406129, 'min_impurity_decrease': 0.6843399039575828, 'max_features': 0.4737300054212029, 'subsample': 0.10023718369168792, 'dropout_rate': 0.1825165271530012, 'ccp_alpha': 0.11466064405697271}. Best is trial 114 with value: 0.6447165324021841.[0m
[32m[I 2022-04-22 16:16:44,532][0m Trial 125 finished with value: 0.6259623355485502 and parameters: {'loss': 'coxph', 'learning_rate': 0.001197269201004116, 'n_estimators': 276, 'criterion': 'friedman_mse', 'min_samples_split': 8, 'min_samples_leaf': 2, 'min_weight_fraction_leaf': 0.06099864373221037, 'min_impurity_decrease': 0.6814848277771244, 'max_features': 0.48090204285667654, 'subsample': 0.09750564285097635, 'dropout_rate': 0.17330283616633996, 'ccp_alpha': 0.12320294701267887}. Best is trial 114 with value: 0.6447165324021841.[0m
[32m[I 2022-04-22 16:17:09,553][0m Trial 126 finished with value: 0.6234537805229234 and parameters: {'loss': 'coxph', 'learning_rate': 0.0011115347040286197, 'n_estimators': 303, 'criterion': 'friedman_mse', 'min_samples_split': 8, 'min_samples_leaf': 2, 'min_weight_fraction_leaf': 0.04700037162276861, 'min_impurity_decrease': 0.6843720171439086, 'max_features': 0.47028202838746014, 'subsample': 0.09086643196634915, 'dropout_rate': 0.1760366143534701, 'ccp_alpha': 0.008836080382916625}. Best is trial 114 with value: 0.6447165324021841.[0m
[32m[I 2022-04-22 16:17:30,639][0m Trial 127 finished with value: 0.6359295282115648 and parameters: {'loss': 'coxph', 'learning_rate': 0.000965694296342963, 'n_estimators': 276, 'criterion': 'friedman_mse', 'min_samples_split': 8, 'min_samples_leaf': 2, 'min_weight_fraction_leaf': 0.05733057821546496, 'min_impurity_decrease': 0.692615056255521, 'max_features': 0.4783592797724281, 'subsample': 0.09342401658057278, 'dropout_rate': 0.17107216072124917, 'ccp_alpha': 0.06537835585865674}. Best is trial 114 with value: 0.6447165324021841.[0m
[32m[I 2022-04-22 16:17:57,084][0m Trial 128 finished with value: 0.6290720732617715 and parameters: {'loss': 'coxph', 'learning_rate': 0.0009401204222897398, 'n_estimators': 305, 'criterion': 'friedman_mse', 'min_samples_split': 8, 'min_samples_leaf': 2, 'min_weight_fraction_leaf': 0.054354179168449104, 'min_impurity_decrease': 0.6908763863959102, 'max_features': 0.4837153176630262, 'subsample': 0.09171625971620323, 'dropout_rate': 0.17615818526597035, 'ccp_alpha': 0.1115868036360011}. Best is trial 114 with value: 0.6447165324021841.[0m
[32m[I 2022-04-22 16:18:28,232][0m Trial 129 finished with value: 0.6423232845004867 and parameters: {'loss': 'coxph', 'learning_rate': 0.001067296123006236, 'n_estimators': 324, 'criterion': 'friedman_mse', 'min_samples_split': 8, 'min_samples_leaf': 2, 'min_weight_fraction_leaf': 0.05488471940054536, 'min_impurity_decrease': 0.7053169240788105, 'max_features': 0.4698092697964093, 'subsample': 0.10493743753380116, 'dropout_rate': 0.17816916016675058, 'ccp_alpha': 0.0015740048846472482}. Best is trial 114 with value: 0.6447165324021841.[0m
/media/san2_ssd/data/Workdir/survival/venv/lib/python3.8/site-packages/sksurv/ensemble/boosting.py:955: RuntimeWarning: divide by zero encountered in log
  time = numpy.log(time)
/media/san2_ssd/data/Workdir/survival/venv/lib/python3.8/site-packages/sksurv/ensemble/boosting.py:955: RuntimeWarning: divide by zero encountered in log
  time = numpy.log(time)
/media/san2_ssd/data/Workdir/survival/venv/lib/python3.8/site-packages/sksurv/ensemble/boosting.py:955: RuntimeWarning: divide by zero encountered in log
  time = numpy.log(time)
/media/san2_ssd/data/Workdir/survival/venv/lib/python3.8/site-packages/sksurv/ensemble/boosting.py:955: RuntimeWarning: divide by zero encountered in log
  time = numpy.log(time)
[32m[I 2022-04-22 16:18:33,334][0m Trial 130 finished with value: -0.7342103715899772 and parameters: {'loss': 'squared', 'learning_rate': 0.0010468081208219833, 'n_estimators': 306, 'criterion': 'friedman_mse', 'min_samples_split': 8, 'min_samples_leaf': 2, 'min_weight_fraction_leaf': 0.051328163147444296, 'min_impurity_decrease': 0.6874940036275254, 'max_features': 0.47317452216893496, 'subsample': 0.17807133317379464, 'dropout_rate': 0.17851584565931666, 'ccp_alpha': 0.004539977160434669}. Best is trial 114 with value: 0.6447165324021841.[0m
[32m[I 2022-04-22 16:18:56,472][0m Trial 131 finished with value: 0.6397074870763634 and parameters: {'loss': 'coxph', 'learning_rate': 0.0021953188187209993, 'n_estimators': 276, 'criterion': 'friedman_mse', 'min_samples_split': 8, 'min_samples_leaf': 2, 'min_weight_fraction_leaf': 0.04104036337400059, 'min_impurity_decrease': 0.7216465338369518, 'max_features': 0.48388406939299616, 'subsample': 0.11827699761272381, 'dropout_rate': 0.13213009913536453, 'ccp_alpha': 0.0965401792381269}. Best is trial 114 with value: 0.6447165324021841.[0m
[32m[I 2022-04-22 16:19:18,664][0m Trial 132 finished with value: 0.6472091459070075 and parameters: {'loss': 'coxph', 'learning_rate': 0.0018196416359738314, 'n_estimators': 277, 'criterion': 'friedman_mse', 'min_samples_split': 8, 'min_samples_leaf': 2, 'min_weight_fraction_leaf': 0.040858503516411855, 'min_impurity_decrease': 0.7199443296549053, 'max_features': 0.4595858497905525, 'subsample': 0.15461701865728922, 'dropout_rate': 0.1413572287825248, 'ccp_alpha': 0.06783263268483519}. Best is trial 132 with value: 0.6472091459070075.[0m
[32m[I 2022-04-22 16:19:44,686][0m Trial 133 finished with value: 0.6508026141812072 and parameters: {'loss': 'coxph', 'learning_rate': 0.0018803295739239568, 'n_estimators': 303, 'criterion': 'friedman_mse', 'min_samples_split': 8, 'min_samples_leaf': 2, 'min_weight_fraction_leaf': 0.03702045286475757, 'min_impurity_decrease': 0.724121448144035, 'max_features': 0.4443864231482182, 'subsample': 0.15942200956485886, 'dropout_rate': 0.1342755342957477, 'ccp_alpha': 0.09786644822958855}. Best is trial 133 with value: 0.6508026141812072.[0m
[32m[I 2022-04-22 16:20:07,398][0m Trial 134 finished with value: 0.6510664474876497 and parameters: {'loss': 'coxph', 'learning_rate': 0.0017119690424653247, 'n_estimators': 278, 'criterion': 'friedman_mse', 'min_samples_split': 8, 'min_samples_leaf': 2, 'min_weight_fraction_leaf': 0.03552810116897102, 'min_impurity_decrease': 0.7125168539016122, 'max_features': 0.43821702967721865, 'subsample': 0.15438692386643954, 'dropout_rate': 0.14628358441954695, 'ccp_alpha': 0.12107157761724578}. Best is trial 134 with value: 0.6510664474876497.[0m
[32m[I 2022-04-22 16:20:38,569][0m Trial 135 finished with value: 0.6498041116188762 and parameters: {'loss': 'coxph', 'learning_rate': 0.002011821041381551, 'n_estimators': 325, 'criterion': 'friedman_mse', 'min_samples_split': 9, 'min_samples_leaf': 2, 'min_weight_fraction_leaf': 0.03323170051774492, 'min_impurity_decrease': 0.7340813119484713, 'max_features': 0.44646474827386695, 'subsample': 0.15841398954628055, 'dropout_rate': 0.13184945354451633, 'ccp_alpha': 0.1115939861706486}. Best is trial 134 with value: 0.6510664474876497.[0m
[32m[I 2022-04-22 16:21:07,595][0m Trial 136 finished with value: 0.6349728886225606 and parameters: {'loss': 'coxph', 'learning_rate': 0.0019038110478586496, 'n_estimators': 327, 'criterion': 'friedman_mse', 'min_samples_split': 9, 'min_samples_leaf': 2, 'min_weight_fraction_leaf': 0.033196634379800416, 'min_impurity_decrease': 0.7279468868360206, 'max_features': 0.44728208755679677, 'subsample': 0.16134795755820597, 'dropout_rate': 0.13231423630173209, 'ccp_alpha': 0.17987571549783518}. Best is trial 134 with value: 0.6510664474876497.[0m
[32m[I 2022-04-22 16:21:40,766][0m Trial 137 finished with value: 0.5177362383394645 and parameters: {'loss': 'coxph', 'learning_rate': 0.0024167203306998913, 'n_estimators': 347, 'criterion': 'friedman_mse', 'min_samples_split': 9, 'min_samples_leaf': 2, 'min_weight_fraction_leaf': 0.034124277882598746, 'min_impurity_decrease': 0.7356303503695703, 'max_features': 0.44415075787072883, 'subsample': 0.1576109167156946, 'dropout_rate': 0.13121923877276165, 'ccp_alpha': 0.3941149750517273}. Best is trial 134 with value: 0.6510664474876497.[0m
[32m[I 2022-04-22 16:22:11,016][0m Trial 138 finished with value: 0.6463477320658735 and parameters: {'loss': 'coxph', 'learning_rate': 0.0018358813649471369, 'n_estimators': 328, 'criterion': 'friedman_mse', 'min_samples_split': 9, 'min_samples_leaf': 2, 'min_weight_fraction_leaf': 0.002936662857371611, 'min_impurity_decrease': 0.719749595538284, 'max_features': 0.42200403428278627, 'subsample': 0.12435035395969185, 'dropout_rate': 0.14245666723247383, 'ccp_alpha': 0.2118915069924288}. Best is trial 134 with value: 0.6510664474876497.[0m
[32m[I 2022-04-22 16:22:47,474][0m Trial 139 finished with value: 0.6459619408121654 and parameters: {'loss': 'coxph', 'learning_rate': 0.0017420998360001068, 'n_estimators': 344, 'criterion': 'friedman_mse', 'min_samples_split': 9, 'min_samples_leaf': 2, 'min_weight_fraction_leaf': 0.00217179427925696, 'min_impurity_decrease': 0.7627087229490723, 'max_features': 0.42469649224880646, 'subsample': 0.12772231970984738, 'dropout_rate': 0.11165302934520922, 'ccp_alpha': 0.00520371471582895}. Best is trial 134 with value: 0.6510664474876497.[0m
[32m[I 2022-04-22 16:23:20,518][0m Trial 140 finished with value: 0.6413265259130323 and parameters: {'loss': 'coxph', 'learning_rate': 0.0030744578354289297, 'n_estimators': 325, 'criterion': 'friedman_mse', 'min_samples_split': 9, 'min_samples_leaf': 3, 'min_weight_fraction_leaf': 0.0063151993630280595, 'min_impurity_decrease': 0.7629521056596918, 'max_features': 0.4232909251408487, 'subsample': 0.12324481613336465, 'dropout_rate': 0.10870931299995935, 'ccp_alpha': 0.0029165546078352405}. Best is trial 134 with value: 0.6510664474876497.[0m
[32m[I 2022-04-22 16:24:00,497][0m Trial 141 finished with value: 0.6412159864313752 and parameters: {'loss': 'coxph', 'learning_rate': 0.002992477700102371, 'n_estimators': 369, 'criterion': 'friedman_mse', 'min_samples_split': 9, 'min_samples_leaf': 3, 'min_weight_fraction_leaf': 0.0012562010475199656, 'min_impurity_decrease': 0.762597863568486, 'max_features': 0.4229590844307844, 'subsample': 0.12068374172693425, 'dropout_rate': 0.11189395851916245, 'ccp_alpha': 0.013504090752098297}. Best is trial 134 with value: 0.6510664474876497.[0m
[32m[I 2022-04-22 16:24:40,701][0m Trial 142 finished with value: 0.6398268029003701 and parameters: {'loss': 'coxph', 'learning_rate': 0.0029516133999798336, 'n_estimators': 364, 'criterion': 'friedman_mse', 'min_samples_split': 9, 'min_samples_leaf': 3, 'min_weight_fraction_leaf': 0.004360162664766458, 'min_impurity_decrease': 0.7646470120057915, 'max_features': 0.4233923203319347, 'subsample': 0.11949260153568486, 'dropout_rate': 0.11317729100494353, 'ccp_alpha': 0.003923902595338563}. Best is trial 134 with value: 0.6510664474876497.[0m
[32m[I 2022-04-22 16:25:22,234][0m Trial 143 finished with value: 0.6514796499186757 and parameters: {'loss': 'coxph', 'learning_rate': 0.0029823728468809352, 'n_estimators': 375, 'criterion': 'friedman_mse', 'min_samples_split': 9, 'min_samples_leaf': 3, 'min_weight_fraction_leaf': 0.0036148921451922542, 'min_impurity_decrease': 0.7606034033640657, 'max_features': 0.4148439208209023, 'subsample': 0.12528582891666024, 'dropout_rate': 0.104925383504671, 'ccp_alpha': 0.002971053319902121}. Best is trial 143 with value: 0.6514796499186757.[0m
[32m[I 2022-04-22 16:26:03,944][0m Trial 144 finished with value: 0.6502504150761259 and parameters: {'loss': 'coxph', 'learning_rate': 0.0031080815933516442, 'n_estimators': 381, 'criterion': 'friedman_mse', 'min_samples_split': 9, 'min_samples_leaf': 3, 'min_weight_fraction_leaf': 0.004422831378997195, 'min_impurity_decrease': 0.7634242299041359, 'max_features': 0.42689329400294634, 'subsample': 0.12935609992117197, 'dropout_rate': 0.10663086043371972, 'ccp_alpha': 0.020387001101244494}. Best is trial 143 with value: 0.6514796499186757.[0m
