[32m[I 2022-04-21 11:51:46,400][0m Trial 903 finished with value: 0.6059322655464621 and parameters: {'splitter': 'best', 'min_samples_split': 0.10394223772640063, 'min_samples_leaf': 0.056806110844610354, 'min_weight_fraction_leaf': 0.02836087979794994, 'max_features': 0.8370699384606773}. Best is trial 688 with value: 0.6612018755665507.[0m
[32m[I 2022-04-21 11:51:46,991][0m Trial 904 finished with value: 0.6370443486381151 and parameters: {'splitter': 'best', 'min_samples_split': 0.11088320778818093, 'min_samples_leaf': 0.01708871653506388, 'min_weight_fraction_leaf': 0.02378487715723067, 'max_features': 0.8258424838294061}. Best is trial 688 with value: 0.6612018755665507.[0m
[32m[I 2022-04-21 11:51:47,351][0m Trial 905 finished with value: 0.5991713888544432 and parameters: {'splitter': 'best', 'min_samples_split': 0.09505675925834842, 'min_samples_leaf': 0.01059091135939012, 'min_weight_fraction_leaf': 0.04873139685422467, 'max_features': 0.7750579004518928}. Best is trial 688 with value: 0.6612018755665507.[0m
[32m[I 2022-04-21 11:51:47,893][0m Trial 906 finished with value: 0.6304363868311896 and parameters: {'splitter': 'best', 'min_samples_split': 0.11907784752849769, 'min_samples_leaf': 0.0019084147731089295, 'min_weight_fraction_leaf': 0.03461464375247282, 'max_features': 0.865365656322982}. Best is trial 688 with value: 0.6612018755665507.[0m
[32m[I 2022-04-21 11:51:48,513][0m Trial 907 finished with value: 0.6258301824341399 and parameters: {'splitter': 'best', 'min_samples_split': 0.08105566298498242, 'min_samples_leaf': 0.03251978616909477, 'min_weight_fraction_leaf': 0.022795301708091242, 'max_features': 0.8025755578669662}. Best is trial 688 with value: 0.6612018755665507.[0m
[32m[I 2022-04-21 11:51:49,372][0m Trial 908 finished with value: 0.6384871277457564 and parameters: {'splitter': 'best', 'min_samples_split': 0.10228745991971029, 'min_samples_leaf': 0.022473534216066314, 'min_weight_fraction_leaf': 0.0216560403392663, 'max_features': 0.9010273353803974}. Best is trial 688 with value: 0.6612018755665507.[0m
[32m[I 2022-04-21 11:51:49,759][0m Trial 909 finished with value: 0.6323706436472082 and parameters: {'splitter': 'best', 'min_samples_split': 0.11549639324943092, 'min_samples_leaf': 0.043620439973160216, 'min_weight_fraction_leaf': 0.036099916090548474, 'max_features': 0.644047770687945}. Best is trial 688 with value: 0.6612018755665507.[0m
[32m[I 2022-04-21 11:51:50,484][0m Trial 910 finished with value: 0.6409640107549374 and parameters: {'splitter': 'best', 'min_samples_split': 0.06753077143530997, 'min_samples_leaf': 0.00911570720303324, 'min_weight_fraction_leaf': 0.018342968605120132, 'max_features': 0.609807030063915}. Best is trial 688 with value: 0.6612018755665507.[0m
[32m[I 2022-04-21 11:51:51,174][0m Trial 911 finished with value: 0.636570787055031 and parameters: {'splitter': 'best', 'min_samples_split': 0.08961625089492697, 'min_samples_leaf': 0.0011032255387419011, 'min_weight_fraction_leaf': 0.03078843751594792, 'max_features': 0.8501695632941568}. Best is trial 688 with value: 0.6612018755665507.[0m
[32m[I 2022-04-21 11:51:51,876][0m Trial 912 finished with value: 0.6326881010471028 and parameters: {'splitter': 'best', 'min_samples_split': 0.12526467077281725, 'min_samples_leaf': 0.017205657277313376, 'min_weight_fraction_leaf': 0.016586596260131457, 'max_features': 0.8185536793321615}. Best is trial 688 with value: 0.6612018755665507.[0m
[32m[I 2022-04-21 11:51:52,563][0m Trial 913 finished with value: 0.6398373124862929 and parameters: {'splitter': 'best', 'min_samples_split': 0.1122493560380636, 'min_samples_leaf': 0.028074765385622823, 'min_weight_fraction_leaf': 0.013982630562834981, 'max_features': 0.77437834967527}. Best is trial 688 with value: 0.6612018755665507.[0m
[32m[I 2022-04-21 11:51:52,683][0m Trial 914 finished with value: 0.6208950863454307 and parameters: {'splitter': 'random', 'min_samples_split': 0.09862225337568369, 'min_samples_leaf': 0.11971496585735691, 'min_weight_fraction_leaf': 0.04081706351242558, 'max_features': 0.5916123076685172}. Best is trial 688 with value: 0.6612018755665507.[0m
[32m[I 2022-04-21 11:51:53,739][0m Trial 915 finished with value: 0.6425297285297611 and parameters: {'splitter': 'best', 'min_samples_split': 0.1227226901391724, 'min_samples_leaf': 0.01751273148731933, 'min_weight_fraction_leaf': 0.025410371212547165, 'max_features': 0.7973603367533817}. Best is trial 688 with value: 0.6612018755665507.[0m
[32m[I 2022-04-21 11:51:54,174][0m Trial 916 finished with value: 0.5404135101820697 and parameters: {'splitter': 'best', 'min_samples_split': 0.10776558847189525, 'min_samples_leaf': 0.0017382077537166805, 'min_weight_fraction_leaf': 0.31370503946546097, 'max_features': 0.6240771100896816}. Best is trial 688 with value: 0.6612018755665507.[0m
[32m[I 2022-04-21 11:51:55,772][0m Trial 917 finished with value: 0.6295926172817221 and parameters: {'splitter': 'best', 'min_samples_split': 0.1327859944427157, 'min_samples_leaf': 0.0012991553834180091, 'min_weight_fraction_leaf': 0.010295652611993757, 'max_features': 0.6529608111229199}. Best is trial 688 with value: 0.6612018755665507.[0m
[32m[I 2022-04-21 11:51:56,654][0m Trial 918 finished with value: 0.61748072544237 and parameters: {'splitter': 'best', 'min_samples_split': 0.08631282166918897, 'min_samples_leaf': 0.0010793582878739095, 'min_weight_fraction_leaf': 0.02414127535024426, 'max_features': 0.5683987309651826}. Best is trial 688 with value: 0.6612018755665507.[0m
[32m[I 2022-04-21 11:51:57,368][0m Trial 919 finished with value: 0.6257396811351237 and parameters: {'splitter': 'best', 'min_samples_split': 0.07285111038856268, 'min_samples_leaf': 0.0346356551642778, 'min_weight_fraction_leaf': 0.00962972093085284, 'max_features': 0.8356088987941152}. Best is trial 688 with value: 0.6612018755665507.[0m
[32m[I 2022-04-21 11:51:58,007][0m Trial 920 finished with value: 0.6184739034153834 and parameters: {'splitter': 'best', 'min_samples_split': 0.1302852683671373, 'min_samples_leaf': 0.024608530994963063, 'min_weight_fraction_leaf': 0.017354852924795577, 'max_features': 0.6055019515995896}. Best is trial 688 with value: 0.6612018755665507.[0m
[32m[I 2022-04-21 11:51:59,017][0m Trial 921 finished with value: 0.6249289062482122 and parameters: {'splitter': 'best', 'min_samples_split': 0.11786399751882848, 'min_samples_leaf': 0.013814572411286443, 'min_weight_fraction_leaf': 0.03165990140759214, 'max_features': 0.7874924703530686}. Best is trial 688 with value: 0.6612018755665507.[0m
[32m[I 2022-04-21 11:51:59,642][0m Trial 922 finished with value: 0.6363683051782573 and parameters: {'splitter': 'best', 'min_samples_split': 0.05350849956568035, 'min_samples_leaf': 0.014402609952431077, 'min_weight_fraction_leaf': 0.008638753457883916, 'max_features': 0.8145382214737775}. Best is trial 688 with value: 0.6612018755665507.[0m
[32m[I 2022-04-21 11:51:59,845][0m Trial 923 finished with value: 0.6187726967595195 and parameters: {'splitter': 'best', 'min_samples_split': 0.09849314904588646, 'min_samples_leaf': 0.07271033682166453, 'min_weight_fraction_leaf': 0.04282394878444921, 'max_features': 0.6378048184184563}. Best is trial 688 with value: 0.6612018755665507.[0m
[32m[I 2022-04-21 11:52:00,462][0m Trial 924 finished with value: 0.6210806086618949 and parameters: {'splitter': 'best', 'min_samples_split': 0.10832720695863784, 'min_samples_leaf': 0.025331813271087793, 'min_weight_fraction_leaf': 0.01945145539569369, 'max_features': 0.7660800167763293}. Best is trial 688 with value: 0.6612018755665507.[0m
[32m[I 2022-04-21 11:52:01,111][0m Trial 925 finished with value: 0.6278434507119471 and parameters: {'splitter': 'best', 'min_samples_split': 0.13580836579538544, 'min_samples_leaf': 0.042611563838843944, 'min_weight_fraction_leaf': 0.008931723313127238, 'max_features': 0.8731925360191135}. Best is trial 688 with value: 0.6612018755665507.[0m
[32m[I 2022-04-21 11:52:01,870][0m Trial 926 finished with value: 0.6374367062930165 and parameters: {'splitter': 'best', 'min_samples_split': 0.14234750492227288, 'min_samples_leaf': 0.01131568622105065, 'min_weight_fraction_leaf': 0.02921785887063138, 'max_features': 0.6135695987475124}. Best is trial 688 with value: 0.6612018755665507.[0m
[32m[I 2022-04-21 11:52:02,031][0m Trial 927 finished with value: 0.5398373364311787 and parameters: {'splitter': 'best', 'min_samples_split': 0.12070007520038398, 'min_samples_leaf': 0.4010768565631308, 'min_weight_fraction_leaf': 0.016354441702953894, 'max_features': 0.583824853407048}. Best is trial 688 with value: 0.6612018755665507.[0m
[32m[I 2022-04-21 11:52:02,834][0m Trial 928 finished with value: 0.6252799757750681 and parameters: {'splitter': 'best', 'min_samples_split': 0.09105766381986463, 'min_samples_leaf': 0.001133153832039071, 'min_weight_fraction_leaf': 0.024045364856685368, 'max_features': 0.7954121859659394}. Best is trial 688 with value: 0.6612018755665507.[0m
[32m[I 2022-04-21 11:52:03,225][0m Trial 929 finished with value: 0.6281721120518519 and parameters: {'splitter': 'best', 'min_samples_split': 0.10595844652250294, 'min_samples_leaf': 0.03288508733875878, 'min_weight_fraction_leaf': 0.00011269842698498692, 'max_features': 0.5417425934202377}. Best is trial 688 with value: 0.6612018755665507.[0m
[32m[I 2022-04-21 11:52:03,343][0m Trial 930 finished with value: 0.536760391755396 and parameters: {'splitter': 'best', 'min_samples_split': 0.12638779653526708, 'min_samples_leaf': 0.3744854697604722, 'min_weight_fraction_leaf': 0.05348274598209417, 'max_features': 0.6593301511146188}. Best is trial 688 with value: 0.6612018755665507.[0m
[32m[I 2022-04-21 11:52:04,112][0m Trial 931 finished with value: 0.6207904177408814 and parameters: {'splitter': 'best', 'min_samples_split': 0.11085825429994636, 'min_samples_leaf': 0.018588069976166462, 'min_weight_fraction_leaf': 0.008835627269037517, 'max_features': 0.8415263347200947}. Best is trial 688 with value: 0.6612018755665507.[0m
[32m[I 2022-04-21 11:52:04,206][0m Trial 932 finished with value: 0.629589135468165 and parameters: {'splitter': 'random', 'min_samples_split': 0.09476420970888084, 'min_samples_leaf': 0.010752102230859949, 'min_weight_fraction_leaf': 0.03445765573217069, 'max_features': 0.6249268654389569}. Best is trial 688 with value: 0.6612018755665507.[0m
[32m[I 2022-04-21 11:52:04,773][0m Trial 933 finished with value: 0.6330035632681097 and parameters: {'splitter': 'best', 'min_samples_split': 0.14103104908013814, 'min_samples_leaf': 0.024603028459665072, 'min_weight_fraction_leaf': 0.016651826184082983, 'max_features': 0.7785421921666605}. Best is trial 688 with value: 0.6612018755665507.[0m
[32m[I 2022-04-21 11:52:06,358][0m Trial 934 finished with value: 0.6446601577881843 and parameters: {'splitter': 'best', 'min_samples_split': 0.08184481612969073, 'min_samples_leaf': 0.0011223932892399954, 'min_weight_fraction_leaf': 0.022305462060889358, 'max_features': 0.8198263733723904}. Best is trial 688 with value: 0.6612018755665507.[0m
[32m[I 2022-04-21 11:52:06,996][0m Trial 935 finished with value: 0.6607029142877525 and parameters: {'splitter': 'best', 'min_samples_split': 0.11979013947416331, 'min_samples_leaf': 0.01668837186645357, 'min_weight_fraction_leaf': 0.00812157361670488, 'max_features': 0.8050351570594282}. Best is trial 688 with value: 0.6612018755665507.[0m
[32m[I 2022-04-21 11:52:07,608][0m Trial 936 finished with value: 0.6366299448453822 and parameters: {'splitter': 'best', 'min_samples_split': 0.10419524677343796, 'min_samples_leaf': 0.01121603185883728, 'min_weight_fraction_leaf': 0.03915199178158322, 'max_features': 0.8211388205501992}. Best is trial 688 with value: 0.6612018755665507.[0m
[32m[I 2022-04-21 11:52:08,360][0m Trial 937 finished with value: 0.6364172087522262 and parameters: {'splitter': 'best', 'min_samples_split': 0.11674619592010357, 'min_samples_leaf': 0.02477242239853479, 'min_weight_fraction_leaf': 0.03015948996816053, 'max_features': 0.8330213088926689}. Best is trial 688 with value: 0.6612018755665507.[0m
[32m[I 2022-04-21 11:52:09,115][0m Trial 938 finished with value: 0.6409904349581395 and parameters: {'splitter': 'best', 'min_samples_split': 0.09057672195925848, 'min_samples_leaf': 0.009733640222760227, 'min_weight_fraction_leaf': 0.017035202691098657, 'max_features': 0.8629418577548215}. Best is trial 688 with value: 0.6612018755665507.[0m
[32m[I 2022-04-21 11:52:09,528][0m Trial 939 finished with value: 0.6183755494368351 and parameters: {'splitter': 'best', 'min_samples_split': 0.11067403983301867, 'min_samples_leaf': 0.03689318139256406, 'min_weight_fraction_leaf': 0.025518411830852312, 'max_features': 0.8051649309457725}. Best is trial 688 with value: 0.6612018755665507.[0m
[32m[I 2022-04-21 11:52:10,068][0m Trial 940 finished with value: 0.6389848108815804 and parameters: {'splitter': 'best', 'min_samples_split': 0.10026197310666782, 'min_samples_leaf': 0.01615773401424233, 'min_weight_fraction_leaf': 0.009834564122649287, 'max_features': 0.848636920829257}. Best is trial 688 with value: 0.6612018755665507.[0m
[32m[I 2022-04-21 11:52:10,201][0m Trial 941 finished with value: 0.5728983162528444 and parameters: {'splitter': 'best', 'min_samples_split': 0.12229233060377032, 'min_samples_leaf': 0.23294055826055432, 'min_weight_fraction_leaf': 0.04601894745672297, 'max_features': 0.813132085332308}. Best is trial 688 with value: 0.6612018755665507.[0m
[32m[I 2022-04-21 11:52:10,439][0m Trial 942 finished with value: 0.5989632720150742 and parameters: {'splitter': 'best', 'min_samples_split': 0.07333587933960428, 'min_samples_leaf': 0.14703772100302345, 'min_weight_fraction_leaf': 0.015250484088647471, 'max_features': 0.833145128095579}. Best is trial 688 with value: 0.6612018755665507.[0m
[32m[I 2022-04-21 11:52:11,626][0m Trial 943 finished with value: 0.6195290744343348 and parameters: {'splitter': 'best', 'min_samples_split': 0.10191453099011494, 'min_samples_leaf': 0.010342860670479764, 'min_weight_fraction_leaf': 0.03207746423555519, 'max_features': 0.8000184058120041}. Best is trial 688 with value: 0.6612018755665507.[0m
[32m[I 2022-04-21 11:52:12,463][0m Trial 944 finished with value: 0.6391854387612362 and parameters: {'splitter': 'best', 'min_samples_split': 0.1298613214539568, 'min_samples_leaf': 0.023425055421999953, 'min_weight_fraction_leaf': 0.00830487805911168, 'max_features': 0.7964656481596817}. Best is trial 688 with value: 0.6612018755665507.[0m
[32m[I 2022-04-21 11:52:13,079][0m Trial 945 finished with value: 0.6175459235056462 and parameters: {'splitter': 'best', 'min_samples_split': 0.11348407225323529, 'min_samples_leaf': 0.0013038921365320384, 'min_weight_fraction_leaf': 0.0233467351841822, 'max_features': 0.8489431595416275}. Best is trial 688 with value: 0.6612018755665507.[0m
[32m[I 2022-04-21 11:52:13,677][0m Trial 946 finished with value: 0.6221620367996955 and parameters: {'splitter': 'best', 'min_samples_split': 0.12000586601101729, 'min_samples_leaf': 0.031197470781914843, 'min_weight_fraction_leaf': 0.008956418071414757, 'max_features': 0.8169976518862855}. Best is trial 688 with value: 0.6612018755665507.[0m
[32m[I 2022-04-21 11:52:14,213][0m Trial 947 finished with value: 0.6063339486348187 and parameters: {'splitter': 'best', 'min_samples_split': 0.29120300740623184, 'min_samples_leaf': 0.05176003282579294, 'min_weight_fraction_leaf': 0.02168518637370974, 'max_features': 0.8819311470442178}. Best is trial 688 with value: 0.6612018755665507.[0m
[32m[I 2022-04-21 11:52:14,643][0m Trial 948 finished with value: 0.6514922661429389 and parameters: {'splitter': 'best', 'min_samples_split': 0.08170929820645594, 'min_samples_leaf': 0.016323693095374896, 'min_weight_fraction_leaf': 2.6076953909597023e-05, 'max_features': 0.5161635014575952}. Best is trial 688 with value: 0.6612018755665507.[0m
[32m[I 2022-04-21 11:52:15,053][0m Trial 949 finished with value: 0.6174629179305298 and parameters: {'splitter': 'best', 'min_samples_split': 0.05128058918209539, 'min_samples_leaf': 0.041232618757894794, 'min_weight_fraction_leaf': 0.000607833439006682, 'max_features': 0.5481151351610385}. Best is trial 688 with value: 0.6612018755665507.[0m
[32m[I 2022-04-21 11:52:15,339][0m Trial 950 finished with value: 0.627687115091541 and parameters: {'splitter': 'best', 'min_samples_split': 0.059823377209123875, 'min_samples_leaf': 0.033595528694579505, 'min_weight_fraction_leaf': 0.0071421261341289045, 'max_features': 0.49083561435256506}. Best is trial 688 with value: 0.6612018755665507.[0m
[32m[I 2022-04-21 11:52:15,820][0m Trial 951 finished with value: 0.6232642448105412 and parameters: {'splitter': 'best', 'min_samples_split': 0.06645397817196139, 'min_samples_leaf': 0.025295400449952033, 'min_weight_fraction_leaf': 0.008602664761994937, 'max_features': 0.4818201637889886}. Best is trial 688 with value: 0.6612018755665507.[0m
[32m[I 2022-04-21 11:52:16,250][0m Trial 952 finished with value: 0.6066618577040577 and parameters: {'splitter': 'best', 'min_samples_split': 0.07214184385076645, 'min_samples_leaf': 0.04764990240516205, 'min_weight_fraction_leaf': 0.00018096747361743605, 'max_features': 0.5040469365107091}. Best is trial 688 with value: 0.6612018755665507.[0m
[32m[I 2022-04-21 11:52:16,546][0m Trial 953 finished with value: 0.6068769083452455 and parameters: {'splitter': 'random', 'min_samples_split': 0.08067580396291003, 'min_samples_leaf': 0.018907017935991824, 'min_weight_fraction_leaf': 0.015928522172286658, 'max_features': 0.5035024881584768}. Best is trial 688 with value: 0.6612018755665507.[0m
[32m[I 2022-04-21 11:52:17,039][0m Trial 954 finished with value: 0.6371762421841023 and parameters: {'splitter': 'best', 'min_samples_split': 0.0808047716720857, 'min_samples_leaf': 0.031206461991041115, 'min_weight_fraction_leaf': 0.00040322793456616657, 'max_features': 0.5151494588641313}. Best is trial 688 with value: 0.6612018755665507.[0m
[32m[I 2022-04-21 11:52:17,539][0m Trial 955 finished with value: 0.6326781836111632 and parameters: {'splitter': 'best', 'min_samples_split': 0.09245330008117075, 'min_samples_leaf': 0.0188359684229157, 'min_weight_fraction_leaf': 0.00019559592084771867, 'max_features': 0.5158159863696443}. Best is trial 688 with value: 0.6612018755665507.[0m
[32m[I 2022-04-21 11:52:17,811][0m Trial 956 finished with value: 0.6443620844710499 and parameters: {'splitter': 'best', 'min_samples_split': 0.07466902359718527, 'min_samples_leaf': 0.025650266936107155, 'min_weight_fraction_leaf': 0.0307413392372288, 'max_features': 0.45438246423848105}. Best is trial 688 with value: 0.6612018755665507.[0m
[32m[I 2022-04-21 11:52:17,893][0m Trial 957 finished with value: 0.5 and parameters: {'splitter': 'best', 'min_samples_split': 0.07889079901295416, 'min_samples_leaf': 0.015189503690363045, 'min_weight_fraction_leaf': 0.017045230476069588, 'max_features': 0.004587241572127532}. Best is trial 688 with value: 0.6612018755665507.[0m
[32m[I 2022-04-21 11:52:18,238][0m Trial 958 finished with value: 0.6318976380996589 and parameters: {'splitter': 'best', 'min_samples_split': 0.08467701379279574, 'min_samples_leaf': 0.03785054019894857, 'min_weight_fraction_leaf': 0.016031184015574733, 'max_features': 0.529691663271831}. Best is trial 688 with value: 0.6612018755665507.[0m
[32m[I 2022-04-21 11:52:18,578][0m Trial 959 finished with value: 0.6082912058334028 and parameters: {'splitter': 'best', 'min_samples_split': 0.06803859935512457, 'min_samples_leaf': 0.01735559811387933, 'min_weight_fraction_leaf': 0.03992491431427472, 'max_features': 0.5219143273241441}. Best is trial 688 with value: 0.6612018755665507.[0m
[32m[I 2022-04-21 11:52:18,933][0m Trial 960 finished with value: 0.6021341017599882 and parameters: {'splitter': 'best', 'min_samples_split': 0.057390227806329616, 'min_samples_leaf': 0.030756204319807304, 'min_weight_fraction_leaf': 0.024927103694915652, 'max_features': 0.5349102478395179}. Best is trial 688 with value: 0.6612018755665507.[0m
[32m[I 2022-04-21 11:52:19,788][0m Trial 961 finished with value: 0.6208381633875275 and parameters: {'splitter': 'best', 'min_samples_split': 0.09048581630370449, 'min_samples_leaf': 0.009972596211569009, 'min_weight_fraction_leaf': 0.0002103537725450685, 'max_features': 0.5687031271677383}. Best is trial 688 with value: 0.6612018755665507.[0m
[32m[I 2022-04-21 11:52:20,334][0m Trial 962 finished with value: 0.6286072211937971 and parameters: {'splitter': 'best', 'min_samples_split': 0.1557650544463137, 'min_samples_leaf': 0.022039014085637288, 'min_weight_fraction_leaf': 0.01012058000684496, 'max_features': 0.48246791323387384}. Best is trial 688 with value: 0.6612018755665507.[0m
[32m[I 2022-04-21 11:52:20,682][0m Trial 963 finished with value: 0.6042855927682116 and parameters: {'splitter': 'best', 'min_samples_split': 0.14779637443881335, 'min_samples_leaf': 0.06385980429306881, 'min_weight_fraction_leaf': 0.02267063858743738, 'max_features': 0.5550468275008699}. Best is trial 688 with value: 0.6612018755665507.[0m
[32m[I 2022-04-21 11:52:21,469][0m Trial 964 finished with value: 0.6411307796487129 and parameters: {'splitter': 'best', 'min_samples_split': 0.09244064174332313, 'min_samples_leaf': 0.009283213387298983, 'min_weight_fraction_leaf': 0.014774890043905343, 'max_features': 0.6014127145005963}. Best is trial 688 with value: 0.6612018755665507.[0m
[32m[I 2022-04-21 11:52:21,864][0m Trial 965 finished with value: 0.6321113081582388 and parameters: {'splitter': 'best', 'min_samples_split': 0.13695372411692552, 'min_samples_leaf': 0.043827686420451595, 'min_weight_fraction_leaf': 0.034075963345550894, 'max_features': 0.542340343935505}. Best is trial 688 with value: 0.6612018755665507.[0m
