[32m[I 2022-04-21 16:11:32,743][0m Trial 110 finished with value: 0.842174688015413 and parameters: {'n_hidden': 1024, 'mixture_components': 4, 'use_sparse_layer': True, 'use_sparse_loss': False, 'use_batchnorm': False, 'use_dropout': False, 'mlp_size_1': 7, 'mlp_size_2': 0, 'mlp_size_3': 0, 'kernel': 'LogLogistic', 'loss_name': 'AlternativeNLLLoss'}. Best is trial 17 with value: 0.8538600001453517.[0m
[32m[I 2022-04-21 16:13:39,594][0m Trial 111 finished with value: 0.8483285138285293 and parameters: {'n_hidden': 1024, 'mixture_components': 3, 'use_sparse_layer': True, 'use_sparse_loss': False, 'use_batchnorm': False, 'use_dropout': False, 'mlp_size_1': 6, 'mlp_size_2': 1, 'mlp_size_3': 0, 'kernel': 'LogLogistic', 'loss_name': 'AlternativeNLLLoss'}. Best is trial 17 with value: 0.8538600001453517.[0m
[32m[I 2022-04-21 16:15:30,318][0m Trial 112 finished with value: 0.8489596497832503 and parameters: {'n_hidden': 1024, 'mixture_components': 3, 'use_sparse_layer': True, 'use_sparse_loss': False, 'use_batchnorm': False, 'use_dropout': False, 'mlp_size_1': 6, 'mlp_size_2': 1, 'mlp_size_3': 0, 'kernel': 'LogLogistic', 'loss_name': 'AlternativeNLLLoss'}. Best is trial 17 with value: 0.8538600001453517.[0m
[32m[I 2022-04-21 16:17:53,335][0m Trial 113 finished with value: 0.8404515094500526 and parameters: {'n_hidden': 1024, 'mixture_components': 3, 'use_sparse_layer': True, 'use_sparse_loss': False, 'use_batchnorm': False, 'use_dropout': False, 'mlp_size_1': 6, 'mlp_size_2': 1, 'mlp_size_3': 0, 'kernel': 'LogLogistic', 'loss_name': 'AlternativeNLLLoss'}. Best is trial 17 with value: 0.8538600001453517.[0m
[32m[I 2022-04-21 16:20:21,692][0m Trial 114 finished with value: 0.8434587445557107 and parameters: {'n_hidden': 1024, 'mixture_components': 3, 'use_sparse_layer': True, 'use_sparse_loss': False, 'use_batchnorm': False, 'use_dropout': False, 'mlp_size_1': 6, 'mlp_size_2': 1, 'mlp_size_3': 0, 'kernel': 'LogLogistic', 'loss_name': 'AlternativeNLLLoss'}. Best is trial 17 with value: 0.8538600001453517.[0m
[32m[I 2022-04-21 16:25:49,657][0m Trial 115 finished with value: 0.7313535211950672 and parameters: {'n_hidden': 1024, 'mixture_components': 3, 'use_sparse_layer': True, 'use_sparse_loss': False, 'use_batchnorm': True, 'use_dropout': False, 'mlp_size_1': 6, 'mlp_size_2': 1, 'mlp_size_3': 0, 'kernel': 'LogLogistic', 'loss_name': 'AlternativeNLLLoss'}. Best is trial 17 with value: 0.8538600001453517.[0m
[32m[I 2022-04-21 16:28:06,410][0m Trial 116 finished with value: 0.7515899764554821 and parameters: {'n_hidden': 1024, 'mixture_components': 2, 'use_sparse_layer': True, 'use_sparse_loss': False, 'use_batchnorm': False, 'use_dropout': False, 'mlp_size_1': 6, 'mlp_size_2': 1, 'mlp_size_3': 0, 'kernel': 'LogLogistic', 'loss_name': 'AlternativeNLLLoss'}. Best is trial 17 with value: 0.8538600001453517.[0m
[32m[I 2022-04-21 16:30:19,964][0m Trial 117 finished with value: 0.8338362727669135 and parameters: {'n_hidden': 1024, 'mixture_components': 4, 'use_sparse_layer': True, 'use_sparse_loss': False, 'use_batchnorm': False, 'use_dropout': False, 'mlp_size_1': 7, 'mlp_size_2': 0, 'mlp_size_3': 0, 'kernel': 'LogLogistic', 'loss_name': 'AlternativeNLLLoss'}. Best is trial 17 with value: 0.8538600001453517.[0m
[32m[I 2022-04-21 16:32:47,126][0m Trial 118 finished with value: 0.8242358381455961 and parameters: {'n_hidden': 1024, 'mixture_components': 2, 'use_sparse_layer': True, 'use_sparse_loss': False, 'use_batchnorm': False, 'use_dropout': False, 'mlp_size_1': 5, 'mlp_size_2': 1, 'mlp_size_3': 1, 'kernel': 'LogLogistic', 'loss_name': 'AlternativeNLLLoss'}. Best is trial 17 with value: 0.8538600001453517.[0m
[32m[I 2022-04-21 16:35:03,967][0m Trial 119 finished with value: 0.832643555014364 and parameters: {'n_hidden': 1024, 'mixture_components': 3, 'use_sparse_layer': True, 'use_sparse_loss': False, 'use_batchnorm': False, 'use_dropout': False, 'mlp_size_1': 6, 'mlp_size_2': 1, 'mlp_size_3': 0, 'kernel': 'Normal', 'loss_name': 'AlternativeNLLLoss'}. Best is trial 17 with value: 0.8538600001453517.[0m
[32m[I 2022-04-21 16:37:43,759][0m Trial 120 finished with value: 0.8374876227875097 and parameters: {'n_hidden': 1024, 'mixture_components': 4, 'use_sparse_layer': True, 'use_sparse_loss': False, 'use_batchnorm': False, 'use_dropout': False, 'mlp_size_1': 5, 'mlp_size_2': 1, 'mlp_size_3': 1, 'kernel': 'Logistic', 'loss_name': 'AlternativeNLLLoss'}. Best is trial 17 with value: 0.8538600001453517.[0m
[32m[I 2022-04-21 16:39:49,440][0m Trial 121 finished with value: 0.8402790512732178 and parameters: {'n_hidden': 1024, 'mixture_components': 3, 'use_sparse_layer': True, 'use_sparse_loss': False, 'use_batchnorm': False, 'use_dropout': False, 'mlp_size_1': 6, 'mlp_size_2': 1, 'mlp_size_3': 0, 'kernel': 'LogLogistic', 'loss_name': 'AlternativeNLLLoss'}. Best is trial 17 with value: 0.8538600001453517.[0m
[32m[I 2022-04-21 16:41:49,224][0m Trial 122 finished with value: 0.8105416795452027 and parameters: {'n_hidden': 1024, 'mixture_components': 4, 'use_sparse_layer': True, 'use_sparse_loss': False, 'use_batchnorm': False, 'use_dropout': False, 'mlp_size_1': 6, 'mlp_size_2': 1, 'mlp_size_3': 0, 'kernel': 'LogLogistic', 'loss_name': 'AlternativeNLLLoss'}. Best is trial 17 with value: 0.8538600001453517.[0m
[32m[I 2022-04-21 16:44:14,163][0m Trial 123 finished with value: 0.8422707021188686 and parameters: {'n_hidden': 128, 'mixture_components': 3, 'use_sparse_layer': True, 'use_sparse_loss': False, 'use_batchnorm': False, 'use_dropout': False, 'mlp_size_1': 4, 'mlp_size_2': 0, 'mlp_size_3': 0, 'kernel': 'LogLogistic', 'loss_name': 'AlternativeNLLLoss'}. Best is trial 17 with value: 0.8538600001453517.[0m
[32m[I 2022-04-21 16:46:46,605][0m Trial 124 finished with value: 0.8311002668163147 and parameters: {'n_hidden': 512, 'mixture_components': 4, 'use_sparse_layer': True, 'use_sparse_loss': False, 'use_batchnorm': False, 'use_dropout': False, 'mlp_size_1': 6, 'mlp_size_2': 0, 'mlp_size_3': 0, 'kernel': 'LogLogistic', 'loss_name': 'AlternativeNLLLoss'}. Best is trial 17 with value: 0.8538600001453517.[0m
[32m[I 2022-04-21 16:49:04,991][0m Trial 125 finished with value: 0.8234573618680635 and parameters: {'n_hidden': 2048, 'mixture_components': 3, 'use_sparse_layer': True, 'use_sparse_loss': False, 'use_batchnorm': False, 'use_dropout': False, 'mlp_size_1': 7, 'mlp_size_2': 1, 'mlp_size_3': 0, 'kernel': 'LogLogistic', 'loss_name': 'CensoredNLLLoss'}. Best is trial 17 with value: 0.8538600001453517.[0m
[32m[I 2022-04-21 16:51:43,661][0m Trial 126 finished with value: 0.844387347399282 and parameters: {'n_hidden': 512, 'mixture_components': 4, 'use_sparse_layer': True, 'use_sparse_loss': False, 'use_batchnorm': False, 'use_dropout': False, 'mlp_size_1': 5, 'mlp_size_2': 1, 'mlp_size_3': 0, 'kernel': 'Normal', 'loss_name': 'AlternativeNLLLoss'}. Best is trial 17 with value: 0.8538600001453517.[0m
2022-04-21 16:53:10.527418: W tensorflow/core/data/root_dataset.cc:200] Optimization loop failed: CANCELLED: Operation was cancelled
[32m[I 2022-04-21 16:54:25,623][0m Trial 127 finished with value: 0.6356415416481841 and parameters: {'n_hidden': 32, 'mixture_components': 3, 'use_sparse_layer': False, 'use_batchnorm': False, 'use_dropout': True, 'dropout': 0.36042379796360735, 'mlp_size_1': 2, 'mlp_size_2': 0, 'mlp_size_3': 0, 'kernel': 'LogLogistic', 'loss_name': 'AlternativeNLLLoss'}. Best is trial 17 with value: 0.8538600001453517.[0m
[32m[I 2022-04-21 16:56:09,339][0m Trial 128 finished with value: 0.841359567271186 and parameters: {'n_hidden': 1024, 'mixture_components': 2, 'use_sparse_layer': False, 'use_batchnorm': False, 'use_dropout': False, 'mlp_size_1': 6, 'mlp_size_2': 1, 'mlp_size_3': 0, 'kernel': 'Normal', 'loss_name': 'AlternativeNLLLoss'}. Best is trial 17 with value: 0.8538600001453517.[0m
[32m[I 2022-04-21 16:58:08,380][0m Trial 129 finished with value: 0.8425181760452423 and parameters: {'n_hidden': 512, 'mixture_components': 9, 'use_sparse_layer': False, 'use_batchnorm': False, 'use_dropout': False, 'mlp_size_1': 6, 'mlp_size_2': 0, 'mlp_size_3': 0, 'kernel': 'LogLogistic', 'loss_name': 'CensoredNLLLoss'}. Best is trial 17 with value: 0.8538600001453517.[0m
[32m[I 2022-04-21 17:03:20,154][0m Trial 130 finished with value: 0.6422068010454607 and parameters: {'n_hidden': 64, 'mixture_components': 4, 'use_sparse_layer': False, 'use_batchnorm': True, 'use_dropout': False, 'mlp_size_1': 3, 'mlp_size_2': 0, 'mlp_size_3': 0, 'kernel': 'Normal', 'loss_name': 'AlternativeNLLLoss'}. Best is trial 17 with value: 0.8538600001453517.[0m
[32m[I 2022-04-21 17:04:38,762][0m Trial 131 finished with value: -0.23582794063394683 and parameters: {'n_hidden': 512, 'mixture_components': 5, 'use_sparse_layer': False, 'use_batchnorm': False, 'use_dropout': False, 'mlp_size_1': 6, 'mlp_size_2': 0, 'mlp_size_3': 0, 'kernel': 'Exponential', 'loss_name': 'AlternativeNLLLoss'}. Best is trial 17 with value: 0.8538600001453517.[0m
[32m[I 2022-04-21 17:06:20,682][0m Trial 132 finished with value: 0.6424376494847959 and parameters: {'n_hidden': 512, 'mixture_components': 5, 'use_sparse_layer': False, 'use_batchnorm': False, 'use_dropout': False, 'mlp_size_1': 6, 'mlp_size_2': 0, 'mlp_size_3': 0, 'kernel': 'Gumbel', 'loss_name': 'AlternativeNLLLoss'}. Best is trial 17 with value: 0.8538600001453517.[0m
[32m[I 2022-04-21 17:08:17,484][0m Trial 133 finished with value: 0.8400152328664168 and parameters: {'n_hidden': 512, 'mixture_components': 5, 'use_sparse_layer': False, 'use_batchnorm': False, 'use_dropout': False, 'mlp_size_1': 6, 'mlp_size_2': 0, 'mlp_size_3': 0, 'kernel': 'LogLogistic', 'loss_name': 'CensoredNLLLoss'}. Best is trial 17 with value: 0.8538600001453517.[0m
[32m[I 2022-04-21 17:10:35,062][0m Trial 134 finished with value: 0.836967700423917 and parameters: {'n_hidden': 512, 'mixture_components': 10, 'use_sparse_layer': False, 'use_batchnorm': False, 'use_dropout': False, 'mlp_size_1': 5, 'mlp_size_2': 1, 'mlp_size_3': 0, 'kernel': 'Normal', 'loss_name': 'AlternativeNLLLoss'}. Best is trial 17 with value: 0.8538600001453517.[0m
[32m[I 2022-04-21 17:12:58,381][0m Trial 135 finished with value: 0.8403627058099872 and parameters: {'n_hidden': 512, 'mixture_components': 5, 'use_sparse_layer': False, 'use_batchnorm': False, 'use_dropout': False, 'mlp_size_1': 6, 'mlp_size_2': 0, 'mlp_size_3': 0, 'kernel': 'LogLogistic', 'loss_name': 'AlternativeNLLLoss'}. Best is trial 17 with value: 0.8538600001453517.[0m
[32m[I 2022-04-21 17:15:28,058][0m Trial 136 finished with value: 0.839588751247376 and parameters: {'n_hidden': 512, 'mixture_components': 4, 'use_sparse_layer': False, 'use_batchnorm': False, 'use_dropout': False, 'mlp_size_1': 5, 'mlp_size_2': 1, 'mlp_size_3': 0, 'kernel': 'Normal', 'loss_name': 'AlternativeNLLLoss'}. Best is trial 17 with value: 0.8538600001453517.[0m
[32m[I 2022-04-21 17:17:35,123][0m Trial 137 finished with value: 0.8474919713762207 and parameters: {'n_hidden': 512, 'mixture_components': 6, 'use_sparse_layer': False, 'use_batchnorm': False, 'use_dropout': False, 'mlp_size_1': 6, 'mlp_size_2': 0, 'mlp_size_3': 0, 'kernel': 'LogLogistic', 'loss_name': 'NLLLoss'}. Best is trial 17 with value: 0.8538600001453517.[0m
[32m[I 2022-04-21 17:20:36,746][0m Trial 138 finished with value: 0.8414342253683715 and parameters: {'n_hidden': 512, 'mixture_components': 6, 'use_sparse_layer': True, 'use_sparse_loss': False, 'use_batchnorm': False, 'use_dropout': False, 'mlp_size_1': 6, 'mlp_size_2': 0, 'mlp_size_3': 0, 'kernel': 'LogLogistic', 'loss_name': 'CensoredNLLLoss'}. Best is trial 17 with value: 0.8538600001453517.[0m
[32m[I 2022-04-21 17:22:42,237][0m Trial 139 finished with value: 0.8442687109580247 and parameters: {'n_hidden': 1024, 'mixture_components': 6, 'use_sparse_layer': False, 'use_batchnorm': False, 'use_dropout': False, 'mlp_size_1': 5, 'mlp_size_2': 2, 'mlp_size_3': 0, 'kernel': 'LogLogistic', 'loss_name': 'AlternativeNLLLoss'}. Best is trial 17 with value: 0.8538600001453517.[0m
[32m[I 2022-04-21 17:24:22,930][0m Trial 140 finished with value: 0.8347612797210149 and parameters: {'n_hidden': 512, 'mixture_components': 3, 'use_sparse_layer': False, 'use_batchnorm': False, 'use_dropout': False, 'mlp_size_1': 6, 'mlp_size_2': 0, 'mlp_size_3': 0, 'kernel': 'LogLogistic', 'loss_name': 'NLLLoss'}. Best is trial 17 with value: 0.8538600001453517.[0m
[32m[I 2022-04-21 17:26:05,696][0m Trial 141 finished with value: 0.8418164522927295 and parameters: {'n_hidden': 512, 'mixture_components': 6, 'use_sparse_layer': False, 'use_batchnorm': False, 'use_dropout': False, 'mlp_size_1': 6, 'mlp_size_2': 0, 'mlp_size_3': 0, 'kernel': 'LogLogistic', 'loss_name': 'NLLLoss'}. Best is trial 17 with value: 0.8538600001453517.[0m
[32m[I 2022-04-21 17:27:29,883][0m Trial 142 finished with value: 0.8397514069274378 and parameters: {'n_hidden': 512, 'mixture_components': 7, 'use_sparse_layer': False, 'use_batchnorm': False, 'use_dropout': False, 'mlp_size_1': 6, 'mlp_size_2': 0, 'mlp_size_3': 0, 'kernel': 'Exponential', 'loss_name': 'NLLLoss'}. Best is trial 17 with value: 0.8538600001453517.[0m
[32m[I 2022-04-21 17:29:12,546][0m Trial 143 finished with value: 0.8407936378493351 and parameters: {'n_hidden': 512, 'mixture_components': 5, 'use_sparse_layer': False, 'use_batchnorm': False, 'use_dropout': False, 'mlp_size_1': 6, 'mlp_size_2': 0, 'mlp_size_3': 0, 'kernel': 'LogLogistic', 'loss_name': 'NLLLoss'}. Best is trial 17 with value: 0.8538600001453517.[0m
[32m[I 2022-04-21 17:31:24,560][0m Trial 144 finished with value: 0.8451626995938547 and parameters: {'n_hidden': 512, 'mixture_components': 3, 'use_sparse_layer': False, 'use_batchnorm': False, 'use_dropout': False, 'mlp_size_1': 6, 'mlp_size_2': 0, 'mlp_size_3': 0, 'kernel': 'Logistic', 'loss_name': 'NLLLoss'}. Best is trial 17 with value: 0.8538600001453517.[0m
[32m[I 2022-04-21 17:33:23,527][0m Trial 145 finished with value: 0.840733177034705 and parameters: {'n_hidden': 512, 'mixture_components': 4, 'use_sparse_layer': False, 'use_batchnorm': False, 'use_dropout': False, 'mlp_size_1': 5, 'mlp_size_2': 1, 'mlp_size_3': 0, 'kernel': 'Normal', 'loss_name': 'NLLLoss'}. Best is trial 17 with value: 0.8538600001453517.[0m
[32m[I 2022-04-21 17:36:00,687][0m Trial 146 finished with value: 0.8414801969607458 and parameters: {'n_hidden': 512, 'mixture_components': 5, 'use_sparse_layer': False, 'use_batchnorm': False, 'use_dropout': False, 'mlp_size_1': 6, 'mlp_size_2': 0, 'mlp_size_3': 0, 'kernel': 'LogLogistic', 'loss_name': 'AlternativeNLLLoss'}. Best is trial 17 with value: 0.8538600001453517.[0m
[32m[I 2022-04-21 17:38:01,546][0m Trial 147 finished with value: 0.8343778613361756 and parameters: {'n_hidden': 1024, 'mixture_components': 6, 'use_sparse_layer': False, 'use_batchnorm': False, 'use_dropout': False, 'mlp_size_1': 7, 'mlp_size_2': 0, 'mlp_size_3': 0, 'kernel': 'LogLogistic', 'loss_name': 'AlternativeNLLLoss'}. Best is trial 17 with value: 0.8538600001453517.[0m
[32m[I 2022-04-21 17:41:27,545][0m Trial 148 finished with value: 0.8416817165456492 and parameters: {'n_hidden': 512, 'mixture_components': 4, 'use_sparse_layer': False, 'use_batchnorm': False, 'use_dropout': True, 'dropout': 0.18316479826214893, 'mlp_size_1': 6, 'mlp_size_2': 0, 'mlp_size_3': 0, 'kernel': 'Normal', 'loss_name': 'CensoredNLLLoss'}. Best is trial 17 with value: 0.8538600001453517.[0m
[32m[I 2022-04-21 17:44:05,416][0m Trial 149 finished with value: 0.8233857893923069 and parameters: {'n_hidden': 128, 'mixture_components': 3, 'use_sparse_layer': True, 'use_sparse_loss': True, 'lmbd': 0.07297628204718623, 'use_batchnorm': False, 'use_dropout': False, 'mlp_size_1': 4, 'mlp_size_2': 0, 'mlp_size_3': 0, 'kernel': 'LogLogistic', 'loss_name': 'AlternativeNLLLoss'}. Best is trial 17 with value: 0.8538600001453517.[0m
[32m[I 2022-04-21 17:46:21,041][0m Trial 150 finished with value: 0.8480899774632054 and parameters: {'n_hidden': 2048, 'mixture_components': 5, 'use_sparse_layer': False, 'use_batchnorm': False, 'use_dropout': False, 'mlp_size_1': 7, 'mlp_size_2': 1, 'mlp_size_3': 0, 'kernel': 'Normal', 'loss_name': 'NLLLoss'}. Best is trial 17 with value: 0.8538600001453517.[0m
[32m[I 2022-04-21 17:48:26,673][0m Trial 151 finished with value: 0.8426543245687904 and parameters: {'n_hidden': 2048, 'mixture_components': 5, 'use_sparse_layer': False, 'use_batchnorm': False, 'use_dropout': False, 'mlp_size_1': 7, 'mlp_size_2': 1, 'mlp_size_3': 0, 'kernel': 'Normal', 'loss_name': 'NLLLoss'}. Best is trial 17 with value: 0.8538600001453517.[0m
[32m[I 2022-04-21 17:50:22,632][0m Trial 152 finished with value: 0.8454893761157225 and parameters: {'n_hidden': 2048, 'mixture_components': 5, 'use_sparse_layer': False, 'use_batchnorm': False, 'use_dropout': False, 'mlp_size_1': 7, 'mlp_size_2': 1, 'mlp_size_3': 0, 'kernel': 'Normal', 'loss_name': 'NLLLoss'}. Best is trial 17 with value: 0.8538600001453517.[0m
[32m[I 2022-04-21 17:52:52,508][0m Trial 153 finished with value: 0.8461985166829784 and parameters: {'n_hidden': 2048, 'mixture_components': 5, 'use_sparse_layer': False, 'use_batchnorm': False, 'use_dropout': False, 'mlp_size_1': 8, 'mlp_size_2': 0, 'mlp_size_3': 0, 'kernel': 'Normal', 'loss_name': 'NLLLoss'}. Best is trial 17 with value: 0.8538600001453517.[0m
[32m[I 2022-04-21 17:54:59,079][0m Trial 154 finished with value: 0.8405128318536889 and parameters: {'n_hidden': 2048, 'mixture_components': 5, 'use_sparse_layer': False, 'use_batchnorm': False, 'use_dropout': False, 'mlp_size_1': 8, 'mlp_size_2': 0, 'mlp_size_3': 0, 'kernel': 'Normal', 'loss_name': 'NLLLoss'}. Best is trial 17 with value: 0.8538600001453517.[0m
[32m[I 2022-04-21 17:56:47,625][0m Trial 155 finished with value: 0.8453949175494533 and parameters: {'n_hidden': 2048, 'mixture_components': 6, 'use_sparse_layer': False, 'use_batchnorm': False, 'use_dropout': False, 'mlp_size_1': 7, 'mlp_size_2': 1, 'mlp_size_3': 0, 'kernel': 'Normal', 'loss_name': 'NLLLoss'}. Best is trial 17 with value: 0.8538600001453517.[0m
[32m[I 2022-04-21 18:00:03,277][0m Trial 156 finished with value: 0.7342559687803293 and parameters: {'n_hidden': 2048, 'mixture_components': 4, 'use_sparse_layer': False, 'use_batchnorm': False, 'use_dropout': False, 'mlp_size_1': 8, 'mlp_size_2': 0, 'mlp_size_3': 0, 'kernel': 'Normal', 'loss_name': 'NLLLoss'}. Best is trial 17 with value: 0.8538600001453517.[0m
[32m[I 2022-04-21 18:04:07,216][0m Trial 157 finished with value: 0.38858714609964295 and parameters: {'n_hidden': 2048, 'mixture_components': 8, 'use_sparse_layer': False, 'use_batchnorm': True, 'use_dropout': False, 'mlp_size_1': 8, 'mlp_size_2': 0, 'mlp_size_3': 0, 'kernel': 'Normal', 'loss_name': 'NLLLoss'}. Best is trial 17 with value: 0.8538600001453517.[0m
[32m[I 2022-04-21 18:06:03,182][0m Trial 158 finished with value: 0.8455666622793723 and parameters: {'n_hidden': 2048, 'mixture_components': 5, 'use_sparse_layer': False, 'use_batchnorm': False, 'use_dropout': False, 'mlp_size_1': 7, 'mlp_size_2': 1, 'mlp_size_3': 0, 'kernel': 'Normal', 'loss_name': 'NLLLoss'}. Best is trial 17 with value: 0.8538600001453517.[0m
[32m[I 2022-04-21 18:08:38,101][0m Trial 159 finished with value: 0.839891536865716 and parameters: {'n_hidden': 2048, 'mixture_components': 3, 'use_sparse_layer': True, 'use_sparse_loss': False, 'use_batchnorm': False, 'use_dropout': False, 'mlp_size_1': 8, 'mlp_size_2': 0, 'mlp_size_3': 0, 'kernel': 'Normal', 'loss_name': 'NLLLoss'}. Best is trial 17 with value: 0.8538600001453517.[0m
[32m[I 2022-04-21 18:10:23,332][0m Trial 160 finished with value: 0.8454859285567456 and parameters: {'n_hidden': 2048, 'mixture_components': 9, 'use_sparse_layer': False, 'use_batchnorm': False, 'use_dropout': False, 'mlp_size_1': 8, 'mlp_size_2': 0, 'mlp_size_3': 0, 'kernel': 'Normal', 'loss_name': 'NLLLoss'}. Best is trial 17 with value: 0.8538600001453517.[0m
[32m[I 2022-04-21 18:12:36,865][0m Trial 161 finished with value: 0.8428648016320534 and parameters: {'n_hidden': 2048, 'mixture_components': 5, 'use_sparse_layer': False, 'use_batchnorm': False, 'use_dropout': False, 'mlp_size_1': 7, 'mlp_size_2': 1, 'mlp_size_3': 0, 'kernel': 'Normal', 'loss_name': 'NLLLoss'}. Best is trial 17 with value: 0.8538600001453517.[0m
[32m[I 2022-04-21 18:14:45,120][0m Trial 162 finished with value: 0.8411105548818993 and parameters: {'n_hidden': 2048, 'mixture_components': 5, 'use_sparse_layer': False, 'use_batchnorm': False, 'use_dropout': False, 'mlp_size_1': 7, 'mlp_size_2': 1, 'mlp_size_3': 0, 'kernel': 'Normal', 'loss_name': 'NLLLoss'}. Best is trial 17 with value: 0.8538600001453517.[0m
[32m[I 2022-04-21 18:16:36,900][0m Trial 163 finished with value: 0.8390013961355625 and parameters: {'n_hidden': 2048, 'mixture_components': 5, 'use_sparse_layer': False, 'use_batchnorm': False, 'use_dropout': False, 'mlp_size_1': 7, 'mlp_size_2': 1, 'mlp_size_3': 0, 'kernel': 'Normal', 'loss_name': 'NLLLoss'}. Best is trial 17 with value: 0.8538600001453517.[0m
[32m[I 2022-04-21 18:18:45,827][0m Trial 164 finished with value: 0.83448660686051 and parameters: {'n_hidden': 2048, 'mixture_components': 4, 'use_sparse_layer': False, 'use_batchnorm': False, 'use_dropout': False, 'mlp_size_1': 7, 'mlp_size_2': 1, 'mlp_size_3': 0, 'kernel': 'Normal', 'loss_name': 'NLLLoss'}. Best is trial 17 with value: 0.8538600001453517.[0m
[32m[I 2022-04-21 18:20:34,898][0m Trial 165 finished with value: 0.837825702622661 and parameters: {'n_hidden': 2048, 'mixture_components': 5, 'use_sparse_layer': False, 'use_batchnorm': False, 'use_dropout': False, 'mlp_size_1': 8, 'mlp_size_2': 0, 'mlp_size_3': 0, 'kernel': 'Normal', 'loss_name': 'NLLLoss'}. Best is trial 17 with value: 0.8538600001453517.[0m
