[32m[I 2022-04-22 00:23:50,578][0m Trial 620 finished with value: 0.5 and parameters: {'loss': 'coxph', 'learning_rate': 2.8694336720982314e-05, 'n_estimators': 307, 'criterion': 'squared_error', 'min_samples_split': 10, 'min_samples_leaf': 10, 'min_weight_fraction_leaf': 0.20867393124832218, 'min_impurity_decrease': 0.08218922435491695, 'max_features': 0.8365514071106457, 'subsample': 0.2693180839504371, 'dropout_rate': 0.06297322974276043, 'ccp_alpha': 1.139563578283424}. Best is trial 187 with value: 0.6933481836305168.[0m
[32m[I 2022-04-22 00:24:03,267][0m Trial 621 finished with value: 0.6127568729131793 and parameters: {'loss': 'coxph', 'learning_rate': 3.7572162268046716e-05, 'n_estimators': 291, 'criterion': 'friedman_mse', 'min_samples_split': 7, 'min_samples_leaf': 10, 'min_weight_fraction_leaf': 0.22675518936990088, 'min_impurity_decrease': 0.035179824498825236, 'max_features': 0.9792498173173179, 'subsample': 0.30306974623267585, 'dropout_rate': 0.5503104349929369, 'ccp_alpha': 0.429548409691134}. Best is trial 187 with value: 0.6933481836305168.[0m
[32m[I 2022-04-22 00:24:28,602][0m Trial 622 finished with value: 0.6641121828103248 and parameters: {'loss': 'coxph', 'learning_rate': 8.524840497221467e-05, 'n_estimators': 315, 'criterion': 'squared_error', 'min_samples_split': 7, 'min_samples_leaf': 10, 'min_weight_fraction_leaf': 0.19421817364169827, 'min_impurity_decrease': 0.06915963515769064, 'max_features': 0.8831676295303726, 'subsample': 0.36602409021945825, 'dropout_rate': 0.000366210958278948, 'ccp_alpha': 0.2460600145265922}. Best is trial 187 with value: 0.6933481836305168.[0m
[32m[I 2022-04-22 00:24:42,107][0m Trial 623 finished with value: 0.6779391555677651 and parameters: {'loss': 'coxph', 'learning_rate': 4.977608979299334e-05, 'n_estimators': 281, 'criterion': 'squared_error', 'min_samples_split': 8, 'min_samples_leaf': 10, 'min_weight_fraction_leaf': 0.2179329214750499, 'min_impurity_decrease': 0.019399354378122142, 'max_features': 0.8161554924087864, 'subsample': 0.9580505086372891, 'dropout_rate': 0.43593274587994385, 'ccp_alpha': 0.002651298494158391}. Best is trial 187 with value: 0.6933481836305168.[0m
[32m[I 2022-04-22 00:24:49,326][0m Trial 624 finished with value: 0.6850225867415727 and parameters: {'loss': 'coxph', 'learning_rate': 7.051297170322307e-05, 'n_estimators': 298, 'criterion': 'squared_error', 'min_samples_split': 7, 'min_samples_leaf': 10, 'min_weight_fraction_leaf': 0.20564966125687975, 'min_impurity_decrease': 0.05274155466813945, 'max_features': 0.7839456140483567, 'subsample': 0.3245894099799205, 'dropout_rate': 0.7246521870875902, 'ccp_alpha': 0.14942611801674593}. Best is trial 187 with value: 0.6933481836305168.[0m
/media/san2_ssd/data/Workdir/survival/venv/lib/python3.8/site-packages/sksurv/ensemble/boosting.py:955: RuntimeWarning: divide by zero encountered in log
  time = numpy.log(time)
/media/san2_ssd/data/Workdir/survival/venv/lib/python3.8/site-packages/sksurv/ensemble/boosting.py:955: RuntimeWarning: divide by zero encountered in log
  time = numpy.log(time)
/media/san2_ssd/data/Workdir/survival/venv/lib/python3.8/site-packages/sksurv/ensemble/boosting.py:955: RuntimeWarning: divide by zero encountered in log
  time = numpy.log(time)
/media/san2_ssd/data/Workdir/survival/venv/lib/python3.8/site-packages/sksurv/ensemble/boosting.py:955: RuntimeWarning: divide by zero encountered in log
  time = numpy.log(time)
[32m[I 2022-04-22 00:24:52,292][0m Trial 625 finished with value: -0.7317286726923086 and parameters: {'loss': 'squared', 'learning_rate': 0.0001236077206276313, 'n_estimators': 266, 'criterion': 'squared_error', 'min_samples_split': 3, 'min_samples_leaf': 10, 'min_weight_fraction_leaf': 0.23901601681597995, 'min_impurity_decrease': 0.037160430449937186, 'max_features': 0.9595703206819481, 'subsample': 0.2822957555183536, 'dropout_rate': 0.0437554062002697, 'ccp_alpha': 0.09577984788851016}. Best is trial 187 with value: 0.6933481836305168.[0m
[32m[I 2022-04-22 00:25:16,649][0m Trial 626 finished with value: 0.6683937225371154 and parameters: {'loss': 'coxph', 'learning_rate': 4.221367644551214e-05, 'n_estimators': 336, 'criterion': 'squared_error', 'min_samples_split': 7, 'min_samples_leaf': 10, 'min_weight_fraction_leaf': 0.21905589276200682, 'min_impurity_decrease': 0.0747730473480742, 'max_features': 0.8639565616858809, 'subsample': 0.2625108949118761, 'dropout_rate': 0.07801069108105119, 'ccp_alpha': 0.24766538755733408}. Best is trial 187 with value: 0.6933481836305168.[0m
[32m[I 2022-04-22 00:25:31,084][0m Trial 627 finished with value: 0.6862167920040476 and parameters: {'loss': 'coxph', 'learning_rate': 6.184285804164617e-05, 'n_estimators': 368, 'criterion': 'squared_error', 'min_samples_split': 2, 'min_samples_leaf': 10, 'min_weight_fraction_leaf': 0.19410771657289708, 'min_impurity_decrease': 0.059175739061843015, 'max_features': 0.8444857827766775, 'subsample': 0.3026764697268205, 'dropout_rate': 0.578415885065598, 'ccp_alpha': 0.08698589843267474}. Best is trial 187 with value: 0.6933481836305168.[0m
[32m[I 2022-04-22 00:25:53,590][0m Trial 628 finished with value: 0.6876624416713343 and parameters: {'loss': 'coxph', 'learning_rate': 9.292564943009185e-05, 'n_estimators': 323, 'criterion': 'squared_error', 'min_samples_split': 7, 'min_samples_leaf': 10, 'min_weight_fraction_leaf': 0.22864196021406322, 'min_impurity_decrease': 0.0212322238696973, 'max_features': 0.9462896633635475, 'subsample': 0.3432276422928908, 'dropout_rate': 0.02285685961859324, 'ccp_alpha': 0.0011398008429832213}. Best is trial 187 with value: 0.6933481836305168.[0m
[32m[I 2022-04-22 00:26:20,551][0m Trial 629 finished with value: 0.6369153906745174 and parameters: {'loss': 'coxph', 'learning_rate': 3.1660958769595256e-05, 'n_estimators': 302, 'criterion': 'squared_error', 'min_samples_split': 7, 'min_samples_leaf': 10, 'min_weight_fraction_leaf': 0.2066787798017295, 'min_impurity_decrease': 0.045516595311469704, 'max_features': 0.7076080215662851, 'subsample': 0.2893601754044784, 'dropout_rate': 0.05653294846830062, 'ccp_alpha': 0.33745644080160236}. Best is trial 187 with value: 0.6933481836305168.[0m
[32m[I 2022-04-22 00:26:41,350][0m Trial 630 finished with value: 0.6750559228090333 and parameters: {'loss': 'coxph', 'learning_rate': 5.171528059079324e-05, 'n_estimators': 283, 'criterion': 'squared_error', 'min_samples_split': 7, 'min_samples_leaf': 10, 'min_weight_fraction_leaf': 0.2478339430540182, 'min_impurity_decrease': 0.0178662537771301, 'max_features': 0.9986479271074928, 'subsample': 0.3196599376407899, 'dropout_rate': 0.1037200157682445, 'ccp_alpha': 0.18475899936234944}. Best is trial 187 with value: 0.6933481836305168.[0m
[32m[I 2022-04-22 00:27:09,161][0m Trial 631 finished with value: 0.6860411584247655 and parameters: {'loss': 'coxph', 'learning_rate': 7.241073644086306e-05, 'n_estimators': 338, 'criterion': 'squared_error', 'min_samples_split': 7, 'min_samples_leaf': 10, 'min_weight_fraction_leaf': 0.19572096546149056, 'min_impurity_decrease': 0.0014790864869038238, 'max_features': 0.8825691159241799, 'subsample': 0.26126986943579594, 'dropout_rate': 0.08045398679080795, 'ccp_alpha': 0.07545963716309244}. Best is trial 187 with value: 0.6933481836305168.[0m
[32m[I 2022-04-22 00:27:38,187][0m Trial 632 finished with value: 0.5 and parameters: {'loss': 'coxph', 'learning_rate': 1.0573232391232131e-05, 'n_estimators': 315, 'criterion': 'squared_error', 'min_samples_split': 7, 'min_samples_leaf': 10, 'min_weight_fraction_leaf': 0.21590983364814514, 'min_impurity_decrease': 0.7022342781293911, 'max_features': 0.9737016934667342, 'subsample': 0.2984897551404417, 'dropout_rate': 0.11679326133618316, 'ccp_alpha': 0.25344868244046287}. Best is trial 187 with value: 0.6933481836305168.[0m
[32m[I 2022-04-22 00:27:52,168][0m Trial 633 finished with value: 0.6832040386562961 and parameters: {'loss': 'coxph', 'learning_rate': 0.00012088696568908625, 'n_estimators': 353, 'criterion': 'friedman_mse', 'min_samples_split': 7, 'min_samples_leaf': 10, 'min_weight_fraction_leaf': 0.19895684959645646, 'min_impurity_decrease': 0.07905022961157977, 'max_features': 0.8546376830629436, 'subsample': 0.38513021586412144, 'dropout_rate': 0.6568864393909721, 'ccp_alpha': 0.1792162837880606}. Best is trial 187 with value: 0.6933481836305168.[0m
[32m[I 2022-04-22 00:28:08,928][0m Trial 634 finished with value: 0.6888302665661074 and parameters: {'loss': 'coxph', 'learning_rate': 4.249160552936549e-05, 'n_estimators': 258, 'criterion': 'squared_error', 'min_samples_split': 7, 'min_samples_leaf': 10, 'min_weight_fraction_leaf': 0.22867328670174342, 'min_impurity_decrease': 0.0545031814867748, 'max_features': 0.8310959577496106, 'subsample': 0.350555808955343, 'dropout_rate': 0.0326300041148804, 'ccp_alpha': 0.08892455567677873}. Best is trial 187 with value: 0.6933481836305168.[0m
[32m[I 2022-04-22 00:28:28,784][0m Trial 635 finished with value: 0.6879892688330184 and parameters: {'loss': 'coxph', 'learning_rate': 2.6705899390803724e-05, 'n_estimators': 292, 'criterion': 'squared_error', 'min_samples_split': 7, 'min_samples_leaf': 10, 'min_weight_fraction_leaf': 0.18683151224342304, 'min_impurity_decrease': 0.03601234350218527, 'max_features': 0.9548077552548809, 'subsample': 0.27625855627086143, 'dropout_rate': 0.05180370753911659, 'ccp_alpha': 0.005249445443281403}. Best is trial 187 with value: 0.6933481836305168.[0m
[32m[I 2022-04-22 00:28:38,465][0m Trial 636 finished with value: 0.6660557321295059 and parameters: {'loss': 'coxph', 'learning_rate': 5.6597411361872504e-05, 'n_estimators': 271, 'criterion': 'squared_error', 'min_samples_split': 7, 'min_samples_leaf': 2, 'min_weight_fraction_leaf': 0.20986232608720534, 'min_impurity_decrease': 0.08147229610192865, 'max_features': 0.8986343967233539, 'subsample': 0.24762390241540538, 'dropout_rate': 0.594736815114079, 'ccp_alpha': 0.30483976017844105}. Best is trial 187 with value: 0.6933481836305168.[0m
[32m[I 2022-04-22 00:28:57,557][0m Trial 637 finished with value: 0.6880637415593812 and parameters: {'loss': 'coxph', 'learning_rate': 8.834881062099969e-05, 'n_estimators': 308, 'criterion': 'squared_error', 'min_samples_split': 7, 'min_samples_leaf': 10, 'min_weight_fraction_leaf': 0.2200535294635577, 'min_impurity_decrease': 0.021599549376959182, 'max_features': 0.7977308870924062, 'subsample': 0.3250019604635792, 'dropout_rate': 0.09126835004415447, 'ccp_alpha': 0.15882276886201435}. Best is trial 187 with value: 0.6933481836305168.[0m
[32m[I 2022-04-22 00:29:09,065][0m Trial 638 finished with value: 0.6449850903649714 and parameters: {'loss': 'coxph', 'learning_rate': 3.9787347238874505e-05, 'n_estimators': 330, 'criterion': 'squared_error', 'min_samples_split': 7, 'min_samples_leaf': 10, 'min_weight_fraction_leaf': 0.23598510246538046, 'min_impurity_decrease': 0.056931270383550406, 'max_features': 0.7678034503333134, 'subsample': 0.30257442622274133, 'dropout_rate': 0.6933395891069432, 'ccp_alpha': 0.37228039629851495}. Best is trial 187 with value: 0.6933481836305168.[0m
[32m[I 2022-04-22 00:29:27,051][0m Trial 639 finished with value: 0.6874910992310055 and parameters: {'loss': 'coxph', 'learning_rate': 0.01263378364991959, 'n_estimators': 371, 'criterion': 'squared_error', 'min_samples_split': 8, 'min_samples_leaf': 10, 'min_weight_fraction_leaf': 0.20276445418617284, 'min_impurity_decrease': 0.033850280020090426, 'max_features': 0.9295103407297569, 'subsample': 0.22917643986637376, 'dropout_rate': 0.6228897916937531, 'ccp_alpha': 0.08654844618477078}. Best is trial 187 with value: 0.6933481836305168.[0m
[32m[I 2022-04-22 00:29:50,134][0m Trial 640 finished with value: 0.5 and parameters: {'loss': 'coxph', 'learning_rate': 6.823494847780934e-05, 'n_estimators': 290, 'criterion': 'squared_error', 'min_samples_split': 7, 'min_samples_leaf': 10, 'min_weight_fraction_leaf': 0.1896600679669806, 'min_impurity_decrease': 0.066687140185222, 'max_features': 0.8686479665068174, 'subsample': 0.1332940217069165, 'dropout_rate': 0.06763810927156688, 'ccp_alpha': 0.2103994992292707}. Best is trial 187 with value: 0.6933481836305168.[0m
[32m[I 2022-04-22 00:30:29,457][0m Trial 641 finished with value: 0.6891168482252575 and parameters: {'loss': 'coxph', 'learning_rate': 9.844117293164198e-05, 'n_estimators': 355, 'criterion': 'squared_error', 'min_samples_split': 7, 'min_samples_leaf': 10, 'min_weight_fraction_leaf': 0.21094897166698656, 'min_impurity_decrease': 0.0010993184379633134, 'max_features': 0.8128083180201446, 'subsample': 0.339782095969588, 'dropout_rate': 0.032796933802896104, 'ccp_alpha': 0.09376122486591029}. Best is trial 187 with value: 0.6933481836305168.[0m
[32m[I 2022-04-22 00:31:04,924][0m Trial 642 finished with value: 0.686393796858021 and parameters: {'loss': 'coxph', 'learning_rate': 9.870894500045421e-05, 'n_estimators': 360, 'criterion': 'squared_error', 'min_samples_split': 7, 'min_samples_leaf': 10, 'min_weight_fraction_leaf': 0.1944847588777536, 'min_impurity_decrease': 0.003286497371832925, 'max_features': 0.9693379000470264, 'subsample': 0.2823651662005634, 'dropout_rate': 0.012368291221907735, 'ccp_alpha': 0.0024206289172252456}. Best is trial 187 with value: 0.6933481836305168.[0m
[32m[I 2022-04-22 00:31:39,690][0m Trial 643 finished with value: 0.6806615309593764 and parameters: {'loss': 'coxph', 'learning_rate': 0.0001273107818499262, 'n_estimators': 346, 'criterion': 'squared_error', 'min_samples_split': 7, 'min_samples_leaf': 10, 'min_weight_fraction_leaf': 0.1819472712998449, 'min_impurity_decrease': 0.03865258858214843, 'max_features': 0.8347137356836128, 'subsample': 0.3161514056730695, 'dropout_rate': 0.03501002300671599, 'ccp_alpha': 0.17243674027565098}. Best is trial 187 with value: 0.6933481836305168.[0m
/media/san2_ssd/data/Workdir/survival/venv/lib/python3.8/site-packages/sksurv/ensemble/boosting.py:955: RuntimeWarning: divide by zero encountered in log
  time = numpy.log(time)
/media/san2_ssd/data/Workdir/survival/venv/lib/python3.8/site-packages/sksurv/ensemble/boosting.py:955: RuntimeWarning: divide by zero encountered in log
  time = numpy.log(time)
/media/san2_ssd/data/Workdir/survival/venv/lib/python3.8/site-packages/sksurv/ensemble/boosting.py:955: RuntimeWarning: divide by zero encountered in log
  time = numpy.log(time)
/media/san2_ssd/data/Workdir/survival/venv/lib/python3.8/site-packages/sksurv/ensemble/boosting.py:955: RuntimeWarning: divide by zero encountered in log
  time = numpy.log(time)
[32m[I 2022-04-22 00:31:47,115][0m Trial 644 finished with value: -0.7309394300370865 and parameters: {'loss': 'squared', 'learning_rate': 0.0001103846937212999, 'n_estimators': 387, 'criterion': 'friedman_mse', 'min_samples_split': 7, 'min_samples_leaf': 10, 'min_weight_fraction_leaf': 0.14244332956480066, 'min_impurity_decrease': 0.01675594555173171, 'max_features': 0.850572678457219, 'subsample': 0.25611181467336336, 'dropout_rate': 0.028844459056277118, 'ccp_alpha': 0.30297643125888946}. Best is trial 187 with value: 0.6933481836305168.[0m
[32m[I 2022-04-22 00:32:27,361][0m Trial 645 finished with value: 0.5217151934164563 and parameters: {'loss': 'coxph', 'learning_rate': 0.0001327719287871581, 'n_estimators': 364, 'criterion': 'squared_error', 'min_samples_split': 7, 'min_samples_leaf': 10, 'min_weight_fraction_leaf': 0.20589059764317508, 'min_impurity_decrease': 0.08096014508131964, 'max_features': 0.896580372875774, 'subsample': 0.3332875691680305, 'dropout_rate': 0.051189791495534376, 'ccp_alpha': 0.5080169581472791}. Best is trial 187 with value: 0.6933481836305168.[0m
[32m[I 2022-04-22 00:33:04,664][0m Trial 646 finished with value: 0.5 and parameters: {'loss': 'coxph', 'learning_rate': 8.10211201961123e-05, 'n_estimators': 381, 'criterion': 'squared_error', 'min_samples_split': 6, 'min_samples_leaf': 8, 'min_weight_fraction_leaf': 0.22345562408849123, 'min_impurity_decrease': 0.0016637637089205598, 'max_features': 0.9493756278122751, 'subsample': 0.29295848875896063, 'dropout_rate': 0.01729669547753613, 'ccp_alpha': 2.1537419581389363}. Best is trial 187 with value: 0.6933481836305168.[0m
[32m[I 2022-04-22 00:33:32,739][0m Trial 647 finished with value: 0.5439002734246218 and parameters: {'loss': 'coxph', 'learning_rate': 9.577272858186189e-05, 'n_estimators': 344, 'criterion': 'squared_error', 'min_samples_split': 7, 'min_samples_leaf': 10, 'min_weight_fraction_leaf': 0.15896348928118886, 'min_impurity_decrease': 0.5612708244663482, 'max_features': 0.8812349797009169, 'subsample': 0.2748243075141273, 'dropout_rate': 0.06582429917008682, 'ccp_alpha': 0.15723077113585007}. Best is trial 187 with value: 0.6933481836305168.[0m
[32m[I 2022-04-22 00:34:00,484][0m Trial 648 finished with value: 0.6872041822161249 and parameters: {'loss': 'coxph', 'learning_rate': 8.157504164973655e-05, 'n_estimators': 357, 'criterion': 'squared_error', 'min_samples_split': 7, 'min_samples_leaf': 5, 'min_weight_fraction_leaf': 0.1983125520656741, 'min_impurity_decrease': 0.048982624743682514, 'max_features': 0.9828174416223148, 'subsample': 0.3117428630207929, 'dropout_rate': 0.03983192951012047, 'ccp_alpha': 0.08907560214411964}. Best is trial 187 with value: 0.6933481836305168.[0m
[32m[I 2022-04-22 00:34:30,548][0m Trial 649 finished with value: 0.6683937225371154 and parameters: {'loss': 'coxph', 'learning_rate': 0.00011389414315118175, 'n_estimators': 331, 'criterion': 'squared_error', 'min_samples_split': 7, 'min_samples_leaf': 10, 'min_weight_fraction_leaf': 0.23349514310785197, 'min_impurity_decrease': 0.032042045968511276, 'max_features': 0.9295565959917039, 'subsample': 0.2614098785687529, 'dropout_rate': 0.08932267005868454, 'ccp_alpha': 0.250069917837079}. Best is trial 187 with value: 0.6933481836305168.[0m
[32m[I 2022-04-22 00:35:07,141][0m Trial 650 finished with value: 0.5 and parameters: {'loss': 'coxph', 'learning_rate': 6.82778702144938e-05, 'n_estimators': 378, 'criterion': 'squared_error', 'min_samples_split': 7, 'min_samples_leaf': 10, 'min_weight_fraction_leaf': 0.18825101056483998, 'min_impurity_decrease': 0.7761551605075339, 'max_features': 0.8206437677494988, 'subsample': 0.2278340607864903, 'dropout_rate': 0.0022764165499104053, 'ccp_alpha': 0.09549654904227069}. Best is trial 187 with value: 0.6933481836305168.[0m
[32m[I 2022-04-22 00:35:39,440][0m Trial 651 finished with value: 0.5961286941933776 and parameters: {'loss': 'coxph', 'learning_rate': 0.0001531512899006159, 'n_estimators': 338, 'criterion': 'squared_error', 'min_samples_split': 8, 'min_samples_leaf': 10, 'min_weight_fraction_leaf': 0.214613313770406, 'min_impurity_decrease': 0.06292693587603732, 'max_features': 0.2587291199063536, 'subsample': 0.2864525036512123, 'dropout_rate': 0.04804601896260922, 'ccp_alpha': 0.4245755974152874}. Best is trial 187 with value: 0.6933481836305168.[0m
[32m[I 2022-04-22 00:36:00,814][0m Trial 652 finished with value: 0.6878519650346007 and parameters: {'loss': 'coxph', 'learning_rate': 1.8235206399940485e-05, 'n_estimators': 324, 'criterion': 'squared_error', 'min_samples_split': 7, 'min_samples_leaf': 10, 'min_weight_fraction_leaf': 0.17047892522220165, 'min_impurity_decrease': 0.0449748329125169, 'max_features': 0.8635436435266992, 'subsample': 0.308781809202743, 'dropout_rate': 0.07201875494815531, 'ccp_alpha': 0.007080353183087488}. Best is trial 187 with value: 0.6933481836305168.[0m
[32m[I 2022-04-22 00:36:37,238][0m Trial 653 finished with value: 0.6683937225371154 and parameters: {'loss': 'coxph', 'learning_rate': 0.00010289149387933385, 'n_estimators': 361, 'criterion': 'squared_error', 'min_samples_split': 7, 'min_samples_leaf': 9, 'min_weight_fraction_leaf': 0.24758823734627805, 'min_impurity_decrease': 0.08507836077058939, 'max_features': 0.9196249497662621, 'subsample': 0.3359170941360711, 'dropout_rate': 0.022836169482184032, 'ccp_alpha': 0.2260712869227382}. Best is trial 187 with value: 0.6933481836305168.[0m
[32m[I 2022-04-22 00:36:59,803][0m Trial 654 finished with value: 0.6872491111876486 and parameters: {'loss': 'coxph', 'learning_rate': 6.406701396550454e-05, 'n_estimators': 315, 'criterion': 'squared_error', 'min_samples_split': 7, 'min_samples_leaf': 10, 'min_weight_fraction_leaf': 0.20678795347115425, 'min_impurity_decrease': 0.02100599070859615, 'max_features': 0.9572002601997881, 'subsample': 0.24888280319319656, 'dropout_rate': 0.12465112482286633, 'ccp_alpha': 0.15800156700965767}. Best is trial 187 with value: 0.6933481836305168.[0m
[32m[I 2022-04-22 00:37:39,778][0m Trial 655 finished with value: 0.687812264039604 and parameters: {'loss': 'coxph', 'learning_rate': 0.00013900814138002854, 'n_estimators': 392, 'criterion': 'squared_error', 'min_samples_split': 7, 'min_samples_leaf': 10, 'min_weight_fraction_leaf': 0.2206670625762649, 'min_impurity_decrease': 0.06274312358809198, 'max_features': 0.8904502591273948, 'subsample': 0.36305829338733053, 'dropout_rate': 0.06105649848740671, 'ccp_alpha': 0.0024317401343282585}. Best is trial 187 with value: 0.6933481836305168.[0m
[32m[I 2022-04-22 00:38:06,394][0m Trial 656 finished with value: 0.658544368467207 and parameters: {'loss': 'coxph', 'learning_rate': 2.450132122245129e-05, 'n_estimators': 343, 'criterion': 'friedman_mse', 'min_samples_split': 7, 'min_samples_leaf': 10, 'min_weight_fraction_leaf': 0.2290497111857188, 'min_impurity_decrease': 0.019382579672844465, 'max_features': 0.8423670404435867, 'subsample': 0.29345843795190507, 'dropout_rate': 0.09837046977456437, 'ccp_alpha': 0.33914865836586866}. Best is trial 187 with value: 0.6933481836305168.[0m
