[32m[I 2022-04-21 11:38:25,108][0m Trial 568 finished with value: 0.8318869790887286 and parameters: {'splitter': 'best', 'min_samples_split': 0.1345106693088053, 'min_samples_leaf': 0.026753634907971023, 'min_weight_fraction_leaf': 0.07682807214065863, 'max_features': 0.668451131760304}. Best is trial 499 with value: 0.8396174698878165.[0m
[32m[I 2022-04-21 11:38:25,160][0m Trial 569 finished with value: 0.8372245618281238 and parameters: {'splitter': 'best', 'min_samples_split': 0.0786335582421944, 'min_samples_leaf': 0.037002727304203606, 'min_weight_fraction_leaf': 0.051771381946484646, 'max_features': 0.6440182541234872}. Best is trial 499 with value: 0.8396174698878165.[0m
[32m[I 2022-04-21 11:38:25,211][0m Trial 570 finished with value: 0.8180388147131256 and parameters: {'splitter': 'best', 'min_samples_split': 0.10085369206532657, 'min_samples_leaf': 0.021948670877650196, 'min_weight_fraction_leaf': 0.11266301079758775, 'max_features': 0.5935643315023461}. Best is trial 499 with value: 0.8396174698878165.[0m
[32m[I 2022-04-21 11:38:25,264][0m Trial 571 finished with value: 0.8292464992419608 and parameters: {'splitter': 'random', 'min_samples_split': 0.12259277174478954, 'min_samples_leaf': 0.02348327062704865, 'min_weight_fraction_leaf': 0.056648932334345495, 'max_features': 0.6763510300282612}. Best is trial 499 with value: 0.8396174698878165.[0m
[32m[I 2022-04-21 11:38:25,378][0m Trial 572 finished with value: 0.8391063129816301 and parameters: {'splitter': 'best', 'min_samples_split': 0.10832634495090664, 'min_samples_leaf': 0.0349047609172709, 'min_weight_fraction_leaf': 0.04479571774599786, 'max_features': 0.6235473027996348}. Best is trial 499 with value: 0.8396174698878165.[0m
[32m[I 2022-04-21 11:38:25,478][0m Trial 573 finished with value: 0.8391063129816301 and parameters: {'splitter': 'best', 'min_samples_split': 0.10805136915668334, 'min_samples_leaf': 0.03712125806733825, 'min_weight_fraction_leaf': 0.0427410789668193, 'max_features': 0.6205050381526772}. Best is trial 499 with value: 0.8396174698878165.[0m
[32m[I 2022-04-21 11:38:25,557][0m Trial 574 finished with value: 0.8391063129816301 and parameters: {'splitter': 'best', 'min_samples_split': 0.10709368305164735, 'min_samples_leaf': 0.03911406435939335, 'min_weight_fraction_leaf': 0.04469379630556826, 'max_features': 0.609928168918513}. Best is trial 499 with value: 0.8396174698878165.[0m
[32m[I 2022-04-21 11:38:25,608][0m Trial 575 finished with value: 0.65 and parameters: {'splitter': 'best', 'min_samples_split': 0.11190100721062715, 'min_samples_leaf': 0.04050783384974175, 'min_weight_fraction_leaf': 0.39649020293874315, 'max_features': 0.6163638016154421}. Best is trial 499 with value: 0.8396174698878165.[0m
[32m[I 2022-04-21 11:38:25,658][0m Trial 576 finished with value: 0.8352402471455868 and parameters: {'splitter': 'best', 'min_samples_split': 0.10433051901018134, 'min_samples_leaf': 0.03696928743453479, 'min_weight_fraction_leaf': 0.03871161020105692, 'max_features': 0.6283821914936203}. Best is trial 499 with value: 0.8396174698878165.[0m
[32m[I 2022-04-21 11:38:25,710][0m Trial 577 finished with value: 0.8352402471455868 and parameters: {'splitter': 'best', 'min_samples_split': 0.10614390695025286, 'min_samples_leaf': 0.03439460856582471, 'min_weight_fraction_leaf': 0.04056755741297862, 'max_features': 0.6024834896052835}. Best is trial 499 with value: 0.8396174698878165.[0m
[32m[I 2022-04-21 11:38:25,775][0m Trial 578 finished with value: 0.8372245618281238 and parameters: {'splitter': 'best', 'min_samples_split': 0.08807347374046898, 'min_samples_leaf': 0.038733179601384754, 'min_weight_fraction_leaf': 0.05294410031188049, 'max_features': 0.6428279090846305}. Best is trial 499 with value: 0.8396174698878165.[0m
[32m[I 2022-04-21 11:38:25,829][0m Trial 579 finished with value: 0.8340130635607796 and parameters: {'splitter': 'best', 'min_samples_split': 0.1179576370919681, 'min_samples_leaf': 0.0301952944822134, 'min_weight_fraction_leaf': 0.06232823428905803, 'max_features': 0.6519246284704915}. Best is trial 499 with value: 0.8396174698878165.[0m
[32m[I 2022-04-21 11:38:25,880][0m Trial 580 finished with value: 0.8318450474400789 and parameters: {'splitter': 'best', 'min_samples_split': 0.12435345877114781, 'min_samples_leaf': 0.028091622198784666, 'min_weight_fraction_leaf': 0.25702392901383225, 'max_features': 0.6161889085010084}. Best is trial 499 with value: 0.8396174698878165.[0m
[32m[I 2022-04-21 11:38:25,937][0m Trial 581 finished with value: 0.8355314144660066 and parameters: {'splitter': 'best', 'min_samples_split': 0.09166028356148553, 'min_samples_leaf': 0.031266149953070255, 'min_weight_fraction_leaf': 0.04095976955486777, 'max_features': 0.626758063193453}. Best is trial 499 with value: 0.8396174698878165.[0m
[32m[I 2022-04-21 11:38:25,986][0m Trial 582 finished with value: 0.65 and parameters: {'splitter': 'best', 'min_samples_split': 0.10137180227520087, 'min_samples_leaf': 0.0398245490439025, 'min_weight_fraction_leaf': 0.17069614563297955, 'max_features': 0.5683139175859144}. Best is trial 499 with value: 0.8396174698878165.[0m
[32m[I 2022-04-21 11:38:26,035][0m Trial 583 finished with value: 0.8304703316230533 and parameters: {'splitter': 'best', 'min_samples_split': 0.11052232839418968, 'min_samples_leaf': 0.04168071122721277, 'min_weight_fraction_leaf': 0.05212231365025216, 'max_features': 0.5899464598003308}. Best is trial 499 with value: 0.8396174698878165.[0m
[32m[I 2022-04-21 11:38:26,087][0m Trial 584 finished with value: 0.8364893173845183 and parameters: {'splitter': 'best', 'min_samples_split': 0.13668922920217347, 'min_samples_leaf': 0.02319504841623826, 'min_weight_fraction_leaf': 0.03452184192592951, 'max_features': 0.6581932534755351}. Best is trial 499 with value: 0.8396174698878165.[0m
[32m[I 2022-04-21 11:38:26,137][0m Trial 585 finished with value: 0.8333498191213747 and parameters: {'splitter': 'best', 'min_samples_split': 0.1218333205206841, 'min_samples_leaf': 0.021244772916753647, 'min_weight_fraction_leaf': 0.06776640802395632, 'max_features': 0.6348147541077369}. Best is trial 499 with value: 0.8396174698878165.[0m
[32m[I 2022-04-21 11:38:26,191][0m Trial 586 finished with value: 0.8391063129816301 and parameters: {'splitter': 'best', 'min_samples_split': 0.09544665543890618, 'min_samples_leaf': 0.040749107497383245, 'min_weight_fraction_leaf': 0.04808079402529133, 'max_features': 0.6789074465929188}. Best is trial 499 with value: 0.8396174698878165.[0m
[32m[I 2022-04-21 11:38:26,404][0m Trial 587 finished with value: 0.8340130635607796 and parameters: {'splitter': 'best', 'min_samples_split': 0.08191456863196994, 'min_samples_leaf': 0.043717195424817376, 'min_weight_fraction_leaf': 0.0568402020757305, 'max_features': 0.6623456203308279}. Best is trial 499 with value: 0.8396174698878165.[0m
[32m[I 2022-04-21 11:38:26,584][0m Trial 588 finished with value: 0.8355314144660066 and parameters: {'splitter': 'best', 'min_samples_split': 0.09879878766200582, 'min_samples_leaf': 0.04110639861953834, 'min_weight_fraction_leaf': 0.036493468051142314, 'max_features': 0.6088637429007684}. Best is trial 499 with value: 0.8396174698878165.[0m
[32m[I 2022-04-21 11:38:26,718][0m Trial 589 finished with value: 0.8355314144660066 and parameters: {'splitter': 'best', 'min_samples_split': 0.09419348935716307, 'min_samples_leaf': 0.0330529405793142, 'min_weight_fraction_leaf': 0.04081909930464266, 'max_features': 0.6405402664353509}. Best is trial 499 with value: 0.8396174698878165.[0m
[32m[I 2022-04-21 11:38:26,792][0m Trial 590 finished with value: 0.8292464992419608 and parameters: {'splitter': 'random', 'min_samples_split': 0.11148256735940593, 'min_samples_leaf': 0.03057534716536016, 'min_weight_fraction_leaf': 0.05922598121517486, 'max_features': 0.67591882107527}. Best is trial 499 with value: 0.8396174698878165.[0m
[32m[I 2022-04-21 11:38:26,869][0m Trial 591 finished with value: 0.8381929163139727 and parameters: {'splitter': 'best', 'min_samples_split': 0.12685131048449702, 'min_samples_leaf': 0.04508412970114863, 'min_weight_fraction_leaf': 0.030237888758700288, 'max_features': 0.6131043554132317}. Best is trial 499 with value: 0.8396174698878165.[0m
[32m[I 2022-04-21 11:38:26,920][0m Trial 592 finished with value: 0.8372245618281238 and parameters: {'splitter': 'best', 'min_samples_split': 0.10287187056509423, 'min_samples_leaf': 0.026957287284328536, 'min_weight_fraction_leaf': 0.049582162216815905, 'max_features': 0.6483724276710038}. Best is trial 499 with value: 0.8396174698878165.[0m
[32m[I 2022-04-21 11:38:26,970][0m Trial 593 finished with value: 0.8333498191213747 and parameters: {'splitter': 'best', 'min_samples_split': 0.11525085605456674, 'min_samples_leaf': 0.040669039683885924, 'min_weight_fraction_leaf': 0.068997066158538, 'max_features': 0.6831195339375921}. Best is trial 499 with value: 0.8396174698878165.[0m
[32m[I 2022-04-21 11:38:27,027][0m Trial 594 finished with value: 0.8291652333479543 and parameters: {'splitter': 'best', 'min_samples_split': 0.13744053945210738, 'min_samples_leaf': 0.020395302063521345, 'min_weight_fraction_leaf': 0.04276061469206245, 'max_features': 0.5945301130088023}. Best is trial 499 with value: 0.8396174698878165.[0m
[32m[I 2022-04-21 11:38:27,080][0m Trial 595 finished with value: 0.8326421777589973 and parameters: {'splitter': 'best', 'min_samples_split': 0.08737483829040939, 'min_samples_leaf': 0.0319432073942661, 'min_weight_fraction_leaf': 0.030376707195332853, 'max_features': 0.6295366993519582}. Best is trial 499 with value: 0.8396174698878165.[0m
[32m[I 2022-04-21 11:38:27,131][0m Trial 596 finished with value: 0.8304703316230533 and parameters: {'splitter': 'best', 'min_samples_split': 0.10782307073797447, 'min_samples_leaf': 0.020458154342111505, 'min_weight_fraction_leaf': 0.0529420184499094, 'max_features': 0.5379781164669635}. Best is trial 499 with value: 0.8396174698878165.[0m
[32m[I 2022-04-21 11:38:27,184][0m Trial 597 finished with value: 0.8337713431190045 and parameters: {'splitter': 'best', 'min_samples_split': 0.057208236501796184, 'min_samples_leaf': 0.03975819464377334, 'min_weight_fraction_leaf': 0.04090842391047255, 'max_features': 0.6536008209483393}. Best is trial 499 with value: 0.8396174698878165.[0m
[32m[I 2022-04-21 11:38:27,233][0m Trial 598 finished with value: 0.8340130635607796 and parameters: {'splitter': 'best', 'min_samples_split': 0.11968730710217025, 'min_samples_leaf': 0.030518166255774335, 'min_weight_fraction_leaf': 0.05894797373754081, 'max_features': 0.6673022771988429}. Best is trial 499 with value: 0.8396174698878165.[0m
[32m[I 2022-04-21 11:38:27,301][0m Trial 599 finished with value: 0.8372245618281238 and parameters: {'splitter': 'best', 'min_samples_split': 0.07899672150824298, 'min_samples_leaf': 0.023852648359351858, 'min_weight_fraction_leaf': 0.049403855458137275, 'max_features': 0.6211839491749563}. Best is trial 499 with value: 0.8396174698878165.[0m
[32m[I 2022-04-21 11:38:27,381][0m Trial 600 finished with value: 0.8336210332407393 and parameters: {'splitter': 'best', 'min_samples_split': 0.10440658831622532, 'min_samples_leaf': 0.041787331039447415, 'min_weight_fraction_leaf': 0.07429936718938349, 'max_features': 0.6890611200125825}. Best is trial 499 with value: 0.8396174698878165.[0m
[32m[I 2022-04-21 11:38:27,453][0m Trial 601 finished with value: 0.8353974399329436 and parameters: {'splitter': 'best', 'min_samples_split': 0.1296096577528944, 'min_samples_leaf': 0.021161886646661607, 'min_weight_fraction_leaf': 0.02889538213321407, 'max_features': 0.6435624974637217}. Best is trial 499 with value: 0.8396174698878165.[0m
[32m[I 2022-04-21 11:38:27,510][0m Trial 602 finished with value: 0.8284678611023908 and parameters: {'splitter': 'best', 'min_samples_split': 0.09565602564548206, 'min_samples_leaf': 0.012463238160016767, 'min_weight_fraction_leaf': 0.04049229867296916, 'max_features': 0.5897773896893609}. Best is trial 499 with value: 0.8396174698878165.[0m
[32m[I 2022-04-21 11:38:27,561][0m Trial 603 finished with value: 0.8333498191213747 and parameters: {'splitter': 'best', 'min_samples_split': 0.114106901699769, 'min_samples_leaf': 0.033014525608511126, 'min_weight_fraction_leaf': 0.06371192451954126, 'max_features': 0.7099470904901808}. Best is trial 499 with value: 0.8396174698878165.[0m
[32m[I 2022-04-21 11:38:27,613][0m Trial 604 finished with value: 0.8381929163139727 and parameters: {'splitter': 'best', 'min_samples_split': 0.1286586740518274, 'min_samples_leaf': 0.018676114851378763, 'min_weight_fraction_leaf': 0.04675216357583364, 'max_features': 0.669865131937269}. Best is trial 499 with value: 0.8396174698878165.[0m
[32m[I 2022-04-21 11:38:27,663][0m Trial 605 finished with value: 0.8391063129816301 and parameters: {'splitter': 'best', 'min_samples_split': 0.09241108293347913, 'min_samples_leaf': 0.045552153329944875, 'min_weight_fraction_leaf': 0.03064536418936004, 'max_features': 0.6234723680202351}. Best is trial 499 with value: 0.8396174698878165.[0m
[32m[I 2022-04-21 11:38:27,713][0m Trial 606 finished with value: 0.8318450474400789 and parameters: {'splitter': 'best', 'min_samples_split': 0.0838374994630635, 'min_samples_leaf': 0.1625924802293317, 'min_weight_fraction_leaf': 0.02898465172420531, 'max_features': 0.6170614519578699}. Best is trial 499 with value: 0.8396174698878165.[0m
[32m[I 2022-04-21 11:38:27,761][0m Trial 607 finished with value: 0.65 and parameters: {'splitter': 'best', 'min_samples_split': 0.09551969218272471, 'min_samples_leaf': 0.04464009108482893, 'min_weight_fraction_leaf': 0.14866131980380315, 'max_features': 0.5645266806819998}. Best is trial 499 with value: 0.8396174698878165.[0m
[32m[I 2022-04-21 11:38:27,813][0m Trial 608 finished with value: 0.8391063129816301 and parameters: {'splitter': 'best', 'min_samples_split': 0.10698605322208274, 'min_samples_leaf': 0.04259884828385194, 'min_weight_fraction_leaf': 0.030509871753616222, 'max_features': 0.6325282627830093}. Best is trial 499 with value: 0.8396174698878165.[0m
[32m[I 2022-04-21 11:38:27,876][0m Trial 609 finished with value: 0.703831508598297 and parameters: {'splitter': 'best', 'min_samples_split': 0.09498736240445033, 'min_samples_leaf': 0.04663765845154092, 'min_weight_fraction_leaf': 0.32297305703110124, 'max_features': 0.6065152116749879}. Best is trial 499 with value: 0.8396174698878165.[0m
[32m[I 2022-04-21 11:38:27,949][0m Trial 610 finished with value: 0.8305934595867903 and parameters: {'splitter': 'random', 'min_samples_split': 0.11819398040301049, 'min_samples_leaf': 0.03201776842998887, 'min_weight_fraction_leaf': 0.03620438876773148, 'max_features': 0.6607623210711449}. Best is trial 499 with value: 0.8396174698878165.[0m
[32m[I 2022-04-21 11:38:28,055][0m Trial 611 finished with value: 0.8391063129816301 and parameters: {'splitter': 'best', 'min_samples_split': 0.10800768032689173, 'min_samples_leaf': 0.047791201410640645, 'min_weight_fraction_leaf': 0.027769986342069283, 'max_features': 0.630444544495832}. Best is trial 499 with value: 0.8396174698878165.[0m
[32m[I 2022-04-21 11:38:28,109][0m Trial 612 finished with value: 0.838471133863884 and parameters: {'splitter': 'best', 'min_samples_split': 0.1389320587012911, 'min_samples_leaf': 0.047278849887697164, 'min_weight_fraction_leaf': 0.03308895610720561, 'max_features': 0.6434196307345093}. Best is trial 499 with value: 0.8396174698878165.[0m
[32m[I 2022-04-21 11:38:28,162][0m Trial 613 finished with value: 0.8337713431190045 and parameters: {'splitter': 'best', 'min_samples_split': 0.07833967889218807, 'min_samples_leaf': 0.04112019106440743, 'min_weight_fraction_leaf': 0.02513502520062461, 'max_features': 0.6253004490316975}. Best is trial 499 with value: 0.8396174698878165.[0m
[32m[I 2022-04-21 11:38:28,218][0m Trial 614 finished with value: 0.8248690776467178 and parameters: {'splitter': 'best', 'min_samples_split': 0.10625284348265664, 'min_samples_leaf': 0.03162383667576268, 'min_weight_fraction_leaf': 0.026906680180648988, 'max_features': 0.5882491839313357}. Best is trial 499 with value: 0.8396174698878165.[0m
[32m[I 2022-04-21 11:38:28,323][0m Trial 615 finished with value: 0.8306194503328614 and parameters: {'splitter': 'best', 'min_samples_split': 0.12168930260355248, 'min_samples_leaf': 0.027453455637229666, 'min_weight_fraction_leaf': 0.027351530636096494, 'max_features': 0.6359585190515595}. Best is trial 499 with value: 0.8396174698878165.[0m
[32m[I 2022-04-21 11:38:28,403][0m Trial 616 finished with value: 0.8352402471455868 and parameters: {'splitter': 'best', 'min_samples_split': 0.10634606788465333, 'min_samples_leaf': 0.03990215564742123, 'min_weight_fraction_leaf': 0.03954678027422667, 'max_features': 0.6636732273459357}. Best is trial 499 with value: 0.8396174698878165.[0m
[32m[I 2022-04-21 11:38:28,453][0m Trial 617 finished with value: 0.8318450474400789 and parameters: {'splitter': 'best', 'min_samples_split': 0.11356926953277066, 'min_samples_leaf': 0.026046420988724745, 'min_weight_fraction_leaf': 0.24590703642437306, 'max_features': 0.6474689600954253}. Best is trial 499 with value: 0.8396174698878165.[0m
[32m[I 2022-04-21 11:38:28,572][0m Trial 618 finished with value: 0.8318450474400789 and parameters: {'splitter': 'best', 'min_samples_split': 0.12577363932149213, 'min_samples_leaf': 0.016040656502507335, 'min_weight_fraction_leaf': 0.2938321969476485, 'max_features': 0.6859103703939239}. Best is trial 499 with value: 0.8396174698878165.[0m
[32m[I 2022-04-21 11:38:28,692][0m Trial 619 finished with value: 0.65 and parameters: {'splitter': 'best', 'min_samples_split': 0.13068167186071067, 'min_samples_leaf': 0.44357306184391376, 'min_weight_fraction_leaf': 0.05670430486146832, 'max_features': 0.6054394818347699}. Best is trial 499 with value: 0.8396174698878165.[0m
[32m[I 2022-04-21 11:38:28,849][0m Trial 620 finished with value: 0.8320143660942818 and parameters: {'splitter': 'best', 'min_samples_split': 0.09431339042153979, 'min_samples_leaf': 0.04715826957712596, 'min_weight_fraction_leaf': 0.04025138351076088, 'max_features': 0.4857928197688481}. Best is trial 499 with value: 0.8396174698878165.[0m
[32m[I 2022-04-21 11:38:28,947][0m Trial 621 finished with value: 0.8391063129816301 and parameters: {'splitter': 'best', 'min_samples_split': 0.11584821259959215, 'min_samples_leaf': 0.04825711420913563, 'min_weight_fraction_leaf': 0.030981788356592523, 'max_features': 0.7035166218743907}. Best is trial 499 with value: 0.8396174698878165.[0m
[32m[I 2022-04-21 11:38:29,144][0m Trial 622 finished with value: 0.8350747161321781 and parameters: {'splitter': 'best', 'min_samples_split': 0.11650539392249831, 'min_samples_leaf': 0.03201580272728367, 'min_weight_fraction_leaf': 0.03863926131252495, 'max_features': 0.7026698435161477}. Best is trial 499 with value: 0.8396174698878165.[0m
[32m[I 2022-04-21 11:38:29,265][0m Trial 623 finished with value: 0.8248690776467178 and parameters: {'splitter': 'best', 'min_samples_split': 0.1026479110442551, 'min_samples_leaf': 0.01559039716596345, 'min_weight_fraction_leaf': 0.02400482569178463, 'max_features': 0.5779233937763741}. Best is trial 499 with value: 0.8396174698878165.[0m
[32m[I 2022-04-21 11:38:29,324][0m Trial 624 finished with value: 0.8391063129816301 and parameters: {'splitter': 'best', 'min_samples_split': 0.08855509139564975, 'min_samples_leaf': 0.04741952576533027, 'min_weight_fraction_leaf': 0.028305437658825983, 'max_features': 0.7107778737400302}. Best is trial 499 with value: 0.8396174698878165.[0m
[32m[I 2022-04-21 11:38:29,377][0m Trial 625 finished with value: 0.8381929163139727 and parameters: {'splitter': 'best', 'min_samples_split': 0.13842728185081238, 'min_samples_leaf': 0.0464098670405116, 'min_weight_fraction_leaf': 0.023451476247940046, 'max_features': 0.7031227106082267}. Best is trial 499 with value: 0.8396174698878165.[0m
[32m[I 2022-04-21 11:38:29,437][0m Trial 626 finished with value: 0.8391063129816301 and parameters: {'splitter': 'best', 'min_samples_split': 0.06713555021118811, 'min_samples_leaf': 0.0442751489667658, 'min_weight_fraction_leaf': 0.02809350301096706, 'max_features': 0.7134846491322685}. Best is trial 499 with value: 0.8396174698878165.[0m
[32m[I 2022-04-21 11:38:29,514][0m Trial 627 finished with value: 0.8372245618281238 and parameters: {'splitter': 'best', 'min_samples_split': 0.12589892698531369, 'min_samples_leaf': 0.02420419916899975, 'min_weight_fraction_leaf': 0.05225360452294795, 'max_features': 0.6145946461072614}. Best is trial 499 with value: 0.8396174698878165.[0m
[32m[I 2022-04-21 11:38:29,569][0m Trial 628 finished with value: 0.8372245618281238 and parameters: {'splitter': 'best', 'min_samples_split': 0.076339551536979, 'min_samples_leaf': 0.05202765709800693, 'min_weight_fraction_leaf': 0.025880307159500408, 'max_features': 0.7141544452701386}. Best is trial 499 with value: 0.8396174698878165.[0m
[32m[I 2022-04-21 11:38:29,626][0m Trial 629 finished with value: 0.65 and parameters: {'splitter': 'random', 'min_samples_split': 0.0897119734150785, 'min_samples_leaf': 0.2402496150813775, 'min_weight_fraction_leaf': 0.036340301314615894, 'max_features': 0.6678169219918484}. Best is trial 499 with value: 0.8396174698878165.[0m
[32m[I 2022-04-21 11:38:29,697][0m Trial 630 finished with value: 0.8281775624320924 and parameters: {'splitter': 'best', 'min_samples_split': 0.0586283932896232, 'min_samples_leaf': 0.012082913091394535, 'min_weight_fraction_leaf': 0.028410785927671208, 'max_features': 0.4495005535890807}. Best is trial 499 with value: 0.8396174698878165.[0m
