[32m[I 2022-04-21 11:43:07,977][0m Trial 285 finished with value: 0.6847054012696481 and parameters: {'alpha': 0.8057024331113556, 'ties': 'breslow'}. Best is trial 26 with value: 0.6847054012696481.[0m
[32m[I 2022-04-21 11:43:08,143][0m Trial 286 finished with value: 0.6847054012696481 and parameters: {'alpha': 0.7594685238168138, 'ties': 'efron'}. Best is trial 26 with value: 0.6847054012696481.[0m
[32m[I 2022-04-21 11:43:08,320][0m Trial 287 finished with value: 0.684367348820454 and parameters: {'alpha': 0.6599219320522414, 'ties': 'efron'}. Best is trial 26 with value: 0.6847054012696481.[0m
[32m[I 2022-04-21 11:43:08,536][0m Trial 288 finished with value: 0.6829090813866752 and parameters: {'alpha': 1.078695103125756, 'ties': 'efron'}. Best is trial 26 with value: 0.6847054012696481.[0m
[32m[I 2022-04-21 11:43:08,769][0m Trial 289 finished with value: 0.684367348820454 and parameters: {'alpha': 0.5426268533390427, 'ties': 'efron'}. Best is trial 26 with value: 0.6847054012696481.[0m
[32m[I 2022-04-21 11:43:09,102][0m Trial 290 finished with value: 0.6829090813866752 and parameters: {'alpha': 0.9824568788726211, 'ties': 'efron'}. Best is trial 26 with value: 0.6847054012696481.[0m
[32m[I 2022-04-21 11:43:09,306][0m Trial 291 finished with value: 0.6847054012696481 and parameters: {'alpha': 0.9304268086464794, 'ties': 'breslow'}. Best is trial 26 with value: 0.6847054012696481.[0m
[32m[I 2022-04-21 11:43:09,583][0m Trial 292 finished with value: 0.684367348820454 and parameters: {'alpha': 0.700945569212784, 'ties': 'breslow'}. Best is trial 26 with value: 0.6847054012696481.[0m
[32m[I 2022-04-21 11:43:09,936][0m Trial 293 finished with value: 0.684367348820454 and parameters: {'alpha': 0.5944739488577294, 'ties': 'efron'}. Best is trial 26 with value: 0.6847054012696481.[0m
[32m[I 2022-04-21 11:43:10,240][0m Trial 294 finished with value: 0.6826116370301901 and parameters: {'alpha': 3.3985209934522076, 'ties': 'efron'}. Best is trial 26 with value: 0.6847054012696481.[0m
[32m[I 2022-04-21 11:43:10,436][0m Trial 295 finished with value: 0.6847054012696481 and parameters: {'alpha': 0.7096343390864959, 'ties': 'breslow'}. Best is trial 26 with value: 0.6847054012696481.[0m
[32m[I 2022-04-21 11:43:10,570][0m Trial 296 finished with value: 0.684367348820454 and parameters: {'alpha': 0.4657712249069817, 'ties': 'breslow'}. Best is trial 26 with value: 0.6847054012696481.[0m
[32m[I 2022-04-21 11:43:10,788][0m Trial 297 finished with value: 0.6847054012696481 and parameters: {'alpha': 0.8358782754456616, 'ties': 'breslow'}. Best is trial 26 with value: 0.6847054012696481.[0m
[32m[I 2022-04-21 11:43:10,981][0m Trial 298 finished with value: 0.6847054012696481 and parameters: {'alpha': 0.7420319150039096, 'ties': 'breslow'}. Best is trial 26 with value: 0.6847054012696481.[0m
[32m[I 2022-04-21 11:43:11,115][0m Trial 299 finished with value: 0.684367348820454 and parameters: {'alpha': 0.6383204446809398, 'ties': 'efron'}. Best is trial 26 with value: 0.6847054012696481.[0m
[32m[I 2022-04-21 11:43:11,331][0m Trial 300 finished with value: 0.6847054012696481 and parameters: {'alpha': 0.7752000170771707, 'ties': 'efron'}. Best is trial 26 with value: 0.6847054012696481.[0m
[32m[I 2022-04-21 11:43:11,671][0m Trial 301 finished with value: 0.6847054012696481 and parameters: {'alpha': 0.7924768321957777, 'ties': 'efron'}. Best is trial 26 with value: 0.6847054012696481.[0m
[32m[I 2022-04-21 11:43:12,010][0m Trial 302 finished with value: 0.6829090813866752 and parameters: {'alpha': 1.0211353238564327, 'ties': 'efron'}. Best is trial 26 with value: 0.6847054012696481.[0m
[32m[I 2022-04-21 11:43:12,435][0m Trial 303 finished with value: 0.6829090813866752 and parameters: {'alpha': 0.9185589154832053, 'ties': 'efron'}. Best is trial 26 with value: 0.6847054012696481.[0m
[32m[I 2022-04-21 11:43:12,757][0m Trial 304 finished with value: 0.6829090813866752 and parameters: {'alpha': 0.8796205222420828, 'ties': 'efron'}. Best is trial 26 with value: 0.6847054012696481.[0m
[32m[I 2022-04-21 11:43:13,058][0m Trial 305 finished with value: 0.684367348820454 and parameters: {'alpha': 0.42069175437967893, 'ties': 'efron'}. Best is trial 26 with value: 0.6847054012696481.[0m
[32m[I 2022-04-21 11:43:13,386][0m Trial 306 finished with value: 0.684367348820454 and parameters: {'alpha': 0.6647806876857888, 'ties': 'breslow'}. Best is trial 26 with value: 0.6847054012696481.[0m
[32m[I 2022-04-21 11:43:13,771][0m Trial 307 finished with value: 0.6847054012696481 and parameters: {'alpha': 0.7929211326982142, 'ties': 'efron'}. Best is trial 26 with value: 0.6847054012696481.[0m
[32m[I 2022-04-21 11:43:14,363][0m Trial 308 finished with value: 0.684367348820454 and parameters: {'alpha': 0.5850373930939529, 'ties': 'efron'}. Best is trial 26 with value: 0.6847054012696481.[0m
[32m[I 2022-04-21 11:43:14,711][0m Trial 309 finished with value: 0.6847054012696481 and parameters: {'alpha': 0.7227242833837071, 'ties': 'efron'}. Best is trial 26 with value: 0.6847054012696481.[0m
[32m[I 2022-04-21 11:43:15,014][0m Trial 310 finished with value: 0.6847054012696481 and parameters: {'alpha': 0.8419843108063287, 'ties': 'efron'}. Best is trial 26 with value: 0.6847054012696481.[0m
[32m[I 2022-04-21 11:43:15,275][0m Trial 311 finished with value: 0.684367348820454 and parameters: {'alpha': 0.5191228010627229, 'ties': 'efron'}. Best is trial 26 with value: 0.6847054012696481.[0m
[32m[I 2022-04-21 11:43:15,429][0m Trial 312 finished with value: 0.6847054012696481 and parameters: {'alpha': 0.6985053407859837, 'ties': 'efron'}. Best is trial 26 with value: 0.6847054012696481.[0m
[32m[I 2022-04-21 11:43:15,685][0m Trial 313 finished with value: 0.684367348820454 and parameters: {'alpha': 0.6341817570608752, 'ties': 'efron'}. Best is trial 26 with value: 0.6847054012696481.[0m
[32m[I 2022-04-21 11:43:15,968][0m Trial 314 finished with value: 0.6847054012696481 and parameters: {'alpha': 0.7196492411689187, 'ties': 'efron'}. Best is trial 26 with value: 0.6847054012696481.[0m
[32m[I 2022-04-21 11:43:16,241][0m Trial 315 finished with value: 0.6847054012696481 and parameters: {'alpha': 0.744690870369481, 'ties': 'efron'}. Best is trial 26 with value: 0.6847054012696481.[0m
[32m[I 2022-04-21 11:43:16,439][0m Trial 316 finished with value: 0.682571028937481 and parameters: {'alpha': 1.7176296653638778, 'ties': 'efron'}. Best is trial 26 with value: 0.6847054012696481.[0m
[32m[I 2022-04-21 11:43:16,574][0m Trial 317 finished with value: 0.684367348820454 and parameters: {'alpha': 0.5822601812864526, 'ties': 'efron'}. Best is trial 26 with value: 0.6847054012696481.[0m
[32m[I 2022-04-21 11:43:16,757][0m Trial 318 finished with value: 0.684367348820454 and parameters: {'alpha': 0.634777796502404, 'ties': 'efron'}. Best is trial 26 with value: 0.6847054012696481.[0m
[32m[I 2022-04-21 11:43:16,919][0m Trial 319 finished with value: 0.6829090813866752 and parameters: {'alpha': 1.0055947713182791, 'ties': 'breslow'}. Best is trial 26 with value: 0.6847054012696481.[0m
[32m[I 2022-04-21 11:43:17,065][0m Trial 320 finished with value: 0.6847054012696481 and parameters: {'alpha': 0.8850721362203394, 'ties': 'breslow'}. Best is trial 26 with value: 0.6847054012696481.[0m
[32m[I 2022-04-21 11:43:17,271][0m Trial 321 finished with value: 0.6829090813866752 and parameters: {'alpha': 1.0611687528898788, 'ties': 'efron'}. Best is trial 26 with value: 0.6847054012696481.[0m
[32m[I 2022-04-21 11:43:17,433][0m Trial 322 finished with value: 0.6829090813866752 and parameters: {'alpha': 0.9227335486766288, 'ties': 'efron'}. Best is trial 26 with value: 0.6847054012696481.[0m
[32m[I 2022-04-21 11:43:17,649][0m Trial 323 finished with value: 0.6829090813866752 and parameters: {'alpha': 0.9634476667394156, 'ties': 'efron'}. Best is trial 26 with value: 0.6847054012696481.[0m
[32m[I 2022-04-21 11:43:17,782][0m Trial 324 finished with value: 0.6829090813866752 and parameters: {'alpha': 1.2250223433113447, 'ties': 'efron'}. Best is trial 26 with value: 0.6847054012696481.[0m
[32m[I 2022-04-21 11:43:18,067][0m Trial 325 finished with value: 0.6829090813866752 and parameters: {'alpha': 0.9117160737764985, 'ties': 'efron'}. Best is trial 26 with value: 0.6847054012696481.[0m
[32m[I 2022-04-21 11:43:18,227][0m Trial 326 finished with value: 0.6829090813866752 and parameters: {'alpha': 1.1072647842776777, 'ties': 'efron'}. Best is trial 26 with value: 0.6847054012696481.[0m
[32m[I 2022-04-21 11:43:18,367][0m Trial 327 finished with value: 0.6847054012696481 and parameters: {'alpha': 0.8341291670511862, 'ties': 'efron'}. Best is trial 26 with value: 0.6847054012696481.[0m
[32m[I 2022-04-21 11:43:18,541][0m Trial 328 finished with value: 0.6847054012696481 and parameters: {'alpha': 0.7914575736950472, 'ties': 'efron'}. Best is trial 26 with value: 0.6847054012696481.[0m
[32m[I 2022-04-21 11:43:18,751][0m Trial 329 finished with value: 0.6847054012696481 and parameters: {'alpha': 0.818607492273405, 'ties': 'efron'}. Best is trial 26 with value: 0.6847054012696481.[0m
[32m[I 2022-04-21 11:43:18,885][0m Trial 330 finished with value: 0.684367348820454 and parameters: {'alpha': 0.3975588914907512, 'ties': 'efron'}. Best is trial 26 with value: 0.6847054012696481.[0m
[32m[I 2022-04-21 11:43:19,068][0m Trial 331 finished with value: 0.6847054012696481 and parameters: {'alpha': 0.8308140850385842, 'ties': 'efron'}. Best is trial 26 with value: 0.6847054012696481.[0m
[32m[I 2022-04-21 11:43:19,241][0m Trial 332 finished with value: 0.6829090813866752 and parameters: {'alpha': 1.0105802581516756, 'ties': 'efron'}. Best is trial 26 with value: 0.6847054012696481.[0m
[32m[I 2022-04-21 11:43:19,403][0m Trial 333 finished with value: 0.684367348820454 and parameters: {'alpha': 0.6800390601771873, 'ties': 'breslow'}. Best is trial 26 with value: 0.6847054012696481.[0m
[32m[I 2022-04-21 11:43:19,607][0m Trial 334 finished with value: 0.6829090813866752 and parameters: {'alpha': 0.9238030787526132, 'ties': 'efron'}. Best is trial 26 with value: 0.6847054012696481.[0m
[32m[I 2022-04-21 11:43:19,844][0m Trial 335 finished with value: 0.684367348820454 and parameters: {'alpha': 0.5228421520902871, 'ties': 'efron'}. Best is trial 26 with value: 0.6847054012696481.[0m
[32m[I 2022-04-21 11:43:19,998][0m Trial 336 finished with value: 0.6847054012696481 and parameters: {'alpha': 0.7595860284360915, 'ties': 'breslow'}. Best is trial 26 with value: 0.6847054012696481.[0m
[32m[I 2022-04-21 11:43:20,234][0m Trial 337 finished with value: 0.6847054012696481 and parameters: {'alpha': 0.7337504768451488, 'ties': 'efron'}. Best is trial 26 with value: 0.6847054012696481.[0m
[32m[I 2022-04-21 11:43:20,737][0m Trial 338 finished with value: 0.6847054012696481 and parameters: {'alpha': 0.7742060764514767, 'ties': 'efron'}. Best is trial 26 with value: 0.6847054012696481.[0m
[32m[I 2022-04-21 11:43:21,072][0m Trial 339 finished with value: 0.6847054012696481 and parameters: {'alpha': 0.7804122806829018, 'ties': 'efron'}. Best is trial 26 with value: 0.6847054012696481.[0m
[32m[I 2022-04-21 11:43:21,385][0m Trial 340 finished with value: 0.684367348820454 and parameters: {'alpha': 0.671581700521512, 'ties': 'efron'}. Best is trial 26 with value: 0.6847054012696481.[0m
[32m[I 2022-04-21 11:43:21,743][0m Trial 341 finished with value: 0.684367348820454 and parameters: {'alpha': 0.5704555706737724, 'ties': 'efron'}. Best is trial 26 with value: 0.6847054012696481.[0m
[32m[I 2022-04-21 11:43:22,069][0m Trial 342 finished with value: 0.684367348820454 and parameters: {'alpha': 0.5357845929556874, 'ties': 'efron'}. Best is trial 26 with value: 0.6847054012696481.[0m
[32m[I 2022-04-21 11:43:22,431][0m Trial 343 finished with value: 0.6847054012696481 and parameters: {'alpha': 0.8910082511384385, 'ties': 'breslow'}. Best is trial 26 with value: 0.6847054012696481.[0m
[32m[I 2022-04-21 11:43:22,838][0m Trial 344 finished with value: 0.6847054012696481 and parameters: {'alpha': 0.8333726807464299, 'ties': 'efron'}. Best is trial 26 with value: 0.6847054012696481.[0m
[32m[I 2022-04-21 11:43:23,209][0m Trial 345 finished with value: 0.6829090813866752 and parameters: {'alpha': 0.966014605590797, 'ties': 'efron'}. Best is trial 26 with value: 0.6847054012696481.[0m
[32m[I 2022-04-21 11:43:23,668][0m Trial 346 finished with value: 0.684367348820454 and parameters: {'alpha': 0.6281624251578238, 'ties': 'efron'}. Best is trial 26 with value: 0.6847054012696481.[0m
[32m[I 2022-04-21 11:43:23,978][0m Trial 347 finished with value: 0.6829090813866752 and parameters: {'alpha': 0.9631938960156298, 'ties': 'breslow'}. Best is trial 26 with value: 0.6847054012696481.[0m
[32m[I 2022-04-21 11:43:24,318][0m Trial 348 finished with value: 0.6847054012696481 and parameters: {'alpha': 0.7269039327926922, 'ties': 'efron'}. Best is trial 26 with value: 0.6847054012696481.[0m
[32m[I 2022-04-21 11:43:24,616][0m Trial 349 finished with value: 0.684367348820454 and parameters: {'alpha': 0.46559939877378803, 'ties': 'breslow'}. Best is trial 26 with value: 0.6847054012696481.[0m
[32m[I 2022-04-21 11:43:24,864][0m Trial 350 finished with value: 0.6829496894793843 and parameters: {'alpha': 2.6853023591908736, 'ties': 'breslow'}. Best is trial 26 with value: 0.6847054012696481.[0m
[32m[I 2022-04-21 11:43:25,014][0m Trial 351 finished with value: 0.684367348820454 and parameters: {'alpha': 0.6370950851901873, 'ties': 'efron'}. Best is trial 26 with value: 0.6847054012696481.[0m
[32m[I 2022-04-21 11:43:25,416][0m Trial 352 finished with value: 0.684367348820454 and parameters: {'alpha': 0.690146046055296, 'ties': 'efron'}. Best is trial 26 with value: 0.6847054012696481.[0m
[32m[I 2022-04-21 11:43:25,610][0m Trial 353 finished with value: 0.684367348820454 and parameters: {'alpha': 0.28667999993150717, 'ties': 'efron'}. Best is trial 26 with value: 0.6847054012696481.[0m
[32m[I 2022-04-21 11:43:25,754][0m Trial 354 finished with value: 0.6829090813866752 and parameters: {'alpha': 1.1526247849674562, 'ties': 'breslow'}. Best is trial 26 with value: 0.6847054012696481.[0m
[32m[I 2022-04-21 11:43:25,924][0m Trial 355 finished with value: 0.684367348820454 and parameters: {'alpha': 0.6931313990949062, 'ties': 'efron'}. Best is trial 26 with value: 0.6847054012696481.[0m
[32m[I 2022-04-21 11:43:26,169][0m Trial 356 finished with value: 0.684367348820454 and parameters: {'alpha': 0.5530458400952115, 'ties': 'efron'}. Best is trial 26 with value: 0.6847054012696481.[0m
[32m[I 2022-04-21 11:43:26,425][0m Trial 357 finished with value: 0.684367348820454 and parameters: {'alpha': 0.42152583285688966, 'ties': 'efron'}. Best is trial 26 with value: 0.6847054012696481.[0m
[32m[I 2022-04-21 11:43:26,753][0m Trial 358 finished with value: 0.6847054012696481 and parameters: {'alpha': 0.6957219735109924, 'ties': 'efron'}. Best is trial 26 with value: 0.6847054012696481.[0m
[32m[I 2022-04-21 11:43:27,119][0m Trial 359 finished with value: 0.6847054012696481 and parameters: {'alpha': 0.8370674447796864, 'ties': 'efron'}. Best is trial 26 with value: 0.6847054012696481.[0m
[32m[I 2022-04-21 11:43:27,416][0m Trial 360 finished with value: 0.6826116370301901 and parameters: {'alpha': 3.074832059513816, 'ties': 'efron'}. Best is trial 26 with value: 0.6847054012696481.[0m
[32m[I 2022-04-21 11:43:27,879][0m Trial 361 finished with value: 0.6847054012696481 and parameters: {'alpha': 0.8879043922548226, 'ties': 'breslow'}. Best is trial 26 with value: 0.6847054012696481.[0m
[32m[I 2022-04-21 11:43:28,159][0m Trial 362 finished with value: 0.6829090813866752 and parameters: {'alpha': 1.0698294698107818, 'ties': 'breslow'}. Best is trial 26 with value: 0.6847054012696481.[0m
[32m[I 2022-04-21 11:43:28,391][0m Trial 363 finished with value: 0.6847054012696481 and parameters: {'alpha': 0.8652436795248782, 'ties': 'efron'}. Best is trial 26 with value: 0.6847054012696481.[0m
[32m[I 2022-04-21 11:43:28,628][0m Trial 364 finished with value: 0.6847054012696481 and parameters: {'alpha': 0.7420432445421499, 'ties': 'efron'}. Best is trial 26 with value: 0.6847054012696481.[0m
[32m[I 2022-04-21 11:43:28,891][0m Trial 365 finished with value: 0.684367348820454 and parameters: {'alpha': 0.6413277662306377, 'ties': 'efron'}. Best is trial 26 with value: 0.6847054012696481.[0m
[32m[I 2022-04-21 11:43:29,094][0m Trial 366 finished with value: 0.6829090813866752 and parameters: {'alpha': 1.0547100271016783, 'ties': 'breslow'}. Best is trial 26 with value: 0.6847054012696481.[0m
[32m[I 2022-04-21 11:43:29,367][0m Trial 367 finished with value: 0.6829090813866752 and parameters: {'alpha': 0.9509802495429485, 'ties': 'efron'}. Best is trial 26 with value: 0.6847054012696481.[0m
[32m[I 2022-04-21 11:43:29,606][0m Trial 368 finished with value: 0.6847054012696481 and parameters: {'alpha': 0.8069637639656905, 'ties': 'efron'}. Best is trial 26 with value: 0.6847054012696481.[0m
[32m[I 2022-04-21 11:43:29,949][0m Trial 369 finished with value: 0.6847054012696481 and parameters: {'alpha': 0.7438661987924101, 'ties': 'efron'}. Best is trial 26 with value: 0.6847054012696481.[0m
[32m[I 2022-04-21 11:43:30,115][0m Trial 370 finished with value: 0.684367348820454 and parameters: {'alpha': 0.5957360802031033, 'ties': 'efron'}. Best is trial 26 with value: 0.6847054012696481.[0m
[32m[I 2022-04-21 11:43:30,281][0m Trial 371 finished with value: 0.684367348820454 and parameters: {'alpha': 0.47970793135946893, 'ties': 'efron'}. Best is trial 26 with value: 0.6847054012696481.[0m
[32m[I 2022-04-21 11:43:30,450][0m Trial 372 finished with value: 0.6829090813866752 and parameters: {'alpha': 0.8783057218967456, 'ties': 'efron'}. Best is trial 26 with value: 0.6847054012696481.[0m
[32m[I 2022-04-21 11:43:30,598][0m Trial 373 finished with value: 0.6811159057216931 and parameters: {'alpha': 4.985846951396772, 'ties': 'breslow'}. Best is trial 26 with value: 0.6847054012696481.[0m
[32m[I 2022-04-21 11:43:30,777][0m Trial 374 finished with value: 0.6829090813866752 and parameters: {'alpha': 0.9864265335975424, 'ties': 'breslow'}. Best is trial 26 with value: 0.6847054012696481.[0m
[32m[I 2022-04-21 11:43:30,950][0m Trial 375 finished with value: 0.6847054012696481 and parameters: {'alpha': 0.9257901312268861, 'ties': 'breslow'}. Best is trial 26 with value: 0.6847054012696481.[0m
[32m[I 2022-04-21 11:43:31,138][0m Trial 376 finished with value: 0.6847054012696481 and parameters: {'alpha': 0.8664873150406165, 'ties': 'efron'}. Best is trial 26 with value: 0.6847054012696481.[0m
[32m[I 2022-04-21 11:43:31,303][0m Trial 377 finished with value: 0.6829090813866752 and parameters: {'alpha': 1.1312831730593558, 'ties': 'breslow'}. Best is trial 26 with value: 0.6847054012696481.[0m
[32m[I 2022-04-21 11:43:31,493][0m Trial 378 finished with value: 0.6829090813866752 and parameters: {'alpha': 1.3735179052409734, 'ties': 'efron'}. Best is trial 26 with value: 0.6847054012696481.[0m
[32m[I 2022-04-21 11:43:31,662][0m Trial 379 finished with value: 0.6847054012696481 and parameters: {'alpha': 0.7892383322666797, 'ties': 'breslow'}. Best is trial 26 with value: 0.6847054012696481.[0m
[32m[I 2022-04-21 11:43:31,860][0m Trial 380 finished with value: 0.684367348820454 and parameters: {'alpha': 0.6338638985883165, 'ties': 'efron'}. Best is trial 26 with value: 0.6847054012696481.[0m
[32m[I 2022-04-21 11:43:32,045][0m Trial 381 finished with value: 0.6847054012696481 and parameters: {'alpha': 0.8537494303562512, 'ties': 'efron'}. Best is trial 26 with value: 0.6847054012696481.[0m
[32m[I 2022-04-21 11:43:32,212][0m Trial 382 finished with value: 0.6829090813866752 and parameters: {'alpha': 1.0187277122173637, 'ties': 'breslow'}. Best is trial 26 with value: 0.6847054012696481.[0m
[32m[I 2022-04-21 11:43:32,386][0m Trial 383 finished with value: 0.6829090813866752 and parameters: {'alpha': 0.9487219052051549, 'ties': 'breslow'}. Best is trial 26 with value: 0.6847054012696481.[0m
[32m[I 2022-04-21 11:43:32,588][0m Trial 384 finished with value: 0.6814469677485105 and parameters: {'alpha': 4.7185028272316645, 'ties': 'breslow'}. Best is trial 26 with value: 0.6847054012696481.[0m
[32m[I 2022-04-21 11:43:32,759][0m Trial 385 finished with value: 0.6847054012696481 and parameters: {'alpha': 0.7669811434924869, 'ties': 'breslow'}. Best is trial 26 with value: 0.6847054012696481.[0m
[32m[I 2022-04-21 11:43:32,944][0m Trial 386 finished with value: 0.682571028937481 and parameters: {'alpha': 1.9220821297311494, 'ties': 'efron'}. Best is trial 26 with value: 0.6847054012696481.[0m
[32m[I 2022-04-21 11:43:33,185][0m Trial 387 finished with value: 0.6847054012696481 and parameters: {'alpha': 0.7573681185386449, 'ties': 'breslow'}. Best is trial 26 with value: 0.6847054012696481.[0m
[32m[I 2022-04-21 11:43:33,360][0m Trial 388 finished with value: 0.6847054012696481 and parameters: {'alpha': 0.857615011070272, 'ties': 'breslow'}. Best is trial 26 with value: 0.6847054012696481.[0m
[32m[I 2022-04-21 11:43:33,597][0m Trial 389 finished with value: 0.6847054012696481 and parameters: {'alpha': 0.7224732258622286, 'ties': 'efron'}. Best is trial 26 with value: 0.6847054012696481.[0m
[32m[I 2022-04-21 11:43:33,809][0m Trial 390 finished with value: 0.684367348820454 and parameters: {'alpha': 0.5536962503471949, 'ties': 'efron'}. Best is trial 26 with value: 0.6847054012696481.[0m
[32m[I 2022-04-21 11:43:34,143][0m Trial 391 finished with value: 0.6847054012696481 and parameters: {'alpha': 0.8436941727428362, 'ties': 'breslow'}. Best is trial 26 with value: 0.6847054012696481.[0m
