[32m[I 2022-04-21 11:41:05,136][0m Trial 633 finished with value: 0.7115181856172865 and parameters: {'splitter': 'best', 'min_samples_split': 0.41928391249688063, 'min_samples_leaf': 0.01574615952897415, 'min_weight_fraction_leaf': 0.016400827172296573, 'max_features': 0.4219758709221266}. Best is trial 613 with value: 0.8272742335542386.[0m
[32m[I 2022-04-21 11:41:05,400][0m Trial 634 finished with value: 0.8077768208380999 and parameters: {'splitter': 'best', 'min_samples_split': 0.11042752873546241, 'min_samples_leaf': 0.03483134265967494, 'min_weight_fraction_leaf': 0.01590611768850149, 'max_features': 0.4697944036610398}. Best is trial 613 with value: 0.8272742335542386.[0m
[32m[I 2022-04-21 11:41:05,539][0m Trial 635 finished with value: 0.6729369218481851 and parameters: {'splitter': 'best', 'min_samples_split': 0.11891285459510459, 'min_samples_leaf': 0.02429315867818967, 'min_weight_fraction_leaf': 0.2826349333794313, 'max_features': 0.4169173406321547}. Best is trial 613 with value: 0.8272742335542386.[0m
[32m[I 2022-04-21 11:41:05,835][0m Trial 636 finished with value: 0.804572047334663 and parameters: {'splitter': 'best', 'min_samples_split': 0.09304689199164372, 'min_samples_leaf': 0.0109145038832192, 'min_weight_fraction_leaf': 0.030017053902320748, 'max_features': 0.46005567869720176}. Best is trial 613 with value: 0.8272742335542386.[0m
[32m[I 2022-04-21 11:41:06,207][0m Trial 637 finished with value: 0.8223989545193173 and parameters: {'splitter': 'best', 'min_samples_split': 0.10412016945531952, 'min_samples_leaf': 0.018804794425799635, 'min_weight_fraction_leaf': 0.015947538891231114, 'max_features': 0.4295840843614485}. Best is trial 613 with value: 0.8272742335542386.[0m
[32m[I 2022-04-21 11:41:06,461][0m Trial 638 finished with value: 0.8114750407495805 and parameters: {'splitter': 'best', 'min_samples_split': 0.10703739720710284, 'min_samples_leaf': 0.010679010597705263, 'min_weight_fraction_leaf': 0.03906937009727751, 'max_features': 0.41543421864995483}. Best is trial 613 with value: 0.8272742335542386.[0m
[32m[I 2022-04-21 11:41:06,708][0m Trial 639 finished with value: 0.8127919910870185 and parameters: {'splitter': 'best', 'min_samples_split': 0.09991312404994838, 'min_samples_leaf': 0.017966470711454408, 'min_weight_fraction_leaf': 0.050415418261156725, 'max_features': 0.42272415414409453}. Best is trial 613 with value: 0.8272742335542386.[0m
[32m[I 2022-04-21 11:41:06,964][0m Trial 640 finished with value: 0.8127109987095574 and parameters: {'splitter': 'best', 'min_samples_split': 0.23899397705932762, 'min_samples_leaf': 0.009406635753390137, 'min_weight_fraction_leaf': 0.026266869767183943, 'max_features': 0.43433685997595695}. Best is trial 613 with value: 0.8272742335542386.[0m
[32m[I 2022-04-21 11:41:07,234][0m Trial 641 finished with value: 0.8135982860889271 and parameters: {'splitter': 'best', 'min_samples_split': 0.11655470115102395, 'min_samples_leaf': 0.0012694981348077504, 'min_weight_fraction_leaf': 0.07220818662995192, 'max_features': 0.41009141532143045}. Best is trial 613 with value: 0.8272742335542386.[0m
/media/san2_ssd/data/Workdir/survival/utils.py:305: RuntimeWarning: invalid value encountered in true_divide
  pdfs = np.gradient(1-survs,axis=1)/norms
/media/san2_ssd/data/Workdir/survival/utils.py:305: RuntimeWarning: invalid value encountered in true_divide
  pdfs = np.gradient(1-survs,axis=1)/norms
[32m[I 2022-04-21 11:41:07,521][0m Trial 642 finished with value: 0.8129145680499347 and parameters: {'splitter': 'best', 'min_samples_split': 0.09221049709936234, 'min_samples_leaf': 0.023207433915135377, 'min_weight_fraction_leaf': 0.02095166086935606, 'max_features': 0.397051337574283}. Best is trial 613 with value: 0.8272742335542386.[0m
[32m[I 2022-04-21 11:41:07,759][0m Trial 643 finished with value: 0.8120161186992174 and parameters: {'splitter': 'best', 'min_samples_split': 0.1073277431736945, 'min_samples_leaf': 0.017654824359472823, 'min_weight_fraction_leaf': 0.03670802369960778, 'max_features': 0.4275642077073965}. Best is trial 613 with value: 0.8272742335542386.[0m
[32m[I 2022-04-21 11:41:08,006][0m Trial 644 finished with value: 0.8024431183403363 and parameters: {'splitter': 'best', 'min_samples_split': 0.09023762841519652, 'min_samples_leaf': 0.027027662994656598, 'min_weight_fraction_leaf': 0.015951275827912788, 'max_features': 0.44903542780167865}. Best is trial 613 with value: 0.8272742335542386.[0m
[32m[I 2022-04-21 11:41:08,427][0m Trial 645 finished with value: 0.8203943678576202 and parameters: {'splitter': 'best', 'min_samples_split': 0.10255952384506851, 'min_samples_leaf': 0.009430840806549474, 'min_weight_fraction_leaf': 0.024846522834093505, 'max_features': 0.4026676115655124}. Best is trial 613 with value: 0.8272742335542386.[0m
[32m[I 2022-04-21 11:41:08,758][0m Trial 646 finished with value: 0.8075501295921951 and parameters: {'splitter': 'best', 'min_samples_split': 0.12108803959948633, 'min_samples_leaf': 0.01792368166434277, 'min_weight_fraction_leaf': 0.012773162459208516, 'max_features': 0.39113785971488807}. Best is trial 613 with value: 0.8272742335542386.[0m
[32m[I 2022-04-21 11:41:09,182][0m Trial 647 finished with value: 0.8100611529852539 and parameters: {'splitter': 'best', 'min_samples_split': 0.11380653207571316, 'min_samples_leaf': 0.032198925811668444, 'min_weight_fraction_leaf': 0.04237320110639844, 'max_features': 0.4393227277798417}. Best is trial 613 with value: 0.8272742335542386.[0m
[32m[I 2022-04-21 11:41:09,819][0m Trial 648 finished with value: 0.8063480738662566 and parameters: {'splitter': 'best', 'min_samples_split': 0.08820812228743316, 'min_samples_leaf': 0.009728912415999108, 'min_weight_fraction_leaf': 0.028091737477371117, 'max_features': 0.45631719786790226}. Best is trial 613 with value: 0.8272742335542386.[0m
[32m[I 2022-04-21 11:41:10,095][0m Trial 649 finished with value: 0.592318943253205 and parameters: {'splitter': 'best', 'min_samples_split': 0.09814026755939427, 'min_samples_leaf': 0.2304837239928582, 'min_weight_fraction_leaf': 0.012057113638883848, 'max_features': 0.4245898978536093}. Best is trial 613 with value: 0.8272742335542386.[0m
/media/san2_ssd/data/Workdir/survival/utils.py:305: RuntimeWarning: invalid value encountered in true_divide
  pdfs = np.gradient(1-survs,axis=1)/norms
[32m[I 2022-04-21 11:41:10,572][0m Trial 650 finished with value: 0.8153089448830271 and parameters: {'splitter': 'best', 'min_samples_split': 0.13496421716986257, 'min_samples_leaf': 0.02340267778389416, 'min_weight_fraction_leaf': 0.017285527307095244, 'max_features': 0.39269113353410684}. Best is trial 613 with value: 0.8272742335542386.[0m
/media/san2_ssd/data/Workdir/survival/utils.py:305: RuntimeWarning: invalid value encountered in true_divide
  pdfs = np.gradient(1-survs,axis=1)/norms
[32m[I 2022-04-21 11:41:11,641][0m Trial 651 finished with value: 0.8236360768637837 and parameters: {'splitter': 'best', 'min_samples_split': 0.10903236768690201, 'min_samples_leaf': 0.00941294390361595, 'min_weight_fraction_leaf': 0.010057235109893597, 'max_features': 0.40857453400899474}. Best is trial 613 with value: 0.8272742335542386.[0m
/media/san2_ssd/data/Workdir/survival/utils.py:305: RuntimeWarning: invalid value encountered in true_divide
  pdfs = np.gradient(1-survs,axis=1)/norms
[32m[I 2022-04-21 11:41:12,328][0m Trial 652 finished with value: 0.8217577821542378 and parameters: {'splitter': 'best', 'min_samples_split': 0.12588506490598672, 'min_samples_leaf': 0.00151917932196656, 'min_weight_fraction_leaf': 0.009664547530938698, 'max_features': 0.4094308633686591}. Best is trial 613 with value: 0.8272742335542386.[0m
/media/san2_ssd/data/Workdir/survival/utils.py:305: RuntimeWarning: invalid value encountered in true_divide
  pdfs = np.gradient(1-survs,axis=1)/norms
[32m[I 2022-04-21 11:41:12,837][0m Trial 653 finished with value: 0.8180317064416573 and parameters: {'splitter': 'best', 'min_samples_split': 0.13525495671988172, 'min_samples_leaf': 0.0017313928064516364, 'min_weight_fraction_leaf': 0.009027595130107802, 'max_features': 0.4046730490226847}. Best is trial 613 with value: 0.8272742335542386.[0m
[32m[I 2022-04-21 11:41:12,935][0m Trial 654 finished with value: 0.6674096230030003 and parameters: {'splitter': 'best', 'min_samples_split': 0.14386276263136072, 'min_samples_leaf': 0.24194830417251662, 'min_weight_fraction_leaf': 0.008680712465765171, 'max_features': 0.4093991430629032}. Best is trial 613 with value: 0.8272742335542386.[0m
[32m[I 2022-04-21 11:41:13,088][0m Trial 655 finished with value: 0.8017549121489942 and parameters: {'splitter': 'best', 'min_samples_split': 0.12673076339926412, 'min_samples_leaf': 0.11513479339569388, 'min_weight_fraction_leaf': 0.008564459518782543, 'max_features': 0.3875406522850677}. Best is trial 613 with value: 0.8272742335542386.[0m
/media/san2_ssd/data/Workdir/survival/utils.py:305: RuntimeWarning: invalid value encountered in true_divide
  pdfs = np.gradient(1-survs,axis=1)/norms
[32m[I 2022-04-21 11:41:14,028][0m Trial 656 finished with value: 0.8329453957568111 and parameters: {'splitter': 'best', 'min_samples_split': 0.12379515653827723, 'min_samples_leaf': 0.00882156039084532, 'min_weight_fraction_leaf': 0.00910641496470267, 'max_features': 0.42631970806535996}. Best is trial 656 with value: 0.8329453957568111.[0m
[32m[I 2022-04-21 11:41:14,179][0m Trial 657 finished with value: 0.468348556469091 and parameters: {'splitter': 'best', 'min_samples_split': 0.3061520299598536, 'min_samples_leaf': 0.44059467233949196, 'min_weight_fraction_leaf': 0.02286982789219503, 'max_features': 0.4445738760791476}. Best is trial 656 with value: 0.8329453957568111.[0m
[32m[I 2022-04-21 11:41:14,680][0m Trial 658 finished with value: 0.8148386097156971 and parameters: {'splitter': 'best', 'min_samples_split': 0.11532252587511027, 'min_samples_leaf': 0.01602618467782241, 'min_weight_fraction_leaf': 0.009241261098322436, 'max_features': 0.42309526744651904}. Best is trial 656 with value: 0.8329453957568111.[0m
[32m[I 2022-04-21 11:41:15,192][0m Trial 659 finished with value: 0.8154257712378165 and parameters: {'splitter': 'best', 'min_samples_split': 0.1247594649767203, 'min_samples_leaf': 0.009813629484234112, 'min_weight_fraction_leaf': 0.01872206195995783, 'max_features': 0.46541137826323103}. Best is trial 656 with value: 0.8329453957568111.[0m
[32m[I 2022-04-21 11:41:15,832][0m Trial 660 finished with value: 0.8168293005810531 and parameters: {'splitter': 'best', 'min_samples_split': 0.11262140066167765, 'min_samples_leaf': 0.0011800124421871899, 'min_weight_fraction_leaf': 0.0094979918761199, 'max_features': 0.437027026269065}. Best is trial 656 with value: 0.8329453957568111.[0m
[32m[I 2022-04-21 11:41:16,081][0m Trial 661 finished with value: 0.806521261596646 and parameters: {'splitter': 'best', 'min_samples_split': 0.10857380844608797, 'min_samples_leaf': 0.025824766096274966, 'min_weight_fraction_leaf': 0.029744974963226836, 'max_features': 0.21990654750384828}. Best is trial 656 with value: 0.8329453957568111.[0m
[32m[I 2022-04-21 11:41:16,288][0m Trial 662 finished with value: 0.8123865239259536 and parameters: {'splitter': 'best', 'min_samples_split': 0.1213312458389385, 'min_samples_leaf': 0.03682370363329053, 'min_weight_fraction_leaf': 0.01868656787935878, 'max_features': 0.37987659482164593}. Best is trial 656 with value: 0.8329453957568111.[0m
[32m[I 2022-04-21 11:41:16,527][0m Trial 663 finished with value: 0.5710980350351094 and parameters: {'splitter': 'best', 'min_samples_split': 0.2642819719239557, 'min_samples_leaf': 0.32839052354845427, 'min_weight_fraction_leaf': 0.008075168888438568, 'max_features': 0.4604253840197618}. Best is trial 656 with value: 0.8329453957568111.[0m
[32m[I 2022-04-21 11:41:17,157][0m Trial 664 finished with value: 0.8050438903992175 and parameters: {'splitter': 'best', 'min_samples_split': 0.1404502550312364, 'min_samples_leaf': 0.016281112853045444, 'min_weight_fraction_leaf': 0.11440637509539184, 'max_features': 0.42972415411251097}. Best is trial 656 with value: 0.8329453957568111.[0m
/media/san2_ssd/data/Workdir/survival/utils.py:305: RuntimeWarning: invalid value encountered in true_divide
  pdfs = np.gradient(1-survs,axis=1)/norms
[32m[I 2022-04-21 11:41:17,772][0m Trial 665 finished with value: 0.8229890255864829 and parameters: {'splitter': 'best', 'min_samples_split': 0.10506337091169715, 'min_samples_leaf': 0.010253990445893842, 'min_weight_fraction_leaf': 0.00018693449691416588, 'max_features': 0.3998621129675664}. Best is trial 656 with value: 0.8329453957568111.[0m
[32m[I 2022-04-21 11:41:18,201][0m Trial 666 finished with value: 0.8195476622658951 and parameters: {'splitter': 'best', 'min_samples_split': 0.11156255874689647, 'min_samples_leaf': 0.0013119013704867791, 'min_weight_fraction_leaf': 0.008279677133938769, 'max_features': 0.38599220871210443}. Best is trial 656 with value: 0.8329453957568111.[0m
[32m[I 2022-04-21 11:41:18,558][0m Trial 667 finished with value: 0.8097719787767288 and parameters: {'splitter': 'best', 'min_samples_split': 0.12970298008066528, 'min_samples_leaf': 0.010569449675396884, 'min_weight_fraction_leaf': 0.008134400300076899, 'max_features': 0.40256900491300684}. Best is trial 656 with value: 0.8329453957568111.[0m
[32m[I 2022-04-21 11:41:18,973][0m Trial 668 finished with value: 0.8069976448992897 and parameters: {'splitter': 'best', 'min_samples_split': 0.10437971425727226, 'min_samples_leaf': 0.010513458400537875, 'min_weight_fraction_leaf': 0.023180792443587173, 'max_features': 0.3716402590103799}. Best is trial 656 with value: 0.8329453957568111.[0m
/media/san2_ssd/data/Workdir/survival/utils.py:305: RuntimeWarning: invalid value encountered in true_divide
  pdfs = np.gradient(1-survs,axis=1)/norms
[32m[I 2022-04-21 11:41:19,369][0m Trial 669 finished with value: 0.8178464340978178 and parameters: {'splitter': 'best', 'min_samples_split': 0.11918120414541246, 'min_samples_leaf': 0.018266132682795876, 'min_weight_fraction_leaf': 0.0008818420700423928, 'max_features': 0.5519098854707511}. Best is trial 656 with value: 0.8329453957568111.[0m
/media/san2_ssd/data/Workdir/survival/utils.py:305: RuntimeWarning: invalid value encountered in true_divide
  pdfs = np.gradient(1-survs,axis=1)/norms
[32m[I 2022-04-21 11:41:19,934][0m Trial 670 finished with value: 0.8207816464958118 and parameters: {'splitter': 'best', 'min_samples_split': 0.10388257581863868, 'min_samples_leaf': 0.00106292163064769, 'min_weight_fraction_leaf': 0.017579981806966773, 'max_features': 0.45330276512547574}. Best is trial 656 with value: 0.8329453957568111.[0m
/media/san2_ssd/data/Workdir/survival/utils.py:305: RuntimeWarning: invalid value encountered in true_divide
  pdfs = np.gradient(1-survs,axis=1)/norms
[32m[I 2022-04-21 11:41:20,378][0m Trial 671 finished with value: 0.8126493916409073 and parameters: {'splitter': 'best', 'min_samples_split': 0.11680708963115874, 'min_samples_leaf': 0.010926235025094499, 'min_weight_fraction_leaf': 0.0001739567974254608, 'max_features': 0.4241518177247547}. Best is trial 656 with value: 0.8329453957568111.[0m
/media/san2_ssd/data/Workdir/survival/utils.py:305: RuntimeWarning: invalid value encountered in true_divide
  pdfs = np.gradient(1-survs,axis=1)/norms
[32m[I 2022-04-21 11:41:20,651][0m Trial 672 finished with value: 0.8025049429923301 and parameters: {'splitter': 'best', 'min_samples_split': 0.10111408562726762, 'min_samples_leaf': 0.022101067641615138, 'min_weight_fraction_leaf': 0.03245089060058373, 'max_features': 0.4727165634451461}. Best is trial 656 with value: 0.8329453957568111.[0m
/media/san2_ssd/data/Workdir/survival/utils.py:305: RuntimeWarning: invalid value encountered in true_divide
  pdfs = np.gradient(1-survs,axis=1)/norms
[32m[I 2022-04-21 11:41:20,996][0m Trial 673 finished with value: 0.8052784044685755 and parameters: {'splitter': 'best', 'min_samples_split': 0.13436551848356415, 'min_samples_leaf': 0.01625861672029398, 'min_weight_fraction_leaf': 0.014755893947139765, 'max_features': 0.39559020484455937}. Best is trial 656 with value: 0.8329453957568111.[0m
[32m[I 2022-04-21 11:41:21,070][0m Trial 674 finished with value: 0.46991866821558936 and parameters: {'splitter': 'best', 'min_samples_split': 0.10896410482886704, 'min_samples_leaf': 0.41419875118010047, 'min_weight_fraction_leaf': 0.023472798513547482, 'max_features': 0.5674342692348897}. Best is trial 656 with value: 0.8329453957568111.[0m
/media/san2_ssd/data/Workdir/survival/utils.py:305: RuntimeWarning: invalid value encountered in true_divide
  pdfs = np.gradient(1-survs,axis=1)/norms
/media/san2_ssd/data/Workdir/survival/utils.py:305: RuntimeWarning: invalid value encountered in true_divide
  pdfs = np.gradient(1-survs,axis=1)/norms
/media/san2_ssd/data/Workdir/survival/utils.py:305: RuntimeWarning: invalid value encountered in true_divide
  pdfs = np.gradient(1-survs,axis=1)/norms
[32m[I 2022-04-21 11:41:21,725][0m Trial 675 finished with value: 0.8193038169529572 and parameters: {'splitter': 'best', 'min_samples_split': 0.0963991428556377, 'min_samples_leaf': 0.008892506861898707, 'min_weight_fraction_leaf': 0.008611874030286617, 'max_features': 0.44523483024948596}. Best is trial 656 with value: 0.8329453957568111.[0m
[32m[I 2022-04-21 11:41:22,506][0m Trial 676 finished with value: 0.812263903789915 and parameters: {'splitter': 'best', 'min_samples_split': 0.11263556087262232, 'min_samples_leaf': 0.026449526489530403, 'min_weight_fraction_leaf': 0.034586242939154445, 'max_features': 0.4121327849590057}. Best is trial 656 with value: 0.8329453957568111.[0m
[32m[I 2022-04-21 11:41:23,166][0m Trial 677 finished with value: 0.8225782362770302 and parameters: {'splitter': 'best', 'min_samples_split': 0.12379861998962752, 'min_samples_leaf': 0.01934626669837503, 'min_weight_fraction_leaf': 0.00014886937697353164, 'max_features': 0.3737835502281247}. Best is trial 656 with value: 0.8329453957568111.[0m
[32m[I 2022-04-21 11:41:23,810][0m Trial 678 finished with value: 0.8122049923163012 and parameters: {'splitter': 'best', 'min_samples_split': 0.1474121496780295, 'min_samples_leaf': 0.00799375117198068, 'min_weight_fraction_leaf': 0.0007183533436546912, 'max_features': 0.371750967394633}. Best is trial 656 with value: 0.8329453957568111.[0m
[32m[I 2022-04-21 11:41:24,205][0m Trial 679 finished with value: 0.8071169677709186 and parameters: {'splitter': 'best', 'min_samples_split': 0.12665375613434718, 'min_samples_leaf': 0.031362313378219916, 'min_weight_fraction_leaf': 6.080704543393045e-05, 'max_features': 0.38813931436100785}. Best is trial 656 with value: 0.8329453957568111.[0m
[32m[I 2022-04-21 11:41:24,816][0m Trial 680 finished with value: 0.8137352610429616 and parameters: {'splitter': 'best', 'min_samples_split': 0.11929570873419448, 'min_samples_leaf': 0.018785509506311776, 'min_weight_fraction_leaf': 0.015696802743770468, 'max_features': 0.5289496656094862}. Best is trial 656 with value: 0.8329453957568111.[0m
/media/san2_ssd/data/Workdir/survival/utils.py:305: RuntimeWarning: invalid value encountered in true_divide
  pdfs = np.gradient(1-survs,axis=1)/norms
/media/san2_ssd/data/Workdir/survival/utils.py:305: RuntimeWarning: invalid value encountered in true_divide
  pdfs = np.gradient(1-survs,axis=1)/norms
/media/san2_ssd/data/Workdir/survival/utils.py:305: RuntimeWarning: invalid value encountered in true_divide
  pdfs = np.gradient(1-survs,axis=1)/norms
[32m[I 2022-04-21 11:41:26,773][0m Trial 681 finished with value: 0.8152631582281511 and parameters: {'splitter': 'best', 'min_samples_split': 0.0943188837905778, 'min_samples_leaf': 0.0011695512500537533, 'min_weight_fraction_leaf': 0.0005355118241707705, 'max_features': 0.41546802402517974}. Best is trial 656 with value: 0.8329453957568111.[0m
[32m[I 2022-04-21 11:41:27,487][0m Trial 682 finished with value: 0.8163525997495101 and parameters: {'splitter': 'best', 'min_samples_split': 0.1348119265333438, 'min_samples_leaf': 0.009834843261321077, 'min_weight_fraction_leaf': 3.2952005875516374e-05, 'max_features': 0.4329210081088378}. Best is trial 656 with value: 0.8329453957568111.[0m
[32m[I 2022-04-21 11:41:27,783][0m Trial 683 finished with value: 0.804445659693118 and parameters: {'splitter': 'best', 'min_samples_split': 0.12170101696058017, 'min_samples_leaf': 0.025060337136758714, 'min_weight_fraction_leaf': 0.015799469223229286, 'max_features': 0.39214104448374787}. Best is trial 656 with value: 0.8329453957568111.[0m
[32m[I 2022-04-21 11:41:28,046][0m Trial 684 finished with value: 0.8021719894598116 and parameters: {'splitter': 'best', 'min_samples_split': 0.10430128203212133, 'min_samples_leaf': 0.039434192769309505, 'min_weight_fraction_leaf': 0.027876023924638484, 'max_features': 0.4734606835634701}. Best is trial 656 with value: 0.8329453957568111.[0m
[32m[I 2022-04-21 11:41:28,369][0m Trial 685 finished with value: 0.812537944740836 and parameters: {'splitter': 'best', 'min_samples_split': 0.12952817706835962, 'min_samples_leaf': 0.01639094969758631, 'min_weight_fraction_leaf': 0.04465241528311993, 'max_features': 0.40736857589535286}. Best is trial 656 with value: 0.8329453957568111.[0m
/media/san2_ssd/data/Workdir/survival/utils.py:305: RuntimeWarning: invalid value encountered in true_divide
  pdfs = np.gradient(1-survs,axis=1)/norms
[32m[I 2022-04-21 11:41:28,829][0m Trial 686 finished with value: 0.8229765742233243 and parameters: {'splitter': 'best', 'min_samples_split': 0.1524668871200448, 'min_samples_leaf': 0.001150543506078368, 'min_weight_fraction_leaf': 0.010349341746364, 'max_features': 0.37244115267711103}. Best is trial 656 with value: 0.8329453957568111.[0m
