[32m[I 2022-04-22 07:29:16,827][0m Trial 853 finished with value: 0.8296407548802183 and parameters: {'loss': 'coxph', 'learning_rate': 0.002341090086788027, 'n_estimators': 890, 'criterion': 'friedman_mse', 'min_samples_split': 2, 'min_samples_leaf': 6, 'min_weight_fraction_leaf': 0.019025628736709724, 'min_impurity_decrease': 0.9613921498007353, 'max_features': 0.2288482856617389, 'subsample': 0.3380833373052701, 'dropout_rate': 0.148010947757923, 'ccp_alpha': 0.005345252038639699}. Best is trial 664 with value: 0.8342316538423719.[0m
[32m[I 2022-04-22 07:33:21,454][0m Trial 854 finished with value: 0.8319587466758687 and parameters: {'loss': 'coxph', 'learning_rate': 0.0028939929239341785, 'n_estimators': 937, 'criterion': 'friedman_mse', 'min_samples_split': 2, 'min_samples_leaf': 6, 'min_weight_fraction_leaf': 0.010169427040763774, 'min_impurity_decrease': 0.9788854649190115, 'max_features': 0.30927571596142317, 'subsample': 0.340965336146376, 'dropout_rate': 0.1690376546197563, 'ccp_alpha': 0.001975743642031837}. Best is trial 664 with value: 0.8342316538423719.[0m
[32m[I 2022-04-22 07:37:40,621][0m Trial 855 finished with value: 0.3576338914237292 and parameters: {'loss': 'coxph', 'learning_rate': 0.0028130258303673264, 'n_estimators': 959, 'criterion': 'friedman_mse', 'min_samples_split': 2, 'min_samples_leaf': 6, 'min_weight_fraction_leaf': 0.029944922206436922, 'min_impurity_decrease': 0.9996356963634258, 'max_features': 0.264009539967554, 'subsample': 0.3394372226739063, 'dropout_rate': 0.14737992030790284, 'ccp_alpha': 0.277772557818742}. Best is trial 664 with value: 0.8342316538423719.[0m
[32m[I 2022-04-22 07:40:13,595][0m Trial 856 finished with value: 0.8316613331076855 and parameters: {'loss': 'coxph', 'learning_rate': 0.0018123914876742486, 'n_estimators': 999, 'criterion': 'friedman_mse', 'min_samples_split': 2, 'min_samples_leaf': 6, 'min_weight_fraction_leaf': 0.019328506000087342, 'min_impurity_decrease': 0.9793325278911229, 'max_features': 0.30202054096715647, 'subsample': 0.3360196279023151, 'dropout_rate': 0.5602656158971708, 'ccp_alpha': 0.0014768413741565714}. Best is trial 664 with value: 0.8342316538423719.[0m
[32m[I 2022-04-22 07:43:58,102][0m Trial 857 finished with value: 0.3592904583807653 and parameters: {'loss': 'coxph', 'learning_rate': 0.001939648102661703, 'n_estimators': 988, 'criterion': 'friedman_mse', 'min_samples_split': 8, 'min_samples_leaf': 6, 'min_weight_fraction_leaf': 0.41477895220810257, 'min_impurity_decrease': 0.9749612423034736, 'max_features': 0.2860977141033404, 'subsample': 0.3466768268597692, 'dropout_rate': 0.24320012594914642, 'ccp_alpha': 0.1554184689567713}. Best is trial 664 with value: 0.8342316538423719.[0m
[32m[I 2022-04-22 07:46:10,031][0m Trial 858 finished with value: 0.8226245766929482 and parameters: {'loss': 'coxph', 'learning_rate': 0.0011417456667271023, 'n_estimators': 997, 'criterion': 'friedman_mse', 'min_samples_split': 2, 'min_samples_leaf': 6, 'min_weight_fraction_leaf': 0.037926490033331366, 'min_impurity_decrease': 0.9815758717016793, 'max_features': 0.25726910842230155, 'subsample': 0.3573920846694409, 'dropout_rate': 0.5962180673535574, 'ccp_alpha': 0.10834177153341688}. Best is trial 664 with value: 0.8342316538423719.[0m
[32m[I 2022-04-22 07:49:27,801][0m Trial 859 finished with value: 0.8228534339827289 and parameters: {'loss': 'coxph', 'learning_rate': 0.001531352099824879, 'n_estimators': 925, 'criterion': 'friedman_mse', 'min_samples_split': 2, 'min_samples_leaf': 6, 'min_weight_fraction_leaf': 0.024848508068781135, 'min_impurity_decrease': 0.9787244877289419, 'max_features': 0.3027176959910041, 'subsample': 0.3366997739285431, 'dropout_rate': 0.2524473569815127, 'ccp_alpha': 0.09362375999414616}. Best is trial 664 with value: 0.8342316538423719.[0m
[32m[I 2022-04-22 07:53:32,670][0m Trial 860 finished with value: 0.26533429437348965 and parameters: {'loss': 'coxph', 'learning_rate': 0.0014653002417934343, 'n_estimators': 936, 'criterion': 'friedman_mse', 'min_samples_split': 2, 'min_samples_leaf': 6, 'min_weight_fraction_leaf': 0.010729076515753388, 'min_impurity_decrease': 0.981304575877548, 'max_features': 0.2859603928871178, 'subsample': 0.33233889101186165, 'dropout_rate': 0.02973538253463459, 'ccp_alpha': 0.2537713373173642}. Best is trial 664 with value: 0.8342316538423719.[0m
[32m[I 2022-04-22 07:55:22,772][0m Trial 861 finished with value: 0.8255519232947333 and parameters: {'loss': 'coxph', 'learning_rate': 0.0018598728061766268, 'n_estimators': 871, 'criterion': 'friedman_mse', 'min_samples_split': 2, 'min_samples_leaf': 6, 'min_weight_fraction_leaf': 0.026247326969416434, 'min_impurity_decrease': 0.9981081370732059, 'max_features': 0.30424970721206795, 'subsample': 0.3607317503788051, 'dropout_rate': 0.5535073732888014, 'ccp_alpha': 0.08981420521265672}. Best is trial 664 with value: 0.8342316538423719.[0m
[32m[I 2022-04-22 07:58:44,325][0m Trial 862 finished with value: 0.25 and parameters: {'loss': 'coxph', 'learning_rate': 0.0027398653339820115, 'n_estimators': 942, 'criterion': 'squared_error', 'min_samples_split': 9, 'min_samples_leaf': 6, 'min_weight_fraction_leaf': 0.001051995874582403, 'min_impurity_decrease': 0.9663924046871986, 'max_features': 0.23988212639685902, 'subsample': 0.3272669821088402, 'dropout_rate': 0.23054583031733816, 'ccp_alpha': 0.17519844967980613}. Best is trial 664 with value: 0.8342316538423719.[0m
[32m[I 2022-04-22 08:03:25,505][0m Trial 863 finished with value: 0.8329133855432019 and parameters: {'loss': 'coxph', 'learning_rate': 0.0027366343077972624, 'n_estimators': 998, 'criterion': 'friedman_mse', 'min_samples_split': 2, 'min_samples_leaf': 6, 'min_weight_fraction_leaf': 0.0363994553987603, 'min_impurity_decrease': 0.9615930008774457, 'max_features': 0.27109254110735476, 'subsample': 0.349459525720025, 'dropout_rate': 0.12144533545901225, 'ccp_alpha': 0.002677322425815677}. Best is trial 664 with value: 0.8342316538423719.[0m
[32m[I 2022-04-22 08:07:49,081][0m Trial 864 finished with value: 0.25 and parameters: {'loss': 'coxph', 'learning_rate': 0.0018176138438896774, 'n_estimators': 1000, 'criterion': 'absolute_error', 'min_samples_split': 2, 'min_samples_leaf': 6, 'min_weight_fraction_leaf': 0.036345639579620954, 'min_impurity_decrease': 0.9566424804790089, 'max_features': 0.263913573841351, 'subsample': 0.31828276175269987, 'dropout_rate': 0.13795235540786366, 'ccp_alpha': 0.38790559768887345}. Best is trial 664 with value: 0.8342316538423719.[0m
[32m[I 2022-04-22 08:12:10,934][0m Trial 865 finished with value: 0.3639343369052341 and parameters: {'loss': 'coxph', 'learning_rate': 0.002662101203922545, 'n_estimators': 999, 'criterion': 'friedman_mse', 'min_samples_split': 2, 'min_samples_leaf': 6, 'min_weight_fraction_leaf': 0.01734785857461708, 'min_impurity_decrease': 0.969844418735943, 'max_features': 0.27495627212754775, 'subsample': 0.3437148767571809, 'dropout_rate': 0.10366128235449075, 'ccp_alpha': 0.24133717724206494}. Best is trial 664 with value: 0.8342316538423719.[0m
/media/san2_ssd/data/Workdir/survival/venv/lib/python3.8/site-packages/sksurv/ensemble/boosting.py:955: RuntimeWarning: divide by zero encountered in log
  time = numpy.log(time)
/media/san2_ssd/data/Workdir/survival/venv/lib/python3.8/site-packages/sksurv/ensemble/boosting.py:955: RuntimeWarning: divide by zero encountered in log
  time = numpy.log(time)
/media/san2_ssd/data/Workdir/survival/venv/lib/python3.8/site-packages/sksurv/ensemble/boosting.py:955: RuntimeWarning: divide by zero encountered in log
  time = numpy.log(time)
/media/san2_ssd/data/Workdir/survival/venv/lib/python3.8/site-packages/sksurv/ensemble/boosting.py:955: RuntimeWarning: divide by zero encountered in log
  time = numpy.log(time)
[32m[I 2022-04-22 08:13:03,247][0m Trial 866 finished with value: -0.4673929194509583 and parameters: {'loss': 'squared', 'learning_rate': 0.002042099326647626, 'n_estimators': 956, 'criterion': 'friedman_mse', 'min_samples_split': 2, 'min_samples_leaf': 6, 'min_weight_fraction_leaf': 0.027572038999758082, 'min_impurity_decrease': 0.9988464904410034, 'max_features': 0.22841975219250105, 'subsample': 0.31354819422154284, 'dropout_rate': 0.07872332895372985, 'ccp_alpha': 0.0886555884067776}. Best is trial 664 with value: 0.8342316538423719.[0m
[32m[I 2022-04-22 08:16:39,592][0m Trial 867 finished with value: 0.8349451173694054 and parameters: {'loss': 'coxph', 'learning_rate': 0.001317427140431025, 'n_estimators': 920, 'criterion': 'friedman_mse', 'min_samples_split': 2, 'min_samples_leaf': 6, 'min_weight_fraction_leaf': 0.010225982206401125, 'min_impurity_decrease': 0.9526146434683818, 'max_features': 0.2526227469550755, 'subsample': 0.3453967050783214, 'dropout_rate': 0.20825772436808648, 'ccp_alpha': 0.002156682704769007}. Best is trial 867 with value: 0.8349451173694054.[0m
[32m[I 2022-04-22 08:19:57,903][0m Trial 868 finished with value: 0.25 and parameters: {'loss': 'coxph', 'learning_rate': 0.0014786079248900379, 'n_estimators': 882, 'criterion': 'friedman_mse', 'min_samples_split': 2, 'min_samples_leaf': 6, 'min_weight_fraction_leaf': 0.035259222426314005, 'min_impurity_decrease': 0.9451331888967663, 'max_features': 0.2503680263945228, 'subsample': 0.33589575387233644, 'dropout_rate': 0.1289967013110933, 'ccp_alpha': 4.574075917026226}. Best is trial 867 with value: 0.8349451173694054.[0m
[32m[I 2022-04-22 08:23:08,076][0m Trial 869 finished with value: 0.815790987637388 and parameters: {'loss': 'coxph', 'learning_rate': 0.0018328810213417153, 'n_estimators': 867, 'criterion': 'friedman_mse', 'min_samples_split': 2, 'min_samples_leaf': 6, 'min_weight_fraction_leaf': 0.01903497120050334, 'min_impurity_decrease': 0.9811996537623033, 'max_features': 0.22023198244386827, 'subsample': 0.3085664426131698, 'dropout_rate': 0.10109932238784568, 'ccp_alpha': 0.15237754955662175}. Best is trial 867 with value: 0.8349451173694054.[0m
[32m[I 2022-04-22 08:27:00,003][0m Trial 870 finished with value: 0.8306868901862827 and parameters: {'loss': 'coxph', 'learning_rate': 0.0015030287550673771, 'n_estimators': 915, 'criterion': 'friedman_mse', 'min_samples_split': 2, 'min_samples_leaf': 6, 'min_weight_fraction_leaf': 0.011825258497843761, 'min_impurity_decrease': 0.9226346231258831, 'max_features': 0.19096221145630837, 'subsample': 0.34416534609695615, 'dropout_rate': 0.12591949212476106, 'ccp_alpha': 0.0020517114596389466}. Best is trial 867 with value: 0.8349451173694054.[0m
[32m[I 2022-04-22 08:30:14,453][0m Trial 871 finished with value: 0.8279018729621146 and parameters: {'loss': 'coxph', 'learning_rate': 0.001732643423459106, 'n_estimators': 918, 'criterion': 'friedman_mse', 'min_samples_split': 2, 'min_samples_leaf': 6, 'min_weight_fraction_leaf': 0.02385186107645127, 'min_impurity_decrease': 0.9993437013163424, 'max_features': 0.23958591506033527, 'subsample': 0.32133230809187974, 'dropout_rate': 0.21049966759318883, 'ccp_alpha': 0.0959823718322313}. Best is trial 867 with value: 0.8349451173694054.[0m
[32m[I 2022-04-22 08:33:13,239][0m Trial 872 finished with value: 0.4902359778650108 and parameters: {'loss': 'coxph', 'learning_rate': 0.0021336476228461516, 'n_estimators': 860, 'criterion': 'friedman_mse', 'min_samples_split': 2, 'min_samples_leaf': 6, 'min_weight_fraction_leaf': 0.009514474986775046, 'min_impurity_decrease': 0.9478873935531985, 'max_features': 0.2609014817030493, 'subsample': 0.3322158413073717, 'dropout_rate': 0.16831209634026031, 'ccp_alpha': 0.20934517569039726}. Best is trial 867 with value: 0.8349451173694054.[0m
[32m[I 2022-04-22 08:36:50,694][0m Trial 873 finished with value: 0.8325655209337576 and parameters: {'loss': 'coxph', 'learning_rate': 0.001111035159977093, 'n_estimators': 931, 'criterion': 'friedman_mse', 'min_samples_split': 2, 'min_samples_leaf': 6, 'min_weight_fraction_leaf': 0.03482229697270582, 'min_impurity_decrease': 0.9776222527182852, 'max_features': 0.21138003707081146, 'subsample': 0.30294914713508214, 'dropout_rate': 0.19862583025026675, 'ccp_alpha': 0.002218455948197476}. Best is trial 867 with value: 0.8349451173694054.[0m
[32m[I 2022-04-22 08:40:03,352][0m Trial 874 finished with value: 0.8244073291914928 and parameters: {'loss': 'coxph', 'learning_rate': 0.001421248127501527, 'n_estimators': 896, 'criterion': 'friedman_mse', 'min_samples_split': 2, 'min_samples_leaf': 6, 'min_weight_fraction_leaf': 0.03398344117614599, 'min_impurity_decrease': 0.20026493793451117, 'max_features': 0.20873503550365655, 'subsample': 0.3515944460129973, 'dropout_rate': 0.1972728820736525, 'ccp_alpha': 0.09934676779278546}. Best is trial 867 with value: 0.8349451173694054.[0m
[32m[I 2022-04-22 08:42:56,367][0m Trial 875 finished with value: 0.2567931854342576 and parameters: {'loss': 'coxph', 'learning_rate': 0.0023992525524108993, 'n_estimators': 849, 'criterion': 'friedman_mse', 'min_samples_split': 2, 'min_samples_leaf': 6, 'min_weight_fraction_leaf': 0.036080129509118916, 'min_impurity_decrease': 0.977250200668964, 'max_features': 0.18491195003277594, 'subsample': 0.310524044140237, 'dropout_rate': 0.18218960587008545, 'ccp_alpha': 0.296754458092898}. Best is trial 867 with value: 0.8349451173694054.[0m
[32m[I 2022-04-22 08:46:51,883][0m Trial 876 finished with value: 0.5983864083456141 and parameters: {'loss': 'coxph', 'learning_rate': 0.0011647353558068164, 'n_estimators': 933, 'criterion': 'friedman_mse', 'min_samples_split': 2, 'min_samples_leaf': 6, 'min_weight_fraction_leaf': 0.018572060498464854, 'min_impurity_decrease': 0.9825613421485716, 'max_features': 0.1696269517143072, 'subsample': 0.3304632756736008, 'dropout_rate': 0.05724732774103354, 'ccp_alpha': 0.17269464320562183}. Best is trial 867 with value: 0.8349451173694054.[0m
[32m[I 2022-04-22 08:49:55,160][0m Trial 877 finished with value: 0.7119167878096443 and parameters: {'loss': 'coxph', 'learning_rate': 0.0014159751165338126, 'n_estimators': 882, 'criterion': 'friedman_mse', 'min_samples_split': 2, 'min_samples_leaf': 6, 'min_weight_fraction_leaf': 0.009051120467927783, 'min_impurity_decrease': 0.9638620413464325, 'max_features': 0.22559682656286192, 'subsample': 0.6352476524275742, 'dropout_rate': 0.2127564689232581, 'ccp_alpha': 0.10312874703201429}. Best is trial 867 with value: 0.8349451173694054.[0m
[32m[I 2022-04-22 08:52:51,242][0m Trial 878 finished with value: 0.37240215471139937 and parameters: {'loss': 'coxph', 'learning_rate': 0.0011091024566137482, 'n_estimators': 851, 'criterion': 'friedman_mse', 'min_samples_split': 2, 'min_samples_leaf': 6, 'min_weight_fraction_leaf': 0.03856229108010174, 'min_impurity_decrease': 0.9793529689425632, 'max_features': 0.21292083915368748, 'subsample': 0.35375421725570483, 'dropout_rate': 0.17445333780802807, 'ccp_alpha': 0.2320694614889242}. Best is trial 867 with value: 0.8349451173694054.[0m
[32m[I 2022-04-22 08:56:28,006][0m Trial 879 finished with value: 0.8315421387127391 and parameters: {'loss': 'coxph', 'learning_rate': 0.00132696382083812, 'n_estimators': 923, 'criterion': 'friedman_mse', 'min_samples_split': 2, 'min_samples_leaf': 6, 'min_weight_fraction_leaf': 0.0010166348499791719, 'min_impurity_decrease': 0.9987866494310443, 'max_features': 0.12405221320860377, 'subsample': 0.29649943647637855, 'dropout_rate': 0.2013059146695031, 'ccp_alpha': 0.0033533481866287592}. Best is trial 867 with value: 0.8349451173694054.[0m
[32m[I 2022-04-22 08:59:25,912][0m Trial 880 finished with value: 0.82516834450506 and parameters: {'loss': 'coxph', 'learning_rate': 0.0016872603847531123, 'n_estimators': 886, 'criterion': 'friedman_mse', 'min_samples_split': 2, 'min_samples_leaf': 6, 'min_weight_fraction_leaf': 0.020007609190646, 'min_impurity_decrease': 0.9636698994832142, 'max_features': 0.20328619300334824, 'subsample': 0.3305343684005291, 'dropout_rate': 0.22497146545542207, 'ccp_alpha': 0.10359876435793554}. Best is trial 867 with value: 0.8349451173694054.[0m
[32m[I 2022-04-22 09:03:07,800][0m Trial 881 finished with value: 0.824355629716114 and parameters: {'loss': 'coxph', 'learning_rate': 0.00108328265227758, 'n_estimators': 956, 'criterion': 'friedman_mse', 'min_samples_split': 2, 'min_samples_leaf': 6, 'min_weight_fraction_leaf': 0.024958643530271527, 'min_impurity_decrease': 0.9582470534912341, 'max_features': 0.1599421685701103, 'subsample': 0.304258611375743, 'dropout_rate': 0.18133863965232289, 'ccp_alpha': 0.09109464194887469}. Best is trial 867 with value: 0.8349451173694054.[0m
[32m[I 2022-04-22 09:06:31,520][0m Trial 882 finished with value: 0.3748389084342848 and parameters: {'loss': 'coxph', 'learning_rate': 0.0013220013414425777, 'n_estimators': 910, 'criterion': 'friedman_mse', 'min_samples_split': 2, 'min_samples_leaf': 6, 'min_weight_fraction_leaf': 0.010713932698540589, 'min_impurity_decrease': 0.9831086693118282, 'max_features': 0.24030727562146825, 'subsample': 0.35495146958242113, 'dropout_rate': 0.15457531999378943, 'ccp_alpha': 0.2181565132520732}. Best is trial 867 with value: 0.8349451173694054.[0m
[32m[I 2022-04-22 09:09:33,986][0m Trial 883 finished with value: 0.8240680515222978 and parameters: {'loss': 'coxph', 'learning_rate': 0.0019539052889464533, 'n_estimators': 835, 'criterion': 'friedman_mse', 'min_samples_split': 2, 'min_samples_leaf': 6, 'min_weight_fraction_leaf': 0.029074553303646573, 'min_impurity_decrease': 0.9449782642109479, 'max_features': 0.19855299691515255, 'subsample': 0.32358786718213306, 'dropout_rate': 0.11937546608931482, 'ccp_alpha': 0.08996552973335778}. Best is trial 867 with value: 0.8349451173694054.[0m
/media/san2_ssd/data/Workdir/survival/venv/lib/python3.8/site-packages/sksurv/ensemble/boosting.py:955: RuntimeWarning: divide by zero encountered in log
  time = numpy.log(time)
/media/san2_ssd/data/Workdir/survival/venv/lib/python3.8/site-packages/sksurv/ensemble/boosting.py:955: RuntimeWarning: divide by zero encountered in log
  time = numpy.log(time)
/media/san2_ssd/data/Workdir/survival/venv/lib/python3.8/site-packages/sksurv/ensemble/boosting.py:955: RuntimeWarning: divide by zero encountered in log
  time = numpy.log(time)
/media/san2_ssd/data/Workdir/survival/venv/lib/python3.8/site-packages/sksurv/ensemble/boosting.py:955: RuntimeWarning: divide by zero encountered in log
  time = numpy.log(time)
[32m[I 2022-04-22 09:10:16,157][0m Trial 884 finished with value: -0.45 and parameters: {'loss': 'squared', 'learning_rate': 0.0010372984603723827, 'n_estimators': 951, 'criterion': 'squared_error', 'min_samples_split': 2, 'min_samples_leaf': 6, 'min_weight_fraction_leaf': 0.001489551464188671, 'min_impurity_decrease': 0.9767946805222814, 'max_features': 0.2393678212613308, 'subsample': 0.3439606716050397, 'dropout_rate': 0.19675626939573898, 'ccp_alpha': 0.3614267429122953}. Best is trial 867 with value: 0.8349451173694054.[0m
[32m[I 2022-04-22 09:13:31,439][0m Trial 885 finished with value: 0.831972831149163 and parameters: {'loss': 'coxph', 'learning_rate': 0.002559791148969752, 'n_estimators': 888, 'criterion': 'friedman_mse', 'min_samples_split': 2, 'min_samples_leaf': 6, 'min_weight_fraction_leaf': 0.017611845098165976, 'min_impurity_decrease': 0.964279134393177, 'max_features': 0.25827063934143357, 'subsample': 0.2838020947111014, 'dropout_rate': 0.2186755713814779, 'ccp_alpha': 0.0020636178656782147}. Best is trial 867 with value: 0.8349451173694054.[0m
[32m[I 2022-04-22 09:17:15,850][0m Trial 886 finished with value: 0.8210478092906344 and parameters: {'loss': 'coxph', 'learning_rate': 0.002180152790876078, 'n_estimators': 1000, 'criterion': 'friedman_mse', 'min_samples_split': 2, 'min_samples_leaf': 6, 'min_weight_fraction_leaf': 0.037604121654198255, 'min_impurity_decrease': 0.963177765478761, 'max_features': 0.27059619337485635, 'subsample': 0.24943583693774796, 'dropout_rate': 0.2190755348437667, 'ccp_alpha': 0.1697072851705303}. Best is trial 867 with value: 0.8349451173694054.[0m
[32m[I 2022-04-22 09:20:15,384][0m Trial 887 finished with value: 0.25 and parameters: {'loss': 'coxph', 'learning_rate': 0.0026755690170227053, 'n_estimators': 887, 'criterion': 'absolute_error', 'min_samples_split': 2, 'min_samples_leaf': 6, 'min_weight_fraction_leaf': 0.017935980505135382, 'min_impurity_decrease': 0.998496438650702, 'max_features': 0.2613130930023549, 'subsample': 0.27317588334634624, 'dropout_rate': 0.20758907477595986, 'ccp_alpha': 0.08953644620906696}. Best is trial 867 with value: 0.8349451173694054.[0m
[32m[I 2022-04-22 09:23:47,040][0m Trial 888 finished with value: 0.8313106109712998 and parameters: {'loss': 'coxph', 'learning_rate': 0.0016725939120450176, 'n_estimators': 937, 'criterion': 'friedman_mse', 'min_samples_split': 2, 'min_samples_leaf': 6, 'min_weight_fraction_leaf': 0.009312749859658713, 'min_impurity_decrease': 0.9772096616541651, 'max_features': 0.22275835647809364, 'subsample': 0.28178371889743914, 'dropout_rate': 0.23393381019329634, 'ccp_alpha': 0.001701457652244471}. Best is trial 867 with value: 0.8349451173694054.[0m
[32m[I 2022-04-22 09:26:51,693][0m Trial 889 finished with value: 0.8098726816837273 and parameters: {'loss': 'coxph', 'learning_rate': 0.0021556103202393395, 'n_estimators': 866, 'criterion': 'friedman_mse', 'min_samples_split': 2, 'min_samples_leaf': 6, 'min_weight_fraction_leaf': 0.02759064037976929, 'min_impurity_decrease': 0.9533940276735349, 'max_features': 0.28576603910766707, 'subsample': 0.2548026027002636, 'dropout_rate': 0.18485652155781124, 'ccp_alpha': 0.18837814353362436}. Best is trial 867 with value: 0.8349451173694054.[0m
