[32m[I 2022-04-21 11:39:28,945][0m Trial 324 finished with value: 0.6586187582319654 and parameters: {'splitter': 'random', 'min_samples_split': 0.33404909970458646, 'min_samples_leaf': 0.10916564796638957, 'min_weight_fraction_leaf': 0.20356290466143903, 'max_features': 0.8591874758480236}. Best is trial 11 with value: 0.6773038119717333.[0m
[32m[I 2022-04-21 11:39:29,027][0m Trial 325 finished with value: 0.6677529806498116 and parameters: {'splitter': 'random', 'min_samples_split': 0.08679315414720684, 'min_samples_leaf': 0.006218571442872664, 'min_weight_fraction_leaf': 0.010380954212473694, 'max_features': 0.993030941116596}. Best is trial 11 with value: 0.6773038119717333.[0m
[32m[I 2022-04-21 11:39:29,128][0m Trial 326 finished with value: 0.6360776294262513 and parameters: {'splitter': 'random', 'min_samples_split': 0.31360303633212505, 'min_samples_leaf': 0.03878751048659411, 'min_weight_fraction_leaf': 0.03139054808440975, 'max_features': 0.0017130195257197833}. Best is trial 11 with value: 0.6773038119717333.[0m
[32m[I 2022-04-21 11:39:29,203][0m Trial 327 finished with value: 0.6215155824977587 and parameters: {'splitter': 'random', 'min_samples_split': 0.2661500875114954, 'min_samples_leaf': 0.073808267405353, 'min_weight_fraction_leaf': 0.2248615851681185, 'max_features': 0.8392532045891501}. Best is trial 11 with value: 0.6773038119717333.[0m
[32m[I 2022-04-21 11:39:29,283][0m Trial 328 finished with value: 0.6738476114655684 and parameters: {'splitter': 'random', 'min_samples_split': 0.26193375837874366, 'min_samples_leaf': 0.17751232706606646, 'min_weight_fraction_leaf': 0.14892974131885212, 'max_features': 0.8358422808734312}. Best is trial 11 with value: 0.6773038119717333.[0m
[32m[I 2022-04-21 11:39:29,359][0m Trial 329 finished with value: 0.5 and parameters: {'splitter': 'random', 'min_samples_split': 0.19951808649805491, 'min_samples_leaf': 0.16074445131997336, 'min_weight_fraction_leaf': 0.15007792828755476, 'max_features': 0.24819506082988635}. Best is trial 11 with value: 0.6773038119717333.[0m
[32m[I 2022-04-21 11:39:29,458][0m Trial 330 finished with value: 0.6738476114655684 and parameters: {'splitter': 'random', 'min_samples_split': 0.08081107538584187, 'min_samples_leaf': 0.1728044912561018, 'min_weight_fraction_leaf': 0.003078526060902531, 'max_features': 0.9367262837440613}. Best is trial 11 with value: 0.6773038119717333.[0m
[32m[I 2022-04-21 11:39:29,518][0m Trial 331 finished with value: 0.6569812493504692 and parameters: {'splitter': 'random', 'min_samples_split': 0.0796475701901435, 'min_samples_leaf': 0.0641102302670465, 'min_weight_fraction_leaf': 0.004764904434668158, 'max_features': 0.9330670349396967}. Best is trial 11 with value: 0.6773038119717333.[0m
[32m[I 2022-04-21 11:39:29,587][0m Trial 332 finished with value: 0.6738476114655684 and parameters: {'splitter': 'random', 'min_samples_split': 0.4198932869420339, 'min_samples_leaf': 0.05400688249052182, 'min_weight_fraction_leaf': 0.2012244753561296, 'max_features': 0.8827932742468712}. Best is trial 11 with value: 0.6773038119717333.[0m
[32m[I 2022-04-21 11:39:29,660][0m Trial 333 finished with value: 0.6738476114655684 and parameters: {'splitter': 'random', 'min_samples_split': 0.437888295267848, 'min_samples_leaf': 0.0013606207374004579, 'min_weight_fraction_leaf': 0.18766086795475873, 'max_features': 0.9730336905994834}. Best is trial 11 with value: 0.6773038119717333.[0m
[32m[I 2022-04-21 11:39:29,751][0m Trial 334 finished with value: 0.6738476114655684 and parameters: {'splitter': 'random', 'min_samples_split': 0.4353490200104449, 'min_samples_leaf': 0.0031658254620117567, 'min_weight_fraction_leaf': 0.18434035606197355, 'max_features': 0.960113647699594}. Best is trial 11 with value: 0.6773038119717333.[0m
[32m[I 2022-04-21 11:39:29,869][0m Trial 335 finished with value: 0.5962367254829114 and parameters: {'splitter': 'random', 'min_samples_split': 0.453405652347351, 'min_samples_leaf': 0.028321500555476126, 'min_weight_fraction_leaf': 0.16552770464948485, 'max_features': 0.627527479718246}. Best is trial 11 with value: 0.6773038119717333.[0m
[32m[I 2022-04-21 11:39:30,008][0m Trial 336 finished with value: 0.662800366349585 and parameters: {'splitter': 'random', 'min_samples_split': 0.4049086119915541, 'min_samples_leaf': 0.13651425988033025, 'min_weight_fraction_leaf': 0.16381093961775714, 'max_features': 0.8803690813300313}. Best is trial 11 with value: 0.6773038119717333.[0m
[32m[I 2022-04-21 11:39:30,122][0m Trial 337 finished with value: 0.6738476114655684 and parameters: {'splitter': 'random', 'min_samples_split': 0.19665993687159514, 'min_samples_leaf': 0.044635875511123746, 'min_weight_fraction_leaf': 0.19546880869178468, 'max_features': 0.9985189779575744}. Best is trial 11 with value: 0.6773038119717333.[0m
[32m[I 2022-04-21 11:39:30,213][0m Trial 338 finished with value: 0.6738476114655684 and parameters: {'splitter': 'random', 'min_samples_split': 0.27634110194169115, 'min_samples_leaf': 0.13337386970423673, 'min_weight_fraction_leaf': 0.17592993267659374, 'max_features': 0.9112207470609147}. Best is trial 11 with value: 0.6773038119717333.[0m
[32m[I 2022-04-21 11:39:30,332][0m Trial 339 finished with value: 0.6738476114655684 and parameters: {'splitter': 'random', 'min_samples_split': 0.3021029538012807, 'min_samples_leaf': 0.1443364677131336, 'min_weight_fraction_leaf': 0.17568961394577898, 'max_features': 0.9072693630687899}. Best is trial 11 with value: 0.6773038119717333.[0m
[32m[I 2022-04-21 11:39:30,481][0m Trial 340 finished with value: 0.6738476114655684 and parameters: {'splitter': 'random', 'min_samples_split': 0.2925224590710743, 'min_samples_leaf': 0.1271921403595682, 'min_weight_fraction_leaf': 0.16953362848185144, 'max_features': 0.9243851473082153}. Best is trial 11 with value: 0.6773038119717333.[0m
[32m[I 2022-04-21 11:39:30,572][0m Trial 341 finished with value: 0.5283695882293453 and parameters: {'splitter': 'random', 'min_samples_split': 0.020900339461894183, 'min_samples_leaf': 0.26277875126952865, 'min_weight_fraction_leaf': 0.2136326403402761, 'max_features': 0.8953417937345767}. Best is trial 11 with value: 0.6773038119717333.[0m
[32m[I 2022-04-21 11:39:30,673][0m Trial 342 finished with value: 0.6636900948801576 and parameters: {'splitter': 'best', 'min_samples_split': 0.3670296631186854, 'min_samples_leaf': 0.213252686782522, 'min_weight_fraction_leaf': 0.14437194860160274, 'max_features': 0.849195379713157}. Best is trial 11 with value: 0.6773038119717333.[0m
[32m[I 2022-04-21 11:39:30,756][0m Trial 343 finished with value: 0.6738476114655684 and parameters: {'splitter': 'random', 'min_samples_split': 0.3926389507782694, 'min_samples_leaf': 0.10700124354573204, 'min_weight_fraction_leaf': 0.18663738458342327, 'max_features': 0.9175557404996082}. Best is trial 11 with value: 0.6773038119717333.[0m
[32m[I 2022-04-21 11:39:30,817][0m Trial 344 finished with value: 0.6502080893344752 and parameters: {'splitter': 'random', 'min_samples_split': 0.2515909716641052, 'min_samples_leaf': 0.14953010457609017, 'min_weight_fraction_leaf': 0.04364312954934435, 'max_features': 0.8993477195924807}. Best is trial 11 with value: 0.6773038119717333.[0m
[32m[I 2022-04-21 11:39:30,878][0m Trial 345 finished with value: 0.6586187582319654 and parameters: {'splitter': 'random', 'min_samples_split': 0.2130681725877973, 'min_samples_leaf': 0.16946821621529123, 'min_weight_fraction_leaf': 0.2068145749215477, 'max_features': 0.8299978721362888}. Best is trial 11 with value: 0.6773038119717333.[0m
[32m[I 2022-04-21 11:39:30,985][0m Trial 346 finished with value: 0.5 and parameters: {'splitter': 'random', 'min_samples_split': 0.3289334048130259, 'min_samples_leaf': 0.015126118429158186, 'min_weight_fraction_leaf': 0.29886012728280004, 'max_features': 0.9781084386985759}. Best is trial 11 with value: 0.6773038119717333.[0m
[32m[I 2022-04-21 11:39:31,167][0m Trial 347 finished with value: 0.5467050366078425 and parameters: {'splitter': 'random', 'min_samples_split': 0.06171863093626524, 'min_samples_leaf': 0.14945477036638405, 'min_weight_fraction_leaf': 0.25150989965636183, 'max_features': 0.9292272911195744}. Best is trial 11 with value: 0.6773038119717333.[0m
[32m[I 2022-04-21 11:39:31,280][0m Trial 348 finished with value: 0.6738476114655684 and parameters: {'splitter': 'random', 'min_samples_split': 0.4013884034945032, 'min_samples_leaf': 0.18189124338034907, 'min_weight_fraction_leaf': 0.1580630570617031, 'max_features': 0.9447673238283387}. Best is trial 11 with value: 0.6773038119717333.[0m
[32m[I 2022-04-21 11:39:31,406][0m Trial 349 finished with value: 0.6738476114655684 and parameters: {'splitter': 'random', 'min_samples_split': 0.17397215275525482, 'min_samples_leaf': 0.19197049152083298, 'min_weight_fraction_leaf': 0.1282935962372757, 'max_features': 0.8161817498229664}. Best is trial 11 with value: 0.6773038119717333.[0m
[32m[I 2022-04-21 11:39:31,472][0m Trial 350 finished with value: 0.5 and parameters: {'splitter': 'random', 'min_samples_split': 0.16372877247867387, 'min_samples_leaf': 0.18604690347431876, 'min_weight_fraction_leaf': 0.13272519427331414, 'max_features': 0.7946911911474929}. Best is trial 11 with value: 0.6773038119717333.[0m
[32m[I 2022-04-21 11:39:31,542][0m Trial 351 finished with value: 0.6543938115635641 and parameters: {'splitter': 'random', 'min_samples_split': 0.05052742149910869, 'min_samples_leaf': 0.15443651106357997, 'min_weight_fraction_leaf': 0.14189259182611363, 'max_features': 0.9573009182557419}. Best is trial 11 with value: 0.6773038119717333.[0m
[32m[I 2022-04-21 11:39:31,718][0m Trial 352 finished with value: 0.6738476114655684 and parameters: {'splitter': 'random', 'min_samples_split': 0.1521812052985413, 'min_samples_leaf': 0.16747346433497703, 'min_weight_fraction_leaf': 0.15703737868862766, 'max_features': 0.9720995620493246}. Best is trial 11 with value: 0.6773038119717333.[0m
[32m[I 2022-04-21 11:39:31,809][0m Trial 353 finished with value: 0.5 and parameters: {'splitter': 'random', 'min_samples_split': 0.25215300242195515, 'min_samples_leaf': 0.22371795209151046, 'min_weight_fraction_leaf': 0.07050423889582953, 'max_features': 0.5117678685384612}. Best is trial 11 with value: 0.6773038119717333.[0m
[32m[I 2022-04-21 11:39:31,882][0m Trial 354 finished with value: 0.6738476114655684 and parameters: {'splitter': 'random', 'min_samples_split': 0.15858606322849142, 'min_samples_leaf': 0.02623765174174786, 'min_weight_fraction_leaf': 0.18034420124333758, 'max_features': 0.9347048301598556}. Best is trial 11 with value: 0.6773038119717333.[0m
[32m[I 2022-04-21 11:39:31,981][0m Trial 355 finished with value: 0.5 and parameters: {'splitter': 'random', 'min_samples_split': 0.4237962717604543, 'min_samples_leaf': 0.12415544645425144, 'min_weight_fraction_leaf': 0.26709118022067396, 'max_features': 0.8910592979588157}. Best is trial 11 with value: 0.6773038119717333.[0m
[32m[I 2022-04-21 11:39:32,044][0m Trial 356 finished with value: 0.5 and parameters: {'splitter': 'random', 'min_samples_split': 0.2786684875844741, 'min_samples_leaf': 0.04948243877237413, 'min_weight_fraction_leaf': 0.36743809044802445, 'max_features': 0.9329567061077223}. Best is trial 11 with value: 0.6773038119717333.[0m
[32m[I 2022-04-21 11:39:32,114][0m Trial 357 finished with value: 0.662800366349585 and parameters: {'splitter': 'random', 'min_samples_split': 0.2721241205775259, 'min_samples_leaf': 0.15400364016427182, 'min_weight_fraction_leaf': 0.16597335096125018, 'max_features': 0.9032905910573998}. Best is trial 11 with value: 0.6773038119717333.[0m
[32m[I 2022-04-21 11:39:32,222][0m Trial 358 finished with value: 0.6647456324911225 and parameters: {'splitter': 'random', 'min_samples_split': 0.045033280025012445, 'min_samples_leaf': 0.07943831733629549, 'min_weight_fraction_leaf': 0.0954942161530339, 'max_features': 0.9915441783913801}. Best is trial 11 with value: 0.6773038119717333.[0m
[32m[I 2022-04-21 11:39:32,265][0m Trial 359 finished with value: 0.6738476114655684 and parameters: {'splitter': 'random', 'min_samples_split': 0.40796951898243783, 'min_samples_leaf': 0.2012972934926111, 'min_weight_fraction_leaf': 0.07748270060251546, 'max_features': 0.8838625362333508}. Best is trial 11 with value: 0.6773038119717333.[0m
[32m[I 2022-04-21 11:39:32,297][0m Trial 360 finished with value: 0.654889188235752 and parameters: {'splitter': 'random', 'min_samples_split': 0.12407202135135387, 'min_samples_leaf': 0.03657065753678574, 'min_weight_fraction_leaf': 0.05441741633724568, 'max_features': 0.9472467625784432}. Best is trial 11 with value: 0.6773038119717333.[0m
[32m[I 2022-04-21 11:39:32,329][0m Trial 361 finished with value: 0.6665385065440175 and parameters: {'splitter': 'best', 'min_samples_split': 0.20445696739191666, 'min_samples_leaf': 0.11533527055922702, 'min_weight_fraction_leaf': 0.17136619051693208, 'max_features': 0.9771292777918769}. Best is trial 11 with value: 0.6773038119717333.[0m
[32m[I 2022-04-21 11:39:32,362][0m Trial 362 finished with value: 0.6738476114655684 and parameters: {'splitter': 'random', 'min_samples_split': 0.2431711629666852, 'min_samples_leaf': 0.022658984374222233, 'min_weight_fraction_leaf': 0.18086990279650147, 'max_features': 0.820249086352968}. Best is trial 11 with value: 0.6773038119717333.[0m
[32m[I 2022-04-21 11:39:32,402][0m Trial 363 finished with value: 0.5 and parameters: {'splitter': 'random', 'min_samples_split': 0.007824666254659041, 'min_samples_leaf': 0.01106387817359758, 'min_weight_fraction_leaf': 0.18719564698071983, 'max_features': 0.5915611037581585}. Best is trial 11 with value: 0.6773038119717333.[0m
[32m[I 2022-04-21 11:39:32,469][0m Trial 364 finished with value: 0.6738476114655684 and parameters: {'splitter': 'random', 'min_samples_split': 0.28669969145176166, 'min_samples_leaf': 0.17559100696000887, 'min_weight_fraction_leaf': 0.15149317433216453, 'max_features': 0.8512670949531492}. Best is trial 11 with value: 0.6773038119717333.[0m
[32m[I 2022-04-21 11:39:32,538][0m Trial 365 finished with value: 0.662800366349585 and parameters: {'splitter': 'random', 'min_samples_split': 0.040395844906688114, 'min_samples_leaf': 0.16423866910949955, 'min_weight_fraction_leaf': 0.1516207189221845, 'max_features': 0.9632830896340937}. Best is trial 11 with value: 0.6773038119717333.[0m
[32m[I 2022-04-21 11:39:32,600][0m Trial 366 finished with value: 0.6738476114655684 and parameters: {'splitter': 'random', 'min_samples_split': 0.03369624788478677, 'min_samples_leaf': 0.17155548719228642, 'min_weight_fraction_leaf': 0.1976357169197123, 'max_features': 0.9708474916473804}. Best is trial 11 with value: 0.6773038119717333.[0m
[32m[I 2022-04-21 11:39:32,659][0m Trial 367 finished with value: 0.6640701022932763 and parameters: {'splitter': 'random', 'min_samples_split': 0.3542608558595526, 'min_samples_leaf': 0.09243231549805553, 'min_weight_fraction_leaf': 0.028194463013606674, 'max_features': 0.9125280044558295}. Best is trial 11 with value: 0.6773038119717333.[0m
[32m[I 2022-04-21 11:39:32,692][0m Trial 368 finished with value: 0.6738476114655684 and parameters: {'splitter': 'random', 'min_samples_split': 0.37508533421614204, 'min_samples_leaf': 0.07320230769273778, 'min_weight_fraction_leaf': 0.19715070866457274, 'max_features': 0.9186852888349039}. Best is trial 11 with value: 0.6773038119717333.[0m
[32m[I 2022-04-21 11:39:32,725][0m Trial 369 finished with value: 0.6738476114655684 and parameters: {'splitter': 'random', 'min_samples_split': 0.18547655559751944, 'min_samples_leaf': 0.19834587166892256, 'min_weight_fraction_leaf': 0.12214548254928681, 'max_features': 0.8508095640835647}. Best is trial 11 with value: 0.6773038119717333.[0m
[32m[I 2022-04-21 11:39:32,765][0m Trial 370 finished with value: 0.6738476114655684 and parameters: {'splitter': 'random', 'min_samples_split': 0.1833116218756419, 'min_samples_leaf': 0.19736092185888754, 'min_weight_fraction_leaf': 0.13313698868107685, 'max_features': 0.8404350882337251}. Best is trial 11 with value: 0.6773038119717333.[0m
[32m[I 2022-04-21 11:39:32,833][0m Trial 371 finished with value: 0.6738476114655684 and parameters: {'splitter': 'random', 'min_samples_split': 0.2250831038592611, 'min_samples_leaf': 0.19282143294574075, 'min_weight_fraction_leaf': 0.08986256907897429, 'max_features': 0.8040935122037033}. Best is trial 11 with value: 0.6773038119717333.[0m
[32m[I 2022-04-21 11:39:32,892][0m Trial 372 finished with value: 0.5 and parameters: {'splitter': 'random', 'min_samples_split': 0.22889375854259134, 'min_samples_leaf': 0.21331818168689853, 'min_weight_fraction_leaf': 0.0890670445630908, 'max_features': 0.7671359323601649}. Best is trial 11 with value: 0.6773038119717333.[0m
[32m[I 2022-04-21 11:39:32,935][0m Trial 373 finished with value: 0.6738476114655684 and parameters: {'splitter': 'random', 'min_samples_split': 0.30611918095962365, 'min_samples_leaf': 0.042833278908273896, 'min_weight_fraction_leaf': 0.17684480197115404, 'max_features': 0.9073567520433119}. Best is trial 11 with value: 0.6773038119717333.[0m
[32m[I 2022-04-21 11:39:32,967][0m Trial 374 finished with value: 0.6738476114655684 and parameters: {'splitter': 'random', 'min_samples_split': 0.3515329158288565, 'min_samples_leaf': 0.12619852843341256, 'min_weight_fraction_leaf': 0.18530463183204135, 'max_features': 0.8717864397818886}. Best is trial 11 with value: 0.6773038119717333.[0m
[32m[I 2022-04-21 11:39:33,024][0m Trial 375 finished with value: 0.6640701022932763 and parameters: {'splitter': 'random', 'min_samples_split': 0.36659683971011475, 'min_samples_leaf': 0.11247654970136374, 'min_weight_fraction_leaf': 0.01769207355735771, 'max_features': 0.8948374473351376}. Best is trial 11 with value: 0.6773038119717333.[0m
[32m[I 2022-04-21 11:39:33,108][0m Trial 376 finished with value: 0.6738476114655684 and parameters: {'splitter': 'random', 'min_samples_split': 0.3805931688805705, 'min_samples_leaf': 0.014046756192182774, 'min_weight_fraction_leaf': 0.19165021969558912, 'max_features': 0.8908756322716864}. Best is trial 11 with value: 0.6773038119717333.[0m
[32m[I 2022-04-21 11:39:33,172][0m Trial 377 finished with value: 0.6738476114655684 and parameters: {'splitter': 'random', 'min_samples_split': 0.3639519410756458, 'min_samples_leaf': 0.10842614659491315, 'min_weight_fraction_leaf': 0.17679239572726554, 'max_features': 0.8679881339628227}. Best is trial 11 with value: 0.6773038119717333.[0m
[32m[I 2022-04-21 11:39:33,223][0m Trial 378 finished with value: 0.6586187582319654 and parameters: {'splitter': 'random', 'min_samples_split': 0.421373206650061, 'min_samples_leaf': 0.11959818129849666, 'min_weight_fraction_leaf': 0.20829028437119226, 'max_features': 0.8867602700741608}. Best is trial 11 with value: 0.6773038119717333.[0m
[32m[I 2022-04-21 11:39:33,262][0m Trial 379 finished with value: 0.6738476114655684 and parameters: {'splitter': 'random', 'min_samples_split': 0.05049736589427931, 'min_samples_leaf': 0.17625659014909278, 'min_weight_fraction_leaf': 0.0074281170939337025, 'max_features': 0.9453813570850116}. Best is trial 11 with value: 0.6773038119717333.[0m
[32m[I 2022-04-21 11:39:33,304][0m Trial 380 finished with value: 0.6640701022932763 and parameters: {'splitter': 'random', 'min_samples_split': 0.2949398376554306, 'min_samples_leaf': 0.13498973191462088, 'min_weight_fraction_leaf': 0.03211023745594057, 'max_features': 0.9283342660582441}. Best is trial 11 with value: 0.6773038119717333.[0m
[32m[I 2022-04-21 11:39:33,354][0m Trial 381 finished with value: 0.6636900948801576 and parameters: {'splitter': 'best', 'min_samples_split': 0.056882956410475624, 'min_samples_leaf': 0.1832616209667323, 'min_weight_fraction_leaf': 0.14544846330573447, 'max_features': 0.9771783729978365}. Best is trial 11 with value: 0.6773038119717333.[0m
[32m[I 2022-04-21 11:39:33,421][0m Trial 382 finished with value: 0.662800366349585 and parameters: {'splitter': 'random', 'min_samples_split': 0.21372392841761922, 'min_samples_leaf': 0.08106645392005822, 'min_weight_fraction_leaf': 0.16234497361923644, 'max_features': 0.954286612274939}. Best is trial 11 with value: 0.6773038119717333.[0m
[32m[I 2022-04-21 11:39:33,466][0m Trial 383 finished with value: 0.5 and parameters: {'splitter': 'random', 'min_samples_split': 0.26251211009376874, 'min_samples_leaf': 0.09233299659311621, 'min_weight_fraction_leaf': 0.3279246871681479, 'max_features': 0.8618763841317058}. Best is trial 11 with value: 0.6773038119717333.[0m
[32m[I 2022-04-21 11:39:33,539][0m Trial 384 finished with value: 0.6738476114655684 and parameters: {'splitter': 'random', 'min_samples_split': 0.2996294314135015, 'min_samples_leaf': 0.1361812434226288, 'min_weight_fraction_leaf': 0.1680054195068858, 'max_features': 0.9174525559581326}. Best is trial 11 with value: 0.6773038119717333.[0m
[32m[I 2022-04-21 11:39:33,605][0m Trial 385 finished with value: 0.6738476114655684 and parameters: {'splitter': 'random', 'min_samples_split': 0.3939246924335021, 'min_samples_leaf': 0.11866577378207013, 'min_weight_fraction_leaf': 0.19302970535741504, 'max_features': 0.9005324216904809}. Best is trial 11 with value: 0.6773038119717333.[0m
[32m[I 2022-04-21 11:39:33,637][0m Trial 386 finished with value: 0.6738476114655684 and parameters: {'splitter': 'random', 'min_samples_split': 0.3751016938252603, 'min_samples_leaf': 0.1266750555444746, 'min_weight_fraction_leaf': 0.18662938963617126, 'max_features': 0.8698440152813196}. Best is trial 11 with value: 0.6773038119717333.[0m
