[32m[I 2022-04-21 11:44:22,471][0m Trial 606 finished with value: 0.684367348820454 and parameters: {'alpha': 0.5757627403208165, 'ties': 'efron'}. Best is trial 26 with value: 0.6847054012696481.[0m
[32m[I 2022-04-21 11:44:22,715][0m Trial 607 finished with value: 0.684367348820454 and parameters: {'alpha': 0.6798272007727927, 'ties': 'efron'}. Best is trial 26 with value: 0.6847054012696481.[0m
[32m[I 2022-04-21 11:44:23,182][0m Trial 608 finished with value: 0.6847054012696481 and parameters: {'alpha': 0.7121600386264816, 'ties': 'efron'}. Best is trial 26 with value: 0.6847054012696481.[0m
[32m[I 2022-04-21 11:44:23,622][0m Trial 609 finished with value: 0.6847054012696481 and parameters: {'alpha': 0.7793040105297742, 'ties': 'efron'}. Best is trial 26 with value: 0.6847054012696481.[0m
[32m[I 2022-04-21 11:44:23,898][0m Trial 610 finished with value: 0.684367348820454 and parameters: {'alpha': 0.6453481788013045, 'ties': 'efron'}. Best is trial 26 with value: 0.6847054012696481.[0m
[32m[I 2022-04-21 11:44:24,179][0m Trial 611 finished with value: 0.684367348820454 and parameters: {'alpha': 0.519424065160428, 'ties': 'efron'}. Best is trial 26 with value: 0.6847054012696481.[0m
[32m[I 2022-04-21 11:44:24,384][0m Trial 612 finished with value: 0.684367348820454 and parameters: {'alpha': 0.5028926788470545, 'ties': 'efron'}. Best is trial 26 with value: 0.6847054012696481.[0m
[32m[I 2022-04-21 11:44:24,523][0m Trial 613 finished with value: 0.684367348820454 and parameters: {'alpha': 0.6150777983032215, 'ties': 'efron'}. Best is trial 26 with value: 0.6847054012696481.[0m
[32m[I 2022-04-21 11:44:24,705][0m Trial 614 finished with value: 0.684367348820454 and parameters: {'alpha': 0.6676368182723892, 'ties': 'efron'}. Best is trial 26 with value: 0.6847054012696481.[0m
[32m[I 2022-04-21 11:44:24,984][0m Trial 615 finished with value: 0.682613451992282 and parameters: {'alpha': 2.248627843583009, 'ties': 'efron'}. Best is trial 26 with value: 0.6847054012696481.[0m
[32m[I 2022-04-21 11:44:25,263][0m Trial 616 finished with value: 0.6847054012696481 and parameters: {'alpha': 0.7793711697579433, 'ties': 'efron'}. Best is trial 26 with value: 0.6847054012696481.[0m
[32m[I 2022-04-21 11:44:25,550][0m Trial 617 finished with value: 0.684367348820454 and parameters: {'alpha': 0.3716502349651129, 'ties': 'efron'}. Best is trial 26 with value: 0.6847054012696481.[0m
[32m[I 2022-04-21 11:44:25,818][0m Trial 618 finished with value: 0.6829090813866752 and parameters: {'alpha': 0.9296127800101635, 'ties': 'efron'}. Best is trial 26 with value: 0.6847054012696481.[0m
[32m[I 2022-04-21 11:44:26,024][0m Trial 619 finished with value: 0.6829496894793843 and parameters: {'alpha': 2.8567783895431043, 'ties': 'efron'}. Best is trial 26 with value: 0.6847054012696481.[0m
[32m[I 2022-04-21 11:44:26,162][0m Trial 620 finished with value: 0.6847054012696481 and parameters: {'alpha': 0.7618509447045334, 'ties': 'efron'}. Best is trial 26 with value: 0.6847054012696481.[0m
[32m[I 2022-04-21 11:44:26,343][0m Trial 621 finished with value: 0.6829090813866752 and parameters: {'alpha': 1.0346486459924258, 'ties': 'breslow'}. Best is trial 26 with value: 0.6847054012696481.[0m
[32m[I 2022-04-21 11:44:26,639][0m Trial 622 finished with value: 0.6829090813866752 and parameters: {'alpha': 0.8753774793887238, 'ties': 'efron'}. Best is trial 26 with value: 0.6847054012696481.[0m
[32m[I 2022-04-21 11:44:26,944][0m Trial 623 finished with value: 0.6847054012696481 and parameters: {'alpha': 0.9096560317846136, 'ties': 'breslow'}. Best is trial 26 with value: 0.6847054012696481.[0m
[32m[I 2022-04-21 11:44:27,334][0m Trial 624 finished with value: 0.6847054012696481 and parameters: {'alpha': 0.8442756511685253, 'ties': 'efron'}. Best is trial 26 with value: 0.6847054012696481.[0m
[32m[I 2022-04-21 11:44:27,679][0m Trial 625 finished with value: 0.6829090813866752 and parameters: {'alpha': 1.0107971916587872, 'ties': 'breslow'}. Best is trial 26 with value: 0.6847054012696481.[0m
[32m[I 2022-04-21 11:44:27,981][0m Trial 626 finished with value: 0.684367348820454 and parameters: {'alpha': 0.4298202553274924, 'ties': 'efron'}. Best is trial 26 with value: 0.6847054012696481.[0m
[32m[I 2022-04-21 11:44:28,147][0m Trial 627 finished with value: 0.684367348820454 and parameters: {'alpha': 0.6829113314162674, 'ties': 'efron'}. Best is trial 26 with value: 0.6847054012696481.[0m
[32m[I 2022-04-21 11:44:28,443][0m Trial 628 finished with value: 0.6847054012696481 and parameters: {'alpha': 0.8241738483144446, 'ties': 'efron'}. Best is trial 26 with value: 0.6847054012696481.[0m
[32m[I 2022-04-21 11:44:28,567][0m Trial 629 finished with value: 0.6829090813866752 and parameters: {'alpha': 1.1125291754974564, 'ties': 'breslow'}. Best is trial 26 with value: 0.6847054012696481.[0m
[32m[I 2022-04-21 11:44:28,819][0m Trial 630 finished with value: 0.6829090813866752 and parameters: {'alpha': 0.9516744728319464, 'ties': 'efron'}. Best is trial 26 with value: 0.6847054012696481.[0m
[32m[I 2022-04-21 11:44:28,998][0m Trial 631 finished with value: 0.6832683453632697 and parameters: {'alpha': 1.9924120856780643, 'ties': 'efron'}. Best is trial 26 with value: 0.6847054012696481.[0m
[32m[I 2022-04-21 11:44:29,202][0m Trial 632 finished with value: 0.6847054012696481 and parameters: {'alpha': 0.9241599882638395, 'ties': 'breslow'}. Best is trial 26 with value: 0.6847054012696481.[0m
[32m[I 2022-04-21 11:44:29,336][0m Trial 633 finished with value: 0.6829090813866752 and parameters: {'alpha': 1.1060224868190298, 'ties': 'efron'}. Best is trial 26 with value: 0.6847054012696481.[0m
[32m[I 2022-04-21 11:44:29,461][0m Trial 634 finished with value: 0.6829090813866752 and parameters: {'alpha': 0.9692444792608153, 'ties': 'breslow'}. Best is trial 26 with value: 0.6847054012696481.[0m
[32m[I 2022-04-21 11:44:29,714][0m Trial 635 finished with value: 0.6814469677485105 and parameters: {'alpha': 4.458955093274732, 'ties': 'efron'}. Best is trial 26 with value: 0.6847054012696481.[0m
[32m[I 2022-04-21 11:44:29,851][0m Trial 636 finished with value: 0.6829090813866752 and parameters: {'alpha': 0.9268627539105213, 'ties': 'efron'}. Best is trial 26 with value: 0.6847054012696481.[0m
[32m[I 2022-04-21 11:44:30,131][0m Trial 637 finished with value: 0.6847054012696481 and parameters: {'alpha': 0.8624911820782312, 'ties': 'efron'}. Best is trial 26 with value: 0.6847054012696481.[0m
[32m[I 2022-04-21 11:44:30,269][0m Trial 638 finished with value: 0.6847054012696481 and parameters: {'alpha': 0.8104045400513119, 'ties': 'efron'}. Best is trial 26 with value: 0.6847054012696481.[0m
[32m[I 2022-04-21 11:44:30,568][0m Trial 639 finished with value: 0.6847054012696481 and parameters: {'alpha': 0.8123142653913543, 'ties': 'efron'}. Best is trial 26 with value: 0.6847054012696481.[0m
[32m[I 2022-04-21 11:44:30,882][0m Trial 640 finished with value: 0.6847054012696481 and parameters: {'alpha': 0.8135164002020805, 'ties': 'efron'}. Best is trial 26 with value: 0.6847054012696481.[0m
[32m[I 2022-04-21 11:44:31,120][0m Trial 641 finished with value: 0.6847054012696481 and parameters: {'alpha': 0.7512912788053264, 'ties': 'breslow'}. Best is trial 26 with value: 0.6847054012696481.[0m
[32m[I 2022-04-21 11:44:31,342][0m Trial 642 finished with value: 0.6829090813866752 and parameters: {'alpha': 1.0086270253332605, 'ties': 'breslow'}. Best is trial 26 with value: 0.6847054012696481.[0m
[32m[I 2022-04-21 11:44:31,477][0m Trial 643 finished with value: 0.6829090813866752 and parameters: {'alpha': 0.9169015956513114, 'ties': 'efron'}. Best is trial 26 with value: 0.6847054012696481.[0m
[32m[I 2022-04-21 11:44:31,689][0m Trial 644 finished with value: 0.6829090813866752 and parameters: {'alpha': 1.085668623881164, 'ties': 'efron'}. Best is trial 26 with value: 0.6847054012696481.[0m
[32m[I 2022-04-21 11:44:31,825][0m Trial 645 finished with value: 0.6829090813866752 and parameters: {'alpha': 1.1597149271593261, 'ties': 'efron'}. Best is trial 26 with value: 0.6847054012696481.[0m
[32m[I 2022-04-21 11:44:31,947][0m Trial 646 finished with value: 0.6847054012696481 and parameters: {'alpha': 0.8659712304651139, 'ties': 'breslow'}. Best is trial 26 with value: 0.6847054012696481.[0m
[32m[I 2022-04-21 11:44:32,070][0m Trial 647 finished with value: 0.6847054012696481 and parameters: {'alpha': 0.7819453480538887, 'ties': 'breslow'}. Best is trial 26 with value: 0.6847054012696481.[0m
[32m[I 2022-04-21 11:44:32,260][0m Trial 648 finished with value: 0.6814469677485105 and parameters: {'alpha': 3.7041905860570576, 'ties': 'breslow'}. Best is trial 26 with value: 0.6847054012696481.[0m
[32m[I 2022-04-21 11:44:32,468][0m Trial 649 finished with value: 0.684367348820454 and parameters: {'alpha': 0.6542017034837739, 'ties': 'efron'}. Best is trial 26 with value: 0.6847054012696481.[0m
[32m[I 2022-04-21 11:44:32,607][0m Trial 650 finished with value: 0.6847054012696481 and parameters: {'alpha': 0.7381616728903093, 'ties': 'efron'}. Best is trial 26 with value: 0.6847054012696481.[0m
[32m[I 2022-04-21 11:44:32,824][0m Trial 651 finished with value: 0.684367348820454 and parameters: {'alpha': 0.5943744227236217, 'ties': 'breslow'}. Best is trial 26 with value: 0.6847054012696481.[0m
[32m[I 2022-04-21 11:44:32,950][0m Trial 652 finished with value: 0.6829090813866752 and parameters: {'alpha': 1.0048867230211596, 'ties': 'breslow'}. Best is trial 26 with value: 0.6847054012696481.[0m
[32m[I 2022-04-21 11:44:33,196][0m Trial 653 finished with value: 0.6847054012696481 and parameters: {'alpha': 0.8990965282366865, 'ties': 'breslow'}. Best is trial 26 with value: 0.6847054012696481.[0m
[32m[I 2022-04-21 11:44:33,321][0m Trial 654 finished with value: 0.6829090813866752 and parameters: {'alpha': 0.9405788023098423, 'ties': 'breslow'}. Best is trial 26 with value: 0.6847054012696481.[0m
[32m[I 2022-04-21 11:44:33,588][0m Trial 655 finished with value: 0.6829090813866752 and parameters: {'alpha': 1.035872724465108, 'ties': 'breslow'}. Best is trial 26 with value: 0.6847054012696481.[0m
[32m[I 2022-04-21 11:44:33,718][0m Trial 656 finished with value: 0.6829090813866752 and parameters: {'alpha': 1.2363959838556213, 'ties': 'breslow'}. Best is trial 26 with value: 0.6847054012696481.[0m
[32m[I 2022-04-21 11:44:34,161][0m Trial 657 finished with value: 0.6847054012696481 and parameters: {'alpha': 0.8974110209518932, 'ties': 'breslow'}. Best is trial 26 with value: 0.6847054012696481.[0m
[32m[I 2022-04-21 11:44:34,661][0m Trial 658 finished with value: 0.6847054012696481 and parameters: {'alpha': 0.7234875518972139, 'ties': 'efron'}. Best is trial 26 with value: 0.6847054012696481.[0m
[32m[I 2022-04-21 11:44:34,964][0m Trial 659 finished with value: 0.6847054012696481 and parameters: {'alpha': 0.8246840402437777, 'ties': 'breslow'}. Best is trial 26 with value: 0.6847054012696481.[0m
[32m[I 2022-04-21 11:44:35,228][0m Trial 660 finished with value: 0.6847054012696481 and parameters: {'alpha': 0.7359642786093226, 'ties': 'efron'}. Best is trial 26 with value: 0.6847054012696481.[0m
[32m[I 2022-04-21 11:44:35,472][0m Trial 661 finished with value: 0.684367348820454 and parameters: {'alpha': 0.5960486587009182, 'ties': 'efron'}. Best is trial 26 with value: 0.6847054012696481.[0m
[32m[I 2022-04-21 11:44:35,666][0m Trial 662 finished with value: 0.6847054012696481 and parameters: {'alpha': 0.833380441421527, 'ties': 'breslow'}. Best is trial 26 with value: 0.6847054012696481.[0m
[32m[I 2022-04-21 11:44:36,146][0m Trial 663 finished with value: 0.684367348820454 and parameters: {'alpha': 0.672158699682468, 'ties': 'efron'}. Best is trial 26 with value: 0.6847054012696481.[0m
[32m[I 2022-04-21 11:44:36,519][0m Trial 664 finished with value: 0.6829090813866752 and parameters: {'alpha': 0.9999283983441329, 'ties': 'breslow'}. Best is trial 26 with value: 0.6847054012696481.[0m
[32m[I 2022-04-21 11:44:36,778][0m Trial 665 finished with value: 0.6847054012696481 and parameters: {'alpha': 0.8110187078428337, 'ties': 'breslow'}. Best is trial 26 with value: 0.6847054012696481.[0m
[32m[I 2022-04-21 11:44:37,042][0m Trial 666 finished with value: 0.684367348820454 and parameters: {'alpha': 0.5900473760575873, 'ties': 'breslow'}. Best is trial 26 with value: 0.6847054012696481.[0m
[32m[I 2022-04-21 11:44:37,305][0m Trial 667 finished with value: 0.6847054012696481 and parameters: {'alpha': 0.7040581451437257, 'ties': 'breslow'}. Best is trial 26 with value: 0.6847054012696481.[0m
[32m[I 2022-04-21 11:44:37,497][0m Trial 668 finished with value: 0.6847054012696481 and parameters: {'alpha': 0.9334874217634821, 'ties': 'breslow'}. Best is trial 26 with value: 0.6847054012696481.[0m
[32m[I 2022-04-21 11:44:37,803][0m Trial 669 finished with value: 0.684367348820454 and parameters: {'alpha': 0.49906199213006996, 'ties': 'efron'}. Best is trial 26 with value: 0.6847054012696481.[0m
[32m[I 2022-04-21 11:44:38,018][0m Trial 670 finished with value: 0.684367348820454 and parameters: {'alpha': 0.5757413444815036, 'ties': 'efron'}. Best is trial 26 with value: 0.6847054012696481.[0m
[32m[I 2022-04-21 11:44:38,388][0m Trial 671 finished with value: 0.6829090813866752 and parameters: {'alpha': 1.083068705705517, 'ties': 'breslow'}. Best is trial 26 with value: 0.6847054012696481.[0m
[32m[I 2022-04-21 11:44:38,524][0m Trial 672 finished with value: 0.6847054012696481 and parameters: {'alpha': 0.9047008948267851, 'ties': 'breslow'}. Best is trial 26 with value: 0.6847054012696481.[0m
[32m[I 2022-04-21 11:44:38,660][0m Trial 673 finished with value: 0.682613451992282 and parameters: {'alpha': 2.345139915255328, 'ties': 'efron'}. Best is trial 26 with value: 0.6847054012696481.[0m
[32m[I 2022-04-21 11:44:38,909][0m Trial 674 finished with value: 0.684367348820454 and parameters: {'alpha': 0.6929781086696901, 'ties': 'breslow'}. Best is trial 26 with value: 0.6847054012696481.[0m
[32m[I 2022-04-21 11:44:39,044][0m Trial 675 finished with value: 0.6847054012696481 and parameters: {'alpha': 0.7716261938440291, 'ties': 'efron'}. Best is trial 26 with value: 0.6847054012696481.[0m
[32m[I 2022-04-21 11:44:39,179][0m Trial 676 finished with value: 0.6847054012696481 and parameters: {'alpha': 0.8614351089571757, 'ties': 'efron'}. Best is trial 26 with value: 0.6847054012696481.[0m
[32m[I 2022-04-21 11:44:39,433][0m Trial 677 finished with value: 0.6811159057216931 and parameters: {'alpha': 4.801086597046517, 'ties': 'efron'}. Best is trial 26 with value: 0.6847054012696481.[0m
[32m[I 2022-04-21 11:44:39,556][0m Trial 678 finished with value: 0.6847054012696481 and parameters: {'alpha': 0.8926039995422488, 'ties': 'breslow'}. Best is trial 26 with value: 0.6847054012696481.[0m
[32m[I 2022-04-21 11:44:39,691][0m Trial 679 finished with value: 0.6829090813866752 and parameters: {'alpha': 1.0408111177488497, 'ties': 'efron'}. Best is trial 26 with value: 0.6847054012696481.[0m
[32m[I 2022-04-21 11:44:39,947][0m Trial 680 finished with value: 0.6847054012696481 and parameters: {'alpha': 0.8309799989635646, 'ties': 'breslow'}. Best is trial 26 with value: 0.6847054012696481.[0m
[32m[I 2022-04-21 11:44:40,082][0m Trial 681 finished with value: 0.6847054012696481 and parameters: {'alpha': 0.7922632800083501, 'ties': 'efron'}. Best is trial 26 with value: 0.6847054012696481.[0m
[32m[I 2022-04-21 11:44:40,221][0m Trial 682 finished with value: 0.6847054012696481 and parameters: {'alpha': 0.7521601297748304, 'ties': 'efron'}. Best is trial 26 with value: 0.6847054012696481.[0m
[32m[I 2022-04-21 11:44:40,516][0m Trial 683 finished with value: 0.684367348820454 and parameters: {'alpha': 0.6136426792276213, 'ties': 'efron'}. Best is trial 26 with value: 0.6847054012696481.[0m
[32m[I 2022-04-21 11:44:40,693][0m Trial 684 finished with value: 0.684367348820454 and parameters: {'alpha': 0.691290777682865, 'ties': 'efron'}. Best is trial 26 with value: 0.6847054012696481.[0m
[32m[I 2022-04-21 11:44:40,939][0m Trial 685 finished with value: 0.684367348820454 and parameters: {'alpha': 0.4135645820237062, 'ties': 'efron'}. Best is trial 26 with value: 0.6847054012696481.[0m
[32m[I 2022-04-21 11:44:41,130][0m Trial 686 finished with value: 0.6829090813866752 and parameters: {'alpha': 0.9780397521642725, 'ties': 'efron'}. Best is trial 26 with value: 0.6847054012696481.[0m
[32m[I 2022-04-21 11:44:41,341][0m Trial 687 finished with value: 0.6847054012696481 and parameters: {'alpha': 0.9016662370849491, 'ties': 'breslow'}. Best is trial 26 with value: 0.6847054012696481.[0m
[32m[I 2022-04-21 11:44:41,710][0m Trial 688 finished with value: 0.6829090813866752 and parameters: {'alpha': 1.0018271882485952, 'ties': 'efron'}. Best is trial 26 with value: 0.6847054012696481.[0m
[32m[I 2022-04-21 11:44:41,983][0m Trial 689 finished with value: 0.6847054012696481 and parameters: {'alpha': 0.7830375822212732, 'ties': 'breslow'}. Best is trial 26 with value: 0.6847054012696481.[0m
[32m[I 2022-04-21 11:44:42,294][0m Trial 690 finished with value: 0.682571028937481 and parameters: {'alpha': 1.7872466916787246, 'ties': 'efron'}. Best is trial 26 with value: 0.6847054012696481.[0m
[32m[I 2022-04-21 11:44:42,507][0m Trial 691 finished with value: 0.684367348820454 and parameters: {'alpha': 0.524834379522629, 'ties': 'breslow'}. Best is trial 26 with value: 0.6847054012696481.[0m
[32m[I 2022-04-21 11:44:42,695][0m Trial 692 finished with value: 0.6829090813866752 and parameters: {'alpha': 1.5399447204368535, 'ties': 'efron'}. Best is trial 26 with value: 0.6847054012696481.[0m
[32m[I 2022-04-21 11:44:42,976][0m Trial 693 finished with value: 0.684367348820454 and parameters: {'alpha': 0.6237123941101276, 'ties': 'efron'}. Best is trial 26 with value: 0.6847054012696481.[0m
[32m[I 2022-04-21 11:44:43,132][0m Trial 694 finished with value: 0.6847054012696481 and parameters: {'alpha': 0.7151141331301198, 'ties': 'efron'}. Best is trial 26 with value: 0.6847054012696481.[0m
[32m[I 2022-04-21 11:44:43,459][0m Trial 695 finished with value: 0.6847054012696481 and parameters: {'alpha': 0.7759808741844898, 'ties': 'breslow'}. Best is trial 26 with value: 0.6847054012696481.[0m
[32m[I 2022-04-21 11:44:43,961][0m Trial 696 finished with value: 0.6847054012696481 and parameters: {'alpha': 0.7486512068346702, 'ties': 'breslow'}. Best is trial 26 with value: 0.6847054012696481.[0m
[32m[I 2022-04-21 11:44:44,201][0m Trial 697 finished with value: 0.6829090813866752 and parameters: {'alpha': 1.1921523316861566, 'ties': 'efron'}. Best is trial 26 with value: 0.6847054012696481.[0m
[32m[I 2022-04-21 11:44:44,367][0m Trial 698 finished with value: 0.6829496894793843 and parameters: {'alpha': 2.5812167300746696, 'ties': 'breslow'}. Best is trial 26 with value: 0.6847054012696481.[0m
[32m[I 2022-04-21 11:44:44,590][0m Trial 699 finished with value: 0.684367348820454 and parameters: {'alpha': 0.5063402339043225, 'ties': 'efron'}. Best is trial 26 with value: 0.6847054012696481.[0m
[32m[I 2022-04-21 11:44:44,875][0m Trial 700 finished with value: 0.684367348820454 and parameters: {'alpha': 0.6643620883572348, 'ties': 'efron'}. Best is trial 26 with value: 0.6847054012696481.[0m
[32m[I 2022-04-21 11:44:45,010][0m Trial 701 finished with value: 0.6847054012696481 and parameters: {'alpha': 0.8044776922764916, 'ties': 'breslow'}. Best is trial 26 with value: 0.6847054012696481.[0m
[32m[I 2022-04-21 11:44:45,149][0m Trial 702 finished with value: 0.684367348820454 and parameters: {'alpha': 0.1762498412084409, 'ties': 'efron'}. Best is trial 26 with value: 0.6847054012696481.[0m
[32m[I 2022-04-21 11:44:45,286][0m Trial 703 finished with value: 0.684367348820454 and parameters: {'alpha': 0.6630497130934135, 'ties': 'efron'}. Best is trial 26 with value: 0.6847054012696481.[0m
[32m[I 2022-04-21 11:44:45,423][0m Trial 704 finished with value: 0.6847054012696481 and parameters: {'alpha': 0.8608912709185358, 'ties': 'efron'}. Best is trial 26 with value: 0.6847054012696481.[0m
[32m[I 2022-04-21 11:44:45,559][0m Trial 705 finished with value: 0.6829090813866752 and parameters: {'alpha': 0.8842279834004485, 'ties': 'efron'}. Best is trial 26 with value: 0.6847054012696481.[0m
[32m[I 2022-04-21 11:44:45,741][0m Trial 706 finished with value: 0.6829090813866752 and parameters: {'alpha': 1.124006321568507, 'ties': 'efron'}. Best is trial 26 with value: 0.6847054012696481.[0m
[32m[I 2022-04-21 11:44:46,065][0m Trial 707 finished with value: 0.684367348820454 and parameters: {'alpha': 0.6731745531367249, 'ties': 'breslow'}. Best is trial 26 with value: 0.6847054012696481.[0m
[32m[I 2022-04-21 11:44:46,416][0m Trial 708 finished with value: 0.684367348820454 and parameters: {'alpha': 0.536164608419916, 'ties': 'efron'}. Best is trial 26 with value: 0.6847054012696481.[0m
[32m[I 2022-04-21 11:44:46,664][0m Trial 709 finished with value: 0.6847054012696481 and parameters: {'alpha': 0.8979504235789253, 'ties': 'breslow'}. Best is trial 26 with value: 0.6847054012696481.[0m
[32m[I 2022-04-21 11:44:46,877][0m Trial 710 finished with value: 0.6829090813866752 and parameters: {'alpha': 1.314874199830713, 'ties': 'breslow'}. Best is trial 26 with value: 0.6847054012696481.[0m
[32m[I 2022-04-21 11:44:47,105][0m Trial 711 finished with value: 0.6829090813866752 and parameters: {'alpha': 0.9879937189845975, 'ties': 'breslow'}. Best is trial 26 with value: 0.6847054012696481.[0m
[32m[I 2022-04-21 11:44:47,291][0m Trial 712 finished with value: 0.6847054012696481 and parameters: {'alpha': 0.7287069473923129, 'ties': 'breslow'}. Best is trial 26 with value: 0.6847054012696481.[0m
