[32m[I 2022-04-21 13:06:28,585][0m Trial 67 finished with value: 0.25 and parameters: {'loss': 'coxph', 'learning_rate': 0.014501381386928679, 'n_estimators': 673, 'criterion': 'squared_error', 'min_samples_split': 7, 'min_samples_leaf': 10, 'min_weight_fraction_leaf': 0.10820648890753728, 'min_impurity_decrease': 0.6414540121986297, 'max_features': 0.6586596037504582, 'subsample': 0.5953945169527015, 'dropout_rate': 0.05448463877266524, 'ccp_alpha': 3.8894074230165634}. Best is trial 0 with value: 0.25.[0m
[32m[I 2022-04-21 13:11:19,102][0m Trial 68 finished with value: 0.25 and parameters: {'loss': 'coxph', 'learning_rate': 0.0197372358778067, 'n_estimators': 885, 'criterion': 'absolute_error', 'min_samples_split': 8, 'min_samples_leaf': 10, 'min_weight_fraction_leaf': 0.1799837431245055, 'min_impurity_decrease': 0.9214816297452049, 'max_features': 0.003518585054966099, 'subsample': 0.7104826745085296, 'dropout_rate': 0.33334121593819305, 'ccp_alpha': 3.0183422716029957}. Best is trial 0 with value: 0.25.[0m
[32m[I 2022-04-21 13:14:27,810][0m Trial 69 finished with value: 0.25 and parameters: {'loss': 'coxph', 'learning_rate': 0.017390261098493735, 'n_estimators': 629, 'criterion': 'squared_error', 'min_samples_split': 7, 'min_samples_leaf': 8, 'min_weight_fraction_leaf': 0.08792013813441454, 'min_impurity_decrease': 0.669514866137207, 'max_features': 0.6388332872881127, 'subsample': 0.5820180654108167, 'dropout_rate': 0.08988030023764607, 'ccp_alpha': 1.6387139545672489}. Best is trial 0 with value: 0.25.[0m
/media/san2_ssd/data/Workdir/survival/venv/lib/python3.8/site-packages/sksurv/ensemble/boosting.py:955: RuntimeWarning: divide by zero encountered in log
  time = numpy.log(time)
/media/san2_ssd/data/Workdir/survival/venv/lib/python3.8/site-packages/sksurv/ensemble/boosting.py:955: RuntimeWarning: divide by zero encountered in log
  time = numpy.log(time)
/media/san2_ssd/data/Workdir/survival/venv/lib/python3.8/site-packages/sksurv/ensemble/boosting.py:955: RuntimeWarning: divide by zero encountered in log
  time = numpy.log(time)
/media/san2_ssd/data/Workdir/survival/venv/lib/python3.8/site-packages/sksurv/ensemble/boosting.py:955: RuntimeWarning: divide by zero encountered in log
  time = numpy.log(time)
[32m[I 2022-04-21 13:14:42,304][0m Trial 70 finished with value: -0.45 and parameters: {'loss': 'squared', 'learning_rate': 0.007160947291816902, 'n_estimators': 424, 'criterion': 'absolute_error', 'min_samples_split': 7, 'min_samples_leaf': 9, 'min_weight_fraction_leaf': 0.3357239964483365, 'min_impurity_decrease': 0.9429978724374126, 'max_features': 0.010683704979901053, 'subsample': 0.7379740617317967, 'dropout_rate': 0.0421332956092581, 'ccp_alpha': 1.759650218418406}. Best is trial 0 with value: 0.25.[0m
[32m[I 2022-04-21 13:14:48,581][0m Trial 71 finished with value: 0.25 and parameters: {'loss': 'coxph', 'learning_rate': 0.0010459781399144864, 'n_estimators': 117, 'criterion': 'friedman_mse', 'min_samples_split': 10, 'min_samples_leaf': 8, 'min_weight_fraction_leaf': 0.3526534651763643, 'min_impurity_decrease': 0.12601544008213617, 'max_features': 0.12586125689941355, 'subsample': 0.5199171723989, 'dropout_rate': 0.09934946180720285, 'ccp_alpha': 2.0322096216287506}. Best is trial 0 with value: 0.25.[0m
[32m[I 2022-04-21 13:17:23,267][0m Trial 72 finished with value: 0.25 and parameters: {'loss': 'coxph', 'learning_rate': 0.002463117868860737, 'n_estimators': 607, 'criterion': 'squared_error', 'min_samples_split': 7, 'min_samples_leaf': 9, 'min_weight_fraction_leaf': 0.4567846548003577, 'min_impurity_decrease': 0.8258829043916089, 'max_features': 0.044682062342733475, 'subsample': 0.14396564970812326, 'dropout_rate': 0.263842882873484, 'ccp_alpha': 0.29549852093029894}. Best is trial 0 with value: 0.25.[0m
[32m[I 2022-04-21 13:19:39,579][0m Trial 73 finished with value: 0.25 and parameters: {'loss': 'coxph', 'learning_rate': 0.0013243309646379876, 'n_estimators': 514, 'criterion': 'squared_error', 'min_samples_split': 4, 'min_samples_leaf': 8, 'min_weight_fraction_leaf': 0.49782031400495236, 'min_impurity_decrease': 0.8815801478283383, 'max_features': 0.045539062738855995, 'subsample': 0.036055796229183354, 'dropout_rate': 0.002071911276854216, 'ccp_alpha': 2.021439925119387}. Best is trial 0 with value: 0.25.[0m
[32m[I 2022-04-21 13:20:39,239][0m Trial 74 finished with value: 0.25 and parameters: {'loss': 'coxph', 'learning_rate': 0.0004359552605243529, 'n_estimators': 407, 'criterion': 'squared_error', 'min_samples_split': 6, 'min_samples_leaf': 9, 'min_weight_fraction_leaf': 0.4613249796598832, 'min_impurity_decrease': 0.755427634688573, 'max_features': 0.03881085623147287, 'subsample': 0.10978803709903895, 'dropout_rate': 0.24123413915081213, 'ccp_alpha': 0.9900849871863585}. Best is trial 0 with value: 0.25.[0m
[32m[I 2022-04-21 13:21:35,674][0m Trial 75 finished with value: 0.25 and parameters: {'loss': 'coxph', 'learning_rate': 0.00031266949999325606, 'n_estimators': 387, 'criterion': 'squared_error', 'min_samples_split': 3, 'min_samples_leaf': 8, 'min_weight_fraction_leaf': 0.44591879469273354, 'min_impurity_decrease': 0.823613397889005, 'max_features': 0.9050309620344189, 'subsample': 0.2652090170313633, 'dropout_rate': 0.26710795408249277, 'ccp_alpha': 0.9203775592779974}. Best is trial 0 with value: 0.25.[0m
[32m[I 2022-04-21 13:22:01,545][0m Trial 76 finished with value: 0.25 and parameters: {'loss': 'coxph', 'learning_rate': 6.004643789028817e-06, 'n_estimators': 288, 'criterion': 'friedman_mse', 'min_samples_split': 5, 'min_samples_leaf': 1, 'min_weight_fraction_leaf': 0.21633058012834014, 'min_impurity_decrease': 0.39555385660375386, 'max_features': 0.27609174509436435, 'subsample': 0.33723736322052206, 'dropout_rate': 0.5588303780379307, 'ccp_alpha': 3.223169870093024}. Best is trial 0 with value: 0.25.[0m
[32m[I 2022-04-21 13:22:11,074][0m Trial 77 finished with value: 0.25 and parameters: {'loss': 'coxph', 'learning_rate': 1.4687019936491675e-06, 'n_estimators': 146, 'criterion': 'friedman_mse', 'min_samples_split': 8, 'min_samples_leaf': 4, 'min_weight_fraction_leaf': 0.30217015977927664, 'min_impurity_decrease': 0.1520967010959014, 'max_features': 0.2358162579121612, 'subsample': 0.8025313012716091, 'dropout_rate': 0.5093020017707672, 'ccp_alpha': 4.920232256323067}. Best is trial 0 with value: 0.25.[0m
[32m[I 2022-04-21 13:22:18,977][0m Trial 78 finished with value: 0.25 and parameters: {'loss': 'coxph', 'learning_rate': 1.383408938842323e-06, 'n_estimators': 135, 'criterion': 'friedman_mse', 'min_samples_split': 6, 'min_samples_leaf': 4, 'min_weight_fraction_leaf': 0.3207355111653538, 'min_impurity_decrease': 0.39649335994420465, 'max_features': 0.166288022048091, 'subsample': 0.756709220829451, 'dropout_rate': 0.40966016197563543, 'ccp_alpha': 4.840476629620424}. Best is trial 0 with value: 0.25.[0m
[32m[I 2022-04-21 13:22:29,910][0m Trial 79 finished with value: 0.25 and parameters: {'loss': 'coxph', 'learning_rate': 7.015298582372972e-06, 'n_estimators': 170, 'criterion': 'friedman_mse', 'min_samples_split': 2, 'min_samples_leaf': 5, 'min_weight_fraction_leaf': 0.37305255518742647, 'min_impurity_decrease': 0.4228760228102497, 'max_features': 0.23857586302365336, 'subsample': 0.9185678734301501, 'dropout_rate': 0.5691609505244782, 'ccp_alpha': 4.1031364236962435}. Best is trial 0 with value: 0.25.[0m
[32m[I 2022-04-21 13:22:34,818][0m Trial 80 finished with value: 0.25 and parameters: {'loss': 'coxph', 'learning_rate': 0.00012836135720240512, 'n_estimators': 130, 'criterion': 'friedman_mse', 'min_samples_split': 8, 'min_samples_leaf': 3, 'min_weight_fraction_leaf': 0.22194120476091905, 'min_impurity_decrease': 0.16899974717524097, 'max_features': 0.7925560057963265, 'subsample': 0.8031637370250609, 'dropout_rate': 0.5348649529419528, 'ccp_alpha': 4.759496164611311}. Best is trial 0 with value: 0.25.[0m
[32m[I 2022-04-21 13:22:42,804][0m Trial 81 finished with value: 0.25 and parameters: {'loss': 'coxph', 'learning_rate': 2.172611839003098e-06, 'n_estimators': 145, 'criterion': 'friedman_mse', 'min_samples_split': 2, 'min_samples_leaf': 3, 'min_weight_fraction_leaf': 0.22458844122441013, 'min_impurity_decrease': 0.325772863861709, 'max_features': 0.17866258458175222, 'subsample': 0.317217501027463, 'dropout_rate': 0.4009824985580236, 'ccp_alpha': 0.7099190616445914}. Best is trial 0 with value: 0.25.[0m
[32m[I 2022-04-21 13:22:53,713][0m Trial 82 finished with value: 0.25 and parameters: {'loss': 'coxph', 'learning_rate': 2.149336274051982e-06, 'n_estimators': 170, 'criterion': 'friedman_mse', 'min_samples_split': 2, 'min_samples_leaf': 5, 'min_weight_fraction_leaf': 0.26911632286450654, 'min_impurity_decrease': 0.5039260116637797, 'max_features': 0.10370345928023572, 'subsample': 0.8785829352833457, 'dropout_rate': 0.465970876840589, 'ccp_alpha': 0.49470312431038727}. Best is trial 0 with value: 0.25.[0m
[32m[I 2022-04-21 13:23:11,074][0m Trial 83 finished with value: 0.25 and parameters: {'loss': 'coxph', 'learning_rate': 2.8969081898009147e-06, 'n_estimators': 194, 'criterion': 'friedman_mse', 'min_samples_split': 2, 'min_samples_leaf': 2, 'min_weight_fraction_leaf': 0.2567338629927031, 'min_impurity_decrease': 0.023359954337261624, 'max_features': 0.9897871808758876, 'subsample': 0.9514987103751907, 'dropout_rate': 0.45515986586563556, 'ccp_alpha': 3.932367017876308}. Best is trial 0 with value: 0.25.[0m
[32m[I 2022-04-21 13:23:22,977][0m Trial 84 finished with value: 0.25 and parameters: {'loss': 'coxph', 'learning_rate': 1.8923322164840942e-06, 'n_estimators': 158, 'criterion': 'friedman_mse', 'min_samples_split': 3, 'min_samples_leaf': 2, 'min_weight_fraction_leaf': 0.20229521776520673, 'min_impurity_decrease': 0.19135191197363025, 'max_features': 0.16067781613472848, 'subsample': 0.8326954815787253, 'dropout_rate': 0.4819806097318771, 'ccp_alpha': 4.62790805434978}. Best is trial 0 with value: 0.25.[0m
[32m[I 2022-04-21 13:23:31,706][0m Trial 85 finished with value: 0.25 and parameters: {'loss': 'coxph', 'learning_rate': 2.953993929504682e-06, 'n_estimators': 112, 'criterion': 'friedman_mse', 'min_samples_split': 2, 'min_samples_leaf': 2, 'min_weight_fraction_leaf': 0.2716565046402211, 'min_impurity_decrease': 0.08756905125401832, 'max_features': 0.2048630049284797, 'subsample': 0.9902571037219131, 'dropout_rate': 0.42424424357855095, 'ccp_alpha': 4.994903895744294}. Best is trial 0 with value: 0.25.[0m
[32m[I 2022-04-21 13:23:35,346][0m Trial 86 finished with value: 0.25 and parameters: {'loss': 'coxph', 'learning_rate': 5.296204290578493e-06, 'n_estimators': 183, 'criterion': 'friedman_mse', 'min_samples_split': 3, 'min_samples_leaf': 2, 'min_weight_fraction_leaf': 0.29886764976022717, 'min_impurity_decrease': 0.06755603671657286, 'max_features': 0.2121709897329463, 'subsample': 0.8530361629963004, 'dropout_rate': 0.9792434441364506, 'ccp_alpha': 4.655488270387652}. Best is trial 0 with value: 0.25.[0m
/media/san2_ssd/data/Workdir/survival/venv/lib/python3.8/site-packages/sksurv/ensemble/boosting.py:955: RuntimeWarning: divide by zero encountered in log
  time = numpy.log(time)
/media/san2_ssd/data/Workdir/survival/venv/lib/python3.8/site-packages/sksurv/ensemble/boosting.py:955: RuntimeWarning: divide by zero encountered in log
  time = numpy.log(time)
/media/san2_ssd/data/Workdir/survival/venv/lib/python3.8/site-packages/sksurv/ensemble/boosting.py:955: RuntimeWarning: divide by zero encountered in log
  time = numpy.log(time)
/media/san2_ssd/data/Workdir/survival/venv/lib/python3.8/site-packages/sksurv/ensemble/boosting.py:955: RuntimeWarning: divide by zero encountered in log
  time = numpy.log(time)
[32m[I 2022-04-21 13:23:36,240][0m Trial 87 finished with value: -0.45 and parameters: {'loss': 'squared', 'learning_rate': 3.5228560805536077e-06, 'n_estimators': 205, 'criterion': 'friedman_mse', 'min_samples_split': 10, 'min_samples_leaf': 3, 'min_weight_fraction_leaf': 0.2646703616130087, 'min_impurity_decrease': 0.5721198959765793, 'max_features': 0.11824225053961565, 'subsample': 0.499798311526759, 'dropout_rate': 0.8684318875454334, 'ccp_alpha': 4.226616357958475}. Best is trial 0 with value: 0.25.[0m
[32m[I 2022-04-21 13:23:48,090][0m Trial 88 finished with value: 0.25 and parameters: {'loss': 'coxph', 'learning_rate': 8.42097312256706e-06, 'n_estimators': 223, 'criterion': 'friedman_mse', 'min_samples_split': 2, 'min_samples_leaf': 3, 'min_weight_fraction_leaf': 0.1774101178109238, 'min_impurity_decrease': 0.22087214074926964, 'max_features': 0.1453029222041194, 'subsample': 0.46953852818451947, 'dropout_rate': 0.7547865743044508, 'ccp_alpha': 3.801621369189306}. Best is trial 0 with value: 0.25.[0m
[32m[I 2022-04-21 13:23:54,625][0m Trial 89 finished with value: 0.25 and parameters: {'loss': 'coxph', 'learning_rate': 0.003294596977624467, 'n_estimators': 122, 'criterion': 'friedman_mse', 'min_samples_split': 10, 'min_samples_leaf': 2, 'min_weight_fraction_leaf': 0.055887536305772756, 'min_impurity_decrease': 0.0634661090058877, 'max_features': 0.09618005302567115, 'subsample': 0.4824829385971981, 'dropout_rate': 0.15384214316955164, 'ccp_alpha': 4.418812666424708}. Best is trial 0 with value: 0.25.[0m
[32m[I 2022-04-21 13:23:59,725][0m Trial 90 finished with value: 0.25 and parameters: {'loss': 'coxph', 'learning_rate': 4.3576224238874205e-06, 'n_estimators': 107, 'criterion': 'friedman_mse', 'min_samples_split': 10, 'min_samples_leaf': 2, 'min_weight_fraction_leaf': 0.16157301390799172, 'min_impurity_decrease': 0.02573390264940182, 'max_features': 0.08604469884035555, 'subsample': 0.9304462111851701, 'dropout_rate': 0.6112865459963852, 'ccp_alpha': 4.233170981677352}. Best is trial 0 with value: 0.25.[0m
[32m[I 2022-04-21 13:27:15,350][0m Trial 91 finished with value: 0.25 and parameters: {'loss': 'coxph', 'learning_rate': 0.007559810790994624, 'n_estimators': 944, 'criterion': 'friedman_mse', 'min_samples_split': 9, 'min_samples_leaf': 6, 'min_weight_fraction_leaf': 0.27765845814417395, 'min_impurity_decrease': 0.11708702910891047, 'max_features': 0.06918906209570974, 'subsample': 0.5575885552985264, 'dropout_rate': 0.6519062092431984, 'ccp_alpha': 4.405877673918283}. Best is trial 0 with value: 0.25.[0m
[32m[I 2022-04-21 13:27:29,035][0m Trial 92 finished with value: 0.25 and parameters: {'loss': 'coxph', 'learning_rate': 0.060220013545258605, 'n_estimators': 245, 'criterion': 'friedman_mse', 'min_samples_split': 10, 'min_samples_leaf': 6, 'min_weight_fraction_leaf': 0.13236722405811524, 'min_impurity_decrease': 0.20888857616361006, 'max_features': 0.0722471994841398, 'subsample': 0.440108353354926, 'dropout_rate': 0.7137564871936286, 'ccp_alpha': 4.3485648433209}. Best is trial 0 with value: 0.25.[0m
[32m[I 2022-04-21 13:29:51,031][0m Trial 93 finished with value: 0.25 and parameters: {'loss': 'coxph', 'learning_rate': 0.08070075123224627, 'n_estimators': 816, 'criterion': 'absolute_error', 'min_samples_split': 9, 'min_samples_leaf': 6, 'min_weight_fraction_leaf': 0.15462859397093856, 'min_impurity_decrease': 0.23228930135813852, 'max_features': 0.0681399355252514, 'subsample': 0.621245010139741, 'dropout_rate': 0.6296432465108392, 'ccp_alpha': 4.0439386429921536}. Best is trial 0 with value: 0.25.[0m
[32m[I 2022-04-21 13:34:06,493][0m Trial 94 finished with value: 0.25 and parameters: {'loss': 'coxph', 'learning_rate': 0.014840896379904872, 'n_estimators': 749, 'criterion': 'absolute_error', 'min_samples_split': 9, 'min_samples_leaf': 10, 'min_weight_fraction_leaf': 0.11366463040635368, 'min_impurity_decrease': 0.2599803604525205, 'max_features': 0.6687864128986883, 'subsample': 0.5703928413832353, 'dropout_rate': 0.13637931281248955, 'ccp_alpha': 4.594199878571997}. Best is trial 0 with value: 0.25.[0m
[32m[I 2022-04-21 13:38:20,483][0m Trial 95 finished with value: 0.25 and parameters: {'loss': 'coxph', 'learning_rate': 0.04794357102149727, 'n_estimators': 698, 'criterion': 'absolute_error', 'min_samples_split': 9, 'min_samples_leaf': 6, 'min_weight_fraction_leaf': 0.12080675687529419, 'min_impurity_decrease': 0.29449593992473194, 'max_features': 0.5792527328515475, 'subsample': 0.5967989513115384, 'dropout_rate': 0.06472166024009784, 'ccp_alpha': 3.5005403284211427}. Best is trial 0 with value: 0.25.[0m
[32m[I 2022-04-21 13:45:23,993][0m Trial 96 finished with value: 0.25 and parameters: {'loss': 'coxph', 'learning_rate': 0.03876056312821861, 'n_estimators': 923, 'criterion': 'friedman_mse', 'min_samples_split': 10, 'min_samples_leaf': 6, 'min_weight_fraction_leaf': 0.049698927066080256, 'min_impurity_decrease': 0.6246623373727241, 'max_features': 0.13732094385770766, 'subsample': 0.538423492437757, 'dropout_rate': 0.1610166905572527, 'ccp_alpha': 3.8012434769782812}. Best is trial 0 with value: 0.25.[0m
[32m[I 2022-04-21 13:50:38,517][0m Trial 97 finished with value: 0.25 and parameters: {'loss': 'coxph', 'learning_rate': 0.005645997660843227, 'n_estimators': 889, 'criterion': 'absolute_error', 'min_samples_split': 9, 'min_samples_leaf': 10, 'min_weight_fraction_leaf': 0.24315306724546104, 'min_impurity_decrease': 0.27508047298931215, 'max_features': 0.013221895735821942, 'subsample': 0.645568422603718, 'dropout_rate': 0.3501511815613718, 'ccp_alpha': 3.601420494554058}. Best is trial 0 with value: 0.25.[0m
[32m[I 2022-04-21 13:56:33,297][0m Trial 98 finished with value: 0.25 and parameters: {'loss': 'coxph', 'learning_rate': 0.016615237021326657, 'n_estimators': 786, 'criterion': 'absolute_error', 'min_samples_split': 9, 'min_samples_leaf': 10, 'min_weight_fraction_leaf': 0.08530533817458294, 'min_impurity_decrease': 0.674039107359644, 'max_features': 0.6239448564364669, 'subsample': 0.6937637727451409, 'dropout_rate': 0.03253409883496622, 'ccp_alpha': 2.9114605760917667}. Best is trial 0 with value: 0.25.[0m
/media/san2_ssd/data/Workdir/survival/venv/lib/python3.8/site-packages/sksurv/ensemble/boosting.py:955: RuntimeWarning: divide by zero encountered in log
  time = numpy.log(time)
/media/san2_ssd/data/Workdir/survival/venv/lib/python3.8/site-packages/sksurv/ensemble/boosting.py:955: RuntimeWarning: divide by zero encountered in log
  time = numpy.log(time)
/media/san2_ssd/data/Workdir/survival/venv/lib/python3.8/site-packages/sksurv/ensemble/boosting.py:955: RuntimeWarning: divide by zero encountered in log
  time = numpy.log(time)
/media/san2_ssd/data/Workdir/survival/venv/lib/python3.8/site-packages/sksurv/ensemble/boosting.py:955: RuntimeWarning: divide by zero encountered in log
  time = numpy.log(time)
[32m[I 2022-04-21 13:57:54,294][0m Trial 99 finished with value: -0.45 and parameters: {'loss': 'squared', 'learning_rate': 0.013740362798432113, 'n_estimators': 831, 'criterion': 'absolute_error', 'min_samples_split': 9, 'min_samples_leaf': 10, 'min_weight_fraction_leaf': 0.1003260664585484, 'min_impurity_decrease': 0.6606066703375515, 'max_features': 0.5472936998858555, 'subsample': 0.6326396334671746, 'dropout_rate': 0.1008241090078512, 'ccp_alpha': 3.70444204008224}. Best is trial 0 with value: 0.25.[0m
[32m[I 2022-04-21 14:02:21,018][0m Trial 100 finished with value: 0.25 and parameters: {'loss': 'coxph', 'learning_rate': 0.022099151730850215, 'n_estimators': 698, 'criterion': 'absolute_error', 'min_samples_split': 10, 'min_samples_leaf': 10, 'min_weight_fraction_leaf': 0.1446280958762099, 'min_impurity_decrease': 0.6280889065947998, 'max_features': 0.6463090295237864, 'subsample': 0.5920086394736129, 'dropout_rate': 0.08509875343934468, 'ccp_alpha': 3.5409871129099395}. Best is trial 0 with value: 0.25.[0m
[32m[I 2022-04-21 14:05:54,123][0m Trial 101 finished with value: 0.25 and parameters: {'loss': 'coxph', 'learning_rate': 0.001230706214590743, 'n_estimators': 597, 'criterion': 'squared_error', 'min_samples_split': 7, 'min_samples_leaf': 8, 'min_weight_fraction_leaf': 0.07284885624597517, 'min_impurity_decrease': 0.8499999648807969, 'max_features': 0.04677003334191408, 'subsample': 0.028295386088226914, 'dropout_rate': 0.01946319958612621, 'ccp_alpha': 1.947399488648526}. Best is trial 0 with value: 0.25.[0m
[32m[I 2022-04-21 14:08:46,773][0m Trial 102 finished with value: 0.25 and parameters: {'loss': 'coxph', 'learning_rate': 0.003020989200956513, 'n_estimators': 609, 'criterion': 'absolute_error', 'min_samples_split': 8, 'min_samples_leaf': 10, 'min_weight_fraction_leaf': 0.17856007369871119, 'min_impurity_decrease': 0.5762380888567978, 'max_features': 0.023136486749492625, 'subsample': 0.585186121718617, 'dropout_rate': 0.217665645559225, 'ccp_alpha': 3.0442962158968037}. Best is trial 0 with value: 0.25.[0m
[32m[I 2022-04-21 14:14:09,617][0m Trial 103 finished with value: 0.25 and parameters: {'loss': 'coxph', 'learning_rate': 0.0012977571068831016, 'n_estimators': 781, 'criterion': 'squared_error', 'min_samples_split': 8, 'min_samples_leaf': 8, 'min_weight_fraction_leaf': 0.1065784899177801, 'min_impurity_decrease': 0.900089190901511, 'max_features': 0.0020839713753534606, 'subsample': 0.5203112844589997, 'dropout_rate': 0.00371661390802952, 'ccp_alpha': 2.199732123666836}. Best is trial 0 with value: 0.25.[0m
[32m[I 2022-04-21 14:16:09,692][0m Trial 104 finished with value: 0.25 and parameters: {'loss': 'coxph', 'learning_rate': 0.0009582574484842873, 'n_estimators': 534, 'criterion': 'squared_error', 'min_samples_split': 7, 'min_samples_leaf': 9, 'min_weight_fraction_leaf': 0.49724965758273976, 'min_impurity_decrease': 0.759348622422696, 'max_features': 0.04409828824530845, 'subsample': 0.12709763844899663, 'dropout_rate': 0.33210329841455927, 'ccp_alpha': 2.080969731851848}. Best is trial 0 with value: 0.25.[0m
