[32m[I 2022-04-21 11:40:00,226][0m Trial 765 finished with value: 0.6738476114655684 and parameters: {'splitter': 'random', 'min_samples_split': 0.20188545485666948, 'min_samples_leaf': 0.014865802394349446, 'min_weight_fraction_leaf': 0.19355588704803214, 'max_features': 0.9731347657298255}. Best is trial 11 with value: 0.6773038119717333.[0m
[32m[I 2022-04-21 11:40:00,293][0m Trial 766 finished with value: 0.6738476114655684 and parameters: {'splitter': 'random', 'min_samples_split': 0.20693505049724417, 'min_samples_leaf': 0.09529900487754779, 'min_weight_fraction_leaf': 0.17043629367733662, 'max_features': 0.8366946926590791}. Best is trial 11 with value: 0.6773038119717333.[0m
[32m[I 2022-04-21 11:40:00,355][0m Trial 767 finished with value: 0.5 and parameters: {'splitter': 'random', 'min_samples_split': 0.30649807715833305, 'min_samples_leaf': 0.21127188179831047, 'min_weight_fraction_leaf': 0.11950205851004223, 'max_features': 0.7798749610111863}. Best is trial 11 with value: 0.6773038119717333.[0m
[32m[I 2022-04-21 11:40:00,407][0m Trial 768 finished with value: 0.6738476114655684 and parameters: {'splitter': 'random', 'min_samples_split': 0.37649896727696325, 'min_samples_leaf': 0.19886744914219928, 'min_weight_fraction_leaf': 0.12330646339263565, 'max_features': 0.8204433170282327}. Best is trial 11 with value: 0.6773038119717333.[0m
[32m[I 2022-04-21 11:40:00,464][0m Trial 769 finished with value: 0.6608441615981727 and parameters: {'splitter': 'best', 'min_samples_split': 0.36622497637664414, 'min_samples_leaf': 0.02086386676728013, 'min_weight_fraction_leaf': 0.009180098178042337, 'max_features': 0.9489913787315326}. Best is trial 11 with value: 0.6773038119717333.[0m
[32m[I 2022-04-21 11:40:00,530][0m Trial 770 finished with value: 0.662800366349585 and parameters: {'splitter': 'random', 'min_samples_split': 0.21042505257424066, 'min_samples_leaf': 0.05152305473729884, 'min_weight_fraction_leaf': 0.16467734210312646, 'max_features': 0.9780677626622304}. Best is trial 11 with value: 0.6773038119717333.[0m
[32m[I 2022-04-21 11:40:00,595][0m Trial 771 finished with value: 0.6586187582319654 and parameters: {'splitter': 'random', 'min_samples_split': 0.3238511365015378, 'min_samples_leaf': 0.1028300554114938, 'min_weight_fraction_leaf': 0.2017659758795495, 'max_features': 0.8964994967448292}. Best is trial 11 with value: 0.6773038119717333.[0m
[32m[I 2022-04-21 11:40:00,657][0m Trial 772 finished with value: 0.5 and parameters: {'splitter': 'random', 'min_samples_split': 0.15309524913947886, 'min_samples_leaf': 0.19652292127987223, 'min_weight_fraction_leaf': 0.21872343695998397, 'max_features': 0.7170262435069487}. Best is trial 11 with value: 0.6773038119717333.[0m
[32m[I 2022-04-21 11:40:00,723][0m Trial 773 finished with value: 0.6640701022932763 and parameters: {'splitter': 'random', 'min_samples_split': 0.3959790340157682, 'min_samples_leaf': 0.10327958571977883, 'min_weight_fraction_leaf': 0.10715384261388983, 'max_features': 0.848670918967544}. Best is trial 11 with value: 0.6773038119717333.[0m
[32m[I 2022-04-21 11:40:00,789][0m Trial 774 finished with value: 0.6738476114655684 and parameters: {'splitter': 'random', 'min_samples_split': 0.17943206517500057, 'min_samples_leaf': 0.002385152844263933, 'min_weight_fraction_leaf': 0.1753287045396596, 'max_features': 0.9634230615809055}. Best is trial 11 with value: 0.6773038119717333.[0m
[32m[I 2022-04-21 11:40:00,867][0m Trial 775 finished with value: 0.5 and parameters: {'splitter': 'random', 'min_samples_split': 0.35925094014779896, 'min_samples_leaf': 0.025139239909605454, 'min_weight_fraction_leaf': 0.32258225148833586, 'max_features': 0.9387874356805669}. Best is trial 11 with value: 0.6773038119717333.[0m
[32m[I 2022-04-21 11:40:00,946][0m Trial 776 finished with value: 0.6586187582319654 and parameters: {'splitter': 'random', 'min_samples_split': 0.37773790935329954, 'min_samples_leaf': 0.20589038617697075, 'min_weight_fraction_leaf': 0.04415774970352572, 'max_features': 0.8423681858758928}. Best is trial 11 with value: 0.6773038119717333.[0m
[32m[I 2022-04-21 11:40:01,008][0m Trial 777 finished with value: 0.6586187582319654 and parameters: {'splitter': 'random', 'min_samples_split': 0.16589177778040695, 'min_samples_leaf': 0.02063921035769362, 'min_weight_fraction_leaf': 0.2091424969222423, 'max_features': 0.8032970182517685}. Best is trial 11 with value: 0.6773038119717333.[0m
[32m[I 2022-04-21 11:40:01,073][0m Trial 778 finished with value: 0.6586187582319654 and parameters: {'splitter': 'random', 'min_samples_split': 0.15202941896505312, 'min_samples_leaf': 0.034923375560909284, 'min_weight_fraction_leaf': 0.21511415530722489, 'max_features': 0.8225459752947766}. Best is trial 11 with value: 0.6773038119717333.[0m
[32m[I 2022-04-21 11:40:01,142][0m Trial 779 finished with value: 0.5 and parameters: {'splitter': 'random', 'min_samples_split': 0.2118483866361572, 'min_samples_leaf': 0.011315837429416917, 'min_weight_fraction_leaf': 0.46297483897367614, 'max_features': 0.7688519298949943}. Best is trial 11 with value: 0.6773038119717333.[0m
[32m[I 2022-04-21 11:40:01,234][0m Trial 780 finished with value: 0.662800366349585 and parameters: {'splitter': 'random', 'min_samples_split': 0.22035620058670502, 'min_samples_leaf': 0.08191296697409918, 'min_weight_fraction_leaf': 0.16520046560262952, 'max_features': 0.9302246045597088}. Best is trial 11 with value: 0.6773038119717333.[0m
[32m[I 2022-04-21 11:40:01,303][0m Trial 781 finished with value: 0.6640701022932763 and parameters: {'splitter': 'random', 'min_samples_split': 0.3170661399522991, 'min_samples_leaf': 0.0873568142570279, 'min_weight_fraction_leaf': 0.14251797584688153, 'max_features': 0.8852405918665213}. Best is trial 11 with value: 0.6773038119717333.[0m
[32m[I 2022-04-21 11:40:01,377][0m Trial 782 finished with value: 0.6640701022932763 and parameters: {'splitter': 'random', 'min_samples_split': 0.3314652641960252, 'min_samples_leaf': 0.09089860076862251, 'min_weight_fraction_leaf': 0.1424331410399118, 'max_features': 0.8699259822612042}. Best is trial 11 with value: 0.6773038119717333.[0m
[32m[I 2022-04-21 11:40:01,512][0m Trial 783 finished with value: 0.5 and parameters: {'splitter': 'random', 'min_samples_split': 0.09790899373827829, 'min_samples_leaf': 0.04026079810804688, 'min_weight_fraction_leaf': 0.3020993443104701, 'max_features': 0.9637300043472314}. Best is trial 11 with value: 0.6773038119717333.[0m
[32m[I 2022-04-21 11:40:01,663][0m Trial 784 finished with value: 0.5 and parameters: {'splitter': 'random', 'min_samples_split': 0.39559993267997273, 'min_samples_leaf': 0.20422233057591085, 'min_weight_fraction_leaf': 0.1496628821871171, 'max_features': 0.7546971861325925}. Best is trial 11 with value: 0.6773038119717333.[0m
[32m[I 2022-04-21 11:40:01,794][0m Trial 785 finished with value: 0.6738476114655684 and parameters: {'splitter': 'random', 'min_samples_split': 0.3795212507592969, 'min_samples_leaf': 0.1884729764666114, 'min_weight_fraction_leaf': 0.07020372326545392, 'max_features': 0.9104139239509764}. Best is trial 11 with value: 0.6773038119717333.[0m
[32m[I 2022-04-21 11:40:01,945][0m Trial 786 finished with value: 0.6625929327049365 and parameters: {'splitter': 'random', 'min_samples_split': 0.3716974886514046, 'min_samples_leaf': 0.016589790352764065, 'min_weight_fraction_leaf': 0.01884767222271739, 'max_features': 0.9491787589639449}. Best is trial 11 with value: 0.6773038119717333.[0m
[32m[I 2022-04-21 11:40:02,063][0m Trial 787 finished with value: 0.6598137568019723 and parameters: {'splitter': 'best', 'min_samples_split': 0.35961756688944424, 'min_samples_leaf': 0.11167282045864113, 'min_weight_fraction_leaf': 0.18010072029652363, 'max_features': 0.9129623031008594}. Best is trial 11 with value: 0.6773038119717333.[0m
[32m[I 2022-04-21 11:40:02,197][0m Trial 788 finished with value: 0.6738476114655684 and parameters: {'splitter': 'random', 'min_samples_split': 0.009727391376326867, 'min_samples_leaf': 0.18500179585436782, 'min_weight_fraction_leaf': 0.1501284435068776, 'max_features': 0.9411943536203746}. Best is trial 11 with value: 0.6773038119717333.[0m
[32m[I 2022-04-21 11:40:02,341][0m Trial 789 finished with value: 0.5 and parameters: {'splitter': 'random', 'min_samples_split': 0.05423448008794114, 'min_samples_leaf': 0.1779973557841135, 'min_weight_fraction_leaf': 0.1314595340503371, 'max_features': 0.31681039045683757}. Best is trial 11 with value: 0.6773038119717333.[0m
[32m[I 2022-04-21 11:40:02,475][0m Trial 790 finished with value: 0.6738476114655684 and parameters: {'splitter': 'random', 'min_samples_split': 0.3499625457190171, 'min_samples_leaf': 0.11889308267693441, 'min_weight_fraction_leaf': 0.20091794517109476, 'max_features': 0.860011165395248}. Best is trial 11 with value: 0.6773038119717333.[0m
[32m[I 2022-04-21 11:40:02,610][0m Trial 791 finished with value: 0.6571960671138655 and parameters: {'splitter': 'random', 'min_samples_split': 0.45529361508721056, 'min_samples_leaf': 0.024464779490442547, 'min_weight_fraction_leaf': 0.0041227775889180135, 'max_features': 0.9783724652709308}. Best is trial 11 with value: 0.6773038119717333.[0m
[32m[I 2022-04-21 11:40:02,738][0m Trial 792 finished with value: 0.6738476114655684 and parameters: {'splitter': 'random', 'min_samples_split': 0.24709402583879747, 'min_samples_leaf': 0.00925470744574755, 'min_weight_fraction_leaf': 0.1937628143757092, 'max_features': 0.9944741534570135}. Best is trial 11 with value: 0.6773038119717333.[0m
[32m[I 2022-04-21 11:40:02,854][0m Trial 793 finished with value: 0.6571960671138655 and parameters: {'splitter': 'random', 'min_samples_split': 0.457704991469109, 'min_samples_leaf': 0.016972303247015444, 'min_weight_fraction_leaf': 0.019974949793350565, 'max_features': 0.9537602222442404}. Best is trial 11 with value: 0.6773038119717333.[0m
[32m[I 2022-04-21 11:40:02,935][0m Trial 794 finished with value: 0.662800366349585 and parameters: {'splitter': 'random', 'min_samples_split': 0.43464762260400325, 'min_samples_leaf': 0.15207378213635248, 'min_weight_fraction_leaf': 0.16564370323446997, 'max_features': 0.8722715481727412}. Best is trial 11 with value: 0.6773038119717333.[0m
[32m[I 2022-04-21 11:40:03,029][0m Trial 795 finished with value: 0.6703693833499768 and parameters: {'splitter': 'random', 'min_samples_split': 0.46954044669495537, 'min_samples_leaf': 0.18702764617332204, 'min_weight_fraction_leaf': 0.12582023403788922, 'max_features': 0.9817799204320259}. Best is trial 11 with value: 0.6773038119717333.[0m
[32m[I 2022-04-21 11:40:03,117][0m Trial 796 finished with value: 0.6738476114655684 and parameters: {'splitter': 'random', 'min_samples_split': 0.1789232586910694, 'min_samples_leaf': 0.163320330974002, 'min_weight_fraction_leaf': 0.188256069625189, 'max_features': 0.9314670202034273}. Best is trial 11 with value: 0.6773038119717333.[0m
[32m[I 2022-04-21 11:40:03,231][0m Trial 797 finished with value: 0.6625929327049365 and parameters: {'splitter': 'random', 'min_samples_split': 0.36032042005922604, 'min_samples_leaf': 0.021968283882342104, 'min_weight_fraction_leaf': 0.021235491663649433, 'max_features': 0.9974060247920077}. Best is trial 11 with value: 0.6773038119717333.[0m
[32m[I 2022-04-21 11:40:03,344][0m Trial 798 finished with value: 0.6738476114655684 and parameters: {'splitter': 'random', 'min_samples_split': 0.023136977664695614, 'min_samples_leaf': 0.09795488526499199, 'min_weight_fraction_leaf': 0.1695058011204164, 'max_features': 0.8034231135230572}. Best is trial 11 with value: 0.6773038119717333.[0m
[32m[I 2022-04-21 11:40:03,423][0m Trial 799 finished with value: 0.6738476114655684 and parameters: {'splitter': 'random', 'min_samples_split': 0.3421521868099889, 'min_samples_leaf': 0.12734049827434457, 'min_weight_fraction_leaf': 0.19830359876506262, 'max_features': 0.8152948210221007}. Best is trial 11 with value: 0.6773038119717333.[0m
[32m[I 2022-04-21 11:40:03,509][0m Trial 800 finished with value: 0.6738476114655684 and parameters: {'splitter': 'random', 'min_samples_split': 0.34066355456328573, 'min_samples_leaf': 0.12663069472178695, 'min_weight_fraction_leaf': 0.19996133561998625, 'max_features': 0.8614100832613657}. Best is trial 11 with value: 0.6773038119717333.[0m
[32m[I 2022-04-21 11:40:03,611][0m Trial 801 finished with value: 0.662800366349585 and parameters: {'splitter': 'random', 'min_samples_split': 0.19285223641516433, 'min_samples_leaf': 0.07778603688216354, 'min_weight_fraction_leaf': 0.16093180990978725, 'max_features': 0.9830417176863157}. Best is trial 11 with value: 0.6773038119717333.[0m
[32m[I 2022-04-21 11:40:03,678][0m Trial 802 finished with value: 0.6738476114655684 and parameters: {'splitter': 'random', 'min_samples_split': 0.20074984901113957, 'min_samples_leaf': 0.16872839864824157, 'min_weight_fraction_leaf': 0.1578979574900225, 'max_features': 0.9763227114133027}. Best is trial 11 with value: 0.6773038119717333.[0m
[32m[I 2022-04-21 11:40:03,768][0m Trial 803 finished with value: 0.5502145606990503 and parameters: {'splitter': 'random', 'min_samples_split': 0.3121996568303578, 'min_samples_leaf': 0.16833339909229356, 'min_weight_fraction_leaf': 0.1271966463481158, 'max_features': 0.7911945239924747}. Best is trial 11 with value: 0.6773038119717333.[0m
[32m[I 2022-04-21 11:40:03,851][0m Trial 804 finished with value: 0.5931624331547747 and parameters: {'splitter': 'random', 'min_samples_split': 0.2155106474726759, 'min_samples_leaf': 0.05921276596849786, 'min_weight_fraction_leaf': 0.23639058924156853, 'max_features': 0.9306497639630009}. Best is trial 11 with value: 0.6773038119717333.[0m
[32m[I 2022-04-21 11:40:03,935][0m Trial 805 finished with value: 0.6551405301163737 and parameters: {'splitter': 'random', 'min_samples_split': 0.3859312274390073, 'min_samples_leaf': 0.22207155865974154, 'min_weight_fraction_leaf': 0.0946922614451759, 'max_features': 0.8348419923596149}. Best is trial 11 with value: 0.6773038119717333.[0m
[32m[I 2022-04-21 11:40:04,019][0m Trial 806 finished with value: 0.6738476114655684 and parameters: {'splitter': 'random', 'min_samples_split': 0.4202459134033463, 'min_samples_leaf': 0.03476026198607265, 'min_weight_fraction_leaf': 0.17422150953950674, 'max_features': 0.928409215350394}. Best is trial 11 with value: 0.6773038119717333.[0m
[32m[I 2022-04-21 11:40:04,101][0m Trial 807 finished with value: 0.5 and parameters: {'splitter': 'best', 'min_samples_split': 0.47326698375762133, 'min_samples_leaf': 0.008774862262064084, 'min_weight_fraction_leaf': 0.35760462340161125, 'max_features': 0.9593148373453418}. Best is trial 11 with value: 0.6773038119717333.[0m
[32m[I 2022-04-21 11:40:04,172][0m Trial 808 finished with value: 0.5 and parameters: {'splitter': 'random', 'min_samples_split': 0.45828574559248475, 'min_samples_leaf': 0.04687576232209416, 'min_weight_fraction_leaf': 0.1818428424166803, 'max_features': 0.48757070006187975}. Best is trial 11 with value: 0.6773038119717333.[0m
[32m[I 2022-04-21 11:40:04,255][0m Trial 809 finished with value: 0.6703693833499768 and parameters: {'splitter': 'random', 'min_samples_split': 0.4711236920619999, 'min_samples_leaf': 0.03747067533504862, 'min_weight_fraction_leaf': 0.19460823423117124, 'max_features': 0.9454319511756495}. Best is trial 11 with value: 0.6773038119717333.[0m
[32m[I 2022-04-21 11:40:04,341][0m Trial 810 finished with value: 0.6738476114655684 and parameters: {'splitter': 'random', 'min_samples_split': 0.2289883276418861, 'min_samples_leaf': 0.028385081557317088, 'min_weight_fraction_leaf': 0.1855359306458665, 'max_features': 0.9869202628896686}. Best is trial 11 with value: 0.6773038119717333.[0m
[32m[I 2022-04-21 11:40:04,432][0m Trial 811 finished with value: 0.6502080893344752 and parameters: {'splitter': 'random', 'min_samples_split': 0.0657509467885334, 'min_samples_leaf': 0.002651462050177923, 'min_weight_fraction_leaf': 0.15110501693461278, 'max_features': 0.9808457503656318}. Best is trial 11 with value: 0.6773038119717333.[0m
[32m[I 2022-04-21 11:40:04,511][0m Trial 812 finished with value: 0.6738476114655684 and parameters: {'splitter': 'random', 'min_samples_split': 0.2708879098745747, 'min_samples_leaf': 0.10284602587141534, 'min_weight_fraction_leaf': 0.17335384687692965, 'max_features': 0.999377037581232}. Best is trial 11 with value: 0.6773038119717333.[0m
[32m[I 2022-04-21 11:40:04,598][0m Trial 813 finished with value: 0.6215155824977587 and parameters: {'splitter': 'random', 'min_samples_split': 0.23031097724293784, 'min_samples_leaf': 0.0010910749695203048, 'min_weight_fraction_leaf': 0.2241130895673863, 'max_features': 0.9988142659721705}. Best is trial 11 with value: 0.6773038119717333.[0m
[32m[I 2022-04-21 11:40:04,763][0m Trial 814 finished with value: 0.6551405301163737 and parameters: {'splitter': 'random', 'min_samples_split': 0.2585113331527371, 'min_samples_leaf': 0.02424695438043633, 'min_weight_fraction_leaf': 0.21608191184309142, 'max_features': 0.9392230046924029}. Best is trial 11 with value: 0.6773038119717333.[0m
[32m[I 2022-04-21 11:40:04,921][0m Trial 815 finished with value: 0.6738476114655684 and parameters: {'splitter': 'random', 'min_samples_split': 0.4071318545344663, 'min_samples_leaf': 0.13809258268820515, 'min_weight_fraction_leaf': 0.17149806362757664, 'max_features': 0.9175604156300757}. Best is trial 11 with value: 0.6773038119717333.[0m
[32m[I 2022-04-21 11:40:05,079][0m Trial 816 finished with value: 0.5 and parameters: {'splitter': 'random', 'min_samples_split': 0.4102944602979023, 'min_samples_leaf': 0.30090766490266796, 'min_weight_fraction_leaf': 0.1502468451263905, 'max_features': 0.9653097147944923}. Best is trial 11 with value: 0.6773038119717333.[0m
[32m[I 2022-04-21 11:40:05,294][0m Trial 817 finished with value: 0.6640701022932763 and parameters: {'splitter': 'random', 'min_samples_split': 0.17402063452735012, 'min_samples_leaf': 0.09335171415348138, 'min_weight_fraction_leaf': 0.13620140754443233, 'max_features': 0.898532261994663}. Best is trial 11 with value: 0.6773038119717333.[0m
[32m[I 2022-04-21 11:40:05,457][0m Trial 818 finished with value: 0.5 and parameters: {'splitter': 'random', 'min_samples_split': 0.38944237745771393, 'min_samples_leaf': 0.1357834970871815, 'min_weight_fraction_leaf': 0.17665213186148804, 'max_features': 0.5752501257683645}. Best is trial 11 with value: 0.6773038119717333.[0m
[32m[I 2022-04-21 11:40:05,607][0m Trial 819 finished with value: 0.6738476114655684 and parameters: {'splitter': 'random', 'min_samples_split': 0.32815309267470805, 'min_samples_leaf': 0.12108577636370117, 'min_weight_fraction_leaf': 0.18776294135091387, 'max_features': 0.8798319565604722}. Best is trial 11 with value: 0.6773038119717333.[0m
[32m[I 2022-04-21 11:40:05,771][0m Trial 820 finished with value: 0.5931624331547747 and parameters: {'splitter': 'random', 'min_samples_split': 0.4010120273078806, 'min_samples_leaf': 0.2028035998684534, 'min_weight_fraction_leaf': 0.24971424106899345, 'max_features': 0.9127016686265148}. Best is trial 11 with value: 0.6773038119717333.[0m
[32m[I 2022-04-21 11:40:05,938][0m Trial 821 finished with value: 0.6738476114655684 and parameters: {'splitter': 'random', 'min_samples_split': 0.3509606237926592, 'min_samples_leaf': 0.19461199537466656, 'min_weight_fraction_leaf': 0.049541678291105416, 'max_features': 0.8517619419888957}. Best is trial 11 with value: 0.6773038119717333.[0m
[32m[I 2022-04-21 11:40:06,062][0m Trial 822 finished with value: 0.6586187582319654 and parameters: {'splitter': 'random', 'min_samples_split': 0.4454115980125755, 'min_samples_leaf': 0.01579998684003494, 'min_weight_fraction_leaf': 0.20487403671686735, 'max_features': 0.9623836650708011}. Best is trial 11 with value: 0.6773038119717333.[0m
[32m[I 2022-04-21 11:40:06,195][0m Trial 823 finished with value: 0.6738476114655684 and parameters: {'splitter': 'random', 'min_samples_split': 0.26384581487504, 'min_samples_leaf': 0.05115275041781249, 'min_weight_fraction_leaf': 0.1819048893519245, 'max_features': 0.890962807328555}. Best is trial 11 with value: 0.6773038119717333.[0m
[32m[I 2022-04-21 11:40:06,330][0m Trial 824 finished with value: 0.6571960671138655 and parameters: {'splitter': 'random', 'min_samples_split': 0.4540725404203309, 'min_samples_leaf': 0.013465005044001386, 'min_weight_fraction_leaf': 0.0012153016338378284, 'max_features': 0.9572352977619254}. Best is trial 11 with value: 0.6773038119717333.[0m
[32m[I 2022-04-21 11:40:06,471][0m Trial 825 finished with value: 0.6738476114655684 and parameters: {'splitter': 'random', 'min_samples_split': 0.4174017636874982, 'min_samples_leaf': 0.017058054148427364, 'min_weight_fraction_leaf': 0.1783598728372494, 'max_features': 0.9324940258489969}. Best is trial 11 with value: 0.6773038119717333.[0m
[32m[I 2022-04-21 11:40:06,601][0m Trial 826 finished with value: 0.6738476114655684 and parameters: {'splitter': 'random', 'min_samples_split': 0.4233473716261243, 'min_samples_leaf': 0.03187113251084443, 'min_weight_fraction_leaf': 0.169415919591283, 'max_features': 0.8909790270576636}. Best is trial 11 with value: 0.6773038119717333.[0m
[32m[I 2022-04-21 11:40:06,722][0m Trial 827 finished with value: 0.6665385065440175 and parameters: {'splitter': 'best', 'min_samples_split': 0.42151704731392425, 'min_samples_leaf': 0.04442927691803298, 'min_weight_fraction_leaf': 0.16913968977230223, 'max_features': 0.8704769720452048}. Best is trial 11 with value: 0.6773038119717333.[0m
