[32m[I 2022-04-22 02:41:50,988][0m Trial 779 finished with value: 0.2651685646512371 and parameters: {'loss': 'coxph', 'learning_rate': 0.007941366157749808, 'n_estimators': 909, 'criterion': 'friedman_mse', 'min_samples_split': 2, 'min_samples_leaf': 10, 'min_weight_fraction_leaf': 0.022584680491603927, 'min_impurity_decrease': 0.9465514771164084, 'max_features': 0.3635722372329669, 'subsample': 0.35300572005351766, 'dropout_rate': 0.24720739125664834, 'ccp_alpha': 0.24401412638610678}. Best is trial 664 with value: 0.8342316538423719.[0m
[32m[I 2022-04-22 02:45:43,318][0m Trial 780 finished with value: 0.7034447950131593 and parameters: {'loss': 'coxph', 'learning_rate': 0.009540890836710551, 'n_estimators': 872, 'criterion': 'friedman_mse', 'min_samples_split': 6, 'min_samples_leaf': 9, 'min_weight_fraction_leaf': 0.03349142027869524, 'min_impurity_decrease': 0.9106664322220396, 'max_features': 0.28352195105225436, 'subsample': 0.3109111652255311, 'dropout_rate': 0.3362889164499532, 'ccp_alpha': 0.1716269732869766}. Best is trial 664 with value: 0.8342316538423719.[0m
[32m[I 2022-04-22 02:49:47,103][0m Trial 781 finished with value: 0.8276087285722731 and parameters: {'loss': 'coxph', 'learning_rate': 0.005295563577302223, 'n_estimators': 923, 'criterion': 'friedman_mse', 'min_samples_split': 2, 'min_samples_leaf': 7, 'min_weight_fraction_leaf': 0.010732510668253469, 'min_impurity_decrease': 0.9712355947386441, 'max_features': 0.34181072579018856, 'subsample': 0.27857814844369505, 'dropout_rate': 0.3589984019852093, 'ccp_alpha': 0.08469868965900243}. Best is trial 664 with value: 0.8342316538423719.[0m
[32m[I 2022-04-22 02:54:05,741][0m Trial 782 finished with value: 0.833760602398903 and parameters: {'loss': 'coxph', 'learning_rate': 0.0036933725752318265, 'n_estimators': 822, 'criterion': 'friedman_mse', 'min_samples_split': 2, 'min_samples_leaf': 7, 'min_weight_fraction_leaf': 0.0015766368381802624, 'min_impurity_decrease': 0.9392460423642238, 'max_features': 0.31485978921356095, 'subsample': 0.32725117772114565, 'dropout_rate': 0.22149645089657063, 'ccp_alpha': 0.005320237372308378}. Best is trial 664 with value: 0.8342316538423719.[0m
[32m[I 2022-04-22 02:57:56,855][0m Trial 783 finished with value: 0.8316170803739169 and parameters: {'loss': 'coxph', 'learning_rate': 0.0036084453986593166, 'n_estimators': 835, 'criterion': 'friedman_mse', 'min_samples_split': 2, 'min_samples_leaf': 7, 'min_weight_fraction_leaf': 0.004266343546501634, 'min_impurity_decrease': 0.9994359067214851, 'max_features': 0.31370224292623206, 'subsample': 0.36618845182921067, 'dropout_rate': 0.23543251987078448, 'ccp_alpha': 0.0014918992628015506}. Best is trial 664 with value: 0.8342316538423719.[0m
[32m[I 2022-04-22 03:01:37,975][0m Trial 784 finished with value: 0.2503270102305002 and parameters: {'loss': 'coxph', 'learning_rate': 0.003419917131341754, 'n_estimators': 824, 'criterion': 'friedman_mse', 'min_samples_split': 2, 'min_samples_leaf': 7, 'min_weight_fraction_leaf': 0.002217516810578249, 'min_impurity_decrease': 0.9866487990378915, 'max_features': 0.3211458165220932, 'subsample': 0.37433350825175715, 'dropout_rate': 0.23304958865745318, 'ccp_alpha': 0.29122535992084786}. Best is trial 664 with value: 0.8342316538423719.[0m
[32m[I 2022-04-22 03:05:26,148][0m Trial 785 finished with value: 0.38871904633233145 and parameters: {'loss': 'coxph', 'learning_rate': 0.0029891027016312522, 'n_estimators': 841, 'criterion': 'friedman_mse', 'min_samples_split': 2, 'min_samples_leaf': 7, 'min_weight_fraction_leaf': 0.018148014809254577, 'min_impurity_decrease': 0.9856780697957297, 'max_features': 0.289686707406227, 'subsample': 0.37050318810368954, 'dropout_rate': 0.24498626873052787, 'ccp_alpha': 0.17314280958142028}. Best is trial 664 with value: 0.8342316538423719.[0m
[32m[I 2022-04-22 03:08:50,162][0m Trial 786 finished with value: 0.8289801007934813 and parameters: {'loss': 'coxph', 'learning_rate': 0.003333622061981492, 'n_estimators': 772, 'criterion': 'friedman_mse', 'min_samples_split': 2, 'min_samples_leaf': 7, 'min_weight_fraction_leaf': 0.002227523250686427, 'min_impurity_decrease': 0.9964181878390059, 'max_features': 0.3079428921659839, 'subsample': 0.33355285571600846, 'dropout_rate': 0.2213257764230439, 'ccp_alpha': 0.09957400917504537}. Best is trial 664 with value: 0.8342316538423719.[0m
/media/san2_ssd/data/Workdir/survival/venv/lib/python3.8/site-packages/sksurv/ensemble/boosting.py:955: RuntimeWarning: divide by zero encountered in log
  time = numpy.log(time)
/media/san2_ssd/data/Workdir/survival/venv/lib/python3.8/site-packages/sksurv/ensemble/boosting.py:955: RuntimeWarning: divide by zero encountered in log
  time = numpy.log(time)
/media/san2_ssd/data/Workdir/survival/venv/lib/python3.8/site-packages/sksurv/ensemble/boosting.py:955: RuntimeWarning: divide by zero encountered in log
  time = numpy.log(time)
/media/san2_ssd/data/Workdir/survival/venv/lib/python3.8/site-packages/sksurv/ensemble/boosting.py:955: RuntimeWarning: divide by zero encountered in log
  time = numpy.log(time)
[32m[I 2022-04-22 03:09:39,441][0m Trial 787 finished with value: -0.46439949710942263 and parameters: {'loss': 'squared', 'learning_rate': 0.004000439537033604, 'n_estimators': 870, 'criterion': 'friedman_mse', 'min_samples_split': 2, 'min_samples_leaf': 7, 'min_weight_fraction_leaf': 0.02443822181540418, 'min_impurity_decrease': 0.9768000353938994, 'max_features': 0.2848353682018912, 'subsample': 0.35740521018470633, 'dropout_rate': 0.2503617434489403, 'ccp_alpha': 0.41912242123771987}. Best is trial 664 with value: 0.8342316538423719.[0m
[32m[I 2022-04-22 03:13:35,459][0m Trial 788 finished with value: 0.8278580912212256 and parameters: {'loss': 'coxph', 'learning_rate': 0.003590813283965326, 'n_estimators': 820, 'criterion': 'friedman_mse', 'min_samples_split': 2, 'min_samples_leaf': 7, 'min_weight_fraction_leaf': 0.002011921361503357, 'min_impurity_decrease': 0.959880770018617, 'max_features': 0.33352520038528227, 'subsample': 0.3282250923748844, 'dropout_rate': 0.22670909991628832, 'ccp_alpha': 0.09331634288556954}. Best is trial 664 with value: 0.8342316538423719.[0m
[32m[I 2022-04-22 03:16:49,089][0m Trial 789 finished with value: 0.27178391939230423 and parameters: {'loss': 'coxph', 'learning_rate': 0.0025893097566803604, 'n_estimators': 776, 'criterion': 'friedman_mse', 'min_samples_split': 2, 'min_samples_leaf': 7, 'min_weight_fraction_leaf': 0.0015410672412012813, 'min_impurity_decrease': 0.9693871844117268, 'max_features': 0.32076022095717666, 'subsample': 0.3468601162508795, 'dropout_rate': 0.2586247493829828, 'ccp_alpha': 0.232926969440786}. Best is trial 664 with value: 0.8342316538423719.[0m
[32m[I 2022-04-22 03:20:48,455][0m Trial 790 finished with value: 0.49838044108437796 and parameters: {'loss': 'coxph', 'learning_rate': 0.0036816272741393738, 'n_estimators': 877, 'criterion': 'friedman_mse', 'min_samples_split': 2, 'min_samples_leaf': 7, 'min_weight_fraction_leaf': 0.018639556865486386, 'min_impurity_decrease': 0.995506788590674, 'max_features': 0.27461863500840417, 'subsample': 0.37245004103443385, 'dropout_rate': 0.18036254453154268, 'ccp_alpha': 0.1664345528949469}. Best is trial 664 with value: 0.8342316538423719.[0m
[32m[I 2022-04-22 03:25:49,247][0m Trial 791 finished with value: 0.8258757524662969 and parameters: {'loss': 'coxph', 'learning_rate': 0.004273884522578746, 'n_estimators': 962, 'criterion': 'friedman_mse', 'min_samples_split': 2, 'min_samples_leaf': 7, 'min_weight_fraction_leaf': 0.0011274189639094104, 'min_impurity_decrease': 0.9485475665270124, 'max_features': 0.2911171550550571, 'subsample': 0.3278612633409983, 'dropout_rate': 0.21456472183462855, 'ccp_alpha': 0.09519775607960201}. Best is trial 664 with value: 0.8342316538423719.[0m
[32m[I 2022-04-22 03:30:07,860][0m Trial 792 finished with value: 0.8274962598212532 and parameters: {'loss': 'coxph', 'learning_rate': 0.002815001864559273, 'n_estimators': 838, 'criterion': 'friedman_mse', 'min_samples_split': 2, 'min_samples_leaf': 7, 'min_weight_fraction_leaf': 0.03272011116415732, 'min_impurity_decrease': 0.9997434353772657, 'max_features': 0.31131574336553813, 'subsample': 0.2915067166803585, 'dropout_rate': 0.19686328282532406, 'ccp_alpha': 0.08786356166685301}. Best is trial 664 with value: 0.8342316538423719.[0m
[32m[I 2022-04-22 03:35:00,887][0m Trial 793 finished with value: 0.25 and parameters: {'loss': 'coxph', 'learning_rate': 0.004608595680371874, 'n_estimators': 945, 'criterion': 'squared_error', 'min_samples_split': 2, 'min_samples_leaf': 7, 'min_weight_fraction_leaf': 0.016970271081040496, 'min_impurity_decrease': 0.9717943916095452, 'max_features': 0.33754105841293086, 'subsample': 0.31467604430443635, 'dropout_rate': 0.16064947677700622, 'ccp_alpha': 0.30039941233685175}. Best is trial 664 with value: 0.8342316538423719.[0m
[32m[I 2022-04-22 03:40:28,666][0m Trial 794 finished with value: 0.38821080940906005 and parameters: {'loss': 'coxph', 'learning_rate': 0.0044523354057649815, 'n_estimators': 1000, 'criterion': 'friedman_mse', 'min_samples_split': 2, 'min_samples_leaf': 7, 'min_weight_fraction_leaf': 0.02598938238283153, 'min_impurity_decrease': 0.9587860869766782, 'max_features': 0.3035002948487281, 'subsample': 0.3465820108865596, 'dropout_rate': 0.24093747607152624, 'ccp_alpha': 0.18249670617887154}. Best is trial 664 with value: 0.8342316538423719.[0m
[32m[I 2022-04-22 03:45:27,091][0m Trial 795 finished with value: 0.8308191687710249 and parameters: {'loss': 'coxph', 'learning_rate': 0.0036401273431581173, 'n_estimators': 894, 'criterion': 'friedman_mse', 'min_samples_split': 2, 'min_samples_leaf': 7, 'min_weight_fraction_leaf': 0.01284896812161804, 'min_impurity_decrease': 0.9440670019876709, 'max_features': 0.37692218294353047, 'subsample': 0.3717461186609065, 'dropout_rate': 0.22370212255298286, 'ccp_alpha': 0.004629570482118627}. Best is trial 664 with value: 0.8342316538423719.[0m
[32m[I 2022-04-22 03:50:02,425][0m Trial 796 finished with value: 0.25 and parameters: {'loss': 'coxph', 'learning_rate': 0.0026731482901402913, 'n_estimators': 889, 'criterion': 'absolute_error', 'min_samples_split': 2, 'min_samples_leaf': 7, 'min_weight_fraction_leaf': 0.00944313386176819, 'min_impurity_decrease': 0.9425053737506356, 'max_features': 0.3769915124835339, 'subsample': 0.34023867704168537, 'dropout_rate': 0.21936015326069763, 'ccp_alpha': 0.006225727143473322}. Best is trial 664 with value: 0.8342316538423719.[0m
[32m[I 2022-04-22 03:54:29,355][0m Trial 797 finished with value: 0.8318309028399369 and parameters: {'loss': 'coxph', 'learning_rate': 0.003052997985667046, 'n_estimators': 852, 'criterion': 'friedman_mse', 'min_samples_split': 2, 'min_samples_leaf': 7, 'min_weight_fraction_leaf': 0.015287899382220548, 'min_impurity_decrease': 0.9494129628378678, 'max_features': 0.27152968539625133, 'subsample': 0.30811258144750014, 'dropout_rate': 0.19111089140645143, 'ccp_alpha': 0.003159916704624619}. Best is trial 664 with value: 0.8342316538423719.[0m
[32m[I 2022-04-22 03:58:16,816][0m Trial 798 finished with value: 0.8276591360415232 and parameters: {'loss': 'coxph', 'learning_rate': 0.0030295395710124733, 'n_estimators': 814, 'criterion': 'friedman_mse', 'min_samples_split': 2, 'min_samples_leaf': 7, 'min_weight_fraction_leaf': 0.021754735781345586, 'min_impurity_decrease': 0.9689817103384706, 'max_features': 0.24752870793182008, 'subsample': 0.2688116311437185, 'dropout_rate': 0.18947685245787013, 'ccp_alpha': 0.09621696765343223}. Best is trial 664 with value: 0.8342316538423719.[0m
[32m[I 2022-04-22 04:02:13,862][0m Trial 799 finished with value: 0.4947773813207205 and parameters: {'loss': 'coxph', 'learning_rate': 0.0022265609884634355, 'n_estimators': 848, 'criterion': 'friedman_mse', 'min_samples_split': 2, 'min_samples_leaf': 7, 'min_weight_fraction_leaf': 0.035526535656404554, 'min_impurity_decrease': 0.9270726375662844, 'max_features': 0.27132610934854, 'subsample': 0.30306543090828875, 'dropout_rate': 0.16242720202679728, 'ccp_alpha': 0.21932788566931524}. Best is trial 664 with value: 0.8342316538423719.[0m
[32m[I 2022-04-22 04:05:19,798][0m Trial 800 finished with value: 0.824778026239686 and parameters: {'loss': 'coxph', 'learning_rate': 0.003545419846928474, 'n_estimators': 772, 'criterion': 'friedman_mse', 'min_samples_split': 2, 'min_samples_leaf': 7, 'min_weight_fraction_leaf': 0.01601715246125981, 'min_impurity_decrease': 0.08072935888364724, 'max_features': 0.23191472595896523, 'subsample': 0.28110843058928553, 'dropout_rate': 0.18756385130520195, 'ccp_alpha': 0.09562102435063952}. Best is trial 664 with value: 0.8342316538423719.[0m
[32m[I 2022-04-22 04:09:02,431][0m Trial 801 finished with value: 0.8311751880992905 and parameters: {'loss': 'coxph', 'learning_rate': 0.00439274592925661, 'n_estimators': 808, 'criterion': 'friedman_mse', 'min_samples_split': 2, 'min_samples_leaf': 7, 'min_weight_fraction_leaf': 0.025905198292255436, 'min_impurity_decrease': 0.9999801282383839, 'max_features': 0.2725460412591918, 'subsample': 0.2939318175187084, 'dropout_rate': 0.26836857355574456, 'ccp_alpha': 0.0015418978684780867}. Best is trial 664 with value: 0.8342316538423719.[0m
[32m[I 2022-04-22 04:12:58,185][0m Trial 802 finished with value: 0.8129232775585405 and parameters: {'loss': 'coxph', 'learning_rate': 0.002775290127051129, 'n_estimators': 802, 'criterion': 'friedman_mse', 'min_samples_split': 2, 'min_samples_leaf': 6, 'min_weight_fraction_leaf': 0.03139632631608494, 'min_impurity_decrease': 0.9876647033038958, 'max_features': 0.2608748778729913, 'subsample': 0.2617181619911244, 'dropout_rate': 0.25893918005416067, 'ccp_alpha': 0.17186993084725743}. Best is trial 664 with value: 0.8342316538423719.[0m
[32m[I 2022-04-22 04:18:02,775][0m Trial 803 finished with value: 0.8301554891243883 and parameters: {'loss': 'coxph', 'learning_rate': 0.003869324093143526, 'n_estimators': 925, 'criterion': 'friedman_mse', 'min_samples_split': 2, 'min_samples_leaf': 7, 'min_weight_fraction_leaf': 0.0011041692229617015, 'min_impurity_decrease': 0.9975182786979057, 'max_features': 0.21572271756356304, 'subsample': 0.289844543819061, 'dropout_rate': 0.105038792912221, 'ccp_alpha': 0.0012725993921433008}. Best is trial 664 with value: 0.8342316538423719.[0m
[32m[I 2022-04-22 04:21:47,018][0m Trial 804 finished with value: 0.2503270102305002 and parameters: {'loss': 'coxph', 'learning_rate': 0.002422891986637657, 'n_estimators': 891, 'criterion': 'friedman_mse', 'min_samples_split': 7, 'min_samples_leaf': 7, 'min_weight_fraction_leaf': 0.01278879957221058, 'min_impurity_decrease': 0.980142935079028, 'max_features': 0.2687973783209261, 'subsample': 0.2791244394252644, 'dropout_rate': 0.237847406697954, 'ccp_alpha': 0.35197137674220835}. Best is trial 664 with value: 0.8342316538423719.[0m
[32m[I 2022-04-22 04:24:54,920][0m Trial 805 finished with value: 0.38145855833042286 and parameters: {'loss': 'coxph', 'learning_rate': 0.004599879721825967, 'n_estimators': 771, 'criterion': 'friedman_mse', 'min_samples_split': 2, 'min_samples_leaf': 6, 'min_weight_fraction_leaf': 0.02724834057224318, 'min_impurity_decrease': 0.9734072656728487, 'max_features': 0.24354466726249901, 'subsample': 0.26118691729332594, 'dropout_rate': 0.21024064333040512, 'ccp_alpha': 0.23934414602283366}. Best is trial 664 with value: 0.8342316538423719.[0m
/media/san2_ssd/data/Workdir/survival/venv/lib/python3.8/site-packages/sksurv/ensemble/boosting.py:955: RuntimeWarning: divide by zero encountered in log
  time = numpy.log(time)
/media/san2_ssd/data/Workdir/survival/venv/lib/python3.8/site-packages/sksurv/ensemble/boosting.py:955: RuntimeWarning: divide by zero encountered in log
  time = numpy.log(time)
/media/san2_ssd/data/Workdir/survival/venv/lib/python3.8/site-packages/sksurv/ensemble/boosting.py:955: RuntimeWarning: divide by zero encountered in log
  time = numpy.log(time)
/media/san2_ssd/data/Workdir/survival/venv/lib/python3.8/site-packages/sksurv/ensemble/boosting.py:955: RuntimeWarning: divide by zero encountered in log
  time = numpy.log(time)
[32m[I 2022-04-22 04:25:51,254][0m Trial 806 finished with value: -0.46754510241865493 and parameters: {'loss': 'squared', 'learning_rate': 0.003044958460013005, 'n_estimators': 862, 'criterion': 'friedman_mse', 'min_samples_split': 2, 'min_samples_leaf': 7, 'min_weight_fraction_leaf': 0.03452898803246833, 'min_impurity_decrease': 0.9993341403216791, 'max_features': 0.2743835605012422, 'subsample': 0.2994778185489983, 'dropout_rate': 0.13516252746774662, 'ccp_alpha': 0.0011015904993063965}. Best is trial 664 with value: 0.8342316538423719.[0m
[32m[I 2022-04-22 04:30:25,670][0m Trial 807 finished with value: 0.8249931505744426 and parameters: {'loss': 'coxph', 'learning_rate': 0.0037797291507943587, 'n_estimators': 921, 'criterion': 'friedman_mse', 'min_samples_split': 2, 'min_samples_leaf': 7, 'min_weight_fraction_leaf': 0.009486539993310677, 'min_impurity_decrease': 0.9530353174120163, 'max_features': 0.294314597083256, 'subsample': 0.30210774011274144, 'dropout_rate': 0.263646591455553, 'ccp_alpha': 0.10580800550212059}. Best is trial 664 with value: 0.8342316538423719.[0m
[32m[I 2022-04-22 04:34:08,993][0m Trial 808 finished with value: 0.5521549754968962 and parameters: {'loss': 'coxph', 'learning_rate': 0.004732530441773816, 'n_estimators': 810, 'criterion': 'friedman_mse', 'min_samples_split': 2, 'min_samples_leaf': 7, 'min_weight_fraction_leaf': 0.43276158873121473, 'min_impurity_decrease': 0.9666239713676898, 'max_features': 0.2795945762372728, 'subsample': 0.31809599617547124, 'dropout_rate': 0.1886141295466932, 'ccp_alpha': 0.15547654903114932}. Best is trial 664 with value: 0.8342316538423719.[0m
[32m[I 2022-04-22 04:38:51,583][0m Trial 809 finished with value: 0.25 and parameters: {'loss': 'coxph', 'learning_rate': 0.004896187610730396, 'n_estimators': 966, 'criterion': 'friedman_mse', 'min_samples_split': 2, 'min_samples_leaf': 7, 'min_weight_fraction_leaf': 0.023789559515467063, 'min_impurity_decrease': 0.9580576972760283, 'max_features': 0.2336890245024339, 'subsample': 0.2715039023905049, 'dropout_rate': 0.24509588249948489, 'ccp_alpha': 1.0593171619037065}. Best is trial 664 with value: 0.8342316538423719.[0m
[32m[I 2022-04-22 04:43:17,391][0m Trial 810 finished with value: 0.8287125732359002 and parameters: {'loss': 'coxph', 'learning_rate': 0.003393411859419123, 'n_estimators': 865, 'criterion': 'friedman_mse', 'min_samples_split': 2, 'min_samples_leaf': 6, 'min_weight_fraction_leaf': 0.0013972242739233014, 'min_impurity_decrease': 0.9800760917237364, 'max_features': 0.29316222225481464, 'subsample': 0.2918433751585719, 'dropout_rate': 0.20973513525185453, 'ccp_alpha': 0.09447749920601459}. Best is trial 664 with value: 0.8342316538423719.[0m
[32m[I 2022-04-22 04:46:19,081][0m Trial 811 finished with value: 0.25662745571200507 and parameters: {'loss': 'coxph', 'learning_rate': 0.0041624256737064205, 'n_estimators': 769, 'criterion': 'friedman_mse', 'min_samples_split': 2, 'min_samples_leaf': 7, 'min_weight_fraction_leaf': 0.011281049197244432, 'min_impurity_decrease': 0.9983819642949686, 'max_features': 0.25571604844444706, 'subsample': 0.311843356130893, 'dropout_rate': 0.2647499435306629, 'ccp_alpha': 0.2993707200593697}. Best is trial 664 with value: 0.8342316538423719.[0m
[32m[I 2022-04-22 04:51:17,409][0m Trial 812 finished with value: 0.8321675780503005 and parameters: {'loss': 'coxph', 'learning_rate': 0.005637106260907069, 'n_estimators': 956, 'criterion': 'friedman_mse', 'min_samples_split': 2, 'min_samples_leaf': 7, 'min_weight_fraction_leaf': 0.019915819254925443, 'min_impurity_decrease': 0.9796280399402737, 'max_features': 0.32005108635453405, 'subsample': 0.3210003038093184, 'dropout_rate': 0.22686162994689876, 'ccp_alpha': 0.0016475591786196642}. Best is trial 664 with value: 0.8342316538423719.[0m
[32m[I 2022-04-22 04:56:45,609][0m Trial 813 finished with value: 0.699348763319462 and parameters: {'loss': 'coxph', 'learning_rate': 0.005731251299916782, 'n_estimators': 999, 'criterion': 'friedman_mse', 'min_samples_split': 2, 'min_samples_leaf': 7, 'min_weight_fraction_leaf': 0.023679668018231907, 'min_impurity_decrease': 0.9779695028739841, 'max_features': 0.3216272488453946, 'subsample': 0.32299573139630905, 'dropout_rate': 0.22360813649665204, 'ccp_alpha': 0.17344164090724667}. Best is trial 664 with value: 0.8342316538423719.[0m
[32m[I 2022-04-22 05:02:49,054][0m Trial 814 finished with value: 0.8314511641786962 and parameters: {'loss': 'coxph', 'learning_rate': 0.0043289464595793825, 'n_estimators': 958, 'criterion': 'friedman_mse', 'min_samples_split': 2, 'min_samples_leaf': 7, 'min_weight_fraction_leaf': 0.01744467433278226, 'min_impurity_decrease': 0.9537450622149808, 'max_features': 0.32011945929244373, 'subsample': 0.32254760089537693, 'dropout_rate': 0.1667781738928937, 'ccp_alpha': 0.0016273768832594738}. Best is trial 664 with value: 0.8342316538423719.[0m
[32m[I 2022-04-22 05:07:46,524][0m Trial 815 finished with value: 0.8227242454267273 and parameters: {'loss': 'coxph', 'learning_rate': 0.0026646775414740343, 'n_estimators': 931, 'criterion': 'friedman_mse', 'min_samples_split': 2, 'min_samples_leaf': 7, 'min_weight_fraction_leaf': 0.03267233657242212, 'min_impurity_decrease': 0.9551337266038693, 'max_features': 0.29700585368249804, 'subsample': 0.3078248426157296, 'dropout_rate': 0.14585577476248224, 'ccp_alpha': 0.09657530195877866}. Best is trial 664 with value: 0.8342316538423719.[0m
