[32m[I 2022-04-22 05:47:31,068][0m Trial 926 finished with value: 0.6712716351161425 and parameters: {'alpha': 3.630517264819986, 'ties': 'efron'}. Best is trial 51 with value: 0.6718225721814719.[0m
[32m[I 2022-04-22 05:47:59,516][0m Trial 927 finished with value: 0.6713391442925675 and parameters: {'alpha': 3.83058903537605, 'ties': 'breslow'}. Best is trial 51 with value: 0.6718225721814719.[0m
[32m[I 2022-04-22 05:48:29,105][0m Trial 928 finished with value: 0.6712748199918555 and parameters: {'alpha': 3.9342937534406768, 'ties': 'breslow'}. Best is trial 51 with value: 0.6718225721814719.[0m
[32m[I 2022-04-22 05:48:59,042][0m Trial 929 finished with value: 0.6714381495717138 and parameters: {'alpha': 3.724471446964712, 'ties': 'breslow'}. Best is trial 51 with value: 0.6718225721814719.[0m
[32m[I 2022-04-22 05:49:29,282][0m Trial 930 finished with value: 0.6715012772624975 and parameters: {'alpha': 3.801237837227822, 'ties': 'breslow'}. Best is trial 51 with value: 0.6718225721814719.[0m
[32m[I 2022-04-22 05:49:59,334][0m Trial 931 finished with value: 0.6710387141360685 and parameters: {'alpha': 3.5520822684218625, 'ties': 'breslow'}. Best is trial 51 with value: 0.6718225721814719.[0m
[32m[I 2022-04-22 05:50:28,680][0m Trial 932 finished with value: 0.6712758842947594 and parameters: {'alpha': 3.6985442735719865, 'ties': 'breslow'}. Best is trial 51 with value: 0.6718225721814719.[0m
[32m[I 2022-04-22 05:50:58,444][0m Trial 933 finished with value: 0.671167534643619 and parameters: {'alpha': 3.4245418580438733, 'ties': 'breslow'}. Best is trial 51 with value: 0.6718225721814719.[0m
[32m[I 2022-04-22 05:51:29,894][0m Trial 934 finished with value: 0.6704033425369416 and parameters: {'alpha': 4.148528035702132, 'ties': 'breslow'}. Best is trial 51 with value: 0.6718225721814719.[0m
[32m[I 2022-04-22 05:52:02,098][0m Trial 935 finished with value: 0.6705709596314063 and parameters: {'alpha': 4.038665602407407, 'ties': 'breslow'}. Best is trial 51 with value: 0.6718225721814719.[0m
[32m[I 2022-04-22 05:52:33,032][0m Trial 936 finished with value: 0.6714246373157657 and parameters: {'alpha': 3.8114615374688157, 'ties': 'breslow'}. Best is trial 51 with value: 0.6718225721814719.[0m
[32m[I 2022-04-22 05:53:04,196][0m Trial 937 finished with value: 0.6711796766006307 and parameters: {'alpha': 3.9252616010770454, 'ties': 'breslow'}. Best is trial 51 with value: 0.6718225721814719.[0m
[32m[I 2022-04-22 05:53:35,059][0m Trial 938 finished with value: 0.670957560396671 and parameters: {'alpha': 3.6545740401226467, 'ties': 'breslow'}. Best is trial 51 with value: 0.6718225721814719.[0m
[32m[I 2022-04-22 05:54:06,450][0m Trial 939 finished with value: 0.6713323130079433 and parameters: {'alpha': 3.8482403559652716, 'ties': 'breslow'}. Best is trial 51 with value: 0.6718225721814719.[0m
[32m[I 2022-04-22 05:54:34,813][0m Trial 940 finished with value: 0.6710116979986835 and parameters: {'alpha': 3.5118038494174546, 'ties': 'breslow'}. Best is trial 51 with value: 0.6718225721814719.[0m
[32m[I 2022-04-22 05:55:06,437][0m Trial 941 finished with value: 0.6711977437780883 and parameters: {'alpha': 3.704773373374738, 'ties': 'breslow'}. Best is trial 51 with value: 0.6718225721814719.[0m
[32m[I 2022-04-22 05:55:35,835][0m Trial 942 finished with value: 0.6704232670604819 and parameters: {'alpha': 3.997015857945085, 'ties': 'breslow'}. Best is trial 51 with value: 0.6718225721814719.[0m
[32m[I 2022-04-22 05:56:04,356][0m Trial 943 finished with value: 0.6716673515982117 and parameters: {'alpha': 3.7625617729268166, 'ties': 'breslow'}. Best is trial 51 with value: 0.6718225721814719.[0m
[32m[I 2022-04-22 05:56:33,449][0m Trial 944 finished with value: 0.6709611038444385 and parameters: {'alpha': 3.5809092457371765, 'ties': 'breslow'}. Best is trial 51 with value: 0.6718225721814719.[0m
[32m[I 2022-04-22 05:57:01,876][0m Trial 945 finished with value: 0.6712563165473625 and parameters: {'alpha': 3.911484982048754, 'ties': 'breslow'}. Best is trial 51 with value: 0.6718225721814719.[0m
[32m[I 2022-04-22 05:57:30,862][0m Trial 946 finished with value: 0.6717410205240577 and parameters: {'alpha': 3.7772868161367286, 'ties': 'breslow'}. Best is trial 51 with value: 0.6718225721814719.[0m
[32m[I 2022-04-22 05:58:01,462][0m Trial 947 finished with value: 0.6711139737370374 and parameters: {'alpha': 3.6726443936486715, 'ties': 'efron'}. Best is trial 51 with value: 0.6718225721814719.[0m
[32m[I 2022-04-22 05:58:30,467][0m Trial 948 finished with value: 0.6714139969723817 and parameters: {'alpha': 3.8740290952753944, 'ties': 'breslow'}. Best is trial 51 with value: 0.6718225721814719.[0m
[32m[I 2022-04-22 05:58:59,794][0m Trial 949 finished with value: 0.6710385818290442 and parameters: {'alpha': 3.623015319874791, 'ties': 'breslow'}. Best is trial 51 with value: 0.6718225721814719.[0m
[32m[I 2022-04-22 05:59:28,089][0m Trial 950 finished with value: 0.6717410205240577 and parameters: {'alpha': 3.7785289015511725, 'ties': 'breslow'}. Best is trial 51 with value: 0.6718225721814719.[0m
[32m[I 2022-04-22 05:59:59,134][0m Trial 951 finished with value: 0.6705709596314063 and parameters: {'alpha': 4.043236773191127, 'ties': 'breslow'}. Best is trial 51 with value: 0.6718225721814719.[0m
[32m[I 2022-04-22 06:00:28,930][0m Trial 952 finished with value: 0.6712748199918555 and parameters: {'alpha': 3.9348793301445313, 'ties': 'breslow'}. Best is trial 51 with value: 0.6718225721814719.[0m
[32m[I 2022-04-22 06:00:59,486][0m Trial 953 finished with value: 0.6714246373157657 and parameters: {'alpha': 3.8127315140253937, 'ties': 'breslow'}. Best is trial 51 with value: 0.6718225721814719.[0m
[32m[I 2022-04-22 06:01:30,290][0m Trial 954 finished with value: 0.6714381495717138 and parameters: {'alpha': 3.720945889422405, 'ties': 'breslow'}. Best is trial 51 with value: 0.6718225721814719.[0m
[32m[I 2022-04-22 06:02:00,425][0m Trial 955 finished with value: 0.6710385818290442 and parameters: {'alpha': 3.618557067887099, 'ties': 'breslow'}. Best is trial 51 with value: 0.6718225721814719.[0m
[32m[I 2022-04-22 06:02:28,029][0m Trial 956 finished with value: 0.6713378682047766 and parameters: {'alpha': 3.880673412542211, 'ties': 'breslow'}. Best is trial 51 with value: 0.6718225721814719.[0m
[32m[I 2022-04-22 06:02:57,245][0m Trial 957 finished with value: 0.6708528438624721 and parameters: {'alpha': 3.500909281891885, 'ties': 'breslow'}. Best is trial 51 with value: 0.6718225721814719.[0m
[32m[I 2022-04-22 06:03:25,163][0m Trial 958 finished with value: 0.6712758842947594 and parameters: {'alpha': 3.701588247623253, 'ties': 'breslow'}. Best is trial 51 with value: 0.6718225721814719.[0m
[32m[I 2022-04-22 06:03:52,639][0m Trial 959 finished with value: 0.6713323130079433 and parameters: {'alpha': 3.8500237317049177, 'ties': 'breslow'}. Best is trial 51 with value: 0.6718225721814719.[0m
[32m[I 2022-04-22 06:04:19,488][0m Trial 960 finished with value: 0.6703826466407967 and parameters: {'alpha': 4.253289972599394, 'ties': 'breslow'}. Best is trial 51 with value: 0.6718225721814719.[0m
[32m[I 2022-04-22 06:04:47,761][0m Trial 961 finished with value: 0.6703417154030678 and parameters: {'alpha': 4.0046581892184925, 'ties': 'breslow'}. Best is trial 51 with value: 0.6718225721814719.[0m
[32m[I 2022-04-22 06:05:17,117][0m Trial 962 finished with value: 0.6707658929071851 and parameters: {'alpha': 3.3683480423663013, 'ties': 'breslow'}. Best is trial 51 with value: 0.6718225721814719.[0m
[32m[I 2022-04-22 06:05:46,152][0m Trial 963 finished with value: 0.6709611038444385 and parameters: {'alpha': 3.568828988088872, 'ties': 'breslow'}. Best is trial 51 with value: 0.6718225721814719.[0m
[32m[I 2022-04-22 06:06:14,224][0m Trial 964 finished with value: 0.6712630044518841 and parameters: {'alpha': 3.7717538947184974, 'ties': 'efron'}. Best is trial 51 with value: 0.6718225721814719.[0m
[32m[I 2022-04-22 06:06:42,585][0m Trial 965 finished with value: 0.6705615341410874 and parameters: {'alpha': 4.119458777052224, 'ties': 'breslow'}. Best is trial 51 with value: 0.6718225721814719.[0m
[32m[I 2022-04-22 06:07:09,283][0m Trial 966 finished with value: 0.6715134091726827 and parameters: {'alpha': 3.756730800137773, 'ties': 'breslow'}. Best is trial 51 with value: 0.6718225721814719.[0m
[32m[I 2022-04-22 06:07:38,196][0m Trial 967 finished with value: 0.670957560396671 and parameters: {'alpha': 3.649217034878919, 'ties': 'breslow'}. Best is trial 51 with value: 0.6718225721814719.[0m
[32m[I 2022-04-22 06:08:05,622][0m Trial 968 finished with value: 0.6711796766006307 and parameters: {'alpha': 3.9295202132909686, 'ties': 'breslow'}. Best is trial 51 with value: 0.6718225721814719.[0m
[32m[I 2022-04-22 06:08:34,779][0m Trial 969 finished with value: 0.6713323130079433 and parameters: {'alpha': 3.8418842286781354, 'ties': 'breslow'}. Best is trial 51 with value: 0.6718225721814719.[0m
[32m[I 2022-04-22 06:08:59,729][0m Trial 970 finished with value: 0.6711977437780883 and parameters: {'alpha': 3.70685226731341, 'ties': 'breslow'}. Best is trial 51 with value: 0.6718225721814719.[0m
[32m[I 2022-04-22 06:09:28,915][0m Trial 971 finished with value: 0.6713430856583515 and parameters: {'alpha': 3.821176615491719, 'ties': 'breslow'}. Best is trial 51 with value: 0.6718225721814719.[0m
[32m[I 2022-04-22 06:09:57,297][0m Trial 972 finished with value: 0.6710116979986835 and parameters: {'alpha': 3.5103256732554464, 'ties': 'breslow'}. Best is trial 51 with value: 0.6718225721814719.[0m
[32m[I 2022-04-22 06:10:24,825][0m Trial 973 finished with value: 0.6710392443611095 and parameters: {'alpha': 3.608170726711398, 'ties': 'breslow'}. Best is trial 51 with value: 0.6718225721814719.[0m
[32m[I 2022-04-22 06:10:55,213][0m Trial 974 finished with value: 0.6667309044527873 and parameters: {'alpha': 1.800511396595424, 'ties': 'breslow'}. Best is trial 51 with value: 0.6718225721814719.[0m
[32m[I 2022-04-22 06:11:22,061][0m Trial 975 finished with value: 0.670653753740832 and parameters: {'alpha': 3.9816675390371703, 'ties': 'breslow'}. Best is trial 51 with value: 0.6718225721814719.[0m
[32m[I 2022-04-22 06:11:49,299][0m Trial 976 finished with value: 0.6714139969723817 and parameters: {'alpha': 3.875980418348394, 'ties': 'breslow'}. Best is trial 51 with value: 0.6718225721814719.[0m
[32m[I 2022-04-22 06:12:16,259][0m Trial 977 finished with value: 0.6714381495717138 and parameters: {'alpha': 3.719808318155673, 'ties': 'breslow'}. Best is trial 51 with value: 0.6718225721814719.[0m
[32m[I 2022-04-22 06:12:43,277][0m Trial 978 finished with value: 0.6716643805773258 and parameters: {'alpha': 3.78619399846071, 'ties': 'breslow'}. Best is trial 51 with value: 0.6718225721814719.[0m
[32m[I 2022-04-22 06:13:13,242][0m Trial 979 finished with value: 0.6685708606937647 and parameters: {'alpha': 2.264626260081906, 'ties': 'breslow'}. Best is trial 51 with value: 0.6718225721814719.[0m
[32m[I 2022-04-22 06:13:40,658][0m Trial 980 finished with value: 0.6714352686560117 and parameters: {'alpha': 3.75436182972088, 'ties': 'breslow'}. Best is trial 51 with value: 0.6718225721814719.[0m
[32m[I 2022-04-22 06:14:07,099][0m Trial 981 finished with value: 0.6708794198799999 and parameters: {'alpha': 3.6339957812995505, 'ties': 'breslow'}. Best is trial 51 with value: 0.6718225721814719.[0m
[32m[I 2022-04-22 06:14:34,757][0m Trial 982 finished with value: 0.6708879997850365 and parameters: {'alpha': 3.949316305959691, 'ties': 'breslow'}. Best is trial 51 with value: 0.6718225721814719.[0m
[32m[I 2022-04-22 06:15:03,345][0m Trial 983 finished with value: 0.6714105858316386 and parameters: {'alpha': 3.8638353677961095, 'ties': 'breslow'}. Best is trial 51 with value: 0.6718225721814719.[0m
[32m[I 2022-04-22 06:15:30,714][0m Trial 984 finished with value: 0.6706491001480773 and parameters: {'alpha': 4.054072210898036, 'ties': 'breslow'}. Best is trial 51 with value: 0.6718225721814719.[0m
[32m[I 2022-04-22 06:15:56,255][0m Trial 985 finished with value: 0.6711977864159386 and parameters: {'alpha': 3.4416382328140545, 'ties': 'efron'}. Best is trial 51 with value: 0.6718225721814719.[0m
[32m[I 2022-04-22 06:16:22,953][0m Trial 986 finished with value: 0.670957560396671 and parameters: {'alpha': 3.6497347068666226, 'ties': 'breslow'}. Best is trial 51 with value: 0.6718225721814719.[0m
[32m[I 2022-04-22 06:16:55,164][0m Trial 987 finished with value: 0.6679503436672964 and parameters: {'alpha': 0.8056936393968239, 'ties': 'breslow'}. Best is trial 51 with value: 0.6718225721814719.[0m
[32m[I 2022-04-22 06:17:22,707][0m Trial 988 finished with value: 0.6713571281393407 and parameters: {'alpha': 3.748509016486865, 'ties': 'breslow'}. Best is trial 51 with value: 0.6718225721814719.[0m
[32m[I 2022-04-22 06:17:49,367][0m Trial 989 finished with value: 0.671193319093663 and parameters: {'alpha': 3.544006128672181, 'ties': 'breslow'}. Best is trial 51 with value: 0.6718225721814719.[0m
[32m[I 2022-04-22 06:18:15,739][0m Trial 990 finished with value: 0.6715012772624975 and parameters: {'alpha': 3.7993795988798316, 'ties': 'breslow'}. Best is trial 51 with value: 0.6718225721814719.[0m
[32m[I 2022-04-22 06:18:45,285][0m Trial 991 finished with value: 0.6705500435122055 and parameters: {'alpha': 3.184178640702954, 'ties': 'breslow'}. Best is trial 51 with value: 0.6718225721814719.[0m
[32m[I 2022-04-22 06:19:12,321][0m Trial 992 finished with value: 0.6711796766006307 and parameters: {'alpha': 3.9208399720145732, 'ties': 'breslow'}. Best is trial 51 with value: 0.6718225721814719.[0m
[32m[I 2022-04-22 06:19:37,942][0m Trial 993 finished with value: 0.6711982740031293 and parameters: {'alpha': 3.690291025265665, 'ties': 'breslow'}. Best is trial 51 with value: 0.6718225721814719.[0m
[32m[I 2022-04-22 06:20:05,623][0m Trial 994 finished with value: 0.6713323130079433 and parameters: {'alpha': 3.841570417423522, 'ties': 'breslow'}. Best is trial 51 with value: 0.6718225721814719.[0m
[32m[I 2022-04-22 06:20:33,107][0m Trial 995 finished with value: 0.6710392443611095 and parameters: {'alpha': 3.597724333330112, 'ties': 'breslow'}. Best is trial 51 with value: 0.6718225721814719.[0m
[32m[I 2022-04-22 06:21:02,109][0m Trial 996 finished with value: 0.6704232670604819 and parameters: {'alpha': 3.993391348510091, 'ties': 'breslow'}. Best is trial 51 with value: 0.6718225721814719.[0m
[32m[I 2022-04-22 06:21:29,346][0m Trial 997 finished with value: 0.6705615341410874 and parameters: {'alpha': 4.124581675444486, 'ties': 'breslow'}. Best is trial 51 with value: 0.6718225721814719.[0m
[32m[I 2022-04-22 06:21:56,118][0m Trial 998 finished with value: 0.6711167223457152 and parameters: {'alpha': 3.6835864963108915, 'ties': 'breslow'}. Best is trial 51 with value: 0.6718225721814719.[0m
[32m[I 2022-04-22 06:22:23,439][0m Trial 999 finished with value: 0.6713378682047766 and parameters: {'alpha': 3.883621358908578, 'ties': 'breslow'}. Best is trial 51 with value: 0.6718225721814719.[0m
CoxPH
Running Optimizer with LogRank binary scoring
{'alpha': 3.770957059564586, 'ties': 'breslow', 'UnoC_LR': 0.835911286090736}
Running Optimizer normaly
{'alpha': 3.773822021927384, 'ties': 'breslow', 'UnoC': 0.6718225721814719}
