[32m[I 2022-04-21 16:59:18,793][0m Trial 292 finished with value: 0.8440868143743929 and parameters: {'loss': 'coxph', 'learning_rate': 0.00012319413794586038, 'n_estimators': 321, 'criterion': 'friedman_mse', 'min_samples_split': 2, 'min_samples_leaf': 4, 'min_weight_fraction_leaf': 0.19009434706822032, 'min_impurity_decrease': 0.27830232723817744, 'max_features': 0.2621348632659916, 'subsample': 0.07920904036358957, 'dropout_rate': 0.12880601485961052, 'ccp_alpha': 0.003609806135614041}. Best is trial 244 with value: 0.8474070660226068.[0m
[32m[I 2022-04-21 16:59:42,078][0m Trial 293 finished with value: 0.8403750692048619 and parameters: {'loss': 'coxph', 'learning_rate': 0.00016249188668564408, 'n_estimators': 279, 'criterion': 'friedman_mse', 'min_samples_split': 3, 'min_samples_leaf': 1, 'min_weight_fraction_leaf': 0.17354942683276356, 'min_impurity_decrease': 0.2525629208701008, 'max_features': 0.336188786237792, 'subsample': 0.11520799200873916, 'dropout_rate': 0.10804758385858819, 'ccp_alpha': 0.17056758636709096}. Best is trial 244 with value: 0.8474070660226068.[0m
[32m[I 2022-04-21 16:59:58,617][0m Trial 294 finished with value: 0.8444183575838953 and parameters: {'loss': 'coxph', 'learning_rate': 5.8536632919730253e-05, 'n_estimators': 252, 'criterion': 'friedman_mse', 'min_samples_split': 5, 'min_samples_leaf': 2, 'min_weight_fraction_leaf': 0.22259104167409266, 'min_impurity_decrease': 0.3605189316671281, 'max_features': 0.30099020235325846, 'subsample': 0.10057705006442257, 'dropout_rate': 0.18336880412900664, 'ccp_alpha': 0.10303534012957727}. Best is trial 244 with value: 0.8474070660226068.[0m
[32m[I 2022-04-21 17:00:13,859][0m Trial 295 finished with value: 0.8393957491998177 and parameters: {'loss': 'coxph', 'learning_rate': 3.9052033318122944e-05, 'n_estimators': 265, 'criterion': 'friedman_mse', 'min_samples_split': 3, 'min_samples_leaf': 2, 'min_weight_fraction_leaf': 0.15559920198312022, 'min_impurity_decrease': 0.32837047468449787, 'max_features': 0.7795023241216285, 'subsample': 0.14000006430806625, 'dropout_rate': 0.04264516483788204, 'ccp_alpha': 0.2985980723979659}. Best is trial 244 with value: 0.8474070660226068.[0m
[32m[I 2022-04-21 17:00:22,419][0m Trial 296 finished with value: 0.8330380657835674 and parameters: {'loss': 'coxph', 'learning_rate': 9.762385553496032e-05, 'n_estimators': 165, 'criterion': 'absolute_error', 'min_samples_split': 3, 'min_samples_leaf': 2, 'min_weight_fraction_leaf': 0.13881211648423708, 'min_impurity_decrease': 0.29324774334117365, 'max_features': 0.36968991930686246, 'subsample': 0.06762797071967347, 'dropout_rate': 0.0696752345127219, 'ccp_alpha': 0.1938063254142834}. Best is trial 244 with value: 0.8474070660226068.[0m
[32m[I 2022-04-21 17:00:38,241][0m Trial 297 finished with value: 0.8411751323170151 and parameters: {'loss': 'coxph', 'learning_rate': 0.00024865781543125643, 'n_estimators': 212, 'criterion': 'friedman_mse', 'min_samples_split': 2, 'min_samples_leaf': 2, 'min_weight_fraction_leaf': 0.1831374173662428, 'min_impurity_decrease': 0.5845889376222047, 'max_features': 0.3100321054344591, 'subsample': 0.03335140914688048, 'dropout_rate': 0.14811296687545572, 'ccp_alpha': 0.0012424634900243137}. Best is trial 244 with value: 0.8474070660226068.[0m
[32m[I 2022-04-21 17:01:04,432][0m Trial 298 finished with value: 0.8440316247171961 and parameters: {'loss': 'coxph', 'learning_rate': 0.0006795875908772826, 'n_estimators': 332, 'criterion': 'friedman_mse', 'min_samples_split': 4, 'min_samples_leaf': 1, 'min_weight_fraction_leaf': 0.19952830574103397, 'min_impurity_decrease': 0.22454759649575687, 'max_features': 0.6341946184445106, 'subsample': 0.08735631191457428, 'dropout_rate': 0.09727451959200659, 'ccp_alpha': 0.09372246747844733}. Best is trial 244 with value: 0.8474070660226068.[0m
[32m[I 2022-04-21 17:01:25,600][0m Trial 299 finished with value: 0.6758484765476891 and parameters: {'loss': 'coxph', 'learning_rate': 7.354653069366735e-05, 'n_estimators': 297, 'criterion': 'friedman_mse', 'min_samples_split': 3, 'min_samples_leaf': 3, 'min_weight_fraction_leaf': 0.16829599959204286, 'min_impurity_decrease': 0.3120887584969673, 'max_features': 0.2722535386791132, 'subsample': 0.39354181081071027, 'dropout_rate': 0.12652573227703776, 'ccp_alpha': 0.4388952570600868}. Best is trial 244 with value: 0.8474070660226068.[0m
/media/san2_ssd/data/Workdir/survival/venv/lib/python3.8/site-packages/sksurv/ensemble/boosting.py:955: RuntimeWarning: divide by zero encountered in log
  time = numpy.log(time)
/media/san2_ssd/data/Workdir/survival/venv/lib/python3.8/site-packages/sksurv/ensemble/boosting.py:955: RuntimeWarning: divide by zero encountered in log
  time = numpy.log(time)
/media/san2_ssd/data/Workdir/survival/venv/lib/python3.8/site-packages/sksurv/ensemble/boosting.py:955: RuntimeWarning: divide by zero encountered in log
  time = numpy.log(time)
/media/san2_ssd/data/Workdir/survival/venv/lib/python3.8/site-packages/sksurv/ensemble/boosting.py:955: RuntimeWarning: divide by zero encountered in log
  time = numpy.log(time)
[32m[I 2022-04-21 17:01:28,841][0m Trial 300 finished with value: -0.46667268029349207 and parameters: {'loss': 'squared', 'learning_rate': 0.0003586170499813071, 'n_estimators': 313, 'criterion': 'friedman_mse', 'min_samples_split': 3, 'min_samples_leaf': 2, 'min_weight_fraction_leaf': 0.2075339628970841, 'min_impurity_decrease': 0.6598376346941524, 'max_features': 0.8712359145872761, 'subsample': 0.11478964545727921, 'dropout_rate': 0.17009839506776267, 'ccp_alpha': 0.23798282489742364}. Best is trial 244 with value: 0.8474070660226068.[0m
[32m[I 2022-04-21 17:01:54,363][0m Trial 301 finished with value: 0.65 and parameters: {'loss': 'coxph', 'learning_rate': 0.00017884740509676737, 'n_estimators': 353, 'criterion': 'friedman_mse', 'min_samples_split': 6, 'min_samples_leaf': 2, 'min_weight_fraction_leaf': 0.12518529575462195, 'min_impurity_decrease': 0.16128957245849024, 'max_features': 0.9614317270153413, 'subsample': 0.056049155556490544, 'dropout_rate': 0.2089254088678412, 'ccp_alpha': 3.432943723560969}. Best is trial 244 with value: 0.8474070660226068.[0m
[32m[I 2022-04-21 17:02:13,414][0m Trial 302 finished with value: 0.8420418187637619 and parameters: {'loss': 'coxph', 'learning_rate': 0.00011840400637329874, 'n_estimators': 285, 'criterion': 'friedman_mse', 'min_samples_split': 9, 'min_samples_leaf': 1, 'min_weight_fraction_leaf': 0.24089182553645422, 'min_impurity_decrease': 0.4333271047394447, 'max_features': 0.15769554943244857, 'subsample': 0.15240372458129842, 'dropout_rate': 0.09391957778935131, 'ccp_alpha': 0.10489945289587892}. Best is trial 244 with value: 0.8474070660226068.[0m
[32m[I 2022-04-21 17:02:23,705][0m Trial 303 finished with value: 0.8464846382930709 and parameters: {'loss': 'coxph', 'learning_rate': 0.003192569356602061, 'n_estimators': 229, 'criterion': 'friedman_mse', 'min_samples_split': 3, 'min_samples_leaf': 2, 'min_weight_fraction_leaf': 0.19117121906675183, 'min_impurity_decrease': 0.6893268763205799, 'max_features': 0.342880641299886, 'subsample': 0.07560648054413338, 'dropout_rate': 0.14147179851847386, 'ccp_alpha': 0.19583475917804857}. Best is trial 244 with value: 0.8474070660226068.[0m
[32m[I 2022-04-21 17:02:37,960][0m Trial 304 finished with value: 0.8430811216308666 and parameters: {'loss': 'coxph', 'learning_rate': 0.0032044691795703245, 'n_estimators': 246, 'criterion': 'friedman_mse', 'min_samples_split': 5, 'min_samples_leaf': 2, 'min_weight_fraction_leaf': 0.1915343181670216, 'min_impurity_decrease': 0.3981500034208072, 'max_features': 0.35146214819460986, 'subsample': 0.06874054697355637, 'dropout_rate': 0.15330137116524795, 'ccp_alpha': 0.3222006168971483}. Best is trial 244 with value: 0.8474070660226068.[0m
[32m[I 2022-04-21 17:02:48,474][0m Trial 305 finished with value: 0.8415090061739574 and parameters: {'loss': 'coxph', 'learning_rate': 0.0018478282071790887, 'n_estimators': 229, 'criterion': 'friedman_mse', 'min_samples_split': 2, 'min_samples_leaf': 2, 'min_weight_fraction_leaf': 0.2167479617181667, 'min_impurity_decrease': 0.6873245297154681, 'max_features': 0.33793583494941676, 'subsample': 0.0329337110868779, 'dropout_rate': 0.1838148258818932, 'ccp_alpha': 0.21411266328460285}. Best is trial 244 with value: 0.8474070660226068.[0m
[32m[I 2022-04-21 17:03:03,814][0m Trial 306 finished with value: 0.65 and parameters: {'loss': 'coxph', 'learning_rate': 8.881392901599714e-05, 'n_estimators': 239, 'criterion': 'friedman_mse', 'min_samples_split': 3, 'min_samples_leaf': 2, 'min_weight_fraction_leaf': 0.20072734709189965, 'min_impurity_decrease': 0.7422459981855983, 'max_features': 0.19557606277462886, 'subsample': 0.016309916490430277, 'dropout_rate': 0.13487491071328367, 'ccp_alpha': 0.004881176044456814}. Best is trial 244 with value: 0.8474070660226068.[0m
[32m[I 2022-04-21 17:03:15,969][0m Trial 307 finished with value: 0.65 and parameters: {'loss': 'coxph', 'learning_rate': 0.004218597327974315, 'n_estimators': 206, 'criterion': 'friedman_mse', 'min_samples_split': 3, 'min_samples_leaf': 3, 'min_weight_fraction_leaf': 0.1861790655806215, 'min_impurity_decrease': 0.8122306007993807, 'max_features': 0.38816997901542816, 'subsample': 0.08519695858273625, 'dropout_rate': 0.1660897640406071, 'ccp_alpha': 3.9383387287657854}. Best is trial 244 with value: 0.8474070660226068.[0m
[32m[I 2022-04-21 17:03:45,423][0m Trial 308 finished with value: 0.65 and parameters: {'loss': 'coxph', 'learning_rate': 0.0025100389323775524, 'n_estimators': 400, 'criterion': 'friedman_mse', 'min_samples_split': 3, 'min_samples_leaf': 2, 'min_weight_fraction_leaf': 0.17461723631831966, 'min_impurity_decrease': 0.7004087046866532, 'max_features': 0.3180771283092071, 'subsample': 0.001184639945026142, 'dropout_rate': 0.24224338389198175, 'ccp_alpha': 4.4750229081504465}. Best is trial 244 with value: 0.8474070660226068.[0m
[32m[I 2022-04-21 17:04:49,620][0m Trial 309 finished with value: 0.8431634777638941 and parameters: {'loss': 'coxph', 'learning_rate': 0.003454678100042215, 'n_estimators': 530, 'criterion': 'friedman_mse', 'min_samples_split': 2, 'min_samples_leaf': 2, 'min_weight_fraction_leaf': 0.19685883723929964, 'min_impurity_decrease': 0.3429161065700638, 'max_features': 0.36738895580075703, 'subsample': 0.05194072712133646, 'dropout_rate': 0.1456698237680166, 'ccp_alpha': 0.32089761593740074}. Best is trial 244 with value: 0.8474070660226068.[0m
[32m[I 2022-04-21 17:05:01,437][0m Trial 310 finished with value: 0.7425347703223014 and parameters: {'loss': 'coxph', 'learning_rate': 0.005245998939017152, 'n_estimators': 229, 'criterion': 'friedman_mse', 'min_samples_split': 6, 'min_samples_leaf': 4, 'min_weight_fraction_leaf': 0.18059707772469558, 'min_impurity_decrease': 0.544571299828722, 'max_features': 0.28603300330197146, 'subsample': 0.07316918851785166, 'dropout_rate': 0.06945198965535156, 'ccp_alpha': 0.16440541504434716}. Best is trial 244 with value: 0.8474070660226068.[0m
[32m[I 2022-04-21 17:07:30,301][0m Trial 311 finished with value: 0.7359900195425254 and parameters: {'loss': 'coxph', 'learning_rate': 0.0001319448444047839, 'n_estimators': 807, 'criterion': 'friedman_mse', 'min_samples_split': 3, 'min_samples_leaf': 1, 'min_weight_fraction_leaf': 0.20593319919583797, 'min_impurity_decrease': 0.3737198158430679, 'max_features': 0.21305635449855959, 'subsample': 0.7847314451695913, 'dropout_rate': 0.20128127883931343, 'ccp_alpha': 0.08753383318747153}. Best is trial 244 with value: 0.8474070660226068.[0m
[32m[I 2022-04-21 17:07:44,386][0m Trial 312 finished with value: 0.8357943352920276 and parameters: {'loss': 'coxph', 'learning_rate': 7.187523018431413e-05, 'n_estimators': 253, 'criterion': 'friedman_mse', 'min_samples_split': 4, 'min_samples_leaf': 2, 'min_weight_fraction_leaf': 0.19076655936309725, 'min_impurity_decrease': 0.6363365861522473, 'max_features': 0.3296988260791717, 'subsample': 0.12258212861075865, 'dropout_rate': 0.12256609024994086, 'ccp_alpha': 0.23634579912147557}. Best is trial 244 with value: 0.8474070660226068.[0m
[32m[I 2022-04-21 17:08:03,587][0m Trial 313 finished with value: 0.839620666978582 and parameters: {'loss': 'coxph', 'learning_rate': 0.0062360776094449585, 'n_estimators': 337, 'criterion': 'friedman_mse', 'min_samples_split': 3, 'min_samples_leaf': 2, 'min_weight_fraction_leaf': 0.17471675713379153, 'min_impurity_decrease': 0.4981812970811723, 'max_features': 0.3124684991864414, 'subsample': 0.09582992698321997, 'dropout_rate': 0.16705605539114401, 'ccp_alpha': 0.3828326843470806}. Best is trial 244 with value: 0.8474070660226068.[0m
[32m[I 2022-04-21 17:08:17,074][0m Trial 314 finished with value: 0.8370035868301995 and parameters: {'loss': 'coxph', 'learning_rate': 4.975560261867906e-05, 'n_estimators': 195, 'criterion': 'friedman_mse', 'min_samples_split': 2, 'min_samples_leaf': 2, 'min_weight_fraction_leaf': 0.22421920061290507, 'min_impurity_decrease': 0.7627996302667036, 'max_features': 0.2473937786450661, 'subsample': 0.048139426632441154, 'dropout_rate': 0.035783001409798065, 'ccp_alpha': 0.10360808005373506}. Best is trial 244 with value: 0.8474070660226068.[0m
[32m[I 2022-04-21 17:08:26,777][0m Trial 315 finished with value: 0.65 and parameters: {'loss': 'coxph', 'learning_rate': 0.00010633374793515152, 'n_estimators': 215, 'criterion': 'friedman_mse', 'min_samples_split': 3, 'min_samples_leaf': 3, 'min_weight_fraction_leaf': 0.16453884392280263, 'min_impurity_decrease': 0.3293841946074835, 'max_features': 0.299707734067033, 'subsample': 0.06845767790250677, 'dropout_rate': 0.0834751458865726, 'ccp_alpha': 1.9152749272183405}. Best is trial 244 with value: 0.8474070660226068.[0m
[32m[I 2022-04-21 17:08:35,618][0m Trial 316 finished with value: 0.7078389223715685 and parameters: {'loss': 'coxph', 'learning_rate': 0.0014264875813384697, 'n_estimators': 239, 'criterion': 'friedman_mse', 'min_samples_split': 3, 'min_samples_leaf': 1, 'min_weight_fraction_leaf': 0.18495746209776764, 'min_impurity_decrease': 0.7293012682812596, 'max_features': 0.3423641111557413, 'subsample': 0.13832470370246894, 'dropout_rate': 0.2213749162297633, 'ccp_alpha': 0.503971329514507}. Best is trial 244 with value: 0.8474070660226068.[0m
[32m[I 2022-04-21 17:08:48,310][0m Trial 317 finished with value: 0.8440858218578461 and parameters: {'loss': 'coxph', 'learning_rate': 0.0001486851127391216, 'n_estimators': 267, 'criterion': 'squared_error', 'min_samples_split': 3, 'min_samples_leaf': 2, 'min_weight_fraction_leaf': 0.20653309868127553, 'min_impurity_decrease': 0.19535862850621194, 'max_features': 0.3992018808087479, 'subsample': 0.0942944299244175, 'dropout_rate': 0.141993917312268, 'ccp_alpha': 0.17980666882840213}. Best is trial 244 with value: 0.8474070660226068.[0m
[32m[I 2022-04-21 17:09:16,979][0m Trial 318 finished with value: 0.65 and parameters: {'loss': 'coxph', 'learning_rate': 5.924127143382673e-05, 'n_estimators': 309, 'criterion': 'friedman_mse', 'min_samples_split': 5, 'min_samples_leaf': 10, 'min_weight_fraction_leaf': 0.19341087580310312, 'min_impurity_decrease': 0.7118970262801911, 'max_features': 0.360192156816115, 'subsample': 0.026294586852819407, 'dropout_rate': 0.10754426245647139, 'ccp_alpha': 0.07565917729869169}. Best is trial 244 with value: 0.8474070660226068.[0m
[32m[I 2022-04-21 17:09:43,738][0m Trial 319 finished with value: 0.7107595047480717 and parameters: {'loss': 'coxph', 'learning_rate': 8.713738356141062e-05, 'n_estimators': 369, 'criterion': 'absolute_error', 'min_samples_split': 3, 'min_samples_leaf': 2, 'min_weight_fraction_leaf': 0.2160222837237142, 'min_impurity_decrease': 0.2637402624313062, 'max_features': 0.27318426225575415, 'subsample': 0.1656896898653138, 'dropout_rate': 0.18454759149912722, 'ccp_alpha': 0.009905480350888061}. Best is trial 244 with value: 0.8474070660226068.[0m
/media/san2_ssd/data/Workdir/survival/venv/lib/python3.8/site-packages/sksurv/ensemble/boosting.py:955: RuntimeWarning: divide by zero encountered in log
  time = numpy.log(time)
/media/san2_ssd/data/Workdir/survival/venv/lib/python3.8/site-packages/sksurv/ensemble/boosting.py:955: RuntimeWarning: divide by zero encountered in log
  time = numpy.log(time)
/media/san2_ssd/data/Workdir/survival/venv/lib/python3.8/site-packages/sksurv/ensemble/boosting.py:955: RuntimeWarning: divide by zero encountered in log
  time = numpy.log(time)
/media/san2_ssd/data/Workdir/survival/venv/lib/python3.8/site-packages/sksurv/ensemble/boosting.py:955: RuntimeWarning: divide by zero encountered in log
  time = numpy.log(time)
[32m[I 2022-04-21 17:09:48,044][0m Trial 320 finished with value: -0.46757084023497864 and parameters: {'loss': 'squared', 'learning_rate': 0.0010681485613270323, 'n_estimators': 254, 'criterion': 'friedman_mse', 'min_samples_split': 2, 'min_samples_leaf': 2, 'min_weight_fraction_leaf': 0.17710334153368562, 'min_impurity_decrease': 0.3577648833484153, 'max_features': 0.2867703944339337, 'subsample': 0.11125712828053089, 'dropout_rate': 0.05682818872511997, 'ccp_alpha': 0.25627636815474863}. Best is trial 244 with value: 0.8474070660226068.[0m
[32m[I 2022-04-21 17:10:02,200][0m Trial 321 finished with value: 0.8445635750012723 and parameters: {'loss': 'coxph', 'learning_rate': 0.0001852962880382583, 'n_estimators': 223, 'criterion': 'friedman_mse', 'min_samples_split': 3, 'min_samples_leaf': 2, 'min_weight_fraction_leaf': 0.1456818316274613, 'min_impurity_decrease': 0.3085963713423961, 'max_features': 0.3193796358457221, 'subsample': 0.07815773018270075, 'dropout_rate': 0.13328277508850273, 'ccp_alpha': 0.1593245638299044}. Best is trial 244 with value: 0.8474070660226068.[0m
[32m[I 2022-04-21 17:10:34,795][0m Trial 322 finished with value: 0.8442580885600457 and parameters: {'loss': 'coxph', 'learning_rate': 0.00011804625570490376, 'n_estimators': 321, 'criterion': 'friedman_mse', 'min_samples_split': 3, 'min_samples_leaf': 1, 'min_weight_fraction_leaf': 0.16867185586657799, 'min_impurity_decrease': 0.29207594047630814, 'max_features': 0.24401603162221766, 'subsample': 0.05309524640769615, 'dropout_rate': 0.15271334889383203, 'ccp_alpha': 0.0762908551804353}. Best is trial 244 with value: 0.8474070660226068.[0m
[32m[I 2022-04-21 17:10:54,273][0m Trial 323 finished with value: 0.65 and parameters: {'loss': 'coxph', 'learning_rate': 3.620281636565295e-05, 'n_estimators': 278, 'criterion': 'friedman_mse', 'min_samples_split': 4, 'min_samples_leaf': 2, 'min_weight_fraction_leaf': 0.15718247772238111, 'min_impurity_decrease': 0.3449334703462633, 'max_features': 0.34100368256376506, 'subsample': 0.1301087837250834, 'dropout_rate': 0.10513527301710886, 'ccp_alpha': 1.3729163863948912}. Best is trial 244 with value: 0.8474070660226068.[0m
[32m[I 2022-04-21 17:11:04,030][0m Trial 324 finished with value: 0.8462613191330887 and parameters: {'loss': 'coxph', 'learning_rate': 0.004621059877154516, 'n_estimators': 233, 'criterion': 'friedman_mse', 'min_samples_split': 3, 'min_samples_leaf': 2, 'min_weight_fraction_leaf': 0.19767091891218563, 'min_impurity_decrease': 0.3301064076430781, 'max_features': 0.68212543075305, 'subsample': 0.08364365883323521, 'dropout_rate': 0.19620327985266084, 'ccp_alpha': 0.0021011387950314927}. Best is trial 244 with value: 0.8474070660226068.[0m
[32m[I 2022-04-21 17:11:17,042][0m Trial 325 finished with value: 0.841684728807909 and parameters: {'loss': 'coxph', 'learning_rate': 0.004477302296132852, 'n_estimators': 237, 'criterion': 'friedman_mse', 'min_samples_split': 2, 'min_samples_leaf': 1, 'min_weight_fraction_leaf': 0.21282662744813818, 'min_impurity_decrease': 0.3865844118969499, 'max_features': 0.9239830527877534, 'subsample': 0.08283149958960655, 'dropout_rate': 0.08772144415629897, 'ccp_alpha': 0.3042509536768716}. Best is trial 244 with value: 0.8474070660226068.[0m
[32m[I 2022-04-21 17:11:50,531][0m Trial 326 finished with value: 0.8436900772936575 and parameters: {'loss': 'coxph', 'learning_rate': 0.005551743154002277, 'n_estimators': 441, 'criterion': 'friedman_mse', 'min_samples_split': 3, 'min_samples_leaf': 3, 'min_weight_fraction_leaf': 0.20489908855094896, 'min_impurity_decrease': 0.36353694111088886, 'max_features': 0.4155180729553972, 'subsample': 0.06432928201666288, 'dropout_rate': 0.16225543313199414, 'ccp_alpha': 0.18441724137153653}. Best is trial 244 with value: 0.8474070660226068.[0m
[32m[I 2022-04-21 17:12:10,124][0m Trial 327 finished with value: 0.8458971162592297 and parameters: {'loss': 'coxph', 'learning_rate': 0.00688580600303178, 'n_estimators': 264, 'criterion': 'friedman_mse', 'min_samples_split': 3, 'min_samples_leaf': 2, 'min_weight_fraction_leaf': 0.19717304126326735, 'min_impurity_decrease': 0.3252078616304814, 'max_features': 0.6601246253488846, 'subsample': 0.09959792945620352, 'dropout_rate': 0.11977517779030156, 'ccp_alpha': 0.00930550903136134}. Best is trial 244 with value: 0.8474070660226068.[0m
[32m[I 2022-04-21 17:12:30,107][0m Trial 328 finished with value: 0.8431438339253869 and parameters: {'loss': 'coxph', 'learning_rate': 0.00989653580549016, 'n_estimators': 260, 'criterion': 'friedman_mse', 'min_samples_split': 3, 'min_samples_leaf': 2, 'min_weight_fraction_leaf': 0.23370204371783865, 'min_impurity_decrease': 0.3374739418594684, 'max_features': 0.6384624456126418, 'subsample': 0.04338439964485363, 'dropout_rate': 0.1327453428264924, 'ccp_alpha': 0.15585872932324438}. Best is trial 244 with value: 0.8474070660226068.[0m
