[32m[I 2022-04-21 20:58:39,429][0m Trial 62 finished with value: 0.5197331818019253 and parameters: {'loss': 'coxph', 'learning_rate': 0.0007186850551249276, 'n_estimators': 353, 'criterion': 'friedman_mse', 'min_samples_split': 8, 'min_samples_leaf': 9, 'min_weight_fraction_leaf': 0.2936450189710879, 'min_impurity_decrease': 0.07795538571575177, 'max_features': 0.11710678946193782, 'subsample': 0.3526960039618041, 'dropout_rate': 0.6767276812793122, 'ccp_alpha': 0.45108044001887593}. Best is trial 32 with value: 0.6842082681032632.[0m
[32m[I 2022-04-21 20:58:45,175][0m Trial 63 finished with value: 0.5 and parameters: {'loss': 'coxph', 'learning_rate': 0.0015086714644981206, 'n_estimators': 268, 'criterion': 'friedman_mse', 'min_samples_split': 9, 'min_samples_leaf': 8, 'min_weight_fraction_leaf': 0.3263675054456227, 'min_impurity_decrease': 0.05297843883050168, 'max_features': 0.020676015882006637, 'subsample': 0.35256125225976653, 'dropout_rate': 0.9032205871076917, 'ccp_alpha': 0.6968258973911321}. Best is trial 32 with value: 0.6842082681032632.[0m
[32m[I 2022-04-21 20:58:48,885][0m Trial 64 finished with value: 0.6636900948801576 and parameters: {'loss': 'coxph', 'learning_rate': 0.0002360522892783167, 'n_estimators': 226, 'criterion': 'friedman_mse', 'min_samples_split': 8, 'min_samples_leaf': 5, 'min_weight_fraction_leaf': 0.3462509752618298, 'min_impurity_decrease': 0.12069612736682263, 'max_features': 0.155933035118967, 'subsample': 0.28276809675623893, 'dropout_rate': 0.8724155940839404, 'ccp_alpha': 0.15514433530713684}. Best is trial 32 with value: 0.6842082681032632.[0m
[32m[I 2022-04-21 20:59:16,294][0m Trial 65 finished with value: 0.5 and parameters: {'loss': 'coxph', 'learning_rate': 0.0009841049833936764, 'n_estimators': 485, 'criterion': 'friedman_mse', 'min_samples_split': 6, 'min_samples_leaf': 9, 'min_weight_fraction_leaf': 0.22808582430896887, 'min_impurity_decrease': 0.029451520827353417, 'max_features': 0.09209890967315233, 'subsample': 0.44620524156893604, 'dropout_rate': 0.6378089153854071, 'ccp_alpha': 0.48547817159828877}. Best is trial 32 with value: 0.6842082681032632.[0m
[32m[I 2022-04-21 20:59:25,976][0m Trial 66 finished with value: 0.6589664563973742 and parameters: {'loss': 'coxph', 'learning_rate': 0.00043096685072201916, 'n_estimators': 305, 'criterion': 'friedman_mse', 'min_samples_split': 9, 'min_samples_leaf': 10, 'min_weight_fraction_leaf': 0.20298684711087284, 'min_impurity_decrease': 0.25054712539134183, 'max_features': 0.0017475220160504956, 'subsample': 0.3081462192836839, 'dropout_rate': 0.7780488130458043, 'ccp_alpha': 0.24872094813665016}. Best is trial 32 with value: 0.6842082681032632.[0m
[32m[I 2022-04-21 20:59:43,139][0m Trial 67 finished with value: 0.6636900948801576 and parameters: {'loss': 'coxph', 'learning_rate': 0.016785875922314716, 'n_estimators': 407, 'criterion': 'squared_error', 'min_samples_split': 7, 'min_samples_leaf': 9, 'min_weight_fraction_leaf': 0.266602614365073, 'min_impurity_decrease': 0.1631658832296483, 'max_features': 0.29036445479275275, 'subsample': 0.4906311750865541, 'dropout_rate': 0.7390059270431812, 'ccp_alpha': 0.010774463170742283}. Best is trial 32 with value: 0.6842082681032632.[0m
[32m[I 2022-04-21 20:59:54,505][0m Trial 68 finished with value: 0.5388748398096357 and parameters: {'loss': 'coxph', 'learning_rate': 0.0003241476728577491, 'n_estimators': 370, 'criterion': 'friedman_mse', 'min_samples_split': 8, 'min_samples_leaf': 10, 'min_weight_fraction_leaf': 0.2459578712591312, 'min_impurity_decrease': 0.09180823212525423, 'max_features': 0.21770868789642642, 'subsample': 0.403492775865119, 'dropout_rate': 0.8022756378631498, 'ccp_alpha': 0.4063815783239885}. Best is trial 32 with value: 0.6842082681032632.[0m
[32m[I 2022-04-21 21:00:07,543][0m Trial 69 finished with value: 0.5 and parameters: {'loss': 'coxph', 'learning_rate': 0.0046292464047862445, 'n_estimators': 265, 'criterion': 'friedman_mse', 'min_samples_split': 10, 'min_samples_leaf': 9, 'min_weight_fraction_leaf': 0.3559138214633304, 'min_impurity_decrease': 0.03988735626738485, 'max_features': 0.059460288234336384, 'subsample': 0.5794150425958668, 'dropout_rate': 0.6903767118721086, 'ccp_alpha': 2.7874108012797234}. Best is trial 32 with value: 0.6842082681032632.[0m
[32m[I 2022-04-21 21:00:12,158][0m Trial 70 finished with value: 0.6776950240386322 and parameters: {'loss': 'coxph', 'learning_rate': 0.001149629254038096, 'n_estimators': 165, 'criterion': 'squared_error', 'min_samples_split': 7, 'min_samples_leaf': 8, 'min_weight_fraction_leaf': 0.31587855984365787, 'min_impurity_decrease': 0.0031029929441181332, 'max_features': 0.13272556606252547, 'subsample': 0.20766825697622163, 'dropout_rate': 0.8450145063841317, 'ccp_alpha': 0.14791750247097243}. Best is trial 32 with value: 0.6842082681032632.[0m
[32m[I 2022-04-21 21:00:40,746][0m Trial 71 finished with value: 0.6801039377099601 and parameters: {'loss': 'coxph', 'learning_rate': 0.00045973804954624217, 'n_estimators': 505, 'criterion': 'friedman_mse', 'min_samples_split': 7, 'min_samples_leaf': 8, 'min_weight_fraction_leaf': 0.22177261217315475, 'min_impurity_decrease': 0.37334011914633075, 'max_features': 0.0993922049832224, 'subsample': 0.35872374980304567, 'dropout_rate': 0.7054672371930001, 'ccp_alpha': 0.015773478332971286}. Best is trial 32 with value: 0.6842082681032632.[0m
[32m[I 2022-04-21 21:01:01,921][0m Trial 72 finished with value: 0.6560064458361676 and parameters: {'loss': 'coxph', 'learning_rate': 0.0007559133143705783, 'n_estimators': 441, 'criterion': 'friedman_mse', 'min_samples_split': 8, 'min_samples_leaf': 8, 'min_weight_fraction_leaf': 0.16526462864926011, 'min_impurity_decrease': 0.4896104762436655, 'max_features': 0.09745300535970397, 'subsample': 0.3495775435886141, 'dropout_rate': 0.7303136154081673, 'ccp_alpha': 0.2678659386036877}. Best is trial 32 with value: 0.6842082681032632.[0m
[32m[I 2022-04-21 21:01:34,363][0m Trial 73 finished with value: 0.5 and parameters: {'loss': 'coxph', 'learning_rate': 0.002647099742709474, 'n_estimators': 532, 'criterion': 'friedman_mse', 'min_samples_split': 6, 'min_samples_leaf': 9, 'min_weight_fraction_leaf': 0.2897699342540628, 'min_impurity_decrease': 0.4295199672971473, 'max_features': 0.14680991248337733, 'subsample': 0.2606641312844702, 'dropout_rate': 0.5996712392905375, 'ccp_alpha': 0.6200080751622253}. Best is trial 32 with value: 0.6842082681032632.[0m
[32m[I 2022-04-21 21:01:52,837][0m Trial 74 finished with value: 0.6902043616759457 and parameters: {'loss': 'coxph', 'learning_rate': 0.00017387793112173648, 'n_estimators': 335, 'criterion': 'friedman_mse', 'min_samples_split': 7, 'min_samples_leaf': 9, 'min_weight_fraction_leaf': 0.22574755458719742, 'min_impurity_decrease': 0.12198294628831247, 'max_features': 0.03706688416822547, 'subsample': 0.2986029876719152, 'dropout_rate': 0.6620644071785418, 'ccp_alpha': 0.1107139529378542}. Best is trial 74 with value: 0.6902043616759457.[0m
[32m[I 2022-04-21 21:02:04,889][0m Trial 75 finished with value: 0.5414483752183816 and parameters: {'loss': 'coxph', 'learning_rate': 0.0001480912202384367, 'n_estimators': 333, 'criterion': 'friedman_mse', 'min_samples_split': 8, 'min_samples_leaf': 10, 'min_weight_fraction_leaf': 0.199811341245833, 'min_impurity_decrease': 0.12083510547616184, 'max_features': 0.031303340736489965, 'subsample': 0.29772783990742724, 'dropout_rate': 0.6723587512253826, 'ccp_alpha': 0.4909485935331532}. Best is trial 74 with value: 0.6902043616759457.[0m
[32m[I 2022-04-21 21:02:13,844][0m Trial 76 finished with value: 0.6687056297685376 and parameters: {'loss': 'coxph', 'learning_rate': 6.142567957627305e-05, 'n_estimators': 210, 'criterion': 'friedman_mse', 'min_samples_split': 9, 'min_samples_leaf': 9, 'min_weight_fraction_leaf': 0.2761636988339213, 'min_impurity_decrease': 0.08620721064843981, 'max_features': 0.07460145299058096, 'subsample': 0.3209298973730532, 'dropout_rate': 0.5064170580797085, 'ccp_alpha': 0.12984270315660718}. Best is trial 74 with value: 0.6902043616759457.[0m
/media/san2_ssd/data/Workdir/survival/venv/lib/python3.8/site-packages/sksurv/ensemble/boosting.py:955: RuntimeWarning: divide by zero encountered in log
  time = numpy.log(time)
/media/san2_ssd/data/Workdir/survival/venv/lib/python3.8/site-packages/sksurv/ensemble/boosting.py:955: RuntimeWarning: divide by zero encountered in log
  time = numpy.log(time)
/media/san2_ssd/data/Workdir/survival/venv/lib/python3.8/site-packages/sksurv/ensemble/boosting.py:955: RuntimeWarning: divide by zero encountered in log
  time = numpy.log(time)
/media/san2_ssd/data/Workdir/survival/venv/lib/python3.8/site-packages/sksurv/ensemble/boosting.py:955: RuntimeWarning: divide by zero encountered in log
  time = numpy.log(time)
[32m[I 2022-04-21 21:02:16,575][0m Trial 77 finished with value: -0.7 and parameters: {'loss': 'squared', 'learning_rate': 0.00022408788393760273, 'n_estimators': 323, 'criterion': 'absolute_error', 'min_samples_split': 7, 'min_samples_leaf': 9, 'min_weight_fraction_leaf': 0.24726316721928343, 'min_impurity_decrease': 0.1961304781390968, 'max_features': 0.03444799257121324, 'subsample': 0.15815141731991947, 'dropout_rate': 0.5739696345106562, 'ccp_alpha': 0.7807591836214696}. Best is trial 74 with value: 0.6902043616759457.[0m
[32m[I 2022-04-21 21:02:21,100][0m Trial 78 finished with value: 0.6501434045846987 and parameters: {'loss': 'coxph', 'learning_rate': 0.0016655030149667538, 'n_estimators': 249, 'criterion': 'squared_error', 'min_samples_split': 5, 'min_samples_leaf': 10, 'min_weight_fraction_leaf': 0.26253408654729415, 'min_impurity_decrease': 0.14816505657804846, 'max_features': 0.21565659779125956, 'subsample': 0.2415488076633458, 'dropout_rate': 0.8211528725704681, 'ccp_alpha': 0.3172960344296987}. Best is trial 74 with value: 0.6902043616759457.[0m
[32m[I 2022-04-21 21:02:25,026][0m Trial 79 finished with value: 0.6686092235249135 and parameters: {'loss': 'coxph', 'learning_rate': 3.703359748794221e-05, 'n_estimators': 279, 'criterion': 'friedman_mse', 'min_samples_split': 8, 'min_samples_leaf': 9, 'min_weight_fraction_leaf': 0.29352640905734256, 'min_impurity_decrease': 0.2778820906501621, 'max_features': 0.8572938149906233, 'subsample': 0.3854955234703213, 'dropout_rate': 0.9601768522604082, 'ccp_alpha': 0.14499720982010103}. Best is trial 74 with value: 0.6902043616759457.[0m
[32m[I 2022-04-21 21:02:50,742][0m Trial 80 finished with value: 0.5 and parameters: {'loss': 'coxph', 'learning_rate': 0.00635229027752205, 'n_estimators': 395, 'criterion': 'friedman_mse', 'min_samples_split': 9, 'min_samples_leaf': 10, 'min_weight_fraction_leaf': 0.23261586208778867, 'min_impurity_decrease': 0.03386084143698913, 'max_features': 0.2687517449415746, 'subsample': 0.4354307691245222, 'dropout_rate': 0.535402527469631, 'ccp_alpha': 1.1140419014008631}. Best is trial 74 with value: 0.6902043616759457.[0m
[32m[I 2022-04-21 21:03:00,514][0m Trial 81 finished with value: 0.6796179964584448 and parameters: {'loss': 'coxph', 'learning_rate': 0.00046883664671866883, 'n_estimators': 346, 'criterion': 'friedman_mse', 'min_samples_split': 7, 'min_samples_leaf': 8, 'min_weight_fraction_leaf': 0.2224884492116468, 'min_impurity_decrease': 0.059031231162643236, 'max_features': 0.10505364500348846, 'subsample': 0.34596431560232094, 'dropout_rate': 0.6996693421273438, 'ccp_alpha': 0.001518813707539866}. Best is trial 74 with value: 0.6902043616759457.[0m
[32m[I 2022-04-21 21:04:04,741][0m Trial 82 finished with value: 0.6846377927804691 and parameters: {'loss': 'coxph', 'learning_rate': 0.0003282998154843604, 'n_estimators': 849, 'criterion': 'friedman_mse', 'min_samples_split': 6, 'min_samples_leaf': 8, 'min_weight_fraction_leaf': 0.21372441527239955, 'min_impurity_decrease': 0.10902962854078367, 'max_features': 0.004922456503034529, 'subsample': 0.4068168249563916, 'dropout_rate': 0.7552366229134134, 'ccp_alpha': 0.09986148677975806}. Best is trial 74 with value: 0.6902043616759457.[0m
[32m[I 2022-04-21 21:05:02,835][0m Trial 83 finished with value: 0.627113692194039 and parameters: {'loss': 'coxph', 'learning_rate': 8.079938410574393e-05, 'n_estimators': 840, 'criterion': 'friedman_mse', 'min_samples_split': 6, 'min_samples_leaf': 9, 'min_weight_fraction_leaf': 0.2548130154228686, 'min_impurity_decrease': 0.11673449099886665, 'max_features': 0.0035245196420950337, 'subsample': 0.40418730310520934, 'dropout_rate': 0.7550016141003724, 'ccp_alpha': 0.3015790230964319}. Best is trial 74 with value: 0.6902043616759457.[0m
[32m[I 2022-04-21 21:06:04,233][0m Trial 84 finished with value: 0.5955972265199999 and parameters: {'loss': 'coxph', 'learning_rate': 0.00011539115937945672, 'n_estimators': 747, 'criterion': 'friedman_mse', 'min_samples_split': 6, 'min_samples_leaf': 7, 'min_weight_fraction_leaf': 0.20809961978666422, 'min_impurity_decrease': 0.0825204827891026, 'max_features': 0.06402952080429568, 'subsample': 0.30354499587766665, 'dropout_rate': 0.6588068502056187, 'ccp_alpha': 0.4567549577995789}. Best is trial 74 with value: 0.6902043616759457.[0m
[32m[I 2022-04-21 21:06:08,971][0m Trial 85 finished with value: 0.6822078894197894 and parameters: {'loss': 'coxph', 'learning_rate': 0.00031203122750371595, 'n_estimators': 303, 'criterion': 'friedman_mse', 'min_samples_split': 8, 'min_samples_leaf': 8, 'min_weight_fraction_leaf': 0.18913320505609033, 'min_impurity_decrease': 0.233626846117165, 'max_features': 0.16673921310688322, 'subsample': 0.36806377188488043, 'dropout_rate': 0.8612937687791287, 'ccp_alpha': 0.1333733440389531}. Best is trial 74 with value: 0.6902043616759457.[0m
[32m[I 2022-04-21 21:06:15,239][0m Trial 86 finished with value: 0.6677998948587878 and parameters: {'loss': 'coxph', 'learning_rate': 0.0002656026544754936, 'n_estimators': 302, 'criterion': 'friedman_mse', 'min_samples_split': 5, 'min_samples_leaf': 8, 'min_weight_fraction_leaf': 0.16514867285671625, 'min_impurity_decrease': 0.22719596903668193, 'max_features': 0.17637737465146616, 'subsample': 0.4553775715200047, 'dropout_rate': 0.8884385863605175, 'ccp_alpha': 0.14742363254284346}. Best is trial 74 with value: 0.6902043616759457.[0m
[32m[I 2022-04-21 21:07:50,889][0m Trial 87 finished with value: 0.5 and parameters: {'loss': 'coxph', 'learning_rate': 0.00018474754817524605, 'n_estimators': 904, 'criterion': 'friedman_mse', 'min_samples_split': 7, 'min_samples_leaf': 8, 'min_weight_fraction_leaf': 0.18453254787820897, 'min_impurity_decrease': 0.17214608164190714, 'max_features': 0.13279823093666146, 'subsample': 0.40615293426520055, 'dropout_rate': 0.6169590710925437, 'ccp_alpha': 2.2325150465209016}. Best is trial 74 with value: 0.6902043616759457.[0m
/media/san2_ssd/data/Workdir/survival/venv/lib/python3.8/site-packages/sksurv/ensemble/boosting.py:955: RuntimeWarning: divide by zero encountered in log
  time = numpy.log(time)
/media/san2_ssd/data/Workdir/survival/venv/lib/python3.8/site-packages/sksurv/ensemble/boosting.py:955: RuntimeWarning: divide by zero encountered in log
  time = numpy.log(time)
/media/san2_ssd/data/Workdir/survival/venv/lib/python3.8/site-packages/sksurv/ensemble/boosting.py:955: RuntimeWarning: divide by zero encountered in log
  time = numpy.log(time)
/media/san2_ssd/data/Workdir/survival/venv/lib/python3.8/site-packages/sksurv/ensemble/boosting.py:955: RuntimeWarning: divide by zero encountered in log
  time = numpy.log(time)
[32m[I 2022-04-21 21:07:52,277][0m Trial 88 finished with value: -0.7309394300370865 and parameters: {'loss': 'squared', 'learning_rate': 0.0008477642194369923, 'n_estimators': 460, 'criterion': 'squared_error', 'min_samples_split': 6, 'min_samples_leaf': 7, 'min_weight_fraction_leaf': 0.18970662428540788, 'min_impurity_decrease': 0.024806078499921815, 'max_features': 0.5228758798941898, 'subsample': 0.5300885803667039, 'dropout_rate': 0.9170971527747481, 'ccp_alpha': 0.5678087882231624}. Best is trial 74 with value: 0.6902043616759457.[0m
[32m[I 2022-04-21 21:07:55,979][0m Trial 89 finished with value: 0.658544368467207 and parameters: {'loss': 'coxph', 'learning_rate': 0.0006079529785813624, 'n_estimators': 236, 'criterion': 'friedman_mse', 'min_samples_split': 8, 'min_samples_leaf': 8, 'min_weight_fraction_leaf': 0.3081222669529902, 'min_impurity_decrease': 0.14910614449345574, 'max_features': 0.027661177760890516, 'subsample': 0.21708837787099566, 'dropout_rate': 0.8534522094368798, 'ccp_alpha': 0.26591998663967087}. Best is trial 74 with value: 0.6902043616759457.[0m
[32m[I 2022-04-21 21:08:01,026][0m Trial 90 finished with value: 0.5217151934164563 and parameters: {'loss': 'coxph', 'learning_rate': 0.0003576843175037979, 'n_estimators': 259, 'criterion': 'absolute_error', 'min_samples_split': 8, 'min_samples_leaf': 6, 'min_weight_fraction_leaf': 0.24118627093916184, 'min_impurity_decrease': 0.10318188381347096, 'max_features': 0.1977719798438392, 'subsample': 0.2557083097961008, 'dropout_rate': 0.7336495880610899, 'ccp_alpha': 0.39879242837268936}. Best is trial 74 with value: 0.6902043616759457.[0m
[32m[I 2022-04-21 21:08:05,874][0m Trial 91 finished with value: 0.6784865775278532 and parameters: {'loss': 'coxph', 'learning_rate': 0.00012896864640721533, 'n_estimators': 275, 'criterion': 'friedman_mse', 'min_samples_split': 8, 'min_samples_leaf': 9, 'min_weight_fraction_leaf': 0.11449896913186468, 'min_impurity_decrease': 0.06755999137920808, 'max_features': 0.048909330876904515, 'subsample': 0.36864166962103057, 'dropout_rate': 0.804443117501697, 'ccp_alpha': 0.12353385932222274}. Best is trial 74 with value: 0.6902043616759457.[0m
[32m[I 2022-04-21 21:08:15,148][0m Trial 92 finished with value: 0.6837472988064728 and parameters: {'loss': 'coxph', 'learning_rate': 0.0005537938522927054, 'n_estimators': 335, 'criterion': 'friedman_mse', 'min_samples_split': 9, 'min_samples_leaf': 9, 'min_weight_fraction_leaf': 0.27225461831968034, 'min_impurity_decrease': 0.13250833791438588, 'max_features': 0.07377413827200699, 'subsample': 0.3243152403608293, 'dropout_rate': 0.7744378382078437, 'ccp_alpha': 0.09340764465003881}. Best is trial 74 with value: 0.6902043616759457.[0m
[32m[I 2022-04-21 21:08:28,070][0m Trial 93 finished with value: 0.6789430380195445 and parameters: {'loss': 'coxph', 'learning_rate': 0.000187511742290839, 'n_estimators': 321, 'criterion': 'friedman_mse', 'min_samples_split': 9, 'min_samples_leaf': 9, 'min_weight_fraction_leaf': 0.27447135786903426, 'min_impurity_decrease': 0.13756621187735318, 'max_features': 0.07979909063949063, 'subsample': 0.32714165931816014, 'dropout_rate': 0.773695232865828, 'ccp_alpha': 0.1275772216001754}. Best is trial 74 with value: 0.6902043616759457.[0m
[32m[I 2022-04-21 21:08:34,730][0m Trial 94 finished with value: 0.6636900948801576 and parameters: {'loss': 'coxph', 'learning_rate': 0.00033833660560059393, 'n_estimators': 284, 'criterion': 'friedman_mse', 'min_samples_split': 9, 'min_samples_leaf': 8, 'min_weight_fraction_leaf': 0.32846472742004035, 'min_impurity_decrease': 0.2290686081385309, 'max_features': 0.15727623192695192, 'subsample': 0.2834000740470103, 'dropout_rate': 0.772490499065924, 'ccp_alpha': 0.26532436296124196}. Best is trial 74 with value: 0.6902043616759457.[0m
[32m[I 2022-04-21 21:08:42,181][0m Trial 95 finished with value: 0.5 and parameters: {'loss': 'coxph', 'learning_rate': 0.0012424867697562933, 'n_estimators': 360, 'criterion': 'friedman_mse', 'min_samples_split': 10, 'min_samples_leaf': 10, 'min_weight_fraction_leaf': 0.2833064276102878, 'min_impurity_decrease': 0.19148972547295812, 'max_features': 0.12477758601821717, 'subsample': 0.3275520697815069, 'dropout_rate': 0.8537924104678581, 'ccp_alpha': 0.6950386549982247}. Best is trial 74 with value: 0.6902043616759457.[0m
[32m[I 2022-04-21 21:08:50,091][0m Trial 96 finished with value: 0.5885897812904826 and parameters: {'loss': 'coxph', 'learning_rate': 0.0005251956651803715, 'n_estimators': 294, 'criterion': 'friedman_mse', 'min_samples_split': 9, 'min_samples_leaf': 9, 'min_weight_fraction_leaf': 0.21662273094616108, 'min_impurity_decrease': 0.6102469390188254, 'max_features': 0.08326167453673511, 'subsample': 0.3947765472969045, 'dropout_rate': 0.7257025822852482, 'ccp_alpha': 0.36182855397999986}. Best is trial 74 with value: 0.6902043616759457.[0m
[32m[I 2022-04-21 21:08:57,957][0m Trial 97 finished with value: 0.6814179602431136 and parameters: {'loss': 'coxph', 'learning_rate': 0.0035861447374270394, 'n_estimators': 373, 'criterion': 'friedman_mse', 'min_samples_split': 6, 'min_samples_leaf': 5, 'min_weight_fraction_leaf': 0.2689902776921734, 'min_impurity_decrease': 0.1160777038140785, 'max_features': 0.6493799093667588, 'subsample': 0.4961690520080058, 'dropout_rate': 0.8231453586371738, 'ccp_alpha': 0.09582595655724535}. Best is trial 74 with value: 0.6902043616759457.[0m
[32m[I 2022-04-21 21:09:04,117][0m Trial 98 finished with value: 0.5 and parameters: {'loss': 'coxph', 'learning_rate': 0.0018801918763559733, 'n_estimators': 336, 'criterion': 'friedman_mse', 'min_samples_split': 8, 'min_samples_leaf': 9, 'min_weight_fraction_leaf': 0.1369814734502472, 'min_impurity_decrease': 0.020027829410048728, 'max_features': 0.017141104548748606, 'subsample': 0.29994893874372036, 'dropout_rate': 0.8768122336498112, 'ccp_alpha': 1.564695530454994}. Best is trial 74 with value: 0.6902043616759457.[0m
