[32m[I 2022-04-21 23:15:55,813][0m Trial 435 finished with value: 0.5 and parameters: {'loss': 'coxph', 'learning_rate': 0.00022270323013333875, 'n_estimators': 279, 'criterion': 'absolute_error', 'min_samples_split': 7, 'min_samples_leaf': 9, 'min_weight_fraction_leaf': 0.22569096636567257, 'min_impurity_decrease': 0.9566286441335112, 'max_features': 0.09818367989980774, 'subsample': 0.3326217997705109, 'dropout_rate': 0.22410913451639558, 'ccp_alpha': 0.17693395614305094}. Best is trial 187 with value: 0.6933481836305168.[0m
[32m[I 2022-04-21 23:16:01,916][0m Trial 436 finished with value: 0.5 and parameters: {'loss': 'coxph', 'learning_rate': 4.3201480340821326e-05, 'n_estimators': 350, 'criterion': 'squared_error', 'min_samples_split': 7, 'min_samples_leaf': 10, 'min_weight_fraction_leaf': 0.18790236467694688, 'min_impurity_decrease': 0.06672126499512422, 'max_features': 0.833102930854421, 'subsample': 0.31031898791800744, 'dropout_rate': 0.9843603105299208, 'ccp_alpha': 0.7997505283458677}. Best is trial 187 with value: 0.6933481836305168.[0m
[32m[I 2022-04-21 23:16:32,865][0m Trial 437 finished with value: 0.6875767306030982 and parameters: {'loss': 'coxph', 'learning_rate': 3.210212340375351e-05, 'n_estimators': 317, 'criterion': 'squared_error', 'min_samples_split': 7, 'min_samples_leaf': 10, 'min_weight_fraction_leaf': 0.1667754185615398, 'min_impurity_decrease': 0.012542649936208005, 'max_features': 0.8892787710060971, 'subsample': 0.28190238065287193, 'dropout_rate': 0.04940887081964282, 'ccp_alpha': 0.0031848087853133117}. Best is trial 187 with value: 0.6933481836305168.[0m
[32m[I 2022-04-21 23:16:52,608][0m Trial 438 finished with value: 0.5 and parameters: {'loss': 'coxph', 'learning_rate': 0.00036534275626223225, 'n_estimators': 285, 'criterion': 'squared_error', 'min_samples_split': 7, 'min_samples_leaf': 9, 'min_weight_fraction_leaf': 0.19451620160738972, 'min_impurity_decrease': 0.0657024441960654, 'max_features': 0.9152899273925619, 'subsample': 0.30514478299820097, 'dropout_rate': 0.2633315863148707, 'ccp_alpha': 0.5887086279950553}. Best is trial 187 with value: 0.6933481836305168.[0m
[32m[I 2022-04-21 23:17:22,414][0m Trial 439 finished with value: 0.5 and parameters: {'loss': 'coxph', 'learning_rate': 5.934937828109036e-05, 'n_estimators': 336, 'criterion': 'squared_error', 'min_samples_split': 5, 'min_samples_leaf': 10, 'min_weight_fraction_leaf': 0.21810647707552902, 'min_impurity_decrease': 0.6872103602102647, 'max_features': 0.8642695039832139, 'subsample': 0.2564701367279383, 'dropout_rate': 0.07228054048118282, 'ccp_alpha': 0.2849771128766584}. Best is trial 187 with value: 0.6933481836305168.[0m
[32m[I 2022-04-21 23:17:53,630][0m Trial 440 finished with value: 0.5541488513016184 and parameters: {'loss': 'coxph', 'learning_rate': 7.42321938162848e-05, 'n_estimators': 391, 'criterion': 'friedman_mse', 'min_samples_split': 7, 'min_samples_leaf': 1, 'min_weight_fraction_leaf': 0.20668064011818088, 'min_impurity_decrease': 0.03585098012541945, 'max_features': 0.06055223735527278, 'subsample': 0.3366783775133283, 'dropout_rate': 0.3984312834188619, 'ccp_alpha': 0.44973340202902773}. Best is trial 187 with value: 0.6933481836305168.[0m
[32m[I 2022-04-21 23:18:15,735][0m Trial 441 finished with value: 0.6862498715968679 and parameters: {'loss': 'coxph', 'learning_rate': 0.00029393947947195336, 'n_estimators': 304, 'criterion': 'squared_error', 'min_samples_split': 7, 'min_samples_leaf': 10, 'min_weight_fraction_leaf': 0.17824796999309692, 'min_impurity_decrease': 0.09962953211165929, 'max_features': 0.9284709322064313, 'subsample': 0.2817950510847182, 'dropout_rate': 0.24434685882620957, 'ccp_alpha': 0.16464529142163334}. Best is trial 187 with value: 0.6933481836305168.[0m
[32m[I 2022-04-21 23:18:48,607][0m Trial 442 finished with value: 0.6827808594018883 and parameters: {'loss': 'coxph', 'learning_rate': 0.00020340990426231752, 'n_estimators': 368, 'criterion': 'absolute_error', 'min_samples_split': 7, 'min_samples_leaf': 9, 'min_weight_fraction_leaf': 0.15392042900690367, 'min_impurity_decrease': 0.019646401410197314, 'max_features': 0.9442070485282505, 'subsample': 0.2981080254813287, 'dropout_rate': 0.03878068168273152, 'ccp_alpha': 0.08974028628414171}. Best is trial 187 with value: 0.6933481836305168.[0m
[32m[I 2022-04-21 23:19:06,943][0m Trial 443 finished with value: 0.5 and parameters: {'loss': 'coxph', 'learning_rate': 0.00014439726116812903, 'n_estimators': 259, 'criterion': 'squared_error', 'min_samples_split': 6, 'min_samples_leaf': 10, 'min_weight_fraction_leaf': 0.19257395022814552, 'min_impurity_decrease': 0.0511109157746602, 'max_features': 0.8903076881948006, 'subsample': 0.25732028157523623, 'dropout_rate': 0.3213256408746331, 'ccp_alpha': 1.7125051577655617}. Best is trial 187 with value: 0.6933481836305168.[0m
[32m[I 2022-04-21 23:19:31,765][0m Trial 444 finished with value: 0.680379848251262 and parameters: {'loss': 'coxph', 'learning_rate': 0.0004295594250926467, 'n_estimators': 326, 'criterion': 'squared_error', 'min_samples_split': 7, 'min_samples_leaf': 10, 'min_weight_fraction_leaf': 0.2314077245844915, 'min_impurity_decrease': 0.08305542799395915, 'max_features': 0.08139496821291876, 'subsample': 0.3187781246558188, 'dropout_rate': 0.06207935108950363, 'ccp_alpha': 0.003007248093752476}. Best is trial 187 with value: 0.6933481836305168.[0m
[32m[I 2022-04-21 23:19:46,357][0m Trial 445 finished with value: 0.6564305241751043 and parameters: {'loss': 'coxph', 'learning_rate': 4.653831706149756e-05, 'n_estimators': 242, 'criterion': 'squared_error', 'min_samples_split': 7, 'min_samples_leaf': 10, 'min_weight_fraction_leaf': 0.16984974904400887, 'min_impurity_decrease': 0.034791943714738295, 'max_features': 0.920882094723121, 'subsample': 0.2757062945642629, 'dropout_rate': 0.029456239294442434, 'ccp_alpha': 0.3371559509963207}. Best is trial 187 with value: 0.6933481836305168.[0m
[32m[I 2022-04-21 23:20:05,035][0m Trial 446 finished with value: 0.6693909955578041 and parameters: {'loss': 'coxph', 'learning_rate': 0.0002546679830524141, 'n_estimators': 297, 'criterion': 'squared_error', 'min_samples_split': 7, 'min_samples_leaf': 10, 'min_weight_fraction_leaf': 0.18470596452348384, 'min_impurity_decrease': 0.0666581707573592, 'max_features': 0.9048672553663635, 'subsample': 0.3540289471516179, 'dropout_rate': 0.0159464786161298, 'ccp_alpha': 0.22874284963257974}. Best is trial 187 with value: 0.6933481836305168.[0m
[32m[I 2022-04-21 23:20:50,628][0m Trial 447 finished with value: 0.6877332279283472 and parameters: {'loss': 'coxph', 'learning_rate': 0.0005450333163380443, 'n_estimators': 416, 'criterion': 'squared_error', 'min_samples_split': 7, 'min_samples_leaf': 9, 'min_weight_fraction_leaf': 0.201763409402993, 'min_impurity_decrease': 0.0028680747313312056, 'max_features': 0.02534807127091665, 'subsample': 0.29725825320665644, 'dropout_rate': 0.08951377582962373, 'ccp_alpha': 0.1046991574667869}. Best is trial 187 with value: 0.6933481836305168.[0m
[32m[I 2022-04-21 23:20:58,361][0m Trial 448 finished with value: 0.6793907240826543 and parameters: {'loss': 'coxph', 'learning_rate': 8.408542232039067e-05, 'n_estimators': 217, 'criterion': 'squared_error', 'min_samples_split': 7, 'min_samples_leaf': 10, 'min_weight_fraction_leaf': 0.2108910277332306, 'min_impurity_decrease': 0.11433722510156552, 'max_features': 0.8756741173241954, 'subsample': 0.2440765122497222, 'dropout_rate': 0.2868449734671589, 'ccp_alpha': 0.17208683962916982}. Best is trial 187 with value: 0.6933481836305168.[0m
[32m[I 2022-04-21 23:21:31,588][0m Trial 449 finished with value: 0.685896766676301 and parameters: {'loss': 'coxph', 'learning_rate': 6.637212114105206e-05, 'n_estimators': 352, 'criterion': 'squared_error', 'min_samples_split': 6, 'min_samples_leaf': 9, 'min_weight_fraction_leaf': 0.21868783749497409, 'min_impurity_decrease': 0.05360945181968124, 'max_features': 0.9535538423885249, 'subsample': 0.3194473347072228, 'dropout_rate': 0.056430758060472645, 'ccp_alpha': 0.0834585199053234}. Best is trial 187 with value: 0.6933481836305168.[0m
[32m[I 2022-04-21 23:21:56,789][0m Trial 450 finished with value: 0.6682973162934912 and parameters: {'loss': 'coxph', 'learning_rate': 2.6176722106648844e-05, 'n_estimators': 315, 'criterion': 'squared_error', 'min_samples_split': 7, 'min_samples_leaf': 10, 'min_weight_fraction_leaf': 0.18729444274113394, 'min_impurity_decrease': 0.14190119748544022, 'max_features': 0.9351172478656167, 'subsample': 0.2687792885287777, 'dropout_rate': 0.07701794674580137, 'ccp_alpha': 0.2550051221025058}. Best is trial 187 with value: 0.6933481836305168.[0m
/media/san2_ssd/data/Workdir/survival/venv/lib/python3.8/site-packages/sksurv/ensemble/boosting.py:955: RuntimeWarning: divide by zero encountered in log
  time = numpy.log(time)
/media/san2_ssd/data/Workdir/survival/venv/lib/python3.8/site-packages/sksurv/ensemble/boosting.py:955: RuntimeWarning: divide by zero encountered in log
  time = numpy.log(time)
/media/san2_ssd/data/Workdir/survival/venv/lib/python3.8/site-packages/sksurv/ensemble/boosting.py:955: RuntimeWarning: divide by zero encountered in log
  time = numpy.log(time)
/media/san2_ssd/data/Workdir/survival/venv/lib/python3.8/site-packages/sksurv/ensemble/boosting.py:955: RuntimeWarning: divide by zero encountered in log
  time = numpy.log(time)
[32m[I 2022-04-21 23:22:00,128][0m Trial 451 finished with value: -0.7309394300370865 and parameters: {'loss': 'squared', 'learning_rate': 0.0001704653203263642, 'n_estimators': 271, 'criterion': 'squared_error', 'min_samples_split': 8, 'min_samples_leaf': 10, 'min_weight_fraction_leaf': 0.16118248790259565, 'min_impurity_decrease': 0.08095281790982836, 'max_features': 0.8577076786225482, 'subsample': 0.17071866679173714, 'dropout_rate': 0.19788396811743947, 'ccp_alpha': 0.09403412220435767}. Best is trial 187 with value: 0.6933481836305168.[0m
[32m[I 2022-04-21 23:22:45,987][0m Trial 452 finished with value: 0.6884054554564354 and parameters: {'loss': 'coxph', 'learning_rate': 3.617185161229659e-05, 'n_estimators': 476, 'criterion': 'friedman_mse', 'min_samples_split': 7, 'min_samples_leaf': 10, 'min_weight_fraction_leaf': 0.17699056879677064, 'min_impurity_decrease': 0.031143598492280912, 'max_features': 0.897495031033081, 'subsample': 0.28933994885482106, 'dropout_rate': 0.2612585410766053, 'ccp_alpha': 0.17789955691712778}. Best is trial 187 with value: 0.6933481836305168.[0m
[32m[I 2022-04-21 23:23:08,822][0m Trial 453 finished with value: 0.6847662229307669 and parameters: {'loss': 'coxph', 'learning_rate': 4.8905445659273586e-06, 'n_estimators': 288, 'criterion': 'absolute_error', 'min_samples_split': 7, 'min_samples_leaf': 9, 'min_weight_fraction_leaf': 0.19858851898269028, 'min_impurity_decrease': 0.09330619490175608, 'max_features': 0.8432734115801143, 'subsample': 0.24169172600290215, 'dropout_rate': 0.04379774112710902, 'ccp_alpha': 0.008230977347574591}. Best is trial 187 with value: 0.6933481836305168.[0m
[32m[I 2022-04-21 23:23:33,841][0m Trial 454 finished with value: 0.6368060109313067 and parameters: {'loss': 'coxph', 'learning_rate': 5.528245354971008e-05, 'n_estimators': 335, 'criterion': 'squared_error', 'min_samples_split': 7, 'min_samples_leaf': 10, 'min_weight_fraction_leaf': 0.20715125254188443, 'min_impurity_decrease': 0.05592793874667279, 'max_features': 0.9575185539605826, 'subsample': 0.34390702981767135, 'dropout_rate': 0.0179097132334581, 'ccp_alpha': 0.34485894547968127}. Best is trial 187 with value: 0.6933481836305168.[0m
[32m[I 2022-04-21 23:23:53,081][0m Trial 455 finished with value: 0.6449850903649714 and parameters: {'loss': 'coxph', 'learning_rate': 0.00036611592018945217, 'n_estimators': 380, 'criterion': 'squared_error', 'min_samples_split': 7, 'min_samples_leaf': 10, 'min_weight_fraction_leaf': 0.2363936846427853, 'min_impurity_decrease': 0.019907756577220912, 'max_features': 0.3500668431584783, 'subsample': 0.7702123706314361, 'dropout_rate': 0.6674916019868466, 'ccp_alpha': 0.15731953297459506}. Best is trial 187 with value: 0.6933481836305168.[0m
[32m[I 2022-04-21 23:24:52,383][0m Trial 456 finished with value: 0.683996326152527 and parameters: {'loss': 'coxph', 'learning_rate': 0.00012734116334966984, 'n_estimators': 523, 'criterion': 'squared_error', 'min_samples_split': 7, 'min_samples_leaf': 9, 'min_weight_fraction_leaf': 0.1896385563502685, 'min_impurity_decrease': 0.07390459156986881, 'max_features': 0.9238613939668766, 'subsample': 0.2684549049195844, 'dropout_rate': 0.21353737791098162, 'ccp_alpha': 0.08207772031913983}. Best is trial 187 with value: 0.6933481836305168.[0m
[32m[I 2022-04-21 23:25:15,318][0m Trial 457 finished with value: 0.6875607977141808 and parameters: {'loss': 'coxph', 'learning_rate': 0.0001913123931075788, 'n_estimators': 357, 'criterion': 'squared_error', 'min_samples_split': 7, 'min_samples_leaf': 10, 'min_weight_fraction_leaf': 0.1695261802364299, 'min_impurity_decrease': 0.039554823202740494, 'max_features': 0.8759046218578567, 'subsample': 0.3053020033598879, 'dropout_rate': 0.4912535307847349, 'ccp_alpha': 0.0013548577377356236}. Best is trial 187 with value: 0.6933481836305168.[0m
[32m[I 2022-04-21 23:25:19,751][0m Trial 458 finished with value: 0.6682973162934912 and parameters: {'loss': 'coxph', 'learning_rate': 7.195019173950261e-05, 'n_estimators': 304, 'criterion': 'squared_error', 'min_samples_split': 7, 'min_samples_leaf': 10, 'min_weight_fraction_leaf': 0.21570507330021202, 'min_impurity_decrease': 0.10457418522862212, 'max_features': 0.7944610173507999, 'subsample': 0.3272175100088214, 'dropout_rate': 0.9546601172227833, 'ccp_alpha': 0.2472234802491894}. Best is trial 187 with value: 0.6933481836305168.[0m
[32m[I 2022-04-21 23:25:40,607][0m Trial 459 finished with value: 0.6877871848544025 and parameters: {'loss': 'coxph', 'learning_rate': 9.100371788549451e-05, 'n_estimators': 326, 'criterion': 'squared_error', 'min_samples_split': 7, 'min_samples_leaf': 9, 'min_weight_fraction_leaf': 0.18073864342064785, 'min_impurity_decrease': 0.12954264285351944, 'max_features': 0.8321952321122715, 'subsample': 0.2863354097429392, 'dropout_rate': 0.23551447507422996, 'ccp_alpha': 0.1613534202600602}. Best is trial 187 with value: 0.6933481836305168.[0m
[32m[I 2022-04-21 23:25:53,833][0m Trial 460 finished with value: 0.5 and parameters: {'loss': 'coxph', 'learning_rate': 0.0003176284457372488, 'n_estimators': 231, 'criterion': 'squared_error', 'min_samples_split': 7, 'min_samples_leaf': 10, 'min_weight_fraction_leaf': 0.2501096944800566, 'min_impurity_decrease': 0.06024136265025063, 'max_features': 0.9082305768645819, 'subsample': 0.2524669292639699, 'dropout_rate': 0.10053154522543165, 'ccp_alpha': 2.0415794560557483}. Best is trial 187 with value: 0.6933481836305168.[0m
[32m[I 2022-04-21 23:26:29,615][0m Trial 461 finished with value: 0.5827751132342576 and parameters: {'loss': 'coxph', 'learning_rate': 4.565184479134392e-05, 'n_estimators': 343, 'criterion': 'squared_error', 'min_samples_split': 10, 'min_samples_leaf': 10, 'min_weight_fraction_leaf': 0.22803879205973204, 'min_impurity_decrease': 0.016168646174665208, 'max_features': 0.05461941059568451, 'subsample': 0.310333339330655, 'dropout_rate': 0.0017988987295168013, 'ccp_alpha': 0.4292406891823192}. Best is trial 187 with value: 0.6933481836305168.[0m
[32m[I 2022-04-21 23:26:46,977][0m Trial 462 finished with value: 0.6649278943012369 and parameters: {'loss': 'coxph', 'learning_rate': 0.0004856989438271615, 'n_estimators': 293, 'criterion': 'absolute_error', 'min_samples_split': 6, 'min_samples_leaf': 10, 'min_weight_fraction_leaf': 0.20050199723291098, 'min_impurity_decrease': 0.17251431010646, 'max_features': 0.9396614420705561, 'subsample': 0.2713973907778285, 'dropout_rate': 0.3486644081158741, 'ccp_alpha': 0.0016655647199403942}. Best is trial 187 with value: 0.6933481836305168.[0m
[32m[I 2022-04-21 23:27:10,249][0m Trial 463 finished with value: 0.6328587378943288 and parameters: {'loss': 'coxph', 'learning_rate': 0.00022142541058576688, 'n_estimators': 314, 'criterion': 'squared_error', 'min_samples_split': 7, 'min_samples_leaf': 10, 'min_weight_fraction_leaf': 0.19247983786649506, 'min_impurity_decrease': 0.0010535050643202572, 'max_features': 0.1009310890378286, 'subsample': 0.36255148425816847, 'dropout_rate': 0.3085086650516107, 'ccp_alpha': 0.2806124846453045}. Best is trial 187 with value: 0.6933481836305168.[0m
[32m[I 2022-04-21 23:27:46,872][0m Trial 464 finished with value: 0.5 and parameters: {'loss': 'coxph', 'learning_rate': 0.00014565835214071907, 'n_estimators': 367, 'criterion': 'squared_error', 'min_samples_split': 7, 'min_samples_leaf': 9, 'min_weight_fraction_leaf': 0.13583979658729062, 'min_impurity_decrease': 0.08292812013939516, 'max_features': 0.9616710745416849, 'subsample': 0.18944502292244544, 'dropout_rate': 0.07885640939292005, 'ccp_alpha': 2.8956328107909277}. Best is trial 187 with value: 0.6933481836305168.[0m
[32m[I 2022-04-21 23:28:05,145][0m Trial 465 finished with value: 0.6807045877835038 and parameters: {'loss': 'coxph', 'learning_rate': 5.561930528753613e-05, 'n_estimators': 263, 'criterion': 'friedman_mse', 'min_samples_split': 8, 'min_samples_leaf': 10, 'min_weight_fraction_leaf': 0.15885675241662278, 'min_impurity_decrease': 0.04259588576291983, 'max_features': 0.8898822986918102, 'subsample': 0.22014516150441826, 'dropout_rate': 0.05288580640615893, 'ccp_alpha': 0.13287876624973144}. Best is trial 187 with value: 0.6933481836305168.[0m
[32m[I 2022-04-21 23:28:39,819][0m Trial 466 finished with value: 0.6867367229402914 and parameters: {'loss': 'coxph', 'learning_rate': 0.03429308104184748, 'n_estimators': 396, 'criterion': 'squared_error', 'min_samples_split': 7, 'min_samples_leaf': 10, 'min_weight_fraction_leaf': 0.17611357907434647, 'min_impurity_decrease': 0.10474702837663027, 'max_features': 0.8153780669326429, 'subsample': 0.2955548142307574, 'dropout_rate': 0.2738969714619821, 'ccp_alpha': 0.08585314171943151}. Best is trial 187 with value: 0.6933481836305168.[0m
[32m[I 2022-04-21 23:29:15,884][0m Trial 467 finished with value: 0.6655242644561282 and parameters: {'loss': 'coxph', 'learning_rate': 3.691839592784935e-05, 'n_estimators': 337, 'criterion': 'squared_error', 'min_samples_split': 7, 'min_samples_leaf': 9, 'min_weight_fraction_leaf': 0.20793236586712688, 'min_impurity_decrease': 0.3000566100294043, 'max_features': 0.9360622979046053, 'subsample': 0.3368662263728202, 'dropout_rate': 0.06899367662448287, 'ccp_alpha': 0.22856988773841802}. Best is trial 187 with value: 0.6933481836305168.[0m
[32m[I 2022-04-21 23:29:38,494][0m Trial 468 finished with value: 0.5 and parameters: {'loss': 'coxph', 'learning_rate': 0.0001090951563412979, 'n_estimators': 280, 'criterion': 'squared_error', 'min_samples_split': 7, 'min_samples_leaf': 10, 'min_weight_fraction_leaf': 0.22001935690097957, 'min_impurity_decrease': 0.07210131964194542, 'max_features': 0.8544442526217093, 'subsample': 0.24647989763437123, 'dropout_rate': 0.027195862145672, 'ccp_alpha': 4.185038630308869}. Best is trial 187 with value: 0.6933481836305168.[0m
[32m[I 2022-04-21 23:30:23,475][0m Trial 469 finished with value: 0.6701312187111274 and parameters: {'loss': 'coxph', 'learning_rate': 0.0002454115372578011, 'n_estimators': 432, 'criterion': 'squared_error', 'min_samples_split': 7, 'min_samples_leaf': 10, 'min_weight_fraction_leaf': 0.1980187350346496, 'min_impurity_decrease': 0.20788815498352692, 'max_features': 0.9748312523634364, 'subsample': 0.2851439079059973, 'dropout_rate': 0.11311637050125946, 'ccp_alpha': 0.0908677663146754}. Best is trial 187 with value: 0.6933481836305168.[0m
/media/san2_ssd/data/Workdir/survival/venv/lib/python3.8/site-packages/sksurv/ensemble/boosting.py:955: RuntimeWarning: divide by zero encountered in log
  time = numpy.log(time)
/media/san2_ssd/data/Workdir/survival/venv/lib/python3.8/site-packages/sksurv/ensemble/boosting.py:955: RuntimeWarning: divide by zero encountered in log
  time = numpy.log(time)
/media/san2_ssd/data/Workdir/survival/venv/lib/python3.8/site-packages/sksurv/ensemble/boosting.py:955: RuntimeWarning: divide by zero encountered in log
  time = numpy.log(time)
/media/san2_ssd/data/Workdir/survival/venv/lib/python3.8/site-packages/sksurv/ensemble/boosting.py:955: RuntimeWarning: divide by zero encountered in log
  time = numpy.log(time)
[32m[I 2022-04-21 23:30:29,454][0m Trial 470 finished with value: -0.7 and parameters: {'loss': 'squared', 'learning_rate': 8.286869564819563e-05, 'n_estimators': 312, 'criterion': 'squared_error', 'min_samples_split': 7, 'min_samples_leaf': 5, 'min_weight_fraction_leaf': 0.18292422756304638, 'min_impurity_decrease': 0.03804884060490453, 'max_features': 0.9122866582531792, 'subsample': 0.005873955294518174, 'dropout_rate': 0.2967130027011025, 'ccp_alpha': 0.34448796887512245}. Best is trial 187 with value: 0.6933481836305168.[0m
[32m[I 2022-04-21 23:30:49,919][0m Trial 471 finished with value: 0.6245929444509514 and parameters: {'loss': 'coxph', 'learning_rate': 0.000167557493906293, 'n_estimators': 293, 'criterion': 'absolute_error', 'min_samples_split': 7, 'min_samples_leaf': 9, 'min_weight_fraction_leaf': 0.16784937895860214, 'min_impurity_decrease': 0.05788190937306634, 'max_features': 0.9462882040430017, 'subsample': 0.3194452129071879, 'dropout_rate': 0.04515353588696802, 'ccp_alpha': 0.18229671466976802}. Best is trial 187 with value: 0.6933481836305168.[0m
