[32m[I 2022-04-21 19:27:43,603][0m Trial 662 finished with value: 0.846114426499798 and parameters: {'loss': 'coxph', 'learning_rate': 0.0005857675492204992, 'n_estimators': 350, 'criterion': 'friedman_mse', 'min_samples_split': 3, 'min_samples_leaf': 1, 'min_weight_fraction_leaf': 0.13537632833362906, 'min_impurity_decrease': 0.20713627692469913, 'max_features': 0.40749558698397165, 'subsample': 0.034843251186168475, 'dropout_rate': 0.09942505449620201, 'ccp_alpha': 0.09138508499609568}. Best is trial 583 with value: 0.8480221917497749.[0m
[32m[I 2022-04-21 19:28:07,978][0m Trial 663 finished with value: 0.8447921138364711 and parameters: {'loss': 'coxph', 'learning_rate': 0.0006426278432784083, 'n_estimators': 357, 'criterion': 'friedman_mse', 'min_samples_split': 3, 'min_samples_leaf': 1, 'min_weight_fraction_leaf': 0.12631367533145937, 'min_impurity_decrease': 0.20112506348853446, 'max_features': 0.3689296298936418, 'subsample': 0.022834664531571763, 'dropout_rate': 0.1019483959543659, 'ccp_alpha': 0.10063354431717338}. Best is trial 583 with value: 0.8480221917497749.[0m
[32m[I 2022-04-21 19:28:34,582][0m Trial 664 finished with value: 0.8446820699855108 and parameters: {'loss': 'coxph', 'learning_rate': 0.0009080892016411418, 'n_estimators': 349, 'criterion': 'friedman_mse', 'min_samples_split': 3, 'min_samples_leaf': 1, 'min_weight_fraction_leaf': 0.13466426822956246, 'min_impurity_decrease': 0.23565692720235065, 'max_features': 0.4017282145539694, 'subsample': 0.037961776132011196, 'dropout_rate': 0.0705893112986421, 'ccp_alpha': 0.1668931256874389}. Best is trial 583 with value: 0.8480221917497749.[0m
[32m[I 2022-04-21 19:29:05,251][0m Trial 665 finished with value: 0.65 and parameters: {'loss': 'coxph', 'learning_rate': 0.0005738130009893751, 'n_estimators': 385, 'criterion': 'friedman_mse', 'min_samples_split': 3, 'min_samples_leaf': 1, 'min_weight_fraction_leaf': 0.1369334000874512, 'min_impurity_decrease': 0.18383692977375246, 'max_features': 0.36792139279171854, 'subsample': 0.019206291067200405, 'dropout_rate': 0.037358403297466695, 'ccp_alpha': 0.09187990279661663}. Best is trial 583 with value: 0.8480221917497749.[0m
[32m[I 2022-04-21 19:29:35,586][0m Trial 666 finished with value: 0.65 and parameters: {'loss': 'coxph', 'learning_rate': 0.0005854707499246849, 'n_estimators': 367, 'criterion': 'friedman_mse', 'min_samples_split': 3, 'min_samples_leaf': 1, 'min_weight_fraction_leaf': 0.12301551351482297, 'min_impurity_decrease': 0.20424022298465447, 'max_features': 0.38698881402276636, 'subsample': 0.0013318945055777326, 'dropout_rate': 0.0923705792217793, 'ccp_alpha': 0.30474608740679554}. Best is trial 583 with value: 0.8480221917497749.[0m
[32m[I 2022-04-21 19:29:58,322][0m Trial 667 finished with value: 0.8470703379899595 and parameters: {'loss': 'coxph', 'learning_rate': 0.0007922685417435714, 'n_estimators': 337, 'criterion': 'friedman_mse', 'min_samples_split': 3, 'min_samples_leaf': 1, 'min_weight_fraction_leaf': 0.143283069733558, 'min_impurity_decrease': 0.15673137513948301, 'max_features': 0.35419706201073287, 'subsample': 0.03759984405095286, 'dropout_rate': 0.10227342757928608, 'ccp_alpha': 0.09391603046079018}. Best is trial 583 with value: 0.8480221917497749.[0m
[32m[I 2022-04-21 19:30:29,476][0m Trial 668 finished with value: 0.8453488312621322 and parameters: {'loss': 'coxph', 'learning_rate': 0.0009915882513185602, 'n_estimators': 335, 'criterion': 'friedman_mse', 'min_samples_split': 3, 'min_samples_leaf': 1, 'min_weight_fraction_leaf': 0.15283620378626042, 'min_impurity_decrease': 0.11283365941680464, 'max_features': 0.3471613812733482, 'subsample': 0.045903536430560624, 'dropout_rate': 0.10986501311765795, 'ccp_alpha': 0.19349510558843142}. Best is trial 583 with value: 0.8480221917497749.[0m
[32m[I 2022-04-21 19:30:55,896][0m Trial 669 finished with value: 0.8445853084640781 and parameters: {'loss': 'coxph', 'learning_rate': 0.0008057359844760515, 'n_estimators': 320, 'criterion': 'friedman_mse', 'min_samples_split': 3, 'min_samples_leaf': 1, 'min_weight_fraction_leaf': 0.14670894944858973, 'min_impurity_decrease': 0.1473425763525837, 'max_features': 0.34435585229603183, 'subsample': 0.05091740451267744, 'dropout_rate': 0.07171986820463197, 'ccp_alpha': 0.0032812651443681704}. Best is trial 583 with value: 0.8480221917497749.[0m
[32m[I 2022-04-21 19:31:00,622][0m Trial 670 finished with value: 0.65 and parameters: {'loss': 'coxph', 'learning_rate': 0.0011008010936518998, 'n_estimators': 140, 'criterion': 'friedman_mse', 'min_samples_split': 3, 'min_samples_leaf': 7, 'min_weight_fraction_leaf': 0.14816427563438408, 'min_impurity_decrease': 0.12585505981460196, 'max_features': 0.36104067293244696, 'subsample': 0.037952686448132406, 'dropout_rate': 0.08271355178051398, 'ccp_alpha': 3.8334258510480623}. Best is trial 583 with value: 0.8480221917497749.[0m
[32m[I 2022-04-21 19:31:28,541][0m Trial 671 finished with value: 0.8418388578331196 and parameters: {'loss': 'coxph', 'learning_rate': 0.0007129307901268656, 'n_estimators': 334, 'criterion': 'friedman_mse', 'min_samples_split': 3, 'min_samples_leaf': 1, 'min_weight_fraction_leaf': 0.1403895664392852, 'min_impurity_decrease': 0.15577321113763587, 'max_features': 0.3313019790112607, 'subsample': 0.0590051377873449, 'dropout_rate': 0.10183602076393528, 'ccp_alpha': 0.24317523430070154}. Best is trial 583 with value: 0.8480221917497749.[0m
[32m[I 2022-04-21 19:31:51,262][0m Trial 672 finished with value: 0.65 and parameters: {'loss': 'coxph', 'learning_rate': 0.0012546331125981335, 'n_estimators': 313, 'criterion': 'friedman_mse', 'min_samples_split': 3, 'min_samples_leaf': 1, 'min_weight_fraction_leaf': 0.154700610875949, 'min_impurity_decrease': 0.14530324444130227, 'max_features': 0.36567000916449865, 'subsample': 0.018430730675693535, 'dropout_rate': 0.12136581719454931, 'ccp_alpha': 0.14762532445939444}. Best is trial 583 with value: 0.8480221917497749.[0m
[32m[I 2022-04-21 19:32:26,486][0m Trial 673 finished with value: 0.843081175865412 and parameters: {'loss': 'coxph', 'learning_rate': 0.000398560126733321, 'n_estimators': 340, 'criterion': 'friedman_mse', 'min_samples_split': 3, 'min_samples_leaf': 1, 'min_weight_fraction_leaf': 0.1566907614809528, 'min_impurity_decrease': 0.16962570042795716, 'max_features': 0.338327442218222, 'subsample': 0.05661231689473479, 'dropout_rate': 0.04791600796599948, 'ccp_alpha': 0.09683645860074055}. Best is trial 583 with value: 0.8480221917497749.[0m
/media/san2_ssd/data/Workdir/survival/venv/lib/python3.8/site-packages/sksurv/ensemble/boosting.py:955: RuntimeWarning: divide by zero encountered in log
  time = numpy.log(time)
/media/san2_ssd/data/Workdir/survival/venv/lib/python3.8/site-packages/sksurv/ensemble/boosting.py:955: RuntimeWarning: divide by zero encountered in log
  time = numpy.log(time)
/media/san2_ssd/data/Workdir/survival/venv/lib/python3.8/site-packages/sksurv/ensemble/boosting.py:955: RuntimeWarning: divide by zero encountered in log
  time = numpy.log(time)
/media/san2_ssd/data/Workdir/survival/venv/lib/python3.8/site-packages/sksurv/ensemble/boosting.py:955: RuntimeWarning: divide by zero encountered in log
  time = numpy.log(time)
[32m[I 2022-04-21 19:32:30,275][0m Trial 674 finished with value: -0.46613378432860025 and parameters: {'loss': 'squared', 'learning_rate': 0.0008466235617479578, 'n_estimators': 324, 'criterion': 'friedman_mse', 'min_samples_split': 3, 'min_samples_leaf': 1, 'min_weight_fraction_leaf': 0.16337217916386995, 'min_impurity_decrease': 0.17345245176844315, 'max_features': 0.37698993283628146, 'subsample': 0.03165741661964497, 'dropout_rate': 0.11779473677238658, 'ccp_alpha': 0.28635915779939025}. Best is trial 583 with value: 0.8480221917497749.[0m
[32m[I 2022-04-21 19:32:53,966][0m Trial 675 finished with value: 0.8437083441099136 and parameters: {'loss': 'coxph', 'learning_rate': 0.0004900945514674536, 'n_estimators': 346, 'criterion': 'friedman_mse', 'min_samples_split': 3, 'min_samples_leaf': 1, 'min_weight_fraction_leaf': 0.14222576749842739, 'min_impurity_decrease': 0.9832891222826422, 'max_features': 0.35325430101075384, 'subsample': 0.060220842958536566, 'dropout_rate': 0.12616397848370042, 'ccp_alpha': 0.08764687285071453}. Best is trial 583 with value: 0.8480221917497749.[0m
[32m[I 2022-04-21 19:33:13,436][0m Trial 676 finished with value: 0.8449530684525751 and parameters: {'loss': 'coxph', 'learning_rate': 0.00025920439564610867, 'n_estimators': 322, 'criterion': 'friedman_mse', 'min_samples_split': 3, 'min_samples_leaf': 1, 'min_weight_fraction_leaf': 0.16796069896108198, 'min_impurity_decrease': 0.24265304151981415, 'max_features': 0.3794010396923476, 'subsample': 0.04213243484968861, 'dropout_rate': 0.09483345030148418, 'ccp_alpha': 0.001340111647425541}. Best is trial 583 with value: 0.8480221917497749.[0m
[32m[I 2022-04-21 19:33:39,107][0m Trial 677 finished with value: 0.6598665909009627 and parameters: {'loss': 'coxph', 'learning_rate': 0.000784524284385625, 'n_estimators': 305, 'criterion': 'squared_error', 'min_samples_split': 3, 'min_samples_leaf': 1, 'min_weight_fraction_leaf': 0.14558838708134553, 'min_impurity_decrease': 0.18602200818871809, 'max_features': 0.3519928905968266, 'subsample': 0.07781070389541295, 'dropout_rate': 0.06466249197575369, 'ccp_alpha': 1.132336202884443}. Best is trial 583 with value: 0.8480221917497749.[0m
[32m[I 2022-04-21 19:34:08,182][0m Trial 678 finished with value: 0.65 and parameters: {'loss': 'coxph', 'learning_rate': 0.00036271958384450086, 'n_estimators': 358, 'criterion': 'friedman_mse', 'min_samples_split': 3, 'min_samples_leaf': 1, 'min_weight_fraction_leaf': 0.13076812895592382, 'min_impurity_decrease': 0.22687936008906526, 'max_features': 0.3262180072311243, 'subsample': 0.018093813551770685, 'dropout_rate': 0.12341539706471573, 'ccp_alpha': 0.18770770670733145}. Best is trial 583 with value: 0.8480221917497749.[0m
[32m[I 2022-04-21 19:34:37,921][0m Trial 679 finished with value: 0.8322873829088066 and parameters: {'loss': 'coxph', 'learning_rate': 0.0004628331764717584, 'n_estimators': 329, 'criterion': 'friedman_mse', 'min_samples_split': 3, 'min_samples_leaf': 1, 'min_weight_fraction_leaf': 0.15047593965222217, 'min_impurity_decrease': 0.25392079475422596, 'max_features': 0.39231188401087913, 'subsample': 0.05886743035413886, 'dropout_rate': 0.10643325864013098, 'ccp_alpha': 0.37310259347001845}. Best is trial 583 with value: 0.8480221917497749.[0m
[32m[I 2022-04-21 19:34:47,683][0m Trial 680 finished with value: 0.8342987582484452 and parameters: {'loss': 'coxph', 'learning_rate': 0.0002942912871455672, 'n_estimators': 375, 'criterion': 'friedman_mse', 'min_samples_split': 3, 'min_samples_leaf': 1, 'min_weight_fraction_leaf': 0.17347144953024402, 'min_impurity_decrease': 0.2176691011736932, 'max_features': 0.3636930559668089, 'subsample': 0.47158256063215603, 'dropout_rate': 0.7635598311391063, 'ccp_alpha': 0.17281356686531646}. Best is trial 583 with value: 0.8480221917497749.[0m
[32m[I 2022-04-21 19:35:11,808][0m Trial 681 finished with value: 0.65 and parameters: {'loss': 'coxph', 'learning_rate': 0.0005885728173141975, 'n_estimators': 313, 'criterion': 'friedman_mse', 'min_samples_split': 3, 'min_samples_leaf': 1, 'min_weight_fraction_leaf': 0.2978661699726597, 'min_impurity_decrease': 0.10225090803205081, 'max_features': 0.23297840385481358, 'subsample': 0.002126169495341723, 'dropout_rate': 0.08467288748551013, 'ccp_alpha': 0.08867828049386378}. Best is trial 583 with value: 0.8480221917497749.[0m
[32m[I 2022-04-21 19:35:40,927][0m Trial 682 finished with value: 0.8429251644951956 and parameters: {'loss': 'coxph', 'learning_rate': 0.000765926638714186, 'n_estimators': 343, 'criterion': 'absolute_error', 'min_samples_split': 3, 'min_samples_leaf': 1, 'min_weight_fraction_leaf': 0.16018934242500982, 'min_impurity_decrease': 0.24240080251297108, 'max_features': 0.2668657213017165, 'subsample': 0.08733270325937478, 'dropout_rate': 0.1341789178828538, 'ccp_alpha': 0.2267159253393894}. Best is trial 583 with value: 0.8480221917497749.[0m
[32m[I 2022-04-21 19:36:06,130][0m Trial 683 finished with value: 0.8429610489692813 and parameters: {'loss': 'coxph', 'learning_rate': 0.00037058397304993556, 'n_estimators': 305, 'criterion': 'friedman_mse', 'min_samples_split': 3, 'min_samples_leaf': 1, 'min_weight_fraction_leaf': 0.32394259131342656, 'min_impurity_decrease': 0.2588277810869609, 'max_features': 0.5487407012282165, 'subsample': 0.034120148551716044, 'dropout_rate': 0.15040546090966828, 'ccp_alpha': 0.3290953298936367}. Best is trial 583 with value: 0.8480221917497749.[0m
[32m[I 2022-04-21 19:36:35,822][0m Trial 684 finished with value: 0.8438038699478149 and parameters: {'loss': 'coxph', 'learning_rate': 0.0004996933851930123, 'n_estimators': 325, 'criterion': 'friedman_mse', 'min_samples_split': 3, 'min_samples_leaf': 1, 'min_weight_fraction_leaf': 0.11051439635259702, 'min_impurity_decrease': 0.19346719040385302, 'max_features': 0.3067236253065388, 'subsample': 0.06241797952861035, 'dropout_rate': 0.020709409561359436, 'ccp_alpha': 0.08817209276747223}. Best is trial 583 with value: 0.8480221917497749.[0m
[32m[I 2022-04-21 19:37:15,461][0m Trial 685 finished with value: 0.8460257500748867 and parameters: {'loss': 'coxph', 'learning_rate': 0.0009302593949167443, 'n_estimators': 365, 'criterion': 'friedman_mse', 'min_samples_split': 3, 'min_samples_leaf': 1, 'min_weight_fraction_leaf': 0.12145727325699596, 'min_impurity_decrease': 0.14592633553219778, 'max_features': 0.33972759246452994, 'subsample': 0.1018878861202089, 'dropout_rate': 0.11639593327349532, 'ccp_alpha': 0.17683745336943912}. Best is trial 583 with value: 0.8480221917497749.[0m
[32m[I 2022-04-21 19:37:52,088][0m Trial 686 finished with value: 0.8336473754243375 and parameters: {'loss': 'coxph', 'learning_rate': 0.00027356520561338984, 'n_estimators': 338, 'criterion': 'friedman_mse', 'min_samples_split': 3, 'min_samples_leaf': 1, 'min_weight_fraction_leaf': 0.1629465032366063, 'min_impurity_decrease': 0.22063264654219, 'max_features': 0.3764234585303516, 'subsample': 0.07726068918397422, 'dropout_rate': 0.07714762106815962, 'ccp_alpha': 0.46641600842029474}. Best is trial 583 with value: 0.8480221917497749.[0m
[32m[I 2022-04-21 19:38:13,839][0m Trial 687 finished with value: 0.8460546217692594 and parameters: {'loss': 'coxph', 'learning_rate': 0.0006809868257876665, 'n_estimators': 303, 'criterion': 'friedman_mse', 'min_samples_split': 3, 'min_samples_leaf': 1, 'min_weight_fraction_leaf': 0.13770285914741537, 'min_impurity_decrease': 0.17640263660987832, 'max_features': 0.3977480758698473, 'subsample': 0.04509273029215046, 'dropout_rate': 0.1554207600416711, 'ccp_alpha': 0.08708193386094519}. Best is trial 583 with value: 0.8480221917497749.[0m
[32m[I 2022-04-21 19:38:48,771][0m Trial 688 finished with value: 0.8460991605569047 and parameters: {'loss': 'coxph', 'learning_rate': 0.00042596302800000196, 'n_estimators': 410, 'criterion': 'friedman_mse', 'min_samples_split': 3, 'min_samples_leaf': 1, 'min_weight_fraction_leaf': 0.17727144382426294, 'min_impurity_decrease': 0.26609348836543373, 'max_features': 0.32320716486951956, 'subsample': 0.06497104626767507, 'dropout_rate': 0.13358072315229316, 'ccp_alpha': 0.0027892505551458677}. Best is trial 583 with value: 0.8480221917497749.[0m
[32m[I 2022-04-21 19:39:28,875][0m Trial 689 finished with value: 0.8431815908565209 and parameters: {'loss': 'coxph', 'learning_rate': 0.0013152445593439198, 'n_estimators': 357, 'criterion': 'friedman_mse', 'min_samples_split': 3, 'min_samples_leaf': 1, 'min_weight_fraction_leaf': 0.152099176399756, 'min_impurity_decrease': 0.9068101662395971, 'max_features': 0.35729328125601056, 'subsample': 0.08808214709298878, 'dropout_rate': 0.05047567690082304, 'ccp_alpha': 0.2634226963395088}. Best is trial 583 with value: 0.8480221917497749.[0m
[32m[I 2022-04-21 19:39:57,267][0m Trial 690 finished with value: 0.65 and parameters: {'loss': 'coxph', 'learning_rate': 0.0003185113350781973, 'n_estimators': 313, 'criterion': 'friedman_mse', 'min_samples_split': 3, 'min_samples_leaf': 6, 'min_weight_fraction_leaf': 0.17360001074935494, 'min_impurity_decrease': 0.9568709272461862, 'max_features': 0.29355281334273464, 'subsample': 0.035052402216099524, 'dropout_rate': 0.10737203614679608, 'ccp_alpha': 0.17135103298621673}. Best is trial 583 with value: 0.8480221917497749.[0m
[32m[I 2022-04-21 19:40:26,490][0m Trial 691 finished with value: 0.7214096231899404 and parameters: {'loss': 'coxph', 'learning_rate': 0.0005428589985482217, 'n_estimators': 389, 'criterion': 'friedman_mse', 'min_samples_split': 3, 'min_samples_leaf': 1, 'min_weight_fraction_leaf': 0.46331790623002755, 'min_impurity_decrease': 0.24104351364975216, 'max_features': 0.381781871485839, 'subsample': 0.10245467671535635, 'dropout_rate': 0.16628839846147547, 'ccp_alpha': 0.34893853989371304}. Best is trial 583 with value: 0.8480221917497749.[0m
/media/san2_ssd/data/Workdir/survival/venv/lib/python3.8/site-packages/sksurv/ensemble/boosting.py:955: RuntimeWarning: divide by zero encountered in log
  time = numpy.log(time)
/media/san2_ssd/data/Workdir/survival/venv/lib/python3.8/site-packages/sksurv/ensemble/boosting.py:955: RuntimeWarning: divide by zero encountered in log
  time = numpy.log(time)
/media/san2_ssd/data/Workdir/survival/venv/lib/python3.8/site-packages/sksurv/ensemble/boosting.py:955: RuntimeWarning: divide by zero encountered in log
  time = numpy.log(time)
/media/san2_ssd/data/Workdir/survival/venv/lib/python3.8/site-packages/sksurv/ensemble/boosting.py:955: RuntimeWarning: divide by zero encountered in log
  time = numpy.log(time)
[32m[I 2022-04-21 19:40:35,633][0m Trial 692 finished with value: -0.4670319442700867 and parameters: {'loss': 'squared', 'learning_rate': 0.00024349999874744105, 'n_estimators': 328, 'criterion': 'friedman_mse', 'min_samples_split': 3, 'min_samples_leaf': 1, 'min_weight_fraction_leaf': 0.16208921284218675, 'min_impurity_decrease': 0.20262856289141945, 'max_features': 0.0581611463013208, 'subsample': 0.051176219748038945, 'dropout_rate': 0.1406346153225128, 'ccp_alpha': 0.09231912369701369}. Best is trial 583 with value: 0.8480221917497749.[0m
[32m[I 2022-04-21 19:41:11,841][0m Trial 693 finished with value: 0.8428569784394077 and parameters: {'loss': 'coxph', 'learning_rate': 3.015622000282593e-06, 'n_estimators': 338, 'criterion': 'friedman_mse', 'min_samples_split': 3, 'min_samples_leaf': 1, 'min_weight_fraction_leaf': 0.2490533362578667, 'min_impurity_decrease': 0.22554676329970402, 'max_features': 0.8848610115258279, 'subsample': 0.07399431127993511, 'dropout_rate': 0.09138145064329897, 'ccp_alpha': 0.25345503937018593}. Best is trial 583 with value: 0.8480221917497749.[0m
[32m[I 2022-04-21 19:41:30,045][0m Trial 694 finished with value: 0.8422689920194237 and parameters: {'loss': 'coxph', 'learning_rate': 0.00098616709913822, 'n_estimators': 299, 'criterion': 'friedman_mse', 'min_samples_split': 3, 'min_samples_leaf': 1, 'min_weight_fraction_leaf': 0.14987656738917643, 'min_impurity_decrease': 0.24725192931595347, 'max_features': 0.34478642335776205, 'subsample': 0.11078734343055956, 'dropout_rate': 0.11958023351646009, 'ccp_alpha': 0.07934010445749823}. Best is trial 583 with value: 0.8480221917497749.[0m
[32m[I 2022-04-21 19:42:07,966][0m Trial 695 finished with value: 0.65 and parameters: {'loss': 'coxph', 'learning_rate': 0.0007011302908744593, 'n_estimators': 350, 'criterion': 'friedman_mse', 'min_samples_split': 3, 'min_samples_leaf': 1, 'min_weight_fraction_leaf': 0.13834330863162705, 'min_impurity_decrease': 0.1332136960783178, 'max_features': 0.40477328888737873, 'subsample': 0.019928031698519682, 'dropout_rate': 0.1522848975377376, 'ccp_alpha': 0.16155643249215096}. Best is trial 583 with value: 0.8480221917497749.[0m
[32m[I 2022-04-21 19:42:32,815][0m Trial 696 finished with value: 0.8418741885645165 and parameters: {'loss': 'coxph', 'learning_rate': 0.0004114899563949925, 'n_estimators': 318, 'criterion': 'friedman_mse', 'min_samples_split': 3, 'min_samples_leaf': 1, 'min_weight_fraction_leaf': 0.16898517196699728, 'min_impurity_decrease': 0.07660164721637364, 'max_features': 0.3666975201830067, 'subsample': 0.05175189151339867, 'dropout_rate': 0.1285377490527688, 'ccp_alpha': 0.24549264186189532}. Best is trial 583 with value: 0.8480221917497749.[0m
[32m[I 2022-04-21 19:42:54,637][0m Trial 697 finished with value: 0.8478942042756417 and parameters: {'loss': 'coxph', 'learning_rate': 0.00022272882402309469, 'n_estimators': 296, 'criterion': 'friedman_mse', 'min_samples_split': 3, 'min_samples_leaf': 1, 'min_weight_fraction_leaf': 0.12871390709892386, 'min_impurity_decrease': 0.1669836596728246, 'max_features': 0.3219246694754049, 'subsample': 0.08804075713146498, 'dropout_rate': 0.10584439955558311, 'ccp_alpha': 0.0038872655959020074}. Best is trial 583 with value: 0.8480221917497749.[0m
[32m[I 2022-04-21 19:43:26,327][0m Trial 698 finished with value: 0.8450686024631866 and parameters: {'loss': 'coxph', 'learning_rate': 0.00022064199364469825, 'n_estimators': 367, 'criterion': 'friedman_mse', 'min_samples_split': 3, 'min_samples_leaf': 1, 'min_weight_fraction_leaf': 0.11446699512509918, 'min_impurity_decrease': 0.17530144360095057, 'max_features': 0.25588548192094646, 'subsample': 0.11265139414894082, 'dropout_rate': 0.06255599102041595, 'ccp_alpha': 0.005256188409541317}. Best is trial 583 with value: 0.8480221917497749.[0m
