[32m[I 2022-04-21 14:11:13,888][0m Trial 103 finished with value: 0.65 and parameters: {'loss': 'coxph', 'learning_rate': 0.015686386342498023, 'n_estimators': 692, 'criterion': 'friedman_mse', 'min_samples_split': 4, 'min_samples_leaf': 3, 'min_weight_fraction_leaf': 0.20532103663756154, 'min_impurity_decrease': 0.2956250465075863, 'max_features': 0.5097358379801376, 'subsample': 0.041199700935041085, 'dropout_rate': 0.1273006822552845, 'ccp_alpha': 0.2701478916437853}. Best is trial 87 with value: 0.8461097132289419.[0m
[32m[I 2022-04-21 14:14:35,891][0m Trial 104 finished with value: 0.8445956552210795 and parameters: {'loss': 'coxph', 'learning_rate': 3.890196856555057e-05, 'n_estimators': 822, 'criterion': 'friedman_mse', 'min_samples_split': 3, 'min_samples_leaf': 2, 'min_weight_fraction_leaf': 0.24015851035113178, 'min_impurity_decrease': 0.2606904907205593, 'max_features': 0.4617355885078604, 'subsample': 0.12769883517598832, 'dropout_rate': 0.19631203543316877, 'ccp_alpha': 0.11552008182046437}. Best is trial 87 with value: 0.8461097132289419.[0m
[32m[I 2022-04-21 14:16:51,305][0m Trial 105 finished with value: 0.7353097200968132 and parameters: {'loss': 'coxph', 'learning_rate': 3.5929621675495406e-05, 'n_estimators': 647, 'criterion': 'friedman_mse', 'min_samples_split': 3, 'min_samples_leaf': 2, 'min_weight_fraction_leaf': 0.2440987595958907, 'min_impurity_decrease': 0.2788366750587491, 'max_features': 0.4649869458500301, 'subsample': 0.16837389140381437, 'dropout_rate': 0.05914412289500601, 'ccp_alpha': 0.3868135890776773}. Best is trial 87 with value: 0.8461097132289419.[0m
[32m[I 2022-04-21 14:19:27,769][0m Trial 106 finished with value: 0.8450262367658674 and parameters: {'loss': 'coxph', 'learning_rate': 6.144273935242276e-06, 'n_estimators': 724, 'criterion': 'squared_error', 'min_samples_split': 3, 'min_samples_leaf': 2, 'min_weight_fraction_leaf': 0.2564527351087669, 'min_impurity_decrease': 0.3264099322165943, 'max_features': 0.49000755274767394, 'subsample': 0.06763856943881649, 'dropout_rate': 0.1468217253245008, 'ccp_alpha': 0.0962182400706591}. Best is trial 87 with value: 0.8461097132289419.[0m
[32m[I 2022-04-21 14:20:56,443][0m Trial 107 finished with value: 0.8425481305063434 and parameters: {'loss': 'coxph', 'learning_rate': 0.0003375237125219921, 'n_estimators': 550, 'criterion': 'squared_error', 'min_samples_split': 3, 'min_samples_leaf': 2, 'min_weight_fraction_leaf': 0.25619151363187564, 'min_impurity_decrease': 0.3190047049219093, 'max_features': 0.5441983329259495, 'subsample': 0.0663228826828378, 'dropout_rate': 0.1974417704946786, 'ccp_alpha': 0.26863348879002646}. Best is trial 87 with value: 0.8461097132289419.[0m
[32m[I 2022-04-21 14:23:39,812][0m Trial 108 finished with value: 0.7176032553630136 and parameters: {'loss': 'coxph', 'learning_rate': 7.874865549887295e-05, 'n_estimators': 699, 'criterion': 'squared_error', 'min_samples_split': 3, 'min_samples_leaf': 2, 'min_weight_fraction_leaf': 0.27820937533315937, 'min_impurity_decrease': 0.2740511201131089, 'max_features': 0.5890309230101136, 'subsample': 0.11258182245458691, 'dropout_rate': 0.12530835493398831, 'ccp_alpha': 0.6984586204286507}. Best is trial 87 with value: 0.8461097132289419.[0m
[32m[I 2022-04-21 14:26:48,231][0m Trial 109 finished with value: 0.84148051637734 and parameters: {'loss': 'coxph', 'learning_rate': 7.71126482002468e-06, 'n_estimators': 732, 'criterion': 'squared_error', 'min_samples_split': 3, 'min_samples_leaf': 1, 'min_weight_fraction_leaf': 0.23253462026093996, 'min_impurity_decrease': 0.3512839051563905, 'max_features': 0.6149665986096632, 'subsample': 0.089327704260623, 'dropout_rate': 0.11002070260443372, 'ccp_alpha': 0.07524132788865777}. Best is trial 87 with value: 0.8461097132289419.[0m
[32m[I 2022-04-21 14:28:40,518][0m Trial 110 finished with value: 0.839589055453683 and parameters: {'loss': 'coxph', 'learning_rate': 0.0005134106600285087, 'n_estimators': 590, 'criterion': 'squared_error', 'min_samples_split': 2, 'min_samples_leaf': 2, 'min_weight_fraction_leaf': 0.2721471161341706, 'min_impurity_decrease': 0.2278895216349881, 'max_features': 0.49587033291982646, 'subsample': 0.05913467473799411, 'dropout_rate': 0.08173703127413043, 'ccp_alpha': 0.46605759696073434}. Best is trial 87 with value: 0.8461097132289419.[0m
[32m[I 2022-04-21 14:31:40,579][0m Trial 111 finished with value: 0.65 and parameters: {'loss': 'coxph', 'learning_rate': 3.5848445281518333e-06, 'n_estimators': 769, 'criterion': 'friedman_mse', 'min_samples_split': 3, 'min_samples_leaf': 2, 'min_weight_fraction_leaf': 0.22127974669880238, 'min_impurity_decrease': 0.34023259782943005, 'max_features': 0.48111007457780125, 'subsample': 0.015606856942497374, 'dropout_rate': 0.16464311855461758, 'ccp_alpha': 0.003661764634035808}. Best is trial 87 with value: 0.8461097132289419.[0m
[32m[I 2022-04-21 14:35:10,280][0m Trial 112 finished with value: 0.8441542656997385 and parameters: {'loss': 'coxph', 'learning_rate': 1.2749768181439316e-05, 'n_estimators': 834, 'criterion': 'friedman_mse', 'min_samples_split': 4, 'min_samples_leaf': 1, 'min_weight_fraction_leaf': 0.2533392464517755, 'min_impurity_decrease': 0.387402086011559, 'max_features': 0.5194104475377526, 'subsample': 0.126900205665248, 'dropout_rate': 0.23456435592166605, 'ccp_alpha': 0.1397941051023076}. Best is trial 87 with value: 0.8461097132289419.[0m
[32m[I 2022-04-21 14:39:02,736][0m Trial 113 finished with value: 0.842041677060109 and parameters: {'loss': 'coxph', 'learning_rate': 1.2642504560505957e-05, 'n_estimators': 847, 'criterion': 'squared_error', 'min_samples_split': 4, 'min_samples_leaf': 1, 'min_weight_fraction_leaf': 0.24390191086241197, 'min_impurity_decrease': 0.39381937394564015, 'max_features': 0.8785713748671694, 'subsample': 0.08196684517525613, 'dropout_rate': 0.2352138030389729, 'ccp_alpha': 0.2754315305938614}. Best is trial 87 with value: 0.8461097132289419.[0m
[32m[I 2022-04-21 14:42:43,233][0m Trial 114 finished with value: 0.8447878940900428 and parameters: {'loss': 'coxph', 'learning_rate': 3.839449694376995e-05, 'n_estimators': 881, 'criterion': 'friedman_mse', 'min_samples_split': 4, 'min_samples_leaf': 1, 'min_weight_fraction_leaf': 0.25860659827476873, 'min_impurity_decrease': 0.3678849406627895, 'max_features': 0.5128042124800404, 'subsample': 0.1177669781180089, 'dropout_rate': 0.18894766186737158, 'ccp_alpha': 0.11083810733745803}. Best is trial 87 with value: 0.8461097132289419.[0m
[32m[I 2022-04-21 14:46:44,638][0m Trial 115 finished with value: 0.8428521365266789 and parameters: {'loss': 'coxph', 'learning_rate': 3.765365747031726e-05, 'n_estimators': 890, 'criterion': 'friedman_mse', 'min_samples_split': 4, 'min_samples_leaf': 1, 'min_weight_fraction_leaf': 0.28732683773477874, 'min_impurity_decrease': 0.36815623923858587, 'max_features': 0.40783982548812436, 'subsample': 0.10473434966043511, 'dropout_rate': 0.15830634031066163, 'ccp_alpha': 0.35023460892890557}. Best is trial 87 with value: 0.8461097132289419.[0m
/media/san2_ssd/data/Workdir/survival/venv/lib/python3.8/site-packages/sksurv/ensemble/boosting.py:955: RuntimeWarning: divide by zero encountered in log
  time = numpy.log(time)
/media/san2_ssd/data/Workdir/survival/venv/lib/python3.8/site-packages/sksurv/ensemble/boosting.py:955: RuntimeWarning: divide by zero encountered in log
  time = numpy.log(time)
/media/san2_ssd/data/Workdir/survival/venv/lib/python3.8/site-packages/sksurv/ensemble/boosting.py:955: RuntimeWarning: divide by zero encountered in log
  time = numpy.log(time)
/media/san2_ssd/data/Workdir/survival/venv/lib/python3.8/site-packages/sksurv/ensemble/boosting.py:955: RuntimeWarning: divide by zero encountered in log
  time = numpy.log(time)
[32m[I 2022-04-21 14:47:39,427][0m Trial 116 finished with value: -0.46613378432860025 and parameters: {'loss': 'squared', 'learning_rate': 6.130042878302612e-05, 'n_estimators': 1000, 'criterion': 'friedman_mse', 'min_samples_split': 3, 'min_samples_leaf': 1, 'min_weight_fraction_leaf': 0.2617950082894534, 'min_impurity_decrease': 0.31939445937784955, 'max_features': 0.5294597613524546, 'subsample': 0.16378017278372362, 'dropout_rate': 0.19307435756343064, 'ccp_alpha': 0.19715522465423518}. Best is trial 87 with value: 0.8461097132289419.[0m
[32m[I 2022-04-21 14:51:01,950][0m Trial 117 finished with value: 0.8438549462588736 and parameters: {'loss': 'coxph', 'learning_rate': 1.548670748282658e-05, 'n_estimators': 872, 'criterion': 'friedman_mse', 'min_samples_split': 4, 'min_samples_leaf': 1, 'min_weight_fraction_leaf': 0.248608055205782, 'min_impurity_decrease': 0.414396831879302, 'max_features': 0.4687139873907088, 'subsample': 0.035123655217894664, 'dropout_rate': 0.14076392764490198, 'ccp_alpha': 0.5190864502034237}. Best is trial 87 with value: 0.8461097132289419.[0m
[32m[I 2022-04-21 14:51:09,377][0m Trial 118 finished with value: 0.7342953809553551 and parameters: {'loss': 'coxph', 'learning_rate': 4.459900384836207e-05, 'n_estimators': 206, 'criterion': 'friedman_mse', 'min_samples_split': 4, 'min_samples_leaf': 1, 'min_weight_fraction_leaf': 0.2983235978872071, 'min_impurity_decrease': 0.37332674044598846, 'max_features': 0.5539726106418175, 'subsample': 0.35387951678682206, 'dropout_rate': 0.750072737219736, 'ccp_alpha': 0.11620175973801485}. Best is trial 87 with value: 0.8461097132289419.[0m
[32m[I 2022-04-21 14:54:22,885][0m Trial 119 finished with value: 0.65 and parameters: {'loss': 'coxph', 'learning_rate': 0.00010806028452701835, 'n_estimators': 819, 'criterion': 'friedman_mse', 'min_samples_split': 2, 'min_samples_leaf': 1, 'min_weight_fraction_leaf': 0.479935096301518, 'min_impurity_decrease': 0.269701497770167, 'max_features': 0.37212052661340456, 'subsample': 0.058939948188131364, 'dropout_rate': 0.17205650545963172, 'ccp_alpha': 3.996269324472625}. Best is trial 87 with value: 0.8461097132289419.[0m
[32m[I 2022-04-21 14:56:41,700][0m Trial 120 finished with value: 0.8432107636689714 and parameters: {'loss': 'coxph', 'learning_rate': 1.8684685551839783e-05, 'n_estimators': 909, 'criterion': 'friedman_mse', 'min_samples_split': 4, 'min_samples_leaf': 1, 'min_weight_fraction_leaf': 0.2530384351904414, 'min_impurity_decrease': 0.17234959787422127, 'max_features': 0.4148122744370818, 'subsample': 0.11893804232042944, 'dropout_rate': 0.6022159037629278, 'ccp_alpha': 0.2370899811730684}. Best is trial 87 with value: 0.8461097132289419.[0m
[32m[I 2022-04-21 14:59:30,117][0m Trial 121 finished with value: 0.8439421692335134 and parameters: {'loss': 'coxph', 'learning_rate': 3.166930016291198e-05, 'n_estimators': 780, 'criterion': 'friedman_mse', 'min_samples_split': 3, 'min_samples_leaf': 2, 'min_weight_fraction_leaf': 0.23571062220550554, 'min_impurity_decrease': 0.32816136341328617, 'max_features': 0.5098699553736473, 'subsample': 0.1831855980366524, 'dropout_rate': 0.2550992659438922, 'ccp_alpha': 0.08348856919130757}. Best is trial 87 with value: 0.8461097132289419.[0m
[32m[I 2022-04-21 15:00:30,625][0m Trial 122 finished with value: 0.7399562296166383 and parameters: {'loss': 'coxph', 'learning_rate': 2.3856761925829737e-06, 'n_estimators': 429, 'criterion': 'friedman_mse', 'min_samples_split': 5, 'min_samples_leaf': 2, 'min_weight_fraction_leaf': 0.2719674958645683, 'min_impurity_decrease': 0.24848008245956, 'max_features': 0.49783514471314955, 'subsample': 0.09905744127254922, 'dropout_rate': 0.2263417962829023, 'ccp_alpha': 0.39243331492689915}. Best is trial 87 with value: 0.8461097132289419.[0m
[32m[I 2022-04-21 15:02:47,706][0m Trial 123 finished with value: 0.8444100304096531 and parameters: {'loss': 'coxph', 'learning_rate': 6.571670080821955e-05, 'n_estimators': 748, 'criterion': 'friedman_mse', 'min_samples_split': 4, 'min_samples_leaf': 1, 'min_weight_fraction_leaf': 0.09425462278657906, 'min_impurity_decrease': 0.21694216178127312, 'max_features': 0.4469154839452691, 'subsample': 0.1523810721241204, 'dropout_rate': 0.3290337679341194, 'ccp_alpha': 0.10663391705316826}. Best is trial 87 with value: 0.8461097132289419.[0m
[32m[I 2022-04-21 15:05:01,756][0m Trial 124 finished with value: 0.8417505447941886 and parameters: {'loss': 'coxph', 'learning_rate': 4.675352965777626e-05, 'n_estimators': 731, 'criterion': 'friedman_mse', 'min_samples_split': 4, 'min_samples_leaf': 1, 'min_weight_fraction_leaf': 0.09234429578857155, 'min_impurity_decrease': 0.2103675111488212, 'max_features': 0.4644699302512108, 'subsample': 0.226422973954356, 'dropout_rate': 0.3334008832351641, 'ccp_alpha': 0.2269351120683147}. Best is trial 87 with value: 0.8461097132289419.[0m
[32m[I 2022-04-21 15:06:57,844][0m Trial 125 finished with value: 0.8397910884787965 and parameters: {'loss': 'coxph', 'learning_rate': 0.00011850579272787816, 'n_estimators': 679, 'criterion': 'friedman_mse', 'min_samples_split': 4, 'min_samples_leaf': 1, 'min_weight_fraction_leaf': 0.32516427940490866, 'min_impurity_decrease': 0.4180742264057016, 'max_features': 0.43136043260696816, 'subsample': 0.1545930545000428, 'dropout_rate': 0.3088835214462361, 'ccp_alpha': 0.15829964234261068}. Best is trial 87 with value: 0.8461097132289419.[0m
[32m[I 2022-04-21 15:11:02,088][0m Trial 126 finished with value: 0.839898877957945 and parameters: {'loss': 'coxph', 'learning_rate': 6.889577161469404e-05, 'n_estimators': 968, 'criterion': 'squared_error', 'min_samples_split': 4, 'min_samples_leaf': 1, 'min_weight_fraction_leaf': 0.07675695239384402, 'min_impurity_decrease': 0.2971615581217966, 'max_features': 0.44953049231886144, 'subsample': 0.0783198910755167, 'dropout_rate': 0.2104301074769298, 'ccp_alpha': 0.330077233871406}. Best is trial 87 with value: 0.8461097132289419.[0m
[32m[I 2022-04-21 15:14:35,521][0m Trial 127 finished with value: 0.7218005743590818 and parameters: {'loss': 'coxph', 'learning_rate': 1.9138268972328617e-05, 'n_estimators': 855, 'criterion': 'friedman_mse', 'min_samples_split': 3, 'min_samples_leaf': 2, 'min_weight_fraction_leaf': 0.22750755556671023, 'min_impurity_decrease': 0.22810402945296776, 'max_features': 0.4772667540633431, 'subsample': 0.11769537200376605, 'dropout_rate': 0.1891040853954275, 'ccp_alpha': 0.6134610903513372}. Best is trial 87 with value: 0.8461097132289419.[0m
[32m[I 2022-04-21 15:16:24,227][0m Trial 128 finished with value: 0.8434978554032246 and parameters: {'loss': 'coxph', 'learning_rate': 8.756978594334574e-05, 'n_estimators': 633, 'criterion': 'friedman_mse', 'min_samples_split': 4, 'min_samples_leaf': 1, 'min_weight_fraction_leaf': 0.11862214216850224, 'min_impurity_decrease': 0.392318185402385, 'max_features': 0.36383361027482175, 'subsample': 0.20380540483178552, 'dropout_rate': 0.1412269570215082, 'ccp_alpha': 0.023019447582952116}. Best is trial 87 with value: 0.8461097132289419.[0m
[32m[I 2022-04-21 15:19:24,926][0m Trial 129 finished with value: 0.8445126123480614 and parameters: {'loss': 'coxph', 'learning_rate': 2.8607710355619425e-05, 'n_estimators': 758, 'criterion': 'friedman_mse', 'min_samples_split': 3, 'min_samples_leaf': 1, 'min_weight_fraction_leaf': 0.20734753009749757, 'min_impurity_decrease': 0.30556158164471536, 'max_features': 0.3947516203505261, 'subsample': 0.028163342408075803, 'dropout_rate': 0.09590810501011647, 'ccp_alpha': 0.4529591228783426}. Best is trial 87 with value: 0.8461097132289419.[0m
[32m[I 2022-04-21 15:21:54,126][0m Trial 130 finished with value: 0.65 and parameters: {'loss': 'coxph', 'learning_rate': 2.7312024812099304e-05, 'n_estimators': 708, 'criterion': 'friedman_mse', 'min_samples_split': 3, 'min_samples_leaf': 1, 'min_weight_fraction_leaf': 0.21343842305793595, 'min_impurity_decrease': 0.2555237605164974, 'max_features': 0.3946202761471153, 'subsample': 0.01615745331218363, 'dropout_rate': 0.1127558628266908, 'ccp_alpha': 0.4283396242488996}. Best is trial 87 with value: 0.8461097132289419.[0m
[32m[I 2022-04-21 15:25:15,718][0m Trial 131 finished with value: 0.8445298638310168 and parameters: {'loss': 'coxph', 'learning_rate': 5.3198026841306956e-05, 'n_estimators': 753, 'criterion': 'friedman_mse', 'min_samples_split': 3, 'min_samples_leaf': 1, 'min_weight_fraction_leaf': 0.19606210459493875, 'min_impurity_decrease': 0.30594084004175903, 'max_features': 0.44731313088774566, 'subsample': 0.06687514411455339, 'dropout_rate': 0.08763478091092688, 'ccp_alpha': 0.19308003616876004}. Best is trial 87 with value: 0.8461097132289419.[0m
[32m[I 2022-04-21 15:28:31,081][0m Trial 132 finished with value: 0.8451117070657054 and parameters: {'loss': 'coxph', 'learning_rate': 3.979099548660861e-05, 'n_estimators': 756, 'criterion': 'friedman_mse', 'min_samples_split': 3, 'min_samples_leaf': 1, 'min_weight_fraction_leaf': 0.20345395929967086, 'min_impurity_decrease': 0.3113827998240489, 'max_features': 0.4266015404977505, 'subsample': 0.05120107983401889, 'dropout_rate': 0.0019372395668565134, 'ccp_alpha': 0.0021089685706594252}. Best is trial 87 with value: 0.8461097132289419.[0m
[32m[I 2022-04-21 15:31:26,707][0m Trial 133 finished with value: 0.65 and parameters: {'loss': 'coxph', 'learning_rate': 5.992677254687416e-05, 'n_estimators': 760, 'criterion': 'friedman_mse', 'min_samples_split': 3, 'min_samples_leaf': 1, 'min_weight_fraction_leaf': 0.19471798920556327, 'min_impurity_decrease': 0.31609734595007816, 'max_features': 0.42407949400653727, 'subsample': 0.041815254674177293, 'dropout_rate': 0.01552817874563549, 'ccp_alpha': 4.988794938709894}. Best is trial 87 with value: 0.8461097132289419.[0m
[32m[I 2022-04-21 15:34:07,056][0m Trial 134 finished with value: 0.8457590346952392 and parameters: {'loss': 'coxph', 'learning_rate': 0.00019834235151405263, 'n_estimators': 666, 'criterion': 'friedman_mse', 'min_samples_split': 2, 'min_samples_leaf': 1, 'min_weight_fraction_leaf': 0.20809591132853378, 'min_impurity_decrease': 0.34369633067635175, 'max_features': 0.3327715248563424, 'subsample': 0.025362111881854228, 'dropout_rate': 0.06238289553858253, 'ccp_alpha': 0.27099502284001403}. Best is trial 87 with value: 0.8461097132289419.[0m
[32m[I 2022-04-21 15:36:21,978][0m Trial 135 finished with value: 0.8421416785705722 and parameters: {'loss': 'coxph', 'learning_rate': 3.880720229265987e-05, 'n_estimators': 655, 'criterion': 'friedman_mse', 'min_samples_split': 2, 'min_samples_leaf': 1, 'min_weight_fraction_leaf': 0.21243015013239155, 'min_impurity_decrease': 0.3479079805445877, 'max_features': 0.32998510096122113, 'subsample': 0.02774455989475015, 'dropout_rate': 0.06305189970772801, 'ccp_alpha': 0.3028323113296286}. Best is trial 87 with value: 0.8461097132289419.[0m
[32m[I 2022-04-21 15:38:18,480][0m Trial 136 finished with value: 0.65 and parameters: {'loss': 'coxph', 'learning_rate': 0.00019205712325081727, 'n_estimators': 599, 'criterion': 'friedman_mse', 'min_samples_split': 2, 'min_samples_leaf': 1, 'min_weight_fraction_leaf': 0.2230078432961595, 'min_impurity_decrease': 0.30578581431736, 'max_features': 0.3435043945997328, 'subsample': 0.004209837882525769, 'dropout_rate': 0.03374786672423246, 'ccp_alpha': 0.07997202058958836}. Best is trial 87 with value: 0.8461097132289419.[0m
[32m[I 2022-04-21 15:40:38,494][0m Trial 137 finished with value: 0.844460760465642 and parameters: {'loss': 'coxph', 'learning_rate': 3.179509105818781e-05, 'n_estimators': 684, 'criterion': 'friedman_mse', 'min_samples_split': 2, 'min_samples_leaf': 1, 'min_weight_fraction_leaf': 0.19296976183649603, 'min_impurity_decrease': 0.26919581675983867, 'max_features': 0.30695240057726425, 'subsample': 0.05599686394643716, 'dropout_rate': 0.08888229528235389, 'ccp_alpha': 0.005745847678326546}. Best is trial 87 with value: 0.8461097132289419.[0m
/media/san2_ssd/data/Workdir/survival/venv/lib/python3.8/site-packages/sksurv/ensemble/boosting.py:955: RuntimeWarning: divide by zero encountered in log
  time = numpy.log(time)
/media/san2_ssd/data/Workdir/survival/venv/lib/python3.8/site-packages/sksurv/ensemble/boosting.py:955: RuntimeWarning: divide by zero encountered in log
  time = numpy.log(time)
/media/san2_ssd/data/Workdir/survival/venv/lib/python3.8/site-packages/sksurv/ensemble/boosting.py:955: RuntimeWarning: divide by zero encountered in log
  time = numpy.log(time)
/media/san2_ssd/data/Workdir/survival/venv/lib/python3.8/site-packages/sksurv/ensemble/boosting.py:955: RuntimeWarning: divide by zero encountered in log
  time = numpy.log(time)
[32m[I 2022-04-21 15:41:09,020][0m Trial 138 finished with value: -0.45 and parameters: {'loss': 'squared', 'learning_rate': 2.9445074168308363e-05, 'n_estimators': 684, 'criterion': 'friedman_mse', 'min_samples_split': 2, 'min_samples_leaf': 1, 'min_weight_fraction_leaf': 0.2029226959988145, 'min_impurity_decrease': 0.25686326053918357, 'max_features': 0.27647555572477767, 'subsample': 0.05024159891856724, 'dropout_rate': 0.005551733639202227, 'ccp_alpha': 4.498141639885277}. Best is trial 87 with value: 0.8461097132289419.[0m
[32m[I 2022-04-21 15:43:51,593][0m Trial 139 finished with value: 0.8444377143898235 and parameters: {'loss': 'coxph', 'learning_rate': 0.0018570641503413213, 'n_estimators': 724, 'criterion': 'friedman_mse', 'min_samples_split': 2, 'min_samples_leaf': 1, 'min_weight_fraction_leaf': 0.18084585057643648, 'min_impurity_decrease': 0.2844227846770233, 'max_features': 0.3202114321711412, 'subsample': 0.0916628214436564, 'dropout_rate': 0.08862769151447769, 'ccp_alpha': 0.010466022235240126}. Best is trial 87 with value: 0.8461097132289419.[0m
