[32m[I 2022-04-23 04:04:31,942][0m Trial 706 finished with value: 0.653722557474584 and parameters: {'loss': 'coxph', 'learning_rate': 0.06514363617195916, 'n_estimators': 572, 'criterion': 'friedman_mse', 'min_samples_split': 8, 'min_samples_leaf': 4, 'min_weight_fraction_leaf': 0.017988547398637422, 'min_impurity_decrease': 0.5067740720702353, 'max_features': 0.5486352507198091, 'subsample': 0.2595511839171478, 'dropout_rate': 0.16394429619913525, 'ccp_alpha': 0.10206867755185074}. Best is trial 690 with value: 0.6691837560454439.[0m
[32m[I 2022-04-23 04:04:37,759][0m Trial 707 finished with value: 0.6558399069745063 and parameters: {'loss': 'coxph', 'learning_rate': 0.08000621605815919, 'n_estimators': 130, 'criterion': 'friedman_mse', 'min_samples_split': 9, 'min_samples_leaf': 4, 'min_weight_fraction_leaf': 0.00999484060525186, 'min_impurity_decrease': 0.570318266232121, 'max_features': 0.6480652733959812, 'subsample': 0.3182614253239207, 'dropout_rate': 0.17806762698241865, 'ccp_alpha': 0.0013806964102617146}. Best is trial 690 with value: 0.6691837560454439.[0m
[32m[I 2022-04-23 04:06:49,729][0m Trial 708 finished with value: 0.6538201612056752 and parameters: {'loss': 'coxph', 'learning_rate': 0.055845409681276714, 'n_estimators': 711, 'criterion': 'friedman_mse', 'min_samples_split': 9, 'min_samples_leaf': 4, 'min_weight_fraction_leaf': 0.026747656969311133, 'min_impurity_decrease': 0.48929479311503, 'max_features': 0.6140613951478437, 'subsample': 0.19445383211010733, 'dropout_rate': 0.2004889005403813, 'ccp_alpha': 0.0033358441135635207}. Best is trial 690 with value: 0.6691837560454439.[0m
/media/san2_ssd/data/Workdir/survival/venv/lib/python3.8/site-packages/sksurv/ensemble/boosting.py:955: RuntimeWarning: divide by zero encountered in log
  time = numpy.log(time)
/media/san2_ssd/data/Workdir/survival/venv/lib/python3.8/site-packages/sksurv/ensemble/boosting.py:955: RuntimeWarning: divide by zero encountered in log
  time = numpy.log(time)
/media/san2_ssd/data/Workdir/survival/venv/lib/python3.8/site-packages/sksurv/ensemble/boosting.py:955: RuntimeWarning: divide by zero encountered in log
  time = numpy.log(time)
/media/san2_ssd/data/Workdir/survival/venv/lib/python3.8/site-packages/sksurv/ensemble/boosting.py:955: RuntimeWarning: divide by zero encountered in log
  time = numpy.log(time)
[32m[I 2022-04-23 04:07:11,285][0m Trial 709 finished with value: -0.7366375512808299 and parameters: {'loss': 'squared', 'learning_rate': 0.08089194221934838, 'n_estimators': 645, 'criterion': 'friedman_mse', 'min_samples_split': 9, 'min_samples_leaf': 4, 'min_weight_fraction_leaf': 0.0012369410972355183, 'min_impurity_decrease': 0.5150801707885343, 'max_features': 0.5831395355391317, 'subsample': 0.280695208286238, 'dropout_rate': 0.12119814871868011, 'ccp_alpha': 0.17909591332972286}. Best is trial 690 with value: 0.6691837560454439.[0m
[32m[I 2022-04-23 04:08:43,052][0m Trial 710 finished with value: 0.5 and parameters: {'loss': 'coxph', 'learning_rate': 0.09863977502466785, 'n_estimators': 608, 'criterion': 'friedman_mse', 'min_samples_split': 9, 'min_samples_leaf': 4, 'min_weight_fraction_leaf': 0.018807398614352926, 'min_impurity_decrease': 0.4714575145180755, 'max_features': 0.6620821767272861, 'subsample': 0.23428689271351796, 'dropout_rate': 0.15377642391593427, 'ccp_alpha': 3.6737886616786772}. Best is trial 690 with value: 0.6691837560454439.[0m
[32m[I 2022-04-23 04:10:01,798][0m Trial 711 finished with value: 0.5126008909630098 and parameters: {'loss': 'coxph', 'learning_rate': 0.06393094589208502, 'n_estimators': 573, 'criterion': 'friedman_mse', 'min_samples_split': 9, 'min_samples_leaf': 4, 'min_weight_fraction_leaf': 0.025586749765735536, 'min_impurity_decrease': 0.15060806553268974, 'max_features': 0.0690018971503687, 'subsample': 0.2564413914765142, 'dropout_rate': 0.16901301490214607, 'ccp_alpha': 0.3140772590389501}. Best is trial 690 with value: 0.6691837560454439.[0m
[32m[I 2022-04-23 04:11:46,326][0m Trial 712 finished with value: 0.5 and parameters: {'loss': 'coxph', 'learning_rate': 0.05555055292812283, 'n_estimators': 669, 'criterion': 'friedman_mse', 'min_samples_split': 9, 'min_samples_leaf': 5, 'min_weight_fraction_leaf': 0.04127430982118742, 'min_impurity_decrease': 0.3403993836447241, 'max_features': 0.6271921984385015, 'subsample': 0.2189052327215219, 'dropout_rate': 0.1903127904781479, 'ccp_alpha': 4.92113686267167}. Best is trial 690 with value: 0.6691837560454439.[0m
[32m[I 2022-04-23 04:14:14,386][0m Trial 713 finished with value: 0.6476813665616045 and parameters: {'loss': 'coxph', 'learning_rate': 1.4594532812492437e-06, 'n_estimators': 760, 'criterion': 'friedman_mse', 'min_samples_split': 9, 'min_samples_leaf': 4, 'min_weight_fraction_leaf': 0.011253036366323303, 'min_impurity_decrease': 0.5445867957902848, 'max_features': 0.5580082159382669, 'subsample': 0.3060088043506525, 'dropout_rate': 0.1430733387841459, 'ccp_alpha': 0.10214162142863413}. Best is trial 690 with value: 0.6691837560454439.[0m
[32m[I 2022-04-23 04:16:00,110][0m Trial 714 finished with value: 0.6637122023465557 and parameters: {'loss': 'coxph', 'learning_rate': 0.07077611655120639, 'n_estimators': 638, 'criterion': 'friedman_mse', 'min_samples_split': 9, 'min_samples_leaf': 4, 'min_weight_fraction_leaf': 0.03487422211005388, 'min_impurity_decrease': 0.4707124348074854, 'max_features': 0.25621785168725564, 'subsample': 0.2836339002167683, 'dropout_rate': 0.20677125528446708, 'ccp_alpha': 0.002929700398623729}. Best is trial 690 with value: 0.6691837560454439.[0m
[32m[I 2022-04-23 04:17:31,756][0m Trial 715 finished with value: 0.5621746600763725 and parameters: {'loss': 'coxph', 'learning_rate': 0.04718269673507145, 'n_estimators': 622, 'criterion': 'friedman_mse', 'min_samples_split': 9, 'min_samples_leaf': 4, 'min_weight_fraction_leaf': 0.03549691431337563, 'min_impurity_decrease': 0.4589744994928323, 'max_features': 0.2518466356710833, 'subsample': 0.28022794666800377, 'dropout_rate': 0.21515299345907035, 'ccp_alpha': 0.2355867325652931}. Best is trial 690 with value: 0.6691837560454439.[0m
[32m[I 2022-04-23 04:19:18,796][0m Trial 716 finished with value: 0.6230190357310162 and parameters: {'loss': 'coxph', 'learning_rate': 0.04692998749461377, 'n_estimators': 677, 'criterion': 'friedman_mse', 'min_samples_split': 9, 'min_samples_leaf': 4, 'min_weight_fraction_leaf': 0.22844819043906286, 'min_impurity_decrease': 0.47765306427763476, 'max_features': 0.11495847683748178, 'subsample': 0.25970166491973457, 'dropout_rate': 0.2081203782540728, 'ccp_alpha': 0.09283723012527755}. Best is trial 690 with value: 0.6691837560454439.[0m
[32m[I 2022-04-23 04:21:16,372][0m Trial 717 finished with value: 0.5769353443083842 and parameters: {'loss': 'coxph', 'learning_rate': 0.06648573435687838, 'n_estimators': 705, 'criterion': 'friedman_mse', 'min_samples_split': 8, 'min_samples_leaf': 4, 'min_weight_fraction_leaf': 0.042022615021170204, 'min_impurity_decrease': 0.4671291176471953, 'max_features': 0.13296663313850843, 'subsample': 0.2934531965311178, 'dropout_rate': 0.18640646784040088, 'ccp_alpha': 0.16738276693382265}. Best is trial 690 with value: 0.6691837560454439.[0m
[32m[I 2022-04-23 04:22:57,630][0m Trial 718 finished with value: 0.6490271675649215 and parameters: {'loss': 'coxph', 'learning_rate': 0.05241527128025958, 'n_estimators': 646, 'criterion': 'friedman_mse', 'min_samples_split': 9, 'min_samples_leaf': 5, 'min_weight_fraction_leaf': 0.02205070675090523, 'min_impurity_decrease': 0.49387543302343534, 'max_features': 0.21869234810868043, 'subsample': 0.24180752782824666, 'dropout_rate': 0.21156760677161646, 'ccp_alpha': 0.10276475317460854}. Best is trial 690 with value: 0.6691837560454439.[0m
[32m[I 2022-04-23 04:24:35,727][0m Trial 719 finished with value: 0.5 and parameters: {'loss': 'coxph', 'learning_rate': 0.06430652502009479, 'n_estimators': 639, 'criterion': 'absolute_error', 'min_samples_split': 9, 'min_samples_leaf': 4, 'min_weight_fraction_leaf': 0.011700777798412292, 'min_impurity_decrease': 0.47352858812122384, 'max_features': 0.10246275765432507, 'subsample': 0.2724914585883516, 'dropout_rate': 0.19405122187759777, 'ccp_alpha': 0.0012078533126143342}. Best is trial 690 with value: 0.6691837560454439.[0m
[32m[I 2022-04-23 04:25:06,024][0m Trial 720 finished with value: 0.5 and parameters: {'loss': 'coxph', 'learning_rate': 0.04400379062312848, 'n_estimators': 607, 'criterion': 'friedman_mse', 'min_samples_split': 9, 'min_samples_leaf': 4, 'min_weight_fraction_leaf': 0.2543134189671037, 'min_impurity_decrease': 0.4524764802551727, 'max_features': 0.29104181076316105, 'subsample': 0.3001981054451361, 'dropout_rate': 0.7968321041706746, 'ccp_alpha': 0.2461614636699183}. Best is trial 690 with value: 0.6691837560454439.[0m
[32m[I 2022-04-23 04:26:33,431][0m Trial 721 finished with value: 0.6549784935403696 and parameters: {'loss': 'coxph', 'learning_rate': 0.07270986838589012, 'n_estimators': 594, 'criterion': 'friedman_mse', 'min_samples_split': 9, 'min_samples_leaf': 4, 'min_weight_fraction_leaf': 0.04003298165209981, 'min_impurity_decrease': 0.5207707488823275, 'max_features': 0.044406979403377345, 'subsample': 0.24808547487954166, 'dropout_rate': 0.2064094574307655, 'ccp_alpha': 0.002386633982348278}. Best is trial 690 with value: 0.6691837560454439.[0m
[32m[I 2022-04-23 04:28:23,138][0m Trial 722 finished with value: 0.5773462933049445 and parameters: {'loss': 'coxph', 'learning_rate': 0.05813473894516053, 'n_estimators': 673, 'criterion': 'friedman_mse', 'min_samples_split': 9, 'min_samples_leaf': 4, 'min_weight_fraction_leaf': 0.023200227232274842, 'min_impurity_decrease': 0.5964718664403775, 'max_features': 0.226151436147793, 'subsample': 0.32220689957929577, 'dropout_rate': 0.1860807050673404, 'ccp_alpha': 0.1627917368200895}. Best is trial 690 with value: 0.6691837560454439.[0m
[32m[I 2022-04-23 04:30:07,801][0m Trial 723 finished with value: 0.5 and parameters: {'loss': 'coxph', 'learning_rate': 0.08092715111871145, 'n_estimators': 628, 'criterion': 'friedman_mse', 'min_samples_split': 9, 'min_samples_leaf': 4, 'min_weight_fraction_leaf': 0.040896091792444494, 'min_impurity_decrease': 0.5003929853687561, 'max_features': 0.5430522693472388, 'subsample': 0.28078960143981696, 'dropout_rate': 0.08318478147123343, 'ccp_alpha': 0.40719494545532664}. Best is trial 690 with value: 0.6691837560454439.[0m
[32m[I 2022-04-23 04:30:18,888][0m Trial 724 finished with value: 0.6538242518735506 and parameters: {'loss': 'coxph', 'learning_rate': 0.04851508304480066, 'n_estimators': 202, 'criterion': 'friedman_mse', 'min_samples_split': 9, 'min_samples_leaf': 4, 'min_weight_fraction_leaf': 0.010035060686592224, 'min_impurity_decrease': 0.47882229773506596, 'max_features': 0.5322593174703676, 'subsample': 0.21965355505771794, 'dropout_rate': 0.2134954091589343, 'ccp_alpha': 0.10351347318920687}. Best is trial 690 with value: 0.6691837560454439.[0m
[32m[I 2022-04-23 04:32:51,527][0m Trial 725 finished with value: 0.6540202765529661 and parameters: {'loss': 'coxph', 'learning_rate': 0.06996411679828911, 'n_estimators': 733, 'criterion': 'friedman_mse', 'min_samples_split': 9, 'min_samples_leaf': 4, 'min_weight_fraction_leaf': 0.030516834698165966, 'min_impurity_decrease': 0.5402819407147613, 'max_features': 0.5789562921767886, 'subsample': 0.2635357882346491, 'dropout_rate': 0.03703898501708608, 'ccp_alpha': 0.08937389871344768}. Best is trial 690 with value: 0.6691837560454439.[0m
[32m[I 2022-04-23 04:34:30,393][0m Trial 726 finished with value: 0.5448043094227988 and parameters: {'loss': 'coxph', 'learning_rate': 0.056007401855734176, 'n_estimators': 639, 'criterion': 'friedman_mse', 'min_samples_split': 9, 'min_samples_leaf': 5, 'min_weight_fraction_leaf': 0.021613317749615037, 'min_impurity_decrease': 0.5121850105538736, 'max_features': 0.26619362098624655, 'subsample': 0.30153351343220636, 'dropout_rate': 0.17594674459767573, 'ccp_alpha': 0.2597677825607748}. Best is trial 690 with value: 0.6691837560454439.[0m
[32m[I 2022-04-23 04:35:56,378][0m Trial 727 finished with value: 0.5 and parameters: {'loss': 'coxph', 'learning_rate': 0.08006568703225693, 'n_estimators': 566, 'criterion': 'squared_error', 'min_samples_split': 8, 'min_samples_leaf': 4, 'min_weight_fraction_leaf': 0.04377848580830217, 'min_impurity_decrease': 0.45048660429073234, 'max_features': 0.33240482552994444, 'subsample': 0.23636749089366457, 'dropout_rate': 0.10750227926288924, 'ccp_alpha': 0.0020801762655331736}. Best is trial 690 with value: 0.6691837560454439.[0m
/media/san2_ssd/data/Workdir/survival/venv/lib/python3.8/site-packages/sksurv/ensemble/boosting.py:955: RuntimeWarning: divide by zero encountered in log
  time = numpy.log(time)
/media/san2_ssd/data/Workdir/survival/venv/lib/python3.8/site-packages/sksurv/ensemble/boosting.py:955: RuntimeWarning: divide by zero encountered in log
  time = numpy.log(time)
/media/san2_ssd/data/Workdir/survival/venv/lib/python3.8/site-packages/sksurv/ensemble/boosting.py:955: RuntimeWarning: divide by zero encountered in log
  time = numpy.log(time)
/media/san2_ssd/data/Workdir/survival/venv/lib/python3.8/site-packages/sksurv/ensemble/boosting.py:955: RuntimeWarning: divide by zero encountered in log
  time = numpy.log(time)
[32m[I 2022-04-23 04:36:13,225][0m Trial 728 finished with value: -0.7380284478298862 and parameters: {'loss': 'squared', 'learning_rate': 0.040839742501973524, 'n_estimators': 594, 'criterion': 'friedman_mse', 'min_samples_split': 9, 'min_samples_leaf': 4, 'min_weight_fraction_leaf': 0.015955538239348113, 'min_impurity_decrease': 0.4418248735243102, 'max_features': 0.7670537150824531, 'subsample': 0.2785368276374496, 'dropout_rate': 0.1999593669161276, 'ccp_alpha': 0.17126299437049397}. Best is trial 690 with value: 0.6691837560454439.[0m
[32m[I 2022-04-23 04:38:00,657][0m Trial 729 finished with value: 0.6573175040811287 and parameters: {'loss': 'coxph', 'learning_rate': 0.06610455775869921, 'n_estimators': 655, 'criterion': 'friedman_mse', 'min_samples_split': 9, 'min_samples_leaf': 4, 'min_weight_fraction_leaf': 0.03153978702116305, 'min_impurity_decrease': 0.4913417221330847, 'max_features': 0.08481199014380597, 'subsample': 0.200971879595493, 'dropout_rate': 0.17955726022654178, 'ccp_alpha': 0.09552754103461975}. Best is trial 690 with value: 0.6691837560454439.[0m
[32m[I 2022-04-23 04:39:37,539][0m Trial 730 finished with value: 0.5 and parameters: {'loss': 'coxph', 'learning_rate': 0.09983257497063411, 'n_estimators': 612, 'criterion': 'friedman_mse', 'min_samples_split': 9, 'min_samples_leaf': 4, 'min_weight_fraction_leaf': 0.001713493441133012, 'min_impurity_decrease': 0.29632213815192054, 'max_features': 0.5972469709269189, 'subsample': 0.32132549089455675, 'dropout_rate': 0.13475853266152754, 'ccp_alpha': 2.18605481546015}. Best is trial 690 with value: 0.6691837560454439.[0m
[32m[I 2022-04-23 04:41:27,368][0m Trial 731 finished with value: 0.5071725547341348 and parameters: {'loss': 'coxph', 'learning_rate': 0.052049247286247435, 'n_estimators': 682, 'criterion': 'friedman_mse', 'min_samples_split': 9, 'min_samples_leaf': 6, 'min_weight_fraction_leaf': 0.049328011517842316, 'min_impurity_decrease': 0.5598279345722764, 'max_features': 0.17796168705037652, 'subsample': 0.26027656382178277, 'dropout_rate': 0.2181883534813357, 'ccp_alpha': 0.31224978498199185}. Best is trial 690 with value: 0.6691837560454439.[0m
[32m[I 2022-04-23 04:42:57,438][0m Trial 732 finished with value: 0.6585286543366907 and parameters: {'loss': 'coxph', 'learning_rate': 0.00032379666789707435, 'n_estimators': 566, 'criterion': 'friedman_mse', 'min_samples_split': 9, 'min_samples_leaf': 4, 'min_weight_fraction_leaf': 0.01948420811912533, 'min_impurity_decrease': 0.5273124392047686, 'max_features': 0.5659956356531526, 'subsample': 0.288452261840742, 'dropout_rate': 0.1508625929486119, 'ccp_alpha': 0.003665960028949852}. Best is trial 690 with value: 0.6691837560454439.[0m
[32m[I 2022-04-23 04:44:22,322][0m Trial 733 finished with value: 0.62368175053014 and parameters: {'loss': 'coxph', 'learning_rate': 0.07938664595989468, 'n_estimators': 583, 'criterion': 'friedman_mse', 'min_samples_split': 9, 'min_samples_leaf': 4, 'min_weight_fraction_leaf': 0.03208341179664517, 'min_impurity_decrease': 0.49959741825893794, 'max_features': 0.16788051054255915, 'subsample': 0.2441305653959961, 'dropout_rate': 0.20879027556906085, 'ccp_alpha': 0.18790298101301584}. Best is trial 690 with value: 0.6691837560454439.[0m
[32m[I 2022-04-23 04:46:29,226][0m Trial 734 finished with value: 0.6557733439690896 and parameters: {'loss': 'coxph', 'learning_rate': 0.040829381103644875, 'n_estimators': 713, 'criterion': 'friedman_mse', 'min_samples_split': 9, 'min_samples_leaf': 4, 'min_weight_fraction_leaf': 0.04333736683074233, 'min_impurity_decrease': 0.4792010616944748, 'max_features': 0.5168689523107629, 'subsample': 0.2211236765724709, 'dropout_rate': 0.16878246112689005, 'ccp_alpha': 0.10047118022699297}. Best is trial 690 with value: 0.6691837560454439.[0m
[32m[I 2022-04-23 04:48:09,814][0m Trial 735 finished with value: 0.6485115375178834 and parameters: {'loss': 'coxph', 'learning_rate': 0.06251239618729743, 'n_estimators': 638, 'criterion': 'friedman_mse', 'min_samples_split': 9, 'min_samples_leaf': 4, 'min_weight_fraction_leaf': 0.010976963987512082, 'min_impurity_decrease': 0.5225638488270915, 'max_features': 0.5898406586750043, 'subsample': 0.30282991763393347, 'dropout_rate': 0.19333995098210244, 'ccp_alpha': 0.0976008344282305}. Best is trial 690 with value: 0.6691837560454439.[0m
[32m[I 2022-04-23 04:49:56,733][0m Trial 736 finished with value: 0.6567263649511605 and parameters: {'loss': 'coxph', 'learning_rate': 0.051103636212368145, 'n_estimators': 612, 'criterion': 'friedman_mse', 'min_samples_split': 8, 'min_samples_leaf': 5, 'min_weight_fraction_leaf': 0.024316472471778865, 'min_impurity_decrease': 0.4643488936606611, 'max_features': 0.7951994541076168, 'subsample': 0.1860484715917087, 'dropout_rate': 0.11851680211255053, 'ccp_alpha': 0.0019655463290315558}. Best is trial 690 with value: 0.6691837560454439.[0m
[32m[I 2022-04-23 04:51:49,399][0m Trial 737 finished with value: 0.5 and parameters: {'loss': 'coxph', 'learning_rate': 0.004894836389420987, 'n_estimators': 674, 'criterion': 'friedman_mse', 'min_samples_split': 6, 'min_samples_leaf': 4, 'min_weight_fraction_leaf': 0.05162853318737412, 'min_impurity_decrease': 0.5145387529761113, 'max_features': 0.5472979673364249, 'subsample': 0.7787689081565885, 'dropout_rate': 0.15850684450959565, 'ccp_alpha': 0.2256308226344925}. Best is trial 690 with value: 0.6691837560454439.[0m
[32m[I 2022-04-23 04:53:06,590][0m Trial 738 finished with value: 0.6320096252970651 and parameters: {'loss': 'coxph', 'learning_rate': 0.07976826016752044, 'n_estimators': 565, 'criterion': 'friedman_mse', 'min_samples_split': 9, 'min_samples_leaf': 4, 'min_weight_fraction_leaf': 0.03738855965001599, 'min_impurity_decrease': 0.42476956380975583, 'max_features': 0.01885759738293974, 'subsample': 0.266360955534108, 'dropout_rate': 0.22166197332005888, 'ccp_alpha': 0.0915785268527394}. Best is trial 690 with value: 0.6691837560454439.[0m
[32m[I 2022-04-23 04:54:32,216][0m Trial 739 finished with value: 0.5 and parameters: {'loss': 'coxph', 'learning_rate': 0.06657114949424767, 'n_estimators': 588, 'criterion': 'friedman_mse', 'min_samples_split': 5, 'min_samples_leaf': 4, 'min_weight_fraction_leaf': 0.012007713746502469, 'min_impurity_decrease': 0.5686243082403484, 'max_features': 0.15015727033370152, 'subsample': 0.8464011079846563, 'dropout_rate': 0.19002109660771618, 'ccp_alpha': 0.18772641493266343}. Best is trial 690 with value: 0.6691837560454439.[0m
[32m[I 2022-04-23 04:56:10,592][0m Trial 740 finished with value: 0.5 and parameters: {'loss': 'coxph', 'learning_rate': 0.04421317941286591, 'n_estimators': 640, 'criterion': 'friedman_mse', 'min_samples_split': 9, 'min_samples_leaf': 5, 'min_weight_fraction_leaf': 0.02557174850432017, 'min_impurity_decrease': 0.49038348647504404, 'max_features': 0.21142584381680596, 'subsample': 0.23950722538163893, 'dropout_rate': 0.17978656987950029, 'ccp_alpha': 0.35868962862433623}. Best is trial 690 with value: 0.6691837560454439.[0m
[32m[I 2022-04-23 04:56:27,754][0m Trial 741 finished with value: 0.5 and parameters: {'loss': 'coxph', 'learning_rate': 0.07901707562075236, 'n_estimators': 617, 'criterion': 'absolute_error', 'min_samples_split': 9, 'min_samples_leaf': 4, 'min_weight_fraction_leaf': 0.3077453973089924, 'min_impurity_decrease': 0.5355290808066446, 'max_features': 0.6085795713841647, 'subsample': 0.32527912512183654, 'dropout_rate': 0.962364129865575, 'ccp_alpha': 3.4348693477045367}. Best is trial 690 with value: 0.6691837560454439.[0m
[32m[I 2022-04-23 04:57:57,092][0m Trial 742 finished with value: 0.6663271926034428 and parameters: {'loss': 'coxph', 'learning_rate': 0.0586114371928666, 'n_estimators': 596, 'criterion': 'friedman_mse', 'min_samples_split': 9, 'min_samples_leaf': 4, 'min_weight_fraction_leaf': 0.05195988775949485, 'min_impurity_decrease': 0.4392914953785674, 'max_features': 0.5595717598360375, 'subsample': 0.2836949470539718, 'dropout_rate': 0.21423829385869378, 'ccp_alpha': 0.0041328429903693354}. Best is trial 690 with value: 0.6691837560454439.[0m
