[32m[I 2022-04-22 09:30:17,787][0m Trial 890 finished with value: 0.8303540895590649 and parameters: {'loss': 'coxph', 'learning_rate': 0.0024666257931948567, 'n_estimators': 917, 'criterion': 'friedman_mse', 'min_samples_split': 2, 'min_samples_leaf': 6, 'min_weight_fraction_leaf': 0.03890426721997433, 'min_impurity_decrease': 0.9996495041950512, 'max_features': 0.2985907148939818, 'subsample': 0.2840546301563842, 'dropout_rate': 0.2531981475613399, 'ccp_alpha': 0.0029911378528512575}. Best is trial 867 with value: 0.8349451173694054.[0m
[32m[I 2022-04-22 09:34:09,776][0m Trial 891 finished with value: 0.8330587069293326 and parameters: {'loss': 'coxph', 'learning_rate': 0.002961464144986302, 'n_estimators': 956, 'criterion': 'friedman_mse', 'min_samples_split': 2, 'min_samples_leaf': 6, 'min_weight_fraction_leaf': 0.0011898086210484593, 'min_impurity_decrease': 0.9705328375626521, 'max_features': 0.26522310110946223, 'subsample': 0.2642708336058432, 'dropout_rate': 0.21563430710549333, 'ccp_alpha': 0.0028304263324481745}. Best is trial 867 with value: 0.8349451173694054.[0m
[32m[I 2022-04-22 09:37:58,887][0m Trial 892 finished with value: 0.25 and parameters: {'loss': 'coxph', 'learning_rate': 0.001307352636286689, 'n_estimators': 969, 'criterion': 'friedman_mse', 'min_samples_split': 2, 'min_samples_leaf': 6, 'min_weight_fraction_leaf': 0.018476395914238428, 'min_impurity_decrease': 0.938834260769827, 'max_features': 0.25095161177447817, 'subsample': 0.25554483587258114, 'dropout_rate': 0.1675197153772329, 'ccp_alpha': 1.7624092229956843}. Best is trial 867 with value: 0.8349451173694054.[0m
[32m[I 2022-04-22 09:41:37,940][0m Trial 893 finished with value: 0.3686225154030866 and parameters: {'loss': 'coxph', 'learning_rate': 0.0017875255137089993, 'n_estimators': 959, 'criterion': 'friedman_mse', 'min_samples_split': 2, 'min_samples_leaf': 6, 'min_weight_fraction_leaf': 0.0010282653453485275, 'min_impurity_decrease': 0.9612680742835736, 'max_features': 0.23364789685464704, 'subsample': 0.24661094741273054, 'dropout_rate': 0.20194866991616978, 'ccp_alpha': 0.2877576016865936}. Best is trial 867 with value: 0.8349451173694054.[0m
[32m[I 2022-04-22 09:44:52,528][0m Trial 894 finished with value: 0.8226491498343466 and parameters: {'loss': 'coxph', 'learning_rate': 0.0028138271830236835, 'n_estimators': 924, 'criterion': 'friedman_mse', 'min_samples_split': 2, 'min_samples_leaf': 6, 'min_weight_fraction_leaf': 0.027392537705450068, 'min_impurity_decrease': 0.9375157653247929, 'max_features': 0.2648869630127681, 'subsample': 0.2658469186859463, 'dropout_rate': 0.21644009697190697, 'ccp_alpha': 0.15250563190143046}. Best is trial 867 with value: 0.8349451173694054.[0m
[32m[I 2022-04-22 09:48:50,804][0m Trial 895 finished with value: 0.8277250889108139 and parameters: {'loss': 'coxph', 'learning_rate': 0.002885718653807188, 'n_estimators': 967, 'criterion': 'friedman_mse', 'min_samples_split': 2, 'min_samples_leaf': 6, 'min_weight_fraction_leaf': 0.013355570316896662, 'min_impurity_decrease': 0.9656701172361289, 'max_features': 0.219733426505696, 'subsample': 0.2645431092524456, 'dropout_rate': 0.1579527387603028, 'ccp_alpha': 0.0877634926642646}. Best is trial 867 with value: 0.8349451173694054.[0m
[32m[I 2022-04-22 09:52:06,262][0m Trial 896 finished with value: 0.8257167255613604 and parameters: {'loss': 'coxph', 'learning_rate': 0.0020231399162878583, 'n_estimators': 893, 'criterion': 'friedman_mse', 'min_samples_split': 2, 'min_samples_leaf': 6, 'min_weight_fraction_leaf': 0.009961888333647494, 'min_impurity_decrease': 0.950562113091656, 'max_features': 0.2779827790155759, 'subsample': 0.28453518362649227, 'dropout_rate': 0.1866370889338632, 'ccp_alpha': 0.09590887107084904}. Best is trial 867 with value: 0.8349451173694054.[0m
[32m[I 2022-04-22 09:55:20,616][0m Trial 897 finished with value: 0.25 and parameters: {'loss': 'coxph', 'learning_rate': 0.002812153725320067, 'n_estimators': 926, 'criterion': 'friedman_mse', 'min_samples_split': 2, 'min_samples_leaf': 6, 'min_weight_fraction_leaf': 0.019663285424911015, 'min_impurity_decrease': 0.9717544472144315, 'max_features': 0.18289316339818756, 'subsample': 0.24142397396495216, 'dropout_rate': 0.21356124222220316, 'ccp_alpha': 0.6345033563136636}. Best is trial 867 with value: 0.8349451173694054.[0m
[32m[I 2022-04-22 09:59:38,410][0m Trial 898 finished with value: 0.6974242604293389 and parameters: {'loss': 'coxph', 'learning_rate': 0.0012788216314383268, 'n_estimators': 996, 'criterion': 'friedman_mse', 'min_samples_split': 2, 'min_samples_leaf': 6, 'min_weight_fraction_leaf': 0.030724047530057388, 'min_impurity_decrease': 0.9295790650512251, 'max_features': 0.25327263436576664, 'subsample': 0.2741152248544363, 'dropout_rate': 0.0898929691960832, 'ccp_alpha': 0.22123276900095704}. Best is trial 867 with value: 0.8349451173694054.[0m
[32m[I 2022-04-22 10:03:28,585][0m Trial 899 finished with value: 0.82495906873196 and parameters: {'loss': 'coxph', 'learning_rate': 0.002488455476363655, 'n_estimators': 949, 'criterion': 'friedman_mse', 'min_samples_split': 2, 'min_samples_leaf': 6, 'min_weight_fraction_leaf': 0.009875545059081448, 'min_impurity_decrease': 0.9761600649936925, 'max_features': 0.27817168844135676, 'subsample': 0.29672386152450847, 'dropout_rate': 0.17495145985725596, 'ccp_alpha': 0.08816153490781188}. Best is trial 867 with value: 0.8349451173694054.[0m
[32m[I 2022-04-22 10:06:42,560][0m Trial 900 finished with value: 0.25 and parameters: {'loss': 'coxph', 'learning_rate': 0.00174460787753136, 'n_estimators': 889, 'criterion': 'friedman_mse', 'min_samples_split': 2, 'min_samples_leaf': 6, 'min_weight_fraction_leaf': 0.023426713917173846, 'min_impurity_decrease': 0.9495881593067942, 'max_features': 0.24557688545878903, 'subsample': 0.2932624876729385, 'dropout_rate': 0.1918528852130538, 'ccp_alpha': 0.4172780926019239}. Best is trial 867 with value: 0.8349451173694054.[0m
[32m[I 2022-04-22 10:10:32,091][0m Trial 901 finished with value: 0.8325384095214987 and parameters: {'loss': 'coxph', 'learning_rate': 0.0009555830491284553, 'n_estimators': 922, 'criterion': 'friedman_mse', 'min_samples_split': 2, 'min_samples_leaf': 6, 'min_weight_fraction_leaf': 0.03937756584532354, 'min_impurity_decrease': 0.9754446835751501, 'max_features': 0.21359667677312513, 'subsample': 0.2711099865275296, 'dropout_rate': 0.14962286416827414, 'ccp_alpha': 0.0013108748685062548}. Best is trial 867 with value: 0.8349451173694054.[0m
[32m[I 2022-04-22 10:13:43,741][0m Trial 902 finished with value: 0.811507475580644 and parameters: {'loss': 'coxph', 'learning_rate': 0.0008484292022780908, 'n_estimators': 868, 'criterion': 'friedman_mse', 'min_samples_split': 2, 'min_samples_leaf': 6, 'min_weight_fraction_leaf': 0.03903958600682333, 'min_impurity_decrease': 0.9808776379115755, 'max_features': 0.20421910650037123, 'subsample': 0.27693013096378205, 'dropout_rate': 0.11770902080886295, 'ccp_alpha': 0.1738301740865823}. Best is trial 867 with value: 0.8349451173694054.[0m
/media/san2_ssd/data/Workdir/survival/venv/lib/python3.8/site-packages/sksurv/ensemble/boosting.py:955: RuntimeWarning: divide by zero encountered in log
  time = numpy.log(time)
/media/san2_ssd/data/Workdir/survival/venv/lib/python3.8/site-packages/sksurv/ensemble/boosting.py:955: RuntimeWarning: divide by zero encountered in log
  time = numpy.log(time)
/media/san2_ssd/data/Workdir/survival/venv/lib/python3.8/site-packages/sksurv/ensemble/boosting.py:955: RuntimeWarning: divide by zero encountered in log
  time = numpy.log(time)
/media/san2_ssd/data/Workdir/survival/venv/lib/python3.8/site-packages/sksurv/ensemble/boosting.py:955: RuntimeWarning: divide by zero encountered in log
  time = numpy.log(time)
[32m[I 2022-04-22 10:14:23,966][0m Trial 903 finished with value: -0.454656354155446 and parameters: {'loss': 'squared', 'learning_rate': 0.0009569756276074749, 'n_estimators': 911, 'criterion': 'friedman_mse', 'min_samples_split': 2, 'min_samples_leaf': 6, 'min_weight_fraction_leaf': 0.356958146352527, 'min_impurity_decrease': 0.9288763041726021, 'max_features': 0.2108682433400757, 'subsample': 0.24207007412647796, 'dropout_rate': 0.14448846443245994, 'ccp_alpha': 0.0016544375338353825}. Best is trial 867 with value: 0.8349451173694054.[0m
[32m[I 2022-04-22 10:17:40,202][0m Trial 904 finished with value: 0.25662745571200507 and parameters: {'loss': 'coxph', 'learning_rate': 0.0013392895182102883, 'n_estimators': 847, 'criterion': 'friedman_mse', 'min_samples_split': 2, 'min_samples_leaf': 6, 'min_weight_fraction_leaf': 0.04019656622834819, 'min_impurity_decrease': 0.9824939272333516, 'max_features': 0.14972737116307194, 'subsample': 0.25377107778082125, 'dropout_rate': 0.13291883304915464, 'ccp_alpha': 0.3168087382828031}. Best is trial 867 with value: 0.8349451173694054.[0m
[32m[I 2022-04-22 10:21:08,136][0m Trial 905 finished with value: 0.8192646556043478 and parameters: {'loss': 'coxph', 'learning_rate': 0.0020312611938136634, 'n_estimators': 900, 'criterion': 'friedman_mse', 'min_samples_split': 6, 'min_samples_leaf': 6, 'min_weight_fraction_leaf': 0.039024387221574905, 'min_impurity_decrease': 0.9538001578819332, 'max_features': 0.18180211799001272, 'subsample': 0.22322098360856032, 'dropout_rate': 0.15285765905217638, 'ccp_alpha': 0.1654964271964031}. Best is trial 867 with value: 0.8349451173694054.[0m
[32m[I 2022-04-22 10:24:56,591][0m Trial 906 finished with value: 0.25 and parameters: {'loss': 'coxph', 'learning_rate': 0.001009095309578179, 'n_estimators': 964, 'criterion': 'squared_error', 'min_samples_split': 2, 'min_samples_leaf': 6, 'min_weight_fraction_leaf': 0.03145173418241573, 'min_impurity_decrease': 0.9814507636308555, 'max_features': 0.22009183305236535, 'subsample': 0.7785064530289262, 'dropout_rate': 0.15274276505249312, 'ccp_alpha': 0.09451714205107907}. Best is trial 867 with value: 0.8349451173694054.[0m
[32m[I 2022-04-22 10:28:59,201][0m Trial 907 finished with value: 0.8297031017619027 and parameters: {'loss': 'coxph', 'learning_rate': 0.0012244580786980271, 'n_estimators': 928, 'criterion': 'friedman_mse', 'min_samples_split': 2, 'min_samples_leaf': 6, 'min_weight_fraction_leaf': 0.03802897558232025, 'min_impurity_decrease': 0.9465325680380982, 'max_features': 0.23364311748270616, 'subsample': 0.2645411631108356, 'dropout_rate': 0.12057051033358959, 'ccp_alpha': 0.0011546394772497183}. Best is trial 867 with value: 0.8349451173694054.[0m
[32m[I 2022-04-22 10:32:02,744][0m Trial 908 finished with value: 0.25 and parameters: {'loss': 'coxph', 'learning_rate': 0.0009452896580108521, 'n_estimators': 866, 'criterion': 'friedman_mse', 'min_samples_split': 2, 'min_samples_leaf': 6, 'min_weight_fraction_leaf': 0.3820950104403886, 'min_impurity_decrease': 0.9637657112846879, 'max_features': 0.20435115753000282, 'subsample': 0.2615034759954183, 'dropout_rate': 0.17626047340499224, 'ccp_alpha': 0.241167005079728}. Best is trial 867 with value: 0.8349451173694054.[0m
[32m[I 2022-04-22 10:35:06,681][0m Trial 909 finished with value: 0.8293964512799172 and parameters: {'loss': 'coxph', 'learning_rate': 0.0013725544797622317, 'n_estimators': 995, 'criterion': 'friedman_mse', 'min_samples_split': 2, 'min_samples_leaf': 6, 'min_weight_fraction_leaf': 0.028576929474012004, 'min_impurity_decrease': 0.9233990598163893, 'max_features': 0.258763242461645, 'subsample': 0.27536078125899344, 'dropout_rate': 0.4339225942946283, 'ccp_alpha': 0.0021592555355075477}. Best is trial 867 with value: 0.8349451173694054.[0m
[32m[I 2022-04-22 10:38:28,957][0m Trial 910 finished with value: 0.25 and parameters: {'loss': 'coxph', 'learning_rate': 0.001600828171779072, 'n_estimators': 899, 'criterion': 'absolute_error', 'min_samples_split': 2, 'min_samples_leaf': 6, 'min_weight_fraction_leaf': 0.49198094672908094, 'min_impurity_decrease': 0.9792103876859148, 'max_features': 0.239230390682218, 'subsample': 0.23198592765012083, 'dropout_rate': 0.16346188115588325, 'ccp_alpha': 0.09865254594561212}. Best is trial 867 with value: 0.8349451173694054.[0m
[32m[I 2022-04-22 10:40:23,495][0m Trial 911 finished with value: 0.8004032879615741 and parameters: {'loss': 'coxph', 'learning_rate': 0.001792201188693709, 'n_estimators': 842, 'criterion': 'friedman_mse', 'min_samples_split': 2, 'min_samples_leaf': 6, 'min_weight_fraction_leaf': 0.021521622607524344, 'min_impurity_decrease': 0.9488972082006404, 'max_features': 0.26443036318653784, 'subsample': 0.28808185992511776, 'dropout_rate': 0.49592821839796525, 'ccp_alpha': 0.1834368240119893}. Best is trial 867 with value: 0.8349451173694054.[0m
[32m[I 2022-04-22 10:43:44,186][0m Trial 912 finished with value: 0.8249858060362056 and parameters: {'loss': 'coxph', 'learning_rate': 0.002844653881149272, 'n_estimators': 932, 'criterion': 'friedman_mse', 'min_samples_split': 2, 'min_samples_leaf': 6, 'min_weight_fraction_leaf': 0.03188114984921983, 'min_impurity_decrease': 0.9835881079186497, 'max_features': 0.17685546619335793, 'subsample': 0.2969222599114322, 'dropout_rate': 0.22982584877974366, 'ccp_alpha': 0.11492791695442683}. Best is trial 867 with value: 0.8349451173694054.[0m
[32m[I 2022-04-22 10:46:59,700][0m Trial 913 finished with value: 0.3739139396704102 and parameters: {'loss': 'coxph', 'learning_rate': 0.002201426174552798, 'n_estimators': 882, 'criterion': 'friedman_mse', 'min_samples_split': 2, 'min_samples_leaf': 6, 'min_weight_fraction_leaf': 0.0416233053365839, 'min_impurity_decrease': 0.9619401461881446, 'max_features': 0.2846453414823341, 'subsample': 0.24793253217267008, 'dropout_rate': 0.1299558145300234, 'ccp_alpha': 0.2665756583776026}. Best is trial 867 with value: 0.8349451173694054.[0m
[32m[I 2022-04-22 10:50:31,896][0m Trial 914 finished with value: 0.8124423017833772 and parameters: {'loss': 'coxph', 'learning_rate': 0.0010974616781247418, 'n_estimators': 959, 'criterion': 'friedman_mse', 'min_samples_split': 2, 'min_samples_leaf': 6, 'min_weight_fraction_leaf': 0.22144720434930784, 'min_impurity_decrease': 0.9335694841237555, 'max_features': 0.19780216834559494, 'subsample': 0.2970838619760367, 'dropout_rate': 0.255681194533644, 'ccp_alpha': 0.09415466030342529}. Best is trial 867 with value: 0.8349451173694054.[0m
[32m[I 2022-04-22 10:54:14,905][0m Trial 915 finished with value: 0.8246768747099434 and parameters: {'loss': 'coxph', 'learning_rate': 5.061597695510092e-06, 'n_estimators': 926, 'criterion': 'friedman_mse', 'min_samples_split': 2, 'min_samples_leaf': 6, 'min_weight_fraction_leaf': 0.019210778012997646, 'min_impurity_decrease': 0.9633977732863649, 'max_features': 0.2454197277185159, 'subsample': 0.27537138654341303, 'dropout_rate': 0.16700919505441159, 'ccp_alpha': 0.09773081998525111}. Best is trial 867 with value: 0.8349451173694054.[0m
[32m[I 2022-04-22 10:58:07,574][0m Trial 916 finished with value: 0.7119341768494742 and parameters: {'loss': 'coxph', 'learning_rate': 0.0016419020126448114, 'n_estimators': 998, 'criterion': 'friedman_mse', 'min_samples_split': 2, 'min_samples_leaf': 6, 'min_weight_fraction_leaf': 0.01815202924865634, 'min_impurity_decrease': 0.9831803896165969, 'max_features': 0.28799842602713943, 'subsample': 0.3054056919305283, 'dropout_rate': 0.20229434310611866, 'ccp_alpha': 0.1800650606822856}. Best is trial 867 with value: 0.8349451173694054.[0m
[32m[I 2022-04-22 11:00:46,416][0m Trial 917 finished with value: 0.2621273863062995 and parameters: {'loss': 'coxph', 'learning_rate': 0.0031400251955398424, 'n_estimators': 833, 'criterion': 'friedman_mse', 'min_samples_split': 2, 'min_samples_leaf': 6, 'min_weight_fraction_leaf': 0.028160534785610605, 'min_impurity_decrease': 0.9447450044150476, 'max_features': 0.2246473274354886, 'subsample': 0.26314383966896115, 'dropout_rate': 0.22359140623460785, 'ccp_alpha': 0.31081339442225797}. Best is trial 867 with value: 0.8349451173694054.[0m
[32m[I 2022-04-22 11:04:24,953][0m Trial 918 finished with value: 0.8279058892146857 and parameters: {'loss': 'coxph', 'learning_rate': 0.0021107922306922936, 'n_estimators': 886, 'criterion': 'friedman_mse', 'min_samples_split': 2, 'min_samples_leaf': 6, 'min_weight_fraction_leaf': 0.017143461876475974, 'min_impurity_decrease': 0.9998236211655873, 'max_features': 0.26655692621358795, 'subsample': 0.30687979884532496, 'dropout_rate': 0.09636658133248735, 'ccp_alpha': 0.08329618179640551}. Best is trial 867 with value: 0.8349451173694054.[0m
[32m[I 2022-04-22 11:08:20,315][0m Trial 919 finished with value: 0.8311931069055172 and parameters: {'loss': 'coxph', 'learning_rate': 0.0024254340284704926, 'n_estimators': 950, 'criterion': 'friedman_mse', 'min_samples_split': 2, 'min_samples_leaf': 6, 'min_weight_fraction_leaf': 0.04118324788210661, 'min_impurity_decrease': 0.9222965585782609, 'max_features': 0.3002062885171546, 'subsample': 0.2827885569887436, 'dropout_rate': 0.17530111475745933, 'ccp_alpha': 0.0038928264108528225}. Best is trial 867 with value: 0.8349451173694054.[0m
[32m[I 2022-04-22 11:11:06,062][0m Trial 920 finished with value: 0.25 and parameters: {'loss': 'coxph', 'learning_rate': 0.002760866070971908, 'n_estimators': 861, 'criterion': 'friedman_mse', 'min_samples_split': 2, 'min_samples_leaf': 6, 'min_weight_fraction_leaf': 0.027098911574858144, 'min_impurity_decrease': 0.9644927647824084, 'max_features': 0.23139982755379593, 'subsample': 0.31205210938620326, 'dropout_rate': 0.2438050275339107, 'ccp_alpha': 1.9905948321488918}. Best is trial 867 with value: 0.8349451173694054.[0m
[32m[I 2022-04-22 11:14:31,091][0m Trial 921 finished with value: 0.25 and parameters: {'loss': 'coxph', 'learning_rate': 0.0031082995087609515, 'n_estimators': 916, 'criterion': 'friedman_mse', 'min_samples_split': 2, 'min_samples_leaf': 6, 'min_weight_fraction_leaf': 0.01209703095877271, 'min_impurity_decrease': 0.9846520920939636, 'max_features': 0.25738135655211075, 'subsample': 0.2918114722666067, 'dropout_rate': 0.19182810150573365, 'ccp_alpha': 2.410229963804463}. Best is trial 867 with value: 0.8349451173694054.[0m
/media/san2_ssd/data/Workdir/survival/venv/lib/python3.8/site-packages/sksurv/ensemble/boosting.py:955: RuntimeWarning: divide by zero encountered in log
  time = numpy.log(time)
/media/san2_ssd/data/Workdir/survival/venv/lib/python3.8/site-packages/sksurv/ensemble/boosting.py:955: RuntimeWarning: divide by zero encountered in log
  time = numpy.log(time)
/media/san2_ssd/data/Workdir/survival/venv/lib/python3.8/site-packages/sksurv/ensemble/boosting.py:955: RuntimeWarning: divide by zero encountered in log
  time = numpy.log(time)
/media/san2_ssd/data/Workdir/survival/venv/lib/python3.8/site-packages/sksurv/ensemble/boosting.py:955: RuntimeWarning: divide by zero encountered in log
  time = numpy.log(time)
[32m[I 2022-04-22 11:15:21,259][0m Trial 922 finished with value: -0.4675297168459397 and parameters: {'loss': 'squared', 'learning_rate': 0.0014748341380946795, 'n_estimators': 997, 'criterion': 'friedman_mse', 'min_samples_split': 2, 'min_samples_leaf': 6, 'min_weight_fraction_leaf': 0.009435435952723597, 'min_impurity_decrease': 0.9404056296615783, 'max_features': 0.2985496822653361, 'subsample': 0.31102816279386863, 'dropout_rate': 0.2165605918277156, 'ccp_alpha': 0.0013017619114857643}. Best is trial 867 with value: 0.8349451173694054.[0m
[32m[I 2022-04-22 11:17:05,254][0m Trial 923 finished with value: 0.8188114819476147 and parameters: {'loss': 'coxph', 'learning_rate': 0.0032733099457493524, 'n_estimators': 893, 'criterion': 'friedman_mse', 'min_samples_split': 2, 'min_samples_leaf': 6, 'min_weight_fraction_leaf': 0.02885559076483335, 'min_impurity_decrease': 0.9655025959478188, 'max_features': 0.2770065517393549, 'subsample': 0.2671405051040077, 'dropout_rate': 0.6293771832987451, 'ccp_alpha': 0.16640682750256008}. Best is trial 867 with value: 0.8349451173694054.[0m
[32m[I 2022-04-22 11:19:39,778][0m Trial 924 finished with value: 0.8273930544695449 and parameters: {'loss': 'coxph', 'learning_rate': 0.0011247365451993062, 'n_estimators': 819, 'criterion': 'friedman_mse', 'min_samples_split': 2, 'min_samples_leaf': 6, 'min_weight_fraction_leaf': 0.01951113599298915, 'min_impurity_decrease': 0.9211348048300706, 'max_features': 0.21413538899297258, 'subsample': 0.28800548212483024, 'dropout_rate': 0.2632107829202198, 'ccp_alpha': 0.08869459601695076}. Best is trial 867 with value: 0.8349451173694054.[0m
[32m[I 2022-04-22 11:23:34,144][0m Trial 925 finished with value: 0.6982371158128153 and parameters: {'loss': 'coxph', 'learning_rate': 0.0008449629029265667, 'n_estimators': 955, 'criterion': 'friedman_mse', 'min_samples_split': 2, 'min_samples_leaf': 6, 'min_weight_fraction_leaf': 0.038209930602748646, 'min_impurity_decrease': 0.9478972373327725, 'max_features': 0.2496792395022598, 'subsample': 0.23005136191504053, 'dropout_rate': 0.14162171747944008, 'ccp_alpha': 0.22933560173120218}. Best is trial 867 with value: 0.8349451173694054.[0m
[32m[I 2022-04-22 11:26:31,722][0m Trial 926 finished with value: 0.8267688779807791 and parameters: {'loss': 'coxph', 'learning_rate': 0.002244871950762971, 'n_estimators': 866, 'criterion': 'friedman_mse', 'min_samples_split': 2, 'min_samples_leaf': 6, 'min_weight_fraction_leaf': 0.008675236075431686, 'min_impurity_decrease': 0.9986055653458001, 'max_features': 0.30053322535693966, 'subsample': 0.3136236034626222, 'dropout_rate': 0.22610513832125653, 'ccp_alpha': 0.09822666994554881}. Best is trial 867 with value: 0.8349451173694054.[0m
