[32m[I 2022-04-23 00:09:23,253][0m Trial 563 finished with value: 0.6773011017218613 and parameters: {'n_hidden': 1024, 'mixture_components': 8, 'use_sparse_layer': False, 'use_batchnorm': False, 'use_dropout': False, 'mlp_size_1': 6, 'mlp_size_2': 0, 'mlp_size_3': 1, 'kernel': 'Normal', 'loss_name': 'AlternativeNLLLoss'}. Best is trial 530 with value: 0.7027982899957603.[0m
[32m[I 2022-04-23 00:10:19,893][0m Trial 564 finished with value: 0.6599641669051648 and parameters: {'n_hidden': 32, 'mixture_components': 2, 'use_sparse_layer': False, 'use_batchnorm': False, 'use_dropout': False, 'mlp_size_1': 2, 'mlp_size_2': 0, 'mlp_size_3': 0, 'kernel': 'LogLogistic', 'loss_name': 'NLLLoss'}. Best is trial 530 with value: 0.7027982899957603.[0m
[32m[I 2022-04-23 00:10:58,382][0m Trial 565 finished with value: 0.6898726269225419 and parameters: {'n_hidden': 1024, 'mixture_components': 1, 'use_sparse_layer': False, 'use_batchnorm': False, 'use_dropout': False, 'mlp_size_1': 5, 'mlp_size_2': 1, 'mlp_size_3': 1, 'kernel': 'Gumbel', 'loss_name': 'NLLLoss'}. Best is trial 530 with value: 0.7027982899957603.[0m
[32m[I 2022-04-23 00:11:43,507][0m Trial 566 finished with value: 0.6839494777611772 and parameters: {'n_hidden': 1024, 'mixture_components': 7, 'use_sparse_layer': False, 'use_batchnorm': False, 'use_dropout': False, 'mlp_size_1': 6, 'mlp_size_2': 0, 'mlp_size_3': 1, 'kernel': 'Normal', 'loss_name': 'NLLLoss'}. Best is trial 530 with value: 0.7027982899957603.[0m
[32m[I 2022-04-23 00:13:35,632][0m Trial 567 finished with value: 0.6662358866317332 and parameters: {'n_hidden': 2048, 'mixture_components': 8, 'use_sparse_layer': False, 'use_batchnorm': True, 'use_dropout': False, 'mlp_size_1': 8, 'mlp_size_2': 0, 'mlp_size_3': 0, 'kernel': 'Logistic', 'loss_name': 'NLLLoss'}. Best is trial 530 with value: 0.7027982899957603.[0m
[32m[I 2022-04-23 00:14:14,096][0m Trial 568 finished with value: 0.686631004733256 and parameters: {'n_hidden': 1024, 'mixture_components': 2, 'use_sparse_layer': False, 'use_batchnorm': False, 'use_dropout': False, 'mlp_size_1': 6, 'mlp_size_2': 0, 'mlp_size_3': 1, 'kernel': 'Normal', 'loss_name': 'NLLLoss'}. Best is trial 530 with value: 0.7027982899957603.[0m
[32m[I 2022-04-23 00:14:56,149][0m Trial 569 finished with value: 0.680074258289112 and parameters: {'n_hidden': 1024, 'mixture_components': 10, 'use_sparse_layer': False, 'use_batchnorm': False, 'use_dropout': False, 'mlp_size_1': 0, 'mlp_size_2': 1, 'mlp_size_3': 1, 'kernel': 'Gumbel', 'loss_name': 'AlternativeNLLLoss'}. Best is trial 530 with value: 0.7027982899957603.[0m
[32m[I 2022-04-23 00:15:41,297][0m Trial 570 finished with value: 0.6791092830107857 and parameters: {'n_hidden': 1024, 'mixture_components': 8, 'use_sparse_layer': False, 'use_batchnorm': False, 'use_dropout': False, 'mlp_size_1': 6, 'mlp_size_2': 0, 'mlp_size_3': 1, 'kernel': 'Normal', 'loss_name': 'NLLLoss'}. Best is trial 530 with value: 0.7027982899957603.[0m
[32m[I 2022-04-23 00:16:24,057][0m Trial 571 finished with value: 0.6900770665663464 and parameters: {'n_hidden': 1024, 'mixture_components': 4, 'use_sparse_layer': True, 'use_sparse_loss': True, 'lmbd': 0.002570973742896636, 'use_batchnorm': False, 'use_dropout': False, 'mlp_size_1': 6, 'mlp_size_2': 0, 'mlp_size_3': 1, 'kernel': 'Logistic', 'loss_name': 'NLLLoss'}. Best is trial 530 with value: 0.7027982899957603.[0m
[32m[I 2022-04-23 00:17:05,923][0m Trial 572 finished with value: 0.6837576143498525 and parameters: {'n_hidden': 1024, 'mixture_components': 2, 'use_sparse_layer': False, 'use_batchnorm': False, 'use_dropout': False, 'mlp_size_1': 6, 'mlp_size_2': 0, 'mlp_size_3': 1, 'kernel': 'Normal', 'loss_name': 'NLLLoss'}. Best is trial 530 with value: 0.7027982899957603.[0m
[32m[I 2022-04-23 00:17:58,325][0m Trial 573 finished with value: 0.6766302738241289 and parameters: {'n_hidden': 128, 'mixture_components': 3, 'use_sparse_layer': False, 'use_batchnorm': False, 'use_dropout': False, 'mlp_size_1': 4, 'mlp_size_2': 0, 'mlp_size_3': 0, 'kernel': 'Gumbel', 'loss_name': 'NLLLoss'}. Best is trial 530 with value: 0.7027982899957603.[0m
[32m[I 2022-04-23 00:19:09,532][0m Trial 574 finished with value: 0.6920604568714095 and parameters: {'n_hidden': 1024, 'mixture_components': 9, 'use_sparse_layer': False, 'use_batchnorm': False, 'use_dropout': False, 'mlp_size_1': 6, 'mlp_size_2': 0, 'mlp_size_3': 1, 'kernel': 'Normal', 'loss_name': 'AlternativeNLLLoss'}. Best is trial 530 with value: 0.7027982899957603.[0m
[32m[I 2022-04-23 00:19:51,599][0m Trial 575 finished with value: 0.6932114039521027 and parameters: {'n_hidden': 1024, 'mixture_components': 8, 'use_sparse_layer': False, 'use_batchnorm': False, 'use_dropout': False, 'mlp_size_1': 6, 'mlp_size_2': 0, 'mlp_size_3': 1, 'kernel': 'LogLogistic', 'loss_name': 'NLLLoss'}. Best is trial 530 with value: 0.7027982899957603.[0m
[32m[I 2022-04-23 00:20:37,988][0m Trial 576 finished with value: 0.6838789435960753 and parameters: {'n_hidden': 64, 'mixture_components': 5, 'use_sparse_layer': False, 'use_batchnorm': False, 'use_dropout': False, 'mlp_size_1': 3, 'mlp_size_2': 0, 'mlp_size_3': 0, 'kernel': 'Logistic', 'loss_name': 'NLLLoss'}. Best is trial 530 with value: 0.7027982899957603.[0m
[32m[I 2022-04-23 00:21:19,813][0m Trial 577 finished with value: 0.6677223917649641 and parameters: {'n_hidden': 512, 'mixture_components': 2, 'use_sparse_layer': False, 'use_batchnorm': False, 'use_dropout': False, 'mlp_size_1': 6, 'mlp_size_2': 0, 'mlp_size_3': 0, 'kernel': 'Normal', 'loss_name': 'NLLLoss'}. Best is trial 530 with value: 0.7027982899957603.[0m
[32m[I 2022-04-23 00:22:04,567][0m Trial 578 finished with value: 0.6885312403460152 and parameters: {'n_hidden': 1024, 'mixture_components': 3, 'use_sparse_layer': False, 'use_batchnorm': False, 'use_dropout': False, 'mlp_size_1': 5, 'mlp_size_2': 2, 'mlp_size_3': 0, 'kernel': 'Gumbel', 'loss_name': 'NLLLoss'}. Best is trial 530 with value: 0.7027982899957603.[0m
[32m[I 2022-04-23 00:22:44,632][0m Trial 579 finished with value: 0.6891902124200804 and parameters: {'n_hidden': 1024, 'mixture_components': 2, 'use_sparse_layer': False, 'use_batchnorm': False, 'use_dropout': False, 'mlp_size_1': 6, 'mlp_size_2': 0, 'mlp_size_3': 1, 'kernel': 'Normal', 'loss_name': 'NLLLoss'}. Best is trial 530 with value: 0.7027982899957603.[0m
[32m[I 2022-04-23 00:23:35,910][0m Trial 580 finished with value: 0.6734164262005035 and parameters: {'n_hidden': 1024, 'mixture_components': 8, 'use_sparse_layer': False, 'use_batchnorm': False, 'use_dropout': False, 'mlp_size_1': 6, 'mlp_size_2': 0, 'mlp_size_3': 1, 'kernel': 'Logistic', 'loss_name': 'AlternativeNLLLoss'}. Best is trial 530 with value: 0.7027982899957603.[0m
[32m[I 2022-04-23 00:24:50,891][0m Trial 581 finished with value: 0.6408459403429927 and parameters: {'n_hidden': 2048, 'mixture_components': 1, 'use_sparse_layer': False, 'use_batchnorm': False, 'use_dropout': True, 'dropout': 0.799547340912397, 'mlp_size_1': 5, 'mlp_size_2': 2, 'mlp_size_3': 1, 'kernel': 'Normal', 'loss_name': 'NLLLoss'}. Best is trial 530 with value: 0.7027982899957603.[0m
[32m[I 2022-04-23 00:25:23,021][0m Trial 582 finished with value: 0.6803225928377783 and parameters: {'n_hidden': 1024, 'mixture_components': 7, 'use_sparse_layer': False, 'use_batchnorm': False, 'use_dropout': False, 'mlp_size_1': 6, 'mlp_size_2': 0, 'mlp_size_3': 1, 'kernel': 'Gumbel', 'loss_name': 'NLLLoss'}. Best is trial 530 with value: 0.7027982899957603.[0m
[32m[I 2022-04-23 00:26:35,391][0m Trial 583 finished with value: 0.6729886084846978 and parameters: {'n_hidden': 1024, 'mixture_components': 9, 'use_sparse_layer': True, 'use_sparse_loss': True, 'lmbd': 8.481765337151889e-05, 'use_batchnorm': False, 'use_dropout': False, 'mlp_size_1': 6, 'mlp_size_2': 0, 'mlp_size_3': 1, 'kernel': 'Normal', 'loss_name': 'CensoredNLLLoss'}. Best is trial 530 with value: 0.7027982899957603.[0m
[32m[I 2022-04-23 00:27:38,306][0m Trial 584 finished with value: 0.6752784044008725 and parameters: {'n_hidden': 1024, 'mixture_components': 3, 'use_sparse_layer': False, 'use_batchnorm': False, 'use_dropout': False, 'mlp_size_1': 6, 'mlp_size_2': 0, 'mlp_size_3': 1, 'kernel': 'LogLogistic', 'loss_name': 'NLLLoss'}. Best is trial 530 with value: 0.7027982899957603.[0m
[32m[I 2022-04-23 00:28:11,465][0m Trial 585 finished with value: 0.6597033859652066 and parameters: {'n_hidden': 1024, 'mixture_components': 10, 'use_sparse_layer': False, 'use_batchnorm': False, 'use_dropout': False, 'mlp_size_1': 6, 'mlp_size_2': 0, 'mlp_size_3': 1, 'kernel': 'Gumbel', 'loss_name': 'NLLLoss'}. Best is trial 530 with value: 0.7027982899957603.[0m
[32m[I 2022-04-23 00:29:54,031][0m Trial 586 finished with value: 0.6464192343722341 and parameters: {'n_hidden': 1024, 'mixture_components': 2, 'use_sparse_layer': False, 'use_batchnorm': True, 'use_dropout': False, 'mlp_size_1': 6, 'mlp_size_2': 0, 'mlp_size_3': 1, 'kernel': 'Normal', 'loss_name': 'AlternativeNLLLoss'}. Best is trial 530 with value: 0.7027982899957603.[0m
[32m[I 2022-04-23 00:30:40,215][0m Trial 587 finished with value: 0.6839830656090438 and parameters: {'n_hidden': 1024, 'mixture_components': 8, 'use_sparse_layer': False, 'use_batchnorm': False, 'use_dropout': False, 'mlp_size_1': 6, 'mlp_size_2': 0, 'mlp_size_3': 1, 'kernel': 'Logistic', 'loss_name': 'NLLLoss'}. Best is trial 530 with value: 0.7027982899957603.[0m
[32m[I 2022-04-23 00:31:13,477][0m Trial 588 finished with value: 0.6742107650670167 and parameters: {'n_hidden': 1024, 'mixture_components': 9, 'use_sparse_layer': False, 'use_batchnorm': False, 'use_dropout': False, 'mlp_size_1': 6, 'mlp_size_2': 0, 'mlp_size_3': 1, 'kernel': 'Exponential', 'loss_name': 'NLLLoss'}. Best is trial 530 with value: 0.7027982899957603.[0m
[32m[I 2022-04-23 00:31:55,284][0m Trial 589 finished with value: 0.6833939791815541 and parameters: {'n_hidden': 1024, 'mixture_components': 3, 'use_sparse_layer': False, 'use_batchnorm': False, 'use_dropout': False, 'mlp_size_1': 6, 'mlp_size_2': 0, 'mlp_size_3': 1, 'kernel': 'Normal', 'loss_name': 'NLLLoss'}. Best is trial 530 with value: 0.7027982899957603.[0m
[32m[I 2022-04-23 00:32:45,513][0m Trial 590 finished with value: 0.619920503762477 and parameters: {'n_hidden': 512, 'mixture_components': 4, 'use_sparse_layer': False, 'use_batchnorm': False, 'use_dropout': False, 'mlp_size_1': 6, 'mlp_size_2': 0, 'mlp_size_3': 0, 'kernel': 'Gumbel', 'loss_name': 'NLLLoss'}. Best is trial 530 with value: 0.7027982899957603.[0m
[32m[I 2022-04-23 00:33:35,005][0m Trial 591 finished with value: 0.6802770316562823 and parameters: {'n_hidden': 1024, 'mixture_components': 2, 'use_sparse_layer': False, 'use_batchnorm': False, 'use_dropout': False, 'mlp_size_1': 7, 'mlp_size_2': 0, 'mlp_size_3': 0, 'kernel': 'Normal', 'loss_name': 'AlternativeNLLLoss'}. Best is trial 530 with value: 0.7027982899957603.[0m
[32m[I 2022-04-23 00:34:14,156][0m Trial 592 finished with value: 0.6830794428335165 and parameters: {'n_hidden': 32, 'mixture_components': 5, 'use_sparse_layer': False, 'use_batchnorm': False, 'use_dropout': False, 'mlp_size_1': 2, 'mlp_size_2': 0, 'mlp_size_3': 0, 'kernel': 'Logistic', 'loss_name': 'NLLLoss'}. Best is trial 530 with value: 0.7027982899957603.[0m
[32m[I 2022-04-23 00:35:02,664][0m Trial 593 finished with value: 0.6388293858410837 and parameters: {'n_hidden': 1024, 'mixture_components': 8, 'use_sparse_layer': False, 'use_batchnorm': False, 'use_dropout': False, 'mlp_size_1': 6, 'mlp_size_2': 0, 'mlp_size_3': 1, 'kernel': 'Normal', 'loss_name': 'NLLLoss'}. Best is trial 530 with value: 0.7027982899957603.[0m
[32m[I 2022-04-23 00:35:45,654][0m Trial 594 finished with value: 0.6824133609511823 and parameters: {'n_hidden': 1024, 'mixture_components': 3, 'use_sparse_layer': True, 'use_sparse_loss': False, 'use_batchnorm': False, 'use_dropout': False, 'mlp_size_1': 6, 'mlp_size_2': 0, 'mlp_size_3': 1, 'kernel': 'LogLogistic', 'loss_name': 'NLLLoss'}. Best is trial 530 with value: 0.7027982899957603.[0m
[32m[I 2022-04-23 00:36:40,456][0m Trial 595 finished with value: 0.6902027435975687 and parameters: {'n_hidden': 2048, 'mixture_components': 1, 'use_sparse_layer': False, 'use_batchnorm': False, 'use_dropout': False, 'mlp_size_1': 7, 'mlp_size_2': 0, 'mlp_size_3': 1, 'kernel': 'Gumbel', 'loss_name': 'NLLLoss'}. Best is trial 530 with value: 0.7027982899957603.[0m
[32m[I 2022-04-23 00:37:44,312][0m Trial 596 finished with value: 0.6827443096898128 and parameters: {'n_hidden': 1024, 'mixture_components': 2, 'use_sparse_layer': False, 'use_batchnorm': False, 'use_dropout': False, 'mlp_size_1': 6, 'mlp_size_2': 0, 'mlp_size_3': 1, 'kernel': 'Normal', 'loss_name': 'AlternativeNLLLoss'}. Best is trial 530 with value: 0.7027982899957603.[0m
[32m[I 2022-04-23 00:38:23,861][0m Trial 597 finished with value: 0.673652432734129 and parameters: {'n_hidden': 1024, 'mixture_components': 7, 'use_sparse_layer': False, 'use_batchnorm': False, 'use_dropout': False, 'mlp_size_1': 6, 'mlp_size_2': 0, 'mlp_size_3': 1, 'kernel': 'Normal', 'loss_name': 'NLLLoss'}. Best is trial 530 with value: 0.7027982899957603.[0m
[32m[I 2022-04-23 00:38:57,367][0m Trial 598 finished with value: 0.6673621876579622 and parameters: {'n_hidden': 1024, 'mixture_components': 9, 'use_sparse_layer': False, 'use_batchnorm': False, 'use_dropout': False, 'mlp_size_1': 6, 'mlp_size_2': 0, 'mlp_size_3': 1, 'kernel': 'Logistic', 'loss_name': 'NLLLoss'}. Best is trial 530 with value: 0.7027982899957603.[0m
[32m[I 2022-04-23 00:39:38,690][0m Trial 599 finished with value: 0.684004564860759 and parameters: {'n_hidden': 1024, 'mixture_components': 8, 'use_sparse_layer': False, 'use_batchnorm': False, 'use_dropout': False, 'mlp_size_1': 7, 'mlp_size_2': 0, 'mlp_size_3': 0, 'kernel': 'Gumbel', 'loss_name': 'NLLLoss'}. Best is trial 530 with value: 0.7027982899957603.[0m
[32m[I 2022-04-23 00:40:47,785][0m Trial 600 finished with value: 0.6709235015909186 and parameters: {'n_hidden': 1024, 'mixture_components': 3, 'use_sparse_layer': False, 'use_batchnorm': False, 'use_dropout': True, 'dropout': 0.05238473125893878, 'mlp_size_1': 6, 'mlp_size_2': 0, 'mlp_size_3': 1, 'kernel': 'Normal', 'loss_name': 'NLLLoss'}. Best is trial 530 with value: 0.7027982899957603.[0m
[32m[I 2022-04-23 00:41:29,804][0m Trial 601 finished with value: 0.6855825681035775 and parameters: {'n_hidden': 1024, 'mixture_components': 2, 'use_sparse_layer': False, 'use_batchnorm': False, 'use_dropout': False, 'mlp_size_1': 6, 'mlp_size_2': 0, 'mlp_size_3': 1, 'kernel': 'Logistic', 'loss_name': 'AlternativeNLLLoss'}. Best is trial 530 with value: 0.7027982899957603.[0m
[32m[I 2022-04-23 00:42:09,579][0m Trial 602 finished with value: 0.6750410154038422 and parameters: {'n_hidden': 1024, 'mixture_components': 4, 'use_sparse_layer': False, 'use_batchnorm': False, 'use_dropout': False, 'mlp_size_1': 6, 'mlp_size_2': 0, 'mlp_size_3': 1, 'kernel': 'Normal', 'loss_name': 'NLLLoss'}. Best is trial 530 with value: 0.7027982899957603.[0m
[32m[I 2022-04-23 00:42:53,697][0m Trial 603 finished with value: 0.6816239142709732 and parameters: {'n_hidden': 128, 'mixture_components': 8, 'use_sparse_layer': False, 'use_batchnorm': False, 'use_dropout': False, 'mlp_size_1': 4, 'mlp_size_2': 0, 'mlp_size_3': 0, 'kernel': 'Gumbel', 'loss_name': 'NLLLoss'}. Best is trial 530 with value: 0.7027982899957603.[0m
[32m[I 2022-04-23 00:43:38,658][0m Trial 604 finished with value: 0.6909797839032821 and parameters: {'n_hidden': 1024, 'mixture_components': 10, 'use_sparse_layer': False, 'use_batchnorm': False, 'use_dropout': False, 'mlp_size_1': 6, 'mlp_size_2': 0, 'mlp_size_3': 1, 'kernel': 'LogLogistic', 'loss_name': 'NLLLoss'}. Best is trial 530 with value: 0.7027982899957603.[0m
[32m[I 2022-04-23 00:44:23,717][0m Trial 605 finished with value: 0.6566125697542746 and parameters: {'n_hidden': 1024, 'mixture_components': 9, 'use_sparse_layer': True, 'use_sparse_loss': True, 'lmbd': 1.8254306640711283e-06, 'use_batchnorm': False, 'use_dropout': False, 'mlp_size_1': 7, 'mlp_size_2': 0, 'mlp_size_3': 0, 'kernel': 'Normal', 'loss_name': 'NLLLoss'}. Best is trial 530 with value: 0.7027982899957603.[0m
[32m[I 2022-04-23 00:45:09,132][0m Trial 606 finished with value: 0.6699881980854705 and parameters: {'n_hidden': 512, 'mixture_components': 2, 'use_sparse_layer': False, 'use_batchnorm': False, 'use_dropout': False, 'mlp_size_1': 6, 'mlp_size_2': 0, 'mlp_size_3': 0, 'kernel': 'Logistic', 'loss_name': 'CensoredNLLLoss'}. Best is trial 530 with value: 0.7027982899957603.[0m
[32m[I 2022-04-23 00:47:24,233][0m Trial 607 finished with value: 0.604726542869451 and parameters: {'n_hidden': 1024, 'mixture_components': 6, 'use_sparse_layer': False, 'use_batchnorm': True, 'use_dropout': False, 'mlp_size_1': 5, 'mlp_size_2': 1, 'mlp_size_3': 1, 'kernel': 'Normal', 'loss_name': 'NLLLoss'}. Best is trial 530 with value: 0.7027982899957603.[0m
[32m[I 2022-04-23 00:48:28,018][0m Trial 608 finished with value: 0.6807276994197056 and parameters: {'n_hidden': 64, 'mixture_components': 3, 'use_sparse_layer': False, 'use_batchnorm': False, 'use_dropout': False, 'mlp_size_1': 3, 'mlp_size_2': 0, 'mlp_size_3': 0, 'kernel': 'Gumbel', 'loss_name': 'AlternativeNLLLoss'}. Best is trial 530 with value: 0.7027982899957603.[0m
[32m[I 2022-04-23 00:49:16,289][0m Trial 609 finished with value: 0.6742810319865612 and parameters: {'n_hidden': 1024, 'mixture_components': 8, 'use_sparse_layer': False, 'use_batchnorm': False, 'use_dropout': False, 'mlp_size_1': 6, 'mlp_size_2': 0, 'mlp_size_3': 1, 'kernel': 'Normal', 'loss_name': 'NLLLoss'}. Best is trial 530 with value: 0.7027982899957603.[0m
[32m[I 2022-04-23 00:50:02,360][0m Trial 610 finished with value: 0.6807899102740871 and parameters: {'n_hidden': 1024, 'mixture_components': 3, 'use_sparse_layer': False, 'use_batchnorm': False, 'use_dropout': False, 'mlp_size_1': 6, 'mlp_size_2': 0, 'mlp_size_3': 1, 'kernel': 'Logistic', 'loss_name': 'NLLLoss'}. Best is trial 530 with value: 0.7027982899957603.[0m
[32m[I 2022-04-23 00:51:23,494][0m Trial 611 finished with value: 0.6530019067386116 and parameters: {'n_hidden': 2048, 'mixture_components': 1, 'use_sparse_layer': False, 'use_batchnorm': False, 'use_dropout': False, 'mlp_size_1': 8, 'mlp_size_2': 0, 'mlp_size_3': 0, 'kernel': 'Gumbel', 'loss_name': 'NLLLoss'}. Best is trial 530 with value: 0.7027982899957603.[0m
[32m[I 2022-04-23 00:52:17,033][0m Trial 612 finished with value: 0.687726770172483 and parameters: {'n_hidden': 1024, 'mixture_components': 2, 'use_sparse_layer': False, 'use_batchnorm': False, 'use_dropout': False, 'mlp_size_1': 6, 'mlp_size_2': 0, 'mlp_size_3': 1, 'kernel': 'Normal', 'loss_name': 'NLLLoss'}. Best is trial 530 with value: 0.7027982899957603.[0m
[32m[I 2022-04-23 00:52:48,495][0m Trial 613 finished with value: -0.6723744092210829 and parameters: {'n_hidden': 1024, 'mixture_components': 7, 'use_sparse_layer': False, 'use_batchnorm': False, 'use_dropout': False, 'mlp_size_1': 6, 'mlp_size_2': 0, 'mlp_size_3': 1, 'kernel': 'Exponential', 'loss_name': 'AlternativeNLLLoss'}. Best is trial 530 with value: 0.7027982899957603.[0m
[32m[I 2022-04-23 00:53:30,370][0m Trial 614 finished with value: 0.6729661934038065 and parameters: {'n_hidden': 1024, 'mixture_components': 9, 'use_sparse_layer': False, 'use_batchnorm': False, 'use_dropout': False, 'mlp_size_1': 6, 'mlp_size_2': 0, 'mlp_size_3': 1, 'kernel': 'LogLogistic', 'loss_name': 'NLLLoss'}. Best is trial 530 with value: 0.7027982899957603.[0m
[32m[I 2022-04-23 00:54:09,624][0m Trial 615 finished with value: 0.6470244722740981 and parameters: {'n_hidden': 1024, 'mixture_components': 8, 'use_sparse_layer': False, 'use_batchnorm': False, 'use_dropout': False, 'mlp_size_1': 6, 'mlp_size_2': 0, 'mlp_size_3': 1, 'kernel': 'Normal', 'loss_name': 'NLLLoss'}. Best is trial 530 with value: 0.7027982899957603.[0m
[32m[I 2022-04-23 00:54:44,405][0m Trial 616 finished with value: 0.667894797273446 and parameters: {'n_hidden': 1024, 'mixture_components': 3, 'use_sparse_layer': True, 'use_sparse_loss': False, 'use_batchnorm': False, 'use_dropout': False, 'mlp_size_1': 7, 'mlp_size_2': 0, 'mlp_size_3': 0, 'kernel': 'Gumbel', 'loss_name': 'NLLLoss'}. Best is trial 530 with value: 0.7027982899957603.[0m
[32m[I 2022-04-23 00:55:33,729][0m Trial 617 finished with value: 0.6848230258543981 and parameters: {'n_hidden': 1024, 'mixture_components': 2, 'use_sparse_layer': False, 'use_batchnorm': False, 'use_dropout': False, 'mlp_size_1': 6, 'mlp_size_2': 0, 'mlp_size_3': 1, 'kernel': 'Logistic', 'loss_name': 'NLLLoss'}. Best is trial 530 with value: 0.7027982899957603.[0m
[32m[I 2022-04-23 00:56:37,317][0m Trial 618 finished with value: 0.6806264482144855 and parameters: {'n_hidden': 1024, 'mixture_components': 4, 'use_sparse_layer': False, 'use_batchnorm': False, 'use_dropout': False, 'mlp_size_1': 6, 'mlp_size_2': 0, 'mlp_size_3': 1, 'kernel': 'Normal', 'loss_name': 'AlternativeNLLLoss'}. Best is trial 530 with value: 0.7027982899957603.[0m
[32m[I 2022-04-23 00:57:34,142][0m Trial 619 finished with value: 0.6884708389566494 and parameters: {'n_hidden': 32, 'mixture_components': 6, 'use_sparse_layer': False, 'use_batchnorm': False, 'use_dropout': False, 'mlp_size_1': 2, 'mlp_size_2': 0, 'mlp_size_3': 0, 'kernel': 'Normal', 'loss_name': 'NLLLoss'}. Best is trial 530 with value: 0.7027982899957603.[0m
[32m[I 2022-04-23 00:58:06,562][0m Trial 620 finished with value: 0.6883908605373286 and parameters: {'n_hidden': 1024, 'mixture_components': 8, 'use_sparse_layer': False, 'use_batchnorm': False, 'use_dropout': True, 'dropout': 0.34722791571253925, 'mlp_size_1': 5, 'mlp_size_2': 1, 'mlp_size_3': 1, 'kernel': 'Gumbel', 'loss_name': 'NLLLoss'}. Best is trial 530 with value: 0.7027982899957603.[0m
