[32m[I 2022-04-21 19:26:29,655][0m Trial 162 finished with value: 0.8363691373784526 and parameters: {'n_hidden': 256, 'mixture_components': 5, 'use_sparse_layer': True, 'use_sparse_loss': False, 'use_batchnorm': True, 'use_dropout': True, 'dropout': 0.5185346372594275, 'mlp_size_1': 0, 'mlp_size_2': 5, 'mlp_size_3': 0, 'kernel': 'Logistic', 'loss_name': 'NLLLoss'}. Best is trial 22 with value: 0.8433318468070169.[0m
[32m[I 2022-04-21 19:31:35,167][0m Trial 163 finished with value: 0.8269807346565049 and parameters: {'n_hidden': 256, 'mixture_components': 5, 'use_sparse_layer': True, 'use_sparse_loss': False, 'use_batchnorm': True, 'use_dropout': True, 'dropout': 0.510755096479471, 'mlp_size_1': 0, 'mlp_size_2': 5, 'mlp_size_3': 0, 'kernel': 'Logistic', 'loss_name': 'NLLLoss'}. Best is trial 22 with value: 0.8433318468070169.[0m
[32m[I 2022-04-21 19:37:25,497][0m Trial 164 finished with value: 0.8326496126558194 and parameters: {'n_hidden': 256, 'mixture_components': 5, 'use_sparse_layer': True, 'use_sparse_loss': False, 'use_batchnorm': True, 'use_dropout': True, 'dropout': 0.548101243152214, 'mlp_size_1': 0, 'mlp_size_2': 5, 'mlp_size_3': 0, 'kernel': 'Logistic', 'loss_name': 'NLLLoss'}. Best is trial 22 with value: 0.8433318468070169.[0m
[32m[I 2022-04-21 19:43:33,281][0m Trial 165 finished with value: 0.8295816518497693 and parameters: {'n_hidden': 256, 'mixture_components': 4, 'use_sparse_layer': True, 'use_sparse_loss': False, 'use_batchnorm': True, 'use_dropout': True, 'dropout': 0.6588373015074781, 'mlp_size_1': 0, 'mlp_size_2': 5, 'mlp_size_3': 0, 'kernel': 'Logistic', 'loss_name': 'NLLLoss'}. Best is trial 22 with value: 0.8433318468070169.[0m
[32m[I 2022-04-21 19:49:30,760][0m Trial 166 finished with value: 0.8334449798668236 and parameters: {'n_hidden': 256, 'mixture_components': 5, 'use_sparse_layer': True, 'use_sparse_loss': False, 'use_batchnorm': True, 'use_dropout': True, 'dropout': 0.5866464166089338, 'mlp_size_1': 0, 'mlp_size_2': 5, 'mlp_size_3': 0, 'kernel': 'Logistic', 'loss_name': 'NLLLoss'}. Best is trial 22 with value: 0.8433318468070169.[0m
[32m[I 2022-04-21 19:55:31,891][0m Trial 167 finished with value: 0.8279495163902999 and parameters: {'n_hidden': 256, 'mixture_components': 5, 'use_sparse_layer': True, 'use_sparse_loss': False, 'use_batchnorm': True, 'use_dropout': True, 'dropout': 0.4799800755611894, 'mlp_size_1': 0, 'mlp_size_2': 5, 'mlp_size_3': 0, 'kernel': 'Logistic', 'loss_name': 'NLLLoss'}. Best is trial 22 with value: 0.8433318468070169.[0m
[32m[I 2022-04-21 20:02:22,375][0m Trial 168 finished with value: 0.7342118664019018 and parameters: {'n_hidden': 256, 'mixture_components': 4, 'use_sparse_layer': True, 'use_sparse_loss': False, 'use_batchnorm': True, 'use_dropout': True, 'dropout': 0.6196013557660867, 'mlp_size_1': 0, 'mlp_size_2': 5, 'mlp_size_3': 0, 'kernel': 'Logistic', 'loss_name': 'CensoredNLLLoss'}. Best is trial 22 with value: 0.8433318468070169.[0m
[32m[I 2022-04-21 20:07:34,320][0m Trial 169 finished with value: 0.8326057098360206 and parameters: {'n_hidden': 256, 'mixture_components': 5, 'use_sparse_layer': True, 'use_sparse_loss': False, 'use_batchnorm': True, 'use_dropout': True, 'dropout': 0.5583932566610382, 'mlp_size_1': 0, 'mlp_size_2': 5, 'mlp_size_3': 0, 'kernel': 'Logistic', 'loss_name': 'NLLLoss'}. Best is trial 22 with value: 0.8433318468070169.[0m
[32m[I 2022-04-21 20:11:37,547][0m Trial 170 finished with value: 0.6269836313660088 and parameters: {'n_hidden': 256, 'mixture_components': 2, 'use_sparse_layer': True, 'use_sparse_loss': False, 'use_batchnorm': True, 'use_dropout': True, 'dropout': 0.07626098662146882, 'mlp_size_1': 0, 'mlp_size_2': 5, 'mlp_size_3': 0, 'kernel': 'Logistic', 'loss_name': 'NLLLoss'}. Best is trial 22 with value: 0.8433318468070169.[0m
[32m[I 2022-04-21 20:17:10,014][0m Trial 171 finished with value: 0.8266349313153173 and parameters: {'n_hidden': 256, 'mixture_components': 5, 'use_sparse_layer': True, 'use_sparse_loss': False, 'use_batchnorm': True, 'use_dropout': True, 'dropout': 0.7242257499872713, 'mlp_size_1': 0, 'mlp_size_2': 5, 'mlp_size_3': 0, 'kernel': 'Normal', 'loss_name': 'NLLLoss'}. Best is trial 22 with value: 0.8433318468070169.[0m
[32m[I 2022-04-21 20:22:33,891][0m Trial 172 finished with value: 0.7302518725246947 and parameters: {'n_hidden': 256, 'mixture_components': 5, 'use_sparse_layer': True, 'use_sparse_loss': False, 'use_batchnorm': True, 'use_dropout': True, 'dropout': 0.16906094885840917, 'mlp_size_1': 0, 'mlp_size_2': 5, 'mlp_size_3': 0, 'kernel': 'LogLogistic', 'loss_name': 'NLLLoss'}. Best is trial 22 with value: 0.8433318468070169.[0m
[32m[I 2022-04-21 20:28:17,163][0m Trial 173 finished with value: 0.826628448977301 and parameters: {'n_hidden': 256, 'mixture_components': 5, 'use_sparse_layer': True, 'use_sparse_loss': False, 'use_batchnorm': True, 'use_dropout': True, 'dropout': 0.6742853573387863, 'mlp_size_1': 0, 'mlp_size_2': 4, 'mlp_size_3': 0, 'kernel': 'Logistic', 'loss_name': 'NLLLoss'}. Best is trial 22 with value: 0.8433318468070169.[0m
[32m[I 2022-04-21 20:33:44,838][0m Trial 174 finished with value: 0.824270161327048 and parameters: {'n_hidden': 256, 'mixture_components': 5, 'use_sparse_layer': True, 'use_sparse_loss': False, 'use_batchnorm': True, 'use_dropout': True, 'dropout': 0.7420791203117274, 'mlp_size_1': 0, 'mlp_size_2': 5, 'mlp_size_3': 0, 'kernel': 'Normal', 'loss_name': 'NLLLoss'}. Best is trial 22 with value: 0.8433318468070169.[0m
[32m[I 2022-04-21 20:38:27,597][0m Trial 175 finished with value: 0.8315668989120866 and parameters: {'n_hidden': 256, 'mixture_components': 5, 'use_sparse_layer': True, 'use_sparse_loss': False, 'use_batchnorm': True, 'use_dropout': True, 'dropout': 0.5988949751416454, 'mlp_size_1': 0, 'mlp_size_2': 4, 'mlp_size_3': 0, 'kernel': 'Exponential', 'loss_name': 'NLLLoss'}. Best is trial 22 with value: 0.8433318468070169.[0m
[32m[I 2022-04-21 20:43:56,927][0m Trial 176 finished with value: 0.8347697050804708 and parameters: {'n_hidden': 256, 'mixture_components': 5, 'use_sparse_layer': True, 'use_sparse_loss': False, 'use_batchnorm': True, 'use_dropout': True, 'dropout': 0.8298045152055236, 'mlp_size_1': 0, 'mlp_size_2': 5, 'mlp_size_3': 0, 'kernel': 'Exponential', 'loss_name': 'NLLLoss'}. Best is trial 22 with value: 0.8433318468070169.[0m
[32m[I 2022-04-21 20:49:40,006][0m Trial 177 finished with value: 0.8345295784489115 and parameters: {'n_hidden': 512, 'mixture_components': 6, 'use_sparse_layer': True, 'use_sparse_loss': False, 'use_batchnorm': True, 'use_dropout': True, 'dropout': 0.8001675553117418, 'mlp_size_1': 0, 'mlp_size_2': 6, 'mlp_size_3': 0, 'kernel': 'Exponential', 'loss_name': 'NLLLoss'}. Best is trial 22 with value: 0.8433318468070169.[0m
[32m[I 2022-04-21 20:51:31,625][0m Trial 178 finished with value: -0.5 and parameters: {'n_hidden': 256, 'mixture_components': 5, 'use_sparse_layer': True, 'use_sparse_loss': False, 'use_batchnorm': True, 'use_dropout': True, 'dropout': 0.9197746091730946, 'mlp_size_1': 3, 'mlp_size_2': 1, 'mlp_size_3': 0, 'kernel': 'Gumbel', 'loss_name': 'CensoredNLLLoss'}. Best is trial 22 with value: 0.8433318468070169.[0m
[32m[I 2022-04-21 20:57:11,870][0m Trial 179 finished with value: 0.7093845095664177 and parameters: {'n_hidden': 256, 'mixture_components': 6, 'use_sparse_layer': True, 'use_sparse_loss': False, 'use_batchnorm': True, 'use_dropout': True, 'dropout': 0.18018405515902808, 'mlp_size_1': 3, 'mlp_size_2': 1, 'mlp_size_3': 0, 'kernel': 'Normal', 'loss_name': 'NLLLoss'}. Best is trial 22 with value: 0.8433318468070169.[0m
[32m[I 2022-04-21 21:01:56,743][0m Trial 180 finished with value: 0.725654206571706 and parameters: {'n_hidden': 2048, 'mixture_components': 4, 'use_sparse_layer': True, 'use_sparse_loss': False, 'use_batchnorm': True, 'use_dropout': True, 'dropout': 0.5208318129964998, 'mlp_size_1': 4, 'mlp_size_2': 4, 'mlp_size_3': 0, 'kernel': 'Exponential', 'loss_name': 'NLLLoss'}. Best is trial 22 with value: 0.8433318468070169.[0m
[32m[I 2022-04-21 21:06:40,938][0m Trial 181 finished with value: 0.8319910049046537 and parameters: {'n_hidden': 512, 'mixture_components': 6, 'use_sparse_layer': True, 'use_sparse_loss': False, 'use_batchnorm': True, 'use_dropout': True, 'dropout': 0.7766492784883963, 'mlp_size_1': 0, 'mlp_size_2': 6, 'mlp_size_3': 0, 'kernel': 'Exponential', 'loss_name': 'NLLLoss'}. Best is trial 22 with value: 0.8433318468070169.[0m
[32m[I 2022-04-21 21:11:31,098][0m Trial 182 finished with value: 0.8344085175067126 and parameters: {'n_hidden': 512, 'mixture_components': 6, 'use_sparse_layer': True, 'use_sparse_loss': False, 'use_batchnorm': True, 'use_dropout': True, 'dropout': 0.8197191530073724, 'mlp_size_1': 0, 'mlp_size_2': 6, 'mlp_size_3': 0, 'kernel': 'Exponential', 'loss_name': 'NLLLoss'}. Best is trial 22 with value: 0.8433318468070169.[0m
[32m[I 2022-04-21 21:15:57,658][0m Trial 183 finished with value: 0.8369440787843434 and parameters: {'n_hidden': 512, 'mixture_components': 6, 'use_sparse_layer': True, 'use_sparse_loss': False, 'use_batchnorm': True, 'use_dropout': True, 'dropout': 0.650582993485298, 'mlp_size_1': 0, 'mlp_size_2': 6, 'mlp_size_3': 0, 'kernel': 'Exponential', 'loss_name': 'NLLLoss'}. Best is trial 22 with value: 0.8433318468070169.[0m
[32m[I 2022-04-21 21:20:33,228][0m Trial 184 finished with value: 0.8344467832814854 and parameters: {'n_hidden': 512, 'mixture_components': 5, 'use_sparse_layer': True, 'use_sparse_loss': False, 'use_batchnorm': True, 'use_dropout': True, 'dropout': 0.6534802510610265, 'mlp_size_1': 0, 'mlp_size_2': 6, 'mlp_size_3': 0, 'kernel': 'Exponential', 'loss_name': 'NLLLoss'}. Best is trial 22 with value: 0.8433318468070169.[0m
[32m[I 2022-04-21 21:22:27,307][0m Trial 185 finished with value: 0.2677612581782475 and parameters: {'n_hidden': 32, 'mixture_components': 6, 'use_sparse_layer': True, 'use_sparse_loss': False, 'use_batchnorm': True, 'use_dropout': True, 'dropout': 0.8667189177287555, 'mlp_size_1': 2, 'mlp_size_2': 0, 'mlp_size_3': 0, 'kernel': 'Exponential', 'loss_name': 'NLLLoss'}. Best is trial 22 with value: 0.8433318468070169.[0m
[32m[I 2022-04-21 21:26:52,916][0m Trial 186 finished with value: 0.827340817017312 and parameters: {'n_hidden': 256, 'mixture_components': 5, 'use_sparse_layer': True, 'use_sparse_loss': False, 'use_batchnorm': True, 'use_dropout': True, 'dropout': 0.11704030673637585, 'mlp_size_1': 0, 'mlp_size_2': 5, 'mlp_size_3': 0, 'kernel': 'Exponential', 'loss_name': 'NLLLoss'}. Best is trial 22 with value: 0.8433318468070169.[0m
[32m[I 2022-04-21 21:32:34,410][0m Trial 187 finished with value: 0.8260732971425335 and parameters: {'n_hidden': 64, 'mixture_components': 6, 'use_sparse_layer': True, 'use_sparse_loss': True, 'lmbd': 0.009381219674164559, 'use_batchnorm': True, 'use_dropout': True, 'dropout': 0.6111466264752751, 'mlp_size_1': 0, 'mlp_size_2': 3, 'mlp_size_3': 0, 'kernel': 'Normal', 'loss_name': 'NLLLoss'}. Best is trial 22 with value: 0.8433318468070169.[0m
[32m[I 2022-04-21 21:34:43,850][0m Trial 188 finished with value: -0.33732596568207385 and parameters: {'n_hidden': 256, 'mixture_components': 5, 'use_sparse_layer': True, 'use_sparse_loss': False, 'use_batchnorm': True, 'use_dropout': True, 'dropout': 0.5437807985824172, 'mlp_size_1': 3, 'mlp_size_2': 1, 'mlp_size_3': 0, 'kernel': 'Exponential', 'loss_name': 'CensoredNLLLoss'}. Best is trial 22 with value: 0.8433318468070169.[0m
[32m[I 2022-04-21 21:40:09,302][0m Trial 189 finished with value: 0.8346963291765379 and parameters: {'n_hidden': 256, 'mixture_components': 5, 'use_sparse_layer': True, 'use_sparse_loss': False, 'use_batchnorm': True, 'use_dropout': True, 'dropout': 0.5659261369149124, 'mlp_size_1': 0, 'mlp_size_2': 5, 'mlp_size_3': 0, 'kernel': 'Logistic', 'loss_name': 'NLLLoss'}. Best is trial 22 with value: 0.8433318468070169.[0m
[32m[I 2022-04-21 21:47:21,664][0m Trial 190 finished with value: 0.7317564152574114 and parameters: {'n_hidden': 512, 'mixture_components': 5, 'use_sparse_layer': True, 'use_sparse_loss': False, 'use_batchnorm': True, 'use_dropout': True, 'dropout': 0.5745391756079667, 'mlp_size_1': 0, 'mlp_size_2': 5, 'mlp_size_3': 0, 'kernel': 'Logistic', 'loss_name': 'AlternativeNLLLoss'}. Best is trial 22 with value: 0.8433318468070169.[0m
[32m[I 2022-04-21 21:52:38,758][0m Trial 191 finished with value: 0.8288605691478594 and parameters: {'n_hidden': 256, 'mixture_components': 5, 'use_sparse_layer': True, 'use_sparse_loss': False, 'use_batchnorm': True, 'use_dropout': True, 'dropout': 0.4932725836615254, 'mlp_size_1': 0, 'mlp_size_2': 5, 'mlp_size_3': 0, 'kernel': 'Logistic', 'loss_name': 'NLLLoss'}. Best is trial 22 with value: 0.8433318468070169.[0m
[32m[I 2022-04-21 21:59:27,119][0m Trial 192 finished with value: 0.8245734933184032 and parameters: {'n_hidden': 256, 'mixture_components': 5, 'use_sparse_layer': True, 'use_sparse_loss': False, 'use_batchnorm': True, 'use_dropout': True, 'dropout': 0.6498174284965132, 'mlp_size_1': 0, 'mlp_size_2': 5, 'mlp_size_3': 0, 'kernel': 'Logistic', 'loss_name': 'NLLLoss'}. Best is trial 22 with value: 0.8433318468070169.[0m
[32m[I 2022-04-21 22:05:10,802][0m Trial 193 finished with value: 0.724902087756642 and parameters: {'n_hidden': 256, 'mixture_components': 6, 'use_sparse_layer': True, 'use_sparse_loss': False, 'use_batchnorm': True, 'use_dropout': True, 'dropout': 0.4506559233414757, 'mlp_size_1': 0, 'mlp_size_2': 5, 'mlp_size_3': 0, 'kernel': 'Logistic', 'loss_name': 'NLLLoss'}. Best is trial 22 with value: 0.8433318468070169.[0m
[32m[I 2022-04-21 22:09:27,164][0m Trial 194 finished with value: 0.8234320976339337 and parameters: {'n_hidden': 256, 'mixture_components': 5, 'use_sparse_layer': True, 'use_sparse_loss': False, 'use_batchnorm': True, 'use_dropout': True, 'dropout': 0.4094511575705841, 'mlp_size_1': 3, 'mlp_size_2': 1, 'mlp_size_3': 0, 'kernel': 'Exponential', 'loss_name': 'NLLLoss'}. Best is trial 22 with value: 0.8433318468070169.[0m
[32m[I 2022-04-21 22:14:58,091][0m Trial 195 finished with value: 0.8329435044012644 and parameters: {'n_hidden': 256, 'mixture_components': 5, 'use_sparse_layer': True, 'use_sparse_loss': False, 'use_batchnorm': True, 'use_dropout': True, 'dropout': 0.6777962255277804, 'mlp_size_1': 0, 'mlp_size_2': 5, 'mlp_size_3': 0, 'kernel': 'Logistic', 'loss_name': 'NLLLoss'}. Best is trial 22 with value: 0.8433318468070169.[0m
[32m[I 2022-04-21 22:19:20,324][0m Trial 196 finished with value: 0.8256595879331872 and parameters: {'n_hidden': 1024, 'mixture_components': 6, 'use_sparse_layer': True, 'use_sparse_loss': False, 'use_batchnorm': True, 'use_dropout': True, 'dropout': 0.6278881468092912, 'mlp_size_1': 2, 'mlp_size_2': 5, 'mlp_size_3': 0, 'kernel': 'Exponential', 'loss_name': 'NLLLoss'}. Best is trial 22 with value: 0.8433318468070169.[0m
[32m[I 2022-04-21 22:24:15,207][0m Trial 197 finished with value: 0.7171925424916699 and parameters: {'n_hidden': 256, 'mixture_components': 4, 'use_sparse_layer': True, 'use_sparse_loss': False, 'use_batchnorm': True, 'use_dropout': True, 'dropout': 0.12948092994143245, 'mlp_size_1': 3, 'mlp_size_2': 1, 'mlp_size_3': 0, 'kernel': 'Normal', 'loss_name': 'NLLLoss'}. Best is trial 22 with value: 0.8433318468070169.[0m
[32m[I 2022-04-21 22:26:15,275][0m Trial 198 finished with value: -0.23349537936282472 and parameters: {'n_hidden': 64, 'mixture_components': 9, 'use_sparse_layer': True, 'use_sparse_loss': False, 'use_batchnorm': True, 'use_dropout': True, 'dropout': 0.5310693027178072, 'mlp_size_1': 0, 'mlp_size_2': 3, 'mlp_size_3': 0, 'kernel': 'Exponential', 'loss_name': 'CensoredNLLLoss'}. Best is trial 22 with value: 0.8433318468070169.[0m
[32m[I 2022-04-21 22:30:51,307][0m Trial 199 finished with value: 0.8345415557598708 and parameters: {'n_hidden': 256, 'mixture_components': 5, 'use_sparse_layer': True, 'use_sparse_loss': False, 'use_batchnorm': True, 'use_dropout': True, 'dropout': 0.6007107203358854, 'mlp_size_1': 0, 'mlp_size_2': 5, 'mlp_size_3': 0, 'kernel': 'Exponential', 'loss_name': 'NLLLoss'}. Best is trial 22 with value: 0.8433318468070169.[0m
[32m[I 2022-04-21 22:36:17,558][0m Trial 200 finished with value: 0.8379524124553915 and parameters: {'n_hidden': 256, 'mixture_components': 5, 'use_sparse_layer': True, 'use_sparse_loss': False, 'use_batchnorm': True, 'use_dropout': True, 'dropout': 0.5726480676343377, 'mlp_size_1': 0, 'mlp_size_2': 5, 'mlp_size_3': 0, 'kernel': 'Logistic', 'loss_name': 'NLLLoss'}. Best is trial 22 with value: 0.8433318468070169.[0m
[32m[I 2022-04-21 22:41:55,321][0m Trial 201 finished with value: 0.7198789660742912 and parameters: {'n_hidden': 256, 'mixture_components': 5, 'use_sparse_layer': True, 'use_sparse_loss': False, 'use_batchnorm': True, 'use_dropout': True, 'dropout': 0.5706594314116437, 'mlp_size_1': 0, 'mlp_size_2': 5, 'mlp_size_3': 0, 'kernel': 'Logistic', 'loss_name': 'NLLLoss'}. Best is trial 22 with value: 0.8433318468070169.[0m
[32m[I 2022-04-21 22:48:12,672][0m Trial 202 finished with value: 0.8289711844201605 and parameters: {'n_hidden': 256, 'mixture_components': 5, 'use_sparse_layer': True, 'use_sparse_loss': False, 'use_batchnorm': True, 'use_dropout': True, 'dropout': 0.6072307041928818, 'mlp_size_1': 0, 'mlp_size_2': 5, 'mlp_size_3': 0, 'kernel': 'Logistic', 'loss_name': 'NLLLoss'}. Best is trial 22 with value: 0.8433318468070169.[0m
[32m[I 2022-04-21 22:54:08,570][0m Trial 203 finished with value: 0.8351286094277821 and parameters: {'n_hidden': 256, 'mixture_components': 5, 'use_sparse_layer': True, 'use_sparse_loss': False, 'use_batchnorm': True, 'use_dropout': True, 'dropout': 0.5783749856736564, 'mlp_size_1': 0, 'mlp_size_2': 5, 'mlp_size_3': 0, 'kernel': 'Logistic', 'loss_name': 'NLLLoss'}. Best is trial 22 with value: 0.8433318468070169.[0m
[32m[I 2022-04-21 22:59:35,137][0m Trial 204 finished with value: 0.8279817840320514 and parameters: {'n_hidden': 256, 'mixture_components': 5, 'use_sparse_layer': True, 'use_sparse_loss': False, 'use_batchnorm': True, 'use_dropout': True, 'dropout': 0.495956676691801, 'mlp_size_1': 0, 'mlp_size_2': 5, 'mlp_size_3': 0, 'kernel': 'Logistic', 'loss_name': 'NLLLoss'}. Best is trial 22 with value: 0.8433318468070169.[0m
[32m[I 2022-04-21 23:04:51,433][0m Trial 205 finished with value: 0.7188858667670962 and parameters: {'n_hidden': 256, 'mixture_components': 5, 'use_sparse_layer': True, 'use_sparse_loss': False, 'use_batchnorm': True, 'use_dropout': True, 'dropout': 0.5763325986521971, 'mlp_size_1': 3, 'mlp_size_2': 1, 'mlp_size_3': 0, 'kernel': 'Logistic', 'loss_name': 'NLLLoss'}. Best is trial 22 with value: 0.8433318468070169.[0m
[32m[I 2022-04-21 23:10:39,095][0m Trial 206 finished with value: 0.8330137718351743 and parameters: {'n_hidden': 256, 'mixture_components': 5, 'use_sparse_layer': True, 'use_sparse_loss': False, 'use_batchnorm': True, 'use_dropout': True, 'dropout': 0.6382655713686026, 'mlp_size_1': 0, 'mlp_size_2': 5, 'mlp_size_3': 0, 'kernel': 'Logistic', 'loss_name': 'NLLLoss'}. Best is trial 22 with value: 0.8433318468070169.[0m
[32m[I 2022-04-21 23:16:02,566][0m Trial 207 finished with value: 0.8321410331428318 and parameters: {'n_hidden': 256, 'mixture_components': 6, 'use_sparse_layer': True, 'use_sparse_loss': False, 'use_batchnorm': True, 'use_dropout': True, 'dropout': 0.5414081087992437, 'mlp_size_1': 0, 'mlp_size_2': 5, 'mlp_size_3': 0, 'kernel': 'Logistic', 'loss_name': 'NLLLoss'}. Best is trial 22 with value: 0.8433318468070169.[0m
[32m[I 2022-04-21 23:21:37,083][0m Trial 208 finished with value: 0.8121865553870125 and parameters: {'n_hidden': 2048, 'mixture_components': 5, 'use_sparse_layer': True, 'use_sparse_loss': False, 'use_batchnorm': True, 'use_dropout': True, 'dropout': 0.7328885691968808, 'mlp_size_1': 2, 'mlp_size_2': 5, 'mlp_size_3': 0, 'kernel': 'Logistic', 'loss_name': 'NLLLoss'}. Best is trial 22 with value: 0.8433318468070169.[0m
[32m[I 2022-04-21 23:26:44,841][0m Trial 209 finished with value: 0.3169796016358531 and parameters: {'n_hidden': 256, 'mixture_components': 4, 'use_sparse_layer': True, 'use_sparse_loss': True, 'lmbd': 9.765223854295857e-05, 'use_batchnorm': True, 'use_dropout': True, 'dropout': 0.06435753332111578, 'mlp_size_1': 3, 'mlp_size_2': 1, 'mlp_size_3': 0, 'kernel': 'Logistic', 'loss_name': 'CensoredNLLLoss'}. Best is trial 22 with value: 0.8433318468070169.[0m
[32m[I 2022-04-21 23:31:39,007][0m Trial 210 finished with value: 0.7289676952661625 and parameters: {'n_hidden': 256, 'mixture_components': 5, 'use_sparse_layer': True, 'use_sparse_loss': False, 'use_batchnorm': True, 'use_dropout': True, 'dropout': 0.5616340255935397, 'mlp_size_1': 0, 'mlp_size_2': 5, 'mlp_size_3': 0, 'kernel': 'Normal', 'loss_name': 'NLLLoss'}. Best is trial 22 with value: 0.8433318468070169.[0m
[32m[I 2022-04-21 23:36:44,207][0m Trial 211 finished with value: 0.8339827339825124 and parameters: {'n_hidden': 256, 'mixture_components': 5, 'use_sparse_layer': True, 'use_sparse_loss': False, 'use_batchnorm': True, 'use_dropout': True, 'dropout': 0.598085455562273, 'mlp_size_1': 0, 'mlp_size_2': 5, 'mlp_size_3': 0, 'kernel': 'Exponential', 'loss_name': 'NLLLoss'}. Best is trial 22 with value: 0.8433318468070169.[0m
[32m[I 2022-04-21 23:41:18,903][0m Trial 212 finished with value: 0.625386980572839 and parameters: {'n_hidden': 256, 'mixture_components': 5, 'use_sparse_layer': True, 'use_sparse_loss': False, 'use_batchnorm': True, 'use_dropout': True, 'dropout': 0.10044514829338153, 'mlp_size_1': 0, 'mlp_size_2': 5, 'mlp_size_3': 0, 'kernel': 'LogLogistic', 'loss_name': 'NLLLoss'}. Best is trial 22 with value: 0.8433318468070169.[0m
