[32m[I 2022-04-21 11:45:17,139][0m Trial 273 finished with value: 0.6225897831736769 and parameters: {'splitter': 'best', 'min_samples_split': 0.15898458670238183, 'min_samples_leaf': 0.0010327560877384616, 'min_weight_fraction_leaf': 0.02691790898141737, 'max_features': 0.7023077961429015}. Best is trial 203 with value: 0.6541339470014573.[0m
[32m[I 2022-04-21 11:45:18,002][0m Trial 274 finished with value: 0.6358503032610121 and parameters: {'splitter': 'best', 'min_samples_split': 0.17179357890406516, 'min_samples_leaf': 0.013711265106180103, 'min_weight_fraction_leaf': 0.008982574034366326, 'max_features': 0.6241346099656794}. Best is trial 203 with value: 0.6541339470014573.[0m
[32m[I 2022-04-21 11:45:18,343][0m Trial 275 finished with value: 0.6317954568948303 and parameters: {'splitter': 'best', 'min_samples_split': 0.13335619553935885, 'min_samples_leaf': 0.034583956341158587, 'min_weight_fraction_leaf': 0.018291601722686623, 'max_features': 0.7589825468551217}. Best is trial 203 with value: 0.6541339470014573.[0m
[32m[I 2022-04-21 11:45:18,707][0m Trial 276 finished with value: 0.615050770918823 and parameters: {'splitter': 'best', 'min_samples_split': 0.10074540350843762, 'min_samples_leaf': 0.010825618560788234, 'min_weight_fraction_leaf': 0.03830199980845756, 'max_features': 0.5502635329847958}. Best is trial 203 with value: 0.6541339470014573.[0m
[32m[I 2022-04-21 11:45:19,045][0m Trial 277 finished with value: 0.6332579074071452 and parameters: {'splitter': 'best', 'min_samples_split': 0.1787746748520596, 'min_samples_leaf': 0.02397939615834838, 'min_weight_fraction_leaf': 0.026495872260544485, 'max_features': 0.6537147015068314}. Best is trial 203 with value: 0.6541339470014573.[0m
[32m[I 2022-04-21 11:45:20,233][0m Trial 278 finished with value: 0.6128702107775558 and parameters: {'splitter': 'best', 'min_samples_split': 0.15322184132352692, 'min_samples_leaf': 0.016951189075187587, 'min_weight_fraction_leaf': 3.774659977735101e-05, 'max_features': 0.6299357176842711}. Best is trial 203 with value: 0.6541339470014573.[0m
[32m[I 2022-04-21 11:45:20,863][0m Trial 279 finished with value: 0.6432776210584517 and parameters: {'splitter': 'best', 'min_samples_split': 0.14502697329045683, 'min_samples_leaf': 0.008603192269739284, 'min_weight_fraction_leaf': 0.010305982839935819, 'max_features': 0.6866963212510717}. Best is trial 203 with value: 0.6541339470014573.[0m
[32m[I 2022-04-21 11:45:21,547][0m Trial 280 finished with value: 0.6428437129874982 and parameters: {'splitter': 'best', 'min_samples_split': 0.191399848180624, 'min_samples_leaf': 0.007726973890571491, 'min_weight_fraction_leaf': 0.012242017568055678, 'max_features': 0.6959686832148256}. Best is trial 203 with value: 0.6541339470014573.[0m
[32m[I 2022-04-21 11:45:21,644][0m Trial 281 finished with value: 0.5866817413425028 and parameters: {'splitter': 'best', 'min_samples_split': 0.21309372201013688, 'min_samples_leaf': 0.1835753400398643, 'min_weight_fraction_leaf': 0.010470887175413031, 'max_features': 0.7175818747796066}. Best is trial 203 with value: 0.6541339470014573.[0m
[32m[I 2022-04-21 11:45:22,243][0m Trial 282 finished with value: 0.6531595418481373 and parameters: {'splitter': 'best', 'min_samples_split': 0.16138461752815075, 'min_samples_leaf': 0.0015934230286600926, 'min_weight_fraction_leaf': 0.0097511440500616, 'max_features': 0.6790019914698823}. Best is trial 203 with value: 0.6541339470014573.[0m
[32m[I 2022-04-21 11:45:22,624][0m Trial 283 finished with value: 0.6168455256684287 and parameters: {'splitter': 'best', 'min_samples_split': 0.19552388036491336, 'min_samples_leaf': 0.0015669965994039026, 'min_weight_fraction_leaf': 0.03022153796763071, 'max_features': 0.6737779861951907}. Best is trial 203 with value: 0.6541339470014573.[0m
[32m[I 2022-04-21 11:45:23,148][0m Trial 284 finished with value: 0.6291497462312352 and parameters: {'splitter': 'best', 'min_samples_split': 0.16153764021777176, 'min_samples_leaf': 0.0063816552274391135, 'min_weight_fraction_leaf': 0.01549073602726528, 'max_features': 0.6834618668011647}. Best is trial 203 with value: 0.6541339470014573.[0m
[32m[I 2022-04-21 11:45:24,409][0m Trial 285 finished with value: 0.6407620025314228 and parameters: {'splitter': 'best', 'min_samples_split': 0.11267034046807306, 'min_samples_leaf': 0.0014998039211164289, 'min_weight_fraction_leaf': 0.008807544581983691, 'max_features': 0.7369428158088104}. Best is trial 203 with value: 0.6541339470014573.[0m
[32m[I 2022-04-21 11:45:26,984][0m Trial 286 finished with value: 0.6265349533934789 and parameters: {'splitter': 'best', 'min_samples_split': 0.1113054203573487, 'min_samples_leaf': 0.0012333462046429898, 'min_weight_fraction_leaf': 0.00043630945514529164, 'max_features': 0.7327094765375416}. Best is trial 203 with value: 0.6541339470014573.[0m
[32m[I 2022-04-21 11:45:27,180][0m Trial 287 finished with value: 0.5398373364311787 and parameters: {'splitter': 'best', 'min_samples_split': 0.12134568984540357, 'min_samples_leaf': 0.012340809885361678, 'min_weight_fraction_leaf': 0.40901793505620687, 'max_features': 0.7451675696915558}. Best is trial 203 with value: 0.6541339470014573.[0m
[32m[I 2022-04-21 11:45:28,478][0m Trial 288 finished with value: 0.6380343179487994 and parameters: {'splitter': 'best', 'min_samples_split': 0.1346220544556508, 'min_samples_leaf': 0.0013181437607924697, 'min_weight_fraction_leaf': 0.009789016802908949, 'max_features': 0.7178863423109052}. Best is trial 203 with value: 0.6541339470014573.[0m
[32m[I 2022-04-21 11:45:29,018][0m Trial 289 finished with value: 0.6273933709666586 and parameters: {'splitter': 'best', 'min_samples_split': 0.10065323100871773, 'min_samples_leaf': 0.02547374886399372, 'min_weight_fraction_leaf': 0.016944239392901572, 'max_features': 0.6963475194161551}. Best is trial 203 with value: 0.6541339470014573.[0m
[32m[I 2022-04-21 11:45:29,799][0m Trial 290 finished with value: 0.6366136874001778 and parameters: {'splitter': 'best', 'min_samples_split': 0.17653581421978257, 'min_samples_leaf': 0.013281597239748248, 'min_weight_fraction_leaf': 0.007454747899828974, 'max_features': 0.6629579064599012}. Best is trial 203 with value: 0.6541339470014573.[0m
[32m[I 2022-04-21 11:45:30,407][0m Trial 291 finished with value: 0.6321825044660938 and parameters: {'splitter': 'best', 'min_samples_split': 0.14519638242106306, 'min_samples_leaf': 0.010742889623430764, 'min_weight_fraction_leaf': 0.025866869890450596, 'max_features': 0.7098241743614236}. Best is trial 203 with value: 0.6541339470014573.[0m
[32m[I 2022-04-21 11:45:31,014][0m Trial 292 finished with value: 0.6199130741793443 and parameters: {'splitter': 'best', 'min_samples_split': 0.12703987091189595, 'min_samples_leaf': 0.02151199929841552, 'min_weight_fraction_leaf': 0.009870397113186056, 'max_features': 0.6900912237624999}. Best is trial 203 with value: 0.6541339470014573.[0m
[32m[I 2022-04-21 11:45:31,512][0m Trial 293 finished with value: 0.6211752617169377 and parameters: {'splitter': 'best', 'min_samples_split': 0.11728009772963717, 'min_samples_leaf': 0.03337712887616073, 'min_weight_fraction_leaf': 0.019348142943089564, 'max_features': 0.6537447145905242}. Best is trial 203 with value: 0.6541339470014573.[0m
[32m[I 2022-04-21 11:45:32,218][0m Trial 294 finished with value: 0.6277265260492815 and parameters: {'splitter': 'best', 'min_samples_split': 0.16518918650748415, 'min_samples_leaf': 0.011049037185081316, 'min_weight_fraction_leaf': 0.0005276881727676007, 'max_features': 0.678027229489433}. Best is trial 203 with value: 0.6541339470014573.[0m
[32m[I 2022-04-21 11:45:32,811][0m Trial 295 finished with value: 0.6235289659770891 and parameters: {'splitter': 'best', 'min_samples_split': 0.22188112083119974, 'min_samples_leaf': 0.020148649803145097, 'min_weight_fraction_leaf': 0.03288192925071824, 'max_features': 0.7734582287444399}. Best is trial 203 with value: 0.6541339470014573.[0m
[32m[I 2022-04-21 11:45:33,604][0m Trial 296 finished with value: 0.644177012082235 and parameters: {'splitter': 'best', 'min_samples_split': 0.1848842096806815, 'min_samples_leaf': 0.00901575770813721, 'min_weight_fraction_leaf': 0.01507658920886584, 'max_features': 0.7391088841058615}. Best is trial 203 with value: 0.6541339470014573.[0m
[32m[I 2022-04-21 11:45:34,124][0m Trial 297 finished with value: 0.6217666284209636 and parameters: {'splitter': 'best', 'min_samples_split': 0.1852279973969834, 'min_samples_leaf': 0.026332305784714134, 'min_weight_fraction_leaf': 0.04215800137854588, 'max_features': 0.6375948557398727}. Best is trial 203 with value: 0.6541339470014573.[0m
[32m[I 2022-04-21 11:45:34,666][0m Trial 298 finished with value: 0.6158849438706083 and parameters: {'splitter': 'best', 'min_samples_split': 0.20153865710477906, 'min_samples_leaf': 0.01638161547678888, 'min_weight_fraction_leaf': 0.02284533534306442, 'max_features': 0.7083629183032224}. Best is trial 203 with value: 0.6541339470014573.[0m
[32m[I 2022-04-21 11:45:35,081][0m Trial 299 finished with value: 0.625196823240484 and parameters: {'splitter': 'best', 'min_samples_split': 0.17906252475082846, 'min_samples_leaf': 0.03352269544872299, 'min_weight_fraction_leaf': 0.01739473131243504, 'max_features': 0.6676261519841169}. Best is trial 203 with value: 0.6541339470014573.[0m
[32m[I 2022-04-21 11:45:36,018][0m Trial 300 finished with value: 0.6217472214228661 and parameters: {'splitter': 'best', 'min_samples_split': 0.17158188409351763, 'min_samples_leaf': 0.00967562764029887, 'min_weight_fraction_leaf': 0.030628206427556693, 'max_features': 0.7528174864721716}. Best is trial 203 with value: 0.6541339470014573.[0m
[32m[I 2022-04-21 11:45:37,046][0m Trial 301 finished with value: 0.6327391508506981 and parameters: {'splitter': 'best', 'min_samples_split': 0.14717765282395162, 'min_samples_leaf': 0.028040470040124676, 'min_weight_fraction_leaf': 0.00019733490790630956, 'max_features': 0.7250353731275494}. Best is trial 203 with value: 0.6541339470014573.[0m
[32m[I 2022-04-21 11:45:37,783][0m Trial 302 finished with value: 0.6357042794693427 and parameters: {'splitter': 'best', 'min_samples_split': 0.19232935512198038, 'min_samples_leaf': 0.01813191201104706, 'min_weight_fraction_leaf': 0.015216967539237613, 'max_features': 0.6474085454147639}. Best is trial 203 with value: 0.6541339470014573.[0m
[32m[I 2022-04-21 11:45:38,198][0m Trial 303 finished with value: 0.6060351659554827 and parameters: {'splitter': 'best', 'min_samples_split': 0.24335401132019782, 'min_samples_leaf': 0.009599784834215627, 'min_weight_fraction_leaf': 0.025553694454048394, 'max_features': 0.6907097131151821}. Best is trial 203 with value: 0.6541339470014573.[0m
[32m[I 2022-04-21 11:45:38,826][0m Trial 304 finished with value: 0.6333048635277427 and parameters: {'splitter': 'best', 'min_samples_split': 0.15738268055507107, 'min_samples_leaf': 0.0011222864501208747, 'min_weight_fraction_leaf': 0.009255811861994052, 'max_features': 0.5997049641601253}. Best is trial 203 with value: 0.6541339470014573.[0m
[32m[I 2022-04-21 11:45:39,169][0m Trial 305 finished with value: 0.6102172933020645 and parameters: {'splitter': 'best', 'min_samples_split': 0.1860874662706613, 'min_samples_leaf': 0.03936495263408326, 'min_weight_fraction_leaf': 0.01798867730211117, 'max_features': 0.6756860635321656}. Best is trial 203 with value: 0.6541339470014573.[0m
[32m[I 2022-04-21 11:45:39,435][0m Trial 306 finished with value: 0.6010378349848086 and parameters: {'splitter': 'best', 'min_samples_split': 0.205304796275421, 'min_samples_leaf': 0.0208461869503031, 'min_weight_fraction_leaf': 0.13723230803894082, 'max_features': 0.6275774256194987}. Best is trial 203 with value: 0.6541339470014573.[0m
[32m[I 2022-04-21 11:45:40,223][0m Trial 307 finished with value: 0.6119995267041421 and parameters: {'splitter': 'best', 'min_samples_split': 0.17458066400163552, 'min_samples_leaf': 0.02787063115450549, 'min_weight_fraction_leaf': 0.036886100307229865, 'max_features': 0.7208130428393302}. Best is trial 203 with value: 0.6541339470014573.[0m
[32m[I 2022-04-21 11:45:40,546][0m Trial 308 finished with value: 0.6280798190945831 and parameters: {'splitter': 'best', 'min_samples_split': 0.1418964306850437, 'min_samples_leaf': 0.01067415920518128, 'min_weight_fraction_leaf': 0.008045653914553148, 'max_features': 0.17914731612015194}. Best is trial 203 with value: 0.6541339470014573.[0m
[32m[I 2022-04-21 11:45:41,254][0m Trial 309 finished with value: 0.6335703812326539 and parameters: {'splitter': 'best', 'min_samples_split': 0.16273881303649454, 'min_samples_leaf': 0.018441189445848577, 'min_weight_fraction_leaf': 0.02435740318037717, 'max_features': 0.6548795297858298}. Best is trial 203 with value: 0.6541339470014573.[0m
[32m[I 2022-04-21 11:45:42,139][0m Trial 310 finished with value: 0.6417062030417455 and parameters: {'splitter': 'best', 'min_samples_split': 0.21374516366437618, 'min_samples_leaf': 0.00978416826838922, 'min_weight_fraction_leaf': 0.010635353879225524, 'max_features': 0.6961464501532094}. Best is trial 203 with value: 0.6541339470014573.[0m
[32m[I 2022-04-21 11:45:43,094][0m Trial 311 finished with value: 0.6263043907324315 and parameters: {'splitter': 'best', 'min_samples_split': 0.22477739502630792, 'min_samples_leaf': 0.008605634765951293, 'min_weight_fraction_leaf': 0.0076756743322908055, 'max_features': 0.7042662964138142}. Best is trial 203 with value: 0.6541339470014573.[0m
[32m[I 2022-04-21 11:45:43,801][0m Trial 312 finished with value: 0.6434589996069822 and parameters: {'splitter': 'best', 'min_samples_split': 0.20927398550490595, 'min_samples_leaf': 0.009103452006836155, 'min_weight_fraction_leaf': 0.017060421372331623, 'max_features': 0.6943002898472008}. Best is trial 203 with value: 0.6541339470014573.[0m
[32m[I 2022-04-21 11:45:44,676][0m Trial 313 finished with value: 0.6430985331574213 and parameters: {'splitter': 'best', 'min_samples_split': 0.21196972847891107, 'min_samples_leaf': 0.010255341843176339, 'min_weight_fraction_leaf': 1.4950490441678193e-05, 'max_features': 0.691201313165823}. Best is trial 203 with value: 0.6541339470014573.[0m
[32m[I 2022-04-21 11:45:47,053][0m Trial 314 finished with value: 0.6397002998333586 and parameters: {'splitter': 'best', 'min_samples_split': 0.2090039373217846, 'min_samples_leaf': 0.0011579351760906496, 'min_weight_fraction_leaf': 0.00012080651717424303, 'max_features': 0.6798032790855347}. Best is trial 203 with value: 0.6541339470014573.[0m
[32m[I 2022-04-21 11:45:47,549][0m Trial 315 finished with value: 0.641110618396311 and parameters: {'splitter': 'best', 'min_samples_split': 0.20202055873498626, 'min_samples_leaf': 0.016951087223133467, 'min_weight_fraction_leaf': 0.0007617354130265066, 'max_features': 0.7322087886128459}. Best is trial 203 with value: 0.6541339470014573.[0m
[32m[I 2022-04-21 11:45:48,303][0m Trial 316 finished with value: 0.6300149500016912 and parameters: {'splitter': 'best', 'min_samples_split': 0.22008018745110855, 'min_samples_leaf': 0.009372075644244329, 'min_weight_fraction_leaf': 0.017505635916777007, 'max_features': 0.7090453696092928}. Best is trial 203 with value: 0.6541339470014573.[0m
[32m[I 2022-04-21 11:45:48,418][0m Trial 317 finished with value: 0.49820239377188164 and parameters: {'splitter': 'best', 'min_samples_split': 0.19052030083844593, 'min_samples_leaf': 0.4870582514545275, 'min_weight_fraction_leaf': 1.064712820576276e-05, 'max_features': 0.688608189756263}. Best is trial 203 with value: 0.6541339470014573.[0m
[32m[I 2022-04-21 11:45:49,302][0m Trial 318 finished with value: 0.6257673418257073 and parameters: {'splitter': 'best', 'min_samples_split': 0.19618759381636305, 'min_samples_leaf': 0.01901593794898323, 'min_weight_fraction_leaf': 0.016557480774897694, 'max_features': 0.677181915320996}. Best is trial 203 with value: 0.6541339470014573.[0m
[32m[I 2022-04-21 11:45:50,140][0m Trial 319 finished with value: 0.6132080734775711 and parameters: {'splitter': 'best', 'min_samples_split': 0.23401490351961574, 'min_samples_leaf': 0.0011754207974418538, 'min_weight_fraction_leaf': 0.025610337668529957, 'max_features': 0.6612556770357163}. Best is trial 203 with value: 0.6541339470014573.[0m
[32m[I 2022-04-21 11:45:50,760][0m Trial 320 finished with value: 0.637212107223407 and parameters: {'splitter': 'best', 'min_samples_split': 0.18355692590569664, 'min_samples_leaf': 0.026312550191184468, 'min_weight_fraction_leaf': 0.009882813457073251, 'max_features': 0.7539642762234542}. Best is trial 203 with value: 0.6541339470014573.[0m
[32m[I 2022-04-21 11:45:51,441][0m Trial 321 finished with value: 0.6115338649543617 and parameters: {'splitter': 'best', 'min_samples_split': 0.16979655365705143, 'min_samples_leaf': 0.010364915984816432, 'min_weight_fraction_leaf': 0.034439647463388526, 'max_features': 0.7213293588694827}. Best is trial 203 with value: 0.6541339470014573.[0m
[32m[I 2022-04-21 11:45:51,599][0m Trial 322 finished with value: 0.5421960700702187 and parameters: {'splitter': 'best', 'min_samples_split': 0.4597392717911003, 'min_samples_leaf': 0.32579454654104556, 'min_weight_fraction_leaf': 0.15523661855393386, 'max_features': 0.7008149710706421}. Best is trial 203 with value: 0.6541339470014573.[0m
[32m[I 2022-04-21 11:45:52,086][0m Trial 323 finished with value: 0.6251820749328013 and parameters: {'splitter': 'best', 'min_samples_split': 0.21201056893748574, 'min_samples_leaf': 0.03518848596961909, 'min_weight_fraction_leaf': 0.043620174467580805, 'max_features': 0.7375020991490244}. Best is trial 203 with value: 0.6541339470014573.[0m
[32m[I 2022-04-21 11:45:52,684][0m Trial 324 finished with value: 0.6211696801820994 and parameters: {'splitter': 'best', 'min_samples_split': 0.13386424927741775, 'min_samples_leaf': 0.017874803901059874, 'min_weight_fraction_leaf': 0.010450117333609083, 'max_features': 0.6577467643754581}. Best is trial 203 with value: 0.6541339470014573.[0m
[32m[I 2022-04-21 11:45:53,351][0m Trial 325 finished with value: 0.6173884339940703 and parameters: {'splitter': 'best', 'min_samples_split': 0.15606036834502868, 'min_samples_leaf': 0.008815291349402654, 'min_weight_fraction_leaf': 0.02341090507572266, 'max_features': 0.6929544442944996}. Best is trial 203 with value: 0.6541339470014573.[0m
[32m[I 2022-04-21 11:45:55,590][0m Trial 326 finished with value: 0.6412040011484119 and parameters: {'splitter': 'best', 'min_samples_split': 0.19822985720078226, 'min_samples_leaf': 0.001140794300696784, 'min_weight_fraction_leaf': 0.00012596612119710436, 'max_features': 0.6453084939292628}. Best is trial 203 with value: 0.6541339470014573.[0m
[32m[I 2022-04-21 11:45:56,275][0m Trial 327 finished with value: 0.627322568736228 and parameters: {'splitter': 'best', 'min_samples_split': 0.1781909875416092, 'min_samples_leaf': 0.023433921049350815, 'min_weight_fraction_leaf': 0.01657572101236108, 'max_features': 0.6738965920256271}. Best is trial 203 with value: 0.6541339470014573.[0m
[32m[I 2022-04-21 11:45:57,015][0m Trial 328 finished with value: 0.6283588507783004 and parameters: {'splitter': 'best', 'min_samples_split': 0.1488193593691615, 'min_samples_leaf': 0.015957746645231592, 'min_weight_fraction_leaf': 0.029090937030792553, 'max_features': 0.7126215091956473}. Best is trial 203 with value: 0.6541339470014573.[0m
[32m[I 2022-04-21 11:45:57,484][0m Trial 329 finished with value: 0.6303686323938571 and parameters: {'splitter': 'best', 'min_samples_split': 0.16514387848237136, 'min_samples_leaf': 0.0306475750324442, 'min_weight_fraction_leaf': 0.009222448724794802, 'max_features': 0.7650223682584453}. Best is trial 203 with value: 0.6541339470014573.[0m
[32m[I 2022-04-21 11:45:57,989][0m Trial 330 finished with value: 0.6189957204088475 and parameters: {'splitter': 'best', 'min_samples_split': 0.22902069541048245, 'min_samples_leaf': 0.0015632430754087805, 'min_weight_fraction_leaf': 0.017288838720399186, 'max_features': 0.6711718151192132}. Best is trial 203 with value: 0.6541339470014573.[0m
[32m[I 2022-04-21 11:45:58,131][0m Trial 331 finished with value: 0.5814451610811162 and parameters: {'splitter': 'best', 'min_samples_split': 0.18966328901363377, 'min_samples_leaf': 0.21509951596772578, 'min_weight_fraction_leaf': 0.008347813443307373, 'max_features': 0.6963452806729148}. Best is trial 203 with value: 0.6541339470014573.[0m
[32m[I 2022-04-21 11:45:58,545][0m Trial 332 finished with value: 0.6154294968817979 and parameters: {'splitter': 'best', 'min_samples_split': 0.20858881778925792, 'min_samples_leaf': 0.015860416369717405, 'min_weight_fraction_leaf': 7.512720053612885e-05, 'max_features': 0.6315162156825186}. Best is trial 203 with value: 0.6541339470014573.[0m
[32m[I 2022-04-21 11:45:59,178][0m Trial 333 finished with value: 0.6380714837779399 and parameters: {'splitter': 'best', 'min_samples_split': 0.1358476062805362, 'min_samples_leaf': 0.011006180096283676, 'min_weight_fraction_leaf': 0.02860957860977248, 'max_features': 0.7233797157742425}. Best is trial 203 with value: 0.6541339470014573.[0m
[32m[I 2022-04-21 11:45:59,254][0m Trial 334 finished with value: 0.5215500905649788 and parameters: {'splitter': 'best', 'min_samples_split': 0.14913395155328016, 'min_samples_leaf': 0.46727100682043227, 'min_weight_fraction_leaf': 0.017528503238515483, 'max_features': 0.7453977421662974}. Best is trial 203 with value: 0.6541339470014573.[0m
[32m[I 2022-04-21 11:45:59,775][0m Trial 335 finished with value: 0.62727121200046 and parameters: {'splitter': 'best', 'min_samples_split': 0.17052221882696347, 'min_samples_leaf': 0.03768349701463858, 'min_weight_fraction_leaf': 0.037366832309977165, 'max_features': 0.6415922589704867}. Best is trial 203 with value: 0.6541339470014573.[0m
