[32m[I 2022-04-22 18:57:36,625][0m Trial 334 finished with value: 0.6100987040666541 and parameters: {'loss': 'coxph', 'learning_rate': 0.027944174478091773, 'n_estimators': 495, 'criterion': 'friedman_mse', 'min_samples_split': 10, 'min_samples_leaf': 3, 'min_weight_fraction_leaf': 0.09623699671555247, 'min_impurity_decrease': 0.9001760230136958, 'max_features': 0.6991412549078849, 'subsample': 0.2803574428817044, 'dropout_rate': 0.3649085047131787, 'ccp_alpha': 0.1827323305268874}. Best is trial 218 with value: 0.6659976583847056.[0m
[32m[I 2022-04-22 18:58:22,735][0m Trial 335 finished with value: 0.6442112029194913 and parameters: {'loss': 'coxph', 'learning_rate': 0.03891173460309496, 'n_estimators': 460, 'criterion': 'friedman_mse', 'min_samples_split': 10, 'min_samples_leaf': 3, 'min_weight_fraction_leaf': 0.06474041533974602, 'min_impurity_decrease': 0.8830357877086275, 'max_features': 0.651420628236538, 'subsample': 0.34183819184838987, 'dropout_rate': 0.328599736699518, 'ccp_alpha': 0.09515191536600838}. Best is trial 218 with value: 0.6659976583847056.[0m
[32m[I 2022-04-22 18:59:20,761][0m Trial 336 finished with value: 0.5699626936126035 and parameters: {'loss': 'coxph', 'learning_rate': 0.04955340575043439, 'n_estimators': 556, 'criterion': 'friedman_mse', 'min_samples_split': 10, 'min_samples_leaf': 3, 'min_weight_fraction_leaf': 0.07623635215132626, 'min_impurity_decrease': 0.9151633371886742, 'max_features': 0.7357277995001481, 'subsample': 0.29841535098433053, 'dropout_rate': 0.41166551907185095, 'ccp_alpha': 0.23639011128708973}. Best is trial 218 with value: 0.6659976583847056.[0m
[32m[I 2022-04-22 19:00:54,810][0m Trial 337 finished with value: 0.6511184312636331 and parameters: {'loss': 'coxph', 'learning_rate': 0.07491110968098019, 'n_estimators': 624, 'criterion': 'friedman_mse', 'min_samples_split': 10, 'min_samples_leaf': 3, 'min_weight_fraction_leaf': 0.053552938198305436, 'min_impurity_decrease': 0.9325223377390836, 'max_features': 0.5876307906576383, 'subsample': 0.2495539966835693, 'dropout_rate': 0.24396394182651235, 'ccp_alpha': 0.084912322947953}. Best is trial 218 with value: 0.6659976583847056.[0m
/media/san2_ssd/data/Workdir/survival/venv/lib/python3.8/site-packages/sksurv/ensemble/boosting.py:955: RuntimeWarning: divide by zero encountered in log
  time = numpy.log(time)
/media/san2_ssd/data/Workdir/survival/venv/lib/python3.8/site-packages/sksurv/ensemble/boosting.py:955: RuntimeWarning: divide by zero encountered in log
  time = numpy.log(time)
/media/san2_ssd/data/Workdir/survival/venv/lib/python3.8/site-packages/sksurv/ensemble/boosting.py:955: RuntimeWarning: divide by zero encountered in log
  time = numpy.log(time)
/media/san2_ssd/data/Workdir/survival/venv/lib/python3.8/site-packages/sksurv/ensemble/boosting.py:955: RuntimeWarning: divide by zero encountered in log
  time = numpy.log(time)
[32m[I 2022-04-22 19:01:07,571][0m Trial 338 finished with value: -0.7353377659029439 and parameters: {'loss': 'squared', 'learning_rate': 0.057220783299849136, 'n_estimators': 515, 'criterion': 'friedman_mse', 'min_samples_split': 10, 'min_samples_leaf': 3, 'min_weight_fraction_leaf': 0.08501612868782771, 'min_impurity_decrease': 0.9008653002395731, 'max_features': 0.6234151950385204, 'subsample': 0.20727626765664958, 'dropout_rate': 0.21773362607708077, 'ccp_alpha': 0.004226866135614003}. Best is trial 218 with value: 0.6659976583847056.[0m
[32m[I 2022-04-22 19:01:40,038][0m Trial 339 finished with value: 0.5927156353326799 and parameters: {'loss': 'coxph', 'learning_rate': 0.038446063181030624, 'n_estimators': 419, 'criterion': 'friedman_mse', 'min_samples_split': 10, 'min_samples_leaf': 3, 'min_weight_fraction_leaf': 0.06862030483225882, 'min_impurity_decrease': 0.8444049295761624, 'max_features': 0.664978307793565, 'subsample': 0.3193108250053998, 'dropout_rate': 0.4563521954988599, 'ccp_alpha': 0.1776704363470611}. Best is trial 218 with value: 0.6659976583847056.[0m
[32m[I 2022-04-22 19:02:27,655][0m Trial 340 finished with value: 0.530715911158733 and parameters: {'loss': 'coxph', 'learning_rate': 0.09971215028687312, 'n_estimators': 481, 'criterion': 'friedman_mse', 'min_samples_split': 10, 'min_samples_leaf': 3, 'min_weight_fraction_leaf': 0.09301397834007348, 'min_impurity_decrease': 0.9525611076935773, 'max_features': 0.7121444252446738, 'subsample': 0.2707185915884999, 'dropout_rate': 0.38749014726355663, 'ccp_alpha': 0.3099949716210444}. Best is trial 218 with value: 0.6659976583847056.[0m
[32m[I 2022-04-22 19:03:40,079][0m Trial 341 finished with value: 0.6492766638840342 and parameters: {'loss': 'coxph', 'learning_rate': 0.006384926205562056, 'n_estimators': 536, 'criterion': 'friedman_mse', 'min_samples_split': 10, 'min_samples_leaf': 3, 'min_weight_fraction_leaf': 0.05866346074911062, 'min_impurity_decrease': 0.8776188299324681, 'max_features': 0.478952327007435, 'subsample': 0.3641971339972314, 'dropout_rate': 0.1922523720010996, 'ccp_alpha': 0.09194401241211997}. Best is trial 218 with value: 0.6659976583847056.[0m
[32m[I 2022-04-22 19:04:52,153][0m Trial 342 finished with value: 0.659073572278814 and parameters: {'loss': 'coxph', 'learning_rate': 0.00978936022369973, 'n_estimators': 580, 'criterion': 'friedman_mse', 'min_samples_split': 10, 'min_samples_leaf': 3, 'min_weight_fraction_leaf': 0.07714695730936774, 'min_impurity_decrease': 0.916403589150807, 'max_features': 0.6014019653807655, 'subsample': 0.2939846625185023, 'dropout_rate': 0.34848036747010697, 'ccp_alpha': 0.0029107235262597225}. Best is trial 218 with value: 0.6659976583847056.[0m
[32m[I 2022-04-22 19:05:39,788][0m Trial 343 finished with value: 0.6587558667065204 and parameters: {'loss': 'coxph', 'learning_rate': 0.01446253057055746, 'n_estimators': 453, 'criterion': 'friedman_mse', 'min_samples_split': 10, 'min_samples_leaf': 3, 'min_weight_fraction_leaf': 0.06538192469785793, 'min_impurity_decrease': 0.8297416575189847, 'max_features': 0.6826458347210826, 'subsample': 0.3170224038987277, 'dropout_rate': 0.2992548262574562, 'ccp_alpha': 0.003850430481596801}. Best is trial 218 with value: 0.6659976583847056.[0m
[32m[I 2022-04-22 19:06:39,013][0m Trial 344 finished with value: 0.6151513199002843 and parameters: {'loss': 'coxph', 'learning_rate': 0.029731082581234743, 'n_estimators': 502, 'criterion': 'friedman_mse', 'min_samples_split': 10, 'min_samples_leaf': 3, 'min_weight_fraction_leaf': 0.08622393541435347, 'min_impurity_decrease': 0.9384141735137698, 'max_features': 0.5716478012219375, 'subsample': 0.3372790965085251, 'dropout_rate': 0.24621525806266026, 'ccp_alpha': 0.15972928486218976}. Best is trial 218 with value: 0.6659976583847056.[0m
[32m[I 2022-04-22 19:07:21,526][0m Trial 345 finished with value: 0.5 and parameters: {'loss': 'coxph', 'learning_rate': 0.05174386858181958, 'n_estimators': 479, 'criterion': 'squared_error', 'min_samples_split': 10, 'min_samples_leaf': 3, 'min_weight_fraction_leaf': 0.04521288065700611, 'min_impurity_decrease': 0.8907745537611204, 'max_features': 0.6390007351565449, 'subsample': 0.20450689541623746, 'dropout_rate': 0.4380556647953399, 'ccp_alpha': 1.285960097930701}. Best is trial 218 with value: 0.6659976583847056.[0m
[32m[I 2022-04-22 19:08:23,366][0m Trial 346 finished with value: 0.5006540204610004 and parameters: {'loss': 'coxph', 'learning_rate': 0.02299306033158657, 'n_estimators': 511, 'criterion': 'friedman_mse', 'min_samples_split': 10, 'min_samples_leaf': 3, 'min_weight_fraction_leaf': 0.09847614659088853, 'min_impurity_decrease': 0.8683245287594206, 'max_features': 0.523859885807347, 'subsample': 0.25267225259165754, 'dropout_rate': 0.21635388899769936, 'ccp_alpha': 0.39670173516076396}. Best is trial 218 with value: 0.6659976583847056.[0m
[32m[I 2022-04-22 19:09:01,847][0m Trial 347 finished with value: 0.6514511156193096 and parameters: {'loss': 'coxph', 'learning_rate': 0.07913927548738478, 'n_estimators': 436, 'criterion': 'friedman_mse', 'min_samples_split': 10, 'min_samples_leaf': 3, 'min_weight_fraction_leaf': 0.0739600697435249, 'min_impurity_decrease': 0.9593660254379075, 'max_features': 0.62753803228554, 'subsample': 0.2785095165529302, 'dropout_rate': 0.3747770901949784, 'ccp_alpha': 0.10209570709664119}. Best is trial 218 with value: 0.6659976583847056.[0m
[32m[I 2022-04-22 19:09:54,131][0m Trial 348 finished with value: 0.548129588481702 and parameters: {'loss': 'coxph', 'learning_rate': 0.008334747006959778, 'n_estimators': 485, 'criterion': 'friedman_mse', 'min_samples_split': 10, 'min_samples_leaf': 3, 'min_weight_fraction_leaf': 0.056034746806765796, 'min_impurity_decrease': 0.9112929113558289, 'max_features': 0.482688216199028, 'subsample': 0.2969666533269028, 'dropout_rate': 0.32151050472665194, 'ccp_alpha': 0.2503977813630243}. Best is trial 218 with value: 0.6659976583847056.[0m
[32m[I 2022-04-22 19:10:52,454][0m Trial 349 finished with value: 0.646105819325715 and parameters: {'loss': 'coxph', 'learning_rate': 0.011166756958774967, 'n_estimators': 546, 'criterion': 'friedman_mse', 'min_samples_split': 10, 'min_samples_leaf': 3, 'min_weight_fraction_leaf': 0.08189553784372146, 'min_impurity_decrease': 0.9301121970193511, 'max_features': 0.5501425421995916, 'subsample': 0.3421528509201408, 'dropout_rate': 0.39343843594979505, 'ccp_alpha': 0.10563779791332473}. Best is trial 218 with value: 0.6659976583847056.[0m
[32m[I 2022-04-22 19:11:49,213][0m Trial 350 finished with value: 0.6625826966768864 and parameters: {'loss': 'coxph', 'learning_rate': 0.0632831662990511, 'n_estimators': 462, 'criterion': 'friedman_mse', 'min_samples_split': 10, 'min_samples_leaf': 3, 'min_weight_fraction_leaf': 0.06843637490292785, 'min_impurity_decrease': 0.8580396833764804, 'max_features': 0.5952211998646615, 'subsample': 0.24875316591016394, 'dropout_rate': 0.19341590513682866, 'ccp_alpha': 0.004000893030060343}. Best is trial 218 with value: 0.6659976583847056.[0m
[32m[I 2022-04-22 19:12:33,858][0m Trial 351 finished with value: 0.6216583080452343 and parameters: {'loss': 'coxph', 'learning_rate': 0.05768644811217519, 'n_estimators': 456, 'criterion': 'friedman_mse', 'min_samples_split': 10, 'min_samples_leaf': 3, 'min_weight_fraction_leaf': 0.06287604653432119, 'min_impurity_decrease': 0.8939307709083681, 'max_features': 0.5979734722309888, 'subsample': 0.2476359576661254, 'dropout_rate': 0.35483322369338954, 'ccp_alpha': 0.1947941965558543}. Best is trial 218 with value: 0.6659976583847056.[0m
[32m[I 2022-04-22 19:13:27,970][0m Trial 352 finished with value: 0.6587361357153892 and parameters: {'loss': 'coxph', 'learning_rate': 0.04437894344270383, 'n_estimators': 467, 'criterion': 'friedman_mse', 'min_samples_split': 10, 'min_samples_leaf': 3, 'min_weight_fraction_leaf': 0.09172730441594155, 'min_impurity_decrease': 0.9089405640422595, 'max_features': 0.573150859713653, 'subsample': 0.2698634742614261, 'dropout_rate': 0.1986036389718533, 'ccp_alpha': 0.09223100224275306}. Best is trial 218 with value: 0.6659976583847056.[0m
[32m[I 2022-04-22 19:14:05,244][0m Trial 353 finished with value: 0.6582256005967854 and parameters: {'loss': 'coxph', 'learning_rate': 0.06588548734925054, 'n_estimators': 432, 'criterion': 'friedman_mse', 'min_samples_split': 10, 'min_samples_leaf': 3, 'min_weight_fraction_leaf': 0.07434859745324897, 'min_impurity_decrease': 0.9679395076552549, 'max_features': 0.6157342616946526, 'subsample': 0.4520521670508492, 'dropout_rate': 0.420200119828613, 'ccp_alpha': 0.007429982217590412}. Best is trial 218 with value: 0.6659976583847056.[0m
[32m[I 2022-04-22 19:14:46,083][0m Trial 354 finished with value: 0.6156816303061913 and parameters: {'loss': 'coxph', 'learning_rate': 0.035834022179268774, 'n_estimators': 409, 'criterion': 'friedman_mse', 'min_samples_split': 10, 'min_samples_leaf': 3, 'min_weight_fraction_leaf': 0.04753729963537459, 'min_impurity_decrease': 0.8594296656351245, 'max_features': 0.6587395512150886, 'subsample': 0.3129676234473388, 'dropout_rate': 0.1910282022131771, 'ccp_alpha': 0.16557358544173625}. Best is trial 218 with value: 0.6659976583847056.[0m
[32m[I 2022-04-22 19:15:47,776][0m Trial 355 finished with value: 0.5448901706031206 and parameters: {'loss': 'coxph', 'learning_rate': 0.07622006225753691, 'n_estimators': 525, 'criterion': 'friedman_mse', 'min_samples_split': 10, 'min_samples_leaf': 3, 'min_weight_fraction_leaf': 0.1010716813894482, 'min_impurity_decrease': 0.8828871619561534, 'max_features': 0.5888496559878872, 'subsample': 0.246332129466672, 'dropout_rate': 0.24868253502193516, 'ccp_alpha': 0.3092011845629}. Best is trial 218 with value: 0.6659976583847056.[0m
[32m[I 2022-04-22 19:16:34,430][0m Trial 356 finished with value: 0.6519979797253969 and parameters: {'loss': 'coxph', 'learning_rate': 0.047106490958991165, 'n_estimators': 495, 'criterion': 'friedman_mse', 'min_samples_split': 10, 'min_samples_leaf': 3, 'min_weight_fraction_leaf': 0.08623129100006137, 'min_impurity_decrease': 0.9347425848084232, 'max_features': 0.6907643065689343, 'subsample': 0.28302146093707903, 'dropout_rate': 0.4033227005892601, 'ccp_alpha': 0.09161214737832118}. Best is trial 218 with value: 0.6659976583847056.[0m
/media/san2_ssd/data/Workdir/survival/venv/lib/python3.8/site-packages/sksurv/ensemble/boosting.py:955: RuntimeWarning: divide by zero encountered in log
  time = numpy.log(time)
/media/san2_ssd/data/Workdir/survival/venv/lib/python3.8/site-packages/sksurv/ensemble/boosting.py:955: RuntimeWarning: divide by zero encountered in log
  time = numpy.log(time)
/media/san2_ssd/data/Workdir/survival/venv/lib/python3.8/site-packages/sksurv/ensemble/boosting.py:955: RuntimeWarning: divide by zero encountered in log
  time = numpy.log(time)
/media/san2_ssd/data/Workdir/survival/venv/lib/python3.8/site-packages/sksurv/ensemble/boosting.py:955: RuntimeWarning: divide by zero encountered in log
  time = numpy.log(time)
[32m[I 2022-04-22 19:16:43,606][0m Trial 357 finished with value: -0.7363526876417567 and parameters: {'loss': 'squared', 'learning_rate': 0.05898770152780885, 'n_estimators': 468, 'criterion': 'friedman_mse', 'min_samples_split': 10, 'min_samples_leaf': 3, 'min_weight_fraction_leaf': 0.05914482135074349, 'min_impurity_decrease': 0.9174309702075015, 'max_features': 0.7169612522035059, 'subsample': 0.26902947677505645, 'dropout_rate': 0.3318792015199017, 'ccp_alpha': 0.007962610216957065}. Best is trial 218 with value: 0.6659976583847056.[0m
[32m[I 2022-04-22 19:17:24,349][0m Trial 358 finished with value: 0.5581208800852548 and parameters: {'loss': 'coxph', 'learning_rate': 0.0341592950259957, 'n_estimators': 449, 'criterion': 'friedman_mse', 'min_samples_split': 10, 'min_samples_leaf': 3, 'min_weight_fraction_leaf': 0.06953907399848741, 'min_impurity_decrease': 0.895892596274502, 'max_features': 0.5619364738246397, 'subsample': 0.3240438960317909, 'dropout_rate': 0.37327787033194215, 'ccp_alpha': 0.22039131837212203}. Best is trial 218 with value: 0.6659976583847056.[0m
[32m[I 2022-04-22 19:18:42,831][0m Trial 359 finished with value: 0.6539610293222414 and parameters: {'loss': 'coxph', 'learning_rate': 0.023676911970513137, 'n_estimators': 573, 'criterion': 'friedman_mse', 'min_samples_split': 10, 'min_samples_leaf': 3, 'min_weight_fraction_leaf': 0.07983151792940822, 'min_impurity_decrease': 0.9489941800418049, 'max_features': 0.6337087555553356, 'subsample': 0.37612987943537574, 'dropout_rate': 0.21537323824991467, 'ccp_alpha': 0.09936707393626708}. Best is trial 218 with value: 0.6659976583847056.[0m
[32m[I 2022-04-22 19:19:35,763][0m Trial 360 finished with value: 0.6299371514504823 and parameters: {'loss': 'coxph', 'learning_rate': 0.04288630759201563, 'n_estimators': 514, 'criterion': 'friedman_mse', 'min_samples_split': 10, 'min_samples_leaf': 3, 'min_weight_fraction_leaf': 0.0669383146710123, 'min_impurity_decrease': 0.8689586284663899, 'max_features': 0.6057532212212464, 'subsample': 0.2982108619347844, 'dropout_rate': 0.3569474387077145, 'ccp_alpha': 0.1523438109919325}. Best is trial 218 with value: 0.6659976583847056.[0m
[32m[I 2022-04-22 19:20:32,675][0m Trial 361 finished with value: 0.6299305313375422 and parameters: {'loss': 'coxph', 'learning_rate': 0.08911251093449564, 'n_estimators': 483, 'criterion': 'friedman_mse', 'min_samples_split': 10, 'min_samples_leaf': 3, 'min_weight_fraction_leaf': 0.2192892417075737, 'min_impurity_decrease': 0.9234712092911908, 'max_features': 0.7409607186200535, 'subsample': 0.3523856985565182, 'dropout_rate': 0.3058357486741696, 'ccp_alpha': 0.008527913027260007}. Best is trial 218 with value: 0.6659976583847056.[0m
[32m[I 2022-04-22 19:21:49,125][0m Trial 362 finished with value: 0.5006540204610004 and parameters: {'loss': 'coxph', 'learning_rate': 0.06650381783856438, 'n_estimators': 537, 'criterion': 'friedman_mse', 'min_samples_split': 10, 'min_samples_leaf': 3, 'min_weight_fraction_leaf': 0.05413073734494503, 'min_impurity_decrease': 0.8386646555433771, 'max_features': 0.5244015892321866, 'subsample': 0.2572357328609722, 'dropout_rate': 0.18637755137703318, 'ccp_alpha': 0.41010568015146975}. Best is trial 218 with value: 0.6659976583847056.[0m
[32m[I 2022-04-22 19:22:53,455][0m Trial 363 finished with value: 0.5963534570883499 and parameters: {'loss': 'coxph', 'learning_rate': 0.016913822566916096, 'n_estimators': 505, 'criterion': 'friedman_mse', 'min_samples_split': 10, 'min_samples_leaf': 3, 'min_weight_fraction_leaf': 0.0908404176089038, 'min_impurity_decrease': 0.9010864245095395, 'max_features': 0.6572758873400085, 'subsample': 0.21857810331733432, 'dropout_rate': 0.23908000571146568, 'ccp_alpha': 0.2486012881177377}. Best is trial 218 with value: 0.6659976583847056.[0m
[32m[I 2022-04-22 19:26:21,234][0m Trial 364 finished with value: 0.6630983368990929 and parameters: {'loss': 'coxph', 'learning_rate': 0.05182405958297312, 'n_estimators': 953, 'criterion': 'friedman_mse', 'min_samples_split': 10, 'min_samples_leaf': 3, 'min_weight_fraction_leaf': 0.07688871190377514, 'min_impurity_decrease': 0.8863754168911041, 'max_features': 0.5378334393599276, 'subsample': 0.2902928118090164, 'dropout_rate': 0.2892086875429711, 'ccp_alpha': 0.0035161496782295984}. Best is trial 218 with value: 0.6659976583847056.[0m
[32m[I 2022-04-22 19:28:07,494][0m Trial 365 finished with value: 0.6470552428106953 and parameters: {'loss': 'coxph', 'learning_rate': 0.012910525550505165, 'n_estimators': 679, 'criterion': 'friedman_mse', 'min_samples_split': 10, 'min_samples_leaf': 3, 'min_weight_fraction_leaf': 0.08072493374348313, 'min_impurity_decrease': 0.8721065626535864, 'max_features': 0.5399368751817899, 'subsample': 0.2819863682641094, 'dropout_rate': 0.31562018784548485, 'ccp_alpha': 0.1135299498479179}. Best is trial 218 with value: 0.6659976583847056.[0m
[32m[I 2022-04-22 19:30:52,716][0m Trial 366 finished with value: 0.5 and parameters: {'loss': 'coxph', 'learning_rate': 0.02881962147898475, 'n_estimators': 866, 'criterion': 'squared_error', 'min_samples_split': 10, 'min_samples_leaf': 3, 'min_weight_fraction_leaf': 0.1037461213904467, 'min_impurity_decrease': 0.8551518746534245, 'max_features': 0.5224039417417706, 'subsample': 0.2506316474712871, 'dropout_rate': 0.27742977231025956, 'ccp_alpha': 0.0011240414721398716}. Best is trial 218 with value: 0.6659976583847056.[0m
[32m[I 2022-04-22 19:31:37,665][0m Trial 367 finished with value: 0.6141279802609793 and parameters: {'loss': 'coxph', 'learning_rate': 0.05876631913632036, 'n_estimators': 440, 'criterion': 'friedman_mse', 'min_samples_split': 10, 'min_samples_leaf': 3, 'min_weight_fraction_leaf': 0.06265945755268415, 'min_impurity_decrease': 0.9389738094690645, 'max_features': 0.5521834693408375, 'subsample': 0.23769318851345178, 'dropout_rate': 0.29172534108101505, 'ccp_alpha': 0.18006299571212506}. Best is trial 218 with value: 0.6659976583847056.[0m
[32m[I 2022-04-22 19:35:06,434][0m Trial 368 finished with value: 0.6516569785934105 and parameters: {'loss': 'coxph', 'learning_rate': 0.040957554127176686, 'n_estimators': 944, 'criterion': 'friedman_mse', 'min_samples_split': 10, 'min_samples_leaf': 3, 'min_weight_fraction_leaf': 0.047581145408465295, 'min_impurity_decrease': 0.8797575795081548, 'max_features': 0.5423734115352903, 'subsample': 0.2938035559391793, 'dropout_rate': 0.24488079446465633, 'ccp_alpha': 0.09747761588612484}. Best is trial 218 with value: 0.6659976583847056.[0m
[32m[I 2022-04-22 19:35:46,827][0m Trial 369 finished with value: 0.5274764932801516 and parameters: {'loss': 'coxph', 'learning_rate': 0.07813839702471771, 'n_estimators': 407, 'criterion': 'friedman_mse', 'min_samples_split': 10, 'min_samples_leaf': 3, 'min_weight_fraction_leaf': 0.17786569596139595, 'min_impurity_decrease': 0.9596284448735308, 'max_features': 0.7701752298886768, 'subsample': 0.2711559449485377, 'dropout_rate': 0.29170793121085214, 'ccp_alpha': 0.27730125133752725}. Best is trial 218 with value: 0.6659976583847056.[0m
[32m[I 2022-04-22 19:36:30,856][0m Trial 370 finished with value: 0.6539960044336858 and parameters: {'loss': 'coxph', 'learning_rate': 0.03323599468417641, 'n_estimators': 450, 'criterion': 'friedman_mse', 'min_samples_split': 10, 'min_samples_leaf': 3, 'min_weight_fraction_leaf': 0.07136674033897152, 'min_impurity_decrease': 0.8316085895334259, 'max_features': 0.5762306626762969, 'subsample': 0.2049626440444443, 'dropout_rate': 0.3309624152989653, 'ccp_alpha': 0.1085942538187568}. Best is trial 218 with value: 0.6659976583847056.[0m
