[32m[I 2022-04-21 18:22:28,804][0m Trial 166 finished with value: 0.8349192726716785 and parameters: {'n_hidden': 2048, 'mixture_components': 6, 'use_sparse_layer': False, 'use_batchnorm': False, 'use_dropout': False, 'mlp_size_1': 7, 'mlp_size_2': 1, 'mlp_size_3': 0, 'kernel': 'Normal', 'loss_name': 'NLLLoss'}. Best is trial 17 with value: 0.8538600001453517.[0m
[32m[I 2022-04-21 18:24:53,071][0m Trial 167 finished with value: 0.8383095673022678 and parameters: {'n_hidden': 2048, 'mixture_components': 4, 'use_sparse_layer': False, 'use_batchnorm': False, 'use_dropout': False, 'mlp_size_1': 7, 'mlp_size_2': 1, 'mlp_size_3': 0, 'kernel': 'Normal', 'loss_name': 'CensoredNLLLoss'}. Best is trial 17 with value: 0.8538600001453517.[0m
[32m[I 2022-04-21 18:26:56,086][0m Trial 168 finished with value: 0.8395966462836825 and parameters: {'n_hidden': 32, 'mixture_components': 5, 'use_sparse_layer': True, 'use_sparse_loss': True, 'lmbd': 0.0015226273929876638, 'use_batchnorm': False, 'use_dropout': False, 'mlp_size_1': 2, 'mlp_size_2': 0, 'mlp_size_3': 0, 'kernel': 'Normal', 'loss_name': 'NLLLoss'}. Best is trial 17 with value: 0.8538600001453517.[0m
[32m[I 2022-04-21 18:28:19,345][0m Trial 169 finished with value: 0.8346881642512052 and parameters: {'n_hidden': 1024, 'mixture_components': 3, 'use_sparse_layer': False, 'use_batchnorm': False, 'use_dropout': False, 'mlp_size_1': 3, 'mlp_size_2': 2, 'mlp_size_3': 0, 'kernel': 'Normal', 'loss_name': 'NLLLoss'}. Best is trial 17 with value: 0.8538600001453517.[0m
[32m[I 2022-04-21 18:31:29,144][0m Trial 170 finished with value: 0.836817662092189 and parameters: {'n_hidden': 2048, 'mixture_components': 7, 'use_sparse_layer': False, 'use_batchnorm': False, 'use_dropout': False, 'mlp_size_1': 5, 'mlp_size_2': 2, 'mlp_size_3': 1, 'kernel': 'Normal', 'loss_name': 'AlternativeNLLLoss'}. Best is trial 17 with value: 0.8538600001453517.[0m
[32m[I 2022-04-21 18:34:00,103][0m Trial 171 finished with value: 0.829708763838877 and parameters: {'n_hidden': 2048, 'mixture_components': 10, 'use_sparse_layer': False, 'use_batchnorm': False, 'use_dropout': False, 'mlp_size_1': 8, 'mlp_size_2': 0, 'mlp_size_3': 0, 'kernel': 'Normal', 'loss_name': 'NLLLoss'}. Best is trial 17 with value: 0.8538600001453517.[0m
[32m[I 2022-04-21 18:35:52,407][0m Trial 172 finished with value: 0.8434460961043989 and parameters: {'n_hidden': 2048, 'mixture_components': 9, 'use_sparse_layer': False, 'use_batchnorm': False, 'use_dropout': False, 'mlp_size_1': 8, 'mlp_size_2': 0, 'mlp_size_3': 0, 'kernel': 'Normal', 'loss_name': 'NLLLoss'}. Best is trial 17 with value: 0.8538600001453517.[0m
[32m[I 2022-04-21 18:38:11,109][0m Trial 173 finished with value: 0.8384492963866667 and parameters: {'n_hidden': 2048, 'mixture_components': 9, 'use_sparse_layer': False, 'use_batchnorm': False, 'use_dropout': False, 'mlp_size_1': 8, 'mlp_size_2': 0, 'mlp_size_3': 0, 'kernel': 'Normal', 'loss_name': 'NLLLoss'}. Best is trial 17 with value: 0.8538600001453517.[0m
[32m[I 2022-04-21 18:40:33,067][0m Trial 174 finished with value: 0.8370878764000977 and parameters: {'n_hidden': 64, 'mixture_components': 5, 'use_sparse_layer': False, 'use_batchnorm': False, 'use_dropout': False, 'mlp_size_1': 3, 'mlp_size_2': 0, 'mlp_size_3': 0, 'kernel': 'Normal', 'loss_name': 'NLLLoss'}. Best is trial 17 with value: 0.8538600001453517.[0m
[32m[I 2022-04-21 18:42:53,584][0m Trial 175 finished with value: 0.7351112838015619 and parameters: {'n_hidden': 2048, 'mixture_components': 9, 'use_sparse_layer': False, 'use_batchnorm': False, 'use_dropout': False, 'mlp_size_1': 8, 'mlp_size_2': 0, 'mlp_size_3': 0, 'kernel': 'Gumbel', 'loss_name': 'NLLLoss'}. Best is trial 17 with value: 0.8538600001453517.[0m
[32m[I 2022-04-21 18:44:57,625][0m Trial 176 finished with value: 0.8397487850298377 and parameters: {'n_hidden': 1024, 'mixture_components': 9, 'use_sparse_layer': False, 'use_batchnorm': False, 'use_dropout': False, 'mlp_size_1': 5, 'mlp_size_2': 2, 'mlp_size_3': 0, 'kernel': 'Normal', 'loss_name': 'CensoredNLLLoss'}. Best is trial 17 with value: 0.8538600001453517.[0m
[32m[I 2022-04-21 18:47:51,339][0m Trial 177 finished with value: 0.7369485685643407 and parameters: {'n_hidden': 2048, 'mixture_components': 2, 'use_sparse_layer': False, 'use_batchnorm': False, 'use_dropout': True, 'dropout': 0.3820262079164648, 'mlp_size_1': 0, 'mlp_size_2': 6, 'mlp_size_3': 2, 'kernel': 'Normal', 'loss_name': 'AlternativeNLLLoss'}. Best is trial 17 with value: 0.8538600001453517.[0m
[32m[I 2022-04-21 18:49:29,530][0m Trial 178 finished with value: 0.8476218885488617 and parameters: {'n_hidden': 1024, 'mixture_components': 4, 'use_sparse_layer': True, 'use_sparse_loss': False, 'use_batchnorm': False, 'use_dropout': False, 'mlp_size_1': 5, 'mlp_size_2': 1, 'mlp_size_3': 1, 'kernel': 'Normal', 'loss_name': 'NLLLoss'}. Best is trial 17 with value: 0.8538600001453517.[0m
[32m[I 2022-04-21 18:51:16,342][0m Trial 179 finished with value: 0.8396221260017086 and parameters: {'n_hidden': 1024, 'mixture_components': 4, 'use_sparse_layer': True, 'use_sparse_loss': False, 'use_batchnorm': False, 'use_dropout': False, 'mlp_size_1': 5, 'mlp_size_2': 1, 'mlp_size_3': 1, 'kernel': 'Logistic', 'loss_name': 'AlternativeNLLLoss'}. Best is trial 17 with value: 0.8538600001453517.[0m
[32m[I 2022-04-21 18:53:03,486][0m Trial 180 finished with value: 0.810739692053634 and parameters: {'n_hidden': 1024, 'mixture_components': 4, 'use_sparse_layer': True, 'use_sparse_loss': False, 'use_batchnorm': False, 'use_dropout': False, 'mlp_size_1': 5, 'mlp_size_2': 1, 'mlp_size_3': 1, 'kernel': 'LogLogistic', 'loss_name': 'AlternativeNLLLoss'}. Best is trial 17 with value: 0.8538600001453517.[0m
[32m[I 2022-04-21 18:54:56,406][0m Trial 181 finished with value: 0.8422585400407613 and parameters: {'n_hidden': 1024, 'mixture_components': 4, 'use_sparse_layer': True, 'use_sparse_loss': False, 'use_batchnorm': False, 'use_dropout': False, 'mlp_size_1': 5, 'mlp_size_2': 1, 'mlp_size_3': 1, 'kernel': 'Normal', 'loss_name': 'NLLLoss'}. Best is trial 17 with value: 0.8538600001453517.[0m
[32m[I 2022-04-21 18:56:54,652][0m Trial 182 finished with value: 0.7490193245512692 and parameters: {'n_hidden': 1024, 'mixture_components': 3, 'use_sparse_layer': True, 'use_sparse_loss': False, 'use_batchnorm': False, 'use_dropout': False, 'mlp_size_1': 5, 'mlp_size_2': 1, 'mlp_size_3': 1, 'kernel': 'Normal', 'loss_name': 'NLLLoss'}. Best is trial 17 with value: 0.8538600001453517.[0m
[32m[I 2022-04-21 18:58:38,885][0m Trial 183 finished with value: 0.841500737642896 and parameters: {'n_hidden': 1024, 'mixture_components': 8, 'use_sparse_layer': True, 'use_sparse_loss': False, 'use_batchnorm': False, 'use_dropout': False, 'mlp_size_1': 5, 'mlp_size_2': 1, 'mlp_size_3': 1, 'kernel': 'Normal', 'loss_name': 'NLLLoss'}. Best is trial 17 with value: 0.8538600001453517.[0m
[32m[I 2022-04-21 19:00:42,023][0m Trial 184 finished with value: 0.8419552131588942 and parameters: {'n_hidden': 2048, 'mixture_components': 4, 'use_sparse_layer': False, 'use_batchnorm': False, 'use_dropout': False, 'mlp_size_1': 7, 'mlp_size_2': 1, 'mlp_size_3': 0, 'kernel': 'Normal', 'loss_name': 'NLLLoss'}. Best is trial 17 with value: 0.8538600001453517.[0m
[32m[I 2022-04-21 19:02:25,622][0m Trial 185 finished with value: 0.8437493061044126 and parameters: {'n_hidden': 1024, 'mixture_components': 5, 'use_sparse_layer': True, 'use_sparse_loss': False, 'use_batchnorm': False, 'use_dropout': False, 'mlp_size_1': 5, 'mlp_size_2': 1, 'mlp_size_3': 1, 'kernel': 'Normal', 'loss_name': 'NLLLoss'}. Best is trial 17 with value: 0.8538600001453517.[0m
[32m[I 2022-04-21 19:06:44,156][0m Trial 186 finished with value: 0.601307018396741 and parameters: {'n_hidden': 512, 'mixture_components': 6, 'use_sparse_layer': False, 'use_batchnorm': True, 'use_dropout': False, 'mlp_size_1': 6, 'mlp_size_2': 0, 'mlp_size_3': 0, 'kernel': 'LogLogistic', 'loss_name': 'NLLLoss'}. Best is trial 17 with value: 0.8538600001453517.[0m
[32m[I 2022-04-21 19:09:48,811][0m Trial 187 finished with value: 0.8427617053933887 and parameters: {'n_hidden': 128, 'mixture_components': 4, 'use_sparse_layer': False, 'use_batchnorm': False, 'use_dropout': False, 'mlp_size_1': 4, 'mlp_size_2': 0, 'mlp_size_3': 0, 'kernel': 'Normal', 'loss_name': 'AlternativeNLLLoss'}. Best is trial 17 with value: 0.8538600001453517.[0m
[32m[I 2022-04-21 19:11:26,841][0m Trial 188 finished with value: 0.8440278347220461 and parameters: {'n_hidden': 512, 'mixture_components': 3, 'use_sparse_layer': False, 'use_batchnorm': False, 'use_dropout': False, 'mlp_size_1': 6, 'mlp_size_2': 0, 'mlp_size_3': 0, 'kernel': 'LogLogistic', 'loss_name': 'CensoredNLLLoss'}. Best is trial 17 with value: 0.8538600001453517.[0m
[32m[I 2022-04-21 19:13:40,158][0m Trial 189 finished with value: 0.8447108802078471 and parameters: {'n_hidden': 1024, 'mixture_components': 9, 'use_sparse_layer': True, 'use_sparse_loss': True, 'lmbd': 1.2377530105692178e-05, 'use_batchnorm': False, 'use_dropout': False, 'mlp_size_1': 3, 'mlp_size_2': 2, 'mlp_size_3': 2, 'kernel': 'Normal', 'loss_name': 'AlternativeNLLLoss'}. Best is trial 17 with value: 0.8538600001453517.[0m
[32m[I 2022-04-21 19:16:00,138][0m Trial 190 finished with value: 0.729553152833534 and parameters: {'n_hidden': 2048, 'mixture_components': 5, 'use_sparse_layer': False, 'use_batchnorm': False, 'use_dropout': False, 'mlp_size_1': 8, 'mlp_size_2': 0, 'mlp_size_3': 0, 'kernel': 'LogLogistic', 'loss_name': 'NLLLoss'}. Best is trial 17 with value: 0.8538600001453517.[0m
[32m[I 2022-04-21 19:18:14,312][0m Trial 191 finished with value: 0.7381678075152116 and parameters: {'n_hidden': 512, 'mixture_components': 5, 'use_sparse_layer': False, 'use_batchnorm': False, 'use_dropout': False, 'mlp_size_1': 6, 'mlp_size_2': 0, 'mlp_size_3': 0, 'kernel': 'LogLogistic', 'loss_name': 'AlternativeNLLLoss'}. Best is trial 17 with value: 0.8538600001453517.[0m
[32m[I 2022-04-21 19:20:12,560][0m Trial 192 finished with value: 0.8491544051370374 and parameters: {'n_hidden': 512, 'mixture_components': 5, 'use_sparse_layer': False, 'use_batchnorm': False, 'use_dropout': False, 'mlp_size_1': 6, 'mlp_size_2': 0, 'mlp_size_3': 0, 'kernel': 'LogLogistic', 'loss_name': 'AlternativeNLLLoss'}. Best is trial 17 with value: 0.8538600001453517.[0m
[32m[I 2022-04-21 19:22:00,223][0m Trial 193 finished with value: 0.8430085826179148 and parameters: {'n_hidden': 512, 'mixture_components': 5, 'use_sparse_layer': False, 'use_batchnorm': False, 'use_dropout': False, 'mlp_size_1': 6, 'mlp_size_2': 0, 'mlp_size_3': 0, 'kernel': 'LogLogistic', 'loss_name': 'AlternativeNLLLoss'}. Best is trial 17 with value: 0.8538600001453517.[0m
[32m[I 2022-04-21 19:24:09,310][0m Trial 194 finished with value: 0.8373517126222094 and parameters: {'n_hidden': 512, 'mixture_components': 5, 'use_sparse_layer': False, 'use_batchnorm': False, 'use_dropout': False, 'mlp_size_1': 6, 'mlp_size_2': 0, 'mlp_size_3': 0, 'kernel': 'LogLogistic', 'loss_name': 'AlternativeNLLLoss'}. Best is trial 17 with value: 0.8538600001453517.[0m
[32m[I 2022-04-21 19:26:33,592][0m Trial 195 finished with value: 0.8409163776846137 and parameters: {'n_hidden': 512, 'mixture_components': 3, 'use_sparse_layer': False, 'use_batchnorm': False, 'use_dropout': False, 'mlp_size_1': 6, 'mlp_size_2': 0, 'mlp_size_3': 0, 'kernel': 'LogLogistic', 'loss_name': 'AlternativeNLLLoss'}. Best is trial 17 with value: 0.8538600001453517.[0m
[32m[I 2022-04-21 19:29:26,120][0m Trial 196 finished with value: 0.8359660845691639 and parameters: {'n_hidden': 512, 'mixture_components': 4, 'use_sparse_layer': False, 'use_batchnorm': False, 'use_dropout': False, 'mlp_size_1': 6, 'mlp_size_2': 0, 'mlp_size_3': 0, 'kernel': 'Normal', 'loss_name': 'AlternativeNLLLoss'}. Best is trial 17 with value: 0.8538600001453517.[0m
[32m[I 2022-04-21 19:31:50,135][0m Trial 197 finished with value: 0.8413445949292967 and parameters: {'n_hidden': 32, 'mixture_components': 6, 'use_sparse_layer': False, 'use_batchnorm': False, 'use_dropout': False, 'mlp_size_1': 2, 'mlp_size_2': 0, 'mlp_size_3': 0, 'kernel': 'LogLogistic', 'loss_name': 'AlternativeNLLLoss'}. Best is trial 17 with value: 0.8538600001453517.[0m
[32m[I 2022-04-21 19:33:26,055][0m Trial 198 finished with value: 0.8411237461252512 and parameters: {'n_hidden': 512, 'mixture_components': 5, 'use_sparse_layer': False, 'use_batchnorm': False, 'use_dropout': False, 'mlp_size_1': 6, 'mlp_size_2': 0, 'mlp_size_3': 0, 'kernel': 'Normal', 'loss_name': 'NLLLoss'}. Best is trial 17 with value: 0.8538600001453517.[0m
[32m[I 2022-04-21 19:35:18,342][0m Trial 199 finished with value: 0.8451397945764942 and parameters: {'n_hidden': 1024, 'mixture_components': 4, 'use_sparse_layer': True, 'use_sparse_loss': False, 'use_batchnorm': False, 'use_dropout': False, 'mlp_size_1': 5, 'mlp_size_2': 1, 'mlp_size_3': 1, 'kernel': 'LogLogistic', 'loss_name': 'CensoredNLLLoss'}. Best is trial 17 with value: 0.8538600001453517.[0m
[32m[I 2022-04-21 19:36:42,479][0m Trial 200 finished with value: 0.7272010847640352 and parameters: {'n_hidden': 512, 'mixture_components': 3, 'use_sparse_layer': False, 'use_batchnorm': False, 'use_dropout': False, 'mlp_size_1': 6, 'mlp_size_2': 0, 'mlp_size_3': 0, 'kernel': 'Gumbel', 'loss_name': 'AlternativeNLLLoss'}. Best is trial 17 with value: 0.8538600001453517.[0m
[32m[I 2022-04-21 19:38:41,324][0m Trial 201 finished with value: 0.8425420272198973 and parameters: {'n_hidden': 512, 'mixture_components': 5, 'use_sparse_layer': False, 'use_batchnorm': False, 'use_dropout': False, 'mlp_size_1': 6, 'mlp_size_2': 0, 'mlp_size_3': 0, 'kernel': 'LogLogistic', 'loss_name': 'AlternativeNLLLoss'}. Best is trial 17 with value: 0.8538600001453517.[0m
[32m[I 2022-04-21 19:41:48,839][0m Trial 202 finished with value: 0.7188386729580849 and parameters: {'n_hidden': 512, 'mixture_components': 5, 'use_sparse_layer': False, 'use_batchnorm': False, 'use_dropout': False, 'mlp_size_1': 6, 'mlp_size_2': 0, 'mlp_size_3': 0, 'kernel': 'LogLogistic', 'loss_name': 'AlternativeNLLLoss'}. Best is trial 17 with value: 0.8538600001453517.[0m
[32m[I 2022-04-21 19:44:02,353][0m Trial 203 finished with value: 0.8374561044012431 and parameters: {'n_hidden': 512, 'mixture_components': 5, 'use_sparse_layer': False, 'use_batchnorm': False, 'use_dropout': False, 'mlp_size_1': 6, 'mlp_size_2': 0, 'mlp_size_3': 0, 'kernel': 'LogLogistic', 'loss_name': 'AlternativeNLLLoss'}. Best is trial 17 with value: 0.8538600001453517.[0m
[32m[I 2022-04-21 19:46:15,404][0m Trial 204 finished with value: 0.7418233013856617 and parameters: {'n_hidden': 512, 'mixture_components': 5, 'use_sparse_layer': False, 'use_batchnorm': False, 'use_dropout': False, 'mlp_size_1': 6, 'mlp_size_2': 0, 'mlp_size_3': 0, 'kernel': 'LogLogistic', 'loss_name': 'AlternativeNLLLoss'}. Best is trial 17 with value: 0.8538600001453517.[0m
[32m[I 2022-04-21 19:48:33,224][0m Trial 205 finished with value: 0.8407428297423047 and parameters: {'n_hidden': 2048, 'mixture_components': 4, 'use_sparse_layer': False, 'use_batchnorm': False, 'use_dropout': False, 'mlp_size_1': 7, 'mlp_size_2': 1, 'mlp_size_3': 0, 'kernel': 'Normal', 'loss_name': 'NLLLoss'}. Best is trial 17 with value: 0.8538600001453517.[0m
[32m[I 2022-04-21 19:51:05,463][0m Trial 206 finished with value: 0.836698660644274 and parameters: {'n_hidden': 64, 'mixture_components': 5, 'use_sparse_layer': False, 'use_batchnorm': False, 'use_dropout': False, 'mlp_size_1': 3, 'mlp_size_2': 0, 'mlp_size_3': 0, 'kernel': 'LogLogistic', 'loss_name': 'AlternativeNLLLoss'}. Best is trial 17 with value: 0.8538600001453517.[0m
[32m[I 2022-04-21 19:53:38,212][0m Trial 207 finished with value: 0.43652486849632915 and parameters: {'n_hidden': 512, 'mixture_components': 3, 'use_sparse_layer': False, 'use_batchnorm': False, 'use_dropout': True, 'dropout': 0.6366592238765011, 'mlp_size_1': 6, 'mlp_size_2': 0, 'mlp_size_3': 0, 'kernel': 'Normal', 'loss_name': 'AlternativeNLLLoss'}. Best is trial 17 with value: 0.8538600001453517.[0m
[32m[I 2022-04-21 19:55:47,084][0m Trial 208 finished with value: 0.8387688072655719 and parameters: {'n_hidden': 1024, 'mixture_components': 6, 'use_sparse_layer': False, 'use_batchnorm': False, 'use_dropout': False, 'mlp_size_1': 5, 'mlp_size_2': 1, 'mlp_size_3': 1, 'kernel': 'LogLogistic', 'loss_name': 'NLLLoss'}. Best is trial 17 with value: 0.8538600001453517.[0m
[32m[I 2022-04-21 19:58:21,109][0m Trial 209 finished with value: 0.7379495551923929 and parameters: {'n_hidden': 2048, 'mixture_components': 10, 'use_sparse_layer': True, 'use_sparse_loss': False, 'use_batchnorm': False, 'use_dropout': False, 'mlp_size_1': 7, 'mlp_size_2': 1, 'mlp_size_3': 0, 'kernel': 'Normal', 'loss_name': 'AlternativeNLLLoss'}. Best is trial 17 with value: 0.8538600001453517.[0m
[32m[I 2022-04-21 20:00:35,988][0m Trial 210 finished with value: 0.8379610404115541 and parameters: {'n_hidden': 512, 'mixture_components': 5, 'use_sparse_layer': False, 'use_batchnorm': False, 'use_dropout': False, 'mlp_size_1': 6, 'mlp_size_2': 0, 'mlp_size_3': 0, 'kernel': 'LogLogistic', 'loss_name': 'NLLLoss'}. Best is trial 17 with value: 0.8538600001453517.[0m
[32m[I 2022-04-21 20:03:00,876][0m Trial 211 finished with value: 0.8435541702134689 and parameters: {'n_hidden': 2048, 'mixture_components': 6, 'use_sparse_layer': False, 'use_batchnorm': False, 'use_dropout': False, 'mlp_size_1': 7, 'mlp_size_2': 1, 'mlp_size_3': 0, 'kernel': 'Normal', 'loss_name': 'NLLLoss'}. Best is trial 17 with value: 0.8538600001453517.[0m
[32m[I 2022-04-21 20:05:29,076][0m Trial 212 finished with value: 0.8369623987439512 and parameters: {'n_hidden': 2048, 'mixture_components': 6, 'use_sparse_layer': False, 'use_batchnorm': False, 'use_dropout': False, 'mlp_size_1': 7, 'mlp_size_2': 1, 'mlp_size_3': 0, 'kernel': 'Normal', 'loss_name': 'NLLLoss'}. Best is trial 17 with value: 0.8538600001453517.[0m
[32m[I 2022-04-21 20:07:18,197][0m Trial 213 finished with value: 0.8369312800446302 and parameters: {'n_hidden': 2048, 'mixture_components': 6, 'use_sparse_layer': False, 'use_batchnorm': False, 'use_dropout': False, 'mlp_size_1': 7, 'mlp_size_2': 1, 'mlp_size_3': 0, 'kernel': 'Normal', 'loss_name': 'NLLLoss'}. Best is trial 17 with value: 0.8538600001453517.[0m
[32m[I 2022-04-21 20:08:53,452][0m Trial 214 finished with value: 0.7469962178806713 and parameters: {'n_hidden': 2048, 'mixture_components': 6, 'use_sparse_layer': False, 'use_batchnorm': False, 'use_dropout': False, 'mlp_size_1': 1, 'mlp_size_2': 5, 'mlp_size_3': 1, 'kernel': 'Normal', 'loss_name': 'NLLLoss'}. Best is trial 17 with value: 0.8538600001453517.[0m
[32m[I 2022-04-21 20:10:38,933][0m Trial 215 finished with value: 0.8376853803602262 and parameters: {'n_hidden': 256, 'mixture_components': 5, 'use_sparse_layer': False, 'use_batchnorm': False, 'use_dropout': False, 'mlp_size_1': 5, 'mlp_size_2': 0, 'mlp_size_3': 0, 'kernel': 'Normal', 'loss_name': 'NLLLoss'}. Best is trial 17 with value: 0.8538600001453517.[0m
[32m[I 2022-04-21 20:12:56,760][0m Trial 216 finished with value: 0.8432945812418261 and parameters: {'n_hidden': 2048, 'mixture_components': 4, 'use_sparse_layer': False, 'use_batchnorm': False, 'use_dropout': False, 'mlp_size_1': 8, 'mlp_size_2': 0, 'mlp_size_3': 0, 'kernel': 'Normal', 'loss_name': 'CensoredNLLLoss'}. Best is trial 17 with value: 0.8538600001453517.[0m
[32m[I 2022-04-21 20:17:54,467][0m Trial 217 finished with value: 0.5287767623159682 and parameters: {'n_hidden': 512, 'mixture_components': 7, 'use_sparse_layer': False, 'use_batchnorm': True, 'use_dropout': False, 'mlp_size_1': 6, 'mlp_size_2': 0, 'mlp_size_3': 0, 'kernel': 'Logistic', 'loss_name': 'AlternativeNLLLoss'}. Best is trial 17 with value: 0.8538600001453517.[0m
[32m[I 2022-04-21 20:19:52,153][0m Trial 218 finished with value: 0.8427702115270546 and parameters: {'n_hidden': 1024, 'mixture_components': 9, 'use_sparse_layer': True, 'use_sparse_loss': True, 'lmbd': 0.010246267231688519, 'use_batchnorm': False, 'use_dropout': False, 'mlp_size_1': 5, 'mlp_size_2': 1, 'mlp_size_3': 1, 'kernel': 'Normal', 'loss_name': 'NLLLoss'}. Best is trial 17 with value: 0.8538600001453517.[0m
[32m[I 2022-04-21 20:22:15,325][0m Trial 219 finished with value: 0.8407598847664769 and parameters: {'n_hidden': 512, 'mixture_components': 4, 'use_sparse_layer': False, 'use_batchnorm': False, 'use_dropout': False, 'mlp_size_1': 6, 'mlp_size_2': 0, 'mlp_size_3': 0, 'kernel': 'LogLogistic', 'loss_name': 'AlternativeNLLLoss'}. Best is trial 17 with value: 0.8538600001453517.[0m
[32m[I 2022-04-21 20:24:25,624][0m Trial 220 finished with value: 0.8419998996125466 and parameters: {'n_hidden': 2048, 'mixture_components': 3, 'use_sparse_layer': False, 'use_batchnorm': False, 'use_dropout': False, 'mlp_size_1': 7, 'mlp_size_2': 1, 'mlp_size_3': 0, 'kernel': 'Normal', 'loss_name': 'NLLLoss'}. Best is trial 17 with value: 0.8538600001453517.[0m
[32m[I 2022-04-21 20:25:55,272][0m Trial 221 finished with value: 0.8445819107525978 and parameters: {'n_hidden': 512, 'mixture_components': 5, 'use_sparse_layer': False, 'use_batchnorm': False, 'use_dropout': False, 'mlp_size_1': 6, 'mlp_size_2': 0, 'mlp_size_3': 0, 'kernel': 'Exponential', 'loss_name': 'NLLLoss'}. Best is trial 17 with value: 0.8538600001453517.[0m
[32m[I 2022-04-21 20:27:23,507][0m Trial 222 finished with value: 0.8395191353568816 and parameters: {'n_hidden': 512, 'mixture_components': 5, 'use_sparse_layer': False, 'use_batchnorm': False, 'use_dropout': False, 'mlp_size_1': 6, 'mlp_size_2': 0, 'mlp_size_3': 0, 'kernel': 'Exponential', 'loss_name': 'NLLLoss'}. Best is trial 17 with value: 0.8538600001453517.[0m
