[32m[I 2022-04-21 11:39:25,270][0m Trial 261 finished with value: 0.6738476114655684 and parameters: {'splitter': 'random', 'min_samples_split': 0.036425629805949086, 'min_samples_leaf': 0.1899206612711363, 'min_weight_fraction_leaf': 0.14198945732218293, 'max_features': 0.8435910730960943}. Best is trial 11 with value: 0.6773038119717333.[0m
[32m[I 2022-04-21 11:39:25,330][0m Trial 262 finished with value: 0.6738476114655684 and parameters: {'splitter': 'random', 'min_samples_split': 0.04957322558634157, 'min_samples_leaf': 0.16800302627111732, 'min_weight_fraction_leaf': 0.1277281842488567, 'max_features': 0.9732130503102498}. Best is trial 11 with value: 0.6773038119717333.[0m
[32m[I 2022-04-21 11:39:25,403][0m Trial 263 finished with value: 0.6665385065440175 and parameters: {'splitter': 'best', 'min_samples_split': 0.33158052887871825, 'min_samples_leaf': 0.15064805271277018, 'min_weight_fraction_leaf': 0.05701876444207519, 'max_features': 0.92852537885119}. Best is trial 11 with value: 0.6773038119717333.[0m
[32m[I 2022-04-21 11:39:25,453][0m Trial 264 finished with value: 0.6738476114655684 and parameters: {'splitter': 'random', 'min_samples_split': 0.28139182340954294, 'min_samples_leaf': 0.08256311178872519, 'min_weight_fraction_leaf': 0.1834288786786268, 'max_features': 0.9007858365603049}. Best is trial 11 with value: 0.6773038119717333.[0m
[32m[I 2022-04-21 11:39:25,502][0m Trial 265 finished with value: 0.662800366349585 and parameters: {'splitter': 'random', 'min_samples_split': 0.2752099961203466, 'min_samples_leaf': 0.1453736315637397, 'min_weight_fraction_leaf': 0.1631693358009802, 'max_features': 0.9021844375080544}. Best is trial 11 with value: 0.6773038119717333.[0m
[32m[I 2022-04-21 11:39:25,573][0m Trial 266 finished with value: 0.6660068201889194 and parameters: {'splitter': 'random', 'min_samples_split': 0.3127317299413829, 'min_samples_leaf': 0.03201532590108951, 'min_weight_fraction_leaf': 0.03657027587552738, 'max_features': 0.9272486486919985}. Best is trial 11 with value: 0.6773038119717333.[0m
[32m[I 2022-04-21 11:39:25,625][0m Trial 267 finished with value: 0.6738476114655684 and parameters: {'splitter': 'random', 'min_samples_split': 0.26439850903790574, 'min_samples_leaf': 0.18101596753057853, 'min_weight_fraction_leaf': 0.15260882329971712, 'max_features': 0.8662966981326146}. Best is trial 11 with value: 0.6773038119717333.[0m
[32m[I 2022-04-21 11:39:25,677][0m Trial 268 finished with value: 0.6551405301163737 and parameters: {'splitter': 'random', 'min_samples_split': 0.009962804892163224, 'min_samples_leaf': 0.14008542856658018, 'min_weight_fraction_leaf': 0.21769168304422787, 'max_features': 0.9620336090466751}. Best is trial 11 with value: 0.6773038119717333.[0m
[32m[I 2022-04-21 11:39:25,734][0m Trial 269 finished with value: 0.6738476114655684 and parameters: {'splitter': 'random', 'min_samples_split': 0.22399289387119267, 'min_samples_leaf': 0.10291993159404937, 'min_weight_fraction_leaf': 0.19933034510630548, 'max_features': 0.82927004768989}. Best is trial 11 with value: 0.6773038119717333.[0m
[32m[I 2022-04-21 11:39:25,789][0m Trial 270 finished with value: 0.6647456324911225 and parameters: {'splitter': 'random', 'min_samples_split': 0.0645853824030289, 'min_samples_leaf': 0.09576695296572413, 'min_weight_fraction_leaf': 0.06470469325041395, 'max_features': 0.9581950220189742}. Best is trial 11 with value: 0.6773038119717333.[0m
[32m[I 2022-04-21 11:39:25,837][0m Trial 271 finished with value: 0.6647456324911225 and parameters: {'splitter': 'random', 'min_samples_split': 0.22586206128555938, 'min_samples_leaf': 0.0998454556631725, 'min_weight_fraction_leaf': 0.08289557657143122, 'max_features': 0.9780000640031573}. Best is trial 11 with value: 0.6773038119717333.[0m
[32m[I 2022-04-21 11:39:25,881][0m Trial 272 finished with value: 0.6586187582319654 and parameters: {'splitter': 'random', 'min_samples_split': 0.04076558728620028, 'min_samples_leaf': 0.20482325905580367, 'min_weight_fraction_leaf': 0.049282637020464044, 'max_features': 0.9084408520222902}. Best is trial 11 with value: 0.6773038119717333.[0m
[32m[I 2022-04-21 11:39:25,933][0m Trial 273 finished with value: 0.6586187582319654 and parameters: {'splitter': 'random', 'min_samples_split': 0.01730472793277943, 'min_samples_leaf': 0.1980957836533291, 'min_weight_fraction_leaf': 0.2024049592119615, 'max_features': 0.9198037201952969}. Best is trial 11 with value: 0.6773038119717333.[0m
[32m[I 2022-04-21 11:39:25,991][0m Trial 274 finished with value: 0.6360776294262513 and parameters: {'splitter': 'random', 'min_samples_split': 0.2156303332014493, 'min_samples_leaf': 0.0869496704376806, 'min_weight_fraction_leaf': 0.02621344476698148, 'max_features': 0.17774809095615918}. Best is trial 11 with value: 0.6773038119717333.[0m
[32m[I 2022-04-21 11:39:26,052][0m Trial 275 finished with value: 0.5 and parameters: {'splitter': 'random', 'min_samples_split': 0.22739301929281158, 'min_samples_leaf': 0.3349275900963535, 'min_weight_fraction_leaf': 0.1891728747156323, 'max_features': 0.9799283539908898}. Best is trial 11 with value: 0.6773038119717333.[0m
[32m[I 2022-04-21 11:39:26,112][0m Trial 276 finished with value: 0.6543938115635641 and parameters: {'splitter': 'random', 'min_samples_split': 0.3829334328896144, 'min_samples_leaf': 0.15926105657099965, 'min_weight_fraction_leaf': 0.11544683410478548, 'max_features': 0.9944826962545296}. Best is trial 11 with value: 0.6773038119717333.[0m
[32m[I 2022-04-21 11:39:26,176][0m Trial 277 finished with value: 0.5 and parameters: {'splitter': 'random', 'min_samples_split': 0.4464389173627411, 'min_samples_leaf': 0.35097326193072564, 'min_weight_fraction_leaf': 0.1684649972407771, 'max_features': 0.8160080903132406}. Best is trial 11 with value: 0.6773038119717333.[0m
[32m[I 2022-04-21 11:39:26,239][0m Trial 278 finished with value: 0.6543938115635641 and parameters: {'splitter': 'random', 'min_samples_split': 0.4021189961703219, 'min_samples_leaf': 0.0364769495826565, 'min_weight_fraction_leaf': 0.15331157823544875, 'max_features': 0.9211467610868128}. Best is trial 11 with value: 0.6773038119717333.[0m
[32m[I 2022-04-21 11:39:26,293][0m Trial 279 finished with value: 0.5 and parameters: {'splitter': 'random', 'min_samples_split': 0.2380180580460375, 'min_samples_leaf': 0.45461378211664194, 'min_weight_fraction_leaf': 0.2816185562698494, 'max_features': 0.9108403511355394}. Best is trial 11 with value: 0.6773038119717333.[0m
[32m[I 2022-04-21 11:39:26,368][0m Trial 280 finished with value: 0.6586187582319654 and parameters: {'splitter': 'random', 'min_samples_split': 0.3917305043188652, 'min_samples_leaf': 0.018096430218505842, 'min_weight_fraction_leaf': 0.21076023693989018, 'max_features': 0.8606927462332044}. Best is trial 11 with value: 0.6773038119717333.[0m
[32m[I 2022-04-21 11:39:26,431][0m Trial 281 finished with value: 0.6636900948801576 and parameters: {'splitter': 'best', 'min_samples_split': 0.3501827221379243, 'min_samples_leaf': 0.23541269224484465, 'min_weight_fraction_leaf': 0.07313441193828871, 'max_features': 0.780893113400193}. Best is trial 11 with value: 0.6773038119717333.[0m
[32m[I 2022-04-21 11:39:26,481][0m Trial 282 finished with value: 0.6738476114655684 and parameters: {'splitter': 'random', 'min_samples_split': 0.0276812383580813, 'min_samples_leaf': 0.1499958402924129, 'min_weight_fraction_leaf': 0.17107732127728234, 'max_features': 0.9377938571884002}. Best is trial 11 with value: 0.6773038119717333.[0m
[32m[I 2022-04-21 11:39:26,529][0m Trial 283 finished with value: 0.662800366349585 and parameters: {'splitter': 'random', 'min_samples_split': 0.24927289252224, 'min_samples_leaf': 0.1641233197182517, 'min_weight_fraction_leaf': 0.0877789651985338, 'max_features': 0.9391733485081567}. Best is trial 11 with value: 0.6773038119717333.[0m
[32m[I 2022-04-21 11:39:26,635][0m Trial 284 finished with value: 0.6738476114655684 and parameters: {'splitter': 'random', 'min_samples_split': 0.1789645712352704, 'min_samples_leaf': 0.007865550417474993, 'min_weight_fraction_leaf': 0.18131542176210866, 'max_features': 0.9774512006102635}. Best is trial 11 with value: 0.6773038119717333.[0m
[32m[I 2022-04-21 11:39:26,689][0m Trial 285 finished with value: 0.6738476114655684 and parameters: {'splitter': 'random', 'min_samples_split': 0.20448140026070735, 'min_samples_leaf': 0.09557119776270938, 'min_weight_fraction_leaf': 0.17684828695958646, 'max_features': 0.822880362883806}. Best is trial 11 with value: 0.6773038119717333.[0m
[32m[I 2022-04-21 11:39:26,745][0m Trial 286 finished with value: 0.6738476114655684 and parameters: {'splitter': 'random', 'min_samples_split': 0.3721408651633916, 'min_samples_leaf': 0.10502254462561124, 'min_weight_fraction_leaf': 0.1730659563415425, 'max_features': 0.8118254901802068}. Best is trial 11 with value: 0.6773038119717333.[0m
[32m[I 2022-04-21 11:39:26,796][0m Trial 287 finished with value: 0.6738476114655684 and parameters: {'splitter': 'random', 'min_samples_split': 0.16457497008521552, 'min_samples_leaf': 0.14098013010855898, 'min_weight_fraction_leaf': 0.1819812459467276, 'max_features': 0.9619211132131882}. Best is trial 11 with value: 0.6773038119717333.[0m
[32m[I 2022-04-21 11:39:26,848][0m Trial 288 finished with value: 0.6640701022932763 and parameters: {'splitter': 'random', 'min_samples_split': 0.11037167996153216, 'min_samples_leaf': 0.1341443675222981, 'min_weight_fraction_leaf': 0.004959775347816662, 'max_features': 0.8779823009454123}. Best is trial 11 with value: 0.6773038119717333.[0m
[32m[I 2022-04-21 11:39:26,930][0m Trial 289 finished with value: 0.5 and parameters: {'splitter': 'random', 'min_samples_split': 0.09172128350913013, 'min_samples_leaf': 0.0718777215521531, 'min_weight_fraction_leaf': 0.31121763466237573, 'max_features': 0.9578472050673306}. Best is trial 11 with value: 0.6773038119717333.[0m
[32m[I 2022-04-21 11:39:26,997][0m Trial 290 finished with value: 0.6738476114655684 and parameters: {'splitter': 'random', 'min_samples_split': 0.19020070296651384, 'min_samples_leaf': 0.18927861929361692, 'min_weight_fraction_leaf': 0.14171418547060297, 'max_features': 0.8560526815969179}. Best is trial 11 with value: 0.6773038119717333.[0m
[32m[I 2022-04-21 11:39:27,047][0m Trial 291 finished with value: 0.5 and parameters: {'splitter': 'random', 'min_samples_split': 0.19083257693219552, 'min_samples_leaf': 0.18770826612501115, 'min_weight_fraction_leaf': 0.13493200530569316, 'max_features': 0.753684479780498}. Best is trial 11 with value: 0.6773038119717333.[0m
[32m[I 2022-04-21 11:39:27,100][0m Trial 292 finished with value: 0.6738476114655684 and parameters: {'splitter': 'random', 'min_samples_split': 0.170213582772508, 'min_samples_leaf': 0.19223801845185443, 'min_weight_fraction_leaf': 0.13010174315459, 'max_features': 0.8410468155479149}. Best is trial 11 with value: 0.6773038119717333.[0m
[32m[I 2022-04-21 11:39:27,150][0m Trial 293 finished with value: 0.6738476114655684 and parameters: {'splitter': 'random', 'min_samples_split': 0.18124141658016063, 'min_samples_leaf': 0.17526856663810586, 'min_weight_fraction_leaf': 0.14497464439467225, 'max_features': 0.9402647472361416}. Best is trial 11 with value: 0.6773038119717333.[0m
[32m[I 2022-04-21 11:39:27,218][0m Trial 294 finished with value: 0.6738476114655684 and parameters: {'splitter': 'random', 'min_samples_split': 0.26424521145876256, 'min_samples_leaf': 0.16885127839030473, 'min_weight_fraction_leaf': 0.15613122285982675, 'max_features': 0.9434556340399758}. Best is trial 11 with value: 0.6773038119717333.[0m
[32m[I 2022-04-21 11:39:27,273][0m Trial 295 finished with value: 0.6738476114655684 and parameters: {'splitter': 'random', 'min_samples_split': 0.2847960984328967, 'min_samples_leaf': 0.05245710173226809, 'min_weight_fraction_leaf': 0.19102838778161213, 'max_features': 0.9289431471365452}. Best is trial 11 with value: 0.6773038119717333.[0m
[32m[I 2022-04-21 11:39:27,322][0m Trial 296 finished with value: 0.6738476114655684 and parameters: {'splitter': 'random', 'min_samples_split': 0.2838686490889224, 'min_samples_leaf': 0.05990263406554367, 'min_weight_fraction_leaf': 0.19975848424222162, 'max_features': 0.9293611888292544}. Best is trial 11 with value: 0.6773038119717333.[0m
[32m[I 2022-04-21 11:39:27,392][0m Trial 297 finished with value: 0.6738476114655684 and parameters: {'splitter': 'random', 'min_samples_split': 0.21299461750828405, 'min_samples_leaf': 0.060388800815244295, 'min_weight_fraction_leaf': 0.19271855291212464, 'max_features': 0.9572277349111136}. Best is trial 11 with value: 0.6773038119717333.[0m
[32m[I 2022-04-21 11:39:27,450][0m Trial 298 finished with value: 0.6551405301163737 and parameters: {'splitter': 'random', 'min_samples_split': 0.4773817684018192, 'min_samples_leaf': 0.05835553781937646, 'min_weight_fraction_leaf': 0.207499185882493, 'max_features': 0.9525749383082229}. Best is trial 11 with value: 0.6773038119717333.[0m
[32m[I 2022-04-21 11:39:27,499][0m Trial 299 finished with value: 0.6551405301163737 and parameters: {'splitter': 'random', 'min_samples_split': 0.18287475494294073, 'min_samples_leaf': 0.00455014369549918, 'min_weight_fraction_leaf': 0.22217039003487052, 'max_features': 0.9803550157896761}. Best is trial 11 with value: 0.6773038119717333.[0m
[32m[I 2022-04-21 11:39:27,562][0m Trial 300 finished with value: 0.6738476114655684 and parameters: {'splitter': 'random', 'min_samples_split': 0.4432397498128453, 'min_samples_leaf': 0.002813981987323345, 'min_weight_fraction_leaf': 0.19014829403899133, 'max_features': 0.8947519475606691}. Best is trial 11 with value: 0.6773038119717333.[0m
[32m[I 2022-04-21 11:39:27,634][0m Trial 301 finished with value: 0.6738476114655684 and parameters: {'splitter': 'random', 'min_samples_split': 0.2519243930086497, 'min_samples_leaf': 0.02887383322824884, 'min_weight_fraction_leaf': 0.16884072798788485, 'max_features': 0.8817474769437813}. Best is trial 11 with value: 0.6773038119717333.[0m
[32m[I 2022-04-21 11:39:27,711][0m Trial 302 finished with value: 0.6738476114655684 and parameters: {'splitter': 'random', 'min_samples_split': 0.22197841060327675, 'min_samples_leaf': 0.021318045945908887, 'min_weight_fraction_leaf': 0.16968850797913435, 'max_features': 0.8252775000673298}. Best is trial 11 with value: 0.6773038119717333.[0m
[32m[I 2022-04-21 11:39:27,799][0m Trial 303 finished with value: 0.6665385065440175 and parameters: {'splitter': 'best', 'min_samples_split': 0.4156412591199363, 'min_samples_leaf': 0.15488359485310121, 'min_weight_fraction_leaf': 0.1559740639487983, 'max_features': 0.9120892028625637}. Best is trial 11 with value: 0.6773038119717333.[0m
[32m[I 2022-04-21 11:39:27,836][0m Trial 304 finished with value: 0.5 and parameters: {'splitter': 'random', 'min_samples_split': 0.07006909287293732, 'min_samples_leaf': 0.293528532225105, 'min_weight_fraction_leaf': 0.17893733641821052, 'max_features': 0.9996134851420886}. Best is trial 11 with value: 0.6773038119717333.[0m
[32m[I 2022-04-21 11:39:27,907][0m Trial 305 finished with value: 0.5931624331547747 and parameters: {'splitter': 'random', 'min_samples_split': 0.029236126194255665, 'min_samples_leaf': 0.14862862161161572, 'min_weight_fraction_leaf': 0.23729143927177274, 'max_features': 0.9539926376317288}. Best is trial 11 with value: 0.6773038119717333.[0m
[32m[I 2022-04-21 11:39:27,972][0m Trial 306 finished with value: 0.6738476114655684 and parameters: {'splitter': 'random', 'min_samples_split': 0.20628450823124717, 'min_samples_leaf': 0.1267468479478301, 'min_weight_fraction_leaf': 0.2009560372453258, 'max_features': 0.8741781093668409}. Best is trial 11 with value: 0.6773038119717333.[0m
[32m[I 2022-04-21 11:39:28,040][0m Trial 307 finished with value: 0.6586187582319654 and parameters: {'splitter': 'random', 'min_samples_split': 0.41432083704589995, 'min_samples_leaf': 0.04107399293136945, 'min_weight_fraction_leaf': 0.20842242525006893, 'max_features': 0.8919476200842785}. Best is trial 11 with value: 0.6773038119717333.[0m
[32m[I 2022-04-21 11:39:28,084][0m Trial 308 finished with value: 0.6586187582319654 and parameters: {'splitter': 'random', 'min_samples_split': 0.37901387327978225, 'min_samples_leaf': 0.21067805134807552, 'min_weight_fraction_leaf': 0.1929062712699859, 'max_features': 0.9050937311823561}. Best is trial 11 with value: 0.6773038119717333.[0m
[32m[I 2022-04-21 11:39:28,144][0m Trial 309 finished with value: 0.6738476114655684 and parameters: {'splitter': 'random', 'min_samples_split': 0.14142547188467008, 'min_samples_leaf': 0.017575067793312363, 'min_weight_fraction_leaf': 0.1996128295604464, 'max_features': 0.8674566057856244}. Best is trial 11 with value: 0.6773038119717333.[0m
[32m[I 2022-04-21 11:39:28,220][0m Trial 310 finished with value: 0.6551405301163737 and parameters: {'splitter': 'random', 'min_samples_split': 0.13544219800086052, 'min_samples_leaf': 0.012585323137980602, 'min_weight_fraction_leaf': 0.21548093315119438, 'max_features': 0.9957264508877202}. Best is trial 11 with value: 0.6773038119717333.[0m
[32m[I 2022-04-21 11:39:28,266][0m Trial 311 finished with value: 0.6447952548096312 and parameters: {'splitter': 'random', 'min_samples_split': 0.49205051927586396, 'min_samples_leaf': 0.0036620174942126717, 'min_weight_fraction_leaf': 0.19052448329266036, 'max_features': 0.9658749958255838}. Best is trial 11 with value: 0.6773038119717333.[0m
[32m[I 2022-04-21 11:39:28,384][0m Trial 312 finished with value: 0.5 and parameters: {'splitter': 'random', 'min_samples_split': 0.04059827997284725, 'min_samples_leaf': 0.18109220461563955, 'min_weight_fraction_leaf': 0.10631201842014994, 'max_features': 0.44758605366342197}. Best is trial 11 with value: 0.6773038119717333.[0m
[32m[I 2022-04-21 11:39:28,434][0m Trial 313 finished with value: 0.5 and parameters: {'splitter': 'random', 'min_samples_split': 0.23363172882917435, 'min_samples_leaf': 0.20127850386335389, 'min_weight_fraction_leaf': 0.4049564229139351, 'max_features': 0.7810346893889062}. Best is trial 11 with value: 0.6773038119717333.[0m
[32m[I 2022-04-21 11:39:28,464][0m Trial 314 finished with value: 0.5 and parameters: {'splitter': 'random', 'min_samples_split': 0.24167449678828654, 'min_samples_leaf': 0.10148545618751173, 'min_weight_fraction_leaf': 0.43112670638126305, 'max_features': 0.7331547925003434}. Best is trial 11 with value: 0.6773038119717333.[0m
[32m[I 2022-04-21 11:39:28,495][0m Trial 315 finished with value: 0.6738476114655684 and parameters: {'splitter': 'random', 'min_samples_split': 0.026869311377103945, 'min_samples_leaf': 0.13608354097930833, 'min_weight_fraction_leaf': 0.17744287066579337, 'max_features': 0.9816757762365986}. Best is trial 11 with value: 0.6773038119717333.[0m
[32m[I 2022-04-21 11:39:28,533][0m Trial 316 finished with value: 0.6543938115635641 and parameters: {'splitter': 'random', 'min_samples_split': 0.30153000999188684, 'min_samples_leaf': 0.1579668778398131, 'min_weight_fraction_leaf': 0.023816447594727688, 'max_features': 0.9147290455730615}. Best is trial 11 with value: 0.6773038119717333.[0m
[32m[I 2022-04-21 11:39:28,595][0m Trial 317 finished with value: 0.6738476114655684 and parameters: {'splitter': 'random', 'min_samples_split': 0.3602451220791401, 'min_samples_leaf': 0.01328226289487463, 'min_weight_fraction_leaf': 0.185402596334098, 'max_features': 0.9747769940343916}. Best is trial 11 with value: 0.6773038119717333.[0m
[32m[I 2022-04-21 11:39:28,656][0m Trial 318 finished with value: 0.6650367998115423 and parameters: {'splitter': 'random', 'min_samples_split': 0.292935784303929, 'min_samples_leaf': 0.12168916888596046, 'min_weight_fraction_leaf': 0.03497223393924859, 'max_features': 0.8954299102267322}. Best is trial 11 with value: 0.6773038119717333.[0m
[32m[I 2022-04-21 11:39:28,698][0m Trial 319 finished with value: 0.6738476114655684 and parameters: {'splitter': 'random', 'min_samples_split': 0.17595470541519034, 'min_samples_leaf': 0.0244725301077393, 'min_weight_fraction_leaf': 0.1850127061529519, 'max_features': 0.9456974419796169}. Best is trial 11 with value: 0.6773038119717333.[0m
[32m[I 2022-04-21 11:39:28,729][0m Trial 320 finished with value: 0.6738476114655684 and parameters: {'splitter': 'random', 'min_samples_split': 0.43918505822644166, 'min_samples_leaf': 0.026276740148415023, 'min_weight_fraction_leaf': 0.17104059567801316, 'max_features': 0.929962559024065}. Best is trial 11 with value: 0.6773038119717333.[0m
[32m[I 2022-04-21 11:39:28,762][0m Trial 321 finished with value: 0.6543938115635641 and parameters: {'splitter': 'random', 'min_samples_split': 0.291080380960804, 'min_samples_leaf': 0.14009071324142836, 'min_weight_fraction_leaf': 0.15892035925487633, 'max_features': 0.9087849694103735}. Best is trial 11 with value: 0.6773038119717333.[0m
[32m[I 2022-04-21 11:39:28,822][0m Trial 322 finished with value: 0.6665385065440175 and parameters: {'splitter': 'best', 'min_samples_split': 0.3228924935785485, 'min_samples_leaf': 0.11731019265020438, 'min_weight_fraction_leaf': 0.16329628914526573, 'max_features': 0.8783856036283885}. Best is trial 11 with value: 0.6773038119717333.[0m
[32m[I 2022-04-21 11:39:28,893][0m Trial 323 finished with value: 0.6738476114655684 and parameters: {'splitter': 'random', 'min_samples_split': 0.3434514821425082, 'min_samples_leaf': 0.12239434624385231, 'min_weight_fraction_leaf': 0.17646765854374816, 'max_features': 0.8636651815286178}. Best is trial 11 with value: 0.6773038119717333.[0m
