[32m[I 2022-04-23 00:29:16,246][0m Trial 556 finished with value: 0.6569096530720757 and parameters: {'loss': 'coxph', 'learning_rate': 0.039319397904787126, 'n_estimators': 521, 'criterion': 'friedman_mse', 'min_samples_split': 10, 'min_samples_leaf': 3, 'min_weight_fraction_leaf': 0.09962094234361911, 'min_impurity_decrease': 0.43206726217743513, 'max_features': 0.5815769527149801, 'subsample': 0.24884918939792128, 'dropout_rate': 0.21420810895492584, 'ccp_alpha': 0.09204712256981692}. Best is trial 218 with value: 0.6659976583847056.[0m
[32m[I 2022-04-23 00:30:23,660][0m Trial 557 finished with value: 0.629561199107725 and parameters: {'loss': 'coxph', 'learning_rate': 0.024149410716677505, 'n_estimators': 556, 'criterion': 'friedman_mse', 'min_samples_split': 10, 'min_samples_leaf': 3, 'min_weight_fraction_leaf': 0.09292063320778657, 'min_impurity_decrease': 0.3156777598673629, 'max_features': 0.1417115393486742, 'subsample': 0.21500736807247203, 'dropout_rate': 0.29785615048590297, 'ccp_alpha': 0.16962205185258142}. Best is trial 218 with value: 0.6659976583847056.[0m
[32m[I 2022-04-23 00:31:11,129][0m Trial 558 finished with value: 0.5 and parameters: {'loss': 'coxph', 'learning_rate': 0.03375513646689785, 'n_estimators': 452, 'criterion': 'friedman_mse', 'min_samples_split': 10, 'min_samples_leaf': 3, 'min_weight_fraction_leaf': 0.10485199139624808, 'min_impurity_decrease': 0.8849707779000665, 'max_features': 0.3255562104237298, 'subsample': 0.3665069829899841, 'dropout_rate': 0.22928874019568493, 'ccp_alpha': 2.7281047591227385}. Best is trial 218 with value: 0.6659976583847056.[0m
[32m[I 2022-04-23 00:32:46,326][0m Trial 559 finished with value: 0.6641676401578385 and parameters: {'loss': 'coxph', 'learning_rate': 0.04326864790638811, 'n_estimators': 601, 'criterion': 'friedman_mse', 'min_samples_split': 10, 'min_samples_leaf': 4, 'min_weight_fraction_leaf': 0.09445184141231125, 'min_impurity_decrease': 0.456674257361004, 'max_features': 0.6260138451373778, 'subsample': 0.23628790597860835, 'dropout_rate': 0.19088447251617172, 'ccp_alpha': 0.0034711102143581813}. Best is trial 218 with value: 0.6659976583847056.[0m
[32m[I 2022-04-23 00:36:19,288][0m Trial 560 finished with value: 0.6565266248518069 and parameters: {'loss': 'coxph', 'learning_rate': 0.0444350889495093, 'n_estimators': 899, 'criterion': 'friedman_mse', 'min_samples_split': 10, 'min_samples_leaf': 4, 'min_weight_fraction_leaf': 0.1174357527377828, 'min_impurity_decrease': 0.4619091509137623, 'max_features': 0.6242947048597426, 'subsample': 0.22821997711498543, 'dropout_rate': 0.173114502973297, 'ccp_alpha': 0.0012964445576923657}. Best is trial 218 with value: 0.6659976583847056.[0m
[32m[I 2022-04-23 00:37:41,843][0m Trial 561 finished with value: 0.5 and parameters: {'loss': 'coxph', 'learning_rate': 0.0545298364600131, 'n_estimators': 574, 'criterion': 'absolute_error', 'min_samples_split': 10, 'min_samples_leaf': 5, 'min_weight_fraction_leaf': 0.10865805456080625, 'min_impurity_decrease': 0.45940086368273797, 'max_features': 0.6387491468425046, 'subsample': 0.18432198003562641, 'dropout_rate': 0.1910982125805652, 'ccp_alpha': 0.08837827564691032}. Best is trial 218 with value: 0.6659976583847056.[0m
[32m[I 2022-04-23 00:39:11,293][0m Trial 562 finished with value: 0.6003718441087893 and parameters: {'loss': 'coxph', 'learning_rate': 0.03637072183314801, 'n_estimators': 599, 'criterion': 'friedman_mse', 'min_samples_split': 10, 'min_samples_leaf': 4, 'min_weight_fraction_leaf': 0.09746859038756735, 'min_impurity_decrease': 0.4040892919265407, 'max_features': 0.60996045328505, 'subsample': 0.21825092911217406, 'dropout_rate': 0.1497350722946402, 'ccp_alpha': 0.24485881738776674}. Best is trial 218 with value: 0.6659976583847056.[0m
[32m[I 2022-04-23 00:40:33,358][0m Trial 563 finished with value: 0.6564332758788898 and parameters: {'loss': 'coxph', 'learning_rate': 0.043784278494246716, 'n_estimators': 632, 'criterion': 'friedman_mse', 'min_samples_split': 10, 'min_samples_leaf': 2, 'min_weight_fraction_leaf': 0.09028913579010807, 'min_impurity_decrease': 0.42721465113230306, 'max_features': 0.6361237235793623, 'subsample': 0.2527226999960806, 'dropout_rate': 0.3766653444706301, 'ccp_alpha': 0.004127872531732381}. Best is trial 218 with value: 0.6659976583847056.[0m
[32m[I 2022-04-23 00:42:01,924][0m Trial 564 finished with value: 0.6447780587168088 and parameters: {'loss': 'coxph', 'learning_rate': 0.028599247870935735, 'n_estimators': 601, 'criterion': 'friedman_mse', 'min_samples_split': 10, 'min_samples_leaf': 2, 'min_weight_fraction_leaf': 0.10044942637022682, 'min_impurity_decrease': 0.4242478620145656, 'max_features': 0.6191495399456219, 'subsample': 0.2399922711907972, 'dropout_rate': 0.17021187961562823, 'ccp_alpha': 0.15553118488209014}. Best is trial 218 with value: 0.6659976583847056.[0m
[32m[I 2022-04-23 00:43:20,122][0m Trial 565 finished with value: 0.6538678065551508 and parameters: {'loss': 'coxph', 'learning_rate': 0.05717656567319718, 'n_estimators': 620, 'criterion': 'friedman_mse', 'min_samples_split': 10, 'min_samples_leaf': 4, 'min_weight_fraction_leaf': 0.11788156104435187, 'min_impurity_decrease': 0.479199109329607, 'max_features': 0.5953429211819221, 'subsample': 0.30478738059657434, 'dropout_rate': 0.3375213690002484, 'ccp_alpha': 0.09515438903710186}. Best is trial 218 with value: 0.6659976583847056.[0m
[32m[I 2022-04-23 00:44:40,599][0m Trial 566 finished with value: 0.5173586646906135 and parameters: {'loss': 'coxph', 'learning_rate': 0.046653354518802904, 'n_estimators': 584, 'criterion': 'friedman_mse', 'min_samples_split': 10, 'min_samples_leaf': 4, 'min_weight_fraction_leaf': 0.08744997768447915, 'min_impurity_decrease': 0.4540205304511922, 'max_features': 0.2873879388513769, 'subsample': 0.19639942883571154, 'dropout_rate': 0.20618684435452445, 'ccp_alpha': 0.3879726569381864}. Best is trial 218 with value: 0.6659976583847056.[0m
[32m[I 2022-04-23 00:47:51,548][0m Trial 567 finished with value: 0.6256669890636337 and parameters: {'loss': 'coxph', 'learning_rate': 0.06630168518582596, 'n_estimators': 933, 'criterion': 'friedman_mse', 'min_samples_split': 10, 'min_samples_leaf': 3, 'min_weight_fraction_leaf': 0.10661430858602196, 'min_impurity_decrease': 0.47527194642212867, 'max_features': 0.6448788769239088, 'subsample': 0.3299667723124434, 'dropout_rate': 0.27894662885533295, 'ccp_alpha': 0.17018019137299628}. Best is trial 218 with value: 0.6659976583847056.[0m
[32m[I 2022-04-23 00:49:06,669][0m Trial 568 finished with value: 0.5 and parameters: {'loss': 'coxph', 'learning_rate': 0.09972743215850495, 'n_estimators': 560, 'criterion': 'squared_error', 'min_samples_split': 10, 'min_samples_leaf': 3, 'min_weight_fraction_leaf': 0.09432407135283753, 'min_impurity_decrease': 0.48547309313549636, 'max_features': 0.6184365742614789, 'subsample': 0.2804392953613994, 'dropout_rate': 0.19555159620512214, 'ccp_alpha': 0.004825937481274576}. Best is trial 218 with value: 0.6659976583847056.[0m
[32m[I 2022-04-23 00:50:24,293][0m Trial 569 finished with value: 0.6529568192793508 and parameters: {'loss': 'coxph', 'learning_rate': 0.035275735995865115, 'n_estimators': 616, 'criterion': 'friedman_mse', 'min_samples_split': 10, 'min_samples_leaf': 3, 'min_weight_fraction_leaf': 0.08146447843784935, 'min_impurity_decrease': 0.3909557222192064, 'max_features': 0.5746935459068806, 'subsample': 0.259419902677896, 'dropout_rate': 0.3533460387755348, 'ccp_alpha': 0.10000584718995786}. Best is trial 218 with value: 0.6659976583847056.[0m
[32m[I 2022-04-23 00:51:20,224][0m Trial 570 finished with value: 0.5623511703378433 and parameters: {'loss': 'coxph', 'learning_rate': 0.07857170099596145, 'n_estimators': 537, 'criterion': 'friedman_mse', 'min_samples_split': 10, 'min_samples_leaf': 3, 'min_weight_fraction_leaf': 0.08468112842380077, 'min_impurity_decrease': 0.8695957393682145, 'max_features': 0.5955640999771388, 'subsample': 0.2953619818361296, 'dropout_rate': 0.40099876019074987, 'ccp_alpha': 0.25882157718449655}. Best is trial 218 with value: 0.6659976583847056.[0m
[32m[I 2022-04-23 00:52:45,263][0m Trial 571 finished with value: 0.6588964306529869 and parameters: {'loss': 'coxph', 'learning_rate': 0.043531226980102936, 'n_estimators': 578, 'criterion': 'friedman_mse', 'min_samples_split': 10, 'min_samples_leaf': 3, 'min_weight_fraction_leaf': 0.09339647603145045, 'min_impurity_decrease': 0.4402221423480725, 'max_features': 0.9717183481857946, 'subsample': 0.3844731576911632, 'dropout_rate': 0.24767601860353247, 'ccp_alpha': 0.0019386009135468835}. Best is trial 218 with value: 0.6659976583847056.[0m
/media/san2_ssd/data/Workdir/survival/venv/lib/python3.8/site-packages/sksurv/ensemble/boosting.py:955: RuntimeWarning: divide by zero encountered in log
  time = numpy.log(time)
/media/san2_ssd/data/Workdir/survival/venv/lib/python3.8/site-packages/sksurv/ensemble/boosting.py:955: RuntimeWarning: divide by zero encountered in log
  time = numpy.log(time)
/media/san2_ssd/data/Workdir/survival/venv/lib/python3.8/site-packages/sksurv/ensemble/boosting.py:955: RuntimeWarning: divide by zero encountered in log
  time = numpy.log(time)
/media/san2_ssd/data/Workdir/survival/venv/lib/python3.8/site-packages/sksurv/ensemble/boosting.py:955: RuntimeWarning: divide by zero encountered in log
  time = numpy.log(time)
[32m[I 2022-04-23 00:52:55,971][0m Trial 572 finished with value: -0.7 and parameters: {'loss': 'squared', 'learning_rate': 0.058827378357854204, 'n_estimators': 513, 'criterion': 'friedman_mse', 'min_samples_split': 10, 'min_samples_leaf': 2, 'min_weight_fraction_leaf': 0.07858173885218804, 'min_impurity_decrease': 0.8372846295571553, 'max_features': 0.6800643564009339, 'subsample': 0.35311069293535985, 'dropout_rate': 0.3108978003821088, 'ccp_alpha': 3.0765017401777546}. Best is trial 218 with value: 0.6659976583847056.[0m
[32m[I 2022-04-23 00:54:49,214][0m Trial 573 finished with value: 0.6213975019359299 and parameters: {'loss': 'coxph', 'learning_rate': 7.981891879488576e-06, 'n_estimators': 661, 'criterion': 'friedman_mse', 'min_samples_split': 10, 'min_samples_leaf': 3, 'min_weight_fraction_leaf': 0.24115131926744388, 'min_impurity_decrease': 0.40529243584167807, 'max_features': 0.6608977718415102, 'subsample': 0.23502275755663377, 'dropout_rate': 0.1556557768504474, 'ccp_alpha': 0.09193420348227654}. Best is trial 218 with value: 0.6659976583847056.[0m
[32m[I 2022-04-23 00:54:54,554][0m Trial 574 finished with value: 0.5842166259551106 and parameters: {'loss': 'coxph', 'learning_rate': 0.02409168438825982, 'n_estimators': 138, 'criterion': 'friedman_mse', 'min_samples_split': 10, 'min_samples_leaf': 3, 'min_weight_fraction_leaf': 0.10779602173440764, 'min_impurity_decrease': 0.44100273982947397, 'max_features': 0.579845595718802, 'subsample': 0.31504535705943365, 'dropout_rate': 0.27970873222421505, 'ccp_alpha': 0.1820612601650183}. Best is trial 218 with value: 0.6659976583847056.[0m
[32m[I 2022-04-23 00:54:58,578][0m Trial 575 finished with value: 0.5 and parameters: {'loss': 'coxph', 'learning_rate': 0.03139005178878557, 'n_estimators': 112, 'criterion': 'friedman_mse', 'min_samples_split': 10, 'min_samples_leaf': 3, 'min_weight_fraction_leaf': 0.13089479117428027, 'min_impurity_decrease': 0.8445164455372045, 'max_features': 0.715489684550613, 'subsample': 0.2729181450933292, 'dropout_rate': 0.18745680963531544, 'ccp_alpha': 2.0731047096843116}. Best is trial 218 with value: 0.6659976583847056.[0m
[32m[I 2022-04-23 00:55:35,307][0m Trial 576 finished with value: 0.6069751502223565 and parameters: {'loss': 'coxph', 'learning_rate': 0.050750809234799237, 'n_estimators': 406, 'criterion': 'friedman_mse', 'min_samples_split': 10, 'min_samples_leaf': 4, 'min_weight_fraction_leaf': 0.09721496310222344, 'min_impurity_decrease': 0.3640302833698303, 'max_features': 0.027632837162367307, 'subsample': 0.29017284798372045, 'dropout_rate': 0.3310993643579843, 'ccp_alpha': 0.10666344493269878}. Best is trial 218 with value: 0.6659976583847056.[0m
[32m[I 2022-04-23 00:56:33,953][0m Trial 577 finished with value: 0.528779400652732 and parameters: {'loss': 'coxph', 'learning_rate': 0.06860985608377748, 'n_estimators': 545, 'criterion': 'friedman_mse', 'min_samples_split': 10, 'min_samples_leaf': 3, 'min_weight_fraction_leaf': 0.4288426607275782, 'min_impurity_decrease': 0.4036094705257054, 'max_features': 0.7324674472994935, 'subsample': 0.21154921550524763, 'dropout_rate': 0.3653981262345593, 'ccp_alpha': 0.31359502247524745}. Best is trial 218 with value: 0.6659976583847056.[0m
[32m[I 2022-04-23 00:57:28,347][0m Trial 578 finished with value: 0.6529407165460749 and parameters: {'loss': 'coxph', 'learning_rate': 0.03828333874089504, 'n_estimators': 476, 'criterion': 'friedman_mse', 'min_samples_split': 10, 'min_samples_leaf': 3, 'min_weight_fraction_leaf': 0.0811889268749947, 'min_impurity_decrease': 0.5028872172001198, 'max_features': 0.6035020127204959, 'subsample': 0.2472636457526724, 'dropout_rate': 0.25775568805111637, 'ccp_alpha': 0.09578700448145717}. Best is trial 218 with value: 0.6659976583847056.[0m
[32m[I 2022-04-23 00:58:33,749][0m Trial 579 finished with value: 0.6638616787717249 and parameters: {'loss': 'coxph', 'learning_rate': 0.0604957407607303, 'n_estimators': 500, 'criterion': 'friedman_mse', 'min_samples_split': 10, 'min_samples_leaf': 3, 'min_weight_fraction_leaf': 0.07194575337336659, 'min_impurity_decrease': 0.9999296118343156, 'max_features': 0.6193043512370962, 'subsample': 0.32935539509431877, 'dropout_rate': 0.2203217704019832, 'ccp_alpha': 0.004895584478529112}. Best is trial 218 with value: 0.6659976583847056.[0m
[32m[I 2022-04-23 01:00:11,948][0m Trial 580 finished with value: 0.604392761732156 and parameters: {'loss': 'coxph', 'learning_rate': 0.07529991865821442, 'n_estimators': 681, 'criterion': 'friedman_mse', 'min_samples_split': 10, 'min_samples_leaf': 3, 'min_weight_fraction_leaf': 0.11757071404861286, 'min_impurity_decrease': 0.9932370847032327, 'max_features': 0.6220253720509834, 'subsample': 0.2730666318612371, 'dropout_rate': 0.2981869091753561, 'ccp_alpha': 0.2026904369516496}. Best is trial 218 with value: 0.6659976583847056.[0m
[32m[I 2022-04-23 01:02:08,486][0m Trial 581 finished with value: 0.5 and parameters: {'loss': 'coxph', 'learning_rate': 0.060697562095064155, 'n_estimators': 850, 'criterion': 'friedman_mse', 'min_samples_split': 10, 'min_samples_leaf': 3, 'min_weight_fraction_leaf': 0.08810332543117129, 'min_impurity_decrease': 0.9842170826452025, 'max_features': 0.6432612588489806, 'subsample': 0.30856060210864583, 'dropout_rate': 0.48015258313110076, 'ccp_alpha': 4.6499460766641745}. Best is trial 218 with value: 0.6659976583847056.[0m
[32m[I 2022-04-23 01:03:11,682][0m Trial 582 finished with value: 0.6109221091339931 and parameters: {'loss': 'coxph', 'learning_rate': 0.08216648780065708, 'n_estimators': 524, 'criterion': 'friedman_mse', 'min_samples_split': 10, 'min_samples_leaf': 3, 'min_weight_fraction_leaf': 0.07405326982688537, 'min_impurity_decrease': 0.9831671472698377, 'max_features': 0.6153531378854314, 'subsample': 0.3260532095496997, 'dropout_rate': 0.23673751709896645, 'ccp_alpha': 0.1595432850200355}. Best is trial 218 with value: 0.6659976583847056.[0m
[32m[I 2022-04-23 01:04:00,252][0m Trial 583 finished with value: 0.6513314270949253 and parameters: {'loss': 'coxph', 'learning_rate': 0.05339776145414919, 'n_estimators': 561, 'criterion': 'friedman_mse', 'min_samples_split': 10, 'min_samples_leaf': 2, 'min_weight_fraction_leaf': 0.09641934173844238, 'min_impurity_decrease': 0.4138938214752735, 'max_features': 0.6346983978668777, 'subsample': 0.2258983991436861, 'dropout_rate': 0.5562785305245603, 'ccp_alpha': 0.09671709976974219}. Best is trial 218 with value: 0.6659976583847056.[0m
[32m[I 2022-04-23 01:06:44,147][0m Trial 584 finished with value: 0.5 and parameters: {'loss': 'coxph', 'learning_rate': 0.09963981381457411, 'n_estimators': 958, 'criterion': 'absolute_error', 'min_samples_split': 10, 'min_samples_leaf': 4, 'min_weight_fraction_leaf': 0.08299309740603548, 'min_impurity_decrease': 0.9991440358612336, 'max_features': 0.5799316511831173, 'subsample': 0.2582708400111819, 'dropout_rate': 0.42514318474069096, 'ccp_alpha': 0.25240154956456695}. Best is trial 218 with value: 0.6659976583847056.[0m
[32m[I 2022-04-23 01:09:51,415][0m Trial 585 finished with value: 0.6519600536990688 and parameters: {'loss': 'coxph', 'learning_rate': 0.06619916777425554, 'n_estimators': 997, 'criterion': 'friedman_mse', 'min_samples_split': 10, 'min_samples_leaf': 3, 'min_weight_fraction_leaf': 0.07072966512025287, 'min_impurity_decrease': 0.9747387894368966, 'max_features': 0.6024495299198109, 'subsample': 0.29031744088898487, 'dropout_rate': 0.3871946035621224, 'ccp_alpha': 0.08481458501625153}. Best is trial 218 with value: 0.6659976583847056.[0m
[32m[I 2022-04-23 01:10:36,757][0m Trial 586 finished with value: 0.5777187008093574 and parameters: {'loss': 'coxph', 'learning_rate': 0.04737634345146718, 'n_estimators': 597, 'criterion': 'friedman_mse', 'min_samples_split': 10, 'min_samples_leaf': 3, 'min_weight_fraction_leaf': 0.3521680163170717, 'min_impurity_decrease': 0.9791097421486191, 'max_features': 0.10076778904926373, 'subsample': 0.24051319485528846, 'dropout_rate': 0.6301112714117072, 'ccp_alpha': 0.003128970655423276}. Best is trial 218 with value: 0.6659976583847056.[0m
[32m[I 2022-04-23 01:11:40,437][0m Trial 587 finished with value: 0.659772991519161 and parameters: {'loss': 'coxph', 'learning_rate': 0.07773349706254408, 'n_estimators': 502, 'criterion': 'friedman_mse', 'min_samples_split': 10, 'min_samples_leaf': 3, 'min_weight_fraction_leaf': 0.10565987462244139, 'min_impurity_decrease': 0.9440194419201263, 'max_features': 0.5613324339522175, 'subsample': 0.26871647277274885, 'dropout_rate': 0.21432826225464496, 'ccp_alpha': 0.006762046074678087}. Best is trial 218 with value: 0.6659976583847056.[0m
[32m[I 2022-04-23 01:12:44,843][0m Trial 588 finished with value: 0.5 and parameters: {'loss': 'coxph', 'learning_rate': 0.05599825932802724, 'n_estimators': 525, 'criterion': 'friedman_mse', 'min_samples_split': 10, 'min_samples_leaf': 3, 'min_weight_fraction_leaf': 0.06107021740815376, 'min_impurity_decrease': 0.9650263518739338, 'max_features': 0.6557090216953292, 'subsample': 0.30392831612318183, 'dropout_rate': 0.2688495328611399, 'ccp_alpha': 0.5545806887419742}. Best is trial 218 with value: 0.6659976583847056.[0m
[32m[I 2022-04-23 01:13:35,504][0m Trial 589 finished with value: 0.5 and parameters: {'loss': 'coxph', 'learning_rate': 0.04591137952252338, 'n_estimators': 451, 'criterion': 'friedman_mse', 'min_samples_split': 9, 'min_samples_leaf': 3, 'min_weight_fraction_leaf': 0.04383635605356784, 'min_impurity_decrease': 0.3758399375906537, 'max_features': 0.588128798792642, 'subsample': 0.0035486253267904, 'dropout_rate': 0.24213804938069494, 'ccp_alpha': 0.0019030620066101459}. Best is trial 218 with value: 0.6659976583847056.[0m
[32m[I 2022-04-23 01:14:45,534][0m Trial 590 finished with value: 0.5 and parameters: {'loss': 'coxph', 'learning_rate': 0.06456521593179937, 'n_estimators': 549, 'criterion': 'squared_error', 'min_samples_split': 10, 'min_samples_leaf': 3, 'min_weight_fraction_leaf': 0.09103089007728674, 'min_impurity_decrease': 0.9617994874479929, 'max_features': 0.6190788067291273, 'subsample': 0.3514050510648524, 'dropout_rate': 0.3173024681944581, 'ccp_alpha': 0.1768159533913216}. Best is trial 218 with value: 0.6659976583847056.[0m
[32m[I 2022-04-23 01:17:50,758][0m Trial 591 finished with value: 0.5 and parameters: {'loss': 'coxph', 'learning_rate': 0.08002881091046912, 'n_estimators': 885, 'criterion': 'friedman_mse', 'min_samples_split': 10, 'min_samples_leaf': 3, 'min_weight_fraction_leaf': 0.07507569526265664, 'min_impurity_decrease': 0.4229436711357883, 'max_features': 0.5672989205486288, 'subsample': 0.2870535654473515, 'dropout_rate': 0.2059610866516232, 'ccp_alpha': 2.884090082863879}. Best is trial 218 with value: 0.6659976583847056.[0m
/media/san2_ssd/data/Workdir/survival/venv/lib/python3.8/site-packages/sksurv/ensemble/boosting.py:955: RuntimeWarning: divide by zero encountered in log
  time = numpy.log(time)
/media/san2_ssd/data/Workdir/survival/venv/lib/python3.8/site-packages/sksurv/ensemble/boosting.py:955: RuntimeWarning: divide by zero encountered in log
  time = numpy.log(time)
/media/san2_ssd/data/Workdir/survival/venv/lib/python3.8/site-packages/sksurv/ensemble/boosting.py:955: RuntimeWarning: divide by zero encountered in log
  time = numpy.log(time)
/media/san2_ssd/data/Workdir/survival/venv/lib/python3.8/site-packages/sksurv/ensemble/boosting.py:955: RuntimeWarning: divide by zero encountered in log
  time = numpy.log(time)
[32m[I 2022-04-23 01:18:01,478][0m Trial 592 finished with value: -0.7346191436349485 and parameters: {'loss': 'squared', 'learning_rate': 0.04012575510764767, 'n_estimators': 493, 'criterion': 'friedman_mse', 'min_samples_split': 10, 'min_samples_leaf': 2, 'min_weight_fraction_leaf': 0.08650620543152822, 'min_impurity_decrease': 0.9027391151114039, 'max_features': 0.6010426509421474, 'subsample': 0.3249997531298559, 'dropout_rate': 0.2929271479699253, 'ccp_alpha': 0.002053272936955901}. Best is trial 218 with value: 0.6659976583847056.[0m
