[32m[I 2022-04-21 11:38:14,110][0m Trial 224 finished with value: 0.805214647561629 and parameters: {'splitter': 'best', 'min_samples_split': 0.09165595580987647, 'min_samples_leaf': 0.00973246702585406, 'min_weight_fraction_leaf': 0.03830492076184325, 'max_features': 0.38626734135187446}. Best is trial 208 with value: 0.8264270922211081.[0m
/media/san2_ssd/data/Workdir/survival/utils.py:305: RuntimeWarning: invalid value encountered in true_divide
  pdfs = np.gradient(1-survs,axis=1)/norms
/media/san2_ssd/data/Workdir/survival/utils.py:305: RuntimeWarning: invalid value encountered in true_divide
  pdfs = np.gradient(1-survs,axis=1)/norms
[32m[I 2022-04-21 11:38:15,017][0m Trial 225 finished with value: 0.8155116276315242 and parameters: {'splitter': 'best', 'min_samples_split': 0.09919839087679166, 'min_samples_leaf': 0.0014544201119278278, 'min_weight_fraction_leaf': 0.010069682369253636, 'max_features': 0.4165305152452425}. Best is trial 208 with value: 0.8264270922211081.[0m
[32m[I 2022-04-21 11:38:15,497][0m Trial 226 finished with value: 0.8068991162295731 and parameters: {'splitter': 'best', 'min_samples_split': 0.1284902062124984, 'min_samples_leaf': 0.020254816106978074, 'min_weight_fraction_leaf': 0.02507344434558187, 'max_features': 0.26408351393164364}. Best is trial 208 with value: 0.8264270922211081.[0m
[32m[I 2022-04-21 11:38:15,764][0m Trial 227 finished with value: 0.8004973343451018 and parameters: {'splitter': 'best', 'min_samples_split': 0.06436378142581362, 'min_samples_leaf': 0.04104196462000677, 'min_weight_fraction_leaf': 0.010848124409981116, 'max_features': 0.37991399923146596}. Best is trial 208 with value: 0.8264270922211081.[0m
[32m[I 2022-04-21 11:38:16,176][0m Trial 228 finished with value: 0.8132862166317769 and parameters: {'splitter': 'best', 'min_samples_split': 0.11452073317917905, 'min_samples_leaf': 0.0012552258284252039, 'min_weight_fraction_leaf': 0.05674545323659437, 'max_features': 0.4550402598489197}. Best is trial 208 with value: 0.8264270922211081.[0m
/media/san2_ssd/data/Workdir/survival/utils.py:305: RuntimeWarning: invalid value encountered in true_divide
  pdfs = np.gradient(1-survs,axis=1)/norms
[32m[I 2022-04-21 11:38:16,652][0m Trial 229 finished with value: 0.8187304458657731 and parameters: {'splitter': 'best', 'min_samples_split': 0.08301606553247787, 'min_samples_leaf': 0.016032125583636442, 'min_weight_fraction_leaf': 0.0006300956749043221, 'max_features': 0.4087782621668958}. Best is trial 208 with value: 0.8264270922211081.[0m
[32m[I 2022-04-21 11:38:17,012][0m Trial 230 finished with value: 0.8222555132396756 and parameters: {'splitter': 'best', 'min_samples_split': 0.08110292889520138, 'min_samples_leaf': 0.030290880080685555, 'min_weight_fraction_leaf': 0.0002385707505363502, 'max_features': 0.40259543066096687}. Best is trial 208 with value: 0.8264270922211081.[0m
[32m[I 2022-04-21 11:38:17,374][0m Trial 231 finished with value: 0.8218951819813997 and parameters: {'splitter': 'best', 'min_samples_split': 0.07941517272416838, 'min_samples_leaf': 0.02862910052030277, 'min_weight_fraction_leaf': 0.007624923239935702, 'max_features': 0.4117838126334038}. Best is trial 208 with value: 0.8264270922211081.[0m
[32m[I 2022-04-21 11:38:17,853][0m Trial 232 finished with value: 0.8164975720868171 and parameters: {'splitter': 'best', 'min_samples_split': 0.07863334768860955, 'min_samples_leaf': 0.03120658427081291, 'min_weight_fraction_leaf': 0.008072267108015268, 'max_features': 0.4021321419026505}. Best is trial 208 with value: 0.8264270922211081.[0m
/media/san2_ssd/data/Workdir/survival/utils.py:305: RuntimeWarning: invalid value encountered in true_divide
  pdfs = np.gradient(1-survs,axis=1)/norms
/media/san2_ssd/data/Workdir/survival/utils.py:305: RuntimeWarning: invalid value encountered in true_divide
  pdfs = np.gradient(1-survs,axis=1)/norms
[32m[I 2022-04-21 11:38:18,444][0m Trial 233 finished with value: 0.8174308764150254 and parameters: {'splitter': 'best', 'min_samples_split': 0.05287777367839188, 'min_samples_leaf': 0.020039973387100535, 'min_weight_fraction_leaf': 0.009697177201400193, 'max_features': 0.4320522463069428}. Best is trial 208 with value: 0.8264270922211081.[0m
/media/san2_ssd/data/Workdir/survival/utils.py:305: RuntimeWarning: invalid value encountered in true_divide
  pdfs = np.gradient(1-survs,axis=1)/norms
[32m[I 2022-04-21 11:38:18,955][0m Trial 234 finished with value: 0.8136454008563939 and parameters: {'splitter': 'best', 'min_samples_split': 0.06631295692365197, 'min_samples_leaf': 0.018354079326396072, 'min_weight_fraction_leaf': 0.02148167969250226, 'max_features': 0.4319066739559435}. Best is trial 208 with value: 0.8264270922211081.[0m
[32m[I 2022-04-21 11:38:19,296][0m Trial 235 finished with value: 0.8143859271965687 and parameters: {'splitter': 'best', 'min_samples_split': 0.055260675727475124, 'min_samples_leaf': 0.032628898816109926, 'min_weight_fraction_leaf': 0.008987902795656462, 'max_features': 0.44961342732819837}. Best is trial 208 with value: 0.8264270922211081.[0m
[32m[I 2022-04-21 11:38:19,422][0m Trial 236 finished with value: 0.8059257365423592 and parameters: {'splitter': 'best', 'min_samples_split': 0.07703174401969845, 'min_samples_leaf': 0.0249433826933671, 'min_weight_fraction_leaf': 0.028167824099441036, 'max_features': 0.0580532597567287}. Best is trial 208 with value: 0.8264270922211081.[0m
/media/san2_ssd/data/Workdir/survival/utils.py:305: RuntimeWarning: invalid value encountered in true_divide
  pdfs = np.gradient(1-survs,axis=1)/norms
/media/san2_ssd/data/Workdir/survival/utils.py:305: RuntimeWarning: invalid value encountered in true_divide
  pdfs = np.gradient(1-survs,axis=1)/norms
/media/san2_ssd/data/Workdir/survival/utils.py:305: RuntimeWarning: invalid value encountered in true_divide
  pdfs = np.gradient(1-survs,axis=1)/norms
/media/san2_ssd/data/Workdir/survival/utils.py:305: RuntimeWarning: invalid value encountered in true_divide
  pdfs = np.gradient(1-survs,axis=1)/norms
/media/san2_ssd/data/Workdir/survival/utils.py:305: RuntimeWarning: invalid value encountered in true_divide
  pdfs = np.gradient(1-survs,axis=1)/norms
[32m[I 2022-04-21 11:38:19,990][0m Trial 237 finished with value: 0.7993315753890649 and parameters: {'splitter': 'best', 'min_samples_split': 0.032539726543827224, 'min_samples_leaf': 0.012294544282059464, 'min_weight_fraction_leaf': 0.0007568351837809578, 'max_features': 0.4136419389313759}. Best is trial 208 with value: 0.8264270922211081.[0m
[32m[I 2022-04-21 11:38:20,324][0m Trial 238 finished with value: 0.8060020857589798 and parameters: {'splitter': 'best', 'min_samples_split': 0.06099197442324005, 'min_samples_leaf': 0.04471072931505361, 'min_weight_fraction_leaf': 0.015371730829860167, 'max_features': 0.20150712597683695}. Best is trial 208 with value: 0.8264270922211081.[0m
[32m[I 2022-04-21 11:38:20,917][0m Trial 239 finished with value: 0.8089448418155971 and parameters: {'splitter': 'best', 'min_samples_split': 0.0873739917928277, 'min_samples_leaf': 0.00990563412198319, 'min_weight_fraction_leaf': 0.034494660459746355, 'max_features': 0.4302463258899862}. Best is trial 208 with value: 0.8264270922211081.[0m
/media/san2_ssd/data/Workdir/survival/utils.py:305: RuntimeWarning: invalid value encountered in true_divide
  pdfs = np.gradient(1-survs,axis=1)/norms
/media/san2_ssd/data/Workdir/survival/utils.py:305: RuntimeWarning: invalid value encountered in true_divide
  pdfs = np.gradient(1-survs,axis=1)/norms
/media/san2_ssd/data/Workdir/survival/utils.py:305: RuntimeWarning: invalid value encountered in true_divide
  pdfs = np.gradient(1-survs,axis=1)/norms
[32m[I 2022-04-21 11:38:21,706][0m Trial 240 finished with value: 0.8118102234396481 and parameters: {'splitter': 'best', 'min_samples_split': 0.05482985187426834, 'min_samples_leaf': 0.0012400700011669964, 'min_weight_fraction_leaf': 0.008781900645616557, 'max_features': 0.461772889712612}. Best is trial 208 with value: 0.8264270922211081.[0m
/media/san2_ssd/data/Workdir/survival/utils.py:305: RuntimeWarning: invalid value encountered in true_divide
  pdfs = np.gradient(1-survs,axis=1)/norms
/media/san2_ssd/data/Workdir/survival/utils.py:305: RuntimeWarning: invalid value encountered in true_divide
  pdfs = np.gradient(1-survs,axis=1)/norms
/media/san2_ssd/data/Workdir/survival/utils.py:305: RuntimeWarning: invalid value encountered in true_divide
  pdfs = np.gradient(1-survs,axis=1)/norms
/media/san2_ssd/data/Workdir/survival/utils.py:305: RuntimeWarning: invalid value encountered in true_divide
  pdfs = np.gradient(1-survs,axis=1)/norms
[32m[I 2022-04-21 11:38:22,012][0m Trial 241 finished with value: 0.8135305142140279 and parameters: {'splitter': 'best', 'min_samples_split': 0.04324942915761361, 'min_samples_leaf': 0.0188393868520029, 'min_weight_fraction_leaf': 0.0019122420799291898, 'max_features': 0.39767664128748886}. Best is trial 208 with value: 0.8264270922211081.[0m
/media/san2_ssd/data/Workdir/survival/utils.py:305: RuntimeWarning: invalid value encountered in true_divide
  pdfs = np.gradient(1-survs,axis=1)/norms
/media/san2_ssd/data/Workdir/survival/utils.py:305: RuntimeWarning: invalid value encountered in true_divide
  pdfs = np.gradient(1-survs,axis=1)/norms
/media/san2_ssd/data/Workdir/survival/utils.py:305: RuntimeWarning: invalid value encountered in true_divide
  pdfs = np.gradient(1-survs,axis=1)/norms
/media/san2_ssd/data/Workdir/survival/utils.py:305: RuntimeWarning: invalid value encountered in true_divide
  pdfs = np.gradient(1-survs,axis=1)/norms
[32m[I 2022-04-21 11:38:22,370][0m Trial 242 finished with value: 0.817990566748301 and parameters: {'splitter': 'best', 'min_samples_split': 0.07445165873102035, 'min_samples_leaf': 0.018541731628424343, 'min_weight_fraction_leaf': 0.00011372337639788989, 'max_features': 0.411910065186488}. Best is trial 208 with value: 0.8264270922211081.[0m
[32m[I 2022-04-21 11:38:22,484][0m Trial 243 finished with value: 0.8038368788208228 and parameters: {'splitter': 'best', 'min_samples_split': 0.08054098273676386, 'min_samples_leaf': 0.15607210580352412, 'min_weight_fraction_leaf': 0.020112246798390784, 'max_features': 0.415431357972505}. Best is trial 208 with value: 0.8264270922211081.[0m
/media/san2_ssd/data/Workdir/survival/utils.py:305: RuntimeWarning: invalid value encountered in true_divide
  pdfs = np.gradient(1-survs,axis=1)/norms
[32m[I 2022-04-21 11:38:22,736][0m Trial 244 finished with value: 0.8073151804907853 and parameters: {'splitter': 'best', 'min_samples_split': 0.06501728692128864, 'min_samples_leaf': 0.02691531452051042, 'min_weight_fraction_leaf': 0.010332494656504689, 'max_features': 0.43895894520989476}. Best is trial 208 with value: 0.8264270922211081.[0m
/media/san2_ssd/data/Workdir/survival/utils.py:305: RuntimeWarning: invalid value encountered in true_divide
  pdfs = np.gradient(1-survs,axis=1)/norms
[32m[I 2022-04-21 11:38:23,563][0m Trial 245 finished with value: 0.8141439955124683 and parameters: {'splitter': 'best', 'min_samples_split': 0.07703907075366198, 'min_samples_leaf': 0.012149597566175084, 'min_weight_fraction_leaf': 0.01657367430755292, 'max_features': 0.40734679815293445}. Best is trial 208 with value: 0.8264270922211081.[0m
[32m[I 2022-04-21 11:38:24,014][0m Trial 246 finished with value: 0.8175547559526276 and parameters: {'splitter': 'best', 'min_samples_split': 0.08949250215747839, 'min_samples_leaf': 0.0206451958909149, 'min_weight_fraction_leaf': 0.008662855665599673, 'max_features': 0.36667938419255947}. Best is trial 208 with value: 0.8264270922211081.[0m
/media/san2_ssd/data/Workdir/survival/utils.py:305: RuntimeWarning: invalid value encountered in true_divide
  pdfs = np.gradient(1-survs,axis=1)/norms
[32m[I 2022-04-21 11:38:24,393][0m Trial 247 finished with value: 0.8067628795300186 and parameters: {'splitter': 'best', 'min_samples_split': 0.08901741010671353, 'min_samples_leaf': 0.030761856677492216, 'min_weight_fraction_leaf': 0.00020661805625691576, 'max_features': 0.36625530736489986}. Best is trial 208 with value: 0.8264270922211081.[0m
[32m[I 2022-04-21 11:38:24,843][0m Trial 248 finished with value: 0.8079906230019382 and parameters: {'splitter': 'best', 'min_samples_split': 0.09260333096048268, 'min_samples_leaf': 0.009513414975816535, 'min_weight_fraction_leaf': 0.025084590391658595, 'max_features': 0.35389797339383194}. Best is trial 208 with value: 0.8264270922211081.[0m
[32m[I 2022-04-21 11:38:25,300][0m Trial 249 finished with value: 0.8004973343451018 and parameters: {'splitter': 'best', 'min_samples_split': 0.06877513983398657, 'min_samples_leaf': 0.03872420768532023, 'min_weight_fraction_leaf': 0.009338431540087165, 'max_features': 0.3819966659862571}. Best is trial 208 with value: 0.8264270922211081.[0m
[32m[I 2022-04-21 11:38:25,825][0m Trial 250 finished with value: 0.80504147282091 and parameters: {'splitter': 'best', 'min_samples_split': 0.08303991749340404, 'min_samples_leaf': 0.02001140461263945, 'min_weight_fraction_leaf': 0.0002905136588872576, 'max_features': 0.3300147984051939}. Best is trial 208 with value: 0.8264270922211081.[0m
[32m[I 2022-04-21 11:38:26,120][0m Trial 251 finished with value: 0.8070570404128778 and parameters: {'splitter': 'best', 'min_samples_split': 0.08947701066325717, 'min_samples_leaf': 0.011410344772033924, 'min_weight_fraction_leaf': 0.018754309455810893, 'max_features': 0.12381903164443964}. Best is trial 208 with value: 0.8264270922211081.[0m
[32m[I 2022-04-21 11:38:26,484][0m Trial 252 finished with value: 0.8088135357313263 and parameters: {'splitter': 'best', 'min_samples_split': 0.09809606620733974, 'min_samples_leaf': 0.02616332468388974, 'min_weight_fraction_leaf': 0.030647860996419245, 'max_features': 0.38953431052612364}. Best is trial 208 with value: 0.8264270922211081.[0m
[32m[I 2022-04-21 11:38:27,054][0m Trial 253 finished with value: 0.8195671346859055 and parameters: {'splitter': 'best', 'min_samples_split': 0.10019256702037972, 'min_samples_leaf': 0.001325990703122403, 'min_weight_fraction_leaf': 0.015290035289164856, 'max_features': 0.37066058338338503}. Best is trial 208 with value: 0.8264270922211081.[0m
[32m[I 2022-04-21 11:38:27,393][0m Trial 254 finished with value: 0.8032732316435511 and parameters: {'splitter': 'best', 'min_samples_split': 0.07447811224068199, 'min_samples_leaf': 0.035335337026559846, 'min_weight_fraction_leaf': 0.03944988627192284, 'max_features': 0.36245788257709516}. Best is trial 208 with value: 0.8264270922211081.[0m
/media/san2_ssd/data/Workdir/survival/utils.py:305: RuntimeWarning: invalid value encountered in true_divide
  pdfs = np.gradient(1-survs,axis=1)/norms
[32m[I 2022-04-21 11:38:27,817][0m Trial 255 finished with value: 0.8083702464866549 and parameters: {'splitter': 'best', 'min_samples_split': 0.0879011415366065, 'min_samples_leaf': 0.016752514900456428, 'min_weight_fraction_leaf': 0.0194701668581622, 'max_features': 0.37240964991290043}. Best is trial 208 with value: 0.8264270922211081.[0m
/media/san2_ssd/data/Workdir/survival/utils.py:305: RuntimeWarning: invalid value encountered in true_divide
  pdfs = np.gradient(1-survs,axis=1)/norms
/media/san2_ssd/data/Workdir/survival/utils.py:305: RuntimeWarning: invalid value encountered in true_divide
  pdfs = np.gradient(1-survs,axis=1)/norms
[32m[I 2022-04-21 11:38:28,942][0m Trial 256 finished with value: 0.8262582946198631 and parameters: {'splitter': 'best', 'min_samples_split': 0.10026717354749183, 'min_samples_leaf': 0.008044221885046157, 'min_weight_fraction_leaf': 0.011741263703348392, 'max_features': 0.3432954742203391}. Best is trial 208 with value: 0.8264270922211081.[0m
[32m[I 2022-04-21 11:38:29,362][0m Trial 257 finished with value: 0.695656235645496 and parameters: {'splitter': 'best', 'min_samples_split': 0.29735618669533537, 'min_samples_leaf': 0.008078063183401782, 'min_weight_fraction_leaf': 0.04546268996540129, 'max_features': 0.34028780875536213}. Best is trial 208 with value: 0.8264270922211081.[0m
[32m[I 2022-04-21 11:38:30,204][0m Trial 258 finished with value: 0.8223935427839372 and parameters: {'splitter': 'best', 'min_samples_split': 0.10042580693849995, 'min_samples_leaf': 0.001090782392056783, 'min_weight_fraction_leaf': 0.028432383629915448, 'max_features': 0.4021860222853091}. Best is trial 208 with value: 0.8264270922211081.[0m
[32m[I 2022-04-21 11:38:31,008][0m Trial 259 finished with value: 0.8193274435551519 and parameters: {'splitter': 'best', 'min_samples_split': 0.10310769028178032, 'min_samples_leaf': 0.009209781179719519, 'min_weight_fraction_leaf': 0.025900041055689944, 'max_features': 0.3994729532666707}. Best is trial 208 with value: 0.8264270922211081.[0m
[32m[I 2022-04-21 11:38:31,257][0m Trial 260 finished with value: 0.4974000559478983 and parameters: {'splitter': 'best', 'min_samples_split': 0.10189852882586375, 'min_samples_leaf': 0.2363544975833715, 'min_weight_fraction_leaf': 0.03123938139748556, 'max_features': 0.3931598694209043}. Best is trial 208 with value: 0.8264270922211081.[0m
[32m[I 2022-04-21 11:38:32,114][0m Trial 261 finished with value: 0.819933520430733 and parameters: {'splitter': 'best', 'min_samples_split': 0.10934668402412827, 'min_samples_leaf': 0.007524337497586116, 'min_weight_fraction_leaf': 0.026572738870439636, 'max_features': 0.39937158928477917}. Best is trial 208 with value: 0.8264270922211081.[0m
[32m[I 2022-04-21 11:38:32,547][0m Trial 262 finished with value: 0.8066315347862172 and parameters: {'splitter': 'best', 'min_samples_split': 0.10869005693117292, 'min_samples_leaf': 0.008293401843011092, 'min_weight_fraction_leaf': 0.02786774617936089, 'max_features': 0.3495283468391691}. Best is trial 208 with value: 0.8264270922211081.[0m
[32m[I 2022-04-21 11:38:32,776][0m Trial 263 finished with value: 0.472473435287635 and parameters: {'splitter': 'best', 'min_samples_split': 0.09739407609536098, 'min_samples_leaf': 0.0025186914653563403, 'min_weight_fraction_leaf': 0.46396116480983396, 'max_features': 0.47707013216932986}. Best is trial 208 with value: 0.8264270922211081.[0m
/media/san2_ssd/data/Workdir/survival/utils.py:305: RuntimeWarning: invalid value encountered in true_divide
  pdfs = np.gradient(1-survs,axis=1)/norms
[32m[I 2022-04-21 11:38:33,251][0m Trial 264 finished with value: 0.8147559505079089 and parameters: {'splitter': 'best', 'min_samples_split': 0.11009775477298869, 'min_samples_leaf': 0.001056159218809291, 'min_weight_fraction_leaf': 0.024742965894246464, 'max_features': 0.3766499345496622}. Best is trial 208 with value: 0.8264270922211081.[0m
[32m[I 2022-04-21 11:38:33,610][0m Trial 265 finished with value: 0.8102703598245199 and parameters: {'splitter': 'best', 'min_samples_split': 0.1193112677789955, 'min_samples_leaf': 0.010093824670883312, 'min_weight_fraction_leaf': 0.037232994813253775, 'max_features': 0.3197526991745297}. Best is trial 208 with value: 0.8264270922211081.[0m
[32m[I 2022-04-21 11:38:33,827][0m Trial 266 finished with value: 0.663651925671249 and parameters: {'splitter': 'best', 'min_samples_split': 0.09716144442624558, 'min_samples_leaf': 0.01154073502931885, 'min_weight_fraction_leaf': 0.2624555656782779, 'max_features': 0.4211314424180886}. Best is trial 208 with value: 0.8264270922211081.[0m
[32m[I 2022-04-21 11:38:34,156][0m Trial 267 finished with value: 0.8053916711891226 and parameters: {'splitter': 'best', 'min_samples_split': 0.10242592729379675, 'min_samples_leaf': 0.030163591910777793, 'min_weight_fraction_leaf': 0.015812591709508213, 'max_features': 0.391333927771038}. Best is trial 208 with value: 0.8264270922211081.[0m
/media/san2_ssd/data/Workdir/survival/utils.py:305: RuntimeWarning: invalid value encountered in true_divide
  pdfs = np.gradient(1-survs,axis=1)/norms
[32m[I 2022-04-21 11:38:34,523][0m Trial 268 finished with value: 0.8094025086035026 and parameters: {'splitter': 'best', 'min_samples_split': 0.11584615900879475, 'min_samples_leaf': 0.011397137448859963, 'min_weight_fraction_leaf': 0.023156656722824312, 'max_features': 0.42132907925005947}. Best is trial 208 with value: 0.8264270922211081.[0m
[32m[I 2022-04-21 11:38:34,782][0m Trial 269 finished with value: 0.8026455154295554 and parameters: {'splitter': 'best', 'min_samples_split': 0.10677506728655516, 'min_samples_leaf': 0.025726478667684422, 'min_weight_fraction_leaf': 0.013422262527291519, 'max_features': 0.44854235811984855}. Best is trial 208 with value: 0.8264270922211081.[0m
[32m[I 2022-04-21 11:38:35,083][0m Trial 270 finished with value: 0.8090486077496971 and parameters: {'splitter': 'best', 'min_samples_split': 0.12299560250763683, 'min_samples_leaf': 0.001719075965868927, 'min_weight_fraction_leaf': 0.03349065007411463, 'max_features': 0.4008560760849714}. Best is trial 208 with value: 0.8264270922211081.[0m
[32m[I 2022-04-21 11:38:35,261][0m Trial 271 finished with value: 0.8158982091989773 and parameters: {'splitter': 'best', 'min_samples_split': 0.18334972118452383, 'min_samples_leaf': 0.04800082406028633, 'min_weight_fraction_leaf': 0.051530183806615115, 'max_features': 0.3540396265879636}. Best is trial 208 with value: 0.8264270922211081.[0m
[32m[I 2022-04-21 11:38:35,366][0m Trial 272 finished with value: 0.8129435670178182 and parameters: {'splitter': 'random', 'min_samples_split': 0.09733651205637349, 'min_samples_leaf': 0.017868642381583484, 'min_weight_fraction_leaf': 0.010859388013102982, 'max_features': 0.3821529129325758}. Best is trial 208 with value: 0.8264270922211081.[0m
