[32m[I 2022-04-21 11:39:12,520][0m Trial 8 finished with value: 0.5489840360325607 and parameters: {'splitter': 'best', 'min_samples_split': 0.10716562610683666, 'min_samples_leaf': 0.12917452048649977, 'min_weight_fraction_leaf': 0.33175336279987533, 'max_features': 0.7525237175916027}. Best is trial 5 with value: 0.6738476114655684.[0m
[32m[I 2022-04-21 11:39:12,548][0m Trial 9 finished with value: 0.5 and parameters: {'splitter': 'random', 'min_samples_split': 0.3135680700468336, 'min_samples_leaf': 0.4835883091457616, 'min_weight_fraction_leaf': 0.23395386236417276, 'max_features': 0.031390238998085684}. Best is trial 5 with value: 0.6738476114655684.[0m
[32m[I 2022-04-21 11:39:12,663][0m Trial 10 finished with value: 0.6719973066813149 and parameters: {'splitter': 'random', 'min_samples_split': 0.003738136981015522, 'min_samples_leaf': 0.008731590898493537, 'min_weight_fraction_leaf': 0.008498061177413335, 'max_features': 0.9949774767607136}. Best is trial 5 with value: 0.6738476114655684.[0m
[32m[I 2022-04-21 11:39:12,784][0m Trial 11 finished with value: 0.6773038119717333 and parameters: {'splitter': 'random', 'min_samples_split': 0.04224757180725848, 'min_samples_leaf': 0.002324223095765538, 'min_weight_fraction_leaf': 0.015466477571951548, 'max_features': 0.9969213989040255}. Best is trial 11 with value: 0.6773038119717333.[0m
[32m[I 2022-04-21 11:39:12,881][0m Trial 12 finished with value: 0.5 and parameters: {'splitter': 'random', 'min_samples_split': 0.12555830091960973, 'min_samples_leaf': 0.07994621470955388, 'min_weight_fraction_leaf': 0.4896578204969452, 'max_features': 0.9982871146893425}. Best is trial 11 with value: 0.6773038119717333.[0m
[32m[I 2022-04-21 11:39:13,000][0m Trial 13 finished with value: 0.6556570012431993 and parameters: {'splitter': 'random', 'min_samples_split': 0.08024619698518422, 'min_samples_leaf': 0.06023182387784491, 'min_weight_fraction_leaf': 0.01138256277578542, 'max_features': 0.8182312926436159}. Best is trial 11 with value: 0.6773038119717333.[0m
[32m[I 2022-04-21 11:39:13,097][0m Trial 14 finished with value: 0.6640701022932763 and parameters: {'splitter': 'random', 'min_samples_split': 0.2053003436597222, 'min_samples_leaf': 0.1352504813312174, 'min_weight_fraction_leaf': 0.07342707676032878, 'max_features': 0.8480986246328477}. Best is trial 11 with value: 0.6773038119717333.[0m
[32m[I 2022-04-21 11:39:13,221][0m Trial 15 finished with value: 0.6636900948801576 and parameters: {'splitter': 'best', 'min_samples_split': 0.059037388904955954, 'min_samples_leaf': 0.05911251505541426, 'min_weight_fraction_leaf': 0.11785114522143197, 'max_features': 0.6482357910776553}. Best is trial 11 with value: 0.6773038119717333.[0m
[32m[I 2022-04-21 11:39:13,339][0m Trial 16 finished with value: 0.6738476114655684 and parameters: {'splitter': 'random', 'min_samples_split': 0.17719774939134614, 'min_samples_leaf': 0.1851653896114773, 'min_weight_fraction_leaf': 0.074114625023191, 'max_features': 0.8928371288158066}. Best is trial 11 with value: 0.6773038119717333.[0m
[32m[I 2022-04-21 11:39:13,432][0m Trial 17 finished with value: 0.5 and parameters: {'splitter': 'random', 'min_samples_split': 0.18285433553939662, 'min_samples_leaf': 0.3159498988452935, 'min_weight_fraction_leaf': 0.07042164066505059, 'max_features': 0.8605436578075755}. Best is trial 11 with value: 0.6773038119717333.[0m
[32m[I 2022-04-21 11:39:13,519][0m Trial 18 finished with value: 0.5 and parameters: {'splitter': 'best', 'min_samples_split': 0.04035504605266832, 'min_samples_leaf': 0.007784606674492295, 'min_weight_fraction_leaf': 0.40626093699103877, 'max_features': 0.6885627870879998}. Best is trial 11 with value: 0.6773038119717333.[0m
[32m[I 2022-04-21 11:39:13,609][0m Trial 19 finished with value: 0.5 and parameters: {'splitter': 'random', 'min_samples_split': 0.484728613991039, 'min_samples_leaf': 0.19036647730808723, 'min_weight_fraction_leaf': 0.06311637132154316, 'max_features': 0.5349799544172673}. Best is trial 11 with value: 0.6773038119717333.[0m
[32m[I 2022-04-21 11:39:13,686][0m Trial 20 finished with value: 0.5 and parameters: {'splitter': 'random', 'min_samples_split': 0.26094376747541903, 'min_samples_leaf': 0.38045063163649023, 'min_weight_fraction_leaf': 0.10398028889717317, 'max_features': 0.8891787984121395}. Best is trial 11 with value: 0.6773038119717333.[0m
[32m[I 2022-04-21 11:39:13,766][0m Trial 21 finished with value: 0.6738476114655684 and parameters: {'splitter': 'random', 'min_samples_split': 0.11855350393590534, 'min_samples_leaf': 0.08960038048398108, 'min_weight_fraction_leaf': 0.1670080710556508, 'max_features': 0.9362703021774803}. Best is trial 11 with value: 0.6773038119717333.[0m
[32m[I 2022-04-21 11:39:13,840][0m Trial 22 finished with value: 0.663370045654361 and parameters: {'splitter': 'random', 'min_samples_split': 0.16814975794183834, 'min_samples_leaf': 0.10407086925384332, 'min_weight_fraction_leaf': 0.03476126409015032, 'max_features': 0.7636054898291853}. Best is trial 11 with value: 0.6773038119717333.[0m
[32m[I 2022-04-21 11:39:13,900][0m Trial 23 finished with value: 0.662800366349585 and parameters: {'splitter': 'random', 'min_samples_split': 0.08017393821032273, 'min_samples_leaf': 0.16425099959461464, 'min_weight_fraction_leaf': 0.15003823984990344, 'max_features': 0.9236796538180683}. Best is trial 11 with value: 0.6773038119717333.[0m
[32m[I 2022-04-21 11:39:13,948][0m Trial 24 finished with value: 0.5 and parameters: {'splitter': 'random', 'min_samples_split': 0.14967205583026577, 'min_samples_leaf': 0.26295420891130133, 'min_weight_fraction_leaf': 0.10819227297338829, 'max_features': 0.7501963001958228}. Best is trial 11 with value: 0.6773038119717333.[0m
[32m[I 2022-04-21 11:39:13,990][0m Trial 25 finished with value: 0.6647456324911225 and parameters: {'splitter': 'random', 'min_samples_split': 0.2298361369430682, 'min_samples_leaf': 0.10308784810728924, 'min_weight_fraction_leaf': 0.05030440587820412, 'max_features': 0.9129639591579378}. Best is trial 11 with value: 0.6773038119717333.[0m
[32m[I 2022-04-21 11:39:14,050][0m Trial 26 finished with value: 0.6598137568019723 and parameters: {'splitter': 'best', 'min_samples_split': 0.03931241458390684, 'min_samples_leaf': 0.050976401707009206, 'min_weight_fraction_leaf': 0.17932667433277052, 'max_features': 0.8018570512820744}. Best is trial 11 with value: 0.6773038119717333.[0m
[32m[I 2022-04-21 11:39:14,090][0m Trial 27 finished with value: 0.5 and parameters: {'splitter': 'random', 'min_samples_split': 0.09387629597270195, 'min_samples_leaf': 0.2501340052747398, 'min_weight_fraction_leaf': 0.09777650815909825, 'max_features': 0.7037947483488631}. Best is trial 11 with value: 0.6773038119717333.[0m
[32m[I 2022-04-21 11:39:14,149][0m Trial 28 finished with value: 0.6738476114655684 and parameters: {'splitter': 'random', 'min_samples_split': 0.18522069514527112, 'min_samples_leaf': 0.040970048989806995, 'min_weight_fraction_leaf': 0.19178868339894148, 'max_features': 0.9940299539719575}. Best is trial 11 with value: 0.6773038119717333.[0m
[32m[I 2022-04-21 11:39:14,207][0m Trial 29 finished with value: 0.5 and parameters: {'splitter': 'random', 'min_samples_split': 0.3059165795321924, 'min_samples_leaf': 0.04672599016011607, 'min_weight_fraction_leaf': 0.2917044194770805, 'max_features': 0.9463031452859043}. Best is trial 11 with value: 0.6773038119717333.[0m
[32m[I 2022-04-21 11:39:14,304][0m Trial 30 finished with value: 0.5 and parameters: {'splitter': 'random', 'min_samples_split': 0.3680095743161945, 'min_samples_leaf': 0.250790908803458, 'min_weight_fraction_leaf': 0.2816408497253844, 'max_features': 0.13971091241082856}. Best is trial 11 with value: 0.6773038119717333.[0m
[32m[I 2022-04-21 11:39:14,372][0m Trial 31 finished with value: 0.6738476114655684 and parameters: {'splitter': 'random', 'min_samples_split': 0.1675906648666317, 'min_samples_leaf': 0.038193996673318034, 'min_weight_fraction_leaf': 0.1936596527053383, 'max_features': 0.9780884034064179}. Best is trial 11 with value: 0.6773038119717333.[0m
[32m[I 2022-04-21 11:39:14,449][0m Trial 32 finished with value: 0.6738476114655684 and parameters: {'splitter': 'random', 'min_samples_split': 0.21018761863389746, 'min_samples_leaf': 0.09542702937200054, 'min_weight_fraction_leaf': 0.18340582074612138, 'max_features': 0.9686934446575862}. Best is trial 11 with value: 0.6773038119717333.[0m
[32m[I 2022-04-21 11:39:14,516][0m Trial 33 finished with value: 0.6738476114655684 and parameters: {'splitter': 'random', 'min_samples_split': 0.19463364553253557, 'min_samples_leaf': 0.17062150171315463, 'min_weight_fraction_leaf': 0.12658906439303774, 'max_features': 0.8858971498230909}. Best is trial 11 with value: 0.6773038119717333.[0m
[32m[I 2022-04-21 11:39:14,584][0m Trial 34 finished with value: 0.6718997342910418 and parameters: {'splitter': 'random', 'min_samples_split': 0.24389496578650094, 'min_samples_leaf': 0.035770164823217925, 'min_weight_fraction_leaf': 0.025744196502217608, 'max_features': 0.8281770796655074}. Best is trial 11 with value: 0.6773038119717333.[0m
[32m[I 2022-04-21 11:39:14,625][0m Trial 35 finished with value: 0.6513921976885101 and parameters: {'splitter': 'random', 'min_samples_split': 0.21767314094583481, 'min_samples_leaf': 0.09130595471018425, 'min_weight_fraction_leaf': 0.14304356683850555, 'max_features': 0.5737862339618147}. Best is trial 11 with value: 0.6773038119717333.[0m
[32m[I 2022-04-21 11:39:14,691][0m Trial 36 finished with value: 0.6636900948801576 and parameters: {'splitter': 'best', 'min_samples_split': 0.11585605679367698, 'min_samples_leaf': 0.1634689888561526, 'min_weight_fraction_leaf': 0.26020752792253365, 'max_features': 0.9297416450289497}. Best is trial 11 with value: 0.6773038119717333.[0m
[32m[I 2022-04-21 11:39:14,747][0m Trial 37 finished with value: 0.6640701022932763 and parameters: {'splitter': 'random', 'min_samples_split': 0.04638345791041365, 'min_samples_leaf': 0.1218490348358777, 'min_weight_fraction_leaf': 0.13498566486603383, 'max_features': 0.8677706606957496}. Best is trial 11 with value: 0.6773038119717333.[0m
[32m[I 2022-04-21 11:39:14,801][0m Trial 38 finished with value: 0.6599474203034321 and parameters: {'splitter': 'random', 'min_samples_split': 0.4103287731080668, 'min_samples_leaf': 0.06976359840922632, 'min_weight_fraction_leaf': 0.07864251806680918, 'max_features': 0.4177686030997548}. Best is trial 11 with value: 0.6773038119717333.[0m
[32m[I 2022-04-21 11:39:14,857][0m Trial 39 finished with value: 0.5 and parameters: {'splitter': 'random', 'min_samples_split': 0.15619006016955128, 'min_samples_leaf': 0.0025294683248122604, 'min_weight_fraction_leaf': 0.20141404462866308, 'max_features': 0.2738187558924786}. Best is trial 11 with value: 0.6773038119717333.[0m
[32m[I 2022-04-21 11:39:14,910][0m Trial 40 finished with value: 0.6636900948801576 and parameters: {'splitter': 'best', 'min_samples_split': 0.29981825903008574, 'min_samples_leaf': 0.16770456441237785, 'min_weight_fraction_leaf': 0.25699862943630536, 'max_features': 0.9565151770465471}. Best is trial 11 with value: 0.6773038119717333.[0m
[32m[I 2022-04-21 11:39:14,935][0m Trial 41 finished with value: 0.6586187582319654 and parameters: {'splitter': 'random', 'min_samples_split': 0.1883110925368201, 'min_samples_leaf': 0.20539303741331977, 'min_weight_fraction_leaf': 0.21012195536975653, 'max_features': 0.8752212644415155}. Best is trial 11 with value: 0.6773038119717333.[0m
[32m[I 2022-04-21 11:39:14,961][0m Trial 42 finished with value: 0.6738476114655684 and parameters: {'splitter': 'random', 'min_samples_split': 0.13653026047396827, 'min_samples_leaf': 0.028759017741953358, 'min_weight_fraction_leaf': 0.1742918334503063, 'max_features': 0.9989863313148963}. Best is trial 11 with value: 0.6773038119717333.[0m
[32m[I 2022-04-21 11:39:14,990][0m Trial 43 finished with value: 0.6738476114655684 and parameters: {'splitter': 'random', 'min_samples_split': 0.2831319560299701, 'min_samples_leaf': 0.11266942350243972, 'min_weight_fraction_leaf': 0.1729524893534678, 'max_features': 0.9498651373642902}. Best is trial 11 with value: 0.6773038119717333.[0m
[32m[I 2022-04-21 11:39:15,021][0m Trial 44 finished with value: 0.6551405301163737 and parameters: {'splitter': 'random', 'min_samples_split': 0.2023354339491413, 'min_samples_leaf': 0.07620593916067984, 'min_weight_fraction_leaf': 0.22216412700255436, 'max_features': 0.921125906668327}. Best is trial 11 with value: 0.6773038119717333.[0m
[32m[I 2022-04-21 11:39:15,052][0m Trial 45 finished with value: 0.6650367998115423 and parameters: {'splitter': 'random', 'min_samples_split': 0.2874796240955164, 'min_samples_leaf': 0.12089513376931262, 'min_weight_fraction_leaf': 0.12274219453389237, 'max_features': 0.9627116674237308}. Best is trial 11 with value: 0.6773038119717333.[0m
[32m[I 2022-04-21 11:39:15,076][0m Trial 46 finished with value: 0.5 and parameters: {'splitter': 'random', 'min_samples_split': 0.1722759270445806, 'min_samples_leaf': 0.029411831482992527, 'min_weight_fraction_leaf': 0.3475053488359895, 'max_features': 0.7943891437268253}. Best is trial 11 with value: 0.6773038119717333.[0m
[32m[I 2022-04-21 11:39:15,102][0m Trial 47 finished with value: 0.6738476114655684 and parameters: {'splitter': 'random', 'min_samples_split': 0.13901548799992625, 'min_samples_leaf': 0.031859938901057254, 'min_weight_fraction_leaf': 0.17234230387190339, 'max_features': 0.9913770550568192}. Best is trial 11 with value: 0.6773038119717333.[0m
[32m[I 2022-04-21 11:39:15,127][0m Trial 48 finished with value: 0.6571506039003374 and parameters: {'splitter': 'random', 'min_samples_split': 0.023678289892015758, 'min_samples_leaf': 0.02775566150355342, 'min_weight_fraction_leaf': 0.005108056321912774, 'max_features': 0.46388701750421374}. Best is trial 11 with value: 0.6773038119717333.[0m
[32m[I 2022-04-21 11:39:15,153][0m Trial 49 finished with value: 0.5 and parameters: {'splitter': 'best', 'min_samples_split': 0.0749638897056828, 'min_samples_leaf': 0.48192476419321806, 'min_weight_fraction_leaf': 0.08677599193636933, 'max_features': 0.9941582037332547}. Best is trial 11 with value: 0.6773038119717333.[0m
[32m[I 2022-04-21 11:39:15,178][0m Trial 50 finished with value: 0.5931624331547747 and parameters: {'splitter': 'random', 'min_samples_split': 0.10516594729257862, 'min_samples_leaf': 0.1442865314013608, 'min_weight_fraction_leaf': 0.24176240607156377, 'max_features': 0.8380787623147087}. Best is trial 11 with value: 0.6773038119717333.[0m
[32m[I 2022-04-21 11:39:15,203][0m Trial 51 finished with value: 0.5 and parameters: {'splitter': 'random', 'min_samples_split': 0.14745429245998537, 'min_samples_leaf': 0.01586432557404062, 'min_weight_fraction_leaf': 0.19297051779258834, 'max_features': 0.33605385924057385}. Best is trial 11 with value: 0.6773038119717333.[0m
[32m[I 2022-04-21 11:39:15,228][0m Trial 52 finished with value: 0.6738476114655684 and parameters: {'splitter': 'random', 'min_samples_split': 0.2814243844975003, 'min_samples_leaf': 0.061874194327875484, 'min_weight_fraction_leaf': 0.1987685656070006, 'max_features': 0.9589813363970817}. Best is trial 11 with value: 0.6773038119717333.[0m
[32m[I 2022-04-21 11:39:15,254][0m Trial 53 finished with value: 0.6647456324911225 and parameters: {'splitter': 'random', 'min_samples_split': 0.2360620814716532, 'min_samples_leaf': 0.08844692295766687, 'min_weight_fraction_leaf': 0.03854203216408866, 'max_features': 0.8883323462359694}. Best is trial 11 with value: 0.6773038119717333.[0m
[32m[I 2022-04-21 11:39:15,280][0m Trial 54 finished with value: 0.662800366349585 and parameters: {'splitter': 'random', 'min_samples_split': 0.1288253961244044, 'min_samples_leaf': 0.022846272414710368, 'min_weight_fraction_leaf': 0.16557380647224576, 'max_features': 0.9360268805373805}. Best is trial 11 with value: 0.6773038119717333.[0m
[32m[I 2022-04-21 11:39:15,305][0m Trial 55 finished with value: 0.6543938115635641 and parameters: {'splitter': 'random', 'min_samples_split': 0.34883517254059737, 'min_samples_leaf': 0.11555065970298428, 'min_weight_fraction_leaf': 0.15517816615223057, 'max_features': 0.9027646863676632}. Best is trial 11 with value: 0.6773038119717333.[0m
[32m[I 2022-04-21 11:39:15,331][0m Trial 56 finished with value: 0.6215155824977587 and parameters: {'splitter': 'random', 'min_samples_split': 0.17009962303660814, 'min_samples_leaf': 0.0426343314242926, 'min_weight_fraction_leaf': 0.22439096867389263, 'max_features': 0.9945579043638081}. Best is trial 11 with value: 0.6773038119717333.[0m
[32m[I 2022-04-21 11:39:15,371][0m Trial 57 finished with value: 0.655668460990784 and parameters: {'splitter': 'random', 'min_samples_split': 0.191319737983628, 'min_samples_leaf': 0.003489699930870206, 'min_weight_fraction_leaf': 0.1293918336784502, 'max_features': 0.7744106414991903}. Best is trial 11 with value: 0.6773038119717333.[0m
[32m[I 2022-04-21 11:39:15,417][0m Trial 58 finished with value: 0.6136073090060808 and parameters: {'splitter': 'random', 'min_samples_split': 0.20922697914666355, 'min_samples_leaf': 0.1484208763050111, 'min_weight_fraction_leaf': 0.05666376634896822, 'max_features': 0.7216435538590982}. Best is trial 11 with value: 0.6773038119717333.[0m
[32m[I 2022-04-21 11:39:15,466][0m Trial 59 finished with value: 0.6636900948801576 and parameters: {'splitter': 'best', 'min_samples_split': 0.3249247052500304, 'min_samples_leaf': 0.0976658813864153, 'min_weight_fraction_leaf': 0.1626574593620802, 'max_features': 0.6586371508473366}. Best is trial 11 with value: 0.6773038119717333.[0m
[32m[I 2022-04-21 11:39:15,509][0m Trial 60 finished with value: 0.5 and parameters: {'splitter': 'random', 'min_samples_split': 0.261796829310728, 'min_samples_leaf': 0.07632729354571538, 'min_weight_fraction_leaf': 0.4699142622573357, 'max_features': 0.8581116921308645}. Best is trial 11 with value: 0.6773038119717333.[0m
[32m[I 2022-04-21 11:39:15,554][0m Trial 61 finished with value: 0.6738476114655684 and parameters: {'splitter': 'random', 'min_samples_split': 0.28475920741406885, 'min_samples_leaf': 0.17670289215382065, 'min_weight_fraction_leaf': 0.08667451476776442, 'max_features': 0.9023365286530837}. Best is trial 11 with value: 0.6773038119717333.[0m
[32m[I 2022-04-21 11:39:15,605][0m Trial 62 finished with value: 0.6738476114655684 and parameters: {'splitter': 'random', 'min_samples_split': 0.15841173611830706, 'min_samples_leaf': 0.06025449853955159, 'min_weight_fraction_leaf': 0.19309009122045245, 'max_features': 0.9637839187307191}. Best is trial 11 with value: 0.6773038119717333.[0m
[32m[I 2022-04-21 11:39:15,650][0m Trial 63 finished with value: 0.6738476114655684 and parameters: {'splitter': 'random', 'min_samples_split': 0.3700804306479466, 'min_samples_leaf': 0.05466767932459317, 'min_weight_fraction_leaf': 0.1747542876671593, 'max_features': 0.9977934015028804}. Best is trial 11 with value: 0.6773038119717333.[0m
[32m[I 2022-04-21 11:39:15,693][0m Trial 64 finished with value: 0.6586187582319654 and parameters: {'splitter': 'random', 'min_samples_split': 0.2804914582766642, 'min_samples_leaf': 0.06714721653046515, 'min_weight_fraction_leaf': 0.2102301706294269, 'max_features': 0.9520891144358702}. Best is trial 11 with value: 0.6773038119717333.[0m
[32m[I 2022-04-21 11:39:15,719][0m Trial 65 finished with value: 0.6586187582319654 and parameters: {'splitter': 'random', 'min_samples_split': 0.41454199700589545, 'min_samples_leaf': 0.20182403539479293, 'min_weight_fraction_leaf': 0.10661571717259567, 'max_features': 0.819673314054092}. Best is trial 11 with value: 0.6773038119717333.[0m
[32m[I 2022-04-21 11:39:15,744][0m Trial 66 finished with value: 0.6215155824977587 and parameters: {'splitter': 'random', 'min_samples_split': 0.2177503951711083, 'min_samples_leaf': 0.22774308505930393, 'min_weight_fraction_leaf': 0.13887284758255786, 'max_features': 0.9062647174180687}. Best is trial 11 with value: 0.6773038119717333.[0m
[32m[I 2022-04-21 11:39:15,769][0m Trial 67 finished with value: 0.5 and parameters: {'splitter': 'random', 'min_samples_split': 0.25374616515453086, 'min_samples_leaf': 0.04208159252654497, 'min_weight_fraction_leaf': 0.27290902843801224, 'max_features': 0.9655043310150102}. Best is trial 11 with value: 0.6773038119717333.[0m
[32m[I 2022-04-21 11:39:15,795][0m Trial 68 finished with value: 0.6502080893344752 and parameters: {'splitter': 'random', 'min_samples_split': 0.09480972954262377, 'min_samples_leaf': 0.019272582974069426, 'min_weight_fraction_leaf': 0.15115280440913462, 'max_features': 0.8739525190326468}. Best is trial 11 with value: 0.6773038119717333.[0m
[32m[I 2022-04-21 11:39:15,821][0m Trial 69 finished with value: 0.5931624331547747 and parameters: {'splitter': 'random', 'min_samples_split': 0.4135418874142592, 'min_samples_leaf': 0.056543583858135446, 'min_weight_fraction_leaf': 0.23732219954024225, 'max_features': 0.9196118994951374}. Best is trial 11 with value: 0.6773038119717333.[0m
[32m[I 2022-04-21 11:39:15,849][0m Trial 70 finished with value: 0.6139501367869995 and parameters: {'splitter': 'best', 'min_samples_split': 0.0627263010578829, 'min_samples_leaf': 0.09580589103490011, 'min_weight_fraction_leaf': 0.313393525017533, 'max_features': 0.84376615041177}. Best is trial 11 with value: 0.6773038119717333.[0m
[32m[I 2022-04-21 11:39:15,879][0m Trial 71 finished with value: 0.6738476114655684 and parameters: {'splitter': 'random', 'min_samples_split': 0.2248450501687774, 'min_samples_leaf': 0.11073203419024988, 'min_weight_fraction_leaf': 0.182605664862954, 'max_features': 0.9656209524611484}. Best is trial 11 with value: 0.6773038119717333.[0m
