[32m[I 2022-04-21 15:46:03,813][0m Trial 140 finished with value: 0.8415400407350366 and parameters: {'loss': 'coxph', 'learning_rate': 0.0008721047758902656, 'n_estimators': 629, 'criterion': 'friedman_mse', 'min_samples_split': 2, 'min_samples_leaf': 2, 'min_weight_fraction_leaf': 0.1892257677047836, 'min_impurity_decrease': 0.3394715712446713, 'max_features': 0.30421934491628233, 'subsample': 0.06791382670736613, 'dropout_rate': 0.04331063195469615, 'ccp_alpha': 0.48638140402915025}. Best is trial 87 with value: 0.8461097132289419.[0m
[32m[I 2022-04-21 15:48:37,406][0m Trial 141 finished with value: 0.8452679571870096 and parameters: {'loss': 'coxph', 'learning_rate': 0.0018413428603642613, 'n_estimators': 719, 'criterion': 'friedman_mse', 'min_samples_split': 2, 'min_samples_leaf': 1, 'min_weight_fraction_leaf': 0.18041158329007534, 'min_impurity_decrease': 0.28705108689760733, 'max_features': 0.3119937191128826, 'subsample': 0.09013085051030095, 'dropout_rate': 0.07730822152403402, 'ccp_alpha': 0.02447266757952435}. Best is trial 87 with value: 0.8461097132289419.[0m
[32m[I 2022-04-21 15:51:07,968][0m Trial 142 finished with value: 0.8431948125201292 and parameters: {'loss': 'coxph', 'learning_rate': 0.004044636700234719, 'n_estimators': 702, 'criterion': 'friedman_mse', 'min_samples_split': 2, 'min_samples_leaf': 1, 'min_weight_fraction_leaf': 0.2082025448337295, 'min_impurity_decrease': 0.36364285154591164, 'max_features': 0.23220982327399736, 'subsample': 0.026660614476120448, 'dropout_rate': 0.06969399012316807, 'ccp_alpha': 0.2331144549911891}. Best is trial 87 with value: 0.8461097132289419.[0m
[32m[I 2022-04-21 15:54:25,246][0m Trial 143 finished with value: 0.8461396295970018 and parameters: {'loss': 'coxph', 'learning_rate': 4.939888051670341e-05, 'n_estimators': 772, 'criterion': 'friedman_mse', 'min_samples_split': 3, 'min_samples_leaf': 1, 'min_weight_fraction_leaf': 0.199519436517579, 'min_impurity_decrease': 0.30224348179974286, 'max_features': 0.3788314456605033, 'subsample': 0.05542752651800319, 'dropout_rate': 0.07890356111558178, 'ccp_alpha': 0.0019065345895832447}. Best is trial 143 with value: 0.8461396295970018.[0m
[32m[I 2022-04-21 15:57:07,808][0m Trial 144 finished with value: 0.65 and parameters: {'loss': 'coxph', 'learning_rate': 0.0013648703189918629, 'n_estimators': 781, 'criterion': 'friedman_mse', 'min_samples_split': 3, 'min_samples_leaf': 1, 'min_weight_fraction_leaf': 0.22034956463674185, 'min_impurity_decrease': 0.30760496148901467, 'max_features': 0.3993560664011368, 'subsample': 0.09090832261305024, 'dropout_rate': 0.03753007153656315, 'ccp_alpha': 3.12556448967781}. Best is trial 143 with value: 0.8461396295970018.[0m
[32m[I 2022-04-21 16:00:15,640][0m Trial 145 finished with value: 0.8438729171683486 and parameters: {'loss': 'coxph', 'learning_rate': 4.5362512810082976e-05, 'n_estimators': 802, 'criterion': 'friedman_mse', 'min_samples_split': 3, 'min_samples_leaf': 2, 'min_weight_fraction_leaf': 0.24013119594905852, 'min_impurity_decrease': 0.3275355908306793, 'max_features': 0.3730667013036552, 'subsample': 0.036214376792532914, 'dropout_rate': 0.0009463019875299572, 'ccp_alpha': 0.3470383760038223}. Best is trial 143 with value: 0.8461396295970018.[0m
[32m[I 2022-04-21 16:02:36,674][0m Trial 146 finished with value: 0.65 and parameters: {'loss': 'coxph', 'learning_rate': 2.438654973615941e-05, 'n_estimators': 742, 'criterion': 'squared_error', 'min_samples_split': 3, 'min_samples_leaf': 1, 'min_weight_fraction_leaf': 0.19987723222991655, 'min_impurity_decrease': 0.28709368095058135, 'max_features': 0.3907679105675407, 'subsample': 0.0018542573867108975, 'dropout_rate': 0.105715583308406, 'ccp_alpha': 0.2386256126734865}. Best is trial 143 with value: 0.8461396295970018.[0m
[32m[I 2022-04-21 16:04:46,877][0m Trial 147 finished with value: 0.8436331061507885 and parameters: {'loss': 'coxph', 'learning_rate': 0.009085274672758, 'n_estimators': 655, 'criterion': 'friedman_mse', 'min_samples_split': 3, 'min_samples_leaf': 1, 'min_weight_fraction_leaf': 0.22787016548476857, 'min_impurity_decrease': 0.36285105485293206, 'max_features': 0.3505027234412269, 'subsample': 0.07143904990022433, 'dropout_rate': 0.07608752653806962, 'ccp_alpha': 0.1732389883780579}. Best is trial 143 with value: 0.8461396295970018.[0m
[32m[I 2022-04-21 16:05:16,314][0m Trial 148 finished with value: 0.8452923072324425 and parameters: {'loss': 'coxph', 'learning_rate': 7.831704688571732e-05, 'n_estimators': 321, 'criterion': 'friedman_mse', 'min_samples_split': 3, 'min_samples_leaf': 2, 'min_weight_fraction_leaf': 0.17322931577671882, 'min_impurity_decrease': 0.2996440824792583, 'max_features': 0.28080750237446556, 'subsample': 0.10582235090409675, 'dropout_rate': 0.09885824459501086, 'ccp_alpha': 0.10313346848159377}. Best is trial 143 with value: 0.8461396295970018.[0m
[32m[I 2022-04-21 16:05:48,050][0m Trial 149 finished with value: 0.8471440992916224 and parameters: {'loss': 'coxph', 'learning_rate': 0.00018057474355613512, 'n_estimators': 310, 'criterion': 'friedman_mse', 'min_samples_split': 3, 'min_samples_leaf': 2, 'min_weight_fraction_leaf': 0.1730163260358296, 'min_impurity_decrease': 0.19219186044089542, 'max_features': 0.2580039321481443, 'subsample': 0.10264315730512268, 'dropout_rate': 0.1284657292190296, 'ccp_alpha': 0.00999560223732314}. Best is trial 149 with value: 0.8471440992916224.[0m
[32m[I 2022-04-21 16:06:13,392][0m Trial 150 finished with value: 0.8445582429016344 and parameters: {'loss': 'coxph', 'learning_rate': 0.00018363377923652835, 'n_estimators': 298, 'criterion': 'friedman_mse', 'min_samples_split': 3, 'min_samples_leaf': 2, 'min_weight_fraction_leaf': 0.15985921049121093, 'min_impurity_decrease': 0.1866624355566943, 'max_features': 0.24385945955975907, 'subsample': 0.11231584656953715, 'dropout_rate': 0.046352016606105904, 'ccp_alpha': 0.004709358148623936}. Best is trial 149 with value: 0.8471440992916224.[0m
[32m[I 2022-04-21 16:06:43,377][0m Trial 151 finished with value: 0.842488056 and parameters: {'loss': 'coxph', 'learning_rate': 0.00030478683357158023, 'n_estimators': 301, 'criterion': 'friedman_mse', 'min_samples_split': 3, 'min_samples_leaf': 2, 'min_weight_fraction_leaf': 0.16379318410141197, 'min_impurity_decrease': 0.19038722109301418, 'max_features': 0.26530574892395864, 'subsample': 0.1050978689299639, 'dropout_rate': 0.04056729775031728, 'ccp_alpha': 0.0699133461048364}. Best is trial 149 with value: 0.8471440992916224.[0m
[32m[I 2022-04-21 16:07:05,796][0m Trial 152 finished with value: 0.8438331086217655 and parameters: {'loss': 'coxph', 'learning_rate': 0.0002141254130825968, 'n_estimators': 267, 'criterion': 'friedman_mse', 'min_samples_split': 3, 'min_samples_leaf': 2, 'min_weight_fraction_leaf': 0.17611987543461613, 'min_impurity_decrease': 0.16077087386868125, 'max_features': 0.2397872746543826, 'subsample': 0.1292554323710703, 'dropout_rate': 0.13369461892613985, 'ccp_alpha': 0.1159087594095866}. Best is trial 149 with value: 0.8471440992916224.[0m
[32m[I 2022-04-21 16:07:38,793][0m Trial 153 finished with value: 0.8462796469345848 and parameters: {'loss': 'coxph', 'learning_rate': 0.00011088165380045273, 'n_estimators': 338, 'criterion': 'friedman_mse', 'min_samples_split': 3, 'min_samples_leaf': 2, 'min_weight_fraction_leaf': 0.1583862270809878, 'min_impurity_decrease': 0.24565592329735716, 'max_features': 0.28495972811962006, 'subsample': 0.09827944258407144, 'dropout_rate': 0.05551643461118383, 'ccp_alpha': 0.028758616198191006}. Best is trial 149 with value: 0.8471440992916224.[0m
[32m[I 2022-04-21 16:08:01,395][0m Trial 154 finished with value: 0.8436625131110892 and parameters: {'loss': 'coxph', 'learning_rate': 0.00011924213330569414, 'n_estimators': 332, 'criterion': 'friedman_mse', 'min_samples_split': 2, 'min_samples_leaf': 2, 'min_weight_fraction_leaf': 0.17400546146266063, 'min_impurity_decrease': 0.24028025453725205, 'max_features': 0.2858173465181351, 'subsample': 0.08676805102201063, 'dropout_rate': 0.5373459429953458, 'ccp_alpha': 0.0013871048295522326}. Best is trial 149 with value: 0.8471440992916224.[0m
[32m[I 2022-04-21 16:08:33,260][0m Trial 155 finished with value: 0.836750543466955 and parameters: {'loss': 'coxph', 'learning_rate': 0.00014824952167848802, 'n_estimators': 383, 'criterion': 'friedman_mse', 'min_samples_split': 3, 'min_samples_leaf': 2, 'min_weight_fraction_leaf': 0.1819984489993543, 'min_impurity_decrease': 0.2567744267186954, 'max_features': 0.207896917146919, 'subsample': 0.1403368629411347, 'dropout_rate': 0.11927355908033743, 'ccp_alpha': 0.29036524880636494}. Best is trial 149 with value: 0.8471440992916224.[0m
[32m[I 2022-04-21 16:09:03,643][0m Trial 156 finished with value: 0.8411060285139242 and parameters: {'loss': 'coxph', 'learning_rate': 0.00042167160245276664, 'n_estimators': 320, 'criterion': 'friedman_mse', 'min_samples_split': 2, 'min_samples_leaf': 2, 'min_weight_fraction_leaf': 0.2640359959226598, 'min_impurity_decrease': 0.33395192204324253, 'max_features': 0.2784992578282601, 'subsample': 0.09443118444674505, 'dropout_rate': 0.0588870699096162, 'ccp_alpha': 0.12729816757540832}. Best is trial 149 with value: 0.8471440992916224.[0m
[32m[I 2022-04-21 16:09:19,649][0m Trial 157 finished with value: 0.65 and parameters: {'loss': 'coxph', 'learning_rate': 7.636862497579122e-05, 'n_estimators': 232, 'criterion': 'friedman_mse', 'min_samples_split': 3, 'min_samples_leaf': 2, 'min_weight_fraction_leaf': 0.1534985442005023, 'min_impurity_decrease': 0.2803640736710371, 'max_features': 0.3260634754200728, 'subsample': 0.05826226545728595, 'dropout_rate': 0.13935550330418292, 'ccp_alpha': 2.752258760938305}. Best is trial 149 with value: 0.8471440992916224.[0m
[32m[I 2022-04-21 16:09:48,524][0m Trial 158 finished with value: 0.8427263758290395 and parameters: {'loss': 'coxph', 'learning_rate': 0.004890626472710941, 'n_estimators': 281, 'criterion': 'squared_error', 'min_samples_split': 5, 'min_samples_leaf': 2, 'min_weight_fraction_leaf': 0.17062682372314103, 'min_impurity_decrease': 0.2112256645999433, 'max_features': 0.4875340496849822, 'subsample': 0.08198802235382383, 'dropout_rate': 0.15401571824648014, 'ccp_alpha': 0.24575896927922536}. Best is trial 149 with value: 0.8471440992916224.[0m
[32m[I 2022-04-21 16:10:02,033][0m Trial 159 finished with value: 0.8449070129613185 and parameters: {'loss': 'coxph', 'learning_rate': 0.00010782712900972159, 'n_estimators': 245, 'criterion': 'friedman_mse', 'min_samples_split': 2, 'min_samples_leaf': 2, 'min_weight_fraction_leaf': 0.1889090474038604, 'min_impurity_decrease': 0.2344638995347197, 'max_features': 0.25374733079200745, 'subsample': 0.10516596152562, 'dropout_rate': 0.16817347063900653, 'ccp_alpha': 0.12049290725077239}. Best is trial 149 with value: 0.8471440992916224.[0m
[32m[I 2022-04-21 16:10:10,603][0m Trial 160 finished with value: 0.8419509952869506 and parameters: {'loss': 'coxph', 'learning_rate': 0.00016836798362263958, 'n_estimators': 180, 'criterion': 'friedman_mse', 'min_samples_split': 2, 'min_samples_leaf': 2, 'min_weight_fraction_leaf': 0.1882527546541674, 'min_impurity_decrease': 0.1362555380198769, 'max_features': 0.2531814079464037, 'subsample': 0.04668450520132418, 'dropout_rate': 0.06520321260381773, 'ccp_alpha': 0.39016523466164754}. Best is trial 149 with value: 0.8471440992916224.[0m
[32m[I 2022-04-21 16:10:33,511][0m Trial 161 finished with value: 0.8453086999927141 and parameters: {'loss': 'coxph', 'learning_rate': 9.553753758950197e-05, 'n_estimators': 248, 'criterion': 'friedman_mse', 'min_samples_split': 2, 'min_samples_leaf': 2, 'min_weight_fraction_leaf': 0.1663301076535109, 'min_impurity_decrease': 0.23641087090688842, 'max_features': 0.19011137126880295, 'subsample': 0.1115724046081113, 'dropout_rate': 0.17197592959732616, 'ccp_alpha': 0.10687083658018766}. Best is trial 149 with value: 0.8471440992916224.[0m
[32m[I 2022-04-21 16:11:09,061][0m Trial 162 finished with value: 0.8441819075297458 and parameters: {'loss': 'coxph', 'learning_rate': 0.00011044936645703683, 'n_estimators': 352, 'criterion': 'friedman_mse', 'min_samples_split': 2, 'min_samples_leaf': 2, 'min_weight_fraction_leaf': 0.1607451403809002, 'min_impurity_decrease': 0.2467204377622948, 'max_features': 0.2073194622922081, 'subsample': 0.11030754473468407, 'dropout_rate': 0.16438937600647607, 'ccp_alpha': 0.17516727301663346}. Best is trial 149 with value: 0.8471440992916224.[0m
[32m[I 2022-04-21 16:11:22,461][0m Trial 163 finished with value: 0.8423899344571975 and parameters: {'loss': 'coxph', 'learning_rate': 9.098101847038522e-05, 'n_estimators': 245, 'criterion': 'friedman_mse', 'min_samples_split': 2, 'min_samples_leaf': 2, 'min_weight_fraction_leaf': 0.18703381389240747, 'min_impurity_decrease': 0.23326070667861384, 'max_features': 0.2930305065079879, 'subsample': 0.07973979571080136, 'dropout_rate': 0.02163291919090475, 'ccp_alpha': 0.09291199415671939}. Best is trial 149 with value: 0.8471440992916224.[0m
[32m[I 2022-04-21 16:11:46,229][0m Trial 164 finished with value: 0.8405226966572856 and parameters: {'loss': 'coxph', 'learning_rate': 8.305885360081426e-05, 'n_estimators': 248, 'criterion': 'friedman_mse', 'min_samples_split': 2, 'min_samples_leaf': 2, 'min_weight_fraction_leaf': 0.17050621697815876, 'min_impurity_decrease': 0.9586064444051325, 'max_features': 0.16423120950916584, 'subsample': 0.1042794322708524, 'dropout_rate': 0.11934643886470858, 'ccp_alpha': 0.2925717207036432}. Best is trial 149 with value: 0.8471440992916224.[0m
[32m[I 2022-04-21 16:12:10,249][0m Trial 165 finished with value: 0.8393438720896821 and parameters: {'loss': 'coxph', 'learning_rate': 0.00013702239866036767, 'n_estimators': 285, 'criterion': 'friedman_mse', 'min_samples_split': 2, 'min_samples_leaf': 2, 'min_weight_fraction_leaf': 0.17726284729918523, 'min_impurity_decrease': 0.29176921119707244, 'max_features': 0.3121321988983899, 'subsample': 0.15029757617024767, 'dropout_rate': 0.10222383325740428, 'ccp_alpha': 0.20685879641873195}. Best is trial 149 with value: 0.8471440992916224.[0m
/media/san2_ssd/data/Workdir/survival/venv/lib/python3.8/site-packages/sksurv/ensemble/boosting.py:955: RuntimeWarning: divide by zero encountered in log
  time = numpy.log(time)
/media/san2_ssd/data/Workdir/survival/venv/lib/python3.8/site-packages/sksurv/ensemble/boosting.py:955: RuntimeWarning: divide by zero encountered in log
  time = numpy.log(time)
/media/san2_ssd/data/Workdir/survival/venv/lib/python3.8/site-packages/sksurv/ensemble/boosting.py:955: RuntimeWarning: divide by zero encountered in log
  time = numpy.log(time)
/media/san2_ssd/data/Workdir/survival/venv/lib/python3.8/site-packages/sksurv/ensemble/boosting.py:955: RuntimeWarning: divide by zero encountered in log
  time = numpy.log(time)
[32m[I 2022-04-21 16:12:17,571][0m Trial 166 finished with value: -0.4659047780013551 and parameters: {'loss': 'squared', 'learning_rate': 0.0002841688563504687, 'n_estimators': 337, 'criterion': 'friedman_mse', 'min_samples_split': 5, 'min_samples_leaf': 1, 'min_weight_fraction_leaf': 0.13764518420081645, 'min_impurity_decrease': 0.32532038170530037, 'max_features': 0.2671975696177172, 'subsample': 0.11808171494961128, 'dropout_rate': 0.18045527257614705, 'ccp_alpha': 0.00446900625920402}. Best is trial 149 with value: 0.8471440992916224.[0m
[32m[I 2022-04-21 16:12:34,467][0m Trial 167 finished with value: 0.7396292118280623 and parameters: {'loss': 'coxph', 'learning_rate': 0.00024599913257854005, 'n_estimators': 220, 'criterion': 'friedman_mse', 'min_samples_split': 2, 'min_samples_leaf': 2, 'min_weight_fraction_leaf': 0.19629836574995554, 'min_impurity_decrease': 0.17586942029459723, 'max_features': 0.21968888543941928, 'subsample': 0.5808578167827773, 'dropout_rate': 0.14722582912724702, 'ccp_alpha': 0.10185715129904141}. Best is trial 149 with value: 0.8471440992916224.[0m
[32m[I 2022-04-21 16:13:03,145][0m Trial 168 finished with value: 0.65 and parameters: {'loss': 'coxph', 'learning_rate': 0.0029399681096587593, 'n_estimators': 491, 'criterion': 'friedman_mse', 'min_samples_split': 3, 'min_samples_leaf': 6, 'min_weight_fraction_leaf': 0.1474729128836572, 'min_impurity_decrease': 0.27363846824297733, 'max_features': 0.25559316876356797, 'subsample': 0.049224977681936136, 'dropout_rate': 0.8365398058867636, 'ccp_alpha': 0.3271977676388589}. Best is trial 149 with value: 0.8471440992916224.[0m
[32m[I 2022-04-21 16:13:16,442][0m Trial 169 finished with value: 0.65 and parameters: {'loss': 'coxph', 'learning_rate': 0.000530787992148027, 'n_estimators': 215, 'criterion': 'friedman_mse', 'min_samples_split': 2, 'min_samples_leaf': 1, 'min_weight_fraction_leaf': 0.20316563143110314, 'min_impurity_decrease': 0.22355006516026832, 'max_features': 0.34325404107450525, 'subsample': 0.95446741220595, 'dropout_rate': 0.05675016024015355, 'ccp_alpha': 2.0337252972509297}. Best is trial 149 with value: 0.8471440992916224.[0m
[32m[I 2022-04-21 16:13:35,334][0m Trial 170 finished with value: 0.8468033137695979 and parameters: {'loss': 'coxph', 'learning_rate': 0.0001482707103181413, 'n_estimators': 251, 'criterion': 'friedman_mse', 'min_samples_split': 5, 'min_samples_leaf': 2, 'min_weight_fraction_leaf': 0.15462428845082782, 'min_impurity_decrease': 0.355127664107414, 'max_features': 0.2896884269059281, 'subsample': 0.07933603135635646, 'dropout_rate': 0.173213727327521, 'ccp_alpha': 0.005377178315321973}. Best is trial 149 with value: 0.8471440992916224.[0m
[32m[I 2022-04-21 16:13:47,461][0m Trial 171 finished with value: 0.8438933818704392 and parameters: {'loss': 'coxph', 'learning_rate': 0.00014379928914047945, 'n_estimators': 258, 'criterion': 'friedman_mse', 'min_samples_split': 5, 'min_samples_leaf': 2, 'min_weight_fraction_leaf': 0.15882272466135605, 'min_impurity_decrease': 0.3787460316228083, 'max_features': 0.19284425441963332, 'subsample': 0.09074174478313984, 'dropout_rate': 0.17498153880530048, 'ccp_alpha': 0.10737768974444703}. Best is trial 149 with value: 0.8471440992916224.[0m
[32m[I 2022-04-21 16:14:05,447][0m Trial 172 finished with value: 0.7416486558997214 and parameters: {'loss': 'coxph', 'learning_rate': 9.286352346422854e-05, 'n_estimators': 240, 'criterion': 'friedman_mse', 'min_samples_split': 5, 'min_samples_leaf': 5, 'min_weight_fraction_leaf': 0.18393203985992115, 'min_impurity_decrease': 0.35496192710776764, 'max_features': 0.29462742472461534, 'subsample': 0.08176451820638397, 'dropout_rate': 0.20549770477236443, 'ccp_alpha': 0.001157769035254972}. Best is trial 149 with value: 0.8471440992916224.[0m
[32m[I 2022-04-21 16:14:25,542][0m Trial 173 finished with value: 0.8467298279657622 and parameters: {'loss': 'coxph', 'learning_rate': 6.714088759672007e-05, 'n_estimators': 277, 'criterion': 'friedman_mse', 'min_samples_split': 5, 'min_samples_leaf': 2, 'min_weight_fraction_leaf': 0.16764198152726917, 'min_impurity_decrease': 0.4351066597294032, 'max_features': 0.28740973118828383, 'subsample': 0.06565519758344196, 'dropout_rate': 0.14481861697216974, 'ccp_alpha': 0.1812390212653347}. Best is trial 149 with value: 0.8471440992916224.[0m
[32m[I 2022-04-21 16:14:44,922][0m Trial 174 finished with value: 0.8439147805211327 and parameters: {'loss': 'coxph', 'learning_rate': 0.00012077524845458503, 'n_estimators': 276, 'criterion': 'friedman_mse', 'min_samples_split': 5, 'min_samples_leaf': 2, 'min_weight_fraction_leaf': 0.16746932992993868, 'min_impurity_decrease': 0.4305741109655781, 'max_features': 0.28893846821823455, 'subsample': 0.0627970717144453, 'dropout_rate': 0.12290465735856998, 'ccp_alpha': 0.19615009925956997}. Best is trial 149 with value: 0.8471440992916224.[0m
[32m[I 2022-04-21 16:15:03,408][0m Trial 175 finished with value: 0.8435848648689743 and parameters: {'loss': 'coxph', 'learning_rate': 0.023838639274476787, 'n_estimators': 251, 'criterion': 'friedman_mse', 'min_samples_split': 5, 'min_samples_leaf': 2, 'min_weight_fraction_leaf': 0.15318653783751482, 'min_impurity_decrease': 0.4109149915112806, 'max_features': 0.31699194653195456, 'subsample': 0.12721361034616274, 'dropout_rate': 0.1429159323557421, 'ccp_alpha': 0.11088819272500815}. Best is trial 149 with value: 0.8471440992916224.[0m
[32m[I 2022-04-21 16:15:38,399][0m Trial 176 finished with value: 0.65 and parameters: {'loss': 'coxph', 'learning_rate': 6.395697982036079e-05, 'n_estimators': 319, 'criterion': 'friedman_mse', 'min_samples_split': 5, 'min_samples_leaf': 1, 'min_weight_fraction_leaf': 0.1731834701941231, 'min_impurity_decrease': 0.38336847259023293, 'max_features': 0.27206143138283184, 'subsample': 0.10105714536750211, 'dropout_rate': 0.16463799538181695, 'ccp_alpha': 1.4915462404663498}. Best is trial 149 with value: 0.8471440992916224.[0m
[32m[I 2022-04-21 16:15:44,361][0m Trial 177 finished with value: 0.8340182243898205 and parameters: {'loss': 'coxph', 'learning_rate': 0.00016921544965443382, 'n_estimators': 126, 'criterion': 'squared_error', 'min_samples_split': 5, 'min_samples_leaf': 2, 'min_weight_fraction_leaf': 0.18636528569376945, 'min_impurity_decrease': 0.46624699627403476, 'max_features': 0.2542069555657708, 'subsample': 0.0458932086936798, 'dropout_rate': 0.09357860212807181, 'ccp_alpha': 0.001977943482963117}. Best is trial 149 with value: 0.8471440992916224.[0m
[32m[I 2022-04-21 16:16:23,066][0m Trial 178 finished with value: 0.65 and parameters: {'loss': 'coxph', 'learning_rate': 0.00021484490740904865, 'n_estimators': 360, 'criterion': 'friedman_mse', 'min_samples_split': 10, 'min_samples_leaf': 9, 'min_weight_fraction_leaf': 0.21671622547774885, 'min_impurity_decrease': 0.3480126173656132, 'max_features': 0.13703988173048343, 'subsample': 0.02382457409664618, 'dropout_rate': 0.07902719453588339, 'ccp_alpha': 0.2622740194871056}. Best is trial 149 with value: 0.8471440992916224.[0m
