[32m[I 2022-04-21 14:57:05,360][0m Trial 406 finished with value: 0.82805269776581 and parameters: {'loss': 'coxph', 'learning_rate': 0.005984982907210837, 'n_estimators': 355, 'criterion': 'friedman_mse', 'min_samples_split': 2, 'min_samples_leaf': 3, 'min_weight_fraction_leaf': 0.08249775664913467, 'min_impurity_decrease': 0.4423646649967904, 'max_features': 0.6023384541539041, 'subsample': 0.25798573328194035, 'dropout_rate': 0.9459071399576651, 'ccp_alpha': 0.09361745540747127}. Best is trial 400 with value: 0.8304067572806094.[0m
[32m[I 2022-04-21 14:57:18,708][0m Trial 407 finished with value: 0.8145110464511631 and parameters: {'loss': 'coxph', 'learning_rate': 0.006199044392150914, 'n_estimators': 356, 'criterion': 'friedman_mse', 'min_samples_split': 2, 'min_samples_leaf': 3, 'min_weight_fraction_leaf': 0.09173765864747174, 'min_impurity_decrease': 0.4589041547879682, 'max_features': 0.5636023621954186, 'subsample': 0.2564034927024308, 'dropout_rate': 0.9552050538226219, 'ccp_alpha': 0.17951691481309937}. Best is trial 400 with value: 0.8304067572806094.[0m
[32m[I 2022-04-21 14:57:26,928][0m Trial 408 finished with value: 0.25 and parameters: {'loss': 'coxph', 'learning_rate': 0.01379473588744979, 'n_estimators': 268, 'criterion': 'squared_error', 'min_samples_split': 2, 'min_samples_leaf': 3, 'min_weight_fraction_leaf': 0.07900960555381092, 'min_impurity_decrease': 0.47708405024624073, 'max_features': 0.601558556557833, 'subsample': 0.26398656655740554, 'dropout_rate': 0.9460529541773968, 'ccp_alpha': 0.4024772836688125}. Best is trial 400 with value: 0.8304067572806094.[0m
[32m[I 2022-04-21 14:57:47,378][0m Trial 409 finished with value: 0.8246128516290359 and parameters: {'loss': 'coxph', 'learning_rate': 0.007719839903782736, 'n_estimators': 605, 'criterion': 'friedman_mse', 'min_samples_split': 5, 'min_samples_leaf': 3, 'min_weight_fraction_leaf': 0.09650274157047757, 'min_impurity_decrease': 0.4406830411554893, 'max_features': 0.6009275922952535, 'subsample': 0.24256327115345128, 'dropout_rate': 0.9801577588083474, 'ccp_alpha': 0.09744845474056944}. Best is trial 400 with value: 0.8304067572806094.[0m
[32m[I 2022-04-21 14:57:56,906][0m Trial 410 finished with value: 0.36974781354961894 and parameters: {'loss': 'coxph', 'learning_rate': 0.006863133043887147, 'n_estimators': 312, 'criterion': 'friedman_mse', 'min_samples_split': 2, 'min_samples_leaf': 3, 'min_weight_fraction_leaf': 0.08382378849215785, 'min_impurity_decrease': 0.43679491746227933, 'max_features': 0.6272148281184102, 'subsample': 0.2778663229858498, 'dropout_rate': 0.9270058556765989, 'ccp_alpha': 0.2511541670145544}. Best is trial 400 with value: 0.8304067572806094.[0m
/media/san2_ssd/data/Workdir/survival/venv/lib/python3.8/site-packages/sksurv/ensemble/boosting.py:955: RuntimeWarning: divide by zero encountered in log
  time = numpy.log(time)
/media/san2_ssd/data/Workdir/survival/venv/lib/python3.8/site-packages/sksurv/ensemble/boosting.py:955: RuntimeWarning: divide by zero encountered in log
  time = numpy.log(time)
/media/san2_ssd/data/Workdir/survival/venv/lib/python3.8/site-packages/sksurv/ensemble/boosting.py:955: RuntimeWarning: divide by zero encountered in log
  time = numpy.log(time)
/media/san2_ssd/data/Workdir/survival/venv/lib/python3.8/site-packages/sksurv/ensemble/boosting.py:955: RuntimeWarning: divide by zero encountered in log
  time = numpy.log(time)
[32m[I 2022-04-21 14:58:00,925][0m Trial 411 finished with value: -0.46656718109604106 and parameters: {'loss': 'squared', 'learning_rate': 0.009530900504948894, 'n_estimators': 436, 'criterion': 'friedman_mse', 'min_samples_split': 2, 'min_samples_leaf': 4, 'min_weight_fraction_leaf': 0.10803211966007531, 'min_impurity_decrease': 0.4633687204732429, 'max_features': 0.569933900907015, 'subsample': 0.2605431831557767, 'dropout_rate': 0.9338275285265324, 'ccp_alpha': 0.1241847922073745}. Best is trial 400 with value: 0.8304067572806094.[0m
[32m[I 2022-04-21 14:58:15,968][0m Trial 412 finished with value: 0.2590338488919847 and parameters: {'loss': 'coxph', 'learning_rate': 0.006145601786702847, 'n_estimators': 365, 'criterion': 'friedman_mse', 'min_samples_split': 2, 'min_samples_leaf': 3, 'min_weight_fraction_leaf': 0.09074759441980897, 'min_impurity_decrease': 0.4843956478497063, 'max_features': 0.6211468446001922, 'subsample': 0.2914544041813245, 'dropout_rate': 0.9592011578415072, 'ccp_alpha': 0.30415922800424344}. Best is trial 400 with value: 0.8304067572806094.[0m
[32m[I 2022-04-21 14:58:32,651][0m Trial 413 finished with value: 0.825448836352528 and parameters: {'loss': 'coxph', 'learning_rate': 0.004850096274335886, 'n_estimators': 333, 'criterion': 'friedman_mse', 'min_samples_split': 2, 'min_samples_leaf': 3, 'min_weight_fraction_leaf': 0.07557404601487808, 'min_impurity_decrease': 0.44909081281649954, 'max_features': 0.5893869085337599, 'subsample': 0.30789535295815584, 'dropout_rate': 0.9057654017368255, 'ccp_alpha': 0.09731829111187008}. Best is trial 400 with value: 0.8304067572806094.[0m
[32m[I 2022-04-21 14:59:13,842][0m Trial 414 finished with value: 0.8269154503830066 and parameters: {'loss': 'coxph', 'learning_rate': 0.007724961915242711, 'n_estimators': 634, 'criterion': 'friedman_mse', 'min_samples_split': 2, 'min_samples_leaf': 3, 'min_weight_fraction_leaf': 0.10145069984513093, 'min_impurity_decrease': 0.4384763483981805, 'max_features': 0.6607072138350978, 'subsample': 0.23290132239919192, 'dropout_rate': 0.9188679994377367, 'ccp_alpha': 0.08977730902017746}. Best is trial 400 with value: 0.8304067572806094.[0m
[32m[I 2022-04-21 14:59:53,146][0m Trial 415 finished with value: 0.8297488373202995 and parameters: {'loss': 'coxph', 'learning_rate': 0.005302864529124368, 'n_estimators': 660, 'criterion': 'friedman_mse', 'min_samples_split': 2, 'min_samples_leaf': 4, 'min_weight_fraction_leaf': 0.08483732274403848, 'min_impurity_decrease': 0.47378068381488514, 'max_features': 0.6124535261101481, 'subsample': 0.28286632590393557, 'dropout_rate': 0.9449588041494111, 'ccp_alpha': 0.001994982102332118}. Best is trial 400 with value: 0.8304067572806094.[0m
[32m[I 2022-04-21 15:00:05,418][0m Trial 416 finished with value: 0.7093686672394846 and parameters: {'loss': 'coxph', 'learning_rate': 0.011134930381916189, 'n_estimators': 345, 'criterion': 'friedman_mse', 'min_samples_split': 2, 'min_samples_leaf': 4, 'min_weight_fraction_leaf': 0.009035805260625605, 'min_impurity_decrease': 0.48580230880434305, 'max_features': 0.6132837727372882, 'subsample': 0.2613211590582538, 'dropout_rate': 0.9737314447921465, 'ccp_alpha': 0.1926311298091654}. Best is trial 400 with value: 0.8304067572806094.[0m
[32m[I 2022-04-21 15:00:31,362][0m Trial 417 finished with value: 0.8302646105739369 and parameters: {'loss': 'coxph', 'learning_rate': 0.005925371580741805, 'n_estimators': 731, 'criterion': 'friedman_mse', 'min_samples_split': 2, 'min_samples_leaf': 5, 'min_weight_fraction_leaf': 0.09012535990999168, 'min_impurity_decrease': 0.47448821674818337, 'max_features': 0.5466607997301212, 'subsample': 0.28149745791301267, 'dropout_rate': 0.9915845785655164, 'ccp_alpha': 0.0027016099279512295}. Best is trial 400 with value: 0.8304067572806094.[0m
[32m[I 2022-04-21 15:00:51,614][0m Trial 418 finished with value: 0.8102333634119046 and parameters: {'loss': 'coxph', 'learning_rate': 0.009098227703325776, 'n_estimators': 658, 'criterion': 'friedman_mse', 'min_samples_split': 2, 'min_samples_leaf': 5, 'min_weight_fraction_leaf': 0.08678495992474443, 'min_impurity_decrease': 0.4670921039904888, 'max_features': 0.5460355876572335, 'subsample': 0.27824232680344674, 'dropout_rate': 0.9942717840786586, 'ccp_alpha': 0.18315254008697882}. Best is trial 400 with value: 0.8304067572806094.[0m
[32m[I 2022-04-21 15:01:21,025][0m Trial 419 finished with value: 0.8271777929741775 and parameters: {'loss': 'coxph', 'learning_rate': 0.005712537217966901, 'n_estimators': 727, 'criterion': 'friedman_mse', 'min_samples_split': 2, 'min_samples_leaf': 5, 'min_weight_fraction_leaf': 0.05383357132980687, 'min_impurity_decrease': 0.49259908098232347, 'max_features': 0.5343705077329821, 'subsample': 0.2533416264985274, 'dropout_rate': 0.9899979974417747, 'ccp_alpha': 0.09409062345210739}. Best is trial 400 with value: 0.8304067572806094.[0m
[32m[I 2022-04-21 15:01:59,619][0m Trial 420 finished with value: 0.8293659932295082 and parameters: {'loss': 'coxph', 'learning_rate': 0.0064951236916503926, 'n_estimators': 674, 'criterion': 'friedman_mse', 'min_samples_split': 2, 'min_samples_leaf': 4, 'min_weight_fraction_leaf': 0.07082919181221861, 'min_impurity_decrease': 0.47245651017880025, 'max_features': 0.5057473522167643, 'subsample': 0.23177855708936562, 'dropout_rate': 0.9494918810583349, 'ccp_alpha': 0.0011548861222446304}. Best is trial 400 with value: 0.8304067572806094.[0m
[32m[I 2022-04-21 15:02:26,370][0m Trial 421 finished with value: 0.480850004731282 and parameters: {'loss': 'coxph', 'learning_rate': 0.007791584746742242, 'n_estimators': 691, 'criterion': 'friedman_mse', 'min_samples_split': 2, 'min_samples_leaf': 4, 'min_weight_fraction_leaf': 0.07394247955502968, 'min_impurity_decrease': 0.5082994997046422, 'max_features': 0.5139925145521825, 'subsample': 0.23620102066936866, 'dropout_rate': 0.9689116896378948, 'ccp_alpha': 0.26633251046658096}. Best is trial 400 with value: 0.8304067572806094.[0m
[32m[I 2022-04-21 15:03:15,356][0m Trial 422 finished with value: 0.8272837906014292 and parameters: {'loss': 'coxph', 'learning_rate': 0.024746463739951416, 'n_estimators': 755, 'criterion': 'friedman_mse', 'min_samples_split': 2, 'min_samples_leaf': 5, 'min_weight_fraction_leaf': 0.08453539825634684, 'min_impurity_decrease': 0.4745001343071291, 'max_features': 0.5620745464460246, 'subsample': 0.22738274460483432, 'dropout_rate': 0.9515445670575999, 'ccp_alpha': 0.001213109132756639}. Best is trial 400 with value: 0.8304067572806094.[0m
[32m[I 2022-04-21 15:03:47,196][0m Trial 423 finished with value: 0.8203347956404438 and parameters: {'loss': 'coxph', 'learning_rate': 0.006730908772635052, 'n_estimators': 656, 'criterion': 'friedman_mse', 'min_samples_split': 2, 'min_samples_leaf': 4, 'min_weight_fraction_leaf': 0.0916206356061876, 'min_impurity_decrease': 0.4652193930423833, 'max_features': 0.46416681789003095, 'subsample': 0.24960227690881423, 'dropout_rate': 0.9676101514838424, 'ccp_alpha': 0.165627680045908}. Best is trial 400 with value: 0.8304067572806094.[0m
[32m[I 2022-04-21 15:04:19,929][0m Trial 424 finished with value: 0.25 and parameters: {'loss': 'coxph', 'learning_rate': 0.012119989065451944, 'n_estimators': 622, 'criterion': 'friedman_mse', 'min_samples_split': 2, 'min_samples_leaf': 4, 'min_weight_fraction_leaf': 0.07612211880856759, 'min_impurity_decrease': 0.5181065990260642, 'max_features': 0.49745038022588345, 'subsample': 0.2620686114866437, 'dropout_rate': 0.9542238971635322, 'ccp_alpha': 0.38629498824770125}. Best is trial 400 with value: 0.8304067572806094.[0m
[32m[I 2022-04-21 15:05:08,748][0m Trial 425 finished with value: 0.8259578088590864 and parameters: {'loss': 'coxph', 'learning_rate': 0.005910738003275511, 'n_estimators': 799, 'criterion': 'friedman_mse', 'min_samples_split': 2, 'min_samples_leaf': 5, 'min_weight_fraction_leaf': 0.1094085593013346, 'min_impurity_decrease': 0.491147127949808, 'max_features': 0.519010309576583, 'subsample': 0.2754334122425334, 'dropout_rate': 0.9777479656860706, 'ccp_alpha': 0.09485329414815538}. Best is trial 400 with value: 0.8304067572806094.[0m
[32m[I 2022-04-21 15:05:34,470][0m Trial 426 finished with value: 0.8266945388941622 and parameters: {'loss': 'coxph', 'learning_rate': 0.008928651717829972, 'n_estimators': 696, 'criterion': 'friedman_mse', 'min_samples_split': 2, 'min_samples_leaf': 4, 'min_weight_fraction_leaf': 0.07057670309757601, 'min_impurity_decrease': 0.453553978938385, 'max_features': 0.4770863002001958, 'subsample': 0.23207809844218996, 'dropout_rate': 0.9982085156431244, 'ccp_alpha': 0.09283996657071274}. Best is trial 400 with value: 0.8304067572806094.[0m
[32m[I 2022-04-21 15:06:04,219][0m Trial 427 finished with value: 0.8302105023941877 and parameters: {'loss': 'coxph', 'learning_rate': 0.005457446659483515, 'n_estimators': 730, 'criterion': 'friedman_mse', 'min_samples_split': 2, 'min_samples_leaf': 4, 'min_weight_fraction_leaf': 0.08236952298175129, 'min_impurity_decrease': 0.4807693658326274, 'max_features': 0.5425538988987944, 'subsample': 0.2934298584169814, 'dropout_rate': 0.9476037104074635, 'ccp_alpha': 0.0015795130044264638}. Best is trial 400 with value: 0.8304067572806094.[0m
[32m[I 2022-04-21 15:06:45,902][0m Trial 428 finished with value: 0.25 and parameters: {'loss': 'coxph', 'learning_rate': 0.005374882960819869, 'n_estimators': 690, 'criterion': 'absolute_error', 'min_samples_split': 2, 'min_samples_leaf': 4, 'min_weight_fraction_leaf': 0.09443775097807777, 'min_impurity_decrease': 0.49553101855932147, 'max_features': 0.5548947998312419, 'subsample': 0.29367072224255486, 'dropout_rate': 0.9480848325066252, 'ccp_alpha': 0.25326288795435925}. Best is trial 400 with value: 0.8304067572806094.[0m
[32m[I 2022-04-21 15:07:28,848][0m Trial 429 finished with value: 0.8260633371573238 and parameters: {'loss': 'coxph', 'learning_rate': 0.007866591901437816, 'n_estimators': 725, 'criterion': 'friedman_mse', 'min_samples_split': 2, 'min_samples_leaf': 4, 'min_weight_fraction_leaf': 0.08287274757279608, 'min_impurity_decrease': 0.48024484380517585, 'max_features': 0.5319054405995899, 'subsample': 0.22456994089380616, 'dropout_rate': 0.9608197535328069, 'ccp_alpha': 0.09436603158089532}. Best is trial 400 with value: 0.8304067572806094.[0m
[32m[I 2022-04-21 15:08:17,722][0m Trial 430 finished with value: 0.8222667840441634 and parameters: {'loss': 'coxph', 'learning_rate': 0.006482767491011184, 'n_estimators': 759, 'criterion': 'friedman_mse', 'min_samples_split': 2, 'min_samples_leaf': 4, 'min_weight_fraction_leaf': 0.10441600842195631, 'min_impurity_decrease': 0.5018866072792127, 'max_features': 0.5469014485890261, 'subsample': 0.25146726762113325, 'dropout_rate': 0.9379705587309665, 'ccp_alpha': 0.1794836136961303}. Best is trial 400 with value: 0.8304067572806094.[0m
[32m[I 2022-04-21 15:08:57,972][0m Trial 431 finished with value: 0.25 and parameters: {'loss': 'coxph', 'learning_rate': 0.004962276446468579, 'n_estimators': 672, 'criterion': 'squared_error', 'min_samples_split': 2, 'min_samples_leaf': 5, 'min_weight_fraction_leaf': 0.0866411757191268, 'min_impurity_decrease': 0.5192665837618228, 'max_features': 0.568935664784977, 'subsample': 0.29333197266035305, 'dropout_rate': 0.9445758556909447, 'ccp_alpha': 0.08719069041436127}. Best is trial 400 with value: 0.8304067572806094.[0m
/media/san2_ssd/data/Workdir/survival/venv/lib/python3.8/site-packages/sksurv/ensemble/boosting.py:955: RuntimeWarning: divide by zero encountered in log
  time = numpy.log(time)
/media/san2_ssd/data/Workdir/survival/venv/lib/python3.8/site-packages/sksurv/ensemble/boosting.py:955: RuntimeWarning: divide by zero encountered in log
  time = numpy.log(time)
/media/san2_ssd/data/Workdir/survival/venv/lib/python3.8/site-packages/sksurv/ensemble/boosting.py:955: RuntimeWarning: divide by zero encountered in log
  time = numpy.log(time)
/media/san2_ssd/data/Workdir/survival/venv/lib/python3.8/site-packages/sksurv/ensemble/boosting.py:955: RuntimeWarning: divide by zero encountered in log
  time = numpy.log(time)
[32m[I 2022-04-21 15:09:00,770][0m Trial 432 finished with value: -0.45 and parameters: {'loss': 'squared', 'learning_rate': 0.00660440170812173, 'n_estimators': 741, 'criterion': 'friedman_mse', 'min_samples_split': 2, 'min_samples_leaf': 4, 'min_weight_fraction_leaf': 0.09515416270873595, 'min_impurity_decrease': 0.46771066805477546, 'max_features': 0.5019699045205112, 'subsample': 0.27700962961643105, 'dropout_rate': 0.9849632139370584, 'ccp_alpha': 3.171385573405776}. Best is trial 400 with value: 0.8304067572806094.[0m
[32m[I 2022-04-21 15:09:30,455][0m Trial 433 finished with value: 0.5038676157290805 and parameters: {'loss': 'coxph', 'learning_rate': 0.004569656060033942, 'n_estimators': 705, 'criterion': 'friedman_mse', 'min_samples_split': 2, 'min_samples_leaf': 4, 'min_weight_fraction_leaf': 0.07947104334826968, 'min_impurity_decrease': 0.4767779881802023, 'max_features': 0.5730600767010371, 'subsample': 0.31145264329170885, 'dropout_rate': 0.9660788973029402, 'ccp_alpha': 0.18813633885194975}. Best is trial 400 with value: 0.8304067572806094.[0m
[32m[I 2022-04-21 15:10:08,009][0m Trial 434 finished with value: 0.8310153865446737 and parameters: {'loss': 'coxph', 'learning_rate': 0.009544069029831426, 'n_estimators': 644, 'criterion': 'friedman_mse', 'min_samples_split': 2, 'min_samples_leaf': 4, 'min_weight_fraction_leaf': 0.0642102485807314, 'min_impurity_decrease': 0.45918454472087744, 'max_features': 0.5859520223715096, 'subsample': 0.2680349857489697, 'dropout_rate': 0.9376135470028665, 'ccp_alpha': 0.007945051058658514}. Best is trial 434 with value: 0.8310153865446737.[0m
[32m[I 2022-04-21 15:10:43,603][0m Trial 435 finished with value: 0.8258406763540087 and parameters: {'loss': 'coxph', 'learning_rate': 0.011115368173378489, 'n_estimators': 596, 'criterion': 'friedman_mse', 'min_samples_split': 2, 'min_samples_leaf': 4, 'min_weight_fraction_leaf': 0.061628335497843315, 'min_impurity_decrease': 0.4552372940272055, 'max_features': 0.5451887247370435, 'subsample': 0.29246300977376416, 'dropout_rate': 0.941216915642802, 'ccp_alpha': 0.0862386497910546}. Best is trial 434 with value: 0.8310153865446737.[0m
[32m[I 2022-04-21 15:11:29,862][0m Trial 436 finished with value: 0.3773287266958224 and parameters: {'loss': 'coxph', 'learning_rate': 0.012773172579678875, 'n_estimators': 797, 'criterion': 'friedman_mse', 'min_samples_split': 2, 'min_samples_leaf': 4, 'min_weight_fraction_leaf': 0.06849870323852614, 'min_impurity_decrease': 0.4497743613394506, 'max_features': 0.5829168634976499, 'subsample': 0.2708479218000732, 'dropout_rate': 0.9289902425023625, 'ccp_alpha': 0.2832606304939296}. Best is trial 434 with value: 0.8310153865446737.[0m
[32m[I 2022-04-21 15:12:00,626][0m Trial 437 finished with value: 0.8291558532865144 and parameters: {'loss': 'coxph', 'learning_rate': 0.017257008174157838, 'n_estimators': 664, 'criterion': 'friedman_mse', 'min_samples_split': 2, 'min_samples_leaf': 4, 'min_weight_fraction_leaf': 0.06359316922294977, 'min_impurity_decrease': 0.4645982952309306, 'max_features': 0.5836839527655286, 'subsample': 0.4199948624565224, 'dropout_rate': 0.9643955359425094, 'ccp_alpha': 0.008814835718035851}. Best is trial 434 with value: 0.8310153865446737.[0m
[32m[I 2022-04-21 15:12:33,778][0m Trial 438 finished with value: 0.8240785839548778 and parameters: {'loss': 'coxph', 'learning_rate': 0.013193007108374474, 'n_estimators': 638, 'criterion': 'friedman_mse', 'min_samples_split': 2, 'min_samples_leaf': 4, 'min_weight_fraction_leaf': 0.057588497633839275, 'min_impurity_decrease': 0.4610467753753366, 'max_features': 0.5831091514017148, 'subsample': 0.4205155752060919, 'dropout_rate': 0.986032232734153, 'ccp_alpha': 0.08797656010345713}. Best is trial 434 with value: 0.8310153865446737.[0m
[32m[I 2022-04-21 15:12:57,500][0m Trial 439 finished with value: 0.8287996622649427 and parameters: {'loss': 'coxph', 'learning_rate': 0.014557543583153159, 'n_estimators': 580, 'criterion': 'friedman_mse', 'min_samples_split': 2, 'min_samples_leaf': 4, 'min_weight_fraction_leaf': 0.07017725770928059, 'min_impurity_decrease': 0.4293434725025985, 'max_features': 0.5961416323141817, 'subsample': 0.38367190606059015, 'dropout_rate': 0.9712091529625988, 'ccp_alpha': 0.019071748985937085}. Best is trial 434 with value: 0.8310153865446737.[0m
[32m[I 2022-04-21 15:13:21,214][0m Trial 440 finished with value: 0.8274745492293022 and parameters: {'loss': 'coxph', 'learning_rate': 0.02199352549076994, 'n_estimators': 557, 'criterion': 'friedman_mse', 'min_samples_split': 2, 'min_samples_leaf': 4, 'min_weight_fraction_leaf': 0.06306630561941426, 'min_impurity_decrease': 0.4287212070326809, 'max_features': 0.5878284666395395, 'subsample': 0.4898094698971516, 'dropout_rate': 0.9651924926491598, 'ccp_alpha': 0.01567656905363339}. Best is trial 434 with value: 0.8310153865446737.[0m
[32m[I 2022-04-21 15:13:48,065][0m Trial 441 finished with value: 0.8276139667607291 and parameters: {'loss': 'coxph', 'learning_rate': 0.017580491485750752, 'n_estimators': 665, 'criterion': 'friedman_mse', 'min_samples_split': 2, 'min_samples_leaf': 4, 'min_weight_fraction_leaf': 0.07157121557430235, 'min_impurity_decrease': 0.43045935857342876, 'max_features': 0.5992915506794808, 'subsample': 0.4082240010365134, 'dropout_rate': 0.9835138573056612, 'ccp_alpha': 0.01566921980248806}. Best is trial 434 with value: 0.8310153865446737.[0m
[32m[I 2022-04-21 15:14:07,793][0m Trial 442 finished with value: 0.8287805828573965 and parameters: {'loss': 'coxph', 'learning_rate': 0.017012449681661605, 'n_estimators': 582, 'criterion': 'friedman_mse', 'min_samples_split': 2, 'min_samples_leaf': 4, 'min_weight_fraction_leaf': 0.05073622670894187, 'min_impurity_decrease': 0.4572195546826928, 'max_features': 0.5640002298821309, 'subsample': 0.4329699850430305, 'dropout_rate': 0.9956576103415528, 'ccp_alpha': 0.0067355008545905695}. Best is trial 434 with value: 0.8310153865446737.[0m
