[32m[I 2022-04-23 07:27:37,867][0m Trial 854 finished with value: 0.6431032282488527 and parameters: {'loss': 'coxph', 'learning_rate': 0.054304455793545266, 'n_estimators': 802, 'criterion': 'friedman_mse', 'min_samples_split': 9, 'min_samples_leaf': 5, 'min_weight_fraction_leaf': 0.02058051409851925, 'min_impurity_decrease': 0.43364877306828437, 'max_features': 0.6080745633526187, 'subsample': 0.23165300041887005, 'dropout_rate': 0.1818420846707082, 'ccp_alpha': 0.17084806577783665}. Best is trial 690 with value: 0.6691837560454439.[0m
[32m[I 2022-04-23 07:27:42,575][0m Trial 855 finished with value: 0.6442023332304225 and parameters: {'loss': 'coxph', 'learning_rate': 0.027993261934922093, 'n_estimators': 124, 'criterion': 'friedman_mse', 'min_samples_split': 9, 'min_samples_leaf': 4, 'min_weight_fraction_leaf': 0.03688495165515105, 'min_impurity_decrease': 0.4683388524669389, 'max_features': 0.557126905131263, 'subsample': 0.20335971322249788, 'dropout_rate': 0.22048477472629224, 'ccp_alpha': 0.08628359421451193}. Best is trial 690 with value: 0.6691837560454439.[0m
[32m[I 2022-04-23 07:27:54,995][0m Trial 856 finished with value: 0.5636083943411443 and parameters: {'loss': 'coxph', 'learning_rate': 0.04501880656745382, 'n_estimators': 216, 'criterion': 'friedman_mse', 'min_samples_split': 9, 'min_samples_leaf': 4, 'min_weight_fraction_leaf': 0.07307195539230452, 'min_impurity_decrease': 0.3827437018164514, 'max_features': 0.5771263875322405, 'subsample': 0.2818982183802741, 'dropout_rate': 0.1930889492547092, 'ccp_alpha': 0.23044786716878637}. Best is trial 690 with value: 0.6691837560454439.[0m
[32m[I 2022-04-23 07:29:32,699][0m Trial 857 finished with value: 0.655027858275375 and parameters: {'loss': 'coxph', 'learning_rate': 1.15874310120993e-05, 'n_estimators': 604, 'criterion': 'friedman_mse', 'min_samples_split': 9, 'min_samples_leaf': 9, 'min_weight_fraction_leaf': 0.0531180141214676, 'min_impurity_decrease': 0.4385811238024076, 'max_features': 0.5877673286562268, 'subsample': 0.31675349755900034, 'dropout_rate': 0.15782234785784158, 'ccp_alpha': 0.002810037800063569}. Best is trial 690 with value: 0.6691837560454439.[0m
[32m[I 2022-04-23 07:31:30,383][0m Trial 858 finished with value: 0.6519347676547487 and parameters: {'loss': 'coxph', 'learning_rate': 0.05823163635493034, 'n_estimators': 725, 'criterion': 'friedman_mse', 'min_samples_split': 8, 'min_samples_leaf': 4, 'min_weight_fraction_leaf': 0.024682096868183345, 'min_impurity_decrease': 0.3984065770976765, 'max_features': 0.3205900615888051, 'subsample': 0.26565561687480016, 'dropout_rate': 0.24444599697779926, 'ccp_alpha': 0.09589111462523346}. Best is trial 690 with value: 0.6691837560454439.[0m
[32m[I 2022-04-23 07:32:43,716][0m Trial 859 finished with value: 0.639487646236906 and parameters: {'loss': 'coxph', 'learning_rate': 0.06783527212519692, 'n_estimators': 528, 'criterion': 'friedman_mse', 'min_samples_split': 9, 'min_samples_leaf': 4, 'min_weight_fraction_leaf': 0.010360761536022887, 'min_impurity_decrease': 0.4808606979588669, 'max_features': 0.6336270096719977, 'subsample': 0.24426580474387222, 'dropout_rate': 0.09338505961905452, 'ccp_alpha': 0.1719410871400047}. Best is trial 690 with value: 0.6691837560454439.[0m
[32m[I 2022-04-23 07:34:27,845][0m Trial 860 finished with value: 0.5 and parameters: {'loss': 'coxph', 'learning_rate': 0.048915708507704665, 'n_estimators': 663, 'criterion': 'friedman_mse', 'min_samples_split': 9, 'min_samples_leaf': 5, 'min_weight_fraction_leaf': 0.04627250821766103, 'min_impurity_decrease': 0.4527850983766193, 'max_features': 0.009235174077772523, 'subsample': 0.28335784278351045, 'dropout_rate': 0.17449004009889538, 'ccp_alpha': 0.3500058076006344}. Best is trial 690 with value: 0.6691837560454439.[0m
[32m[I 2022-04-23 07:36:02,660][0m Trial 861 finished with value: 0.5274764932801516 and parameters: {'loss': 'coxph', 'learning_rate': 0.03578374716093668, 'n_estimators': 616, 'criterion': 'squared_error', 'min_samples_split': 9, 'min_samples_leaf': 4, 'min_weight_fraction_leaf': 0.07536083890042562, 'min_impurity_decrease': 0.36212972596859727, 'max_features': 0.5381152383779058, 'subsample': 0.21837858816561723, 'dropout_rate': 0.1375084942842772, 'ccp_alpha': 0.004415232280192942}. Best is trial 690 with value: 0.6691837560454439.[0m
/media/san2_ssd/data/Workdir/survival/venv/lib/python3.8/site-packages/sksurv/ensemble/boosting.py:955: RuntimeWarning: divide by zero encountered in log
  time = numpy.log(time)
/media/san2_ssd/data/Workdir/survival/venv/lib/python3.8/site-packages/sksurv/ensemble/boosting.py:955: RuntimeWarning: divide by zero encountered in log
  time = numpy.log(time)
/media/san2_ssd/data/Workdir/survival/venv/lib/python3.8/site-packages/sksurv/ensemble/boosting.py:955: RuntimeWarning: divide by zero encountered in log
  time = numpy.log(time)
/media/san2_ssd/data/Workdir/survival/venv/lib/python3.8/site-packages/sksurv/ensemble/boosting.py:955: RuntimeWarning: divide by zero encountered in log
  time = numpy.log(time)
[32m[I 2022-04-23 07:36:17,899][0m Trial 862 finished with value: -0.7365023010232797 and parameters: {'loss': 'squared', 'learning_rate': 0.06427089755954632, 'n_estimators': 567, 'criterion': 'friedman_mse', 'min_samples_split': 9, 'min_samples_leaf': 4, 'min_weight_fraction_leaf': 0.06439876135661347, 'min_impurity_decrease': 0.6580960038485603, 'max_features': 0.604326441608186, 'subsample': 0.3381007924725843, 'dropout_rate': 0.2047245027022569, 'ccp_alpha': 0.09644107228344932}. Best is trial 690 with value: 0.6691837560454439.[0m
[32m[I 2022-04-23 07:36:26,305][0m Trial 863 finished with value: 0.6152746394204756 and parameters: {'loss': 'coxph', 'learning_rate': 0.08321091527591007, 'n_estimators': 175, 'criterion': 'friedman_mse', 'min_samples_split': 9, 'min_samples_leaf': 7, 'min_weight_fraction_leaf': 0.02967730846370281, 'min_impurity_decrease': 0.41688897316433576, 'max_features': 0.6659846700349893, 'subsample': 0.3006124665845036, 'dropout_rate': 0.22785991456333937, 'ccp_alpha': 0.18212365429483884}. Best is trial 690 with value: 0.6691837560454439.[0m
[32m[I 2022-04-23 07:37:43,932][0m Trial 864 finished with value: 0.5623511703378433 and parameters: {'loss': 'coxph', 'learning_rate': 0.05548662553861927, 'n_estimators': 589, 'criterion': 'friedman_mse', 'min_samples_split': 9, 'min_samples_leaf': 4, 'min_weight_fraction_leaf': 0.0014335398567242204, 'min_impurity_decrease': 0.5038507237345615, 'max_features': 0.5698380237248609, 'subsample': 0.2535140731714936, 'dropout_rate': 0.25658572993997864, 'ccp_alpha': 0.26134436089955154}. Best is trial 690 with value: 0.6691837560454439.[0m
[32m[I 2022-04-23 07:38:49,664][0m Trial 865 finished with value: 0.6577661189258638 and parameters: {'loss': 'coxph', 'learning_rate': 0.04253568294161284, 'n_estimators': 642, 'criterion': 'friedman_mse', 'min_samples_split': 5, 'min_samples_leaf': 4, 'min_weight_fraction_leaf': 0.058428894774962915, 'min_impurity_decrease': 0.4547077101426838, 'max_features': 0.5579128480823905, 'subsample': 0.23346181610729524, 'dropout_rate': 0.5546942702135544, 'ccp_alpha': 0.004065470385127028}. Best is trial 690 with value: 0.6691837560454439.[0m
[32m[I 2022-04-23 07:40:48,014][0m Trial 866 finished with value: 0.6572147258756937 and parameters: {'loss': 'coxph', 'learning_rate': 0.06919744602872137, 'n_estimators': 692, 'criterion': 'friedman_mse', 'min_samples_split': 9, 'min_samples_leaf': 6, 'min_weight_fraction_leaf': 0.015175220761894866, 'min_impurity_decrease': 0.3511810340142494, 'max_features': 0.8039969836395862, 'subsample': 0.2697090802060216, 'dropout_rate': 0.18505730368132867, 'ccp_alpha': 0.08592685869544106}. Best is trial 690 with value: 0.6691837560454439.[0m
[32m[I 2022-04-23 07:40:54,369][0m Trial 867 finished with value: 0.6359019025888132 and parameters: {'loss': 'coxph', 'learning_rate': 0.08699027913612332, 'n_estimators': 153, 'criterion': 'friedman_mse', 'min_samples_split': 9, 'min_samples_leaf': 4, 'min_weight_fraction_leaf': 0.03780449150146063, 'min_impurity_decrease': 0.3800984377000664, 'max_features': 0.06742596172244161, 'subsample': 0.3192676680104005, 'dropout_rate': 0.21491961809620935, 'ccp_alpha': 0.08845144553829995}. Best is trial 690 with value: 0.6691837560454439.[0m
[32m[I 2022-04-23 07:42:02,176][0m Trial 868 finished with value: 0.6410524725695019 and parameters: {'loss': 'coxph', 'learning_rate': 0.0004103064507890112, 'n_estimators': 520, 'criterion': 'friedman_mse', 'min_samples_split': 9, 'min_samples_leaf': 4, 'min_weight_fraction_leaf': 0.07283237826834651, 'min_impurity_decrease': 0.5186305520048242, 'max_features': 0.5235675298482112, 'subsample': 0.18931746317326237, 'dropout_rate': 0.16887818355234882, 'ccp_alpha': 0.1689066710401674}. Best is trial 690 with value: 0.6691837560454439.[0m
[32m[I 2022-04-23 07:43:17,212][0m Trial 869 finished with value: 0.6570658774749358 and parameters: {'loss': 'coxph', 'learning_rate': 0.0988702380960517, 'n_estimators': 554, 'criterion': 'friedman_mse', 'min_samples_split': 8, 'min_samples_leaf': 5, 'min_weight_fraction_leaf': 0.04593710417688701, 'min_impurity_decrease': 0.48922568737632466, 'max_features': 0.6144940513206713, 'subsample': 0.2919149629588171, 'dropout_rate': 0.19890468232720454, 'ccp_alpha': 0.08562038829770856}. Best is trial 690 with value: 0.6691837560454439.[0m
[32m[I 2022-04-23 07:44:49,221][0m Trial 870 finished with value: 0.5405140320861431 and parameters: {'loss': 'coxph', 'learning_rate': 0.05529774393905657, 'n_estimators': 605, 'criterion': 'friedman_mse', 'min_samples_split': 9, 'min_samples_leaf': 4, 'min_weight_fraction_leaf': 0.024538851237102255, 'min_impurity_decrease': 0.3302584152353639, 'max_features': 0.5981645124428202, 'subsample': 0.24667539938303656, 'dropout_rate': 0.1552820210150967, 'ccp_alpha': 0.29173092926126}. Best is trial 690 with value: 0.6691837560454439.[0m
[32m[I 2022-04-23 07:45:06,847][0m Trial 871 finished with value: 0.6570822352372043 and parameters: {'loss': 'coxph', 'learning_rate': 0.02354262894944859, 'n_estimators': 246, 'criterion': 'friedman_mse', 'min_samples_split': 9, 'min_samples_leaf': 4, 'min_weight_fraction_leaf': 0.05676724455533019, 'min_impurity_decrease': 0.5383448351703801, 'max_features': 0.17257733275640902, 'subsample': 0.21176369956788033, 'dropout_rate': 0.12380834071487039, 'ccp_alpha': 0.004619547539074186}. Best is trial 690 with value: 0.6691837560454439.[0m
[32m[I 2022-04-23 07:46:37,629][0m Trial 872 finished with value: 0.6413486571168902 and parameters: {'loss': 'coxph', 'learning_rate': 0.06919628522212502, 'n_estimators': 628, 'criterion': 'friedman_mse', 'min_samples_split': 9, 'min_samples_leaf': 4, 'min_weight_fraction_leaf': 0.0754764944468204, 'min_impurity_decrease': 0.4339348392462003, 'max_features': 0.5784884043120904, 'subsample': 0.2701560519637989, 'dropout_rate': 0.22660027152792847, 'ccp_alpha': 0.1702346065342847}. Best is trial 690 with value: 0.6691837560454439.[0m
[32m[I 2022-04-23 07:47:31,385][0m Trial 873 finished with value: 0.5647893734855787 and parameters: {'loss': 'coxph', 'learning_rate': 0.04186923710262964, 'n_estimators': 485, 'criterion': 'friedman_mse', 'min_samples_split': 9, 'min_samples_leaf': 5, 'min_weight_fraction_leaf': 0.38450083461907264, 'min_impurity_decrease': 0.4571407101473829, 'max_features': 0.6341562149716984, 'subsample': 0.3053658870820106, 'dropout_rate': 0.25860802777625874, 'ccp_alpha': 0.09291331695844332}. Best is trial 690 with value: 0.6691837560454439.[0m
[32m[I 2022-04-23 07:49:18,416][0m Trial 874 finished with value: 0.5943120588189312 and parameters: {'loss': 'coxph', 'learning_rate': 0.033004853892775736, 'n_estimators': 666, 'criterion': 'friedman_mse', 'min_samples_split': 9, 'min_samples_leaf': 4, 'min_weight_fraction_leaf': 0.03705051745101748, 'min_impurity_decrease': 0.5005256886693321, 'max_features': 0.5396560977607445, 'subsample': 0.2349993510962432, 'dropout_rate': 0.18356599354911915, 'ccp_alpha': 0.24036925716150304}. Best is trial 690 with value: 0.6691837560454439.[0m
[32m[I 2022-04-23 07:50:29,901][0m Trial 875 finished with value: 0.5 and parameters: {'loss': 'coxph', 'learning_rate': 0.08164814619300169, 'n_estimators': 537, 'criterion': 'absolute_error', 'min_samples_split': 8, 'min_samples_leaf': 4, 'min_weight_fraction_leaf': 0.018364117386784846, 'min_impurity_decrease': 0.47773865934464893, 'max_features': 0.8477380411356896, 'subsample': 0.28176334729605573, 'dropout_rate': 0.20699612749984225, 'ccp_alpha': 0.08332815810845068}. Best is trial 690 with value: 0.6691837560454439.[0m
[32m[I 2022-04-23 07:52:34,705][0m Trial 876 finished with value: 0.5734344374293304 and parameters: {'loss': 'coxph', 'learning_rate': 0.0577059963620556, 'n_estimators': 740, 'criterion': 'friedman_mse', 'min_samples_split': 9, 'min_samples_leaf': 4, 'min_weight_fraction_leaf': 0.4439986235928882, 'min_impurity_decrease': 0.5130376314443346, 'max_features': 0.5596326383328132, 'subsample': 0.2593416326519976, 'dropout_rate': 0.23690563989068703, 'ccp_alpha': 0.002131172432211816}. Best is trial 690 with value: 0.6691837560454439.[0m
[32m[I 2022-04-23 07:53:56,818][0m Trial 877 finished with value: 0.5 and parameters: {'loss': 'coxph', 'learning_rate': 0.0482710831522412, 'n_estimators': 574, 'criterion': 'friedman_mse', 'min_samples_split': 9, 'min_samples_leaf': 2, 'min_weight_fraction_leaf': 0.06296001040896808, 'min_impurity_decrease': 0.46177523519349867, 'max_features': 0.6487160727071937, 'subsample': 0.34275697244812053, 'dropout_rate': 0.14615064178775122, 'ccp_alpha': 2.9934575652096234}. Best is trial 690 with value: 0.6691837560454439.[0m
[32m[I 2022-04-23 07:55:27,220][0m Trial 878 finished with value: 0.5461105059281433 and parameters: {'loss': 'coxph', 'learning_rate': 0.09802244960084312, 'n_estimators': 612, 'criterion': 'friedman_mse', 'min_samples_split': 9, 'min_samples_leaf': 5, 'min_weight_fraction_leaf': 0.047454391254722776, 'min_impurity_decrease': 0.34267731581001315, 'max_features': 0.5945839747877087, 'subsample': 0.5257498212797871, 'dropout_rate': 0.1804195301689376, 'ccp_alpha': 0.1792888432510278}. Best is trial 690 with value: 0.6691837560454439.[0m
[32m[I 2022-04-23 07:56:28,240][0m Trial 879 finished with value: 0.5006540204610004 and parameters: {'loss': 'coxph', 'learning_rate': 0.00014533157451970637, 'n_estimators': 508, 'criterion': 'friedman_mse', 'min_samples_split': 9, 'min_samples_leaf': 4, 'min_weight_fraction_leaf': 0.18785295891673132, 'min_impurity_decrease': 0.5531710891928545, 'max_features': 0.6153131786233353, 'subsample': 0.32151311240436553, 'dropout_rate': 0.20345158521480483, 'ccp_alpha': 0.370712798515951}. Best is trial 690 with value: 0.6691837560454439.[0m
[32m[I 2022-04-23 07:58:00,048][0m Trial 880 finished with value: 0.6469657192985236 and parameters: {'loss': 'coxph', 'learning_rate': 0.06619342031708504, 'n_estimators': 588, 'criterion': 'friedman_mse', 'min_samples_split': 9, 'min_samples_leaf': 4, 'min_weight_fraction_leaf': 0.028028746160079426, 'min_impurity_decrease': 0.49675820486778055, 'max_features': 0.5315753052521591, 'subsample': 0.22043645820018568, 'dropout_rate': 0.10933368413915927, 'ccp_alpha': 0.1466305690957153}. Best is trial 690 with value: 0.6691837560454439.[0m
/media/san2_ssd/data/Workdir/survival/venv/lib/python3.8/site-packages/sksurv/ensemble/boosting.py:955: RuntimeWarning: divide by zero encountered in log
  time = numpy.log(time)
/media/san2_ssd/data/Workdir/survival/venv/lib/python3.8/site-packages/sksurv/ensemble/boosting.py:955: RuntimeWarning: divide by zero encountered in log
  time = numpy.log(time)
/media/san2_ssd/data/Workdir/survival/venv/lib/python3.8/site-packages/sksurv/ensemble/boosting.py:955: RuntimeWarning: divide by zero encountered in log
  time = numpy.log(time)
/media/san2_ssd/data/Workdir/survival/venv/lib/python3.8/site-packages/sksurv/ensemble/boosting.py:955: RuntimeWarning: divide by zero encountered in log
  time = numpy.log(time)
[32m[I 2022-04-23 07:58:20,996][0m Trial 881 finished with value: -0.7345851477694432 and parameters: {'loss': 'squared', 'learning_rate': 0.07362555003625733, 'n_estimators': 661, 'criterion': 'friedman_mse', 'min_samples_split': 9, 'min_samples_leaf': 4, 'min_weight_fraction_leaf': 0.08016584926408211, 'min_impurity_decrease': 0.4167801253479111, 'max_features': 0.5176260800652531, 'subsample': 0.24544334232904816, 'dropout_rate': 0.22105113583680422, 'ccp_alpha': 0.0027551468796067893}. Best is trial 690 with value: 0.6691837560454439.[0m
[32m[I 2022-04-23 08:00:21,899][0m Trial 882 finished with value: 0.5 and parameters: {'loss': 'coxph', 'learning_rate': 0.05299669700635264, 'n_estimators': 701, 'criterion': 'friedman_mse', 'min_samples_split': 9, 'min_samples_leaf': 5, 'min_weight_fraction_leaf': 0.011989210597664437, 'min_impurity_decrease': 0.47529879949863313, 'max_features': 0.5730593714991205, 'subsample': 0.299167396141537, 'dropout_rate': 0.16642445507548906, 'ccp_alpha': 3.9782083165646385}. Best is trial 690 with value: 0.6691837560454439.[0m
[32m[I 2022-04-23 08:01:30,273][0m Trial 883 finished with value: 0.5 and parameters: {'loss': 'coxph', 'learning_rate': 0.09819947590816436, 'n_estimators': 554, 'criterion': 'squared_error', 'min_samples_split': 8, 'min_samples_leaf': 4, 'min_weight_fraction_leaf': 0.06795513652385285, 'min_impurity_decrease': 0.6108457893025854, 'max_features': 0.6263360837144668, 'subsample': 0.27449801779613026, 'dropout_rate': 0.25443627025155535, 'ccp_alpha': 0.003873757805714922}. Best is trial 690 with value: 0.6691837560454439.[0m
[32m[I 2022-04-23 08:02:30,680][0m Trial 884 finished with value: 0.5 and parameters: {'loss': 'coxph', 'learning_rate': 0.040809689961843525, 'n_estimators': 494, 'criterion': 'friedman_mse', 'min_samples_split': 7, 'min_samples_leaf': 4, 'min_weight_fraction_leaf': 0.039260590402824314, 'min_impurity_decrease': 0.38176951640034296, 'max_features': 0.5943784256940026, 'subsample': 0.17350942644033682, 'dropout_rate': 0.19152573528338857, 'ccp_alpha': 4.313598305937033}. Best is trial 690 with value: 0.6691837560454439.[0m
[32m[I 2022-04-23 08:04:16,868][0m Trial 885 finished with value: 0.6638925608600691 and parameters: {'loss': 'coxph', 'learning_rate': 0.06912702858968321, 'n_estimators': 625, 'criterion': 'friedman_mse', 'min_samples_split': 9, 'min_samples_leaf': 6, 'min_weight_fraction_leaf': 0.05119286196918664, 'min_impurity_decrease': 0.5173684741680596, 'max_features': 0.5524898250349279, 'subsample': 0.2559227640562139, 'dropout_rate': 0.13972829457432867, 'ccp_alpha': 0.0023526518628734796}. Best is trial 690 with value: 0.6691837560454439.[0m
[32m[I 2022-04-23 08:06:03,041][0m Trial 886 finished with value: 0.5786317560269069 and parameters: {'loss': 'coxph', 'learning_rate': 0.07922453039867562, 'n_estimators': 643, 'criterion': 'friedman_mse', 'min_samples_split': 9, 'min_samples_leaf': 6, 'min_weight_fraction_leaf': 0.04644662051969713, 'min_impurity_decrease': 0.5302970437648148, 'max_features': 0.5066100043098007, 'subsample': 0.2825005440009454, 'dropout_rate': 0.10197970814066873, 'ccp_alpha': 0.24284691032274466}. Best is trial 690 with value: 0.6691837560454439.[0m
[32m[I 2022-04-23 08:07:41,385][0m Trial 887 finished with value: 0.6448074695746646 and parameters: {'loss': 'coxph', 'learning_rate': 0.06931888664569187, 'n_estimators': 622, 'criterion': 'friedman_mse', 'min_samples_split': 9, 'min_samples_leaf': 6, 'min_weight_fraction_leaf': 0.028670566684406817, 'min_impurity_decrease': 0.5570473259393594, 'max_features': 0.5304081402766404, 'subsample': 0.3085346421392276, 'dropout_rate': 0.12262944228422143, 'ccp_alpha': 0.10700852216806854}. Best is trial 690 with value: 0.6691837560454439.[0m
[32m[I 2022-04-23 08:09:33,975][0m Trial 888 finished with value: 0.6525600807497132 and parameters: {'loss': 'coxph', 'learning_rate': 0.0054647628118665486, 'n_estimators': 666, 'criterion': 'friedman_mse', 'min_samples_split': 9, 'min_samples_leaf': 6, 'min_weight_fraction_leaf': 0.03808767434228915, 'min_impurity_decrease': 0.5238925401950686, 'max_features': 0.5471724632692327, 'subsample': 0.26757405655632804, 'dropout_rate': 0.1342633932612171, 'ccp_alpha': 0.10014475507479931}. Best is trial 690 with value: 0.6691837560454439.[0m
[32m[I 2022-04-23 08:11:07,754][0m Trial 889 finished with value: 0.6162169232469091 and parameters: {'loss': 'coxph', 'learning_rate': 0.09985332417457207, 'n_estimators': 608, 'criterion': 'friedman_mse', 'min_samples_split': 9, 'min_samples_leaf': 6, 'min_weight_fraction_leaf': 0.052618634603796385, 'min_impurity_decrease': 0.5389353679622849, 'max_features': 0.5484250670989944, 'subsample': 0.3280417235040676, 'dropout_rate': 0.1158521919457904, 'ccp_alpha': 0.17947739977314553}. Best is trial 690 with value: 0.6691837560454439.[0m
[32m[I 2022-04-23 08:12:57,789][0m Trial 890 finished with value: 0.6632457300549376 and parameters: {'loss': 'coxph', 'learning_rate': 0.05773912097536433, 'n_estimators': 636, 'criterion': 'friedman_mse', 'min_samples_split': 9, 'min_samples_leaf': 6, 'min_weight_fraction_leaf': 0.030071134738716237, 'min_impurity_decrease': 0.5794952193946384, 'max_features': 0.4928243637080523, 'subsample': 0.28626572876572226, 'dropout_rate': 0.13933208120989551, 'ccp_alpha': 0.004742183437681577}. Best is trial 690 with value: 0.6691837560454439.[0m
