[32m[I 2022-04-22 00:59:26,662][0m Trial 731 finished with value: 0.5 and parameters: {'loss': 'coxph', 'learning_rate': 3.867932975802157e-05, 'n_estimators': 309, 'criterion': 'squared_error', 'min_samples_split': 6, 'min_samples_leaf': 9, 'min_weight_fraction_leaf': 0.1594008404094559, 'min_impurity_decrease': 0.03244991391484243, 'max_features': 0.7892855486973718, 'subsample': 0.3248896038606828, 'dropout_rate': 0.3798156428779389, 'ccp_alpha': 2.3191843603270543}. Best is trial 187 with value: 0.6933481836305168.[0m
[32m[I 2022-04-22 00:59:41,339][0m Trial 732 finished with value: 0.6875579642290924 and parameters: {'loss': 'coxph', 'learning_rate': 0.00022657726728587572, 'n_estimators': 383, 'criterion': 'friedman_mse', 'min_samples_split': 7, 'min_samples_leaf': 10, 'min_weight_fraction_leaf': 0.08176474378823151, 'min_impurity_decrease': 0.053779504836096004, 'max_features': 0.8855330430751496, 'subsample': 0.25595395214321165, 'dropout_rate': 0.6679636015529206, 'ccp_alpha': 0.0042201599766522185}. Best is trial 187 with value: 0.6933481836305168.[0m
[32m[I 2022-04-22 00:59:47,194][0m Trial 733 finished with value: 0.6682973162934912 and parameters: {'loss': 'coxph', 'learning_rate': 5.791545372009097e-05, 'n_estimators': 243, 'criterion': 'squared_error', 'min_samples_split': 7, 'min_samples_leaf': 10, 'min_weight_fraction_leaf': 0.2214083517822109, 'min_impurity_decrease': 0.021273099849229357, 'max_features': 0.8109306769658415, 'subsample': 0.3038086979611789, 'dropout_rate': 0.616450430787792, 'ccp_alpha': 0.22914243677096485}. Best is trial 187 with value: 0.6933481836305168.[0m
[32m[I 2022-04-22 01:00:04,440][0m Trial 734 finished with value: 0.6829029315391306 and parameters: {'loss': 'coxph', 'learning_rate': 8.875648420806252e-05, 'n_estimators': 283, 'criterion': 'squared_error', 'min_samples_split': 7, 'min_samples_leaf': 10, 'min_weight_fraction_leaf': 0.22953755901018033, 'min_impurity_decrease': 0.08173194936008427, 'max_features': 0.8400695705111826, 'subsample': 0.2757167156937236, 'dropout_rate': 0.14160333988402257, 'ccp_alpha': 0.18321373431689547}. Best is trial 187 with value: 0.6933481836305168.[0m
[32m[I 2022-04-22 01:00:20,229][0m Trial 735 finished with value: 0.6878188346867231 and parameters: {'loss': 'coxph', 'learning_rate': 4.79796888938101e-05, 'n_estimators': 318, 'criterion': 'squared_error', 'min_samples_split': 7, 'min_samples_leaf': 10, 'min_weight_fraction_leaf': 0.1859599012620972, 'min_impurity_decrease': 0.048571708870527114, 'max_features': 0.8596651898603348, 'subsample': 0.23867794580659957, 'dropout_rate': 0.5674340291572411, 'ccp_alpha': 0.09091998558031374}. Best is trial 187 with value: 0.6933481836305168.[0m
[32m[I 2022-04-22 01:00:53,614][0m Trial 736 finished with value: 0.6862010666434332 and parameters: {'loss': 'coxph', 'learning_rate': 6.749424283609962e-05, 'n_estimators': 403, 'criterion': 'squared_error', 'min_samples_split': 7, 'min_samples_leaf': 9, 'min_weight_fraction_leaf': 0.2096210438072822, 'min_impurity_decrease': 0.0319064799970866, 'max_features': 0.8315296288785045, 'subsample': 0.3096438576545282, 'dropout_rate': 0.40848783048994547, 'ccp_alpha': 0.003790248625401345}. Best is trial 187 with value: 0.6933481836305168.[0m
[32m[I 2022-04-22 01:01:03,662][0m Trial 737 finished with value: 0.6529688876710681 and parameters: {'loss': 'coxph', 'learning_rate': 0.00011382753381135575, 'n_estimators': 267, 'criterion': 'squared_error', 'min_samples_split': 8, 'min_samples_leaf': 10, 'min_weight_fraction_leaf': 0.20361389451466, 'min_impurity_decrease': 0.11286585943757585, 'max_features': 0.887705949313655, 'subsample': 0.3491692197567511, 'dropout_rate': 0.5873272267477819, 'ccp_alpha': 0.3030888993514374}. Best is trial 187 with value: 0.6933481836305168.[0m
[32m[I 2022-04-22 01:01:18,084][0m Trial 738 finished with value: 0.6808630992564884 and parameters: {'loss': 'coxph', 'learning_rate': 3.6694589165041594e-05, 'n_estimators': 300, 'criterion': 'squared_error', 'min_samples_split': 7, 'min_samples_leaf': 10, 'min_weight_fraction_leaf': 0.21546646511796264, 'min_impurity_decrease': 0.06234210761189435, 'max_features': 0.9810180618914945, 'subsample': 0.2640427334379222, 'dropout_rate': 0.6319825386229144, 'ccp_alpha': 0.16511947433632287}. Best is trial 187 with value: 0.6933481836305168.[0m
[32m[I 2022-04-22 01:01:34,749][0m Trial 739 finished with value: 0.6876058586514386 and parameters: {'loss': 'coxph', 'learning_rate': 2.6785746995380464e-05, 'n_estimators': 333, 'criterion': 'squared_error', 'min_samples_split': 7, 'min_samples_leaf': 8, 'min_weight_fraction_leaf': 0.17858286392759617, 'min_impurity_decrease': 0.022504095645102522, 'max_features': 0.8129768641766894, 'subsample': 0.21963196071038688, 'dropout_rate': 0.5512053560861367, 'ccp_alpha': 0.0856976459586749}. Best is trial 187 with value: 0.6933481836305168.[0m
/media/san2_ssd/data/Workdir/survival/venv/lib/python3.8/site-packages/sksurv/ensemble/boosting.py:955: RuntimeWarning: divide by zero encountered in log
  time = numpy.log(time)
/media/san2_ssd/data/Workdir/survival/venv/lib/python3.8/site-packages/sksurv/ensemble/boosting.py:955: RuntimeWarning: divide by zero encountered in log
  time = numpy.log(time)
/media/san2_ssd/data/Workdir/survival/venv/lib/python3.8/site-packages/sksurv/ensemble/boosting.py:955: RuntimeWarning: divide by zero encountered in log
  time = numpy.log(time)
/media/san2_ssd/data/Workdir/survival/venv/lib/python3.8/site-packages/sksurv/ensemble/boosting.py:955: RuntimeWarning: divide by zero encountered in log
  time = numpy.log(time)
[32m[I 2022-04-22 01:01:41,093][0m Trial 740 finished with value: -0.7309394300370865 and parameters: {'loss': 'squared', 'learning_rate': 0.00017775838663467496, 'n_estimators': 288, 'criterion': 'squared_error', 'min_samples_split': 7, 'min_samples_leaf': 9, 'min_weight_fraction_leaf': 0.14769817083055956, 'min_impurity_decrease': 0.42977146852856407, 'max_features': 0.7832915417694118, 'subsample': 0.5424687863755587, 'dropout_rate': 0.09122691339914962, 'ccp_alpha': 0.0016478439243654691}. Best is trial 187 with value: 0.6933481836305168.[0m
[32m[I 2022-04-22 01:02:09,585][0m Trial 741 finished with value: 0.5 and parameters: {'loss': 'coxph', 'learning_rate': 8.06083149751264e-05, 'n_estimators': 321, 'criterion': 'absolute_error', 'min_samples_split': 7, 'min_samples_leaf': 10, 'min_weight_fraction_leaf': 0.23507127073438652, 'min_impurity_decrease': 0.0782859772804519, 'max_features': 0.8546659937926558, 'subsample': 0.3310041391472941, 'dropout_rate': 0.11787335955252681, 'ccp_alpha': 0.5972320596118517}. Best is trial 187 with value: 0.6933481836305168.[0m
[32m[I 2022-04-22 01:02:30,100][0m Trial 742 finished with value: 0.6682612790097882 and parameters: {'loss': 'coxph', 'learning_rate': 4.954223684752478e-05, 'n_estimators': 380, 'criterion': 'squared_error', 'min_samples_split': 7, 'min_samples_leaf': 10, 'min_weight_fraction_leaf': 0.19103839177014273, 'min_impurity_decrease': 0.05321052432250745, 'max_features': 0.9690114464452222, 'subsample': 0.28999467327831707, 'dropout_rate': 0.6031611314909818, 'ccp_alpha': 0.2432912520564675}. Best is trial 187 with value: 0.6933481836305168.[0m
[32m[I 2022-04-22 01:02:44,910][0m Trial 743 finished with value: 0.6263035632086383 and parameters: {'loss': 'coxph', 'learning_rate': 6.204812477911814e-05, 'n_estimators': 298, 'criterion': 'squared_error', 'min_samples_split': 7, 'min_samples_leaf': 9, 'min_weight_fraction_leaf': 0.20045254999491194, 'min_impurity_decrease': 0.09425750154906427, 'max_features': 0.9017770722250963, 'subsample': 0.9065735748174579, 'dropout_rate': 0.6314207742657738, 'ccp_alpha': 0.1732420818148015}. Best is trial 187 with value: 0.6933481836305168.[0m
[32m[I 2022-04-22 01:03:01,902][0m Trial 744 finished with value: 0.6455039981134991 and parameters: {'loss': 'coxph', 'learning_rate': 0.0001307575232939787, 'n_estimators': 269, 'criterion': 'friedman_mse', 'min_samples_split': 6, 'min_samples_leaf': 10, 'min_weight_fraction_leaf': 0.167597030527928, 'min_impurity_decrease': 0.036155664320198705, 'max_features': 0.8239765247238222, 'subsample': 0.2782859996272049, 'dropout_rate': 0.13916435359832086, 'ccp_alpha': 0.36682946720680465}. Best is trial 187 with value: 0.6933481836305168.[0m
[32m[I 2022-04-22 01:03:22,411][0m Trial 745 finished with value: 0.6896320048696569 and parameters: {'loss': 'coxph', 'learning_rate': 0.00024944074804671905, 'n_estimators': 308, 'criterion': 'squared_error', 'min_samples_split': 7, 'min_samples_leaf': 7, 'min_weight_fraction_leaf': 0.24790959869015947, 'min_impurity_decrease': 0.017927517802508876, 'max_features': 0.8659365084576628, 'subsample': 0.24777131102093392, 'dropout_rate': 0.10083475326024138, 'ccp_alpha': 0.10193246708319709}. Best is trial 187 with value: 0.6933481836305168.[0m
[32m[I 2022-04-22 01:03:50,018][0m Trial 746 finished with value: 0.6864471415575775 and parameters: {'loss': 'coxph', 'learning_rate': 0.00023916359535428632, 'n_estimators': 328, 'criterion': 'squared_error', 'min_samples_split': 7, 'min_samples_leaf': 6, 'min_weight_fraction_leaf': 0.2588203055097923, 'min_impurity_decrease': 0.018909748552643997, 'max_features': 0.872290498538955, 'subsample': 0.21177251609692532, 'dropout_rate': 0.10347507829501904, 'ccp_alpha': 0.08847083330733936}. Best is trial 187 with value: 0.6933481836305168.[0m
[32m[I 2022-04-22 01:04:12,379][0m Trial 747 finished with value: 0.6691130277844033 and parameters: {'loss': 'coxph', 'learning_rate': 0.0002751206474498658, 'n_estimators': 310, 'criterion': 'squared_error', 'min_samples_split': 6, 'min_samples_leaf': 9, 'min_weight_fraction_leaf': 0.2825287604128636, 'min_impurity_decrease': 0.0015376795216274775, 'max_features': 0.8896606922612381, 'subsample': 0.23398101502681673, 'dropout_rate': 0.1220794201552173, 'ccp_alpha': 0.24855221858823895}. Best is trial 187 with value: 0.6933481836305168.[0m
[32m[I 2022-04-22 01:04:44,644][0m Trial 748 finished with value: 0.685981070424571 and parameters: {'loss': 'coxph', 'learning_rate': 0.00023364110469476252, 'n_estimators': 395, 'criterion': 'squared_error', 'min_samples_split': 7, 'min_samples_leaf': 6, 'min_weight_fraction_leaf': 0.26159990512779985, 'min_impurity_decrease': 0.021805302216050974, 'max_features': 0.9477057928511932, 'subsample': 0.18903165902844796, 'dropout_rate': 0.07694592544221891, 'ccp_alpha': 0.09703503652591276}. Best is trial 187 with value: 0.6933481836305168.[0m
[32m[I 2022-04-22 01:05:06,266][0m Trial 749 finished with value: 0.6832062061755648 and parameters: {'loss': 'coxph', 'learning_rate': 0.00017472894883004914, 'n_estimators': 333, 'criterion': 'squared_error', 'min_samples_split': 7, 'min_samples_leaf': 7, 'min_weight_fraction_leaf': 0.24876311519675556, 'min_impurity_decrease': 0.020196892445178274, 'max_features': 0.9007280707111499, 'subsample': 0.24642181703036686, 'dropout_rate': 0.4942896195037888, 'ccp_alpha': 0.15107552847024738}. Best is trial 187 with value: 0.6933481836305168.[0m
[32m[I 2022-04-22 01:05:31,686][0m Trial 750 finished with value: 0.6739985741391072 and parameters: {'loss': 'coxph', 'learning_rate': 0.00020882264959540622, 'n_estimators': 315, 'criterion': 'squared_error', 'min_samples_split': 7, 'min_samples_leaf': 9, 'min_weight_fraction_leaf': 0.2515378757870288, 'min_impurity_decrease': 0.0021717482169802405, 'max_features': 0.8634326052184084, 'subsample': 0.22897038939390374, 'dropout_rate': 0.08435131390437614, 'ccp_alpha': 0.30429049886244786}. Best is trial 187 with value: 0.6933481836305168.[0m
[32m[I 2022-04-22 01:05:48,974][0m Trial 751 finished with value: 0.6877993513543539 and parameters: {'loss': 'coxph', 'learning_rate': 0.0002975787204238341, 'n_estimators': 232, 'criterion': 'squared_error', 'min_samples_split': 7, 'min_samples_leaf': 8, 'min_weight_fraction_leaf': 0.2532511642117909, 'min_impurity_decrease': 0.0364720259144969, 'max_features': 0.9646093312500139, 'subsample': 0.20824839273251705, 'dropout_rate': 0.10869958802122823, 'ccp_alpha': 0.003938564228337549}. Best is trial 187 with value: 0.6933481836305168.[0m
[32m[I 2022-04-22 01:06:32,347][0m Trial 752 finished with value: 0.686262326516235 and parameters: {'loss': 'coxph', 'learning_rate': 0.0002763492252163088, 'n_estimators': 419, 'criterion': 'squared_error', 'min_samples_split': 8, 'min_samples_leaf': 7, 'min_weight_fraction_leaf': 0.24253413075200025, 'min_impurity_decrease': 0.04062619430360659, 'max_features': 0.9994370029811488, 'subsample': 0.25475558575778834, 'dropout_rate': 0.15528263005243406, 'ccp_alpha': 0.153777481323299}. Best is trial 187 with value: 0.6933481836305168.[0m
[32m[I 2022-04-22 01:07:12,615][0m Trial 753 finished with value: 0.6892031267501044 and parameters: {'loss': 'coxph', 'learning_rate': 0.00022713496410333553, 'n_estimators': 374, 'criterion': 'absolute_error', 'min_samples_split': 7, 'min_samples_leaf': 8, 'min_weight_fraction_leaf': 0.24023321274811496, 'min_impurity_decrease': 0.017237344178639945, 'max_features': 0.9193899618715496, 'subsample': 0.24454631741142935, 'dropout_rate': 0.0829043989530065, 'ccp_alpha': 0.08233089136389594}. Best is trial 187 with value: 0.6933481836305168.[0m
[32m[I 2022-04-22 01:07:42,158][0m Trial 754 finished with value: 0.6749829968885491 and parameters: {'loss': 'coxph', 'learning_rate': 0.00016463512652918323, 'n_estimators': 343, 'criterion': 'squared_error', 'min_samples_split': 7, 'min_samples_leaf': 5, 'min_weight_fraction_leaf': 0.22943792444068042, 'min_impurity_decrease': 0.04799918618609761, 'max_features': 0.612223292891923, 'subsample': 0.16913490181164642, 'dropout_rate': 0.10536254349738111, 'ccp_alpha': 0.24655241958243115}. Best is trial 187 with value: 0.6933481836305168.[0m
[32m[I 2022-04-22 01:08:01,678][0m Trial 755 finished with value: 0.5413267380158759 and parameters: {'loss': 'coxph', 'learning_rate': 3.953776143180068e-05, 'n_estimators': 282, 'criterion': 'squared_error', 'min_samples_split': 7, 'min_samples_leaf': 7, 'min_weight_fraction_leaf': 0.24560568262861304, 'min_impurity_decrease': 0.5942193005076439, 'max_features': 0.8734444735061516, 'subsample': 0.2657236201067943, 'dropout_rate': 0.1308482602906874, 'ccp_alpha': 0.45321482480029696}. Best is trial 187 with value: 0.6933481836305168.[0m
[32m[I 2022-04-22 01:08:18,034][0m Trial 756 finished with value: 0.6891982896590507 and parameters: {'loss': 'coxph', 'learning_rate': 3.284545463544499e-05, 'n_estimators': 308, 'criterion': 'squared_error', 'min_samples_split': 7, 'min_samples_leaf': 9, 'min_weight_fraction_leaf': 0.23297231002427504, 'min_impurity_decrease': 0.01956333949076452, 'max_features': 0.9419607673569051, 'subsample': 0.22924173495742386, 'dropout_rate': 0.5855395071357169, 'ccp_alpha': 0.08342303786272931}. Best is trial 187 with value: 0.6933481836305168.[0m
[32m[I 2022-04-22 01:09:03,671][0m Trial 757 finished with value: 0.6851633230590508 and parameters: {'loss': 'coxph', 'learning_rate': 0.0001875301906109969, 'n_estimators': 456, 'criterion': 'friedman_mse', 'min_samples_split': 7, 'min_samples_leaf': 8, 'min_weight_fraction_leaf': 0.22379283581328435, 'min_impurity_decrease': 0.03652327332993486, 'max_features': 0.7715565348759736, 'subsample': 0.19847461049196602, 'dropout_rate': 0.09987449788992617, 'ccp_alpha': 0.18277381601291884}. Best is trial 187 with value: 0.6933481836305168.[0m
[32m[I 2022-04-22 01:09:11,894][0m Trial 758 finished with value: 0.6897723662106504 and parameters: {'loss': 'coxph', 'learning_rate': 4.493204123762607e-05, 'n_estimators': 255, 'criterion': 'squared_error', 'min_samples_split': 7, 'min_samples_leaf': 4, 'min_weight_fraction_leaf': 0.21958145480900465, 'min_impurity_decrease': 0.056553350245671, 'max_features': 0.7997018476166531, 'subsample': 0.2585317423801244, 'dropout_rate': 0.6613715166768913, 'ccp_alpha': 0.004283172993755011}. Best is trial 187 with value: 0.6933481836305168.[0m
[32m[I 2022-04-22 01:09:19,128][0m Trial 759 finished with value: 0.6906361260927965 and parameters: {'loss': 'coxph', 'learning_rate': 2.4086470196807463e-05, 'n_estimators': 242, 'criterion': 'squared_error', 'min_samples_split': 7, 'min_samples_leaf': 6, 'min_weight_fraction_leaf': 0.23961023625647337, 'min_impurity_decrease': 0.05749226496901183, 'max_features': 0.7907999352548304, 'subsample': 0.25377871683130615, 'dropout_rate': 0.6806965790089816, 'ccp_alpha': 0.001491453747920841}. Best is trial 187 with value: 0.6933481836305168.[0m
/media/san2_ssd/data/Workdir/survival/venv/lib/python3.8/site-packages/sksurv/ensemble/boosting.py:955: RuntimeWarning: divide by zero encountered in log
  time = numpy.log(time)
/media/san2_ssd/data/Workdir/survival/venv/lib/python3.8/site-packages/sksurv/ensemble/boosting.py:955: RuntimeWarning: divide by zero encountered in log
  time = numpy.log(time)
/media/san2_ssd/data/Workdir/survival/venv/lib/python3.8/site-packages/sksurv/ensemble/boosting.py:955: RuntimeWarning: divide by zero encountered in log
  time = numpy.log(time)
/media/san2_ssd/data/Workdir/survival/venv/lib/python3.8/site-packages/sksurv/ensemble/boosting.py:955: RuntimeWarning: divide by zero encountered in log
  time = numpy.log(time)
[32m[I 2022-04-22 01:09:20,085][0m Trial 760 finished with value: -0.7309607704001715 and parameters: {'loss': 'squared', 'learning_rate': 1.4508356919924784e-05, 'n_estimators': 232, 'criterion': 'squared_error', 'min_samples_split': 5, 'min_samples_leaf': 6, 'min_weight_fraction_leaf': 0.2546334382671061, 'min_impurity_decrease': 0.05142280783418763, 'max_features': 0.733021381755172, 'subsample': 0.2510680197543975, 'dropout_rate': 0.6989434075463911, 'ccp_alpha': 0.004013911343404005}. Best is trial 187 with value: 0.6933481836305168.[0m
[32m[I 2022-04-22 01:09:25,286][0m Trial 761 finished with value: 0.6904303276652325 and parameters: {'loss': 'coxph', 'learning_rate': 2.703064612181191e-05, 'n_estimators': 254, 'criterion': 'squared_error', 'min_samples_split': 7, 'min_samples_leaf': 4, 'min_weight_fraction_leaf': 0.2470040359527408, 'min_impurity_decrease': 0.01868420763370109, 'max_features': 0.7550107498295539, 'subsample': 0.2471737189997647, 'dropout_rate': 0.7059563014067209, 'ccp_alpha': 0.09229135060885374}. Best is trial 187 with value: 0.6933481836305168.[0m
[32m[I 2022-04-22 01:09:29,562][0m Trial 762 finished with value: 0.6894967011909203 and parameters: {'loss': 'coxph', 'learning_rate': 1.597522784448054e-05, 'n_estimators': 241, 'criterion': 'squared_error', 'min_samples_split': 7, 'min_samples_leaf': 4, 'min_weight_fraction_leaf': 0.26441853648196467, 'min_impurity_decrease': 0.032721946717715035, 'max_features': 0.7706091595759319, 'subsample': 0.24033441685621368, 'dropout_rate': 0.7702789036952912, 'ccp_alpha': 0.005011383657449214}. Best is trial 187 with value: 0.6933481836305168.[0m
[32m[I 2022-04-22 01:09:34,991][0m Trial 763 finished with value: 0.6637865011237818 and parameters: {'loss': 'coxph', 'learning_rate': 9.507501420911618e-06, 'n_estimators': 223, 'criterion': 'squared_error', 'min_samples_split': 7, 'min_samples_leaf': 4, 'min_weight_fraction_leaf': 0.2771994007196739, 'min_impurity_decrease': 0.2209922508031425, 'max_features': 0.7533479620595033, 'subsample': 0.23730736359825952, 'dropout_rate': 0.7075746734865624, 'ccp_alpha': 0.06564032189682047}. Best is trial 187 with value: 0.6933481836305168.[0m
[32m[I 2022-04-22 01:09:41,457][0m Trial 764 finished with value: 0.6896032275673692 and parameters: {'loss': 'coxph', 'learning_rate': 1.685635669807187e-05, 'n_estimators': 235, 'criterion': 'squared_error', 'min_samples_split': 7, 'min_samples_leaf': 4, 'min_weight_fraction_leaf': 0.270182900634463, 'min_impurity_decrease': 0.017237351261941262, 'max_features': 0.7325235186471533, 'subsample': 0.22265203788940202, 'dropout_rate': 0.7924969839534053, 'ccp_alpha': 0.07940317035757886}. Best is trial 187 with value: 0.6933481836305168.[0m
[32m[I 2022-04-22 01:09:48,069][0m Trial 765 finished with value: 0.6900399785479991 and parameters: {'loss': 'coxph', 'learning_rate': 1.578973977261677e-05, 'n_estimators': 232, 'criterion': 'squared_error', 'min_samples_split': 7, 'min_samples_leaf': 4, 'min_weight_fraction_leaf': 0.2891931156018536, 'min_impurity_decrease': 0.002441008554820167, 'max_features': 0.7499570997012203, 'subsample': 0.21860237711883646, 'dropout_rate': 0.8157575676960058, 'ccp_alpha': 0.009492005436939205}. Best is trial 187 with value: 0.6933481836305168.[0m
[32m[I 2022-04-22 01:09:57,639][0m Trial 766 finished with value: 0.6900399785479991 and parameters: {'loss': 'coxph', 'learning_rate': 1.2448202422704461e-05, 'n_estimators': 224, 'criterion': 'squared_error', 'min_samples_split': 7, 'min_samples_leaf': 3, 'min_weight_fraction_leaf': 0.2731815587741236, 'min_impurity_decrease': 0.011066379402988602, 'max_features': 0.7310536701066164, 'subsample': 0.2169195516671308, 'dropout_rate': 0.7576649793288609, 'ccp_alpha': 0.0012528474144832412}. Best is trial 187 with value: 0.6933481836305168.[0m
[32m[I 2022-04-22 01:10:00,738][0m Trial 767 finished with value: 0.6860606188762747 and parameters: {'loss': 'coxph', 'learning_rate': 7.838179318509655e-06, 'n_estimators': 215, 'criterion': 'squared_error', 'min_samples_split': 6, 'min_samples_leaf': 4, 'min_weight_fraction_leaf': 0.2924578684065331, 'min_impurity_decrease': 0.007603100060446074, 'max_features': 0.7405016500614948, 'subsample': 0.21576303869614982, 'dropout_rate': 0.7923993960287701, 'ccp_alpha': 0.0016596705067016427}. Best is trial 187 with value: 0.6933481836305168.[0m
