[32m[I 2022-04-21 20:31:17,324][0m Trial 810 finished with value: -0.4670319442700867 and parameters: {'loss': 'squared', 'learning_rate': 0.00014456274963678176, 'n_estimators': 281, 'criterion': 'friedman_mse', 'min_samples_split': 2, 'min_samples_leaf': 1, 'min_weight_fraction_leaf': 0.09467721221671364, 'min_impurity_decrease': 0.1421035679057061, 'max_features': 0.2535478975716145, 'subsample': 0.02004222135528588, 'dropout_rate': 0.9172592048844168, 'ccp_alpha': 0.004021182112570784}. Best is trial 802 with value: 0.8492679411913457.[0m
[32m[I 2022-04-21 20:31:19,654][0m Trial 811 finished with value: 0.65 and parameters: {'loss': 'coxph', 'learning_rate': 0.00035739792053887193, 'n_estimators': 260, 'criterion': 'friedman_mse', 'min_samples_split': 2, 'min_samples_leaf': 1, 'min_weight_fraction_leaf': 0.10381249494828801, 'min_impurity_decrease': 0.2153525559431387, 'max_features': 0.2780650828333482, 'subsample': 0.0329868655977777, 'dropout_rate': 0.9895285006124575, 'ccp_alpha': 2.7974234138539815}. Best is trial 802 with value: 0.8492679411913457.[0m
[32m[I 2022-04-21 20:31:22,297][0m Trial 812 finished with value: 0.8483591754861589 and parameters: {'loss': 'coxph', 'learning_rate': 0.0002845397467509023, 'n_estimators': 291, 'criterion': 'friedman_mse', 'min_samples_split': 2, 'min_samples_leaf': 1, 'min_weight_fraction_leaf': 0.10235538663952368, 'min_impurity_decrease': 0.1859667951435196, 'max_features': 0.22905622046869978, 'subsample': 0.046429959287171696, 'dropout_rate': 0.9972904734231961, 'ccp_alpha': 0.0015635236413842836}. Best is trial 802 with value: 0.8492679411913457.[0m
[32m[I 2022-04-21 20:31:26,035][0m Trial 813 finished with value: 0.8430051226093769 and parameters: {'loss': 'coxph', 'learning_rate': 0.0003178159706352694, 'n_estimators': 282, 'criterion': 'friedman_mse', 'min_samples_split': 2, 'min_samples_leaf': 1, 'min_weight_fraction_leaf': 0.08922920551747858, 'min_impurity_decrease': 0.19384609455487048, 'max_features': 0.2135158822945774, 'subsample': 0.015156385993098837, 'dropout_rate': 0.9677135782279931, 'ccp_alpha': 0.2194736104533146}. Best is trial 802 with value: 0.8492679411913457.[0m
[32m[I 2022-04-21 20:31:30,674][0m Trial 814 finished with value: 0.65 and parameters: {'loss': 'coxph', 'learning_rate': 0.00037702889207088494, 'n_estimators': 277, 'criterion': 'squared_error', 'min_samples_split': 2, 'min_samples_leaf': 1, 'min_weight_fraction_leaf': 0.09490843413346153, 'min_impurity_decrease': 0.17715226754175387, 'max_features': 0.24705354366955884, 'subsample': 0.04992065759894322, 'dropout_rate': 0.9752014307175065, 'ccp_alpha': 1.5147259986193835}. Best is trial 802 with value: 0.8492679411913457.[0m
[32m[I 2022-04-21 20:31:33,688][0m Trial 815 finished with value: 0.8464809065251775 and parameters: {'loss': 'coxph', 'learning_rate': 0.00027396694201023864, 'n_estimators': 256, 'criterion': 'friedman_mse', 'min_samples_split': 2, 'min_samples_leaf': 1, 'min_weight_fraction_leaf': 0.09982821492507463, 'min_impurity_decrease': 0.14930345014638308, 'max_features': 0.19619178402704635, 'subsample': 0.04097559386527219, 'dropout_rate': 0.9995369935566794, 'ccp_alpha': 0.005807014598854784}. Best is trial 802 with value: 0.8492679411913457.[0m
[32m[I 2022-04-21 20:31:36,432][0m Trial 816 finished with value: 0.65 and parameters: {'loss': 'coxph', 'learning_rate': 0.0002725837303745175, 'n_estimators': 257, 'criterion': 'friedman_mse', 'min_samples_split': 2, 'min_samples_leaf': 1, 'min_weight_fraction_leaf': 0.07260468517541382, 'min_impurity_decrease': 0.12642593976761607, 'max_features': 0.24760164730455875, 'subsample': 0.013173072970946668, 'dropout_rate': 0.9823829670319129, 'ccp_alpha': 4.318295401803647}. Best is trial 802 with value: 0.8492679411913457.[0m
[32m[I 2022-04-21 20:31:41,176][0m Trial 817 finished with value: 0.65 and parameters: {'loss': 'coxph', 'learning_rate': 0.00027371616428897405, 'n_estimators': 257, 'criterion': 'friedman_mse', 'min_samples_split': 2, 'min_samples_leaf': 1, 'min_weight_fraction_leaf': 0.08489354978010547, 'min_impurity_decrease': 0.15201667840527502, 'max_features': 0.18998950722248018, 'subsample': 0.005031131670119836, 'dropout_rate': 0.9447770464784533, 'ccp_alpha': 0.0827529506425678}. Best is trial 802 with value: 0.8492679411913457.[0m
[32m[I 2022-04-21 20:31:44,647][0m Trial 818 finished with value: 0.65 and parameters: {'loss': 'coxph', 'learning_rate': 0.0003956185890895987, 'n_estimators': 266, 'criterion': 'friedman_mse', 'min_samples_split': 2, 'min_samples_leaf': 1, 'min_weight_fraction_leaf': 0.1034814591779321, 'min_impurity_decrease': 0.15149655062482328, 'max_features': 0.242833367526921, 'subsample': 0.0019270501465711992, 'dropout_rate': 0.994626351019508, 'ccp_alpha': 2.447933605640061}. Best is trial 802 with value: 0.8492679411913457.[0m
[32m[I 2022-04-21 20:31:50,666][0m Trial 819 finished with value: 0.8449878724535809 and parameters: {'loss': 'coxph', 'learning_rate': 0.00031147019585531596, 'n_estimators': 251, 'criterion': 'friedman_mse', 'min_samples_split': 2, 'min_samples_leaf': 1, 'min_weight_fraction_leaf': 0.08372528916128594, 'min_impurity_decrease': 0.17088725113054223, 'max_features': 0.23695795703405875, 'subsample': 0.036274822131110065, 'dropout_rate': 0.9012203035054972, 'ccp_alpha': 0.008208542678854907}. Best is trial 802 with value: 0.8492679411913457.[0m
[32m[I 2022-04-21 20:31:54,919][0m Trial 820 finished with value: 0.8471708164536947 and parameters: {'loss': 'coxph', 'learning_rate': 0.0002661184179659244, 'n_estimators': 260, 'criterion': 'friedman_mse', 'min_samples_split': 2, 'min_samples_leaf': 1, 'min_weight_fraction_leaf': 0.11032827502056808, 'min_impurity_decrease': 0.13796463282883192, 'max_features': 0.15607666043367316, 'subsample': 0.03411242468950336, 'dropout_rate': 0.9605676224818045, 'ccp_alpha': 0.15252313665884004}. Best is trial 802 with value: 0.8492679411913457.[0m
[32m[I 2022-04-21 20:31:59,449][0m Trial 821 finished with value: 0.845878300004933 and parameters: {'loss': 'coxph', 'learning_rate': 0.00023409014655062727, 'n_estimators': 276, 'criterion': 'absolute_error', 'min_samples_split': 2, 'min_samples_leaf': 1, 'min_weight_fraction_leaf': 0.10735819869610745, 'min_impurity_decrease': 0.10952665165954857, 'max_features': 0.1362979790318813, 'subsample': 0.02301483815516463, 'dropout_rate': 0.9756651785146283, 'ccp_alpha': 0.33074750343552384}. Best is trial 802 with value: 0.8492679411913457.[0m
[32m[I 2022-04-21 20:32:03,435][0m Trial 822 finished with value: 0.8470819654976454 and parameters: {'loss': 'coxph', 'learning_rate': 0.00039366054105965004, 'n_estimators': 269, 'criterion': 'friedman_mse', 'min_samples_split': 2, 'min_samples_leaf': 1, 'min_weight_fraction_leaf': 0.10860912771733604, 'min_impurity_decrease': 0.12782842621656312, 'max_features': 0.11563018985402418, 'subsample': 0.02833646343523339, 'dropout_rate': 0.9671250963033605, 'ccp_alpha': 0.27269004988581175}. Best is trial 802 with value: 0.8492679411913457.[0m
[32m[I 2022-04-21 20:32:07,582][0m Trial 823 finished with value: 0.8380886406156224 and parameters: {'loss': 'coxph', 'learning_rate': 0.00048644924951733173, 'n_estimators': 269, 'criterion': 'friedman_mse', 'min_samples_split': 2, 'min_samples_leaf': 1, 'min_weight_fraction_leaf': 0.10455133893471404, 'min_impurity_decrease': 0.10967987622535603, 'max_features': 0.08519055581122907, 'subsample': 0.020079990909486124, 'dropout_rate': 0.9612502551021725, 'ccp_alpha': 0.39823639305917186}. Best is trial 802 with value: 0.8492679411913457.[0m
[32m[I 2022-04-21 20:32:10,640][0m Trial 824 finished with value: 0.8455458703161929 and parameters: {'loss': 'coxph', 'learning_rate': 0.00045528432703378403, 'n_estimators': 273, 'criterion': 'friedman_mse', 'min_samples_split': 2, 'min_samples_leaf': 1, 'min_weight_fraction_leaf': 0.09986349369657663, 'min_impurity_decrease': 0.08864089925304713, 'max_features': 0.10307631587902778, 'subsample': 0.02809177178705495, 'dropout_rate': 0.9655273097637167, 'ccp_alpha': 0.26539208622037985}. Best is trial 802 with value: 0.8492679411913457.[0m
[32m[I 2022-04-21 20:32:15,008][0m Trial 825 finished with value: 0.65 and parameters: {'loss': 'coxph', 'learning_rate': 0.0003557879812620113, 'n_estimators': 285, 'criterion': 'friedman_mse', 'min_samples_split': 2, 'min_samples_leaf': 1, 'min_weight_fraction_leaf': 0.05374616775614449, 'min_impurity_decrease': 0.12129546119854086, 'max_features': 0.18198953236878523, 'subsample': 0.0034433061820994884, 'dropout_rate': 0.9361814580021585, 'ccp_alpha': 0.15117504488210104}. Best is trial 802 with value: 0.8492679411913457.[0m
[32m[I 2022-04-21 20:32:21,240][0m Trial 826 finished with value: 0.65 and parameters: {'loss': 'coxph', 'learning_rate': 0.00039358154495632486, 'n_estimators': 269, 'criterion': 'friedman_mse', 'min_samples_split': 2, 'min_samples_leaf': 1, 'min_weight_fraction_leaf': 0.11071667671206648, 'min_impurity_decrease': 0.13091867660269713, 'max_features': 0.16402251504138682, 'subsample': 0.001239985266415597, 'dropout_rate': 0.9502076857823761, 'ccp_alpha': 0.2569113878195098}. Best is trial 802 with value: 0.8492679411913457.[0m
[32m[I 2022-04-21 20:32:24,067][0m Trial 827 finished with value: 0.8457415357277777 and parameters: {'loss': 'coxph', 'learning_rate': 0.00031392095201291796, 'n_estimators': 187, 'criterion': 'friedman_mse', 'min_samples_split': 2, 'min_samples_leaf': 1, 'min_weight_fraction_leaf': 0.09580421121919913, 'min_impurity_decrease': 0.09594164510267336, 'max_features': 0.12026505162561218, 'subsample': 0.03534624357873875, 'dropout_rate': 0.9408374460714207, 'ccp_alpha': 0.1464692090761304}. Best is trial 802 with value: 0.8492679411913457.[0m
[32m[I 2022-04-21 20:32:30,555][0m Trial 828 finished with value: 0.8455805155467042 and parameters: {'loss': 'coxph', 'learning_rate': 0.00042555980897220736, 'n_estimators': 289, 'criterion': 'friedman_mse', 'min_samples_split': 2, 'min_samples_leaf': 1, 'min_weight_fraction_leaf': 0.11356378692137754, 'min_impurity_decrease': 0.13700479827238746, 'max_features': 0.1468258631996955, 'subsample': 0.04297158635252109, 'dropout_rate': 0.8454125679998913, 'ccp_alpha': 0.16642397774522596}. Best is trial 802 with value: 0.8492679411913457.[0m
[32m[I 2022-04-21 20:32:33,506][0m Trial 829 finished with value: 0.8461204195270122 and parameters: {'loss': 'coxph', 'learning_rate': 0.0003482271186402088, 'n_estimators': 285, 'criterion': 'friedman_mse', 'min_samples_split': 2, 'min_samples_leaf': 1, 'min_weight_fraction_leaf': 0.11516896847179732, 'min_impurity_decrease': 0.13108533447978576, 'max_features': 0.05737662950707034, 'subsample': 0.030010064511160017, 'dropout_rate': 0.9798954204136948, 'ccp_alpha': 0.3047950875025733}. Best is trial 802 with value: 0.8492679411913457.[0m
[32m[I 2022-04-21 20:32:35,950][0m Trial 830 finished with value: 0.8476335369804577 and parameters: {'loss': 'coxph', 'learning_rate': 0.00023311822083443569, 'n_estimators': 261, 'criterion': 'friedman_mse', 'min_samples_split': 2, 'min_samples_leaf': 1, 'min_weight_fraction_leaf': 0.08481065024821303, 'min_impurity_decrease': 0.15902290107989892, 'max_features': 0.07549330721090985, 'subsample': 0.04312886988379519, 'dropout_rate': 0.9926678181837731, 'ccp_alpha': 0.08403275037559287}. Best is trial 802 with value: 0.8492679411913457.[0m
/media/san2_ssd/data/Workdir/survival/venv/lib/python3.8/site-packages/sksurv/ensemble/boosting.py:955: RuntimeWarning: divide by zero encountered in log
  time = numpy.log(time)
/media/san2_ssd/data/Workdir/survival/venv/lib/python3.8/site-packages/sksurv/ensemble/boosting.py:955: RuntimeWarning: divide by zero encountered in log
  time = numpy.log(time)
/media/san2_ssd/data/Workdir/survival/venv/lib/python3.8/site-packages/sksurv/ensemble/boosting.py:955: RuntimeWarning: divide by zero encountered in log
  time = numpy.log(time)
/media/san2_ssd/data/Workdir/survival/venv/lib/python3.8/site-packages/sksurv/ensemble/boosting.py:955: RuntimeWarning: divide by zero encountered in log
  time = numpy.log(time)
[32m[I 2022-04-21 20:32:36,342][0m Trial 831 finished with value: -0.45 and parameters: {'loss': 'squared', 'learning_rate': 0.00023691510635284106, 'n_estimators': 260, 'criterion': 'friedman_mse', 'min_samples_split': 2, 'min_samples_leaf': 7, 'min_weight_fraction_leaf': 0.07849584820423929, 'min_impurity_decrease': 0.1846430134732456, 'max_features': 0.10614573072686509, 'subsample': 0.024278326931344206, 'dropout_rate': 0.9872890067138856, 'ccp_alpha': 0.38248122839965865}. Best is trial 802 with value: 0.8492679411913457.[0m
[32m[I 2022-04-21 20:32:39,791][0m Trial 832 finished with value: 0.8449531860704385 and parameters: {'loss': 'coxph', 'learning_rate': 0.0004932486379434277, 'n_estimators': 265, 'criterion': 'friedman_mse', 'min_samples_split': 2, 'min_samples_leaf': 1, 'min_weight_fraction_leaf': 0.06732637307379927, 'min_impurity_decrease': 0.07282854694033439, 'max_features': 0.08487620450265135, 'subsample': 0.04573451852953439, 'dropout_rate': 0.9508783370677361, 'ccp_alpha': 0.18924049275492572}. Best is trial 802 with value: 0.8492679411913457.[0m
[32m[I 2022-04-21 20:32:41,418][0m Trial 833 finished with value: 0.8457959327677482 and parameters: {'loss': 'coxph', 'learning_rate': 0.0002901556682959936, 'n_estimators': 163, 'criterion': 'friedman_mse', 'min_samples_split': 2, 'min_samples_leaf': 1, 'min_weight_fraction_leaf': 0.07683323350210962, 'min_impurity_decrease': 0.1628602784772537, 'max_features': 0.1336935811621049, 'subsample': 0.020652137028420114, 'dropout_rate': 0.9797937952534135, 'ccp_alpha': 0.08432259893044378}. Best is trial 802 with value: 0.8492679411913457.[0m
[32m[I 2022-04-21 20:32:44,144][0m Trial 834 finished with value: 0.8459051342927875 and parameters: {'loss': 'coxph', 'learning_rate': 0.00035932435885297203, 'n_estimators': 270, 'criterion': 'friedman_mse', 'min_samples_split': 2, 'min_samples_leaf': 1, 'min_weight_fraction_leaf': 0.08615094367550363, 'min_impurity_decrease': 0.11198143336014574, 'max_features': 0.02787334290446901, 'subsample': 0.03235780505316708, 'dropout_rate': 0.9938432453236488, 'ccp_alpha': 0.25506703139651765}. Best is trial 802 with value: 0.8492679411913457.[0m
[32m[I 2022-04-21 20:32:47,091][0m Trial 835 finished with value: 0.8389285989222366 and parameters: {'loss': 'coxph', 'learning_rate': 0.00023200125936692398, 'n_estimators': 258, 'criterion': 'friedman_mse', 'min_samples_split': 2, 'min_samples_leaf': 1, 'min_weight_fraction_leaf': 0.09080804673775195, 'min_impurity_decrease': 0.14801431732072143, 'max_features': 0.12601071464031116, 'subsample': 0.0495533580061026, 'dropout_rate': 0.9953081044044001, 'ccp_alpha': 0.5141649603924667}. Best is trial 802 with value: 0.8492679411913457.[0m
[32m[I 2022-04-21 20:32:51,617][0m Trial 836 finished with value: 0.8483490876983808 and parameters: {'loss': 'coxph', 'learning_rate': 0.00041451666046947455, 'n_estimators': 277, 'criterion': 'friedman_mse', 'min_samples_split': 2, 'min_samples_leaf': 1, 'min_weight_fraction_leaf': 0.09866772649060357, 'min_impurity_decrease': 0.19874096624504242, 'max_features': 0.22491332172223638, 'subsample': 0.048555306692123615, 'dropout_rate': 0.9661921591226028, 'ccp_alpha': 0.1615088105687843}. Best is trial 802 with value: 0.8492679411913457.[0m
[32m[I 2022-04-21 20:32:56,556][0m Trial 837 finished with value: 0.8410701520986459 and parameters: {'loss': 'coxph', 'learning_rate': 0.00030206206163630985, 'n_estimators': 273, 'criterion': 'friedman_mse', 'min_samples_split': 2, 'min_samples_leaf': 1, 'min_weight_fraction_leaf': 0.09584070509373739, 'min_impurity_decrease': 0.20456788550703509, 'max_features': 0.1556728020416601, 'subsample': 0.05409371728976624, 'dropout_rate': 0.9610563625340088, 'ccp_alpha': 0.36572348327529003}. Best is trial 802 with value: 0.8492679411913457.[0m
[32m[I 2022-04-21 20:33:00,671][0m Trial 838 finished with value: 0.844827263720019 and parameters: {'loss': 'coxph', 'learning_rate': 0.0004053961493562837, 'n_estimators': 254, 'criterion': 'squared_error', 'min_samples_split': 2, 'min_samples_leaf': 1, 'min_weight_fraction_leaf': 0.0992512570882377, 'min_impurity_decrease': 0.1771516833107542, 'max_features': 0.08580558543111844, 'subsample': 0.053681935496644975, 'dropout_rate': 0.9356422071967108, 'ccp_alpha': 0.232408515181401}. Best is trial 802 with value: 0.8492679411913457.[0m
[32m[I 2022-04-21 20:33:03,793][0m Trial 839 finished with value: 0.8474579483984132 and parameters: {'loss': 'coxph', 'learning_rate': 0.0002736096790624393, 'n_estimators': 274, 'criterion': 'friedman_mse', 'min_samples_split': 2, 'min_samples_leaf': 1, 'min_weight_fraction_leaf': 0.08638349356256937, 'min_impurity_decrease': 0.19204300909887778, 'max_features': 0.07496880226036225, 'subsample': 0.025128686925090432, 'dropout_rate': 0.9616895370162265, 'ccp_alpha': 0.17269185203473017}. Best is trial 802 with value: 0.8492679411913457.[0m
[32m[I 2022-04-21 20:33:07,564][0m Trial 840 finished with value: 0.838357272852701 and parameters: {'loss': 'coxph', 'learning_rate': 0.00032483350628421205, 'n_estimators': 267, 'criterion': 'friedman_mse', 'min_samples_split': 2, 'min_samples_leaf': 1, 'min_weight_fraction_leaf': 0.07262284492103341, 'min_impurity_decrease': 0.19297558090818395, 'max_features': 0.06785012492044724, 'subsample': 0.01833426897165492, 'dropout_rate': 0.9590605357197013, 'ccp_alpha': 0.4176411947439008}. Best is trial 802 with value: 0.8492679411913457.[0m
[32m[I 2022-04-21 20:33:10,845][0m Trial 841 finished with value: 0.65 and parameters: {'loss': 'coxph', 'learning_rate': 0.00040471868686774994, 'n_estimators': 278, 'criterion': 'friedman_mse', 'min_samples_split': 2, 'min_samples_leaf': 1, 'min_weight_fraction_leaf': 0.10138500973324094, 'min_impurity_decrease': 0.19673529617715782, 'max_features': 0.14760767360806681, 'subsample': 0.013798830539976908, 'dropout_rate': 0.9727514406251766, 'ccp_alpha': 0.313247000096338}. Best is trial 802 with value: 0.8492679411913457.[0m
[32m[I 2022-04-21 20:33:14,856][0m Trial 842 finished with value: 0.65 and parameters: {'loss': 'coxph', 'learning_rate': 0.00027143943385610106, 'n_estimators': 261, 'criterion': 'friedman_mse', 'min_samples_split': 2, 'min_samples_leaf': 1, 'min_weight_fraction_leaf': 0.08377272155859747, 'min_impurity_decrease': 0.18161092064448242, 'max_features': 0.07708685561669971, 'subsample': 0.0011880368290615728, 'dropout_rate': 0.9377045614018572, 'ccp_alpha': 0.21019528975786927}. Best is trial 802 with value: 0.8492679411913457.[0m
[32m[I 2022-04-21 20:33:17,183][0m Trial 843 finished with value: 0.65 and parameters: {'loss': 'coxph', 'learning_rate': 0.00032793529031439536, 'n_estimators': 251, 'criterion': 'absolute_error', 'min_samples_split': 2, 'min_samples_leaf': 1, 'min_weight_fraction_leaf': 0.07015052606791672, 'min_impurity_decrease': 0.16951374466887859, 'max_features': 0.04357985363464993, 'subsample': 0.0020331540131649437, 'dropout_rate': 0.9749458374605698, 'ccp_alpha': 0.00363471647626522}. Best is trial 802 with value: 0.8492679411913457.[0m
[32m[I 2022-04-21 20:33:20,886][0m Trial 844 finished with value: 0.65 and parameters: {'loss': 'coxph', 'learning_rate': 0.0002679390710982437, 'n_estimators': 279, 'criterion': 'friedman_mse', 'min_samples_split': 2, 'min_samples_leaf': 10, 'min_weight_fraction_leaf': 0.08074968244464016, 'min_impurity_decrease': 0.20546364416143859, 'max_features': 0.04831698390192392, 'subsample': 0.03260114364745622, 'dropout_rate': 0.9486141302437036, 'ccp_alpha': 0.28800813937759684}. Best is trial 802 with value: 0.8492679411913457.[0m
[32m[I 2022-04-21 20:33:22,968][0m Trial 845 finished with value: 0.8475693436641049 and parameters: {'loss': 'coxph', 'learning_rate': 0.0004847645473050965, 'n_estimators': 266, 'criterion': 'friedman_mse', 'min_samples_split': 2, 'min_samples_leaf': 1, 'min_weight_fraction_leaf': 0.08383355124823555, 'min_impurity_decrease': 0.19172284283278826, 'max_features': 0.06758226594260884, 'subsample': 0.0268952905763062, 'dropout_rate': 0.9984280543268861, 'ccp_alpha': 0.17370575346454895}. Best is trial 802 with value: 0.8492679411913457.[0m
[32m[I 2022-04-21 20:33:25,115][0m Trial 846 finished with value: 0.8424554727846598 and parameters: {'loss': 'coxph', 'learning_rate': 0.0004736265450671611, 'n_estimators': 249, 'criterion': 'friedman_mse', 'min_samples_split': 2, 'min_samples_leaf': 1, 'min_weight_fraction_leaf': 0.08583379360317497, 'min_impurity_decrease': 0.21775836424951994, 'max_features': 0.06806099328299181, 'subsample': 0.0317468233040138, 'dropout_rate': 0.9954170544686939, 'ccp_alpha': 0.44781210875091104}. Best is trial 802 with value: 0.8492679411913457.[0m
[32m[I 2022-04-21 20:33:29,966][0m Trial 847 finished with value: 0.8456269073515514 and parameters: {'loss': 'coxph', 'learning_rate': 0.0005296286508089668, 'n_estimators': 277, 'criterion': 'friedman_mse', 'min_samples_split': 2, 'min_samples_leaf': 1, 'min_weight_fraction_leaf': 0.08053591295069766, 'min_impurity_decrease': 0.19455057673622014, 'max_features': 0.09634094525626186, 'subsample': 0.025878076440330727, 'dropout_rate': 0.9718969355523636, 'ccp_alpha': 0.3785030888560612}. Best is trial 802 with value: 0.8492679411913457.[0m
[32m[I 2022-04-21 20:33:34,830][0m Trial 848 finished with value: 0.837482776081502 and parameters: {'loss': 'coxph', 'learning_rate': 0.0004173463811528236, 'n_estimators': 262, 'criterion': 'friedman_mse', 'min_samples_split': 2, 'min_samples_leaf': 1, 'min_weight_fraction_leaf': 0.05208391739550148, 'min_impurity_decrease': 0.2111697477941694, 'max_features': 0.07053969220568254, 'subsample': 0.015104172391974646, 'dropout_rate': 0.8951730919201812, 'ccp_alpha': 0.784617987115511}. Best is trial 802 with value: 0.8492679411913457.[0m
