[32m[I 2022-04-21 11:38:20,058][0m Trial 505 finished with value: 0.8394676524280678 and parameters: {'splitter': 'best', 'min_samples_split': 0.276061052748267, 'min_samples_leaf': 0.026295247117382056, 'min_weight_fraction_leaf': 0.04721357944181745, 'max_features': 0.6900201740191091}. Best is trial 499 with value: 0.8396174698878165.[0m
[32m[I 2022-04-21 11:38:20,137][0m Trial 506 finished with value: 0.8322570148675416 and parameters: {'splitter': 'best', 'min_samples_split': 0.30405525836581604, 'min_samples_leaf': 0.0253497437630053, 'min_weight_fraction_leaf': 0.05900396807599563, 'max_features': 0.6619952537106977}. Best is trial 499 with value: 0.8396174698878165.[0m
[32m[I 2022-04-21 11:38:20,226][0m Trial 507 finished with value: 0.8340187950162761 and parameters: {'splitter': 'best', 'min_samples_split': 0.27522376125335457, 'min_samples_leaf': 0.024685425260461243, 'min_weight_fraction_leaf': 0.06669660466977602, 'max_features': 0.6821926410114981}. Best is trial 499 with value: 0.8396174698878165.[0m
[32m[I 2022-04-21 11:38:20,320][0m Trial 508 finished with value: 0.6656426807671247 and parameters: {'splitter': 'best', 'min_samples_split': 0.29413093874497415, 'min_samples_leaf': 0.3452448208938575, 'min_weight_fraction_leaf': 0.05039327581342933, 'max_features': 0.7040624251248707}. Best is trial 499 with value: 0.8396174698878165.[0m
[32m[I 2022-04-21 11:38:20,395][0m Trial 509 finished with value: 0.8374994682939777 and parameters: {'splitter': 'best', 'min_samples_split': 0.2791728305487737, 'min_samples_leaf': 0.01608445939968479, 'min_weight_fraction_leaf': 0.03102850203245014, 'max_features': 0.7277568448120367}. Best is trial 499 with value: 0.8396174698878165.[0m
[32m[I 2022-04-21 11:38:20,479][0m Trial 510 finished with value: 0.8356453536097854 and parameters: {'splitter': 'best', 'min_samples_split': 0.2862554638587438, 'min_samples_leaf': 0.012151410515241285, 'min_weight_fraction_leaf': 0.05018480732793137, 'max_features': 0.6872759731483881}. Best is trial 499 with value: 0.8396174698878165.[0m
[32m[I 2022-04-21 11:38:20,571][0m Trial 511 finished with value: 0.8334107142154489 and parameters: {'splitter': 'random', 'min_samples_split': 0.2789060858246114, 'min_samples_leaf': 0.026759327382181834, 'min_weight_fraction_leaf': 0.07482724917037317, 'max_features': 0.7210619128002127}. Best is trial 499 with value: 0.8396174698878165.[0m
[32m[I 2022-04-21 11:38:20,658][0m Trial 512 finished with value: 0.8327136347259619 and parameters: {'splitter': 'best', 'min_samples_split': 0.29211576873455086, 'min_samples_leaf': 0.02123005724145373, 'min_weight_fraction_leaf': 0.041890076542889204, 'max_features': 0.656562261348398}. Best is trial 499 with value: 0.8396174698878165.[0m
[32m[I 2022-04-21 11:38:20,737][0m Trial 513 finished with value: 0.8367492132316885 and parameters: {'splitter': 'best', 'min_samples_split': 0.2705317282497389, 'min_samples_leaf': 0.018483799844488478, 'min_weight_fraction_leaf': 0.03047884884267899, 'max_features': 0.7345986266707393}. Best is trial 499 with value: 0.8396174698878165.[0m
[32m[I 2022-04-21 11:38:20,828][0m Trial 514 finished with value: 0.833502860951816 and parameters: {'splitter': 'best', 'min_samples_split': 0.2513991263031764, 'min_samples_leaf': 0.027643957134493545, 'min_weight_fraction_leaf': 0.05976380440030482, 'max_features': 0.7009503244807639}. Best is trial 499 with value: 0.8396174698878165.[0m
[32m[I 2022-04-21 11:38:20,916][0m Trial 515 finished with value: 0.65 and parameters: {'splitter': 'best', 'min_samples_split': 0.2798452007588642, 'min_samples_leaf': 0.013509548612342628, 'min_weight_fraction_leaf': 0.354033969902019, 'max_features': 0.7566693587018135}. Best is trial 499 with value: 0.8396174698878165.[0m
[32m[I 2022-04-21 11:38:21,006][0m Trial 516 finished with value: 0.8394676524280678 and parameters: {'splitter': 'best', 'min_samples_split': 0.27572377518691665, 'min_samples_leaf': 0.0018319108957485179, 'min_weight_fraction_leaf': 0.044016685682250804, 'max_features': 0.638319498146991}. Best is trial 499 with value: 0.8396174698878165.[0m
[32m[I 2022-04-21 11:38:21,107][0m Trial 517 finished with value: 0.8340187950162761 and parameters: {'splitter': 'best', 'min_samples_split': 0.2947370069095738, 'min_samples_leaf': 0.009817217050773397, 'min_weight_fraction_leaf': 0.06801866305034494, 'max_features': 0.6678572442381253}. Best is trial 499 with value: 0.8396174698878165.[0m
[32m[I 2022-04-21 11:38:21,191][0m Trial 518 finished with value: 0.8356453536097854 and parameters: {'splitter': 'best', 'min_samples_split': 0.28023459190518657, 'min_samples_leaf': 0.001676403352360795, 'min_weight_fraction_leaf': 0.05168604043633486, 'max_features': 0.6520958826657194}. Best is trial 499 with value: 0.8396174698878165.[0m
[32m[I 2022-04-21 11:38:21,274][0m Trial 519 finished with value: 0.8352014009981168 and parameters: {'splitter': 'best', 'min_samples_split': 0.28464388276919356, 'min_samples_leaf': 0.01094571599701231, 'min_weight_fraction_leaf': 0.04347970714812222, 'max_features': 0.62333367210798}. Best is trial 499 with value: 0.8396174698878165.[0m
[32m[I 2022-04-21 11:38:21,358][0m Trial 520 finished with value: 0.8318450474400789 and parameters: {'splitter': 'best', 'min_samples_split': 0.30573541241968244, 'min_samples_leaf': 0.2240602094704725, 'min_weight_fraction_leaf': 0.0586746204607302, 'max_features': 0.7305167130882775}. Best is trial 499 with value: 0.8396174698878165.[0m
[32m[I 2022-04-21 11:38:21,456][0m Trial 521 finished with value: 0.8394676524280678 and parameters: {'splitter': 'best', 'min_samples_split': 0.27303928791327414, 'min_samples_leaf': 0.0016872245969153335, 'min_weight_fraction_leaf': 0.04650450523151604, 'max_features': 0.639891600605284}. Best is trial 499 with value: 0.8396174698878165.[0m
[32m[I 2022-04-21 11:38:21,547][0m Trial 522 finished with value: 0.8337666169009493 and parameters: {'splitter': 'best', 'min_samples_split': 0.27286387467684037, 'min_samples_leaf': 0.016279993263849164, 'min_weight_fraction_leaf': 0.07136896647299523, 'max_features': 0.6083664536827614}. Best is trial 499 with value: 0.8396174698878165.[0m
[32m[I 2022-04-21 11:38:21,641][0m Trial 523 finished with value: 0.8356453536097854 and parameters: {'splitter': 'best', 'min_samples_split': 0.2886822461356217, 'min_samples_leaf': 0.009279903197337201, 'min_weight_fraction_leaf': 0.05416592900714612, 'max_features': 0.645927911968716}. Best is trial 499 with value: 0.8396174698878165.[0m
[32m[I 2022-04-21 11:38:21,731][0m Trial 524 finished with value: 0.8316149506675705 and parameters: {'splitter': 'best', 'min_samples_split': 0.24626864420578057, 'min_samples_leaf': 0.027155827213881434, 'min_weight_fraction_leaf': 0.08657217735416366, 'max_features': 0.629315099903666}. Best is trial 499 with value: 0.8396174698878165.[0m
[32m[I 2022-04-21 11:38:21,829][0m Trial 525 finished with value: 0.8394676524280678 and parameters: {'splitter': 'best', 'min_samples_split': 0.2740415679466895, 'min_samples_leaf': 0.0014489698819465588, 'min_weight_fraction_leaf': 0.04477051300197929, 'max_features': 0.6950740976610523}. Best is trial 499 with value: 0.8396174698878165.[0m
[32m[I 2022-04-21 11:38:21,920][0m Trial 526 finished with value: 0.8180388147131256 and parameters: {'splitter': 'best', 'min_samples_split': 0.29891746717985956, 'min_samples_leaf': 0.00103761102018439, 'min_weight_fraction_leaf': 0.06112705126366236, 'max_features': 0.5831948084263086}. Best is trial 499 with value: 0.8396174698878165.[0m
[32m[I 2022-04-21 11:38:22,007][0m Trial 527 finished with value: 0.8386460587152798 and parameters: {'splitter': 'best', 'min_samples_split': 0.25731186879432844, 'min_samples_leaf': 0.016244544140933598, 'min_weight_fraction_leaf': 0.04841795329202289, 'max_features': 0.6858813814266232}. Best is trial 499 with value: 0.8396174698878165.[0m
[32m[I 2022-04-21 11:38:22,104][0m Trial 528 finished with value: 0.8386460587152798 and parameters: {'splitter': 'best', 'min_samples_split': 0.2594079683002262, 'min_samples_leaf': 0.019267568995495837, 'min_weight_fraction_leaf': 0.04788400531254521, 'max_features': 0.6827251118076155}. Best is trial 499 with value: 0.8396174698878165.[0m
[32m[I 2022-04-21 11:38:22,199][0m Trial 529 finished with value: 0.8328255155375228 and parameters: {'splitter': 'best', 'min_samples_split': 0.25380456777934873, 'min_samples_leaf': 0.026786394808976516, 'min_weight_fraction_leaf': 0.06801066956163676, 'max_features': 0.6792761844329658}. Best is trial 499 with value: 0.8396174698878165.[0m
[32m[I 2022-04-21 11:38:22,290][0m Trial 530 finished with value: 0.8330420598909939 and parameters: {'splitter': 'random', 'min_samples_split': 0.24617168775915346, 'min_samples_leaf': 0.018953917905177732, 'min_weight_fraction_leaf': 0.05180502200420252, 'max_features': 0.6905333998753252}. Best is trial 499 with value: 0.8396174698878165.[0m
[32m[I 2022-04-21 11:38:22,378][0m Trial 531 finished with value: 0.65 and parameters: {'splitter': 'best', 'min_samples_split': 0.25851712467148047, 'min_samples_leaf': 0.40589501143448486, 'min_weight_fraction_leaf': 0.06208858529504526, 'max_features': 0.6682490037514902}. Best is trial 499 with value: 0.8396174698878165.[0m
[32m[I 2022-04-21 11:38:22,488][0m Trial 532 finished with value: 0.8386460587152798 and parameters: {'splitter': 'best', 'min_samples_split': 0.2609818189863916, 'min_samples_leaf': 0.020007309649186303, 'min_weight_fraction_leaf': 0.047202363999282765, 'max_features': 0.7020142125113381}. Best is trial 499 with value: 0.8396174698878165.[0m
[32m[I 2022-04-21 11:38:22,538][0m Trial 533 finished with value: 0.8318869790887286 and parameters: {'splitter': 'best', 'min_samples_split': 0.24586833647696194, 'min_samples_leaf': 0.02853886145253741, 'min_weight_fraction_leaf': 0.07758904127352216, 'max_features': 0.6496894929363961}. Best is trial 499 with value: 0.8396174698878165.[0m
[32m[I 2022-04-21 11:38:22,587][0m Trial 534 finished with value: 0.8318450474400789 and parameters: {'splitter': 'best', 'min_samples_split': 0.25573647180182296, 'min_samples_leaf': 0.2532825527519177, 'min_weight_fraction_leaf': 0.057452582708179704, 'max_features': 0.6960830937804743}. Best is trial 499 with value: 0.8396174698878165.[0m
[32m[I 2022-04-21 11:38:22,633][0m Trial 535 finished with value: 0.8316149506675705 and parameters: {'splitter': 'best', 'min_samples_split': 0.2590301618999421, 'min_samples_leaf': 0.0288926728780248, 'min_weight_fraction_leaf': 0.0910086396808964, 'max_features': 0.6772460810175017}. Best is trial 499 with value: 0.8396174698878165.[0m
[32m[I 2022-04-21 11:38:22,692][0m Trial 536 finished with value: 0.8391063129816301 and parameters: {'splitter': 'best', 'min_samples_split': 0.12250998679572811, 'min_samples_leaf': 0.01779727765530141, 'min_weight_fraction_leaf': 0.047686800607450605, 'max_features': 0.6375938767868427}. Best is trial 499 with value: 0.8396174698878165.[0m
[32m[I 2022-04-21 11:38:22,784][0m Trial 537 finished with value: 0.8336210332407393 and parameters: {'splitter': 'best', 'min_samples_split': 0.03315462821911952, 'min_samples_leaf': 0.01699929019591701, 'min_weight_fraction_leaf': 0.06972083033524146, 'max_features': 0.6370445583937314}. Best is trial 499 with value: 0.8396174698878165.[0m
[32m[I 2022-04-21 11:38:22,844][0m Trial 538 finished with value: 0.8391063129816301 and parameters: {'splitter': 'best', 'min_samples_split': 0.12264102018863211, 'min_samples_leaf': 0.029613024354380166, 'min_weight_fraction_leaf': 0.04671073690787438, 'max_features': 0.658610476590567}. Best is trial 499 with value: 0.8396174698878165.[0m
[32m[I 2022-04-21 11:38:22,910][0m Trial 539 finished with value: 0.65 and parameters: {'splitter': 'best', 'min_samples_split': 0.11599540555079818, 'min_samples_leaf': 0.4985344517071896, 'min_weight_fraction_leaf': 0.04643877799698813, 'max_features': 0.5942867843283588}. Best is trial 499 with value: 0.8396174698878165.[0m
[32m[I 2022-04-21 11:38:23,018][0m Trial 540 finished with value: 0.8340130635607796 and parameters: {'splitter': 'best', 'min_samples_split': 0.10854991767589046, 'min_samples_leaf': 0.02972630679034851, 'min_weight_fraction_leaf': 0.05890710324625617, 'max_features': 0.6627286938177794}. Best is trial 499 with value: 0.8396174698878165.[0m
[32m[I 2022-04-21 11:38:23,104][0m Trial 541 finished with value: 0.8318450474400789 and parameters: {'splitter': 'best', 'min_samples_split': 0.09496996562011246, 'min_samples_leaf': 0.1152509306230583, 'min_weight_fraction_leaf': 0.043906016860105326, 'max_features': 0.6480746371515206}. Best is trial 499 with value: 0.8396174698878165.[0m
[32m[I 2022-04-21 11:38:23,172][0m Trial 542 finished with value: 0.8333498191213747 and parameters: {'splitter': 'best', 'min_samples_split': 0.11206125953030374, 'min_samples_leaf': 0.029158330199179874, 'min_weight_fraction_leaf': 0.06685917554501304, 'max_features': 0.6862786775797072}. Best is trial 499 with value: 0.8396174698878165.[0m
[32m[I 2022-04-21 11:38:23,225][0m Trial 543 finished with value: 0.8318450474400789 and parameters: {'splitter': 'best', 'min_samples_split': 0.09726565217029295, 'min_samples_leaf': 0.21190083573816137, 'min_weight_fraction_leaf': 0.05492997144864031, 'max_features': 0.6165987702302078}. Best is trial 499 with value: 0.8396174698878165.[0m
[32m[I 2022-04-21 11:38:23,338][0m Trial 544 finished with value: 0.8318869790887286 and parameters: {'splitter': 'best', 'min_samples_split': 0.12822110831621955, 'min_samples_leaf': 0.01909126829312286, 'min_weight_fraction_leaf': 0.07889324324613067, 'max_features': 0.697195309316884}. Best is trial 499 with value: 0.8396174698878165.[0m
[32m[I 2022-04-21 11:38:23,420][0m Trial 545 finished with value: 0.8391063129816301 and parameters: {'splitter': 'best', 'min_samples_split': 0.11855117178307575, 'min_samples_leaf': 0.031139118002901842, 'min_weight_fraction_leaf': 0.0473368054480535, 'max_features': 0.6386032211644433}. Best is trial 499 with value: 0.8396174698878165.[0m
[32m[I 2022-04-21 11:38:23,513][0m Trial 546 finished with value: 0.8391063129816301 and parameters: {'splitter': 'best', 'min_samples_split': 0.10881200717630805, 'min_samples_leaf': 0.03269628484055803, 'min_weight_fraction_leaf': 0.04331663607551091, 'max_features': 0.6258450852949482}. Best is trial 499 with value: 0.8396174698878165.[0m
[32m[I 2022-04-21 11:38:23,633][0m Trial 547 finished with value: 0.8350747161321781 and parameters: {'splitter': 'best', 'min_samples_split': 0.12150675214131602, 'min_samples_leaf': 0.03046989248084301, 'min_weight_fraction_leaf': 0.03827674957637222, 'max_features': 0.6271064383260324}. Best is trial 499 with value: 0.8396174698878165.[0m
[32m[I 2022-04-21 11:38:23,691][0m Trial 548 finished with value: 0.8391063129816301 and parameters: {'splitter': 'best', 'min_samples_split': 0.10710906802696675, 'min_samples_leaf': 0.0332208790249956, 'min_weight_fraction_leaf': 0.044355773271484385, 'max_features': 0.6319085288514161}. Best is trial 499 with value: 0.8396174698878165.[0m
[32m[I 2022-04-21 11:38:23,753][0m Trial 549 finished with value: 0.8391063129816301 and parameters: {'splitter': 'best', 'min_samples_split': 0.11796894995463188, 'min_samples_leaf': 0.031006252549755975, 'min_weight_fraction_leaf': 0.042405666342067314, 'max_features': 0.6423471526716468}. Best is trial 499 with value: 0.8396174698878165.[0m
[32m[I 2022-04-21 11:38:23,803][0m Trial 550 finished with value: 0.8300922795397978 and parameters: {'splitter': 'random', 'min_samples_split': 0.09769836683110122, 'min_samples_leaf': 0.03446325987040099, 'min_weight_fraction_leaf': 0.04206675012563881, 'max_features': 0.635785751648609}. Best is trial 499 with value: 0.8396174698878165.[0m
[32m[I 2022-04-21 11:38:23,870][0m Trial 551 finished with value: 0.8391063129816301 and parameters: {'splitter': 'best', 'min_samples_split': 0.12174934678534048, 'min_samples_leaf': 0.031877908690884006, 'min_weight_fraction_leaf': 0.04349749011997776, 'max_features': 0.6517755310715073}. Best is trial 499 with value: 0.8396174698878165.[0m
[32m[I 2022-04-21 11:38:23,935][0m Trial 552 finished with value: 0.8331975496664612 and parameters: {'splitter': 'best', 'min_samples_split': 0.11621095214217445, 'min_samples_leaf': 0.032062423284310936, 'min_weight_fraction_leaf': 0.041896318474795705, 'max_features': 0.5974247704139606}. Best is trial 499 with value: 0.8396174698878165.[0m
[32m[I 2022-04-21 11:38:24,035][0m Trial 553 finished with value: 0.8320143660942818 and parameters: {'splitter': 'best', 'min_samples_split': 0.0885432745538158, 'min_samples_leaf': 0.03182797026967342, 'min_weight_fraction_leaf': 0.042289568414789536, 'max_features': 0.5534489217809678}. Best is trial 499 with value: 0.8396174698878165.[0m
[32m[I 2022-04-21 11:38:24,097][0m Trial 554 finished with value: 0.8381929163139727 and parameters: {'splitter': 'best', 'min_samples_split': 0.1263905775623836, 'min_samples_leaf': 0.03462550026738934, 'min_weight_fraction_leaf': 0.04508705577870401, 'max_features': 0.6127937835981044}. Best is trial 499 with value: 0.8396174698878165.[0m
[32m[I 2022-04-21 11:38:24,165][0m Trial 555 finished with value: 0.8391063129816301 and parameters: {'splitter': 'best', 'min_samples_split': 0.10125982641082358, 'min_samples_leaf': 0.034411337807637964, 'min_weight_fraction_leaf': 0.04350432488127309, 'max_features': 0.6457238842665453}. Best is trial 499 with value: 0.8396174698878165.[0m
[32m[I 2022-04-21 11:38:24,216][0m Trial 556 finished with value: 0.8381929163139727 and parameters: {'splitter': 'best', 'min_samples_split': 0.13302959962090558, 'min_samples_leaf': 0.03564097490526169, 'min_weight_fraction_leaf': 0.045085634622657474, 'max_features': 0.6405930329571398}. Best is trial 499 with value: 0.8396174698878165.[0m
[32m[I 2022-04-21 11:38:24,272][0m Trial 557 finished with value: 0.8340130635607796 and parameters: {'splitter': 'best', 'min_samples_split': 0.1061944511754351, 'min_samples_leaf': 0.032767035823257115, 'min_weight_fraction_leaf': 0.06137789250288791, 'max_features': 0.6641660251713091}. Best is trial 499 with value: 0.8396174698878165.[0m
[32m[I 2022-04-21 11:38:24,393][0m Trial 558 finished with value: 0.8391063129816301 and parameters: {'splitter': 'best', 'min_samples_split': 0.12055394279782808, 'min_samples_leaf': 0.03387870508132264, 'min_weight_fraction_leaf': 0.04493599733452697, 'max_features': 0.6459333187004218}. Best is trial 499 with value: 0.8396174698878165.[0m
[32m[I 2022-04-21 11:38:24,489][0m Trial 559 finished with value: 0.720122309788786 and parameters: {'splitter': 'best', 'min_samples_split': 0.11689749002097252, 'min_samples_leaf': 0.3075572678796562, 'min_weight_fraction_leaf': 0.04680870185421124, 'max_features': 0.6509748754953196}. Best is trial 499 with value: 0.8396174698878165.[0m
[32m[I 2022-04-21 11:38:24,581][0m Trial 560 finished with value: 0.8333498191213747 and parameters: {'splitter': 'best', 'min_samples_split': 0.10987964901049879, 'min_samples_leaf': 0.03465762406633414, 'min_weight_fraction_leaf': 0.06755643651745058, 'max_features': 0.6166568051230581}. Best is trial 499 with value: 0.8396174698878165.[0m
[32m[I 2022-04-21 11:38:24,632][0m Trial 561 finished with value: 0.65 and parameters: {'splitter': 'best', 'min_samples_split': 0.0731886013602094, 'min_samples_leaf': 0.030667656401590283, 'min_weight_fraction_leaf': 0.4442480023930663, 'max_features': 0.6645981336693654}. Best is trial 499 with value: 0.8396174698878165.[0m
[32m[I 2022-04-21 11:38:24,727][0m Trial 562 finished with value: 0.8391063129816301 and parameters: {'splitter': 'best', 'min_samples_split': 0.12212306752458806, 'min_samples_leaf': 0.02604384368240029, 'min_weight_fraction_leaf': 0.0466012998484032, 'max_features': 0.6335252182316793}. Best is trial 499 with value: 0.8396174698878165.[0m
[32m[I 2022-04-21 11:38:24,782][0m Trial 563 finished with value: 0.8372245618281238 and parameters: {'splitter': 'best', 'min_samples_split': 0.10163711408821072, 'min_samples_leaf': 0.026216782087798804, 'min_weight_fraction_leaf': 0.050465865429029325, 'max_features': 0.6337342357187115}. Best is trial 499 with value: 0.8396174698878165.[0m
[32m[I 2022-04-21 11:38:24,836][0m Trial 564 finished with value: 0.8267496652718039 and parameters: {'splitter': 'best', 'min_samples_split': 0.11338711914809343, 'min_samples_leaf': 0.036671203874217864, 'min_weight_fraction_leaf': 0.060729973748864276, 'max_features': 0.5749806925851254}. Best is trial 499 with value: 0.8396174698878165.[0m
[32m[I 2022-04-21 11:38:24,938][0m Trial 565 finished with value: 0.8381929163139727 and parameters: {'splitter': 'best', 'min_samples_split': 0.12631254454342514, 'min_samples_leaf': 0.024496571760813504, 'min_weight_fraction_leaf': 0.045779638150149, 'max_features': 0.6043508236660268}. Best is trial 499 with value: 0.8396174698878165.[0m
[32m[I 2022-04-21 11:38:25,004][0m Trial 566 finished with value: 0.8333498191213747 and parameters: {'splitter': 'best', 'min_samples_split': 0.12037959407870451, 'min_samples_leaf': 0.024889773648119357, 'min_weight_fraction_leaf': 0.06372233190491795, 'max_features': 0.6541183905122754}. Best is trial 499 with value: 0.8396174698878165.[0m
[32m[I 2022-04-21 11:38:25,055][0m Trial 567 finished with value: 0.8355314144660066 and parameters: {'splitter': 'best', 'min_samples_split': 0.08875972618512167, 'min_samples_leaf': 0.0368270294862138, 'min_weight_fraction_leaf': 0.040825611816337974, 'max_features': 0.6306778459296711}. Best is trial 499 with value: 0.8396174698878165.[0m
