[32m[I 2022-04-21 22:45:31,605][0m Trial 361 finished with value: 0.679207391043189 and parameters: {'loss': 'coxph', 'learning_rate': 0.0012059986329813505, 'n_estimators': 274, 'criterion': 'squared_error', 'min_samples_split': 7, 'min_samples_leaf': 10, 'min_weight_fraction_leaf': 0.23317564332355278, 'min_impurity_decrease': 0.10501880401732135, 'max_features': 0.5449975899501144, 'subsample': 0.27282211767454057, 'dropout_rate': 0.5575289269062501, 'ccp_alpha': 0.15866091188921178}. Best is trial 187 with value: 0.6933481836305168.[0m
[32m[I 2022-04-21 22:45:45,042][0m Trial 362 finished with value: 0.6882523793623939 and parameters: {'loss': 'coxph', 'learning_rate': 0.0008380900786448656, 'n_estimators': 283, 'criterion': 'squared_error', 'min_samples_split': 7, 'min_samples_leaf': 10, 'min_weight_fraction_leaf': 0.19452325691767064, 'min_impurity_decrease': 0.06003796869276016, 'max_features': 0.6738074870933304, 'subsample': 0.25252302951768674, 'dropout_rate': 0.2854283999478997, 'ccp_alpha': 0.09082889882331499}. Best is trial 187 with value: 0.6933481836305168.[0m
[32m[I 2022-04-21 22:46:03,226][0m Trial 363 finished with value: 0.6343732628990925 and parameters: {'loss': 'coxph', 'learning_rate': 0.0010774166811997087, 'n_estimators': 290, 'criterion': 'squared_error', 'min_samples_split': 7, 'min_samples_leaf': 10, 'min_weight_fraction_leaf': 0.18744146658137073, 'min_impurity_decrease': 0.05052043631993353, 'max_features': 0.7820624061709177, 'subsample': 0.2403026811866673, 'dropout_rate': 0.27094350385985966, 'ccp_alpha': 0.38207363513820713}. Best is trial 187 with value: 0.6933481836305168.[0m
[32m[I 2022-04-21 22:46:17,178][0m Trial 364 finished with value: 0.5 and parameters: {'loss': 'coxph', 'learning_rate': 6.797571251283318e-05, 'n_estimators': 278, 'criterion': 'squared_error', 'min_samples_split': 7, 'min_samples_leaf': 10, 'min_weight_fraction_leaf': 0.4760777134621511, 'min_impurity_decrease': 0.06005724167314654, 'max_features': 0.9017304346109771, 'subsample': 0.9305684378371422, 'dropout_rate': 0.2841011453051818, 'ccp_alpha': 0.18668658985657977}. Best is trial 187 with value: 0.6933481836305168.[0m
[32m[I 2022-04-21 22:46:32,560][0m Trial 365 finished with value: 0.5 and parameters: {'loss': 'coxph', 'learning_rate': 0.0008867667393076015, 'n_estimators': 273, 'criterion': 'squared_error', 'min_samples_split': 7, 'min_samples_leaf': 10, 'min_weight_fraction_leaf': 0.1952818682559621, 'min_impurity_decrease': 0.03983201059335867, 'max_features': 0.4977776901177534, 'subsample': 0.2514229638048363, 'dropout_rate': 0.002789503001447427, 'ccp_alpha': 2.3767957249066316}. Best is trial 187 with value: 0.6933481836305168.[0m
[32m[I 2022-04-21 22:46:46,549][0m Trial 366 finished with value: 0.6884179103758026 and parameters: {'loss': 'coxph', 'learning_rate': 0.0012625217866004507, 'n_estimators': 289, 'criterion': 'squared_error', 'min_samples_split': 7, 'min_samples_leaf': 10, 'min_weight_fraction_leaf': 0.20200127104885282, 'min_impurity_decrease': 0.06216207355253641, 'max_features': 0.8790051358219497, 'subsample': 0.2650036306423337, 'dropout_rate': 0.2543706062098978, 'ccp_alpha': 0.10595416410414711}. Best is trial 187 with value: 0.6933481836305168.[0m
[32m[I 2022-04-21 22:47:05,678][0m Trial 367 finished with value: 0.6695305867910533 and parameters: {'loss': 'coxph', 'learning_rate': 0.0017790304504364577, 'n_estimators': 297, 'criterion': 'squared_error', 'min_samples_split': 7, 'min_samples_leaf': 10, 'min_weight_fraction_leaf': 0.20558685022564216, 'min_impurity_decrease': 0.08785021239545764, 'max_features': 0.8694898606708807, 'subsample': 0.2708946692959633, 'dropout_rate': 0.2099105872389956, 'ccp_alpha': 0.2674150630660811}. Best is trial 187 with value: 0.6933481836305168.[0m
[32m[I 2022-04-21 22:47:21,732][0m Trial 368 finished with value: 0.6892779388752727 and parameters: {'loss': 'coxph', 'learning_rate': 8.719525909771863e-05, 'n_estimators': 297, 'criterion': 'squared_error', 'min_samples_split': 7, 'min_samples_leaf': 10, 'min_weight_fraction_leaf': 0.1798498180965967, 'min_impurity_decrease': 0.07056440834482292, 'max_features': 0.8429553800931742, 'subsample': 0.3027119145654139, 'dropout_rate': 0.2536057873102819, 'ccp_alpha': 0.11633101420303452}. Best is trial 187 with value: 0.6933481836305168.[0m
[32m[I 2022-04-21 22:47:42,465][0m Trial 369 finished with value: 0.5374318563002364 and parameters: {'loss': 'coxph', 'learning_rate': 8.254973185499307e-05, 'n_estimators': 323, 'criterion': 'squared_error', 'min_samples_split': 7, 'min_samples_leaf': 10, 'min_weight_fraction_leaf': 0.4265219451534196, 'min_impurity_decrease': 0.03911309824420566, 'max_features': 0.8370372296137916, 'subsample': 0.3058011308819578, 'dropout_rate': 0.2278314258337441, 'ccp_alpha': 0.3236643557402508}. Best is trial 187 with value: 0.6933481836305168.[0m
[32m[I 2022-04-21 22:47:59,086][0m Trial 370 finished with value: 0.6818782989657601 and parameters: {'loss': 'coxph', 'learning_rate': 9.368530606814681e-05, 'n_estimators': 301, 'criterion': 'squared_error', 'min_samples_split': 8, 'min_samples_leaf': 10, 'min_weight_fraction_leaf': 0.18492604309866126, 'min_impurity_decrease': 0.06373777548733583, 'max_features': 0.8520826326039016, 'subsample': 0.3125325203022271, 'dropout_rate': 0.2536332333486677, 'ccp_alpha': 0.18723198885815903}. Best is trial 187 with value: 0.6933481836305168.[0m
[32m[I 2022-04-21 22:48:28,579][0m Trial 371 finished with value: 0.6742471879475971 and parameters: {'loss': 'coxph', 'learning_rate': 6.773591061056239e-05, 'n_estimators': 397, 'criterion': 'squared_error', 'min_samples_split': 6, 'min_samples_leaf': 10, 'min_weight_fraction_leaf': 0.17951206467009623, 'min_impurity_decrease': 0.044723225832916276, 'max_features': 0.8141388843456276, 'subsample': 0.28854877844761967, 'dropout_rate': 0.2468891522661845, 'ccp_alpha': 0.24424096114743943}. Best is trial 187 with value: 0.6933481836305168.[0m
[32m[I 2022-04-21 22:49:42,820][0m Trial 372 finished with value: 0.5 and parameters: {'loss': 'coxph', 'learning_rate': 0.002332985010577961, 'n_estimators': 571, 'criterion': 'squared_error', 'min_samples_split': 7, 'min_samples_leaf': 10, 'min_weight_fraction_leaf': 0.18464589201914805, 'min_impurity_decrease': 0.07300328420298868, 'max_features': 0.8759758255764142, 'subsample': 0.07118270001376081, 'dropout_rate': 0.22859715484704154, 'ccp_alpha': 0.42564485982433964}. Best is trial 187 with value: 0.6933481836305168.[0m
/media/san2_ssd/data/Workdir/survival/venv/lib/python3.8/site-packages/sksurv/ensemble/boosting.py:955: RuntimeWarning: divide by zero encountered in log
  time = numpy.log(time)
/media/san2_ssd/data/Workdir/survival/venv/lib/python3.8/site-packages/sksurv/ensemble/boosting.py:955: RuntimeWarning: divide by zero encountered in log
  time = numpy.log(time)
/media/san2_ssd/data/Workdir/survival/venv/lib/python3.8/site-packages/sksurv/ensemble/boosting.py:955: RuntimeWarning: divide by zero encountered in log
  time = numpy.log(time)
/media/san2_ssd/data/Workdir/survival/venv/lib/python3.8/site-packages/sksurv/ensemble/boosting.py:955: RuntimeWarning: divide by zero encountered in log
  time = numpy.log(time)
[32m[I 2022-04-21 22:49:46,321][0m Trial 373 finished with value: -0.7309394300370865 and parameters: {'loss': 'squared', 'learning_rate': 0.00010491968526344818, 'n_estimators': 313, 'criterion': 'absolute_error', 'min_samples_split': 7, 'min_samples_leaf': 10, 'min_weight_fraction_leaf': 0.20952244343766824, 'min_impurity_decrease': 0.040722914209356025, 'max_features': 0.8943894932791707, 'subsample': 0.5249014518264636, 'dropout_rate': 0.6122336334968749, 'ccp_alpha': 0.10877919273142381}. Best is trial 187 with value: 0.6933481836305168.[0m
[32m[I 2022-04-21 22:50:07,831][0m Trial 374 finished with value: 0.6787317639180929 and parameters: {'loss': 'coxph', 'learning_rate': 8.131625950560738e-05, 'n_estimators': 330, 'criterion': 'squared_error', 'min_samples_split': 7, 'min_samples_leaf': 10, 'min_weight_fraction_leaf': 0.3799157411342926, 'min_impurity_decrease': 0.0752708968106528, 'max_features': 0.8294046056035675, 'subsample': 0.29286407073005855, 'dropout_rate': 0.268181562201666, 'ccp_alpha': 0.1292578654578064}. Best is trial 187 with value: 0.6933481836305168.[0m
[32m[I 2022-04-21 22:50:24,172][0m Trial 375 finished with value: 0.6468663004723885 and parameters: {'loss': 'coxph', 'learning_rate': 6.273187559569119e-05, 'n_estimators': 300, 'criterion': 'squared_error', 'min_samples_split': 7, 'min_samples_leaf': 10, 'min_weight_fraction_leaf': 0.17599259831270986, 'min_impurity_decrease': 0.05349954483910511, 'max_features': 0.9172337923130703, 'subsample': 0.3139155999136205, 'dropout_rate': 0.2515596899267342, 'ccp_alpha': 0.3063833582532186}. Best is trial 187 with value: 0.6933481836305168.[0m
[32m[I 2022-04-21 22:51:01,379][0m Trial 376 finished with value: 0.6803368756661481 and parameters: {'loss': 'coxph', 'learning_rate': 0.00011511792923935424, 'n_estimators': 383, 'criterion': 'squared_error', 'min_samples_split': 7, 'min_samples_leaf': 10, 'min_weight_fraction_leaf': 0.1924544118204253, 'min_impurity_decrease': 0.03445660086114004, 'max_features': 0.3671334579367832, 'subsample': 0.3447320295516016, 'dropout_rate': 0.023172773399524046, 'ccp_alpha': 0.17759070462813753}. Best is trial 187 with value: 0.6933481836305168.[0m
[32m[I 2022-04-21 22:51:54,628][0m Trial 377 finished with value: 0.6866353034923407 and parameters: {'loss': 'coxph', 'learning_rate': 0.00025690244110114757, 'n_estimators': 411, 'criterion': 'friedman_mse', 'min_samples_split': 7, 'min_samples_leaf': 10, 'min_weight_fraction_leaf': 0.21561574200272293, 'min_impurity_decrease': 0.08628397043545283, 'max_features': 0.8476765784804081, 'subsample': 0.22964517832090403, 'dropout_rate': 0.03480199449861185, 'ccp_alpha': 0.10106295093899015}. Best is trial 187 with value: 0.6933481836305168.[0m
[32m[I 2022-04-21 22:52:15,489][0m Trial 378 finished with value: 0.6190439925035849 and parameters: {'loss': 'coxph', 'learning_rate': 0.00015404153244903102, 'n_estimators': 321, 'criterion': 'squared_error', 'min_samples_split': 7, 'min_samples_leaf': 10, 'min_weight_fraction_leaf': 0.20132676564362226, 'min_impurity_decrease': 0.43663507801082446, 'max_features': 0.883061191862727, 'subsample': 0.2768101053293783, 'dropout_rate': 0.08438072443633134, 'ccp_alpha': 0.23692835154246333}. Best is trial 187 with value: 0.6933481836305168.[0m
[32m[I 2022-04-21 22:52:43,775][0m Trial 379 finished with value: 0.6822469256700635 and parameters: {'loss': 'coxph', 'learning_rate': 8.022942622111737e-05, 'n_estimators': 290, 'criterion': 'squared_error', 'min_samples_split': 7, 'min_samples_leaf': 10, 'min_weight_fraction_leaf': 0.18245579076890484, 'min_impurity_decrease': 0.06108854640367102, 'max_features': 0.26417830619851124, 'subsample': 0.2987523102854385, 'dropout_rate': 0.0505006655519424, 'ccp_alpha': 0.07587074831318993}. Best is trial 187 with value: 0.6933481836305168.[0m
[32m[I 2022-04-21 22:52:58,620][0m Trial 380 finished with value: 0.6894505915961366 and parameters: {'loss': 'coxph', 'learning_rate': 5.75524231818012e-05, 'n_estimators': 261, 'criterion': 'squared_error', 'min_samples_split': 7, 'min_samples_leaf': 10, 'min_weight_fraction_leaf': 0.22538399550521565, 'min_impurity_decrease': 0.039790176769052985, 'max_features': 0.926870801459962, 'subsample': 0.3198052792289149, 'dropout_rate': 0.10132778404890311, 'ccp_alpha': 0.08416921095784825}. Best is trial 187 with value: 0.6933481836305168.[0m
[32m[I 2022-04-21 22:53:11,745][0m Trial 381 finished with value: 0.6872497754294532 and parameters: {'loss': 'coxph', 'learning_rate': 0.0029683644875299867, 'n_estimators': 266, 'criterion': 'squared_error', 'min_samples_split': 6, 'min_samples_leaf': 10, 'min_weight_fraction_leaf': 0.23124134996106852, 'min_impurity_decrease': 0.07648522440039691, 'max_features': 0.9208150467767099, 'subsample': 0.2612911322933351, 'dropout_rate': 0.25661387109365474, 'ccp_alpha': 0.003840841316736787}. Best is trial 187 with value: 0.6933481836305168.[0m
[32m[I 2022-04-21 22:53:27,518][0m Trial 382 finished with value: 0.5541488513016184 and parameters: {'loss': 'coxph', 'learning_rate': 0.00011343259137060352, 'n_estimators': 266, 'criterion': 'squared_error', 'min_samples_split': 7, 'min_samples_leaf': 10, 'min_weight_fraction_leaf': 0.15945317746322793, 'min_impurity_decrease': 0.055258019594183805, 'max_features': 0.8676043483672455, 'subsample': 0.2816308807739461, 'dropout_rate': 0.23311573632116206, 'ccp_alpha': 0.5051369796748889}. Best is trial 187 with value: 0.6933481836305168.[0m
[32m[I 2022-04-21 22:53:40,817][0m Trial 383 finished with value: 0.6739089147015163 and parameters: {'loss': 'coxph', 'learning_rate': 5.941213114318021e-05, 'n_estimators': 260, 'criterion': 'squared_error', 'min_samples_split': 7, 'min_samples_leaf': 10, 'min_weight_fraction_leaf': 0.22288493725438335, 'min_impurity_decrease': 0.09831835012835222, 'max_features': 0.8919612251885602, 'subsample': 0.3243251340961693, 'dropout_rate': 0.02939139004523387, 'ccp_alpha': 0.18858865028754376}. Best is trial 187 with value: 0.6933481836305168.[0m
[32m[I 2022-04-21 22:53:54,892][0m Trial 384 finished with value: 0.6015127033987434 and parameters: {'loss': 'coxph', 'learning_rate': 0.0003953144732995244, 'n_estimators': 249, 'criterion': 'squared_error', 'min_samples_split': 7, 'min_samples_leaf': 10, 'min_weight_fraction_leaf': 0.14739214846776025, 'min_impurity_decrease': 0.03913658745912697, 'max_features': 0.93270694068365, 'subsample': 0.35288642212204446, 'dropout_rate': 0.11187424057148371, 'ccp_alpha': 0.3643869122449265}. Best is trial 187 with value: 0.6933481836305168.[0m
[32m[I 2022-04-21 22:54:06,934][0m Trial 385 finished with value: 0.68430985272741 and parameters: {'loss': 'coxph', 'learning_rate': 9.296524831226249e-05, 'n_estimators': 280, 'criterion': 'squared_error', 'min_samples_split': 7, 'min_samples_leaf': 10, 'min_weight_fraction_leaf': 0.20417634861017359, 'min_impurity_decrease': 0.07359847782564877, 'max_features': 0.8999208952466955, 'subsample': 0.23835051280482536, 'dropout_rate': 0.21534658294338094, 'ccp_alpha': 0.08823973620987016}. Best is trial 187 with value: 0.6933481836305168.[0m
[32m[I 2022-04-21 22:54:21,466][0m Trial 386 finished with value: 0.6127568729131793 and parameters: {'loss': 'coxph', 'learning_rate': 0.0002919454005734412, 'n_estimators': 361, 'criterion': 'absolute_error', 'min_samples_split': 8, 'min_samples_leaf': 10, 'min_weight_fraction_leaf': 0.25083256243414576, 'min_impurity_decrease': 0.05234210814564516, 'max_features': 0.8074349839016683, 'subsample': 0.29941275643020354, 'dropout_rate': 0.5163150069400477, 'ccp_alpha': 0.26387270925852685}. Best is trial 187 with value: 0.6933481836305168.[0m
[32m[I 2022-04-21 22:54:35,647][0m Trial 387 finished with value: 0.6837472988064728 and parameters: {'loss': 'coxph', 'learning_rate': 6.376792941783825e-05, 'n_estimators': 257, 'criterion': 'squared_error', 'min_samples_split': 7, 'min_samples_leaf': 10, 'min_weight_fraction_leaf': 0.23977366993240345, 'min_impurity_decrease': 0.09122469469647906, 'max_features': 0.5963069835869068, 'subsample': 0.21708732596616753, 'dropout_rate': 0.042789215855525, 'ccp_alpha': 0.0010804362770021336}. Best is trial 187 with value: 0.6933481836305168.[0m
[32m[I 2022-04-21 22:56:02,244][0m Trial 388 finished with value: 0.6793291477058843 and parameters: {'loss': 'coxph', 'learning_rate': 0.00014027117365685704, 'n_estimators': 632, 'criterion': 'squared_error', 'min_samples_split': 7, 'min_samples_leaf': 10, 'min_weight_fraction_leaf': 0.19372973852436196, 'min_impurity_decrease': 0.034321539889921995, 'max_features': 0.048038584571041654, 'subsample': 0.27196363325363726, 'dropout_rate': 0.07114326133846989, 'ccp_alpha': 0.19661381111384507}. Best is trial 187 with value: 0.6933481836305168.[0m
[32m[I 2022-04-21 22:56:26,272][0m Trial 389 finished with value: 0.6848510231484688 and parameters: {'loss': 'coxph', 'learning_rate': 7.597786458034747e-05, 'n_estimators': 292, 'criterion': 'friedman_mse', 'min_samples_split': 7, 'min_samples_leaf': 10, 'min_weight_fraction_leaf': 0.1687401270981208, 'min_impurity_decrease': 0.0687028971002366, 'max_features': 0.8487358081709819, 'subsample': 0.33587911467542186, 'dropout_rate': 0.09072361334834396, 'ccp_alpha': 0.001105268971894377}. Best is trial 187 with value: 0.6933481836305168.[0m
[32m[I 2022-04-21 22:56:49,394][0m Trial 390 finished with value: 0.6886529203024677 and parameters: {'loss': 'coxph', 'learning_rate': 0.00017494481230488434, 'n_estimators': 340, 'criterion': 'squared_error', 'min_samples_split': 7, 'min_samples_leaf': 10, 'min_weight_fraction_leaf': 0.1758070175613222, 'min_impurity_decrease': 0.10560124598893525, 'max_features': 0.9112344023760818, 'subsample': 0.25174301948835653, 'dropout_rate': 0.2959996938130966, 'ccp_alpha': 0.15068120877925342}. Best is trial 187 with value: 0.6933481836305168.[0m
[32m[I 2022-04-21 22:57:18,812][0m Trial 391 finished with value: 0.6886529203024677 and parameters: {'loss': 'coxph', 'learning_rate': 0.0001925999240454168, 'n_estimators': 352, 'criterion': 'squared_error', 'min_samples_split': 6, 'min_samples_leaf': 9, 'min_weight_fraction_leaf': 0.1768821419509975, 'min_impurity_decrease': 0.11096180768375145, 'max_features': 0.9121521701089202, 'subsample': 0.24340721906865126, 'dropout_rate': 0.29412109193743746, 'ccp_alpha': 0.1720280016926638}. Best is trial 187 with value: 0.6933481836305168.[0m
[32m[I 2022-04-21 22:57:39,632][0m Trial 392 finished with value: 0.6686325960100316 and parameters: {'loss': 'coxph', 'learning_rate': 0.00014401649185350623, 'n_estimators': 350, 'criterion': 'squared_error', 'min_samples_split': 5, 'min_samples_leaf': 9, 'min_weight_fraction_leaf': 0.17518818131758138, 'min_impurity_decrease': 0.1313930031862927, 'max_features': 0.9170589932480415, 'subsample': 0.2165505258582046, 'dropout_rate': 0.29248465516000627, 'ccp_alpha': 0.3244365016462545}. Best is trial 187 with value: 0.6933481836305168.[0m
[32m[I 2022-04-21 22:58:04,733][0m Trial 393 finished with value: 0.6864337351952289 and parameters: {'loss': 'coxph', 'learning_rate': 0.00016503199841065526, 'n_estimators': 381, 'criterion': 'squared_error', 'min_samples_split': 6, 'min_samples_leaf': 9, 'min_weight_fraction_leaf': 0.16638355644862748, 'min_impurity_decrease': 0.11319635989796956, 'max_features': 0.9251063670915536, 'subsample': 0.23866091609910384, 'dropout_rate': 0.3281398354335314, 'ccp_alpha': 0.20947144474906887}. Best is trial 187 with value: 0.6933481836305168.[0m
/media/san2_ssd/data/Workdir/survival/venv/lib/python3.8/site-packages/sksurv/ensemble/boosting.py:955: RuntimeWarning: divide by zero encountered in log
  time = numpy.log(time)
/media/san2_ssd/data/Workdir/survival/venv/lib/python3.8/site-packages/sksurv/ensemble/boosting.py:955: RuntimeWarning: divide by zero encountered in log
  time = numpy.log(time)
/media/san2_ssd/data/Workdir/survival/venv/lib/python3.8/site-packages/sksurv/ensemble/boosting.py:955: RuntimeWarning: divide by zero encountered in log
  time = numpy.log(time)
/media/san2_ssd/data/Workdir/survival/venv/lib/python3.8/site-packages/sksurv/ensemble/boosting.py:955: RuntimeWarning: divide by zero encountered in log
  time = numpy.log(time)
[32m[I 2022-04-21 22:58:08,495][0m Trial 394 finished with value: -0.7297033464820903 and parameters: {'loss': 'squared', 'learning_rate': 0.00019081306419578694, 'n_estimators': 357, 'criterion': 'squared_error', 'min_samples_split': 6, 'min_samples_leaf': 9, 'min_weight_fraction_leaf': 0.17782234320704016, 'min_impurity_decrease': 0.10571742400710005, 'max_features': 0.908106134612118, 'subsample': 0.24825525147663813, 'dropout_rate': 0.30722119153681443, 'ccp_alpha': 0.17012914357834344}. Best is trial 187 with value: 0.6933481836305168.[0m
[32m[I 2022-04-21 22:58:37,930][0m Trial 395 finished with value: 0.6807672346328408 and parameters: {'loss': 'coxph', 'learning_rate': 0.00023473967731163153, 'n_estimators': 333, 'criterion': 'squared_error', 'min_samples_split': 7, 'min_samples_leaf': 9, 'min_weight_fraction_leaf': 0.16058009696169326, 'min_impurity_decrease': 0.1702316127939888, 'max_features': 0.46645639089868296, 'subsample': 0.21324268337010963, 'dropout_rate': 0.002292375093612499, 'ccp_alpha': 0.09257514954027404}. Best is trial 187 with value: 0.6933481836305168.[0m
[32m[I 2022-04-21 22:59:11,642][0m Trial 396 finished with value: 0.6200164436182327 and parameters: {'loss': 'coxph', 'learning_rate': 0.00019725083337722394, 'n_estimators': 370, 'criterion': 'squared_error', 'min_samples_split': 5, 'min_samples_leaf': 9, 'min_weight_fraction_leaf': 0.17386480407391808, 'min_impurity_decrease': 0.08833718251682735, 'max_features': 0.9318963739130309, 'subsample': 0.6114359820056606, 'dropout_rate': 0.05602783256127821, 'ccp_alpha': 0.27947059724516216}. Best is trial 187 with value: 0.6933481836305168.[0m
[32m[I 2022-04-21 22:59:32,273][0m Trial 397 finished with value: 0.6864973364429 and parameters: {'loss': 'coxph', 'learning_rate': 0.0915249724942327, 'n_estimators': 348, 'criterion': 'squared_error', 'min_samples_split': 6, 'min_samples_leaf': 9, 'min_weight_fraction_leaf': 0.15428689262424886, 'min_impurity_decrease': 0.1369843969232045, 'max_features': 0.9351957550238242, 'subsample': 0.2322166554421223, 'dropout_rate': 0.35713056304710816, 'ccp_alpha': 0.16100970100378453}. Best is trial 187 with value: 0.6933481836305168.[0m
