[32m[I 2022-04-21 14:39:22,044][0m Trial 258 finished with value: 0.8262620460910975 and parameters: {'loss': 'coxph', 'learning_rate': 0.0025057778866350165, 'n_estimators': 117, 'criterion': 'friedman_mse', 'min_samples_split': 3, 'min_samples_leaf': 2, 'min_weight_fraction_leaf': 0.06349145387748951, 'min_impurity_decrease': 0.4319897371522846, 'max_features': 0.8087691633703263, 'subsample': 0.27485810958048895, 'dropout_rate': 0.8848512296977913, 'ccp_alpha': 0.005913489207431247}. Best is trial 232 with value: 0.8290981242143094.[0m
[32m[I 2022-04-21 14:39:26,073][0m Trial 259 finished with value: 0.8256822130264501 and parameters: {'loss': 'coxph', 'learning_rate': 0.0024581491950195237, 'n_estimators': 117, 'criterion': 'friedman_mse', 'min_samples_split': 3, 'min_samples_leaf': 2, 'min_weight_fraction_leaf': 0.06422856867452131, 'min_impurity_decrease': 0.4255724175236232, 'max_features': 0.7956078888178976, 'subsample': 0.27682356917040196, 'dropout_rate': 0.8860596890468618, 'ccp_alpha': 0.013155508631095894}. Best is trial 232 with value: 0.8290981242143094.[0m
[32m[I 2022-04-21 14:39:30,304][0m Trial 260 finished with value: 0.8264401800622263 and parameters: {'loss': 'coxph', 'learning_rate': 0.0020911375373121282, 'n_estimators': 121, 'criterion': 'friedman_mse', 'min_samples_split': 3, 'min_samples_leaf': 2, 'min_weight_fraction_leaf': 0.06974862558853062, 'min_impurity_decrease': 0.4341056825719326, 'max_features': 0.7982041294250999, 'subsample': 0.27929225552628234, 'dropout_rate': 0.8912111473449307, 'ccp_alpha': 0.0011973371953588746}. Best is trial 232 with value: 0.8290981242143094.[0m
[32m[I 2022-04-21 14:39:34,225][0m Trial 261 finished with value: 0.8255519129053587 and parameters: {'loss': 'coxph', 'learning_rate': 0.002353804906444036, 'n_estimators': 120, 'criterion': 'friedman_mse', 'min_samples_split': 3, 'min_samples_leaf': 2, 'min_weight_fraction_leaf': 0.06304576471375185, 'min_impurity_decrease': 0.4115825133516965, 'max_features': 0.763137945438185, 'subsample': 0.2894195276251619, 'dropout_rate': 0.8885638554510841, 'ccp_alpha': 0.050966385276411334}. Best is trial 232 with value: 0.8290981242143094.[0m
[32m[I 2022-04-21 14:39:37,454][0m Trial 262 finished with value: 0.8270958557692962 and parameters: {'loss': 'coxph', 'learning_rate': 0.0030036000240840697, 'n_estimators': 121, 'criterion': 'friedman_mse', 'min_samples_split': 3, 'min_samples_leaf': 2, 'min_weight_fraction_leaf': 0.06442285891586681, 'min_impurity_decrease': 0.41396520487676963, 'max_features': 0.7602131841250648, 'subsample': 0.28110350519613847, 'dropout_rate': 0.8920961006605727, 'ccp_alpha': 0.004979948940768822}. Best is trial 232 with value: 0.8290981242143094.[0m
[32m[I 2022-04-21 14:39:41,024][0m Trial 263 finished with value: 0.8278704894117501 and parameters: {'loss': 'coxph', 'learning_rate': 0.0026592715589459446, 'n_estimators': 123, 'criterion': 'friedman_mse', 'min_samples_split': 3, 'min_samples_leaf': 2, 'min_weight_fraction_leaf': 0.07336386465466235, 'min_impurity_decrease': 0.42780457384793746, 'max_features': 0.7582549097380477, 'subsample': 0.28336410002375195, 'dropout_rate': 0.8864586777581214, 'ccp_alpha': 0.01009715576658111}. Best is trial 232 with value: 0.8290981242143094.[0m
[32m[I 2022-04-21 14:39:46,593][0m Trial 264 finished with value: 0.829035390101897 and parameters: {'loss': 'coxph', 'learning_rate': 0.0030250831137386006, 'n_estimators': 123, 'criterion': 'friedman_mse', 'min_samples_split': 3, 'min_samples_leaf': 2, 'min_weight_fraction_leaf': 0.06517176616703116, 'min_impurity_decrease': 0.42415389899171196, 'max_features': 0.7524373441381615, 'subsample': 0.28765288392512967, 'dropout_rate': 0.8885617834973457, 'ccp_alpha': 0.002290355571266875}. Best is trial 232 with value: 0.8290981242143094.[0m
[32m[I 2022-04-21 14:39:51,335][0m Trial 265 finished with value: 0.8262202385639863 and parameters: {'loss': 'coxph', 'learning_rate': 0.0028042922024171953, 'n_estimators': 124, 'criterion': 'friedman_mse', 'min_samples_split': 3, 'min_samples_leaf': 2, 'min_weight_fraction_leaf': 0.06295437677299785, 'min_impurity_decrease': 0.4160127556874482, 'max_features': 0.7489973411959401, 'subsample': 0.2779798797189251, 'dropout_rate': 0.8827601555006293, 'ccp_alpha': 0.02264476292909934}. Best is trial 232 with value: 0.8290981242143094.[0m
[32m[I 2022-04-21 14:39:55,106][0m Trial 266 finished with value: 0.8227206488588423 and parameters: {'loss': 'coxph', 'learning_rate': 0.002821332819375416, 'n_estimators': 124, 'criterion': 'friedman_mse', 'min_samples_split': 3, 'min_samples_leaf': 2, 'min_weight_fraction_leaf': 0.0649510289990553, 'min_impurity_decrease': 0.42408672591313173, 'max_features': 0.7447954817882224, 'subsample': 0.2801477636716264, 'dropout_rate': 0.8876281948706959, 'ccp_alpha': 0.05467490765322465}. Best is trial 232 with value: 0.8290981242143094.[0m
[32m[I 2022-04-21 14:39:58,457][0m Trial 267 finished with value: 0.8245124267569072 and parameters: {'loss': 'coxph', 'learning_rate': 0.0037322394083766264, 'n_estimators': 122, 'criterion': 'friedman_mse', 'min_samples_split': 3, 'min_samples_leaf': 2, 'min_weight_fraction_leaf': 0.0436093402733979, 'min_impurity_decrease': 0.39970619938141433, 'max_features': 0.7599800298780116, 'subsample': 0.27911637529802136, 'dropout_rate': 0.8925337645493354, 'ccp_alpha': 0.015551310264670618}. Best is trial 232 with value: 0.8290981242143094.[0m
[32m[I 2022-04-21 14:40:02,678][0m Trial 268 finished with value: 0.8235843315994013 and parameters: {'loss': 'coxph', 'learning_rate': 0.0036541518723571765, 'n_estimators': 122, 'criterion': 'friedman_mse', 'min_samples_split': 3, 'min_samples_leaf': 2, 'min_weight_fraction_leaf': 0.035032871990631514, 'min_impurity_decrease': 0.40271268365818186, 'max_features': 0.7503245093699634, 'subsample': 0.3042398589480814, 'dropout_rate': 0.8931523063539154, 'ccp_alpha': 0.015591382955402562}. Best is trial 232 with value: 0.8290981242143094.[0m
[32m[I 2022-04-21 14:40:05,333][0m Trial 269 finished with value: 0.8265177252489802 and parameters: {'loss': 'coxph', 'learning_rate': 0.002323809932486251, 'n_estimators': 123, 'criterion': 'friedman_mse', 'min_samples_split': 3, 'min_samples_leaf': 2, 'min_weight_fraction_leaf': 0.04361225259622197, 'min_impurity_decrease': 0.39307080782347353, 'max_features': 0.7018243680862581, 'subsample': 0.2748170668623406, 'dropout_rate': 0.8910489461826928, 'ccp_alpha': 0.006945040514529588}. Best is trial 232 with value: 0.8290981242143094.[0m
[32m[I 2022-04-21 14:40:09,271][0m Trial 270 finished with value: 0.8245755775361958 and parameters: {'loss': 'coxph', 'learning_rate': 0.002383844201388329, 'n_estimators': 124, 'criterion': 'friedman_mse', 'min_samples_split': 3, 'min_samples_leaf': 2, 'min_weight_fraction_leaf': 0.04341252629509899, 'min_impurity_decrease': 0.38516173635261675, 'max_features': 0.7172307965684914, 'subsample': 0.2767826941839686, 'dropout_rate': 0.893023976590649, 'ccp_alpha': 0.0013880348639151094}. Best is trial 232 with value: 0.8290981242143094.[0m
[32m[I 2022-04-21 14:40:13,305][0m Trial 271 finished with value: 0.8284735812393226 and parameters: {'loss': 'coxph', 'learning_rate': 0.002365359308778086, 'n_estimators': 125, 'criterion': 'friedman_mse', 'min_samples_split': 3, 'min_samples_leaf': 2, 'min_weight_fraction_leaf': 0.06207010899574908, 'min_impurity_decrease': 0.3894916456651796, 'max_features': 0.7140227819068024, 'subsample': 0.2800638652355003, 'dropout_rate': 0.9058752330207984, 'ccp_alpha': 0.004776457980941664}. Best is trial 232 with value: 0.8290981242143094.[0m
[32m[I 2022-04-21 14:40:17,341][0m Trial 272 finished with value: 0.8197369534450702 and parameters: {'loss': 'coxph', 'learning_rate': 0.0023142403641183964, 'n_estimators': 124, 'criterion': 'friedman_mse', 'min_samples_split': 3, 'min_samples_leaf': 2, 'min_weight_fraction_leaf': 0.03551543637090497, 'min_impurity_decrease': 0.3896780666775013, 'max_features': 0.7051510399932575, 'subsample': 0.2742482531874171, 'dropout_rate': 0.8984327565417973, 'ccp_alpha': 0.01123127845759346}. Best is trial 232 with value: 0.8290981242143094.[0m
[32m[I 2022-04-21 14:40:22,135][0m Trial 273 finished with value: 0.82378754178058 and parameters: {'loss': 'coxph', 'learning_rate': 0.005170106858089205, 'n_estimators': 124, 'criterion': 'friedman_mse', 'min_samples_split': 3, 'min_samples_leaf': 2, 'min_weight_fraction_leaf': 0.04629439814695588, 'min_impurity_decrease': 0.40637820780854556, 'max_features': 0.7179240743105605, 'subsample': 0.3446726099761834, 'dropout_rate': 0.8793248943032363, 'ccp_alpha': 0.046571722732665306}. Best is trial 232 with value: 0.8290981242143094.[0m
/media/san2_ssd/data/Workdir/survival/venv/lib/python3.8/site-packages/sksurv/ensemble/boosting.py:955: RuntimeWarning: divide by zero encountered in log
  time = numpy.log(time)
/media/san2_ssd/data/Workdir/survival/venv/lib/python3.8/site-packages/sksurv/ensemble/boosting.py:955: RuntimeWarning: divide by zero encountered in log
  time = numpy.log(time)
/media/san2_ssd/data/Workdir/survival/venv/lib/python3.8/site-packages/sksurv/ensemble/boosting.py:955: RuntimeWarning: divide by zero encountered in log
  time = numpy.log(time)
/media/san2_ssd/data/Workdir/survival/venv/lib/python3.8/site-packages/sksurv/ensemble/boosting.py:955: RuntimeWarning: divide by zero encountered in log
  time = numpy.log(time)
[32m[I 2022-04-21 14:40:22,914][0m Trial 274 finished with value: -0.45 and parameters: {'loss': 'squared', 'learning_rate': 0.0027449334638641448, 'n_estimators': 127, 'criterion': 'absolute_error', 'min_samples_split': 3, 'min_samples_leaf': 2, 'min_weight_fraction_leaf': 0.06110959387544245, 'min_impurity_decrease': 0.4166110969818198, 'max_features': 0.7622459644615964, 'subsample': 0.2884102157658601, 'dropout_rate': 0.8983571052652297, 'ccp_alpha': 0.02205515857608939}. Best is trial 232 with value: 0.8290981242143094.[0m
[32m[I 2022-04-21 14:40:25,481][0m Trial 275 finished with value: 0.8251632233779107 and parameters: {'loss': 'coxph', 'learning_rate': 0.003187186055181869, 'n_estimators': 120, 'criterion': 'friedman_mse', 'min_samples_split': 3, 'min_samples_leaf': 2, 'min_weight_fraction_leaf': 0.04531245364906688, 'min_impurity_decrease': 0.3915206375966077, 'max_features': 0.7268749409035823, 'subsample': 0.3127403717042516, 'dropout_rate': 0.889436393915686, 'ccp_alpha': 0.019869055810567575}. Best is trial 232 with value: 0.8290981242143094.[0m
[32m[I 2022-04-21 14:40:29,634][0m Trial 276 finished with value: 0.8271495447562263 and parameters: {'loss': 'coxph', 'learning_rate': 0.0036324263771327302, 'n_estimators': 120, 'criterion': 'friedman_mse', 'min_samples_split': 3, 'min_samples_leaf': 2, 'min_weight_fraction_leaf': 0.07498009553168608, 'min_impurity_decrease': 0.3867227111253888, 'max_features': 0.7005185717846418, 'subsample': 0.3242434459675414, 'dropout_rate': 0.8851343368049306, 'ccp_alpha': 0.004023926081948306}. Best is trial 232 with value: 0.8290981242143094.[0m
[32m[I 2022-04-21 14:40:33,884][0m Trial 277 finished with value: 0.8262012010968931 and parameters: {'loss': 'coxph', 'learning_rate': 0.003385938828048293, 'n_estimators': 118, 'criterion': 'friedman_mse', 'min_samples_split': 3, 'min_samples_leaf': 2, 'min_weight_fraction_leaf': 0.0743821401645901, 'min_impurity_decrease': 0.36512598170428273, 'max_features': 0.6820551480801038, 'subsample': 0.3141097158424363, 'dropout_rate': 0.8780302493148223, 'ccp_alpha': 0.01659017255984583}. Best is trial 232 with value: 0.8290981242143094.[0m
[32m[I 2022-04-21 14:40:38,836][0m Trial 278 finished with value: 0.3724687465074371 and parameters: {'loss': 'coxph', 'learning_rate': 0.002125230246503948, 'n_estimators': 115, 'criterion': 'friedman_mse', 'min_samples_split': 3, 'min_samples_leaf': 2, 'min_weight_fraction_leaf': 0.07336053418998105, 'min_impurity_decrease': 0.3640616159578854, 'max_features': 0.7190285361220905, 'subsample': 0.3247003985183797, 'dropout_rate': 0.8780165482608191, 'ccp_alpha': 0.21985826312057516}. Best is trial 232 with value: 0.8290981242143094.[0m
[32m[I 2022-04-21 14:40:44,546][0m Trial 279 finished with value: 0.8259074830517438 and parameters: {'loss': 'coxph', 'learning_rate': 0.0027422665532224324, 'n_estimators': 119, 'criterion': 'friedman_mse', 'min_samples_split': 3, 'min_samples_leaf': 2, 'min_weight_fraction_leaf': 0.07796659775284541, 'min_impurity_decrease': 0.3879157874688546, 'max_features': 0.6762522233650426, 'subsample': 0.30809388198290744, 'dropout_rate': 0.9096320077551077, 'ccp_alpha': 0.00712460384262986}. Best is trial 232 with value: 0.8290981242143094.[0m
[32m[I 2022-04-21 14:40:49,668][0m Trial 280 finished with value: 0.8271812435758139 and parameters: {'loss': 'coxph', 'learning_rate': 0.004775083152101546, 'n_estimators': 116, 'criterion': 'friedman_mse', 'min_samples_split': 3, 'min_samples_leaf': 2, 'min_weight_fraction_leaf': 0.08141861692939852, 'min_impurity_decrease': 0.38019186019909723, 'max_features': 0.6722660472621872, 'subsample': 0.31202473914110257, 'dropout_rate': 0.91349318222928, 'ccp_alpha': 0.021199785138253192}. Best is trial 232 with value: 0.8290981242143094.[0m
[32m[I 2022-04-21 14:40:52,561][0m Trial 281 finished with value: 0.8242116529511527 and parameters: {'loss': 'coxph', 'learning_rate': 0.0031429866693770403, 'n_estimators': 117, 'criterion': 'friedman_mse', 'min_samples_split': 3, 'min_samples_leaf': 2, 'min_weight_fraction_leaf': 0.08135822824531214, 'min_impurity_decrease': 0.3849814563602782, 'max_features': 0.6692573171453358, 'subsample': 0.32264550051424723, 'dropout_rate': 0.9137394574423152, 'ccp_alpha': 0.0035065237776182034}. Best is trial 232 with value: 0.8290981242143094.[0m
[32m[I 2022-04-21 14:40:55,398][0m Trial 282 finished with value: 0.2574033530967689 and parameters: {'loss': 'coxph', 'learning_rate': 0.004298790434145349, 'n_estimators': 117, 'criterion': 'friedman_mse', 'min_samples_split': 3, 'min_samples_leaf': 2, 'min_weight_fraction_leaf': 0.062179572922444894, 'min_impurity_decrease': 0.356978108572221, 'max_features': 0.6797455099351742, 'subsample': 0.35743407906979396, 'dropout_rate': 0.919904082997095, 'ccp_alpha': 0.20840115005710189}. Best is trial 232 with value: 0.8290981242143094.[0m
[32m[I 2022-04-21 14:40:57,755][0m Trial 283 finished with value: 0.8266240352356465 and parameters: {'loss': 'coxph', 'learning_rate': 0.005707730911228543, 'n_estimators': 113, 'criterion': 'friedman_mse', 'min_samples_split': 3, 'min_samples_leaf': 2, 'min_weight_fraction_leaf': 0.07313453181414617, 'min_impurity_decrease': 0.4239635839078338, 'max_features': 0.684390228535598, 'subsample': 0.3002892620924017, 'dropout_rate': 0.8747357775763235, 'ccp_alpha': 0.011058042507064124}. Best is trial 232 with value: 0.8290981242143094.[0m
[32m[I 2022-04-21 14:41:00,688][0m Trial 284 finished with value: 0.26552368530161896 and parameters: {'loss': 'coxph', 'learning_rate': 0.001997725916702615, 'n_estimators': 112, 'criterion': 'friedman_mse', 'min_samples_split': 3, 'min_samples_leaf': 2, 'min_weight_fraction_leaf': 0.07265287856451892, 'min_impurity_decrease': 0.41330931505369434, 'max_features': 0.684974693547779, 'subsample': 0.3035888372029834, 'dropout_rate': 0.8730602082511799, 'ccp_alpha': 0.20786926364005948}. Best is trial 232 with value: 0.8290981242143094.[0m
[32m[I 2022-04-21 14:41:03,772][0m Trial 285 finished with value: 0.8280112435626155 and parameters: {'loss': 'coxph', 'learning_rate': 0.0057745815757826195, 'n_estimators': 113, 'criterion': 'friedman_mse', 'min_samples_split': 3, 'min_samples_leaf': 3, 'min_weight_fraction_leaf': 0.076745219956969, 'min_impurity_decrease': 0.42807680620076705, 'max_features': 0.6431281691888732, 'subsample': 0.264277552523105, 'dropout_rate': 0.906699310788228, 'ccp_alpha': 0.009785130252935342}. Best is trial 232 with value: 0.8290981242143094.[0m
[32m[I 2022-04-21 14:41:06,042][0m Trial 286 finished with value: 0.8279831099502738 and parameters: {'loss': 'coxph', 'learning_rate': 0.004528455027541718, 'n_estimators': 113, 'criterion': 'friedman_mse', 'min_samples_split': 3, 'min_samples_leaf': 3, 'min_weight_fraction_leaf': 0.07757112274924613, 'min_impurity_decrease': 0.43476436874958013, 'max_features': 0.6352105095361317, 'subsample': 0.2925066122822948, 'dropout_rate': 0.9124704349887836, 'ccp_alpha': 0.0022534770979066475}. Best is trial 232 with value: 0.8290981242143094.[0m
[32m[I 2022-04-21 14:41:08,804][0m Trial 287 finished with value: 0.8250123605640176 and parameters: {'loss': 'coxph', 'learning_rate': 0.005813830760578713, 'n_estimators': 111, 'criterion': 'friedman_mse', 'min_samples_split': 3, 'min_samples_leaf': 3, 'min_weight_fraction_leaf': 0.06122767716846297, 'min_impurity_decrease': 0.4328998944820668, 'max_features': 0.6225853177633577, 'subsample': 0.3020669994110347, 'dropout_rate': 0.9294755382247224, 'ccp_alpha': 0.00451414471983471}. Best is trial 232 with value: 0.8290981242143094.[0m
[32m[I 2022-04-21 14:41:11,206][0m Trial 288 finished with value: 0.7073429800222091 and parameters: {'loss': 'coxph', 'learning_rate': 0.005181107612930905, 'n_estimators': 113, 'criterion': 'friedman_mse', 'min_samples_split': 3, 'min_samples_leaf': 3, 'min_weight_fraction_leaf': 0.055183240337967, 'min_impurity_decrease': 0.4352003034563921, 'max_features': 0.6858932901280227, 'subsample': 0.2612774671634816, 'dropout_rate': 0.9105833785286631, 'ccp_alpha': 0.17434060571124652}. Best is trial 232 with value: 0.8290981242143094.[0m
[32m[I 2022-04-21 14:41:14,878][0m Trial 289 finished with value: 0.3724687465074371 and parameters: {'loss': 'coxph', 'learning_rate': 0.0034880752102029533, 'n_estimators': 114, 'criterion': 'friedman_mse', 'min_samples_split': 3, 'min_samples_leaf': 2, 'min_weight_fraction_leaf': 0.0695284353059204, 'min_impurity_decrease': 0.3715611620805369, 'max_features': 0.6196311865180573, 'subsample': 0.33467892209429395, 'dropout_rate': 0.8713887039108749, 'ccp_alpha': 0.2016076617019938}. Best is trial 232 with value: 0.8290981242143094.[0m
[32m[I 2022-04-21 14:41:18,505][0m Trial 290 finished with value: 0.8297644701144975 and parameters: {'loss': 'coxph', 'learning_rate': 0.007766522180414316, 'n_estimators': 129, 'criterion': 'friedman_mse', 'min_samples_split': 3, 'min_samples_leaf': 2, 'min_weight_fraction_leaf': 0.07831343357762963, 'min_impurity_decrease': 0.39728569370612477, 'max_features': 0.6436359205388626, 'subsample': 0.3000606441000746, 'dropout_rate': 0.912640243782119, 'ccp_alpha': 0.007826683236322532}. Best is trial 290 with value: 0.8297644701144975.[0m
[32m[I 2022-04-21 14:41:21,683][0m Trial 291 finished with value: 0.38417042723803396 and parameters: {'loss': 'coxph', 'learning_rate': 0.010737678692900371, 'n_estimators': 130, 'criterion': 'friedman_mse', 'min_samples_split': 3, 'min_samples_leaf': 3, 'min_weight_fraction_leaf': 0.08186515701180573, 'min_impurity_decrease': 0.39032253944110823, 'max_features': 0.6354349021041926, 'subsample': 0.31622576818300513, 'dropout_rate': 0.9399907227748543, 'ccp_alpha': 0.19086387762951249}. Best is trial 290 with value: 0.8297644701144975.[0m
/media/san2_ssd/data/Workdir/survival/venv/lib/python3.8/site-packages/sksurv/ensemble/boosting.py:955: RuntimeWarning: divide by zero encountered in log
  time = numpy.log(time)
/media/san2_ssd/data/Workdir/survival/venv/lib/python3.8/site-packages/sksurv/ensemble/boosting.py:955: RuntimeWarning: divide by zero encountered in log
  time = numpy.log(time)
/media/san2_ssd/data/Workdir/survival/venv/lib/python3.8/site-packages/sksurv/ensemble/boosting.py:955: RuntimeWarning: divide by zero encountered in log
  time = numpy.log(time)
/media/san2_ssd/data/Workdir/survival/venv/lib/python3.8/site-packages/sksurv/ensemble/boosting.py:955: RuntimeWarning: divide by zero encountered in log
  time = numpy.log(time)
[32m[I 2022-04-21 14:41:22,216][0m Trial 292 finished with value: -0.46737081068466135 and parameters: {'loss': 'squared', 'learning_rate': 0.006795959402474935, 'n_estimators': 134, 'criterion': 'friedman_mse', 'min_samples_split': 3, 'min_samples_leaf': 2, 'min_weight_fraction_leaf': 0.016760994695868975, 'min_impurity_decrease': 0.4309395730279829, 'max_features': 0.6554522968846418, 'subsample': 0.2585101421251019, 'dropout_rate': 0.9115027706354144, 'ccp_alpha': 0.010446214881466393}. Best is trial 290 with value: 0.8297644701144975.[0m
[32m[I 2022-04-21 14:41:26,434][0m Trial 293 finished with value: 0.2503270102305002 and parameters: {'loss': 'coxph', 'learning_rate': 0.009137985326768261, 'n_estimators': 128, 'criterion': 'friedman_mse', 'min_samples_split': 3, 'min_samples_leaf': 2, 'min_weight_fraction_leaf': 0.078288277441575, 'min_impurity_decrease': 0.35415421126047136, 'max_features': 0.5940979314745134, 'subsample': 0.3004545644880654, 'dropout_rate': 0.9249869572817616, 'ccp_alpha': 0.29513157442569327}. Best is trial 290 with value: 0.8297644701144975.[0m
[32m[I 2022-04-21 14:41:32,831][0m Trial 294 finished with value: 0.825443721274944 and parameters: {'loss': 'coxph', 'learning_rate': 0.004688868369437739, 'n_estimators': 113, 'criterion': 'friedman_mse', 'min_samples_split': 3, 'min_samples_leaf': 2, 'min_weight_fraction_leaf': 0.07016663677354565, 'min_impurity_decrease': 0.39565590463472694, 'max_features': 0.6985769905968207, 'subsample': 0.3632470679159059, 'dropout_rate': 0.8661873213824098, 'ccp_alpha': 0.004430067807681388}. Best is trial 290 with value: 0.8297644701144975.[0m
