[32m[I 2022-04-22 17:30:11,988][0m Trial 101 finished with value: 0.6791312386060044 and parameters: {'n_hidden': 1024, 'mixture_components': 3, 'use_sparse_layer': False, 'use_batchnorm': False, 'use_dropout': False, 'mlp_size_1': 7, 'mlp_size_2': 0, 'mlp_size_3': 0, 'kernel': 'Normal', 'loss_name': 'NLLLoss'}. Best is trial 33 with value: 0.6976094983213004.[0m
[32m[I 2022-04-22 17:30:54,527][0m Trial 102 finished with value: 0.6859533826324593 and parameters: {'n_hidden': 1024, 'mixture_components': 2, 'use_sparse_layer': False, 'use_batchnorm': False, 'use_dropout': False, 'mlp_size_1': 7, 'mlp_size_2': 0, 'mlp_size_3': 0, 'kernel': 'Normal', 'loss_name': 'NLLLoss'}. Best is trial 33 with value: 0.6976094983213004.[0m
[32m[I 2022-04-22 17:31:51,546][0m Trial 103 finished with value: 0.682690761573091 and parameters: {'n_hidden': 1024, 'mixture_components': 3, 'use_sparse_layer': False, 'use_batchnorm': False, 'use_dropout': False, 'mlp_size_1': 7, 'mlp_size_2': 0, 'mlp_size_3': 0, 'kernel': 'Normal', 'loss_name': 'NLLLoss'}. Best is trial 33 with value: 0.6976094983213004.[0m
[32m[I 2022-04-22 17:32:31,449][0m Trial 104 finished with value: 0.6323473077366607 and parameters: {'n_hidden': 1024, 'mixture_components': 4, 'use_sparse_layer': False, 'use_batchnorm': False, 'use_dropout': False, 'mlp_size_1': 7, 'mlp_size_2': 0, 'mlp_size_3': 0, 'kernel': 'Normal', 'loss_name': 'NLLLoss'}. Best is trial 33 with value: 0.6976094983213004.[0m
[32m[I 2022-04-22 17:33:11,305][0m Trial 105 finished with value: 0.6688109550188145 and parameters: {'n_hidden': 1024, 'mixture_components': 2, 'use_sparse_layer': False, 'use_batchnorm': False, 'use_dropout': False, 'mlp_size_1': 6, 'mlp_size_2': 1, 'mlp_size_3': 0, 'kernel': 'Normal', 'loss_name': 'NLLLoss'}. Best is trial 33 with value: 0.6976094983213004.[0m
[32m[I 2022-04-22 17:34:11,823][0m Trial 106 finished with value: 0.6758194332851946 and parameters: {'n_hidden': 32, 'mixture_components': 4, 'use_sparse_layer': False, 'use_batchnorm': False, 'use_dropout': True, 'dropout': 0.1606062509398033, 'mlp_size_1': 2, 'mlp_size_2': 0, 'mlp_size_3': 0, 'kernel': 'LogLogistic', 'loss_name': 'CensoredNLLLoss'}. Best is trial 33 with value: 0.6976094983213004.[0m
[32m[I 2022-04-22 17:34:58,879][0m Trial 107 finished with value: 0.6896676638223347 and parameters: {'n_hidden': 1024, 'mixture_components': 6, 'use_sparse_layer': False, 'use_batchnorm': False, 'use_dropout': False, 'mlp_size_1': 7, 'mlp_size_2': 0, 'mlp_size_3': 0, 'kernel': 'Normal', 'loss_name': 'NLLLoss'}. Best is trial 33 with value: 0.6976094983213004.[0m
[32m[I 2022-04-22 17:35:56,157][0m Trial 108 finished with value: 0.6777390048316257 and parameters: {'n_hidden': 1024, 'mixture_components': 6, 'use_sparse_layer': False, 'use_batchnorm': False, 'use_dropout': False, 'mlp_size_1': 7, 'mlp_size_2': 0, 'mlp_size_3': 0, 'kernel': 'Normal', 'loss_name': 'NLLLoss'}. Best is trial 33 with value: 0.6976094983213004.[0m
[32m[I 2022-04-22 17:36:36,081][0m Trial 109 finished with value: 0.6846174010103938 and parameters: {'n_hidden': 256, 'mixture_components': 8, 'use_sparse_layer': False, 'use_batchnorm': False, 'use_dropout': False, 'mlp_size_1': 5, 'mlp_size_2': 0, 'mlp_size_3': 0, 'kernel': 'Gumbel', 'loss_name': 'NLLLoss'}. Best is trial 33 with value: 0.6976094983213004.[0m
[32m[I 2022-04-22 17:38:30,248][0m Trial 110 finished with value: 0.6693916591775998 and parameters: {'n_hidden': 512, 'mixture_components': 9, 'use_sparse_layer': True, 'use_sparse_loss': True, 'lmbd': 0.02615874672169232, 'use_batchnorm': True, 'use_dropout': False, 'mlp_size_1': 6, 'mlp_size_2': 0, 'mlp_size_3': 0, 'kernel': 'Normal', 'loss_name': 'NLLLoss'}. Best is trial 33 with value: 0.6976094983213004.[0m
[32m[I 2022-04-22 17:39:16,745][0m Trial 111 finished with value: 0.6724720542996098 and parameters: {'n_hidden': 1024, 'mixture_components': 3, 'use_sparse_layer': False, 'use_batchnorm': False, 'use_dropout': False, 'mlp_size_1': 7, 'mlp_size_2': 0, 'mlp_size_3': 0, 'kernel': 'Normal', 'loss_name': 'NLLLoss'}. Best is trial 33 with value: 0.6976094983213004.[0m
[32m[I 2022-04-22 17:40:04,697][0m Trial 112 finished with value: 0.6831885033714653 and parameters: {'n_hidden': 1024, 'mixture_components': 6, 'use_sparse_layer': False, 'use_batchnorm': False, 'use_dropout': False, 'mlp_size_1': 7, 'mlp_size_2': 0, 'mlp_size_3': 0, 'kernel': 'Normal', 'loss_name': 'NLLLoss'}. Best is trial 33 with value: 0.6976094983213004.[0m
[32m[I 2022-04-22 17:40:50,953][0m Trial 113 finished with value: 0.6778153157150553 and parameters: {'n_hidden': 1024, 'mixture_components': 5, 'use_sparse_layer': False, 'use_batchnorm': False, 'use_dropout': False, 'mlp_size_1': 7, 'mlp_size_2': 0, 'mlp_size_3': 0, 'kernel': 'Normal', 'loss_name': 'NLLLoss'}. Best is trial 33 with value: 0.6976094983213004.[0m
[32m[I 2022-04-22 17:41:34,398][0m Trial 114 finished with value: 0.6840445653254013 and parameters: {'n_hidden': 1024, 'mixture_components': 2, 'use_sparse_layer': False, 'use_batchnorm': False, 'use_dropout': False, 'mlp_size_1': 7, 'mlp_size_2': 0, 'mlp_size_3': 0, 'kernel': 'Normal', 'loss_name': 'NLLLoss'}. Best is trial 33 with value: 0.6976094983213004.[0m
[32m[I 2022-04-22 17:42:15,201][0m Trial 115 finished with value: 0.6767713922444247 and parameters: {'n_hidden': 1024, 'mixture_components': 1, 'use_sparse_layer': False, 'use_batchnorm': False, 'use_dropout': False, 'mlp_size_1': 6, 'mlp_size_2': 0, 'mlp_size_3': 1, 'kernel': 'Logistic', 'loss_name': 'NLLLoss'}. Best is trial 33 with value: 0.6976094983213004.[0m
[32m[I 2022-04-22 17:42:54,134][0m Trial 116 finished with value: -0.6636533251049166 and parameters: {'n_hidden': 1024, 'mixture_components': 7, 'use_sparse_layer': False, 'use_batchnorm': False, 'use_dropout': False, 'mlp_size_1': 7, 'mlp_size_2': 0, 'mlp_size_3': 0, 'kernel': 'Exponential', 'loss_name': 'AlternativeNLLLoss'}. Best is trial 33 with value: 0.6976094983213004.[0m
[32m[I 2022-04-22 17:43:38,097][0m Trial 117 finished with value: 0.6755515385925175 and parameters: {'n_hidden': 64, 'mixture_components': 3, 'use_sparse_layer': False, 'use_batchnorm': False, 'use_dropout': False, 'mlp_size_1': 3, 'mlp_size_2': 0, 'mlp_size_3': 0, 'kernel': 'Normal', 'loss_name': 'NLLLoss'}. Best is trial 33 with value: 0.6976094983213004.[0m
[32m[I 2022-04-22 17:44:32,409][0m Trial 118 finished with value: 0.6841045087915307 and parameters: {'n_hidden': 1024, 'mixture_components': 4, 'use_sparse_layer': False, 'use_batchnorm': False, 'use_dropout': False, 'mlp_size_1': 7, 'mlp_size_2': 0, 'mlp_size_3': 0, 'kernel': 'LogLogistic', 'loss_name': 'NLLLoss'}. Best is trial 33 with value: 0.6976094983213004.[0m
[32m[I 2022-04-22 17:45:19,400][0m Trial 119 finished with value: 0.6796534364723225 and parameters: {'n_hidden': 128, 'mixture_components': 9, 'use_sparse_layer': True, 'use_sparse_loss': False, 'use_batchnorm': False, 'use_dropout': False, 'mlp_size_1': 4, 'mlp_size_2': 0, 'mlp_size_3': 0, 'kernel': 'Normal', 'loss_name': 'NLLLoss'}. Best is trial 33 with value: 0.6976094983213004.[0m
[32m[I 2022-04-22 17:46:00,975][0m Trial 120 finished with value: 0.6894985902331328 and parameters: {'n_hidden': 1024, 'mixture_components': 2, 'use_sparse_layer': False, 'use_batchnorm': False, 'use_dropout': False, 'mlp_size_1': 6, 'mlp_size_2': 0, 'mlp_size_3': 1, 'kernel': 'Normal', 'loss_name': 'NLLLoss'}. Best is trial 33 with value: 0.6976094983213004.[0m
[32m[I 2022-04-22 17:46:49,071][0m Trial 121 finished with value: 0.6770162108081821 and parameters: {'n_hidden': 1024, 'mixture_components': 2, 'use_sparse_layer': False, 'use_batchnorm': False, 'use_dropout': False, 'mlp_size_1': 6, 'mlp_size_2': 0, 'mlp_size_3': 1, 'kernel': 'Normal', 'loss_name': 'NLLLoss'}. Best is trial 33 with value: 0.6976094983213004.[0m
[32m[I 2022-04-22 17:47:36,457][0m Trial 122 finished with value: 0.694688546108065 and parameters: {'n_hidden': 1024, 'mixture_components': 3, 'use_sparse_layer': False, 'use_batchnorm': False, 'use_dropout': False, 'mlp_size_1': 6, 'mlp_size_2': 0, 'mlp_size_3': 1, 'kernel': 'Normal', 'loss_name': 'NLLLoss'}. Best is trial 33 with value: 0.6976094983213004.[0m
[32m[I 2022-04-22 17:48:21,785][0m Trial 123 finished with value: 0.6912635578662947 and parameters: {'n_hidden': 1024, 'mixture_components': 3, 'use_sparse_layer': False, 'use_batchnorm': False, 'use_dropout': False, 'mlp_size_1': 6, 'mlp_size_2': 0, 'mlp_size_3': 1, 'kernel': 'Normal', 'loss_name': 'NLLLoss'}. Best is trial 33 with value: 0.6976094983213004.[0m
[32m[I 2022-04-22 17:49:07,546][0m Trial 124 finished with value: 0.6869695443200936 and parameters: {'n_hidden': 1024, 'mixture_components': 3, 'use_sparse_layer': False, 'use_batchnorm': False, 'use_dropout': False, 'mlp_size_1': 6, 'mlp_size_2': 0, 'mlp_size_3': 1, 'kernel': 'Normal', 'loss_name': 'NLLLoss'}. Best is trial 33 with value: 0.6976094983213004.[0m
[32m[I 2022-04-22 17:49:46,291][0m Trial 125 finished with value: 0.6826984730173681 and parameters: {'n_hidden': 1024, 'mixture_components': 3, 'use_sparse_layer': False, 'use_batchnorm': False, 'use_dropout': False, 'mlp_size_1': 6, 'mlp_size_2': 0, 'mlp_size_3': 1, 'kernel': 'Normal', 'loss_name': 'NLLLoss'}. Best is trial 33 with value: 0.6976094983213004.[0m
[32m[I 2022-04-22 17:50:23,176][0m Trial 126 finished with value: 0.6404535110775846 and parameters: {'n_hidden': 1024, 'mixture_components': 3, 'use_sparse_layer': False, 'use_batchnorm': False, 'use_dropout': False, 'mlp_size_1': 6, 'mlp_size_2': 0, 'mlp_size_3': 1, 'kernel': 'Normal', 'loss_name': 'NLLLoss'}. Best is trial 33 with value: 0.6976094983213004.[0m
[32m[I 2022-04-22 17:51:17,201][0m Trial 127 finished with value: 0.6088569707751376 and parameters: {'n_hidden': 512, 'mixture_components': 4, 'use_sparse_layer': False, 'use_batchnorm': False, 'use_dropout': True, 'dropout': 0.738240888365758, 'mlp_size_1': 6, 'mlp_size_2': 0, 'mlp_size_3': 0, 'kernel': 'Logistic', 'loss_name': 'NLLLoss'}. Best is trial 33 with value: 0.6976094983213004.[0m
[32m[I 2022-04-22 17:52:27,320][0m Trial 128 finished with value: 0.6276703581163223 and parameters: {'n_hidden': 2048, 'mixture_components': 3, 'use_sparse_layer': False, 'use_batchnorm': False, 'use_dropout': False, 'mlp_size_1': 8, 'mlp_size_2': 0, 'mlp_size_3': 0, 'kernel': 'Normal', 'loss_name': 'CensoredNLLLoss'}. Best is trial 33 with value: 0.6976094983213004.[0m
[32m[I 2022-04-22 17:53:26,221][0m Trial 129 finished with value: -0.04204791219634507 and parameters: {'n_hidden': 1024, 'mixture_components': 1, 'use_sparse_layer': False, 'use_batchnorm': True, 'use_dropout': False, 'mlp_size_1': 1, 'mlp_size_2': 5, 'mlp_size_3': 1, 'kernel': 'Gumbel', 'loss_name': 'NLLLoss'}. Best is trial 33 with value: 0.6976094983213004.[0m
[32m[I 2022-04-22 17:54:02,831][0m Trial 130 finished with value: 0.6779767651978572 and parameters: {'n_hidden': 1024, 'mixture_components': 4, 'use_sparse_layer': False, 'use_batchnorm': False, 'use_dropout': False, 'mlp_size_1': 5, 'mlp_size_2': 2, 'mlp_size_3': 0, 'kernel': 'Normal', 'loss_name': 'NLLLoss'}. Best is trial 33 with value: 0.6976094983213004.[0m
[32m[I 2022-04-22 17:54:51,073][0m Trial 131 finished with value: 0.6890623820452924 and parameters: {'n_hidden': 1024, 'mixture_components': 2, 'use_sparse_layer': False, 'use_batchnorm': False, 'use_dropout': False, 'mlp_size_1': 6, 'mlp_size_2': 0, 'mlp_size_3': 1, 'kernel': 'Normal', 'loss_name': 'NLLLoss'}. Best is trial 33 with value: 0.6976094983213004.[0m
[32m[I 2022-04-22 17:55:37,851][0m Trial 132 finished with value: 0.6806741788771974 and parameters: {'n_hidden': 1024, 'mixture_components': 3, 'use_sparse_layer': False, 'use_batchnorm': False, 'use_dropout': False, 'mlp_size_1': 6, 'mlp_size_2': 0, 'mlp_size_3': 1, 'kernel': 'Normal', 'loss_name': 'NLLLoss'}. Best is trial 33 with value: 0.6976094983213004.[0m
[32m[I 2022-04-22 17:56:15,343][0m Trial 133 finished with value: 0.693961681640786 and parameters: {'n_hidden': 1024, 'mixture_components': 2, 'use_sparse_layer': False, 'use_batchnorm': False, 'use_dropout': False, 'mlp_size_1': 6, 'mlp_size_2': 0, 'mlp_size_3': 1, 'kernel': 'Normal', 'loss_name': 'NLLLoss'}. Best is trial 33 with value: 0.6976094983213004.[0m
[32m[I 2022-04-22 17:57:23,497][0m Trial 134 finished with value: 0.6612209284111237 and parameters: {'n_hidden': 1024, 'mixture_components': 1, 'use_sparse_layer': False, 'use_batchnorm': False, 'use_dropout': False, 'mlp_size_1': 6, 'mlp_size_2': 0, 'mlp_size_3': 1, 'kernel': 'Normal', 'loss_name': 'NLLLoss'}. Best is trial 33 with value: 0.6976094983213004.[0m
[32m[I 2022-04-22 17:57:59,950][0m Trial 135 finished with value: 0.7009567952772325 and parameters: {'n_hidden': 1024, 'mixture_components': 3, 'use_sparse_layer': False, 'use_batchnorm': False, 'use_dropout': False, 'mlp_size_1': 6, 'mlp_size_2': 0, 'mlp_size_3': 1, 'kernel': 'Normal', 'loss_name': 'NLLLoss'}. Best is trial 135 with value: 0.7009567952772325.[0m
[32m[I 2022-04-22 17:58:42,082][0m Trial 136 finished with value: 0.6884512138005194 and parameters: {'n_hidden': 1024, 'mixture_components': 3, 'use_sparse_layer': False, 'use_batchnorm': False, 'use_dropout': False, 'mlp_size_1': 6, 'mlp_size_2': 0, 'mlp_size_3': 1, 'kernel': 'LogLogistic', 'loss_name': 'NLLLoss'}. Best is trial 135 with value: 0.7009567952772325.[0m
[32m[I 2022-04-22 17:59:33,203][0m Trial 137 finished with value: 0.6821905396339069 and parameters: {'n_hidden': 32, 'mixture_components': 3, 'use_sparse_layer': True, 'use_sparse_loss': True, 'lmbd': 9.130212677421392e-06, 'use_batchnorm': False, 'use_dropout': False, 'mlp_size_1': 2, 'mlp_size_2': 0, 'mlp_size_3': 0, 'kernel': 'Normal', 'loss_name': 'NLLLoss'}. Best is trial 135 with value: 0.7009567952772325.[0m
[32m[I 2022-04-22 18:00:28,361][0m Trial 138 finished with value: 0.677617722251038 and parameters: {'n_hidden': 1024, 'mixture_components': 3, 'use_sparse_layer': False, 'use_batchnorm': False, 'use_dropout': False, 'mlp_size_1': 6, 'mlp_size_2': 0, 'mlp_size_3': 1, 'kernel': 'Normal', 'loss_name': 'NLLLoss'}. Best is trial 135 with value: 0.7009567952772325.[0m
[32m[I 2022-04-22 18:01:30,022][0m Trial 139 finished with value: 0.6825397254658488 and parameters: {'n_hidden': 256, 'mixture_components': 2, 'use_sparse_layer': False, 'use_batchnorm': False, 'use_dropout': False, 'mlp_size_1': 5, 'mlp_size_2': 0, 'mlp_size_3': 0, 'kernel': 'Gumbel', 'loss_name': 'AlternativeNLLLoss'}. Best is trial 135 with value: 0.7009567952772325.[0m
[32m[I 2022-04-22 18:02:22,020][0m Trial 140 finished with value: 0.6752101865954563 and parameters: {'n_hidden': 1024, 'mixture_components': 2, 'use_sparse_layer': False, 'use_batchnorm': False, 'use_dropout': False, 'mlp_size_1': 5, 'mlp_size_2': 1, 'mlp_size_3': 1, 'kernel': 'Exponential', 'loss_name': 'NLLLoss'}. Best is trial 135 with value: 0.7009567952772325.[0m
[32m[I 2022-04-22 18:03:13,500][0m Trial 141 finished with value: 0.6679674109683961 and parameters: {'n_hidden': 1024, 'mixture_components': 8, 'use_sparse_layer': False, 'use_batchnorm': False, 'use_dropout': False, 'mlp_size_1': 7, 'mlp_size_2': 0, 'mlp_size_3': 0, 'kernel': 'Normal', 'loss_name': 'NLLLoss'}. Best is trial 135 with value: 0.7009567952772325.[0m
[32m[I 2022-04-22 18:03:57,188][0m Trial 142 finished with value: 0.6876637980998975 and parameters: {'n_hidden': 1024, 'mixture_components': 10, 'use_sparse_layer': False, 'use_batchnorm': False, 'use_dropout': False, 'mlp_size_1': 6, 'mlp_size_2': 0, 'mlp_size_3': 1, 'kernel': 'Normal', 'loss_name': 'NLLLoss'}. Best is trial 135 with value: 0.7009567952772325.[0m
[32m[I 2022-04-22 18:04:39,462][0m Trial 143 finished with value: 0.6681025175149488 and parameters: {'n_hidden': 1024, 'mixture_components': 5, 'use_sparse_layer': False, 'use_batchnorm': False, 'use_dropout': False, 'mlp_size_1': 7, 'mlp_size_2': 0, 'mlp_size_3': 0, 'kernel': 'Normal', 'loss_name': 'NLLLoss'}. Best is trial 135 with value: 0.7009567952772325.[0m
[32m[I 2022-04-22 18:05:21,073][0m Trial 144 finished with value: 0.6875379201390096 and parameters: {'n_hidden': 1024, 'mixture_components': 3, 'use_sparse_layer': False, 'use_batchnorm': False, 'use_dropout': False, 'mlp_size_1': 6, 'mlp_size_2': 0, 'mlp_size_3': 1, 'kernel': 'Normal', 'loss_name': 'NLLLoss'}. Best is trial 135 with value: 0.7009567952772325.[0m
[32m[I 2022-04-22 18:06:10,857][0m Trial 145 finished with value: 0.6723185917895363 and parameters: {'n_hidden': 512, 'mixture_components': 4, 'use_sparse_layer': False, 'use_batchnorm': False, 'use_dropout': False, 'mlp_size_1': 6, 'mlp_size_2': 0, 'mlp_size_3': 0, 'kernel': 'Normal', 'loss_name': 'NLLLoss'}. Best is trial 135 with value: 0.7009567952772325.[0m
[32m[I 2022-04-22 18:06:54,384][0m Trial 146 finished with value: 0.6756463021585561 and parameters: {'n_hidden': 1024, 'mixture_components': 4, 'use_sparse_layer': False, 'use_batchnorm': False, 'use_dropout': False, 'mlp_size_1': 7, 'mlp_size_2': 0, 'mlp_size_3': 0, 'kernel': 'Logistic', 'loss_name': 'NLLLoss'}. Best is trial 135 with value: 0.7009567952772325.[0m
[32m[I 2022-04-22 18:07:53,716][0m Trial 147 finished with value: 0.6766491200502848 and parameters: {'n_hidden': 1024, 'mixture_components': 3, 'use_sparse_layer': False, 'use_batchnorm': False, 'use_dropout': False, 'mlp_size_1': 7, 'mlp_size_2': 0, 'mlp_size_3': 0, 'kernel': 'Normal', 'loss_name': 'NLLLoss'}. Best is trial 135 with value: 0.7009567952772325.[0m
[32m[I 2022-04-22 18:08:35,756][0m Trial 148 finished with value: 0.6187217041843805 and parameters: {'n_hidden': 1024, 'mixture_components': 2, 'use_sparse_layer': True, 'use_sparse_loss': True, 'lmbd': 0.0014805472454279926, 'use_batchnorm': False, 'use_dropout': False, 'mlp_size_1': 6, 'mlp_size_2': 0, 'mlp_size_3': 1, 'kernel': 'Normal', 'loss_name': 'NLLLoss'}. Best is trial 135 with value: 0.7009567952772325.[0m
[32m[I 2022-04-22 18:09:14,489][0m Trial 149 finished with value: 0.6373030171742721 and parameters: {'n_hidden': 1024, 'mixture_components': 9, 'use_sparse_layer': False, 'use_batchnorm': False, 'use_dropout': True, 'dropout': 0.9543055273148204, 'mlp_size_1': 7, 'mlp_size_2': 0, 'mlp_size_3': 0, 'kernel': 'Normal', 'loss_name': 'NLLLoss'}. Best is trial 135 with value: 0.7009567952772325.[0m
[32m[I 2022-04-22 18:10:01,471][0m Trial 150 finished with value: 0.6725536629035369 and parameters: {'n_hidden': 64, 'mixture_components': 3, 'use_sparse_layer': False, 'use_batchnorm': False, 'use_dropout': False, 'mlp_size_1': 3, 'mlp_size_2': 0, 'mlp_size_3': 0, 'kernel': 'LogLogistic', 'loss_name': 'NLLLoss'}. Best is trial 135 with value: 0.7009567952772325.[0m
[32m[I 2022-04-22 18:10:48,149][0m Trial 151 finished with value: 0.6656637049051273 and parameters: {'n_hidden': 1024, 'mixture_components': 2, 'use_sparse_layer': False, 'use_batchnorm': False, 'use_dropout': False, 'mlp_size_1': 6, 'mlp_size_2': 0, 'mlp_size_3': 1, 'kernel': 'Normal', 'loss_name': 'NLLLoss'}. Best is trial 135 with value: 0.7009567952772325.[0m
[32m[I 2022-04-22 18:11:38,081][0m Trial 152 finished with value: 0.6732272298474198 and parameters: {'n_hidden': 1024, 'mixture_components': 2, 'use_sparse_layer': False, 'use_batchnorm': False, 'use_dropout': False, 'mlp_size_1': 6, 'mlp_size_2': 0, 'mlp_size_3': 1, 'kernel': 'Normal', 'loss_name': 'NLLLoss'}. Best is trial 135 with value: 0.7009567952772325.[0m
[32m[I 2022-04-22 18:12:23,994][0m Trial 153 finished with value: 0.6758106037689486 and parameters: {'n_hidden': 1024, 'mixture_components': 1, 'use_sparse_layer': False, 'use_batchnorm': False, 'use_dropout': False, 'mlp_size_1': 6, 'mlp_size_2': 0, 'mlp_size_3': 1, 'kernel': 'Normal', 'loss_name': 'NLLLoss'}. Best is trial 135 with value: 0.7009567952772325.[0m
[32m[I 2022-04-22 18:13:01,956][0m Trial 154 finished with value: 0.6852547636106732 and parameters: {'n_hidden': 1024, 'mixture_components': 2, 'use_sparse_layer': False, 'use_batchnorm': False, 'use_dropout': False, 'mlp_size_1': 6, 'mlp_size_2': 0, 'mlp_size_3': 1, 'kernel': 'Normal', 'loss_name': 'NLLLoss'}. Best is trial 135 with value: 0.7009567952772325.[0m
[32m[I 2022-04-22 18:13:46,503][0m Trial 155 finished with value: 0.6751631767859132 and parameters: {'n_hidden': 1024, 'mixture_components': 7, 'use_sparse_layer': False, 'use_batchnorm': False, 'use_dropout': False, 'mlp_size_1': 6, 'mlp_size_2': 0, 'mlp_size_3': 1, 'kernel': 'Normal', 'loss_name': 'NLLLoss'}. Best is trial 135 with value: 0.7009567952772325.[0m
[32m[I 2022-04-22 18:15:22,977][0m Trial 156 finished with value: 0.6136306028455033 and parameters: {'n_hidden': 128, 'mixture_components': 1, 'use_sparse_layer': False, 'use_batchnorm': True, 'use_dropout': False, 'mlp_size_1': 4, 'mlp_size_2': 0, 'mlp_size_3': 0, 'kernel': 'Normal', 'loss_name': 'NLLLoss'}. Best is trial 135 with value: 0.7009567952772325.[0m
[32m[I 2022-04-22 18:16:33,752][0m Trial 157 finished with value: 0.6744316052911945 and parameters: {'n_hidden': 1024, 'mixture_components': 3, 'use_sparse_layer': False, 'use_batchnorm': False, 'use_dropout': False, 'mlp_size_1': 7, 'mlp_size_2': 0, 'mlp_size_3': 0, 'kernel': 'Normal', 'loss_name': 'CensoredNLLLoss'}. Best is trial 135 with value: 0.7009567952772325.[0m
[32m[I 2022-04-22 18:17:20,812][0m Trial 158 finished with value: 0.6966300020545514 and parameters: {'n_hidden': 1024, 'mixture_components': 3, 'use_sparse_layer': False, 'use_batchnorm': False, 'use_dropout': False, 'mlp_size_1': 7, 'mlp_size_2': 0, 'mlp_size_3': 0, 'kernel': 'Gumbel', 'loss_name': 'NLLLoss'}. Best is trial 135 with value: 0.7009567952772325.[0m
