[32m[I 2022-04-22 22:58:42,682][0m Trial 482 finished with value: 0.6492128630515998 and parameters: {'loss': 'coxph', 'learning_rate': 0.012652778657077455, 'n_estimators': 1000, 'criterion': 'friedman_mse', 'min_samples_split': 10, 'min_samples_leaf': 3, 'min_weight_fraction_leaf': 0.03881424393981883, 'min_impurity_decrease': 0.8753785283933342, 'max_features': 0.6336302828397937, 'subsample': 0.27560246232662217, 'dropout_rate': 0.43304216795335493, 'ccp_alpha': 0.09879508732463216}. Best is trial 218 with value: 0.6659976583847056.[0m
[32m[I 2022-04-22 22:59:24,332][0m Trial 483 finished with value: 0.5 and parameters: {'loss': 'coxph', 'learning_rate': 0.023860873866283282, 'n_estimators': 428, 'criterion': 'friedman_mse', 'min_samples_split': 10, 'min_samples_leaf': 3, 'min_weight_fraction_leaf': 0.09911866775266816, 'min_impurity_decrease': 0.9487905262799855, 'max_features': 0.7715411270822965, 'subsample': 0.2949148312811699, 'dropout_rate': 0.31730415537068735, 'ccp_alpha': 3.580526672107402}. Best is trial 218 with value: 0.6659976583847056.[0m
[32m[I 2022-04-22 23:00:22,509][0m Trial 484 finished with value: 0.5618865273012629 and parameters: {'loss': 'coxph', 'learning_rate': 0.08276007348453575, 'n_estimators': 475, 'criterion': 'friedman_mse', 'min_samples_split': 10, 'min_samples_leaf': 3, 'min_weight_fraction_leaf': 0.11926167693509648, 'min_impurity_decrease': 0.9009569809456444, 'max_features': 0.6028679545961564, 'subsample': 0.24930405257093674, 'dropout_rate': 0.1779387532169109, 'ccp_alpha': 0.28355780121981894}. Best is trial 218 with value: 0.6659976583847056.[0m
[32m[I 2022-04-22 23:01:24,170][0m Trial 485 finished with value: 0.5132549114240101 and parameters: {'loss': 'coxph', 'learning_rate': 0.05351775680246364, 'n_estimators': 505, 'criterion': 'friedman_mse', 'min_samples_split': 10, 'min_samples_leaf': 3, 'min_weight_fraction_leaf': 0.07852594251551366, 'min_impurity_decrease': 0.9806713160657351, 'max_features': 0.5425730976444628, 'subsample': 0.6358987280562137, 'dropout_rate': 0.24890261797107147, 'ccp_alpha': 0.16080772859306003}. Best is trial 218 with value: 0.6659976583847056.[0m
[32m[I 2022-04-22 23:02:07,909][0m Trial 486 finished with value: 0.5 and parameters: {'loss': 'coxph', 'learning_rate': 0.03574681541813476, 'n_estimators': 444, 'criterion': 'friedman_mse', 'min_samples_split': 10, 'min_samples_leaf': 3, 'min_weight_fraction_leaf': 0.06306933943259788, 'min_impurity_decrease': 0.9274768289284778, 'max_features': 0.731472923353037, 'subsample': 0.33603117425801426, 'dropout_rate': 0.3395211871777166, 'ccp_alpha': 2.4351012505464156}. Best is trial 218 with value: 0.6659976583847056.[0m
[32m[I 2022-04-22 23:04:47,214][0m Trial 487 finished with value: 0.6555410748902404 and parameters: {'loss': 'coxph', 'learning_rate': 0.06784809956152807, 'n_estimators': 798, 'criterion': 'friedman_mse', 'min_samples_split': 10, 'min_samples_leaf': 3, 'min_weight_fraction_leaf': 0.07256355015765696, 'min_impurity_decrease': 0.8873143994361131, 'max_features': 0.5117526446573047, 'subsample': 0.31667177926390483, 'dropout_rate': 0.20522595121216416, 'ccp_alpha': 0.08629765095640751}. Best is trial 218 with value: 0.6659976583847056.[0m
[32m[I 2022-04-22 23:05:49,604][0m Trial 488 finished with value: 0.6207565504378214 and parameters: {'loss': 'coxph', 'learning_rate': 0.09976539976828062, 'n_estimators': 524, 'criterion': 'friedman_mse', 'min_samples_split': 10, 'min_samples_leaf': 3, 'min_weight_fraction_leaf': 0.08383314144020017, 'min_impurity_decrease': 0.8611730394167255, 'max_features': 0.7545799802088194, 'subsample': 0.23186506348268085, 'dropout_rate': 0.28868102290669145, 'ccp_alpha': 0.20606867179389454}. Best is trial 218 with value: 0.6659976583847056.[0m
[32m[I 2022-04-22 23:06:45,089][0m Trial 489 finished with value: 0.63963532013406 and parameters: {'loss': 'coxph', 'learning_rate': 0.015614100606531654, 'n_estimators': 484, 'criterion': 'friedman_mse', 'min_samples_split': 10, 'min_samples_leaf': 6, 'min_weight_fraction_leaf': 0.055356155456865605, 'min_impurity_decrease': 0.9581946970072974, 'max_features': 0.5572790077193179, 'subsample': 0.41530966397212, 'dropout_rate': 0.2559154970910876, 'ccp_alpha': 0.09075054263805862}. Best is trial 218 with value: 0.6659976583847056.[0m
[32m[I 2022-04-22 23:08:19,257][0m Trial 490 finished with value: 0.6540648016624806 and parameters: {'loss': 'coxph', 'learning_rate': 0.04380439460270044, 'n_estimators': 691, 'criterion': 'friedman_mse', 'min_samples_split': 10, 'min_samples_leaf': 3, 'min_weight_fraction_leaf': 0.09692433330336106, 'min_impurity_decrease': 0.9094313196164941, 'max_features': 0.04730677854508403, 'subsample': 0.36637499682458935, 'dropout_rate': 0.3733200062069467, 'ccp_alpha': 0.08066035190125904}. Best is trial 218 with value: 0.6659976583847056.[0m
[32m[I 2022-04-22 23:11:46,782][0m Trial 491 finished with value: 0.5006540204610004 and parameters: {'loss': 'coxph', 'learning_rate': 2.158710422861965e-06, 'n_estimators': 950, 'criterion': 'friedman_mse', 'min_samples_split': 10, 'min_samples_leaf': 3, 'min_weight_fraction_leaf': 0.10961628696466343, 'min_impurity_decrease': 0.9370840733927067, 'max_features': 0.7024300955703764, 'subsample': 0.2633568568879043, 'dropout_rate': 0.22416964443978593, 'ccp_alpha': 0.41428940216343735}. Best is trial 218 with value: 0.6659976583847056.[0m
[32m[I 2022-04-22 23:12:25,864][0m Trial 492 finished with value: 0.6064275583948228 and parameters: {'loss': 'coxph', 'learning_rate': 0.053261701253326944, 'n_estimators': 413, 'criterion': 'friedman_mse', 'min_samples_split': 10, 'min_samples_leaf': 3, 'min_weight_fraction_leaf': 0.06948220273947864, 'min_impurity_decrease': 0.8352871767750395, 'max_features': 0.8181846869400672, 'subsample': 0.28418846531016484, 'dropout_rate': 0.304098187636134, 'ccp_alpha': 0.19237008152439866}. Best is trial 218 with value: 0.6659976583847056.[0m
/media/san2_ssd/data/Workdir/survival/venv/lib/python3.8/site-packages/sksurv/ensemble/boosting.py:955: RuntimeWarning: divide by zero encountered in log
  time = numpy.log(time)
/media/san2_ssd/data/Workdir/survival/venv/lib/python3.8/site-packages/sksurv/ensemble/boosting.py:955: RuntimeWarning: divide by zero encountered in log
  time = numpy.log(time)
/media/san2_ssd/data/Workdir/survival/venv/lib/python3.8/site-packages/sksurv/ensemble/boosting.py:955: RuntimeWarning: divide by zero encountered in log
  time = numpy.log(time)
/media/san2_ssd/data/Workdir/survival/venv/lib/python3.8/site-packages/sksurv/ensemble/boosting.py:955: RuntimeWarning: divide by zero encountered in log
  time = numpy.log(time)
[32m[I 2022-04-22 23:12:35,480][0m Trial 493 finished with value: -0.7 and parameters: {'loss': 'squared', 'learning_rate': 0.029743249038322653, 'n_estimators': 553, 'criterion': 'absolute_error', 'min_samples_split': 10, 'min_samples_leaf': 3, 'min_weight_fraction_leaf': 0.045473905508109334, 'min_impurity_decrease': 0.8974726023618096, 'max_features': 0.6703696846926775, 'subsample': 0.3026666090431456, 'dropout_rate': 0.49556980747489665, 'ccp_alpha': 0.08560586186565503}. Best is trial 218 with value: 0.6659976583847056.[0m
[32m[I 2022-04-22 23:13:11,988][0m Trial 494 finished with value: 0.5685809382073378 and parameters: {'loss': 'coxph', 'learning_rate': 0.06324829139213956, 'n_estimators': 497, 'criterion': 'friedman_mse', 'min_samples_split': 10, 'min_samples_leaf': 4, 'min_weight_fraction_leaf': 0.08447918344556572, 'min_impurity_decrease': 0.8738430428111942, 'max_features': 0.6152993252755932, 'subsample': 0.20787062146651566, 'dropout_rate': 0.5812025383780968, 'ccp_alpha': 0.3082709887589515}. Best is trial 218 with value: 0.6659976583847056.[0m
[32m[I 2022-04-22 23:14:05,478][0m Trial 495 finished with value: 0.6569334792068763 and parameters: {'loss': 'coxph', 'learning_rate': 0.011198787975066215, 'n_estimators': 464, 'criterion': 'friedman_mse', 'min_samples_split': 10, 'min_samples_leaf': 3, 'min_weight_fraction_leaf': 0.05885006578310381, 'min_impurity_decrease': 0.9177590522312452, 'max_features': 0.5790163348803576, 'subsample': 0.2529100237238923, 'dropout_rate': 0.2714955063814899, 'ccp_alpha': 0.0010250232144943718}. Best is trial 218 with value: 0.6659976583847056.[0m
[32m[I 2022-04-22 23:15:03,863][0m Trial 496 finished with value: 0.6237150855961573 and parameters: {'loss': 'coxph', 'learning_rate': 0.08173272604553833, 'n_estimators': 533, 'criterion': 'friedman_mse', 'min_samples_split': 10, 'min_samples_leaf': 3, 'min_weight_fraction_leaf': 0.07543423563528025, 'min_impurity_decrease': 0.8095794232626226, 'max_features': 0.5326200559082487, 'subsample': 0.2828668385754254, 'dropout_rate': 0.39015677122205006, 'ccp_alpha': 0.18139561311012048}. Best is trial 218 with value: 0.6659976583847056.[0m
[32m[I 2022-04-22 23:17:33,029][0m Trial 497 finished with value: 0.6479215505976873 and parameters: {'loss': 'coxph', 'learning_rate': 0.021072070424546528, 'n_estimators': 769, 'criterion': 'friedman_mse', 'min_samples_split': 10, 'min_samples_leaf': 3, 'min_weight_fraction_leaf': 0.09213161264258636, 'min_impurity_decrease': 0.9940521193897748, 'max_features': 0.6414118409904936, 'subsample': 0.7554424131336133, 'dropout_rate': 0.23203132565148246, 'ccp_alpha': 0.0011899004860329203}. Best is trial 218 with value: 0.6659976583847056.[0m
[32m[I 2022-04-22 23:18:37,443][0m Trial 498 finished with value: 0.642819822234457 and parameters: {'loss': 'coxph', 'learning_rate': 0.03934601532664472, 'n_estimators': 511, 'criterion': 'friedman_mse', 'min_samples_split': 10, 'min_samples_leaf': 4, 'min_weight_fraction_leaf': 0.06601469089060549, 'min_impurity_decrease': 0.9481404517581381, 'max_features': 0.7168355846232181, 'subsample': 0.3488579928014975, 'dropout_rate': 0.1916568857123585, 'ccp_alpha': 0.09869726681907484}. Best is trial 218 with value: 0.6659976583847056.[0m
[32m[I 2022-04-22 23:20:01,362][0m Trial 499 finished with value: 0.5643207752727695 and parameters: {'loss': 'coxph', 'learning_rate': 0.06355929070713202, 'n_estimators': 622, 'criterion': 'friedman_mse', 'min_samples_split': 10, 'min_samples_leaf': 3, 'min_weight_fraction_leaf': 0.4869346181806147, 'min_impurity_decrease': 0.9660713451013445, 'max_features': 0.5945368713364472, 'subsample': 0.32408620426708523, 'dropout_rate': 0.32284898320723143, 'ccp_alpha': 0.0011611309627641364}. Best is trial 218 with value: 0.6659976583847056.[0m
[32m[I 2022-04-22 23:22:19,448][0m Trial 500 finished with value: 0.5 and parameters: {'loss': 'coxph', 'learning_rate': 0.02748411896297162, 'n_estimators': 858, 'criterion': 'squared_error', 'min_samples_split': 10, 'min_samples_leaf': 3, 'min_weight_fraction_leaf': 0.10269032533400496, 'min_impurity_decrease': 0.8908407493889043, 'max_features': 0.5554338756600078, 'subsample': 0.3008645836630928, 'dropout_rate': 0.4189389263804876, 'ccp_alpha': 0.2514868157937333}. Best is trial 218 with value: 0.6659976583847056.[0m
[32m[I 2022-04-22 23:23:17,751][0m Trial 501 finished with value: 0.6600740616366968 and parameters: {'loss': 'coxph', 'learning_rate': 0.04738713888228442, 'n_estimators': 477, 'criterion': 'friedman_mse', 'min_samples_split': 10, 'min_samples_leaf': 3, 'min_weight_fraction_leaf': 0.07874979423004395, 'min_impurity_decrease': 0.9293855527527243, 'max_features': 0.7401519282367549, 'subsample': 0.22986971874167544, 'dropout_rate': 0.21073510724335157, 'ccp_alpha': 0.16091412600083302}. Best is trial 218 with value: 0.6659976583847056.[0m
[32m[I 2022-04-22 23:24:41,023][0m Trial 502 finished with value: 0.662490074344068 and parameters: {'loss': 'coxph', 'learning_rate': 0.07960452194851862, 'n_estimators': 580, 'criterion': 'friedman_mse', 'min_samples_split': 10, 'min_samples_leaf': 3, 'min_weight_fraction_leaf': 0.05286407512999614, 'min_impurity_decrease': 0.860622560561018, 'max_features': 0.5065926563815866, 'subsample': 0.26605489279548555, 'dropout_rate': 0.24951622547943136, 'ccp_alpha': 0.0022277026973333875}. Best is trial 218 with value: 0.6659976583847056.[0m
[32m[I 2022-04-22 23:26:06,188][0m Trial 503 finished with value: 0.6498416949575299 and parameters: {'loss': 'coxph', 'learning_rate': 0.08382928970492023, 'n_estimators': 596, 'criterion': 'friedman_mse', 'min_samples_split': 10, 'min_samples_leaf': 3, 'min_weight_fraction_leaf': 0.03354480652874128, 'min_impurity_decrease': 0.8542230974596006, 'max_features': 0.5030293826306804, 'subsample': 0.26118438157402396, 'dropout_rate': 0.24913341037043085, 'ccp_alpha': 0.09870394143088845}. Best is trial 218 with value: 0.6659976583847056.[0m
[32m[I 2022-04-22 23:27:25,617][0m Trial 504 finished with value: 0.6576903359731394 and parameters: {'loss': 'coxph', 'learning_rate': 0.03447472265985352, 'n_estimators': 566, 'criterion': 'friedman_mse', 'min_samples_split': 10, 'min_samples_leaf': 3, 'min_weight_fraction_leaf': 0.04520670110504411, 'min_impurity_decrease': 0.8270675714690296, 'max_features': 0.5083409498240798, 'subsample': 0.24286861876772567, 'dropout_rate': 0.23862385322465876, 'ccp_alpha': 0.0017676979925482185}. Best is trial 218 with value: 0.6659976583847056.[0m
[32m[I 2022-04-22 23:28:40,614][0m Trial 505 finished with value: 0.5222147116998119 and parameters: {'loss': 'coxph', 'learning_rate': 0.01484107022561365, 'n_estimators': 585, 'criterion': 'friedman_mse', 'min_samples_split': 10, 'min_samples_leaf': 3, 'min_weight_fraction_leaf': 0.2653342553968051, 'min_impurity_decrease': 0.8608357447733239, 'max_features': 0.5278064635801852, 'subsample': 0.26812915063081255, 'dropout_rate': 0.2662753491704028, 'ccp_alpha': 0.2333287095431919}. Best is trial 218 with value: 0.6659976583847056.[0m
[32m[I 2022-04-22 23:29:53,691][0m Trial 506 finished with value: 0.6530532554645088 and parameters: {'loss': 'coxph', 'learning_rate': 0.08027772962508674, 'n_estimators': 634, 'criterion': 'friedman_mse', 'min_samples_split': 10, 'min_samples_leaf': 3, 'min_weight_fraction_leaf': 0.051817207955873454, 'min_impurity_decrease': 0.8408870479808092, 'max_features': 0.5090604611459466, 'subsample': 0.21675456274588242, 'dropout_rate': 0.45093812500808517, 'ccp_alpha': 0.10233797716833502}. Best is trial 218 with value: 0.6659976583847056.[0m
[32m[I 2022-04-22 23:31:12,336][0m Trial 507 finished with value: 0.5 and parameters: {'loss': 'coxph', 'learning_rate': 0.008501406305073154, 'n_estimators': 575, 'criterion': 'friedman_mse', 'min_samples_split': 10, 'min_samples_leaf': 4, 'min_weight_fraction_leaf': 0.08879901622398512, 'min_impurity_decrease': 0.8787459434279412, 'max_features': 0.5280795242287011, 'subsample': 0.5804115569187372, 'dropout_rate': 0.23011218230856356, 'ccp_alpha': 0.34163986544865255}. Best is trial 218 with value: 0.6659976583847056.[0m
[32m[I 2022-04-22 23:32:22,980][0m Trial 508 finished with value: 0.6299452837630417 and parameters: {'loss': 'coxph', 'learning_rate': 0.05201190023663676, 'n_estimators': 544, 'criterion': 'friedman_mse', 'min_samples_split': 10, 'min_samples_leaf': 3, 'min_weight_fraction_leaf': 0.060870974651356415, 'min_impurity_decrease': 0.8707126440556772, 'max_features': 0.5436204034731928, 'subsample': 0.24957029940184786, 'dropout_rate': 0.26049473100796056, 'ccp_alpha': 0.17418050717850872}. Best is trial 218 with value: 0.6659976583847056.[0m
[32m[I 2022-04-22 23:33:52,439][0m Trial 509 finished with value: 0.6564314515305711 and parameters: {'loss': 'coxph', 'learning_rate': 0.09770154213214335, 'n_estimators': 604, 'criterion': 'friedman_mse', 'min_samples_split': 10, 'min_samples_leaf': 3, 'min_weight_fraction_leaf': 0.0755236114601932, 'min_impurity_decrease': 0.8082324837112138, 'max_features': 0.7783773286289692, 'subsample': 0.2746590377672409, 'dropout_rate': 0.21646775087597753, 'ccp_alpha': 0.09611838226085738}. Best is trial 218 with value: 0.6659976583847056.[0m
[32m[I 2022-04-22 23:36:51,735][0m Trial 510 finished with value: 0.6525082256009906 and parameters: {'loss': 'coxph', 'learning_rate': 0.06887134565681781, 'n_estimators': 884, 'criterion': 'friedman_mse', 'min_samples_split': 10, 'min_samples_leaf': 3, 'min_weight_fraction_leaf': 0.03596622170168058, 'min_impurity_decrease': 0.4471383186529856, 'max_features': 0.5672563725929141, 'subsample': 0.23052740289845286, 'dropout_rate': 0.24692674142815627, 'ccp_alpha': 0.08656606706341921}. Best is trial 218 with value: 0.6659976583847056.[0m
[32m[I 2022-04-22 23:38:07,605][0m Trial 511 finished with value: 0.5 and parameters: {'loss': 'coxph', 'learning_rate': 0.01907051949440329, 'n_estimators': 547, 'criterion': 'friedman_mse', 'min_samples_split': 10, 'min_samples_leaf': 3, 'min_weight_fraction_leaf': 0.05291135294855591, 'min_impurity_decrease': 0.9015831503387838, 'max_features': 0.5033964498126211, 'subsample': 0.3128790057998939, 'dropout_rate': 0.17355021280936217, 'ccp_alpha': 1.4992690218243208}. Best is trial 218 with value: 0.6659976583847056.[0m
[32m[I 2022-04-22 23:39:10,002][0m Trial 512 finished with value: 0.6212554444115198 and parameters: {'loss': 'coxph', 'learning_rate': 0.00014081615059657624, 'n_estimators': 529, 'criterion': 'friedman_mse', 'min_samples_split': 10, 'min_samples_leaf': 3, 'min_weight_fraction_leaf': 0.09298985969174497, 'min_impurity_decrease': 0.8475038381553329, 'max_features': 0.4804593453409468, 'subsample': 0.18999334544737986, 'dropout_rate': 0.2806277061727798, 'ccp_alpha': 0.18664453834267009}. Best is trial 218 with value: 0.6659976583847056.[0m
/media/san2_ssd/data/Workdir/survival/venv/lib/python3.8/site-packages/sksurv/ensemble/boosting.py:955: RuntimeWarning: divide by zero encountered in log
  time = numpy.log(time)
/media/san2_ssd/data/Workdir/survival/venv/lib/python3.8/site-packages/sksurv/ensemble/boosting.py:955: RuntimeWarning: divide by zero encountered in log
  time = numpy.log(time)
/media/san2_ssd/data/Workdir/survival/venv/lib/python3.8/site-packages/sksurv/ensemble/boosting.py:955: RuntimeWarning: divide by zero encountered in log
  time = numpy.log(time)
/media/san2_ssd/data/Workdir/survival/venv/lib/python3.8/site-packages/sksurv/ensemble/boosting.py:955: RuntimeWarning: divide by zero encountered in log
  time = numpy.log(time)
[32m[I 2022-04-22 23:39:43,530][0m Trial 513 finished with value: -0.7365275617296609 and parameters: {'loss': 'squared', 'learning_rate': 2.5160150850558268e-05, 'n_estimators': 823, 'criterion': 'friedman_mse', 'min_samples_split': 10, 'min_samples_leaf': 3, 'min_weight_fraction_leaf': 0.08171355741906741, 'min_impurity_decrease': 0.8792024854513466, 'max_features': 0.7587400514244247, 'subsample': 0.2861068845927914, 'dropout_rate': 0.2011297937083143, 'ccp_alpha': 0.0846485795047556}. Best is trial 218 with value: 0.6659976583847056.[0m
[32m[I 2022-04-22 23:41:29,602][0m Trial 514 finished with value: 0.6594713199528072 and parameters: {'loss': 'coxph', 'learning_rate': 0.04476536674775567, 'n_estimators': 657, 'criterion': 'friedman_mse', 'min_samples_split': 10, 'min_samples_leaf': 3, 'min_weight_fraction_leaf': 0.11092619283360523, 'min_impurity_decrease': 0.9050454907102788, 'max_features': 0.5452481548238671, 'subsample': 0.2618768225162287, 'dropout_rate': 0.26197648167755216, 'ccp_alpha': 0.007815176692683818}. Best is trial 218 with value: 0.6659976583847056.[0m
[32m[I 2022-04-22 23:44:57,193][0m Trial 515 finished with value: 0.5 and parameters: {'loss': 'coxph', 'learning_rate': 0.0587617246788674, 'n_estimators': 947, 'criterion': 'absolute_error', 'min_samples_split': 10, 'min_samples_leaf': 3, 'min_weight_fraction_leaf': 0.06775471746416675, 'min_impurity_decrease': 0.8302484472363886, 'max_features': 0.5830073172130423, 'subsample': 0.3286086566547364, 'dropout_rate': 0.22915308032023107, 'ccp_alpha': 0.005296628143076645}. Best is trial 218 with value: 0.6659976583847056.[0m
[32m[I 2022-04-22 23:46:00,877][0m Trial 516 finished with value: 0.5740354804289527 and parameters: {'loss': 'coxph', 'learning_rate': 0.026863844278629125, 'n_estimators': 506, 'criterion': 'friedman_mse', 'min_samples_split': 10, 'min_samples_leaf': 3, 'min_weight_fraction_leaf': 0.1430237925390605, 'min_impurity_decrease': 0.9800524563978591, 'max_features': 0.513063828394793, 'subsample': 0.29456776366587295, 'dropout_rate': 0.2156798355720807, 'ccp_alpha': 0.2183810651499676}. Best is trial 218 with value: 0.6659976583847056.[0m
[32m[I 2022-04-22 23:46:50,729][0m Trial 517 finished with value: 0.5274764932801516 and parameters: {'loss': 'coxph', 'learning_rate': 0.012980168677769603, 'n_estimators': 448, 'criterion': 'friedman_mse', 'min_samples_split': 10, 'min_samples_leaf': 3, 'min_weight_fraction_leaf': 0.09952239001285444, 'min_impurity_decrease': 0.8582461766941178, 'max_features': 0.2040023779730617, 'subsample': 0.2382763264310101, 'dropout_rate': 0.18481683570882554, 'ccp_alpha': 0.3097981093938718}. Best is trial 218 with value: 0.6659976583847056.[0m
[32m[I 2022-04-22 23:48:02,751][0m Trial 518 finished with value: 0.6414930967646593 and parameters: {'loss': 'coxph', 'learning_rate': 0.038813301725403905, 'n_estimators': 566, 'criterion': 'friedman_mse', 'min_samples_split': 10, 'min_samples_leaf': 4, 'min_weight_fraction_leaf': 0.07407139157150193, 'min_impurity_decrease': 0.9394840889540113, 'max_features': 0.801418719098628, 'subsample': 0.27459250732714235, 'dropout_rate': 0.287216239141758, 'ccp_alpha': 0.1535444401099786}. Best is trial 218 with value: 0.6659976583847056.[0m
