[32m[I 2022-04-24 01:55:24,397][0m Trial 935 finished with value: 0.6431950897387073 and parameters: {'n_hidden': 2048, 'mixture_components': 2, 'use_sparse_layer': False, 'use_batchnorm': False, 'use_dropout': False, 'mlp_size_1': 3, 'mlp_size_2': 3, 'mlp_size_3': 2, 'kernel': 'LogLogistic', 'loss_name': 'CensoredNLLLoss'}. Best is trial 551 with value: 0.6925048594105658.[0m
[32m[I 2022-04-24 01:56:40,985][0m Trial 936 finished with value: 0.6742933318704896 and parameters: {'n_hidden': 2048, 'mixture_components': 1, 'use_sparse_layer': False, 'use_batchnorm': False, 'use_dropout': True, 'dropout': 0.09858487654620238, 'mlp_size_1': 3, 'mlp_size_2': 3, 'mlp_size_3': 2, 'kernel': 'LogLogistic', 'loss_name': 'CensoredNLLLoss'}. Best is trial 551 with value: 0.6925048594105658.[0m
[32m[I 2022-04-24 01:57:52,630][0m Trial 937 finished with value: 0.6424092425719751 and parameters: {'n_hidden': 32, 'mixture_components': 2, 'use_sparse_layer': False, 'use_batchnorm': False, 'use_dropout': True, 'dropout': 0.3244913278808934, 'mlp_size_1': 2, 'mlp_size_2': 0, 'mlp_size_3': 0, 'kernel': 'LogLogistic', 'loss_name': 'AlternativeNLLLoss'}. Best is trial 551 with value: 0.6925048594105658.[0m
[32m[I 2022-04-24 01:59:10,940][0m Trial 938 finished with value: 0.6369883224095414 and parameters: {'n_hidden': 2048, 'mixture_components': 2, 'use_sparse_layer': False, 'use_batchnorm': False, 'use_dropout': True, 'dropout': 0.27987683784472994, 'mlp_size_1': 0, 'mlp_size_2': 7, 'mlp_size_3': 1, 'kernel': 'LogLogistic', 'loss_name': 'CensoredNLLLoss'}. Best is trial 551 with value: 0.6925048594105658.[0m
[32m[I 2022-04-24 02:00:30,015][0m Trial 939 finished with value: 0.6494497392845563 and parameters: {'n_hidden': 2048, 'mixture_components': 2, 'use_sparse_layer': False, 'use_batchnorm': False, 'use_dropout': True, 'dropout': 0.7995875749466111, 'mlp_size_1': 3, 'mlp_size_2': 3, 'mlp_size_3': 2, 'kernel': 'LogLogistic', 'loss_name': 'CensoredNLLLoss'}. Best is trial 551 with value: 0.6925048594105658.[0m
[32m[I 2022-04-24 02:01:53,392][0m Trial 940 finished with value: 0.6653361193316663 and parameters: {'n_hidden': 64, 'mixture_components': 2, 'use_sparse_layer': False, 'use_batchnorm': False, 'use_dropout': True, 'dropout': 0.16812918585963754, 'mlp_size_1': 3, 'mlp_size_2': 0, 'mlp_size_3': 0, 'kernel': 'LogLogistic', 'loss_name': 'AlternativeNLLLoss'}. Best is trial 551 with value: 0.6925048594105658.[0m
[32m[I 2022-04-24 02:03:05,731][0m Trial 941 finished with value: 0.672286437351422 and parameters: {'n_hidden': 1024, 'mixture_components': 2, 'use_sparse_layer': False, 'use_batchnorm': False, 'use_dropout': True, 'dropout': 0.1981894778322319, 'mlp_size_1': 3, 'mlp_size_2': 3, 'mlp_size_3': 1, 'kernel': 'LogLogistic', 'loss_name': 'CensoredNLLLoss'}. Best is trial 551 with value: 0.6925048594105658.[0m
[32m[I 2022-04-24 02:04:19,878][0m Trial 942 finished with value: 0.6847433995944399 and parameters: {'n_hidden': 2048, 'mixture_components': 2, 'use_sparse_layer': False, 'use_batchnorm': False, 'use_dropout': True, 'dropout': 0.30534426276011295, 'mlp_size_1': 3, 'mlp_size_2': 3, 'mlp_size_3': 2, 'kernel': 'LogLogistic', 'loss_name': 'CensoredNLLLoss'}. Best is trial 551 with value: 0.6925048594105658.[0m
[32m[I 2022-04-24 02:05:19,178][0m Trial 943 finished with value: 0.6250161801466767 and parameters: {'n_hidden': 128, 'mixture_components': 2, 'use_sparse_layer': False, 'use_batchnorm': False, 'use_dropout': True, 'dropout': 0.3481690153664722, 'mlp_size_1': 3, 'mlp_size_2': 1, 'mlp_size_3': 0, 'kernel': 'LogLogistic', 'loss_name': 'NLLLoss'}. Best is trial 551 with value: 0.6925048594105658.[0m
[32m[I 2022-04-24 02:06:42,988][0m Trial 944 finished with value: 0.6710510031926757 and parameters: {'n_hidden': 2048, 'mixture_components': 1, 'use_sparse_layer': True, 'use_sparse_loss': False, 'use_batchnorm': False, 'use_dropout': True, 'dropout': 0.2944602699604494, 'mlp_size_1': 3, 'mlp_size_2': 3, 'mlp_size_3': 2, 'kernel': 'LogLogistic', 'loss_name': 'CensoredNLLLoss'}. Best is trial 551 with value: 0.6925048594105658.[0m
[32m[I 2022-04-24 02:07:54,876][0m Trial 945 finished with value: 0.6791231518556891 and parameters: {'n_hidden': 2048, 'mixture_components': 2, 'use_sparse_layer': False, 'use_batchnorm': False, 'use_dropout': True, 'dropout': 0.13470884056981136, 'mlp_size_1': 3, 'mlp_size_2': 3, 'mlp_size_3': 2, 'kernel': 'Logistic', 'loss_name': 'AlternativeNLLLoss'}. Best is trial 551 with value: 0.6925048594105658.[0m
[32m[I 2022-04-24 02:09:09,632][0m Trial 946 finished with value: 0.6781960143124921 and parameters: {'n_hidden': 2048, 'mixture_components': 2, 'use_sparse_layer': False, 'use_batchnorm': False, 'use_dropout': True, 'dropout': 0.33397630695508357, 'mlp_size_1': 3, 'mlp_size_2': 3, 'mlp_size_3': 2, 'kernel': 'LogLogistic', 'loss_name': 'CensoredNLLLoss'}. Best is trial 551 with value: 0.6925048594105658.[0m
[32m[I 2022-04-24 02:10:32,457][0m Trial 947 finished with value: 0.6778136852120513 and parameters: {'n_hidden': 2048, 'mixture_components': 4, 'use_sparse_layer': False, 'use_batchnorm': False, 'use_dropout': True, 'dropout': 0.3182037159914007, 'mlp_size_1': 1, 'mlp_size_2': 4, 'mlp_size_3': 2, 'kernel': 'LogLogistic', 'loss_name': 'CensoredNLLLoss'}. Best is trial 551 with value: 0.6925048594105658.[0m
[32m[I 2022-04-24 02:11:42,302][0m Trial 948 finished with value: 0.6160647984689103 and parameters: {'n_hidden': 2048, 'mixture_components': 6, 'use_sparse_layer': False, 'use_batchnorm': False, 'use_dropout': True, 'dropout': 0.3367251742512863, 'mlp_size_1': 8, 'mlp_size_2': 0, 'mlp_size_3': 0, 'kernel': 'LogLogistic', 'loss_name': 'AlternativeNLLLoss'}. Best is trial 551 with value: 0.6925048594105658.[0m
[32m[I 2022-04-24 02:12:57,361][0m Trial 949 finished with value: 0.6846379126701685 and parameters: {'n_hidden': 2048, 'mixture_components': 2, 'use_sparse_layer': False, 'use_batchnorm': False, 'use_dropout': True, 'dropout': 0.35542746991951096, 'mlp_size_1': 3, 'mlp_size_2': 3, 'mlp_size_3': 2, 'kernel': 'LogLogistic', 'loss_name': 'CensoredNLLLoss'}. Best is trial 551 with value: 0.6925048594105658.[0m
[32m[I 2022-04-24 02:13:59,869][0m Trial 950 finished with value: 0.6199456098575649 and parameters: {'n_hidden': 2048, 'mixture_components': 8, 'use_sparse_layer': False, 'use_batchnorm': False, 'use_dropout': True, 'dropout': 0.3507945914512166, 'mlp_size_1': 3, 'mlp_size_2': 3, 'mlp_size_3': 2, 'kernel': 'LogLogistic', 'loss_name': 'CensoredNLLLoss'}. Best is trial 551 with value: 0.6925048594105658.[0m
[32m[I 2022-04-24 02:15:17,965][0m Trial 951 finished with value: 0.6614543046558937 and parameters: {'n_hidden': 2048, 'mixture_components': 2, 'use_sparse_layer': False, 'use_batchnorm': False, 'use_dropout': True, 'dropout': 0.35530929095504216, 'mlp_size_1': 3, 'mlp_size_2': 3, 'mlp_size_3': 2, 'kernel': 'LogLogistic', 'loss_name': 'CensoredNLLLoss'}. Best is trial 551 with value: 0.6925048594105658.[0m
[32m[I 2022-04-24 02:16:27,404][0m Trial 952 finished with value: 0.6742756352294885 and parameters: {'n_hidden': 2048, 'mixture_components': 2, 'use_sparse_layer': False, 'use_batchnorm': False, 'use_dropout': True, 'dropout': 0.3692377930132489, 'mlp_size_1': 3, 'mlp_size_2': 3, 'mlp_size_3': 2, 'kernel': 'LogLogistic', 'loss_name': 'CensoredNLLLoss'}. Best is trial 551 with value: 0.6925048594105658.[0m
[32m[I 2022-04-24 02:20:09,840][0m Trial 953 finished with value: 0.625328879029748 and parameters: {'n_hidden': 2048, 'mixture_components': 2, 'use_sparse_layer': False, 'use_batchnorm': True, 'use_dropout': True, 'dropout': 0.3557592735127893, 'mlp_size_1': 3, 'mlp_size_2': 3, 'mlp_size_3': 2, 'kernel': 'LogLogistic', 'loss_name': 'CensoredNLLLoss'}. Best is trial 551 with value: 0.6925048594105658.[0m
[32m[I 2022-04-24 02:20:59,214][0m Trial 954 finished with value: 0.6512817889458964 and parameters: {'n_hidden': 1024, 'mixture_components': 1, 'use_sparse_layer': False, 'use_batchnorm': False, 'use_dropout': False, 'mlp_size_1': 3, 'mlp_size_2': 3, 'mlp_size_3': 1, 'kernel': 'LogLogistic', 'loss_name': 'CensoredNLLLoss'}. Best is trial 551 with value: 0.6925048594105658.[0m
[32m[I 2022-04-24 02:22:22,521][0m Trial 955 finished with value: 0.6627974434202286 and parameters: {'n_hidden': 2048, 'mixture_components': 2, 'use_sparse_layer': False, 'use_batchnorm': False, 'use_dropout': True, 'dropout': 0.39600153432421226, 'mlp_size_1': 3, 'mlp_size_2': 3, 'mlp_size_3': 2, 'kernel': 'LogLogistic', 'loss_name': 'CensoredNLLLoss'}. Best is trial 551 with value: 0.6925048594105658.[0m
[32m[I 2022-04-24 02:23:20,096][0m Trial 956 finished with value: -0.664921362336377 and parameters: {'n_hidden': 2048, 'mixture_components': 2, 'use_sparse_layer': True, 'use_sparse_loss': False, 'use_batchnorm': False, 'use_dropout': True, 'dropout': 0.3262958461587144, 'mlp_size_1': 2, 'mlp_size_2': 3, 'mlp_size_3': 2, 'kernel': 'Exponential', 'loss_name': 'CensoredNLLLoss'}. Best is trial 551 with value: 0.6925048594105658.[0m
[32m[I 2022-04-24 02:24:37,864][0m Trial 957 finished with value: 0.6740138892494466 and parameters: {'n_hidden': 2048, 'mixture_components': 2, 'use_sparse_layer': False, 'use_batchnorm': False, 'use_dropout': True, 'dropout': 0.3391883919676857, 'mlp_size_1': 3, 'mlp_size_2': 3, 'mlp_size_3': 2, 'kernel': 'LogLogistic', 'loss_name': 'CensoredNLLLoss'}. Best is trial 551 with value: 0.6925048594105658.[0m
[32m[I 2022-04-24 02:25:51,156][0m Trial 958 finished with value: 0.6824589425274725 and parameters: {'n_hidden': 2048, 'mixture_components': 2, 'use_sparse_layer': False, 'use_batchnorm': False, 'use_dropout': True, 'dropout': 0.3829396408105196, 'mlp_size_1': 3, 'mlp_size_2': 3, 'mlp_size_3': 2, 'kernel': 'LogLogistic', 'loss_name': 'CensoredNLLLoss'}. Best is trial 551 with value: 0.6925048594105658.[0m
[32m[I 2022-04-24 02:27:24,533][0m Trial 959 finished with value: 0.6712664222744167 and parameters: {'n_hidden': 2048, 'mixture_components': 2, 'use_sparse_layer': False, 'use_batchnorm': False, 'use_dropout': True, 'dropout': 0.3669797525908034, 'mlp_size_1': 3, 'mlp_size_2': 3, 'mlp_size_3': 2, 'kernel': 'LogLogistic', 'loss_name': 'CensoredNLLLoss'}. Best is trial 551 with value: 0.6925048594105658.[0m
[32m[I 2022-04-24 02:28:36,427][0m Trial 960 finished with value: 0.6701288318697337 and parameters: {'n_hidden': 2048, 'mixture_components': 2, 'use_sparse_layer': False, 'use_batchnorm': False, 'use_dropout': True, 'dropout': 0.3278115789349464, 'mlp_size_1': 3, 'mlp_size_2': 3, 'mlp_size_3': 2, 'kernel': 'LogLogistic', 'loss_name': 'CensoredNLLLoss'}. Best is trial 551 with value: 0.6925048594105658.[0m
[32m[I 2022-04-24 02:29:52,763][0m Trial 961 finished with value: 0.6711893882012713 and parameters: {'n_hidden': 2048, 'mixture_components': 4, 'use_sparse_layer': False, 'use_batchnorm': False, 'use_dropout': True, 'dropout': 0.3116185788278618, 'mlp_size_1': 3, 'mlp_size_2': 3, 'mlp_size_3': 2, 'kernel': 'LogLogistic', 'loss_name': 'CensoredNLLLoss'}. Best is trial 551 with value: 0.6925048594105658.[0m
[32m[I 2022-04-24 02:30:57,159][0m Trial 962 finished with value: 0.6535765841608383 and parameters: {'n_hidden': 32, 'mixture_components': 1, 'use_sparse_layer': False, 'use_batchnorm': False, 'use_dropout': True, 'dropout': 0.3093836236212058, 'mlp_size_1': 2, 'mlp_size_2': 0, 'mlp_size_3': 0, 'kernel': 'LogLogistic', 'loss_name': 'CensoredNLLLoss'}. Best is trial 551 with value: 0.6925048594105658.[0m
[32m[I 2022-04-24 02:32:11,037][0m Trial 963 finished with value: 0.6723767346421806 and parameters: {'n_hidden': 2048, 'mixture_components': 2, 'use_sparse_layer': False, 'use_batchnorm': False, 'use_dropout': True, 'dropout': 0.34748544721336955, 'mlp_size_1': 3, 'mlp_size_2': 3, 'mlp_size_3': 2, 'kernel': 'LogLogistic', 'loss_name': 'CensoredNLLLoss'}. Best is trial 551 with value: 0.6925048594105658.[0m
[32m[I 2022-04-24 02:33:23,380][0m Trial 964 finished with value: 0.67581690652646 and parameters: {'n_hidden': 2048, 'mixture_components': 2, 'use_sparse_layer': False, 'use_batchnorm': False, 'use_dropout': True, 'dropout': 0.11023883081464525, 'mlp_size_1': 3, 'mlp_size_2': 3, 'mlp_size_3': 2, 'kernel': 'Logistic', 'loss_name': 'CensoredNLLLoss'}. Best is trial 551 with value: 0.6925048594105658.[0m
[32m[I 2022-04-24 02:34:27,023][0m Trial 965 finished with value: 0.615193587882706 and parameters: {'n_hidden': 2048, 'mixture_components': 10, 'use_sparse_layer': False, 'use_batchnorm': False, 'use_dropout': True, 'dropout': 0.37805551459615866, 'mlp_size_1': 3, 'mlp_size_2': 3, 'mlp_size_3': 2, 'kernel': 'LogLogistic', 'loss_name': 'CensoredNLLLoss'}. Best is trial 551 with value: 0.6925048594105658.[0m
[32m[I 2022-04-24 02:35:33,915][0m Trial 966 finished with value: 0.6677593341477233 and parameters: {'n_hidden': 1024, 'mixture_components': 2, 'use_sparse_layer': False, 'use_batchnorm': False, 'use_dropout': True, 'dropout': 0.07806662895691964, 'mlp_size_1': 3, 'mlp_size_2': 3, 'mlp_size_3': 1, 'kernel': 'LogLogistic', 'loss_name': 'CensoredNLLLoss'}. Best is trial 551 with value: 0.6925048594105658.[0m
[32m[I 2022-04-24 02:36:46,318][0m Trial 967 finished with value: 0.6557303137248358 and parameters: {'n_hidden': 128, 'mixture_components': 2, 'use_sparse_layer': True, 'use_sparse_loss': False, 'use_batchnorm': False, 'use_dropout': True, 'dropout': 0.4178944271753335, 'mlp_size_1': 3, 'mlp_size_2': 1, 'mlp_size_3': 0, 'kernel': 'LogLogistic', 'loss_name': 'CensoredNLLLoss'}. Best is trial 551 with value: 0.6925048594105658.[0m
[32m[I 2022-04-24 02:37:34,795][0m Trial 968 finished with value: 0.661021067053405 and parameters: {'n_hidden': 64, 'mixture_components': 1, 'use_sparse_layer': False, 'use_batchnorm': False, 'use_dropout': True, 'dropout': 0.3140368021697143, 'mlp_size_1': 3, 'mlp_size_2': 0, 'mlp_size_3': 0, 'kernel': 'LogLogistic', 'loss_name': 'NLLLoss'}. Best is trial 551 with value: 0.6925048594105658.[0m
[32m[I 2022-04-24 02:38:58,199][0m Trial 969 finished with value: 0.6738447689496262 and parameters: {'n_hidden': 2048, 'mixture_components': 2, 'use_sparse_layer': False, 'use_batchnorm': False, 'use_dropout': True, 'dropout': 0.14750197619808972, 'mlp_size_1': 4, 'mlp_size_2': 3, 'mlp_size_3': 1, 'kernel': 'LogLogistic', 'loss_name': 'CensoredNLLLoss'}. Best is trial 551 with value: 0.6925048594105658.[0m
[32m[I 2022-04-24 02:40:17,218][0m Trial 970 finished with value: 0.6752407999639931 and parameters: {'n_hidden': 2048, 'mixture_components': 2, 'use_sparse_layer': False, 'use_batchnorm': False, 'use_dropout': True, 'dropout': 0.30213521259539383, 'mlp_size_1': 2, 'mlp_size_2': 5, 'mlp_size_3': 1, 'kernel': 'LogLogistic', 'loss_name': 'CensoredNLLLoss'}. Best is trial 551 with value: 0.6925048594105658.[0m
[32m[I 2022-04-24 02:41:27,335][0m Trial 971 finished with value: 0.6780556161958037 and parameters: {'n_hidden': 2048, 'mixture_components': 2, 'use_sparse_layer': False, 'use_batchnorm': False, 'use_dropout': True, 'dropout': 0.12508858683644694, 'mlp_size_1': 4, 'mlp_size_2': 3, 'mlp_size_3': 1, 'kernel': 'LogLogistic', 'loss_name': 'CensoredNLLLoss'}. Best is trial 551 with value: 0.6925048594105658.[0m
[32m[I 2022-04-24 02:44:31,337][0m Trial 972 finished with value: 0.6423911541128005 and parameters: {'n_hidden': 2048, 'mixture_components': 2, 'use_sparse_layer': False, 'use_batchnorm': True, 'use_dropout': True, 'dropout': 0.16713375520289053, 'mlp_size_1': 7, 'mlp_size_2': 1, 'mlp_size_3': 0, 'kernel': 'LogLogistic', 'loss_name': 'CensoredNLLLoss'}. Best is trial 551 with value: 0.6925048594105658.[0m
[32m[I 2022-04-24 02:45:52,449][0m Trial 973 finished with value: 0.6790416941624585 and parameters: {'n_hidden': 2048, 'mixture_components': 2, 'use_sparse_layer': False, 'use_batchnorm': False, 'use_dropout': True, 'dropout': 0.10365202701290598, 'mlp_size_1': 3, 'mlp_size_2': 3, 'mlp_size_3': 2, 'kernel': 'LogLogistic', 'loss_name': 'CensoredNLLLoss'}. Best is trial 551 with value: 0.6925048594105658.[0m
[32m[I 2022-04-24 02:47:01,653][0m Trial 974 finished with value: 0.6627451468557608 and parameters: {'n_hidden': 2048, 'mixture_components': 2, 'use_sparse_layer': False, 'use_batchnorm': False, 'use_dropout': False, 'mlp_size_1': 1, 'mlp_size_2': 4, 'mlp_size_3': 3, 'kernel': 'LogLogistic', 'loss_name': 'CensoredNLLLoss'}. Best is trial 551 with value: 0.6925048594105658.[0m
[32m[I 2022-04-24 02:48:16,985][0m Trial 975 finished with value: 0.6509296082241338 and parameters: {'n_hidden': 2048, 'mixture_components': 2, 'use_sparse_layer': False, 'use_batchnorm': False, 'use_dropout': True, 'dropout': 0.07094738438511716, 'mlp_size_1': 0, 'mlp_size_2': 4, 'mlp_size_3': 2, 'kernel': 'LogLogistic', 'loss_name': 'NLLLoss'}. Best is trial 551 with value: 0.6925048594105658.[0m
[32m[I 2022-04-24 02:49:12,234][0m Trial 976 finished with value: -0.6688274114541504 and parameters: {'n_hidden': 2048, 'mixture_components': 1, 'use_sparse_layer': False, 'use_batchnorm': False, 'use_dropout': True, 'dropout': 0.3316647206285279, 'mlp_size_1': 3, 'mlp_size_2': 3, 'mlp_size_3': 2, 'kernel': 'Exponential', 'loss_name': 'CensoredNLLLoss'}. Best is trial 551 with value: 0.6925048594105658.[0m
[32m[I 2022-04-24 02:50:30,304][0m Trial 977 finished with value: 0.6722850199262341 and parameters: {'n_hidden': 2048, 'mixture_components': 2, 'use_sparse_layer': False, 'use_batchnorm': False, 'use_dropout': True, 'dropout': 0.18535679261175894, 'mlp_size_1': 3, 'mlp_size_2': 3, 'mlp_size_3': 2, 'kernel': 'LogLogistic', 'loss_name': 'CensoredNLLLoss'}. Best is trial 551 with value: 0.6925048594105658.[0m
[32m[I 2022-04-24 02:51:53,942][0m Trial 978 finished with value: 0.6749254350722075 and parameters: {'n_hidden': 2048, 'mixture_components': 3, 'use_sparse_layer': True, 'use_sparse_loss': False, 'use_batchnorm': False, 'use_dropout': True, 'dropout': 0.09898289245556542, 'mlp_size_1': 4, 'mlp_size_2': 3, 'mlp_size_3': 1, 'kernel': 'LogLogistic', 'loss_name': 'CensoredNLLLoss'}. Best is trial 551 with value: 0.6925048594105658.[0m
[32m[I 2022-04-24 02:53:06,488][0m Trial 979 finished with value: 0.6678005972254153 and parameters: {'n_hidden': 2048, 'mixture_components': 2, 'use_sparse_layer': False, 'use_batchnorm': False, 'use_dropout': True, 'dropout': 0.1374467985680455, 'mlp_size_1': 3, 'mlp_size_2': 3, 'mlp_size_3': 2, 'kernel': 'LogLogistic', 'loss_name': 'CensoredNLLLoss'}. Best is trial 551 with value: 0.6925048594105658.[0m
[32m[I 2022-04-24 02:54:18,605][0m Trial 980 finished with value: 0.6559529185464352 and parameters: {'n_hidden': 2048, 'mixture_components': 2, 'use_sparse_layer': False, 'use_batchnorm': False, 'use_dropout': True, 'dropout': 0.3093231974822936, 'mlp_size_1': 3, 'mlp_size_2': 3, 'mlp_size_3': 2, 'kernel': 'Gumbel', 'loss_name': 'CensoredNLLLoss'}. Best is trial 551 with value: 0.6925048594105658.[0m
[32m[I 2022-04-24 02:55:29,102][0m Trial 981 finished with value: 0.6712584241415416 and parameters: {'n_hidden': 2048, 'mixture_components': 2, 'use_sparse_layer': False, 'use_batchnorm': False, 'use_dropout': True, 'dropout': 0.20735268682680524, 'mlp_size_1': 4, 'mlp_size_2': 3, 'mlp_size_3': 1, 'kernel': 'LogLogistic', 'loss_name': 'NLLLoss'}. Best is trial 551 with value: 0.6925048594105658.[0m
[32m[I 2022-04-24 02:56:33,079][0m Trial 982 finished with value: 0.6691994972910893 and parameters: {'n_hidden': 1024, 'mixture_components': 2, 'use_sparse_layer': False, 'use_batchnorm': False, 'use_dropout': True, 'dropout': 0.3625824454356817, 'mlp_size_1': 3, 'mlp_size_2': 3, 'mlp_size_3': 1, 'kernel': 'LogLogistic', 'loss_name': 'CensoredNLLLoss'}. Best is trial 551 with value: 0.6925048594105658.[0m
[32m[I 2022-04-24 02:57:49,738][0m Trial 983 finished with value: 0.6857478433875122 and parameters: {'n_hidden': 2048, 'mixture_components': 8, 'use_sparse_layer': False, 'use_batchnorm': False, 'use_dropout': True, 'dropout': 0.08636288403775362, 'mlp_size_1': 3, 'mlp_size_2': 3, 'mlp_size_3': 2, 'kernel': 'LogLogistic', 'loss_name': 'CensoredNLLLoss'}. Best is trial 551 with value: 0.6925048594105658.[0m
[32m[I 2022-04-24 02:59:02,988][0m Trial 984 finished with value: 0.6607566994790279 and parameters: {'n_hidden': 2048, 'mixture_components': 8, 'use_sparse_layer': False, 'use_batchnorm': False, 'use_dropout': True, 'dropout': 0.06000632520670364, 'mlp_size_1': 3, 'mlp_size_2': 3, 'mlp_size_3': 2, 'kernel': 'LogLogistic', 'loss_name': 'CensoredNLLLoss'}. Best is trial 551 with value: 0.6925048594105658.[0m
[32m[I 2022-04-24 03:00:06,659][0m Trial 985 finished with value: 0.6665605887426135 and parameters: {'n_hidden': 2048, 'mixture_components': 8, 'use_sparse_layer': False, 'use_batchnorm': False, 'use_dropout': True, 'dropout': 0.08769193582713684, 'mlp_size_1': 2, 'mlp_size_2': 3, 'mlp_size_3': 2, 'kernel': 'LogLogistic', 'loss_name': 'CensoredNLLLoss'}. Best is trial 551 with value: 0.6925048594105658.[0m
[32m[I 2022-04-24 03:01:29,977][0m Trial 986 finished with value: 0.6809542486460113 and parameters: {'n_hidden': 2048, 'mixture_components': 10, 'use_sparse_layer': False, 'use_batchnorm': False, 'use_dropout': True, 'dropout': 0.06632986960812803, 'mlp_size_1': 4, 'mlp_size_2': 3, 'mlp_size_3': 1, 'kernel': 'Logistic', 'loss_name': 'CensoredNLLLoss'}. Best is trial 551 with value: 0.6925048594105658.[0m
[32m[I 2022-04-24 03:02:58,694][0m Trial 987 finished with value: 0.6724604834556156 and parameters: {'n_hidden': 2048, 'mixture_components': 7, 'use_sparse_layer': False, 'use_batchnorm': False, 'use_dropout': True, 'dropout': 0.08367976078367274, 'mlp_size_1': 8, 'mlp_size_2': 0, 'mlp_size_3': 0, 'kernel': 'LogLogistic', 'loss_name': 'CensoredNLLLoss'}. Best is trial 551 with value: 0.6925048594105658.[0m
