[32m[I 2022-04-21 11:42:48,338][0m Trial 855 finished with value: 0.807560994906779 and parameters: {'splitter': 'best', 'min_samples_split': 0.13693174062576452, 'min_samples_leaf': 0.04759255058043961, 'min_weight_fraction_leaf': 0.017714271388886094, 'max_features': 0.6057594023170508}. Best is trial 691 with value: 0.8340697555858835.[0m
/media/san2_ssd/data/Workdir/survival/utils.py:305: RuntimeWarning: invalid value encountered in true_divide
  pdfs = np.gradient(1-survs,axis=1)/norms
[32m[I 2022-04-21 11:42:48,866][0m Trial 856 finished with value: 0.8095739500429449 and parameters: {'splitter': 'best', 'min_samples_split': 0.20024167906244136, 'min_samples_leaf': 0.021465743730726662, 'min_weight_fraction_leaf': 3.9103605914105966e-05, 'max_features': 0.47559244921484356}. Best is trial 691 with value: 0.8340697555858835.[0m
[32m[I 2022-04-21 11:42:49,363][0m Trial 857 finished with value: 0.8131608486476438 and parameters: {'splitter': 'best', 'min_samples_split': 0.16162550567858933, 'min_samples_leaf': 0.01199136121220246, 'min_weight_fraction_leaf': 0.022502974461365934, 'max_features': 0.6541910211635982}. Best is trial 691 with value: 0.8340697555858835.[0m
[32m[I 2022-04-21 11:42:49,468][0m Trial 858 finished with value: 0.673852392283379 and parameters: {'splitter': 'best', 'min_samples_split': 0.1288060612995439, 'min_samples_leaf': 0.2861116559391112, 'min_weight_fraction_leaf': 0.03699957900246798, 'max_features': 0.5619905670837619}. Best is trial 691 with value: 0.8340697555858835.[0m
[32m[I 2022-04-21 11:42:49,743][0m Trial 859 finished with value: 0.8201823376850313 and parameters: {'splitter': 'best', 'min_samples_split': 0.13660763132048698, 'min_samples_leaf': 0.03363164904473767, 'min_weight_fraction_leaf': 0.009948488141243246, 'max_features': 0.4515592973051821}. Best is trial 691 with value: 0.8340697555858835.[0m
[32m[I 2022-04-21 11:42:50,215][0m Trial 860 finished with value: 0.8156633791101303 and parameters: {'splitter': 'best', 'min_samples_split': 0.15115526809662388, 'min_samples_leaf': 0.0013634563167163553, 'min_weight_fraction_leaf': 0.018008035158429695, 'max_features': 0.5276762537219434}. Best is trial 691 with value: 0.8340697555858835.[0m
[32m[I 2022-04-21 11:42:50,759][0m Trial 861 finished with value: 0.8054817125875793 and parameters: {'splitter': 'best', 'min_samples_split': 0.12102760990114678, 'min_samples_leaf': 0.022004944940586888, 'min_weight_fraction_leaf': 0.02881034461157335, 'max_features': 0.6284682276994651}. Best is trial 691 with value: 0.8340697555858835.[0m
[32m[I 2022-04-21 11:42:51,421][0m Trial 862 finished with value: 0.8138949843878575 and parameters: {'splitter': 'best', 'min_samples_split': 0.18732871079814334, 'min_samples_leaf': 0.015801340877117306, 'min_weight_fraction_leaf': 0.012642200695386685, 'max_features': 0.5024471350115686}. Best is trial 691 with value: 0.8340697555858835.[0m
[32m[I 2022-04-21 11:42:51,647][0m Trial 863 finished with value: 0.8197618032480586 and parameters: {'splitter': 'random', 'min_samples_split': 0.16154701054757906, 'min_samples_leaf': 0.026276411604593142, 'min_weight_fraction_leaf': 0.006438728434396225, 'max_features': 0.588753410343927}. Best is trial 691 with value: 0.8340697555858835.[0m
[32m[I 2022-04-21 11:42:51,831][0m Trial 864 finished with value: 0.5657546670186754 and parameters: {'splitter': 'best', 'min_samples_split': 0.13591987224888016, 'min_samples_leaf': 0.38315778381665544, 'min_weight_fraction_leaf': 0.049330396304967605, 'max_features': 0.4165808886587161}. Best is trial 691 with value: 0.8340697555858835.[0m
[32m[I 2022-04-21 11:42:52,749][0m Trial 865 finished with value: 0.8096782040446892 and parameters: {'splitter': 'best', 'min_samples_split': 0.12447012725430767, 'min_samples_leaf': 0.009626155030788083, 'min_weight_fraction_leaf': 0.02368851092922655, 'max_features': 0.4712958652625562}. Best is trial 691 with value: 0.8340697555858835.[0m
[32m[I 2022-04-21 11:42:53,285][0m Trial 866 finished with value: 0.8166977857777653 and parameters: {'splitter': 'best', 'min_samples_split': 0.11322017817631062, 'min_samples_leaf': 0.04008926401806198, 'min_weight_fraction_leaf': 0.008069225478777914, 'max_features': 0.44941500814972435}. Best is trial 691 with value: 0.8340697555858835.[0m
[32m[I 2022-04-21 11:42:53,805][0m Trial 867 finished with value: 0.7063396118148964 and parameters: {'splitter': 'best', 'min_samples_split': 0.1474251342996788, 'min_samples_leaf': 0.010377675769110445, 'min_weight_fraction_leaf': 0.0002916584146621711, 'max_features': 0.40277874946238246}. Best is trial 691 with value: 0.8340697555858835.[0m
[32m[I 2022-04-21 11:42:54,409][0m Trial 868 finished with value: 0.8190484538708243 and parameters: {'splitter': 'best', 'min_samples_split': 0.12806376373325226, 'min_samples_leaf': 0.02878333559946087, 'min_weight_fraction_leaf': 0.032875124950028575, 'max_features': 0.5533830610078599}. Best is trial 691 with value: 0.8340697555858835.[0m
[32m[I 2022-04-21 11:42:54,916][0m Trial 869 finished with value: 0.8198449229094591 and parameters: {'splitter': 'best', 'min_samples_split': 0.17083605451458916, 'min_samples_leaf': 0.01863908526811233, 'min_weight_fraction_leaf': 0.016010959118892436, 'max_features': 0.48896786990271646}. Best is trial 691 with value: 0.8340697555858835.[0m
/media/san2_ssd/data/Workdir/survival/utils.py:305: RuntimeWarning: invalid value encountered in true_divide
  pdfs = np.gradient(1-survs,axis=1)/norms
/media/san2_ssd/data/Workdir/survival/utils.py:305: RuntimeWarning: invalid value encountered in true_divide
  pdfs = np.gradient(1-survs,axis=1)/norms
/media/san2_ssd/data/Workdir/survival/utils.py:305: RuntimeWarning: invalid value encountered in true_divide
  pdfs = np.gradient(1-survs,axis=1)/norms
[32m[I 2022-04-21 11:42:55,387][0m Trial 870 finished with value: 0.8174422696764893 and parameters: {'splitter': 'best', 'min_samples_split': 0.09844911752979092, 'min_samples_leaf': 0.008369789623605822, 'min_weight_fraction_leaf': 0.02286675094213951, 'max_features': 0.6063494305358252}. Best is trial 691 with value: 0.8340697555858835.[0m
/media/san2_ssd/data/Workdir/survival/utils.py:305: RuntimeWarning: invalid value encountered in true_divide
  pdfs = np.gradient(1-survs,axis=1)/norms
[32m[I 2022-04-21 11:42:55,876][0m Trial 871 finished with value: 0.8220165802755435 and parameters: {'splitter': 'best', 'min_samples_split': 0.11388746182931223, 'min_samples_leaf': 0.0013426381313324533, 'min_weight_fraction_leaf': 0.009560975397615844, 'max_features': 0.40959576474012466}. Best is trial 691 with value: 0.8340697555858835.[0m
[32m[I 2022-04-21 11:42:56,162][0m Trial 872 finished with value: 0.8044050471739947 and parameters: {'splitter': 'best', 'min_samples_split': 0.13741449685616852, 'min_samples_leaf': 0.03692424543673607, 'min_weight_fraction_leaf': 0.00032484417179499037, 'max_features': 0.5227908348636476}. Best is trial 691 with value: 0.8340697555858835.[0m
[32m[I 2022-04-21 11:42:56,387][0m Trial 873 finished with value: 0.8072953548966263 and parameters: {'splitter': 'best', 'min_samples_split': 0.09955726244602853, 'min_samples_leaf': 0.08151011764928448, 'min_weight_fraction_leaf': 0.017350463876342145, 'max_features': 0.5770786076710953}. Best is trial 691 with value: 0.8340697555858835.[0m
[32m[I 2022-04-21 11:42:56,493][0m Trial 874 finished with value: 0.8132074108255896 and parameters: {'splitter': 'random', 'min_samples_split': 0.1236768373708003, 'min_samples_leaf': 0.022095309372341505, 'min_weight_fraction_leaf': 0.03637329967186388, 'max_features': 0.4394176831091102}. Best is trial 691 with value: 0.8340697555858835.[0m
[32m[I 2022-04-21 11:42:56,717][0m Trial 875 finished with value: 0.8114600824435906 and parameters: {'splitter': 'best', 'min_samples_split': 0.15750313913671218, 'min_samples_leaf': 0.04957829028676115, 'min_weight_fraction_leaf': 0.025862454445943484, 'max_features': 0.4624051956362746}. Best is trial 691 with value: 0.8340697555858835.[0m
/media/san2_ssd/data/Workdir/survival/utils.py:305: RuntimeWarning: invalid value encountered in true_divide
  pdfs = np.gradient(1-survs,axis=1)/norms
[32m[I 2022-04-21 11:42:57,723][0m Trial 876 finished with value: 0.8106809481315063 and parameters: {'splitter': 'best', 'min_samples_split': 0.08864611637081482, 'min_samples_leaf': 0.001320752707061808, 'min_weight_fraction_leaf': 0.009108340948847738, 'max_features': 0.7120387593548674}. Best is trial 691 with value: 0.8340697555858835.[0m
[32m[I 2022-04-21 11:42:57,924][0m Trial 877 finished with value: 0.5596035542014499 and parameters: {'splitter': 'best', 'min_samples_split': 0.11376956175749318, 'min_samples_leaf': 0.01661785317079619, 'min_weight_fraction_leaf': 0.3886655650083813, 'max_features': 0.5668442416383609}. Best is trial 691 with value: 0.8340697555858835.[0m
/media/san2_ssd/data/Workdir/survival/utils.py:305: RuntimeWarning: invalid value encountered in true_divide
  pdfs = np.gradient(1-survs,axis=1)/norms
[32m[I 2022-04-21 11:42:58,280][0m Trial 878 finished with value: 0.8171828214365664 and parameters: {'splitter': 'best', 'min_samples_split': 0.10445707311123931, 'min_samples_leaf': 0.02469306754209056, 'min_weight_fraction_leaf': 0.017365430230026905, 'max_features': 0.5412316136553954}. Best is trial 691 with value: 0.8340697555858835.[0m
[32m[I 2022-04-21 11:42:58,783][0m Trial 879 finished with value: 0.8127477026664167 and parameters: {'splitter': 'best', 'min_samples_split': 0.14550646659487257, 'min_samples_leaf': 0.0010776600257346794, 'min_weight_fraction_leaf': 0.0436270294095759, 'max_features': 0.40704787119497304}. Best is trial 691 with value: 0.8340697555858835.[0m
[32m[I 2022-04-21 11:42:59,664][0m Trial 880 finished with value: 0.8131751618580964 and parameters: {'splitter': 'best', 'min_samples_split': 0.13200546664089868, 'min_samples_leaf': 0.03313953440074918, 'min_weight_fraction_leaf': 0.06699442252318716, 'max_features': 0.4864501975715965}. Best is trial 691 with value: 0.8340697555858835.[0m
[32m[I 2022-04-21 11:42:59,820][0m Trial 881 finished with value: 0.5683801958776981 and parameters: {'splitter': 'best', 'min_samples_split': 0.09633255604733404, 'min_samples_leaf': 0.35437156391631114, 'min_weight_fraction_leaf': 0.00823573238831448, 'max_features': 0.5068995976184807}. Best is trial 691 with value: 0.8340697555858835.[0m
[32m[I 2022-04-21 11:43:00,473][0m Trial 882 finished with value: 0.8120378788582799 and parameters: {'splitter': 'best', 'min_samples_split': 0.11548719805815107, 'min_samples_leaf': 0.014685650018003295, 'min_weight_fraction_leaf': 0.02808602801418076, 'max_features': 0.6191677446325052}. Best is trial 691 with value: 0.8340697555858835.[0m
[32m[I 2022-04-21 11:43:00,985][0m Trial 883 finished with value: 0.7052752807012836 and parameters: {'splitter': 'best', 'min_samples_split': 0.2687459501657317, 'min_samples_leaf': 0.043955217569172644, 'min_weight_fraction_leaf': 0.014817359990597658, 'max_features': 0.5900591738060951}. Best is trial 691 with value: 0.8340697555858835.[0m
/media/san2_ssd/data/Workdir/survival/utils.py:305: RuntimeWarning: invalid value encountered in true_divide
  pdfs = np.gradient(1-survs,axis=1)/norms
[32m[I 2022-04-21 11:43:02,238][0m Trial 884 finished with value: 0.8044865145208254 and parameters: {'splitter': 'best', 'min_samples_split': 0.07359211585201855, 'min_samples_leaf': 0.02335876703166325, 'min_weight_fraction_leaf': 0.00811856704925542, 'max_features': 0.43857272415221205}. Best is trial 691 with value: 0.8340697555858835.[0m
[32m[I 2022-04-21 11:43:02,660][0m Trial 885 finished with value: 0.809896275109246 and parameters: {'splitter': 'random', 'min_samples_split': 0.08773074516301352, 'min_samples_leaf': 0.01047363710335939, 'min_weight_fraction_leaf': 0.037114945104148096, 'max_features': 0.42805312599793954}. Best is trial 691 with value: 0.8340697555858835.[0m
[32m[I 2022-04-21 11:43:03,361][0m Trial 886 finished with value: 0.8142898341001386 and parameters: {'splitter': 'best', 'min_samples_split': 0.15940049230935235, 'min_samples_leaf': 0.030182994931672917, 'min_weight_fraction_leaf': 0.02352378659241827, 'max_features': 0.6405820528489028}. Best is trial 691 with value: 0.8340697555858835.[0m
[32m[I 2022-04-21 11:43:03,838][0m Trial 887 finished with value: 0.8135672178811252 and parameters: {'splitter': 'best', 'min_samples_split': 0.17503599116910057, 'min_samples_leaf': 0.015812592146883016, 'min_weight_fraction_leaf': 0.01566671707151208, 'max_features': 0.396016103274419}. Best is trial 691 with value: 0.8340697555858835.[0m
/media/san2_ssd/data/Workdir/survival/utils.py:305: RuntimeWarning: invalid value encountered in true_divide
  pdfs = np.gradient(1-survs,axis=1)/norms
[32m[I 2022-04-21 11:43:04,507][0m Trial 888 finished with value: 0.8088434997787595 and parameters: {'splitter': 'best', 'min_samples_split': 0.10789014912348457, 'min_samples_leaf': 0.009650818126795507, 'min_weight_fraction_leaf': 0.008019362072497828, 'max_features': 0.47139751785425077}. Best is trial 691 with value: 0.8340697555858835.[0m
[32m[I 2022-04-21 11:43:04,889][0m Trial 889 finished with value: 0.8129621097386043 and parameters: {'splitter': 'best', 'min_samples_split': 0.22728004950725966, 'min_samples_leaf': 0.03907705602296424, 'min_weight_fraction_leaf': 0.030194016305071934, 'max_features': 0.5254355249837823}. Best is trial 691 with value: 0.8340697555858835.[0m
/media/san2_ssd/data/Workdir/survival/utils.py:305: RuntimeWarning: invalid value encountered in true_divide
  pdfs = np.gradient(1-survs,axis=1)/norms
[32m[I 2022-04-21 11:43:05,390][0m Trial 890 finished with value: 0.8192965569440183 and parameters: {'splitter': 'best', 'min_samples_split': 0.12348085897530456, 'min_samples_leaf': 0.0261690110483324, 'min_weight_fraction_leaf': 0.0002170739684577358, 'max_features': 0.4533968113251966}. Best is trial 691 with value: 0.8340697555858835.[0m
/media/san2_ssd/data/Workdir/survival/utils.py:305: RuntimeWarning: invalid value encountered in true_divide
  pdfs = np.gradient(1-survs,axis=1)/norms
[32m[I 2022-04-21 11:43:06,240][0m Trial 891 finished with value: 0.8177454163321698 and parameters: {'splitter': 'best', 'min_samples_split': 0.1386581134582671, 'min_samples_leaf': 0.01742774043255059, 'min_weight_fraction_leaf': 0.01857582998994442, 'max_features': 0.5528642705019606}. Best is trial 691 with value: 0.8340697555858835.[0m
[32m[I 2022-04-21 11:43:06,420][0m Trial 892 finished with value: 0.7712044871331116 and parameters: {'splitter': 'best', 'min_samples_split': 0.0978400422302494, 'min_samples_leaf': 0.29875877178907745, 'min_weight_fraction_leaf': 0.04463018060097791, 'max_features': 0.4166904836073446}. Best is trial 691 with value: 0.8340697555858835.[0m
/media/san2_ssd/data/Workdir/survival/utils.py:305: RuntimeWarning: invalid value encountered in true_divide
  pdfs = np.gradient(1-survs,axis=1)/norms
/media/san2_ssd/data/Workdir/survival/utils.py:305: RuntimeWarning: invalid value encountered in true_divide
  pdfs = np.gradient(1-survs,axis=1)/norms
/media/san2_ssd/data/Workdir/survival/utils.py:305: RuntimeWarning: invalid value encountered in true_divide
  pdfs = np.gradient(1-survs,axis=1)/norms
/media/san2_ssd/data/Workdir/survival/utils.py:305: RuntimeWarning: invalid value encountered in true_divide
  pdfs = np.gradient(1-survs,axis=1)/norms
/media/san2_ssd/data/Workdir/survival/utils.py:305: RuntimeWarning: invalid value encountered in true_divide
  pdfs = np.gradient(1-survs,axis=1)/norms
[32m[I 2022-04-21 11:43:06,980][0m Trial 893 finished with value: 0.8190452734829954 and parameters: {'splitter': 'best', 'min_samples_split': 0.07468858801028028, 'min_samples_leaf': 0.00912614535229724, 'min_weight_fraction_leaf': 0.007864206724965359, 'max_features': 0.5006367328740684}. Best is trial 691 with value: 0.8340697555858835.[0m
[32m[I 2022-04-21 11:43:07,354][0m Trial 894 finished with value: 0.8004839143162756 and parameters: {'splitter': 'best', 'min_samples_split': 0.1488356655712203, 'min_samples_leaf': 0.053199464851839025, 'min_weight_fraction_leaf': 0.00025680845425542914, 'max_features': 0.5991779444218973}. Best is trial 691 with value: 0.8340697555858835.[0m
[32m[I 2022-04-21 11:43:07,636][0m Trial 895 finished with value: 0.468348556469091 and parameters: {'splitter': 'best', 'min_samples_split': 0.10610829439855186, 'min_samples_leaf': 0.030526519172082073, 'min_weight_fraction_leaf': 0.439785857182948, 'max_features': 0.39260334029638366}. Best is trial 691 with value: 0.8340697555858835.[0m
/media/san2_ssd/data/Workdir/survival/utils.py:305: RuntimeWarning: invalid value encountered in true_divide
  pdfs = np.gradient(1-survs,axis=1)/norms
[32m[I 2022-04-21 11:43:08,272][0m Trial 896 finished with value: 0.809599880570761 and parameters: {'splitter': 'best', 'min_samples_split': 0.09025003522347622, 'min_samples_leaf': 0.0010639150883239943, 'min_weight_fraction_leaf': 0.023312445911048, 'max_features': 0.44424833047825024}. Best is trial 691 with value: 0.8340697555858835.[0m
[32m[I 2022-04-21 11:43:09,090][0m Trial 897 finished with value: 0.818558509737462 and parameters: {'splitter': 'best', 'min_samples_split': 0.1303895847398031, 'min_samples_leaf': 0.018853200431490566, 'min_weight_fraction_leaf': 0.0340510811601956, 'max_features': 0.5709608425297169}. Best is trial 691 with value: 0.8340697555858835.[0m
/media/san2_ssd/data/Workdir/survival/utils.py:305: RuntimeWarning: invalid value encountered in true_divide
  pdfs = np.gradient(1-survs,axis=1)/norms
/media/san2_ssd/data/Workdir/survival/utils.py:305: RuntimeWarning: invalid value encountered in true_divide
  pdfs = np.gradient(1-survs,axis=1)/norms
[32m[I 2022-04-21 11:43:10,515][0m Trial 898 finished with value: 0.8190969080469909 and parameters: {'splitter': 'best', 'min_samples_split': 0.1140106315442517, 'min_samples_leaf': 0.009840583151600753, 'min_weight_fraction_leaf': 1.1335595442786561e-05, 'max_features': 0.41905035993076445}. Best is trial 691 with value: 0.8340697555858835.[0m
[32m[I 2022-04-21 11:43:10,682][0m Trial 899 finished with value: 0.8082964445372026 and parameters: {'splitter': 'random', 'min_samples_split': 0.08441428554585617, 'min_samples_leaf': 0.037164012042682736, 'min_weight_fraction_leaf': 0.00014054303034382112, 'max_features': 0.535753425261514}. Best is trial 691 with value: 0.8340697555858835.[0m
[32m[I 2022-04-21 11:43:11,251][0m Trial 900 finished with value: 0.8069615265240305 and parameters: {'splitter': 'best', 'min_samples_split': 0.12080926520824437, 'min_samples_leaf': 0.023993865036465074, 'min_weight_fraction_leaf': 0.016876337762705692, 'max_features': 0.4798739017104864}. Best is trial 691 with value: 0.8340697555858835.[0m
[32m[I 2022-04-21 11:43:11,788][0m Trial 901 finished with value: 0.8203943678576202 and parameters: {'splitter': 'best', 'min_samples_split': 0.1005988305128434, 'min_samples_leaf': 0.009608618915968354, 'min_weight_fraction_leaf': 0.026373579455882548, 'max_features': 0.40496318550718174}. Best is trial 691 with value: 0.8340697555858835.[0m
[32m[I 2022-04-21 11:43:12,310][0m Trial 902 finished with value: 0.8127646269513402 and parameters: {'splitter': 'best', 'min_samples_split': 0.13641863957586384, 'min_samples_leaf': 0.01724817850721823, 'min_weight_fraction_leaf': 0.014439871153058913, 'max_features': 0.5118815312554352}. Best is trial 691 with value: 0.8340697555858835.[0m
/media/san2_ssd/data/Workdir/survival/utils.py:305: RuntimeWarning: invalid value encountered in true_divide
  pdfs = np.gradient(1-survs,axis=1)/norms
/media/san2_ssd/data/Workdir/survival/utils.py:305: RuntimeWarning: invalid value encountered in true_divide
  pdfs = np.gradient(1-survs,axis=1)/norms
[32m[I 2022-04-21 11:43:12,983][0m Trial 903 finished with value: 0.7964937447824559 and parameters: {'splitter': 'best', 'min_samples_split': 0.15036349639729935, 'min_samples_leaf': 0.0011730265058014396, 'min_weight_fraction_leaf': 0.010005965122545328, 'max_features': 0.3776507264153614}. Best is trial 691 with value: 0.8340697555858835.[0m
[32m[I 2022-04-21 11:43:13,169][0m Trial 904 finished with value: 0.6702780841798294 and parameters: {'splitter': 'best', 'min_samples_split': 0.09288427056426264, 'min_samples_leaf': 0.2594353105269194, 'min_weight_fraction_leaf': 0.023959169538837505, 'max_features': 0.4388999290308517}. Best is trial 691 with value: 0.8340697555858835.[0m
[32m[I 2022-04-21 11:43:13,478][0m Trial 905 finished with value: 0.8066719578861739 and parameters: {'splitter': 'best', 'min_samples_split': 0.24504529935178748, 'min_samples_leaf': 0.031140464477160422, 'min_weight_fraction_leaf': 0.03461076374642354, 'max_features': 0.4589484879231328}. Best is trial 691 with value: 0.8340697555858835.[0m
[32m[I 2022-04-21 11:43:13,861][0m Trial 906 finished with value: 0.8075541565414808 and parameters: {'splitter': 'best', 'min_samples_split': 0.16409820205425962, 'min_samples_leaf': 0.044404918499605706, 'min_weight_fraction_leaf': 0.009550725304994305, 'max_features': 0.583942699971723}. Best is trial 691 with value: 0.8340697555858835.[0m
/media/san2_ssd/data/Workdir/survival/utils.py:305: RuntimeWarning: invalid value encountered in true_divide
  pdfs = np.gradient(1-survs,axis=1)/norms
/media/san2_ssd/data/Workdir/survival/utils.py:305: RuntimeWarning: invalid value encountered in true_divide
  pdfs = np.gradient(1-survs,axis=1)/norms
/media/san2_ssd/data/Workdir/survival/utils.py:305: RuntimeWarning: invalid value encountered in true_divide
  pdfs = np.gradient(1-survs,axis=1)/norms
