[32m[I 2022-04-21 11:37:53,143][0m Trial 190 finished with value: 0.8348082114676366 and parameters: {'splitter': 'best', 'min_samples_split': 0.31734887775334625, 'min_samples_leaf': 0.04677913622691616, 'min_weight_fraction_leaf': 0.018851687346832284, 'max_features': 0.9475188455890854}. Best is trial 21 with value: 0.837083811404636.[0m
[32m[I 2022-04-21 11:37:53,211][0m Trial 191 finished with value: 0.8367527493778185 and parameters: {'splitter': 'best', 'min_samples_split': 0.33933414897872716, 'min_samples_leaf': 0.04019324112955559, 'min_weight_fraction_leaf': 0.049115371023631435, 'max_features': 0.9324666834390724}. Best is trial 21 with value: 0.837083811404636.[0m
[32m[I 2022-04-21 11:37:53,295][0m Trial 192 finished with value: 0.8332692532720088 and parameters: {'splitter': 'best', 'min_samples_split': 0.34338912061138616, 'min_samples_leaf': 0.05840760489619504, 'min_weight_fraction_leaf': 0.14610701793439845, 'max_features': 0.962136449565737}. Best is trial 21 with value: 0.837083811404636.[0m
[32m[I 2022-04-21 11:37:53,374][0m Trial 193 finished with value: 0.836837262490117 and parameters: {'splitter': 'best', 'min_samples_split': 0.34704505261954816, 'min_samples_leaf': 0.06650978038259715, 'min_weight_fraction_leaf': 0.01368030159465721, 'max_features': 0.9522096259463468}. Best is trial 21 with value: 0.837083811404636.[0m
[32m[I 2022-04-21 11:37:53,428][0m Trial 194 finished with value: 0.821547241131856 and parameters: {'splitter': 'best', 'min_samples_split': 0.3609143503033998, 'min_samples_leaf': 0.036981652029277515, 'min_weight_fraction_leaf': 0.028709342765320153, 'max_features': 0.3500045076007604}. Best is trial 21 with value: 0.837083811404636.[0m
[32m[I 2022-04-21 11:37:53,470][0m Trial 195 finished with value: 0.834789602080266 and parameters: {'splitter': 'best', 'min_samples_split': 0.32836783878041675, 'min_samples_leaf': 0.0075761283694114855, 'min_weight_fraction_leaf': 0.015772122968983407, 'max_features': 0.9186286404156693}. Best is trial 21 with value: 0.837083811404636.[0m
[32m[I 2022-04-21 11:37:53,513][0m Trial 196 finished with value: 0.65 and parameters: {'splitter': 'best', 'min_samples_split': 0.33911406872936417, 'min_samples_leaf': 0.023769970355151705, 'min_weight_fraction_leaf': 0.3835540301418526, 'max_features': 0.9335734144238709}. Best is trial 21 with value: 0.837083811404636.[0m
[32m[I 2022-04-21 11:37:53,596][0m Trial 197 finished with value: 0.8366717314767083 and parameters: {'splitter': 'best', 'min_samples_split': 0.35197443183963256, 'min_samples_leaf': 0.013696415751635325, 'min_weight_fraction_leaf': 0.04010081832417186, 'max_features': 0.9612023387299953}. Best is trial 21 with value: 0.837083811404636.[0m
[32m[I 2022-04-21 11:37:53,680][0m Trial 198 finished with value: 0.65 and parameters: {'splitter': 'best', 'min_samples_split': 0.2320255855970397, 'min_samples_leaf': 0.34984569059177606, 'min_weight_fraction_leaf': 0.030423054738255764, 'max_features': 0.41662861789448763}. Best is trial 21 with value: 0.837083811404636.[0m
[32m[I 2022-04-21 11:37:53,768][0m Trial 199 finished with value: 0.8329615567419848 and parameters: {'splitter': 'best', 'min_samples_split': 0.37279244568909425, 'min_samples_leaf': 0.08129634970103577, 'min_weight_fraction_leaf': 0.01085174513968816, 'max_features': 0.9808404552947323}. Best is trial 21 with value: 0.837083811404636.[0m
[32m[I 2022-04-21 11:37:53,860][0m Trial 200 finished with value: 0.8353797750782629 and parameters: {'splitter': 'best', 'min_samples_split': 0.35971745547843176, 'min_samples_leaf': 0.07234029361003615, 'min_weight_fraction_leaf': 0.014248289126210699, 'max_features': 0.9008981832987961}. Best is trial 21 with value: 0.837083811404636.[0m
[32m[I 2022-04-21 11:37:53,973][0m Trial 201 finished with value: 0.8366717314767083 and parameters: {'splitter': 'best', 'min_samples_split': 0.349423730421152, 'min_samples_leaf': 0.06016122942280332, 'min_weight_fraction_leaf': 0.044604349265686266, 'max_features': 0.9469838116240092}. Best is trial 21 with value: 0.837083811404636.[0m
[32m[I 2022-04-21 11:37:54,094][0m Trial 202 finished with value: 0.836837262490117 and parameters: {'splitter': 'best', 'min_samples_split': 0.3422497265624555, 'min_samples_leaf': 0.04868514328997256, 'min_weight_fraction_leaf': 0.00040375958971712415, 'max_features': 0.9393214626931393}. Best is trial 21 with value: 0.837083811404636.[0m
[32m[I 2022-04-21 11:37:54,151][0m Trial 203 finished with value: 0.8365872183644096 and parameters: {'splitter': 'best', 'min_samples_split': 0.33101236978308424, 'min_samples_leaf': 0.09463686543955606, 'min_weight_fraction_leaf': 0.023262325195773165, 'max_features': 0.9588093910831599}. Best is trial 21 with value: 0.837083811404636.[0m
[32m[I 2022-04-21 11:37:54,244][0m Trial 204 finished with value: 0.8341370287032179 and parameters: {'splitter': 'best', 'min_samples_split': 0.3210233815125804, 'min_samples_leaf': 0.04995192459821335, 'min_weight_fraction_leaf': 0.005321448895433384, 'max_features': 0.9229615428891986}. Best is trial 21 with value: 0.837083811404636.[0m
[32m[I 2022-04-21 11:37:54,383][0m Trial 205 finished with value: 0.8367527493778185 and parameters: {'splitter': 'best', 'min_samples_split': 0.3401877470722268, 'min_samples_leaf': 0.0447532428164177, 'min_weight_fraction_leaf': 0.03599193811675988, 'max_features': 0.9343456858058844}. Best is trial 21 with value: 0.837083811404636.[0m
[32m[I 2022-04-21 11:37:54,497][0m Trial 206 finished with value: 0.8350807425495251 and parameters: {'splitter': 'best', 'min_samples_split': 0.35140615936502073, 'min_samples_leaf': 0.029842545146167847, 'min_weight_fraction_leaf': 0.00037310078446969874, 'max_features': 0.607282744826565}. Best is trial 21 with value: 0.837083811404636.[0m
[32m[I 2022-04-21 11:37:54,600][0m Trial 207 finished with value: 0.8354988474398202 and parameters: {'splitter': 'random', 'min_samples_split': 0.20235415634821394, 'min_samples_leaf': 0.0015055106160358923, 'min_weight_fraction_leaf': 0.05657061044700192, 'max_features': 0.9730514139706458}. Best is trial 21 with value: 0.837083811404636.[0m
[32m[I 2022-04-21 11:37:54,693][0m Trial 208 finished with value: 0.8353797750782629 and parameters: {'splitter': 'best', 'min_samples_split': 0.3606068286287222, 'min_samples_leaf': 0.06525941329533327, 'min_weight_fraction_leaf': 0.031136957493639855, 'max_features': 0.9569135448623254}. Best is trial 21 with value: 0.837083811404636.[0m
[32m[I 2022-04-21 11:37:54,768][0m Trial 209 finished with value: 0.8371653597449141 and parameters: {'splitter': 'best', 'min_samples_split': 0.30877593519714935, 'min_samples_leaf': 0.03401537131351376, 'min_weight_fraction_leaf': 0.01487553229575332, 'max_features': 0.9966465425368447}. Best is trial 209 with value: 0.8371653597449141.[0m
[32m[I 2022-04-21 11:37:54,863][0m Trial 210 finished with value: 0.8343688264312 and parameters: {'splitter': 'best', 'min_samples_split': 0.30348617745163775, 'min_samples_leaf': 0.07708887993181048, 'min_weight_fraction_leaf': 0.01722507635488783, 'max_features': 0.9091537510069434}. Best is trial 209 with value: 0.8371653597449141.[0m
[32m[I 2022-04-21 11:37:54,947][0m Trial 211 finished with value: 0.8367527493778185 and parameters: {'splitter': 'best', 'min_samples_split': 0.3334410977925674, 'min_samples_leaf': 0.03910414771802699, 'min_weight_fraction_leaf': 0.02048442878328425, 'max_features': 0.9985758129525106}. Best is trial 209 with value: 0.8371653597449141.[0m
[32m[I 2022-04-21 11:37:55,103][0m Trial 212 finished with value: 0.8352022124473615 and parameters: {'splitter': 'best', 'min_samples_split': 0.3121483815051298, 'min_samples_leaf': 0.020728076814454842, 'min_weight_fraction_leaf': 0.009962611156682597, 'max_features': 0.9752178908619814}. Best is trial 209 with value: 0.8371653597449141.[0m
[32m[I 2022-04-21 11:37:55,251][0m Trial 213 finished with value: 0.8366717314767083 and parameters: {'splitter': 'best', 'min_samples_split': 0.3489053545454332, 'min_samples_leaf': 0.0529987098307682, 'min_weight_fraction_leaf': 0.03008398632996411, 'max_features': 0.9436495595303387}. Best is trial 209 with value: 0.8371653597449141.[0m
[32m[I 2022-04-21 11:37:55,362][0m Trial 214 finished with value: 0.8344489474910419 and parameters: {'splitter': 'best', 'min_samples_split': 0.32413507151703685, 'min_samples_leaf': 0.03152198016700923, 'min_weight_fraction_leaf': 0.044373208697912114, 'max_features': 0.9718985545934113}. Best is trial 209 with value: 0.8371653597449141.[0m
[32m[I 2022-04-21 11:37:55,448][0m Trial 215 finished with value: 0.836837262490117 and parameters: {'splitter': 'best', 'min_samples_split': 0.34584272736564114, 'min_samples_leaf': 0.06734805213171734, 'min_weight_fraction_leaf': 0.01932882564268048, 'max_features': 0.9998896310595228}. Best is trial 209 with value: 0.8371653597449141.[0m
[32m[I 2022-04-21 11:37:55,551][0m Trial 216 finished with value: 0.8367527493778185 and parameters: {'splitter': 'best', 'min_samples_split': 0.3332952823795747, 'min_samples_leaf': 0.01412311430664278, 'min_weight_fraction_leaf': 0.052550847777682354, 'max_features': 0.994275379892137}. Best is trial 209 with value: 0.8371653597449141.[0m
[32m[I 2022-04-21 11:37:55,653][0m Trial 217 finished with value: 0.8369839464007164 and parameters: {'splitter': 'best', 'min_samples_split': 0.22186725262777984, 'min_samples_leaf': 0.04169651024493073, 'min_weight_fraction_leaf': 0.010362806987924371, 'max_features': 0.922072951813839}. Best is trial 209 with value: 0.8371653597449141.[0m
[32m[I 2022-04-21 11:37:55,748][0m Trial 218 finished with value: 0.8368835244060235 and parameters: {'splitter': 'best', 'min_samples_split': 0.23338778489668494, 'min_samples_leaf': 0.03156014850165724, 'min_weight_fraction_leaf': 0.00639300022292757, 'max_features': 0.9800048027993256}. Best is trial 209 with value: 0.8371653597449141.[0m
[32m[I 2022-04-21 11:37:55,844][0m Trial 219 finished with value: 0.8369839464007164 and parameters: {'splitter': 'best', 'min_samples_split': 0.22147934518966497, 'min_samples_leaf': 0.04384376171621339, 'min_weight_fraction_leaf': 0.008503835269204403, 'max_features': 0.9601484858412715}. Best is trial 209 with value: 0.8371653597449141.[0m
[32m[I 2022-04-21 11:37:55,923][0m Trial 220 finished with value: 0.8370547382698911 and parameters: {'splitter': 'best', 'min_samples_split': 0.22406003321277837, 'min_samples_leaf': 0.06224195648845465, 'min_weight_fraction_leaf': 0.013742081386303175, 'max_features': 0.9955861538276736}. Best is trial 209 with value: 0.8371653597449141.[0m
[32m[I 2022-04-21 11:37:56,017][0m Trial 221 finished with value: 0.8369733404001721 and parameters: {'splitter': 'best', 'min_samples_split': 0.2147961741835541, 'min_samples_leaf': 0.04146197921021086, 'min_weight_fraction_leaf': 0.009366171421460002, 'max_features': 0.9743151977103646}. Best is trial 209 with value: 0.8371653597449141.[0m
[32m[I 2022-04-21 11:37:56,128][0m Trial 222 finished with value: 0.8318933144885436 and parameters: {'splitter': 'best', 'min_samples_split': 0.22117047455957897, 'min_samples_leaf': 0.027670959579649674, 'min_weight_fraction_leaf': 0.007232468408145039, 'max_features': 0.9834967317770152}. Best is trial 209 with value: 0.8371653597449141.[0m
[32m[I 2022-04-21 11:37:56,222][0m Trial 223 finished with value: 0.8372023218910313 and parameters: {'splitter': 'best', 'min_samples_split': 0.23676095093235977, 'min_samples_leaf': 0.04436901993507455, 'min_weight_fraction_leaf': 0.006381577663756578, 'max_features': 0.9713524493200608}. Best is trial 223 with value: 0.8372023218910313.[0m
[32m[I 2022-04-21 11:37:56,309][0m Trial 224 finished with value: 0.8372023218910313 and parameters: {'splitter': 'best', 'min_samples_split': 0.2423043704335057, 'min_samples_leaf': 0.04755370504922436, 'min_weight_fraction_leaf': 0.007900758514214599, 'max_features': 0.9695090348557798}. Best is trial 223 with value: 0.8372023218910313.[0m
[32m[I 2022-04-21 11:37:56,403][0m Trial 225 finished with value: 0.8372023218910313 and parameters: {'splitter': 'best', 'min_samples_split': 0.23614552512687279, 'min_samples_leaf': 0.04517305190460624, 'min_weight_fraction_leaf': 0.0007212190846478117, 'max_features': 0.9608945763143696}. Best is trial 223 with value: 0.8372023218910313.[0m
[32m[I 2022-04-21 11:37:56,504][0m Trial 226 finished with value: 0.8372023218910313 and parameters: {'splitter': 'best', 'min_samples_split': 0.24138387888070745, 'min_samples_leaf': 0.04530683726065603, 'min_weight_fraction_leaf': 0.001754094478753014, 'max_features': 0.9786023686273332}. Best is trial 223 with value: 0.8372023218910313.[0m
[32m[I 2022-04-21 11:37:56,632][0m Trial 227 finished with value: 0.8363268199688415 and parameters: {'splitter': 'best', 'min_samples_split': 0.23936572115445434, 'min_samples_leaf': 0.05436796163743958, 'min_weight_fraction_leaf': 0.003270902799133218, 'max_features': 0.9764261415773076}. Best is trial 223 with value: 0.8372023218910313.[0m
[32m[I 2022-04-21 11:37:56,719][0m Trial 228 finished with value: 0.8326985566832812 and parameters: {'splitter': 'best', 'min_samples_split': 0.2295111821793841, 'min_samples_leaf': 0.1557157670023886, 'min_weight_fraction_leaf': 0.001988026375252987, 'max_features': 0.9831742036209509}. Best is trial 223 with value: 0.8372023218910313.[0m
[32m[I 2022-04-21 11:37:56,821][0m Trial 229 finished with value: 0.8372023218910313 and parameters: {'splitter': 'best', 'min_samples_split': 0.2542531540757311, 'min_samples_leaf': 0.046974235215351254, 'min_weight_fraction_leaf': 0.002352317680795529, 'max_features': 0.9660769169776492}. Best is trial 223 with value: 0.8372023218910313.[0m
[32m[I 2022-04-21 11:37:56,889][0m Trial 230 finished with value: 0.8357281453365699 and parameters: {'splitter': 'random', 'min_samples_split': 0.25002847648653254, 'min_samples_leaf': 0.04830216251085479, 'min_weight_fraction_leaf': 9.068481915621134e-05, 'max_features': 0.9742650099332105}. Best is trial 223 with value: 0.8372023218910313.[0m
[32m[I 2022-04-21 11:37:56,944][0m Trial 231 finished with value: 0.8369733404001721 and parameters: {'splitter': 'best', 'min_samples_split': 0.2147310025066053, 'min_samples_leaf': 0.039698432195960344, 'min_weight_fraction_leaf': 0.011242437749090225, 'max_features': 0.9641365202372745}. Best is trial 223 with value: 0.8372023218910313.[0m
[32m[I 2022-04-21 11:37:57,004][0m Trial 232 finished with value: 0.8369839464007164 and parameters: {'splitter': 'best', 'min_samples_split': 0.21313299931670399, 'min_samples_leaf': 0.0453999655272467, 'min_weight_fraction_leaf': 0.0016607705767495012, 'max_features': 0.9611294075009338}. Best is trial 223 with value: 0.8372023218910313.[0m
[32m[I 2022-04-21 11:37:57,069][0m Trial 233 finished with value: 0.8235957809666086 and parameters: {'splitter': 'best', 'min_samples_split': 0.21002949129365525, 'min_samples_leaf': 0.037843271688558514, 'min_weight_fraction_leaf': 0.010800415339900544, 'max_features': 0.26444196471284387}. Best is trial 223 with value: 0.8372023218910313.[0m
[32m[I 2022-04-21 11:37:57,113][0m Trial 234 finished with value: 0.8369839464007164 and parameters: {'splitter': 'best', 'min_samples_split': 0.21896503972221132, 'min_samples_leaf': 0.042307883058262295, 'min_weight_fraction_leaf': 0.0014886067571580957, 'max_features': 0.9213381055839479}. Best is trial 223 with value: 0.8372023218910313.[0m
[32m[I 2022-04-21 11:37:57,166][0m Trial 235 finished with value: 0.8366140764235777 and parameters: {'splitter': 'best', 'min_samples_split': 0.2208412490781354, 'min_samples_leaf': 0.038318432159402296, 'min_weight_fraction_leaf': 0.010784404863767551, 'max_features': 0.9999781530575472}. Best is trial 223 with value: 0.8372023218910313.[0m
[32m[I 2022-04-21 11:37:57,218][0m Trial 236 finished with value: 0.8366140764235777 and parameters: {'splitter': 'best', 'min_samples_split': 0.22835330875281412, 'min_samples_leaf': 0.0413507523431416, 'min_weight_fraction_leaf': 0.002804092987764467, 'max_features': 0.9234132498272962}. Best is trial 223 with value: 0.8372023218910313.[0m
[32m[I 2022-04-21 11:37:57,345][0m Trial 237 finished with value: 0.8363268199688415 and parameters: {'splitter': 'best', 'min_samples_split': 0.2406427932029673, 'min_samples_leaf': 0.04969445910989531, 'min_weight_fraction_leaf': 0.013799463160775047, 'max_features': 0.9671139773302857}. Best is trial 223 with value: 0.8372023218910313.[0m
[32m[I 2022-04-21 11:37:57,446][0m Trial 238 finished with value: 0.8370547382698911 and parameters: {'splitter': 'best', 'min_samples_split': 0.2077356889866935, 'min_samples_leaf': 0.06172706328189294, 'min_weight_fraction_leaf': 0.0025197982272833833, 'max_features': 0.9628116722293215}. Best is trial 223 with value: 0.8372023218910313.[0m
[32m[I 2022-04-21 11:37:57,510][0m Trial 239 finished with value: 0.8361084444785265 and parameters: {'splitter': 'best', 'min_samples_split': 0.21350344562973447, 'min_samples_leaf': 0.051736942978699, 'min_weight_fraction_leaf': 0.001562546346066362, 'max_features': 0.9607936542147284}. Best is trial 223 with value: 0.8372023218910313.[0m
[32m[I 2022-04-21 11:37:57,623][0m Trial 240 finished with value: 0.8363914938304864 and parameters: {'splitter': 'best', 'min_samples_split': 0.19645162578810438, 'min_samples_leaf': 0.06733738987328011, 'min_weight_fraction_leaf': 0.02238550511607338, 'max_features': 0.9807208419997369}. Best is trial 223 with value: 0.8372023218910313.[0m
[32m[I 2022-04-21 11:37:57,693][0m Trial 241 finished with value: 0.8366140764235777 and parameters: {'splitter': 'best', 'min_samples_split': 0.23577883163784852, 'min_samples_leaf': 0.03721099201478326, 'min_weight_fraction_leaf': 0.012095053018258067, 'max_features': 0.9996844566407074}. Best is trial 223 with value: 0.8372023218910313.[0m
[32m[I 2022-04-21 11:37:57,745][0m Trial 242 finished with value: 0.8369839464007164 and parameters: {'splitter': 'best', 'min_samples_split': 0.22097862853701514, 'min_samples_leaf': 0.045682237961706146, 'min_weight_fraction_leaf': 0.0006586996758851606, 'max_features': 0.9685272248350205}. Best is trial 223 with value: 0.8372023218910313.[0m
[32m[I 2022-04-21 11:37:57,815][0m Trial 243 finished with value: 0.8370547382698911 and parameters: {'splitter': 'best', 'min_samples_split': 0.2211686354824933, 'min_samples_leaf': 0.06133265630619224, 'min_weight_fraction_leaf': 4.0475452323970916e-05, 'max_features': 0.9611302356717546}. Best is trial 223 with value: 0.8372023218910313.[0m
[32m[I 2022-04-21 11:37:57,891][0m Trial 244 finished with value: 0.8370547382698911 and parameters: {'splitter': 'best', 'min_samples_split': 0.2179050145363091, 'min_samples_leaf': 0.06097736928228657, 'min_weight_fraction_leaf': 0.003174272977929867, 'max_features': 0.9643947651632044}. Best is trial 223 with value: 0.8372023218910313.[0m
[32m[I 2022-04-21 11:37:57,966][0m Trial 245 finished with value: 0.8370547382698911 and parameters: {'splitter': 'best', 'min_samples_split': 0.21965311778383456, 'min_samples_leaf': 0.05902518899951052, 'min_weight_fraction_leaf': 0.0003259522626646822, 'max_features': 0.9833068924479108}. Best is trial 223 with value: 0.8372023218910313.[0m
[32m[I 2022-04-21 11:37:58,033][0m Trial 246 finished with value: 0.8370547382698911 and parameters: {'splitter': 'best', 'min_samples_split': 0.22325308612947717, 'min_samples_leaf': 0.060764414498709354, 'min_weight_fraction_leaf': 0.0005131851553655047, 'max_features': 0.9781728933724905}. Best is trial 223 with value: 0.8372023218910313.[0m
[32m[I 2022-04-21 11:37:58,087][0m Trial 247 finished with value: 0.8367225558573038 and parameters: {'splitter': 'best', 'min_samples_split': 0.20825803081362743, 'min_samples_leaf': 0.07561333476176882, 'min_weight_fraction_leaf': 0.0019998089965093955, 'max_features': 0.9801387442721179}. Best is trial 223 with value: 0.8372023218910313.[0m
[32m[I 2022-04-21 11:37:58,135][0m Trial 248 finished with value: 0.8363914938304864 and parameters: {'splitter': 'best', 'min_samples_split': 0.21820385339946974, 'min_samples_leaf': 0.06429266300346706, 'min_weight_fraction_leaf': 0.0001284154718182468, 'max_features': 0.9619749972044062}. Best is trial 223 with value: 0.8372023218910313.[0m
[32m[I 2022-04-21 11:37:58,179][0m Trial 249 finished with value: 0.8370547382698911 and parameters: {'splitter': 'best', 'min_samples_split': 0.2244881100271332, 'min_samples_leaf': 0.06043494100561094, 'min_weight_fraction_leaf': 1.9511750353260046e-06, 'max_features': 0.981548212421731}. Best is trial 223 with value: 0.8372023218910313.[0m
[32m[I 2022-04-21 11:37:58,225][0m Trial 250 finished with value: 0.8370547382698911 and parameters: {'splitter': 'best', 'min_samples_split': 0.2220695204756522, 'min_samples_leaf': 0.060092388076297354, 'min_weight_fraction_leaf': 0.0018012253922768022, 'max_features': 0.9987596438234658}. Best is trial 223 with value: 0.8372023218910313.[0m
[32m[I 2022-04-21 11:37:58,276][0m Trial 251 finished with value: 0.8370547382698911 and parameters: {'splitter': 'best', 'min_samples_split': 0.22567867362692484, 'min_samples_leaf': 0.06226393406775543, 'min_weight_fraction_leaf': 0.009211317659048751, 'max_features': 0.9973412566454932}. Best is trial 223 with value: 0.8372023218910313.[0m
[32m[I 2022-04-21 11:37:58,327][0m Trial 252 finished with value: 0.8342605834042434 and parameters: {'splitter': 'best', 'min_samples_split': 0.22290166811790946, 'min_samples_leaf': 0.0806625606836042, 'min_weight_fraction_leaf': 0.0009301031397451207, 'max_features': 0.9934899867525147}. Best is trial 223 with value: 0.8372023218910313.[0m
