[32m[I 2022-04-22 23:50:07,618][0m Trial 519 finished with value: 0.6476633954471942 and parameters: {'loss': 'coxph', 'learning_rate': 0.07135300957403533, 'n_estimators': 728, 'criterion': 'friedman_mse', 'min_samples_split': 10, 'min_samples_leaf': 3, 'min_weight_fraction_leaf': 0.046074855352509256, 'min_impurity_decrease': 0.8905122765712368, 'max_features': 0.5657688806238936, 'subsample': 0.308509761189049, 'dropout_rate': 0.24270675063405767, 'ccp_alpha': 0.0893448167068809}. Best is trial 218 with value: 0.6659976583847056.[0m
[32m[I 2022-04-22 23:51:14,021][0m Trial 520 finished with value: 0.6616426054855638 and parameters: {'loss': 'coxph', 'learning_rate': 0.050959222927674984, 'n_estimators': 523, 'criterion': 'friedman_mse', 'min_samples_split': 10, 'min_samples_leaf': 3, 'min_weight_fraction_leaf': 0.08620087654552437, 'min_impurity_decrease': 0.9193834366769656, 'max_features': 0.4870295486022403, 'subsample': 0.34059908578516307, 'dropout_rate': 0.26679484107572937, 'ccp_alpha': 0.006567095024703314}. Best is trial 218 with value: 0.6659976583847056.[0m
[32m[I 2022-04-22 23:52:16,782][0m Trial 521 finished with value: 0.5177362383394645 and parameters: {'loss': 'coxph', 'learning_rate': 0.060242749425820044, 'n_estimators': 523, 'criterion': 'friedman_mse', 'min_samples_split': 10, 'min_samples_leaf': 3, 'min_weight_fraction_leaf': 0.12193018670803249, 'min_impurity_decrease': 0.9609214653427711, 'max_features': 0.4820034138738556, 'subsample': 0.3762450171187793, 'dropout_rate': 0.27182702333150793, 'ccp_alpha': 0.24848322912050327}. Best is trial 218 with value: 0.6659976583847056.[0m
[32m[I 2022-04-22 23:53:23,979][0m Trial 522 finished with value: 0.6277595485968679 and parameters: {'loss': 'coxph', 'learning_rate': 0.08280630592493851, 'n_estimators': 553, 'criterion': 'friedman_mse', 'min_samples_split': 10, 'min_samples_leaf': 3, 'min_weight_fraction_leaf': 0.08936299368776109, 'min_impurity_decrease': 0.9308463699445098, 'max_features': 0.4886389541426427, 'subsample': 0.39566479453855624, 'dropout_rate': 0.28844023918487366, 'ccp_alpha': 0.15487697967010758}. Best is trial 218 with value: 0.6659976583847056.[0m
[32m[I 2022-04-22 23:54:18,000][0m Trial 523 finished with value: 0.6364029294312913 and parameters: {'loss': 'coxph', 'learning_rate': 0.05394158474514015, 'n_estimators': 498, 'criterion': 'squared_error', 'min_samples_split': 10, 'min_samples_leaf': 3, 'min_weight_fraction_leaf': 0.10221342464601398, 'min_impurity_decrease': 0.13525340540300557, 'max_features': 0.5024622207826144, 'subsample': 0.3557105797574789, 'dropout_rate': 0.3042074606008908, 'ccp_alpha': 0.0896202863956837}. Best is trial 218 with value: 0.6659976583847056.[0m
[32m[I 2022-04-22 23:55:25,705][0m Trial 524 finished with value: 0.6606606721602326 and parameters: {'loss': 'coxph', 'learning_rate': 0.010337643413142666, 'n_estimators': 532, 'criterion': 'friedman_mse', 'min_samples_split': 10, 'min_samples_leaf': 3, 'min_weight_fraction_leaf': 0.08620333619418728, 'min_impurity_decrease': 0.8715353039623095, 'max_features': 0.5273322743594682, 'subsample': 0.33883975254707255, 'dropout_rate': 0.2590232431369628, 'ccp_alpha': 0.006214891777012562}. Best is trial 218 with value: 0.6659976583847056.[0m
[32m[I 2022-04-22 23:56:09,822][0m Trial 525 finished with value: 0.6158251383697054 and parameters: {'loss': 'coxph', 'learning_rate': 0.03316290396366297, 'n_estimators': 477, 'criterion': 'friedman_mse', 'min_samples_split': 10, 'min_samples_leaf': 6, 'min_weight_fraction_leaf': 0.060532088276215056, 'min_impurity_decrease': 0.9991936097850368, 'max_features': 0.526391187048993, 'subsample': 0.25438614777906315, 'dropout_rate': 0.4037787954399147, 'ccp_alpha': 0.16959944379054634}. Best is trial 218 with value: 0.6659976583847056.[0m
[32m[I 2022-04-22 23:57:05,662][0m Trial 526 finished with value: 0.5006540204610004 and parameters: {'loss': 'coxph', 'learning_rate': 0.07645549388728458, 'n_estimators': 502, 'criterion': 'friedman_mse', 'min_samples_split': 10, 'min_samples_leaf': 3, 'min_weight_fraction_leaf': 0.06931932242912911, 'min_impurity_decrease': 0.9065599500483159, 'max_features': 0.542827219341965, 'subsample': 0.21183319915391086, 'dropout_rate': 0.26985680387930994, 'ccp_alpha': 0.3678180189373971}. Best is trial 218 with value: 0.6659976583847056.[0m
[32m[I 2022-04-22 23:58:10,199][0m Trial 527 finished with value: 0.6597972744911194 and parameters: {'loss': 'coxph', 'learning_rate': 0.020649986440798795, 'n_estimators': 576, 'criterion': 'friedman_mse', 'min_samples_split': 10, 'min_samples_leaf': 3, 'min_weight_fraction_leaf': 0.09120945379584215, 'min_impurity_decrease': 0.9450434685276502, 'max_features': 0.4958343562111165, 'subsample': 0.28928985105494015, 'dropout_rate': 0.42568454150850094, 'ccp_alpha': 0.003197546013994532}. Best is trial 218 with value: 0.6659976583847056.[0m
[32m[I 2022-04-22 23:59:14,569][0m Trial 528 finished with value: 0.6361678332371353 and parameters: {'loss': 'coxph', 'learning_rate': 0.09865006143395816, 'n_estimators': 516, 'criterion': 'friedman_mse', 'min_samples_split': 10, 'min_samples_leaf': 4, 'min_weight_fraction_leaf': 0.11319280389925665, 'min_impurity_decrease': 0.8920276987423642, 'max_features': 0.4825337551319959, 'subsample': 0.33420232452642834, 'dropout_rate': 0.2502034235956659, 'ccp_alpha': 0.11191494327391145}. Best is trial 218 with value: 0.6659976583847056.[0m
[32m[I 2022-04-23 00:00:02,337][0m Trial 529 finished with value: 0.5 and parameters: {'loss': 'coxph', 'learning_rate': 0.05244919778299338, 'n_estimators': 431, 'criterion': 'friedman_mse', 'min_samples_split': 10, 'min_samples_leaf': 3, 'min_weight_fraction_leaf': 0.2080487589394705, 'min_impurity_decrease': 0.8559945717628582, 'max_features': 0.605053749942832, 'subsample': 0.3627308529259394, 'dropout_rate': 0.23807422025801125, 'ccp_alpha': 4.056921849474028}. Best is trial 218 with value: 0.6659976583847056.[0m
[32m[I 2022-04-23 00:00:50,604][0m Trial 530 finished with value: 0.6613102235165471 and parameters: {'loss': 'coxph', 'learning_rate': 0.06603621988060189, 'n_estimators': 451, 'criterion': 'friedman_mse', 'min_samples_split': 10, 'min_samples_leaf': 3, 'min_weight_fraction_leaf': 0.055483531914078746, 'min_impurity_decrease': 0.964160356235598, 'max_features': 0.2382543445711257, 'subsample': 0.26486398696197067, 'dropout_rate': 0.29897756725957936, 'ccp_alpha': 0.003160363336968928}. Best is trial 218 with value: 0.6659976583847056.[0m
[32m[I 2022-04-23 00:01:40,114][0m Trial 531 finished with value: 0.5 and parameters: {'loss': 'coxph', 'learning_rate': 0.01612296554809082, 'n_estimators': 469, 'criterion': 'friedman_mse', 'min_samples_split': 10, 'min_samples_leaf': 3, 'min_weight_fraction_leaf': 0.08127664360337539, 'min_impurity_decrease': 0.9239805218340092, 'max_features': 0.5233407183505381, 'subsample': 0.4397697996773344, 'dropout_rate': 0.28448968110973105, 'ccp_alpha': 1.9577183594951413}. Best is trial 218 with value: 0.6659976583847056.[0m
/media/san2_ssd/data/Workdir/survival/venv/lib/python3.8/site-packages/sksurv/ensemble/boosting.py:955: RuntimeWarning: divide by zero encountered in log
  time = numpy.log(time)
/media/san2_ssd/data/Workdir/survival/venv/lib/python3.8/site-packages/sksurv/ensemble/boosting.py:955: RuntimeWarning: divide by zero encountered in log
  time = numpy.log(time)
/media/san2_ssd/data/Workdir/survival/venv/lib/python3.8/site-packages/sksurv/ensemble/boosting.py:955: RuntimeWarning: divide by zero encountered in log
  time = numpy.log(time)
/media/san2_ssd/data/Workdir/survival/venv/lib/python3.8/site-packages/sksurv/ensemble/boosting.py:955: RuntimeWarning: divide by zero encountered in log
  time = numpy.log(time)
[32m[I 2022-04-23 00:01:47,878][0m Trial 532 finished with value: -0.7356376520358172 and parameters: {'loss': 'squared', 'learning_rate': 0.044533696552000415, 'n_estimators': 398, 'criterion': 'friedman_mse', 'min_samples_split': 6, 'min_samples_leaf': 3, 'min_weight_fraction_leaf': 0.04278948002717317, 'min_impurity_decrease': 0.09740505536213001, 'max_features': 0.5587656619169942, 'subsample': 0.23324430914777855, 'dropout_rate': 0.20173833241993008, 'ccp_alpha': 0.27873302359179397}. Best is trial 218 with value: 0.6659976583847056.[0m
[32m[I 2022-04-23 00:02:56,955][0m Trial 533 finished with value: 0.6483457540571002 and parameters: {'loss': 'coxph', 'learning_rate': 0.026146711655805645, 'n_estimators': 543, 'criterion': 'friedman_mse', 'min_samples_split': 10, 'min_samples_leaf': 3, 'min_weight_fraction_leaf': 0.09780728564706635, 'min_impurity_decrease': 0.8813267736151823, 'max_features': 0.5813857276242251, 'subsample': 0.281516683353193, 'dropout_rate': 0.26391012944060044, 'ccp_alpha': 0.16118408223903247}. Best is trial 218 with value: 0.6659976583847056.[0m
[32m[I 2022-04-23 00:04:01,326][0m Trial 534 finished with value: 0.6587955035801336 and parameters: {'loss': 'coxph', 'learning_rate': 0.06482310317042507, 'n_estimators': 498, 'criterion': 'friedman_mse', 'min_samples_split': 10, 'min_samples_leaf': 3, 'min_weight_fraction_leaf': 0.0667534847492423, 'min_impurity_decrease': 0.8407576966245829, 'max_features': 0.5414739718791801, 'subsample': 0.2508226007574025, 'dropout_rate': 0.2162753511083633, 'ccp_alpha': 0.001656031212667565}. Best is trial 218 with value: 0.6659976583847056.[0m
[32m[I 2022-04-23 00:04:11,358][0m Trial 535 finished with value: 0.6421277141044948 and parameters: {'loss': 'coxph', 'learning_rate': 0.0373498962120308, 'n_estimators': 180, 'criterion': 'friedman_mse', 'min_samples_split': 10, 'min_samples_leaf': 3, 'min_weight_fraction_leaf': 0.08169094502680108, 'min_impurity_decrease': 0.9101212922942343, 'max_features': 0.5096874216477618, 'subsample': 0.48357671239060074, 'dropout_rate': 0.16777059156520627, 'ccp_alpha': 0.08934126729787142}. Best is trial 218 with value: 0.6659976583847056.[0m
[32m[I 2022-04-23 00:05:38,949][0m Trial 536 finished with value: 0.5623511703378433 and parameters: {'loss': 'coxph', 'learning_rate': 0.008334568901171402, 'n_estimators': 903, 'criterion': 'friedman_mse', 'min_samples_split': 10, 'min_samples_leaf': 3, 'min_weight_fraction_leaf': 0.0576881311564042, 'min_impurity_decrease': 0.9288296085764919, 'max_features': 0.8890892163318339, 'subsample': 0.31645950859435024, 'dropout_rate': 0.7034212891952869, 'ccp_alpha': 0.24334974802744286}. Best is trial 218 with value: 0.6659976583847056.[0m
[32m[I 2022-04-23 00:06:51,359][0m Trial 537 finished with value: 0.6507680896671177 and parameters: {'loss': 'coxph', 'learning_rate': 0.09887284507885885, 'n_estimators': 597, 'criterion': 'friedman_mse', 'min_samples_split': 10, 'min_samples_leaf': 4, 'min_weight_fraction_leaf': 0.07367296352596166, 'min_impurity_decrease': 0.9515790740593052, 'max_features': 0.59034204143668, 'subsample': 0.19980232927565034, 'dropout_rate': 0.3802533538932723, 'ccp_alpha': 0.09723509977917252}. Best is trial 218 with value: 0.6659976583847056.[0m
[32m[I 2022-04-23 00:07:55,496][0m Trial 538 finished with value: 0.5 and parameters: {'loss': 'coxph', 'learning_rate': 0.048563378861027365, 'n_estimators': 526, 'criterion': 'absolute_error', 'min_samples_split': 10, 'min_samples_leaf': 3, 'min_weight_fraction_leaf': 0.09471398103866308, 'min_impurity_decrease': 0.9785120157056059, 'max_features': 0.5596636592977955, 'subsample': 0.2927052599353594, 'dropout_rate': 0.2431310695381834, 'ccp_alpha': 0.0011883353977175308}. Best is trial 218 with value: 0.6659976583847056.[0m
[32m[I 2022-04-23 00:09:02,845][0m Trial 539 finished with value: 0.5 and parameters: {'loss': 'coxph', 'learning_rate': 0.05962958342463454, 'n_estimators': 558, 'criterion': 'friedman_mse', 'min_samples_split': 10, 'min_samples_leaf': 3, 'min_weight_fraction_leaf': 0.06698792196241068, 'min_impurity_decrease': 0.8654764668621472, 'max_features': 0.6243711142054944, 'subsample': 0.34337962792437315, 'dropout_rate': 0.3055379247643224, 'ccp_alpha': 0.4843247516542082}. Best is trial 218 with value: 0.6659976583847056.[0m
[32m[I 2022-04-23 00:09:55,441][0m Trial 540 finished with value: 0.6011437532534684 and parameters: {'loss': 'coxph', 'learning_rate': 0.07475209044180531, 'n_estimators': 487, 'criterion': 'friedman_mse', 'min_samples_split': 10, 'min_samples_leaf': 3, 'min_weight_fraction_leaf': 0.10779788383236644, 'min_impurity_decrease': 0.8949189896556796, 'max_features': 0.4774270649427607, 'subsample': 0.2660560753090587, 'dropout_rate': 0.2722459516915178, 'ccp_alpha': 0.18493576670600143}. Best is trial 218 with value: 0.6659976583847056.[0m
[32m[I 2022-04-23 00:10:48,136][0m Trial 541 finished with value: 0.6352487404591072 and parameters: {'loss': 'coxph', 'learning_rate': 0.0348241760667967, 'n_estimators': 464, 'criterion': 'friedman_mse', 'min_samples_split': 10, 'min_samples_leaf': 2, 'min_weight_fraction_leaf': 0.0841437130920866, 'min_impurity_decrease': 0.9085654282708057, 'max_features': 0.5321810391960582, 'subsample': 0.5431746810436886, 'dropout_rate': 0.19010030574418282, 'ccp_alpha': 0.09193853317845917}. Best is trial 218 with value: 0.6659976583847056.[0m
[32m[I 2022-04-23 00:11:49,210][0m Trial 542 finished with value: 0.6451773410276995 and parameters: {'loss': 'coxph', 'learning_rate': 0.011759186891068406, 'n_estimators': 513, 'criterion': 'friedman_mse', 'min_samples_split': 5, 'min_samples_leaf': 3, 'min_weight_fraction_leaf': 0.051613452743104894, 'min_impurity_decrease': 0.8225563603857031, 'max_features': 0.7475312900527826, 'subsample': 0.22762655315789015, 'dropout_rate': 0.2285827713072956, 'ccp_alpha': 0.15350090848127992}. Best is trial 218 with value: 0.6659976583847056.[0m
[32m[I 2022-04-23 00:14:44,316][0m Trial 543 finished with value: 0.548129588481702 and parameters: {'loss': 'coxph', 'learning_rate': 0.0769165090853687, 'n_estimators': 951, 'criterion': 'friedman_mse', 'min_samples_split': 10, 'min_samples_leaf': 3, 'min_weight_fraction_leaf': 0.07433389106550953, 'min_impurity_decrease': 0.941318952588633, 'max_features': 0.785973028586404, 'subsample': 0.3028363811842233, 'dropout_rate': 0.3567448810158574, 'ccp_alpha': 0.29157977302569116}. Best is trial 218 with value: 0.6659976583847056.[0m
[32m[I 2022-04-23 00:15:40,210][0m Trial 544 finished with value: 0.6521699393653938 and parameters: {'loss': 'coxph', 'learning_rate': 0.021217082836154012, 'n_estimators': 541, 'criterion': 'friedman_mse', 'min_samples_split': 10, 'min_samples_leaf': 3, 'min_weight_fraction_leaf': 0.08902424445918128, 'min_impurity_decrease': 0.8739272780561989, 'max_features': 0.5678788876993599, 'subsample': 0.24909595723604025, 'dropout_rate': 0.4145275271980429, 'ccp_alpha': 0.09838853697785789}. Best is trial 218 with value: 0.6659976583847056.[0m
[32m[I 2022-04-23 00:17:05,724][0m Trial 545 finished with value: 0.5 and parameters: {'loss': 'coxph', 'learning_rate': 0.05178322342998614, 'n_estimators': 622, 'criterion': 'squared_error', 'min_samples_split': 10, 'min_samples_leaf': 3, 'min_weight_fraction_leaf': 0.06214433831843977, 'min_impurity_decrease': 0.9240499389419123, 'max_features': 0.51322118046505, 'subsample': 0.32493009439099413, 'dropout_rate': 0.2496147827476261, 'ccp_alpha': 0.0037893700423595944}. Best is trial 218 with value: 0.6659976583847056.[0m
[32m[I 2022-04-23 00:17:51,769][0m Trial 546 finished with value: 0.5 and parameters: {'loss': 'coxph', 'learning_rate': 0.02962240286096239, 'n_estimators': 437, 'criterion': 'friedman_mse', 'min_samples_split': 10, 'min_samples_leaf': 3, 'min_weight_fraction_leaf': 0.03624243526575086, 'min_impurity_decrease': 0.8829860365925736, 'max_features': 0.6102821731486823, 'subsample': 0.2772007677327023, 'dropout_rate': 0.20961486889933315, 'ccp_alpha': 1.2976851275064185}. Best is trial 218 with value: 0.6659976583847056.[0m
[32m[I 2022-04-23 00:18:31,030][0m Trial 547 finished with value: 0.5728201946349832 and parameters: {'loss': 'coxph', 'learning_rate': 0.013314355581931732, 'n_estimators': 489, 'criterion': 'friedman_mse', 'min_samples_split': 10, 'min_samples_leaf': 5, 'min_weight_fraction_leaf': 0.1010493661296546, 'min_impurity_decrease': 0.9674843105266356, 'max_features': 0.7282220603977559, 'subsample': 0.29953221203807345, 'dropout_rate': 0.5217875819970589, 'ccp_alpha': 0.2158767997754476}. Best is trial 218 with value: 0.6659976583847056.[0m
[32m[I 2022-04-23 00:19:07,568][0m Trial 548 finished with value: 0.5 and parameters: {'loss': 'coxph', 'learning_rate': 6.0991528820703576e-05, 'n_estimators': 461, 'criterion': 'friedman_mse', 'min_samples_split': 10, 'min_samples_leaf': 3, 'min_weight_fraction_leaf': 0.3190290334062891, 'min_impurity_decrease': 0.8466061504147774, 'max_features': 0.5368320958098746, 'subsample': 0.26721031446169674, 'dropout_rate': 0.4625592020597303, 'ccp_alpha': 0.9804720758946555}. Best is trial 218 with value: 0.6659976583847056.[0m
[32m[I 2022-04-23 00:20:08,366][0m Trial 549 finished with value: 0.6534555818789133 and parameters: {'loss': 'coxph', 'learning_rate': 0.04161331701180002, 'n_estimators': 514, 'criterion': 'friedman_mse', 'min_samples_split': 10, 'min_samples_leaf': 3, 'min_weight_fraction_leaf': 0.0760421917814791, 'min_impurity_decrease': 0.9018864949828829, 'max_features': 0.5961371163316465, 'subsample': 0.21392397965575433, 'dropout_rate': 0.28646927053350807, 'ccp_alpha': 0.0948928118444306}. Best is trial 218 with value: 0.6659976583847056.[0m
[32m[I 2022-04-23 00:21:10,743][0m Trial 550 finished with value: 0.6547976945041604 and parameters: {'loss': 'coxph', 'learning_rate': 0.08238689967010998, 'n_estimators': 573, 'criterion': 'friedman_mse', 'min_samples_split': 10, 'min_samples_leaf': 4, 'min_weight_fraction_leaf': 0.05068654190171033, 'min_impurity_decrease': 0.3433129509912145, 'max_features': 0.4811353764838558, 'subsample': 0.2383086115777634, 'dropout_rate': 0.43883225310018037, 'ccp_alpha': 0.004746093799813163}. Best is trial 218 with value: 0.6659976583847056.[0m
/media/san2_ssd/data/Workdir/survival/venv/lib/python3.8/site-packages/sksurv/ensemble/boosting.py:955: RuntimeWarning: divide by zero encountered in log
  time = numpy.log(time)
/media/san2_ssd/data/Workdir/survival/venv/lib/python3.8/site-packages/sksurv/ensemble/boosting.py:955: RuntimeWarning: divide by zero encountered in log
  time = numpy.log(time)
/media/san2_ssd/data/Workdir/survival/venv/lib/python3.8/site-packages/sksurv/ensemble/boosting.py:955: RuntimeWarning: divide by zero encountered in log
  time = numpy.log(time)
/media/san2_ssd/data/Workdir/survival/venv/lib/python3.8/site-packages/sksurv/ensemble/boosting.py:955: RuntimeWarning: divide by zero encountered in log
  time = numpy.log(time)
[32m[I 2022-04-23 00:21:19,413][0m Trial 551 finished with value: -0.7341958006815215 and parameters: {'loss': 'squared', 'learning_rate': 0.0534617163069112, 'n_estimators': 481, 'criterion': 'friedman_mse', 'min_samples_split': 10, 'min_samples_leaf': 3, 'min_weight_fraction_leaf': 0.08373906360952615, 'min_impurity_decrease': 0.9464669599947436, 'max_features': 0.50449415647135, 'subsample': 0.3162751800529447, 'dropout_rate': 0.39522609982361834, 'ccp_alpha': 0.17218990411465204}. Best is trial 218 with value: 0.6659976583847056.[0m
[32m[I 2022-04-23 00:21:58,928][0m Trial 552 finished with value: 0.5477981290371969 and parameters: {'loss': 'coxph', 'learning_rate': 0.017699939120644798, 'n_estimators': 422, 'criterion': 'friedman_mse', 'min_samples_split': 10, 'min_samples_leaf': 2, 'min_weight_fraction_leaf': 0.1279660379300505, 'min_impurity_decrease': 0.9201193194278876, 'max_features': 0.556082543502086, 'subsample': 0.28387214712555675, 'dropout_rate': 0.31912060624209987, 'ccp_alpha': 0.24097481059466389}. Best is trial 218 with value: 0.6659976583847056.[0m
[32m[I 2022-04-23 00:23:05,743][0m Trial 553 finished with value: 0.6486118500398128 and parameters: {'loss': 'coxph', 'learning_rate': 0.06707527623632556, 'n_estimators': 539, 'criterion': 'friedman_mse', 'min_samples_split': 10, 'min_samples_leaf': 3, 'min_weight_fraction_leaf': 0.06621329432990433, 'min_impurity_decrease': 0.8630650315856028, 'max_features': 0.7590494347765697, 'subsample': 0.3423220533326136, 'dropout_rate': 0.26168929865490564, 'ccp_alpha': 0.09313614871723916}. Best is trial 218 with value: 0.6659976583847056.[0m
[32m[I 2022-04-23 00:24:15,410][0m Trial 554 finished with value: 0.6620255923404663 and parameters: {'loss': 'coxph', 'learning_rate': 0.035410338477331466, 'n_estimators': 508, 'criterion': 'friedman_mse', 'min_samples_split': 10, 'min_samples_leaf': 3, 'min_weight_fraction_leaf': 0.09467218201172105, 'min_impurity_decrease': 0.42117562185098073, 'max_features': 0.5723811725480126, 'subsample': 0.25260505346057377, 'dropout_rate': 0.22843091889860825, 'ccp_alpha': 0.0013919432017826007}. Best is trial 218 with value: 0.6659976583847056.[0m
[32m[I 2022-04-23 00:28:09,772][0m Trial 555 finished with value: 0.553606310106803 and parameters: {'loss': 'coxph', 'learning_rate': 0.030526017214519734, 'n_estimators': 990, 'criterion': 'friedman_mse', 'min_samples_split': 10, 'min_samples_leaf': 8, 'min_weight_fraction_leaf': 0.11105008711801741, 'min_impurity_decrease': 0.809808606176103, 'max_features': 0.5977983035523949, 'subsample': 0.19454392037684454, 'dropout_rate': 0.17951937192218403, 'ccp_alpha': 0.34590536578599296}. Best is trial 218 with value: 0.6659976583847056.[0m
