[32m[I 2022-04-23 02:40:42,338][0m Trial 734 finished with value: 0.6384896185520618 and parameters: {'n_hidden': 1024, 'mixture_components': 7, 'use_sparse_layer': False, 'use_batchnorm': False, 'use_dropout': False, 'mlp_size_1': 6, 'mlp_size_2': 0, 'mlp_size_3': 1, 'kernel': 'Logistic', 'loss_name': 'AlternativeNLLLoss'}. Best is trial 656 with value: 0.7038239344068009.[0m
[32m[I 2022-04-23 02:42:05,705][0m Trial 735 finished with value: 0.6753911911244064 and parameters: {'n_hidden': 2048, 'mixture_components': 5, 'use_sparse_layer': False, 'use_batchnorm': False, 'use_dropout': False, 'mlp_size_1': 7, 'mlp_size_2': 0, 'mlp_size_3': 1, 'kernel': 'Gumbel', 'loss_name': 'AlternativeNLLLoss'}. Best is trial 656 with value: 0.7038239344068009.[0m
[32m[I 2022-04-23 02:42:47,136][0m Trial 736 finished with value: 0.6795565300518086 and parameters: {'n_hidden': 1024, 'mixture_components': 8, 'use_sparse_layer': False, 'use_batchnorm': False, 'use_dropout': True, 'dropout': 0.2638543712022927, 'mlp_size_1': 6, 'mlp_size_2': 0, 'mlp_size_3': 1, 'kernel': 'Logistic', 'loss_name': 'AlternativeNLLLoss'}. Best is trial 656 with value: 0.7038239344068009.[0m
[32m[I 2022-04-23 02:43:15,462][0m Trial 737 finished with value: -0.6641922210698085 and parameters: {'n_hidden': 1024, 'mixture_components': 6, 'use_sparse_layer': False, 'use_batchnorm': False, 'use_dropout': False, 'mlp_size_1': 6, 'mlp_size_2': 0, 'mlp_size_3': 1, 'kernel': 'Exponential', 'loss_name': 'AlternativeNLLLoss'}. Best is trial 656 with value: 0.7038239344068009.[0m
[32m[I 2022-04-23 02:43:57,772][0m Trial 738 finished with value: 0.6863468765791522 and parameters: {'n_hidden': 1024, 'mixture_components': 8, 'use_sparse_layer': False, 'use_batchnorm': False, 'use_dropout': False, 'mlp_size_1': 5, 'mlp_size_2': 0, 'mlp_size_3': 1, 'kernel': 'Logistic', 'loss_name': 'CensoredNLLLoss'}. Best is trial 656 with value: 0.7038239344068009.[0m
[32m[I 2022-04-23 02:45:17,898][0m Trial 739 finished with value: 0.6661630968664172 and parameters: {'n_hidden': 32, 'mixture_components': 6, 'use_sparse_layer': False, 'use_batchnorm': False, 'use_dropout': False, 'mlp_size_1': 2, 'mlp_size_2': 0, 'mlp_size_3': 0, 'kernel': 'Gumbel', 'loss_name': 'AlternativeNLLLoss'}. Best is trial 656 with value: 0.7038239344068009.[0m
[32m[I 2022-04-23 02:46:04,178][0m Trial 740 finished with value: 0.6753671213546009 and parameters: {'n_hidden': 1024, 'mixture_components': 7, 'use_sparse_layer': False, 'use_batchnorm': False, 'use_dropout': False, 'mlp_size_1': 6, 'mlp_size_2': 0, 'mlp_size_3': 1, 'kernel': 'Logistic', 'loss_name': 'AlternativeNLLLoss'}. Best is trial 656 with value: 0.7038239344068009.[0m
[32m[I 2022-04-23 02:47:49,415][0m Trial 741 finished with value: 0.6454693130946227 and parameters: {'n_hidden': 1024, 'mixture_components': 10, 'use_sparse_layer': False, 'use_batchnorm': True, 'use_dropout': False, 'mlp_size_1': 6, 'mlp_size_2': 0, 'mlp_size_3': 1, 'kernel': 'Logistic', 'loss_name': 'AlternativeNLLLoss'}. Best is trial 656 with value: 0.7038239344068009.[0m
[32m[I 2022-04-23 02:48:31,642][0m Trial 742 finished with value: 0.6734746243065398 and parameters: {'n_hidden': 1024, 'mixture_components': 8, 'use_sparse_layer': False, 'use_batchnorm': False, 'use_dropout': False, 'mlp_size_1': 6, 'mlp_size_2': 0, 'mlp_size_3': 1, 'kernel': 'Gumbel', 'loss_name': 'AlternativeNLLLoss'}. Best is trial 656 with value: 0.7038239344068009.[0m
[32m[I 2022-04-23 02:49:16,486][0m Trial 743 finished with value: 0.6778262043373182 and parameters: {'n_hidden': 1024, 'mixture_components': 8, 'use_sparse_layer': False, 'use_batchnorm': False, 'use_dropout': False, 'mlp_size_1': 7, 'mlp_size_2': 0, 'mlp_size_3': 0, 'kernel': 'Logistic', 'loss_name': 'AlternativeNLLLoss'}. Best is trial 656 with value: 0.7038239344068009.[0m
[32m[I 2022-04-23 02:50:18,549][0m Trial 744 finished with value: 0.6840952686253243 and parameters: {'n_hidden': 1024, 'mixture_components': 1, 'use_sparse_layer': True, 'use_sparse_loss': False, 'use_batchnorm': False, 'use_dropout': False, 'mlp_size_1': 6, 'mlp_size_2': 0, 'mlp_size_3': 1, 'kernel': 'Gumbel', 'loss_name': 'AlternativeNLLLoss'}. Best is trial 656 with value: 0.7038239344068009.[0m
[32m[I 2022-04-23 02:51:10,084][0m Trial 745 finished with value: 0.6905606028052975 and parameters: {'n_hidden': 512, 'mixture_components': 7, 'use_sparse_layer': False, 'use_batchnorm': False, 'use_dropout': False, 'mlp_size_1': 6, 'mlp_size_2': 0, 'mlp_size_3': 0, 'kernel': 'Logistic', 'loss_name': 'AlternativeNLLLoss'}. Best is trial 656 with value: 0.7038239344068009.[0m
[32m[I 2022-04-23 02:52:00,217][0m Trial 746 finished with value: 0.6781475689040555 and parameters: {'n_hidden': 1024, 'mixture_components': 8, 'use_sparse_layer': False, 'use_batchnorm': False, 'use_dropout': False, 'mlp_size_1': 6, 'mlp_size_2': 0, 'mlp_size_3': 1, 'kernel': 'Logistic', 'loss_name': 'CensoredNLLLoss'}. Best is trial 656 with value: 0.7038239344068009.[0m
[32m[I 2022-04-23 02:52:45,910][0m Trial 747 finished with value: 0.6792655137930046 and parameters: {'n_hidden': 128, 'mixture_components': 6, 'use_sparse_layer': False, 'use_batchnorm': False, 'use_dropout': False, 'mlp_size_1': 4, 'mlp_size_2': 0, 'mlp_size_3': 0, 'kernel': 'Gumbel', 'loss_name': 'AlternativeNLLLoss'}. Best is trial 656 with value: 0.7038239344068009.[0m
[32m[I 2022-04-23 02:53:29,865][0m Trial 748 finished with value: 0.689563180657132 and parameters: {'n_hidden': 1024, 'mixture_components': 8, 'use_sparse_layer': False, 'use_batchnorm': False, 'use_dropout': False, 'mlp_size_1': 6, 'mlp_size_2': 0, 'mlp_size_3': 1, 'kernel': 'Logistic', 'loss_name': 'AlternativeNLLLoss'}. Best is trial 656 with value: 0.7038239344068009.[0m
[32m[I 2022-04-23 02:54:19,225][0m Trial 749 finished with value: 0.6852286821470599 and parameters: {'n_hidden': 1024, 'mixture_components': 8, 'use_sparse_layer': False, 'use_batchnorm': False, 'use_dropout': False, 'mlp_size_1': 7, 'mlp_size_2': 0, 'mlp_size_3': 0, 'kernel': 'Logistic', 'loss_name': 'AlternativeNLLLoss'}. Best is trial 656 with value: 0.7038239344068009.[0m
[32m[I 2022-04-23 02:55:14,619][0m Trial 750 finished with value: 0.684543258641233 and parameters: {'n_hidden': 64, 'mixture_components': 5, 'use_sparse_layer': False, 'use_batchnorm': False, 'use_dropout': False, 'mlp_size_1': 3, 'mlp_size_2': 0, 'mlp_size_3': 0, 'kernel': 'Gumbel', 'loss_name': 'NLLLoss'}. Best is trial 656 with value: 0.7038239344068009.[0m
[32m[I 2022-04-23 02:56:01,470][0m Trial 751 finished with value: 0.6427147009296411 and parameters: {'n_hidden': 1024, 'mixture_components': 10, 'use_sparse_layer': False, 'use_batchnorm': False, 'use_dropout': False, 'mlp_size_1': 6, 'mlp_size_2': 0, 'mlp_size_3': 1, 'kernel': 'Logistic', 'loss_name': 'NLLLoss'}. Best is trial 656 with value: 0.7038239344068009.[0m
[32m[I 2022-04-23 02:56:48,692][0m Trial 752 finished with value: 0.6879970349270824 and parameters: {'n_hidden': 1024, 'mixture_components': 8, 'use_sparse_layer': False, 'use_batchnorm': False, 'use_dropout': False, 'mlp_size_1': 6, 'mlp_size_2': 0, 'mlp_size_3': 1, 'kernel': 'Logistic', 'loss_name': 'AlternativeNLLLoss'}. Best is trial 656 with value: 0.7038239344068009.[0m
[32m[I 2022-04-23 02:57:31,115][0m Trial 753 finished with value: 0.685682869773434 and parameters: {'n_hidden': 2048, 'mixture_components': 8, 'use_sparse_layer': False, 'use_batchnorm': False, 'use_dropout': False, 'mlp_size_1': 7, 'mlp_size_2': 0, 'mlp_size_3': 1, 'kernel': 'Exponential', 'loss_name': 'NLLLoss'}. Best is trial 656 with value: 0.7038239344068009.[0m
[32m[I 2022-04-23 02:58:23,165][0m Trial 754 finished with value: 0.6761856738827012 and parameters: {'n_hidden': 1024, 'mixture_components': 6, 'use_sparse_layer': False, 'use_batchnorm': False, 'use_dropout': False, 'mlp_size_1': 6, 'mlp_size_2': 0, 'mlp_size_3': 1, 'kernel': 'Gumbel', 'loss_name': 'AlternativeNLLLoss'}. Best is trial 656 with value: 0.7038239344068009.[0m
[32m[I 2022-04-23 02:59:02,916][0m Trial 755 finished with value: 0.39407039338369615 and parameters: {'n_hidden': 1024, 'mixture_components': 7, 'use_sparse_layer': True, 'use_sparse_loss': True, 'lmbd': 3.2514540252710083e-06, 'use_batchnorm': False, 'use_dropout': True, 'dropout': 0.9252984904926882, 'mlp_size_1': 6, 'mlp_size_2': 0, 'mlp_size_3': 1, 'kernel': 'Logistic', 'loss_name': 'NLLLoss'}. Best is trial 656 with value: 0.7038239344068009.[0m
[32m[I 2022-04-23 02:59:59,184][0m Trial 756 finished with value: 0.6728238251788687 and parameters: {'n_hidden': 256, 'mixture_components': 8, 'use_sparse_layer': False, 'use_batchnorm': False, 'use_dropout': False, 'mlp_size_1': 5, 'mlp_size_2': 0, 'mlp_size_3': 0, 'kernel': 'Normal', 'loss_name': 'NLLLoss'}. Best is trial 656 with value: 0.7038239344068009.[0m
[32m[I 2022-04-23 03:00:55,571][0m Trial 757 finished with value: 0.6837316019805009 and parameters: {'n_hidden': 1024, 'mixture_components': 7, 'use_sparse_layer': False, 'use_batchnorm': False, 'use_dropout': False, 'mlp_size_1': 6, 'mlp_size_2': 0, 'mlp_size_3': 1, 'kernel': 'Logistic', 'loss_name': 'AlternativeNLLLoss'}. Best is trial 656 with value: 0.7038239344068009.[0m
[32m[I 2022-04-23 03:01:54,628][0m Trial 758 finished with value: 0.6928171356432674 and parameters: {'n_hidden': 1024, 'mixture_components': 1, 'use_sparse_layer': False, 'use_batchnorm': False, 'use_dropout': False, 'mlp_size_1': 6, 'mlp_size_2': 0, 'mlp_size_3': 1, 'kernel': 'Gumbel', 'loss_name': 'NLLLoss'}. Best is trial 656 with value: 0.7038239344068009.[0m
[32m[I 2022-04-23 03:03:13,874][0m Trial 759 finished with value: 0.6340469575472653 and parameters: {'n_hidden': 1024, 'mixture_components': 6, 'use_sparse_layer': False, 'use_batchnorm': True, 'use_dropout': False, 'mlp_size_1': 7, 'mlp_size_2': 0, 'mlp_size_3': 0, 'kernel': 'Normal', 'loss_name': 'NLLLoss'}. Best is trial 656 with value: 0.7038239344068009.[0m
[32m[I 2022-04-23 03:04:00,901][0m Trial 760 finished with value: 0.6954917776408592 and parameters: {'n_hidden': 1024, 'mixture_components': 8, 'use_sparse_layer': False, 'use_batchnorm': False, 'use_dropout': False, 'mlp_size_1': 6, 'mlp_size_2': 0, 'mlp_size_3': 1, 'kernel': 'Logistic', 'loss_name': 'AlternativeNLLLoss'}. Best is trial 656 with value: 0.7038239344068009.[0m
[32m[I 2022-04-23 03:04:55,658][0m Trial 761 finished with value: 0.7068620691332198 and parameters: {'n_hidden': 1024, 'mixture_components': 8, 'use_sparse_layer': False, 'use_batchnorm': False, 'use_dropout': False, 'mlp_size_1': 6, 'mlp_size_2': 0, 'mlp_size_3': 1, 'kernel': 'Logistic', 'loss_name': 'AlternativeNLLLoss'}. Best is trial 761 with value: 0.7068620691332198.[0m
[32m[I 2022-04-23 03:06:08,787][0m Trial 762 finished with value: 0.6837796581230168 and parameters: {'n_hidden': 1024, 'mixture_components': 8, 'use_sparse_layer': False, 'use_batchnorm': False, 'use_dropout': False, 'mlp_size_1': 6, 'mlp_size_2': 0, 'mlp_size_3': 1, 'kernel': 'Logistic', 'loss_name': 'AlternativeNLLLoss'}. Best is trial 761 with value: 0.7068620691332198.[0m
[32m[I 2022-04-23 03:07:12,250][0m Trial 763 finished with value: 0.6845967549965905 and parameters: {'n_hidden': 512, 'mixture_components': 8, 'use_sparse_layer': False, 'use_batchnorm': False, 'use_dropout': False, 'mlp_size_1': 6, 'mlp_size_2': 0, 'mlp_size_3': 0, 'kernel': 'Logistic', 'loss_name': 'AlternativeNLLLoss'}. Best is trial 761 with value: 0.7068620691332198.[0m
[32m[I 2022-04-23 03:08:04,095][0m Trial 764 finished with value: 0.6818218593947274 and parameters: {'n_hidden': 1024, 'mixture_components': 8, 'use_sparse_layer': False, 'use_batchnorm': False, 'use_dropout': False, 'mlp_size_1': 6, 'mlp_size_2': 0, 'mlp_size_3': 1, 'kernel': 'Logistic', 'loss_name': 'AlternativeNLLLoss'}. Best is trial 761 with value: 0.7068620691332198.[0m
[32m[I 2022-04-23 03:08:52,738][0m Trial 765 finished with value: 0.6900798427871083 and parameters: {'n_hidden': 1024, 'mixture_components': 8, 'use_sparse_layer': False, 'use_batchnorm': False, 'use_dropout': False, 'mlp_size_1': 6, 'mlp_size_2': 0, 'mlp_size_3': 1, 'kernel': 'Logistic', 'loss_name': 'AlternativeNLLLoss'}. Best is trial 761 with value: 0.7068620691332198.[0m
[32m[I 2022-04-23 03:09:56,818][0m Trial 766 finished with value: 0.6821697012019369 and parameters: {'n_hidden': 1024, 'mixture_components': 8, 'use_sparse_layer': False, 'use_batchnorm': False, 'use_dropout': False, 'mlp_size_1': 7, 'mlp_size_2': 0, 'mlp_size_3': 0, 'kernel': 'Logistic', 'loss_name': 'AlternativeNLLLoss'}. Best is trial 761 with value: 0.7068620691332198.[0m
[32m[I 2022-04-23 03:11:35,729][0m Trial 767 finished with value: 0.6479136714861007 and parameters: {'n_hidden': 2048, 'mixture_components': 8, 'use_sparse_layer': True, 'use_sparse_loss': True, 'lmbd': 0.0009712755675009459, 'use_batchnorm': False, 'use_dropout': False, 'mlp_size_1': 8, 'mlp_size_2': 0, 'mlp_size_3': 0, 'kernel': 'Logistic', 'loss_name': 'AlternativeNLLLoss'}. Best is trial 761 with value: 0.7068620691332198.[0m
[32m[I 2022-04-23 03:12:28,488][0m Trial 768 finished with value: 0.6969569544415635 and parameters: {'n_hidden': 1024, 'mixture_components': 8, 'use_sparse_layer': False, 'use_batchnorm': False, 'use_dropout': False, 'mlp_size_1': 6, 'mlp_size_2': 0, 'mlp_size_3': 1, 'kernel': 'Logistic', 'loss_name': 'AlternativeNLLLoss'}. Best is trial 761 with value: 0.7068620691332198.[0m
[32m[I 2022-04-23 03:13:43,415][0m Trial 769 finished with value: 0.6666731637029604 and parameters: {'n_hidden': 32, 'mixture_components': 8, 'use_sparse_layer': False, 'use_batchnorm': False, 'use_dropout': False, 'mlp_size_1': 2, 'mlp_size_2': 0, 'mlp_size_3': 0, 'kernel': 'Logistic', 'loss_name': 'AlternativeNLLLoss'}. Best is trial 761 with value: 0.7068620691332198.[0m
[32m[I 2022-04-23 03:14:37,065][0m Trial 770 finished with value: 0.6790844201296558 and parameters: {'n_hidden': 1024, 'mixture_components': 8, 'use_sparse_layer': False, 'use_batchnorm': False, 'use_dropout': False, 'mlp_size_1': 6, 'mlp_size_2': 0, 'mlp_size_3': 1, 'kernel': 'Logistic', 'loss_name': 'AlternativeNLLLoss'}. Best is trial 761 with value: 0.7068620691332198.[0m
[32m[I 2022-04-23 03:15:30,997][0m Trial 771 finished with value: 0.6801454356731211 and parameters: {'n_hidden': 1024, 'mixture_components': 8, 'use_sparse_layer': False, 'use_batchnorm': False, 'use_dropout': False, 'mlp_size_1': 6, 'mlp_size_2': 0, 'mlp_size_3': 1, 'kernel': 'Logistic', 'loss_name': 'AlternativeNLLLoss'}. Best is trial 761 with value: 0.7068620691332198.[0m
[32m[I 2022-04-23 03:16:25,154][0m Trial 772 finished with value: 0.6900476210724269 and parameters: {'n_hidden': 1024, 'mixture_components': 8, 'use_sparse_layer': False, 'use_batchnorm': False, 'use_dropout': False, 'mlp_size_1': 6, 'mlp_size_2': 0, 'mlp_size_3': 1, 'kernel': 'Logistic', 'loss_name': 'AlternativeNLLLoss'}. Best is trial 761 with value: 0.7068620691332198.[0m
[32m[I 2022-04-23 03:17:04,344][0m Trial 773 finished with value: 0.6728187965711601 and parameters: {'n_hidden': 1024, 'mixture_components': 8, 'use_sparse_layer': False, 'use_batchnorm': False, 'use_dropout': False, 'mlp_size_1': 0, 'mlp_size_2': 7, 'mlp_size_3': 0, 'kernel': 'Logistic', 'loss_name': 'AlternativeNLLLoss'}. Best is trial 761 with value: 0.7068620691332198.[0m
[32m[I 2022-04-23 03:17:54,442][0m Trial 774 finished with value: 0.6777652233904858 and parameters: {'n_hidden': 1024, 'mixture_components': 8, 'use_sparse_layer': False, 'use_batchnorm': False, 'use_dropout': False, 'mlp_size_1': 6, 'mlp_size_2': 0, 'mlp_size_3': 1, 'kernel': 'Logistic', 'loss_name': 'AlternativeNLLLoss'}. Best is trial 761 with value: 0.7068620691332198.[0m
[32m[I 2022-04-23 03:18:55,818][0m Trial 775 finished with value: 0.6871805517799714 and parameters: {'n_hidden': 1024, 'mixture_components': 8, 'use_sparse_layer': False, 'use_batchnorm': False, 'use_dropout': False, 'mlp_size_1': 6, 'mlp_size_2': 0, 'mlp_size_3': 1, 'kernel': 'Logistic', 'loss_name': 'AlternativeNLLLoss'}. Best is trial 761 with value: 0.7068620691332198.[0m
[32m[I 2022-04-23 03:19:49,731][0m Trial 776 finished with value: 0.6798396328850302 and parameters: {'n_hidden': 1024, 'mixture_components': 8, 'use_sparse_layer': False, 'use_batchnorm': False, 'use_dropout': False, 'mlp_size_1': 7, 'mlp_size_2': 0, 'mlp_size_3': 0, 'kernel': 'Logistic', 'loss_name': 'AlternativeNLLLoss'}. Best is trial 761 with value: 0.7068620691332198.[0m
[32m[I 2022-04-23 03:20:39,370][0m Trial 777 finished with value: 0.679606722064713 and parameters: {'n_hidden': 1024, 'mixture_components': 8, 'use_sparse_layer': False, 'use_batchnorm': False, 'use_dropout': True, 'dropout': 0.6591554931207801, 'mlp_size_1': 6, 'mlp_size_2': 0, 'mlp_size_3': 1, 'kernel': 'Logistic', 'loss_name': 'AlternativeNLLLoss'}. Best is trial 761 with value: 0.7068620691332198.[0m
[32m[I 2022-04-23 03:21:35,965][0m Trial 778 finished with value: 0.685224686052124 and parameters: {'n_hidden': 128, 'mixture_components': 8, 'use_sparse_layer': False, 'use_batchnorm': False, 'use_dropout': False, 'mlp_size_1': 4, 'mlp_size_2': 0, 'mlp_size_3': 0, 'kernel': 'Logistic', 'loss_name': 'AlternativeNLLLoss'}. Best is trial 761 with value: 0.7068620691332198.[0m
[32m[I 2022-04-23 03:22:25,826][0m Trial 779 finished with value: 0.6760908612018472 and parameters: {'n_hidden': 512, 'mixture_components': 8, 'use_sparse_layer': True, 'use_sparse_loss': False, 'use_batchnorm': False, 'use_dropout': False, 'mlp_size_1': 6, 'mlp_size_2': 0, 'mlp_size_3': 0, 'kernel': 'Logistic', 'loss_name': 'AlternativeNLLLoss'}. Best is trial 761 with value: 0.7068620691332198.[0m
[32m[I 2022-04-23 03:24:02,425][0m Trial 780 finished with value: 0.6848907391297983 and parameters: {'n_hidden': 1024, 'mixture_components': 8, 'use_sparse_layer': False, 'use_batchnorm': True, 'use_dropout': False, 'mlp_size_1': 6, 'mlp_size_2': 0, 'mlp_size_3': 1, 'kernel': 'Logistic', 'loss_name': 'AlternativeNLLLoss'}. Best is trial 761 with value: 0.7068620691332198.[0m
[32m[I 2022-04-23 03:24:52,180][0m Trial 781 finished with value: 0.68138659346333 and parameters: {'n_hidden': 1024, 'mixture_components': 8, 'use_sparse_layer': False, 'use_batchnorm': False, 'use_dropout': False, 'mlp_size_1': 6, 'mlp_size_2': 0, 'mlp_size_3': 1, 'kernel': 'Logistic', 'loss_name': 'AlternativeNLLLoss'}. Best is trial 761 with value: 0.7068620691332198.[0m
[32m[I 2022-04-23 03:25:41,660][0m Trial 782 finished with value: 0.6754340101658867 and parameters: {'n_hidden': 64, 'mixture_components': 8, 'use_sparse_layer': False, 'use_batchnorm': False, 'use_dropout': False, 'mlp_size_1': 3, 'mlp_size_2': 0, 'mlp_size_3': 0, 'kernel': 'Logistic', 'loss_name': 'AlternativeNLLLoss'}. Best is trial 761 with value: 0.7068620691332198.[0m
[32m[I 2022-04-23 03:27:01,854][0m Trial 783 finished with value: 0.6838915175410389 and parameters: {'n_hidden': 1024, 'mixture_components': 9, 'use_sparse_layer': False, 'use_batchnorm': False, 'use_dropout': False, 'mlp_size_1': 7, 'mlp_size_2': 0, 'mlp_size_3': 0, 'kernel': 'Logistic', 'loss_name': 'AlternativeNLLLoss'}. Best is trial 761 with value: 0.7068620691332198.[0m
[32m[I 2022-04-23 03:28:07,737][0m Trial 784 finished with value: 0.6736793548350662 and parameters: {'n_hidden': 2048, 'mixture_components': 8, 'use_sparse_layer': False, 'use_batchnorm': False, 'use_dropout': False, 'mlp_size_1': 8, 'mlp_size_2': 0, 'mlp_size_3': 0, 'kernel': 'Logistic', 'loss_name': 'AlternativeNLLLoss'}. Best is trial 761 with value: 0.7068620691332198.[0m
[32m[I 2022-04-23 03:28:54,483][0m Trial 785 finished with value: 0.6746408008285691 and parameters: {'n_hidden': 1024, 'mixture_components': 8, 'use_sparse_layer': False, 'use_batchnorm': False, 'use_dropout': False, 'mlp_size_1': 6, 'mlp_size_2': 0, 'mlp_size_3': 1, 'kernel': 'Logistic', 'loss_name': 'AlternativeNLLLoss'}. Best is trial 761 with value: 0.7068620691332198.[0m
[32m[I 2022-04-23 03:29:55,250][0m Trial 786 finished with value: 0.6865315769427517 and parameters: {'n_hidden': 1024, 'mixture_components': 8, 'use_sparse_layer': False, 'use_batchnorm': False, 'use_dropout': False, 'mlp_size_1': 6, 'mlp_size_2': 0, 'mlp_size_3': 1, 'kernel': 'Logistic', 'loss_name': 'AlternativeNLLLoss'}. Best is trial 761 with value: 0.7068620691332198.[0m
[32m[I 2022-04-23 03:31:04,000][0m Trial 787 finished with value: 0.691326503011297 and parameters: {'n_hidden': 256, 'mixture_components': 9, 'use_sparse_layer': False, 'use_batchnorm': False, 'use_dropout': False, 'mlp_size_1': 5, 'mlp_size_2': 0, 'mlp_size_3': 0, 'kernel': 'Logistic', 'loss_name': 'AlternativeNLLLoss'}. Best is trial 761 with value: 0.7068620691332198.[0m
[32m[I 2022-04-23 03:31:46,691][0m Trial 788 finished with value: 0.6790276615441654 and parameters: {'n_hidden': 1024, 'mixture_components': 8, 'use_sparse_layer': False, 'use_batchnorm': False, 'use_dropout': False, 'mlp_size_1': 6, 'mlp_size_2': 0, 'mlp_size_3': 1, 'kernel': 'Gumbel', 'loss_name': 'AlternativeNLLLoss'}. Best is trial 761 with value: 0.7068620691332198.[0m
[32m[I 2022-04-23 03:32:50,332][0m Trial 789 finished with value: 0.6887283766723054 and parameters: {'n_hidden': 1024, 'mixture_components': 8, 'use_sparse_layer': False, 'use_batchnorm': False, 'use_dropout': False, 'mlp_size_1': 6, 'mlp_size_2': 0, 'mlp_size_3': 1, 'kernel': 'Logistic', 'loss_name': 'AlternativeNLLLoss'}. Best is trial 761 with value: 0.7068620691332198.[0m
[32m[I 2022-04-23 03:33:40,388][0m Trial 790 finished with value: 0.6958805614841961 and parameters: {'n_hidden': 1024, 'mixture_components': 8, 'use_sparse_layer': False, 'use_batchnorm': False, 'use_dropout': False, 'mlp_size_1': 6, 'mlp_size_2': 0, 'mlp_size_3': 1, 'kernel': 'Logistic', 'loss_name': 'CensoredNLLLoss'}. Best is trial 761 with value: 0.7068620691332198.[0m
