[32m[I 2022-04-21 16:53:15,413][0m Trial 428 finished with value: 0.8355898383003153 and parameters: {'alpha': 3.922504826212436, 'ties': 'breslow'}. Best is trial 70 with value: 0.835911286090736.[0m
[32m[I 2022-04-21 16:53:45,183][0m Trial 429 finished with value: 0.835519622180555 and parameters: {'alpha': 3.6012137840845124, 'ties': 'breslow'}. Best is trial 70 with value: 0.835911286090736.[0m
[32m[I 2022-04-21 16:54:16,368][0m Trial 430 finished with value: 0.8357190747858569 and parameters: {'alpha': 3.726042206047036, 'ties': 'breslow'}. Best is trial 70 with value: 0.835911286090736.[0m
[32m[I 2022-04-21 16:54:49,279][0m Trial 431 finished with value: 0.8353628700474047 and parameters: {'alpha': 4.075231706414179, 'ties': 'breslow'}. Best is trial 70 with value: 0.835911286090736.[0m
[32m[I 2022-04-21 16:55:21,328][0m Trial 432 finished with value: 0.8356715428291757 and parameters: {'alpha': 3.8184946141801475, 'ties': 'breslow'}. Best is trial 70 with value: 0.835911286090736.[0m
[32m[I 2022-04-21 16:55:53,938][0m Trial 433 finished with value: 0.8351729822908422 and parameters: {'alpha': 3.982188427137055, 'ties': 'breslow'}. Best is trial 70 with value: 0.835911286090736.[0m
[32m[I 2022-04-21 16:56:40,912][0m Trial 434 finished with value: 0.8332176087598603 and parameters: {'alpha': 1.7046422330778852, 'ties': 'breslow'}. Best is trial 70 with value: 0.835911286090736.[0m
[32m[I 2022-04-21 16:57:11,599][0m Trial 435 finished with value: 0.8355454473484436 and parameters: {'alpha': 3.451836283684394, 'ties': 'breslow'}. Best is trial 70 with value: 0.835911286090736.[0m
[32m[I 2022-04-21 16:57:42,644][0m Trial 436 finished with value: 0.8355175853441505 and parameters: {'alpha': 3.677075049009922, 'ties': 'breslow'}. Best is trial 70 with value: 0.835911286090736.[0m
[32m[I 2022-04-21 16:58:12,979][0m Trial 437 finished with value: 0.8357052929158193 and parameters: {'alpha': 3.8638254169589095, 'ties': 'breslow'}. Best is trial 70 with value: 0.835911286090736.[0m
[32m[I 2022-04-21 16:58:44,942][0m Trial 438 finished with value: 0.8357152446261769 and parameters: {'alpha': 3.6170164199975243, 'ties': 'efron'}. Best is trial 70 with value: 0.835911286090736.[0m
[32m[I 2022-04-21 16:59:19,025][0m Trial 439 finished with value: 0.8350950706800753 and parameters: {'alpha': 2.9016314206281533, 'ties': 'breslow'}. Best is trial 70 with value: 0.835911286090736.[0m
[32m[I 2022-04-21 16:59:52,233][0m Trial 440 finished with value: 0.8356281582736811 and parameters: {'alpha': 3.9079749381703044, 'ties': 'breslow'}. Best is trial 70 with value: 0.835911286090736.[0m
[32m[I 2022-04-21 17:00:21,144][0m Trial 441 finished with value: 0.8357176343280059 and parameters: {'alpha': 3.749970898818416, 'ties': 'breslow'}. Best is trial 70 with value: 0.835911286090736.[0m
[32m[I 2022-04-21 17:00:50,364][0m Trial 442 finished with value: 0.835558008307433 and parameters: {'alpha': 3.5352567803475208, 'ties': 'breslow'}. Best is trial 70 with value: 0.835911286090736.[0m
[32m[I 2022-04-21 17:01:29,782][0m Trial 443 finished with value: 0.8341623708529241 and parameters: {'alpha': 0.7088980185421827, 'ties': 'breslow'}. Best is trial 70 with value: 0.835911286090736.[0m
[32m[I 2022-04-21 17:01:59,130][0m Trial 444 finished with value: 0.8356785640696703 and parameters: {'alpha': 3.7492762543847418, 'ties': 'breslow'}. Best is trial 70 with value: 0.835911286090736.[0m
[32m[I 2022-04-21 17:02:29,550][0m Trial 445 finished with value: 0.8351602176202985 and parameters: {'alpha': 3.3394041344457612, 'ties': 'breslow'}. Best is trial 70 with value: 0.835911286090736.[0m
[32m[I 2022-04-21 17:02:59,360][0m Trial 446 finished with value: 0.8353262556444102 and parameters: {'alpha': 4.027071336388863, 'ties': 'breslow'}. Best is trial 70 with value: 0.835911286090736.[0m
[32m[I 2022-04-21 17:03:28,606][0m Trial 447 finished with value: 0.8357052929158193 and parameters: {'alpha': 3.867239431495862, 'ties': 'breslow'}. Best is trial 70 with value: 0.835911286090736.[0m
[32m[I 2022-04-21 17:04:00,112][0m Trial 448 finished with value: 0.8352388263720453 and parameters: {'alpha': 3.1439260192133456, 'ties': 'breslow'}. Best is trial 70 with value: 0.835911286090736.[0m
[32m[I 2022-04-21 17:04:30,107][0m Trial 449 finished with value: 0.8355175853441505 and parameters: {'alpha': 3.6708144864347005, 'ties': 'breslow'}. Best is trial 70 with value: 0.835911286090736.[0m
[32m[I 2022-04-21 17:05:07,945][0m Trial 450 finished with value: 0.8333859079381456 and parameters: {'alpha': 1.495361423817659, 'ties': 'breslow'}. Best is trial 70 with value: 0.835911286090736.[0m
[32m[I 2022-04-21 17:05:36,029][0m Trial 451 finished with value: 0.8357914144599559 and parameters: {'alpha': 3.795587872458329, 'ties': 'breslow'}. Best is trial 70 with value: 0.835911286090736.[0m
[32m[I 2022-04-21 17:06:05,715][0m Trial 452 finished with value: 0.8354804857687071 and parameters: {'alpha': 3.626016725968997, 'ties': 'breslow'}. Best is trial 70 with value: 0.835911286090736.[0m
[32m[I 2022-04-21 17:06:35,402][0m Trial 453 finished with value: 0.8354049296341829 and parameters: {'alpha': 3.959112789235241, 'ties': 'breslow'}. Best is trial 70 with value: 0.835911286090736.[0m
[32m[I 2022-04-21 17:07:05,011][0m Trial 454 finished with value: 0.8357567045863414 and parameters: {'alpha': 3.7587276863582604, 'ties': 'breslow'}. Best is trial 70 with value: 0.835911286090736.[0m
[32m[I 2022-04-21 17:07:38,486][0m Trial 455 finished with value: 0.8342052529938071 and parameters: {'alpha': 2.2519416252785547, 'ties': 'breslow'}. Best is trial 70 with value: 0.835911286090736.[0m
[32m[I 2022-04-21 17:08:08,059][0m Trial 456 finished with value: 0.8357052929158193 and parameters: {'alpha': 3.8579400596356543, 'ties': 'breslow'}. Best is trial 70 with value: 0.835911286090736.[0m
[32m[I 2022-04-21 17:08:39,158][0m Trial 457 finished with value: 0.8355186067830648 and parameters: {'alpha': 3.521955919771025, 'ties': 'efron'}. Best is trial 70 with value: 0.835911286090736.[0m
[32m[I 2022-04-21 17:09:09,328][0m Trial 458 finished with value: 0.8352016712684709 and parameters: {'alpha': 4.146521754112804, 'ties': 'breslow'}. Best is trial 70 with value: 0.835911286090736.[0m
[32m[I 2022-04-21 17:09:41,532][0m Trial 459 finished with value: 0.835598871889044 and parameters: {'alpha': 3.707761415820498, 'ties': 'breslow'}. Best is trial 70 with value: 0.835911286090736.[0m
[32m[I 2022-04-21 17:10:11,734][0m Trial 460 finished with value: 0.8356309209068851 and parameters: {'alpha': 3.833146850530881, 'ties': 'breslow'}. Best is trial 70 with value: 0.835911286090736.[0m
[32m[I 2022-04-21 17:10:40,965][0m Trial 461 finished with value: 0.8354787801983354 and parameters: {'alpha': 3.6442987542142706, 'ties': 'breslow'}. Best is trial 70 with value: 0.835911286090736.[0m
[32m[I 2022-04-21 17:11:10,875][0m Trial 462 finished with value: 0.8354826511319169 and parameters: {'alpha': 3.9481326182750065, 'ties': 'breslow'}. Best is trial 70 with value: 0.835911286090736.[0m
[32m[I 2022-04-21 17:11:39,976][0m Trial 463 finished with value: 0.8351506586977953 and parameters: {'alpha': 4.315071354794803, 'ties': 'breslow'}. Best is trial 70 with value: 0.835911286090736.[0m
[32m[I 2022-04-21 17:12:10,926][0m Trial 464 finished with value: 0.8357123186578829 and parameters: {'alpha': 3.8132952758496383, 'ties': 'breslow'}. Best is trial 70 with value: 0.835911286090736.[0m
[32m[I 2022-04-21 17:12:40,228][0m Trial 465 finished with value: 0.8353262556444102 and parameters: {'alpha': 4.029003459482823, 'ties': 'breslow'}. Best is trial 70 with value: 0.835911286090736.[0m
[32m[I 2022-04-21 17:13:10,558][0m Trial 466 finished with value: 0.835519622180555 and parameters: {'alpha': 3.6085685803595386, 'ties': 'breslow'}. Best is trial 70 with value: 0.835911286090736.[0m
[32m[I 2022-04-21 17:13:41,696][0m Trial 467 finished with value: 0.8357190747858569 and parameters: {'alpha': 3.720861907216058, 'ties': 'breslow'}. Best is trial 70 with value: 0.835911286090736.[0m
[32m[I 2022-04-21 17:14:11,651][0m Trial 468 finished with value: 0.835588281099821 and parameters: {'alpha': 3.836890966012312, 'ties': 'breslow'}. Best is trial 70 with value: 0.835911286090736.[0m
[32m[I 2022-04-21 17:14:40,960][0m Trial 469 finished with value: 0.8357190747858569 and parameters: {'alpha': 3.720762825471389, 'ties': 'breslow'}. Best is trial 70 with value: 0.835911286090736.[0m
[32m[I 2022-04-21 17:15:11,132][0m Trial 470 finished with value: 0.8355063770901081 and parameters: {'alpha': 3.4395696482832796, 'ties': 'breslow'}. Best is trial 70 with value: 0.835911286090736.[0m
[32m[I 2022-04-21 17:15:40,507][0m Trial 471 finished with value: 0.8356689341023882 and parameters: {'alpha': 3.8845839558263036, 'ties': 'breslow'}. Best is trial 70 with value: 0.835911286090736.[0m
[32m[I 2022-04-21 17:16:10,751][0m Trial 472 finished with value: 0.8357567045863414 and parameters: {'alpha': 3.7592747338738497, 'ties': 'breslow'}. Best is trial 70 with value: 0.835911286090736.[0m
[32m[I 2022-04-21 17:16:42,411][0m Trial 473 finished with value: 0.8354805519222193 and parameters: {'alpha': 3.5745482263445116, 'ties': 'breslow'}. Best is trial 70 with value: 0.835911286090736.[0m
[32m[I 2022-04-21 17:17:12,506][0m Trial 474 finished with value: 0.8355601075171306 and parameters: {'alpha': 3.943595487694483, 'ties': 'breslow'}. Best is trial 70 with value: 0.835911286090736.[0m
[32m[I 2022-04-21 17:17:42,105][0m Trial 475 finished with value: 0.8355583611728576 and parameters: {'alpha': 3.681947422763778, 'ties': 'breslow'}. Best is trial 70 with value: 0.835911286090736.[0m
[32m[I 2022-04-21 17:18:13,518][0m Trial 476 finished with value: 0.8357914144599559 and parameters: {'alpha': 3.792056080337353, 'ties': 'breslow'}. Best is trial 70 with value: 0.835911286090736.[0m
[32m[I 2022-04-21 17:18:43,916][0m Trial 477 finished with value: 0.8353628700474047 and parameters: {'alpha': 4.069790985930467, 'ties': 'breslow'}. Best is trial 70 with value: 0.835911286090736.[0m
[32m[I 2022-04-21 17:19:16,160][0m Trial 478 finished with value: 0.8354708558014249 and parameters: {'alpha': 3.9199085052754734, 'ties': 'efron'}. Best is trial 70 with value: 0.835911286090736.[0m
[32m[I 2022-04-21 17:19:47,500][0m Trial 479 finished with value: 0.8354805519222193 and parameters: {'alpha': 3.586841603572104, 'ties': 'breslow'}. Best is trial 70 with value: 0.835911286090736.[0m
[32m[I 2022-04-21 17:20:19,290][0m Trial 480 finished with value: 0.8354264219312361 and parameters: {'alpha': 3.4890566133305536, 'ties': 'breslow'}. Best is trial 70 with value: 0.835911286090736.[0m
[32m[I 2022-04-21 17:20:52,318][0m Trial 481 finished with value: 0.835598871889044 and parameters: {'alpha': 3.7065067350938885, 'ties': 'breslow'}. Best is trial 70 with value: 0.835911286090736.[0m
[32m[I 2022-04-21 17:21:24,793][0m Trial 482 finished with value: 0.8356661565039716 and parameters: {'alpha': 3.844495122460264, 'ties': 'breslow'}. Best is trial 70 with value: 0.835911286090736.[0m
[32m[I 2022-04-21 17:21:56,901][0m Trial 483 finished with value: 0.8354049296341829 and parameters: {'alpha': 3.9596275566647803, 'ties': 'breslow'}. Best is trial 70 with value: 0.835911286090736.[0m
[32m[I 2022-04-21 17:22:28,974][0m Trial 484 finished with value: 0.835911286090736 and parameters: {'alpha': 3.7750705590071854, 'ties': 'breslow'}. Best is trial 70 with value: 0.835911286090736.[0m
[32m[I 2022-04-21 17:22:59,117][0m Trial 485 finished with value: 0.8358321902886627 and parameters: {'alpha': 3.7808450063235135, 'ties': 'breslow'}. Best is trial 70 with value: 0.835911286090736.[0m
[32m[I 2022-04-21 17:23:30,877][0m Trial 486 finished with value: 0.8352812311180031 and parameters: {'alpha': 4.187532289409185, 'ties': 'breslow'}. Best is trial 70 with value: 0.835911286090736.[0m
[32m[I 2022-04-21 17:24:02,397][0m Trial 487 finished with value: 0.8354787801983354 and parameters: {'alpha': 3.6636119920388666, 'ties': 'breslow'}. Best is trial 70 with value: 0.835911286090736.[0m
[32m[I 2022-04-21 17:24:33,518][0m Trial 488 finished with value: 0.8356281582736811 and parameters: {'alpha': 3.8972958285076267, 'ties': 'breslow'}. Best is trial 70 with value: 0.835911286090736.[0m
[32m[I 2022-04-21 17:25:04,988][0m Trial 489 finished with value: 0.8354787801983354 and parameters: {'alpha': 3.6408207201395126, 'ties': 'breslow'}. Best is trial 70 with value: 0.835911286090736.[0m
[32m[I 2022-04-21 17:25:36,859][0m Trial 490 finished with value: 0.8357123186578829 and parameters: {'alpha': 3.8113085210847673, 'ties': 'breslow'}. Best is trial 70 with value: 0.835911286090736.[0m
[32m[I 2022-04-21 17:26:08,192][0m Trial 491 finished with value: 0.8352486453527801 and parameters: {'alpha': 4.025775241663217, 'ties': 'breslow'}. Best is trial 70 with value: 0.835911286090736.[0m
[32m[I 2022-04-21 17:26:39,219][0m Trial 492 finished with value: 0.835558008307433 and parameters: {'alpha': 3.5495117297759444, 'ties': 'breslow'}. Best is trial 70 with value: 0.835911286090736.[0m
[32m[I 2022-04-21 17:27:10,469][0m Trial 493 finished with value: 0.8357190747858569 and parameters: {'alpha': 3.727121166202341, 'ties': 'breslow'}. Best is trial 70 with value: 0.835911286090736.[0m
[32m[I 2022-04-21 17:27:42,345][0m Trial 494 finished with value: 0.8356689341023882 and parameters: {'alpha': 3.880178735741559, 'ties': 'breslow'}. Best is trial 70 with value: 0.835911286090736.[0m
[32m[I 2022-04-21 17:28:13,400][0m Trial 495 finished with value: 0.8355583611728576 and parameters: {'alpha': 3.692273490016591, 'ties': 'efron'}. Best is trial 70 with value: 0.835911286090736.[0m
[32m[I 2022-04-21 17:28:44,055][0m Trial 496 finished with value: 0.8357914144599559 and parameters: {'alpha': 3.790444291954266, 'ties': 'breslow'}. Best is trial 70 with value: 0.835911286090736.[0m
[32m[I 2022-04-21 17:29:14,569][0m Trial 497 finished with value: 0.8354049296341829 and parameters: {'alpha': 3.9590942843408605, 'ties': 'breslow'}. Best is trial 70 with value: 0.835911286090736.[0m
[32m[I 2022-04-21 17:29:42,453][0m Trial 498 finished with value: 0.8354805519222193 and parameters: {'alpha': 3.583376006196602, 'ties': 'breslow'}. Best is trial 70 with value: 0.835911286090736.[0m
[32m[I 2022-04-21 17:30:13,218][0m Trial 499 finished with value: 0.8357052929158193 and parameters: {'alpha': 3.868560460843231, 'ties': 'breslow'}. Best is trial 70 with value: 0.835911286090736.[0m
[32m[I 2022-04-21 17:30:42,112][0m Trial 500 finished with value: 0.8354787801983354 and parameters: {'alpha': 3.656068208068611, 'ties': 'breslow'}. Best is trial 70 with value: 0.835911286090736.[0m
[32m[I 2022-04-21 17:31:29,598][0m Trial 501 finished with value: 0.8333253166755732 and parameters: {'alpha': 0.27795184204916357, 'ties': 'breslow'}. Best is trial 70 with value: 0.835911286090736.[0m
[32m[I 2022-04-21 17:31:59,414][0m Trial 502 finished with value: 0.8354264219312361 and parameters: {'alpha': 3.4890808975361174, 'ties': 'breslow'}. Best is trial 70 with value: 0.835911286090736.[0m
[32m[I 2022-04-21 17:32:29,404][0m Trial 503 finished with value: 0.835911286090736 and parameters: {'alpha': 3.7723257016530147, 'ties': 'breslow'}. Best is trial 70 with value: 0.835911286090736.[0m
[32m[I 2022-04-21 17:33:00,465][0m Trial 504 finished with value: 0.8352419619247285 and parameters: {'alpha': 4.111082131640602, 'ties': 'breslow'}. Best is trial 70 with value: 0.835911286090736.[0m
[32m[I 2022-04-21 17:33:31,757][0m Trial 505 finished with value: 0.8355018627989705 and parameters: {'alpha': 3.3779601527920633, 'ties': 'breslow'}. Best is trial 70 with value: 0.835911286090736.[0m
[32m[I 2022-04-21 17:34:03,088][0m Trial 506 finished with value: 0.8358321902886627 and parameters: {'alpha': 3.785108451610285, 'ties': 'breslow'}. Best is trial 70 with value: 0.835911286090736.[0m
[32m[I 2022-04-21 17:34:33,706][0m Trial 507 finished with value: 0.8352095089409325 and parameters: {'alpha': 4.011037773493969, 'ties': 'breslow'}. Best is trial 70 with value: 0.835911286090736.[0m
[32m[I 2022-04-21 17:35:04,954][0m Trial 508 finished with value: 0.8356281582736811 and parameters: {'alpha': 3.8905465972866304, 'ties': 'breslow'}. Best is trial 70 with value: 0.835911286090736.[0m
[32m[I 2022-04-21 17:35:35,520][0m Trial 509 finished with value: 0.8357190747858569 and parameters: {'alpha': 3.719111091547417, 'ties': 'breslow'}. Best is trial 70 with value: 0.835911286090736.[0m
[32m[I 2022-04-21 17:36:08,202][0m Trial 510 finished with value: 0.835519290914522 and parameters: {'alpha': 3.6166235584763555, 'ties': 'breslow'}. Best is trial 70 with value: 0.835911286090736.[0m
[32m[I 2022-04-21 17:36:41,948][0m Trial 511 finished with value: 0.835588281099821 and parameters: {'alpha': 3.8382620842002377, 'ties': 'breslow'}. Best is trial 70 with value: 0.835911286090736.[0m
[32m[I 2022-04-21 17:37:14,504][0m Trial 512 finished with value: 0.8355601075171306 and parameters: {'alpha': 3.940523489725768, 'ties': 'breslow'}. Best is trial 70 with value: 0.835911286090736.[0m
[32m[I 2022-04-21 17:37:46,752][0m Trial 513 finished with value: 0.8355583611728576 and parameters: {'alpha': 3.688507988840513, 'ties': 'breslow'}. Best is trial 70 with value: 0.835911286090736.[0m
[32m[I 2022-04-21 17:38:27,359][0m Trial 514 finished with value: 0.8328214850836659 and parameters: {'alpha': 1.2397811648367612, 'ties': 'breslow'}. Best is trial 70 with value: 0.835911286090736.[0m
[32m[I 2022-04-21 17:38:59,785][0m Trial 515 finished with value: 0.835631502225942 and parameters: {'alpha': 3.7745554123780276, 'ties': 'efron'}. Best is trial 70 with value: 0.835911286090736.[0m
[32m[I 2022-04-21 17:39:31,026][0m Trial 516 finished with value: 0.8348417213403149 and parameters: {'alpha': 4.98043329337213, 'ties': 'breslow'}. Best is trial 70 with value: 0.835911286090736.[0m
[32m[I 2022-04-21 17:40:02,845][0m Trial 517 finished with value: 0.8354805519222193 and parameters: {'alpha': 3.5684258877202186, 'ties': 'breslow'}. Best is trial 70 with value: 0.835911286090736.[0m
[32m[I 2022-04-21 17:40:34,354][0m Trial 518 finished with value: 0.8357052929158193 and parameters: {'alpha': 3.86554736148372, 'ties': 'breslow'}. Best is trial 70 with value: 0.835911286090736.[0m
[32m[I 2022-04-21 17:41:09,326][0m Trial 519 finished with value: 0.8348807734533127 and parameters: {'alpha': 2.627229184014677, 'ties': 'breslow'}. Best is trial 70 with value: 0.835911286090736.[0m
[32m[I 2022-04-21 17:41:39,414][0m Trial 520 finished with value: 0.8351708577015339 and parameters: {'alpha': 4.001357729733018, 'ties': 'breslow'}. Best is trial 70 with value: 0.835911286090736.[0m
[32m[I 2022-04-21 17:42:12,452][0m Trial 521 finished with value: 0.8357190747858569 and parameters: {'alpha': 3.7330261705528605, 'ties': 'breslow'}. Best is trial 70 with value: 0.835911286090736.[0m
[32m[I 2022-04-21 17:42:44,899][0m Trial 522 finished with value: 0.8357914144599559 and parameters: {'alpha': 3.796530829264992, 'ties': 'breslow'}. Best is trial 70 with value: 0.835911286090736.[0m
[32m[I 2022-04-21 17:43:17,932][0m Trial 523 finished with value: 0.8354264219312361 and parameters: {'alpha': 3.4845219370634917, 'ties': 'breslow'}. Best is trial 70 with value: 0.835911286090736.[0m
[32m[I 2022-04-21 17:43:50,061][0m Trial 524 finished with value: 0.8354787801983354 and parameters: {'alpha': 3.6355898555414536, 'ties': 'breslow'}. Best is trial 70 with value: 0.835911286090736.[0m
[32m[I 2022-04-21 17:44:32,073][0m Trial 525 finished with value: 0.8337373892064568 and parameters: {'alpha': 1.8582507824355792, 'ties': 'breslow'}. Best is trial 70 with value: 0.835911286090736.[0m
[32m[I 2022-04-21 17:45:03,885][0m Trial 526 finished with value: 0.8356281582736811 and parameters: {'alpha': 3.903292632760903, 'ties': 'breslow'}. Best is trial 70 with value: 0.835911286090736.[0m
[32m[I 2022-04-21 17:45:36,915][0m Trial 527 finished with value: 0.83567829895715 and parameters: {'alpha': 3.7177022131941913, 'ties': 'breslow'}. Best is trial 70 with value: 0.835911286090736.[0m
[32m[I 2022-04-21 17:46:10,606][0m Trial 528 finished with value: 0.8353628700474047 and parameters: {'alpha': 4.0763605841127, 'ties': 'breslow'}. Best is trial 70 with value: 0.835911286090736.[0m
[32m[I 2022-04-21 17:46:43,958][0m Trial 529 finished with value: 0.8356661565039716 and parameters: {'alpha': 3.8428720367393496, 'ties': 'breslow'}. Best is trial 70 with value: 0.835911286090736.[0m
[32m[I 2022-04-21 17:47:17,965][0m Trial 530 finished with value: 0.835519622180555 and parameters: {'alpha': 3.6064379000390696, 'ties': 'breslow'}. Best is trial 70 with value: 0.835911286090736.[0m
[32m[I 2022-04-21 17:47:50,751][0m Trial 531 finished with value: 0.835911286090736 and parameters: {'alpha': 3.771351725885831, 'ties': 'breslow'}. Best is trial 70 with value: 0.835911286090736.[0m
[32m[I 2022-04-21 17:48:23,260][0m Trial 532 finished with value: 0.8356281582736811 and parameters: {'alpha': 3.913657146776184, 'ties': 'breslow'}. Best is trial 70 with value: 0.835911286090736.[0m
[32m[I 2022-04-21 17:48:55,118][0m Trial 533 finished with value: 0.8355583611728576 and parameters: {'alpha': 3.685215160421248, 'ties': 'breslow'}. Best is trial 70 with value: 0.835911286090736.[0m
[32m[I 2022-04-21 17:49:27,996][0m Trial 534 finished with value: 0.835627667564693 and parameters: {'alpha': 3.8136477161605087, 'ties': 'efron'}. Best is trial 70 with value: 0.835911286090736.[0m
