[32m[I 2022-04-21 11:39:46,052][0m Trial 436 finished with value: 0.7026796238595482 and parameters: {'splitter': 'best', 'min_samples_split': 0.46029444223124133, 'min_samples_leaf': 0.001057490190227199, 'min_weight_fraction_leaf': 0.011403641212842241, 'max_features': 0.47375788087649706}. Best is trial 435 with value: 0.8271205444415821.[0m
/media/san2_ssd/data/Workdir/survival/utils.py:305: RuntimeWarning: invalid value encountered in true_divide
  pdfs = np.gradient(1-survs,axis=1)/norms
/media/san2_ssd/data/Workdir/survival/utils.py:305: RuntimeWarning: invalid value encountered in true_divide
  pdfs = np.gradient(1-survs,axis=1)/norms
/media/san2_ssd/data/Workdir/survival/utils.py:305: RuntimeWarning: invalid value encountered in true_divide
  pdfs = np.gradient(1-survs,axis=1)/norms
[32m[I 2022-04-21 11:39:46,726][0m Trial 437 finished with value: 0.8205248720595542 and parameters: {'splitter': 'best', 'min_samples_split': 0.119291129613613, 'min_samples_leaf': 0.001024418408010687, 'min_weight_fraction_leaf': 0.009836414276988132, 'max_features': 0.44895532725660536}. Best is trial 435 with value: 0.8271205444415821.[0m
/media/san2_ssd/data/Workdir/survival/utils.py:305: RuntimeWarning: invalid value encountered in true_divide
  pdfs = np.gradient(1-survs,axis=1)/norms
/media/san2_ssd/data/Workdir/survival/utils.py:305: RuntimeWarning: invalid value encountered in true_divide
  pdfs = np.gradient(1-survs,axis=1)/norms
[32m[I 2022-04-21 11:39:47,952][0m Trial 438 finished with value: 0.8149279007824219 and parameters: {'splitter': 'best', 'min_samples_split': 0.11595759168058387, 'min_samples_leaf': 0.0014591843854438553, 'min_weight_fraction_leaf': 2.4460225450727985e-05, 'max_features': 0.4907366735242717}. Best is trial 435 with value: 0.8271205444415821.[0m
/media/san2_ssd/data/Workdir/survival/utils.py:305: RuntimeWarning: invalid value encountered in true_divide
  pdfs = np.gradient(1-survs,axis=1)/norms
/media/san2_ssd/data/Workdir/survival/utils.py:305: RuntimeWarning: invalid value encountered in true_divide
  pdfs = np.gradient(1-survs,axis=1)/norms
/media/san2_ssd/data/Workdir/survival/utils.py:305: RuntimeWarning: invalid value encountered in true_divide
  pdfs = np.gradient(1-survs,axis=1)/norms
/media/san2_ssd/data/Workdir/survival/utils.py:305: RuntimeWarning: invalid value encountered in true_divide
  pdfs = np.gradient(1-survs,axis=1)/norms
/media/san2_ssd/data/Workdir/survival/utils.py:305: RuntimeWarning: invalid value encountered in true_divide
  pdfs = np.gradient(1-survs,axis=1)/norms
[32m[I 2022-04-21 11:39:48,679][0m Trial 439 finished with value: 0.8150653610453592 and parameters: {'splitter': 'best', 'min_samples_split': 0.05960468735242795, 'min_samples_leaf': 0.009108203323563466, 'min_weight_fraction_leaf': 0.00889709543452525, 'max_features': 0.4439607665095147}. Best is trial 435 with value: 0.8271205444415821.[0m
/media/san2_ssd/data/Workdir/survival/utils.py:305: RuntimeWarning: invalid value encountered in true_divide
  pdfs = np.gradient(1-survs,axis=1)/norms
[32m[I 2022-04-21 11:39:49,097][0m Trial 440 finished with value: 0.8047048622401963 and parameters: {'splitter': 'best', 'min_samples_split': 0.09511123725686291, 'min_samples_leaf': 0.013349152967403102, 'min_weight_fraction_leaf': 0.008669909726451827, 'max_features': 0.46120298008753857}. Best is trial 435 with value: 0.8271205444415821.[0m
[32m[I 2022-04-21 11:39:49,360][0m Trial 441 finished with value: 0.46991866821558936 and parameters: {'splitter': 'best', 'min_samples_split': 0.13477464384011362, 'min_samples_leaf': 0.010925781982242625, 'min_weight_fraction_leaf': 0.42042273598610336, 'max_features': 0.4447438770997785}. Best is trial 435 with value: 0.8271205444415821.[0m
[32m[I 2022-04-21 11:39:50,085][0m Trial 442 finished with value: 0.7015060565598639 and parameters: {'splitter': 'best', 'min_samples_split': 0.430845132756298, 'min_samples_leaf': 0.001007824736924576, 'min_weight_fraction_leaf': 0.0180149581565384, 'max_features': 0.4796123353415397}. Best is trial 435 with value: 0.8271205444415821.[0m
/media/san2_ssd/data/Workdir/survival/utils.py:305: RuntimeWarning: invalid value encountered in true_divide
  pdfs = np.gradient(1-survs,axis=1)/norms
[32m[I 2022-04-21 11:39:50,486][0m Trial 443 finished with value: 0.8184063153476406 and parameters: {'splitter': 'best', 'min_samples_split': 0.07570865362673936, 'min_samples_leaf': 0.020971277821194408, 'min_weight_fraction_leaf': 0.00972728454932893, 'max_features': 0.3051975812185586}. Best is trial 435 with value: 0.8271205444415821.[0m
[32m[I 2022-04-21 11:39:50,815][0m Trial 444 finished with value: 0.815920233303071 and parameters: {'splitter': 'best', 'min_samples_split': 0.10423976314825491, 'min_samples_leaf': 0.016696009240231208, 'min_weight_fraction_leaf': 0.027207305012951592, 'max_features': 0.43312013225694845}. Best is trial 435 with value: 0.8271205444415821.[0m
[32m[I 2022-04-21 11:39:51,171][0m Trial 445 finished with value: 0.8141637118697371 and parameters: {'splitter': 'best', 'min_samples_split': 0.14494461556576027, 'min_samples_leaf': 0.009966267793075561, 'min_weight_fraction_leaf': 0.008438561596344245, 'max_features': 0.3610983798075334}. Best is trial 435 with value: 0.8271205444415821.[0m
/media/san2_ssd/data/Workdir/survival/utils.py:305: RuntimeWarning: invalid value encountered in true_divide
  pdfs = np.gradient(1-survs,axis=1)/norms
/media/san2_ssd/data/Workdir/survival/utils.py:305: RuntimeWarning: invalid value encountered in true_divide
  pdfs = np.gradient(1-survs,axis=1)/norms
/media/san2_ssd/data/Workdir/survival/utils.py:305: RuntimeWarning: invalid value encountered in true_divide
  pdfs = np.gradient(1-survs,axis=1)/norms
/media/san2_ssd/data/Workdir/survival/utils.py:305: RuntimeWarning: invalid value encountered in true_divide
  pdfs = np.gradient(1-survs,axis=1)/norms
[32m[I 2022-04-21 11:39:52,388][0m Trial 446 finished with value: 0.8224705617414646 and parameters: {'splitter': 'best', 'min_samples_split': 0.08887610047103565, 'min_samples_leaf': 0.001232058909886546, 'min_weight_fraction_leaf': 0.00014225443992213504, 'max_features': 0.4572459257009821}. Best is trial 435 with value: 0.8271205444415821.[0m
[32m[I 2022-04-21 11:39:52,594][0m Trial 447 finished with value: 0.8040712562248788 and parameters: {'splitter': 'random', 'min_samples_split': 0.08644822379450101, 'min_samples_leaf': 0.0013150289416917573, 'min_weight_fraction_leaf': 0.021635402524006562, 'max_features': 0.48826954234943737}. Best is trial 435 with value: 0.8271205444415821.[0m
[32m[I 2022-04-21 11:39:53,180][0m Trial 448 finished with value: 0.8079734022377686 and parameters: {'splitter': 'best', 'min_samples_split': 0.06997652101895999, 'min_samples_leaf': 0.023328447418803498, 'min_weight_fraction_leaf': 0.0414566576031652, 'max_features': 0.5134653670348676}. Best is trial 435 with value: 0.8271205444415821.[0m
/media/san2_ssd/data/Workdir/survival/utils.py:305: RuntimeWarning: invalid value encountered in true_divide
  pdfs = np.gradient(1-survs,axis=1)/norms
/media/san2_ssd/data/Workdir/survival/utils.py:305: RuntimeWarning: invalid value encountered in true_divide
  pdfs = np.gradient(1-survs,axis=1)/norms
[32m[I 2022-04-21 11:39:53,704][0m Trial 449 finished with value: 0.8095999993727064 and parameters: {'splitter': 'best', 'min_samples_split': 0.0789551487484059, 'min_samples_leaf': 0.0011385813788943903, 'min_weight_fraction_leaf': 0.016388796757146683, 'max_features': 0.44861481318900404}. Best is trial 435 with value: 0.8271205444415821.[0m
/media/san2_ssd/data/Workdir/survival/utils.py:305: RuntimeWarning: invalid value encountered in true_divide
  pdfs = np.gradient(1-survs,axis=1)/norms
/media/san2_ssd/data/Workdir/survival/utils.py:305: RuntimeWarning: invalid value encountered in true_divide
  pdfs = np.gradient(1-survs,axis=1)/norms
/media/san2_ssd/data/Workdir/survival/utils.py:305: RuntimeWarning: invalid value encountered in true_divide
  pdfs = np.gradient(1-survs,axis=1)/norms
[32m[I 2022-04-21 11:39:54,188][0m Trial 450 finished with value: 0.8035263264090042 and parameters: {'splitter': 'best', 'min_samples_split': 0.046900882688048276, 'min_samples_leaf': 0.017405216063348473, 'min_weight_fraction_leaf': 0.008168086898306733, 'max_features': 0.46884414101761407}. Best is trial 435 with value: 0.8271205444415821.[0m
[32m[I 2022-04-21 11:39:54,447][0m Trial 451 finished with value: 0.8141667198027619 and parameters: {'splitter': 'best', 'min_samples_split': 0.2075089328647451, 'min_samples_leaf': 0.02810446908386538, 'min_weight_fraction_leaf': 0.024854117389095154, 'max_features': 0.45824576851954085}. Best is trial 435 with value: 0.8271205444415821.[0m
/media/san2_ssd/data/Workdir/survival/utils.py:305: RuntimeWarning: invalid value encountered in true_divide
  pdfs = np.gradient(1-survs,axis=1)/norms
/media/san2_ssd/data/Workdir/survival/utils.py:305: RuntimeWarning: invalid value encountered in true_divide
  pdfs = np.gradient(1-survs,axis=1)/norms
/media/san2_ssd/data/Workdir/survival/utils.py:305: RuntimeWarning: invalid value encountered in true_divide
  pdfs = np.gradient(1-survs,axis=1)/norms
/media/san2_ssd/data/Workdir/survival/utils.py:305: RuntimeWarning: invalid value encountered in true_divide
  pdfs = np.gradient(1-survs,axis=1)/norms
[32m[I 2022-04-21 11:39:55,320][0m Trial 452 finished with value: 0.8155762573118709 and parameters: {'splitter': 'best', 'min_samples_split': 0.09364690951270696, 'min_samples_leaf': 0.00980710659283324, 'min_weight_fraction_leaf': 0.008094585797852393, 'max_features': 0.5036805256461697}. Best is trial 435 with value: 0.8271205444415821.[0m
/media/san2_ssd/data/Workdir/survival/utils.py:305: RuntimeWarning: invalid value encountered in true_divide
  pdfs = np.gradient(1-survs,axis=1)/norms
[32m[I 2022-04-21 11:39:55,900][0m Trial 453 finished with value: 0.8176439472454341 and parameters: {'splitter': 'best', 'min_samples_split': 0.08578209389261769, 'min_samples_leaf': 0.016846934545601374, 'min_weight_fraction_leaf': 6.463275287334414e-06, 'max_features': 0.4255693529879049}. Best is trial 435 with value: 0.8271205444415821.[0m
/media/san2_ssd/data/Workdir/survival/utils.py:305: RuntimeWarning: invalid value encountered in true_divide
  pdfs = np.gradient(1-survs,axis=1)/norms
[32m[I 2022-04-21 11:39:56,351][0m Trial 454 finished with value: 0.8216746102362269 and parameters: {'splitter': 'best', 'min_samples_split': 0.058329013327720086, 'min_samples_leaf': 0.009247994061434308, 'min_weight_fraction_leaf': 0.017886974884918385, 'max_features': 0.4291136851550693}. Best is trial 435 with value: 0.8271205444415821.[0m
[32m[I 2022-04-21 11:39:56,708][0m Trial 455 finished with value: 0.8088054979440346 and parameters: {'splitter': 'best', 'min_samples_split': 0.05216574030436493, 'min_samples_leaf': 0.02859892044651125, 'min_weight_fraction_leaf': 0.034066184127164036, 'max_features': 0.45912068223566826}. Best is trial 435 with value: 0.8271205444415821.[0m
/media/san2_ssd/data/Workdir/survival/utils.py:305: RuntimeWarning: invalid value encountered in true_divide
  pdfs = np.gradient(1-survs,axis=1)/norms
/media/san2_ssd/data/Workdir/survival/utils.py:305: RuntimeWarning: invalid value encountered in true_divide
  pdfs = np.gradient(1-survs,axis=1)/norms
[32m[I 2022-04-21 11:39:57,076][0m Trial 456 finished with value: 0.8157096139065256 and parameters: {'splitter': 'best', 'min_samples_split': 0.06730005949016334, 'min_samples_leaf': 0.02498071095683213, 'min_weight_fraction_leaf': 0.01899438432200051, 'max_features': 0.5399207025557576}. Best is trial 435 with value: 0.8271205444415821.[0m
[32m[I 2022-04-21 11:39:57,490][0m Trial 457 finished with value: 0.8160962708450393 and parameters: {'splitter': 'best', 'min_samples_split': 0.0601725614733825, 'min_samples_leaf': 0.013161616858243465, 'min_weight_fraction_leaf': 0.031575319226916046, 'max_features': 0.4184659381575326}. Best is trial 435 with value: 0.8271205444415821.[0m
[32m[I 2022-04-21 11:39:57,650][0m Trial 458 finished with value: 0.824703976616027 and parameters: {'splitter': 'random', 'min_samples_split': 0.039767848880968286, 'min_samples_leaf': 0.03528304853770504, 'min_weight_fraction_leaf': 0.00023417629897414639, 'max_features': 0.4418322474454967}. Best is trial 435 with value: 0.8271205444415821.[0m
[32m[I 2022-04-21 11:39:57,773][0m Trial 459 finished with value: 0.8208659098486436 and parameters: {'splitter': 'random', 'min_samples_split': 0.048773163977073875, 'min_samples_leaf': 0.04634133452757259, 'min_weight_fraction_leaf': 0.000372933956316452, 'max_features': 0.4836219584304484}. Best is trial 435 with value: 0.8271205444415821.[0m
[32m[I 2022-04-21 11:39:57,897][0m Trial 460 finished with value: 0.8147576322263355 and parameters: {'splitter': 'random', 'min_samples_split': 0.0498848510831016, 'min_samples_leaf': 0.063997718092936, 'min_weight_fraction_leaf': 0.006595112285496445, 'max_features': 0.4819365332885687}. Best is trial 435 with value: 0.8271205444415821.[0m
[32m[I 2022-04-21 11:39:57,991][0m Trial 461 finished with value: 0.8215702058080069 and parameters: {'splitter': 'random', 'min_samples_split': 0.026498775353363223, 'min_samples_leaf': 0.049615318091169466, 'min_weight_fraction_leaf': 0.0015127932053835649, 'max_features': 0.4866899849150343}. Best is trial 435 with value: 0.8271205444415821.[0m
[32m[I 2022-04-21 11:39:58,204][0m Trial 462 finished with value: 0.7611274372673147 and parameters: {'splitter': 'random', 'min_samples_split': 0.04768625427707371, 'min_samples_leaf': 0.0438703447040498, 'min_weight_fraction_leaf': 0.21887381415530785, 'max_features': 0.523467939512181}. Best is trial 435 with value: 0.8271205444415821.[0m
[32m[I 2022-04-21 11:39:58,348][0m Trial 463 finished with value: 0.8062263028986448 and parameters: {'splitter': 'random', 'min_samples_split': 0.04957194283844098, 'min_samples_leaf': 0.05059350283817776, 'min_weight_fraction_leaf': 0.002394322297891136, 'max_features': 0.498045183247674}. Best is trial 435 with value: 0.8271205444415821.[0m
[32m[I 2022-04-21 11:39:58,488][0m Trial 464 finished with value: 0.8062263028986448 and parameters: {'splitter': 'random', 'min_samples_split': 0.04745463245030021, 'min_samples_leaf': 0.051113704551911, 'min_weight_fraction_leaf': 0.001088532960743717, 'max_features': 0.4942608541547391}. Best is trial 435 with value: 0.8271205444415821.[0m
[32m[I 2022-04-21 11:39:58,641][0m Trial 465 finished with value: 0.8092164213617001 and parameters: {'splitter': 'random', 'min_samples_split': 0.029490325470865372, 'min_samples_leaf': 0.06468530505571785, 'min_weight_fraction_leaf': 7.493133642128003e-05, 'max_features': 0.475234576810942}. Best is trial 435 with value: 0.8271205444415821.[0m
[32m[I 2022-04-21 11:39:58,765][0m Trial 466 finished with value: 0.812556373128321 and parameters: {'splitter': 'random', 'min_samples_split': 0.043845504075843145, 'min_samples_leaf': 0.03899599399292463, 'min_weight_fraction_leaf': 0.014595862035230662, 'max_features': 0.4653369785774003}. Best is trial 435 with value: 0.8271205444415821.[0m
[32m[I 2022-04-21 11:39:58,912][0m Trial 467 finished with value: 0.797023666843524 and parameters: {'splitter': 'random', 'min_samples_split': 0.025178003757079966, 'min_samples_leaf': 0.052041157795267114, 'min_weight_fraction_leaf': 0.0003912611570299207, 'max_features': 0.5003122485794438}. Best is trial 435 with value: 0.8271205444415821.[0m
[32m[I 2022-04-21 11:39:59,016][0m Trial 468 finished with value: 0.8182671401230339 and parameters: {'splitter': 'random', 'min_samples_split': 0.021713627330227435, 'min_samples_leaf': 0.03959680444550537, 'min_weight_fraction_leaf': 0.01503201092249913, 'max_features': 0.4464068597927701}. Best is trial 435 with value: 0.8271205444415821.[0m
[32m[I 2022-04-21 11:39:59,185][0m Trial 469 finished with value: 0.8126331389705393 and parameters: {'splitter': 'random', 'min_samples_split': 0.015843637862131298, 'min_samples_leaf': 0.03720296739846105, 'min_weight_fraction_leaf': 0.009954401061589228, 'max_features': 0.4822771512870371}. Best is trial 435 with value: 0.8271205444415821.[0m
[32m[I 2022-04-21 11:39:59,273][0m Trial 470 finished with value: 0.8152276917377781 and parameters: {'splitter': 'random', 'min_samples_split': 0.03183696105741128, 'min_samples_leaf': 0.07054935313708922, 'min_weight_fraction_leaf': 0.017219038822148234, 'max_features': 0.4697091962549281}. Best is trial 435 with value: 0.8271205444415821.[0m
[32m[I 2022-04-21 11:39:59,390][0m Trial 471 finished with value: 0.8109190455849179 and parameters: {'splitter': 'random', 'min_samples_split': 0.05712812714737612, 'min_samples_leaf': 0.04781367725249709, 'min_weight_fraction_leaf': 0.010147769799826458, 'max_features': 0.4534912510531669}. Best is trial 435 with value: 0.8271205444415821.[0m
/media/san2_ssd/data/Workdir/survival/utils.py:305: RuntimeWarning: invalid value encountered in true_divide
  pdfs = np.gradient(1-survs,axis=1)/norms
[32m[I 2022-04-21 11:39:59,623][0m Trial 472 finished with value: 0.8133742226077947 and parameters: {'splitter': 'random', 'min_samples_split': 0.01034337938813176, 'min_samples_leaf': 0.023629593813198218, 'min_weight_fraction_leaf': 0.021681915458014622, 'max_features': 0.44181152038973376}. Best is trial 435 with value: 0.8271205444415821.[0m
[32m[I 2022-04-21 11:39:59,787][0m Trial 473 finished with value: 0.6602372585167304 and parameters: {'splitter': 'random', 'min_samples_split': 0.03193361063671576, 'min_samples_leaf': 0.27911641624216504, 'min_weight_fraction_leaf': 0.0009052091304258677, 'max_features': 0.5072188268618775}. Best is trial 435 with value: 0.8271205444415821.[0m
[32m[I 2022-04-21 11:39:59,986][0m Trial 474 finished with value: 0.7826007054762518 and parameters: {'splitter': 'random', 'min_samples_split': 0.03104306077034539, 'min_samples_leaf': 0.03338454936483968, 'min_weight_fraction_leaf': 0.1825678653151259, 'max_features': 0.5278499063951272}. Best is trial 435 with value: 0.8271205444415821.[0m
[32m[I 2022-04-21 11:40:00,117][0m Trial 475 finished with value: 0.8045612074189842 and parameters: {'splitter': 'random', 'min_samples_split': 0.005838728197861437, 'min_samples_leaf': 0.031103024392074883, 'min_weight_fraction_leaf': 0.009321020974848411, 'max_features': 0.4566102149242421}. Best is trial 435 with value: 0.8271205444415821.[0m
[32m[I 2022-04-21 11:40:00,292][0m Trial 476 finished with value: 0.7693449935578376 and parameters: {'splitter': 'random', 'min_samples_split': 0.03748171273472974, 'min_samples_leaf': 0.018171884717148368, 'min_weight_fraction_leaf': 0.15342562756250994, 'max_features': 0.434250419024109}. Best is trial 435 with value: 0.8271205444415821.[0m
[32m[I 2022-04-21 11:40:00,516][0m Trial 477 finished with value: 0.8037079092908567 and parameters: {'splitter': 'random', 'min_samples_split': 0.03640493687993802, 'min_samples_leaf': 0.07798039130321252, 'min_weight_fraction_leaf': 0.00029667825974060043, 'max_features': 0.47669590062132}. Best is trial 435 with value: 0.8271205444415821.[0m
[32m[I 2022-04-21 11:40:00,811][0m Trial 478 finished with value: 0.8158191604357921 and parameters: {'splitter': 'random', 'min_samples_split': 0.056406914775437966, 'min_samples_leaf': 0.036807678772320405, 'min_weight_fraction_leaf': 0.02214689702014238, 'max_features': 0.43404220140185523}. Best is trial 435 with value: 0.8271205444415821.[0m
/media/san2_ssd/data/Workdir/survival/utils.py:305: RuntimeWarning: invalid value encountered in true_divide
  pdfs = np.gradient(1-survs,axis=1)/norms
/media/san2_ssd/data/Workdir/survival/utils.py:305: RuntimeWarning: invalid value encountered in true_divide
  pdfs = np.gradient(1-survs,axis=1)/norms
/media/san2_ssd/data/Workdir/survival/utils.py:305: RuntimeWarning: invalid value encountered in true_divide
  pdfs = np.gradient(1-survs,axis=1)/norms
/media/san2_ssd/data/Workdir/survival/utils.py:305: RuntimeWarning: invalid value encountered in true_divide
  pdfs = np.gradient(1-survs,axis=1)/norms
[32m[I 2022-04-21 11:40:01,026][0m Trial 479 finished with value: 0.8061297119440717 and parameters: {'splitter': 'random', 'min_samples_split': 0.020064962236319088, 'min_samples_leaf': 0.008823475836045473, 'min_weight_fraction_leaf': 0.014699320781122488, 'max_features': 0.46121704660746854}. Best is trial 435 with value: 0.8271205444415821.[0m
[32m[I 2022-04-21 11:40:01,577][0m Trial 480 finished with value: 0.8055966485733205 and parameters: {'splitter': 'best', 'min_samples_split': 0.0365300635568182, 'min_samples_leaf': 0.05569344549161324, 'min_weight_fraction_leaf': 0.010380073007203344, 'max_features': 0.48659984369343795}. Best is trial 435 with value: 0.8271205444415821.[0m
[32m[I 2022-04-21 11:40:02,462][0m Trial 481 finished with value: 0.8179198032781901 and parameters: {'splitter': 'best', 'min_samples_split': 0.06524966435860083, 'min_samples_leaf': 0.020789384847218022, 'min_weight_fraction_leaf': 0.02586405772141542, 'max_features': 0.43376478338725577}. Best is trial 435 with value: 0.8271205444415821.[0m
