[32m[I 2022-04-23 15:51:56,836][0m Trial 464 finished with value: 0.5702850061667605 and parameters: {'n_hidden': 32, 'mixture_components': 2, 'use_sparse_layer': False, 'use_batchnorm': True, 'use_dropout': True, 'dropout': 0.14021320473767226, 'mlp_size_1': 2, 'mlp_size_2': 0, 'mlp_size_3': 0, 'kernel': 'Logistic', 'loss_name': 'NLLLoss'}. Best is trial 123 with value: 0.6857038111174789.[0m
[32m[I 2022-04-23 15:53:04,085][0m Trial 465 finished with value: 0.6387921955249307 and parameters: {'n_hidden': 64, 'mixture_components': 8, 'use_sparse_layer': False, 'use_batchnorm': False, 'use_dropout': True, 'dropout': 0.15865324382527457, 'mlp_size_1': 3, 'mlp_size_2': 0, 'mlp_size_3': 0, 'kernel': 'LogLogistic', 'loss_name': 'CensoredNLLLoss'}. Best is trial 123 with value: 0.6857038111174789.[0m
[32m[I 2022-04-23 15:54:27,465][0m Trial 466 finished with value: 0.658503808012517 and parameters: {'n_hidden': 128, 'mixture_components': 2, 'use_sparse_layer': False, 'use_batchnorm': False, 'use_dropout': True, 'dropout': 0.20979550301670147, 'mlp_size_1': 4, 'mlp_size_2': 0, 'mlp_size_3': 0, 'kernel': 'Normal', 'loss_name': 'AlternativeNLLLoss'}. Best is trial 123 with value: 0.6857038111174789.[0m
[32m[I 2022-04-23 15:55:51,279][0m Trial 467 finished with value: 0.6628142719093635 and parameters: {'n_hidden': 2048, 'mixture_components': 9, 'use_sparse_layer': False, 'use_batchnorm': False, 'use_dropout': True, 'dropout': 0.24104097849454587, 'mlp_size_1': 7, 'mlp_size_2': 1, 'mlp_size_3': 0, 'kernel': 'Normal', 'loss_name': 'NLLLoss'}. Best is trial 123 with value: 0.6857038111174789.[0m
[32m[I 2022-04-23 15:57:18,944][0m Trial 468 finished with value: 0.6768643327661827 and parameters: {'n_hidden': 2048, 'mixture_components': 9, 'use_sparse_layer': False, 'use_batchnorm': False, 'use_dropout': True, 'dropout': 0.08326407510369745, 'mlp_size_1': 4, 'mlp_size_2': 3, 'mlp_size_3': 1, 'kernel': 'Normal', 'loss_name': 'CensoredNLLLoss'}. Best is trial 123 with value: 0.6857038111174789.[0m
[32m[I 2022-04-23 15:58:30,289][0m Trial 469 finished with value: 0.6731609654761954 and parameters: {'n_hidden': 2048, 'mixture_components': 2, 'use_sparse_layer': False, 'use_batchnorm': False, 'use_dropout': True, 'dropout': 0.17091402781534698, 'mlp_size_1': 4, 'mlp_size_2': 3, 'mlp_size_3': 1, 'kernel': 'Normal', 'loss_name': 'NLLLoss'}. Best is trial 123 with value: 0.6857038111174789.[0m
[32m[I 2022-04-23 15:59:48,570][0m Trial 470 finished with value: 0.6659283578027233 and parameters: {'n_hidden': 2048, 'mixture_components': 9, 'use_sparse_layer': False, 'use_batchnorm': False, 'use_dropout': True, 'dropout': 0.01528502899872173, 'mlp_size_1': 4, 'mlp_size_2': 3, 'mlp_size_3': 1, 'kernel': 'Normal', 'loss_name': 'CensoredNLLLoss'}. Best is trial 123 with value: 0.6857038111174789.[0m
[32m[I 2022-04-23 16:00:51,026][0m Trial 471 finished with value: 0.6382249243215125 and parameters: {'n_hidden': 2048, 'mixture_components': 2, 'use_sparse_layer': False, 'use_batchnorm': False, 'use_dropout': True, 'dropout': 0.09770373625197334, 'mlp_size_1': 4, 'mlp_size_2': 3, 'mlp_size_3': 1, 'kernel': 'Gumbel', 'loss_name': 'NLLLoss'}. Best is trial 123 with value: 0.6857038111174789.[0m
[32m[I 2022-04-23 16:02:03,535][0m Trial 472 finished with value: 0.6857027251623874 and parameters: {'n_hidden': 1024, 'mixture_components': 9, 'use_sparse_layer': False, 'use_batchnorm': False, 'use_dropout': True, 'dropout': 0.13110127363005625, 'mlp_size_1': 4, 'mlp_size_2': 3, 'mlp_size_3': 0, 'kernel': 'Normal', 'loss_name': 'CensoredNLLLoss'}. Best is trial 123 with value: 0.6857038111174789.[0m
[32m[I 2022-04-23 16:03:10,085][0m Trial 473 finished with value: 0.6606028282949147 and parameters: {'n_hidden': 512, 'mixture_components': 8, 'use_sparse_layer': False, 'use_batchnorm': False, 'use_dropout': True, 'dropout': 0.11619038284492557, 'mlp_size_1': 4, 'mlp_size_2': 2, 'mlp_size_3': 0, 'kernel': 'Normal', 'loss_name': 'CensoredNLLLoss'}. Best is trial 123 with value: 0.6857038111174789.[0m
[32m[I 2022-04-23 16:04:31,303][0m Trial 474 finished with value: 0.647944706885674 and parameters: {'n_hidden': 256, 'mixture_components': 10, 'use_sparse_layer': False, 'use_batchnorm': False, 'use_dropout': True, 'dropout': 0.06663963148873632, 'mlp_size_1': 5, 'mlp_size_2': 0, 'mlp_size_3': 0, 'kernel': 'Normal', 'loss_name': 'CensoredNLLLoss'}. Best is trial 123 with value: 0.6857038111174789.[0m
[32m[I 2022-04-23 16:05:40,183][0m Trial 475 finished with value: 0.6673912720675574 and parameters: {'n_hidden': 1024, 'mixture_components': 2, 'use_sparse_layer': False, 'use_batchnorm': False, 'use_dropout': True, 'dropout': 0.1465186341609504, 'mlp_size_1': 4, 'mlp_size_2': 3, 'mlp_size_3': 0, 'kernel': 'Normal', 'loss_name': 'CensoredNLLLoss'}. Best is trial 123 with value: 0.6857038111174789.[0m
[32m[I 2022-04-23 16:06:19,558][0m Trial 476 finished with value: -0.6633225362722284 and parameters: {'n_hidden': 512, 'mixture_components': 9, 'use_sparse_layer': False, 'use_batchnorm': False, 'use_dropout': True, 'dropout': 0.0388735082493059, 'mlp_size_1': 4, 'mlp_size_2': 2, 'mlp_size_3': 0, 'kernel': 'Exponential', 'loss_name': 'CensoredNLLLoss'}. Best is trial 123 with value: 0.6857038111174789.[0m
[32m[I 2022-04-23 16:07:36,345][0m Trial 477 finished with value: 0.6526676931257199 and parameters: {'n_hidden': 1024, 'mixture_components': 9, 'use_sparse_layer': False, 'use_batchnorm': False, 'use_dropout': True, 'dropout': 0.09586410688562269, 'mlp_size_1': 4, 'mlp_size_2': 3, 'mlp_size_3': 0, 'kernel': 'Normal', 'loss_name': 'CensoredNLLLoss'}. Best is trial 123 with value: 0.6857038111174789.[0m
[32m[I 2022-04-23 16:08:42,656][0m Trial 478 finished with value: 0.6549076888009553 and parameters: {'n_hidden': 1024, 'mixture_components': 2, 'use_sparse_layer': False, 'use_batchnorm': False, 'use_dropout': True, 'dropout': 0.17806281956706183, 'mlp_size_1': 4, 'mlp_size_2': 3, 'mlp_size_3': 0, 'kernel': 'Normal', 'loss_name': 'CensoredNLLLoss'}. Best is trial 123 with value: 0.6857038111174789.[0m
[32m[I 2022-04-23 16:10:04,141][0m Trial 479 finished with value: 0.6469414799940281 and parameters: {'n_hidden': 1024, 'mixture_components': 9, 'use_sparse_layer': False, 'use_batchnorm': False, 'use_dropout': True, 'dropout': 0.20581556010443486, 'mlp_size_1': 4, 'mlp_size_2': 3, 'mlp_size_3': 0, 'kernel': 'Normal', 'loss_name': 'CensoredNLLLoss'}. Best is trial 123 with value: 0.6857038111174789.[0m
[32m[I 2022-04-23 16:11:34,623][0m Trial 480 finished with value: 0.6550431518078543 and parameters: {'n_hidden': 32, 'mixture_components': 2, 'use_sparse_layer': False, 'use_batchnorm': False, 'use_dropout': True, 'dropout': 0.3634419260735663, 'mlp_size_1': 2, 'mlp_size_2': 0, 'mlp_size_3': 0, 'kernel': 'Normal', 'loss_name': 'CensoredNLLLoss'}. Best is trial 123 with value: 0.6857038111174789.[0m
[32m[I 2022-04-23 16:12:43,567][0m Trial 481 finished with value: 0.6718010719580985 and parameters: {'n_hidden': 1024, 'mixture_components': 1, 'use_sparse_layer': False, 'use_batchnorm': False, 'use_dropout': True, 'dropout': 0.11895645496232393, 'mlp_size_1': 4, 'mlp_size_2': 3, 'mlp_size_3': 0, 'kernel': 'Normal', 'loss_name': 'CensoredNLLLoss'}. Best is trial 123 with value: 0.6857038111174789.[0m
[32m[I 2022-04-23 16:13:41,739][0m Trial 482 finished with value: 0.6501401165776832 and parameters: {'n_hidden': 1024, 'mixture_components': 9, 'use_sparse_layer': False, 'use_batchnorm': False, 'use_dropout': True, 'dropout': 0.056551673762945474, 'mlp_size_1': 4, 'mlp_size_2': 3, 'mlp_size_3': 0, 'kernel': 'LogLogistic', 'loss_name': 'CensoredNLLLoss'}. Best is trial 123 with value: 0.6857038111174789.[0m
[32m[I 2022-04-23 16:14:50,059][0m Trial 483 finished with value: 0.6745813798115925 and parameters: {'n_hidden': 1024, 'mixture_components': 10, 'use_sparse_layer': False, 'use_batchnorm': False, 'use_dropout': True, 'dropout': 0.0830009137946052, 'mlp_size_1': 4, 'mlp_size_2': 3, 'mlp_size_3': 0, 'kernel': 'Normal', 'loss_name': 'CensoredNLLLoss'}. Best is trial 123 with value: 0.6857038111174789.[0m
[32m[I 2022-04-23 16:17:03,656][0m Trial 484 finished with value: 0.6480529553086083 and parameters: {'n_hidden': 1024, 'mixture_components': 8, 'use_sparse_layer': False, 'use_batchnorm': True, 'use_dropout': True, 'dropout': 0.13368149808382623, 'mlp_size_1': 4, 'mlp_size_2': 3, 'mlp_size_3': 0, 'kernel': 'Normal', 'loss_name': 'CensoredNLLLoss'}. Best is trial 123 with value: 0.6857038111174789.[0m
[32m[I 2022-04-23 16:17:57,232][0m Trial 485 finished with value: 0.5792093471314871 and parameters: {'n_hidden': 64, 'mixture_components': 9, 'use_sparse_layer': False, 'use_batchnorm': False, 'use_dropout': True, 'dropout': 0.17164260650929186, 'mlp_size_1': 3, 'mlp_size_2': 0, 'mlp_size_3': 0, 'kernel': 'Gumbel', 'loss_name': 'CensoredNLLLoss'}. Best is trial 123 with value: 0.6857038111174789.[0m
[32m[I 2022-04-23 16:19:12,721][0m Trial 486 finished with value: 0.6725106219795303 and parameters: {'n_hidden': 512, 'mixture_components': 2, 'use_sparse_layer': False, 'use_batchnorm': False, 'use_dropout': True, 'dropout': 0.23751801318416563, 'mlp_size_1': 4, 'mlp_size_2': 2, 'mlp_size_3': 0, 'kernel': 'Normal', 'loss_name': 'CensoredNLLLoss'}. Best is trial 123 with value: 0.6857038111174789.[0m
[32m[I 2022-04-23 16:20:26,124][0m Trial 487 finished with value: 0.6302601096947015 and parameters: {'n_hidden': 1024, 'mixture_components': 9, 'use_sparse_layer': False, 'use_batchnorm': False, 'use_dropout': True, 'dropout': 0.2677643108684471, 'mlp_size_1': 4, 'mlp_size_2': 3, 'mlp_size_3': 0, 'kernel': 'Normal', 'loss_name': 'CensoredNLLLoss'}. Best is trial 123 with value: 0.6857038111174789.[0m
[32m[I 2022-04-23 16:21:39,455][0m Trial 488 finished with value: 0.6569419185787859 and parameters: {'n_hidden': 128, 'mixture_components': 2, 'use_sparse_layer': False, 'use_batchnorm': False, 'use_dropout': True, 'dropout': 0.1520245811130836, 'mlp_size_1': 4, 'mlp_size_2': 0, 'mlp_size_3': 0, 'kernel': 'Normal', 'loss_name': 'AlternativeNLLLoss'}. Best is trial 123 with value: 0.6857038111174789.[0m
[32m[I 2022-04-23 16:22:52,557][0m Trial 489 finished with value: 0.6712149219723187 and parameters: {'n_hidden': 512, 'mixture_components': 9, 'use_sparse_layer': False, 'use_batchnorm': False, 'use_dropout': True, 'dropout': 0.1905766135001337, 'mlp_size_1': 4, 'mlp_size_2': 2, 'mlp_size_3': 0, 'kernel': 'Logistic', 'loss_name': 'CensoredNLLLoss'}. Best is trial 123 with value: 0.6857038111174789.[0m
[32m[I 2022-04-23 16:24:02,993][0m Trial 490 finished with value: 0.6770973532211322 and parameters: {'n_hidden': 512, 'mixture_components': 2, 'use_sparse_layer': False, 'use_batchnorm': False, 'use_dropout': True, 'dropout': 0.10177862219869717, 'mlp_size_1': 4, 'mlp_size_2': 2, 'mlp_size_3': 0, 'kernel': 'Normal', 'loss_name': 'CensoredNLLLoss'}. Best is trial 123 with value: 0.6857038111174789.[0m
[32m[I 2022-04-23 16:25:29,237][0m Trial 491 finished with value: 0.6536657881210781 and parameters: {'n_hidden': 2048, 'mixture_components': 3, 'use_sparse_layer': False, 'use_batchnorm': False, 'use_dropout': True, 'dropout': 0.07095495152778333, 'mlp_size_1': 1, 'mlp_size_2': 7, 'mlp_size_3': 0, 'kernel': 'Normal', 'loss_name': 'CensoredNLLLoss'}. Best is trial 123 with value: 0.6857038111174789.[0m
[32m[I 2022-04-23 16:26:41,764][0m Trial 492 finished with value: 0.6690357393245562 and parameters: {'n_hidden': 512, 'mixture_components': 9, 'use_sparse_layer': False, 'use_batchnorm': False, 'use_dropout': True, 'dropout': 0.04327506156200084, 'mlp_size_1': 4, 'mlp_size_2': 2, 'mlp_size_3': 0, 'kernel': 'Normal', 'loss_name': 'CensoredNLLLoss'}. Best is trial 123 with value: 0.6857038111174789.[0m
[32m[I 2022-04-23 16:28:05,592][0m Trial 493 finished with value: 0.6626365741961429 and parameters: {'n_hidden': 2048, 'mixture_components': 9, 'use_sparse_layer': True, 'use_sparse_loss': False, 'use_batchnorm': False, 'use_dropout': True, 'dropout': 0.22186352548603924, 'mlp_size_1': 3, 'mlp_size_2': 3, 'mlp_size_3': 1, 'kernel': 'Normal', 'loss_name': 'CensoredNLLLoss'}. Best is trial 123 with value: 0.6857038111174789.[0m
[32m[I 2022-04-23 16:29:20,556][0m Trial 494 finished with value: 0.6740555939174634 and parameters: {'n_hidden': 512, 'mixture_components': 2, 'use_sparse_layer': False, 'use_batchnorm': False, 'use_dropout': True, 'dropout': 0.12966769853006355, 'mlp_size_1': 4, 'mlp_size_2': 2, 'mlp_size_3': 0, 'kernel': 'Normal', 'loss_name': 'CensoredNLLLoss'}. Best is trial 123 with value: 0.6857038111174789.[0m
[32m[I 2022-04-23 16:30:23,777][0m Trial 495 finished with value: 0.648542045598601 and parameters: {'n_hidden': 2048, 'mixture_components': 8, 'use_sparse_layer': False, 'use_batchnorm': False, 'use_dropout': True, 'dropout': 0.1032736374707033, 'mlp_size_1': 4, 'mlp_size_2': 3, 'mlp_size_3': 1, 'kernel': 'Normal', 'loss_name': 'NLLLoss'}. Best is trial 123 with value: 0.6857038111174789.[0m
[32m[I 2022-04-23 16:31:38,672][0m Trial 496 finished with value: 0.6758205334178313 and parameters: {'n_hidden': 512, 'mixture_components': 3, 'use_sparse_layer': False, 'use_batchnorm': False, 'use_dropout': True, 'dropout': 0.15974066386348254, 'mlp_size_1': 4, 'mlp_size_2': 2, 'mlp_size_3': 0, 'kernel': 'Normal', 'loss_name': 'AlternativeNLLLoss'}. Best is trial 123 with value: 0.6857038111174789.[0m
[32m[I 2022-04-23 16:32:59,102][0m Trial 497 finished with value: 0.6479044604991654 and parameters: {'n_hidden': 2048, 'mixture_components': 10, 'use_sparse_layer': False, 'use_batchnorm': False, 'use_dropout': True, 'dropout': 0.19360771664872287, 'mlp_size_1': 4, 'mlp_size_2': 3, 'mlp_size_3': 1, 'kernel': 'LogLogistic', 'loss_name': 'CensoredNLLLoss'}. Best is trial 123 with value: 0.6857038111174789.[0m
[32m[I 2022-04-23 16:33:53,164][0m Trial 498 finished with value: 0.6419442382101413 and parameters: {'n_hidden': 512, 'mixture_components': 1, 'use_sparse_layer': False, 'use_batchnorm': False, 'use_dropout': True, 'dropout': 0.08193278747561307, 'mlp_size_1': 5, 'mlp_size_2': 1, 'mlp_size_3': 0, 'kernel': 'Normal', 'loss_name': 'NLLLoss'}. Best is trial 123 with value: 0.6857038111174789.[0m
[32m[I 2022-04-23 16:35:12,778][0m Trial 499 finished with value: 0.6641581676982244 and parameters: {'n_hidden': 2048, 'mixture_components': 9, 'use_sparse_layer': False, 'use_batchnorm': False, 'use_dropout': True, 'dropout': 0.12020651051906495, 'mlp_size_1': 4, 'mlp_size_2': 3, 'mlp_size_3': 1, 'kernel': 'Normal', 'loss_name': 'CensoredNLLLoss'}. Best is trial 123 with value: 0.6857038111174789.[0m
[32m[I 2022-04-23 16:35:55,376][0m Trial 500 finished with value: 0.6150920232049278 and parameters: {'n_hidden': 512, 'mixture_components': 6, 'use_sparse_layer': False, 'use_batchnorm': False, 'use_dropout': True, 'dropout': 0.14582858339134389, 'mlp_size_1': 4, 'mlp_size_2': 2, 'mlp_size_3': 0, 'kernel': 'Gumbel', 'loss_name': 'NLLLoss'}. Best is trial 123 with value: 0.6857038111174789.[0m
[32m[I 2022-04-23 16:37:21,398][0m Trial 501 finished with value: 0.6825913383965435 and parameters: {'n_hidden': 256, 'mixture_components': 9, 'use_sparse_layer': False, 'use_batchnorm': False, 'use_dropout': True, 'dropout': 0.05403266036379581, 'mlp_size_1': 5, 'mlp_size_2': 0, 'mlp_size_3': 0, 'kernel': 'Normal', 'loss_name': 'CensoredNLLLoss'}. Best is trial 123 with value: 0.6857038111174789.[0m
[32m[I 2022-04-23 16:38:32,987][0m Trial 502 finished with value: 0.6492274032089785 and parameters: {'n_hidden': 256, 'mixture_components': 9, 'use_sparse_layer': False, 'use_batchnorm': False, 'use_dropout': True, 'dropout': 0.019414251207646553, 'mlp_size_1': 5, 'mlp_size_2': 0, 'mlp_size_3': 0, 'kernel': 'Normal', 'loss_name': 'CensoredNLLLoss'}. Best is trial 123 with value: 0.6857038111174789.[0m
[32m[I 2022-04-23 16:40:51,013][0m Trial 503 finished with value: 0.6177963682420483 and parameters: {'n_hidden': 256, 'mixture_components': 9, 'use_sparse_layer': False, 'use_batchnorm': True, 'use_dropout': True, 'dropout': 0.0517597234752251, 'mlp_size_1': 5, 'mlp_size_2': 0, 'mlp_size_3': 0, 'kernel': 'Normal', 'loss_name': 'CensoredNLLLoss'}. Best is trial 123 with value: 0.6857038111174789.[0m
[32m[I 2022-04-23 16:42:08,935][0m Trial 504 finished with value: 0.6080284708865294 and parameters: {'n_hidden': 256, 'mixture_components': 9, 'use_sparse_layer': True, 'use_sparse_loss': False, 'use_batchnorm': False, 'use_dropout': True, 'dropout': 0.8122807455583952, 'mlp_size_1': 5, 'mlp_size_2': 0, 'mlp_size_3': 0, 'kernel': 'Normal', 'loss_name': 'CensoredNLLLoss'}. Best is trial 123 with value: 0.6857038111174789.[0m
[32m[I 2022-04-23 16:43:18,537][0m Trial 505 finished with value: 0.6292079347265783 and parameters: {'n_hidden': 256, 'mixture_components': 9, 'use_sparse_layer': False, 'use_batchnorm': False, 'use_dropout': True, 'dropout': 0.2082794241286283, 'mlp_size_1': 5, 'mlp_size_2': 0, 'mlp_size_3': 0, 'kernel': 'Normal', 'loss_name': 'CensoredNLLLoss'}. Best is trial 123 with value: 0.6857038111174789.[0m
[32m[I 2022-04-23 16:43:53,298][0m Trial 506 finished with value: -0.661011664148416 and parameters: {'n_hidden': 256, 'mixture_components': 9, 'use_sparse_layer': False, 'use_batchnorm': False, 'use_dropout': True, 'dropout': 0.17365018556397332, 'mlp_size_1': 5, 'mlp_size_2': 0, 'mlp_size_3': 0, 'kernel': 'Exponential', 'loss_name': 'CensoredNLLLoss'}. Best is trial 123 with value: 0.6857038111174789.[0m
[32m[I 2022-04-23 16:45:09,487][0m Trial 507 finished with value: 0.6368314646142063 and parameters: {'n_hidden': 2048, 'mixture_components': 9, 'use_sparse_layer': False, 'use_batchnorm': False, 'use_dropout': True, 'dropout': 0.07062575323333917, 'mlp_size_1': 4, 'mlp_size_2': 4, 'mlp_size_3': 0, 'kernel': 'Normal', 'loss_name': 'CensoredNLLLoss'}. Best is trial 123 with value: 0.6857038111174789.[0m
[32m[I 2022-04-23 16:46:19,766][0m Trial 508 finished with value: 0.6600666670364079 and parameters: {'n_hidden': 256, 'mixture_components': 9, 'use_sparse_layer': False, 'use_batchnorm': False, 'use_dropout': True, 'dropout': 0.11310593945037346, 'mlp_size_1': 5, 'mlp_size_2': 0, 'mlp_size_3': 0, 'kernel': 'Normal', 'loss_name': 'CensoredNLLLoss'}. Best is trial 123 with value: 0.6857038111174789.[0m
[32m[I 2022-04-23 16:47:44,704][0m Trial 509 finished with value: 0.6773236733503284 and parameters: {'n_hidden': 2048, 'mixture_components': 9, 'use_sparse_layer': False, 'use_batchnorm': False, 'use_dropout': True, 'dropout': 0.0025142537969553846, 'mlp_size_1': 4, 'mlp_size_2': 3, 'mlp_size_3': 1, 'kernel': 'Normal', 'loss_name': 'CensoredNLLLoss'}. Best is trial 123 with value: 0.6857038111174789.[0m
[32m[I 2022-04-23 16:48:58,107][0m Trial 510 finished with value: 0.6703558674874454 and parameters: {'n_hidden': 1024, 'mixture_components': 8, 'use_sparse_layer': False, 'use_batchnorm': False, 'use_dropout': True, 'dropout': 0.16038697057486573, 'mlp_size_1': 4, 'mlp_size_2': 3, 'mlp_size_3': 0, 'kernel': 'Normal', 'loss_name': 'CensoredNLLLoss'}. Best is trial 123 with value: 0.6857038111174789.[0m
[32m[I 2022-04-23 16:49:48,500][0m Trial 511 finished with value: 0.6609800428138319 and parameters: {'n_hidden': 256, 'mixture_components': 9, 'use_sparse_layer': False, 'use_batchnorm': False, 'use_dropout': True, 'dropout': 0.09001841125400507, 'mlp_size_1': 5, 'mlp_size_2': 0, 'mlp_size_3': 0, 'kernel': 'LogLogistic', 'loss_name': 'CensoredNLLLoss'}. Best is trial 123 with value: 0.6857038111174789.[0m
[32m[I 2022-04-23 16:51:32,797][0m Trial 512 finished with value: 0.6821015465285037 and parameters: {'n_hidden': 2048, 'mixture_components': 5, 'use_sparse_layer': False, 'use_batchnorm': False, 'use_dropout': True, 'dropout': 0.13429094730722405, 'mlp_size_1': 4, 'mlp_size_2': 3, 'mlp_size_3': 1, 'kernel': 'Normal', 'loss_name': 'CensoredNLLLoss'}. Best is trial 123 with value: 0.6857038111174789.[0m
[32m[I 2022-04-23 16:52:36,080][0m Trial 513 finished with value: 0.656670989215989 and parameters: {'n_hidden': 256, 'mixture_components': 5, 'use_sparse_layer': False, 'use_batchnorm': False, 'use_dropout': False, 'mlp_size_1': 5, 'mlp_size_2': 0, 'mlp_size_3': 0, 'kernel': 'Normal', 'loss_name': 'CensoredNLLLoss'}. Best is trial 123 with value: 0.6857038111174789.[0m
[32m[I 2022-04-23 16:53:49,594][0m Trial 514 finished with value: 0.6613938942632973 and parameters: {'n_hidden': 256, 'mixture_components': 5, 'use_sparse_layer': False, 'use_batchnorm': False, 'use_dropout': True, 'dropout': 0.13762338729518148, 'mlp_size_1': 5, 'mlp_size_2': 0, 'mlp_size_3': 0, 'kernel': 'Normal', 'loss_name': 'CensoredNLLLoss'}. Best is trial 123 with value: 0.6857038111174789.[0m
[32m[I 2022-04-23 16:54:57,945][0m Trial 515 finished with value: 0.5614924819280707 and parameters: {'n_hidden': 2048, 'mixture_components': 5, 'use_sparse_layer': False, 'use_batchnorm': False, 'use_dropout': True, 'dropout': 0.1811580803006127, 'mlp_size_1': 4, 'mlp_size_2': 3, 'mlp_size_3': 1, 'kernel': 'Gumbel', 'loss_name': 'CensoredNLLLoss'}. Best is trial 123 with value: 0.6857038111174789.[0m
[32m[I 2022-04-23 16:56:04,974][0m Trial 516 finished with value: 0.6270690464027582 and parameters: {'n_hidden': 32, 'mixture_components': 5, 'use_sparse_layer': True, 'use_sparse_loss': False, 'use_batchnorm': False, 'use_dropout': True, 'dropout': 0.2039077042518282, 'mlp_size_1': 2, 'mlp_size_2': 0, 'mlp_size_3': 0, 'kernel': 'Logistic', 'loss_name': 'CensoredNLLLoss'}. Best is trial 123 with value: 0.6857038111174789.[0m
