[32m[I 2022-04-21 21:13:54,869][0m Trial 705 finished with value: 0.8283043711301529 and parameters: {'loss': 'coxph', 'learning_rate': 0.0043877661457487616, 'n_estimators': 875, 'criterion': 'friedman_mse', 'min_samples_split': 2, 'min_samples_leaf': 7, 'min_weight_fraction_leaf': 0.01868762386448733, 'min_impurity_decrease': 0.9306318369081157, 'max_features': 0.3394412789680202, 'subsample': 0.28491329769717905, 'dropout_rate': 0.23508993525932464, 'ccp_alpha': 0.09259112811325836}. Best is trial 664 with value: 0.8342316538423719.[0m
[32m[I 2022-04-21 21:19:19,038][0m Trial 706 finished with value: 0.25 and parameters: {'loss': 'coxph', 'learning_rate': 0.003549608138291851, 'n_estimators': 958, 'criterion': 'absolute_error', 'min_samples_split': 2, 'min_samples_leaf': 7, 'min_weight_fraction_leaf': 0.0013627498459173725, 'min_impurity_decrease': 0.9226376885135386, 'max_features': 0.28905676483182735, 'subsample': 0.30663707318038425, 'dropout_rate': 0.25688321926905683, 'ccp_alpha': 0.004983962439917176}. Best is trial 664 with value: 0.8342316538423719.[0m
[32m[I 2022-04-21 21:24:52,779][0m Trial 707 finished with value: 0.8321395766020174 and parameters: {'loss': 'coxph', 'learning_rate': 0.005411409974763307, 'n_estimators': 1000, 'criterion': 'friedman_mse', 'min_samples_split': 2, 'min_samples_leaf': 7, 'min_weight_fraction_leaf': 0.010745084056503266, 'min_impurity_decrease': 0.9759916611351385, 'max_features': 0.3202838703493061, 'subsample': 0.277748105957289, 'dropout_rate': 0.29401373923884305, 'ccp_alpha': 0.003339724753947693}. Best is trial 664 with value: 0.8342316538423719.[0m
[32m[I 2022-04-21 21:28:28,024][0m Trial 708 finished with value: 0.25 and parameters: {'loss': 'coxph', 'learning_rate': 0.006183015406995947, 'n_estimators': 858, 'criterion': 'friedman_mse', 'min_samples_split': 2, 'min_samples_leaf': 7, 'min_weight_fraction_leaf': 0.012896502895126345, 'min_impurity_decrease': 0.9461461332884752, 'max_features': 0.32892853820652107, 'subsample': 0.2603371863684619, 'dropout_rate': 0.35537541758438274, 'ccp_alpha': 4.740398351879643}. Best is trial 664 with value: 0.8342316538423719.[0m
[32m[I 2022-04-21 21:32:52,943][0m Trial 709 finished with value: 0.8304379352321749 and parameters: {'loss': 'coxph', 'learning_rate': 0.0038620037410852814, 'n_estimators': 892, 'criterion': 'friedman_mse', 'min_samples_split': 2, 'min_samples_leaf': 8, 'min_weight_fraction_leaf': 0.028554714447511533, 'min_impurity_decrease': 0.992739300817829, 'max_features': 0.2530724490274493, 'subsample': 0.341757294678038, 'dropout_rate': 0.28198502974728135, 'ccp_alpha': 0.002544131655772954}. Best is trial 664 with value: 0.8342316538423719.[0m
/media/san2_ssd/data/Workdir/survival/venv/lib/python3.8/site-packages/sksurv/ensemble/boosting.py:955: RuntimeWarning: divide by zero encountered in log
  time = numpy.log(time)
/media/san2_ssd/data/Workdir/survival/venv/lib/python3.8/site-packages/sksurv/ensemble/boosting.py:955: RuntimeWarning: divide by zero encountered in log
  time = numpy.log(time)
/media/san2_ssd/data/Workdir/survival/venv/lib/python3.8/site-packages/sksurv/ensemble/boosting.py:955: RuntimeWarning: divide by zero encountered in log
  time = numpy.log(time)
/media/san2_ssd/data/Workdir/survival/venv/lib/python3.8/site-packages/sksurv/ensemble/boosting.py:955: RuntimeWarning: divide by zero encountered in log
  time = numpy.log(time)
[32m[I 2022-04-21 21:33:53,381][0m Trial 710 finished with value: -0.45 and parameters: {'loss': 'squared', 'learning_rate': 0.0034416960602947017, 'n_estimators': 937, 'criterion': 'friedman_mse', 'min_samples_split': 9, 'min_samples_leaf': 8, 'min_weight_fraction_leaf': 0.02967630133047326, 'min_impurity_decrease': 0.9976075972333732, 'max_features': 0.2427214151293634, 'subsample': 0.3460492274913954, 'dropout_rate': 0.2842324294043634, 'ccp_alpha': 1.5938675555568569}. Best is trial 664 with value: 0.8342316538423719.[0m
[32m[I 2022-04-21 21:37:50,391][0m Trial 711 finished with value: 0.5992750930785745 and parameters: {'loss': 'coxph', 'learning_rate': 0.004015176339474801, 'n_estimators': 914, 'criterion': 'friedman_mse', 'min_samples_split': 2, 'min_samples_leaf': 8, 'min_weight_fraction_leaf': 0.010511607690044443, 'min_impurity_decrease': 0.9792641524488096, 'max_features': 0.2267425141542468, 'subsample': 0.34210900697412433, 'dropout_rate': 0.3185413083827814, 'ccp_alpha': 0.17055909327320234}. Best is trial 664 with value: 0.8342316538423719.[0m
[32m[I 2022-04-21 21:42:01,994][0m Trial 712 finished with value: 0.2503270102305002 and parameters: {'loss': 'coxph', 'learning_rate': 0.004230738415126539, 'n_estimators': 885, 'criterion': 'friedman_mse', 'min_samples_split': 2, 'min_samples_leaf': 8, 'min_weight_fraction_leaf': 0.031468176801413825, 'min_impurity_decrease': 0.997521057381462, 'max_features': 0.26429853994782493, 'subsample': 0.35167407526525374, 'dropout_rate': 0.2952052121628717, 'ccp_alpha': 0.2729898358813956}. Best is trial 664 with value: 0.8342316538423719.[0m
[32m[I 2022-04-21 21:45:34,275][0m Trial 713 finished with value: 0.8243746225212416 and parameters: {'loss': 'coxph', 'learning_rate': 0.005632990880868983, 'n_estimators': 840, 'criterion': 'friedman_mse', 'min_samples_split': 2, 'min_samples_leaf': 8, 'min_weight_fraction_leaf': 0.02230128677309249, 'min_impurity_decrease': 0.9742754741703651, 'max_features': 0.2962287687348999, 'subsample': 0.3377151572607442, 'dropout_rate': 0.3112643905965171, 'ccp_alpha': 0.09911990858098055}. Best is trial 664 with value: 0.8342316538423719.[0m
[32m[I 2022-04-21 21:50:12,733][0m Trial 714 finished with value: 0.597136420159164 and parameters: {'loss': 'coxph', 'learning_rate': 0.0034067523645201414, 'n_estimators': 921, 'criterion': 'friedman_mse', 'min_samples_split': 2, 'min_samples_leaf': 7, 'min_weight_fraction_leaf': 0.001554904461823903, 'min_impurity_decrease': 0.9641528963646442, 'max_features': 0.24068229616165235, 'subsample': 0.32410310882627064, 'dropout_rate': 0.2762008724384953, 'ccp_alpha': 0.17403465901777626}. Best is trial 664 with value: 0.8342316538423719.[0m
[32m[I 2022-04-21 21:54:36,169][0m Trial 715 finished with value: 0.2503270102305002 and parameters: {'loss': 'coxph', 'learning_rate': 0.006148459634688325, 'n_estimators': 868, 'criterion': 'friedman_mse', 'min_samples_split': 2, 'min_samples_leaf': 8, 'min_weight_fraction_leaf': 0.011351180402045488, 'min_impurity_decrease': 0.930896503754133, 'max_features': 0.1693299292814454, 'subsample': 0.35464956277610654, 'dropout_rate': 0.26461523795190445, 'ccp_alpha': 0.36052707450733407}. Best is trial 664 with value: 0.8342316538423719.[0m
[32m[I 2022-04-21 21:58:52,347][0m Trial 716 finished with value: 0.25 and parameters: {'loss': 'coxph', 'learning_rate': 0.004713556216364472, 'n_estimators': 899, 'criterion': 'friedman_mse', 'min_samples_split': 2, 'min_samples_leaf': 7, 'min_weight_fraction_leaf': 0.02763833063210045, 'min_impurity_decrease': 0.8756343835235165, 'max_features': 0.35715178906836426, 'subsample': 0.3191031504011722, 'dropout_rate': 0.34000474170535433, 'ccp_alpha': 4.467776562975693}. Best is trial 664 with value: 0.8342316538423719.[0m
[32m[I 2022-04-21 22:02:17,194][0m Trial 717 finished with value: 0.8259537780124543 and parameters: {'loss': 'coxph', 'learning_rate': 0.0031328052989136536, 'n_estimators': 832, 'criterion': 'friedman_mse', 'min_samples_split': 2, 'min_samples_leaf': 7, 'min_weight_fraction_leaf': 0.016722440617172225, 'min_impurity_decrease': 0.9094484108519502, 'max_features': 0.27402723377431937, 'subsample': 0.3315866603912136, 'dropout_rate': 0.2495683629516454, 'ccp_alpha': 0.09999773426754664}. Best is trial 664 with value: 0.8342316538423719.[0m
[32m[I 2022-04-21 22:07:22,556][0m Trial 718 finished with value: 0.26549606712904655 and parameters: {'loss': 'coxph', 'learning_rate': 0.006141307180106008, 'n_estimators': 941, 'criterion': 'friedman_mse', 'min_samples_split': 2, 'min_samples_leaf': 7, 'min_weight_fraction_leaf': 0.03218568517782592, 'min_impurity_decrease': 0.9500011405300852, 'max_features': 0.3206473494485581, 'subsample': 0.3062973400622825, 'dropout_rate': 0.30678110799373054, 'ccp_alpha': 0.26142887796844966}. Best is trial 664 with value: 0.8342316538423719.[0m
[32m[I 2022-04-21 22:12:19,009][0m Trial 719 finished with value: 0.8305689314623128 and parameters: {'loss': 'coxph', 'learning_rate': 0.0044057027097716564, 'n_estimators': 958, 'criterion': 'friedman_mse', 'min_samples_split': 2, 'min_samples_leaf': 8, 'min_weight_fraction_leaf': 0.0012867873226396261, 'min_impurity_decrease': 0.9853681998581207, 'max_features': 0.25743683833982106, 'subsample': 0.358503924866422, 'dropout_rate': 0.28881336839603056, 'ccp_alpha': 0.0014810808179744322}. Best is trial 664 with value: 0.8342316538423719.[0m
[32m[I 2022-04-21 22:17:03,499][0m Trial 720 finished with value: 0.8268001135437876 and parameters: {'loss': 'coxph', 'learning_rate': 0.006576843800717238, 'n_estimators': 951, 'criterion': 'friedman_mse', 'min_samples_split': 2, 'min_samples_leaf': 8, 'min_weight_fraction_leaf': 0.010154502557269369, 'min_impurity_decrease': 0.9829574256363645, 'max_features': 0.2161424411629722, 'subsample': 0.3628621741423359, 'dropout_rate': 0.32893225843907214, 'ccp_alpha': 0.09510054352336762}. Best is trial 664 with value: 0.8342316538423719.[0m
[32m[I 2022-04-21 22:22:05,196][0m Trial 721 finished with value: 0.3870251124983593 and parameters: {'loss': 'coxph', 'learning_rate': 0.005184239583940011, 'n_estimators': 995, 'criterion': 'friedman_mse', 'min_samples_split': 2, 'min_samples_leaf': 8, 'min_weight_fraction_leaf': 0.0014497702486056252, 'min_impurity_decrease': 0.9825470696833734, 'max_features': 0.24665128168573822, 'subsample': 0.3559808332965971, 'dropout_rate': 0.28692687999977207, 'ccp_alpha': 0.19816124028720494}. Best is trial 664 with value: 0.8342316538423719.[0m
[32m[I 2022-04-21 22:26:09,336][0m Trial 722 finished with value: 0.8239907609797908 and parameters: {'loss': 'coxph', 'learning_rate': 0.006566383404205572, 'n_estimators': 910, 'criterion': 'friedman_mse', 'min_samples_split': 2, 'min_samples_leaf': 8, 'min_weight_fraction_leaf': 0.01162261046186071, 'min_impurity_decrease': 0.13582668307449708, 'max_features': 0.25997027115792465, 'subsample': 0.3422509907071534, 'dropout_rate': 0.29424295216862156, 'ccp_alpha': 0.09530672139820175}. Best is trial 664 with value: 0.8342316538423719.[0m
[32m[I 2022-04-21 22:31:09,799][0m Trial 723 finished with value: 0.8234123953343113 and parameters: {'loss': 'coxph', 'learning_rate': 0.0042687227578942135, 'n_estimators': 965, 'criterion': 'friedman_mse', 'min_samples_split': 2, 'min_samples_leaf': 9, 'min_weight_fraction_leaf': 0.010494297697034468, 'min_impurity_decrease': 0.9998556429309369, 'max_features': 0.26325507018554284, 'subsample': 0.36378169967549445, 'dropout_rate': 0.3191769496125296, 'ccp_alpha': 0.08986348121771609}. Best is trial 664 with value: 0.8342316538423719.[0m
[32m[I 2022-04-21 22:35:22,442][0m Trial 724 finished with value: 0.8316692587738576 and parameters: {'loss': 'coxph', 'learning_rate': 0.00510010546088314, 'n_estimators': 900, 'criterion': 'friedman_mse', 'min_samples_split': 2, 'min_samples_leaf': 8, 'min_weight_fraction_leaf': 0.019516116730287882, 'min_impurity_decrease': 0.9800388452791602, 'max_features': 0.2818634046749118, 'subsample': 0.3356611097704896, 'dropout_rate': 0.35460885172666406, 'ccp_alpha': 0.0036294142553143205}. Best is trial 664 with value: 0.8342316538423719.[0m
[32m[I 2022-04-21 22:38:55,877][0m Trial 725 finished with value: 0.25 and parameters: {'loss': 'coxph', 'learning_rate': 0.007321052143104729, 'n_estimators': 888, 'criterion': 'friedman_mse', 'min_samples_split': 2, 'min_samples_leaf': 8, 'min_weight_fraction_leaf': 0.0010976407540963934, 'min_impurity_decrease': 0.9633001177650347, 'max_features': 0.22475376318449755, 'subsample': 0.3360701528061012, 'dropout_rate': 0.3822846602433816, 'ccp_alpha': 1.4475308227419394}. Best is trial 664 with value: 0.8342316538423719.[0m
[32m[I 2022-04-21 22:42:20,033][0m Trial 726 finished with value: 0.25 and parameters: {'loss': 'coxph', 'learning_rate': 0.005549185603140887, 'n_estimators': 832, 'criterion': 'squared_error', 'min_samples_split': 2, 'min_samples_leaf': 8, 'min_weight_fraction_leaf': 0.017767709225222205, 'min_impurity_decrease': 0.9512475470039482, 'max_features': 0.19870151873399922, 'subsample': 0.3594805215799811, 'dropout_rate': 0.33960001208924734, 'ccp_alpha': 0.0014546615166442772}. Best is trial 664 with value: 0.8342316538423719.[0m
[32m[I 2022-04-21 22:45:18,991][0m Trial 727 finished with value: 0.38502437489620644 and parameters: {'loss': 'coxph', 'learning_rate': 0.007472359054183791, 'n_estimators': 799, 'criterion': 'friedman_mse', 'min_samples_split': 2, 'min_samples_leaf': 8, 'min_weight_fraction_leaf': 0.013427658516046902, 'min_impurity_decrease': 0.9000077704969225, 'max_features': 0.24179620812253597, 'subsample': 0.3272858384127688, 'dropout_rate': 0.36601558825996106, 'ccp_alpha': 0.19336827871190312}. Best is trial 664 with value: 0.8342316538423719.[0m
[32m[I 2022-04-21 22:49:41,623][0m Trial 728 finished with value: 0.8123049171251921 and parameters: {'loss': 'coxph', 'learning_rate': 0.003470502881713402, 'n_estimators': 893, 'criterion': 'friedman_mse', 'min_samples_split': 2, 'min_samples_leaf': 8, 'min_weight_fraction_leaf': 0.009363949114733663, 'min_impurity_decrease': 0.9991420850281786, 'max_features': 0.2787547690082911, 'subsample': 0.35002705582945237, 'dropout_rate': 0.22301341461767565, 'ccp_alpha': 0.16585672300040277}. Best is trial 664 with value: 0.8342316538423719.[0m
[32m[I 2022-04-21 22:54:03,402][0m Trial 729 finished with value: 0.25 and parameters: {'loss': 'coxph', 'learning_rate': 0.00543994924650685, 'n_estimators': 841, 'criterion': 'absolute_error', 'min_samples_split': 2, 'min_samples_leaf': 8, 'min_weight_fraction_leaf': 0.030651536398478486, 'min_impurity_decrease': 0.85581792357118, 'max_features': 0.35577706900759765, 'subsample': 0.33344488975555736, 'dropout_rate': 0.1338781715192605, 'ccp_alpha': 0.005105597819450604}. Best is trial 664 with value: 0.8342316538423719.[0m
/media/san2_ssd/data/Workdir/survival/venv/lib/python3.8/site-packages/sksurv/ensemble/boosting.py:955: RuntimeWarning: divide by zero encountered in log
  time = numpy.log(time)
/media/san2_ssd/data/Workdir/survival/venv/lib/python3.8/site-packages/sksurv/ensemble/boosting.py:955: RuntimeWarning: divide by zero encountered in log
  time = numpy.log(time)
/media/san2_ssd/data/Workdir/survival/venv/lib/python3.8/site-packages/sksurv/ensemble/boosting.py:955: RuntimeWarning: divide by zero encountered in log
  time = numpy.log(time)
/media/san2_ssd/data/Workdir/survival/venv/lib/python3.8/site-packages/sksurv/ensemble/boosting.py:955: RuntimeWarning: divide by zero encountered in log
  time = numpy.log(time)
[32m[I 2022-04-21 22:55:01,458][0m Trial 730 finished with value: -0.46586172126087017 and parameters: {'loss': 'squared', 'learning_rate': 0.006141323661605884, 'n_estimators': 992, 'criterion': 'friedman_mse', 'min_samples_split': 2, 'min_samples_leaf': 9, 'min_weight_fraction_leaf': 0.0013377699364742653, 'min_impurity_decrease': 0.974300885033028, 'max_features': 0.3273739901829866, 'subsample': 0.36327999577878956, 'dropout_rate': 0.3351969290192536, 'ccp_alpha': 0.30629596710198104}. Best is trial 664 with value: 0.8342316538423719.[0m
[32m[I 2022-04-21 22:59:40,982][0m Trial 731 finished with value: 0.8305897452594632 and parameters: {'loss': 'coxph', 'learning_rate': 0.004656879468775676, 'n_estimators': 916, 'criterion': 'friedman_mse', 'min_samples_split': 2, 'min_samples_leaf': 8, 'min_weight_fraction_leaf': 0.017319252947422037, 'min_impurity_decrease': 0.9163212972425343, 'max_features': 0.25933529210244616, 'subsample': 0.3163408176646284, 'dropout_rate': 0.2718738365173117, 'ccp_alpha': 0.0035748982190218406}. Best is trial 664 with value: 0.8342316538423719.[0m
[32m[I 2022-04-21 23:03:47,288][0m Trial 732 finished with value: 0.25 and parameters: {'loss': 'coxph', 'learning_rate': 0.002946883439690098, 'n_estimators': 924, 'criterion': 'friedman_mse', 'min_samples_split': 2, 'min_samples_leaf': 8, 'min_weight_fraction_leaf': 0.01856563142165966, 'min_impurity_decrease': 0.9170087754315127, 'max_features': 0.2604596435125564, 'subsample': 0.34152357557834295, 'dropout_rate': 0.27293446818867184, 'ccp_alpha': 4.258886765282081}. Best is trial 664 with value: 0.8342316538423719.[0m
[32m[I 2022-04-21 23:07:28,748][0m Trial 733 finished with value: 0.8228434727549077 and parameters: {'loss': 'coxph', 'learning_rate': 0.0038926447743710384, 'n_estimators': 886, 'criterion': 'friedman_mse', 'min_samples_split': 2, 'min_samples_leaf': 8, 'min_weight_fraction_leaf': 0.02267882288606813, 'min_impurity_decrease': 0.8858620836400933, 'max_features': 0.27890367068078925, 'subsample': 0.3200662704922809, 'dropout_rate': 0.30625851780680746, 'ccp_alpha': 0.11277130440065555}. Best is trial 664 with value: 0.8342316538423719.[0m
[32m[I 2022-04-21 23:11:31,947][0m Trial 734 finished with value: 0.3684324971062085 and parameters: {'loss': 'coxph', 'learning_rate': 0.004531035710425352, 'n_estimators': 920, 'criterion': 'friedman_mse', 'min_samples_split': 2, 'min_samples_leaf': 8, 'min_weight_fraction_leaf': 0.011310537568278262, 'min_impurity_decrease': 0.9378102695312409, 'max_features': 0.23413381223115853, 'subsample': 0.36051739859894627, 'dropout_rate': 0.355416290587673, 'ccp_alpha': 0.22365970682921565}. Best is trial 664 with value: 0.8342316538423719.[0m
[32m[I 2022-04-21 23:16:16,074][0m Trial 735 finished with value: 0.8236723974794458 and parameters: {'loss': 'coxph', 'learning_rate': 0.0032983202565208813, 'n_estimators': 956, 'criterion': 'friedman_mse', 'min_samples_split': 2, 'min_samples_leaf': 8, 'min_weight_fraction_leaf': 0.03093313469822096, 'min_impurity_decrease': 0.9146466042086929, 'max_features': 0.2940624938629097, 'subsample': 0.3245465303759555, 'dropout_rate': 0.2763912467167683, 'ccp_alpha': 0.09488950643230953}. Best is trial 664 with value: 0.8342316538423719.[0m
[32m[I 2022-04-21 23:19:56,428][0m Trial 736 finished with value: 0.25 and parameters: {'loss': 'coxph', 'learning_rate': 0.004804358368526776, 'n_estimators': 861, 'criterion': 'friedman_mse', 'min_samples_split': 2, 'min_samples_leaf': 8, 'min_weight_fraction_leaf': 0.016573060996605955, 'min_impurity_decrease': 0.9511032191746854, 'max_features': 0.2577964905884486, 'subsample': 0.828193607503074, 'dropout_rate': 0.3985816114920548, 'ccp_alpha': 0.5771828030404667}. Best is trial 664 with value: 0.8342316538423719.[0m
[32m[I 2022-04-21 23:23:25,299][0m Trial 737 finished with value: 0.8230068753373907 and parameters: {'loss': 'coxph', 'learning_rate': 0.00801886018489192, 'n_estimators': 811, 'criterion': 'friedman_mse', 'min_samples_split': 2, 'min_samples_leaf': 8, 'min_weight_fraction_leaf': 0.021040314524311245, 'min_impurity_decrease': 0.8953596463800978, 'max_features': 0.27588759734423446, 'subsample': 0.34648539830848846, 'dropout_rate': 0.24332000669780784, 'ccp_alpha': 0.09864770905616967}. Best is trial 664 with value: 0.8342316538423719.[0m
[32m[I 2022-04-21 23:27:49,677][0m Trial 738 finished with value: 0.25886811916973224 and parameters: {'loss': 'coxph', 'learning_rate': 0.0038830318072868154, 'n_estimators': 888, 'criterion': 'friedman_mse', 'min_samples_split': 2, 'min_samples_leaf': 8, 'min_weight_fraction_leaf': 0.03127131242940681, 'min_impurity_decrease': 0.9381989387999197, 'max_features': 0.30600380663162885, 'subsample': 0.3626365799932856, 'dropout_rate': 0.30477254025183204, 'ccp_alpha': 0.25402088884920515}. Best is trial 664 with value: 0.8342316538423719.[0m
[32m[I 2022-04-21 23:33:09,841][0m Trial 739 finished with value: 0.8153556125429894 and parameters: {'loss': 'coxph', 'learning_rate': 0.006847908825225785, 'n_estimators': 960, 'criterion': 'friedman_mse', 'min_samples_split': 2, 'min_samples_leaf': 8, 'min_weight_fraction_leaf': 0.008281952702784591, 'min_impurity_decrease': 0.8736468457937883, 'max_features': 0.3383191363210923, 'subsample': 0.3168958781968654, 'dropout_rate': 0.2632859608980139, 'ccp_alpha': 0.15439009241672014}. Best is trial 664 with value: 0.8342316538423719.[0m
[32m[I 2022-04-21 23:39:49,620][0m Trial 740 finished with value: 0.8310558112066909 and parameters: {'loss': 'coxph', 'learning_rate': 0.005331422970052267, 'n_estimators': 998, 'criterion': 'friedman_mse', 'min_samples_split': 2, 'min_samples_leaf': 9, 'min_weight_fraction_leaf': 0.022670562359733394, 'min_impurity_decrease': 0.9652875325312645, 'max_features': 0.24952548202568814, 'subsample': 0.33450925277288734, 'dropout_rate': 0.17806164433700092, 'ccp_alpha': 0.00258049931980241}. Best is trial 664 with value: 0.8342316538423719.[0m
[32m[I 2022-04-21 23:45:12,012][0m Trial 741 finished with value: 0.25 and parameters: {'loss': 'coxph', 'learning_rate': 0.003967016072756455, 'n_estimators': 961, 'criterion': 'friedman_mse', 'min_samples_split': 2, 'min_samples_leaf': 9, 'min_weight_fraction_leaf': 0.00167339356822677, 'min_impurity_decrease': 0.9803691280435912, 'max_features': 0.20786088071227876, 'subsample': 0.3468370674283178, 'dropout_rate': 0.18166639842827753, 'ccp_alpha': 0.3594562613617258}. Best is trial 664 with value: 0.8342316538423719.[0m
