[32m[I 2022-04-21 20:40:19,625][0m Trial 856 finished with value: 0.8357052929158193 and parameters: {'alpha': 3.86453045593818, 'ties': 'breslow'}. Best is trial 70 with value: 0.835911286090736.[0m
[32m[I 2022-04-21 20:40:51,201][0m Trial 857 finished with value: 0.8355583611728576 and parameters: {'alpha': 3.6862603657026503, 'ties': 'breslow'}. Best is trial 70 with value: 0.835911286090736.[0m
[32m[I 2022-04-21 20:41:22,992][0m Trial 858 finished with value: 0.8354708558014249 and parameters: {'alpha': 3.9369544311251614, 'ties': 'efron'}. Best is trial 70 with value: 0.835911286090736.[0m
[32m[I 2022-04-21 20:41:53,092][0m Trial 859 finished with value: 0.8357914144599559 and parameters: {'alpha': 3.7947377171908028, 'ties': 'breslow'}. Best is trial 70 with value: 0.835911286090736.[0m
[32m[I 2022-04-21 20:42:24,331][0m Trial 860 finished with value: 0.8352854798157032 and parameters: {'alpha': 4.037310740520075, 'ties': 'breslow'}. Best is trial 70 with value: 0.835911286090736.[0m
[32m[I 2022-04-21 20:42:55,149][0m Trial 861 finished with value: 0.835519622180555 and parameters: {'alpha': 3.601291598530892, 'ties': 'breslow'}. Best is trial 70 with value: 0.835911286090736.[0m
[32m[I 2022-04-21 20:43:25,694][0m Trial 862 finished with value: 0.8356309209068851 and parameters: {'alpha': 3.8316660922764827, 'ties': 'breslow'}. Best is trial 70 with value: 0.835911286090736.[0m
[32m[I 2022-04-21 20:43:57,626][0m Trial 863 finished with value: 0.8355837673218096 and parameters: {'alpha': 3.42714224173071, 'ties': 'breslow'}. Best is trial 70 with value: 0.835911286090736.[0m
[32m[I 2022-04-21 20:44:27,450][0m Trial 864 finished with value: 0.8355583611728576 and parameters: {'alpha': 3.680704049151774, 'ties': 'breslow'}. Best is trial 70 with value: 0.835911286090736.[0m
[32m[I 2022-04-21 20:44:59,597][0m Trial 865 finished with value: 0.8356802696400418 and parameters: {'alpha': 3.7420724217613976, 'ties': 'breslow'}. Best is trial 70 with value: 0.835911286090736.[0m
[32m[I 2022-04-21 20:45:30,657][0m Trial 866 finished with value: 0.8356281582736811 and parameters: {'alpha': 3.908768022614263, 'ties': 'breslow'}. Best is trial 70 with value: 0.835911286090736.[0m
[32m[I 2022-04-21 20:46:02,785][0m Trial 867 finished with value: 0.8355193570680342 and parameters: {'alpha': 3.5565976574133042, 'ties': 'breslow'}. Best is trial 70 with value: 0.835911286090736.[0m
[32m[I 2022-04-21 20:46:34,881][0m Trial 868 finished with value: 0.8357123186578829 and parameters: {'alpha': 3.8110538978618154, 'ties': 'breslow'}. Best is trial 70 with value: 0.835911286090736.[0m
[32m[I 2022-04-21 20:47:06,175][0m Trial 869 finished with value: 0.8352036419513628 and parameters: {'alpha': 4.106565668878721, 'ties': 'breslow'}. Best is trial 70 with value: 0.835911286090736.[0m
[32m[I 2022-04-21 20:47:39,435][0m Trial 870 finished with value: 0.8351532900589449 and parameters: {'alpha': 4.461968667599602, 'ties': 'breslow'}. Best is trial 70 with value: 0.835911286090736.[0m
[32m[I 2022-04-21 20:48:12,505][0m Trial 871 finished with value: 0.8354049296341829 and parameters: {'alpha': 3.9684474445772597, 'ties': 'breslow'}. Best is trial 70 with value: 0.835911286090736.[0m
[32m[I 2022-04-21 20:48:44,721][0m Trial 872 finished with value: 0.8356396477177512 and parameters: {'alpha': 3.711723513775561, 'ties': 'breslow'}. Best is trial 70 with value: 0.835911286090736.[0m
[32m[I 2022-04-21 20:49:16,731][0m Trial 873 finished with value: 0.835519290914522 and parameters: {'alpha': 3.6147480693201515, 'ties': 'breslow'}. Best is trial 70 with value: 0.835911286090736.[0m
[32m[I 2022-04-21 20:49:47,224][0m Trial 874 finished with value: 0.8357052929158193 and parameters: {'alpha': 3.8615947342586048, 'ties': 'breslow'}. Best is trial 70 with value: 0.835911286090736.[0m
[32m[I 2022-04-21 20:50:18,936][0m Trial 875 finished with value: 0.8356379421473796 and parameters: {'alpha': 3.6996208312480516, 'ties': 'breslow'}. Best is trial 70 with value: 0.835911286090736.[0m
[32m[I 2022-04-21 20:50:50,589][0m Trial 876 finished with value: 0.8354264219312361 and parameters: {'alpha': 3.4919648312251534, 'ties': 'breslow'}. Best is trial 70 with value: 0.835911286090736.[0m
[32m[I 2022-04-21 20:51:23,025][0m Trial 877 finished with value: 0.8355907263972349 and parameters: {'alpha': 3.785680222656706, 'ties': 'efron'}. Best is trial 70 with value: 0.835911286090736.[0m
[32m[I 2022-04-21 20:51:53,329][0m Trial 878 finished with value: 0.8356374099959277 and parameters: {'alpha': 3.935112683467232, 'ties': 'breslow'}. Best is trial 70 with value: 0.835911286090736.[0m
[32m[I 2022-04-21 20:52:23,428][0m Trial 879 finished with value: 0.8357052929158193 and parameters: {'alpha': 3.862000875792439, 'ties': 'breslow'}. Best is trial 70 with value: 0.835911286090736.[0m
[32m[I 2022-04-21 20:52:55,574][0m Trial 880 finished with value: 0.8358336757991058 and parameters: {'alpha': 3.765225736842389, 'ties': 'breslow'}. Best is trial 70 with value: 0.835911286090736.[0m
[32m[I 2022-04-21 20:53:26,764][0m Trial 881 finished with value: 0.8350399762107896 and parameters: {'alpha': 3.2179715762787984, 'ties': 'breslow'}. Best is trial 70 with value: 0.835911286090736.[0m
[32m[I 2022-04-21 20:53:57,850][0m Trial 882 finished with value: 0.8354804857687071 and parameters: {'alpha': 3.628658243545311, 'ties': 'breslow'}. Best is trial 70 with value: 0.835911286090736.[0m
[32m[I 2022-04-21 20:54:27,246][0m Trial 883 finished with value: 0.8352095089409325 and parameters: {'alpha': 4.006309833436957, 'ties': 'breslow'}. Best is trial 70 with value: 0.835911286090736.[0m
[32m[I 2022-04-21 20:54:57,285][0m Trial 884 finished with value: 0.8357048077433703 and parameters: {'alpha': 3.853056408176728, 'ties': 'breslow'}. Best is trial 70 with value: 0.835911286090736.[0m
[32m[I 2022-04-21 20:55:28,382][0m Trial 885 finished with value: 0.8355991370015646 and parameters: {'alpha': 3.6919823023294893, 'ties': 'breslow'}. Best is trial 70 with value: 0.835911286090736.[0m
[32m[I 2022-04-21 20:55:58,252][0m Trial 886 finished with value: 0.8355572580224632 and parameters: {'alpha': 3.52845709053228, 'ties': 'breslow'}. Best is trial 70 with value: 0.835911286090736.[0m
[32m[I 2022-04-21 20:56:29,915][0m Trial 887 finished with value: 0.8353829464535926 and parameters: {'alpha': 3.3654354225688725, 'ties': 'breslow'}. Best is trial 70 with value: 0.835911286090736.[0m
[32m[I 2022-04-21 20:57:01,287][0m Trial 888 finished with value: 0.8358321902886627 and parameters: {'alpha': 3.780930189106209, 'ties': 'breslow'}. Best is trial 70 with value: 0.835911286090736.[0m
[32m[I 2022-04-21 20:57:36,113][0m Trial 889 finished with value: 0.8342443232521426 and parameters: {'alpha': 2.252450448918082, 'ties': 'breslow'}. Best is trial 70 with value: 0.835911286090736.[0m
[32m[I 2022-04-21 20:58:08,160][0m Trial 890 finished with value: 0.8355601075171306 and parameters: {'alpha': 3.939337156288059, 'ties': 'breslow'}. Best is trial 70 with value: 0.835911286090736.[0m
[32m[I 2022-04-21 20:58:42,352][0m Trial 891 finished with value: 0.8354787801983354 and parameters: {'alpha': 3.6349878117137924, 'ties': 'breslow'}. Best is trial 70 with value: 0.835911286090736.[0m
[32m[I 2022-04-21 20:59:14,896][0m Trial 892 finished with value: 0.8357567045863414 and parameters: {'alpha': 3.756270159316412, 'ties': 'breslow'}. Best is trial 70 with value: 0.835911286090736.[0m
[32m[I 2022-04-21 20:59:49,574][0m Trial 893 finished with value: 0.8357048077433703 and parameters: {'alpha': 3.851735430374555, 'ties': 'breslow'}. Best is trial 70 with value: 0.835911286090736.[0m
[32m[I 2022-04-21 21:00:22,155][0m Trial 894 finished with value: 0.8352419619247285 and parameters: {'alpha': 4.111288293507926, 'ties': 'breslow'}. Best is trial 70 with value: 0.835911286090736.[0m
[32m[I 2022-04-21 21:00:54,997][0m Trial 895 finished with value: 0.8354805519222193 and parameters: {'alpha': 3.5714157928168015, 'ties': 'breslow'}. Best is trial 70 with value: 0.835911286090736.[0m
[32m[I 2022-04-21 21:01:26,832][0m Trial 896 finished with value: 0.8355991370015646 and parameters: {'alpha': 3.696371627452942, 'ties': 'breslow'}. Best is trial 70 with value: 0.835911286090736.[0m
[32m[I 2022-04-21 21:01:58,237][0m Trial 897 finished with value: 0.83523146007024 and parameters: {'alpha': 4.330909818905534, 'ties': 'efron'}. Best is trial 70 with value: 0.835911286090736.[0m
[32m[I 2022-04-21 21:02:28,642][0m Trial 898 finished with value: 0.8351729822908422 and parameters: {'alpha': 3.9843397074770035, 'ties': 'breslow'}. Best is trial 70 with value: 0.835911286090736.[0m
[32m[I 2022-04-21 21:02:58,516][0m Trial 899 finished with value: 0.8356309209068851 and parameters: {'alpha': 3.8332960435511563, 'ties': 'breslow'}. Best is trial 70 with value: 0.835911286090736.[0m
[32m[I 2022-04-21 21:03:35,608][0m Trial 900 finished with value: 0.8329371502361413 and parameters: {'alpha': 1.2282352017532865, 'ties': 'breslow'}. Best is trial 70 with value: 0.835911286090736.[0m
[32m[I 2022-04-21 21:04:06,804][0m Trial 901 finished with value: 0.8355175853441505 and parameters: {'alpha': 3.6666215895856493, 'ties': 'breslow'}. Best is trial 70 with value: 0.835911286090736.[0m
[32m[I 2022-04-21 21:04:38,358][0m Trial 902 finished with value: 0.8355898383003153 and parameters: {'alpha': 3.9215073225752572, 'ties': 'breslow'}. Best is trial 70 with value: 0.835911286090736.[0m
[32m[I 2022-04-21 21:05:08,912][0m Trial 903 finished with value: 0.8358724809449208 and parameters: {'alpha': 3.7682578477104136, 'ties': 'breslow'}. Best is trial 70 with value: 0.835911286090736.[0m
[32m[I 2022-04-21 21:05:39,664][0m Trial 904 finished with value: 0.8357567045863414 and parameters: {'alpha': 3.756100555986342, 'ties': 'breslow'}. Best is trial 70 with value: 0.835911286090736.[0m
[32m[I 2022-04-21 21:06:10,641][0m Trial 905 finished with value: 0.8352854798157032 and parameters: {'alpha': 4.047047487220039, 'ties': 'breslow'}. Best is trial 70 with value: 0.835911286090736.[0m
[32m[I 2022-04-21 21:06:38,542][0m Trial 906 finished with value: 0.835519290914522 and parameters: {'alpha': 3.6210487912377602, 'ties': 'breslow'}. Best is trial 70 with value: 0.835911286090736.[0m
[32m[I 2022-04-21 21:07:07,390][0m Trial 907 finished with value: 0.8354683222292627 and parameters: {'alpha': 3.4799937683910294, 'ties': 'breslow'}. Best is trial 70 with value: 0.835911286090736.[0m
[32m[I 2022-04-21 21:07:35,674][0m Trial 908 finished with value: 0.8352486197880322 and parameters: {'alpha': 4.618981612699773, 'ties': 'breslow'}. Best is trial 70 with value: 0.835911286090736.[0m
[32m[I 2022-04-21 21:08:03,985][0m Trial 909 finished with value: 0.8357052929158193 and parameters: {'alpha': 3.8699295102711586, 'ties': 'breslow'}. Best is trial 70 with value: 0.835911286090736.[0m
[32m[I 2022-04-21 21:08:33,001][0m Trial 910 finished with value: 0.8355175853441505 and parameters: {'alpha': 3.6759649527405562, 'ties': 'breslow'}. Best is trial 70 with value: 0.835911286090736.[0m
[32m[I 2022-04-21 21:09:03,762][0m Trial 911 finished with value: 0.8356661565039716 and parameters: {'alpha': 3.8486722252343384, 'ties': 'breslow'}. Best is trial 70 with value: 0.835911286090736.[0m
[32m[I 2022-04-21 21:09:33,745][0m Trial 912 finished with value: 0.835558008307433 and parameters: {'alpha': 3.5472708675406897, 'ties': 'breslow'}. Best is trial 70 with value: 0.835911286090736.[0m
[32m[I 2022-04-21 21:10:03,730][0m Trial 913 finished with value: 0.8357567045863414 and parameters: {'alpha': 3.755233459994169, 'ties': 'breslow'}. Best is trial 70 with value: 0.835911286090736.[0m
[32m[I 2022-04-21 21:10:34,019][0m Trial 914 finished with value: 0.8354049296341829 and parameters: {'alpha': 3.957539009163043, 'ties': 'breslow'}. Best is trial 70 with value: 0.835911286090736.[0m
[32m[I 2022-04-21 21:11:03,898][0m Trial 915 finished with value: 0.8355991370015646 and parameters: {'alpha': 3.6918813131738277, 'ties': 'breslow'}. Best is trial 70 with value: 0.835911286090736.[0m
[32m[I 2022-04-21 21:11:33,863][0m Trial 916 finished with value: 0.835631502225942 and parameters: {'alpha': 3.8031207601122046, 'ties': 'efron'}. Best is trial 70 with value: 0.835911286090736.[0m
[32m[I 2022-04-21 21:12:02,622][0m Trial 917 finished with value: 0.8356281582736811 and parameters: {'alpha': 3.9079814962921984, 'ties': 'breslow'}. Best is trial 70 with value: 0.835911286090736.[0m
[32m[I 2022-04-21 21:12:33,249][0m Trial 918 finished with value: 0.8356802696400418 and parameters: {'alpha': 3.7448711281932217, 'ties': 'breslow'}. Best is trial 70 with value: 0.835911286090736.[0m
[32m[I 2022-04-21 21:13:04,437][0m Trial 919 finished with value: 0.8354805519222193 and parameters: {'alpha': 3.5901895905157546, 'ties': 'breslow'}. Best is trial 70 with value: 0.835911286090736.[0m
[32m[I 2022-04-21 21:13:34,304][0m Trial 920 finished with value: 0.8357052929158193 and parameters: {'alpha': 3.8688318172011207, 'ties': 'breslow'}. Best is trial 70 with value: 0.835911286090736.[0m
[32m[I 2022-04-21 21:14:05,291][0m Trial 921 finished with value: 0.8354036458761117 and parameters: {'alpha': 4.0860520458896445, 'ties': 'breslow'}. Best is trial 70 with value: 0.835911286090736.[0m
[32m[I 2022-04-21 21:14:33,535][0m Trial 922 finished with value: 0.8358321902886627 and parameters: {'alpha': 3.783776881044064, 'ties': 'breslow'}. Best is trial 70 with value: 0.835911286090736.[0m
[32m[I 2022-04-21 21:15:03,060][0m Trial 923 finished with value: 0.8354787801983354 and parameters: {'alpha': 3.651552242035934, 'ties': 'breslow'}. Best is trial 70 with value: 0.835911286090736.[0m
[32m[I 2022-04-21 21:15:32,249][0m Trial 924 finished with value: 0.8354049296341829 and parameters: {'alpha': 3.968491737052654, 'ties': 'breslow'}. Best is trial 70 with value: 0.835911286090736.[0m
[32m[I 2022-04-21 21:16:01,061][0m Trial 925 finished with value: 0.8354264219312361 and parameters: {'alpha': 3.499468111583948, 'ties': 'breslow'}. Best is trial 70 with value: 0.835911286090736.[0m
[32m[I 2022-04-21 21:16:32,027][0m Trial 926 finished with value: 0.8355991370015646 and parameters: {'alpha': 3.69662648335667, 'ties': 'breslow'}. Best is trial 70 with value: 0.835911286090736.[0m
[32m[I 2022-04-21 21:17:01,116][0m Trial 927 finished with value: 0.8356273513581567 and parameters: {'alpha': 3.8407401391035205, 'ties': 'breslow'}. Best is trial 70 with value: 0.835911286090736.[0m
[32m[I 2022-04-21 21:17:29,702][0m Trial 928 finished with value: 0.8355446970634739 and parameters: {'alpha': 3.4290238577314023, 'ties': 'breslow'}. Best is trial 70 with value: 0.835911286090736.[0m
[32m[I 2022-04-21 21:17:58,738][0m Trial 929 finished with value: 0.8352421608596676 and parameters: {'alpha': 4.191523870092016, 'ties': 'breslow'}. Best is trial 70 with value: 0.835911286090736.[0m
[32m[I 2022-04-21 21:18:27,610][0m Trial 930 finished with value: 0.8352116335302411 and parameters: {'alpha': 3.995606907594023, 'ties': 'breslow'}. Best is trial 70 with value: 0.835911286090736.[0m
[32m[I 2022-04-21 21:18:56,676][0m Trial 931 finished with value: 0.8354805519222193 and parameters: {'alpha': 3.5842403189012235, 'ties': 'breslow'}. Best is trial 70 with value: 0.835911286090736.[0m
[32m[I 2022-04-21 21:19:24,262][0m Trial 932 finished with value: 0.8356309209068851 and parameters: {'alpha': 3.831735033902526, 'ties': 'breslow'}. Best is trial 70 with value: 0.835911286090736.[0m
[32m[I 2022-04-21 21:19:53,731][0m Trial 933 finished with value: 0.8355175853441505 and parameters: {'alpha': 3.6733401695221035, 'ties': 'breslow'}. Best is trial 70 with value: 0.835911286090736.[0m
[32m[I 2022-04-21 21:20:24,807][0m Trial 934 finished with value: 0.8354708558014249 and parameters: {'alpha': 3.9197742221711027, 'ties': 'efron'}. Best is trial 70 with value: 0.835911286090736.[0m
[32m[I 2022-04-21 21:20:55,026][0m Trial 935 finished with value: 0.8357190747858569 and parameters: {'alpha': 3.7364993408769562, 'ties': 'breslow'}. Best is trial 70 with value: 0.835911286090736.[0m
[32m[I 2022-04-21 21:21:24,744][0m Trial 936 finished with value: 0.835911286090736 and parameters: {'alpha': 3.7758030382603427, 'ties': 'breslow'}. Best is trial 70 with value: 0.835911286090736.[0m
[32m[I 2022-04-21 21:22:04,230][0m Trial 937 finished with value: 0.8333093603146999 and parameters: {'alpha': 1.5458875792865854, 'ties': 'breslow'}. Best is trial 70 with value: 0.835911286090736.[0m
[32m[I 2022-04-21 21:22:36,599][0m Trial 938 finished with value: 0.8348961562840007 and parameters: {'alpha': 2.7007528016910913, 'ties': 'breslow'}. Best is trial 70 with value: 0.835911286090736.[0m
[32m[I 2022-04-21 21:23:06,588][0m Trial 939 finished with value: 0.8354805519222193 and parameters: {'alpha': 3.5892023371684196, 'ties': 'breslow'}. Best is trial 70 with value: 0.835911286090736.[0m
[32m[I 2022-04-21 21:23:36,597][0m Trial 940 finished with value: 0.8353262556444102 and parameters: {'alpha': 4.031921603442567, 'ties': 'breslow'}. Best is trial 70 with value: 0.835911286090736.[0m
[32m[I 2022-04-21 21:24:07,151][0m Trial 941 finished with value: 0.8357506386312487 and parameters: {'alpha': 3.799698060878989, 'ties': 'breslow'}. Best is trial 70 with value: 0.835911286090736.[0m
[32m[I 2022-04-21 21:24:38,257][0m Trial 942 finished with value: 0.8356281582736811 and parameters: {'alpha': 3.895298662889089, 'ties': 'breslow'}. Best is trial 70 with value: 0.835911286090736.[0m
[32m[I 2022-04-21 21:25:10,949][0m Trial 943 finished with value: 0.8358705102620287 and parameters: {'alpha': 3.7791513602105518, 'ties': 'breslow'}. Best is trial 70 with value: 0.835911286090736.[0m
[32m[I 2022-04-21 21:25:43,481][0m Trial 944 finished with value: 0.8355583611728576 and parameters: {'alpha': 3.677983936016392, 'ties': 'breslow'}. Best is trial 70 with value: 0.835911286090736.[0m
[32m[I 2022-04-21 21:26:16,974][0m Trial 945 finished with value: 0.8356281582736811 and parameters: {'alpha': 3.9009159946280776, 'ties': 'breslow'}. Best is trial 70 with value: 0.835911286090736.[0m
[32m[I 2022-04-21 21:26:49,542][0m Trial 946 finished with value: 0.8356802696400418 and parameters: {'alpha': 3.739432953622414, 'ties': 'breslow'}. Best is trial 70 with value: 0.835911286090736.[0m
[32m[I 2022-04-21 21:27:19,557][0m Trial 947 finished with value: 0.8354787801983354 and parameters: {'alpha': 3.6537833569093294, 'ties': 'breslow'}. Best is trial 70 with value: 0.835911286090736.[0m
[32m[I 2022-04-21 21:27:54,239][0m Trial 948 finished with value: 0.8337201867528389 and parameters: {'alpha': 1.940348973466803, 'ties': 'breslow'}. Best is trial 70 with value: 0.835911286090736.[0m
[32m[I 2022-04-21 21:28:24,849][0m Trial 949 finished with value: 0.8351711889675666 and parameters: {'alpha': 4.020668668136887, 'ties': 'breslow'}. Best is trial 70 with value: 0.835911286090736.[0m
[32m[I 2022-04-21 21:28:55,419][0m Trial 950 finished with value: 0.8355193570680342 and parameters: {'alpha': 3.5545236887142306, 'ties': 'breslow'}. Best is trial 70 with value: 0.835911286090736.[0m
[32m[I 2022-04-21 21:29:29,460][0m Trial 951 finished with value: 0.8347669713442547 and parameters: {'alpha': 2.4745189178801335, 'ties': 'breslow'}. Best is trial 70 with value: 0.835911286090736.[0m
[32m[I 2022-04-21 21:30:00,433][0m Trial 952 finished with value: 0.8356715428291757 and parameters: {'alpha': 3.816954469177511, 'ties': 'breslow'}. Best is trial 70 with value: 0.835911286090736.[0m
[32m[I 2022-04-21 21:30:31,592][0m Trial 953 finished with value: 0.8356802696400418 and parameters: {'alpha': 3.74496135388981, 'ties': 'breslow'}. Best is trial 70 with value: 0.835911286090736.[0m
[32m[I 2022-04-21 21:31:03,572][0m Trial 954 finished with value: 0.8356281582736811 and parameters: {'alpha': 3.8964893309410686, 'ties': 'breslow'}. Best is trial 70 with value: 0.835911286090736.[0m
[32m[I 2022-04-21 21:31:36,426][0m Trial 955 finished with value: 0.8355017687250015 and parameters: {'alpha': 3.3959644067830626, 'ties': 'efron'}. Best is trial 70 with value: 0.835911286090736.[0m
[32m[I 2022-04-21 21:32:07,144][0m Trial 956 finished with value: 0.835519622180555 and parameters: {'alpha': 3.6020650982607534, 'ties': 'breslow'}. Best is trial 70 with value: 0.835911286090736.[0m
[32m[I 2022-04-21 21:32:39,384][0m Trial 957 finished with value: 0.8356661565039716 and parameters: {'alpha': 3.844247828562172, 'ties': 'breslow'}. Best is trial 70 with value: 0.835911286090736.[0m
[32m[I 2022-04-21 21:33:09,017][0m Trial 958 finished with value: 0.8352033768388424 and parameters: {'alpha': 4.133264886751693, 'ties': 'breslow'}. Best is trial 70 with value: 0.835911286090736.[0m
[32m[I 2022-04-21 21:33:39,867][0m Trial 959 finished with value: 0.8356379421473796 and parameters: {'alpha': 3.701628592738627, 'ties': 'breslow'}. Best is trial 70 with value: 0.835911286090736.[0m
[32m[I 2022-04-21 21:34:11,406][0m Trial 960 finished with value: 0.8351729822908422 and parameters: {'alpha': 3.9826782047195124, 'ties': 'breslow'}. Best is trial 70 with value: 0.835911286090736.[0m
[32m[I 2022-04-21 21:34:42,648][0m Trial 961 finished with value: 0.8354264219312361 and parameters: {'alpha': 3.5022732300608284, 'ties': 'breslow'}. Best is trial 70 with value: 0.835911286090736.[0m
[32m[I 2022-04-21 21:35:12,808][0m Trial 962 finished with value: 0.8356309209068851 and parameters: {'alpha': 3.832247694535335, 'ties': 'breslow'}. Best is trial 70 with value: 0.835911286090736.[0m
