[32m[I 2022-04-21 16:24:21,163][0m Trial 592 finished with value: 0.25 and parameters: {'loss': 'coxph', 'learning_rate': 0.023433665566690215, 'n_estimators': 625, 'criterion': 'friedman_mse', 'min_samples_split': 2, 'min_samples_leaf': 4, 'min_weight_fraction_leaf': 0.05455302890741243, 'min_impurity_decrease': 0.48243158240151457, 'max_features': 0.5147727433895484, 'subsample': 0.4695055861300318, 'dropout_rate': 0.9396942681604658, 'ccp_alpha': 4.00661549611014}. Best is trial 486 with value: 0.8320137528916117.[0m
[32m[I 2022-04-21 16:25:12,815][0m Trial 593 finished with value: 0.8234177022768752 and parameters: {'loss': 'coxph', 'learning_rate': 0.005874065025474801, 'n_estimators': 719, 'criterion': 'friedman_mse', 'min_samples_split': 2, 'min_samples_leaf': 4, 'min_weight_fraction_leaf': 0.09067686642573866, 'min_impurity_decrease': 0.4621347655006832, 'max_features': 0.4377594978078126, 'subsample': 0.3940214389755452, 'dropout_rate': 0.9070551084326106, 'ccp_alpha': 0.09659645033510918}. Best is trial 486 with value: 0.8320137528916117.[0m
[32m[I 2022-04-21 16:25:49,886][0m Trial 594 finished with value: 0.6981353577851208 and parameters: {'loss': 'coxph', 'learning_rate': 0.010680107782334317, 'n_estimators': 680, 'criterion': 'friedman_mse', 'min_samples_split': 8, 'min_samples_leaf': 5, 'min_weight_fraction_leaf': 0.06503793613309469, 'min_impurity_decrease': 0.49606779846816385, 'max_features': 0.5324711229441182, 'subsample': 0.3544039992255655, 'dropout_rate': 0.9560367400823299, 'ccp_alpha': 0.17469357734724758}. Best is trial 486 with value: 0.8320137528916117.[0m
[32m[I 2022-04-21 16:26:18,738][0m Trial 595 finished with value: 0.8281799943568547 and parameters: {'loss': 'coxph', 'learning_rate': 0.007009566624428807, 'n_estimators': 595, 'criterion': 'friedman_mse', 'min_samples_split': 2, 'min_samples_leaf': 4, 'min_weight_fraction_leaf': 0.08260867175527334, 'min_impurity_decrease': 0.42577206507282744, 'max_features': 0.4759311838860919, 'subsample': 0.4279754877166486, 'dropout_rate': 0.9342621081082279, 'ccp_alpha': 0.00192703455339931}. Best is trial 486 with value: 0.8320137528916117.[0m
[32m[I 2022-04-21 16:26:43,776][0m Trial 596 finished with value: 0.3724450853015603 and parameters: {'loss': 'coxph', 'learning_rate': 0.008585529883627893, 'n_estimators': 644, 'criterion': 'friedman_mse', 'min_samples_split': 2, 'min_samples_leaf': 4, 'min_weight_fraction_leaf': 0.046960543066931724, 'min_impurity_decrease': 0.45069301770158343, 'max_features': 0.5625142988760694, 'subsample': 0.31235099724259485, 'dropout_rate': 0.9789364841436039, 'ccp_alpha': 0.24650398454571776}. Best is trial 486 with value: 0.8320137528916117.[0m
[32m[I 2022-04-21 16:27:17,564][0m Trial 597 finished with value: 0.8287941879009406 and parameters: {'loss': 'coxph', 'learning_rate': 0.01788912331036023, 'n_estimators': 546, 'criterion': 'friedman_mse', 'min_samples_split': 2, 'min_samples_leaf': 4, 'min_weight_fraction_leaf': 0.09885966913051572, 'min_impurity_decrease': 0.4748332016200454, 'max_features': 0.2995703057554099, 'subsample': 0.5022672686662811, 'dropout_rate': 0.9228416074837845, 'ccp_alpha': 0.10170449902190057}. Best is trial 486 with value: 0.8320137528916117.[0m
[32m[I 2022-04-21 16:27:39,927][0m Trial 598 finished with value: 0.8281496079431021 and parameters: {'loss': 'coxph', 'learning_rate': 0.04402165338097106, 'n_estimators': 708, 'criterion': 'friedman_mse', 'min_samples_split': 2, 'min_samples_leaf': 6, 'min_weight_fraction_leaf': 0.022956036076555865, 'min_impurity_decrease': 0.5295801475434194, 'max_features': 0.5009650106125008, 'subsample': 0.44547609837858787, 'dropout_rate': 0.9980177612367982, 'ccp_alpha': 0.00533306726586838}. Best is trial 486 with value: 0.8320137528916117.[0m
[32m[I 2022-04-21 16:28:06,503][0m Trial 599 finished with value: 0.8291043924135819 and parameters: {'loss': 'coxph', 'learning_rate': 0.012751804278596427, 'n_estimators': 612, 'criterion': 'friedman_mse', 'min_samples_split': 2, 'min_samples_leaf': 5, 'min_weight_fraction_leaf': 0.061752496643994625, 'min_impurity_decrease': 0.4961948387978989, 'max_features': 0.6196344972528074, 'subsample': 0.37712658034776014, 'dropout_rate': 0.9622179817338912, 'ccp_alpha': 0.0024918636742712903}. Best is trial 486 with value: 0.8320137528916117.[0m
[32m[I 2022-04-21 16:28:32,778][0m Trial 600 finished with value: 0.48697740920673516 and parameters: {'loss': 'coxph', 'learning_rate': 0.011286538629535504, 'n_estimators': 611, 'criterion': 'friedman_mse', 'min_samples_split': 2, 'min_samples_leaf': 4, 'min_weight_fraction_leaf': 0.05444022743890573, 'min_impurity_decrease': 0.5060011016418464, 'max_features': 0.6268927199917993, 'subsample': 0.39917012650536526, 'dropout_rate': 0.9707470685797711, 'ccp_alpha': 0.1625252474344589}. Best is trial 486 with value: 0.8320137528916117.[0m
[32m[I 2022-04-21 16:28:59,639][0m Trial 601 finished with value: 0.25 and parameters: {'loss': 'coxph', 'learning_rate': 0.009013333363335598, 'n_estimators': 576, 'criterion': 'friedman_mse', 'min_samples_split': 2, 'min_samples_leaf': 4, 'min_weight_fraction_leaf': 0.03890621323663791, 'min_impurity_decrease': 0.5899637975192279, 'max_features': 0.6179132555063548, 'subsample': 0.4216489178312921, 'dropout_rate': 0.96689916676608, 'ccp_alpha': 0.8336111286531496}. Best is trial 486 with value: 0.8320137528916117.[0m
[32m[I 2022-04-21 16:29:35,918][0m Trial 602 finished with value: 0.25 and parameters: {'loss': 'coxph', 'learning_rate': 0.013140137987497092, 'n_estimators': 613, 'criterion': 'friedman_mse', 'min_samples_split': 2, 'min_samples_leaf': 5, 'min_weight_fraction_leaf': 0.062423058494934305, 'min_impurity_decrease': 0.5492810001657633, 'max_features': 0.6062849693609129, 'subsample': 0.4587814182559499, 'dropout_rate': 0.9042524761649178, 'ccp_alpha': 0.3117009981059044}. Best is trial 486 with value: 0.8320137528916117.[0m
[32m[I 2022-04-21 16:29:52,895][0m Trial 603 finished with value: 0.8213197178765878 and parameters: {'loss': 'coxph', 'learning_rate': 0.005852483636278123, 'n_estimators': 552, 'criterion': 'friedman_mse', 'min_samples_split': 2, 'min_samples_leaf': 4, 'min_weight_fraction_leaf': 0.048357534067922606, 'min_impurity_decrease': 0.44107543169733326, 'max_features': 0.6326745987541778, 'subsample': 0.32350165424495475, 'dropout_rate': 0.9836124643538077, 'ccp_alpha': 0.11613085370717376}. Best is trial 486 with value: 0.8320137528916117.[0m
[32m[I 2022-04-21 16:30:04,040][0m Trial 604 finished with value: 0.8276874615778282 and parameters: {'loss': 'coxph', 'learning_rate': 0.008723506324846942, 'n_estimators': 589, 'criterion': 'friedman_mse', 'min_samples_split': 2, 'min_samples_leaf': 4, 'min_weight_fraction_leaf': 0.05962338982901773, 'min_impurity_decrease': 0.52327289128703, 'max_features': 0.3465689664595786, 'subsample': 0.39180272021646567, 'dropout_rate': 0.9987048856298419, 'ccp_alpha': 0.11550208838115221}. Best is trial 486 with value: 0.8320137528916117.[0m
[32m[I 2022-04-21 16:30:31,750][0m Trial 605 finished with value: 0.2651685646512371 and parameters: {'loss': 'coxph', 'learning_rate': 0.01246613884754387, 'n_estimators': 643, 'criterion': 'friedman_mse', 'min_samples_split': 2, 'min_samples_leaf': 5, 'min_weight_fraction_leaf': 0.07145301050934712, 'min_impurity_decrease': 0.5003086267296695, 'max_features': 0.6187788831420198, 'subsample': 0.43623773252096093, 'dropout_rate': 0.9467784656789852, 'ccp_alpha': 0.24137193885529762}. Best is trial 486 with value: 0.8320137528916117.[0m
[32m[I 2022-04-21 16:31:03,583][0m Trial 606 finished with value: 0.8265706918907083 and parameters: {'loss': 'coxph', 'learning_rate': 0.007749283479958588, 'n_estimators': 526, 'criterion': 'friedman_mse', 'min_samples_split': 2, 'min_samples_leaf': 4, 'min_weight_fraction_leaf': 0.03863785421827245, 'min_impurity_decrease': 0.46566787893708, 'max_features': 0.4235870974496892, 'subsample': 0.3594992540078074, 'dropout_rate': 0.9234811103189466, 'ccp_alpha': 0.0993268111092078}. Best is trial 486 with value: 0.8320137528916117.[0m
[32m[I 2022-04-21 16:31:27,986][0m Trial 607 finished with value: 0.25 and parameters: {'loss': 'coxph', 'learning_rate': 0.027020140451979233, 'n_estimators': 616, 'criterion': 'friedman_mse', 'min_samples_split': 2, 'min_samples_leaf': 4, 'min_weight_fraction_leaf': 0.05222172025573073, 'min_impurity_decrease': 0.4879184110454505, 'max_features': 0.44928081883348403, 'subsample': 0.4128339167047933, 'dropout_rate': 0.9611567070297208, 'ccp_alpha': 3.0528732703976624}. Best is trial 486 with value: 0.8320137528916117.[0m
[32m[I 2022-04-21 16:31:50,202][0m Trial 608 finished with value: 0.8235672449634326 and parameters: {'loss': 'coxph', 'learning_rate': 0.0052376824417820255, 'n_estimators': 570, 'criterion': 'friedman_mse', 'min_samples_split': 2, 'min_samples_leaf': 5, 'min_weight_fraction_leaf': 0.06461892880780785, 'min_impurity_decrease': 0.5232658211718915, 'max_features': 0.6359549328716406, 'subsample': 0.243211497257084, 'dropout_rate': 0.942342361582077, 'ccp_alpha': 0.10022839712146658}. Best is trial 486 with value: 0.8320137528916117.[0m
/media/san2_ssd/data/Workdir/survival/venv/lib/python3.8/site-packages/sksurv/ensemble/boosting.py:955: RuntimeWarning: divide by zero encountered in log
  time = numpy.log(time)
/media/san2_ssd/data/Workdir/survival/venv/lib/python3.8/site-packages/sksurv/ensemble/boosting.py:955: RuntimeWarning: divide by zero encountered in log
  time = numpy.log(time)
/media/san2_ssd/data/Workdir/survival/venv/lib/python3.8/site-packages/sksurv/ensemble/boosting.py:955: RuntimeWarning: divide by zero encountered in log
  time = numpy.log(time)
/media/san2_ssd/data/Workdir/survival/venv/lib/python3.8/site-packages/sksurv/ensemble/boosting.py:955: RuntimeWarning: divide by zero encountered in log
  time = numpy.log(time)
[32m[I 2022-04-21 16:31:55,433][0m Trial 609 finished with value: -0.4629572693532982 and parameters: {'loss': 'squared', 'learning_rate': 0.011166034676387835, 'n_estimators': 659, 'criterion': 'friedman_mse', 'min_samples_split': 2, 'min_samples_leaf': 4, 'min_weight_fraction_leaf': 0.07410703592182971, 'min_impurity_decrease': 0.4328151735673448, 'max_features': 0.5886450568883428, 'subsample': 0.08894275802267967, 'dropout_rate': 0.977118372514773, 'ccp_alpha': 0.005310213425154992}. Best is trial 486 with value: 0.8320137528916117.[0m
[32m[I 2022-04-21 16:32:36,430][0m Trial 610 finished with value: 0.25 and parameters: {'loss': 'coxph', 'learning_rate': 0.015018151371479936, 'n_estimators': 636, 'criterion': 'squared_error', 'min_samples_split': 2, 'min_samples_leaf': 5, 'min_weight_fraction_leaf': 0.03477082609925587, 'min_impurity_decrease': 0.45935830038926556, 'max_features': 0.4085399227048117, 'subsample': 0.4912439442350436, 'dropout_rate': 0.9035332326581347, 'ccp_alpha': 0.20145333446490463}. Best is trial 486 with value: 0.8320137528916117.[0m
[32m[I 2022-04-21 16:33:01,241][0m Trial 611 finished with value: 0.25 and parameters: {'loss': 'coxph', 'learning_rate': 0.01961953547902292, 'n_estimators': 587, 'criterion': 'friedman_mse', 'min_samples_split': 2, 'min_samples_leaf': 4, 'min_weight_fraction_leaf': 0.059125613949607955, 'min_impurity_decrease': 0.8112550813150159, 'max_features': 0.4824810420660271, 'subsample': 0.3810872391682585, 'dropout_rate': 0.9577314821177485, 'ccp_alpha': 3.646900745728795}. Best is trial 486 with value: 0.8320137528916117.[0m
[32m[I 2022-04-21 16:33:30,720][0m Trial 612 finished with value: 0.25 and parameters: {'loss': 'coxph', 'learning_rate': 0.007003569065632728, 'n_estimators': 505, 'criterion': 'absolute_error', 'min_samples_split': 2, 'min_samples_leaf': 4, 'min_weight_fraction_leaf': 0.06834946230827077, 'min_impurity_decrease': 0.5058892597343828, 'max_features': 0.6056357454691124, 'subsample': 0.3385825786912523, 'dropout_rate': 0.9380374388317347, 'ccp_alpha': 0.005847204728848518}. Best is trial 486 with value: 0.8320137528916117.[0m
[32m[I 2022-04-21 16:33:53,371][0m Trial 613 finished with value: 0.2503270102305002 and parameters: {'loss': 'coxph', 'learning_rate': 0.009514709365704891, 'n_estimators': 554, 'criterion': 'friedman_mse', 'min_samples_split': 2, 'min_samples_leaf': 5, 'min_weight_fraction_leaf': 0.04619847042715395, 'min_impurity_decrease': 0.4756825125659715, 'max_features': 0.575012612403857, 'subsample': 0.3068571466164312, 'dropout_rate': 0.9816578327189498, 'ccp_alpha': 0.3681598880171883}. Best is trial 486 with value: 0.8320137528916117.[0m
[32m[I 2022-04-21 16:34:33,852][0m Trial 614 finished with value: 0.4829456026092102 and parameters: {'loss': 'coxph', 'learning_rate': 0.013706289693822817, 'n_estimators': 676, 'criterion': 'friedman_mse', 'min_samples_split': 2, 'min_samples_leaf': 4, 'min_weight_fraction_leaf': 0.050500458576552346, 'min_impurity_decrease': 0.4217669236111767, 'max_features': 0.6293244528048549, 'subsample': 0.4069139382584062, 'dropout_rate': 0.9202247925202117, 'ccp_alpha': 0.18340931041629688}. Best is trial 486 with value: 0.8320137528916117.[0m
[32m[I 2022-04-21 16:34:58,941][0m Trial 615 finished with value: 0.8308088125260384 and parameters: {'loss': 'coxph', 'learning_rate': 0.03435744573698704, 'n_estimators': 602, 'criterion': 'friedman_mse', 'min_samples_split': 2, 'min_samples_leaf': 4, 'min_weight_fraction_leaf': 0.06196075991257793, 'min_impurity_decrease': 0.5408691466514409, 'max_features': 0.36053377321798336, 'subsample': 0.37480868011772855, 'dropout_rate': 0.9629022888660059, 'ccp_alpha': 0.0014785378946877504}. Best is trial 486 with value: 0.8320137528916117.[0m
[32m[I 2022-04-21 16:35:29,854][0m Trial 616 finished with value: 0.8257762339354302 and parameters: {'loss': 'coxph', 'learning_rate': 0.05741646726182294, 'n_estimators': 632, 'criterion': 'friedman_mse', 'min_samples_split': 2, 'min_samples_leaf': 5, 'min_weight_fraction_leaf': 0.07776764960601845, 'min_impurity_decrease': 0.5317892136675872, 'max_features': 0.3554239339554568, 'subsample': 0.3522244849148308, 'dropout_rate': 0.9683948472777955, 'ccp_alpha': 0.10015787140375614}. Best is trial 486 with value: 0.8320137528916117.[0m
[32m[I 2022-04-21 16:35:51,525][0m Trial 617 finished with value: 0.8240106677293365 and parameters: {'loss': 'coxph', 'learning_rate': 0.06868634616651074, 'n_estimators': 739, 'criterion': 'friedman_mse', 'min_samples_split': 2, 'min_samples_leaf': 4, 'min_weight_fraction_leaf': 0.06635830411143351, 'min_impurity_decrease': 0.5517214674797863, 'max_features': 0.34331573265662274, 'subsample': 0.3750247518298313, 'dropout_rate': 0.9970103302960791, 'ccp_alpha': 0.09939964558140346}. Best is trial 486 with value: 0.8320137528916117.[0m
[32m[I 2022-04-21 16:36:11,403][0m Trial 618 finished with value: 0.2503270102305002 and parameters: {'loss': 'coxph', 'learning_rate': 0.08447371642071236, 'n_estimators': 673, 'criterion': 'friedman_mse', 'min_samples_split': 2, 'min_samples_leaf': 4, 'min_weight_fraction_leaf': 0.08633197560204789, 'min_impurity_decrease': 0.010768960157461704, 'max_features': 0.356747969962717, 'subsample': 0.3702581962135352, 'dropout_rate': 0.9990302451122907, 'ccp_alpha': 0.2935417278654606}. Best is trial 486 with value: 0.8320137528916117.[0m
[32m[I 2022-04-21 16:36:17,700][0m Trial 619 finished with value: 0.26653982582691116 and parameters: {'loss': 'coxph', 'learning_rate': 0.04543992125423757, 'n_estimators': 213, 'criterion': 'friedman_mse', 'min_samples_split': 2, 'min_samples_leaf': 5, 'min_weight_fraction_leaf': 0.07625375716347779, 'min_impurity_decrease': 0.5075251861669688, 'max_features': 0.37533733308274325, 'subsample': 0.38844570995770095, 'dropout_rate': 0.9650655349571804, 'ccp_alpha': 0.18759666068920133}. Best is trial 486 with value: 0.8320137528916117.[0m
[32m[I 2022-04-21 16:36:44,690][0m Trial 620 finished with value: 0.8311275455495892 and parameters: {'loss': 'coxph', 'learning_rate': 0.006759710326940264, 'n_estimators': 614, 'criterion': 'friedman_mse', 'min_samples_split': 2, 'min_samples_leaf': 4, 'min_weight_fraction_leaf': 0.061938256746366674, 'min_impurity_decrease': 0.48650638682852315, 'max_features': 0.3138541441431493, 'subsample': 0.3263570821836248, 'dropout_rate': 0.9820985902005193, 'ccp_alpha': 0.0023595958427443404}. Best is trial 486 with value: 0.8320137528916117.[0m
[32m[I 2022-04-21 16:37:10,513][0m Trial 621 finished with value: 0.8259630613695512 and parameters: {'loss': 'coxph', 'learning_rate': 0.005666348971224766, 'n_estimators': 606, 'criterion': 'friedman_mse', 'min_samples_split': 2, 'min_samples_leaf': 6, 'min_weight_fraction_leaf': 0.09421416410966191, 'min_impurity_decrease': 0.5283099821384936, 'max_features': 0.3484318235610251, 'subsample': 0.328304292223598, 'dropout_rate': 0.9842384664064967, 'ccp_alpha': 0.08898937866348243}. Best is trial 486 with value: 0.8320137528916117.[0m
[32m[I 2022-04-21 16:38:06,991][0m Trial 622 finished with value: 0.26533429437348965 and parameters: {'loss': 'coxph', 'learning_rate': 0.0065652326241754785, 'n_estimators': 804, 'criterion': 'friedman_mse', 'min_samples_split': 2, 'min_samples_leaf': 4, 'min_weight_fraction_leaf': 0.07090841042719523, 'min_impurity_decrease': 0.49249819404103073, 'max_features': 0.3572340218264248, 'subsample': 0.31584864824856385, 'dropout_rate': 0.9491743940628513, 'ccp_alpha': 0.24727790114021206}. Best is trial 486 with value: 0.8320137528916117.[0m
[32m[I 2022-04-21 16:38:26,060][0m Trial 623 finished with value: 0.8292357856597018 and parameters: {'loss': 'coxph', 'learning_rate': 0.007246615647092128, 'n_estimators': 647, 'criterion': 'friedman_mse', 'min_samples_split': 2, 'min_samples_leaf': 5, 'min_weight_fraction_leaf': 0.08387164010876552, 'min_impurity_decrease': 0.9949089375992657, 'max_features': 0.33879103678367134, 'subsample': 0.34175690840527095, 'dropout_rate': 0.9998212508552093, 'ccp_alpha': 0.0023090344827536844}. Best is trial 486 with value: 0.8320137528916117.[0m
[32m[I 2022-04-21 16:38:47,920][0m Trial 624 finished with value: 0.8267707068796077 and parameters: {'loss': 'coxph', 'learning_rate': 0.007702257442217676, 'n_estimators': 640, 'criterion': 'friedman_mse', 'min_samples_split': 7, 'min_samples_leaf': 5, 'min_weight_fraction_leaf': 0.08855681378301289, 'min_impurity_decrease': 0.5363894661465147, 'max_features': 0.28453177103963756, 'subsample': 0.3384481523914218, 'dropout_rate': 0.9968192405119527, 'ccp_alpha': 0.09235095523635044}. Best is trial 486 with value: 0.8320137528916117.[0m
[32m[I 2022-04-21 16:39:08,311][0m Trial 625 finished with value: 0.8074573258230409 and parameters: {'loss': 'coxph', 'learning_rate': 0.009035466942178782, 'n_estimators': 621, 'criterion': 'friedman_mse', 'min_samples_split': 2, 'min_samples_leaf': 5, 'min_weight_fraction_leaf': 0.10247375424306068, 'min_impurity_decrease': 0.17046658201227693, 'max_features': 0.29304819304007096, 'subsample': 0.3168798580341975, 'dropout_rate': 0.983834465116273, 'ccp_alpha': 0.17561206786918235}. Best is trial 486 with value: 0.8320137528916117.[0m
[32m[I 2022-04-21 16:39:28,032][0m Trial 626 finished with value: 0.8252929235226649 and parameters: {'loss': 'coxph', 'learning_rate': 0.007045095846766406, 'n_estimators': 667, 'criterion': 'friedman_mse', 'min_samples_split': 2, 'min_samples_leaf': 5, 'min_weight_fraction_leaf': 0.08410411304597998, 'min_impurity_decrease': 0.9900316196636805, 'max_features': 0.31197360817108344, 'subsample': 0.34233068281998724, 'dropout_rate': 0.9993257851895404, 'ccp_alpha': 0.09945449045992907}. Best is trial 486 with value: 0.8320137528916117.[0m
[32m[I 2022-04-21 16:42:17,716][0m Trial 627 finished with value: 0.83015326780605 and parameters: {'loss': 'coxph', 'learning_rate': 0.009965013409408087, 'n_estimators': 647, 'criterion': 'friedman_mse', 'min_samples_split': 2, 'min_samples_leaf': 5, 'min_weight_fraction_leaf': 0.05951401526853621, 'min_impurity_decrease': 0.8995403680951229, 'max_features': 0.3130142402982253, 'subsample': 0.3238311897332251, 'dropout_rate': 0.2897190437551931, 'ccp_alpha': 0.0032401664404335777}. Best is trial 486 with value: 0.8320137528916117.[0m
[32m[I 2022-04-21 16:42:31,811][0m Trial 628 finished with value: 0.25 and parameters: {'loss': 'coxph', 'learning_rate': 0.009672981137950324, 'n_estimators': 187, 'criterion': 'friedman_mse', 'min_samples_split': 2, 'min_samples_leaf': 5, 'min_weight_fraction_leaf': 0.03096040295862769, 'min_impurity_decrease': 0.9912192780670509, 'max_features': 0.31716716599798356, 'subsample': 0.33580259863785894, 'dropout_rate': 0.2480781627283713, 'ccp_alpha': 0.5134227362609194}. Best is trial 486 with value: 0.8320137528916117.[0m
/media/san2_ssd/data/Workdir/survival/venv/lib/python3.8/site-packages/sksurv/ensemble/boosting.py:955: RuntimeWarning: divide by zero encountered in log
  time = numpy.log(time)
/media/san2_ssd/data/Workdir/survival/venv/lib/python3.8/site-packages/sksurv/ensemble/boosting.py:955: RuntimeWarning: divide by zero encountered in log
  time = numpy.log(time)
/media/san2_ssd/data/Workdir/survival/venv/lib/python3.8/site-packages/sksurv/ensemble/boosting.py:955: RuntimeWarning: divide by zero encountered in log
  time = numpy.log(time)
/media/san2_ssd/data/Workdir/survival/venv/lib/python3.8/site-packages/sksurv/ensemble/boosting.py:955: RuntimeWarning: divide by zero encountered in log
  time = numpy.log(time)
