[32m[I 2022-04-21 11:43:59,454][0m Trial 499 finished with value: 0.6847054012696481 and parameters: {'alpha': 0.8498793784006489, 'ties': 'efron'}. Best is trial 26 with value: 0.6847054012696481.[0m
[32m[I 2022-04-21 11:43:59,631][0m Trial 500 finished with value: 0.6829090813866752 and parameters: {'alpha': 0.9646935468129058, 'ties': 'efron'}. Best is trial 26 with value: 0.6847054012696481.[0m
[32m[I 2022-04-21 11:43:59,756][0m Trial 501 finished with value: 0.6847054012696481 and parameters: {'alpha': 0.8895255100469817, 'ties': 'breslow'}. Best is trial 26 with value: 0.6847054012696481.[0m
[32m[I 2022-04-21 11:43:59,879][0m Trial 502 finished with value: 0.6847054012696481 and parameters: {'alpha': 0.7747269302998978, 'ties': 'breslow'}. Best is trial 26 with value: 0.6847054012696481.[0m
[32m[I 2022-04-21 11:44:00,001][0m Trial 503 finished with value: 0.6829090813866752 and parameters: {'alpha': 0.9508259347693429, 'ties': 'breslow'}. Best is trial 26 with value: 0.6847054012696481.[0m
[32m[I 2022-04-21 11:44:00,140][0m Trial 504 finished with value: 0.684367348820454 and parameters: {'alpha': 0.6782279356893468, 'ties': 'efron'}. Best is trial 26 with value: 0.6847054012696481.[0m
[32m[I 2022-04-21 11:44:00,275][0m Trial 505 finished with value: 0.6829090813866752 and parameters: {'alpha': 1.2647414184082488, 'ties': 'efron'}. Best is trial 26 with value: 0.6847054012696481.[0m
[32m[I 2022-04-21 11:44:00,531][0m Trial 506 finished with value: 0.684367348820454 and parameters: {'alpha': 0.5746096575807123, 'ties': 'efron'}. Best is trial 26 with value: 0.6847054012696481.[0m
[32m[I 2022-04-21 11:44:00,717][0m Trial 507 finished with value: 0.684367348820454 and parameters: {'alpha': 0.6566234415090391, 'ties': 'efron'}. Best is trial 26 with value: 0.6847054012696481.[0m
[32m[I 2022-04-21 11:44:00,866][0m Trial 508 finished with value: 0.684367348820454 and parameters: {'alpha': 0.39627934803196657, 'ties': 'efron'}. Best is trial 26 with value: 0.6847054012696481.[0m
[32m[I 2022-04-21 11:44:01,010][0m Trial 509 finished with value: 0.6847054012696481 and parameters: {'alpha': 0.7218937305009459, 'ties': 'efron'}. Best is trial 26 with value: 0.6847054012696481.[0m
[32m[I 2022-04-21 11:44:01,147][0m Trial 510 finished with value: 0.6847054012696481 and parameters: {'alpha': 0.754408291102247, 'ties': 'efron'}. Best is trial 26 with value: 0.6847054012696481.[0m
[32m[I 2022-04-21 11:44:01,274][0m Trial 511 finished with value: 0.684367348820454 and parameters: {'alpha': 0.5471403952831122, 'ties': 'breslow'}. Best is trial 26 with value: 0.6847054012696481.[0m
[32m[I 2022-04-21 11:44:01,480][0m Trial 512 finished with value: 0.6847054012696481 and parameters: {'alpha': 0.8082645811473956, 'ties': 'efron'}. Best is trial 26 with value: 0.6847054012696481.[0m
[32m[I 2022-04-21 11:44:01,621][0m Trial 513 finished with value: 0.6847054012696481 and parameters: {'alpha': 0.8063880931511345, 'ties': 'efron'}. Best is trial 26 with value: 0.6847054012696481.[0m
[32m[I 2022-04-21 11:44:01,764][0m Trial 514 finished with value: 0.6847054012696481 and parameters: {'alpha': 0.8155275749881057, 'ties': 'efron'}. Best is trial 26 with value: 0.6847054012696481.[0m
[32m[I 2022-04-21 11:44:01,929][0m Trial 515 finished with value: 0.684367348820454 and parameters: {'alpha': 0.6208518154028748, 'ties': 'efron'}. Best is trial 26 with value: 0.6847054012696481.[0m
[32m[I 2022-04-21 11:44:02,158][0m Trial 516 finished with value: 0.684367348820454 and parameters: {'alpha': 0.4925840749839597, 'ties': 'efron'}. Best is trial 26 with value: 0.6847054012696481.[0m
[32m[I 2022-04-21 11:44:02,373][0m Trial 517 finished with value: 0.6847054012696481 and parameters: {'alpha': 0.7321223181741873, 'ties': 'efron'}. Best is trial 26 with value: 0.6847054012696481.[0m
[32m[I 2022-04-21 11:44:02,520][0m Trial 518 finished with value: 0.684367348820454 and parameters: {'alpha': 0.6498435867685372, 'ties': 'efron'}. Best is trial 26 with value: 0.6847054012696481.[0m
[32m[I 2022-04-21 11:44:02,759][0m Trial 519 finished with value: 0.6829090813866752 and parameters: {'alpha': 0.9424480337642882, 'ties': 'efron'}. Best is trial 26 with value: 0.6847054012696481.[0m
[32m[I 2022-04-21 11:44:02,900][0m Trial 520 finished with value: 0.684367348820454 and parameters: {'alpha': 0.3634492780454642, 'ties': 'efron'}. Best is trial 26 with value: 0.6847054012696481.[0m
[32m[I 2022-04-21 11:44:03,083][0m Trial 521 finished with value: 0.6829090813866752 and parameters: {'alpha': 0.9909129233538596, 'ties': 'efron'}. Best is trial 26 with value: 0.6847054012696481.[0m
[32m[I 2022-04-21 11:44:03,304][0m Trial 522 finished with value: 0.6829090813866752 and parameters: {'alpha': 1.0998831058052687, 'ties': 'efron'}. Best is trial 26 with value: 0.6847054012696481.[0m
[32m[I 2022-04-21 11:44:03,559][0m Trial 523 finished with value: 0.6847054012696481 and parameters: {'alpha': 0.8732398054215885, 'ties': 'breslow'}. Best is trial 26 with value: 0.6847054012696481.[0m
[32m[I 2022-04-21 11:44:03,946][0m Trial 524 finished with value: 0.684367348820454 and parameters: {'alpha': 0.6154340003111203, 'ties': 'efron'}. Best is trial 26 with value: 0.6847054012696481.[0m
[32m[I 2022-04-21 11:44:04,265][0m Trial 525 finished with value: 0.6847054012696481 and parameters: {'alpha': 0.8913648548291373, 'ties': 'breslow'}. Best is trial 26 with value: 0.6847054012696481.[0m
[32m[I 2022-04-21 11:44:04,466][0m Trial 526 finished with value: 0.6829090813866752 and parameters: {'alpha': 1.0364529023869717, 'ties': 'efron'}. Best is trial 26 with value: 0.6847054012696481.[0m
[32m[I 2022-04-21 11:44:04,694][0m Trial 527 finished with value: 0.6847054012696481 and parameters: {'alpha': 0.7910280423876889, 'ties': 'breslow'}. Best is trial 26 with value: 0.6847054012696481.[0m
[32m[I 2022-04-21 11:44:04,851][0m Trial 528 finished with value: 0.6829090813866752 and parameters: {'alpha': 1.2079427100039242, 'ties': 'breslow'}. Best is trial 26 with value: 0.6847054012696481.[0m
[32m[I 2022-04-21 11:44:05,061][0m Trial 529 finished with value: 0.6847054012696481 and parameters: {'alpha': 0.9368124066159347, 'ties': 'breslow'}. Best is trial 26 with value: 0.6847054012696481.[0m
[32m[I 2022-04-21 11:44:05,205][0m Trial 530 finished with value: 0.6847054012696481 and parameters: {'alpha': 0.8727921913057988, 'ties': 'breslow'}. Best is trial 26 with value: 0.6847054012696481.[0m
[32m[I 2022-04-21 11:44:05,458][0m Trial 531 finished with value: 0.684367348820454 and parameters: {'alpha': 0.523830245600828, 'ties': 'efron'}. Best is trial 26 with value: 0.6847054012696481.[0m
[32m[I 2022-04-21 11:44:05,583][0m Trial 532 finished with value: 0.6829090813866752 and parameters: {'alpha': 1.0978046519967353, 'ties': 'breslow'}. Best is trial 26 with value: 0.6847054012696481.[0m
[32m[I 2022-04-21 11:44:05,801][0m Trial 533 finished with value: 0.6829090813866752 and parameters: {'alpha': 0.9904721806237643, 'ties': 'efron'}. Best is trial 26 with value: 0.6847054012696481.[0m
[32m[I 2022-04-21 11:44:06,050][0m Trial 534 finished with value: 0.6847054012696481 and parameters: {'alpha': 0.7240774457224926, 'ties': 'efron'}. Best is trial 26 with value: 0.6847054012696481.[0m
[32m[I 2022-04-21 11:44:06,266][0m Trial 535 finished with value: 0.6847054012696481 and parameters: {'alpha': 0.7254781336195717, 'ties': 'efron'}. Best is trial 26 with value: 0.6847054012696481.[0m
[32m[I 2022-04-21 11:44:06,486][0m Trial 536 finished with value: 0.684367348820454 and parameters: {'alpha': 0.4359225837121079, 'ties': 'efron'}. Best is trial 26 with value: 0.6847054012696481.[0m
[32m[I 2022-04-21 11:44:06,709][0m Trial 537 finished with value: 0.684367348820454 and parameters: {'alpha': 0.5890257041187879, 'ties': 'efron'}. Best is trial 26 with value: 0.6847054012696481.[0m
[32m[I 2022-04-21 11:44:06,929][0m Trial 538 finished with value: 0.684367348820454 and parameters: {'alpha': 0.6899745613550581, 'ties': 'efron'}. Best is trial 26 with value: 0.6847054012696481.[0m
[32m[I 2022-04-21 11:44:07,068][0m Trial 539 finished with value: 0.684367348820454 and parameters: {'alpha': 0.6220097650155605, 'ties': 'efron'}. Best is trial 26 with value: 0.6847054012696481.[0m
[32m[I 2022-04-21 11:44:07,207][0m Trial 540 finished with value: 0.6847054012696481 and parameters: {'alpha': 0.7472504031216146, 'ties': 'efron'}. Best is trial 26 with value: 0.6847054012696481.[0m
[32m[I 2022-04-21 11:44:07,542][0m Trial 541 finished with value: 0.6829090813866752 and parameters: {'alpha': 0.880064174087986, 'ties': 'efron'}. Best is trial 26 with value: 0.6847054012696481.[0m
[32m[I 2022-04-21 11:44:07,951][0m Trial 542 finished with value: 0.684367348820454 and parameters: {'alpha': 0.6739850818324622, 'ties': 'efron'}. Best is trial 26 with value: 0.6847054012696481.[0m
[32m[I 2022-04-21 11:44:08,362][0m Trial 543 finished with value: 0.6829090813866752 and parameters: {'alpha': 1.0505783113111025, 'ties': 'breslow'}. Best is trial 26 with value: 0.6847054012696481.[0m
[32m[I 2022-04-21 11:44:08,704][0m Trial 544 finished with value: 0.6847054012696481 and parameters: {'alpha': 0.7961448644111554, 'ties': 'breslow'}. Best is trial 26 with value: 0.6847054012696481.[0m
[32m[I 2022-04-21 11:44:09,063][0m Trial 545 finished with value: 0.6829090813866752 and parameters: {'alpha': 0.9879982296555883, 'ties': 'breslow'}. Best is trial 26 with value: 0.6847054012696481.[0m
[32m[I 2022-04-21 11:44:09,394][0m Trial 546 finished with value: 0.684367348820454 and parameters: {'alpha': 0.5843434736759243, 'ties': 'efron'}. Best is trial 26 with value: 0.6847054012696481.[0m
[32m[I 2022-04-21 11:44:09,625][0m Trial 547 finished with value: 0.6847054012696481 and parameters: {'alpha': 0.7280458818975221, 'ties': 'breslow'}. Best is trial 26 with value: 0.6847054012696481.[0m
[32m[I 2022-04-21 11:44:09,848][0m Trial 548 finished with value: 0.6847054012696481 and parameters: {'alpha': 0.8709529501437101, 'ties': 'breslow'}. Best is trial 26 with value: 0.6847054012696481.[0m
[32m[I 2022-04-21 11:44:10,077][0m Trial 549 finished with value: 0.6847054012696481 and parameters: {'alpha': 0.8516025337549256, 'ties': 'efron'}. Best is trial 26 with value: 0.6847054012696481.[0m
[32m[I 2022-04-21 11:44:10,324][0m Trial 550 finished with value: 0.6829090813866752 and parameters: {'alpha': 0.8899124984156007, 'ties': 'efron'}. Best is trial 26 with value: 0.6847054012696481.[0m
[32m[I 2022-04-21 11:44:10,721][0m Trial 551 finished with value: 0.6826116370301901 and parameters: {'alpha': 3.241912485241131, 'ties': 'breslow'}. Best is trial 26 with value: 0.6847054012696481.[0m
[32m[I 2022-04-21 11:44:10,854][0m Trial 552 finished with value: 0.6847054012696481 and parameters: {'alpha': 0.8234621115991553, 'ties': 'breslow'}. Best is trial 26 with value: 0.6847054012696481.[0m
[32m[I 2022-04-21 11:44:10,979][0m Trial 553 finished with value: 0.6847054012696481 and parameters: {'alpha': 0.928577574028988, 'ties': 'breslow'}. Best is trial 26 with value: 0.6847054012696481.[0m
[32m[I 2022-04-21 11:44:11,116][0m Trial 554 finished with value: 0.6847054012696481 and parameters: {'alpha': 0.7982878659805482, 'ties': 'breslow'}. Best is trial 26 with value: 0.6847054012696481.[0m
[32m[I 2022-04-21 11:44:11,259][0m Trial 555 finished with value: 0.6847054012696481 and parameters: {'alpha': 0.7707196066550585, 'ties': 'efron'}. Best is trial 26 with value: 0.6847054012696481.[0m
[32m[I 2022-04-21 11:44:11,548][0m Trial 556 finished with value: 0.6847054012696481 and parameters: {'alpha': 0.7677340904253414, 'ties': 'efron'}. Best is trial 26 with value: 0.6847054012696481.[0m
[32m[I 2022-04-21 11:44:11,823][0m Trial 557 finished with value: 0.6847054012696481 and parameters: {'alpha': 0.7542258786282063, 'ties': 'breslow'}. Best is trial 26 with value: 0.6847054012696481.[0m
[32m[I 2022-04-21 11:44:11,969][0m Trial 558 finished with value: 0.6847054012696481 and parameters: {'alpha': 0.7636885381276535, 'ties': 'breslow'}. Best is trial 26 with value: 0.6847054012696481.[0m
[32m[I 2022-04-21 11:44:12,269][0m Trial 559 finished with value: 0.684367348820454 and parameters: {'alpha': 0.6766414704097108, 'ties': 'breslow'}. Best is trial 26 with value: 0.6847054012696481.[0m
[32m[I 2022-04-21 11:44:12,598][0m Trial 560 finished with value: 0.6829090813866752 and parameters: {'alpha': 1.016082314460092, 'ties': 'efron'}. Best is trial 26 with value: 0.6847054012696481.[0m
[32m[I 2022-04-21 11:44:12,824][0m Trial 561 finished with value: 0.6829090813866752 and parameters: {'alpha': 1.193446495519727, 'ties': 'breslow'}. Best is trial 26 with value: 0.6847054012696481.[0m
[32m[I 2022-04-21 11:44:12,996][0m Trial 562 finished with value: 0.684367348820454 and parameters: {'alpha': 0.5745979787765648, 'ties': 'efron'}. Best is trial 26 with value: 0.6847054012696481.[0m
[32m[I 2022-04-21 11:44:13,175][0m Trial 563 finished with value: 0.6829090813866752 and parameters: {'alpha': 0.9559824783454615, 'ties': 'efron'}. Best is trial 26 with value: 0.6847054012696481.[0m
[32m[I 2022-04-21 11:44:13,362][0m Trial 564 finished with value: 0.682571028937481 and parameters: {'alpha': 1.8628432147852139, 'ties': 'efron'}. Best is trial 26 with value: 0.6847054012696481.[0m
[32m[I 2022-04-21 11:44:13,517][0m Trial 565 finished with value: 0.6847054012696481 and parameters: {'alpha': 0.9134137789694136, 'ties': 'breslow'}. Best is trial 26 with value: 0.6847054012696481.[0m
[32m[I 2022-04-21 11:44:13,669][0m Trial 566 finished with value: 0.684367348820454 and parameters: {'alpha': 0.48312363886631304, 'ties': 'breslow'}. Best is trial 26 with value: 0.6847054012696481.[0m
[32m[I 2022-04-21 11:44:13,872][0m Trial 567 finished with value: 0.6829090813866752 and parameters: {'alpha': 1.0597925479038774, 'ties': 'efron'}. Best is trial 26 with value: 0.6847054012696481.[0m
[32m[I 2022-04-21 11:44:14,214][0m Trial 568 finished with value: 0.684367348820454 and parameters: {'alpha': 0.6315595478311141, 'ties': 'efron'}. Best is trial 26 with value: 0.6847054012696481.[0m
[32m[I 2022-04-21 11:44:14,478][0m Trial 569 finished with value: 0.6829090813866752 and parameters: {'alpha': 0.953218047135248, 'ties': 'breslow'}. Best is trial 26 with value: 0.6847054012696481.[0m
[32m[I 2022-04-21 11:44:14,658][0m Trial 570 finished with value: 0.684367348820454 and parameters: {'alpha': 0.5031972144945662, 'ties': 'efron'}. Best is trial 26 with value: 0.6847054012696481.[0m
[32m[I 2022-04-21 11:44:14,826][0m Trial 571 finished with value: 0.6829090813866752 and parameters: {'alpha': 0.8815089262285335, 'ties': 'efron'}. Best is trial 26 with value: 0.6847054012696481.[0m
[32m[I 2022-04-21 11:44:14,979][0m Trial 572 finished with value: 0.6847054012696481 and parameters: {'alpha': 0.795272155029398, 'ties': 'breslow'}. Best is trial 26 with value: 0.6847054012696481.[0m
[32m[I 2022-04-21 11:44:15,204][0m Trial 573 finished with value: 0.6847054012696481 and parameters: {'alpha': 0.7074544823443726, 'ties': 'breslow'}. Best is trial 26 with value: 0.6847054012696481.[0m
[32m[I 2022-04-21 11:44:15,507][0m Trial 574 finished with value: 0.6847054012696481 and parameters: {'alpha': 0.8232091298730371, 'ties': 'breslow'}. Best is trial 26 with value: 0.6847054012696481.[0m
[32m[I 2022-04-21 11:44:15,845][0m Trial 575 finished with value: 0.6829090813866752 and parameters: {'alpha': 1.0802465706360773, 'ties': 'efron'}. Best is trial 26 with value: 0.6847054012696481.[0m
[32m[I 2022-04-21 11:44:16,219][0m Trial 576 finished with value: 0.6847054012696481 and parameters: {'alpha': 0.8256650961778569, 'ties': 'efron'}. Best is trial 26 with value: 0.6847054012696481.[0m
[32m[I 2022-04-21 11:44:16,361][0m Trial 577 finished with value: 0.684367348820454 and parameters: {'alpha': 0.6180549354118264, 'ties': 'efron'}. Best is trial 26 with value: 0.6847054012696481.[0m
[32m[I 2022-04-21 11:44:16,584][0m Trial 578 finished with value: 0.6847054012696481 and parameters: {'alpha': 0.7255943342629512, 'ties': 'efron'}. Best is trial 26 with value: 0.6847054012696481.[0m
[32m[I 2022-04-21 11:44:16,726][0m Trial 579 finished with value: 0.6836276093398644 and parameters: {'alpha': 2.1015424234276154, 'ties': 'efron'}. Best is trial 26 with value: 0.6847054012696481.[0m
[32m[I 2022-04-21 11:44:16,916][0m Trial 580 finished with value: 0.6829090813866752 and parameters: {'alpha': 1.3407629726583146, 'ties': 'breslow'}. Best is trial 26 with value: 0.6847054012696481.[0m
[32m[I 2022-04-21 11:44:17,123][0m Trial 581 finished with value: 0.684367348820454 and parameters: {'alpha': 0.6798472314317441, 'ties': 'efron'}. Best is trial 26 with value: 0.6847054012696481.[0m
[32m[I 2022-04-21 11:44:17,401][0m Trial 582 finished with value: 0.6847054012696481 and parameters: {'alpha': 0.7415769506350904, 'ties': 'breslow'}. Best is trial 26 with value: 0.6847054012696481.[0m
[32m[I 2022-04-21 11:44:17,583][0m Trial 583 finished with value: 0.6847054012696481 and parameters: {'alpha': 0.9215799746943861, 'ties': 'breslow'}. Best is trial 26 with value: 0.6847054012696481.[0m
[32m[I 2022-04-21 11:44:17,784][0m Trial 584 finished with value: 0.684367348820454 and parameters: {'alpha': 0.5483743834596141, 'ties': 'breslow'}. Best is trial 26 with value: 0.6847054012696481.[0m
[32m[I 2022-04-21 11:44:17,919][0m Trial 585 finished with value: 0.684367348820454 and parameters: {'alpha': 0.6525220132106286, 'ties': 'efron'}. Best is trial 26 with value: 0.6847054012696481.[0m
[32m[I 2022-04-21 11:44:18,136][0m Trial 586 finished with value: 0.684367348820454 and parameters: {'alpha': 0.264644870211189, 'ties': 'efron'}. Best is trial 26 with value: 0.6847054012696481.[0m
[32m[I 2022-04-21 11:44:18,298][0m Trial 587 finished with value: 0.6829090813866752 and parameters: {'alpha': 0.8707404318862555, 'ties': 'efron'}. Best is trial 26 with value: 0.6847054012696481.[0m
[32m[I 2022-04-21 11:44:18,507][0m Trial 588 finished with value: 0.6847054012696481 and parameters: {'alpha': 0.8403519582429428, 'ties': 'efron'}. Best is trial 26 with value: 0.6847054012696481.[0m
[32m[I 2022-04-21 11:44:18,759][0m Trial 589 finished with value: 0.684367348820454 and parameters: {'alpha': 0.36596589811378133, 'ties': 'efron'}. Best is trial 26 with value: 0.6847054012696481.[0m
[32m[I 2022-04-21 11:44:19,003][0m Trial 590 finished with value: 0.6847054012696481 and parameters: {'alpha': 0.6983705824205187, 'ties': 'efron'}. Best is trial 26 with value: 0.6847054012696481.[0m
[32m[I 2022-04-21 11:44:19,215][0m Trial 591 finished with value: 0.6829090813866752 and parameters: {'alpha': 1.0271201782177282, 'ties': 'breslow'}. Best is trial 26 with value: 0.6847054012696481.[0m
[32m[I 2022-04-21 11:44:19,453][0m Trial 592 finished with value: 0.684367348820454 and parameters: {'alpha': 0.4983084639957868, 'ties': 'efron'}. Best is trial 26 with value: 0.6847054012696481.[0m
[32m[I 2022-04-21 11:44:19,659][0m Trial 593 finished with value: 0.684367348820454 and parameters: {'alpha': 0.6085700768290627, 'ties': 'efron'}. Best is trial 26 with value: 0.6847054012696481.[0m
[32m[I 2022-04-21 11:44:19,797][0m Trial 594 finished with value: 0.684367348820454 and parameters: {'alpha': 0.6350400360318078, 'ties': 'efron'}. Best is trial 26 with value: 0.6847054012696481.[0m
[32m[I 2022-04-21 11:44:20,102][0m Trial 595 finished with value: 0.6847054012696481 and parameters: {'alpha': 0.8181398567828293, 'ties': 'efron'}. Best is trial 26 with value: 0.6847054012696481.[0m
[32m[I 2022-04-21 11:44:20,357][0m Trial 596 finished with value: 0.6829090813866752 and parameters: {'alpha': 0.9612149070146644, 'ties': 'breslow'}. Best is trial 26 with value: 0.6847054012696481.[0m
[32m[I 2022-04-21 11:44:20,638][0m Trial 597 finished with value: 0.684367348820454 and parameters: {'alpha': 0.5411676127220694, 'ties': 'efron'}. Best is trial 26 with value: 0.6847054012696481.[0m
[32m[I 2022-04-21 11:44:20,914][0m Trial 598 finished with value: 0.6847054012696481 and parameters: {'alpha': 0.7097186420392827, 'ties': 'efron'}. Best is trial 26 with value: 0.6847054012696481.[0m
[32m[I 2022-04-21 11:44:21,179][0m Trial 599 finished with value: 0.6847054012696481 and parameters: {'alpha': 0.8185476140477431, 'ties': 'efron'}. Best is trial 26 with value: 0.6847054012696481.[0m
[32m[I 2022-04-21 11:44:21,336][0m Trial 600 finished with value: 0.6847054012696481 and parameters: {'alpha': 0.808209076738217, 'ties': 'efron'}. Best is trial 26 with value: 0.6847054012696481.[0m
[32m[I 2022-04-21 11:44:21,461][0m Trial 601 finished with value: 0.6847054012696481 and parameters: {'alpha': 0.7361488457362785, 'ties': 'breslow'}. Best is trial 26 with value: 0.6847054012696481.[0m
[32m[I 2022-04-21 11:44:21,587][0m Trial 602 finished with value: 0.6847054012696481 and parameters: {'alpha': 0.7314715717147828, 'ties': 'breslow'}. Best is trial 26 with value: 0.6847054012696481.[0m
[32m[I 2022-04-21 11:44:21,712][0m Trial 603 finished with value: 0.6829090813866752 and parameters: {'alpha': 1.169542446196502, 'ties': 'breslow'}. Best is trial 26 with value: 0.6847054012696481.[0m
[32m[I 2022-04-21 11:44:21,954][0m Trial 604 finished with value: 0.684367348820454 and parameters: {'alpha': 0.4716417934393956, 'ties': 'efron'}. Best is trial 26 with value: 0.6847054012696481.[0m
[32m[I 2022-04-21 11:44:22,198][0m Trial 605 finished with value: 0.684367348820454 and parameters: {'alpha': 0.6160832401187863, 'ties': 'efron'}. Best is trial 26 with value: 0.6847054012696481.[0m
