[32m[I 2022-04-21 18:45:06,271][0m Trial 642 finished with value: 0.8358321902886627 and parameters: {'alpha': 3.7797045432374943, 'ties': 'breslow'}. Best is trial 70 with value: 0.835911286090736.[0m
[32m[I 2022-04-21 18:45:37,799][0m Trial 643 finished with value: 0.8351365306402398 and parameters: {'alpha': 2.9738049943570948, 'ties': 'breslow'}. Best is trial 70 with value: 0.835911286090736.[0m
[32m[I 2022-04-21 18:46:07,938][0m Trial 644 finished with value: 0.8355071273750777 and parameters: {'alpha': 3.468105309442155, 'ties': 'breslow'}. Best is trial 70 with value: 0.835911286090736.[0m
[32m[I 2022-04-21 18:46:39,740][0m Trial 645 finished with value: 0.8357190747858569 and parameters: {'alpha': 3.734265145937746, 'ties': 'breslow'}. Best is trial 70 with value: 0.835911286090736.[0m
[32m[I 2022-04-21 18:47:10,172][0m Trial 646 finished with value: 0.8352109238340357 and parameters: {'alpha': 4.545552910760772, 'ties': 'breslow'}. Best is trial 70 with value: 0.835911286090736.[0m
[32m[I 2022-04-21 18:47:40,336][0m Trial 647 finished with value: 0.8356281582736811 and parameters: {'alpha': 3.9074340965775605, 'ties': 'breslow'}. Best is trial 70 with value: 0.835911286090736.[0m
[32m[I 2022-04-21 18:48:10,149][0m Trial 648 finished with value: 0.835519622180555 and parameters: {'alpha': 3.595433333228354, 'ties': 'breslow'}. Best is trial 70 with value: 0.835911286090736.[0m
[32m[I 2022-04-21 18:48:44,786][0m Trial 649 finished with value: 0.8337465423980488 and parameters: {'alpha': 2.109042316854762, 'ties': 'efron'}. Best is trial 70 with value: 0.835911286090736.[0m
[32m[I 2022-04-21 18:49:15,157][0m Trial 650 finished with value: 0.8354787801983354 and parameters: {'alpha': 3.6456947631707894, 'ties': 'breslow'}. Best is trial 70 with value: 0.835911286090736.[0m
[32m[I 2022-04-21 18:49:46,753][0m Trial 651 finished with value: 0.8357506386312487 and parameters: {'alpha': 3.8075582840946307, 'ties': 'breslow'}. Best is trial 70 with value: 0.835911286090736.[0m
[32m[I 2022-04-21 18:50:18,941][0m Trial 652 finished with value: 0.8353628700474047 and parameters: {'alpha': 4.059330727699644, 'ties': 'breslow'}. Best is trial 70 with value: 0.835911286090736.[0m
[32m[I 2022-04-21 18:50:49,781][0m Trial 653 finished with value: 0.835521456277732 and parameters: {'alpha': 3.9454264075072483, 'ties': 'breslow'}. Best is trial 70 with value: 0.835911286090736.[0m
[32m[I 2022-04-21 18:51:22,029][0m Trial 654 finished with value: 0.8357190747858569 and parameters: {'alpha': 3.728535744996008, 'ties': 'breslow'}. Best is trial 70 with value: 0.835911286090736.[0m
[32m[I 2022-04-21 18:51:52,921][0m Trial 655 finished with value: 0.8356661565039716 and parameters: {'alpha': 3.8496282666283506, 'ties': 'breslow'}. Best is trial 70 with value: 0.835911286090736.[0m
[32m[I 2022-04-21 18:52:27,206][0m Trial 656 finished with value: 0.8349374623377489 and parameters: {'alpha': 2.774377364868697, 'ties': 'breslow'}. Best is trial 70 with value: 0.835911286090736.[0m
[32m[I 2022-04-21 18:52:57,667][0m Trial 657 finished with value: 0.835558008307433 and parameters: {'alpha': 3.5468410094401808, 'ties': 'breslow'}. Best is trial 70 with value: 0.835911286090736.[0m
[32m[I 2022-04-21 18:53:26,877][0m Trial 658 finished with value: 0.8357190747858569 and parameters: {'alpha': 3.732492992975311, 'ties': 'breslow'}. Best is trial 70 with value: 0.835911286090736.[0m
[32m[I 2022-04-21 18:53:54,207][0m Trial 659 finished with value: 0.8356281582736811 and parameters: {'alpha': 3.8881016728545075, 'ties': 'breslow'}. Best is trial 70 with value: 0.835911286090736.[0m
[32m[I 2022-04-21 18:54:24,217][0m Trial 660 finished with value: 0.8354787801983354 and parameters: {'alpha': 3.662526182763117, 'ties': 'breslow'}. Best is trial 70 with value: 0.835911286090736.[0m
[32m[I 2022-04-21 18:54:53,867][0m Trial 661 finished with value: 0.8355429914931024 and parameters: {'alpha': 3.419836361252098, 'ties': 'breslow'}. Best is trial 70 with value: 0.835911286090736.[0m
[32m[I 2022-04-21 18:55:23,240][0m Trial 662 finished with value: 0.8352686257991955 and parameters: {'alpha': 4.259406885677729, 'ties': 'breslow'}. Best is trial 70 with value: 0.835911286090736.[0m
[32m[I 2022-04-21 18:55:52,435][0m Trial 663 finished with value: 0.8357506386312487 and parameters: {'alpha': 3.8008705327519174, 'ties': 'breslow'}. Best is trial 70 with value: 0.835911286090736.[0m
[32m[I 2022-04-21 18:56:22,367][0m Trial 664 finished with value: 0.8351708577015339 and parameters: {'alpha': 4.004082575003161, 'ties': 'breslow'}. Best is trial 70 with value: 0.835911286090736.[0m
[32m[I 2022-04-21 18:56:52,701][0m Trial 665 finished with value: 0.8357190747858569 and parameters: {'alpha': 3.738268947637948, 'ties': 'breslow'}. Best is trial 70 with value: 0.835911286090736.[0m
[32m[I 2022-04-21 18:57:22,745][0m Trial 666 finished with value: 0.835519622180555 and parameters: {'alpha': 3.608986530306934, 'ties': 'breslow'}. Best is trial 70 with value: 0.835911286090736.[0m
[32m[I 2022-04-21 18:57:52,178][0m Trial 667 finished with value: 0.8356281582736811 and parameters: {'alpha': 3.8937948362350143, 'ties': 'breslow'}. Best is trial 70 with value: 0.835911286090736.[0m
[32m[I 2022-04-21 18:58:22,133][0m Trial 668 finished with value: 0.835911286090736 and parameters: {'alpha': 3.772949928410083, 'ties': 'breslow'}. Best is trial 70 with value: 0.835911286090736.[0m
[32m[I 2022-04-21 18:58:48,933][0m Trial 669 finished with value: 0.8355953068418847 and parameters: {'alpha': 3.6687536675700065, 'ties': 'efron'}. Best is trial 70 with value: 0.835911286090736.[0m
[32m[I 2022-04-21 18:59:19,798][0m Trial 670 finished with value: 0.8355572580224632 and parameters: {'alpha': 3.5323804343611513, 'ties': 'breslow'}. Best is trial 70 with value: 0.835911286090736.[0m
[32m[I 2022-04-21 18:59:50,273][0m Trial 671 finished with value: 0.8357103479749908 and parameters: {'alpha': 3.8261059967740234, 'ties': 'breslow'}. Best is trial 70 with value: 0.835911286090736.[0m
[32m[I 2022-04-21 19:00:20,686][0m Trial 672 finished with value: 0.83540459836815 and parameters: {'alpha': 3.975272542700994, 'ties': 'breslow'}. Best is trial 70 with value: 0.835911286090736.[0m
[32m[I 2022-04-21 19:00:49,640][0m Trial 673 finished with value: 0.8355991370015646 and parameters: {'alpha': 3.6901429983613316, 'ties': 'breslow'}. Best is trial 70 with value: 0.835911286090736.[0m
[32m[I 2022-04-21 19:01:17,720][0m Trial 674 finished with value: 0.8353829464535926 and parameters: {'alpha': 3.369539567781919, 'ties': 'breslow'}. Best is trial 70 with value: 0.835911286090736.[0m
[32m[I 2022-04-21 19:01:48,397][0m Trial 675 finished with value: 0.8358321902886627 and parameters: {'alpha': 3.7810336513290905, 'ties': 'breslow'}. Best is trial 70 with value: 0.835911286090736.[0m
[32m[I 2022-04-21 19:02:15,677][0m Trial 676 finished with value: 0.8352422931907615 and parameters: {'alpha': 4.097561004988944, 'ties': 'breslow'}. Best is trial 70 with value: 0.835911286090736.[0m
[32m[I 2022-04-21 19:02:45,385][0m Trial 677 finished with value: 0.8356281582736811 and parameters: {'alpha': 3.8881526077898902, 'ties': 'breslow'}. Best is trial 70 with value: 0.835911286090736.[0m
[32m[I 2022-04-21 19:03:14,371][0m Trial 678 finished with value: 0.8354805519222193 and parameters: {'alpha': 3.5918983919953025, 'ties': 'breslow'}. Best is trial 70 with value: 0.835911286090736.[0m
[32m[I 2022-04-21 19:03:44,485][0m Trial 679 finished with value: 0.8349836350652546 and parameters: {'alpha': 4.728668063716962, 'ties': 'breslow'}. Best is trial 70 with value: 0.835911286090736.[0m
[32m[I 2022-04-21 19:04:14,111][0m Trial 680 finished with value: 0.8357567045863414 and parameters: {'alpha': 3.7586861327461913, 'ties': 'breslow'}. Best is trial 70 with value: 0.835911286090736.[0m
[32m[I 2022-04-21 19:04:44,825][0m Trial 681 finished with value: 0.8356281582736811 and parameters: {'alpha': 3.894998778293302, 'ties': 'breslow'}. Best is trial 70 with value: 0.835911286090736.[0m
[32m[I 2022-04-21 19:05:15,150][0m Trial 682 finished with value: 0.835519290914522 and parameters: {'alpha': 3.613288923279792, 'ties': 'breslow'}. Best is trial 70 with value: 0.835911286090736.[0m
[32m[I 2022-04-21 19:05:46,142][0m Trial 683 finished with value: 0.835598871889044 and parameters: {'alpha': 3.7082391308327023, 'ties': 'breslow'}. Best is trial 70 with value: 0.835911286090736.[0m
[32m[I 2022-04-21 19:06:14,610][0m Trial 684 finished with value: 0.8356309209068851 and parameters: {'alpha': 3.835686500078318, 'ties': 'breslow'}. Best is trial 70 with value: 0.835911286090736.[0m
[32m[I 2022-04-21 19:06:48,091][0m Trial 685 finished with value: 0.8352116335302411 and parameters: {'alpha': 3.9968020145192704, 'ties': 'breslow'}. Best is trial 70 with value: 0.835911286090736.[0m
[32m[I 2022-04-21 19:07:18,656][0m Trial 686 finished with value: 0.8357506386312487 and parameters: {'alpha': 3.8045172682667157, 'ties': 'breslow'}. Best is trial 70 with value: 0.835911286090736.[0m
[32m[I 2022-04-21 19:07:51,031][0m Trial 687 finished with value: 0.8355960631682784 and parameters: {'alpha': 3.491494941835952, 'ties': 'efron'}. Best is trial 70 with value: 0.835911286090736.[0m
[32m[I 2022-04-21 19:08:23,457][0m Trial 688 finished with value: 0.8352387170438181 and parameters: {'alpha': 3.279466415273398, 'ties': 'breslow'}. Best is trial 70 with value: 0.835911286090736.[0m
[32m[I 2022-04-21 19:08:54,364][0m Trial 689 finished with value: 0.8355583611728576 and parameters: {'alpha': 3.6815667501172205, 'ties': 'breslow'}. Best is trial 70 with value: 0.835911286090736.[0m
[32m[I 2022-04-21 19:09:25,531][0m Trial 690 finished with value: 0.8355898383003153 and parameters: {'alpha': 3.925770027646892, 'ties': 'breslow'}. Best is trial 70 with value: 0.835911286090736.[0m
[32m[I 2022-04-21 19:09:55,697][0m Trial 691 finished with value: 0.8357190747858569 and parameters: {'alpha': 3.7243222911503584, 'ties': 'breslow'}. Best is trial 70 with value: 0.835911286090736.[0m
[32m[I 2022-04-21 19:10:26,469][0m Trial 692 finished with value: 0.8352812311180031 and parameters: {'alpha': 4.172899054234546, 'ties': 'breslow'}. Best is trial 70 with value: 0.835911286090736.[0m
[32m[I 2022-04-21 19:10:57,612][0m Trial 693 finished with value: 0.8357506386312487 and parameters: {'alpha': 3.799536394646104, 'ties': 'breslow'}. Best is trial 70 with value: 0.835911286090736.[0m
[32m[I 2022-04-21 19:11:28,081][0m Trial 694 finished with value: 0.8349032611054505 and parameters: {'alpha': 4.896650268897474, 'ties': 'breslow'}. Best is trial 70 with value: 0.835911286090736.[0m
[32m[I 2022-04-21 19:11:58,685][0m Trial 695 finished with value: 0.8354805519222193 and parameters: {'alpha': 3.5888164526479707, 'ties': 'breslow'}. Best is trial 70 with value: 0.835911286090736.[0m
[32m[I 2022-04-21 19:12:29,668][0m Trial 696 finished with value: 0.8354049296341829 and parameters: {'alpha': 3.9640447749453904, 'ties': 'breslow'}. Best is trial 70 with value: 0.835911286090736.[0m
[32m[I 2022-04-21 19:13:00,023][0m Trial 697 finished with value: 0.8357052929158193 and parameters: {'alpha': 3.8632890100861093, 'ties': 'breslow'}. Best is trial 70 with value: 0.835911286090736.[0m
[32m[I 2022-04-21 19:13:27,573][0m Trial 698 finished with value: 0.8355991370015646 and parameters: {'alpha': 3.695958837519142, 'ties': 'breslow'}. Best is trial 70 with value: 0.835911286090736.[0m
[32m[I 2022-04-21 19:13:58,113][0m Trial 699 finished with value: 0.8353245500740385 and parameters: {'alpha': 4.050784284093145, 'ties': 'breslow'}. Best is trial 70 with value: 0.835911286090736.[0m
[32m[I 2022-04-21 19:14:29,496][0m Trial 700 finished with value: 0.8354264219312361 and parameters: {'alpha': 3.4969260975949763, 'ties': 'breslow'}. Best is trial 70 with value: 0.835911286090736.[0m
[32m[I 2022-04-21 19:15:01,086][0m Trial 701 finished with value: 0.8354804857687071 and parameters: {'alpha': 3.6257413931095153, 'ties': 'breslow'}. Best is trial 70 with value: 0.835911286090736.[0m
[32m[I 2022-04-21 19:15:33,197][0m Trial 702 finished with value: 0.8357506386312487 and parameters: {'alpha': 3.8075257913177074, 'ties': 'breslow'}. Best is trial 70 with value: 0.835911286090736.[0m
[32m[I 2022-04-21 19:16:03,071][0m Trial 703 finished with value: 0.8356281582736811 and parameters: {'alpha': 3.903381785211931, 'ties': 'breslow'}. Best is trial 70 with value: 0.835911286090736.[0m
[32m[I 2022-04-21 19:16:33,462][0m Trial 704 finished with value: 0.8356785640696703 and parameters: {'alpha': 3.747085695628752, 'ties': 'breslow'}. Best is trial 70 with value: 0.835911286090736.[0m
[32m[I 2022-04-21 19:17:02,661][0m Trial 705 finished with value: 0.8358705102620287 and parameters: {'alpha': 3.77817489659333, 'ties': 'breslow'}. Best is trial 70 with value: 0.835911286090736.[0m
[32m[I 2022-04-21 19:17:33,117][0m Trial 706 finished with value: 0.8356358175580713 and parameters: {'alpha': 3.6462953645623584, 'ties': 'efron'}. Best is trial 70 with value: 0.835911286090736.[0m
[32m[I 2022-04-21 19:18:02,821][0m Trial 707 finished with value: 0.8354049296341829 and parameters: {'alpha': 3.9541924475154606, 'ties': 'breslow'}. Best is trial 70 with value: 0.835911286090736.[0m
[32m[I 2022-04-21 19:18:35,053][0m Trial 708 finished with value: 0.8356661565039716 and parameters: {'alpha': 3.847465090814815, 'ties': 'breslow'}. Best is trial 70 with value: 0.835911286090736.[0m
[32m[I 2022-04-21 19:19:06,327][0m Trial 709 finished with value: 0.8355959092618619 and parameters: {'alpha': 3.520664345964906, 'ties': 'breslow'}. Best is trial 70 with value: 0.835911286090736.[0m
[32m[I 2022-04-21 19:19:36,826][0m Trial 710 finished with value: 0.8355991370015646 and parameters: {'alpha': 3.6951877435455582, 'ties': 'breslow'}. Best is trial 70 with value: 0.835911286090736.[0m
[32m[I 2022-04-21 19:20:07,409][0m Trial 711 finished with value: 0.8352036419513628 and parameters: {'alpha': 4.102399385087143, 'ties': 'breslow'}. Best is trial 70 with value: 0.835911286090736.[0m
[32m[I 2022-04-21 19:20:40,016][0m Trial 712 finished with value: 0.8345296238259475 and parameters: {'alpha': 2.362274091942257, 'ties': 'breslow'}. Best is trial 70 with value: 0.835911286090736.[0m
[32m[I 2022-04-21 19:21:11,898][0m Trial 713 finished with value: 0.8356309209068851 and parameters: {'alpha': 3.8337633004491964, 'ties': 'breslow'}. Best is trial 70 with value: 0.835911286090736.[0m
[32m[I 2022-04-21 19:21:42,236][0m Trial 714 finished with value: 0.8354805519222193 and parameters: {'alpha': 3.5855259435565494, 'ties': 'breslow'}. Best is trial 70 with value: 0.835911286090736.[0m
[32m[I 2022-04-21 19:22:12,855][0m Trial 715 finished with value: 0.8351729822908422 and parameters: {'alpha': 3.9902094964297534, 'ties': 'breslow'}. Best is trial 70 with value: 0.835911286090736.[0m
[32m[I 2022-04-21 19:22:43,245][0m Trial 716 finished with value: 0.8358321902886627 and parameters: {'alpha': 3.7860502727236987, 'ties': 'breslow'}. Best is trial 70 with value: 0.835911286090736.[0m
[32m[I 2022-04-21 19:23:15,156][0m Trial 717 finished with value: 0.8355583611728576 and parameters: {'alpha': 3.685549581809898, 'ties': 'breslow'}. Best is trial 70 with value: 0.835911286090736.[0m
[32m[I 2022-04-21 19:23:46,002][0m Trial 718 finished with value: 0.8356689341023882 and parameters: {'alpha': 3.8854708550075547, 'ties': 'breslow'}. Best is trial 70 with value: 0.835911286090736.[0m
[32m[I 2022-04-21 19:24:15,833][0m Trial 719 finished with value: 0.8357190747858569 and parameters: {'alpha': 3.7331494270263867, 'ties': 'breslow'}. Best is trial 70 with value: 0.835911286090736.[0m
[32m[I 2022-04-21 19:24:53,872][0m Trial 720 finished with value: 0.8334950056773479 and parameters: {'alpha': 1.4421502012802871, 'ties': 'breslow'}. Best is trial 70 with value: 0.835911286090736.[0m
[32m[I 2022-04-21 19:25:25,021][0m Trial 721 finished with value: 0.8355837673218096 and parameters: {'alpha': 3.427399845222878, 'ties': 'breslow'}. Best is trial 70 with value: 0.835911286090736.[0m
[32m[I 2022-04-21 19:25:56,219][0m Trial 722 finished with value: 0.8354805519222193 and parameters: {'alpha': 3.587256180731645, 'ties': 'breslow'}. Best is trial 70 with value: 0.835911286090736.[0m
[32m[I 2022-04-21 19:26:53,522][0m Trial 723 finished with value: 0.833572852283754 and parameters: {'alpha': 0.20422331678673977, 'ties': 'breslow'}. Best is trial 70 with value: 0.835911286090736.[0m
[32m[I 2022-04-21 19:27:25,312][0m Trial 724 finished with value: 0.8354049296341829 and parameters: {'alpha': 3.956485031339403, 'ties': 'breslow'}. Best is trial 70 with value: 0.835911286090736.[0m
[32m[I 2022-04-21 19:27:56,898][0m Trial 725 finished with value: 0.8358321902886627 and parameters: {'alpha': 3.7798498046945905, 'ties': 'breslow'}. Best is trial 70 with value: 0.835911286090736.[0m
[32m[I 2022-04-21 19:28:27,814][0m Trial 726 finished with value: 0.835593038904087 and parameters: {'alpha': 3.856876511210974, 'ties': 'efron'}. Best is trial 70 with value: 0.835911286090736.[0m
[32m[I 2022-04-21 19:28:57,983][0m Trial 727 finished with value: 0.8354787801983354 and parameters: {'alpha': 3.662198250070113, 'ties': 'breslow'}. Best is trial 70 with value: 0.835911286090736.[0m
[32m[I 2022-04-21 19:29:27,634][0m Trial 728 finished with value: 0.8352854798157032 and parameters: {'alpha': 4.049750285947482, 'ties': 'breslow'}. Best is trial 70 with value: 0.835911286090736.[0m
[32m[I 2022-04-21 19:29:59,198][0m Trial 729 finished with value: 0.8357176343280059 and parameters: {'alpha': 3.7540985298595992, 'ties': 'breslow'}. Best is trial 70 with value: 0.835911286090736.[0m
[32m[I 2022-04-21 19:30:30,135][0m Trial 730 finished with value: 0.8356281582736811 and parameters: {'alpha': 3.89874517219031, 'ties': 'breslow'}. Best is trial 70 with value: 0.835911286090736.[0m
[32m[I 2022-04-21 19:31:03,263][0m Trial 731 finished with value: 0.8354787801983354 and parameters: {'alpha': 3.6483781669506303, 'ties': 'breslow'}. Best is trial 70 with value: 0.835911286090736.[0m
[32m[I 2022-04-21 19:31:35,963][0m Trial 732 finished with value: 0.835558008307433 and parameters: {'alpha': 3.5380037365516164, 'ties': 'breslow'}. Best is trial 70 with value: 0.835911286090736.[0m
[32m[I 2022-04-21 19:32:08,421][0m Trial 733 finished with value: 0.8358724809449208 and parameters: {'alpha': 3.767817002969579, 'ties': 'breslow'}. Best is trial 70 with value: 0.835911286090736.[0m
[32m[I 2022-04-21 19:32:40,900][0m Trial 734 finished with value: 0.8356396477177512 and parameters: {'alpha': 3.710967558882061, 'ties': 'breslow'}. Best is trial 70 with value: 0.835911286090736.[0m
[32m[I 2022-04-21 19:33:14,035][0m Trial 735 finished with value: 0.8357052929158193 and parameters: {'alpha': 3.863924899873413, 'ties': 'breslow'}. Best is trial 70 with value: 0.835911286090736.[0m
[32m[I 2022-04-21 19:33:52,281][0m Trial 736 finished with value: 0.8329318450860115 and parameters: {'alpha': 1.0250750800801183, 'ties': 'breslow'}. Best is trial 70 with value: 0.835911286090736.[0m
[32m[I 2022-04-21 19:34:24,250][0m Trial 737 finished with value: 0.835519622180555 and parameters: {'alpha': 3.6053625433133347, 'ties': 'breslow'}. Best is trial 70 with value: 0.835911286090736.[0m
[32m[I 2022-04-21 19:34:54,051][0m Trial 738 finished with value: 0.8351729822908422 and parameters: {'alpha': 3.9825866864676605, 'ties': 'breslow'}. Best is trial 70 with value: 0.835911286090736.[0m
[32m[I 2022-04-21 19:35:25,635][0m Trial 739 finished with value: 0.8357506386312487 and parameters: {'alpha': 3.7987081360738375, 'ties': 'breslow'}. Best is trial 70 with value: 0.835911286090736.[0m
[32m[I 2022-04-21 19:35:55,919][0m Trial 740 finished with value: 0.835598871889044 and parameters: {'alpha': 3.7081970549589682, 'ties': 'breslow'}. Best is trial 70 with value: 0.835911286090736.[0m
[32m[I 2022-04-21 19:36:26,702][0m Trial 741 finished with value: 0.8356374099959277 and parameters: {'alpha': 3.9321550103930742, 'ties': 'breslow'}. Best is trial 70 with value: 0.835911286090736.[0m
[32m[I 2022-04-21 19:36:59,263][0m Trial 742 finished with value: 0.8355429914931024 and parameters: {'alpha': 3.4176657596225666, 'ties': 'breslow'}. Best is trial 70 with value: 0.835911286090736.[0m
[32m[I 2022-04-21 19:37:32,625][0m Trial 743 finished with value: 0.8356695721462838 and parameters: {'alpha': 3.8308326041513374, 'ties': 'breslow'}. Best is trial 70 with value: 0.835911286090736.[0m
[32m[I 2022-04-21 19:38:05,269][0m Trial 744 finished with value: 0.8355193570680342 and parameters: {'alpha': 3.556578332439663, 'ties': 'breslow'}. Best is trial 70 with value: 0.835911286090736.[0m
[32m[I 2022-04-21 19:38:37,291][0m Trial 745 finished with value: 0.8355583611728576 and parameters: {'alpha': 3.6816555421762467, 'ties': 'breslow'}. Best is trial 70 with value: 0.835911286090736.[0m
[32m[I 2022-04-21 19:39:09,368][0m Trial 746 finished with value: 0.8352422931907615 and parameters: {'alpha': 4.097478547352771, 'ties': 'breslow'}. Best is trial 70 with value: 0.835911286090736.[0m
[32m[I 2022-04-21 19:39:40,585][0m Trial 747 finished with value: 0.835631502225942 and parameters: {'alpha': 3.7685355014992328, 'ties': 'efron'}. Best is trial 70 with value: 0.835911286090736.[0m
[32m[I 2022-04-21 19:40:13,514][0m Trial 748 finished with value: 0.8356281582736811 and parameters: {'alpha': 3.8925347760293065, 'ties': 'breslow'}. Best is trial 70 with value: 0.835911286090736.[0m
