[32m[I 2022-04-23 03:02:55,429][0m Trial 669 finished with value: 0.5148756023171417 and parameters: {'loss': 'coxph', 'learning_rate': 0.0998973109047183, 'n_estimators': 599, 'criterion': 'friedman_mse', 'min_samples_split': 9, 'min_samples_leaf': 4, 'min_weight_fraction_leaf': 0.006035150706812039, 'min_impurity_decrease': 0.5579527184264381, 'max_features': 0.6118692816213133, 'subsample': 0.23751934476141884, 'dropout_rate': 0.09359416080399702, 'ccp_alpha': 0.3942057307762098}. Best is trial 646 with value: 0.6676264917109616.[0m
[32m[I 2022-04-23 03:04:34,598][0m Trial 670 finished with value: 0.5274764932801516 and parameters: {'loss': 'coxph', 'learning_rate': 0.0553659056282719, 'n_estimators': 607, 'criterion': 'friedman_mse', 'min_samples_split': 9, 'min_samples_leaf': 4, 'min_weight_fraction_leaf': 0.0017089487004935539, 'min_impurity_decrease': 0.503666897185124, 'max_features': 0.6377466379892801, 'subsample': 0.25761361326127297, 'dropout_rate': 0.11209621531746033, 'ccp_alpha': 0.31630448171191566}. Best is trial 646 with value: 0.6676264917109616.[0m
/media/san2_ssd/data/Workdir/survival/venv/lib/python3.8/site-packages/sksurv/ensemble/boosting.py:955: RuntimeWarning: divide by zero encountered in log
  time = numpy.log(time)
/media/san2_ssd/data/Workdir/survival/venv/lib/python3.8/site-packages/sksurv/ensemble/boosting.py:955: RuntimeWarning: divide by zero encountered in log
  time = numpy.log(time)
/media/san2_ssd/data/Workdir/survival/venv/lib/python3.8/site-packages/sksurv/ensemble/boosting.py:955: RuntimeWarning: divide by zero encountered in log
  time = numpy.log(time)
/media/san2_ssd/data/Workdir/survival/venv/lib/python3.8/site-packages/sksurv/ensemble/boosting.py:955: RuntimeWarning: divide by zero encountered in log
  time = numpy.log(time)
[32m[I 2022-04-23 03:04:55,841][0m Trial 671 finished with value: -0.7357146938667365 and parameters: {'loss': 'squared', 'learning_rate': 0.07289860388689724, 'n_estimators': 621, 'criterion': 'friedman_mse', 'min_samples_split': 9, 'min_samples_leaf': 4, 'min_weight_fraction_leaf': 0.01089244692278504, 'min_impurity_decrease': 0.475011970922518, 'max_features': 0.5944794706689944, 'subsample': 0.2667647606976204, 'dropout_rate': 0.12997229392000495, 'ccp_alpha': 0.002812278225105087}. Best is trial 646 with value: 0.6676264917109616.[0m
[32m[I 2022-04-23 03:06:58,181][0m Trial 672 finished with value: 0.642185081817502 and parameters: {'loss': 'coxph', 'learning_rate': 0.04852046621800383, 'n_estimators': 696, 'criterion': 'friedman_mse', 'min_samples_split': 9, 'min_samples_leaf': 4, 'min_weight_fraction_leaf': 0.017307281099001197, 'min_impurity_decrease': 0.5396919236786647, 'max_features': 0.61985370913439, 'subsample': 0.23028191617108656, 'dropout_rate': 0.14606280284142928, 'ccp_alpha': 0.18298747201800353}. Best is trial 646 with value: 0.6676264917109616.[0m
[32m[I 2022-04-23 03:08:47,956][0m Trial 673 finished with value: 0.6536404851280379 and parameters: {'loss': 'coxph', 'learning_rate': 0.09983026109127492, 'n_estimators': 645, 'criterion': 'friedman_mse', 'min_samples_split': 9, 'min_samples_leaf': 4, 'min_weight_fraction_leaf': 0.019777014665645715, 'min_impurity_decrease': 0.5116041878487684, 'max_features': 0.6131329219192684, 'subsample': 0.2695766942846205, 'dropout_rate': 0.12203543451940328, 'ccp_alpha': 0.09906235391711274}. Best is trial 646 with value: 0.6676264917109616.[0m
[32m[I 2022-04-23 03:10:16,581][0m Trial 674 finished with value: 0.5 and parameters: {'loss': 'coxph', 'learning_rate': 0.06313186283048619, 'n_estimators': 590, 'criterion': 'absolute_error', 'min_samples_split': 9, 'min_samples_leaf': 5, 'min_weight_fraction_leaf': 0.026828551704756662, 'min_impurity_decrease': 0.5175579996778774, 'max_features': 0.8375791455107209, 'subsample': 0.24618154067977627, 'dropout_rate': 0.16408504720015468, 'ccp_alpha': 0.2238396462928611}. Best is trial 646 with value: 0.6676264917109616.[0m
[32m[I 2022-04-23 03:12:02,427][0m Trial 675 finished with value: 0.6598035378215081 and parameters: {'loss': 'coxph', 'learning_rate': 0.07749284701660807, 'n_estimators': 633, 'criterion': 'friedman_mse', 'min_samples_split': 9, 'min_samples_leaf': 4, 'min_weight_fraction_leaf': 0.03188940270042028, 'min_impurity_decrease': 0.48789878954191107, 'max_features': 0.631946734785462, 'subsample': 0.22804480991946321, 'dropout_rate': 0.1788928659650889, 'ccp_alpha': 0.08817873198905407}. Best is trial 646 with value: 0.6676264917109616.[0m
[32m[I 2022-04-23 03:13:35,019][0m Trial 676 finished with value: 0.657111137162518 and parameters: {'loss': 'coxph', 'learning_rate': 0.04221547511614543, 'n_estimators': 598, 'criterion': 'friedman_mse', 'min_samples_split': 9, 'min_samples_leaf': 4, 'min_weight_fraction_leaf': 0.010229967143004894, 'min_impurity_decrease': 0.527080320124626, 'max_features': 0.6531009679186743, 'subsample': 0.258873170926377, 'dropout_rate': 0.14503565723694756, 'ccp_alpha': 0.08813192925684117}. Best is trial 646 with value: 0.6676264917109616.[0m
[32m[I 2022-04-23 03:15:32,941][0m Trial 677 finished with value: 0.5006540204610004 and parameters: {'loss': 'coxph', 'learning_rate': 0.05663089770751345, 'n_estimators': 674, 'criterion': 'friedman_mse', 'min_samples_split': 9, 'min_samples_leaf': 4, 'min_weight_fraction_leaf': 0.0019584552223088775, 'min_impurity_decrease': 0.45693194448482866, 'max_features': 0.5881557429523013, 'subsample': 0.6982691433609254, 'dropout_rate': 0.12865726205009234, 'ccp_alpha': 0.1741420346043864}. Best is trial 646 with value: 0.6676264917109616.[0m
[32m[I 2022-04-23 03:17:10,118][0m Trial 678 finished with value: 0.6598063425928976 and parameters: {'loss': 'coxph', 'learning_rate': 0.07951923831307127, 'n_estimators': 594, 'criterion': 'friedman_mse', 'min_samples_split': 8, 'min_samples_leaf': 5, 'min_weight_fraction_leaf': 0.021072046617752735, 'min_impurity_decrease': 0.5489575558722127, 'max_features': 0.5995880552127278, 'subsample': 0.5564251293820075, 'dropout_rate': 0.17520856929575115, 'ccp_alpha': 0.007010060172625986}. Best is trial 646 with value: 0.6676264917109616.[0m
[32m[I 2022-04-23 03:18:52,149][0m Trial 679 finished with value: 0.6580338155400841 and parameters: {'loss': 'coxph', 'learning_rate': 0.04172128995286051, 'n_estimators': 626, 'criterion': 'friedman_mse', 'min_samples_split': 9, 'min_samples_leaf': 4, 'min_weight_fraction_leaf': 0.013212268714193235, 'min_impurity_decrease': 0.47614477677323297, 'max_features': 0.5742790351603565, 'subsample': 0.27709584943141874, 'dropout_rate': 0.18227899100542272, 'ccp_alpha': 0.007211865545012875}. Best is trial 646 with value: 0.6676264917109616.[0m
[32m[I 2022-04-23 03:20:35,877][0m Trial 680 finished with value: 0.559976890991606 and parameters: {'loss': 'coxph', 'learning_rate': 0.06051190860943506, 'n_estimators': 642, 'criterion': 'friedman_mse', 'min_samples_split': 9, 'min_samples_leaf': 4, 'min_weight_fraction_leaf': 0.029416603026880452, 'min_impurity_decrease': 0.5735942601754864, 'max_features': 0.6392231217026451, 'subsample': 0.24325193567244652, 'dropout_rate': 0.15797475767444955, 'ccp_alpha': 0.28096311043081634}. Best is trial 646 with value: 0.6676264917109616.[0m
[32m[I 2022-04-23 03:22:00,546][0m Trial 681 finished with value: 0.6508441318921123 and parameters: {'loss': 'coxph', 'learning_rate': 0.09926901820611263, 'n_estimators': 584, 'criterion': 'friedman_mse', 'min_samples_split': 9, 'min_samples_leaf': 4, 'min_weight_fraction_leaf': 0.017536871744351427, 'min_impurity_decrease': 0.5019751982637064, 'max_features': 0.6049551085122561, 'subsample': 0.2685267366536662, 'dropout_rate': 0.19260267235111883, 'ccp_alpha': 0.10669165940176481}. Best is trial 646 with value: 0.6676264917109616.[0m
[32m[I 2022-04-23 03:24:07,851][0m Trial 682 finished with value: 0.6568910964357089 and parameters: {'loss': 'coxph', 'learning_rate': 0.049807787158441856, 'n_estimators': 694, 'criterion': 'friedman_mse', 'min_samples_split': 9, 'min_samples_leaf': 7, 'min_weight_fraction_leaf': 0.009023804717876427, 'min_impurity_decrease': 0.4442706296852801, 'max_features': 0.6205339525597007, 'subsample': 0.2110955250486895, 'dropout_rate': 0.1595212134158935, 'ccp_alpha': 0.0041038113198529624}. Best is trial 646 with value: 0.6676264917109616.[0m
[32m[I 2022-04-23 03:25:49,484][0m Trial 683 finished with value: 0.5 and parameters: {'loss': 'coxph', 'learning_rate': 0.07098716614476594, 'n_estimators': 660, 'criterion': 'squared_error', 'min_samples_split': 9, 'min_samples_leaf': 6, 'min_weight_fraction_leaf': 0.03061914090363243, 'min_impurity_decrease': 0.5168568112806082, 'max_features': 0.8209280582163032, 'subsample': 0.2859382739501139, 'dropout_rate': 0.19945883010590112, 'ccp_alpha': 0.7047241647322585}. Best is trial 646 with value: 0.6676264917109616.[0m
[32m[I 2022-04-23 03:27:16,232][0m Trial 684 finished with value: 0.6441809744399137 and parameters: {'loss': 'coxph', 'learning_rate': 0.037948315977179924, 'n_estimators': 591, 'criterion': 'friedman_mse', 'min_samples_split': 9, 'min_samples_leaf': 4, 'min_weight_fraction_leaf': 0.028858734799223934, 'min_impurity_decrease': 0.4789273997266534, 'max_features': 0.651315449347573, 'subsample': 0.2454538805326941, 'dropout_rate': 0.17210654898642913, 'ccp_alpha': 0.17127224865766594}. Best is trial 646 with value: 0.6676264917109616.[0m
[32m[I 2022-04-23 03:29:36,714][0m Trial 685 finished with value: 0.653312139596805 and parameters: {'loss': 'coxph', 'learning_rate': 0.07400778528013159, 'n_estimators': 711, 'criterion': 'friedman_mse', 'min_samples_split': 9, 'min_samples_leaf': 5, 'min_weight_fraction_leaf': 0.016365693749721792, 'min_impurity_decrease': 0.5413056228933917, 'max_features': 0.5671201691546695, 'subsample': 0.263863506256465, 'dropout_rate': 0.09940646551067374, 'ccp_alpha': 0.09412616216832763}. Best is trial 646 with value: 0.6676264917109616.[0m
[32m[I 2022-04-23 03:31:22,928][0m Trial 686 finished with value: 0.6594140347697126 and parameters: {'loss': 'coxph', 'learning_rate': 0.05372826173136132, 'n_estimators': 615, 'criterion': 'friedman_mse', 'min_samples_split': 9, 'min_samples_leaf': 4, 'min_weight_fraction_leaf': 0.03689509030466658, 'min_impurity_decrease': 0.4924911437165641, 'max_features': 0.59582662934208, 'subsample': 0.226466019030424, 'dropout_rate': 0.139022896385264, 'ccp_alpha': 0.0025524040648122704}. Best is trial 646 with value: 0.6676264917109616.[0m
[32m[I 2022-04-23 03:33:12,359][0m Trial 687 finished with value: 0.5736667560420801 and parameters: {'loss': 'coxph', 'learning_rate': 0.06474816742998662, 'n_estimators': 660, 'criterion': 'friedman_mse', 'min_samples_split': 9, 'min_samples_leaf': 4, 'min_weight_fraction_leaf': 0.021601409167078416, 'min_impurity_decrease': 0.11393788402989458, 'max_features': 0.6259613253410443, 'subsample': 0.2936481358565748, 'dropout_rate': 0.18874321201873046, 'ccp_alpha': 0.24052170524131783}. Best is trial 646 with value: 0.6676264917109616.[0m
[32m[I 2022-04-23 03:34:56,876][0m Trial 688 finished with value: 0.6648709444434484 and parameters: {'loss': 'coxph', 'learning_rate': 0.0794674813857563, 'n_estimators': 616, 'criterion': 'friedman_mse', 'min_samples_split': 9, 'min_samples_leaf': 4, 'min_weight_fraction_leaf': 0.00931024346123041, 'min_impurity_decrease': 0.5978473708660177, 'max_features': 0.7961553755125921, 'subsample': 0.27923938527392955, 'dropout_rate': 0.15067520575727186, 'ccp_alpha': 0.0029500530953266123}. Best is trial 646 with value: 0.6676264917109616.[0m
[32m[I 2022-04-23 03:36:39,567][0m Trial 689 finished with value: 0.6354989674450998 and parameters: {'loss': 'coxph', 'learning_rate': 0.0827495741748488, 'n_estimators': 620, 'criterion': 'friedman_mse', 'min_samples_split': 9, 'min_samples_leaf': 4, 'min_weight_fraction_leaf': 0.016207470882136414, 'min_impurity_decrease': 0.6268974165455823, 'max_features': 0.8528114639358775, 'subsample': 0.29819475974332704, 'dropout_rate': 0.14529847836448945, 'ccp_alpha': 0.16955850200638192}. Best is trial 646 with value: 0.6676264917109616.[0m
[32m[I 2022-04-23 03:38:16,404][0m Trial 690 finished with value: 0.6691837560454439 and parameters: {'loss': 'coxph', 'learning_rate': 0.08266604590428857, 'n_estimators': 584, 'criterion': 'friedman_mse', 'min_samples_split': 9, 'min_samples_leaf': 4, 'min_weight_fraction_leaf': 0.023474768557727486, 'min_impurity_decrease': 0.5253186542278785, 'max_features': 0.5510068485397087, 'subsample': 0.2568976947012673, 'dropout_rate': 0.10681648818139163, 'ccp_alpha': 0.0010330803066994957}. Best is trial 690 with value: 0.6691837560454439.[0m
[32m[I 2022-04-23 03:39:50,470][0m Trial 691 finished with value: 0.656263812895339 and parameters: {'loss': 'coxph', 'learning_rate': 0.09893243673754613, 'n_estimators': 589, 'criterion': 'friedman_mse', 'min_samples_split': 9, 'min_samples_leaf': 4, 'min_weight_fraction_leaf': 0.0039016896587693965, 'min_impurity_decrease': 0.5840378018045078, 'max_features': 0.8104512695915576, 'subsample': 0.2746867319344473, 'dropout_rate': 0.11166643767596236, 'ccp_alpha': 0.09497033890736052}. Best is trial 690 with value: 0.6691837560454439.[0m
/media/san2_ssd/data/Workdir/survival/venv/lib/python3.8/site-packages/sksurv/ensemble/boosting.py:955: RuntimeWarning: divide by zero encountered in log
  time = numpy.log(time)
/media/san2_ssd/data/Workdir/survival/venv/lib/python3.8/site-packages/sksurv/ensemble/boosting.py:955: RuntimeWarning: divide by zero encountered in log
  time = numpy.log(time)
/media/san2_ssd/data/Workdir/survival/venv/lib/python3.8/site-packages/sksurv/ensemble/boosting.py:955: RuntimeWarning: divide by zero encountered in log
  time = numpy.log(time)
/media/san2_ssd/data/Workdir/survival/venv/lib/python3.8/site-packages/sksurv/ensemble/boosting.py:955: RuntimeWarning: divide by zero encountered in log
  time = numpy.log(time)
[32m[I 2022-04-23 03:40:11,245][0m Trial 692 finished with value: -0.7344204479008626 and parameters: {'loss': 'squared', 'learning_rate': 0.09967004030675602, 'n_estimators': 617, 'criterion': 'friedman_mse', 'min_samples_split': 9, 'min_samples_leaf': 4, 'min_weight_fraction_leaf': 0.009403349133628267, 'min_impurity_decrease': 0.5429981622595567, 'max_features': 0.7998691893244337, 'subsample': 0.2205553109752331, 'dropout_rate': 0.06523640344299811, 'ccp_alpha': 0.30107252448252264}. Best is trial 690 with value: 0.6691837560454439.[0m
[32m[I 2022-04-23 03:41:39,871][0m Trial 693 finished with value: 0.5 and parameters: {'loss': 'coxph', 'learning_rate': 0.08077342012561024, 'n_estimators': 583, 'criterion': 'friedman_mse', 'min_samples_split': 9, 'min_samples_leaf': 4, 'min_weight_fraction_leaf': 0.001056318032728723, 'min_impurity_decrease': 0.510831684801103, 'max_features': 0.5494159387246006, 'subsample': 0.31200972904460533, 'dropout_rate': 0.09600919689698721, 'ccp_alpha': 0.4529495524503747}. Best is trial 690 with value: 0.6691837560454439.[0m
[32m[I 2022-04-23 03:43:31,966][0m Trial 694 finished with value: 0.6508464602946743 and parameters: {'loss': 'coxph', 'learning_rate': 0.08148097143469768, 'n_estimators': 647, 'criterion': 'friedman_mse', 'min_samples_split': 9, 'min_samples_leaf': 4, 'min_weight_fraction_leaf': 0.021749966645298383, 'min_impurity_decrease': 0.5604375089915892, 'max_features': 0.8318984944572914, 'subsample': 0.2850582848904795, 'dropout_rate': 0.12521605611908926, 'ccp_alpha': 0.09436009667456192}. Best is trial 690 with value: 0.6691837560454439.[0m
[32m[I 2022-04-23 03:45:13,571][0m Trial 695 finished with value: 0.630900474848485 and parameters: {'loss': 'coxph', 'learning_rate': 0.07753267947267928, 'n_estimators': 607, 'criterion': 'friedman_mse', 'min_samples_split': 9, 'min_samples_leaf': 4, 'min_weight_fraction_leaf': 0.02509108837524777, 'min_impurity_decrease': 0.5242923154772098, 'max_features': 0.7786044058674252, 'subsample': 0.24274336841811206, 'dropout_rate': 0.13701242185006404, 'ccp_alpha': 0.18145128287250306}. Best is trial 690 with value: 0.6691837560454439.[0m
[32m[I 2022-04-23 03:46:45,984][0m Trial 696 finished with value: 0.653696679859513 and parameters: {'loss': 'coxph', 'learning_rate': 0.06775716889482784, 'n_estimators': 576, 'criterion': 'friedman_mse', 'min_samples_split': 9, 'min_samples_leaf': 4, 'min_weight_fraction_leaf': 0.03286621919729023, 'min_impurity_decrease': 0.5263529923119993, 'max_features': 0.7822038104835123, 'subsample': 0.2678580928047078, 'dropout_rate': 0.11575231370613281, 'ccp_alpha': 0.0912025741910272}. Best is trial 690 with value: 0.6691837560454439.[0m
[32m[I 2022-04-23 03:48:46,619][0m Trial 697 finished with value: 0.6534308566849646 and parameters: {'loss': 'coxph', 'learning_rate': 0.0005277037688249254, 'n_estimators': 640, 'criterion': 'friedman_mse', 'min_samples_split': 9, 'min_samples_leaf': 4, 'min_weight_fraction_leaf': 0.01638563371289086, 'min_impurity_decrease': 0.594600144155778, 'max_features': 0.8081527399418141, 'subsample': 0.2053290855989046, 'dropout_rate': 0.10269636839866025, 'ccp_alpha': 0.001949960987156463}. Best is trial 690 with value: 0.6691837560454439.[0m
[32m[I 2022-04-23 03:50:54,408][0m Trial 698 finished with value: 0.5620197108933385 and parameters: {'loss': 'coxph', 'learning_rate': 0.08200658907641785, 'n_estimators': 686, 'criterion': 'friedman_mse', 'min_samples_split': 8, 'min_samples_leaf': 4, 'min_weight_fraction_leaf': 0.0010195684339573512, 'min_impurity_decrease': 0.558602276211903, 'max_features': 0.7761499504723404, 'subsample': 0.4702722738245422, 'dropout_rate': 0.05488748283572055, 'ccp_alpha': 0.19683562760878837}. Best is trial 690 with value: 0.6691837560454439.[0m
[32m[I 2022-04-23 03:52:27,341][0m Trial 699 finished with value: 0.5 and parameters: {'loss': 'coxph', 'learning_rate': 0.09949826716411458, 'n_estimators': 606, 'criterion': 'absolute_error', 'min_samples_split': 9, 'min_samples_leaf': 5, 'min_weight_fraction_leaf': 0.03021429461726059, 'min_impurity_decrease': 0.5276118336077096, 'max_features': 0.8726577336763561, 'subsample': 0.29438236475163226, 'dropout_rate': 0.1559672571123702, 'ccp_alpha': 0.32586485995156766}. Best is trial 690 with value: 0.6691837560454439.[0m
[32m[I 2022-04-23 03:54:52,346][0m Trial 700 finished with value: 0.6522144341547315 and parameters: {'loss': 'coxph', 'learning_rate': 0.06541586058530022, 'n_estimators': 741, 'criterion': 'friedman_mse', 'min_samples_split': 9, 'min_samples_leaf': 4, 'min_weight_fraction_leaf': 0.011968404284967328, 'min_impurity_decrease': 0.6467495393404136, 'max_features': 0.793582193638284, 'subsample': 0.31291516795486446, 'dropout_rate': 0.08440982469612808, 'ccp_alpha': 0.09293424835334178}. Best is trial 690 with value: 0.6691837560454439.[0m
[32m[I 2022-04-23 03:56:35,794][0m Trial 701 finished with value: 0.6565642329582071 and parameters: {'loss': 'coxph', 'learning_rate': 0.07876070305179753, 'n_estimators': 630, 'criterion': 'friedman_mse', 'min_samples_split': 9, 'min_samples_leaf': 4, 'min_weight_fraction_leaf': 0.010651918930431731, 'min_impurity_decrease': 0.5021543779412746, 'max_features': 0.8203586585962814, 'subsample': 0.25379978368571476, 'dropout_rate': 0.12466319999584759, 'ccp_alpha': 0.09827404236224606}. Best is trial 690 with value: 0.6691837560454439.[0m
[32m[I 2022-04-23 03:58:12,542][0m Trial 702 finished with value: 0.6584605481684845 and parameters: {'loss': 'coxph', 'learning_rate': 0.0646110072168917, 'n_estimators': 571, 'criterion': 'friedman_mse', 'min_samples_split': 9, 'min_samples_leaf': 4, 'min_weight_fraction_leaf': 0.0338331708543345, 'min_impurity_decrease': 0.5029181230409348, 'max_features': 0.5485979098780586, 'subsample': 0.2326202600260442, 'dropout_rate': 0.0782543074558976, 'ccp_alpha': 0.003247355929073749}. Best is trial 690 with value: 0.6691837560454439.[0m
[32m[I 2022-04-23 04:00:06,543][0m Trial 703 finished with value: 0.5899278140644263 and parameters: {'loss': 'coxph', 'learning_rate': 0.08116527782187903, 'n_estimators': 667, 'criterion': 'friedman_mse', 'min_samples_split': 9, 'min_samples_leaf': 4, 'min_weight_fraction_leaf': 0.02482323007045644, 'min_impurity_decrease': 0.4885340128077518, 'max_features': 0.6486589813099866, 'subsample': 0.2739621375283985, 'dropout_rate': 0.15047842277744217, 'ccp_alpha': 0.23319024939257918}. Best is trial 690 with value: 0.6691837560454439.[0m
[32m[I 2022-04-23 04:01:31,276][0m Trial 704 finished with value: 0.5006540204610004 and parameters: {'loss': 'coxph', 'learning_rate': 0.057603042067853896, 'n_estimators': 588, 'criterion': 'friedman_mse', 'min_samples_split': 9, 'min_samples_leaf': 5, 'min_weight_fraction_leaf': 0.035722567325797636, 'min_impurity_decrease': 0.539424416362236, 'max_features': 0.7930281172086757, 'subsample': 0.9499646707127117, 'dropout_rate': 0.16914251331179975, 'ccp_alpha': 0.1615060933561904}. Best is trial 690 with value: 0.6691837560454439.[0m
[32m[I 2022-04-23 04:03:06,812][0m Trial 705 finished with value: 0.5 and parameters: {'loss': 'coxph', 'learning_rate': 0.09995419969893932, 'n_estimators': 614, 'criterion': 'squared_error', 'min_samples_split': 9, 'min_samples_leaf': 4, 'min_weight_fraction_leaf': 0.03901999725073907, 'min_impurity_decrease': 0.5256038179312974, 'max_features': 0.5665523423905905, 'subsample': 0.2937620097380414, 'dropout_rate': 0.1363614319844823, 'ccp_alpha': 2.5760755108365}. Best is trial 690 with value: 0.6691837560454439.[0m
