[32m[I 2022-04-21 11:37:49,254][0m Trial 172 finished with value: 0.8074618645702479 and parameters: {'splitter': 'best', 'min_samples_split': 0.11753722639184608, 'min_samples_leaf': 0.0193517923404656, 'min_weight_fraction_leaf': 0.028301582882828167, 'max_features': 0.30987432013373317}. Best is trial 105 with value: 0.8252433813646162.[0m
/media/san2_ssd/data/Workdir/survival/utils.py:305: RuntimeWarning: invalid value encountered in true_divide
  pdfs = np.gradient(1-survs,axis=1)/norms
[32m[I 2022-04-21 11:37:49,979][0m Trial 173 finished with value: 0.8189873579531094 and parameters: {'splitter': 'best', 'min_samples_split': 0.10493789617500937, 'min_samples_leaf': 0.008181040464194055, 'min_weight_fraction_leaf': 3.6798649315668286e-06, 'max_features': 0.34776719260391603}. Best is trial 105 with value: 0.8252433813646162.[0m
/media/san2_ssd/data/Workdir/survival/utils.py:305: RuntimeWarning: invalid value encountered in true_divide
  pdfs = np.gradient(1-survs,axis=1)/norms
[32m[I 2022-04-21 11:37:50,650][0m Trial 174 finished with value: 0.7943736968459703 and parameters: {'splitter': 'best', 'min_samples_split': 0.1048609133319731, 'min_samples_leaf': 0.012266309868546417, 'min_weight_fraction_leaf': 0.008686448790268786, 'max_features': 0.3336620398241885}. Best is trial 105 with value: 0.8252433813646162.[0m
/media/san2_ssd/data/Workdir/survival/utils.py:305: RuntimeWarning: invalid value encountered in true_divide
  pdfs = np.gradient(1-survs,axis=1)/norms
[32m[I 2022-04-21 11:37:51,147][0m Trial 175 finished with value: 0.8049809019377603 and parameters: {'splitter': 'best', 'min_samples_split': 0.0916923015416242, 'min_samples_leaf': 0.021098318137265024, 'min_weight_fraction_leaf': 0.0001453120724378039, 'max_features': 0.4327637247126612}. Best is trial 105 with value: 0.8252433813646162.[0m
[32m[I 2022-04-21 11:37:51,290][0m Trial 176 finished with value: 0.5623644072073779 and parameters: {'splitter': 'best', 'min_samples_split': 0.10823991646638202, 'min_samples_leaf': 0.359374290682044, 'min_weight_fraction_leaf': 0.0171115455044452, 'max_features': 0.3815122090688154}. Best is trial 105 with value: 0.8252433813646162.[0m
[32m[I 2022-04-21 11:37:51,403][0m Trial 177 finished with value: 0.5642562311096825 and parameters: {'splitter': 'best', 'min_samples_split': 0.1320891202437354, 'min_samples_leaf': 0.487820402737428, 'min_weight_fraction_leaf': 0.03905758178378927, 'max_features': 0.40741906474117434}. Best is trial 105 with value: 0.8252433813646162.[0m
[32m[I 2022-04-21 11:37:52,016][0m Trial 178 finished with value: 0.8136090946966421 and parameters: {'splitter': 'best', 'min_samples_split': 0.14768207693689994, 'min_samples_leaf': 0.04112236630165086, 'min_weight_fraction_leaf': 0.010163392670842847, 'max_features': 0.6126571390261281}. Best is trial 105 with value: 0.8252433813646162.[0m
[32m[I 2022-04-21 11:37:52,314][0m Trial 179 finished with value: 0.47495774536239777 and parameters: {'splitter': 'best', 'min_samples_split': 0.10043863938892145, 'min_samples_leaf': 0.0012818086128996483, 'min_weight_fraction_leaf': 0.4095885037347545, 'max_features': 0.363716403980005}. Best is trial 105 with value: 0.8252433813646162.[0m
[32m[I 2022-04-21 11:37:53,067][0m Trial 180 finished with value: 0.7995037741989048 and parameters: {'splitter': 'best', 'min_samples_split': 0.08646856714643508, 'min_samples_leaf': 0.0280222738250119, 'min_weight_fraction_leaf': 0.026875466925920626, 'max_features': 0.38857676648603656}. Best is trial 105 with value: 0.8252433813646162.[0m
[32m[I 2022-04-21 11:37:54,123][0m Trial 181 finished with value: 0.8136510705743867 and parameters: {'splitter': 'best', 'min_samples_split': 0.11907321899940504, 'min_samples_leaf': 0.010509523104946576, 'min_weight_fraction_leaf': 6.74563618571807e-05, 'max_features': 0.34988997389139165}. Best is trial 105 with value: 0.8252433813646162.[0m
/media/san2_ssd/data/Workdir/survival/utils.py:305: RuntimeWarning: invalid value encountered in true_divide
  pdfs = np.gradient(1-survs,axis=1)/norms
[32m[I 2022-04-21 11:37:54,707][0m Trial 182 finished with value: 0.81600131760365 and parameters: {'splitter': 'best', 'min_samples_split': 0.12997395793800828, 'min_samples_leaf': 0.011871540168304804, 'min_weight_fraction_leaf': 0.018536886619646552, 'max_features': 0.4219079822255874}. Best is trial 105 with value: 0.8252433813646162.[0m
[32m[I 2022-04-21 11:37:54,807][0m Trial 183 finished with value: 0.572967289192524 and parameters: {'splitter': 'best', 'min_samples_split': 0.11265611539438587, 'min_samples_leaf': 0.39520954702785227, 'min_weight_fraction_leaf': 0.015900553850704352, 'max_features': 0.332364719004306}. Best is trial 105 with value: 0.8252433813646162.[0m
[32m[I 2022-04-21 11:37:55,500][0m Trial 184 finished with value: 0.8111530531273206 and parameters: {'splitter': 'best', 'min_samples_split': 0.09871337628760657, 'min_samples_leaf': 0.021537666735804695, 'min_weight_fraction_leaf': 0.033495943041234516, 'max_features': 0.48649640817517015}. Best is trial 105 with value: 0.8252433813646162.[0m
/media/san2_ssd/data/Workdir/survival/utils.py:305: RuntimeWarning: invalid value encountered in true_divide
  pdfs = np.gradient(1-survs,axis=1)/norms
/media/san2_ssd/data/Workdir/survival/utils.py:305: RuntimeWarning: invalid value encountered in true_divide
  pdfs = np.gradient(1-survs,axis=1)/norms
[32m[I 2022-04-21 11:37:56,185][0m Trial 185 finished with value: 0.8021739309823814 and parameters: {'splitter': 'best', 'min_samples_split': 0.058083802223683416, 'min_samples_leaf': 0.008945708319675939, 'min_weight_fraction_leaf': 8.533549056460006e-05, 'max_features': 0.3586730720079828}. Best is trial 105 with value: 0.8252433813646162.[0m
[32m[I 2022-04-21 11:37:56,413][0m Trial 186 finished with value: 0.8156177118813186 and parameters: {'splitter': 'best', 'min_samples_split': 0.12096561981639206, 'min_samples_leaf': 0.034005093704892936, 'min_weight_fraction_leaf': 0.023485666338757493, 'max_features': 0.3946233620537342}. Best is trial 105 with value: 0.8252433813646162.[0m
[32m[I 2022-04-21 11:37:56,843][0m Trial 187 finished with value: 0.8095036599194654 and parameters: {'splitter': 'best', 'min_samples_split': 0.13715178637662928, 'min_samples_leaf': 0.0013981902880266352, 'min_weight_fraction_leaf': 0.010980175855282721, 'max_features': 0.44380599466122583}. Best is trial 105 with value: 0.8252433813646162.[0m
[32m[I 2022-04-21 11:37:57,107][0m Trial 188 finished with value: 0.7975376168292947 and parameters: {'splitter': 'best', 'min_samples_split': 0.16695890315193856, 'min_samples_leaf': 0.020475268130857156, 'min_weight_fraction_leaf': 0.04909131448316989, 'max_features': 0.3729113504475504}. Best is trial 105 with value: 0.8252433813646162.[0m
[32m[I 2022-04-21 11:37:57,597][0m Trial 189 finished with value: 0.8170398964307131 and parameters: {'splitter': 'best', 'min_samples_split': 0.10843597238138941, 'min_samples_leaf': 0.010413302103560583, 'min_weight_fraction_leaf': 0.018039861489792117, 'max_features': 0.6694529515003551}. Best is trial 105 with value: 0.8252433813646162.[0m
[32m[I 2022-04-21 11:37:58,158][0m Trial 190 finished with value: 0.8106275014358264 and parameters: {'splitter': 'best', 'min_samples_split': 0.09212506398992878, 'min_samples_leaf': 0.04648433228693983, 'min_weight_fraction_leaf': 0.03686908531401895, 'max_features': 0.728446769576458}. Best is trial 105 with value: 0.8252433813646162.[0m
/media/san2_ssd/data/Workdir/survival/utils.py:305: RuntimeWarning: invalid value encountered in true_divide
  pdfs = np.gradient(1-survs,axis=1)/norms
/media/san2_ssd/data/Workdir/survival/utils.py:305: RuntimeWarning: invalid value encountered in true_divide
  pdfs = np.gradient(1-survs,axis=1)/norms
[32m[I 2022-04-21 11:37:58,927][0m Trial 191 finished with value: 0.8039483051110745 and parameters: {'splitter': 'best', 'min_samples_split': 0.10740829586856657, 'min_samples_leaf': 0.010735971723427412, 'min_weight_fraction_leaf': 0.01673574849524349, 'max_features': 0.4095757878630835}. Best is trial 105 with value: 0.8252433813646162.[0m
[32m[I 2022-04-21 11:37:59,181][0m Trial 192 finished with value: 0.5666834983541463 and parameters: {'splitter': 'best', 'min_samples_split': 0.11539412008861268, 'min_samples_leaf': 0.305924410774386, 'min_weight_fraction_leaf': 0.008839050204291168, 'max_features': 0.42474348522756095}. Best is trial 105 with value: 0.8252433813646162.[0m
[32m[I 2022-04-21 11:37:59,925][0m Trial 193 finished with value: 0.8036431146542153 and parameters: {'splitter': 'best', 'min_samples_split': 0.07451979819931223, 'min_samples_leaf': 0.025559087503734222, 'min_weight_fraction_leaf': 0.024646556521923796, 'max_features': 0.4600862305513817}. Best is trial 105 with value: 0.8252433813646162.[0m
/media/san2_ssd/data/Workdir/survival/utils.py:305: RuntimeWarning: invalid value encountered in true_divide
  pdfs = np.gradient(1-survs,axis=1)/norms
/media/san2_ssd/data/Workdir/survival/utils.py:305: RuntimeWarning: invalid value encountered in true_divide
  pdfs = np.gradient(1-survs,axis=1)/norms
[32m[I 2022-04-21 11:38:00,513][0m Trial 194 finished with value: 0.7992437267681897 and parameters: {'splitter': 'best', 'min_samples_split': 0.12761094416844623, 'min_samples_leaf': 0.010068322339262989, 'min_weight_fraction_leaf': 0.008134898005782154, 'max_features': 0.3007446886958583}. Best is trial 105 with value: 0.8252433813646162.[0m
[32m[I 2022-04-21 11:38:00,944][0m Trial 195 finished with value: 0.8216387357878698 and parameters: {'splitter': 'best', 'min_samples_split': 0.09993742136596681, 'min_samples_leaf': 0.018340689025914913, 'min_weight_fraction_leaf': 0.01808747179103789, 'max_features': 0.3446485235619995}. Best is trial 105 with value: 0.8252433813646162.[0m
[32m[I 2022-04-21 11:38:01,880][0m Trial 196 finished with value: 0.8137787271480169 and parameters: {'splitter': 'best', 'min_samples_split': 0.100973031947789, 'min_samples_leaf': 0.018777176949651073, 'min_weight_fraction_leaf': 0.027541687669283416, 'max_features': 0.3750117881767132}. Best is trial 105 with value: 0.8252433813646162.[0m
[32m[I 2022-04-21 11:38:02,297][0m Trial 197 finished with value: 0.8106102283621481 and parameters: {'splitter': 'best', 'min_samples_split': 0.0881312313695218, 'min_samples_leaf': 0.03386726223012937, 'min_weight_fraction_leaf': 0.008906379133039398, 'max_features': 0.39336486995627007}. Best is trial 105 with value: 0.8252433813646162.[0m
[32m[I 2022-04-21 11:38:02,872][0m Trial 198 finished with value: 0.8160976458755155 and parameters: {'splitter': 'best', 'min_samples_split': 0.08098319073189644, 'min_samples_leaf': 0.026447252360692255, 'min_weight_fraction_leaf': 0.00024406654327557736, 'max_features': 0.6740622047652043}. Best is trial 105 with value: 0.8252433813646162.[0m
[32m[I 2022-04-21 11:38:03,204][0m Trial 199 finished with value: 0.8166868116238504 and parameters: {'splitter': 'best', 'min_samples_split': 0.10798468627525298, 'min_samples_leaf': 0.017848394154544082, 'min_weight_fraction_leaf': 0.01575227800748571, 'max_features': 0.32060824137947785}. Best is trial 105 with value: 0.8252433813646162.[0m
[32m[I 2022-04-21 11:38:03,645][0m Trial 200 finished with value: 0.8011159913016364 and parameters: {'splitter': 'best', 'min_samples_split': 0.09597613182654421, 'min_samples_leaf': 0.009105353299544754, 'min_weight_fraction_leaf': 0.04395309663601616, 'max_features': 0.44001263929748713}. Best is trial 105 with value: 0.8252433813646162.[0m
[32m[I 2022-04-21 11:38:03,793][0m Trial 201 finished with value: 0.5626294700602272 and parameters: {'splitter': 'best', 'min_samples_split': 0.12045734021427193, 'min_samples_leaf': 0.0014638424377893785, 'min_weight_fraction_leaf': 0.3537489023946629, 'max_features': 0.34569596287760207}. Best is trial 105 with value: 0.8252433813646162.[0m
[32m[I 2022-04-21 11:38:04,112][0m Trial 202 finished with value: 0.8101129473851533 and parameters: {'splitter': 'best', 'min_samples_split': 0.11382653569326781, 'min_samples_leaf': 0.016055352476367128, 'min_weight_fraction_leaf': 0.01866329791394678, 'max_features': 0.3576717891946377}. Best is trial 105 with value: 0.8252433813646162.[0m
[32m[I 2022-04-21 11:38:04,920][0m Trial 203 finished with value: 0.8065943387052761 and parameters: {'splitter': 'best', 'min_samples_split': 0.14321856249475307, 'min_samples_leaf': 0.0017871346052197063, 'min_weight_fraction_leaf': 0.02392273895566023, 'max_features': 0.3878525991340604}. Best is trial 105 with value: 0.8252433813646162.[0m
[32m[I 2022-04-21 11:38:05,488][0m Trial 204 finished with value: 0.8127346376987946 and parameters: {'splitter': 'best', 'min_samples_split': 0.10431908133097939, 'min_samples_leaf': 0.0277470275562332, 'min_weight_fraction_leaf': 0.007303303111866796, 'max_features': 0.4113779226848294}. Best is trial 105 with value: 0.8252433813646162.[0m
[32m[I 2022-04-21 11:38:05,847][0m Trial 205 finished with value: 0.7951476029087358 and parameters: {'splitter': 'best', 'min_samples_split': 0.12855467781790822, 'min_samples_leaf': 0.01058671319846292, 'min_weight_fraction_leaf': 0.03294306645106009, 'max_features': 0.3709616946095035}. Best is trial 105 with value: 0.8252433813646162.[0m
[32m[I 2022-04-21 11:38:06,211][0m Trial 206 finished with value: 0.7979977651400967 and parameters: {'splitter': 'best', 'min_samples_split': 0.09316287937046103, 'min_samples_leaf': 0.03949763840465731, 'min_weight_fraction_leaf': 0.016305227857972844, 'max_features': 0.3427925785069832}. Best is trial 105 with value: 0.8252433813646162.[0m
[32m[I 2022-04-21 11:38:06,559][0m Trial 207 finished with value: 0.6687174656743641 and parameters: {'splitter': 'best', 'min_samples_split': 0.11515302252622804, 'min_samples_leaf': 0.0011796695461585406, 'min_weight_fraction_leaf': 0.29814165481715044, 'max_features': 0.4223058891374604}. Best is trial 105 with value: 0.8252433813646162.[0m
/media/san2_ssd/data/Workdir/survival/utils.py:305: RuntimeWarning: invalid value encountered in true_divide
  pdfs = np.gradient(1-survs,axis=1)/norms
[32m[I 2022-04-21 11:38:07,245][0m Trial 208 finished with value: 0.8264270922211081 and parameters: {'splitter': 'best', 'min_samples_split': 0.068009383698499, 'min_samples_leaf': 0.02061706138152193, 'min_weight_fraction_leaf': 0.00019879969441686325, 'max_features': 0.39727874032078486}. Best is trial 208 with value: 0.8264270922211081.[0m
/media/san2_ssd/data/Workdir/survival/utils.py:305: RuntimeWarning: invalid value encountered in true_divide
  pdfs = np.gradient(1-survs,axis=1)/norms
/media/san2_ssd/data/Workdir/survival/utils.py:305: RuntimeWarning: invalid value encountered in true_divide
  pdfs = np.gradient(1-survs,axis=1)/norms
[32m[I 2022-04-21 11:38:07,591][0m Trial 209 finished with value: 0.8063264389886686 and parameters: {'splitter': 'best', 'min_samples_split': 0.07075481277933435, 'min_samples_leaf': 0.020913727832721718, 'min_weight_fraction_leaf': 0.0018808361204581828, 'max_features': 0.646419164500458}. Best is trial 208 with value: 0.8264270922211081.[0m
[32m[I 2022-04-21 11:38:07,841][0m Trial 210 finished with value: 0.8089959963936518 and parameters: {'splitter': 'best', 'min_samples_split': 0.08184502918481322, 'min_samples_leaf': 0.03338647974198149, 'min_weight_fraction_leaf': 0.008455846096298637, 'max_features': 0.4811362942312333}. Best is trial 208 with value: 0.8264270922211081.[0m
/media/san2_ssd/data/Workdir/survival/utils.py:305: RuntimeWarning: invalid value encountered in true_divide
  pdfs = np.gradient(1-survs,axis=1)/norms
[32m[I 2022-04-21 11:38:08,162][0m Trial 211 finished with value: 0.802446517385864 and parameters: {'splitter': 'best', 'min_samples_split': 0.10462813303936017, 'min_samples_leaf': 0.014220306403604287, 'min_weight_fraction_leaf': 0.00028699065587029426, 'max_features': 0.39108372882505854}. Best is trial 208 with value: 0.8264270922211081.[0m
/media/san2_ssd/data/Workdir/survival/utils.py:305: RuntimeWarning: invalid value encountered in true_divide
  pdfs = np.gradient(1-survs,axis=1)/norms
/media/san2_ssd/data/Workdir/survival/utils.py:305: RuntimeWarning: invalid value encountered in true_divide
  pdfs = np.gradient(1-survs,axis=1)/norms
/media/san2_ssd/data/Workdir/survival/utils.py:305: RuntimeWarning: invalid value encountered in true_divide
  pdfs = np.gradient(1-survs,axis=1)/norms
[32m[I 2022-04-21 11:38:08,430][0m Trial 212 finished with value: 0.8181262056294317 and parameters: {'splitter': 'best', 'min_samples_split': 0.05979024499080165, 'min_samples_leaf': 0.020559878359967775, 'min_weight_fraction_leaf': 0.017974642340493292, 'max_features': 0.4042185140397541}. Best is trial 208 with value: 0.8264270922211081.[0m
[32m[I 2022-04-21 11:38:08,822][0m Trial 213 finished with value: 0.8101683837121951 and parameters: {'splitter': 'best', 'min_samples_split': 0.06437272135442522, 'min_samples_leaf': 0.02422546405742589, 'min_weight_fraction_leaf': 0.014982617769152504, 'max_features': 0.4080838797100058}. Best is trial 208 with value: 0.8264270922211081.[0m
/media/san2_ssd/data/Workdir/survival/utils.py:305: RuntimeWarning: invalid value encountered in true_divide
  pdfs = np.gradient(1-survs,axis=1)/norms
[32m[I 2022-04-21 11:38:09,385][0m Trial 214 finished with value: 0.8087813709120271 and parameters: {'splitter': 'best', 'min_samples_split': 0.05755318550539019, 'min_samples_leaf': 0.016784987590333703, 'min_weight_fraction_leaf': 0.025141972732270278, 'max_features': 0.4367807217737741}. Best is trial 208 with value: 0.8264270922211081.[0m
/media/san2_ssd/data/Workdir/survival/utils.py:305: RuntimeWarning: invalid value encountered in true_divide
  pdfs = np.gradient(1-survs,axis=1)/norms
[32m[I 2022-04-21 11:38:09,874][0m Trial 215 finished with value: 0.816727185197279 and parameters: {'splitter': 'best', 'min_samples_split': 0.049729777227001296, 'min_samples_leaf': 0.030032644280219643, 'min_weight_fraction_leaf': 0.0003162825437145905, 'max_features': 0.39354416959055205}. Best is trial 208 with value: 0.8264270922211081.[0m
/media/san2_ssd/data/Workdir/survival/utils.py:305: RuntimeWarning: invalid value encountered in true_divide
  pdfs = np.gradient(1-survs,axis=1)/norms
[32m[I 2022-04-21 11:38:10,563][0m Trial 216 finished with value: 0.8154739702306429 and parameters: {'splitter': 'best', 'min_samples_split': 0.06892869318126292, 'min_samples_leaf': 0.009363987179706731, 'min_weight_fraction_leaf': 0.012261735108118831, 'max_features': 0.42555101385441046}. Best is trial 208 with value: 0.8264270922211081.[0m
[32m[I 2022-04-21 11:38:11,020][0m Trial 217 finished with value: 0.8186570406091505 and parameters: {'splitter': 'best', 'min_samples_split': 0.08587315193985273, 'min_samples_leaf': 0.020781886599141403, 'min_weight_fraction_leaf': 0.029160046439415877, 'max_features': 0.4530205470462949}. Best is trial 208 with value: 0.8264270922211081.[0m
[32m[I 2022-04-21 11:38:11,496][0m Trial 218 finished with value: 0.8160474588780676 and parameters: {'splitter': 'best', 'min_samples_split': 0.08008207809600063, 'min_samples_leaf': 0.022413831131908653, 'min_weight_fraction_leaf': 0.03329153879766092, 'max_features': 0.5002055076581929}. Best is trial 208 with value: 0.8264270922211081.[0m
[32m[I 2022-04-21 11:38:11,844][0m Trial 219 finished with value: 0.8143078316375322 and parameters: {'splitter': 'best', 'min_samples_split': 0.08676269876438333, 'min_samples_leaf': 0.050080323559270695, 'min_weight_fraction_leaf': 0.009023448081994186, 'max_features': 0.4518473648565218}. Best is trial 208 with value: 0.8264270922211081.[0m
/media/san2_ssd/data/Workdir/survival/utils.py:305: RuntimeWarning: invalid value encountered in true_divide
  pdfs = np.gradient(1-survs,axis=1)/norms
[32m[I 2022-04-21 11:38:12,424][0m Trial 220 finished with value: 0.8124996693224045 and parameters: {'splitter': 'best', 'min_samples_split': 0.03797968414753766, 'min_samples_leaf': 0.02792594598290891, 'min_weight_fraction_leaf': 0.02672440162972756, 'max_features': 0.46609271401088814}. Best is trial 208 with value: 0.8264270922211081.[0m
/media/san2_ssd/data/Workdir/survival/utils.py:305: RuntimeWarning: invalid value encountered in true_divide
  pdfs = np.gradient(1-survs,axis=1)/norms
[32m[I 2022-04-21 11:38:13,244][0m Trial 221 finished with value: 0.7970101877576887 and parameters: {'splitter': 'best', 'min_samples_split': 0.09650189776122693, 'min_samples_leaf': 0.011327644552617486, 'min_weight_fraction_leaf': 0.017671456381322143, 'max_features': 0.4075965368842508}. Best is trial 208 with value: 0.8264270922211081.[0m
[32m[I 2022-04-21 11:38:13,626][0m Trial 222 finished with value: 0.8058193858704307 and parameters: {'splitter': 'best', 'min_samples_split': 0.10813065408650852, 'min_samples_leaf': 0.0179056961436746, 'min_weight_fraction_leaf': 7.626613139308323e-05, 'max_features': 0.3681032196452032}. Best is trial 208 with value: 0.8264270922211081.[0m
[32m[I 2022-04-21 11:38:13,825][0m Trial 223 finished with value: 0.8168196832063483 and parameters: {'splitter': 'best', 'min_samples_split': 0.07262884042804958, 'min_samples_leaf': 0.036908627421248424, 'min_weight_fraction_leaf': 0.01747335435853169, 'max_features': 0.433174259966494}. Best is trial 208 with value: 0.8264270922211081.[0m
