[32m[I 2022-04-22 01:12:48,005][0m Trial 805 finished with value: 0.5 and parameters: {'loss': 'coxph', 'learning_rate': 1.1242688324563966e-05, 'n_estimators': 210, 'criterion': 'absolute_error', 'min_samples_split': 8, 'min_samples_leaf': 6, 'min_weight_fraction_leaf': 0.30198113861226, 'min_impurity_decrease': 0.9557100674074364, 'max_features': 0.6329234193573791, 'subsample': 0.24642217779711664, 'dropout_rate': 0.8118715261292182, 'ccp_alpha': 0.002237732338601986}. Best is trial 187 with value: 0.6933481836305168.[0m
[32m[I 2022-04-22 01:12:53,890][0m Trial 806 finished with value: 0.6645282883055869 and parameters: {'loss': 'coxph', 'learning_rate': 8.569442207765686e-06, 'n_estimators': 198, 'criterion': 'absolute_error', 'min_samples_split': 8, 'min_samples_leaf': 5, 'min_weight_fraction_leaf': 0.2745213480946304, 'min_impurity_decrease': 0.03799157135612138, 'max_features': 0.6576561288910998, 'subsample': 0.20989369739626454, 'dropout_rate': 0.8371519125504183, 'ccp_alpha': 0.1563318325954474}. Best is trial 187 with value: 0.6933481836305168.[0m
[32m[I 2022-04-22 01:12:57,988][0m Trial 807 finished with value: 0.6869689995326069 and parameters: {'loss': 'coxph', 'learning_rate': 2.0671793440377035e-05, 'n_estimators': 222, 'criterion': 'absolute_error', 'min_samples_split': 8, 'min_samples_leaf': 4, 'min_weight_fraction_leaf': 0.2601317825322475, 'min_impurity_decrease': 0.002356327366202679, 'max_features': 0.7727986453812594, 'subsample': 0.24302463809570043, 'dropout_rate': 0.9215943973929912, 'ccp_alpha': 0.0020467191189392914}. Best is trial 187 with value: 0.6933481836305168.[0m
[32m[I 2022-04-22 01:13:04,290][0m Trial 808 finished with value: 0.5414483752183816 and parameters: {'loss': 'coxph', 'learning_rate': 9.890376912930535e-06, 'n_estimators': 215, 'criterion': 'absolute_error', 'min_samples_split': 8, 'min_samples_leaf': 5, 'min_weight_fraction_leaf': 0.2970294164498019, 'min_impurity_decrease': 0.034181171797875345, 'max_features': 0.7599643988979699, 'subsample': 0.22534316950188252, 'dropout_rate': 0.8003741820387854, 'ccp_alpha': 0.33545962380658334}. Best is trial 187 with value: 0.6933481836305168.[0m
[32m[I 2022-04-22 01:13:09,039][0m Trial 809 finished with value: 0.6852855689608741 and parameters: {'loss': 'coxph', 'learning_rate': 4.238657335625664e-06, 'n_estimators': 223, 'criterion': 'absolute_error', 'min_samples_split': 9, 'min_samples_leaf': 5, 'min_weight_fraction_leaf': 0.277443638459278, 'min_impurity_decrease': 0.039560172685414924, 'max_features': 0.7717182748822737, 'subsample': 0.17094883311455483, 'dropout_rate': 0.8488810055876151, 'ccp_alpha': 0.0036268147854261867}. Best is trial 187 with value: 0.6933481836305168.[0m
[32m[I 2022-04-22 01:13:12,221][0m Trial 810 finished with value: 0.665553205007748 and parameters: {'loss': 'coxph', 'learning_rate': 5.2447257651655536e-06, 'n_estimators': 192, 'criterion': 'absolute_error', 'min_samples_split': 8, 'min_samples_leaf': 3, 'min_weight_fraction_leaf': 0.2578179515853607, 'min_impurity_decrease': 0.02051554388629637, 'max_features': 0.7071521197280946, 'subsample': 0.1152759144510137, 'dropout_rate': 0.8232589296642127, 'ccp_alpha': 0.22756366377219664}. Best is trial 187 with value: 0.6933481836305168.[0m
[32m[I 2022-04-22 01:13:17,753][0m Trial 811 finished with value: 0.6870777370903353 and parameters: {'loss': 'coxph', 'learning_rate': 6.838874656571761e-06, 'n_estimators': 245, 'criterion': 'friedman_mse', 'min_samples_split': 8, 'min_samples_leaf': 4, 'min_weight_fraction_leaf': 0.2675306154104541, 'min_impurity_decrease': 0.0016131837104326017, 'max_features': 0.7432905199228468, 'subsample': 0.19455534559888707, 'dropout_rate': 0.7435684434261275, 'ccp_alpha': 0.09950533801070374}. Best is trial 187 with value: 0.6933481836305168.[0m
[32m[I 2022-04-22 01:13:21,893][0m Trial 812 finished with value: 0.666091769413209 and parameters: {'loss': 'coxph', 'learning_rate': 2.3418546915723232e-05, 'n_estimators': 211, 'criterion': 'absolute_error', 'min_samples_split': 8, 'min_samples_leaf': 3, 'min_weight_fraction_leaf': 0.25506518121797445, 'min_impurity_decrease': 0.04734464863634823, 'max_features': 0.7821112151894871, 'subsample': 0.2423797267933378, 'dropout_rate': 0.7286087815165726, 'ccp_alpha': 0.1664405821169963}. Best is trial 187 with value: 0.6933481836305168.[0m
[32m[I 2022-04-22 01:13:24,213][0m Trial 813 finished with value: 0.6814229866965141 and parameters: {'loss': 'coxph', 'learning_rate': 1.4646583143557571e-05, 'n_estimators': 202, 'criterion': 'absolute_error', 'min_samples_split': 3, 'min_samples_leaf': 4, 'min_weight_fraction_leaf': 0.29245407077087476, 'min_impurity_decrease': 0.0011454330107168167, 'max_features': 0.7121670679248558, 'subsample': 0.21570316419012708, 'dropout_rate': 0.8859362132992494, 'ccp_alpha': 0.0034943139767731335}. Best is trial 187 with value: 0.6933481836305168.[0m
[32m[I 2022-04-22 01:13:30,707][0m Trial 814 finished with value: 0.5 and parameters: {'loss': 'coxph', 'learning_rate': 4.519622632784999e-06, 'n_estimators': 232, 'criterion': 'absolute_error', 'min_samples_split': 8, 'min_samples_leaf': 6, 'min_weight_fraction_leaf': 0.2796689273200746, 'min_impurity_decrease': 0.022607130632438296, 'max_features': 0.7575199856127397, 'subsample': 0.25200805856169606, 'dropout_rate': 0.691779578065593, 'ccp_alpha': 4.1897805710208464}. Best is trial 187 with value: 0.6933481836305168.[0m
[32m[I 2022-04-22 01:13:37,286][0m Trial 815 finished with value: 0.6126474931699687 and parameters: {'loss': 'coxph', 'learning_rate': 2.789765467352077e-06, 'n_estimators': 219, 'criterion': 'absolute_error', 'min_samples_split': 8, 'min_samples_leaf': 5, 'min_weight_fraction_leaf': 0.2707727249545787, 'min_impurity_decrease': 0.04347172748310006, 'max_features': 0.735036126133609, 'subsample': 0.2536119558831154, 'dropout_rate': 0.8217310637659273, 'ccp_alpha': 0.27472131068965844}. Best is trial 187 with value: 0.6933481836305168.[0m
[32m[I 2022-04-22 01:13:43,108][0m Trial 816 finished with value: 0.6756405972694646 and parameters: {'loss': 'coxph', 'learning_rate': 3.2267877540077415e-06, 'n_estimators': 248, 'criterion': 'absolute_error', 'min_samples_split': 8, 'min_samples_leaf': 4, 'min_weight_fraction_leaf': 0.30813351600376787, 'min_impurity_decrease': 0.0264098601239717, 'max_features': 0.5776711278230131, 'subsample': 0.2260748157717732, 'dropout_rate': 0.6996981293983159, 'ccp_alpha': 0.09577678582104368}. Best is trial 187 with value: 0.6933481836305168.[0m
[32m[I 2022-04-22 01:13:47,608][0m Trial 817 finished with value: 0.5 and parameters: {'loss': 'coxph', 'learning_rate': 7.491180358774624e-06, 'n_estimators': 232, 'criterion': 'absolute_error', 'min_samples_split': 8, 'min_samples_leaf': 4, 'min_weight_fraction_leaf': 0.26061991938628815, 'min_impurity_decrease': 0.668680775671488, 'max_features': 0.7801870471134346, 'subsample': 0.19837973135323114, 'dropout_rate': 0.8397979937542638, 'ccp_alpha': 0.0030379861130355765}. Best is trial 187 with value: 0.6933481836305168.[0m
[32m[I 2022-04-22 01:13:50,214][0m Trial 818 finished with value: 0.5 and parameters: {'loss': 'coxph', 'learning_rate': 2.4866990886574587e-05, 'n_estimators': 182, 'criterion': 'absolute_error', 'min_samples_split': 5, 'min_samples_leaf': 3, 'min_weight_fraction_leaf': 0.28654208150449456, 'min_impurity_decrease': 0.05047699495855955, 'max_features': 0.6938405794964672, 'subsample': 0.2585132733143994, 'dropout_rate': 0.8120162972854114, 'ccp_alpha': 1.4332831780470114}. Best is trial 187 with value: 0.6933481836305168.[0m
[32m[I 2022-04-22 01:13:59,644][0m Trial 819 finished with value: 0.6662011491564195 and parameters: {'loss': 'coxph', 'learning_rate': 4.627392041173699e-06, 'n_estimators': 249, 'criterion': 'absolute_error', 'min_samples_split': 8, 'min_samples_leaf': 4, 'min_weight_fraction_leaf': 0.2503401666178128, 'min_impurity_decrease': 0.021103270281623773, 'max_features': 0.7600345380645652, 'subsample': 0.230641797501694, 'dropout_rate': 0.7165663323564445, 'ccp_alpha': 0.1731439477252794}. Best is trial 187 with value: 0.6933481836305168.[0m
/media/san2_ssd/data/Workdir/survival/venv/lib/python3.8/site-packages/sksurv/ensemble/boosting.py:955: RuntimeWarning: divide by zero encountered in log
  time = numpy.log(time)
/media/san2_ssd/data/Workdir/survival/venv/lib/python3.8/site-packages/sksurv/ensemble/boosting.py:955: RuntimeWarning: divide by zero encountered in log
  time = numpy.log(time)
/media/san2_ssd/data/Workdir/survival/venv/lib/python3.8/site-packages/sksurv/ensemble/boosting.py:955: RuntimeWarning: divide by zero encountered in log
  time = numpy.log(time)
/media/san2_ssd/data/Workdir/survival/venv/lib/python3.8/site-packages/sksurv/ensemble/boosting.py:955: RuntimeWarning: divide by zero encountered in log
  time = numpy.log(time)
[32m[I 2022-04-22 01:14:00,819][0m Trial 820 finished with value: -0.7322675686572004 and parameters: {'loss': 'squared', 'learning_rate': 2.430558650499279e-05, 'n_estimators': 207, 'criterion': 'absolute_error', 'min_samples_split': 7, 'min_samples_leaf': 5, 'min_weight_fraction_leaf': 0.2519638640524958, 'min_impurity_decrease': 0.039612083859258754, 'max_features': 0.7148389082725893, 'subsample': 0.17827758079048212, 'dropout_rate': 0.7817367731346573, 'ccp_alpha': 0.0013421121973788558}. Best is trial 187 with value: 0.6933481836305168.[0m
[32m[I 2022-04-22 01:14:07,424][0m Trial 821 finished with value: 0.558608021611561 and parameters: {'loss': 'coxph', 'learning_rate': 2.5318012681377826e-05, 'n_estimators': 228, 'criterion': 'absolute_error', 'min_samples_split': 7, 'min_samples_leaf': 4, 'min_weight_fraction_leaf': 0.2771902377722958, 'min_impurity_decrease': 0.021558515211566303, 'max_features': 0.6755758178486534, 'subsample': 0.21123395644953924, 'dropout_rate': 0.7615446770439624, 'ccp_alpha': 0.3529742613172593}. Best is trial 187 with value: 0.6933481836305168.[0m
[32m[I 2022-04-22 01:14:13,130][0m Trial 822 finished with value: 0.5 and parameters: {'loss': 'coxph', 'learning_rate': 9.726931179780436e-06, 'n_estimators': 241, 'criterion': 'absolute_error', 'min_samples_split': 7, 'min_samples_leaf': 5, 'min_weight_fraction_leaf': 0.2661437969892752, 'min_impurity_decrease': 0.9124748772341164, 'max_features': 0.7415764565850191, 'subsample': 0.24725495358134023, 'dropout_rate': 0.864199001754865, 'ccp_alpha': 0.10744978011714654}. Best is trial 187 with value: 0.6933481836305168.[0m
[32m[I 2022-04-22 01:14:16,089][0m Trial 823 finished with value: 0.6637865011237818 and parameters: {'loss': 'coxph', 'learning_rate': 3.5659662767139237e-06, 'n_estimators': 217, 'criterion': 'friedman_mse', 'min_samples_split': 8, 'min_samples_leaf': 2, 'min_weight_fraction_leaf': 0.29100877573616507, 'min_impurity_decrease': 0.05170552172581065, 'max_features': 0.7851710461450141, 'subsample': 0.2578924994589478, 'dropout_rate': 0.8540483382478026, 'ccp_alpha': 0.22638417666736427}. Best is trial 187 with value: 0.6933481836305168.[0m
[32m[I 2022-04-22 01:14:20,611][0m Trial 824 finished with value: 0.6825889497539577 and parameters: {'loss': 'coxph', 'learning_rate': 1.2544704028299108e-05, 'n_estimators': 226, 'criterion': 'absolute_error', 'min_samples_split': 7, 'min_samples_leaf': 6, 'min_weight_fraction_leaf': 0.2543503922808432, 'min_impurity_decrease': 0.020040991476034806, 'max_features': 0.7698444796429449, 'subsample': 0.22428782722201546, 'dropout_rate': 0.6759904396364652, 'ccp_alpha': 0.09991705424980274}. Best is trial 187 with value: 0.6933481836305168.[0m
[32m[I 2022-04-22 01:14:25,199][0m Trial 825 finished with value: 0.6655603017398313 and parameters: {'loss': 'coxph', 'learning_rate': 6.68992756711631e-06, 'n_estimators': 190, 'criterion': 'absolute_error', 'min_samples_split': 6, 'min_samples_leaf': 4, 'min_weight_fraction_leaf': 0.26953951187855113, 'min_impurity_decrease': 0.037498397145227035, 'max_features': 0.7243053114496234, 'subsample': 0.20113009319212244, 'dropout_rate': 0.7102740584964132, 'ccp_alpha': 0.19310858102808906}. Best is trial 187 with value: 0.6933481836305168.[0m
[32m[I 2022-04-22 01:14:32,426][0m Trial 826 finished with value: 0.6770318061822154 and parameters: {'loss': 'coxph', 'learning_rate': 1.7962373429061587e-05, 'n_estimators': 252, 'criterion': 'absolute_error', 'min_samples_split': 7, 'min_samples_leaf': 4, 'min_weight_fraction_leaf': 0.28154977168468276, 'min_impurity_decrease': 0.0014896268432220972, 'max_features': 0.7530406087613892, 'subsample': 0.2369575788374187, 'dropout_rate': 0.8133235573027183, 'ccp_alpha': 0.10377773432304963}. Best is trial 187 with value: 0.6933481836305168.[0m
[32m[I 2022-04-22 01:14:37,253][0m Trial 827 finished with value: 0.6127568729131793 and parameters: {'loss': 'coxph', 'learning_rate': 2.332296563865521e-05, 'n_estimators': 202, 'criterion': 'absolute_error', 'min_samples_split': 2, 'min_samples_leaf': 3, 'min_weight_fraction_leaf': 0.2511725674183601, 'min_impurity_decrease': 0.05285498850084307, 'max_features': 0.633291889823364, 'subsample': 0.2524869957206998, 'dropout_rate': 0.7386822345332875, 'ccp_alpha': 0.2819773951712219}. Best is trial 187 with value: 0.6933481836305168.[0m
[32m[I 2022-04-22 01:14:42,178][0m Trial 828 finished with value: 0.5 and parameters: {'loss': 'coxph', 'learning_rate': 2.6073602044926593e-05, 'n_estimators': 241, 'criterion': 'friedman_mse', 'min_samples_split': 7, 'min_samples_leaf': 5, 'min_weight_fraction_leaf': 0.2715819396763191, 'min_impurity_decrease': 0.03524745984316989, 'max_features': 0.7896920211117399, 'subsample': 0.21372331550625906, 'dropout_rate': 0.9082095967421191, 'ccp_alpha': 3.6092167239056154}. Best is trial 187 with value: 0.6933481836305168.[0m
[32m[I 2022-04-22 01:14:46,528][0m Trial 829 finished with value: 0.6816449885755709 and parameters: {'loss': 'coxph', 'learning_rate': 1.5219799415967303e-05, 'n_estimators': 215, 'criterion': 'squared_error', 'min_samples_split': 8, 'min_samples_leaf': 4, 'min_weight_fraction_leaf': 0.29493784450045785, 'min_impurity_decrease': 0.05730999117070864, 'max_features': 0.6567345290118342, 'subsample': 0.15703094579192867, 'dropout_rate': 0.6826274754151236, 'ccp_alpha': 0.10275171698737802}. Best is trial 187 with value: 0.6933481836305168.[0m
[32m[I 2022-04-22 01:14:52,292][0m Trial 830 finished with value: 0.6765194543003374 and parameters: {'loss': 'coxph', 'learning_rate': 4.90970194234561e-06, 'n_estimators': 250, 'criterion': 'squared_error', 'min_samples_split': 7, 'min_samples_leaf': 4, 'min_weight_fraction_leaf': 0.3047089064727708, 'min_impurity_decrease': 0.021306835881210587, 'max_features': 0.7378684252343249, 'subsample': 0.18898675997513534, 'dropout_rate': 0.8301295182443776, 'ccp_alpha': 0.2003832960586105}. Best is trial 187 with value: 0.6933481836305168.[0m
[32m[I 2022-04-22 01:14:56,236][0m Trial 831 finished with value: 0.5 and parameters: {'loss': 'coxph', 'learning_rate': 1.9156792126547838e-05, 'n_estimators': 224, 'criterion': 'squared_error', 'min_samples_split': 9, 'min_samples_leaf': 4, 'min_weight_fraction_leaf': 0.26254418109376404, 'min_impurity_decrease': 0.017019302136626016, 'max_features': 0.7647112395549025, 'subsample': 0.2592222284273418, 'dropout_rate': 0.7628950450161937, 'ccp_alpha': 3.350310602256169}. Best is trial 187 with value: 0.6933481836305168.[0m
[32m[I 2022-04-22 01:15:01,451][0m Trial 832 finished with value: 0.6907974269757531 and parameters: {'loss': 'coxph', 'learning_rate': 1.0970139511816564e-05, 'n_estimators': 236, 'criterion': 'squared_error', 'min_samples_split': 7, 'min_samples_leaf': 6, 'min_weight_fraction_leaf': 0.25285152353446655, 'min_impurity_decrease': 0.05350526762031485, 'max_features': 0.6966924023513146, 'subsample': 0.2360823489980525, 'dropout_rate': 0.8501725076280267, 'ccp_alpha': 0.09100303209136913}. Best is trial 187 with value: 0.6933481836305168.[0m
[32m[I 2022-04-22 01:15:06,667][0m Trial 833 finished with value: 0.6898284538205265 and parameters: {'loss': 'coxph', 'learning_rate': 6.976465426876972e-06, 'n_estimators': 236, 'criterion': 'squared_error', 'min_samples_split': 7, 'min_samples_leaf': 2, 'min_weight_fraction_leaf': 0.24597834770288632, 'min_impurity_decrease': 0.057443086676034386, 'max_features': 0.6912626341575916, 'subsample': 0.2338178228226774, 'dropout_rate': 0.8680328108842794, 'ccp_alpha': 0.005613945586225655}. Best is trial 187 with value: 0.6933481836305168.[0m
[32m[I 2022-04-22 01:15:11,506][0m Trial 834 finished with value: 0.6903131782385057 and parameters: {'loss': 'coxph', 'learning_rate': 8.604050162063614e-06, 'n_estimators': 245, 'criterion': 'squared_error', 'min_samples_split': 7, 'min_samples_leaf': 2, 'min_weight_fraction_leaf': 0.2494168018973004, 'min_impurity_decrease': 0.056014791707999625, 'max_features': 0.6919068164165261, 'subsample': 0.21140998620640944, 'dropout_rate': 0.8720547087132394, 'ccp_alpha': 0.008936682069750929}. Best is trial 187 with value: 0.6933481836305168.[0m
[32m[I 2022-04-22 01:15:14,354][0m Trial 835 finished with value: 0.681997944132683 and parameters: {'loss': 'coxph', 'learning_rate': 8.184824172853082e-06, 'n_estimators': 238, 'criterion': 'absolute_error', 'min_samples_split': 6, 'min_samples_leaf': 2, 'min_weight_fraction_leaf': 0.25756078764292767, 'min_impurity_decrease': 0.06513157551192639, 'max_features': 0.6822935967061896, 'subsample': 0.1769390060238132, 'dropout_rate': 0.9008779353512698, 'ccp_alpha': 0.07858211133779565}. Best is trial 187 with value: 0.6933481836305168.[0m
[32m[I 2022-04-22 01:15:17,540][0m Trial 836 finished with value: 0.6872714700535212 and parameters: {'loss': 'coxph', 'learning_rate': 1.1156811511559035e-05, 'n_estimators': 247, 'criterion': 'squared_error', 'min_samples_split': 6, 'min_samples_leaf': 2, 'min_weight_fraction_leaf': 0.2618910384330729, 'min_impurity_decrease': 0.06777349290155088, 'max_features': 0.648118435228809, 'subsample': 0.19834633284511172, 'dropout_rate': 0.8984562001589763, 'ccp_alpha': 0.0054370143134736815}. Best is trial 187 with value: 0.6933481836305168.[0m
[32m[I 2022-04-22 01:15:22,160][0m Trial 837 finished with value: 0.6910176052168063 and parameters: {'loss': 'coxph', 'learning_rate': 5.418052801825713e-06, 'n_estimators': 231, 'criterion': 'friedman_mse', 'min_samples_split': 6, 'min_samples_leaf': 1, 'min_weight_fraction_leaf': 0.2509145439410659, 'min_impurity_decrease': 0.06289678965989358, 'max_features': 0.6910382302260336, 'subsample': 0.21127064983336077, 'dropout_rate': 0.8672151165139235, 'ccp_alpha': 0.005364096218822251}. Best is trial 187 with value: 0.6933481836305168.[0m
[32m[I 2022-04-22 01:15:25,197][0m Trial 838 finished with value: 0.6886741259005591 and parameters: {'loss': 'coxph', 'learning_rate': 6.319854987413219e-06, 'n_estimators': 236, 'criterion': 'friedman_mse', 'min_samples_split': 6, 'min_samples_leaf': 1, 'min_weight_fraction_leaf': 0.2524357988294893, 'min_impurity_decrease': 0.06378141741784335, 'max_features': 0.6711710324641942, 'subsample': 0.19580400482574442, 'dropout_rate': 0.8703952482134192, 'ccp_alpha': 0.0011543835343963528}. Best is trial 187 with value: 0.6933481836305168.[0m
[32m[I 2022-04-22 01:15:28,119][0m Trial 839 finished with value: 0.6837136874344409 and parameters: {'loss': 'coxph', 'learning_rate': 8.893338865824699e-06, 'n_estimators': 226, 'criterion': 'friedman_mse', 'min_samples_split': 6, 'min_samples_leaf': 3, 'min_weight_fraction_leaf': 0.2599463077281077, 'min_impurity_decrease': 0.05735869511449459, 'max_features': 0.6650503603545075, 'subsample': 0.15369217420119796, 'dropout_rate': 0.8745508706456803, 'ccp_alpha': 0.10176029366459041}. Best is trial 187 with value: 0.6933481836305168.[0m
[32m[I 2022-04-22 01:15:30,962][0m Trial 840 finished with value: 0.6740239093747888 and parameters: {'loss': 'coxph', 'learning_rate': 5.2532981427207916e-06, 'n_estimators': 230, 'criterion': 'friedman_mse', 'min_samples_split': 6, 'min_samples_leaf': 2, 'min_weight_fraction_leaf': 0.27280648527094115, 'min_impurity_decrease': 0.042303107538422396, 'max_features': 0.6946505046314804, 'subsample': 0.21249591243535518, 'dropout_rate': 0.877246326575703, 'ccp_alpha': 0.15853144861593665}. Best is trial 187 with value: 0.6933481836305168.[0m
[32m[I 2022-04-22 01:15:33,774][0m Trial 841 finished with value: 0.6880038896008296 and parameters: {'loss': 'coxph', 'learning_rate': 6.5667727428814114e-06, 'n_estimators': 219, 'criterion': 'friedman_mse', 'min_samples_split': 6, 'min_samples_leaf': 1, 'min_weight_fraction_leaf': 0.24792526962309783, 'min_impurity_decrease': 0.06952925225426643, 'max_features': 0.646859612953284, 'subsample': 0.13865950161530402, 'dropout_rate': 0.8586292560848324, 'ccp_alpha': 0.08398293102385618}. Best is trial 187 with value: 0.6933481836305168.[0m
/media/san2_ssd/data/Workdir/survival/venv/lib/python3.8/site-packages/sksurv/ensemble/boosting.py:955: RuntimeWarning: divide by zero encountered in log
  time = numpy.log(time)
/media/san2_ssd/data/Workdir/survival/venv/lib/python3.8/site-packages/sksurv/ensemble/boosting.py:955: RuntimeWarning: divide by zero encountered in log
  time = numpy.log(time)
/media/san2_ssd/data/Workdir/survival/venv/lib/python3.8/site-packages/sksurv/ensemble/boosting.py:955: RuntimeWarning: divide by zero encountered in log
  time = numpy.log(time)
/media/san2_ssd/data/Workdir/survival/venv/lib/python3.8/site-packages/sksurv/ensemble/boosting.py:955: RuntimeWarning: divide by zero encountered in log
  time = numpy.log(time)
