[32m[I 2022-04-21 11:38:14,359][0m Trial 442 finished with value: 0.8382577519146084 and parameters: {'splitter': 'best', 'min_samples_split': 0.2640786071683621, 'min_samples_leaf': 0.014048213953009321, 'min_weight_fraction_leaf': 0.051174763921242865, 'max_features': 0.7842690435689039}. Best is trial 425 with value: 0.8394667449470219.[0m
[32m[I 2022-04-21 11:38:14,436][0m Trial 443 finished with value: 0.8328255155375228 and parameters: {'splitter': 'best', 'min_samples_split': 0.25889058537232384, 'min_samples_leaf': 0.0013143063989723368, 'min_weight_fraction_leaf': 0.06496528300996136, 'max_features': 0.7902886204351663}. Best is trial 425 with value: 0.8394667449470219.[0m
[32m[I 2022-04-21 11:38:14,532][0m Trial 444 finished with value: 0.8328255155375228 and parameters: {'splitter': 'best', 'min_samples_split': 0.25810212058181653, 'min_samples_leaf': 0.015526508186838359, 'min_weight_fraction_leaf': 0.06255770704952161, 'max_features': 0.719515064652409}. Best is trial 425 with value: 0.8394667449470219.[0m
[32m[I 2022-04-21 11:38:14,625][0m Trial 445 finished with value: 0.8356453536097854 and parameters: {'splitter': 'best', 'min_samples_split': 0.28237763237298724, 'min_samples_leaf': 0.010131650149461801, 'min_weight_fraction_leaf': 0.054627713936856295, 'max_features': 0.7440238316042134}. Best is trial 425 with value: 0.8394667449470219.[0m
[32m[I 2022-04-21 11:38:14,723][0m Trial 446 finished with value: 0.8363268199688415 and parameters: {'splitter': 'best', 'min_samples_split': 0.26687432679178547, 'min_samples_leaf': 0.001285718721413226, 'min_weight_fraction_leaf': 0.05279625552142737, 'max_features': 0.8149994343260865}. Best is trial 425 with value: 0.8394667449470219.[0m
[32m[I 2022-04-21 11:38:14,822][0m Trial 447 finished with value: 0.65 and parameters: {'splitter': 'best', 'min_samples_split': 0.2916554792619477, 'min_samples_leaf': 0.014885366237643752, 'min_weight_fraction_leaf': 0.37619309771397413, 'max_features': 0.7762418648309513}. Best is trial 425 with value: 0.8394667449470219.[0m
[32m[I 2022-04-21 11:38:14,922][0m Trial 448 finished with value: 0.8375392239614191 and parameters: {'splitter': 'best', 'min_samples_split': 0.25509976688926694, 'min_samples_leaf': 0.013209923466066982, 'min_weight_fraction_leaf': 0.04928937703310849, 'max_features': 0.7995548127400417}. Best is trial 425 with value: 0.8394667449470219.[0m
[32m[I 2022-04-21 11:38:15,020][0m Trial 449 finished with value: 0.8328255155375228 and parameters: {'splitter': 'best', 'min_samples_split': 0.2518937395773339, 'min_samples_leaf': 0.015594159191030153, 'min_weight_fraction_leaf': 0.06496697027391556, 'max_features': 0.7891472042098997}. Best is trial 425 with value: 0.8394667449470219.[0m
[32m[I 2022-04-21 11:38:15,111][0m Trial 450 finished with value: 0.8363268199688415 and parameters: {'splitter': 'best', 'min_samples_split': 0.2772037432615992, 'min_samples_leaf': 0.002033807501694655, 'min_weight_fraction_leaf': 0.05250975231415147, 'max_features': 0.8037269940967519}. Best is trial 425 with value: 0.8394667449470219.[0m
[32m[I 2022-04-21 11:38:15,263][0m Trial 451 finished with value: 0.8334107142154489 and parameters: {'splitter': 'random', 'min_samples_split': 0.2517267859778701, 'min_samples_leaf': 0.015386645404632514, 'min_weight_fraction_leaf': 0.07463889062146448, 'max_features': 0.7675492478550877}. Best is trial 425 with value: 0.8394667449470219.[0m
[32m[I 2022-04-21 11:38:15,355][0m Trial 452 finished with value: 0.8375392239614191 and parameters: {'splitter': 'best', 'min_samples_split': 0.2566153799249364, 'min_samples_leaf': 0.018361418697734312, 'min_weight_fraction_leaf': 0.05027532651762543, 'max_features': 0.7854521849190912}. Best is trial 425 with value: 0.8394667449470219.[0m
[32m[I 2022-04-21 11:38:15,445][0m Trial 453 finished with value: 0.8382577519146084 and parameters: {'splitter': 'best', 'min_samples_split': 0.2653772382768359, 'min_samples_leaf': 0.010587451376308232, 'min_weight_fraction_leaf': 0.05513278161067793, 'max_features': 0.7387194501413964}. Best is trial 425 with value: 0.8394667449470219.[0m
[32m[I 2022-04-21 11:38:15,632][0m Trial 454 finished with value: 0.8328255155375228 and parameters: {'splitter': 'best', 'min_samples_split': 0.25522009789479244, 'min_samples_leaf': 0.010972388334880415, 'min_weight_fraction_leaf': 0.06652561842689475, 'max_features': 0.7031849148092362}. Best is trial 425 with value: 0.8394667449470219.[0m
[32m[I 2022-04-21 11:38:15,770][0m Trial 455 finished with value: 0.8316149506675705 and parameters: {'splitter': 'best', 'min_samples_split': 0.13384825184860555, 'min_samples_leaf': 0.0017530444820742614, 'min_weight_fraction_leaf': 0.08619938067974175, 'max_features': 0.7615737416508038}. Best is trial 425 with value: 0.8394667449470219.[0m
[32m[I 2022-04-21 11:38:15,863][0m Trial 456 finished with value: 0.8318869790887286 and parameters: {'splitter': 'best', 'min_samples_split': 0.26020956767405357, 'min_samples_leaf': 0.015534107057477427, 'min_weight_fraction_leaf': 0.07686068734397726, 'max_features': 0.7405699037140088}. Best is trial 425 with value: 0.8394667449470219.[0m
[32m[I 2022-04-21 11:38:15,960][0m Trial 457 finished with value: 0.833502860951816 and parameters: {'splitter': 'best', 'min_samples_split': 0.24779806920024428, 'min_samples_leaf': 0.001005279840795601, 'min_weight_fraction_leaf': 0.06075177515135908, 'max_features': 0.7841599953435822}. Best is trial 425 with value: 0.8394667449470219.[0m
[32m[I 2022-04-21 11:38:16,059][0m Trial 458 finished with value: 0.8363268199688415 and parameters: {'splitter': 'best', 'min_samples_split': 0.2601998933739591, 'min_samples_leaf': 0.01848402080736373, 'min_weight_fraction_leaf': 0.052418716438170324, 'max_features': 0.8230511771600608}. Best is trial 425 with value: 0.8394667449470219.[0m
[32m[I 2022-04-21 11:38:16,135][0m Trial 459 finished with value: 0.8363268199688415 and parameters: {'splitter': 'best', 'min_samples_split': 0.249297110873307, 'min_samples_leaf': 0.011047281826592755, 'min_weight_fraction_leaf': 0.057608889817634595, 'max_features': 0.8010585087112805}. Best is trial 425 with value: 0.8394667449470219.[0m
[32m[I 2022-04-21 11:38:16,182][0m Trial 460 finished with value: 0.8348703389712995 and parameters: {'splitter': 'best', 'min_samples_split': 0.2859024167863444, 'min_samples_leaf': 0.01660308032751423, 'min_weight_fraction_leaf': 0.048463416680700526, 'max_features': 0.784496907648193}. Best is trial 425 with value: 0.8394667449470219.[0m
[32m[I 2022-04-21 11:38:16,229][0m Trial 461 finished with value: 0.8337666169009493 and parameters: {'splitter': 'best', 'min_samples_split': 0.2632196940664746, 'min_samples_leaf': 0.001266542903982622, 'min_weight_fraction_leaf': 0.07381350650838414, 'max_features': 0.7593051439518379}. Best is trial 425 with value: 0.8394667449470219.[0m
[32m[I 2022-04-21 11:38:16,279][0m Trial 462 finished with value: 0.8356453536097854 and parameters: {'splitter': 'best', 'min_samples_split': 0.2781643134487902, 'min_samples_leaf': 0.01033077243548708, 'min_weight_fraction_leaf': 0.04914052956884063, 'max_features': 0.7344538928400911}. Best is trial 425 with value: 0.8394667449470219.[0m
[32m[I 2022-04-21 11:38:16,327][0m Trial 463 finished with value: 0.8368835244060235 and parameters: {'splitter': 'best', 'min_samples_split': 0.25441976731446997, 'min_samples_leaf': 0.01810341019550607, 'min_weight_fraction_leaf': 0.028064342333555523, 'max_features': 0.8350277650771015}. Best is trial 425 with value: 0.8394667449470219.[0m
[32m[I 2022-04-21 11:38:16,377][0m Trial 464 finished with value: 0.8318450474400789 and parameters: {'splitter': 'best', 'min_samples_split': 0.1597714831724908, 'min_samples_leaf': 0.009837384598899894, 'min_weight_fraction_leaf': 0.20134942528500163, 'max_features': 0.8088767713596883}. Best is trial 425 with value: 0.8394667449470219.[0m
[32m[I 2022-04-21 11:38:16,427][0m Trial 465 finished with value: 0.8340187950162761 and parameters: {'splitter': 'best', 'min_samples_split': 0.29710661262477317, 'min_samples_leaf': 0.021397885748686025, 'min_weight_fraction_leaf': 0.06250656796360143, 'max_features': 0.778015152998728}. Best is trial 425 with value: 0.8394667449470219.[0m
[32m[I 2022-04-21 11:38:16,474][0m Trial 466 finished with value: 0.8394667449470219 and parameters: {'splitter': 'best', 'min_samples_split': 0.2669266183426003, 'min_samples_leaf': 0.009765538238344688, 'min_weight_fraction_leaf': 0.04600058998256552, 'max_features': 0.7507597430629737}. Best is trial 425 with value: 0.8394667449470219.[0m
[32m[I 2022-04-21 11:38:16,522][0m Trial 467 finished with value: 0.8394667449470219 and parameters: {'splitter': 'best', 'min_samples_split': 0.26724448687103897, 'min_samples_leaf': 0.010014145366884072, 'min_weight_fraction_leaf': 0.04702803178574012, 'max_features': 0.750001407636366}. Best is trial 425 with value: 0.8394667449470219.[0m
[32m[I 2022-04-21 11:38:16,570][0m Trial 468 finished with value: 0.8328255155375228 and parameters: {'splitter': 'best', 'min_samples_split': 0.26630811796369835, 'min_samples_leaf': 0.011355816676440908, 'min_weight_fraction_leaf': 0.0666229715822467, 'max_features': 0.7204056899163004}. Best is trial 425 with value: 0.8394667449470219.[0m
[32m[I 2022-04-21 11:38:16,628][0m Trial 469 finished with value: 0.8355801993971674 and parameters: {'splitter': 'best', 'min_samples_split': 0.27489098820813107, 'min_samples_leaf': 0.0010028791761274372, 'min_weight_fraction_leaf': 0.05654289907068775, 'max_features': 0.7492308673793718}. Best is trial 425 with value: 0.8394667449470219.[0m
[32m[I 2022-04-21 11:38:16,686][0m Trial 470 finished with value: 0.8348703389712995 and parameters: {'splitter': 'best', 'min_samples_split': 0.28833018820855094, 'min_samples_leaf': 0.020526833785857016, 'min_weight_fraction_leaf': 0.04745271245709901, 'max_features': 0.7594545141196622}. Best is trial 425 with value: 0.8394667449470219.[0m
[32m[I 2022-04-21 11:38:16,737][0m Trial 471 finished with value: 0.8337699781920435 and parameters: {'splitter': 'random', 'min_samples_split': 0.26256782764230696, 'min_samples_leaf': 0.013789413277609582, 'min_weight_fraction_leaf': 0.045594406721947436, 'max_features': 0.7073752504143702}. Best is trial 425 with value: 0.8394667449470219.[0m
[32m[I 2022-04-21 11:38:16,784][0m Trial 472 finished with value: 0.8318450474400789 and parameters: {'splitter': 'best', 'min_samples_split': 0.2463216124583515, 'min_samples_leaf': 0.020030164230156473, 'min_weight_fraction_leaf': 0.27362203281813646, 'max_features': 0.7948359763945589}. Best is trial 425 with value: 0.8394667449470219.[0m
[32m[I 2022-04-21 11:38:16,844][0m Trial 473 finished with value: 0.8363268199688415 and parameters: {'splitter': 'best', 'min_samples_split': 0.2742411995865021, 'min_samples_leaf': 0.0013417391278471922, 'min_weight_fraction_leaf': 0.05722120066643127, 'max_features': 0.8151854288755558}. Best is trial 425 with value: 0.8394667449470219.[0m
[32m[I 2022-04-21 11:38:16,902][0m Trial 474 finished with value: 0.8316149506675705 and parameters: {'splitter': 'best', 'min_samples_split': 0.25472176283339104, 'min_samples_leaf': 0.011470876250941783, 'min_weight_fraction_leaf': 0.09663730810489943, 'max_features': 0.7383517159623707}. Best is trial 425 with value: 0.8394667449470219.[0m
[32m[I 2022-04-21 11:38:16,953][0m Trial 475 finished with value: 0.8356453536097854 and parameters: {'splitter': 'best', 'min_samples_split': 0.280463642415669, 'min_samples_leaf': 0.010080964822963605, 'min_weight_fraction_leaf': 0.05034178652475128, 'max_features': 0.7776289431271423}. Best is trial 425 with value: 0.8394667449470219.[0m
[32m[I 2022-04-21 11:38:17,002][0m Trial 476 finished with value: 0.8372023218910313 and parameters: {'splitter': 'best', 'min_samples_split': 0.26789366734813463, 'min_samples_leaf': 0.023995732430300117, 'min_weight_fraction_leaf': 0.04503498224065555, 'max_features': 0.843870702981203}. Best is trial 425 with value: 0.8394667449470219.[0m
[32m[I 2022-04-21 11:38:17,084][0m Trial 477 finished with value: 0.8337666169009493 and parameters: {'splitter': 'best', 'min_samples_split': 0.2603612210038059, 'min_samples_leaf': 0.0016057747606527117, 'min_weight_fraction_leaf': 0.07106822698976618, 'max_features': 0.7575228043851459}. Best is trial 425 with value: 0.8394667449470219.[0m
[32m[I 2022-04-21 11:38:17,177][0m Trial 478 finished with value: 0.833502860951816 and parameters: {'splitter': 'best', 'min_samples_split': 0.24853745308879788, 'min_samples_leaf': 0.020466091658198734, 'min_weight_fraction_leaf': 0.05903159453935719, 'max_features': 0.792288055035875}. Best is trial 425 with value: 0.8394667449470219.[0m
[32m[I 2022-04-21 11:38:17,234][0m Trial 479 finished with value: 0.8369115330577473 and parameters: {'splitter': 'best', 'min_samples_split': 0.28663119193890285, 'min_samples_leaf': 0.01027713278261145, 'min_weight_fraction_leaf': 0.029021976073311723, 'max_features': 0.8185283130104977}. Best is trial 425 with value: 0.8394667449470219.[0m
[32m[I 2022-04-21 11:38:17,296][0m Trial 480 finished with value: 0.8394676524280678 and parameters: {'splitter': 'best', 'min_samples_split': 0.27114516160830876, 'min_samples_leaf': 0.02218672083812176, 'min_weight_fraction_leaf': 0.04445752059151305, 'max_features': 0.7363711186733232}. Best is trial 480 with value: 0.8394676524280678.[0m
[32m[I 2022-04-21 11:38:17,372][0m Trial 481 finished with value: 0.8337666169009493 and parameters: {'splitter': 'best', 'min_samples_split': 0.2710443751784849, 'min_samples_leaf': 0.02101742218261199, 'min_weight_fraction_leaf': 0.07102432698669181, 'max_features': 0.7248523508246633}. Best is trial 480 with value: 0.8394676524280678.[0m
[32m[I 2022-04-21 11:38:17,468][0m Trial 482 finished with value: 0.8330787034261397 and parameters: {'splitter': 'best', 'min_samples_split': 0.30063059864178415, 'min_samples_leaf': 0.0010213073317525828, 'min_weight_fraction_leaf': 0.051263457991278974, 'max_features': 0.6940785833748889}. Best is trial 480 with value: 0.8394676524280678.[0m
[32m[I 2022-04-21 11:38:17,554][0m Trial 483 finished with value: 0.8352014009981168 and parameters: {'splitter': 'best', 'min_samples_split': 0.2800936935133676, 'min_samples_leaf': 0.011798809128229783, 'min_weight_fraction_leaf': 0.04564778064846308, 'max_features': 0.7453433088815821}. Best is trial 480 with value: 0.8394676524280678.[0m
[32m[I 2022-04-21 11:38:17,721][0m Trial 484 finished with value: 0.8342213889050052 and parameters: {'splitter': 'best', 'min_samples_split': 0.2574848464183387, 'min_samples_leaf': 0.022462308245504346, 'min_weight_fraction_leaf': 0.05970849365978691, 'max_features': 0.7733361031130674}. Best is trial 480 with value: 0.8394676524280678.[0m
[32m[I 2022-04-21 11:38:17,910][0m Trial 485 finished with value: 0.8372023218910313 and parameters: {'splitter': 'best', 'min_samples_split': 0.26615869550276344, 'min_samples_leaf': 0.01059305917426966, 'min_weight_fraction_leaf': 0.043339263059380954, 'max_features': 0.800924886548164}. Best is trial 480 with value: 0.8394676524280678.[0m
[32m[I 2022-04-21 11:38:18,091][0m Trial 486 finished with value: 0.8318869790887286 and parameters: {'splitter': 'best', 'min_samples_split': 0.2753940424838275, 'min_samples_leaf': 0.022155394087740945, 'min_weight_fraction_leaf': 0.08132200866298181, 'max_features': 0.7297866288452006}. Best is trial 480 with value: 0.8394676524280678.[0m
[32m[I 2022-04-21 11:38:18,188][0m Trial 487 finished with value: 0.8356453536097854 and parameters: {'splitter': 'best', 'min_samples_split': 0.291148027462004, 'min_samples_leaf': 0.011529260690530858, 'min_weight_fraction_leaf': 0.05554718962024541, 'max_features': 0.7684489236847543}. Best is trial 480 with value: 0.8394676524280678.[0m
[32m[I 2022-04-21 11:38:18,333][0m Trial 488 finished with value: 0.8318450474400789 and parameters: {'splitter': 'best', 'min_samples_split': 0.24762141560084872, 'min_samples_leaf': 0.009601033198843856, 'min_weight_fraction_leaf': 0.2220384753350838, 'max_features': 0.7857596716971174}. Best is trial 480 with value: 0.8394676524280678.[0m
[32m[I 2022-04-21 11:38:18,483][0m Trial 489 finished with value: 0.8374751161921132 and parameters: {'splitter': 'best', 'min_samples_split': 0.2632424701991592, 'min_samples_leaf': 0.02212887600810904, 'min_weight_fraction_leaf': 0.031032951941704315, 'max_features': 0.8345805070859016}. Best is trial 480 with value: 0.8394676524280678.[0m
[32m[I 2022-04-21 11:38:18,582][0m Trial 490 finished with value: 0.8372023218910313 and parameters: {'splitter': 'best', 'min_samples_split': 0.26222853578618077, 'min_samples_leaf': 0.022073734862655982, 'min_weight_fraction_leaf': 0.04389141231300457, 'max_features': 0.8288576926217925}. Best is trial 480 with value: 0.8394676524280678.[0m
[32m[I 2022-04-21 11:38:18,748][0m Trial 491 finished with value: 0.8336146512976559 and parameters: {'splitter': 'random', 'min_samples_split': 0.26924089375410865, 'min_samples_leaf': 0.02007140438584859, 'min_weight_fraction_leaf': 0.03117693934860115, 'max_features': 0.8405914449567278}. Best is trial 480 with value: 0.8394676524280678.[0m
[32m[I 2022-04-21 11:38:18,901][0m Trial 492 finished with value: 0.8356635755294366 and parameters: {'splitter': 'best', 'min_samples_split': 0.2536350462715268, 'min_samples_leaf': 0.0017091680120294474, 'min_weight_fraction_leaf': 0.0663911954525601, 'max_features': 0.8141903745758079}. Best is trial 480 with value: 0.8394676524280678.[0m
[32m[I 2022-04-21 11:38:19,032][0m Trial 493 finished with value: 0.8374994682939777 and parameters: {'splitter': 'best', 'min_samples_split': 0.28194651720638375, 'min_samples_leaf': 0.010170249669350004, 'min_weight_fraction_leaf': 0.03431311871272609, 'max_features': 0.749512169480655}. Best is trial 480 with value: 0.8394676524280678.[0m
[32m[I 2022-04-21 11:38:19,119][0m Trial 494 finished with value: 0.8348703389712995 and parameters: {'splitter': 'best', 'min_samples_split': 0.28674192159021233, 'min_samples_leaf': 0.011855316448820664, 'min_weight_fraction_leaf': 0.04288466572213053, 'max_features': 0.745510678898965}. Best is trial 480 with value: 0.8394676524280678.[0m
[32m[I 2022-04-21 11:38:19,199][0m Trial 495 finished with value: 0.8356453536097854 and parameters: {'splitter': 'best', 'min_samples_split': 0.28233022412324543, 'min_samples_leaf': 0.022315057692392424, 'min_weight_fraction_leaf': 0.05375554978497733, 'max_features': 0.7666143155206947}. Best is trial 480 with value: 0.8394676524280678.[0m
[32m[I 2022-04-21 11:38:19,286][0m Trial 496 finished with value: 0.831869170226071 and parameters: {'splitter': 'best', 'min_samples_split': 0.2992706279571968, 'min_samples_leaf': 0.00725349127921708, 'min_weight_fraction_leaf': 0.033559484514879764, 'max_features': 0.7998889225523191}. Best is trial 480 with value: 0.8394676524280678.[0m
[32m[I 2022-04-21 11:38:19,379][0m Trial 497 finished with value: 0.8394676524280678 and parameters: {'splitter': 'best', 'min_samples_split': 0.27416420480809983, 'min_samples_leaf': 0.01217525734846844, 'min_weight_fraction_leaf': 0.04578417031365599, 'max_features': 0.6678781591363006}. Best is trial 480 with value: 0.8394676524280678.[0m
[32m[I 2022-04-21 11:38:19,481][0m Trial 498 finished with value: 0.8340130635607796 and parameters: {'splitter': 'best', 'min_samples_split': 0.06396830495851613, 'min_samples_leaf': 0.021565609165999804, 'min_weight_fraction_leaf': 0.061334050302020486, 'max_features': 0.7219780320807434}. Best is trial 480 with value: 0.8394676524280678.[0m
[32m[I 2022-04-21 11:38:19,560][0m Trial 499 finished with value: 0.8396174698878165 and parameters: {'splitter': 'best', 'min_samples_split': 0.27577889543622125, 'min_samples_leaf': 0.01425957772298497, 'min_weight_fraction_leaf': 0.049442055776326786, 'max_features': 0.7030510310977897}. Best is trial 499 with value: 0.8396174698878165.[0m
[32m[I 2022-04-21 11:38:19,642][0m Trial 500 finished with value: 0.8356453536097854 and parameters: {'splitter': 'best', 'min_samples_split': 0.2797996678859712, 'min_samples_leaf': 0.024471519581444626, 'min_weight_fraction_leaf': 0.051002636752347626, 'max_features': 0.6788248727198816}. Best is trial 499 with value: 0.8396174698878165.[0m
[32m[I 2022-04-21 11:38:19,732][0m Trial 501 finished with value: 0.8340187950162761 and parameters: {'splitter': 'best', 'min_samples_split': 0.2933709434803283, 'min_samples_leaf': 0.015320737922847747, 'min_weight_fraction_leaf': 0.06824549663090546, 'max_features': 0.7039417079866322}. Best is trial 499 with value: 0.8396174698878165.[0m
[32m[I 2022-04-21 11:38:19,808][0m Trial 502 finished with value: 0.8355801993971674 and parameters: {'splitter': 'best', 'min_samples_split': 0.27207957342081474, 'min_samples_leaf': 0.01196454587545695, 'min_weight_fraction_leaf': 0.05812644100559007, 'max_features': 0.7093377098656725}. Best is trial 499 with value: 0.8396174698878165.[0m
[32m[I 2022-04-21 11:38:19,894][0m Trial 503 finished with value: 0.8352014009981168 and parameters: {'splitter': 'best', 'min_samples_split': 0.2843888600935148, 'min_samples_leaf': 0.024800121474763834, 'min_weight_fraction_leaf': 0.047043803476821244, 'max_features': 0.7315905206160443}. Best is trial 499 with value: 0.8396174698878165.[0m
[32m[I 2022-04-21 11:38:19,964][0m Trial 504 finished with value: 0.8318869790887286 and parameters: {'splitter': 'best', 'min_samples_split': 0.25830874485721117, 'min_samples_leaf': 0.013229888829441889, 'min_weight_fraction_leaf': 0.07923215168156626, 'max_features': 0.7507798830678964}. Best is trial 499 with value: 0.8396174698878165.[0m
