[32m[I 2022-04-21 11:38:02,482][0m Trial 316 finished with value: 0.8370547382698911 and parameters: {'splitter': 'best', 'min_samples_split': 0.19283964935694745, 'min_samples_leaf': 0.055661006020381015, 'min_weight_fraction_leaf': 0.025112608687394854, 'max_features': 0.9999563816363587}. Best is trial 272 with value: 0.8386029278581782.[0m
[32m[I 2022-04-21 11:38:02,570][0m Trial 317 finished with value: 0.65 and parameters: {'splitter': 'best', 'min_samples_split': 0.17226359818111303, 'min_samples_leaf': 0.4568002133407806, 'min_weight_fraction_leaf': 0.01056662551247221, 'max_features': 0.9828331699981452}. Best is trial 272 with value: 0.8386029278581782.[0m
[32m[I 2022-04-21 11:38:02,627][0m Trial 318 finished with value: 0.8356635755294366 and parameters: {'splitter': 'best', 'min_samples_split': 0.27750307176052147, 'min_samples_leaf': 0.06649831819760915, 'min_weight_fraction_leaf': 0.008102430721346586, 'max_features': 0.9514128968345389}. Best is trial 272 with value: 0.8386029278581782.[0m
[32m[I 2022-04-21 11:38:02,670][0m Trial 319 finished with value: 0.833988554983085 and parameters: {'splitter': 'best', 'min_samples_split': 0.24465659485429034, 'min_samples_leaf': 0.09683956625853841, 'min_weight_fraction_leaf': 0.009732110651643809, 'max_features': 0.9647918245376165}. Best is trial 272 with value: 0.8386029278581782.[0m
[32m[I 2022-04-21 11:38:02,802][0m Trial 320 finished with value: 0.8332692532720088 and parameters: {'splitter': 'best', 'min_samples_split': 0.23888885321054837, 'min_samples_leaf': 0.06254520310313816, 'min_weight_fraction_leaf': 0.16023797770679965, 'max_features': 0.9813099765155694}. Best is trial 272 with value: 0.8386029278581782.[0m
[32m[I 2022-04-21 11:38:02,925][0m Trial 321 finished with value: 0.834875970541378 and parameters: {'splitter': 'best', 'min_samples_split': 0.14678548604210276, 'min_samples_leaf': 0.045204279602204606, 'min_weight_fraction_leaf': 0.035336049983683816, 'max_features': 0.9363242094067858}. Best is trial 272 with value: 0.8386029278581782.[0m
[32m[I 2022-04-21 11:38:03,035][0m Trial 322 finished with value: 0.8361084444785265 and parameters: {'splitter': 'best', 'min_samples_split': 0.1897318039685037, 'min_samples_leaf': 0.05478525665237574, 'min_weight_fraction_leaf': 0.018227202220465064, 'max_features': 0.9179744212928993}. Best is trial 272 with value: 0.8386029278581782.[0m
[32m[I 2022-04-21 11:38:03,119][0m Trial 323 finished with value: 0.65 and parameters: {'splitter': 'best', 'min_samples_split': 0.16491142077021415, 'min_samples_leaf': 0.3928097428996009, 'min_weight_fraction_leaf': 0.0028734841468455287, 'max_features': 0.6331801271174265}. Best is trial 272 with value: 0.8386029278581782.[0m
[32m[I 2022-04-21 11:38:03,186][0m Trial 324 finished with value: 0.8367225558573038 and parameters: {'splitter': 'best', 'min_samples_split': 0.19359421201367732, 'min_samples_leaf': 0.07612694032618464, 'min_weight_fraction_leaf': 0.03665237603110175, 'max_features': 0.9647814168489145}. Best is trial 272 with value: 0.8386029278581782.[0m
[32m[I 2022-04-21 11:38:03,233][0m Trial 325 finished with value: 0.8360735258269683 and parameters: {'splitter': 'best', 'min_samples_split': 0.17775170879722607, 'min_samples_leaf': 0.04585513201502417, 'min_weight_fraction_leaf': 0.0002506859534815464, 'max_features': 0.949400299902228}. Best is trial 272 with value: 0.8386029278581782.[0m
[32m[I 2022-04-21 11:38:03,369][0m Trial 326 finished with value: 0.8363268199688415 and parameters: {'splitter': 'best', 'min_samples_split': 0.24203189979175235, 'min_samples_leaf': 0.06217246513366931, 'min_weight_fraction_leaf': 0.010937610144705333, 'max_features': 0.9971716389383393}. Best is trial 272 with value: 0.8386029278581782.[0m
[32m[I 2022-04-21 11:38:03,500][0m Trial 327 finished with value: 0.8318450474400789 and parameters: {'splitter': 'best', 'min_samples_split': 0.21762935061405767, 'min_samples_leaf': 0.23487005670288708, 'min_weight_fraction_leaf': 7.366850292023306e-05, 'max_features': 0.9661035155145978}. Best is trial 272 with value: 0.8386029278581782.[0m
[32m[I 2022-04-21 11:38:03,641][0m Trial 328 finished with value: 0.8369839464007164 and parameters: {'splitter': 'best', 'min_samples_split': 0.20065418355388964, 'min_samples_leaf': 0.04847331010890234, 'min_weight_fraction_leaf': 0.02838148803594273, 'max_features': 0.9782903157608364}. Best is trial 272 with value: 0.8386029278581782.[0m
[32m[I 2022-04-21 11:38:03,741][0m Trial 329 finished with value: 0.8370547382698911 and parameters: {'splitter': 'best', 'min_samples_split': 0.22693424535669443, 'min_samples_leaf': 0.05933661453280814, 'min_weight_fraction_leaf': 0.009478544165460684, 'max_features': 0.9547606967121604}. Best is trial 272 with value: 0.8386029278581782.[0m
[32m[I 2022-04-21 11:38:03,829][0m Trial 330 finished with value: 0.6744920180162803 and parameters: {'splitter': 'best', 'min_samples_split': 0.2272514321288279, 'min_samples_leaf': 0.08487655871534497, 'min_weight_fraction_leaf': 0.33154044515714465, 'max_features': 0.950625424339656}. Best is trial 272 with value: 0.8386029278581782.[0m
[32m[I 2022-04-21 11:38:03,972][0m Trial 331 finished with value: 0.8363646776683682 and parameters: {'splitter': 'best', 'min_samples_split': 0.15759597214220944, 'min_samples_leaf': 0.07327848787862996, 'min_weight_fraction_leaf': 0.024573229931854165, 'max_features': 0.9814031239349887}. Best is trial 272 with value: 0.8386029278581782.[0m
[32m[I 2022-04-21 11:38:04,106][0m Trial 332 finished with value: 0.8331505195055676 and parameters: {'splitter': 'random', 'min_samples_split': 0.17602593592036667, 'min_samples_leaf': 0.03997670431598058, 'min_weight_fraction_leaf': 0.018758309556944925, 'max_features': 0.9927720144373026}. Best is trial 272 with value: 0.8386029278581782.[0m
[32m[I 2022-04-21 11:38:04,209][0m Trial 333 finished with value: 0.8356635755294366 and parameters: {'splitter': 'best', 'min_samples_split': 0.26120068177055417, 'min_samples_leaf': 0.06904105973161774, 'min_weight_fraction_leaf': 0.016156013659406866, 'max_features': 0.9797011047622762}. Best is trial 272 with value: 0.8386029278581782.[0m
[32m[I 2022-04-21 11:38:04,299][0m Trial 334 finished with value: 0.8342186517555936 and parameters: {'splitter': 'best', 'min_samples_split': 0.17081582924858438, 'min_samples_leaf': 0.05619313948903644, 'min_weight_fraction_leaf': 0.11092231508548572, 'max_features': 0.9966808703650243}. Best is trial 272 with value: 0.8386029278581782.[0m
[32m[I 2022-04-21 11:38:04,422][0m Trial 335 finished with value: 0.8369733404001721 and parameters: {'splitter': 'best', 'min_samples_split': 0.20400831538860564, 'min_samples_leaf': 0.03666415338227097, 'min_weight_fraction_leaf': 0.03597326109245952, 'max_features': 0.9272206492467031}. Best is trial 272 with value: 0.8386029278581782.[0m
[32m[I 2022-04-21 11:38:04,566][0m Trial 336 finished with value: 0.8318450474400789 and parameters: {'splitter': 'best', 'min_samples_split': 0.1442846074749461, 'min_samples_leaf': 0.288230449182174, 'min_weight_fraction_leaf': 0.015477009970674381, 'max_features': 0.9821499909992482}. Best is trial 272 with value: 0.8386029278581782.[0m
[32m[I 2022-04-21 11:38:04,674][0m Trial 337 finished with value: 0.8361084444785265 and parameters: {'splitter': 'best', 'min_samples_split': 0.18552234592448433, 'min_samples_leaf': 0.04980811788206392, 'min_weight_fraction_leaf': 0.02992615323477478, 'max_features': 0.9999347588332436}. Best is trial 272 with value: 0.8386029278581782.[0m
[32m[I 2022-04-21 11:38:04,781][0m Trial 338 finished with value: 0.8342605834042434 and parameters: {'splitter': 'best', 'min_samples_split': 0.2099310433417796, 'min_samples_leaf': 0.0823910249705444, 'min_weight_fraction_leaf': 0.022801291149813552, 'max_features': 0.9438410671827095}. Best is trial 272 with value: 0.8386029278581782.[0m
[32m[I 2022-04-21 11:38:04,828][0m Trial 339 finished with value: 0.8370547382698911 and parameters: {'splitter': 'best', 'min_samples_split': 0.22908686150968066, 'min_samples_leaf': 0.05770526590327045, 'min_weight_fraction_leaf': 0.011840296008560682, 'max_features': 0.973944067265111}. Best is trial 272 with value: 0.8386029278581782.[0m
[32m[I 2022-04-21 11:38:04,899][0m Trial 340 finished with value: 0.8359946375562541 and parameters: {'splitter': 'best', 'min_samples_split': 0.24341981716220684, 'min_samples_leaf': 0.07033591727182567, 'min_weight_fraction_leaf': 0.0006616384032782929, 'max_features': 0.980312448321189}. Best is trial 272 with value: 0.8386029278581782.[0m
[32m[I 2022-04-21 11:38:04,992][0m Trial 341 finished with value: 0.8369839464007164 and parameters: {'splitter': 'best', 'min_samples_split': 0.18573317874873885, 'min_samples_leaf': 0.04851003059323656, 'min_weight_fraction_leaf': 0.0415354341300495, 'max_features': 0.9307627919759838}. Best is trial 272 with value: 0.8386029278581782.[0m
[32m[I 2022-04-21 11:38:05,080][0m Trial 342 finished with value: 0.8369733404001721 and parameters: {'splitter': 'best', 'min_samples_split': 0.1947739171058414, 'min_samples_leaf': 0.035485126795900886, 'min_weight_fraction_leaf': 0.03280209726845386, 'max_features': 0.9656535998617258}. Best is trial 272 with value: 0.8386029278581782.[0m
[32m[I 2022-04-21 11:38:05,140][0m Trial 343 finished with value: 0.8363914938304864 and parameters: {'splitter': 'best', 'min_samples_split': 0.21584857763427648, 'min_samples_leaf': 0.06648679563021646, 'min_weight_fraction_leaf': 0.008979390876544112, 'max_features': 0.909390495303851}. Best is trial 272 with value: 0.8386029278581782.[0m
[32m[I 2022-04-21 11:38:05,236][0m Trial 344 finished with value: 0.65 and parameters: {'splitter': 'best', 'min_samples_split': 0.15623947065273364, 'min_samples_leaf': 0.17488585038318027, 'min_weight_fraction_leaf': 0.4766316492566193, 'max_features': 0.9512918748079127}. Best is trial 272 with value: 0.8386029278581782.[0m
[32m[I 2022-04-21 11:38:05,329][0m Trial 345 finished with value: 0.8370547382698911 and parameters: {'splitter': 'best', 'min_samples_split': 0.19624402641233352, 'min_samples_leaf': 0.056439876762580596, 'min_weight_fraction_leaf': 0.02341146240974771, 'max_features': 0.9959656821025447}. Best is trial 272 with value: 0.8386029278581782.[0m
[32m[I 2022-04-21 11:38:05,405][0m Trial 346 finished with value: 0.8318450474400789 and parameters: {'splitter': 'best', 'min_samples_split': 0.1669864304731929, 'min_samples_leaf': 0.07807632928592724, 'min_weight_fraction_leaf': 0.23765499609867907, 'max_features': 0.9992836033249664}. Best is trial 272 with value: 0.8386029278581782.[0m
[32m[I 2022-04-21 11:38:05,451][0m Trial 347 finished with value: 0.8328978783341231 and parameters: {'splitter': 'best', 'min_samples_split': 0.20798341469349352, 'min_samples_leaf': 0.1254370387755946, 'min_weight_fraction_leaf': 0.024348287715492915, 'max_features': 0.9377437266349254}. Best is trial 272 with value: 0.8386029278581782.[0m
[32m[I 2022-04-21 11:38:05,497][0m Trial 348 finished with value: 0.8345525536484555 and parameters: {'splitter': 'random', 'min_samples_split': 0.18188184963073614, 'min_samples_leaf': 0.045439745288086274, 'min_weight_fraction_leaf': 0.02768255775588029, 'max_features': 0.9663658492481392}. Best is trial 272 with value: 0.8386029278581782.[0m
[32m[I 2022-04-21 11:38:05,588][0m Trial 349 finished with value: 0.6864017167921991 and parameters: {'splitter': 'best', 'min_samples_split': 0.16186089375110352, 'min_samples_leaf': 0.1018424593964817, 'min_weight_fraction_leaf': 0.016689349465384553, 'max_features': 0.15063793571139983}. Best is trial 272 with value: 0.8386029278581782.[0m
[32m[I 2022-04-21 11:38:05,688][0m Trial 350 finished with value: 0.8318450474400789 and parameters: {'splitter': 'best', 'min_samples_split': 0.2509313018214178, 'min_samples_leaf': 0.05500181027827366, 'min_weight_fraction_leaf': 0.1839714290933857, 'max_features': 0.9167693461536655}. Best is trial 272 with value: 0.8386029278581782.[0m
[32m[I 2022-04-21 11:38:05,816][0m Trial 351 finished with value: 0.833988554983085 and parameters: {'splitter': 'best', 'min_samples_split': 0.23242498827678004, 'min_samples_leaf': 0.08952783520491278, 'min_weight_fraction_leaf': 0.007240682417023354, 'max_features': 0.9499955494755882}. Best is trial 272 with value: 0.8386029278581782.[0m
[32m[I 2022-04-21 11:38:05,921][0m Trial 352 finished with value: 0.8328978783341231 and parameters: {'splitter': 'best', 'min_samples_split': 0.21721159970502274, 'min_samples_leaf': 0.06693147541326153, 'min_weight_fraction_leaf': 0.13623120011302825, 'max_features': 0.9602637076032233}. Best is trial 272 with value: 0.8386029278581782.[0m
[32m[I 2022-04-21 11:38:06,040][0m Trial 353 finished with value: 0.8353871517105244 and parameters: {'splitter': 'best', 'min_samples_split': 0.16843515912176843, 'min_samples_leaf': 0.03822278476362695, 'min_weight_fraction_leaf': 0.010512407129339256, 'max_features': 0.9844465480702357}. Best is trial 272 with value: 0.8386029278581782.[0m
[32m[I 2022-04-21 11:38:06,144][0m Trial 354 finished with value: 0.8350481835720354 and parameters: {'splitter': 'best', 'min_samples_split': 0.14929190977976603, 'min_samples_leaf': 0.07823640618439721, 'min_weight_fraction_leaf': 0.01725576188724554, 'max_features': 0.9322659064738796}. Best is trial 272 with value: 0.8386029278581782.[0m
[32m[I 2022-04-21 11:38:06,265][0m Trial 355 finished with value: 0.8363914938304864 and parameters: {'splitter': 'best', 'min_samples_split': 0.21268472410584766, 'min_samples_leaf': 0.06412540137239076, 'min_weight_fraction_leaf': 0.0005681527374826675, 'max_features': 0.9653483217413654}. Best is trial 272 with value: 0.8386029278581782.[0m
[32m[I 2022-04-21 11:38:06,389][0m Trial 356 finished with value: 0.8352329321092128 and parameters: {'splitter': 'best', 'min_samples_split': 0.172245151376703, 'min_samples_leaf': 0.04644796179060716, 'min_weight_fraction_leaf': 0.021764400126219947, 'max_features': 0.9060579713140863}. Best is trial 272 with value: 0.8386029278581782.[0m
[32m[I 2022-04-21 11:38:06,491][0m Trial 357 finished with value: 0.8363268199688415 and parameters: {'splitter': 'best', 'min_samples_split': 0.2864721591525211, 'min_samples_leaf': 0.057265561240982574, 'min_weight_fraction_leaf': 0.01725145809005495, 'max_features': 0.9797259509580191}. Best is trial 272 with value: 0.8386029278581782.[0m
[32m[I 2022-04-21 11:38:06,594][0m Trial 358 finished with value: 0.8342605834042434 and parameters: {'splitter': 'best', 'min_samples_split': 0.23867334805054932, 'min_samples_leaf': 0.07742875100788775, 'min_weight_fraction_leaf': 0.01069771290932034, 'max_features': 0.9983025254384923}. Best is trial 272 with value: 0.8386029278581782.[0m
[32m[I 2022-04-21 11:38:06,709][0m Trial 359 finished with value: 0.8367225558573038 and parameters: {'splitter': 'best', 'min_samples_split': 0.1847575958163674, 'min_samples_leaf': 0.07106495930540054, 'min_weight_fraction_leaf': 0.007492144350698083, 'max_features': 0.95484722980558}. Best is trial 272 with value: 0.8386029278581782.[0m
[32m[I 2022-04-21 11:38:06,817][0m Trial 360 finished with value: 0.833988554983085 and parameters: {'splitter': 'best', 'min_samples_split': 0.26103573546333125, 'min_samples_leaf': 0.0923796518703014, 'min_weight_fraction_leaf': 0.008881853257938234, 'max_features': 0.9776304899349615}. Best is trial 272 with value: 0.8386029278581782.[0m
[32m[I 2022-04-21 11:38:06,939][0m Trial 361 finished with value: 0.8363268199688415 and parameters: {'splitter': 'best', 'min_samples_split': 0.22958731002546112, 'min_samples_leaf': 0.05626181560081576, 'min_weight_fraction_leaf': 0.03699509206871176, 'max_features': 0.9594045188353527}. Best is trial 272 with value: 0.8386029278581782.[0m
[32m[I 2022-04-21 11:38:07,013][0m Trial 362 finished with value: 0.703831508598297 and parameters: {'splitter': 'best', 'min_samples_split': 0.24546714039642997, 'min_samples_leaf': 0.32123102920808777, 'min_weight_fraction_leaf': 0.016405107816760783, 'max_features': 0.934428030470372}. Best is trial 272 with value: 0.8386029278581782.[0m
[32m[I 2022-04-21 11:38:07,138][0m Trial 363 finished with value: 0.8368835244060235 and parameters: {'splitter': 'best', 'min_samples_split': 0.22670909411276027, 'min_samples_leaf': 0.032577500825957666, 'min_weight_fraction_leaf': 0.0006691460159828702, 'max_features': 0.9814604670040945}. Best is trial 272 with value: 0.8386029278581782.[0m
[32m[I 2022-04-21 11:38:07,264][0m Trial 364 finished with value: 0.8363914938304864 and parameters: {'splitter': 'best', 'min_samples_split': 0.2105232075499375, 'min_samples_leaf': 0.0684954918886688, 'min_weight_fraction_leaf': 0.001790201294688631, 'max_features': 0.9404491601017725}. Best is trial 272 with value: 0.8386029278581782.[0m
[32m[I 2022-04-21 11:38:07,386][0m Trial 365 finished with value: 0.8363914938304864 and parameters: {'splitter': 'best', 'min_samples_split': 0.1976410976820995, 'min_samples_leaf': 0.06286371369459746, 'min_weight_fraction_leaf': 0.009916933737253419, 'max_features': 0.9998110336993967}. Best is trial 272 with value: 0.8386029278581782.[0m
[32m[I 2022-04-21 11:38:07,505][0m Trial 366 finished with value: 0.8235100430001496 and parameters: {'splitter': 'best', 'min_samples_split': 0.1422717672773551, 'min_samples_leaf': 0.04501898442577334, 'min_weight_fraction_leaf': 0.03628392050034665, 'max_features': 0.39219244707520023}. Best is trial 272 with value: 0.8386029278581782.[0m
[32m[I 2022-04-21 11:38:07,638][0m Trial 367 finished with value: 0.8318450474400789 and parameters: {'splitter': 'best', 'min_samples_split': 0.19795235122756355, 'min_samples_leaf': 0.27102048939325946, 'min_weight_fraction_leaf': 0.024876649378451667, 'max_features': 0.9993437894776984}. Best is trial 272 with value: 0.8386029278581782.[0m
[32m[I 2022-04-21 11:38:07,743][0m Trial 368 finished with value: 0.8345525536484555 and parameters: {'splitter': 'random', 'min_samples_split': 0.19453072033389077, 'min_samples_leaf': 0.053008989682564144, 'min_weight_fraction_leaf': 0.02817313332895325, 'max_features': 0.9778607218046629}. Best is trial 272 with value: 0.8386029278581782.[0m
[32m[I 2022-04-21 11:38:07,863][0m Trial 369 finished with value: 0.8357196521117292 and parameters: {'splitter': 'best', 'min_samples_split': 0.012851073755415027, 'min_samples_leaf': 0.03875041832568138, 'min_weight_fraction_leaf': 0.0002496109263956893, 'max_features': 0.9588579520539869}. Best is trial 272 with value: 0.8386029278581782.[0m
[32m[I 2022-04-21 11:38:07,961][0m Trial 370 finished with value: 0.83518896684928 and parameters: {'splitter': 'best', 'min_samples_split': 0.17324150916698822, 'min_samples_leaf': 0.049406836247497865, 'min_weight_fraction_leaf': 0.04294356182603693, 'max_features': 0.9226060653942246}. Best is trial 272 with value: 0.8386029278581782.[0m
[32m[I 2022-04-21 11:38:08,041][0m Trial 371 finished with value: 0.8370547382698911 and parameters: {'splitter': 'best', 'min_samples_split': 0.22905215870066545, 'min_samples_leaf': 0.05685244927139656, 'min_weight_fraction_leaf': 0.013749772143358485, 'max_features': 0.9770594636577069}. Best is trial 272 with value: 0.8386029278581782.[0m
[32m[I 2022-04-21 11:38:08,121][0m Trial 372 finished with value: 0.833988554983085 and parameters: {'splitter': 'best', 'min_samples_split': 0.18096458381827335, 'min_samples_leaf': 0.08477412492661962, 'min_weight_fraction_leaf': 0.029271002945108655, 'max_features': 0.9587640646784283}. Best is trial 272 with value: 0.8386029278581782.[0m
[32m[I 2022-04-21 11:38:08,194][0m Trial 373 finished with value: 0.720122309788786 and parameters: {'splitter': 'best', 'min_samples_split': 0.16053107104157455, 'min_samples_leaf': 0.07340559075661854, 'min_weight_fraction_leaf': 0.3066468024675232, 'max_features': 0.9453143925553501}. Best is trial 272 with value: 0.8386029278581782.[0m
[32m[I 2022-04-21 11:38:08,271][0m Trial 374 finished with value: 0.8328255155375228 and parameters: {'splitter': 'best', 'min_samples_split': 0.23861098462147945, 'min_samples_leaf': 0.06387511584188069, 'min_weight_fraction_leaf': 0.0003402370803913188, 'max_features': 0.6739486986281835}. Best is trial 272 with value: 0.8386029278581782.[0m
[32m[I 2022-04-21 11:38:08,345][0m Trial 375 finished with value: 0.8372023218910313 and parameters: {'splitter': 'best', 'min_samples_split': 0.2552875744056776, 'min_samples_leaf': 0.047510911911023364, 'min_weight_fraction_leaf': 0.035656606187926626, 'max_features': 0.9733127384252613}. Best is trial 272 with value: 0.8386029278581782.[0m
[32m[I 2022-04-21 11:38:08,414][0m Trial 376 finished with value: 0.8348675823184362 and parameters: {'splitter': 'best', 'min_samples_split': 0.15220308392386495, 'min_samples_leaf': 0.030746325805162, 'min_weight_fraction_leaf': 0.021859950088790447, 'max_features': 0.8871294748828239}. Best is trial 272 with value: 0.8386029278581782.[0m
[32m[I 2022-04-21 11:38:08,504][0m Trial 377 finished with value: 0.8372023218910313 and parameters: {'splitter': 'best', 'min_samples_split': 0.270480903970229, 'min_samples_leaf': 0.04067547520247278, 'min_weight_fraction_leaf': 0.044715436863783944, 'max_features': 0.932509791880814}. Best is trial 272 with value: 0.8386029278581782.[0m
[32m[I 2022-04-21 11:38:08,585][0m Trial 378 finished with value: 0.8318450474400789 and parameters: {'splitter': 'best', 'min_samples_split': 0.26173981308965516, 'min_samples_leaf': 0.19460383681238125, 'min_weight_fraction_leaf': 0.04638359620319156, 'max_features': 0.9261112782674435}. Best is trial 272 with value: 0.8386029278581782.[0m
