[32m[I 2022-04-22 09:38:53,231][0m Trial 416 finished with value: 0.803346294467071 and parameters: {'n_hidden': 512, 'mixture_components': 2, 'use_sparse_layer': False, 'use_batchnorm': True, 'use_dropout': False, 'mlp_size_1': 2, 'mlp_size_2': 4, 'mlp_size_3': 0, 'kernel': 'Exponential', 'loss_name': 'NLLLoss'}. Best is trial 22 with value: 0.8433318468070169.[0m
[32m[I 2022-04-22 09:41:22,690][0m Trial 417 finished with value: 0.7302654060568137 and parameters: {'n_hidden': 512, 'mixture_components': 1, 'use_sparse_layer': True, 'use_sparse_loss': False, 'use_batchnorm': True, 'use_dropout': True, 'dropout': 0.6916421317718268, 'mlp_size_1': 3, 'mlp_size_2': 3, 'mlp_size_3': 0, 'kernel': 'Exponential', 'loss_name': 'NLLLoss'}. Best is trial 22 with value: 0.8433318468070169.[0m
[32m[I 2022-04-22 09:42:52,834][0m Trial 418 finished with value: 0.8230311092613384 and parameters: {'n_hidden': 128, 'mixture_components': 2, 'use_sparse_layer': True, 'use_sparse_loss': False, 'use_batchnorm': False, 'use_dropout': True, 'dropout': 0.7059713873617648, 'mlp_size_1': 0, 'mlp_size_2': 4, 'mlp_size_3': 0, 'kernel': 'LogLogistic', 'loss_name': 'CensoredNLLLoss'}. Best is trial 22 with value: 0.8433318468070169.[0m
[32m[I 2022-04-22 09:45:08,986][0m Trial 419 finished with value: 0.8280564910266864 and parameters: {'n_hidden': 64, 'mixture_components': 2, 'use_sparse_layer': True, 'use_sparse_loss': True, 'lmbd': 4.801657176347452e-05, 'use_batchnorm': True, 'use_dropout': True, 'dropout': 0.7502105561428342, 'mlp_size_1': 0, 'mlp_size_2': 3, 'mlp_size_3': 0, 'kernel': 'Exponential', 'loss_name': 'NLLLoss'}. Best is trial 22 with value: 0.8433318468070169.[0m
[32m[I 2022-04-22 09:45:54,325][0m Trial 420 finished with value: -0.5 and parameters: {'n_hidden': 512, 'mixture_components': 2, 'use_sparse_layer': True, 'use_sparse_loss': False, 'use_batchnorm': True, 'use_dropout': True, 'dropout': 0.6694245970474232, 'mlp_size_1': 0, 'mlp_size_2': 6, 'mlp_size_3': 0, 'kernel': 'Gumbel', 'loss_name': 'NLLLoss'}. Best is trial 22 with value: 0.8433318468070169.[0m
[32m[I 2022-04-22 09:47:05,151][0m Trial 421 finished with value: 0.8003521966683597 and parameters: {'n_hidden': 512, 'mixture_components': 3, 'use_sparse_layer': True, 'use_sparse_loss': False, 'use_batchnorm': False, 'use_dropout': False, 'mlp_size_1': 1, 'mlp_size_2': 5, 'mlp_size_3': 0, 'kernel': 'Normal', 'loss_name': 'AlternativeNLLLoss'}. Best is trial 22 with value: 0.8433318468070169.[0m
[32m[I 2022-04-22 09:49:14,461][0m Trial 422 finished with value: 0.8338026478295916 and parameters: {'n_hidden': 128, 'mixture_components': 2, 'use_sparse_layer': True, 'use_sparse_loss': False, 'use_batchnorm': True, 'use_dropout': True, 'dropout': 0.687882373206238, 'mlp_size_1': 0, 'mlp_size_2': 4, 'mlp_size_3': 0, 'kernel': 'Exponential', 'loss_name': 'NLLLoss'}. Best is trial 22 with value: 0.8433318468070169.[0m
[32m[I 2022-04-22 09:51:23,104][0m Trial 423 finished with value: 0.8207551111640725 and parameters: {'n_hidden': 1024, 'mixture_components': 2, 'use_sparse_layer': False, 'use_batchnorm': True, 'use_dropout': True, 'dropout': 0.5184106178526127, 'mlp_size_1': 4, 'mlp_size_2': 3, 'mlp_size_3': 0, 'kernel': 'Exponential', 'loss_name': 'NLLLoss'}. Best is trial 22 with value: 0.8433318468070169.[0m
[32m[I 2022-04-22 09:52:26,276][0m Trial 424 finished with value: 0.8328720391390224 and parameters: {'n_hidden': 256, 'mixture_components': 9, 'use_sparse_layer': True, 'use_sparse_loss': True, 'lmbd': 6.447444216843705e-06, 'use_batchnorm': False, 'use_dropout': True, 'dropout': 0.12896283378110318, 'mlp_size_1': 3, 'mlp_size_2': 2, 'mlp_size_3': 0, 'kernel': 'Exponential', 'loss_name': 'NLLLoss'}. Best is trial 22 with value: 0.8433318468070169.[0m
[32m[I 2022-04-22 09:54:21,306][0m Trial 425 finished with value: 0.8293963151749324 and parameters: {'n_hidden': 512, 'mixture_components': 3, 'use_sparse_layer': True, 'use_sparse_loss': False, 'use_batchnorm': True, 'use_dropout': True, 'dropout': 0.21386410699805686, 'mlp_size_1': 0, 'mlp_size_2': 6, 'mlp_size_3': 0, 'kernel': 'Exponential', 'loss_name': 'NLLLoss'}. Best is trial 22 with value: 0.8433318468070169.[0m
[32m[I 2022-04-22 09:57:48,101][0m Trial 426 finished with value: 0.3257939722602554 and parameters: {'n_hidden': 256, 'mixture_components': 4, 'use_sparse_layer': True, 'use_sparse_loss': False, 'use_batchnorm': True, 'use_dropout': True, 'dropout': 0.545247514772505, 'mlp_size_1': 3, 'mlp_size_2': 1, 'mlp_size_3': 1, 'kernel': 'Normal', 'loss_name': 'CensoredNLLLoss'}. Best is trial 22 with value: 0.8433318468070169.[0m
[32m[I 2022-04-22 09:58:31,707][0m Trial 427 finished with value: 0.7876865165793049 and parameters: {'n_hidden': 512, 'mixture_components': 8, 'use_sparse_layer': True, 'use_sparse_loss': False, 'use_batchnorm': False, 'use_dropout': False, 'mlp_size_1': 0, 'mlp_size_2': 6, 'mlp_size_3': 0, 'kernel': 'Exponential', 'loss_name': 'NLLLoss'}. Best is trial 22 with value: 0.8433318468070169.[0m
[32m[I 2022-04-22 10:01:01,662][0m Trial 428 finished with value: 0.8281594155109392 and parameters: {'n_hidden': 256, 'mixture_components': 2, 'use_sparse_layer': True, 'use_sparse_loss': True, 'lmbd': 1.1547917138894345e-05, 'use_batchnorm': True, 'use_dropout': True, 'dropout': 0.6567964305469995, 'mlp_size_1': 3, 'mlp_size_2': 2, 'mlp_size_3': 0, 'kernel': 'Exponential', 'loss_name': 'NLLLoss'}. Best is trial 22 with value: 0.8433318468070169.[0m
[32m[I 2022-04-22 10:03:12,243][0m Trial 429 finished with value: 0.8310397211009866 and parameters: {'n_hidden': 128, 'mixture_components': 5, 'use_sparse_layer': False, 'use_batchnorm': True, 'use_dropout': True, 'dropout': 0.5759250998970903, 'mlp_size_1': 0, 'mlp_size_2': 4, 'mlp_size_3': 0, 'kernel': 'Exponential', 'loss_name': 'NLLLoss'}. Best is trial 22 with value: 0.8433318468070169.[0m
[32m[I 2022-04-22 10:04:20,167][0m Trial 430 finished with value: 0.8304750189449747 and parameters: {'n_hidden': 2048, 'mixture_components': 1, 'use_sparse_layer': True, 'use_sparse_loss': False, 'use_batchnorm': False, 'use_dropout': True, 'dropout': 0.0855850167661026, 'mlp_size_1': 2, 'mlp_size_2': 6, 'mlp_size_3': 0, 'kernel': 'LogLogistic', 'loss_name': 'NLLLoss'}. Best is trial 22 with value: 0.8433318468070169.[0m
[32m[I 2022-04-22 10:07:00,809][0m Trial 431 finished with value: 0.7166074715323111 and parameters: {'n_hidden': 256, 'mixture_components': 5, 'use_sparse_layer': True, 'use_sparse_loss': False, 'use_batchnorm': True, 'use_dropout': True, 'dropout': 0.16373889079127507, 'mlp_size_1': 3, 'mlp_size_2': 1, 'mlp_size_3': 1, 'kernel': 'Exponential', 'loss_name': 'NLLLoss'}. Best is trial 22 with value: 0.8433318468070169.[0m
[32m[I 2022-04-22 10:10:05,645][0m Trial 432 finished with value: 0.6204075167592229 and parameters: {'n_hidden': 512, 'mixture_components': 5, 'use_sparse_layer': True, 'use_sparse_loss': False, 'use_batchnorm': True, 'use_dropout': False, 'mlp_size_1': 1, 'mlp_size_2': 5, 'mlp_size_3': 0, 'kernel': 'Normal', 'loss_name': 'CensoredNLLLoss'}. Best is trial 22 with value: 0.8433318468070169.[0m
[32m[I 2022-04-22 10:11:46,424][0m Trial 433 finished with value: 0.8114891420698097 and parameters: {'n_hidden': 64, 'mixture_components': 2, 'use_sparse_layer': True, 'use_sparse_loss': True, 'lmbd': 0.0001225454105584668, 'use_batchnorm': False, 'use_dropout': True, 'dropout': 0.7312681610949364, 'mlp_size_1': 0, 'mlp_size_2': 3, 'mlp_size_3': 0, 'kernel': 'Logistic', 'loss_name': 'NLLLoss'}. Best is trial 22 with value: 0.8433318468070169.[0m
[32m[I 2022-04-22 10:13:37,098][0m Trial 434 finished with value: 0.8336998679299104 and parameters: {'n_hidden': 256, 'mixture_components': 9, 'use_sparse_layer': True, 'use_sparse_loss': False, 'use_batchnorm': True, 'use_dropout': True, 'dropout': 0.6005701127906722, 'mlp_size_1': 0, 'mlp_size_2': 5, 'mlp_size_3': 0, 'kernel': 'Exponential', 'loss_name': 'NLLLoss'}. Best is trial 22 with value: 0.8433318468070169.[0m
[32m[I 2022-04-22 10:15:43,977][0m Trial 435 finished with value: 0.8360650823787023 and parameters: {'n_hidden': 512, 'mixture_components': 5, 'use_sparse_layer': False, 'use_batchnorm': True, 'use_dropout': True, 'dropout': 0.6411736663870886, 'mlp_size_1': 1, 'mlp_size_2': 5, 'mlp_size_3': 0, 'kernel': 'Exponential', 'loss_name': 'NLLLoss'}. Best is trial 22 with value: 0.8433318468070169.[0m
[32m[I 2022-04-22 10:16:45,456][0m Trial 436 finished with value: 0.8311332149378003 and parameters: {'n_hidden': 512, 'mixture_components': 5, 'use_sparse_layer': False, 'use_batchnorm': False, 'use_dropout': True, 'dropout': 0.31795552295037294, 'mlp_size_1': 1, 'mlp_size_2': 5, 'mlp_size_3': 0, 'kernel': 'Exponential', 'loss_name': 'NLLLoss'}. Best is trial 22 with value: 0.8433318468070169.[0m
[32m[I 2022-04-22 10:18:59,705][0m Trial 437 finished with value: 0.4998076665414038 and parameters: {'n_hidden': 512, 'mixture_components': 8, 'use_sparse_layer': False, 'use_batchnorm': True, 'use_dropout': False, 'mlp_size_1': 1, 'mlp_size_2': 5, 'mlp_size_3': 0, 'kernel': 'Normal', 'loss_name': 'NLLLoss'}. Best is trial 22 with value: 0.8433318468070169.[0m
[32m[I 2022-04-22 10:21:23,804][0m Trial 438 finished with value: 0.8388120652211526 and parameters: {'n_hidden': 512, 'mixture_components': 5, 'use_sparse_layer': False, 'use_batchnorm': True, 'use_dropout': True, 'dropout': 0.6728298660940798, 'mlp_size_1': 1, 'mlp_size_2': 5, 'mlp_size_3': 0, 'kernel': 'Exponential', 'loss_name': 'NLLLoss'}. Best is trial 22 with value: 0.8433318468070169.[0m
[32m[I 2022-04-22 10:23:25,386][0m Trial 439 finished with value: 0.8354853489163215 and parameters: {'n_hidden': 512, 'mixture_components': 5, 'use_sparse_layer': False, 'use_batchnorm': True, 'use_dropout': True, 'dropout': 0.6453208709963252, 'mlp_size_1': 1, 'mlp_size_2': 5, 'mlp_size_3': 0, 'kernel': 'Exponential', 'loss_name': 'NLLLoss'}. Best is trial 22 with value: 0.8433318468070169.[0m
[32m[I 2022-04-22 10:25:38,502][0m Trial 440 finished with value: 0.8315524652116899 and parameters: {'n_hidden': 512, 'mixture_components': 5, 'use_sparse_layer': False, 'use_batchnorm': True, 'use_dropout': True, 'dropout': 0.6795937093159711, 'mlp_size_1': 1, 'mlp_size_2': 5, 'mlp_size_3': 0, 'kernel': 'Exponential', 'loss_name': 'NLLLoss'}. Best is trial 22 with value: 0.8433318468070169.[0m
[32m[I 2022-04-22 10:27:57,776][0m Trial 441 finished with value: 0.8310134737332342 and parameters: {'n_hidden': 512, 'mixture_components': 5, 'use_sparse_layer': False, 'use_batchnorm': True, 'use_dropout': True, 'dropout': 0.6637837990028082, 'mlp_size_1': 1, 'mlp_size_2': 5, 'mlp_size_3': 0, 'kernel': 'Exponential', 'loss_name': 'NLLLoss'}. Best is trial 22 with value: 0.8433318468070169.[0m
[32m[I 2022-04-22 10:30:09,093][0m Trial 442 finished with value: 0.8339904299408157 and parameters: {'n_hidden': 512, 'mixture_components': 5, 'use_sparse_layer': False, 'use_batchnorm': True, 'use_dropout': True, 'dropout': 0.7061341534308972, 'mlp_size_1': 1, 'mlp_size_2': 5, 'mlp_size_3': 0, 'kernel': 'Exponential', 'loss_name': 'NLLLoss'}. Best is trial 22 with value: 0.8433318468070169.[0m
[32m[I 2022-04-22 10:32:08,095][0m Trial 443 finished with value: 0.8338377915460384 and parameters: {'n_hidden': 512, 'mixture_components': 5, 'use_sparse_layer': False, 'use_batchnorm': True, 'use_dropout': True, 'dropout': 0.6820224384109197, 'mlp_size_1': 1, 'mlp_size_2': 5, 'mlp_size_3': 0, 'kernel': 'Exponential', 'loss_name': 'NLLLoss'}. Best is trial 22 with value: 0.8433318468070169.[0m
[32m[I 2022-04-22 10:34:09,146][0m Trial 444 finished with value: 0.8214884526576407 and parameters: {'n_hidden': 512, 'mixture_components': 5, 'use_sparse_layer': False, 'use_batchnorm': True, 'use_dropout': False, 'mlp_size_1': 1, 'mlp_size_2': 5, 'mlp_size_3': 0, 'kernel': 'Exponential', 'loss_name': 'NLLLoss'}. Best is trial 22 with value: 0.8433318468070169.[0m
[32m[I 2022-04-22 10:36:02,891][0m Trial 445 finished with value: 0.8359101357390264 and parameters: {'n_hidden': 512, 'mixture_components': 5, 'use_sparse_layer': False, 'use_batchnorm': True, 'use_dropout': True, 'dropout': 0.6413770247819961, 'mlp_size_1': 1, 'mlp_size_2': 5, 'mlp_size_3': 0, 'kernel': 'Exponential', 'loss_name': 'NLLLoss'}. Best is trial 22 with value: 0.8433318468070169.[0m
[32m[I 2022-04-22 10:38:07,801][0m Trial 446 finished with value: 0.8354760609826096 and parameters: {'n_hidden': 512, 'mixture_components': 5, 'use_sparse_layer': False, 'use_batchnorm': True, 'use_dropout': True, 'dropout': 0.6212432182672424, 'mlp_size_1': 1, 'mlp_size_2': 5, 'mlp_size_3': 0, 'kernel': 'Exponential', 'loss_name': 'NLLLoss'}. Best is trial 22 with value: 0.8433318468070169.[0m
[32m[I 2022-04-22 10:40:18,288][0m Trial 447 finished with value: 0.8297093220718157 and parameters: {'n_hidden': 512, 'mixture_components': 5, 'use_sparse_layer': False, 'use_batchnorm': True, 'use_dropout': True, 'dropout': 0.6633593280603582, 'mlp_size_1': 1, 'mlp_size_2': 5, 'mlp_size_3': 0, 'kernel': 'Exponential', 'loss_name': 'NLLLoss'}. Best is trial 22 with value: 0.8433318468070169.[0m
[32m[I 2022-04-22 10:42:22,311][0m Trial 448 finished with value: 0.8326049191238305 and parameters: {'n_hidden': 512, 'mixture_components': 5, 'use_sparse_layer': False, 'use_batchnorm': True, 'use_dropout': True, 'dropout': 0.6039455731176934, 'mlp_size_1': 1, 'mlp_size_2': 5, 'mlp_size_3': 0, 'kernel': 'Exponential', 'loss_name': 'NLLLoss'}. Best is trial 22 with value: 0.8433318468070169.[0m
[32m[I 2022-04-22 10:44:23,603][0m Trial 449 finished with value: 0.4267241924146745 and parameters: {'n_hidden': 512, 'mixture_components': 5, 'use_sparse_layer': False, 'use_batchnorm': True, 'use_dropout': False, 'mlp_size_1': 1, 'mlp_size_2': 5, 'mlp_size_3': 0, 'kernel': 'Logistic', 'loss_name': 'NLLLoss'}. Best is trial 22 with value: 0.8433318468070169.[0m
[32m[I 2022-04-22 10:45:20,106][0m Trial 450 finished with value: -0.23379044493702522 and parameters: {'n_hidden': 32, 'mixture_components': 5, 'use_sparse_layer': False, 'use_batchnorm': True, 'use_dropout': True, 'dropout': 0.5834492942389935, 'mlp_size_1': 0, 'mlp_size_2': 2, 'mlp_size_3': 0, 'kernel': 'Exponential', 'loss_name': 'AlternativeNLLLoss'}. Best is trial 22 with value: 0.8433318468070169.[0m
[32m[I 2022-04-22 10:47:19,630][0m Trial 451 finished with value: 0.833919242572789 and parameters: {'n_hidden': 512, 'mixture_components': 7, 'use_sparse_layer': False, 'use_batchnorm': True, 'use_dropout': True, 'dropout': 0.6876521795045863, 'mlp_size_1': 1, 'mlp_size_2': 5, 'mlp_size_3': 0, 'kernel': 'Exponential', 'loss_name': 'NLLLoss'}. Best is trial 22 with value: 0.8433318468070169.[0m
[32m[I 2022-04-22 10:47:55,978][0m Trial 452 finished with value: -0.5 and parameters: {'n_hidden': 128, 'mixture_components': 5, 'use_sparse_layer': False, 'use_batchnorm': True, 'use_dropout': True, 'dropout': 0.6422843926342539, 'mlp_size_1': 1, 'mlp_size_2': 3, 'mlp_size_3': 0, 'kernel': 'Gumbel', 'loss_name': 'NLLLoss'}. Best is trial 22 with value: 0.8433318468070169.[0m
[32m[I 2022-04-22 10:50:09,783][0m Trial 453 finished with value: 0.8289368261733226 and parameters: {'n_hidden': 1024, 'mixture_components': 5, 'use_sparse_layer': False, 'use_batchnorm': True, 'use_dropout': True, 'dropout': 0.524396230681682, 'mlp_size_1': 2, 'mlp_size_2': 5, 'mlp_size_3': 0, 'kernel': 'Exponential', 'loss_name': 'NLLLoss'}. Best is trial 22 with value: 0.8433318468070169.[0m
[32m[I 2022-04-22 10:52:13,749][0m Trial 454 finished with value: 0.40567007639236613 and parameters: {'n_hidden': 512, 'mixture_components': 6, 'use_sparse_layer': False, 'use_batchnorm': True, 'use_dropout': False, 'mlp_size_1': 1, 'mlp_size_2': 5, 'mlp_size_3': 0, 'kernel': 'Logistic', 'loss_name': 'NLLLoss'}. Best is trial 22 with value: 0.8433318468070169.[0m
[32m[I 2022-04-22 10:54:35,599][0m Trial 455 finished with value: 0.7322609679756801 and parameters: {'n_hidden': 512, 'mixture_components': 5, 'use_sparse_layer': False, 'use_batchnorm': True, 'use_dropout': True, 'dropout': 0.7117789116079116, 'mlp_size_1': 1, 'mlp_size_2': 5, 'mlp_size_3': 0, 'kernel': 'LogLogistic', 'loss_name': 'NLLLoss'}. Best is trial 22 with value: 0.8433318468070169.[0m
[32m[I 2022-04-22 10:56:40,389][0m Trial 456 finished with value: 0.8303231965583329 and parameters: {'n_hidden': 512, 'mixture_components': 5, 'use_sparse_layer': False, 'use_batchnorm': True, 'use_dropout': True, 'dropout': 0.622552753614471, 'mlp_size_1': 1, 'mlp_size_2': 5, 'mlp_size_3': 0, 'kernel': 'Exponential', 'loss_name': 'NLLLoss'}. Best is trial 22 with value: 0.8433318468070169.[0m
[32m[I 2022-04-22 10:58:46,046][0m Trial 457 finished with value: 0.8316318778605847 and parameters: {'n_hidden': 128, 'mixture_components': 6, 'use_sparse_layer': True, 'use_sparse_loss': True, 'lmbd': 0.00018719060706083783, 'use_batchnorm': True, 'use_dropout': True, 'dropout': 0.6581352819279482, 'mlp_size_1': 1, 'mlp_size_2': 3, 'mlp_size_3': 0, 'kernel': 'Exponential', 'loss_name': 'NLLLoss'}. Best is trial 22 with value: 0.8433318468070169.[0m
[32m[I 2022-04-22 11:01:01,227][0m Trial 458 finished with value: 0.8316341496495385 and parameters: {'n_hidden': 64, 'mixture_components': 5, 'use_sparse_layer': True, 'use_sparse_loss': True, 'lmbd': 0.010073190203849846, 'use_batchnorm': True, 'use_dropout': True, 'dropout': 0.608989360130001, 'mlp_size_1': 1, 'mlp_size_2': 2, 'mlp_size_3': 0, 'kernel': 'Exponential', 'loss_name': 'NLLLoss'}. Best is trial 22 with value: 0.8433318468070169.[0m
[32m[I 2022-04-22 11:02:57,679][0m Trial 459 finished with value: 0.8313180517042754 and parameters: {'n_hidden': 512, 'mixture_components': 5, 'use_sparse_layer': False, 'use_batchnorm': True, 'use_dropout': False, 'mlp_size_1': 0, 'mlp_size_2': 6, 'mlp_size_3': 0, 'kernel': 'Exponential', 'loss_name': 'NLLLoss'}. Best is trial 22 with value: 0.8433318468070169.[0m
[32m[I 2022-04-22 11:05:26,342][0m Trial 460 finished with value: 0.521120030154036 and parameters: {'n_hidden': 512, 'mixture_components': 1, 'use_sparse_layer': True, 'use_sparse_loss': True, 'lmbd': 0.00048664324015929174, 'use_batchnorm': True, 'use_dropout': True, 'dropout': 0.5689307680306152, 'mlp_size_1': 5, 'mlp_size_2': 1, 'mlp_size_3': 0, 'kernel': 'Exponential', 'loss_name': 'NLLLoss'}. Best is trial 22 with value: 0.8433318468070169.[0m
[32m[I 2022-04-22 11:08:43,038][0m Trial 461 finished with value: 0.7292657014173465 and parameters: {'n_hidden': 1024, 'mixture_components': 2, 'use_sparse_layer': True, 'use_sparse_loss': True, 'lmbd': 0.0009547965998435045, 'use_batchnorm': True, 'use_dropout': True, 'dropout': 0.7743665025504682, 'mlp_size_1': 1, 'mlp_size_2': 6, 'mlp_size_3': 0, 'kernel': 'Logistic', 'loss_name': 'NLLLoss'}. Best is trial 22 with value: 0.8433318468070169.[0m
[32m[I 2022-04-22 11:10:56,622][0m Trial 462 finished with value: 0.834976034585585 and parameters: {'n_hidden': 512, 'mixture_components': 6, 'use_sparse_layer': True, 'use_sparse_loss': True, 'lmbd': 2.9930833250253494e-05, 'use_batchnorm': True, 'use_dropout': True, 'dropout': 0.7407571624664374, 'mlp_size_1': 0, 'mlp_size_2': 6, 'mlp_size_3': 0, 'kernel': 'Exponential', 'loss_name': 'NLLLoss'}. Best is trial 22 with value: 0.8433318468070169.[0m
[32m[I 2022-04-22 11:12:58,782][0m Trial 463 finished with value: 0.8345171653707923 and parameters: {'n_hidden': 128, 'mixture_components': 4, 'use_sparse_layer': True, 'use_sparse_loss': False, 'use_batchnorm': True, 'use_dropout': True, 'dropout': 0.6413083949488398, 'mlp_size_1': 0, 'mlp_size_2': 4, 'mlp_size_3': 0, 'kernel': 'Exponential', 'loss_name': 'NLLLoss'}. Best is trial 22 with value: 0.8433318468070169.[0m
[32m[I 2022-04-22 11:15:01,758][0m Trial 464 finished with value: 0.8330453938522258 and parameters: {'n_hidden': 512, 'mixture_components': 5, 'use_sparse_layer': False, 'use_batchnorm': True, 'use_dropout': False, 'mlp_size_1': 0, 'mlp_size_2': 6, 'mlp_size_3': 0, 'kernel': 'Exponential', 'loss_name': 'NLLLoss'}. Best is trial 22 with value: 0.8433318468070169.[0m
[32m[I 2022-04-22 11:15:58,398][0m Trial 465 finished with value: 0.8236835268639984 and parameters: {'n_hidden': 512, 'mixture_components': 5, 'use_sparse_layer': True, 'use_sparse_loss': True, 'lmbd': 1.3965209309423904e-06, 'use_batchnorm': False, 'use_dropout': True, 'dropout': 0.5050514722070532, 'mlp_size_1': 1, 'mlp_size_2': 5, 'mlp_size_3': 0, 'kernel': 'LogLogistic', 'loss_name': 'NLLLoss'}. Best is trial 22 with value: 0.8433318468070169.[0m
[32m[I 2022-04-22 11:18:24,921][0m Trial 466 finished with value: 0.8346848639224508 and parameters: {'n_hidden': 2048, 'mixture_components': 6, 'use_sparse_layer': True, 'use_sparse_loss': False, 'use_batchnorm': True, 'use_dropout': True, 'dropout': 0.6746732592956812, 'mlp_size_1': 2, 'mlp_size_2': 6, 'mlp_size_3': 0, 'kernel': 'Exponential', 'loss_name': 'NLLLoss'}. Best is trial 22 with value: 0.8433318468070169.[0m
[32m[I 2022-04-22 11:20:40,599][0m Trial 467 finished with value: 0.820347752537875 and parameters: {'n_hidden': 128, 'mixture_components': 7, 'use_sparse_layer': True, 'use_sparse_loss': False, 'use_batchnorm': True, 'use_dropout': True, 'dropout': 0.589071278358214, 'mlp_size_1': 0, 'mlp_size_2': 4, 'mlp_size_3': 0, 'kernel': 'Logistic', 'loss_name': 'NLLLoss'}. Best is trial 22 with value: 0.8433318468070169.[0m
[32m[I 2022-04-22 11:22:09,161][0m Trial 468 finished with value: 0.8192968228495484 and parameters: {'n_hidden': 32, 'mixture_components': 5, 'use_sparse_layer': True, 'use_sparse_loss': True, 'lmbd': 0.00032381026442624127, 'use_batchnorm': False, 'use_dropout': True, 'dropout': 0.5390123339880878, 'mlp_size_1': 0, 'mlp_size_2': 2, 'mlp_size_3': 0, 'kernel': 'Exponential', 'loss_name': 'NLLLoss'}. Best is trial 22 with value: 0.8433318468070169.[0m
