[32m[I 2022-04-23 05:19:04,865][0m Trial 906 finished with value: 0.6836660540173591 and parameters: {'n_hidden': 1024, 'mixture_components': 9, 'use_sparse_layer': False, 'use_batchnorm': False, 'use_dropout': False, 'mlp_size_1': 6, 'mlp_size_2': 0, 'mlp_size_3': 1, 'kernel': 'Gumbel', 'loss_name': 'NLLLoss'}. Best is trial 761 with value: 0.7068620691332198.[0m
[32m[I 2022-04-23 05:19:50,285][0m Trial 907 finished with value: 0.6794777716265353 and parameters: {'n_hidden': 1024, 'mixture_components': 8, 'use_sparse_layer': False, 'use_batchnorm': False, 'use_dropout': False, 'mlp_size_1': 6, 'mlp_size_2': 0, 'mlp_size_3': 1, 'kernel': 'Logistic', 'loss_name': 'NLLLoss'}. Best is trial 761 with value: 0.7068620691332198.[0m
[32m[I 2022-04-23 05:20:31,779][0m Trial 908 finished with value: 0.6932319478827863 and parameters: {'n_hidden': 1024, 'mixture_components': 9, 'use_sparse_layer': False, 'use_batchnorm': False, 'use_dropout': False, 'mlp_size_1': 6, 'mlp_size_2': 0, 'mlp_size_3': 1, 'kernel': 'Logistic', 'loss_name': 'NLLLoss'}. Best is trial 761 with value: 0.7068620691332198.[0m
[32m[I 2022-04-23 05:21:46,329][0m Trial 909 finished with value: 0.6705240597597841 and parameters: {'n_hidden': 1024, 'mixture_components': 8, 'use_sparse_layer': False, 'use_batchnorm': False, 'use_dropout': False, 'mlp_size_1': 6, 'mlp_size_2': 0, 'mlp_size_3': 1, 'kernel': 'Normal', 'loss_name': 'CensoredNLLLoss'}. Best is trial 761 with value: 0.7068620691332198.[0m
[32m[I 2022-04-23 05:22:47,274][0m Trial 910 finished with value: 0.6325768346188145 and parameters: {'n_hidden': 2048, 'mixture_components': 1, 'use_sparse_layer': False, 'use_batchnorm': False, 'use_dropout': True, 'dropout': 0.20558418718576316, 'mlp_size_1': 8, 'mlp_size_2': 0, 'mlp_size_3': 0, 'kernel': 'Logistic', 'loss_name': 'NLLLoss'}. Best is trial 761 with value: 0.7068620691332198.[0m
[32m[I 2022-04-23 05:23:33,335][0m Trial 911 finished with value: 0.6706832375950579 and parameters: {'n_hidden': 128, 'mixture_components': 8, 'use_sparse_layer': False, 'use_batchnorm': False, 'use_dropout': False, 'mlp_size_1': 4, 'mlp_size_2': 0, 'mlp_size_3': 0, 'kernel': 'Gumbel', 'loss_name': 'NLLLoss'}. Best is trial 761 with value: 0.7068620691332198.[0m
[32m[I 2022-04-23 05:24:07,384][0m Trial 912 finished with value: 0.6765854028524896 and parameters: {'n_hidden': 1024, 'mixture_components': 9, 'use_sparse_layer': False, 'use_batchnorm': False, 'use_dropout': False, 'mlp_size_1': 6, 'mlp_size_2': 0, 'mlp_size_3': 1, 'kernel': 'Exponential', 'loss_name': 'NLLLoss'}. Best is trial 761 with value: 0.7068620691332198.[0m
[32m[I 2022-04-23 05:24:44,106][0m Trial 913 finished with value: 0.6948118537609334 and parameters: {'n_hidden': 1024, 'mixture_components': 6, 'use_sparse_layer': False, 'use_batchnorm': False, 'use_dropout': False, 'mlp_size_1': 6, 'mlp_size_2': 0, 'mlp_size_3': 1, 'kernel': 'LogLogistic', 'loss_name': 'NLLLoss'}. Best is trial 761 with value: 0.7068620691332198.[0m
[32m[I 2022-04-23 05:26:59,499][0m Trial 914 finished with value: 0.654109428008631 and parameters: {'n_hidden': 64, 'mixture_components': 8, 'use_sparse_layer': False, 'use_batchnorm': True, 'use_dropout': False, 'mlp_size_1': 3, 'mlp_size_2': 0, 'mlp_size_3': 0, 'kernel': 'Normal', 'loss_name': 'CensoredNLLLoss'}. Best is trial 761 with value: 0.7068620691332198.[0m
[32m[I 2022-04-23 05:27:49,926][0m Trial 915 finished with value: 0.6784225719902073 and parameters: {'n_hidden': 1024, 'mixture_components': 7, 'use_sparse_layer': False, 'use_batchnorm': False, 'use_dropout': False, 'mlp_size_1': 7, 'mlp_size_2': 0, 'mlp_size_3': 0, 'kernel': 'Logistic', 'loss_name': 'NLLLoss'}. Best is trial 761 with value: 0.7068620691332198.[0m
[32m[I 2022-04-23 05:28:36,894][0m Trial 916 finished with value: 0.672265196436103 and parameters: {'n_hidden': 1024, 'mixture_components': 8, 'use_sparse_layer': False, 'use_batchnorm': False, 'use_dropout': False, 'mlp_size_1': 6, 'mlp_size_2': 0, 'mlp_size_3': 1, 'kernel': 'Logistic', 'loss_name': 'NLLLoss'}. Best is trial 761 with value: 0.7068620691332198.[0m
[32m[I 2022-04-23 05:29:17,478][0m Trial 917 finished with value: 0.6138564441876553 and parameters: {'n_hidden': 256, 'mixture_components': 8, 'use_sparse_layer': False, 'use_batchnorm': False, 'use_dropout': False, 'mlp_size_1': 5, 'mlp_size_2': 0, 'mlp_size_3': 0, 'kernel': 'Gumbel', 'loss_name': 'NLLLoss'}. Best is trial 761 with value: 0.7068620691332198.[0m
[32m[I 2022-04-23 05:30:13,075][0m Trial 918 finished with value: 0.6717151030823544 and parameters: {'n_hidden': 1024, 'mixture_components': 9, 'use_sparse_layer': False, 'use_batchnorm': False, 'use_dropout': False, 'mlp_size_1': 6, 'mlp_size_2': 0, 'mlp_size_3': 1, 'kernel': 'Normal', 'loss_name': 'CensoredNLLLoss'}. Best is trial 761 with value: 0.7068620691332198.[0m
[32m[I 2022-04-23 05:30:55,983][0m Trial 919 finished with value: 0.6600656582687563 and parameters: {'n_hidden': 1024, 'mixture_components': 6, 'use_sparse_layer': False, 'use_batchnorm': False, 'use_dropout': False, 'mlp_size_1': 6, 'mlp_size_2': 0, 'mlp_size_3': 1, 'kernel': 'Logistic', 'loss_name': 'NLLLoss'}. Best is trial 761 with value: 0.7068620691332198.[0m
[32m[I 2022-04-23 05:31:48,218][0m Trial 920 finished with value: 0.6941848278125786 and parameters: {'n_hidden': 1024, 'mixture_components': 8, 'use_sparse_layer': False, 'use_batchnorm': False, 'use_dropout': False, 'mlp_size_1': 7, 'mlp_size_2': 0, 'mlp_size_3': 0, 'kernel': 'Logistic', 'loss_name': 'NLLLoss'}. Best is trial 761 with value: 0.7068620691332198.[0m
[32m[I 2022-04-23 05:32:33,727][0m Trial 921 finished with value: 0.6740344646146068 and parameters: {'n_hidden': 1024, 'mixture_components': 8, 'use_sparse_layer': False, 'use_batchnorm': False, 'use_dropout': False, 'mlp_size_1': 6, 'mlp_size_2': 0, 'mlp_size_3': 1, 'kernel': 'Gumbel', 'loss_name': 'NLLLoss'}. Best is trial 761 with value: 0.7068620691332198.[0m
[32m[I 2022-04-23 05:33:55,721][0m Trial 922 finished with value: 0.6631779469791671 and parameters: {'n_hidden': 2048, 'mixture_components': 7, 'use_sparse_layer': False, 'use_batchnorm': False, 'use_dropout': False, 'mlp_size_1': 8, 'mlp_size_2': 0, 'mlp_size_3': 0, 'kernel': 'Normal', 'loss_name': 'AlternativeNLLLoss'}. Best is trial 761 with value: 0.7068620691332198.[0m
[32m[I 2022-04-23 05:34:41,872][0m Trial 923 finished with value: 0.6796970325572199 and parameters: {'n_hidden': 1024, 'mixture_components': 1, 'use_sparse_layer': False, 'use_batchnorm': False, 'use_dropout': False, 'mlp_size_1': 6, 'mlp_size_2': 0, 'mlp_size_3': 1, 'kernel': 'Logistic', 'loss_name': 'NLLLoss'}. Best is trial 761 with value: 0.7068620691332198.[0m
[32m[I 2022-04-23 05:35:24,601][0m Trial 924 finished with value: 0.6748245858741762 and parameters: {'n_hidden': 1024, 'mixture_components': 9, 'use_sparse_layer': False, 'use_batchnorm': False, 'use_dropout': False, 'mlp_size_1': 6, 'mlp_size_2': 0, 'mlp_size_3': 1, 'kernel': 'Logistic', 'loss_name': 'CensoredNLLLoss'}. Best is trial 761 with value: 0.7068620691332198.[0m
[32m[I 2022-04-23 05:36:13,807][0m Trial 925 finished with value: 0.6835548453442314 and parameters: {'n_hidden': 1024, 'mixture_components': 8, 'use_sparse_layer': False, 'use_batchnorm': False, 'use_dropout': False, 'mlp_size_1': 6, 'mlp_size_2': 0, 'mlp_size_3': 1, 'kernel': 'Normal', 'loss_name': 'NLLLoss'}. Best is trial 761 with value: 0.7068620691332198.[0m
[32m[I 2022-04-23 05:36:53,784][0m Trial 926 finished with value: 0.5715575015890719 and parameters: {'n_hidden': 1024, 'mixture_components': 8, 'use_sparse_layer': False, 'use_batchnorm': False, 'use_dropout': False, 'mlp_size_1': 6, 'mlp_size_2': 0, 'mlp_size_3': 1, 'kernel': 'Logistic', 'loss_name': 'AlternativeNLLLoss'}. Best is trial 761 with value: 0.7068620691332198.[0m
[32m[I 2022-04-23 05:37:24,659][0m Trial 927 finished with value: 0.6772189257837508 and parameters: {'n_hidden': 1024, 'mixture_components': 5, 'use_sparse_layer': False, 'use_batchnorm': False, 'use_dropout': False, 'mlp_size_1': 6, 'mlp_size_2': 0, 'mlp_size_3': 1, 'kernel': 'Gumbel', 'loss_name': 'NLLLoss'}. Best is trial 761 with value: 0.7068620691332198.[0m
[32m[I 2022-04-23 05:38:17,239][0m Trial 928 finished with value: 0.6763773736851689 and parameters: {'n_hidden': 32, 'mixture_components': 9, 'use_sparse_layer': False, 'use_batchnorm': False, 'use_dropout': False, 'mlp_size_1': 2, 'mlp_size_2': 0, 'mlp_size_3': 0, 'kernel': 'Logistic', 'loss_name': 'AlternativeNLLLoss'}. Best is trial 761 with value: 0.7068620691332198.[0m
[32m[I 2022-04-23 05:38:58,947][0m Trial 929 finished with value: 0.5028844174809249 and parameters: {'n_hidden': 1024, 'mixture_components': 7, 'use_sparse_layer': False, 'use_batchnorm': False, 'use_dropout': True, 'dropout': 0.8990119262077062, 'mlp_size_1': 7, 'mlp_size_2': 0, 'mlp_size_3': 0, 'kernel': 'LogLogistic', 'loss_name': 'NLLLoss'}. Best is trial 761 with value: 0.7068620691332198.[0m
[32m[I 2022-04-23 05:39:49,119][0m Trial 930 finished with value: 0.6647533242862256 and parameters: {'n_hidden': 1024, 'mixture_components': 8, 'use_sparse_layer': False, 'use_batchnorm': False, 'use_dropout': False, 'mlp_size_1': 6, 'mlp_size_2': 0, 'mlp_size_3': 1, 'kernel': 'Normal', 'loss_name': 'NLLLoss'}. Best is trial 761 with value: 0.7068620691332198.[0m
[32m[I 2022-04-23 05:40:52,014][0m Trial 931 finished with value: 0.6886123075947481 and parameters: {'n_hidden': 1024, 'mixture_components': 8, 'use_sparse_layer': False, 'use_batchnorm': False, 'use_dropout': False, 'mlp_size_1': 6, 'mlp_size_2': 0, 'mlp_size_3': 1, 'kernel': 'Logistic', 'loss_name': 'CensoredNLLLoss'}. Best is trial 761 with value: 0.7068620691332198.[0m
[32m[I 2022-04-23 05:41:39,656][0m Trial 932 finished with value: 0.6092042073758629 and parameters: {'n_hidden': 2048, 'mixture_components': 8, 'use_sparse_layer': False, 'use_batchnorm': False, 'use_dropout': False, 'mlp_size_1': 8, 'mlp_size_2': 0, 'mlp_size_3': 0, 'kernel': 'Gumbel', 'loss_name': 'AlternativeNLLLoss'}. Best is trial 761 with value: 0.7068620691332198.[0m
[32m[I 2022-04-23 05:43:39,518][0m Trial 933 finished with value: 0.6767492241169412 and parameters: {'n_hidden': 1024, 'mixture_components': 6, 'use_sparse_layer': False, 'use_batchnorm': True, 'use_dropout': False, 'mlp_size_1': 6, 'mlp_size_2': 0, 'mlp_size_3': 1, 'kernel': 'Logistic', 'loss_name': 'NLLLoss'}. Best is trial 761 with value: 0.7068620691332198.[0m
[32m[I 2022-04-23 05:44:25,490][0m Trial 934 finished with value: 0.6537561970446919 and parameters: {'n_hidden': 1024, 'mixture_components': 9, 'use_sparse_layer': False, 'use_batchnorm': False, 'use_dropout': False, 'mlp_size_1': 6, 'mlp_size_2': 0, 'mlp_size_3': 1, 'kernel': 'Normal', 'loss_name': 'AlternativeNLLLoss'}. Best is trial 761 with value: 0.7068620691332198.[0m
[32m[I 2022-04-23 05:45:03,926][0m Trial 935 finished with value: 0.6838048139148334 and parameters: {'n_hidden': 1024, 'mixture_components': 1, 'use_sparse_layer': False, 'use_batchnorm': False, 'use_dropout': False, 'mlp_size_1': 5, 'mlp_size_2': 2, 'mlp_size_3': 0, 'kernel': 'Logistic', 'loss_name': 'NLLLoss'}. Best is trial 761 with value: 0.7068620691332198.[0m
[32m[I 2022-04-23 05:45:43,952][0m Trial 936 finished with value: 0.6720551351396606 and parameters: {'n_hidden': 1024, 'mixture_components': 8, 'use_sparse_layer': False, 'use_batchnorm': False, 'use_dropout': False, 'mlp_size_1': 6, 'mlp_size_2': 0, 'mlp_size_3': 1, 'kernel': 'Gumbel', 'loss_name': 'NLLLoss'}. Best is trial 761 with value: 0.7068620691332198.[0m
[32m[I 2022-04-23 05:46:37,025][0m Trial 937 finished with value: 0.6919568515025138 and parameters: {'n_hidden': 1024, 'mixture_components': 7, 'use_sparse_layer': False, 'use_batchnorm': False, 'use_dropout': False, 'mlp_size_1': 7, 'mlp_size_2': 0, 'mlp_size_3': 0, 'kernel': 'Logistic', 'loss_name': 'AlternativeNLLLoss'}. Best is trial 761 with value: 0.7068620691332198.[0m
[32m[I 2022-04-23 05:47:37,410][0m Trial 938 finished with value: 0.6731799788488795 and parameters: {'n_hidden': 1024, 'mixture_components': 8, 'use_sparse_layer': False, 'use_batchnorm': False, 'use_dropout': False, 'mlp_size_1': 6, 'mlp_size_2': 0, 'mlp_size_3': 1, 'kernel': 'Normal', 'loss_name': 'CensoredNLLLoss'}. Best is trial 761 with value: 0.7068620691332198.[0m
[32m[I 2022-04-23 05:48:23,134][0m Trial 939 finished with value: 0.685774823953115 and parameters: {'n_hidden': 128, 'mixture_components': 9, 'use_sparse_layer': False, 'use_batchnorm': False, 'use_dropout': False, 'mlp_size_1': 4, 'mlp_size_2': 0, 'mlp_size_3': 0, 'kernel': 'Logistic', 'loss_name': 'NLLLoss'}. Best is trial 761 with value: 0.7068620691332198.[0m
[32m[I 2022-04-23 05:49:02,225][0m Trial 940 finished with value: 0.6792087586802559 and parameters: {'n_hidden': 1024, 'mixture_components': 8, 'use_sparse_layer': False, 'use_batchnorm': False, 'use_dropout': False, 'mlp_size_1': 6, 'mlp_size_2': 0, 'mlp_size_3': 1, 'kernel': 'Exponential', 'loss_name': 'NLLLoss'}. Best is trial 761 with value: 0.7068620691332198.[0m
[32m[I 2022-04-23 05:50:32,279][0m Trial 941 finished with value: 0.6786536790670785 and parameters: {'n_hidden': 2048, 'mixture_components': 9, 'use_sparse_layer': False, 'use_batchnorm': False, 'use_dropout': False, 'mlp_size_1': 8, 'mlp_size_2': 0, 'mlp_size_3': 0, 'kernel': 'Gumbel', 'loss_name': 'AlternativeNLLLoss'}. Best is trial 761 with value: 0.7068620691332198.[0m
[32m[I 2022-04-23 05:51:22,242][0m Trial 942 finished with value: 0.6749762073060188 and parameters: {'n_hidden': 64, 'mixture_components': 6, 'use_sparse_layer': False, 'use_batchnorm': False, 'use_dropout': False, 'mlp_size_1': 3, 'mlp_size_2': 0, 'mlp_size_3': 0, 'kernel': 'LogLogistic', 'loss_name': 'NLLLoss'}. Best is trial 761 with value: 0.7068620691332198.[0m
[32m[I 2022-04-23 05:52:24,197][0m Trial 943 finished with value: 0.684487998554915 and parameters: {'n_hidden': 1024, 'mixture_components': 8, 'use_sparse_layer': False, 'use_batchnorm': False, 'use_dropout': False, 'mlp_size_1': 6, 'mlp_size_2': 0, 'mlp_size_3': 1, 'kernel': 'Logistic', 'loss_name': 'AlternativeNLLLoss'}. Best is trial 761 with value: 0.7068620691332198.[0m
[32m[I 2022-04-23 05:53:14,156][0m Trial 944 finished with value: 0.6774256697864273 and parameters: {'n_hidden': 1024, 'mixture_components': 9, 'use_sparse_layer': False, 'use_batchnorm': False, 'use_dropout': False, 'mlp_size_1': 6, 'mlp_size_2': 0, 'mlp_size_3': 1, 'kernel': 'Normal', 'loss_name': 'NLLLoss'}. Best is trial 761 with value: 0.7068620691332198.[0m
[32m[I 2022-04-23 05:54:05,168][0m Trial 945 finished with value: 0.670741386748817 and parameters: {'n_hidden': 256, 'mixture_components': 7, 'use_sparse_layer': False, 'use_batchnorm': False, 'use_dropout': False, 'mlp_size_1': 5, 'mlp_size_2': 0, 'mlp_size_3': 0, 'kernel': 'Logistic', 'loss_name': 'CensoredNLLLoss'}. Best is trial 761 with value: 0.7068620691332198.[0m
[32m[I 2022-04-23 05:54:56,231][0m Trial 946 finished with value: 0.6830827402246232 and parameters: {'n_hidden': 1024, 'mixture_components': 8, 'use_sparse_layer': False, 'use_batchnorm': False, 'use_dropout': False, 'mlp_size_1': 6, 'mlp_size_2': 0, 'mlp_size_3': 1, 'kernel': 'Logistic', 'loss_name': 'NLLLoss'}. Best is trial 761 with value: 0.7068620691332198.[0m
[32m[I 2022-04-23 05:55:44,004][0m Trial 947 finished with value: 0.6723630508450431 and parameters: {'n_hidden': 1024, 'mixture_components': 8, 'use_sparse_layer': False, 'use_batchnorm': False, 'use_dropout': True, 'dropout': 0.28710363727480703, 'mlp_size_1': 6, 'mlp_size_2': 0, 'mlp_size_3': 1, 'kernel': 'Gumbel', 'loss_name': 'AlternativeNLLLoss'}. Best is trial 761 with value: 0.7068620691332198.[0m
[32m[I 2022-04-23 05:56:26,466][0m Trial 948 finished with value: 0.6917736006279922 and parameters: {'n_hidden': 1024, 'mixture_components': 5, 'use_sparse_layer': False, 'use_batchnorm': False, 'use_dropout': False, 'mlp_size_1': 7, 'mlp_size_2': 0, 'mlp_size_3': 0, 'kernel': 'Normal', 'loss_name': 'NLLLoss'}. Best is trial 761 with value: 0.7068620691332198.[0m
[32m[I 2022-04-23 05:57:31,808][0m Trial 949 finished with value: 0.6851739191820451 and parameters: {'n_hidden': 1024, 'mixture_components': 6, 'use_sparse_layer': False, 'use_batchnorm': False, 'use_dropout': False, 'mlp_size_1': 6, 'mlp_size_2': 0, 'mlp_size_3': 1, 'kernel': 'Logistic', 'loss_name': 'NLLLoss'}. Best is trial 761 with value: 0.7068620691332198.[0m
[32m[I 2022-04-23 05:58:33,717][0m Trial 950 finished with value: 0.6598991029820205 and parameters: {'n_hidden': 1024, 'mixture_components': 8, 'use_sparse_layer': False, 'use_batchnorm': False, 'use_dropout': False, 'mlp_size_1': 7, 'mlp_size_2': 0, 'mlp_size_3': 0, 'kernel': 'Logistic', 'loss_name': 'AlternativeNLLLoss'}. Best is trial 761 with value: 0.7068620691332198.[0m
[32m[I 2022-04-23 05:59:19,131][0m Trial 951 finished with value: 0.6682587496806286 and parameters: {'n_hidden': 1024, 'mixture_components': 8, 'use_sparse_layer': False, 'use_batchnorm': False, 'use_dropout': False, 'mlp_size_1': 6, 'mlp_size_2': 0, 'mlp_size_3': 1, 'kernel': 'Gumbel', 'loss_name': 'CensoredNLLLoss'}. Best is trial 761 with value: 0.7068620691332198.[0m
[32m[I 2022-04-23 06:01:03,612][0m Trial 952 finished with value: 0.5470857197017672 and parameters: {'n_hidden': 1024, 'mixture_components': 9, 'use_sparse_layer': False, 'use_batchnorm': True, 'use_dropout': False, 'mlp_size_1': 6, 'mlp_size_2': 0, 'mlp_size_3': 1, 'kernel': 'Normal', 'loss_name': 'NLLLoss'}. Best is trial 761 with value: 0.7068620691332198.[0m
[32m[I 2022-04-23 06:02:03,361][0m Trial 953 finished with value: 0.6855220906707368 and parameters: {'n_hidden': 1024, 'mixture_components': 8, 'use_sparse_layer': False, 'use_batchnorm': False, 'use_dropout': False, 'mlp_size_1': 6, 'mlp_size_2': 0, 'mlp_size_3': 1, 'kernel': 'Logistic', 'loss_name': 'AlternativeNLLLoss'}. Best is trial 761 with value: 0.7068620691332198.[0m
[32m[I 2022-04-23 06:02:49,502][0m Trial 954 finished with value: 0.6726906149681963 and parameters: {'n_hidden': 2048, 'mixture_components': 8, 'use_sparse_layer': False, 'use_batchnorm': False, 'use_dropout': False, 'mlp_size_1': 8, 'mlp_size_2': 0, 'mlp_size_3': 0, 'kernel': 'Logistic', 'loss_name': 'NLLLoss'}. Best is trial 761 with value: 0.7068620691332198.[0m
[32m[I 2022-04-23 06:03:34,434][0m Trial 955 finished with value: 0.6854660131760999 and parameters: {'n_hidden': 1024, 'mixture_components': 7, 'use_sparse_layer': False, 'use_batchnorm': False, 'use_dropout': False, 'mlp_size_1': 6, 'mlp_size_2': 0, 'mlp_size_3': 1, 'kernel': 'LogLogistic', 'loss_name': 'NLLLoss'}. Best is trial 761 with value: 0.7068620691332198.[0m
[32m[I 2022-04-23 06:04:32,094][0m Trial 956 finished with value: 0.65462692409482 and parameters: {'n_hidden': 32, 'mixture_components': 1, 'use_sparse_layer': False, 'use_batchnorm': False, 'use_dropout': False, 'mlp_size_1': 2, 'mlp_size_2': 0, 'mlp_size_3': 0, 'kernel': 'Normal', 'loss_name': 'AlternativeNLLLoss'}. Best is trial 761 with value: 0.7068620691332198.[0m
[32m[I 2022-04-23 06:05:11,199][0m Trial 957 finished with value: 0.6972694449543785 and parameters: {'n_hidden': 1024, 'mixture_components': 9, 'use_sparse_layer': False, 'use_batchnorm': False, 'use_dropout': False, 'mlp_size_1': 6, 'mlp_size_2': 0, 'mlp_size_3': 1, 'kernel': 'Gumbel', 'loss_name': 'NLLLoss'}. Best is trial 761 with value: 0.7068620691332198.[0m
[32m[I 2022-04-23 06:05:55,477][0m Trial 958 finished with value: 0.6757431547971056 and parameters: {'n_hidden': 1024, 'mixture_components': 9, 'use_sparse_layer': False, 'use_batchnorm': False, 'use_dropout': False, 'mlp_size_1': 6, 'mlp_size_2': 0, 'mlp_size_3': 1, 'kernel': 'Gumbel', 'loss_name': 'CensoredNLLLoss'}. Best is trial 761 with value: 0.7068620691332198.[0m
[32m[I 2022-04-23 06:06:30,432][0m Trial 959 finished with value: 0.6786866494774006 and parameters: {'n_hidden': 1024, 'mixture_components': 9, 'use_sparse_layer': False, 'use_batchnorm': False, 'use_dropout': False, 'mlp_size_1': 7, 'mlp_size_2': 0, 'mlp_size_3': 0, 'kernel': 'Gumbel', 'loss_name': 'NLLLoss'}. Best is trial 761 with value: 0.7068620691332198.[0m
[32m[I 2022-04-23 06:07:16,658][0m Trial 960 finished with value: 0.5996182537357986 and parameters: {'n_hidden': 1024, 'mixture_components': 9, 'use_sparse_layer': False, 'use_batchnorm': False, 'use_dropout': False, 'mlp_size_1': 6, 'mlp_size_2': 0, 'mlp_size_3': 1, 'kernel': 'Gumbel', 'loss_name': 'AlternativeNLLLoss'}. Best is trial 761 with value: 0.7068620691332198.[0m
[32m[I 2022-04-23 06:07:56,507][0m Trial 961 finished with value: 0.679976304736244 and parameters: {'n_hidden': 1024, 'mixture_components': 9, 'use_sparse_layer': False, 'use_batchnorm': False, 'use_dropout': False, 'mlp_size_1': 6, 'mlp_size_2': 0, 'mlp_size_3': 1, 'kernel': 'Gumbel', 'loss_name': 'NLLLoss'}. Best is trial 761 with value: 0.7068620691332198.[0m
[32m[I 2022-04-23 06:08:51,567][0m Trial 962 finished with value: 0.6709729812467355 and parameters: {'n_hidden': 2048, 'mixture_components': 9, 'use_sparse_layer': False, 'use_batchnorm': False, 'use_dropout': False, 'mlp_size_1': 8, 'mlp_size_2': 0, 'mlp_size_3': 0, 'kernel': 'Gumbel', 'loss_name': 'NLLLoss'}. Best is trial 761 with value: 0.7068620691332198.[0m
[32m[I 2022-04-23 06:09:35,414][0m Trial 963 finished with value: 0.6765633852145516 and parameters: {'n_hidden': 1024, 'mixture_components': 9, 'use_sparse_layer': False, 'use_batchnorm': False, 'use_dropout': False, 'mlp_size_1': 6, 'mlp_size_2': 0, 'mlp_size_3': 1, 'kernel': 'Gumbel', 'loss_name': 'AlternativeNLLLoss'}. Best is trial 761 with value: 0.7068620691332198.[0m
