[32m[I 2022-04-22 00:15:12,952][0m Trial 583 finished with value: 0.5 and parameters: {'loss': 'coxph', 'learning_rate': 2.1674388399363994e-05, 'n_estimators': 266, 'criterion': 'squared_error', 'min_samples_split': 8, 'min_samples_leaf': 10, 'min_weight_fraction_leaf': 0.20851346202551171, 'min_impurity_decrease': 0.0012814635144755525, 'max_features': 0.7270040778928116, 'subsample': 0.4555311462369604, 'dropout_rate': 0.608196026691326, 'ccp_alpha': 4.893146482766876}. Best is trial 187 with value: 0.6933481836305168.[0m
[32m[I 2022-04-22 00:15:25,924][0m Trial 584 finished with value: 0.6855996495794844 and parameters: {'loss': 'coxph', 'learning_rate': 7.421061377022541e-05, 'n_estimators': 283, 'criterion': 'squared_error', 'min_samples_split': 7, 'min_samples_leaf': 10, 'min_weight_fraction_leaf': 0.23919603447695, 'min_impurity_decrease': 0.04462657222027074, 'max_features': 0.8235257381705885, 'subsample': 0.37578615701950574, 'dropout_rate': 0.5489971533892675, 'ccp_alpha': 0.08739996044994246}. Best is trial 187 with value: 0.6933481836305168.[0m
[32m[I 2022-04-22 00:15:40,361][0m Trial 585 finished with value: 0.6636900948801576 and parameters: {'loss': 'coxph', 'learning_rate': 4.9821538944222586e-05, 'n_estimators': 300, 'criterion': 'squared_error', 'min_samples_split': 7, 'min_samples_leaf': 6, 'min_weight_fraction_leaf': 0.2221409039895098, 'min_impurity_decrease': 0.023745008559709634, 'max_features': 0.8333211747274727, 'subsample': 0.36526848709593984, 'dropout_rate': 0.5761911989871545, 'ccp_alpha': 0.299036921161776}. Best is trial 187 with value: 0.6933481836305168.[0m
[32m[I 2022-04-22 00:15:48,733][0m Trial 586 finished with value: 0.6645282883055869 and parameters: {'loss': 'coxph', 'learning_rate': 5.33898326769169e-05, 'n_estimators': 273, 'criterion': 'friedman_mse', 'min_samples_split': 7, 'min_samples_leaf': 10, 'min_weight_fraction_leaf': 0.2625703056529763, 'min_impurity_decrease': 0.049205538736888384, 'max_features': 0.8070339566176059, 'subsample': 0.34920243490998387, 'dropout_rate': 0.6472712137548723, 'ccp_alpha': 0.21603047409257667}. Best is trial 187 with value: 0.6933481836305168.[0m
/media/san2_ssd/data/Workdir/survival/venv/lib/python3.8/site-packages/sksurv/ensemble/boosting.py:955: RuntimeWarning: divide by zero encountered in log
  time = numpy.log(time)
/media/san2_ssd/data/Workdir/survival/venv/lib/python3.8/site-packages/sksurv/ensemble/boosting.py:955: RuntimeWarning: divide by zero encountered in log
  time = numpy.log(time)
/media/san2_ssd/data/Workdir/survival/venv/lib/python3.8/site-packages/sksurv/ensemble/boosting.py:955: RuntimeWarning: divide by zero encountered in log
  time = numpy.log(time)
/media/san2_ssd/data/Workdir/survival/venv/lib/python3.8/site-packages/sksurv/ensemble/boosting.py:955: RuntimeWarning: divide by zero encountered in log
  time = numpy.log(time)
[32m[I 2022-04-22 00:15:53,633][0m Trial 587 finished with value: -0.7291644505171984 and parameters: {'loss': 'squared', 'learning_rate': 3.4943717694617956e-05, 'n_estimators': 423, 'criterion': 'squared_error', 'min_samples_split': 7, 'min_samples_leaf': 10, 'min_weight_fraction_leaf': 0.21582370909117776, 'min_impurity_decrease': 0.026123603388212565, 'max_features': 0.8448092300324656, 'subsample': 0.33886265595526655, 'dropout_rate': 0.5156030295510151, 'ccp_alpha': 0.15060901362044668}. Best is trial 187 with value: 0.6933481836305168.[0m
[32m[I 2022-04-22 00:16:04,465][0m Trial 588 finished with value: 0.6896846010398776 and parameters: {'loss': 'coxph', 'learning_rate': 7.728633977844261e-05, 'n_estimators': 306, 'criterion': 'squared_error', 'min_samples_split': 7, 'min_samples_leaf': 10, 'min_weight_fraction_leaf': 0.23100339659864236, 'min_impurity_decrease': 0.045420334570850804, 'max_features': 0.8015414517138266, 'subsample': 0.3189405322461947, 'dropout_rate': 0.5690808625750982, 'ccp_alpha': 0.09519907506462864}. Best is trial 187 with value: 0.6933481836305168.[0m
[32m[I 2022-04-22 00:16:17,612][0m Trial 589 finished with value: 0.6655603017398313 and parameters: {'loss': 'coxph', 'learning_rate': 7.917610321054385e-05, 'n_estimators': 306, 'criterion': 'squared_error', 'min_samples_split': 7, 'min_samples_leaf': 10, 'min_weight_fraction_leaf': 0.24526287001056837, 'min_impurity_decrease': 0.042035160269348094, 'max_features': 0.8047835963164202, 'subsample': 0.3277782433983852, 'dropout_rate': 0.5587111790262396, 'ccp_alpha': 0.2674326565959608}. Best is trial 187 with value: 0.6933481836305168.[0m
[32m[I 2022-04-22 00:16:33,150][0m Trial 590 finished with value: 0.5656154668410782 and parameters: {'loss': 'coxph', 'learning_rate': 8.528584175679042e-05, 'n_estimators': 284, 'criterion': 'squared_error', 'min_samples_split': 7, 'min_samples_leaf': 10, 'min_weight_fraction_leaf': 0.23260747751032163, 'min_impurity_decrease': 0.5144180856439426, 'max_features': 0.7816623635318354, 'subsample': 0.31610680861777074, 'dropout_rate': 0.47616257146325475, 'ccp_alpha': 0.390576816133811}. Best is trial 187 with value: 0.6933481836305168.[0m
[32m[I 2022-04-22 00:16:46,668][0m Trial 591 finished with value: 0.6675744766386444 and parameters: {'loss': 'coxph', 'learning_rate': 6.422868379412492e-05, 'n_estimators': 307, 'criterion': 'squared_error', 'min_samples_split': 7, 'min_samples_leaf': 10, 'min_weight_fraction_leaf': 0.2379477157668975, 'min_impurity_decrease': 0.025298540319233183, 'max_features': 0.7616608174840478, 'subsample': 0.34735045892079075, 'dropout_rate': 0.5612800644159852, 'ccp_alpha': 0.17756481136910865}. Best is trial 187 with value: 0.6933481836305168.[0m
[32m[I 2022-04-22 00:16:56,590][0m Trial 592 finished with value: 0.686069293642819 and parameters: {'loss': 'coxph', 'learning_rate': 6.111505866740154e-05, 'n_estimators': 294, 'criterion': 'squared_error', 'min_samples_split': 7, 'min_samples_leaf': 10, 'min_weight_fraction_leaf': 0.2535889573981001, 'min_impurity_decrease': 0.04847490068756784, 'max_features': 0.7823134066172633, 'subsample': 0.30898715672836685, 'dropout_rate': 0.5978076391539818, 'ccp_alpha': 0.001898143942292943}. Best is trial 187 with value: 0.6933481836305168.[0m
[32m[I 2022-04-22 00:17:06,952][0m Trial 593 finished with value: 0.6636900948801576 and parameters: {'loss': 'coxph', 'learning_rate': 4.196381171943687e-05, 'n_estimators': 307, 'criterion': 'squared_error', 'min_samples_split': 7, 'min_samples_leaf': 10, 'min_weight_fraction_leaf': 0.3385475535393897, 'min_impurity_decrease': 0.0017546492374106671, 'max_features': 0.7954616641939525, 'subsample': 0.3311309191281132, 'dropout_rate': 0.6245170897821538, 'ccp_alpha': 0.2610044926017665}. Best is trial 187 with value: 0.6933481836305168.[0m
[32m[I 2022-04-22 00:17:21,629][0m Trial 594 finished with value: 0.6870228674517211 and parameters: {'loss': 'coxph', 'learning_rate': 9.463593278729515e-05, 'n_estimators': 291, 'criterion': 'squared_error', 'min_samples_split': 7, 'min_samples_leaf': 10, 'min_weight_fraction_leaf': 0.23007083480199253, 'min_impurity_decrease': 0.055405654890775716, 'max_features': 0.830714793631455, 'subsample': 0.3098740061372041, 'dropout_rate': 0.5835737396250238, 'ccp_alpha': 0.001464402736783707}. Best is trial 187 with value: 0.6933481836305168.[0m
[32m[I 2022-04-22 00:17:34,142][0m Trial 595 finished with value: 0.6838353231519413 and parameters: {'loss': 'coxph', 'learning_rate': 7.360856329228787e-05, 'n_estimators': 260, 'criterion': 'squared_error', 'min_samples_split': 7, 'min_samples_leaf': 10, 'min_weight_fraction_leaf': 0.2069344560366577, 'min_impurity_decrease': 0.028290305754983182, 'max_features': 0.8211944780710558, 'subsample': 0.37457836783946685, 'dropout_rate': 0.5366910323768358, 'ccp_alpha': 0.14633266625942037}. Best is trial 187 with value: 0.6933481836305168.[0m
[32m[I 2022-04-22 00:17:51,403][0m Trial 596 finished with value: 0.6882084312368011 and parameters: {'loss': 'coxph', 'learning_rate': 5.183007946141317e-05, 'n_estimators': 276, 'criterion': 'squared_error', 'min_samples_split': 7, 'min_samples_leaf': 10, 'min_weight_fraction_leaf': 0.22927474934562705, 'min_impurity_decrease': 0.0012406850207166715, 'max_features': 0.7904046382054044, 'subsample': 0.32856190134454966, 'dropout_rate': 0.5589948542468509, 'ccp_alpha': 0.08988188167972941}. Best is trial 187 with value: 0.6933481836305168.[0m
[32m[I 2022-04-22 00:18:03,905][0m Trial 597 finished with value: 0.6635807151369472 and parameters: {'loss': 'coxph', 'learning_rate': 8.62972805000162e-05, 'n_estimators': 318, 'criterion': 'squared_error', 'min_samples_split': 7, 'min_samples_leaf': 10, 'min_weight_fraction_leaf': 0.21932137033638377, 'min_impurity_decrease': 0.035416064186108945, 'max_features': 0.8431211866328598, 'subsample': 0.3033575552753231, 'dropout_rate': 0.6143402625172765, 'ccp_alpha': 0.31787696162109047}. Best is trial 187 with value: 0.6933481836305168.[0m
[32m[I 2022-04-22 00:18:29,881][0m Trial 598 finished with value: 0.5 and parameters: {'loss': 'coxph', 'learning_rate': 3.264091055057011e-05, 'n_estimators': 404, 'criterion': 'friedman_mse', 'min_samples_split': 7, 'min_samples_leaf': 10, 'min_weight_fraction_leaf': 0.2066153464145327, 'min_impurity_decrease': 0.058830901074020774, 'max_features': 0.8598279979779087, 'subsample': 0.4221316248357333, 'dropout_rate': 0.5648966536005063, 'ccp_alpha': 0.5177303965743618}. Best is trial 187 with value: 0.6933481836305168.[0m
[32m[I 2022-04-22 00:18:37,877][0m Trial 599 finished with value: 0.684549922021637 and parameters: {'loss': 'coxph', 'learning_rate': 6.408034509592918e-05, 'n_estimators': 297, 'criterion': 'squared_error', 'min_samples_split': 7, 'min_samples_leaf': 10, 'min_weight_fraction_leaf': 0.22488248562959812, 'min_impurity_decrease': 0.02831958299311725, 'max_features': 0.8121178515410563, 'subsample': 0.3453135182783265, 'dropout_rate': 0.6481091501234385, 'ccp_alpha': 0.15492382246492226}. Best is trial 187 with value: 0.6933481836305168.[0m
[32m[I 2022-04-22 00:18:53,649][0m Trial 600 finished with value: 0.6881827576354274 and parameters: {'loss': 'coxph', 'learning_rate': 4.546878711970938e-05, 'n_estimators': 309, 'criterion': 'squared_error', 'min_samples_split': 8, 'min_samples_leaf': 4, 'min_weight_fraction_leaf': 0.24324135085263157, 'min_impurity_decrease': 0.05564628758841838, 'max_features': 0.8531963041197478, 'subsample': 0.3179295123600563, 'dropout_rate': 0.5296841793850265, 'ccp_alpha': 0.0013031829671653061}. Best is trial 187 with value: 0.6933481836305168.[0m
[32m[I 2022-04-22 00:19:03,756][0m Trial 601 finished with value: 0.6682612790097882 and parameters: {'loss': 'coxph', 'learning_rate': 0.00010741328047254777, 'n_estimators': 323, 'criterion': 'squared_error', 'min_samples_split': 7, 'min_samples_leaf': 10, 'min_weight_fraction_leaf': 0.21453332199577865, 'min_impurity_decrease': 0.018428999743431037, 'max_features': 0.834690052056762, 'subsample': 0.2920038685648243, 'dropout_rate': 0.6019162542797096, 'ccp_alpha': 0.24596116525570538}. Best is trial 187 with value: 0.6933481836305168.[0m
[32m[I 2022-04-22 00:19:12,060][0m Trial 602 finished with value: 0.6834530118316563 and parameters: {'loss': 'coxph', 'learning_rate': 7.446836389108421e-05, 'n_estimators': 288, 'criterion': 'squared_error', 'min_samples_split': 7, 'min_samples_leaf': 10, 'min_weight_fraction_leaf': 0.20700666121415975, 'min_impurity_decrease': 0.04222270399954462, 'max_features': 0.47311059869290517, 'subsample': 0.35921644038592004, 'dropout_rate': 0.5988952669866956, 'ccp_alpha': 0.09273686687856807}. Best is trial 187 with value: 0.6933481836305168.[0m
[32m[I 2022-04-22 00:19:23,074][0m Trial 603 finished with value: 0.5 and parameters: {'loss': 'coxph', 'learning_rate': 2.515093433255831e-05, 'n_estimators': 273, 'criterion': 'squared_error', 'min_samples_split': 7, 'min_samples_leaf': 10, 'min_weight_fraction_leaf': 0.22100131188473962, 'min_impurity_decrease': 0.017667260390980644, 'max_features': 0.820816399687483, 'subsample': 0.31156032526159294, 'dropout_rate': 0.4973790097119165, 'ccp_alpha': 0.8818025676291271}. Best is trial 187 with value: 0.6933481836305168.[0m
[32m[I 2022-04-22 00:19:37,428][0m Trial 604 finished with value: 0.6849268239431039 and parameters: {'loss': 'coxph', 'learning_rate': 5.837040950294849e-05, 'n_estimators': 313, 'criterion': 'squared_error', 'min_samples_split': 7, 'min_samples_leaf': 7, 'min_weight_fraction_leaf': 0.19999902834167987, 'min_impurity_decrease': 0.04972748134511598, 'max_features': 0.772253752917862, 'subsample': 0.33391142508245614, 'dropout_rate': 0.5477347861088318, 'ccp_alpha': 0.16873583470854991}. Best is trial 187 with value: 0.6933481836305168.[0m
[32m[I 2022-04-22 00:19:47,805][0m Trial 605 finished with value: 0.6905958586786412 and parameters: {'loss': 'coxph', 'learning_rate': 3.938190700526371e-05, 'n_estimators': 296, 'criterion': 'squared_error', 'min_samples_split': 7, 'min_samples_leaf': 10, 'min_weight_fraction_leaf': 0.23397471099264547, 'min_impurity_decrease': 0.06831670048450147, 'max_features': 0.8616540998358218, 'subsample': 0.2795614413112758, 'dropout_rate': 0.5834342159945489, 'ccp_alpha': 0.08150998078801638}. Best is trial 187 with value: 0.6933481836305168.[0m
/media/san2_ssd/data/Workdir/survival/venv/lib/python3.8/site-packages/sksurv/ensemble/boosting.py:955: RuntimeWarning: divide by zero encountered in log
  time = numpy.log(time)
/media/san2_ssd/data/Workdir/survival/venv/lib/python3.8/site-packages/sksurv/ensemble/boosting.py:955: RuntimeWarning: divide by zero encountered in log
  time = numpy.log(time)
/media/san2_ssd/data/Workdir/survival/venv/lib/python3.8/site-packages/sksurv/ensemble/boosting.py:955: RuntimeWarning: divide by zero encountered in log
  time = numpy.log(time)
/media/san2_ssd/data/Workdir/survival/venv/lib/python3.8/site-packages/sksurv/ensemble/boosting.py:955: RuntimeWarning: divide by zero encountered in log
  time = numpy.log(time)
[32m[I 2022-04-22 00:19:49,713][0m Trial 606 finished with value: -0.7297033464820903 and parameters: {'loss': 'squared', 'learning_rate': 1.6612746920386848e-05, 'n_estimators': 290, 'criterion': 'squared_error', 'min_samples_split': 7, 'min_samples_leaf': 1, 'min_weight_fraction_leaf': 0.21537559264329928, 'min_impurity_decrease': 0.07100625868578841, 'max_features': 0.8704608681796838, 'subsample': 0.29367286957075817, 'dropout_rate': 0.625569876332764, 'ccp_alpha': 0.08211928100921345}. Best is trial 187 with value: 0.6933481836305168.[0m
[32m[I 2022-04-22 00:19:59,128][0m Trial 607 finished with value: 0.671291915167831 and parameters: {'loss': 'coxph', 'learning_rate': 3.0410249999217784e-05, 'n_estimators': 301, 'criterion': 'squared_error', 'min_samples_split': 7, 'min_samples_leaf': 10, 'min_weight_fraction_leaf': 0.20789392887110236, 'min_impurity_decrease': 0.06518557826369537, 'max_features': 0.8004960164383879, 'subsample': 0.30651210884942426, 'dropout_rate': 0.5829043945817924, 'ccp_alpha': 0.21041945681171373}. Best is trial 187 with value: 0.6933481836305168.[0m
[32m[I 2022-04-22 00:20:07,507][0m Trial 608 finished with value: 0.686069293642819 and parameters: {'loss': 'coxph', 'learning_rate': 3.60181695986451e-05, 'n_estimators': 277, 'criterion': 'squared_error', 'min_samples_split': 7, 'min_samples_leaf': 10, 'min_weight_fraction_leaf': 0.23113262607104082, 'min_impurity_decrease': 0.06470127690145434, 'max_features': 0.2303582835894955, 'subsample': 0.3389312580724129, 'dropout_rate': 0.6070954184624979, 'ccp_alpha': 0.0017271924200613718}. Best is trial 187 with value: 0.6933481836305168.[0m
[32m[I 2022-04-22 00:20:19,794][0m Trial 609 finished with value: 0.5 and parameters: {'loss': 'coxph', 'learning_rate': 3.994853799535606e-05, 'n_estimators': 322, 'criterion': 'squared_error', 'min_samples_split': 7, 'min_samples_leaf': 10, 'min_weight_fraction_leaf': 0.20323800402080477, 'min_impurity_decrease': 0.07144836004919085, 'max_features': 0.7402812696983547, 'subsample': 0.285641441501823, 'dropout_rate': 0.5794427408203509, 'ccp_alpha': 1.8938207960973268}. Best is trial 187 with value: 0.6933481836305168.[0m
[32m[I 2022-04-22 00:20:28,851][0m Trial 610 finished with value: 0.6190439925035849 and parameters: {'loss': 'coxph', 'learning_rate': 4.7723877298747534e-05, 'n_estimators': 267, 'criterion': 'friedman_mse', 'min_samples_split': 7, 'min_samples_leaf': 10, 'min_weight_fraction_leaf': 0.2243899295847357, 'min_impurity_decrease': 0.0464187051688998, 'max_features': 0.8455073545788934, 'subsample': 0.3642426081939019, 'dropout_rate': 0.6116811625379508, 'ccp_alpha': 0.378077463395607}. Best is trial 187 with value: 0.6933481836305168.[0m
[32m[I 2022-04-22 00:20:56,442][0m Trial 611 finished with value: 0.6647221083144021 and parameters: {'loss': 'coxph', 'learning_rate': 2.6256021559896278e-05, 'n_estimators': 292, 'criterion': 'squared_error', 'min_samples_split': 8, 'min_samples_leaf': 10, 'min_weight_fraction_leaf': 0.2167774711157377, 'min_impurity_decrease': 0.06687077980430146, 'max_features': 0.8660497907281595, 'subsample': 0.3166009665187724, 'dropout_rate': 0.03351598759325139, 'ccp_alpha': 0.26147672567531166}. Best is trial 187 with value: 0.6933481836305168.[0m
[32m[I 2022-04-22 00:21:05,860][0m Trial 612 finished with value: 0.6825112152514765 and parameters: {'loss': 'coxph', 'learning_rate': 3.862535485346028e-05, 'n_estimators': 306, 'criterion': 'squared_error', 'min_samples_split': 7, 'min_samples_leaf': 10, 'min_weight_fraction_leaf': 0.24495953694860742, 'min_impurity_decrease': 0.04166698485474585, 'max_features': 0.8239411574867828, 'subsample': 0.3932418927323056, 'dropout_rate': 0.6431541629757921, 'ccp_alpha': 0.08703726782586868}. Best is trial 187 with value: 0.6933481836305168.[0m
[32m[I 2022-04-22 00:21:20,017][0m Trial 613 finished with value: 0.6867147951503981 and parameters: {'loss': 'coxph', 'learning_rate': 4.9931333540844724e-05, 'n_estimators': 260, 'criterion': 'squared_error', 'min_samples_split': 7, 'min_samples_leaf': 10, 'min_weight_fraction_leaf': 0.20127263435857567, 'min_impurity_decrease': 0.05630334921309584, 'max_features': 0.9997292160728836, 'subsample': 0.27849299202275446, 'dropout_rate': 0.0754851385215633, 'ccp_alpha': 0.16050640444692316}. Best is trial 187 with value: 0.6933481836305168.[0m
[32m[I 2022-04-22 00:21:42,941][0m Trial 614 finished with value: 0.6845820448416114 and parameters: {'loss': 'coxph', 'learning_rate': 2.104112465902408e-05, 'n_estimators': 286, 'criterion': 'squared_error', 'min_samples_split': 7, 'min_samples_leaf': 10, 'min_weight_fraction_leaf': 0.21260709955587767, 'min_impurity_decrease': 0.03374962697852771, 'max_features': 0.880575302447261, 'subsample': 0.3275872260986145, 'dropout_rate': 0.049135257703977975, 'ccp_alpha': 0.002727577653064461}. Best is trial 187 with value: 0.6933481836305168.[0m
[32m[I 2022-04-22 00:22:00,092][0m Trial 615 finished with value: 0.6868317007545213 and parameters: {'loss': 'coxph', 'learning_rate': 3.2633102348375486e-05, 'n_estimators': 326, 'criterion': 'squared_error', 'min_samples_split': 7, 'min_samples_leaf': 10, 'min_weight_fraction_leaf': 0.22523130847593856, 'min_impurity_decrease': 0.07408058097601644, 'max_features': 0.837885211318465, 'subsample': 0.3018492938205785, 'dropout_rate': 0.5232804328097941, 'ccp_alpha': 0.09380028111616864}. Best is trial 187 with value: 0.6933481836305168.[0m
[32m[I 2022-04-22 00:22:15,198][0m Trial 616 finished with value: 0.6635807151369472 and parameters: {'loss': 'coxph', 'learning_rate': 5.812933224470848e-05, 'n_estimators': 301, 'criterion': 'squared_error', 'min_samples_split': 7, 'min_samples_leaf': 10, 'min_weight_fraction_leaf': 0.19991706482558408, 'min_impurity_decrease': 0.04069548899673091, 'max_features': 0.9756486499147163, 'subsample': 0.27072902229360657, 'dropout_rate': 0.5896950172648506, 'ccp_alpha': 0.3147892122665884}. Best is trial 187 with value: 0.6933481836305168.[0m
[32m[I 2022-04-22 00:22:47,651][0m Trial 617 finished with value: 0.6124269653428465 and parameters: {'loss': 'coxph', 'learning_rate': 4.28252475371697e-05, 'n_estimators': 316, 'criterion': 'squared_error', 'min_samples_split': 7, 'min_samples_leaf': 10, 'min_weight_fraction_leaf': 0.4618008408850225, 'min_impurity_decrease': 0.055985193281241505, 'max_features': 0.8632664970033083, 'subsample': 0.343521367326857, 'dropout_rate': 0.019212984239481146, 'ccp_alpha': 0.1993273967412725}. Best is trial 187 with value: 0.6933481836305168.[0m
[32m[I 2022-04-22 00:23:11,017][0m Trial 618 finished with value: 0.6208265726036334 and parameters: {'loss': 'coxph', 'learning_rate': 0.00010271422488759419, 'n_estimators': 277, 'criterion': 'squared_error', 'min_samples_split': 7, 'min_samples_leaf': 10, 'min_weight_fraction_leaf': 0.23634771851929046, 'min_impurity_decrease': 0.3718012963673796, 'max_features': 0.8019695864716686, 'subsample': 0.291339156221307, 'dropout_rate': 0.09775907592160339, 'ccp_alpha': 0.08188740712902931}. Best is trial 187 with value: 0.6933481836305168.[0m
[32m[I 2022-04-22 00:23:25,477][0m Trial 619 finished with value: 0.6717346108704305 and parameters: {'loss': 'coxph', 'learning_rate': 5.643533882584329e-05, 'n_estimators': 330, 'criterion': 'squared_error', 'min_samples_split': 7, 'min_samples_leaf': 10, 'min_weight_fraction_leaf': 0.25841814940556174, 'min_impurity_decrease': 0.024053412347997183, 'max_features': 0.8919729420087813, 'subsample': 0.31810094337416583, 'dropout_rate': 0.6318117541375792, 'ccp_alpha': 0.16585726082413377}. Best is trial 187 with value: 0.6933481836305168.[0m
