[32m[I 2022-04-21 14:19:29,466][0m Trial 105 finished with value: 0.25 and parameters: {'loss': 'coxph', 'learning_rate': 0.0019186948761485798, 'n_estimators': 633, 'criterion': 'squared_error', 'min_samples_split': 7, 'min_samples_leaf': 9, 'min_weight_fraction_leaf': 0.4705831629184168, 'min_impurity_decrease': 0.7118085892561766, 'max_features': 0.04196104158678751, 'subsample': 0.05430568818778557, 'dropout_rate': 0.11028649888386774, 'ccp_alpha': 1.688987611487353}. Best is trial 0 with value: 0.25.[0m
[32m[I 2022-04-21 14:20:50,775][0m Trial 106 finished with value: 0.25 and parameters: {'loss': 'coxph', 'learning_rate': 0.00028203904670852137, 'n_estimators': 441, 'criterion': 'squared_error', 'min_samples_split': 6, 'min_samples_leaf': 8, 'min_weight_fraction_leaf': 0.45325001777025853, 'min_impurity_decrease': 0.8020397833935562, 'max_features': 0.9185874382357222, 'subsample': 0.12592016623000804, 'dropout_rate': 0.2577556965587998, 'ccp_alpha': 1.367352826025881}. Best is trial 0 with value: 0.25.[0m
[32m[I 2022-04-21 14:23:09,320][0m Trial 107 finished with value: 0.25 and parameters: {'loss': 'coxph', 'learning_rate': 0.0005707774363729083, 'n_estimators': 540, 'criterion': 'squared_error', 'min_samples_split': 4, 'min_samples_leaf': 9, 'min_weight_fraction_leaf': 0.44679773670988215, 'min_impurity_decrease': 0.827266267336835, 'max_features': 0.8689669453397233, 'subsample': 0.19539565834341402, 'dropout_rate': 0.2767654255720515, 'ccp_alpha': 3.2479068764264145}. Best is trial 0 with value: 0.25.[0m
[32m[I 2022-04-21 14:24:07,304][0m Trial 108 finished with value: 0.25 and parameters: {'loss': 'coxph', 'learning_rate': 0.0009489959497685173, 'n_estimators': 394, 'criterion': 'squared_error', 'min_samples_split': 6, 'min_samples_leaf': 8, 'min_weight_fraction_leaf': 0.4680105746370034, 'min_impurity_decrease': 0.880834204003618, 'max_features': 0.055500621033057744, 'subsample': 0.10850149936066844, 'dropout_rate': 0.3127674738456114, 'ccp_alpha': 2.800436187271722}. Best is trial 0 with value: 0.25.[0m
[32m[I 2022-04-21 14:25:36,270][0m Trial 109 finished with value: 0.25 and parameters: {'loss': 'coxph', 'learning_rate': 0.002302826331273374, 'n_estimators': 511, 'criterion': 'squared_error', 'min_samples_split': 4, 'min_samples_leaf': 8, 'min_weight_fraction_leaf': 0.47454879496248037, 'min_impurity_decrease': 0.7651417855705632, 'max_features': 0.29249944642652603, 'subsample': 0.06340706454885883, 'dropout_rate': 0.4993108511834642, 'ccp_alpha': 1.0003209091785425}. Best is trial 0 with value: 0.25.[0m
[32m[I 2022-04-21 14:25:43,296][0m Trial 110 finished with value: 0.25 and parameters: {'loss': 'coxph', 'learning_rate': 1.4291166918508144e-06, 'n_estimators': 120, 'criterion': 'squared_error', 'min_samples_split': 6, 'min_samples_leaf': 4, 'min_weight_fraction_leaf': 0.3216722697478569, 'min_impurity_decrease': 0.972624052933294, 'max_features': 0.1168269255513339, 'subsample': 0.7593602022909579, 'dropout_rate': 0.38044798318507267, 'ccp_alpha': 2.620875788088499}. Best is trial 0 with value: 0.25.[0m
[32m[I 2022-04-21 14:25:56,987][0m Trial 111 finished with value: 0.25 and parameters: {'loss': 'coxph', 'learning_rate': 0.00047117844675276845, 'n_estimators': 140, 'criterion': 'squared_error', 'min_samples_split': 4, 'min_samples_leaf': 7, 'min_weight_fraction_leaf': 0.3511843549165366, 'min_impurity_decrease': 0.3779623365619738, 'max_features': 0.2456898962199765, 'subsample': 0.7225333086701082, 'dropout_rate': 0.24848798036210135, 'ccp_alpha': 4.8546528873221515}. Best is trial 0 with value: 0.25.[0m
[32m[I 2022-04-21 14:26:07,477][0m Trial 112 finished with value: 0.25 and parameters: {'loss': 'coxph', 'learning_rate': 7.308188209906331e-05, 'n_estimators': 152, 'criterion': 'squared_error', 'min_samples_split': 6, 'min_samples_leaf': 8, 'min_weight_fraction_leaf': 0.4841863688784813, 'min_impurity_decrease': 0.3939404986315741, 'max_features': 0.22612485210128758, 'subsample': 0.019197097995192095, 'dropout_rate': 0.5612061597940563, 'ccp_alpha': 2.0323214257979463}. Best is trial 0 with value: 0.25.[0m
[32m[I 2022-04-21 14:26:12,309][0m Trial 113 finished with value: 0.25 and parameters: {'loss': 'coxph', 'learning_rate': 0.00020494834301021029, 'n_estimators': 131, 'criterion': 'squared_error', 'min_samples_split': 5, 'min_samples_leaf': 4, 'min_weight_fraction_leaf': 0.29578928021045703, 'min_impurity_decrease': 0.8423720364853011, 'max_features': 0.28012126570650725, 'subsample': 0.8026151541394902, 'dropout_rate': 0.5203005736836757, 'ccp_alpha': 4.904373924865214}. Best is trial 0 with value: 0.25.[0m
[32m[I 2022-04-21 14:26:17,794][0m Trial 114 finished with value: 0.6686595464651618 and parameters: {'loss': 'coxph', 'learning_rate': 0.0002728907012454502, 'n_estimators': 145, 'criterion': 'friedman_mse', 'min_samples_split': 3, 'min_samples_leaf': 3, 'min_weight_fraction_leaf': 0.44081915426925156, 'min_impurity_decrease': 0.32496687768221644, 'max_features': 0.9510254442284215, 'subsample': 0.15736815863711873, 'dropout_rate': 0.5889969118663487, 'ccp_alpha': 0.24449379865854276}. Best is trial 114 with value: 0.6686595464651618.[0m
[32m[I 2022-04-21 14:26:25,639][0m Trial 115 finished with value: 0.25 and parameters: {'loss': 'coxph', 'learning_rate': 2.4067358577058784e-06, 'n_estimators': 147, 'criterion': 'friedman_mse', 'min_samples_split': 3, 'min_samples_leaf': 3, 'min_weight_fraction_leaf': 0.42187976960966506, 'min_impurity_decrease': 0.33158700546465975, 'max_features': 0.7949039932960238, 'subsample': 0.8887813794909492, 'dropout_rate': 0.5049063027722139, 'ccp_alpha': 0.27574605157415144}. Best is trial 114 with value: 0.6686595464651618.[0m
[32m[I 2022-04-21 14:26:39,740][0m Trial 116 finished with value: 0.25 and parameters: {'loss': 'coxph', 'learning_rate': 1.4748582937930669e-06, 'n_estimators': 172, 'criterion': 'friedman_mse', 'min_samples_split': 2, 'min_samples_leaf': 3, 'min_weight_fraction_leaf': 0.22460107591889947, 'min_impurity_decrease': 0.5115895870851965, 'max_features': 0.9471603876887755, 'subsample': 0.9209441346058783, 'dropout_rate': 0.5688596252335357, 'ccp_alpha': 0.8952044200167301}. Best is trial 114 with value: 0.6686595464651618.[0m
[32m[I 2022-04-21 14:26:48,070][0m Trial 117 finished with value: 0.8082500904543595 and parameters: {'loss': 'coxph', 'learning_rate': 0.00015885081367207935, 'n_estimators': 138, 'criterion': 'friedman_mse', 'min_samples_split': 2, 'min_samples_leaf': 1, 'min_weight_fraction_leaf': 0.25564164921107563, 'min_impurity_decrease': 0.3329832931948957, 'max_features': 0.9849089424151385, 'subsample': 0.2869465911304755, 'dropout_rate': 0.5350884996844639, 'ccp_alpha': 0.054809677985508176}. Best is trial 117 with value: 0.8082500904543595.[0m
[32m[I 2022-04-21 14:26:57,717][0m Trial 118 finished with value: 0.8043635052046076 and parameters: {'loss': 'coxph', 'learning_rate': 0.00014671310283352073, 'n_estimators': 138, 'criterion': 'friedman_mse', 'min_samples_split': 2, 'min_samples_leaf': 1, 'min_weight_fraction_leaf': 0.2575724804325521, 'min_impurity_decrease': 0.4409784501873687, 'max_features': 0.9964858768280368, 'subsample': 0.22623257322103937, 'dropout_rate': 0.5425200346692963, 'ccp_alpha': 0.15382047215290226}. Best is trial 117 with value: 0.8082500904543595.[0m
[32m[I 2022-04-21 14:27:10,116][0m Trial 119 finished with value: 0.8112590663505761 and parameters: {'loss': 'coxph', 'learning_rate': 0.00013207079157005752, 'n_estimators': 157, 'criterion': 'friedman_mse', 'min_samples_split': 2, 'min_samples_leaf': 1, 'min_weight_fraction_leaf': 0.20259692394642684, 'min_impurity_decrease': 0.33057665548252346, 'max_features': 0.9915174022009922, 'subsample': 0.9880279185241011, 'dropout_rate': 0.47467596542555374, 'ccp_alpha': 0.014259399349003228}. Best is trial 119 with value: 0.8112590663505761.[0m
[32m[I 2022-04-21 14:27:20,597][0m Trial 120 finished with value: 0.79982585567489 and parameters: {'loss': 'coxph', 'learning_rate': 0.00011065781086914072, 'n_estimators': 152, 'criterion': 'friedman_mse', 'min_samples_split': 2, 'min_samples_leaf': 1, 'min_weight_fraction_leaf': 0.22974670708201975, 'min_impurity_decrease': 0.3287856895878431, 'max_features': 0.9998291657890083, 'subsample': 0.9882897293856094, 'dropout_rate': 0.48750344924393363, 'ccp_alpha': 0.03607295916929923}. Best is trial 119 with value: 0.8112590663505761.[0m
[32m[I 2022-04-21 14:27:27,911][0m Trial 121 finished with value: 0.7870865781385438 and parameters: {'loss': 'coxph', 'learning_rate': 0.00010897862382822364, 'n_estimators': 157, 'criterion': 'friedman_mse', 'min_samples_split': 2, 'min_samples_leaf': 1, 'min_weight_fraction_leaf': 0.258630262499974, 'min_impurity_decrease': 0.439359693559606, 'max_features': 0.9917749896155258, 'subsample': 0.9954539163670089, 'dropout_rate': 0.47527800069838505, 'ccp_alpha': 0.01206698308752771}. Best is trial 119 with value: 0.8112590663505761.[0m
[32m[I 2022-04-21 14:27:34,750][0m Trial 122 finished with value: 0.7940150192980632 and parameters: {'loss': 'coxph', 'learning_rate': 9.594735898630246e-05, 'n_estimators': 143, 'criterion': 'friedman_mse', 'min_samples_split': 2, 'min_samples_leaf': 1, 'min_weight_fraction_leaf': 0.25652675034221045, 'min_impurity_decrease': 0.336335057994729, 'max_features': 0.998586019414658, 'subsample': 0.9795071639724307, 'dropout_rate': 0.5898882189888129, 'ccp_alpha': 0.019094447265352806}. Best is trial 119 with value: 0.8112590663505761.[0m
[32m[I 2022-04-21 14:27:45,190][0m Trial 123 finished with value: 0.6884881958100616 and parameters: {'loss': 'coxph', 'learning_rate': 0.00013760568411642907, 'n_estimators': 153, 'criterion': 'friedman_mse', 'min_samples_split': 2, 'min_samples_leaf': 1, 'min_weight_fraction_leaf': 0.25676817455272205, 'min_impurity_decrease': 0.45462923495826646, 'max_features': 0.950356040286652, 'subsample': 0.9834293023054634, 'dropout_rate': 0.48391711355137945, 'ccp_alpha': 0.028090104074120603}. Best is trial 119 with value: 0.8112590663505761.[0m
[32m[I 2022-04-21 14:27:57,365][0m Trial 124 finished with value: 0.8124114557151714 and parameters: {'loss': 'coxph', 'learning_rate': 0.0001280139757556045, 'n_estimators': 155, 'criterion': 'friedman_mse', 'min_samples_split': 2, 'min_samples_leaf': 1, 'min_weight_fraction_leaf': 0.1985681829319356, 'min_impurity_decrease': 0.44513055582974587, 'max_features': 0.9607502352272304, 'subsample': 0.9892841415321711, 'dropout_rate': 0.5866287611430681, 'ccp_alpha': 0.002358396561457289}. Best is trial 124 with value: 0.8124114557151714.[0m
[32m[I 2022-04-21 14:28:09,315][0m Trial 125 finished with value: 0.6889019728434539 and parameters: {'loss': 'coxph', 'learning_rate': 9.798129804393e-05, 'n_estimators': 158, 'criterion': 'friedman_mse', 'min_samples_split': 2, 'min_samples_leaf': 1, 'min_weight_fraction_leaf': 0.2570023541383237, 'min_impurity_decrease': 0.332910356065528, 'max_features': 0.9995626787790649, 'subsample': 0.9901296857494026, 'dropout_rate': 0.4866512707351961, 'ccp_alpha': 0.024829051970218258}. Best is trial 124 with value: 0.8124114557151714.[0m
[32m[I 2022-04-21 14:28:17,773][0m Trial 126 finished with value: 0.8118739304341183 and parameters: {'loss': 'coxph', 'learning_rate': 9.756540314953192e-05, 'n_estimators': 157, 'criterion': 'friedman_mse', 'min_samples_split': 2, 'min_samples_leaf': 1, 'min_weight_fraction_leaf': 0.2061456462381841, 'min_impurity_decrease': 0.4438434814800042, 'max_features': 0.958110791497919, 'subsample': 0.9926405981218961, 'dropout_rate': 0.48654019520422886, 'ccp_alpha': 0.015417996728118187}. Best is trial 124 with value: 0.8124114557151714.[0m
/media/san2_ssd/data/Workdir/survival/venv/lib/python3.8/site-packages/sksurv/ensemble/boosting.py:955: RuntimeWarning: divide by zero encountered in log
  time = numpy.log(time)
/media/san2_ssd/data/Workdir/survival/venv/lib/python3.8/site-packages/sksurv/ensemble/boosting.py:955: RuntimeWarning: divide by zero encountered in log
  time = numpy.log(time)
/media/san2_ssd/data/Workdir/survival/venv/lib/python3.8/site-packages/sksurv/ensemble/boosting.py:955: RuntimeWarning: divide by zero encountered in log
  time = numpy.log(time)
/media/san2_ssd/data/Workdir/survival/venv/lib/python3.8/site-packages/sksurv/ensemble/boosting.py:955: RuntimeWarning: divide by zero encountered in log
  time = numpy.log(time)
[32m[I 2022-04-21 14:28:19,872][0m Trial 127 finished with value: -0.454805466512636 and parameters: {'loss': 'squared', 'learning_rate': 0.0001377424196059353, 'n_estimators': 158, 'criterion': 'friedman_mse', 'min_samples_split': 2, 'min_samples_leaf': 1, 'min_weight_fraction_leaf': 0.2553330373097832, 'min_impurity_decrease': 0.4531414964452316, 'max_features': 0.9635289879995189, 'subsample': 0.9979216553087941, 'dropout_rate': 0.5384999061941826, 'ccp_alpha': 0.010266981273171022}. Best is trial 124 with value: 0.8124114557151714.[0m
[32m[I 2022-04-21 14:28:32,248][0m Trial 128 finished with value: 0.25 and parameters: {'loss': 'coxph', 'learning_rate': 7.769582698478464e-05, 'n_estimators': 156, 'criterion': 'friedman_mse', 'min_samples_split': 2, 'min_samples_leaf': 1, 'min_weight_fraction_leaf': 0.20480055396742722, 'min_impurity_decrease': 0.4231833774302528, 'max_features': 0.9471027648628223, 'subsample': 0.9769941362067235, 'dropout_rate': 0.5852937741803954, 'ccp_alpha': 0.14517652497073585}. Best is trial 124 with value: 0.8124114557151714.[0m
[32m[I 2022-04-21 14:28:45,434][0m Trial 129 finished with value: 0.25 and parameters: {'loss': 'coxph', 'learning_rate': 9.56992540284896e-05, 'n_estimators': 181, 'criterion': 'friedman_mse', 'min_samples_split': 2, 'min_samples_leaf': 1, 'min_weight_fraction_leaf': 0.1927712533908616, 'min_impurity_decrease': 0.33772074215590697, 'max_features': 0.978137592733448, 'subsample': 0.9364257467065443, 'dropout_rate': 0.5938116626853935, 'ccp_alpha': 0.1387151308103057}. Best is trial 124 with value: 0.8124114557151714.[0m
[32m[I 2022-04-21 14:28:57,153][0m Trial 130 finished with value: 0.25 and parameters: {'loss': 'coxph', 'learning_rate': 5.966778427136729e-05, 'n_estimators': 163, 'criterion': 'friedman_mse', 'min_samples_split': 2, 'min_samples_leaf': 1, 'min_weight_fraction_leaf': 0.23506249263848242, 'min_impurity_decrease': 0.44219666788080214, 'max_features': 0.9302009328416665, 'subsample': 0.9725465252811936, 'dropout_rate': 0.6073676163956419, 'ccp_alpha': 0.21685802900215098}. Best is trial 124 with value: 0.8124114557151714.[0m
[32m[I 2022-04-21 14:29:04,090][0m Trial 131 finished with value: 0.4929126059345708 and parameters: {'loss': 'coxph', 'learning_rate': 0.0001480029679615301, 'n_estimators': 126, 'criterion': 'friedman_mse', 'min_samples_split': 2, 'min_samples_leaf': 1, 'min_weight_fraction_leaf': 0.2320373772008337, 'min_impurity_decrease': 0.3216910180236525, 'max_features': 0.9997761464195589, 'subsample': 0.9115445256936964, 'dropout_rate': 0.5381475736204849, 'ccp_alpha': 0.06646941107711045}. Best is trial 124 with value: 0.8124114557151714.[0m
[32m[I 2022-04-21 14:29:09,061][0m Trial 132 finished with value: 0.8149992174072377 and parameters: {'loss': 'coxph', 'learning_rate': 3.277198485329304e-05, 'n_estimators': 139, 'criterion': 'friedman_mse', 'min_samples_split': 3, 'min_samples_leaf': 1, 'min_weight_fraction_leaf': 0.17754580602633288, 'min_impurity_decrease': 0.30559968254424685, 'max_features': 0.9997272211399992, 'subsample': 0.907051107837877, 'dropout_rate': 0.7817887422493639, 'ccp_alpha': 0.0036913003041108977}. Best is trial 132 with value: 0.8149992174072377.[0m
[32m[I 2022-04-21 14:29:15,709][0m Trial 133 finished with value: 0.39192713050809697 and parameters: {'loss': 'coxph', 'learning_rate': 3.6169599844127215e-05, 'n_estimators': 141, 'criterion': 'friedman_mse', 'min_samples_split': 2, 'min_samples_leaf': 1, 'min_weight_fraction_leaf': 0.22889754446023164, 'min_impurity_decrease': 0.3252805457383199, 'max_features': 0.9936794365760763, 'subsample': 0.9450161783602357, 'dropout_rate': 0.493723631021703, 'ccp_alpha': 0.06564613150941008}. Best is trial 132 with value: 0.8149992174072377.[0m
[32m[I 2022-04-21 14:29:23,510][0m Trial 134 finished with value: 0.492341897824227 and parameters: {'loss': 'coxph', 'learning_rate': 3.901116975753149e-05, 'n_estimators': 139, 'criterion': 'friedman_mse', 'min_samples_split': 2, 'min_samples_leaf': 1, 'min_weight_fraction_leaf': 0.20942295137863307, 'min_impurity_decrease': 0.3093174242425616, 'max_features': 0.9980281701857229, 'subsample': 0.9484298209961725, 'dropout_rate': 0.487409276870281, 'ccp_alpha': 0.06605944108046444}. Best is trial 132 with value: 0.8149992174072377.[0m
[32m[I 2022-04-21 14:29:32,411][0m Trial 135 finished with value: 0.25 and parameters: {'loss': 'coxph', 'learning_rate': 0.00025328744958631543, 'n_estimators': 127, 'criterion': 'friedman_mse', 'min_samples_split': 2, 'min_samples_leaf': 1, 'min_weight_fraction_leaf': 0.20658512856564518, 'min_impurity_decrease': 0.3090642911953261, 'max_features': 0.9679066387979471, 'subsample': 0.906275296590616, 'dropout_rate': 0.48105058657942384, 'ccp_alpha': 0.3741995351338232}. Best is trial 132 with value: 0.8149992174072377.[0m
[32m[I 2022-04-21 14:29:42,131][0m Trial 136 finished with value: 0.8117810710166931 and parameters: {'loss': 'coxph', 'learning_rate': 0.00016353387853630053, 'n_estimators': 138, 'criterion': 'friedman_mse', 'min_samples_split': 3, 'min_samples_leaf': 1, 'min_weight_fraction_leaf': 0.2126247560951801, 'min_impurity_decrease': 0.37033306417234363, 'max_features': 0.8836522264746376, 'subsample': 0.9613253507304028, 'dropout_rate': 0.44014939113532603, 'ccp_alpha': 0.0012617182404756964}. Best is trial 132 with value: 0.8149992174072377.[0m
[32m[I 2022-04-21 14:29:52,462][0m Trial 137 finished with value: 0.25 and parameters: {'loss': 'coxph', 'learning_rate': 0.00015058547623817057, 'n_estimators': 152, 'criterion': 'friedman_mse', 'min_samples_split': 3, 'min_samples_leaf': 1, 'min_weight_fraction_leaf': 0.2528788560885094, 'min_impurity_decrease': 0.3695140402901571, 'max_features': 0.8803819687202211, 'subsample': 0.9788006518824894, 'dropout_rate': 0.4444634044133395, 'ccp_alpha': 0.2142069664829095}. Best is trial 132 with value: 0.8149992174072377.[0m
[32m[I 2022-04-21 14:29:59,547][0m Trial 138 finished with value: 0.25 and parameters: {'loss': 'coxph', 'learning_rate': 0.0001035359455284263, 'n_estimators': 135, 'criterion': 'friedman_mse', 'min_samples_split': 3, 'min_samples_leaf': 1, 'min_weight_fraction_leaf': 0.1989523913136769, 'min_impurity_decrease': 0.3487429559789597, 'max_features': 0.9255163028857134, 'subsample': 0.9967548962026077, 'dropout_rate': 0.5337604299551373, 'ccp_alpha': 0.3996924733450418}. Best is trial 132 with value: 0.8149992174072377.[0m
[32m[I 2022-04-21 14:30:08,924][0m Trial 139 finished with value: 0.8155275016171896 and parameters: {'loss': 'coxph', 'learning_rate': 0.0001743653715389559, 'n_estimators': 126, 'criterion': 'friedman_mse', 'min_samples_split': 2, 'min_samples_leaf': 1, 'min_weight_fraction_leaf': 0.16839589396135035, 'min_impurity_decrease': 0.4692327056217511, 'max_features': 0.9481269571089719, 'subsample': 0.9700990342056557, 'dropout_rate': 0.43289614493803075, 'ccp_alpha': 0.003849484538844615}. Best is trial 139 with value: 0.8155275016171896.[0m
[32m[I 2022-04-21 14:30:21,270][0m Trial 140 finished with value: 0.8133735199743726 and parameters: {'loss': 'coxph', 'learning_rate': 0.0001862415943508231, 'n_estimators': 148, 'criterion': 'friedman_mse', 'min_samples_split': 3, 'min_samples_leaf': 1, 'min_weight_fraction_leaf': 0.1725927268662356, 'min_impurity_decrease': 0.4622414227204465, 'max_features': 0.9533305485338511, 'subsample': 0.9620478651311156, 'dropout_rate': 0.4325292858469441, 'ccp_alpha': 0.0030864425209582665}. Best is trial 139 with value: 0.8155275016171896.[0m
[32m[I 2022-04-21 14:30:33,760][0m Trial 141 finished with value: 0.25 and parameters: {'loss': 'coxph', 'learning_rate': 0.00023392797742570497, 'n_estimators': 149, 'criterion': 'friedman_mse', 'min_samples_split': 3, 'min_samples_leaf': 1, 'min_weight_fraction_leaf': 0.168336644335187, 'min_impurity_decrease': 0.4675213238620332, 'max_features': 0.9473859046296279, 'subsample': 0.9620851466443598, 'dropout_rate': 0.43733172531282355, 'ccp_alpha': 0.19518483630335298}. Best is trial 139 with value: 0.8155275016171896.[0m
[32m[I 2022-04-21 14:30:41,429][0m Trial 142 finished with value: 0.8164567347311582 and parameters: {'loss': 'coxph', 'learning_rate': 0.0001804527111928996, 'n_estimators': 159, 'criterion': 'friedman_mse', 'min_samples_split': 2, 'min_samples_leaf': 1, 'min_weight_fraction_leaf': 0.18679695475690275, 'min_impurity_decrease': 0.2766094103538948, 'max_features': 0.8439826186921567, 'subsample': 0.22924815816865274, 'dropout_rate': 0.47235646632126166, 'ccp_alpha': 0.0050067909326483775}. Best is trial 142 with value: 0.8164567347311582.[0m
[32m[I 2022-04-21 14:30:55,662][0m Trial 143 finished with value: 0.8102732539871976 and parameters: {'loss': 'coxph', 'learning_rate': 0.00018206647663388613, 'n_estimators': 161, 'criterion': 'friedman_mse', 'min_samples_split': 2, 'min_samples_leaf': 1, 'min_weight_fraction_leaf': 0.19032413062168166, 'min_impurity_decrease': 0.27485290395016687, 'max_features': 0.8399408312212898, 'subsample': 0.9718448865864742, 'dropout_rate': 0.47039579722991, 'ccp_alpha': 0.0019564671264410156}. Best is trial 142 with value: 0.8164567347311582.[0m
