[32m[I 2022-04-23 09:33:20,270][0m Trial 965 finished with value: 0.5 and parameters: {'loss': 'coxph', 'learning_rate': 0.06020985117424028, 'n_estimators': 127, 'criterion': 'absolute_error', 'min_samples_split': 8, 'min_samples_leaf': 6, 'min_weight_fraction_leaf': 0.03335443328787283, 'min_impurity_decrease': 0.5749640043580473, 'max_features': 0.2529137802149739, 'subsample': 0.6238278676585878, 'dropout_rate': 0.12292172245726926, 'ccp_alpha': 0.005463709031857773}. Best is trial 947 with value: 0.6741395165532647.[0m
[32m[I 2022-04-23 09:33:24,956][0m Trial 966 finished with value: 0.665429157109042 and parameters: {'loss': 'coxph', 'learning_rate': 0.05976427869223799, 'n_estimators': 120, 'criterion': 'friedman_mse', 'min_samples_split': 9, 'min_samples_leaf': 7, 'min_weight_fraction_leaf': 0.023416024288427782, 'min_impurity_decrease': 0.6028413459503604, 'max_features': 0.2136662080546161, 'subsample': 0.673342702761489, 'dropout_rate': 0.13043792578111169, 'ccp_alpha': 0.004882983178332936}. Best is trial 947 with value: 0.6741395165532647.[0m
[32m[I 2022-04-23 09:33:31,906][0m Trial 967 finished with value: 0.5 and parameters: {'loss': 'coxph', 'learning_rate': 0.06816010428949466, 'n_estimators': 143, 'criterion': 'friedman_mse', 'min_samples_split': 9, 'min_samples_leaf': 7, 'min_weight_fraction_leaf': 0.02112239116171887, 'min_impurity_decrease': 0.6034706042688059, 'max_features': 0.22228913565107378, 'subsample': 0.618235578619191, 'dropout_rate': 0.01796889136877314, 'ccp_alpha': 0.2446906285137039}. Best is trial 947 with value: 0.6741395165532647.[0m
[32m[I 2022-04-23 09:33:36,666][0m Trial 968 finished with value: 0.5757109271471132 and parameters: {'loss': 'coxph', 'learning_rate': 0.05885690612174728, 'n_estimators': 121, 'criterion': 'friedman_mse', 'min_samples_split': 9, 'min_samples_leaf': 7, 'min_weight_fraction_leaf': 0.02638923831118898, 'min_impurity_decrease': 0.601002812440085, 'max_features': 0.20463664926428032, 'subsample': 0.7194449438523289, 'dropout_rate': 0.07508240823514295, 'ccp_alpha': 0.10100198334459691}. Best is trial 947 with value: 0.6741395165532647.[0m
[32m[I 2022-04-23 09:33:40,890][0m Trial 969 finished with value: 0.5 and parameters: {'loss': 'coxph', 'learning_rate': 0.07669119013372117, 'n_estimators': 112, 'criterion': 'friedman_mse', 'min_samples_split': 9, 'min_samples_leaf': 7, 'min_weight_fraction_leaf': 0.036707222823629204, 'min_impurity_decrease': 0.6155431465780967, 'max_features': 0.17531173027796254, 'subsample': 0.6896765964183385, 'dropout_rate': 0.03103519648944548, 'ccp_alpha': 1.1964001534989042}. Best is trial 947 with value: 0.6741395165532647.[0m
[32m[I 2022-04-23 09:33:47,376][0m Trial 970 finished with value: 0.6590240097880324 and parameters: {'loss': 'coxph', 'learning_rate': 3.33513795688169e-05, 'n_estimators': 136, 'criterion': 'friedman_mse', 'min_samples_split': 9, 'min_samples_leaf': 7, 'min_weight_fraction_leaf': 0.019309910516693177, 'min_impurity_decrease': 0.6415095270919231, 'max_features': 0.24802713493630066, 'subsample': 0.6850533076243239, 'dropout_rate': 0.041678056108456096, 'ccp_alpha': 0.003723005265072536}. Best is trial 947 with value: 0.6741395165532647.[0m
[32m[I 2022-04-23 09:33:52,200][0m Trial 971 finished with value: 0.5 and parameters: {'loss': 'coxph', 'learning_rate': 0.08065553000877773, 'n_estimators': 121, 'criterion': 'friedman_mse', 'min_samples_split': 9, 'min_samples_leaf': 7, 'min_weight_fraction_leaf': 0.008685162969816437, 'min_impurity_decrease': 0.6051396016764792, 'max_features': 0.21458056432404038, 'subsample': 0.6708919226927103, 'dropout_rate': 0.030612179592775277, 'ccp_alpha': 0.3442079241877072}. Best is trial 947 with value: 0.6741395165532647.[0m
[32m[I 2022-04-23 09:33:56,637][0m Trial 972 finished with value: 0.5006540204610004 and parameters: {'loss': 'coxph', 'learning_rate': 0.050223579872045405, 'n_estimators': 115, 'criterion': 'friedman_mse', 'min_samples_split': 9, 'min_samples_leaf': 7, 'min_weight_fraction_leaf': 0.026374975510827202, 'min_impurity_decrease': 0.5860571848506019, 'max_features': 0.17360652458404752, 'subsample': 0.6911555185710885, 'dropout_rate': 0.009971731332338342, 'ccp_alpha': 0.16843491571289318}. Best is trial 947 with value: 0.6741395165532647.[0m
[32m[I 2022-04-23 09:34:02,622][0m Trial 973 finished with value: 0.612311575948101 and parameters: {'loss': 'coxph', 'learning_rate': 0.06680607377989962, 'n_estimators': 137, 'criterion': 'friedman_mse', 'min_samples_split': 8, 'min_samples_leaf': 7, 'min_weight_fraction_leaf': 0.03536449828809088, 'min_impurity_decrease': 0.5966009970339986, 'max_features': 0.19191898206592417, 'subsample': 0.6438634381309516, 'dropout_rate': 0.04118369074917917, 'ccp_alpha': 0.09182452205577192}. Best is trial 947 with value: 0.6741395165532647.[0m
[32m[I 2022-04-23 09:34:07,130][0m Trial 974 finished with value: 0.6709085683634696 and parameters: {'loss': 'coxph', 'learning_rate': 0.05984960454953794, 'n_estimators': 114, 'criterion': 'friedman_mse', 'min_samples_split': 9, 'min_samples_leaf': 6, 'min_weight_fraction_leaf': 0.009748349180417906, 'min_impurity_decrease': 0.6407469922328587, 'max_features': 0.22532167139608417, 'subsample': 0.7446423934496522, 'dropout_rate': 0.05075122856686333, 'ccp_alpha': 0.00278928274958241}. Best is trial 947 with value: 0.6741395165532647.[0m
[32m[I 2022-04-23 09:34:11,388][0m Trial 975 finished with value: 0.5 and parameters: {'loss': 'coxph', 'learning_rate': 0.04418408274542606, 'n_estimators': 115, 'criterion': 'squared_error', 'min_samples_split': 9, 'min_samples_leaf': 8, 'min_weight_fraction_leaf': 0.006147819194336445, 'min_impurity_decrease': 0.6396632042157209, 'max_features': 0.25785616766609, 'subsample': 0.7483910849865465, 'dropout_rate': 0.04279495047687942, 'ccp_alpha': 0.24496913292635217}. Best is trial 947 with value: 0.6741395165532647.[0m
[32m[I 2022-04-23 09:34:15,053][0m Trial 976 finished with value: 0.5132549114240101 and parameters: {'loss': 'coxph', 'learning_rate': 0.05401862125512933, 'n_estimators': 104, 'criterion': 'friedman_mse', 'min_samples_split': 9, 'min_samples_leaf': 7, 'min_weight_fraction_leaf': 0.001977704813568711, 'min_impurity_decrease': 0.6746325295524167, 'max_features': 0.2368431470177709, 'subsample': 0.6709483372755497, 'dropout_rate': 0.029647347393641114, 'ccp_alpha': 0.16925439456623373}. Best is trial 947 with value: 0.6741395165532647.[0m
[32m[I 2022-04-23 09:34:19,997][0m Trial 977 finished with value: 0.5875728808280815 and parameters: {'loss': 'coxph', 'learning_rate': 0.039218899325714617, 'n_estimators': 125, 'criterion': 'friedman_mse', 'min_samples_split': 9, 'min_samples_leaf': 8, 'min_weight_fraction_leaf': 0.012281213805790826, 'min_impurity_decrease': 0.6633422127436871, 'max_features': 0.22554593494971034, 'subsample': 0.7020410664058083, 'dropout_rate': 0.058730176440382725, 'ccp_alpha': 0.0959263686344146}. Best is trial 947 with value: 0.6741395165532647.[0m
[32m[I 2022-04-23 09:34:25,349][0m Trial 978 finished with value: 0.5795762412767633 and parameters: {'loss': 'coxph', 'learning_rate': 0.05021109746401088, 'n_estimators': 122, 'criterion': 'friedman_mse', 'min_samples_split': 9, 'min_samples_leaf': 5, 'min_weight_fraction_leaf': 0.011454233700200607, 'min_impurity_decrease': 0.6341207665339409, 'max_features': 0.2680460898323753, 'subsample': 0.7964553259398839, 'dropout_rate': 0.015997156454059858, 'ccp_alpha': 0.0937223800981237}. Best is trial 947 with value: 0.6741395165532647.[0m
[32m[I 2022-04-23 09:34:29,928][0m Trial 979 finished with value: 0.5006540204610004 and parameters: {'loss': 'coxph', 'learning_rate': 0.057455361922347306, 'n_estimators': 110, 'criterion': 'friedman_mse', 'min_samples_split': 9, 'min_samples_leaf': 6, 'min_weight_fraction_leaf': 0.01500299939879681, 'min_impurity_decrease': 0.6529086733439173, 'max_features': 0.27596518075801907, 'subsample': 0.8291160651871243, 'dropout_rate': 0.009086716172639049, 'ccp_alpha': 0.17283361007097792}. Best is trial 947 with value: 0.6741395165532647.[0m
/media/san2_ssd/data/Workdir/survival/venv/lib/python3.8/site-packages/sksurv/ensemble/boosting.py:955: RuntimeWarning: divide by zero encountered in log
  time = numpy.log(time)
/media/san2_ssd/data/Workdir/survival/venv/lib/python3.8/site-packages/sksurv/ensemble/boosting.py:955: RuntimeWarning: divide by zero encountered in log
  time = numpy.log(time)
/media/san2_ssd/data/Workdir/survival/venv/lib/python3.8/site-packages/sksurv/ensemble/boosting.py:955: RuntimeWarning: divide by zero encountered in log
  time = numpy.log(time)
/media/san2_ssd/data/Workdir/survival/venv/lib/python3.8/site-packages/sksurv/ensemble/boosting.py:955: RuntimeWarning: divide by zero encountered in log
  time = numpy.log(time)
[32m[I 2022-04-23 09:34:30,805][0m Trial 980 finished with value: -0.7342166408616736 and parameters: {'loss': 'squared', 'learning_rate': 0.06215891203644123, 'n_estimators': 113, 'criterion': 'friedman_mse', 'min_samples_split': 9, 'min_samples_leaf': 7, 'min_weight_fraction_leaf': 0.018959600862431807, 'min_impurity_decrease': 0.6570335219070351, 'max_features': 0.2018842434579328, 'subsample': 0.7740977344738222, 'dropout_rate': 0.04900580045626736, 'ccp_alpha': 0.005513507693101952}. Best is trial 947 with value: 0.6741395165532647.[0m
[32m[I 2022-04-23 09:34:34,918][0m Trial 981 finished with value: 0.5 and parameters: {'loss': 'coxph', 'learning_rate': 0.043781185781008966, 'n_estimators': 109, 'criterion': 'friedman_mse', 'min_samples_split': 9, 'min_samples_leaf': 6, 'min_weight_fraction_leaf': 0.009769986830414603, 'min_impurity_decrease': 0.6093232162371731, 'max_features': 0.24460896891766884, 'subsample': 0.7345961401104505, 'dropout_rate': 0.0002835444542140242, 'ccp_alpha': 0.27951252194639836}. Best is trial 947 with value: 0.6741395165532647.[0m
[32m[I 2022-04-23 09:34:39,025][0m Trial 982 finished with value: 0.662477612457835 and parameters: {'loss': 'coxph', 'learning_rate': 0.06737057239621949, 'n_estimators': 108, 'criterion': 'friedman_mse', 'min_samples_split': 9, 'min_samples_leaf': 5, 'min_weight_fraction_leaf': 0.016720512668624378, 'min_impurity_decrease': 0.6254897942307511, 'max_features': 0.22725433379414825, 'subsample': 0.7595344458359047, 'dropout_rate': 0.06715784304386713, 'ccp_alpha': 0.0018574466249719106}. Best is trial 947 with value: 0.6741395165532647.[0m
[32m[I 2022-04-23 09:34:43,959][0m Trial 983 finished with value: 0.5935072975384473 and parameters: {'loss': 'coxph', 'learning_rate': 0.09963132249508118, 'n_estimators': 120, 'criterion': 'friedman_mse', 'min_samples_split': 8, 'min_samples_leaf': 8, 'min_weight_fraction_leaf': 0.00882037142669477, 'min_impurity_decrease': 0.6212206873468891, 'max_features': 0.22003608453197737, 'subsample': 0.7225158952752722, 'dropout_rate': 0.04684325150400212, 'ccp_alpha': 0.0953198488826865}. Best is trial 947 with value: 0.6741395165532647.[0m
[32m[I 2022-04-23 09:34:48,957][0m Trial 984 finished with value: 0.5 and parameters: {'loss': 'coxph', 'learning_rate': 0.04837017829467806, 'n_estimators': 118, 'criterion': 'friedman_mse', 'min_samples_split': 3, 'min_samples_leaf': 8, 'min_weight_fraction_leaf': 0.0231544364689218, 'min_impurity_decrease': 0.6760984940909621, 'max_features': 0.28954697581344563, 'subsample': 0.6350362980989205, 'dropout_rate': 0.003903251373601549, 'ccp_alpha': 3.562836630180597}. Best is trial 947 with value: 0.6741395165532647.[0m
[32m[I 2022-04-23 09:34:52,820][0m Trial 985 finished with value: 0.5006540204610004 and parameters: {'loss': 'coxph', 'learning_rate': 0.060067066646631154, 'n_estimators': 107, 'criterion': 'friedman_mse', 'min_samples_split': 9, 'min_samples_leaf': 6, 'min_weight_fraction_leaf': 0.023017189524749345, 'min_impurity_decrease': 0.6200059823205497, 'max_features': 0.2542483892793565, 'subsample': 0.6700355149929075, 'dropout_rate': 0.04093736841845904, 'ccp_alpha': 0.17545775458943966}. Best is trial 947 with value: 0.6741395165532647.[0m
[32m[I 2022-04-23 09:34:57,286][0m Trial 986 finished with value: 0.6168810444870504 and parameters: {'loss': 'coxph', 'learning_rate': 0.03591015034317428, 'n_estimators': 117, 'criterion': 'friedman_mse', 'min_samples_split': 9, 'min_samples_leaf': 5, 'min_weight_fraction_leaf': 0.007112681477806722, 'min_impurity_decrease': 0.6476707628603796, 'max_features': 0.23590204276885807, 'subsample': 0.6426817689865774, 'dropout_rate': 0.059271437389520544, 'ccp_alpha': 0.09404411304510052}. Best is trial 947 with value: 0.6741395165532647.[0m
[32m[I 2022-04-23 09:35:11,441][0m Trial 987 finished with value: 0.6740980314319185 and parameters: {'loss': 'coxph', 'learning_rate': 0.07181469376018747, 'n_estimators': 212, 'criterion': 'friedman_mse', 'min_samples_split': 9, 'min_samples_leaf': 6, 'min_weight_fraction_leaf': 0.0011005100382483965, 'min_impurity_decrease': 0.6961261015519755, 'max_features': 0.2182523912040689, 'subsample': 0.6571811412836635, 'dropout_rate': 0.025451814811553976, 'ccp_alpha': 0.003558808061040678}. Best is trial 947 with value: 0.6741395165532647.[0m
[32m[I 2022-04-23 09:35:25,142][0m Trial 988 finished with value: 0.6750347494547368 and parameters: {'loss': 'coxph', 'learning_rate': 0.07956477642784399, 'n_estimators': 206, 'criterion': 'friedman_mse', 'min_samples_split': 9, 'min_samples_leaf': 6, 'min_weight_fraction_leaf': 0.0011495967608824292, 'min_impurity_decrease': 0.6824661478957649, 'max_features': 0.18202461798952774, 'subsample': 0.6524917216713446, 'dropout_rate': 0.025625229303524805, 'ccp_alpha': 0.0016418287499199553}. Best is trial 988 with value: 0.6750347494547368.[0m
[32m[I 2022-04-23 09:35:39,827][0m Trial 989 finished with value: 0.5 and parameters: {'loss': 'coxph', 'learning_rate': 0.08149540923881869, 'n_estimators': 218, 'criterion': 'absolute_error', 'min_samples_split': 9, 'min_samples_leaf': 6, 'min_weight_fraction_leaf': 0.00321131849994501, 'min_impurity_decrease': 0.6725032283187192, 'max_features': 0.18212910865072296, 'subsample': 0.6492998076213082, 'dropout_rate': 0.03825999543221194, 'ccp_alpha': 0.0013985898941504666}. Best is trial 988 with value: 0.6750347494547368.[0m
[32m[I 2022-04-23 09:35:54,020][0m Trial 990 finished with value: 0.5 and parameters: {'loss': 'coxph', 'learning_rate': 0.08250496374274215, 'n_estimators': 219, 'criterion': 'friedman_mse', 'min_samples_split': 9, 'min_samples_leaf': 6, 'min_weight_fraction_leaf': 0.004286289741181549, 'min_impurity_decrease': 0.675938926409649, 'max_features': 0.15139458472080597, 'subsample': 0.6556143248323769, 'dropout_rate': 0.01759580907552931, 'ccp_alpha': 0.34436020780341975}. Best is trial 988 with value: 0.6750347494547368.[0m
[32m[I 2022-04-23 09:36:07,682][0m Trial 991 finished with value: 0.5 and parameters: {'loss': 'coxph', 'learning_rate': 0.07915846669932608, 'n_estimators': 211, 'criterion': 'friedman_mse', 'min_samples_split': 9, 'min_samples_leaf': 6, 'min_weight_fraction_leaf': 0.00822180023227808, 'min_impurity_decrease': 0.6932268555975282, 'max_features': 0.17187139383859878, 'subsample': 0.6846301244876442, 'dropout_rate': 0.02510687917684931, 'ccp_alpha': 0.22625963628166149}. Best is trial 988 with value: 0.6750347494547368.[0m
[32m[I 2022-04-23 09:36:22,802][0m Trial 992 finished with value: 0.5303371293024742 and parameters: {'loss': 'coxph', 'learning_rate': 0.06978976878786096, 'n_estimators': 227, 'criterion': 'friedman_mse', 'min_samples_split': 9, 'min_samples_leaf': 6, 'min_weight_fraction_leaf': 0.0012435411133804603, 'min_impurity_decrease': 0.6593027314309531, 'max_features': 0.18053119945655088, 'subsample': 0.6986505492933857, 'dropout_rate': 0.03428739510842005, 'ccp_alpha': 0.1424077585836356}. Best is trial 988 with value: 0.6750347494547368.[0m
[32m[I 2022-04-23 09:36:34,014][0m Trial 993 finished with value: 0.6125382198891945 and parameters: {'loss': 'coxph', 'learning_rate': 0.0845038587923661, 'n_estimators': 192, 'criterion': 'friedman_mse', 'min_samples_split': 9, 'min_samples_leaf': 6, 'min_weight_fraction_leaf': 0.0013241107572763422, 'min_impurity_decrease': 0.706046624652286, 'max_features': 0.16784457715431506, 'subsample': 0.6287116812654404, 'dropout_rate': 0.01477822840476861, 'ccp_alpha': 0.09759641624256937}. Best is trial 988 with value: 0.6750347494547368.[0m
[32m[I 2022-04-23 09:36:46,929][0m Trial 994 finished with value: 0.5 and parameters: {'loss': 'coxph', 'learning_rate': 0.06794816639959712, 'n_estimators': 201, 'criterion': 'friedman_mse', 'min_samples_split': 9, 'min_samples_leaf': 6, 'min_weight_fraction_leaf': 0.004759911201631198, 'min_impurity_decrease': 0.685867179868772, 'max_features': 0.20138484326546469, 'subsample': 0.6071404823731601, 'dropout_rate': 0.02168667566111698, 'ccp_alpha': 0.2521507003697365}. Best is trial 988 with value: 0.6750347494547368.[0m
[32m[I 2022-04-23 09:37:00,671][0m Trial 995 finished with value: 0.530715911158733 and parameters: {'loss': 'coxph', 'learning_rate': 0.09746586380267046, 'n_estimators': 209, 'criterion': 'friedman_mse', 'min_samples_split': 8, 'min_samples_leaf': 6, 'min_weight_fraction_leaf': 0.010966034635370426, 'min_impurity_decrease': 0.7247648874387146, 'max_features': 0.20672603715290513, 'subsample': 0.6637579790620227, 'dropout_rate': 0.028537024216301634, 'ccp_alpha': 0.15977852831333203}. Best is trial 988 with value: 0.6750347494547368.[0m
[32m[I 2022-04-23 09:37:16,229][0m Trial 996 finished with value: 0.6080958860597241 and parameters: {'loss': 'coxph', 'learning_rate': 0.05736051415180122, 'n_estimators': 229, 'criterion': 'friedman_mse', 'min_samples_split': 9, 'min_samples_leaf': 6, 'min_weight_fraction_leaf': 0.0023656552682915916, 'min_impurity_decrease': 0.6926249044141007, 'max_features': 0.22090976443121166, 'subsample': 0.6552603445260501, 'dropout_rate': 0.04725380736969822, 'ccp_alpha': 0.0959123530343889}. Best is trial 988 with value: 0.6750347494547368.[0m
[32m[I 2022-04-23 09:37:29,080][0m Trial 997 finished with value: 0.5 and parameters: {'loss': 'coxph', 'learning_rate': 0.09945223502130993, 'n_estimators': 202, 'criterion': 'friedman_mse', 'min_samples_split': 9, 'min_samples_leaf': 6, 'min_weight_fraction_leaf': 0.013531617174514144, 'min_impurity_decrease': 0.647231569475346, 'max_features': 0.19880713491262658, 'subsample': 0.6189252607731012, 'dropout_rate': 0.047483527956768565, 'ccp_alpha': 1.7132210494701072}. Best is trial 988 with value: 0.6750347494547368.[0m
[32m[I 2022-04-23 09:37:40,746][0m Trial 998 finished with value: 0.5844326070866331 and parameters: {'loss': 'coxph', 'learning_rate': 0.07132961013258635, 'n_estimators': 188, 'criterion': 'friedman_mse', 'min_samples_split': 9, 'min_samples_leaf': 6, 'min_weight_fraction_leaf': 0.0030619334510243734, 'min_impurity_decrease': 0.6483708164574443, 'max_features': 0.19160213639632806, 'subsample': 0.651343219013533, 'dropout_rate': 0.0544946311720768, 'ccp_alpha': 0.10216319306050695}. Best is trial 988 with value: 0.6750347494547368.[0m
/media/san2_ssd/data/Workdir/survival/venv/lib/python3.8/site-packages/sksurv/ensemble/boosting.py:955: RuntimeWarning: divide by zero encountered in log
  time = numpy.log(time)
/media/san2_ssd/data/Workdir/survival/venv/lib/python3.8/site-packages/sksurv/ensemble/boosting.py:955: RuntimeWarning: divide by zero encountered in log
  time = numpy.log(time)
/media/san2_ssd/data/Workdir/survival/venv/lib/python3.8/site-packages/sksurv/ensemble/boosting.py:955: RuntimeWarning: divide by zero encountered in log
  time = numpy.log(time)
/media/san2_ssd/data/Workdir/survival/venv/lib/python3.8/site-packages/sksurv/ensemble/boosting.py:955: RuntimeWarning: divide by zero encountered in log
  time = numpy.log(time)
[32m[I 2022-04-23 09:37:43,967][0m Trial 999 finished with value: -0.7 and parameters: {'loss': 'squared', 'learning_rate': 0.047724221121854746, 'n_estimators': 235, 'criterion': 'friedman_mse', 'min_samples_split': 8, 'min_samples_leaf': 6, 'min_weight_fraction_leaf': 0.012133752476611413, 'min_impurity_decrease': 0.6315402793883822, 'max_features': 0.1597187907688164, 'subsample': 0.6737972732311879, 'dropout_rate': 0.056167703713893784, 'ccp_alpha': 0.46074953888184356}. Best is trial 988 with value: 0.6750347494547368.[0m
BoostingSurvival
Running Optimizer with LogRank binary scoring
{'loss': 'coxph', 'learning_rate': 0.001317427140431025, 'n_estimators': 920, 'criterion': 'friedman_mse', 'min_samples_split': 2, 'min_samples_leaf': 6, 'min_weight_fraction_leaf': 0.010225982206401125, 'min_impurity_decrease': 0.9526146434683818, 'max_features': 0.2526227469550755, 'subsample': 0.3453967050783214, 'dropout_rate': 0.20825772436808648, 'ccp_alpha': 0.002156682704769007, 'UnoC_LR': 0.8349451173694054}
Running Optimizer normaly
{'loss': 'coxph', 'learning_rate': 0.07956477642784399, 'n_estimators': 206, 'criterion': 'friedman_mse', 'min_samples_split': 9, 'min_samples_leaf': 6, 'min_weight_fraction_leaf': 0.0011495967608824292, 'min_impurity_decrease': 0.6824661478957649, 'max_features': 0.18202461798952774, 'subsample': 0.6524917216713446, 'dropout_rate': 0.025625229303524805, 'ccp_alpha': 0.0016418287499199553, 'UnoC': 0.6750347494547368}
