[32m[I 2022-04-21 11:40:42,863][0m Trial 579 finished with value: 0.8153843936522351 and parameters: {'splitter': 'best', 'min_samples_split': 0.05772905262599397, 'min_samples_leaf': 0.031364033681100245, 'min_weight_fraction_leaf': 0.00868413140950331, 'max_features': 0.27355576964029155}. Best is trial 435 with value: 0.8271205444415821.[0m
[32m[I 2022-04-21 11:40:43,027][0m Trial 580 finished with value: 0.5682305707392423 and parameters: {'splitter': 'best', 'min_samples_split': 0.037633891217468365, 'min_samples_leaf': 0.2674164047251367, 'min_weight_fraction_leaf': 0.3138862833351463, 'max_features': 0.29783731043983797}. Best is trial 435 with value: 0.8271205444415821.[0m
[32m[I 2022-04-21 11:40:43,158][0m Trial 581 finished with value: 0.47240522258759954 and parameters: {'splitter': 'best', 'min_samples_split': 0.04790193641863097, 'min_samples_leaf': 0.008844630160206202, 'min_weight_fraction_leaf': 0.44864953636686056, 'max_features': 0.30939412412069933}. Best is trial 435 with value: 0.8271205444415821.[0m
[32m[I 2022-04-21 11:40:43,425][0m Trial 582 finished with value: 0.8053943058331786 and parameters: {'splitter': 'best', 'min_samples_split': 0.06448757335784785, 'min_samples_leaf': 0.04683879437317603, 'min_weight_fraction_leaf': 0.00043572134084997815, 'max_features': 0.2903145066822243}. Best is trial 435 with value: 0.8271205444415821.[0m
[32m[I 2022-04-21 11:40:43,524][0m Trial 583 finished with value: 0.8071899311719177 and parameters: {'splitter': 'random', 'min_samples_split': 0.05312164047612185, 'min_samples_leaf': 0.02083225467948542, 'min_weight_fraction_leaf': 0.021700964547855164, 'max_features': 0.3109467654345687}. Best is trial 435 with value: 0.8271205444415821.[0m
/media/san2_ssd/data/Workdir/survival/utils.py:305: RuntimeWarning: invalid value encountered in true_divide
  pdfs = np.gradient(1-survs,axis=1)/norms
[32m[I 2022-04-21 11:40:43,814][0m Trial 584 finished with value: 0.8106520362606903 and parameters: {'splitter': 'best', 'min_samples_split': 0.060486224468479344, 'min_samples_leaf': 0.01560631627087203, 'min_weight_fraction_leaf': 0.00942650706427406, 'max_features': 0.34330556223276865}. Best is trial 435 with value: 0.8271205444415821.[0m
[32m[I 2022-04-21 11:40:43,947][0m Trial 585 finished with value: 0.7826233433891726 and parameters: {'splitter': 'best', 'min_samples_split': 0.07150853787716553, 'min_samples_leaf': 0.062087043422622265, 'min_weight_fraction_leaf': 0.12543476974685183, 'max_features': 0.3337176755244012}. Best is trial 435 with value: 0.8271205444415821.[0m
[32m[I 2022-04-21 11:40:44,147][0m Trial 586 finished with value: 0.8046649260306491 and parameters: {'splitter': 'best', 'min_samples_split': 0.047787703076737825, 'min_samples_leaf': 0.029250362911428095, 'min_weight_fraction_leaf': 0.030544731843393402, 'max_features': 0.31201812933492057}. Best is trial 435 with value: 0.8271205444415821.[0m
/media/san2_ssd/data/Workdir/survival/utils.py:305: RuntimeWarning: invalid value encountered in true_divide
  pdfs = np.gradient(1-survs,axis=1)/norms
/media/san2_ssd/data/Workdir/survival/utils.py:305: RuntimeWarning: invalid value encountered in true_divide
  pdfs = np.gradient(1-survs,axis=1)/norms
/media/san2_ssd/data/Workdir/survival/utils.py:305: RuntimeWarning: invalid value encountered in true_divide
  pdfs = np.gradient(1-survs,axis=1)/norms
/media/san2_ssd/data/Workdir/survival/utils.py:305: RuntimeWarning: invalid value encountered in true_divide
  pdfs = np.gradient(1-survs,axis=1)/norms
[32m[I 2022-04-21 11:40:44,463][0m Trial 587 finished with value: 0.8030602605176462 and parameters: {'splitter': 'best', 'min_samples_split': 0.032544173212162464, 'min_samples_leaf': 0.009040189779178523, 'min_weight_fraction_leaf': 0.00027923328931343534, 'max_features': 0.2609016664309069}. Best is trial 435 with value: 0.8271205444415821.[0m
[32m[I 2022-04-21 11:40:44,653][0m Trial 588 finished with value: 0.8108645982012208 and parameters: {'splitter': 'best', 'min_samples_split': 0.07597690540696309, 'min_samples_leaf': 0.04123134754244734, 'min_weight_fraction_leaf': 0.01559431757245202, 'max_features': 0.3500121740389296}. Best is trial 435 with value: 0.8271205444415821.[0m
[32m[I 2022-04-21 11:40:44,730][0m Trial 589 finished with value: 0.6778390687741236 and parameters: {'splitter': 'random', 'min_samples_split': 0.016226099690022026, 'min_samples_leaf': 0.0020333796851020325, 'min_weight_fraction_leaf': 0.20007698994042816, 'max_features': 0.24707007265017694}. Best is trial 435 with value: 0.8271205444415821.[0m
/media/san2_ssd/data/Workdir/survival/utils.py:305: RuntimeWarning: invalid value encountered in true_divide
  pdfs = np.gradient(1-survs,axis=1)/norms
[32m[I 2022-04-21 11:40:44,961][0m Trial 590 finished with value: 0.8086377528916622 and parameters: {'splitter': 'best', 'min_samples_split': 0.0620808251549144, 'min_samples_leaf': 0.020645398011184535, 'min_weight_fraction_leaf': 0.018469166342890444, 'max_features': 0.32148270930718575}. Best is trial 435 with value: 0.8271205444415821.[0m
[32m[I 2022-04-21 11:40:45,254][0m Trial 591 finished with value: 0.8145910521543582 and parameters: {'splitter': 'best', 'min_samples_split': 0.04107953087584616, 'min_samples_leaf': 0.03243371651533842, 'min_weight_fraction_leaf': 0.03197507479152395, 'max_features': 0.48434007149418723}. Best is trial 435 with value: 0.8271205444415821.[0m
/media/san2_ssd/data/Workdir/survival/utils.py:305: RuntimeWarning: invalid value encountered in true_divide
  pdfs = np.gradient(1-survs,axis=1)/norms
[32m[I 2022-04-21 11:40:45,522][0m Trial 592 finished with value: 0.8003119172280769 and parameters: {'splitter': 'best', 'min_samples_split': 0.07825639856428859, 'min_samples_leaf': 0.016650103813757068, 'min_weight_fraction_leaf': 0.000447588296107663, 'max_features': 0.2883026616315676}. Best is trial 435 with value: 0.8271205444415821.[0m
[32m[I 2022-04-21 11:40:45,640][0m Trial 593 finished with value: 0.7949507589191492 and parameters: {'splitter': 'best', 'min_samples_split': 0.10854279230724281, 'min_samples_leaf': 0.12686219023787776, 'min_weight_fraction_leaf': 0.009803546718603767, 'max_features': 0.4139910115884646}. Best is trial 435 with value: 0.8271205444415821.[0m
/media/san2_ssd/data/Workdir/survival/utils.py:305: RuntimeWarning: invalid value encountered in true_divide
  pdfs = np.gradient(1-survs,axis=1)/norms
[32m[I 2022-04-21 11:40:45,965][0m Trial 594 finished with value: 0.8136454008563939 and parameters: {'splitter': 'best', 'min_samples_split': 0.06796371984503313, 'min_samples_leaf': 0.00853948612961949, 'min_weight_fraction_leaf': 0.023679743847854918, 'max_features': 0.43071291963389624}. Best is trial 435 with value: 0.8271205444415821.[0m
[32m[I 2022-04-21 11:40:46,229][0m Trial 595 finished with value: 0.818071467472343 and parameters: {'splitter': 'best', 'min_samples_split': 0.05440296843863092, 'min_samples_leaf': 0.026410841022156795, 'min_weight_fraction_leaf': 0.008508214623252321, 'max_features': 0.39907214102468613}. Best is trial 435 with value: 0.8271205444415821.[0m
[32m[I 2022-04-21 11:40:46,354][0m Trial 596 finished with value: 0.8119658337181213 and parameters: {'splitter': 'random', 'min_samples_split': 0.10065126982259325, 'min_samples_leaf': 0.0012253290754495163, 'min_weight_fraction_leaf': 0.03690863856327794, 'max_features': 0.3558273718641384}. Best is trial 435 with value: 0.8271205444415821.[0m
/media/san2_ssd/data/Workdir/survival/utils.py:305: RuntimeWarning: invalid value encountered in true_divide
  pdfs = np.gradient(1-survs,axis=1)/norms
[32m[I 2022-04-21 11:40:46,883][0m Trial 597 finished with value: 0.8183588612459101 and parameters: {'splitter': 'best', 'min_samples_split': 0.08279215906202092, 'min_samples_leaf': 0.01760249308464535, 'min_weight_fraction_leaf': 0.016714691941985424, 'max_features': 0.5150049741715879}. Best is trial 435 with value: 0.8271205444415821.[0m
[32m[I 2022-04-21 11:40:47,776][0m Trial 598 finished with value: 0.8110025832569192 and parameters: {'splitter': 'best', 'min_samples_split': 0.11173150438842613, 'min_samples_leaf': 0.039935561474338306, 'min_weight_fraction_leaf': 0.04990113851391033, 'max_features': 0.4621709774168184}. Best is trial 435 with value: 0.8271205444415821.[0m
[32m[I 2022-04-21 11:40:48,176][0m Trial 599 finished with value: 0.8049306709249338 and parameters: {'splitter': 'best', 'min_samples_split': 0.027808823219359312, 'min_samples_leaf': 0.0560289244233881, 'min_weight_fraction_leaf': 0.025166926280304442, 'max_features': 0.06607227972305446}. Best is trial 435 with value: 0.8271205444415821.[0m
[32m[I 2022-04-21 11:40:48,826][0m Trial 600 finished with value: 0.8181510762308626 and parameters: {'splitter': 'best', 'min_samples_split': 0.09503465238449955, 'min_samples_leaf': 0.02611656818567186, 'min_weight_fraction_leaf': 0.00011263823777902474, 'max_features': 0.3774451341370242}. Best is trial 435 with value: 0.8271205444415821.[0m
/media/san2_ssd/data/Workdir/survival/utils.py:305: RuntimeWarning: invalid value encountered in true_divide
  pdfs = np.gradient(1-survs,axis=1)/norms
/media/san2_ssd/data/Workdir/survival/utils.py:305: RuntimeWarning: invalid value encountered in true_divide
  pdfs = np.gradient(1-survs,axis=1)/norms
[32m[I 2022-04-21 11:40:49,347][0m Trial 601 finished with value: 0.809495755223935 and parameters: {'splitter': 'best', 'min_samples_split': 0.07037460670674986, 'min_samples_leaf': 0.00941023714874903, 'min_weight_fraction_leaf': 0.00013782924530402342, 'max_features': 0.32459528496231227}. Best is trial 435 with value: 0.8271205444415821.[0m
/media/san2_ssd/data/Workdir/survival/utils.py:305: RuntimeWarning: invalid value encountered in true_divide
  pdfs = np.gradient(1-survs,axis=1)/norms
[32m[I 2022-04-21 11:40:49,581][0m Trial 602 finished with value: 0.8035489896194928 and parameters: {'splitter': 'random', 'min_samples_split': 0.08646594041866448, 'min_samples_leaf': 0.0010817987646017367, 'min_weight_fraction_leaf': 0.013028827828798056, 'max_features': 0.4408406662487937}. Best is trial 435 with value: 0.8271205444415821.[0m
[32m[I 2022-04-21 11:40:50,005][0m Trial 603 finished with value: 0.8181936300106802 and parameters: {'splitter': 'best', 'min_samples_split': 0.05911118564587096, 'min_samples_leaf': 0.03545152561867465, 'min_weight_fraction_leaf': 0.018323423638089684, 'max_features': 0.4053555189480321}. Best is trial 435 with value: 0.8271205444415821.[0m
/media/san2_ssd/data/Workdir/survival/utils.py:305: RuntimeWarning: invalid value encountered in true_divide
  pdfs = np.gradient(1-survs,axis=1)/norms
[32m[I 2022-04-21 11:40:50,520][0m Trial 604 finished with value: 0.819565148464398 and parameters: {'splitter': 'best', 'min_samples_split': 0.07497618148978381, 'min_samples_leaf': 0.01752567361090638, 'min_weight_fraction_leaf': 0.01072095626531625, 'max_features': 0.3610571934652769}. Best is trial 435 with value: 0.8271205444415821.[0m
[32m[I 2022-04-21 11:40:50,709][0m Trial 605 finished with value: 0.7897536840728916 and parameters: {'splitter': 'best', 'min_samples_split': 0.09980525887504063, 'min_samples_leaf': 0.08355598947451845, 'min_weight_fraction_leaf': 0.08990333066400123, 'max_features': 0.275416989033274}. Best is trial 435 with value: 0.8271205444415821.[0m
[32m[I 2022-04-21 11:40:50,999][0m Trial 606 finished with value: 0.6741016019553268 and parameters: {'splitter': 'best', 'min_samples_split': 0.042890556393546636, 'min_samples_leaf': 0.0261737310031937, 'min_weight_fraction_leaf': 0.24603807461401517, 'max_features': 0.6956814004295776}. Best is trial 435 with value: 0.8271205444415821.[0m
/media/san2_ssd/data/Workdir/survival/utils.py:305: RuntimeWarning: invalid value encountered in true_divide
  pdfs = np.gradient(1-survs,axis=1)/norms
[32m[I 2022-04-21 11:40:51,466][0m Trial 607 finished with value: 0.8108704633703084 and parameters: {'splitter': 'best', 'min_samples_split': 0.11739585395696238, 'min_samples_leaf': 0.014118886774436418, 'min_weight_fraction_leaf': 0.033556751148179464, 'max_features': 0.47190108950419096}. Best is trial 435 with value: 0.8271205444415821.[0m
[32m[I 2022-04-21 11:40:51,599][0m Trial 608 finished with value: 0.8124698892401018 and parameters: {'splitter': 'random', 'min_samples_split': 0.08889355369785926, 'min_samples_leaf': 0.04483069552097669, 'min_weight_fraction_leaf': 0.009103723729038572, 'max_features': 0.43147179649993334}. Best is trial 435 with value: 0.8271205444415821.[0m
[32m[I 2022-04-21 11:40:52,032][0m Trial 609 finished with value: 0.8060270176876468 and parameters: {'splitter': 'best', 'min_samples_split': 0.08040666765558785, 'min_samples_leaf': 0.00964120812256368, 'min_weight_fraction_leaf': 0.023473680548237653, 'max_features': 0.38242128834275047}. Best is trial 435 with value: 0.8271205444415821.[0m
[32m[I 2022-04-21 11:40:52,423][0m Trial 610 finished with value: 0.8069330409914649 and parameters: {'splitter': 'best', 'min_samples_split': 0.06430980448086664, 'min_samples_leaf': 0.024226717699517782, 'min_weight_fraction_leaf': 0.000198421070278861, 'max_features': 0.3434611868903315}. Best is trial 435 with value: 0.8271205444415821.[0m
[32m[I 2022-04-21 11:40:52,820][0m Trial 611 finished with value: 0.8231738920131318 and parameters: {'splitter': 'best', 'min_samples_split': 0.10589143494799746, 'min_samples_leaf': 0.033443473574737745, 'min_weight_fraction_leaf': 0.015855630407920783, 'max_features': 0.4935218715601916}. Best is trial 435 with value: 0.8271205444415821.[0m
[32m[I 2022-04-21 11:40:53,126][0m Trial 612 finished with value: 0.8001950751423197 and parameters: {'splitter': 'best', 'min_samples_split': 0.11228960606066563, 'min_samples_leaf': 0.05236443569728036, 'min_weight_fraction_leaf': 0.037429955598476325, 'max_features': 0.4950617466622061}. Best is trial 435 with value: 0.8271205444415821.[0m
[32m[I 2022-04-21 11:40:53,648][0m Trial 613 finished with value: 0.8272742335542386 and parameters: {'splitter': 'best', 'min_samples_split': 0.10491333901446817, 'min_samples_leaf': 0.03765027051791671, 'min_weight_fraction_leaf': 0.02695082627445406, 'max_features': 0.512756996520729}. Best is trial 613 with value: 0.8272742335542386.[0m
[32m[I 2022-04-21 11:40:54,286][0m Trial 614 finished with value: 0.8065620447260622 and parameters: {'splitter': 'best', 'min_samples_split': 0.10627238693204669, 'min_samples_leaf': 0.03410079759980285, 'min_weight_fraction_leaf': 0.05035302084885894, 'max_features': 0.5197868249689745}. Best is trial 613 with value: 0.8272742335542386.[0m
[32m[I 2022-04-21 11:40:54,950][0m Trial 615 finished with value: 0.8070986723178454 and parameters: {'splitter': 'best', 'min_samples_split': 0.11801754781997056, 'min_samples_leaf': 0.035434117117636624, 'min_weight_fraction_leaf': 0.045588120305077647, 'max_features': 0.5402695201665092}. Best is trial 613 with value: 0.8272742335542386.[0m
[32m[I 2022-04-21 11:40:55,748][0m Trial 616 finished with value: 0.8017746820441098 and parameters: {'splitter': 'best', 'min_samples_split': 0.1044436836005917, 'min_samples_leaf': 0.014346102663577187, 'min_weight_fraction_leaf': 0.037658708873523794, 'max_features': 0.532520357437006}. Best is trial 613 with value: 0.8272742335542386.[0m
[32m[I 2022-04-21 11:40:55,944][0m Trial 617 finished with value: 0.8096257296132462 and parameters: {'splitter': 'best', 'min_samples_split': 0.11276888781173966, 'min_samples_leaf': 0.15824600781124584, 'min_weight_fraction_leaf': 0.057893812809529356, 'max_features': 0.5053755999011073}. Best is trial 613 with value: 0.8272742335542386.[0m
[32m[I 2022-04-21 11:40:56,682][0m Trial 618 finished with value: 0.8082220810031953 and parameters: {'splitter': 'best', 'min_samples_split': 0.09640834307208797, 'min_samples_leaf': 0.0015382750969116614, 'min_weight_fraction_leaf': 0.030916231602151026, 'max_features': 0.5125625293397903}. Best is trial 613 with value: 0.8272742335542386.[0m
/media/san2_ssd/data/Workdir/survival/utils.py:305: RuntimeWarning: invalid value encountered in true_divide
  pdfs = np.gradient(1-survs,axis=1)/norms
[32m[I 2022-04-21 11:40:57,581][0m Trial 619 finished with value: 0.8153222879852071 and parameters: {'splitter': 'best', 'min_samples_split': 0.1027731925021638, 'min_samples_leaf': 0.030173074825605786, 'min_weight_fraction_leaf': 0.026636364058968836, 'max_features': 0.5413648212699896}. Best is trial 613 with value: 0.8272742335542386.[0m
[32m[I 2022-04-21 11:40:58,168][0m Trial 620 finished with value: 0.8150232724320372 and parameters: {'splitter': 'best', 'min_samples_split': 0.09598919816643456, 'min_samples_leaf': 0.018834363001326793, 'min_weight_fraction_leaf': 0.026575142772942695, 'max_features': 0.556157834975934}. Best is trial 613 with value: 0.8272742335542386.[0m
[32m[I 2022-04-21 11:40:58,524][0m Trial 621 finished with value: 0.8070652302011793 and parameters: {'splitter': 'best', 'min_samples_split': 0.1149607828839891, 'min_samples_leaf': 0.03855091045860269, 'min_weight_fraction_leaf': 0.04038815366694669, 'max_features': 0.47321261777591644}. Best is trial 613 with value: 0.8272742335542386.[0m
/media/san2_ssd/data/Workdir/survival/utils.py:305: RuntimeWarning: invalid value encountered in true_divide
  pdfs = np.gradient(1-survs,axis=1)/norms
[32m[I 2022-04-21 11:40:59,059][0m Trial 622 finished with value: 0.8210249744800894 and parameters: {'splitter': 'best', 'min_samples_split': 0.1278159529819689, 'min_samples_leaf': 0.0011072956225821294, 'min_weight_fraction_leaf': 0.021278809383517297, 'max_features': 0.48909285764936605}. Best is trial 613 with value: 0.8272742335542386.[0m
[32m[I 2022-04-21 11:41:00,047][0m Trial 623 finished with value: 0.8056324637575086 and parameters: {'splitter': 'best', 'min_samples_split': 0.12189339611130683, 'min_samples_leaf': 0.009432196499770465, 'min_weight_fraction_leaf': 0.03558991383883063, 'max_features': 0.5124942536583282}. Best is trial 613 with value: 0.8272742335542386.[0m
[32m[I 2022-04-21 11:41:01,162][0m Trial 624 finished with value: 0.8090414051093567 and parameters: {'splitter': 'best', 'min_samples_split': 0.12954522469478552, 'min_samples_leaf': 0.0010884053901942387, 'min_weight_fraction_leaf': 0.04656502444762904, 'max_features': 0.4980622465626892}. Best is trial 613 with value: 0.8272742335542386.[0m
/media/san2_ssd/data/Workdir/survival/utils.py:305: RuntimeWarning: invalid value encountered in true_divide
  pdfs = np.gradient(1-survs,axis=1)/norms
/media/san2_ssd/data/Workdir/survival/utils.py:305: RuntimeWarning: invalid value encountered in true_divide
  pdfs = np.gradient(1-survs,axis=1)/norms
[32m[I 2022-04-21 11:41:01,839][0m Trial 625 finished with value: 0.8085615012780277 and parameters: {'splitter': 'best', 'min_samples_split': 0.12748908001251866, 'min_samples_leaf': 0.016556876873708274, 'min_weight_fraction_leaf': 0.02398211526162556, 'max_features': 0.4853743367848078}. Best is trial 613 with value: 0.8272742335542386.[0m
[32m[I 2022-04-21 11:41:02,255][0m Trial 626 finished with value: 0.8130600723062317 and parameters: {'splitter': 'best', 'min_samples_split': 0.12264937536963508, 'min_samples_leaf': 0.025882752595451565, 'min_weight_fraction_leaf': 0.028256350777387643, 'max_features': 0.5218967287928706}. Best is trial 613 with value: 0.8272742335542386.[0m
[32m[I 2022-04-21 11:41:02,644][0m Trial 627 finished with value: 0.8117382484094439 and parameters: {'splitter': 'best', 'min_samples_split': 0.11034864018962728, 'min_samples_leaf': 0.010370665101114547, 'min_weight_fraction_leaf': 0.0641540851260912, 'max_features': 0.49122554954785214}. Best is trial 613 with value: 0.8272742335542386.[0m
/media/san2_ssd/data/Workdir/survival/utils.py:305: RuntimeWarning: invalid value encountered in true_divide
  pdfs = np.gradient(1-survs,axis=1)/norms
[32m[I 2022-04-21 11:41:03,208][0m Trial 628 finished with value: 0.8239935087135473 and parameters: {'splitter': 'best', 'min_samples_split': 0.11573915716367451, 'min_samples_leaf': 0.0013631922082316351, 'min_weight_fraction_leaf': 0.019390622243927885, 'max_features': 0.45358775192446305}. Best is trial 613 with value: 0.8272742335542386.[0m
/media/san2_ssd/data/Workdir/survival/utils.py:305: RuntimeWarning: invalid value encountered in true_divide
  pdfs = np.gradient(1-survs,axis=1)/norms
[32m[I 2022-04-21 11:41:03,672][0m Trial 629 finished with value: 0.8081816030097781 and parameters: {'splitter': 'best', 'min_samples_split': 0.1058261862409326, 'min_samples_leaf': 0.019681258255516223, 'min_weight_fraction_leaf': 0.018237768163748277, 'max_features': 0.4472804945519186}. Best is trial 613 with value: 0.8272742335542386.[0m
[32m[I 2022-04-21 11:41:03,951][0m Trial 630 finished with value: 0.8102467946387218 and parameters: {'splitter': 'best', 'min_samples_split': 0.1159945719078373, 'min_samples_leaf': 0.045271259134689046, 'min_weight_fraction_leaf': 0.03604871413142302, 'max_features': 0.44206497855902555}. Best is trial 613 with value: 0.8272742335542386.[0m
[32m[I 2022-04-21 11:41:04,287][0m Trial 631 finished with value: 0.8102099799862146 and parameters: {'splitter': 'best', 'min_samples_split': 0.10255555992994561, 'min_samples_leaf': 0.030113399494318023, 'min_weight_fraction_leaf': 0.01845833226677889, 'max_features': 0.44437527552758227}. Best is trial 613 with value: 0.8272742335542386.[0m
[32m[I 2022-04-21 11:41:04,764][0m Trial 632 finished with value: 0.8014711435308834 and parameters: {'splitter': 'best', 'min_samples_split': 0.09727403148047586, 'min_samples_leaf': 0.001199255690486286, 'min_weight_fraction_leaf': 0.029810634910706707, 'max_features': 0.4591953469959617}. Best is trial 613 with value: 0.8272742335542386.[0m
