[32m[I 2022-04-21 11:42:16,362][0m Trial 70 finished with value: 0.684367348820454 and parameters: {'alpha': 0.1472489443203946, 'ties': 'efron'}. Best is trial 26 with value: 0.6847054012696481.[0m
[32m[I 2022-04-21 11:42:16,495][0m Trial 71 finished with value: 0.6829090813866752 and parameters: {'alpha': 0.9220012427705202, 'ties': 'efron'}. Best is trial 26 with value: 0.6847054012696481.[0m
[32m[I 2022-04-21 11:42:16,628][0m Trial 72 finished with value: 0.684367348820454 and parameters: {'alpha': 0.6528614009458638, 'ties': 'efron'}. Best is trial 26 with value: 0.6847054012696481.[0m
[32m[I 2022-04-21 11:42:16,761][0m Trial 73 finished with value: 0.6847054012696481 and parameters: {'alpha': 0.7903097275517723, 'ties': 'efron'}. Best is trial 26 with value: 0.6847054012696481.[0m
[32m[I 2022-04-21 11:42:16,895][0m Trial 74 finished with value: 0.684367348820454 and parameters: {'alpha': 0.40718302268623213, 'ties': 'efron'}. Best is trial 26 with value: 0.6847054012696481.[0m
[32m[I 2022-04-21 11:42:17,067][0m Trial 75 finished with value: 0.6829090813866752 and parameters: {'alpha': 0.89293909613483, 'ties': 'efron'}. Best is trial 26 with value: 0.6847054012696481.[0m
[32m[I 2022-04-21 11:42:17,200][0m Trial 76 finished with value: 0.6829090813866752 and parameters: {'alpha': 1.5950467558416397, 'ties': 'efron'}. Best is trial 26 with value: 0.6847054012696481.[0m
[32m[I 2022-04-21 11:42:17,376][0m Trial 77 finished with value: 0.6829090813866752 and parameters: {'alpha': 1.2081317710456116, 'ties': 'efron'}. Best is trial 26 with value: 0.6847054012696481.[0m
[32m[I 2022-04-21 11:42:17,508][0m Trial 78 finished with value: 0.6847054012696481 and parameters: {'alpha': 0.7791326800142795, 'ties': 'efron'}. Best is trial 26 with value: 0.6847054012696481.[0m
[32m[I 2022-04-21 11:42:17,758][0m Trial 79 finished with value: 0.684367348820454 and parameters: {'alpha': 0.49354961252820234, 'ties': 'efron'}. Best is trial 26 with value: 0.6847054012696481.[0m
[32m[I 2022-04-21 11:42:17,883][0m Trial 80 finished with value: 0.6829090813866752 and parameters: {'alpha': 1.0294809047753075, 'ties': 'breslow'}. Best is trial 26 with value: 0.6847054012696481.[0m
[32m[I 2022-04-21 11:42:18,062][0m Trial 81 finished with value: 0.684367348820454 and parameters: {'alpha': 0.6715414150618938, 'ties': 'efron'}. Best is trial 26 with value: 0.6847054012696481.[0m
[32m[I 2022-04-21 11:42:18,310][0m Trial 82 finished with value: 0.6847054012696481 and parameters: {'alpha': 0.8183809086282657, 'ties': 'efron'}. Best is trial 26 with value: 0.6847054012696481.[0m
[32m[I 2022-04-21 11:42:18,537][0m Trial 83 finished with value: 0.6829090813866752 and parameters: {'alpha': 0.9346791586569928, 'ties': 'efron'}. Best is trial 26 with value: 0.6847054012696481.[0m
[32m[I 2022-04-21 11:42:18,885][0m Trial 84 finished with value: 0.6847054012696481 and parameters: {'alpha': 0.8375433453780423, 'ties': 'efron'}. Best is trial 26 with value: 0.6847054012696481.[0m
[32m[I 2022-04-21 11:42:19,158][0m Trial 85 finished with value: 0.684367348820454 and parameters: {'alpha': 0.23406139859014607, 'ties': 'efron'}. Best is trial 26 with value: 0.6847054012696481.[0m
[32m[I 2022-04-21 11:42:19,517][0m Trial 86 finished with value: 0.684367348820454 and parameters: {'alpha': 0.5669213114688341, 'ties': 'efron'}. Best is trial 26 with value: 0.6847054012696481.[0m
[32m[I 2022-04-21 11:42:19,906][0m Trial 87 finished with value: 0.6826116370301901 and parameters: {'alpha': 3.21457553470744, 'ties': 'efron'}. Best is trial 26 with value: 0.6847054012696481.[0m
[32m[I 2022-04-21 11:42:20,114][0m Trial 88 finished with value: 0.6847054012696481 and parameters: {'alpha': 0.7207001410948506, 'ties': 'efron'}. Best is trial 26 with value: 0.6847054012696481.[0m
[32m[I 2022-04-21 11:42:20,474][0m Trial 89 finished with value: 0.684367348820454 and parameters: {'alpha': 0.4061468010816093, 'ties': 'efron'}. Best is trial 26 with value: 0.6847054012696481.[0m
[32m[I 2022-04-21 11:42:20,635][0m Trial 90 finished with value: 0.6847054012696481 and parameters: {'alpha': 0.7347511210882209, 'ties': 'efron'}. Best is trial 26 with value: 0.6847054012696481.[0m
[32m[I 2022-04-21 11:42:20,869][0m Trial 91 finished with value: 0.6829090813866752 and parameters: {'alpha': 1.0230502387186338, 'ties': 'efron'}. Best is trial 26 with value: 0.6847054012696481.[0m
[32m[I 2022-04-21 11:42:21,021][0m Trial 92 finished with value: 0.6829090813866752 and parameters: {'alpha': 1.267045332826414, 'ties': 'efron'}. Best is trial 26 with value: 0.6847054012696481.[0m
[32m[I 2022-04-21 11:42:21,260][0m Trial 93 finished with value: 0.6829090813866752 and parameters: {'alpha': 1.1137155271971726, 'ties': 'efron'}. Best is trial 26 with value: 0.6847054012696481.[0m
[32m[I 2022-04-21 11:42:21,424][0m Trial 94 finished with value: 0.684367348820454 and parameters: {'alpha': 0.5235014312715772, 'ties': 'efron'}. Best is trial 26 with value: 0.6847054012696481.[0m
[32m[I 2022-04-21 11:42:21,655][0m Trial 95 finished with value: 0.6829090813866752 and parameters: {'alpha': 1.4942813189562942, 'ties': 'efron'}. Best is trial 26 with value: 0.6847054012696481.[0m
[32m[I 2022-04-21 11:42:21,954][0m Trial 96 finished with value: 0.6847054012696481 and parameters: {'alpha': 0.8278727279607356, 'ties': 'efron'}. Best is trial 26 with value: 0.6847054012696481.[0m
[32m[I 2022-04-21 11:42:22,183][0m Trial 97 finished with value: 0.6814469677485105 and parameters: {'alpha': 3.6560269971260455, 'ties': 'efron'}. Best is trial 26 with value: 0.6847054012696481.[0m
[32m[I 2022-04-21 11:42:22,500][0m Trial 98 finished with value: 0.6847054012696481 and parameters: {'alpha': 0.7599706864927747, 'ties': 'efron'}. Best is trial 26 with value: 0.6847054012696481.[0m
[32m[I 2022-04-21 11:42:22,865][0m Trial 99 finished with value: 0.684367348820454 and parameters: {'alpha': 0.07165775353782566, 'ties': 'breslow'}. Best is trial 26 with value: 0.6847054012696481.[0m
[32m[I 2022-04-21 11:42:23,017][0m Trial 100 finished with value: 0.6829496894793843 and parameters: {'alpha': 2.8740884686231016, 'ties': 'efron'}. Best is trial 26 with value: 0.6847054012696481.[0m
[32m[I 2022-04-21 11:42:23,341][0m Trial 101 finished with value: 0.684367348820454 and parameters: {'alpha': 0.6289013300991334, 'ties': 'efron'}. Best is trial 26 with value: 0.6847054012696481.[0m
[32m[I 2022-04-21 11:42:23,624][0m Trial 102 finished with value: 0.6829090813866752 and parameters: {'alpha': 0.9866357070689352, 'ties': 'efron'}. Best is trial 26 with value: 0.6847054012696481.[0m
[32m[I 2022-04-21 11:42:23,840][0m Trial 103 finished with value: 0.6829090813866752 and parameters: {'alpha': 0.8683953146019389, 'ties': 'efron'}. Best is trial 26 with value: 0.6847054012696481.[0m
[32m[I 2022-04-21 11:42:24,175][0m Trial 104 finished with value: 0.684367348820454 and parameters: {'alpha': 0.4131938358441989, 'ties': 'efron'}. Best is trial 26 with value: 0.6847054012696481.[0m
[32m[I 2022-04-21 11:42:24,488][0m Trial 105 finished with value: 0.6847054012696481 and parameters: {'alpha': 0.7687630827017518, 'ties': 'efron'}. Best is trial 26 with value: 0.6847054012696481.[0m
[32m[I 2022-04-21 11:42:24,889][0m Trial 106 finished with value: 0.6829090813866752 and parameters: {'alpha': 1.0756757310276635, 'ties': 'efron'}. Best is trial 26 with value: 0.6847054012696481.[0m
[32m[I 2022-04-21 11:42:25,029][0m Trial 107 finished with value: 0.6829090813866752 and parameters: {'alpha': 1.3139987129863568, 'ties': 'efron'}. Best is trial 26 with value: 0.6847054012696481.[0m
[32m[I 2022-04-21 11:42:25,165][0m Trial 108 finished with value: 0.684367348820454 and parameters: {'alpha': 0.6010230825937134, 'ties': 'efron'}. Best is trial 26 with value: 0.6847054012696481.[0m
[32m[I 2022-04-21 11:42:25,462][0m Trial 109 finished with value: 0.684367348820454 and parameters: {'alpha': 0.22834907030648555, 'ties': 'efron'}. Best is trial 26 with value: 0.6847054012696481.[0m
[32m[I 2022-04-21 11:42:25,596][0m Trial 110 finished with value: 0.682613451992282 and parameters: {'alpha': 2.296628644370683, 'ties': 'efron'}. Best is trial 26 with value: 0.6847054012696481.[0m
[32m[I 2022-04-21 11:42:25,890][0m Trial 111 finished with value: 0.6847054012696481 and parameters: {'alpha': 0.8061687850909522, 'ties': 'efron'}. Best is trial 26 with value: 0.6847054012696481.[0m
[32m[I 2022-04-21 11:42:26,225][0m Trial 112 finished with value: 0.6829090813866752 and parameters: {'alpha': 0.9820156744050532, 'ties': 'efron'}. Best is trial 26 with value: 0.6847054012696481.[0m
[32m[I 2022-04-21 11:42:26,600][0m Trial 113 finished with value: 0.6829090813866752 and parameters: {'alpha': 0.8986441955093203, 'ties': 'efron'}. Best is trial 26 with value: 0.6847054012696481.[0m
[32m[I 2022-04-21 11:42:26,960][0m Trial 114 finished with value: 0.6847054012696481 and parameters: {'alpha': 0.7276028317873925, 'ties': 'efron'}. Best is trial 26 with value: 0.6847054012696481.[0m
[32m[I 2022-04-21 11:42:27,294][0m Trial 115 finished with value: 0.684367348820454 and parameters: {'alpha': 0.6723062892810097, 'ties': 'efron'}. Best is trial 26 with value: 0.6847054012696481.[0m
[32m[I 2022-04-21 11:42:27,603][0m Trial 116 finished with value: 0.6829090813866752 and parameters: {'alpha': 1.1657948147829962, 'ties': 'breslow'}. Best is trial 26 with value: 0.6847054012696481.[0m
[32m[I 2022-04-21 11:42:27,955][0m Trial 117 finished with value: 0.684367348820454 and parameters: {'alpha': 0.5028177297344347, 'ties': 'efron'}. Best is trial 26 with value: 0.6847054012696481.[0m
[32m[I 2022-04-21 11:42:28,325][0m Trial 118 finished with value: 0.6847054012696481 and parameters: {'alpha': 0.6974877377021464, 'ties': 'efron'}. Best is trial 26 with value: 0.6847054012696481.[0m
[32m[I 2022-04-21 11:42:28,700][0m Trial 119 finished with value: 0.684367348820454 and parameters: {'alpha': 0.6167792529269263, 'ties': 'efron'}. Best is trial 26 with value: 0.6847054012696481.[0m
[32m[I 2022-04-21 11:42:28,965][0m Trial 120 finished with value: 0.684367348820454 and parameters: {'alpha': 0.3397825996617979, 'ties': 'efron'}. Best is trial 26 with value: 0.6847054012696481.[0m
[32m[I 2022-04-21 11:42:29,098][0m Trial 121 finished with value: 0.6847054012696481 and parameters: {'alpha': 0.7522384030103098, 'ties': 'efron'}. Best is trial 26 with value: 0.6847054012696481.[0m
[32m[I 2022-04-21 11:42:29,479][0m Trial 122 finished with value: 0.6829090813866752 and parameters: {'alpha': 0.9353124836775045, 'ties': 'efron'}. Best is trial 26 with value: 0.6847054012696481.[0m
[32m[I 2022-04-21 11:42:29,662][0m Trial 123 finished with value: 0.6847054012696481 and parameters: {'alpha': 0.8476743560083472, 'ties': 'efron'}. Best is trial 26 with value: 0.6847054012696481.[0m
[32m[I 2022-04-21 11:42:30,065][0m Trial 124 finished with value: 0.6829090813866752 and parameters: {'alpha': 1.0762681289844442, 'ties': 'efron'}. Best is trial 26 with value: 0.6847054012696481.[0m
[32m[I 2022-04-21 11:42:30,398][0m Trial 125 finished with value: 0.6829090813866752 and parameters: {'alpha': 1.2070235428128493, 'ties': 'efron'}. Best is trial 26 with value: 0.6847054012696481.[0m
[32m[I 2022-04-21 11:42:30,666][0m Trial 126 finished with value: 0.6847054012696481 and parameters: {'alpha': 0.8485923511543813, 'ties': 'efron'}. Best is trial 26 with value: 0.6847054012696481.[0m
[32m[I 2022-04-21 11:42:30,937][0m Trial 127 finished with value: 0.684367348820454 and parameters: {'alpha': 0.4808951582096245, 'ties': 'efron'}. Best is trial 26 with value: 0.6847054012696481.[0m
[32m[I 2022-04-21 11:42:31,138][0m Trial 128 finished with value: 0.6847054012696481 and parameters: {'alpha': 0.7315408930167335, 'ties': 'efron'}. Best is trial 26 with value: 0.6847054012696481.[0m
[32m[I 2022-04-21 11:42:31,356][0m Trial 129 finished with value: 0.6829090813866752 and parameters: {'alpha': 0.9490024711512097, 'ties': 'efron'}. Best is trial 26 with value: 0.6847054012696481.[0m
[32m[I 2022-04-21 11:42:31,489][0m Trial 130 finished with value: 0.684367348820454 and parameters: {'alpha': 0.5307519780687429, 'ties': 'efron'}. Best is trial 26 with value: 0.6847054012696481.[0m
[32m[I 2022-04-21 11:42:31,660][0m Trial 131 finished with value: 0.6847054012696481 and parameters: {'alpha': 0.8150645334215701, 'ties': 'efron'}. Best is trial 26 with value: 0.6847054012696481.[0m
[32m[I 2022-04-21 11:42:31,794][0m Trial 132 finished with value: 0.684367348820454 and parameters: {'alpha': 0.6175116761617861, 'ties': 'efron'}. Best is trial 26 with value: 0.6847054012696481.[0m
[32m[I 2022-04-21 11:42:32,060][0m Trial 133 finished with value: 0.6847054012696481 and parameters: {'alpha': 0.8001028448856558, 'ties': 'efron'}. Best is trial 26 with value: 0.6847054012696481.[0m
[32m[I 2022-04-21 11:42:32,333][0m Trial 134 finished with value: 0.684367348820454 and parameters: {'alpha': 0.6827353237439426, 'ties': 'efron'}. Best is trial 26 with value: 0.6847054012696481.[0m
[32m[I 2022-04-21 11:42:32,595][0m Trial 135 finished with value: 0.684367348820454 and parameters: {'alpha': 0.4026269720235396, 'ties': 'efron'}. Best is trial 26 with value: 0.6847054012696481.[0m
[32m[I 2022-04-21 11:42:32,843][0m Trial 136 finished with value: 0.6829090813866752 and parameters: {'alpha': 1.0418882425891156, 'ties': 'breslow'}. Best is trial 26 with value: 0.6847054012696481.[0m
[32m[I 2022-04-21 11:42:33,024][0m Trial 137 finished with value: 0.6847054012696481 and parameters: {'alpha': 0.6975720205239719, 'ties': 'efron'}. Best is trial 26 with value: 0.6847054012696481.[0m
[32m[I 2022-04-21 11:42:33,310][0m Trial 138 finished with value: 0.6847054012696481 and parameters: {'alpha': 0.7481135120305737, 'ties': 'efron'}. Best is trial 26 with value: 0.6847054012696481.[0m
[32m[I 2022-04-21 11:42:33,470][0m Trial 139 finished with value: 0.684367348820454 and parameters: {'alpha': 0.27552037987617817, 'ties': 'efron'}. Best is trial 26 with value: 0.6847054012696481.[0m
[32m[I 2022-04-21 11:42:33,720][0m Trial 140 finished with value: 0.6829090813866752 and parameters: {'alpha': 0.8780123227121212, 'ties': 'efron'}. Best is trial 26 with value: 0.6847054012696481.[0m
[32m[I 2022-04-21 11:42:33,852][0m Trial 141 finished with value: 0.684367348820454 and parameters: {'alpha': 0.5698121351131671, 'ties': 'efron'}. Best is trial 26 with value: 0.6847054012696481.[0m
[32m[I 2022-04-21 11:42:33,984][0m Trial 142 finished with value: 0.6829090813866752 and parameters: {'alpha': 0.9787423095860354, 'ties': 'efron'}. Best is trial 26 with value: 0.6847054012696481.[0m
[32m[I 2022-04-21 11:42:34,199][0m Trial 143 finished with value: 0.6847054012696481 and parameters: {'alpha': 0.8476586613410079, 'ties': 'efron'}. Best is trial 26 with value: 0.6847054012696481.[0m
[32m[I 2022-04-21 11:42:34,475][0m Trial 144 finished with value: 0.6847054012696481 and parameters: {'alpha': 0.8509684666195151, 'ties': 'efron'}. Best is trial 26 with value: 0.6847054012696481.[0m
[32m[I 2022-04-21 11:42:34,724][0m Trial 145 finished with value: 0.6829090813866752 and parameters: {'alpha': 1.1112604462055373, 'ties': 'efron'}. Best is trial 26 with value: 0.6847054012696481.[0m
[32m[I 2022-04-21 11:42:34,880][0m Trial 146 finished with value: 0.684367348820454 and parameters: {'alpha': 0.6930224367321993, 'ties': 'efron'}. Best is trial 26 with value: 0.6847054012696481.[0m
[32m[I 2022-04-21 11:42:35,013][0m Trial 147 finished with value: 0.6829090813866752 and parameters: {'alpha': 0.9972923472417896, 'ties': 'efron'}. Best is trial 26 with value: 0.6847054012696481.[0m
[32m[I 2022-04-21 11:42:35,148][0m Trial 148 finished with value: 0.6814469677485105 and parameters: {'alpha': 4.584710414502537, 'ties': 'efron'}. Best is trial 26 with value: 0.6847054012696481.[0m
[32m[I 2022-04-21 11:42:35,305][0m Trial 149 finished with value: 0.6847054012696481 and parameters: {'alpha': 0.7947386631951714, 'ties': 'efron'}. Best is trial 26 with value: 0.6847054012696481.[0m
[32m[I 2022-04-21 11:42:35,554][0m Trial 150 finished with value: 0.684367348820454 and parameters: {'alpha': 0.45166984544317046, 'ties': 'efron'}. Best is trial 26 with value: 0.6847054012696481.[0m
[32m[I 2022-04-21 11:42:35,775][0m Trial 151 finished with value: 0.684367348820454 and parameters: {'alpha': 0.6416037679794604, 'ties': 'efron'}. Best is trial 26 with value: 0.6847054012696481.[0m
[32m[I 2022-04-21 11:42:35,991][0m Trial 152 finished with value: 0.6829090813866752 and parameters: {'alpha': 0.8973525158593831, 'ties': 'efron'}. Best is trial 26 with value: 0.6847054012696481.[0m
[32m[I 2022-04-21 11:42:36,209][0m Trial 153 finished with value: 0.6847054012696481 and parameters: {'alpha': 0.7956803765439621, 'ties': 'efron'}. Best is trial 26 with value: 0.6847054012696481.[0m
[32m[I 2022-04-21 11:42:36,429][0m Trial 154 finished with value: 0.6847054012696481 and parameters: {'alpha': 0.7514958649203377, 'ties': 'efron'}. Best is trial 26 with value: 0.6847054012696481.[0m
[32m[I 2022-04-21 11:42:36,561][0m Trial 155 finished with value: 0.6847054012696481 and parameters: {'alpha': 0.7168113098397353, 'ties': 'efron'}. Best is trial 26 with value: 0.6847054012696481.[0m
[32m[I 2022-04-21 11:42:36,693][0m Trial 156 finished with value: 0.684367348820454 and parameters: {'alpha': 0.5526149234090975, 'ties': 'efron'}. Best is trial 26 with value: 0.6847054012696481.[0m
[32m[I 2022-04-21 11:42:36,824][0m Trial 157 finished with value: 0.684367348820454 and parameters: {'alpha': 0.6140517052535204, 'ties': 'efron'}. Best is trial 26 with value: 0.6847054012696481.[0m
[32m[I 2022-04-21 11:42:36,956][0m Trial 158 finished with value: 0.6847054012696481 and parameters: {'alpha': 0.7003097515975215, 'ties': 'efron'}. Best is trial 26 with value: 0.6847054012696481.[0m
[32m[I 2022-04-21 11:42:37,077][0m Trial 159 finished with value: 0.6829090813866752 and parameters: {'alpha': 1.2034724299811552, 'ties': 'breslow'}. Best is trial 26 with value: 0.6847054012696481.[0m
[32m[I 2022-04-21 11:42:37,210][0m Trial 160 finished with value: 0.6829090813866752 and parameters: {'alpha': 0.9789476765158545, 'ties': 'efron'}. Best is trial 26 with value: 0.6847054012696481.[0m
[32m[I 2022-04-21 11:42:37,341][0m Trial 161 finished with value: 0.6847054012696481 and parameters: {'alpha': 0.8282524993073945, 'ties': 'efron'}. Best is trial 26 with value: 0.6847054012696481.[0m
[32m[I 2022-04-21 11:42:37,583][0m Trial 162 finished with value: 0.6847054012696481 and parameters: {'alpha': 0.8391156078504165, 'ties': 'efron'}. Best is trial 26 with value: 0.6847054012696481.[0m
[32m[I 2022-04-21 11:42:37,716][0m Trial 163 finished with value: 0.6847054012696481 and parameters: {'alpha': 0.7447740972357019, 'ties': 'efron'}. Best is trial 26 with value: 0.6847054012696481.[0m
[32m[I 2022-04-21 11:42:37,847][0m Trial 164 finished with value: 0.6832683453632697 and parameters: {'alpha': 1.9504934025973908, 'ties': 'efron'}. Best is trial 26 with value: 0.6847054012696481.[0m
[32m[I 2022-04-21 11:42:38,018][0m Trial 165 finished with value: 0.6829090813866752 and parameters: {'alpha': 0.9088771287321051, 'ties': 'efron'}. Best is trial 26 with value: 0.6847054012696481.[0m
[32m[I 2022-04-21 11:42:38,188][0m Trial 166 finished with value: 0.6829090813866752 and parameters: {'alpha': 1.1205989121122004, 'ties': 'efron'}. Best is trial 26 with value: 0.6847054012696481.[0m
[32m[I 2022-04-21 11:42:38,372][0m Trial 167 finished with value: 0.6829090813866752 and parameters: {'alpha': 1.0288560890282301, 'ties': 'efron'}. Best is trial 26 with value: 0.6847054012696481.[0m
[32m[I 2022-04-21 11:42:38,624][0m Trial 168 finished with value: 0.684367348820454 and parameters: {'alpha': 0.4746213072545546, 'ties': 'efron'}. Best is trial 26 with value: 0.6847054012696481.[0m
[32m[I 2022-04-21 11:42:38,910][0m Trial 169 finished with value: 0.684367348820454 and parameters: {'alpha': 0.5475520474931431, 'ties': 'efron'}. Best is trial 26 with value: 0.6847054012696481.[0m
[32m[I 2022-04-21 11:42:39,327][0m Trial 170 finished with value: 0.684367348820454 and parameters: {'alpha': 0.6804062362189426, 'ties': 'efron'}. Best is trial 26 with value: 0.6847054012696481.[0m
[32m[I 2022-04-21 11:42:39,615][0m Trial 171 finished with value: 0.6847054012696481 and parameters: {'alpha': 0.771870239667246, 'ties': 'efron'}. Best is trial 26 with value: 0.6847054012696481.[0m
[32m[I 2022-04-21 11:42:39,940][0m Trial 172 finished with value: 0.6847054012696481 and parameters: {'alpha': 0.7648782304076855, 'ties': 'efron'}. Best is trial 26 with value: 0.6847054012696481.[0m
[32m[I 2022-04-21 11:42:40,136][0m Trial 173 finished with value: 0.6829090813866752 and parameters: {'alpha': 0.9360851133985477, 'ties': 'efron'}. Best is trial 26 with value: 0.6847054012696481.[0m
[32m[I 2022-04-21 11:42:40,286][0m Trial 174 finished with value: 0.6829090813866752 and parameters: {'alpha': 0.908918229048407, 'ties': 'efron'}. Best is trial 26 with value: 0.6847054012696481.[0m
[32m[I 2022-04-21 11:42:40,418][0m Trial 175 finished with value: 0.6847054012696481 and parameters: {'alpha': 0.7111838107665915, 'ties': 'efron'}. Best is trial 26 with value: 0.6847054012696481.[0m
[32m[I 2022-04-21 11:42:40,554][0m Trial 176 finished with value: 0.684367348820454 and parameters: {'alpha': 0.6191720243846297, 'ties': 'efron'}. Best is trial 26 with value: 0.6847054012696481.[0m
[32m[I 2022-04-21 11:42:40,826][0m Trial 177 finished with value: 0.6847054012696481 and parameters: {'alpha': 0.7996696192249824, 'ties': 'efron'}. Best is trial 26 with value: 0.6847054012696481.[0m
