[32m[I 2022-04-21 11:38:08,652][0m Trial 379 finished with value: 0.8372056682096674 and parameters: {'splitter': 'best', 'min_samples_split': 0.268384111587778, 'min_samples_leaf': 0.028304188885842994, 'min_weight_fraction_leaf': 0.04130697243790179, 'max_features': 0.937569564555254}. Best is trial 272 with value: 0.8386029278581782.[0m
[32m[I 2022-04-21 11:38:08,720][0m Trial 380 finished with value: 0.8372023218910313 and parameters: {'splitter': 'best', 'min_samples_split': 0.26563992792834407, 'min_samples_leaf': 0.03542787439754106, 'min_weight_fraction_leaf': 0.04549538832416752, 'max_features': 0.9024645938602339}. Best is trial 272 with value: 0.8386029278581782.[0m
[32m[I 2022-04-21 11:38:08,812][0m Trial 381 finished with value: 0.8372023218910313 and parameters: {'splitter': 'best', 'min_samples_split': 0.2748133898576881, 'min_samples_leaf': 0.02891355627534277, 'min_weight_fraction_leaf': 0.04851861801876026, 'max_features': 0.9112599512725387}. Best is trial 272 with value: 0.8386029278581782.[0m
[32m[I 2022-04-21 11:38:08,897][0m Trial 382 finished with value: 0.8356635755294366 and parameters: {'splitter': 'best', 'min_samples_split': 0.2659416789549548, 'min_samples_leaf': 0.026271297196800568, 'min_weight_fraction_leaf': 0.06267118387084301, 'max_features': 0.8882044874804469}. Best is trial 272 with value: 0.8386029278581782.[0m
[32m[I 2022-04-21 11:38:08,995][0m Trial 383 finished with value: 0.8356635755294366 and parameters: {'splitter': 'best', 'min_samples_split': 0.27488070122526176, 'min_samples_leaf': 0.02414460691483348, 'min_weight_fraction_leaf': 0.06854218413914813, 'max_features': 0.9157626683027585}. Best is trial 272 with value: 0.8386029278581782.[0m
[32m[I 2022-04-21 11:38:09,077][0m Trial 384 finished with value: 0.8366387387566654 and parameters: {'splitter': 'best', 'min_samples_split': 0.2849542030266069, 'min_samples_leaf': 0.03263447957345855, 'min_weight_fraction_leaf': 0.045681214274899, 'max_features': 0.8791685999793565}. Best is trial 272 with value: 0.8386029278581782.[0m
[32m[I 2022-04-21 11:38:09,158][0m Trial 385 finished with value: 0.8363268199688415 and parameters: {'splitter': 'best', 'min_samples_split': 0.2822812525015643, 'min_samples_leaf': 0.026388367976518667, 'min_weight_fraction_leaf': 0.05110727862428019, 'max_features': 0.9004220144554733}. Best is trial 272 with value: 0.8386029278581782.[0m
[32m[I 2022-04-21 11:38:09,244][0m Trial 386 finished with value: 0.8347180703991794 and parameters: {'splitter': 'best', 'min_samples_split': 0.29248147074220276, 'min_samples_leaf': 0.03610890568171228, 'min_weight_fraction_leaf': 0.044444458657748875, 'max_features': 0.9033890391883439}. Best is trial 272 with value: 0.8386029278581782.[0m
[32m[I 2022-04-21 11:38:09,319][0m Trial 387 finished with value: 0.8372056682096674 and parameters: {'splitter': 'best', 'min_samples_split': 0.27207801138576054, 'min_samples_leaf': 0.032132283592106806, 'min_weight_fraction_leaf': 0.04033333530708253, 'max_features': 0.9124833161757592}. Best is trial 272 with value: 0.8386029278581782.[0m
[32m[I 2022-04-21 11:38:09,398][0m Trial 388 finished with value: 0.8363268199688415 and parameters: {'splitter': 'best', 'min_samples_split': 0.2731534946692543, 'min_samples_leaf': 0.025481910956846356, 'min_weight_fraction_leaf': 0.061591366307795534, 'max_features': 0.8503432289796473}. Best is trial 272 with value: 0.8386029278581782.[0m
[32m[I 2022-04-21 11:38:09,471][0m Trial 389 finished with value: 0.8353625209248602 and parameters: {'splitter': 'random', 'min_samples_split': 0.2666062589190641, 'min_samples_leaf': 0.03360888901894553, 'min_weight_fraction_leaf': 0.05156361961984747, 'max_features': 0.8670258476159906}. Best is trial 272 with value: 0.8386029278581782.[0m
[32m[I 2022-04-21 11:38:09,559][0m Trial 390 finished with value: 0.8372056682096674 and parameters: {'splitter': 'best', 'min_samples_split': 0.25883066902186036, 'min_samples_leaf': 0.02108866853119712, 'min_weight_fraction_leaf': 0.04063843368175111, 'max_features': 0.937593859338793}. Best is trial 272 with value: 0.8386029278581782.[0m
[32m[I 2022-04-21 11:38:09,641][0m Trial 391 finished with value: 0.8359946375562541 and parameters: {'splitter': 'best', 'min_samples_split': 0.27032061195122803, 'min_samples_leaf': 0.016781331267103867, 'min_weight_fraction_leaf': 0.07467236331052923, 'max_features': 0.8851608912635858}. Best is trial 272 with value: 0.8386029278581782.[0m
[32m[I 2022-04-21 11:38:09,738][0m Trial 392 finished with value: 0.8363268199688415 and parameters: {'splitter': 'best', 'min_samples_split': 0.2568281300488903, 'min_samples_leaf': 0.02099045624788185, 'min_weight_fraction_leaf': 0.05126015495266791, 'max_features': 0.9158271347679626}. Best is trial 272 with value: 0.8386029278581782.[0m
[32m[I 2022-04-21 11:38:09,836][0m Trial 393 finished with value: 0.8342906427915446 and parameters: {'splitter': 'best', 'min_samples_split': 0.104378169079412, 'min_samples_leaf': 0.029400790892982476, 'min_weight_fraction_leaf': 0.0408780575504512, 'max_features': 0.8970033827936346}. Best is trial 272 with value: 0.8386029278581782.[0m
[32m[I 2022-04-21 11:38:09,958][0m Trial 394 finished with value: 0.8372056682096674 and parameters: {'splitter': 'best', 'min_samples_split': 0.27725827395574315, 'min_samples_leaf': 0.039161650946728986, 'min_weight_fraction_leaf': 0.03893994273177891, 'max_features': 0.9012804018862494}. Best is trial 272 with value: 0.8386029278581782.[0m
[32m[I 2022-04-21 11:38:10,039][0m Trial 395 finished with value: 0.8363268199688415 and parameters: {'splitter': 'best', 'min_samples_split': 0.27826810758795206, 'min_samples_leaf': 0.013702621744230713, 'min_weight_fraction_leaf': 0.051302599604592505, 'max_features': 0.9116830203284964}. Best is trial 272 with value: 0.8386029278581782.[0m
[32m[I 2022-04-21 11:38:10,123][0m Trial 396 finished with value: 0.8347214167178155 and parameters: {'splitter': 'best', 'min_samples_split': 0.297734839501918, 'min_samples_leaf': 0.03754610026391887, 'min_weight_fraction_leaf': 0.039608686239140316, 'max_features': 0.9018184524955121}. Best is trial 272 with value: 0.8386029278581782.[0m
[32m[I 2022-04-21 11:38:10,206][0m Trial 397 finished with value: 0.8180388147131256 and parameters: {'splitter': 'best', 'min_samples_split': 0.2570062068216034, 'min_samples_leaf': 0.02945144497317163, 'min_weight_fraction_leaf': 0.057842636796176336, 'max_features': 0.5420050156396554}. Best is trial 272 with value: 0.8386029278581782.[0m
[32m[I 2022-04-21 11:38:10,291][0m Trial 398 finished with value: 0.8356635755294366 and parameters: {'splitter': 'best', 'min_samples_split': 0.2779773435498951, 'min_samples_leaf': 0.02040785416741053, 'min_weight_fraction_leaf': 0.0634519877451447, 'max_features': 0.8776975035100041}. Best is trial 272 with value: 0.8386029278581782.[0m
[32m[I 2022-04-21 11:38:10,381][0m Trial 399 finished with value: 0.8366387387566654 and parameters: {'splitter': 'best', 'min_samples_split': 0.28903688772842456, 'min_samples_leaf': 0.0369852094811894, 'min_weight_fraction_leaf': 0.042266933803301356, 'max_features': 0.9259635796317356}. Best is trial 272 with value: 0.8386029278581782.[0m
[32m[I 2022-04-21 11:38:10,459][0m Trial 400 finished with value: 0.8318869790887286 and parameters: {'splitter': 'best', 'min_samples_split': 0.27066807231724455, 'min_samples_leaf': 0.04327317039033379, 'min_weight_fraction_leaf': 0.08245241464023362, 'max_features': 0.7415373614287138}. Best is trial 272 with value: 0.8386029278581782.[0m
[32m[I 2022-04-21 11:38:10,534][0m Trial 401 finished with value: 0.8366140764235777 and parameters: {'splitter': 'best', 'min_samples_split': 0.25691681180362014, 'min_samples_leaf': 0.019281091357740643, 'min_weight_fraction_leaf': 0.037019700697491914, 'max_features': 0.9273071679507988}. Best is trial 272 with value: 0.8386029278581782.[0m
[32m[I 2022-04-21 11:38:10,608][0m Trial 402 finished with value: 0.8322247700989613 and parameters: {'splitter': 'best', 'min_samples_split': 0.2814823431363669, 'min_samples_leaf': 0.1432010931753126, 'min_weight_fraction_leaf': 0.04694377676418286, 'max_features': 0.9079600770779761}. Best is trial 272 with value: 0.8386029278581782.[0m
[32m[I 2022-04-21 11:38:10,691][0m Trial 403 finished with value: 0.8356635755294366 and parameters: {'splitter': 'best', 'min_samples_split': 0.26405959021376363, 'min_samples_leaf': 0.040323476281311284, 'min_weight_fraction_leaf': 0.06790079185239614, 'max_features': 0.873499985698684}. Best is trial 272 with value: 0.8386029278581782.[0m
[32m[I 2022-04-21 11:38:10,759][0m Trial 404 finished with value: 0.8348296597447723 and parameters: {'splitter': 'best', 'min_samples_split': 0.30167554396642177, 'min_samples_leaf': 0.030660747484702988, 'min_weight_fraction_leaf': 0.03609938839713251, 'max_features': 0.9325202138882837}. Best is trial 272 with value: 0.8386029278581782.[0m
[32m[I 2022-04-21 11:38:10,841][0m Trial 405 finished with value: 0.8363268199688415 and parameters: {'splitter': 'best', 'min_samples_split': 0.2707009083334107, 'min_samples_leaf': 0.04091242018347554, 'min_weight_fraction_leaf': 0.058223196719303004, 'max_features': 0.936906345589246}. Best is trial 272 with value: 0.8386029278581782.[0m
[32m[I 2022-04-21 11:38:10,931][0m Trial 406 finished with value: 0.8372023218910313 and parameters: {'splitter': 'best', 'min_samples_split': 0.2513292359486373, 'min_samples_leaf': 0.013552830524280305, 'min_weight_fraction_leaf': 0.04670008915029859, 'max_features': 0.8925927595961602}. Best is trial 272 with value: 0.8386029278581782.[0m
[32m[I 2022-04-21 11:38:10,995][0m Trial 407 finished with value: 0.8363268199688415 and parameters: {'splitter': 'best', 'min_samples_split': 0.25093573995854107, 'min_samples_leaf': 0.00996608223399701, 'min_weight_fraction_leaf': 0.05037442666645385, 'max_features': 0.9027720629824207}. Best is trial 272 with value: 0.8386029278581782.[0m
[32m[I 2022-04-21 11:38:11,087][0m Trial 408 finished with value: 0.8340916358958348 and parameters: {'splitter': 'best', 'min_samples_split': 0.0690939868977263, 'min_samples_leaf': 0.0053735037132073595, 'min_weight_fraction_leaf': 0.04548666799422859, 'max_features': 0.8613462625948807}. Best is trial 272 with value: 0.8386029278581782.[0m
[32m[I 2022-04-21 11:38:11,169][0m Trial 409 finished with value: 0.8363902693902048 and parameters: {'splitter': 'random', 'min_samples_split': 0.2912105752929406, 'min_samples_leaf': 0.02536914465754083, 'min_weight_fraction_leaf': 0.06033442325476329, 'max_features': 0.8297181761058815}. Best is trial 272 with value: 0.8386029278581782.[0m
[32m[I 2022-04-21 11:38:11,240][0m Trial 410 finished with value: 0.8372056682096674 and parameters: {'splitter': 'best', 'min_samples_split': 0.2613383491153614, 'min_samples_leaf': 0.014277132263957049, 'min_weight_fraction_leaf': 0.03548452015886436, 'max_features': 0.9003047948436094}. Best is trial 272 with value: 0.8386029278581782.[0m
[32m[I 2022-04-21 11:38:11,314][0m Trial 411 finished with value: 0.65 and parameters: {'splitter': 'best', 'min_samples_split': 0.2612814432092687, 'min_samples_leaf': 0.012710987969199486, 'min_weight_fraction_leaf': 0.41765003689293384, 'max_features': 0.8858401860093543}. Best is trial 272 with value: 0.8386029278581782.[0m
[32m[I 2022-04-21 11:38:11,387][0m Trial 412 finished with value: 0.8372056682096674 and parameters: {'splitter': 'best', 'min_samples_split': 0.27232402171494596, 'min_samples_leaf': 0.00909223653984026, 'min_weight_fraction_leaf': 0.03629228212312614, 'max_features': 0.8907409630837628}. Best is trial 272 with value: 0.8386029278581782.[0m
[32m[I 2022-04-21 11:38:11,459][0m Trial 413 finished with value: 0.8374751161921132 and parameters: {'splitter': 'best', 'min_samples_split': 0.27099830228169763, 'min_samples_leaf': 0.0017293446009292446, 'min_weight_fraction_leaf': 0.03037212071618505, 'max_features': 0.8977857806198722}. Best is trial 272 with value: 0.8386029278581782.[0m
[32m[I 2022-04-21 11:38:11,540][0m Trial 414 finished with value: 0.8372056682096674 and parameters: {'splitter': 'best', 'min_samples_split': 0.27369856355579913, 'min_samples_leaf': 0.009004321213981696, 'min_weight_fraction_leaf': 0.03570055241325871, 'max_features': 0.8761151768666156}. Best is trial 272 with value: 0.8386029278581782.[0m
[32m[I 2022-04-21 11:38:11,629][0m Trial 415 finished with value: 0.8369115330577473 and parameters: {'splitter': 'best', 'min_samples_split': 0.2781287819709851, 'min_samples_leaf': 0.005900520012378353, 'min_weight_fraction_leaf': 0.033930261191284394, 'max_features': 0.8524965179838393}. Best is trial 272 with value: 0.8386029278581782.[0m
[32m[I 2022-04-21 11:38:11,835][0m Trial 416 finished with value: 0.8372056682096674 and parameters: {'splitter': 'best', 'min_samples_split': 0.2687343424278195, 'min_samples_leaf': 0.0041502992337996624, 'min_weight_fraction_leaf': 0.03921065742827116, 'max_features': 0.8866799705390306}. Best is trial 272 with value: 0.8386029278581782.[0m
[32m[I 2022-04-21 11:38:12,045][0m Trial 417 finished with value: 0.8372056682096674 and parameters: {'splitter': 'best', 'min_samples_split': 0.2717600295459384, 'min_samples_leaf': 0.0026730693921085845, 'min_weight_fraction_leaf': 0.040281115287779785, 'max_features': 0.8653440784343105}. Best is trial 272 with value: 0.8386029278581782.[0m
[32m[I 2022-04-21 11:38:12,235][0m Trial 418 finished with value: 0.8372056682096674 and parameters: {'splitter': 'best', 'min_samples_split': 0.2677759420465582, 'min_samples_leaf': 0.01645627192706025, 'min_weight_fraction_leaf': 0.03529124502612631, 'max_features': 0.8813932477714508}. Best is trial 272 with value: 0.8386029278581782.[0m
[32m[I 2022-04-21 11:38:12,392][0m Trial 419 finished with value: 0.8366420850753015 and parameters: {'splitter': 'best', 'min_samples_split': 0.28187094354016146, 'min_samples_leaf': 0.003827242438936, 'min_weight_fraction_leaf': 0.038803090998154946, 'max_features': 0.8633237819701416}. Best is trial 272 with value: 0.8386029278581782.[0m
[32m[I 2022-04-21 11:38:12,583][0m Trial 420 finished with value: 0.8374751161921132 and parameters: {'splitter': 'best', 'min_samples_split': 0.264197204185739, 'min_samples_leaf': 0.004353101196345716, 'min_weight_fraction_leaf': 0.03159746730907334, 'max_features': 0.852031179277438}. Best is trial 272 with value: 0.8386029278581782.[0m
[32m[I 2022-04-21 11:38:12,688][0m Trial 421 finished with value: 0.8373240128006764 and parameters: {'splitter': 'best', 'min_samples_split': 0.2670129267311164, 'min_samples_leaf': 0.002380059351065558, 'min_weight_fraction_leaf': 0.03992458557963649, 'max_features': 0.7871375121208889}. Best is trial 272 with value: 0.8386029278581782.[0m
[32m[I 2022-04-21 11:38:12,786][0m Trial 422 finished with value: 0.8372023218910313 and parameters: {'splitter': 'best', 'min_samples_split': 0.27408213863833225, 'min_samples_leaf': 0.010177008453688517, 'min_weight_fraction_leaf': 0.045940203022590435, 'max_features': 0.8293976790420783}. Best is trial 272 with value: 0.8386029278581782.[0m
[32m[I 2022-04-21 11:38:12,855][0m Trial 423 finished with value: 0.8369115330577473 and parameters: {'splitter': 'best', 'min_samples_split': 0.2883023765607115, 'min_samples_leaf': 0.008108766783455842, 'min_weight_fraction_leaf': 0.033927097460423036, 'max_features': 0.8154140257195099}. Best is trial 272 with value: 0.8386029278581782.[0m
[32m[I 2022-04-21 11:38:12,908][0m Trial 424 finished with value: 0.8374751161921132 and parameters: {'splitter': 'best', 'min_samples_split': 0.2683353527458561, 'min_samples_leaf': 0.0011467907748729457, 'min_weight_fraction_leaf': 0.033862066529434645, 'max_features': 0.8454998009148849}. Best is trial 272 with value: 0.8386029278581782.[0m
[32m[I 2022-04-21 11:38:12,954][0m Trial 425 finished with value: 0.8394667449470219 and parameters: {'splitter': 'best', 'min_samples_split': 0.2689876679848551, 'min_samples_leaf': 0.0030887501791025933, 'min_weight_fraction_leaf': 0.042908244099435944, 'max_features': 0.7931276082361374}. Best is trial 425 with value: 0.8394667449470219.[0m
[32m[I 2022-04-21 11:38:13,009][0m Trial 426 finished with value: 0.8372056682096674 and parameters: {'splitter': 'best', 'min_samples_split': 0.2684008518868552, 'min_samples_leaf': 0.003895217427087587, 'min_weight_fraction_leaf': 0.03947183812070511, 'max_features': 0.8067566508280655}. Best is trial 425 with value: 0.8394667449470219.[0m
[32m[I 2022-04-21 11:38:13,076][0m Trial 427 finished with value: 0.8385374292394825 and parameters: {'splitter': 'best', 'min_samples_split': 0.2726879685731181, 'min_samples_leaf': 0.0031345736812755315, 'min_weight_fraction_leaf': 0.03623569676805911, 'max_features': 0.7914619328236432}. Best is trial 425 with value: 0.8394667449470219.[0m
[32m[I 2022-04-21 11:38:13,242][0m Trial 428 finished with value: 0.8342711778095314 and parameters: {'splitter': 'best', 'min_samples_split': 0.2834614726242937, 'min_samples_leaf': 0.003641822188904355, 'min_weight_fraction_leaf': 0.0375956574680105, 'max_features': 0.7908616102599539}. Best is trial 425 with value: 0.8394667449470219.[0m
[32m[I 2022-04-21 11:38:13,422][0m Trial 429 finished with value: 0.8373240128006764 and parameters: {'splitter': 'best', 'min_samples_split': 0.2665299509941715, 'min_samples_leaf': 0.0022252729088026836, 'min_weight_fraction_leaf': 0.035687761979972935, 'max_features': 0.776973088704995}. Best is trial 425 with value: 0.8394667449470219.[0m
[32m[I 2022-04-21 11:38:13,567][0m Trial 430 finished with value: 0.8382577519146084 and parameters: {'splitter': 'best', 'min_samples_split': 0.26866255970139474, 'min_samples_leaf': 0.0051320391447537556, 'min_weight_fraction_leaf': 0.054821962604291154, 'max_features': 0.7734209329932598}. Best is trial 425 with value: 0.8394667449470219.[0m
[32m[I 2022-04-21 11:38:13,701][0m Trial 431 finished with value: 0.8337699781920435 and parameters: {'splitter': 'random', 'min_samples_split': 0.263404442364065, 'min_samples_leaf': 0.001200125054660741, 'min_weight_fraction_leaf': 0.055382898476874734, 'max_features': 0.7704376021158661}. Best is trial 425 with value: 0.8394667449470219.[0m
[32m[I 2022-04-21 11:38:13,751][0m Trial 432 finished with value: 0.8356453536097854 and parameters: {'splitter': 'best', 'min_samples_split': 0.29011047675713647, 'min_samples_leaf': 0.001095225281177273, 'min_weight_fraction_leaf': 0.05339404573678214, 'max_features': 0.7998864403466975}. Best is trial 425 with value: 0.8394667449470219.[0m
[32m[I 2022-04-21 11:38:13,798][0m Trial 433 finished with value: 0.8367492132316885 and parameters: {'splitter': 'best', 'min_samples_split': 0.26576469293128163, 'min_samples_leaf': 0.01034568808506605, 'min_weight_fraction_leaf': 0.031598887309790574, 'max_features': 0.777764403057041}. Best is trial 425 with value: 0.8394667449470219.[0m
[32m[I 2022-04-21 11:38:13,854][0m Trial 434 finished with value: 0.8374751161921132 and parameters: {'splitter': 'best', 'min_samples_split': 0.27534200628441885, 'min_samples_leaf': 0.0028073764508383518, 'min_weight_fraction_leaf': 0.03324258936908031, 'max_features': 0.8356820394312426}. Best is trial 425 with value: 0.8394667449470219.[0m
[32m[I 2022-04-21 11:38:13,951][0m Trial 435 finished with value: 0.8369115330577473 and parameters: {'splitter': 'best', 'min_samples_split': 0.2798890873934065, 'min_samples_leaf': 0.0016151490513820728, 'min_weight_fraction_leaf': 0.031337566128407025, 'max_features': 0.83316621036001}. Best is trial 425 with value: 0.8394667449470219.[0m
[32m[I 2022-04-21 11:38:14,019][0m Trial 436 finished with value: 0.8316169921107444 and parameters: {'splitter': 'best', 'min_samples_split': 0.295508940531788, 'min_samples_leaf': 0.0010399448777725349, 'min_weight_fraction_leaf': 0.032402267666191045, 'max_features': 0.7611373924023861}. Best is trial 425 with value: 0.8394667449470219.[0m
[32m[I 2022-04-21 11:38:14,079][0m Trial 437 finished with value: 0.8385374292394825 and parameters: {'splitter': 'best', 'min_samples_split': 0.27160106010906626, 'min_samples_leaf': 0.013820111625131032, 'min_weight_fraction_leaf': 0.036060655122810724, 'max_features': 0.7541350649583167}. Best is trial 425 with value: 0.8394667449470219.[0m
[32m[I 2022-04-21 11:38:14,125][0m Trial 438 finished with value: 0.8356453536097854 and parameters: {'splitter': 'best', 'min_samples_split': 0.2830580666005539, 'min_samples_leaf': 0.014365371047403326, 'min_weight_fraction_leaf': 0.05358554214271677, 'max_features': 0.7562111447809492}. Best is trial 425 with value: 0.8394667449470219.[0m
[32m[I 2022-04-21 11:38:14,193][0m Trial 439 finished with value: 0.8374613873228913 and parameters: {'splitter': 'best', 'min_samples_split': 0.25987505159143287, 'min_samples_leaf': 0.010033226315423688, 'min_weight_fraction_leaf': 0.0414159163338704, 'max_features': 0.7875217772628837}. Best is trial 425 with value: 0.8394667449470219.[0m
[32m[I 2022-04-21 11:38:14,248][0m Trial 440 finished with value: 0.8386460587152798 and parameters: {'splitter': 'best', 'min_samples_split': 0.26028935229719813, 'min_samples_leaf': 0.0013073773373494702, 'min_weight_fraction_leaf': 0.04590511310025391, 'max_features': 0.7969875656212957}. Best is trial 425 with value: 0.8394667449470219.[0m
[32m[I 2022-04-21 11:38:14,296][0m Trial 441 finished with value: 0.8382577519146084 and parameters: {'splitter': 'best', 'min_samples_split': 0.26722138208249135, 'min_samples_leaf': 0.0030234571232953637, 'min_weight_fraction_leaf': 0.05485285319507638, 'max_features': 0.740874651823072}. Best is trial 425 with value: 0.8394667449470219.[0m
