[32m[I 2022-04-22 20:48:35,774][0m Trial 332 finished with value: 0.6752336887378728 and parameters: {'n_hidden': 1024, 'mixture_components': 2, 'use_sparse_layer': False, 'use_batchnorm': False, 'use_dropout': False, 'mlp_size_1': 6, 'mlp_size_2': 0, 'mlp_size_3': 1, 'kernel': 'Normal', 'loss_name': 'NLLLoss'}. Best is trial 164 with value: 0.7011621788753918.[0m
[32m[I 2022-04-22 20:49:23,237][0m Trial 333 finished with value: 0.6850655286404513 and parameters: {'n_hidden': 1024, 'mixture_components': 2, 'use_sparse_layer': False, 'use_batchnorm': False, 'use_dropout': False, 'mlp_size_1': 6, 'mlp_size_2': 0, 'mlp_size_3': 1, 'kernel': 'Normal', 'loss_name': 'NLLLoss'}. Best is trial 164 with value: 0.7011621788753918.[0m
[32m[I 2022-04-22 20:50:04,703][0m Trial 334 finished with value: 0.6788813626763928 and parameters: {'n_hidden': 1024, 'mixture_components': 2, 'use_sparse_layer': False, 'use_batchnorm': False, 'use_dropout': False, 'mlp_size_1': 6, 'mlp_size_2': 0, 'mlp_size_3': 1, 'kernel': 'Normal', 'loss_name': 'NLLLoss'}. Best is trial 164 with value: 0.7011621788753918.[0m
[32m[I 2022-04-22 20:50:53,685][0m Trial 335 finished with value: 0.6669427221321733 and parameters: {'n_hidden': 64, 'mixture_components': 2, 'use_sparse_layer': False, 'use_batchnorm': False, 'use_dropout': False, 'mlp_size_1': 3, 'mlp_size_2': 0, 'mlp_size_3': 0, 'kernel': 'Normal', 'loss_name': 'NLLLoss'}. Best is trial 164 with value: 0.7011621788753918.[0m
[32m[I 2022-04-22 20:51:39,553][0m Trial 336 finished with value: 0.6763768663836645 and parameters: {'n_hidden': 1024, 'mixture_components': 2, 'use_sparse_layer': False, 'use_batchnorm': False, 'use_dropout': False, 'mlp_size_1': 7, 'mlp_size_2': 0, 'mlp_size_3': 0, 'kernel': 'Logistic', 'loss_name': 'NLLLoss'}. Best is trial 164 with value: 0.7011621788753918.[0m
[32m[I 2022-04-22 20:52:21,618][0m Trial 337 finished with value: 0.6884497345945756 and parameters: {'n_hidden': 1024, 'mixture_components': 2, 'use_sparse_layer': True, 'use_sparse_loss': True, 'lmbd': 5.454464252027718e-05, 'use_batchnorm': False, 'use_dropout': False, 'mlp_size_1': 6, 'mlp_size_2': 0, 'mlp_size_3': 1, 'kernel': 'Normal', 'loss_name': 'NLLLoss'}. Best is trial 164 with value: 0.7011621788753918.[0m
[32m[I 2022-04-22 20:53:17,169][0m Trial 338 finished with value: 0.6886269597909414 and parameters: {'n_hidden': 512, 'mixture_components': 10, 'use_sparse_layer': False, 'use_batchnorm': False, 'use_dropout': False, 'mlp_size_1': 6, 'mlp_size_2': 0, 'mlp_size_3': 0, 'kernel': 'Normal', 'loss_name': 'NLLLoss'}. Best is trial 164 with value: 0.7011621788753918.[0m
[32m[I 2022-04-22 20:53:57,538][0m Trial 339 finished with value: 0.6870764203510417 and parameters: {'n_hidden': 1024, 'mixture_components': 2, 'use_sparse_layer': False, 'use_batchnorm': False, 'use_dropout': False, 'mlp_size_1': 7, 'mlp_size_2': 0, 'mlp_size_3': 0, 'kernel': 'Logistic', 'loss_name': 'NLLLoss'}. Best is trial 164 with value: 0.7011621788753918.[0m
[32m[I 2022-04-22 20:54:47,719][0m Trial 340 finished with value: 0.6893463189330092 and parameters: {'n_hidden': 1024, 'mixture_components': 8, 'use_sparse_layer': False, 'use_batchnorm': False, 'use_dropout': False, 'mlp_size_1': 7, 'mlp_size_2': 0, 'mlp_size_3': 0, 'kernel': 'Normal', 'loss_name': 'NLLLoss'}. Best is trial 164 with value: 0.7011621788753918.[0m
[32m[I 2022-04-22 20:55:34,361][0m Trial 341 finished with value: 0.6940896849468137 and parameters: {'n_hidden': 1024, 'mixture_components': 4, 'use_sparse_layer': False, 'use_batchnorm': False, 'use_dropout': False, 'mlp_size_1': 6, 'mlp_size_2': 0, 'mlp_size_3': 1, 'kernel': 'Normal', 'loss_name': 'NLLLoss'}. Best is trial 164 with value: 0.7011621788753918.[0m
[32m[I 2022-04-22 20:56:18,173][0m Trial 342 finished with value: 0.6848893607226775 and parameters: {'n_hidden': 1024, 'mixture_components': 4, 'use_sparse_layer': False, 'use_batchnorm': False, 'use_dropout': False, 'mlp_size_1': 6, 'mlp_size_2': 0, 'mlp_size_3': 1, 'kernel': 'Normal', 'loss_name': 'NLLLoss'}. Best is trial 164 with value: 0.7011621788753918.[0m
[32m[I 2022-04-22 20:57:00,357][0m Trial 343 finished with value: 0.6862170607209106 and parameters: {'n_hidden': 1024, 'mixture_components': 4, 'use_sparse_layer': False, 'use_batchnorm': False, 'use_dropout': False, 'mlp_size_1': 6, 'mlp_size_2': 0, 'mlp_size_3': 1, 'kernel': 'Normal', 'loss_name': 'NLLLoss'}. Best is trial 164 with value: 0.7011621788753918.[0m
[32m[I 2022-04-22 20:57:56,971][0m Trial 344 finished with value: 0.6667297008261096 and parameters: {'n_hidden': 1024, 'mixture_components': 3, 'use_sparse_layer': False, 'use_batchnorm': False, 'use_dropout': False, 'mlp_size_1': 6, 'mlp_size_2': 0, 'mlp_size_3': 1, 'kernel': 'Logistic', 'loss_name': 'NLLLoss'}. Best is trial 164 with value: 0.7011621788753918.[0m
[32m[I 2022-04-22 20:58:49,162][0m Trial 345 finished with value: 0.6758664203711242 and parameters: {'n_hidden': 1024, 'mixture_components': 4, 'use_sparse_layer': False, 'use_batchnorm': False, 'use_dropout': False, 'mlp_size_1': 6, 'mlp_size_2': 0, 'mlp_size_3': 1, 'kernel': 'Normal', 'loss_name': 'NLLLoss'}. Best is trial 164 with value: 0.7011621788753918.[0m
[32m[I 2022-04-22 20:59:38,434][0m Trial 346 finished with value: 0.6729752940679347 and parameters: {'n_hidden': 1024, 'mixture_components': 3, 'use_sparse_layer': False, 'use_batchnorm': False, 'use_dropout': False, 'mlp_size_1': 6, 'mlp_size_2': 0, 'mlp_size_3': 1, 'kernel': 'Normal', 'loss_name': 'NLLLoss'}. Best is trial 164 with value: 0.7011621788753918.[0m
[32m[I 2022-04-22 21:00:49,911][0m Trial 347 finished with value: -0.6745299930806505 and parameters: {'n_hidden': 2048, 'mixture_components': 3, 'use_sparse_layer': False, 'use_batchnorm': False, 'use_dropout': True, 'dropout': 0.8749627512652665, 'mlp_size_1': 8, 'mlp_size_2': 0, 'mlp_size_3': 0, 'kernel': 'Exponential', 'loss_name': 'CensoredNLLLoss'}. Best is trial 164 with value: 0.7011621788753918.[0m
[32m[I 2022-04-22 21:01:51,213][0m Trial 348 finished with value: 0.6776417989128918 and parameters: {'n_hidden': 1024, 'mixture_components': 3, 'use_sparse_layer': False, 'use_batchnorm': False, 'use_dropout': False, 'mlp_size_1': 6, 'mlp_size_2': 0, 'mlp_size_3': 1, 'kernel': 'Logistic', 'loss_name': 'NLLLoss'}. Best is trial 164 with value: 0.7011621788753918.[0m
[32m[I 2022-04-22 21:02:39,334][0m Trial 349 finished with value: 0.6877678269902108 and parameters: {'n_hidden': 1024, 'mixture_components': 3, 'use_sparse_layer': True, 'use_sparse_loss': True, 'lmbd': 0.0005241744632753639, 'use_batchnorm': False, 'use_dropout': False, 'mlp_size_1': 6, 'mlp_size_2': 0, 'mlp_size_3': 1, 'kernel': 'Normal', 'loss_name': 'NLLLoss'}. Best is trial 164 with value: 0.7011621788753918.[0m
[32m[I 2022-04-22 21:04:03,319][0m Trial 350 finished with value: 0.5948225504567285 and parameters: {'n_hidden': 1024, 'mixture_components': 9, 'use_sparse_layer': False, 'use_batchnorm': True, 'use_dropout': False, 'mlp_size_1': 6, 'mlp_size_2': 0, 'mlp_size_3': 1, 'kernel': 'Normal', 'loss_name': 'NLLLoss'}. Best is trial 164 with value: 0.7011621788753918.[0m
[32m[I 2022-04-22 21:04:56,665][0m Trial 351 finished with value: 0.6890683885015221 and parameters: {'n_hidden': 1024, 'mixture_components': 3, 'use_sparse_layer': False, 'use_batchnorm': False, 'use_dropout': False, 'mlp_size_1': 6, 'mlp_size_2': 0, 'mlp_size_3': 1, 'kernel': 'Normal', 'loss_name': 'NLLLoss'}. Best is trial 164 with value: 0.7011621788753918.[0m
[32m[I 2022-04-22 21:05:33,612][0m Trial 352 finished with value: 0.6816735661949802 and parameters: {'n_hidden': 256, 'mixture_components': 3, 'use_sparse_layer': False, 'use_batchnorm': False, 'use_dropout': False, 'mlp_size_1': 5, 'mlp_size_2': 0, 'mlp_size_3': 0, 'kernel': 'Logistic', 'loss_name': 'NLLLoss'}. Best is trial 164 with value: 0.7011621788753918.[0m
[32m[I 2022-04-22 21:06:29,741][0m Trial 353 finished with value: 0.6871953763955679 and parameters: {'n_hidden': 32, 'mixture_components': 3, 'use_sparse_layer': False, 'use_batchnorm': False, 'use_dropout': False, 'mlp_size_1': 2, 'mlp_size_2': 0, 'mlp_size_3': 0, 'kernel': 'Normal', 'loss_name': 'NLLLoss'}. Best is trial 164 with value: 0.7011621788753918.[0m
[32m[I 2022-04-22 21:07:16,280][0m Trial 354 finished with value: 0.6876651134695274 and parameters: {'n_hidden': 512, 'mixture_components': 10, 'use_sparse_layer': False, 'use_batchnorm': False, 'use_dropout': False, 'mlp_size_1': 6, 'mlp_size_2': 0, 'mlp_size_3': 0, 'kernel': 'LogLogistic', 'loss_name': 'NLLLoss'}. Best is trial 164 with value: 0.7011621788753918.[0m
[32m[I 2022-04-22 21:08:10,750][0m Trial 355 finished with value: 0.6832575763955948 and parameters: {'n_hidden': 1024, 'mixture_components': 3, 'use_sparse_layer': False, 'use_batchnorm': False, 'use_dropout': False, 'mlp_size_1': 6, 'mlp_size_2': 0, 'mlp_size_3': 1, 'kernel': 'Normal', 'loss_name': 'NLLLoss'}. Best is trial 164 with value: 0.7011621788753918.[0m
[32m[I 2022-04-22 21:08:57,869][0m Trial 356 finished with value: 0.6793147947110156 and parameters: {'n_hidden': 1024, 'mixture_components': 4, 'use_sparse_layer': False, 'use_batchnorm': False, 'use_dropout': False, 'mlp_size_1': 6, 'mlp_size_2': 0, 'mlp_size_3': 1, 'kernel': 'Normal', 'loss_name': 'NLLLoss'}. Best is trial 164 with value: 0.7011621788753918.[0m
[32m[I 2022-04-22 21:09:43,005][0m Trial 357 finished with value: 0.6794159784998641 and parameters: {'n_hidden': 1024, 'mixture_components': 3, 'use_sparse_layer': False, 'use_batchnorm': False, 'use_dropout': False, 'mlp_size_1': 6, 'mlp_size_2': 0, 'mlp_size_3': 1, 'kernel': 'Logistic', 'loss_name': 'NLLLoss'}. Best is trial 164 with value: 0.7011621788753918.[0m
[32m[I 2022-04-22 21:10:31,279][0m Trial 358 finished with value: 0.683602146891403 and parameters: {'n_hidden': 1024, 'mixture_components': 3, 'use_sparse_layer': False, 'use_batchnorm': False, 'use_dropout': False, 'mlp_size_1': 6, 'mlp_size_2': 0, 'mlp_size_3': 1, 'kernel': 'Normal', 'loss_name': 'NLLLoss'}. Best is trial 164 with value: 0.7011621788753918.[0m
[32m[I 2022-04-22 21:11:18,690][0m Trial 359 finished with value: 0.6899508755110135 and parameters: {'n_hidden': 1024, 'mixture_components': 2, 'use_sparse_layer': False, 'use_batchnorm': False, 'use_dropout': False, 'mlp_size_1': 7, 'mlp_size_2': 0, 'mlp_size_3': 0, 'kernel': 'Normal', 'loss_name': 'NLLLoss'}. Best is trial 164 with value: 0.7011621788753918.[0m
[32m[I 2022-04-22 21:12:03,868][0m Trial 360 finished with value: 0.6632654754491494 and parameters: {'n_hidden': 1024, 'mixture_components': 3, 'use_sparse_layer': False, 'use_batchnorm': False, 'use_dropout': False, 'mlp_size_1': 7, 'mlp_size_2': 0, 'mlp_size_3': 0, 'kernel': 'Logistic', 'loss_name': 'NLLLoss'}. Best is trial 164 with value: 0.7011621788753918.[0m
[32m[I 2022-04-22 21:12:48,157][0m Trial 361 finished with value: 0.666540518737671 and parameters: {'n_hidden': 1024, 'mixture_components': 2, 'use_sparse_layer': True, 'use_sparse_loss': False, 'use_batchnorm': False, 'use_dropout': False, 'mlp_size_1': 6, 'mlp_size_2': 0, 'mlp_size_3': 1, 'kernel': 'Normal', 'loss_name': 'NLLLoss'}. Best is trial 164 with value: 0.7011621788753918.[0m
[32m[I 2022-04-22 21:13:45,229][0m Trial 362 finished with value: 0.6753437683127719 and parameters: {'n_hidden': 1024, 'mixture_components': 4, 'use_sparse_layer': False, 'use_batchnorm': False, 'use_dropout': False, 'mlp_size_1': 6, 'mlp_size_2': 0, 'mlp_size_3': 1, 'kernel': 'Gumbel', 'loss_name': 'CensoredNLLLoss'}. Best is trial 164 with value: 0.7011621788753918.[0m
[32m[I 2022-04-22 21:14:26,753][0m Trial 363 finished with value: 0.6641871516204766 and parameters: {'n_hidden': 1024, 'mixture_components': 3, 'use_sparse_layer': False, 'use_batchnorm': False, 'use_dropout': False, 'mlp_size_1': 7, 'mlp_size_2': 0, 'mlp_size_3': 0, 'kernel': 'Normal', 'loss_name': 'NLLLoss'}. Best is trial 164 with value: 0.7011621788753918.[0m
[32m[I 2022-04-22 21:15:20,846][0m Trial 364 finished with value: 0.6793566525773255 and parameters: {'n_hidden': 64, 'mixture_components': 3, 'use_sparse_layer': False, 'use_batchnorm': False, 'use_dropout': False, 'mlp_size_1': 3, 'mlp_size_2': 0, 'mlp_size_3': 0, 'kernel': 'Gumbel', 'loss_name': 'NLLLoss'}. Best is trial 164 with value: 0.7011621788753918.[0m
[32m[I 2022-04-22 21:16:06,021][0m Trial 365 finished with value: 0.6757897060088792 and parameters: {'n_hidden': 1024, 'mixture_components': 9, 'use_sparse_layer': False, 'use_batchnorm': False, 'use_dropout': True, 'dropout': 0.5209274467850452, 'mlp_size_1': 6, 'mlp_size_2': 0, 'mlp_size_3': 1, 'kernel': 'Normal', 'loss_name': 'NLLLoss'}. Best is trial 164 with value: 0.7011621788753918.[0m
[32m[I 2022-04-22 21:16:53,967][0m Trial 366 finished with value: 0.682999341177519 and parameters: {'n_hidden': 256, 'mixture_components': 3, 'use_sparse_layer': False, 'use_batchnorm': False, 'use_dropout': False, 'mlp_size_1': 5, 'mlp_size_2': 0, 'mlp_size_3': 0, 'kernel': 'Logistic', 'loss_name': 'NLLLoss'}. Best is trial 164 with value: 0.7011621788753918.[0m
[32m[I 2022-04-22 21:17:29,016][0m Trial 367 finished with value: 0.6729784120067116 and parameters: {'n_hidden': 1024, 'mixture_components': 1, 'use_sparse_layer': False, 'use_batchnorm': False, 'use_dropout': False, 'mlp_size_1': 7, 'mlp_size_2': 0, 'mlp_size_3': 0, 'kernel': 'Exponential', 'loss_name': 'NLLLoss'}. Best is trial 164 with value: 0.7011621788753918.[0m
[32m[I 2022-04-22 21:18:23,222][0m Trial 368 finished with value: 0.6565749601218566 and parameters: {'n_hidden': 1024, 'mixture_components': 2, 'use_sparse_layer': False, 'use_batchnorm': False, 'use_dropout': False, 'mlp_size_1': 6, 'mlp_size_2': 0, 'mlp_size_3': 1, 'kernel': 'Normal', 'loss_name': 'NLLLoss'}. Best is trial 164 with value: 0.7011621788753918.[0m
[32m[I 2022-04-22 21:20:05,053][0m Trial 369 finished with value: 0.6200291948202376 and parameters: {'n_hidden': 1024, 'mixture_components': 2, 'use_sparse_layer': False, 'use_batchnorm': True, 'use_dropout': False, 'mlp_size_1': 7, 'mlp_size_2': 0, 'mlp_size_3': 0, 'kernel': 'Gumbel', 'loss_name': 'NLLLoss'}. Best is trial 164 with value: 0.7011621788753918.[0m
[32m[I 2022-04-22 21:20:55,758][0m Trial 370 finished with value: 0.6778800598004009 and parameters: {'n_hidden': 512, 'mixture_components': 3, 'use_sparse_layer': False, 'use_batchnorm': False, 'use_dropout': False, 'mlp_size_1': 6, 'mlp_size_2': 0, 'mlp_size_3': 0, 'kernel': 'Normal', 'loss_name': 'NLLLoss'}. Best is trial 164 with value: 0.7011621788753918.[0m
[32m[I 2022-04-22 21:21:31,522][0m Trial 371 finished with value: 0.6863633072144398 and parameters: {'n_hidden': 1024, 'mixture_components': 7, 'use_sparse_layer': False, 'use_batchnorm': False, 'use_dropout': False, 'mlp_size_1': 6, 'mlp_size_2': 0, 'mlp_size_3': 1, 'kernel': 'Gumbel', 'loss_name': 'NLLLoss'}. Best is trial 164 with value: 0.7011621788753918.[0m
[32m[I 2022-04-22 21:22:08,187][0m Trial 372 finished with value: 0.6814273338397961 and parameters: {'n_hidden': 1024, 'mixture_components': 3, 'use_sparse_layer': True, 'use_sparse_loss': True, 'lmbd': 0.004748798413631539, 'use_batchnorm': False, 'use_dropout': False, 'mlp_size_1': 7, 'mlp_size_2': 0, 'mlp_size_3': 0, 'kernel': 'Normal', 'loss_name': 'NLLLoss'}. Best is trial 164 with value: 0.7011621788753918.[0m
[32m[I 2022-04-22 21:22:51,948][0m Trial 373 finished with value: 0.6840251106925315 and parameters: {'n_hidden': 1024, 'mixture_components': 2, 'use_sparse_layer': False, 'use_batchnorm': False, 'use_dropout': False, 'mlp_size_1': 7, 'mlp_size_2': 0, 'mlp_size_3': 0, 'kernel': 'Logistic', 'loss_name': 'NLLLoss'}. Best is trial 164 with value: 0.7011621788753918.[0m
[32m[I 2022-04-22 21:23:58,950][0m Trial 374 finished with value: 0.6984635172059155 and parameters: {'n_hidden': 2048, 'mixture_components': 8, 'use_sparse_layer': False, 'use_batchnorm': False, 'use_dropout': False, 'mlp_size_1': 8, 'mlp_size_2': 0, 'mlp_size_3': 0, 'kernel': 'Normal', 'loss_name': 'NLLLoss'}. Best is trial 164 with value: 0.7011621788753918.[0m
[32m[I 2022-04-22 21:24:38,654][0m Trial 375 finished with value: 0.6811746428012502 and parameters: {'n_hidden': 256, 'mixture_components': 8, 'use_sparse_layer': False, 'use_batchnorm': False, 'use_dropout': False, 'mlp_size_1': 5, 'mlp_size_2': 0, 'mlp_size_3': 0, 'kernel': 'Normal', 'loss_name': 'NLLLoss'}. Best is trial 164 with value: 0.7011621788753918.[0m
[32m[I 2022-04-22 21:25:50,784][0m Trial 376 finished with value: 0.6687347577139116 and parameters: {'n_hidden': 2048, 'mixture_components': 9, 'use_sparse_layer': False, 'use_batchnorm': False, 'use_dropout': False, 'mlp_size_1': 6, 'mlp_size_2': 1, 'mlp_size_3': 1, 'kernel': 'Gumbel', 'loss_name': 'NLLLoss'}. Best is trial 164 with value: 0.7011621788753918.[0m
[32m[I 2022-04-22 21:26:57,650][0m Trial 377 finished with value: 0.6800595597532506 and parameters: {'n_hidden': 32, 'mixture_components': 8, 'use_sparse_layer': False, 'use_batchnorm': False, 'use_dropout': False, 'mlp_size_1': 2, 'mlp_size_2': 0, 'mlp_size_3': 0, 'kernel': 'Normal', 'loss_name': 'NLLLoss'}. Best is trial 164 with value: 0.7011621788753918.[0m
[32m[I 2022-04-22 21:27:39,641][0m Trial 378 finished with value: 0.695832282812775 and parameters: {'n_hidden': 1024, 'mixture_components': 8, 'use_sparse_layer': False, 'use_batchnorm': False, 'use_dropout': False, 'mlp_size_1': 6, 'mlp_size_2': 0, 'mlp_size_3': 1, 'kernel': 'LogLogistic', 'loss_name': 'NLLLoss'}. Best is trial 164 with value: 0.7011621788753918.[0m
[32m[I 2022-04-22 21:28:17,826][0m Trial 379 finished with value: 0.6662693220340097 and parameters: {'n_hidden': 512, 'mixture_components': 8, 'use_sparse_layer': False, 'use_batchnorm': False, 'use_dropout': False, 'mlp_size_1': 6, 'mlp_size_2': 0, 'mlp_size_3': 0, 'kernel': 'LogLogistic', 'loss_name': 'NLLLoss'}. Best is trial 164 with value: 0.7011621788753918.[0m
[32m[I 2022-04-22 21:29:22,861][0m Trial 380 finished with value: 0.6771105029582232 and parameters: {'n_hidden': 2048, 'mixture_components': 8, 'use_sparse_layer': False, 'use_batchnorm': False, 'use_dropout': False, 'mlp_size_1': 8, 'mlp_size_2': 0, 'mlp_size_3': 0, 'kernel': 'LogLogistic', 'loss_name': 'NLLLoss'}. Best is trial 164 with value: 0.7011621788753918.[0m
[32m[I 2022-04-22 21:30:26,179][0m Trial 381 finished with value: 0.6804858644801735 and parameters: {'n_hidden': 2048, 'mixture_components': 8, 'use_sparse_layer': False, 'use_batchnorm': False, 'use_dropout': False, 'mlp_size_1': 8, 'mlp_size_2': 0, 'mlp_size_3': 0, 'kernel': 'LogLogistic', 'loss_name': 'NLLLoss'}. Best is trial 164 with value: 0.7011621788753918.[0m
[32m[I 2022-04-22 21:31:25,883][0m Trial 382 finished with value: 0.6821584661604843 and parameters: {'n_hidden': 2048, 'mixture_components': 8, 'use_sparse_layer': False, 'use_batchnorm': False, 'use_dropout': False, 'mlp_size_1': 8, 'mlp_size_2': 0, 'mlp_size_3': 0, 'kernel': 'LogLogistic', 'loss_name': 'NLLLoss'}. Best is trial 164 with value: 0.7011621788753918.[0m
[32m[I 2022-04-22 21:32:37,127][0m Trial 383 finished with value: 0.6898471279383177 and parameters: {'n_hidden': 2048, 'mixture_components': 7, 'use_sparse_layer': False, 'use_batchnorm': False, 'use_dropout': False, 'mlp_size_1': 8, 'mlp_size_2': 0, 'mlp_size_3': 0, 'kernel': 'LogLogistic', 'loss_name': 'NLLLoss'}. Best is trial 164 with value: 0.7011621788753918.[0m
[32m[I 2022-04-22 21:33:28,127][0m Trial 384 finished with value: 0.6863557169719313 and parameters: {'n_hidden': 2048, 'mixture_components': 9, 'use_sparse_layer': False, 'use_batchnorm': False, 'use_dropout': False, 'mlp_size_1': 8, 'mlp_size_2': 0, 'mlp_size_3': 0, 'kernel': 'LogLogistic', 'loss_name': 'NLLLoss'}. Best is trial 164 with value: 0.7011621788753918.[0m
[32m[I 2022-04-22 21:34:27,581][0m Trial 385 finished with value: 0.6803162277673603 and parameters: {'n_hidden': 2048, 'mixture_components': 8, 'use_sparse_layer': True, 'use_sparse_loss': True, 'lmbd': 9.044856889815707e-06, 'use_batchnorm': False, 'use_dropout': False, 'mlp_size_1': 8, 'mlp_size_2': 0, 'mlp_size_3': 0, 'kernel': 'LogLogistic', 'loss_name': 'NLLLoss'}. Best is trial 164 with value: 0.7011621788753918.[0m
[32m[I 2022-04-22 21:35:02,967][0m Trial 386 finished with value: 0.6838296680772494 and parameters: {'n_hidden': 1024, 'mixture_components': 8, 'use_sparse_layer': False, 'use_batchnorm': False, 'use_dropout': True, 'dropout': 0.11899952154096072, 'mlp_size_1': 6, 'mlp_size_2': 0, 'mlp_size_3': 1, 'kernel': 'Gumbel', 'loss_name': 'NLLLoss'}. Best is trial 164 with value: 0.7011621788753918.[0m
[32m[I 2022-04-22 21:35:51,019][0m Trial 387 finished with value: 0.6870166760774139 and parameters: {'n_hidden': 1024, 'mixture_components': 8, 'use_sparse_layer': False, 'use_batchnorm': False, 'use_dropout': False, 'mlp_size_1': 6, 'mlp_size_2': 0, 'mlp_size_3': 1, 'kernel': 'Normal', 'loss_name': 'NLLLoss'}. Best is trial 164 with value: 0.7011621788753918.[0m
[32m[I 2022-04-22 21:36:41,207][0m Trial 388 finished with value: 0.6736111101920592 and parameters: {'n_hidden': 1024, 'mixture_components': 10, 'use_sparse_layer': False, 'use_batchnorm': False, 'use_dropout': False, 'mlp_size_1': 6, 'mlp_size_2': 0, 'mlp_size_3': 1, 'kernel': 'Normal', 'loss_name': 'NLLLoss'}. Best is trial 164 with value: 0.7011621788753918.[0m
[32m[I 2022-04-22 21:37:24,100][0m Trial 389 finished with value: 0.6819034855853768 and parameters: {'n_hidden': 1024, 'mixture_components': 1, 'use_sparse_layer': False, 'use_batchnorm': False, 'use_dropout': False, 'mlp_size_1': 6, 'mlp_size_2': 0, 'mlp_size_3': 1, 'kernel': 'Gumbel', 'loss_name': 'NLLLoss'}. Best is trial 164 with value: 0.7011621788753918.[0m
