[32m[I 2022-04-21 18:38:32,376][0m Trial 551 finished with value: 0.8348242447654382 and parameters: {'loss': 'coxph', 'learning_rate': 0.004355723359607754, 'n_estimators': 235, 'criterion': 'friedman_mse', 'min_samples_split': 10, 'min_samples_leaf': 2, 'min_weight_fraction_leaf': 0.1486542246578844, 'min_impurity_decrease': 0.19039968129768403, 'max_features': 0.2952805361679808, 'subsample': 0.07739623396451811, 'dropout_rate': 0.08041197287385327, 'ccp_alpha': 0.39373535217388445}. Best is trial 244 with value: 0.8474070660226068.[0m
[32m[I 2022-04-21 18:38:44,391][0m Trial 552 finished with value: 0.8446715636866436 and parameters: {'loss': 'coxph', 'learning_rate': 0.002300869918439109, 'n_estimators': 257, 'criterion': 'friedman_mse', 'min_samples_split': 4, 'min_samples_leaf': 3, 'min_weight_fraction_leaf': 0.2074993833635071, 'min_impurity_decrease': 0.27242961920142916, 'max_features': 0.9266350906061038, 'subsample': 0.1524307834868477, 'dropout_rate': 0.13050974256820697, 'ccp_alpha': 0.0018457498283159235}. Best is trial 244 with value: 0.8474070660226068.[0m
/media/san2_ssd/data/Workdir/survival/venv/lib/python3.8/site-packages/sksurv/ensemble/boosting.py:955: RuntimeWarning: divide by zero encountered in log
  time = numpy.log(time)
/media/san2_ssd/data/Workdir/survival/venv/lib/python3.8/site-packages/sksurv/ensemble/boosting.py:955: RuntimeWarning: divide by zero encountered in log
  time = numpy.log(time)
/media/san2_ssd/data/Workdir/survival/venv/lib/python3.8/site-packages/sksurv/ensemble/boosting.py:955: RuntimeWarning: divide by zero encountered in log
  time = numpy.log(time)
/media/san2_ssd/data/Workdir/survival/venv/lib/python3.8/site-packages/sksurv/ensemble/boosting.py:955: RuntimeWarning: divide by zero encountered in log
  time = numpy.log(time)
[32m[I 2022-04-21 18:38:55,591][0m Trial 553 finished with value: -0.4664930483051949 and parameters: {'loss': 'squared', 'learning_rate': 0.0001291213196744291, 'n_estimators': 544, 'criterion': 'friedman_mse', 'min_samples_split': 2, 'min_samples_leaf': 1, 'min_weight_fraction_leaf': 0.18429341783159636, 'min_impurity_decrease': 0.3907944964993106, 'max_features': 0.3257529506602727, 'subsample': 0.09715980530825605, 'dropout_rate': 0.15974563844522974, 'ccp_alpha': 0.17005779948556166}. Best is trial 244 with value: 0.8474070660226068.[0m
[32m[I 2022-04-21 18:39:12,895][0m Trial 554 finished with value: 0.8448354949269982 and parameters: {'loss': 'coxph', 'learning_rate': 8.896472072295205e-05, 'n_estimators': 279, 'criterion': 'friedman_mse', 'min_samples_split': 5, 'min_samples_leaf': 2, 'min_weight_fraction_leaf': 0.16388286713696412, 'min_impurity_decrease': 0.2435567225968583, 'max_features': 0.35358532548366983, 'subsample': 0.06477176242364777, 'dropout_rate': 0.1156934430993125, 'ccp_alpha': 0.09116197250281852}. Best is trial 244 with value: 0.8474070660226068.[0m
[32m[I 2022-04-21 18:39:25,620][0m Trial 555 finished with value: 0.8419838787081361 and parameters: {'loss': 'coxph', 'learning_rate': 0.0001703156105632756, 'n_estimators': 219, 'criterion': 'friedman_mse', 'min_samples_split': 3, 'min_samples_leaf': 2, 'min_weight_fraction_leaf': 0.19452188350020463, 'min_impurity_decrease': 0.3352167190843552, 'max_features': 0.30635464440607063, 'subsample': 0.034734176726908594, 'dropout_rate': 0.1764278783282832, 'ccp_alpha': 0.24702726317627507}. Best is trial 244 with value: 0.8474070660226068.[0m
[32m[I 2022-04-21 18:39:51,319][0m Trial 556 finished with value: 0.8456405127662283 and parameters: {'loss': 'coxph', 'learning_rate': 0.00034922251357482004, 'n_estimators': 299, 'criterion': 'friedman_mse', 'min_samples_split': 4, 'min_samples_leaf': 2, 'min_weight_fraction_leaf': 0.17753910906099687, 'min_impurity_decrease': 0.5726074457167124, 'max_features': 0.011305471743969675, 'subsample': 0.08944128098207288, 'dropout_rate': 0.14507639116292798, 'ccp_alpha': 0.09249048361945605}. Best is trial 244 with value: 0.8474070660226068.[0m
[32m[I 2022-04-21 18:40:03,760][0m Trial 557 finished with value: 0.7162785497511581 and parameters: {'loss': 'coxph', 'learning_rate': 4.237929055095496e-05, 'n_estimators': 204, 'criterion': 'friedman_mse', 'min_samples_split': 3, 'min_samples_leaf': 2, 'min_weight_fraction_leaf': 0.223023592571313, 'min_impurity_decrease': 0.30155133119144345, 'max_features': 0.25744661940195046, 'subsample': 0.11523017388824495, 'dropout_rate': 0.09142809623878893, 'ccp_alpha': 0.48244441868718835}. Best is trial 244 with value: 0.8474070660226068.[0m
[32m[I 2022-04-21 18:40:19,161][0m Trial 558 finished with value: 0.8435029118728534 and parameters: {'loss': 'coxph', 'learning_rate': 0.0054334668275432575, 'n_estimators': 245, 'criterion': 'friedman_mse', 'min_samples_split': 4, 'min_samples_leaf': 1, 'min_weight_fraction_leaf': 0.13297087641356553, 'min_impurity_decrease': 0.358262430262798, 'max_features': 0.9524547342219488, 'subsample': 0.07273163559667334, 'dropout_rate': 0.19690229870118164, 'ccp_alpha': 0.3225383797213602}. Best is trial 244 with value: 0.8474070660226068.[0m
[32m[I 2022-04-21 18:40:41,496][0m Trial 559 finished with value: 0.65 and parameters: {'loss': 'coxph', 'learning_rate': 0.00010918854115383677, 'n_estimators': 320, 'criterion': 'friedman_mse', 'min_samples_split': 3, 'min_samples_leaf': 4, 'min_weight_fraction_leaf': 0.15470254985672324, 'min_impurity_decrease': 0.6127033101224113, 'max_features': 0.40443784412889383, 'subsample': 0.05217665807582307, 'dropout_rate': 0.1610509873828299, 'ccp_alpha': 0.18147229662410275}. Best is trial 244 with value: 0.8474070660226068.[0m
[32m[I 2022-04-21 18:40:58,083][0m Trial 560 finished with value: 0.8450351763010782 and parameters: {'loss': 'coxph', 'learning_rate': 5.3896568466814915e-05, 'n_estimators': 268, 'criterion': 'friedman_mse', 'min_samples_split': 2, 'min_samples_leaf': 2, 'min_weight_fraction_leaf': 0.1895689170640502, 'min_impurity_decrease': 0.32215686798845833, 'max_features': 0.3771280489951018, 'subsample': 0.10164285123261722, 'dropout_rate': 0.038584179384440934, 'ccp_alpha': 0.09876814492732036}. Best is trial 244 with value: 0.8474070660226068.[0m
[32m[I 2022-04-21 18:41:08,954][0m Trial 561 finished with value: 0.8403045686054073 and parameters: {'loss': 'coxph', 'learning_rate': 7.820300801553963e-05, 'n_estimators': 227, 'criterion': 'friedman_mse', 'min_samples_split': 3, 'min_samples_leaf': 2, 'min_weight_fraction_leaf': 0.20825166312837498, 'min_impurity_decrease': 0.28013080612747165, 'max_features': 0.2787584905275924, 'subsample': 0.028177318232471105, 'dropout_rate': 0.13369529772530134, 'ccp_alpha': 0.2511530274851527}. Best is trial 244 with value: 0.8474070660226068.[0m
[32m[I 2022-04-21 18:41:23,664][0m Trial 562 finished with value: 0.7261744455804562 and parameters: {'loss': 'coxph', 'learning_rate': 0.0001414463505841671, 'n_estimators': 254, 'criterion': 'squared_error', 'min_samples_split': 5, 'min_samples_leaf': 3, 'min_weight_fraction_leaf': 0.17205190874161916, 'min_impurity_decrease': 0.47566023664021184, 'max_features': 0.3448821634865565, 'subsample': 0.13119813714843517, 'dropout_rate': 0.2247038475357349, 'ccp_alpha': 0.08571230384623021}. Best is trial 244 with value: 0.8474070660226068.[0m
[32m[I 2022-04-21 18:41:50,226][0m Trial 563 finished with value: 0.8464537284893314 and parameters: {'loss': 'coxph', 'learning_rate': 0.00019545701924680837, 'n_estimators': 303, 'criterion': 'friedman_mse', 'min_samples_split': 3, 'min_samples_leaf': 1, 'min_weight_fraction_leaf': 0.18214136330140793, 'min_impurity_decrease': 0.3118966946166523, 'max_features': 0.315675535524951, 'subsample': 0.0836137790303598, 'dropout_rate': 0.10864756894077587, 'ccp_alpha': 0.0012889777391276724}. Best is trial 244 with value: 0.8474070660226068.[0m
[32m[I 2022-04-21 18:42:09,786][0m Trial 564 finished with value: 0.8445317988785572 and parameters: {'loss': 'coxph', 'learning_rate': 0.00023468094461994094, 'n_estimators': 311, 'criterion': 'friedman_mse', 'min_samples_split': 3, 'min_samples_leaf': 1, 'min_weight_fraction_leaf': 0.19890541521453406, 'min_impurity_decrease': 0.3386069750871277, 'max_features': 0.3623428055021278, 'subsample': 0.06569982911287651, 'dropout_rate': 0.07014528092570955, 'ccp_alpha': 0.20625003262215494}. Best is trial 244 with value: 0.8474070660226068.[0m
[32m[I 2022-04-21 18:42:27,235][0m Trial 565 finished with value: 0.8400356819476371 and parameters: {'loss': 'coxph', 'learning_rate': 0.00026488644294633677, 'n_estimators': 298, 'criterion': 'friedman_mse', 'min_samples_split': 3, 'min_samples_leaf': 1, 'min_weight_fraction_leaf': 0.18510374622027642, 'min_impurity_decrease': 0.3141477798641351, 'max_features': 0.32655297490211116, 'subsample': 0.08328959889390532, 'dropout_rate': 0.09318982586142555, 'ccp_alpha': 0.37808273082505894}. Best is trial 244 with value: 0.8474070660226068.[0m
[32m[I 2022-04-21 18:42:47,743][0m Trial 566 finished with value: 0.8424533633116547 and parameters: {'loss': 'coxph', 'learning_rate': 1.767675804731895e-05, 'n_estimators': 291, 'criterion': 'friedman_mse', 'min_samples_split': 3, 'min_samples_leaf': 1, 'min_weight_fraction_leaf': 0.19374472383113522, 'min_impurity_decrease': 0.4122678442680384, 'max_features': 0.4210586472745961, 'subsample': 0.05456966864909104, 'dropout_rate': 0.10526962710642626, 'ccp_alpha': 0.14790321949223673}. Best is trial 244 with value: 0.8474070660226068.[0m
[32m[I 2022-04-21 18:43:22,656][0m Trial 567 finished with value: 0.8261182506435496 and parameters: {'loss': 'coxph', 'learning_rate': 0.00031309948512998637, 'n_estimators': 402, 'criterion': 'absolute_error', 'min_samples_split': 3, 'min_samples_leaf': 1, 'min_weight_fraction_leaf': 0.21587915217551867, 'min_impurity_decrease': 0.34971944775139757, 'max_features': 0.3435279775068264, 'subsample': 0.0783045538424997, 'dropout_rate': 0.11009079240713379, 'ccp_alpha': 0.07937757517651112}. Best is trial 244 with value: 0.8474070660226068.[0m
[32m[I 2022-04-21 18:43:55,237][0m Trial 568 finished with value: 0.65 and parameters: {'loss': 'coxph', 'learning_rate': 0.00016965996753656983, 'n_estimators': 327, 'criterion': 'friedman_mse', 'min_samples_split': 3, 'min_samples_leaf': 1, 'min_weight_fraction_leaf': 0.1657313624077947, 'min_impurity_decrease': 0.2581744969496512, 'max_features': 0.605804302233521, 'subsample': 0.7565579283685164, 'dropout_rate': 0.0680797935205264, 'ccp_alpha': 0.30431324102162227}. Best is trial 244 with value: 0.8474070660226068.[0m
[32m[I 2022-04-21 18:44:20,450][0m Trial 569 finished with value: 0.65 and parameters: {'loss': 'coxph', 'learning_rate': 0.00021726095621325378, 'n_estimators': 311, 'criterion': 'friedman_mse', 'min_samples_split': 3, 'min_samples_leaf': 1, 'min_weight_fraction_leaf': 0.1778754297730245, 'min_impurity_decrease': 0.22162603627955518, 'max_features': 0.3148739980026711, 'subsample': 0.020429280528682196, 'dropout_rate': 0.12453787728158351, 'ccp_alpha': 0.22562583302439146}. Best is trial 244 with value: 0.8474070660226068.[0m
[32m[I 2022-04-21 18:44:53,873][0m Trial 570 finished with value: 0.8437820748142407 and parameters: {'loss': 'coxph', 'learning_rate': 0.0032459944907298013, 'n_estimators': 337, 'criterion': 'friedman_mse', 'min_samples_split': 3, 'min_samples_leaf': 1, 'min_weight_fraction_leaf': 0.1562603695293382, 'min_impurity_decrease': 0.3819910007309598, 'max_features': 0.3878786450780439, 'subsample': 0.044702001308062754, 'dropout_rate': 0.08444912581032107, 'ccp_alpha': 0.08141774583397657}. Best is trial 244 with value: 0.8474070660226068.[0m
[32m[I 2022-04-21 18:45:12,205][0m Trial 571 finished with value: 0.8438536388024932 and parameters: {'loss': 'coxph', 'learning_rate': 0.009185404468438409, 'n_estimators': 303, 'criterion': 'friedman_mse', 'min_samples_split': 3, 'min_samples_leaf': 1, 'min_weight_fraction_leaf': 0.20164104939043614, 'min_impurity_decrease': 0.29333698483346776, 'max_features': 0.4411478431646663, 'subsample': 0.09376025601414938, 'dropout_rate': 0.10504126415873491, 'ccp_alpha': 0.20952717745832256}. Best is trial 244 with value: 0.8474070660226068.[0m
[32m[I 2022-04-21 18:45:26,476][0m Trial 572 finished with value: 0.8457930340126001 and parameters: {'loss': 'coxph', 'learning_rate': 0.00020879032788712314, 'n_estimators': 281, 'criterion': 'friedman_mse', 'min_samples_split': 3, 'min_samples_leaf': 1, 'min_weight_fraction_leaf': 0.17905505563070157, 'min_impurity_decrease': 0.32918311553827556, 'max_features': 0.3661386207084276, 'subsample': 0.059908794924310754, 'dropout_rate': 0.139266541093557, 'ccp_alpha': 0.007744369251913958}. Best is trial 244 with value: 0.8474070660226068.[0m
[32m[I 2022-04-21 18:46:55,247][0m Trial 573 finished with value: 0.8456334584042565 and parameters: {'loss': 'coxph', 'learning_rate': 0.00024776844426352483, 'n_estimators': 644, 'criterion': 'friedman_mse', 'min_samples_split': 3, 'min_samples_leaf': 1, 'min_weight_fraction_leaf': 0.18470637343105292, 'min_impurity_decrease': 0.3115780294884613, 'max_features': 0.37075639562927015, 'subsample': 0.033287410777475504, 'dropout_rate': 0.1281212054656125, 'ccp_alpha': 0.005096220881997462}. Best is trial 244 with value: 0.8474070660226068.[0m
/media/san2_ssd/data/Workdir/survival/venv/lib/python3.8/site-packages/sksurv/ensemble/boosting.py:955: RuntimeWarning: divide by zero encountered in log
  time = numpy.log(time)
/media/san2_ssd/data/Workdir/survival/venv/lib/python3.8/site-packages/sksurv/ensemble/boosting.py:955: RuntimeWarning: divide by zero encountered in log
  time = numpy.log(time)
/media/san2_ssd/data/Workdir/survival/venv/lib/python3.8/site-packages/sksurv/ensemble/boosting.py:955: RuntimeWarning: divide by zero encountered in log
  time = numpy.log(time)
/media/san2_ssd/data/Workdir/survival/venv/lib/python3.8/site-packages/sksurv/ensemble/boosting.py:955: RuntimeWarning: divide by zero encountered in log
  time = numpy.log(time)
[32m[I 2022-04-21 18:47:18,279][0m Trial 574 finished with value: -0.4664930483051949 and parameters: {'loss': 'squared', 'learning_rate': 0.0003067507232768692, 'n_estimators': 776, 'criterion': 'friedman_mse', 'min_samples_split': 3, 'min_samples_leaf': 1, 'min_weight_fraction_leaf': 0.17734547554846025, 'min_impurity_decrease': 0.2774376740004403, 'max_features': 0.4036556316598672, 'subsample': 0.058303251036456887, 'dropout_rate': 0.1381661792211064, 'ccp_alpha': 0.012646276788594146}. Best is trial 244 with value: 0.8474070660226068.[0m
[32m[I 2022-04-21 18:47:38,992][0m Trial 575 finished with value: 0.65 and parameters: {'loss': 'coxph', 'learning_rate': 0.00019405437154935184, 'n_estimators': 286, 'criterion': 'friedman_mse', 'min_samples_split': 3, 'min_samples_leaf': 1, 'min_weight_fraction_leaf': 0.19052992930264276, 'min_impurity_decrease': 0.3297326423302693, 'max_features': 0.355498084654689, 'subsample': 0.019310636989205848, 'dropout_rate': 0.11188745440786987, 'ccp_alpha': 0.1451237291420591}. Best is trial 244 with value: 0.8474070660226068.[0m
[32m[I 2022-04-21 18:48:12,827][0m Trial 576 finished with value: 0.8479692830614087 and parameters: {'loss': 'coxph', 'learning_rate': 0.00035264637667901347, 'n_estimators': 356, 'criterion': 'friedman_mse', 'min_samples_split': 3, 'min_samples_leaf': 1, 'min_weight_fraction_leaf': 0.16942651936446426, 'min_impurity_decrease': 0.31204027789991035, 'max_features': 0.38193727389929044, 'subsample': 0.06766952086089639, 'dropout_rate': 0.14622476538085669, 'ccp_alpha': 0.008942713393373701}. Best is trial 576 with value: 0.8479692830614087.[0m
[32m[I 2022-04-21 18:48:39,898][0m Trial 577 finished with value: 0.65 and parameters: {'loss': 'coxph', 'learning_rate': 0.004017139173433214, 'n_estimators': 360, 'criterion': 'friedman_mse', 'min_samples_split': 3, 'min_samples_leaf': 1, 'min_weight_fraction_leaf': 0.16393197776288146, 'min_impurity_decrease': 0.293529014422192, 'max_features': 0.38683792427753266, 'subsample': 0.07291131213170111, 'dropout_rate': 0.14937165660013219, 'ccp_alpha': 2.986098007784546}. Best is trial 576 with value: 0.8479692830614087.[0m
[32m[I 2022-04-21 18:49:01,432][0m Trial 578 finished with value: 0.846066543924859 and parameters: {'loss': 'coxph', 'learning_rate': 0.00047874116644138794, 'n_estimators': 320, 'criterion': 'friedman_mse', 'min_samples_split': 3, 'min_samples_leaf': 1, 'min_weight_fraction_leaf': 0.16993666177145914, 'min_impurity_decrease': 0.3049336316059394, 'max_features': 0.42143137103532496, 'subsample': 0.06973755455528319, 'dropout_rate': 0.14152860107277035, 'ccp_alpha': 0.007732710066203057}. Best is trial 576 with value: 0.8479692830614087.[0m
[32m[I 2022-04-21 18:49:23,757][0m Trial 579 finished with value: 0.844748135263457 and parameters: {'loss': 'coxph', 'learning_rate': 0.00038327283840483393, 'n_estimators': 336, 'criterion': 'friedman_mse', 'min_samples_split': 3, 'min_samples_leaf': 1, 'min_weight_fraction_leaf': 0.15975143426286526, 'min_impurity_decrease': 0.2650556277599824, 'max_features': 0.4122476086722655, 'subsample': 0.05649330701856459, 'dropout_rate': 0.12496481718298058, 'ccp_alpha': 0.018843532371227323}. Best is trial 576 with value: 0.8479692830614087.[0m
[32m[I 2022-04-21 18:49:45,697][0m Trial 580 finished with value: 0.8428945337155959 and parameters: {'loss': 'coxph', 'learning_rate': 0.00044160114949465886, 'n_estimators': 348, 'criterion': 'friedman_mse', 'min_samples_split': 3, 'min_samples_leaf': 1, 'min_weight_fraction_leaf': 0.16912861132988424, 'min_impurity_decrease': 0.3001093862727789, 'max_features': 0.4704345363904746, 'subsample': 0.4155234810188889, 'dropout_rate': 0.1455828464204846, 'ccp_alpha': 0.004664842936620242}. Best is trial 576 with value: 0.8479692830614087.[0m
[32m[I 2022-04-21 18:50:12,964][0m Trial 581 finished with value: 0.8447516304746454 and parameters: {'loss': 'coxph', 'learning_rate': 0.0004220895733442687, 'n_estimators': 358, 'criterion': 'friedman_mse', 'min_samples_split': 3, 'min_samples_leaf': 1, 'min_weight_fraction_leaf': 0.1503495811111664, 'min_impurity_decrease': 0.2813932951921305, 'max_features': 0.43151560453477716, 'subsample': 0.06952539454304171, 'dropout_rate': 0.1278913018923107, 'ccp_alpha': 0.08567854803464033}. Best is trial 576 with value: 0.8479692830614087.[0m
[32m[I 2022-04-21 18:50:36,335][0m Trial 582 finished with value: 0.8454950472000082 and parameters: {'loss': 'coxph', 'learning_rate': 0.0006576731070306414, 'n_estimators': 304, 'criterion': 'friedman_mse', 'min_samples_split': 3, 'min_samples_leaf': 1, 'min_weight_fraction_leaf': 0.16907879235193016, 'min_impurity_decrease': 0.2501874343080956, 'max_features': 0.3695968248911037, 'subsample': 0.04302664871941363, 'dropout_rate': 0.11142056614169366, 'ccp_alpha': 0.0019276173825370502}. Best is trial 576 with value: 0.8479692830614087.[0m
[32m[I 2022-04-21 18:50:59,146][0m Trial 583 finished with value: 0.8480221917497749 and parameters: {'loss': 'coxph', 'learning_rate': 0.00046554958344672214, 'n_estimators': 343, 'criterion': 'friedman_mse', 'min_samples_split': 3, 'min_samples_leaf': 1, 'min_weight_fraction_leaf': 0.1605902603758898, 'min_impurity_decrease': 0.30729289795866394, 'max_features': 0.3961976872299428, 'subsample': 0.06706485213751526, 'dropout_rate': 0.13666779049033456, 'ccp_alpha': 0.005895015859546132}. Best is trial 583 with value: 0.8480221917497749.[0m
[32m[I 2022-04-21 18:51:22,837][0m Trial 584 finished with value: 0.8447246402944601 and parameters: {'loss': 'coxph', 'learning_rate': 0.0005537904753771513, 'n_estimators': 308, 'criterion': 'friedman_mse', 'min_samples_split': 3, 'min_samples_leaf': 1, 'min_weight_fraction_leaf': 0.15572478535177203, 'min_impurity_decrease': 0.2702853592348153, 'max_features': 0.4093705369323876, 'subsample': 0.08138212396138528, 'dropout_rate': 0.14860685335928384, 'ccp_alpha': 0.14405930411479595}. Best is trial 583 with value: 0.8480221917497749.[0m
[32m[I 2022-04-21 18:51:54,360][0m Trial 585 finished with value: 0.8346328172266858 and parameters: {'loss': 'coxph', 'learning_rate': 0.0009504606055880214, 'n_estimators': 330, 'criterion': 'friedman_mse', 'min_samples_split': 3, 'min_samples_leaf': 1, 'min_weight_fraction_leaf': 0.15954144146725632, 'min_impurity_decrease': 0.2976119358050942, 'max_features': 0.4562493583952553, 'subsample': 0.8360504689890045, 'dropout_rate': 0.11538731069240271, 'ccp_alpha': 0.09127251091177933}. Best is trial 583 with value: 0.8480221917497749.[0m
[32m[I 2022-04-21 18:52:29,212][0m Trial 586 finished with value: 0.65 and parameters: {'loss': 'coxph', 'learning_rate': 0.0005249861043853444, 'n_estimators': 388, 'criterion': 'squared_error', 'min_samples_split': 3, 'min_samples_leaf': 1, 'min_weight_fraction_leaf': 0.14200116576284294, 'min_impurity_decrease': 0.30814607212366335, 'max_features': 0.40123748440959056, 'subsample': 0.08009703181166873, 'dropout_rate': 0.0924507841917353, 'ccp_alpha': 2.678314971320273}. Best is trial 583 with value: 0.8480221917497749.[0m
[32m[I 2022-04-21 18:52:56,346][0m Trial 587 finished with value: 0.8440297281217684 and parameters: {'loss': 'coxph', 'learning_rate': 0.0015857343951707706, 'n_estimators': 363, 'criterion': 'friedman_mse', 'min_samples_split': 3, 'min_samples_leaf': 1, 'min_weight_fraction_leaf': 0.16420117140549942, 'min_impurity_decrease': 0.28116824950348124, 'max_features': 0.43223914565019445, 'subsample': 0.04911516181519323, 'dropout_rate': 0.13540433561103477, 'ccp_alpha': 0.002642887962860524}. Best is trial 583 with value: 0.8480221917497749.[0m
