[32m[I 2022-04-21 11:42:41,090][0m Trial 178 finished with value: 0.684367348820454 and parameters: {'alpha': 0.4228652696904804, 'ties': 'efron'}. Best is trial 26 with value: 0.6847054012696481.[0m
[32m[I 2022-04-21 11:42:41,369][0m Trial 179 finished with value: 0.6847054012696481 and parameters: {'alpha': 0.8525651531963304, 'ties': 'efron'}. Best is trial 26 with value: 0.6847054012696481.[0m
[32m[I 2022-04-21 11:42:41,627][0m Trial 180 finished with value: 0.6829090813866752 and parameters: {'alpha': 1.0619719336391669, 'ties': 'efron'}. Best is trial 26 with value: 0.6847054012696481.[0m
[32m[I 2022-04-21 11:42:41,777][0m Trial 181 finished with value: 0.6847054012696481 and parameters: {'alpha': 0.8331927298990609, 'ties': 'efron'}. Best is trial 26 with value: 0.6847054012696481.[0m
[32m[I 2022-04-21 11:42:41,910][0m Trial 182 finished with value: 0.684367348820454 and parameters: {'alpha': 0.5678564500276848, 'ties': 'efron'}. Best is trial 26 with value: 0.6847054012696481.[0m
[32m[I 2022-04-21 11:42:42,041][0m Trial 183 finished with value: 0.6829090813866752 and parameters: {'alpha': 0.9028547898959602, 'ties': 'efron'}. Best is trial 26 with value: 0.6847054012696481.[0m
[32m[I 2022-04-21 11:42:42,182][0m Trial 184 finished with value: 0.6847054012696481 and parameters: {'alpha': 0.743008912362813, 'ties': 'efron'}. Best is trial 26 with value: 0.6847054012696481.[0m
[32m[I 2022-04-21 11:42:42,318][0m Trial 185 finished with value: 0.684367348820454 and parameters: {'alpha': 0.6724944040645559, 'ties': 'efron'}. Best is trial 26 with value: 0.6847054012696481.[0m
[32m[I 2022-04-21 11:42:42,455][0m Trial 186 finished with value: 0.6847054012696481 and parameters: {'alpha': 0.8051279456503829, 'ties': 'efron'}. Best is trial 26 with value: 0.6847054012696481.[0m
[32m[I 2022-04-21 11:42:42,722][0m Trial 187 finished with value: 0.684367348820454 and parameters: {'alpha': 0.627797719009429, 'ties': 'efron'}. Best is trial 26 with value: 0.6847054012696481.[0m
[32m[I 2022-04-21 11:42:42,857][0m Trial 188 finished with value: 0.6829090813866752 and parameters: {'alpha': 0.9485409090508143, 'ties': 'efron'}. Best is trial 26 with value: 0.6847054012696481.[0m
[32m[I 2022-04-21 11:42:43,007][0m Trial 189 finished with value: 0.6847054012696481 and parameters: {'alpha': 0.7037270069942457, 'ties': 'efron'}. Best is trial 26 with value: 0.6847054012696481.[0m
[32m[I 2022-04-21 11:42:43,134][0m Trial 190 finished with value: 0.684367348820454 and parameters: {'alpha': 0.49766543140139724, 'ties': 'breslow'}. Best is trial 26 with value: 0.6847054012696481.[0m
[32m[I 2022-04-21 11:42:43,272][0m Trial 191 finished with value: 0.6847054012696481 and parameters: {'alpha': 0.717935174330245, 'ties': 'efron'}. Best is trial 26 with value: 0.6847054012696481.[0m
[32m[I 2022-04-21 11:42:43,408][0m Trial 192 finished with value: 0.6847054012696481 and parameters: {'alpha': 0.8064457702063956, 'ties': 'efron'}. Best is trial 26 with value: 0.6847054012696481.[0m
[32m[I 2022-04-21 11:42:43,552][0m Trial 193 finished with value: 0.684367348820454 and parameters: {'alpha': 0.6009182541558011, 'ties': 'efron'}. Best is trial 26 with value: 0.6847054012696481.[0m
[32m[I 2022-04-21 11:42:43,684][0m Trial 194 finished with value: 0.6847054012696481 and parameters: {'alpha': 0.8528929285310268, 'ties': 'efron'}. Best is trial 26 with value: 0.6847054012696481.[0m
[32m[I 2022-04-21 11:42:43,831][0m Trial 195 finished with value: 0.6829090813866752 and parameters: {'alpha': 1.0132558280620425, 'ties': 'efron'}. Best is trial 26 with value: 0.6847054012696481.[0m
[32m[I 2022-04-21 11:42:43,975][0m Trial 196 finished with value: 0.6847054012696481 and parameters: {'alpha': 0.7838322897455333, 'ties': 'efron'}. Best is trial 26 with value: 0.6847054012696481.[0m
[32m[I 2022-04-21 11:42:44,328][0m Trial 197 finished with value: 0.6829090813866752 and parameters: {'alpha': 0.9718632643951457, 'ties': 'efron'}. Best is trial 26 with value: 0.6847054012696481.[0m
[32m[I 2022-04-21 11:42:44,560][0m Trial 198 finished with value: 0.6847054012696481 and parameters: {'alpha': 0.7236732628719246, 'ties': 'efron'}. Best is trial 26 with value: 0.6847054012696481.[0m
[32m[I 2022-04-21 11:42:44,751][0m Trial 199 finished with value: 0.6829496894793843 and parameters: {'alpha': 2.7188818327046813, 'ties': 'efron'}. Best is trial 26 with value: 0.6847054012696481.[0m
[32m[I 2022-04-21 11:42:44,990][0m Trial 200 finished with value: 0.6847054012696481 and parameters: {'alpha': 0.6947136022352843, 'ties': 'efron'}. Best is trial 26 with value: 0.6847054012696481.[0m
[32m[I 2022-04-21 11:42:45,190][0m Trial 201 finished with value: 0.6847054012696481 and parameters: {'alpha': 0.8214660659014005, 'ties': 'efron'}. Best is trial 26 with value: 0.6847054012696481.[0m
[32m[I 2022-04-21 11:42:45,363][0m Trial 202 finished with value: 0.6847054012696481 and parameters: {'alpha': 0.8192385052619926, 'ties': 'efron'}. Best is trial 26 with value: 0.6847054012696481.[0m
[32m[I 2022-04-21 11:42:45,520][0m Trial 203 finished with value: 0.6829090813866752 and parameters: {'alpha': 0.9155084421362706, 'ties': 'efron'}. Best is trial 26 with value: 0.6847054012696481.[0m
[32m[I 2022-04-21 11:42:45,747][0m Trial 204 finished with value: 0.6847054012696481 and parameters: {'alpha': 0.7623486122148475, 'ties': 'efron'}. Best is trial 26 with value: 0.6847054012696481.[0m
[32m[I 2022-04-21 11:42:45,881][0m Trial 205 finished with value: 0.684367348820454 and parameters: {'alpha': 0.6186010598292436, 'ties': 'efron'}. Best is trial 26 with value: 0.6847054012696481.[0m
[32m[I 2022-04-21 11:42:46,156][0m Trial 206 finished with value: 0.684367348820454 and parameters: {'alpha': 0.5465552224229413, 'ties': 'efron'}. Best is trial 26 with value: 0.6847054012696481.[0m
[32m[I 2022-04-21 11:42:46,323][0m Trial 207 finished with value: 0.6829090813866752 and parameters: {'alpha': 0.8846351427764853, 'ties': 'efron'}. Best is trial 26 with value: 0.6847054012696481.[0m
[32m[I 2022-04-21 11:42:46,526][0m Trial 208 finished with value: 0.6829090813866752 and parameters: {'alpha': 1.077321714895315, 'ties': 'efron'}. Best is trial 26 with value: 0.6847054012696481.[0m
[32m[I 2022-04-21 11:42:46,777][0m Trial 209 finished with value: 0.6829090813866752 and parameters: {'alpha': 0.8682207729379043, 'ties': 'efron'}. Best is trial 26 with value: 0.6847054012696481.[0m
[32m[I 2022-04-21 11:42:46,918][0m Trial 210 finished with value: 0.6829090813866752 and parameters: {'alpha': 1.0347085325035998, 'ties': 'efron'}. Best is trial 26 with value: 0.6847054012696481.[0m
[32m[I 2022-04-21 11:42:47,145][0m Trial 211 finished with value: 0.6847054012696481 and parameters: {'alpha': 0.8032127039247726, 'ties': 'efron'}. Best is trial 26 with value: 0.6847054012696481.[0m
[32m[I 2022-04-21 11:42:47,409][0m Trial 212 finished with value: 0.684367348820454 and parameters: {'alpha': 0.6703119167181167, 'ties': 'efron'}. Best is trial 26 with value: 0.6847054012696481.[0m
[32m[I 2022-04-21 11:42:47,642][0m Trial 213 finished with value: 0.6847054012696481 and parameters: {'alpha': 0.7531238946284478, 'ties': 'efron'}. Best is trial 26 with value: 0.6847054012696481.[0m
[32m[I 2022-04-21 11:42:47,903][0m Trial 214 finished with value: 0.6847054012696481 and parameters: {'alpha': 0.7625624533904807, 'ties': 'efron'}. Best is trial 26 with value: 0.6847054012696481.[0m
[32m[I 2022-04-21 11:42:48,037][0m Trial 215 finished with value: 0.6829090813866752 and parameters: {'alpha': 0.8835510281099725, 'ties': 'efron'}. Best is trial 26 with value: 0.6847054012696481.[0m
[32m[I 2022-04-21 11:42:48,330][0m Trial 216 finished with value: 0.684367348820454 and parameters: {'alpha': 0.6341227499431253, 'ties': 'efron'}. Best is trial 26 with value: 0.6847054012696481.[0m
[32m[I 2022-04-21 11:42:48,463][0m Trial 217 finished with value: 0.6829090813866752 and parameters: {'alpha': 0.9578209091216277, 'ties': 'efron'}. Best is trial 26 with value: 0.6847054012696481.[0m
[32m[I 2022-04-21 11:42:48,708][0m Trial 218 finished with value: 0.6847054012696481 and parameters: {'alpha': 0.8450888096384064, 'ties': 'efron'}. Best is trial 26 with value: 0.6847054012696481.[0m
[32m[I 2022-04-21 11:42:48,943][0m Trial 219 finished with value: 0.6829090813866752 and parameters: {'alpha': 0.8768405166402605, 'ties': 'efron'}. Best is trial 26 with value: 0.6847054012696481.[0m
[32m[I 2022-04-21 11:42:49,090][0m Trial 220 finished with value: 0.6847054012696481 and parameters: {'alpha': 0.8229466909528225, 'ties': 'efron'}. Best is trial 26 with value: 0.6847054012696481.[0m
[32m[I 2022-04-21 11:42:49,413][0m Trial 221 finished with value: 0.6847054012696481 and parameters: {'alpha': 0.759853244288263, 'ties': 'efron'}. Best is trial 26 with value: 0.6847054012696481.[0m
[32m[I 2022-04-21 11:42:49,861][0m Trial 222 finished with value: 0.6847054012696481 and parameters: {'alpha': 0.7549692765332549, 'ties': 'efron'}. Best is trial 26 with value: 0.6847054012696481.[0m
[32m[I 2022-04-21 11:42:50,378][0m Trial 223 finished with value: 0.684367348820454 and parameters: {'alpha': 0.6885375809058674, 'ties': 'efron'}. Best is trial 26 with value: 0.6847054012696481.[0m
[32m[I 2022-04-21 11:42:50,896][0m Trial 224 finished with value: 0.6847054012696481 and parameters: {'alpha': 0.6980565636886812, 'ties': 'efron'}. Best is trial 26 with value: 0.6847054012696481.[0m
[32m[I 2022-04-21 11:42:51,374][0m Trial 225 finished with value: 0.684367348820454 and parameters: {'alpha': 0.5314729758373148, 'ties': 'efron'}. Best is trial 26 with value: 0.6847054012696481.[0m
[32m[I 2022-04-21 11:42:51,598][0m Trial 226 finished with value: 0.684367348820454 and parameters: {'alpha': 0.6449216408271685, 'ties': 'efron'}. Best is trial 26 with value: 0.6847054012696481.[0m
[32m[I 2022-04-21 11:42:51,858][0m Trial 227 finished with value: 0.6847054012696481 and parameters: {'alpha': 0.7272621530218558, 'ties': 'breslow'}. Best is trial 26 with value: 0.6847054012696481.[0m
[32m[I 2022-04-21 11:42:52,269][0m Trial 228 finished with value: 0.684367348820454 and parameters: {'alpha': 0.5599946308628634, 'ties': 'breslow'}. Best is trial 26 with value: 0.6847054012696481.[0m
[32m[I 2022-04-21 11:42:52,678][0m Trial 229 finished with value: 0.6829090813866752 and parameters: {'alpha': 0.9600990775167362, 'ties': 'breslow'}. Best is trial 26 with value: 0.6847054012696481.[0m
[32m[I 2022-04-21 11:42:53,120][0m Trial 230 finished with value: 0.684367348820454 and parameters: {'alpha': 0.4574982477401184, 'ties': 'efron'}. Best is trial 26 with value: 0.6847054012696481.[0m
[32m[I 2022-04-21 11:42:53,581][0m Trial 231 finished with value: 0.6847054012696481 and parameters: {'alpha': 0.7704524906473572, 'ties': 'efron'}. Best is trial 26 with value: 0.6847054012696481.[0m
[32m[I 2022-04-21 11:42:53,998][0m Trial 232 finished with value: 0.6847054012696481 and parameters: {'alpha': 0.7913728336748905, 'ties': 'efron'}. Best is trial 26 with value: 0.6847054012696481.[0m
[32m[I 2022-04-21 11:42:54,174][0m Trial 233 finished with value: 0.6847054012696481 and parameters: {'alpha': 0.6934415376927928, 'ties': 'efron'}. Best is trial 26 with value: 0.6847054012696481.[0m
[32m[I 2022-04-21 11:42:54,430][0m Trial 234 finished with value: 0.6829090813866752 and parameters: {'alpha': 0.8696223783086713, 'ties': 'efron'}. Best is trial 26 with value: 0.6847054012696481.[0m
[32m[I 2022-04-21 11:42:54,617][0m Trial 235 finished with value: 0.684367348820454 and parameters: {'alpha': 0.6319796887793978, 'ties': 'efron'}. Best is trial 26 with value: 0.6847054012696481.[0m
[32m[I 2022-04-21 11:42:54,751][0m Trial 236 finished with value: 0.6829090813866752 and parameters: {'alpha': 0.9290722934568102, 'ties': 'efron'}. Best is trial 26 with value: 0.6847054012696481.[0m
[32m[I 2022-04-21 11:42:54,884][0m Trial 237 finished with value: 0.6847054012696481 and parameters: {'alpha': 0.8145767929342604, 'ties': 'efron'}. Best is trial 26 with value: 0.6847054012696481.[0m
[32m[I 2022-04-21 11:42:55,017][0m Trial 238 finished with value: 0.684367348820454 and parameters: {'alpha': 0.6836087046057377, 'ties': 'efron'}. Best is trial 26 with value: 0.6847054012696481.[0m
[32m[I 2022-04-21 11:42:55,154][0m Trial 239 finished with value: 0.6847054012696481 and parameters: {'alpha': 0.7231730298483245, 'ties': 'efron'}. Best is trial 26 with value: 0.6847054012696481.[0m
[32m[I 2022-04-21 11:42:55,287][0m Trial 240 finished with value: 0.684367348820454 and parameters: {'alpha': 0.576203695860337, 'ties': 'efron'}. Best is trial 26 with value: 0.6847054012696481.[0m
[32m[I 2022-04-21 11:42:55,419][0m Trial 241 finished with value: 0.6847054012696481 and parameters: {'alpha': 0.7508729225219516, 'ties': 'efron'}. Best is trial 26 with value: 0.6847054012696481.[0m
[32m[I 2022-04-21 11:42:55,557][0m Trial 242 finished with value: 0.6847054012696481 and parameters: {'alpha': 0.7841134806146073, 'ties': 'efron'}. Best is trial 26 with value: 0.6847054012696481.[0m
[32m[I 2022-04-21 11:42:55,694][0m Trial 243 finished with value: 0.6847054012696481 and parameters: {'alpha': 0.7223880081175564, 'ties': 'efron'}. Best is trial 26 with value: 0.6847054012696481.[0m
[32m[I 2022-04-21 11:42:55,831][0m Trial 244 finished with value: 0.6847054012696481 and parameters: {'alpha': 0.8287168360338374, 'ties': 'efron'}. Best is trial 26 with value: 0.6847054012696481.[0m
[32m[I 2022-04-21 11:42:55,967][0m Trial 245 finished with value: 0.6847054012696481 and parameters: {'alpha': 0.8258733933465038, 'ties': 'efron'}. Best is trial 26 with value: 0.6847054012696481.[0m
[32m[I 2022-04-21 11:42:56,209][0m Trial 246 finished with value: 0.684367348820454 and parameters: {'alpha': 0.6243377899650977, 'ties': 'efron'}. Best is trial 26 with value: 0.6847054012696481.[0m
[32m[I 2022-04-21 11:42:56,500][0m Trial 247 finished with value: 0.6829090813866752 and parameters: {'alpha': 0.9805401765320727, 'ties': 'efron'}. Best is trial 26 with value: 0.6847054012696481.[0m
[32m[I 2022-04-21 11:42:56,778][0m Trial 248 finished with value: 0.6847054012696481 and parameters: {'alpha': 0.8360172537329338, 'ties': 'efron'}. Best is trial 26 with value: 0.6847054012696481.[0m
[32m[I 2022-04-21 11:42:57,065][0m Trial 249 finished with value: 0.6829090813866752 and parameters: {'alpha': 0.9167640268217613, 'ties': 'efron'}. Best is trial 26 with value: 0.6847054012696481.[0m
[32m[I 2022-04-21 11:42:57,474][0m Trial 250 finished with value: 0.6847054012696481 and parameters: {'alpha': 0.8999424742282576, 'ties': 'breslow'}. Best is trial 26 with value: 0.6847054012696481.[0m
[32m[I 2022-04-21 11:42:57,760][0m Trial 251 finished with value: 0.6847054012696481 and parameters: {'alpha': 0.7854076045018503, 'ties': 'breslow'}. Best is trial 26 with value: 0.6847054012696481.[0m
[32m[I 2022-04-21 11:42:58,041][0m Trial 252 finished with value: 0.684367348820454 and parameters: {'alpha': 0.6424786516385991, 'ties': 'efron'}. Best is trial 26 with value: 0.6847054012696481.[0m
[32m[I 2022-04-21 11:42:58,350][0m Trial 253 finished with value: 0.6814469677485105 and parameters: {'alpha': 3.812408706861407, 'ties': 'efron'}. Best is trial 26 with value: 0.6847054012696481.[0m
[32m[I 2022-04-21 11:42:58,681][0m Trial 254 finished with value: 0.6829090813866752 and parameters: {'alpha': 1.0189435842965395, 'ties': 'efron'}. Best is trial 26 with value: 0.6847054012696481.[0m
[32m[I 2022-04-21 11:42:59,134][0m Trial 255 finished with value: 0.6847054012696481 and parameters: {'alpha': 0.7999001399075555, 'ties': 'efron'}. Best is trial 26 with value: 0.6847054012696481.[0m
[32m[I 2022-04-21 11:42:59,489][0m Trial 256 finished with value: 0.684367348820454 and parameters: {'alpha': 0.5665443697016141, 'ties': 'efron'}. Best is trial 26 with value: 0.6847054012696481.[0m
[32m[I 2022-04-21 11:42:59,817][0m Trial 257 finished with value: 0.684367348820454 and parameters: {'alpha': 0.6576838840413611, 'ties': 'efron'}. Best is trial 26 with value: 0.6847054012696481.[0m
[32m[I 2022-04-21 11:43:00,047][0m Trial 258 finished with value: 0.6847054012696481 and parameters: {'alpha': 0.7102168027396596, 'ties': 'efron'}. Best is trial 26 with value: 0.6847054012696481.[0m
[32m[I 2022-04-21 11:43:00,248][0m Trial 259 finished with value: 0.6847054012696481 and parameters: {'alpha': 0.7087678924228992, 'ties': 'efron'}. Best is trial 26 with value: 0.6847054012696481.[0m
[32m[I 2022-04-21 11:43:00,551][0m Trial 260 finished with value: 0.684367348820454 and parameters: {'alpha': 0.4714012719823926, 'ties': 'efron'}. Best is trial 26 with value: 0.6847054012696481.[0m
[32m[I 2022-04-21 11:43:00,958][0m Trial 261 finished with value: 0.6829090813866752 and parameters: {'alpha': 0.9160761474630714, 'ties': 'efron'}. Best is trial 26 with value: 0.6847054012696481.[0m
[32m[I 2022-04-21 11:43:01,190][0m Trial 262 finished with value: 0.6829090813866752 and parameters: {'alpha': 1.108256493375178, 'ties': 'breslow'}. Best is trial 26 with value: 0.6847054012696481.[0m
[32m[I 2022-04-21 11:43:01,465][0m Trial 263 finished with value: 0.6829090813866752 and parameters: {'alpha': 0.9903744496367608, 'ties': 'breslow'}. Best is trial 26 with value: 0.6847054012696481.[0m
[32m[I 2022-04-21 11:43:01,625][0m Trial 264 finished with value: 0.6847054012696481 and parameters: {'alpha': 0.844144848502984, 'ties': 'efron'}. Best is trial 26 with value: 0.6847054012696481.[0m
[32m[I 2022-04-21 11:43:01,922][0m Trial 265 finished with value: 0.6829090813866752 and parameters: {'alpha': 0.8675963977895971, 'ties': 'efron'}. Best is trial 26 with value: 0.6847054012696481.[0m
[32m[I 2022-04-21 11:43:02,279][0m Trial 266 finished with value: 0.6847054012696481 and parameters: {'alpha': 0.78584522316699, 'ties': 'breslow'}. Best is trial 26 with value: 0.6847054012696481.[0m
[32m[I 2022-04-21 11:43:02,639][0m Trial 267 finished with value: 0.6814469677485105 and parameters: {'alpha': 4.25401783773509, 'ties': 'efron'}. Best is trial 26 with value: 0.6847054012696481.[0m
[32m[I 2022-04-21 11:43:02,931][0m Trial 268 finished with value: 0.6847054012696481 and parameters: {'alpha': 0.777414328716504, 'ties': 'efron'}. Best is trial 26 with value: 0.6847054012696481.[0m
[32m[I 2022-04-21 11:43:03,206][0m Trial 269 finished with value: 0.684367348820454 and parameters: {'alpha': 0.5618560826726945, 'ties': 'efron'}. Best is trial 26 with value: 0.6847054012696481.[0m
[32m[I 2022-04-21 11:43:03,358][0m Trial 270 finished with value: 0.684367348820454 and parameters: {'alpha': 0.3462746345308912, 'ties': 'efron'}. Best is trial 26 with value: 0.6847054012696481.[0m
[32m[I 2022-04-21 11:43:03,589][0m Trial 271 finished with value: 0.6829090813866752 and parameters: {'alpha': 0.9366152190000776, 'ties': 'efron'}. Best is trial 26 with value: 0.6847054012696481.[0m
[32m[I 2022-04-21 11:43:03,867][0m Trial 272 finished with value: 0.6847054012696481 and parameters: {'alpha': 0.7082874384290261, 'ties': 'efron'}. Best is trial 26 with value: 0.6847054012696481.[0m
[32m[I 2022-04-21 11:43:04,191][0m Trial 273 finished with value: 0.6847054012696481 and parameters: {'alpha': 0.7454537081284816, 'ties': 'efron'}. Best is trial 26 with value: 0.6847054012696481.[0m
[32m[I 2022-04-21 11:43:04,488][0m Trial 274 finished with value: 0.684367348820454 and parameters: {'alpha': 0.6511882769713138, 'ties': 'efron'}. Best is trial 26 with value: 0.6847054012696481.[0m
[32m[I 2022-04-21 11:43:04,773][0m Trial 275 finished with value: 0.684367348820454 and parameters: {'alpha': 0.5250418700801867, 'ties': 'efron'}. Best is trial 26 with value: 0.6847054012696481.[0m
[32m[I 2022-04-21 11:43:04,932][0m Trial 276 finished with value: 0.6847054012696481 and parameters: {'alpha': 0.8579734644776813, 'ties': 'efron'}. Best is trial 26 with value: 0.6847054012696481.[0m
[32m[I 2022-04-21 11:43:05,187][0m Trial 277 finished with value: 0.6829090813866752 and parameters: {'alpha': 1.0158266512680596, 'ties': 'efron'}. Best is trial 26 with value: 0.6847054012696481.[0m
[32m[I 2022-04-21 11:43:05,520][0m Trial 278 finished with value: 0.6847054012696481 and parameters: {'alpha': 0.7659801173019521, 'ties': 'breslow'}. Best is trial 26 with value: 0.6847054012696481.[0m
[32m[I 2022-04-21 11:43:05,697][0m Trial 279 finished with value: 0.6847054012696481 and parameters: {'alpha': 0.8290283836827159, 'ties': 'efron'}. Best is trial 26 with value: 0.6847054012696481.[0m
[32m[I 2022-04-21 11:43:06,110][0m Trial 280 finished with value: 0.6829090813866752 and parameters: {'alpha': 1.1654138085532433, 'ties': 'efron'}. Best is trial 26 with value: 0.6847054012696481.[0m
[32m[I 2022-04-21 11:43:06,629][0m Trial 281 finished with value: 0.6829090813866752 and parameters: {'alpha': 0.9076704937178232, 'ties': 'efron'}. Best is trial 26 with value: 0.6847054012696481.[0m
[32m[I 2022-04-21 11:43:07,016][0m Trial 282 finished with value: 0.6847054012696481 and parameters: {'alpha': 0.8830997457106664, 'ties': 'breslow'}. Best is trial 26 with value: 0.6847054012696481.[0m
[32m[I 2022-04-21 11:43:07,357][0m Trial 283 finished with value: 0.684367348820454 and parameters: {'alpha': 0.6126104548497244, 'ties': 'efron'}. Best is trial 26 with value: 0.6847054012696481.[0m
[32m[I 2022-04-21 11:43:07,690][0m Trial 284 finished with value: 0.682613451992282 and parameters: {'alpha': 2.298874642812197, 'ties': 'efron'}. Best is trial 26 with value: 0.6847054012696481.[0m
