[32m[I 2022-04-22 16:47:28,325][0m Trial 183 finished with value: 0.6389912631261457 and parameters: {'loss': 'coxph', 'learning_rate': 0.0020628307396632316, 'n_estimators': 266, 'criterion': 'friedman_mse', 'min_samples_split': 9, 'min_samples_leaf': 2, 'min_weight_fraction_leaf': 0.01900096348782722, 'min_impurity_decrease': 0.7797403254258991, 'max_features': 0.4347382240510923, 'subsample': 0.16213416304266765, 'dropout_rate': 0.15934183751760483, 'ccp_alpha': 0.020547827078904048}. Best is trial 143 with value: 0.6514796499186757.[0m
[32m[I 2022-04-22 16:47:53,901][0m Trial 184 finished with value: 0.5278079527246566 and parameters: {'loss': 'coxph', 'learning_rate': 0.001589499738719407, 'n_estimators': 298, 'criterion': 'friedman_mse', 'min_samples_split': 9, 'min_samples_leaf': 2, 'min_weight_fraction_leaf': 0.034199379646630335, 'min_impurity_decrease': 0.800767221784962, 'max_features': 0.39402390970450707, 'subsample': 0.19066554516444603, 'dropout_rate': 0.10633504941558343, 'ccp_alpha': 0.3445170512936048}. Best is trial 143 with value: 0.6514796499186757.[0m
[32m[I 2022-04-22 16:48:32,076][0m Trial 185 finished with value: 0.6447359605480756 and parameters: {'loss': 'coxph', 'learning_rate': 0.003516291219237572, 'n_estimators': 369, 'criterion': 'friedman_mse', 'min_samples_split': 9, 'min_samples_leaf': 2, 'min_weight_fraction_leaf': 0.010877093094904988, 'min_impurity_decrease': 0.7571995177537816, 'max_features': 0.3578564632093285, 'subsample': 0.11630302262206207, 'dropout_rate': 0.13448630657503538, 'ccp_alpha': 0.14863033837982859}. Best is trial 143 with value: 0.6514796499186757.[0m
[32m[I 2022-04-22 16:49:12,644][0m Trial 186 finished with value: 0.6403743617062354 and parameters: {'loss': 'coxph', 'learning_rate': 0.0053885877662476316, 'n_estimators': 361, 'criterion': 'friedman_mse', 'min_samples_split': 9, 'min_samples_leaf': 2, 'min_weight_fraction_leaf': 0.002085694655410794, 'min_impurity_decrease': 0.7547576855241211, 'max_features': 0.33778650462239723, 'subsample': 0.11816873229992221, 'dropout_rate': 0.0296008959760123, 'ccp_alpha': 0.004483433844627502}. Best is trial 143 with value: 0.6514796499186757.[0m
[32m[I 2022-04-22 16:49:52,283][0m Trial 187 finished with value: 0.6164640046862935 and parameters: {'loss': 'coxph', 'learning_rate': 0.00312560698511691, 'n_estimators': 378, 'criterion': 'friedman_mse', 'min_samples_split': 9, 'min_samples_leaf': 2, 'min_weight_fraction_leaf': 0.012670294778382895, 'min_impurity_decrease': 0.7317686010646517, 'max_features': 0.35188200684383386, 'subsample': 0.13933299011417005, 'dropout_rate': 0.0854506907314428, 'ccp_alpha': 0.22232278180372878}. Best is trial 143 with value: 0.6514796499186757.[0m
[32m[I 2022-04-22 16:50:24,056][0m Trial 188 finished with value: 0.6459815395350631 and parameters: {'loss': 'coxph', 'learning_rate': 0.0018316244161262181, 'n_estimators': 328, 'criterion': 'friedman_mse', 'min_samples_split': 9, 'min_samples_leaf': 2, 'min_weight_fraction_leaf': 0.024436011989049322, 'min_impurity_decrease': 0.7740842248980507, 'max_features': 0.4140119621776535, 'subsample': 0.11833957798002502, 'dropout_rate': 0.1372080431735202, 'ccp_alpha': 0.15949324996669245}. Best is trial 143 with value: 0.6514796499186757.[0m
/media/san2_ssd/data/Workdir/survival/venv/lib/python3.8/site-packages/sksurv/ensemble/boosting.py:955: RuntimeWarning: divide by zero encountered in log
  time = numpy.log(time)
/media/san2_ssd/data/Workdir/survival/venv/lib/python3.8/site-packages/sksurv/ensemble/boosting.py:955: RuntimeWarning: divide by zero encountered in log
  time = numpy.log(time)
/media/san2_ssd/data/Workdir/survival/venv/lib/python3.8/site-packages/sksurv/ensemble/boosting.py:955: RuntimeWarning: divide by zero encountered in log
  time = numpy.log(time)
/media/san2_ssd/data/Workdir/survival/venv/lib/python3.8/site-packages/sksurv/ensemble/boosting.py:955: RuntimeWarning: divide by zero encountered in log
  time = numpy.log(time)
[32m[I 2022-04-22 16:50:30,270][0m Trial 189 finished with value: -0.7309814233585297 and parameters: {'loss': 'squared', 'learning_rate': 0.0018919104643850878, 'n_estimators': 327, 'criterion': 'friedman_mse', 'min_samples_split': 9, 'min_samples_leaf': 3, 'min_weight_fraction_leaf': 0.014640850489180849, 'min_impurity_decrease': 0.8458059897922008, 'max_features': 0.31073696840514603, 'subsample': 0.12654768626143428, 'dropout_rate': 0.13610339091959953, 'ccp_alpha': 0.15690709748998516}. Best is trial 143 with value: 0.6514796499186757.[0m
[32m[I 2022-04-22 16:51:02,732][0m Trial 190 finished with value: 0.6000329641008513 and parameters: {'loss': 'coxph', 'learning_rate': 0.0012653367117927124, 'n_estimators': 332, 'criterion': 'friedman_mse', 'min_samples_split': 9, 'min_samples_leaf': 2, 'min_weight_fraction_leaf': 0.022082769545590037, 'min_impurity_decrease': 0.8179771068257651, 'max_features': 0.4325201265715249, 'subsample': 0.11781417805739813, 'dropout_rate': 0.1182860910063826, 'ccp_alpha': 0.33118203860097606}. Best is trial 143 with value: 0.6514796499186757.[0m
[32m[I 2022-04-22 16:51:30,716][0m Trial 191 finished with value: 0.6418042290592411 and parameters: {'loss': 'coxph', 'learning_rate': 0.004021147335932111, 'n_estimators': 307, 'criterion': 'friedman_mse', 'min_samples_split': 9, 'min_samples_leaf': 2, 'min_weight_fraction_leaf': 0.0012348701842561302, 'min_impurity_decrease': 0.7748907925611023, 'max_features': 0.4124798212186864, 'subsample': 0.14843209881513508, 'dropout_rate': 0.13699225102787824, 'ccp_alpha': 0.14998911247311153}. Best is trial 143 with value: 0.6514796499186757.[0m
[32m[I 2022-04-22 16:52:09,742][0m Trial 192 finished with value: 0.6148133326961976 and parameters: {'loss': 'coxph', 'learning_rate': 0.0019069224724353791, 'n_estimators': 373, 'criterion': 'friedman_mse', 'min_samples_split': 9, 'min_samples_leaf': 2, 'min_weight_fraction_leaf': 0.025453661096467736, 'min_impurity_decrease': 0.7668645471981272, 'max_features': 0.3859565402922993, 'subsample': 0.17833965588271497, 'dropout_rate': 0.10037875020308967, 'ccp_alpha': 0.2286623077749887}. Best is trial 143 with value: 0.6514796499186757.[0m
[32m[I 2022-04-22 16:52:42,093][0m Trial 193 finished with value: 0.6478073286046323 and parameters: {'loss': 'coxph', 'learning_rate': 0.0014972402099712463, 'n_estimators': 336, 'criterion': 'friedman_mse', 'min_samples_split': 9, 'min_samples_leaf': 2, 'min_weight_fraction_leaf': 0.04774811023354468, 'min_impurity_decrease': 0.7971327186366164, 'max_features': 0.4174176735652728, 'subsample': 0.14599639378913554, 'dropout_rate': 0.1661524194958998, 'ccp_alpha': 0.11629859985742896}. Best is trial 143 with value: 0.6514796499186757.[0m
[32m[I 2022-04-22 16:53:15,587][0m Trial 194 finished with value: 0.6394081741447966 and parameters: {'loss': 'coxph', 'learning_rate': 0.001518827095781605, 'n_estimators': 345, 'criterion': 'friedman_mse', 'min_samples_split': 9, 'min_samples_leaf': 2, 'min_weight_fraction_leaf': 0.04894844563152803, 'min_impurity_decrease': 0.7938997381869745, 'max_features': 0.45648900841744494, 'subsample': 0.1128838037055728, 'dropout_rate': 0.1599841542541642, 'ccp_alpha': 0.112967009981727}. Best is trial 143 with value: 0.6514796499186757.[0m
[32m[I 2022-04-22 16:53:43,143][0m Trial 195 finished with value: 0.621088000636662 and parameters: {'loss': 'coxph', 'learning_rate': 0.0012185003438615065, 'n_estimators': 315, 'criterion': 'friedman_mse', 'min_samples_split': 9, 'min_samples_leaf': 2, 'min_weight_fraction_leaf': 0.0655021160101352, 'min_impurity_decrease': 0.7272607376439564, 'max_features': 0.413489654281628, 'subsample': 0.07477983409524103, 'dropout_rate': 0.12175526757156367, 'ccp_alpha': 0.24253109840589998}. Best is trial 143 with value: 0.6514796499186757.[0m
[32m[I 2022-04-22 16:54:15,615][0m Trial 196 finished with value: 0.6382400610055816 and parameters: {'loss': 'coxph', 'learning_rate': 0.002942131855853694, 'n_estimators': 332, 'criterion': 'friedman_mse', 'min_samples_split': 9, 'min_samples_leaf': 2, 'min_weight_fraction_leaf': 0.03749384513419082, 'min_impurity_decrease': 0.802494663183081, 'max_features': 0.4411162319385462, 'subsample': 0.14312034322476397, 'dropout_rate': 0.07542536324490592, 'ccp_alpha': 0.12662172503090127}. Best is trial 143 with value: 0.6514796499186757.[0m
[32m[I 2022-04-22 16:54:36,657][0m Trial 197 finished with value: 0.5006540204610004 and parameters: {'loss': 'coxph', 'learning_rate': 0.002206977592488795, 'n_estimators': 266, 'criterion': 'friedman_mse', 'min_samples_split': 9, 'min_samples_leaf': 2, 'min_weight_fraction_leaf': 0.00903918609384905, 'min_impurity_decrease': 0.7620847149673151, 'max_features': 0.36193277260266143, 'subsample': 0.13370380882299773, 'dropout_rate': 0.13942901383169048, 'ccp_alpha': 0.45659339041137303}. Best is trial 143 with value: 0.6514796499186757.[0m
[32m[I 2022-04-22 16:55:00,857][0m Trial 198 finished with value: 0.5457727829241851 and parameters: {'loss': 'coxph', 'learning_rate': 0.0015290658684189453, 'n_estimators': 285, 'criterion': 'friedman_mse', 'min_samples_split': 9, 'min_samples_leaf': 2, 'min_weight_fraction_leaf': 0.01825708389722246, 'min_impurity_decrease': 0.7789560874634914, 'max_features': 0.41865847672162204, 'subsample': 0.15719534317850464, 'dropout_rate': 0.10342188410661339, 'ccp_alpha': 0.3332846652753907}. Best is trial 143 with value: 0.6514796499186757.[0m
[32m[I 2022-04-22 16:55:36,860][0m Trial 199 finished with value: 0.6519341410484283 and parameters: {'loss': 'coxph', 'learning_rate': 0.001865977398729761, 'n_estimators': 352, 'criterion': 'friedman_mse', 'min_samples_split': 9, 'min_samples_leaf': 3, 'min_weight_fraction_leaf': 0.05171768250472448, 'min_impurity_decrease': 0.8229063456428608, 'max_features': 0.4597911432483099, 'subsample': 0.11968696803411169, 'dropout_rate': 0.16868966801641813, 'ccp_alpha': 0.10070864505758434}. Best is trial 199 with value: 0.6519341410484283.[0m
[32m[I 2022-04-22 16:56:16,402][0m Trial 200 finished with value: 0.652578054926717 and parameters: {'loss': 'coxph', 'learning_rate': 0.0035788553962905058, 'n_estimators': 363, 'criterion': 'friedman_mse', 'min_samples_split': 9, 'min_samples_leaf': 3, 'min_weight_fraction_leaf': 0.0483829083418197, 'min_impurity_decrease': 0.8184466433600815, 'max_features': 0.46091744438054294, 'subsample': 0.11896387316485355, 'dropout_rate': 0.16690387354823935, 'ccp_alpha': 0.0036270782406990134}. Best is trial 200 with value: 0.652578054926717.[0m
[32m[I 2022-04-22 16:56:52,610][0m Trial 201 finished with value: 0.6499272512035803 and parameters: {'loss': 'coxph', 'learning_rate': 0.0033756197198985113, 'n_estimators': 354, 'criterion': 'friedman_mse', 'min_samples_split': 9, 'min_samples_leaf': 3, 'min_weight_fraction_leaf': 0.05312298922780016, 'min_impurity_decrease': 0.831970892593324, 'max_features': 0.4573787454044006, 'subsample': 0.11729494164314819, 'dropout_rate': 0.16483260465943406, 'ccp_alpha': 0.006702639814271549}. Best is trial 200 with value: 0.652578054926717.[0m
[32m[I 2022-04-22 16:57:28,237][0m Trial 202 finished with value: 0.6505560452081789 and parameters: {'loss': 'coxph', 'learning_rate': 0.0020140292319952846, 'n_estimators': 349, 'criterion': 'friedman_mse', 'min_samples_split': 9, 'min_samples_leaf': 3, 'min_weight_fraction_leaf': 0.05355780687489167, 'min_impurity_decrease': 0.8625012078052976, 'max_features': 0.46315456284858064, 'subsample': 0.15026965975728762, 'dropout_rate': 0.16126214229287225, 'ccp_alpha': 0.012530477353102323}. Best is trial 200 with value: 0.652578054926717.[0m
[32m[I 2022-04-22 16:58:04,623][0m Trial 203 finished with value: 0.6497471065780466 and parameters: {'loss': 'coxph', 'learning_rate': 0.0026378962173496923, 'n_estimators': 357, 'criterion': 'friedman_mse', 'min_samples_split': 9, 'min_samples_leaf': 3, 'min_weight_fraction_leaf': 0.053525095501694195, 'min_impurity_decrease': 0.8783616216328404, 'max_features': 0.45653907212915223, 'subsample': 0.15501996037312385, 'dropout_rate': 0.16464903813347484, 'ccp_alpha': 0.0715859615318428}. Best is trial 200 with value: 0.652578054926717.[0m
[32m[I 2022-04-22 16:58:48,227][0m Trial 204 finished with value: 0.6497283528394935 and parameters: {'loss': 'coxph', 'learning_rate': 0.002785248258877511, 'n_estimators': 397, 'criterion': 'friedman_mse', 'min_samples_split': 9, 'min_samples_leaf': 3, 'min_weight_fraction_leaf': 0.056793989874541664, 'min_impurity_decrease': 0.8668560038653115, 'max_features': 0.45602091929580685, 'subsample': 0.16251973840248335, 'dropout_rate': 0.16511003927092002, 'ccp_alpha': 0.08673945867425593}. Best is trial 200 with value: 0.652578054926717.[0m
[32m[I 2022-04-22 16:59:44,747][0m Trial 205 finished with value: 0.6503231314389126 and parameters: {'loss': 'coxph', 'learning_rate': 0.002620475167323843, 'n_estimators': 444, 'criterion': 'friedman_mse', 'min_samples_split': 9, 'min_samples_leaf': 3, 'min_weight_fraction_leaf': 0.05783274366534674, 'min_impurity_decrease': 0.8942627920874233, 'max_features': 0.4584555901426952, 'subsample': 0.1613705816741762, 'dropout_rate': 0.1693274648317205, 'ccp_alpha': 0.0036542129534015717}. Best is trial 200 with value: 0.652578054926717.[0m
[32m[I 2022-04-22 17:00:38,932][0m Trial 206 finished with value: 0.6524576005683023 and parameters: {'loss': 'coxph', 'learning_rate': 0.003400831460105771, 'n_estimators': 447, 'criterion': 'friedman_mse', 'min_samples_split': 9, 'min_samples_leaf': 3, 'min_weight_fraction_leaf': 0.05910592344398931, 'min_impurity_decrease': 0.8762687876450155, 'max_features': 0.46210001735916467, 'subsample': 0.15583225958063432, 'dropout_rate': 0.1643672849310037, 'ccp_alpha': 0.0012921081313940902}. Best is trial 200 with value: 0.652578054926717.[0m
[32m[I 2022-04-22 17:01:33,113][0m Trial 207 finished with value: 0.6488545028460255 and parameters: {'loss': 'coxph', 'learning_rate': 0.005599630231339425, 'n_estimators': 445, 'criterion': 'friedman_mse', 'min_samples_split': 9, 'min_samples_leaf': 3, 'min_weight_fraction_leaf': 0.06152144091699322, 'min_impurity_decrease': 0.8793119068127477, 'max_features': 0.460811106224971, 'subsample': 0.1681289659547901, 'dropout_rate': 0.16740827466746588, 'ccp_alpha': 0.09772636080864765}. Best is trial 200 with value: 0.652578054926717.[0m
[32m[I 2022-04-22 17:02:21,962][0m Trial 208 finished with value: 0.6172580652984636 and parameters: {'loss': 'coxph', 'learning_rate': 0.008024800134654559, 'n_estimators': 443, 'criterion': 'friedman_mse', 'min_samples_split': 9, 'min_samples_leaf': 3, 'min_weight_fraction_leaf': 0.06261967269410111, 'min_impurity_decrease': 0.8765988390234196, 'max_features': 0.4973458991242797, 'subsample': 0.17586062051455162, 'dropout_rate': 0.1976876763510926, 'ccp_alpha': 0.26152625857697676}. Best is trial 200 with value: 0.652578054926717.[0m
[32m[I 2022-04-22 17:03:04,212][0m Trial 209 finished with value: 0.6466328271108978 and parameters: {'loss': 'coxph', 'learning_rate': 0.004809537915915934, 'n_estimators': 398, 'criterion': 'friedman_mse', 'min_samples_split': 9, 'min_samples_leaf': 3, 'min_weight_fraction_leaf': 0.05446452904273389, 'min_impurity_decrease': 0.9031131309500361, 'max_features': 0.4632938354567189, 'subsample': 0.14326752921075048, 'dropout_rate': 0.16925928707861676, 'ccp_alpha': 0.011461365717455471}. Best is trial 200 with value: 0.652578054926717.[0m
[32m[I 2022-04-22 17:04:04,860][0m Trial 210 finished with value: 0.6596104189213274 and parameters: {'loss': 'coxph', 'learning_rate': 0.006840029780795502, 'n_estimators': 492, 'criterion': 'friedman_mse', 'min_samples_split': 9, 'min_samples_leaf': 3, 'min_weight_fraction_leaf': 0.07012093536543743, 'min_impurity_decrease': 0.8583305274705164, 'max_features': 0.46181299201848663, 'subsample': 0.17208956009590629, 'dropout_rate': 0.2203813004684578, 'ccp_alpha': 0.00569710889708814}. Best is trial 210 with value: 0.6596104189213274.[0m
[32m[I 2022-04-22 17:05:06,552][0m Trial 211 finished with value: 0.6600894788590785 and parameters: {'loss': 'coxph', 'learning_rate': 0.00673024565275744, 'n_estimators': 512, 'criterion': 'friedman_mse', 'min_samples_split': 9, 'min_samples_leaf': 3, 'min_weight_fraction_leaf': 0.06905601729208452, 'min_impurity_decrease': 0.877674505758354, 'max_features': 0.4612244909567012, 'subsample': 0.20231076502435327, 'dropout_rate': 0.22495639611283427, 'ccp_alpha': 0.10293972750409329}. Best is trial 211 with value: 0.6600894788590785.[0m
[32m[I 2022-04-22 17:06:07,690][0m Trial 212 finished with value: 0.6506779689330882 and parameters: {'loss': 'coxph', 'learning_rate': 0.005769453300459566, 'n_estimators': 509, 'criterion': 'friedman_mse', 'min_samples_split': 9, 'min_samples_leaf': 3, 'min_weight_fraction_leaf': 0.07052793564418938, 'min_impurity_decrease': 0.8604732413526472, 'max_features': 0.4612490974797784, 'subsample': 0.1853979929783773, 'dropout_rate': 0.22421673582232607, 'ccp_alpha': 0.12836047889773697}. Best is trial 211 with value: 0.6600894788590785.[0m
[32m[I 2022-04-22 17:07:09,079][0m Trial 213 finished with value: 0.6536030447412149 and parameters: {'loss': 'coxph', 'learning_rate': 0.006315440627118462, 'n_estimators': 517, 'criterion': 'friedman_mse', 'min_samples_split': 9, 'min_samples_leaf': 3, 'min_weight_fraction_leaf': 0.06950374567887077, 'min_impurity_decrease': 0.8684028912033798, 'max_features': 0.4637978284445729, 'subsample': 0.2154733651742588, 'dropout_rate': 0.23224294448578423, 'ccp_alpha': 0.18308540054184935}. Best is trial 211 with value: 0.6600894788590785.[0m
[32m[I 2022-04-22 17:08:16,847][0m Trial 214 finished with value: 0.624611940090886 and parameters: {'loss': 'coxph', 'learning_rate': 0.006746106995374385, 'n_estimators': 529, 'criterion': 'friedman_mse', 'min_samples_split': 9, 'min_samples_leaf': 3, 'min_weight_fraction_leaf': 0.07128674903866378, 'min_impurity_decrease': 0.8611275363045602, 'max_features': 0.4661147496857314, 'subsample': 0.20347055873007494, 'dropout_rate': 0.19737913515826852, 'ccp_alpha': 0.20967353673637928}. Best is trial 211 with value: 0.6600894788590785.[0m
[32m[I 2022-04-22 17:09:19,206][0m Trial 215 finished with value: 0.6530230115388945 and parameters: {'loss': 'coxph', 'learning_rate': 0.012153742306790562, 'n_estimators': 500, 'criterion': 'friedman_mse', 'min_samples_split': 9, 'min_samples_leaf': 3, 'min_weight_fraction_leaf': 0.0673405694529868, 'min_impurity_decrease': 0.883313761472183, 'max_features': 0.4925059129365681, 'subsample': 0.19112875774332747, 'dropout_rate': 0.22773571555372313, 'ccp_alpha': 0.0062586551535882134}. Best is trial 211 with value: 0.6600894788590785.[0m
[32m[I 2022-04-22 17:10:22,294][0m Trial 216 finished with value: 0.6603632536689609 and parameters: {'loss': 'coxph', 'learning_rate': 0.010002206302833504, 'n_estimators': 504, 'criterion': 'friedman_mse', 'min_samples_split': 9, 'min_samples_leaf': 3, 'min_weight_fraction_leaf': 0.07177659486918819, 'min_impurity_decrease': 0.9261224041615106, 'max_features': 0.4954437113070253, 'subsample': 0.232140915393924, 'dropout_rate': 0.22779114134376557, 'ccp_alpha': 0.005714123545844615}. Best is trial 216 with value: 0.6603632536689609.[0m
[32m[I 2022-04-22 17:11:21,207][0m Trial 217 finished with value: 0.6603524591331212 and parameters: {'loss': 'coxph', 'learning_rate': 0.009473539424983971, 'n_estimators': 478, 'criterion': 'friedman_mse', 'min_samples_split': 9, 'min_samples_leaf': 3, 'min_weight_fraction_leaf': 0.07318876361481552, 'min_impurity_decrease': 0.907228923174919, 'max_features': 0.4906250010713176, 'subsample': 0.2409611237104589, 'dropout_rate': 0.22022181630312715, 'ccp_alpha': 0.010082762324166307}. Best is trial 216 with value: 0.6603632536689609.[0m
[32m[I 2022-04-22 17:12:21,704][0m Trial 218 finished with value: 0.6659976583847056 and parameters: {'loss': 'coxph', 'learning_rate': 0.011211845523392414, 'n_estimators': 488, 'criterion': 'friedman_mse', 'min_samples_split': 9, 'min_samples_leaf': 3, 'min_weight_fraction_leaf': 0.07357417363689753, 'min_impurity_decrease': 0.930378495578329, 'max_features': 0.49385010656867345, 'subsample': 0.24469721253026339, 'dropout_rate': 0.2308785112244167, 'ccp_alpha': 0.0052607664059339245}. Best is trial 218 with value: 0.6659976583847056.[0m
[32m[I 2022-04-22 17:13:30,824][0m Trial 219 finished with value: 0.6617969762387096 and parameters: {'loss': 'coxph', 'learning_rate': 0.012626170073173243, 'n_estimators': 511, 'criterion': 'friedman_mse', 'min_samples_split': 10, 'min_samples_leaf': 3, 'min_weight_fraction_leaf': 0.09409324372964525, 'min_impurity_decrease': 0.9302214775841047, 'max_features': 0.5345109860512692, 'subsample': 0.2203201742380445, 'dropout_rate': 0.23100766615470236, 'ccp_alpha': 0.011130872731683119}. Best is trial 218 with value: 0.6659976583847056.[0m
[32m[I 2022-04-22 17:14:32,264][0m Trial 220 finished with value: 0.6629772051944844 and parameters: {'loss': 'coxph', 'learning_rate': 0.009258674332116875, 'n_estimators': 492, 'criterion': 'friedman_mse', 'min_samples_split': 10, 'min_samples_leaf': 3, 'min_weight_fraction_leaf': 0.07248175041058617, 'min_impurity_decrease': 0.848361347630578, 'max_features': 0.5372883090212542, 'subsample': 0.2642845810066785, 'dropout_rate': 0.22802536878624313, 'ccp_alpha': 0.008521177832412293}. Best is trial 218 with value: 0.6659976583847056.[0m
