[32m[I 2022-04-21 16:16:44,728][0m Trial 179 finished with value: 0.844174456012734 and parameters: {'loss': 'coxph', 'learning_rate': 9.419008909669635e-05, 'n_estimators': 261, 'criterion': 'friedman_mse', 'min_samples_split': 5, 'min_samples_leaf': 1, 'min_weight_fraction_leaf': 0.1639102382258758, 'min_impurity_decrease': 0.32654942480756316, 'max_features': 0.32947637789430384, 'subsample': 0.1374714198635777, 'dropout_rate': 0.19495049038395612, 'ccp_alpha': 0.16408709377832872}. Best is trial 149 with value: 0.8471440992916224.[0m
[32m[I 2022-04-21 16:17:08,918][0m Trial 180 finished with value: 0.8420449556625119 and parameters: {'loss': 'coxph', 'learning_rate': 7.13048807196757e-05, 'n_estimators': 284, 'criterion': 'friedman_mse', 'min_samples_split': 3, 'min_samples_leaf': 1, 'min_weight_fraction_leaf': 0.1309805989891939, 'min_impurity_decrease': 0.4332859357213549, 'max_features': 0.23796799941115093, 'subsample': 0.07331757455590154, 'dropout_rate': 0.11153296477310407, 'ccp_alpha': 0.363204008810727}. Best is trial 149 with value: 0.8471440992916224.[0m
[32m[I 2022-04-21 16:17:13,233][0m Trial 181 finished with value: 0.8434369300479581 and parameters: {'loss': 'coxph', 'learning_rate': 5.662276060063553e-05, 'n_estimators': 232, 'criterion': 'friedman_mse', 'min_samples_split': 2, 'min_samples_leaf': 2, 'min_weight_fraction_leaf': 0.1411962632857481, 'min_impurity_decrease': 0.28798599753604687, 'max_features': 0.3725970544309898, 'subsample': 0.09831991481096962, 'dropout_rate': 0.8677444090386898, 'ccp_alpha': 0.09521316843001254}. Best is trial 149 with value: 0.8471440992916224.[0m
[32m[I 2022-04-21 16:17:43,713][0m Trial 182 finished with value: 0.8461209122425029 and parameters: {'loss': 'coxph', 'learning_rate': 4.7530702192643625e-05, 'n_estimators': 302, 'criterion': 'friedman_mse', 'min_samples_split': 3, 'min_samples_leaf': 2, 'min_weight_fraction_leaf': 0.2015184638276763, 'min_impurity_decrease': 0.3179215825891025, 'max_features': 0.419218812404287, 'subsample': 0.06760137965739241, 'dropout_rate': 0.14579592597858154, 'ccp_alpha': 0.22019887571326077}. Best is trial 149 with value: 0.8471440992916224.[0m
[32m[I 2022-04-21 16:18:08,045][0m Trial 183 finished with value: 0.845148879277963 and parameters: {'loss': 'coxph', 'learning_rate': 0.00011027763380822728, 'n_estimators': 295, 'criterion': 'friedman_mse', 'min_samples_split': 3, 'min_samples_leaf': 2, 'min_weight_fraction_leaf': 0.19720006321367675, 'min_impurity_decrease': 0.31683731267325344, 'max_features': 0.35647235566695523, 'subsample': 0.0618305376007951, 'dropout_rate': 0.14784514376223284, 'ccp_alpha': 0.21432834531037925}. Best is trial 149 with value: 0.8471440992916224.[0m
[32m[I 2022-04-21 16:18:30,201][0m Trial 184 finished with value: 0.84612882837191 and parameters: {'loss': 'coxph', 'learning_rate': 0.000115913352776633, 'n_estimators': 304, 'criterion': 'friedman_mse', 'min_samples_split': 3, 'min_samples_leaf': 2, 'min_weight_fraction_leaf': 0.20386569698660395, 'min_impurity_decrease': 0.30689967531775825, 'max_features': 0.36134410982174553, 'subsample': 0.059343816622662006, 'dropout_rate': 0.14501580429325464, 'ccp_alpha': 0.193146692040366}. Best is trial 149 with value: 0.8471440992916224.[0m
[32m[I 2022-04-21 16:18:49,190][0m Trial 185 finished with value: 0.8422496371422316 and parameters: {'loss': 'coxph', 'learning_rate': 0.00010673924959026565, 'n_estimators': 299, 'criterion': 'friedman_mse', 'min_samples_split': 3, 'min_samples_leaf': 2, 'min_weight_fraction_leaf': 0.2054685337464496, 'min_impurity_decrease': 0.31545269964464007, 'max_features': 0.34966022270619507, 'subsample': 0.04189788649101407, 'dropout_rate': 0.1481750769550108, 'ccp_alpha': 0.2803477275703416}. Best is trial 149 with value: 0.8471440992916224.[0m
[32m[I 2022-04-21 16:19:13,264][0m Trial 186 finished with value: 0.8440429013479193 and parameters: {'loss': 'coxph', 'learning_rate': 0.00014390094789895204, 'n_estimators': 318, 'criterion': 'friedman_mse', 'min_samples_split': 3, 'min_samples_leaf': 2, 'min_weight_fraction_leaf': 0.1937036992528458, 'min_impurity_decrease': 0.3023731134541349, 'max_features': 0.30841179955027015, 'subsample': 0.06223803889519204, 'dropout_rate': 0.12980004429410005, 'ccp_alpha': 0.20052841123535922}. Best is trial 149 with value: 0.8471440992916224.[0m
[32m[I 2022-04-21 16:19:38,126][0m Trial 187 finished with value: 0.65 and parameters: {'loss': 'coxph', 'learning_rate': 0.00012847306970219786, 'n_estimators': 305, 'criterion': 'friedman_mse', 'min_samples_split': 3, 'min_samples_leaf': 2, 'min_weight_fraction_leaf': 0.2214749343790863, 'min_impurity_decrease': 0.33799757092103105, 'max_features': 0.3670253154831693, 'subsample': 0.02019343117442976, 'dropout_rate': 0.16214037477938148, 'ccp_alpha': 0.010646224320813066}. Best is trial 149 with value: 0.8471440992916224.[0m
[32m[I 2022-04-21 16:20:00,566][0m Trial 188 finished with value: 0.8437630291200119 and parameters: {'loss': 'coxph', 'learning_rate': 8.019775772803507e-05, 'n_estimators': 276, 'criterion': 'friedman_mse', 'min_samples_split': 3, 'min_samples_leaf': 2, 'min_weight_fraction_leaf': 0.19932603138421678, 'min_impurity_decrease': 0.2609209910111114, 'max_features': 0.3406628156762782, 'subsample': 0.05922795314801601, 'dropout_rate': 0.10966403373911932, 'ccp_alpha': 0.16686520854826398}. Best is trial 149 with value: 0.8471440992916224.[0m
[32m[I 2022-04-21 16:20:27,118][0m Trial 189 finished with value: 0.8400162232743262 and parameters: {'loss': 'coxph', 'learning_rate': 0.0121265135371278, 'n_estimators': 311, 'criterion': 'friedman_mse', 'min_samples_split': 3, 'min_samples_leaf': 2, 'min_weight_fraction_leaf': 0.1808049301336865, 'min_impurity_decrease': 0.29614466644501325, 'max_features': 0.2877285845189626, 'subsample': 0.08010332103169188, 'dropout_rate': 0.17260405901645381, 'ccp_alpha': 0.3113094661655344}. Best is trial 149 with value: 0.8471440992916224.[0m
[32m[I 2022-04-21 16:20:54,631][0m Trial 190 finished with value: 0.8421351239763519 and parameters: {'loss': 'coxph', 'learning_rate': 0.005469466238532614, 'n_estimators': 293, 'criterion': 'friedman_mse', 'min_samples_split': 3, 'min_samples_leaf': 2, 'min_weight_fraction_leaf': 0.21006853396070754, 'min_impurity_decrease': 0.20520058261898097, 'max_features': 0.32510692250709894, 'subsample': 0.04344353797282799, 'dropout_rate': 0.13932545313666697, 'ccp_alpha': 0.08744422383170364}. Best is trial 149 with value: 0.8471440992916224.[0m
[32m[I 2022-04-21 16:21:10,572][0m Trial 191 finished with value: 0.845087672560797 and parameters: {'loss': 'coxph', 'learning_rate': 9.620857114203435e-05, 'n_estimators': 274, 'criterion': 'friedman_mse', 'min_samples_split': 3, 'min_samples_leaf': 2, 'min_weight_fraction_leaf': 0.19177206403274988, 'min_impurity_decrease': 0.34886895627022885, 'max_features': 0.4069961094629626, 'subsample': 0.10909971331845932, 'dropout_rate': 0.1846571714021975, 'ccp_alpha': 0.10801653134625318}. Best is trial 149 with value: 0.8471440992916224.[0m
[32m[I 2022-04-21 16:21:26,903][0m Trial 192 finished with value: 0.8457831740244938 and parameters: {'loss': 'coxph', 'learning_rate': 0.00010803005430388128, 'n_estimators': 267, 'criterion': 'friedman_mse', 'min_samples_split': 3, 'min_samples_leaf': 2, 'min_weight_fraction_leaf': 0.1881536094212908, 'min_impurity_decrease': 0.33982227747680605, 'max_features': 0.4134339656942673, 'subsample': 0.09800394079683775, 'dropout_rate': 0.17573635039168106, 'ccp_alpha': 0.09554872045423138}. Best is trial 149 with value: 0.8471440992916224.[0m
[32m[I 2022-04-21 16:21:45,881][0m Trial 193 finished with value: 0.8403942837342331 and parameters: {'loss': 'coxph', 'learning_rate': 0.0001841737029430392, 'n_estimators': 267, 'criterion': 'friedman_mse', 'min_samples_split': 3, 'min_samples_leaf': 2, 'min_weight_fraction_leaf': 0.17792689865903327, 'min_impurity_decrease': 0.3363080982266553, 'max_features': 0.4152472925774221, 'subsample': 0.07692936440336298, 'dropout_rate': 0.2051113859172107, 'ccp_alpha': 0.24000680119180884}. Best is trial 149 with value: 0.8471440992916224.[0m
[32m[I 2022-04-21 16:22:18,677][0m Trial 194 finished with value: 0.8442697956560812 and parameters: {'loss': 'coxph', 'learning_rate': 7.299326249482771e-05, 'n_estimators': 290, 'criterion': 'friedman_mse', 'min_samples_split': 3, 'min_samples_leaf': 2, 'min_weight_fraction_leaf': 0.2006927069795051, 'min_impurity_decrease': 0.35447189099828, 'max_features': 0.4170353165987535, 'subsample': 0.11726184716927071, 'dropout_rate': 0.07822634744238943, 'ccp_alpha': 0.00370232797239331}. Best is trial 149 with value: 0.8471440992916224.[0m
[32m[I 2022-04-21 16:22:48,029][0m Trial 195 finished with value: 0.8427772495455542 and parameters: {'loss': 'coxph', 'learning_rate': 0.00010279075186549443, 'n_estimators': 333, 'criterion': 'friedman_mse', 'min_samples_split': 3, 'min_samples_leaf': 2, 'min_weight_fraction_leaf': 0.21540606291355535, 'min_impurity_decrease': 0.31513267199631073, 'max_features': 0.3783346105039517, 'subsample': 0.029744154394609146, 'dropout_rate': 0.1290913684222703, 'ccp_alpha': 0.17642857348392127}. Best is trial 149 with value: 0.8471440992916224.[0m
[32m[I 2022-04-21 16:23:05,214][0m Trial 196 finished with value: 0.65 and parameters: {'loss': 'coxph', 'learning_rate': 0.00022128104542911735, 'n_estimators': 271, 'criterion': 'friedman_mse', 'min_samples_split': 3, 'min_samples_leaf': 2, 'min_weight_fraction_leaf': 0.18745034335355035, 'min_impurity_decrease': 0.32082071218940783, 'max_features': 0.4083917366551104, 'subsample': 0.09283783698958985, 'dropout_rate': 0.15017279451670446, 'ccp_alpha': 3.5825230171089015}. Best is trial 149 with value: 0.8471440992916224.[0m
/media/san2_ssd/data/Workdir/survival/venv/lib/python3.8/site-packages/sksurv/ensemble/boosting.py:955: RuntimeWarning: divide by zero encountered in log
  time = numpy.log(time)
/media/san2_ssd/data/Workdir/survival/venv/lib/python3.8/site-packages/sksurv/ensemble/boosting.py:955: RuntimeWarning: divide by zero encountered in log
  time = numpy.log(time)
/media/san2_ssd/data/Workdir/survival/venv/lib/python3.8/site-packages/sksurv/ensemble/boosting.py:955: RuntimeWarning: divide by zero encountered in log
  time = numpy.log(time)
/media/san2_ssd/data/Workdir/survival/venv/lib/python3.8/site-packages/sksurv/ensemble/boosting.py:955: RuntimeWarning: divide by zero encountered in log
  time = numpy.log(time)
[32m[I 2022-04-21 16:23:11,083][0m Trial 197 finished with value: -0.4664930483051949 and parameters: {'loss': 'squared', 'learning_rate': 0.00015409919187901462, 'n_estimators': 258, 'criterion': 'squared_error', 'min_samples_split': 3, 'min_samples_leaf': 3, 'min_weight_fraction_leaf': 0.2328961290166601, 'min_impurity_decrease': 0.36708889226740454, 'max_features': 0.43103310078993634, 'subsample': 0.06803754640889163, 'dropout_rate': 0.18179869306762828, 'ccp_alpha': 0.3969997042425856}. Best is trial 149 with value: 0.8471440992916224.[0m
[32m[I 2022-04-21 16:23:43,221][0m Trial 198 finished with value: 0.8383606237151214 and parameters: {'loss': 'coxph', 'learning_rate': 0.00033544358053723097, 'n_estimators': 321, 'criterion': 'friedman_mse', 'min_samples_split': 3, 'min_samples_leaf': 2, 'min_weight_fraction_leaf': 0.17066429349695952, 'min_impurity_decrease': 0.2829544539687782, 'max_features': 0.382957074126942, 'subsample': 0.43644966895373327, 'dropout_rate': 0.09867336761490819, 'ccp_alpha': 0.10106855431326132}. Best is trial 149 with value: 0.8471440992916224.[0m
[32m[I 2022-04-21 16:24:14,687][0m Trial 199 finished with value: 0.8368294941869806 and parameters: {'loss': 'coxph', 'learning_rate': 9.127386542047427e-05, 'n_estimators': 286, 'criterion': 'friedman_mse', 'min_samples_split': 3, 'min_samples_leaf': 2, 'min_weight_fraction_leaf': 0.1922868558810317, 'min_impurity_decrease': 0.34268462257154425, 'max_features': 0.34272435524381273, 'subsample': 0.15509119702097168, 'dropout_rate': 0.02450738116737875, 'ccp_alpha': 0.24597189204591555}. Best is trial 149 with value: 0.8471440992916224.[0m
[32m[I 2022-04-21 16:24:34,952][0m Trial 200 finished with value: 0.8436250418488797 and parameters: {'loss': 'coxph', 'learning_rate': 0.007906311631321453, 'n_estimators': 275, 'criterion': 'friedman_mse', 'min_samples_split': 3, 'min_samples_leaf': 2, 'min_weight_fraction_leaf': 0.20450320093298185, 'min_impurity_decrease': 0.4016568121396946, 'max_features': 0.40232403104889386, 'subsample': 0.04945218353894215, 'dropout_rate': 0.21937023924962185, 'ccp_alpha': 0.08415234036759216}. Best is trial 149 with value: 0.8471440992916224.[0m
[32m[I 2022-04-21 16:24:59,031][0m Trial 201 finished with value: 0.8440707315252609 and parameters: {'loss': 'coxph', 'learning_rate': 0.00011389493047363238, 'n_estimators': 249, 'criterion': 'friedman_mse', 'min_samples_split': 3, 'min_samples_leaf': 2, 'min_weight_fraction_leaf': 0.19027382364540255, 'min_impurity_decrease': 0.26927495378955546, 'max_features': 0.35932526648400354, 'subsample': 0.10346124126954057, 'dropout_rate': 0.16041509163641976, 'ccp_alpha': 0.1538950583904905}. Best is trial 149 with value: 0.8471440992916224.[0m
[32m[I 2022-04-21 16:25:12,905][0m Trial 202 finished with value: 0.8457423110886542 and parameters: {'loss': 'coxph', 'learning_rate': 0.0001267997378027818, 'n_estimators': 236, 'criterion': 'friedman_mse', 'min_samples_split': 2, 'min_samples_leaf': 2, 'min_weight_fraction_leaf': 0.1783805388735568, 'min_impurity_decrease': 0.3063096052648507, 'max_features': 0.30663302562888867, 'subsample': 0.13278358224517137, 'dropout_rate': 0.17834849807358794, 'ccp_alpha': 0.0018981254078179763}. Best is trial 149 with value: 0.8471440992916224.[0m
[32m[I 2022-04-21 16:25:27,291][0m Trial 203 finished with value: 0.8452483057785705 and parameters: {'loss': 'coxph', 'learning_rate': 0.00013456094458370863, 'n_estimators': 222, 'criterion': 'friedman_mse', 'min_samples_split': 3, 'min_samples_leaf': 2, 'min_weight_fraction_leaf': 0.17712243874592287, 'min_impurity_decrease': 0.30231354078080086, 'max_features': 0.30660401218676375, 'subsample': 0.1368206501344664, 'dropout_rate': 0.18413238483498212, 'ccp_alpha': 0.012997466171429578}. Best is trial 149 with value: 0.8471440992916224.[0m
[32m[I 2022-04-21 16:25:39,485][0m Trial 204 finished with value: 0.8451537607732298 and parameters: {'loss': 'coxph', 'learning_rate': 0.0001312197443498382, 'n_estimators': 223, 'criterion': 'friedman_mse', 'min_samples_split': 2, 'min_samples_leaf': 2, 'min_weight_fraction_leaf': 0.1738645171166598, 'min_impurity_decrease': 0.298845217748566, 'max_features': 0.30809669218081265, 'subsample': 0.1343083081904446, 'dropout_rate': 0.19140249060387313, 'ccp_alpha': 0.01510792990238769}. Best is trial 149 with value: 0.8471440992916224.[0m
[32m[I 2022-04-21 16:25:56,815][0m Trial 205 finished with value: 0.8448349973623277 and parameters: {'loss': 'coxph', 'learning_rate': 0.00013189715182588546, 'n_estimators': 207, 'criterion': 'friedman_mse', 'min_samples_split': 2, 'min_samples_leaf': 2, 'min_weight_fraction_leaf': 0.1770667252565634, 'min_impurity_decrease': 0.3029338438141063, 'max_features': 0.30896901164360385, 'subsample': 0.1393824572068741, 'dropout_rate': 0.19216194446136628, 'ccp_alpha': 0.015617152440931698}. Best is trial 149 with value: 0.8471440992916224.[0m
[32m[I 2022-04-21 16:26:10,694][0m Trial 206 finished with value: 0.8444580639611093 and parameters: {'loss': 'coxph', 'learning_rate': 0.00017680869239733782, 'n_estimators': 230, 'criterion': 'friedman_mse', 'min_samples_split': 2, 'min_samples_leaf': 2, 'min_weight_fraction_leaf': 0.16298391286240368, 'min_impurity_decrease': 0.2865813931672465, 'max_features': 0.2878147590049854, 'subsample': 0.12971383066729372, 'dropout_rate': 0.21152652404297134, 'ccp_alpha': 0.07546739210690512}. Best is trial 149 with value: 0.8471440992916224.[0m
[32m[I 2022-04-21 16:26:29,369][0m Trial 207 finished with value: 0.8441911695950818 and parameters: {'loss': 'coxph', 'learning_rate': 7.608297906763219e-05, 'n_estimators': 222, 'criterion': 'friedman_mse', 'min_samples_split': 2, 'min_samples_leaf': 3, 'min_weight_fraction_leaf': 0.15467704128804097, 'min_impurity_decrease': 0.31014636302977444, 'max_features': 0.32619024051485057, 'subsample': 0.1779152401541053, 'dropout_rate': 0.18025885215229193, 'ccp_alpha': 0.006231661749712205}. Best is trial 149 with value: 0.8471440992916224.[0m
[32m[I 2022-04-21 16:26:51,342][0m Trial 208 finished with value: 0.8446603208598036 and parameters: {'loss': 'coxph', 'learning_rate': 5.3883833704877316e-05, 'n_estimators': 230, 'criterion': 'friedman_mse', 'min_samples_split': 2, 'min_samples_leaf': 2, 'min_weight_fraction_leaf': 0.17499684788265177, 'min_impurity_decrease': 0.3390586164226848, 'max_features': 0.2780019097212076, 'subsample': 0.11814298381804672, 'dropout_rate': 0.12524045978793852, 'ccp_alpha': 0.21466503962828828}. Best is trial 149 with value: 0.8471440992916224.[0m
[32m[I 2022-04-21 16:27:08,300][0m Trial 209 finished with value: 0.8399339499791412 and parameters: {'loss': 'coxph', 'learning_rate': 0.00025113129651934486, 'n_estimators': 201, 'criterion': 'friedman_mse', 'min_samples_split': 3, 'min_samples_leaf': 2, 'min_weight_fraction_leaf': 0.19849194082416832, 'min_impurity_decrease': 0.3707932253831342, 'max_features': 0.3013830121523466, 'subsample': 0.16504882051173336, 'dropout_rate': 0.18010349120479757, 'ccp_alpha': 0.002673208878886631}. Best is trial 149 with value: 0.8471440992916224.[0m
[32m[I 2022-04-21 16:27:45,309][0m Trial 210 finished with value: 0.8370688153750804 and parameters: {'loss': 'coxph', 'learning_rate': 0.00014614803513574585, 'n_estimators': 306, 'criterion': 'friedman_mse', 'min_samples_split': 3, 'min_samples_leaf': 2, 'min_weight_fraction_leaf': 0.18207596402616488, 'min_impurity_decrease': 0.26424576956300394, 'max_features': 0.3540322989371284, 'subsample': 0.1455008996578035, 'dropout_rate': 0.0575611240627829, 'ccp_alpha': 0.3098726817144253}. Best is trial 149 with value: 0.8471440992916224.[0m
[32m[I 2022-04-21 16:28:05,993][0m Trial 211 finished with value: 0.844487796819908 and parameters: {'loss': 'coxph', 'learning_rate': 9.324383714047877e-05, 'n_estimators': 254, 'criterion': 'friedman_mse', 'min_samples_split': 3, 'min_samples_leaf': 2, 'min_weight_fraction_leaf': 0.16365351357045146, 'min_impurity_decrease': 0.2989130425857199, 'max_features': 0.3168190886580101, 'subsample': 0.09571948539281899, 'dropout_rate': 0.2010370329376249, 'ccp_alpha': 0.11550075105715013}. Best is trial 149 with value: 0.8471440992916224.[0m
[32m[I 2022-04-21 16:28:16,742][0m Trial 212 finished with value: 0.8413492314771386 and parameters: {'loss': 'coxph', 'learning_rate': 0.00011931520416470935, 'n_estimators': 189, 'criterion': 'friedman_mse', 'min_samples_split': 2, 'min_samples_leaf': 2, 'min_weight_fraction_leaf': 0.1704908065284438, 'min_impurity_decrease': 0.32149216992949553, 'max_features': 0.299916506983559, 'subsample': 0.12360105327988913, 'dropout_rate': 0.1580942789524214, 'ccp_alpha': 0.173850368335306}. Best is trial 149 with value: 0.8471440992916224.[0m
[32m[I 2022-04-21 16:28:29,362][0m Trial 213 finished with value: 0.8440622354941916 and parameters: {'loss': 'coxph', 'learning_rate': 0.00018272082340254868, 'n_estimators': 243, 'criterion': 'friedman_mse', 'min_samples_split': 3, 'min_samples_leaf': 2, 'min_weight_fraction_leaf': 0.18415843112015068, 'min_impurity_decrease': 0.30062215944392057, 'max_features': 0.33653681851958894, 'subsample': 0.09303281006692715, 'dropout_rate': 0.2263482339047781, 'ccp_alpha': 0.10455579582571907}. Best is trial 149 with value: 0.8471440992916224.[0m
[32m[I 2022-04-21 16:28:42,537][0m Trial 214 finished with value: 0.8424562466238582 and parameters: {'loss': 'coxph', 'learning_rate': 6.41194273834139e-05, 'n_estimators': 214, 'criterion': 'friedman_mse', 'min_samples_split': 2, 'min_samples_leaf': 3, 'min_weight_fraction_leaf': 0.21011888554151945, 'min_impurity_decrease': 0.2775294881811243, 'max_features': 0.3732509121521002, 'subsample': 0.10855533950217053, 'dropout_rate': 0.13683071756918583, 'ccp_alpha': 0.23083771934443736}. Best is trial 149 with value: 0.8471440992916224.[0m
[32m[I 2022-04-21 16:29:12,718][0m Trial 215 finished with value: 0.8455490897993112 and parameters: {'loss': 'coxph', 'learning_rate': 0.0001398332820573178, 'n_estimators': 261, 'criterion': 'friedman_mse', 'min_samples_split': 3, 'min_samples_leaf': 2, 'min_weight_fraction_leaf': 0.1915380787044937, 'min_impurity_decrease': 0.3469417180835107, 'max_features': 0.27379121215958074, 'subsample': 0.08301128464703554, 'dropout_rate': 0.09531816558524461, 'ccp_alpha': 0.011493882837258412}. Best is trial 149 with value: 0.8471440992916224.[0m
[32m[I 2022-04-21 16:29:26,431][0m Trial 216 finished with value: 0.8444914127596931 and parameters: {'loss': 'coxph', 'learning_rate': 0.0001445830641135921, 'n_estimators': 265, 'criterion': 'friedman_mse', 'min_samples_split': 3, 'min_samples_leaf': 2, 'min_weight_fraction_leaf': 0.19615814316105157, 'min_impurity_decrease': 0.3540779503714953, 'max_features': 0.2547807566899658, 'subsample': 0.07223820906255145, 'dropout_rate': 0.10088096312640432, 'ccp_alpha': 0.09873494093519732}. Best is trial 149 with value: 0.8471440992916224.[0m
