[32m[I 2022-04-21 15:38:10,386][0m Trial 321 finished with value: 0.835597012412256 and parameters: {'alpha': 3.65467667617957, 'ties': 'efron'}. Best is trial 70 with value: 0.835911286090736.[0m
[32m[I 2022-04-21 15:38:53,587][0m Trial 322 finished with value: 0.8353628700474047 and parameters: {'alpha': 4.060528341295397, 'ties': 'breslow'}. Best is trial 70 with value: 0.835911286090736.[0m
[32m[I 2022-04-21 15:39:35,484][0m Trial 323 finished with value: 0.8353829464535926 and parameters: {'alpha': 3.370568234133128, 'ties': 'breslow'}. Best is trial 70 with value: 0.835911286090736.[0m
[32m[I 2022-04-21 15:40:18,569][0m Trial 324 finished with value: 0.835911286090736 and parameters: {'alpha': 3.7732585730567627, 'ties': 'breslow'}. Best is trial 70 with value: 0.835911286090736.[0m
[32m[I 2022-04-21 15:41:01,302][0m Trial 325 finished with value: 0.8355193570680342 and parameters: {'alpha': 3.56186644391634, 'ties': 'breslow'}. Best is trial 70 with value: 0.835911286090736.[0m
[32m[I 2022-04-21 15:41:41,946][0m Trial 326 finished with value: 0.8358321902886627 and parameters: {'alpha': 3.7794742290762704, 'ties': 'breslow'}. Best is trial 70 with value: 0.835911286090736.[0m
[32m[I 2022-04-21 15:42:25,933][0m Trial 327 finished with value: 0.8355898383003153 and parameters: {'alpha': 3.92456139394729, 'ties': 'breslow'}. Best is trial 70 with value: 0.835911286090736.[0m
[32m[I 2022-04-21 15:43:10,801][0m Trial 328 finished with value: 0.8354787801983354 and parameters: {'alpha': 3.646045289111727, 'ties': 'breslow'}. Best is trial 70 with value: 0.835911286090736.[0m
[32m[I 2022-04-21 15:43:54,189][0m Trial 329 finished with value: 0.835588281099821 and parameters: {'alpha': 3.837048495676392, 'ties': 'breslow'}. Best is trial 70 with value: 0.835911286090736.[0m
[32m[I 2022-04-21 15:44:43,112][0m Trial 330 finished with value: 0.8339031318492734 and parameters: {'alpha': 2.0469628659593844, 'ties': 'breslow'}. Best is trial 70 with value: 0.835911286090736.[0m
[32m[I 2022-04-21 15:45:24,868][0m Trial 331 finished with value: 0.8356802696400418 and parameters: {'alpha': 3.743998511889377, 'ties': 'breslow'}. Best is trial 70 with value: 0.835911286090736.[0m
[32m[I 2022-04-21 15:46:09,085][0m Trial 332 finished with value: 0.8354264219312361 and parameters: {'alpha': 3.5073031358406817, 'ties': 'breslow'}. Best is trial 70 with value: 0.835911286090736.[0m
[32m[I 2022-04-21 15:46:52,284][0m Trial 333 finished with value: 0.8355175853441505 and parameters: {'alpha': 3.6691700954031625, 'ties': 'breslow'}. Best is trial 70 with value: 0.835911286090736.[0m
[32m[I 2022-04-21 15:47:34,811][0m Trial 334 finished with value: 0.835747774314898 and parameters: {'alpha': 3.8784692635128946, 'ties': 'breslow'}. Best is trial 70 with value: 0.835911286090736.[0m
[32m[I 2022-04-21 15:48:19,131][0m Trial 335 finished with value: 0.8351729822908422 and parameters: {'alpha': 3.988328694477696, 'ties': 'breslow'}. Best is trial 70 with value: 0.835911286090736.[0m
[32m[I 2022-04-21 15:49:00,495][0m Trial 336 finished with value: 0.835911286090736 and parameters: {'alpha': 3.775471965425973, 'ties': 'breslow'}. Best is trial 70 with value: 0.835911286090736.[0m
[32m[I 2022-04-21 15:49:47,872][0m Trial 337 finished with value: 0.8352036419513628 and parameters: {'alpha': 4.100905835563769, 'ties': 'breslow'}. Best is trial 70 with value: 0.835911286090736.[0m
[32m[I 2022-04-21 15:50:32,893][0m Trial 338 finished with value: 0.8355175853441505 and parameters: {'alpha': 3.6666411240116537, 'ties': 'breslow'}. Best is trial 70 with value: 0.835911286090736.[0m
[32m[I 2022-04-21 15:51:14,716][0m Trial 339 finished with value: 0.835588281099821 and parameters: {'alpha': 3.8387002039059763, 'ties': 'breslow'}. Best is trial 70 with value: 0.835911286090736.[0m
[32m[I 2022-04-21 15:51:58,045][0m Trial 340 finished with value: 0.8354805519222193 and parameters: {'alpha': 3.5932920443357883, 'ties': 'breslow'}. Best is trial 70 with value: 0.835911286090736.[0m
[32m[I 2022-04-21 15:52:43,314][0m Trial 341 finished with value: 0.8357538297120632 and parameters: {'alpha': 3.754410327813564, 'ties': 'efron'}. Best is trial 70 with value: 0.835911286090736.[0m
[32m[I 2022-04-21 15:53:31,629][0m Trial 342 finished with value: 0.8353655281098146 and parameters: {'alpha': 3.978973180727176, 'ties': 'breslow'}. Best is trial 70 with value: 0.835911286090736.[0m
[32m[I 2022-04-21 15:54:18,595][0m Trial 343 finished with value: 0.8356689341023882 and parameters: {'alpha': 3.8860557049666187, 'ties': 'breslow'}. Best is trial 70 with value: 0.835911286090736.[0m
[32m[I 2022-04-21 15:55:01,355][0m Trial 344 finished with value: 0.8357190747858569 and parameters: {'alpha': 3.724862262777791, 'ties': 'breslow'}. Best is trial 70 with value: 0.835911286090736.[0m
[32m[I 2022-04-21 15:55:46,939][0m Trial 345 finished with value: 0.8357123186578829 and parameters: {'alpha': 3.811664441808461, 'ties': 'breslow'}. Best is trial 70 with value: 0.835911286090736.[0m
[32m[I 2022-04-21 15:56:34,315][0m Trial 346 finished with value: 0.8355837673218096 and parameters: {'alpha': 3.427523352546112, 'ties': 'breslow'}. Best is trial 70 with value: 0.835911286090736.[0m
[32m[I 2022-04-21 15:57:19,241][0m Trial 347 finished with value: 0.835519622180555 and parameters: {'alpha': 3.600087447848113, 'ties': 'breslow'}. Best is trial 70 with value: 0.835911286090736.[0m
[32m[I 2022-04-21 15:58:10,445][0m Trial 348 finished with value: 0.8349740767407431 and parameters: {'alpha': 2.7970089365558524, 'ties': 'breslow'}. Best is trial 70 with value: 0.835911286090736.[0m
[32m[I 2022-04-21 15:58:56,912][0m Trial 349 finished with value: 0.8355898383003153 and parameters: {'alpha': 3.92071877697104, 'ties': 'breslow'}. Best is trial 70 with value: 0.835911286090736.[0m
[32m[I 2022-04-21 15:59:41,458][0m Trial 350 finished with value: 0.835598871889044 and parameters: {'alpha': 3.70901733085698, 'ties': 'breslow'}. Best is trial 70 with value: 0.835911286090736.[0m
[32m[I 2022-04-21 16:00:24,993][0m Trial 351 finished with value: 0.8357123186578829 and parameters: {'alpha': 3.813140560862709, 'ties': 'breslow'}. Best is trial 70 with value: 0.835911286090736.[0m
[32m[I 2022-04-21 16:01:10,986][0m Trial 352 finished with value: 0.8354264219312361 and parameters: {'alpha': 3.4874015256967246, 'ties': 'breslow'}. Best is trial 70 with value: 0.835911286090736.[0m
[32m[I 2022-04-21 16:01:59,424][0m Trial 353 finished with value: 0.8351482631613664 and parameters: {'alpha': 3.0400683167770928, 'ties': 'breslow'}. Best is trial 70 with value: 0.835911286090736.[0m
[32m[I 2022-04-21 16:02:45,243][0m Trial 354 finished with value: 0.8352095089409325 and parameters: {'alpha': 4.014915719466845, 'ties': 'breslow'}. Best is trial 70 with value: 0.835911286090736.[0m
[32m[I 2022-04-21 16:03:33,226][0m Trial 355 finished with value: 0.8357190747858569 and parameters: {'alpha': 3.735960710386631, 'ties': 'breslow'}. Best is trial 70 with value: 0.835911286090736.[0m
[32m[I 2022-04-21 16:04:18,472][0m Trial 356 finished with value: 0.835519290914522 and parameters: {'alpha': 3.6118762707398604, 'ties': 'breslow'}. Best is trial 70 with value: 0.835911286090736.[0m
[32m[I 2022-04-21 16:05:04,335][0m Trial 357 finished with value: 0.8356281582736811 and parameters: {'alpha': 3.893503778362464, 'ties': 'breslow'}. Best is trial 70 with value: 0.835911286090736.[0m
[32m[I 2022-04-21 16:05:51,311][0m Trial 358 finished with value: 0.8355991370015646 and parameters: {'alpha': 3.690911368118659, 'ties': 'breslow'}. Best is trial 70 with value: 0.835911286090736.[0m
[32m[I 2022-04-21 16:06:38,613][0m Trial 359 finished with value: 0.8357123186578829 and parameters: {'alpha': 3.8092165238463367, 'ties': 'breslow'}. Best is trial 70 with value: 0.835911286090736.[0m
[32m[I 2022-04-21 16:07:22,936][0m Trial 360 finished with value: 0.8352036419513628 and parameters: {'alpha': 4.102101510991907, 'ties': 'breslow'}. Best is trial 70 with value: 0.835911286090736.[0m
[32m[I 2022-04-21 16:08:08,832][0m Trial 361 finished with value: 0.8352000658044197 and parameters: {'alpha': 3.2652555632486573, 'ties': 'breslow'}. Best is trial 70 with value: 0.835911286090736.[0m
[32m[I 2022-04-21 16:08:55,087][0m Trial 362 finished with value: 0.8355987841361399 and parameters: {'alpha': 3.540956028225548, 'ties': 'efron'}. Best is trial 70 with value: 0.835911286090736.[0m
[32m[I 2022-04-21 16:09:40,699][0m Trial 363 finished with value: 0.8354049296341829 and parameters: {'alpha': 3.9510543799144564, 'ties': 'breslow'}. Best is trial 70 with value: 0.835911286090736.[0m
[32m[I 2022-04-21 16:10:26,517][0m Trial 364 finished with value: 0.8357103479749908 and parameters: {'alpha': 3.825528076040546, 'ties': 'breslow'}. Best is trial 70 with value: 0.835911286090736.[0m
[32m[I 2022-04-21 16:11:10,961][0m Trial 365 finished with value: 0.8354787801983354 and parameters: {'alpha': 3.6573029311604706, 'ties': 'breslow'}. Best is trial 70 with value: 0.835911286090736.[0m
[32m[I 2022-04-21 16:11:55,305][0m Trial 366 finished with value: 0.8356394938113348 and parameters: {'alpha': 3.745810208855499, 'ties': 'breslow'}. Best is trial 70 with value: 0.835911286090736.[0m
[32m[I 2022-04-21 16:12:43,987][0m Trial 367 finished with value: 0.8346124559933722 and parameters: {'alpha': 2.4511199875943306, 'ties': 'breslow'}. Best is trial 70 with value: 0.835911286090736.[0m
[32m[I 2022-04-21 16:13:28,347][0m Trial 368 finished with value: 0.8356281582736811 and parameters: {'alpha': 3.8917293817093825, 'ties': 'breslow'}. Best is trial 70 with value: 0.835911286090736.[0m
[32m[I 2022-04-21 16:14:15,761][0m Trial 369 finished with value: 0.835519622180555 and parameters: {'alpha': 3.6037733792235698, 'ties': 'breslow'}. Best is trial 70 with value: 0.835911286090736.[0m
[32m[I 2022-04-21 16:14:59,785][0m Trial 370 finished with value: 0.835911286090736 and parameters: {'alpha': 3.775124494956736, 'ties': 'breslow'}. Best is trial 70 with value: 0.835911286090736.[0m
[32m[I 2022-04-21 16:15:45,909][0m Trial 371 finished with value: 0.8352116335302411 and parameters: {'alpha': 3.9921863961229755, 'ties': 'breslow'}. Best is trial 70 with value: 0.835911286090736.[0m
[32m[I 2022-04-21 16:16:31,673][0m Trial 372 finished with value: 0.835588281099821 and parameters: {'alpha': 3.838967316478199, 'ties': 'breslow'}. Best is trial 70 with value: 0.835911286090736.[0m
[32m[I 2022-04-21 16:17:17,221][0m Trial 373 finished with value: 0.8355175853441505 and parameters: {'alpha': 3.676289506799857, 'ties': 'breslow'}. Best is trial 70 with value: 0.835911286090736.[0m
[32m[I 2022-04-21 16:18:04,856][0m Trial 374 finished with value: 0.8358336757991058 and parameters: {'alpha': 3.7668235046176255, 'ties': 'breslow'}. Best is trial 70 with value: 0.835911286090736.[0m
[32m[I 2022-04-21 16:18:51,080][0m Trial 375 finished with value: 0.8356281582736811 and parameters: {'alpha': 3.9041008237917243, 'ties': 'breslow'}. Best is trial 70 with value: 0.835911286090736.[0m
[32m[I 2022-04-21 16:19:37,102][0m Trial 376 finished with value: 0.8355572580224632 and parameters: {'alpha': 3.529156774299081, 'ties': 'breslow'}. Best is trial 70 with value: 0.835911286090736.[0m
[32m[I 2022-04-21 16:20:24,241][0m Trial 377 finished with value: 0.8357567045863414 and parameters: {'alpha': 3.758205695765739, 'ties': 'breslow'}. Best is trial 70 with value: 0.835911286090736.[0m
[32m[I 2022-04-21 16:21:09,630][0m Trial 378 finished with value: 0.8355175853441505 and parameters: {'alpha': 3.6753647123582036, 'ties': 'breslow'}. Best is trial 70 with value: 0.835911286090736.[0m
[32m[I 2022-04-21 16:21:54,475][0m Trial 379 finished with value: 0.8352486453527801 and parameters: {'alpha': 4.025786477362602, 'ties': 'breslow'}. Best is trial 70 with value: 0.835911286090736.[0m
[32m[I 2022-04-21 16:22:39,826][0m Trial 380 finished with value: 0.835593038904087 and parameters: {'alpha': 3.860847251030641, 'ties': 'efron'}. Best is trial 70 with value: 0.835911286090736.[0m
[32m[I 2022-04-21 16:23:24,540][0m Trial 381 finished with value: 0.835911286090736 and parameters: {'alpha': 3.7747510834826943, 'ties': 'breslow'}. Best is trial 70 with value: 0.835911286090736.[0m
[32m[I 2022-04-21 16:24:04,502][0m Trial 382 finished with value: 0.835519622180555 and parameters: {'alpha': 3.6086193358094216, 'ties': 'breslow'}. Best is trial 70 with value: 0.835911286090736.[0m
[32m[I 2022-04-21 16:24:48,977][0m Trial 383 finished with value: 0.8352303935787339 and parameters: {'alpha': 4.245406997485699, 'ties': 'breslow'}. Best is trial 70 with value: 0.835911286090736.[0m
[32m[I 2022-04-21 16:25:31,511][0m Trial 384 finished with value: 0.8355454473484436 and parameters: {'alpha': 3.4518461925503163, 'ties': 'breslow'}. Best is trial 70 with value: 0.835911286090736.[0m
[32m[I 2022-04-21 16:26:13,835][0m Trial 385 finished with value: 0.8357123186578829 and parameters: {'alpha': 3.8114231891791164, 'ties': 'breslow'}. Best is trial 70 with value: 0.835911286090736.[0m
[32m[I 2022-04-21 16:26:56,922][0m Trial 386 finished with value: 0.8355601075171306 and parameters: {'alpha': 3.9426354540726543, 'ties': 'breslow'}. Best is trial 70 with value: 0.835911286090736.[0m
[32m[I 2022-04-21 16:27:39,491][0m Trial 387 finished with value: 0.8355175853441505 and parameters: {'alpha': 3.665858992596122, 'ties': 'breslow'}. Best is trial 70 with value: 0.835911286090736.[0m
[32m[I 2022-04-21 16:28:23,285][0m Trial 388 finished with value: 0.8352036419513628 and parameters: {'alpha': 4.103059125198312, 'ties': 'breslow'}. Best is trial 70 with value: 0.835911286090736.[0m
[32m[I 2022-04-21 16:29:06,191][0m Trial 389 finished with value: 0.8356281582736811 and parameters: {'alpha': 3.8983791441153217, 'ties': 'breslow'}. Best is trial 70 with value: 0.835911286090736.[0m
[32m[I 2022-04-21 16:29:49,666][0m Trial 390 finished with value: 0.8352078439593253 and parameters: {'alpha': 4.625123107862702, 'ties': 'breslow'}. Best is trial 70 with value: 0.835911286090736.[0m
[32m[I 2022-04-21 16:30:34,083][0m Trial 391 finished with value: 0.8356802696400418 and parameters: {'alpha': 3.743257621780368, 'ties': 'breslow'}. Best is trial 70 with value: 0.835911286090736.[0m
[32m[I 2022-04-21 16:31:17,677][0m Trial 392 finished with value: 0.8355193570680342 and parameters: {'alpha': 3.5522641464650397, 'ties': 'breslow'}. Best is trial 70 with value: 0.835911286090736.[0m
[32m[I 2022-04-21 16:31:59,658][0m Trial 393 finished with value: 0.8357506386312487 and parameters: {'alpha': 3.798533744705168, 'ties': 'breslow'}. Best is trial 70 with value: 0.835911286090736.[0m
[32m[I 2022-04-21 16:32:43,401][0m Trial 394 finished with value: 0.8354049296341829 and parameters: {'alpha': 3.9649663370588746, 'ties': 'breslow'}. Best is trial 70 with value: 0.835911286090736.[0m
[32m[I 2022-04-21 16:33:28,984][0m Trial 395 finished with value: 0.8354787801983354 and parameters: {'alpha': 3.66360118263386, 'ties': 'breslow'}. Best is trial 70 with value: 0.835911286090736.[0m
[32m[I 2022-04-21 16:34:12,431][0m Trial 396 finished with value: 0.8356661565039716 and parameters: {'alpha': 3.8421992604169426, 'ties': 'breslow'}. Best is trial 70 with value: 0.835911286090736.[0m
[32m[I 2022-04-21 16:34:57,693][0m Trial 397 finished with value: 0.835598871889044 and parameters: {'alpha': 3.706460719512058, 'ties': 'breslow'}. Best is trial 70 with value: 0.835911286090736.[0m
[32m[I 2022-04-21 16:35:40,148][0m Trial 398 finished with value: 0.8355193570680342 and parameters: {'alpha': 3.556394565076587, 'ties': 'breslow'}. Best is trial 70 with value: 0.835911286090736.[0m
[32m[I 2022-04-21 16:36:28,510][0m Trial 399 finished with value: 0.8355933467169198 and parameters: {'alpha': 3.8796236766640155, 'ties': 'efron'}. Best is trial 70 with value: 0.835911286090736.[0m
[32m[I 2022-04-21 16:37:12,450][0m Trial 400 finished with value: 0.8354610869702634 and parameters: {'alpha': 3.3764651253829983, 'ties': 'breslow'}. Best is trial 70 with value: 0.835911286090736.[0m
[32m[I 2022-04-21 16:37:57,962][0m Trial 401 finished with value: 0.8358336757991058 and parameters: {'alpha': 3.762160779094629, 'ties': 'breslow'}. Best is trial 70 with value: 0.835911286090736.[0m
[32m[I 2022-04-21 16:38:41,210][0m Trial 402 finished with value: 0.8352095089409325 and parameters: {'alpha': 4.013855889332557, 'ties': 'breslow'}. Best is trial 70 with value: 0.835911286090736.[0m
[32m[I 2022-04-21 16:39:27,681][0m Trial 403 finished with value: 0.835519290914522 and parameters: {'alpha': 3.624359033701307, 'ties': 'breslow'}. Best is trial 70 with value: 0.835911286090736.[0m
[32m[I 2022-04-21 16:40:12,146][0m Trial 404 finished with value: 0.8357052929158193 and parameters: {'alpha': 3.8612234745579452, 'ties': 'breslow'}. Best is trial 70 with value: 0.835911286090736.[0m
[32m[I 2022-04-21 16:40:54,329][0m Trial 405 finished with value: 0.835598871889044 and parameters: {'alpha': 3.7063433747191907, 'ties': 'breslow'}. Best is trial 70 with value: 0.835911286090736.[0m
[32m[I 2022-04-21 16:41:27,183][0m Trial 406 finished with value: 0.8358336757991058 and parameters: {'alpha': 3.7645647173698373, 'ties': 'breslow'}. Best is trial 70 with value: 0.835911286090736.[0m
[32m[I 2022-04-21 16:41:58,085][0m Trial 407 finished with value: 0.8354049296341829 and parameters: {'alpha': 3.9499277696418944, 'ties': 'breslow'}. Best is trial 70 with value: 0.835911286090736.[0m
[32m[I 2022-04-21 16:42:28,890][0m Trial 408 finished with value: 0.8352016712684709 and parameters: {'alpha': 4.149336004748407, 'ties': 'breslow'}. Best is trial 70 with value: 0.835911286090736.[0m
[32m[I 2022-04-21 16:43:00,608][0m Trial 409 finished with value: 0.8356715428291757 and parameters: {'alpha': 3.8161389287728076, 'ties': 'breslow'}. Best is trial 70 with value: 0.835911286090736.[0m
[32m[I 2022-04-21 16:43:33,933][0m Trial 410 finished with value: 0.835519622180555 and parameters: {'alpha': 3.600574618715992, 'ties': 'breslow'}. Best is trial 70 with value: 0.835911286090736.[0m
[32m[I 2022-04-21 16:44:07,552][0m Trial 411 finished with value: 0.8354683222292627 and parameters: {'alpha': 3.4808147023277938, 'ties': 'breslow'}. Best is trial 70 with value: 0.835911286090736.[0m
[32m[I 2022-04-21 16:44:39,441][0m Trial 412 finished with value: 0.8356785640696703 and parameters: {'alpha': 3.748504320245929, 'ties': 'breslow'}. Best is trial 70 with value: 0.835911286090736.[0m
[32m[I 2022-04-21 16:45:13,124][0m Trial 413 finished with value: 0.8356281582736811 and parameters: {'alpha': 3.916342731591673, 'ties': 'breslow'}. Best is trial 70 with value: 0.835911286090736.[0m
[32m[I 2022-04-21 16:45:46,132][0m Trial 414 finished with value: 0.8355583611728576 and parameters: {'alpha': 3.679949461239266, 'ties': 'breslow'}. Best is trial 70 with value: 0.835911286090736.[0m
[32m[I 2022-04-21 16:46:18,984][0m Trial 415 finished with value: 0.8356309209068851 and parameters: {'alpha': 3.8362298929117093, 'ties': 'breslow'}. Best is trial 70 with value: 0.835911286090736.[0m
[32m[I 2022-04-21 16:46:51,507][0m Trial 416 finished with value: 0.8352854798157032 and parameters: {'alpha': 4.0477036135027245, 'ties': 'breslow'}. Best is trial 70 with value: 0.835911286090736.[0m
[32m[I 2022-04-21 16:47:24,307][0m Trial 417 finished with value: 0.8357567045863414 and parameters: {'alpha': 3.7547367971373644, 'ties': 'breslow'}. Best is trial 70 with value: 0.835911286090736.[0m
[32m[I 2022-04-21 16:47:59,602][0m Trial 418 finished with value: 0.8355599789903249 and parameters: {'alpha': 3.586619244459228, 'ties': 'efron'}. Best is trial 70 with value: 0.835911286090736.[0m
[32m[I 2022-04-21 16:48:34,056][0m Trial 419 finished with value: 0.8349836350652546 and parameters: {'alpha': 4.755163126270834, 'ties': 'breslow'}. Best is trial 70 with value: 0.835911286090736.[0m
[32m[I 2022-04-21 16:49:07,071][0m Trial 420 finished with value: 0.8355583611728576 and parameters: {'alpha': 3.6816612245875295, 'ties': 'breslow'}. Best is trial 70 with value: 0.835911286090736.[0m
[32m[I 2022-04-21 16:49:38,821][0m Trial 421 finished with value: 0.8354049296341829 and parameters: {'alpha': 3.962179408033221, 'ties': 'breslow'}. Best is trial 70 with value: 0.835911286090736.[0m
[32m[I 2022-04-21 16:50:10,214][0m Trial 422 finished with value: 0.8357506386312487 and parameters: {'alpha': 3.800373849865585, 'ties': 'breslow'}. Best is trial 70 with value: 0.835911286090736.[0m
[32m[I 2022-04-21 16:50:41,185][0m Trial 423 finished with value: 0.8355959092618619 and parameters: {'alpha': 3.5231805743304414, 'ties': 'breslow'}. Best is trial 70 with value: 0.835911286090736.[0m
[32m[I 2022-04-21 16:51:11,721][0m Trial 424 finished with value: 0.8357052929158193 and parameters: {'alpha': 3.869789200503635, 'ties': 'breslow'}. Best is trial 70 with value: 0.835911286090736.[0m
[32m[I 2022-04-21 16:51:41,561][0m Trial 425 finished with value: 0.8351943310001726 and parameters: {'alpha': 4.481281796137662, 'ties': 'breslow'}. Best is trial 70 with value: 0.835911286090736.[0m
[32m[I 2022-04-21 16:52:13,633][0m Trial 426 finished with value: 0.8355175853441505 and parameters: {'alpha': 3.6671312438608585, 'ties': 'breslow'}. Best is trial 70 with value: 0.835911286090736.[0m
[32m[I 2022-04-21 16:52:43,809][0m Trial 427 finished with value: 0.8357914144599559 and parameters: {'alpha': 3.7878925014264184, 'ties': 'breslow'}. Best is trial 70 with value: 0.835911286090736.[0m
