[32m[I 2022-04-21 11:37:48,177][0m Trial 127 finished with value: 0.836837262490117 and parameters: {'splitter': 'best', 'min_samples_split': 0.34422457837670845, 'min_samples_leaf': 0.02324141647641797, 'min_weight_fraction_leaf': 0.05467057148548149, 'max_features': 0.934982980587437}. Best is trial 21 with value: 0.837083811404636.[0m
[32m[I 2022-04-21 11:37:48,219][0m Trial 128 finished with value: 0.8320350511466381 and parameters: {'splitter': 'random', 'min_samples_split': 0.34357660950496133, 'min_samples_leaf': 0.020349743901348676, 'min_weight_fraction_leaf': 0.0772389031109067, 'max_features': 0.9162426595527824}. Best is trial 21 with value: 0.837083811404636.[0m
[32m[I 2022-04-21 11:37:48,260][0m Trial 129 finished with value: 0.65 and parameters: {'splitter': 'best', 'min_samples_split': 0.36513681905475465, 'min_samples_leaf': 0.4558934722562973, 'min_weight_fraction_leaf': 0.2776053551294548, 'max_features': 0.9352725357073838}. Best is trial 21 with value: 0.837083811404636.[0m
[32m[I 2022-04-21 11:37:48,301][0m Trial 130 finished with value: 0.8294029951776167 and parameters: {'splitter': 'best', 'min_samples_split': 0.3841055195552989, 'min_samples_leaf': 0.02056532173002998, 'min_weight_fraction_leaf': 0.05829821188416913, 'max_features': 0.8921855101356264}. Best is trial 21 with value: 0.837083811404636.[0m
[32m[I 2022-04-21 11:37:48,347][0m Trial 131 finished with value: 0.8344962926798125 and parameters: {'splitter': 'best', 'min_samples_split': 0.31703907625225125, 'min_samples_leaf': 0.06059717399493231, 'min_weight_fraction_leaf': 0.050321063570823214, 'max_features': 0.9730045354933179}. Best is trial 21 with value: 0.837083811404636.[0m
[32m[I 2022-04-21 11:37:48,477][0m Trial 132 finished with value: 0.836837262490117 and parameters: {'splitter': 'best', 'min_samples_split': 0.3422428865164093, 'min_samples_leaf': 0.009940669969261455, 'min_weight_fraction_leaf': 0.03726897380216933, 'max_features': 0.9374206152247069}. Best is trial 21 with value: 0.837083811404636.[0m
[32m[I 2022-04-21 11:37:48,550][0m Trial 133 finished with value: 0.8366717314767083 and parameters: {'splitter': 'best', 'min_samples_split': 0.3413760417311647, 'min_samples_leaf': 0.010070008231056601, 'min_weight_fraction_leaf': 0.08888750888523841, 'max_features': 0.9230172795762449}. Best is trial 21 with value: 0.837083811404636.[0m
[32m[I 2022-04-21 11:37:48,589][0m Trial 134 finished with value: 0.8318450474400789 and parameters: {'splitter': 'best', 'min_samples_split': 0.3536405014699289, 'min_samples_leaf': 0.24221185446950327, 'min_weight_fraction_leaf': 0.03842570009482486, 'max_features': 0.9433859238620675}. Best is trial 21 with value: 0.837083811404636.[0m
[32m[I 2022-04-21 11:37:48,659][0m Trial 135 finished with value: 0.8329615567419848 and parameters: {'splitter': 'best', 'min_samples_split': 0.37369772675463897, 'min_samples_leaf': 0.02370391929606052, 'min_weight_fraction_leaf': 0.07342268820568087, 'max_features': 0.8702198436670983}. Best is trial 21 with value: 0.837083811404636.[0m
[32m[I 2022-04-21 11:37:48,777][0m Trial 136 finished with value: 0.8363268199688415 and parameters: {'splitter': 'best', 'min_samples_split': 0.2380822598415253, 'min_samples_leaf': 0.006374653640057987, 'min_weight_fraction_leaf': 0.05285863223929252, 'max_features': 0.9047872731262768}. Best is trial 21 with value: 0.837083811404636.[0m
[32m[I 2022-04-21 11:37:48,818][0m Trial 137 finished with value: 0.8294029951776167 and parameters: {'splitter': 'best', 'min_samples_split': 0.3976645626410216, 'min_samples_leaf': 0.016319007439180473, 'min_weight_fraction_leaf': 0.037976220923363106, 'max_features': 0.9311542705298548}. Best is trial 21 with value: 0.837083811404636.[0m
[32m[I 2022-04-21 11:37:48,859][0m Trial 138 finished with value: 0.8318450474400789 and parameters: {'splitter': 'best', 'min_samples_split': 0.3442797587976794, 'min_samples_leaf': 0.001953372101711057, 'min_weight_fraction_leaf': 0.2362716126417551, 'max_features': 0.9568185237910892}. Best is trial 21 with value: 0.837083811404636.[0m
[32m[I 2022-04-21 11:37:48,902][0m Trial 139 finished with value: 0.8334225171867375 and parameters: {'splitter': 'best', 'min_samples_split': 0.30850169422425244, 'min_samples_leaf': 0.050566021564099936, 'min_weight_fraction_leaf': 0.017906116676294718, 'max_features': 0.9109530683948126}. Best is trial 21 with value: 0.837083811404636.[0m
[32m[I 2022-04-21 11:37:49,096][0m Trial 140 finished with value: 0.8307835772230975 and parameters: {'splitter': 'random', 'min_samples_split': 0.36102341688012135, 'min_samples_leaf': 0.03786433238870545, 'min_weight_fraction_leaf': 0.06451755072678486, 'max_features': 0.8851629848307769}. Best is trial 21 with value: 0.837083811404636.[0m
[32m[I 2022-04-21 11:37:49,162][0m Trial 141 finished with value: 0.8344489474910419 and parameters: {'splitter': 'best', 'min_samples_split': 0.32293982404884475, 'min_samples_leaf': 0.04201021101100111, 'min_weight_fraction_leaf': 0.015720838791163278, 'max_features': 0.9797314032658799}. Best is trial 21 with value: 0.837083811404636.[0m
[32m[I 2022-04-21 11:37:49,225][0m Trial 142 finished with value: 0.8367527493778185 and parameters: {'splitter': 'best', 'min_samples_split': 0.33371317268830225, 'min_samples_leaf': 0.025472848269436937, 'min_weight_fraction_leaf': 0.04790645395734899, 'max_features': 0.9991701830292037}. Best is trial 21 with value: 0.837083811404636.[0m
[32m[I 2022-04-21 11:37:49,298][0m Trial 143 finished with value: 0.8366717314767083 and parameters: {'splitter': 'best', 'min_samples_split': 0.3517844145747695, 'min_samples_leaf': 0.03283204691151784, 'min_weight_fraction_leaf': 0.02943705217492873, 'max_features': 0.9628478595879926}. Best is trial 21 with value: 0.837083811404636.[0m
[32m[I 2022-04-21 11:37:49,341][0m Trial 144 finished with value: 0.836837262490117 and parameters: {'splitter': 'best', 'min_samples_split': 0.3414872815000445, 'min_samples_leaf': 0.05926402149407774, 'min_weight_fraction_leaf': 0.03004092736175082, 'max_features': 0.942923716312755}. Best is trial 21 with value: 0.837083811404636.[0m
[32m[I 2022-04-21 11:37:49,383][0m Trial 145 finished with value: 0.836837262490117 and parameters: {'splitter': 'best', 'min_samples_split': 0.3407905372442228, 'min_samples_leaf': 0.06258418287419018, 'min_weight_fraction_leaf': 0.04140146837034381, 'max_features': 0.9420845145576106}. Best is trial 21 with value: 0.837083811404636.[0m
[32m[I 2022-04-21 11:37:49,487][0m Trial 146 finished with value: 0.8123359030993946 and parameters: {'splitter': 'best', 'min_samples_split': 0.20434034961332434, 'min_samples_leaf': 0.060373306546747496, 'min_weight_fraction_leaf': 0.04483132214951908, 'max_features': 0.06035610135868874}. Best is trial 21 with value: 0.837083811404636.[0m
[32m[I 2022-04-21 11:37:49,611][0m Trial 147 finished with value: 0.8337887861510798 and parameters: {'splitter': 'best', 'min_samples_split': 0.3654388096715948, 'min_samples_leaf': 0.07276284564896404, 'min_weight_fraction_leaf': 0.05792093117002739, 'max_features': 0.6886163226985003}. Best is trial 21 with value: 0.837083811404636.[0m
[32m[I 2022-04-21 11:37:49,652][0m Trial 148 finished with value: 0.8367225558573038 and parameters: {'splitter': 'best', 'min_samples_split': 0.1798902608606926, 'min_samples_leaf': 0.06573183904378324, 'min_weight_fraction_leaf': 0.03521971899287296, 'max_features': 0.9461702359643217}. Best is trial 21 with value: 0.837083811404636.[0m
[32m[I 2022-04-21 11:37:49,692][0m Trial 149 finished with value: 0.8342605834042434 and parameters: {'splitter': 'best', 'min_samples_split': 0.2946180162968629, 'min_samples_leaf': 0.017437408284838394, 'min_weight_fraction_leaf': 0.07893489790042049, 'max_features': 0.9277550638771407}. Best is trial 21 with value: 0.837083811404636.[0m
[32m[I 2022-04-21 11:37:49,733][0m Trial 150 finished with value: 0.8294029951776167 and parameters: {'splitter': 'best', 'min_samples_split': 0.4373828027259714, 'min_samples_leaf': 0.054728790140473646, 'min_weight_fraction_leaf': 0.06630459851289675, 'max_features': 0.90746330971118}. Best is trial 21 with value: 0.837083811404636.[0m
[32m[I 2022-04-21 11:37:49,775][0m Trial 151 finished with value: 0.836837262490117 and parameters: {'splitter': 'best', 'min_samples_split': 0.34100387108238983, 'min_samples_leaf': 0.04873054396938306, 'min_weight_fraction_leaf': 0.015703640259871986, 'max_features': 0.9443380572407377}. Best is trial 21 with value: 0.837083811404636.[0m
[32m[I 2022-04-21 11:37:49,845][0m Trial 152 finished with value: 0.8348082114676366 and parameters: {'splitter': 'best', 'min_samples_split': 0.31711238146793197, 'min_samples_leaf': 0.04728475235567174, 'min_weight_fraction_leaf': 0.01936567863041662, 'max_features': 0.9739351862939624}. Best is trial 21 with value: 0.837083811404636.[0m
[32m[I 2022-04-21 11:37:50,002][0m Trial 153 finished with value: 0.8367527493778185 and parameters: {'splitter': 'best', 'min_samples_split': 0.3358167772295438, 'min_samples_leaf': 0.0010590981596116794, 'min_weight_fraction_leaf': 0.03615893848151223, 'max_features': 0.942673169678178}. Best is trial 21 with value: 0.837083811404636.[0m
[32m[I 2022-04-21 11:37:50,149][0m Trial 154 finished with value: 0.8318450474400789 and parameters: {'splitter': 'best', 'min_samples_split': 0.3509668605065176, 'min_samples_leaf': 0.30462814565710467, 'min_weight_fraction_leaf': 0.00923578714560767, 'max_features': 0.9630569391373353}. Best is trial 21 with value: 0.837083811404636.[0m
[32m[I 2022-04-21 11:37:50,313][0m Trial 155 finished with value: 0.8304220807990864 and parameters: {'splitter': 'best', 'min_samples_split': 0.3791389977469457, 'min_samples_leaf': 0.02453520975227087, 'min_weight_fraction_leaf': 0.027059108044507764, 'max_features': 0.8675655344697014}. Best is trial 21 with value: 0.837083811404636.[0m
[32m[I 2022-04-21 11:37:50,489][0m Trial 156 finished with value: 0.65 and parameters: {'splitter': 'best', 'min_samples_split': 0.33620610457598843, 'min_samples_leaf': 0.07907840854291193, 'min_weight_fraction_leaf': 0.29610266547291736, 'max_features': 0.15870359743307683}. Best is trial 21 with value: 0.837083811404636.[0m
[32m[I 2022-04-21 11:37:50,596][0m Trial 157 finished with value: 0.8328578264342497 and parameters: {'splitter': 'random', 'min_samples_split': 0.30543224495659543, 'min_samples_leaf': 0.04091080018433542, 'min_weight_fraction_leaf': 0.0006027895287231185, 'max_features': 0.9789631111720839}. Best is trial 21 with value: 0.837083811404636.[0m
[32m[I 2022-04-21 11:37:50,706][0m Trial 158 finished with value: 0.8299068784009862 and parameters: {'splitter': 'best', 'min_samples_split': 0.2775876886167465, 'min_samples_leaf': 0.08925162817802654, 'min_weight_fraction_leaf': 0.17675794376791634, 'max_features': 0.926754942328796}. Best is trial 21 with value: 0.837083811404636.[0m
[32m[I 2022-04-21 11:37:50,884][0m Trial 159 finished with value: 0.8361084444785265 and parameters: {'splitter': 'best', 'min_samples_split': 0.1927507275828793, 'min_samples_leaf': 0.015010077837069813, 'min_weight_fraction_leaf': 0.05076320470564437, 'max_features': 0.8949280243106866}. Best is trial 21 with value: 0.837083811404636.[0m
[32m[I 2022-04-21 11:37:51,037][0m Trial 160 finished with value: 0.8353797750782629 and parameters: {'splitter': 'best', 'min_samples_split': 0.3585695188679798, 'min_samples_leaf': 0.032430343683634635, 'min_weight_fraction_leaf': 0.018700912372360046, 'max_features': 0.9977640800640291}. Best is trial 21 with value: 0.837083811404636.[0m
[32m[I 2022-04-21 11:37:51,145][0m Trial 161 finished with value: 0.836837262490117 and parameters: {'splitter': 'best', 'min_samples_split': 0.3438956700963237, 'min_samples_leaf': 0.053250828727275414, 'min_weight_fraction_leaf': 0.0431246633018339, 'max_features': 0.9442666695148321}. Best is trial 21 with value: 0.837083811404636.[0m
[32m[I 2022-04-21 11:37:51,267][0m Trial 162 finished with value: 0.825849160299934 and parameters: {'splitter': 'best', 'min_samples_split': 0.34837970172535765, 'min_samples_leaf': 0.045605887273529475, 'min_weight_fraction_leaf': 0.04509751219479175, 'max_features': 0.5157037434755016}. Best is trial 21 with value: 0.837083811404636.[0m
[32m[I 2022-04-21 11:37:51,320][0m Trial 163 finished with value: 0.8367527493778185 and parameters: {'splitter': 'best', 'min_samples_split': 0.32771825485187817, 'min_samples_leaf': 0.05958192436540268, 'min_weight_fraction_leaf': 0.025959268327763917, 'max_features': 0.9494540164245998}. Best is trial 21 with value: 0.837083811404636.[0m
[32m[I 2022-04-21 11:37:51,410][0m Trial 164 finished with value: 0.8366717314767083 and parameters: {'splitter': 'best', 'min_samples_split': 0.34309599595032075, 'min_samples_leaf': 0.052923430716030354, 'min_weight_fraction_leaf': 0.09714618475456094, 'max_features': 0.9236517396839007}. Best is trial 21 with value: 0.837083811404636.[0m
[32m[I 2022-04-21 11:37:51,457][0m Trial 165 finished with value: 0.8329615567419848 and parameters: {'splitter': 'best', 'min_samples_split': 0.36555297936275216, 'min_samples_leaf': 0.07011165419798134, 'min_weight_fraction_leaf': 0.03552925611637256, 'max_features': 0.9445615801034666}. Best is trial 21 with value: 0.837083811404636.[0m
[32m[I 2022-04-21 11:37:51,556][0m Trial 166 finished with value: 0.8348082114676366 and parameters: {'splitter': 'best', 'min_samples_split': 0.31939025532849835, 'min_samples_leaf': 0.03504004688742589, 'min_weight_fraction_leaf': 0.01925566774902875, 'max_features': 0.9136240293972424}. Best is trial 21 with value: 0.837083811404636.[0m
[32m[I 2022-04-21 11:37:51,636][0m Trial 167 finished with value: 0.8353797750782629 and parameters: {'splitter': 'best', 'min_samples_split': 0.35652339071541284, 'min_samples_leaf': 0.022002400664235082, 'min_weight_fraction_leaf': 0.05533451697610381, 'max_features': 0.9742618425608572}. Best is trial 21 with value: 0.837083811404636.[0m
[32m[I 2022-04-21 11:37:51,702][0m Trial 168 finished with value: 0.65 and parameters: {'splitter': 'best', 'min_samples_split': 0.33474245403294217, 'min_samples_leaf': 0.02847545138773363, 'min_weight_fraction_leaf': 0.4582984528290893, 'max_features': 0.9624288482604443}. Best is trial 21 with value: 0.837083811404636.[0m
[32m[I 2022-04-21 11:37:51,824][0m Trial 169 finished with value: 0.8294029951776167 and parameters: {'splitter': 'best', 'min_samples_split': 0.46558032926965676, 'min_samples_leaf': 0.06610239963833604, 'min_weight_fraction_leaf': 0.008364029097051117, 'max_features': 0.890932818555802}. Best is trial 21 with value: 0.837083811404636.[0m
[32m[I 2022-04-21 11:37:51,888][0m Trial 170 finished with value: 0.8321397898872117 and parameters: {'splitter': 'random', 'min_samples_split': 0.3395142335600035, 'min_samples_leaf': 0.01604146491719715, 'min_weight_fraction_leaf': 0.04122380261665704, 'max_features': 0.9369698901792505}. Best is trial 21 with value: 0.837083811404636.[0m
[32m[I 2022-04-21 11:37:51,976][0m Trial 171 finished with value: 0.836837262490117 and parameters: {'splitter': 'best', 'min_samples_split': 0.34511101904521374, 'min_samples_leaf': 0.042184145548088595, 'min_weight_fraction_leaf': 0.02721835422003637, 'max_features': 0.9493333511845008}. Best is trial 21 with value: 0.837083811404636.[0m
[32m[I 2022-04-21 11:37:52,043][0m Trial 172 finished with value: 0.8329615567419848 and parameters: {'splitter': 'best', 'min_samples_split': 0.37316999385919924, 'min_samples_leaf': 0.008985713420860894, 'min_weight_fraction_leaf': 0.030005241590004554, 'max_features': 0.9739883798609873}. Best is trial 21 with value: 0.837083811404636.[0m
[32m[I 2022-04-21 11:37:52,086][0m Trial 173 finished with value: 0.8361084444785265 and parameters: {'splitter': 'best', 'min_samples_split': 0.21492474801161945, 'min_samples_leaf': 0.051281755181662364, 'min_weight_fraction_leaf': 0.04166994551713976, 'max_features': 0.9387990856762836}. Best is trial 21 with value: 0.837083811404636.[0m
[32m[I 2022-04-21 11:37:52,129][0m Trial 174 finished with value: 0.8366717314767083 and parameters: {'splitter': 'best', 'min_samples_split': 0.3492725647487739, 'min_samples_leaf': 0.03964962527014123, 'min_weight_fraction_leaf': 0.05913543067294457, 'max_features': 0.9562517248381593}. Best is trial 21 with value: 0.837083811404636.[0m
[32m[I 2022-04-21 11:37:52,208][0m Trial 175 finished with value: 0.8350223759362981 and parameters: {'splitter': 'best', 'min_samples_split': 0.32586714264862215, 'min_samples_leaf': 0.028159905095018763, 'min_weight_fraction_leaf': 0.013998091137880829, 'max_features': 0.9149402754275354}. Best is trial 21 with value: 0.837083811404636.[0m
[32m[I 2022-04-21 11:37:52,267][0m Trial 176 finished with value: 0.8318450474400789 and parameters: {'splitter': 'best', 'min_samples_split': 0.35826064054898504, 'min_samples_leaf': 0.2077029307039327, 'min_weight_fraction_leaf': 0.02493828990887896, 'max_features': 0.9895460565835908}. Best is trial 21 with value: 0.837083811404636.[0m
[32m[I 2022-04-21 11:37:52,345][0m Trial 177 finished with value: 0.836837262490117 and parameters: {'splitter': 'best', 'min_samples_split': 0.3434552006926976, 'min_samples_leaf': 0.05893016152100057, 'min_weight_fraction_leaf': 0.010603109244127593, 'max_features': 0.9487159122009013}. Best is trial 21 with value: 0.837083811404636.[0m
[32m[I 2022-04-21 11:37:52,446][0m Trial 178 finished with value: 0.837083811404636 and parameters: {'splitter': 'best', 'min_samples_split': 0.326604159477924, 'min_samples_leaf': 0.07585674429558253, 'min_weight_fraction_leaf': 0.07313221932075707, 'max_features': 0.9258175822444766}. Best is trial 21 with value: 0.837083811404636.[0m
[32m[I 2022-04-21 11:37:52,563][0m Trial 179 finished with value: 0.8347245653772368 and parameters: {'splitter': 'best', 'min_samples_split': 0.3145007875455264, 'min_samples_leaf': 0.09084558450264707, 'min_weight_fraction_leaf': 0.06884260515383057, 'max_features': 0.8585525515101807}. Best is trial 21 with value: 0.837083811404636.[0m
[32m[I 2022-04-21 11:37:52,619][0m Trial 180 finished with value: 0.8359946375562541 and parameters: {'splitter': 'best', 'min_samples_split': 0.26030331808799934, 'min_samples_leaf': 0.07372618401932265, 'min_weight_fraction_leaf': 0.008358354068180536, 'max_features': 0.9006037122385758}. Best is trial 21 with value: 0.837083811404636.[0m
[32m[I 2022-04-21 11:37:52,686][0m Trial 181 finished with value: 0.8367527493778185 and parameters: {'splitter': 'best', 'min_samples_split': 0.3328465947584116, 'min_samples_leaf': 0.04372432381408642, 'min_weight_fraction_leaf': 0.05129600093477349, 'max_features': 0.9223190744587092}. Best is trial 21 with value: 0.837083811404636.[0m
[32m[I 2022-04-21 11:37:52,771][0m Trial 182 finished with value: 0.8330592286387455 and parameters: {'splitter': 'best', 'min_samples_split': 0.325589661912009, 'min_samples_leaf': 0.014862699588786811, 'min_weight_fraction_leaf': 8.276651437394769e-05, 'max_features': 0.9647271054513293}. Best is trial 21 with value: 0.837083811404636.[0m
[32m[I 2022-04-21 11:37:52,847][0m Trial 183 finished with value: 0.8366717314767083 and parameters: {'splitter': 'best', 'min_samples_split': 0.34780602532422006, 'min_samples_leaf': 0.061151176936328044, 'min_weight_fraction_leaf': 0.032583906648516445, 'max_features': 0.9501632096261345}. Best is trial 21 with value: 0.837083811404636.[0m
[32m[I 2022-04-21 11:37:52,889][0m Trial 184 finished with value: 0.8350481835720354 and parameters: {'splitter': 'best', 'min_samples_split': 0.08338229398678973, 'min_samples_leaf': 0.08073290247813084, 'min_weight_fraction_leaf': 0.024204087328028884, 'max_features': 0.9307607771554087}. Best is trial 21 with value: 0.837083811404636.[0m
[32m[I 2022-04-21 11:37:52,929][0m Trial 185 finished with value: 0.8329615567419848 and parameters: {'splitter': 'best', 'min_samples_split': 0.3665083888952563, 'min_samples_leaf': 0.05729037328137794, 'min_weight_fraction_leaf': 0.040058248266805915, 'max_features': 0.8835196358411205}. Best is trial 21 with value: 0.837083811404636.[0m
[32m[I 2022-04-21 11:37:52,970][0m Trial 186 finished with value: 0.8365872183644096 and parameters: {'splitter': 'best', 'min_samples_split': 0.3390233717149375, 'min_samples_leaf': 0.06992921171359519, 'min_weight_fraction_leaf': 0.08273394258376038, 'max_features': 0.9052191479952657}. Best is trial 21 with value: 0.837083811404636.[0m
[32m[I 2022-04-21 11:37:53,019][0m Trial 187 finished with value: 0.8366717314767083 and parameters: {'splitter': 'best', 'min_samples_split': 0.3527215550615181, 'min_samples_leaf': 0.03232568787197189, 'min_weight_fraction_leaf': 0.06150909473575142, 'max_features': 0.9835494634684118}. Best is trial 21 with value: 0.837083811404636.[0m
[32m[I 2022-04-21 11:37:53,060][0m Trial 188 finished with value: 0.8332881785328444 and parameters: {'splitter': 'random', 'min_samples_split': 0.3304207776549551, 'min_samples_leaf': 0.02322144859992021, 'min_weight_fraction_leaf': 0.07292757619378701, 'max_features': 0.9780834913365325}. Best is trial 21 with value: 0.837083811404636.[0m
[32m[I 2022-04-21 11:37:53,102][0m Trial 189 finished with value: 0.8318450474400789 and parameters: {'splitter': 'best', 'min_samples_split': 0.24650212165387828, 'min_samples_leaf': 0.05324290649668312, 'min_weight_fraction_leaf': 0.2571217997354973, 'max_features': 0.9980474787753315}. Best is trial 21 with value: 0.837083811404636.[0m
