[32m[I 2022-04-21 14:31:00,878][0m Trial 144 finished with value: 0.8155028980412908 and parameters: {'loss': 'coxph', 'learning_rate': 0.0001743317995047089, 'n_estimators': 163, 'criterion': 'friedman_mse', 'min_samples_split': 2, 'min_samples_leaf': 1, 'min_weight_fraction_leaf': 0.1889165024553016, 'min_impurity_decrease': 0.2782098367227638, 'max_features': 0.8286294931758443, 'subsample': 0.22348108648707715, 'dropout_rate': 0.9226607945246071, 'ccp_alpha': 0.013800364078504176}. Best is trial 142 with value: 0.8164567347311582.[0m
[32m[I 2022-04-21 14:31:05,968][0m Trial 145 finished with value: 0.25 and parameters: {'loss': 'coxph', 'learning_rate': 0.00018641103929466408, 'n_estimators': 163, 'criterion': 'friedman_mse', 'min_samples_split': 2, 'min_samples_leaf': 1, 'min_weight_fraction_leaf': 0.18872236954566826, 'min_impurity_decrease': 0.2776192384282044, 'max_features': 0.901708178927579, 'subsample': 0.22972755617122753, 'dropout_rate': 0.9500708356497389, 'ccp_alpha': 0.441630781569479}. Best is trial 142 with value: 0.8164567347311582.[0m
[32m[I 2022-04-21 14:31:14,621][0m Trial 146 finished with value: 0.8139628544686366 and parameters: {'loss': 'coxph', 'learning_rate': 0.0001896306544289156, 'n_estimators': 181, 'criterion': 'friedman_mse', 'min_samples_split': 2, 'min_samples_leaf': 1, 'min_weight_fraction_leaf': 0.17401120589544428, 'min_impurity_decrease': 0.285693165975975, 'max_features': 0.8475138961817379, 'subsample': 0.2987996877973844, 'dropout_rate': 0.8195741816299351, 'ccp_alpha': 0.1324288046198472}. Best is trial 142 with value: 0.8164567347311582.[0m
[32m[I 2022-04-21 14:31:21,775][0m Trial 147 finished with value: 0.25662745571200507 and parameters: {'loss': 'coxph', 'learning_rate': 0.0001756558041739724, 'n_estimators': 180, 'criterion': 'friedman_mse', 'min_samples_split': 2, 'min_samples_leaf': 1, 'min_weight_fraction_leaf': 0.17252031236888551, 'min_impurity_decrease': 0.2809425343832877, 'max_features': 0.8858695836150767, 'subsample': 0.2956408640401697, 'dropout_rate': 0.8380675710667109, 'ccp_alpha': 0.3166673515025432}. Best is trial 142 with value: 0.8164567347311582.[0m
[32m[I 2022-04-21 14:31:26,763][0m Trial 148 finished with value: 0.816781700583012 and parameters: {'loss': 'coxph', 'learning_rate': 6.589581227233226e-05, 'n_estimators': 116, 'criterion': 'friedman_mse', 'min_samples_split': 2, 'min_samples_leaf': 1, 'min_weight_fraction_leaf': 0.18545727517286742, 'min_impurity_decrease': 0.3724007523770554, 'max_features': 0.8405101210453494, 'subsample': 0.22722026321644767, 'dropout_rate': 0.9101776658253351, 'ccp_alpha': 0.13515127135950006}. Best is trial 148 with value: 0.816781700583012.[0m
/media/san2_ssd/data/Workdir/survival/venv/lib/python3.8/site-packages/sksurv/ensemble/boosting.py:955: RuntimeWarning: divide by zero encountered in log
  time = numpy.log(time)
/media/san2_ssd/data/Workdir/survival/venv/lib/python3.8/site-packages/sksurv/ensemble/boosting.py:955: RuntimeWarning: divide by zero encountered in log
  time = numpy.log(time)
/media/san2_ssd/data/Workdir/survival/venv/lib/python3.8/site-packages/sksurv/ensemble/boosting.py:955: RuntimeWarning: divide by zero encountered in log
  time = numpy.log(time)
/media/san2_ssd/data/Workdir/survival/venv/lib/python3.8/site-packages/sksurv/ensemble/boosting.py:955: RuntimeWarning: divide by zero encountered in log
  time = numpy.log(time)
[32m[I 2022-04-21 14:31:27,925][0m Trial 149 finished with value: -0.4620117997325698 and parameters: {'loss': 'squared', 'learning_rate': 6.19700960051055e-05, 'n_estimators': 120, 'criterion': 'friedman_mse', 'min_samples_split': 2, 'min_samples_leaf': 1, 'min_weight_fraction_leaf': 0.1845893314704714, 'min_impurity_decrease': 0.3798585410481149, 'max_features': 0.8150293999762703, 'subsample': 0.23199531308113017, 'dropout_rate': 0.7878313965829835, 'ccp_alpha': 0.15064611381245657}. Best is trial 148 with value: 0.816781700583012.[0m
[32m[I 2022-04-21 14:31:30,644][0m Trial 150 finished with value: 0.8185025694908692 and parameters: {'loss': 'coxph', 'learning_rate': 0.0003251934648053906, 'n_estimators': 114, 'criterion': 'friedman_mse', 'min_samples_split': 3, 'min_samples_leaf': 1, 'min_weight_fraction_leaf': 0.14190627443246656, 'min_impurity_decrease': 0.4072702873708838, 'max_features': 0.836487101124551, 'subsample': 0.21176009083575947, 'dropout_rate': 0.9322414669481869, 'ccp_alpha': 0.1382824457933378}. Best is trial 150 with value: 0.8185025694908692.[0m
[32m[I 2022-04-21 14:31:35,764][0m Trial 151 finished with value: 0.821947875574411 and parameters: {'loss': 'coxph', 'learning_rate': 0.0003517051108544701, 'n_estimators': 137, 'criterion': 'friedman_mse', 'min_samples_split': 3, 'min_samples_leaf': 1, 'min_weight_fraction_leaf': 0.1435428702433293, 'min_impurity_decrease': 0.481466363306358, 'max_features': 0.8341911280537365, 'subsample': 0.20607001867882468, 'dropout_rate': 0.9233174540454361, 'ccp_alpha': 0.1388661240871682}. Best is trial 151 with value: 0.821947875574411.[0m
[32m[I 2022-04-21 14:31:38,701][0m Trial 152 finished with value: 0.8156838792133488 and parameters: {'loss': 'coxph', 'learning_rate': 0.00034154866306754483, 'n_estimators': 100, 'criterion': 'friedman_mse', 'min_samples_split': 3, 'min_samples_leaf': 1, 'min_weight_fraction_leaf': 0.16550785358290124, 'min_impurity_decrease': 0.48454845558071935, 'max_features': 0.845410713690889, 'subsample': 0.18802716676968034, 'dropout_rate': 0.9370990101393559, 'ccp_alpha': 0.14753561659775818}. Best is trial 151 with value: 0.821947875574411.[0m
[32m[I 2022-04-21 14:31:41,419][0m Trial 153 finished with value: 0.3709320983553456 and parameters: {'loss': 'coxph', 'learning_rate': 0.00034594392950989346, 'n_estimators': 101, 'criterion': 'friedman_mse', 'min_samples_split': 3, 'min_samples_leaf': 2, 'min_weight_fraction_leaf': 0.14530384134603125, 'min_impurity_decrease': 0.4894167200350382, 'max_features': 0.8454273202566795, 'subsample': 0.18993397801739656, 'dropout_rate': 0.917779396254037, 'ccp_alpha': 0.3040753443496353}. Best is trial 151 with value: 0.821947875574411.[0m
[32m[I 2022-04-21 14:31:46,879][0m Trial 154 finished with value: 0.8113807358244616 and parameters: {'loss': 'coxph', 'learning_rate': 0.0001944684636335766, 'n_estimators': 125, 'criterion': 'friedman_mse', 'min_samples_split': 3, 'min_samples_leaf': 1, 'min_weight_fraction_leaf': 0.16808118717415796, 'min_impurity_decrease': 0.41348695931486, 'max_features': 0.8504575064228118, 'subsample': 0.267335107532323, 'dropout_rate': 0.9189086144447283, 'ccp_alpha': 0.14145519685258187}. Best is trial 151 with value: 0.821947875574411.[0m
[32m[I 2022-04-21 14:31:51,114][0m Trial 155 finished with value: 0.25 and parameters: {'loss': 'coxph', 'learning_rate': 0.00022526624842965796, 'n_estimators': 112, 'criterion': 'friedman_mse', 'min_samples_split': 3, 'min_samples_leaf': 1, 'min_weight_fraction_leaf': 0.167968261143966, 'min_impurity_decrease': 0.4084253490697434, 'max_features': 0.8633942493578284, 'subsample': 0.2513017091049176, 'dropout_rate': 0.901348160545607, 'ccp_alpha': 0.5412459018112343}. Best is trial 151 with value: 0.821947875574411.[0m
[32m[I 2022-04-21 14:31:56,295][0m Trial 156 finished with value: 0.5968505545537354 and parameters: {'loss': 'coxph', 'learning_rate': 0.00032916300924075074, 'n_estimators': 113, 'criterion': 'friedman_mse', 'min_samples_split': 3, 'min_samples_leaf': 2, 'min_weight_fraction_leaf': 0.1512096977852103, 'min_impurity_decrease': 0.5305139316947658, 'max_features': 0.8424256909872213, 'subsample': 0.20522024351554574, 'dropout_rate': 0.9342755334894535, 'ccp_alpha': 0.22491933026455435}. Best is trial 151 with value: 0.821947875574411.[0m
[32m[I 2022-04-21 14:31:58,429][0m Trial 157 finished with value: 0.8196712124353628 and parameters: {'loss': 'coxph', 'learning_rate': 0.0005524553051805675, 'n_estimators': 117, 'criterion': 'friedman_mse', 'min_samples_split': 3, 'min_samples_leaf': 1, 'min_weight_fraction_leaf': 0.16452397099064942, 'min_impurity_decrease': 0.48235978408717806, 'max_features': 0.8281726555551486, 'subsample': 0.16789975197324758, 'dropout_rate': 0.9983555239037958, 'ccp_alpha': 0.14000667882099505}. Best is trial 151 with value: 0.821947875574411.[0m
[32m[I 2022-04-21 14:31:59,730][0m Trial 158 finished with value: 0.25905751009786154 and parameters: {'loss': 'coxph', 'learning_rate': 0.0006054648377597879, 'n_estimators': 103, 'criterion': 'friedman_mse', 'min_samples_split': 3, 'min_samples_leaf': 1, 'min_weight_fraction_leaf': 0.1603680963980132, 'min_impurity_decrease': 0.4808031944664712, 'max_features': 0.769232019939797, 'subsample': 0.2085308697733435, 'dropout_rate': 0.997775542900679, 'ccp_alpha': 0.3478118331530346}. Best is trial 151 with value: 0.821947875574411.[0m
[32m[I 2022-04-21 14:32:04,649][0m Trial 159 finished with value: 0.8171170383705066 and parameters: {'loss': 'coxph', 'learning_rate': 0.0004541601057323555, 'n_estimators': 116, 'criterion': 'friedman_mse', 'min_samples_split': 3, 'min_samples_leaf': 1, 'min_weight_fraction_leaf': 0.1351234347630418, 'min_impurity_decrease': 0.5142747162347971, 'max_features': 0.8149381339916099, 'subsample': 0.16929527484596385, 'dropout_rate': 0.8694120815369643, 'ccp_alpha': 0.15642890626322706}. Best is trial 151 with value: 0.821947875574411.[0m
[32m[I 2022-04-21 14:32:08,162][0m Trial 160 finished with value: 0.8123999106177363 and parameters: {'loss': 'coxph', 'learning_rate': 0.00038459794755513074, 'n_estimators': 124, 'criterion': 'friedman_mse', 'min_samples_split': 3, 'min_samples_leaf': 2, 'min_weight_fraction_leaf': 0.1402243422514644, 'min_impurity_decrease': 0.5528201922204715, 'max_features': 0.8151892526526221, 'subsample': 0.17915611040815274, 'dropout_rate': 0.8857765231261305, 'ccp_alpha': 0.1732953429442304}. Best is trial 151 with value: 0.821947875574411.[0m
[32m[I 2022-04-21 14:32:11,891][0m Trial 161 finished with value: 0.8240558898042311 and parameters: {'loss': 'coxph', 'learning_rate': 0.00044224202809530416, 'n_estimators': 116, 'criterion': 'friedman_mse', 'min_samples_split': 3, 'min_samples_leaf': 1, 'min_weight_fraction_leaf': 0.13658335897749843, 'min_impurity_decrease': 0.5044695923990685, 'max_features': 0.8222319111317828, 'subsample': 0.16590005048522527, 'dropout_rate': 0.8669978478294431, 'ccp_alpha': 0.13280616489360605}. Best is trial 161 with value: 0.8240558898042311.[0m
[32m[I 2022-04-21 14:32:16,288][0m Trial 162 finished with value: 0.8051967672637435 and parameters: {'loss': 'coxph', 'learning_rate': 0.0004751590003521331, 'n_estimators': 116, 'criterion': 'friedman_mse', 'min_samples_split': 3, 'min_samples_leaf': 2, 'min_weight_fraction_leaf': 0.13661485633521356, 'min_impurity_decrease': 0.5520855801927524, 'max_features': 0.8176457457230673, 'subsample': 0.14771625773803684, 'dropout_rate': 0.8802227752712938, 'ccp_alpha': 0.2581680981624604}. Best is trial 161 with value: 0.8240558898042311.[0m
[32m[I 2022-04-21 14:32:19,738][0m Trial 163 finished with value: 0.25 and parameters: {'loss': 'coxph', 'learning_rate': 0.0007021338928721737, 'n_estimators': 108, 'criterion': 'friedman_mse', 'min_samples_split': 3, 'min_samples_leaf': 1, 'min_weight_fraction_leaf': 0.124051588463838, 'min_impurity_decrease': 0.47885033789632486, 'max_features': 0.7975009260421929, 'subsample': 0.17494731361612834, 'dropout_rate': 0.8648715261617047, 'ccp_alpha': 0.4266350692328067}. Best is trial 161 with value: 0.8240558898042311.[0m
[32m[I 2022-04-21 14:32:23,337][0m Trial 164 finished with value: 0.8228482265057242 and parameters: {'loss': 'coxph', 'learning_rate': 0.00038746720398134213, 'n_estimators': 118, 'criterion': 'friedman_mse', 'min_samples_split': 3, 'min_samples_leaf': 2, 'min_weight_fraction_leaf': 0.1452706937054023, 'min_impurity_decrease': 0.5078149618409316, 'max_features': 0.7721046073356262, 'subsample': 0.2151374811279206, 'dropout_rate': 0.8270684429867371, 'ccp_alpha': 0.14573008311363586}. Best is trial 161 with value: 0.8240558898042311.[0m
[32m[I 2022-04-21 14:32:28,219][0m Trial 165 finished with value: 0.8135210527346886 and parameters: {'loss': 'coxph', 'learning_rate': 0.00039074602111646185, 'n_estimators': 119, 'criterion': 'friedman_mse', 'min_samples_split': 3, 'min_samples_leaf': 2, 'min_weight_fraction_leaf': 0.14830817937677038, 'min_impurity_decrease': 0.4980999998554003, 'max_features': 0.772516891872771, 'subsample': 0.1785243003463611, 'dropout_rate': 0.8205663057982814, 'ccp_alpha': 0.16228487816492645}. Best is trial 161 with value: 0.8240558898042311.[0m
[32m[I 2022-04-21 14:32:32,462][0m Trial 166 finished with value: 0.8077852451881521 and parameters: {'loss': 'coxph', 'learning_rate': 0.00036479127253421714, 'n_estimators': 118, 'criterion': 'friedman_mse', 'min_samples_split': 3, 'min_samples_leaf': 2, 'min_weight_fraction_leaf': 0.14405279612952504, 'min_impurity_decrease': 0.5142082796955573, 'max_features': 0.7713054294957851, 'subsample': 0.17004438369263394, 'dropout_rate': 0.8268383793722918, 'ccp_alpha': 0.17151039974312027}. Best is trial 161 with value: 0.8240558898042311.[0m
[32m[I 2022-04-21 14:32:36,257][0m Trial 167 finished with value: 0.2653579555793665 and parameters: {'loss': 'coxph', 'learning_rate': 0.0005401338102685995, 'n_estimators': 123, 'criterion': 'friedman_mse', 'min_samples_split': 3, 'min_samples_leaf': 2, 'min_weight_fraction_leaf': 0.1404184487707344, 'min_impurity_decrease': 0.5490663853055596, 'max_features': 0.8293273080843548, 'subsample': 0.2110634871756001, 'dropout_rate': 0.8522090459569477, 'ccp_alpha': 0.31290197914099194}. Best is trial 161 with value: 0.8240558898042311.[0m
[32m[I 2022-04-21 14:32:42,405][0m Trial 168 finished with value: 0.8215132046968566 and parameters: {'loss': 'coxph', 'learning_rate': 0.00043487887405514785, 'n_estimators': 130, 'criterion': 'friedman_mse', 'min_samples_split': 3, 'min_samples_leaf': 2, 'min_weight_fraction_leaf': 0.1522174407293464, 'min_impurity_decrease': 0.5040856285524455, 'max_features': 0.7308129548947458, 'subsample': 0.1696239124036814, 'dropout_rate': 0.7833323648752111, 'ccp_alpha': 0.14422221993772438}. Best is trial 161 with value: 0.8240558898042311.[0m
[32m[I 2022-04-21 14:32:47,838][0m Trial 169 finished with value: 0.25 and parameters: {'loss': 'coxph', 'learning_rate': 0.00028154506662299034, 'n_estimators': 110, 'criterion': 'friedman_mse', 'min_samples_split': 4, 'min_samples_leaf': 1, 'min_weight_fraction_leaf': 0.15376835402675926, 'min_impurity_decrease': 0.49829281923326035, 'max_features': 0.7384008130660741, 'subsample': 0.1404511754290267, 'dropout_rate': 0.8077711781600846, 'ccp_alpha': 0.5479955164889619}. Best is trial 161 with value: 0.8240558898042311.[0m
[32m[I 2022-04-21 14:32:51,793][0m Trial 170 finished with value: 0.3765608419922887 and parameters: {'loss': 'coxph', 'learning_rate': 0.00045439136078135705, 'n_estimators': 115, 'criterion': 'friedman_mse', 'min_samples_split': 3, 'min_samples_leaf': 2, 'min_weight_fraction_leaf': 0.1295309848450692, 'min_impurity_decrease': 0.5233974529883043, 'max_features': 0.6998016970221481, 'subsample': 0.24574788445654933, 'dropout_rate': 0.7775266495006843, 'ccp_alpha': 0.2624678341687466}. Best is trial 161 with value: 0.8240558898042311.[0m
[32m[I 2022-04-21 14:32:55,824][0m Trial 171 finished with value: 0.7987986979878123 and parameters: {'loss': 'coxph', 'learning_rate': 0.0003773581588867593, 'n_estimators': 127, 'criterion': 'friedman_mse', 'min_samples_split': 3, 'min_samples_leaf': 2, 'min_weight_fraction_leaf': 0.16440121548829018, 'min_impurity_decrease': 0.5797888403823838, 'max_features': 0.7805491986261113, 'subsample': 0.18487389565611778, 'dropout_rate': 0.8930822491502746, 'ccp_alpha': 0.1873587615971586}. Best is trial 161 with value: 0.8240558898042311.[0m
[32m[I 2022-04-21 14:33:00,518][0m Trial 172 finished with value: 0.8092493107960681 and parameters: {'loss': 'coxph', 'learning_rate': 0.00081195405914476, 'n_estimators': 132, 'criterion': 'friedman_mse', 'min_samples_split': 3, 'min_samples_leaf': 2, 'min_weight_fraction_leaf': 0.1817034040575591, 'min_impurity_decrease': 0.4679431426067693, 'max_features': 0.754551128500786, 'subsample': 0.08757749384099209, 'dropout_rate': 0.9671580317534249, 'ccp_alpha': 0.13891849212666113}. Best is trial 161 with value: 0.8240558898042311.[0m
[32m[I 2022-04-21 14:33:02,982][0m Trial 173 finished with value: 0.25 and parameters: {'loss': 'coxph', 'learning_rate': 0.0003286471667692806, 'n_estimators': 104, 'criterion': 'friedman_mse', 'min_samples_split': 3, 'min_samples_leaf': 1, 'min_weight_fraction_leaf': 0.15300983082261277, 'min_impurity_decrease': 0.5373905442294235, 'max_features': 0.8034092956091005, 'subsample': 0.16865307992535028, 'dropout_rate': 0.9363627379900362, 'ccp_alpha': 0.4250798977001412}. Best is trial 161 with value: 0.8240558898042311.[0m
[32m[I 2022-04-21 14:33:08,998][0m Trial 174 finished with value: 0.824528057483301 and parameters: {'loss': 'coxph', 'learning_rate': 0.0005488024752212772, 'n_estimators': 122, 'criterion': 'friedman_mse', 'min_samples_split': 3, 'min_samples_leaf': 1, 'min_weight_fraction_leaf': 0.1741526806329936, 'min_impurity_decrease': 0.4966861879957114, 'max_features': 0.8256761230856245, 'subsample': 0.19052057272494316, 'dropout_rate': 0.8123223772295917, 'ccp_alpha': 0.11270412961855897}. Best is trial 174 with value: 0.824528057483301.[0m
[32m[I 2022-04-21 14:33:15,602][0m Trial 175 finished with value: 0.8203802420520055 and parameters: {'loss': 'coxph', 'learning_rate': 0.0005706593046908104, 'n_estimators': 118, 'criterion': 'friedman_mse', 'min_samples_split': 3, 'min_samples_leaf': 1, 'min_weight_fraction_leaf': 0.1781163144895358, 'min_impurity_decrease': 0.5081222517038664, 'max_features': 0.8600572824276232, 'subsample': 0.225604263412541, 'dropout_rate': 0.8050429245343558, 'ccp_alpha': 0.11941743635904463}. Best is trial 174 with value: 0.824528057483301.[0m
[32m[I 2022-04-21 14:33:18,675][0m Trial 176 finished with value: 0.25 and parameters: {'loss': 'coxph', 'learning_rate': 0.000640878708796208, 'n_estimators': 117, 'criterion': 'friedman_mse', 'min_samples_split': 3, 'min_samples_leaf': 1, 'min_weight_fraction_leaf': 0.17607189817486504, 'min_impurity_decrease': 0.5008089219742822, 'max_features': 0.8325019815429091, 'subsample': 0.2193996793049125, 'dropout_rate': 0.8100407910877981, 'ccp_alpha': 0.3273610617440783}. Best is trial 174 with value: 0.824528057483301.[0m
[32m[I 2022-04-21 14:33:22,003][0m Trial 177 finished with value: 0.8214702078116044 and parameters: {'loss': 'coxph', 'learning_rate': 0.0005045454837025197, 'n_estimators': 106, 'criterion': 'friedman_mse', 'min_samples_split': 3, 'min_samples_leaf': 1, 'min_weight_fraction_leaf': 0.11907151215807674, 'min_impurity_decrease': 0.5079918345266285, 'max_features': 0.8616217492925511, 'subsample': 0.15589608086979553, 'dropout_rate': 0.8444349908481334, 'ccp_alpha': 0.1062574997841921}. Best is trial 174 with value: 0.824528057483301.[0m
[32m[I 2022-04-21 14:33:25,329][0m Trial 178 finished with value: 0.8179633399586889 and parameters: {'loss': 'coxph', 'learning_rate': 0.0005714973966693689, 'n_estimators': 107, 'criterion': 'friedman_mse', 'min_samples_split': 3, 'min_samples_leaf': 1, 'min_weight_fraction_leaf': 0.12453680417677357, 'min_impurity_decrease': 0.508041196789926, 'max_features': 0.8675842542805952, 'subsample': 0.13054477937559564, 'dropout_rate': 0.8451901074838818, 'ccp_alpha': 0.12350562742667295}. Best is trial 174 with value: 0.824528057483301.[0m
/media/san2_ssd/data/Workdir/survival/venv/lib/python3.8/site-packages/sksurv/ensemble/boosting.py:955: RuntimeWarning: divide by zero encountered in log
  time = numpy.log(time)
/media/san2_ssd/data/Workdir/survival/venv/lib/python3.8/site-packages/sksurv/ensemble/boosting.py:955: RuntimeWarning: divide by zero encountered in log
  time = numpy.log(time)
/media/san2_ssd/data/Workdir/survival/venv/lib/python3.8/site-packages/sksurv/ensemble/boosting.py:955: RuntimeWarning: divide by zero encountered in log
  time = numpy.log(time)
/media/san2_ssd/data/Workdir/survival/venv/lib/python3.8/site-packages/sksurv/ensemble/boosting.py:955: RuntimeWarning: divide by zero encountered in log
  time = numpy.log(time)
[32m[I 2022-04-21 14:33:25,668][0m Trial 179 finished with value: -0.4630834312745124 and parameters: {'loss': 'squared', 'learning_rate': 0.0008173432759962117, 'n_estimators': 100, 'criterion': 'friedman_mse', 'min_samples_split': 4, 'min_samples_leaf': 1, 'min_weight_fraction_leaf': 0.1277636006676385, 'min_impurity_decrease': 0.5197120722174254, 'max_features': 0.8670435738266615, 'subsample': 0.15321144890421617, 'dropout_rate': 0.8491379947547938, 'ccp_alpha': 0.12371882163233774}. Best is trial 174 with value: 0.824528057483301.[0m
[32m[I 2022-04-21 14:33:31,845][0m Trial 180 finished with value: 0.8058586558597873 and parameters: {'loss': 'coxph', 'learning_rate': 0.0004969308395045257, 'n_estimators': 105, 'criterion': 'friedman_mse', 'min_samples_split': 3, 'min_samples_leaf': 1, 'min_weight_fraction_leaf': 0.11337842391033728, 'min_impurity_decrease': 0.48863738749166613, 'max_features': 0.8272403066266893, 'subsample': 0.11672804164484656, 'dropout_rate': 0.7550751287859788, 'ccp_alpha': 0.27542416959001736}. Best is trial 174 with value: 0.824528057483301.[0m
