[32m[I 2022-04-22 11:29:11,382][0m Trial 927 finished with value: 0.8048976296177237 and parameters: {'loss': 'coxph', 'learning_rate': 0.0018682088298486324, 'n_estimators': 927, 'criterion': 'friedman_mse', 'min_samples_split': 2, 'min_samples_leaf': 6, 'min_weight_fraction_leaf': 0.0012694750289730843, 'min_impurity_decrease': 0.9819013240786547, 'max_features': 0.2852000617850226, 'subsample': 0.25133640881146546, 'dropout_rate': 0.41325083560189735, 'ccp_alpha': 0.18462767910931496}. Best is trial 867 with value: 0.8349451173694054.[0m
[32m[I 2022-04-22 11:32:05,731][0m Trial 928 finished with value: 0.25 and parameters: {'loss': 'coxph', 'learning_rate': 0.0030352820430108135, 'n_estimators': 834, 'criterion': 'friedman_mse', 'min_samples_split': 2, 'min_samples_leaf': 6, 'min_weight_fraction_leaf': 0.023199265009136577, 'min_impurity_decrease': 0.9998759028570927, 'max_features': 0.26819662469147615, 'subsample': 0.30092242820907983, 'dropout_rate': 0.18999877600942633, 'ccp_alpha': 4.896399865626092}. Best is trial 867 with value: 0.8349451173694054.[0m
[32m[I 2022-04-22 11:33:57,335][0m Trial 929 finished with value: 0.716295499893087 and parameters: {'loss': 'coxph', 'learning_rate': 0.0022982624444491027, 'n_estimators': 902, 'criterion': 'friedman_mse', 'min_samples_split': 2, 'min_samples_leaf': 6, 'min_weight_fraction_leaf': 0.03317115822968208, 'min_impurity_decrease': 0.9635187830660609, 'max_features': 0.2352276222138348, 'subsample': 0.7263342077819168, 'dropout_rate': 0.5705719500422519, 'ccp_alpha': 0.08522785201838831}. Best is trial 867 with value: 0.8349451173694054.[0m
[32m[I 2022-04-22 11:37:44,471][0m Trial 930 finished with value: 0.25 and parameters: {'loss': 'coxph', 'learning_rate': 0.0015846162082259149, 'n_estimators': 954, 'criterion': 'absolute_error', 'min_samples_split': 2, 'min_samples_leaf': 6, 'min_weight_fraction_leaf': 0.015528404062040167, 'min_impurity_decrease': 0.1067627194546023, 'max_features': 0.1980519802270757, 'subsample': 0.5982684556609, 'dropout_rate': 0.15087007630531774, 'ccp_alpha': 0.45011036403657506}. Best is trial 867 with value: 0.8349451173694054.[0m
[32m[I 2022-04-22 11:41:28,305][0m Trial 931 finished with value: 0.25 and parameters: {'loss': 'coxph', 'learning_rate': 0.003272320281709925, 'n_estimators': 997, 'criterion': 'squared_error', 'min_samples_split': 2, 'min_samples_leaf': 6, 'min_weight_fraction_leaf': 0.040318800723551464, 'min_impurity_decrease': 0.9366082302213748, 'max_features': 0.3033509329373491, 'subsample': 0.2779501263943054, 'dropout_rate': 0.24535571787178012, 'ccp_alpha': 0.004513087286271761}. Best is trial 867 with value: 0.8349451173694054.[0m
[32m[I 2022-04-22 11:44:37,213][0m Trial 932 finished with value: 0.2503270102305002 and parameters: {'loss': 'coxph', 'learning_rate': 0.0013266788869827509, 'n_estimators': 862, 'criterion': 'friedman_mse', 'min_samples_split': 2, 'min_samples_leaf': 6, 'min_weight_fraction_leaf': 0.010511781747799216, 'min_impurity_decrease': 0.9695120641828546, 'max_features': 0.16877076294635668, 'subsample': 0.3169242207880745, 'dropout_rate': 0.19910752273204063, 'ccp_alpha': 0.2970776143152168}. Best is trial 867 with value: 0.8349451173694054.[0m
[32m[I 2022-04-22 11:48:27,834][0m Trial 933 finished with value: 0.8332327989456013 and parameters: {'loss': 'coxph', 'learning_rate': 0.0024602104410021185, 'n_estimators': 919, 'criterion': 'friedman_mse', 'min_samples_split': 2, 'min_samples_leaf': 6, 'min_weight_fraction_leaf': 0.025899038102227278, 'min_impurity_decrease': 0.9513137747701804, 'max_features': 0.2740462259248569, 'subsample': 0.3199186160791693, 'dropout_rate': 0.1682094693547792, 'ccp_alpha': 0.0021595964461898955}. Best is trial 867 with value: 0.8349451173694054.[0m
[32m[I 2022-04-22 11:52:43,676][0m Trial 934 finished with value: 0.8114796254232484 and parameters: {'loss': 'coxph', 'learning_rate': 0.001994993846337242, 'n_estimators': 1000, 'criterion': 'friedman_mse', 'min_samples_split': 2, 'min_samples_leaf': 6, 'min_weight_fraction_leaf': 0.03116156338823714, 'min_impurity_decrease': 0.9135038704687994, 'max_features': 0.2648085709624863, 'subsample': 0.3263172136272986, 'dropout_rate': 0.12076602823329148, 'ccp_alpha': 0.17702607409273996}. Best is trial 867 with value: 0.8349451173694054.[0m
[32m[I 2022-04-22 11:55:17,696][0m Trial 935 finished with value: 0.8262286283584487 and parameters: {'loss': 'coxph', 'learning_rate': 0.0025562720274912203, 'n_estimators': 806, 'criterion': 'friedman_mse', 'min_samples_split': 2, 'min_samples_leaf': 6, 'min_weight_fraction_leaf': 0.042609674918294954, 'min_impurity_decrease': 0.9284120439735569, 'max_features': 0.2524231238650665, 'subsample': 0.29317475078371935, 'dropout_rate': 0.2169273179846941, 'ccp_alpha': 0.11044426109784822}. Best is trial 867 with value: 0.8349451173694054.[0m
[32m[I 2022-04-22 11:58:59,461][0m Trial 936 finished with value: 0.3725982449765577 and parameters: {'loss': 'coxph', 'learning_rate': 0.002443758299997718, 'n_estimators': 937, 'criterion': 'friedman_mse', 'min_samples_split': 2, 'min_samples_leaf': 6, 'min_weight_fraction_leaf': 0.027076297914525732, 'min_impurity_decrease': 0.9487963335784312, 'max_features': 0.2796317629004072, 'subsample': 0.3292513372940281, 'dropout_rate': 0.15701415590742113, 'ccp_alpha': 0.2473738272013287}. Best is trial 867 with value: 0.8349451173694054.[0m
[32m[I 2022-04-22 12:01:56,094][0m Trial 937 finished with value: 0.8251380444048404 and parameters: {'loss': 'coxph', 'learning_rate': 0.003218990973607058, 'n_estimators': 881, 'criterion': 'friedman_mse', 'min_samples_split': 2, 'min_samples_leaf': 6, 'min_weight_fraction_leaf': 0.021784495648778046, 'min_impurity_decrease': 0.9540225119830372, 'max_features': 0.2360522648685192, 'subsample': 0.26740741143555236, 'dropout_rate': 0.25509650575229215, 'ccp_alpha': 0.08869760087382993}. Best is trial 867 with value: 0.8349451173694054.[0m
[32m[I 2022-04-22 12:05:39,936][0m Trial 938 finished with value: 0.8326335287772494 and parameters: {'loss': 'coxph', 'learning_rate': 0.0019273263824510624, 'n_estimators': 938, 'criterion': 'friedman_mse', 'min_samples_split': 2, 'min_samples_leaf': 6, 'min_weight_fraction_leaf': 0.03939371444502297, 'min_impurity_decrease': 0.9247332968158, 'max_features': 0.27664214390533, 'subsample': 0.3203599595387924, 'dropout_rate': 0.21199593441825537, 'ccp_alpha': 0.005958914291833515}. Best is trial 867 with value: 0.8349451173694054.[0m
[32m[I 2022-04-22 12:08:30,635][0m Trial 939 finished with value: 0.7146296543683444 and parameters: {'loss': 'coxph', 'learning_rate': 0.0025971898229286846, 'n_estimators': 844, 'criterion': 'friedman_mse', 'min_samples_split': 2, 'min_samples_leaf': 6, 'min_weight_fraction_leaf': 0.04213424240134958, 'min_impurity_decrease': 0.9183675382071589, 'max_features': 0.25780537046185215, 'subsample': 0.301974809491516, 'dropout_rate': 0.20783196206381552, 'ccp_alpha': 0.17459272804189785}. Best is trial 867 with value: 0.8349451173694054.[0m
[32m[I 2022-04-22 12:11:31,476][0m Trial 940 finished with value: 0.2503270102305002 and parameters: {'loss': 'coxph', 'learning_rate': 0.0029777285285572308, 'n_estimators': 895, 'criterion': 'friedman_mse', 'min_samples_split': 8, 'min_samples_leaf': 6, 'min_weight_fraction_leaf': 0.04229171036282282, 'min_impurity_decrease': 0.9249935878535473, 'max_features': 0.21784056369600005, 'subsample': 0.28261775014733614, 'dropout_rate': 0.23468761257347195, 'ccp_alpha': 0.36112288877337373}. Best is trial 867 with value: 0.8349451173694054.[0m
[32m[I 2022-04-22 12:14:26,855][0m Trial 941 finished with value: 0.8306192017687263 and parameters: {'loss': 'coxph', 'learning_rate': 0.0021357099461158523, 'n_estimators': 810, 'criterion': 'friedman_mse', 'min_samples_split': 2, 'min_samples_leaf': 6, 'min_weight_fraction_leaf': 0.04259274196254103, 'min_impurity_decrease': 0.9091783773602865, 'max_features': 0.2764628986926314, 'subsample': 0.3173677078238181, 'dropout_rate': 0.18880096034437063, 'ccp_alpha': 0.0022504586420234144}. Best is trial 867 with value: 0.8349451173694054.[0m
[32m[I 2022-04-22 12:17:14,652][0m Trial 942 finished with value: 0.8140807973224906 and parameters: {'loss': 'coxph', 'learning_rate': 0.001675375028338336, 'n_estimators': 858, 'criterion': 'friedman_mse', 'min_samples_split': 2, 'min_samples_leaf': 6, 'min_weight_fraction_leaf': 0.0330329874367393, 'min_impurity_decrease': 0.9077469606601296, 'max_features': 0.2542391057491021, 'subsample': 0.29554493118706576, 'dropout_rate': 0.2245563461578906, 'ccp_alpha': 0.15505936571687443}. Best is trial 867 with value: 0.8349451173694054.[0m
/media/san2_ssd/data/Workdir/survival/venv/lib/python3.8/site-packages/sksurv/ensemble/boosting.py:955: RuntimeWarning: divide by zero encountered in log
  time = numpy.log(time)
/media/san2_ssd/data/Workdir/survival/venv/lib/python3.8/site-packages/sksurv/ensemble/boosting.py:955: RuntimeWarning: divide by zero encountered in log
  time = numpy.log(time)
/media/san2_ssd/data/Workdir/survival/venv/lib/python3.8/site-packages/sksurv/ensemble/boosting.py:955: RuntimeWarning: divide by zero encountered in log
  time = numpy.log(time)
/media/san2_ssd/data/Workdir/survival/venv/lib/python3.8/site-packages/sksurv/ensemble/boosting.py:955: RuntimeWarning: divide by zero encountered in log
  time = numpy.log(time)
[32m[I 2022-04-22 12:17:56,534][0m Trial 943 finished with value: -0.466418056911606 and parameters: {'loss': 'squared', 'learning_rate': 0.0031650505768683486, 'n_estimators': 917, 'criterion': 'friedman_mse', 'min_samples_split': 10, 'min_samples_leaf': 6, 'min_weight_fraction_leaf': 0.032130705991601324, 'min_impurity_decrease': 0.9326104953275792, 'max_features': 0.23586394117083403, 'subsample': 0.2491100915717488, 'dropout_rate': 0.16804999068175827, 'ccp_alpha': 0.0017450773631545347}. Best is trial 867 with value: 0.8349451173694054.[0m
[32m[I 2022-04-22 12:21:05,816][0m Trial 944 finished with value: 0.8263919321825792 and parameters: {'loss': 'coxph', 'learning_rate': 0.002519258209711949, 'n_estimators': 884, 'criterion': 'friedman_mse', 'min_samples_split': 2, 'min_samples_leaf': 6, 'min_weight_fraction_leaf': 0.042963380079240276, 'min_impurity_decrease': 0.9437935047968038, 'max_features': 0.27571542726515136, 'subsample': 0.3209076337020976, 'dropout_rate': 0.20736117554590947, 'ccp_alpha': 0.0978340682823377}. Best is trial 867 with value: 0.8349451173694054.[0m
[32m[I 2022-04-22 12:24:29,913][0m Trial 945 finished with value: 0.37338275544188104 and parameters: {'loss': 'coxph', 'learning_rate': 0.0012260508717888293, 'n_estimators': 943, 'criterion': 'friedman_mse', 'min_samples_split': 2, 'min_samples_leaf': 7, 'min_weight_fraction_leaf': 0.02865312732271024, 'min_impurity_decrease': 0.9480985647245957, 'max_features': 0.26961117590334155, 'subsample': 0.2821889675295376, 'dropout_rate': 0.24305333277004854, 'ccp_alpha': 0.25391388050815283}. Best is trial 867 with value: 0.8349451173694054.[0m
[32m[I 2022-04-22 12:27:02,970][0m Trial 946 finished with value: 0.25 and parameters: {'loss': 'coxph', 'learning_rate': 0.00334735833005927, 'n_estimators': 832, 'criterion': 'friedman_mse', 'min_samples_split': 2, 'min_samples_leaf': 6, 'min_weight_fraction_leaf': 0.023848229375856907, 'min_impurity_decrease': 0.9146139207393079, 'max_features': 0.24366460805203077, 'subsample': 0.3070637530248898, 'dropout_rate': 0.2691497231793966, 'ccp_alpha': 3.90958862461345}. Best is trial 867 with value: 0.8349451173694054.[0m
[32m[I 2022-04-22 12:30:21,068][0m Trial 947 finished with value: 0.8273248094353669 and parameters: {'loss': 'coxph', 'learning_rate': 0.0020205735509706006, 'n_estimators': 915, 'criterion': 'friedman_mse', 'min_samples_split': 2, 'min_samples_leaf': 7, 'min_weight_fraction_leaf': 0.03569979395305044, 'min_impurity_decrease': 0.9580353524683937, 'max_features': 0.28647310761942213, 'subsample': 0.2660125274595919, 'dropout_rate': 0.18467536342529622, 'ccp_alpha': 0.08880459508044797}. Best is trial 867 with value: 0.8349451173694054.[0m
[32m[I 2022-04-22 12:33:36,428][0m Trial 948 finished with value: 0.8102556336381657 and parameters: {'loss': 'coxph', 'learning_rate': 0.0034271126607015303, 'n_estimators': 867, 'criterion': 'friedman_mse', 'min_samples_split': 2, 'min_samples_leaf': 6, 'min_weight_fraction_leaf': 0.01767384789125358, 'min_impurity_decrease': 0.9358033547149519, 'max_features': 0.2157185645736977, 'subsample': 0.3240769091821711, 'dropout_rate': 0.13772387079977055, 'ccp_alpha': 0.16071321376901143}. Best is trial 867 with value: 0.8349451173694054.[0m
[32m[I 2022-04-22 12:37:21,420][0m Trial 949 finished with value: 0.8319957302213172 and parameters: {'loss': 'coxph', 'learning_rate': 0.0016229298335479364, 'n_estimators': 938, 'criterion': 'friedman_mse', 'min_samples_split': 2, 'min_samples_leaf': 6, 'min_weight_fraction_leaf': 0.028195168899440924, 'min_impurity_decrease': 0.9585998655540376, 'max_features': 0.19209858443912653, 'subsample': 0.3373146622353929, 'dropout_rate': 0.21264036976603123, 'ccp_alpha': 0.004005994373116257}. Best is trial 867 with value: 0.8349451173694054.[0m
[32m[I 2022-04-22 12:41:25,690][0m Trial 950 finished with value: 0.8278375389611714 and parameters: {'loss': 'coxph', 'learning_rate': 0.0014455690439979698, 'n_estimators': 951, 'criterion': 'friedman_mse', 'min_samples_split': 7, 'min_samples_leaf': 6, 'min_weight_fraction_leaf': 0.040455765464992494, 'min_impurity_decrease': 0.918408788506215, 'max_features': 0.18404357438486788, 'subsample': 0.22498362806644256, 'dropout_rate': 0.0662904207132172, 'ccp_alpha': 0.09278362896126359}. Best is trial 867 with value: 0.8349451173694054.[0m
[32m[I 2022-04-22 12:45:00,830][0m Trial 951 finished with value: 0.25 and parameters: {'loss': 'coxph', 'learning_rate': 0.0010075048806580933, 'n_estimators': 955, 'criterion': 'squared_error', 'min_samples_split': 2, 'min_samples_leaf': 6, 'min_weight_fraction_leaf': 0.030924223280894555, 'min_impurity_decrease': 0.9369053508230957, 'max_features': 0.17407357597906403, 'subsample': 0.293412759566191, 'dropout_rate': 0.20224889075139574, 'ccp_alpha': 2.1571669210288924}. Best is trial 867 with value: 0.8349451173694054.[0m
[32m[I 2022-04-22 12:48:31,833][0m Trial 952 finished with value: 0.2632428104530722 and parameters: {'loss': 'coxph', 'learning_rate': 0.0016756883108560198, 'n_estimators': 962, 'criterion': 'friedman_mse', 'min_samples_split': 2, 'min_samples_leaf': 6, 'min_weight_fraction_leaf': 0.04407179977583257, 'min_impurity_decrease': 0.7802533173464882, 'max_features': 0.16199447346634274, 'subsample': 0.3430428972283484, 'dropout_rate': 0.2200395626321592, 'ccp_alpha': 0.24560443137324495}. Best is trial 867 with value: 0.8349451173694054.[0m
[32m[I 2022-04-22 12:52:07,416][0m Trial 953 finished with value: 0.832494184104792 and parameters: {'loss': 'coxph', 'learning_rate': 0.0007626022860353494, 'n_estimators': 921, 'criterion': 'friedman_mse', 'min_samples_split': 2, 'min_samples_leaf': 6, 'min_weight_fraction_leaf': 0.031285090641601614, 'min_impurity_decrease': 0.9576708028121067, 'max_features': 0.1953362561939135, 'subsample': 0.31995874162488025, 'dropout_rate': 0.1657939880061583, 'ccp_alpha': 0.0016420911331581967}. Best is trial 867 with value: 0.8349451173694054.[0m
[32m[I 2022-04-22 12:55:34,476][0m Trial 954 finished with value: 0.25 and parameters: {'loss': 'coxph', 'learning_rate': 0.0010217158306557107, 'n_estimators': 931, 'criterion': 'absolute_error', 'min_samples_split': 2, 'min_samples_leaf': 6, 'min_weight_fraction_leaf': 0.0431443979521284, 'min_impurity_decrease': 0.9519025105948549, 'max_features': 0.1988634549734373, 'subsample': 0.30624923275594723, 'dropout_rate': 0.1635441273386947, 'ccp_alpha': 0.16500103952629164}. Best is trial 867 with value: 0.8349451173694054.[0m
[32m[I 2022-04-22 12:59:27,777][0m Trial 955 finished with value: 0.8282458990105784 and parameters: {'loss': 'coxph', 'learning_rate': 0.0007388144258666928, 'n_estimators': 959, 'criterion': 'friedman_mse', 'min_samples_split': 2, 'min_samples_leaf': 6, 'min_weight_fraction_leaf': 0.03473049835989698, 'min_impurity_decrease': 0.9621350953868765, 'max_features': 0.1490898665480987, 'subsample': 0.2752010584998218, 'dropout_rate': 0.10905440639902007, 'ccp_alpha': 0.09099807539578836}. Best is trial 867 with value: 0.8349451173694054.[0m
[32m[I 2022-04-22 13:03:02,000][0m Trial 956 finished with value: 0.2503270102305002 and parameters: {'loss': 'coxph', 'learning_rate': 0.0009559511755831434, 'n_estimators': 907, 'criterion': 'friedman_mse', 'min_samples_split': 2, 'min_samples_leaf': 6, 'min_weight_fraction_leaf': 0.04395742162067368, 'min_impurity_decrease': 0.9336254661363197, 'max_features': 0.13558672340132708, 'subsample': 0.2481461238925466, 'dropout_rate': 0.1428457771201006, 'ccp_alpha': 0.348608788560342}. Best is trial 867 with value: 0.8349451173694054.[0m
[32m[I 2022-04-22 13:06:50,301][0m Trial 957 finished with value: 0.25 and parameters: {'loss': 'coxph', 'learning_rate': 0.0006771299122513251, 'n_estimators': 959, 'criterion': 'friedman_mse', 'min_samples_split': 2, 'min_samples_leaf': 6, 'min_weight_fraction_leaf': 0.030282344178150115, 'min_impurity_decrease': 0.9627881798640209, 'max_features': 0.16626632613092232, 'subsample': 0.3123185823923047, 'dropout_rate': 0.1861104013553599, 'ccp_alpha': 2.698067214006194}. Best is trial 867 with value: 0.8349451173694054.[0m
[32m[I 2022-04-22 13:10:07,754][0m Trial 958 finished with value: 0.8246280163708363 and parameters: {'loss': 'coxph', 'learning_rate': 0.000759894212098374, 'n_estimators': 889, 'criterion': 'friedman_mse', 'min_samples_split': 2, 'min_samples_leaf': 6, 'min_weight_fraction_leaf': 0.032509357436497105, 'min_impurity_decrease': 0.9476947078546166, 'max_features': 0.19681962275440032, 'subsample': 0.28644565805428834, 'dropout_rate': 0.16889502906773757, 'ccp_alpha': 0.09570348661306319}. Best is trial 867 with value: 0.8349451173694054.[0m
[32m[I 2022-04-22 13:13:41,169][0m Trial 959 finished with value: 0.36878824512533914 and parameters: {'loss': 'coxph', 'learning_rate': 0.0008702427138690199, 'n_estimators': 936, 'criterion': 'friedman_mse', 'min_samples_split': 2, 'min_samples_leaf': 6, 'min_weight_fraction_leaf': 0.025517637262766825, 'min_impurity_decrease': 0.9667707428992722, 'max_features': 0.1867034165890406, 'subsample': 0.3237805174588825, 'dropout_rate': 0.19768320635078376, 'ccp_alpha': 0.2404859680702987}. Best is trial 867 with value: 0.8349451173694054.[0m
[32m[I 2022-04-22 13:17:19,497][0m Trial 960 finished with value: 0.8280053641268832 and parameters: {'loss': 'coxph', 'learning_rate': 0.001260076773076429, 'n_estimators': 917, 'criterion': 'friedman_mse', 'min_samples_split': 2, 'min_samples_leaf': 7, 'min_weight_fraction_leaf': 0.03684431645488309, 'min_impurity_decrease': 0.9050963884422946, 'max_features': 0.18046929445796195, 'subsample': 0.3450704319255645, 'dropout_rate': 0.15709292736558753, 'ccp_alpha': 0.08710022731832377}. Best is trial 867 with value: 0.8349451173694054.[0m
/media/san2_ssd/data/Workdir/survival/venv/lib/python3.8/site-packages/sksurv/ensemble/boosting.py:955: RuntimeWarning: divide by zero encountered in log
  time = numpy.log(time)
/media/san2_ssd/data/Workdir/survival/venv/lib/python3.8/site-packages/sksurv/ensemble/boosting.py:955: RuntimeWarning: divide by zero encountered in log
  time = numpy.log(time)
/media/san2_ssd/data/Workdir/survival/venv/lib/python3.8/site-packages/sksurv/ensemble/boosting.py:955: RuntimeWarning: divide by zero encountered in log
  time = numpy.log(time)
/media/san2_ssd/data/Workdir/survival/venv/lib/python3.8/site-packages/sksurv/ensemble/boosting.py:955: RuntimeWarning: divide by zero encountered in log
  time = numpy.log(time)
[32m[I 2022-04-22 13:17:27,322][0m Trial 961 finished with value: -0.46553337277041873 and parameters: {'loss': 'squared', 'learning_rate': 0.001189115001276942, 'n_estimators': 406, 'criterion': 'friedman_mse', 'min_samples_split': 2, 'min_samples_leaf': 6, 'min_weight_fraction_leaf': 0.044550026767121984, 'min_impurity_decrease': 0.9358328104625954, 'max_features': 0.15059885784811508, 'subsample': 0.30143381552367404, 'dropout_rate': 0.1787954061542419, 'ccp_alpha': 0.18385337503091184}. Best is trial 867 with value: 0.8349451173694054.[0m
[32m[I 2022-04-22 13:21:03,410][0m Trial 962 finished with value: 0.8266537960700436 and parameters: {'loss': 'coxph', 'learning_rate': 0.0012939343000615315, 'n_estimators': 962, 'criterion': 'friedman_mse', 'min_samples_split': 2, 'min_samples_leaf': 6, 'min_weight_fraction_leaf': 0.02455024723727807, 'min_impurity_decrease': 0.9809493838809741, 'max_features': 0.21337179530190037, 'subsample': 0.2600953846138492, 'dropout_rate': 0.21237123258071816, 'ccp_alpha': 0.08484125535032}. Best is trial 867 with value: 0.8349451173694054.[0m
[32m[I 2022-04-22 13:24:32,714][0m Trial 963 finished with value: 0.8311191588522554 and parameters: {'loss': 'coxph', 'learning_rate': 0.0006170010995262264, 'n_estimators': 876, 'criterion': 'friedman_mse', 'min_samples_split': 2, 'min_samples_leaf': 7, 'min_weight_fraction_leaf': 0.022061991551033507, 'min_impurity_decrease': 0.9606074825494073, 'max_features': 0.19587901158981544, 'subsample': 0.34018338176196133, 'dropout_rate': 0.13102846749365982, 'ccp_alpha': 0.0034790805575422917}. Best is trial 867 with value: 0.8349451173694054.[0m
