[32m[I 2022-04-21 18:53:23,074][0m Trial 588 finished with value: 0.8463296705813915 and parameters: {'loss': 'coxph', 'learning_rate': 0.0006345367230793447, 'n_estimators': 348, 'criterion': 'friedman_mse', 'min_samples_split': 3, 'min_samples_leaf': 1, 'min_weight_fraction_leaf': 0.15164786263210678, 'min_impurity_decrease': 0.2357517368088124, 'max_features': 0.39088355467306285, 'subsample': 0.10171234336430432, 'dropout_rate': 0.15555293789158006, 'ccp_alpha': 0.1526287031163115}. Best is trial 583 with value: 0.8480221917497749.[0m
[32m[I 2022-04-21 18:53:49,405][0m Trial 589 finished with value: 0.8468952242661757 and parameters: {'loss': 'coxph', 'learning_rate': 0.0007734943955635776, 'n_estimators': 346, 'criterion': 'friedman_mse', 'min_samples_split': 3, 'min_samples_leaf': 1, 'min_weight_fraction_leaf': 0.1458716443999524, 'min_impurity_decrease': 0.2147053038490236, 'max_features': 0.3866576138151264, 'subsample': 0.06436385094765804, 'dropout_rate': 0.15265495498566561, 'ccp_alpha': 0.16593801806316633}. Best is trial 583 with value: 0.8480221917497749.[0m
[32m[I 2022-04-21 18:54:30,172][0m Trial 590 finished with value: 0.846237506602025 and parameters: {'loss': 'coxph', 'learning_rate': 0.0005812498028761667, 'n_estimators': 374, 'criterion': 'friedman_mse', 'min_samples_split': 3, 'min_samples_leaf': 1, 'min_weight_fraction_leaf': 0.13863134156075155, 'min_impurity_decrease': 0.18322733344672343, 'max_features': 0.3769559886557563, 'subsample': 0.044626437244595266, 'dropout_rate': 0.12677697118060913, 'ccp_alpha': 0.17412285891461912}. Best is trial 583 with value: 0.8480221917497749.[0m
[32m[I 2022-04-21 18:55:04,078][0m Trial 591 finished with value: 0.8441343665975666 and parameters: {'loss': 'coxph', 'learning_rate': 0.000723842862791858, 'n_estimators': 377, 'criterion': 'friedman_mse', 'min_samples_split': 3, 'min_samples_leaf': 1, 'min_weight_fraction_leaf': 0.1345784709053157, 'min_impurity_decrease': 0.19716609811063424, 'max_features': 0.38867743464513016, 'subsample': 0.03729306623242968, 'dropout_rate': 0.148868582520709, 'ccp_alpha': 0.33099962774281844}. Best is trial 583 with value: 0.8480221917497749.[0m
[32m[I 2022-04-21 18:55:32,303][0m Trial 592 finished with value: 0.8367284421683335 and parameters: {'loss': 'coxph', 'learning_rate': 0.0006486739140340328, 'n_estimators': 351, 'criterion': 'absolute_error', 'min_samples_split': 3, 'min_samples_leaf': 1, 'min_weight_fraction_leaf': 0.14137043867119417, 'min_impurity_decrease': 0.15806224550462528, 'max_features': 0.38119465496003724, 'subsample': 0.04207766716815926, 'dropout_rate': 0.1259552497986362, 'ccp_alpha': 0.4400787742849191}. Best is trial 583 with value: 0.8480221917497749.[0m
[32m[I 2022-04-21 18:56:02,894][0m Trial 593 finished with value: 0.7326087693520382 and parameters: {'loss': 'coxph', 'learning_rate': 0.0008005774399189038, 'n_estimators': 390, 'criterion': 'friedman_mse', 'min_samples_split': 3, 'min_samples_leaf': 1, 'min_weight_fraction_leaf': 0.14079199832661377, 'min_impurity_decrease': 0.178615535358978, 'max_features': 0.3731729991756655, 'subsample': 0.25505367036632076, 'dropout_rate': 0.09665314650682569, 'ccp_alpha': 0.2714050320783995}. Best is trial 583 with value: 0.8480221917497749.[0m
/media/san2_ssd/data/Workdir/survival/venv/lib/python3.8/site-packages/sksurv/ensemble/boosting.py:955: RuntimeWarning: divide by zero encountered in log
  time = numpy.log(time)
/media/san2_ssd/data/Workdir/survival/venv/lib/python3.8/site-packages/sksurv/ensemble/boosting.py:955: RuntimeWarning: divide by zero encountered in log
  time = numpy.log(time)
/media/san2_ssd/data/Workdir/survival/venv/lib/python3.8/site-packages/sksurv/ensemble/boosting.py:955: RuntimeWarning: divide by zero encountered in log
  time = numpy.log(time)
/media/san2_ssd/data/Workdir/survival/venv/lib/python3.8/site-packages/sksurv/ensemble/boosting.py:955: RuntimeWarning: divide by zero encountered in log
  time = numpy.log(time)
[32m[I 2022-04-21 18:56:11,069][0m Trial 594 finished with value: -0.45 and parameters: {'loss': 'squared', 'learning_rate': 0.000534672038186962, 'n_estimators': 362, 'criterion': 'friedman_mse', 'min_samples_split': 3, 'min_samples_leaf': 1, 'min_weight_fraction_leaf': 0.14588617016830907, 'min_impurity_decrease': 0.1921297195683621, 'max_features': 0.3510495656521763, 'subsample': 0.015608923008068355, 'dropout_rate': 0.151317756561818, 'ccp_alpha': 0.21471784647277203}. Best is trial 583 with value: 0.8480221917497749.[0m
[32m[I 2022-04-21 18:56:44,926][0m Trial 595 finished with value: 0.8441527766986372 and parameters: {'loss': 'coxph', 'learning_rate': 0.0011775004298289833, 'n_estimators': 364, 'criterion': 'friedman_mse', 'min_samples_split': 3, 'min_samples_leaf': 1, 'min_weight_fraction_leaf': 0.148280896816488, 'min_impurity_decrease': 0.21392369933061772, 'max_features': 0.3888404609887166, 'subsample': 0.05431405688289437, 'dropout_rate': 0.13055523123821233, 'ccp_alpha': 0.19049772420247835}. Best is trial 583 with value: 0.8480221917497749.[0m
[32m[I 2022-04-21 18:57:25,791][0m Trial 596 finished with value: 0.8445830867505679 and parameters: {'loss': 'coxph', 'learning_rate': 0.0005110589393910927, 'n_estimators': 380, 'criterion': 'friedman_mse', 'min_samples_split': 3, 'min_samples_leaf': 1, 'min_weight_fraction_leaf': 0.15130531474946501, 'min_impurity_decrease': 0.20913305405440194, 'max_features': 0.35914966201846565, 'subsample': 0.04020243971309058, 'dropout_rate': 0.10481796555528472, 'ccp_alpha': 0.3730168027091438}. Best is trial 583 with value: 0.8480221917497749.[0m
[32m[I 2022-04-21 18:57:53,759][0m Trial 597 finished with value: 0.8397740806212785 and parameters: {'loss': 'coxph', 'learning_rate': 0.000428611741681501, 'n_estimators': 345, 'criterion': 'friedman_mse', 'min_samples_split': 3, 'min_samples_leaf': 1, 'min_weight_fraction_leaf': 0.12973030496541754, 'min_impurity_decrease': 0.20290431818649254, 'max_features': 0.3832251922469434, 'subsample': 0.06756904619281966, 'dropout_rate': 0.15628970310760656, 'ccp_alpha': 0.5264055378146502}. Best is trial 583 with value: 0.8480221917497749.[0m
[32m[I 2022-04-21 18:58:27,782][0m Trial 598 finished with value: 0.8431140233707708 and parameters: {'loss': 'coxph', 'learning_rate': 0.000711594904319184, 'n_estimators': 347, 'criterion': 'friedman_mse', 'min_samples_split': 3, 'min_samples_leaf': 1, 'min_weight_fraction_leaf': 0.1345854921589588, 'min_impurity_decrease': 0.2266384185239606, 'max_features': 0.3406801256788521, 'subsample': 0.05927486598209168, 'dropout_rate': 0.13293368145610096, 'ccp_alpha': 0.24131231537192957}. Best is trial 583 with value: 0.8480221917497749.[0m
[32m[I 2022-04-21 18:59:07,062][0m Trial 599 finished with value: 0.65 and parameters: {'loss': 'coxph', 'learning_rate': 0.0009947990276249054, 'n_estimators': 368, 'criterion': 'friedman_mse', 'min_samples_split': 3, 'min_samples_leaf': 1, 'min_weight_fraction_leaf': 0.149103465919297, 'min_impurity_decrease': 0.15715833183821828, 'max_features': 0.3627834089929479, 'subsample': 0.0030795794285891492, 'dropout_rate': 0.11437166973662005, 'ccp_alpha': 0.15308628189443724}. Best is trial 583 with value: 0.8480221917497749.[0m
[32m[I 2022-04-21 18:59:37,443][0m Trial 600 finished with value: 0.8440817432305832 and parameters: {'loss': 'coxph', 'learning_rate': 0.0006448681531341665, 'n_estimators': 345, 'criterion': 'friedman_mse', 'min_samples_split': 3, 'min_samples_leaf': 1, 'min_weight_fraction_leaf': 0.1389654537584868, 'min_impurity_decrease': 0.18177025185753845, 'max_features': 0.39655173472919014, 'subsample': 0.02797516390534352, 'dropout_rate': 0.15904650881843155, 'ccp_alpha': 0.29608900619693423}. Best is trial 583 with value: 0.8480221917497749.[0m
[32m[I 2022-04-21 19:00:04,749][0m Trial 601 finished with value: 0.8463182777392649 and parameters: {'loss': 'coxph', 'learning_rate': 0.000468704798718172, 'n_estimators': 340, 'criterion': 'friedman_mse', 'min_samples_split': 3, 'min_samples_leaf': 1, 'min_weight_fraction_leaf': 0.15016539438205348, 'min_impurity_decrease': 0.22705199634505002, 'max_features': 0.37925712837869713, 'subsample': 0.06549919090542353, 'dropout_rate': 0.13619459910313145, 'ccp_alpha': 0.16968926875378385}. Best is trial 583 with value: 0.8480221917497749.[0m
[32m[I 2022-04-21 19:00:30,487][0m Trial 602 finished with value: 0.8457209662086 and parameters: {'loss': 'coxph', 'learning_rate': 0.00046478113058822767, 'n_estimators': 353, 'criterion': 'friedman_mse', 'min_samples_split': 3, 'min_samples_leaf': 1, 'min_weight_fraction_leaf': 0.1264022010813053, 'min_impurity_decrease': 0.2279295990818881, 'max_features': 0.3809205725831131, 'subsample': 0.043096584060908036, 'dropout_rate': 0.14287957542087204, 'ccp_alpha': 0.1852149688389714}. Best is trial 583 with value: 0.8480221917497749.[0m
[32m[I 2022-04-21 19:01:01,704][0m Trial 603 finished with value: 0.8454578382458514 and parameters: {'loss': 'coxph', 'learning_rate': 0.00038379385621919657, 'n_estimators': 373, 'criterion': 'friedman_mse', 'min_samples_split': 3, 'min_samples_leaf': 1, 'min_weight_fraction_leaf': 0.14703821751928617, 'min_impurity_decrease': 0.23568536052861705, 'max_features': 0.4038405689805337, 'subsample': 0.06173476243464871, 'dropout_rate': 0.16474919351667794, 'ccp_alpha': 0.13605684335970147}. Best is trial 583 with value: 0.8480221917497749.[0m
[32m[I 2022-04-21 19:01:45,116][0m Trial 604 finished with value: 0.8459919496128006 and parameters: {'loss': 'coxph', 'learning_rate': 0.0005837427068619262, 'n_estimators': 399, 'criterion': 'friedman_mse', 'min_samples_split': 3, 'min_samples_leaf': 1, 'min_weight_fraction_leaf': 0.14066782861425556, 'min_impurity_decrease': 0.19079167637035066, 'max_features': 0.3804723010408715, 'subsample': 0.03104867908562861, 'dropout_rate': 0.14142517558621345, 'ccp_alpha': 0.32959604890417715}. Best is trial 583 with value: 0.8480221917497749.[0m
[32m[I 2022-04-21 19:02:20,857][0m Trial 605 finished with value: 0.65 and parameters: {'loss': 'coxph', 'learning_rate': 0.0005979384697338704, 'n_estimators': 402, 'criterion': 'friedman_mse', 'min_samples_split': 3, 'min_samples_leaf': 1, 'min_weight_fraction_leaf': 0.133522108587906, 'min_impurity_decrease': 0.1783500440366494, 'max_features': 0.42004782667133567, 'subsample': 0.018064465942179815, 'dropout_rate': 0.16514808687951354, 'ccp_alpha': 4.140732722990269}. Best is trial 583 with value: 0.8480221917497749.[0m
[32m[I 2022-04-21 19:02:53,655][0m Trial 606 finished with value: 0.8451728836348968 and parameters: {'loss': 'coxph', 'learning_rate': 0.0005443003258971639, 'n_estimators': 390, 'criterion': 'friedman_mse', 'min_samples_split': 3, 'min_samples_leaf': 1, 'min_weight_fraction_leaf': 0.12151709847606659, 'min_impurity_decrease': 0.1484037492435991, 'max_features': 0.39598449784842427, 'subsample': 0.030294737335707485, 'dropout_rate': 0.14391715938343963, 'ccp_alpha': 0.4382807881652582}. Best is trial 583 with value: 0.8480221917497749.[0m
[32m[I 2022-04-21 19:03:34,517][0m Trial 607 finished with value: 0.65 and parameters: {'loss': 'coxph', 'learning_rate': 0.000777657995533454, 'n_estimators': 418, 'criterion': 'friedman_mse', 'min_samples_split': 3, 'min_samples_leaf': 1, 'min_weight_fraction_leaf': 0.13749377737115465, 'min_impurity_decrease': 0.20286017736513473, 'max_features': 0.37337492266368705, 'subsample': 0.012964377239219019, 'dropout_rate': 0.16502660614734316, 'ccp_alpha': 0.36948046751942953}. Best is trial 583 with value: 0.8480221917497749.[0m
[32m[I 2022-04-21 19:03:59,928][0m Trial 608 finished with value: 0.8402247332999115 and parameters: {'loss': 'coxph', 'learning_rate': 0.00046150542019167027, 'n_estimators': 337, 'criterion': 'friedman_mse', 'min_samples_split': 3, 'min_samples_leaf': 1, 'min_weight_fraction_leaf': 0.1459570163873901, 'min_impurity_decrease': 0.21090037952070156, 'max_features': 0.407165401187304, 'subsample': 0.03741580352487022, 'dropout_rate': 0.13973621566607086, 'ccp_alpha': 0.6531113771445403}. Best is trial 583 with value: 0.8480221917497749.[0m
[32m[I 2022-04-21 19:04:26,517][0m Trial 609 finished with value: 0.65 and parameters: {'loss': 'coxph', 'learning_rate': 0.0008836319783655635, 'n_estimators': 360, 'criterion': 'friedman_mse', 'min_samples_split': 3, 'min_samples_leaf': 1, 'min_weight_fraction_leaf': 0.15094598733334894, 'min_impurity_decrease': 0.21365138292292607, 'max_features': 0.37998063382175423, 'subsample': 0.0025982666388398856, 'dropout_rate': 0.4910267968333228, 'ccp_alpha': 0.30356764986030227}. Best is trial 583 with value: 0.8480221917497749.[0m
[32m[I 2022-04-21 19:04:58,672][0m Trial 610 finished with value: 0.8451914516796218 and parameters: {'loss': 'coxph', 'learning_rate': 0.00037464790046937504, 'n_estimators': 340, 'criterion': 'squared_error', 'min_samples_split': 3, 'min_samples_leaf': 1, 'min_weight_fraction_leaf': 0.13653847053778645, 'min_impurity_decrease': 0.18713839128807097, 'max_features': 0.3923302108108594, 'subsample': 0.044287849127912324, 'dropout_rate': 0.153499027726007, 'ccp_alpha': 0.2649386131240673}. Best is trial 583 with value: 0.8480221917497749.[0m
[32m[I 2022-04-21 19:05:21,494][0m Trial 611 finished with value: 0.843358940166112 and parameters: {'loss': 'coxph', 'learning_rate': 0.0006020263845259517, 'n_estimators': 352, 'criterion': 'friedman_mse', 'min_samples_split': 3, 'min_samples_leaf': 1, 'min_weight_fraction_leaf': 0.1540305577655135, 'min_impurity_decrease': 0.16631951617376264, 'max_features': 0.4121930590307564, 'subsample': 0.05468998610416912, 'dropout_rate': 0.17440028433470584, 'ccp_alpha': 0.3887603563916886}. Best is trial 583 with value: 0.8480221917497749.[0m
[32m[I 2022-04-21 19:05:49,973][0m Trial 612 finished with value: 0.8439262184346225 and parameters: {'loss': 'coxph', 'learning_rate': 0.00070882898154186, 'n_estimators': 397, 'criterion': 'friedman_mse', 'min_samples_split': 3, 'min_samples_leaf': 1, 'min_weight_fraction_leaf': 0.12511442084922517, 'min_impurity_decrease': 0.22759893937132203, 'max_features': 0.3776600503037317, 'subsample': 0.026260343996319366, 'dropout_rate': 0.1262469036595938, 'ccp_alpha': 0.2324845422362965}. Best is trial 583 with value: 0.8480221917497749.[0m
[32m[I 2022-04-21 19:06:17,837][0m Trial 613 finished with value: 0.8395673533555318 and parameters: {'loss': 'coxph', 'learning_rate': 0.0004369816461430416, 'n_estimators': 338, 'criterion': 'friedman_mse', 'min_samples_split': 3, 'min_samples_leaf': 1, 'min_weight_fraction_leaf': 0.14605415492580057, 'min_impurity_decrease': 0.20118030612334042, 'max_features': 0.43311179172679076, 'subsample': 0.07190068080123271, 'dropout_rate': 0.13689573692796134, 'ccp_alpha': 0.5219811367522807}. Best is trial 583 with value: 0.8480221917497749.[0m
/media/san2_ssd/data/Workdir/survival/venv/lib/python3.8/site-packages/sksurv/ensemble/boosting.py:955: RuntimeWarning: divide by zero encountered in log
  time = numpy.log(time)
/media/san2_ssd/data/Workdir/survival/venv/lib/python3.8/site-packages/sksurv/ensemble/boosting.py:955: RuntimeWarning: divide by zero encountered in log
  time = numpy.log(time)
/media/san2_ssd/data/Workdir/survival/venv/lib/python3.8/site-packages/sksurv/ensemble/boosting.py:955: RuntimeWarning: divide by zero encountered in log
  time = numpy.log(time)
/media/san2_ssd/data/Workdir/survival/venv/lib/python3.8/site-packages/sksurv/ensemble/boosting.py:955: RuntimeWarning: divide by zero encountered in log
  time = numpy.log(time)
[32m[I 2022-04-21 19:06:29,810][0m Trial 614 finished with value: -0.46523562438711374 and parameters: {'loss': 'squared', 'learning_rate': 0.0003512281051315127, 'n_estimators': 376, 'criterion': 'friedman_mse', 'min_samples_split': 3, 'min_samples_leaf': 1, 'min_weight_fraction_leaf': 0.15820605341633634, 'min_impurity_decrease': 0.14458183519279544, 'max_features': 0.2315291249139812, 'subsample': 0.05084775150062082, 'dropout_rate': 0.15622563841657053, 'ccp_alpha': 0.1498150983005378}. Best is trial 583 with value: 0.8480221917497749.[0m
[32m[I 2022-04-21 19:07:01,531][0m Trial 615 finished with value: 0.8404288362826463 and parameters: {'loss': 'coxph', 'learning_rate': 0.0004675470004913324, 'n_estimators': 365, 'criterion': 'friedman_mse', 'min_samples_split': 3, 'min_samples_leaf': 1, 'min_weight_fraction_leaf': 0.1131568901353705, 'min_impurity_decrease': 0.2343440646096972, 'max_features': 0.3659758520453884, 'subsample': 0.07238461398841023, 'dropout_rate': 0.10240940971809272, 'ccp_alpha': 0.2659592416658443}. Best is trial 583 with value: 0.8480221917497749.[0m
[32m[I 2022-04-21 19:07:26,013][0m Trial 616 finished with value: 0.8439962146981831 and parameters: {'loss': 'coxph', 'learning_rate': 0.0006846294433840686, 'n_estimators': 326, 'criterion': 'absolute_error', 'min_samples_split': 3, 'min_samples_leaf': 1, 'min_weight_fraction_leaf': 0.1452261038650022, 'min_impurity_decrease': 0.18203191268339583, 'max_features': 0.42071400972568135, 'subsample': 0.029020901240079198, 'dropout_rate': 0.3527591816842193, 'ccp_alpha': 0.1581046433999235}. Best is trial 583 with value: 0.8480221917497749.[0m
[32m[I 2022-04-21 19:07:55,311][0m Trial 617 finished with value: 0.8432994244337533 and parameters: {'loss': 'coxph', 'learning_rate': 0.0008871793510645962, 'n_estimators': 379, 'criterion': 'friedman_mse', 'min_samples_split': 3, 'min_samples_leaf': 1, 'min_weight_fraction_leaf': 0.1383788631398339, 'min_impurity_decrease': 0.2163329859841675, 'max_features': 0.35498662766088135, 'subsample': 0.07561693171472421, 'dropout_rate': 0.13740029495684308, 'ccp_alpha': 0.35570832906320515}. Best is trial 583 with value: 0.8480221917497749.[0m
[32m[I 2022-04-21 19:08:02,737][0m Trial 618 finished with value: 0.8448673827213167 and parameters: {'loss': 'coxph', 'learning_rate': 0.0011963597568697987, 'n_estimators': 350, 'criterion': 'friedman_mse', 'min_samples_split': 3, 'min_samples_leaf': 1, 'min_weight_fraction_leaf': 0.1520667019880358, 'min_impurity_decrease': 0.23947216352902206, 'max_features': 0.39545965619018264, 'subsample': 0.2323357280869971, 'dropout_rate': 0.8192591853909801, 'ccp_alpha': 0.14840603644643138}. Best is trial 583 with value: 0.8480221917497749.[0m
[32m[I 2022-04-21 19:08:28,640][0m Trial 619 finished with value: 0.8457628699781393 and parameters: {'loss': 'coxph', 'learning_rate': 0.0005728997430515792, 'n_estimators': 327, 'criterion': 'friedman_mse', 'min_samples_split': 3, 'min_samples_leaf': 1, 'min_weight_fraction_leaf': 0.15759350147500492, 'min_impurity_decrease': 0.23407945935222893, 'max_features': 0.37409665673799386, 'subsample': 0.05435766078719261, 'dropout_rate': 0.16759782041217455, 'ccp_alpha': 0.08983503766979495}. Best is trial 583 with value: 0.8480221917497749.[0m
[32m[I 2022-04-21 19:09:06,150][0m Trial 620 finished with value: 0.65 and parameters: {'loss': 'coxph', 'learning_rate': 0.00041295570399530043, 'n_estimators': 435, 'criterion': 'friedman_mse', 'min_samples_split': 3, 'min_samples_leaf': 1, 'min_weight_fraction_leaf': 0.13253740001640074, 'min_impurity_decrease': 0.1944816494301222, 'max_features': 0.3486555920009133, 'subsample': 0.08696311460807282, 'dropout_rate': 0.11717561882775737, 'ccp_alpha': 2.112342912274827}. Best is trial 583 with value: 0.8480221917497749.[0m
[32m[I 2022-04-21 19:09:30,964][0m Trial 621 finished with value: 0.8444252183774619 and parameters: {'loss': 'coxph', 'learning_rate': 0.0004944598498909607, 'n_estimators': 339, 'criterion': 'friedman_mse', 'min_samples_split': 3, 'min_samples_leaf': 1, 'min_weight_fraction_leaf': 0.1235764616703674, 'min_impurity_decrease': 0.20991229596477756, 'max_features': 0.4081950467304623, 'subsample': 0.041519199650995015, 'dropout_rate': 0.14944089042504974, 'ccp_alpha': 0.2672778547076087}. Best is trial 583 with value: 0.8480221917497749.[0m
[32m[I 2022-04-21 19:10:03,738][0m Trial 622 finished with value: 0.8449049577899584 and parameters: {'loss': 'coxph', 'learning_rate': 0.0005938255691314, 'n_estimators': 366, 'criterion': 'friedman_mse', 'min_samples_split': 3, 'min_samples_leaf': 1, 'min_weight_fraction_leaf': 0.15855431793754624, 'min_impurity_decrease': 0.17457229875628844, 'max_features': 0.33490667079737096, 'subsample': 0.06701944028772404, 'dropout_rate': 0.0886143893547495, 'ccp_alpha': 0.1809082311606769}. Best is trial 583 with value: 0.8480221917497749.[0m
[32m[I 2022-04-21 19:10:21,691][0m Trial 623 finished with value: 0.8474212704655264 and parameters: {'loss': 'coxph', 'learning_rate': 0.00033616392900647006, 'n_estimators': 334, 'criterion': 'friedman_mse', 'min_samples_split': 3, 'min_samples_leaf': 1, 'min_weight_fraction_leaf': 0.14173694647471285, 'min_impurity_decrease': 0.24179001347957954, 'max_features': 0.38800576747786614, 'subsample': 0.02326994350191216, 'dropout_rate': 0.4729934344488314, 'ccp_alpha': 0.09506935046286298}. Best is trial 583 with value: 0.8480221917497749.[0m
[32m[I 2022-04-21 19:10:34,502][0m Trial 624 finished with value: 0.65 and parameters: {'loss': 'coxph', 'learning_rate': 0.0002883995018267337, 'n_estimators': 321, 'criterion': 'friedman_mse', 'min_samples_split': 3, 'min_samples_leaf': 1, 'min_weight_fraction_leaf': 0.15324436386561513, 'min_impurity_decrease': 0.2499529578321576, 'max_features': 0.4528070101610805, 'subsample': 0.004020229950010418, 'dropout_rate': 0.4962722800163042, 'ccp_alpha': 0.10031695295065024}. Best is trial 583 with value: 0.8480221917497749.[0m
