[32m[I 2022-04-21 11:40:53,905][0m Trial 749 finished with value: 0.8423527006348241 and parameters: {'alpha': 0.8647580108176577, 'ties': 'efron'}. Best is trial 13 with value: 0.8423527006348241.[0m
[32m[I 2022-04-21 11:40:54,097][0m Trial 750 finished with value: 0.8414545406933376 and parameters: {'alpha': 1.0513917500943926, 'ties': 'efron'}. Best is trial 13 with value: 0.8423527006348241.[0m
[32m[I 2022-04-21 11:40:54,382][0m Trial 751 finished with value: 0.842183674410227 and parameters: {'alpha': 0.6871372061029151, 'ties': 'breslow'}. Best is trial 13 with value: 0.8423527006348241.[0m
[32m[I 2022-04-21 11:40:54,554][0m Trial 752 finished with value: 0.8414545406933376 and parameters: {'alpha': 1.1962122558863477, 'ties': 'breslow'}. Best is trial 13 with value: 0.8423527006348241.[0m
[32m[I 2022-04-21 11:40:54,722][0m Trial 753 finished with value: 0.842183674410227 and parameters: {'alpha': 0.5826417141946836, 'ties': 'breslow'}. Best is trial 13 with value: 0.8423527006348241.[0m
[32m[I 2022-04-21 11:40:54,932][0m Trial 754 finished with value: 0.842183674410227 and parameters: {'alpha': 0.6631858119849399, 'ties': 'breslow'}. Best is trial 13 with value: 0.8423527006348241.[0m
[32m[I 2022-04-21 11:40:55,104][0m Trial 755 finished with value: 0.8423527006348241 and parameters: {'alpha': 0.7266648106890344, 'ties': 'breslow'}. Best is trial 13 with value: 0.8423527006348241.[0m
[32m[I 2022-04-21 11:40:55,281][0m Trial 756 finished with value: 0.8414545406933376 and parameters: {'alpha': 1.3818147477169256, 'ties': 'breslow'}. Best is trial 13 with value: 0.8423527006348241.[0m
[32m[I 2022-04-21 11:40:55,464][0m Trial 757 finished with value: 0.8423527006348241 and parameters: {'alpha': 0.7439870316882101, 'ties': 'breslow'}. Best is trial 13 with value: 0.8423527006348241.[0m
[32m[I 2022-04-21 11:40:55,657][0m Trial 758 finished with value: 0.8423527006348241 and parameters: {'alpha': 0.7893678208581373, 'ties': 'breslow'}. Best is trial 13 with value: 0.8423527006348241.[0m
[32m[I 2022-04-21 11:40:55,829][0m Trial 759 finished with value: 0.8414545406933376 and parameters: {'alpha': 0.8995944676516151, 'ties': 'efron'}. Best is trial 13 with value: 0.8423527006348241.[0m
[32m[I 2022-04-21 11:40:56,080][0m Trial 760 finished with value: 0.842183674410227 and parameters: {'alpha': 0.481897458466194, 'ties': 'efron'}. Best is trial 13 with value: 0.8423527006348241.[0m
[32m[I 2022-04-21 11:40:56,301][0m Trial 761 finished with value: 0.8423527006348241 and parameters: {'alpha': 0.8002823374746165, 'ties': 'breslow'}. Best is trial 13 with value: 0.8423527006348241.[0m
[32m[I 2022-04-21 11:40:56,453][0m Trial 762 finished with value: 0.8423527006348241 and parameters: {'alpha': 0.7987076572089056, 'ties': 'breslow'}. Best is trial 13 with value: 0.8423527006348241.[0m
[32m[I 2022-04-21 11:40:56,677][0m Trial 763 finished with value: 0.842183674410227 and parameters: {'alpha': 0.6286896620353746, 'ties': 'efron'}. Best is trial 13 with value: 0.8423527006348241.[0m
[32m[I 2022-04-21 11:40:56,846][0m Trial 764 finished with value: 0.8414545406933376 and parameters: {'alpha': 1.02089278302306, 'ties': 'breslow'}. Best is trial 13 with value: 0.8423527006348241.[0m
[32m[I 2022-04-21 11:40:57,018][0m Trial 765 finished with value: 0.8423527006348241 and parameters: {'alpha': 0.866174039836306, 'ties': 'breslow'}. Best is trial 13 with value: 0.8423527006348241.[0m
[32m[I 2022-04-21 11:40:57,182][0m Trial 766 finished with value: 0.8412855144687406 and parameters: {'alpha': 1.7715238323138376, 'ties': 'breslow'}. Best is trial 13 with value: 0.8423527006348241.[0m
[32m[I 2022-04-21 11:40:57,352][0m Trial 767 finished with value: 0.8414545406933376 and parameters: {'alpha': 0.8938562055439233, 'ties': 'efron'}. Best is trial 13 with value: 0.8423527006348241.[0m
[32m[I 2022-04-21 11:40:57,522][0m Trial 768 finished with value: 0.8423527006348241 and parameters: {'alpha': 0.6962690559954174, 'ties': 'efron'}. Best is trial 13 with value: 0.8423527006348241.[0m
[32m[I 2022-04-21 11:40:57,730][0m Trial 769 finished with value: 0.842183674410227 and parameters: {'alpha': 0.5411592141517058, 'ties': 'efron'}. Best is trial 13 with value: 0.8423527006348241.[0m
[32m[I 2022-04-21 11:40:57,880][0m Trial 770 finished with value: 0.8423527006348241 and parameters: {'alpha': 0.8475687815649665, 'ties': 'breslow'}. Best is trial 13 with value: 0.8423527006348241.[0m
[32m[I 2022-04-21 11:40:58,095][0m Trial 771 finished with value: 0.8423527006348241 and parameters: {'alpha': 0.8526316310014377, 'ties': 'breslow'}. Best is trial 13 with value: 0.8423527006348241.[0m
[32m[I 2022-04-21 11:40:58,329][0m Trial 772 finished with value: 0.8423527006348241 and parameters: {'alpha': 0.8156040738700339, 'ties': 'breslow'}. Best is trial 13 with value: 0.8423527006348241.[0m
[32m[I 2022-04-21 11:40:58,570][0m Trial 773 finished with value: 0.841474844739692 and parameters: {'alpha': 2.8898869520262735, 'ties': 'breslow'}. Best is trial 13 with value: 0.8423527006348241.[0m
[32m[I 2022-04-21 11:40:58,732][0m Trial 774 finished with value: 0.8423527006348241 and parameters: {'alpha': 0.7240352535090115, 'ties': 'breslow'}. Best is trial 13 with value: 0.8423527006348241.[0m
[32m[I 2022-04-21 11:40:59,006][0m Trial 775 finished with value: 0.842183674410227 and parameters: {'alpha': 0.5904568729899092, 'ties': 'breslow'}. Best is trial 13 with value: 0.8423527006348241.[0m
[32m[I 2022-04-21 11:40:59,187][0m Trial 776 finished with value: 0.842183674410227 and parameters: {'alpha': 0.6191843682681355, 'ties': 'breslow'}. Best is trial 13 with value: 0.8423527006348241.[0m
[32m[I 2022-04-21 11:40:59,429][0m Trial 777 finished with value: 0.8423527006348241 and parameters: {'alpha': 0.709760348223232, 'ties': 'breslow'}. Best is trial 13 with value: 0.8423527006348241.[0m
[32m[I 2022-04-21 11:40:59,717][0m Trial 778 finished with value: 0.841305818515095 and parameters: {'alpha': 3.1786417699147163, 'ties': 'efron'}. Best is trial 13 with value: 0.8423527006348241.[0m
[32m[I 2022-04-21 11:40:59,927][0m Trial 779 finished with value: 0.8414545406933376 and parameters: {'alpha': 0.9755891246367305, 'ties': 'efron'}. Best is trial 13 with value: 0.8423527006348241.[0m
[32m[I 2022-04-21 11:41:00,194][0m Trial 780 finished with value: 0.8414545406933376 and parameters: {'alpha': 1.1181149293707557, 'ties': 'breslow'}. Best is trial 13 with value: 0.8423527006348241.[0m
[32m[I 2022-04-21 11:41:00,395][0m Trial 781 finished with value: 0.842183674410227 and parameters: {'alpha': 0.1417613699049025, 'ties': 'efron'}. Best is trial 13 with value: 0.8423527006348241.[0m
[32m[I 2022-04-21 11:41:00,624][0m Trial 782 finished with value: 0.842183674410227 and parameters: {'alpha': 0.6356800951312294, 'ties': 'efron'}. Best is trial 13 with value: 0.8423527006348241.[0m
[32m[I 2022-04-21 11:41:00,914][0m Trial 783 finished with value: 0.8414545406933376 and parameters: {'alpha': 1.066538910425281, 'ties': 'efron'}. Best is trial 13 with value: 0.8423527006348241.[0m
[32m[I 2022-04-21 11:41:01,097][0m Trial 784 finished with value: 0.8414545406933376 and parameters: {'alpha': 0.9603837051502668, 'ties': 'efron'}. Best is trial 13 with value: 0.8423527006348241.[0m
[32m[I 2022-04-21 11:41:01,511][0m Trial 785 finished with value: 0.8414545406933376 and parameters: {'alpha': 0.9607242562732897, 'ties': 'efron'}. Best is trial 13 with value: 0.8423527006348241.[0m
[32m[I 2022-04-21 11:41:02,049][0m Trial 786 finished with value: 0.8414545406933376 and parameters: {'alpha': 1.2303031527763264, 'ties': 'efron'}. Best is trial 13 with value: 0.8423527006348241.[0m
[32m[I 2022-04-21 11:41:02,501][0m Trial 787 finished with value: 0.8414545406933376 and parameters: {'alpha': 0.9102997336257679, 'ties': 'efron'}. Best is trial 13 with value: 0.8423527006348241.[0m
[32m[I 2022-04-21 11:41:02,731][0m Trial 788 finished with value: 0.8423527006348241 and parameters: {'alpha': 0.7372572849296256, 'ties': 'efron'}. Best is trial 13 with value: 0.8423527006348241.[0m
[32m[I 2022-04-21 11:41:02,892][0m Trial 789 finished with value: 0.842183674410227 and parameters: {'alpha': 0.45206686210559927, 'ties': 'efron'}. Best is trial 13 with value: 0.8423527006348241.[0m
[32m[I 2022-04-21 11:41:03,152][0m Trial 790 finished with value: 0.8423527006348241 and parameters: {'alpha': 0.7155919405248282, 'ties': 'efron'}. Best is trial 13 with value: 0.8423527006348241.[0m
[32m[I 2022-04-21 11:41:03,510][0m Trial 791 finished with value: 0.8423527006348241 and parameters: {'alpha': 0.7740263975046062, 'ties': 'efron'}. Best is trial 13 with value: 0.8423527006348241.[0m
[32m[I 2022-04-21 11:41:03,741][0m Trial 792 finished with value: 0.8423527006348241 and parameters: {'alpha': 0.8028632816689965, 'ties': 'efron'}. Best is trial 13 with value: 0.8423527006348241.[0m
[32m[I 2022-04-21 11:41:04,149][0m Trial 793 finished with value: 0.8423527006348241 and parameters: {'alpha': 0.8298445940265072, 'ties': 'efron'}. Best is trial 13 with value: 0.8423527006348241.[0m
[32m[I 2022-04-21 11:41:04,606][0m Trial 794 finished with value: 0.8414545406933376 and parameters: {'alpha': 1.0208034685679148, 'ties': 'efron'}. Best is trial 13 with value: 0.8423527006348241.[0m
[32m[I 2022-04-21 11:41:04,912][0m Trial 795 finished with value: 0.842183674410227 and parameters: {'alpha': 0.6615514090031648, 'ties': 'efron'}. Best is trial 13 with value: 0.8423527006348241.[0m
[32m[I 2022-04-21 11:41:05,263][0m Trial 796 finished with value: 0.8405579528608467 and parameters: {'alpha': 4.816448822956172, 'ties': 'breslow'}. Best is trial 13 with value: 0.8423527006348241.[0m
[32m[I 2022-04-21 11:41:05,576][0m Trial 797 finished with value: 0.842183674410227 and parameters: {'alpha': 0.5316317308693236, 'ties': 'efron'}. Best is trial 13 with value: 0.8423527006348241.[0m
[32m[I 2022-04-21 11:41:05,861][0m Trial 798 finished with value: 0.8423527006348241 and parameters: {'alpha': 0.8489641184912802, 'ties': 'breslow'}. Best is trial 13 with value: 0.8423527006348241.[0m
[32m[I 2022-04-21 11:41:06,024][0m Trial 799 finished with value: 0.842183674410227 and parameters: {'alpha': 0.37306387955678166, 'ties': 'breslow'}. Best is trial 13 with value: 0.8423527006348241.[0m
[32m[I 2022-04-21 11:41:06,216][0m Trial 800 finished with value: 0.842183674410227 and parameters: {'alpha': 0.6931989848426136, 'ties': 'breslow'}. Best is trial 13 with value: 0.8423527006348241.[0m
[32m[I 2022-04-21 11:41:06,500][0m Trial 801 finished with value: 0.842183674410227 and parameters: {'alpha': 0.5901990547368512, 'ties': 'breslow'}. Best is trial 13 with value: 0.8423527006348241.[0m
[32m[I 2022-04-21 11:41:06,841][0m Trial 802 finished with value: 0.8423527006348241 and parameters: {'alpha': 0.9038888624954327, 'ties': 'breslow'}. Best is trial 13 with value: 0.8423527006348241.[0m
[32m[I 2022-04-21 11:41:07,314][0m Trial 803 finished with value: 0.8423527006348241 and parameters: {'alpha': 0.7477092865330209, 'ties': 'efron'}. Best is trial 13 with value: 0.8423527006348241.[0m
[32m[I 2022-04-21 11:41:07,788][0m Trial 804 finished with value: 0.8423527006348241 and parameters: {'alpha': 0.7651912372688056, 'ties': 'efron'}. Best is trial 13 with value: 0.8423527006348241.[0m
[32m[I 2022-04-21 11:41:08,186][0m Trial 805 finished with value: 0.8414545406933376 and parameters: {'alpha': 1.0441769213475531, 'ties': 'efron'}. Best is trial 13 with value: 0.8423527006348241.[0m
[32m[I 2022-04-21 11:41:08,568][0m Trial 806 finished with value: 0.842183674410227 and parameters: {'alpha': 0.6575455795382741, 'ties': 'efron'}. Best is trial 13 with value: 0.8423527006348241.[0m
[32m[I 2022-04-21 11:41:08,943][0m Trial 807 finished with value: 0.8423527006348241 and parameters: {'alpha': 0.7665390410009681, 'ties': 'efron'}. Best is trial 13 with value: 0.8423527006348241.[0m
[32m[I 2022-04-21 11:41:09,330][0m Trial 808 finished with value: 0.8414545406933376 and parameters: {'alpha': 0.9891493606347254, 'ties': 'efron'}. Best is trial 13 with value: 0.8423527006348241.[0m
[32m[I 2022-04-21 11:41:09,549][0m Trial 809 finished with value: 0.8423527006348241 and parameters: {'alpha': 0.8960344087751299, 'ties': 'breslow'}. Best is trial 13 with value: 0.8423527006348241.[0m
[32m[I 2022-04-21 11:41:09,782][0m Trial 810 finished with value: 0.8414545406933376 and parameters: {'alpha': 1.0606586119515085, 'ties': 'efron'}. Best is trial 13 with value: 0.8423527006348241.[0m
[32m[I 2022-04-21 11:41:10,015][0m Trial 811 finished with value: 0.8414545406933376 and parameters: {'alpha': 1.102348722462705, 'ties': 'efron'}. Best is trial 13 with value: 0.8423527006348241.[0m
[32m[I 2022-04-21 11:41:10,245][0m Trial 812 finished with value: 0.8414545406933376 and parameters: {'alpha': 1.149814300669632, 'ties': 'efron'}. Best is trial 13 with value: 0.8423527006348241.[0m
[32m[I 2022-04-21 11:41:10,497][0m Trial 813 finished with value: 0.8414545406933376 and parameters: {'alpha': 0.9526259243436009, 'ties': 'efron'}. Best is trial 13 with value: 0.8423527006348241.[0m
[32m[I 2022-04-21 11:41:10,786][0m Trial 814 finished with value: 0.8414545406933376 and parameters: {'alpha': 0.9164900474447729, 'ties': 'efron'}. Best is trial 13 with value: 0.8423527006348241.[0m
[32m[I 2022-04-21 11:41:11,009][0m Trial 815 finished with value: 0.8414545406933376 and parameters: {'alpha': 0.8790428531770591, 'ties': 'efron'}. Best is trial 13 with value: 0.8423527006348241.[0m
[32m[I 2022-04-21 11:41:11,244][0m Trial 816 finished with value: 0.8423527006348241 and parameters: {'alpha': 0.8490565914939566, 'ties': 'efron'}. Best is trial 13 with value: 0.8423527006348241.[0m
[32m[I 2022-04-21 11:41:11,445][0m Trial 817 finished with value: 0.842183674410227 and parameters: {'alpha': 0.5543907748714654, 'ties': 'efron'}. Best is trial 13 with value: 0.8423527006348241.[0m
[32m[I 2022-04-21 11:41:11,645][0m Trial 818 finished with value: 0.8414545406933376 and parameters: {'alpha': 0.9723701637120233, 'ties': 'efron'}. Best is trial 13 with value: 0.8423527006348241.[0m
[32m[I 2022-04-21 11:41:11,891][0m Trial 819 finished with value: 0.842183674410227 and parameters: {'alpha': 0.6537200106595654, 'ties': 'breslow'}. Best is trial 13 with value: 0.8423527006348241.[0m
[32m[I 2022-04-21 11:41:12,259][0m Trial 820 finished with value: 0.8423527006348241 and parameters: {'alpha': 0.7538021403917456, 'ties': 'breslow'}. Best is trial 13 with value: 0.8423527006348241.[0m
[32m[I 2022-04-21 11:41:12,575][0m Trial 821 finished with value: 0.8423527006348241 and parameters: {'alpha': 0.8560394886830193, 'ties': 'efron'}. Best is trial 13 with value: 0.8423527006348241.[0m
[32m[I 2022-04-21 11:41:12,939][0m Trial 822 finished with value: 0.8414545406933376 and parameters: {'alpha': 1.1146843370808166, 'ties': 'efron'}. Best is trial 13 with value: 0.8423527006348241.[0m
[32m[I 2022-04-21 11:41:13,261][0m Trial 823 finished with value: 0.8414545406933376 and parameters: {'alpha': 0.9911135697687691, 'ties': 'efron'}. Best is trial 13 with value: 0.8423527006348241.[0m
[32m[I 2022-04-21 11:41:13,415][0m Trial 824 finished with value: 0.8414545406933376 and parameters: {'alpha': 0.9239889957639583, 'ties': 'efron'}. Best is trial 13 with value: 0.8423527006348241.[0m
[32m[I 2022-04-21 11:41:13,577][0m Trial 825 finished with value: 0.8407234838742553 and parameters: {'alpha': 4.085601955316088, 'ties': 'breslow'}. Best is trial 13 with value: 0.8423527006348241.[0m
[32m[I 2022-04-21 11:41:13,771][0m Trial 826 finished with value: 0.8423527006348241 and parameters: {'alpha': 0.7437898702507955, 'ties': 'efron'}. Best is trial 13 with value: 0.8423527006348241.[0m
[32m[I 2022-04-21 11:41:13,984][0m Trial 827 finished with value: 0.842183674410227 and parameters: {'alpha': 0.49581297919917994, 'ties': 'breslow'}. Best is trial 13 with value: 0.8423527006348241.[0m
[32m[I 2022-04-21 11:41:14,157][0m Trial 828 finished with value: 0.842183674410227 and parameters: {'alpha': 0.6418273126611458, 'ties': 'breslow'}. Best is trial 13 with value: 0.8423527006348241.[0m
[32m[I 2022-04-21 11:41:14,298][0m Trial 829 finished with value: 0.8423527006348241 and parameters: {'alpha': 0.9063322857294086, 'ties': 'breslow'}. Best is trial 13 with value: 0.8423527006348241.[0m
[32m[I 2022-04-21 11:41:14,511][0m Trial 830 finished with value: 0.8423527006348241 and parameters: {'alpha': 0.7412805091164676, 'ties': 'breslow'}. Best is trial 13 with value: 0.8423527006348241.[0m
[32m[I 2022-04-21 11:41:14,658][0m Trial 831 finished with value: 0.8414545406933376 and parameters: {'alpha': 1.0688311703154143, 'ties': 'breslow'}. Best is trial 13 with value: 0.8423527006348241.[0m
[32m[I 2022-04-21 11:41:14,799][0m Trial 832 finished with value: 0.8423527006348241 and parameters: {'alpha': 0.7906393996197717, 'ties': 'breslow'}. Best is trial 13 with value: 0.8423527006348241.[0m
[32m[I 2022-04-21 11:41:15,012][0m Trial 833 finished with value: 0.8423527006348241 and parameters: {'alpha': 0.7271546501760948, 'ties': 'breslow'}. Best is trial 13 with value: 0.8423527006348241.[0m
[32m[I 2022-04-21 11:41:15,153][0m Trial 834 finished with value: 0.8423527006348241 and parameters: {'alpha': 0.7130396282336745, 'ties': 'breslow'}. Best is trial 13 with value: 0.8423527006348241.[0m
[32m[I 2022-04-21 11:41:15,363][0m Trial 835 finished with value: 0.842183674410227 and parameters: {'alpha': 0.5759570816672588, 'ties': 'breslow'}. Best is trial 13 with value: 0.8423527006348241.[0m
[32m[I 2022-04-21 11:41:15,502][0m Trial 836 finished with value: 0.8423527006348241 and parameters: {'alpha': 0.8338551062311667, 'ties': 'breslow'}. Best is trial 13 with value: 0.8423527006348241.[0m
[32m[I 2022-04-21 11:41:15,764][0m Trial 837 finished with value: 0.842183674410227 and parameters: {'alpha': 0.6196697139137033, 'ties': 'efron'}. Best is trial 13 with value: 0.8423527006348241.[0m
[32m[I 2022-04-21 11:41:15,906][0m Trial 838 finished with value: 0.8423527006348241 and parameters: {'alpha': 0.8357180953997558, 'ties': 'breslow'}. Best is trial 13 with value: 0.8423527006348241.[0m
[32m[I 2022-04-21 11:41:16,055][0m Trial 839 finished with value: 0.8423527006348241 and parameters: {'alpha': 0.9159800156497246, 'ties': 'breslow'}. Best is trial 13 with value: 0.8423527006348241.[0m
[32m[I 2022-04-21 11:41:16,266][0m Trial 840 finished with value: 0.8414545406933376 and parameters: {'alpha': 0.957605121481253, 'ties': 'breslow'}. Best is trial 13 with value: 0.8423527006348241.[0m
[32m[I 2022-04-21 11:41:16,687][0m Trial 841 finished with value: 0.8414545406933376 and parameters: {'alpha': 1.6234680134590849, 'ties': 'efron'}. Best is trial 13 with value: 0.8423527006348241.[0m
[32m[I 2022-04-21 11:41:17,075][0m Trial 842 finished with value: 0.8414545406933376 and parameters: {'alpha': 1.3567603069680956, 'ties': 'breslow'}. Best is trial 13 with value: 0.8423527006348241.[0m
[32m[I 2022-04-21 11:41:17,304][0m Trial 843 finished with value: 0.8414545406933376 and parameters: {'alpha': 1.251638007040621, 'ties': 'breslow'}. Best is trial 13 with value: 0.8423527006348241.[0m
[32m[I 2022-04-21 11:41:17,567][0m Trial 844 finished with value: 0.8414545406933376 and parameters: {'alpha': 1.1748918263152286, 'ties': 'breslow'}. Best is trial 13 with value: 0.8423527006348241.[0m
[32m[I 2022-04-21 11:41:17,796][0m Trial 845 finished with value: 0.8414545406933376 and parameters: {'alpha': 1.0439119318373993, 'ties': 'breslow'}. Best is trial 13 with value: 0.8423527006348241.[0m
[32m[I 2022-04-21 11:41:18,083][0m Trial 846 finished with value: 0.8414545406933376 and parameters: {'alpha': 1.0037479921986205, 'ties': 'breslow'}. Best is trial 13 with value: 0.8423527006348241.[0m
[32m[I 2022-04-21 11:41:18,387][0m Trial 847 finished with value: 0.8414545406933376 and parameters: {'alpha': 1.151927323804168, 'ties': 'breslow'}. Best is trial 13 with value: 0.8423527006348241.[0m
[32m[I 2022-04-21 11:41:18,775][0m Trial 848 finished with value: 0.8414545406933376 and parameters: {'alpha': 1.001841302398615, 'ties': 'breslow'}. Best is trial 13 with value: 0.8423527006348241.[0m
[32m[I 2022-04-21 11:41:19,172][0m Trial 849 finished with value: 0.8423527006348241 and parameters: {'alpha': 0.8128985128550648, 'ties': 'breslow'}. Best is trial 13 with value: 0.8423527006348241.[0m
[32m[I 2022-04-21 11:41:19,558][0m Trial 850 finished with value: 0.8423527006348241 and parameters: {'alpha': 0.817488193127039, 'ties': 'breslow'}. Best is trial 13 with value: 0.8423527006348241.[0m
[32m[I 2022-04-21 11:41:19,804][0m Trial 851 finished with value: 0.8423527006348241 and parameters: {'alpha': 0.9276988887065893, 'ties': 'breslow'}. Best is trial 13 with value: 0.8423527006348241.[0m
[32m[I 2022-04-21 11:41:20,088][0m Trial 852 finished with value: 0.8423527006348241 and parameters: {'alpha': 0.8040545379053137, 'ties': 'breslow'}. Best is trial 13 with value: 0.8423527006348241.[0m
[32m[I 2022-04-21 11:41:20,424][0m Trial 853 finished with value: 0.8423527006348241 and parameters: {'alpha': 0.80930104383019, 'ties': 'breslow'}. Best is trial 13 with value: 0.8423527006348241.[0m
[32m[I 2022-04-21 11:41:20,599][0m Trial 854 finished with value: 0.8412855144687406 and parameters: {'alpha': 1.9260109887065844, 'ties': 'breslow'}. Best is trial 13 with value: 0.8423527006348241.[0m
[32m[I 2022-04-21 11:41:20,897][0m Trial 855 finished with value: 0.842183674410227 and parameters: {'alpha': 0.6769847079586699, 'ties': 'breslow'}. Best is trial 13 with value: 0.8423527006348241.[0m
