[32m[I 2022-04-21 23:31:19,806][0m Trial 472 finished with value: 0.6727758953938765 and parameters: {'loss': 'coxph', 'learning_rate': 6.593226903925752e-05, 'n_estimators': 323, 'criterion': 'squared_error', 'min_samples_split': 7, 'min_samples_leaf': 10, 'min_weight_fraction_leaf': 0.21191096638908, 'min_impurity_decrease': 0.1532166113027431, 'max_features': 0.038189804775718185, 'subsample': 0.2631208151283798, 'dropout_rate': 0.06990371024651455, 'ccp_alpha': 0.09041139717520445}. Best is trial 187 with value: 0.6933481836305168.[0m
[32m[I 2022-04-21 23:31:52,080][0m Trial 473 finished with value: 0.678828170161717 and parameters: {'loss': 'coxph', 'learning_rate': 3.210427887201087e-05, 'n_estimators': 358, 'criterion': 'squared_error', 'min_samples_split': 6, 'min_samples_leaf': 10, 'min_weight_fraction_leaf': 0.19033493640709015, 'min_impurity_decrease': 0.12053817655396162, 'max_features': 0.07316173607557436, 'subsample': 0.24007487078617123, 'dropout_rate': 0.09439921537615716, 'ccp_alpha': 0.003910581088949511}. Best is trial 187 with value: 0.6933481836305168.[0m
[32m[I 2022-04-21 23:33:52,350][0m Trial 474 finished with value: 0.6810082307401858 and parameters: {'loss': 'coxph', 'learning_rate': 0.00032768594062499524, 'n_estimators': 794, 'criterion': 'squared_error', 'min_samples_split': 8, 'min_samples_leaf': 9, 'min_weight_fraction_leaf': 0.22531159284484992, 'min_impurity_decrease': 0.023934816918281268, 'max_features': 0.8766325884820798, 'subsample': 0.3043184000150308, 'dropout_rate': 0.3224102823926927, 'ccp_alpha': 0.25625582193680985}. Best is trial 187 with value: 0.6933481836305168.[0m
[32m[I 2022-04-21 23:34:06,719][0m Trial 475 finished with value: 0.681716174847585 and parameters: {'loss': 'coxph', 'learning_rate': 0.00012863521133623222, 'n_estimators': 255, 'criterion': 'squared_error', 'min_samples_split': 7, 'min_samples_leaf': 10, 'min_weight_fraction_leaf': 0.2022959363127628, 'min_impurity_decrease': 0.09550392787534741, 'max_features': 0.9186474997955819, 'subsample': 0.20451569186257657, 'dropout_rate': 0.1693022230124205, 'ccp_alpha': 0.0016663883364248927}. Best is trial 187 with value: 0.6933481836305168.[0m
[32m[I 2022-04-21 23:34:30,638][0m Trial 476 finished with value: 0.6865290378346488 and parameters: {'loss': 'coxph', 'learning_rate': 4.771862239258439e-05, 'n_estimators': 345, 'criterion': 'squared_error', 'min_samples_split': 2, 'min_samples_leaf': 10, 'min_weight_fraction_leaf': 0.17439674579826817, 'min_impurity_decrease': 0.07100099436783862, 'max_features': 0.12311487355975712, 'subsample': 0.2776143157152081, 'dropout_rate': 0.247949813161578, 'ccp_alpha': 0.1665958814110715}. Best is trial 187 with value: 0.6933481836305168.[0m
[32m[I 2022-04-21 23:34:53,214][0m Trial 477 finished with value: 0.6771424173063129 and parameters: {'loss': 'coxph', 'learning_rate': 9.872201791274095e-05, 'n_estimators': 303, 'criterion': 'friedman_mse', 'min_samples_split': 7, 'min_samples_leaf': 10, 'min_weight_fraction_leaf': 0.18318807478830965, 'min_impurity_decrease': 0.047530649698072316, 'max_features': 0.4204369785093337, 'subsample': 0.22696266204005308, 'dropout_rate': 0.03384741949618622, 'ccp_alpha': 0.09435086882883904}. Best is trial 187 with value: 0.6933481836305168.[0m
[32m[I 2022-04-21 23:35:31,837][0m Trial 478 finished with value: 0.619882185929014 and parameters: {'loss': 'coxph', 'learning_rate': 0.000270161057247452, 'n_estimators': 380, 'criterion': 'squared_error', 'min_samples_split': 7, 'min_samples_leaf': 9, 'min_weight_fraction_leaf': 0.1476521857723463, 'min_impurity_decrease': 0.022401498511526508, 'max_features': 0.8648655110847497, 'subsample': 0.33566090223531064, 'dropout_rate': 0.054346134933015613, 'ccp_alpha': 0.34444714919825337}. Best is trial 187 with value: 0.6933481836305168.[0m
[32m[I 2022-04-21 23:35:55,062][0m Trial 479 finished with value: 0.6744798424922687 and parameters: {'loss': 'coxph', 'learning_rate': 2.2517067148725445e-05, 'n_estimators': 326, 'criterion': 'squared_error', 'min_samples_split': 7, 'min_samples_leaf': 10, 'min_weight_fraction_leaf': 0.2398360228295889, 'min_impurity_decrease': 0.24611956610000563, 'max_features': 0.897566448216151, 'subsample': 0.26083608362874716, 'dropout_rate': 0.20065422540749012, 'ccp_alpha': 0.1908359899993731}. Best is trial 187 with value: 0.6933481836305168.[0m
[32m[I 2022-04-21 23:36:15,624][0m Trial 480 finished with value: 0.6843576429937187 and parameters: {'loss': 'coxph', 'learning_rate': 0.024002894775289035, 'n_estimators': 286, 'criterion': 'absolute_error', 'min_samples_split': 7, 'min_samples_leaf': 10, 'min_weight_fraction_leaf': 0.21465516463946913, 'min_impurity_decrease': 0.08567040562908827, 'max_features': 0.9719705096652478, 'subsample': 0.2957846287779598, 'dropout_rate': 0.2758677941548011, 'ccp_alpha': 0.1052008698523249}. Best is trial 187 with value: 0.6933481836305168.[0m
[32m[I 2022-04-21 23:36:44,387][0m Trial 481 finished with value: 0.6640761455266218 and parameters: {'loss': 'coxph', 'learning_rate': 0.0006241641340383016, 'n_estimators': 307, 'criterion': 'squared_error', 'min_samples_split': 7, 'min_samples_leaf': 10, 'min_weight_fraction_leaf': 0.19813779127280642, 'min_impurity_decrease': 0.053030976001154514, 'max_features': 0.8327851646594386, 'subsample': 0.31783229342413694, 'dropout_rate': 0.12720323544484394, 'ccp_alpha': 0.2560154331686485}. Best is trial 187 with value: 0.6933481836305168.[0m
[32m[I 2022-04-21 23:37:06,543][0m Trial 482 finished with value: 0.6871123676092686 and parameters: {'loss': 'coxph', 'learning_rate': 0.00018189460036886496, 'n_estimators': 271, 'criterion': 'squared_error', 'min_samples_split': 7, 'min_samples_leaf': 9, 'min_weight_fraction_leaf': 0.1897581262772244, 'min_impurity_decrease': 0.10956551962713387, 'max_features': 0.9556526306212001, 'subsample': 0.27754546627412546, 'dropout_rate': 0.00016930825034038033, 'ccp_alpha': 0.0033787137569490505}. Best is trial 187 with value: 0.6933481836305168.[0m
[32m[I 2022-04-21 23:37:36,005][0m Trial 483 finished with value: 0.667875228363324 and parameters: {'loss': 'coxph', 'learning_rate': 0.0004101743322839938, 'n_estimators': 341, 'criterion': 'squared_error', 'min_samples_split': 7, 'min_samples_leaf': 10, 'min_weight_fraction_leaf': 0.15992999207225245, 'min_impurity_decrease': 0.03601705737140252, 'max_features': 0.928109291430006, 'subsample': 0.15658174235620712, 'dropout_rate': 0.08697425002064318, 'ccp_alpha': 0.1719242088815155}. Best is trial 187 with value: 0.6933481836305168.[0m
[32m[I 2022-04-21 23:37:49,925][0m Trial 484 finished with value: 0.6866420034818652 and parameters: {'loss': 'coxph', 'learning_rate': 6.026323591602348e-05, 'n_estimators': 366, 'criterion': 'squared_error', 'min_samples_split': 8, 'min_samples_leaf': 10, 'min_weight_fraction_leaf': 0.20807062911967772, 'min_impurity_decrease': 0.07319129307592635, 'max_features': 0.8859363639403895, 'subsample': 0.24746725808182712, 'dropout_rate': 0.7116838924143016, 'ccp_alpha': 0.09182032620014907}. Best is trial 187 with value: 0.6933481836305168.[0m
[32m[I 2022-04-21 23:38:04,562][0m Trial 485 finished with value: 0.629655819969464 and parameters: {'loss': 'coxph', 'learning_rate': 4.293690192055284e-05, 'n_estimators': 243, 'criterion': 'squared_error', 'min_samples_split': 7, 'min_samples_leaf': 9, 'min_weight_fraction_leaf': 0.2274405532329109, 'min_impurity_decrease': 0.016449709174353854, 'max_features': 0.08639233183279472, 'subsample': 0.37081821180622204, 'dropout_rate': 0.025035060991010445, 'ccp_alpha': 0.2645221433086098}. Best is trial 187 with value: 0.6933481836305168.[0m
[32m[I 2022-04-21 23:38:41,267][0m Trial 486 finished with value: 0.6127568729131793 and parameters: {'loss': 'coxph', 'learning_rate': 8.033144711480246e-05, 'n_estimators': 397, 'criterion': 'squared_error', 'min_samples_split': 7, 'min_samples_leaf': 10, 'min_weight_fraction_leaf': 0.17111738266927504, 'min_impurity_decrease': 0.05967067506319273, 'max_features': 0.9321629154066632, 'subsample': 0.29300049214418816, 'dropout_rate': 0.22725346625799545, 'ccp_alpha': 0.42252353879514076}. Best is trial 187 with value: 0.6933481836305168.[0m
[32m[I 2022-04-21 23:39:06,651][0m Trial 487 finished with value: 0.5 and parameters: {'loss': 'coxph', 'learning_rate': 0.00023863866747669412, 'n_estimators': 316, 'criterion': 'squared_error', 'min_samples_split': 6, 'min_samples_leaf': 10, 'min_weight_fraction_leaf': 0.18484264503687375, 'min_impurity_decrease': 0.8421903452980217, 'max_features': 0.9792144539608739, 'subsample': 0.21668965010322006, 'dropout_rate': 0.10264625003500923, 'ccp_alpha': 0.09851177808228304}. Best is trial 187 with value: 0.6933481836305168.[0m
[32m[I 2022-04-21 23:39:18,029][0m Trial 488 finished with value: 0.6572935955465417 and parameters: {'loss': 'coxph', 'learning_rate': 3.006651138736932e-05, 'n_estimators': 297, 'criterion': 'absolute_error', 'min_samples_split': 7, 'min_samples_leaf': 10, 'min_weight_fraction_leaf': 0.19819181443322373, 'min_impurity_decrease': 0.12798264348950253, 'max_features': 0.9068231673224821, 'subsample': 0.2642883868744844, 'dropout_rate': 0.5437410763806445, 'ccp_alpha': 0.18725409205789223}. Best is trial 187 with value: 0.6933481836305168.[0m
/media/san2_ssd/data/Workdir/survival/venv/lib/python3.8/site-packages/sksurv/ensemble/boosting.py:955: RuntimeWarning: divide by zero encountered in log
  time = numpy.log(time)
/media/san2_ssd/data/Workdir/survival/venv/lib/python3.8/site-packages/sksurv/ensemble/boosting.py:955: RuntimeWarning: divide by zero encountered in log
  time = numpy.log(time)
/media/san2_ssd/data/Workdir/survival/venv/lib/python3.8/site-packages/sksurv/ensemble/boosting.py:955: RuntimeWarning: divide by zero encountered in log
  time = numpy.log(time)
/media/san2_ssd/data/Workdir/survival/venv/lib/python3.8/site-packages/sksurv/ensemble/boosting.py:955: RuntimeWarning: divide by zero encountered in log
  time = numpy.log(time)
[32m[I 2022-04-21 23:39:26,451][0m Trial 489 finished with value: -0.7320879366689031 and parameters: {'loss': 'squared', 'learning_rate': 0.00012078269019250326, 'n_estimators': 416, 'criterion': 'squared_error', 'min_samples_split': 7, 'min_samples_leaf': 9, 'min_weight_fraction_leaf': 0.2133750658254892, 'min_impurity_decrease': 0.09041333324694693, 'max_features': 0.8632538279478003, 'subsample': 0.31553972637830874, 'dropout_rate': 0.0587998923121944, 'ccp_alpha': 0.0015211682236456886}. Best is trial 187 with value: 0.6933481836305168.[0m
[32m[I 2022-04-21 23:39:52,929][0m Trial 490 finished with value: 0.6220992220227615 and parameters: {'loss': 'coxph', 'learning_rate': 0.0001496935471388514, 'n_estimators': 331, 'criterion': 'friedman_mse', 'min_samples_split': 7, 'min_samples_leaf': 10, 'min_weight_fraction_leaf': 0.18195941788525352, 'min_impurity_decrease': 0.0027826596918065424, 'max_features': 0.020530973712938987, 'subsample': 0.3374047789188118, 'dropout_rate': 0.2905622191873678, 'ccp_alpha': 0.3240970526216893}. Best is trial 187 with value: 0.6933481836305168.[0m
[32m[I 2022-04-21 23:40:15,511][0m Trial 491 finished with value: 0.6807045877835038 and parameters: {'loss': 'coxph', 'learning_rate': 0.0002052204957421417, 'n_estimators': 276, 'criterion': 'squared_error', 'min_samples_split': 7, 'min_samples_leaf': 10, 'min_weight_fraction_leaf': 0.1653624418742508, 'min_impurity_decrease': 0.03759065416926721, 'max_features': 0.9446094489147963, 'subsample': 0.19190657027270053, 'dropout_rate': 0.151738139956798, 'ccp_alpha': 0.10504596585910526}. Best is trial 187 with value: 0.6933481836305168.[0m
[32m[I 2022-04-21 23:40:27,223][0m Trial 492 finished with value: 0.6746466052629192 and parameters: {'loss': 'coxph', 'learning_rate': 0.0004935712829767551, 'n_estimators': 225, 'criterion': 'squared_error', 'min_samples_split': 7, 'min_samples_leaf': 9, 'min_weight_fraction_leaf': 0.19423858364332697, 'min_impurity_decrease': 0.07216351982605132, 'max_features': 0.8118420281945957, 'subsample': 0.2863359118781904, 'dropout_rate': 0.039254071424285594, 'ccp_alpha': 0.2063668909590741}. Best is trial 187 with value: 0.6933481836305168.[0m
[32m[I 2022-04-21 23:40:49,836][0m Trial 493 finished with value: 0.6830737691724138 and parameters: {'loss': 'coxph', 'learning_rate': 6.224346935233096e-05, 'n_estimators': 350, 'criterion': 'squared_error', 'min_samples_split': 5, 'min_samples_leaf': 10, 'min_weight_fraction_leaf': 0.20482848941885667, 'min_impurity_decrease': 0.1006126441660608, 'max_features': 0.9204493991014316, 'subsample': 0.23843246511831, 'dropout_rate': 0.2525318651883389, 'ccp_alpha': 0.08387800093577485}. Best is trial 187 with value: 0.6933481836305168.[0m
[32m[I 2022-04-21 23:41:21,238][0m Trial 494 finished with value: 0.6878519650346007 and parameters: {'loss': 'coxph', 'learning_rate': 0.0003188081623644103, 'n_estimators': 377, 'criterion': 'squared_error', 'min_samples_split': 7, 'min_samples_leaf': 10, 'min_weight_fraction_leaf': 0.22044589632880304, 'min_impurity_decrease': 0.0483091479586648, 'max_features': 0.8475534353023078, 'subsample': 0.3064084432859302, 'dropout_rate': 0.07879218475379716, 'ccp_alpha': 0.00550486059661319}. Best is trial 187 with value: 0.6933481836305168.[0m
[32m[I 2022-04-21 23:41:42,425][0m Trial 495 finished with value: 0.5 and parameters: {'loss': 'coxph', 'learning_rate': 9.513735037071953e-05, 'n_estimators': 317, 'criterion': 'squared_error', 'min_samples_split': 7, 'min_samples_leaf': 9, 'min_weight_fraction_leaf': 0.17411417173674051, 'min_impurity_decrease': 0.02679819587641824, 'max_features': 0.9625438337019746, 'subsample': 0.26339060466907, 'dropout_rate': 0.33387121531686964, 'ccp_alpha': 0.6623443105432176}. Best is trial 187 with value: 0.6933481836305168.[0m
[32m[I 2022-04-21 23:41:54,695][0m Trial 496 finished with value: 0.6737157202742197 and parameters: {'loss': 'coxph', 'learning_rate': 4.16477985523882e-05, 'n_estimators': 286, 'criterion': 'squared_error', 'min_samples_split': 7, 'min_samples_leaf': 10, 'min_weight_fraction_leaf': 0.2319702377564608, 'min_impurity_decrease': 0.13700779600888457, 'max_features': 0.8933119754052233, 'subsample': 0.35614653367005245, 'dropout_rate': 0.37500981931532185, 'ccp_alpha': 0.1806991007677186}. Best is trial 187 with value: 0.6933481836305168.[0m
[32m[I 2022-04-21 23:45:09,916][0m Trial 497 finished with value: 0.6127568729131793 and parameters: {'loss': 'coxph', 'learning_rate': 5.3119288718815854e-05, 'n_estimators': 896, 'criterion': 'absolute_error', 'min_samples_split': 7, 'min_samples_leaf': 10, 'min_weight_fraction_leaf': 0.18940061392060187, 'min_impurity_decrease': 0.06261238676947259, 'max_features': 0.6326461491714781, 'subsample': 0.2817714864466825, 'dropout_rate': 0.01967243917189987, 'ccp_alpha': 0.31654982849522206}. Best is trial 187 with value: 0.6933481836305168.[0m
[32m[I 2022-04-21 23:45:34,890][0m Trial 498 finished with value: 0.6872251245041707 and parameters: {'loss': 'coxph', 'learning_rate': 7.681537999422287e-05, 'n_estimators': 332, 'criterion': 'squared_error', 'min_samples_split': 8, 'min_samples_leaf': 10, 'min_weight_fraction_leaf': 0.20539174661062143, 'min_impurity_decrease': 0.0858104426711361, 'max_features': 0.06676119050696298, 'subsample': 0.22774684872870948, 'dropout_rate': 0.1845580622837629, 'ccp_alpha': 0.09156452079652987}. Best is trial 187 with value: 0.6933481836305168.[0m
[32m[I 2022-04-21 23:46:05,930][0m Trial 499 finished with value: 0.6748121362763279 and parameters: {'loss': 'coxph', 'learning_rate': 0.0001854254511975642, 'n_estimators': 363, 'criterion': 'squared_error', 'min_samples_split': 6, 'min_samples_leaf': 9, 'min_weight_fraction_leaf': 0.1774710462410769, 'min_impurity_decrease': 0.11342297482208971, 'max_features': 0.9437441268324083, 'subsample': 0.3208928252841945, 'dropout_rate': 0.12311371694896903, 'ccp_alpha': 0.23105064336745829}. Best is trial 187 with value: 0.6933481836305168.[0m
[32m[I 2022-04-21 23:46:31,126][0m Trial 500 finished with value: 0.6740239093747888 and parameters: {'loss': 'coxph', 'learning_rate': 0.0001416610614315397, 'n_estimators': 302, 'criterion': 'squared_error', 'min_samples_split': 4, 'min_samples_leaf': 10, 'min_weight_fraction_leaf': 0.19527537112335616, 'min_impurity_decrease': 0.03684345920261544, 'max_features': 0.11221723156279778, 'subsample': 0.24967946379967682, 'dropout_rate': 0.05564658696339567, 'ccp_alpha': 0.14756602189250792}. Best is trial 187 with value: 0.6933481836305168.[0m
[32m[I 2022-04-21 23:46:34,030][0m Trial 501 finished with value: 0.6856121032352751 and parameters: {'loss': 'coxph', 'learning_rate': 0.0003977316836099933, 'n_estimators': 128, 'criterion': 'squared_error', 'min_samples_split': 7, 'min_samples_leaf': 10, 'min_weight_fraction_leaf': 0.2192082754680256, 'min_impurity_decrease': 0.013936736273698626, 'max_features': 0.5201782629494607, 'subsample': 0.3003741284117912, 'dropout_rate': 0.30556242060120153, 'ccp_alpha': 0.002521270219075847}. Best is trial 187 with value: 0.6933481836305168.[0m
[32m[I 2022-04-21 23:46:53,591][0m Trial 502 finished with value: 0.6127568729131793 and parameters: {'loss': 'coxph', 'learning_rate': 1.4187393553392184e-05, 'n_estimators': 265, 'criterion': 'friedman_mse', 'min_samples_split': 7, 'min_samples_leaf': 10, 'min_weight_fraction_leaf': 0.14982442333772272, 'min_impurity_decrease': 0.056881810926603965, 'max_features': 0.877967514560488, 'subsample': 0.27420542906786627, 'dropout_rate': 0.08690667175630465, 'ccp_alpha': 0.45737030803628737}. Best is trial 187 with value: 0.6933481836305168.[0m
[32m[I 2022-04-21 23:47:24,406][0m Trial 503 finished with value: 0.6685907619107101 and parameters: {'loss': 'coxph', 'learning_rate': 0.0002563038361175766, 'n_estimators': 345, 'criterion': 'squared_error', 'min_samples_split': 7, 'min_samples_leaf': 9, 'min_weight_fraction_leaf': 0.18590690817325675, 'min_impurity_decrease': 0.08216860993106448, 'max_features': 0.9135991822551007, 'subsample': 0.2053472137849191, 'dropout_rate': 0.037840481891563964, 'ccp_alpha': 0.2574192289574231}. Best is trial 187 with value: 0.6933481836305168.[0m
[32m[I 2022-04-21 23:47:45,839][0m Trial 504 finished with value: 0.6876584777226199 and parameters: {'loss': 'coxph', 'learning_rate': 2.771694216386374e-05, 'n_estimators': 319, 'criterion': 'squared_error', 'min_samples_split': 7, 'min_samples_leaf': 10, 'min_weight_fraction_leaf': 0.164703086498754, 'min_impurity_decrease': 0.043907986696691284, 'max_features': 0.8363539190455423, 'subsample': 0.4800432402173318, 'dropout_rate': 0.27116182845981235, 'ccp_alpha': 0.0936270255981187}. Best is trial 187 with value: 0.6933481836305168.[0m
[32m[I 2022-04-21 23:48:03,248][0m Trial 505 finished with value: 0.6750559228090333 and parameters: {'loss': 'coxph', 'learning_rate': 3.635697130372759e-05, 'n_estimators': 297, 'criterion': 'squared_error', 'min_samples_split': 7, 'min_samples_leaf': 9, 'min_weight_fraction_leaf': 0.25515810707623987, 'min_impurity_decrease': 0.07004408841234797, 'max_features': 0.9802339400175399, 'subsample': 0.333303454889896, 'dropout_rate': 0.1085498886734688, 'ccp_alpha': 0.1698558905880595}. Best is trial 187 with value: 0.6933481836305168.[0m
[32m[I 2022-04-21 23:48:44,084][0m Trial 506 finished with value: 0.5 and parameters: {'loss': 'coxph', 'learning_rate': 0.00011005813659876344, 'n_estimators': 390, 'criterion': 'absolute_error', 'min_samples_split': 7, 'min_samples_leaf': 10, 'min_weight_fraction_leaf': 0.4943890816812052, 'min_impurity_decrease': 0.1012038487295816, 'max_features': 0.04450005197949777, 'subsample': 0.2956468780272443, 'dropout_rate': 0.06670577019361001, 'ccp_alpha': 0.3579221758677188}. Best is trial 187 with value: 0.6933481836305168.[0m
[32m[I 2022-04-21 23:49:11,811][0m Trial 507 finished with value: 0.6880991926519642 and parameters: {'loss': 'coxph', 'learning_rate': 4.979857927996743e-05, 'n_estimators': 358, 'criterion': 'squared_error', 'min_samples_split': 7, 'min_samples_leaf': 10, 'min_weight_fraction_leaf': 0.20678361189272632, 'min_impurity_decrease': 0.029879959024218347, 'max_features': 0.928840246766417, 'subsample': 0.2561781161771577, 'dropout_rate': 0.22525281505265207, 'ccp_alpha': 0.005449240074035841}. Best is trial 187 with value: 0.6933481836305168.[0m
/media/san2_ssd/data/Workdir/survival/venv/lib/python3.8/site-packages/sksurv/ensemble/boosting.py:955: RuntimeWarning: divide by zero encountered in log
  time = numpy.log(time)
/media/san2_ssd/data/Workdir/survival/venv/lib/python3.8/site-packages/sksurv/ensemble/boosting.py:955: RuntimeWarning: divide by zero encountered in log
  time = numpy.log(time)
/media/san2_ssd/data/Workdir/survival/venv/lib/python3.8/site-packages/sksurv/ensemble/boosting.py:955: RuntimeWarning: divide by zero encountered in log
  time = numpy.log(time)
/media/san2_ssd/data/Workdir/survival/venv/lib/python3.8/site-packages/sksurv/ensemble/boosting.py:955: RuntimeWarning: divide by zero encountered in log
  time = numpy.log(time)
[32m[I 2022-04-21 23:49:14,122][0m Trial 508 finished with value: -0.729523714493793 and parameters: {'loss': 'squared', 'learning_rate': 6.783520491911846e-05, 'n_estimators': 249, 'criterion': 'squared_error', 'min_samples_split': 7, 'min_samples_leaf': 10, 'min_weight_fraction_leaf': 0.17828465037294441, 'min_impurity_decrease': 0.12655845386764003, 'max_features': 0.29147773572186464, 'subsample': 0.3150001974325012, 'dropout_rate': 0.14139262637683797, 'ccp_alpha': 0.10051478536429112}. Best is trial 187 with value: 0.6933481836305168.[0m
