[32m[I 2022-04-22 22:28:28,651][0m Trial 448 finished with value: 0.685307944395874 and parameters: {'n_hidden': 1024, 'mixture_components': 10, 'use_sparse_layer': False, 'use_batchnorm': False, 'use_dropout': False, 'mlp_size_1': 6, 'mlp_size_2': 0, 'mlp_size_3': 1, 'kernel': 'Normal', 'loss_name': 'NLLLoss'}. Best is trial 164 with value: 0.7011621788753918.[0m
[32m[I 2022-04-22 22:29:16,802][0m Trial 449 finished with value: 0.67155485108716 and parameters: {'n_hidden': 1024, 'mixture_components': 8, 'use_sparse_layer': False, 'use_batchnorm': False, 'use_dropout': False, 'mlp_size_1': 6, 'mlp_size_2': 0, 'mlp_size_3': 1, 'kernel': 'LogLogistic', 'loss_name': 'NLLLoss'}. Best is trial 164 with value: 0.7011621788753918.[0m
[32m[I 2022-04-22 22:30:51,725][0m Trial 450 finished with value: 0.5818847754115111 and parameters: {'n_hidden': 2048, 'mixture_components': 2, 'use_sparse_layer': False, 'use_batchnorm': True, 'use_dropout': False, 'mlp_size_1': 8, 'mlp_size_2': 0, 'mlp_size_3': 0, 'kernel': 'Normal', 'loss_name': 'NLLLoss'}. Best is trial 164 with value: 0.7011621788753918.[0m
[32m[I 2022-04-22 22:31:34,261][0m Trial 451 finished with value: 0.678111210068172 and parameters: {'n_hidden': 1024, 'mixture_components': 8, 'use_sparse_layer': False, 'use_batchnorm': False, 'use_dropout': False, 'mlp_size_1': 6, 'mlp_size_2': 0, 'mlp_size_3': 1, 'kernel': 'Normal', 'loss_name': 'NLLLoss'}. Best is trial 164 with value: 0.7011621788753918.[0m
[32m[I 2022-04-22 22:32:11,775][0m Trial 452 finished with value: 0.6757785953506599 and parameters: {'n_hidden': 1024, 'mixture_components': 1, 'use_sparse_layer': False, 'use_batchnorm': False, 'use_dropout': False, 'mlp_size_1': 6, 'mlp_size_2': 0, 'mlp_size_3': 1, 'kernel': 'Normal', 'loss_name': 'NLLLoss'}. Best is trial 164 with value: 0.7011621788753918.[0m
[32m[I 2022-04-22 22:33:33,634][0m Trial 453 finished with value: 0.6719004221866862 and parameters: {'n_hidden': 64, 'mixture_components': 2, 'use_sparse_layer': False, 'use_batchnorm': False, 'use_dropout': False, 'mlp_size_1': 3, 'mlp_size_2': 0, 'mlp_size_3': 0, 'kernel': 'Normal', 'loss_name': 'CensoredNLLLoss'}. Best is trial 164 with value: 0.7011621788753918.[0m
[32m[I 2022-04-22 22:34:32,031][0m Trial 454 finished with value: 0.6746747313607819 and parameters: {'n_hidden': 1024, 'mixture_components': 9, 'use_sparse_layer': False, 'use_batchnorm': False, 'use_dropout': False, 'mlp_size_1': 6, 'mlp_size_2': 0, 'mlp_size_3': 1, 'kernel': 'Normal', 'loss_name': 'NLLLoss'}. Best is trial 164 with value: 0.7011621788753918.[0m
[32m[I 2022-04-22 22:35:19,775][0m Trial 455 finished with value: 0.6752651957696244 and parameters: {'n_hidden': 1024, 'mixture_components': 2, 'use_sparse_layer': True, 'use_sparse_loss': True, 'lmbd': 0.0006879051680496958, 'use_batchnorm': False, 'use_dropout': False, 'mlp_size_1': 6, 'mlp_size_2': 0, 'mlp_size_3': 1, 'kernel': 'Normal', 'loss_name': 'NLLLoss'}. Best is trial 164 with value: 0.7011621788753918.[0m
[32m[I 2022-04-22 22:36:01,387][0m Trial 456 finished with value: 0.6845190339454926 and parameters: {'n_hidden': 1024, 'mixture_components': 6, 'use_sparse_layer': False, 'use_batchnorm': False, 'use_dropout': False, 'mlp_size_1': 6, 'mlp_size_2': 0, 'mlp_size_3': 1, 'kernel': 'Exponential', 'loss_name': 'NLLLoss'}. Best is trial 164 with value: 0.7011621788753918.[0m
[32m[I 2022-04-22 22:36:54,260][0m Trial 457 finished with value: 0.6832270084854917 and parameters: {'n_hidden': 1024, 'mixture_components': 9, 'use_sparse_layer': False, 'use_batchnorm': False, 'use_dropout': False, 'mlp_size_1': 6, 'mlp_size_2': 0, 'mlp_size_3': 1, 'kernel': 'Gumbel', 'loss_name': 'NLLLoss'}. Best is trial 164 with value: 0.7011621788753918.[0m
[32m[I 2022-04-22 22:37:51,097][0m Trial 458 finished with value: 0.673863395873408 and parameters: {'n_hidden': 1024, 'mixture_components': 8, 'use_sparse_layer': False, 'use_batchnorm': False, 'use_dropout': False, 'mlp_size_1': 6, 'mlp_size_2': 0, 'mlp_size_3': 1, 'kernel': 'Normal', 'loss_name': 'NLLLoss'}. Best is trial 164 with value: 0.7011621788753918.[0m
[32m[I 2022-04-22 22:38:39,202][0m Trial 459 finished with value: 0.669727421575511 and parameters: {'n_hidden': 256, 'mixture_components': 1, 'use_sparse_layer': False, 'use_batchnorm': False, 'use_dropout': False, 'mlp_size_1': 5, 'mlp_size_2': 0, 'mlp_size_3': 0, 'kernel': 'Normal', 'loss_name': 'NLLLoss'}. Best is trial 164 with value: 0.7011621788753918.[0m
[32m[I 2022-04-22 22:39:25,452][0m Trial 460 finished with value: 0.6804366544987255 and parameters: {'n_hidden': 1024, 'mixture_components': 10, 'use_sparse_layer': False, 'use_batchnorm': False, 'use_dropout': False, 'mlp_size_1': 6, 'mlp_size_2': 0, 'mlp_size_3': 1, 'kernel': 'LogLogistic', 'loss_name': 'NLLLoss'}. Best is trial 164 with value: 0.7011621788753918.[0m
[32m[I 2022-04-22 22:40:03,679][0m Trial 461 finished with value: 0.6937994936818892 and parameters: {'n_hidden': 1024, 'mixture_components': 2, 'use_sparse_layer': False, 'use_batchnorm': False, 'use_dropout': False, 'mlp_size_1': 6, 'mlp_size_2': 0, 'mlp_size_3': 1, 'kernel': 'Gumbel', 'loss_name': 'NLLLoss'}. Best is trial 164 with value: 0.7011621788753918.[0m
[32m[I 2022-04-22 22:40:40,705][0m Trial 462 finished with value: 0.6810864016885546 and parameters: {'n_hidden': 1024, 'mixture_components': 8, 'use_sparse_layer': False, 'use_batchnorm': False, 'use_dropout': False, 'mlp_size_1': 6, 'mlp_size_2': 0, 'mlp_size_3': 1, 'kernel': 'Gumbel', 'loss_name': 'NLLLoss'}. Best is trial 164 with value: 0.7011621788753918.[0m
[32m[I 2022-04-22 22:41:18,072][0m Trial 463 finished with value: 0.6876188260859886 and parameters: {'n_hidden': 1024, 'mixture_components': 2, 'use_sparse_layer': False, 'use_batchnorm': False, 'use_dropout': False, 'mlp_size_1': 6, 'mlp_size_2': 0, 'mlp_size_3': 1, 'kernel': 'Gumbel', 'loss_name': 'NLLLoss'}. Best is trial 164 with value: 0.7011621788753918.[0m
[32m[I 2022-04-22 22:41:59,751][0m Trial 464 finished with value: 0.6837568016437319 and parameters: {'n_hidden': 1024, 'mixture_components': 9, 'use_sparse_layer': False, 'use_batchnorm': False, 'use_dropout': False, 'mlp_size_1': 6, 'mlp_size_2': 0, 'mlp_size_3': 1, 'kernel': 'Gumbel', 'loss_name': 'NLLLoss'}. Best is trial 164 with value: 0.7011621788753918.[0m
[32m[I 2022-04-22 22:42:48,613][0m Trial 465 finished with value: 0.6198551368210851 and parameters: {'n_hidden': 1024, 'mixture_components': 1, 'use_sparse_layer': False, 'use_batchnorm': False, 'use_dropout': True, 'dropout': 0.5572804998652161, 'mlp_size_1': 6, 'mlp_size_2': 0, 'mlp_size_3': 1, 'kernel': 'Gumbel', 'loss_name': 'NLLLoss'}. Best is trial 164 with value: 0.7011621788753918.[0m
[32m[I 2022-04-22 22:43:30,023][0m Trial 466 finished with value: 0.681017446057105 and parameters: {'n_hidden': 1024, 'mixture_components': 8, 'use_sparse_layer': False, 'use_batchnorm': False, 'use_dropout': False, 'mlp_size_1': 6, 'mlp_size_2': 0, 'mlp_size_3': 1, 'kernel': 'Gumbel', 'loss_name': 'NLLLoss'}. Best is trial 164 with value: 0.7011621788753918.[0m
[32m[I 2022-04-22 22:44:21,035][0m Trial 467 finished with value: 0.6732886791258863 and parameters: {'n_hidden': 1024, 'mixture_components': 4, 'use_sparse_layer': True, 'use_sparse_loss': False, 'use_batchnorm': False, 'use_dropout': False, 'mlp_size_1': 6, 'mlp_size_2': 0, 'mlp_size_3': 1, 'kernel': 'Gumbel', 'loss_name': 'NLLLoss'}. Best is trial 164 with value: 0.7011621788753918.[0m
[32m[I 2022-04-22 22:45:03,315][0m Trial 468 finished with value: 0.6966374782636809 and parameters: {'n_hidden': 1024, 'mixture_components': 2, 'use_sparse_layer': False, 'use_batchnorm': False, 'use_dropout': False, 'mlp_size_1': 6, 'mlp_size_2': 0, 'mlp_size_3': 1, 'kernel': 'Gumbel', 'loss_name': 'NLLLoss'}. Best is trial 164 with value: 0.7011621788753918.[0m
[32m[I 2022-04-22 22:47:02,409][0m Trial 469 finished with value: 0.5942242147322222 and parameters: {'n_hidden': 1024, 'mixture_components': 2, 'use_sparse_layer': False, 'use_batchnorm': True, 'use_dropout': False, 'mlp_size_1': 6, 'mlp_size_2': 0, 'mlp_size_3': 1, 'kernel': 'Gumbel', 'loss_name': 'NLLLoss'}. Best is trial 164 with value: 0.7011621788753918.[0m
[32m[I 2022-04-22 22:47:46,411][0m Trial 470 finished with value: 0.6776930969984374 and parameters: {'n_hidden': 512, 'mixture_components': 2, 'use_sparse_layer': False, 'use_batchnorm': False, 'use_dropout': False, 'mlp_size_1': 6, 'mlp_size_2': 0, 'mlp_size_3': 0, 'kernel': 'Gumbel', 'loss_name': 'NLLLoss'}. Best is trial 164 with value: 0.7011621788753918.[0m
[32m[I 2022-04-22 22:48:37,643][0m Trial 471 finished with value: 0.6878052142947031 and parameters: {'n_hidden': 1024, 'mixture_components': 2, 'use_sparse_layer': False, 'use_batchnorm': False, 'use_dropout': False, 'mlp_size_1': 6, 'mlp_size_2': 0, 'mlp_size_3': 1, 'kernel': 'Gumbel', 'loss_name': 'NLLLoss'}. Best is trial 164 with value: 0.7011621788753918.[0m
[32m[I 2022-04-22 22:49:32,605][0m Trial 472 finished with value: 0.6700941293147655 and parameters: {'n_hidden': 1024, 'mixture_components': 2, 'use_sparse_layer': False, 'use_batchnorm': False, 'use_dropout': False, 'mlp_size_1': 6, 'mlp_size_2': 0, 'mlp_size_3': 1, 'kernel': 'Gumbel', 'loss_name': 'NLLLoss'}. Best is trial 164 with value: 0.7011621788753918.[0m
[32m[I 2022-04-22 22:50:30,460][0m Trial 473 finished with value: 0.6843253795060048 and parameters: {'n_hidden': 1024, 'mixture_components': 2, 'use_sparse_layer': False, 'use_batchnorm': False, 'use_dropout': False, 'mlp_size_1': 6, 'mlp_size_2': 0, 'mlp_size_3': 1, 'kernel': 'Gumbel', 'loss_name': 'NLLLoss'}. Best is trial 164 with value: 0.7011621788753918.[0m
[32m[I 2022-04-22 22:51:20,892][0m Trial 474 finished with value: 0.6229149351753599 and parameters: {'n_hidden': 2048, 'mixture_components': 2, 'use_sparse_layer': False, 'use_batchnorm': False, 'use_dropout': False, 'mlp_size_1': 8, 'mlp_size_2': 0, 'mlp_size_3': 0, 'kernel': 'LogLogistic', 'loss_name': 'NLLLoss'}. Best is trial 164 with value: 0.7011621788753918.[0m
[32m[I 2022-04-22 22:52:20,713][0m Trial 475 finished with value: 0.6820157666366424 and parameters: {'n_hidden': 1024, 'mixture_components': 2, 'use_sparse_layer': False, 'use_batchnorm': False, 'use_dropout': False, 'mlp_size_1': 6, 'mlp_size_2': 1, 'mlp_size_3': 0, 'kernel': 'Gumbel', 'loss_name': 'CensoredNLLLoss'}. Best is trial 164 with value: 0.7011621788753918.[0m
[32m[I 2022-04-22 22:53:03,895][0m Trial 476 finished with value: 0.6930963424407688 and parameters: {'n_hidden': 1024, 'mixture_components': 9, 'use_sparse_layer': False, 'use_batchnorm': False, 'use_dropout': False, 'mlp_size_1': 6, 'mlp_size_2': 0, 'mlp_size_3': 1, 'kernel': 'Normal', 'loss_name': 'NLLLoss'}. Best is trial 164 with value: 0.7011621788753918.[0m
[32m[I 2022-04-22 22:53:54,897][0m Trial 477 finished with value: 0.6671751006040173 and parameters: {'n_hidden': 1024, 'mixture_components': 2, 'use_sparse_layer': False, 'use_batchnorm': False, 'use_dropout': False, 'mlp_size_1': 6, 'mlp_size_2': 0, 'mlp_size_3': 1, 'kernel': 'Normal', 'loss_name': 'NLLLoss'}. Best is trial 164 with value: 0.7011621788753918.[0m
[32m[I 2022-04-22 22:54:53,342][0m Trial 478 finished with value: 0.6742324708361166 and parameters: {'n_hidden': 1024, 'mixture_components': 8, 'use_sparse_layer': False, 'use_batchnorm': False, 'use_dropout': False, 'mlp_size_1': 6, 'mlp_size_2': 0, 'mlp_size_3': 1, 'kernel': 'Normal', 'loss_name': 'NLLLoss'}. Best is trial 164 with value: 0.7011621788753918.[0m
[32m[I 2022-04-22 22:56:03,736][0m Trial 479 finished with value: 0.6644263610587642 and parameters: {'n_hidden': 32, 'mixture_components': 10, 'use_sparse_layer': True, 'use_sparse_loss': True, 'lmbd': 2.658273064996374e-06, 'use_batchnorm': False, 'use_dropout': False, 'mlp_size_1': 2, 'mlp_size_2': 0, 'mlp_size_3': 0, 'kernel': 'Gumbel', 'loss_name': 'NLLLoss'}. Best is trial 164 with value: 0.7011621788753918.[0m
[32m[I 2022-04-22 22:56:57,514][0m Trial 480 finished with value: 0.681928664347034 and parameters: {'n_hidden': 1024, 'mixture_components': 2, 'use_sparse_layer': False, 'use_batchnorm': False, 'use_dropout': False, 'mlp_size_1': 6, 'mlp_size_2': 0, 'mlp_size_3': 1, 'kernel': 'Normal', 'loss_name': 'NLLLoss'}. Best is trial 164 with value: 0.7011621788753918.[0m
[32m[I 2022-04-22 22:57:33,236][0m Trial 481 finished with value: 0.6780898194187813 and parameters: {'n_hidden': 1024, 'mixture_components': 9, 'use_sparse_layer': False, 'use_batchnorm': False, 'use_dropout': False, 'mlp_size_1': 6, 'mlp_size_2': 0, 'mlp_size_3': 1, 'kernel': 'Exponential', 'loss_name': 'NLLLoss'}. Best is trial 164 with value: 0.7011621788753918.[0m
[32m[I 2022-04-22 22:58:22,136][0m Trial 482 finished with value: 0.6737293371385007 and parameters: {'n_hidden': 1024, 'mixture_components': 8, 'use_sparse_layer': False, 'use_batchnorm': False, 'use_dropout': False, 'mlp_size_1': 6, 'mlp_size_2': 0, 'mlp_size_3': 1, 'kernel': 'Normal', 'loss_name': 'NLLLoss'}. Best is trial 164 with value: 0.7011621788753918.[0m
[32m[I 2022-04-22 22:59:14,920][0m Trial 483 finished with value: 0.6880963751224304 and parameters: {'n_hidden': 1024, 'mixture_components': 2, 'use_sparse_layer': False, 'use_batchnorm': False, 'use_dropout': False, 'mlp_size_1': 6, 'mlp_size_2': 0, 'mlp_size_3': 1, 'kernel': 'Gumbel', 'loss_name': 'NLLLoss'}. Best is trial 164 with value: 0.7011621788753918.[0m
[32m[I 2022-04-22 23:00:01,078][0m Trial 484 finished with value: 0.6436702610112625 and parameters: {'n_hidden': 512, 'mixture_components': 4, 'use_sparse_layer': False, 'use_batchnorm': False, 'use_dropout': True, 'dropout': 0.9104566984520922, 'mlp_size_1': 6, 'mlp_size_2': 0, 'mlp_size_3': 0, 'kernel': 'Normal', 'loss_name': 'NLLLoss'}. Best is trial 164 with value: 0.7011621788753918.[0m
[32m[I 2022-04-22 23:00:53,428][0m Trial 485 finished with value: 0.6668841070100925 and parameters: {'n_hidden': 1024, 'mixture_components': 9, 'use_sparse_layer': False, 'use_batchnorm': False, 'use_dropout': False, 'mlp_size_1': 6, 'mlp_size_2': 0, 'mlp_size_3': 1, 'kernel': 'Normal', 'loss_name': 'NLLLoss'}. Best is trial 164 with value: 0.7011621788753918.[0m
[32m[I 2022-04-22 23:01:34,266][0m Trial 486 finished with value: 0.6916298521784402 and parameters: {'n_hidden': 1024, 'mixture_components': 6, 'use_sparse_layer': False, 'use_batchnorm': False, 'use_dropout': False, 'mlp_size_1': 6, 'mlp_size_2': 0, 'mlp_size_3': 1, 'kernel': 'Gumbel', 'loss_name': 'NLLLoss'}. Best is trial 164 with value: 0.7011621788753918.[0m
[32m[I 2022-04-22 23:02:14,472][0m Trial 487 finished with value: 0.6698524088326305 and parameters: {'n_hidden': 128, 'mixture_components': 2, 'use_sparse_layer': False, 'use_batchnorm': False, 'use_dropout': False, 'mlp_size_1': 4, 'mlp_size_2': 0, 'mlp_size_3': 0, 'kernel': 'LogLogistic', 'loss_name': 'NLLLoss'}. Best is trial 164 with value: 0.7011621788753918.[0m
[32m[I 2022-04-22 23:02:52,576][0m Trial 488 finished with value: 0.6917141062565311 and parameters: {'n_hidden': 1024, 'mixture_components': 8, 'use_sparse_layer': False, 'use_batchnorm': False, 'use_dropout': False, 'mlp_size_1': 6, 'mlp_size_2': 0, 'mlp_size_3': 1, 'kernel': 'Normal', 'loss_name': 'NLLLoss'}. Best is trial 164 with value: 0.7011621788753918.[0m
[32m[I 2022-04-22 23:03:41,434][0m Trial 489 finished with value: 0.6856662302901121 and parameters: {'n_hidden': 2048, 'mixture_components': 2, 'use_sparse_layer': False, 'use_batchnorm': False, 'use_dropout': False, 'mlp_size_1': 6, 'mlp_size_2': 2, 'mlp_size_3': 0, 'kernel': 'Normal', 'loss_name': 'NLLLoss'}. Best is trial 164 with value: 0.7011621788753918.[0m
[32m[I 2022-04-22 23:04:59,663][0m Trial 490 finished with value: 0.6160490524603912 and parameters: {'n_hidden': 64, 'mixture_components': 9, 'use_sparse_layer': True, 'use_sparse_loss': True, 'lmbd': 0.08326490914701103, 'use_batchnorm': True, 'use_dropout': False, 'mlp_size_1': 3, 'mlp_size_2': 0, 'mlp_size_3': 0, 'kernel': 'Gumbel', 'loss_name': 'NLLLoss'}. Best is trial 164 with value: 0.7011621788753918.[0m
[32m[I 2022-04-22 23:05:46,066][0m Trial 491 finished with value: 0.6711942465156349 and parameters: {'n_hidden': 1024, 'mixture_components': 2, 'use_sparse_layer': False, 'use_batchnorm': False, 'use_dropout': False, 'mlp_size_1': 6, 'mlp_size_2': 0, 'mlp_size_3': 1, 'kernel': 'Normal', 'loss_name': 'NLLLoss'}. Best is trial 164 with value: 0.7011621788753918.[0m
[32m[I 2022-04-22 23:06:35,861][0m Trial 492 finished with value: 0.6851291883996766 and parameters: {'n_hidden': 1024, 'mixture_components': 10, 'use_sparse_layer': False, 'use_batchnorm': False, 'use_dropout': False, 'mlp_size_1': 6, 'mlp_size_2': 0, 'mlp_size_3': 1, 'kernel': 'Normal', 'loss_name': 'NLLLoss'}. Best is trial 164 with value: 0.7011621788753918.[0m
[32m[I 2022-04-22 23:07:13,669][0m Trial 493 finished with value: 0.6805651248446279 and parameters: {'n_hidden': 1024, 'mixture_components': 8, 'use_sparse_layer': False, 'use_batchnorm': False, 'use_dropout': False, 'mlp_size_1': 6, 'mlp_size_2': 0, 'mlp_size_3': 1, 'kernel': 'Gumbel', 'loss_name': 'NLLLoss'}. Best is trial 164 with value: 0.7011621788753918.[0m
[32m[I 2022-04-22 23:08:00,157][0m Trial 494 finished with value: 0.6804080403652303 and parameters: {'n_hidden': 1024, 'mixture_components': 7, 'use_sparse_layer': False, 'use_batchnorm': False, 'use_dropout': False, 'mlp_size_1': 6, 'mlp_size_2': 0, 'mlp_size_3': 1, 'kernel': 'Normal', 'loss_name': 'NLLLoss'}. Best is trial 164 with value: 0.7011621788753918.[0m
[32m[I 2022-04-22 23:09:05,406][0m Trial 495 finished with value: 0.6857624996773423 and parameters: {'n_hidden': 1024, 'mixture_components': 2, 'use_sparse_layer': False, 'use_batchnorm': False, 'use_dropout': False, 'mlp_size_1': 6, 'mlp_size_2': 0, 'mlp_size_3': 1, 'kernel': 'Logistic', 'loss_name': 'CensoredNLLLoss'}. Best is trial 164 with value: 0.7011621788753918.[0m
[32m[I 2022-04-22 23:09:54,415][0m Trial 496 finished with value: 0.6820214049951878 and parameters: {'n_hidden': 1024, 'mixture_components': 9, 'use_sparse_layer': False, 'use_batchnorm': False, 'use_dropout': False, 'mlp_size_1': 6, 'mlp_size_2': 0, 'mlp_size_3': 1, 'kernel': 'Normal', 'loss_name': 'NLLLoss'}. Best is trial 164 with value: 0.7011621788753918.[0m
[32m[I 2022-04-22 23:10:28,021][0m Trial 497 finished with value: 0.6761156013584095 and parameters: {'n_hidden': 1024, 'mixture_components': 8, 'use_sparse_layer': False, 'use_batchnorm': False, 'use_dropout': False, 'mlp_size_1': 6, 'mlp_size_2': 0, 'mlp_size_3': 1, 'kernel': 'Gumbel', 'loss_name': 'NLLLoss'}. Best is trial 164 with value: 0.7011621788753918.[0m
[32m[I 2022-04-22 23:11:07,378][0m Trial 498 finished with value: 0.6762282318734916 and parameters: {'n_hidden': 1024, 'mixture_components': 2, 'use_sparse_layer': False, 'use_batchnorm': False, 'use_dropout': False, 'mlp_size_1': 6, 'mlp_size_2': 0, 'mlp_size_3': 1, 'kernel': 'Normal', 'loss_name': 'NLLLoss'}. Best is trial 164 with value: 0.7011621788753918.[0m
[32m[I 2022-04-22 23:11:51,646][0m Trial 499 finished with value: 0.6800381880586448 and parameters: {'n_hidden': 512, 'mixture_components': 2, 'use_sparse_layer': False, 'use_batchnorm': False, 'use_dropout': False, 'mlp_size_1': 6, 'mlp_size_2': 0, 'mlp_size_3': 0, 'kernel': 'Normal', 'loss_name': 'NLLLoss'}. Best is trial 164 with value: 0.7011621788753918.[0m
[32m[I 2022-04-22 23:12:38,871][0m Trial 500 finished with value: 0.6938562833316277 and parameters: {'n_hidden': 1024, 'mixture_components': 4, 'use_sparse_layer': False, 'use_batchnorm': False, 'use_dropout': False, 'mlp_size_1': 6, 'mlp_size_2': 0, 'mlp_size_3': 1, 'kernel': 'LogLogistic', 'loss_name': 'NLLLoss'}. Best is trial 164 with value: 0.7011621788753918.[0m
[32m[I 2022-04-22 23:13:20,923][0m Trial 501 finished with value: 0.6874029776749844 and parameters: {'n_hidden': 1024, 'mixture_components': 4, 'use_sparse_layer': False, 'use_batchnorm': False, 'use_dropout': False, 'mlp_size_1': 6, 'mlp_size_2': 0, 'mlp_size_3': 1, 'kernel': 'LogLogistic', 'loss_name': 'NLLLoss'}. Best is trial 164 with value: 0.7011621788753918.[0m
[32m[I 2022-04-22 23:14:14,709][0m Trial 502 finished with value: 0.6877524185887208 and parameters: {'n_hidden': 1024, 'mixture_components': 5, 'use_sparse_layer': True, 'use_sparse_loss': False, 'use_batchnorm': False, 'use_dropout': False, 'mlp_size_1': 6, 'mlp_size_2': 0, 'mlp_size_3': 1, 'kernel': 'LogLogistic', 'loss_name': 'NLLLoss'}. Best is trial 164 with value: 0.7011621788753918.[0m
[32m[I 2022-04-22 23:15:02,753][0m Trial 503 finished with value: 0.6779196720912968 and parameters: {'n_hidden': 2048, 'mixture_components': 4, 'use_sparse_layer': False, 'use_batchnorm': False, 'use_dropout': False, 'mlp_size_1': 8, 'mlp_size_2': 0, 'mlp_size_3': 0, 'kernel': 'LogLogistic', 'loss_name': 'NLLLoss'}. Best is trial 164 with value: 0.7011621788753918.[0m
[32m[I 2022-04-22 23:15:44,646][0m Trial 504 finished with value: 0.6733013983731065 and parameters: {'n_hidden': 1024, 'mixture_components': 4, 'use_sparse_layer': False, 'use_batchnorm': False, 'use_dropout': True, 'dropout': 0.7608949925443005, 'mlp_size_1': 6, 'mlp_size_2': 0, 'mlp_size_3': 1, 'kernel': 'LogLogistic', 'loss_name': 'NLLLoss'}. Best is trial 164 with value: 0.7011621788753918.[0m
[32m[I 2022-04-22 23:16:41,682][0m Trial 505 finished with value: 0.6821081138205045 and parameters: {'n_hidden': 1024, 'mixture_components': 4, 'use_sparse_layer': False, 'use_batchnorm': False, 'use_dropout': False, 'mlp_size_1': 6, 'mlp_size_2': 0, 'mlp_size_3': 1, 'kernel': 'LogLogistic', 'loss_name': 'NLLLoss'}. Best is trial 164 with value: 0.7011621788753918.[0m
