[32m[I 2022-04-21 23:31:15,121][0m Trial 177 finished with value: 0.6710908946968871 and parameters: {'alpha': 3.448103817932966, 'ties': 'breslow'}. Best is trial 51 with value: 0.6718225721814719.[0m
[32m[I 2022-04-21 23:31:45,133][0m Trial 178 finished with value: 0.6714261077667124 and parameters: {'alpha': 3.7621247322959777, 'ties': 'efron'}. Best is trial 51 with value: 0.6718225721814719.[0m
[32m[I 2022-04-21 23:32:14,381][0m Trial 179 finished with value: 0.6709653022638338 and parameters: {'alpha': 3.94716077982694, 'ties': 'breslow'}. Best is trial 51 with value: 0.6718225721814719.[0m
[32m[I 2022-04-21 23:32:44,143][0m Trial 180 finished with value: 0.6714096154867404 and parameters: {'alpha': 3.853132716744904, 'ties': 'breslow'}. Best is trial 51 with value: 0.6718225721814719.[0m
[32m[I 2022-04-21 23:33:13,394][0m Trial 181 finished with value: 0.6716643805773258 and parameters: {'alpha': 3.7847485533285754, 'ties': 'breslow'}. Best is trial 51 with value: 0.6718225721814719.[0m
[32m[I 2022-04-21 23:33:43,541][0m Trial 182 finished with value: 0.6711982740031293 and parameters: {'alpha': 3.6922105946302577, 'ties': 'breslow'}. Best is trial 51 with value: 0.6718225721814719.[0m
[32m[I 2022-04-21 23:34:11,564][0m Trial 183 finished with value: 0.6709611038444385 and parameters: {'alpha': 3.57063373549353, 'ties': 'breslow'}. Best is trial 51 with value: 0.6718225721814719.[0m
[32m[I 2022-04-21 23:34:40,835][0m Trial 184 finished with value: 0.6705709596314063 and parameters: {'alpha': 4.046633435046041, 'ties': 'breslow'}. Best is trial 51 with value: 0.6718225721814719.[0m
[32m[I 2022-04-21 23:35:11,276][0m Trial 185 finished with value: 0.6694622144524598 and parameters: {'alpha': 2.524597875782021, 'ties': 'breslow'}. Best is trial 51 with value: 0.6718225721814719.[0m
[32m[I 2022-04-21 23:35:40,568][0m Trial 186 finished with value: 0.6715828289199117 and parameters: {'alpha': 3.787657925824539, 'ties': 'breslow'}. Best is trial 51 with value: 0.6718225721814719.[0m
[32m[I 2022-04-21 23:36:09,951][0m Trial 187 finished with value: 0.6713605392800839 and parameters: {'alpha': 3.74409573205888, 'ties': 'breslow'}. Best is trial 51 with value: 0.6718225721814719.[0m
[32m[I 2022-04-21 23:36:39,286][0m Trial 188 finished with value: 0.6714955486297959 and parameters: {'alpha': 3.8791810501408954, 'ties': 'breslow'}. Best is trial 51 with value: 0.6718225721814719.[0m
[32m[I 2022-04-21 23:37:08,587][0m Trial 189 finished with value: 0.670957560396671 and parameters: {'alpha': 3.6362698952684607, 'ties': 'breslow'}. Best is trial 51 with value: 0.6718225721814719.[0m
[32m[I 2022-04-21 23:37:37,853][0m Trial 190 finished with value: 0.671120215034261 and parameters: {'alpha': 3.9424717199262673, 'ties': 'breslow'}. Best is trial 51 with value: 0.6718225721814719.[0m
[32m[I 2022-04-21 23:38:05,125][0m Trial 191 finished with value: 0.6716643805773258 and parameters: {'alpha': 3.7832686441653793, 'ties': 'breslow'}. Best is trial 51 with value: 0.6718225721814719.[0m
[32m[I 2022-04-21 23:38:35,200][0m Trial 192 finished with value: 0.6712758842947594 and parameters: {'alpha': 3.701377915707498, 'ties': 'breslow'}. Best is trial 51 with value: 0.6718225721814719.[0m
[32m[I 2022-04-21 23:39:03,979][0m Trial 193 finished with value: 0.6712547027163132 and parameters: {'alpha': 3.839884690524139, 'ties': 'breslow'}. Best is trial 51 with value: 0.6718225721814719.[0m
[32m[I 2022-04-21 23:39:33,381][0m Trial 194 finished with value: 0.6717410205240577 and parameters: {'alpha': 3.7784252930969497, 'ties': 'breslow'}. Best is trial 51 with value: 0.6718225721814719.[0m
[32m[I 2022-04-21 23:40:03,550][0m Trial 195 finished with value: 0.6710387141360685 and parameters: {'alpha': 3.551256994343671, 'ties': 'breslow'}. Best is trial 51 with value: 0.6718225721814719.[0m
[32m[I 2022-04-21 23:40:34,153][0m Trial 196 finished with value: 0.6707310562196291 and parameters: {'alpha': 3.9794641474838373, 'ties': 'breslow'}. Best is trial 51 with value: 0.6718225721814719.[0m
[32m[I 2022-04-21 23:41:04,651][0m Trial 197 finished with value: 0.671035170688301 and parameters: {'alpha': 3.6725851286195192, 'ties': 'breslow'}. Best is trial 51 with value: 0.6718225721814719.[0m
[32m[I 2022-04-21 23:41:35,057][0m Trial 198 finished with value: 0.6714352686560117 and parameters: {'alpha': 3.7503165828041003, 'ties': 'breslow'}. Best is trial 51 with value: 0.6718225721814719.[0m
[32m[I 2022-04-21 23:42:06,999][0m Trial 199 finished with value: 0.6713430856583515 and parameters: {'alpha': 3.8231911439583732, 'ties': 'breslow'}. Best is trial 51 with value: 0.6718225721814719.[0m
[32m[I 2022-04-21 23:42:39,305][0m Trial 200 finished with value: 0.6704072839027255 and parameters: {'alpha': 4.103749273020292, 'ties': 'breslow'}. Best is trial 51 with value: 0.6718225721814719.[0m
[32m[I 2022-04-21 23:43:10,968][0m Trial 201 finished with value: 0.6715828289199117 and parameters: {'alpha': 3.789168745696107, 'ties': 'breslow'}. Best is trial 51 with value: 0.6718225721814719.[0m
[32m[I 2022-04-21 23:43:43,192][0m Trial 202 finished with value: 0.6713378682047766 and parameters: {'alpha': 3.8812641474847345, 'ties': 'breslow'}. Best is trial 51 with value: 0.6718225721814719.[0m
[32m[I 2022-04-21 23:44:17,348][0m Trial 203 finished with value: 0.6689791965644203 and parameters: {'alpha': 2.3266641155952885, 'ties': 'breslow'}. Best is trial 51 with value: 0.6718225721814719.[0m
[32m[I 2022-04-21 23:44:49,221][0m Trial 204 finished with value: 0.6713571281393407 and parameters: {'alpha': 3.747006684428541, 'ties': 'breslow'}. Best is trial 51 with value: 0.6718225721814719.[0m
[32m[I 2022-04-21 23:45:20,779][0m Trial 205 finished with value: 0.6710392443611095 and parameters: {'alpha': 3.611299134329514, 'ties': 'breslow'}. Best is trial 51 with value: 0.6718225721814719.[0m
[32m[I 2022-04-21 23:45:52,974][0m Trial 206 finished with value: 0.6710429125554638 and parameters: {'alpha': 3.9443322930099547, 'ties': 'breslow'}. Best is trial 51 with value: 0.6718225721814719.[0m
[32m[I 2022-04-21 23:46:24,699][0m Trial 207 finished with value: 0.6708528438624721 and parameters: {'alpha': 3.4895505522014134, 'ties': 'breslow'}. Best is trial 51 with value: 0.6718225721814719.[0m
[32m[I 2022-04-21 23:46:55,316][0m Trial 208 finished with value: 0.6715012772624975 and parameters: {'alpha': 3.7988482833758384, 'ties': 'breslow'}. Best is trial 51 with value: 0.6718225721814719.[0m
[32m[I 2022-04-21 23:47:27,276][0m Trial 209 finished with value: 0.670957560396671 and parameters: {'alpha': 3.6598789026066196, 'ties': 'breslow'}. Best is trial 51 with value: 0.6718225721814719.[0m
[32m[I 2022-04-21 23:47:57,403][0m Trial 210 finished with value: 0.6712630044518841 and parameters: {'alpha': 3.788184219143289, 'ties': 'efron'}. Best is trial 51 with value: 0.6718225721814719.[0m
[32m[I 2022-04-21 23:48:29,228][0m Trial 211 finished with value: 0.6713378682047766 and parameters: {'alpha': 3.8825723051705032, 'ties': 'breslow'}. Best is trial 51 with value: 0.6718225721814719.[0m
[32m[I 2022-04-21 23:49:00,112][0m Trial 212 finished with value: 0.6716643805773258 and parameters: {'alpha': 3.7798649452280224, 'ties': 'breslow'}. Best is trial 51 with value: 0.6718225721814719.[0m
[32m[I 2022-04-21 23:49:31,600][0m Trial 213 finished with value: 0.6712758842947594 and parameters: {'alpha': 3.6977832181442105, 'ties': 'breslow'}. Best is trial 51 with value: 0.6718225721814719.[0m
[32m[I 2022-04-21 23:50:01,970][0m Trial 214 finished with value: 0.6708864992150974 and parameters: {'alpha': 3.9737273159304807, 'ties': 'breslow'}. Best is trial 51 with value: 0.6718225721814719.[0m
[32m[I 2022-04-21 23:50:32,362][0m Trial 215 finished with value: 0.6710392443611095 and parameters: {'alpha': 3.5951696811394234, 'ties': 'breslow'}. Best is trial 51 with value: 0.6718225721814719.[0m
[32m[I 2022-04-21 23:51:02,292][0m Trial 216 finished with value: 0.6716673515982117 and parameters: {'alpha': 3.76573805795181, 'ties': 'breslow'}. Best is trial 51 with value: 0.6718225721814719.[0m
[32m[I 2022-04-21 23:51:31,617][0m Trial 217 finished with value: 0.6711982740031293 and parameters: {'alpha': 3.691336219753803, 'ties': 'breslow'}. Best is trial 51 with value: 0.6718225721814719.[0m
[32m[I 2022-04-21 23:52:00,696][0m Trial 218 finished with value: 0.6714139969723817 and parameters: {'alpha': 3.87540531363181, 'ties': 'breslow'}. Best is trial 51 with value: 0.6718225721814719.[0m
[32m[I 2022-04-21 23:52:31,100][0m Trial 219 finished with value: 0.6718225721814719 and parameters: {'alpha': 3.770419964917947, 'ties': 'breslow'}. Best is trial 51 with value: 0.6718225721814719.[0m
[32m[I 2022-04-21 23:53:00,028][0m Trial 220 finished with value: 0.6709611038444385 and parameters: {'alpha': 3.579324480081464, 'ties': 'breslow'}. Best is trial 51 with value: 0.6718225721814719.[0m
[32m[I 2022-04-21 23:53:29,762][0m Trial 221 finished with value: 0.6714352686560117 and parameters: {'alpha': 3.7498812788605353, 'ties': 'breslow'}. Best is trial 51 with value: 0.6718225721814719.[0m
[32m[I 2022-04-21 23:54:00,141][0m Trial 222 finished with value: 0.6714206959499815 and parameters: {'alpha': 3.823530347506233, 'ties': 'breslow'}. Best is trial 51 with value: 0.6718225721814719.[0m
[32m[I 2022-04-21 23:54:29,933][0m Trial 223 finished with value: 0.6711796766006307 and parameters: {'alpha': 3.9233899415967546, 'ties': 'breslow'}. Best is trial 51 with value: 0.6718225721814719.[0m
[32m[I 2022-04-21 23:55:02,132][0m Trial 224 finished with value: 0.6714352686560117 and parameters: {'alpha': 3.749837477388962, 'ties': 'breslow'}. Best is trial 51 with value: 0.6718225721814719.[0m
[32m[I 2022-04-21 23:55:32,893][0m Trial 225 finished with value: 0.6703423779351331 and parameters: {'alpha': 4.015412408511844, 'ties': 'breslow'}. Best is trial 51 with value: 0.6718225721814719.[0m
[32m[I 2022-04-21 23:56:12,396][0m Trial 226 finished with value: 0.6657173611754246 and parameters: {'alpha': 1.2497733167082032, 'ties': 'breslow'}. Best is trial 51 with value: 0.6718225721814719.[0m
[32m[I 2022-04-21 23:56:44,615][0m Trial 227 finished with value: 0.671035170688301 and parameters: {'alpha': 3.6663612251422633, 'ties': 'breslow'}. Best is trial 51 with value: 0.6718225721814719.[0m
[32m[I 2022-04-21 23:57:15,431][0m Trial 228 finished with value: 0.6713378682047766 and parameters: {'alpha': 3.8822252274793945, 'ties': 'breslow'}. Best is trial 51 with value: 0.6718225721814719.[0m
[32m[I 2022-04-21 23:57:44,672][0m Trial 229 finished with value: 0.670957560396671 and parameters: {'alpha': 3.648810623761741, 'ties': 'breslow'}. Best is trial 51 with value: 0.6718225721814719.[0m
[32m[I 2022-04-21 23:58:15,822][0m Trial 230 finished with value: 0.6709301463412694 and parameters: {'alpha': 3.5100100579378752, 'ties': 'breslow'}. Best is trial 51 with value: 0.6718225721814719.[0m
[32m[I 2022-04-21 23:58:47,964][0m Trial 231 finished with value: 0.6717410205240577 and parameters: {'alpha': 3.7769621598946137, 'ties': 'breslow'}. Best is trial 51 with value: 0.6718225721814719.[0m
[32m[I 2022-04-21 23:59:20,099][0m Trial 232 finished with value: 0.6718225721814719 and parameters: {'alpha': 3.770590550697843, 'ties': 'breslow'}. Best is trial 51 with value: 0.6718225721814719.[0m
[32m[I 2022-04-21 23:59:51,742][0m Trial 233 finished with value: 0.6718225721814719 and parameters: {'alpha': 3.7702899187142345, 'ties': 'breslow'}. Best is trial 51 with value: 0.6718225721814719.[0m
[32m[I 2022-04-22 00:00:23,233][0m Trial 234 finished with value: 0.6714381495717138 and parameters: {'alpha': 3.734638826890316, 'ties': 'breslow'}. Best is trial 51 with value: 0.6718225721814719.[0m
[32m[I 2022-04-22 00:00:55,330][0m Trial 235 finished with value: 0.6712563165473625 and parameters: {'alpha': 3.892922045718224, 'ties': 'breslow'}. Best is trial 51 with value: 0.6718225721814719.[0m
[32m[I 2022-04-22 00:01:26,979][0m Trial 236 finished with value: 0.6713565979142997 and parameters: {'alpha': 3.718379909604534, 'ties': 'breslow'}. Best is trial 51 with value: 0.6718225721814719.[0m
[32m[I 2022-04-22 00:01:58,881][0m Trial 237 finished with value: 0.6710385818290442 and parameters: {'alpha': 3.6187360140577636, 'ties': 'breslow'}. Best is trial 51 with value: 0.6718225721814719.[0m
[32m[I 2022-04-22 00:02:29,099][0m Trial 238 finished with value: 0.6715012772624975 and parameters: {'alpha': 3.8006868654580086, 'ties': 'breslow'}. Best is trial 51 with value: 0.6718225721814719.[0m
[32m[I 2022-04-22 00:03:00,714][0m Trial 239 finished with value: 0.6708098592683656 and parameters: {'alpha': 3.968274990174846, 'ties': 'breslow'}. Best is trial 51 with value: 0.6718225721814719.[0m
[32m[I 2022-04-22 00:03:32,216][0m Trial 240 finished with value: 0.6712547027163132 and parameters: {'alpha': 3.839952803337061, 'ties': 'breslow'}. Best is trial 51 with value: 0.6718225721814719.[0m
[32m[I 2022-04-22 00:04:03,861][0m Trial 241 finished with value: 0.6712789876226697 and parameters: {'alpha': 3.7460755984336087, 'ties': 'breslow'}. Best is trial 51 with value: 0.6718225721814719.[0m
[32m[I 2022-04-22 00:04:34,627][0m Trial 242 finished with value: 0.6711167223457152 and parameters: {'alpha': 3.6796555338695907, 'ties': 'breslow'}. Best is trial 51 with value: 0.6718225721814719.[0m
[32m[I 2022-04-22 00:06:27,789][0m Trial 243 finished with value: 0.654587826284333 and parameters: {'alpha': 0.0015590578653013054, 'ties': 'breslow'}. Best is trial 51 with value: 0.6718225721814719.[0m
[32m[I 2022-04-22 00:06:58,545][0m Trial 244 finished with value: 0.6712618418137702 and parameters: {'alpha': 3.8314181057395054, 'ties': 'breslow'}. Best is trial 51 with value: 0.6718225721814719.[0m
[32m[I 2022-04-22 00:07:28,245][0m Trial 245 finished with value: 0.6695797560260976 and parameters: {'alpha': 4.979176333560757, 'ties': 'breslow'}. Best is trial 51 with value: 0.6718225721814719.[0m
[32m[I 2022-04-22 00:07:58,285][0m Trial 246 finished with value: 0.6716643805773258 and parameters: {'alpha': 3.783371975889846, 'ties': 'breslow'}. Best is trial 51 with value: 0.6718225721814719.[0m
[32m[I 2022-04-22 00:08:28,291][0m Trial 247 finished with value: 0.6710385818290442 and parameters: {'alpha': 3.618984224063486, 'ties': 'breslow'}. Best is trial 51 with value: 0.6718225721814719.[0m
[32m[I 2022-04-22 00:08:58,042][0m Trial 248 finished with value: 0.6714381495717138 and parameters: {'alpha': 3.7383293624942167, 'ties': 'breslow'}. Best is trial 51 with value: 0.6718225721814719.[0m
[32m[I 2022-04-22 00:09:29,371][0m Trial 249 finished with value: 0.6701755424206534 and parameters: {'alpha': 2.70874016793002, 'ties': 'efron'}. Best is trial 51 with value: 0.6718225721814719.[0m
[32m[I 2022-04-22 00:10:00,489][0m Trial 250 finished with value: 0.6711796766006307 and parameters: {'alpha': 3.91733363970427, 'ties': 'breslow'}. Best is trial 51 with value: 0.6718225721814719.[0m
[32m[I 2022-04-22 00:10:31,826][0m Trial 251 finished with value: 0.6705709596314063 and parameters: {'alpha': 4.041973656536815, 'ties': 'breslow'}. Best is trial 51 with value: 0.6718225721814719.[0m
[32m[I 2022-04-22 00:11:01,458][0m Trial 252 finished with value: 0.6715012772624975 and parameters: {'alpha': 3.798266596040596, 'ties': 'breslow'}. Best is trial 51 with value: 0.6718225721814719.[0m
[32m[I 2022-04-22 00:11:30,869][0m Trial 253 finished with value: 0.6711926565615977 and parameters: {'alpha': 3.5327370471500212, 'ties': 'breslow'}. Best is trial 51 with value: 0.6718225721814719.[0m
[32m[I 2022-04-22 00:12:01,681][0m Trial 254 finished with value: 0.671035170688301 and parameters: {'alpha': 3.6750547240493665, 'ties': 'breslow'}. Best is trial 51 with value: 0.6718225721814719.[0m
[32m[I 2022-04-22 00:12:31,887][0m Trial 255 finished with value: 0.6713378682047766 and parameters: {'alpha': 3.880049430050871, 'ties': 'breslow'}. Best is trial 51 with value: 0.6718225721814719.[0m
[32m[I 2022-04-22 00:13:04,023][0m Trial 256 finished with value: 0.6712789876226697 and parameters: {'alpha': 3.7460261789895957, 'ties': 'breslow'}. Best is trial 51 with value: 0.6718225721814719.[0m
[32m[I 2022-04-22 00:13:36,013][0m Trial 257 finished with value: 0.6709611038444385 and parameters: {'alpha': 3.590253366831657, 'ties': 'breslow'}. Best is trial 51 with value: 0.6718225721814719.[0m
[32m[I 2022-04-22 00:14:08,176][0m Trial 258 finished with value: 0.671120215034261 and parameters: {'alpha': 3.9430257089082184, 'ties': 'breslow'}. Best is trial 51 with value: 0.6718225721814719.[0m
[32m[I 2022-04-22 00:14:39,334][0m Trial 259 finished with value: 0.6715012772624975 and parameters: {'alpha': 3.8082004244992915, 'ties': 'breslow'}. Best is trial 51 with value: 0.6718225721814719.[0m
[32m[I 2022-04-22 00:15:11,217][0m Trial 260 finished with value: 0.6711167223457152 and parameters: {'alpha': 3.680393193778514, 'ties': 'breslow'}. Best is trial 51 with value: 0.6718225721814719.[0m
[32m[I 2022-04-22 00:15:43,011][0m Trial 261 finished with value: 0.6712563165473625 and parameters: {'alpha': 3.9114931032317726, 'ties': 'breslow'}. Best is trial 51 with value: 0.6718225721814719.[0m
[32m[I 2022-04-22 00:16:15,285][0m Trial 262 finished with value: 0.6704196804139302 and parameters: {'alpha': 4.0232283638311594, 'ties': 'breslow'}. Best is trial 51 with value: 0.6718225721814719.[0m
[32m[I 2022-04-22 00:16:55,191][0m Trial 263 finished with value: 0.6674787197786978 and parameters: {'alpha': 1.8607538956178495, 'ties': 'breslow'}. Best is trial 51 with value: 0.6718225721814719.[0m
[32m[I 2022-04-22 00:17:25,271][0m Trial 264 finished with value: 0.671167534643619 and parameters: {'alpha': 3.4269995343360975, 'ties': 'breslow'}. Best is trial 51 with value: 0.6718225721814719.[0m
[32m[I 2022-04-22 00:17:56,683][0m Trial 265 finished with value: 0.6715828289199117 and parameters: {'alpha': 3.7934914843899903, 'ties': 'breslow'}. Best is trial 51 with value: 0.6718225721814719.[0m
[32m[I 2022-04-22 00:18:28,537][0m Trial 266 finished with value: 0.6712547027163132 and parameters: {'alpha': 3.8400131971773273, 'ties': 'breslow'}. Best is trial 51 with value: 0.6718225721814719.[0m
[32m[I 2022-04-22 00:19:00,773][0m Trial 267 finished with value: 0.6709611038444385 and parameters: {'alpha': 3.5807794839395943, 'ties': 'breslow'}. Best is trial 51 with value: 0.6718225721814719.[0m
[32m[I 2022-04-22 00:19:30,052][0m Trial 268 finished with value: 0.6714381495717138 and parameters: {'alpha': 3.729272162940123, 'ties': 'breslow'}. Best is trial 51 with value: 0.6718225721814719.[0m
[32m[I 2022-04-22 00:20:01,557][0m Trial 269 finished with value: 0.671263688099804 and parameters: {'alpha': 3.8634813903008727, 'ties': 'efron'}. Best is trial 51 with value: 0.6718225721814719.[0m
[32m[I 2022-04-22 00:20:34,071][0m Trial 270 finished with value: 0.6707310562196291 and parameters: {'alpha': 3.9769611421951, 'ties': 'breslow'}. Best is trial 51 with value: 0.6718225721814719.[0m
[32m[I 2022-04-22 00:21:04,745][0m Trial 271 finished with value: 0.670957560396671 and parameters: {'alpha': 3.65738073007412, 'ties': 'breslow'}. Best is trial 51 with value: 0.6718225721814719.[0m
[32m[I 2022-04-22 00:21:34,118][0m Trial 272 finished with value: 0.6716643805773258 and parameters: {'alpha': 3.7830883287263006, 'ties': 'breslow'}. Best is trial 51 with value: 0.6718225721814719.[0m
[32m[I 2022-04-22 00:22:04,838][0m Trial 273 finished with value: 0.6715012772624975 and parameters: {'alpha': 3.8088015120877126, 'ties': 'breslow'}. Best is trial 51 with value: 0.6718225721814719.[0m
[32m[I 2022-04-22 00:22:35,573][0m Trial 274 finished with value: 0.6710116979986835 and parameters: {'alpha': 3.515304708846211, 'ties': 'breslow'}. Best is trial 51 with value: 0.6718225721814719.[0m
[32m[I 2022-04-22 00:23:07,537][0m Trial 275 finished with value: 0.6707257400948092 and parameters: {'alpha': 4.066970146503965, 'ties': 'breslow'}. Best is trial 51 with value: 0.6718225721814719.[0m
[32m[I 2022-04-22 00:23:36,669][0m Trial 276 finished with value: 0.6712563165473625 and parameters: {'alpha': 3.9076156948687406, 'ties': 'breslow'}. Best is trial 51 with value: 0.6718225721814719.[0m
[32m[I 2022-04-22 00:24:06,024][0m Trial 277 finished with value: 0.6713565979142997 and parameters: {'alpha': 3.7172450388134863, 'ties': 'breslow'}. Best is trial 51 with value: 0.6718225721814719.[0m
[32m[I 2022-04-22 00:24:37,687][0m Trial 278 finished with value: 0.6715828289199117 and parameters: {'alpha': 3.796161539612014, 'ties': 'breslow'}. Best is trial 51 with value: 0.6718225721814719.[0m
[32m[I 2022-04-22 00:25:08,235][0m Trial 279 finished with value: 0.6710392443611095 and parameters: {'alpha': 3.6073155331366475, 'ties': 'breslow'}. Best is trial 51 with value: 0.6718225721814719.[0m
[32m[I 2022-04-22 00:25:39,115][0m Trial 280 finished with value: 0.6714105858316386 and parameters: {'alpha': 3.8698665371910743, 'ties': 'breslow'}. Best is trial 51 with value: 0.6718225721814719.[0m
[32m[I 2022-04-22 00:26:09,449][0m Trial 281 finished with value: 0.6714352686560117 and parameters: {'alpha': 3.7519385016441946, 'ties': 'breslow'}. Best is trial 51 with value: 0.6718225721814719.[0m
[32m[I 2022-04-22 00:26:39,235][0m Trial 282 finished with value: 0.670653753740832 and parameters: {'alpha': 3.9805596429332293, 'ties': 'breslow'}. Best is trial 51 with value: 0.6718225721814719.[0m
[32m[I 2022-04-22 00:27:10,914][0m Trial 283 finished with value: 0.670957560396671 and parameters: {'alpha': 3.654294597660372, 'ties': 'breslow'}. Best is trial 51 with value: 0.6718225721814719.[0m
