[32m[I 2022-04-21 11:40:14,466][0m Trial 954 finished with value: 0.6543938115635641 and parameters: {'splitter': 'random', 'min_samples_split': 0.45719791622517236, 'min_samples_leaf': 0.10789056229870919, 'min_weight_fraction_leaf': 0.1575845898546878, 'max_features': 0.9401096113759715}. Best is trial 11 with value: 0.6773038119717333.[0m
[32m[I 2022-04-21 11:40:14,577][0m Trial 955 finished with value: 0.6640701022932763 and parameters: {'splitter': 'random', 'min_samples_split': 0.36475964461213967, 'min_samples_leaf': 0.1331144943772991, 'min_weight_fraction_leaf': 0.019470615981247264, 'max_features': 0.913272151824746}. Best is trial 11 with value: 0.6773038119717333.[0m
[32m[I 2022-04-21 11:40:14,679][0m Trial 956 finished with value: 0.6738476114655684 and parameters: {'splitter': 'random', 'min_samples_split': 0.1782064544576378, 'min_samples_leaf': 0.18941554023152346, 'min_weight_fraction_leaf': 0.13657288063265213, 'max_features': 0.8735267626978251}. Best is trial 11 with value: 0.6773038119717333.[0m
[32m[I 2022-04-21 11:40:14,787][0m Trial 957 finished with value: 0.5 and parameters: {'splitter': 'random', 'min_samples_split': 0.1752637559478546, 'min_samples_leaf': 0.190815210844713, 'min_weight_fraction_leaf': 0.12017668323300494, 'max_features': 0.45470328899726964}. Best is trial 11 with value: 0.6773038119717333.[0m
[32m[I 2022-04-21 11:40:14,872][0m Trial 958 finished with value: 0.6738476114655684 and parameters: {'splitter': 'random', 'min_samples_split': 0.1615240428062168, 'min_samples_leaf': 0.20094614763480015, 'min_weight_fraction_leaf': 0.11344790962331341, 'max_features': 0.8141039171118059}. Best is trial 11 with value: 0.6773038119717333.[0m
[32m[I 2022-04-21 11:40:14,918][0m Trial 959 finished with value: 0.5 and parameters: {'splitter': 'random', 'min_samples_split': 0.16437906618766412, 'min_samples_leaf': 0.20035169661445626, 'min_weight_fraction_leaf': 0.10626307047255351, 'max_features': 0.7696706290435372}. Best is trial 11 with value: 0.6773038119717333.[0m
[32m[I 2022-04-21 11:40:14,988][0m Trial 960 finished with value: 0.6636900948801576 and parameters: {'splitter': 'best', 'min_samples_split': 0.2673438963756265, 'min_samples_leaf': 0.1420980578177532, 'min_weight_fraction_leaf': 0.1886495625035296, 'max_features': 0.9997908976529273}. Best is trial 11 with value: 0.6773038119717333.[0m
[32m[I 2022-04-21 11:40:15,076][0m Trial 961 finished with value: 0.662800366349585 and parameters: {'splitter': 'random', 'min_samples_split': 0.4112056911965188, 'min_samples_leaf': 0.16426362105865477, 'min_weight_fraction_leaf': 0.14670972093293816, 'max_features': 0.9594643172009889}. Best is trial 11 with value: 0.6773038119717333.[0m
[32m[I 2022-04-21 11:40:15,161][0m Trial 962 finished with value: 0.6738476114655684 and parameters: {'splitter': 'random', 'min_samples_split': 0.4273210421529644, 'min_samples_leaf': 0.03563171366584579, 'min_weight_fraction_leaf': 0.1821260056551791, 'max_features': 0.930838191903058}. Best is trial 11 with value: 0.6773038119717333.[0m
[32m[I 2022-04-21 11:40:15,208][0m Trial 963 finished with value: 0.6738476114655684 and parameters: {'splitter': 'random', 'min_samples_split': 0.4326776339566212, 'min_samples_leaf': 0.03749715515786277, 'min_weight_fraction_leaf': 0.17717538066778987, 'max_features': 0.9244719370253726}. Best is trial 11 with value: 0.6773038119717333.[0m
[32m[I 2022-04-21 11:40:15,257][0m Trial 964 finished with value: 0.6738476114655684 and parameters: {'splitter': 'random', 'min_samples_split': 0.43752536440121076, 'min_samples_leaf': 0.12626392033778672, 'min_weight_fraction_leaf': 0.1691664040741205, 'max_features': 0.9038195315067457}. Best is trial 11 with value: 0.6773038119717333.[0m
[32m[I 2022-04-21 11:40:15,342][0m Trial 965 finished with value: 0.662800366349585 and parameters: {'splitter': 'random', 'min_samples_split': 0.4503924365567387, 'min_samples_leaf': 0.12726037038383717, 'min_weight_fraction_leaf': 0.16586474942732335, 'max_features': 0.8974586042926535}. Best is trial 11 with value: 0.6773038119717333.[0m
[32m[I 2022-04-21 11:40:15,437][0m Trial 966 finished with value: 0.6543938115635641 and parameters: {'splitter': 'random', 'min_samples_split': 0.3000689562679799, 'min_samples_leaf': 0.14737938402172615, 'min_weight_fraction_leaf': 0.1565858387537769, 'max_features': 0.9348063784149474}. Best is trial 11 with value: 0.6773038119717333.[0m
[32m[I 2022-04-21 11:40:15,482][0m Trial 967 finished with value: 0.6625929327049365 and parameters: {'splitter': 'random', 'min_samples_split': 0.38099581651547054, 'min_samples_leaf': 0.030489664960244328, 'min_weight_fraction_leaf': 0.018768500464834432, 'max_features': 0.9513054983419998}. Best is trial 11 with value: 0.6773038119717333.[0m
[32m[I 2022-04-21 11:40:15,620][0m Trial 968 finished with value: 0.6738476114655684 and parameters: {'splitter': 'random', 'min_samples_split': 0.28414724372467687, 'min_samples_leaf': 0.19776188989331372, 'min_weight_fraction_leaf': 0.15198455176025877, 'max_features': 0.8503783189755661}. Best is trial 11 with value: 0.6773038119717333.[0m
[32m[I 2022-04-21 11:40:15,728][0m Trial 969 finished with value: 0.5 and parameters: {'splitter': 'random', 'min_samples_split': 0.2870478925373689, 'min_samples_leaf': 0.15295036736381776, 'min_weight_fraction_leaf': 0.15749887253364692, 'max_features': 0.2549552180960254}. Best is trial 11 with value: 0.6773038119717333.[0m
[32m[I 2022-04-21 11:40:15,813][0m Trial 970 finished with value: 0.6586187582319654 and parameters: {'splitter': 'random', 'min_samples_split': 0.2059681606655147, 'min_samples_leaf': 0.055640442947632346, 'min_weight_fraction_leaf': 0.2127071091081309, 'max_features': 0.8809260094732458}. Best is trial 11 with value: 0.6773038119717333.[0m
[32m[I 2022-04-21 11:40:15,908][0m Trial 971 finished with value: 0.6738476114655684 and parameters: {'splitter': 'random', 'min_samples_split': 0.18516389105628958, 'min_samples_leaf': 0.053738295012626475, 'min_weight_fraction_leaf': 0.174920455093701, 'max_features': 0.8298475946479998}. Best is trial 11 with value: 0.6773038119717333.[0m
[32m[I 2022-04-21 11:40:16,005][0m Trial 972 finished with value: 0.6738476114655684 and parameters: {'splitter': 'random', 'min_samples_split': 0.4319384109540453, 'min_samples_leaf': 0.03733452745032694, 'min_weight_fraction_leaf': 0.18949083014429605, 'max_features': 0.9754687453609909}. Best is trial 11 with value: 0.6773038119717333.[0m
[32m[I 2022-04-21 11:40:16,103][0m Trial 973 finished with value: 0.5 and parameters: {'splitter': 'random', 'min_samples_split': 0.14923470680859308, 'min_samples_leaf': 0.3888978613303351, 'min_weight_fraction_leaf': 0.16201439857725697, 'max_features': 0.8374621224523555}. Best is trial 11 with value: 0.6773038119717333.[0m
[32m[I 2022-04-21 11:40:16,200][0m Trial 974 finished with value: 0.6738476114655684 and parameters: {'splitter': 'random', 'min_samples_split': 0.3939860917225717, 'min_samples_leaf': 0.027554996715423878, 'min_weight_fraction_leaf': 0.1916911379450887, 'max_features': 0.9720643071728565}. Best is trial 11 with value: 0.6773038119717333.[0m
[32m[I 2022-04-21 11:40:16,292][0m Trial 975 finished with value: 0.6502080893344752 and parameters: {'splitter': 'random', 'min_samples_split': 0.4432476054218385, 'min_samples_leaf': 0.0010623807640277854, 'min_weight_fraction_leaf': 0.14637883721152517, 'max_features': 0.9619149316946783}. Best is trial 11 with value: 0.6773038119717333.[0m
[32m[I 2022-04-21 11:40:16,390][0m Trial 976 finished with value: 0.6738476114655684 and parameters: {'splitter': 'random', 'min_samples_split': 0.29694020370797586, 'min_samples_leaf': 0.1706985883966079, 'min_weight_fraction_leaf': 0.18454518057139538, 'max_features': 0.9208078815398144}. Best is trial 11 with value: 0.6773038119717333.[0m
[32m[I 2022-04-21 11:40:16,491][0m Trial 977 finished with value: 0.662800366349585 and parameters: {'splitter': 'random', 'min_samples_split': 0.15726883956365179, 'min_samples_leaf': 0.011122954854685514, 'min_weight_fraction_leaf': 0.16384484625166879, 'max_features': 0.9851227695580714}. Best is trial 11 with value: 0.6773038119717333.[0m
[32m[I 2022-04-21 11:40:16,590][0m Trial 978 finished with value: 0.6598137568019723 and parameters: {'splitter': 'best', 'min_samples_split': 0.3997421219963041, 'min_samples_leaf': 0.1614142582182516, 'min_weight_fraction_leaf': 0.17714259042929983, 'max_features': 0.9408935293342137}. Best is trial 11 with value: 0.6773038119717333.[0m
[32m[I 2022-04-21 11:40:16,688][0m Trial 979 finished with value: 0.6738476114655684 and parameters: {'splitter': 'random', 'min_samples_split': 0.3643002919940833, 'min_samples_leaf': 0.19066273639346853, 'min_weight_fraction_leaf': 0.08287547187896835, 'max_features': 0.8620361842237267}. Best is trial 11 with value: 0.6773038119717333.[0m
[32m[I 2022-04-21 11:40:16,773][0m Trial 980 finished with value: 0.662800366349585 and parameters: {'splitter': 'random', 'min_samples_split': 0.14045051770489378, 'min_samples_leaf': 0.012330154645098923, 'min_weight_fraction_leaf': 0.16284272628689653, 'max_features': 0.8484938663403722}. Best is trial 11 with value: 0.6773038119717333.[0m
[32m[I 2022-04-21 11:40:16,875][0m Trial 981 finished with value: 0.6738476114655684 and parameters: {'splitter': 'random', 'min_samples_split': 0.40957769810407885, 'min_samples_leaf': 0.16888129448439998, 'min_weight_fraction_leaf': 0.17821825288251372, 'max_features': 0.9390050977489328}. Best is trial 11 with value: 0.6773038119717333.[0m
[32m[I 2022-04-21 11:40:16,954][0m Trial 982 finished with value: 0.5 and parameters: {'splitter': 'random', 'min_samples_split': 0.11994623121855903, 'min_samples_leaf': 0.32433604743199584, 'min_weight_fraction_leaf': 0.14967829066047728, 'max_features': 0.955696026284249}. Best is trial 11 with value: 0.6773038119717333.[0m
[32m[I 2022-04-21 11:40:17,130][0m Trial 983 finished with value: 0.6738476114655684 and parameters: {'splitter': 'random', 'min_samples_split': 0.23067550293522188, 'min_samples_leaf': 0.02015802683560799, 'min_weight_fraction_leaf': 0.196294530730238, 'max_features': 0.9856279951510809}. Best is trial 11 with value: 0.6773038119717333.[0m
[32m[I 2022-04-21 11:40:17,221][0m Trial 984 finished with value: 0.5 and parameters: {'splitter': 'random', 'min_samples_split': 0.13935886549403725, 'min_samples_leaf': 0.43720691113528526, 'min_weight_fraction_leaf': 0.14167822147801817, 'max_features': 0.8598118586543052}. Best is trial 11 with value: 0.6773038119717333.[0m
[32m[I 2022-04-21 11:40:17,301][0m Trial 985 finished with value: 0.5889594645659965 and parameters: {'splitter': 'random', 'min_samples_split': 0.24094684291540347, 'min_samples_leaf': 0.02077563592286349, 'min_weight_fraction_leaf': 0.2294455677689963, 'max_features': 0.9905493226828582}. Best is trial 11 with value: 0.6773038119717333.[0m
[32m[I 2022-04-21 11:40:17,417][0m Trial 986 finished with value: 0.5 and parameters: {'splitter': 'random', 'min_samples_split': 0.010863846373457168, 'min_samples_leaf': 0.17270708725109604, 'min_weight_fraction_leaf': 0.21016523806657988, 'max_features': 0.09258804542551546}. Best is trial 11 with value: 0.6773038119717333.[0m
[32m[I 2022-04-21 11:40:17,478][0m Trial 987 finished with value: 0.6586187582319654 and parameters: {'splitter': 'random', 'min_samples_split': 0.27789041886196153, 'min_samples_leaf': 0.11287645408033281, 'min_weight_fraction_leaf': 0.20355043198140907, 'max_features': 0.813787395130228}. Best is trial 11 with value: 0.6773038119717333.[0m
[32m[I 2022-04-21 11:40:17,534][0m Trial 988 finished with value: 0.6738476114655684 and parameters: {'splitter': 'random', 'min_samples_split': 0.41973496231754587, 'min_samples_leaf': 0.11470793726375508, 'min_weight_fraction_leaf': 0.1869507403370951, 'max_features': 0.88744396732973}. Best is trial 11 with value: 0.6773038119717333.[0m
[32m[I 2022-04-21 11:40:17,649][0m Trial 989 finished with value: 0.5 and parameters: {'splitter': 'random', 'min_samples_split': 0.09725653508935696, 'min_samples_leaf': 0.2849613347822049, 'min_weight_fraction_leaf': 0.17104714684627734, 'max_features': 0.9527965100062371}. Best is trial 11 with value: 0.6773038119717333.[0m
[32m[I 2022-04-21 11:40:17,714][0m Trial 990 finished with value: 0.6738476114655684 and parameters: {'splitter': 'random', 'min_samples_split': 0.24083972563986675, 'min_samples_leaf': 0.013902859971199399, 'min_weight_fraction_leaf': 0.19469335719082387, 'max_features': 0.8724768992666567}. Best is trial 11 with value: 0.6773038119717333.[0m
[32m[I 2022-04-21 11:40:17,758][0m Trial 991 finished with value: 0.6738476114655684 and parameters: {'splitter': 'random', 'min_samples_split': 0.24570424610343036, 'min_samples_leaf': 0.027550560227789532, 'min_weight_fraction_leaf': 0.19793129746640745, 'max_features': 0.8689789949658218}. Best is trial 11 with value: 0.6773038119717333.[0m
[32m[I 2022-04-21 11:40:17,815][0m Trial 992 finished with value: 0.6586187582319654 and parameters: {'splitter': 'random', 'min_samples_split': 0.2500186938812734, 'min_samples_leaf': 0.032257940929860854, 'min_weight_fraction_leaf': 0.2020249778350431, 'max_features': 0.9984277876117044}. Best is trial 11 with value: 0.6773038119717333.[0m
[32m[I 2022-04-21 11:40:17,913][0m Trial 993 finished with value: 0.6586187582319654 and parameters: {'splitter': 'random', 'min_samples_split': 0.3775428044458884, 'min_samples_leaf': 0.21334806714184917, 'min_weight_fraction_leaf': 0.1831638623614808, 'max_features': 0.8825327360218518}. Best is trial 11 with value: 0.6773038119717333.[0m
[32m[I 2022-04-21 11:40:17,991][0m Trial 994 finished with value: 0.6586187582319654 and parameters: {'splitter': 'random', 'min_samples_split': 0.3765388189198696, 'min_samples_leaf': 0.20704523695498847, 'min_weight_fraction_leaf': 0.0639010867899425, 'max_features': 0.8923960098043878}. Best is trial 11 with value: 0.6773038119717333.[0m
[32m[I 2022-04-21 11:40:18,043][0m Trial 995 finished with value: 0.6738476114655684 and parameters: {'splitter': 'random', 'min_samples_split': 0.041994111179915396, 'min_samples_leaf': 0.09966252393703061, 'min_weight_fraction_leaf': 0.1790993951834109, 'max_features': 0.814975837555642}. Best is trial 11 with value: 0.6773038119717333.[0m
[32m[I 2022-04-21 11:40:18,098][0m Trial 996 finished with value: 0.5 and parameters: {'splitter': 'random', 'min_samples_split': 0.40100590563763217, 'min_samples_leaf': 0.10167931919627107, 'min_weight_fraction_leaf': 0.18134014404099003, 'max_features': 0.7092685711871582}. Best is trial 11 with value: 0.6773038119717333.[0m
[32m[I 2022-04-21 11:40:18,208][0m Trial 997 finished with value: 0.6738476114655684 and parameters: {'splitter': 'random', 'min_samples_split': 0.42939228536815344, 'min_samples_leaf': 0.15170598165397123, 'min_weight_fraction_leaf': 0.17121528594870336, 'max_features': 0.88313560053741}. Best is trial 11 with value: 0.6773038119717333.[0m
[32m[I 2022-04-21 11:40:18,302][0m Trial 998 finished with value: 0.5305100038533069 and parameters: {'splitter': 'random', 'min_samples_split': 0.3789960153520658, 'min_samples_leaf': 0.09253557571132996, 'min_weight_fraction_leaf': 0.17440903550567044, 'max_features': 0.7852107098865356}. Best is trial 11 with value: 0.6773038119717333.[0m
[32m[I 2022-04-21 11:40:18,353][0m Trial 999 finished with value: 0.6636900948801576 and parameters: {'splitter': 'best', 'min_samples_split': 0.2513081362861065, 'min_samples_leaf': 0.018121351641363328, 'min_weight_fraction_leaf': 0.19445510618637726, 'max_features': 0.9769167777275278}. Best is trial 11 with value: 0.6773038119717333.[0m
SurvivalTree
Running Optimizer with LogRank binary scoring
{'splitter': 'best', 'min_samples_split': 0.27577889543622125, 'min_samples_leaf': 0.01425957772298497, 'min_weight_fraction_leaf': 0.049442055776326786, 'max_features': 0.7030510310977897, 'UnoC_LR': 0.8396174698878165}
Running Optimizer normaly
{'splitter': 'random', 'min_samples_split': 0.04224757180725848, 'min_samples_leaf': 0.002324223095765538, 'min_weight_fraction_leaf': 0.015466477571951548, 'max_features': 0.9969213989040255, 'UnoC': 0.6773038119717333}
