[32m[I 2022-04-21 11:37:58,380][0m Trial 253 finished with value: 0.8370547382698911 and parameters: {'splitter': 'best', 'min_samples_split': 0.20162011690103046, 'min_samples_leaf': 0.05986321958344029, 'min_weight_fraction_leaf': 0.011331338835024067, 'max_features': 0.9975046504712758}. Best is trial 223 with value: 0.8372023218910313.[0m
[32m[I 2022-04-21 11:37:58,426][0m Trial 254 finished with value: 0.8370547382698911 and parameters: {'splitter': 'best', 'min_samples_split': 0.20013839140354728, 'min_samples_leaf': 0.061132658531347014, 'min_weight_fraction_leaf': 0.00017117695760872505, 'max_features': 0.9982912965110856}. Best is trial 223 with value: 0.8372023218910313.[0m
[32m[I 2022-04-21 11:37:58,469][0m Trial 255 finished with value: 0.8367225558573038 and parameters: {'splitter': 'best', 'min_samples_split': 0.18940666820487478, 'min_samples_leaf': 0.07468735330805623, 'min_weight_fraction_leaf': 0.012525589030302212, 'max_features': 0.9987782745268626}. Best is trial 223 with value: 0.8372023218910313.[0m
[32m[I 2022-04-21 11:37:58,513][0m Trial 256 finished with value: 0.8363914938304864 and parameters: {'splitter': 'best', 'min_samples_split': 0.20304537011252252, 'min_samples_leaf': 0.06361702131091737, 'min_weight_fraction_leaf': 0.00047366454358648696, 'max_features': 0.9866601653445934}. Best is trial 223 with value: 0.8372023218910313.[0m
[32m[I 2022-04-21 11:37:58,566][0m Trial 257 finished with value: 0.8363268199688415 and parameters: {'splitter': 'best', 'min_samples_split': 0.25702065300280236, 'min_samples_leaf': 0.057909355851540896, 'min_weight_fraction_leaf': 0.016049097398396217, 'max_features': 0.9981426651133033}. Best is trial 223 with value: 0.8372023218910313.[0m
[32m[I 2022-04-21 11:37:58,610][0m Trial 258 finished with value: 0.8359946375562541 and parameters: {'splitter': 'best', 'min_samples_split': 0.24725133186992093, 'min_samples_leaf': 0.07097560490680224, 'min_weight_fraction_leaf': 0.00016858552699016652, 'max_features': 0.9820118979006305}. Best is trial 223 with value: 0.8372023218910313.[0m
[32m[I 2022-04-21 11:37:58,668][0m Trial 259 finished with value: 0.833988554983085 and parameters: {'splitter': 'best', 'min_samples_split': 0.1999811868872023, 'min_samples_leaf': 0.08756969645192014, 'min_weight_fraction_leaf': 0.0005588663943004325, 'max_features': 0.9961752582217602}. Best is trial 223 with value: 0.8372023218910313.[0m
[32m[I 2022-04-21 11:37:58,711][0m Trial 260 finished with value: 0.8370547382698911 and parameters: {'splitter': 'best', 'min_samples_split': 0.2284124976494111, 'min_samples_leaf': 0.05865533052631767, 'min_weight_fraction_leaf': 0.015553141401569217, 'max_features': 0.9657443209282438}. Best is trial 223 with value: 0.8372023218910313.[0m
[32m[I 2022-04-21 11:37:58,755][0m Trial 261 finished with value: 0.8370547382698911 and parameters: {'splitter': 'best', 'min_samples_split': 0.2265758835355825, 'min_samples_leaf': 0.059461087056310036, 'min_weight_fraction_leaf': 0.019783175906952374, 'max_features': 0.9740444213005692}. Best is trial 223 with value: 0.8372023218910313.[0m
[32m[I 2022-04-21 11:37:58,815][0m Trial 262 finished with value: 0.8356635755294366 and parameters: {'splitter': 'best', 'min_samples_split': 0.23389207157078262, 'min_samples_leaf': 0.06380066700058513, 'min_weight_fraction_leaf': 0.020616905801589442, 'max_features': 0.9990222942438132}. Best is trial 223 with value: 0.8372023218910313.[0m
[32m[I 2022-04-21 11:37:58,858][0m Trial 263 finished with value: 0.8367225558573038 and parameters: {'splitter': 'best', 'min_samples_split': 0.18638251573609588, 'min_samples_leaf': 0.07210132885617003, 'min_weight_fraction_leaf': 0.020388450771388414, 'max_features': 0.9653740044891558}. Best is trial 223 with value: 0.8372023218910313.[0m
[32m[I 2022-04-21 11:37:58,910][0m Trial 264 finished with value: 0.8373120918455026 and parameters: {'splitter': 'best', 'min_samples_split': 0.17237920940604876, 'min_samples_leaf': 0.05910193111337035, 'min_weight_fraction_leaf': 0.01951706022546832, 'max_features': 0.9812777265676921}. Best is trial 264 with value: 0.8373120918455026.[0m
[32m[I 2022-04-21 11:37:58,954][0m Trial 265 finished with value: 0.8342605834042434 and parameters: {'splitter': 'best', 'min_samples_split': 0.17373840949495978, 'min_samples_leaf': 0.08314656725264367, 'min_weight_fraction_leaf': 0.020667383722498472, 'max_features': 0.9794663113914011}. Best is trial 264 with value: 0.8373120918455026.[0m
[32m[I 2022-04-21 11:37:59,003][0m Trial 266 finished with value: 0.8370547382698911 and parameters: {'splitter': 'best', 'min_samples_split': 0.20544923445903826, 'min_samples_leaf': 0.059139617225608516, 'min_weight_fraction_leaf': 0.015969292825152328, 'max_features': 0.9801116872278439}. Best is trial 264 with value: 0.8373120918455026.[0m
[32m[I 2022-04-21 11:37:59,046][0m Trial 267 finished with value: 0.8373120918455026 and parameters: {'splitter': 'best', 'min_samples_split': 0.1674813608334791, 'min_samples_leaf': 0.061061060732898007, 'min_weight_fraction_leaf': 0.01704517639501241, 'max_features': 0.9847758032910598}. Best is trial 264 with value: 0.8373120918455026.[0m
[32m[I 2022-04-21 11:37:59,088][0m Trial 268 finished with value: 0.8353455920468985 and parameters: {'splitter': 'best', 'min_samples_split': 0.1452231048306909, 'min_samples_leaf': 0.072586652808303, 'min_weight_fraction_leaf': 0.022694539435135292, 'max_features': 0.9977423718020034}. Best is trial 264 with value: 0.8373120918455026.[0m
[32m[I 2022-04-21 11:37:59,139][0m Trial 269 finished with value: 0.8363268199688415 and parameters: {'splitter': 'best', 'min_samples_split': 0.2684043048276395, 'min_samples_leaf': 0.05795645063401169, 'min_weight_fraction_leaf': 0.017987483657132774, 'max_features': 0.975308086209821}. Best is trial 264 with value: 0.8373120918455026.[0m
[32m[I 2022-04-21 11:37:59,185][0m Trial 270 finished with value: 0.8373120918455026 and parameters: {'splitter': 'best', 'min_samples_split': 0.17293108093912293, 'min_samples_leaf': 0.058676973552395754, 'min_weight_fraction_leaf': 0.011802516390777784, 'max_features': 0.9817356680949795}. Best is trial 264 with value: 0.8373120918455026.[0m
[32m[I 2022-04-21 11:37:59,228][0m Trial 271 finished with value: 0.83375622717359 and parameters: {'splitter': 'best', 'min_samples_split': 0.1731950586022888, 'min_samples_leaf': 0.07892058963850239, 'min_weight_fraction_leaf': 0.024207582353247648, 'max_features': 0.9612928258051819}. Best is trial 264 with value: 0.8373120918455026.[0m
[32m[I 2022-04-21 11:37:59,271][0m Trial 272 finished with value: 0.8386029278581782 and parameters: {'splitter': 'best', 'min_samples_split': 0.16275067670963675, 'min_samples_leaf': 0.06796013436232934, 'min_weight_fraction_leaf': 0.010871070146610911, 'max_features': 0.9850317756742482}. Best is trial 272 with value: 0.8386029278581782.[0m
[32m[I 2022-04-21 11:37:59,315][0m Trial 273 finished with value: 0.833988554983085 and parameters: {'splitter': 'best', 'min_samples_split': 0.18148692932544114, 'min_samples_leaf': 0.09523982599299358, 'min_weight_fraction_leaf': 0.016568376447787553, 'max_features': 0.9583321563104062}. Best is trial 272 with value: 0.8386029278581782.[0m
[32m[I 2022-04-21 11:37:59,369][0m Trial 274 finished with value: 0.8386029278581782 and parameters: {'splitter': 'best', 'min_samples_split': 0.16066468916892343, 'min_samples_leaf': 0.06805036944897207, 'min_weight_fraction_leaf': 0.0077144074950410545, 'max_features': 0.9978216016776369}. Best is trial 272 with value: 0.8386029278581782.[0m
[32m[I 2022-04-21 11:37:59,416][0m Trial 275 finished with value: 0.833988554983085 and parameters: {'splitter': 'best', 'min_samples_split': 0.15714847214969255, 'min_samples_leaf': 0.08453932425676207, 'min_weight_fraction_leaf': 0.02636901859199489, 'max_features': 0.9783093073738083}. Best is trial 272 with value: 0.8386029278581782.[0m
[32m[I 2022-04-21 11:37:59,465][0m Trial 276 finished with value: 0.8180388147131256 and parameters: {'splitter': 'best', 'min_samples_split': 0.16831878252142038, 'min_samples_leaf': 0.06981495905575023, 'min_weight_fraction_leaf': 0.011064434430456287, 'max_features': 0.5798290886516826}. Best is trial 272 with value: 0.8386029278581782.[0m
[32m[I 2022-04-21 11:37:59,512][0m Trial 277 finished with value: 0.8363268199688415 and parameters: {'splitter': 'best', 'min_samples_split': 0.25494865987672716, 'min_samples_leaf': 0.05475706979050084, 'min_weight_fraction_leaf': 0.01185713812128164, 'max_features': 0.984366156579475}. Best is trial 272 with value: 0.8386029278581782.[0m
[32m[I 2022-04-21 11:37:59,565][0m Trial 278 finished with value: 0.8353455920468985 and parameters: {'splitter': 'best', 'min_samples_split': 0.152548654479268, 'min_samples_leaf': 0.07134050092400729, 'min_weight_fraction_leaf': 0.017266504697877265, 'max_features': 0.9798942296962674}. Best is trial 272 with value: 0.8386029278581782.[0m
[32m[I 2022-04-21 11:37:59,619][0m Trial 279 finished with value: 0.8350481835720354 and parameters: {'splitter': 'best', 'min_samples_split': 0.16334160600497072, 'min_samples_leaf': 0.08014532054238246, 'min_weight_fraction_leaf': 0.010149786918820626, 'max_features': 0.9969468633711277}. Best is trial 272 with value: 0.8386029278581782.[0m
[32m[I 2022-04-21 11:37:59,693][0m Trial 280 finished with value: 0.8356635755294366 and parameters: {'splitter': 'best', 'min_samples_split': 0.24521187872780822, 'min_samples_leaf': 0.06712690856897988, 'min_weight_fraction_leaf': 0.02534105191575203, 'max_features': 0.9825332482899845}. Best is trial 272 with value: 0.8386029278581782.[0m
[32m[I 2022-04-21 11:37:59,774][0m Trial 281 finished with value: 0.8115547962606179 and parameters: {'splitter': 'best', 'min_samples_split': 0.13670443034737842, 'min_samples_leaf': 0.05267880989407895, 'min_weight_fraction_leaf': 0.02597888922778694, 'max_features': 0.23037366714509966}. Best is trial 272 with value: 0.8386029278581782.[0m
[32m[I 2022-04-21 11:37:59,866][0m Trial 282 finished with value: 0.8361084444785265 and parameters: {'splitter': 'best', 'min_samples_split': 0.19498214767559174, 'min_samples_leaf': 0.05510082066199152, 'min_weight_fraction_leaf': 0.01731225963635329, 'max_features': 0.9830583814532339}. Best is trial 272 with value: 0.8386029278581782.[0m
[32m[I 2022-04-21 11:37:59,952][0m Trial 283 finished with value: 0.8363268199688415 and parameters: {'splitter': 'best', 'min_samples_split': 0.23683755459511718, 'min_samples_leaf': 0.059765484080734066, 'min_weight_fraction_leaf': 0.009514138985071491, 'max_features': 0.9815138871886626}. Best is trial 272 with value: 0.8386029278581782.[0m
[32m[I 2022-04-21 11:38:00,006][0m Trial 284 finished with value: 0.833988554983085 and parameters: {'splitter': 'best', 'min_samples_split': 0.18331385431653646, 'min_samples_leaf': 0.08903406694646554, 'min_weight_fraction_leaf': 0.0071289794242959895, 'max_features': 0.9527411127624705}. Best is trial 272 with value: 0.8386029278581782.[0m
[32m[I 2022-04-21 11:38:00,058][0m Trial 285 finished with value: 0.8373109714597329 and parameters: {'splitter': 'best', 'min_samples_split': 0.16859939727717868, 'min_samples_leaf': 0.06916838706148674, 'min_weight_fraction_leaf': 0.009855360561473554, 'max_features': 0.9540410666729183}. Best is trial 272 with value: 0.8386029278581782.[0m
[32m[I 2022-04-21 11:38:00,116][0m Trial 286 finished with value: 0.8363646776683682 and parameters: {'splitter': 'best', 'min_samples_split': 0.15441408409177904, 'min_samples_leaf': 0.07474236325162997, 'min_weight_fraction_leaf': 0.0324883934123113, 'max_features': 0.9989316770278764}. Best is trial 272 with value: 0.8386029278581782.[0m
[32m[I 2022-04-21 11:38:00,215][0m Trial 287 finished with value: 0.8373109714597329 and parameters: {'splitter': 'best', 'min_samples_split': 0.17235802761176533, 'min_samples_leaf': 0.06772816736934457, 'min_weight_fraction_leaf': 0.02417171895038644, 'max_features': 0.9514717485869006}. Best is trial 272 with value: 0.8386029278581782.[0m
[32m[I 2022-04-21 11:38:00,267][0m Trial 288 finished with value: 0.833988554983085 and parameters: {'splitter': 'best', 'min_samples_split': 0.16609069860624312, 'min_samples_leaf': 0.10022366181900794, 'min_weight_fraction_leaf': 0.022754723184158603, 'max_features': 0.9518552170320514}. Best is trial 272 with value: 0.8386029278581782.[0m
[32m[I 2022-04-21 11:38:00,345][0m Trial 289 finished with value: 0.8367225558573038 and parameters: {'splitter': 'best', 'min_samples_split': 0.1761856883177025, 'min_samples_leaf': 0.072180628743766, 'min_weight_fraction_leaf': 0.03147779165318334, 'max_features': 0.9608064391203032}. Best is trial 272 with value: 0.8386029278581782.[0m
[32m[I 2022-04-21 11:38:00,445][0m Trial 290 finished with value: 0.833988554983085 and parameters: {'splitter': 'best', 'min_samples_split': 0.15056830274708502, 'min_samples_leaf': 0.08508067146572384, 'min_weight_fraction_leaf': 0.010332609466629181, 'max_features': 0.9476014722365814}. Best is trial 272 with value: 0.8386029278581782.[0m
[32m[I 2022-04-21 11:38:00,531][0m Trial 291 finished with value: 0.8386029278581782 and parameters: {'splitter': 'best', 'min_samples_split': 0.16328077574036157, 'min_samples_leaf': 0.06813983509616044, 'min_weight_fraction_leaf': 0.0005509821541564192, 'max_features': 0.9605331364602948}. Best is trial 272 with value: 0.8386029278581782.[0m
[32m[I 2022-04-21 11:38:00,659][0m Trial 292 finished with value: 0.8350481835720354 and parameters: {'splitter': 'best', 'min_samples_split': 0.16515857496940728, 'min_samples_leaf': 0.07845251833665899, 'min_weight_fraction_leaf': 0.0222837026107513, 'max_features': 0.9474197552055987}. Best is trial 272 with value: 0.8386029278581782.[0m
[32m[I 2022-04-21 11:38:00,806][0m Trial 293 finished with value: 0.835014530020081 and parameters: {'splitter': 'best', 'min_samples_split': 0.12941792947034458, 'min_samples_leaf': 0.06895280158614892, 'min_weight_fraction_leaf': 0.017557717545653995, 'max_features': 0.9627616452786922}. Best is trial 272 with value: 0.8386029278581782.[0m
[32m[I 2022-04-21 11:38:00,856][0m Trial 294 finished with value: 0.83518896684928 and parameters: {'splitter': 'best', 'min_samples_split': 0.1705379103201921, 'min_samples_leaf': 0.050705810659787694, 'min_weight_fraction_leaf': 0.031105110578392332, 'max_features': 0.9399801644470867}. Best is trial 272 with value: 0.8386029278581782.[0m
[32m[I 2022-04-21 11:38:00,903][0m Trial 295 finished with value: 0.8358176788083208 and parameters: {'splitter': 'best', 'min_samples_split': 0.16323851643651788, 'min_samples_leaf': 0.052655440644341675, 'min_weight_fraction_leaf': 0.0011355604762297113, 'max_features': 0.9598854582468496}. Best is trial 272 with value: 0.8386029278581782.[0m
[32m[I 2022-04-21 11:38:00,992][0m Trial 296 finished with value: 0.8180388147131256 and parameters: {'splitter': 'best', 'min_samples_split': 0.13907207926397663, 'min_samples_leaf': 0.09167956334246508, 'min_weight_fraction_leaf': 0.014353811692346041, 'max_features': 0.4804943529265335}. Best is trial 272 with value: 0.8386029278581782.[0m
[32m[I 2022-04-21 11:38:01,091][0m Trial 297 finished with value: 0.8342186517555936 and parameters: {'splitter': 'best', 'min_samples_split': 0.19130526579414558, 'min_samples_leaf': 0.10969790040778557, 'min_weight_fraction_leaf': 0.026220501734872007, 'max_features': 0.9743849782602167}. Best is trial 272 with value: 0.8386029278581782.[0m
[32m[I 2022-04-21 11:38:01,179][0m Trial 298 finished with value: 0.8333498191213747 and parameters: {'splitter': 'best', 'min_samples_split': 0.18032380576301346, 'min_samples_leaf': 0.06828352431571245, 'min_weight_fraction_leaf': 0.012017731211049633, 'max_features': 0.7183137806190483}. Best is trial 272 with value: 0.8386029278581782.[0m
[32m[I 2022-04-21 11:38:01,231][0m Trial 299 finished with value: 0.8342605834042434 and parameters: {'splitter': 'best', 'min_samples_split': 0.18991234462753254, 'min_samples_leaf': 0.08135025968844535, 'min_weight_fraction_leaf': 0.03201123446126947, 'max_features': 0.9999179156511215}. Best is trial 272 with value: 0.8386029278581782.[0m
[32m[I 2022-04-21 11:38:01,281][0m Trial 300 finished with value: 0.8356635755294366 and parameters: {'splitter': 'best', 'min_samples_split': 0.24084858866233722, 'min_samples_leaf': 0.06617844925396099, 'min_weight_fraction_leaf': 0.010915138588537699, 'max_features': 0.976032016241432}. Best is trial 272 with value: 0.8386029278581782.[0m
[32m[I 2022-04-21 11:38:01,347][0m Trial 301 finished with value: 0.8092024099610124 and parameters: {'splitter': 'best', 'min_samples_split': 0.15811029714875435, 'min_samples_leaf': 0.052693530639271874, 'min_weight_fraction_leaf': 0.020829172647235092, 'max_features': 0.2966929069668391}. Best is trial 272 with value: 0.8386029278581782.[0m
[32m[I 2022-04-21 11:38:01,439][0m Trial 302 finished with value: 0.65 and parameters: {'splitter': 'best', 'min_samples_split': 0.17557072710219418, 'min_samples_leaf': 0.42060601849723595, 'min_weight_fraction_leaf': 0.010993008283366211, 'max_features': 0.9352711008475919}. Best is trial 272 with value: 0.8386029278581782.[0m
[32m[I 2022-04-21 11:38:01,497][0m Trial 303 finished with value: 0.8356635755294366 and parameters: {'splitter': 'best', 'min_samples_split': 0.23136747967751103, 'min_samples_leaf': 0.06763992250698854, 'min_weight_fraction_leaf': 0.010946522300937771, 'max_features': 0.9992684211934326}. Best is trial 272 with value: 0.8386029278581782.[0m
[32m[I 2022-04-21 11:38:01,598][0m Trial 304 finished with value: 0.8342605834042434 and parameters: {'splitter': 'best', 'min_samples_split': 0.25079300336344446, 'min_samples_leaf': 0.07726781468708749, 'min_weight_fraction_leaf': 0.0006760087139385193, 'max_features': 0.9524864035546003}. Best is trial 272 with value: 0.8386029278581782.[0m
[32m[I 2022-04-21 11:38:01,649][0m Trial 305 finished with value: 0.8361084444785265 and parameters: {'splitter': 'best', 'min_samples_split': 0.20355518167283412, 'min_samples_leaf': 0.0525368873855693, 'min_weight_fraction_leaf': 0.020807519591906673, 'max_features': 0.9648427346019737}. Best is trial 272 with value: 0.8386029278581782.[0m
[32m[I 2022-04-21 11:38:01,706][0m Trial 306 finished with value: 0.835014530020081 and parameters: {'splitter': 'best', 'min_samples_split': 0.15161752630666903, 'min_samples_leaf': 0.06372349038158621, 'min_weight_fraction_leaf': 0.0014883781560564098, 'max_features': 0.9997452793466791}. Best is trial 272 with value: 0.8386029278581782.[0m
[32m[I 2022-04-21 11:38:01,809][0m Trial 307 finished with value: 0.8343194359041494 and parameters: {'splitter': 'best', 'min_samples_split': 0.2317894453976825, 'min_samples_leaf': 0.05263628691347459, 'min_weight_fraction_leaf': 0.12453243718121709, 'max_features': 0.975610006074629}. Best is trial 272 with value: 0.8386029278581782.[0m
[32m[I 2022-04-21 11:38:01,932][0m Trial 308 finished with value: 0.833168690499571 and parameters: {'splitter': 'best', 'min_samples_split': 0.12255491428538641, 'min_samples_leaf': 0.059760319906773385, 'min_weight_fraction_leaf': 0.0006987313242809448, 'max_features': 0.969385758769692}. Best is trial 272 with value: 0.8386029278581782.[0m
[32m[I 2022-04-21 11:38:01,981][0m Trial 309 finished with value: 0.8359946375562541 and parameters: {'splitter': 'best', 'min_samples_split': 0.23405012631242372, 'min_samples_leaf': 0.07367721876419005, 'min_weight_fraction_leaf': 0.00840241278540858, 'max_features': 0.931823793376412}. Best is trial 272 with value: 0.8386029278581782.[0m
[32m[I 2022-04-21 11:38:02,028][0m Trial 310 finished with value: 0.833988554983085 and parameters: {'splitter': 'best', 'min_samples_split': 0.2649887181229568, 'min_samples_leaf': 0.08947934473792842, 'min_weight_fraction_leaf': 0.0003794894439667549, 'max_features': 0.9485579542826338}. Best is trial 272 with value: 0.8386029278581782.[0m
[32m[I 2022-04-21 11:38:02,137][0m Trial 311 finished with value: 0.8369839464007164 and parameters: {'splitter': 'best', 'min_samples_split': 0.20356979230113822, 'min_samples_leaf': 0.04842120124496273, 'min_weight_fraction_leaf': 0.021983217296177544, 'max_features': 0.9810285643391549}. Best is trial 272 with value: 0.8386029278581782.[0m
[32m[I 2022-04-21 11:38:02,237][0m Trial 312 finished with value: 0.8367225558573038 and parameters: {'splitter': 'best', 'min_samples_split': 0.18188370856035604, 'min_samples_leaf': 0.0750050595067703, 'min_weight_fraction_leaf': 0.032608344164130054, 'max_features': 0.9679419523217901}. Best is trial 272 with value: 0.8386029278581782.[0m
[32m[I 2022-04-21 11:38:02,294][0m Trial 313 finished with value: 0.8352329321092128 and parameters: {'splitter': 'best', 'min_samples_split': 0.16143256493737096, 'min_samples_leaf': 0.047922555985967744, 'min_weight_fraction_leaf': 0.024797770547168366, 'max_features': 0.937312506046899}. Best is trial 272 with value: 0.8386029278581782.[0m
[32m[I 2022-04-21 11:38:02,344][0m Trial 314 finished with value: 0.8363914938304864 and parameters: {'splitter': 'best', 'min_samples_split': 0.20986091932012677, 'min_samples_leaf': 0.065871340156837, 'min_weight_fraction_leaf': 0.017452269108783003, 'max_features': 0.9199401725147237}. Best is trial 272 with value: 0.8386029278581782.[0m
[32m[I 2022-04-21 11:38:02,393][0m Trial 315 finished with value: 0.8342605834042434 and parameters: {'splitter': 'best', 'min_samples_split': 0.2534675954804559, 'min_samples_leaf': 0.08254308578715547, 'min_weight_fraction_leaf': 0.009820045309186209, 'max_features': 0.9485670247114409}. Best is trial 272 with value: 0.8386029278581782.[0m
