[32m[I 2022-04-22 17:51:36,956][0m Trial 258 finished with value: -0.7140450715946705 and parameters: {'loss': 'squared', 'learning_rate': 0.021214599037608077, 'n_estimators': 543, 'criterion': 'squared_error', 'min_samples_split': 10, 'min_samples_leaf': 3, 'min_weight_fraction_leaf': 0.0911144393746183, 'min_impurity_decrease': 0.9673303257136243, 'max_features': 0.5872924009710152, 'subsample': 0.22658909018195753, 'dropout_rate': 0.3318391532975765, 'ccp_alpha': 0.32510871910470485}. Best is trial 218 with value: 0.6659976583847056.[0m
[32m[I 2022-04-22 17:52:59,805][0m Trial 259 finished with value: 0.6554522263841781 and parameters: {'loss': 'coxph', 'learning_rate': 0.03872650708862487, 'n_estimators': 578, 'criterion': 'friedman_mse', 'min_samples_split': 10, 'min_samples_leaf': 3, 'min_weight_fraction_leaf': 0.09974591930763851, 'min_impurity_decrease': 0.9373968003019122, 'max_features': 0.5918812951289928, 'subsample': 0.23509155972149381, 'dropout_rate': 0.2819612232227721, 'ccp_alpha': 0.10739822406869494}. Best is trial 218 with value: 0.6659976583847056.[0m
[32m[I 2022-04-22 17:54:13,056][0m Trial 260 finished with value: 0.5840063939648468 and parameters: {'loss': 'coxph', 'learning_rate': 0.03525333257374026, 'n_estimators': 574, 'criterion': 'friedman_mse', 'min_samples_split': 10, 'min_samples_leaf': 3, 'min_weight_fraction_leaf': 0.09979003095820524, 'min_impurity_decrease': 0.9223619725005668, 'max_features': 0.5943289112631956, 'subsample': 0.21809138638799483, 'dropout_rate': 0.27804827644441094, 'ccp_alpha': 0.26660925262025864}. Best is trial 218 with value: 0.6659976583847056.[0m
[32m[I 2022-04-22 17:55:37,745][0m Trial 261 finished with value: 0.6294433737754311 and parameters: {'loss': 'coxph', 'learning_rate': 0.027904348678220673, 'n_estimators': 607, 'criterion': 'friedman_mse', 'min_samples_split': 10, 'min_samples_leaf': 3, 'min_weight_fraction_leaf': 0.08417580407171762, 'min_impurity_decrease': 0.9425707711250821, 'max_features': 0.6189355601661597, 'subsample': 0.24021084252811875, 'dropout_rate': 0.248306683913589, 'ccp_alpha': 0.16894597990090526}. Best is trial 218 with value: 0.6659976583847056.[0m
[32m[I 2022-04-22 17:56:51,146][0m Trial 262 finished with value: 0.6533754055280621 and parameters: {'loss': 'coxph', 'learning_rate': 0.03982048093815127, 'n_estimators': 557, 'criterion': 'friedman_mse', 'min_samples_split': 10, 'min_samples_leaf': 3, 'min_weight_fraction_leaf': 0.1167369612879229, 'min_impurity_decrease': 0.9227946841905472, 'max_features': 0.5644473376837641, 'subsample': 0.28089464438805606, 'dropout_rate': 0.2604598302003776, 'ccp_alpha': 0.08651238981032408}. Best is trial 218 with value: 0.6659976583847056.[0m
[32m[I 2022-04-22 17:58:04,322][0m Trial 263 finished with value: 0.6617074061471423 and parameters: {'loss': 'coxph', 'learning_rate': 0.056684266068913504, 'n_estimators': 555, 'criterion': 'friedman_mse', 'min_samples_split': 10, 'min_samples_leaf': 3, 'min_weight_fraction_leaf': 0.08682334829263005, 'min_impurity_decrease': 0.9166363485780025, 'max_features': 0.5713527390022032, 'subsample': 0.28258299010539484, 'dropout_rate': 0.3000875965984049, 'ccp_alpha': 0.0015265553677475258}. Best is trial 218 with value: 0.6659976583847056.[0m
[32m[I 2022-04-22 17:59:11,523][0m Trial 264 finished with value: 0.6619550653503079 and parameters: {'loss': 'coxph', 'learning_rate': 0.046035258921737085, 'n_estimators': 540, 'criterion': 'friedman_mse', 'min_samples_split': 10, 'min_samples_leaf': 3, 'min_weight_fraction_leaf': 0.0804335260061313, 'min_impurity_decrease': 0.9092645543151482, 'max_features': 0.6079617529886633, 'subsample': 0.21833270144612432, 'dropout_rate': 0.304616911226797, 'ccp_alpha': 0.003652806789385954}. Best is trial 218 with value: 0.6659976583847056.[0m
[32m[I 2022-04-22 18:00:29,207][0m Trial 265 finished with value: 0.6400794845722214 and parameters: {'loss': 'coxph', 'learning_rate': 0.09056670267794166, 'n_estimators': 598, 'criterion': 'friedman_mse', 'min_samples_split': 10, 'min_samples_leaf': 3, 'min_weight_fraction_leaf': 0.08542581893249897, 'min_impurity_decrease': 0.9132699892088172, 'max_features': 0.5764835381076303, 'subsample': 0.21202917459531928, 'dropout_rate': 0.28734789447787423, 'ccp_alpha': 0.17055881441708534}. Best is trial 218 with value: 0.6659976583847056.[0m
[32m[I 2022-04-22 18:01:16,294][0m Trial 266 finished with value: 0.6579984170134374 and parameters: {'loss': 'coxph', 'learning_rate': 0.04835161615353794, 'n_estimators': 461, 'criterion': 'friedman_mse', 'min_samples_split': 10, 'min_samples_leaf': 3, 'min_weight_fraction_leaf': 0.07958893264195131, 'min_impurity_decrease': 0.9046626254234439, 'max_features': 0.6138679663384026, 'subsample': 0.26467063829223575, 'dropout_rate': 0.3529964465271303, 'ccp_alpha': 0.0038328742621951467}. Best is trial 218 with value: 0.6659976583847056.[0m
[32m[I 2022-04-22 18:02:05,481][0m Trial 267 finished with value: 0.6620246173442166 and parameters: {'loss': 'coxph', 'learning_rate': 0.0518241164391521, 'n_estimators': 463, 'criterion': 'friedman_mse', 'min_samples_split': 10, 'min_samples_leaf': 3, 'min_weight_fraction_leaf': 0.08750350897318866, 'min_impurity_decrease': 0.9116177635444842, 'max_features': 0.6063687470183075, 'subsample': 0.2742152878291737, 'dropout_rate': 0.30756944900328054, 'ccp_alpha': 0.005417630784342868}. Best is trial 218 with value: 0.6659976583847056.[0m
[32m[I 2022-04-22 18:02:54,170][0m Trial 268 finished with value: 0.6480021350261834 and parameters: {'loss': 'coxph', 'learning_rate': 0.06881988523827097, 'n_estimators': 464, 'criterion': 'friedman_mse', 'min_samples_split': 10, 'min_samples_leaf': 3, 'min_weight_fraction_leaf': 0.09789163191371149, 'min_impurity_decrease': 0.9035281246090416, 'max_features': 0.6196395885039157, 'subsample': 0.2905692521183457, 'dropout_rate': 0.2738190877260969, 'ccp_alpha': 0.09776181916118723}. Best is trial 218 with value: 0.6659976583847056.[0m
[32m[I 2022-04-22 18:03:46,637][0m Trial 269 finished with value: 0.6568907895308137 and parameters: {'loss': 'coxph', 'learning_rate': 0.053602998525748784, 'n_estimators': 489, 'criterion': 'friedman_mse', 'min_samples_split': 10, 'min_samples_leaf': 3, 'min_weight_fraction_leaf': 0.08012432624550656, 'min_impurity_decrease': 0.931728680786351, 'max_features': 0.6112166703951293, 'subsample': 0.2552339513291154, 'dropout_rate': 0.3522904654274197, 'ccp_alpha': 0.0010368531348243911}. Best is trial 218 with value: 0.6659976583847056.[0m
[32m[I 2022-04-22 18:04:33,401][0m Trial 270 finished with value: 0.6581146885213467 and parameters: {'loss': 'coxph', 'learning_rate': 0.054911347652979045, 'n_estimators': 463, 'criterion': 'friedman_mse', 'min_samples_split': 10, 'min_samples_leaf': 3, 'min_weight_fraction_leaf': 0.07925884875637332, 'min_impurity_decrease': 0.9308070123854381, 'max_features': 0.612759002370428, 'subsample': 0.2676521848993059, 'dropout_rate': 0.3455419668770233, 'ccp_alpha': 0.005640598701436417}. Best is trial 218 with value: 0.6659976583847056.[0m
[32m[I 2022-04-22 18:05:17,418][0m Trial 271 finished with value: 0.5546574533916447 and parameters: {'loss': 'coxph', 'learning_rate': 0.060680696304129415, 'n_estimators': 465, 'criterion': 'friedman_mse', 'min_samples_split': 10, 'min_samples_leaf': 3, 'min_weight_fraction_leaf': 0.08200888975184134, 'min_impurity_decrease': 0.9262955907821505, 'max_features': 0.6030373870268378, 'subsample': 0.26816741042232284, 'dropout_rate': 0.3541211137541482, 'ccp_alpha': 0.25558472745199734}. Best is trial 218 with value: 0.6659976583847056.[0m
[32m[I 2022-04-22 18:06:08,311][0m Trial 272 finished with value: 0.6649361421199995 and parameters: {'loss': 'coxph', 'learning_rate': 0.05182004629047836, 'n_estimators': 493, 'criterion': 'friedman_mse', 'min_samples_split': 10, 'min_samples_leaf': 3, 'min_weight_fraction_leaf': 0.07867292750190942, 'min_impurity_decrease': 0.9064727277545449, 'max_features': 0.6107627385018733, 'subsample': 0.2910139051493309, 'dropout_rate': 0.37633233782732245, 'ccp_alpha': 0.0057105869840812255}. Best is trial 218 with value: 0.6659976583847056.[0m
[32m[I 2022-04-22 18:07:05,914][0m Trial 273 finished with value: 0.6624204786763814 and parameters: {'loss': 'coxph', 'learning_rate': 0.046684589526860394, 'n_estimators': 497, 'criterion': 'friedman_mse', 'min_samples_split': 10, 'min_samples_leaf': 3, 'min_weight_fraction_leaf': 0.07866729759696725, 'min_impurity_decrease': 0.8965942929647427, 'max_features': 0.6114182664440889, 'subsample': 0.3267967021931098, 'dropout_rate': 0.36707897254389427, 'ccp_alpha': 0.008339029336893209}. Best is trial 218 with value: 0.6659976583847056.[0m
[32m[I 2022-04-22 18:07:55,921][0m Trial 274 finished with value: 0.6598856844062607 and parameters: {'loss': 'coxph', 'learning_rate': 0.050965995930689796, 'n_estimators': 487, 'criterion': 'friedman_mse', 'min_samples_split': 10, 'min_samples_leaf': 3, 'min_weight_fraction_leaf': 0.07704305491331952, 'min_impurity_decrease': 0.8990332693867865, 'max_features': 0.6278945961074455, 'subsample': 0.3336349146994587, 'dropout_rate': 0.385476865976801, 'ccp_alpha': 0.007026998735076892}. Best is trial 218 with value: 0.6659976583847056.[0m
[32m[I 2022-04-22 18:08:46,994][0m Trial 275 finished with value: 0.6591730504467899 and parameters: {'loss': 'coxph', 'learning_rate': 0.05773693655433885, 'n_estimators': 482, 'criterion': 'friedman_mse', 'min_samples_split': 10, 'min_samples_leaf': 3, 'min_weight_fraction_leaf': 0.08108677286743615, 'min_impurity_decrease': 0.8995304702847222, 'max_features': 0.6536681530642853, 'subsample': 0.3318573184169242, 'dropout_rate': 0.36511632728150395, 'ccp_alpha': 0.01493189221731427}. Best is trial 218 with value: 0.6659976583847056.[0m
[32m[I 2022-04-22 18:09:32,932][0m Trial 276 finished with value: 0.6184162104060373 and parameters: {'loss': 'coxph', 'learning_rate': 0.07337119176101657, 'n_estimators': 481, 'criterion': 'friedman_mse', 'min_samples_split': 10, 'min_samples_leaf': 3, 'min_weight_fraction_leaf': 0.07849050815793206, 'min_impurity_decrease': 0.8920999404831342, 'max_features': 0.6636912185011188, 'subsample': 0.33140155368660235, 'dropout_rate': 0.38925371979819595, 'ccp_alpha': 0.17423045886826954}. Best is trial 218 with value: 0.6659976583847056.[0m
[32m[I 2022-04-22 18:10:11,831][0m Trial 277 finished with value: 0.6609553874119884 and parameters: {'loss': 'coxph', 'learning_rate': 0.04936138931423964, 'n_estimators': 434, 'criterion': 'friedman_mse', 'min_samples_split': 10, 'min_samples_leaf': 3, 'min_weight_fraction_leaf': 0.07856252758221757, 'min_impurity_decrease': 0.9066974390877303, 'max_features': 0.6289278530002939, 'subsample': 0.31408852649067465, 'dropout_rate': 0.4080928477918074, 'ccp_alpha': 0.00719492501850423}. Best is trial 218 with value: 0.6659976583847056.[0m
/media/san2_ssd/data/Workdir/survival/venv/lib/python3.8/site-packages/sksurv/ensemble/boosting.py:955: RuntimeWarning: divide by zero encountered in log
  time = numpy.log(time)
/media/san2_ssd/data/Workdir/survival/venv/lib/python3.8/site-packages/sksurv/ensemble/boosting.py:955: RuntimeWarning: divide by zero encountered in log
  time = numpy.log(time)
/media/san2_ssd/data/Workdir/survival/venv/lib/python3.8/site-packages/sksurv/ensemble/boosting.py:955: RuntimeWarning: divide by zero encountered in log
  time = numpy.log(time)
/media/san2_ssd/data/Workdir/survival/venv/lib/python3.8/site-packages/sksurv/ensemble/boosting.py:955: RuntimeWarning: divide by zero encountered in log
  time = numpy.log(time)
[32m[I 2022-04-22 18:10:18,957][0m Trial 278 finished with value: -0.7372092908855727 and parameters: {'loss': 'squared', 'learning_rate': 0.05175107080463169, 'n_estimators': 427, 'criterion': 'friedman_mse', 'min_samples_split': 10, 'min_samples_leaf': 3, 'min_weight_fraction_leaf': 0.07821860776266601, 'min_impurity_decrease': 0.8977894153731593, 'max_features': 0.6290948679877868, 'subsample': 0.29477162275043184, 'dropout_rate': 0.40128935693366063, 'ccp_alpha': 0.003010620569405072}. Best is trial 218 with value: 0.6659976583847056.[0m
[32m[I 2022-04-22 18:11:00,282][0m Trial 279 finished with value: 0.5 and parameters: {'loss': 'coxph', 'learning_rate': 0.05015747045427306, 'n_estimators': 461, 'criterion': 'squared_error', 'min_samples_split': 10, 'min_samples_leaf': 3, 'min_weight_fraction_leaf': 0.07839100075155772, 'min_impurity_decrease': 0.9123946792597675, 'max_features': 0.6660114553073622, 'subsample': 0.35580479113587776, 'dropout_rate': 0.3738177027408294, 'ccp_alpha': 0.1615173898952948}. Best is trial 218 with value: 0.6659976583847056.[0m
[32m[I 2022-04-22 18:11:43,314][0m Trial 280 finished with value: 0.6502112986739208 and parameters: {'loss': 'coxph', 'learning_rate': 0.05539402533627727, 'n_estimators': 453, 'criterion': 'friedman_mse', 'min_samples_split': 10, 'min_samples_leaf': 3, 'min_weight_fraction_leaf': 0.06664628348778633, 'min_impurity_decrease': 0.9052391853764388, 'max_features': 0.6456380060852457, 'subsample': 0.3045497678086562, 'dropout_rate': 0.34878475834316003, 'ccp_alpha': 0.08246778513741318}. Best is trial 218 with value: 0.6659976583847056.[0m
[32m[I 2022-04-22 18:12:27,791][0m Trial 281 finished with value: 0.5 and parameters: {'loss': 'coxph', 'learning_rate': 0.04544918916180137, 'n_estimators': 484, 'criterion': 'friedman_mse', 'min_samples_split': 10, 'min_samples_leaf': 3, 'min_weight_fraction_leaf': 0.07715923467673894, 'min_impurity_decrease': 0.8917332601660776, 'max_features': 0.6252264249172278, 'subsample': 0.27698281520763696, 'dropout_rate': 0.4114290894385264, 'ccp_alpha': 1.811769234921476}. Best is trial 218 with value: 0.6659976583847056.[0m
[32m[I 2022-04-22 18:13:05,705][0m Trial 282 finished with value: 0.5 and parameters: {'loss': 'coxph', 'learning_rate': 0.09808056614016018, 'n_estimators': 433, 'criterion': 'friedman_mse', 'min_samples_split': 10, 'min_samples_leaf': 3, 'min_weight_fraction_leaf': 0.08862015790959299, 'min_impurity_decrease': 0.9213413504084325, 'max_features': 0.6096086392833655, 'subsample': 0.3164674819535086, 'dropout_rate': 0.36379875548602736, 'ccp_alpha': 2.075782563421326}. Best is trial 218 with value: 0.6659976583847056.[0m
[32m[I 2022-04-22 18:13:58,736][0m Trial 283 finished with value: 0.6613468175688186 and parameters: {'loss': 'coxph', 'learning_rate': 0.06715991300550989, 'n_estimators': 484, 'criterion': 'friedman_mse', 'min_samples_split': 10, 'min_samples_leaf': 3, 'min_weight_fraction_leaf': 0.06342400858466572, 'min_impurity_decrease': 0.916914321492311, 'max_features': 0.6629137341203112, 'subsample': 0.29119822672341755, 'dropout_rate': 0.33371558485055125, 'ccp_alpha': 0.010759813851591908}. Best is trial 218 with value: 0.6659976583847056.[0m
[32m[I 2022-04-22 18:14:43,740][0m Trial 284 finished with value: 0.5006540204610004 and parameters: {'loss': 'coxph', 'learning_rate': 0.06353524999350432, 'n_estimators': 463, 'criterion': 'friedman_mse', 'min_samples_split': 10, 'min_samples_leaf': 3, 'min_weight_fraction_leaf': 0.06468350780553224, 'min_impurity_decrease': 0.9083058442361043, 'max_features': 0.6833509530049734, 'subsample': 0.37543719781157986, 'dropout_rate': 0.3362971635439534, 'ccp_alpha': 0.2646700955552296}. Best is trial 218 with value: 0.6659976583847056.[0m
[32m[I 2022-04-22 18:15:36,005][0m Trial 285 finished with value: 0.6600921573721196 and parameters: {'loss': 'coxph', 'learning_rate': 0.03178431906663313, 'n_estimators': 488, 'criterion': 'friedman_mse', 'min_samples_split': 10, 'min_samples_leaf': 3, 'min_weight_fraction_leaf': 0.06955851393816223, 'min_impurity_decrease': 0.8826070370877879, 'max_features': 0.6490179897366692, 'subsample': 0.3415447598720796, 'dropout_rate': 0.3779588125346851, 'ccp_alpha': 0.005860516215205812}. Best is trial 218 with value: 0.6659976583847056.[0m
[32m[I 2022-04-22 18:16:17,256][0m Trial 286 finished with value: 0.6304326586986069 and parameters: {'loss': 'coxph', 'learning_rate': 0.0726628821153291, 'n_estimators': 448, 'criterion': 'friedman_mse', 'min_samples_split': 10, 'min_samples_leaf': 3, 'min_weight_fraction_leaf': 0.06619723650037856, 'min_impurity_decrease': 0.8867073027259548, 'max_features': 0.6542273201297325, 'subsample': 0.29338700079154506, 'dropout_rate': 0.3706993786716075, 'ccp_alpha': 0.15953028157800014}. Best is trial 218 with value: 0.6659976583847056.[0m
[32m[I 2022-04-22 18:17:02,366][0m Trial 287 finished with value: 0.6474984149409413 and parameters: {'loss': 'coxph', 'learning_rate': 0.04409589311937395, 'n_estimators': 473, 'criterion': 'friedman_mse', 'min_samples_split': 10, 'min_samples_leaf': 3, 'min_weight_fraction_leaf': 0.07053368378146696, 'min_impurity_decrease': 0.8528025896678029, 'max_features': 0.6391744628941213, 'subsample': 0.344808617711876, 'dropout_rate': 0.4237881978417135, 'ccp_alpha': 0.10514668077288303}. Best is trial 218 with value: 0.6659976583847056.[0m
[32m[I 2022-04-22 18:17:49,636][0m Trial 288 finished with value: 0.5 and parameters: {'loss': 'coxph', 'learning_rate': 0.03247620726768022, 'n_estimators': 489, 'criterion': 'friedman_mse', 'min_samples_split': 10, 'min_samples_leaf': 3, 'min_weight_fraction_leaf': 0.07859232952308001, 'min_impurity_decrease': 0.8861243640225652, 'max_features': 0.6325704419419172, 'subsample': 0.3223341007998905, 'dropout_rate': 0.3959786401098427, 'ccp_alpha': 2.323940270568079}. Best is trial 218 with value: 0.6659976583847056.[0m
[32m[I 2022-04-22 18:18:34,408][0m Trial 289 finished with value: 0.5989884671343602 and parameters: {'loss': 'coxph', 'learning_rate': 0.07638734487796825, 'n_estimators': 464, 'criterion': 'friedman_mse', 'min_samples_split': 10, 'min_samples_leaf': 3, 'min_weight_fraction_leaf': 0.08954201275749647, 'min_impurity_decrease': 0.9112757999136348, 'max_features': 0.5724314194717898, 'subsample': 0.27649610973594896, 'dropout_rate': 0.3355617689271514, 'ccp_alpha': 0.20321558447697177}. Best is trial 218 with value: 0.6659976583847056.[0m
[32m[I 2022-04-22 18:19:26,203][0m Trial 290 finished with value: 0.5181150201957231 and parameters: {'loss': 'coxph', 'learning_rate': 0.056387854602606965, 'n_estimators': 513, 'criterion': 'friedman_mse', 'min_samples_split': 10, 'min_samples_leaf': 3, 'min_weight_fraction_leaf': 0.06902139424432396, 'min_impurity_decrease': 0.9132136968956328, 'max_features': 0.6451797875680809, 'subsample': 0.30427768245499875, 'dropout_rate': 0.3803226644646858, 'ccp_alpha': 0.35767624670979375}. Best is trial 218 with value: 0.6659976583847056.[0m
[32m[I 2022-04-22 18:20:08,537][0m Trial 291 finished with value: 0.6619975105532583 and parameters: {'loss': 'coxph', 'learning_rate': 0.03072225415694376, 'n_estimators': 433, 'criterion': 'friedman_mse', 'min_samples_split': 10, 'min_samples_leaf': 3, 'min_weight_fraction_leaf': 0.06520969920587587, 'min_impurity_decrease': 0.8894550908617709, 'max_features': 0.6782135874952193, 'subsample': 0.3349636884917037, 'dropout_rate': 0.36403939131262175, 'ccp_alpha': 0.0014446669623673475}. Best is trial 218 with value: 0.6659976583847056.[0m
[32m[I 2022-04-22 18:20:48,031][0m Trial 292 finished with value: 0.6390860381581668 and parameters: {'loss': 'coxph', 'learning_rate': 0.029974050960850946, 'n_estimators': 427, 'criterion': 'friedman_mse', 'min_samples_split': 10, 'min_samples_leaf': 3, 'min_weight_fraction_leaf': 0.07510831865885319, 'min_impurity_decrease': 0.8870982303139372, 'max_features': 0.6657479639324134, 'subsample': 0.3481219992081132, 'dropout_rate': 0.3547577778113226, 'ccp_alpha': 0.09090558658810781}. Best is trial 218 with value: 0.6659976583847056.[0m
[32m[I 2022-04-22 18:21:27,346][0m Trial 293 finished with value: 0.6269728666069039 and parameters: {'loss': 'coxph', 'learning_rate': 0.04849184618172932, 'n_estimators': 439, 'criterion': 'friedman_mse', 'min_samples_split': 10, 'min_samples_leaf': 3, 'min_weight_fraction_leaf': 0.0610188374152057, 'min_impurity_decrease': 0.8729669663730957, 'max_features': 0.6822528570233135, 'subsample': 0.3366265419180755, 'dropout_rate': 0.3728917419834261, 'ccp_alpha': 0.16232862886925653}. Best is trial 218 with value: 0.6659976583847056.[0m
[32m[I 2022-04-22 18:22:14,213][0m Trial 294 finished with value: 0.6627036042581652 and parameters: {'loss': 'coxph', 'learning_rate': 0.06741945796834277, 'n_estimators': 477, 'criterion': 'friedman_mse', 'min_samples_split': 10, 'min_samples_leaf': 3, 'min_weight_fraction_leaf': 0.06619699186587044, 'min_impurity_decrease': 0.8454787156786484, 'max_features': 0.7152849649517637, 'subsample': 0.3167494106866966, 'dropout_rate': 0.40051081821127305, 'ccp_alpha': 0.006318756944430263}. Best is trial 218 with value: 0.6659976583847056.[0m
[32m[I 2022-04-22 18:22:58,264][0m Trial 295 finished with value: 0.5620197108933385 and parameters: {'loss': 'coxph', 'learning_rate': 0.07879729725575657, 'n_estimators': 478, 'criterion': 'friedman_mse', 'min_samples_split': 10, 'min_samples_leaf': 3, 'min_weight_fraction_leaf': 0.06687601045540147, 'min_impurity_decrease': 0.8440995510850798, 'max_features': 0.7048256066084531, 'subsample': 0.2921640133433996, 'dropout_rate': 0.4036008016034134, 'ccp_alpha': 0.2604980323147735}. Best is trial 218 with value: 0.6659976583847056.[0m
[32m[I 2022-04-22 18:23:49,433][0m Trial 296 finished with value: 0.6526996697354848 and parameters: {'loss': 'coxph', 'learning_rate': 0.0642350872046992, 'n_estimators': 524, 'criterion': 'friedman_mse', 'min_samples_split': 10, 'min_samples_leaf': 3, 'min_weight_fraction_leaf': 0.06287149292030675, 'min_impurity_decrease': 0.8522724255865696, 'max_features': 0.6844400287730543, 'subsample': 0.3182925564427647, 'dropout_rate': 0.43370307633065014, 'ccp_alpha': 0.09821662037145244}. Best is trial 218 with value: 0.6659976583847056.[0m
