[32m[I 2022-04-21 11:46:00,809][0m Trial 336 finished with value: 0.6309071927053286 and parameters: {'splitter': 'best', 'min_samples_split': 0.16216863359661557, 'min_samples_leaf': 0.025150473846272114, 'min_weight_fraction_leaf': 0.008587855455897648, 'max_features': 0.6846839942308837}. Best is trial 203 with value: 0.6541339470014573.[0m
[32m[I 2022-04-21 11:46:01,631][0m Trial 337 finished with value: 0.62862584325803 and parameters: {'splitter': 'best', 'min_samples_split': 0.18100770050280635, 'min_samples_leaf': 0.00920092027690346, 'min_weight_fraction_leaf': 0.017190286545175994, 'max_features': 0.6657084589334419}. Best is trial 203 with value: 0.6541339470014573.[0m
[32m[I 2022-04-21 11:46:02,301][0m Trial 338 finished with value: 0.6181456479973468 and parameters: {'splitter': 'best', 'min_samples_split': 0.19603453842910507, 'min_samples_leaf': 0.020996653342489485, 'min_weight_fraction_leaf': 0.026225787985572752, 'max_features': 0.7063210250821177}. Best is trial 203 with value: 0.6541339470014573.[0m
[32m[I 2022-04-21 11:46:02,830][0m Trial 339 finished with value: 0.6396134234829696 and parameters: {'splitter': 'best', 'min_samples_split': 0.21964764688617133, 'min_samples_leaf': 0.01078339017781436, 'min_weight_fraction_leaf': 0.009558526882296279, 'max_features': 0.6558201721599484}. Best is trial 203 with value: 0.6541339470014573.[0m
[32m[I 2022-04-21 11:46:03,103][0m Trial 340 finished with value: 0.618883531119129 and parameters: {'splitter': 'best', 'min_samples_split': 0.1437600606135763, 'min_samples_leaf': 0.04203818251546285, 'min_weight_fraction_leaf': 0.0005179228550266281, 'max_features': 0.567652112196896}. Best is trial 203 with value: 0.6541339470014573.[0m
[32m[I 2022-04-21 11:46:03,255][0m Trial 341 finished with value: 0.5398373364311787 and parameters: {'splitter': 'best', 'min_samples_split': 0.15731052220016936, 'min_samples_leaf': 0.4137931795212179, 'min_weight_fraction_leaf': 0.021632117762559067, 'max_features': 0.6224294927427515}. Best is trial 203 with value: 0.6541339470014573.[0m
[32m[I 2022-04-21 11:46:04,160][0m Trial 342 finished with value: 0.6133612167285328 and parameters: {'splitter': 'best', 'min_samples_split': 0.1319533098944003, 'min_samples_leaf': 0.02855202535234612, 'min_weight_fraction_leaf': 0.04461643620159267, 'max_features': 0.7191350794033238}. Best is trial 203 with value: 0.6541339470014573.[0m
[32m[I 2022-04-21 11:46:04,627][0m Trial 343 finished with value: 0.5133003329278907 and parameters: {'splitter': 'best', 'min_samples_split': 0.20512091621460676, 'min_samples_leaf': 0.017897871674484204, 'min_weight_fraction_leaf': 0.43861805334135706, 'max_features': 0.6861137384041143}. Best is trial 203 with value: 0.6541339470014573.[0m
[32m[I 2022-04-21 11:46:05,068][0m Trial 344 finished with value: 0.5231457408380825 and parameters: {'splitter': 'best', 'min_samples_split': 0.18069775735456922, 'min_samples_leaf': 0.008484458878509528, 'min_weight_fraction_leaf': 0.4951775686067626, 'max_features': 0.7368232500871825}. Best is trial 203 with value: 0.6541339470014573.[0m
[32m[I 2022-04-21 11:46:06,355][0m Trial 345 finished with value: 0.627290581617306 and parameters: {'splitter': 'best', 'min_samples_split': 0.12614280261034488, 'min_samples_leaf': 0.025111061579550543, 'min_weight_fraction_leaf': 0.010175985568866064, 'max_features': 0.7795156976688412}. Best is trial 203 with value: 0.6541339470014573.[0m
[32m[I 2022-04-21 11:46:07,388][0m Trial 346 finished with value: 0.6294865394094117 and parameters: {'splitter': 'best', 'min_samples_split': 0.17214967826608557, 'min_samples_leaf': 0.0011168391111119058, 'min_weight_fraction_leaf': 0.03238822789097051, 'max_features': 0.648691563740638}. Best is trial 203 with value: 0.6541339470014573.[0m
[32m[I 2022-04-21 11:46:07,853][0m Trial 347 finished with value: 0.640719973994716 and parameters: {'splitter': 'best', 'min_samples_split': 0.19139198955197126, 'min_samples_leaf': 0.016294376636929786, 'min_weight_fraction_leaf': 0.019166622548698713, 'max_features': 0.6977224295330696}. Best is trial 203 with value: 0.6541339470014573.[0m
[32m[I 2022-04-21 11:46:09,760][0m Trial 348 finished with value: 0.6300737827996936 and parameters: {'splitter': 'best', 'min_samples_split': 0.16192145548475104, 'min_samples_leaf': 0.0011120021793474613, 'min_weight_fraction_leaf': 0.0001413367994431182, 'max_features': 0.6743510146658189}. Best is trial 203 with value: 0.6541339470014573.[0m
[32m[I 2022-04-21 11:46:10,359][0m Trial 349 finished with value: 0.623601685434283 and parameters: {'splitter': 'best', 'min_samples_split': 0.14772551482597354, 'min_samples_leaf': 0.03431425476860142, 'min_weight_fraction_leaf': 0.010632287160615001, 'max_features': 0.5964801190635971}. Best is trial 203 with value: 0.6541339470014573.[0m
[32m[I 2022-04-21 11:46:10,774][0m Trial 350 finished with value: 0.6182516196476404 and parameters: {'splitter': 'best', 'min_samples_split': 0.21545839831282693, 'min_samples_leaf': 0.017799408400605232, 'min_weight_fraction_leaf': 0.021146498488129953, 'max_features': 0.707811207599904}. Best is trial 203 with value: 0.6541339470014573.[0m
[32m[I 2022-04-21 11:46:11,430][0m Trial 351 finished with value: 0.6354828337279875 and parameters: {'splitter': 'best', 'min_samples_split': 0.18237434096729777, 'min_samples_leaf': 0.009574433604794801, 'min_weight_fraction_leaf': 0.03241088787128656, 'max_features': 0.6190494119501293}. Best is trial 203 with value: 0.6541339470014573.[0m
[32m[I 2022-04-21 11:46:11,790][0m Trial 352 finished with value: 0.536760391755396 and parameters: {'splitter': 'best', 'min_samples_split': 0.3508522857942459, 'min_samples_leaf': 0.001010989035631708, 'min_weight_fraction_leaf': 0.37690613481375407, 'max_features': 0.6660575754368501}. Best is trial 203 with value: 0.6541339470014573.[0m
[32m[I 2022-04-21 11:46:12,339][0m Trial 353 finished with value: 0.6193711182649683 and parameters: {'splitter': 'best', 'min_samples_split': 0.1411983238476438, 'min_samples_leaf': 0.02798996166332085, 'min_weight_fraction_leaf': 0.009357221486571598, 'max_features': 0.7496617144100642}. Best is trial 203 with value: 0.6541339470014573.[0m
[32m[I 2022-04-21 11:46:12,765][0m Trial 354 finished with value: 0.6366830312463259 and parameters: {'splitter': 'best', 'min_samples_split': 0.20225081665955902, 'min_samples_leaf': 0.019126014706828842, 'min_weight_fraction_leaf': 0.01706359577694239, 'max_features': 0.6407486709542549}. Best is trial 203 with value: 0.6541339470014573.[0m
[32m[I 2022-04-21 11:46:13,204][0m Trial 355 finished with value: 0.6326114114854 and parameters: {'splitter': 'best', 'min_samples_split': 0.1548869023856438, 'min_samples_leaf': 0.012040475273826961, 'min_weight_fraction_leaf': 0.025379264959876184, 'max_features': 0.7238682627100443}. Best is trial 203 with value: 0.6541339470014573.[0m
[32m[I 2022-04-21 11:46:13,506][0m Trial 356 finished with value: 0.6191851904937359 and parameters: {'splitter': 'best', 'min_samples_split': 0.16977861597636792, 'min_samples_leaf': 0.0427206396425253, 'min_weight_fraction_leaf': 0.000291017329365751, 'max_features': 0.688693625173979}. Best is trial 203 with value: 0.6541339470014573.[0m
[32m[I 2022-04-21 11:46:14,090][0m Trial 357 finished with value: 0.6199249443791588 and parameters: {'splitter': 'best', 'min_samples_split': 0.11908211720324731, 'min_samples_leaf': 0.030179636382805932, 'min_weight_fraction_leaf': 0.009722882285469652, 'max_features': 0.6117838809060281}. Best is trial 203 with value: 0.6541339470014573.[0m
[32m[I 2022-04-21 11:46:14,785][0m Trial 358 finished with value: 0.6307233607802715 and parameters: {'splitter': 'best', 'min_samples_split': 0.19302345041428465, 'min_samples_leaf': 0.02059994296236467, 'min_weight_fraction_leaf': 0.016197214668739836, 'max_features': 0.5343649030410946}. Best is trial 203 with value: 0.6541339470014573.[0m
[32m[I 2022-04-21 11:46:15,495][0m Trial 359 finished with value: 0.6296540450958041 and parameters: {'splitter': 'best', 'min_samples_split': 0.1293935406395773, 'min_samples_leaf': 0.00955923996754287, 'min_weight_fraction_leaf': 0.03805661274627419, 'max_features': 0.5727452192556549}. Best is trial 203 with value: 0.6541339470014573.[0m
[32m[I 2022-04-21 11:46:16,164][0m Trial 360 finished with value: 0.6280904497069116 and parameters: {'splitter': 'best', 'min_samples_split': 0.17503438036142765, 'min_samples_leaf': 0.022822571997633385, 'min_weight_fraction_leaf': 0.02630597199896613, 'max_features': 0.667157368613377}. Best is trial 203 with value: 0.6541339470014573.[0m
[32m[I 2022-04-21 11:46:16,807][0m Trial 361 finished with value: 0.6082819582806474 and parameters: {'splitter': 'best', 'min_samples_split': 0.16267855358530062, 'min_samples_leaf': 0.011792504777087449, 'min_weight_fraction_leaf': 0.04889577803395509, 'max_features': 0.7133393264144279}. Best is trial 203 with value: 0.6541339470014573.[0m
[32m[I 2022-04-21 11:46:18,509][0m Trial 362 finished with value: 0.648154853663883 and parameters: {'splitter': 'best', 'min_samples_split': 0.1386861920325968, 'min_samples_leaf': 0.0016018134869180863, 'min_weight_fraction_leaf': 3.398006230504422e-05, 'max_features': 0.6400291629826118}. Best is trial 203 with value: 0.6541339470014573.[0m
[32m[I 2022-04-21 11:46:18,734][0m Trial 363 finished with value: 0.5489684846079532 and parameters: {'splitter': 'best', 'min_samples_split': 0.1457913510610778, 'min_samples_leaf': 0.002840835789247805, 'min_weight_fraction_leaf': 0.2840367319050688, 'max_features': 0.6321123745401594}. Best is trial 203 with value: 0.6541339470014573.[0m
[32m[I 2022-04-21 11:46:19,056][0m Trial 364 finished with value: 0.6385370628132984 and parameters: {'splitter': 'best', 'min_samples_split': 0.13864457365957805, 'min_samples_leaf': 0.034266687886939894, 'min_weight_fraction_leaf': 0.008645224698294325, 'max_features': 0.6466451892161662}. Best is trial 203 with value: 0.6541339470014573.[0m
[32m[I 2022-04-21 11:46:19,567][0m Trial 365 finished with value: 0.6253186033588967 and parameters: {'splitter': 'best', 'min_samples_split': 0.12972551423276757, 'min_samples_leaf': 0.017518776521348124, 'min_weight_fraction_leaf': 0.015976594048382774, 'max_features': 0.5888298261965339}. Best is trial 203 with value: 0.6541339470014573.[0m
[32m[I 2022-04-21 11:46:19,988][0m Trial 366 finished with value: 0.5790384649433202 and parameters: {'splitter': 'best', 'min_samples_split': 0.15449020662741958, 'min_samples_leaf': 0.0011676490646631218, 'min_weight_fraction_leaf': 0.18943606591719656, 'max_features': 0.6115256157521951}. Best is trial 203 with value: 0.6541339470014573.[0m
[32m[I 2022-04-21 11:46:20,867][0m Trial 367 finished with value: 0.6341778020052372 and parameters: {'splitter': 'best', 'min_samples_split': 0.11455055992677654, 'min_samples_leaf': 0.010007896098508696, 'min_weight_fraction_leaf': 0.00023779253148130435, 'max_features': 0.6344465785546937}. Best is trial 203 with value: 0.6541339470014573.[0m
[32m[I 2022-04-21 11:46:21,939][0m Trial 368 finished with value: 0.6199816394260658 and parameters: {'splitter': 'best', 'min_samples_split': 0.13720426103833006, 'min_samples_leaf': 0.02526389484113458, 'min_weight_fraction_leaf': 0.030546649013410934, 'max_features': 0.6529827332737583}. Best is trial 203 with value: 0.6541339470014573.[0m
[32m[I 2022-04-21 11:46:23,467][0m Trial 369 finished with value: 0.6358344481481583 and parameters: {'splitter': 'best', 'min_samples_split': 0.15474617850075442, 'min_samples_leaf': 0.001125343638355692, 'min_weight_fraction_leaf': 0.019096056678853855, 'max_features': 0.6787581600107488}. Best is trial 203 with value: 0.6541339470014573.[0m
[32m[I 2022-04-21 11:46:24,311][0m Trial 370 finished with value: 0.6425294348651447 and parameters: {'splitter': 'best', 'min_samples_split': 0.22862895605004976, 'min_samples_leaf': 0.018364547252187436, 'min_weight_fraction_leaf': 0.00989058200038548, 'max_features': 0.6253447784025332}. Best is trial 203 with value: 0.6541339470014573.[0m
[32m[I 2022-04-21 11:46:24,838][0m Trial 371 finished with value: 0.5667883688951354 and parameters: {'splitter': 'best', 'min_samples_split': 0.23656562998069625, 'min_samples_leaf': 0.04215660085830389, 'min_weight_fraction_leaf': 0.2373392563437953, 'max_features': 0.5940530598846515}. Best is trial 203 with value: 0.6541339470014573.[0m
[32m[I 2022-04-21 11:46:25,491][0m Trial 372 finished with value: 0.6097413833797043 and parameters: {'splitter': 'best', 'min_samples_split': 0.24504395456847813, 'min_samples_leaf': 0.03406778008865129, 'min_weight_fraction_leaf': 0.010101311189241163, 'max_features': 0.6102982612063662}. Best is trial 203 with value: 0.6541339470014573.[0m
[32m[I 2022-04-21 11:46:25,993][0m Trial 373 finished with value: 0.6422847798929021 and parameters: {'splitter': 'best', 'min_samples_split': 0.21987721345215946, 'min_samples_leaf': 0.020555042087167748, 'min_weight_fraction_leaf': 0.0003079366022912767, 'max_features': 0.6210927906094339}. Best is trial 203 with value: 0.6541339470014573.[0m
[32m[I 2022-04-21 11:46:26,426][0m Trial 374 finished with value: 0.6109834969743074 and parameters: {'splitter': 'best', 'min_samples_split': 0.21902232551411185, 'min_samples_leaf': 0.048511304563829696, 'min_weight_fraction_leaf': 0.0251113984756155, 'max_features': 0.6183323939464455}. Best is trial 203 with value: 0.6541339470014573.[0m
[32m[I 2022-04-21 11:46:26,829][0m Trial 375 finished with value: 0.6253515168171642 and parameters: {'splitter': 'best', 'min_samples_split': 0.22820895606529237, 'min_samples_leaf': 0.024853993133464224, 'min_weight_fraction_leaf': 0.00878316014600659, 'max_features': 0.5705738553343452}. Best is trial 203 with value: 0.6541339470014573.[0m
[32m[I 2022-04-21 11:46:27,042][0m Trial 376 finished with value: 0.5421960700702187 and parameters: {'splitter': 'best', 'min_samples_split': 0.10361352862423504, 'min_samples_leaf': 0.01911670525709324, 'min_weight_fraction_leaf': 0.33485562993919, 'max_features': 0.6266907575539482}. Best is trial 203 with value: 0.6541339470014573.[0m
[32m[I 2022-04-21 11:46:27,387][0m Trial 377 finished with value: 0.6237102139056712 and parameters: {'splitter': 'best', 'min_samples_split': 0.2332892538597716, 'min_samples_leaf': 0.03242783167680754, 'min_weight_fraction_leaf': 0.008756294954594138, 'max_features': 0.6000754093810289}. Best is trial 203 with value: 0.6541339470014573.[0m
[32m[I 2022-04-21 11:46:27,916][0m Trial 378 finished with value: 0.6247417321001356 and parameters: {'splitter': 'best', 'min_samples_split': 0.20647824095942838, 'min_samples_leaf': 0.017335380290265913, 'min_weight_fraction_leaf': 0.00014189407011514117, 'max_features': 0.6314363733264707}. Best is trial 203 with value: 0.6541339470014573.[0m
[32m[I 2022-04-21 11:46:28,214][0m Trial 379 finished with value: 0.607838309594349 and parameters: {'splitter': 'best', 'min_samples_split': 0.12172473373892212, 'min_samples_leaf': 0.022923379790128318, 'min_weight_fraction_leaf': 0.12407447698300489, 'max_features': 0.5951186053110579}. Best is trial 203 with value: 0.6541339470014573.[0m
[32m[I 2022-04-21 11:46:28,708][0m Trial 380 finished with value: 0.6263949789968225 and parameters: {'splitter': 'best', 'min_samples_split': 0.22594376395078222, 'min_samples_leaf': 0.010713251460934142, 'min_weight_fraction_leaf': 0.03620370808751744, 'max_features': 0.6464222800743203}. Best is trial 203 with value: 0.6541339470014573.[0m
[32m[I 2022-04-21 11:46:29,075][0m Trial 381 finished with value: 0.6262190271806605 and parameters: {'splitter': 'best', 'min_samples_split': 0.14584470470587807, 'min_samples_leaf': 0.03391635709210733, 'min_weight_fraction_leaf': 0.022456557534657244, 'max_features': 0.546933758961532}. Best is trial 203 with value: 0.6541339470014573.[0m
[32m[I 2022-04-21 11:46:29,237][0m Trial 382 finished with value: 0.5760388654110253 and parameters: {'splitter': 'best', 'min_samples_split': 0.24956033150462914, 'min_samples_leaf': 0.16152135706098442, 'min_weight_fraction_leaf': 0.016057303647607078, 'max_features': 0.5753075483070265}. Best is trial 203 with value: 0.6541339470014573.[0m
[32m[I 2022-04-21 11:46:30,055][0m Trial 383 finished with value: 0.6458357972929767 and parameters: {'splitter': 'best', 'min_samples_split': 0.12839085775947642, 'min_samples_leaf': 0.01692749229904872, 'min_weight_fraction_leaf': 0.008392289547909042, 'max_features': 0.6189675877386557}. Best is trial 203 with value: 0.6541339470014573.[0m
[32m[I 2022-04-21 11:46:31,141][0m Trial 384 finished with value: 0.6187220883578518 and parameters: {'splitter': 'best', 'min_samples_split': 0.12679874599322868, 'min_samples_leaf': 0.0015627372067374065, 'min_weight_fraction_leaf': 0.028950405027583, 'max_features': 0.6570641804171087}. Best is trial 203 with value: 0.6541339470014573.[0m
[32m[I 2022-04-21 11:46:31,763][0m Trial 385 finished with value: 0.6311868522917594 and parameters: {'splitter': 'best', 'min_samples_split': 0.10495238143331762, 'min_samples_leaf': 0.011624606950044327, 'min_weight_fraction_leaf': 0.042558555703567515, 'max_features': 0.6398728627702077}. Best is trial 203 with value: 0.6541339470014573.[0m
[32m[I 2022-04-21 11:46:32,444][0m Trial 386 finished with value: 0.6333521129725128 and parameters: {'splitter': 'best', 'min_samples_split': 0.1398714944272246, 'min_samples_leaf': 0.02917517304949003, 'min_weight_fraction_leaf': 0.016454979749134974, 'max_features': 0.6081710342140353}. Best is trial 203 with value: 0.6541339470014573.[0m
[32m[I 2022-04-21 11:46:33,076][0m Trial 387 finished with value: 0.6306290833274661 and parameters: {'splitter': 'best', 'min_samples_split': 0.1192591287491323, 'min_samples_leaf': 0.016155388172108272, 'min_weight_fraction_leaf': 0.009960021356378128, 'max_features': 0.5805833246464633}. Best is trial 203 with value: 0.6541339470014573.[0m
[32m[I 2022-04-21 11:46:33,795][0m Trial 388 finished with value: 0.6411145301107293 and parameters: {'splitter': 'best', 'min_samples_split': 0.13160483100280987, 'min_samples_leaf': 0.008980836104791619, 'min_weight_fraction_leaf': 0.02497355550677361, 'max_features': 0.7958237734645124}. Best is trial 203 with value: 0.6541339470014573.[0m
[32m[I 2022-04-21 11:46:35,064][0m Trial 389 finished with value: 0.6264243885870012 and parameters: {'splitter': 'best', 'min_samples_split': 0.14901178384930996, 'min_samples_leaf': 0.001134988334860568, 'min_weight_fraction_leaf': 0.009654846311277197, 'max_features': 0.6627275016593858}. Best is trial 203 with value: 0.6541339470014573.[0m
[32m[I 2022-04-21 11:46:35,128][0m Trial 390 finished with value: 0.536760391755396 and parameters: {'splitter': 'best', 'min_samples_split': 0.09422521894926672, 'min_samples_leaf': 0.3535949392904551, 'min_weight_fraction_leaf': 0.03428234946685045, 'max_features': 0.5104628946451228}. Best is trial 203 with value: 0.6541339470014573.[0m
[32m[I 2022-04-21 11:46:35,494][0m Trial 391 finished with value: 0.6470415563707652 and parameters: {'splitter': 'best', 'min_samples_split': 0.11426166267479203, 'min_samples_leaf': 0.02520314803145437, 'min_weight_fraction_leaf': 0.019299229845406475, 'max_features': 0.6261054487574562}. Best is trial 203 with value: 0.6541339470014573.[0m
[32m[I 2022-04-21 11:46:36,096][0m Trial 392 finished with value: 0.6187875956045783 and parameters: {'splitter': 'best', 'min_samples_split': 0.10807115338434076, 'min_samples_leaf': 0.04422678078263751, 'min_weight_fraction_leaf': 0.023740159215694934, 'max_features': 0.6238353587959026}. Best is trial 203 with value: 0.6541339470014573.[0m
[32m[I 2022-04-21 11:46:36,736][0m Trial 393 finished with value: 0.6162752626181773 and parameters: {'splitter': 'best', 'min_samples_split': 0.11259063936776764, 'min_samples_leaf': 0.03770345113764115, 'min_weight_fraction_leaf': 0.009192906472915985, 'max_features': 0.5600542340769288}. Best is trial 203 with value: 0.6541339470014573.[0m
[32m[I 2022-04-21 11:46:37,375][0m Trial 394 finished with value: 0.6298365800879883 and parameters: {'splitter': 'best', 'min_samples_split': 0.12387895960217611, 'min_samples_leaf': 0.02656926764459744, 'min_weight_fraction_leaf': 0.018959501059329482, 'max_features': 0.6008510710293112}. Best is trial 203 with value: 0.6541339470014573.[0m
[32m[I 2022-04-21 11:46:37,765][0m Trial 395 finished with value: 0.6127581308155117 and parameters: {'splitter': 'best', 'min_samples_split': 0.1267193527402545, 'min_samples_leaf': 0.023914919051695252, 'min_weight_fraction_leaf': 0.04814187991358539, 'max_features': 0.6264204896860137}. Best is trial 203 with value: 0.6541339470014573.[0m
[32m[I 2022-04-21 11:46:38,211][0m Trial 396 finished with value: 0.6289020184637861 and parameters: {'splitter': 'best', 'min_samples_split': 0.13705871937573105, 'min_samples_leaf': 0.017319359903955552, 'min_weight_fraction_leaf': 0.03351403334632367, 'max_features': 0.5845607723961649}. Best is trial 203 with value: 0.6541339470014573.[0m
[32m[I 2022-04-21 11:46:38,550][0m Trial 397 finished with value: 0.6178714804244572 and parameters: {'splitter': 'best', 'min_samples_split': 0.13204687935115197, 'min_samples_leaf': 0.03350869868131416, 'min_weight_fraction_leaf': 7.641467604905736e-05, 'max_features': 0.644367463192169}. Best is trial 203 with value: 0.6541339470014573.[0m
[32m[I 2022-04-21 11:46:38,810][0m Trial 398 finished with value: 0.6271261363591843 and parameters: {'splitter': 'best', 'min_samples_split': 0.11129919430844334, 'min_samples_leaf': 0.05090779148488456, 'min_weight_fraction_leaf': 0.014644119094674798, 'max_features': 0.6140182482381241}. Best is trial 203 with value: 0.6541339470014573.[0m
