[32m[I 2022-04-21 15:27:14,054][0m Trial 480 finished with value: 0.2503270102305002 and parameters: {'loss': 'coxph', 'learning_rate': 0.015127169833458902, 'n_estimators': 560, 'criterion': 'friedman_mse', 'min_samples_split': 2, 'min_samples_leaf': 4, 'min_weight_fraction_leaf': 0.04374419476245854, 'min_impurity_decrease': 0.4980691455885868, 'max_features': 0.47369636984480423, 'subsample': 0.5196577401389105, 'dropout_rate': 0.9496719195921728, 'ccp_alpha': 0.24305743536402513}. Best is trial 434 with value: 0.8310153865446737.[0m
[32m[I 2022-04-21 15:27:41,766][0m Trial 481 finished with value: 0.8234647886737738 and parameters: {'loss': 'coxph', 'learning_rate': 0.0809575042550048, 'n_estimators': 596, 'criterion': 'friedman_mse', 'min_samples_split': 2, 'min_samples_leaf': 5, 'min_weight_fraction_leaf': 0.05874840413346722, 'min_impurity_decrease': 0.45370911348081727, 'max_features': 0.5208009443523894, 'subsample': 0.4160470188166215, 'dropout_rate': 0.9585499986651216, 'ccp_alpha': 0.09702275340334317}. Best is trial 434 with value: 0.8310153865446737.[0m
[32m[I 2022-04-21 15:28:00,853][0m Trial 482 finished with value: 0.3877362040574927 and parameters: {'loss': 'coxph', 'learning_rate': 0.01118967241733766, 'n_estimators': 650, 'criterion': 'friedman_mse', 'min_samples_split': 2, 'min_samples_leaf': 4, 'min_weight_fraction_leaf': 0.04950138279134324, 'min_impurity_decrease': 0.48167532356819215, 'max_features': 0.5426792638151797, 'subsample': 0.4615759637920456, 'dropout_rate': 0.9762175772728633, 'ccp_alpha': 0.1665485424081673}. Best is trial 434 with value: 0.8310153865446737.[0m
[32m[I 2022-04-21 15:28:22,881][0m Trial 483 finished with value: 0.8314609961568491 and parameters: {'loss': 'coxph', 'learning_rate': 0.015998933413385163, 'n_estimators': 527, 'criterion': 'friedman_mse', 'min_samples_split': 2, 'min_samples_leaf': 4, 'min_weight_fraction_leaf': 0.06363310120029102, 'min_impurity_decrease': 0.5239158906255384, 'max_features': 0.3828665331921316, 'subsample': 0.37785810835528927, 'dropout_rate': 0.9451886005874055, 'ccp_alpha': 0.0016666094195924286}. Best is trial 483 with value: 0.8314609961568491.[0m
[32m[I 2022-04-21 15:28:50,865][0m Trial 484 finished with value: 0.25662745571200507 and parameters: {'loss': 'coxph', 'learning_rate': 0.024855470542294863, 'n_estimators': 523, 'criterion': 'friedman_mse', 'min_samples_split': 2, 'min_samples_leaf': 4, 'min_weight_fraction_leaf': 0.03715200769147961, 'min_impurity_decrease': 0.5340342332452795, 'max_features': 0.5026499003341074, 'subsample': 0.383591145609714, 'dropout_rate': 0.9434829467198368, 'ccp_alpha': 0.2944563355183773}. Best is trial 483 with value: 0.8314609961568491.[0m
[32m[I 2022-04-21 15:29:11,461][0m Trial 485 finished with value: 0.8246798144190345 and parameters: {'loss': 'coxph', 'learning_rate': 0.016076595463726334, 'n_estimators': 552, 'criterion': 'friedman_mse', 'min_samples_split': 2, 'min_samples_leaf': 4, 'min_weight_fraction_leaf': 0.06442223368926689, 'min_impurity_decrease': 0.5278435356995824, 'max_features': 0.42049117591652707, 'subsample': 0.36931400887983806, 'dropout_rate': 0.9605312646568858, 'ccp_alpha': 0.08648243033562265}. Best is trial 483 with value: 0.8314609961568491.[0m
[32m[I 2022-04-21 15:29:45,092][0m Trial 486 finished with value: 0.8320137528916117 and parameters: {'loss': 'coxph', 'learning_rate': 0.012297842820285466, 'n_estimators': 616, 'criterion': 'friedman_mse', 'min_samples_split': 2, 'min_samples_leaf': 4, 'min_weight_fraction_leaf': 0.053252770342670785, 'min_impurity_decrease': 0.5106540337772149, 'max_features': 0.3771393197973207, 'subsample': 0.4035792650594938, 'dropout_rate': 0.9444018995787195, 'ccp_alpha': 0.0012570896301270413}. Best is trial 486 with value: 0.8320137528916117.[0m
[32m[I 2022-04-21 15:30:16,553][0m Trial 487 finished with value: 0.8283886812610955 and parameters: {'loss': 'coxph', 'learning_rate': 0.011739541820116476, 'n_estimators': 628, 'criterion': 'friedman_mse', 'min_samples_split': 2, 'min_samples_leaf': 5, 'min_weight_fraction_leaf': 0.029942400241445392, 'min_impurity_decrease': 0.5237412304340237, 'max_features': 0.36926079420558766, 'subsample': 0.41824289714144747, 'dropout_rate': 0.9399738968249395, 'ccp_alpha': 0.0011259203376185393}. Best is trial 486 with value: 0.8320137528916117.[0m
[32m[I 2022-04-21 15:30:46,412][0m Trial 488 finished with value: 0.3815030876467311 and parameters: {'loss': 'coxph', 'learning_rate': 0.012123225502863558, 'n_estimators': 629, 'criterion': 'friedman_mse', 'min_samples_split': 2, 'min_samples_leaf': 5, 'min_weight_fraction_leaf': 0.022603676515208122, 'min_impurity_decrease': 0.547446453879172, 'max_features': 0.38085194188185495, 'subsample': 0.43735776415012, 'dropout_rate': 0.9430218078420994, 'ccp_alpha': 0.1789227011349164}. Best is trial 486 with value: 0.8320137528916117.[0m
[32m[I 2022-04-21 15:31:10,761][0m Trial 489 finished with value: 0.8219089283414698 and parameters: {'loss': 'coxph', 'learning_rate': 0.013001391273883453, 'n_estimators': 678, 'criterion': 'friedman_mse', 'min_samples_split': 2, 'min_samples_leaf': 5, 'min_weight_fraction_leaf': 0.014512579615589764, 'min_impurity_decrease': 0.5276521848947476, 'max_features': 0.3467944621892344, 'subsample': 0.4218297572265456, 'dropout_rate': 0.9863033231725932, 'ccp_alpha': 0.10743824691682193}. Best is trial 486 with value: 0.8320137528916117.[0m
[32m[I 2022-04-21 15:31:49,315][0m Trial 490 finished with value: 0.25 and parameters: {'loss': 'coxph', 'learning_rate': 0.00978784159252075, 'n_estimators': 597, 'criterion': 'friedman_mse', 'min_samples_split': 2, 'min_samples_leaf': 6, 'min_weight_fraction_leaf': 0.03128805333772325, 'min_impurity_decrease': 0.5150454672696128, 'max_features': 0.3428708596766049, 'subsample': 0.4039111688934469, 'dropout_rate': 0.9417753120592882, 'ccp_alpha': 0.4417544139237248}. Best is trial 486 with value: 0.8320137528916117.[0m
[32m[I 2022-04-21 15:32:11,202][0m Trial 491 finished with value: 0.25 and parameters: {'loss': 'coxph', 'learning_rate': 0.02204821067238217, 'n_estimators': 639, 'criterion': 'friedman_mse', 'min_samples_split': 2, 'min_samples_leaf': 5, 'min_weight_fraction_leaf': 0.02710728034291257, 'min_impurity_decrease': 0.5358747513371649, 'max_features': 0.36193122847375275, 'subsample': 0.45885216751136193, 'dropout_rate': 0.981713109626598, 'ccp_alpha': 2.8929457115888417}. Best is trial 486 with value: 0.8320137528916117.[0m
[32m[I 2022-04-21 15:32:37,766][0m Trial 492 finished with value: 0.25662745571200507 and parameters: {'loss': 'coxph', 'learning_rate': 0.010200100786008082, 'n_estimators': 614, 'criterion': 'friedman_mse', 'min_samples_split': 2, 'min_samples_leaf': 5, 'min_weight_fraction_leaf': 0.04053913509323244, 'min_impurity_decrease': 0.5157630040622689, 'max_features': 0.31161851676688207, 'subsample': 0.4337375076064542, 'dropout_rate': 0.9612110412605761, 'ccp_alpha': 0.2348989416554003}. Best is trial 486 with value: 0.8320137528916117.[0m
/media/san2_ssd/data/Workdir/survival/venv/lib/python3.8/site-packages/sksurv/ensemble/boosting.py:955: RuntimeWarning: divide by zero encountered in log
  time = numpy.log(time)
/media/san2_ssd/data/Workdir/survival/venv/lib/python3.8/site-packages/sksurv/ensemble/boosting.py:955: RuntimeWarning: divide by zero encountered in log
  time = numpy.log(time)
/media/san2_ssd/data/Workdir/survival/venv/lib/python3.8/site-packages/sksurv/ensemble/boosting.py:955: RuntimeWarning: divide by zero encountered in log
  time = numpy.log(time)
/media/san2_ssd/data/Workdir/survival/venv/lib/python3.8/site-packages/sksurv/ensemble/boosting.py:955: RuntimeWarning: divide by zero encountered in log
  time = numpy.log(time)
[32m[I 2022-04-21 15:32:45,713][0m Trial 493 finished with value: -0.46683100416149054 and parameters: {'loss': 'squared', 'learning_rate': 0.014300462093069245, 'n_estimators': 723, 'criterion': 'friedman_mse', 'min_samples_split': 2, 'min_samples_leaf': 4, 'min_weight_fraction_leaf': 0.011692672347035717, 'min_impurity_decrease': 0.5440909825103264, 'max_features': 0.35001633370902024, 'subsample': 0.4091630765754776, 'dropout_rate': 0.9382511484310755, 'ccp_alpha': 0.09771508875238707}. Best is trial 486 with value: 0.8320137528916117.[0m
[32m[I 2022-04-21 15:33:25,467][0m Trial 494 finished with value: 0.826891060561055 and parameters: {'loss': 'coxph', 'learning_rate': 0.020433198060910266, 'n_estimators': 765, 'criterion': 'friedman_mse', 'min_samples_split': 2, 'min_samples_leaf': 4, 'min_weight_fraction_leaf': 0.04975023149590613, 'min_impurity_decrease': 0.5105271838740404, 'max_features': 0.3947353231786533, 'subsample': 0.37846429897783623, 'dropout_rate': 0.9743677625672134, 'ccp_alpha': 0.10356038576498638}. Best is trial 486 with value: 0.8320137528916117.[0m
[32m[I 2022-04-21 15:33:51,118][0m Trial 495 finished with value: 0.8276813958794553 and parameters: {'loss': 'coxph', 'learning_rate': 0.009258679257587981, 'n_estimators': 583, 'criterion': 'friedman_mse', 'min_samples_split': 2, 'min_samples_leaf': 5, 'min_weight_fraction_leaf': 0.03340071401720425, 'min_impurity_decrease': 0.501196783990675, 'max_features': 0.3962250258989296, 'subsample': 0.44560635685594385, 'dropout_rate': 0.9474125407436038, 'ccp_alpha': 0.0035460225612357257}. Best is trial 486 with value: 0.8320137528916117.[0m
[32m[I 2022-04-21 15:34:21,468][0m Trial 496 finished with value: 0.8296297628283993 and parameters: {'loss': 'coxph', 'learning_rate': 0.01247120095502552, 'n_estimators': 684, 'criterion': 'friedman_mse', 'min_samples_split': 2, 'min_samples_leaf': 4, 'min_weight_fraction_leaf': 0.049668708947850734, 'min_impurity_decrease': 0.5276185160450758, 'max_features': 0.39537704063975154, 'subsample': 0.4141355464445641, 'dropout_rate': 0.9698180795343907, 'ccp_alpha': 0.0016963497824889948}. Best is trial 486 with value: 0.8320137528916117.[0m
[32m[I 2022-04-21 15:34:48,561][0m Trial 497 finished with value: 0.48330346562992554 and parameters: {'loss': 'coxph', 'learning_rate': 0.028714448458356464, 'n_estimators': 686, 'criterion': 'friedman_mse', 'min_samples_split': 2, 'min_samples_leaf': 4, 'min_weight_fraction_leaf': 0.05192694210830292, 'min_impurity_decrease': 0.4951671910027731, 'max_features': 0.4545348045432408, 'subsample': 0.4072708773325754, 'dropout_rate': 0.9876665409434093, 'ccp_alpha': 0.1852837426938858}. Best is trial 486 with value: 0.8320137528916117.[0m
[32m[I 2022-04-21 15:34:58,139][0m Trial 498 finished with value: 0.488113124688392 and parameters: {'loss': 'coxph', 'learning_rate': 0.015776240608232305, 'n_estimators': 489, 'criterion': 'friedman_mse', 'min_samples_split': 2, 'min_samples_leaf': 4, 'min_weight_fraction_leaf': 0.05488484287915754, 'min_impurity_decrease': 0.5031401855057736, 'max_features': 0.3985750418838666, 'subsample': 0.3767376617305209, 'dropout_rate': 0.9998444555768131, 'ccp_alpha': 0.18120117635805455}. Best is trial 486 with value: 0.8320137528916117.[0m
[32m[I 2022-04-21 15:35:41,366][0m Trial 499 finished with value: 0.25 and parameters: {'loss': 'coxph', 'learning_rate': 0.01277593554752932, 'n_estimators': 841, 'criterion': 'squared_error', 'min_samples_split': 2, 'min_samples_leaf': 4, 'min_weight_fraction_leaf': 0.04804587499453883, 'min_impurity_decrease': 0.5363689113102521, 'max_features': 0.3286910249731813, 'subsample': 0.39229833080253534, 'dropout_rate': 0.9750147408436163, 'ccp_alpha': 0.09914173583607687}. Best is trial 486 with value: 0.8320137528916117.[0m
[32m[I 2022-04-21 15:36:31,150][0m Trial 500 finished with value: 0.25 and parameters: {'loss': 'coxph', 'learning_rate': 0.04349267646632973, 'n_estimators': 706, 'criterion': 'absolute_error', 'min_samples_split': 2, 'min_samples_leaf': 4, 'min_weight_fraction_leaf': 0.05849603920783758, 'min_impurity_decrease': 0.4944583375729344, 'max_features': 0.4086606837979506, 'subsample': 0.47580161788750663, 'dropout_rate': 0.9641073492436255, 'ccp_alpha': 0.3240195070926529}. Best is trial 486 with value: 0.8320137528916117.[0m
[32m[I 2022-04-21 15:36:43,871][0m Trial 501 finished with value: 0.2503270102305002 and parameters: {'loss': 'coxph', 'learning_rate': 0.008816643950883739, 'n_estimators': 532, 'criterion': 'friedman_mse', 'min_samples_split': 2, 'min_samples_leaf': 4, 'min_weight_fraction_leaf': 0.04430638692592248, 'min_impurity_decrease': 0.4777845446001426, 'max_features': 0.4243616277813885, 'subsample': 0.44816579690128483, 'dropout_rate': 0.9994191281855292, 'ccp_alpha': 0.2627487526833312}. Best is trial 486 with value: 0.8320137528916117.[0m
[32m[I 2022-04-21 15:37:20,063][0m Trial 502 finished with value: 0.8288496584165366 and parameters: {'loss': 'coxph', 'learning_rate': 0.018459336898591118, 'n_estimators': 677, 'criterion': 'friedman_mse', 'min_samples_split': 2, 'min_samples_leaf': 4, 'min_weight_fraction_leaf': 0.06344130533261719, 'min_impurity_decrease': 0.515603408942503, 'max_features': 0.39377301440258783, 'subsample': 0.4266921496893025, 'dropout_rate': 0.9581147104865791, 'ccp_alpha': 0.004056176783643698}. Best is trial 486 with value: 0.8320137528916117.[0m
[32m[I 2022-04-21 15:37:49,192][0m Trial 503 finished with value: 0.8237063136837086 and parameters: {'loss': 'coxph', 'learning_rate': 0.020318713407008856, 'n_estimators': 656, 'criterion': 'friedman_mse', 'min_samples_split': 2, 'min_samples_leaf': 4, 'min_weight_fraction_leaf': 0.06500006810954541, 'min_impurity_decrease': 0.5505296444178341, 'max_features': 0.38980972035126393, 'subsample': 0.4253009703356037, 'dropout_rate': 0.9664487526237773, 'ccp_alpha': 0.09065188696067221}. Best is trial 486 with value: 0.8320137528916117.[0m
[32m[I 2022-04-21 15:38:14,104][0m Trial 504 finished with value: 0.3811755851689217 and parameters: {'loss': 'coxph', 'learning_rate': 0.034403065908539865, 'n_estimators': 688, 'criterion': 'friedman_mse', 'min_samples_split': 2, 'min_samples_leaf': 4, 'min_weight_fraction_leaf': 0.04027001375975831, 'min_impurity_decrease': 0.5201518764459451, 'max_features': 0.4359785541959833, 'subsample': 0.4881847596488469, 'dropout_rate': 0.9765448421717792, 'ccp_alpha': 0.17945070907268337}. Best is trial 486 with value: 0.8320137528916117.[0m
[32m[I 2022-04-21 15:38:51,807][0m Trial 505 finished with value: 0.8286558340684476 and parameters: {'loss': 'coxph', 'learning_rate': 0.019531128487493245, 'n_estimators': 738, 'criterion': 'friedman_mse', 'min_samples_split': 2, 'min_samples_leaf': 4, 'min_weight_fraction_leaf': 0.05907243395534397, 'min_impurity_decrease': 0.5167598019442693, 'max_features': 0.37242867499056603, 'subsample': 0.39890201872289405, 'dropout_rate': 0.955806045187635, 'ccp_alpha': 0.0012968532032649398}. Best is trial 486 with value: 0.8320137528916117.[0m
[32m[I 2022-04-21 15:39:13,622][0m Trial 506 finished with value: 0.8237166720811849 and parameters: {'loss': 'coxph', 'learning_rate': 0.015593860281083663, 'n_estimators': 658, 'criterion': 'friedman_mse', 'min_samples_split': 2, 'min_samples_leaf': 4, 'min_weight_fraction_leaf': 0.06889717862854959, 'min_impurity_decrease': 0.5057262870969437, 'max_features': 0.39004442000541667, 'subsample': 0.4319667730921239, 'dropout_rate': 0.9818590975226248, 'ccp_alpha': 0.09803904058082698}. Best is trial 486 with value: 0.8320137528916117.[0m
[32m[I 2022-04-21 15:39:46,400][0m Trial 507 finished with value: 0.8289486128058037 and parameters: {'loss': 'coxph', 'learning_rate': 0.02677280792634032, 'n_estimators': 595, 'criterion': 'friedman_mse', 'min_samples_split': 2, 'min_samples_leaf': 4, 'min_weight_fraction_leaf': 0.051504553245441245, 'min_impurity_decrease': 0.5818203853412572, 'max_features': 0.4233903670917662, 'subsample': 0.4655268402918553, 'dropout_rate': 0.9394673478681416, 'ccp_alpha': 0.0038440472540837724}. Best is trial 486 with value: 0.8320137528916117.[0m
[32m[I 2022-04-21 15:40:15,275][0m Trial 508 finished with value: 0.274064794240851 and parameters: {'loss': 'coxph', 'learning_rate': 0.02231797698608013, 'n_estimators': 609, 'criterion': 'friedman_mse', 'min_samples_split': 2, 'min_samples_leaf': 4, 'min_weight_fraction_leaf': 0.056740587995883295, 'min_impurity_decrease': 0.6313828244561946, 'max_features': 0.4131033635897745, 'subsample': 0.5106614760823923, 'dropout_rate': 0.9324548803075342, 'ccp_alpha': 0.18630341598414488}. Best is trial 486 with value: 0.8320137528916117.[0m
[32m[I 2022-04-21 15:40:49,792][0m Trial 509 finished with value: 0.2503270102305002 and parameters: {'loss': 'coxph', 'learning_rate': 0.015391210414047996, 'n_estimators': 695, 'criterion': 'friedman_mse', 'min_samples_split': 2, 'min_samples_leaf': 4, 'min_weight_fraction_leaf': 0.07119347733105479, 'min_impurity_decrease': 0.604812055029504, 'max_features': 0.4185644564243479, 'subsample': 0.4726967643942621, 'dropout_rate': 0.9436865981685718, 'ccp_alpha': 0.2733804241643201}. Best is trial 486 with value: 0.8320137528916117.[0m
[32m[I 2022-04-21 15:41:19,044][0m Trial 510 finished with value: 0.82171516403463 and parameters: {'loss': 'coxph', 'learning_rate': 0.026383067440122837, 'n_estimators': 652, 'criterion': 'friedman_mse', 'min_samples_split': 2, 'min_samples_leaf': 4, 'min_weight_fraction_leaf': 0.05105705515744617, 'min_impurity_decrease': 0.659675102457211, 'max_features': 0.37697771896407956, 'subsample': 0.4609458019205073, 'dropout_rate': 0.9485966461573707, 'ccp_alpha': 0.08616687570049875}. Best is trial 486 with value: 0.8320137528916117.[0m
[32m[I 2022-04-21 15:41:52,720][0m Trial 511 finished with value: 0.25 and parameters: {'loss': 'coxph', 'learning_rate': 0.017537282294873127, 'n_estimators': 723, 'criterion': 'friedman_mse', 'min_samples_split': 2, 'min_samples_leaf': 4, 'min_weight_fraction_leaf': 0.07032023083703873, 'min_impurity_decrease': 0.5604897915883177, 'max_features': 0.40768314109601994, 'subsample': 0.37494703005126095, 'dropout_rate': 0.9590699431454764, 'ccp_alpha': 1.4496404781415166}. Best is trial 486 with value: 0.8320137528916117.[0m
[32m[I 2022-04-21 15:42:43,564][0m Trial 512 finished with value: 0.8261003817433163 and parameters: {'loss': 'coxph', 'learning_rate': 0.011785459227653481, 'n_estimators': 769, 'criterion': 'friedman_mse', 'min_samples_split': 2, 'min_samples_leaf': 4, 'min_weight_fraction_leaf': 0.05798326300083846, 'min_impurity_decrease': 0.5714348985912354, 'max_features': 0.40099897009526503, 'subsample': 0.39460664411337953, 'dropout_rate': 0.93485676612456, 'ccp_alpha': 0.11539002154132579}. Best is trial 486 with value: 0.8320137528916117.[0m
[32m[I 2022-04-21 15:43:11,917][0m Trial 513 finished with value: 0.25 and parameters: {'loss': 'coxph', 'learning_rate': 0.009337249635049144, 'n_estimators': 616, 'criterion': 'friedman_mse', 'min_samples_split': 2, 'min_samples_leaf': 4, 'min_weight_fraction_leaf': 0.07101425062741631, 'min_impurity_decrease': 0.5777211088529932, 'max_features': 0.4424358437045885, 'subsample': 0.42354182997859946, 'dropout_rate': 0.9574297384582119, 'ccp_alpha': 0.392111547814015}. Best is trial 486 with value: 0.8320137528916117.[0m
[32m[I 2022-04-21 15:43:43,374][0m Trial 514 finished with value: 0.48541065577011666 and parameters: {'loss': 'coxph', 'learning_rate': 0.013512363033096973, 'n_estimators': 563, 'criterion': 'friedman_mse', 'min_samples_split': 2, 'min_samples_leaf': 4, 'min_weight_fraction_leaf': 0.04833920988174431, 'min_impurity_decrease': 0.474966740324533, 'max_features': 0.3680432628463055, 'subsample': 0.40919996397305486, 'dropout_rate': 0.9328795192588236, 'ccp_alpha': 0.16849631332617673}. Best is trial 486 with value: 0.8320137528916117.[0m
/media/san2_ssd/data/Workdir/survival/venv/lib/python3.8/site-packages/sksurv/ensemble/boosting.py:955: RuntimeWarning: divide by zero encountered in log
  time = numpy.log(time)
/media/san2_ssd/data/Workdir/survival/venv/lib/python3.8/site-packages/sksurv/ensemble/boosting.py:955: RuntimeWarning: divide by zero encountered in log
  time = numpy.log(time)
/media/san2_ssd/data/Workdir/survival/venv/lib/python3.8/site-packages/sksurv/ensemble/boosting.py:955: RuntimeWarning: divide by zero encountered in log
  time = numpy.log(time)
/media/san2_ssd/data/Workdir/survival/venv/lib/python3.8/site-packages/sksurv/ensemble/boosting.py:955: RuntimeWarning: divide by zero encountered in log
  time = numpy.log(time)
[32m[I 2022-04-21 15:43:47,595][0m Trial 515 finished with value: -0.46635703976202797 and parameters: {'loss': 'squared', 'learning_rate': 0.008041934238162097, 'n_estimators': 517, 'criterion': 'friedman_mse', 'min_samples_split': 2, 'min_samples_leaf': 4, 'min_weight_fraction_leaf': 0.0616413409662561, 'min_impurity_decrease': 0.6186374226872315, 'max_features': 0.37916875734120115, 'subsample': 0.494562919583293, 'dropout_rate': 0.966583308792499, 'ccp_alpha': 0.08130121599118283}. Best is trial 486 with value: 0.8320137528916117.[0m
[32m[I 2022-04-21 15:44:23,683][0m Trial 516 finished with value: 0.2503270102305002 and parameters: {'loss': 'coxph', 'learning_rate': 0.010635303320843713, 'n_estimators': 641, 'criterion': 'friedman_mse', 'min_samples_split': 2, 'min_samples_leaf': 4, 'min_weight_fraction_leaf': 0.07388494940900854, 'min_impurity_decrease': 0.593970488429349, 'max_features': 0.5544303246519933, 'subsample': 0.44642768176270203, 'dropout_rate': 0.9355425492234914, 'ccp_alpha': 0.2884006747472633}. Best is trial 486 with value: 0.8320137528916117.[0m
