[32m[I 2022-04-21 11:38:56,756][0m Trial 882 finished with value: 0.8313466605567467 and parameters: {'splitter': 'best', 'min_samples_split': 0.29644218957626495, 'min_samples_leaf': 0.018379881624696403, 'min_weight_fraction_leaf': 0.03741825045966035, 'max_features': 0.7186263052763556}. Best is trial 499 with value: 0.8396174698878165.[0m
[32m[I 2022-04-21 11:38:56,831][0m Trial 883 finished with value: 0.8375392239614191 and parameters: {'splitter': 'best', 'min_samples_split': 0.2523563850478833, 'min_samples_leaf': 0.03399227057556053, 'min_weight_fraction_leaf': 0.053841713101532594, 'max_features': 0.7094183573187447}. Best is trial 499 with value: 0.8396174698878165.[0m
[32m[I 2022-04-21 11:38:56,947][0m Trial 884 finished with value: 0.8340187950162761 and parameters: {'splitter': 'best', 'min_samples_split': 0.2873780566220758, 'min_samples_leaf': 0.026738119310854867, 'min_weight_fraction_leaf': 0.0691992752977585, 'max_features': 0.7028058675813175}. Best is trial 499 with value: 0.8396174698878165.[0m
[32m[I 2022-04-21 11:38:57,107][0m Trial 885 finished with value: 0.8373240128006764 and parameters: {'splitter': 'best', 'min_samples_split': 0.2642732626562016, 'min_samples_leaf': 0.008499684497130136, 'min_weight_fraction_leaf': 0.03961027981097094, 'max_features': 0.73644302583674}. Best is trial 499 with value: 0.8396174698878165.[0m
[32m[I 2022-04-21 11:38:57,275][0m Trial 886 finished with value: 0.8356453536097854 and parameters: {'splitter': 'best', 'min_samples_split': 0.28021501958982076, 'min_samples_leaf': 0.017920373506190964, 'min_weight_fraction_leaf': 0.04874824734957289, 'max_features': 0.7659890346062354}. Best is trial 499 with value: 0.8396174698878165.[0m
[32m[I 2022-04-21 11:38:57,386][0m Trial 887 finished with value: 0.8363268199688415 and parameters: {'splitter': 'best', 'min_samples_split': 0.2689666024278736, 'min_samples_leaf': 0.007364365277712276, 'min_weight_fraction_leaf': 0.057448365130866576, 'max_features': 0.8016948083095331}. Best is trial 499 with value: 0.8396174698878165.[0m
[32m[I 2022-04-21 11:38:57,508][0m Trial 888 finished with value: 0.8340187950162761 and parameters: {'splitter': 'best', 'min_samples_split': 0.2761632154470723, 'min_samples_leaf': 0.034412619602010364, 'min_weight_fraction_leaf': 0.06444432216870793, 'max_features': 0.6813552117575415}. Best is trial 499 with value: 0.8396174698878165.[0m
[32m[I 2022-04-21 11:38:57,644][0m Trial 889 finished with value: 0.8375392239614191 and parameters: {'splitter': 'best', 'min_samples_split': 0.2525837489591774, 'min_samples_leaf': 0.02344252615086448, 'min_weight_fraction_leaf': 0.0492770056180651, 'max_features': 0.67626594183586}. Best is trial 499 with value: 0.8396174698878165.[0m
[32m[I 2022-04-21 11:38:57,751][0m Trial 890 finished with value: 0.8348082114676366 and parameters: {'splitter': 'best', 'min_samples_split': 0.31613376441591884, 'min_samples_leaf': 0.017683219647924235, 'min_weight_fraction_leaf': 0.04641917299292116, 'max_features': 0.8266607322879596}. Best is trial 499 with value: 0.8396174698878165.[0m
[32m[I 2022-04-21 11:38:57,848][0m Trial 891 finished with value: 0.8318869790887286 and parameters: {'splitter': 'best', 'min_samples_split': 0.28653323821176296, 'min_samples_leaf': 0.0010705285176255807, 'min_weight_fraction_leaf': 0.0785260788433506, 'max_features': 0.727093983528321}. Best is trial 499 with value: 0.8396174698878165.[0m
[32m[I 2022-04-21 11:38:57,933][0m Trial 892 finished with value: 0.8373240128006764 and parameters: {'splitter': 'best', 'min_samples_split': 0.2645921879597946, 'min_samples_leaf': 0.0011255793376708442, 'min_weight_fraction_leaf': 0.03524126332128884, 'max_features': 0.7755407997344292}. Best is trial 499 with value: 0.8396174698878165.[0m
[32m[I 2022-04-21 11:38:58,021][0m Trial 893 finished with value: 0.8372430118325767 and parameters: {'splitter': 'best', 'min_samples_split': 0.24208275290360276, 'min_samples_leaf': 0.001030851706920806, 'min_weight_fraction_leaf': 0.03551006025289464, 'max_features': 0.718886704351119}. Best is trial 499 with value: 0.8396174698878165.[0m
[32m[I 2022-04-21 11:38:58,107][0m Trial 894 finished with value: 0.8322570148675416 and parameters: {'splitter': 'best', 'min_samples_split': 0.30234645572199603, 'min_samples_leaf': 0.033551657715809036, 'min_weight_fraction_leaf': 0.05570502091161197, 'max_features': 0.7473285412755449}. Best is trial 499 with value: 0.8396174698878165.[0m
[32m[I 2022-04-21 11:38:58,180][0m Trial 895 finished with value: 0.8394676524280678 and parameters: {'splitter': 'best', 'min_samples_split': 0.2757966253768684, 'min_samples_leaf': 0.024868792584587723, 'min_weight_fraction_leaf': 0.04511633075393863, 'max_features': 0.6929935472934752}. Best is trial 499 with value: 0.8396174698878165.[0m
[32m[I 2022-04-21 11:38:58,244][0m Trial 896 finished with value: 0.8337666169009493 and parameters: {'splitter': 'best', 'min_samples_split': 0.27975956434076654, 'min_samples_leaf': 0.01612106408684632, 'min_weight_fraction_leaf': 0.07074382038938289, 'max_features': 0.6986034265379759}. Best is trial 499 with value: 0.8396174698878165.[0m
[32m[I 2022-04-21 11:38:58,311][0m Trial 897 finished with value: 0.8327613710981948 and parameters: {'splitter': 'best', 'min_samples_split': 0.296070183219979, 'min_samples_leaf': 0.02443782042569608, 'min_weight_fraction_leaf': 0.05851435297765151, 'max_features': 0.6885393929227566}. Best is trial 499 with value: 0.8396174698878165.[0m
[32m[I 2022-04-21 11:38:58,372][0m Trial 898 finished with value: 0.65 and parameters: {'splitter': 'random', 'min_samples_split': 0.2707181311044922, 'min_samples_leaf': 0.3146130834531442, 'min_weight_fraction_leaf': 0.04979921824662424, 'max_features': 0.7562813566843022}. Best is trial 499 with value: 0.8396174698878165.[0m
[32m[I 2022-04-21 11:38:58,445][0m Trial 899 finished with value: 0.8318450474400789 and parameters: {'splitter': 'best', 'min_samples_split': 0.257579331526805, 'min_samples_leaf': 0.2285816374081262, 'min_weight_fraction_leaf': 0.06542282530839523, 'max_features': 0.7862875183167947}. Best is trial 499 with value: 0.8396174698878165.[0m
[32m[I 2022-04-21 11:38:58,528][0m Trial 900 finished with value: 0.8348703389712995 and parameters: {'splitter': 'best', 'min_samples_split': 0.28930894679975894, 'min_samples_leaf': 0.012075771111571076, 'min_weight_fraction_leaf': 0.046124766870058086, 'max_features': 0.7051029287890153}. Best is trial 499 with value: 0.8396174698878165.[0m
[32m[I 2022-04-21 11:38:58,592][0m Trial 901 finished with value: 0.8373240128006764 and parameters: {'splitter': 'best', 'min_samples_split': 0.26970834863940496, 'min_samples_leaf': 0.017640251760096044, 'min_weight_fraction_leaf': 0.03957770072811144, 'max_features': 0.7290308593409963}. Best is trial 499 with value: 0.8396174698878165.[0m
[32m[I 2022-04-21 11:38:58,653][0m Trial 902 finished with value: 0.8316149506675705 and parameters: {'splitter': 'best', 'min_samples_split': 0.27960990045664436, 'min_samples_leaf': 0.025044730074434588, 'min_weight_fraction_leaf': 0.09529916123911422, 'max_features': 0.741976981955877}. Best is trial 499 with value: 0.8396174698878165.[0m
[32m[I 2022-04-21 11:38:58,716][0m Trial 903 finished with value: 0.8342213889050052 and parameters: {'splitter': 'best', 'min_samples_split': 0.2624045085942015, 'min_samples_leaf': 0.01126226390692556, 'min_weight_fraction_leaf': 0.05593902929793909, 'max_features': 0.7671540638991673}. Best is trial 499 with value: 0.8396174698878165.[0m
[32m[I 2022-04-21 11:38:58,815][0m Trial 904 finished with value: 0.8340187950162761 and parameters: {'splitter': 'best', 'min_samples_split': 0.286217159128417, 'min_samples_leaf': 0.03252538955815441, 'min_weight_fraction_leaf': 0.06314167147860811, 'max_features': 0.6690622955992522}. Best is trial 499 with value: 0.8396174698878165.[0m
[32m[I 2022-04-21 11:38:58,964][0m Trial 905 finished with value: 0.8394676524280678 and parameters: {'splitter': 'best', 'min_samples_split': 0.275381813598465, 'min_samples_leaf': 0.010476192765339544, 'min_weight_fraction_leaf': 0.04602350300977754, 'max_features': 0.6958300924585502}. Best is trial 499 with value: 0.8396174698878165.[0m
[32m[I 2022-04-21 11:38:59,103][0m Trial 906 finished with value: 0.8337666169009493 and parameters: {'splitter': 'best', 'min_samples_split': 0.2761608781979968, 'min_samples_leaf': 0.009496953322749014, 'min_weight_fraction_leaf': 0.0760132659792576, 'max_features': 0.6977213894590908}. Best is trial 499 with value: 0.8396174698878165.[0m
[32m[I 2022-04-21 11:38:59,249][0m Trial 907 finished with value: 0.832826525310813 and parameters: {'splitter': 'best', 'min_samples_split': 0.2971299651962668, 'min_samples_leaf': 0.0016227391140060561, 'min_weight_fraction_leaf': 0.05528579383438034, 'max_features': 0.7218638068834566}. Best is trial 499 with value: 0.8396174698878165.[0m
[32m[I 2022-04-21 11:38:59,401][0m Trial 908 finished with value: 0.8394667449470219 and parameters: {'splitter': 'best', 'min_samples_split': 0.26507108656077893, 'min_samples_leaf': 0.010292356495722963, 'min_weight_fraction_leaf': 0.0472565285796288, 'max_features': 0.7167573231048473}. Best is trial 499 with value: 0.8396174698878165.[0m
[32m[I 2022-04-21 11:38:59,547][0m Trial 909 finished with value: 0.8328255155375228 and parameters: {'splitter': 'best', 'min_samples_split': 0.24985676414796051, 'min_samples_leaf': 0.016779452323810527, 'min_weight_fraction_leaf': 0.0627861270023594, 'max_features': 0.7386914428446918}. Best is trial 499 with value: 0.8396174698878165.[0m
[32m[I 2022-04-21 11:38:59,670][0m Trial 910 finished with value: 0.8382577519146084 and parameters: {'splitter': 'best', 'min_samples_split': 0.26185147983377166, 'min_samples_leaf': 0.01952976734567971, 'min_weight_fraction_leaf': 0.05197203046303183, 'max_features': 0.7139336287812165}. Best is trial 499 with value: 0.8396174698878165.[0m
[32m[I 2022-04-21 11:38:59,825][0m Trial 911 finished with value: 0.8394676524280678 and parameters: {'splitter': 'best', 'min_samples_split': 0.2764566769295667, 'min_samples_leaf': 0.008596959194953154, 'min_weight_fraction_leaf': 0.04307868653344942, 'max_features': 0.694156643325508}. Best is trial 499 with value: 0.8396174698878165.[0m
[32m[I 2022-04-21 11:38:59,947][0m Trial 912 finished with value: 0.8337666169009493 and parameters: {'splitter': 'best', 'min_samples_split': 0.28923772299908995, 'min_samples_leaf': 0.010160536942969322, 'min_weight_fraction_leaf': 0.07099244780871497, 'max_features': 0.6915694656622813}. Best is trial 499 with value: 0.8396174698878165.[0m
[32m[I 2022-04-21 11:39:00,072][0m Trial 913 finished with value: 0.8318450474400789 and parameters: {'splitter': 'best', 'min_samples_split': 0.2778147409757713, 'min_samples_leaf': 0.02190865577022365, 'min_weight_fraction_leaf': 0.21188384257708043, 'max_features': 0.6817169625625554}. Best is trial 499 with value: 0.8396174698878165.[0m
[32m[I 2022-04-21 11:39:00,144][0m Trial 914 finished with value: 0.8314987086975186 and parameters: {'splitter': 'best', 'min_samples_split': 0.3080157666653807, 'min_samples_leaf': 0.00919927039710566, 'min_weight_fraction_leaf': 0.04482839839254378, 'max_features': 0.6869116623096907}. Best is trial 499 with value: 0.8396174698878165.[0m
[32m[I 2022-04-21 11:39:00,203][0m Trial 915 finished with value: 0.8355801993971674 and parameters: {'splitter': 'best', 'min_samples_split': 0.28518892238309507, 'min_samples_leaf': 0.02486841081726773, 'min_weight_fraction_leaf': 0.05773779427229975, 'max_features': 0.6980308329089555}. Best is trial 499 with value: 0.8396174698878165.[0m
[32m[I 2022-04-21 11:39:00,411][0m Trial 916 finished with value: 0.8385374292394825 and parameters: {'splitter': 'best', 'min_samples_split': 0.2730003410078867, 'min_samples_leaf': 0.0011020573572864414, 'min_weight_fraction_leaf': 0.039638633107140615, 'max_features': 0.670589702160001}. Best is trial 499 with value: 0.8396174698878165.[0m
[32m[I 2022-04-21 11:39:00,541][0m Trial 917 finished with value: 0.65 and parameters: {'splitter': 'random', 'min_samples_split': 0.2928129833248301, 'min_samples_leaf': 0.249744481204668, 'min_weight_fraction_leaf': 0.08700006184465468, 'max_features': 0.7081818735244859}. Best is trial 499 with value: 0.8396174698878165.[0m
[32m[I 2022-04-21 11:39:00,633][0m Trial 918 finished with value: 0.8342711778095314 and parameters: {'splitter': 'best', 'min_samples_split': 0.27862897356864164, 'min_samples_leaf': 0.001260704452730986, 'min_weight_fraction_leaf': 0.040400685477114465, 'max_features': 0.6942184355697624}. Best is trial 499 with value: 0.8396174698878165.[0m
[32m[I 2022-04-21 11:39:00,777][0m Trial 919 finished with value: 0.8375392239614191 and parameters: {'splitter': 'best', 'min_samples_split': 0.2558177080096297, 'min_samples_leaf': 0.01602684686409813, 'min_weight_fraction_leaf': 0.05548876397664203, 'max_features': 0.7380287553935756}. Best is trial 499 with value: 0.8396174698878165.[0m
[32m[I 2022-04-21 11:39:00,988][0m Trial 920 finished with value: 0.8335144387856227 and parameters: {'splitter': 'best', 'min_samples_split': 0.2995395963938933, 'min_samples_leaf': 0.0011576729983376107, 'min_weight_fraction_leaf': 0.06882737770727966, 'max_features': 0.6736104723768028}. Best is trial 499 with value: 0.8396174698878165.[0m
[32m[I 2022-04-21 11:39:01,203][0m Trial 921 finished with value: 0.8382577519146084 and parameters: {'splitter': 'best', 'min_samples_split': 0.2668622702112615, 'min_samples_leaf': 0.026826140259352226, 'min_weight_fraction_leaf': 0.04951736194091445, 'max_features': 0.7149769067025724}. Best is trial 499 with value: 0.8396174698878165.[0m
[32m[I 2022-04-21 11:39:01,445][0m Trial 922 finished with value: 0.65 and parameters: {'splitter': 'best', 'min_samples_split': 0.2837454247082201, 'min_samples_leaf': 0.01678896231217786, 'min_weight_fraction_leaf': 0.46019074531095056, 'max_features': 0.7184586295332966}. Best is trial 499 with value: 0.8396174698878165.[0m
[32m[I 2022-04-21 11:39:01,637][0m Trial 923 finished with value: 0.8385374292394825 and parameters: {'splitter': 'best', 'min_samples_split': 0.27134280874006556, 'min_samples_leaf': 0.010787685654240008, 'min_weight_fraction_leaf': 0.03707439389676152, 'max_features': 0.6915756894603866}. Best is trial 499 with value: 0.8396174698878165.[0m
[32m[I 2022-04-21 11:39:01,830][0m Trial 924 finished with value: 0.8348703389712995 and parameters: {'splitter': 'best', 'min_samples_split': 0.2892054337446763, 'min_samples_leaf': 0.024172537562021708, 'min_weight_fraction_leaf': 0.04390217503494076, 'max_features': 0.6643816194545257}. Best is trial 499 with value: 0.8396174698878165.[0m
[32m[I 2022-04-21 11:39:02,015][0m Trial 925 finished with value: 0.8355801993971674 and parameters: {'splitter': 'best', 'min_samples_split': 0.27734516733829206, 'min_samples_leaf': 0.026863566404024236, 'min_weight_fraction_leaf': 0.057407079507927034, 'max_features': 0.7306817064537446}. Best is trial 499 with value: 0.8396174698878165.[0m
[32m[I 2022-04-21 11:39:02,214][0m Trial 926 finished with value: 0.8328255155375228 and parameters: {'splitter': 'best', 'min_samples_split': 0.260280827551333, 'min_samples_leaf': 0.016208495454743302, 'min_weight_fraction_leaf': 0.06538764042431604, 'max_features': 0.7045080001812516}. Best is trial 499 with value: 0.8396174698878165.[0m
[32m[I 2022-04-21 11:39:02,372][0m Trial 927 finished with value: 0.6744920180162803 and parameters: {'splitter': 'best', 'min_samples_split': 0.24368657743688454, 'min_samples_leaf': 0.331347067353984, 'min_weight_fraction_leaf': 0.05069821965910227, 'max_features': 0.7134521067320946}. Best is trial 499 with value: 0.8396174698878165.[0m
[32m[I 2022-04-21 11:39:02,527][0m Trial 928 finished with value: 0.8337666169009493 and parameters: {'splitter': 'best', 'min_samples_split': 0.2652086476541903, 'min_samples_leaf': 0.031521611031178565, 'min_weight_fraction_leaf': 0.07490990664090993, 'max_features': 0.6870196736222833}. Best is trial 499 with value: 0.8396174698878165.[0m
[32m[I 2022-04-21 11:39:02,625][0m Trial 929 finished with value: 0.8377936034458976 and parameters: {'splitter': 'best', 'min_samples_split': 0.2769983097827277, 'min_samples_leaf': 0.009203068894640731, 'min_weight_fraction_leaf': 0.0342165390486037, 'max_features': 0.6659089088664193}. Best is trial 499 with value: 0.8396174698878165.[0m
[32m[I 2022-04-21 11:39:02,749][0m Trial 930 finished with value: 0.8327613710981948 and parameters: {'splitter': 'best', 'min_samples_split': 0.29419273968697723, 'min_samples_leaf': 0.017412837518395702, 'min_weight_fraction_leaf': 0.06091026039156098, 'max_features': 0.7537380496359252}. Best is trial 499 with value: 0.8396174698878165.[0m
[32m[I 2022-04-21 11:39:02,873][0m Trial 931 finished with value: 0.8221016854899492 and parameters: {'splitter': 'best', 'min_samples_split': 0.2836947638202786, 'min_samples_leaf': 0.00979770749940685, 'min_weight_fraction_leaf': 0.037816272618478725, 'max_features': 0.10060782984423478}. Best is trial 499 with value: 0.8396174698878165.[0m
[32m[I 2022-04-21 11:39:02,981][0m Trial 932 finished with value: 0.8386460587152798 and parameters: {'splitter': 'best', 'min_samples_split': 0.25224964728385346, 'min_samples_leaf': 0.03254083795237707, 'min_weight_fraction_leaf': 0.048327330075952975, 'max_features': 0.7379737393075447}. Best is trial 499 with value: 0.8396174698878165.[0m
[32m[I 2022-04-21 11:39:03,072][0m Trial 933 finished with value: 0.8396174698878165 and parameters: {'splitter': 'best', 'min_samples_split': 0.27178612468288327, 'min_samples_leaf': 0.022839390309657266, 'min_weight_fraction_leaf': 0.05294563928515257, 'max_features': 0.7285857578038494}. Best is trial 499 with value: 0.8396174698878165.[0m
[32m[I 2022-04-21 11:39:03,204][0m Trial 934 finished with value: 0.8316149506675705 and parameters: {'splitter': 'best', 'min_samples_split': 0.27408276685039745, 'min_samples_leaf': 0.03252365373801884, 'min_weight_fraction_leaf': 0.08420249142947765, 'max_features': 0.7018870084809314}. Best is trial 499 with value: 0.8396174698878165.[0m
[32m[I 2022-04-21 11:39:03,367][0m Trial 935 finished with value: 0.8335144387856227 and parameters: {'splitter': 'best', 'min_samples_split': 0.30422891201945806, 'min_samples_leaf': 0.024501570293852352, 'min_weight_fraction_leaf': 0.06516026339974657, 'max_features': 0.6791867020320292}. Best is trial 499 with value: 0.8396174698878165.[0m
[32m[I 2022-04-21 11:39:03,485][0m Trial 936 finished with value: 0.8334107142154489 and parameters: {'splitter': 'random', 'min_samples_split': 0.28713732646640905, 'min_samples_leaf': 0.02563438531919608, 'min_weight_fraction_leaf': 0.07472324693104482, 'max_features': 0.7288202089130257}. Best is trial 499 with value: 0.8396174698878165.[0m
[32m[I 2022-04-21 11:39:03,578][0m Trial 937 finished with value: 0.8355801993971674 and parameters: {'splitter': 'best', 'min_samples_split': 0.273342046418634, 'min_samples_leaf': 0.019938504874725864, 'min_weight_fraction_leaf': 0.059016953700137056, 'max_features': 0.6810513073790648}. Best is trial 499 with value: 0.8396174698878165.[0m
[32m[I 2022-04-21 11:39:03,647][0m Trial 938 finished with value: 0.832826525310813 and parameters: {'splitter': 'best', 'min_samples_split': 0.2936624914898185, 'min_samples_leaf': 0.03504078633058279, 'min_weight_fraction_leaf': 0.052524739337382505, 'max_features': 0.7235348212231576}. Best is trial 499 with value: 0.8396174698878165.[0m
[32m[I 2022-04-21 11:39:03,710][0m Trial 939 finished with value: 0.6656426807671247 and parameters: {'splitter': 'best', 'min_samples_split': 0.2582700539866908, 'min_samples_leaf': 0.34478624027745186, 'min_weight_fraction_leaf': 0.046415548614091896, 'max_features': 0.7019542708909039}. Best is trial 499 with value: 0.8396174698878165.[0m
[32m[I 2022-04-21 11:39:03,768][0m Trial 940 finished with value: 0.8328255155375228 and parameters: {'splitter': 'best', 'min_samples_split': 0.26634880539438405, 'min_samples_leaf': 0.0351709661936456, 'min_weight_fraction_leaf': 0.06447900386749035, 'max_features': 0.7066334857887464}. Best is trial 499 with value: 0.8396174698878165.[0m
[32m[I 2022-04-21 11:39:03,836][0m Trial 941 finished with value: 0.8356453536097854 and parameters: {'splitter': 'best', 'min_samples_split': 0.2841705039455892, 'min_samples_leaf': 0.017334374285315254, 'min_weight_fraction_leaf': 0.053634175409109364, 'max_features': 0.7302662445779646}. Best is trial 499 with value: 0.8396174698878165.[0m
[32m[I 2022-04-21 11:39:03,895][0m Trial 942 finished with value: 0.8342711778095314 and parameters: {'splitter': 'best', 'min_samples_split': 0.2783256329918152, 'min_samples_leaf': 0.010049490521485644, 'min_weight_fraction_leaf': 0.037513668297402436, 'max_features': 0.6651552599033465}. Best is trial 499 with value: 0.8396174698878165.[0m
[32m[I 2022-04-21 11:39:04,086][0m Trial 943 finished with value: 0.65 and parameters: {'splitter': 'best', 'min_samples_split': 0.27036823542670907, 'min_samples_leaf': 0.4084095592837792, 'min_weight_fraction_leaf': 0.0398124492400052, 'max_features': 0.6855617934041315}. Best is trial 499 with value: 0.8396174698878165.[0m
[32m[I 2022-04-21 11:39:04,287][0m Trial 944 finished with value: 0.8337666169009493 and parameters: {'splitter': 'best', 'min_samples_split': 0.2569160340516597, 'min_samples_leaf': 0.026047013921423487, 'min_weight_fraction_leaf': 0.0725715357532462, 'max_features': 0.7520449682506581}. Best is trial 499 with value: 0.8396174698878165.[0m
