[32m[I 2022-04-22 19:39:06,203][0m Trial 371 finished with value: 0.6627197205895214 and parameters: {'loss': 'coxph', 'learning_rate': 0.02080731985695993, 'n_estimators': 784, 'criterion': 'friedman_mse', 'min_samples_split': 10, 'min_samples_leaf': 3, 'min_weight_fraction_leaf': 0.09358722070841834, 'min_impurity_decrease': 0.9175475982182383, 'max_features': 0.5167867663815563, 'subsample': 0.31184616445060864, 'dropout_rate': 0.22092245520082468, 'ccp_alpha': 0.003875505574327637}. Best is trial 218 with value: 0.6659976583847056.[0m
[32m[I 2022-04-22 19:41:50,677][0m Trial 372 finished with value: 0.66161299683263 and parameters: {'loss': 'coxph', 'learning_rate': 0.020372914658032374, 'n_estimators': 807, 'criterion': 'friedman_mse', 'min_samples_split': 10, 'min_samples_leaf': 3, 'min_weight_fraction_leaf': 0.09787298974212065, 'min_impurity_decrease': 0.9741453980630712, 'max_features': 0.5319900557211337, 'subsample': 0.29340750380514175, 'dropout_rate': 0.210570904261012, 'ccp_alpha': 0.001577066387278031}. Best is trial 218 with value: 0.6659976583847056.[0m
[32m[I 2022-04-22 19:45:06,690][0m Trial 373 finished with value: 0.6017702847517712 and parameters: {'loss': 'coxph', 'learning_rate': 0.019482088108765387, 'n_estimators': 923, 'criterion': 'friedman_mse', 'min_samples_split': 10, 'min_samples_leaf': 3, 'min_weight_fraction_leaf': 0.10050295660398739, 'min_impurity_decrease': 0.9754258738680458, 'max_features': 0.5305218491120318, 'subsample': 0.30695816218729555, 'dropout_rate': 0.20485616920891564, 'ccp_alpha': 0.19209936668628438}. Best is trial 218 with value: 0.6659976583847056.[0m
[32m[I 2022-04-22 19:47:32,012][0m Trial 374 finished with value: 0.6542441171167084 and parameters: {'loss': 'coxph', 'learning_rate': 0.021606049433274013, 'n_estimators': 785, 'criterion': 'friedman_mse', 'min_samples_split': 10, 'min_samples_leaf': 3, 'min_weight_fraction_leaf': 0.09600708926189386, 'min_impurity_decrease': 0.9694007556681938, 'max_features': 0.5182329527787393, 'subsample': 0.283695809204799, 'dropout_rate': 0.21910112146268407, 'ccp_alpha': 0.09847004712127412}. Best is trial 218 with value: 0.6659976583847056.[0m
[32m[I 2022-04-22 19:49:48,235][0m Trial 375 finished with value: 0.6119967631700488 and parameters: {'loss': 'coxph', 'learning_rate': 0.018267053174820802, 'n_estimators': 789, 'criterion': 'friedman_mse', 'min_samples_split': 10, 'min_samples_leaf': 3, 'min_weight_fraction_leaf': 0.11225618876116808, 'min_impurity_decrease': 0.9411113816803715, 'max_features': 0.5615843973964785, 'subsample': 0.30527185394569695, 'dropout_rate': 0.25625764901256154, 'ccp_alpha': 0.1820735637386652}. Best is trial 218 with value: 0.6659976583847056.[0m
[32m[I 2022-04-22 19:52:26,237][0m Trial 376 finished with value: 0.6549969960665332 and parameters: {'loss': 'coxph', 'learning_rate': 0.015528014088219312, 'n_estimators': 778, 'criterion': 'friedman_mse', 'min_samples_split': 10, 'min_samples_leaf': 3, 'min_weight_fraction_leaf': 0.11806868598366375, 'min_impurity_decrease': 0.9515056873706222, 'max_features': 0.5141922617377721, 'subsample': 0.2689667953141368, 'dropout_rate': 0.20392061272963452, 'ccp_alpha': 0.0046621704950030535}. Best is trial 218 with value: 0.6659976583847056.[0m
[32m[I 2022-04-22 19:56:10,199][0m Trial 377 finished with value: 0.5006540204610004 and parameters: {'loss': 'coxph', 'learning_rate': 0.025028617446914373, 'n_estimators': 998, 'criterion': 'friedman_mse', 'min_samples_split': 10, 'min_samples_leaf': 3, 'min_weight_fraction_leaf': 0.09081971549570678, 'min_impurity_decrease': 0.9789886168487867, 'max_features': 0.5446005253480496, 'subsample': 0.3156201071269899, 'dropout_rate': 0.24164972273942417, 'ccp_alpha': 0.34054099599605697}. Best is trial 218 with value: 0.6659976583847056.[0m
/media/san2_ssd/data/Workdir/survival/venv/lib/python3.8/site-packages/sksurv/ensemble/boosting.py:955: RuntimeWarning: divide by zero encountered in log
  time = numpy.log(time)
/media/san2_ssd/data/Workdir/survival/venv/lib/python3.8/site-packages/sksurv/ensemble/boosting.py:955: RuntimeWarning: divide by zero encountered in log
  time = numpy.log(time)
/media/san2_ssd/data/Workdir/survival/venv/lib/python3.8/site-packages/sksurv/ensemble/boosting.py:955: RuntimeWarning: divide by zero encountered in log
  time = numpy.log(time)
/media/san2_ssd/data/Workdir/survival/venv/lib/python3.8/site-packages/sksurv/ensemble/boosting.py:955: RuntimeWarning: divide by zero encountered in log
  time = numpy.log(time)
[32m[I 2022-04-22 19:56:43,307][0m Trial 378 finished with value: -0.7345519944781845 and parameters: {'loss': 'squared', 'learning_rate': 0.05102129833174219, 'n_estimators': 843, 'criterion': 'friedman_mse', 'min_samples_split': 10, 'min_samples_leaf': 3, 'min_weight_fraction_leaf': 0.11090638117640146, 'min_impurity_decrease': 0.9201403358923305, 'max_features': 0.492393777424584, 'subsample': 0.29051460506677074, 'dropout_rate': 0.22608885709269574, 'ccp_alpha': 0.002472145008959946}. Best is trial 218 with value: 0.6659976583847056.[0m
[32m[I 2022-04-22 19:59:34,802][0m Trial 379 finished with value: 0.6545452371078501 and parameters: {'loss': 'coxph', 'learning_rate': 0.01393248360403783, 'n_estimators': 820, 'criterion': 'friedman_mse', 'min_samples_split': 10, 'min_samples_leaf': 3, 'min_weight_fraction_leaf': 0.08449385409473385, 'min_impurity_decrease': 0.9298485050232443, 'max_features': 0.56496717374914, 'subsample': 0.24679084775950078, 'dropout_rate': 0.18367099207058438, 'ccp_alpha': 0.08991070738767165}. Best is trial 218 with value: 0.6659976583847056.[0m
[32m[I 2022-04-22 20:01:39,775][0m Trial 380 finished with value: 0.5745123731317865 and parameters: {'loss': 'coxph', 'learning_rate': 0.010974842031042218, 'n_estimators': 733, 'criterion': 'friedman_mse', 'min_samples_split': 10, 'min_samples_leaf': 3, 'min_weight_fraction_leaf': 0.09951685862072143, 'min_impurity_decrease': 0.9140593238497707, 'max_features': 0.5327841510848846, 'subsample': 0.27229710025205744, 'dropout_rate': 0.2601363949105014, 'ccp_alpha': 0.24215538279306173}. Best is trial 218 with value: 0.6659976583847056.[0m
[32m[I 2022-04-22 20:05:03,119][0m Trial 381 finished with value: 0.6501462656594201 and parameters: {'loss': 'coxph', 'learning_rate': 0.09841678667676487, 'n_estimators': 919, 'criterion': 'friedman_mse', 'min_samples_split': 10, 'min_samples_leaf': 3, 'min_weight_fraction_leaf': 0.0876617743810099, 'min_impurity_decrease': 0.9491791462744602, 'max_features': 0.5867756567183756, 'subsample': 0.32502389061570575, 'dropout_rate': 0.1881686852904835, 'ccp_alpha': 0.09320224908392143}. Best is trial 218 with value: 0.6659976583847056.[0m
[32m[I 2022-04-22 20:07:15,055][0m Trial 382 finished with value: 0.5 and parameters: {'loss': 'coxph', 'learning_rate': 0.025546897795422473, 'n_estimators': 893, 'criterion': 'friedman_mse', 'min_samples_split': 10, 'min_samples_leaf': 3, 'min_weight_fraction_leaf': 0.08203156907456431, 'min_impurity_decrease': 0.9621332825366868, 'max_features': 0.5185880038257213, 'subsample': 0.29582366094548607, 'dropout_rate': 0.47567890927593737, 'ccp_alpha': 0.9050816984942036}. Best is trial 218 with value: 0.6659976583847056.[0m
[32m[I 2022-04-22 20:08:58,733][0m Trial 383 finished with value: 0.6347265482346568 and parameters: {'loss': 'coxph', 'learning_rate': 0.0674737889824329, 'n_estimators': 656, 'criterion': 'friedman_mse', 'min_samples_split': 10, 'min_samples_leaf': 3, 'min_weight_fraction_leaf': 0.09476050501326946, 'min_impurity_decrease': 0.9316972151586577, 'max_features': 0.7269185658815129, 'subsample': 0.26014828530091116, 'dropout_rate': 0.21639711696932182, 'ccp_alpha': 0.18148692814163406}. Best is trial 218 with value: 0.6659976583847056.[0m
[32m[I 2022-04-22 20:10:25,708][0m Trial 384 finished with value: 0.6564902162253408 and parameters: {'loss': 'coxph', 'learning_rate': 0.0202455106328942, 'n_estimators': 611, 'criterion': 'friedman_mse', 'min_samples_split': 10, 'min_samples_leaf': 3, 'min_weight_fraction_leaf': 0.10418099765947772, 'min_impurity_decrease': 0.9050850277188766, 'max_features': 0.4837151761849803, 'subsample': 0.23838592447444126, 'dropout_rate': 0.2904839574967104, 'ccp_alpha': 0.00116837845780379}. Best is trial 218 with value: 0.6659976583847056.[0m
[32m[I 2022-04-22 20:12:37,972][0m Trial 385 finished with value: 0.6613890008524942 and parameters: {'loss': 'coxph', 'learning_rate': 0.04510913503391087, 'n_estimators': 732, 'criterion': 'friedman_mse', 'min_samples_split': 10, 'min_samples_leaf': 3, 'min_weight_fraction_leaf': 0.07776168040517056, 'min_impurity_decrease': 0.9160529749624282, 'max_features': 0.7043778244986184, 'subsample': 0.3124387045213779, 'dropout_rate': 0.22838452876338936, 'ccp_alpha': 0.0015047243386253272}. Best is trial 218 with value: 0.6659976583847056.[0m
[32m[I 2022-04-22 20:14:33,392][0m Trial 386 finished with value: 0.6421209186919671 and parameters: {'loss': 'coxph', 'learning_rate': 0.041691705187913326, 'n_estimators': 721, 'criterion': 'friedman_mse', 'min_samples_split': 10, 'min_samples_leaf': 3, 'min_weight_fraction_leaf': 0.08385924583537754, 'min_impurity_decrease': 0.9263535055287707, 'max_features': 0.6829968640996793, 'subsample': 0.3145257350283166, 'dropout_rate': 0.2568129559389266, 'ccp_alpha': 0.13885573584552038}. Best is trial 218 with value: 0.6659976583847056.[0m
[32m[I 2022-04-22 20:15:52,248][0m Trial 387 finished with value: 0.6611287521136416 and parameters: {'loss': 'coxph', 'learning_rate': 0.05060758389119282, 'n_estimators': 559, 'criterion': 'friedman_mse', 'min_samples_split': 10, 'min_samples_leaf': 4, 'min_weight_fraction_leaf': 0.09242855052665794, 'min_impurity_decrease': 0.9796757201605619, 'max_features': 0.7064053586076541, 'subsample': 0.32535605829608194, 'dropout_rate': 0.23579645345254457, 'ccp_alpha': 0.0015651930721597277}. Best is trial 218 with value: 0.6659976583847056.[0m
[32m[I 2022-04-22 20:18:16,983][0m Trial 388 finished with value: 0.5620197108933385 and parameters: {'loss': 'coxph', 'learning_rate': 0.05149572110570194, 'n_estimators': 818, 'criterion': 'friedman_mse', 'min_samples_split': 10, 'min_samples_leaf': 3, 'min_weight_fraction_leaf': 0.12086968808165963, 'min_impurity_decrease': 0.9833399149091218, 'max_features': 0.7019722512497582, 'subsample': 0.3276533520639265, 'dropout_rate': 0.3103938991474626, 'ccp_alpha': 0.2730241043132349}. Best is trial 218 with value: 0.6659976583847056.[0m
[32m[I 2022-04-22 20:20:21,412][0m Trial 389 finished with value: 0.5 and parameters: {'loss': 'coxph', 'learning_rate': 0.03719506942177343, 'n_estimators': 768, 'criterion': 'squared_error', 'min_samples_split': 10, 'min_samples_leaf': 4, 'min_weight_fraction_leaf': 0.10889859872717114, 'min_impurity_decrease': 0.9744598314743721, 'max_features': 0.7045578989459856, 'subsample': 0.3520008752622367, 'dropout_rate': 0.27921605533162774, 'ccp_alpha': 0.5113221159315331}. Best is trial 218 with value: 0.6659976583847056.[0m
[32m[I 2022-04-22 20:21:55,776][0m Trial 390 finished with value: 0.6263837284224012 and parameters: {'loss': 'coxph', 'learning_rate': 0.059444558359366545, 'n_estimators': 639, 'criterion': 'friedman_mse', 'min_samples_split': 10, 'min_samples_leaf': 4, 'min_weight_fraction_leaf': 0.2378438756043671, 'min_impurity_decrease': 0.9555648934408291, 'max_features': 0.7417141896118943, 'subsample': 0.3099675128209867, 'dropout_rate': 0.24079352912072935, 'ccp_alpha': 0.08813384661575979}. Best is trial 218 with value: 0.6659976583847056.[0m
[32m[I 2022-04-22 20:23:20,072][0m Trial 391 finished with value: 0.6373104222508067 and parameters: {'loss': 'coxph', 'learning_rate': 0.04657757603076488, 'n_estimators': 596, 'criterion': 'friedman_mse', 'min_samples_split': 10, 'min_samples_leaf': 4, 'min_weight_fraction_leaf': 0.09495934918529353, 'min_impurity_decrease': 0.9871541466701825, 'max_features': 0.7143531025715932, 'subsample': 0.2959162228590594, 'dropout_rate': 0.2008024276540956, 'ccp_alpha': 0.17142680762736706}. Best is trial 218 with value: 0.6659976583847056.[0m
[32m[I 2022-04-22 20:26:01,595][0m Trial 392 finished with value: 0.6489840295215954 and parameters: {'loss': 'coxph', 'learning_rate': 0.07339106213828181, 'n_estimators': 895, 'criterion': 'friedman_mse', 'min_samples_split': 10, 'min_samples_leaf': 3, 'min_weight_fraction_leaf': 0.09155217213824911, 'min_impurity_decrease': 0.9478449247243074, 'max_features': 0.7635692013735106, 'subsample': 0.3338639615895552, 'dropout_rate': 0.3401095479992419, 'ccp_alpha': 0.09190165293432867}. Best is trial 218 with value: 0.6659976583847056.[0m
[32m[I 2022-04-22 20:28:06,825][0m Trial 393 finished with value: 0.548129588481702 and parameters: {'loss': 'coxph', 'learning_rate': 0.032987608571892146, 'n_estimators': 751, 'criterion': 'friedman_mse', 'min_samples_split': 10, 'min_samples_leaf': 3, 'min_weight_fraction_leaf': 0.07809783747892261, 'min_impurity_decrease': 0.9654774206389531, 'max_features': 0.7250363926248182, 'subsample': 0.36365393029472703, 'dropout_rate': 0.25488846257703734, 'ccp_alpha': 0.23641977451535126}. Best is trial 218 with value: 0.6659976583847056.[0m
[32m[I 2022-04-22 20:31:33,451][0m Trial 394 finished with value: 0.6550352806805633 and parameters: {'loss': 'coxph', 'learning_rate': 0.05952317424600203, 'n_estimators': 939, 'criterion': 'friedman_mse', 'min_samples_split': 10, 'min_samples_leaf': 3, 'min_weight_fraction_leaf': 0.10540584296413685, 'min_impurity_decrease': 0.8971938638746783, 'max_features': 0.6931920348574059, 'subsample': 0.2870100002561224, 'dropout_rate': 0.2337831436919677, 'ccp_alpha': 0.09476245000937691}. Best is trial 218 with value: 0.6659976583847056.[0m
[32m[I 2022-04-22 20:33:58,411][0m Trial 395 finished with value: 0.5006540204610004 and parameters: {'loss': 'coxph', 'learning_rate': 0.04248153677687484, 'n_estimators': 816, 'criterion': 'friedman_mse', 'min_samples_split': 10, 'min_samples_leaf': 5, 'min_weight_fraction_leaf': 0.058893560961401616, 'min_impurity_decrease': 0.9360973128131855, 'max_features': 0.6742033136620245, 'subsample': 0.31761030761394016, 'dropout_rate': 0.27021828694845607, 'ccp_alpha': 0.33598224602146487}. Best is trial 218 with value: 0.6659976583847056.[0m
[32m[I 2022-04-22 20:35:13,811][0m Trial 396 finished with value: 0.653139649042769 and parameters: {'loss': 'coxph', 'learning_rate': 0.07626396089227554, 'n_estimators': 555, 'criterion': 'friedman_mse', 'min_samples_split': 10, 'min_samples_leaf': 3, 'min_weight_fraction_leaf': 0.08598156509872898, 'min_impurity_decrease': 0.9162425909496137, 'max_features': 0.6978055470057408, 'subsample': 0.30143723953103757, 'dropout_rate': 0.18954226723182482, 'ccp_alpha': 0.08656422367359287}. Best is trial 218 with value: 0.6659976583847056.[0m
/media/san2_ssd/data/Workdir/survival/venv/lib/python3.8/site-packages/sksurv/ensemble/boosting.py:955: RuntimeWarning: divide by zero encountered in log
  time = numpy.log(time)
/media/san2_ssd/data/Workdir/survival/venv/lib/python3.8/site-packages/sksurv/ensemble/boosting.py:955: RuntimeWarning: divide by zero encountered in log
  time = numpy.log(time)
/media/san2_ssd/data/Workdir/survival/venv/lib/python3.8/site-packages/sksurv/ensemble/boosting.py:955: RuntimeWarning: divide by zero encountered in log
  time = numpy.log(time)
/media/san2_ssd/data/Workdir/survival/venv/lib/python3.8/site-packages/sksurv/ensemble/boosting.py:955: RuntimeWarning: divide by zero encountered in log
  time = numpy.log(time)
[32m[I 2022-04-22 20:35:36,901][0m Trial 397 finished with value: -0.7369895977784211 and parameters: {'loss': 'squared', 'learning_rate': 0.028835789582146446, 'n_estimators': 695, 'criterion': 'friedman_mse', 'min_samples_split': 10, 'min_samples_leaf': 3, 'min_weight_fraction_leaf': 0.07703947700380999, 'min_impurity_decrease': 0.8983467824630218, 'max_features': 0.7151038945334355, 'subsample': 0.34226354360249595, 'dropout_rate': 0.21316940936884973, 'ccp_alpha': 0.001961716448103696}. Best is trial 218 with value: 0.6659976583847056.[0m
[32m[I 2022-04-22 20:37:26,020][0m Trial 398 finished with value: 0.631388899242847 and parameters: {'loss': 'coxph', 'learning_rate': 0.05068426858888511, 'n_estimators': 717, 'criterion': 'friedman_mse', 'min_samples_split': 10, 'min_samples_leaf': 3, 'min_weight_fraction_leaf': 0.09757822058019659, 'min_impurity_decrease': 0.8468076255921917, 'max_features': 0.7369688860091262, 'subsample': 0.2802330216037695, 'dropout_rate': 0.3012766222380588, 'ccp_alpha': 0.17201833152261914}. Best is trial 218 with value: 0.6659976583847056.[0m
[32m[I 2022-04-22 20:38:05,229][0m Trial 399 finished with value: 0.5 and parameters: {'loss': 'coxph', 'learning_rate': 0.09989639106717578, 'n_estimators': 418, 'criterion': 'friedman_mse', 'min_samples_split': 10, 'min_samples_leaf': 4, 'min_weight_fraction_leaf': 0.08834799897921311, 'min_impurity_decrease': 0.9463950367292415, 'max_features': 0.590573006139774, 'subsample': 0.3230178727473529, 'dropout_rate': 0.3258225175057369, 'ccp_alpha': 3.802447301388713}. Best is trial 218 with value: 0.6659976583847056.[0m
[32m[I 2022-04-22 20:40:16,899][0m Trial 400 finished with value: 0.6519589583588532 and parameters: {'loss': 'coxph', 'learning_rate': 0.03708773196638057, 'n_estimators': 855, 'criterion': 'friedman_mse', 'min_samples_split': 10, 'min_samples_leaf': 3, 'min_weight_fraction_leaf': 0.06255701990452818, 'min_impurity_decrease': 0.8888418429808275, 'max_features': 0.5583820238046958, 'subsample': 0.29872673887556694, 'dropout_rate': 0.43409268720756805, 'ccp_alpha': 0.09445160681919236}. Best is trial 218 with value: 0.6659976583847056.[0m
[32m[I 2022-04-22 20:44:03,220][0m Trial 401 finished with value: 0.6623052828520044 and parameters: {'loss': 'coxph', 'learning_rate': 0.06387256579428671, 'n_estimators': 970, 'criterion': 'friedman_mse', 'min_samples_split': 10, 'min_samples_leaf': 3, 'min_weight_fraction_leaf': 0.07880607097418431, 'min_impurity_decrease': 0.9792908557114117, 'max_features': 0.7547253383470327, 'subsample': 0.2732890890876653, 'dropout_rate': 0.23850162821753484, 'ccp_alpha': 0.007172818357632125}. Best is trial 218 with value: 0.6659976583847056.[0m
[32m[I 2022-04-22 20:47:01,708][0m Trial 402 finished with value: 0.6616672091657201 and parameters: {'loss': 'coxph', 'learning_rate': 0.0664758778030355, 'n_estimators': 886, 'criterion': 'friedman_mse', 'min_samples_split': 10, 'min_samples_leaf': 3, 'min_weight_fraction_leaf': 0.04493211177710615, 'min_impurity_decrease': 0.8670632902475255, 'max_features': 0.7231071681366993, 'subsample': 0.2704771955915345, 'dropout_rate': 0.2849964818196211, 'ccp_alpha': 0.002248504517687637}. Best is trial 218 with value: 0.6659976583847056.[0m
[32m[I 2022-04-22 20:50:27,300][0m Trial 403 finished with value: 0.621306783925414 and parameters: {'loss': 'coxph', 'learning_rate': 0.07430535729513958, 'n_estimators': 985, 'criterion': 'friedman_mse', 'min_samples_split': 10, 'min_samples_leaf': 3, 'min_weight_fraction_leaf': 0.042195956674747445, 'min_impurity_decrease': 0.8249672812027519, 'max_features': 0.7835288426809248, 'subsample': 0.26871997439112283, 'dropout_rate': 0.287208365588449, 'ccp_alpha': 0.19723148723279532}. Best is trial 218 with value: 0.6659976583847056.[0m
[32m[I 2022-04-22 20:53:40,755][0m Trial 404 finished with value: 0.5 and parameters: {'loss': 'coxph', 'learning_rate': 0.0638822754314161, 'n_estimators': 967, 'criterion': 'friedman_mse', 'min_samples_split': 10, 'min_samples_leaf': 3, 'min_weight_fraction_leaf': 0.04879746562004752, 'min_impurity_decrease': 0.8599696709422929, 'max_features': 0.8026488816696924, 'subsample': 0.26802697049118385, 'dropout_rate': 0.30797257408892736, 'ccp_alpha': 0.42780546336341974}. Best is trial 218 with value: 0.6659976583847056.[0m
[32m[I 2022-04-22 20:56:34,996][0m Trial 405 finished with value: 0.5 and parameters: {'loss': 'coxph', 'learning_rate': 0.08163246713463457, 'n_estimators': 893, 'criterion': 'absolute_error', 'min_samples_split': 10, 'min_samples_leaf': 3, 'min_weight_fraction_leaf': 0.05476410655964685, 'min_impurity_decrease': 0.9940262005679522, 'max_features': 0.763759436486981, 'subsample': 0.25827380721234033, 'dropout_rate': 0.2704009211243693, 'ccp_alpha': 0.0025765099087181444}. Best is trial 218 with value: 0.6659976583847056.[0m
[32m[I 2022-04-22 20:59:55,772][0m Trial 406 finished with value: 0.5630061752934622 and parameters: {'loss': 'coxph', 'learning_rate': 0.0614928587319842, 'n_estimators': 953, 'criterion': 'friedman_mse', 'min_samples_split': 10, 'min_samples_leaf': 3, 'min_weight_fraction_leaf': 0.03935535311129936, 'min_impurity_decrease': 0.8600284068187216, 'max_features': 0.7384441394763827, 'subsample': 0.2840311987680471, 'dropout_rate': 0.25038690153902204, 'ccp_alpha': 0.2717424343071583}. Best is trial 218 with value: 0.6659976583847056.[0m
[32m[I 2022-04-22 21:03:26,033][0m Trial 407 finished with value: 0.6431775301673601 and parameters: {'loss': 'coxph', 'learning_rate': 0.05322025274502008, 'n_estimators': 977, 'criterion': 'friedman_mse', 'min_samples_split': 10, 'min_samples_leaf': 3, 'min_weight_fraction_leaf': 0.061275493916955165, 'min_impurity_decrease': 0.008440959422288508, 'max_features': 0.7578391244829663, 'subsample': 0.26229200944885683, 'dropout_rate': 0.2861117134050868, 'ccp_alpha': 0.16516081565235946}. Best is trial 218 with value: 0.6659976583847056.[0m
