[32m[I 2022-04-21 14:33:36,925][0m Trial 181 finished with value: 0.8204901153511178 and parameters: {'loss': 'coxph', 'learning_rate': 0.00055503252169702, 'n_estimators': 108, 'criterion': 'friedman_mse', 'min_samples_split': 3, 'min_samples_leaf': 1, 'min_weight_fraction_leaf': 0.16014646517019207, 'min_impurity_decrease': 0.508484105552127, 'max_features': 0.8545127960120864, 'subsample': 0.2024321989925484, 'dropout_rate': 0.788381374028454, 'ccp_alpha': 0.11996620445595642}. Best is trial 174 with value: 0.824528057483301.[0m
[32m[I 2022-04-21 14:33:41,199][0m Trial 182 finished with value: 0.817762924010619 and parameters: {'loss': 'coxph', 'learning_rate': 0.0005938091304627994, 'n_estimators': 111, 'criterion': 'friedman_mse', 'min_samples_split': 3, 'min_samples_leaf': 1, 'min_weight_fraction_leaf': 0.15987103458186855, 'min_impurity_decrease': 0.5108153279155431, 'max_features': 0.8576693083579559, 'subsample': 0.19852704584402572, 'dropout_rate': 0.78652886688156, 'ccp_alpha': 0.13476495037671798}. Best is trial 174 with value: 0.824528057483301.[0m
[32m[I 2022-04-21 14:33:44,212][0m Trial 183 finished with value: 0.2503270102305002 and parameters: {'loss': 'coxph', 'learning_rate': 1.8362284477512498e-05, 'n_estimators': 109, 'criterion': 'friedman_mse', 'min_samples_split': 3, 'min_samples_leaf': 1, 'min_weight_fraction_leaf': 0.15904581195954381, 'min_impurity_decrease': 0.5155933276174725, 'max_features': 0.8631780435233719, 'subsample': 0.20327817032553663, 'dropout_rate': 0.7950468631153688, 'ccp_alpha': 0.3713665108932319}. Best is trial 174 with value: 0.824528057483301.[0m
[32m[I 2022-04-21 14:33:47,982][0m Trial 184 finished with value: 0.8021052361931227 and parameters: {'loss': 'coxph', 'learning_rate': 0.0006441151429391274, 'n_estimators': 112, 'criterion': 'friedman_mse', 'min_samples_split': 3, 'min_samples_leaf': 1, 'min_weight_fraction_leaf': 0.11864719896312592, 'min_impurity_decrease': 0.5475615712459034, 'max_features': 0.8994843717030383, 'subsample': 0.13773287995876143, 'dropout_rate': 0.7651923612962919, 'ccp_alpha': 0.2389134419736081}. Best is trial 174 with value: 0.824528057483301.[0m
[32m[I 2022-04-21 14:33:52,091][0m Trial 185 finished with value: 0.819102747016767 and parameters: {'loss': 'coxph', 'learning_rate': 0.0005630532924058023, 'n_estimators': 109, 'criterion': 'friedman_mse', 'min_samples_split': 3, 'min_samples_leaf': 1, 'min_weight_fraction_leaf': 0.13463164394781973, 'min_impurity_decrease': 0.4763126030462286, 'max_features': 0.8632093544944494, 'subsample': 0.1959212633456468, 'dropout_rate': 0.9095069487089358, 'ccp_alpha': 0.13247451253639358}. Best is trial 174 with value: 0.824528057483301.[0m
[32m[I 2022-04-21 14:33:54,441][0m Trial 186 finished with value: 0.25 and parameters: {'loss': 'coxph', 'learning_rate': 0.0005605096192527487, 'n_estimators': 107, 'criterion': 'friedman_mse', 'min_samples_split': 3, 'min_samples_leaf': 1, 'min_weight_fraction_leaf': 0.13849626650084523, 'min_impurity_decrease': 0.4751245602682904, 'max_features': 0.8591743621959853, 'subsample': 0.19577465825915286, 'dropout_rate': 0.9106386702992246, 'ccp_alpha': 0.47269951479630856}. Best is trial 174 with value: 0.824528057483301.[0m
[32m[I 2022-04-21 14:33:57,784][0m Trial 187 finished with value: 0.8241108509535151 and parameters: {'loss': 'coxph', 'learning_rate': 0.0010072369254278237, 'n_estimators': 116, 'criterion': 'friedman_mse', 'min_samples_split': 3, 'min_samples_leaf': 1, 'min_weight_fraction_leaf': 0.13093752205067563, 'min_impurity_decrease': 0.5663673268157369, 'max_features': 0.8001219087104499, 'subsample': 0.23703255597499867, 'dropout_rate': 0.7196473281614041, 'ccp_alpha': 0.10544221967794723}. Best is trial 174 with value: 0.824528057483301.[0m
[32m[I 2022-04-21 14:34:02,226][0m Trial 188 finished with value: 0.3765608419922887 and parameters: {'loss': 'coxph', 'learning_rate': 0.0010001804468671252, 'n_estimators': 114, 'criterion': 'friedman_mse', 'min_samples_split': 3, 'min_samples_leaf': 1, 'min_weight_fraction_leaf': 0.0973329894355617, 'min_impurity_decrease': 0.5702294324956801, 'max_features': 0.7912643289858781, 'subsample': 0.2546577178485231, 'dropout_rate': 0.7198551662007118, 'ccp_alpha': 0.24224313943729925}. Best is trial 174 with value: 0.824528057483301.[0m
[32m[I 2022-04-21 14:34:05,354][0m Trial 189 finished with value: 0.8199395899353645 and parameters: {'loss': 'coxph', 'learning_rate': 0.0007691390021117361, 'n_estimators': 107, 'criterion': 'friedman_mse', 'min_samples_split': 4, 'min_samples_leaf': 1, 'min_weight_fraction_leaf': 0.13178003947627598, 'min_impurity_decrease': 0.5311469847957, 'max_features': 0.8080409292035635, 'subsample': 0.16427110122868593, 'dropout_rate': 0.8696572003178346, 'ccp_alpha': 0.11869175649238689}. Best is trial 174 with value: 0.824528057483301.[0m
[32m[I 2022-04-21 14:34:08,507][0m Trial 190 finished with value: 0.25 and parameters: {'loss': 'coxph', 'learning_rate': 0.0006803634395482209, 'n_estimators': 104, 'criterion': 'friedman_mse', 'min_samples_split': 4, 'min_samples_leaf': 1, 'min_weight_fraction_leaf': 0.1330918348378713, 'min_impurity_decrease': 0.5914362195915952, 'max_features': 0.8036290376399484, 'subsample': 0.15783525072130272, 'dropout_rate': 0.8562797084501685, 'ccp_alpha': 0.6277959754744364}. Best is trial 174 with value: 0.824528057483301.[0m
[32m[I 2022-04-21 14:34:11,606][0m Trial 191 finished with value: 0.8240148183656405 and parameters: {'loss': 'coxph', 'learning_rate': 0.0007912961123472923, 'n_estimators': 100, 'criterion': 'friedman_mse', 'min_samples_split': 3, 'min_samples_leaf': 1, 'min_weight_fraction_leaf': 0.12399580197229833, 'min_impurity_decrease': 0.5351086930378696, 'max_features': 0.8853666728644698, 'subsample': 0.19270244709042372, 'dropout_rate': 0.8360318968190328, 'ccp_alpha': 0.12686945542965095}. Best is trial 174 with value: 0.824528057483301.[0m
[32m[I 2022-04-21 14:34:14,166][0m Trial 192 finished with value: 0.8146439333674532 and parameters: {'loss': 'coxph', 'learning_rate': 0.0010531205095971163, 'n_estimators': 100, 'criterion': 'friedman_mse', 'min_samples_split': 3, 'min_samples_leaf': 1, 'min_weight_fraction_leaf': 0.12333358255714141, 'min_impurity_decrease': 0.5304017547393991, 'max_features': 0.8808607149394589, 'subsample': 0.19087334561029382, 'dropout_rate': 0.8376123228842794, 'ccp_alpha': 0.15402533204298144}. Best is trial 174 with value: 0.824528057483301.[0m
[32m[I 2022-04-21 14:34:18,774][0m Trial 193 finished with value: 0.2583132803301006 and parameters: {'loss': 'coxph', 'learning_rate': 0.000779988502195112, 'n_estimators': 109, 'criterion': 'friedman_mse', 'min_samples_split': 3, 'min_samples_leaf': 1, 'min_weight_fraction_leaf': 0.1066849794372448, 'min_impurity_decrease': 0.5040922418335858, 'max_features': 0.8515957891458688, 'subsample': 0.23900816471188047, 'dropout_rate': 0.8715507861464094, 'ccp_alpha': 0.33380323426055436}. Best is trial 174 with value: 0.824528057483301.[0m
[32m[I 2022-04-21 14:34:22,312][0m Trial 194 finished with value: 0.822328171687934 and parameters: {'loss': 'coxph', 'learning_rate': 0.0015946910626749302, 'n_estimators': 116, 'criterion': 'friedman_mse', 'min_samples_split': 3, 'min_samples_leaf': 1, 'min_weight_fraction_leaf': 0.15028110185527774, 'min_impurity_decrease': 0.5287367058614793, 'max_features': 0.8179850628926969, 'subsample': 0.21379568662731455, 'dropout_rate': 0.9465424577467911, 'ccp_alpha': 0.11821408384592744}. Best is trial 174 with value: 0.824528057483301.[0m
[32m[I 2022-04-21 14:34:24,613][0m Trial 195 finished with value: 0.374670872984842 and parameters: {'loss': 'coxph', 'learning_rate': 0.0015435157295611544, 'n_estimators': 119, 'criterion': 'friedman_mse', 'min_samples_split': 3, 'min_samples_leaf': 1, 'min_weight_fraction_leaf': 0.14839480529280571, 'min_impurity_decrease': 0.568047677950072, 'max_features': 0.8141632006747916, 'subsample': 0.2149285987035426, 'dropout_rate': 0.9753033437865699, 'ccp_alpha': 0.25252261110194063}. Best is trial 174 with value: 0.824528057483301.[0m
[32m[I 2022-04-21 14:34:27,199][0m Trial 196 finished with value: 0.8227438830876785 and parameters: {'loss': 'coxph', 'learning_rate': 0.0005270634892632767, 'n_estimators': 112, 'criterion': 'friedman_mse', 'min_samples_split': 4, 'min_samples_leaf': 1, 'min_weight_fraction_leaf': 0.11861003833268824, 'min_impurity_decrease': 0.5377900998584989, 'max_features': 0.9085996554829536, 'subsample': 0.1345162141603645, 'dropout_rate': 0.9562156635590429, 'ccp_alpha': 0.10986734306312816}. Best is trial 174 with value: 0.824528057483301.[0m
[32m[I 2022-04-21 14:34:32,320][0m Trial 197 finished with value: 0.8192546105470306 and parameters: {'loss': 'coxph', 'learning_rate': 0.0005470841117932648, 'n_estimators': 114, 'criterion': 'friedman_mse', 'min_samples_split': 4, 'min_samples_leaf': 1, 'min_weight_fraction_leaf': 0.11273125598381253, 'min_impurity_decrease': 0.5324843955680671, 'max_features': 0.9054746562088221, 'subsample': 0.1314635787941593, 'dropout_rate': 0.7333258826879434, 'ccp_alpha': 0.12289187037069609}. Best is trial 174 with value: 0.824528057483301.[0m
[32m[I 2022-04-21 14:34:36,406][0m Trial 198 finished with value: 0.7786842214792422 and parameters: {'loss': 'coxph', 'learning_rate': 0.0005140589938554211, 'n_estimators': 107, 'criterion': 'friedman_mse', 'min_samples_split': 4, 'min_samples_leaf': 1, 'min_weight_fraction_leaf': 0.11473884212824614, 'min_impurity_decrease': 0.5395627750584177, 'max_features': 0.9153635749508635, 'subsample': 0.09631609319219088, 'dropout_rate': 0.8066027786791499, 'ccp_alpha': 0.3944388604411503}. Best is trial 174 with value: 0.824528057483301.[0m
[32m[I 2022-04-21 14:34:41,615][0m Trial 199 finished with value: 0.8178278304596536 and parameters: {'loss': 'coxph', 'learning_rate': 0.0011400775986796603, 'n_estimators': 111, 'criterion': 'friedman_mse', 'min_samples_split': 4, 'min_samples_leaf': 1, 'min_weight_fraction_leaf': 0.10058286745686768, 'min_impurity_decrease': 0.5186517652596125, 'max_features': 0.8774405112373304, 'subsample': 0.12975582310213174, 'dropout_rate': 0.7391101583128926, 'ccp_alpha': 0.10575009138156327}. Best is trial 174 with value: 0.824528057483301.[0m
[32m[I 2022-04-21 14:34:45,706][0m Trial 200 finished with value: 0.8040215406000863 and parameters: {'loss': 'coxph', 'learning_rate': 0.0011954166269483872, 'n_estimators': 111, 'criterion': 'friedman_mse', 'min_samples_split': 4, 'min_samples_leaf': 1, 'min_weight_fraction_leaf': 0.09489083684920127, 'min_impurity_decrease': 0.6018999239057216, 'max_features': 0.887792306552845, 'subsample': 0.12253968959832777, 'dropout_rate': 0.6920823918719734, 'ccp_alpha': 0.2779679815383417}. Best is trial 174 with value: 0.824528057483301.[0m
[32m[I 2022-04-21 14:34:49,254][0m Trial 201 finished with value: 0.8278209604554713 and parameters: {'loss': 'coxph', 'learning_rate': 0.0008703891790883784, 'n_estimators': 114, 'criterion': 'friedman_mse', 'min_samples_split': 4, 'min_samples_leaf': 1, 'min_weight_fraction_leaf': 0.12573056175541675, 'min_impurity_decrease': 0.5236577251461615, 'max_features': 0.8724841781739034, 'subsample': 0.15891909938031734, 'dropout_rate': 0.7458346369262633, 'ccp_alpha': 0.10593505557081744}. Best is trial 201 with value: 0.8278209604554713.[0m
[32m[I 2022-04-21 14:34:53,771][0m Trial 202 finished with value: 0.8278350672519472 and parameters: {'loss': 'coxph', 'learning_rate': 0.00084217242677021, 'n_estimators': 111, 'criterion': 'friedman_mse', 'min_samples_split': 4, 'min_samples_leaf': 1, 'min_weight_fraction_leaf': 0.12684452655474307, 'min_impurity_decrease': 0.5553649256491656, 'max_features': 0.8754844802289321, 'subsample': 0.14972327231880925, 'dropout_rate': 0.7397628160055687, 'ccp_alpha': 0.11206235559684061}. Best is trial 202 with value: 0.8278350672519472.[0m
[32m[I 2022-04-21 14:35:00,561][0m Trial 203 finished with value: 0.8259116538672648 and parameters: {'loss': 'coxph', 'learning_rate': 0.000819947703799781, 'n_estimators': 122, 'criterion': 'friedman_mse', 'min_samples_split': 4, 'min_samples_leaf': 1, 'min_weight_fraction_leaf': 0.07953820835317368, 'min_impurity_decrease': 0.5592512634755707, 'max_features': 0.9041232126775423, 'subsample': 0.13680483628035123, 'dropout_rate': 0.7228122690417985, 'ccp_alpha': 0.11157912492561131}. Best is trial 202 with value: 0.8278350672519472.[0m
[32m[I 2022-04-21 14:35:03,959][0m Trial 204 finished with value: 0.8007913575799395 and parameters: {'loss': 'coxph', 'learning_rate': 0.0008586154489899251, 'n_estimators': 122, 'criterion': 'friedman_mse', 'min_samples_split': 4, 'min_samples_leaf': 1, 'min_weight_fraction_leaf': 0.07796167168889878, 'min_impurity_decrease': 0.542185899613658, 'max_features': 0.9091580045733991, 'subsample': 0.14988523681329052, 'dropout_rate': 0.9970127546090002, 'ccp_alpha': 0.24774541501777048}. Best is trial 202 with value: 0.8278350672519472.[0m
[32m[I 2022-04-21 14:35:09,450][0m Trial 205 finished with value: 0.8242717880687689 and parameters: {'loss': 'coxph', 'learning_rate': 0.0015576505100245465, 'n_estimators': 105, 'criterion': 'friedman_mse', 'min_samples_split': 4, 'min_samples_leaf': 1, 'min_weight_fraction_leaf': 0.12282383115007739, 'min_impurity_decrease': 0.5627171492282913, 'max_features': 0.8964432819596244, 'subsample': 0.15916992135457375, 'dropout_rate': 0.7320264416657158, 'ccp_alpha': 0.11510403878660702}. Best is trial 202 with value: 0.8278350672519472.[0m
[32m[I 2022-04-21 14:35:15,425][0m Trial 206 finished with value: 0.44999804865584353 and parameters: {'loss': 'coxph', 'learning_rate': 0.001861854339076716, 'n_estimators': 129, 'criterion': 'friedman_mse', 'min_samples_split': 4, 'min_samples_leaf': 1, 'min_weight_fraction_leaf': 0.111302358971819, 'min_impurity_decrease': 0.5629338471342286, 'max_features': 0.8967556893518723, 'subsample': 0.16184752231373772, 'dropout_rate': 0.7326364729826582, 'ccp_alpha': 0.36704585475556717}. Best is trial 202 with value: 0.8278350672519472.[0m
[32m[I 2022-04-21 14:35:20,237][0m Trial 207 finished with value: 0.8068255587101891 and parameters: {'loss': 'coxph', 'learning_rate': 0.0008015759487037824, 'n_estimators': 121, 'criterion': 'friedman_mse', 'min_samples_split': 4, 'min_samples_leaf': 1, 'min_weight_fraction_leaf': 0.11958763560903207, 'min_impurity_decrease': 0.5934812332976113, 'max_features': 0.9228163365007241, 'subsample': 0.07510931209238328, 'dropout_rate': 0.6821895162028536, 'ccp_alpha': 0.22783581824589166}. Best is trial 202 with value: 0.8278350672519472.[0m
[32m[I 2022-04-21 14:35:25,509][0m Trial 208 finished with value: 0.8160194604045499 and parameters: {'loss': 'coxph', 'learning_rate': 0.001566759340376225, 'n_estimators': 115, 'criterion': 'friedman_mse', 'min_samples_split': 4, 'min_samples_leaf': 1, 'min_weight_fraction_leaf': 0.1336085204245137, 'min_impurity_decrease': 0.5568591603399343, 'max_features': 0.8962598135632697, 'subsample': 0.10565384908867857, 'dropout_rate': 0.7386588286572788, 'ccp_alpha': 0.10334967608349464}. Best is trial 202 with value: 0.8278350672519472.[0m
[32m[I 2022-04-21 14:35:27,626][0m Trial 209 finished with value: 0.8179109954757365 and parameters: {'loss': 'coxph', 'learning_rate': 0.0009362779006135488, 'n_estimators': 104, 'criterion': 'friedman_mse', 'min_samples_split': 4, 'min_samples_leaf': 1, 'min_weight_fraction_leaf': 0.05509277640029777, 'min_impurity_decrease': 0.5340618952498137, 'max_features': 0.7872749385120107, 'subsample': 0.15371171807069461, 'dropout_rate': 0.9560734077423063, 'ccp_alpha': 0.0986644455853497}. Best is trial 202 with value: 0.8278350672519472.[0m
[32m[I 2022-04-21 14:35:31,849][0m Trial 210 finished with value: 0.46794511931557015 and parameters: {'loss': 'coxph', 'learning_rate': 0.0007140735814722256, 'n_estimators': 121, 'criterion': 'friedman_mse', 'min_samples_split': 4, 'min_samples_leaf': 1, 'min_weight_fraction_leaf': 0.14453258170151442, 'min_impurity_decrease': 0.579258121260486, 'max_features': 0.8758219925629706, 'subsample': 0.1733833327029602, 'dropout_rate': 0.6998254284170006, 'ccp_alpha': 0.32263359880645553}. Best is trial 202 with value: 0.8278350672519472.[0m
[32m[I 2022-04-21 14:35:37,159][0m Trial 211 finished with value: 0.8221739700881102 and parameters: {'loss': 'coxph', 'learning_rate': 0.000563716533354442, 'n_estimators': 107, 'criterion': 'friedman_mse', 'min_samples_split': 4, 'min_samples_leaf': 1, 'min_weight_fraction_leaf': 0.12691194235993591, 'min_impurity_decrease': 0.4960445994640026, 'max_features': 0.8690206111095016, 'subsample': 0.13381342615226133, 'dropout_rate': 0.76293912825966, 'ccp_alpha': 0.09573933580189921}. Best is trial 202 with value: 0.8278350672519472.[0m
[32m[I 2022-04-21 14:35:42,291][0m Trial 212 finished with value: 0.8086020906144503 and parameters: {'loss': 'coxph', 'learning_rate': 0.0004521844448279521, 'n_estimators': 106, 'criterion': 'friedman_mse', 'min_samples_split': 4, 'min_samples_leaf': 1, 'min_weight_fraction_leaf': 0.12406538202474397, 'min_impurity_decrease': 0.5324461110812037, 'max_features': 0.8298622665460109, 'subsample': 0.14986108628218298, 'dropout_rate': 0.7710573779831165, 'ccp_alpha': 0.2180863598493994}. Best is trial 202 with value: 0.8278350672519472.[0m
[32m[I 2022-04-21 14:35:48,601][0m Trial 213 finished with value: 0.8185819581280833 and parameters: {'loss': 'coxph', 'learning_rate': 0.0014645175779945438, 'n_estimators': 113, 'criterion': 'friedman_mse', 'min_samples_split': 4, 'min_samples_leaf': 1, 'min_weight_fraction_leaf': 0.13633817017968383, 'min_impurity_decrease': 0.49625365271919164, 'max_features': 0.9249616860271574, 'subsample': 0.13778298141534118, 'dropout_rate': 0.7252120724458186, 'ccp_alpha': 0.10778203122526733}. Best is trial 202 with value: 0.8278350672519472.[0m
[32m[I 2022-04-21 14:35:53,432][0m Trial 214 finished with value: 0.8172962358545112 and parameters: {'loss': 'coxph', 'learning_rate': 0.0011619579571695636, 'n_estimators': 104, 'criterion': 'friedman_mse', 'min_samples_split': 4, 'min_samples_leaf': 1, 'min_weight_fraction_leaf': 0.13063165319161374, 'min_impurity_decrease': 0.4959051833185568, 'max_features': 0.9268311012919431, 'subsample': 0.1335078045958864, 'dropout_rate': 0.7210267331594141, 'ccp_alpha': 0.0875488303242211}. Best is trial 202 with value: 0.8278350672519472.[0m
[32m[I 2022-04-21 14:36:01,224][0m Trial 215 finished with value: 0.8055330581335184 and parameters: {'loss': 'coxph', 'learning_rate': 0.0015110810110733645, 'n_estimators': 115, 'criterion': 'friedman_mse', 'min_samples_split': 4, 'min_samples_leaf': 1, 'min_weight_fraction_leaf': 0.03315879066888183, 'min_impurity_decrease': 0.5579189033290155, 'max_features': 0.902297270092081, 'subsample': 0.10857218794111863, 'dropout_rate': 0.7517409940293001, 'ccp_alpha': 0.20702172345344985}. Best is trial 202 with value: 0.8278350672519472.[0m
[32m[I 2022-04-21 14:36:06,983][0m Trial 216 finished with value: 0.8221699615198295 and parameters: {'loss': 'coxph', 'learning_rate': 0.0006738315125825853, 'n_estimators': 130, 'criterion': 'friedman_mse', 'min_samples_split': 4, 'min_samples_leaf': 1, 'min_weight_fraction_leaf': 0.1065098716715327, 'min_impurity_decrease': 0.5296374753418831, 'max_features': 0.8780715517353325, 'subsample': 0.17044802213402344, 'dropout_rate': 0.6688187902430804, 'ccp_alpha': 0.09976584285713733}. Best is trial 202 with value: 0.8278350672519472.[0m
/media/san2_ssd/data/Workdir/survival/venv/lib/python3.8/site-packages/sksurv/ensemble/boosting.py:955: RuntimeWarning: divide by zero encountered in log
  time = numpy.log(time)
/media/san2_ssd/data/Workdir/survival/venv/lib/python3.8/site-packages/sksurv/ensemble/boosting.py:955: RuntimeWarning: divide by zero encountered in log
  time = numpy.log(time)
/media/san2_ssd/data/Workdir/survival/venv/lib/python3.8/site-packages/sksurv/ensemble/boosting.py:955: RuntimeWarning: divide by zero encountered in log
  time = numpy.log(time)
/media/san2_ssd/data/Workdir/survival/venv/lib/python3.8/site-packages/sksurv/ensemble/boosting.py:955: RuntimeWarning: divide by zero encountered in log
  time = numpy.log(time)
[32m[I 2022-04-21 14:36:07,480][0m Trial 217 finished with value: -0.46473573069428314 and parameters: {'loss': 'squared', 'learning_rate': 0.0006905670400982386, 'n_estimators': 131, 'criterion': 'friedman_mse', 'min_samples_split': 4, 'min_samples_leaf': 1, 'min_weight_fraction_leaf': 0.10779838598232146, 'min_impurity_decrease': 0.5330440989938887, 'max_features': 0.8765934755120117, 'subsample': 0.1828080571100538, 'dropout_rate': 0.7591780602142337, 'ccp_alpha': 0.2985120074852178}. Best is trial 202 with value: 0.8278350672519472.[0m
[32m[I 2022-04-21 14:36:12,340][0m Trial 218 finished with value: 0.8065844601827459 and parameters: {'loss': 'coxph', 'learning_rate': 0.0008977561873790784, 'n_estimators': 124, 'criterion': 'friedman_mse', 'min_samples_split': 4, 'min_samples_leaf': 1, 'min_weight_fraction_leaf': 0.08755734903232859, 'min_impurity_decrease': 0.5215750681521977, 'max_features': 0.867723114426639, 'subsample': 0.16328903387316604, 'dropout_rate': 0.794440929319564, 'ccp_alpha': 0.21515317932107272}. Best is trial 202 with value: 0.8278350672519472.[0m
[32m[I 2022-04-21 14:36:19,152][0m Trial 219 finished with value: 0.25 and parameters: {'loss': 'coxph', 'learning_rate': 0.0005562973070137583, 'n_estimators': 120, 'criterion': 'friedman_mse', 'min_samples_split': 4, 'min_samples_leaf': 1, 'min_weight_fraction_leaf': 0.11595370848264082, 'min_impurity_decrease': 0.5572133214030766, 'max_features': 0.8929065254112146, 'subsample': 0.19295718398174105, 'dropout_rate': 0.7039994169932682, 'ccp_alpha': 0.4564153915515985}. Best is trial 202 with value: 0.8278350672519472.[0m
