[32m[I 2022-04-23 19:12:30,616][0m Trial 619 finished with value: 0.643768907211952 and parameters: {'n_hidden': 2048, 'mixture_components': 2, 'use_sparse_layer': False, 'use_batchnorm': False, 'use_dropout': True, 'dropout': 0.6019541849773425, 'mlp_size_1': 3, 'mlp_size_2': 3, 'mlp_size_3': 1, 'kernel': 'LogLogistic', 'loss_name': 'CensoredNLLLoss'}. Best is trial 551 with value: 0.6925048594105658.[0m
[32m[I 2022-04-23 19:13:41,491][0m Trial 620 finished with value: 0.6654449557704119 and parameters: {'n_hidden': 2048, 'mixture_components': 2, 'use_sparse_layer': False, 'use_batchnorm': False, 'use_dropout': True, 'dropout': 0.29116556607632726, 'mlp_size_1': 3, 'mlp_size_2': 3, 'mlp_size_3': 1, 'kernel': 'LogLogistic', 'loss_name': 'CensoredNLLLoss'}. Best is trial 551 with value: 0.6925048594105658.[0m
[32m[I 2022-04-23 19:14:23,618][0m Trial 621 finished with value: 0.6402543331448115 and parameters: {'n_hidden': 256, 'mixture_components': 1, 'use_sparse_layer': False, 'use_batchnorm': False, 'use_dropout': False, 'mlp_size_1': 3, 'mlp_size_2': 2, 'mlp_size_3': 0, 'kernel': 'LogLogistic', 'loss_name': 'AlternativeNLLLoss'}. Best is trial 551 with value: 0.6925048594105658.[0m
[32m[I 2022-04-23 19:15:39,645][0m Trial 622 finished with value: 0.6660143119685514 and parameters: {'n_hidden': 2048, 'mixture_components': 2, 'use_sparse_layer': False, 'use_batchnorm': False, 'use_dropout': True, 'dropout': 0.4082918758738314, 'mlp_size_1': 3, 'mlp_size_2': 3, 'mlp_size_3': 1, 'kernel': 'Logistic', 'loss_name': 'CensoredNLLLoss'}. Best is trial 551 with value: 0.6925048594105658.[0m
[32m[I 2022-04-23 19:16:50,841][0m Trial 623 finished with value: 0.6759636496588689 and parameters: {'n_hidden': 1024, 'mixture_components': 2, 'use_sparse_layer': True, 'use_sparse_loss': True, 'lmbd': 0.00012858580683168766, 'use_batchnorm': False, 'use_dropout': True, 'dropout': 0.2442188428439001, 'mlp_size_1': 3, 'mlp_size_2': 3, 'mlp_size_3': 1, 'kernel': 'Gumbel', 'loss_name': 'CensoredNLLLoss'}. Best is trial 551 with value: 0.6925048594105658.[0m
[32m[I 2022-04-23 19:20:00,289][0m Trial 624 finished with value: 0.6449776709219559 and parameters: {'n_hidden': 2048, 'mixture_components': 2, 'use_sparse_layer': False, 'use_batchnorm': True, 'use_dropout': True, 'dropout': 0.22767477021086607, 'mlp_size_1': 3, 'mlp_size_2': 3, 'mlp_size_3': 1, 'kernel': 'LogLogistic', 'loss_name': 'CensoredNLLLoss'}. Best is trial 551 with value: 0.6925048594105658.[0m
[32m[I 2022-04-23 19:21:17,487][0m Trial 625 finished with value: 0.6771961519224317 and parameters: {'n_hidden': 2048, 'mixture_components': 2, 'use_sparse_layer': False, 'use_batchnorm': False, 'use_dropout': True, 'dropout': 0.2723323903347726, 'mlp_size_1': 3, 'mlp_size_2': 3, 'mlp_size_3': 1, 'kernel': 'LogLogistic', 'loss_name': 'CensoredNLLLoss'}. Best is trial 551 with value: 0.6925048594105658.[0m
[32m[I 2022-04-23 19:22:24,453][0m Trial 626 finished with value: 0.6629807280762311 and parameters: {'n_hidden': 2048, 'mixture_components': 2, 'use_sparse_layer': False, 'use_batchnorm': False, 'use_dropout': True, 'dropout': 0.31135786024426626, 'mlp_size_1': 3, 'mlp_size_2': 3, 'mlp_size_3': 1, 'kernel': 'LogLogistic', 'loss_name': 'CensoredNLLLoss'}. Best is trial 551 with value: 0.6925048594105658.[0m
[32m[I 2022-04-23 19:23:36,704][0m Trial 627 finished with value: 0.6756657577793204 and parameters: {'n_hidden': 2048, 'mixture_components': 1, 'use_sparse_layer': False, 'use_batchnorm': False, 'use_dropout': True, 'dropout': 0.35702499882857114, 'mlp_size_1': 3, 'mlp_size_2': 4, 'mlp_size_3': 1, 'kernel': 'LogLogistic', 'loss_name': 'CensoredNLLLoss'}. Best is trial 551 with value: 0.6925048594105658.[0m
[32m[I 2022-04-23 19:24:51,839][0m Trial 628 finished with value: 0.6829120713993824 and parameters: {'n_hidden': 2048, 'mixture_components': 2, 'use_sparse_layer': False, 'use_batchnorm': False, 'use_dropout': True, 'dropout': 0.2193766468500824, 'mlp_size_1': 3, 'mlp_size_2': 3, 'mlp_size_3': 2, 'kernel': 'LogLogistic', 'loss_name': 'CensoredNLLLoss'}. Best is trial 551 with value: 0.6925048594105658.[0m
[32m[I 2022-04-23 19:25:45,236][0m Trial 629 finished with value: 0.6521091002105253 and parameters: {'n_hidden': 256, 'mixture_components': 2, 'use_sparse_layer': False, 'use_batchnorm': False, 'use_dropout': True, 'dropout': 0.21619976946316888, 'mlp_size_1': 3, 'mlp_size_2': 2, 'mlp_size_3': 0, 'kernel': 'Gumbel', 'loss_name': 'AlternativeNLLLoss'}. Best is trial 551 with value: 0.6925048594105658.[0m
[32m[I 2022-04-23 19:27:13,277][0m Trial 630 finished with value: 0.6874933791352463 and parameters: {'n_hidden': 2048, 'mixture_components': 2, 'use_sparse_layer': True, 'use_sparse_loss': True, 'lmbd': 6.169785042330071e-06, 'use_batchnorm': False, 'use_dropout': True, 'dropout': 0.22875844117011876, 'mlp_size_1': 8, 'mlp_size_2': 0, 'mlp_size_3': 0, 'kernel': 'LogLogistic', 'loss_name': 'CensoredNLLLoss'}. Best is trial 551 with value: 0.6925048594105658.[0m
[32m[I 2022-04-23 19:28:09,124][0m Trial 631 finished with value: -0.664388987189126 and parameters: {'n_hidden': 2048, 'mixture_components': 2, 'use_sparse_layer': False, 'use_batchnorm': False, 'use_dropout': True, 'dropout': 0.22063231496210398, 'mlp_size_1': 6, 'mlp_size_2': 2, 'mlp_size_3': 0, 'kernel': 'Exponential', 'loss_name': 'CensoredNLLLoss'}. Best is trial 551 with value: 0.6925048594105658.[0m
[32m[I 2022-04-23 19:29:26,963][0m Trial 632 finished with value: 0.6747243896379648 and parameters: {'n_hidden': 2048, 'mixture_components': 2, 'use_sparse_layer': False, 'use_batchnorm': False, 'use_dropout': True, 'dropout': 0.5332266259487217, 'mlp_size_1': 6, 'mlp_size_2': 2, 'mlp_size_3': 0, 'kernel': 'LogLogistic', 'loss_name': 'CensoredNLLLoss'}. Best is trial 551 with value: 0.6925048594105658.[0m
[32m[I 2022-04-23 19:30:21,977][0m Trial 633 finished with value: 0.6342475123712918 and parameters: {'n_hidden': 32, 'mixture_components': 2, 'use_sparse_layer': False, 'use_batchnorm': False, 'use_dropout': False, 'mlp_size_1': 2, 'mlp_size_2': 0, 'mlp_size_3': 0, 'kernel': 'LogLogistic', 'loss_name': 'CensoredNLLLoss'}. Best is trial 551 with value: 0.6925048594105658.[0m
[32m[I 2022-04-23 19:31:18,651][0m Trial 634 finished with value: 0.6643647731343645 and parameters: {'n_hidden': 1024, 'mixture_components': 2, 'use_sparse_layer': False, 'use_batchnorm': False, 'use_dropout': True, 'dropout': 0.24385154546415908, 'mlp_size_1': 3, 'mlp_size_2': 3, 'mlp_size_3': 1, 'kernel': 'LogLogistic', 'loss_name': 'CensoredNLLLoss'}. Best is trial 551 with value: 0.6925048594105658.[0m
[32m[I 2022-04-23 19:32:35,068][0m Trial 635 finished with value: 0.6771762053788609 and parameters: {'n_hidden': 2048, 'mixture_components': 2, 'use_sparse_layer': False, 'use_batchnorm': False, 'use_dropout': True, 'dropout': 0.21937823618064195, 'mlp_size_1': 6, 'mlp_size_2': 2, 'mlp_size_3': 0, 'kernel': 'LogLogistic', 'loss_name': 'CensoredNLLLoss'}. Best is trial 551 with value: 0.6925048594105658.[0m
[32m[I 2022-04-23 19:33:31,751][0m Trial 636 finished with value: 0.6548038114497665 and parameters: {'n_hidden': 64, 'mixture_components': 2, 'use_sparse_layer': True, 'use_sparse_loss': False, 'use_batchnorm': False, 'use_dropout': True, 'dropout': 0.23024021306955217, 'mlp_size_1': 3, 'mlp_size_2': 0, 'mlp_size_3': 0, 'kernel': 'Logistic', 'loss_name': 'CensoredNLLLoss'}. Best is trial 551 with value: 0.6925048594105658.[0m
[32m[I 2022-04-23 19:34:48,522][0m Trial 637 finished with value: 0.6810601162150478 and parameters: {'n_hidden': 2048, 'mixture_components': 2, 'use_sparse_layer': False, 'use_batchnorm': False, 'use_dropout': True, 'dropout': 0.2549040778805857, 'mlp_size_1': 3, 'mlp_size_2': 3, 'mlp_size_3': 2, 'kernel': 'LogLogistic', 'loss_name': 'AlternativeNLLLoss'}. Best is trial 551 with value: 0.6925048594105658.[0m
[32m[I 2022-04-23 19:35:42,041][0m Trial 638 finished with value: 0.6416602113131622 and parameters: {'n_hidden': 256, 'mixture_components': 2, 'use_sparse_layer': False, 'use_batchnorm': False, 'use_dropout': True, 'dropout': 0.23475544455242509, 'mlp_size_1': 5, 'mlp_size_2': 0, 'mlp_size_3': 0, 'kernel': 'Gumbel', 'loss_name': 'CensoredNLLLoss'}. Best is trial 551 with value: 0.6925048594105658.[0m
[32m[I 2022-04-23 19:36:47,541][0m Trial 639 finished with value: 0.660522799329452 and parameters: {'n_hidden': 128, 'mixture_components': 2, 'use_sparse_layer': False, 'use_batchnorm': False, 'use_dropout': True, 'dropout': 0.20797924365926726, 'mlp_size_1': 4, 'mlp_size_2': 0, 'mlp_size_3': 0, 'kernel': 'LogLogistic', 'loss_name': 'CensoredNLLLoss'}. Best is trial 551 with value: 0.6925048594105658.[0m
[32m[I 2022-04-23 19:38:03,368][0m Trial 640 finished with value: 0.6753628732278868 and parameters: {'n_hidden': 2048, 'mixture_components': 2, 'use_sparse_layer': False, 'use_batchnorm': False, 'use_dropout': True, 'dropout': 0.25042970223966565, 'mlp_size_1': 3, 'mlp_size_2': 3, 'mlp_size_3': 2, 'kernel': 'LogLogistic', 'loss_name': 'CensoredNLLLoss'}. Best is trial 551 with value: 0.6925048594105658.[0m
[32m[I 2022-04-23 19:39:08,774][0m Trial 641 finished with value: 0.6719561688108678 and parameters: {'n_hidden': 2048, 'mixture_components': 2, 'use_sparse_layer': False, 'use_batchnorm': False, 'use_dropout': True, 'dropout': 0.21871156559544083, 'mlp_size_1': 8, 'mlp_size_2': 0, 'mlp_size_3': 0, 'kernel': 'LogLogistic', 'loss_name': 'CensoredNLLLoss'}. Best is trial 551 with value: 0.6925048594105658.[0m
[32m[I 2022-04-23 19:40:31,349][0m Trial 642 finished with value: 0.6057104045006917 and parameters: {'n_hidden': 2048, 'mixture_components': 2, 'use_sparse_layer': True, 'use_sparse_loss': True, 'lmbd': 5.63143474918944e-06, 'use_batchnorm': False, 'use_dropout': True, 'dropout': 0.23693441977696278, 'mlp_size_1': 8, 'mlp_size_2': 0, 'mlp_size_3': 0, 'kernel': 'LogLogistic', 'loss_name': 'CensoredNLLLoss'}. Best is trial 551 with value: 0.6925048594105658.[0m
[32m[I 2022-04-23 19:42:26,990][0m Trial 643 finished with value: 0.6520423159667408 and parameters: {'n_hidden': 2048, 'mixture_components': 2, 'use_sparse_layer': False, 'use_batchnorm': True, 'use_dropout': True, 'dropout': 0.26591759736651377, 'mlp_size_1': 6, 'mlp_size_2': 2, 'mlp_size_3': 0, 'kernel': 'LogLogistic', 'loss_name': 'CensoredNLLLoss'}. Best is trial 551 with value: 0.6925048594105658.[0m
[32m[I 2022-04-23 19:43:21,353][0m Trial 644 finished with value: -0.6645348443641703 and parameters: {'n_hidden': 2048, 'mixture_components': 2, 'use_sparse_layer': False, 'use_batchnorm': False, 'use_dropout': False, 'mlp_size_1': 8, 'mlp_size_2': 0, 'mlp_size_3': 0, 'kernel': 'Exponential', 'loss_name': 'AlternativeNLLLoss'}. Best is trial 551 with value: 0.6925048594105658.[0m
[32m[I 2022-04-23 19:44:41,828][0m Trial 645 finished with value: 0.6417454155512232 and parameters: {'n_hidden': 2048, 'mixture_components': 2, 'use_sparse_layer': False, 'use_batchnorm': False, 'use_dropout': True, 'dropout': 0.246410574888845, 'mlp_size_1': 8, 'mlp_size_2': 0, 'mlp_size_3': 0, 'kernel': 'Gumbel', 'loss_name': 'CensoredNLLLoss'}. Best is trial 551 with value: 0.6925048594105658.[0m
[32m[I 2022-04-23 19:45:36,515][0m Trial 646 finished with value: 0.6648187333424661 and parameters: {'n_hidden': 256, 'mixture_components': 2, 'use_sparse_layer': False, 'use_batchnorm': False, 'use_dropout': True, 'dropout': 0.2099875012903517, 'mlp_size_1': 4, 'mlp_size_2': 1, 'mlp_size_3': 0, 'kernel': 'LogLogistic', 'loss_name': 'CensoredNLLLoss'}. Best is trial 551 with value: 0.6925048594105658.[0m
[32m[I 2022-04-23 19:46:39,421][0m Trial 647 finished with value: 0.6729887158276461 and parameters: {'n_hidden': 1024, 'mixture_components': 2, 'use_sparse_layer': False, 'use_batchnorm': False, 'use_dropout': True, 'dropout': 0.26131458229522714, 'mlp_size_1': 3, 'mlp_size_2': 3, 'mlp_size_3': 1, 'kernel': 'LogLogistic', 'loss_name': 'CensoredNLLLoss'}. Best is trial 551 with value: 0.6925048594105658.[0m
[32m[I 2022-04-23 19:48:21,264][0m Trial 648 finished with value: 0.6774974938895396 and parameters: {'n_hidden': 2048, 'mixture_components': 2, 'use_sparse_layer': True, 'use_sparse_loss': True, 'lmbd': 2.3768635554881727e-06, 'use_batchnorm': False, 'use_dropout': True, 'dropout': 0.22778035024588517, 'mlp_size_1': 8, 'mlp_size_2': 0, 'mlp_size_3': 0, 'kernel': 'LogLogistic', 'loss_name': 'CensoredNLLLoss'}. Best is trial 551 with value: 0.6925048594105658.[0m
[32m[I 2022-04-23 19:49:39,063][0m Trial 649 finished with value: 0.6523367860701585 and parameters: {'n_hidden': 2048, 'mixture_components': 2, 'use_sparse_layer': False, 'use_batchnorm': False, 'use_dropout': True, 'dropout': 0.2020437514673376, 'mlp_size_1': 8, 'mlp_size_2': 0, 'mlp_size_3': 0, 'kernel': 'LogLogistic', 'loss_name': 'CensoredNLLLoss'}. Best is trial 551 with value: 0.6925048594105658.[0m
[32m[I 2022-04-23 19:51:05,556][0m Trial 650 finished with value: 0.64149094702368 and parameters: {'n_hidden': 2048, 'mixture_components': 2, 'use_sparse_layer': False, 'use_batchnorm': False, 'use_dropout': True, 'dropout': 0.2713421720522097, 'mlp_size_1': 8, 'mlp_size_2': 0, 'mlp_size_3': 0, 'kernel': 'LogLogistic', 'loss_name': 'CensoredNLLLoss'}. Best is trial 551 with value: 0.6925048594105658.[0m
[32m[I 2022-04-23 19:52:40,951][0m Trial 651 finished with value: 0.6528889883759635 and parameters: {'n_hidden': 2048, 'mixture_components': 2, 'use_sparse_layer': False, 'use_batchnorm': False, 'use_dropout': True, 'dropout': 0.22373364278302726, 'mlp_size_1': 8, 'mlp_size_2': 0, 'mlp_size_3': 0, 'kernel': 'LogLogistic', 'loss_name': 'CensoredNLLLoss'}. Best is trial 551 with value: 0.6925048594105658.[0m
[32m[I 2022-04-23 19:53:50,202][0m Trial 652 finished with value: 0.6684642560359892 and parameters: {'n_hidden': 2048, 'mixture_components': 2, 'use_sparse_layer': False, 'use_batchnorm': False, 'use_dropout': True, 'dropout': 0.2477435753731983, 'mlp_size_1': 3, 'mlp_size_2': 3, 'mlp_size_3': 2, 'kernel': 'Gumbel', 'loss_name': 'AlternativeNLLLoss'}. Best is trial 551 with value: 0.6925048594105658.[0m
[32m[I 2022-04-23 19:54:45,173][0m Trial 653 finished with value: 0.6650962760456305 and parameters: {'n_hidden': 256, 'mixture_components': 2, 'use_sparse_layer': False, 'use_batchnorm': False, 'use_dropout': True, 'dropout': 0.2077218128327006, 'mlp_size_1': 4, 'mlp_size_2': 1, 'mlp_size_3': 0, 'kernel': 'Logistic', 'loss_name': 'CensoredNLLLoss'}. Best is trial 551 with value: 0.6925048594105658.[0m
[32m[I 2022-04-23 19:55:58,205][0m Trial 654 finished with value: 0.668379675076706 and parameters: {'n_hidden': 2048, 'mixture_components': 2, 'use_sparse_layer': False, 'use_batchnorm': False, 'use_dropout': True, 'dropout': 0.2403022097236166, 'mlp_size_1': 3, 'mlp_size_2': 3, 'mlp_size_3': 1, 'kernel': 'LogLogistic', 'loss_name': 'CensoredNLLLoss'}. Best is trial 551 with value: 0.6925048594105658.[0m
[32m[I 2022-04-23 19:57:27,188][0m Trial 655 finished with value: 0.6614487762719572 and parameters: {'n_hidden': 2048, 'mixture_components': 6, 'use_sparse_layer': True, 'use_sparse_loss': True, 'lmbd': 7.528225691190696e-06, 'use_batchnorm': False, 'use_dropout': True, 'dropout': 0.2725967200968238, 'mlp_size_1': 1, 'mlp_size_2': 4, 'mlp_size_3': 2, 'kernel': 'LogLogistic', 'loss_name': 'CensoredNLLLoss'}. Best is trial 551 with value: 0.6925048594105658.[0m
[32m[I 2022-04-23 19:58:16,404][0m Trial 656 finished with value: 0.6097712545923212 and parameters: {'n_hidden': 32, 'mixture_components': 2, 'use_sparse_layer': False, 'use_batchnorm': False, 'use_dropout': False, 'mlp_size_1': 2, 'mlp_size_2': 0, 'mlp_size_3': 0, 'kernel': 'LogLogistic', 'loss_name': 'CensoredNLLLoss'}. Best is trial 551 with value: 0.6925048594105658.[0m
[32m[I 2022-04-23 19:59:23,895][0m Trial 657 finished with value: 0.6493349300491534 and parameters: {'n_hidden': 2048, 'mixture_components': 2, 'use_sparse_layer': False, 'use_batchnorm': False, 'use_dropout': True, 'dropout': 0.726432802872759, 'mlp_size_1': 6, 'mlp_size_2': 2, 'mlp_size_3': 0, 'kernel': 'LogLogistic', 'loss_name': 'CensoredNLLLoss'}. Best is trial 551 with value: 0.6925048594105658.[0m
[32m[I 2022-04-23 20:00:02,584][0m Trial 658 finished with value: -0.6684110315182789 and parameters: {'n_hidden': 64, 'mixture_components': 2, 'use_sparse_layer': False, 'use_batchnorm': False, 'use_dropout': True, 'dropout': 0.2254975587075558, 'mlp_size_1': 3, 'mlp_size_2': 0, 'mlp_size_3': 0, 'kernel': 'Exponential', 'loss_name': 'CensoredNLLLoss'}. Best is trial 551 with value: 0.6925048594105658.[0m
[32m[I 2022-04-23 20:01:22,758][0m Trial 659 finished with value: 0.6505769499463947 and parameters: {'n_hidden': 2048, 'mixture_components': 10, 'use_sparse_layer': False, 'use_batchnorm': False, 'use_dropout': True, 'dropout': 0.20209280411352154, 'mlp_size_1': 4, 'mlp_size_2': 3, 'mlp_size_3': 1, 'kernel': 'LogLogistic', 'loss_name': 'AlternativeNLLLoss'}. Best is trial 551 with value: 0.6925048594105658.[0m
[32m[I 2022-04-23 20:02:18,762][0m Trial 660 finished with value: 0.6454199534529945 and parameters: {'n_hidden': 1024, 'mixture_components': 2, 'use_sparse_layer': False, 'use_batchnorm': False, 'use_dropout': True, 'dropout': 0.05436528306908018, 'mlp_size_1': 4, 'mlp_size_2': 3, 'mlp_size_3': 0, 'kernel': 'LogLogistic', 'loss_name': 'CensoredNLLLoss'}. Best is trial 551 with value: 0.6925048594105658.[0m
[32m[I 2022-04-23 20:03:28,019][0m Trial 661 finished with value: 0.6412043944110389 and parameters: {'n_hidden': 128, 'mixture_components': 2, 'use_sparse_layer': True, 'use_sparse_loss': False, 'use_batchnorm': False, 'use_dropout': True, 'dropout': 0.28051159703785794, 'mlp_size_1': 4, 'mlp_size_2': 0, 'mlp_size_3': 0, 'kernel': 'Gumbel', 'loss_name': 'CensoredNLLLoss'}. Best is trial 551 with value: 0.6925048594105658.[0m
[32m[I 2022-04-23 20:05:19,403][0m Trial 662 finished with value: 0.6614301690662705 and parameters: {'n_hidden': 2048, 'mixture_components': 7, 'use_sparse_layer': False, 'use_batchnorm': False, 'use_dropout': True, 'dropout': 0.18843182678842574, 'mlp_size_1': 8, 'mlp_size_2': 0, 'mlp_size_3': 0, 'kernel': 'LogLogistic', 'loss_name': 'CensoredNLLLoss'}. Best is trial 551 with value: 0.6925048594105658.[0m
[32m[I 2022-04-23 20:06:29,174][0m Trial 663 finished with value: 0.6800738305677748 and parameters: {'n_hidden': 2048, 'mixture_components': 2, 'use_sparse_layer': False, 'use_batchnorm': False, 'use_dropout': True, 'dropout': 0.025987459037512456, 'mlp_size_1': 3, 'mlp_size_2': 3, 'mlp_size_3': 1, 'kernel': 'LogLogistic', 'loss_name': 'CensoredNLLLoss'}. Best is trial 551 with value: 0.6925048594105658.[0m
[32m[I 2022-04-23 20:08:52,738][0m Trial 664 finished with value: 0.6289441329103155 and parameters: {'n_hidden': 2048, 'mixture_components': 2, 'use_sparse_layer': False, 'use_batchnorm': True, 'use_dropout': True, 'dropout': 0.2576541695455793, 'mlp_size_1': 6, 'mlp_size_2': 2, 'mlp_size_3': 0, 'kernel': 'LogLogistic', 'loss_name': 'CensoredNLLLoss'}. Best is trial 551 with value: 0.6925048594105658.[0m
[32m[I 2022-04-23 20:09:46,719][0m Trial 665 finished with value: 0.6511710117400765 and parameters: {'n_hidden': 256, 'mixture_components': 2, 'use_sparse_layer': False, 'use_batchnorm': False, 'use_dropout': True, 'dropout': 0.46823285459119024, 'mlp_size_1': 5, 'mlp_size_2': 0, 'mlp_size_3': 0, 'kernel': 'LogLogistic', 'loss_name': 'CensoredNLLLoss'}. Best is trial 551 with value: 0.6925048594105658.[0m
[32m[I 2022-04-23 20:10:51,495][0m Trial 666 finished with value: 0.6598429751571937 and parameters: {'n_hidden': 2048, 'mixture_components': 2, 'use_sparse_layer': False, 'use_batchnorm': False, 'use_dropout': False, 'mlp_size_1': 3, 'mlp_size_2': 3, 'mlp_size_3': 1, 'kernel': 'LogLogistic', 'loss_name': 'CensoredNLLLoss'}. Best is trial 551 with value: 0.6925048594105658.[0m
[32m[I 2022-04-23 20:12:11,969][0m Trial 667 finished with value: 0.6416490019010472 and parameters: {'n_hidden': 2048, 'mixture_components': 2, 'use_sparse_layer': True, 'use_sparse_loss': True, 'lmbd': 3.812822869066257e-05, 'use_batchnorm': False, 'use_dropout': True, 'dropout': 0.6432994842493309, 'mlp_size_1': 4, 'mlp_size_2': 3, 'mlp_size_3': 1, 'kernel': 'Logistic', 'loss_name': 'AlternativeNLLLoss'}. Best is trial 551 with value: 0.6925048594105658.[0m
[32m[I 2022-04-23 20:13:34,382][0m Trial 668 finished with value: 0.6536058816715589 and parameters: {'n_hidden': 2048, 'mixture_components': 2, 'use_sparse_layer': False, 'use_batchnorm': False, 'use_dropout': True, 'dropout': 0.22547634145394527, 'mlp_size_1': 4, 'mlp_size_2': 3, 'mlp_size_3': 1, 'kernel': 'Gumbel', 'loss_name': 'CensoredNLLLoss'}. Best is trial 551 with value: 0.6925048594105658.[0m
[32m[I 2022-04-23 20:14:46,508][0m Trial 669 finished with value: 0.6748900638826577 and parameters: {'n_hidden': 2048, 'mixture_components': 2, 'use_sparse_layer': False, 'use_batchnorm': False, 'use_dropout': True, 'dropout': 0.24864549245852335, 'mlp_size_1': 3, 'mlp_size_2': 3, 'mlp_size_3': 2, 'kernel': 'LogLogistic', 'loss_name': 'CensoredNLLLoss'}. Best is trial 551 with value: 0.6925048594105658.[0m
[32m[I 2022-04-23 20:15:46,165][0m Trial 670 finished with value: 0.6637409524869974 and parameters: {'n_hidden': 1024, 'mixture_components': 2, 'use_sparse_layer': False, 'use_batchnorm': False, 'use_dropout': True, 'dropout': 0.040491586156539305, 'mlp_size_1': 3, 'mlp_size_2': 3, 'mlp_size_3': 1, 'kernel': 'LogLogistic', 'loss_name': 'CensoredNLLLoss'}. Best is trial 551 with value: 0.6925048594105658.[0m
