[32m[I 2022-04-21 11:52:22,134][0m Trial 966 finished with value: 0.5450461603346979 and parameters: {'splitter': 'best', 'min_samples_split': 0.08310214431535003, 'min_samples_leaf': 0.01770794816170934, 'min_weight_fraction_leaf': 0.26583204565944896, 'max_features': 0.4918186611587637}. Best is trial 688 with value: 0.6612018755665507.[0m
[32m[I 2022-04-21 11:52:22,538][0m Trial 967 finished with value: 0.6086836234814372 and parameters: {'splitter': 'best', 'min_samples_split': 0.09984504719140636, 'min_samples_leaf': 0.02944092507155062, 'min_weight_fraction_leaf': 0.07268819648678708, 'max_features': 0.44114561911023475}. Best is trial 688 with value: 0.6612018755665507.[0m
[32m[I 2022-04-21 11:52:23,369][0m Trial 968 finished with value: 0.6478011467146596 and parameters: {'splitter': 'best', 'min_samples_split': 0.3152725585272925, 'min_samples_leaf': 0.014890476840499376, 'min_weight_fraction_leaf': 0.00887117866552874, 'max_features': 0.5873100151223197}. Best is trial 688 with value: 0.6612018755665507.[0m
[32m[I 2022-04-21 11:52:23,764][0m Trial 969 finished with value: 0.6268092254603382 and parameters: {'splitter': 'best', 'min_samples_split': 0.15692746539651414, 'min_samples_leaf': 0.0106107239164576, 'min_weight_fraction_leaf': 0.011809923508674913, 'max_features': 0.5776406280724948}. Best is trial 688 with value: 0.6612018755665507.[0m
[32m[I 2022-04-21 11:52:24,176][0m Trial 970 finished with value: 0.6288902849293956 and parameters: {'splitter': 'best', 'min_samples_split': 0.40316700889938983, 'min_samples_leaf': 0.009584299906887398, 'min_weight_fraction_leaf': 0.0071765344611157186, 'max_features': 0.5632968498795236}. Best is trial 688 with value: 0.6612018755665507.[0m
[32m[I 2022-04-21 11:52:24,542][0m Trial 971 finished with value: 0.6329485719096047 and parameters: {'splitter': 'best', 'min_samples_split': 0.1486222453987837, 'min_samples_leaf': 0.011122147052524824, 'min_weight_fraction_leaf': 0.0005584332354594719, 'max_features': 0.5316354727767005}. Best is trial 688 with value: 0.6612018755665507.[0m
[32m[I 2022-04-21 11:52:24,636][0m Trial 972 finished with value: 0.5973042529667488 and parameters: {'splitter': 'random', 'min_samples_split': 0.4215670291752599, 'min_samples_leaf': 0.019495588169576247, 'min_weight_fraction_leaf': 0.008390615650859887, 'max_features': 0.5545399946939875}. Best is trial 688 with value: 0.6612018755665507.[0m
[32m[I 2022-04-21 11:52:24,753][0m Trial 973 finished with value: 0.63255156674591 and parameters: {'splitter': 'best', 'min_samples_split': 0.36409544436942787, 'min_samples_leaf': 0.0013637884008140411, 'min_weight_fraction_leaf': 0.008663035633328348, 'max_features': 0.06247675941195835}. Best is trial 688 with value: 0.6612018755665507.[0m
[32m[I 2022-04-21 11:52:25,025][0m Trial 974 finished with value: 0.6096847995295518 and parameters: {'splitter': 'best', 'min_samples_split': 0.3191470094409916, 'min_samples_leaf': 0.008954956911879365, 'min_weight_fraction_leaf': 0.023954777989687738, 'max_features': 0.5106609538917423}. Best is trial 688 with value: 0.6612018755665507.[0m
[32m[I 2022-04-21 11:52:25,157][0m Trial 975 finished with value: 0.5309177313735519 and parameters: {'splitter': 'best', 'min_samples_split': 0.2563363521476815, 'min_samples_leaf': 0.018750892058565193, 'min_weight_fraction_leaf': 0.46830401851862113, 'max_features': 0.6016881032843596}. Best is trial 688 with value: 0.6612018755665507.[0m
[32m[I 2022-04-21 11:52:25,472][0m Trial 976 finished with value: 0.599644145681609 and parameters: {'splitter': 'best', 'min_samples_split': 0.14182453622360058, 'min_samples_leaf': 0.009810099532317304, 'min_weight_fraction_leaf': 0.1928558413606014, 'max_features': 0.5773582153173262}. Best is trial 688 with value: 0.6612018755665507.[0m
[32m[I 2022-04-21 11:52:26,029][0m Trial 977 finished with value: 0.62122607533725 and parameters: {'splitter': 'best', 'min_samples_split': 0.3340229376978804, 'min_samples_leaf': 0.025155349450575376, 'min_weight_fraction_leaf': 0.016961476682620324, 'max_features': 0.5797682436075892}. Best is trial 688 with value: 0.6612018755665507.[0m
[32m[I 2022-04-21 11:52:26,746][0m Trial 978 finished with value: 0.6385227662177302 and parameters: {'splitter': 'best', 'min_samples_split': 0.37231011035267403, 'min_samples_leaf': 0.016604651499176778, 'min_weight_fraction_leaf': 0.007951926579254634, 'max_features': 0.5293899054903147}. Best is trial 688 with value: 0.6612018755665507.[0m
[32m[I 2022-04-21 11:52:27,032][0m Trial 979 finished with value: 0.5908758505444272 and parameters: {'splitter': 'best', 'min_samples_split': 0.3021002153499287, 'min_samples_leaf': 0.20821818146801216, 'min_weight_fraction_leaf': 0.016659534867085088, 'max_features': 0.5508939270822775}. Best is trial 688 with value: 0.6612018755665507.[0m
[32m[I 2022-04-21 11:52:27,977][0m Trial 980 finished with value: 0.6385855229219114 and parameters: {'splitter': 'best', 'min_samples_split': 0.31201829173131584, 'min_samples_leaf': 0.009056803777516552, 'min_weight_fraction_leaf': 0.0002774904726129783, 'max_features': 0.5898115002127203}. Best is trial 688 with value: 0.6612018755665507.[0m
[32m[I 2022-04-21 11:52:28,505][0m Trial 981 finished with value: 0.6130517692680442 and parameters: {'splitter': 'best', 'min_samples_split': 0.16584168660463092, 'min_samples_leaf': 0.024832153967864676, 'min_weight_fraction_leaf': 0.025792534972359404, 'max_features': 0.35827188733427134}. Best is trial 688 with value: 0.6612018755665507.[0m
[32m[I 2022-04-21 11:52:28,892][0m Trial 982 finished with value: 0.6117423954794552 and parameters: {'splitter': 'best', 'min_samples_split': 0.06298139952048787, 'min_samples_leaf': 0.035665060157380656, 'min_weight_fraction_leaf': 0.009894338093971854, 'max_features': 0.5929795273925582}. Best is trial 688 with value: 0.6612018755665507.[0m
[32m[I 2022-04-21 11:52:29,291][0m Trial 983 finished with value: 0.632565497366304 and parameters: {'splitter': 'best', 'min_samples_split': 0.07539907381029269, 'min_samples_leaf': 0.0016700000095047855, 'min_weight_fraction_leaf': 0.017512432381260056, 'max_features': 0.4688913823870725}. Best is trial 688 with value: 0.6612018755665507.[0m
[32m[I 2022-04-21 11:52:29,723][0m Trial 984 finished with value: 0.6303541112918912 and parameters: {'splitter': 'best', 'min_samples_split': 0.28077945611957295, 'min_samples_leaf': 0.01605758250038345, 'min_weight_fraction_leaf': 0.00022904170673490772, 'max_features': 0.5633447503234742}. Best is trial 688 with value: 0.6612018755665507.[0m
[32m[I 2022-04-21 11:52:30,505][0m Trial 985 finished with value: 0.6120646597730357 and parameters: {'splitter': 'best', 'min_samples_split': 0.28889538190913466, 'min_samples_leaf': 0.009592870207247813, 'min_weight_fraction_leaf': 0.03354296306243843, 'max_features': 0.8636257131250804}. Best is trial 688 with value: 0.6612018755665507.[0m
[32m[I 2022-04-21 11:52:31,071][0m Trial 986 finished with value: 0.6094834400430389 and parameters: {'splitter': 'best', 'min_samples_split': 0.4574226722884601, 'min_samples_leaf': 0.029462025113550554, 'min_weight_fraction_leaf': 0.08035988333253473, 'max_features': 0.8356949932272506}. Best is trial 688 with value: 0.6612018755665507.[0m
[32m[I 2022-04-21 11:52:31,402][0m Trial 987 finished with value: 0.6355956745057201 and parameters: {'splitter': 'best', 'min_samples_split': 0.16255174511281062, 'min_samples_leaf': 0.01932361096743678, 'min_weight_fraction_leaf': 0.02302650448731784, 'max_features': 0.6121297278392219}. Best is trial 688 with value: 0.6612018755665507.[0m
[32m[I 2022-04-21 11:52:32,110][0m Trial 988 finished with value: 0.6158759636323723 and parameters: {'splitter': 'best', 'min_samples_split': 0.38695237753817463, 'min_samples_leaf': 0.009758494158383134, 'min_weight_fraction_leaf': 0.11905901650425849, 'max_features': 0.8205242622008494}. Best is trial 688 with value: 0.6612018755665507.[0m
[32m[I 2022-04-21 11:52:32,537][0m Trial 989 finished with value: 0.6239535513179859 and parameters: {'splitter': 'random', 'min_samples_split': 0.24261269638934957, 'min_samples_leaf': 0.02327950805621957, 'min_weight_fraction_leaf': 0.00859336702505235, 'max_features': 0.8513144372716579}. Best is trial 688 with value: 0.6612018755665507.[0m
[32m[I 2022-04-21 11:52:33,518][0m Trial 990 finished with value: 0.6376364355002968 and parameters: {'splitter': 'best', 'min_samples_split': 0.3356662686854666, 'min_samples_leaf': 0.009099756412726409, 'min_weight_fraction_leaf': 5.459777224122429e-05, 'max_features': 0.5891204150209026}. Best is trial 688 with value: 0.6612018755665507.[0m
[32m[I 2022-04-21 11:52:34,029][0m Trial 991 finished with value: 0.6205189859838015 and parameters: {'splitter': 'best', 'min_samples_split': 0.1353689966656519, 'min_samples_leaf': 0.0010295009812360308, 'min_weight_fraction_leaf': 0.0183035649347544, 'max_features': 0.569068764037734}. Best is trial 688 with value: 0.6612018755665507.[0m
[32m[I 2022-04-21 11:52:34,305][0m Trial 992 finished with value: 0.5460803020249596 and parameters: {'splitter': 'best', 'min_samples_split': 0.4086714796345139, 'min_samples_leaf': 0.03655341692760848, 'min_weight_fraction_leaf': 0.28419452556680536, 'max_features': 0.9232976079216484}. Best is trial 688 with value: 0.6612018755665507.[0m
[32m[I 2022-04-21 11:52:34,753][0m Trial 993 finished with value: 0.6264124609922268 and parameters: {'splitter': 'best', 'min_samples_split': 0.08574306032121956, 'min_samples_leaf': 0.018258051367207546, 'min_weight_fraction_leaf': 0.030280055227435942, 'max_features': 0.6350174277390422}. Best is trial 688 with value: 0.6612018755665507.[0m
[32m[I 2022-04-21 11:52:35,270][0m Trial 994 finished with value: 0.6328799608452027 and parameters: {'splitter': 'best', 'min_samples_split': 0.1532119801195907, 'min_samples_leaf': 0.026058051039562827, 'min_weight_fraction_leaf': 2.8362270715827018e-05, 'max_features': 0.8319508089135018}. Best is trial 688 with value: 0.6612018755665507.[0m
[32m[I 2022-04-21 11:52:35,348][0m Trial 995 finished with value: 0.506214055937101 and parameters: {'splitter': 'best', 'min_samples_split': 0.12940900999448302, 'min_samples_leaf': 0.4998873453764165, 'min_weight_fraction_leaf': 0.4168575229380142, 'max_features': 0.6142464636864062}. Best is trial 688 with value: 0.6612018755665507.[0m
[32m[I 2022-04-21 11:52:35,791][0m Trial 996 finished with value: 0.6103495538000416 and parameters: {'splitter': 'best', 'min_samples_split': 0.09751071235711715, 'min_samples_leaf': 0.001199500668558919, 'min_weight_fraction_leaf': 0.04744369879976175, 'max_features': 0.5056534912264447}. Best is trial 688 with value: 0.6612018755665507.[0m
[32m[I 2022-04-21 11:52:37,151][0m Trial 997 finished with value: 0.6546274903042416 and parameters: {'splitter': 'best', 'min_samples_split': 0.14670002925636666, 'min_samples_leaf': 0.016490151003342696, 'min_weight_fraction_leaf': 0.014383868912307526, 'max_features': 0.8091758365044782}. Best is trial 688 with value: 0.6612018755665507.[0m
[32m[I 2022-04-21 11:52:37,502][0m Trial 998 finished with value: 0.6323622289370208 and parameters: {'splitter': 'best', 'min_samples_split': 0.14770909375902988, 'min_samples_leaf': 0.040726398059608634, 'min_weight_fraction_leaf': 0.009385875826175031, 'max_features': 0.8604590467249906}. Best is trial 688 with value: 0.6612018755665507.[0m
[32m[I 2022-04-21 11:52:37,956][0m Trial 999 finished with value: 0.6186031712772637 and parameters: {'splitter': 'best', 'min_samples_split': 0.2684077275582342, 'min_samples_leaf': 0.03112955502264823, 'min_weight_fraction_leaf': 0.014568774336150444, 'max_features': 0.8435784319519795}. Best is trial 688 with value: 0.6612018755665507.[0m
SurvivalTree
Running Optimizer with LogRank binary scoring
{'splitter': 'best', 'min_samples_split': 0.1450919885972804, 'min_samples_leaf': 0.009625987665255971, 'min_weight_fraction_leaf': 0.008849383628667822, 'max_features': 0.42417252129869437, 'UnoC_LR': 0.8340697555858835}
Running Optimizer normaly
{'splitter': 'best', 'min_samples_split': 0.181488236332204, 'min_samples_leaf': 0.0015599524210311543, 'min_weight_fraction_leaf': 0.010651339121299435, 'max_features': 0.8065393331335484, 'UnoC': 0.6612018755665507}
