[32m[I 2022-04-23 09:14:26,496][0m Trial 928 finished with value: 0.5 and parameters: {'loss': 'coxph', 'learning_rate': 0.04788280211068394, 'n_estimators': 556, 'criterion': 'squared_error', 'min_samples_split': 9, 'min_samples_leaf': 5, 'min_weight_fraction_leaf': 0.042999745770158804, 'min_impurity_decrease': 0.6090831335133392, 'max_features': 0.2530081746384901, 'subsample': 0.23251362526330985, 'dropout_rate': 0.0795054940600867, 'ccp_alpha': 0.16219976334520597}. Best is trial 690 with value: 0.6691837560454439.[0m
[32m[I 2022-04-23 09:15:51,012][0m Trial 929 finished with value: 0.6548927174923932 and parameters: {'loss': 'coxph', 'learning_rate': 0.0002689983583777284, 'n_estimators': 583, 'criterion': 'friedman_mse', 'min_samples_split': 9, 'min_samples_leaf': 6, 'min_weight_fraction_leaf': 0.048683610398042865, 'min_impurity_decrease': 0.5276451487522695, 'max_features': 0.5704402141645596, 'subsample': 0.2796290983625638, 'dropout_rate': 0.17357889802443205, 'ccp_alpha': 0.0942831481815218}. Best is trial 690 with value: 0.6691837560454439.[0m
[32m[I 2022-04-23 09:17:24,352][0m Trial 930 finished with value: 0.5323500007259224 and parameters: {'loss': 'coxph', 'learning_rate': 0.0805962460895439, 'n_estimators': 613, 'criterion': 'friedman_mse', 'min_samples_split': 9, 'min_samples_leaf': 5, 'min_weight_fraction_leaf': 0.017367652354573004, 'min_impurity_decrease': 0.4726638543763113, 'max_features': 0.12191796818168449, 'subsample': 0.25585270435187624, 'dropout_rate': 0.15101122164927577, 'ccp_alpha': 0.2457949731647834}. Best is trial 690 with value: 0.6691837560454439.[0m
[32m[I 2022-04-23 09:19:06,943][0m Trial 931 finished with value: 0.6547060124149756 and parameters: {'loss': 'coxph', 'learning_rate': 0.03469279170202533, 'n_estimators': 650, 'criterion': 'friedman_mse', 'min_samples_split': 9, 'min_samples_leaf': 6, 'min_weight_fraction_leaf': 0.035494607981258204, 'min_impurity_decrease': 0.5093251988713795, 'max_features': 0.6269994362388991, 'subsample': 0.29733237403043766, 'dropout_rate': 0.17578606574619995, 'ccp_alpha': 0.0930692406461931}. Best is trial 690 with value: 0.6691837560454439.[0m
[32m[I 2022-04-23 09:20:20,470][0m Trial 932 finished with value: 0.5 and parameters: {'loss': 'coxph', 'learning_rate': 2.2129698619511628e-05, 'n_estimators': 544, 'criterion': 'friedman_mse', 'min_samples_split': 9, 'min_samples_leaf': 7, 'min_weight_fraction_leaf': 0.05249429404860517, 'min_impurity_decrease': 0.45910712448607266, 'max_features': 0.04159801815676217, 'subsample': 0.9073370547758801, 'dropout_rate': 0.14747811779126546, 'ccp_alpha': 0.3752360097803049}. Best is trial 690 with value: 0.6691837560454439.[0m
[32m[I 2022-04-23 09:22:06,502][0m Trial 933 finished with value: 0.658788507779006 and parameters: {'loss': 'coxph', 'learning_rate': 0.05691877234918403, 'n_estimators': 629, 'criterion': 'friedman_mse', 'min_samples_split': 9, 'min_samples_leaf': 5, 'min_weight_fraction_leaf': 0.025393741740165038, 'min_impurity_decrease': 0.4436117070301307, 'max_features': 0.8542938847215189, 'subsample': 0.2172027675015112, 'dropout_rate': 0.11015167776513594, 'ccp_alpha': 0.0933195590045975}. Best is trial 690 with value: 0.6691837560454439.[0m
[32m[I 2022-04-23 09:23:30,469][0m Trial 934 finished with value: 0.6479452170739455 and parameters: {'loss': 'coxph', 'learning_rate': 0.0685419196446021, 'n_estimators': 580, 'criterion': 'friedman_mse', 'min_samples_split': 9, 'min_samples_leaf': 6, 'min_weight_fraction_leaf': 0.00940671815624178, 'min_impurity_decrease': 0.48416020167774887, 'max_features': 0.9843226283242306, 'subsample': 0.19108981862608437, 'dropout_rate': 0.17638142699215895, 'ccp_alpha': 0.1848199550606519}. Best is trial 690 with value: 0.6691837560454439.[0m
[32m[I 2022-04-23 09:25:24,185][0m Trial 935 finished with value: 0.6510425240253006 and parameters: {'loss': 'coxph', 'learning_rate': 0.04342653634741962, 'n_estimators': 682, 'criterion': 'friedman_mse', 'min_samples_split': 8, 'min_samples_leaf': 5, 'min_weight_fraction_leaf': 0.058566323563574274, 'min_impurity_decrease': 0.570679767929464, 'max_features': 0.2969728269328872, 'subsample': 0.26853748162541197, 'dropout_rate': 0.1652399008588677, 'ccp_alpha': 0.1012825569904269}. Best is trial 690 with value: 0.6691837560454439.[0m
[32m[I 2022-04-23 09:25:29,899][0m Trial 936 finished with value: 0.6633157629960669 and parameters: {'loss': 'coxph', 'learning_rate': 0.08047835910437322, 'n_estimators': 133, 'criterion': 'friedman_mse', 'min_samples_split': 9, 'min_samples_leaf': 6, 'min_weight_fraction_leaf': 0.032434361074698013, 'min_impurity_decrease': 0.5515050296143946, 'max_features': 0.20417926075305073, 'subsample': 0.5688477197034492, 'dropout_rate': 0.12723280385496116, 'ccp_alpha': 0.004655654763141661}. Best is trial 690 with value: 0.6691837560454439.[0m
[32m[I 2022-04-23 09:25:34,786][0m Trial 937 finished with value: 0.6522731692054536 and parameters: {'loss': 'coxph', 'learning_rate': 0.07586355339588763, 'n_estimators': 116, 'criterion': 'friedman_mse', 'min_samples_split': 9, 'min_samples_leaf': 6, 'min_weight_fraction_leaf': 0.032086017724784636, 'min_impurity_decrease': 0.5491146503252018, 'max_features': 0.19672702226367444, 'subsample': 0.2055171747287684, 'dropout_rate': 0.059946668000456796, 'ccp_alpha': 0.003617222032405482}. Best is trial 690 with value: 0.6691837560454439.[0m
[32m[I 2022-04-23 09:25:44,614][0m Trial 938 finished with value: 0.5006540204610004 and parameters: {'loss': 'coxph', 'learning_rate': 0.05918678778459785, 'n_estimators': 183, 'criterion': 'friedman_mse', 'min_samples_split': 9, 'min_samples_leaf': 5, 'min_weight_fraction_leaf': 0.02080871681050683, 'min_impurity_decrease': 0.5626479818516469, 'max_features': 0.6058748487825909, 'subsample': 0.592985256878186, 'dropout_rate': 0.10930240998506972, 'ccp_alpha': 0.2508989205767427}. Best is trial 690 with value: 0.6691837560454439.[0m
[32m[I 2022-04-23 09:26:08,321][0m Trial 939 finished with value: 0.620193362190202 and parameters: {'loss': 'coxph', 'learning_rate': 0.08412904000437543, 'n_estimators': 291, 'criterion': 'friedman_mse', 'min_samples_split': 9, 'min_samples_leaf': 6, 'min_weight_fraction_leaf': 0.030826092765755608, 'min_impurity_decrease': 0.581400896038794, 'max_features': 0.5475691171703257, 'subsample': 0.642492394059745, 'dropout_rate': 0.1282990836454085, 'ccp_alpha': 0.10009699045295702}. Best is trial 690 with value: 0.6691837560454439.[0m
[32m[I 2022-04-23 09:26:11,945][0m Trial 940 finished with value: 0.5132549114240101 and parameters: {'loss': 'coxph', 'learning_rate': 0.051294187751686184, 'n_estimators': 100, 'criterion': 'friedman_mse', 'min_samples_split': 9, 'min_samples_leaf': 6, 'min_weight_fraction_leaf': 0.0159831413462447, 'min_impurity_decrease': 0.5443464445629612, 'max_features': 0.20202795922346992, 'subsample': 0.49090487698138746, 'dropout_rate': 0.12133941962013761, 'ccp_alpha': 0.1796457487240338}. Best is trial 690 with value: 0.6691837560454439.[0m
/media/san2_ssd/data/Workdir/survival/venv/lib/python3.8/site-packages/sksurv/ensemble/boosting.py:955: RuntimeWarning: divide by zero encountered in log
  time = numpy.log(time)
/media/san2_ssd/data/Workdir/survival/venv/lib/python3.8/site-packages/sksurv/ensemble/boosting.py:955: RuntimeWarning: divide by zero encountered in log
  time = numpy.log(time)
/media/san2_ssd/data/Workdir/survival/venv/lib/python3.8/site-packages/sksurv/ensemble/boosting.py:955: RuntimeWarning: divide by zero encountered in log
  time = numpy.log(time)
/media/san2_ssd/data/Workdir/survival/venv/lib/python3.8/site-packages/sksurv/ensemble/boosting.py:955: RuntimeWarning: divide by zero encountered in log
  time = numpy.log(time)
[32m[I 2022-04-23 09:26:38,170][0m Trial 941 finished with value: -0.7344362749649462 and parameters: {'loss': 'squared', 'learning_rate': 0.08193154061837105, 'n_estimators': 703, 'criterion': 'friedman_mse', 'min_samples_split': 9, 'min_samples_leaf': 6, 'min_weight_fraction_leaf': 0.03592969024634314, 'min_impurity_decrease': 0.5780851698476462, 'max_features': 0.19006023170922198, 'subsample': 0.577283354006894, 'dropout_rate': 0.07755830205125444, 'ccp_alpha': 0.0886358596618967}. Best is trial 690 with value: 0.6691837560454439.[0m
[32m[I 2022-04-23 09:26:58,161][0m Trial 942 finished with value: 0.6708627558939895 and parameters: {'loss': 'coxph', 'learning_rate': 0.09913686990926453, 'n_estimators': 257, 'criterion': 'friedman_mse', 'min_samples_split': 9, 'min_samples_leaf': 6, 'min_weight_fraction_leaf': 0.02288006192558041, 'min_impurity_decrease': 0.5999539164146931, 'max_features': 0.2063324915258105, 'subsample': 0.6504351336363344, 'dropout_rate': 0.1044996189893071, 'ccp_alpha': 0.0010109129841485444}. Best is trial 942 with value: 0.6708627558939895.[0m
[32m[I 2022-04-23 09:29:02,292][0m Trial 943 finished with value: 0.5 and parameters: {'loss': 'coxph', 'learning_rate': 0.09827851810616016, 'n_estimators': 674, 'criterion': 'absolute_error', 'min_samples_split': 9, 'min_samples_leaf': 6, 'min_weight_fraction_leaf': 0.009453982652962397, 'min_impurity_decrease': 0.5739722335405509, 'max_features': 0.6357675095854398, 'subsample': 0.506743549557404, 'dropout_rate': 0.08062147310999608, 'ccp_alpha': 0.3233351477308902}. Best is trial 942 with value: 0.6708627558939895.[0m
[32m[I 2022-04-23 09:29:21,659][0m Trial 944 finished with value: 0.6057924028802075 and parameters: {'loss': 'coxph', 'learning_rate': 0.09899987165274174, 'n_estimators': 264, 'criterion': 'friedman_mse', 'min_samples_split': 9, 'min_samples_leaf': 6, 'min_weight_fraction_leaf': 0.02013252575063944, 'min_impurity_decrease': 0.6029661919663029, 'max_features': 0.2686796995290242, 'subsample': 0.7009497811463593, 'dropout_rate': 0.1007095558458827, 'ccp_alpha': 0.09586807946286995}. Best is trial 942 with value: 0.6708627558939895.[0m
[32m[I 2022-04-23 09:31:13,152][0m Trial 945 finished with value: 0.5006540204610004 and parameters: {'loss': 'coxph', 'learning_rate': 0.09973412469365169, 'n_estimators': 652, 'criterion': 'friedman_mse', 'min_samples_split': 9, 'min_samples_leaf': 6, 'min_weight_fraction_leaf': 0.023696894944715035, 'min_impurity_decrease': 0.5888144398115198, 'max_features': 0.6506142144104334, 'subsample': 0.7265913162739674, 'dropout_rate': 0.08571972322600727, 'ccp_alpha': 0.22935653466228095}. Best is trial 942 with value: 0.6708627558939895.[0m
[32m[I 2022-04-23 09:31:52,705][0m Trial 946 finished with value: 0.5306685887469793 and parameters: {'loss': 'coxph', 'learning_rate': 0.06854480316356755, 'n_estimators': 382, 'criterion': 'friedman_mse', 'min_samples_split': 9, 'min_samples_leaf': 6, 'min_weight_fraction_leaf': 0.007820061709594841, 'min_impurity_decrease': 0.6036209732228743, 'max_features': 0.23061370950917687, 'subsample': 0.5588894545381818, 'dropout_rate': 0.10119090841570728, 'ccp_alpha': 0.16281757556628818}. Best is trial 942 with value: 0.6708627558939895.[0m
[32m[I 2022-04-23 09:31:59,124][0m Trial 947 finished with value: 0.6741395165532647 and parameters: {'loss': 'coxph', 'learning_rate': 0.08293770586570244, 'n_estimators': 136, 'criterion': 'friedman_mse', 'min_samples_split': 9, 'min_samples_leaf': 6, 'min_weight_fraction_leaf': 0.023550437807494464, 'min_impurity_decrease': 0.5917798918982722, 'max_features': 0.23717367663521677, 'subsample': 0.6290501515106203, 'dropout_rate': 0.0468751903543844, 'ccp_alpha': 0.0066009300692310945}. Best is trial 947 with value: 0.6741395165532647.[0m
[32m[I 2022-04-23 09:32:02,407][0m Trial 948 finished with value: 0.6631511289669073 and parameters: {'loss': 'coxph', 'learning_rate': 0.08479177434741739, 'n_estimators': 133, 'criterion': 'friedman_mse', 'min_samples_split': 9, 'min_samples_leaf': 6, 'min_weight_fraction_leaf': 0.013588267640210958, 'min_impurity_decrease': 0.6353895982116486, 'max_features': 0.2289395598676463, 'subsample': 0.6446810456108549, 'dropout_rate': 0.6481594453612106, 'ccp_alpha': 0.0036166680567863776}. Best is trial 947 with value: 0.6741395165532647.[0m
[32m[I 2022-04-23 09:32:07,563][0m Trial 949 finished with value: 0.6133242417889354 and parameters: {'loss': 'coxph', 'learning_rate': 0.098436469925349, 'n_estimators': 127, 'criterion': 'friedman_mse', 'min_samples_split': 9, 'min_samples_leaf': 6, 'min_weight_fraction_leaf': 0.0025022207980556653, 'min_impurity_decrease': 0.618848026576577, 'max_features': 0.2263667897245866, 'subsample': 0.6376351139866372, 'dropout_rate': 0.06032106532985654, 'ccp_alpha': 0.09153347303315217}. Best is trial 947 with value: 0.6741395165532647.[0m
[32m[I 2022-04-23 09:32:13,281][0m Trial 950 finished with value: 0.5 and parameters: {'loss': 'coxph', 'learning_rate': 0.0823249783735478, 'n_estimators': 132, 'criterion': 'friedman_mse', 'min_samples_split': 9, 'min_samples_leaf': 6, 'min_weight_fraction_leaf': 0.0013122746806394567, 'min_impurity_decrease': 0.6300478366894382, 'max_features': 0.21758315816974927, 'subsample': 0.6776104092754498, 'dropout_rate': 0.06470427746577717, 'ccp_alpha': 0.17850220152140037}. Best is trial 947 with value: 0.6741395165532647.[0m
[32m[I 2022-04-23 09:32:16,466][0m Trial 951 finished with value: 0.6545497935640017 and parameters: {'loss': 'coxph', 'learning_rate': 0.08347342453716103, 'n_estimators': 132, 'criterion': 'friedman_mse', 'min_samples_split': 9, 'min_samples_leaf': 6, 'min_weight_fraction_leaf': 0.012766069054751951, 'min_impurity_decrease': 0.5646020041833189, 'max_features': 0.2412164304786499, 'subsample': 0.6594726628012907, 'dropout_rate': 0.6381857815091555, 'ccp_alpha': 0.004197023914858173}. Best is trial 947 with value: 0.6741395165532647.[0m
[32m[I 2022-04-23 09:32:23,378][0m Trial 952 finished with value: 0.5 and parameters: {'loss': 'coxph', 'learning_rate': 0.08340033784785768, 'n_estimators': 143, 'criterion': 'squared_error', 'min_samples_split': 9, 'min_samples_leaf': 6, 'min_weight_fraction_leaf': 0.013817134166735377, 'min_impurity_decrease': 0.5909007331599133, 'max_features': 0.20739484063816202, 'subsample': 0.5875486423578054, 'dropout_rate': 0.05069831111312695, 'ccp_alpha': 0.29832522871697903}. Best is trial 947 with value: 0.6741395165532647.[0m
[32m[I 2022-04-23 09:32:29,071][0m Trial 953 finished with value: 0.6175507059912285 and parameters: {'loss': 'coxph', 'learning_rate': 0.09793577998510059, 'n_estimators': 132, 'criterion': 'friedman_mse', 'min_samples_split': 9, 'min_samples_leaf': 6, 'min_weight_fraction_leaf': 0.023192398405443578, 'min_impurity_decrease': 0.6457715948155037, 'max_features': 0.21560228354352617, 'subsample': 0.6732526309933821, 'dropout_rate': 0.007194203971527591, 'ccp_alpha': 0.08583865842906743}. Best is trial 947 with value: 0.6741395165532647.[0m
[32m[I 2022-04-23 09:32:31,979][0m Trial 954 finished with value: 0.5132549114240101 and parameters: {'loss': 'coxph', 'learning_rate': 0.09842200211886892, 'n_estimators': 142, 'criterion': 'friedman_mse', 'min_samples_split': 9, 'min_samples_leaf': 6, 'min_weight_fraction_leaf': 0.0158487040665502, 'min_impurity_decrease': 0.6229755951786796, 'max_features': 0.23801869502534065, 'subsample': 0.6044307376551356, 'dropout_rate': 0.7469551125381018, 'ccp_alpha': 0.16362167832563915}. Best is trial 947 with value: 0.6741395165532647.[0m
[32m[I 2022-04-23 09:32:37,538][0m Trial 955 finished with value: 0.6698125625004052 and parameters: {'loss': 'coxph', 'learning_rate': 0.0802948526487121, 'n_estimators': 126, 'criterion': 'friedman_mse', 'min_samples_split': 9, 'min_samples_leaf': 6, 'min_weight_fraction_leaf': 0.02323608192521771, 'min_impurity_decrease': 0.6232001302968698, 'max_features': 0.25229815071389067, 'subsample': 0.6569840834922246, 'dropout_rate': 0.04032958967996089, 'ccp_alpha': 0.004650557973790626}. Best is trial 947 with value: 0.6741395165532647.[0m
[32m[I 2022-04-23 09:32:40,941][0m Trial 956 finished with value: 0.6222863170290589 and parameters: {'loss': 'coxph', 'learning_rate': 0.07243255110579926, 'n_estimators': 135, 'criterion': 'friedman_mse', 'min_samples_split': 9, 'min_samples_leaf': 6, 'min_weight_fraction_leaf': 0.010821158762882283, 'min_impurity_decrease': 0.6258744230711295, 'max_features': 0.26867203203064816, 'subsample': 0.6737073052730148, 'dropout_rate': 0.5989393324492515, 'ccp_alpha': 0.0844385657832573}. Best is trial 947 with value: 0.6741395165532647.[0m
[32m[I 2022-04-23 09:32:43,732][0m Trial 957 finished with value: 0.5 and parameters: {'loss': 'coxph', 'learning_rate': 0.07134520046039378, 'n_estimators': 130, 'criterion': 'friedman_mse', 'min_samples_split': 9, 'min_samples_leaf': 6, 'min_weight_fraction_leaf': 0.0010264193460347293, 'min_impurity_decrease': 0.6797079165340354, 'max_features': 0.24213510690607787, 'subsample': 0.6425909789946144, 'dropout_rate': 0.6870821915780355, 'ccp_alpha': 0.26253883357695396}. Best is trial 947 with value: 0.6741395165532647.[0m
[32m[I 2022-04-23 09:32:45,822][0m Trial 958 finished with value: 0.5 and parameters: {'loss': 'coxph', 'learning_rate': 0.07823092273267371, 'n_estimators': 126, 'criterion': 'friedman_mse', 'min_samples_split': 9, 'min_samples_leaf': 6, 'min_weight_fraction_leaf': 0.0217485357832808, 'min_impurity_decrease': 0.6352938831378195, 'max_features': 0.26067250658953595, 'subsample': 0.6096093296141192, 'dropout_rate': 0.8305788257514479, 'ccp_alpha': 0.4133263289060017}. Best is trial 947 with value: 0.6741395165532647.[0m
[32m[I 2022-04-23 09:32:50,983][0m Trial 959 finished with value: 0.6237814072436473 and parameters: {'loss': 'coxph', 'learning_rate': 0.09975064622876727, 'n_estimators': 124, 'criterion': 'friedman_mse', 'min_samples_split': 9, 'min_samples_leaf': 6, 'min_weight_fraction_leaf': 0.024868394078619377, 'min_impurity_decrease': 0.6105645514379794, 'max_features': 0.2206095908212579, 'subsample': 0.6217068208533807, 'dropout_rate': 0.005228420996633093, 'ccp_alpha': 0.08895471800515399}. Best is trial 947 with value: 0.6741395165532647.[0m
[32m[I 2022-04-23 09:32:55,760][0m Trial 960 finished with value: 0.5006540204610004 and parameters: {'loss': 'coxph', 'learning_rate': 0.06784907450279395, 'n_estimators': 117, 'criterion': 'friedman_mse', 'min_samples_split': 9, 'min_samples_leaf': 6, 'min_weight_fraction_leaf': 0.014288355800178128, 'min_impurity_decrease': 0.6597956695040134, 'max_features': 0.18558147108533032, 'subsample': 0.6612641365475397, 'dropout_rate': 0.005401777173894756, 'ccp_alpha': 0.1874628170114728}. Best is trial 947 with value: 0.6741395165532647.[0m
/media/san2_ssd/data/Workdir/survival/venv/lib/python3.8/site-packages/sksurv/ensemble/boosting.py:955: RuntimeWarning: divide by zero encountered in log
  time = numpy.log(time)
/media/san2_ssd/data/Workdir/survival/venv/lib/python3.8/site-packages/sksurv/ensemble/boosting.py:955: RuntimeWarning: divide by zero encountered in log
  time = numpy.log(time)
/media/san2_ssd/data/Workdir/survival/venv/lib/python3.8/site-packages/sksurv/ensemble/boosting.py:955: RuntimeWarning: divide by zero encountered in log
  time = numpy.log(time)
/media/san2_ssd/data/Workdir/survival/venv/lib/python3.8/site-packages/sksurv/ensemble/boosting.py:955: RuntimeWarning: divide by zero encountered in log
  time = numpy.log(time)
[32m[I 2022-04-23 09:32:56,717][0m Trial 961 finished with value: -0.7 and parameters: {'loss': 'squared', 'learning_rate': 0.06856468834246857, 'n_estimators': 126, 'criterion': 'friedman_mse', 'min_samples_split': 9, 'min_samples_leaf': 6, 'min_weight_fraction_leaf': 0.027557731322373262, 'min_impurity_decrease': 0.6330301419179345, 'max_features': 0.24071194415319208, 'subsample': 0.6376612776751756, 'dropout_rate': 0.09052355547096229, 'ccp_alpha': 2.7261978502603212}. Best is trial 947 with value: 0.6741395165532647.[0m
[32m[I 2022-04-23 09:33:01,744][0m Trial 962 finished with value: 0.6327759437820992 and parameters: {'loss': 'coxph', 'learning_rate': 0.08164864664059203, 'n_estimators': 123, 'criterion': 'friedman_mse', 'min_samples_split': 9, 'min_samples_leaf': 6, 'min_weight_fraction_leaf': 0.016580346087266107, 'min_impurity_decrease': 0.6077496134621116, 'max_features': 0.20229499745339996, 'subsample': 0.6579168709612996, 'dropout_rate': 0.023432483497144843, 'ccp_alpha': 0.07739393200601437}. Best is trial 947 with value: 0.6741395165532647.[0m
[32m[I 2022-04-23 09:33:07,862][0m Trial 963 finished with value: 0.6698313602148234 and parameters: {'loss': 'coxph', 'learning_rate': 0.06353247621790897, 'n_estimators': 133, 'criterion': 'friedman_mse', 'min_samples_split': 9, 'min_samples_leaf': 6, 'min_weight_fraction_leaf': 0.02685505616248704, 'min_impurity_decrease': 0.6088341076697129, 'max_features': 0.22494297189326823, 'subsample': 0.6451362434551541, 'dropout_rate': 0.02331977519504201, 'ccp_alpha': 0.0037483000407239207}. Best is trial 947 with value: 0.6741395165532647.[0m
[32m[I 2022-04-23 09:33:14,833][0m Trial 964 finished with value: 0.5181150201957231 and parameters: {'loss': 'coxph', 'learning_rate': 0.06411502321509563, 'n_estimators': 148, 'criterion': 'friedman_mse', 'min_samples_split': 9, 'min_samples_leaf': 7, 'min_weight_fraction_leaf': 0.029281993137278615, 'min_impurity_decrease': 0.619084810143469, 'max_features': 0.28427076674701335, 'subsample': 0.6212804723450938, 'dropout_rate': 0.03642426183112043, 'ccp_alpha': 0.16995142905829805}. Best is trial 947 with value: 0.6741395165532647.[0m
