[32m[I 2022-04-21 11:40:06,880][0m Trial 828 finished with value: 0.6543938115635641 and parameters: {'splitter': 'random', 'min_samples_split': 0.43315028567232866, 'min_samples_leaf': 0.15192434689006953, 'min_weight_fraction_leaf': 0.15781635976055064, 'max_features': 0.8417617743164562}. Best is trial 11 with value: 0.6773038119717333.[0m
[32m[I 2022-04-21 11:40:07,039][0m Trial 829 finished with value: 0.6738476114655684 and parameters: {'splitter': 'random', 'min_samples_split': 0.23688086322562854, 'min_samples_leaf': 0.17309807236064173, 'min_weight_fraction_leaf': 0.19858496229631858, 'max_features': 0.9696735032992633}. Best is trial 11 with value: 0.6773038119717333.[0m
[32m[I 2022-04-21 11:40:07,189][0m Trial 830 finished with value: 0.6571960671138655 and parameters: {'splitter': 'random', 'min_samples_split': 0.45909089203109554, 'min_samples_leaf': 0.010986284668727303, 'min_weight_fraction_leaf': 7.58990771083266e-05, 'max_features': 0.9583191067265847}. Best is trial 11 with value: 0.6773038119717333.[0m
[32m[I 2022-04-21 11:40:07,363][0m Trial 831 finished with value: 0.6738476114655684 and parameters: {'splitter': 'random', 'min_samples_split': 0.39462109112194027, 'min_samples_leaf': 0.004864660704161578, 'min_weight_fraction_leaf': 0.1822640589551511, 'max_features': 0.9399449014800274}. Best is trial 11 with value: 0.6773038119717333.[0m
[32m[I 2022-04-21 11:40:07,471][0m Trial 832 finished with value: 0.6571960671138655 and parameters: {'splitter': 'random', 'min_samples_split': 0.45185920530032364, 'min_samples_leaf': 0.013454285647955005, 'min_weight_fraction_leaf': 0.013907289035091407, 'max_features': 0.9680965547848963}. Best is trial 11 with value: 0.6773038119717333.[0m
[32m[I 2022-04-21 11:40:07,513][0m Trial 833 finished with value: 0.5 and parameters: {'splitter': 'random', 'min_samples_split': 0.40566529210197866, 'min_samples_leaf': 0.0038370362053539615, 'min_weight_fraction_leaf': 0.18240621493183384, 'max_features': 0.40618086788939745}. Best is trial 11 with value: 0.6773038119717333.[0m
[32m[I 2022-04-21 11:40:07,557][0m Trial 834 finished with value: 0.6640701022932763 and parameters: {'splitter': 'random', 'min_samples_split': 0.3692459736512858, 'min_samples_leaf': 0.11734443729277591, 'min_weight_fraction_leaf': 0.010296014093866207, 'max_features': 0.9049643325152156}. Best is trial 11 with value: 0.6773038119717333.[0m
[32m[I 2022-04-21 11:40:07,603][0m Trial 835 finished with value: 0.6738476114655684 and parameters: {'splitter': 'random', 'min_samples_split': 0.04448403460157894, 'min_samples_leaf': 0.011603659930942183, 'min_weight_fraction_leaf': 0.19270810042577516, 'max_features': 0.9814368395956834}. Best is trial 11 with value: 0.6773038119717333.[0m
[32m[I 2022-04-21 11:40:07,653][0m Trial 836 finished with value: 0.6502080893344752 and parameters: {'splitter': 'random', 'min_samples_split': 0.4647686620045108, 'min_samples_leaf': 0.0010068361231619256, 'min_weight_fraction_leaf': 0.14637654432529118, 'max_features': 0.9575295669842396}. Best is trial 11 with value: 0.6773038119717333.[0m
[32m[I 2022-04-21 11:40:07,698][0m Trial 837 finished with value: 0.5 and parameters: {'splitter': 'random', 'min_samples_split': 0.3932202848968909, 'min_samples_leaf': 0.21582156348719483, 'min_weight_fraction_leaf': 0.10075599469830346, 'max_features': 0.7787953895208243}. Best is trial 11 with value: 0.6773038119717333.[0m
[32m[I 2022-04-21 11:40:07,753][0m Trial 838 finished with value: 0.6625929327049365 and parameters: {'splitter': 'random', 'min_samples_split': 0.35643081653628716, 'min_samples_leaf': 0.026596820677893887, 'min_weight_fraction_leaf': 0.014114181179109495, 'max_features': 0.9159948439311563}. Best is trial 11 with value: 0.6773038119717333.[0m
[32m[I 2022-04-21 11:40:07,801][0m Trial 839 finished with value: 0.6586187582319654 and parameters: {'splitter': 'random', 'min_samples_split': 0.24701811175016727, 'min_samples_leaf': 0.06321971777641033, 'min_weight_fraction_leaf': 0.20814268061167593, 'max_features': 0.8953733927588564}. Best is trial 11 with value: 0.6773038119717333.[0m
[32m[I 2022-04-21 11:40:07,902][0m Trial 840 finished with value: 0.5 and parameters: {'splitter': 'random', 'min_samples_split': 0.12044659414250883, 'min_samples_leaf': 0.14707398077927347, 'min_weight_fraction_leaf': 0.1905391099606012, 'max_features': 0.6745072338490796}. Best is trial 11 with value: 0.6773038119717333.[0m
[32m[I 2022-04-21 11:40:07,968][0m Trial 841 finished with value: 0.5 and parameters: {'splitter': 'random', 'min_samples_split': 0.025904333541124674, 'min_samples_leaf': 0.09528609590648494, 'min_weight_fraction_leaf': 0.20444986955713265, 'max_features': 0.7915070410841892}. Best is trial 11 with value: 0.6773038119717333.[0m
[32m[I 2022-04-21 11:40:08,018][0m Trial 842 finished with value: 0.6738476114655684 and parameters: {'splitter': 'random', 'min_samples_split': 0.02959904140760496, 'min_samples_leaf': 0.10253767806719924, 'min_weight_fraction_leaf': 0.19928159780757632, 'max_features': 0.8125053383042646}. Best is trial 11 with value: 0.6773038119717333.[0m
[32m[I 2022-04-21 11:40:08,067][0m Trial 843 finished with value: 0.6738476114655684 and parameters: {'splitter': 'random', 'min_samples_split': 0.3577075184391891, 'min_samples_leaf': 0.11433793550452452, 'min_weight_fraction_leaf': 0.18896352405231961, 'max_features': 0.8447821701325443}. Best is trial 11 with value: 0.6773038119717333.[0m
[32m[I 2022-04-21 11:40:08,120][0m Trial 844 finished with value: 0.6636900948801576 and parameters: {'splitter': 'best', 'min_samples_split': 0.22282409308042692, 'min_samples_leaf': 0.011677791370708105, 'min_weight_fraction_leaf': 0.19404219634856154, 'max_features': 0.9976126059557484}. Best is trial 11 with value: 0.6773038119717333.[0m
[32m[I 2022-04-21 11:40:08,214][0m Trial 845 finished with value: 0.6738476114655684 and parameters: {'splitter': 'random', 'min_samples_split': 0.20644250925410373, 'min_samples_leaf': 0.08066830188438401, 'min_weight_fraction_leaf': 0.1720565307730336, 'max_features': 0.8233109697139339}. Best is trial 11 with value: 0.6773038119717333.[0m
[32m[I 2022-04-21 11:40:08,285][0m Trial 846 finished with value: 0.6738476114655684 and parameters: {'splitter': 'random', 'min_samples_split': 0.04432662944946107, 'min_samples_leaf': 0.07776955621025289, 'min_weight_fraction_leaf': 0.18160223120787414, 'max_features': 0.9755545563478458}. Best is trial 11 with value: 0.6773038119717333.[0m
[32m[I 2022-04-21 11:40:08,369][0m Trial 847 finished with value: 0.6543938115635641 and parameters: {'splitter': 'random', 'min_samples_split': 0.46210174791744063, 'min_samples_leaf': 0.023671847732450117, 'min_weight_fraction_leaf': 0.1558118666671161, 'max_features': 0.9542753823415913}. Best is trial 11 with value: 0.6773038119717333.[0m
[32m[I 2022-04-21 11:40:08,454][0m Trial 848 finished with value: 0.6738476114655684 and parameters: {'splitter': 'random', 'min_samples_split': 0.28530393300854767, 'min_samples_leaf': 0.1765948415366034, 'min_weight_fraction_leaf': 0.10109916111997432, 'max_features': 0.8390748288679404}. Best is trial 11 with value: 0.6773038119717333.[0m
[32m[I 2022-04-21 11:40:08,545][0m Trial 849 finished with value: 0.6502080893344752 and parameters: {'splitter': 'random', 'min_samples_split': 0.45178964762109697, 'min_samples_leaf': 0.02264792185114211, 'min_weight_fraction_leaf': 0.1466808330468169, 'max_features': 0.9553752665425587}. Best is trial 11 with value: 0.6773038119717333.[0m
[32m[I 2022-04-21 11:40:08,608][0m Trial 850 finished with value: 0.6738476114655684 and parameters: {'splitter': 'random', 'min_samples_split': 0.21660410693858834, 'min_samples_leaf': 0.19048302328309352, 'min_weight_fraction_leaf': 0.1556300302345101, 'max_features': 0.8596710858217085}. Best is trial 11 with value: 0.6773038119717333.[0m
[32m[I 2022-04-21 11:40:08,657][0m Trial 851 finished with value: 0.6738476114655684 and parameters: {'splitter': 'random', 'min_samples_split': 0.4646246524378118, 'min_samples_leaf': 0.013339749546098964, 'min_weight_fraction_leaf': 0.16737193013496354, 'max_features': 0.9492213599983952}. Best is trial 11 with value: 0.6773038119717333.[0m
[32m[I 2022-04-21 11:40:08,708][0m Trial 852 finished with value: 0.6186236384826864 and parameters: {'splitter': 'random', 'min_samples_split': 0.48986118467325646, 'min_samples_leaf': 0.02523195675587206, 'min_weight_fraction_leaf': 0.15432963620837484, 'max_features': 0.9505427692186283}. Best is trial 11 with value: 0.6773038119717333.[0m
[32m[I 2022-04-21 11:40:08,759][0m Trial 853 finished with value: 0.6551405301163737 and parameters: {'splitter': 'random', 'min_samples_split': 0.2748170157804243, 'min_samples_leaf': 0.17287863403298598, 'min_weight_fraction_leaf': 0.22101481932873723, 'max_features': 0.9749802066156353}. Best is trial 11 with value: 0.6773038119717333.[0m
[32m[I 2022-04-21 11:40:08,808][0m Trial 854 finished with value: 0.662800366349585 and parameters: {'splitter': 'random', 'min_samples_split': 0.019878925809123787, 'min_samples_leaf': 0.1611291630087666, 'min_weight_fraction_leaf': 0.14690933155800764, 'max_features': 0.9948289060032491}. Best is trial 11 with value: 0.6773038119717333.[0m
[32m[I 2022-04-21 11:40:08,860][0m Trial 855 finished with value: 0.5962367254829114 and parameters: {'splitter': 'random', 'min_samples_split': 0.1999472204867984, 'min_samples_leaf': 0.07462836056823005, 'min_weight_fraction_leaf': 0.1606558147265844, 'max_features': 0.7589242925684835}. Best is trial 11 with value: 0.6773038119717333.[0m
[32m[I 2022-04-21 11:40:08,912][0m Trial 856 finished with value: 0.6738476114655684 and parameters: {'splitter': 'random', 'min_samples_split': 0.23579581673565617, 'min_samples_leaf': 0.002174289682560723, 'min_weight_fraction_leaf': 0.18270392328596152, 'max_features': 0.9829983025933343}. Best is trial 11 with value: 0.6773038119717333.[0m
[32m[I 2022-04-21 11:40:08,962][0m Trial 857 finished with value: 0.6738476114655684 and parameters: {'splitter': 'random', 'min_samples_split': 0.4303555765769734, 'min_samples_leaf': 0.18084003520655875, 'min_weight_fraction_leaf': 0.15826069543677648, 'max_features': 0.9339562310500861}. Best is trial 11 with value: 0.6773038119717333.[0m
[32m[I 2022-04-21 11:40:09,008][0m Trial 858 finished with value: 0.6738476114655684 and parameters: {'splitter': 'random', 'min_samples_split': 0.43380197037917345, 'min_samples_leaf': 0.1783924188036811, 'min_weight_fraction_leaf': 0.15359434469448477, 'max_features': 0.9288676025050377}. Best is trial 11 with value: 0.6773038119717333.[0m
[32m[I 2022-04-21 11:40:09,058][0m Trial 859 finished with value: 0.6738476114655684 and parameters: {'splitter': 'random', 'min_samples_split': 0.4231382976871193, 'min_samples_leaf': 0.0012244324902270058, 'min_weight_fraction_leaf': 0.17002455590049628, 'max_features': 0.9404069423813041}. Best is trial 11 with value: 0.6773038119717333.[0m
[32m[I 2022-04-21 11:40:09,103][0m Trial 860 finished with value: 0.6738476114655684 and parameters: {'splitter': 'random', 'min_samples_split': 0.44180842547350696, 'min_samples_leaf': 0.034568315137669746, 'min_weight_fraction_leaf': 0.16907542353421115, 'max_features': 0.9369989687253927}. Best is trial 11 with value: 0.6773038119717333.[0m
[32m[I 2022-04-21 11:40:09,152][0m Trial 861 finished with value: 0.6738476114655684 and parameters: {'splitter': 'random', 'min_samples_split': 0.16562863084743726, 'min_samples_leaf': 0.045996897538275426, 'min_weight_fraction_leaf': 0.17703327105461258, 'max_features': 0.8809435748796833}. Best is trial 11 with value: 0.6773038119717333.[0m
[32m[I 2022-04-21 11:40:09,493][0m Trial 862 finished with value: 0.6584370859525686 and parameters: {'splitter': 'random', 'min_samples_split': 0.15893308326742403, 'min_samples_leaf': 0.06616123454823337, 'min_weight_fraction_leaf': 0.04207185112299426, 'max_features': 0.8602082986697493}. Best is trial 11 with value: 0.6773038119717333.[0m
[32m[I 2022-04-21 11:40:09,563][0m Trial 863 finished with value: 0.5 and parameters: {'splitter': 'best', 'min_samples_split': 0.41708835079430034, 'min_samples_leaf': 0.16695109502502287, 'min_weight_fraction_leaf': 0.004587237391475176, 'max_features': 0.3629746194139753}. Best is trial 11 with value: 0.6773038119717333.[0m
[32m[I 2022-04-21 11:40:09,609][0m Trial 864 finished with value: 0.6586187582319654 and parameters: {'splitter': 'random', 'min_samples_split': 0.016744325941491393, 'min_samples_leaf': 0.15681438605779371, 'min_weight_fraction_leaf': 0.20430018790776536, 'max_features': 0.9161809529124625}. Best is trial 11 with value: 0.6773038119717333.[0m
[32m[I 2022-04-21 11:40:09,653][0m Trial 865 finished with value: 0.6650367998115423 and parameters: {'splitter': 'random', 'min_samples_split': 0.2529495054144906, 'min_samples_leaf': 0.008779212723701475, 'min_weight_fraction_leaf': 0.12024829566662908, 'max_features': 0.9951906188154287}. Best is trial 11 with value: 0.6773038119717333.[0m
[32m[I 2022-04-21 11:40:09,708][0m Trial 866 finished with value: 0.662800366349585 and parameters: {'splitter': 'random', 'min_samples_split': 0.3426857540599438, 'min_samples_leaf': 0.12116508681534456, 'min_weight_fraction_leaf': 0.16259302691836175, 'max_features': 0.8767463362566309}. Best is trial 11 with value: 0.6773038119717333.[0m
[32m[I 2022-04-21 11:40:09,765][0m Trial 867 finished with value: 0.6502080893344752 and parameters: {'splitter': 'random', 'min_samples_split': 0.1539993970186717, 'min_samples_leaf': 0.06690310599719967, 'min_weight_fraction_leaf': 0.14822367451804233, 'max_features': 0.8969022830528997}. Best is trial 11 with value: 0.6773038119717333.[0m
[32m[I 2022-04-21 11:40:09,809][0m Trial 868 finished with value: 0.6640701022932763 and parameters: {'splitter': 'random', 'min_samples_split': 0.3668831146633644, 'min_samples_leaf': 0.1306774563064197, 'min_weight_fraction_leaf': 0.0827513586061112, 'max_features': 0.8652546879372137}. Best is trial 11 with value: 0.6773038119717333.[0m
[32m[I 2022-04-21 11:40:09,851][0m Trial 869 finished with value: 0.6738476114655684 and parameters: {'splitter': 'random', 'min_samples_split': 0.3338635931104832, 'min_samples_leaf': 0.08662066047296937, 'min_weight_fraction_leaf': 0.19110769413423087, 'max_features': 0.9103238869783854}. Best is trial 11 with value: 0.6773038119717333.[0m
[32m[I 2022-04-21 11:40:09,893][0m Trial 870 finished with value: 0.6380774383846907 and parameters: {'splitter': 'random', 'min_samples_split': 0.47935859105924616, 'min_samples_leaf': 0.10789048660398835, 'min_weight_fraction_leaf': 0.16697551135517796, 'max_features': 0.9493328593621486}. Best is trial 11 with value: 0.6773038119717333.[0m
[32m[I 2022-04-21 11:40:09,934][0m Trial 871 finished with value: 0.6640701022932763 and parameters: {'splitter': 'random', 'min_samples_split': 0.3384707874869261, 'min_samples_leaf': 0.1290378031142393, 'min_weight_fraction_leaf': 0.11212660568389557, 'max_features': 0.8822070645051484}. Best is trial 11 with value: 0.6773038119717333.[0m
[32m[I 2022-04-21 11:40:09,974][0m Trial 872 finished with value: 0.6738476114655684 and parameters: {'splitter': 'random', 'min_samples_split': 0.05551806838464761, 'min_samples_leaf': 0.08886716377311196, 'min_weight_fraction_leaf': 0.17301492131935137, 'max_features': 0.8489882180037989}. Best is trial 11 with value: 0.6773038119717333.[0m
[32m[I 2022-04-21 11:40:10,017][0m Trial 873 finished with value: 0.6502080893344752 and parameters: {'splitter': 'random', 'min_samples_split': 0.3559087599005806, 'min_samples_leaf': 0.1471094223449499, 'min_weight_fraction_leaf': 0.025243947684207468, 'max_features': 0.912307952790556}. Best is trial 11 with value: 0.6773038119717333.[0m
[32m[I 2022-04-21 11:40:10,059][0m Trial 874 finished with value: 0.6625929327049365 and parameters: {'splitter': 'random', 'min_samples_split': 0.35477630282518674, 'min_samples_leaf': 0.03646688697512407, 'min_weight_fraction_leaf': 0.011621718694318512, 'max_features': 0.9093678184967305}. Best is trial 11 with value: 0.6773038119717333.[0m
[32m[I 2022-04-21 11:40:10,100][0m Trial 875 finished with value: 0.6502080893344752 and parameters: {'splitter': 'random', 'min_samples_split': 0.10909004000157899, 'min_samples_leaf': 0.15011440843525453, 'min_weight_fraction_leaf': 0.13742246427988242, 'max_features': 0.9714810631845616}. Best is trial 11 with value: 0.6773038119717333.[0m
[32m[I 2022-04-21 11:40:10,142][0m Trial 876 finished with value: 0.6640701022932763 and parameters: {'splitter': 'random', 'min_samples_split': 0.3620555965421224, 'min_samples_leaf': 0.1394457550745929, 'min_weight_fraction_leaf': 0.109938664663553, 'max_features': 0.8922725711812917}. Best is trial 11 with value: 0.6773038119717333.[0m
[32m[I 2022-04-21 11:40:10,184][0m Trial 877 finished with value: 0.5 and parameters: {'splitter': 'random', 'min_samples_split': 0.2149895648987004, 'min_samples_leaf': 0.09313325510183693, 'min_weight_fraction_leaf': 0.17900340314447488, 'max_features': 0.5498685556182659}. Best is trial 11 with value: 0.6773038119717333.[0m
[32m[I 2022-04-21 11:40:10,247][0m Trial 878 finished with value: 0.6586187582319654 and parameters: {'splitter': 'random', 'min_samples_split': 0.3242766273623129, 'min_samples_leaf': 0.019396437838743143, 'min_weight_fraction_leaf': 0.21061869704093658, 'max_features': 0.9767375565383127}. Best is trial 11 with value: 0.6773038119717333.[0m
[32m[I 2022-04-21 11:40:10,303][0m Trial 879 finished with value: 0.6738476114655684 and parameters: {'splitter': 'random', 'min_samples_split': 0.38614845557953087, 'min_samples_leaf': 0.12383615080902335, 'min_weight_fraction_leaf': 0.18318095542399496, 'max_features': 0.9305252147125187}. Best is trial 11 with value: 0.6773038119717333.[0m
[32m[I 2022-04-21 11:40:10,374][0m Trial 880 finished with value: 0.6270301932687071 and parameters: {'splitter': 'random', 'min_samples_split': 0.4850133217202483, 'min_samples_leaf': 0.10747487220947495, 'min_weight_fraction_leaf': 0.16452958797394965, 'max_features': 0.9200421651281113}. Best is trial 11 with value: 0.6773038119717333.[0m
[32m[I 2022-04-21 11:40:10,503][0m Trial 881 finished with value: 0.6738476114655684 and parameters: {'splitter': 'random', 'min_samples_split': 0.07288464689825906, 'min_samples_leaf': 0.1441990845762154, 'min_weight_fraction_leaf': 0.17257796678648027, 'max_features': 0.8325655079965528}. Best is trial 11 with value: 0.6773038119717333.[0m
[32m[I 2022-04-21 11:40:10,598][0m Trial 882 finished with value: 0.6738476114655684 and parameters: {'splitter': 'random', 'min_samples_split': 0.4010249306352724, 'min_samples_leaf': 0.19506558939295385, 'min_weight_fraction_leaf': 0.12912652741068242, 'max_features': 0.8070354317447529}. Best is trial 11 with value: 0.6773038119717333.[0m
[32m[I 2022-04-21 11:40:10,644][0m Trial 883 finished with value: 0.6738476114655684 and parameters: {'splitter': 'random', 'min_samples_split': 0.40649446654083105, 'min_samples_leaf': 0.18047089281226975, 'min_weight_fraction_leaf': 0.1350169019307394, 'max_features': 0.9667821684180239}. Best is trial 11 with value: 0.6773038119717333.[0m
[32m[I 2022-04-21 11:40:10,693][0m Trial 884 finished with value: 0.6738476114655684 and parameters: {'splitter': 'random', 'min_samples_split': 0.40956978984795767, 'min_samples_leaf': 0.18131512403894884, 'min_weight_fraction_leaf': 0.12276728636629733, 'max_features': 0.964279483929078}. Best is trial 11 with value: 0.6773038119717333.[0m
[32m[I 2022-04-21 11:40:10,741][0m Trial 885 finished with value: 0.5 and parameters: {'splitter': 'random', 'min_samples_split': 0.2517665623110616, 'min_samples_leaf': 0.07058055544485724, 'min_weight_fraction_leaf': 0.16342228000004064, 'max_features': 0.028708205397010356}. Best is trial 11 with value: 0.6773038119717333.[0m
[32m[I 2022-04-21 11:40:10,790][0m Trial 886 finished with value: 0.6738476114655684 and parameters: {'splitter': 'random', 'min_samples_split': 0.0430346578291527, 'min_samples_leaf': 0.0793424093423599, 'min_weight_fraction_leaf': 0.18373193569783547, 'max_features': 0.8255992703924301}. Best is trial 11 with value: 0.6773038119717333.[0m
[32m[I 2022-04-21 11:40:10,839][0m Trial 887 finished with value: 0.6636900948801576 and parameters: {'splitter': 'best', 'min_samples_split': 0.3817639773757828, 'min_samples_leaf': 0.1329234091088388, 'min_weight_fraction_leaf': 0.18179676280869234, 'max_features': 0.9174303922590826}. Best is trial 11 with value: 0.6773038119717333.[0m
[32m[I 2022-04-21 11:40:10,885][0m Trial 888 finished with value: 0.6738476114655684 and parameters: {'splitter': 'random', 'min_samples_split': 0.4016927122075772, 'min_samples_leaf': 0.10690714712627275, 'min_weight_fraction_leaf': 0.19209088136527763, 'max_features': 0.901364507884159}. Best is trial 11 with value: 0.6773038119717333.[0m
[32m[I 2022-04-21 11:40:10,930][0m Trial 889 finished with value: 0.6215155824977587 and parameters: {'splitter': 'random', 'min_samples_split': 0.376174215345504, 'min_samples_leaf': 0.2262916277028129, 'min_weight_fraction_leaf': 0.0905556254571439, 'max_features': 0.8715573081454736}. Best is trial 11 with value: 0.6773038119717333.[0m
[32m[I 2022-04-21 11:40:10,974][0m Trial 890 finished with value: 0.6738476114655684 and parameters: {'splitter': 'random', 'min_samples_split': 0.033290101327026034, 'min_samples_leaf': 0.00936338498356679, 'min_weight_fraction_leaf': 0.16725268494372694, 'max_features': 0.9939399121269231}. Best is trial 11 with value: 0.6773038119717333.[0m
