[32m[I 2022-04-23 07:28:56,561][0m Trial 35 finished with value: 0.6390007789131563 and parameters: {'n_hidden': 1024, 'mixture_components': 3, 'use_sparse_layer': False, 'use_batchnorm': False, 'use_dropout': True, 'dropout': 0.1190235663832345, 'mlp_size_1': 4, 'mlp_size_2': 2, 'mlp_size_3': 1, 'kernel': 'Gumbel', 'loss_name': 'NLLLoss'}. Best is trial 29 with value: 0.6737891981153702.[0m
[32m[I 2022-04-23 07:30:00,251][0m Trial 36 finished with value: 0.656556603143758 and parameters: {'n_hidden': 128, 'mixture_components': 7, 'use_sparse_layer': False, 'use_batchnorm': False, 'use_dropout': True, 'dropout': 0.0010628979383166814, 'mlp_size_1': 3, 'mlp_size_2': 1, 'mlp_size_3': 0, 'kernel': 'Normal', 'loss_name': 'CensoredNLLLoss'}. Best is trial 29 with value: 0.6737891981153702.[0m
[32m[I 2022-04-23 07:30:46,847][0m Trial 37 finished with value: 0.625727692475642 and parameters: {'n_hidden': 512, 'mixture_components': 5, 'use_sparse_layer': False, 'use_batchnorm': False, 'use_dropout': True, 'dropout': 0.3321262097756398, 'mlp_size_1': 4, 'mlp_size_2': 1, 'mlp_size_3': 1, 'kernel': 'Normal', 'loss_name': 'NLLLoss'}. Best is trial 29 with value: 0.6737891981153702.[0m
[32m[I 2022-04-23 07:31:34,892][0m Trial 38 finished with value: 0.6312053930070876 and parameters: {'n_hidden': 512, 'mixture_components': 3, 'use_sparse_layer': False, 'use_batchnorm': False, 'use_dropout': True, 'dropout': 0.5691315971603131, 'mlp_size_1': 3, 'mlp_size_2': 3, 'mlp_size_3': 0, 'kernel': 'Logistic', 'loss_name': 'NLLLoss'}. Best is trial 29 with value: 0.6737891981153702.[0m
[32m[I 2022-04-23 07:33:37,798][0m Trial 39 finished with value: 0.5877174091603516 and parameters: {'n_hidden': 256, 'mixture_components': 2, 'use_sparse_layer': False, 'use_batchnorm': True, 'use_dropout': True, 'dropout': 0.21464404453442226, 'mlp_size_1': 4, 'mlp_size_2': 1, 'mlp_size_3': 0, 'kernel': 'Exponential', 'loss_name': 'NLLLoss'}. Best is trial 29 with value: 0.6737891981153702.[0m
[32m[I 2022-04-23 07:34:58,309][0m Trial 40 finished with value: 0.6558416332853032 and parameters: {'n_hidden': 1024, 'mixture_components': 1, 'use_sparse_layer': False, 'use_batchnorm': False, 'use_dropout': True, 'dropout': 0.43223271899710225, 'mlp_size_1': 6, 'mlp_size_2': 1, 'mlp_size_3': 0, 'kernel': 'Normal', 'loss_name': 'CensoredNLLLoss'}. Best is trial 29 with value: 0.6737891981153702.[0m
[32m[I 2022-04-23 07:35:51,435][0m Trial 41 finished with value: 0.6420852518462754 and parameters: {'n_hidden': 512, 'mixture_components': 4, 'use_sparse_layer': False, 'use_batchnorm': False, 'use_dropout': True, 'dropout': 0.17863533686604832, 'mlp_size_1': 5, 'mlp_size_2': 1, 'mlp_size_3': 0, 'kernel': 'Normal', 'loss_name': 'NLLLoss'}. Best is trial 29 with value: 0.6737891981153702.[0m
[32m[I 2022-04-23 07:37:01,747][0m Trial 42 finished with value: 0.6421708414919018 and parameters: {'n_hidden': 512, 'mixture_components': 4, 'use_sparse_layer': False, 'use_batchnorm': False, 'use_dropout': True, 'dropout': 0.24073839563134863, 'mlp_size_1': 5, 'mlp_size_2': 1, 'mlp_size_3': 0, 'kernel': 'Normal', 'loss_name': 'NLLLoss'}. Best is trial 29 with value: 0.6737891981153702.[0m
[32m[I 2022-04-23 07:37:49,810][0m Trial 43 finished with value: 0.6845198635498428 and parameters: {'n_hidden': 512, 'mixture_components': 4, 'use_sparse_layer': False, 'use_batchnorm': False, 'use_dropout': True, 'dropout': 0.09225448892929008, 'mlp_size_1': 4, 'mlp_size_2': 1, 'mlp_size_3': 1, 'kernel': 'Normal', 'loss_name': 'NLLLoss'}. Best is trial 43 with value: 0.6845198635498428.[0m
[32m[I 2022-04-23 07:38:57,790][0m Trial 44 finished with value: 0.65778587969314 and parameters: {'n_hidden': 32, 'mixture_components': 5, 'use_sparse_layer': False, 'use_batchnorm': False, 'use_dropout': True, 'dropout': 0.06560870787820451, 'mlp_size_1': 2, 'mlp_size_2': 0, 'mlp_size_3': 0, 'kernel': 'Normal', 'loss_name': 'NLLLoss'}. Best is trial 43 with value: 0.6845198635498428.[0m
[32m[I 2022-04-23 07:41:20,677][0m Trial 45 finished with value: 0.6265623527556975 and parameters: {'n_hidden': 512, 'mixture_components': 3, 'use_sparse_layer': False, 'use_batchnorm': True, 'use_dropout': True, 'dropout': 0.4823156315935195, 'mlp_size_1': 4, 'mlp_size_2': 2, 'mlp_size_3': 0, 'kernel': 'Normal', 'loss_name': 'NLLLoss'}. Best is trial 43 with value: 0.6845198635498428.[0m
[32m[I 2022-04-23 07:42:11,185][0m Trial 46 finished with value: 0.6439817950831884 and parameters: {'n_hidden': 128, 'mixture_components': 4, 'use_sparse_layer': True, 'use_sparse_loss': False, 'use_batchnorm': False, 'use_dropout': True, 'dropout': 0.13461733928476793, 'mlp_size_1': 3, 'mlp_size_2': 1, 'mlp_size_3': 0, 'kernel': 'Normal', 'loss_name': 'NLLLoss'}. Best is trial 43 with value: 0.6845198635498428.[0m
[32m[I 2022-04-23 07:42:57,106][0m Trial 47 finished with value: 0.5993333361512221 and parameters: {'n_hidden': 512, 'mixture_components': 3, 'use_sparse_layer': False, 'use_batchnorm': False, 'use_dropout': True, 'dropout': 0.3486301533553084, 'mlp_size_1': 4, 'mlp_size_2': 2, 'mlp_size_3': 0, 'kernel': 'Gumbel', 'loss_name': 'NLLLoss'}. Best is trial 43 with value: 0.6845198635498428.[0m
[32m[I 2022-04-23 07:43:54,487][0m Trial 48 finished with value: -0.6654567005322315 and parameters: {'n_hidden': 2048, 'mixture_components': 6, 'use_sparse_layer': True, 'use_sparse_loss': False, 'use_batchnorm': False, 'use_dropout': True, 'dropout': 0.28578421133840026, 'mlp_size_1': 6, 'mlp_size_2': 2, 'mlp_size_3': 0, 'kernel': 'Exponential', 'loss_name': 'CensoredNLLLoss'}. Best is trial 43 with value: 0.6845198635498428.[0m
[32m[I 2022-04-23 07:46:51,694][0m Trial 49 finished with value: 0.6228616336109767 and parameters: {'n_hidden': 512, 'mixture_components': 7, 'use_sparse_layer': False, 'use_batchnorm': True, 'use_dropout': True, 'dropout': 0.06198748530871964, 'mlp_size_1': 4, 'mlp_size_2': 1, 'mlp_size_3': 1, 'kernel': 'Normal', 'loss_name': 'AlternativeNLLLoss'}. Best is trial 43 with value: 0.6845198635498428.[0m
[32m[I 2022-04-23 07:47:38,060][0m Trial 50 finished with value: 0.636147416837253 and parameters: {'n_hidden': 1024, 'mixture_components': 4, 'use_sparse_layer': False, 'use_batchnorm': False, 'use_dropout': False, 'mlp_size_1': 2, 'mlp_size_2': 3, 'mlp_size_3': 2, 'kernel': 'Normal', 'loss_name': 'NLLLoss'}. Best is trial 43 with value: 0.6845198635498428.[0m
[32m[I 2022-04-23 07:48:29,485][0m Trial 51 finished with value: 0.6725037989474826 and parameters: {'n_hidden': 512, 'mixture_components': 4, 'use_sparse_layer': False, 'use_batchnorm': False, 'use_dropout': True, 'dropout': 0.2170134743221057, 'mlp_size_1': 5, 'mlp_size_2': 1, 'mlp_size_3': 0, 'kernel': 'Normal', 'loss_name': 'NLLLoss'}. Best is trial 43 with value: 0.6845198635498428.[0m
[32m[I 2022-04-23 07:49:28,566][0m Trial 52 finished with value: 0.6642710033287633 and parameters: {'n_hidden': 512, 'mixture_components': 5, 'use_sparse_layer': False, 'use_batchnorm': False, 'use_dropout': True, 'dropout': 0.27043569180488414, 'mlp_size_1': 5, 'mlp_size_2': 1, 'mlp_size_3': 0, 'kernel': 'Normal', 'loss_name': 'NLLLoss'}. Best is trial 43 with value: 0.6845198635498428.[0m
[32m[I 2022-04-23 07:50:20,480][0m Trial 53 finished with value: 0.6659657065180464 and parameters: {'n_hidden': 512, 'mixture_components': 4, 'use_sparse_layer': False, 'use_batchnorm': False, 'use_dropout': True, 'dropout': 0.10408351384503195, 'mlp_size_1': 5, 'mlp_size_2': 1, 'mlp_size_3': 0, 'kernel': 'Normal', 'loss_name': 'NLLLoss'}. Best is trial 43 with value: 0.6845198635498428.[0m
[32m[I 2022-04-23 07:51:06,094][0m Trial 54 finished with value: 0.6685727812342402 and parameters: {'n_hidden': 512, 'mixture_components': 4, 'use_sparse_layer': False, 'use_batchnorm': False, 'use_dropout': True, 'dropout': 0.09529936710198268, 'mlp_size_1': 3, 'mlp_size_2': 2, 'mlp_size_3': 1, 'kernel': 'LogLogistic', 'loss_name': 'NLLLoss'}. Best is trial 43 with value: 0.6845198635498428.[0m
[32m[I 2022-04-23 07:51:55,526][0m Trial 55 finished with value: 0.6340219902060529 and parameters: {'n_hidden': 64, 'mixture_components': 5, 'use_sparse_layer': False, 'use_batchnorm': False, 'use_dropout': True, 'dropout': 0.05564192688738556, 'mlp_size_1': 3, 'mlp_size_2': 0, 'mlp_size_3': 0, 'kernel': 'LogLogistic', 'loss_name': 'NLLLoss'}. Best is trial 43 with value: 0.6845198635498428.[0m
[32m[I 2022-04-23 07:52:40,262][0m Trial 56 finished with value: 0.6478676970576995 and parameters: {'n_hidden': 256, 'mixture_components': 6, 'use_sparse_layer': True, 'use_sparse_loss': False, 'use_batchnorm': False, 'use_dropout': True, 'dropout': 0.1896189595154547, 'mlp_size_1': 3, 'mlp_size_2': 2, 'mlp_size_3': 0, 'kernel': 'Logistic', 'loss_name': 'NLLLoss'}. Best is trial 43 with value: 0.6845198635498428.[0m
[32m[I 2022-04-23 07:53:22,975][0m Trial 57 finished with value: 0.6242515911598566 and parameters: {'n_hidden': 512, 'mixture_components': 5, 'use_sparse_layer': False, 'use_batchnorm': False, 'use_dropout': False, 'mlp_size_1': 2, 'mlp_size_2': 4, 'mlp_size_3': 0, 'kernel': 'LogLogistic', 'loss_name': 'AlternativeNLLLoss'}. Best is trial 43 with value: 0.6845198635498428.[0m
[32m[I 2022-04-23 07:56:24,419][0m Trial 58 finished with value: 0.5652353333064685 and parameters: {'n_hidden': 2048, 'mixture_components': 4, 'use_sparse_layer': False, 'use_batchnorm': True, 'use_dropout': True, 'dropout': 0.12282234456047655, 'mlp_size_1': 7, 'mlp_size_2': 1, 'mlp_size_3': 0, 'kernel': 'LogLogistic', 'loss_name': 'NLLLoss'}. Best is trial 43 with value: 0.6845198635498428.[0m
[32m[I 2022-04-23 07:57:05,433][0m Trial 59 finished with value: 0.6443822250481631 and parameters: {'n_hidden': 512, 'mixture_components': 3, 'use_sparse_layer': False, 'use_batchnorm': False, 'use_dropout': True, 'dropout': 0.030312871366932587, 'mlp_size_1': 4, 'mlp_size_2': 2, 'mlp_size_3': 0, 'kernel': 'LogLogistic', 'loss_name': 'NLLLoss'}. Best is trial 43 with value: 0.6845198635498428.[0m
[32m[I 2022-04-23 07:58:01,282][0m Trial 60 finished with value: 0.6144939428789389 and parameters: {'n_hidden': 512, 'mixture_components': 4, 'use_sparse_layer': False, 'use_batchnorm': False, 'use_dropout': True, 'dropout': 0.7817616362683341, 'mlp_size_1': 3, 'mlp_size_2': 2, 'mlp_size_3': 1, 'kernel': 'LogLogistic', 'loss_name': 'NLLLoss'}. Best is trial 43 with value: 0.6845198635498428.[0m
[32m[I 2022-04-23 07:58:50,692][0m Trial 61 finished with value: 0.6647915861995832 and parameters: {'n_hidden': 512, 'mixture_components': 4, 'use_sparse_layer': False, 'use_batchnorm': False, 'use_dropout': True, 'dropout': 0.09978434399999875, 'mlp_size_1': 5, 'mlp_size_2': 1, 'mlp_size_3': 0, 'kernel': 'Normal', 'loss_name': 'NLLLoss'}. Best is trial 43 with value: 0.6845198635498428.[0m
[32m[I 2022-04-23 07:59:40,255][0m Trial 62 finished with value: 0.6560311919431918 and parameters: {'n_hidden': 512, 'mixture_components': 4, 'use_sparse_layer': False, 'use_batchnorm': False, 'use_dropout': True, 'dropout': 0.14931691677723238, 'mlp_size_1': 5, 'mlp_size_2': 1, 'mlp_size_3': 0, 'kernel': 'Normal', 'loss_name': 'NLLLoss'}. Best is trial 43 with value: 0.6845198635498428.[0m
[32m[I 2022-04-23 08:00:36,114][0m Trial 63 finished with value: 0.6806936891077829 and parameters: {'n_hidden': 512, 'mixture_components': 5, 'use_sparse_layer': False, 'use_batchnorm': False, 'use_dropout': True, 'dropout': 0.08896172667835442, 'mlp_size_1': 4, 'mlp_size_2': 1, 'mlp_size_3': 1, 'kernel': 'Normal', 'loss_name': 'NLLLoss'}. Best is trial 43 with value: 0.6845198635498428.[0m
[32m[I 2022-04-23 08:01:35,849][0m Trial 64 finished with value: 0.670989467546425 and parameters: {'n_hidden': 512, 'mixture_components': 5, 'use_sparse_layer': False, 'use_batchnorm': False, 'use_dropout': True, 'dropout': 0.22794064038464554, 'mlp_size_1': 4, 'mlp_size_2': 2, 'mlp_size_3': 0, 'kernel': 'Normal', 'loss_name': 'NLLLoss'}. Best is trial 43 with value: 0.6845198635498428.[0m
[32m[I 2022-04-23 08:02:51,628][0m Trial 65 finished with value: 0.6640635052444794 and parameters: {'n_hidden': 64, 'mixture_components': 5, 'use_sparse_layer': False, 'use_batchnorm': False, 'use_dropout': True, 'dropout': 0.21886316879782086, 'mlp_size_1': 3, 'mlp_size_2': 0, 'mlp_size_3': 0, 'kernel': 'Normal', 'loss_name': 'NLLLoss'}. Best is trial 43 with value: 0.6845198635498428.[0m
[32m[I 2022-04-23 08:04:02,813][0m Trial 66 finished with value: 0.6372726027646205 and parameters: {'n_hidden': 32, 'mixture_components': 6, 'use_sparse_layer': False, 'use_batchnorm': False, 'use_dropout': False, 'mlp_size_1': 2, 'mlp_size_2': 0, 'mlp_size_3': 0, 'kernel': 'Normal', 'loss_name': 'CensoredNLLLoss'}. Best is trial 43 with value: 0.6845198635498428.[0m
[32m[I 2022-04-23 08:05:19,571][0m Trial 67 finished with value: 0.6618759324561259 and parameters: {'n_hidden': 512, 'mixture_components': 5, 'use_sparse_layer': True, 'use_sparse_loss': False, 'use_batchnorm': False, 'use_dropout': True, 'dropout': 0.3023573430359292, 'mlp_size_1': 4, 'mlp_size_2': 1, 'mlp_size_3': 1, 'kernel': 'Normal', 'loss_name': 'AlternativeNLLLoss'}. Best is trial 43 with value: 0.6845198635498428.[0m
[32m[I 2022-04-23 08:06:14,602][0m Trial 68 finished with value: 0.6616795121253032 and parameters: {'n_hidden': 128, 'mixture_components': 5, 'use_sparse_layer': False, 'use_batchnorm': False, 'use_dropout': True, 'dropout': 0.19312891693391815, 'mlp_size_1': 4, 'mlp_size_2': 0, 'mlp_size_3': 0, 'kernel': 'Normal', 'loss_name': 'NLLLoss'}. Best is trial 43 with value: 0.6845198635498428.[0m
[32m[I 2022-04-23 08:07:07,782][0m Trial 69 finished with value: 0.67517568127537 and parameters: {'n_hidden': 512, 'mixture_components': 6, 'use_sparse_layer': False, 'use_batchnorm': False, 'use_dropout': True, 'dropout': 0.23318365577519867, 'mlp_size_1': 4, 'mlp_size_2': 2, 'mlp_size_3': 0, 'kernel': 'Normal', 'loss_name': 'NLLLoss'}. Best is trial 43 with value: 0.6845198635498428.[0m
[32m[I 2022-04-23 08:08:35,674][0m Trial 70 finished with value: 0.2552756176123812 and parameters: {'n_hidden': 512, 'mixture_components': 7, 'use_sparse_layer': False, 'use_batchnorm': True, 'use_dropout': True, 'dropout': 0.15247484388678356, 'mlp_size_1': 4, 'mlp_size_2': 1, 'mlp_size_3': 1, 'kernel': 'Gumbel', 'loss_name': 'NLLLoss'}. Best is trial 43 with value: 0.6845198635498428.[0m
[32m[I 2022-04-23 08:09:36,099][0m Trial 71 finished with value: 0.676554202038645 and parameters: {'n_hidden': 512, 'mixture_components': 6, 'use_sparse_layer': False, 'use_batchnorm': False, 'use_dropout': True, 'dropout': 0.24317059435367172, 'mlp_size_1': 4, 'mlp_size_2': 2, 'mlp_size_3': 0, 'kernel': 'Normal', 'loss_name': 'NLLLoss'}. Best is trial 43 with value: 0.6845198635498428.[0m
[32m[I 2022-04-23 08:10:31,188][0m Trial 72 finished with value: 0.6601488031494377 and parameters: {'n_hidden': 512, 'mixture_components': 6, 'use_sparse_layer': False, 'use_batchnorm': False, 'use_dropout': True, 'dropout': 0.25858971289589594, 'mlp_size_1': 4, 'mlp_size_2': 2, 'mlp_size_3': 0, 'kernel': 'Normal', 'loss_name': 'NLLLoss'}. Best is trial 43 with value: 0.6845198635498428.[0m
[32m[I 2022-04-23 08:11:27,143][0m Trial 73 finished with value: 0.6780993906689015 and parameters: {'n_hidden': 512, 'mixture_components': 7, 'use_sparse_layer': False, 'use_batchnorm': False, 'use_dropout': True, 'dropout': 0.17186706861402348, 'mlp_size_1': 5, 'mlp_size_2': 1, 'mlp_size_3': 0, 'kernel': 'Normal', 'loss_name': 'NLLLoss'}. Best is trial 43 with value: 0.6845198635498428.[0m
[32m[I 2022-04-23 08:12:20,147][0m Trial 74 finished with value: 0.6799658174400762 and parameters: {'n_hidden': 512, 'mixture_components': 8, 'use_sparse_layer': False, 'use_batchnorm': False, 'use_dropout': True, 'dropout': 0.1640102351027754, 'mlp_size_1': 4, 'mlp_size_2': 2, 'mlp_size_3': 0, 'kernel': 'Normal', 'loss_name': 'NLLLoss'}. Best is trial 43 with value: 0.6845198635498428.[0m
[32m[I 2022-04-23 08:13:04,525][0m Trial 75 finished with value: 0.6318093394843197 and parameters: {'n_hidden': 512, 'mixture_components': 8, 'use_sparse_layer': False, 'use_batchnorm': False, 'use_dropout': True, 'dropout': 0.031547830285401146, 'mlp_size_1': 4, 'mlp_size_2': 2, 'mlp_size_3': 0, 'kernel': 'Normal', 'loss_name': 'NLLLoss'}. Best is trial 43 with value: 0.6845198635498428.[0m
[32m[I 2022-04-23 08:13:48,294][0m Trial 76 finished with value: 0.6574268112151589 and parameters: {'n_hidden': 512, 'mixture_components': 8, 'use_sparse_layer': False, 'use_batchnorm': False, 'use_dropout': True, 'dropout': 0.14830232950644748, 'mlp_size_1': 4, 'mlp_size_2': 2, 'mlp_size_3': 0, 'kernel': 'Exponential', 'loss_name': 'NLLLoss'}. Best is trial 43 with value: 0.6845198635498428.[0m
[32m[I 2022-04-23 08:14:34,415][0m Trial 77 finished with value: 0.6607488314265687 and parameters: {'n_hidden': 512, 'mixture_components': 9, 'use_sparse_layer': False, 'use_batchnorm': False, 'use_dropout': False, 'mlp_size_1': 5, 'mlp_size_2': 1, 'mlp_size_3': 0, 'kernel': 'Normal', 'loss_name': 'NLLLoss'}. Best is trial 43 with value: 0.6845198635498428.[0m
[32m[I 2022-04-23 08:15:24,187][0m Trial 78 finished with value: 0.6602146284740666 and parameters: {'n_hidden': 256, 'mixture_components': 7, 'use_sparse_layer': False, 'use_batchnorm': False, 'use_dropout': True, 'dropout': 0.20718568361965375, 'mlp_size_1': 1, 'mlp_size_2': 3, 'mlp_size_3': 1, 'kernel': 'Normal', 'loss_name': 'NLLLoss'}. Best is trial 43 with value: 0.6845198635498428.[0m
[32m[I 2022-04-23 08:16:09,290][0m Trial 79 finished with value: 0.573588282065445 and parameters: {'n_hidden': 1024, 'mixture_components': 8, 'use_sparse_layer': False, 'use_batchnorm': False, 'use_dropout': True, 'dropout': 0.8780237981083214, 'mlp_size_1': 5, 'mlp_size_2': 2, 'mlp_size_3': 0, 'kernel': 'Normal', 'loss_name': 'NLLLoss'}. Best is trial 43 with value: 0.6845198635498428.[0m
[32m[I 2022-04-23 08:17:44,221][0m Trial 80 finished with value: 0.6637139270246328 and parameters: {'n_hidden': 2048, 'mixture_components': 9, 'use_sparse_layer': True, 'use_sparse_loss': True, 'lmbd': 1.1811544450236109e-06, 'use_batchnorm': False, 'use_dropout': True, 'dropout': 0.10048791090947562, 'mlp_size_1': 6, 'mlp_size_2': 1, 'mlp_size_3': 1, 'kernel': 'Normal', 'loss_name': 'CensoredNLLLoss'}. Best is trial 43 with value: 0.6845198635498428.[0m
[32m[I 2022-04-23 08:18:35,935][0m Trial 81 finished with value: 0.6676828337511215 and parameters: {'n_hidden': 512, 'mixture_components': 7, 'use_sparse_layer': False, 'use_batchnorm': False, 'use_dropout': True, 'dropout': 0.1735583873993355, 'mlp_size_1': 3, 'mlp_size_2': 2, 'mlp_size_3': 1, 'kernel': 'Normal', 'loss_name': 'NLLLoss'}. Best is trial 43 with value: 0.6845198635498428.[0m
[32m[I 2022-04-23 08:19:26,858][0m Trial 82 finished with value: 0.6573441544358245 and parameters: {'n_hidden': 512, 'mixture_components': 6, 'use_sparse_layer': False, 'use_batchnorm': False, 'use_dropout': True, 'dropout': 0.23580171619962864, 'mlp_size_1': 4, 'mlp_size_2': 2, 'mlp_size_3': 0, 'kernel': 'Normal', 'loss_name': 'NLLLoss'}. Best is trial 43 with value: 0.6845198635498428.[0m
[32m[I 2022-04-23 08:20:23,924][0m Trial 83 finished with value: 0.6630095328517532 and parameters: {'n_hidden': 512, 'mixture_components': 6, 'use_sparse_layer': False, 'use_batchnorm': False, 'use_dropout': True, 'dropout': 0.1292354866800014, 'mlp_size_1': 4, 'mlp_size_2': 2, 'mlp_size_3': 0, 'kernel': 'Normal', 'loss_name': 'NLLLoss'}. Best is trial 43 with value: 0.6845198635498428.[0m
[32m[I 2022-04-23 08:21:12,852][0m Trial 84 finished with value: 0.6658831745286526 and parameters: {'n_hidden': 512, 'mixture_components': 7, 'use_sparse_layer': False, 'use_batchnorm': False, 'use_dropout': True, 'dropout': 0.1815947652247848, 'mlp_size_1': 3, 'mlp_size_2': 2, 'mlp_size_3': 1, 'kernel': 'Logistic', 'loss_name': 'NLLLoss'}. Best is trial 43 with value: 0.6845198635498428.[0m
[32m[I 2022-04-23 08:22:00,587][0m Trial 85 finished with value: 0.6372807026670999 and parameters: {'n_hidden': 512, 'mixture_components': 7, 'use_sparse_layer': False, 'use_batchnorm': False, 'use_dropout': True, 'dropout': 0.07540070663819451, 'mlp_size_1': 4, 'mlp_size_2': 2, 'mlp_size_3': 0, 'kernel': 'Normal', 'loss_name': 'NLLLoss'}. Best is trial 43 with value: 0.6845198635498428.[0m
[32m[I 2022-04-23 08:23:11,343][0m Trial 86 finished with value: 0.6123588517407188 and parameters: {'n_hidden': 32, 'mixture_components': 8, 'use_sparse_layer': False, 'use_batchnorm': False, 'use_dropout': True, 'dropout': 0.2799227398870422, 'mlp_size_1': 2, 'mlp_size_2': 0, 'mlp_size_3': 0, 'kernel': 'Normal', 'loss_name': 'NLLLoss'}. Best is trial 43 with value: 0.6845198635498428.[0m
[32m[I 2022-04-23 08:24:23,658][0m Trial 87 finished with value: 0.6627796064431601 and parameters: {'n_hidden': 512, 'mixture_components': 6, 'use_sparse_layer': False, 'use_batchnorm': False, 'use_dropout': True, 'dropout': 0.16130699737327897, 'mlp_size_1': 3, 'mlp_size_2': 2, 'mlp_size_3': 1, 'kernel': 'Normal', 'loss_name': 'AlternativeNLLLoss'}. Best is trial 43 with value: 0.6845198635498428.[0m
[32m[I 2022-04-23 08:25:02,259][0m Trial 88 finished with value: 0.5878786889664518 and parameters: {'n_hidden': 128, 'mixture_components': 6, 'use_sparse_layer': False, 'use_batchnorm': False, 'use_dropout': True, 'dropout': 0.2422491368345821, 'mlp_size_1': 4, 'mlp_size_2': 0, 'mlp_size_3': 0, 'kernel': 'Gumbel', 'loss_name': 'NLLLoss'}. Best is trial 43 with value: 0.6845198635498428.[0m
