[32m[I 2022-04-23 06:10:56,081][0m Trial 982 finished with value: 0.7297341476055539 and parameters: {'n_hidden': 256, 'mixture_components': 5, 'use_sparse_layer': False, 'use_batchnorm': False, 'use_dropout': True, 'dropout': 0.5640790646508579, 'mlp_size_1': 0, 'mlp_size_2': 5, 'mlp_size_3': 0, 'kernel': 'Logistic', 'loss_name': 'CensoredNLLLoss'}. Best is trial 22 with value: 0.8433318468070169.[0m
[32m[I 2022-04-23 06:13:40,695][0m Trial 983 finished with value: 0.42283025958796794 and parameters: {'n_hidden': 256, 'mixture_components': 4, 'use_sparse_layer': True, 'use_sparse_loss': True, 'lmbd': 0.002459978422369788, 'use_batchnorm': True, 'use_dropout': True, 'dropout': 0.5741224147090281, 'mlp_size_1': 3, 'mlp_size_2': 2, 'mlp_size_3': 0, 'kernel': 'Logistic', 'loss_name': 'CensoredNLLLoss'}. Best is trial 22 with value: 0.8433318468070169.[0m
[32m[I 2022-04-23 06:16:14,511][0m Trial 984 finished with value: 0.7293355145225051 and parameters: {'n_hidden': 256, 'mixture_components': 6, 'use_sparse_layer': False, 'use_batchnorm': True, 'use_dropout': True, 'dropout': 0.5444356599868635, 'mlp_size_1': 0, 'mlp_size_2': 5, 'mlp_size_3': 0, 'kernel': 'Logistic', 'loss_name': 'CensoredNLLLoss'}. Best is trial 22 with value: 0.8433318468070169.[0m
[32m[I 2022-04-23 06:18:57,974][0m Trial 985 finished with value: 0.825926479697662 and parameters: {'n_hidden': 256, 'mixture_components': 5, 'use_sparse_layer': True, 'use_sparse_loss': True, 'lmbd': 0.0014984173172710711, 'use_batchnorm': True, 'use_dropout': True, 'dropout': 0.5675194713076019, 'mlp_size_1': 0, 'mlp_size_2': 5, 'mlp_size_3': 0, 'kernel': 'Logistic', 'loss_name': 'CensoredNLLLoss'}. Best is trial 22 with value: 0.8433318468070169.[0m
[32m[I 2022-04-23 06:21:20,093][0m Trial 986 finished with value: 0.6310867241986904 and parameters: {'n_hidden': 256, 'mixture_components': 4, 'use_sparse_layer': False, 'use_batchnorm': True, 'use_dropout': True, 'dropout': 0.5272087979799542, 'mlp_size_1': 0, 'mlp_size_2': 5, 'mlp_size_3': 0, 'kernel': 'Logistic', 'loss_name': 'CensoredNLLLoss'}. Best is trial 22 with value: 0.8433318468070169.[0m
[32m[I 2022-04-23 06:24:03,814][0m Trial 987 finished with value: 0.7238933414504327 and parameters: {'n_hidden': 256, 'mixture_components': 6, 'use_sparse_layer': True, 'use_sparse_loss': True, 'lmbd': 0.0036345383916539502, 'use_batchnorm': True, 'use_dropout': True, 'dropout': 0.5846998090565352, 'mlp_size_1': 0, 'mlp_size_2': 5, 'mlp_size_3': 0, 'kernel': 'Logistic', 'loss_name': 'CensoredNLLLoss'}. Best is trial 22 with value: 0.8433318468070169.[0m
[32m[I 2022-04-23 06:26:26,936][0m Trial 988 finished with value: 0.7241074219800001 and parameters: {'n_hidden': 256, 'mixture_components': 5, 'use_sparse_layer': False, 'use_batchnorm': True, 'use_dropout': True, 'dropout': 0.5629097544885665, 'mlp_size_1': 0, 'mlp_size_2': 5, 'mlp_size_3': 0, 'kernel': 'Logistic', 'loss_name': 'CensoredNLLLoss'}. Best is trial 22 with value: 0.8433318468070169.[0m
[32m[I 2022-04-23 06:28:57,886][0m Trial 989 finished with value: 0.732238112014034 and parameters: {'n_hidden': 256, 'mixture_components': 4, 'use_sparse_layer': True, 'use_sparse_loss': True, 'lmbd': 0.0028676566482898954, 'use_batchnorm': True, 'use_dropout': True, 'dropout': 0.5819123888289535, 'mlp_size_1': 0, 'mlp_size_2': 5, 'mlp_size_3': 0, 'kernel': 'Logistic', 'loss_name': 'CensoredNLLLoss'}. Best is trial 22 with value: 0.8433318468070169.[0m
[32m[I 2022-04-23 06:30:01,811][0m Trial 990 finished with value: 0.81304029081146 and parameters: {'n_hidden': 256, 'mixture_components': 5, 'use_sparse_layer': True, 'use_sparse_loss': True, 'lmbd': 0.005418451971588335, 'use_batchnorm': False, 'use_dropout': True, 'dropout': 0.5934645186255849, 'mlp_size_1': 0, 'mlp_size_2': 5, 'mlp_size_3': 0, 'kernel': 'Logistic', 'loss_name': 'CensoredNLLLoss'}. Best is trial 22 with value: 0.8433318468070169.[0m
[32m[I 2022-04-23 06:32:34,847][0m Trial 991 finished with value: 0.839447357176865 and parameters: {'n_hidden': 256, 'mixture_components': 6, 'use_sparse_layer': False, 'use_batchnorm': True, 'use_dropout': True, 'dropout': 0.5998023100101304, 'mlp_size_1': 0, 'mlp_size_2': 5, 'mlp_size_3': 0, 'kernel': 'Logistic', 'loss_name': 'CensoredNLLLoss'}. Best is trial 22 with value: 0.8433318468070169.[0m
[32m[I 2022-04-23 06:35:17,543][0m Trial 992 finished with value: 0.8314137573710207 and parameters: {'n_hidden': 256, 'mixture_components': 6, 'use_sparse_layer': False, 'use_batchnorm': True, 'use_dropout': True, 'dropout': 0.566737450749581, 'mlp_size_1': 0, 'mlp_size_2': 5, 'mlp_size_3': 0, 'kernel': 'Logistic', 'loss_name': 'CensoredNLLLoss'}. Best is trial 22 with value: 0.8433318468070169.[0m
[32m[I 2022-04-23 06:37:52,541][0m Trial 993 finished with value: 0.8356392416900169 and parameters: {'n_hidden': 256, 'mixture_components': 6, 'use_sparse_layer': False, 'use_batchnorm': True, 'use_dropout': True, 'dropout': 0.5927572455663789, 'mlp_size_1': 0, 'mlp_size_2': 5, 'mlp_size_3': 0, 'kernel': 'LogLogistic', 'loss_name': 'CensoredNLLLoss'}. Best is trial 22 with value: 0.8433318468070169.[0m
[32m[I 2022-04-23 06:40:07,511][0m Trial 994 finished with value: 0.7261195730466264 and parameters: {'n_hidden': 256, 'mixture_components': 6, 'use_sparse_layer': False, 'use_batchnorm': True, 'use_dropout': True, 'dropout': 0.5438445129326832, 'mlp_size_1': 0, 'mlp_size_2': 5, 'mlp_size_3': 0, 'kernel': 'LogLogistic', 'loss_name': 'CensoredNLLLoss'}. Best is trial 22 with value: 0.8433318468070169.[0m
[32m[I 2022-04-23 06:42:29,451][0m Trial 995 finished with value: 0.6245475227892962 and parameters: {'n_hidden': 256, 'mixture_components': 6, 'use_sparse_layer': False, 'use_batchnorm': True, 'use_dropout': True, 'dropout': 0.6057486823628372, 'mlp_size_1': 0, 'mlp_size_2': 5, 'mlp_size_3': 0, 'kernel': 'Logistic', 'loss_name': 'CensoredNLLLoss'}. Best is trial 22 with value: 0.8433318468070169.[0m
[32m[I 2022-04-23 06:44:54,054][0m Trial 996 finished with value: 0.3302464335351184 and parameters: {'n_hidden': 256, 'mixture_components': 6, 'use_sparse_layer': False, 'use_batchnorm': True, 'use_dropout': True, 'dropout': 0.5790392119409489, 'mlp_size_1': 3, 'mlp_size_2': 2, 'mlp_size_3': 0, 'kernel': 'LogLogistic', 'loss_name': 'CensoredNLLLoss'}. Best is trial 22 with value: 0.8433318468070169.[0m
[32m[I 2022-04-23 06:47:21,474][0m Trial 997 finished with value: 0.8276842091067301 and parameters: {'n_hidden': 256, 'mixture_components': 6, 'use_sparse_layer': False, 'use_batchnorm': True, 'use_dropout': True, 'dropout': 0.5564703933453519, 'mlp_size_1': 0, 'mlp_size_2': 5, 'mlp_size_3': 0, 'kernel': 'LogLogistic', 'loss_name': 'CensoredNLLLoss'}. Best is trial 22 with value: 0.8433318468070169.[0m
[32m[I 2022-04-23 06:50:02,010][0m Trial 998 finished with value: 0.6189184663238828 and parameters: {'n_hidden': 256, 'mixture_components': 6, 'use_sparse_layer': False, 'use_batchnorm': True, 'use_dropout': True, 'dropout': 0.6099756697220996, 'mlp_size_1': 0, 'mlp_size_2': 5, 'mlp_size_3': 0, 'kernel': 'Normal', 'loss_name': 'CensoredNLLLoss'}. Best is trial 22 with value: 0.8433318468070169.[0m
[32m[I 2022-04-23 06:51:03,976][0m Trial 999 finished with value: 0.8044909572818888 and parameters: {'n_hidden': 256, 'mixture_components': 6, 'use_sparse_layer': False, 'use_batchnorm': False, 'use_dropout': True, 'dropout': 0.5907514834291667, 'mlp_size_1': 0, 'mlp_size_2': 5, 'mlp_size_3': 0, 'kernel': 'LogLogistic', 'loss_name': 'CensoredNLLLoss'}. Best is trial 22 with value: 0.8433318468070169.[0m
[32m[I 2022-04-23 06:51:03,989][0m A new study created in memory with name: no-name-de5be4bc-59ad-4d0d-bb75-40e69ee70530[0m
[32m[I 2022-04-23 06:52:38,296][0m Trial 0 finished with value: 0.6402469763789734 and parameters: {'n_hidden': 256, 'mixture_components': 1, 'use_sparse_layer': True, 'use_sparse_loss': True, 'lmbd': 0.0001873588056422323, 'use_batchnorm': True, 'use_dropout': False, 'mlp_size_1': 0, 'mlp_size_2': 3, 'mlp_size_3': 2, 'kernel': 'LogLogistic', 'loss_name': 'NLLLoss'}. Best is trial 0 with value: 0.6402469763789734.[0m
[32m[I 2022-04-23 06:54:20,076][0m Trial 1 finished with value: 0.5746387755907159 and parameters: {'n_hidden': 32, 'mixture_components': 8, 'use_sparse_layer': False, 'use_batchnorm': True, 'use_dropout': False, 'mlp_size_1': 2, 'mlp_size_2': 0, 'mlp_size_3': 0, 'kernel': 'Logistic', 'loss_name': 'NLLLoss'}. Best is trial 0 with value: 0.6402469763789734.[0m
[32m[I 2022-04-23 06:54:57,900][0m Trial 2 finished with value: -0.09069851342516426 and parameters: {'n_hidden': 256, 'mixture_components': 1, 'use_sparse_layer': False, 'use_batchnorm': True, 'use_dropout': True, 'dropout': 0.4581647799243683, 'mlp_size_1': 4, 'mlp_size_2': 1, 'mlp_size_3': 0, 'kernel': 'Gumbel', 'loss_name': 'NLLLoss'}. Best is trial 0 with value: 0.6402469763789734.[0m
[32m[I 2022-04-23 06:56:20,039][0m Trial 3 finished with value: 0.6193430643010523 and parameters: {'n_hidden': 1024, 'mixture_components': 3, 'use_sparse_layer': True, 'use_sparse_loss': True, 'lmbd': 0.0418262101205415, 'use_batchnorm': False, 'use_dropout': True, 'dropout': 0.7658797049653945, 'mlp_size_1': 4, 'mlp_size_2': 1, 'mlp_size_3': 2, 'kernel': 'Normal', 'loss_name': 'AlternativeNLLLoss'}. Best is trial 0 with value: 0.6402469763789734.[0m
[32m[I 2022-04-23 06:57:22,357][0m Trial 4 finished with value: 0.615176246233239 and parameters: {'n_hidden': 128, 'mixture_components': 9, 'use_sparse_layer': False, 'use_batchnorm': False, 'use_dropout': False, 'mlp_size_1': 3, 'mlp_size_2': 1, 'mlp_size_3': 0, 'kernel': 'Normal', 'loss_name': 'CensoredNLLLoss'}. Best is trial 0 with value: 0.6402469763789734.[0m
[32m[I 2022-04-23 06:59:05,327][0m Trial 5 finished with value: 0.5334684458718886 and parameters: {'n_hidden': 2048, 'mixture_components': 8, 'use_sparse_layer': True, 'use_sparse_loss': False, 'use_batchnorm': True, 'use_dropout': True, 'dropout': 0.4923228190829394, 'mlp_size_1': 5, 'mlp_size_2': 2, 'mlp_size_3': 1, 'kernel': 'Logistic', 'loss_name': 'NLLLoss'}. Best is trial 0 with value: 0.6402469763789734.[0m
[32m[I 2022-04-23 07:00:06,793][0m Trial 6 finished with value: -0.6695818496350239 and parameters: {'n_hidden': 1024, 'mixture_components': 1, 'use_sparse_layer': True, 'use_sparse_loss': True, 'lmbd': 0.012816885484620327, 'use_batchnorm': True, 'use_dropout': False, 'mlp_size_1': 3, 'mlp_size_2': 0, 'mlp_size_3': 1, 'kernel': 'Exponential', 'loss_name': 'CensoredNLLLoss'}. Best is trial 0 with value: 0.6402469763789734.[0m
[32m[I 2022-04-23 07:01:30,615][0m Trial 7 finished with value: 0.6386500991896186 and parameters: {'n_hidden': 256, 'mixture_components': 1, 'use_sparse_layer': False, 'use_batchnorm': True, 'use_dropout': False, 'mlp_size_1': 1, 'mlp_size_2': 4, 'mlp_size_3': 0, 'kernel': 'Normal', 'loss_name': 'NLLLoss'}. Best is trial 0 with value: 0.6402469763789734.[0m
[32m[I 2022-04-23 07:02:30,193][0m Trial 8 finished with value: 0.6619613118374834 and parameters: {'n_hidden': 2048, 'mixture_components': 3, 'use_sparse_layer': False, 'use_batchnorm': False, 'use_dropout': False, 'mlp_size_1': 5, 'mlp_size_2': 3, 'mlp_size_3': 0, 'kernel': 'Normal', 'loss_name': 'NLLLoss'}. Best is trial 8 with value: 0.6619613118374834.[0m
[32m[I 2022-04-23 07:04:29,708][0m Trial 9 finished with value: 0.6423575977321043 and parameters: {'n_hidden': 64, 'mixture_components': 4, 'use_sparse_layer': True, 'use_sparse_loss': True, 'lmbd': 0.00015842983906674582, 'use_batchnorm': True, 'use_dropout': True, 'dropout': 0.2740397467882296, 'mlp_size_1': 0, 'mlp_size_2': 1, 'mlp_size_3': 0, 'kernel': 'LogLogistic', 'loss_name': 'AlternativeNLLLoss'}. Best is trial 8 with value: 0.6619613118374834.[0m
[32m[I 2022-04-23 07:05:07,873][0m Trial 10 finished with value: -0.6871447129256963 and parameters: {'n_hidden': 512, 'mixture_components': 6, 'use_sparse_layer': False, 'use_batchnorm': False, 'use_dropout': False, 'mlp_size_1': 6, 'mlp_size_2': 0, 'mlp_size_3': 0, 'kernel': 'Exponential', 'loss_name': 'CensoredNLLLoss'}. Best is trial 8 with value: 0.6619613118374834.[0m
[32m[I 2022-04-23 07:06:00,901][0m Trial 11 finished with value: 0.6232502643855675 and parameters: {'n_hidden': 64, 'mixture_components': 4, 'use_sparse_layer': True, 'use_sparse_loss': False, 'use_batchnorm': False, 'use_dropout': True, 'dropout': 0.012217416975642548, 'mlp_size_1': 0, 'mlp_size_2': 2, 'mlp_size_3': 0, 'kernel': 'LogLogistic', 'loss_name': 'AlternativeNLLLoss'}. Best is trial 8 with value: 0.6619613118374834.[0m
[32m[I 2022-04-23 07:07:20,250][0m Trial 12 finished with value: 0.6412380145199863 and parameters: {'n_hidden': 2048, 'mixture_components': 4, 'use_sparse_layer': True, 'use_sparse_loss': True, 'lmbd': 3.020001559724273e-06, 'use_batchnorm': False, 'use_dropout': True, 'dropout': 0.10677877817117465, 'mlp_size_1': 8, 'mlp_size_2': 0, 'mlp_size_3': 0, 'kernel': 'LogLogistic', 'loss_name': 'AlternativeNLLLoss'}. Best is trial 8 with value: 0.6619613118374834.[0m
[32m[I 2022-04-23 07:08:07,557][0m Trial 13 finished with value: 0.5554866626835371 and parameters: {'n_hidden': 64, 'mixture_components': 6, 'use_sparse_layer': False, 'use_batchnorm': False, 'use_dropout': True, 'dropout': 0.235741537237454, 'mlp_size_1': 1, 'mlp_size_2': 2, 'mlp_size_3': 0, 'kernel': 'Gumbel', 'loss_name': 'AlternativeNLLLoss'}. Best is trial 8 with value: 0.6619613118374834.[0m
[32m[I 2022-04-23 07:09:18,197][0m Trial 14 finished with value: 0.5408497883809977 and parameters: {'n_hidden': 2048, 'mixture_components': 3, 'use_sparse_layer': True, 'use_sparse_loss': True, 'lmbd': 0.00010279541761582387, 'use_batchnorm': False, 'use_dropout': True, 'dropout': 0.9755865134193442, 'mlp_size_1': 7, 'mlp_size_2': 0, 'mlp_size_3': 0, 'kernel': 'Normal', 'loss_name': 'AlternativeNLLLoss'}. Best is trial 8 with value: 0.6619613118374834.[0m
[32m[I 2022-04-23 07:10:52,870][0m Trial 15 finished with value: 0.562293565556736 and parameters: {'n_hidden': 64, 'mixture_components': 5, 'use_sparse_layer': False, 'use_batchnorm': True, 'use_dropout': False, 'mlp_size_1': 1, 'mlp_size_2': 1, 'mlp_size_3': 1, 'kernel': 'LogLogistic', 'loss_name': 'NLLLoss'}. Best is trial 8 with value: 0.6619613118374834.[0m
[32m[I 2022-04-23 07:12:32,436][0m Trial 16 finished with value: 0.6284542368719064 and parameters: {'n_hidden': 128, 'mixture_components': 3, 'use_sparse_layer': True, 'use_sparse_loss': False, 'use_batchnorm': True, 'use_dropout': False, 'mlp_size_1': 2, 'mlp_size_2': 1, 'mlp_size_3': 0, 'kernel': 'LogLogistic', 'loss_name': 'AlternativeNLLLoss'}. Best is trial 8 with value: 0.6619613118374834.[0m
[32m[I 2022-04-23 07:13:31,258][0m Trial 17 finished with value: 0.6621281887290291 and parameters: {'n_hidden': 512, 'mixture_components': 5, 'use_sparse_layer': False, 'use_batchnorm': False, 'use_dropout': True, 'dropout': 0.30345812039900666, 'mlp_size_1': 4, 'mlp_size_2': 2, 'mlp_size_3': 0, 'kernel': 'Normal', 'loss_name': 'NLLLoss'}. Best is trial 17 with value: 0.6621281887290291.[0m
[32m[I 2022-04-23 07:14:13,366][0m Trial 18 finished with value: 0.6301777109356592 and parameters: {'n_hidden': 512, 'mixture_components': 5, 'use_sparse_layer': False, 'use_batchnorm': False, 'use_dropout': False, 'mlp_size_1': 5, 'mlp_size_2': 1, 'mlp_size_3': 0, 'kernel': 'Normal', 'loss_name': 'NLLLoss'}. Best is trial 17 with value: 0.6621281887290291.[0m
[32m[I 2022-04-23 07:14:59,478][0m Trial 19 finished with value: 0.6298607350240746 and parameters: {'n_hidden': 512, 'mixture_components': 7, 'use_sparse_layer': False, 'use_batchnorm': False, 'use_dropout': True, 'dropout': 0.6762633805143015, 'mlp_size_1': 4, 'mlp_size_2': 2, 'mlp_size_3': 0, 'kernel': 'Normal', 'loss_name': 'NLLLoss'}. Best is trial 17 with value: 0.6621281887290291.[0m
[32m[I 2022-04-23 07:15:43,004][0m Trial 20 finished with value: 0.6122535970279619 and parameters: {'n_hidden': 32, 'mixture_components': 2, 'use_sparse_layer': False, 'use_batchnorm': False, 'use_dropout': False, 'mlp_size_1': 2, 'mlp_size_2': 0, 'mlp_size_3': 0, 'kernel': 'Normal', 'loss_name': 'NLLLoss'}. Best is trial 17 with value: 0.6621281887290291.[0m
[32m[I 2022-04-23 07:16:41,548][0m Trial 21 finished with value: 0.6714970018370997 and parameters: {'n_hidden': 512, 'mixture_components': 4, 'use_sparse_layer': False, 'use_batchnorm': False, 'use_dropout': True, 'dropout': 0.29750458484163256, 'mlp_size_1': 5, 'mlp_size_2': 1, 'mlp_size_3': 0, 'kernel': 'Normal', 'loss_name': 'NLLLoss'}. Best is trial 21 with value: 0.6714970018370997.[0m
[32m[I 2022-04-23 07:17:35,522][0m Trial 22 finished with value: 0.644728138853089 and parameters: {'n_hidden': 512, 'mixture_components': 5, 'use_sparse_layer': False, 'use_batchnorm': False, 'use_dropout': True, 'dropout': 0.3219445850943101, 'mlp_size_1': 5, 'mlp_size_2': 1, 'mlp_size_3': 0, 'kernel': 'Normal', 'loss_name': 'NLLLoss'}. Best is trial 21 with value: 0.6714970018370997.[0m
[32m[I 2022-04-23 07:18:37,143][0m Trial 23 finished with value: 0.6655710258042579 and parameters: {'n_hidden': 512, 'mixture_components': 3, 'use_sparse_layer': False, 'use_batchnorm': False, 'use_dropout': True, 'dropout': 0.35921451964505846, 'mlp_size_1': 5, 'mlp_size_2': 1, 'mlp_size_3': 0, 'kernel': 'Normal', 'loss_name': 'NLLLoss'}. Best is trial 21 with value: 0.6714970018370997.[0m
[32m[I 2022-04-23 07:19:37,561][0m Trial 24 finished with value: 0.6456792584759737 and parameters: {'n_hidden': 512, 'mixture_components': 2, 'use_sparse_layer': False, 'use_batchnorm': False, 'use_dropout': True, 'dropout': 0.3720944186427021, 'mlp_size_1': 4, 'mlp_size_2': 1, 'mlp_size_3': 1, 'kernel': 'Normal', 'loss_name': 'NLLLoss'}. Best is trial 21 with value: 0.6714970018370997.[0m
[32m[I 2022-04-23 07:20:23,031][0m Trial 25 finished with value: 0.6644015256246212 and parameters: {'n_hidden': 512, 'mixture_components': 4, 'use_sparse_layer': False, 'use_batchnorm': False, 'use_dropout': True, 'dropout': 0.20308042322736514, 'mlp_size_1': 5, 'mlp_size_2': 1, 'mlp_size_3': 0, 'kernel': 'Normal', 'loss_name': 'NLLLoss'}. Best is trial 21 with value: 0.6714970018370997.[0m
[32m[I 2022-04-23 07:21:03,921][0m Trial 26 finished with value: -0.6660767313992169 and parameters: {'n_hidden': 512, 'mixture_components': 4, 'use_sparse_layer': False, 'use_batchnorm': False, 'use_dropout': True, 'dropout': 0.16165120590964507, 'mlp_size_1': 6, 'mlp_size_2': 0, 'mlp_size_3': 0, 'kernel': 'Exponential', 'loss_name': 'CensoredNLLLoss'}. Best is trial 21 with value: 0.6714970018370997.[0m
[32m[I 2022-04-23 07:21:56,604][0m Trial 27 finished with value: 0.6284558761738823 and parameters: {'n_hidden': 512, 'mixture_components': 2, 'use_sparse_layer': False, 'use_batchnorm': False, 'use_dropout': True, 'dropout': 0.6236335746375019, 'mlp_size_1': 6, 'mlp_size_2': 0, 'mlp_size_3': 0, 'kernel': 'Logistic', 'loss_name': 'NLLLoss'}. Best is trial 21 with value: 0.6714970018370997.[0m
[32m[I 2022-04-23 07:22:36,016][0m Trial 28 finished with value: 0.5639593730015294 and parameters: {'n_hidden': 512, 'mixture_components': 6, 'use_sparse_layer': False, 'use_batchnorm': False, 'use_dropout': True, 'dropout': 0.40182807091802053, 'mlp_size_1': 5, 'mlp_size_2': 1, 'mlp_size_3': 0, 'kernel': 'Gumbel', 'loss_name': 'NLLLoss'}. Best is trial 21 with value: 0.6714970018370997.[0m
[32m[I 2022-04-23 07:23:27,965][0m Trial 29 finished with value: 0.6737891981153702 and parameters: {'n_hidden': 512, 'mixture_components': 4, 'use_sparse_layer': False, 'use_batchnorm': False, 'use_dropout': True, 'dropout': 0.1708227679263497, 'mlp_size_1': 3, 'mlp_size_2': 2, 'mlp_size_3': 1, 'kernel': 'Normal', 'loss_name': 'NLLLoss'}. Best is trial 29 with value: 0.6737891981153702.[0m
[32m[I 2022-04-23 07:24:10,136][0m Trial 30 finished with value: 0.6289210182317784 and parameters: {'n_hidden': 512, 'mixture_components': 2, 'use_sparse_layer': False, 'use_batchnorm': False, 'use_dropout': True, 'dropout': 0.07338386786302664, 'mlp_size_1': 3, 'mlp_size_2': 3, 'mlp_size_3': 0, 'kernel': 'Normal', 'loss_name': 'NLLLoss'}. Best is trial 29 with value: 0.6737891981153702.[0m
[32m[I 2022-04-23 07:25:11,576][0m Trial 31 finished with value: 0.6720936809398886 and parameters: {'n_hidden': 512, 'mixture_components': 4, 'use_sparse_layer': False, 'use_batchnorm': False, 'use_dropout': True, 'dropout': 0.18581366664363974, 'mlp_size_1': 3, 'mlp_size_2': 2, 'mlp_size_3': 1, 'kernel': 'Normal', 'loss_name': 'NLLLoss'}. Best is trial 29 with value: 0.6737891981153702.[0m
[32m[I 2022-04-23 07:26:11,948][0m Trial 32 finished with value: 0.636607062206923 and parameters: {'n_hidden': 32, 'mixture_components': 3, 'use_sparse_layer': False, 'use_batchnorm': False, 'use_dropout': True, 'dropout': 0.1660982482712408, 'mlp_size_1': 2, 'mlp_size_2': 0, 'mlp_size_3': 0, 'kernel': 'Normal', 'loss_name': 'NLLLoss'}. Best is trial 29 with value: 0.6737891981153702.[0m
[32m[I 2022-04-23 07:27:05,718][0m Trial 33 finished with value: 0.6642938483493162 and parameters: {'n_hidden': 512, 'mixture_components': 4, 'use_sparse_layer': False, 'use_batchnorm': False, 'use_dropout': True, 'dropout': 0.2536482170063517, 'mlp_size_1': 3, 'mlp_size_2': 2, 'mlp_size_3': 1, 'kernel': 'Logistic', 'loss_name': 'NLLLoss'}. Best is trial 29 with value: 0.6737891981153702.[0m
[32m[I 2022-04-23 07:28:05,702][0m Trial 34 finished with value: 0.6446200985920274 and parameters: {'n_hidden': 256, 'mixture_components': 10, 'use_sparse_layer': False, 'use_batchnorm': False, 'use_dropout': True, 'dropout': 0.4013020792736431, 'mlp_size_1': 3, 'mlp_size_2': 2, 'mlp_size_3': 0, 'kernel': 'Normal', 'loss_name': 'NLLLoss'}. Best is trial 29 with value: 0.6737891981153702.[0m
