[32m[I 2022-04-21 14:47:35,735][0m Trial 369 finished with value: 0.25 and parameters: {'loss': 'coxph', 'learning_rate': 0.003144969651295192, 'n_estimators': 112, 'criterion': 'friedman_mse', 'min_samples_split': 3, 'min_samples_leaf': 3, 'min_weight_fraction_leaf': 0.023757962391755143, 'min_impurity_decrease': 0.41319275354507473, 'max_features': 0.7171518155228559, 'subsample': 0.26989992059282314, 'dropout_rate': 0.8673819594120276, 'ccp_alpha': 0.8015854849623238}. Best is trial 290 with value: 0.8297644701144975.[0m
[32m[I 2022-04-21 14:47:39,881][0m Trial 370 finished with value: 0.8235311275952537 and parameters: {'loss': 'coxph', 'learning_rate': 0.002634516084859458, 'n_estimators': 123, 'criterion': 'friedman_mse', 'min_samples_split': 3, 'min_samples_leaf': 3, 'min_weight_fraction_leaf': 0.06088874008567524, 'min_impurity_decrease': 0.4580671989803826, 'max_features': 0.6335329339733063, 'subsample': 0.3483151589563949, 'dropout_rate': 0.9217555238763414, 'ccp_alpha': 0.103991108363627}. Best is trial 290 with value: 0.8297644701144975.[0m
/media/san2_ssd/data/Workdir/survival/venv/lib/python3.8/site-packages/sksurv/ensemble/boosting.py:955: RuntimeWarning: divide by zero encountered in log
  time = numpy.log(time)
/media/san2_ssd/data/Workdir/survival/venv/lib/python3.8/site-packages/sksurv/ensemble/boosting.py:955: RuntimeWarning: divide by zero encountered in log
  time = numpy.log(time)
/media/san2_ssd/data/Workdir/survival/venv/lib/python3.8/site-packages/sksurv/ensemble/boosting.py:955: RuntimeWarning: divide by zero encountered in log
  time = numpy.log(time)
/media/san2_ssd/data/Workdir/survival/venv/lib/python3.8/site-packages/sksurv/ensemble/boosting.py:955: RuntimeWarning: divide by zero encountered in log
  time = numpy.log(time)
[32m[I 2022-04-21 14:47:40,577][0m Trial 371 finished with value: -0.466591058901008 and parameters: {'loss': 'squared', 'learning_rate': 0.008871786421280429, 'n_estimators': 128, 'criterion': 'friedman_mse', 'min_samples_split': 3, 'min_samples_leaf': 3, 'min_weight_fraction_leaf': 0.08794724666745832, 'min_impurity_decrease': 0.3832099262493111, 'max_features': 0.6676719323654832, 'subsample': 0.286205508813788, 'dropout_rate': 0.8726029256315069, 'ccp_alpha': 0.003493961912799095}. Best is trial 290 with value: 0.8297644701144975.[0m
[32m[I 2022-04-21 14:47:44,882][0m Trial 372 finished with value: 0.3724687465074371 and parameters: {'loss': 'coxph', 'learning_rate': 0.0041299550091765305, 'n_estimators': 139, 'criterion': 'friedman_mse', 'min_samples_split': 3, 'min_samples_leaf': 2, 'min_weight_fraction_leaf': 0.09742169615737381, 'min_impurity_decrease': 0.42645854564161817, 'max_features': 0.6878801669735275, 'subsample': 0.3264130954818108, 'dropout_rate': 0.9401935624501545, 'ccp_alpha': 0.20119232841050408}. Best is trial 290 with value: 0.8297644701144975.[0m
[32m[I 2022-04-21 14:47:48,304][0m Trial 373 finished with value: 0.8283835105022817 and parameters: {'loss': 'coxph', 'learning_rate': 0.005962566089387882, 'n_estimators': 116, 'criterion': 'friedman_mse', 'min_samples_split': 3, 'min_samples_leaf': 3, 'min_weight_fraction_leaf': 0.07794329455199583, 'min_impurity_decrease': 0.4801987693526181, 'max_features': 0.6438687198474111, 'subsample': 0.36839214564118283, 'dropout_rate': 0.9116504699459351, 'ccp_alpha': 0.0023012682403757367}. Best is trial 290 with value: 0.8297644701144975.[0m
[32m[I 2022-04-21 14:47:49,671][0m Trial 374 finished with value: 0.8126969663705159 and parameters: {'loss': 'coxph', 'learning_rate': 0.006198785991709422, 'n_estimators': 105, 'criterion': 'friedman_mse', 'min_samples_split': 3, 'min_samples_leaf': 3, 'min_weight_fraction_leaf': 0.07966092375299727, 'min_impurity_decrease': 0.34890638382825573, 'max_features': 0.6406474622274301, 'subsample': 0.4061478464019679, 'dropout_rate': 0.978901791245784, 'ccp_alpha': 0.11408747531115773}. Best is trial 290 with value: 0.8297644701144975.[0m
[32m[I 2022-04-21 14:47:53,090][0m Trial 375 finished with value: 0.8218258329000404 and parameters: {'loss': 'coxph', 'learning_rate': 0.007453908356788053, 'n_estimators': 119, 'criterion': 'friedman_mse', 'min_samples_split': 3, 'min_samples_leaf': 3, 'min_weight_fraction_leaf': 0.049267287322456284, 'min_impurity_decrease': 0.44682592532576304, 'max_features': 0.6274632807625188, 'subsample': 0.3795008254752812, 'dropout_rate': 0.9112122010362395, 'ccp_alpha': 0.09923116397034344}. Best is trial 290 with value: 0.8297644701144975.[0m
[32m[I 2022-04-21 14:47:56,022][0m Trial 376 finished with value: 0.36754457201096613 and parameters: {'loss': 'coxph', 'learning_rate': 0.005118133504145047, 'n_estimators': 109, 'criterion': 'friedman_mse', 'min_samples_split': 3, 'min_samples_leaf': 3, 'min_weight_fraction_leaf': 0.061923176785723476, 'min_impurity_decrease': 0.3951574981217237, 'max_features': 0.6600753957448003, 'subsample': 0.3696918738218246, 'dropout_rate': 0.9272664557113014, 'ccp_alpha': 0.18102061613324508}. Best is trial 290 with value: 0.8297644701144975.[0m
[32m[I 2022-04-21 14:47:59,780][0m Trial 377 finished with value: 0.8260473607016342 and parameters: {'loss': 'coxph', 'learning_rate': 0.010686004459743707, 'n_estimators': 126, 'criterion': 'friedman_mse', 'min_samples_split': 3, 'min_samples_leaf': 3, 'min_weight_fraction_leaf': 0.07386693447933956, 'min_impurity_decrease': 0.4197510870890516, 'max_features': 0.7085323412056841, 'subsample': 0.3541891576446977, 'dropout_rate': 0.944365670746154, 'ccp_alpha': 0.009141191917796339}. Best is trial 290 with value: 0.8297644701144975.[0m
[32m[I 2022-04-21 14:48:13,724][0m Trial 378 finished with value: 0.8280614987057732 and parameters: {'loss': 'coxph', 'learning_rate': 0.0036726771056984093, 'n_estimators': 354, 'criterion': 'friedman_mse', 'min_samples_split': 3, 'min_samples_leaf': 3, 'min_weight_fraction_leaf': 0.03285948300351557, 'min_impurity_decrease': 0.371244699196789, 'max_features': 0.6090159614977179, 'subsample': 0.3382101005914469, 'dropout_rate': 0.9004614944469679, 'ccp_alpha': 0.005092776688240088}. Best is trial 290 with value: 0.8297644701144975.[0m
[32m[I 2022-04-21 14:48:26,154][0m Trial 379 finished with value: 0.2572376233745164 and parameters: {'loss': 'coxph', 'learning_rate': 0.0032893797476698694, 'n_estimators': 324, 'criterion': 'friedman_mse', 'min_samples_split': 3, 'min_samples_leaf': 3, 'min_weight_fraction_leaf': 0.031196765157125043, 'min_impurity_decrease': 0.3725654858270035, 'max_features': 0.5570656181809628, 'subsample': 0.35755030961965933, 'dropout_rate': 0.9006688555779183, 'ccp_alpha': 0.2475005600562611}. Best is trial 290 with value: 0.8297644701144975.[0m
[32m[I 2022-04-21 14:48:49,247][0m Trial 380 finished with value: 0.25 and parameters: {'loss': 'coxph', 'learning_rate': 0.0034980588976259116, 'n_estimators': 374, 'criterion': 'friedman_mse', 'min_samples_split': 3, 'min_samples_leaf': 3, 'min_weight_fraction_leaf': 0.017560471390885925, 'min_impurity_decrease': 0.356384072289249, 'max_features': 0.6153704530469479, 'subsample': 0.39061790588289985, 'dropout_rate': 0.844833646003691, 'ccp_alpha': 1.5601050050204406}. Best is trial 290 with value: 0.8297644701144975.[0m
[32m[I 2022-04-21 14:49:02,958][0m Trial 381 finished with value: 0.8227013765172219 and parameters: {'loss': 'coxph', 'learning_rate': 0.004300227433211174, 'n_estimators': 359, 'criterion': 'friedman_mse', 'min_samples_split': 3, 'min_samples_leaf': 3, 'min_weight_fraction_leaf': 0.029020264594188362, 'min_impurity_decrease': 0.38746301446155207, 'max_features': 0.5787124329439802, 'subsample': 0.33319166491970686, 'dropout_rate': 0.8939064670913401, 'ccp_alpha': 0.09902171798933551}. Best is trial 290 with value: 0.8297644701144975.[0m
[32m[I 2022-04-21 14:49:20,038][0m Trial 382 finished with value: 0.25 and parameters: {'loss': 'coxph', 'learning_rate': 0.0026964165188708327, 'n_estimators': 388, 'criterion': 'absolute_error', 'min_samples_split': 3, 'min_samples_leaf': 3, 'min_weight_fraction_leaf': 0.04260858262944667, 'min_impurity_decrease': 0.34096795356156895, 'max_features': 0.6028471856631549, 'subsample': 0.31617804218183365, 'dropout_rate': 0.9116506175186779, 'ccp_alpha': 0.178921603384728}. Best is trial 290 with value: 0.8297644701144975.[0m
[32m[I 2022-04-21 14:49:35,242][0m Trial 383 finished with value: 0.8262727031030019 and parameters: {'loss': 'coxph', 'learning_rate': 0.00558115224358417, 'n_estimators': 302, 'criterion': 'friedman_mse', 'min_samples_split': 3, 'min_samples_leaf': 4, 'min_weight_fraction_leaf': 0.052890268441975086, 'min_impurity_decrease': 0.47166279140904943, 'max_features': 0.6464988149080667, 'subsample': 0.4275770033185211, 'dropout_rate': 0.8609644726619553, 'ccp_alpha': 0.0049658182854339025}. Best is trial 290 with value: 0.8297644701144975.[0m
[32m[I 2022-04-21 14:49:45,133][0m Trial 384 finished with value: 0.8270232348667497 and parameters: {'loss': 'coxph', 'learning_rate': 0.0036357879745861454, 'n_estimators': 284, 'criterion': 'friedman_mse', 'min_samples_split': 3, 'min_samples_leaf': 3, 'min_weight_fraction_leaf': 0.06499236324893967, 'min_impurity_decrease': 0.39439073898432647, 'max_features': 0.6211720802794474, 'subsample': 0.34167734686228834, 'dropout_rate': 0.8791872838444675, 'ccp_alpha': 0.003809211177332048}. Best is trial 290 with value: 0.8297644701144975.[0m
[32m[I 2022-04-21 14:49:57,996][0m Trial 385 finished with value: 0.25 and parameters: {'loss': 'coxph', 'learning_rate': 0.0038290843579892515, 'n_estimators': 241, 'criterion': 'friedman_mse', 'min_samples_split': 3, 'min_samples_leaf': 3, 'min_weight_fraction_leaf': 0.06687793271319885, 'min_impurity_decrease': 0.3676036826199359, 'max_features': 0.6116425525718142, 'subsample': 0.37114612556515236, 'dropout_rate': 0.873523586628659, 'ccp_alpha': 0.325565087671728}. Best is trial 290 with value: 0.8297644701144975.[0m
[32m[I 2022-04-21 14:50:29,122][0m Trial 386 finished with value: 0.8288811922604653 and parameters: {'loss': 'coxph', 'learning_rate': 0.00667345241262475, 'n_estimators': 433, 'criterion': 'friedman_mse', 'min_samples_split': 5, 'min_samples_leaf': 3, 'min_weight_fraction_leaf': 0.08184523445096074, 'min_impurity_decrease': 0.4443976972086156, 'max_features': 0.5946652741382666, 'subsample': 0.3506047080465202, 'dropout_rate': 0.840897042039038, 'ccp_alpha': 0.13114825493439175}. Best is trial 290 with value: 0.8297644701144975.[0m
[32m[I 2022-04-21 14:50:55,792][0m Trial 387 finished with value: 0.25 and parameters: {'loss': 'coxph', 'learning_rate': 0.006813002215585118, 'n_estimators': 400, 'criterion': 'squared_error', 'min_samples_split': 6, 'min_samples_leaf': 3, 'min_weight_fraction_leaf': 0.08120315161809596, 'min_impurity_decrease': 0.4732909341021297, 'max_features': 0.5301683802695004, 'subsample': 0.36680232528731044, 'dropout_rate': 0.8289318139670849, 'ccp_alpha': 0.4959462488207172}. Best is trial 290 with value: 0.8297644701144975.[0m
[32m[I 2022-04-21 14:51:04,761][0m Trial 388 finished with value: 0.3877612245277353 and parameters: {'loss': 'coxph', 'learning_rate': 0.0031417487550496415, 'n_estimators': 302, 'criterion': 'friedman_mse', 'min_samples_split': 5, 'min_samples_leaf': 3, 'min_weight_fraction_leaf': 0.05650930194677101, 'min_impurity_decrease': 0.45384842370234174, 'max_features': 0.5815341437045594, 'subsample': 0.344622001219347, 'dropout_rate': 0.8443018751733169, 'ccp_alpha': 0.17915170948440473}. Best is trial 290 with value: 0.8297644701144975.[0m
[32m[I 2022-04-21 14:51:43,625][0m Trial 389 finished with value: 0.25662745571200507 and parameters: {'loss': 'coxph', 'learning_rate': 0.0083807229834806, 'n_estimators': 451, 'criterion': 'friedman_mse', 'min_samples_split': 5, 'min_samples_leaf': 3, 'min_weight_fraction_leaf': 0.06687310829239045, 'min_impurity_decrease': 0.44117240548979664, 'max_features': 0.6228692442952847, 'subsample': 0.3934451154043787, 'dropout_rate': 0.8300432806578208, 'ccp_alpha': 0.2762698871991188}. Best is trial 290 with value: 0.8297644701144975.[0m
[32m[I 2022-04-21 14:51:57,604][0m Trial 390 finished with value: 0.8234629844507284 and parameters: {'loss': 'coxph', 'learning_rate': 0.004279443869369979, 'n_estimators': 282, 'criterion': 'friedman_mse', 'min_samples_split': 5, 'min_samples_leaf': 3, 'min_weight_fraction_leaf': 0.08538794910760608, 'min_impurity_decrease': 0.40558669684369925, 'max_features': 0.5960660425330409, 'subsample': 0.348367209151066, 'dropout_rate': 0.8562231973151645, 'ccp_alpha': 0.13631394705625188}. Best is trial 290 with value: 0.8297644701144975.[0m
/media/san2_ssd/data/Workdir/survival/venv/lib/python3.8/site-packages/sksurv/ensemble/boosting.py:955: RuntimeWarning: divide by zero encountered in log
  time = numpy.log(time)
/media/san2_ssd/data/Workdir/survival/venv/lib/python3.8/site-packages/sksurv/ensemble/boosting.py:955: RuntimeWarning: divide by zero encountered in log
  time = numpy.log(time)
/media/san2_ssd/data/Workdir/survival/venv/lib/python3.8/site-packages/sksurv/ensemble/boosting.py:955: RuntimeWarning: divide by zero encountered in log
  time = numpy.log(time)
/media/san2_ssd/data/Workdir/survival/venv/lib/python3.8/site-packages/sksurv/ensemble/boosting.py:955: RuntimeWarning: divide by zero encountered in log
  time = numpy.log(time)
[32m[I 2022-04-21 14:51:58,527][0m Trial 391 finished with value: -0.45 and parameters: {'loss': 'squared', 'learning_rate': 0.014690294056528587, 'n_estimators': 291, 'criterion': 'friedman_mse', 'min_samples_split': 5, 'min_samples_leaf': 4, 'min_weight_fraction_leaf': 0.07889276722566285, 'min_impurity_decrease': 0.4874685762287321, 'max_features': 0.62172644247935, 'subsample': 0.3330013699231901, 'dropout_rate': 0.915194306747642, 'ccp_alpha': 2.7073280868021525}. Best is trial 290 with value: 0.8297644701144975.[0m
[32m[I 2022-04-21 14:52:20,886][0m Trial 392 finished with value: 0.8253204420216168 and parameters: {'loss': 'coxph', 'learning_rate': 0.0026790863582851375, 'n_estimators': 417, 'criterion': 'friedman_mse', 'min_samples_split': 4, 'min_samples_leaf': 3, 'min_weight_fraction_leaf': 0.06244998494636381, 'min_impurity_decrease': 0.45315878194452897, 'max_features': 0.6049651862606886, 'subsample': 0.36160023490692383, 'dropout_rate': 0.8921603357358246, 'ccp_alpha': 0.11141364621697745}. Best is trial 290 with value: 0.8297644701144975.[0m
[32m[I 2022-04-21 14:52:34,994][0m Trial 393 finished with value: 0.8247002356466661 and parameters: {'loss': 'coxph', 'learning_rate': 0.003676051148802947, 'n_estimators': 284, 'criterion': 'friedman_mse', 'min_samples_split': 6, 'min_samples_leaf': 3, 'min_weight_fraction_leaf': 0.090564124918038, 'min_impurity_decrease': 0.31747277808208846, 'max_features': 0.634725952199275, 'subsample': 0.3224147312529638, 'dropout_rate': 0.8748880017672743, 'ccp_alpha': 0.09485554065250729}. Best is trial 290 with value: 0.8297644701144975.[0m
[32m[I 2022-04-21 14:52:56,693][0m Trial 394 finished with value: 0.25 and parameters: {'loss': 'coxph', 'learning_rate': 0.004866716882252735, 'n_estimators': 318, 'criterion': 'friedman_mse', 'min_samples_split': 3, 'min_samples_leaf': 3, 'min_weight_fraction_leaf': 0.07764188673312032, 'min_impurity_decrease': 0.4373016364611406, 'max_features': 0.6441000499694174, 'subsample': 0.3384040091536195, 'dropout_rate': 0.8072616750614618, 'ccp_alpha': 0.35346409554985636}. Best is trial 290 with value: 0.8297644701144975.[0m
[32m[I 2022-04-21 14:53:16,467][0m Trial 395 finished with value: 0.3811755851689217 and parameters: {'loss': 'coxph', 'learning_rate': 0.00638914301921342, 'n_estimators': 344, 'criterion': 'friedman_mse', 'min_samples_split': 3, 'min_samples_leaf': 3, 'min_weight_fraction_leaf': 0.10722413835159494, 'min_impurity_decrease': 0.3816085350195687, 'max_features': 0.5884672500329748, 'subsample': 0.320441990261665, 'dropout_rate': 0.9068168684530931, 'ccp_alpha': 0.22156769941058788}. Best is trial 290 with value: 0.8297644701144975.[0m
[32m[I 2022-04-21 14:53:41,593][0m Trial 396 finished with value: 0.8227976000836177 and parameters: {'loss': 'coxph', 'learning_rate': 0.003301115791747586, 'n_estimators': 377, 'criterion': 'friedman_mse', 'min_samples_split': 4, 'min_samples_leaf': 3, 'min_weight_fraction_leaf': 0.06811587079392227, 'min_impurity_decrease': 0.4110296395840182, 'max_features': 0.6222280162210319, 'subsample': 0.40476410877169666, 'dropout_rate': 0.8477230549418957, 'ccp_alpha': 0.10178571064172548}. Best is trial 290 with value: 0.8297644701144975.[0m
[32m[I 2022-04-21 14:53:48,403][0m Trial 397 finished with value: 0.8281905766062575 and parameters: {'loss': 'coxph', 'learning_rate': 0.009719684708945754, 'n_estimators': 256, 'criterion': 'friedman_mse', 'min_samples_split': 3, 'min_samples_leaf': 3, 'min_weight_fraction_leaf': 0.09686966893845764, 'min_impurity_decrease': 0.4744718880716845, 'max_features': 0.5685839682578496, 'subsample': 0.35543245465746115, 'dropout_rate': 0.9281092033197079, 'ccp_alpha': 0.0016202023408212842}. Best is trial 290 with value: 0.8297644701144975.[0m
[32m[I 2022-04-21 14:54:16,449][0m Trial 398 finished with value: 0.38662577243280544 and parameters: {'loss': 'coxph', 'learning_rate': 0.010303585094854104, 'n_estimators': 537, 'criterion': 'friedman_mse', 'min_samples_split': 3, 'min_samples_leaf': 4, 'min_weight_fraction_leaf': 0.09675180615049048, 'min_impurity_decrease': 0.47504285281743314, 'max_features': 0.5756160437322095, 'subsample': 0.3638107453065905, 'dropout_rate': 0.9327146601201802, 'ccp_alpha': 0.1924612360995833}. Best is trial 290 with value: 0.8297644701144975.[0m
[32m[I 2022-04-21 14:54:23,576][0m Trial 399 finished with value: 0.8194897842825398 and parameters: {'loss': 'coxph', 'learning_rate': 0.01816709953668798, 'n_estimators': 249, 'criterion': 'friedman_mse', 'min_samples_split': 3, 'min_samples_leaf': 3, 'min_weight_fraction_leaf': 0.10978107660232755, 'min_impurity_decrease': 0.484820349752904, 'max_features': 0.5940041256764717, 'subsample': 0.38741508812892955, 'dropout_rate': 0.9292690861732064, 'ccp_alpha': 0.0991944018617571}. Best is trial 290 with value: 0.8297644701144975.[0m
[32m[I 2022-04-21 14:54:53,104][0m Trial 400 finished with value: 0.8304067572806094 and parameters: {'loss': 'coxph', 'learning_rate': 0.0085945364472806, 'n_estimators': 567, 'criterion': 'friedman_mse', 'min_samples_split': 2, 'min_samples_leaf': 3, 'min_weight_fraction_leaf': 0.08681330849861511, 'min_impurity_decrease': 0.46146740923502166, 'max_features': 0.6508402370181195, 'subsample': 0.29287570141476543, 'dropout_rate': 0.913808492160375, 'ccp_alpha': 0.0023975497318696583}. Best is trial 400 with value: 0.8304067572806094.[0m
[32m[I 2022-04-21 14:55:17,704][0m Trial 401 finished with value: 0.3811755851689217 and parameters: {'loss': 'coxph', 'learning_rate': 0.012779716042213583, 'n_estimators': 481, 'criterion': 'friedman_mse', 'min_samples_split': 2, 'min_samples_leaf': 3, 'min_weight_fraction_leaf': 0.08835389617970929, 'min_impurity_decrease': 0.4670977250688568, 'max_features': 0.5567456321404743, 'subsample': 0.30183427197929397, 'dropout_rate': 0.9431377992140577, 'ccp_alpha': 0.2392886003210059}. Best is trial 400 with value: 0.8304067572806094.[0m
[32m[I 2022-04-21 14:55:46,427][0m Trial 402 finished with value: 0.8253796307077588 and parameters: {'loss': 'coxph', 'learning_rate': 0.010405637531720762, 'n_estimators': 569, 'criterion': 'friedman_mse', 'min_samples_split': 2, 'min_samples_leaf': 3, 'min_weight_fraction_leaf': 0.09926419601054784, 'min_impurity_decrease': 0.4896450080243952, 'max_features': 0.6498743611209238, 'subsample': 0.45321316950780816, 'dropout_rate': 0.913079826911898, 'ccp_alpha': 0.0014929451307532588}. Best is trial 400 with value: 0.8304067572806094.[0m
[32m[I 2022-04-21 14:55:56,511][0m Trial 403 finished with value: 0.8231648046093343 and parameters: {'loss': 'coxph', 'learning_rate': 0.007773499733611877, 'n_estimators': 255, 'criterion': 'friedman_mse', 'min_samples_split': 4, 'min_samples_leaf': 5, 'min_weight_fraction_leaf': 0.08561518163173516, 'min_impurity_decrease': 0.46419939625069623, 'max_features': 0.5349198032795291, 'subsample': 0.320930278289976, 'dropout_rate': 0.9637878356750414, 'ccp_alpha': 0.11186550489136866}. Best is trial 400 with value: 0.8304067572806094.[0m
[32m[I 2022-04-21 14:56:14,037][0m Trial 404 finished with value: 0.8126373439089726 and parameters: {'loss': 'coxph', 'learning_rate': 0.010097299680707775, 'n_estimators': 424, 'criterion': 'friedman_mse', 'min_samples_split': 2, 'min_samples_leaf': 3, 'min_weight_fraction_leaf': 0.10960049324579721, 'min_impurity_decrease': 0.4504865743257334, 'max_features': 0.6559491144050386, 'subsample': 0.29319999837641547, 'dropout_rate': 0.9249048957663447, 'ccp_alpha': 0.18044183357591742}. Best is trial 400 with value: 0.8304067572806094.[0m
[32m[I 2022-04-21 14:56:45,582][0m Trial 405 finished with value: 0.25 and parameters: {'loss': 'coxph', 'learning_rate': 0.008592848856365999, 'n_estimators': 504, 'criterion': 'absolute_error', 'min_samples_split': 2, 'min_samples_leaf': 3, 'min_weight_fraction_leaf': 0.0996093793587911, 'min_impurity_decrease': 0.4882061851146768, 'max_features': 0.640988131390692, 'subsample': 0.37951904373733963, 'dropout_rate': 0.907367274793935, 'ccp_alpha': 0.30229804265975246}. Best is trial 400 with value: 0.8304067572806094.[0m
