[32m[I 2022-04-21 21:40:42,974][0m Trial 212 finished with value: 0.6877652719264824 and parameters: {'loss': 'coxph', 'learning_rate': 8.152254501353006e-05, 'n_estimators': 305, 'criterion': 'squared_error', 'min_samples_split': 7, 'min_samples_leaf': 10, 'min_weight_fraction_leaf': 0.20297176623376545, 'min_impurity_decrease': 0.03163425068003566, 'max_features': 0.9433823471003503, 'subsample': 0.2845053869197213, 'dropout_rate': 0.0033066717173340227, 'ccp_alpha': 0.12772685849596271}. Best is trial 187 with value: 0.6933481836305168.[0m
[32m[I 2022-04-21 21:41:05,852][0m Trial 213 finished with value: 0.6871588130588601 and parameters: {'loss': 'coxph', 'learning_rate': 9.803892160092884e-05, 'n_estimators': 302, 'criterion': 'squared_error', 'min_samples_split': 7, 'min_samples_leaf': 10, 'min_weight_fraction_leaf': 0.20656678131581302, 'min_impurity_decrease': 0.018998483068797103, 'max_features': 0.9155259304704334, 'subsample': 0.2896906984723294, 'dropout_rate': 0.004034300653788902, 'ccp_alpha': 0.11752016414713307}. Best is trial 187 with value: 0.6933481836305168.[0m
[32m[I 2022-04-21 21:41:33,197][0m Trial 214 finished with value: 0.5827751132342576 and parameters: {'loss': 'coxph', 'learning_rate': 9.349996834805119e-05, 'n_estimators': 281, 'criterion': 'squared_error', 'min_samples_split': 7, 'min_samples_leaf': 10, 'min_weight_fraction_leaf': 0.21755945709694158, 'min_impurity_decrease': 0.03925704421738781, 'max_features': 0.9529088195246742, 'subsample': 0.7948560251985711, 'dropout_rate': 0.05553755343502103, 'ccp_alpha': 0.24259226431929076}. Best is trial 187 with value: 0.6933481836305168.[0m
[32m[I 2022-04-21 21:41:54,227][0m Trial 215 finished with value: 0.6855502895225021 and parameters: {'loss': 'coxph', 'learning_rate': 8.615333154322843e-05, 'n_estimators': 289, 'criterion': 'squared_error', 'min_samples_split': 7, 'min_samples_leaf': 10, 'min_weight_fraction_leaf': 0.1993502064376506, 'min_impurity_decrease': 0.006806998049547607, 'max_features': 0.9635859768243065, 'subsample': 0.2797346475894673, 'dropout_rate': 0.026957362238734326, 'ccp_alpha': 0.14274625051120782}. Best is trial 187 with value: 0.6933481836305168.[0m
[32m[I 2022-04-21 21:42:14,784][0m Trial 216 finished with value: 0.6879327491956069 and parameters: {'loss': 'coxph', 'learning_rate': 0.00013077723200920725, 'n_estimators': 309, 'criterion': 'squared_error', 'min_samples_split': 7, 'min_samples_leaf': 10, 'min_weight_fraction_leaf': 0.2154427020160628, 'min_impurity_decrease': 0.030220651304235683, 'max_features': 0.9442076111566521, 'subsample': 0.3055860347177447, 'dropout_rate': 0.06636343993443326, 'ccp_alpha': 0.09542623052003305}. Best is trial 187 with value: 0.6933481836305168.[0m
[32m[I 2022-04-21 21:42:44,380][0m Trial 217 finished with value: 0.6642215625535354 and parameters: {'loss': 'coxph', 'learning_rate': 5.083466007757782e-05, 'n_estimators': 298, 'criterion': 'squared_error', 'min_samples_split': 7, 'min_samples_leaf': 10, 'min_weight_fraction_leaf': 0.22314538330239247, 'min_impurity_decrease': 0.02762443020792535, 'max_features': 0.9308770797492495, 'subsample': 0.31641829060115356, 'dropout_rate': 0.023916435350942483, 'ccp_alpha': 0.2875591491473729}. Best is trial 187 with value: 0.6933481836305168.[0m
[32m[I 2022-04-21 21:43:05,419][0m Trial 218 finished with value: 0.6190439925035849 and parameters: {'loss': 'coxph', 'learning_rate': 8.250704066722558e-05, 'n_estimators': 311, 'criterion': 'squared_error', 'min_samples_split': 7, 'min_samples_leaf': 10, 'min_weight_fraction_leaf': 0.20969883297444017, 'min_impurity_decrease': 0.02543664501812823, 'max_features': 0.9731588828577661, 'subsample': 0.3005380238202929, 'dropout_rate': 0.0628845126354158, 'ccp_alpha': 0.4007769580926752}. Best is trial 187 with value: 0.6933481836305168.[0m
[32m[I 2022-04-21 21:43:29,634][0m Trial 219 finished with value: 0.6891086729194187 and parameters: {'loss': 'coxph', 'learning_rate': 7.032025521706903e-05, 'n_estimators': 308, 'criterion': 'squared_error', 'min_samples_split': 7, 'min_samples_leaf': 10, 'min_weight_fraction_leaf': 0.21771623646312108, 'min_impurity_decrease': 0.003911604612110615, 'max_features': 0.9366060203240499, 'subsample': 0.3068395813031963, 'dropout_rate': 0.06790072702789822, 'ccp_alpha': 0.11230751009093062}. Best is trial 187 with value: 0.6933481836305168.[0m
/media/san2_ssd/data/Workdir/survival/venv/lib/python3.8/site-packages/sksurv/ensemble/boosting.py:955: RuntimeWarning: divide by zero encountered in log
  time = numpy.log(time)
/media/san2_ssd/data/Workdir/survival/venv/lib/python3.8/site-packages/sksurv/ensemble/boosting.py:955: RuntimeWarning: divide by zero encountered in log
  time = numpy.log(time)
/media/san2_ssd/data/Workdir/survival/venv/lib/python3.8/site-packages/sksurv/ensemble/boosting.py:955: RuntimeWarning: divide by zero encountered in log
  time = numpy.log(time)
/media/san2_ssd/data/Workdir/survival/venv/lib/python3.8/site-packages/sksurv/ensemble/boosting.py:955: RuntimeWarning: divide by zero encountered in log
  time = numpy.log(time)
[32m[I 2022-04-21 21:43:36,646][0m Trial 220 finished with value: -0.7260203013923309 and parameters: {'loss': 'squared', 'learning_rate': 7.0770092235279e-05, 'n_estimators': 310, 'criterion': 'squared_error', 'min_samples_split': 7, 'min_samples_leaf': 10, 'min_weight_fraction_leaf': 0.4410862042883332, 'min_impurity_decrease': 0.014276711439736186, 'max_features': 0.9371638003707038, 'subsample': 0.32304361866797293, 'dropout_rate': 0.08385969070789379, 'ccp_alpha': 0.2121401000130826}. Best is trial 187 with value: 0.6933481836305168.[0m
[32m[I 2022-04-21 21:43:56,897][0m Trial 221 finished with value: 0.6874044589944152 and parameters: {'loss': 'coxph', 'learning_rate': 6.59355281126194e-05, 'n_estimators': 294, 'criterion': 'squared_error', 'min_samples_split': 7, 'min_samples_leaf': 10, 'min_weight_fraction_leaf': 0.21591405589853277, 'min_impurity_decrease': 0.001915474675804182, 'max_features': 0.8981023223811953, 'subsample': 0.30326770943981185, 'dropout_rate': 0.07218133871268048, 'ccp_alpha': 0.11025868495523725}. Best is trial 187 with value: 0.6933481836305168.[0m
[32m[I 2022-04-21 21:44:14,557][0m Trial 222 finished with value: 0.6874044589944152 and parameters: {'loss': 'coxph', 'learning_rate': 6.357308496550337e-05, 'n_estimators': 290, 'criterion': 'squared_error', 'min_samples_split': 7, 'min_samples_leaf': 10, 'min_weight_fraction_leaf': 0.21955155160145193, 'min_impurity_decrease': 0.0023437243163958975, 'max_features': 0.9447539085635595, 'subsample': 0.30264601963838705, 'dropout_rate': 0.06899098598280046, 'ccp_alpha': 0.09514886828864653}. Best is trial 187 with value: 0.6933481836305168.[0m
[32m[I 2022-04-21 21:44:30,145][0m Trial 223 finished with value: 0.6877637229710098 and parameters: {'loss': 'coxph', 'learning_rate': 4.365888194551402e-05, 'n_estimators': 286, 'criterion': 'squared_error', 'min_samples_split': 7, 'min_samples_leaf': 10, 'min_weight_fraction_leaf': 0.21767348030416717, 'min_impurity_decrease': 0.013156094810533833, 'max_features': 0.8986667592909446, 'subsample': 0.30951155251568113, 'dropout_rate': 0.07140877958508067, 'ccp_alpha': 0.10127771907029694}. Best is trial 187 with value: 0.6933481836305168.[0m
[32m[I 2022-04-21 21:44:49,771][0m Trial 224 finished with value: 0.6740408722368899 and parameters: {'loss': 'coxph', 'learning_rate': 3.615384500240433e-05, 'n_estimators': 277, 'criterion': 'squared_error', 'min_samples_split': 7, 'min_samples_leaf': 10, 'min_weight_fraction_leaf': 0.21218362404407215, 'min_impurity_decrease': 0.001551440553010302, 'max_features': 0.8959547182876164, 'subsample': 0.3243271035323023, 'dropout_rate': 0.09823107564827797, 'ccp_alpha': 0.18508937726948926}. Best is trial 187 with value: 0.6933481836305168.[0m
[32m[I 2022-04-21 21:45:11,141][0m Trial 225 finished with value: 0.6879327491956069 and parameters: {'loss': 'coxph', 'learning_rate': 4.6287077671372114e-05, 'n_estimators': 293, 'criterion': 'squared_error', 'min_samples_split': 7, 'min_samples_leaf': 10, 'min_weight_fraction_leaf': 0.20434690572016037, 'min_impurity_decrease': 0.03231967422036373, 'max_features': 0.905323240473489, 'subsample': 0.306111098112565, 'dropout_rate': 0.03760197651223035, 'ccp_alpha': 0.11103816569830832}. Best is trial 187 with value: 0.6933481836305168.[0m
[32m[I 2022-04-21 21:45:35,705][0m Trial 226 finished with value: 0.658544368467207 and parameters: {'loss': 'coxph', 'learning_rate': 4.039860782917852e-05, 'n_estimators': 308, 'criterion': 'squared_error', 'min_samples_split': 7, 'min_samples_leaf': 10, 'min_weight_fraction_leaf': 0.22571117902899143, 'min_impurity_decrease': 0.03293235029014768, 'max_features': 0.9101308780047085, 'subsample': 0.32696183843379845, 'dropout_rate': 0.03284823422706147, 'ccp_alpha': 0.3126684995935935}. Best is trial 187 with value: 0.6933481836305168.[0m
[32m[I 2022-04-21 21:45:52,591][0m Trial 227 finished with value: 0.6877731842980875 and parameters: {'loss': 'coxph', 'learning_rate': 4.830072940834467e-05, 'n_estimators': 276, 'criterion': 'squared_error', 'min_samples_split': 7, 'min_samples_leaf': 10, 'min_weight_fraction_leaf': 0.20290538977067116, 'min_impurity_decrease': 0.030058981668132694, 'max_features': 0.9207414439932013, 'subsample': 0.2944409531067186, 'dropout_rate': 0.04346726997934447, 'ccp_alpha': 0.0943779569175535}. Best is trial 187 with value: 0.6933481836305168.[0m
[32m[I 2022-04-21 21:46:11,157][0m Trial 228 finished with value: 0.6465485714725936 and parameters: {'loss': 'coxph', 'learning_rate': 2.586919853104369e-05, 'n_estimators': 275, 'criterion': 'absolute_error', 'min_samples_split': 7, 'min_samples_leaf': 10, 'min_weight_fraction_leaf': 0.20451211524452176, 'min_impurity_decrease': 0.03752628518023572, 'max_features': 0.8729985294981748, 'subsample': 0.2934332597748841, 'dropout_rate': 0.04831640651653725, 'ccp_alpha': 0.21126172210561134}. Best is trial 187 with value: 0.6933481836305168.[0m
[32m[I 2022-04-21 21:46:32,568][0m Trial 229 finished with value: 0.6851609220967668 and parameters: {'loss': 'coxph', 'learning_rate': 2.4345439597747037e-05, 'n_estimators': 280, 'criterion': 'squared_error', 'min_samples_split': 7, 'min_samples_leaf': 10, 'min_weight_fraction_leaf': 0.20203029878614553, 'min_impurity_decrease': 0.028211120951108257, 'max_features': 0.978426983662211, 'subsample': 0.2734466491926464, 'dropout_rate': 0.012745221505630948, 'ccp_alpha': 0.09758939563441628}. Best is trial 187 with value: 0.6933481836305168.[0m
[32m[I 2022-04-21 21:46:55,537][0m Trial 230 finished with value: 0.6556203951897036 and parameters: {'loss': 'coxph', 'learning_rate': 3.522340721280015e-05, 'n_estimators': 292, 'criterion': 'squared_error', 'min_samples_split': 7, 'min_samples_leaf': 10, 'min_weight_fraction_leaf': 0.19769028770444433, 'min_impurity_decrease': 0.05565179277861604, 'max_features': 0.9261954918379609, 'subsample': 0.3015439851591792, 'dropout_rate': 0.035070718218878055, 'ccp_alpha': 0.32360863337818424}. Best is trial 187 with value: 0.6933481836305168.[0m
[32m[I 2022-04-21 21:47:21,463][0m Trial 231 finished with value: 0.6883660049650483 and parameters: {'loss': 'coxph', 'learning_rate': 4.582408086026796e-05, 'n_estimators': 306, 'criterion': 'squared_error', 'min_samples_split': 7, 'min_samples_leaf': 10, 'min_weight_fraction_leaf': 0.2114411781334897, 'min_impurity_decrease': 0.021784531335606094, 'max_features': 0.9512467299175107, 'subsample': 0.3171144326495181, 'dropout_rate': 0.09063195179020184, 'ccp_alpha': 0.09319562185546228}. Best is trial 187 with value: 0.6933481836305168.[0m
[32m[I 2022-04-21 21:47:41,559][0m Trial 232 finished with value: 0.6880314477270424 and parameters: {'loss': 'coxph', 'learning_rate': 5.178911480330601e-05, 'n_estimators': 307, 'criterion': 'squared_error', 'min_samples_split': 7, 'min_samples_leaf': 10, 'min_weight_fraction_leaf': 0.2118296539074251, 'min_impurity_decrease': 0.019473416369755914, 'max_features': 0.9475382925312239, 'subsample': 0.3270320472550495, 'dropout_rate': 0.08091748257675933, 'ccp_alpha': 0.09468475139284421}. Best is trial 187 with value: 0.6933481836305168.[0m
[32m[I 2022-04-21 21:47:58,912][0m Trial 233 finished with value: 0.6663271575205115 and parameters: {'loss': 'coxph', 'learning_rate': 4.7534798346133386e-05, 'n_estimators': 301, 'criterion': 'squared_error', 'min_samples_split': 7, 'min_samples_leaf': 10, 'min_weight_fraction_leaf': 0.2266684516506186, 'min_impurity_decrease': 0.020048477565378246, 'max_features': 0.9536077113661179, 'subsample': 0.2842150073000789, 'dropout_rate': 0.09306166500033575, 'ccp_alpha': 0.1883501715582085}. Best is trial 187 with value: 0.6933481836305168.[0m
[32m[I 2022-04-21 21:48:24,403][0m Trial 234 finished with value: 0.6880314477270424 and parameters: {'loss': 'coxph', 'learning_rate': 4.886831341065174e-05, 'n_estimators': 315, 'criterion': 'squared_error', 'min_samples_split': 7, 'min_samples_leaf': 10, 'min_weight_fraction_leaf': 0.21187416523116573, 'min_impurity_decrease': 0.02360000581847633, 'max_features': 0.9162981279380943, 'subsample': 0.33217473798119446, 'dropout_rate': 0.06348042911656172, 'ccp_alpha': 0.10356168788021981}. Best is trial 187 with value: 0.6933481836305168.[0m
[32m[I 2022-04-21 21:48:51,124][0m Trial 235 finished with value: 0.6788526468806182 and parameters: {'loss': 'coxph', 'learning_rate': 5.16957902197962e-05, 'n_estimators': 313, 'criterion': 'squared_error', 'min_samples_split': 7, 'min_samples_leaf': 10, 'min_weight_fraction_leaf': 0.20903637430390215, 'min_impurity_decrease': 0.03920624433481799, 'max_features': 0.9164210374890586, 'subsample': 0.328958062693276, 'dropout_rate': 0.0037386540497748033, 'ccp_alpha': 0.19170035967050125}. Best is trial 187 with value: 0.6933481836305168.[0m
[32m[I 2022-04-21 21:49:21,691][0m Trial 236 finished with value: 0.688447658045636 and parameters: {'loss': 'coxph', 'learning_rate': 5.7673243505867395e-05, 'n_estimators': 345, 'criterion': 'squared_error', 'min_samples_split': 7, 'min_samples_leaf': 10, 'min_weight_fraction_leaf': 0.2119503037766745, 'min_impurity_decrease': 0.049353637721709115, 'max_features': 0.9485057636805729, 'subsample': 0.274447229643644, 'dropout_rate': 0.05006230600335654, 'ccp_alpha': 0.10897634383317223}. Best is trial 187 with value: 0.6933481836305168.[0m
[32m[I 2022-04-21 21:49:57,183][0m Trial 237 finished with value: 0.5934149392682608 and parameters: {'loss': 'coxph', 'learning_rate': 5.547797519803294e-05, 'n_estimators': 356, 'criterion': 'squared_error', 'min_samples_split': 7, 'min_samples_leaf': 10, 'min_weight_fraction_leaf': 0.22899132527440652, 'min_impurity_decrease': 0.4109701870155389, 'max_features': 0.9710291309929531, 'subsample': 0.33262848792631877, 'dropout_rate': 0.11129352464141572, 'ccp_alpha': 0.2704897803216936}. Best is trial 187 with value: 0.6933481836305168.[0m
[32m[I 2022-04-21 21:50:29,785][0m Trial 238 finished with value: 0.6856176004385199 and parameters: {'loss': 'coxph', 'learning_rate': 2.887929479330275e-05, 'n_estimators': 343, 'criterion': 'squared_error', 'min_samples_split': 7, 'min_samples_leaf': 10, 'min_weight_fraction_leaf': 0.2165124756998215, 'min_impurity_decrease': 0.055718917921688954, 'max_features': 0.9209697552891333, 'subsample': 0.26437198019840813, 'dropout_rate': 0.05129521577509093, 'ccp_alpha': 0.11126393772330974}. Best is trial 187 with value: 0.6933481836305168.[0m
[32m[I 2022-04-21 21:50:59,961][0m Trial 239 finished with value: 0.6874044589944152 and parameters: {'loss': 'coxph', 'learning_rate': 6.170161634400728e-05, 'n_estimators': 317, 'criterion': 'squared_error', 'min_samples_split': 7, 'min_samples_leaf': 10, 'min_weight_fraction_leaf': 0.19383926442478305, 'min_impurity_decrease': 0.050573805772603286, 'max_features': 0.9323457115698484, 'subsample': 0.30124275361185715, 'dropout_rate': 0.08459557117407289, 'ccp_alpha': 0.08484329025018772}. Best is trial 187 with value: 0.6933481836305168.[0m
[32m[I 2022-04-21 21:51:27,372][0m Trial 240 finished with value: 0.6682973162934912 and parameters: {'loss': 'coxph', 'learning_rate': 4.107694464462471e-05, 'n_estimators': 363, 'criterion': 'squared_error', 'min_samples_split': 7, 'min_samples_leaf': 10, 'min_weight_fraction_leaf': 0.21058597033222828, 'min_impurity_decrease': 0.022564915709703235, 'max_features': 0.9565467975563028, 'subsample': 0.2787498811128393, 'dropout_rate': 0.06717966218434492, 'ccp_alpha': 0.24696402221586208}. Best is trial 187 with value: 0.6933481836305168.[0m
[32m[I 2022-04-21 21:51:54,509][0m Trial 241 finished with value: 0.6868902697681121 and parameters: {'loss': 'coxph', 'learning_rate': 7.846340991825803e-05, 'n_estimators': 301, 'criterion': 'squared_error', 'min_samples_split': 7, 'min_samples_leaf': 10, 'min_weight_fraction_leaf': 0.2048897901265456, 'min_impurity_decrease': 0.034306559063491684, 'max_features': 0.9411446983969725, 'subsample': 0.2947505937620144, 'dropout_rate': 0.037645994442170275, 'ccp_alpha': 0.11147888153170335}. Best is trial 187 with value: 0.6933481836305168.[0m
[32m[I 2022-04-21 21:52:22,014][0m Trial 242 finished with value: 0.6880740833313549 and parameters: {'loss': 'coxph', 'learning_rate': 2.0441136312611727e-05, 'n_estimators': 317, 'criterion': 'squared_error', 'min_samples_split': 7, 'min_samples_leaf': 10, 'min_weight_fraction_leaf': 0.18928233663835708, 'min_impurity_decrease': 0.0012836799886179057, 'max_features': 0.9846548693877158, 'subsample': 0.2791588462673435, 'dropout_rate': 0.05621861622767895, 'ccp_alpha': 0.1961439559439942}. Best is trial 187 with value: 0.6933481836305168.[0m
[32m[I 2022-04-21 21:52:56,866][0m Trial 243 finished with value: 0.6797882852237278 and parameters: {'loss': 'coxph', 'learning_rate': 1.0258159376453697e-05, 'n_estimators': 341, 'criterion': 'squared_error', 'min_samples_split': 7, 'min_samples_leaf': 10, 'min_weight_fraction_leaf': 0.1888754847691024, 'min_impurity_decrease': 0.01660557786380308, 'max_features': 0.9950908725847494, 'subsample': 0.2712525058705342, 'dropout_rate': 0.09044159787342979, 'ccp_alpha': 0.19598205112399097}. Best is trial 187 with value: 0.6933481836305168.[0m
[32m[I 2022-04-21 21:53:22,046][0m Trial 244 finished with value: 0.6872894986048378 and parameters: {'loss': 'coxph', 'learning_rate': 1.8004396931838552e-05, 'n_estimators': 318, 'criterion': 'squared_error', 'min_samples_split': 7, 'min_samples_leaf': 10, 'min_weight_fraction_leaf': 0.2222148446709678, 'min_impurity_decrease': 0.050374501957819395, 'max_features': 0.9839267720921814, 'subsample': 0.31339537826559816, 'dropout_rate': 0.05745347729178738, 'ccp_alpha': 0.07155380900909368}. Best is trial 187 with value: 0.6933481836305168.[0m
[32m[I 2022-04-21 21:53:48,230][0m Trial 245 finished with value: 0.6701312187111274 and parameters: {'loss': 'coxph', 'learning_rate': 1.8770712269528187e-05, 'n_estimators': 271, 'criterion': 'squared_error', 'min_samples_split': 7, 'min_samples_leaf': 10, 'min_weight_fraction_leaf': 0.1907935493106511, 'min_impurity_decrease': 0.013347695280796917, 'max_features': 0.877679218733357, 'subsample': 0.33711002910964266, 'dropout_rate': 0.11108393934550337, 'ccp_alpha': 0.1926379833209933}. Best is trial 187 with value: 0.6933481836305168.[0m
[32m[I 2022-04-21 21:54:15,589][0m Trial 246 finished with value: 0.6912703324261896 and parameters: {'loss': 'coxph', 'learning_rate': 5.021494519050606e-05, 'n_estimators': 318, 'criterion': 'squared_error', 'min_samples_split': 7, 'min_samples_leaf': 10, 'min_weight_fraction_leaf': 0.21222462094932676, 'min_impurity_decrease': 0.05768764519559114, 'max_features': 0.9642819470336178, 'subsample': 0.2956782863348836, 'dropout_rate': 0.054042662545308415, 'ccp_alpha': 0.0794200527008207}. Best is trial 187 with value: 0.6933481836305168.[0m
[32m[I 2022-04-21 21:54:38,796][0m Trial 247 finished with value: 0.6677658486201136 and parameters: {'loss': 'coxph', 'learning_rate': 0.00011095963527415893, 'n_estimators': 338, 'criterion': 'squared_error', 'min_samples_split': 7, 'min_samples_leaf': 10, 'min_weight_fraction_leaf': 0.21363331286025716, 'min_impurity_decrease': 0.06741133337603569, 'max_features': 0.9626277802000315, 'subsample': 0.27039123824624933, 'dropout_rate': 0.07735763665377234, 'ccp_alpha': 0.3171815592698645}. Best is trial 187 with value: 0.6933481836305168.[0m
[32m[I 2022-04-21 21:55:10,939][0m Trial 248 finished with value: 0.686350284667502 and parameters: {'loss': 'coxph', 'learning_rate': 4.797459878028239e-05, 'n_estimators': 319, 'criterion': 'squared_error', 'min_samples_split': 7, 'min_samples_leaf': 1, 'min_weight_fraction_leaf': 0.2027979832944543, 'min_impurity_decrease': 0.0011647312483820706, 'max_features': 0.9602759429854439, 'subsample': 0.313660476233951, 'dropout_rate': 0.05778362055841822, 'ccp_alpha': 0.06376869255417976}. Best is trial 187 with value: 0.6933481836305168.[0m
[32m[I 2022-04-21 21:55:40,805][0m Trial 249 finished with value: 0.679969563339172 and parameters: {'loss': 'coxph', 'learning_rate': 3.5622957876229126e-05, 'n_estimators': 376, 'criterion': 'squared_error', 'min_samples_split': 7, 'min_samples_leaf': 10, 'min_weight_fraction_leaf': 0.2287227051445602, 'min_impurity_decrease': 0.036692317465190416, 'max_features': 0.9120069212169415, 'subsample': 0.23846229550874876, 'dropout_rate': 0.09374974432214597, 'ccp_alpha': 0.1910770552096948}. Best is trial 187 with value: 0.6933481836305168.[0m
