[32m[I 2022-04-21 19:40:45,183][0m Trial 749 finished with value: 0.8354787801983354 and parameters: {'alpha': 3.6545173927119774, 'ties': 'breslow'}. Best is trial 70 with value: 0.835911286090736.[0m
[32m[I 2022-04-21 19:41:16,182][0m Trial 750 finished with value: 0.8354683222292627 and parameters: {'alpha': 3.4831564905605763, 'ties': 'breslow'}. Best is trial 70 with value: 0.835911286090736.[0m
[32m[I 2022-04-21 19:41:47,931][0m Trial 751 finished with value: 0.8358321902886627 and parameters: {'alpha': 3.7865717660227323, 'ties': 'breslow'}. Best is trial 70 with value: 0.835911286090736.[0m
[32m[I 2022-04-21 19:42:20,466][0m Trial 752 finished with value: 0.8352095089409325 and parameters: {'alpha': 4.008340274691872, 'ties': 'breslow'}. Best is trial 70 with value: 0.835911286090736.[0m
[32m[I 2022-04-21 19:42:52,198][0m Trial 753 finished with value: 0.8356689341023882 and parameters: {'alpha': 3.8794555497139416, 'ties': 'breslow'}. Best is trial 70 with value: 0.835911286090736.[0m
[32m[I 2022-04-21 19:43:23,084][0m Trial 754 finished with value: 0.8357190747858569 and parameters: {'alpha': 3.719701175763509, 'ties': 'breslow'}. Best is trial 70 with value: 0.835911286090736.[0m
[32m[I 2022-04-21 19:43:55,275][0m Trial 755 finished with value: 0.835519622180555 and parameters: {'alpha': 3.608059884840274, 'ties': 'breslow'}. Best is trial 70 with value: 0.835911286090736.[0m
[32m[I 2022-04-21 19:44:25,374][0m Trial 756 finished with value: 0.8356715428291757 and parameters: {'alpha': 3.820686403002773, 'ties': 'breslow'}. Best is trial 70 with value: 0.835911286090736.[0m
[32m[I 2022-04-21 19:44:54,590][0m Trial 757 finished with value: 0.8354826511319169 and parameters: {'alpha': 3.947609790118526, 'ties': 'breslow'}. Best is trial 70 with value: 0.835911286090736.[0m
[32m[I 2022-04-21 19:45:24,892][0m Trial 758 finished with value: 0.8357190747858569 and parameters: {'alpha': 3.7337229037892916, 'ties': 'breslow'}. Best is trial 70 with value: 0.835911286090736.[0m
[32m[I 2022-04-21 19:45:56,599][0m Trial 759 finished with value: 0.8355966595468315 and parameters: {'alpha': 3.544245076004888, 'ties': 'breslow'}. Best is trial 70 with value: 0.835911286090736.[0m
[32m[I 2022-04-21 19:46:26,473][0m Trial 760 finished with value: 0.8354787801983354 and parameters: {'alpha': 3.6414918476323646, 'ties': 'breslow'}. Best is trial 70 with value: 0.835911286090736.[0m
[32m[I 2022-04-21 19:46:55,857][0m Trial 761 finished with value: 0.8352421608596676 and parameters: {'alpha': 4.1910579610804595, 'ties': 'breslow'}. Best is trial 70 with value: 0.835911286090736.[0m
[32m[I 2022-04-21 19:47:28,054][0m Trial 762 finished with value: 0.8357069984861909 and parameters: {'alpha': 3.8743144281449937, 'ties': 'breslow'}. Best is trial 70 with value: 0.835911286090736.[0m
[32m[I 2022-04-21 19:47:58,787][0m Trial 763 finished with value: 0.835631502225942 and parameters: {'alpha': 3.7890552971689964, 'ties': 'efron'}. Best is trial 70 with value: 0.835911286090736.[0m
[32m[I 2022-04-21 19:48:31,160][0m Trial 764 finished with value: 0.8352767442638476 and parameters: {'alpha': 3.348885937939955, 'ties': 'breslow'}. Best is trial 70 with value: 0.835911286090736.[0m
[32m[I 2022-04-21 19:49:04,448][0m Trial 765 finished with value: 0.8351886199711365 and parameters: {'alpha': 3.084349151666055, 'ties': 'breslow'}. Best is trial 70 with value: 0.835911286090736.[0m
[32m[I 2022-04-21 19:49:36,918][0m Trial 766 finished with value: 0.8352095089409325 and parameters: {'alpha': 4.0056725199335395, 'ties': 'breslow'}. Best is trial 70 with value: 0.835911286090736.[0m
[32m[I 2022-04-21 19:50:09,838][0m Trial 767 finished with value: 0.8356379421473796 and parameters: {'alpha': 3.7010985995053955, 'ties': 'breslow'}. Best is trial 70 with value: 0.835911286090736.[0m
[32m[I 2022-04-21 19:50:40,545][0m Trial 768 finished with value: 0.8357052929158193 and parameters: {'alpha': 3.8584623473226958, 'ties': 'breslow'}. Best is trial 70 with value: 0.835911286090736.[0m
[32m[I 2022-04-21 19:51:11,891][0m Trial 769 finished with value: 0.835519290914522 and parameters: {'alpha': 3.6206236435353554, 'ties': 'breslow'}. Best is trial 70 with value: 0.835911286090736.[0m
[32m[I 2022-04-21 19:51:43,027][0m Trial 770 finished with value: 0.8357914144599559 and parameters: {'alpha': 3.7908775135454063, 'ties': 'breslow'}. Best is trial 70 with value: 0.835911286090736.[0m
[32m[I 2022-04-21 19:52:18,843][0m Trial 771 finished with value: 0.8336194882585689 and parameters: {'alpha': 1.8443660162270927, 'ties': 'breslow'}. Best is trial 70 with value: 0.835911286090736.[0m
[32m[I 2022-04-21 19:52:50,699][0m Trial 772 finished with value: 0.8354439998925184 and parameters: {'alpha': 3.949278245978055, 'ties': 'breslow'}. Best is trial 70 with value: 0.835911286090736.[0m
[32m[I 2022-04-21 19:53:23,055][0m Trial 773 finished with value: 0.8354264219312361 and parameters: {'alpha': 3.500750109730005, 'ties': 'breslow'}. Best is trial 70 with value: 0.835911286090736.[0m
[32m[I 2022-04-21 19:53:56,564][0m Trial 774 finished with value: 0.8357190747858569 and parameters: {'alpha': 3.7265633010372747, 'ties': 'breslow'}. Best is trial 70 with value: 0.835911286090736.[0m
[32m[I 2022-04-21 19:54:29,360][0m Trial 775 finished with value: 0.8356281582736811 and parameters: {'alpha': 3.8930241547736584, 'ties': 'breslow'}. Best is trial 70 with value: 0.835911286090736.[0m
[32m[I 2022-04-21 19:55:01,635][0m Trial 776 finished with value: 0.8353628700474047 and parameters: {'alpha': 4.073293279323323, 'ties': 'breslow'}. Best is trial 70 with value: 0.835911286090736.[0m
[32m[I 2022-04-21 19:55:32,565][0m Trial 777 finished with value: 0.8355175853441505 and parameters: {'alpha': 3.668629974578641, 'ties': 'breslow'}. Best is trial 70 with value: 0.835911286090736.[0m
[32m[I 2022-04-21 19:56:04,140][0m Trial 778 finished with value: 0.8357123186578829 and parameters: {'alpha': 3.8103366722429297, 'ties': 'breslow'}. Best is trial 70 with value: 0.835911286090736.[0m
[32m[I 2022-04-21 19:56:36,793][0m Trial 779 finished with value: 0.835519622180555 and parameters: {'alpha': 3.6017222243539084, 'ties': 'breslow'}. Best is trial 70 with value: 0.835911286090736.[0m
[32m[I 2022-04-21 19:57:08,368][0m Trial 780 finished with value: 0.8356802696400418 and parameters: {'alpha': 3.7388553375197953, 'ties': 'breslow'}. Best is trial 70 with value: 0.835911286090736.[0m
[32m[I 2022-04-21 19:57:40,500][0m Trial 781 finished with value: 0.8354439998925184 and parameters: {'alpha': 3.9490978655741085, 'ties': 'breslow'}. Best is trial 70 with value: 0.835911286090736.[0m
[32m[I 2022-04-21 19:58:13,447][0m Trial 782 finished with value: 0.8356661565039716 and parameters: {'alpha': 3.847168326479374, 'ties': 'breslow'}. Best is trial 70 with value: 0.835911286090736.[0m
[32m[I 2022-04-21 19:58:45,128][0m Trial 783 finished with value: 0.8355987841361399 and parameters: {'alpha': 3.541240311199248, 'ties': 'efron'}. Best is trial 70 with value: 0.835911286090736.[0m
[32m[I 2022-04-21 19:59:17,975][0m Trial 784 finished with value: 0.8357190747858569 and parameters: {'alpha': 3.7189777206168975, 'ties': 'breslow'}. Best is trial 70 with value: 0.835911286090736.[0m
[32m[I 2022-04-21 19:59:50,038][0m Trial 785 finished with value: 0.8357506386312487 and parameters: {'alpha': 3.7998565741015122, 'ties': 'breslow'}. Best is trial 70 with value: 0.835911286090736.[0m
[32m[I 2022-04-21 20:00:22,799][0m Trial 786 finished with value: 0.8354787801983354 and parameters: {'alpha': 3.6352245178946188, 'ties': 'breslow'}. Best is trial 70 with value: 0.835911286090736.[0m
[32m[I 2022-04-21 20:00:56,376][0m Trial 787 finished with value: 0.8352095089409325 and parameters: {'alpha': 4.014377856757237, 'ties': 'breslow'}. Best is trial 70 with value: 0.835911286090736.[0m
[32m[I 2022-04-21 20:01:29,473][0m Trial 788 finished with value: 0.8356281582736811 and parameters: {'alpha': 3.904848035890634, 'ties': 'breslow'}. Best is trial 70 with value: 0.835911286090736.[0m
[32m[I 2022-04-21 20:02:01,739][0m Trial 789 finished with value: 0.8356396477177512 and parameters: {'alpha': 3.715725164981864, 'ties': 'breslow'}. Best is trial 70 with value: 0.835911286090736.[0m
[32m[I 2022-04-21 20:02:34,347][0m Trial 790 finished with value: 0.8355446970634739 and parameters: {'alpha': 3.4308179218274635, 'ties': 'breslow'}. Best is trial 70 with value: 0.835911286090736.[0m
[32m[I 2022-04-21 20:03:04,965][0m Trial 791 finished with value: 0.8356715428291757 and parameters: {'alpha': 3.820195110755881, 'ties': 'breslow'}. Best is trial 70 with value: 0.835911286090736.[0m
[32m[I 2022-04-21 20:03:38,313][0m Trial 792 finished with value: 0.835519622180555 and parameters: {'alpha': 3.6074437642638983, 'ties': 'breslow'}. Best is trial 70 with value: 0.835911286090736.[0m
[32m[I 2022-04-21 20:04:11,792][0m Trial 793 finished with value: 0.8352036419513628 and parameters: {'alpha': 4.102427982760724, 'ties': 'breslow'}. Best is trial 70 with value: 0.835911286090736.[0m
[32m[I 2022-04-21 20:04:45,309][0m Trial 794 finished with value: 0.8355898383003153 and parameters: {'alpha': 3.9231689178319584, 'ties': 'breslow'}. Best is trial 70 with value: 0.835911286090736.[0m
[32m[I 2022-04-21 20:05:15,713][0m Trial 795 finished with value: 0.8356394938113348 and parameters: {'alpha': 3.7458639520472987, 'ties': 'breslow'}. Best is trial 70 with value: 0.835911286090736.[0m
[32m[I 2022-04-21 20:05:48,534][0m Trial 796 finished with value: 0.8354787801983354 and parameters: {'alpha': 3.652689005981154, 'ties': 'breslow'}. Best is trial 70 with value: 0.835911286090736.[0m
[32m[I 2022-04-21 20:06:21,995][0m Trial 797 finished with value: 0.8357103479749908 and parameters: {'alpha': 3.824168936737181, 'ties': 'breslow'}. Best is trial 70 with value: 0.835911286090736.[0m
[32m[I 2022-04-21 20:06:55,238][0m Trial 798 finished with value: 0.835558008307433 and parameters: {'alpha': 3.5348179971690543, 'ties': 'breslow'}. Best is trial 70 with value: 0.835911286090736.[0m
[32m[I 2022-04-21 20:07:28,291][0m Trial 799 finished with value: 0.835326876870416 and parameters: {'alpha': 3.980665225548207, 'ties': 'breslow'}. Best is trial 70 with value: 0.835911286090736.[0m
[32m[I 2022-04-21 20:08:00,029][0m Trial 800 finished with value: 0.8356785640696703 and parameters: {'alpha': 3.7480555825995596, 'ties': 'breslow'}. Best is trial 70 with value: 0.835911286090736.[0m
[32m[I 2022-04-21 20:08:32,401][0m Trial 801 finished with value: 0.8356319979563185 and parameters: {'alpha': 3.88605226885786, 'ties': 'efron'}. Best is trial 70 with value: 0.835911286090736.[0m
[32m[I 2022-04-21 20:09:01,336][0m Trial 802 finished with value: 0.8355175853441505 and parameters: {'alpha': 3.6685523907563757, 'ties': 'breslow'}. Best is trial 70 with value: 0.835911286090736.[0m
[32m[I 2022-04-21 20:09:32,228][0m Trial 803 finished with value: 0.8351911694139819 and parameters: {'alpha': 4.2645947618519715, 'ties': 'breslow'}. Best is trial 70 with value: 0.835911286090736.[0m
[32m[I 2022-04-21 20:10:02,388][0m Trial 804 finished with value: 0.8357914144599559 and parameters: {'alpha': 3.794729683297494, 'ties': 'breslow'}. Best is trial 70 with value: 0.835911286090736.[0m
[32m[I 2022-04-21 20:10:33,781][0m Trial 805 finished with value: 0.8354805519222193 and parameters: {'alpha': 3.570647190082446, 'ties': 'breslow'}. Best is trial 70 with value: 0.835911286090736.[0m
[32m[I 2022-04-21 20:11:03,116][0m Trial 806 finished with value: 0.8357052929158193 and parameters: {'alpha': 3.866042073222377, 'ties': 'breslow'}. Best is trial 70 with value: 0.835911286090736.[0m
[32m[I 2022-04-21 20:11:32,533][0m Trial 807 finished with value: 0.8355583611728576 and parameters: {'alpha': 3.6808469268710944, 'ties': 'breslow'}. Best is trial 70 with value: 0.835911286090736.[0m
[32m[I 2022-04-21 20:12:03,368][0m Trial 808 finished with value: 0.8352854798157032 and parameters: {'alpha': 4.037647540103312, 'ties': 'breslow'}. Best is trial 70 with value: 0.835911286090736.[0m
[32m[I 2022-04-21 20:12:34,002][0m Trial 809 finished with value: 0.8356715428291757 and parameters: {'alpha': 3.8183247879446385, 'ties': 'breslow'}. Best is trial 70 with value: 0.835911286090736.[0m
[32m[I 2022-04-21 20:13:04,887][0m Trial 810 finished with value: 0.8355454473484436 and parameters: {'alpha': 3.447132882618921, 'ties': 'breslow'}. Best is trial 70 with value: 0.835911286090736.[0m
[32m[I 2022-04-21 20:17:45,891][0m Trial 811 finished with value: 0.8283897307886863 and parameters: {'alpha': 0.009367370277740594, 'ties': 'breslow'}. Best is trial 70 with value: 0.835911286090736.[0m
[32m[I 2022-04-21 20:18:25,472][0m Trial 812 finished with value: 0.834237179375686 and parameters: {'alpha': 0.563657074907624, 'ties': 'breslow'}. Best is trial 70 with value: 0.835911286090736.[0m
[32m[I 2022-04-21 20:18:52,122][0m Trial 813 finished with value: 0.8354826511319169 and parameters: {'alpha': 3.948255496125055, 'ties': 'breslow'}. Best is trial 70 with value: 0.835911286090736.[0m
[32m[I 2022-04-21 20:19:20,875][0m Trial 814 finished with value: 0.8357190747858569 and parameters: {'alpha': 3.737492919848858, 'ties': 'breslow'}. Best is trial 70 with value: 0.835911286090736.[0m
[32m[I 2022-04-21 20:19:48,935][0m Trial 815 finished with value: 0.835519290914522 and parameters: {'alpha': 3.62125315544071, 'ties': 'breslow'}. Best is trial 70 with value: 0.835911286090736.[0m
[32m[I 2022-04-21 20:20:18,596][0m Trial 816 finished with value: 0.8358321902886627 and parameters: {'alpha': 3.7825948756739396, 'ties': 'breslow'}. Best is trial 70 with value: 0.835911286090736.[0m
[32m[I 2022-04-21 20:20:49,048][0m Trial 817 finished with value: 0.8356281582736811 and parameters: {'alpha': 3.9015329807544323, 'ties': 'breslow'}. Best is trial 70 with value: 0.835911286090736.[0m
[32m[I 2022-04-21 20:21:18,315][0m Trial 818 finished with value: 0.8356379421473796 and parameters: {'alpha': 3.702428615376304, 'ties': 'breslow'}. Best is trial 70 with value: 0.835911286090736.[0m
[32m[I 2022-04-21 20:21:48,641][0m Trial 819 finished with value: 0.8355058489993418 and parameters: {'alpha': 3.515285195077959, 'ties': 'breslow'}. Best is trial 70 with value: 0.835911286090736.[0m
[32m[I 2022-04-21 20:22:18,106][0m Trial 820 finished with value: 0.835593038904087 and parameters: {'alpha': 3.8490160238677977, 'ties': 'efron'}. Best is trial 70 with value: 0.835911286090736.[0m
[32m[I 2022-04-21 20:22:47,500][0m Trial 821 finished with value: 0.8352098402069652 and parameters: {'alpha': 4.024240025511713, 'ties': 'breslow'}. Best is trial 70 with value: 0.835911286090736.[0m
[32m[I 2022-04-21 20:23:17,342][0m Trial 822 finished with value: 0.8354804857687071 and parameters: {'alpha': 3.6303718613698504, 'ties': 'breslow'}. Best is trial 70 with value: 0.835911286090736.[0m
[32m[I 2022-04-21 20:23:46,072][0m Trial 823 finished with value: 0.8358336757991058 and parameters: {'alpha': 3.765995356936384, 'ties': 'breslow'}. Best is trial 70 with value: 0.835911286090736.[0m
[32m[I 2022-04-21 20:24:15,410][0m Trial 824 finished with value: 0.8352419619247285 and parameters: {'alpha': 4.1124842916554005, 'ties': 'breslow'}. Best is trial 70 with value: 0.835911286090736.[0m
[32m[I 2022-04-21 20:24:43,725][0m Trial 825 finished with value: 0.8355898383003153 and parameters: {'alpha': 3.920364826509068, 'ties': 'breslow'}. Best is trial 70 with value: 0.835911286090736.[0m
[32m[I 2022-04-21 20:25:13,587][0m Trial 826 finished with value: 0.8357190747858569 and parameters: {'alpha': 3.7301508909095844, 'ties': 'breslow'}. Best is trial 70 with value: 0.835911286090736.[0m
[32m[I 2022-04-21 20:25:42,575][0m Trial 827 finished with value: 0.8355193570680342 and parameters: {'alpha': 3.5648325347132648, 'ties': 'breslow'}. Best is trial 70 with value: 0.835911286090736.[0m
[32m[I 2022-04-21 20:26:12,007][0m Trial 828 finished with value: 0.8356661565039716 and parameters: {'alpha': 3.8491892600100166, 'ties': 'breslow'}. Best is trial 70 with value: 0.835911286090736.[0m
[32m[I 2022-04-21 20:26:41,641][0m Trial 829 finished with value: 0.8355175853441505 and parameters: {'alpha': 3.6761700491000497, 'ties': 'breslow'}. Best is trial 70 with value: 0.835911286090736.[0m
[32m[I 2022-04-21 20:27:10,836][0m Trial 830 finished with value: 0.8349017094414954 and parameters: {'alpha': 4.853770696703839, 'ties': 'breslow'}. Best is trial 70 with value: 0.835911286090736.[0m
[32m[I 2022-04-21 20:27:40,308][0m Trial 831 finished with value: 0.8354049296341829 and parameters: {'alpha': 3.9565084321212245, 'ties': 'breslow'}. Best is trial 70 with value: 0.835911286090736.[0m
[32m[I 2022-04-21 20:28:08,510][0m Trial 832 finished with value: 0.835160371526715 and parameters: {'alpha': 3.3105302563014076, 'ties': 'breslow'}. Best is trial 70 with value: 0.835911286090736.[0m
[32m[I 2022-04-21 20:28:36,896][0m Trial 833 finished with value: 0.8357914144599559 and parameters: {'alpha': 3.791513701275296, 'ties': 'breslow'}. Best is trial 70 with value: 0.835911286090736.[0m
[32m[I 2022-04-21 20:29:06,134][0m Trial 834 finished with value: 0.8355991370015646 and parameters: {'alpha': 3.693133533417636, 'ties': 'breslow'}. Best is trial 70 with value: 0.835911286090736.[0m
[32m[I 2022-04-21 20:29:35,056][0m Trial 835 finished with value: 0.8357052929158193 and parameters: {'alpha': 3.8567176154031175, 'ties': 'breslow'}. Best is trial 70 with value: 0.835911286090736.[0m
[32m[I 2022-04-21 20:30:03,184][0m Trial 836 finished with value: 0.8355071273750777 and parameters: {'alpha': 3.4713208080000664, 'ties': 'breslow'}. Best is trial 70 with value: 0.835911286090736.[0m
[32m[I 2022-04-21 20:30:32,123][0m Trial 837 finished with value: 0.8354805519222193 and parameters: {'alpha': 3.5929487942192857, 'ties': 'breslow'}. Best is trial 70 with value: 0.835911286090736.[0m
[32m[I 2022-04-21 20:31:02,473][0m Trial 838 finished with value: 0.8358724809449208 and parameters: {'alpha': 3.76762895302269, 'ties': 'breslow'}. Best is trial 70 with value: 0.835911286090736.[0m
[32m[I 2022-04-21 20:31:32,511][0m Trial 839 finished with value: 0.835052537734709 and parameters: {'alpha': 4.0001341262906625, 'ties': 'efron'}. Best is trial 70 with value: 0.835911286090736.[0m
[32m[I 2022-04-21 20:32:03,302][0m Trial 840 finished with value: 0.8356785640696703 and parameters: {'alpha': 3.7495015000167657, 'ties': 'breslow'}. Best is trial 70 with value: 0.835911286090736.[0m
[32m[I 2022-04-21 20:32:33,756][0m Trial 841 finished with value: 0.8355898383003153 and parameters: {'alpha': 3.917104663413201, 'ties': 'breslow'}. Best is trial 70 with value: 0.835911286090736.[0m
[32m[I 2022-04-21 20:33:03,443][0m Trial 842 finished with value: 0.8354787801983354 and parameters: {'alpha': 3.6617794849435668, 'ties': 'breslow'}. Best is trial 70 with value: 0.835911286090736.[0m
[32m[I 2022-04-21 20:33:34,355][0m Trial 843 finished with value: 0.8353200362638182 and parameters: {'alpha': 4.169900185502403, 'ties': 'breslow'}. Best is trial 70 with value: 0.835911286090736.[0m
[32m[I 2022-04-21 20:34:07,737][0m Trial 844 finished with value: 0.8350498786496011 and parameters: {'alpha': 2.8524886541664434, 'ties': 'breslow'}. Best is trial 70 with value: 0.835911286090736.[0m
[32m[I 2022-04-21 20:34:38,374][0m Trial 845 finished with value: 0.8357506386312487 and parameters: {'alpha': 3.807990361437604, 'ties': 'breslow'}. Best is trial 70 with value: 0.835911286090736.[0m
[32m[I 2022-04-21 20:35:09,955][0m Trial 846 finished with value: 0.8355193570680342 and parameters: {'alpha': 3.564732716275854, 'ties': 'breslow'}. Best is trial 70 with value: 0.835911286090736.[0m
[32m[I 2022-04-21 20:35:41,689][0m Trial 847 finished with value: 0.8357052929158193 and parameters: {'alpha': 3.8656031523039918, 'ties': 'breslow'}. Best is trial 70 with value: 0.835911286090736.[0m
[32m[I 2022-04-21 20:36:13,362][0m Trial 848 finished with value: 0.8356802696400418 and parameters: {'alpha': 3.7419874964551885, 'ties': 'breslow'}. Best is trial 70 with value: 0.835911286090736.[0m
[32m[I 2022-04-21 20:36:45,370][0m Trial 849 finished with value: 0.8352098402069652 and parameters: {'alpha': 4.02449400319336, 'ties': 'breslow'}. Best is trial 70 with value: 0.835911286090736.[0m
[32m[I 2022-04-21 20:37:16,343][0m Trial 850 finished with value: 0.8354787801983354 and parameters: {'alpha': 3.6558778288717426, 'ties': 'breslow'}. Best is trial 70 with value: 0.835911286090736.[0m
[32m[I 2022-04-21 20:37:45,473][0m Trial 851 finished with value: 0.8355898383003153 and parameters: {'alpha': 3.917911230993172, 'ties': 'breslow'}. Best is trial 70 with value: 0.835911286090736.[0m
[32m[I 2022-04-21 20:38:17,326][0m Trial 852 finished with value: 0.8357914144599559 and parameters: {'alpha': 3.7888943011762866, 'ties': 'breslow'}. Best is trial 70 with value: 0.835911286090736.[0m
[32m[I 2022-04-21 20:38:48,524][0m Trial 853 finished with value: 0.8354264219312361 and parameters: {'alpha': 3.5057867519553674, 'ties': 'breslow'}. Best is trial 70 with value: 0.835911286090736.[0m
[32m[I 2022-04-21 20:39:18,494][0m Trial 854 finished with value: 0.835519290914522 and parameters: {'alpha': 3.624272685824458, 'ties': 'breslow'}. Best is trial 70 with value: 0.835911286090736.[0m
[32m[I 2022-04-21 20:39:49,232][0m Trial 855 finished with value: 0.8356802696400418 and parameters: {'alpha': 3.745438712396688, 'ties': 'breslow'}. Best is trial 70 with value: 0.835911286090736.[0m
