[32m[I 2022-04-21 11:44:47,595][0m Trial 713 finished with value: 0.684367348820454 and parameters: {'alpha': 0.5872268638844442, 'ties': 'breslow'}. Best is trial 26 with value: 0.6847054012696481.[0m
[32m[I 2022-04-21 11:44:47,731][0m Trial 714 finished with value: 0.6847054012696481 and parameters: {'alpha': 0.817588713260694, 'ties': 'efron'}. Best is trial 26 with value: 0.6847054012696481.[0m
[32m[I 2022-04-21 11:44:47,869][0m Trial 715 finished with value: 0.6847054012696481 and parameters: {'alpha': 0.8369495679067857, 'ties': 'efron'}. Best is trial 26 with value: 0.6847054012696481.[0m
[32m[I 2022-04-21 11:44:48,006][0m Trial 716 finished with value: 0.6847054012696481 and parameters: {'alpha': 0.7909146899492525, 'ties': 'efron'}. Best is trial 26 with value: 0.6847054012696481.[0m
[32m[I 2022-04-21 11:44:48,133][0m Trial 717 finished with value: 0.6829090813866752 and parameters: {'alpha': 1.047820056547184, 'ties': 'breslow'}. Best is trial 26 with value: 0.6847054012696481.[0m
[32m[I 2022-04-21 11:44:48,327][0m Trial 718 finished with value: 0.684367348820454 and parameters: {'alpha': 0.6282433639175655, 'ties': 'efron'}. Best is trial 26 with value: 0.6847054012696481.[0m
[32m[I 2022-04-21 11:44:48,611][0m Trial 719 finished with value: 0.684367348820454 and parameters: {'alpha': 0.6908790098153264, 'ties': 'efron'}. Best is trial 26 with value: 0.6847054012696481.[0m
[32m[I 2022-04-21 11:44:48,888][0m Trial 720 finished with value: 0.6847054012696481 and parameters: {'alpha': 0.8659709542332216, 'ties': 'efron'}. Best is trial 26 with value: 0.6847054012696481.[0m
[32m[I 2022-04-21 11:44:49,147][0m Trial 721 finished with value: 0.6829090813866752 and parameters: {'alpha': 0.9834601344537914, 'ties': 'breslow'}. Best is trial 26 with value: 0.6847054012696481.[0m
[32m[I 2022-04-21 11:44:49,510][0m Trial 722 finished with value: 0.6847054012696481 and parameters: {'alpha': 0.7533381883944513, 'ties': 'efron'}. Best is trial 26 with value: 0.6847054012696481.[0m
[32m[I 2022-04-21 11:44:49,752][0m Trial 723 finished with value: 0.6829090813866752 and parameters: {'alpha': 1.0988011831986184, 'ties': 'breslow'}. Best is trial 26 with value: 0.6847054012696481.[0m
[32m[I 2022-04-21 11:44:49,979][0m Trial 724 finished with value: 0.6847054012696481 and parameters: {'alpha': 0.9344064129103137, 'ties': 'breslow'}. Best is trial 26 with value: 0.6847054012696481.[0m
[32m[I 2022-04-21 11:44:50,202][0m Trial 725 finished with value: 0.6829090813866752 and parameters: {'alpha': 0.9475824862131652, 'ties': 'breslow'}. Best is trial 26 with value: 0.6847054012696481.[0m
[32m[I 2022-04-21 11:44:50,417][0m Trial 726 finished with value: 0.684367348820454 and parameters: {'alpha': 0.5796080540080109, 'ties': 'efron'}. Best is trial 26 with value: 0.6847054012696481.[0m
[32m[I 2022-04-21 11:44:50,557][0m Trial 727 finished with value: 0.6847054012696481 and parameters: {'alpha': 0.7354130251132837, 'ties': 'efron'}. Best is trial 26 with value: 0.6847054012696481.[0m
[32m[I 2022-04-21 11:44:50,844][0m Trial 728 finished with value: 0.6847054012696481 and parameters: {'alpha': 0.8995206270217149, 'ties': 'breslow'}. Best is trial 26 with value: 0.6847054012696481.[0m
[32m[I 2022-04-21 11:44:51,033][0m Trial 729 finished with value: 0.6847054012696481 and parameters: {'alpha': 0.8994515152294432, 'ties': 'breslow'}. Best is trial 26 with value: 0.6847054012696481.[0m
[32m[I 2022-04-21 11:44:51,161][0m Trial 730 finished with value: 0.6829090813866752 and parameters: {'alpha': 1.1303548035887345, 'ties': 'breslow'}. Best is trial 26 with value: 0.6847054012696481.[0m
[32m[I 2022-04-21 11:44:51,304][0m Trial 731 finished with value: 0.6829090813866752 and parameters: {'alpha': 0.9888137303396654, 'ties': 'breslow'}. Best is trial 26 with value: 0.6847054012696481.[0m
[32m[I 2022-04-21 11:44:51,737][0m Trial 732 finished with value: 0.6847054012696481 and parameters: {'alpha': 0.7841233321392651, 'ties': 'efron'}. Best is trial 26 with value: 0.6847054012696481.[0m
[32m[I 2022-04-21 11:44:51,922][0m Trial 733 finished with value: 0.684367348820454 and parameters: {'alpha': 0.6724025037740428, 'ties': 'efron'}. Best is trial 26 with value: 0.6847054012696481.[0m
[32m[I 2022-04-21 11:44:52,082][0m Trial 734 finished with value: 0.6847054012696481 and parameters: {'alpha': 0.8655938498843481, 'ties': 'breslow'}. Best is trial 26 with value: 0.6847054012696481.[0m
[32m[I 2022-04-21 11:44:52,485][0m Trial 735 finished with value: 0.6829090813866752 and parameters: {'alpha': 1.021191632781314, 'ties': 'breslow'}. Best is trial 26 with value: 0.6847054012696481.[0m
[32m[I 2022-04-21 11:44:52,750][0m Trial 736 finished with value: 0.684367348820454 and parameters: {'alpha': 0.46757754062414936, 'ties': 'efron'}. Best is trial 26 with value: 0.6847054012696481.[0m
[32m[I 2022-04-21 11:44:52,911][0m Trial 737 finished with value: 0.684367348820454 and parameters: {'alpha': 0.6000890329630777, 'ties': 'efron'}. Best is trial 26 with value: 0.6847054012696481.[0m
[32m[I 2022-04-21 11:44:53,291][0m Trial 738 finished with value: 0.684367348820454 and parameters: {'alpha': 0.40710102144224874, 'ties': 'efron'}. Best is trial 26 with value: 0.6847054012696481.[0m
[32m[I 2022-04-21 11:44:53,646][0m Trial 739 finished with value: 0.6847054012696481 and parameters: {'alpha': 0.7102360531522821, 'ties': 'efron'}. Best is trial 26 with value: 0.6847054012696481.[0m
[32m[I 2022-04-21 11:44:53,897][0m Trial 740 finished with value: 0.6847054012696481 and parameters: {'alpha': 0.8785325378000025, 'ties': 'breslow'}. Best is trial 26 with value: 0.6847054012696481.[0m
[32m[I 2022-04-21 11:44:54,081][0m Trial 741 finished with value: 0.684367348820454 and parameters: {'alpha': 0.5209463414228255, 'ties': 'efron'}. Best is trial 26 with value: 0.6847054012696481.[0m
[32m[I 2022-04-21 11:44:54,274][0m Trial 742 finished with value: 0.6847054012696481 and parameters: {'alpha': 0.7165227234774398, 'ties': 'efron'}. Best is trial 26 with value: 0.6847054012696481.[0m
[32m[I 2022-04-21 11:44:54,464][0m Trial 743 finished with value: 0.684367348820454 and parameters: {'alpha': 0.3413249016281315, 'ties': 'efron'}. Best is trial 26 with value: 0.6847054012696481.[0m
[32m[I 2022-04-21 11:44:54,696][0m Trial 744 finished with value: 0.684367348820454 and parameters: {'alpha': 0.5687796529570834, 'ties': 'efron'}. Best is trial 26 with value: 0.6847054012696481.[0m
[32m[I 2022-04-21 11:44:54,944][0m Trial 745 finished with value: 0.684367348820454 and parameters: {'alpha': 0.6729989439024211, 'ties': 'breslow'}. Best is trial 26 with value: 0.6847054012696481.[0m
[32m[I 2022-04-21 11:44:55,140][0m Trial 746 finished with value: 0.6847054012696481 and parameters: {'alpha': 0.7668561202100984, 'ties': 'breslow'}. Best is trial 26 with value: 0.6847054012696481.[0m
[32m[I 2022-04-21 11:44:55,407][0m Trial 747 finished with value: 0.6847054012696481 and parameters: {'alpha': 0.7293215254080065, 'ties': 'breslow'}. Best is trial 26 with value: 0.6847054012696481.[0m
[32m[I 2022-04-21 11:44:55,632][0m Trial 748 finished with value: 0.6829090813866752 and parameters: {'alpha': 0.9559994254182318, 'ties': 'efron'}. Best is trial 26 with value: 0.6847054012696481.[0m
[32m[I 2022-04-21 11:44:55,822][0m Trial 749 finished with value: 0.6829090813866752 and parameters: {'alpha': 1.226475461185379, 'ties': 'breslow'}. Best is trial 26 with value: 0.6847054012696481.[0m
[32m[I 2022-04-21 11:44:55,998][0m Trial 750 finished with value: 0.6847054012696481 and parameters: {'alpha': 0.8962812227910316, 'ties': 'breslow'}. Best is trial 26 with value: 0.6847054012696481.[0m
[32m[I 2022-04-21 11:44:56,155][0m Trial 751 finished with value: 0.6829090813866752 and parameters: {'alpha': 1.0528881227905267, 'ties': 'breslow'}. Best is trial 26 with value: 0.6847054012696481.[0m
[32m[I 2022-04-21 11:44:56,379][0m Trial 752 finished with value: 0.6847054012696481 and parameters: {'alpha': 0.8178608680166577, 'ties': 'efron'}. Best is trial 26 with value: 0.6847054012696481.[0m
[32m[I 2022-04-21 11:44:56,518][0m Trial 753 finished with value: 0.6814469677485105 and parameters: {'alpha': 4.086309381903305, 'ties': 'efron'}. Best is trial 26 with value: 0.6847054012696481.[0m
[32m[I 2022-04-21 11:44:56,726][0m Trial 754 finished with value: 0.6847054012696481 and parameters: {'alpha': 0.8343171459639893, 'ties': 'efron'}. Best is trial 26 with value: 0.6847054012696481.[0m
[32m[I 2022-04-21 11:44:56,900][0m Trial 755 finished with value: 0.6847054012696481 and parameters: {'alpha': 0.8239672241009116, 'ties': 'efron'}. Best is trial 26 with value: 0.6847054012696481.[0m
[32m[I 2022-04-21 11:44:57,039][0m Trial 756 finished with value: 0.6847054012696481 and parameters: {'alpha': 0.8170928020370243, 'ties': 'efron'}. Best is trial 26 with value: 0.6847054012696481.[0m
[32m[I 2022-04-21 11:44:57,164][0m Trial 757 finished with value: 0.684367348820454 and parameters: {'alpha': 0.6715921555585336, 'ties': 'breslow'}. Best is trial 26 with value: 0.6847054012696481.[0m
[32m[I 2022-04-21 11:44:57,382][0m Trial 758 finished with value: 0.684367348820454 and parameters: {'alpha': 0.5827496384476167, 'ties': 'breslow'}. Best is trial 26 with value: 0.6847054012696481.[0m
[32m[I 2022-04-21 11:44:57,589][0m Trial 759 finished with value: 0.6826116370301901 and parameters: {'alpha': 3.340113716251457, 'ties': 'breslow'}. Best is trial 26 with value: 0.6847054012696481.[0m
[32m[I 2022-04-21 11:44:57,833][0m Trial 760 finished with value: 0.6847054012696481 and parameters: {'alpha': 0.7356304147860641, 'ties': 'breslow'}. Best is trial 26 with value: 0.6847054012696481.[0m
[32m[I 2022-04-21 11:44:58,178][0m Trial 761 finished with value: 0.684367348820454 and parameters: {'alpha': 0.6043994152470881, 'ties': 'breslow'}. Best is trial 26 with value: 0.6847054012696481.[0m
[32m[I 2022-04-21 11:44:58,514][0m Trial 762 finished with value: 0.684367348820454 and parameters: {'alpha': 0.4928310623172176, 'ties': 'breslow'}. Best is trial 26 with value: 0.6847054012696481.[0m
[32m[I 2022-04-21 11:44:58,924][0m Trial 763 finished with value: 0.6847054012696481 and parameters: {'alpha': 0.9375980714950883, 'ties': 'breslow'}. Best is trial 26 with value: 0.6847054012696481.[0m
[32m[I 2022-04-21 11:44:59,237][0m Trial 764 finished with value: 0.6829090813866752 and parameters: {'alpha': 0.8765276653322733, 'ties': 'efron'}. Best is trial 26 with value: 0.6847054012696481.[0m
[32m[I 2022-04-21 11:44:59,541][0m Trial 765 finished with value: 0.6829496894793843 and parameters: {'alpha': 3.0269680290846135, 'ties': 'efron'}. Best is trial 26 with value: 0.6847054012696481.[0m
[32m[I 2022-04-21 11:44:59,873][0m Trial 766 finished with value: 0.684367348820454 and parameters: {'alpha': 0.659601643363199, 'ties': 'efron'}. Best is trial 26 with value: 0.6847054012696481.[0m
[32m[I 2022-04-21 11:45:00,172][0m Trial 767 finished with value: 0.682571028937481 and parameters: {'alpha': 1.6489144765094688, 'ties': 'efron'}. Best is trial 26 with value: 0.6847054012696481.[0m
[32m[I 2022-04-21 11:45:00,429][0m Trial 768 finished with value: 0.6829090813866752 and parameters: {'alpha': 0.982985711576734, 'ties': 'breslow'}. Best is trial 26 with value: 0.6847054012696481.[0m
[32m[I 2022-04-21 11:45:00,675][0m Trial 769 finished with value: 0.6847054012696481 and parameters: {'alpha': 0.7571948576691079, 'ties': 'breslow'}. Best is trial 26 with value: 0.6847054012696481.[0m
[32m[I 2022-04-21 11:45:00,952][0m Trial 770 finished with value: 0.6829090813866752 and parameters: {'alpha': 1.1135197280212332, 'ties': 'breslow'}. Best is trial 26 with value: 0.6847054012696481.[0m
[32m[I 2022-04-21 11:45:01,119][0m Trial 771 finished with value: 0.6829090813866752 and parameters: {'alpha': 0.95742646908936, 'ties': 'breslow'}. Best is trial 26 with value: 0.6847054012696481.[0m
[32m[I 2022-04-21 11:45:01,398][0m Trial 772 finished with value: 0.6829090813866752 and parameters: {'alpha': 1.0655157134305118, 'ties': 'breslow'}. Best is trial 26 with value: 0.6847054012696481.[0m
[32m[I 2022-04-21 11:45:01,676][0m Trial 773 finished with value: 0.684367348820454 and parameters: {'alpha': 0.616179514533265, 'ties': 'efron'}. Best is trial 26 with value: 0.6847054012696481.[0m
[32m[I 2022-04-21 11:45:01,888][0m Trial 774 finished with value: 0.6829090813866752 and parameters: {'alpha': 0.8972462221490692, 'ties': 'efron'}. Best is trial 26 with value: 0.6847054012696481.[0m
[32m[I 2022-04-21 11:45:02,048][0m Trial 775 finished with value: 0.6847054012696481 and parameters: {'alpha': 0.8209083068483157, 'ties': 'breslow'}. Best is trial 26 with value: 0.6847054012696481.[0m
[32m[I 2022-04-21 11:45:02,186][0m Trial 776 finished with value: 0.6847054012696481 and parameters: {'alpha': 0.7802142378853867, 'ties': 'efron'}. Best is trial 26 with value: 0.6847054012696481.[0m
[32m[I 2022-04-21 11:45:02,326][0m Trial 777 finished with value: 0.6847054012696481 and parameters: {'alpha': 0.8509899887333026, 'ties': 'efron'}. Best is trial 26 with value: 0.6847054012696481.[0m
[32m[I 2022-04-21 11:45:02,466][0m Trial 778 finished with value: 0.6847054012696481 and parameters: {'alpha': 0.7545864406017908, 'ties': 'efron'}. Best is trial 26 with value: 0.6847054012696481.[0m
[32m[I 2022-04-21 11:45:02,606][0m Trial 779 finished with value: 0.6847054012696481 and parameters: {'alpha': 0.7001379949790799, 'ties': 'efron'}. Best is trial 26 with value: 0.6847054012696481.[0m
[32m[I 2022-04-21 11:45:02,822][0m Trial 780 finished with value: 0.684367348820454 and parameters: {'alpha': 0.6779685661317477, 'ties': 'efron'}. Best is trial 26 with value: 0.6847054012696481.[0m
[32m[I 2022-04-21 11:45:03,078][0m Trial 781 finished with value: 0.684367348820454 and parameters: {'alpha': 0.5036337836559156, 'ties': 'breslow'}. Best is trial 26 with value: 0.6847054012696481.[0m
[32m[I 2022-04-21 11:45:03,463][0m Trial 782 finished with value: 0.684367348820454 and parameters: {'alpha': 0.5814696983334708, 'ties': 'efron'}. Best is trial 26 with value: 0.6847054012696481.[0m
[32m[I 2022-04-21 11:45:03,787][0m Trial 783 finished with value: 0.6847054012696481 and parameters: {'alpha': 0.8123050740363021, 'ties': 'efron'}. Best is trial 26 with value: 0.6847054012696481.[0m
[32m[I 2022-04-21 11:45:03,958][0m Trial 784 finished with value: 0.6847054012696481 and parameters: {'alpha': 0.7391968285938525, 'ties': 'efron'}. Best is trial 26 with value: 0.6847054012696481.[0m
[32m[I 2022-04-21 11:45:04,152][0m Trial 785 finished with value: 0.6829090813866752 and parameters: {'alpha': 0.9677044581798774, 'ties': 'breslow'}. Best is trial 26 with value: 0.6847054012696481.[0m
[32m[I 2022-04-21 11:45:04,358][0m Trial 786 finished with value: 0.684367348820454 and parameters: {'alpha': 0.638872580103035, 'ties': 'efron'}. Best is trial 26 with value: 0.6847054012696481.[0m
[32m[I 2022-04-21 11:45:04,564][0m Trial 787 finished with value: 0.6847054012696481 and parameters: {'alpha': 0.832014999027, 'ties': 'efron'}. Best is trial 26 with value: 0.6847054012696481.[0m
[32m[I 2022-04-21 11:45:04,719][0m Trial 788 finished with value: 0.6847054012696481 and parameters: {'alpha': 0.8564685519109844, 'ties': 'efron'}. Best is trial 26 with value: 0.6847054012696481.[0m
[32m[I 2022-04-21 11:45:04,930][0m Trial 789 finished with value: 0.6829090813866752 and parameters: {'alpha': 0.9943783086139423, 'ties': 'efron'}. Best is trial 26 with value: 0.6847054012696481.[0m
[32m[I 2022-04-21 11:45:05,097][0m Trial 790 finished with value: 0.6829090813866752 and parameters: {'alpha': 1.0741164639506295, 'ties': 'breslow'}. Best is trial 26 with value: 0.6847054012696481.[0m
[32m[I 2022-04-21 11:45:05,325][0m Trial 791 finished with value: 0.684367348820454 and parameters: {'alpha': 0.07420624152074695, 'ties': 'efron'}. Best is trial 26 with value: 0.6847054012696481.[0m
[32m[I 2022-04-21 11:45:05,452][0m Trial 792 finished with value: 0.6847054012696481 and parameters: {'alpha': 0.8800535588766912, 'ties': 'breslow'}. Best is trial 26 with value: 0.6847054012696481.[0m
[32m[I 2022-04-21 11:45:05,603][0m Trial 793 finished with value: 0.6829090813866752 and parameters: {'alpha': 0.9811002007081158, 'ties': 'efron'}. Best is trial 26 with value: 0.6847054012696481.[0m
[32m[I 2022-04-21 11:45:05,733][0m Trial 794 finished with value: 0.6847054012696481 and parameters: {'alpha': 0.756635393004872, 'ties': 'breslow'}. Best is trial 26 with value: 0.6847054012696481.[0m
[32m[I 2022-04-21 11:45:05,873][0m Trial 795 finished with value: 0.684367348820454 and parameters: {'alpha': 0.43199725425487967, 'ties': 'efron'}. Best is trial 26 with value: 0.6847054012696481.[0m
[32m[I 2022-04-21 11:45:05,999][0m Trial 796 finished with value: 0.6847054012696481 and parameters: {'alpha': 0.9241146690342343, 'ties': 'breslow'}. Best is trial 26 with value: 0.6847054012696481.[0m
[32m[I 2022-04-21 11:45:06,140][0m Trial 797 finished with value: 0.6829090813866752 and parameters: {'alpha': 1.129913109259128, 'ties': 'breslow'}. Best is trial 26 with value: 0.6847054012696481.[0m
[32m[I 2022-04-21 11:45:06,288][0m Trial 798 finished with value: 0.684367348820454 and parameters: {'alpha': 0.6470105753644542, 'ties': 'efron'}. Best is trial 26 with value: 0.6847054012696481.[0m
[32m[I 2022-04-21 11:45:06,498][0m Trial 799 finished with value: 0.6829090813866752 and parameters: {'alpha': 0.9465830543822008, 'ties': 'breslow'}. Best is trial 26 with value: 0.6847054012696481.[0m
[32m[I 2022-04-21 11:45:06,637][0m Trial 800 finished with value: 0.684367348820454 and parameters: {'alpha': 0.31805464525510335, 'ties': 'efron'}. Best is trial 26 with value: 0.6847054012696481.[0m
[32m[I 2022-04-21 11:45:06,778][0m Trial 801 finished with value: 0.684367348820454 and parameters: {'alpha': 0.5292499399399657, 'ties': 'efron'}. Best is trial 26 with value: 0.6847054012696481.[0m
[32m[I 2022-04-21 11:45:06,919][0m Trial 802 finished with value: 0.684367348820454 and parameters: {'alpha': 0.6484562408613282, 'ties': 'efron'}. Best is trial 26 with value: 0.6847054012696481.[0m
[32m[I 2022-04-21 11:45:07,069][0m Trial 803 finished with value: 0.684367348820454 and parameters: {'alpha': 0.6800823137910629, 'ties': 'efron'}. Best is trial 26 with value: 0.6847054012696481.[0m
[32m[I 2022-04-21 11:45:07,209][0m Trial 804 finished with value: 0.684367348820454 and parameters: {'alpha': 0.5272422684840569, 'ties': 'efron'}. Best is trial 26 with value: 0.6847054012696481.[0m
[32m[I 2022-04-21 11:45:07,350][0m Trial 805 finished with value: 0.6847054012696481 and parameters: {'alpha': 0.7731240927365924, 'ties': 'efron'}. Best is trial 26 with value: 0.6847054012696481.[0m
[32m[I 2022-04-21 11:45:07,476][0m Trial 806 finished with value: 0.6847054012696481 and parameters: {'alpha': 0.7527942183630448, 'ties': 'breslow'}. Best is trial 26 with value: 0.6847054012696481.[0m
[32m[I 2022-04-21 11:45:07,604][0m Trial 807 finished with value: 0.6847054012696481 and parameters: {'alpha': 0.8841215978302407, 'ties': 'breslow'}. Best is trial 26 with value: 0.6847054012696481.[0m
[32m[I 2022-04-21 11:45:07,790][0m Trial 808 finished with value: 0.6829090813866752 and parameters: {'alpha': 1.0435024899133836, 'ties': 'breslow'}. Best is trial 26 with value: 0.6847054012696481.[0m
[32m[I 2022-04-21 11:45:08,081][0m Trial 809 finished with value: 0.6847054012696481 and parameters: {'alpha': 0.7902092885829795, 'ties': 'breslow'}. Best is trial 26 with value: 0.6847054012696481.[0m
[32m[I 2022-04-21 11:45:08,252][0m Trial 810 finished with value: 0.684367348820454 and parameters: {'alpha': 0.675132296741916, 'ties': 'efron'}. Best is trial 26 with value: 0.6847054012696481.[0m
[32m[I 2022-04-21 11:45:08,462][0m Trial 811 finished with value: 0.684367348820454 and parameters: {'alpha': 0.5746684512400677, 'ties': 'efron'}. Best is trial 26 with value: 0.6847054012696481.[0m
[32m[I 2022-04-21 11:45:08,590][0m Trial 812 finished with value: 0.6847054012696481 and parameters: {'alpha': 0.7292623955471799, 'ties': 'breslow'}. Best is trial 26 with value: 0.6847054012696481.[0m
[32m[I 2022-04-21 11:45:08,765][0m Trial 813 finished with value: 0.6847054012696481 and parameters: {'alpha': 0.9189906640371652, 'ties': 'breslow'}. Best is trial 26 with value: 0.6847054012696481.[0m
[32m[I 2022-04-21 11:45:08,938][0m Trial 814 finished with value: 0.6829090813866752 and parameters: {'alpha': 1.0337979100879557, 'ties': 'breslow'}. Best is trial 26 with value: 0.6847054012696481.[0m
[32m[I 2022-04-21 11:45:09,070][0m Trial 815 finished with value: 0.6829090813866752 and parameters: {'alpha': 1.3886148201545245, 'ties': 'breslow'}. Best is trial 26 with value: 0.6847054012696481.[0m
[32m[I 2022-04-21 11:45:09,278][0m Trial 816 finished with value: 0.6847054012696481 and parameters: {'alpha': 0.9295894959850427, 'ties': 'breslow'}. Best is trial 26 with value: 0.6847054012696481.[0m
[32m[I 2022-04-21 11:45:09,432][0m Trial 817 finished with value: 0.6847054012696481 and parameters: {'alpha': 0.7538709576714111, 'ties': 'efron'}. Best is trial 26 with value: 0.6847054012696481.[0m
[32m[I 2022-04-21 11:45:09,570][0m Trial 818 finished with value: 0.684367348820454 and parameters: {'alpha': 0.4412819043828681, 'ties': 'efron'}. Best is trial 26 with value: 0.6847054012696481.[0m
[32m[I 2022-04-21 11:45:09,799][0m Trial 819 finished with value: 0.684367348820454 and parameters: {'alpha': 0.6283728990703282, 'ties': 'breslow'}. Best is trial 26 with value: 0.6847054012696481.[0m
