[32m[I 2022-04-23 04:02:38,466][0m Trial 930 finished with value: 0.8318051387755923 and parameters: {'n_hidden': 256, 'mixture_components': 4, 'use_sparse_layer': False, 'use_batchnorm': True, 'use_dropout': True, 'dropout': 0.6039916481637916, 'mlp_size_1': 0, 'mlp_size_2': 5, 'mlp_size_3': 0, 'kernel': 'LogLogistic', 'loss_name': 'CensoredNLLLoss'}. Best is trial 22 with value: 0.8433318468070169.[0m
[32m[I 2022-04-23 04:05:06,919][0m Trial 931 finished with value: 0.635568012590133 and parameters: {'n_hidden': 256, 'mixture_components': 3, 'use_sparse_layer': False, 'use_batchnorm': True, 'use_dropout': True, 'dropout': 0.5555243974182065, 'mlp_size_1': 0, 'mlp_size_2': 5, 'mlp_size_3': 0, 'kernel': 'LogLogistic', 'loss_name': 'CensoredNLLLoss'}. Best is trial 22 with value: 0.8433318468070169.[0m
[32m[I 2022-04-23 04:07:38,062][0m Trial 932 finished with value: 0.7339924288222976 and parameters: {'n_hidden': 256, 'mixture_components': 4, 'use_sparse_layer': False, 'use_batchnorm': True, 'use_dropout': True, 'dropout': 0.6359351014743652, 'mlp_size_1': 0, 'mlp_size_2': 5, 'mlp_size_3': 0, 'kernel': 'LogLogistic', 'loss_name': 'CensoredNLLLoss'}. Best is trial 22 with value: 0.8433318468070169.[0m
[32m[I 2022-04-23 04:09:54,401][0m Trial 933 finished with value: 0.7240870567687352 and parameters: {'n_hidden': 256, 'mixture_components': 4, 'use_sparse_layer': False, 'use_batchnorm': True, 'use_dropout': True, 'dropout': 0.5353510416419085, 'mlp_size_1': 0, 'mlp_size_2': 5, 'mlp_size_3': 0, 'kernel': 'LogLogistic', 'loss_name': 'CensoredNLLLoss'}. Best is trial 22 with value: 0.8433318468070169.[0m
[32m[I 2022-04-23 04:12:17,578][0m Trial 934 finished with value: 0.8284190271869933 and parameters: {'n_hidden': 256, 'mixture_components': 4, 'use_sparse_layer': False, 'use_batchnorm': True, 'use_dropout': True, 'dropout': 0.6088884772448957, 'mlp_size_1': 0, 'mlp_size_2': 5, 'mlp_size_3': 0, 'kernel': 'LogLogistic', 'loss_name': 'CensoredNLLLoss'}. Best is trial 22 with value: 0.8433318468070169.[0m
[32m[I 2022-04-23 04:14:51,964][0m Trial 935 finished with value: 0.8308979627902247 and parameters: {'n_hidden': 256, 'mixture_components': 4, 'use_sparse_layer': False, 'use_batchnorm': True, 'use_dropout': True, 'dropout': 0.58376645918576, 'mlp_size_1': 0, 'mlp_size_2': 5, 'mlp_size_3': 0, 'kernel': 'LogLogistic', 'loss_name': 'CensoredNLLLoss'}. Best is trial 22 with value: 0.8433318468070169.[0m
[32m[I 2022-04-23 04:16:57,879][0m Trial 936 finished with value: 0.5290626905453768 and parameters: {'n_hidden': 256, 'mixture_components': 4, 'use_sparse_layer': False, 'use_batchnorm': True, 'use_dropout': True, 'dropout': 0.12785666231271145, 'mlp_size_1': 0, 'mlp_size_2': 5, 'mlp_size_3': 0, 'kernel': 'LogLogistic', 'loss_name': 'CensoredNLLLoss'}. Best is trial 22 with value: 0.8433318468070169.[0m
[32m[I 2022-04-23 04:19:24,642][0m Trial 937 finished with value: 0.7334222886009172 and parameters: {'n_hidden': 256, 'mixture_components': 4, 'use_sparse_layer': False, 'use_batchnorm': True, 'use_dropout': True, 'dropout': 0.6410589666212758, 'mlp_size_1': 0, 'mlp_size_2': 5, 'mlp_size_3': 0, 'kernel': 'LogLogistic', 'loss_name': 'CensoredNLLLoss'}. Best is trial 22 with value: 0.8433318468070169.[0m
[32m[I 2022-04-23 04:21:48,247][0m Trial 938 finished with value: 0.7308255233192911 and parameters: {'n_hidden': 256, 'mixture_components': 3, 'use_sparse_layer': False, 'use_batchnorm': True, 'use_dropout': True, 'dropout': 0.4229208324985311, 'mlp_size_1': 0, 'mlp_size_2': 5, 'mlp_size_3': 0, 'kernel': 'LogLogistic', 'loss_name': 'CensoredNLLLoss'}. Best is trial 22 with value: 0.8433318468070169.[0m
[32m[I 2022-04-23 04:24:38,472][0m Trial 939 finished with value: 0.6390270421694354 and parameters: {'n_hidden': 256, 'mixture_components': 4, 'use_sparse_layer': False, 'use_batchnorm': True, 'use_dropout': True, 'dropout': 0.6135487913294245, 'mlp_size_1': 0, 'mlp_size_2': 5, 'mlp_size_3': 0, 'kernel': 'LogLogistic', 'loss_name': 'CensoredNLLLoss'}. Best is trial 22 with value: 0.8433318468070169.[0m
[32m[I 2022-04-23 04:26:46,341][0m Trial 940 finished with value: 0.41433053965443145 and parameters: {'n_hidden': 256, 'mixture_components': 4, 'use_sparse_layer': False, 'use_batchnorm': True, 'use_dropout': True, 'dropout': 0.5685323416791644, 'mlp_size_1': 3, 'mlp_size_2': 2, 'mlp_size_3': 0, 'kernel': 'LogLogistic', 'loss_name': 'CensoredNLLLoss'}. Best is trial 22 with value: 0.8433318468070169.[0m
[32m[I 2022-04-23 04:30:18,376][0m Trial 941 finished with value: 0.43129668506177526 and parameters: {'n_hidden': 1024, 'mixture_components': 4, 'use_sparse_layer': False, 'use_batchnorm': True, 'use_dropout': True, 'dropout': 0.5914739914238105, 'mlp_size_1': 1, 'mlp_size_2': 5, 'mlp_size_3': 1, 'kernel': 'LogLogistic', 'loss_name': 'CensoredNLLLoss'}. Best is trial 22 with value: 0.8433318468070169.[0m
[32m[I 2022-04-23 04:32:39,331][0m Trial 942 finished with value: 0.427825569416329 and parameters: {'n_hidden': 32, 'mixture_components': 3, 'use_sparse_layer': False, 'use_batchnorm': True, 'use_dropout': True, 'dropout': 0.6314153014195265, 'mlp_size_1': 0, 'mlp_size_2': 2, 'mlp_size_3': 0, 'kernel': 'LogLogistic', 'loss_name': 'CensoredNLLLoss'}. Best is trial 22 with value: 0.8433318468070169.[0m
[32m[I 2022-04-23 04:35:20,018][0m Trial 943 finished with value: 0.8365329462786045 and parameters: {'n_hidden': 256, 'mixture_components': 4, 'use_sparse_layer': False, 'use_batchnorm': True, 'use_dropout': True, 'dropout': 0.6134889556593445, 'mlp_size_1': 0, 'mlp_size_2': 5, 'mlp_size_3': 0, 'kernel': 'LogLogistic', 'loss_name': 'AlternativeNLLLoss'}. Best is trial 22 with value: 0.8433318468070169.[0m
[32m[I 2022-04-23 04:38:01,564][0m Trial 944 finished with value: 0.6297053588358762 and parameters: {'n_hidden': 256, 'mixture_components': 4, 'use_sparse_layer': False, 'use_batchnorm': True, 'use_dropout': True, 'dropout': 0.6533948481481189, 'mlp_size_1': 0, 'mlp_size_2': 5, 'mlp_size_3': 0, 'kernel': 'LogLogistic', 'loss_name': 'CensoredNLLLoss'}. Best is trial 22 with value: 0.8433318468070169.[0m
[32m[I 2022-04-23 04:38:53,132][0m Trial 945 finished with value: -0.34929419056418787 and parameters: {'n_hidden': 256, 'mixture_components': 3, 'use_sparse_layer': False, 'use_batchnorm': True, 'use_dropout': True, 'dropout': 0.5958244195131205, 'mlp_size_1': 0, 'mlp_size_2': 5, 'mlp_size_3': 0, 'kernel': 'Gumbel', 'loss_name': 'CensoredNLLLoss'}. Best is trial 22 with value: 0.8433318468070169.[0m
[32m[I 2022-04-23 04:41:44,052][0m Trial 946 finished with value: 0.7331998489171516 and parameters: {'n_hidden': 256, 'mixture_components': 4, 'use_sparse_layer': False, 'use_batchnorm': True, 'use_dropout': True, 'dropout': 0.5485767203478923, 'mlp_size_1': 0, 'mlp_size_2': 5, 'mlp_size_3': 0, 'kernel': 'LogLogistic', 'loss_name': 'CensoredNLLLoss'}. Best is trial 22 with value: 0.8433318468070169.[0m
[32m[I 2022-04-23 04:44:22,582][0m Trial 947 finished with value: 0.8308506616986149 and parameters: {'n_hidden': 256, 'mixture_components': 6, 'use_sparse_layer': False, 'use_batchnorm': True, 'use_dropout': True, 'dropout': 0.6261808392683955, 'mlp_size_1': 0, 'mlp_size_2': 5, 'mlp_size_3': 0, 'kernel': 'LogLogistic', 'loss_name': 'CensoredNLLLoss'}. Best is trial 22 with value: 0.8433318468070169.[0m
[32m[I 2022-04-23 04:45:07,301][0m Trial 948 finished with value: -0.3424064163132973 and parameters: {'n_hidden': 256, 'mixture_components': 6, 'use_sparse_layer': False, 'use_batchnorm': True, 'use_dropout': True, 'dropout': 0.9553545650699378, 'mlp_size_1': 0, 'mlp_size_2': 5, 'mlp_size_3': 0, 'kernel': 'LogLogistic', 'loss_name': 'CensoredNLLLoss'}. Best is trial 22 with value: 0.8433318468070169.[0m
[32m[I 2022-04-23 04:47:39,787][0m Trial 949 finished with value: 0.8407779361879403 and parameters: {'n_hidden': 256, 'mixture_components': 4, 'use_sparse_layer': False, 'use_batchnorm': True, 'use_dropout': True, 'dropout': 0.6502090648217642, 'mlp_size_1': 0, 'mlp_size_2': 5, 'mlp_size_3': 0, 'kernel': 'LogLogistic', 'loss_name': 'CensoredNLLLoss'}. Best is trial 22 with value: 0.8433318468070169.[0m
[32m[I 2022-04-23 04:50:26,069][0m Trial 950 finished with value: 0.6357620060235138 and parameters: {'n_hidden': 256, 'mixture_components': 4, 'use_sparse_layer': False, 'use_batchnorm': True, 'use_dropout': True, 'dropout': 0.6631186527984513, 'mlp_size_1': 0, 'mlp_size_2': 5, 'mlp_size_3': 0, 'kernel': 'LogLogistic', 'loss_name': 'CensoredNLLLoss'}. Best is trial 22 with value: 0.8433318468070169.[0m
[32m[I 2022-04-23 04:53:02,543][0m Trial 951 finished with value: 0.8336440821067429 and parameters: {'n_hidden': 256, 'mixture_components': 6, 'use_sparse_layer': False, 'use_batchnorm': True, 'use_dropout': True, 'dropout': 0.6603344065076437, 'mlp_size_1': 0, 'mlp_size_2': 5, 'mlp_size_3': 0, 'kernel': 'LogLogistic', 'loss_name': 'CensoredNLLLoss'}. Best is trial 22 with value: 0.8433318468070169.[0m
[32m[I 2022-04-23 04:55:28,125][0m Trial 952 finished with value: 0.616295978297331 and parameters: {'n_hidden': 1024, 'mixture_components': 6, 'use_sparse_layer': False, 'use_batchnorm': True, 'use_dropout': True, 'dropout': 0.643009614473626, 'mlp_size_1': 4, 'mlp_size_2': 3, 'mlp_size_3': 0, 'kernel': 'LogLogistic', 'loss_name': 'CensoredNLLLoss'}. Best is trial 22 with value: 0.8433318468070169.[0m
[32m[I 2022-04-23 04:57:23,892][0m Trial 953 finished with value: 0.32537616121279045 and parameters: {'n_hidden': 256, 'mixture_components': 4, 'use_sparse_layer': False, 'use_batchnorm': True, 'use_dropout': True, 'dropout': 0.0018505148146587547, 'mlp_size_1': 0, 'mlp_size_2': 5, 'mlp_size_3': 0, 'kernel': 'LogLogistic', 'loss_name': 'CensoredNLLLoss'}. Best is trial 22 with value: 0.8433318468070169.[0m
[32m[I 2022-04-23 05:00:14,074][0m Trial 954 finished with value: 0.730992446358103 and parameters: {'n_hidden': 256, 'mixture_components': 4, 'use_sparse_layer': False, 'use_batchnorm': True, 'use_dropout': True, 'dropout': 0.6692754063589619, 'mlp_size_1': 0, 'mlp_size_2': 5, 'mlp_size_3': 0, 'kernel': 'LogLogistic', 'loss_name': 'AlternativeNLLLoss'}. Best is trial 22 with value: 0.8433318468070169.[0m
[32m[I 2022-04-23 05:03:17,482][0m Trial 955 finished with value: 0.32777780289737085 and parameters: {'n_hidden': 256, 'mixture_components': 6, 'use_sparse_layer': False, 'use_batchnorm': True, 'use_dropout': True, 'dropout': 0.5729415734008342, 'mlp_size_1': 3, 'mlp_size_2': 2, 'mlp_size_3': 0, 'kernel': 'Normal', 'loss_name': 'CensoredNLLLoss'}. Best is trial 22 with value: 0.8433318468070169.[0m
[32m[I 2022-04-23 05:06:03,072][0m Trial 956 finished with value: 0.8256440281126783 and parameters: {'n_hidden': 256, 'mixture_components': 6, 'use_sparse_layer': False, 'use_batchnorm': True, 'use_dropout': True, 'dropout': 0.648765995908961, 'mlp_size_1': 0, 'mlp_size_2': 5, 'mlp_size_3': 0, 'kernel': 'Logistic', 'loss_name': 'CensoredNLLLoss'}. Best is trial 22 with value: 0.8433318468070169.[0m
[32m[I 2022-04-23 05:08:25,238][0m Trial 957 finished with value: 0.7349493487556595 and parameters: {'n_hidden': 256, 'mixture_components': 4, 'use_sparse_layer': False, 'use_batchnorm': True, 'use_dropout': True, 'dropout': 0.6052440632857491, 'mlp_size_1': 0, 'mlp_size_2': 5, 'mlp_size_3': 0, 'kernel': 'LogLogistic', 'loss_name': 'CensoredNLLLoss'}. Best is trial 22 with value: 0.8433318468070169.[0m
[32m[I 2022-04-23 05:09:20,770][0m Trial 958 finished with value: -0.34401471862931915 and parameters: {'n_hidden': 256, 'mixture_components': 4, 'use_sparse_layer': False, 'use_batchnorm': True, 'use_dropout': True, 'dropout': 0.15720450306760364, 'mlp_size_1': 3, 'mlp_size_2': 2, 'mlp_size_3': 0, 'kernel': 'Gumbel', 'loss_name': 'CensoredNLLLoss'}. Best is trial 22 with value: 0.8433318468070169.[0m
[32m[I 2022-04-23 05:11:50,151][0m Trial 959 finished with value: 0.8299906179282894 and parameters: {'n_hidden': 256, 'mixture_components': 6, 'use_sparse_layer': False, 'use_batchnorm': True, 'use_dropout': True, 'dropout': 0.5835661452879977, 'mlp_size_1': 0, 'mlp_size_2': 5, 'mlp_size_3': 0, 'kernel': 'LogLogistic', 'loss_name': 'CensoredNLLLoss'}. Best is trial 22 with value: 0.8433318468070169.[0m
[32m[I 2022-04-23 05:14:17,141][0m Trial 960 finished with value: 0.8344820657201215 and parameters: {'n_hidden': 256, 'mixture_components': 3, 'use_sparse_layer': False, 'use_batchnorm': True, 'use_dropout': True, 'dropout': 0.6738399327620861, 'mlp_size_1': 0, 'mlp_size_2': 5, 'mlp_size_3': 0, 'kernel': 'LogLogistic', 'loss_name': 'CensoredNLLLoss'}. Best is trial 22 with value: 0.8433318468070169.[0m
[32m[I 2022-04-23 05:16:45,332][0m Trial 961 finished with value: 0.42200651641675807 and parameters: {'n_hidden': 32, 'mixture_components': 4, 'use_sparse_layer': False, 'use_batchnorm': True, 'use_dropout': True, 'dropout': 0.6457584664756794, 'mlp_size_1': 0, 'mlp_size_2': 2, 'mlp_size_3': 0, 'kernel': 'Logistic', 'loss_name': 'CensoredNLLLoss'}. Best is trial 22 with value: 0.8433318468070169.[0m
[32m[I 2022-04-23 05:19:32,313][0m Trial 962 finished with value: 0.7260150713660185 and parameters: {'n_hidden': 256, 'mixture_components': 6, 'use_sparse_layer': False, 'use_batchnorm': True, 'use_dropout': True, 'dropout': 0.22968120312561885, 'mlp_size_1': 0, 'mlp_size_2': 5, 'mlp_size_3': 0, 'kernel': 'LogLogistic', 'loss_name': 'CensoredNLLLoss'}. Best is trial 22 with value: 0.8433318468070169.[0m
[32m[I 2022-04-23 05:22:33,426][0m Trial 963 finished with value: 0.8330701965524518 and parameters: {'n_hidden': 256, 'mixture_components': 6, 'use_sparse_layer': False, 'use_batchnorm': True, 'use_dropout': True, 'dropout': 0.6148083484168806, 'mlp_size_1': 0, 'mlp_size_2': 5, 'mlp_size_3': 0, 'kernel': 'Normal', 'loss_name': 'CensoredNLLLoss'}. Best is trial 22 with value: 0.8433318468070169.[0m
[32m[I 2022-04-23 05:25:08,943][0m Trial 964 finished with value: 0.6346743827954906 and parameters: {'n_hidden': 1024, 'mixture_components': 4, 'use_sparse_layer': True, 'use_sparse_loss': True, 'lmbd': 0.0023063877035003535, 'use_batchnorm': True, 'use_dropout': True, 'dropout': 0.5595896960907643, 'mlp_size_1': 2, 'mlp_size_2': 5, 'mlp_size_3': 0, 'kernel': 'LogLogistic', 'loss_name': 'CensoredNLLLoss'}. Best is trial 22 with value: 0.8433318468070169.[0m
[32m[I 2022-04-23 05:27:43,983][0m Trial 965 finished with value: 0.8265958350543153 and parameters: {'n_hidden': 256, 'mixture_components': 6, 'use_sparse_layer': False, 'use_batchnorm': True, 'use_dropout': True, 'dropout': 0.5341324605732974, 'mlp_size_1': 0, 'mlp_size_2': 5, 'mlp_size_3': 0, 'kernel': 'LogLogistic', 'loss_name': 'CensoredNLLLoss'}. Best is trial 22 with value: 0.8433318468070169.[0m
[32m[I 2022-04-23 05:30:21,670][0m Trial 966 finished with value: 0.6273315530031411 and parameters: {'n_hidden': 64, 'mixture_components': 3, 'use_sparse_layer': True, 'use_sparse_loss': True, 'lmbd': 0.003180464386638631, 'use_batchnorm': True, 'use_dropout': True, 'dropout': 0.6287618328125621, 'mlp_size_1': 0, 'mlp_size_2': 3, 'mlp_size_3': 0, 'kernel': 'Logistic', 'loss_name': 'CensoredNLLLoss'}. Best is trial 22 with value: 0.8433318468070169.[0m
[32m[I 2022-04-23 05:32:51,211][0m Trial 967 finished with value: 0.7332986148073795 and parameters: {'n_hidden': 256, 'mixture_components': 4, 'use_sparse_layer': False, 'use_batchnorm': True, 'use_dropout': True, 'dropout': 0.5932842044034816, 'mlp_size_1': 0, 'mlp_size_2': 5, 'mlp_size_3': 0, 'kernel': 'LogLogistic', 'loss_name': 'AlternativeNLLLoss'}. Best is trial 22 with value: 0.8433318468070169.[0m
[32m[I 2022-04-23 05:35:40,205][0m Trial 968 finished with value: 0.820160863961681 and parameters: {'n_hidden': 256, 'mixture_components': 6, 'use_sparse_layer': True, 'use_sparse_loss': True, 'lmbd': 0.0012761524823184471, 'use_batchnorm': True, 'use_dropout': True, 'dropout': 0.6818977151223485, 'mlp_size_1': 0, 'mlp_size_2': 5, 'mlp_size_3': 0, 'kernel': 'LogLogistic', 'loss_name': 'CensoredNLLLoss'}. Best is trial 22 with value: 0.8433318468070169.[0m
[32m[I 2022-04-23 05:38:46,354][0m Trial 969 finished with value: 0.8236542592304985 and parameters: {'n_hidden': 256, 'mixture_components': 4, 'use_sparse_layer': True, 'use_sparse_loss': True, 'lmbd': 0.007845067289536618, 'use_batchnorm': True, 'use_dropout': True, 'dropout': 0.18505912475942993, 'mlp_size_1': 0, 'mlp_size_2': 5, 'mlp_size_3': 0, 'kernel': 'Normal', 'loss_name': 'CensoredNLLLoss'}. Best is trial 22 with value: 0.8433318468070169.[0m
[32m[I 2022-04-23 05:41:13,050][0m Trial 970 finished with value: 0.7279353609138948 and parameters: {'n_hidden': 256, 'mixture_components': 6, 'use_sparse_layer': False, 'use_batchnorm': True, 'use_dropout': True, 'dropout': 0.6466155446272048, 'mlp_size_1': 0, 'mlp_size_2': 5, 'mlp_size_3': 0, 'kernel': 'LogLogistic', 'loss_name': 'CensoredNLLLoss'}. Best is trial 22 with value: 0.8433318468070169.[0m
[32m[I 2022-04-23 05:43:57,385][0m Trial 971 finished with value: 0.8243017010872254 and parameters: {'n_hidden': 256, 'mixture_components': 10, 'use_sparse_layer': True, 'use_sparse_loss': True, 'lmbd': 0.00492875639765956, 'use_batchnorm': True, 'use_dropout': True, 'dropout': 0.6105399812860824, 'mlp_size_1': 0, 'mlp_size_2': 5, 'mlp_size_3': 0, 'kernel': 'Logistic', 'loss_name': 'CensoredNLLLoss'}. Best is trial 22 with value: 0.8433318468070169.[0m
[32m[I 2022-04-23 05:46:37,193][0m Trial 972 finished with value: 0.6338683781014357 and parameters: {'n_hidden': 256, 'mixture_components': 6, 'use_sparse_layer': False, 'use_batchnorm': True, 'use_dropout': True, 'dropout': 0.5778774985714562, 'mlp_size_1': 0, 'mlp_size_2': 5, 'mlp_size_3': 0, 'kernel': 'LogLogistic', 'loss_name': 'CensoredNLLLoss'}. Best is trial 22 with value: 0.8433318468070169.[0m
[32m[I 2022-04-23 05:49:16,634][0m Trial 973 finished with value: 0.7270268181933457 and parameters: {'n_hidden': 256, 'mixture_components': 4, 'use_sparse_layer': True, 'use_sparse_loss': True, 'lmbd': 0.004067161854794373, 'use_batchnorm': True, 'use_dropout': True, 'dropout': 0.6268407669316945, 'mlp_size_1': 0, 'mlp_size_2': 5, 'mlp_size_3': 0, 'kernel': 'LogLogistic', 'loss_name': 'CensoredNLLLoss'}. Best is trial 22 with value: 0.8433318468070169.[0m
[32m[I 2022-04-23 05:51:45,981][0m Trial 974 finished with value: 0.7424308895005032 and parameters: {'n_hidden': 256, 'mixture_components': 4, 'use_sparse_layer': False, 'use_batchnorm': True, 'use_dropout': True, 'dropout': 0.6575250168752388, 'mlp_size_1': 0, 'mlp_size_2': 5, 'mlp_size_3': 0, 'kernel': 'LogLogistic', 'loss_name': 'CensoredNLLLoss'}. Best is trial 22 with value: 0.8433318468070169.[0m
[32m[I 2022-04-23 05:55:09,619][0m Trial 975 finished with value: 0.8259830769831928 and parameters: {'n_hidden': 256, 'mixture_components': 6, 'use_sparse_layer': True, 'use_sparse_loss': True, 'lmbd': 0.031648223909130906, 'use_batchnorm': True, 'use_dropout': True, 'dropout': 0.596285168300342, 'mlp_size_1': 0, 'mlp_size_2': 5, 'mlp_size_3': 0, 'kernel': 'Normal', 'loss_name': 'CensoredNLLLoss'}. Best is trial 22 with value: 0.8433318468070169.[0m
[32m[I 2022-04-23 05:56:15,436][0m Trial 976 finished with value: -0.04070938112100932 and parameters: {'n_hidden': 1024, 'mixture_components': 5, 'use_sparse_layer': False, 'use_batchnorm': True, 'use_dropout': True, 'dropout': 0.10350864291798421, 'mlp_size_1': 1, 'mlp_size_2': 5, 'mlp_size_3': 1, 'kernel': 'Gumbel', 'loss_name': 'AlternativeNLLLoss'}. Best is trial 22 with value: 0.8433318468070169.[0m
[32m[I 2022-04-23 05:58:55,330][0m Trial 977 finished with value: 0.838338201760215 and parameters: {'n_hidden': 256, 'mixture_components': 6, 'use_sparse_layer': True, 'use_sparse_loss': True, 'lmbd': 0.001709745555371093, 'use_batchnorm': True, 'use_dropout': True, 'dropout': 0.5634546220054397, 'mlp_size_1': 0, 'mlp_size_2': 5, 'mlp_size_3': 0, 'kernel': 'Logistic', 'loss_name': 'CensoredNLLLoss'}. Best is trial 22 with value: 0.8433318468070169.[0m
[32m[I 2022-04-23 06:01:38,382][0m Trial 978 finished with value: 0.7317858724323875 and parameters: {'n_hidden': 256, 'mixture_components': 5, 'use_sparse_layer': True, 'use_sparse_loss': True, 'lmbd': 0.0010313553478264836, 'use_batchnorm': True, 'use_dropout': True, 'dropout': 0.5134772938763159, 'mlp_size_1': 0, 'mlp_size_2': 5, 'mlp_size_3': 0, 'kernel': 'Logistic', 'loss_name': 'CensoredNLLLoss'}. Best is trial 22 with value: 0.8433318468070169.[0m
[32m[I 2022-04-23 06:03:55,135][0m Trial 979 finished with value: 0.6361015788540507 and parameters: {'n_hidden': 256, 'mixture_components': 4, 'use_sparse_layer': False, 'use_batchnorm': True, 'use_dropout': True, 'dropout': 0.5475751036678451, 'mlp_size_1': 0, 'mlp_size_2': 5, 'mlp_size_3': 0, 'kernel': 'Logistic', 'loss_name': 'CensoredNLLLoss'}. Best is trial 22 with value: 0.8433318468070169.[0m
[32m[I 2022-04-23 06:06:58,333][0m Trial 980 finished with value: 0.6309547879305815 and parameters: {'n_hidden': 256, 'mixture_components': 6, 'use_sparse_layer': True, 'use_sparse_loss': True, 'lmbd': 0.0017737826678370643, 'use_batchnorm': True, 'use_dropout': True, 'dropout': 0.5521968831492395, 'mlp_size_1': 3, 'mlp_size_2': 2, 'mlp_size_3': 0, 'kernel': 'Logistic', 'loss_name': 'CensoredNLLLoss'}. Best is trial 22 with value: 0.8433318468070169.[0m
[32m[I 2022-04-23 06:09:39,822][0m Trial 981 finished with value: 0.7251283115077064 and parameters: {'n_hidden': 256, 'mixture_components': 3, 'use_sparse_layer': True, 'use_sparse_loss': True, 'lmbd': 0.0007154847263632365, 'use_batchnorm': True, 'use_dropout': True, 'dropout': 0.5259612147068157, 'mlp_size_1': 0, 'mlp_size_2': 5, 'mlp_size_3': 0, 'kernel': 'Logistic', 'loss_name': 'CensoredNLLLoss'}. Best is trial 22 with value: 0.8433318468070169.[0m
