[32m[I 2022-04-21 11:40:25,296][0m Trial 642 finished with value: 0.842183674410227 and parameters: {'alpha': 0.6318296854646595, 'ties': 'breslow'}. Best is trial 13 with value: 0.8423527006348241.[0m
[32m[I 2022-04-21 11:40:25,436][0m Trial 643 finished with value: 0.8407234838742553 and parameters: {'alpha': 4.13118649640558, 'ties': 'breslow'}. Best is trial 13 with value: 0.8423527006348241.[0m
[32m[I 2022-04-21 11:40:25,576][0m Trial 644 finished with value: 0.842183674410227 and parameters: {'alpha': 0.26979515508774304, 'ties': 'breslow'}. Best is trial 13 with value: 0.8423527006348241.[0m
[32m[I 2022-04-21 11:40:25,762][0m Trial 645 finished with value: 0.842183674410227 and parameters: {'alpha': 0.5666707449420434, 'ties': 'breslow'}. Best is trial 13 with value: 0.8423527006348241.[0m
[32m[I 2022-04-21 11:40:25,985][0m Trial 646 finished with value: 0.842183674410227 and parameters: {'alpha': 0.47345669647745436, 'ties': 'breslow'}. Best is trial 13 with value: 0.8423527006348241.[0m
[32m[I 2022-04-21 11:40:26,124][0m Trial 647 finished with value: 0.842183674410227 and parameters: {'alpha': 0.6541699565625073, 'ties': 'breslow'}. Best is trial 13 with value: 0.8423527006348241.[0m
[32m[I 2022-04-21 11:40:26,278][0m Trial 648 finished with value: 0.8423527006348241 and parameters: {'alpha': 0.7075389388694737, 'ties': 'efron'}. Best is trial 13 with value: 0.8423527006348241.[0m
[32m[I 2022-04-21 11:40:26,431][0m Trial 649 finished with value: 0.8414545406933376 and parameters: {'alpha': 1.1514471827480608, 'ties': 'efron'}. Best is trial 13 with value: 0.8423527006348241.[0m
[32m[I 2022-04-21 11:40:26,585][0m Trial 650 finished with value: 0.8423527006348241 and parameters: {'alpha': 0.7258772047609917, 'ties': 'efron'}. Best is trial 13 with value: 0.8423527006348241.[0m
[32m[I 2022-04-21 11:40:26,738][0m Trial 651 finished with value: 0.8414545406933376 and parameters: {'alpha': 0.9403786575540478, 'ties': 'efron'}. Best is trial 13 with value: 0.8423527006348241.[0m
[32m[I 2022-04-21 11:40:26,971][0m Trial 652 finished with value: 0.8423527006348241 and parameters: {'alpha': 0.8979432286604051, 'ties': 'breslow'}. Best is trial 13 with value: 0.8423527006348241.[0m
[32m[I 2022-04-21 11:40:27,262][0m Trial 653 finished with value: 0.8414545406933376 and parameters: {'alpha': 1.0537756062701227, 'ties': 'breslow'}. Best is trial 13 with value: 0.8423527006348241.[0m
[32m[I 2022-04-21 11:40:27,543][0m Trial 654 finished with value: 0.8414545406933376 and parameters: {'alpha': 1.1740497697521612, 'ties': 'breslow'}. Best is trial 13 with value: 0.8423527006348241.[0m
[32m[I 2022-04-21 11:40:27,700][0m Trial 655 finished with value: 0.8423527006348241 and parameters: {'alpha': 0.7030119327649337, 'ties': 'breslow'}. Best is trial 13 with value: 0.8423527006348241.[0m
[32m[I 2022-04-21 11:40:27,972][0m Trial 656 finished with value: 0.842183674410227 and parameters: {'alpha': 0.4614403876157533, 'ties': 'breslow'}. Best is trial 13 with value: 0.8423527006348241.[0m
[32m[I 2022-04-21 11:40:28,254][0m Trial 657 finished with value: 0.842183674410227 and parameters: {'alpha': 0.6013911869191914, 'ties': 'breslow'}. Best is trial 13 with value: 0.8423527006348241.[0m
[32m[I 2022-04-21 11:40:28,657][0m Trial 658 finished with value: 0.842183674410227 and parameters: {'alpha': 0.5609132396602355, 'ties': 'efron'}. Best is trial 13 with value: 0.8423527006348241.[0m
[32m[I 2022-04-21 11:40:29,112][0m Trial 659 finished with value: 0.8423527006348241 and parameters: {'alpha': 0.8203229727227881, 'ties': 'efron'}. Best is trial 13 with value: 0.8423527006348241.[0m
[32m[I 2022-04-21 11:40:29,439][0m Trial 660 finished with value: 0.8413067259961411 and parameters: {'alpha': 2.2211879663074736, 'ties': 'efron'}. Best is trial 13 with value: 0.8423527006348241.[0m
[32m[I 2022-04-21 11:40:29,698][0m Trial 661 finished with value: 0.8423527006348241 and parameters: {'alpha': 0.8337571946861636, 'ties': 'breslow'}. Best is trial 13 with value: 0.8423527006348241.[0m
[32m[I 2022-04-21 11:40:30,071][0m Trial 662 finished with value: 0.8423527006348241 and parameters: {'alpha': 0.7948421557035261, 'ties': 'efron'}. Best is trial 13 with value: 0.8423527006348241.[0m
[32m[I 2022-04-21 11:40:30,388][0m Trial 663 finished with value: 0.8414545406933376 and parameters: {'alpha': 0.9925382172411563, 'ties': 'efron'}. Best is trial 13 with value: 0.8423527006348241.[0m
[32m[I 2022-04-21 11:40:30,785][0m Trial 664 finished with value: 0.8423527006348241 and parameters: {'alpha': 0.7670147895431084, 'ties': 'breslow'}. Best is trial 13 with value: 0.8423527006348241.[0m
[32m[I 2022-04-21 11:40:31,261][0m Trial 665 finished with value: 0.8414545406933376 and parameters: {'alpha': 0.9458800779305923, 'ties': 'efron'}. Best is trial 13 with value: 0.8423527006348241.[0m
[32m[I 2022-04-21 11:40:31,710][0m Trial 666 finished with value: 0.842183674410227 and parameters: {'alpha': 0.6709446329369042, 'ties': 'breslow'}. Best is trial 13 with value: 0.8423527006348241.[0m
[32m[I 2022-04-21 11:40:32,188][0m Trial 667 finished with value: 0.8423527006348241 and parameters: {'alpha': 0.8507340092271628, 'ties': 'breslow'}. Best is trial 13 with value: 0.8423527006348241.[0m
[32m[I 2022-04-21 11:40:32,497][0m Trial 668 finished with value: 0.8414545406933376 and parameters: {'alpha': 1.0504888168017172, 'ties': 'breslow'}. Best is trial 13 with value: 0.8423527006348241.[0m
[32m[I 2022-04-21 11:40:32,832][0m Trial 669 finished with value: 0.842183674410227 and parameters: {'alpha': 0.6667655938995697, 'ties': 'efron'}. Best is trial 13 with value: 0.8423527006348241.[0m
[32m[I 2022-04-21 11:40:32,984][0m Trial 670 finished with value: 0.842183674410227 and parameters: {'alpha': 0.5591838728732759, 'ties': 'efron'}. Best is trial 13 with value: 0.8423527006348241.[0m
[32m[I 2022-04-21 11:40:33,185][0m Trial 671 finished with value: 0.8414545406933376 and parameters: {'alpha': 0.8744383036969554, 'ties': 'efron'}. Best is trial 13 with value: 0.8423527006348241.[0m
[32m[I 2022-04-21 11:40:33,377][0m Trial 672 finished with value: 0.8414545406933376 and parameters: {'alpha': 1.1401094067934998, 'ties': 'breslow'}. Best is trial 13 with value: 0.8423527006348241.[0m
[32m[I 2022-04-21 11:40:33,517][0m Trial 673 finished with value: 0.8414545406933376 and parameters: {'alpha': 0.9696333580457044, 'ties': 'breslow'}. Best is trial 13 with value: 0.8423527006348241.[0m
[32m[I 2022-04-21 11:40:33,727][0m Trial 674 finished with value: 0.842183674410227 and parameters: {'alpha': 0.37207534760166805, 'ties': 'efron'}. Best is trial 13 with value: 0.8423527006348241.[0m
[32m[I 2022-04-21 11:40:33,902][0m Trial 675 finished with value: 0.8423527006348241 and parameters: {'alpha': 0.781304077231237, 'ties': 'efron'}. Best is trial 13 with value: 0.8423527006348241.[0m
[32m[I 2022-04-21 11:40:34,043][0m Trial 676 finished with value: 0.8414545406933376 and parameters: {'alpha': 1.4829807577805985, 'ties': 'breslow'}. Best is trial 13 with value: 0.8423527006348241.[0m
[32m[I 2022-04-21 11:40:34,255][0m Trial 677 finished with value: 0.8414545406933376 and parameters: {'alpha': 0.9395025358860675, 'ties': 'breslow'}. Best is trial 13 with value: 0.8423527006348241.[0m
[32m[I 2022-04-21 11:40:34,421][0m Trial 678 finished with value: 0.8423527006348241 and parameters: {'alpha': 0.900697333089822, 'ties': 'breslow'}. Best is trial 13 with value: 0.8423527006348241.[0m
[32m[I 2022-04-21 11:40:34,564][0m Trial 679 finished with value: 0.8414545406933376 and parameters: {'alpha': 1.0630936249189336, 'ties': 'breslow'}. Best is trial 13 with value: 0.8423527006348241.[0m
[32m[I 2022-04-21 11:40:34,754][0m Trial 680 finished with value: 0.8423527006348241 and parameters: {'alpha': 0.7369929575638412, 'ties': 'efron'}. Best is trial 13 with value: 0.8423527006348241.[0m
[32m[I 2022-04-21 11:40:35,059][0m Trial 681 finished with value: 0.8423527006348241 and parameters: {'alpha': 0.8318778064574733, 'ties': 'breslow'}. Best is trial 13 with value: 0.8423527006348241.[0m
[32m[I 2022-04-21 11:40:35,255][0m Trial 682 finished with value: 0.8423527006348241 and parameters: {'alpha': 0.9118475064173929, 'ties': 'breslow'}. Best is trial 13 with value: 0.8423527006348241.[0m
[32m[I 2022-04-21 11:40:35,567][0m Trial 683 finished with value: 0.8414545406933376 and parameters: {'alpha': 1.0624009134508376, 'ties': 'breslow'}. Best is trial 13 with value: 0.8423527006348241.[0m
[32m[I 2022-04-21 11:40:35,759][0m Trial 684 finished with value: 0.8423527006348241 and parameters: {'alpha': 0.7715691199772592, 'ties': 'breslow'}. Best is trial 13 with value: 0.8423527006348241.[0m
[32m[I 2022-04-21 11:40:36,109][0m Trial 685 finished with value: 0.8423527006348241 and parameters: {'alpha': 0.7819509709710115, 'ties': 'efron'}. Best is trial 13 with value: 0.8423527006348241.[0m
[32m[I 2022-04-21 11:40:36,551][0m Trial 686 finished with value: 0.8423527006348241 and parameters: {'alpha': 0.8262799651775788, 'ties': 'efron'}. Best is trial 13 with value: 0.8423527006348241.[0m
[32m[I 2022-04-21 11:40:36,880][0m Trial 687 finished with value: 0.841474844739692 and parameters: {'alpha': 2.582756891186781, 'ties': 'efron'}. Best is trial 13 with value: 0.8423527006348241.[0m
[32m[I 2022-04-21 11:40:37,077][0m Trial 688 finished with value: 0.842183674410227 and parameters: {'alpha': 0.6491573734957456, 'ties': 'breslow'}. Best is trial 13 with value: 0.8423527006348241.[0m
[32m[I 2022-04-21 11:40:37,376][0m Trial 689 finished with value: 0.8414545406933376 and parameters: {'alpha': 0.8724953728319266, 'ties': 'efron'}. Best is trial 13 with value: 0.8423527006348241.[0m
[32m[I 2022-04-21 11:40:37,593][0m Trial 690 finished with value: 0.842183674410227 and parameters: {'alpha': 0.5658486869124437, 'ties': 'breslow'}. Best is trial 13 with value: 0.8423527006348241.[0m
[32m[I 2022-04-21 11:40:37,776][0m Trial 691 finished with value: 0.8423527006348241 and parameters: {'alpha': 0.8619384162133931, 'ties': 'efron'}. Best is trial 13 with value: 0.8423527006348241.[0m
[32m[I 2022-04-21 11:40:37,916][0m Trial 692 finished with value: 0.8407234838742553 and parameters: {'alpha': 4.506048213314363, 'ties': 'breslow'}. Best is trial 13 with value: 0.8423527006348241.[0m
[32m[I 2022-04-21 11:40:38,066][0m Trial 693 finished with value: 0.8414545406933376 and parameters: {'alpha': 1.0024625571798913, 'ties': 'efron'}. Best is trial 13 with value: 0.8423527006348241.[0m
[32m[I 2022-04-21 11:40:38,216][0m Trial 694 finished with value: 0.842183674410227 and parameters: {'alpha': 0.4721835644773921, 'ties': 'efron'}. Best is trial 13 with value: 0.8423527006348241.[0m
[32m[I 2022-04-21 11:40:38,368][0m Trial 695 finished with value: 0.842183674410227 and parameters: {'alpha': 0.6876948167371357, 'ties': 'efron'}. Best is trial 13 with value: 0.8423527006348241.[0m
[32m[I 2022-04-21 11:40:38,572][0m Trial 696 finished with value: 0.842183674410227 and parameters: {'alpha': 0.6576459090496991, 'ties': 'efron'}. Best is trial 13 with value: 0.8423527006348241.[0m
[32m[I 2022-04-21 11:40:38,728][0m Trial 697 finished with value: 0.8414545406933376 and parameters: {'alpha': 0.9289589090301714, 'ties': 'efron'}. Best is trial 13 with value: 0.8423527006348241.[0m
[32m[I 2022-04-21 11:40:38,957][0m Trial 698 finished with value: 0.842183674410227 and parameters: {'alpha': 0.6092588536296007, 'ties': 'efron'}. Best is trial 13 with value: 0.8423527006348241.[0m
[32m[I 2022-04-21 11:40:39,112][0m Trial 699 finished with value: 0.8423527006348241 and parameters: {'alpha': 0.756829583936998, 'ties': 'efron'}. Best is trial 13 with value: 0.8423527006348241.[0m
[32m[I 2022-04-21 11:40:39,402][0m Trial 700 finished with value: 0.8423527006348241 and parameters: {'alpha': 0.7202424293313938, 'ties': 'efron'}. Best is trial 13 with value: 0.8423527006348241.[0m
[32m[I 2022-04-21 11:40:39,644][0m Trial 701 finished with value: 0.842183674410227 and parameters: {'alpha': 0.4994580928823922, 'ties': 'efron'}. Best is trial 13 with value: 0.8423527006348241.[0m
[32m[I 2022-04-21 11:40:39,964][0m Trial 702 finished with value: 0.8414545406933376 and parameters: {'alpha': 0.9854556874653225, 'ties': 'breslow'}. Best is trial 13 with value: 0.8423527006348241.[0m
[32m[I 2022-04-21 11:40:40,263][0m Trial 703 finished with value: 0.8423527006348241 and parameters: {'alpha': 0.8296792139157672, 'ties': 'breslow'}. Best is trial 13 with value: 0.8423527006348241.[0m
[32m[I 2022-04-21 11:40:40,405][0m Trial 704 finished with value: 0.8414545406933376 and parameters: {'alpha': 1.027345069977111, 'ties': 'breslow'}. Best is trial 13 with value: 0.8423527006348241.[0m
[32m[I 2022-04-21 11:40:40,561][0m Trial 705 finished with value: 0.8423527006348241 and parameters: {'alpha': 0.7002281762687165, 'ties': 'efron'}. Best is trial 13 with value: 0.8423527006348241.[0m
[32m[I 2022-04-21 11:40:40,851][0m Trial 706 finished with value: 0.842183674410227 and parameters: {'alpha': 0.6151813724776054, 'ties': 'efron'}. Best is trial 13 with value: 0.8423527006348241.[0m
[32m[I 2022-04-21 11:40:40,994][0m Trial 707 finished with value: 0.8407234838742553 and parameters: {'alpha': 3.5105155363074823, 'ties': 'breslow'}. Best is trial 13 with value: 0.8423527006348241.[0m
[32m[I 2022-04-21 11:40:41,142][0m Trial 708 finished with value: 0.8414545406933376 and parameters: {'alpha': 1.2432360728936482, 'ties': 'breslow'}. Best is trial 13 with value: 0.8423527006348241.[0m
[32m[I 2022-04-21 11:40:41,460][0m Trial 709 finished with value: 0.8423527006348241 and parameters: {'alpha': 0.8433739871915442, 'ties': 'efron'}. Best is trial 13 with value: 0.8423527006348241.[0m
[32m[I 2022-04-21 11:40:41,883][0m Trial 710 finished with value: 0.8423527006348241 and parameters: {'alpha': 0.8224261558697652, 'ties': 'efron'}. Best is trial 13 with value: 0.8423527006348241.[0m
[32m[I 2022-04-21 11:40:42,299][0m Trial 711 finished with value: 0.8414545406933376 and parameters: {'alpha': 0.9494149459984729, 'ties': 'efron'}. Best is trial 13 with value: 0.8423527006348241.[0m
[32m[I 2022-04-21 11:40:42,693][0m Trial 712 finished with value: 0.8414545406933376 and parameters: {'alpha': 1.1380256942356073, 'ties': 'breslow'}. Best is trial 13 with value: 0.8423527006348241.[0m
[32m[I 2022-04-21 11:40:43,085][0m Trial 713 finished with value: 0.8423527006348241 and parameters: {'alpha': 0.7376821802250958, 'ties': 'breslow'}. Best is trial 13 with value: 0.8423527006348241.[0m
[32m[I 2022-04-21 11:40:43,437][0m Trial 714 finished with value: 0.8414545406933376 and parameters: {'alpha': 1.0699155301690346, 'ties': 'breslow'}. Best is trial 13 with value: 0.8423527006348241.[0m
[32m[I 2022-04-21 11:40:43,788][0m Trial 715 finished with value: 0.8423527006348241 and parameters: {'alpha': 0.7097807990915806, 'ties': 'breslow'}. Best is trial 13 with value: 0.8423527006348241.[0m
[32m[I 2022-04-21 11:40:44,196][0m Trial 716 finished with value: 0.8414545406933376 and parameters: {'alpha': 0.9362644405236356, 'ties': 'efron'}. Best is trial 13 with value: 0.8423527006348241.[0m
[32m[I 2022-04-21 11:40:44,564][0m Trial 717 finished with value: 0.842183674410227 and parameters: {'alpha': 0.4112005345096897, 'ties': 'breslow'}. Best is trial 13 with value: 0.8423527006348241.[0m
[32m[I 2022-04-21 11:40:45,110][0m Trial 718 finished with value: 0.842183674410227 and parameters: {'alpha': 0.6202626648735342, 'ties': 'breslow'}. Best is trial 13 with value: 0.8423527006348241.[0m
[32m[I 2022-04-21 11:40:45,353][0m Trial 719 finished with value: 0.8423527006348241 and parameters: {'alpha': 0.7716522328230208, 'ties': 'efron'}. Best is trial 13 with value: 0.8423527006348241.[0m
[32m[I 2022-04-21 11:40:45,637][0m Trial 720 finished with value: 0.8423527006348241 and parameters: {'alpha': 0.7494624506474117, 'ties': 'breslow'}. Best is trial 13 with value: 0.8423527006348241.[0m
[32m[I 2022-04-21 11:40:45,911][0m Trial 721 finished with value: 0.8423527006348241 and parameters: {'alpha': 0.7460122838908991, 'ties': 'breslow'}. Best is trial 13 with value: 0.8423527006348241.[0m
[32m[I 2022-04-21 11:40:46,140][0m Trial 722 finished with value: 0.842183674410227 and parameters: {'alpha': 0.5493071339452046, 'ties': 'breslow'}. Best is trial 13 with value: 0.8423527006348241.[0m
[32m[I 2022-04-21 11:40:46,522][0m Trial 723 finished with value: 0.842183674410227 and parameters: {'alpha': 0.6591817740898821, 'ties': 'breslow'}. Best is trial 13 with value: 0.8423527006348241.[0m
[32m[I 2022-04-21 11:40:46,743][0m Trial 724 finished with value: 0.8423527006348241 and parameters: {'alpha': 0.8850752601154258, 'ties': 'breslow'}. Best is trial 13 with value: 0.8423527006348241.[0m
[32m[I 2022-04-21 11:40:47,028][0m Trial 725 finished with value: 0.8423527006348241 and parameters: {'alpha': 0.84974064578135, 'ties': 'efron'}. Best is trial 13 with value: 0.8423527006348241.[0m
[32m[I 2022-04-21 11:40:47,450][0m Trial 726 finished with value: 0.8414545406933376 and parameters: {'alpha': 0.9134446456641316, 'ties': 'efron'}. Best is trial 13 with value: 0.8423527006348241.[0m
[32m[I 2022-04-21 11:40:47,829][0m Trial 727 finished with value: 0.8414545406933376 and parameters: {'alpha': 0.9674437401900904, 'ties': 'breslow'}. Best is trial 13 with value: 0.8423527006348241.[0m
[32m[I 2022-04-21 11:40:48,088][0m Trial 728 finished with value: 0.8423527006348241 and parameters: {'alpha': 0.9137099109086325, 'ties': 'breslow'}. Best is trial 13 with value: 0.8423527006348241.[0m
[32m[I 2022-04-21 11:40:48,356][0m Trial 729 finished with value: 0.8423527006348241 and parameters: {'alpha': 0.8034597691584333, 'ties': 'efron'}. Best is trial 13 with value: 0.8423527006348241.[0m
[32m[I 2022-04-21 11:40:48,610][0m Trial 730 finished with value: 0.8414545406933376 and parameters: {'alpha': 1.0130645948745918, 'ties': 'efron'}. Best is trial 13 with value: 0.8423527006348241.[0m
[32m[I 2022-04-21 11:40:48,871][0m Trial 731 finished with value: 0.8423527006348241 and parameters: {'alpha': 0.7881139930163433, 'ties': 'breslow'}. Best is trial 13 with value: 0.8423527006348241.[0m
[32m[I 2022-04-21 11:40:49,141][0m Trial 732 finished with value: 0.842183674410227 and parameters: {'alpha': 0.5461438606292466, 'ties': 'efron'}. Best is trial 13 with value: 0.8423527006348241.[0m
[32m[I 2022-04-21 11:40:49,433][0m Trial 733 finished with value: 0.842183674410227 and parameters: {'alpha': 0.6177734784336165, 'ties': 'breslow'}. Best is trial 13 with value: 0.8423527006348241.[0m
[32m[I 2022-04-21 11:40:49,796][0m Trial 734 finished with value: 0.8423527006348241 and parameters: {'alpha': 0.7909994629800101, 'ties': 'breslow'}. Best is trial 13 with value: 0.8423527006348241.[0m
[32m[I 2022-04-21 11:40:50,238][0m Trial 735 finished with value: 0.8423527006348241 and parameters: {'alpha': 0.8507174345828268, 'ties': 'breslow'}. Best is trial 13 with value: 0.8423527006348241.[0m
[32m[I 2022-04-21 11:40:50,635][0m Trial 736 finished with value: 0.842183674410227 and parameters: {'alpha': 0.5458714398047467, 'ties': 'breslow'}. Best is trial 13 with value: 0.8423527006348241.[0m
[32m[I 2022-04-21 11:40:50,999][0m Trial 737 finished with value: 0.842183674410227 and parameters: {'alpha': 0.6760114631562775, 'ties': 'breslow'}. Best is trial 13 with value: 0.8423527006348241.[0m
[32m[I 2022-04-21 11:40:51,284][0m Trial 738 finished with value: 0.8418138046699323 and parameters: {'alpha': 2.1031425935739407, 'ties': 'breslow'}. Best is trial 13 with value: 0.8423527006348241.[0m
[32m[I 2022-04-21 11:40:51,585][0m Trial 739 finished with value: 0.8423527006348241 and parameters: {'alpha': 0.7420100685456703, 'ties': 'breslow'}. Best is trial 13 with value: 0.8423527006348241.[0m
[32m[I 2022-04-21 11:40:51,811][0m Trial 740 finished with value: 0.842183674410227 and parameters: {'alpha': 0.6643816371232878, 'ties': 'breslow'}. Best is trial 13 with value: 0.8423527006348241.[0m
[32m[I 2022-04-21 11:40:51,962][0m Trial 741 finished with value: 0.8423527006348241 and parameters: {'alpha': 0.8600946976807258, 'ties': 'breslow'}. Best is trial 13 with value: 0.8423527006348241.[0m
[32m[I 2022-04-21 11:40:52,198][0m Trial 742 finished with value: 0.8414545406933376 and parameters: {'alpha': 1.1130344254877622, 'ties': 'breslow'}. Best is trial 13 with value: 0.8423527006348241.[0m
[32m[I 2022-04-21 11:40:52,402][0m Trial 743 finished with value: 0.8423527006348241 and parameters: {'alpha': 0.8098814046468783, 'ties': 'breslow'}. Best is trial 13 with value: 0.8423527006348241.[0m
[32m[I 2022-04-21 11:40:52,601][0m Trial 744 finished with value: 0.8414545406933376 and parameters: {'alpha': 0.9946163908280494, 'ties': 'breslow'}. Best is trial 13 with value: 0.8423527006348241.[0m
[32m[I 2022-04-21 11:40:52,772][0m Trial 745 finished with value: 0.842183674410227 and parameters: {'alpha': 0.3260521673211848, 'ties': 'breslow'}. Best is trial 13 with value: 0.8423527006348241.[0m
[32m[I 2022-04-21 11:40:53,170][0m Trial 746 finished with value: 0.8414545406933376 and parameters: {'alpha': 0.9493764752130381, 'ties': 'breslow'}. Best is trial 13 with value: 0.8423527006348241.[0m
[32m[I 2022-04-21 11:40:53,499][0m Trial 747 finished with value: 0.842183674410227 and parameters: {'alpha': 0.4626156545836848, 'ties': 'efron'}. Best is trial 13 with value: 0.8423527006348241.[0m
[32m[I 2022-04-21 11:40:53,691][0m Trial 748 finished with value: 0.8423527006348241 and parameters: {'alpha': 0.9271719987833447, 'ties': 'breslow'}. Best is trial 13 with value: 0.8423527006348241.[0m
