[32m[I 2022-04-21 20:35:25,977][0m Trial 886 finished with value: 0.8459636989109768 and parameters: {'loss': 'coxph', 'learning_rate': 0.0005400628115992775, 'n_estimators': 259, 'criterion': 'friedman_mse', 'min_samples_split': 2, 'min_samples_leaf': 1, 'min_weight_fraction_leaf': 0.10662142321827588, 'min_impurity_decrease': 0.16269945913901293, 'max_features': 0.07158045754418355, 'subsample': 0.041365247414457046, 'dropout_rate': 0.9558491644254302, 'ccp_alpha': 0.15889833819753724}. Best is trial 802 with value: 0.8492679411913457.[0m
[32m[I 2022-04-21 20:35:27,427][0m Trial 887 finished with value: 0.8415150372336295 and parameters: {'loss': 'coxph', 'learning_rate': 0.0002535047192408956, 'n_estimators': 176, 'criterion': 'friedman_mse', 'min_samples_split': 2, 'min_samples_leaf': 1, 'min_weight_fraction_leaf': 0.09227177829521652, 'min_impurity_decrease': 0.1844878373979578, 'max_features': 0.021848056149717104, 'subsample': 0.018456125987147264, 'dropout_rate': 0.9728294475371442, 'ccp_alpha': 0.25456404580963193}. Best is trial 802 with value: 0.8492679411913457.[0m
[32m[I 2022-04-21 20:35:31,317][0m Trial 888 finished with value: 0.65 and parameters: {'loss': 'coxph', 'learning_rate': 0.0003526642020914748, 'n_estimators': 277, 'criterion': 'friedman_mse', 'min_samples_split': 2, 'min_samples_leaf': 1, 'min_weight_fraction_leaf': 0.07104915226500373, 'min_impurity_decrease': 0.21002242891320272, 'max_features': 0.05661362254404588, 'subsample': 0.0011095643783016057, 'dropout_rate': 0.9803470917789563, 'ccp_alpha': 0.09235490214866512}. Best is trial 802 with value: 0.8492679411913457.[0m
/media/san2_ssd/data/Workdir/survival/venv/lib/python3.8/site-packages/sksurv/ensemble/boosting.py:955: RuntimeWarning: divide by zero encountered in log
  time = numpy.log(time)
/media/san2_ssd/data/Workdir/survival/venv/lib/python3.8/site-packages/sksurv/ensemble/boosting.py:955: RuntimeWarning: divide by zero encountered in log
  time = numpy.log(time)
/media/san2_ssd/data/Workdir/survival/venv/lib/python3.8/site-packages/sksurv/ensemble/boosting.py:955: RuntimeWarning: divide by zero encountered in log
  time = numpy.log(time)
/media/san2_ssd/data/Workdir/survival/venv/lib/python3.8/site-packages/sksurv/ensemble/boosting.py:955: RuntimeWarning: divide by zero encountered in log
  time = numpy.log(time)
[32m[I 2022-04-21 20:35:31,838][0m Trial 889 finished with value: -0.46613378432860025 and parameters: {'loss': 'squared', 'learning_rate': 0.00023308973252785843, 'n_estimators': 291, 'criterion': 'absolute_error', 'min_samples_split': 2, 'min_samples_leaf': 1, 'min_weight_fraction_leaf': 0.10673653290464186, 'min_impurity_decrease': 0.2279276431244066, 'max_features': 0.1565580073592008, 'subsample': 0.05526604681379088, 'dropout_rate': 0.9804825846823476, 'ccp_alpha': 0.16009138850061583}. Best is trial 802 with value: 0.8492679411913457.[0m
[32m[I 2022-04-21 20:35:34,275][0m Trial 890 finished with value: 0.840299617668195 and parameters: {'loss': 'coxph', 'learning_rate': 0.0008650508371366772, 'n_estimators': 246, 'criterion': 'friedman_mse', 'min_samples_split': 2, 'min_samples_leaf': 1, 'min_weight_fraction_leaf': 0.09856747919310099, 'min_impurity_decrease': 0.1912329819185036, 'max_features': 0.12322881966335872, 'subsample': 0.03687802481620034, 'dropout_rate': 0.985580353350285, 'ccp_alpha': 0.29368984807981274}. Best is trial 802 with value: 0.8492679411913457.[0m
[32m[I 2022-04-21 20:35:40,617][0m Trial 891 finished with value: 0.8425854704576722 and parameters: {'loss': 'coxph', 'learning_rate': 0.0004868476339939704, 'n_estimators': 268, 'criterion': 'friedman_mse', 'min_samples_split': 2, 'min_samples_leaf': 1, 'min_weight_fraction_leaf': 0.08519186380419495, 'min_impurity_decrease': 0.1553365570880628, 'max_features': 0.0750492811809858, 'subsample': 0.0464914625319782, 'dropout_rate': 0.9362996926673602, 'ccp_alpha': 0.4691387684480052}. Best is trial 802 with value: 0.8492679411913457.[0m
[32m[I 2022-04-21 20:35:42,117][0m Trial 892 finished with value: 0.8447847632748937 and parameters: {'loss': 'coxph', 'learning_rate': 0.0006653520129027525, 'n_estimators': 171, 'criterion': 'friedman_mse', 'min_samples_split': 2, 'min_samples_leaf': 1, 'min_weight_fraction_leaf': 0.10198383490087129, 'min_impurity_decrease': 0.2073675175545947, 'max_features': 0.10219239812789996, 'subsample': 0.05889612071886284, 'dropout_rate': 0.9996432623148548, 'ccp_alpha': 0.0920823767627568}. Best is trial 802 with value: 0.8492679411913457.[0m
[32m[I 2022-04-21 20:35:48,283][0m Trial 893 finished with value: 0.8478857685110036 and parameters: {'loss': 'coxph', 'learning_rate': 0.00037327661937045366, 'n_estimators': 257, 'criterion': 'friedman_mse', 'min_samples_split': 2, 'min_samples_leaf': 1, 'min_weight_fraction_leaf': 0.0763483575849575, 'min_impurity_decrease': 0.17648622891423224, 'max_features': 0.043112875466992856, 'subsample': 0.020933673618731646, 'dropout_rate': 0.8954345828307914, 'ccp_alpha': 0.2277069189441551}. Best is trial 802 with value: 0.8492679411913457.[0m
[32m[I 2022-04-21 20:35:51,732][0m Trial 894 finished with value: 0.8381001538603684 and parameters: {'loss': 'coxph', 'learning_rate': 0.0003513421275608566, 'n_estimators': 255, 'criterion': 'friedman_mse', 'min_samples_split': 2, 'min_samples_leaf': 1, 'min_weight_fraction_leaf': 0.06218597247157179, 'min_impurity_decrease': 0.17040721805496495, 'max_features': 0.04095581903853929, 'subsample': 0.01969162538670147, 'dropout_rate': 0.9078018655497895, 'ccp_alpha': 0.39838252941199326}. Best is trial 802 with value: 0.8492679411913457.[0m
[32m[I 2022-04-21 20:35:55,163][0m Trial 895 finished with value: 0.65 and parameters: {'loss': 'coxph', 'learning_rate': 0.00044280499245282005, 'n_estimators': 250, 'criterion': 'friedman_mse', 'min_samples_split': 2, 'min_samples_leaf': 1, 'min_weight_fraction_leaf': 0.06208049091931076, 'min_impurity_decrease': 0.15570093994092127, 'max_features': 0.03015248431280034, 'subsample': 0.0012141679616742042, 'dropout_rate': 0.957442182690356, 'ccp_alpha': 0.26457374041509296}. Best is trial 802 with value: 0.8492679411913457.[0m
[32m[I 2022-04-21 20:35:59,003][0m Trial 896 finished with value: 0.8450602881779492 and parameters: {'loss': 'coxph', 'learning_rate': 0.00038674896148829986, 'n_estimators': 239, 'criterion': 'friedman_mse', 'min_samples_split': 2, 'min_samples_leaf': 1, 'min_weight_fraction_leaf': 0.08176381775429259, 'min_impurity_decrease': 0.12884584924283093, 'max_features': 0.0735780050079516, 'subsample': 0.02389821983489992, 'dropout_rate': 0.9346711074065562, 'ccp_alpha': 0.5244432320491602}. Best is trial 802 with value: 0.8492679411913457.[0m
[32m[I 2022-04-21 20:36:03,240][0m Trial 897 finished with value: 0.65 and parameters: {'loss': 'coxph', 'learning_rate': 0.0005257159413481034, 'n_estimators': 258, 'criterion': 'friedman_mse', 'min_samples_split': 2, 'min_samples_leaf': 1, 'min_weight_fraction_leaf': 0.07360033047728073, 'min_impurity_decrease': 0.17278654096910412, 'max_features': 0.053851869301872586, 'subsample': 0.0010955989845382944, 'dropout_rate': 0.9803384324084272, 'ccp_alpha': 0.3369815046344665}. Best is trial 802 with value: 0.8492679411913457.[0m
[32m[I 2022-04-21 20:36:05,424][0m Trial 898 finished with value: 0.65 and parameters: {'loss': 'coxph', 'learning_rate': 1.1499800261725054e-05, 'n_estimators': 244, 'criterion': 'friedman_mse', 'min_samples_split': 2, 'min_samples_leaf': 5, 'min_weight_fraction_leaf': 0.07777436465966907, 'min_impurity_decrease': 0.15472537576666387, 'max_features': 0.05285166651538362, 'subsample': 0.032367613846773974, 'dropout_rate': 0.9997234271155498, 'ccp_alpha': 0.08449365136862566}. Best is trial 802 with value: 0.8492679411913457.[0m
[32m[I 2022-04-21 20:36:08,646][0m Trial 899 finished with value: 0.8443477390364752 and parameters: {'loss': 'coxph', 'learning_rate': 0.0006296835835512639, 'n_estimators': 268, 'criterion': 'friedman_mse', 'min_samples_split': 2, 'min_samples_leaf': 1, 'min_weight_fraction_leaf': 0.05117698329257619, 'min_impurity_decrease': 0.0574579181497812, 'max_features': 0.01656484206781158, 'subsample': 0.058866065917956546, 'dropout_rate': 0.9631275124764745, 'ccp_alpha': 0.21924333019616798}. Best is trial 802 with value: 0.8492679411913457.[0m
[32m[I 2022-04-21 20:36:12,125][0m Trial 900 finished with value: 0.84158136074065 and parameters: {'loss': 'coxph', 'learning_rate': 0.00037372950233523504, 'n_estimators': 257, 'criterion': 'friedman_mse', 'min_samples_split': 2, 'min_samples_leaf': 1, 'min_weight_fraction_leaf': 0.07325396500270595, 'min_impurity_decrease': 0.18141751461618366, 'max_features': 0.09890095733148813, 'subsample': 0.019741351110707323, 'dropout_rate': 0.9279769688401124, 'ccp_alpha': 0.08929135566766497}. Best is trial 802 with value: 0.8492679411913457.[0m
[32m[I 2022-04-21 20:36:15,763][0m Trial 901 finished with value: 0.845939243369271 and parameters: {'loss': 'coxph', 'learning_rate': 0.00029568591685498366, 'n_estimators': 276, 'criterion': 'friedman_mse', 'min_samples_split': 2, 'min_samples_leaf': 1, 'min_weight_fraction_leaf': 0.0890044738089666, 'min_impurity_decrease': 0.18329566378846202, 'max_features': 0.06693702978829813, 'subsample': 0.055335480220409655, 'dropout_rate': 0.9487473109665872, 'ccp_alpha': 0.24291392899842865}. Best is trial 802 with value: 0.8492679411913457.[0m
[32m[I 2022-04-21 20:36:18,894][0m Trial 902 finished with value: 0.65 and parameters: {'loss': 'coxph', 'learning_rate': 0.00046306788702109883, 'n_estimators': 265, 'criterion': 'friedman_mse', 'min_samples_split': 2, 'min_samples_leaf': 1, 'min_weight_fraction_leaf': 0.09011752776903463, 'min_impurity_decrease': 0.13283076096217694, 'max_features': 0.11420839501260246, 'subsample': 0.03256338502309106, 'dropout_rate': 0.9694840790581071, 'ccp_alpha': 3.536064166522105}. Best is trial 802 with value: 0.8492679411913457.[0m
[32m[I 2022-04-21 20:36:24,858][0m Trial 903 finished with value: 0.65 and parameters: {'loss': 'coxph', 'learning_rate': 0.00031686977017602127, 'n_estimators': 239, 'criterion': 'friedman_mse', 'min_samples_split': 2, 'min_samples_leaf': 1, 'min_weight_fraction_leaf': 0.08183832333992769, 'min_impurity_decrease': 0.15622981271932504, 'max_features': 0.20384640517035035, 'subsample': 0.01805321915345314, 'dropout_rate': 0.9035321956443951, 'ccp_alpha': 3.027149399653007}. Best is trial 802 with value: 0.8492679411913457.[0m
[32m[I 2022-04-21 20:36:28,631][0m Trial 904 finished with value: 0.8470557942390433 and parameters: {'loss': 'coxph', 'learning_rate': 0.0008089916977630247, 'n_estimators': 255, 'criterion': 'friedman_mse', 'min_samples_split': 2, 'min_samples_leaf': 1, 'min_weight_fraction_leaf': 0.0665283905515505, 'min_impurity_decrease': 0.19407718211318123, 'max_features': 0.04299300335019157, 'subsample': 0.05615153459817446, 'dropout_rate': 0.9840582771223458, 'ccp_alpha': 0.16364665513965349}. Best is trial 802 with value: 0.8492679411913457.[0m
[32m[I 2022-04-21 20:36:30,900][0m Trial 905 finished with value: 0.65 and parameters: {'loss': 'coxph', 'learning_rate': 0.0002692387512346696, 'n_estimators': 250, 'criterion': 'friedman_mse', 'min_samples_split': 2, 'min_samples_leaf': 1, 'min_weight_fraction_leaf': 0.037461125690451604, 'min_impurity_decrease': 0.17342120766788158, 'max_features': 0.017417755651982322, 'subsample': 0.8026676781033699, 'dropout_rate': 0.981489164060756, 'ccp_alpha': 0.3493131306415953}. Best is trial 802 with value: 0.8492679411913457.[0m
[32m[I 2022-04-21 20:36:34,027][0m Trial 906 finished with value: 0.8458120774152352 and parameters: {'loss': 'coxph', 'learning_rate': 0.0004097372775563422, 'n_estimators': 256, 'criterion': 'squared_error', 'min_samples_split': 2, 'min_samples_leaf': 1, 'min_weight_fraction_leaf': 0.06269042483657813, 'min_impurity_decrease': 0.14717034174732574, 'max_features': 0.045093991687692694, 'subsample': 0.03990076372157553, 'dropout_rate': 0.9569848306557511, 'ccp_alpha': 0.07669814024243685}. Best is trial 802 with value: 0.8492679411913457.[0m
[32m[I 2022-04-21 20:36:35,328][0m Trial 907 finished with value: 0.8437756764067448 and parameters: {'loss': 'coxph', 'learning_rate': 0.0005408989511375039, 'n_estimators': 161, 'criterion': 'friedman_mse', 'min_samples_split': 2, 'min_samples_leaf': 1, 'min_weight_fraction_leaf': 0.06923558042911061, 'min_impurity_decrease': 0.1939047167574746, 'max_features': 0.041705960142085295, 'subsample': 0.060426564607385186, 'dropout_rate': 0.9820220473269995, 'ccp_alpha': 0.16371693548210195}. Best is trial 802 with value: 0.8492679411913457.[0m
[32m[I 2022-04-21 20:36:39,613][0m Trial 908 finished with value: 0.8454645181406084 and parameters: {'loss': 'coxph', 'learning_rate': 0.0003282321058496957, 'n_estimators': 246, 'criterion': 'friedman_mse', 'min_samples_split': 2, 'min_samples_leaf': 1, 'min_weight_fraction_leaf': 0.04708471161969478, 'min_impurity_decrease': 0.16658975331783638, 'max_features': 0.07661753534273966, 'subsample': 0.038562039886947425, 'dropout_rate': 0.9376787151622468, 'ccp_alpha': 0.07378579576292973}. Best is trial 802 with value: 0.8492679411913457.[0m
/media/san2_ssd/data/Workdir/survival/venv/lib/python3.8/site-packages/sksurv/ensemble/boosting.py:955: RuntimeWarning: divide by zero encountered in log
  time = numpy.log(time)
/media/san2_ssd/data/Workdir/survival/venv/lib/python3.8/site-packages/sksurv/ensemble/boosting.py:955: RuntimeWarning: divide by zero encountered in log
  time = numpy.log(time)
/media/san2_ssd/data/Workdir/survival/venv/lib/python3.8/site-packages/sksurv/ensemble/boosting.py:955: RuntimeWarning: divide by zero encountered in log
  time = numpy.log(time)
/media/san2_ssd/data/Workdir/survival/venv/lib/python3.8/site-packages/sksurv/ensemble/boosting.py:955: RuntimeWarning: divide by zero encountered in log
  time = numpy.log(time)
[32m[I 2022-04-21 20:36:40,320][0m Trial 909 finished with value: -0.46739120824668134 and parameters: {'loss': 'squared', 'learning_rate': 0.0002451989881399977, 'n_estimators': 262, 'criterion': 'friedman_mse', 'min_samples_split': 2, 'min_samples_leaf': 1, 'min_weight_fraction_leaf': 0.059054496767182794, 'min_impurity_decrease': 0.1971926744941063, 'max_features': 0.02568654018228115, 'subsample': 0.018194473989717734, 'dropout_rate': 0.9991616918315787, 'ccp_alpha': 0.2518031646553538}. Best is trial 802 with value: 0.8492679411913457.[0m
[32m[I 2022-04-21 20:36:44,061][0m Trial 910 finished with value: 0.8376146320422567 and parameters: {'loss': 'coxph', 'learning_rate': 0.0003787018325326853, 'n_estimators': 238, 'criterion': 'friedman_mse', 'min_samples_split': 2, 'min_samples_leaf': 1, 'min_weight_fraction_leaf': 0.06988600305278872, 'min_impurity_decrease': 0.12407949991819658, 'max_features': 0.09022512486713227, 'subsample': 0.053077348380629004, 'dropout_rate': 0.9664835972500715, 'ccp_alpha': 0.4033491427138169}. Best is trial 802 with value: 0.8492679411913457.[0m
[32m[I 2022-04-21 20:36:49,223][0m Trial 911 finished with value: 0.843275535639361 and parameters: {'loss': 'coxph', 'learning_rate': 0.0010772910071543478, 'n_estimators': 273, 'criterion': 'absolute_error', 'min_samples_split': 2, 'min_samples_leaf': 1, 'min_weight_fraction_leaf': 0.07513865542040243, 'min_impurity_decrease': 0.15021875111567204, 'max_features': 0.04930310855518719, 'subsample': 0.016935123314023314, 'dropout_rate': 0.9833345131090278, 'ccp_alpha': 0.16845664502906021}. Best is trial 802 with value: 0.8492679411913457.[0m
[32m[I 2022-04-21 20:36:53,541][0m Trial 912 finished with value: 0.8446086611237875 and parameters: {'loss': 'coxph', 'learning_rate': 0.0006115926372600674, 'n_estimators': 240, 'criterion': 'friedman_mse', 'min_samples_split': 2, 'min_samples_leaf': 1, 'min_weight_fraction_leaf': 0.09614659559475244, 'min_impurity_decrease': 0.1800341132355543, 'max_features': 0.03433557965770701, 'subsample': 0.03672299092653376, 'dropout_rate': 0.9522005729951124, 'ccp_alpha': 0.0041150715871352255}. Best is trial 802 with value: 0.8492679411913457.[0m
[32m[I 2022-04-21 20:36:57,628][0m Trial 913 finished with value: 0.8480313981789005 and parameters: {'loss': 'coxph', 'learning_rate': 0.00028953337668826535, 'n_estimators': 254, 'criterion': 'friedman_mse', 'min_samples_split': 2, 'min_samples_leaf': 1, 'min_weight_fraction_leaf': 0.08458365042086326, 'min_impurity_decrease': 0.19571007123258183, 'max_features': 0.05896134492117249, 'subsample': 0.06363146267656669, 'dropout_rate': 0.9190520839636783, 'ccp_alpha': 0.007194667619780612}. Best is trial 802 with value: 0.8492679411913457.[0m
[32m[I 2022-04-21 20:37:01,519][0m Trial 914 finished with value: 0.65 and parameters: {'loss': 'coxph', 'learning_rate': 0.00028230012650772333, 'n_estimators': 267, 'criterion': 'friedman_mse', 'min_samples_split': 2, 'min_samples_leaf': 1, 'min_weight_fraction_leaf': 0.08450028492648966, 'min_impurity_decrease': 0.16530367931102508, 'max_features': 0.06240604327011893, 'subsample': 0.001433877160127505, 'dropout_rate': 0.8918519717778587, 'ccp_alpha': 0.006314617577285103}. Best is trial 802 with value: 0.8492679411913457.[0m
[32m[I 2022-04-21 20:37:05,835][0m Trial 915 finished with value: 0.8462194976318113 and parameters: {'loss': 'coxph', 'learning_rate': 0.00023683147570825768, 'n_estimators': 276, 'criterion': 'friedman_mse', 'min_samples_split': 2, 'min_samples_leaf': 1, 'min_weight_fraction_leaf': 0.0945639093197718, 'min_impurity_decrease': 0.13343729523344144, 'max_features': 0.07351554047341348, 'subsample': 0.0616532469400324, 'dropout_rate': 0.9249658061852786, 'ccp_alpha': 0.07735872551123575}. Best is trial 802 with value: 0.8492679411913457.[0m
[32m[I 2022-04-21 20:37:09,265][0m Trial 916 finished with value: 0.8456321454780085 and parameters: {'loss': 'coxph', 'learning_rate': 0.00031793544698969746, 'n_estimators': 243, 'criterion': 'friedman_mse', 'min_samples_split': 2, 'min_samples_leaf': 1, 'min_weight_fraction_leaf': 0.10323943964705211, 'min_impurity_decrease': 0.18307585639333887, 'max_features': 0.0019574173466139246, 'subsample': 0.03506756006705247, 'dropout_rate': 0.9207392059019999, 'ccp_alpha': 0.005616074103995153}. Best is trial 802 with value: 0.8492679411913457.[0m
[32m[I 2022-04-21 20:37:13,492][0m Trial 917 finished with value: 0.8473207623254343 and parameters: {'loss': 'coxph', 'learning_rate': 0.0002491882667315777, 'n_estimators': 280, 'criterion': 'friedman_mse', 'min_samples_split': 2, 'min_samples_leaf': 1, 'min_weight_fraction_leaf': 0.08266686456541099, 'min_impurity_decrease': 0.2067992425251175, 'max_features': 0.12840225192587165, 'subsample': 0.06421857607114238, 'dropout_rate': 0.9339950108821956, 'ccp_alpha': 0.0038642823493830747}. Best is trial 802 with value: 0.8492679411913457.[0m
[32m[I 2022-04-21 20:37:18,878][0m Trial 918 finished with value: 0.8473242575366227 and parameters: {'loss': 'coxph', 'learning_rate': 0.00023377497242874708, 'n_estimators': 280, 'criterion': 'friedman_mse', 'min_samples_split': 2, 'min_samples_leaf': 1, 'min_weight_fraction_leaf': 0.0889007292423008, 'min_impurity_decrease': 0.231423559504178, 'max_features': 0.13457230482176366, 'subsample': 0.0635877330370542, 'dropout_rate': 0.8969282879213456, 'ccp_alpha': 0.014104784910367693}. Best is trial 802 with value: 0.8492679411913457.[0m
[32m[I 2022-04-21 20:37:24,449][0m Trial 919 finished with value: 0.8471552313120256 and parameters: {'loss': 'coxph', 'learning_rate': 0.0002214512439223975, 'n_estimators': 283, 'criterion': 'friedman_mse', 'min_samples_split': 2, 'min_samples_leaf': 1, 'min_weight_fraction_leaf': 0.08099211189917249, 'min_impurity_decrease': 0.23450146137263753, 'max_features': 0.18316857525604613, 'subsample': 0.06509100126663288, 'dropout_rate': 0.9146114289589399, 'ccp_alpha': 0.009525595905813228}. Best is trial 802 with value: 0.8492679411913457.[0m
[32m[I 2022-04-21 20:37:32,054][0m Trial 920 finished with value: 0.8469931955098051 and parameters: {'loss': 'coxph', 'learning_rate': 0.00023835222234111858, 'n_estimators': 279, 'criterion': 'friedman_mse', 'min_samples_split': 2, 'min_samples_leaf': 1, 'min_weight_fraction_leaf': 0.07995501361739572, 'min_impurity_decrease': 0.23510700378850535, 'max_features': 0.1692390868080473, 'subsample': 0.0656734504306303, 'dropout_rate': 0.8708094261319704, 'ccp_alpha': 0.058168598596227666}. Best is trial 802 with value: 0.8492679411913457.[0m
[32m[I 2022-04-21 20:37:36,288][0m Trial 921 finished with value: 0.8473207623254343 and parameters: {'loss': 'coxph', 'learning_rate': 0.00022185318997401047, 'n_estimators': 280, 'criterion': 'friedman_mse', 'min_samples_split': 2, 'min_samples_leaf': 1, 'min_weight_fraction_leaf': 0.08023189843073, 'min_impurity_decrease': 0.24061855682184607, 'max_features': 0.15282519575655032, 'subsample': 0.06477693842458929, 'dropout_rate': 0.8782624867181668, 'ccp_alpha': 0.014812176094128077}. Best is trial 802 with value: 0.8492679411913457.[0m
[32m[I 2022-04-21 20:37:40,184][0m Trial 922 finished with value: 0.8466471250270532 and parameters: {'loss': 'coxph', 'learning_rate': 0.0002251213069605273, 'n_estimators': 262, 'criterion': 'friedman_mse', 'min_samples_split': 2, 'min_samples_leaf': 1, 'min_weight_fraction_leaf': 0.08635805746663384, 'min_impurity_decrease': 0.23303019911156944, 'max_features': 0.14604270605707287, 'subsample': 0.06450404366079174, 'dropout_rate': 0.8784797705962216, 'ccp_alpha': 0.07818848302943454}. Best is trial 802 with value: 0.8492679411913457.[0m
