[32m[I 2022-04-22 01:15:34,224][0m Trial 842 finished with value: -0.7317286726923086 and parameters: {'loss': 'squared', 'learning_rate': 7.515737708831387e-06, 'n_estimators': 233, 'criterion': 'friedman_mse', 'min_samples_split': 6, 'min_samples_leaf': 1, 'min_weight_fraction_leaf': 0.2648866498948856, 'min_impurity_decrease': 0.3235209778314765, 'max_features': 0.6969073611050705, 'subsample': 0.18445030485239183, 'dropout_rate': 0.937976972834498, 'ccp_alpha': 0.17623081698540827}. Best is trial 187 with value: 0.6933481836305168.[0m
[32m[I 2022-04-22 01:15:37,986][0m Trial 843 finished with value: 0.689177709363162 and parameters: {'loss': 'coxph', 'learning_rate': 7.041272777371327e-06, 'n_estimators': 235, 'criterion': 'friedman_mse', 'min_samples_split': 6, 'min_samples_leaf': 2, 'min_weight_fraction_leaf': 0.2463599421772532, 'min_impurity_decrease': 0.03739607087930764, 'max_features': 0.6776130695401845, 'subsample': 0.20290608585642986, 'dropout_rate': 0.8673629403431391, 'ccp_alpha': 0.010654060938950938}. Best is trial 187 with value: 0.6933481836305168.[0m
[32m[I 2022-04-22 01:15:41,454][0m Trial 844 finished with value: 0.6859672203884049 and parameters: {'loss': 'coxph', 'learning_rate': 5.292834529347882e-06, 'n_estimators': 210, 'criterion': 'friedman_mse', 'min_samples_split': 6, 'min_samples_leaf': 2, 'min_weight_fraction_leaf': 0.25583584106186386, 'min_impurity_decrease': 0.060447503311986936, 'max_features': 0.6933107161266419, 'subsample': 0.18333300097295493, 'dropout_rate': 0.8526753948471326, 'ccp_alpha': 0.09351934743917636}. Best is trial 187 with value: 0.6933481836305168.[0m
[32m[I 2022-04-22 01:15:48,180][0m Trial 845 finished with value: 0.6648314880576127 and parameters: {'loss': 'coxph', 'learning_rate': 6.207478211703504e-06, 'n_estimators': 242, 'criterion': 'friedman_mse', 'min_samples_split': 6, 'min_samples_leaf': 1, 'min_weight_fraction_leaf': 0.2785631656955766, 'min_impurity_decrease': 0.03309078154874957, 'max_features': 0.6901556565238834, 'subsample': 0.2156127347579136, 'dropout_rate': 0.8473671153769428, 'ccp_alpha': 0.2422057035206251}. Best is trial 187 with value: 0.6933481836305168.[0m
[32m[I 2022-04-22 01:15:52,514][0m Trial 846 finished with value: 0.6879003123806964 and parameters: {'loss': 'coxph', 'learning_rate': 8.643042907727256e-06, 'n_estimators': 219, 'criterion': 'friedman_mse', 'min_samples_split': 6, 'min_samples_leaf': 1, 'min_weight_fraction_leaf': 0.24691207260821071, 'min_impurity_decrease': 0.07161336714837387, 'max_features': 0.7091469369026113, 'subsample': 0.2254474924657646, 'dropout_rate': 0.8985456454322645, 'ccp_alpha': 0.0966568980212925}. Best is trial 187 with value: 0.6933481836305168.[0m
[32m[I 2022-04-22 01:15:57,735][0m Trial 847 finished with value: 0.6838501085355804 and parameters: {'loss': 'coxph', 'learning_rate': 3.994313936128791e-06, 'n_estimators': 223, 'criterion': 'friedman_mse', 'min_samples_split': 6, 'min_samples_leaf': 1, 'min_weight_fraction_leaf': 0.32890945173031505, 'min_impurity_decrease': 0.0019411286671322978, 'max_features': 0.6659636331812582, 'subsample': 0.16634157487457213, 'dropout_rate': 0.8879027611123257, 'ccp_alpha': 0.004770767716055028}. Best is trial 187 with value: 0.6933481836305168.[0m
[32m[I 2022-04-22 01:16:04,418][0m Trial 848 finished with value: 0.6751653025522437 and parameters: {'loss': 'coxph', 'learning_rate': 1.0167054975007746e-05, 'n_estimators': 244, 'criterion': 'friedman_mse', 'min_samples_split': 6, 'min_samples_leaf': 2, 'min_weight_fraction_leaf': 0.26681829347985025, 'min_impurity_decrease': 0.04706425748656653, 'max_features': 0.6431326392543973, 'subsample': 0.2106105023354498, 'dropout_rate': 0.8891306177846623, 'ccp_alpha': 0.17487328777286162}. Best is trial 187 with value: 0.6933481836305168.[0m
[32m[I 2022-04-22 01:16:08,154][0m Trial 849 finished with value: 0.6886497511574577 and parameters: {'loss': 'coxph', 'learning_rate': 5.55758426170041e-06, 'n_estimators': 227, 'criterion': 'friedman_mse', 'min_samples_split': 6, 'min_samples_leaf': 2, 'min_weight_fraction_leaf': 0.2498237568618618, 'min_impurity_decrease': 0.03569521201784272, 'max_features': 0.6998450310703184, 'subsample': 0.22876932544216264, 'dropout_rate': 0.8354788247947567, 'ccp_alpha': 0.005117152280265144}. Best is trial 187 with value: 0.6933481836305168.[0m
[32m[I 2022-04-22 01:16:11,431][0m Trial 850 finished with value: 0.6869339142923266 and parameters: {'loss': 'coxph', 'learning_rate': 1.2143097364600092e-05, 'n_estimators': 213, 'criterion': 'friedman_mse', 'min_samples_split': 6, 'min_samples_leaf': 1, 'min_weight_fraction_leaf': 0.28483059953993267, 'min_impurity_decrease': 0.06007654057551857, 'max_features': 0.7018952614274946, 'subsample': 0.17951995665539233, 'dropout_rate': 0.8510855841325328, 'ccp_alpha': 0.0026055626127735737}. Best is trial 187 with value: 0.6933481836305168.[0m
[32m[I 2022-04-22 01:16:14,533][0m Trial 851 finished with value: 0.6789708706533393 and parameters: {'loss': 'coxph', 'learning_rate': 9.42900531488858e-06, 'n_estimators': 239, 'criterion': 'friedman_mse', 'min_samples_split': 6, 'min_samples_leaf': 3, 'min_weight_fraction_leaf': 0.25715784504460365, 'min_impurity_decrease': 0.0015419975088830987, 'max_features': 0.7184888551588345, 'subsample': 0.2050447203480073, 'dropout_rate': 0.8718724936533564, 'ccp_alpha': 0.17622189871236435}. Best is trial 187 with value: 0.6933481836305168.[0m
[32m[I 2022-04-22 01:16:18,033][0m Trial 852 finished with value: 0.6648314880576127 and parameters: {'loss': 'coxph', 'learning_rate': 2.9956514961295196e-06, 'n_estimators': 252, 'criterion': 'friedman_mse', 'min_samples_split': 6, 'min_samples_leaf': 3, 'min_weight_fraction_leaf': 0.2700204602213498, 'min_impurity_decrease': 0.024651206353249508, 'max_features': 0.6828418277835927, 'subsample': 0.22766615653742386, 'dropout_rate': 0.8458253515513814, 'ccp_alpha': 0.2918279804373187}. Best is trial 187 with value: 0.6933481836305168.[0m
[32m[I 2022-04-22 01:16:20,112][0m Trial 853 finished with value: 0.6797843529283706 and parameters: {'loss': 'coxph', 'learning_rate': 5.376992451380668e-06, 'n_estimators': 202, 'criterion': 'absolute_error', 'min_samples_split': 6, 'min_samples_leaf': 2, 'min_weight_fraction_leaf': 0.2590662875679626, 'min_impurity_decrease': 0.07478845521992508, 'max_features': 0.657117266398677, 'subsample': 0.201869289122773, 'dropout_rate': 0.9079931098986227, 'ccp_alpha': 0.09925365909753842}. Best is trial 187 with value: 0.6933481836305168.[0m
[32m[I 2022-04-22 01:16:24,026][0m Trial 854 finished with value: 0.6896032275673692 and parameters: {'loss': 'coxph', 'learning_rate': 9.09566871953917e-06, 'n_estimators': 228, 'criterion': 'friedman_mse', 'min_samples_split': 6, 'min_samples_leaf': 1, 'min_weight_fraction_leaf': 0.2805252141177052, 'min_impurity_decrease': 0.04887999285557855, 'max_features': 0.7095480510655566, 'subsample': 0.2281351328803094, 'dropout_rate': 0.832714995512859, 'ccp_alpha': 0.005947559081932552}. Best is trial 187 with value: 0.6933481836305168.[0m
[32m[I 2022-04-22 01:16:26,604][0m Trial 855 finished with value: 0.5 and parameters: {'loss': 'coxph', 'learning_rate': 7.514348953049668e-06, 'n_estimators': 208, 'criterion': 'absolute_error', 'min_samples_split': 6, 'min_samples_leaf': 6, 'min_weight_fraction_leaf': 0.24727049439668392, 'min_impurity_decrease': 0.033107066191914364, 'max_features': 0.6756226643208424, 'subsample': 0.18422212034617552, 'dropout_rate': 0.8586778088352223, 'ccp_alpha': 0.9124088383725348}. Best is trial 187 with value: 0.6933481836305168.[0m
[32m[I 2022-04-22 01:16:30,620][0m Trial 856 finished with value: 0.6659454570051263 and parameters: {'loss': 'coxph', 'learning_rate': 1.3069744661941429e-05, 'n_estimators': 241, 'criterion': 'absolute_error', 'min_samples_split': 6, 'min_samples_leaf': 6, 'min_weight_fraction_leaf': 0.2423220659278634, 'min_impurity_decrease': 0.0011652105701178764, 'max_features': 0.720839380141443, 'subsample': 0.23298440728159556, 'dropout_rate': 0.9189909198347601, 'ccp_alpha': 0.1804086100826643}. Best is trial 187 with value: 0.6933481836305168.[0m
[32m[I 2022-04-22 01:16:37,631][0m Trial 857 finished with value: 0.5 and parameters: {'loss': 'coxph', 'learning_rate': 7.317665711944841e-06, 'n_estimators': 252, 'criterion': 'friedman_mse', 'min_samples_split': 6, 'min_samples_leaf': 3, 'min_weight_fraction_leaf': 0.27038198947729886, 'min_impurity_decrease': 0.053745375975684996, 'max_features': 0.6826149371960522, 'subsample': 0.1631364010008277, 'dropout_rate': 0.8041259691242105, 'ccp_alpha': 4.988588338042661}. Best is trial 187 with value: 0.6933481836305168.[0m
[32m[I 2022-04-22 01:16:42,916][0m Trial 858 finished with value: 0.6893674845237362 and parameters: {'loss': 'coxph', 'learning_rate': 9.993904678689593e-06, 'n_estimators': 218, 'criterion': 'absolute_error', 'min_samples_split': 6, 'min_samples_leaf': 2, 'min_weight_fraction_leaf': 0.2928361942913129, 'min_impurity_decrease': 0.023216719885438913, 'max_features': 0.7179323228755617, 'subsample': 0.21439608338175223, 'dropout_rate': 0.8875316398872308, 'ccp_alpha': 0.00404922066988716}. Best is trial 187 with value: 0.6933481836305168.[0m
[32m[I 2022-04-22 01:16:47,102][0m Trial 859 finished with value: 0.6893674845237362 and parameters: {'loss': 'coxph', 'learning_rate': 5.555327252504724e-06, 'n_estimators': 230, 'criterion': 'squared_error', 'min_samples_split': 6, 'min_samples_leaf': 2, 'min_weight_fraction_leaf': 0.25438598033603704, 'min_impurity_decrease': 0.07674047907510953, 'max_features': 0.6965383818113665, 'subsample': 0.235156805769057, 'dropout_rate': 0.8190950029486204, 'ccp_alpha': 0.001207419060456294}. Best is trial 187 with value: 0.6933481836305168.[0m
/media/san2_ssd/data/Workdir/survival/venv/lib/python3.8/site-packages/sksurv/ensemble/boosting.py:955: RuntimeWarning: divide by zero encountered in log
  time = numpy.log(time)
/media/san2_ssd/data/Workdir/survival/venv/lib/python3.8/site-packages/sksurv/ensemble/boosting.py:955: RuntimeWarning: divide by zero encountered in log
  time = numpy.log(time)
/media/san2_ssd/data/Workdir/survival/venv/lib/python3.8/site-packages/sksurv/ensemble/boosting.py:955: RuntimeWarning: divide by zero encountered in log
  time = numpy.log(time)
/media/san2_ssd/data/Workdir/survival/venv/lib/python3.8/site-packages/sksurv/ensemble/boosting.py:955: RuntimeWarning: divide by zero encountered in log
  time = numpy.log(time)
[32m[I 2022-04-22 01:16:47,737][0m Trial 860 finished with value: -0.7322675686572004 and parameters: {'loss': 'squared', 'learning_rate': 1.0829241489086168e-05, 'n_estimators': 234, 'criterion': 'squared_error', 'min_samples_split': 7, 'min_samples_leaf': 2, 'min_weight_fraction_leaf': 0.2847233511078878, 'min_impurity_decrease': 0.035868445144640396, 'max_features': 0.7277210249636994, 'subsample': 0.19336931847321048, 'dropout_rate': 0.8384511183523619, 'ccp_alpha': 0.2773048201558773}. Best is trial 187 with value: 0.6933481836305168.[0m
[32m[I 2022-04-22 01:16:56,572][0m Trial 861 finished with value: 0.6811622231267834 and parameters: {'loss': 'coxph', 'learning_rate': 8.216043058976866e-06, 'n_estimators': 249, 'criterion': 'squared_error', 'min_samples_split': 8, 'min_samples_leaf': 1, 'min_weight_fraction_leaf': 0.31391781885117304, 'min_impurity_decrease': 0.01993271497566025, 'max_features': 0.6056655562710168, 'subsample': 0.21859456689441903, 'dropout_rate': 0.7919045200958168, 'ccp_alpha': 0.1519633055923006}. Best is trial 187 with value: 0.6933481836305168.[0m
[32m[I 2022-04-22 01:17:02,998][0m Trial 862 finished with value: 0.6636900948801576 and parameters: {'loss': 'coxph', 'learning_rate': 4.57981335781488e-06, 'n_estimators': 217, 'criterion': 'friedman_mse', 'min_samples_split': 7, 'min_samples_leaf': 6, 'min_weight_fraction_leaf': 0.24362878599614018, 'min_impurity_decrease': 0.9983338651621119, 'max_features': 0.714624489925771, 'subsample': 0.2415913471598574, 'dropout_rate': 0.8612923442477353, 'ccp_alpha': 0.3695628223242289}. Best is trial 187 with value: 0.6933481836305168.[0m
[32m[I 2022-04-22 01:17:07,535][0m Trial 863 finished with value: 0.6914719007233014 and parameters: {'loss': 'coxph', 'learning_rate': 1.3119645239856158e-05, 'n_estimators': 208, 'criterion': 'squared_error', 'min_samples_split': 9, 'min_samples_leaf': 3, 'min_weight_fraction_leaf': 0.2588493136676541, 'min_impurity_decrease': 0.05535785546702001, 'max_features': 0.6500226898260272, 'subsample': 0.21081265521268694, 'dropout_rate': 0.8888058985381434, 'ccp_alpha': 0.09565946766172741}. Best is trial 187 with value: 0.6933481836305168.[0m
[32m[I 2022-04-22 01:17:11,101][0m Trial 864 finished with value: 0.6696357488445409 and parameters: {'loss': 'coxph', 'learning_rate': 1.3421875050769292e-05, 'n_estimators': 201, 'criterion': 'absolute_error', 'min_samples_split': 10, 'min_samples_leaf': 3, 'min_weight_fraction_leaf': 0.27065202259582916, 'min_impurity_decrease': 0.04206481553018798, 'max_features': 0.6232264229431791, 'subsample': 0.14557987833797137, 'dropout_rate': 0.8879309485574024, 'ccp_alpha': 0.21585376281128785}. Best is trial 187 with value: 0.6933481836305168.[0m
[32m[I 2022-04-22 01:17:15,053][0m Trial 865 finished with value: 0.6647221083144021 and parameters: {'loss': 'coxph', 'learning_rate': 1.5657954409997623e-05, 'n_estimators': 197, 'criterion': 'squared_error', 'min_samples_split': 6, 'min_samples_leaf': 5, 'min_weight_fraction_leaf': 0.27715379034644716, 'min_impurity_decrease': 0.0013975879160124918, 'max_features': 0.6408657550915361, 'subsample': 0.174269371791682, 'dropout_rate': 0.8276694230424458, 'ccp_alpha': 0.36694189555723095}. Best is trial 187 with value: 0.6933481836305168.[0m
[32m[I 2022-04-22 01:17:17,216][0m Trial 866 finished with value: 0.6749595165654091 and parameters: {'loss': 'coxph', 'learning_rate': 1.3933779810899782e-05, 'n_estimators': 199, 'criterion': 'squared_error', 'min_samples_split': 10, 'min_samples_leaf': 3, 'min_weight_fraction_leaf': 0.2623339404138094, 'min_impurity_decrease': 0.08001408885613877, 'max_features': 0.7316179883601612, 'subsample': 0.20172878216207735, 'dropout_rate': 0.9310323589792957, 'ccp_alpha': 0.26349323265926916}. Best is trial 187 with value: 0.6933481836305168.[0m
[32m[I 2022-04-22 01:17:20,982][0m Trial 867 finished with value: 0.5 and parameters: {'loss': 'coxph', 'learning_rate': 1.138288945021993e-05, 'n_estimators': 210, 'criterion': 'squared_error', 'min_samples_split': 9, 'min_samples_leaf': 3, 'min_weight_fraction_leaf': 0.2625346736015425, 'min_impurity_decrease': 0.23993220341466487, 'max_features': 0.662864534765182, 'subsample': 0.1927193298261506, 'dropout_rate': 0.8841207643969609, 'ccp_alpha': 2.0409252020314197}. Best is trial 187 with value: 0.6933481836305168.[0m
[32m[I 2022-04-22 01:17:25,364][0m Trial 868 finished with value: 0.5 and parameters: {'loss': 'coxph', 'learning_rate': 1.2301948581534312e-05, 'n_estimators': 194, 'criterion': 'squared_error', 'min_samples_split': 9, 'min_samples_leaf': 3, 'min_weight_fraction_leaf': 0.27143144553677134, 'min_impurity_decrease': 0.8394738027323845, 'max_features': 0.6385796577581836, 'subsample': 0.2144392415279588, 'dropout_rate': 0.9102751639090175, 'ccp_alpha': 0.15460511246606634}. Best is trial 187 with value: 0.6933481836305168.[0m
[32m[I 2022-04-22 01:17:30,704][0m Trial 869 finished with value: 0.5882597429650015 and parameters: {'loss': 'coxph', 'learning_rate': 1.6240247832757585e-05, 'n_estimators': 216, 'criterion': 'absolute_error', 'min_samples_split': 9, 'min_samples_leaf': 3, 'min_weight_fraction_leaf': 0.26603876735609827, 'min_impurity_decrease': 0.021760703791522566, 'max_features': 0.6172175334180316, 'subsample': 0.1660943269543828, 'dropout_rate': 0.7839766521634861, 'ccp_alpha': 0.45764558268933625}. Best is trial 187 with value: 0.6933481836305168.[0m
[32m[I 2022-04-22 01:17:34,404][0m Trial 870 finished with value: 0.6888669435189467 and parameters: {'loss': 'coxph', 'learning_rate': 1.8118430380063004e-05, 'n_estimators': 209, 'criterion': 'squared_error', 'min_samples_split': 10, 'min_samples_leaf': 5, 'min_weight_fraction_leaf': 0.28037435587352727, 'min_impurity_decrease': 0.054005331897987244, 'max_features': 0.6709970020287872, 'subsample': 0.1962843447052986, 'dropout_rate': 0.8086513107105716, 'ccp_alpha': 0.11045143190886617}. Best is trial 187 with value: 0.6933481836305168.[0m
[32m[I 2022-04-22 01:17:37,131][0m Trial 871 finished with value: 0.5 and parameters: {'loss': 'coxph', 'learning_rate': 9.583758052638471e-06, 'n_estimators': 185, 'criterion': 'squared_error', 'min_samples_split': 9, 'min_samples_leaf': 6, 'min_weight_fraction_leaf': 0.28939898733117475, 'min_impurity_decrease': 0.7267571298583078, 'max_features': 0.6571828124703795, 'subsample': 0.215560894274954, 'dropout_rate': 0.8364514009416659, 'ccp_alpha': 0.23034810155778968}. Best is trial 187 with value: 0.6933481836305168.[0m
[32m[I 2022-04-22 01:17:43,450][0m Trial 872 finished with value: 0.6905958586786412 and parameters: {'loss': 'coxph', 'learning_rate': 1.0197604472308036e-05, 'n_estimators': 224, 'criterion': 'squared_error', 'min_samples_split': 6, 'min_samples_leaf': 6, 'min_weight_fraction_leaf': 0.25661794969298535, 'min_impurity_decrease': 0.021276443738517115, 'max_features': 0.6037980904458082, 'subsample': 0.24036422496377668, 'dropout_rate': 0.8543765650646384, 'ccp_alpha': 0.10700625521712001}. Best is trial 187 with value: 0.6933481836305168.[0m
[32m[I 2022-04-22 01:17:48,732][0m Trial 873 finished with value: 0.6899233837044367 and parameters: {'loss': 'coxph', 'learning_rate': 9.705094487499943e-06, 'n_estimators': 221, 'criterion': 'friedman_mse', 'min_samples_split': 9, 'min_samples_leaf': 6, 'min_weight_fraction_leaf': 0.2514380639897206, 'min_impurity_decrease': 0.021261111590119647, 'max_features': 0.604109543335723, 'subsample': 0.23642895162602923, 'dropout_rate': 0.877924250474361, 'ccp_alpha': 0.1026132493975085}. Best is trial 187 with value: 0.6933481836305168.[0m
[32m[I 2022-04-22 01:17:53,302][0m Trial 874 finished with value: 0.6894133810726565 and parameters: {'loss': 'coxph', 'learning_rate': 1.1036821356221984e-05, 'n_estimators': 223, 'criterion': 'friedman_mse', 'min_samples_split': 9, 'min_samples_leaf': 5, 'min_weight_fraction_leaf': 0.25666383053535413, 'min_impurity_decrease': 0.0013011700966576215, 'max_features': 0.6199354771987942, 'subsample': 0.2199605066151929, 'dropout_rate': 0.889609213152868, 'ccp_alpha': 0.09747393420282949}. Best is trial 187 with value: 0.6933481836305168.[0m
[32m[I 2022-04-22 01:17:55,861][0m Trial 875 finished with value: 0.6866243516303845 and parameters: {'loss': 'coxph', 'learning_rate': 8.730574843954416e-06, 'n_estimators': 207, 'criterion': 'friedman_mse', 'min_samples_split': 9, 'min_samples_leaf': 6, 'min_weight_fraction_leaf': 0.2532339429185797, 'min_impurity_decrease': 0.01974148146248664, 'max_features': 0.58085578339186, 'subsample': 0.19013172513718612, 'dropout_rate': 0.863823877152185, 'ccp_alpha': 0.09528191049836375}. Best is trial 187 with value: 0.6933481836305168.[0m
[32m[I 2022-04-22 01:17:58,545][0m Trial 876 finished with value: 0.656906382249526 and parameters: {'loss': 'coxph', 'learning_rate': 1.227864004703975e-05, 'n_estimators': 221, 'criterion': 'friedman_mse', 'min_samples_split': 9, 'min_samples_leaf': 6, 'min_weight_fraction_leaf': 0.25496327365402416, 'min_impurity_decrease': 0.021650574150017057, 'max_features': 0.5827048661434995, 'subsample': 0.23549234231331131, 'dropout_rate': 0.8780672183443768, 'ccp_alpha': 0.2980231899021951}. Best is trial 187 with value: 0.6933481836305168.[0m
[32m[I 2022-04-22 01:18:05,102][0m Trial 877 finished with value: 0.6798601835959615 and parameters: {'loss': 'coxph', 'learning_rate': 9.802910839077591e-06, 'n_estimators': 213, 'criterion': 'friedman_mse', 'min_samples_split': 9, 'min_samples_leaf': 6, 'min_weight_fraction_leaf': 0.2642803645329873, 'min_impurity_decrease': 0.044884243908240605, 'max_features': 0.6261800268351693, 'subsample': 0.21371329445454307, 'dropout_rate': 0.8464762282374702, 'ccp_alpha': 0.1955085791445158}. Best is trial 187 with value: 0.6933481836305168.[0m
[32m[I 2022-04-22 01:18:09,063][0m Trial 878 finished with value: 0.6895180667488573 and parameters: {'loss': 'coxph', 'learning_rate': 7.687253118871403e-06, 'n_estimators': 226, 'criterion': 'friedman_mse', 'min_samples_split': 9, 'min_samples_leaf': 6, 'min_weight_fraction_leaf': 0.24037948229214837, 'min_impurity_decrease': 0.018050462784277223, 'max_features': 0.6443893383454479, 'subsample': 0.24072372515522525, 'dropout_rate': 0.9493999656225043, 'ccp_alpha': 0.12151439534337972}. Best is trial 187 with value: 0.6933481836305168.[0m
