[32m[I 2022-04-21 11:39:42,149][0m Trial 513 finished with value: 0.5208276091994826 and parameters: {'splitter': 'random', 'min_samples_split': 0.4300927689546867, 'min_samples_leaf': 0.03943588997418281, 'min_weight_fraction_leaf': 0.16050556817447575, 'max_features': 0.4709178233867156}. Best is trial 11 with value: 0.6773038119717333.[0m
[32m[I 2022-04-21 11:39:42,274][0m Trial 514 finished with value: 0.6738476114655684 and parameters: {'splitter': 'random', 'min_samples_split': 0.19192911299239343, 'min_samples_leaf': 0.0012307905891991919, 'min_weight_fraction_leaf': 0.1911331657402414, 'max_features': 0.8862760958409517}. Best is trial 11 with value: 0.6773038119717333.[0m
[32m[I 2022-04-21 11:39:42,384][0m Trial 515 finished with value: 0.6738476114655684 and parameters: {'splitter': 'random', 'min_samples_split': 0.053126475619284276, 'min_samples_leaf': 0.17602168369544058, 'min_weight_fraction_leaf': 0.11561380558641203, 'max_features': 0.8341461400536294}. Best is trial 11 with value: 0.6773038119717333.[0m
[32m[I 2022-04-21 11:39:42,485][0m Trial 516 finished with value: 0.5 and parameters: {'splitter': 'random', 'min_samples_split': 0.19189923426326644, 'min_samples_leaf': 0.1813715398221657, 'min_weight_fraction_leaf': 0.13567085959704883, 'max_features': 0.7946314478723362}. Best is trial 11 with value: 0.6773038119717333.[0m
[32m[I 2022-04-21 11:39:42,597][0m Trial 517 finished with value: 0.6738476114655684 and parameters: {'splitter': 'random', 'min_samples_split': 0.15517811685795388, 'min_samples_leaf': 0.0714529145516905, 'min_weight_fraction_leaf': 0.19275457318326014, 'max_features': 0.9298161077739164}. Best is trial 11 with value: 0.6773038119717333.[0m
[32m[I 2022-04-21 11:39:42,721][0m Trial 518 finished with value: 0.6738476114655684 and parameters: {'splitter': 'random', 'min_samples_split': 0.16957877260914553, 'min_samples_leaf': 0.1783461153101824, 'min_weight_fraction_leaf': 0.1409623812987508, 'max_features': 0.9562217204211497}. Best is trial 11 with value: 0.6773038119717333.[0m
[32m[I 2022-04-21 11:39:42,795][0m Trial 519 finished with value: 0.6738476114655684 and parameters: {'splitter': 'random', 'min_samples_split': 0.43365235904097565, 'min_samples_leaf': 0.13418662045711624, 'min_weight_fraction_leaf': 0.18070826479840094, 'max_features': 0.9580578233494423}. Best is trial 11 with value: 0.6773038119717333.[0m
[32m[I 2022-04-21 11:39:42,884][0m Trial 520 finished with value: 0.6665385065440175 and parameters: {'splitter': 'best', 'min_samples_split': 0.4370055777082685, 'min_samples_leaf': 0.14161381049301502, 'min_weight_fraction_leaf': 0.16525023528815347, 'max_features': 0.9685122037399158}. Best is trial 11 with value: 0.6773038119717333.[0m
[32m[I 2022-04-21 11:39:43,018][0m Trial 521 finished with value: 0.5 and parameters: {'splitter': 'random', 'min_samples_split': 0.49216767445144133, 'min_samples_leaf': 0.030454420014629318, 'min_weight_fraction_leaf': 0.4962588647878822, 'max_features': 0.9333092629145691}. Best is trial 11 with value: 0.6773038119717333.[0m
[32m[I 2022-04-21 11:39:43,147][0m Trial 522 finished with value: 0.6703693833499768 and parameters: {'splitter': 'random', 'min_samples_split': 0.4683769523240281, 'min_samples_leaf': 0.025912851848140836, 'min_weight_fraction_leaf': 0.19425253290377775, 'max_features': 0.9800603246740506}. Best is trial 11 with value: 0.6773038119717333.[0m
[32m[I 2022-04-21 11:39:43,207][0m Trial 523 finished with value: 0.6215155824977587 and parameters: {'splitter': 'random', 'min_samples_split': 0.20193280271011396, 'min_samples_leaf': 0.05763151020896171, 'min_weight_fraction_leaf': 0.2245749595613032, 'max_features': 0.8669988951220191}. Best is trial 11 with value: 0.6773038119717333.[0m
[32m[I 2022-04-21 11:39:43,366][0m Trial 524 finished with value: 0.6738476114655684 and parameters: {'splitter': 'random', 'min_samples_split': 0.24441198393749247, 'min_samples_leaf': 0.1394152593714494, 'min_weight_fraction_leaf': 0.16950314774981887, 'max_features': 0.8532627420943659}. Best is trial 11 with value: 0.6773038119717333.[0m
[32m[I 2022-04-21 11:39:43,475][0m Trial 525 finished with value: 0.6640701022932763 and parameters: {'splitter': 'random', 'min_samples_split': 0.28130561977736906, 'min_samples_leaf': 0.08390756123877409, 'min_weight_fraction_leaf': 0.14438316009906094, 'max_features': 0.8210925761357613}. Best is trial 11 with value: 0.6773038119717333.[0m
[32m[I 2022-04-21 11:39:43,600][0m Trial 526 finished with value: 0.6055713066869624 and parameters: {'splitter': 'random', 'min_samples_split': 0.2674490766692329, 'min_samples_leaf': 0.15790927145829595, 'min_weight_fraction_leaf': 0.15852958372187942, 'max_features': 0.6579029179947501}. Best is trial 11 with value: 0.6773038119717333.[0m
[32m[I 2022-04-21 11:39:43,692][0m Trial 527 finished with value: 0.5 and parameters: {'splitter': 'random', 'min_samples_split': 0.1824892116796846, 'min_samples_leaf': 0.01689523165604935, 'min_weight_fraction_leaf': 0.19734150217135943, 'max_features': 0.5550222406926347}. Best is trial 11 with value: 0.6773038119717333.[0m
[32m[I 2022-04-21 11:39:43,827][0m Trial 528 finished with value: 0.6586187582319654 and parameters: {'splitter': 'random', 'min_samples_split': 0.37826031220502265, 'min_samples_leaf': 0.21182402332118092, 'min_weight_fraction_leaf': 0.1473911586073104, 'max_features': 0.9775501979514869}. Best is trial 11 with value: 0.6773038119717333.[0m
[32m[I 2022-04-21 11:39:43,927][0m Trial 529 finished with value: 0.6640701022932763 and parameters: {'splitter': 'random', 'min_samples_split': 0.23666304274621108, 'min_samples_leaf': 0.12525046073353008, 'min_weight_fraction_leaf': 0.01013123763153942, 'max_features': 0.8961742656676042}. Best is trial 11 with value: 0.6773038119717333.[0m
[32m[I 2022-04-21 11:39:44,047][0m Trial 530 finished with value: 0.6543938115635641 and parameters: {'splitter': 'random', 'min_samples_split': 0.3063406895178596, 'min_samples_leaf': 0.1506908669226889, 'min_weight_fraction_leaf': 0.157370435386319, 'max_features': 0.9219332423140992}. Best is trial 11 with value: 0.6773038119717333.[0m
[32m[I 2022-04-21 11:39:44,160][0m Trial 531 finished with value: 0.6650367998115423 and parameters: {'splitter': 'random', 'min_samples_split': 0.024136375029930886, 'min_samples_leaf': 0.08448129469976018, 'min_weight_fraction_leaf': 0.10776838003557293, 'max_features': 0.9455396113590377}. Best is trial 11 with value: 0.6773038119717333.[0m
[32m[I 2022-04-21 11:39:44,206][0m Trial 532 finished with value: 0.5 and parameters: {'splitter': 'random', 'min_samples_split': 0.3252267141128293, 'min_samples_leaf': 0.11752503093985883, 'min_weight_fraction_leaf': 0.44665832090980234, 'max_features': 0.8640065698578077}. Best is trial 11 with value: 0.6773038119717333.[0m
[32m[I 2022-04-21 11:39:44,287][0m Trial 533 finished with value: 0.6738476114655684 and parameters: {'splitter': 'random', 'min_samples_split': 0.08902550867102926, 'min_samples_leaf': 0.19430188620736308, 'min_weight_fraction_leaf': 0.13636095210225702, 'max_features': 0.861893685840314}. Best is trial 11 with value: 0.6773038119717333.[0m
[32m[I 2022-04-21 11:39:44,351][0m Trial 534 finished with value: 0.5 and parameters: {'splitter': 'random', 'min_samples_split': 0.09458811800665216, 'min_samples_leaf': 0.02495416874058435, 'min_weight_fraction_leaf': 0.21712445841170253, 'max_features': 0.4148096016825152}. Best is trial 11 with value: 0.6773038119717333.[0m
[32m[I 2022-04-21 11:39:44,393][0m Trial 535 finished with value: 0.6586187582319654 and parameters: {'splitter': 'random', 'min_samples_split': 0.048213935209626926, 'min_samples_leaf': 0.008555904675279051, 'min_weight_fraction_leaf': 0.20889918422730447, 'max_features': 0.9974220137505252}. Best is trial 11 with value: 0.6773038119717333.[0m
[32m[I 2022-04-21 11:39:44,434][0m Trial 536 finished with value: 0.6636900948801576 and parameters: {'splitter': 'best', 'min_samples_split': 0.23335926098770904, 'min_samples_leaf': 0.26075022387882385, 'min_weight_fraction_leaf': 0.20044652981150854, 'max_features': 0.8917182626400454}. Best is trial 11 with value: 0.6773038119717333.[0m
[32m[I 2022-04-21 11:39:44,518][0m Trial 537 finished with value: 0.5 and parameters: {'splitter': 'random', 'min_samples_split': 0.014154327935375507, 'min_samples_leaf': 0.277590805091545, 'min_weight_fraction_leaf': 0.1875226198447853, 'max_features': 0.9504751206523837}. Best is trial 11 with value: 0.6773038119717333.[0m
[32m[I 2022-04-21 11:39:44,597][0m Trial 538 finished with value: 0.5 and parameters: {'splitter': 'random', 'min_samples_split': 0.35457190250984777, 'min_samples_leaf': 0.13590255630982095, 'min_weight_fraction_leaf': 0.3779554661265494, 'max_features': 0.9046255596928523}. Best is trial 11 with value: 0.6773038119717333.[0m
[32m[I 2022-04-21 11:39:44,649][0m Trial 539 finished with value: 0.6738476114655684 and parameters: {'splitter': 'random', 'min_samples_split': 0.07472335407957809, 'min_samples_leaf': 0.03763779288776387, 'min_weight_fraction_leaf': 0.1737440786126926, 'max_features': 0.9720803742121584}. Best is trial 11 with value: 0.6773038119717333.[0m
[32m[I 2022-04-21 11:39:44,692][0m Trial 540 finished with value: 0.5283695882293453 and parameters: {'splitter': 'random', 'min_samples_split': 0.27325991916282577, 'min_samples_leaf': 0.09935763052455089, 'min_weight_fraction_leaf': 0.25885292151502753, 'max_features': 0.8417764048462542}. Best is trial 11 with value: 0.6773038119717333.[0m
[32m[I 2022-04-21 11:39:44,729][0m Trial 541 finished with value: 0.5889594645659965 and parameters: {'splitter': 'random', 'min_samples_split': 0.2597625210131848, 'min_samples_leaf': 0.1527772397341986, 'min_weight_fraction_leaf': 0.23223261512529964, 'max_features': 0.8781063414181702}. Best is trial 11 with value: 0.6773038119717333.[0m
[32m[I 2022-04-21 11:39:44,764][0m Trial 542 finished with value: 0.6586187582319654 and parameters: {'splitter': 'random', 'min_samples_split': 0.22945420009510192, 'min_samples_leaf': 0.054950426561168914, 'min_weight_fraction_leaf': 0.21117285719781467, 'max_features': 0.9985421710719367}. Best is trial 11 with value: 0.6773038119717333.[0m
[32m[I 2022-04-21 11:39:44,810][0m Trial 543 finished with value: 0.6738476114655684 and parameters: {'splitter': 'random', 'min_samples_split': 0.44721752804681575, 'min_samples_leaf': 0.033567832473392054, 'min_weight_fraction_leaf': 0.18950599170639668, 'max_features': 0.9653530972189022}. Best is trial 11 with value: 0.6773038119717333.[0m
[32m[I 2022-04-21 11:39:44,850][0m Trial 544 finished with value: 0.6586187582319654 and parameters: {'splitter': 'random', 'min_samples_split': 0.42151000286440005, 'min_samples_leaf': 0.04186373541063437, 'min_weight_fraction_leaf': 0.203480937546999, 'max_features': 0.9998234929595813}. Best is trial 11 with value: 0.6773038119717333.[0m
[32m[I 2022-04-21 11:39:44,887][0m Trial 545 finished with value: 0.6660068201889194 and parameters: {'splitter': 'random', 'min_samples_split': 0.31695124569958083, 'min_samples_leaf': 0.04097334952457759, 'min_weight_fraction_leaf': 0.024119675475037787, 'max_features': 0.9337176055301939}. Best is trial 11 with value: 0.6773038119717333.[0m
[32m[I 2022-04-21 11:39:44,927][0m Trial 546 finished with value: 0.5 and parameters: {'splitter': 'random', 'min_samples_split': 0.4646122470292263, 'min_samples_leaf': 0.1869790192386564, 'min_weight_fraction_leaf': 0.14325369374095281, 'max_features': 0.0850222143916326}. Best is trial 11 with value: 0.6773038119717333.[0m
[32m[I 2022-04-21 11:39:44,989][0m Trial 547 finished with value: 0.5 and parameters: {'splitter': 'random', 'min_samples_split': 0.28681174191654824, 'min_samples_leaf': 0.3617333562025863, 'min_weight_fraction_leaf': 0.034249019424073504, 'max_features': 0.7816314364322261}. Best is trial 11 with value: 0.6773038119717333.[0m
[32m[I 2022-04-21 11:39:45,075][0m Trial 548 finished with value: 0.6215155824977587 and parameters: {'splitter': 'random', 'min_samples_split': 0.29654929916446127, 'min_samples_leaf': 0.22695564178667388, 'min_weight_fraction_leaf': 0.0524618561814946, 'max_features': 0.8122023940522214}. Best is trial 11 with value: 0.6773038119717333.[0m
[32m[I 2022-04-21 11:39:45,155][0m Trial 549 finished with value: 0.6738476114655684 and parameters: {'splitter': 'random', 'min_samples_split': 0.20228656818244478, 'min_samples_leaf': 0.002113668269202247, 'min_weight_fraction_leaf': 0.17895998181259654, 'max_features': 0.9781731867700716}. Best is trial 11 with value: 0.6773038119717333.[0m
[32m[I 2022-04-21 11:39:45,199][0m Trial 550 finished with value: 0.6738476114655684 and parameters: {'splitter': 'random', 'min_samples_split': 0.19761046202931679, 'min_samples_leaf': 0.01666978884283412, 'min_weight_fraction_leaf': 0.1847025478564252, 'max_features': 0.9826028489377525}. Best is trial 11 with value: 0.6773038119717333.[0m
[32m[I 2022-04-21 11:39:45,240][0m Trial 551 finished with value: 0.5502145606990503 and parameters: {'splitter': 'random', 'min_samples_split': 0.031972294390574606, 'min_samples_leaf': 0.013422393435780375, 'min_weight_fraction_leaf': 0.17355968359611895, 'max_features': 0.7855517192223774}. Best is trial 11 with value: 0.6773038119717333.[0m
[32m[I 2022-04-21 11:39:45,292][0m Trial 552 finished with value: 0.6738476114655684 and parameters: {'splitter': 'random', 'min_samples_split': 0.04082895726292568, 'min_samples_leaf': 0.010436503379902021, 'min_weight_fraction_leaf': 0.17692050071512055, 'max_features': 0.9814355296509475}. Best is trial 11 with value: 0.6773038119717333.[0m
[32m[I 2022-04-21 11:39:45,370][0m Trial 553 finished with value: 0.6738476114655684 and parameters: {'splitter': 'random', 'min_samples_split': 0.3853393295729816, 'min_samples_leaf': 0.016710350003466202, 'min_weight_fraction_leaf': 0.18981946323340607, 'max_features': 0.8802298006275591}. Best is trial 11 with value: 0.6773038119717333.[0m
[32m[I 2022-04-21 11:39:45,436][0m Trial 554 finished with value: 0.5 and parameters: {'splitter': 'random', 'min_samples_split': 0.39943884030618565, 'min_samples_leaf': 0.03330398156396115, 'min_weight_fraction_leaf': 0.16078094269452325, 'max_features': 0.20979016634266612}. Best is trial 11 with value: 0.6773038119717333.[0m
[32m[I 2022-04-21 11:39:45,472][0m Trial 555 finished with value: 0.6738476114655684 and parameters: {'splitter': 'random', 'min_samples_split': 0.18496186258510616, 'min_samples_leaf': 0.019990935740177213, 'min_weight_fraction_leaf': 0.18436060962795017, 'max_features': 0.8361607651983134}. Best is trial 11 with value: 0.6773038119717333.[0m
[32m[I 2022-04-21 11:39:45,522][0m Trial 556 finished with value: 0.6650367998115423 and parameters: {'splitter': 'random', 'min_samples_split': 0.15871227566444687, 'min_samples_leaf': 0.09201212869583646, 'min_weight_fraction_leaf': 0.11812105696375405, 'max_features': 0.8328355454150466}. Best is trial 11 with value: 0.6773038119717333.[0m
[32m[I 2022-04-21 11:39:45,574][0m Trial 557 finished with value: 0.6586187582319654 and parameters: {'splitter': 'random', 'min_samples_split': 0.25124175104595736, 'min_samples_leaf': 0.06058705724853046, 'min_weight_fraction_leaf': 0.2018673847766968, 'max_features': 0.9123385897743497}. Best is trial 11 with value: 0.6773038119717333.[0m
[32m[I 2022-04-21 11:39:45,665][0m Trial 558 finished with value: 0.669084700831851 and parameters: {'splitter': 'best', 'min_samples_split': 0.3483311846723977, 'min_samples_leaf': 0.1302760219201868, 'min_weight_fraction_leaf': 0.0010297477464238424, 'max_features': 0.9244690319777715}. Best is trial 11 with value: 0.6773038119717333.[0m
[32m[I 2022-04-21 11:39:45,706][0m Trial 559 finished with value: 0.6640701022932763 and parameters: {'splitter': 'random', 'min_samples_split': 0.3507887362445191, 'min_samples_leaf': 0.12921652090780156, 'min_weight_fraction_leaf': 0.10518619158351061, 'max_features': 0.8032559926676212}. Best is trial 11 with value: 0.6773038119717333.[0m
[32m[I 2022-04-21 11:39:45,752][0m Trial 560 finished with value: 0.6738476114655684 and parameters: {'splitter': 'random', 'min_samples_split': 0.08094525393834208, 'min_samples_leaf': 0.05269513624614955, 'min_weight_fraction_leaf': 0.1724417274811586, 'max_features': 0.9236684401478732}. Best is trial 11 with value: 0.6773038119717333.[0m
[32m[I 2022-04-21 11:39:45,797][0m Trial 561 finished with value: 0.6650367998115423 and parameters: {'splitter': 'random', 'min_samples_split': 0.2545262294191688, 'min_samples_leaf': 0.1185875455751285, 'min_weight_fraction_leaf': 0.10456440597963351, 'max_features': 0.8462285804234282}. Best is trial 11 with value: 0.6773038119717333.[0m
[32m[I 2022-04-21 11:39:45,880][0m Trial 562 finished with value: 0.6543938115635641 and parameters: {'splitter': 'random', 'min_samples_split': 0.3946886159567998, 'min_samples_leaf': 0.11995447814793682, 'min_weight_fraction_leaf': 0.15645370600420422, 'max_features': 0.868144006725078}. Best is trial 11 with value: 0.6773038119717333.[0m
[32m[I 2022-04-21 11:39:45,931][0m Trial 563 finished with value: 0.6738476114655684 and parameters: {'splitter': 'random', 'min_samples_split': 0.3707498657062792, 'min_samples_leaf': 0.009465186552272353, 'min_weight_fraction_leaf': 0.18945828243763346, 'max_features': 0.950214308337553}. Best is trial 11 with value: 0.6773038119717333.[0m
[32m[I 2022-04-21 11:39:46,000][0m Trial 564 finished with value: 0.6640701022932763 and parameters: {'splitter': 'random', 'min_samples_split': 0.30383973156054755, 'min_samples_leaf': 0.1430629994996061, 'min_weight_fraction_leaf': 0.013113217807969986, 'max_features': 0.8988984244945323}. Best is trial 11 with value: 0.6773038119717333.[0m
[32m[I 2022-04-21 11:39:46,117][0m Trial 565 finished with value: 0.662800366349585 and parameters: {'splitter': 'random', 'min_samples_split': 0.06088684464020792, 'min_samples_leaf': 0.16640751833022588, 'min_weight_fraction_leaf': 0.1311570817802187, 'max_features': 0.8494718437374924}. Best is trial 11 with value: 0.6773038119717333.[0m
[32m[I 2022-04-21 11:39:46,217][0m Trial 566 finished with value: 0.6738476114655684 and parameters: {'splitter': 'random', 'min_samples_split': 0.3563452097810662, 'min_samples_leaf': 0.11195984092333405, 'min_weight_fraction_leaf': 0.19564300459981662, 'max_features': 0.8913954064037419}. Best is trial 11 with value: 0.6773038119717333.[0m
[32m[I 2022-04-21 11:39:46,263][0m Trial 567 finished with value: 0.6738476114655684 and parameters: {'splitter': 'random', 'min_samples_split': 0.334191638800041, 'min_samples_leaf': 0.10170451054347375, 'min_weight_fraction_leaf': 0.2006998755288413, 'max_features': 0.8880743152661708}. Best is trial 11 with value: 0.6773038119717333.[0m
[32m[I 2022-04-21 11:39:46,366][0m Trial 568 finished with value: 0.6738476114655684 and parameters: {'splitter': 'random', 'min_samples_split': 0.3412226091436058, 'min_samples_leaf': 0.11459179781625667, 'min_weight_fraction_leaf': 0.18273750118018478, 'max_features': 0.874612746562167}. Best is trial 11 with value: 0.6773038119717333.[0m
[32m[I 2022-04-21 11:39:46,441][0m Trial 569 finished with value: 0.6586187582319654 and parameters: {'splitter': 'random', 'min_samples_split': 0.21350790378282808, 'min_samples_leaf': 0.08414952362561809, 'min_weight_fraction_leaf': 0.20928765167308708, 'max_features': 0.8600791019570863}. Best is trial 11 with value: 0.6773038119717333.[0m
[32m[I 2022-04-21 11:39:46,494][0m Trial 570 finished with value: 0.6738476114655684 and parameters: {'splitter': 'random', 'min_samples_split': 0.45968388082257955, 'min_samples_leaf': 0.19743890575549355, 'min_weight_fraction_leaf': 0.12460582717948952, 'max_features': 0.954258707257474}. Best is trial 11 with value: 0.6773038119717333.[0m
[32m[I 2022-04-21 11:39:46,543][0m Trial 571 finished with value: 0.5 and parameters: {'splitter': 'random', 'min_samples_split': 0.2054224273067342, 'min_samples_leaf': 0.025280644648276257, 'min_weight_fraction_leaf': 0.2792616175354765, 'max_features': 0.8233382003025211}. Best is trial 11 with value: 0.6773038119717333.[0m
[32m[I 2022-04-21 11:39:46,590][0m Trial 572 finished with value: 0.6640701022932763 and parameters: {'splitter': 'random', 'min_samples_split': 0.20698376735610235, 'min_samples_leaf': 0.06797252105160576, 'min_weight_fraction_leaf': 0.12619479436541264, 'max_features': 0.8196369337792264}. Best is trial 11 with value: 0.6773038119717333.[0m
[32m[I 2022-04-21 11:39:46,690][0m Trial 573 finished with value: 0.6640701022932763 and parameters: {'splitter': 'random', 'min_samples_split': 0.31305019409391427, 'min_samples_leaf': 0.046734956852625784, 'min_weight_fraction_leaf': 0.09190759430636394, 'max_features': 0.9054740963305645}. Best is trial 11 with value: 0.6773038119717333.[0m
[32m[I 2022-04-21 11:39:46,739][0m Trial 574 finished with value: 0.6598137568019723 and parameters: {'splitter': 'best', 'min_samples_split': 0.3761665426793201, 'min_samples_leaf': 0.07740325853499437, 'min_weight_fraction_leaf': 0.1805335506199506, 'max_features': 0.9078414641845399}. Best is trial 11 with value: 0.6773038119717333.[0m
[32m[I 2022-04-21 11:39:46,779][0m Trial 575 finished with value: 0.6738476114655684 and parameters: {'splitter': 'random', 'min_samples_split': 0.23803139394325232, 'min_samples_leaf': 0.17998679994302375, 'min_weight_fraction_leaf': 0.01769924651131572, 'max_features': 0.9328448558766467}. Best is trial 11 with value: 0.6773038119717333.[0m
