[32m[I 2022-04-21 17:52:33,549][0m Trial 440 finished with value: 0.8423387721471943 and parameters: {'loss': 'coxph', 'learning_rate': 7.189824170584214e-05, 'n_estimators': 211, 'criterion': 'friedman_mse', 'min_samples_split': 2, 'min_samples_leaf': 1, 'min_weight_fraction_leaf': 0.20529950744261777, 'min_impurity_decrease': 0.21099517603848536, 'max_features': 0.3142645326100249, 'subsample': 0.07408576658942706, 'dropout_rate': 0.11962594324027025, 'ccp_alpha': 0.17992101665852617}. Best is trial 244 with value: 0.8474070660226068.[0m
[32m[I 2022-04-21 17:52:39,135][0m Trial 441 finished with value: 0.8406517597485867 and parameters: {'loss': 'coxph', 'learning_rate': 5.4246683358852525e-05, 'n_estimators': 204, 'criterion': 'friedman_mse', 'min_samples_split': 3, 'min_samples_leaf': 1, 'min_weight_fraction_leaf': 0.17596634763253635, 'min_impurity_decrease': 0.24796021117222244, 'max_features': 0.37465994712795436, 'subsample': 0.09114636928063746, 'dropout_rate': 0.5272711344601884, 'ccp_alpha': 0.08775432643690369}. Best is trial 244 with value: 0.8474070660226068.[0m
[32m[I 2022-04-21 17:52:51,904][0m Trial 442 finished with value: 0.8448809644313657 and parameters: {'loss': 'coxph', 'learning_rate': 8.82709739736427e-05, 'n_estimators': 229, 'criterion': 'friedman_mse', 'min_samples_split': 4, 'min_samples_leaf': 1, 'min_weight_fraction_leaf': 0.19667271506482686, 'min_impurity_decrease': 0.1512721199022739, 'max_features': 0.33965859884742283, 'subsample': 0.035850505210564834, 'dropout_rate': 0.2787712009595126, 'ccp_alpha': 0.19097435550194747}. Best is trial 244 with value: 0.8474070660226068.[0m
[32m[I 2022-04-21 17:53:00,864][0m Trial 443 finished with value: 0.65 and parameters: {'loss': 'coxph', 'learning_rate': 9.161649952539552e-05, 'n_estimators': 183, 'criterion': 'friedman_mse', 'min_samples_split': 3, 'min_samples_leaf': 1, 'min_weight_fraction_leaf': 0.18603353597093364, 'min_impurity_decrease': 0.23599444143103637, 'max_features': 0.289898432451562, 'subsample': 0.6452951087269015, 'dropout_rate': 0.3191747840786439, 'ccp_alpha': 0.3357430356455897}. Best is trial 244 with value: 0.8474070660226068.[0m
[32m[I 2022-04-21 17:53:07,785][0m Trial 444 finished with value: 0.8413559897989448 and parameters: {'loss': 'coxph', 'learning_rate': 6.664825275893693e-05, 'n_estimators': 226, 'criterion': 'friedman_mse', 'min_samples_split': 3, 'min_samples_leaf': 1, 'min_weight_fraction_leaf': 0.17075340973145722, 'min_impurity_decrease': 0.2658358883890121, 'max_features': 0.3013647663794037, 'subsample': 0.24978369991078675, 'dropout_rate': 0.4943694944437826, 'ccp_alpha': 0.08574676420071493}. Best is trial 244 with value: 0.8474070660226068.[0m
[32m[I 2022-04-21 17:53:23,855][0m Trial 445 finished with value: 0.8439764648254553 and parameters: {'loss': 'coxph', 'learning_rate': 2.6193357223924782e-05, 'n_estimators': 238, 'criterion': 'friedman_mse', 'min_samples_split': 6, 'min_samples_leaf': 2, 'min_weight_fraction_leaf': 0.21861463399344497, 'min_impurity_decrease': 0.29374874536102125, 'max_features': 0.3973224850992257, 'subsample': 0.11424651565054081, 'dropout_rate': 0.131045206768325, 'ccp_alpha': 0.0054107379807411034}. Best is trial 244 with value: 0.8474070660226068.[0m
[32m[I 2022-04-21 17:53:37,528][0m Trial 446 finished with value: 0.8379399292189638 and parameters: {'loss': 'coxph', 'learning_rate': 0.004705252721489919, 'n_estimators': 256, 'criterion': 'friedman_mse', 'min_samples_split': 5, 'min_samples_leaf': 2, 'min_weight_fraction_leaf': 0.19721090139511965, 'min_impurity_decrease': 0.5242162817830248, 'max_features': 0.32174029864546233, 'subsample': 0.153512270651587, 'dropout_rate': 0.46090867552964665, 'ccp_alpha': 0.2629185942952843}. Best is trial 244 with value: 0.8474070660226068.[0m
[32m[I 2022-04-21 17:53:44,093][0m Trial 447 finished with value: 0.845226247563207 and parameters: {'loss': 'coxph', 'learning_rate': 0.006606945589144577, 'n_estimators': 196, 'criterion': 'friedman_mse', 'min_samples_split': 3, 'min_samples_leaf': 2, 'min_weight_fraction_leaf': 0.18215686131046294, 'min_impurity_decrease': 0.26117572026901337, 'max_features': 0.47996989321621464, 'subsample': 0.062013264557805356, 'dropout_rate': 0.5018889525996114, 'ccp_alpha': 0.11694437253016497}. Best is trial 244 with value: 0.8474070660226068.[0m
[32m[I 2022-04-21 17:53:49,710][0m Trial 448 finished with value: 0.65 and parameters: {'loss': 'coxph', 'learning_rate': 6.0901052527498964e-05, 'n_estimators': 213, 'criterion': 'friedman_mse', 'min_samples_split': 2, 'min_samples_leaf': 1, 'min_weight_fraction_leaf': 0.2122590990720519, 'min_impurity_decrease': 0.30425692501181567, 'max_features': 0.4176930029349192, 'subsample': 0.09326034629366964, 'dropout_rate': 0.5262080795034204, 'ccp_alpha': 1.5592874796883471}. Best is trial 244 with value: 0.8474070660226068.[0m
[32m[I 2022-04-21 17:55:49,281][0m Trial 449 finished with value: 0.8420453797779924 and parameters: {'loss': 'coxph', 'learning_rate': 9.832235311891758e-05, 'n_estimators': 914, 'criterion': 'friedman_mse', 'min_samples_split': 3, 'min_samples_leaf': 2, 'min_weight_fraction_leaf': 0.17223367940324286, 'min_impurity_decrease': 0.2770449525270755, 'max_features': 0.35992808710012286, 'subsample': 0.06543268092128994, 'dropout_rate': 0.43182493555764295, 'ccp_alpha': 0.48537142635408087}. Best is trial 244 with value: 0.8474070660226068.[0m
[32m[I 2022-04-21 17:56:19,074][0m Trial 450 finished with value: 0.8417460526131378 and parameters: {'loss': 'coxph', 'learning_rate': 0.002816184569472703, 'n_estimators': 332, 'criterion': 'friedman_mse', 'min_samples_split': 4, 'min_samples_leaf': 2, 'min_weight_fraction_leaf': 0.0247946036661377, 'min_impurity_decrease': 0.19971757185565714, 'max_features': 0.26963653168991025, 'subsample': 0.1193571694835023, 'dropout_rate': 0.10688221242250417, 'ccp_alpha': 0.20212922479644782}. Best is trial 244 with value: 0.8474070660226068.[0m
[32m[I 2022-04-21 17:58:20,778][0m Trial 451 finished with value: 0.7330825559363582 and parameters: {'loss': 'coxph', 'learning_rate': 4.727401726868385e-05, 'n_estimators': 955, 'criterion': 'squared_error', 'min_samples_split': 3, 'min_samples_leaf': 1, 'min_weight_fraction_leaf': 0.19017828217089805, 'min_impurity_decrease': 0.31915168692151713, 'max_features': 0.3404003166323314, 'subsample': 0.1912241888135876, 'dropout_rate': 0.5031335363667664, 'ccp_alpha': 0.11961329098190004}. Best is trial 244 with value: 0.8474070660226068.[0m
[32m[I 2022-04-21 17:58:28,344][0m Trial 452 finished with value: 0.8425978960683548 and parameters: {'loss': 'coxph', 'learning_rate': 0.011672667326797032, 'n_estimators': 239, 'criterion': 'friedman_mse', 'min_samples_split': 5, 'min_samples_leaf': 2, 'min_weight_fraction_leaf': 0.2002466431853628, 'min_impurity_decrease': 0.2517638222724884, 'max_features': 0.37865075737257764, 'subsample': 0.043347545293940026, 'dropout_rate': 0.5577783845256192, 'ccp_alpha': 0.3713593109986567}. Best is trial 244 with value: 0.8474070660226068.[0m
[32m[I 2022-04-21 17:58:44,948][0m Trial 453 finished with value: 0.65 and parameters: {'loss': 'coxph', 'learning_rate': 0.00011162534042191114, 'n_estimators': 381, 'criterion': 'friedman_mse', 'min_samples_split': 3, 'min_samples_leaf': 1, 'min_weight_fraction_leaf': 0.17782734723654925, 'min_impurity_decrease': 0.2858229258518559, 'max_features': 0.31044182908697127, 'subsample': 0.005883178147520353, 'dropout_rate': 0.5230854215200476, 'ccp_alpha': 4.814823714451737}. Best is trial 244 with value: 0.8474070660226068.[0m
[32m[I 2022-04-21 17:58:56,952][0m Trial 454 finished with value: 0.8429874219609191 and parameters: {'loss': 'coxph', 'learning_rate': 0.033940639686764904, 'n_estimators': 297, 'criterion': 'friedman_mse', 'min_samples_split': 3, 'min_samples_leaf': 5, 'min_weight_fraction_leaf': 0.16272952648268593, 'min_impurity_decrease': 0.2271238823995993, 'max_features': 0.5965491207840657, 'subsample': 0.07910499657438572, 'dropout_rate': 0.5890764770197658, 'ccp_alpha': 0.09796339947244809}. Best is trial 244 with value: 0.8474070660226068.[0m
[32m[I 2022-04-21 17:59:18,593][0m Trial 455 finished with value: 0.8372744251389272 and parameters: {'loss': 'coxph', 'learning_rate': 7.953609752801063e-05, 'n_estimators': 272, 'criterion': 'absolute_error', 'min_samples_split': 4, 'min_samples_leaf': 2, 'min_weight_fraction_leaf': 0.2053002688196186, 'min_impurity_decrease': 0.17274696668274642, 'max_features': 0.2815344589894719, 'subsample': 0.09775586869569515, 'dropout_rate': 0.1578277894946157, 'ccp_alpha': 0.24446635031555108}. Best is trial 244 with value: 0.8474070660226068.[0m
[32m[I 2022-04-21 17:59:36,208][0m Trial 456 finished with value: 0.8448193243294458 and parameters: {'loss': 'coxph', 'learning_rate': 0.005116153225178724, 'n_estimators': 250, 'criterion': 'friedman_mse', 'min_samples_split': 2, 'min_samples_leaf': 2, 'min_weight_fraction_leaf': 0.1870004422698877, 'min_impurity_decrease': 0.3309373580301628, 'max_features': 0.8817668783690035, 'subsample': 0.14519016268681698, 'dropout_rate': 0.1376359691645021, 'ccp_alpha': 0.010230511842656553}. Best is trial 244 with value: 0.8474070660226068.[0m
/media/san2_ssd/data/Workdir/survival/venv/lib/python3.8/site-packages/sksurv/ensemble/boosting.py:955: RuntimeWarning: divide by zero encountered in log
  time = numpy.log(time)
/media/san2_ssd/data/Workdir/survival/venv/lib/python3.8/site-packages/sksurv/ensemble/boosting.py:955: RuntimeWarning: divide by zero encountered in log
  time = numpy.log(time)
/media/san2_ssd/data/Workdir/survival/venv/lib/python3.8/site-packages/sksurv/ensemble/boosting.py:955: RuntimeWarning: divide by zero encountered in log
  time = numpy.log(time)
/media/san2_ssd/data/Workdir/survival/venv/lib/python3.8/site-packages/sksurv/ensemble/boosting.py:955: RuntimeWarning: divide by zero encountered in log
  time = numpy.log(time)
[32m[I 2022-04-21 17:59:40,652][0m Trial 457 finished with value: -0.4659541523403029 and parameters: {'loss': 'squared', 'learning_rate': 6.22578125994065e-05, 'n_estimators': 313, 'criterion': 'friedman_mse', 'min_samples_split': 6, 'min_samples_leaf': 2, 'min_weight_fraction_leaf': 0.19496261730311068, 'min_impurity_decrease': 0.30055997891725206, 'max_features': 0.9378512960098212, 'subsample': 0.05403169698511155, 'dropout_rate': 0.09482044603760134, 'ccp_alpha': 0.002789563301520359}. Best is trial 244 with value: 0.8474070660226068.[0m
[32m[I 2022-04-21 18:00:05,853][0m Trial 458 finished with value: 0.8441572716475841 and parameters: {'loss': 'coxph', 'learning_rate': 3.4831229797363524e-05, 'n_estimators': 347, 'criterion': 'friedman_mse', 'min_samples_split': 3, 'min_samples_leaf': 2, 'min_weight_fraction_leaf': 0.1692517946388066, 'min_impurity_decrease': 0.6634567942666005, 'max_features': 0.6446122334424242, 'subsample': 0.12879239168220052, 'dropout_rate': 0.16679345390250605, 'ccp_alpha': 0.16755119200102203}. Best is trial 244 with value: 0.8474070660226068.[0m
[32m[I 2022-04-21 18:00:22,483][0m Trial 459 finished with value: 0.8415392712656093 and parameters: {'loss': 'coxph', 'learning_rate': 0.008880774246924404, 'n_estimators': 283, 'criterion': 'friedman_mse', 'min_samples_split': 5, 'min_samples_leaf': 1, 'min_weight_fraction_leaf': 0.2107852786102688, 'min_impurity_decrease': 0.6945531405504115, 'max_features': 0.4429502026647436, 'subsample': 0.07851987737062481, 'dropout_rate': 0.11903967917672287, 'ccp_alpha': 0.31589353154648164}. Best is trial 244 with value: 0.8474070660226068.[0m
[32m[I 2022-04-21 18:00:40,606][0m Trial 460 finished with value: 0.65 and parameters: {'loss': 'coxph', 'learning_rate': 0.00010199524240035413, 'n_estimators': 264, 'criterion': 'friedman_mse', 'min_samples_split': 3, 'min_samples_leaf': 2, 'min_weight_fraction_leaf': 0.17902932698171092, 'min_impurity_decrease': 0.30886435417163194, 'max_features': 0.2393718020547512, 'subsample': 0.10776415843514474, 'dropout_rate': 0.07241458706347136, 'ccp_alpha': 2.4241480127133626}. Best is trial 244 with value: 0.8474070660226068.[0m
[32m[I 2022-04-21 18:00:51,635][0m Trial 461 finished with value: 0.65 and parameters: {'loss': 'coxph', 'learning_rate': 0.00012149183057508305, 'n_estimators': 220, 'criterion': 'friedman_mse', 'min_samples_split': 3, 'min_samples_leaf': 2, 'min_weight_fraction_leaf': 0.19099702941013966, 'min_impurity_decrease': 0.2767527670187994, 'max_features': 0.32514297492441774, 'subsample': 0.02445519280384429, 'dropout_rate': 0.14741947985978524, 'ccp_alpha': 3.384153115450058}. Best is trial 244 with value: 0.8474070660226068.[0m
[32m[I 2022-04-21 18:01:24,821][0m Trial 462 finished with value: 0.8415769903624497 and parameters: {'loss': 'coxph', 'learning_rate': 7.662486929226803e-05, 'n_estimators': 330, 'criterion': 'friedman_mse', 'min_samples_split': 3, 'min_samples_leaf': 1, 'min_weight_fraction_leaf': 0.155501975490426, 'min_impurity_decrease': 0.33464332000088426, 'max_features': 0.39393966617720255, 'subsample': 0.17064203697974697, 'dropout_rate': 0.04832634254155054, 'ccp_alpha': 0.10043361991356353}. Best is trial 244 with value: 0.8474070660226068.[0m
[32m[I 2022-04-21 18:01:49,457][0m Trial 463 finished with value: 0.8430713185066854 and parameters: {'loss': 'coxph', 'learning_rate': 0.000168924185705213, 'n_estimators': 293, 'criterion': 'friedman_mse', 'min_samples_split': 2, 'min_samples_leaf': 2, 'min_weight_fraction_leaf': 0.22058794059440257, 'min_impurity_decrease': 0.24634683780039335, 'max_features': 0.29931132009062256, 'subsample': 0.09304124229113821, 'dropout_rate': 0.1779229879533156, 'ccp_alpha': 0.1973167905014691}. Best is trial 244 with value: 0.8474070660226068.[0m
[32m[I 2022-04-21 18:02:05,783][0m Trial 464 finished with value: 0.8459613218460106 and parameters: {'loss': 'coxph', 'learning_rate': 8.646589319873307e-05, 'n_estimators': 234, 'criterion': 'friedman_mse', 'min_samples_split': 4, 'min_samples_leaf': 2, 'min_weight_fraction_leaf': 0.16869893533165614, 'min_impurity_decrease': 0.3120607932039643, 'max_features': 0.35419892291723387, 'subsample': 0.06483767437231083, 'dropout_rate': 0.11852639281052167, 'ccp_alpha': 0.08956899508833087}. Best is trial 244 with value: 0.8474070660226068.[0m
[32m[I 2022-04-21 18:02:10,930][0m Trial 465 finished with value: 0.8393744212108235 and parameters: {'loss': 'coxph', 'learning_rate': 5.0377198516921105e-05, 'n_estimators': 208, 'criterion': 'friedman_mse', 'min_samples_split': 4, 'min_samples_leaf': 2, 'min_weight_fraction_leaf': 0.16711688985236736, 'min_impurity_decrease': 0.3452182592442365, 'max_features': 0.3625610163529409, 'subsample': 0.045336210274843046, 'dropout_rate': 0.6842418773834829, 'ccp_alpha': 0.40573014075518343}. Best is trial 244 with value: 0.8474070660226068.[0m
[32m[I 2022-04-21 18:02:25,869][0m Trial 466 finished with value: 0.8437538554076849 and parameters: {'loss': 'coxph', 'learning_rate': 6.413026306591695e-05, 'n_estimators': 233, 'criterion': 'friedman_mse', 'min_samples_split': 4, 'min_samples_leaf': 1, 'min_weight_fraction_leaf': 0.1601330264300135, 'min_impurity_decrease': 0.31961988843458156, 'max_features': 0.349820538257507, 'subsample': 0.06403596026945882, 'dropout_rate': 0.1309339706088721, 'ccp_alpha': 0.25612501487810513}. Best is trial 244 with value: 0.8474070660226068.[0m
[32m[I 2022-04-21 18:02:45,429][0m Trial 467 finished with value: 0.8449750236565444 and parameters: {'loss': 'coxph', 'learning_rate': 7.895368779069303e-05, 'n_estimators': 243, 'criterion': 'friedman_mse', 'min_samples_split': 4, 'min_samples_leaf': 2, 'min_weight_fraction_leaf': 0.172408781946484, 'min_impurity_decrease': 0.30800051948986, 'max_features': 0.37342156611543814, 'subsample': 0.10882625492284409, 'dropout_rate': 0.15080863311790685, 'ccp_alpha': 0.16257700214412116}. Best is trial 244 with value: 0.8474070660226068.[0m
[32m[I 2022-04-21 18:03:02,919][0m Trial 468 finished with value: 0.8401911910460292 and parameters: {'loss': 'coxph', 'learning_rate': 0.006911747944677889, 'n_estimators': 228, 'criterion': 'friedman_mse', 'min_samples_split': 4, 'min_samples_leaf': 2, 'min_weight_fraction_leaf': 0.14201266690194533, 'min_impurity_decrease': 0.34952673300178383, 'max_features': 0.33285810065276294, 'subsample': 0.03506873094812473, 'dropout_rate': 0.12158877919678207, 'ccp_alpha': 0.29700575809466156}. Best is trial 244 with value: 0.8474070660226068.[0m
[32m[I 2022-04-21 18:03:15,149][0m Trial 469 finished with value: 0.8458491889300987 and parameters: {'loss': 'coxph', 'learning_rate': 4.175416173266014e-05, 'n_estimators': 221, 'criterion': 'friedman_mse', 'min_samples_split': 4, 'min_samples_leaf': 2, 'min_weight_fraction_leaf': 0.18081260764812443, 'min_impurity_decrease': 0.749767750612089, 'max_features': 0.4014278491762831, 'subsample': 0.08010615777949251, 'dropout_rate': 0.16530688575629707, 'ccp_alpha': 0.09032107584998285}. Best is trial 244 with value: 0.8474070660226068.[0m
[32m[I 2022-04-21 18:03:23,050][0m Trial 470 finished with value: 0.8452677169777413 and parameters: {'loss': 'coxph', 'learning_rate': 3.724441924849773e-05, 'n_estimators': 222, 'criterion': 'friedman_mse', 'min_samples_split': 4, 'min_samples_leaf': 2, 'min_weight_fraction_leaf': 0.16285825168306742, 'min_impurity_decrease': 0.7167305445541333, 'max_features': 0.40089021393546354, 'subsample': 0.06946678432806186, 'dropout_rate': 0.7760408072958769, 'ccp_alpha': 0.1906937042275978}. Best is trial 244 with value: 0.8474070660226068.[0m
[32m[I 2022-04-21 18:03:34,068][0m Trial 471 finished with value: 0.8420712298668528 and parameters: {'loss': 'coxph', 'learning_rate': 3.99124737107684e-05, 'n_estimators': 208, 'criterion': 'friedman_mse', 'min_samples_split': 4, 'min_samples_leaf': 1, 'min_weight_fraction_leaf': 0.17682296274901294, 'min_impurity_decrease': 0.7346619891112278, 'max_features': 0.42089594936885444, 'subsample': 0.05111608272485532, 'dropout_rate': 0.18053694784181173, 'ccp_alpha': 0.3940381762929546}. Best is trial 244 with value: 0.8474070660226068.[0m
[32m[I 2022-04-21 18:03:42,448][0m Trial 472 finished with value: 0.8449234126987193 and parameters: {'loss': 'coxph', 'learning_rate': 3.6807005135263215e-05, 'n_estimators': 236, 'criterion': 'friedman_mse', 'min_samples_split': 4, 'min_samples_leaf': 2, 'min_weight_fraction_leaf': 0.15960058549798883, 'min_impurity_decrease': 0.9321663176505715, 'max_features': 0.41645469482523373, 'subsample': 0.08949514803994554, 'dropout_rate': 0.4023289446195131, 'ccp_alpha': 0.09965839868535793}. Best is trial 244 with value: 0.8474070660226068.[0m
[32m[I 2022-04-21 18:03:50,960][0m Trial 473 finished with value: 0.8453011331233358 and parameters: {'loss': 'coxph', 'learning_rate': 2.502461098969724e-05, 'n_estimators': 196, 'criterion': 'friedman_mse', 'min_samples_split': 4, 'min_samples_leaf': 1, 'min_weight_fraction_leaf': 0.17907379039048, 'min_impurity_decrease': 0.29475459072972265, 'max_features': 0.38340324295649003, 'subsample': 0.07850206234793136, 'dropout_rate': 0.19917180418412403, 'ccp_alpha': 0.26127013410788724}. Best is trial 244 with value: 0.8474070660226068.[0m
[32m[I 2022-04-21 18:04:02,479][0m Trial 474 finished with value: 0.65 and parameters: {'loss': 'coxph', 'learning_rate': 5.0487253806875e-05, 'n_estimators': 222, 'criterion': 'squared_error', 'min_samples_split': 4, 'min_samples_leaf': 2, 'min_weight_fraction_leaf': 0.15006705953780655, 'min_impurity_decrease': 0.7472664233307399, 'max_features': 0.40044718282848035, 'subsample': 0.02067079875503653, 'dropout_rate': 0.1589605050468029, 'ccp_alpha': 0.09481796305714678}. Best is trial 244 with value: 0.8474070660226068.[0m
[32m[I 2022-04-21 18:04:13,223][0m Trial 475 finished with value: 0.8346364826426237 and parameters: {'loss': 'coxph', 'learning_rate': 4.352006123783749e-05, 'n_estimators': 231, 'criterion': 'friedman_mse', 'min_samples_split': 4, 'min_samples_leaf': 2, 'min_weight_fraction_leaf': 0.16917122467527088, 'min_impurity_decrease': 0.8388010605839313, 'max_features': 0.4605484683102993, 'subsample': 0.05468240425776874, 'dropout_rate': 0.17494589855943657, 'ccp_alpha': 0.5610206819783794}. Best is trial 244 with value: 0.8474070660226068.[0m
[32m[I 2022-04-21 18:04:22,638][0m Trial 476 finished with value: 0.8409559958067143 and parameters: {'loss': 'coxph', 'learning_rate': 0.0037227673093922094, 'n_estimators': 210, 'criterion': 'friedman_mse', 'min_samples_split': 4, 'min_samples_leaf': 2, 'min_weight_fraction_leaf': 0.18314681399303417, 'min_impurity_decrease': 0.6844361344874917, 'max_features': 0.4340593226345622, 'subsample': 0.09355935861280579, 'dropout_rate': 0.21474214450213017, 'ccp_alpha': 0.1938523319695103}. Best is trial 244 with value: 0.8474070660226068.[0m
/media/san2_ssd/data/Workdir/survival/venv/lib/python3.8/site-packages/sksurv/ensemble/boosting.py:955: RuntimeWarning: divide by zero encountered in log
  time = numpy.log(time)
/media/san2_ssd/data/Workdir/survival/venv/lib/python3.8/site-packages/sksurv/ensemble/boosting.py:955: RuntimeWarning: divide by zero encountered in log
  time = numpy.log(time)
/media/san2_ssd/data/Workdir/survival/venv/lib/python3.8/site-packages/sksurv/ensemble/boosting.py:955: RuntimeWarning: divide by zero encountered in log
  time = numpy.log(time)
/media/san2_ssd/data/Workdir/survival/venv/lib/python3.8/site-packages/sksurv/ensemble/boosting.py:955: RuntimeWarning: divide by zero encountered in log
  time = numpy.log(time)
