[32m[I 2022-04-21 18:04:23,970][0m Trial 477 finished with value: -0.4642880901066794 and parameters: {'loss': 'squared', 'learning_rate': 2.9402530604251902e-05, 'n_estimators': 171, 'criterion': 'friedman_mse', 'min_samples_split': 4, 'min_samples_leaf': 1, 'min_weight_fraction_leaf': 0.1716861829268235, 'min_impurity_decrease': 0.32143897518624504, 'max_features': 0.35554688716363775, 'subsample': 0.07386118407398744, 'dropout_rate': 0.16090366945606532, 'ccp_alpha': 0.30173121132045555}. Best is trial 244 with value: 0.8474070660226068.[0m
[32m[I 2022-04-21 18:04:32,260][0m Trial 478 finished with value: 0.8410549319802311 and parameters: {'loss': 'coxph', 'learning_rate': 5.5159538696722814e-05, 'n_estimators': 219, 'criterion': 'absolute_error', 'min_samples_split': 4, 'min_samples_leaf': 2, 'min_weight_fraction_leaf': 0.1865054190570009, 'min_impurity_decrease': 0.27891551584140817, 'max_features': 0.5644769770938748, 'subsample': 0.04044356957960257, 'dropout_rate': 0.24182262895625606, 'ccp_alpha': 0.10295823882701038}. Best is trial 244 with value: 0.8474070660226068.[0m
[32m[I 2022-04-21 18:04:44,853][0m Trial 479 finished with value: 0.65 and parameters: {'loss': 'coxph', 'learning_rate': 0.005635098533044266, 'n_estimators': 247, 'criterion': 'friedman_mse', 'min_samples_split': 5, 'min_samples_leaf': 2, 'min_weight_fraction_leaf': 0.15464222727207955, 'min_impurity_decrease': 0.6299704086015173, 'max_features': 0.3622138473181563, 'subsample': 0.0028942191561690395, 'dropout_rate': 0.1853327067888291, 'ccp_alpha': 0.16509886907290022}. Best is trial 244 with value: 0.8474070660226068.[0m
[32m[I 2022-04-21 18:04:57,467][0m Trial 480 finished with value: 0.7349432631381716 and parameters: {'loss': 'coxph', 'learning_rate': 6.0438783363238616e-05, 'n_estimators': 239, 'criterion': 'friedman_mse', 'min_samples_split': 4, 'min_samples_leaf': 1, 'min_weight_fraction_leaf': 0.1968975624214312, 'min_impurity_decrease': 0.7591562596803778, 'max_features': 0.38721515016371755, 'subsample': 0.10566811887956623, 'dropout_rate': 0.14309215360028035, 'ccp_alpha': 0.43855822777734427}. Best is trial 244 with value: 0.8474070660226068.[0m
[32m[I 2022-04-21 18:05:10,839][0m Trial 481 finished with value: 0.8448828387815119 and parameters: {'loss': 'coxph', 'learning_rate': 0.0024587416434053073, 'n_estimators': 250, 'criterion': 'friedman_mse', 'min_samples_split': 4, 'min_samples_leaf': 2, 'min_weight_fraction_leaf': 0.1394644740638825, 'min_impurity_decrease': 0.26044830200706426, 'max_features': 0.539348001981697, 'subsample': 0.05747739619373769, 'dropout_rate': 0.1954649789037298, 'ccp_alpha': 0.08987001310539208}. Best is trial 244 with value: 0.8474070660226068.[0m
[32m[I 2022-04-21 18:08:07,070][0m Trial 482 finished with value: 0.8446162023340543 and parameters: {'loss': 'coxph', 'learning_rate': 8.648748800577105e-05, 'n_estimators': 872, 'criterion': 'friedman_mse', 'min_samples_split': 5, 'min_samples_leaf': 2, 'min_weight_fraction_leaf': 0.1801157766984633, 'min_impurity_decrease': 0.33253057144789966, 'max_features': 0.3424785733796316, 'subsample': 0.08193085463987479, 'dropout_rate': 0.15689070858502582, 'ccp_alpha': 0.0030845895726569553}. Best is trial 244 with value: 0.8474070660226068.[0m
[32m[I 2022-04-21 18:08:14,846][0m Trial 483 finished with value: 0.7364453816258519 and parameters: {'loss': 'coxph', 'learning_rate': 6.763881312028296e-05, 'n_estimators': 215, 'criterion': 'friedman_mse', 'min_samples_split': 5, 'min_samples_leaf': 6, 'min_weight_fraction_leaf': 0.16757177637082196, 'min_impurity_decrease': 0.21702651823871466, 'max_features': 0.3779338962474569, 'subsample': 0.11826685961028505, 'dropout_rate': 0.3376361476139799, 'ccp_alpha': 0.2516311786716096}. Best is trial 244 with value: 0.8474070660226068.[0m
[32m[I 2022-04-21 18:08:21,121][0m Trial 484 finished with value: 0.8450700929961641 and parameters: {'loss': 'coxph', 'learning_rate': 0.004579318423201572, 'n_estimators': 230, 'criterion': 'friedman_mse', 'min_samples_split': 4, 'min_samples_leaf': 1, 'min_weight_fraction_leaf': 0.18653349822980983, 'min_impurity_decrease': 0.7737849959439219, 'max_features': 0.4033464680983705, 'subsample': 0.06643402719571309, 'dropout_rate': 0.5168245398797412, 'ccp_alpha': 0.1656423978245931}. Best is trial 244 with value: 0.8474070660226068.[0m
[32m[I 2022-04-21 18:08:34,202][0m Trial 485 finished with value: 0.7377066397697857 and parameters: {'loss': 'coxph', 'learning_rate': 0.007560632400073994, 'n_estimators': 259, 'criterion': 'friedman_mse', 'min_samples_split': 4, 'min_samples_leaf': 2, 'min_weight_fraction_leaf': 0.3122561148207124, 'min_impurity_decrease': 0.3119571006717426, 'max_features': 0.43362469922709534, 'subsample': 0.09741465408031558, 'dropout_rate': 0.17320008897288602, 'ccp_alpha': 0.32299962736513954}. Best is trial 244 with value: 0.8474070660226068.[0m
[32m[I 2022-04-21 18:09:44,177][0m Trial 486 finished with value: 0.65 and parameters: {'loss': 'coxph', 'learning_rate': 4.5260044529966835e-05, 'n_estimators': 517, 'criterion': 'friedman_mse', 'min_samples_split': 6, 'min_samples_leaf': 2, 'min_weight_fraction_leaf': 0.15723258727390774, 'min_impurity_decrease': 0.2875977077454298, 'max_features': 0.3177160875882942, 'subsample': 0.03211045461072383, 'dropout_rate': 0.12583666546872144, 'ccp_alpha': 0.10885459553565766}. Best is trial 244 with value: 0.8474070660226068.[0m
[32m[I 2022-04-21 18:09:56,814][0m Trial 487 finished with value: 0.8463154713870381 and parameters: {'loss': 'coxph', 'learning_rate': 9.808653788795539e-05, 'n_estimators': 239, 'criterion': 'friedman_mse', 'min_samples_split': 4, 'min_samples_leaf': 2, 'min_weight_fraction_leaf': 0.19408771833984784, 'min_impurity_decrease': 0.32989386194898845, 'max_features': 0.367748472835164, 'subsample': 0.08181346826214184, 'dropout_rate': 0.1408773997836246, 'ccp_alpha': 0.22123569879495134}. Best is trial 244 with value: 0.8474070660226068.[0m
[32m[I 2022-04-21 18:10:05,951][0m Trial 488 finished with value: 0.8382279181521726 and parameters: {'loss': 'coxph', 'learning_rate': 2.2088877471579297e-05, 'n_estimators': 188, 'criterion': 'friedman_mse', 'min_samples_split': 5, 'min_samples_leaf': 2, 'min_weight_fraction_leaf': 0.17477523869936754, 'min_impurity_decrease': 0.3340407917452229, 'max_features': 0.3736332401083201, 'subsample': 0.05482664632992227, 'dropout_rate': 0.1396314694668411, 'ccp_alpha': 0.4431413752090725}. Best is trial 244 with value: 0.8474070660226068.[0m
[32m[I 2022-04-21 18:10:08,472][0m Trial 489 finished with value: 0.8368032062511407 and parameters: {'loss': 'coxph', 'learning_rate': 0.00013560908824901695, 'n_estimators': 231, 'criterion': 'friedman_mse', 'min_samples_split': 2, 'min_samples_leaf': 2, 'min_weight_fraction_leaf': 0.09883725174828499, 'min_impurity_decrease': 0.33984476145916337, 'max_features': 0.36348427089497715, 'subsample': 0.07963912961659618, 'dropout_rate': 0.9221338226329225, 'ccp_alpha': 0.34138838846277003}. Best is trial 244 with value: 0.8474070660226068.[0m
[32m[I 2022-04-21 18:10:20,401][0m Trial 490 finished with value: 0.65 and parameters: {'loss': 'coxph', 'learning_rate': 8.366977897701579e-05, 'n_estimators': 215, 'criterion': 'friedman_mse', 'min_samples_split': 7, 'min_samples_leaf': 2, 'min_weight_fraction_leaf': 0.1659797888976586, 'min_impurity_decrease': 0.35885396585499874, 'max_features': 0.3433975424787801, 'subsample': 0.037250601501386545, 'dropout_rate': 0.11550646725939126, 'ccp_alpha': 0.23737346683085805}. Best is trial 244 with value: 0.8474070660226068.[0m
[32m[I 2022-04-21 18:10:27,664][0m Trial 491 finished with value: 0.6782430368947265 and parameters: {'loss': 'coxph', 'learning_rate': 0.00018266426573802606, 'n_estimators': 242, 'criterion': 'friedman_mse', 'min_samples_split': 4, 'min_samples_leaf': 2, 'min_weight_fraction_leaf': 0.1290579762130557, 'min_impurity_decrease': 0.3205153471892045, 'max_features': 0.4085742225817473, 'subsample': 0.06718244477250933, 'dropout_rate': 0.48064067351093687, 'ccp_alpha': 1.1477417351749868}. Best is trial 244 with value: 0.8474070660226068.[0m
[32m[I 2022-04-21 18:10:38,424][0m Trial 492 finished with value: 0.8440912274531602 and parameters: {'loss': 'coxph', 'learning_rate': 0.01563229319973209, 'n_estimators': 225, 'criterion': 'friedman_mse', 'min_samples_split': 5, 'min_samples_leaf': 2, 'min_weight_fraction_leaf': 0.20156365492900247, 'min_impurity_decrease': 0.30769982339961754, 'max_features': 0.3853940164804975, 'subsample': 0.09106425939149837, 'dropout_rate': 0.1404653525161962, 'ccp_alpha': 0.23285569208839577}. Best is trial 244 with value: 0.8474070660226068.[0m
[32m[I 2022-04-21 18:10:48,881][0m Trial 493 finished with value: 0.65 and parameters: {'loss': 'coxph', 'learning_rate': 0.0003981664576220814, 'n_estimators': 203, 'criterion': 'friedman_mse', 'min_samples_split': 2, 'min_samples_leaf': 2, 'min_weight_fraction_leaf': 0.18826613804769238, 'min_impurity_decrease': 0.3504260591776896, 'max_features': 0.3329323984957883, 'subsample': 0.02256158317487352, 'dropout_rate': 0.02850524192330589, 'ccp_alpha': 0.37367793328857657}. Best is trial 244 with value: 0.8474070660226068.[0m
[32m[I 2022-04-21 18:11:23,361][0m Trial 494 finished with value: 0.8388622573259582 and parameters: {'loss': 'coxph', 'learning_rate': 0.0008277128010114434, 'n_estimators': 418, 'criterion': 'friedman_mse', 'min_samples_split': 5, 'min_samples_leaf': 2, 'min_weight_fraction_leaf': 0.14875780395089874, 'min_impurity_decrease': 0.3288013337082338, 'max_features': 0.3500001078392621, 'subsample': 0.05321949789361846, 'dropout_rate': 0.0968604619244181, 'ccp_alpha': 0.498461686815225}. Best is trial 244 with value: 0.8474070660226068.[0m
[32m[I 2022-04-21 18:11:34,633][0m Trial 495 finished with value: 0.8443547705541652 and parameters: {'loss': 'coxph', 'learning_rate': 0.00011370670496087979, 'n_estimators': 238, 'criterion': 'friedman_mse', 'min_samples_split': 4, 'min_samples_leaf': 2, 'min_weight_fraction_leaf': 0.17450533985120206, 'min_impurity_decrease': 0.30486963203325385, 'max_features': 0.4206350279854754, 'subsample': 0.07731594215502215, 'dropout_rate': 0.13228111332258508, 'ccp_alpha': 0.17202694449461742}. Best is trial 244 with value: 0.8474070660226068.[0m
/media/san2_ssd/data/Workdir/survival/venv/lib/python3.8/site-packages/sksurv/ensemble/boosting.py:955: RuntimeWarning: divide by zero encountered in log
  time = numpy.log(time)
/media/san2_ssd/data/Workdir/survival/venv/lib/python3.8/site-packages/sksurv/ensemble/boosting.py:955: RuntimeWarning: divide by zero encountered in log
  time = numpy.log(time)
/media/san2_ssd/data/Workdir/survival/venv/lib/python3.8/site-packages/sksurv/ensemble/boosting.py:955: RuntimeWarning: divide by zero encountered in log
  time = numpy.log(time)
/media/san2_ssd/data/Workdir/survival/venv/lib/python3.8/site-packages/sksurv/ensemble/boosting.py:955: RuntimeWarning: divide by zero encountered in log
  time = numpy.log(time)
[32m[I 2022-04-21 18:11:50,626][0m Trial 496 finished with value: -0.4670319442700867 and parameters: {'loss': 'squared', 'learning_rate': 0.01032739670731891, 'n_estimators': 619, 'criterion': 'squared_error', 'min_samples_split': 9, 'min_samples_leaf': 2, 'min_weight_fraction_leaf': 0.18149331207820574, 'min_impurity_decrease': 0.6557242787540207, 'max_features': 0.31589032490702096, 'subsample': 0.09767338380679894, 'dropout_rate': 0.21958760269554636, 'ccp_alpha': 0.2897702573447625}. Best is trial 244 with value: 0.8474070660226068.[0m
[32m[I 2022-04-21 18:12:01,206][0m Trial 497 finished with value: 0.844786279865685 and parameters: {'loss': 'coxph', 'learning_rate': 6.8962170129754e-05, 'n_estimators': 248, 'criterion': 'friedman_mse', 'min_samples_split': 3, 'min_samples_leaf': 2, 'min_weight_fraction_leaf': 0.2044124960796993, 'min_impurity_decrease': 0.3226378162237138, 'max_features': 0.4498825670824781, 'subsample': 0.045236116947045844, 'dropout_rate': 0.18747280847079104, 'ccp_alpha': 0.17106526495816354}. Best is trial 244 with value: 0.8474070660226068.[0m
[32m[I 2022-04-21 18:14:27,153][0m Trial 498 finished with value: 0.739982442921589 and parameters: {'loss': 'coxph', 'learning_rate': 0.0002499675789467109, 'n_estimators': 809, 'criterion': 'friedman_mse', 'min_samples_split': 4, 'min_samples_leaf': 2, 'min_weight_fraction_leaf': 0.19221303334405693, 'min_impurity_decrease': 0.8073478687399065, 'max_features': 0.3884963582648343, 'subsample': 0.6896536130298357, 'dropout_rate': 0.1572114528061183, 'ccp_alpha': 0.10775205353252676}. Best is trial 244 with value: 0.8474070660226068.[0m
[32m[I 2022-04-21 18:14:36,072][0m Trial 499 finished with value: 0.8412008581212305 and parameters: {'loss': 'coxph', 'learning_rate': 5.396460827082743e-05, 'n_estimators': 223, 'criterion': 'friedman_mse', 'min_samples_split': 2, 'min_samples_leaf': 2, 'min_weight_fraction_leaf': 0.16279595120888055, 'min_impurity_decrease': 0.1808632851638097, 'max_features': 0.3622267715122407, 'subsample': 0.2917601020640294, 'dropout_rate': 0.10901369768273932, 'ccp_alpha': 0.08615563599817663}. Best is trial 244 with value: 0.8474070660226068.[0m
[32m[I 2022-04-21 18:14:46,193][0m Trial 500 finished with value: 0.8433974985028243 and parameters: {'loss': 'coxph', 'learning_rate': 3.087146937981477e-05, 'n_estimators': 234, 'criterion': 'absolute_error', 'min_samples_split': 3, 'min_samples_leaf': 2, 'min_weight_fraction_leaf': 0.17753333690804085, 'min_impurity_decrease': 0.3595125878150555, 'max_features': 0.47978363041940575, 'subsample': 0.07082305184728867, 'dropout_rate': 0.16928617715972713, 'ccp_alpha': 0.2486435156588005}. Best is trial 244 with value: 0.8474070660226068.[0m
[32m[I 2022-04-21 18:14:58,421][0m Trial 501 finished with value: 0.65 and parameters: {'loss': 'coxph', 'learning_rate': 0.0001557533489551328, 'n_estimators': 215, 'criterion': 'friedman_mse', 'min_samples_split': 6, 'min_samples_leaf': 2, 'min_weight_fraction_leaf': 0.1568587870597076, 'min_impurity_decrease': 0.269592602340375, 'max_features': 0.3317895948715343, 'subsample': 0.09139344208515571, 'dropout_rate': 0.13717073552032988, 'ccp_alpha': 2.5709978737962667}. Best is trial 244 with value: 0.8474070660226068.[0m
[32m[I 2022-04-21 18:15:10,886][0m Trial 502 finished with value: 0.8388934014519052 and parameters: {'loss': 'coxph', 'learning_rate': 0.005805102692837179, 'n_estimators': 251, 'criterion': 'friedman_mse', 'min_samples_split': 4, 'min_samples_leaf': 2, 'min_weight_fraction_leaf': 0.19253769353966751, 'min_impurity_decrease': 0.23924728023303446, 'max_features': 0.30655358005853056, 'subsample': 0.10526492255770896, 'dropout_rate': 0.20215499720529626, 'ccp_alpha': 0.350736916801308}. Best is trial 244 with value: 0.8474070660226068.[0m
[32m[I 2022-04-21 18:15:31,142][0m Trial 503 finished with value: 0.8434067824272636 and parameters: {'loss': 'coxph', 'learning_rate': 0.00327290439614303, 'n_estimators': 451, 'criterion': 'friedman_mse', 'min_samples_split': 3, 'min_samples_leaf': 2, 'min_weight_fraction_leaf': 0.2074306767430252, 'min_impurity_decrease': 0.33738471124559793, 'max_features': 0.34874311712230777, 'subsample': 0.06199206986269892, 'dropout_rate': 0.7327771274010044, 'ccp_alpha': 0.09723547125798175}. Best is trial 244 with value: 0.8474070660226068.[0m
[32m[I 2022-04-21 18:15:43,790][0m Trial 504 finished with value: 0.65 and parameters: {'loss': 'coxph', 'learning_rate': 9.902187803686643e-05, 'n_estimators': 255, 'criterion': 'friedman_mse', 'min_samples_split': 5, 'min_samples_leaf': 4, 'min_weight_fraction_leaf': 0.182731137363535, 'min_impurity_decrease': 0.7030359025202628, 'max_features': 0.37760821786584897, 'subsample': 0.022793081486739655, 'dropout_rate': 0.08289957647439583, 'ccp_alpha': 0.2028968373925299}. Best is trial 244 with value: 0.8474070660226068.[0m
[32m[I 2022-04-21 18:16:09,404][0m Trial 505 finished with value: 0.8438614543975301 and parameters: {'loss': 'coxph', 'learning_rate': 0.00012902227106767881, 'n_estimators': 360, 'criterion': 'friedman_mse', 'min_samples_split': 3, 'min_samples_leaf': 2, 'min_weight_fraction_leaf': 0.13686333335294257, 'min_impurity_decrease': 0.3028958366908813, 'max_features': 0.40880268626008737, 'subsample': 0.1222259167110782, 'dropout_rate': 0.1495943208683788, 'ccp_alpha': 0.00945882655544951}. Best is trial 244 with value: 0.8474070660226068.[0m
[32m[I 2022-04-21 18:16:15,922][0m Trial 506 finished with value: 0.8452630687595374 and parameters: {'loss': 'coxph', 'learning_rate': 0.004421259470163962, 'n_estimators': 204, 'criterion': 'friedman_mse', 'min_samples_split': 3, 'min_samples_leaf': 2, 'min_weight_fraction_leaf': 0.16820294023788881, 'min_impurity_decrease': 0.5916579497020713, 'max_features': 0.3303249840401997, 'subsample': 0.0775372561785449, 'dropout_rate': 0.36925493638250634, 'ccp_alpha': 0.1723125592959944}. Best is trial 244 with value: 0.8474070660226068.[0m
[32m[I 2022-04-21 18:16:33,365][0m Trial 507 finished with value: 0.6851829601634306 and parameters: {'loss': 'coxph', 'learning_rate': 7.211929400612056e-05, 'n_estimators': 240, 'criterion': 'friedman_mse', 'min_samples_split': 3, 'min_samples_leaf': 2, 'min_weight_fraction_leaf': 0.11881667616844406, 'min_impurity_decrease': 0.29320032996106693, 'max_features': 0.29936723389690384, 'subsample': 0.5243033272310125, 'dropout_rate': 0.12290989709281516, 'ccp_alpha': 0.2960366346042256}. Best is trial 244 with value: 0.8474070660226068.[0m
[32m[I 2022-04-21 18:16:45,612][0m Trial 508 finished with value: 0.8431577824859857 and parameters: {'loss': 'coxph', 'learning_rate': 9.27648076226945e-05, 'n_estimators': 227, 'criterion': 'friedman_mse', 'min_samples_split': 4, 'min_samples_leaf': 2, 'min_weight_fraction_leaf': 0.19697610388241546, 'min_impurity_decrease': 0.5025234939198625, 'max_features': 0.3642945315676072, 'subsample': 0.04327695331192639, 'dropout_rate': 0.29198296387791467, 'ccp_alpha': 0.0018451780565188064}. Best is trial 244 with value: 0.8474070660226068.[0m
[32m[I 2022-04-21 18:17:05,727][0m Trial 509 finished with value: 0.8442523905235829 and parameters: {'loss': 'coxph', 'learning_rate': 0.0001904769018182977, 'n_estimators': 318, 'criterion': 'friedman_mse', 'min_samples_split': 2, 'min_samples_leaf': 2, 'min_weight_fraction_leaf': 0.14569348777787705, 'min_impurity_decrease': 0.3625857517917026, 'max_features': 0.27473038958403895, 'subsample': 0.10772967662731811, 'dropout_rate': 0.25612089463589083, 'ccp_alpha': 0.09393699766777903}. Best is trial 244 with value: 0.8474070660226068.[0m
[32m[I 2022-04-21 18:17:25,109][0m Trial 510 finished with value: 0.8414937657254734 and parameters: {'loss': 'coxph', 'learning_rate': 5.135140044330404e-05, 'n_estimators': 261, 'criterion': 'friedman_mse', 'min_samples_split': 4, 'min_samples_leaf': 2, 'min_weight_fraction_leaf': 0.17146213762702134, 'min_impurity_decrease': 0.31952397987249265, 'max_features': 0.42772748760044627, 'subsample': 0.13847899896982507, 'dropout_rate': 0.17457163354927888, 'ccp_alpha': 0.20366806541893848}. Best is trial 244 with value: 0.8474070660226068.[0m
[32m[I 2022-04-21 18:17:39,991][0m Trial 511 finished with value: 0.8373392938718945 and parameters: {'loss': 'coxph', 'learning_rate': 0.008560475505262012, 'n_estimators': 243, 'criterion': 'friedman_mse', 'min_samples_split': 3, 'min_samples_leaf': 2, 'min_weight_fraction_leaf': 0.18637920231188773, 'min_impurity_decrease': 0.2712959743421003, 'max_features': 0.40029410901572465, 'subsample': 0.08074945974226115, 'dropout_rate': 0.09363963306969578, 'ccp_alpha': 0.41472621108241836}. Best is trial 244 with value: 0.8474070660226068.[0m
[32m[I 2022-04-21 18:18:05,352][0m Trial 512 finished with value: 0.8443678767871585 and parameters: {'loss': 'coxph', 'learning_rate': 3.968280204753138e-05, 'n_estimators': 342, 'criterion': 'friedman_mse', 'min_samples_split': 3, 'min_samples_leaf': 2, 'min_weight_fraction_leaf': 0.1564400094681889, 'min_impurity_decrease': 0.2036282300515676, 'max_features': 0.9215192458705682, 'subsample': 0.05410753637787268, 'dropout_rate': 0.06188803751509232, 'ccp_alpha': 0.07109634385523608}. Best is trial 244 with value: 0.8474070660226068.[0m
[32m[I 2022-04-21 18:18:24,099][0m Trial 513 finished with value: 0.65 and parameters: {'loss': 'coxph', 'learning_rate': 0.0001231759651555912, 'n_estimators': 306, 'criterion': 'friedman_mse', 'min_samples_split': 5, 'min_samples_leaf': 2, 'min_weight_fraction_leaf': 0.20182959971074205, 'min_impurity_decrease': 0.34295362161295206, 'max_features': 0.3152641866586026, 'subsample': 0.0951581682336364, 'dropout_rate': 0.19235064094780993, 'ccp_alpha': 3.7266302041866215}. Best is trial 244 with value: 0.8474070660226068.[0m
