[32m[I 2022-04-21 11:39:38,308][0m Trial 450 finished with value: 0.6738476114655684 and parameters: {'splitter': 'random', 'min_samples_split': 0.3796794762309608, 'min_samples_leaf': 0.1170838452644911, 'min_weight_fraction_leaf': 0.1831309697929509, 'max_features': 0.8639175992376292}. Best is trial 11 with value: 0.6773038119717333.[0m
[32m[I 2022-04-21 11:39:38,385][0m Trial 451 finished with value: 0.6738476114655684 and parameters: {'splitter': 'random', 'min_samples_split': 0.3419838732562215, 'min_samples_leaf': 0.1353891907404826, 'min_weight_fraction_leaf': 0.16718703752772995, 'max_features': 0.871146614850415}. Best is trial 11 with value: 0.6773038119717333.[0m
[32m[I 2022-04-21 11:39:38,455][0m Trial 452 finished with value: 0.6586187582319654 and parameters: {'splitter': 'random', 'min_samples_split': 0.041336988773643044, 'min_samples_leaf': 0.0639491579026854, 'min_weight_fraction_leaf': 0.20411158078538527, 'max_features': 0.9796100330026769}. Best is trial 11 with value: 0.6773038119717333.[0m
[32m[I 2022-04-21 11:39:38,525][0m Trial 453 finished with value: 0.662800366349585 and parameters: {'splitter': 'random', 'min_samples_split': 0.2917645958069757, 'min_samples_leaf': 0.16476744888208975, 'min_weight_fraction_leaf': 0.13945132146322245, 'max_features': 0.9302083976016872}. Best is trial 11 with value: 0.6773038119717333.[0m
[32m[I 2022-04-21 11:39:38,606][0m Trial 454 finished with value: 0.6738476114655684 and parameters: {'splitter': 'random', 'min_samples_split': 0.34208262825230606, 'min_samples_leaf': 0.13801158154820606, 'min_weight_fraction_leaf': 0.1732045168045122, 'max_features': 0.8509026061769271}. Best is trial 11 with value: 0.6773038119717333.[0m
[32m[I 2022-04-21 11:39:38,707][0m Trial 455 finished with value: 0.6543938115635641 and parameters: {'splitter': 'random', 'min_samples_split': 0.4066364733626704, 'min_samples_leaf': 0.1535769686399556, 'min_weight_fraction_leaf': 0.15229167582477102, 'max_features': 0.9110904031429513}. Best is trial 11 with value: 0.6773038119717333.[0m
[32m[I 2022-04-21 11:39:38,775][0m Trial 456 finished with value: 0.6738476114655684 and parameters: {'splitter': 'random', 'min_samples_split': 0.26396565857317644, 'min_samples_leaf': 0.1785249230907292, 'min_weight_fraction_leaf': 0.1616770705772189, 'max_features': 0.8971996538081872}. Best is trial 11 with value: 0.6773038119717333.[0m
[32m[I 2022-04-21 11:39:38,839][0m Trial 457 finished with value: 0.6650367998115423 and parameters: {'splitter': 'random', 'min_samples_split': 0.1732011204161824, 'min_samples_leaf': 0.0012774385848937416, 'min_weight_fraction_leaf': 0.11467389875994832, 'max_features': 0.9835369271943737}. Best is trial 11 with value: 0.6773038119717333.[0m
[32m[I 2022-04-21 11:39:38,909][0m Trial 458 finished with value: 0.6502080893344752 and parameters: {'splitter': 'random', 'min_samples_split': 0.2164949718058889, 'min_samples_leaf': 0.0898258169779568, 'min_weight_fraction_leaf': 0.14766030109495853, 'max_features': 0.9621878665760959}. Best is trial 11 with value: 0.6773038119717333.[0m
[32m[I 2022-04-21 11:39:38,968][0m Trial 459 finished with value: 0.6139501367869995 and parameters: {'splitter': 'best', 'min_samples_split': 0.364743072909779, 'min_samples_leaf': 0.31647989320564984, 'min_weight_fraction_leaf': 0.14219640917697562, 'max_features': 0.8405649054407758}. Best is trial 11 with value: 0.6773038119717333.[0m
[32m[I 2022-04-21 11:39:39,002][0m Trial 460 finished with value: 0.6738476114655684 and parameters: {'splitter': 'random', 'min_samples_split': 0.4623418141264435, 'min_samples_leaf': 0.03071098145957783, 'min_weight_fraction_leaf': 0.1703969955406724, 'max_features': 0.9428854646197887}. Best is trial 11 with value: 0.6773038119717333.[0m
[32m[I 2022-04-21 11:39:39,035][0m Trial 461 finished with value: 0.6650367998115423 and parameters: {'splitter': 'random', 'min_samples_split': 0.18576275872347123, 'min_samples_leaf': 0.015385311778720094, 'min_weight_fraction_leaf': 0.12423455512299736, 'max_features': 0.9962338853117887}. Best is trial 11 with value: 0.6773038119717333.[0m
[32m[I 2022-04-21 11:39:39,069][0m Trial 462 finished with value: 0.6136073090060808 and parameters: {'splitter': 'random', 'min_samples_split': 0.2098386509546587, 'min_samples_leaf': 0.09728537092912541, 'min_weight_fraction_leaf': 0.1516340370416348, 'max_features': 0.7861465294302734}. Best is trial 11 with value: 0.6773038119717333.[0m
[32m[I 2022-04-21 11:39:39,139][0m Trial 463 finished with value: 0.6551405301163737 and parameters: {'splitter': 'random', 'min_samples_split': 0.14796074803165854, 'min_samples_leaf': 0.22098975632596235, 'min_weight_fraction_leaf': 0.21433954831016894, 'max_features': 0.9670760218769271}. Best is trial 11 with value: 0.6773038119717333.[0m
[32m[I 2022-04-21 11:39:39,232][0m Trial 464 finished with value: 0.6640701022932763 and parameters: {'splitter': 'random', 'min_samples_split': 0.40841610422598934, 'min_samples_leaf': 0.12934819469055436, 'min_weight_fraction_leaf': 0.018758223511468386, 'max_features': 0.892274585453182}. Best is trial 11 with value: 0.6773038119717333.[0m
[32m[I 2022-04-21 11:39:39,268][0m Trial 465 finished with value: 0.6738476114655684 and parameters: {'splitter': 'random', 'min_samples_split': 0.17656606319234144, 'min_samples_leaf': 0.06535375008528682, 'min_weight_fraction_leaf': 0.195406761938147, 'max_features': 0.9536119600311375}. Best is trial 11 with value: 0.6773038119717333.[0m
[32m[I 2022-04-21 11:39:39,305][0m Trial 466 finished with value: 0.6640701022932763 and parameters: {'splitter': 'random', 'min_samples_split': 0.1738230704423758, 'min_samples_leaf': 0.012027185448511231, 'min_weight_fraction_leaf': 0.12985106372479163, 'max_features': 0.9845419887841373}. Best is trial 11 with value: 0.6773038119717333.[0m
[32m[I 2022-04-21 11:39:39,342][0m Trial 467 finished with value: 0.5931624331547747 and parameters: {'splitter': 'random', 'min_samples_split': 0.012683874261089067, 'min_samples_leaf': 0.18989134911603422, 'min_weight_fraction_leaf': 0.23689395021531623, 'max_features': 0.830562263988135}. Best is trial 11 with value: 0.6773038119717333.[0m
[32m[I 2022-04-21 11:39:39,380][0m Trial 468 finished with value: 0.6571960671138655 and parameters: {'splitter': 'random', 'min_samples_split': 0.45433036995110715, 'min_samples_leaf': 0.031688610882159414, 'min_weight_fraction_leaf': 0.01104775607694878, 'max_features': 0.9300757228917885}. Best is trial 11 with value: 0.6773038119717333.[0m
[32m[I 2022-04-21 11:39:39,446][0m Trial 469 finished with value: 0.5931624331547747 and parameters: {'splitter': 'random', 'min_samples_split': 0.29932368613600746, 'min_samples_leaf': 0.24429137085026814, 'min_weight_fraction_leaf': 0.03823936230668921, 'max_features': 0.8837792340840464}. Best is trial 11 with value: 0.6773038119717333.[0m
[32m[I 2022-04-21 11:39:39,554][0m Trial 470 finished with value: 0.6738476114655684 and parameters: {'splitter': 'random', 'min_samples_split': 0.24156319394380127, 'min_samples_leaf': 0.015303766334539153, 'min_weight_fraction_leaf': 0.19512274740451283, 'max_features': 0.9581916496281946}. Best is trial 11 with value: 0.6773038119717333.[0m
[32m[I 2022-04-21 11:39:39,628][0m Trial 471 finished with value: 0.6640701022932763 and parameters: {'splitter': 'random', 'min_samples_split': 0.17850540906357198, 'min_samples_leaf': 0.020435020610123984, 'min_weight_fraction_leaf': 0.1372541680747572, 'max_features': 0.9963229672167317}. Best is trial 11 with value: 0.6773038119717333.[0m
[32m[I 2022-04-21 11:39:39,662][0m Trial 472 finished with value: 0.6551405301163737 and parameters: {'splitter': 'random', 'min_samples_split': 0.19041285827703902, 'min_samples_leaf': 0.05568548097973925, 'min_weight_fraction_leaf': 0.22131273839679297, 'max_features': 0.9549344205103252}. Best is trial 11 with value: 0.6773038119717333.[0m
[32m[I 2022-04-21 11:39:39,712][0m Trial 473 finished with value: 0.6738476114655684 and parameters: {'splitter': 'random', 'min_samples_split': 0.4220368402370632, 'min_samples_leaf': 0.1247330275363023, 'min_weight_fraction_leaf': 0.1789766858521658, 'max_features': 0.9052712121173082}. Best is trial 11 with value: 0.6773038119717333.[0m
[32m[I 2022-04-21 11:39:39,782][0m Trial 474 finished with value: 0.6502080893344752 and parameters: {'splitter': 'random', 'min_samples_split': 0.2827650616947207, 'min_samples_leaf': 0.14741542004407931, 'min_weight_fraction_leaf': 0.06446936672749026, 'max_features': 0.9104128277443955}. Best is trial 11 with value: 0.6773038119717333.[0m
[32m[I 2022-04-21 11:39:39,841][0m Trial 475 finished with value: 0.6738476114655684 and parameters: {'splitter': 'random', 'min_samples_split': 0.4521227061663223, 'min_samples_leaf': 0.032112314224034925, 'min_weight_fraction_leaf': 0.17741206582495733, 'max_features': 0.9182577458511362}. Best is trial 11 with value: 0.6773038119717333.[0m
[32m[I 2022-04-21 11:39:39,875][0m Trial 476 finished with value: 0.6738476114655684 and parameters: {'splitter': 'random', 'min_samples_split': 0.20545302628507928, 'min_samples_leaf': 0.0013304938295922585, 'min_weight_fraction_leaf': 0.19515804492496514, 'max_features': 0.9741755566527589}. Best is trial 11 with value: 0.6773038119717333.[0m
[32m[I 2022-04-21 11:39:39,935][0m Trial 477 finished with value: 0.6586187582319654 and parameters: {'splitter': 'random', 'min_samples_split': 0.16762392960420913, 'min_samples_leaf': 0.20464456137319909, 'min_weight_fraction_leaf': 0.20833479523730108, 'max_features': 0.9394754376061825}. Best is trial 11 with value: 0.6773038119717333.[0m
[32m[I 2022-04-21 11:39:39,992][0m Trial 478 finished with value: 0.6586187582319654 and parameters: {'splitter': 'random', 'min_samples_split': 0.1397090564669226, 'min_samples_leaf': 0.12614367574069504, 'min_weight_fraction_leaf': 0.20369605457912843, 'max_features': 0.8722725324003455}. Best is trial 11 with value: 0.6773038119717333.[0m
[32m[I 2022-04-21 11:39:40,089][0m Trial 479 finished with value: 0.6586187582319654 and parameters: {'splitter': 'random', 'min_samples_split': 0.24783431639777787, 'min_samples_leaf': 0.05239715898727977, 'min_weight_fraction_leaf': 0.21173163038792217, 'max_features': 0.8212597733040718}. Best is trial 11 with value: 0.6773038119717333.[0m
[32m[I 2022-04-21 11:39:40,138][0m Trial 480 finished with value: 0.6653971133665625 and parameters: {'splitter': 'best', 'min_samples_split': 0.308717689842144, 'min_samples_leaf': 0.14411464541434127, 'min_weight_fraction_leaf': 0.15840027224974354, 'max_features': 0.9240624767298147}. Best is trial 11 with value: 0.6773038119717333.[0m
[32m[I 2022-04-21 11:39:40,172][0m Trial 481 finished with value: 0.662800366349585 and parameters: {'splitter': 'random', 'min_samples_split': 0.40199646351551116, 'min_samples_leaf': 0.1614415089235562, 'min_weight_fraction_leaf': 0.11446305309169665, 'max_features': 0.925150754537501}. Best is trial 11 with value: 0.6773038119717333.[0m
[32m[I 2022-04-21 11:39:40,205][0m Trial 482 finished with value: 0.662800366349585 and parameters: {'splitter': 'random', 'min_samples_split': 0.06966821147422345, 'min_samples_leaf': 0.16651233455782788, 'min_weight_fraction_leaf': 0.13506479044159161, 'max_features': 0.9401690947724699}. Best is trial 11 with value: 0.6773038119717333.[0m
[32m[I 2022-04-21 11:39:40,239][0m Trial 483 finished with value: 0.6738476114655684 and parameters: {'splitter': 'random', 'min_samples_split': 0.3925113322375601, 'min_samples_leaf': 0.17627287696338179, 'min_weight_fraction_leaf': 0.15648369586861757, 'max_features': 0.9739150346184461}. Best is trial 11 with value: 0.6773038119717333.[0m
[32m[I 2022-04-21 11:39:40,291][0m Trial 484 finished with value: 0.662800366349585 and parameters: {'splitter': 'random', 'min_samples_split': 0.27258195395954876, 'min_samples_leaf': 0.15647353558307864, 'min_weight_fraction_leaf': 0.16278181644993317, 'max_features': 0.9643470288621053}. Best is trial 11 with value: 0.6773038119717333.[0m
[32m[I 2022-04-21 11:39:40,355][0m Trial 485 finished with value: 0.6544965468490955 and parameters: {'splitter': 'random', 'min_samples_split': 0.10737315055302343, 'min_samples_leaf': 0.04327021701388961, 'min_weight_fraction_leaf': 0.015725815044934376, 'max_features': 0.8547995285654357}. Best is trial 11 with value: 0.6773038119717333.[0m
[32m[I 2022-04-21 11:39:40,426][0m Trial 486 finished with value: 0.6738476114655684 and parameters: {'splitter': 'random', 'min_samples_split': 0.2490007860451684, 'min_samples_leaf': 0.1695337261456641, 'min_weight_fraction_leaf': 0.16718073391691113, 'max_features': 0.823673406225104}. Best is trial 11 with value: 0.6773038119717333.[0m
[32m[I 2022-04-21 11:39:40,485][0m Trial 487 finished with value: 0.6502080893344752 and parameters: {'splitter': 'random', 'min_samples_split': 0.279335810591073, 'min_samples_leaf': 0.1441803083065679, 'min_weight_fraction_leaf': 0.14758468473032893, 'max_features': 0.9143946950500205}. Best is trial 11 with value: 0.6773038119717333.[0m
[32m[I 2022-04-21 11:39:40,519][0m Trial 488 finished with value: 0.6738476114655684 and parameters: {'splitter': 'random', 'min_samples_split': 0.3385996347910266, 'min_samples_leaf': 0.021088820707097885, 'min_weight_fraction_leaf': 0.17933361259074188, 'max_features': 0.978800674316277}. Best is trial 11 with value: 0.6773038119717333.[0m
[32m[I 2022-04-21 11:39:40,553][0m Trial 489 finished with value: 0.6738476114655684 and parameters: {'splitter': 'random', 'min_samples_split': 0.22606193531187738, 'min_samples_leaf': 0.010948784553188318, 'min_weight_fraction_leaf': 0.20019728420527558, 'max_features': 0.8781386276273038}. Best is trial 11 with value: 0.6773038119717333.[0m
[32m[I 2022-04-21 11:39:40,588][0m Trial 490 finished with value: 0.6738476114655684 and parameters: {'splitter': 'random', 'min_samples_split': 0.21600146781067708, 'min_samples_leaf': 0.02604584727538525, 'min_weight_fraction_leaf': 0.1877894712906097, 'max_features': 0.9809839552642591}. Best is trial 11 with value: 0.6773038119717333.[0m
[32m[I 2022-04-21 11:39:40,622][0m Trial 491 finished with value: 0.6738476114655684 and parameters: {'splitter': 'random', 'min_samples_split': 0.2279375940325119, 'min_samples_leaf': 0.011706039132321613, 'min_weight_fraction_leaf': 0.19341478761643574, 'max_features': 0.874503073226902}. Best is trial 11 with value: 0.6773038119717333.[0m
[32m[I 2022-04-21 11:39:40,657][0m Trial 492 finished with value: 0.6738476114655684 and parameters: {'splitter': 'random', 'min_samples_split': 0.21794093911151965, 'min_samples_leaf': 0.022138681525428902, 'min_weight_fraction_leaf': 0.18612230016113743, 'max_features': 0.9964710037056483}. Best is trial 11 with value: 0.6773038119717333.[0m
[32m[I 2022-04-21 11:39:40,699][0m Trial 493 finished with value: 0.5 and parameters: {'splitter': 'random', 'min_samples_split': 0.04195536340881313, 'min_samples_leaf': 0.017982493692744864, 'min_weight_fraction_leaf': 0.22047982108192726, 'max_features': 0.37372958855973093}. Best is trial 11 with value: 0.6773038119717333.[0m
[32m[I 2022-04-21 11:39:40,746][0m Trial 494 finished with value: 0.6738476114655684 and parameters: {'splitter': 'random', 'min_samples_split': 0.3803373097590121, 'min_samples_leaf': 0.007339792152755552, 'min_weight_fraction_leaf': 0.1839286377998911, 'max_features': 0.9947313465888186}. Best is trial 11 with value: 0.6773038119717333.[0m
[32m[I 2022-04-21 11:39:40,786][0m Trial 495 finished with value: 0.5 and parameters: {'splitter': 'random', 'min_samples_split': 0.03351075036039198, 'min_samples_leaf': 0.0018378317456877909, 'min_weight_fraction_leaf': 0.2020815191922323, 'max_features': 0.1273100349270831}. Best is trial 11 with value: 0.6773038119717333.[0m
[32m[I 2022-04-21 11:39:40,854][0m Trial 496 finished with value: 0.6738476114655684 and parameters: {'splitter': 'random', 'min_samples_split': 0.3631422605000317, 'min_samples_leaf': 0.009313957440051894, 'min_weight_fraction_leaf': 0.1830532701228772, 'max_features': 0.9893081824227361}. Best is trial 11 with value: 0.6773038119717333.[0m
[32m[I 2022-04-21 11:39:40,910][0m Trial 497 finished with value: 0.662800366349585 and parameters: {'splitter': 'random', 'min_samples_split': 0.40846389205888334, 'min_samples_leaf': 0.16552379705096606, 'min_weight_fraction_leaf': 0.1542611977691623, 'max_features': 0.9422277338058715}. Best is trial 11 with value: 0.6773038119717333.[0m
[32m[I 2022-04-21 11:39:40,949][0m Trial 498 finished with value: 0.6636900948801576 and parameters: {'splitter': 'best', 'min_samples_split': 0.4145010884981931, 'min_samples_leaf': 0.18622575698470423, 'min_weight_fraction_leaf': 0.12529007560039743, 'max_features': 0.8962810170191071}. Best is trial 11 with value: 0.6773038119717333.[0m
[32m[I 2022-04-21 11:39:40,991][0m Trial 499 finished with value: 0.6738476114655684 and parameters: {'splitter': 'random', 'min_samples_split': 0.43935187252477864, 'min_samples_leaf': 0.17133173224308412, 'min_weight_fraction_leaf': 0.16276731001149614, 'max_features': 0.9493620295845853}. Best is trial 11 with value: 0.6773038119717333.[0m
[32m[I 2022-04-21 11:39:41,063][0m Trial 500 finished with value: 0.5 and parameters: {'splitter': 'random', 'min_samples_split': 0.13191440466350438, 'min_samples_leaf': 0.42081207244561936, 'min_weight_fraction_leaf': 0.1705067740552249, 'max_features': 0.7180130490014042}. Best is trial 11 with value: 0.6773038119717333.[0m
[32m[I 2022-04-21 11:39:41,105][0m Trial 501 finished with value: 0.6738476114655684 and parameters: {'splitter': 'random', 'min_samples_split': 0.2586027298255971, 'min_samples_leaf': 0.19440963477656478, 'min_weight_fraction_leaf': 0.14691735869564568, 'max_features': 0.8505016809334577}. Best is trial 11 with value: 0.6773038119717333.[0m
[32m[I 2022-04-21 11:39:41,140][0m Trial 502 finished with value: 0.6738476114655684 and parameters: {'splitter': 'random', 'min_samples_split': 0.12465072802230143, 'min_samples_leaf': 0.029029767320272747, 'min_weight_fraction_leaf': 0.17086133607515114, 'max_features': 0.8525836577040616}. Best is trial 11 with value: 0.6773038119717333.[0m
[32m[I 2022-04-21 11:39:41,190][0m Trial 503 finished with value: 0.6738476114655684 and parameters: {'splitter': 'random', 'min_samples_split': 0.028734965831169357, 'min_samples_leaf': 0.10283505690427977, 'min_weight_fraction_leaf': 0.17091396099877432, 'max_features': 0.8022020540230776}. Best is trial 11 with value: 0.6773038119717333.[0m
[32m[I 2022-04-21 11:39:41,261][0m Trial 504 finished with value: 0.6738476114655684 and parameters: {'splitter': 'random', 'min_samples_split': 0.03764859783385671, 'min_samples_leaf': 0.009514911330009906, 'min_weight_fraction_leaf': 0.17594083076934022, 'max_features': 0.9673984065258068}. Best is trial 11 with value: 0.6773038119717333.[0m
[32m[I 2022-04-21 11:39:41,350][0m Trial 505 finished with value: 0.5305100038533069 and parameters: {'splitter': 'random', 'min_samples_split': 0.05091466338724188, 'min_samples_leaf': 0.09779624544013248, 'min_weight_fraction_leaf': 0.17363491884300783, 'max_features': 0.7658948831333205}. Best is trial 11 with value: 0.6773038119717333.[0m
[32m[I 2022-04-21 11:39:41,471][0m Trial 506 finished with value: 0.6738476114655684 and parameters: {'splitter': 'random', 'min_samples_split': 0.1928434476632711, 'min_samples_leaf': 0.0021212287441813877, 'min_weight_fraction_leaf': 0.18428226605670553, 'max_features': 0.9681214634600637}. Best is trial 11 with value: 0.6773038119717333.[0m
[32m[I 2022-04-21 11:39:41,535][0m Trial 507 finished with value: 0.6586187582319654 and parameters: {'splitter': 'random', 'min_samples_split': 0.28911114415993194, 'min_samples_leaf': 0.2017025361890689, 'min_weight_fraction_leaf': 0.05107888684382826, 'max_features': 0.9064685248511116}. Best is trial 11 with value: 0.6773038119717333.[0m
[32m[I 2022-04-21 11:39:41,678][0m Trial 508 finished with value: 0.6738476114655684 and parameters: {'splitter': 'random', 'min_samples_split': 0.4258124793030523, 'min_samples_leaf': 0.11045249856985853, 'min_weight_fraction_leaf': 0.17502594292410234, 'max_features': 0.9036501570410553}. Best is trial 11 with value: 0.6773038119717333.[0m
[32m[I 2022-04-21 11:39:41,730][0m Trial 509 finished with value: 0.6738476114655684 and parameters: {'splitter': 'random', 'min_samples_split': 0.1709232609922089, 'min_samples_leaf': 0.17289733578724215, 'min_weight_fraction_leaf': 0.132864223581606, 'max_features': 0.8298419624990233}. Best is trial 11 with value: 0.6773038119717333.[0m
[32m[I 2022-04-21 11:39:41,832][0m Trial 510 finished with value: 0.6650367998115423 and parameters: {'splitter': 'random', 'min_samples_split': 0.1799594357486533, 'min_samples_leaf': 0.10595833443780439, 'min_weight_fraction_leaf': 0.12481815945240161, 'max_features': 0.825006248644189}. Best is trial 11 with value: 0.6773038119717333.[0m
[32m[I 2022-04-21 11:39:41,950][0m Trial 511 finished with value: 0.6738476114655684 and parameters: {'splitter': 'random', 'min_samples_split': 0.16541373486939717, 'min_samples_leaf': 0.1895231126880826, 'min_weight_fraction_leaf': 0.16306550482012636, 'max_features': 0.941652984896464}. Best is trial 11 with value: 0.6773038119717333.[0m
[32m[I 2022-04-21 11:39:42,078][0m Trial 512 finished with value: 0.6502080893344752 and parameters: {'splitter': 'random', 'min_samples_split': 0.17973493331505228, 'min_samples_leaf': 0.01611776954557843, 'min_weight_fraction_leaf': 0.15165681666046735, 'max_features': 0.9510804399545715}. Best is trial 11 with value: 0.6773038119717333.[0m
