[32m[I 2022-04-21 11:39:46,814][0m Trial 576 finished with value: 0.5 and parameters: {'splitter': 'random', 'min_samples_split': 0.17593337850291124, 'min_samples_leaf': 0.027141795455065117, 'min_weight_fraction_leaf': 0.22781117581548724, 'max_features': 0.7932000317270886}. Best is trial 11 with value: 0.6773038119717333.[0m
[32m[I 2022-04-21 11:39:46,856][0m Trial 577 finished with value: 0.662800366349585 and parameters: {'splitter': 'random', 'min_samples_split': 0.32634880930453347, 'min_samples_leaf': 0.1561857099221311, 'min_weight_fraction_leaf': 0.1639948206540309, 'max_features': 0.924705627072668}. Best is trial 11 with value: 0.6773038119717333.[0m
[32m[I 2022-04-21 11:39:46,925][0m Trial 578 finished with value: 0.6640701022932763 and parameters: {'splitter': 'random', 'min_samples_split': 0.4584172146946502, 'min_samples_leaf': 0.13070661358676214, 'min_weight_fraction_leaf': 0.011279134295126635, 'max_features': 0.9582258650262824}. Best is trial 11 with value: 0.6773038119717333.[0m
[32m[I 2022-04-21 11:39:46,968][0m Trial 579 finished with value: 0.6502080893344752 and parameters: {'splitter': 'random', 'min_samples_split': 0.18033948933071467, 'min_samples_leaf': 0.09010213677607232, 'min_weight_fraction_leaf': 0.1478248780949853, 'max_features': 0.8398659966797487}. Best is trial 11 with value: 0.6773038119717333.[0m
[32m[I 2022-04-21 11:39:47,030][0m Trial 580 finished with value: 0.6640701022932763 and parameters: {'splitter': 'random', 'min_samples_split': 0.187753083921888, 'min_samples_leaf': 0.0017168567995180977, 'min_weight_fraction_leaf': 0.14080696859615732, 'max_features': 0.9668121039878432}. Best is trial 11 with value: 0.6773038119717333.[0m
[32m[I 2022-04-21 11:39:47,120][0m Trial 581 finished with value: 0.6586187582319654 and parameters: {'splitter': 'random', 'min_samples_split': 0.29634494529054395, 'min_samples_leaf': 0.21031053676107048, 'min_weight_fraction_leaf': 0.06933098483984591, 'max_features': 0.8876427827115859}. Best is trial 11 with value: 0.6773038119717333.[0m
[32m[I 2022-04-21 11:39:47,172][0m Trial 582 finished with value: 0.6738476114655684 and parameters: {'splitter': 'random', 'min_samples_split': 0.38878310810959543, 'min_samples_leaf': 0.10996982130574945, 'min_weight_fraction_leaf': 0.19118535284592927, 'max_features': 0.9140739307474129}. Best is trial 11 with value: 0.6773038119717333.[0m
[32m[I 2022-04-21 11:39:47,261][0m Trial 583 finished with value: 0.6536302897478448 and parameters: {'splitter': 'random', 'min_samples_split': 0.19770813952307303, 'min_samples_leaf': 0.10042150108555828, 'min_weight_fraction_leaf': 0.1387376319753801, 'max_features': 0.742225276221638}. Best is trial 11 with value: 0.6773038119717333.[0m
[32m[I 2022-04-21 11:39:47,302][0m Trial 584 finished with value: 0.5 and parameters: {'splitter': 'random', 'min_samples_split': 0.07914859722394066, 'min_samples_leaf': 0.15357509548449938, 'min_weight_fraction_leaf': 0.29286205876282545, 'max_features': 0.5171913715661562}. Best is trial 11 with value: 0.6773038119717333.[0m
[32m[I 2022-04-21 11:39:47,345][0m Trial 585 finished with value: 0.6543938115635641 and parameters: {'splitter': 'random', 'min_samples_split': 0.26652135304915453, 'min_samples_leaf': 0.1577666395194747, 'min_weight_fraction_leaf': 0.15440247858312617, 'max_features': 0.8535593425789488}. Best is trial 11 with value: 0.6773038119717333.[0m
[32m[I 2022-04-21 11:39:47,382][0m Trial 586 finished with value: 0.6738476114655684 and parameters: {'splitter': 'random', 'min_samples_split': 0.3619224175130767, 'min_samples_leaf': 0.1877153529211823, 'min_weight_fraction_leaf': 0.16635976130065194, 'max_features': 0.9967106571631285}. Best is trial 11 with value: 0.6773038119717333.[0m
[32m[I 2022-04-21 11:39:47,423][0m Trial 587 finished with value: 0.5 and parameters: {'splitter': 'random', 'min_samples_split': 0.17159695403506403, 'min_samples_leaf': 0.07376109930300828, 'min_weight_fraction_leaf': 0.21365366973803, 'max_features': 0.7689815002856317}. Best is trial 11 with value: 0.6773038119717333.[0m
[32m[I 2022-04-21 11:39:47,504][0m Trial 588 finished with value: 0.6738476114655684 and parameters: {'splitter': 'random', 'min_samples_split': 0.21487963657003856, 'min_samples_leaf': 0.07326094955768192, 'min_weight_fraction_leaf': 0.17856739468210708, 'max_features': 0.9715187730262784}. Best is trial 11 with value: 0.6773038119717333.[0m
[32m[I 2022-04-21 11:39:47,583][0m Trial 589 finished with value: 0.5 and parameters: {'splitter': 'random', 'min_samples_split': 0.16613871565367141, 'min_samples_leaf': 0.4726401039877072, 'min_weight_fraction_leaf': 0.17192789022535307, 'max_features': 0.8111488632015981}. Best is trial 11 with value: 0.6773038119717333.[0m
[32m[I 2022-04-21 11:39:47,637][0m Trial 590 finished with value: 0.6738476114655684 and parameters: {'splitter': 'random', 'min_samples_split': 0.20113291775295106, 'min_samples_leaf': 0.06457954927753205, 'min_weight_fraction_leaf': 0.179130967549778, 'max_features': 0.9754728856884266}. Best is trial 11 with value: 0.6773038119717333.[0m
[32m[I 2022-04-21 11:39:47,675][0m Trial 591 finished with value: 0.6738476114655684 and parameters: {'splitter': 'random', 'min_samples_split': 0.1813220962553701, 'min_samples_leaf': 0.027782671066560675, 'min_weight_fraction_leaf': 0.1686976365753054, 'max_features': 0.8323040363014326}. Best is trial 11 with value: 0.6773038119717333.[0m
[32m[I 2022-04-21 11:39:47,711][0m Trial 592 finished with value: 0.6502080893344752 and parameters: {'splitter': 'random', 'min_samples_split': 0.18926884960103202, 'min_samples_leaf': 0.05139828157415226, 'min_weight_fraction_leaf': 0.14861924718601385, 'max_features': 0.8554363051297722}. Best is trial 11 with value: 0.6773038119717333.[0m
[32m[I 2022-04-21 11:39:47,786][0m Trial 593 finished with value: 0.6738476114655684 and parameters: {'splitter': 'random', 'min_samples_split': 0.033710162545950134, 'min_samples_leaf': 0.032466197428756075, 'min_weight_fraction_leaf': 0.19438098697945175, 'max_features': 0.9564249011113668}. Best is trial 11 with value: 0.6773038119717333.[0m
[32m[I 2022-04-21 11:39:47,880][0m Trial 594 finished with value: 0.6502080893344752 and parameters: {'splitter': 'random', 'min_samples_split': 0.17056044201997508, 'min_samples_leaf': 0.03020245737387573, 'min_weight_fraction_leaf': 0.15034630879330527, 'max_features': 0.8077732816667154}. Best is trial 11 with value: 0.6773038119717333.[0m
[32m[I 2022-04-21 11:39:47,927][0m Trial 595 finished with value: 0.6636900948801576 and parameters: {'splitter': 'best', 'min_samples_split': 0.03786181583448728, 'min_samples_leaf': 0.00927160865733468, 'min_weight_fraction_leaf': 0.18604788956829055, 'max_features': 0.978855349379982}. Best is trial 11 with value: 0.6773038119717333.[0m
[32m[I 2022-04-21 11:39:47,968][0m Trial 596 finished with value: 0.6738476114655684 and parameters: {'splitter': 'random', 'min_samples_split': 0.4241144081814256, 'min_samples_leaf': 0.043372478745963214, 'min_weight_fraction_leaf': 0.19191815951359376, 'max_features': 0.9191614795968357}. Best is trial 11 with value: 0.6773038119717333.[0m
[32m[I 2022-04-21 11:39:48,008][0m Trial 597 finished with value: 0.6738476114655684 and parameters: {'splitter': 'random', 'min_samples_split': 0.37224647769108665, 'min_samples_leaf': 0.16791598872298968, 'min_weight_fraction_leaf': 0.19031882933727193, 'max_features': 0.9830807520757873}. Best is trial 11 with value: 0.6773038119717333.[0m
[32m[I 2022-04-21 11:39:48,062][0m Trial 598 finished with value: 0.6738476114655684 and parameters: {'splitter': 'random', 'min_samples_split': 0.3706558354357349, 'min_samples_leaf': 0.17357851773184121, 'min_weight_fraction_leaf': 0.18011065038132623, 'max_features': 0.9977636364196913}. Best is trial 11 with value: 0.6773038119717333.[0m
[32m[I 2022-04-21 11:39:48,143][0m Trial 599 finished with value: 0.6738476114655684 and parameters: {'splitter': 'random', 'min_samples_split': 0.3647407738164442, 'min_samples_leaf': 0.17752987921033514, 'min_weight_fraction_leaf': 0.16145510486560571, 'max_features': 0.9869988506670045}. Best is trial 11 with value: 0.6773038119717333.[0m
[32m[I 2022-04-21 11:39:48,206][0m Trial 600 finished with value: 0.662800366349585 and parameters: {'splitter': 'random', 'min_samples_split': 0.3860505249331118, 'min_samples_leaf': 0.001503109170334476, 'min_weight_fraction_leaf': 0.15989783015483675, 'max_features': 0.9979666436842161}. Best is trial 11 with value: 0.6773038119717333.[0m
[32m[I 2022-04-21 11:39:48,251][0m Trial 601 finished with value: 0.6571960671138655 and parameters: {'splitter': 'random', 'min_samples_split': 0.44732400545059503, 'min_samples_leaf': 0.023191738163514677, 'min_weight_fraction_leaf': 0.02751226254521444, 'max_features': 0.934878362978897}. Best is trial 11 with value: 0.6773038119717333.[0m
[32m[I 2022-04-21 11:39:48,294][0m Trial 602 finished with value: 0.6738476114655684 and parameters: {'splitter': 'random', 'min_samples_split': 0.018539813894242124, 'min_samples_leaf': 0.012249457423068034, 'min_weight_fraction_leaf': 0.19924898148434078, 'max_features': 0.9737910509464469}. Best is trial 11 with value: 0.6773038119717333.[0m
[32m[I 2022-04-21 11:39:48,338][0m Trial 603 finished with value: 0.5 and parameters: {'splitter': 'random', 'min_samples_split': 0.4342881874479436, 'min_samples_leaf': 0.04824517005529501, 'min_weight_fraction_leaf': 0.3413802493078102, 'max_features': 0.8751843744728378}. Best is trial 11 with value: 0.6773038119717333.[0m
[32m[I 2022-04-21 11:39:48,418][0m Trial 604 finished with value: 0.6586187582319654 and parameters: {'splitter': 'random', 'min_samples_split': 0.0018753543568420863, 'min_samples_leaf': 0.07530827908037485, 'min_weight_fraction_leaf': 0.20854017584452775, 'max_features': 0.8265579072006612}. Best is trial 11 with value: 0.6773038119717333.[0m
[32m[I 2022-04-21 11:39:48,504][0m Trial 605 finished with value: 0.6380774383846907 and parameters: {'splitter': 'random', 'min_samples_split': 0.4837035243814122, 'min_samples_leaf': 0.03996504199424243, 'min_weight_fraction_leaf': 0.19919668735995325, 'max_features': 0.9017173492462625}. Best is trial 11 with value: 0.6773038119717333.[0m
[32m[I 2022-04-21 11:39:48,550][0m Trial 606 finished with value: 0.662800366349585 and parameters: {'splitter': 'random', 'min_samples_split': 0.07645800481274172, 'min_samples_leaf': 0.041951932178810505, 'min_weight_fraction_leaf': 0.16633846410789666, 'max_features': 0.9400691323887446}. Best is trial 11 with value: 0.6773038119717333.[0m
[32m[I 2022-04-21 11:39:48,595][0m Trial 607 finished with value: 0.6738476114655684 and parameters: {'splitter': 'random', 'min_samples_split': 0.012917200698211957, 'min_samples_leaf': 0.1851515305716139, 'min_weight_fraction_leaf': 0.12334538689225907, 'max_features': 0.9403498175253959}. Best is trial 11 with value: 0.6773038119717333.[0m
[32m[I 2022-04-21 11:39:48,638][0m Trial 608 finished with value: 0.6738476114655684 and parameters: {'splitter': 'random', 'min_samples_split': 0.2907311852827774, 'min_samples_leaf': 0.18728111100881642, 'min_weight_fraction_leaf': 0.1348503605127127, 'max_features': 0.9308930851917706}. Best is trial 11 with value: 0.6773038119717333.[0m
[32m[I 2022-04-21 11:39:48,726][0m Trial 609 finished with value: 0.6536302897478448 and parameters: {'splitter': 'random', 'min_samples_split': 0.2697329929560607, 'min_samples_leaf': 0.1065456753920735, 'min_weight_fraction_leaf': 0.13402841971928017, 'max_features': 0.623792016963732}. Best is trial 11 with value: 0.6773038119717333.[0m
[32m[I 2022-04-21 11:39:48,812][0m Trial 610 finished with value: 0.6650367998115423 and parameters: {'splitter': 'random', 'min_samples_split': 0.050259146522416184, 'min_samples_leaf': 0.018678567651808142, 'min_weight_fraction_leaf': 0.11148293699520445, 'max_features': 0.962248652345228}. Best is trial 11 with value: 0.6773038119717333.[0m
[32m[I 2022-04-21 11:39:48,877][0m Trial 611 finished with value: 0.6738476114655684 and parameters: {'splitter': 'random', 'min_samples_split': 0.06822402849972131, 'min_samples_leaf': 0.19164468273671997, 'min_weight_fraction_leaf': 0.15233116519946163, 'max_features': 0.9565505428319182}. Best is trial 11 with value: 0.6773038119717333.[0m
[32m[I 2022-04-21 11:39:48,923][0m Trial 612 finished with value: 0.6502080893344752 and parameters: {'splitter': 'random', 'min_samples_split': 0.042482313580028776, 'min_samples_leaf': 0.01134287928307112, 'min_weight_fraction_leaf': 0.14906723762042054, 'max_features': 0.958599198952137}. Best is trial 11 with value: 0.6773038119717333.[0m
[32m[I 2022-04-21 11:39:48,971][0m Trial 613 finished with value: 0.6738476114655684 and parameters: {'splitter': 'random', 'min_samples_split': 0.1560532318046398, 'min_samples_leaf': 0.14273815130912063, 'min_weight_fraction_leaf': 0.17318051741459345, 'max_features': 0.9796488351152067}. Best is trial 11 with value: 0.6773038119717333.[0m
[32m[I 2022-04-21 11:39:49,048][0m Trial 614 finished with value: 0.6636900948801576 and parameters: {'splitter': 'best', 'min_samples_split': 0.44269154421459855, 'min_samples_leaf': 0.051559962479074184, 'min_weight_fraction_leaf': 0.21803171055094003, 'max_features': 0.8741286421434104}. Best is trial 11 with value: 0.6773038119717333.[0m
[32m[I 2022-04-21 11:39:49,132][0m Trial 615 finished with value: 0.6586187582319654 and parameters: {'splitter': 'random', 'min_samples_split': 0.22348682296425834, 'min_samples_leaf': 0.016810276394650644, 'min_weight_fraction_leaf': 0.20321039467594482, 'max_features': 0.9741790913253294}. Best is trial 11 with value: 0.6773038119717333.[0m
[32m[I 2022-04-21 11:39:49,233][0m Trial 616 finished with value: 0.6738476114655684 and parameters: {'splitter': 'random', 'min_samples_split': 0.3378493723269483, 'min_samples_leaf': 0.2011076852817726, 'min_weight_fraction_leaf': 0.002630002931492561, 'max_features': 0.8610891105007444}. Best is trial 11 with value: 0.6773038119717333.[0m
[32m[I 2022-04-21 11:39:49,277][0m Trial 617 finished with value: 0.6738476114655684 and parameters: {'splitter': 'random', 'min_samples_split': 0.22489024475702957, 'min_samples_leaf': 0.017777245161027265, 'min_weight_fraction_leaf': 0.19439089680925525, 'max_features': 0.8143076635951004}. Best is trial 11 with value: 0.6773038119717333.[0m
[32m[I 2022-04-21 11:39:49,318][0m Trial 618 finished with value: 0.6738476114655684 and parameters: {'splitter': 'random', 'min_samples_split': 0.02366800183151039, 'min_samples_leaf': 0.0028187996165138646, 'min_weight_fraction_leaf': 0.19202389914827486, 'max_features': 0.9156508552603542}. Best is trial 11 with value: 0.6773038119717333.[0m
[32m[I 2022-04-21 11:39:49,364][0m Trial 619 finished with value: 0.6586187582319654 and parameters: {'splitter': 'random', 'min_samples_split': 0.26209048023395964, 'min_samples_leaf': 0.02514528172836159, 'min_weight_fraction_leaf': 0.2073293103673784, 'max_features': 0.8886887272862571}. Best is trial 11 with value: 0.6773038119717333.[0m
[32m[I 2022-04-21 11:39:49,418][0m Trial 620 finished with value: 0.6738476114655684 and parameters: {'splitter': 'random', 'min_samples_split': 0.3581175714463797, 'min_samples_leaf': 0.009008838919180643, 'min_weight_fraction_leaf': 0.18651847241344485, 'max_features': 0.9966627613780202}. Best is trial 11 with value: 0.6773038119717333.[0m
[32m[I 2022-04-21 11:39:49,479][0m Trial 621 finished with value: 0.6215155824977587 and parameters: {'splitter': 'random', 'min_samples_split': 0.025192644789719422, 'min_samples_leaf': 0.2225780119993082, 'min_weight_fraction_leaf': 0.011888090987307117, 'max_features': 0.9062501197655527}. Best is trial 11 with value: 0.6773038119717333.[0m
[32m[I 2022-04-21 11:39:49,522][0m Trial 622 finished with value: 0.6640701022932763 and parameters: {'splitter': 'random', 'min_samples_split': 0.1990800358974615, 'min_samples_leaf': 0.018408345725359564, 'min_weight_fraction_leaf': 0.12940612799097362, 'max_features': 0.8322909910868942}. Best is trial 11 with value: 0.6773038119717333.[0m
[32m[I 2022-04-21 11:39:49,568][0m Trial 623 finished with value: 0.662800366349585 and parameters: {'splitter': 'random', 'min_samples_split': 0.20273930885563124, 'min_samples_leaf': 0.16472234646514822, 'min_weight_fraction_leaf': 0.14199219201186114, 'max_features': 0.9785462842667109}. Best is trial 11 with value: 0.6773038119717333.[0m
[32m[I 2022-04-21 11:39:49,607][0m Trial 624 finished with value: 0.6738476114655684 and parameters: {'splitter': 'random', 'min_samples_split': 0.3485326767545567, 'min_samples_leaf': 0.11611433908359545, 'min_weight_fraction_leaf': 0.1809261911727226, 'max_features': 0.8610042987030387}. Best is trial 11 with value: 0.6773038119717333.[0m
[32m[I 2022-04-21 11:39:49,654][0m Trial 625 finished with value: 0.6738476114655684 and parameters: {'splitter': 'random', 'min_samples_split': 0.15699061925603242, 'min_samples_leaf': 0.11555745942840387, 'min_weight_fraction_leaf': 0.17547360844320428, 'max_features': 0.8363339001474575}. Best is trial 11 with value: 0.6773038119717333.[0m
[32m[I 2022-04-21 11:39:49,694][0m Trial 626 finished with value: 0.5931624331547747 and parameters: {'splitter': 'random', 'min_samples_split': 0.16020944340250343, 'min_samples_leaf': 0.10710197265699084, 'min_weight_fraction_leaf': 0.24525619729626466, 'max_features': 0.8493261113320522}. Best is trial 11 with value: 0.6773038119717333.[0m
[32m[I 2022-04-21 11:39:49,730][0m Trial 627 finished with value: 0.6586187582319654 and parameters: {'splitter': 'random', 'min_samples_split': 0.20853340857594183, 'min_samples_leaf': 0.07311052887848757, 'min_weight_fraction_leaf': 0.20410362348784525, 'max_features': 0.9947909393656547}. Best is trial 11 with value: 0.6773038119717333.[0m
[32m[I 2022-04-21 11:39:49,767][0m Trial 628 finished with value: 0.662800366349585 and parameters: {'splitter': 'random', 'min_samples_split': 0.23904174021035707, 'min_samples_leaf': 0.09342590487348777, 'min_weight_fraction_leaf': 0.1654207916938939, 'max_features': 0.8733703381539097}. Best is trial 11 with value: 0.6773038119717333.[0m
[32m[I 2022-04-21 11:39:49,811][0m Trial 629 finished with value: 0.6586187582319654 and parameters: {'splitter': 'random', 'min_samples_split': 0.24582499203896635, 'min_samples_leaf': 0.21155049246923208, 'min_weight_fraction_leaf': 0.11633584835389066, 'max_features': 0.9473183096959873}. Best is trial 11 with value: 0.6773038119717333.[0m
[32m[I 2022-04-21 11:39:49,859][0m Trial 630 finished with value: 0.6738476114655684 and parameters: {'splitter': 'random', 'min_samples_split': 0.4129813318332456, 'min_samples_leaf': 0.04204882210625303, 'min_weight_fraction_leaf': 0.19096169670436247, 'max_features': 0.900967543490815}. Best is trial 11 with value: 0.6773038119717333.[0m
[32m[I 2022-04-21 11:39:49,905][0m Trial 631 finished with value: 0.6551405301163737 and parameters: {'splitter': 'random', 'min_samples_split': 0.4302826629505687, 'min_samples_leaf': 0.03173177399196042, 'min_weight_fraction_leaf': 0.2177969999521015, 'max_features': 0.9278085081309132}. Best is trial 11 with value: 0.6773038119717333.[0m
[32m[I 2022-04-21 11:39:49,961][0m Trial 632 finished with value: 0.6738476114655684 and parameters: {'splitter': 'random', 'min_samples_split': 0.02882591512119744, 'min_samples_leaf': 0.1732532511474192, 'min_weight_fraction_leaf': 0.11568141788163916, 'max_features': 0.8889132730497576}. Best is trial 11 with value: 0.6773038119717333.[0m
[32m[I 2022-04-21 11:39:50,000][0m Trial 633 finished with value: 0.5502145606990503 and parameters: {'splitter': 'random', 'min_samples_split': 0.029163315499007712, 'min_samples_leaf': 0.14907938547417832, 'min_weight_fraction_leaf': 0.1714737732439336, 'max_features': 0.6942079628294551}. Best is trial 11 with value: 0.6773038119717333.[0m
[32m[I 2022-04-21 11:39:50,045][0m Trial 634 finished with value: 0.6636900948801576 and parameters: {'splitter': 'best', 'min_samples_split': 0.22088319727008776, 'min_samples_leaf': 0.2041182844106951, 'min_weight_fraction_leaf': 0.07665185477896118, 'max_features': 0.7982854828567565}. Best is trial 11 with value: 0.6773038119717333.[0m
[32m[I 2022-04-21 11:39:50,088][0m Trial 635 finished with value: 0.6738476114655684 and parameters: {'splitter': 'random', 'min_samples_split': 0.2530439508556372, 'min_samples_leaf': 0.19350143493283856, 'min_weight_fraction_leaf': 0.0017197500602171866, 'max_features': 0.9461544300716828}. Best is trial 11 with value: 0.6773038119717333.[0m
[32m[I 2022-04-21 11:39:50,127][0m Trial 636 finished with value: 0.5 and parameters: {'splitter': 'random', 'min_samples_split': 0.44489049075807174, 'min_samples_leaf': 0.13102186008974098, 'min_weight_fraction_leaf': 0.17131603829018938, 'max_features': 0.2863778568739197}. Best is trial 11 with value: 0.6773038119717333.[0m
[32m[I 2022-04-21 11:39:50,162][0m Trial 637 finished with value: 0.6738476114655684 and parameters: {'splitter': 'random', 'min_samples_split': 0.4026707676953041, 'min_samples_leaf': 0.17024687794911358, 'min_weight_fraction_leaf': 0.0562378092595558, 'max_features': 0.9244782991370953}. Best is trial 11 with value: 0.6773038119717333.[0m
[32m[I 2022-04-21 11:39:50,202][0m Trial 638 finished with value: 0.6640701022932763 and parameters: {'splitter': 'random', 'min_samples_split': 0.4053133673400172, 'min_samples_leaf': 0.1229323765235447, 'min_weight_fraction_leaf': 0.041230031190595526, 'max_features': 0.9091651535480103}. Best is trial 11 with value: 0.6773038119717333.[0m
