[32m[I 2022-04-21 11:40:11,033][0m Trial 891 finished with value: 0.6738476114655684 and parameters: {'splitter': 'random', 'min_samples_split': 0.39076943485109267, 'min_samples_leaf': 0.007910239714567752, 'min_weight_fraction_leaf': 0.17435956782192644, 'max_features': 0.9271952364293289}. Best is trial 11 with value: 0.6773038119717333.[0m
[32m[I 2022-04-21 11:40:11,089][0m Trial 892 finished with value: 0.6738476114655684 and parameters: {'splitter': 'random', 'min_samples_split': 0.3828297650356982, 'min_samples_leaf': 0.002302291391831318, 'min_weight_fraction_leaf': 0.176141727568075, 'max_features': 0.921558188431258}. Best is trial 11 with value: 0.6773038119717333.[0m
[32m[I 2022-04-21 11:40:11,132][0m Trial 893 finished with value: 0.6738476114655684 and parameters: {'splitter': 'random', 'min_samples_split': 0.2497214388502855, 'min_samples_leaf': 0.19247180671362069, 'min_weight_fraction_leaf': 0.1994725881113722, 'max_features': 0.9086423848209164}. Best is trial 11 with value: 0.6773038119717333.[0m
[32m[I 2022-04-21 11:40:11,175][0m Trial 894 finished with value: 0.6215155824977587 and parameters: {'splitter': 'random', 'min_samples_split': 0.23882607025787814, 'min_samples_leaf': 0.19130148097688185, 'min_weight_fraction_leaf': 0.2242608942525575, 'max_features': 0.8941767434165335}. Best is trial 11 with value: 0.6773038119717333.[0m
[32m[I 2022-04-21 11:40:11,227][0m Trial 895 finished with value: 0.6640701022932763 and parameters: {'splitter': 'random', 'min_samples_split': 0.350514232030164, 'min_samples_leaf': 0.13461582866246694, 'min_weight_fraction_leaf': 0.03308010389494309, 'max_features': 0.9061906201228248}. Best is trial 11 with value: 0.6773038119717333.[0m
[32m[I 2022-04-21 11:40:11,272][0m Trial 896 finished with value: 0.662800366349585 and parameters: {'splitter': 'random', 'min_samples_split': 0.010544776438595999, 'min_samples_leaf': 0.1653609478272128, 'min_weight_fraction_leaf': 0.1405050426823149, 'max_features': 0.9999484810169498}. Best is trial 11 with value: 0.6773038119717333.[0m
[32m[I 2022-04-21 11:40:11,315][0m Trial 897 finished with value: 0.6543938115635641 and parameters: {'splitter': 'random', 'min_samples_split': 0.26563873359716667, 'min_samples_leaf': 0.1572778578829811, 'min_weight_fraction_leaf': 0.145969753812816, 'max_features': 0.8854867605817576}. Best is trial 11 with value: 0.6773038119717333.[0m
[32m[I 2022-04-21 11:40:11,358][0m Trial 898 finished with value: 0.6640701022932763 and parameters: {'splitter': 'random', 'min_samples_split': 0.3843454413441301, 'min_samples_leaf': 0.11617689759928274, 'min_weight_fraction_leaf': 0.05581626189648521, 'max_features': 0.8787895710802766}. Best is trial 11 with value: 0.6773038119717333.[0m
[32m[I 2022-04-21 11:40:11,401][0m Trial 899 finished with value: 0.6738476114655684 and parameters: {'splitter': 'random', 'min_samples_split': 0.01627755350915627, 'min_samples_leaf': 0.16271157493069996, 'min_weight_fraction_leaf': 0.19349709519942115, 'max_features': 0.9769151533722025}. Best is trial 11 with value: 0.6773038119717333.[0m
[32m[I 2022-04-21 11:40:11,445][0m Trial 900 finished with value: 0.5962367254829114 and parameters: {'splitter': 'random', 'min_samples_split': 0.4755662215544273, 'min_samples_leaf': 0.03371064976227464, 'min_weight_fraction_leaf': 0.1629037616452394, 'max_features': 0.6168578138453725}. Best is trial 11 with value: 0.6773038119717333.[0m
[32m[I 2022-04-21 11:40:11,488][0m Trial 901 finished with value: 0.6738476114655684 and parameters: {'splitter': 'random', 'min_samples_split': 0.374728979558787, 'min_samples_leaf': 0.023196842024955144, 'min_weight_fraction_leaf': 0.19044716663163194, 'max_features': 0.9388509584349545}. Best is trial 11 with value: 0.6773038119717333.[0m
[32m[I 2022-04-21 11:40:11,532][0m Trial 902 finished with value: 0.5962367254829114 and parameters: {'splitter': 'random', 'min_samples_split': 0.4592841432331016, 'min_samples_leaf': 0.025358552482336056, 'min_weight_fraction_leaf': 0.1637727777266768, 'max_features': 0.6507942403829762}. Best is trial 11 with value: 0.6773038119717333.[0m
[32m[I 2022-04-21 11:40:11,575][0m Trial 903 finished with value: 0.6636900948801576 and parameters: {'splitter': 'best', 'min_samples_split': 0.2742229094185739, 'min_samples_leaf': 0.05044962703691902, 'min_weight_fraction_leaf': 0.20841030705325883, 'max_features': 0.9292714753515825}. Best is trial 11 with value: 0.6773038119717333.[0m
[32m[I 2022-04-21 11:40:11,617][0m Trial 904 finished with value: 0.662800366349585 and parameters: {'splitter': 'random', 'min_samples_split': 0.03673513173028689, 'min_samples_leaf': 0.16223531676102015, 'min_weight_fraction_leaf': 0.13587914566753856, 'max_features': 0.955037551470307}. Best is trial 11 with value: 0.6773038119717333.[0m
[32m[I 2022-04-21 11:40:11,661][0m Trial 905 finished with value: 0.6738476114655684 and parameters: {'splitter': 'random', 'min_samples_split': 0.343341657344216, 'min_samples_leaf': 0.09649682895244675, 'min_weight_fraction_leaf': 0.18603352073872848, 'max_features': 0.9423300246994575}. Best is trial 11 with value: 0.6773038119717333.[0m
[32m[I 2022-04-21 11:40:11,732][0m Trial 906 finished with value: 0.6738476114655684 and parameters: {'splitter': 'random', 'min_samples_split': 0.1753279093233458, 'min_samples_leaf': 0.14800250765865974, 'min_weight_fraction_leaf': 0.1741701557389121, 'max_features': 0.9341773867085331}. Best is trial 11 with value: 0.6773038119717333.[0m
[32m[I 2022-04-21 11:40:11,783][0m Trial 907 finished with value: 0.6586187582319654 and parameters: {'splitter': 'random', 'min_samples_split': 0.2298544915401657, 'min_samples_leaf': 0.03946356356466079, 'min_weight_fraction_leaf': 0.21060166392715177, 'max_features': 0.9498730672522121}. Best is trial 11 with value: 0.6773038119717333.[0m
[32m[I 2022-04-21 11:40:11,826][0m Trial 908 finished with value: 0.662800366349585 and parameters: {'splitter': 'random', 'min_samples_split': 0.1643170907998705, 'min_samples_leaf': 0.1614851056761016, 'min_weight_fraction_leaf': 0.15530381530487725, 'max_features': 0.9239846917087261}. Best is trial 11 with value: 0.6773038119717333.[0m
[32m[I 2022-04-21 11:40:11,869][0m Trial 909 finished with value: 0.6738476114655684 and parameters: {'splitter': 'random', 'min_samples_split': 0.13153751502698344, 'min_samples_leaf': 0.03039387585975333, 'min_weight_fraction_leaf': 0.19761864352795688, 'max_features': 0.953388360817691}. Best is trial 11 with value: 0.6773038119717333.[0m
[32m[I 2022-04-21 11:40:11,914][0m Trial 910 finished with value: 0.6738476114655684 and parameters: {'splitter': 'random', 'min_samples_split': 0.24443699134294622, 'min_samples_leaf': 0.023786991659258804, 'min_weight_fraction_leaf': 0.19298970233752075, 'max_features': 0.9661207026459524}. Best is trial 11 with value: 0.6773038119717333.[0m
[32m[I 2022-04-21 11:40:11,969][0m Trial 911 finished with value: 0.6557970001078239 and parameters: {'splitter': 'random', 'min_samples_split': 0.1950502128932074, 'min_samples_leaf': 0.14298196618360604, 'min_weight_fraction_leaf': 0.030223678097744906, 'max_features': 0.7952599495154089}. Best is trial 11 with value: 0.6773038119717333.[0m
[32m[I 2022-04-21 11:40:12,016][0m Trial 912 finished with value: 0.6551405301163737 and parameters: {'splitter': 'random', 'min_samples_split': 0.05774840980978996, 'min_samples_leaf': 0.05609716834860731, 'min_weight_fraction_leaf': 0.21944403389115055, 'max_features': 0.8512936085301847}. Best is trial 11 with value: 0.6773038119717333.[0m
[32m[I 2022-04-21 11:40:12,058][0m Trial 913 finished with value: 0.6586187582319654 and parameters: {'splitter': 'random', 'min_samples_split': 0.37636139622984155, 'min_samples_leaf': 0.2045527839103413, 'min_weight_fraction_leaf': 0.07200540642618503, 'max_features': 0.8768857065464646}. Best is trial 11 with value: 0.6773038119717333.[0m
[32m[I 2022-04-21 11:40:12,100][0m Trial 914 finished with value: 0.6738476114655684 and parameters: {'splitter': 'random', 'min_samples_split': 0.4328434877020546, 'min_samples_leaf': 0.1676486487535062, 'min_weight_fraction_leaf': 0.1668559612242229, 'max_features': 0.8974595088810193}. Best is trial 11 with value: 0.6773038119717333.[0m
[32m[I 2022-04-21 11:40:12,141][0m Trial 915 finished with value: 0.5 and parameters: {'splitter': 'random', 'min_samples_split': 0.3208620334983401, 'min_samples_leaf': 0.07428138981455887, 'min_weight_fraction_leaf': 0.2728486304726709, 'max_features': 0.8925627590407538}. Best is trial 11 with value: 0.6773038119717333.[0m
[32m[I 2022-04-21 11:40:12,182][0m Trial 916 finished with value: 0.6738476114655684 and parameters: {'splitter': 'random', 'min_samples_split': 0.0785290193183043, 'min_samples_leaf': 0.18065899516733497, 'min_weight_fraction_leaf': 0.1540916255321597, 'max_features': 0.8324510507359468}. Best is trial 11 with value: 0.6773038119717333.[0m
[32m[I 2022-04-21 11:40:12,225][0m Trial 917 finished with value: 0.6738476114655684 and parameters: {'splitter': 'random', 'min_samples_split': 0.33875535316256195, 'min_samples_leaf': 0.12759136362308898, 'min_weight_fraction_leaf': 0.18222317402361077, 'max_features': 0.8322554174580173}. Best is trial 11 with value: 0.6773038119717333.[0m
[32m[I 2022-04-21 11:40:12,267][0m Trial 918 finished with value: 0.6640701022932763 and parameters: {'splitter': 'random', 'min_samples_split': 0.3388957465220379, 'min_samples_leaf': 0.13627193280516828, 'min_weight_fraction_leaf': 0.06280424137146479, 'max_features': 0.8165471235068925}. Best is trial 11 with value: 0.6773038119717333.[0m
[32m[I 2022-04-21 11:40:12,325][0m Trial 919 finished with value: 0.6738476114655684 and parameters: {'splitter': 'random', 'min_samples_split': 0.0037012536768371244, 'min_samples_leaf': 0.1813143499633297, 'min_weight_fraction_leaf': 0.15264363526083893, 'max_features': 0.999412580901562}. Best is trial 11 with value: 0.6773038119717333.[0m
[32m[I 2022-04-21 11:40:12,393][0m Trial 920 finished with value: 0.662800366349585 and parameters: {'splitter': 'random', 'min_samples_split': 0.21182413924472515, 'min_samples_leaf': 0.0721819639492513, 'min_weight_fraction_leaf': 0.16257876704330926, 'max_features': 0.9481189340176538}. Best is trial 11 with value: 0.6773038119717333.[0m
[32m[I 2022-04-21 11:40:12,466][0m Trial 921 finished with value: 0.6738476114655684 and parameters: {'splitter': 'random', 'min_samples_split': 0.10460567660009557, 'min_samples_leaf': 0.18592523999818167, 'min_weight_fraction_leaf': 0.14236779762402837, 'max_features': 0.9690051406845234}. Best is trial 11 with value: 0.6773038119717333.[0m
[32m[I 2022-04-21 11:40:12,510][0m Trial 922 finished with value: 0.6598137568019723 and parameters: {'splitter': 'best', 'min_samples_split': 0.2407669849835549, 'min_samples_leaf': 0.020251300601230628, 'min_weight_fraction_leaf': 0.17696186861838825, 'max_features': 0.9829429109245468}. Best is trial 11 with value: 0.6773038119717333.[0m
[32m[I 2022-04-21 11:40:12,552][0m Trial 923 finished with value: 0.6738476114655684 and parameters: {'splitter': 'random', 'min_samples_split': 0.18281494791230554, 'min_samples_leaf': 0.1491855204245709, 'min_weight_fraction_leaf': 0.1721347007177828, 'max_features': 0.9234065446040896}. Best is trial 11 with value: 0.6773038119717333.[0m
[32m[I 2022-04-21 11:40:12,595][0m Trial 924 finished with value: 0.6738476114655684 and parameters: {'splitter': 'random', 'min_samples_split': 0.22663559333489514, 'min_samples_leaf': 0.09820392801866479, 'min_weight_fraction_leaf': 0.200640268805486, 'max_features': 0.9149277189271582}. Best is trial 11 with value: 0.6773038119717333.[0m
[32m[I 2022-04-21 11:40:12,675][0m Trial 925 finished with value: 0.6586187582319654 and parameters: {'splitter': 'random', 'min_samples_split': 0.44430594642479515, 'min_samples_leaf': 0.01325112816631378, 'min_weight_fraction_leaf': 0.20873499886687275, 'max_features': 0.9723462937428863}. Best is trial 11 with value: 0.6773038119717333.[0m
[32m[I 2022-04-21 11:40:12,718][0m Trial 926 finished with value: 0.6738476114655684 and parameters: {'splitter': 'random', 'min_samples_split': 0.18384813809252493, 'min_samples_leaf': 0.058640805721272005, 'min_weight_fraction_leaf': 0.18918967469078998, 'max_features': 0.8791897385571645}. Best is trial 11 with value: 0.6773038119717333.[0m
[32m[I 2022-04-21 11:40:12,760][0m Trial 927 finished with value: 0.6586187582319654 and parameters: {'splitter': 'random', 'min_samples_split': 0.36599500940230745, 'min_samples_leaf': 0.21440120209946034, 'min_weight_fraction_leaf': 0.1993309935058571, 'max_features': 0.847878314866563}. Best is trial 11 with value: 0.6773038119717333.[0m
[32m[I 2022-04-21 11:40:12,803][0m Trial 928 finished with value: 0.6738476114655684 and parameters: {'splitter': 'random', 'min_samples_split': 0.3120585912929011, 'min_samples_leaf': 0.12297778164655465, 'min_weight_fraction_leaf': 0.18918964212163525, 'max_features': 0.8553135077376837}. Best is trial 11 with value: 0.6773038119717333.[0m
[32m[I 2022-04-21 11:40:12,857][0m Trial 929 finished with value: 0.6563538734458076 and parameters: {'splitter': 'random', 'min_samples_split': 0.16988594015322445, 'min_samples_leaf': 0.07357202049440029, 'min_weight_fraction_leaf': 0.038335188130992855, 'max_features': 0.8128205796666527}. Best is trial 11 with value: 0.6773038119717333.[0m
[32m[I 2022-04-21 11:40:12,907][0m Trial 930 finished with value: 0.6738476114655684 and parameters: {'splitter': 'random', 'min_samples_split': 0.3702841640202644, 'min_samples_leaf': 0.09083852917318831, 'min_weight_fraction_leaf': 0.20138470385630453, 'max_features': 0.8621726882579109}. Best is trial 11 with value: 0.6773038119717333.[0m
[32m[I 2022-04-21 11:40:12,951][0m Trial 931 finished with value: 0.6738476114655684 and parameters: {'splitter': 'random', 'min_samples_split': 0.23198346061497196, 'min_samples_leaf': 0.03305159884951425, 'min_weight_fraction_leaf': 0.1772313845512497, 'max_features': 0.999019087031175}. Best is trial 11 with value: 0.6773038119717333.[0m
[32m[I 2022-04-21 11:40:12,992][0m Trial 932 finished with value: 0.5931624331547747 and parameters: {'splitter': 'random', 'min_samples_split': 0.23082917455983712, 'min_samples_leaf': 0.014742958031039328, 'min_weight_fraction_leaf': 0.2377942443576146, 'max_features': 0.9986007142442882}. Best is trial 11 with value: 0.6773038119717333.[0m
[32m[I 2022-04-21 11:40:13,036][0m Trial 933 finished with value: 0.6586187582319654 and parameters: {'splitter': 'random', 'min_samples_split': 0.355255258291503, 'min_samples_leaf': 0.0833816329618958, 'min_weight_fraction_leaf': 0.21393492163261105, 'max_features': 0.902639638298828}. Best is trial 11 with value: 0.6773038119717333.[0m
[32m[I 2022-04-21 11:40:13,078][0m Trial 934 finished with value: 0.6055713066869624 and parameters: {'splitter': 'random', 'min_samples_split': 0.2009291553448061, 'min_samples_leaf': 0.15965898324031733, 'min_weight_fraction_leaf': 0.1461291858846226, 'max_features': 0.7844905204385434}. Best is trial 11 with value: 0.6773038119717333.[0m
[32m[I 2022-04-21 11:40:13,123][0m Trial 935 finished with value: 0.6738476114655684 and parameters: {'splitter': 'random', 'min_samples_split': 0.4499928534008193, 'min_samples_leaf': 0.011405224334201438, 'min_weight_fraction_leaf': 0.18821994573332498, 'max_features': 0.9636209760454675}. Best is trial 11 with value: 0.6773038119717333.[0m
[32m[I 2022-04-21 11:40:13,166][0m Trial 936 finished with value: 0.6543938115635641 and parameters: {'splitter': 'random', 'min_samples_split': 0.44603198839124336, 'min_samples_leaf': 0.001230702652113053, 'min_weight_fraction_leaf': 0.15715431333969634, 'max_features': 0.9600994765777582}. Best is trial 11 with value: 0.6773038119717333.[0m
[32m[I 2022-04-21 11:40:13,213][0m Trial 937 finished with value: 0.6640701022932763 and parameters: {'splitter': 'random', 'min_samples_split': 0.357251070963476, 'min_samples_leaf': 0.14021585947869242, 'min_weight_fraction_leaf': 0.026392434786611692, 'max_features': 0.8536224856445496}. Best is trial 11 with value: 0.6773038119717333.[0m
[32m[I 2022-04-21 11:40:13,274][0m Trial 938 finished with value: 0.6738476114655684 and parameters: {'splitter': 'random', 'min_samples_split': 0.3873294984558449, 'min_samples_leaf': 0.20105664001353346, 'min_weight_fraction_leaf': 0.10684885834599778, 'max_features': 0.8340441826318312}. Best is trial 11 with value: 0.6773038119717333.[0m
[32m[I 2022-04-21 11:40:13,331][0m Trial 939 finished with value: 0.6738476114655684 and parameters: {'splitter': 'random', 'min_samples_split': 0.43954114945232897, 'min_samples_leaf': 0.1834760089266372, 'min_weight_fraction_leaf': 0.13955076768921612, 'max_features': 0.941390313894043}. Best is trial 11 with value: 0.6773038119717333.[0m
[32m[I 2022-04-21 11:40:13,390][0m Trial 940 finished with value: 0.6640701022932763 and parameters: {'splitter': 'random', 'min_samples_split': 0.4395151511926671, 'min_samples_leaf': 0.011541940485861962, 'min_weight_fraction_leaf': 0.13507087121318442, 'max_features': 0.9415929571536342}. Best is trial 11 with value: 0.6773038119717333.[0m
[32m[I 2022-04-21 11:40:13,437][0m Trial 941 finished with value: 0.6738476114655684 and parameters: {'splitter': 'random', 'min_samples_split': 0.258066504526832, 'min_samples_leaf': 0.057083732009061375, 'min_weight_fraction_leaf': 0.1747671609159828, 'max_features': 0.901446612670451}. Best is trial 11 with value: 0.6773038119717333.[0m
[32m[I 2022-04-21 11:40:13,480][0m Trial 942 finished with value: 0.6665385065440175 and parameters: {'splitter': 'best', 'min_samples_split': 0.2247220433878033, 'min_samples_leaf': 0.01827184611205748, 'min_weight_fraction_leaf': 0.16578787082712207, 'max_features': 0.9781789504815135}. Best is trial 11 with value: 0.6773038119717333.[0m
[32m[I 2022-04-21 11:40:13,524][0m Trial 943 finished with value: 0.6738476114655684 and parameters: {'splitter': 'random', 'min_samples_split': 0.4181060917544202, 'min_samples_leaf': 0.06023950138284474, 'min_weight_fraction_leaf': 0.17564107872937137, 'max_features': 0.901483444445439}. Best is trial 11 with value: 0.6773038119717333.[0m
[32m[I 2022-04-21 11:40:13,596][0m Trial 944 finished with value: 0.6738476114655684 and parameters: {'splitter': 'random', 'min_samples_split': 0.4214839136576089, 'min_samples_leaf': 0.04414860315936266, 'min_weight_fraction_leaf': 0.17091214898152857, 'max_features': 0.8932893662170148}. Best is trial 11 with value: 0.6773038119717333.[0m
[32m[I 2022-04-21 11:40:13,683][0m Trial 945 finished with value: 0.6586187582319654 and parameters: {'splitter': 'random', 'min_samples_split': 0.34697532389907476, 'min_samples_leaf': 0.1315741524672537, 'min_weight_fraction_leaf': 0.20617466850860305, 'max_features': 0.8686861692956257}. Best is trial 11 with value: 0.6773038119717333.[0m
[32m[I 2022-04-21 11:40:13,779][0m Trial 946 finished with value: 0.5283695882293453 and parameters: {'splitter': 'random', 'min_samples_split': 0.2584962394603205, 'min_samples_leaf': 0.052037654125739526, 'min_weight_fraction_leaf': 0.25801156026992567, 'max_features': 0.9243053247960625}. Best is trial 11 with value: 0.6773038119717333.[0m
[32m[I 2022-04-21 11:40:13,870][0m Trial 947 finished with value: 0.5467050366078425 and parameters: {'splitter': 'random', 'min_samples_split': 0.4805081700292315, 'min_samples_leaf': 0.25118604326638827, 'min_weight_fraction_leaf': 0.13077756663793322, 'max_features': 0.9460223760349381}. Best is trial 11 with value: 0.6773038119717333.[0m
[32m[I 2022-04-21 11:40:13,948][0m Trial 948 finished with value: 0.6640701022932763 and parameters: {'splitter': 'random', 'min_samples_split': 0.46394871405685745, 'min_samples_leaf': 0.11217631335885024, 'min_weight_fraction_leaf': 0.01141265556255691, 'max_features': 0.954440388699302}. Best is trial 11 with value: 0.6773038119717333.[0m
[32m[I 2022-04-21 11:40:14,029][0m Trial 949 finished with value: 0.6738476114655684 and parameters: {'splitter': 'random', 'min_samples_split': 0.18933262752041083, 'min_samples_leaf': 0.05138356189735655, 'min_weight_fraction_leaf': 0.17001896469807748, 'max_features': 0.924325577095773}. Best is trial 11 with value: 0.6773038119717333.[0m
[32m[I 2022-04-21 11:40:14,167][0m Trial 950 finished with value: 0.6738476114655684 and parameters: {'splitter': 'random', 'min_samples_split': 0.19497602808446188, 'min_samples_leaf': 0.021367412083604362, 'min_weight_fraction_leaf': 0.1982895815543256, 'max_features': 0.9740654758591067}. Best is trial 11 with value: 0.6773038119717333.[0m
[32m[I 2022-04-21 11:40:14,300][0m Trial 951 finished with value: 0.6738476114655684 and parameters: {'splitter': 'random', 'min_samples_split': 0.22218626001792985, 'min_samples_leaf': 0.0013153398952448715, 'min_weight_fraction_leaf': 0.18362570927713345, 'max_features': 0.9796509832978868}. Best is trial 11 with value: 0.6773038119717333.[0m
[32m[I 2022-04-21 11:40:14,361][0m Trial 952 finished with value: 0.662800366349585 and parameters: {'splitter': 'random', 'min_samples_split': 0.39513268095565995, 'min_samples_leaf': 0.029123161767208337, 'min_weight_fraction_leaf': 0.1631644941840286, 'max_features': 0.9792836822888531}. Best is trial 11 with value: 0.6773038119717333.[0m
[32m[I 2022-04-21 11:40:14,406][0m Trial 953 finished with value: 0.5 and parameters: {'splitter': 'random', 'min_samples_split': 0.2969636641067389, 'min_samples_leaf': 0.0027895500672990028, 'min_weight_fraction_leaf': 0.2855232181488134, 'max_features': 0.9225555360710098}. Best is trial 11 with value: 0.6773038119717333.[0m
