[32m[I 2022-04-21 11:39:50,254][0m Trial 639 finished with value: 0.6615671544461948 and parameters: {'splitter': 'random', 'min_samples_split': 0.4250232437715854, 'min_samples_leaf': 0.02553663939691432, 'min_weight_fraction_leaf': 0.016916277516500378, 'max_features': 0.9487880722203287}. Best is trial 11 with value: 0.6773038119717333.[0m
[32m[I 2022-04-21 11:39:50,298][0m Trial 640 finished with value: 0.6551405301163737 and parameters: {'splitter': 'random', 'min_samples_split': 0.4761697307262376, 'min_samples_leaf': 0.03269353983082192, 'min_weight_fraction_leaf': 0.19469641722739675, 'max_features': 0.9167776743683619}. Best is trial 11 with value: 0.6773038119717333.[0m
[32m[I 2022-04-21 11:39:50,344][0m Trial 641 finished with value: 0.662800366349585 and parameters: {'splitter': 'random', 'min_samples_split': 0.14612275534885577, 'min_samples_leaf': 0.10123325935546688, 'min_weight_fraction_leaf': 0.1650266947208, 'max_features': 0.8612532761119527}. Best is trial 11 with value: 0.6773038119717333.[0m
[32m[I 2022-04-21 11:39:50,388][0m Trial 642 finished with value: 0.6738476114655684 and parameters: {'splitter': 'random', 'min_samples_split': 0.24144676795846048, 'min_samples_leaf': 0.06960669469312075, 'min_weight_fraction_leaf': 0.18121032514959712, 'max_features': 0.9393190191857433}. Best is trial 11 with value: 0.6773038119717333.[0m
[32m[I 2022-04-21 11:39:50,433][0m Trial 643 finished with value: 0.6640701022932763 and parameters: {'splitter': 'random', 'min_samples_split': 0.06265460205037113, 'min_samples_leaf': 0.08374537132964291, 'min_weight_fraction_leaf': 0.134808680476418, 'max_features': 0.9633614761784333}. Best is trial 11 with value: 0.6773038119717333.[0m
[32m[I 2022-04-21 11:39:50,471][0m Trial 644 finished with value: 0.6551405301163737 and parameters: {'splitter': 'random', 'min_samples_split': 0.12783530968816903, 'min_samples_leaf': 0.2166321131306227, 'min_weight_fraction_leaf': 0.031277738712976344, 'max_features': 0.9165332037712941}. Best is trial 11 with value: 0.6773038119717333.[0m
[32m[I 2022-04-21 11:39:50,514][0m Trial 645 finished with value: 0.6543938115635641 and parameters: {'splitter': 'random', 'min_samples_split': 0.057108571077446324, 'min_samples_leaf': 0.15678762189197815, 'min_weight_fraction_leaf': 0.15380425767926492, 'max_features': 0.8799651848697849}. Best is trial 11 with value: 0.6773038119717333.[0m
[32m[I 2022-04-21 11:39:50,560][0m Trial 646 finished with value: 0.6738476114655684 and parameters: {'splitter': 'random', 'min_samples_split': 0.41631039921060153, 'min_samples_leaf': 0.050639399648339314, 'min_weight_fraction_leaf': 0.1748792260370953, 'max_features': 0.9331270497867901}. Best is trial 11 with value: 0.6773038119717333.[0m
[32m[I 2022-04-21 11:39:50,613][0m Trial 647 finished with value: 0.6738476114655684 and parameters: {'splitter': 'random', 'min_samples_split': 0.43367101045943207, 'min_samples_leaf': 0.02334470140857544, 'min_weight_fraction_leaf': 0.18132429115455412, 'max_features': 0.8917829595955084}. Best is trial 11 with value: 0.6773038119717333.[0m
[32m[I 2022-04-21 11:39:50,688][0m Trial 648 finished with value: 0.6738476114655684 and parameters: {'splitter': 'random', 'min_samples_split': 0.4173134906636063, 'min_samples_leaf': 0.02208466240580299, 'min_weight_fraction_leaf': 0.17018284768287095, 'max_features': 0.894014816505955}. Best is trial 11 with value: 0.6773038119717333.[0m
[32m[I 2022-04-21 11:39:50,745][0m Trial 649 finished with value: 0.6738476114655684 and parameters: {'splitter': 'random', 'min_samples_split': 0.41896403975875507, 'min_samples_leaf': 0.17976310400897869, 'min_weight_fraction_leaf': 0.16101593692883043, 'max_features': 0.8986910125895529}. Best is trial 11 with value: 0.6773038119717333.[0m
[32m[I 2022-04-21 11:39:50,792][0m Trial 650 finished with value: 0.662800366349585 and parameters: {'splitter': 'random', 'min_samples_split': 0.03940594437904343, 'min_samples_leaf': 0.002919396934701401, 'min_weight_fraction_leaf': 0.1606297417116583, 'max_features': 0.9745733952032255}. Best is trial 11 with value: 0.6773038119717333.[0m
[32m[I 2022-04-21 11:39:50,829][0m Trial 651 finished with value: 0.6551405301163737 and parameters: {'splitter': 'random', 'min_samples_split': 0.4758474873361847, 'min_samples_leaf': 0.03503958625224533, 'min_weight_fraction_leaf': 0.19731332109229846, 'max_features': 0.9480942241221263}. Best is trial 11 with value: 0.6773038119717333.[0m
[32m[I 2022-04-21 11:39:50,875][0m Trial 652 finished with value: 0.6636900948801576 and parameters: {'splitter': 'best', 'min_samples_split': 0.42725235636564146, 'min_samples_leaf': 0.061645112435521274, 'min_weight_fraction_leaf': 0.18519546735549358, 'max_features': 0.9327888433994744}. Best is trial 11 with value: 0.6773038119717333.[0m
[32m[I 2022-04-21 11:39:50,913][0m Trial 653 finished with value: 0.5502145606990503 and parameters: {'splitter': 'random', 'min_samples_split': 0.4998895293931029, 'min_samples_leaf': 0.1672814786719422, 'min_weight_fraction_leaf': 0.143553267206058, 'max_features': 0.7667072107186398}. Best is trial 11 with value: 0.6773038119717333.[0m
[32m[I 2022-04-21 11:39:50,960][0m Trial 654 finished with value: 0.6738476114655684 and parameters: {'splitter': 'random', 'min_samples_split': 0.2802762644008273, 'min_samples_leaf': 0.14262227576158287, 'min_weight_fraction_leaf': 0.17727115834302612, 'max_features': 0.9987327943605099}. Best is trial 11 with value: 0.6773038119717333.[0m
[32m[I 2022-04-21 11:39:51,003][0m Trial 655 finished with value: 0.6647456324911225 and parameters: {'splitter': 'random', 'min_samples_split': 0.27851068901662873, 'min_samples_leaf': 0.043591011120792056, 'min_weight_fraction_leaf': 0.08751479880167368, 'max_features': 0.9141168668376256}. Best is trial 11 with value: 0.6773038119717333.[0m
[32m[I 2022-04-21 11:39:51,046][0m Trial 656 finished with value: 0.6738476114655684 and parameters: {'splitter': 'random', 'min_samples_split': 0.33549526642921773, 'min_samples_leaf': 0.1453957226787014, 'min_weight_fraction_leaf': 0.18596948425693105, 'max_features': 0.8903894031647791}. Best is trial 11 with value: 0.6773038119717333.[0m
[32m[I 2022-04-21 11:39:51,110][0m Trial 657 finished with value: 0.5 and parameters: {'splitter': 'random', 'min_samples_split': 0.4074880979461048, 'min_samples_leaf': 0.3177682535100293, 'min_weight_fraction_leaf': 0.17891648692717171, 'max_features': 0.8744484922292642}. Best is trial 11 with value: 0.6773038119717333.[0m
[32m[I 2022-04-21 11:39:51,157][0m Trial 658 finished with value: 0.6738476114655684 and parameters: {'splitter': 'random', 'min_samples_split': 0.26102901389282185, 'min_samples_leaf': 0.18709154370920533, 'min_weight_fraction_leaf': 0.14735303629647944, 'max_features': 0.8728814416368844}. Best is trial 11 with value: 0.6773038119717333.[0m
[32m[I 2022-04-21 11:39:51,195][0m Trial 659 finished with value: 0.6738476114655684 and parameters: {'splitter': 'random', 'min_samples_split': 0.2336162022421175, 'min_samples_leaf': 0.1937137724495574, 'min_weight_fraction_leaf': 0.1913372447989688, 'max_features': 0.8391475862013817}. Best is trial 11 with value: 0.6773038119717333.[0m
[32m[I 2022-04-21 11:39:51,262][0m Trial 660 finished with value: 0.5889594645659965 and parameters: {'splitter': 'random', 'min_samples_split': 0.26132244675542615, 'min_samples_leaf': 0.19933616686583192, 'min_weight_fraction_leaf': 0.2332259004407119, 'max_features': 0.8583391125748171}. Best is trial 11 with value: 0.6773038119717333.[0m
[32m[I 2022-04-21 11:39:51,351][0m Trial 661 finished with value: 0.6215155824977587 and parameters: {'splitter': 'random', 'min_samples_split': 0.2876268315124598, 'min_samples_leaf': 0.2238394111780008, 'min_weight_fraction_leaf': 0.07618534175123953, 'max_features': 0.9113268615185328}. Best is trial 11 with value: 0.6773038119717333.[0m
[32m[I 2022-04-21 11:39:51,438][0m Trial 662 finished with value: 0.5 and parameters: {'splitter': 'random', 'min_samples_split': 0.21404446981526024, 'min_samples_leaf': 0.06079900930489267, 'min_weight_fraction_leaf': 0.26647012485205124, 'max_features': 0.9560979152765672}. Best is trial 11 with value: 0.6773038119717333.[0m
[32m[I 2022-04-21 11:39:51,522][0m Trial 663 finished with value: 0.6586187582319654 and parameters: {'splitter': 'random', 'min_samples_split': 0.14626424254931603, 'min_samples_leaf': 0.019951861818138607, 'min_weight_fraction_leaf': 0.21277155447282448, 'max_features': 0.8641331843294204}. Best is trial 11 with value: 0.6773038119717333.[0m
[32m[I 2022-04-21 11:39:51,614][0m Trial 664 finished with value: 0.6738476114655684 and parameters: {'splitter': 'random', 'min_samples_split': 0.1813014152109879, 'min_samples_leaf': 0.16722181376800319, 'min_weight_fraction_leaf': 0.14093842837794432, 'max_features': 0.8463164291157929}. Best is trial 11 with value: 0.6773038119717333.[0m
[32m[I 2022-04-21 11:39:51,698][0m Trial 665 finished with value: 0.6738476114655684 and parameters: {'splitter': 'random', 'min_samples_split': 0.43850929987666315, 'min_samples_leaf': 0.15951556735484756, 'min_weight_fraction_leaf': 0.16688525036459717, 'max_features': 0.9564484816400604}. Best is trial 11 with value: 0.6773038119717333.[0m
[32m[I 2022-04-21 11:39:51,780][0m Trial 666 finished with value: 0.6738476114655684 and parameters: {'splitter': 'random', 'min_samples_split': 0.4123964789010733, 'min_samples_leaf': 0.16723096673218454, 'min_weight_fraction_leaf': 0.15500845585799633, 'max_features': 0.9651602652616306}. Best is trial 11 with value: 0.6773038119717333.[0m
[32m[I 2022-04-21 11:39:51,918][0m Trial 667 finished with value: 0.662800366349585 and parameters: {'splitter': 'random', 'min_samples_split': 0.4297175766346747, 'min_samples_leaf': 0.15508651977526497, 'min_weight_fraction_leaf': 0.1651374488129172, 'max_features': 0.9615067893341459}. Best is trial 11 with value: 0.6773038119717333.[0m
[32m[I 2022-04-21 11:39:52,014][0m Trial 668 finished with value: 0.6586187582319654 and parameters: {'splitter': 'random', 'min_samples_split': 0.22529200456278511, 'min_samples_leaf': 0.011115041664874164, 'min_weight_fraction_leaf': 0.2095939766875644, 'max_features': 0.9828336192583013}. Best is trial 11 with value: 0.6773038119717333.[0m
[32m[I 2022-04-21 11:39:52,100][0m Trial 669 finished with value: 0.6586187582319654 and parameters: {'splitter': 'random', 'min_samples_split': 0.046394464712923356, 'min_samples_leaf': 0.18198323265725916, 'min_weight_fraction_leaf': 0.20323525201093418, 'max_features': 0.9498316419912844}. Best is trial 11 with value: 0.6773038119717333.[0m
[32m[I 2022-04-21 11:39:52,209][0m Trial 670 finished with value: 0.6738476114655684 and parameters: {'splitter': 'random', 'min_samples_split': 0.1682154333502544, 'min_samples_leaf': 0.17794765507099797, 'min_weight_fraction_leaf': 0.1196313187533064, 'max_features': 0.9574247496584174}. Best is trial 11 with value: 0.6773038119717333.[0m
[32m[I 2022-04-21 11:39:52,313][0m Trial 671 finished with value: 0.6735450312505284 and parameters: {'splitter': 'best', 'min_samples_split': 0.3482981397485817, 'min_samples_leaf': 0.122069346241937, 'min_weight_fraction_leaf': 0.0037803198713939334, 'max_features': 0.9317753067541612}. Best is trial 11 with value: 0.6773038119717333.[0m
[32m[I 2022-04-21 11:39:52,443][0m Trial 672 finished with value: 0.6738476114655684 and parameters: {'splitter': 'random', 'min_samples_split': 0.11180337353106845, 'min_samples_leaf': 0.047256812353331394, 'min_weight_fraction_leaf': 0.1857967571127657, 'max_features': 0.9257274610427361}. Best is trial 11 with value: 0.6773038119717333.[0m
[32m[I 2022-04-21 11:39:52,542][0m Trial 673 finished with value: 0.6738476114655684 and parameters: {'splitter': 'random', 'min_samples_split': 0.2220215561702603, 'min_samples_leaf': 0.015187818856204634, 'min_weight_fraction_leaf': 0.18995203487068296, 'max_features': 0.9836318862372755}. Best is trial 11 with value: 0.6773038119717333.[0m
[32m[I 2022-04-21 11:39:52,732][0m Trial 674 finished with value: 0.6738476114655684 and parameters: {'splitter': 'random', 'min_samples_split': 0.22729406592984938, 'min_samples_leaf': 0.01167547039421633, 'min_weight_fraction_leaf': 0.19863053542632603, 'max_features': 0.9937803954371467}. Best is trial 11 with value: 0.6773038119717333.[0m
[32m[I 2022-04-21 11:39:52,914][0m Trial 675 finished with value: 0.6738476114655684 and parameters: {'splitter': 'random', 'min_samples_split': 0.40305471609928567, 'min_samples_leaf': 0.17572514177668155, 'min_weight_fraction_leaf': 0.17473696826282165, 'max_features': 0.9223677749845942}. Best is trial 11 with value: 0.6773038119717333.[0m
[32m[I 2022-04-21 11:39:53,086][0m Trial 676 finished with value: 0.6738476114655684 and parameters: {'splitter': 'random', 'min_samples_split': 0.3952287326373811, 'min_samples_leaf': 0.1813695175518978, 'min_weight_fraction_leaf': 0.1554901162496364, 'max_features': 0.9369183451746332}. Best is trial 11 with value: 0.6773038119717333.[0m
[32m[I 2022-04-21 11:39:53,263][0m Trial 677 finished with value: 0.6738476114655684 and parameters: {'splitter': 'random', 'min_samples_split': 0.40454129600867594, 'min_samples_leaf': 0.20079011448271916, 'min_weight_fraction_leaf': 0.1521879080832115, 'max_features': 0.8796557805419134}. Best is trial 11 with value: 0.6773038119717333.[0m
[32m[I 2022-04-21 11:39:53,360][0m Trial 678 finished with value: 0.6738476114655684 and parameters: {'splitter': 'random', 'min_samples_split': 0.39083351198967786, 'min_samples_leaf': 0.18731394731421439, 'min_weight_fraction_leaf': 0.128797623208877, 'max_features': 0.9166546028970647}. Best is trial 11 with value: 0.6773038119717333.[0m
[32m[I 2022-04-21 11:39:53,425][0m Trial 679 finished with value: 0.6738476114655684 and parameters: {'splitter': 'random', 'min_samples_split': 0.40899803824221564, 'min_samples_leaf': 0.20054676171445454, 'min_weight_fraction_leaf': 0.10417183384322505, 'max_features': 0.8022930017220409}. Best is trial 11 with value: 0.6773038119717333.[0m
[32m[I 2022-04-21 11:39:53,491][0m Trial 680 finished with value: 0.6586187582319654 and parameters: {'splitter': 'random', 'min_samples_split': 0.4021462369503008, 'min_samples_leaf': 0.2066830918411856, 'min_weight_fraction_leaf': 0.09425367966405092, 'max_features': 0.8194608453063225}. Best is trial 11 with value: 0.6773038119717333.[0m
[32m[I 2022-04-21 11:39:53,563][0m Trial 681 finished with value: 0.662800366349585 and parameters: {'splitter': 'random', 'min_samples_split': 0.049155163577604355, 'min_samples_leaf': 0.13647991781188912, 'min_weight_fraction_leaf': 0.16292941649130174, 'max_features': 0.8504598521900921}. Best is trial 11 with value: 0.6773038119717333.[0m
[32m[I 2022-04-21 11:39:53,634][0m Trial 682 finished with value: 0.6738476114655684 and parameters: {'splitter': 'random', 'min_samples_split': 0.3662277404950727, 'min_samples_leaf': 0.009038018760425886, 'min_weight_fraction_leaf': 0.18489791304741174, 'max_features': 0.989199977335789}. Best is trial 11 with value: 0.6773038119717333.[0m
[32m[I 2022-04-21 11:39:53,687][0m Trial 683 finished with value: 0.6551405301163737 and parameters: {'splitter': 'random', 'min_samples_split': 0.44190286614448426, 'min_samples_leaf': 0.04064044441672576, 'min_weight_fraction_leaf': 0.21539531592277336, 'max_features': 0.8912416172796576}. Best is trial 11 with value: 0.6773038119717333.[0m
[32m[I 2022-04-21 11:39:53,783][0m Trial 684 finished with value: 0.6738476114655684 and parameters: {'splitter': 'random', 'min_samples_split': 0.06541123156231399, 'min_samples_leaf': 0.1919866006369609, 'min_weight_fraction_leaf': 0.1403284996680252, 'max_features': 0.9616919736139632}. Best is trial 11 with value: 0.6773038119717333.[0m
[32m[I 2022-04-21 11:39:53,936][0m Trial 685 finished with value: 0.6738476114655684 and parameters: {'splitter': 'random', 'min_samples_split': 0.3734221572241726, 'min_samples_leaf': 0.0011982869358922827, 'min_weight_fraction_leaf': 0.1816363242010869, 'max_features': 0.9457971221303892}. Best is trial 11 with value: 0.6773038119717333.[0m
[32m[I 2022-04-21 11:39:54,018][0m Trial 686 finished with value: 0.6738476114655684 and parameters: {'splitter': 'random', 'min_samples_split': 0.3894267382983481, 'min_samples_leaf': 0.005870599491431563, 'min_weight_fraction_leaf': 0.20034444970496246, 'max_features': 0.9415517129416474}. Best is trial 11 with value: 0.6773038119717333.[0m
[32m[I 2022-04-21 11:39:54,107][0m Trial 687 finished with value: 0.6551405301163737 and parameters: {'splitter': 'random', 'min_samples_split': 0.307102798266791, 'min_samples_leaf': 0.21792693924533102, 'min_weight_fraction_leaf': 0.12244088284344129, 'max_features': 0.8783463565369936}. Best is trial 11 with value: 0.6773038119717333.[0m
[32m[I 2022-04-21 11:39:54,165][0m Trial 688 finished with value: 0.6738476114655684 and parameters: {'splitter': 'random', 'min_samples_split': 0.3628286085558031, 'min_samples_leaf': 0.11080761784548507, 'min_weight_fraction_leaf': 0.18009600322264774, 'max_features': 0.9103621426076105}. Best is trial 11 with value: 0.6773038119717333.[0m
[32m[I 2022-04-21 11:39:54,237][0m Trial 689 finished with value: 0.6636900948801576 and parameters: {'splitter': 'best', 'min_samples_split': 0.35692114283119075, 'min_samples_leaf': 0.12481015848369043, 'min_weight_fraction_leaf': 0.19616593280626404, 'max_features': 0.9009177535599671}. Best is trial 11 with value: 0.6773038119717333.[0m
[32m[I 2022-04-21 11:39:54,303][0m Trial 690 finished with value: 0.6738476114655684 and parameters: {'splitter': 'random', 'min_samples_split': 0.3732871467435151, 'min_samples_leaf': 0.1302832475865241, 'min_weight_fraction_leaf': 0.18641865790957896, 'max_features': 0.8944181179595558}. Best is trial 11 with value: 0.6773038119717333.[0m
[32m[I 2022-04-21 11:39:54,364][0m Trial 691 finished with value: 0.6738476114655684 and parameters: {'splitter': 'random', 'min_samples_split': 0.1917718646151953, 'min_samples_leaf': 0.016110352728146385, 'min_weight_fraction_leaf': 0.1769849789106796, 'max_features': 0.846205187966873}. Best is trial 11 with value: 0.6773038119717333.[0m
[32m[I 2022-04-21 11:39:54,446][0m Trial 692 finished with value: 0.6738476114655684 and parameters: {'splitter': 'random', 'min_samples_split': 0.1915645197839153, 'min_samples_leaf': 0.018343637593859378, 'min_weight_fraction_leaf': 0.16931823358751788, 'max_features': 0.832747990058013}. Best is trial 11 with value: 0.6773038119717333.[0m
[32m[I 2022-04-21 11:39:54,501][0m Trial 693 finished with value: 0.6738476114655684 and parameters: {'splitter': 'random', 'min_samples_split': 0.3846197076870216, 'min_samples_leaf': 0.1151521487255953, 'min_weight_fraction_leaf': 0.16736240647270584, 'max_features': 0.8757965361071863}. Best is trial 11 with value: 0.6773038119717333.[0m
[32m[I 2022-04-21 11:39:54,567][0m Trial 694 finished with value: 0.662800366349585 and parameters: {'splitter': 'random', 'min_samples_split': 0.16794458579162308, 'min_samples_leaf': 0.09837586659364446, 'min_weight_fraction_leaf': 0.16616760789069326, 'max_features': 0.8269815826127427}. Best is trial 11 with value: 0.6773038119717333.[0m
[32m[I 2022-04-21 11:39:54,614][0m Trial 695 finished with value: 0.6738476114655684 and parameters: {'splitter': 'random', 'min_samples_split': 0.2136722383359636, 'min_samples_leaf': 0.0030412424003613435, 'min_weight_fraction_leaf': 0.19536354338690176, 'max_features': 0.9773590149516004}. Best is trial 11 with value: 0.6773038119717333.[0m
[32m[I 2022-04-21 11:39:54,675][0m Trial 696 finished with value: 0.6586187582319654 and parameters: {'splitter': 'random', 'min_samples_split': 0.4486095586896754, 'min_samples_leaf': 0.05789124661989745, 'min_weight_fraction_leaf': 0.20563280384041774, 'max_features': 0.93146636713461}. Best is trial 11 with value: 0.6773038119717333.[0m
[32m[I 2022-04-21 11:39:54,739][0m Trial 697 finished with value: 0.5305100038533069 and parameters: {'splitter': 'random', 'min_samples_split': 0.19567897430781242, 'min_samples_leaf': 0.019448237805376224, 'min_weight_fraction_leaf': 0.17570084239840922, 'max_features': 0.7808355154638729}. Best is trial 11 with value: 0.6773038119717333.[0m
[32m[I 2022-04-21 11:39:54,800][0m Trial 698 finished with value: 0.6738476114655684 and parameters: {'splitter': 'random', 'min_samples_split': 0.44166732192411123, 'min_samples_leaf': 0.033161782402465256, 'min_weight_fraction_leaf': 0.1770004018699707, 'max_features': 0.935895223030733}. Best is trial 11 with value: 0.6773038119717333.[0m
[32m[I 2022-04-21 11:39:54,869][0m Trial 699 finished with value: 0.6640701022932763 and parameters: {'splitter': 'random', 'min_samples_split': 0.30567565719811013, 'min_samples_leaf': 0.12986895172421267, 'min_weight_fraction_leaf': 0.09536662846123166, 'max_features': 0.8621009297585516}. Best is trial 11 with value: 0.6773038119717333.[0m
[32m[I 2022-04-21 11:39:54,939][0m Trial 700 finished with value: 0.5 and parameters: {'splitter': 'random', 'min_samples_split': 0.4519184774507265, 'min_samples_leaf': 0.036750864328034705, 'min_weight_fraction_leaf': 0.39037188045739446, 'max_features': 0.9697054248423034}. Best is trial 11 with value: 0.6773038119717333.[0m
[32m[I 2022-04-21 11:39:54,995][0m Trial 701 finished with value: 0.5 and parameters: {'splitter': 'random', 'min_samples_split': 0.3681356120865364, 'min_samples_leaf': 0.3802376553944355, 'min_weight_fraction_leaf': 0.10724020452215444, 'max_features': 0.9968798444148177}. Best is trial 11 with value: 0.6773038119717333.[0m
