[32m[I 2022-04-21 11:38:58,610][0m Trial 321 finished with value: 0.842183674410227 and parameters: {'alpha': 0.6388698135771034, 'ties': 'efron'}. Best is trial 13 with value: 0.8423527006348241.[0m
[32m[I 2022-04-21 11:38:58,881][0m Trial 322 finished with value: 0.8414545406933376 and parameters: {'alpha': 1.0067642829045966, 'ties': 'efron'}. Best is trial 13 with value: 0.8423527006348241.[0m
[32m[I 2022-04-21 11:38:59,171][0m Trial 323 finished with value: 0.8423527006348241 and parameters: {'alpha': 0.713779363838995, 'ties': 'efron'}. Best is trial 13 with value: 0.8423527006348241.[0m
[32m[I 2022-04-21 11:38:59,460][0m Trial 324 finished with value: 0.8423527006348241 and parameters: {'alpha': 0.8170697142538985, 'ties': 'breslow'}. Best is trial 13 with value: 0.8423527006348241.[0m
[32m[I 2022-04-21 11:38:59,781][0m Trial 325 finished with value: 0.8423527006348241 and parameters: {'alpha': 0.8240425360768607, 'ties': 'breslow'}. Best is trial 13 with value: 0.8423527006348241.[0m
[32m[I 2022-04-21 11:39:00,215][0m Trial 326 finished with value: 0.8414545406933376 and parameters: {'alpha': 0.9987097644013305, 'ties': 'breslow'}. Best is trial 13 with value: 0.8423527006348241.[0m
[32m[I 2022-04-21 11:39:00,507][0m Trial 327 finished with value: 0.8414545406933376 and parameters: {'alpha': 1.2723511409957067, 'ties': 'breslow'}. Best is trial 13 with value: 0.8423527006348241.[0m
[32m[I 2022-04-21 11:39:00,851][0m Trial 328 finished with value: 0.842183674410227 and parameters: {'alpha': 0.573096939350594, 'ties': 'breslow'}. Best is trial 13 with value: 0.8423527006348241.[0m
[32m[I 2022-04-21 11:39:01,158][0m Trial 329 finished with value: 0.842183674410227 and parameters: {'alpha': 0.4647955651414302, 'ties': 'breslow'}. Best is trial 13 with value: 0.8423527006348241.[0m
[32m[I 2022-04-21 11:39:01,447][0m Trial 330 finished with value: 0.842183674410227 and parameters: {'alpha': 0.6507590594758493, 'ties': 'breslow'}. Best is trial 13 with value: 0.8423527006348241.[0m
[32m[I 2022-04-21 11:39:01,740][0m Trial 331 finished with value: 0.8423527006348241 and parameters: {'alpha': 0.7405628398216361, 'ties': 'breslow'}. Best is trial 13 with value: 0.8423527006348241.[0m
[32m[I 2022-04-21 11:39:02,045][0m Trial 332 finished with value: 0.8423527006348241 and parameters: {'alpha': 0.7410953662794808, 'ties': 'efron'}. Best is trial 13 with value: 0.8423527006348241.[0m
[32m[I 2022-04-21 11:39:02,388][0m Trial 333 finished with value: 0.8423527006348241 and parameters: {'alpha': 0.9337688784474513, 'ties': 'breslow'}. Best is trial 13 with value: 0.8423527006348241.[0m
[32m[I 2022-04-21 11:39:02,627][0m Trial 334 finished with value: 0.8414545406933376 and parameters: {'alpha': 1.127618658269435, 'ties': 'breslow'}. Best is trial 13 with value: 0.8423527006348241.[0m
[32m[I 2022-04-21 11:39:02,801][0m Trial 335 finished with value: 0.8423527006348241 and parameters: {'alpha': 0.9237480478475866, 'ties': 'breslow'}. Best is trial 13 with value: 0.8423527006348241.[0m
[32m[I 2022-04-21 11:39:03,013][0m Trial 336 finished with value: 0.8414545406933376 and parameters: {'alpha': 1.0007639612552661, 'ties': 'efron'}. Best is trial 13 with value: 0.8423527006348241.[0m
[32m[I 2022-04-21 11:39:03,219][0m Trial 337 finished with value: 0.8423527006348241 and parameters: {'alpha': 0.8300264369114547, 'ties': 'breslow'}. Best is trial 13 with value: 0.8423527006348241.[0m
[32m[I 2022-04-21 11:39:03,392][0m Trial 338 finished with value: 0.8423527006348241 and parameters: {'alpha': 0.9002653785070718, 'ties': 'breslow'}. Best is trial 13 with value: 0.8423527006348241.[0m
[32m[I 2022-04-21 11:39:03,557][0m Trial 339 finished with value: 0.8423527006348241 and parameters: {'alpha': 0.8722130766479038, 'ties': 'breslow'}. Best is trial 13 with value: 0.8423527006348241.[0m
[32m[I 2022-04-21 11:39:03,913][0m Trial 340 finished with value: 0.8414545406933376 and parameters: {'alpha': 1.074942566036415, 'ties': 'breslow'}. Best is trial 13 with value: 0.8423527006348241.[0m
[32m[I 2022-04-21 11:39:04,183][0m Trial 341 finished with value: 0.8423527006348241 and parameters: {'alpha': 0.7847803992284528, 'ties': 'breslow'}. Best is trial 13 with value: 0.8423527006348241.[0m
[32m[I 2022-04-21 11:39:04,333][0m Trial 342 finished with value: 0.842183674410227 and parameters: {'alpha': 0.6298335084979184, 'ties': 'breslow'}. Best is trial 13 with value: 0.8423527006348241.[0m
[32m[I 2022-04-21 11:39:04,569][0m Trial 343 finished with value: 0.8423527006348241 and parameters: {'alpha': 0.7253908677709426, 'ties': 'efron'}. Best is trial 13 with value: 0.8423527006348241.[0m
[32m[I 2022-04-21 11:39:04,904][0m Trial 344 finished with value: 0.842183674410227 and parameters: {'alpha': 0.5671404806715018, 'ties': 'breslow'}. Best is trial 13 with value: 0.8423527006348241.[0m
[32m[I 2022-04-21 11:39:05,208][0m Trial 345 finished with value: 0.8423527006348241 and parameters: {'alpha': 0.8250431392756673, 'ties': 'efron'}. Best is trial 13 with value: 0.8423527006348241.[0m
[32m[I 2022-04-21 11:39:05,694][0m Trial 346 finished with value: 0.842183674410227 and parameters: {'alpha': 0.7011843025716908, 'ties': 'breslow'}. Best is trial 13 with value: 0.8423527006348241.[0m
[32m[I 2022-04-21 11:39:06,200][0m Trial 347 finished with value: 0.8423527006348241 and parameters: {'alpha': 0.8072558675707, 'ties': 'efron'}. Best is trial 13 with value: 0.8423527006348241.[0m
[32m[I 2022-04-21 11:39:06,635][0m Trial 348 finished with value: 0.8413067259961411 and parameters: {'alpha': 2.313487272152154, 'ties': 'efron'}. Best is trial 13 with value: 0.8423527006348241.[0m
[32m[I 2022-04-21 11:39:07,001][0m Trial 349 finished with value: 0.8414545406933376 and parameters: {'alpha': 0.9468004079354962, 'ties': 'efron'}. Best is trial 13 with value: 0.8423527006348241.[0m
[32m[I 2022-04-21 11:39:07,417][0m Trial 350 finished with value: 0.842183674410227 and parameters: {'alpha': 0.6663792890891279, 'ties': 'breslow'}. Best is trial 13 with value: 0.8423527006348241.[0m
[32m[I 2022-04-21 11:39:07,709][0m Trial 351 finished with value: 0.8412855144687406 and parameters: {'alpha': 1.8520827334005374, 'ties': 'efron'}. Best is trial 13 with value: 0.8423527006348241.[0m
[32m[I 2022-04-21 11:39:07,922][0m Trial 352 finished with value: 0.8414545406933376 and parameters: {'alpha': 1.0312213421977452, 'ties': 'efron'}. Best is trial 13 with value: 0.8423527006348241.[0m
[32m[I 2022-04-21 11:39:08,109][0m Trial 353 finished with value: 0.8423527006348241 and parameters: {'alpha': 0.9347969100536082, 'ties': 'breslow'}. Best is trial 13 with value: 0.8423527006348241.[0m
[32m[I 2022-04-21 11:39:08,445][0m Trial 354 finished with value: 0.842183674410227 and parameters: {'alpha': 0.4301087357144556, 'ties': 'efron'}. Best is trial 13 with value: 0.8423527006348241.[0m
[32m[I 2022-04-21 11:39:08,660][0m Trial 355 finished with value: 0.8423527006348241 and parameters: {'alpha': 0.8779275886065371, 'ties': 'breslow'}. Best is trial 13 with value: 0.8423527006348241.[0m
[32m[I 2022-04-21 11:39:08,960][0m Trial 356 finished with value: 0.8414545406933376 and parameters: {'alpha': 1.1511005154941485, 'ties': 'breslow'}. Best is trial 13 with value: 0.8423527006348241.[0m
[32m[I 2022-04-21 11:39:09,198][0m Trial 357 finished with value: 0.8423527006348241 and parameters: {'alpha': 0.8781340226645498, 'ties': 'breslow'}. Best is trial 13 with value: 0.8423527006348241.[0m
[32m[I 2022-04-21 11:39:09,582][0m Trial 358 finished with value: 0.8423527006348241 and parameters: {'alpha': 0.7474661780524549, 'ties': 'efron'}. Best is trial 13 with value: 0.8423527006348241.[0m
[32m[I 2022-04-21 11:39:09,953][0m Trial 359 finished with value: 0.8414545406933376 and parameters: {'alpha': 1.0370941222696155, 'ties': 'breslow'}. Best is trial 13 with value: 0.8423527006348241.[0m
[32m[I 2022-04-21 11:39:10,155][0m Trial 360 finished with value: 0.8414545406933376 and parameters: {'alpha': 0.9955584570364222, 'ties': 'breslow'}. Best is trial 13 with value: 0.8423527006348241.[0m
[32m[I 2022-04-21 11:39:10,319][0m Trial 361 finished with value: 0.8423527006348241 and parameters: {'alpha': 0.8275648744945517, 'ties': 'breslow'}. Best is trial 13 with value: 0.8423527006348241.[0m
[32m[I 2022-04-21 11:39:10,496][0m Trial 362 finished with value: 0.8423527006348241 and parameters: {'alpha': 0.817874615168614, 'ties': 'breslow'}. Best is trial 13 with value: 0.8423527006348241.[0m
[32m[I 2022-04-21 11:39:10,666][0m Trial 363 finished with value: 0.842183674410227 and parameters: {'alpha': 0.5989038505054074, 'ties': 'efron'}. Best is trial 13 with value: 0.8423527006348241.[0m
[32m[I 2022-04-21 11:39:10,993][0m Trial 364 finished with value: 0.8423527006348241 and parameters: {'alpha': 0.925658701342927, 'ties': 'breslow'}. Best is trial 13 with value: 0.8423527006348241.[0m
[32m[I 2022-04-21 11:39:11,341][0m Trial 365 finished with value: 0.8423527006348241 and parameters: {'alpha': 0.6946904425700815, 'ties': 'efron'}. Best is trial 13 with value: 0.8423527006348241.[0m
[32m[I 2022-04-21 11:39:11,671][0m Trial 366 finished with value: 0.842183674410227 and parameters: {'alpha': 0.5826433054525393, 'ties': 'breslow'}. Best is trial 13 with value: 0.8423527006348241.[0m
[32m[I 2022-04-21 11:39:12,047][0m Trial 367 finished with value: 0.8414545406933376 and parameters: {'alpha': 0.9886162267763097, 'ties': 'breslow'}. Best is trial 13 with value: 0.8423527006348241.[0m
[32m[I 2022-04-21 11:39:12,563][0m Trial 368 finished with value: 0.8423527006348241 and parameters: {'alpha': 0.7602635655538709, 'ties': 'breslow'}. Best is trial 13 with value: 0.8423527006348241.[0m
[32m[I 2022-04-21 11:39:12,992][0m Trial 369 finished with value: 0.842183674410227 and parameters: {'alpha': 0.5150390918494288, 'ties': 'breslow'}. Best is trial 13 with value: 0.8423527006348241.[0m
[32m[I 2022-04-21 11:39:13,336][0m Trial 370 finished with value: 0.842183674410227 and parameters: {'alpha': 0.6775687646840161, 'ties': 'efron'}. Best is trial 13 with value: 0.8423527006348241.[0m
[32m[I 2022-04-21 11:39:13,615][0m Trial 371 finished with value: 0.842183674410227 and parameters: {'alpha': 0.6642940376562572, 'ties': 'breslow'}. Best is trial 13 with value: 0.8423527006348241.[0m
[32m[I 2022-04-21 11:39:13,957][0m Trial 372 finished with value: 0.8423527006348241 and parameters: {'alpha': 0.7563894513188516, 'ties': 'breslow'}. Best is trial 13 with value: 0.8423527006348241.[0m
[32m[I 2022-04-21 11:39:14,322][0m Trial 373 finished with value: 0.8423527006348241 and parameters: {'alpha': 0.8209810374891241, 'ties': 'efron'}. Best is trial 13 with value: 0.8423527006348241.[0m
[32m[I 2022-04-21 11:39:14,628][0m Trial 374 finished with value: 0.8423527006348241 and parameters: {'alpha': 0.790012532741082, 'ties': 'breslow'}. Best is trial 13 with value: 0.8423527006348241.[0m
[32m[I 2022-04-21 11:39:15,023][0m Trial 375 finished with value: 0.842183674410227 and parameters: {'alpha': 0.5558080258731115, 'ties': 'breslow'}. Best is trial 13 with value: 0.8423527006348241.[0m
[32m[I 2022-04-21 11:39:15,456][0m Trial 376 finished with value: 0.842183674410227 and parameters: {'alpha': 0.39940543272977636, 'ties': 'efron'}. Best is trial 13 with value: 0.8423527006348241.[0m
[32m[I 2022-04-21 11:39:15,965][0m Trial 377 finished with value: 0.842183674410227 and parameters: {'alpha': 0.6301239187530983, 'ties': 'efron'}. Best is trial 13 with value: 0.8423527006348241.[0m
[32m[I 2022-04-21 11:39:16,443][0m Trial 378 finished with value: 0.842183674410227 and parameters: {'alpha': 0.6699081003803294, 'ties': 'breslow'}. Best is trial 13 with value: 0.8423527006348241.[0m
[32m[I 2022-04-21 11:39:16,716][0m Trial 379 finished with value: 0.8423527006348241 and parameters: {'alpha': 0.7291232254823287, 'ties': 'efron'}. Best is trial 13 with value: 0.8423527006348241.[0m
[32m[I 2022-04-21 11:39:17,025][0m Trial 380 finished with value: 0.842183674410227 and parameters: {'alpha': 0.5256205506117555, 'ties': 'efron'}. Best is trial 13 with value: 0.8423527006348241.[0m
[32m[I 2022-04-21 11:39:17,500][0m Trial 381 finished with value: 0.8414545406933376 and parameters: {'alpha': 1.098889196648175, 'ties': 'efron'}. Best is trial 13 with value: 0.8423527006348241.[0m
[32m[I 2022-04-21 11:39:18,142][0m Trial 382 finished with value: 0.8414545406933376 and parameters: {'alpha': 0.9100504662135185, 'ties': 'efron'}. Best is trial 13 with value: 0.8423527006348241.[0m
[32m[I 2022-04-21 11:39:18,479][0m Trial 383 finished with value: 0.8423527006348241 and parameters: {'alpha': 0.7840254267489697, 'ties': 'efron'}. Best is trial 13 with value: 0.8423527006348241.[0m
[32m[I 2022-04-21 11:39:18,785][0m Trial 384 finished with value: 0.8423527006348241 and parameters: {'alpha': 0.8653912351678705, 'ties': 'breslow'}. Best is trial 13 with value: 0.8423527006348241.[0m
[32m[I 2022-04-21 11:39:18,949][0m Trial 385 finished with value: 0.8414545406933376 and parameters: {'alpha': 0.9677064260971959, 'ties': 'breslow'}. Best is trial 13 with value: 0.8423527006348241.[0m
[32m[I 2022-04-21 11:39:19,088][0m Trial 386 finished with value: 0.8414545406933376 and parameters: {'alpha': 1.5215287353400155, 'ties': 'breslow'}. Best is trial 13 with value: 0.8423527006348241.[0m
[32m[I 2022-04-21 11:39:19,292][0m Trial 387 finished with value: 0.842183674410227 and parameters: {'alpha': 0.6635990735130122, 'ties': 'breslow'}. Best is trial 13 with value: 0.8423527006348241.[0m
[32m[I 2022-04-21 11:39:19,574][0m Trial 388 finished with value: 0.8423527006348241 and parameters: {'alpha': 0.8025410367549108, 'ties': 'efron'}. Best is trial 13 with value: 0.8423527006348241.[0m
[32m[I 2022-04-21 11:39:19,758][0m Trial 389 finished with value: 0.8423527006348241 and parameters: {'alpha': 0.8990752601449012, 'ties': 'breslow'}. Best is trial 13 with value: 0.8423527006348241.[0m
[32m[I 2022-04-21 11:39:19,915][0m Trial 390 finished with value: 0.8423527006348241 and parameters: {'alpha': 0.8007407046561494, 'ties': 'efron'}. Best is trial 13 with value: 0.8423527006348241.[0m
[32m[I 2022-04-21 11:39:20,107][0m Trial 391 finished with value: 0.8414545406933376 and parameters: {'alpha': 1.0638102802715976, 'ties': 'efron'}. Best is trial 13 with value: 0.8423527006348241.[0m
[32m[I 2022-04-21 11:39:20,359][0m Trial 392 finished with value: 0.842183674410227 and parameters: {'alpha': 0.07628333025213385, 'ties': 'breslow'}. Best is trial 13 with value: 0.8423527006348241.[0m
[32m[I 2022-04-21 11:39:20,528][0m Trial 393 finished with value: 0.842183674410227 and parameters: {'alpha': 0.6024016204904795, 'ties': 'efron'}. Best is trial 13 with value: 0.8423527006348241.[0m
[32m[I 2022-04-21 11:39:20,924][0m Trial 394 finished with value: 0.8423527006348241 and parameters: {'alpha': 0.7235110018800672, 'ties': 'efron'}. Best is trial 13 with value: 0.8423527006348241.[0m
[32m[I 2022-04-21 11:39:21,301][0m Trial 395 finished with value: 0.8414545406933376 and parameters: {'alpha': 1.3158574477718332, 'ties': 'breslow'}. Best is trial 13 with value: 0.8423527006348241.[0m
[32m[I 2022-04-21 11:39:21,606][0m Trial 396 finished with value: 0.8414545406933376 and parameters: {'alpha': 0.9653529454048364, 'ties': 'breslow'}. Best is trial 13 with value: 0.8423527006348241.[0m
[32m[I 2022-04-21 11:39:21,800][0m Trial 397 finished with value: 0.8423527006348241 and parameters: {'alpha': 0.7133296779496944, 'ties': 'breslow'}. Best is trial 13 with value: 0.8423527006348241.[0m
[32m[I 2022-04-21 11:39:22,114][0m Trial 398 finished with value: 0.8414545406933376 and parameters: {'alpha': 1.1867061476686738, 'ties': 'efron'}. Best is trial 13 with value: 0.8423527006348241.[0m
[32m[I 2022-04-21 11:39:22,340][0m Trial 399 finished with value: 0.842183674410227 and parameters: {'alpha': 0.4558069393952316, 'ties': 'efron'}. Best is trial 13 with value: 0.8423527006348241.[0m
[32m[I 2022-04-21 11:39:22,565][0m Trial 400 finished with value: 0.8423527006348241 and parameters: {'alpha': 0.8749978355387953, 'ties': 'breslow'}. Best is trial 13 with value: 0.8423527006348241.[0m
[32m[I 2022-04-21 11:39:22,752][0m Trial 401 finished with value: 0.8423527006348241 and parameters: {'alpha': 0.8899956517836017, 'ties': 'breslow'}. Best is trial 13 with value: 0.8423527006348241.[0m
[32m[I 2022-04-21 11:39:22,956][0m Trial 402 finished with value: 0.8414545406933376 and parameters: {'alpha': 1.0304613019872368, 'ties': 'breslow'}. Best is trial 13 with value: 0.8423527006348241.[0m
[32m[I 2022-04-21 11:39:23,166][0m Trial 403 finished with value: 0.8414545406933376 and parameters: {'alpha': 0.9426865200015819, 'ties': 'breslow'}. Best is trial 13 with value: 0.8423527006348241.[0m
[32m[I 2022-04-21 11:39:23,389][0m Trial 404 finished with value: 0.8414545406933376 and parameters: {'alpha': 1.1103760520301043, 'ties': 'breslow'}. Best is trial 13 with value: 0.8423527006348241.[0m
[32m[I 2022-04-21 11:39:23,599][0m Trial 405 finished with value: 0.8414545406933376 and parameters: {'alpha': 0.9418696353821122, 'ties': 'breslow'}. Best is trial 13 with value: 0.8423527006348241.[0m
[32m[I 2022-04-21 11:39:23,842][0m Trial 406 finished with value: 0.842183674410227 and parameters: {'alpha': 0.5833906585981835, 'ties': 'efron'}. Best is trial 13 with value: 0.8423527006348241.[0m
[32m[I 2022-04-21 11:39:24,014][0m Trial 407 finished with value: 0.8423527006348241 and parameters: {'alpha': 0.8515499186388, 'ties': 'efron'}. Best is trial 13 with value: 0.8423527006348241.[0m
[32m[I 2022-04-21 11:39:24,193][0m Trial 408 finished with value: 0.8423527006348241 and parameters: {'alpha': 0.841605175054958, 'ties': 'efron'}. Best is trial 13 with value: 0.8423527006348241.[0m
[32m[I 2022-04-21 11:39:24,350][0m Trial 409 finished with value: 0.841474844739692 and parameters: {'alpha': 2.4851025390546124, 'ties': 'breslow'}. Best is trial 13 with value: 0.8423527006348241.[0m
[32m[I 2022-04-21 11:39:24,531][0m Trial 410 finished with value: 0.8414545406933376 and parameters: {'alpha': 0.985290229044621, 'ties': 'efron'}. Best is trial 13 with value: 0.8423527006348241.[0m
[32m[I 2022-04-21 11:39:24,881][0m Trial 411 finished with value: 0.8423527006348241 and parameters: {'alpha': 0.8848500647377258, 'ties': 'breslow'}. Best is trial 13 with value: 0.8423527006348241.[0m
[32m[I 2022-04-21 11:39:25,184][0m Trial 412 finished with value: 0.8423527006348241 and parameters: {'alpha': 0.772662457834847, 'ties': 'breslow'}. Best is trial 13 with value: 0.8423527006348241.[0m
[32m[I 2022-04-21 11:39:25,524][0m Trial 413 finished with value: 0.8423527006348241 and parameters: {'alpha': 0.7219472292626337, 'ties': 'efron'}. Best is trial 13 with value: 0.8423527006348241.[0m
[32m[I 2022-04-21 11:39:25,822][0m Trial 414 finished with value: 0.8423527006348241 and parameters: {'alpha': 0.734491201976867, 'ties': 'breslow'}. Best is trial 13 with value: 0.8423527006348241.[0m
[32m[I 2022-04-21 11:39:26,065][0m Trial 415 finished with value: 0.842183674410227 and parameters: {'alpha': 0.26536315320315185, 'ties': 'breslow'}. Best is trial 13 with value: 0.8423527006348241.[0m
[32m[I 2022-04-21 11:39:26,279][0m Trial 416 finished with value: 0.8414545406933376 and parameters: {'alpha': 1.042407291065042, 'ties': 'efron'}. Best is trial 13 with value: 0.8423527006348241.[0m
[32m[I 2022-04-21 11:39:26,476][0m Trial 417 finished with value: 0.8423527006348241 and parameters: {'alpha': 0.7752766192993854, 'ties': 'breslow'}. Best is trial 13 with value: 0.8423527006348241.[0m
[32m[I 2022-04-21 11:39:26,869][0m Trial 418 finished with value: 0.8407234838742553 and parameters: {'alpha': 3.4561256068020008, 'ties': 'breslow'}. Best is trial 13 with value: 0.8423527006348241.[0m
[32m[I 2022-04-21 11:39:27,179][0m Trial 419 finished with value: 0.842183674410227 and parameters: {'alpha': 0.6119750968925924, 'ties': 'breslow'}. Best is trial 13 with value: 0.8423527006348241.[0m
[32m[I 2022-04-21 11:39:27,430][0m Trial 420 finished with value: 0.8407234838742553 and parameters: {'alpha': 4.2543704558955335, 'ties': 'breslow'}. Best is trial 13 with value: 0.8423527006348241.[0m
[32m[I 2022-04-21 11:39:27,786][0m Trial 421 finished with value: 0.8423527006348241 and parameters: {'alpha': 0.8701953173377929, 'ties': 'breslow'}. Best is trial 13 with value: 0.8423527006348241.[0m
[32m[I 2022-04-21 11:39:28,145][0m Trial 422 finished with value: 0.842183674410227 and parameters: {'alpha': 0.5056774930090662, 'ties': 'efron'}. Best is trial 13 with value: 0.8423527006348241.[0m
[32m[I 2022-04-21 11:39:28,391][0m Trial 423 finished with value: 0.8423527006348241 and parameters: {'alpha': 0.7676338124173956, 'ties': 'breslow'}. Best is trial 13 with value: 0.8423527006348241.[0m
[32m[I 2022-04-21 11:39:28,664][0m Trial 424 finished with value: 0.842183674410227 and parameters: {'alpha': 0.6620179104432322, 'ties': 'efron'}. Best is trial 13 with value: 0.8423527006348241.[0m
[32m[I 2022-04-21 11:39:28,970][0m Trial 425 finished with value: 0.8414545406933376 and parameters: {'alpha': 1.205625855931274, 'ties': 'breslow'}. Best is trial 13 with value: 0.8423527006348241.[0m
[32m[I 2022-04-21 11:39:29,296][0m Trial 426 finished with value: 0.8414545406933376 and parameters: {'alpha': 1.1203647182555723, 'ties': 'breslow'}. Best is trial 13 with value: 0.8423527006348241.[0m
[32m[I 2022-04-21 11:39:29,637][0m Trial 427 finished with value: 0.8414545406933376 and parameters: {'alpha': 0.9804047313071713, 'ties': 'breslow'}. Best is trial 13 with value: 0.8423527006348241.[0m
