[32m[I 2022-04-22 00:04:55,929][0m Trial 546 finished with value: 0.6870699017564094 and parameters: {'loss': 'coxph', 'learning_rate': 0.0003277095620523984, 'n_estimators': 320, 'criterion': 'squared_error', 'min_samples_split': 7, 'min_samples_leaf': 10, 'min_weight_fraction_leaf': 0.1653562061219826, 'min_impurity_decrease': 0.0676585179778347, 'max_features': 0.5574131368735395, 'subsample': 0.2922057192974066, 'dropout_rate': 0.2789721942612589, 'ccp_alpha': 0.0015955418070343883}. Best is trial 187 with value: 0.6933481836305168.[0m
/media/san2_ssd/data/Workdir/survival/venv/lib/python3.8/site-packages/sksurv/ensemble/boosting.py:955: RuntimeWarning: divide by zero encountered in log
  time = numpy.log(time)
/media/san2_ssd/data/Workdir/survival/venv/lib/python3.8/site-packages/sksurv/ensemble/boosting.py:955: RuntimeWarning: divide by zero encountered in log
  time = numpy.log(time)
/media/san2_ssd/data/Workdir/survival/venv/lib/python3.8/site-packages/sksurv/ensemble/boosting.py:955: RuntimeWarning: divide by zero encountered in log
  time = numpy.log(time)
/media/san2_ssd/data/Workdir/survival/venv/lib/python3.8/site-packages/sksurv/ensemble/boosting.py:955: RuntimeWarning: divide by zero encountered in log
  time = numpy.log(time)
[32m[I 2022-04-22 00:05:00,612][0m Trial 547 finished with value: -0.7309394300370865 and parameters: {'loss': 'squared', 'learning_rate': 0.00027467334184673713, 'n_estimators': 269, 'criterion': 'squared_error', 'min_samples_split': 7, 'min_samples_leaf': 9, 'min_weight_fraction_leaf': 0.19781234159061695, 'min_impurity_decrease': 0.11832764795225624, 'max_features': 0.9278838823782438, 'subsample': 0.2534092747065975, 'dropout_rate': 0.15099674484887804, 'ccp_alpha': 0.2735307450568281}. Best is trial 187 with value: 0.6933481836305168.[0m
[32m[I 2022-04-22 00:05:18,655][0m Trial 548 finished with value: 0.689325337063283 and parameters: {'loss': 'coxph', 'learning_rate': 5.971540273702009e-05, 'n_estimators': 364, 'criterion': 'squared_error', 'min_samples_split': 7, 'min_samples_leaf': 10, 'min_weight_fraction_leaf': 0.2245027803422728, 'min_impurity_decrease': 0.016217766089181282, 'max_features': 0.9820161461950012, 'subsample': 0.3162312459098116, 'dropout_rate': 0.6044238460070139, 'ccp_alpha': 0.09277110589474732}. Best is trial 187 with value: 0.6933481836305168.[0m
[32m[I 2022-04-22 00:05:32,162][0m Trial 549 finished with value: 0.5 and parameters: {'loss': 'coxph', 'learning_rate': 5.952417759132602e-05, 'n_estimators': 364, 'criterion': 'squared_error', 'min_samples_split': 7, 'min_samples_leaf': 10, 'min_weight_fraction_leaf': 0.264577477611138, 'min_impurity_decrease': 0.018454926403641953, 'max_features': 0.9543072035328921, 'subsample': 0.5513178381805766, 'dropout_rate': 0.6888795638601409, 'ccp_alpha': 0.40446336470752414}. Best is trial 187 with value: 0.6933481836305168.[0m
[32m[I 2022-04-22 00:05:49,888][0m Trial 550 finished with value: 0.6644189085623763 and parameters: {'loss': 'coxph', 'learning_rate': 6.45723207266466e-05, 'n_estimators': 371, 'criterion': 'squared_error', 'min_samples_split': 7, 'min_samples_leaf': 10, 'min_weight_fraction_leaf': 0.22392101213497095, 'min_impurity_decrease': 0.008419189446209032, 'max_features': 0.9627830173355268, 'subsample': 0.3451746273391141, 'dropout_rate': 0.617825133659273, 'ccp_alpha': 0.2427360280713303}. Best is trial 187 with value: 0.6933481836305168.[0m
[32m[I 2022-04-22 00:06:06,630][0m Trial 551 finished with value: 0.679154276669587 and parameters: {'loss': 'coxph', 'learning_rate': 4.218115260014161e-05, 'n_estimators': 355, 'criterion': 'squared_error', 'min_samples_split': 8, 'min_samples_leaf': 8, 'min_weight_fraction_leaf': 0.23369066104180064, 'min_impurity_decrease': 0.016096691156836873, 'max_features': 0.9892230077950094, 'subsample': 0.3222915267038562, 'dropout_rate': 0.5253074639078532, 'ccp_alpha': 0.16033017983432424}. Best is trial 187 with value: 0.6933481836305168.[0m
[32m[I 2022-04-22 00:06:24,727][0m Trial 552 finished with value: 0.6343732628990925 and parameters: {'loss': 'coxph', 'learning_rate': 3.201201086726587e-05, 'n_estimators': 390, 'criterion': 'squared_error', 'min_samples_split': 7, 'min_samples_leaf': 9, 'min_weight_fraction_leaf': 0.22743797163409238, 'min_impurity_decrease': 0.0323526769888425, 'max_features': 0.9689183397664085, 'subsample': 0.35513370778300857, 'dropout_rate': 0.5951138059510512, 'ccp_alpha': 0.31907193761667424}. Best is trial 187 with value: 0.6933481836305168.[0m
[32m[I 2022-04-22 00:06:36,396][0m Trial 553 finished with value: 0.6885034993287709 and parameters: {'loss': 'coxph', 'learning_rate': 8.375383538031989e-05, 'n_estimators': 346, 'criterion': 'squared_error', 'min_samples_split': 7, 'min_samples_leaf': 4, 'min_weight_fraction_leaf': 0.24259916268995868, 'min_impurity_decrease': 0.0035500045227144046, 'max_features': 0.9972455095319768, 'subsample': 0.30969556404281906, 'dropout_rate': 0.6708801162835885, 'ccp_alpha': 0.10365017766107021}. Best is trial 187 with value: 0.6933481836305168.[0m
[32m[I 2022-04-22 00:06:51,964][0m Trial 554 finished with value: 0.6799186058963859 and parameters: {'loss': 'coxph', 'learning_rate': 5.59122780353498e-05, 'n_estimators': 331, 'criterion': 'squared_error', 'min_samples_split': 7, 'min_samples_leaf': 10, 'min_weight_fraction_leaf': 0.0019695309219548984, 'min_impurity_decrease': 0.040774881221438714, 'max_features': 0.9881931185269404, 'subsample': 0.3328856100478513, 'dropout_rate': 0.6630486551047822, 'ccp_alpha': 0.1643635010343955}. Best is trial 187 with value: 0.6933481836305168.[0m
[32m[I 2022-04-22 00:07:05,455][0m Trial 555 finished with value: 0.5 and parameters: {'loss': 'coxph', 'learning_rate': 4.8597211922422044e-05, 'n_estimators': 377, 'criterion': 'squared_error', 'min_samples_split': 6, 'min_samples_leaf': 10, 'min_weight_fraction_leaf': 0.216323922126534, 'min_impurity_decrease': 0.02320885799187569, 'max_features': 0.9801898788200477, 'subsample': 0.2887926079589995, 'dropout_rate': 0.6842380288088137, 'ccp_alpha': 1.5693512792459674}. Best is trial 187 with value: 0.6933481836305168.[0m
[32m[I 2022-04-22 00:07:20,096][0m Trial 556 finished with value: 0.6706194401936265 and parameters: {'loss': 'coxph', 'learning_rate': 9.703274350568965e-05, 'n_estimators': 350, 'criterion': 'squared_error', 'min_samples_split': 7, 'min_samples_leaf': 9, 'min_weight_fraction_leaf': 0.22014359456825258, 'min_impurity_decrease': 0.04717003615885815, 'max_features': 0.8745254798252987, 'subsample': 0.3120217357534591, 'dropout_rate': 0.7105086814078454, 'ccp_alpha': 0.23903805026657385}. Best is trial 187 with value: 0.6933481836305168.[0m
[32m[I 2022-04-22 00:07:44,456][0m Trial 557 finished with value: 0.6887875974164656 and parameters: {'loss': 'coxph', 'learning_rate': 7.200522439298392e-05, 'n_estimators': 405, 'criterion': 'squared_error', 'min_samples_split': 7, 'min_samples_leaf': 10, 'min_weight_fraction_leaf': 0.2362128840963481, 'min_impurity_decrease': 0.0036780076158709485, 'max_features': 0.8531263565216338, 'subsample': 0.27593690381604713, 'dropout_rate': 0.5697461237377862, 'ccp_alpha': 0.11267361231912938}. Best is trial 187 with value: 0.6933481836305168.[0m
[32m[I 2022-04-22 00:08:06,519][0m Trial 558 finished with value: 0.6848184057680949 and parameters: {'loss': 'coxph', 'learning_rate': 7.854331499200321e-05, 'n_estimators': 412, 'criterion': 'squared_error', 'min_samples_split': 7, 'min_samples_leaf': 10, 'min_weight_fraction_leaf': 0.2441888955859981, 'min_impurity_decrease': 0.001385685101073078, 'max_features': 0.8001310267319974, 'subsample': 0.29196127032561, 'dropout_rate': 0.6396057302788892, 'ccp_alpha': 0.08684777637992327}. Best is trial 187 with value: 0.6933481836305168.[0m
[32m[I 2022-04-22 00:08:34,579][0m Trial 559 finished with value: 0.6127568729131793 and parameters: {'loss': 'coxph', 'learning_rate': 6.9459252412942e-05, 'n_estimators': 435, 'criterion': 'squared_error', 'min_samples_split': 7, 'min_samples_leaf': 9, 'min_weight_fraction_leaf': 0.24992759976486462, 'min_impurity_decrease': 0.018712160939243248, 'max_features': 0.8350008859449597, 'subsample': 0.2678668175994469, 'dropout_rate': 0.5816536040525322, 'ccp_alpha': 0.46612205499348636}. Best is trial 187 with value: 0.6933481836305168.[0m
[32m[I 2022-04-22 00:08:57,242][0m Trial 560 finished with value: 0.655511015446493 and parameters: {'loss': 'coxph', 'learning_rate': 0.00011722802204912092, 'n_estimators': 415, 'criterion': 'squared_error', 'min_samples_split': 7, 'min_samples_leaf': 10, 'min_weight_fraction_leaf': 0.2364654704718338, 'min_impurity_decrease': 0.0069252179109210305, 'max_features': 0.20793028385868656, 'subsample': 0.27465572490754653, 'dropout_rate': 0.5987170476355617, 'ccp_alpha': 0.29674451685711145}. Best is trial 187 with value: 0.6933481836305168.[0m
[32m[I 2022-04-22 00:09:19,864][0m Trial 561 finished with value: 0.6635807151369472 and parameters: {'loss': 'coxph', 'learning_rate': 5.53580288830021e-05, 'n_estimators': 395, 'criterion': 'squared_error', 'min_samples_split': 6, 'min_samples_leaf': 10, 'min_weight_fraction_leaf': 0.23589059688798109, 'min_impurity_decrease': 0.3311043108644111, 'max_features': 0.8508356157013314, 'subsample': 0.25447045312026995, 'dropout_rate': 0.6353842594725391, 'ccp_alpha': 0.16794748432253087}. Best is trial 187 with value: 0.6933481836305168.[0m
[32m[I 2022-04-22 00:09:45,332][0m Trial 562 finished with value: 0.6766301709121354 and parameters: {'loss': 'coxph', 'learning_rate': 8.571693804589938e-05, 'n_estimators': 470, 'criterion': 'friedman_mse', 'min_samples_split': 7, 'min_samples_leaf': 10, 'min_weight_fraction_leaf': 0.22739185475446788, 'min_impurity_decrease': 0.026754897557435743, 'max_features': 0.821416130495384, 'subsample': 0.27894618047733444, 'dropout_rate': 0.6588252300426871, 'ccp_alpha': 0.21325803829772344}. Best is trial 187 with value: 0.6933481836305168.[0m
[32m[I 2022-04-22 00:10:14,561][0m Trial 563 finished with value: 0.6878261119817318 and parameters: {'loss': 'coxph', 'learning_rate': 3.957796031623942e-05, 'n_estimators': 441, 'criterion': 'squared_error', 'min_samples_split': 7, 'min_samples_leaf': 9, 'min_weight_fraction_leaf': 0.2542743565700501, 'min_impurity_decrease': 0.032851168324929805, 'max_features': 0.8536376085089246, 'subsample': 0.327504096018928, 'dropout_rate': 0.508603493791342, 'ccp_alpha': 0.09639908526508689}. Best is trial 187 with value: 0.6933481836305168.[0m
[32m[I 2022-04-22 00:10:35,225][0m Trial 564 finished with value: 0.6838603765267379 and parameters: {'loss': 'coxph', 'learning_rate': 6.446141096663219e-05, 'n_estimators': 387, 'criterion': 'squared_error', 'min_samples_split': 7, 'min_samples_leaf': 10, 'min_weight_fraction_leaf': 0.23128681885687122, 'min_impurity_decrease': 0.04327760200809787, 'max_features': 0.5864973590815172, 'subsample': 0.30917064416766743, 'dropout_rate': 0.614031785634949, 'ccp_alpha': 0.08010430053881484}. Best is trial 187 with value: 0.6933481836305168.[0m
[32m[I 2022-04-22 00:11:49,721][0m Trial 565 finished with value: 0.5 and parameters: {'loss': 'coxph', 'learning_rate': 9.612259914224553e-05, 'n_estimators': 697, 'criterion': 'squared_error', 'min_samples_split': 7, 'min_samples_leaf': 10, 'min_weight_fraction_leaf': 0.2237938003976123, 'min_impurity_decrease': 0.0018932155971112703, 'max_features': 0.8748727340282245, 'subsample': 0.2692378038328659, 'dropout_rate': 0.5695977960011469, 'ccp_alpha': 4.709188548550575}. Best is trial 187 with value: 0.6933481836305168.[0m
[32m[I 2022-04-22 00:12:07,895][0m Trial 566 finished with value: 0.5 and parameters: {'loss': 'coxph', 'learning_rate': 2.6766979198167277e-05, 'n_estimators': 406, 'criterion': 'squared_error', 'min_samples_split': 8, 'min_samples_leaf': 10, 'min_weight_fraction_leaf': 0.2388419198864652, 'min_impurity_decrease': 0.022147504526986415, 'max_features': 0.8597620949571226, 'subsample': 0.2903025145568692, 'dropout_rate': 0.6197210404039779, 'ccp_alpha': 1.02276802007794}. Best is trial 187 with value: 0.6933481836305168.[0m
[32m[I 2022-04-22 00:12:19,010][0m Trial 567 finished with value: 0.6895237421446939 and parameters: {'loss': 'coxph', 'learning_rate': 4.9803079160051416e-05, 'n_estimators': 299, 'criterion': 'squared_error', 'min_samples_split': 7, 'min_samples_leaf': 10, 'min_weight_fraction_leaf': 0.2140504921240509, 'min_impurity_decrease': 0.04709287874908272, 'max_features': 0.8090174382425608, 'subsample': 0.3496244053902541, 'dropout_rate': 0.598733109164413, 'ccp_alpha': 0.00149540197405156}. Best is trial 187 with value: 0.6933481836305168.[0m
/media/san2_ssd/data/Workdir/survival/venv/lib/python3.8/site-packages/sksurv/ensemble/boosting.py:955: RuntimeWarning: divide by zero encountered in log
  time = numpy.log(time)
/media/san2_ssd/data/Workdir/survival/venv/lib/python3.8/site-packages/sksurv/ensemble/boosting.py:955: RuntimeWarning: divide by zero encountered in log
  time = numpy.log(time)
/media/san2_ssd/data/Workdir/survival/venv/lib/python3.8/site-packages/sksurv/ensemble/boosting.py:955: RuntimeWarning: divide by zero encountered in log
  time = numpy.log(time)
/media/san2_ssd/data/Workdir/survival/venv/lib/python3.8/site-packages/sksurv/ensemble/boosting.py:955: RuntimeWarning: divide by zero encountered in log
  time = numpy.log(time)
[32m[I 2022-04-22 00:12:21,574][0m Trial 568 finished with value: -0.7317286726923086 and parameters: {'loss': 'squared', 'learning_rate': 4.766291856418922e-05, 'n_estimators': 377, 'criterion': 'squared_error', 'min_samples_split': 7, 'min_samples_leaf': 9, 'min_weight_fraction_leaf': 0.2168170150107287, 'min_impurity_decrease': 0.03952113618928903, 'max_features': 0.8128874031418519, 'subsample': 0.24612496032519066, 'dropout_rate': 0.6345704172259935, 'ccp_alpha': 0.0024321468849315547}. Best is trial 187 with value: 0.6933481836305168.[0m
[32m[I 2022-04-22 00:12:32,836][0m Trial 569 finished with value: 0.5 and parameters: {'loss': 'coxph', 'learning_rate': 3.708905552629944e-05, 'n_estimators': 297, 'criterion': 'squared_error', 'min_samples_split': 7, 'min_samples_leaf': 10, 'min_weight_fraction_leaf': 0.22844895854429043, 'min_impurity_decrease': 0.021562602589115375, 'max_features': 0.8096110034849318, 'subsample': 0.43502485007732244, 'dropout_rate': 0.5473603478107391, 'ccp_alpha': 4.006269698159013}. Best is trial 187 with value: 0.6933481836305168.[0m
[32m[I 2022-04-22 00:12:42,316][0m Trial 570 finished with value: 0.6874969106579255 and parameters: {'loss': 'coxph', 'learning_rate': 4.818796170543637e-05, 'n_estimators': 300, 'criterion': 'squared_error', 'min_samples_split': 7, 'min_samples_leaf': 10, 'min_weight_fraction_leaf': 0.2133632383082097, 'min_impurity_decrease': 0.05171543974507165, 'max_features': 0.7516583685453743, 'subsample': 0.37630545363007695, 'dropout_rate': 0.5971893436012959, 'ccp_alpha': 0.0037779168304125366}. Best is trial 187 with value: 0.6933481836305168.[0m
[32m[I 2022-04-22 00:12:55,318][0m Trial 571 finished with value: 0.6901289473869571 and parameters: {'loss': 'coxph', 'learning_rate': 6.019895317358567e-05, 'n_estimators': 285, 'criterion': 'squared_error', 'min_samples_split': 7, 'min_samples_leaf': 10, 'min_weight_fraction_leaf': 0.2128152326231705, 'min_impurity_decrease': 0.0011734439555208184, 'max_features': 0.8386167254266645, 'subsample': 0.35021513013368816, 'dropout_rate': 0.5863221674605985, 'ccp_alpha': 0.07275954611048863}. Best is trial 187 with value: 0.6933481836305168.[0m
[32m[I 2022-04-22 00:13:05,561][0m Trial 572 finished with value: 0.5 and parameters: {'loss': 'coxph', 'learning_rate': 6.212303919906659e-05, 'n_estimators': 277, 'criterion': 'squared_error', 'min_samples_split': 7, 'min_samples_leaf': 9, 'min_weight_fraction_leaf': 0.24253870124702084, 'min_impurity_decrease': 0.00957020391518671, 'max_features': 0.8298165212978301, 'subsample': 0.36166772625616833, 'dropout_rate': 0.5711357980846903, 'ccp_alpha': 2.493532926488584}. Best is trial 187 with value: 0.6933481836305168.[0m
[32m[I 2022-04-22 00:13:16,667][0m Trial 573 finished with value: 0.6879429637020222 and parameters: {'loss': 'coxph', 'learning_rate': 7.405937145150855e-05, 'n_estimators': 284, 'criterion': 'squared_error', 'min_samples_split': 6, 'min_samples_leaf': 10, 'min_weight_fraction_leaf': 0.2225526104826353, 'min_impurity_decrease': 0.0046080472240315334, 'max_features': 0.8291799293235698, 'subsample': 0.3869304811572947, 'dropout_rate': 0.5974383548173634, 'ccp_alpha': 0.0038974313199358207}. Best is trial 187 with value: 0.6933481836305168.[0m
[32m[I 2022-04-22 00:13:24,352][0m Trial 574 finished with value: 0.6858677253457073 and parameters: {'loss': 'coxph', 'learning_rate': 5.160613839215469e-05, 'n_estimators': 272, 'criterion': 'squared_error', 'min_samples_split': 7, 'min_samples_leaf': 8, 'min_weight_fraction_leaf': 0.2330737421968599, 'min_impurity_decrease': 0.0014271518507939507, 'max_features': 0.7837879133625226, 'subsample': 0.3515585296697719, 'dropout_rate': 0.6179102709246489, 'ccp_alpha': 0.10269939778391311}. Best is trial 187 with value: 0.6933481836305168.[0m
[32m[I 2022-04-22 00:13:34,531][0m Trial 575 finished with value: 0.6871108585931438 and parameters: {'loss': 'coxph', 'learning_rate': 4.2089514839692095e-05, 'n_estimators': 293, 'criterion': 'friedman_mse', 'min_samples_split': 7, 'min_samples_leaf': 10, 'min_weight_fraction_leaf': 0.21173933435177786, 'min_impurity_decrease': 0.028828430940891017, 'max_features': 0.7763252281985473, 'subsample': 0.3332574635620589, 'dropout_rate': 0.5949849604160219, 'ccp_alpha': 0.09511789330920838}. Best is trial 187 with value: 0.6933481836305168.[0m
[32m[I 2022-04-22 00:13:44,301][0m Trial 576 finished with value: 0.6840852912190984 and parameters: {'loss': 'coxph', 'learning_rate': 6.581263654675263e-05, 'n_estimators': 284, 'criterion': 'squared_error', 'min_samples_split': 7, 'min_samples_leaf': 10, 'min_weight_fraction_leaf': 0.22234999482810294, 'min_impurity_decrease': 0.02510265623941188, 'max_features': 0.7983192903922238, 'subsample': 0.3572777139413518, 'dropout_rate': 0.5622743888973029, 'ccp_alpha': 0.08812225792740583}. Best is trial 187 with value: 0.6933481836305168.[0m
[32m[I 2022-04-22 00:14:18,972][0m Trial 577 finished with value: 0.668864629214208 and parameters: {'loss': 'coxph', 'learning_rate': 3.6158084229384916e-05, 'n_estimators': 448, 'criterion': 'squared_error', 'min_samples_split': 7, 'min_samples_leaf': 10, 'min_weight_fraction_leaf': 0.21566436895930752, 'min_impurity_decrease': 0.04268221042214512, 'max_features': 0.8439929678989112, 'subsample': 0.2941945171985723, 'dropout_rate': 0.5475565694031105, 'ccp_alpha': 0.2044891325835874}. Best is trial 187 with value: 0.6933481836305168.[0m
[32m[I 2022-04-22 00:14:28,575][0m Trial 578 finished with value: 0.6888376510064151 and parameters: {'loss': 'coxph', 'learning_rate': 5.289369161770342e-05, 'n_estimators': 288, 'criterion': 'squared_error', 'min_samples_split': 7, 'min_samples_leaf': 10, 'min_weight_fraction_leaf': 0.21300423778005906, 'min_impurity_decrease': 0.0200774744971333, 'max_features': 0.8089856234085764, 'subsample': 0.34930429178482947, 'dropout_rate': 0.5622059100997164, 'ccp_alpha': 0.0763275988399329}. Best is trial 187 with value: 0.6933481836305168.[0m
[32m[I 2022-04-22 00:14:35,968][0m Trial 579 finished with value: 0.6824277364411961 and parameters: {'loss': 'coxph', 'learning_rate': 5.323657057310931e-05, 'n_estimators': 269, 'criterion': 'squared_error', 'min_samples_split': 7, 'min_samples_leaf': 10, 'min_weight_fraction_leaf': 0.23220387152378694, 'min_impurity_decrease': 0.004339184497506086, 'max_features': 0.8098240792677105, 'subsample': 0.4035309533219259, 'dropout_rate': 0.585305946183576, 'ccp_alpha': 0.0040986053416169205}. Best is trial 187 with value: 0.6933481836305168.[0m
[32m[I 2022-04-22 00:14:46,661][0m Trial 580 finished with value: 0.6127568729131793 and parameters: {'loss': 'coxph', 'learning_rate': 2.976467781491604e-05, 'n_estimators': 288, 'criterion': 'squared_error', 'min_samples_split': 7, 'min_samples_leaf': 10, 'min_weight_fraction_leaf': 0.21094766969085477, 'min_impurity_decrease': 0.022805358405899888, 'max_features': 0.7912044498232471, 'subsample': 0.40600803768425997, 'dropout_rate': 0.5358859616764412, 'ccp_alpha': 0.350055655917776}. Best is trial 187 with value: 0.6933481836305168.[0m
[32m[I 2022-04-22 00:14:54,934][0m Trial 581 finished with value: 0.6636900948801576 and parameters: {'loss': 'coxph', 'learning_rate': 6.310380126656659e-05, 'n_estimators': 282, 'criterion': 'squared_error', 'min_samples_split': 7, 'min_samples_leaf': 10, 'min_weight_fraction_leaf': 0.24966217408292812, 'min_impurity_decrease': 0.0028767447716516042, 'max_features': 0.7607274752408186, 'subsample': 0.3481792136859375, 'dropout_rate': 0.5792536802526588, 'ccp_alpha': 0.19865105565398594}. Best is trial 187 with value: 0.6933481836305168.[0m
[32m[I 2022-04-22 00:15:05,814][0m Trial 582 finished with value: 0.6841625936731058 and parameters: {'loss': 'coxph', 'learning_rate': 4.311978386948073e-05, 'n_estimators': 300, 'criterion': 'squared_error', 'min_samples_split': 7, 'min_samples_leaf': 10, 'min_weight_fraction_leaf': 0.2235850613807761, 'min_impurity_decrease': 0.030386913857111345, 'max_features': 0.815103089338626, 'subsample': 0.3809673471027996, 'dropout_rate': 0.5670674038103858, 'ccp_alpha': 0.08490043952216442}. Best is trial 187 with value: 0.6933481836305168.[0m
