[32m[I 2022-04-21 11:40:26,566][0m Trial 527 finished with value: 0.5683801958776981 and parameters: {'splitter': 'best', 'min_samples_split': 0.08258793725059127, 'min_samples_leaf': 0.3467151172622779, 'min_weight_fraction_leaf': 0.017686362115264684, 'max_features': 0.6137035258038385}. Best is trial 435 with value: 0.8271205444415821.[0m
/media/san2_ssd/data/Workdir/survival/utils.py:305: RuntimeWarning: invalid value encountered in true_divide
  pdfs = np.gradient(1-survs,axis=1)/norms
/media/san2_ssd/data/Workdir/survival/utils.py:305: RuntimeWarning: invalid value encountered in true_divide
  pdfs = np.gradient(1-survs,axis=1)/norms
[32m[I 2022-04-21 11:40:26,868][0m Trial 528 finished with value: 0.8092427718957783 and parameters: {'splitter': 'best', 'min_samples_split': 0.07039562991515132, 'min_samples_leaf': 0.03429344377627012, 'min_weight_fraction_leaf': 0.009105782957264406, 'max_features': 0.5975768900542513}. Best is trial 435 with value: 0.8271205444415821.[0m
[32m[I 2022-04-21 11:40:27,219][0m Trial 529 finished with value: 0.8096004331960387 and parameters: {'splitter': 'best', 'min_samples_split': 0.08921718559283001, 'min_samples_leaf': 0.022838311247736873, 'min_weight_fraction_leaf': 0.03091415963711663, 'max_features': 0.6280684850447933}. Best is trial 435 with value: 0.8271205444415821.[0m
[32m[I 2022-04-21 11:40:27,530][0m Trial 530 finished with value: 0.8033913670263593 and parameters: {'splitter': 'best', 'min_samples_split': 0.07979452750240768, 'min_samples_leaf': 0.022748145087926313, 'min_weight_fraction_leaf': 0.04992765757353048, 'max_features': 0.6078166712932426}. Best is trial 435 with value: 0.8271205444415821.[0m
[32m[I 2022-04-21 11:40:27,634][0m Trial 531 finished with value: 0.782245173148673 and parameters: {'splitter': 'best', 'min_samples_split': 0.06792619842577716, 'min_samples_leaf': 0.13936156995416976, 'min_weight_fraction_leaf': 0.000664137023471908, 'max_features': 0.31566740452897596}. Best is trial 435 with value: 0.8271205444415821.[0m
[32m[I 2022-04-21 11:40:27,823][0m Trial 532 finished with value: 0.6751313675863264 and parameters: {'splitter': 'best', 'min_samples_split': 0.09089123577321759, 'min_samples_leaf': 0.040461166511563854, 'min_weight_fraction_leaf': 0.266151190956908, 'max_features': 0.6563962839576644}. Best is trial 435 with value: 0.8271205444415821.[0m
[32m[I 2022-04-21 11:40:27,890][0m Trial 533 finished with value: 0.5739247618450222 and parameters: {'splitter': 'random', 'min_samples_split': 0.075980653774113, 'min_samples_leaf': 0.4630337266069885, 'min_weight_fraction_leaf': 0.019838436501387505, 'max_features': 0.572437614336277}. Best is trial 435 with value: 0.8271205444415821.[0m
/media/san2_ssd/data/Workdir/survival/utils.py:305: RuntimeWarning: invalid value encountered in true_divide
  pdfs = np.gradient(1-survs,axis=1)/norms
/media/san2_ssd/data/Workdir/survival/utils.py:305: RuntimeWarning: invalid value encountered in true_divide
  pdfs = np.gradient(1-survs,axis=1)/norms
/media/san2_ssd/data/Workdir/survival/utils.py:305: RuntimeWarning: invalid value encountered in true_divide
  pdfs = np.gradient(1-survs,axis=1)/norms
[32m[I 2022-04-21 11:40:28,289][0m Trial 534 finished with value: 0.8164052901123636 and parameters: {'splitter': 'best', 'min_samples_split': 0.09300579141000186, 'min_samples_leaf': 0.018804795993222774, 'min_weight_fraction_leaf': 0.009197210537896058, 'max_features': 0.5761531704009835}. Best is trial 435 with value: 0.8271205444415821.[0m
[32m[I 2022-04-21 11:40:28,527][0m Trial 535 finished with value: 0.8014939386022736 and parameters: {'splitter': 'best', 'min_samples_split': 0.08214109468564004, 'min_samples_leaf': 0.06113369692087972, 'min_weight_fraction_leaf': 0.022598585851276144, 'max_features': 0.6501769082877322}. Best is trial 435 with value: 0.8271205444415821.[0m
/media/san2_ssd/data/Workdir/survival/utils.py:305: RuntimeWarning: invalid value encountered in true_divide
  pdfs = np.gradient(1-survs,axis=1)/norms
/media/san2_ssd/data/Workdir/survival/utils.py:305: RuntimeWarning: invalid value encountered in true_divide
  pdfs = np.gradient(1-survs,axis=1)/norms
/media/san2_ssd/data/Workdir/survival/utils.py:305: RuntimeWarning: invalid value encountered in true_divide
  pdfs = np.gradient(1-survs,axis=1)/norms
[32m[I 2022-04-21 11:40:28,872][0m Trial 536 finished with value: 0.8150856489461804 and parameters: {'splitter': 'best', 'min_samples_split': 0.06642308025368843, 'min_samples_leaf': 0.029782220171899493, 'min_weight_fraction_leaf': 0.008847227949361016, 'max_features': 0.598473712621805}. Best is trial 435 with value: 0.8271205444415821.[0m
[32m[I 2022-04-21 11:40:29,171][0m Trial 537 finished with value: 0.806350486344788 and parameters: {'splitter': 'best', 'min_samples_split': 0.22798823181425842, 'min_samples_leaf': 0.016694015914429323, 'min_weight_fraction_leaf': 0.04056499329059523, 'max_features': 0.6341283677339021}. Best is trial 435 with value: 0.8271205444415821.[0m
[32m[I 2022-04-21 11:40:29,449][0m Trial 538 finished with value: 0.8078747948136854 and parameters: {'splitter': 'best', 'min_samples_split': 0.09532296914064854, 'min_samples_leaf': 0.04438531234058504, 'min_weight_fraction_leaf': 0.016595817205202378, 'max_features': 0.5816537152116953}. Best is trial 435 with value: 0.8271205444415821.[0m
[32m[I 2022-04-21 11:40:29,523][0m Trial 539 finished with value: 0.45956041267801107 and parameters: {'splitter': 'random', 'min_samples_split': 0.08485476518829427, 'min_samples_leaf': 0.3693783005648945, 'min_weight_fraction_leaf': 0.0008525640570918205, 'max_features': 0.6193024827487333}. Best is trial 435 with value: 0.8271205444415821.[0m
/media/san2_ssd/data/Workdir/survival/utils.py:305: RuntimeWarning: invalid value encountered in true_divide
  pdfs = np.gradient(1-survs,axis=1)/norms
[32m[I 2022-04-21 11:40:29,896][0m Trial 540 finished with value: 0.8087883082353364 and parameters: {'splitter': 'best', 'min_samples_split': 0.06322592913447023, 'min_samples_leaf': 0.03413893425550291, 'min_weight_fraction_leaf': 0.03149978216150792, 'max_features': 0.6807858781355096}. Best is trial 435 with value: 0.8271205444415821.[0m
/media/san2_ssd/data/Workdir/survival/utils.py:305: RuntimeWarning: invalid value encountered in true_divide
  pdfs = np.gradient(1-survs,axis=1)/norms
[32m[I 2022-04-21 11:40:30,494][0m Trial 541 finished with value: 0.8150939766571982 and parameters: {'splitter': 'best', 'min_samples_split': 0.10194577536185727, 'min_samples_leaf': 0.015731137917859843, 'min_weight_fraction_leaf': 0.0001933474787517847, 'max_features': 0.6792919960436932}. Best is trial 435 with value: 0.8271205444415821.[0m
/media/san2_ssd/data/Workdir/survival/utils.py:305: RuntimeWarning: invalid value encountered in true_divide
  pdfs = np.gradient(1-survs,axis=1)/norms
[32m[I 2022-04-21 11:40:30,931][0m Trial 542 finished with value: 0.8099516227130339 and parameters: {'splitter': 'best', 'min_samples_split': 0.07484533953476374, 'min_samples_leaf': 0.027146156170598203, 'min_weight_fraction_leaf': 4.78360964129552e-06, 'max_features': 0.6034513404403237}. Best is trial 435 with value: 0.8271205444415821.[0m
/media/san2_ssd/data/Workdir/survival/utils.py:305: RuntimeWarning: invalid value encountered in true_divide
  pdfs = np.gradient(1-survs,axis=1)/norms
/media/san2_ssd/data/Workdir/survival/utils.py:305: RuntimeWarning: invalid value encountered in true_divide
  pdfs = np.gradient(1-survs,axis=1)/norms
/media/san2_ssd/data/Workdir/survival/utils.py:305: RuntimeWarning: invalid value encountered in true_divide
  pdfs = np.gradient(1-survs,axis=1)/norms
[32m[I 2022-04-21 11:40:31,584][0m Trial 543 finished with value: 0.8126092378288432 and parameters: {'splitter': 'best', 'min_samples_split': 0.09011226904963184, 'min_samples_leaf': 0.012813938232546049, 'min_weight_fraction_leaf': 0.01669658140813229, 'max_features': 0.5806879545719104}. Best is trial 435 with value: 0.8271205444415821.[0m
[32m[I 2022-04-21 11:40:32,018][0m Trial 544 finished with value: 0.8231611711657021 and parameters: {'splitter': 'best', 'min_samples_split': 0.1035689971861627, 'min_samples_leaf': 0.022106066810741586, 'min_weight_fraction_leaf': 0.02633305674573705, 'max_features': 0.5728381167711322}. Best is trial 435 with value: 0.8271205444415821.[0m
[32m[I 2022-04-21 11:40:32,339][0m Trial 545 finished with value: 0.8065130950429639 and parameters: {'splitter': 'best', 'min_samples_split': 0.07965438797578701, 'min_samples_leaf': 0.05391874702590195, 'min_weight_fraction_leaf': 0.03424233369489693, 'max_features': 0.5674848336004944}. Best is trial 435 with value: 0.8271205444415821.[0m
[32m[I 2022-04-21 11:40:32,451][0m Trial 546 finished with value: 0.8154224748197839 and parameters: {'splitter': 'random', 'min_samples_split': 0.09741888480151836, 'min_samples_leaf': 0.042222243858953123, 'min_weight_fraction_leaf': 0.048223607393853826, 'max_features': 0.5779437241001859}. Best is trial 435 with value: 0.8271205444415821.[0m
[32m[I 2022-04-21 11:40:32,907][0m Trial 547 finished with value: 0.8113367864162229 and parameters: {'splitter': 'best', 'min_samples_split': 0.022717825858863158, 'min_samples_leaf': 0.03385929451599969, 'min_weight_fraction_leaf': 0.027179058911713634, 'max_features': 0.6346599982758958}. Best is trial 435 with value: 0.8271205444415821.[0m
[32m[I 2022-04-21 11:40:33,285][0m Trial 548 finished with value: 0.8184975768046725 and parameters: {'splitter': 'best', 'min_samples_split': 0.0874381403023993, 'min_samples_leaf': 0.02497064459727703, 'min_weight_fraction_leaf': 0.009273811204132397, 'max_features': 0.5535533403186652}. Best is trial 435 with value: 0.8271205444415821.[0m
[32m[I 2022-04-21 11:40:33,568][0m Trial 549 finished with value: 0.6912803755316433 and parameters: {'splitter': 'best', 'min_samples_split': 0.06298887468048338, 'min_samples_leaf': 0.18440272996183454, 'min_weight_fraction_leaf': 0.021938775504938852, 'max_features': 0.593164688612178}. Best is trial 435 with value: 0.8271205444415821.[0m
/media/san2_ssd/data/Workdir/survival/utils.py:305: RuntimeWarning: invalid value encountered in true_divide
  pdfs = np.gradient(1-survs,axis=1)/norms
[32m[I 2022-04-21 11:40:34,050][0m Trial 550 finished with value: 0.8001261988000989 and parameters: {'splitter': 'best', 'min_samples_split': 0.07345486316510977, 'min_samples_leaf': 0.033224432650893976, 'min_weight_fraction_leaf': 0.011579273576696407, 'max_features': 0.6033837713558575}. Best is trial 435 with value: 0.8271205444415821.[0m
[32m[I 2022-04-21 11:40:34,637][0m Trial 551 finished with value: 0.8139115690089402 and parameters: {'splitter': 'best', 'min_samples_split': 0.1042891712851479, 'min_samples_leaf': 0.022777968467044503, 'min_weight_fraction_leaf': 0.0002541311341105175, 'max_features': 0.6357711910711189}. Best is trial 435 with value: 0.8271205444415821.[0m
[32m[I 2022-04-21 11:40:34,802][0m Trial 552 finished with value: 0.7016439072786897 and parameters: {'splitter': 'random', 'min_samples_split': 0.4779967940966595, 'min_samples_leaf': 0.045489532570833144, 'min_weight_fraction_leaf': 0.059275357272887214, 'max_features': 0.5574248223207212}. Best is trial 435 with value: 0.8271205444415821.[0m
[32m[I 2022-04-21 11:40:34,992][0m Trial 553 finished with value: 0.6722414496984792 and parameters: {'splitter': 'best', 'min_samples_split': 0.09424907093691118, 'min_samples_leaf': 0.2953227086920898, 'min_weight_fraction_leaf': 0.03814326117271571, 'max_features': 0.608267473311911}. Best is trial 435 with value: 0.8271205444415821.[0m
[32m[I 2022-04-21 11:40:35,532][0m Trial 554 finished with value: 0.8147932221115424 and parameters: {'splitter': 'best', 'min_samples_split': 0.08216033221873771, 'min_samples_leaf': 0.01754645864757934, 'min_weight_fraction_leaf': 0.026518865518994475, 'max_features': 0.5751945612667817}. Best is trial 435 with value: 0.8271205444415821.[0m
[32m[I 2022-04-21 11:40:35,867][0m Trial 555 finished with value: 0.8104003742048839 and parameters: {'splitter': 'best', 'min_samples_split': 0.05893454200699215, 'min_samples_leaf': 0.07273767937112778, 'min_weight_fraction_leaf': 0.009621234112107493, 'max_features': 0.6122943194615384}. Best is trial 435 with value: 0.8271205444415821.[0m
/media/san2_ssd/data/Workdir/survival/utils.py:305: RuntimeWarning: invalid value encountered in true_divide
  pdfs = np.gradient(1-survs,axis=1)/norms
[32m[I 2022-04-21 11:40:36,184][0m Trial 556 finished with value: 0.8153605962459054 and parameters: {'splitter': 'best', 'min_samples_split': 0.10643306111156675, 'min_samples_leaf': 0.027913851026039993, 'min_weight_fraction_leaf': 0.016461610504998673, 'max_features': 0.5411766462673353}. Best is trial 435 with value: 0.8271205444415821.[0m
[32m[I 2022-04-21 11:40:36,361][0m Trial 557 finished with value: 0.8147715674655265 and parameters: {'splitter': 'best', 'min_samples_split': 0.075394144773863, 'min_samples_leaf': 0.03614387132322905, 'min_weight_fraction_leaf': 0.00011991016857476884, 'max_features': 0.2767997901366882}. Best is trial 435 with value: 0.8271205444415821.[0m
[32m[I 2022-04-21 11:40:36,461][0m Trial 558 finished with value: 0.8149225741344038 and parameters: {'splitter': 'random', 'min_samples_split': 0.044478925457991744, 'min_samples_leaf': 0.012789874257195986, 'min_weight_fraction_leaf': 0.022998524912634676, 'max_features': 0.29335339443891534}. Best is trial 435 with value: 0.8271205444415821.[0m
[32m[I 2022-04-21 11:40:36,712][0m Trial 559 finished with value: 0.8085733773883218 and parameters: {'splitter': 'best', 'min_samples_split': 0.08989059833690334, 'min_samples_leaf': 0.05420425857604688, 'min_weight_fraction_leaf': 0.009350718696704438, 'max_features': 0.5882916783554173}. Best is trial 435 with value: 0.8271205444415821.[0m
[32m[I 2022-04-21 11:40:37,133][0m Trial 560 finished with value: 0.8104321410576922 and parameters: {'splitter': 'best', 'min_samples_split': 0.09893493689035156, 'min_samples_leaf': 0.02271268020790673, 'min_weight_fraction_leaf': 0.01687199362842233, 'max_features': 0.6330258504475368}. Best is trial 435 with value: 0.8271205444415821.[0m
[32m[I 2022-04-21 11:40:37,565][0m Trial 561 finished with value: 0.8126864060912501 and parameters: {'splitter': 'best', 'min_samples_split': 0.06937431091225503, 'min_samples_leaf': 0.01014076135226427, 'min_weight_fraction_leaf': 0.032344561952166985, 'max_features': 0.6190534432072505}. Best is trial 435 with value: 0.8271205444415821.[0m
/media/san2_ssd/data/Workdir/survival/utils.py:305: RuntimeWarning: invalid value encountered in true_divide
  pdfs = np.gradient(1-survs,axis=1)/norms
/media/san2_ssd/data/Workdir/survival/utils.py:305: RuntimeWarning: invalid value encountered in true_divide
  pdfs = np.gradient(1-survs,axis=1)/norms
[32m[I 2022-04-21 11:40:38,016][0m Trial 562 finished with value: 0.8056123781171509 and parameters: {'splitter': 'best', 'min_samples_split': 0.05610358252211789, 'min_samples_leaf': 0.018988811395799894, 'min_weight_fraction_leaf': 0.009089193212598821, 'max_features': 0.3312204104855805}. Best is trial 435 with value: 0.8271205444415821.[0m
[32m[I 2022-04-21 11:40:38,437][0m Trial 563 finished with value: 0.8098939337938227 and parameters: {'splitter': 'best', 'min_samples_split': 0.08561388213084056, 'min_samples_leaf': 0.038507449925942724, 'min_weight_fraction_leaf': 0.023585291946361244, 'max_features': 0.30051136869966266}. Best is trial 435 with value: 0.8271205444415821.[0m
[32m[I 2022-04-21 11:40:38,649][0m Trial 564 finished with value: 0.45956041267801107 and parameters: {'splitter': 'random', 'min_samples_split': 0.10564171472135232, 'min_samples_leaf': 0.027311044863299855, 'min_weight_fraction_leaf': 0.36382622946051757, 'max_features': 0.558164825770885}. Best is trial 435 with value: 0.8271205444415821.[0m
[32m[I 2022-04-21 11:40:39,409][0m Trial 565 finished with value: 0.815159541969571 and parameters: {'splitter': 'best', 'min_samples_split': 0.09684316690448774, 'min_samples_leaf': 0.010010225015135599, 'min_weight_fraction_leaf': 0.039833518321372004, 'max_features': 0.6572703427618397}. Best is trial 435 with value: 0.8271205444415821.[0m
/media/san2_ssd/data/Workdir/survival/utils.py:305: RuntimeWarning: invalid value encountered in true_divide
  pdfs = np.gradient(1-survs,axis=1)/norms
[32m[I 2022-04-21 11:40:39,841][0m Trial 566 finished with value: 0.8170797940670624 and parameters: {'splitter': 'best', 'min_samples_split': 0.07797405724892789, 'min_samples_leaf': 0.019778840529837104, 'min_weight_fraction_leaf': 0.009279343683625502, 'max_features': 0.5887181587695026}. Best is trial 435 with value: 0.8271205444415821.[0m
[32m[I 2022-04-21 11:40:40,031][0m Trial 567 finished with value: 0.8032380112024313 and parameters: {'splitter': 'best', 'min_samples_split': 0.0654571218101909, 'min_samples_leaf': 0.041586309664404394, 'min_weight_fraction_leaf': 0.016418833762797055, 'max_features': 0.34716720496089054}. Best is trial 435 with value: 0.8271205444415821.[0m
[32m[I 2022-04-21 11:40:40,166][0m Trial 568 finished with value: 0.5710980350351094 and parameters: {'splitter': 'best', 'min_samples_split': 0.0276334294440993, 'min_samples_leaf': 0.0290293255753184, 'min_weight_fraction_leaf': 0.33179798858105747, 'max_features': 0.4730793876495789}. Best is trial 435 with value: 0.8271205444415821.[0m
[32m[I 2022-04-21 11:40:40,528][0m Trial 569 finished with value: 0.8106648045462295 and parameters: {'splitter': 'best', 'min_samples_split': 0.11084144117486708, 'min_samples_leaf': 0.009875530186590126, 'min_weight_fraction_leaf': 0.027327667256686464, 'max_features': 0.5334651959673841}. Best is trial 435 with value: 0.8271205444415821.[0m
/media/san2_ssd/data/Workdir/survival/utils.py:305: RuntimeWarning: invalid value encountered in true_divide
  pdfs = np.gradient(1-survs,axis=1)/norms
[32m[I 2022-04-21 11:40:40,833][0m Trial 570 finished with value: 0.818648449313167 and parameters: {'splitter': 'best', 'min_samples_split': 0.0878421680991194, 'min_samples_leaf': 0.015518787623727178, 'min_weight_fraction_leaf': 0.0007027562014183496, 'max_features': 0.42337470003863614}. Best is trial 435 with value: 0.8271205444415821.[0m
[32m[I 2022-04-21 11:40:40,931][0m Trial 571 finished with value: 0.8024135165685934 and parameters: {'splitter': 'random', 'min_samples_split': 0.053274190120369824, 'min_samples_leaf': 0.030308647009177882, 'min_weight_fraction_leaf': 0.01753110471623684, 'max_features': 0.3996162552176358}. Best is trial 435 with value: 0.8271205444415821.[0m
/media/san2_ssd/data/Workdir/survival/utils.py:305: RuntimeWarning: invalid value encountered in true_divide
  pdfs = np.gradient(1-survs,axis=1)/norms
/media/san2_ssd/data/Workdir/survival/utils.py:305: RuntimeWarning: invalid value encountered in true_divide
  pdfs = np.gradient(1-survs,axis=1)/norms
[32m[I 2022-04-21 11:40:41,280][0m Trial 572 finished with value: 0.8134717237154045 and parameters: {'splitter': 'best', 'min_samples_split': 0.09891675081130222, 'min_samples_leaf': 0.009850609971724322, 'min_weight_fraction_leaf': 0.0086806887068379, 'max_features': 0.3274726629870159}. Best is trial 435 with value: 0.8271205444415821.[0m
[32m[I 2022-04-21 11:40:41,468][0m Trial 573 finished with value: 0.8046382000920482 and parameters: {'splitter': 'best', 'min_samples_split': 0.07078800024062824, 'min_samples_leaf': 0.04926337121755439, 'min_weight_fraction_leaf': 0.0003598515696829032, 'max_features': 0.4424042843715651}. Best is trial 435 with value: 0.8271205444415821.[0m
[32m[I 2022-04-21 11:40:41,655][0m Trial 574 finished with value: 0.8068696023757294 and parameters: {'splitter': 'best', 'min_samples_split': 0.08191687350951507, 'min_samples_leaf': 0.09327261132469722, 'min_weight_fraction_leaf': 0.026667062813239925, 'max_features': 0.5706986608254169}. Best is trial 435 with value: 0.8271205444415821.[0m
/media/san2_ssd/data/Workdir/survival/utils.py:305: RuntimeWarning: invalid value encountered in true_divide
  pdfs = np.gradient(1-survs,axis=1)/norms
[32m[I 2022-04-21 11:40:41,907][0m Trial 575 finished with value: 0.8093652158859111 and parameters: {'splitter': 'best', 'min_samples_split': 0.10983398110358944, 'min_samples_leaf': 0.020761729868392448, 'min_weight_fraction_leaf': 0.010633214922078093, 'max_features': 0.3495199182309517}. Best is trial 435 with value: 0.8271205444415821.[0m
[32m[I 2022-04-21 11:40:42,159][0m Trial 576 finished with value: 0.8024801134329372 and parameters: {'splitter': 'best', 'min_samples_split': 0.04367216445369635, 'min_samples_leaf': 0.037106547393160993, 'min_weight_fraction_leaf': 0.04370195619159731, 'max_features': 0.3908883509729439}. Best is trial 435 with value: 0.8271205444415821.[0m
[32m[I 2022-04-21 11:40:42,272][0m Trial 577 finished with value: 0.8112596340180822 and parameters: {'splitter': 'random', 'min_samples_split': 0.09228028055453831, 'min_samples_leaf': 0.009828667803981722, 'min_weight_fraction_leaf': 0.017511154403656845, 'max_features': 0.45470904076024427}. Best is trial 435 with value: 0.8271205444415821.[0m
/media/san2_ssd/data/Workdir/survival/utils.py:305: RuntimeWarning: invalid value encountered in true_divide
  pdfs = np.gradient(1-survs,axis=1)/norms
/media/san2_ssd/data/Workdir/survival/utils.py:305: RuntimeWarning: invalid value encountered in true_divide
  pdfs = np.gradient(1-survs,axis=1)/norms
[32m[I 2022-04-21 11:40:42,529][0m Trial 578 finished with value: 0.8208088574756316 and parameters: {'splitter': 'best', 'min_samples_split': 0.06011760591947247, 'min_samples_leaf': 0.02365697476340671, 'min_weight_fraction_leaf': 0.00014920696216202955, 'max_features': 0.3073397880415395}. Best is trial 435 with value: 0.8271205444415821.[0m
