[32m[I 2022-04-22 16:39:56,450][0m Trial 44 finished with value: 0.6840570734426432 and parameters: {'n_hidden': 1024, 'mixture_components': 5, 'use_sparse_layer': False, 'use_batchnorm': False, 'use_dropout': False, 'mlp_size_1': 7, 'mlp_size_2': 0, 'mlp_size_3': 0, 'kernel': 'LogLogistic', 'loss_name': 'NLLLoss'}. Best is trial 33 with value: 0.6976094983213004.[0m
[32m[I 2022-04-22 16:40:52,974][0m Trial 45 finished with value: 0.6673870225004304 and parameters: {'n_hidden': 256, 'mixture_components': 4, 'use_sparse_layer': False, 'use_batchnorm': False, 'use_dropout': False, 'mlp_size_1': 5, 'mlp_size_2': 0, 'mlp_size_3': 0, 'kernel': 'LogLogistic', 'loss_name': 'CensoredNLLLoss'}. Best is trial 33 with value: 0.6976094983213004.[0m
[32m[I 2022-04-22 16:41:32,353][0m Trial 46 finished with value: 0.6563883815164593 and parameters: {'n_hidden': 1024, 'mixture_components': 2, 'use_sparse_layer': False, 'use_batchnorm': False, 'use_dropout': True, 'dropout': 0.6188928670436841, 'mlp_size_1': 6, 'mlp_size_2': 0, 'mlp_size_3': 0, 'kernel': 'LogLogistic', 'loss_name': 'NLLLoss'}. Best is trial 33 with value: 0.6976094983213004.[0m
[32m[I 2022-04-22 16:42:14,743][0m Trial 47 finished with value: 0.6958106386902657 and parameters: {'n_hidden': 512, 'mixture_components': 9, 'use_sparse_layer': True, 'use_sparse_loss': True, 'lmbd': 0.09382608703055037, 'use_batchnorm': False, 'use_dropout': False, 'mlp_size_1': 6, 'mlp_size_2': 0, 'mlp_size_3': 0, 'kernel': 'Logistic', 'loss_name': 'NLLLoss'}. Best is trial 33 with value: 0.6976094983213004.[0m
[32m[I 2022-04-22 16:43:00,750][0m Trial 48 finished with value: 0.6817052285417459 and parameters: {'n_hidden': 512, 'mixture_components': 9, 'use_sparse_layer': True, 'use_sparse_loss': True, 'lmbd': 0.06523394088212434, 'use_batchnorm': False, 'use_dropout': False, 'mlp_size_1': 6, 'mlp_size_2': 0, 'mlp_size_3': 0, 'kernel': 'Logistic', 'loss_name': 'NLLLoss'}. Best is trial 33 with value: 0.6976094983213004.[0m
[32m[I 2022-04-22 16:45:31,249][0m Trial 49 finished with value: 0.6578868766315533 and parameters: {'n_hidden': 512, 'mixture_components': 10, 'use_sparse_layer': True, 'use_sparse_loss': True, 'lmbd': 0.001156392528207034, 'use_batchnorm': True, 'use_dropout': False, 'mlp_size_1': 5, 'mlp_size_2': 0, 'mlp_size_3': 1, 'kernel': 'Logistic', 'loss_name': 'AlternativeNLLLoss'}. Best is trial 33 with value: 0.6976094983213004.[0m
[32m[I 2022-04-22 16:46:12,999][0m Trial 50 finished with value: 0.673343571970022 and parameters: {'n_hidden': 512, 'mixture_components': 8, 'use_sparse_layer': True, 'use_sparse_loss': True, 'lmbd': 0.005107723716426767, 'use_batchnorm': False, 'use_dropout': True, 'dropout': 0.266407252008287, 'mlp_size_1': 6, 'mlp_size_2': 0, 'mlp_size_3': 0, 'kernel': 'Logistic', 'loss_name': 'NLLLoss'}. Best is trial 33 with value: 0.6976094983213004.[0m
[32m[I 2022-04-22 16:47:01,228][0m Trial 51 finished with value: 0.6682578079964376 and parameters: {'n_hidden': 512, 'mixture_components': 9, 'use_sparse_layer': True, 'use_sparse_loss': True, 'lmbd': 3.701995199035948e-05, 'use_batchnorm': False, 'use_dropout': False, 'mlp_size_1': 6, 'mlp_size_2': 0, 'mlp_size_3': 0, 'kernel': 'Logistic', 'loss_name': 'NLLLoss'}. Best is trial 33 with value: 0.6976094983213004.[0m
[32m[I 2022-04-22 16:47:43,219][0m Trial 52 finished with value: 0.6837859852518721 and parameters: {'n_hidden': 128, 'mixture_components': 5, 'use_sparse_layer': True, 'use_sparse_loss': False, 'use_batchnorm': False, 'use_dropout': False, 'mlp_size_1': 4, 'mlp_size_2': 0, 'mlp_size_3': 0, 'kernel': 'Gumbel', 'loss_name': 'NLLLoss'}. Best is trial 33 with value: 0.6976094983213004.[0m
[32m[I 2022-04-22 16:48:31,246][0m Trial 53 finished with value: 0.6323095116251891 and parameters: {'n_hidden': 1024, 'mixture_components': 10, 'use_sparse_layer': False, 'use_batchnorm': False, 'use_dropout': False, 'mlp_size_1': 7, 'mlp_size_2': 0, 'mlp_size_3': 0, 'kernel': 'LogLogistic', 'loss_name': 'NLLLoss'}. Best is trial 33 with value: 0.6976094983213004.[0m
[32m[I 2022-04-22 16:49:14,850][0m Trial 54 finished with value: 0.677717350140096 and parameters: {'n_hidden': 64, 'mixture_components': 3, 'use_sparse_layer': False, 'use_batchnorm': False, 'use_dropout': False, 'mlp_size_1': 3, 'mlp_size_2': 0, 'mlp_size_3': 0, 'kernel': 'Exponential', 'loss_name': 'NLLLoss'}. Best is trial 33 with value: 0.6976094983213004.[0m
[32m[I 2022-04-22 16:49:58,543][0m Trial 55 finished with value: 0.6553714258056649 and parameters: {'n_hidden': 1024, 'mixture_components': 6, 'use_sparse_layer': True, 'use_sparse_loss': True, 'lmbd': 3.3174353632750454e-05, 'use_batchnorm': False, 'use_dropout': False, 'mlp_size_1': 7, 'mlp_size_2': 0, 'mlp_size_3': 0, 'kernel': 'Logistic', 'loss_name': 'NLLLoss'}. Best is trial 33 with value: 0.6976094983213004.[0m
[32m[I 2022-04-22 16:50:43,040][0m Trial 56 finished with value: 0.6826832168711109 and parameters: {'n_hidden': 512, 'mixture_components': 9, 'use_sparse_layer': False, 'use_batchnorm': False, 'use_dropout': False, 'mlp_size_1': 6, 'mlp_size_2': 0, 'mlp_size_3': 0, 'kernel': 'Gumbel', 'loss_name': 'CensoredNLLLoss'}. Best is trial 33 with value: 0.6976094983213004.[0m
[32m[I 2022-04-22 16:51:41,532][0m Trial 57 finished with value: 0.6637545557390921 and parameters: {'n_hidden': 2048, 'mixture_components': 10, 'use_sparse_layer': False, 'use_batchnorm': False, 'use_dropout': False, 'mlp_size_1': 8, 'mlp_size_2': 0, 'mlp_size_3': 0, 'kernel': 'Normal', 'loss_name': 'NLLLoss'}. Best is trial 33 with value: 0.6976094983213004.[0m
[32m[I 2022-04-22 16:52:27,651][0m Trial 58 finished with value: 0.681193092829109 and parameters: {'n_hidden': 1024, 'mixture_components': 3, 'use_sparse_layer': False, 'use_batchnorm': False, 'use_dropout': False, 'mlp_size_1': 7, 'mlp_size_2': 0, 'mlp_size_3': 0, 'kernel': 'LogLogistic', 'loss_name': 'NLLLoss'}. Best is trial 33 with value: 0.6976094983213004.[0m
[32m[I 2022-04-22 16:53:31,617][0m Trial 59 finished with value: 0.6765350690224307 and parameters: {'n_hidden': 1024, 'mixture_components': 7, 'use_sparse_layer': False, 'use_batchnorm': False, 'use_dropout': False, 'mlp_size_1': 7, 'mlp_size_2': 0, 'mlp_size_3': 0, 'kernel': 'Normal', 'loss_name': 'NLLLoss'}. Best is trial 33 with value: 0.6976094983213004.[0m
[32m[I 2022-04-22 16:54:24,248][0m Trial 60 finished with value: 0.6625073085104886 and parameters: {'n_hidden': 256, 'mixture_components': 8, 'use_sparse_layer': True, 'use_sparse_loss': True, 'lmbd': 0.010613926991748197, 'use_batchnorm': False, 'use_dropout': True, 'dropout': 0.6414579536189772, 'mlp_size_1': 5, 'mlp_size_2': 0, 'mlp_size_3': 0, 'kernel': 'Normal', 'loss_name': 'NLLLoss'}. Best is trial 33 with value: 0.6976094983213004.[0m
[32m[I 2022-04-22 16:55:20,013][0m Trial 61 finished with value: 0.6494210080788845 and parameters: {'n_hidden': 1024, 'mixture_components': 3, 'use_sparse_layer': False, 'use_batchnorm': False, 'use_dropout': False, 'mlp_size_1': 7, 'mlp_size_2': 0, 'mlp_size_3': 0, 'kernel': 'Normal', 'loss_name': 'NLLLoss'}. Best is trial 33 with value: 0.6976094983213004.[0m
[32m[I 2022-04-22 16:56:02,187][0m Trial 62 finished with value: 0.6914227538310158 and parameters: {'n_hidden': 1024, 'mixture_components': 2, 'use_sparse_layer': False, 'use_batchnorm': False, 'use_dropout': False, 'mlp_size_1': 7, 'mlp_size_2': 0, 'mlp_size_3': 0, 'kernel': 'Normal', 'loss_name': 'NLLLoss'}. Best is trial 33 with value: 0.6976094983213004.[0m
[32m[I 2022-04-22 16:56:56,595][0m Trial 63 finished with value: 0.6823690573485904 and parameters: {'n_hidden': 1024, 'mixture_components': 2, 'use_sparse_layer': False, 'use_batchnorm': False, 'use_dropout': False, 'mlp_size_1': 7, 'mlp_size_2': 0, 'mlp_size_3': 0, 'kernel': 'Normal', 'loss_name': 'NLLLoss'}. Best is trial 33 with value: 0.6976094983213004.[0m
[32m[I 2022-04-22 16:57:30,284][0m Trial 64 finished with value: 0.6807742671392325 and parameters: {'n_hidden': 1024, 'mixture_components': 1, 'use_sparse_layer': False, 'use_batchnorm': False, 'use_dropout': False, 'mlp_size_1': 7, 'mlp_size_2': 0, 'mlp_size_3': 0, 'kernel': 'Normal', 'loss_name': 'NLLLoss'}. Best is trial 33 with value: 0.6976094983213004.[0m
[32m[I 2022-04-22 16:58:20,185][0m Trial 65 finished with value: 0.6154914032312268 and parameters: {'n_hidden': 1024, 'mixture_components': 2, 'use_sparse_layer': False, 'use_batchnorm': False, 'use_dropout': False, 'mlp_size_1': 7, 'mlp_size_2': 0, 'mlp_size_3': 0, 'kernel': 'Normal', 'loss_name': 'NLLLoss'}. Best is trial 33 with value: 0.6976094983213004.[0m
[32m[I 2022-04-22 16:59:11,836][0m Trial 66 finished with value: 0.6726010527539977 and parameters: {'n_hidden': 32, 'mixture_components': 1, 'use_sparse_layer': False, 'use_batchnorm': False, 'use_dropout': False, 'mlp_size_1': 2, 'mlp_size_2': 0, 'mlp_size_3': 0, 'kernel': 'Logistic', 'loss_name': 'AlternativeNLLLoss'}. Best is trial 33 with value: 0.6976094983213004.[0m
[32m[I 2022-04-22 16:59:56,564][0m Trial 67 finished with value: 0.6866848086122044 and parameters: {'n_hidden': 1024, 'mixture_components': 4, 'use_sparse_layer': False, 'use_batchnorm': False, 'use_dropout': False, 'mlp_size_1': 6, 'mlp_size_2': 1, 'mlp_size_3': 0, 'kernel': 'Normal', 'loss_name': 'NLLLoss'}. Best is trial 33 with value: 0.6976094983213004.[0m
[32m[I 2022-04-22 17:01:21,806][0m Trial 68 finished with value: 0.593161047686904 and parameters: {'n_hidden': 64, 'mixture_components': 2, 'use_sparse_layer': False, 'use_batchnorm': True, 'use_dropout': False, 'mlp_size_1': 3, 'mlp_size_2': 0, 'mlp_size_3': 0, 'kernel': 'Gumbel', 'loss_name': 'NLLLoss'}. Best is trial 33 with value: 0.6976094983213004.[0m
[32m[I 2022-04-22 17:02:01,347][0m Trial 69 finished with value: 0.6937994452909916 and parameters: {'n_hidden': 1024, 'mixture_components': 3, 'use_sparse_layer': False, 'use_batchnorm': False, 'use_dropout': False, 'mlp_size_1': 6, 'mlp_size_2': 0, 'mlp_size_3': 1, 'kernel': 'Normal', 'loss_name': 'NLLLoss'}. Best is trial 33 with value: 0.6976094983213004.[0m
[32m[I 2022-04-22 17:03:00,969][0m Trial 70 finished with value: 0.6835592143720559 and parameters: {'n_hidden': 512, 'mixture_components': 2, 'use_sparse_layer': False, 'use_batchnorm': False, 'use_dropout': False, 'mlp_size_1': 6, 'mlp_size_2': 0, 'mlp_size_3': 0, 'kernel': 'Normal', 'loss_name': 'CensoredNLLLoss'}. Best is trial 33 with value: 0.6976094983213004.[0m
[32m[I 2022-04-22 17:03:50,195][0m Trial 71 finished with value: 0.6782066869153125 and parameters: {'n_hidden': 1024, 'mixture_components': 3, 'use_sparse_layer': False, 'use_batchnorm': False, 'use_dropout': False, 'mlp_size_1': 7, 'mlp_size_2': 0, 'mlp_size_3': 0, 'kernel': 'Normal', 'loss_name': 'NLLLoss'}. Best is trial 33 with value: 0.6976094983213004.[0m
[32m[I 2022-04-22 17:04:39,867][0m Trial 72 finished with value: 0.6702840697849944 and parameters: {'n_hidden': 1024, 'mixture_components': 3, 'use_sparse_layer': False, 'use_batchnorm': False, 'use_dropout': False, 'mlp_size_1': 6, 'mlp_size_2': 0, 'mlp_size_3': 1, 'kernel': 'Normal', 'loss_name': 'NLLLoss'}. Best is trial 33 with value: 0.6976094983213004.[0m
[32m[I 2022-04-22 17:05:23,356][0m Trial 73 finished with value: 0.6753519082350405 and parameters: {'n_hidden': 1024, 'mixture_components': 3, 'use_sparse_layer': False, 'use_batchnorm': False, 'use_dropout': False, 'mlp_size_1': 7, 'mlp_size_2': 0, 'mlp_size_3': 0, 'kernel': 'Normal', 'loss_name': 'NLLLoss'}. Best is trial 33 with value: 0.6976094983213004.[0m
[32m[I 2022-04-22 17:05:58,000][0m Trial 74 finished with value: 0.6752338293388943 and parameters: {'n_hidden': 1024, 'mixture_components': 4, 'use_sparse_layer': False, 'use_batchnorm': False, 'use_dropout': False, 'mlp_size_1': 6, 'mlp_size_2': 0, 'mlp_size_3': 1, 'kernel': 'Exponential', 'loss_name': 'NLLLoss'}. Best is trial 33 with value: 0.6976094983213004.[0m
[32m[I 2022-04-22 17:06:47,413][0m Trial 75 finished with value: 0.6678893453369492 and parameters: {'n_hidden': 128, 'mixture_components': 1, 'use_sparse_layer': False, 'use_batchnorm': False, 'use_dropout': False, 'mlp_size_1': 4, 'mlp_size_2': 0, 'mlp_size_3': 0, 'kernel': 'Normal', 'loss_name': 'NLLLoss'}. Best is trial 33 with value: 0.6976094983213004.[0m
[32m[I 2022-04-22 17:07:26,901][0m Trial 76 finished with value: 0.6561975845487519 and parameters: {'n_hidden': 1024, 'mixture_components': 10, 'use_sparse_layer': False, 'use_batchnorm': False, 'use_dropout': False, 'mlp_size_1': 7, 'mlp_size_2': 0, 'mlp_size_3': 0, 'kernel': 'LogLogistic', 'loss_name': 'NLLLoss'}. Best is trial 33 with value: 0.6976094983213004.[0m
[32m[I 2022-04-22 17:08:18,682][0m Trial 77 finished with value: 0.6123824074790318 and parameters: {'n_hidden': 2048, 'mixture_components': 3, 'use_sparse_layer': True, 'use_sparse_loss': False, 'use_batchnorm': False, 'use_dropout': True, 'dropout': 0.2063607665886213, 'mlp_size_1': 8, 'mlp_size_2': 0, 'mlp_size_3': 0, 'kernel': 'Normal', 'loss_name': 'NLLLoss'}. Best is trial 33 with value: 0.6976094983213004.[0m
[32m[I 2022-04-22 17:09:18,600][0m Trial 78 finished with value: 0.6801722570306408 and parameters: {'n_hidden': 1024, 'mixture_components': 2, 'use_sparse_layer': False, 'use_batchnorm': False, 'use_dropout': False, 'mlp_size_1': 6, 'mlp_size_2': 0, 'mlp_size_3': 1, 'kernel': 'Gumbel', 'loss_name': 'AlternativeNLLLoss'}. Best is trial 33 with value: 0.6976094983213004.[0m
[32m[I 2022-04-22 17:11:01,960][0m Trial 79 finished with value: 0.5778314025357036 and parameters: {'n_hidden': 1024, 'mixture_components': 9, 'use_sparse_layer': False, 'use_batchnorm': True, 'use_dropout': False, 'mlp_size_1': 7, 'mlp_size_2': 0, 'mlp_size_3': 0, 'kernel': 'Normal', 'loss_name': 'NLLLoss'}. Best is trial 33 with value: 0.6976094983213004.[0m
[32m[I 2022-04-22 17:12:00,146][0m Trial 80 finished with value: 0.6681056961857401 and parameters: {'n_hidden': 32, 'mixture_components': 4, 'use_sparse_layer': False, 'use_batchnorm': False, 'use_dropout': False, 'mlp_size_1': 2, 'mlp_size_2': 0, 'mlp_size_3': 0, 'kernel': 'Logistic', 'loss_name': 'NLLLoss'}. Best is trial 33 with value: 0.6976094983213004.[0m
[32m[I 2022-04-22 17:12:46,945][0m Trial 81 finished with value: 0.677890229874942 and parameters: {'n_hidden': 1024, 'mixture_components': 5, 'use_sparse_layer': False, 'use_batchnorm': False, 'use_dropout': False, 'mlp_size_1': 7, 'mlp_size_2': 0, 'mlp_size_3': 0, 'kernel': 'Normal', 'loss_name': 'NLLLoss'}. Best is trial 33 with value: 0.6976094983213004.[0m
[32m[I 2022-04-22 17:13:35,327][0m Trial 82 finished with value: 0.674392162671724 and parameters: {'n_hidden': 1024, 'mixture_components': 3, 'use_sparse_layer': False, 'use_batchnorm': False, 'use_dropout': False, 'mlp_size_1': 7, 'mlp_size_2': 0, 'mlp_size_3': 0, 'kernel': 'Normal', 'loss_name': 'NLLLoss'}. Best is trial 33 with value: 0.6976094983213004.[0m
[32m[I 2022-04-22 17:14:14,438][0m Trial 83 finished with value: 0.6923338572123041 and parameters: {'n_hidden': 1024, 'mixture_components': 3, 'use_sparse_layer': False, 'use_batchnorm': False, 'use_dropout': False, 'mlp_size_1': 6, 'mlp_size_2': 0, 'mlp_size_3': 1, 'kernel': 'Normal', 'loss_name': 'NLLLoss'}. Best is trial 33 with value: 0.6976094983213004.[0m
[32m[I 2022-04-22 17:15:13,716][0m Trial 84 finished with value: 0.6712696583423493 and parameters: {'n_hidden': 1024, 'mixture_components': 2, 'use_sparse_layer': False, 'use_batchnorm': False, 'use_dropout': False, 'mlp_size_1': 6, 'mlp_size_2': 0, 'mlp_size_3': 1, 'kernel': 'Normal', 'loss_name': 'NLLLoss'}. Best is trial 33 with value: 0.6976094983213004.[0m
[32m[I 2022-04-22 17:15:56,954][0m Trial 85 finished with value: 0.679225369263677 and parameters: {'n_hidden': 1024, 'mixture_components': 1, 'use_sparse_layer': False, 'use_batchnorm': False, 'use_dropout': False, 'mlp_size_1': 5, 'mlp_size_2': 0, 'mlp_size_3': 2, 'kernel': 'LogLogistic', 'loss_name': 'NLLLoss'}. Best is trial 33 with value: 0.6976094983213004.[0m
[32m[I 2022-04-22 17:16:48,182][0m Trial 86 finished with value: 0.6507393957698439 and parameters: {'n_hidden': 256, 'mixture_components': 4, 'use_sparse_layer': True, 'use_sparse_loss': True, 'lmbd': 0.00010088014005233946, 'use_batchnorm': False, 'use_dropout': False, 'mlp_size_1': 5, 'mlp_size_2': 0, 'mlp_size_3': 0, 'kernel': 'Normal', 'loss_name': 'NLLLoss'}. Best is trial 33 with value: 0.6976094983213004.[0m
[32m[I 2022-04-22 17:17:44,933][0m Trial 87 finished with value: 0.6777392009060749 and parameters: {'n_hidden': 512, 'mixture_components': 2, 'use_sparse_layer': False, 'use_batchnorm': False, 'use_dropout': False, 'mlp_size_1': 6, 'mlp_size_2': 0, 'mlp_size_3': 0, 'kernel': 'Gumbel', 'loss_name': 'NLLLoss'}. Best is trial 33 with value: 0.6976094983213004.[0m
[32m[I 2022-04-22 17:18:55,151][0m Trial 88 finished with value: 0.6702907053059481 and parameters: {'n_hidden': 1024, 'mixture_components': 10, 'use_sparse_layer': False, 'use_batchnorm': False, 'use_dropout': False, 'mlp_size_1': 6, 'mlp_size_2': 0, 'mlp_size_3': 1, 'kernel': 'Normal', 'loss_name': 'CensoredNLLLoss'}. Best is trial 33 with value: 0.6976094983213004.[0m
[32m[I 2022-04-22 17:19:28,757][0m Trial 89 finished with value: 0.6071896514394162 and parameters: {'n_hidden': 1024, 'mixture_components': 9, 'use_sparse_layer': False, 'use_batchnorm': False, 'use_dropout': True, 'dropout': 0.49807159053373984, 'mlp_size_1': 6, 'mlp_size_2': 0, 'mlp_size_3': 1, 'kernel': 'Exponential', 'loss_name': 'NLLLoss'}. Best is trial 33 with value: 0.6976094983213004.[0m
[32m[I 2022-04-22 17:21:25,046][0m Trial 90 finished with value: 0.655490728320259 and parameters: {'n_hidden': 64, 'mixture_components': 8, 'use_sparse_layer': True, 'use_sparse_loss': False, 'use_batchnorm': True, 'use_dropout': False, 'mlp_size_1': 3, 'mlp_size_2': 0, 'mlp_size_3': 0, 'kernel': 'Logistic', 'loss_name': 'NLLLoss'}. Best is trial 33 with value: 0.6976094983213004.[0m
[32m[I 2022-04-22 17:22:08,408][0m Trial 91 finished with value: 0.6514027061815679 and parameters: {'n_hidden': 1024, 'mixture_components': 3, 'use_sparse_layer': False, 'use_batchnorm': False, 'use_dropout': False, 'mlp_size_1': 7, 'mlp_size_2': 0, 'mlp_size_3': 0, 'kernel': 'Normal', 'loss_name': 'NLLLoss'}. Best is trial 33 with value: 0.6976094983213004.[0m
[32m[I 2022-04-22 17:22:55,818][0m Trial 92 finished with value: 0.6781449655703481 and parameters: {'n_hidden': 1024, 'mixture_components': 3, 'use_sparse_layer': False, 'use_batchnorm': False, 'use_dropout': False, 'mlp_size_1': 7, 'mlp_size_2': 0, 'mlp_size_3': 0, 'kernel': 'Normal', 'loss_name': 'NLLLoss'}. Best is trial 33 with value: 0.6976094983213004.[0m
[32m[I 2022-04-22 17:23:40,641][0m Trial 93 finished with value: 0.6898573322346745 and parameters: {'n_hidden': 1024, 'mixture_components': 4, 'use_sparse_layer': False, 'use_batchnorm': False, 'use_dropout': False, 'mlp_size_1': 7, 'mlp_size_2': 0, 'mlp_size_3': 0, 'kernel': 'Normal', 'loss_name': 'NLLLoss'}. Best is trial 33 with value: 0.6976094983213004.[0m
[32m[I 2022-04-22 17:24:25,099][0m Trial 94 finished with value: 0.6875557069029823 and parameters: {'n_hidden': 1024, 'mixture_components': 4, 'use_sparse_layer': False, 'use_batchnorm': False, 'use_dropout': False, 'mlp_size_1': 7, 'mlp_size_2': 0, 'mlp_size_3': 0, 'kernel': 'Normal', 'loss_name': 'NLLLoss'}. Best is trial 33 with value: 0.6976094983213004.[0m
[32m[I 2022-04-22 17:25:08,021][0m Trial 95 finished with value: 0.6756185075164841 and parameters: {'n_hidden': 1024, 'mixture_components': 4, 'use_sparse_layer': False, 'use_batchnorm': False, 'use_dropout': False, 'mlp_size_1': 7, 'mlp_size_2': 0, 'mlp_size_3': 0, 'kernel': 'Normal', 'loss_name': 'NLLLoss'}. Best is trial 33 with value: 0.6976094983213004.[0m
[32m[I 2022-04-22 17:26:06,076][0m Trial 96 finished with value: 0.6879138460833392 and parameters: {'n_hidden': 128, 'mixture_components': 5, 'use_sparse_layer': False, 'use_batchnorm': False, 'use_dropout': False, 'mlp_size_1': 4, 'mlp_size_2': 0, 'mlp_size_3': 0, 'kernel': 'LogLogistic', 'loss_name': 'AlternativeNLLLoss'}. Best is trial 33 with value: 0.6976094983213004.[0m
[32m[I 2022-04-22 17:26:57,136][0m Trial 97 finished with value: 0.6818640234314214 and parameters: {'n_hidden': 1024, 'mixture_components': 5, 'use_sparse_layer': False, 'use_batchnorm': False, 'use_dropout': False, 'mlp_size_1': 6, 'mlp_size_2': 0, 'mlp_size_3': 1, 'kernel': 'Normal', 'loss_name': 'NLLLoss'}. Best is trial 33 with value: 0.6976094983213004.[0m
[32m[I 2022-04-22 17:27:45,848][0m Trial 98 finished with value: 0.6821611090577228 and parameters: {'n_hidden': 512, 'mixture_components': 3, 'use_sparse_layer': False, 'use_batchnorm': False, 'use_dropout': False, 'mlp_size_1': 6, 'mlp_size_2': 0, 'mlp_size_3': 0, 'kernel': 'Gumbel', 'loss_name': 'NLLLoss'}. Best is trial 33 with value: 0.6976094983213004.[0m
[32m[I 2022-04-22 17:28:34,667][0m Trial 99 finished with value: 0.6748156247498904 and parameters: {'n_hidden': 1024, 'mixture_components': 7, 'use_sparse_layer': True, 'use_sparse_loss': True, 'lmbd': 0.005626413470357001, 'use_batchnorm': False, 'use_dropout': False, 'mlp_size_1': 7, 'mlp_size_2': 0, 'mlp_size_3': 0, 'kernel': 'Normal', 'loss_name': 'NLLLoss'}. Best is trial 33 with value: 0.6976094983213004.[0m
[32m[I 2022-04-22 17:29:21,077][0m Trial 100 finished with value: 0.6733922220978878 and parameters: {'n_hidden': 2048, 'mixture_components': 10, 'use_sparse_layer': False, 'use_batchnorm': False, 'use_dropout': False, 'mlp_size_1': 8, 'mlp_size_2': 0, 'mlp_size_3': 0, 'kernel': 'Logistic', 'loss_name': 'NLLLoss'}. Best is trial 33 with value: 0.6976094983213004.[0m
