[32m[I 2022-04-23 06:10:22,571][0m Trial 964 finished with value: 0.6929383968978288 and parameters: {'n_hidden': 1024, 'mixture_components': 10, 'use_sparse_layer': False, 'use_batchnorm': False, 'use_dropout': False, 'mlp_size_1': 6, 'mlp_size_2': 0, 'mlp_size_3': 1, 'kernel': 'Gumbel', 'loss_name': 'NLLLoss'}. Best is trial 761 with value: 0.7068620691332198.[0m
[32m[I 2022-04-23 06:11:27,143][0m Trial 965 finished with value: 0.6842630367723219 and parameters: {'n_hidden': 1024, 'mixture_components': 9, 'use_sparse_layer': False, 'use_batchnorm': False, 'use_dropout': False, 'mlp_size_1': 6, 'mlp_size_2': 0, 'mlp_size_3': 1, 'kernel': 'Gumbel', 'loss_name': 'CensoredNLLLoss'}. Best is trial 761 with value: 0.7068620691332198.[0m
[32m[I 2022-04-23 06:12:16,059][0m Trial 966 finished with value: 0.690756661139893 and parameters: {'n_hidden': 128, 'mixture_components': 9, 'use_sparse_layer': False, 'use_batchnorm': False, 'use_dropout': False, 'mlp_size_1': 4, 'mlp_size_2': 0, 'mlp_size_3': 0, 'kernel': 'Gumbel', 'loss_name': 'AlternativeNLLLoss'}. Best is trial 761 with value: 0.7068620691332198.[0m
[32m[I 2022-04-23 06:12:49,479][0m Trial 967 finished with value: 0.6717389594761757 and parameters: {'n_hidden': 1024, 'mixture_components': 9, 'use_sparse_layer': False, 'use_batchnorm': False, 'use_dropout': False, 'mlp_size_1': 6, 'mlp_size_2': 0, 'mlp_size_3': 1, 'kernel': 'Gumbel', 'loss_name': 'NLLLoss'}. Best is trial 761 with value: 0.7068620691332198.[0m
[32m[I 2022-04-23 06:13:22,773][0m Trial 968 finished with value: 0.4024678625395307 and parameters: {'n_hidden': 1024, 'mixture_components': 9, 'use_sparse_layer': False, 'use_batchnorm': False, 'use_dropout': True, 'dropout': 0.9513458380103684, 'mlp_size_1': 6, 'mlp_size_2': 0, 'mlp_size_3': 1, 'kernel': 'Gumbel', 'loss_name': 'NLLLoss'}. Best is trial 761 with value: 0.7068620691332198.[0m
[32m[I 2022-04-23 06:14:17,671][0m Trial 969 finished with value: 0.6792393361512022 and parameters: {'n_hidden': 64, 'mixture_components': 9, 'use_sparse_layer': False, 'use_batchnorm': False, 'use_dropout': False, 'mlp_size_1': 3, 'mlp_size_2': 0, 'mlp_size_3': 0, 'kernel': 'Gumbel', 'loss_name': 'AlternativeNLLLoss'}. Best is trial 761 with value: 0.7068620691332198.[0m
[32m[I 2022-04-23 06:14:57,277][0m Trial 970 finished with value: 0.6771368716638383 and parameters: {'n_hidden': 1024, 'mixture_components': 9, 'use_sparse_layer': False, 'use_batchnorm': False, 'use_dropout': False, 'mlp_size_1': 7, 'mlp_size_2': 0, 'mlp_size_3': 0, 'kernel': 'Gumbel', 'loss_name': 'NLLLoss'}. Best is trial 761 with value: 0.7068620691332198.[0m
[32m[I 2022-04-23 06:15:50,465][0m Trial 971 finished with value: 0.6720401037428589 and parameters: {'n_hidden': 1024, 'mixture_components': 9, 'use_sparse_layer': False, 'use_batchnorm': False, 'use_dropout': False, 'mlp_size_1': 6, 'mlp_size_2': 0, 'mlp_size_3': 1, 'kernel': 'Gumbel', 'loss_name': 'CensoredNLLLoss'}. Best is trial 761 with value: 0.7068620691332198.[0m
[32m[I 2022-04-23 06:16:46,334][0m Trial 972 finished with value: 0.2570534026230458 and parameters: {'n_hidden': 1024, 'mixture_components': 9, 'use_sparse_layer': False, 'use_batchnorm': True, 'use_dropout': False, 'mlp_size_1': 6, 'mlp_size_2': 0, 'mlp_size_3': 1, 'kernel': 'Gumbel', 'loss_name': 'NLLLoss'}. Best is trial 761 with value: 0.7068620691332198.[0m
[32m[I 2022-04-23 06:17:37,890][0m Trial 973 finished with value: 0.6931585688760123 and parameters: {'n_hidden': 2048, 'mixture_components': 6, 'use_sparse_layer': False, 'use_batchnorm': False, 'use_dropout': False, 'mlp_size_1': 5, 'mlp_size_2': 1, 'mlp_size_3': 1, 'kernel': 'Gumbel', 'loss_name': 'AlternativeNLLLoss'}. Best is trial 761 with value: 0.7068620691332198.[0m
[32m[I 2022-04-23 06:18:36,265][0m Trial 974 finished with value: 0.68258334224571 and parameters: {'n_hidden': 256, 'mixture_components': 9, 'use_sparse_layer': False, 'use_batchnorm': False, 'use_dropout': False, 'mlp_size_1': 5, 'mlp_size_2': 0, 'mlp_size_3': 0, 'kernel': 'Logistic', 'loss_name': 'NLLLoss'}. Best is trial 761 with value: 0.7068620691332198.[0m
[32m[I 2022-04-23 06:19:24,004][0m Trial 975 finished with value: 0.6433891916056435 and parameters: {'n_hidden': 1024, 'mixture_components': 10, 'use_sparse_layer': False, 'use_batchnorm': False, 'use_dropout': False, 'mlp_size_1': 7, 'mlp_size_2': 0, 'mlp_size_3': 0, 'kernel': 'Logistic', 'loss_name': 'AlternativeNLLLoss'}. Best is trial 761 with value: 0.7068620691332198.[0m
[32m[I 2022-04-23 06:19:59,325][0m Trial 976 finished with value: 0.6742699635095888 and parameters: {'n_hidden': 1024, 'mixture_components': 9, 'use_sparse_layer': False, 'use_batchnorm': False, 'use_dropout': False, 'mlp_size_1': 6, 'mlp_size_2': 0, 'mlp_size_3': 1, 'kernel': 'Gumbel', 'loss_name': 'NLLLoss'}. Best is trial 761 with value: 0.7068620691332198.[0m
[32m[I 2022-04-23 06:20:46,684][0m Trial 977 finished with value: 0.670526237036518 and parameters: {'n_hidden': 1024, 'mixture_components': 2, 'use_sparse_layer': False, 'use_batchnorm': False, 'use_dropout': False, 'mlp_size_1': 6, 'mlp_size_2': 0, 'mlp_size_3': 1, 'kernel': 'Normal', 'loss_name': 'NLLLoss'}. Best is trial 761 with value: 0.7068620691332198.[0m
[32m[I 2022-04-23 06:21:32,847][0m Trial 978 finished with value: 0.6766731343708512 and parameters: {'n_hidden': 1024, 'mixture_components': 1, 'use_sparse_layer': False, 'use_batchnorm': False, 'use_dropout': False, 'mlp_size_1': 6, 'mlp_size_2': 0, 'mlp_size_3': 1, 'kernel': 'Logistic', 'loss_name': 'CensoredNLLLoss'}. Best is trial 761 with value: 0.7068620691332198.[0m
[32m[I 2022-04-23 06:22:25,780][0m Trial 979 finished with value: 0.6904013554455852 and parameters: {'n_hidden': 1024, 'mixture_components': 9, 'use_sparse_layer': False, 'use_batchnorm': False, 'use_dropout': False, 'mlp_size_1': 7, 'mlp_size_2': 0, 'mlp_size_3': 0, 'kernel': 'Logistic', 'loss_name': 'AlternativeNLLLoss'}. Best is trial 761 with value: 0.7068620691332198.[0m
[32m[I 2022-04-23 06:23:12,240][0m Trial 980 finished with value: 0.6929679585263455 and parameters: {'n_hidden': 1024, 'mixture_components': 4, 'use_sparse_layer': False, 'use_batchnorm': False, 'use_dropout': False, 'mlp_size_1': 6, 'mlp_size_2': 0, 'mlp_size_3': 1, 'kernel': 'Gumbel', 'loss_name': 'NLLLoss'}. Best is trial 761 with value: 0.7068620691332198.[0m
[32m[I 2022-04-23 06:23:59,492][0m Trial 981 finished with value: 0.6969959532395281 and parameters: {'n_hidden': 1024, 'mixture_components': 3, 'use_sparse_layer': False, 'use_batchnorm': False, 'use_dropout': False, 'mlp_size_1': 6, 'mlp_size_2': 0, 'mlp_size_3': 1, 'kernel': 'Normal', 'loss_name': 'NLLLoss'}. Best is trial 761 with value: 0.7068620691332198.[0m
[32m[I 2022-04-23 06:24:45,327][0m Trial 982 finished with value: 0.6944095035473763 and parameters: {'n_hidden': 1024, 'mixture_components': 3, 'use_sparse_layer': False, 'use_batchnorm': False, 'use_dropout': False, 'mlp_size_1': 7, 'mlp_size_2': 0, 'mlp_size_3': 0, 'kernel': 'Normal', 'loss_name': 'NLLLoss'}. Best is trial 761 with value: 0.7068620691332198.[0m
[32m[I 2022-04-23 06:25:51,976][0m Trial 983 finished with value: 0.6694126348040516 and parameters: {'n_hidden': 2048, 'mixture_components': 3, 'use_sparse_layer': False, 'use_batchnorm': False, 'use_dropout': False, 'mlp_size_1': 8, 'mlp_size_2': 0, 'mlp_size_3': 0, 'kernel': 'Normal', 'loss_name': 'NLLLoss'}. Best is trial 761 with value: 0.7068620691332198.[0m
[32m[I 2022-04-23 06:26:30,255][0m Trial 984 finished with value: 0.611875728095248 and parameters: {'n_hidden': 1024, 'mixture_components': 3, 'use_sparse_layer': False, 'use_batchnorm': False, 'use_dropout': False, 'mlp_size_1': 6, 'mlp_size_2': 0, 'mlp_size_3': 1, 'kernel': 'Normal', 'loss_name': 'NLLLoss'}. Best is trial 761 with value: 0.7068620691332198.[0m
[32m[I 2022-04-23 06:27:21,960][0m Trial 985 finished with value: 0.6753568880335096 and parameters: {'n_hidden': 32, 'mixture_components': 3, 'use_sparse_layer': False, 'use_batchnorm': False, 'use_dropout': False, 'mlp_size_1': 2, 'mlp_size_2': 0, 'mlp_size_3': 0, 'kernel': 'Normal', 'loss_name': 'NLLLoss'}. Best is trial 761 with value: 0.7068620691332198.[0m
[32m[I 2022-04-23 06:28:02,210][0m Trial 986 finished with value: 0.6767542430532654 and parameters: {'n_hidden': 1024, 'mixture_components': 3, 'use_sparse_layer': False, 'use_batchnorm': False, 'use_dropout': True, 'dropout': 0.6043588013049204, 'mlp_size_1': 6, 'mlp_size_2': 0, 'mlp_size_3': 1, 'kernel': 'Normal', 'loss_name': 'NLLLoss'}. Best is trial 761 with value: 0.7068620691332198.[0m
[32m[I 2022-04-23 06:28:52,696][0m Trial 987 finished with value: 0.674793739384038 and parameters: {'n_hidden': 1024, 'mixture_components': 3, 'use_sparse_layer': False, 'use_batchnorm': False, 'use_dropout': False, 'mlp_size_1': 6, 'mlp_size_2': 0, 'mlp_size_3': 1, 'kernel': 'Normal', 'loss_name': 'NLLLoss'}. Best is trial 761 with value: 0.7068620691332198.[0m
[32m[I 2022-04-23 06:29:33,043][0m Trial 988 finished with value: 0.6742249155592529 and parameters: {'n_hidden': 1024, 'mixture_components': 3, 'use_sparse_layer': False, 'use_batchnorm': False, 'use_dropout': False, 'mlp_size_1': 6, 'mlp_size_2': 0, 'mlp_size_3': 1, 'kernel': 'Normal', 'loss_name': 'NLLLoss'}. Best is trial 761 with value: 0.7068620691332198.[0m
[32m[I 2022-04-23 06:30:13,480][0m Trial 989 finished with value: 0.6907254337123458 and parameters: {'n_hidden': 1024, 'mixture_components': 2, 'use_sparse_layer': False, 'use_batchnorm': False, 'use_dropout': False, 'mlp_size_1': 6, 'mlp_size_2': 0, 'mlp_size_3': 1, 'kernel': 'Normal', 'loss_name': 'NLLLoss'}. Best is trial 761 with value: 0.7068620691332198.[0m
[32m[I 2022-04-23 06:30:55,919][0m Trial 990 finished with value: 0.6983849832958159 and parameters: {'n_hidden': 1024, 'mixture_components': 3, 'use_sparse_layer': False, 'use_batchnorm': False, 'use_dropout': False, 'mlp_size_1': 6, 'mlp_size_2': 0, 'mlp_size_3': 1, 'kernel': 'Normal', 'loss_name': 'NLLLoss'}. Best is trial 761 with value: 0.7068620691332198.[0m
[32m[I 2022-04-23 06:31:38,180][0m Trial 991 finished with value: 0.6812006460752924 and parameters: {'n_hidden': 1024, 'mixture_components': 3, 'use_sparse_layer': False, 'use_batchnorm': False, 'use_dropout': False, 'mlp_size_1': 6, 'mlp_size_2': 0, 'mlp_size_3': 1, 'kernel': 'Normal', 'loss_name': 'NLLLoss'}. Best is trial 761 with value: 0.7068620691332198.[0m
[32m[I 2022-04-23 06:33:25,254][0m Trial 992 finished with value: 0.6653848882065884 and parameters: {'n_hidden': 1024, 'mixture_components': 3, 'use_sparse_layer': False, 'use_batchnorm': True, 'use_dropout': False, 'mlp_size_1': 6, 'mlp_size_2': 0, 'mlp_size_3': 1, 'kernel': 'Normal', 'loss_name': 'NLLLoss'}. Best is trial 761 with value: 0.7068620691332198.[0m
[32m[I 2022-04-23 06:34:20,076][0m Trial 993 finished with value: 0.6889749836397556 and parameters: {'n_hidden': 2048, 'mixture_components': 3, 'use_sparse_layer': False, 'use_batchnorm': False, 'use_dropout': False, 'mlp_size_1': 8, 'mlp_size_2': 0, 'mlp_size_3': 0, 'kernel': 'Normal', 'loss_name': 'NLLLoss'}. Best is trial 761 with value: 0.7068620691332198.[0m
[32m[I 2022-04-23 06:35:09,979][0m Trial 994 finished with value: 0.676696799387175 and parameters: {'n_hidden': 128, 'mixture_components': 3, 'use_sparse_layer': False, 'use_batchnorm': False, 'use_dropout': False, 'mlp_size_1': 4, 'mlp_size_2': 0, 'mlp_size_3': 0, 'kernel': 'Normal', 'loss_name': 'NLLLoss'}. Best is trial 761 with value: 0.7068620691332198.[0m
[32m[I 2022-04-23 06:35:51,829][0m Trial 995 finished with value: 0.6912953828136705 and parameters: {'n_hidden': 1024, 'mixture_components': 3, 'use_sparse_layer': False, 'use_batchnorm': False, 'use_dropout': False, 'mlp_size_1': 6, 'mlp_size_2': 0, 'mlp_size_3': 1, 'kernel': 'Normal', 'loss_name': 'NLLLoss'}. Best is trial 761 with value: 0.7068620691332198.[0m
[32m[I 2022-04-23 06:36:29,766][0m Trial 996 finished with value: 0.6714768355342681 and parameters: {'n_hidden': 1024, 'mixture_components': 3, 'use_sparse_layer': False, 'use_batchnorm': False, 'use_dropout': False, 'mlp_size_1': 6, 'mlp_size_2': 0, 'mlp_size_3': 1, 'kernel': 'Normal', 'loss_name': 'NLLLoss'}. Best is trial 761 with value: 0.7068620691332198.[0m
[32m[I 2022-04-23 06:37:18,157][0m Trial 997 finished with value: 0.6476176921613913 and parameters: {'n_hidden': 1024, 'mixture_components': 3, 'use_sparse_layer': False, 'use_batchnorm': False, 'use_dropout': False, 'mlp_size_1': 7, 'mlp_size_2': 0, 'mlp_size_3': 0, 'kernel': 'Normal', 'loss_name': 'NLLLoss'}. Best is trial 761 with value: 0.7068620691332198.[0m
[32m[I 2022-04-23 06:38:08,806][0m Trial 998 finished with value: 0.683515070046379 and parameters: {'n_hidden': 64, 'mixture_components': 3, 'use_sparse_layer': False, 'use_batchnorm': False, 'use_dropout': False, 'mlp_size_1': 3, 'mlp_size_2': 0, 'mlp_size_3': 0, 'kernel': 'Normal', 'loss_name': 'NLLLoss'}. Best is trial 761 with value: 0.7068620691332198.[0m
[32m[I 2022-04-23 06:38:51,862][0m Trial 999 finished with value: 0.6442839941664995 and parameters: {'n_hidden': 1024, 'mixture_components': 3, 'use_sparse_layer': False, 'use_batchnorm': False, 'use_dropout': False, 'mlp_size_1': 6, 'mlp_size_2': 0, 'mlp_size_3': 1, 'kernel': 'Normal', 'loss_name': 'NLLLoss'}. Best is trial 761 with value: 0.7068620691332198.[0m
Running Optimizer with LogRank binary scoring
{'n_hidden': 2048, 'mixture_components': 3, 'use_sparse_layer': False, 'use_batchnorm': False, 'use_dropout': False, 'mlp_size_1': 7, 'mlp_size_2': 1, 'mlp_size_3': 0, 'kernel': 'LogLogistic', 'loss_name': 'CensoredNLLLoss', 'UnoC_LR': 0.8545388812039783}
Running Optimizer normaly
{'n_hidden': 1024, 'mixture_components': 8, 'use_sparse_layer': False, 'use_batchnorm': False, 'use_dropout': False, 'mlp_size_1': 6, 'mlp_size_2': 0, 'mlp_size_3': 1, 'kernel': 'Logistic', 'loss_name': 'AlternativeNLLLoss', 'UnoC': 0.7068620691332198}
