[32m[I 2022-04-21 11:43:34,751][0m Trial 963 finished with value: 0.808506232607541 and parameters: {'splitter': 'best', 'min_samples_split': 0.11226498073660311, 'min_samples_leaf': 0.043893513867657885, 'min_weight_fraction_leaf': 0.022370436001639432, 'max_features': 0.39142356753526336}. Best is trial 691 with value: 0.8340697555858835.[0m
[32m[I 2022-04-21 11:43:34,937][0m Trial 964 finished with value: 0.820722632705308 and parameters: {'splitter': 'random', 'min_samples_split': 0.06429920220027129, 'min_samples_leaf': 0.001332690531967294, 'min_weight_fraction_leaf': 0.03672751171824757, 'max_features': 0.6253305061250837}. Best is trial 691 with value: 0.8340697555858835.[0m
[32m[I 2022-04-21 11:43:35,139][0m Trial 965 finished with value: 0.6776753578341366 and parameters: {'splitter': 'best', 'min_samples_split': 0.12708882216994333, 'min_samples_leaf': 0.01918909476362276, 'min_weight_fraction_leaf': 0.27741467874391407, 'max_features': 0.5834426874972873}. Best is trial 691 with value: 0.8340697555858835.[0m
[32m[I 2022-04-21 11:43:35,370][0m Trial 966 finished with value: 0.8072419097987013 and parameters: {'splitter': 'best', 'min_samples_split': 0.15469674094883082, 'min_samples_leaf': 0.03276134174298887, 'min_weight_fraction_leaf': 0.0005381543609859414, 'max_features': 0.3283585817765427}. Best is trial 691 with value: 0.8340697555858835.[0m
[32m[I 2022-04-21 11:43:35,840][0m Trial 967 finished with value: 0.8116232316786476 and parameters: {'splitter': 'best', 'min_samples_split': 0.09395024230697846, 'min_samples_leaf': 0.017398996469164756, 'min_weight_fraction_leaf': 0.013956141191687428, 'max_features': 0.3519546713979587}. Best is trial 691 with value: 0.8340697555858835.[0m
[32m[I 2022-04-21 11:43:36,356][0m Trial 968 finished with value: 0.81189375171862 and parameters: {'splitter': 'best', 'min_samples_split': 0.10933513871011491, 'min_samples_leaf': 0.02516422167119956, 'min_weight_fraction_leaf': 0.008408417840634654, 'max_features': 0.43641348583559}. Best is trial 691 with value: 0.8340697555858835.[0m
[32m[I 2022-04-21 11:43:36,655][0m Trial 969 finished with value: 0.6882582335121891 and parameters: {'splitter': 'best', 'min_samples_split': 0.13536835191797988, 'min_samples_leaf': 0.009452101842429877, 'min_weight_fraction_leaf': 0.2331958092851018, 'max_features': 0.6801454975776184}. Best is trial 691 with value: 0.8340697555858835.[0m
[32m[I 2022-04-21 11:43:36,905][0m Trial 970 finished with value: 0.801025848841428 and parameters: {'splitter': 'best', 'min_samples_split': 0.07632556677791469, 'min_samples_leaf': 0.05527669922693384, 'min_weight_fraction_leaf': 2.4830995686753524e-05, 'max_features': 0.4681987586083704}. Best is trial 691 with value: 0.8340697555858835.[0m
[32m[I 2022-04-21 11:43:37,033][0m Trial 971 finished with value: 0.7776674402774608 and parameters: {'splitter': 'best', 'min_samples_split': 0.12055891575433053, 'min_samples_leaf': 0.16876590790498938, 'min_weight_fraction_leaf': 7.875791323676223e-05, 'max_features': 0.4108928216404033}. Best is trial 691 with value: 0.8340697555858835.[0m
[32m[I 2022-04-21 11:43:37,444][0m Trial 972 finished with value: 0.8047777764450176 and parameters: {'splitter': 'best', 'min_samples_split': 0.09804366220259957, 'min_samples_leaf': 0.010096470693511207, 'min_weight_fraction_leaf': 0.02106790924909885, 'max_features': 0.5612781033453162}. Best is trial 691 with value: 0.8340697555858835.[0m
[32m[I 2022-04-21 11:43:37,734][0m Trial 973 finished with value: 0.8060211855487951 and parameters: {'splitter': 'best', 'min_samples_split': 0.08731325905734014, 'min_samples_leaf': 0.036442009064561444, 'min_weight_fraction_leaf': 0.03304115403860724, 'max_features': 0.5994417278836823}. Best is trial 691 with value: 0.8340697555858835.[0m
/media/san2_ssd/data/Workdir/survival/utils.py:305: RuntimeWarning: invalid value encountered in true_divide
  pdfs = np.gradient(1-survs,axis=1)/norms
[32m[I 2022-04-21 11:43:38,211][0m Trial 974 finished with value: 0.8252858096130193 and parameters: {'splitter': 'best', 'min_samples_split': 0.1411134257120893, 'min_samples_leaf': 0.023565228803263227, 'min_weight_fraction_leaf': 0.013199640625477842, 'max_features': 0.5138345321682813}. Best is trial 691 with value: 0.8340697555858835.[0m
[32m[I 2022-04-21 11:43:38,757][0m Trial 975 finished with value: 0.8131910053456061 and parameters: {'splitter': 'best', 'min_samples_split': 0.13640976844050934, 'min_samples_leaf': 0.04900187233802913, 'min_weight_fraction_leaf': 0.05649158053100071, 'max_features': 0.5175353801970474}. Best is trial 691 with value: 0.8340697555858835.[0m
[32m[I 2022-04-21 11:43:39,000][0m Trial 976 finished with value: 0.7981059344586583 and parameters: {'splitter': 'random', 'min_samples_split': 0.12543069940946827, 'min_samples_leaf': 0.04324789147649869, 'min_weight_fraction_leaf': 0.04159948866072388, 'max_features': 0.5226422178676347}. Best is trial 691 with value: 0.8340697555858835.[0m
[32m[I 2022-04-21 11:43:39,467][0m Trial 977 finished with value: 0.8147143708719531 and parameters: {'splitter': 'best', 'min_samples_split': 0.10901459777101931, 'min_samples_leaf': 0.03149791135226681, 'min_weight_fraction_leaf': 0.02473747801379435, 'max_features': 0.4964824665663462}. Best is trial 691 with value: 0.8340697555858835.[0m
[32m[I 2022-04-21 11:43:39,876][0m Trial 978 finished with value: 0.807505678333958 and parameters: {'splitter': 'best', 'min_samples_split': 0.12023704471231197, 'min_samples_leaf': 0.03892222797053207, 'min_weight_fraction_leaf': 0.015989590648895907, 'max_features': 0.5321285765630688}. Best is trial 691 with value: 0.8340697555858835.[0m
[32m[I 2022-04-21 11:43:40,473][0m Trial 979 finished with value: 0.8082488259468846 and parameters: {'splitter': 'best', 'min_samples_split': 0.14281154173019814, 'min_samples_leaf': 0.027680401856111918, 'min_weight_fraction_leaf': 0.03018133398816622, 'max_features': 0.5084381605612878}. Best is trial 691 with value: 0.8340697555858835.[0m
/media/san2_ssd/data/Workdir/survival/utils.py:305: RuntimeWarning: invalid value encountered in true_divide
  pdfs = np.gradient(1-survs,axis=1)/norms
/media/san2_ssd/data/Workdir/survival/utils.py:305: RuntimeWarning: invalid value encountered in true_divide
  pdfs = np.gradient(1-survs,axis=1)/norms
[32m[I 2022-04-21 11:43:41,263][0m Trial 980 finished with value: 0.816851843704096 and parameters: {'splitter': 'best', 'min_samples_split': 0.12744339191535467, 'min_samples_leaf': 0.025481711626627518, 'min_weight_fraction_leaf': 0.016980449512492647, 'max_features': 0.503058461359471}. Best is trial 691 with value: 0.8340697555858835.[0m
[32m[I 2022-04-21 11:43:41,576][0m Trial 981 finished with value: 0.8056489497555429 and parameters: {'splitter': 'best', 'min_samples_split': 0.10583512447364378, 'min_samples_leaf': 0.03498116836162177, 'min_weight_fraction_leaf': 0.07420519601562234, 'max_features': 0.5373718074547568}. Best is trial 691 with value: 0.8340697555858835.[0m
[32m[I 2022-04-21 11:43:42,001][0m Trial 982 finished with value: 0.8181889927591179 and parameters: {'splitter': 'best', 'min_samples_split': 0.066754290287634, 'min_samples_leaf': 0.04843977604753899, 'min_weight_fraction_leaf': 0.0002035534764670572, 'max_features': 0.4721785226801112}. Best is trial 691 with value: 0.8340697555858835.[0m
[32m[I 2022-04-21 11:43:42,410][0m Trial 983 finished with value: 0.8168347416639768 and parameters: {'splitter': 'best', 'min_samples_split': 0.2825624991623214, 'min_samples_leaf': 0.02344998191172233, 'min_weight_fraction_leaf': 0.016499970424105517, 'max_features': 0.553238435039127}. Best is trial 691 with value: 0.8340697555858835.[0m
/media/san2_ssd/data/Workdir/survival/utils.py:305: RuntimeWarning: invalid value encountered in true_divide
  pdfs = np.gradient(1-survs,axis=1)/norms
/media/san2_ssd/data/Workdir/survival/utils.py:305: RuntimeWarning: invalid value encountered in true_divide
  pdfs = np.gradient(1-survs,axis=1)/norms
/media/san2_ssd/data/Workdir/survival/utils.py:305: RuntimeWarning: invalid value encountered in true_divide
  pdfs = np.gradient(1-survs,axis=1)/norms
/media/san2_ssd/data/Workdir/survival/utils.py:305: RuntimeWarning: invalid value encountered in true_divide
  pdfs = np.gradient(1-survs,axis=1)/norms
/media/san2_ssd/data/Workdir/survival/utils.py:305: RuntimeWarning: invalid value encountered in true_divide
  pdfs = np.gradient(1-survs,axis=1)/norms
[32m[I 2022-04-21 11:43:43,339][0m Trial 984 finished with value: 0.8136966787152613 and parameters: {'splitter': 'best', 'min_samples_split': 0.002730039103999743, 'min_samples_leaf': 0.021870042935340103, 'min_weight_fraction_leaf': 0.0093858529198857, 'max_features': 0.7437155469488013}. Best is trial 691 with value: 0.8340697555858835.[0m
[32m[I 2022-04-21 11:43:43,661][0m Trial 985 finished with value: 0.7991703416876712 and parameters: {'splitter': 'best', 'min_samples_split': 0.11647909512354021, 'min_samples_leaf': 0.07316210720019502, 'min_weight_fraction_leaf': 0.02742073807662593, 'max_features': 0.8960904443319915}. Best is trial 691 with value: 0.8340697555858835.[0m
[32m[I 2022-04-21 11:43:43,957][0m Trial 986 finished with value: 0.808651661992051 and parameters: {'splitter': 'best', 'min_samples_split': 0.08449351237922059, 'min_samples_leaf': 0.03701368374037267, 'min_weight_fraction_leaf': 0.036842007378955224, 'max_features': 0.4857743166831418}. Best is trial 691 with value: 0.8340697555858835.[0m
[32m[I 2022-04-21 11:43:44,065][0m Trial 987 finished with value: 0.8010756809466741 and parameters: {'splitter': 'random', 'min_samples_split': 0.09807885141784524, 'min_samples_leaf': 0.018095789628680387, 'min_weight_fraction_leaf': 0.008801507473515508, 'max_features': 0.5399494543488774}. Best is trial 691 with value: 0.8340697555858835.[0m
[32m[I 2022-04-21 11:43:44,297][0m Trial 988 finished with value: 0.8066327644288694 and parameters: {'splitter': 'best', 'min_samples_split': 0.13299796843867276, 'min_samples_leaf': 0.056173275689409684, 'min_weight_fraction_leaf': 0.021647916379956146, 'max_features': 0.5259581609688658}. Best is trial 691 with value: 0.8340697555858835.[0m
[32m[I 2022-04-21 11:43:44,582][0m Trial 989 finished with value: 0.8083062768303607 and parameters: {'splitter': 'best', 'min_samples_split': 0.10710679016104689, 'min_samples_leaf': 0.028397277823843443, 'min_weight_fraction_leaf': 0.04767068015635261, 'max_features': 0.4874259279573308}. Best is trial 691 with value: 0.8340697555858835.[0m
[32m[I 2022-04-21 11:43:44,686][0m Trial 990 finished with value: 0.6668809372549611 and parameters: {'splitter': 'best', 'min_samples_split': 0.07819772675669176, 'min_samples_leaf': 0.2702915964250346, 'min_weight_fraction_leaf': 0.10531211434259052, 'max_features': 0.5718159733157855}. Best is trial 691 with value: 0.8340697555858835.[0m
[32m[I 2022-04-21 11:43:45,036][0m Trial 991 finished with value: 0.8095209616982654 and parameters: {'splitter': 'best', 'min_samples_split': 0.14242505731445773, 'min_samples_leaf': 0.01694540186531588, 'min_weight_fraction_leaf': 0.015805914332805183, 'max_features': 0.5101977939502418}. Best is trial 691 with value: 0.8340697555858835.[0m
[32m[I 2022-04-21 11:43:45,265][0m Trial 992 finished with value: 0.8020896879774408 and parameters: {'splitter': 'best', 'min_samples_split': 0.11721808194904532, 'min_samples_leaf': 0.0410261613663058, 'min_weight_fraction_leaf': 0.00931946628268688, 'max_features': 0.4592058282424265}. Best is trial 691 with value: 0.8340697555858835.[0m
[32m[I 2022-04-21 11:43:45,690][0m Trial 993 finished with value: 0.8182527338011368 and parameters: {'splitter': 'best', 'min_samples_split': 0.09682277352201465, 'min_samples_leaf': 0.028633402835728503, 'min_weight_fraction_leaf': 0.0002900772267948895, 'max_features': 0.5536049452885496}. Best is trial 691 with value: 0.8340697555858835.[0m
[32m[I 2022-04-21 11:43:46,304][0m Trial 994 finished with value: 0.8159000168874057 and parameters: {'splitter': 'best', 'min_samples_split': 0.1275405627559326, 'min_samples_leaf': 0.015600526476722738, 'min_weight_fraction_leaf': 0.027715258785664637, 'max_features': 0.49285041179939254}. Best is trial 691 with value: 0.8340697555858835.[0m
/media/san2_ssd/data/Workdir/survival/utils.py:305: RuntimeWarning: invalid value encountered in true_divide
  pdfs = np.gradient(1-survs,axis=1)/norms
[32m[I 2022-04-21 11:43:46,876][0m Trial 995 finished with value: 0.8180869564242105 and parameters: {'splitter': 'best', 'min_samples_split': 0.08786037094803667, 'min_samples_leaf': 0.02377662144831225, 'min_weight_fraction_leaf': 0.020860300557783318, 'max_features': 0.5171166913547044}. Best is trial 691 with value: 0.8340697555858835.[0m
[32m[I 2022-04-21 11:43:47,537][0m Trial 996 finished with value: 0.8115352380736081 and parameters: {'splitter': 'best', 'min_samples_split': 0.10690813935896926, 'min_samples_leaf': 0.032400438941106266, 'min_weight_fraction_leaf': 0.03644872454084228, 'max_features': 0.468303684149163}. Best is trial 691 with value: 0.8340697555858835.[0m
/media/san2_ssd/data/Workdir/survival/utils.py:305: RuntimeWarning: invalid value encountered in true_divide
  pdfs = np.gradient(1-survs,axis=1)/norms
[32m[I 2022-04-21 11:43:48,165][0m Trial 997 finished with value: 0.8209509863507254 and parameters: {'splitter': 'best', 'min_samples_split': 0.06955674924105734, 'min_samples_leaf': 0.015792245654971938, 'min_weight_fraction_leaf': 0.008518480447863894, 'max_features': 0.6487335326538601}. Best is trial 691 with value: 0.8340697555858835.[0m
[32m[I 2022-04-21 11:43:48,284][0m Trial 998 finished with value: 0.6966657364438674 and parameters: {'splitter': 'random', 'min_samples_split': 0.3968909072237361, 'min_samples_leaf': 0.04474328165321126, 'min_weight_fraction_leaf': 0.016210718747918143, 'max_features': 0.44800234604185407}. Best is trial 691 with value: 0.8340697555858835.[0m
/media/san2_ssd/data/Workdir/survival/utils.py:305: RuntimeWarning: invalid value encountered in true_divide
  pdfs = np.gradient(1-survs,axis=1)/norms
[32m[I 2022-04-21 11:43:48,890][0m Trial 999 finished with value: 0.8198307793329398 and parameters: {'splitter': 'best', 'min_samples_split': 0.1200520075378533, 'min_samples_leaf': 0.010557073715854466, 'min_weight_fraction_leaf': 0.00024149864392462514, 'max_features': 0.5530802707570034}. Best is trial 691 with value: 0.8340697555858835.[0m
[32m[I 2022-04-21 11:43:48,894][0m A new study created in memory with name: no-name-2a73112f-1428-431e-a219-dd8635b06e35[0m
[32m[I 2022-04-21 11:43:48,962][0m Trial 0 finished with value: 0.6078842772916468 and parameters: {'splitter': 'random', 'min_samples_split': 0.24714346494745085, 'min_samples_leaf': 0.19459193115493556, 'min_weight_fraction_leaf': 0.06877632647231469, 'max_features': 0.9194625427611608}. Best is trial 0 with value: 0.6078842772916468.[0m
[32m[I 2022-04-21 11:43:49,271][0m Trial 1 finished with value: 0.6304710323533727 and parameters: {'splitter': 'best', 'min_samples_split': 0.025104043255861158, 'min_samples_leaf': 0.03332651661765502, 'min_weight_fraction_leaf': 0.020779838798450745, 'max_features': 0.4178117575457857}. Best is trial 1 with value: 0.6304710323533727.[0m
[32m[I 2022-04-21 11:43:49,303][0m Trial 2 finished with value: 0.553048398829677 and parameters: {'splitter': 'random', 'min_samples_split': 0.39685161379813216, 'min_samples_leaf': 0.29467585591758716, 'min_weight_fraction_leaf': 0.2733071959085838, 'max_features': 0.8944649866924771}. Best is trial 1 with value: 0.6304710323533727.[0m
[32m[I 2022-04-21 11:43:49,327][0m Trial 3 finished with value: 0.5367913695535471 and parameters: {'splitter': 'random', 'min_samples_split': 0.23838466214505422, 'min_samples_leaf': 0.24628064685184675, 'min_weight_fraction_leaf': 0.32585238589530624, 'max_features': 0.7416318904382999}. Best is trial 1 with value: 0.6304710323533727.[0m
[32m[I 2022-04-21 11:43:49,351][0m Trial 4 finished with value: 0.5246215679883168 and parameters: {'splitter': 'random', 'min_samples_split': 0.24929546820273013, 'min_samples_leaf': 0.2359325694805498, 'min_weight_fraction_leaf': 0.3521576991000244, 'max_features': 0.760492038462127}. Best is trial 1 with value: 0.6304710323533727.[0m
[32m[I 2022-04-21 11:43:49,379][0m Trial 5 finished with value: 0.533863179711421 and parameters: {'splitter': 'best', 'min_samples_split': 0.049511052551491026, 'min_samples_leaf': 0.18495305021299308, 'min_weight_fraction_leaf': 0.44706888413014295, 'max_features': 0.08925895547024709}. Best is trial 1 with value: 0.6304710323533727.[0m
[32m[I 2022-04-21 11:43:49,405][0m Trial 6 finished with value: 0.5299748664234063 and parameters: {'splitter': 'random', 'min_samples_split': 0.3909050469498453, 'min_samples_leaf': 0.27926741928677273, 'min_weight_fraction_leaf': 0.12202757698978889, 'max_features': 0.8434436032154943}. Best is trial 1 with value: 0.6304710323533727.[0m
[32m[I 2022-04-21 11:43:49,425][0m Trial 7 finished with value: 0.5123137293528363 and parameters: {'splitter': 'random', 'min_samples_split': 0.29175713828824745, 'min_samples_leaf': 0.46279334567125846, 'min_weight_fraction_leaf': 0.4905979752060068, 'max_features': 0.4801104751356128}. Best is trial 1 with value: 0.6304710323533727.[0m
[32m[I 2022-04-21 11:43:49,481][0m Trial 8 finished with value: 0.555938833137348 and parameters: {'splitter': 'best', 'min_samples_split': 0.011748374920609192, 'min_samples_leaf': 0.1515666543386459, 'min_weight_fraction_leaf': 0.216489037109587, 'max_features': 0.11719617979573116}. Best is trial 1 with value: 0.6304710323533727.[0m
[32m[I 2022-04-21 11:43:49,758][0m Trial 9 finished with value: 0.614399974993757 and parameters: {'splitter': 'best', 'min_samples_split': 0.2932641077034877, 'min_samples_leaf': 0.016506021050872392, 'min_weight_fraction_leaf': 0.023958304532871066, 'max_features': 0.522279843878098}. Best is trial 1 with value: 0.6304710323533727.[0m
[32m[I 2022-04-21 11:43:49,879][0m Trial 10 finished with value: 0.544594618526193 and parameters: {'splitter': 'best', 'min_samples_split': 0.10602755442996399, 'min_samples_leaf': 0.009806780166819268, 'min_weight_fraction_leaf': 0.15710468826705015, 'max_features': 0.3372584116848255}. Best is trial 1 with value: 0.6304710323533727.[0m
[32m[I 2022-04-21 11:43:50,328][0m Trial 11 finished with value: 0.6395144477369629 and parameters: {'splitter': 'best', 'min_samples_split': 0.1470432819467205, 'min_samples_leaf': 0.01746193904893004, 'min_weight_fraction_leaf': 0.008450351606747855, 'max_features': 0.5423916521823618}. Best is trial 11 with value: 0.6395144477369629.[0m
[32m[I 2022-04-21 11:43:50,468][0m Trial 12 finished with value: 0.6242458838742111 and parameters: {'splitter': 'best', 'min_samples_split': 0.1252163049507438, 'min_samples_leaf': 0.09075892417178742, 'min_weight_fraction_leaf': 0.008712972345585372, 'max_features': 0.5154275804442368}. Best is trial 11 with value: 0.6395144477369629.[0m
[32m[I 2022-04-21 11:43:50,609][0m Trial 13 finished with value: 0.5830518819960849 and parameters: {'splitter': 'best', 'min_samples_split': 0.15040921906137955, 'min_samples_leaf': 0.08828093284324119, 'min_weight_fraction_leaf': 0.11255885171225954, 'max_features': 0.3419684614002223}. Best is trial 11 with value: 0.6395144477369629.[0m
[32m[I 2022-04-21 11:43:50,653][0m Trial 14 finished with value: 0.536760391755396 and parameters: {'splitter': 'best', 'min_samples_split': 0.1724021222022329, 'min_samples_leaf': 0.3752720162003469, 'min_weight_fraction_leaf': 0.18471232131276108, 'max_features': 0.6427172743791032}. Best is trial 11 with value: 0.6395144477369629.[0m
[32m[I 2022-04-21 11:43:50,840][0m Trial 15 finished with value: 0.6035418370519421 and parameters: {'splitter': 'best', 'min_samples_split': 0.0661910501198639, 'min_samples_leaf': 0.08226464508008047, 'min_weight_fraction_leaf': 0.07004356435872688, 'max_features': 0.25931745287284225}. Best is trial 11 with value: 0.6395144477369629.[0m
[32m[I 2022-04-21 11:43:51,623][0m Trial 16 finished with value: 0.6191190744473243 and parameters: {'splitter': 'best', 'min_samples_split': 0.02226348118066379, 'min_samples_leaf': 0.0051366970677609765, 'min_weight_fraction_leaf': 0.011870774220669678, 'max_features': 0.6171415872730797}. Best is trial 11 with value: 0.6395144477369629.[0m
[32m[I 2022-04-21 11:43:51,741][0m Trial 17 finished with value: 0.5977835047015032 and parameters: {'splitter': 'best', 'min_samples_split': 0.19641888529141932, 'min_samples_leaf': 0.06750986838182443, 'min_weight_fraction_leaf': 0.08126851325777877, 'max_features': 0.3860172332623929}. Best is trial 11 with value: 0.6395144477369629.[0m
[32m[I 2022-04-21 11:43:51,821][0m Trial 18 finished with value: 0.5586750559512484 and parameters: {'splitter': 'best', 'min_samples_split': 0.4904741852760066, 'min_samples_leaf': 0.13702094613689458, 'min_weight_fraction_leaf': 0.2847794453440593, 'max_features': 0.19757777472580534}. Best is trial 11 with value: 0.6395144477369629.[0m
[32m[I 2022-04-21 11:43:51,893][0m Trial 19 finished with value: 0.5192071084029 and parameters: {'splitter': 'best', 'min_samples_split': 0.07752790300597959, 'min_samples_leaf': 0.384917525171369, 'min_weight_fraction_leaf': 0.15356899567366883, 'max_features': 0.6524655573483338}. Best is trial 11 with value: 0.6395144477369629.[0m
[32m[I 2022-04-21 11:43:52,109][0m Trial 20 finished with value: 0.5906525109749102 and parameters: {'splitter': 'best', 'min_samples_split': 0.1966273260850987, 'min_samples_leaf': 0.04626656379109205, 'min_weight_fraction_leaf': 0.21945310280090385, 'max_features': 0.4377761389355782}. Best is trial 11 with value: 0.6395144477369629.[0m
