[32m[I 2022-04-21 21:11:46,610][0m Trial 99 finished with value: 0.5 and parameters: {'loss': 'coxph', 'learning_rate': 0.0007400499523774336, 'n_estimators': 994, 'criterion': 'squared_error', 'min_samples_split': 8, 'min_samples_leaf': 8, 'min_weight_fraction_leaf': 0.3007509932390092, 'min_impurity_decrease': 0.046444421860605795, 'max_features': 0.32378438504688667, 'subsample': 0.42070141845812997, 'dropout_rate': 0.44969662324432813, 'ccp_alpha': 0.5399435018479454}. Best is trial 74 with value: 0.6902043616759457.[0m
[32m[I 2022-04-21 21:12:03,637][0m Trial 100 finished with value: 0.6636900948801576 and parameters: {'loss': 'coxph', 'learning_rate': 9.736942686106236e-05, 'n_estimators': 250, 'criterion': 'friedman_mse', 'min_samples_split': 7, 'min_samples_leaf': 9, 'min_weight_fraction_leaf': 0.2378203821884104, 'min_impurity_decrease': 0.08037545220155859, 'max_features': 0.11082029264002637, 'subsample': 0.36681956132563454, 'dropout_rate': 0.09220654307519877, 'ccp_alpha': 0.2349812967173729}. Best is trial 74 with value: 0.6902043616759457.[0m
[32m[I 2022-04-21 21:12:10,574][0m Trial 101 finished with value: 0.6860606188762747 and parameters: {'loss': 'coxph', 'learning_rate': 0.0006048442422890831, 'n_estimators': 312, 'criterion': 'friedman_mse', 'min_samples_split': 8, 'min_samples_leaf': 9, 'min_weight_fraction_leaf': 0.2626632850352547, 'min_impurity_decrease': 0.10701651856676364, 'max_features': 0.04782612344686323, 'subsample': 0.33670273799798384, 'dropout_rate': 0.7854129742507994, 'ccp_alpha': 0.07166145475708201}. Best is trial 74 with value: 0.6902043616759457.[0m
[32m[I 2022-04-21 21:12:45,637][0m Trial 102 finished with value: 0.6815367884657785 and parameters: {'loss': 'coxph', 'learning_rate': 0.00025866704606119156, 'n_estimators': 679, 'criterion': 'friedman_mse', 'min_samples_split': 8, 'min_samples_leaf': 10, 'min_weight_fraction_leaf': 0.28752870460757207, 'min_impurity_decrease': 0.16557231136953457, 'max_features': 0.046397778284799705, 'subsample': 0.27841553857633117, 'dropout_rate': 0.8337563725887266, 'ccp_alpha': 0.10408058203479889}. Best is trial 74 with value: 0.6902043616759457.[0m
[32m[I 2022-04-21 21:12:53,308][0m Trial 103 finished with value: 0.5 and parameters: {'loss': 'coxph', 'learning_rate': 0.0005987991541560126, 'n_estimators': 308, 'criterion': 'friedman_mse', 'min_samples_split': 9, 'min_samples_leaf': 9, 'min_weight_fraction_leaf': 0.25437226558395426, 'min_impurity_decrease': 0.09897440829762229, 'max_features': 0.06537110446053611, 'subsample': 0.3743035254576745, 'dropout_rate': 0.7559878630805363, 'ccp_alpha': 3.2455513745615407}. Best is trial 74 with value: 0.6902043616759457.[0m
[32m[I 2022-04-21 21:13:04,990][0m Trial 104 finished with value: 0.5910416794967228 and parameters: {'loss': 'coxph', 'learning_rate': 0.0009009915786158863, 'n_estimators': 383, 'criterion': 'friedman_mse', 'min_samples_split': 8, 'min_samples_leaf': 9, 'min_weight_fraction_leaf': 0.31344665299613206, 'min_impurity_decrease': 0.12825721639397472, 'max_features': 0.04283751483935822, 'subsample': 0.32765943054383767, 'dropout_rate': 0.7904620705875187, 'ccp_alpha': 0.40518781573003815}. Best is trial 74 with value: 0.6902043616759457.[0m
[32m[I 2022-04-21 21:13:11,701][0m Trial 105 finished with value: 0.6690036480411925 and parameters: {'loss': 'coxph', 'learning_rate': 0.00035249271030257445, 'n_estimators': 220, 'criterion': 'friedman_mse', 'min_samples_split': 8, 'min_samples_leaf': 10, 'min_weight_fraction_leaf': 0.2274657751999376, 'min_impurity_decrease': 0.345131487924953, 'max_features': 0.7684942080505416, 'subsample': 0.33827830027284167, 'dropout_rate': 0.6494469070101246, 'ccp_alpha': 0.19755354668437983}. Best is trial 74 with value: 0.6902043616759457.[0m
[32m[I 2022-04-21 21:13:29,818][0m Trial 106 finished with value: 0.6791169856887179 and parameters: {'loss': 'coxph', 'learning_rate': 0.0022793965927659088, 'n_estimators': 428, 'criterion': 'friedman_mse', 'min_samples_split': 9, 'min_samples_leaf': 7, 'min_weight_fraction_leaf': 0.19489474229793033, 'min_impurity_decrease': 0.20523565807767102, 'max_features': 0.16394524791760345, 'subsample': 0.48303639769205026, 'dropout_rate': 0.6844280773347122, 'ccp_alpha': 0.061093057466577234}. Best is trial 74 with value: 0.6902043616759457.[0m
/media/san2_ssd/data/Workdir/survival/venv/lib/python3.8/site-packages/sksurv/ensemble/boosting.py:955: RuntimeWarning: divide by zero encountered in log
  time = numpy.log(time)
/media/san2_ssd/data/Workdir/survival/venv/lib/python3.8/site-packages/sksurv/ensemble/boosting.py:955: RuntimeWarning: divide by zero encountered in log
  time = numpy.log(time)
/media/san2_ssd/data/Workdir/survival/venv/lib/python3.8/site-packages/sksurv/ensemble/boosting.py:955: RuntimeWarning: divide by zero encountered in log
  time = numpy.log(time)
/media/san2_ssd/data/Workdir/survival/venv/lib/python3.8/site-packages/sksurv/ensemble/boosting.py:955: RuntimeWarning: divide by zero encountered in log
  time = numpy.log(time)
[32m[I 2022-04-21 21:13:30,702][0m Trial 107 finished with value: -0.7309394300370865 and parameters: {'loss': 'squared', 'learning_rate': 0.001442609426124931, 'n_estimators': 342, 'criterion': 'friedman_mse', 'min_samples_split': 5, 'min_samples_leaf': 8, 'min_weight_fraction_leaf': 0.26827737814862535, 'min_impurity_decrease': 0.0685011192717904, 'max_features': 0.9649199836204885, 'subsample': 0.44239823081052637, 'dropout_rate': 0.9179701327002068, 'ccp_alpha': 0.3254333788053789}. Best is trial 74 with value: 0.6902043616759457.[0m
[32m[I 2022-04-21 21:13:38,801][0m Trial 108 finished with value: 0.6697389096743451 and parameters: {'loss': 'coxph', 'learning_rate': 0.0001634063805056613, 'n_estimators': 319, 'criterion': 'friedman_mse', 'min_samples_split': 6, 'min_samples_leaf': 9, 'min_weight_fraction_leaf': 0.16895348173564034, 'min_impurity_decrease': 0.14310806114395475, 'max_features': 0.1156196220761664, 'subsample': 0.29853892640997914, 'dropout_rate': 0.7450506526667633, 'ccp_alpha': 0.2161313859960617}. Best is trial 74 with value: 0.6902043616759457.[0m
[32m[I 2022-04-21 21:13:54,551][0m Trial 109 finished with value: 0.6847588858705541 and parameters: {'loss': 'coxph', 'learning_rate': 0.00039197867455340344, 'n_estimators': 291, 'criterion': 'squared_error', 'min_samples_split': 7, 'min_samples_leaf': 8, 'min_weight_fraction_leaf': 0.20867937200111447, 'min_impurity_decrease': 0.10617857050573927, 'max_features': 0.14532283227009601, 'subsample': 0.3888738509054116, 'dropout_rate': 0.3260065128716532, 'ccp_alpha': 0.09080575013312253}. Best is trial 74 with value: 0.6902043616759457.[0m
[32m[I 2022-04-21 21:14:01,916][0m Trial 110 finished with value: 0.5 and parameters: {'loss': 'coxph', 'learning_rate': 0.00021266318665815967, 'n_estimators': 296, 'criterion': 'squared_error', 'min_samples_split': 7, 'min_samples_leaf': 7, 'min_weight_fraction_leaf': 0.2124507533364525, 'min_impurity_decrease': 0.27326500161705225, 'max_features': 0.19477563400004175, 'subsample': 0.3961303520430982, 'dropout_rate': 0.8107576732475197, 'ccp_alpha': 0.48480556824657983}. Best is trial 74 with value: 0.6902043616759457.[0m
[32m[I 2022-04-21 21:14:13,208][0m Trial 111 finished with value: 0.6871458997299013 and parameters: {'loss': 'coxph', 'learning_rate': 0.00041385819103728313, 'n_estimators': 276, 'criterion': 'squared_error', 'min_samples_split': 7, 'min_samples_leaf': 8, 'min_weight_fraction_leaf': 0.1764202581342531, 'min_impurity_decrease': 0.10221360244243559, 'max_features': 0.13937553322019713, 'subsample': 0.35902195466332415, 'dropout_rate': 0.276456860898417, 'ccp_alpha': 0.011652610814439836}. Best is trial 74 with value: 0.6902043616759457.[0m
[32m[I 2022-04-21 21:14:23,651][0m Trial 112 finished with value: 0.6859664839137115 and parameters: {'loss': 'coxph', 'learning_rate': 0.00042695097054660364, 'n_estimators': 257, 'criterion': 'squared_error', 'min_samples_split': 7, 'min_samples_leaf': 7, 'min_weight_fraction_leaf': 0.2436037772484282, 'min_impurity_decrease': 0.11119780660070026, 'max_features': 0.14112601780854694, 'subsample': 0.3443947896545026, 'dropout_rate': 0.35193951355615904, 'ccp_alpha': 0.11188070558091412}. Best is trial 74 with value: 0.6902043616759457.[0m
[32m[I 2022-04-21 21:14:40,253][0m Trial 113 finished with value: 0.6455165580383492 and parameters: {'loss': 'coxph', 'learning_rate': 0.0002778291770722534, 'n_estimators': 257, 'criterion': 'squared_error', 'min_samples_split': 7, 'min_samples_leaf': 8, 'min_weight_fraction_leaf': 0.1738322353972711, 'min_impurity_decrease': 0.18045036742121, 'max_features': 0.1392175170065462, 'subsample': 0.4243352898130473, 'dropout_rate': 0.29455771081037674, 'ccp_alpha': 0.22435049026924803}. Best is trial 74 with value: 0.6902043616759457.[0m
[32m[I 2022-04-21 21:14:51,902][0m Trial 114 finished with value: 0.6809354029914614 and parameters: {'loss': 'coxph', 'learning_rate': 0.00037554505376902246, 'n_estimators': 239, 'criterion': 'squared_error', 'min_samples_split': 7, 'min_samples_leaf': 7, 'min_weight_fraction_leaf': 0.19581149976966739, 'min_impurity_decrease': 0.16009721547325562, 'max_features': 0.21688923446757405, 'subsample': 0.31305105761959595, 'dropout_rate': 0.31063359790672396, 'ccp_alpha': 0.08298379444276473}. Best is trial 74 with value: 0.6902043616759457.[0m
[32m[I 2022-04-21 21:15:10,107][0m Trial 115 finished with value: 0.5591253988039688 and parameters: {'loss': 'coxph', 'learning_rate': 0.0006224677761407052, 'n_estimators': 276, 'criterion': 'squared_error', 'min_samples_split': 6, 'min_samples_leaf': 6, 'min_weight_fraction_leaf': 0.20429244476200478, 'min_impurity_decrease': 0.10840922998330695, 'max_features': 0.23413121145575067, 'subsample': 0.34012828938220335, 'dropout_rate': 0.22819070108596118, 'ccp_alpha': 0.37697323482399725}. Best is trial 74 with value: 0.6902043616759457.[0m
[32m[I 2022-04-21 21:15:17,156][0m Trial 116 finished with value: 0.6865271711365913 and parameters: {'loss': 'coxph', 'learning_rate': 0.0010061195713051583, 'n_estimators': 197, 'criterion': 'squared_error', 'min_samples_split': 7, 'min_samples_leaf': 8, 'min_weight_fraction_leaf': 0.1829519001101555, 'min_impurity_decrease': 0.08944314734027012, 'max_features': 0.1707984572487055, 'subsample': 0.2610262433066862, 'dropout_rate': 0.3276465996668939, 'ccp_alpha': 0.0013307386337831767}. Best is trial 74 with value: 0.6902043616759457.[0m
[32m[I 2022-04-21 21:15:30,563][0m Trial 117 finished with value: 0.5 and parameters: {'loss': 'coxph', 'learning_rate': 0.0009817004369916448, 'n_estimators': 258, 'criterion': 'squared_error', 'min_samples_split': 7, 'min_samples_leaf': 8, 'min_weight_fraction_leaf': 0.15571008349147797, 'min_impurity_decrease': 0.08938670397767623, 'max_features': 0.18795809992160464, 'subsample': 0.25576086002815257, 'dropout_rate': 0.3867199428064485, 'ccp_alpha': 0.6360159463982352}. Best is trial 74 with value: 0.6902043616759457.[0m
[32m[I 2022-04-21 21:15:34,453][0m Trial 118 finished with value: 0.6474601073575301 and parameters: {'loss': 'coxph', 'learning_rate': 0.00041686285319993344, 'n_estimators': 140, 'criterion': 'squared_error', 'min_samples_split': 6, 'min_samples_leaf': 7, 'min_weight_fraction_leaf': 0.17815886865448083, 'min_impurity_decrease': 0.11322470167675983, 'max_features': 0.1471183698396853, 'subsample': 0.26787674321118754, 'dropout_rate': 0.3279919998178788, 'ccp_alpha': 0.26057170760248755}. Best is trial 74 with value: 0.6902043616759457.[0m
[32m[I 2022-04-21 21:15:42,252][0m Trial 119 finished with value: 0.684643812802531 and parameters: {'loss': 'coxph', 'learning_rate': 0.0006967458648694912, 'n_estimators': 201, 'criterion': 'squared_error', 'min_samples_split': 7, 'min_samples_leaf': 8, 'min_weight_fraction_leaf': 0.13327259239835695, 'min_impurity_decrease': 0.022058042171822653, 'max_features': 0.08542842404727827, 'subsample': 0.2809733740111917, 'dropout_rate': 0.2602620139974216, 'ccp_alpha': 0.07501677161399256}. Best is trial 74 with value: 0.6902043616759457.[0m
[32m[I 2022-04-21 21:15:50,673][0m Trial 120 finished with value: 0.6637865011237818 and parameters: {'loss': 'coxph', 'learning_rate': 0.0012675991716062304, 'n_estimators': 193, 'criterion': 'squared_error', 'min_samples_split': 7, 'min_samples_leaf': 8, 'min_weight_fraction_leaf': 0.11851760031643538, 'min_impurity_decrease': 0.01836790325940464, 'max_features': 0.09039680161392735, 'subsample': 0.16354271203376608, 'dropout_rate': 0.2691269593144412, 'ccp_alpha': 0.33466238125160813}. Best is trial 74 with value: 0.6902043616759457.[0m
[32m[I 2022-04-21 21:15:59,182][0m Trial 121 finished with value: 0.6823357855008253 and parameters: {'loss': 'coxph', 'learning_rate': 0.000737498009770859, 'n_estimators': 171, 'criterion': 'squared_error', 'min_samples_split': 7, 'min_samples_leaf': 8, 'min_weight_fraction_leaf': 0.238228953432033, 'min_impurity_decrease': 0.0013582028769557296, 'max_features': 0.11490507286756486, 'subsample': 0.22189527907766599, 'dropout_rate': 0.22954701794353616, 'ccp_alpha': 0.00416972558017005}. Best is trial 74 with value: 0.6902043616759457.[0m
[32m[I 2022-04-21 21:16:08,728][0m Trial 122 finished with value: 0.6614023667188818 and parameters: {'loss': 'coxph', 'learning_rate': 0.05199593034293274, 'n_estimators': 206, 'criterion': 'squared_error', 'min_samples_split': 7, 'min_samples_leaf': 8, 'min_weight_fraction_leaf': 0.09930910068162861, 'min_impurity_decrease': 0.04294820155673593, 'max_features': 0.06353867425114836, 'subsample': 0.24503702874842814, 'dropout_rate': 0.18638196531948825, 'ccp_alpha': 0.18655516881212197}. Best is trial 74 with value: 0.6902043616759457.[0m
[32m[I 2022-04-21 21:16:17,070][0m Trial 123 finished with value: 0.6865675001627458 and parameters: {'loss': 'coxph', 'learning_rate': 0.0006388406487542786, 'n_estimators': 195, 'criterion': 'squared_error', 'min_samples_split': 6, 'min_samples_leaf': 8, 'min_weight_fraction_leaf': 0.1422987948719845, 'min_impurity_decrease': 0.08159491225382337, 'max_features': 0.1373149441005499, 'subsample': 0.286867214082785, 'dropout_rate': 0.27744451624411226, 'ccp_alpha': 0.00331695477469989}. Best is trial 74 with value: 0.6902043616759457.[0m
[32m[I 2022-04-21 21:16:25,724][0m Trial 124 finished with value: 0.6872950077365688 and parameters: {'loss': 'coxph', 'learning_rate': 0.00047589681691220554, 'n_estimators': 163, 'criterion': 'squared_error', 'min_samples_split': 6, 'min_samples_leaf': 8, 'min_weight_fraction_leaf': 0.1420171246497193, 'min_impurity_decrease': 0.13049400857466859, 'max_features': 0.08480682508780482, 'subsample': 0.28698434440410603, 'dropout_rate': 0.26691454438446943, 'ccp_alpha': 0.004644112578531659}. Best is trial 74 with value: 0.6902043616759457.[0m
[32m[I 2022-04-21 21:16:36,741][0m Trial 125 finished with value: 0.6829121733447812 and parameters: {'loss': 'coxph', 'learning_rate': 0.0010610403964644482, 'n_estimators': 196, 'criterion': 'squared_error', 'min_samples_split': 6, 'min_samples_leaf': 8, 'min_weight_fraction_leaf': 0.13823250816381674, 'min_impurity_decrease': 0.08745519002649223, 'max_features': 0.12100097210918545, 'subsample': 0.20349867468857635, 'dropout_rate': 0.28133125174332196, 'ccp_alpha': 0.01123759623510752}. Best is trial 74 with value: 0.6902043616759457.[0m
[32m[I 2022-04-21 21:16:44,061][0m Trial 126 finished with value: 0.5 and parameters: {'loss': 'coxph', 'learning_rate': 0.00046424661715587184, 'n_estimators': 170, 'criterion': 'squared_error', 'min_samples_split': 6, 'min_samples_leaf': 7, 'min_weight_fraction_leaf': 0.1485594447228376, 'min_impurity_decrease': 0.728858382115527, 'max_features': 0.09507953861697624, 'subsample': 0.29045984282838644, 'dropout_rate': 0.25458843509217377, 'ccp_alpha': 1.7885879248902048}. Best is trial 74 with value: 0.6902043616759457.[0m
[32m[I 2022-04-21 21:16:55,906][0m Trial 127 finished with value: 0.6750016130503876 and parameters: {'loss': 'coxph', 'learning_rate': 0.0006994874349303295, 'n_estimators': 180, 'criterion': 'squared_error', 'min_samples_split': 6, 'min_samples_leaf': 8, 'min_weight_fraction_leaf': 0.12975206392264635, 'min_impurity_decrease': 0.07066027656340695, 'max_features': 0.017275300242048392, 'subsample': 0.30650652254630695, 'dropout_rate': 0.3357371457064787, 'ccp_alpha': 0.2016988905187313}. Best is trial 74 with value: 0.6902043616759457.[0m
/media/san2_ssd/data/Workdir/survival/venv/lib/python3.8/site-packages/sksurv/ensemble/boosting.py:955: RuntimeWarning: divide by zero encountered in log
  time = numpy.log(time)
/media/san2_ssd/data/Workdir/survival/venv/lib/python3.8/site-packages/sksurv/ensemble/boosting.py:955: RuntimeWarning: divide by zero encountered in log
  time = numpy.log(time)
/media/san2_ssd/data/Workdir/survival/venv/lib/python3.8/site-packages/sksurv/ensemble/boosting.py:955: RuntimeWarning: divide by zero encountered in log
  time = numpy.log(time)
/media/san2_ssd/data/Workdir/survival/venv/lib/python3.8/site-packages/sksurv/ensemble/boosting.py:955: RuntimeWarning: divide by zero encountered in log
  time = numpy.log(time)
[32m[I 2022-04-21 21:16:56,583][0m Trial 128 finished with value: -0.7317286726923086 and parameters: {'loss': 'squared', 'learning_rate': 0.0008244404586042471, 'n_estimators': 119, 'criterion': 'squared_error', 'min_samples_split': 6, 'min_samples_leaf': 7, 'min_weight_fraction_leaf': 0.14722641769690142, 'min_impurity_decrease': 0.1022877336900464, 'max_features': 0.3738055639060293, 'subsample': 0.23689270292637918, 'dropout_rate': 0.38633376926565755, 'ccp_alpha': 0.4504645324697601}. Best is trial 74 with value: 0.6902043616759457.[0m
[32m[I 2022-04-21 21:17:11,037][0m Trial 129 finished with value: 0.5 and parameters: {'loss': 'coxph', 'learning_rate': 0.00027184459991508184, 'n_estimators': 224, 'criterion': 'squared_error', 'min_samples_split': 5, 'min_samples_leaf': 8, 'min_weight_fraction_leaf': 0.11315433152498364, 'min_impurity_decrease': 0.034919581538620195, 'max_features': 0.13826014439675954, 'subsample': 0.2777289514980253, 'dropout_rate': 0.20121732635794504, 'ccp_alpha': 3.8896354671651423}. Best is trial 74 with value: 0.6902043616759457.[0m
[32m[I 2022-04-21 21:17:16,463][0m Trial 130 finished with value: 0.6776158879994176 and parameters: {'loss': 'coxph', 'learning_rate': 0.0003898590959429927, 'n_estimators': 148, 'criterion': 'squared_error', 'min_samples_split': 6, 'min_samples_leaf': 8, 'min_weight_fraction_leaf': 0.1645774680115004, 'min_impurity_decrease': 0.12868288213766413, 'max_features': 0.44949663706857923, 'subsample': 0.33822165716783165, 'dropout_rate': 0.3648062331707657, 'ccp_alpha': 0.09984088452970262}. Best is trial 74 with value: 0.6902043616759457.[0m
[32m[I 2022-04-21 21:17:22,685][0m Trial 131 finished with value: 0.6811369712885733 and parameters: {'loss': 'coxph', 'learning_rate': 0.0005617108065317047, 'n_estimators': 158, 'criterion': 'squared_error', 'min_samples_split': 7, 'min_samples_leaf': 8, 'min_weight_fraction_leaf': 0.09540559006071378, 'min_impurity_decrease': 0.14788403547385237, 'max_features': 0.07324290794661875, 'subsample': 0.31441532918145043, 'dropout_rate': 0.303872383723766, 'ccp_alpha': 0.093320489115677}. Best is trial 74 with value: 0.6902043616759457.[0m
[32m[I 2022-04-21 21:17:35,478][0m Trial 132 finished with value: 0.6307972131469188 and parameters: {'loss': 'coxph', 'learning_rate': 0.0005163385440531314, 'n_estimators': 213, 'criterion': 'squared_error', 'min_samples_split': 6, 'min_samples_leaf': 9, 'min_weight_fraction_leaf': 0.12498125418475636, 'min_impurity_decrease': 0.1285675452918392, 'max_features': 0.1694230591811376, 'subsample': 0.35286346234252797, 'dropout_rate': 0.2642304971544813, 'ccp_alpha': 0.27955182357569464}. Best is trial 74 with value: 0.6902043616759457.[0m
[32m[I 2022-04-21 21:17:43,899][0m Trial 133 finished with value: 0.6834334731246179 and parameters: {'loss': 'coxph', 'learning_rate': 0.00022803867865369375, 'n_estimators': 190, 'criterion': 'squared_error', 'min_samples_split': 7, 'min_samples_leaf': 9, 'min_weight_fraction_leaf': 0.1551147391458908, 'min_impurity_decrease': 0.07818449083869702, 'max_features': 0.08106054452270059, 'subsample': 0.28352544264185514, 'dropout_rate': 0.34886272571053456, 'ccp_alpha': 0.004331520739246502}. Best is trial 74 with value: 0.6902043616759457.[0m
[32m[I 2022-04-21 21:17:52,158][0m Trial 134 finished with value: 0.6798763691202652 and parameters: {'loss': 'coxph', 'learning_rate': 0.0006586779191115902, 'n_estimators': 202, 'criterion': 'squared_error', 'min_samples_split': 7, 'min_samples_leaf': 8, 'min_weight_fraction_leaf': 0.10646230681393165, 'min_impurity_decrease': 0.16016222513713824, 'max_features': 0.04332204635224238, 'subsample': 0.2557780928344056, 'dropout_rate': 0.3209015195427922, 'ccp_alpha': 0.16468124732557887}. Best is trial 74 with value: 0.6902043616759457.[0m
[32m[I 2022-04-21 21:18:05,950][0m Trial 135 finished with value: 0.6200164436182327 and parameters: {'loss': 'coxph', 'learning_rate': 0.0001952784211707508, 'n_estimators': 229, 'criterion': 'squared_error', 'min_samples_split': 7, 'min_samples_leaf': 8, 'min_weight_fraction_leaf': 0.22729093940978684, 'min_impurity_decrease': 0.07190939238944252, 'max_features': 0.57206707213793, 'subsample': 0.3814008977181622, 'dropout_rate': 0.25047947595354303, 'ccp_alpha': 0.3107456319870249}. Best is trial 74 with value: 0.6902043616759457.[0m
