No protocol specified
[32m[I 2022-04-21 11:37:19,960][0m A new study created in memory with name: no-name-c5cea8f3-57c1-45d4-8a34-df670c4f2aab[0m
2022-04-21 11:37:20.017526: E tensorflow/stream_executor/cuda/cuda_driver.cc:271] failed call to cuInit: CUDA_ERROR_NO_DEVICE: no CUDA-capable device is detected
2022-04-21 11:37:20.017573: I tensorflow/stream_executor/cuda/cuda_diagnostics.cc:156] kernel driver does not appear to be running on this host (nbcwdc01): /proc/driver/nvidia/version does not exist
2022-04-21 11:37:20.018157: I tensorflow/core/platform/cpu_feature_guard.cc:151] This TensorFlow binary is optimized with oneAPI Deep Neural Network Library (oneDNN) to use the following CPU instructions in performance-critical operations:  AVX2 AVX512F FMA
To enable them in other operations, rebuild TensorFlow with the appropriate compiler flags.
WARNING:tensorflow:Setting parallel_iterations > 1 has no effect when executing eagerly. Consider calling map_fn with tf.function to execute fn in parallel.
[32m[I 2022-04-21 11:43:28,248][0m Trial 0 finished with value: 0.6419611243045142 and parameters: {'n_hidden': 1024, 'mixture_components': 2, 'use_sparse_layer': True, 'use_sparse_loss': False, 'use_batchnorm': True, 'use_dropout': True, 'dropout': 0.08132402189115018, 'mlp_size_1': 5, 'mlp_size_2': 1, 'mlp_size_3': 0, 'kernel': 'Logistic', 'loss_name': 'NLLLoss'}. Best is trial 0 with value: 0.6419611243045142.[0m
[32m[I 2022-04-21 11:45:05,194][0m Trial 1 finished with value: 0.8379879616157743 and parameters: {'n_hidden': 512, 'mixture_components': 1, 'use_sparse_layer': False, 'use_batchnorm': False, 'use_dropout': False, 'mlp_size_1': 3, 'mlp_size_2': 2, 'mlp_size_3': 1, 'kernel': 'Exponential', 'loss_name': 'NLLLoss'}. Best is trial 1 with value: 0.8379879616157743.[0m
[32m[I 2022-04-21 11:48:08,179][0m Trial 2 finished with value: 0.2781584327204961 and parameters: {'n_hidden': 2048, 'mixture_components': 10, 'use_sparse_layer': False, 'use_batchnorm': True, 'use_dropout': True, 'dropout': 0.8374660593028211, 'mlp_size_1': 2, 'mlp_size_2': 0, 'mlp_size_3': 5, 'kernel': 'Logistic', 'loss_name': 'NLLLoss'}. Best is trial 1 with value: 0.8379879616157743.[0m
[32m[I 2022-04-21 11:49:49,899][0m Trial 3 finished with value: -0.23475014870416305 and parameters: {'n_hidden': 256, 'mixture_components': 10, 'use_sparse_layer': True, 'use_sparse_loss': True, 'lmbd': 0.0690942518503935, 'use_batchnorm': False, 'use_dropout': False, 'mlp_size_1': 4, 'mlp_size_2': 0, 'mlp_size_3': 1, 'kernel': 'Exponential', 'loss_name': 'AlternativeNLLLoss'}. Best is trial 1 with value: 0.8379879616157743.[0m
[32m[I 2022-04-21 11:52:17,277][0m Trial 4 finished with value: 0.2986939495909612 and parameters: {'n_hidden': 2048, 'mixture_components': 9, 'use_sparse_layer': False, 'use_batchnorm': True, 'use_dropout': False, 'mlp_size_1': 7, 'mlp_size_2': 0, 'mlp_size_3': 0, 'kernel': 'Gumbel', 'loss_name': 'CensoredNLLLoss'}. Best is trial 1 with value: 0.8379879616157743.[0m
[32m[I 2022-04-21 11:57:03,455][0m Trial 5 finished with value: 0.6379364802260102 and parameters: {'n_hidden': 128, 'mixture_components': 7, 'use_sparse_layer': True, 'use_sparse_loss': True, 'lmbd': 0.0016309490870747535, 'use_batchnorm': True, 'use_dropout': False, 'mlp_size_1': 1, 'mlp_size_2': 3, 'mlp_size_3': 0, 'kernel': 'Logistic', 'loss_name': 'NLLLoss'}. Best is trial 1 with value: 0.8379879616157743.[0m
[32m[I 2022-04-21 11:59:40,842][0m Trial 6 finished with value: 0.8349616274915889 and parameters: {'n_hidden': 64, 'mixture_components': 10, 'use_sparse_layer': False, 'use_batchnorm': False, 'use_dropout': False, 'mlp_size_1': 0, 'mlp_size_2': 2, 'mlp_size_3': 1, 'kernel': 'Logistic', 'loss_name': 'CensoredNLLLoss'}. Best is trial 1 with value: 0.8379879616157743.[0m
[32m[I 2022-04-21 12:01:29,075][0m Trial 7 finished with value: -0.5 and parameters: {'n_hidden': 2048, 'mixture_components': 7, 'use_sparse_layer': False, 'use_batchnorm': True, 'use_dropout': True, 'dropout': 0.47584799828033864, 'mlp_size_1': 3, 'mlp_size_2': 2, 'mlp_size_3': 2, 'kernel': 'Gumbel', 'loss_name': 'AlternativeNLLLoss'}. Best is trial 1 with value: 0.8379879616157743.[0m
[32m[I 2022-04-21 12:03:17,421][0m Trial 8 finished with value: 0.3178490754901119 and parameters: {'n_hidden': 2048, 'mixture_components': 2, 'use_sparse_layer': True, 'use_sparse_loss': True, 'lmbd': 0.004880203186107568, 'use_batchnorm': False, 'use_dropout': True, 'dropout': 0.9124229641667758, 'mlp_size_1': 7, 'mlp_size_2': 0, 'mlp_size_3': 1, 'kernel': 'LogLogistic', 'loss_name': 'AlternativeNLLLoss'}. Best is trial 1 with value: 0.8379879616157743.[0m
[32m[I 2022-04-21 12:07:48,829][0m Trial 9 finished with value: 0.6371795080215373 and parameters: {'n_hidden': 64, 'mixture_components': 6, 'use_sparse_layer': False, 'use_batchnorm': True, 'use_dropout': True, 'dropout': 0.04659549307593158, 'mlp_size_1': 1, 'mlp_size_2': 2, 'mlp_size_3': 0, 'kernel': 'Exponential', 'loss_name': 'NLLLoss'}. Best is trial 1 with value: 0.8379879616157743.[0m
[32m[I 2022-04-21 12:09:41,955][0m Trial 10 finished with value: 0.7382198427652502 and parameters: {'n_hidden': 512, 'mixture_components': 4, 'use_sparse_layer': False, 'use_batchnorm': False, 'use_dropout': False, 'mlp_size_1': 5, 'mlp_size_2': 1, 'mlp_size_3': 0, 'kernel': 'Normal', 'loss_name': 'NLLLoss'}. Best is trial 1 with value: 0.8379879616157743.[0m
[32m[I 2022-04-21 12:11:14,778][0m Trial 11 finished with value: -0.23555849265150092 and parameters: {'n_hidden': 32, 'mixture_components': 4, 'use_sparse_layer': False, 'use_batchnorm': False, 'use_dropout': False, 'mlp_size_1': 0, 'mlp_size_2': 2, 'mlp_size_3': 0, 'kernel': 'Exponential', 'loss_name': 'CensoredNLLLoss'}. Best is trial 1 with value: 0.8379879616157743.[0m
[32m[I 2022-04-21 12:13:40,239][0m Trial 12 finished with value: 0.6372386657630522 and parameters: {'n_hidden': 64, 'mixture_components': 1, 'use_sparse_layer': False, 'use_batchnorm': False, 'use_dropout': False, 'mlp_size_1': 0, 'mlp_size_2': 3, 'mlp_size_3': 0, 'kernel': 'LogLogistic', 'loss_name': 'CensoredNLLLoss'}. Best is trial 1 with value: 0.8379879616157743.[0m
[32m[I 2022-04-21 12:15:44,205][0m Trial 13 finished with value: 0.847425244657974 and parameters: {'n_hidden': 512, 'mixture_components': 8, 'use_sparse_layer': False, 'use_batchnorm': False, 'use_dropout': False, 'mlp_size_1': 3, 'mlp_size_2': 2, 'mlp_size_3': 1, 'kernel': 'Normal', 'loss_name': 'CensoredNLLLoss'}. Best is trial 13 with value: 0.847425244657974.[0m
[32m[I 2022-04-21 12:18:00,139][0m Trial 14 finished with value: 0.8439137684320258 and parameters: {'n_hidden': 512, 'mixture_components': 8, 'use_sparse_layer': False, 'use_batchnorm': False, 'use_dropout': False, 'mlp_size_1': 3, 'mlp_size_2': 3, 'mlp_size_3': 0, 'kernel': 'Normal', 'loss_name': 'CensoredNLLLoss'}. Best is trial 13 with value: 0.847425244657974.[0m
[32m[I 2022-04-21 12:20:51,168][0m Trial 15 finished with value: 0.839687945913153 and parameters: {'n_hidden': 512, 'mixture_components': 8, 'use_sparse_layer': False, 'use_batchnorm': False, 'use_dropout': False, 'mlp_size_1': 4, 'mlp_size_2': 1, 'mlp_size_3': 1, 'kernel': 'Normal', 'loss_name': 'CensoredNLLLoss'}. Best is trial 13 with value: 0.847425244657974.[0m
[32m[I 2022-04-21 12:22:58,553][0m Trial 16 finished with value: 0.8390194994750656 and parameters: {'n_hidden': 512, 'mixture_components': 8, 'use_sparse_layer': False, 'use_batchnorm': False, 'use_dropout': False, 'mlp_size_1': 2, 'mlp_size_2': 4, 'mlp_size_3': 0, 'kernel': 'Normal', 'loss_name': 'CensoredNLLLoss'}. Best is trial 13 with value: 0.847425244657974.[0m
[32m[I 2022-04-21 12:25:30,258][0m Trial 17 finished with value: 0.8538600001453517 and parameters: {'n_hidden': 512, 'mixture_components': 5, 'use_sparse_layer': False, 'use_batchnorm': False, 'use_dropout': False, 'mlp_size_1': 4, 'mlp_size_2': 2, 'mlp_size_3': 0, 'kernel': 'Normal', 'loss_name': 'CensoredNLLLoss'}. Best is trial 17 with value: 0.8538600001453517.[0m
[32m[I 2022-04-21 12:27:53,004][0m Trial 18 finished with value: 0.7416419513646957 and parameters: {'n_hidden': 1024, 'mixture_components': 5, 'use_sparse_layer': True, 'use_sparse_loss': False, 'use_batchnorm': False, 'use_dropout': False, 'mlp_size_1': 6, 'mlp_size_2': 1, 'mlp_size_3': 0, 'kernel': 'Normal', 'loss_name': 'CensoredNLLLoss'}. Best is trial 17 with value: 0.8538600001453517.[0m
[32m[I 2022-04-21 12:30:15,524][0m Trial 19 finished with value: 0.8397383473582473 and parameters: {'n_hidden': 256, 'mixture_components': 6, 'use_sparse_layer': False, 'use_batchnorm': False, 'use_dropout': False, 'mlp_size_1': 4, 'mlp_size_2': 1, 'mlp_size_3': 0, 'kernel': 'Normal', 'loss_name': 'CensoredNLLLoss'}. Best is trial 17 with value: 0.8538600001453517.[0m
[32m[I 2022-04-21 12:32:43,416][0m Trial 20 finished with value: 0.7198396981687252 and parameters: {'n_hidden': 32, 'mixture_components': 4, 'use_sparse_layer': False, 'use_batchnorm': False, 'use_dropout': False, 'mlp_size_1': 2, 'mlp_size_2': 0, 'mlp_size_3': 0, 'kernel': 'Normal', 'loss_name': 'CensoredNLLLoss'}. Best is trial 17 with value: 0.8538600001453517.[0m
[32m[I 2022-04-21 12:34:57,823][0m Trial 21 finished with value: 0.8409772779660323 and parameters: {'n_hidden': 512, 'mixture_components': 8, 'use_sparse_layer': False, 'use_batchnorm': False, 'use_dropout': False, 'mlp_size_1': 3, 'mlp_size_2': 3, 'mlp_size_3': 0, 'kernel': 'Normal', 'loss_name': 'CensoredNLLLoss'}. Best is trial 17 with value: 0.8538600001453517.[0m
[32m[I 2022-04-21 12:37:38,315][0m Trial 22 finished with value: 0.8362956208557814 and parameters: {'n_hidden': 512, 'mixture_components': 7, 'use_sparse_layer': False, 'use_batchnorm': False, 'use_dropout': False, 'mlp_size_1': 3, 'mlp_size_2': 3, 'mlp_size_3': 0, 'kernel': 'Normal', 'loss_name': 'CensoredNLLLoss'}. Best is trial 17 with value: 0.8538600001453517.[0m
[32m[I 2022-04-21 12:40:00,539][0m Trial 23 finished with value: 0.8411405421506146 and parameters: {'n_hidden': 512, 'mixture_components': 5, 'use_sparse_layer': False, 'use_batchnorm': False, 'use_dropout': False, 'mlp_size_1': 4, 'mlp_size_2': 2, 'mlp_size_3': 0, 'kernel': 'Normal', 'loss_name': 'CensoredNLLLoss'}. Best is trial 17 with value: 0.8538600001453517.[0m
[32m[I 2022-04-21 12:42:24,999][0m Trial 24 finished with value: 0.837774462070848 and parameters: {'n_hidden': 128, 'mixture_components': 9, 'use_sparse_layer': False, 'use_batchnorm': False, 'use_dropout': False, 'mlp_size_1': 3, 'mlp_size_2': 1, 'mlp_size_3': 0, 'kernel': 'Normal', 'loss_name': 'CensoredNLLLoss'}. Best is trial 17 with value: 0.8538600001453517.[0m
[32m[I 2022-04-21 12:45:11,946][0m Trial 25 finished with value: 0.8470720866386232 and parameters: {'n_hidden': 512, 'mixture_components': 6, 'use_sparse_layer': False, 'use_batchnorm': False, 'use_dropout': False, 'mlp_size_1': 5, 'mlp_size_2': 1, 'mlp_size_3': 0, 'kernel': 'Normal', 'loss_name': 'AlternativeNLLLoss'}. Best is trial 17 with value: 0.8538600001453517.[0m
[32m[I 2022-04-21 12:47:08,755][0m Trial 26 finished with value: 0.43732705630833824 and parameters: {'n_hidden': 512, 'mixture_components': 6, 'use_sparse_layer': True, 'use_sparse_loss': False, 'use_batchnorm': False, 'use_dropout': True, 'dropout': 0.4568029880694438, 'mlp_size_1': 5, 'mlp_size_2': 1, 'mlp_size_3': 0, 'kernel': 'Gumbel', 'loss_name': 'AlternativeNLLLoss'}. Best is trial 17 with value: 0.8538600001453517.[0m
[32m[I 2022-04-21 12:49:40,710][0m Trial 27 finished with value: 0.8431943075493427 and parameters: {'n_hidden': 512, 'mixture_components': 3, 'use_sparse_layer': False, 'use_batchnorm': False, 'use_dropout': False, 'mlp_size_1': 5, 'mlp_size_2': 1, 'mlp_size_3': 0, 'kernel': 'LogLogistic', 'loss_name': 'AlternativeNLLLoss'}. Best is trial 17 with value: 0.8538600001453517.[0m
[32m[I 2022-04-21 12:52:34,091][0m Trial 28 finished with value: 0.8407429693632202 and parameters: {'n_hidden': 512, 'mixture_components': 5, 'use_sparse_layer': False, 'use_batchnorm': False, 'use_dropout': False, 'mlp_size_1': 4, 'mlp_size_2': 1, 'mlp_size_3': 1, 'kernel': 'Normal', 'loss_name': 'AlternativeNLLLoss'}. Best is trial 17 with value: 0.8538600001453517.[0m
[32m[I 2022-04-21 12:57:05,915][0m Trial 29 finished with value: 0.3383922477564813 and parameters: {'n_hidden': 1024, 'mixture_components': 3, 'use_sparse_layer': True, 'use_sparse_loss': False, 'use_batchnorm': True, 'use_dropout': True, 'dropout': 0.7028360933714295, 'mlp_size_1': 6, 'mlp_size_2': 1, 'mlp_size_3': 0, 'kernel': 'Normal', 'loss_name': 'AlternativeNLLLoss'}. Best is trial 17 with value: 0.8538600001453517.[0m
[32m[I 2022-04-21 12:59:58,863][0m Trial 30 finished with value: 0.8418399877911689 and parameters: {'n_hidden': 32, 'mixture_components': 7, 'use_sparse_layer': False, 'use_batchnorm': False, 'use_dropout': False, 'mlp_size_1': 2, 'mlp_size_2': 0, 'mlp_size_3': 0, 'kernel': 'Normal', 'loss_name': 'AlternativeNLLLoss'}. Best is trial 17 with value: 0.8538600001453517.[0m
[32m[I 2022-04-21 13:02:43,458][0m Trial 31 finished with value: 0.841293045211404 and parameters: {'n_hidden': 512, 'mixture_components': 9, 'use_sparse_layer': False, 'use_batchnorm': False, 'use_dropout': False, 'mlp_size_1': 4, 'mlp_size_2': 2, 'mlp_size_3': 0, 'kernel': 'Normal', 'loss_name': 'CensoredNLLLoss'}. Best is trial 17 with value: 0.8538600001453517.[0m
[32m[I 2022-04-21 13:05:05,854][0m Trial 32 finished with value: 0.8378840808770935 and parameters: {'n_hidden': 512, 'mixture_components': 8, 'use_sparse_layer': False, 'use_batchnorm': False, 'use_dropout': False, 'mlp_size_1': 3, 'mlp_size_2': 3, 'mlp_size_3': 0, 'kernel': 'Normal', 'loss_name': 'CensoredNLLLoss'}. Best is trial 17 with value: 0.8538600001453517.[0m
[32m[I 2022-04-21 13:07:47,178][0m Trial 33 finished with value: 0.840694717717037 and parameters: {'n_hidden': 512, 'mixture_components': 6, 'use_sparse_layer': False, 'use_batchnorm': False, 'use_dropout': False, 'mlp_size_1': 5, 'mlp_size_2': 1, 'mlp_size_3': 0, 'kernel': 'Normal', 'loss_name': 'CensoredNLLLoss'}. Best is trial 17 with value: 0.8538600001453517.[0m
[32m[I 2022-04-21 13:09:36,564][0m Trial 34 finished with value: 0.8348464896256447 and parameters: {'n_hidden': 256, 'mixture_components': 7, 'use_sparse_layer': False, 'use_batchnorm': False, 'use_dropout': False, 'mlp_size_1': 4, 'mlp_size_2': 1, 'mlp_size_3': 0, 'kernel': 'Logistic', 'loss_name': 'NLLLoss'}. Best is trial 17 with value: 0.8538600001453517.[0m
[32m[I 2022-04-21 13:11:21,793][0m Trial 35 finished with value: 0.6392037354739802 and parameters: {'n_hidden': 512, 'mixture_components': 9, 'use_sparse_layer': False, 'use_batchnorm': False, 'use_dropout': False, 'mlp_size_1': 5, 'mlp_size_2': 1, 'mlp_size_3': 0, 'kernel': 'Gumbel', 'loss_name': 'AlternativeNLLLoss'}. Best is trial 17 with value: 0.8538600001453517.[0m
[32m[I 2022-04-21 13:13:17,978][0m Trial 36 finished with value: -0.33577856629499897 and parameters: {'n_hidden': 128, 'mixture_components': 8, 'use_sparse_layer': False, 'use_batchnorm': True, 'use_dropout': False, 'mlp_size_1': 3, 'mlp_size_2': 1, 'mlp_size_3': 0, 'kernel': 'Exponential', 'loss_name': 'CensoredNLLLoss'}. Best is trial 17 with value: 0.8538600001453517.[0m
[32m[I 2022-04-21 13:15:58,258][0m Trial 37 finished with value: 0.6356646375790501 and parameters: {'n_hidden': 1024, 'mixture_components': 5, 'use_sparse_layer': True, 'use_sparse_loss': True, 'lmbd': 6.630213784638628e-06, 'use_batchnorm': False, 'use_dropout': True, 'dropout': 0.26561536809314756, 'mlp_size_1': 6, 'mlp_size_2': 1, 'mlp_size_3': 0, 'kernel': 'Normal', 'loss_name': 'CensoredNLLLoss'}. Best is trial 17 with value: 0.8538600001453517.[0m
[32m[I 2022-04-21 13:21:28,318][0m Trial 38 finished with value: 0.7295358443443843 and parameters: {'n_hidden': 512, 'mixture_components': 10, 'use_sparse_layer': False, 'use_batchnorm': True, 'use_dropout': False, 'mlp_size_1': 2, 'mlp_size_2': 4, 'mlp_size_3': 0, 'kernel': 'Logistic', 'loss_name': 'NLLLoss'}. Best is trial 17 with value: 0.8538600001453517.[0m
[32m[I 2022-04-21 13:23:47,905][0m Trial 39 finished with value: 0.842850457791506 and parameters: {'n_hidden': 256, 'mixture_components': 7, 'use_sparse_layer': False, 'use_batchnorm': False, 'use_dropout': False, 'mlp_size_1': 4, 'mlp_size_2': 1, 'mlp_size_3': 0, 'kernel': 'LogLogistic', 'loss_name': 'AlternativeNLLLoss'}. Best is trial 17 with value: 0.8538600001453517.[0m
[32m[I 2022-04-21 13:28:05,581][0m Trial 40 finished with value: 0.42806881867031715 and parameters: {'n_hidden': 2048, 'mixture_components': 6, 'use_sparse_layer': True, 'use_sparse_loss': False, 'use_batchnorm': True, 'use_dropout': True, 'dropout': 0.6044808119255847, 'mlp_size_1': 8, 'mlp_size_2': 0, 'mlp_size_3': 0, 'kernel': 'Normal', 'loss_name': 'CensoredNLLLoss'}. Best is trial 17 with value: 0.8538600001453517.[0m
[32m[I 2022-04-21 13:30:01,579][0m Trial 41 finished with value: 0.8463332955262123 and parameters: {'n_hidden': 512, 'mixture_components': 3, 'use_sparse_layer': False, 'use_batchnorm': False, 'use_dropout': False, 'mlp_size_1': 5, 'mlp_size_2': 1, 'mlp_size_3': 0, 'kernel': 'LogLogistic', 'loss_name': 'AlternativeNLLLoss'}. Best is trial 17 with value: 0.8538600001453517.[0m
[32m[I 2022-04-21 13:31:51,715][0m Trial 42 finished with value: 0.8459722217669009 and parameters: {'n_hidden': 512, 'mixture_components': 3, 'use_sparse_layer': False, 'use_batchnorm': False, 'use_dropout': False, 'mlp_size_1': 5, 'mlp_size_2': 1, 'mlp_size_3': 0, 'kernel': 'LogLogistic', 'loss_name': 'AlternativeNLLLoss'}. Best is trial 17 with value: 0.8538600001453517.[0m
[32m[I 2022-04-21 13:34:15,699][0m Trial 43 finished with value: 0.8404135932532235 and parameters: {'n_hidden': 512, 'mixture_components': 3, 'use_sparse_layer': False, 'use_batchnorm': False, 'use_dropout': False, 'mlp_size_1': 5, 'mlp_size_2': 1, 'mlp_size_3': 0, 'kernel': 'LogLogistic', 'loss_name': 'AlternativeNLLLoss'}. Best is trial 17 with value: 0.8538600001453517.[0m
[32m[I 2022-04-21 13:38:02,325][0m Trial 44 finished with value: 0.746564472529894 and parameters: {'n_hidden': 64, 'mixture_components': 2, 'use_sparse_layer': False, 'use_batchnorm': False, 'use_dropout': False, 'mlp_size_1': 3, 'mlp_size_2': 0, 'mlp_size_3': 0, 'kernel': 'LogLogistic', 'loss_name': 'AlternativeNLLLoss'}. Best is trial 17 with value: 0.8538600001453517.[0m
[32m[I 2022-04-21 13:40:02,099][0m Trial 45 finished with value: 0.8442018173588638 and parameters: {'n_hidden': 512, 'mixture_components': 1, 'use_sparse_layer': False, 'use_batchnorm': False, 'use_dropout': False, 'mlp_size_1': 5, 'mlp_size_2': 1, 'mlp_size_3': 0, 'kernel': 'LogLogistic', 'loss_name': 'AlternativeNLLLoss'}. Best is trial 17 with value: 0.8538600001453517.[0m
[32m[I 2022-04-21 13:42:25,956][0m Trial 46 finished with value: 0.8421235581658504 and parameters: {'n_hidden': 512, 'mixture_components': 3, 'use_sparse_layer': False, 'use_batchnorm': False, 'use_dropout': False, 'mlp_size_1': 6, 'mlp_size_2': 0, 'mlp_size_3': 0, 'kernel': 'LogLogistic', 'loss_name': 'AlternativeNLLLoss'}. Best is trial 17 with value: 0.8538600001453517.[0m
[32m[I 2022-04-21 13:45:37,079][0m Trial 47 finished with value: 0.8434262474734544 and parameters: {'n_hidden': 128, 'mixture_components': 4, 'use_sparse_layer': False, 'use_batchnorm': False, 'use_dropout': False, 'mlp_size_1': 4, 'mlp_size_2': 0, 'mlp_size_3': 0, 'kernel': 'LogLogistic', 'loss_name': 'AlternativeNLLLoss'}. Best is trial 17 with value: 0.8538600001453517.[0m
[32m[I 2022-04-21 13:48:02,252][0m Trial 48 finished with value: 0.8404681217935007 and parameters: {'n_hidden': 2048, 'mixture_components': 2, 'use_sparse_layer': False, 'use_batchnorm': False, 'use_dropout': False, 'mlp_size_1': 7, 'mlp_size_2': 1, 'mlp_size_3': 0, 'kernel': 'LogLogistic', 'loss_name': 'AlternativeNLLLoss'}. Best is trial 17 with value: 0.8538600001453517.[0m
[32m[I 2022-04-21 13:50:40,206][0m Trial 49 finished with value: -0.33416187840032324 and parameters: {'n_hidden': 512, 'mixture_components': 4, 'use_sparse_layer': False, 'use_batchnorm': True, 'use_dropout': True, 'dropout': 0.2811313290065389, 'mlp_size_1': 5, 'mlp_size_2': 1, 'mlp_size_3': 0, 'kernel': 'Exponential', 'loss_name': 'AlternativeNLLLoss'}. Best is trial 17 with value: 0.8538600001453517.[0m
[32m[I 2022-04-21 13:53:08,647][0m Trial 50 finished with value: 0.8240271796521876 and parameters: {'n_hidden': 64, 'mixture_components': 3, 'use_sparse_layer': True, 'use_sparse_loss': True, 'lmbd': 1.2206359402206046e-06, 'use_batchnorm': False, 'use_dropout': False, 'mlp_size_1': 3, 'mlp_size_2': 0, 'mlp_size_3': 0, 'kernel': 'Gumbel', 'loss_name': 'NLLLoss'}. Best is trial 17 with value: 0.8538600001453517.[0m
[32m[I 2022-04-21 13:55:04,588][0m Trial 51 finished with value: 0.7429396195945475 and parameters: {'n_hidden': 512, 'mixture_components': 1, 'use_sparse_layer': False, 'use_batchnorm': False, 'use_dropout': False, 'mlp_size_1': 5, 'mlp_size_2': 1, 'mlp_size_3': 0, 'kernel': 'LogLogistic', 'loss_name': 'AlternativeNLLLoss'}. Best is trial 17 with value: 0.8538600001453517.[0m
[32m[I 2022-04-21 13:56:52,036][0m Trial 52 finished with value: 0.7406815462482724 and parameters: {'n_hidden': 512, 'mixture_components': 1, 'use_sparse_layer': False, 'use_batchnorm': False, 'use_dropout': False, 'mlp_size_1': 5, 'mlp_size_2': 1, 'mlp_size_3': 0, 'kernel': 'LogLogistic', 'loss_name': 'AlternativeNLLLoss'}. Best is trial 17 with value: 0.8538600001453517.[0m
