[32m[I 2022-04-23 03:34:23,955][0m Trial 791 finished with value: 0.6782103438530542 and parameters: {'n_hidden': 1024, 'mixture_components': 8, 'use_sparse_layer': True, 'use_sparse_loss': True, 'lmbd': 2.3232030960390156e-05, 'use_batchnorm': False, 'use_dropout': False, 'mlp_size_1': 6, 'mlp_size_2': 0, 'mlp_size_3': 1, 'kernel': 'Gumbel', 'loss_name': 'AlternativeNLLLoss'}. Best is trial 761 with value: 0.7068620691332198.[0m
[32m[I 2022-04-23 03:35:17,274][0m Trial 792 finished with value: 0.6969975793963485 and parameters: {'n_hidden': 1024, 'mixture_components': 8, 'use_sparse_layer': False, 'use_batchnorm': False, 'use_dropout': False, 'mlp_size_1': 6, 'mlp_size_2': 0, 'mlp_size_3': 1, 'kernel': 'Logistic', 'loss_name': 'CensoredNLLLoss'}. Best is trial 761 with value: 0.7068620691332198.[0m
[32m[I 2022-04-23 03:36:12,912][0m Trial 793 finished with value: 0.6792614316000521 and parameters: {'n_hidden': 1024, 'mixture_components': 8, 'use_sparse_layer': False, 'use_batchnorm': False, 'use_dropout': False, 'mlp_size_1': 6, 'mlp_size_2': 0, 'mlp_size_3': 1, 'kernel': 'Logistic', 'loss_name': 'CensoredNLLLoss'}. Best is trial 761 with value: 0.7068620691332198.[0m
[32m[I 2022-04-23 03:36:59,323][0m Trial 794 finished with value: 0.681193009796562 and parameters: {'n_hidden': 1024, 'mixture_components': 8, 'use_sparse_layer': False, 'use_batchnorm': False, 'use_dropout': False, 'mlp_size_1': 6, 'mlp_size_2': 0, 'mlp_size_3': 1, 'kernel': 'Logistic', 'loss_name': 'CensoredNLLLoss'}. Best is trial 761 with value: 0.7068620691332198.[0m
[32m[I 2022-04-23 03:38:08,921][0m Trial 795 finished with value: 0.6824895535729711 and parameters: {'n_hidden': 512, 'mixture_components': 8, 'use_sparse_layer': False, 'use_batchnorm': False, 'use_dropout': False, 'mlp_size_1': 6, 'mlp_size_2': 0, 'mlp_size_3': 0, 'kernel': 'Logistic', 'loss_name': 'CensoredNLLLoss'}. Best is trial 761 with value: 0.7068620691332198.[0m
[32m[I 2022-04-23 03:39:03,422][0m Trial 796 finished with value: 0.6743756900377699 and parameters: {'n_hidden': 1024, 'mixture_components': 8, 'use_sparse_layer': False, 'use_batchnorm': False, 'use_dropout': True, 'dropout': 0.5719509593701588, 'mlp_size_1': 7, 'mlp_size_2': 0, 'mlp_size_3': 0, 'kernel': 'Logistic', 'loss_name': 'CensoredNLLLoss'}. Best is trial 761 with value: 0.7068620691332198.[0m
[32m[I 2022-04-23 03:39:57,468][0m Trial 797 finished with value: 0.6896581365599073 and parameters: {'n_hidden': 1024, 'mixture_components': 8, 'use_sparse_layer': False, 'use_batchnorm': False, 'use_dropout': False, 'mlp_size_1': 5, 'mlp_size_2': 1, 'mlp_size_3': 1, 'kernel': 'Logistic', 'loss_name': 'CensoredNLLLoss'}. Best is trial 761 with value: 0.7068620691332198.[0m
[32m[I 2022-04-23 03:40:55,562][0m Trial 798 finished with value: 0.6815494041828261 and parameters: {'n_hidden': 1024, 'mixture_components': 8, 'use_sparse_layer': False, 'use_batchnorm': False, 'use_dropout': False, 'mlp_size_1': 6, 'mlp_size_2': 0, 'mlp_size_3': 1, 'kernel': 'Logistic', 'loss_name': 'CensoredNLLLoss'}. Best is trial 761 with value: 0.7068620691332198.[0m
[32m[I 2022-04-23 03:41:58,280][0m Trial 799 finished with value: 0.6804254129833543 and parameters: {'n_hidden': 32, 'mixture_components': 8, 'use_sparse_layer': False, 'use_batchnorm': False, 'use_dropout': False, 'mlp_size_1': 2, 'mlp_size_2': 0, 'mlp_size_3': 0, 'kernel': 'Logistic', 'loss_name': 'CensoredNLLLoss'}. Best is trial 761 with value: 0.7068620691332198.[0m
[32m[I 2022-04-23 03:42:59,918][0m Trial 800 finished with value: 0.6967503443706524 and parameters: {'n_hidden': 2048, 'mixture_components': 9, 'use_sparse_layer': False, 'use_batchnorm': False, 'use_dropout': False, 'mlp_size_1': 8, 'mlp_size_2': 0, 'mlp_size_3': 0, 'kernel': 'Logistic', 'loss_name': 'CensoredNLLLoss'}. Best is trial 761 with value: 0.7068620691332198.[0m
[32m[I 2022-04-23 03:44:58,885][0m Trial 801 finished with value: 0.6565335726693143 and parameters: {'n_hidden': 2048, 'mixture_components': 9, 'use_sparse_layer': False, 'use_batchnorm': True, 'use_dropout': False, 'mlp_size_1': 8, 'mlp_size_2': 0, 'mlp_size_3': 0, 'kernel': 'Logistic', 'loss_name': 'CensoredNLLLoss'}. Best is trial 761 with value: 0.7068620691332198.[0m
[32m[I 2022-04-23 03:45:52,835][0m Trial 802 finished with value: 0.673895003605894 and parameters: {'n_hidden': 2048, 'mixture_components': 9, 'use_sparse_layer': False, 'use_batchnorm': False, 'use_dropout': False, 'mlp_size_1': 7, 'mlp_size_2': 0, 'mlp_size_3': 1, 'kernel': 'Logistic', 'loss_name': 'CensoredNLLLoss'}. Best is trial 761 with value: 0.7068620691332198.[0m
[32m[I 2022-04-23 03:46:59,989][0m Trial 803 finished with value: 0.6910209581957079 and parameters: {'n_hidden': 2048, 'mixture_components': 9, 'use_sparse_layer': True, 'use_sparse_loss': False, 'use_batchnorm': False, 'use_dropout': False, 'mlp_size_1': 8, 'mlp_size_2': 0, 'mlp_size_3': 0, 'kernel': 'Logistic', 'loss_name': 'CensoredNLLLoss'}. Best is trial 761 with value: 0.7068620691332198.[0m
[32m[I 2022-04-23 03:47:55,285][0m Trial 804 finished with value: 0.6795342433237548 and parameters: {'n_hidden': 128, 'mixture_components': 9, 'use_sparse_layer': False, 'use_batchnorm': False, 'use_dropout': False, 'mlp_size_1': 4, 'mlp_size_2': 0, 'mlp_size_3': 0, 'kernel': 'Logistic', 'loss_name': 'CensoredNLLLoss'}. Best is trial 761 with value: 0.7068620691332198.[0m
[32m[I 2022-04-23 03:48:49,754][0m Trial 805 finished with value: 0.684901004281382 and parameters: {'n_hidden': 2048, 'mixture_components': 9, 'use_sparse_layer': False, 'use_batchnorm': False, 'use_dropout': False, 'mlp_size_1': 8, 'mlp_size_2': 0, 'mlp_size_3': 0, 'kernel': 'Logistic', 'loss_name': 'CensoredNLLLoss'}. Best is trial 761 with value: 0.7068620691332198.[0m
[32m[I 2022-04-23 03:49:59,968][0m Trial 806 finished with value: 0.6867569093976682 and parameters: {'n_hidden': 2048, 'mixture_components': 9, 'use_sparse_layer': False, 'use_batchnorm': False, 'use_dropout': False, 'mlp_size_1': 7, 'mlp_size_2': 0, 'mlp_size_3': 1, 'kernel': 'Logistic', 'loss_name': 'CensoredNLLLoss'}. Best is trial 761 with value: 0.7068620691332198.[0m
[32m[I 2022-04-23 03:50:46,920][0m Trial 807 finished with value: 0.6025569329802628 and parameters: {'n_hidden': 2048, 'mixture_components': 9, 'use_sparse_layer': False, 'use_batchnorm': False, 'use_dropout': False, 'mlp_size_1': 8, 'mlp_size_2': 0, 'mlp_size_3': 0, 'kernel': 'Gumbel', 'loss_name': 'CensoredNLLLoss'}. Best is trial 761 with value: 0.7068620691332198.[0m
[32m[I 2022-04-23 03:51:52,337][0m Trial 808 finished with value: 0.682543888617118 and parameters: {'n_hidden': 2048, 'mixture_components': 9, 'use_sparse_layer': False, 'use_batchnorm': False, 'use_dropout': False, 'mlp_size_1': 8, 'mlp_size_2': 0, 'mlp_size_3': 0, 'kernel': 'Logistic', 'loss_name': 'CensoredNLLLoss'}. Best is trial 761 with value: 0.7068620691332198.[0m
[32m[I 2022-04-23 03:52:34,515][0m Trial 809 finished with value: 0.6895610235891797 and parameters: {'n_hidden': 512, 'mixture_components': 9, 'use_sparse_layer': False, 'use_batchnorm': False, 'use_dropout': False, 'mlp_size_1': 6, 'mlp_size_2': 0, 'mlp_size_3': 0, 'kernel': 'Logistic', 'loss_name': 'CensoredNLLLoss'}. Best is trial 761 with value: 0.7068620691332198.[0m
[32m[I 2022-04-23 03:53:19,835][0m Trial 810 finished with value: 0.6738361246540421 and parameters: {'n_hidden': 2048, 'mixture_components': 9, 'use_sparse_layer': False, 'use_batchnorm': False, 'use_dropout': False, 'mlp_size_1': 8, 'mlp_size_2': 0, 'mlp_size_3': 0, 'kernel': 'Gumbel', 'loss_name': 'CensoredNLLLoss'}. Best is trial 761 with value: 0.7068620691332198.[0m
[32m[I 2022-04-23 03:53:57,812][0m Trial 811 finished with value: -0.6641922210698085 and parameters: {'n_hidden': 2048, 'mixture_components': 9, 'use_sparse_layer': False, 'use_batchnorm': False, 'use_dropout': False, 'mlp_size_1': 8, 'mlp_size_2': 0, 'mlp_size_3': 0, 'kernel': 'Exponential', 'loss_name': 'CensoredNLLLoss'}. Best is trial 761 with value: 0.7068620691332198.[0m
[32m[I 2022-04-23 03:54:51,568][0m Trial 812 finished with value: 0.6819092841318776 and parameters: {'n_hidden': 2048, 'mixture_components': 9, 'use_sparse_layer': False, 'use_batchnorm': False, 'use_dropout': False, 'mlp_size_1': 8, 'mlp_size_2': 0, 'mlp_size_3': 0, 'kernel': 'Logistic', 'loss_name': 'CensoredNLLLoss'}. Best is trial 761 with value: 0.7068620691332198.[0m
[32m[I 2022-04-23 03:55:38,713][0m Trial 813 finished with value: 0.6716692311732929 and parameters: {'n_hidden': 2048, 'mixture_components': 7, 'use_sparse_layer': False, 'use_batchnorm': False, 'use_dropout': False, 'mlp_size_1': 8, 'mlp_size_2': 0, 'mlp_size_3': 0, 'kernel': 'Logistic', 'loss_name': 'NLLLoss'}. Best is trial 761 with value: 0.7068620691332198.[0m
[32m[I 2022-04-23 03:56:30,869][0m Trial 814 finished with value: 0.607731290773318 and parameters: {'n_hidden': 2048, 'mixture_components': 9, 'use_sparse_layer': True, 'use_sparse_loss': True, 'lmbd': 0.01798104633369175, 'use_batchnorm': False, 'use_dropout': True, 'dropout': 0.4629309571969055, 'mlp_size_1': 8, 'mlp_size_2': 0, 'mlp_size_3': 0, 'kernel': 'Gumbel', 'loss_name': 'CensoredNLLLoss'}. Best is trial 761 with value: 0.7068620691332198.[0m
[32m[I 2022-04-23 03:57:22,821][0m Trial 815 finished with value: 0.6814285811912741 and parameters: {'n_hidden': 64, 'mixture_components': 7, 'use_sparse_layer': False, 'use_batchnorm': False, 'use_dropout': False, 'mlp_size_1': 3, 'mlp_size_2': 0, 'mlp_size_3': 0, 'kernel': 'Logistic', 'loss_name': 'CensoredNLLLoss'}. Best is trial 761 with value: 0.7068620691332198.[0m
[32m[I 2022-04-23 03:58:19,854][0m Trial 816 finished with value: 0.6743425199454596 and parameters: {'n_hidden': 2048, 'mixture_components': 9, 'use_sparse_layer': False, 'use_batchnorm': False, 'use_dropout': False, 'mlp_size_1': 8, 'mlp_size_2': 0, 'mlp_size_3': 0, 'kernel': 'Logistic', 'loss_name': 'CensoredNLLLoss'}. Best is trial 761 with value: 0.7068620691332198.[0m
[32m[I 2022-04-23 03:59:45,987][0m Trial 817 finished with value: 0.6673432099258332 and parameters: {'n_hidden': 2048, 'mixture_components': 8, 'use_sparse_layer': False, 'use_batchnorm': False, 'use_dropout': False, 'mlp_size_1': 8, 'mlp_size_2': 0, 'mlp_size_3': 0, 'kernel': 'Logistic', 'loss_name': 'CensoredNLLLoss'}. Best is trial 761 with value: 0.7068620691332198.[0m
[32m[I 2022-04-23 04:00:49,055][0m Trial 818 finished with value: 0.6819917836349478 and parameters: {'n_hidden': 256, 'mixture_components': 7, 'use_sparse_layer': False, 'use_batchnorm': False, 'use_dropout': False, 'mlp_size_1': 5, 'mlp_size_2': 0, 'mlp_size_3': 0, 'kernel': 'Gumbel', 'loss_name': 'CensoredNLLLoss'}. Best is trial 761 with value: 0.7068620691332198.[0m
[32m[I 2022-04-23 04:02:30,496][0m Trial 819 finished with value: 0.649491766023479 and parameters: {'n_hidden': 1024, 'mixture_components': 8, 'use_sparse_layer': False, 'use_batchnorm': True, 'use_dropout': False, 'mlp_size_1': 7, 'mlp_size_2': 0, 'mlp_size_3': 0, 'kernel': 'Logistic', 'loss_name': 'CensoredNLLLoss'}. Best is trial 761 with value: 0.7068620691332198.[0m
[32m[I 2022-04-23 04:03:20,090][0m Trial 820 finished with value: 0.6874379916516945 and parameters: {'n_hidden': 1024, 'mixture_components': 8, 'use_sparse_layer': False, 'use_batchnorm': False, 'use_dropout': False, 'mlp_size_1': 7, 'mlp_size_2': 0, 'mlp_size_3': 0, 'kernel': 'Logistic', 'loss_name': 'NLLLoss'}. Best is trial 761 with value: 0.7068620691332198.[0m
[32m[I 2022-04-23 04:04:04,367][0m Trial 821 finished with value: 0.6796856791178286 and parameters: {'n_hidden': 1024, 'mixture_components': 9, 'use_sparse_layer': False, 'use_batchnorm': False, 'use_dropout': False, 'mlp_size_1': 7, 'mlp_size_2': 0, 'mlp_size_3': 0, 'kernel': 'Gumbel', 'loss_name': 'CensoredNLLLoss'}. Best is trial 761 with value: 0.7068620691332198.[0m
[32m[I 2022-04-23 04:04:57,107][0m Trial 822 finished with value: 0.6734475745320172 and parameters: {'n_hidden': 1024, 'mixture_components': 8, 'use_sparse_layer': False, 'use_batchnorm': False, 'use_dropout': False, 'mlp_size_1': 7, 'mlp_size_2': 0, 'mlp_size_3': 0, 'kernel': 'Logistic', 'loss_name': 'CensoredNLLLoss'}. Best is trial 761 with value: 0.7068620691332198.[0m
[32m[I 2022-04-23 04:06:07,651][0m Trial 823 finished with value: 0.6886386166584209 and parameters: {'n_hidden': 2048, 'mixture_components': 8, 'use_sparse_layer': False, 'use_batchnorm': False, 'use_dropout': False, 'mlp_size_1': 8, 'mlp_size_2': 0, 'mlp_size_3': 0, 'kernel': 'Logistic', 'loss_name': 'CensoredNLLLoss'}. Best is trial 761 with value: 0.7068620691332198.[0m
[32m[I 2022-04-23 04:07:07,236][0m Trial 824 finished with value: 0.6892139928398928 and parameters: {'n_hidden': 1024, 'mixture_components': 1, 'use_sparse_layer': False, 'use_batchnorm': False, 'use_dropout': False, 'mlp_size_1': 6, 'mlp_size_2': 0, 'mlp_size_3': 1, 'kernel': 'Gumbel', 'loss_name': 'CensoredNLLLoss'}. Best is trial 761 with value: 0.7068620691332198.[0m
[32m[I 2022-04-23 04:07:54,895][0m Trial 825 finished with value: 0.6926791817425497 and parameters: {'n_hidden': 1024, 'mixture_components': 8, 'use_sparse_layer': False, 'use_batchnorm': False, 'use_dropout': False, 'mlp_size_1': 6, 'mlp_size_2': 0, 'mlp_size_3': 1, 'kernel': 'Logistic', 'loss_name': 'CensoredNLLLoss'}. Best is trial 761 with value: 0.7068620691332198.[0m
[32m[I 2022-04-23 04:08:35,592][0m Trial 826 finished with value: 0.6846750274012834 and parameters: {'n_hidden': 512, 'mixture_components': 7, 'use_sparse_layer': False, 'use_batchnorm': False, 'use_dropout': False, 'mlp_size_1': 6, 'mlp_size_2': 0, 'mlp_size_3': 0, 'kernel': 'Logistic', 'loss_name': 'CensoredNLLLoss'}. Best is trial 761 with value: 0.7068620691332198.[0m
[32m[I 2022-04-23 04:09:21,070][0m Trial 827 finished with value: 0.636382939942709 and parameters: {'n_hidden': 1024, 'mixture_components': 9, 'use_sparse_layer': True, 'use_sparse_loss': True, 'lmbd': 0.00019271016073818295, 'use_batchnorm': False, 'use_dropout': False, 'mlp_size_1': 7, 'mlp_size_2': 0, 'mlp_size_3': 0, 'kernel': 'Gumbel', 'loss_name': 'CensoredNLLLoss'}. Best is trial 761 with value: 0.7068620691332198.[0m
[32m[I 2022-04-23 04:10:07,545][0m Trial 828 finished with value: 0.6738113051475159 and parameters: {'n_hidden': 1024, 'mixture_components': 8, 'use_sparse_layer': False, 'use_batchnorm': False, 'use_dropout': False, 'mlp_size_1': 6, 'mlp_size_2': 0, 'mlp_size_3': 1, 'kernel': 'Logistic', 'loss_name': 'CensoredNLLLoss'}. Best is trial 761 with value: 0.7068620691332198.[0m
[32m[I 2022-04-23 04:10:36,207][0m Trial 829 finished with value: -0.6643718530581058 and parameters: {'n_hidden': 1024, 'mixture_components': 8, 'use_sparse_layer': False, 'use_batchnorm': False, 'use_dropout': False, 'mlp_size_1': 6, 'mlp_size_2': 0, 'mlp_size_3': 1, 'kernel': 'Exponential', 'loss_name': 'CensoredNLLLoss'}. Best is trial 761 with value: 0.7068620691332198.[0m
[32m[I 2022-04-23 04:11:41,977][0m Trial 830 finished with value: 0.671640126769583 and parameters: {'n_hidden': 32, 'mixture_components': 7, 'use_sparse_layer': False, 'use_batchnorm': False, 'use_dropout': False, 'mlp_size_1': 2, 'mlp_size_2': 0, 'mlp_size_3': 0, 'kernel': 'Logistic', 'loss_name': 'CensoredNLLLoss'}. Best is trial 761 with value: 0.7068620691332198.[0m
[32m[I 2022-04-23 04:12:37,542][0m Trial 831 finished with value: 0.6689936583605441 and parameters: {'n_hidden': 1024, 'mixture_components': 9, 'use_sparse_layer': False, 'use_batchnorm': False, 'use_dropout': False, 'mlp_size_1': 7, 'mlp_size_2': 0, 'mlp_size_3': 0, 'kernel': 'Logistic', 'loss_name': 'CensoredNLLLoss'}. Best is trial 761 with value: 0.7068620691332198.[0m
[32m[I 2022-04-23 04:13:17,291][0m Trial 832 finished with value: 0.6736575098666594 and parameters: {'n_hidden': 1024, 'mixture_components': 8, 'use_sparse_layer': False, 'use_batchnorm': False, 'use_dropout': False, 'mlp_size_1': 6, 'mlp_size_2': 0, 'mlp_size_3': 1, 'kernel': 'Gumbel', 'loss_name': 'CensoredNLLLoss'}. Best is trial 761 with value: 0.7068620691332198.[0m
[32m[I 2022-04-23 04:14:01,032][0m Trial 833 finished with value: 0.6260981170734029 and parameters: {'n_hidden': 1024, 'mixture_components': 8, 'use_sparse_layer': False, 'use_batchnorm': False, 'use_dropout': True, 'dropout': 0.3800641350915044, 'mlp_size_1': 6, 'mlp_size_2': 0, 'mlp_size_3': 1, 'kernel': 'Logistic', 'loss_name': 'CensoredNLLLoss'}. Best is trial 761 with value: 0.7068620691332198.[0m
[32m[I 2022-04-23 04:14:58,621][0m Trial 834 finished with value: 0.65414420204803 and parameters: {'n_hidden': 2048, 'mixture_components': 8, 'use_sparse_layer': False, 'use_batchnorm': False, 'use_dropout': False, 'mlp_size_1': 8, 'mlp_size_2': 0, 'mlp_size_3': 0, 'kernel': 'LogLogistic', 'loss_name': 'CensoredNLLLoss'}. Best is trial 761 with value: 0.7068620691332198.[0m
[32m[I 2022-04-23 04:16:03,416][0m Trial 835 finished with value: 0.6752311300773606 and parameters: {'n_hidden': 1024, 'mixture_components': 8, 'use_sparse_layer': False, 'use_batchnorm': False, 'use_dropout': False, 'mlp_size_1': 6, 'mlp_size_2': 0, 'mlp_size_3': 1, 'kernel': 'Logistic', 'loss_name': 'CensoredNLLLoss'}. Best is trial 761 with value: 0.7068620691332198.[0m
[32m[I 2022-04-23 04:16:46,464][0m Trial 836 finished with value: 0.6789952646079546 and parameters: {'n_hidden': 1024, 'mixture_components': 9, 'use_sparse_layer': False, 'use_batchnorm': False, 'use_dropout': False, 'mlp_size_1': 6, 'mlp_size_2': 0, 'mlp_size_3': 1, 'kernel': 'Gumbel', 'loss_name': 'CensoredNLLLoss'}. Best is trial 761 with value: 0.7068620691332198.[0m
[32m[I 2022-04-23 04:17:45,307][0m Trial 837 finished with value: 0.6839640248426389 and parameters: {'n_hidden': 128, 'mixture_components': 7, 'use_sparse_layer': True, 'use_sparse_loss': False, 'use_batchnorm': False, 'use_dropout': False, 'mlp_size_1': 4, 'mlp_size_2': 0, 'mlp_size_3': 0, 'kernel': 'Logistic', 'loss_name': 'CensoredNLLLoss'}. Best is trial 761 with value: 0.7068620691332198.[0m
[32m[I 2022-04-23 04:19:31,529][0m Trial 838 finished with value: 0.6675309962503498 and parameters: {'n_hidden': 1024, 'mixture_components': 5, 'use_sparse_layer': False, 'use_batchnorm': True, 'use_dropout': False, 'mlp_size_1': 6, 'mlp_size_2': 0, 'mlp_size_3': 1, 'kernel': 'Logistic', 'loss_name': 'CensoredNLLLoss'}. Best is trial 761 with value: 0.7068620691332198.[0m
[32m[I 2022-04-23 04:21:05,725][0m Trial 839 finished with value: 0.6749187521163005 and parameters: {'n_hidden': 1024, 'mixture_components': 1, 'use_sparse_layer': False, 'use_batchnorm': False, 'use_dropout': False, 'mlp_size_1': 6, 'mlp_size_2': 0, 'mlp_size_3': 1, 'kernel': 'Gumbel', 'loss_name': 'CensoredNLLLoss'}. Best is trial 761 with value: 0.7068620691332198.[0m
[32m[I 2022-04-23 04:21:55,681][0m Trial 840 finished with value: 0.6884658217694086 and parameters: {'n_hidden': 1024, 'mixture_components': 8, 'use_sparse_layer': False, 'use_batchnorm': False, 'use_dropout': False, 'mlp_size_1': 7, 'mlp_size_2': 0, 'mlp_size_3': 0, 'kernel': 'Logistic', 'loss_name': 'CensoredNLLLoss'}. Best is trial 761 with value: 0.7068620691332198.[0m
[32m[I 2022-04-23 04:22:58,212][0m Trial 841 finished with value: 0.6747230120991162 and parameters: {'n_hidden': 512, 'mixture_components': 8, 'use_sparse_layer': False, 'use_batchnorm': False, 'use_dropout': False, 'mlp_size_1': 6, 'mlp_size_2': 0, 'mlp_size_3': 0, 'kernel': 'Logistic', 'loss_name': 'CensoredNLLLoss'}. Best is trial 761 with value: 0.7068620691332198.[0m
[32m[I 2022-04-23 04:23:43,333][0m Trial 842 finished with value: 0.6830469177083895 and parameters: {'n_hidden': 1024, 'mixture_components': 8, 'use_sparse_layer': False, 'use_batchnorm': False, 'use_dropout': False, 'mlp_size_1': 6, 'mlp_size_2': 0, 'mlp_size_3': 1, 'kernel': 'Logistic', 'loss_name': 'CensoredNLLLoss'}. Best is trial 761 with value: 0.7068620691332198.[0m
[32m[I 2022-04-23 04:24:23,239][0m Trial 843 finished with value: 0.6752547926033696 and parameters: {'n_hidden': 1024, 'mixture_components': 9, 'use_sparse_layer': False, 'use_batchnorm': False, 'use_dropout': False, 'mlp_size_1': 6, 'mlp_size_2': 0, 'mlp_size_3': 1, 'kernel': 'Gumbel', 'loss_name': 'CensoredNLLLoss'}. Best is trial 761 with value: 0.7068620691332198.[0m
[32m[I 2022-04-23 04:25:13,476][0m Trial 844 finished with value: 0.6702916355017738 and parameters: {'n_hidden': 64, 'mixture_components': 7, 'use_sparse_layer': False, 'use_batchnorm': False, 'use_dropout': False, 'mlp_size_1': 3, 'mlp_size_2': 0, 'mlp_size_3': 0, 'kernel': 'LogLogistic', 'loss_name': 'NLLLoss'}. Best is trial 761 with value: 0.7068620691332198.[0m
[32m[I 2022-04-23 04:25:51,121][0m Trial 845 finished with value: 0.6749768553100708 and parameters: {'n_hidden': 256, 'mixture_components': 8, 'use_sparse_layer': False, 'use_batchnorm': False, 'use_dropout': False, 'mlp_size_1': 5, 'mlp_size_2': 0, 'mlp_size_3': 0, 'kernel': 'Logistic', 'loss_name': 'NLLLoss'}. Best is trial 761 with value: 0.7068620691332198.[0m
[32m[I 2022-04-23 04:26:44,591][0m Trial 846 finished with value: 0.6489262336166837 and parameters: {'n_hidden': 1024, 'mixture_components': 8, 'use_sparse_layer': False, 'use_batchnorm': False, 'use_dropout': False, 'mlp_size_1': 7, 'mlp_size_2': 0, 'mlp_size_3': 0, 'kernel': 'Logistic', 'loss_name': 'AlternativeNLLLoss'}. Best is trial 761 with value: 0.7068620691332198.[0m
[32m[I 2022-04-23 04:27:43,215][0m Trial 847 finished with value: 0.598734574764891 and parameters: {'n_hidden': 2048, 'mixture_components': 8, 'use_sparse_layer': False, 'use_batchnorm': False, 'use_dropout': False, 'mlp_size_1': 8, 'mlp_size_2': 0, 'mlp_size_3': 0, 'kernel': 'Gumbel', 'loss_name': 'CensoredNLLLoss'}. Best is trial 761 with value: 0.7068620691332198.[0m
