[32m[I 2022-04-21 20:33:37,121][0m Trial 849 finished with value: 0.8483222039511087 and parameters: {'loss': 'coxph', 'learning_rate': 0.0004973106398904398, 'n_estimators': 264, 'criterion': 'friedman_mse', 'min_samples_split': 2, 'min_samples_leaf': 1, 'min_weight_fraction_leaf': 0.06184004477576362, 'min_impurity_decrease': 0.17697564183368036, 'max_features': 0.03168610422192739, 'subsample': 0.023458118250571633, 'dropout_rate': 0.9957228140513802, 'ccp_alpha': 0.21266467393938093}. Best is trial 802 with value: 0.8492679411913457.[0m
[32m[I 2022-04-21 20:33:39,486][0m Trial 850 finished with value: 0.65 and parameters: {'loss': 'coxph', 'learning_rate': 0.0005104801817649734, 'n_estimators': 260, 'criterion': 'friedman_mse', 'min_samples_split': 2, 'min_samples_leaf': 1, 'min_weight_fraction_leaf': 0.08688156364919015, 'min_impurity_decrease': 0.18723539375774295, 'max_features': 0.028449212557867087, 'subsample': 0.012100443591983333, 'dropout_rate': 0.9998414084845757, 'ccp_alpha': 0.5020087292596876}. Best is trial 802 with value: 0.8492679411913457.[0m
[32m[I 2022-04-21 20:33:44,456][0m Trial 851 finished with value: 0.65 and parameters: {'loss': 'coxph', 'learning_rate': 0.0005304375441395294, 'n_estimators': 250, 'criterion': 'friedman_mse', 'min_samples_split': 2, 'min_samples_leaf': 1, 'min_weight_fraction_leaf': 0.04127619147862263, 'min_impurity_decrease': 0.18307396751032148, 'max_features': 0.015494674025494912, 'subsample': 0.004172419019520864, 'dropout_rate': 0.9609759721145587, 'ccp_alpha': 0.2794856700920078}. Best is trial 802 with value: 0.8492679411913457.[0m
/media/san2_ssd/data/Workdir/survival/venv/lib/python3.8/site-packages/sksurv/ensemble/boosting.py:955: RuntimeWarning: divide by zero encountered in log
  time = numpy.log(time)
/media/san2_ssd/data/Workdir/survival/venv/lib/python3.8/site-packages/sksurv/ensemble/boosting.py:955: RuntimeWarning: divide by zero encountered in log
  time = numpy.log(time)
/media/san2_ssd/data/Workdir/survival/venv/lib/python3.8/site-packages/sksurv/ensemble/boosting.py:955: RuntimeWarning: divide by zero encountered in log
  time = numpy.log(time)
/media/san2_ssd/data/Workdir/survival/venv/lib/python3.8/site-packages/sksurv/ensemble/boosting.py:955: RuntimeWarning: divide by zero encountered in log
  time = numpy.log(time)
[32m[I 2022-04-21 20:33:45,332][0m Trial 852 finished with value: -0.45 and parameters: {'loss': 'squared', 'learning_rate': 0.0004328550910161522, 'n_estimators': 269, 'criterion': 'friedman_mse', 'min_samples_split': 2, 'min_samples_leaf': 8, 'min_weight_fraction_leaf': 0.05211547906291659, 'min_impurity_decrease': 0.20605395046633096, 'max_features': 0.02683061090334623, 'subsample': 0.020562610840200363, 'dropout_rate': 0.9812056908002266, 'ccp_alpha': 0.18715692229954256}. Best is trial 802 with value: 0.8492679411913457.[0m
[32m[I 2022-04-21 20:33:50,653][0m Trial 853 finished with value: 0.8458998705107676 and parameters: {'loss': 'coxph', 'learning_rate': 0.0004276237592611363, 'n_estimators': 268, 'criterion': 'friedman_mse', 'min_samples_split': 2, 'min_samples_leaf': 1, 'min_weight_fraction_leaf': 0.07098361148378124, 'min_impurity_decrease': 0.16454688622558886, 'max_features': 0.057709612958563264, 'subsample': 0.027316419186390835, 'dropout_rate': 0.9243004678070093, 'ccp_alpha': 0.2885850014407369}. Best is trial 802 with value: 0.8492679411913457.[0m
[32m[I 2022-04-21 20:33:57,010][0m Trial 854 finished with value: 0.65 and parameters: {'loss': 'coxph', 'learning_rate': 0.0005509991988373704, 'n_estimators': 284, 'criterion': 'friedman_mse', 'min_samples_split': 2, 'min_samples_leaf': 1, 'min_weight_fraction_leaf': 0.06436546501233126, 'min_impurity_decrease': 0.1955571521029609, 'max_features': 0.0037973726440725802, 'subsample': 0.0015167213195676696, 'dropout_rate': 0.952233474861148, 'ccp_alpha': 0.16426927146506026}. Best is trial 802 with value: 0.8492679411913457.[0m
[32m[I 2022-04-21 20:34:00,385][0m Trial 855 finished with value: 0.8438825458457977 and parameters: {'loss': 'coxph', 'learning_rate': 0.00035619195319157255, 'n_estimators': 254, 'criterion': 'friedman_mse', 'min_samples_split': 2, 'min_samples_leaf': 1, 'min_weight_fraction_leaf': 0.06449409315537358, 'min_impurity_decrease': 0.21935308487354294, 'max_features': 0.10254613642648647, 'subsample': 0.03262792672921462, 'dropout_rate': 0.9992659394586406, 'ccp_alpha': 0.3707327323896986}. Best is trial 802 with value: 0.8492679411913457.[0m
[32m[I 2022-04-21 20:34:03,171][0m Trial 856 finished with value: 0.8430627897355985 and parameters: {'loss': 'coxph', 'learning_rate': 0.00037147157467851935, 'n_estimators': 180, 'criterion': 'friedman_mse', 'min_samples_split': 2, 'min_samples_leaf': 1, 'min_weight_fraction_leaf': 0.05451071886826832, 'min_impurity_decrease': 0.1774858668658118, 'max_features': 0.05583497277862432, 'subsample': 0.04016942632261256, 'dropout_rate': 0.9721690004838154, 'ccp_alpha': 0.1854821623965543}. Best is trial 802 with value: 0.8492679411913457.[0m
[32m[I 2022-04-21 20:34:07,272][0m Trial 857 finished with value: 0.65 and parameters: {'loss': 'coxph', 'learning_rate': 0.0005030705967711233, 'n_estimators': 263, 'criterion': 'friedman_mse', 'min_samples_split': 2, 'min_samples_leaf': 1, 'min_weight_fraction_leaf': 0.06411962391697693, 'min_impurity_decrease': 0.15127535762273364, 'max_features': 0.08501667489012173, 'subsample': 0.0015004578036051305, 'dropout_rate': 0.9998539323055613, 'ccp_alpha': 0.24513074730349588}. Best is trial 802 with value: 0.8492679411913457.[0m
[32m[I 2022-04-21 20:34:12,469][0m Trial 858 finished with value: 0.8435538123364479 and parameters: {'loss': 'coxph', 'learning_rate': 0.0003225678005310667, 'n_estimators': 281, 'criterion': 'friedman_mse', 'min_samples_split': 2, 'min_samples_leaf': 1, 'min_weight_fraction_leaf': 0.09132792967382093, 'min_impurity_decrease': 0.19853617681575103, 'max_features': 0.04500077643851212, 'subsample': 0.02563096397348541, 'dropout_rate': 0.9465518296986961, 'ccp_alpha': 0.5494116058485626}. Best is trial 802 with value: 0.8492679411913457.[0m
[32m[I 2022-04-21 20:34:14,876][0m Trial 859 finished with value: 0.8473874411933775 and parameters: {'loss': 'coxph', 'learning_rate': 0.0004136383121122704, 'n_estimators': 250, 'criterion': 'friedman_mse', 'min_samples_split': 2, 'min_samples_leaf': 1, 'min_weight_fraction_leaf': 0.07714186905188564, 'min_impurity_decrease': 0.17302846141599726, 'max_features': 0.07325944562303781, 'subsample': 0.04558503888400469, 'dropout_rate': 0.9790602071906926, 'ccp_alpha': 0.13416351903359217}. Best is trial 802 with value: 0.8492679411913457.[0m
[32m[I 2022-04-21 20:34:17,738][0m Trial 860 finished with value: 0.845023850547755 and parameters: {'loss': 'coxph', 'learning_rate': 0.0005994352391890577, 'n_estimators': 248, 'criterion': 'friedman_mse', 'min_samples_split': 2, 'min_samples_leaf': 1, 'min_weight_fraction_leaf': 0.07431944789853788, 'min_impurity_decrease': 0.16738461016741651, 'max_features': 0.09390385976222887, 'subsample': 0.02200895679295163, 'dropout_rate': 0.9770346281517038, 'ccp_alpha': 0.36819991665984053}. Best is trial 802 with value: 0.8492679411913457.[0m
[32m[I 2022-04-21 20:34:21,058][0m Trial 861 finished with value: 0.8429892654198365 and parameters: {'loss': 'coxph', 'learning_rate': 0.0004293166454413256, 'n_estimators': 272, 'criterion': 'friedman_mse', 'min_samples_split': 2, 'min_samples_leaf': 1, 'min_weight_fraction_leaf': 0.07939440757521278, 'min_impurity_decrease': 0.17650881786437447, 'max_features': 0.07062926972001501, 'subsample': 0.0394577995473674, 'dropout_rate': 0.9681035248466997, 'ccp_alpha': 0.31017997584063295}. Best is trial 802 with value: 0.8492679411913457.[0m
[32m[I 2022-04-21 20:34:24,258][0m Trial 862 finished with value: 0.8467144369761455 and parameters: {'loss': 'coxph', 'learning_rate': 0.0005462107017693862, 'n_estimators': 260, 'criterion': 'squared_error', 'min_samples_split': 2, 'min_samples_leaf': 1, 'min_weight_fraction_leaf': 0.09339171560161288, 'min_impurity_decrease': 0.15110908545715812, 'max_features': 0.037195286133958394, 'subsample': 0.04611970955814574, 'dropout_rate': 0.9217377545428376, 'ccp_alpha': 0.2102719830489143}. Best is trial 802 with value: 0.8492679411913457.[0m
[32m[I 2022-04-21 20:34:27,791][0m Trial 863 finished with value: 0.8391464851922074 and parameters: {'loss': 'coxph', 'learning_rate': 0.0004120212070592997, 'n_estimators': 288, 'criterion': 'friedman_mse', 'min_samples_split': 2, 'min_samples_leaf': 1, 'min_weight_fraction_leaf': 0.06784952885355172, 'min_impurity_decrease': 0.19134196277828244, 'max_features': 0.07110606428472002, 'subsample': 0.017498170615397875, 'dropout_rate': 0.9821445994113222, 'ccp_alpha': 0.4395934140940568}. Best is trial 802 with value: 0.8492679411913457.[0m
[32m[I 2022-04-21 20:34:32,246][0m Trial 864 finished with value: 0.65 and parameters: {'loss': 'coxph', 'learning_rate': 0.0003630734600211714, 'n_estimators': 273, 'criterion': 'friedman_mse', 'min_samples_split': 2, 'min_samples_leaf': 1, 'min_weight_fraction_leaf': 0.09152594296560006, 'min_impurity_decrease': 0.21595113487786022, 'max_features': 0.10881506647986132, 'subsample': 0.0015760715509017253, 'dropout_rate': 0.9515347674202277, 'ccp_alpha': 0.16384260452899158}. Best is trial 802 with value: 0.8492679411913457.[0m
[32m[I 2022-04-21 20:34:34,464][0m Trial 865 finished with value: 0.8455788316513602 and parameters: {'loss': 'coxph', 'learning_rate': 0.0005242628362835384, 'n_estimators': 247, 'criterion': 'friedman_mse', 'min_samples_split': 2, 'min_samples_leaf': 1, 'min_weight_fraction_leaf': 0.058612582928561835, 'min_impurity_decrease': 0.17366409084578177, 'max_features': 0.0516869583068129, 'subsample': 0.047829986583960524, 'dropout_rate': 0.980816892394142, 'ccp_alpha': 0.3065793550364794}. Best is trial 802 with value: 0.8492679411913457.[0m
[32m[I 2022-04-21 20:34:38,100][0m Trial 866 finished with value: 0.8459269825690269 and parameters: {'loss': 'coxph', 'learning_rate': 0.00033190576179874953, 'n_estimators': 291, 'criterion': 'absolute_error', 'min_samples_split': 2, 'min_samples_leaf': 1, 'min_weight_fraction_leaf': 0.060842704508354384, 'min_impurity_decrease': 0.1505243166866675, 'max_features': 0.1203035662303053, 'subsample': 0.030584647548464933, 'dropout_rate': 0.959656082479005, 'ccp_alpha': 0.17195103781514162}. Best is trial 802 with value: 0.8492679411913457.[0m
[32m[I 2022-04-21 20:34:40,456][0m Trial 867 finished with value: 0.8452723718692781 and parameters: {'loss': 'coxph', 'learning_rate': 0.0004541622635068521, 'n_estimators': 265, 'criterion': 'friedman_mse', 'min_samples_split': 2, 'min_samples_leaf': 1, 'min_weight_fraction_leaf': 0.04248698649112555, 'min_impurity_decrease': 0.2217743716204599, 'max_features': 0.03208481144169064, 'subsample': 0.04532170218852882, 'dropout_rate': 0.9983446839733906, 'ccp_alpha': 0.26931002056270864}. Best is trial 802 with value: 0.8492679411913457.[0m
[32m[I 2022-04-21 20:34:43,585][0m Trial 868 finished with value: 0.7369916926287893 and parameters: {'loss': 'coxph', 'learning_rate': 0.0007335472414029344, 'n_estimators': 281, 'criterion': 'friedman_mse', 'min_samples_split': 2, 'min_samples_leaf': 1, 'min_weight_fraction_leaf': 0.07792116226741883, 'min_impurity_decrease': 0.19416300928028007, 'max_features': 0.0779787920867325, 'subsample': 0.022652804481521367, 'dropout_rate': 0.9456200449478567, 'ccp_alpha': 1.2357258036627345}. Best is trial 802 with value: 0.8492679411913457.[0m
[32m[I 2022-04-21 20:34:47,225][0m Trial 869 finished with value: 0.65 and parameters: {'loss': 'coxph', 'learning_rate': 0.0002848666616113222, 'n_estimators': 288, 'criterion': 'friedman_mse', 'min_samples_split': 2, 'min_samples_leaf': 1, 'min_weight_fraction_leaf': 0.09784964223844646, 'min_impurity_decrease': 0.16751221953543907, 'max_features': 0.11030543755790254, 'subsample': 0.05160745741772966, 'dropout_rate': 0.9115640115880408, 'ccp_alpha': 4.639539059682065}. Best is trial 802 with value: 0.8492679411913457.[0m
[32m[I 2022-04-21 20:34:49,521][0m Trial 870 finished with value: 0.8451379198998217 and parameters: {'loss': 'coxph', 'learning_rate': 0.0003654493786733707, 'n_estimators': 248, 'criterion': 'friedman_mse', 'min_samples_split': 2, 'min_samples_leaf': 1, 'min_weight_fraction_leaf': 0.07759635087349431, 'min_impurity_decrease': 0.13921237391622532, 'max_features': 0.09022048676388904, 'subsample': 0.02103662043598405, 'dropout_rate': 0.9711951747742429, 'ccp_alpha': 0.09961618582685906}. Best is trial 802 with value: 0.8492679411913457.[0m
/media/san2_ssd/data/Workdir/survival/venv/lib/python3.8/site-packages/sksurv/ensemble/boosting.py:955: RuntimeWarning: divide by zero encountered in log
  time = numpy.log(time)
/media/san2_ssd/data/Workdir/survival/venv/lib/python3.8/site-packages/sksurv/ensemble/boosting.py:955: RuntimeWarning: divide by zero encountered in log
  time = numpy.log(time)
/media/san2_ssd/data/Workdir/survival/venv/lib/python3.8/site-packages/sksurv/ensemble/boosting.py:955: RuntimeWarning: divide by zero encountered in log
  time = numpy.log(time)
/media/san2_ssd/data/Workdir/survival/venv/lib/python3.8/site-packages/sksurv/ensemble/boosting.py:955: RuntimeWarning: divide by zero encountered in log
  time = numpy.log(time)
[32m[I 2022-04-21 20:34:50,095][0m Trial 871 finished with value: -0.4648269860715713 and parameters: {'loss': 'squared', 'learning_rate': 0.0006246333168248434, 'n_estimators': 260, 'criterion': 'friedman_mse', 'min_samples_split': 2, 'min_samples_leaf': 1, 'min_weight_fraction_leaf': 0.08783651648632822, 'min_impurity_decrease': 0.20404823379388806, 'max_features': 0.1751767583196101, 'subsample': 0.0457965981958515, 'dropout_rate': 0.9311303396278564, 'ccp_alpha': 0.10017876957125235}. Best is trial 802 with value: 0.8492679411913457.[0m
[32m[I 2022-04-21 20:34:52,493][0m Trial 872 finished with value: 0.8464674134403275 and parameters: {'loss': 'coxph', 'learning_rate': 0.000411366965716471, 'n_estimators': 276, 'criterion': 'friedman_mse', 'min_samples_split': 2, 'min_samples_leaf': 1, 'min_weight_fraction_leaf': 0.10179150344281432, 'min_impurity_decrease': 0.18978763195279894, 'max_features': 0.039461570907512185, 'subsample': 0.052961062436175904, 'dropout_rate': 0.9819189916343706, 'ccp_alpha': 0.22995623545541877}. Best is trial 802 with value: 0.8492679411913457.[0m
[32m[I 2022-04-21 20:34:54,057][0m Trial 873 finished with value: 0.8479118625646003 and parameters: {'loss': 'coxph', 'learning_rate': 0.00029294541721188095, 'n_estimators': 175, 'criterion': 'friedman_mse', 'min_samples_split': 2, 'min_samples_leaf': 1, 'min_weight_fraction_leaf': 0.08119404494192464, 'min_impurity_decrease': 0.22415663860327842, 'max_features': 0.06290192135527156, 'subsample': 0.027006025445182, 'dropout_rate': 0.9614121350664081, 'ccp_alpha': 0.004159955234862428}. Best is trial 802 with value: 0.8492679411913457.[0m
[32m[I 2022-04-21 20:34:55,159][0m Trial 874 finished with value: 0.65 and parameters: {'loss': 'coxph', 'learning_rate': 0.0004901130827312891, 'n_estimators': 133, 'criterion': 'friedman_mse', 'min_samples_split': 2, 'min_samples_leaf': 1, 'min_weight_fraction_leaf': 0.08073755734984597, 'min_impurity_decrease': 0.22526781039369131, 'max_features': 0.06441048000675859, 'subsample': 0.0019416962048277586, 'dropout_rate': 0.9347807611577764, 'ccp_alpha': 0.40615549742384466}. Best is trial 802 with value: 0.8492679411913457.[0m
[32m[I 2022-04-21 20:34:57,749][0m Trial 875 finished with value: 0.8416227903534562 and parameters: {'loss': 'coxph', 'learning_rate': 0.0003321814756333677, 'n_estimators': 268, 'criterion': 'friedman_mse', 'min_samples_split': 2, 'min_samples_leaf': 1, 'min_weight_fraction_leaf': 0.07167326102309415, 'min_impurity_decrease': 0.2207148697185149, 'max_features': 0.03422030601426612, 'subsample': 0.02074776569097267, 'dropout_rate': 0.9989216982201274, 'ccp_alpha': 0.16234341888235412}. Best is trial 802 with value: 0.8492679411913457.[0m
[32m[I 2022-04-21 20:35:03,482][0m Trial 876 finished with value: 0.8425110744826073 and parameters: {'loss': 'coxph', 'learning_rate': 0.0002607671098010085, 'n_estimators': 248, 'criterion': 'friedman_mse', 'min_samples_split': 2, 'min_samples_leaf': 1, 'min_weight_fraction_leaf': 0.057404297977395095, 'min_impurity_decrease': 0.2099121464631977, 'max_features': 0.05111125325172222, 'subsample': 0.022466177289975558, 'dropout_rate': 0.9544290173630442, 'ccp_alpha': 0.6445324576204254}. Best is trial 802 with value: 0.8492679411913457.[0m
[32m[I 2022-04-21 20:35:06,523][0m Trial 877 finished with value: 0.843269247289421 and parameters: {'loss': 'coxph', 'learning_rate': 0.0005704319718692766, 'n_estimators': 157, 'criterion': 'friedman_mse', 'min_samples_split': 2, 'min_samples_leaf': 1, 'min_weight_fraction_leaf': 0.08721842016786241, 'min_impurity_decrease': 0.22680828517359947, 'max_features': 0.09327052813200236, 'subsample': 0.03329343129612637, 'dropout_rate': 0.8838562854184827, 'ccp_alpha': 0.31086276034747995}. Best is trial 802 with value: 0.8492679411913457.[0m
[32m[I 2022-04-21 20:35:07,802][0m Trial 878 finished with value: 0.8429233000453291 and parameters: {'loss': 'coxph', 'learning_rate': 0.0003997531157181864, 'n_estimators': 144, 'criterion': 'friedman_mse', 'min_samples_split': 2, 'min_samples_leaf': 1, 'min_weight_fraction_leaf': 0.09804124437279435, 'min_impurity_decrease': 0.20199431786798172, 'max_features': 0.016432015313787365, 'subsample': 0.019090095200494928, 'dropout_rate': 0.9691487746217812, 'ccp_alpha': 0.10261389375992999}. Best is trial 802 with value: 0.8492679411913457.[0m
[32m[I 2022-04-21 20:35:09,830][0m Trial 879 finished with value: 0.65 and parameters: {'loss': 'coxph', 'learning_rate': 0.00029523831136156156, 'n_estimators': 191, 'criterion': 'friedman_mse', 'min_samples_split': 2, 'min_samples_leaf': 1, 'min_weight_fraction_leaf': 0.07278960447786932, 'min_impurity_decrease': 0.1825919727686572, 'max_features': 0.06470096658359814, 'subsample': 0.03869417886687338, 'dropout_rate': 0.9996260213938492, 'ccp_alpha': 3.1623794323491317}. Best is trial 802 with value: 0.8492679411913457.[0m
[32m[I 2022-04-21 20:35:11,581][0m Trial 880 finished with value: 0.8434401325252605 and parameters: {'loss': 'coxph', 'learning_rate': 0.00024420328142077364, 'n_estimators': 156, 'criterion': 'friedman_mse', 'min_samples_split': 2, 'min_samples_leaf': 1, 'min_weight_fraction_leaf': 0.08158947009029864, 'min_impurity_decrease': 0.22758244307881736, 'max_features': 0.11397136609494395, 'subsample': 0.039672807450183784, 'dropout_rate': 0.9670381301332233, 'ccp_alpha': 0.17451145852542355}. Best is trial 802 with value: 0.8492679411913457.[0m
[32m[I 2022-04-21 20:35:13,965][0m Trial 881 finished with value: 0.65 and parameters: {'loss': 'coxph', 'learning_rate': 0.0004524911916347007, 'n_estimators': 167, 'criterion': 'friedman_mse', 'min_samples_split': 2, 'min_samples_leaf': 1, 'min_weight_fraction_leaf': 0.024231392878462016, 'min_impurity_decrease': 0.2069102577605344, 'max_features': 0.08639365841505933, 'subsample': 0.0021619088110850296, 'dropout_rate': 0.8041228018626511, 'ccp_alpha': 0.0028964371690107793}. Best is trial 802 with value: 0.8492679411913457.[0m
[32m[I 2022-04-21 20:35:15,591][0m Trial 882 finished with value: 0.8418528113841844 and parameters: {'loss': 'coxph', 'learning_rate': 0.0007183842134961755, 'n_estimators': 147, 'criterion': 'friedman_mse', 'min_samples_split': 2, 'min_samples_leaf': 1, 'min_weight_fraction_leaf': 0.06431920724954063, 'min_impurity_decrease': 0.1817565828405528, 'max_features': 0.04461071035344461, 'subsample': 0.05400482743545172, 'dropout_rate': 0.9400522423525794, 'ccp_alpha': 0.23312147014858858}. Best is trial 802 with value: 0.8492679411913457.[0m
[32m[I 2022-04-21 20:35:16,479][0m Trial 883 finished with value: 0.65 and parameters: {'loss': 'coxph', 'learning_rate': 0.0003257749452052582, 'n_estimators': 114, 'criterion': 'friedman_mse', 'min_samples_split': 2, 'min_samples_leaf': 6, 'min_weight_fraction_leaf': 0.08650635594853362, 'min_impurity_decrease': 0.16905000518746208, 'max_features': 0.008319907413506734, 'subsample': 0.03128204368250892, 'dropout_rate': 0.9601680190432205, 'ccp_alpha': 0.0012291502110968605}. Best is trial 802 with value: 0.8492679411913457.[0m
[32m[I 2022-04-21 20:35:18,974][0m Trial 884 finished with value: 0.8427494346622183 and parameters: {'loss': 'coxph', 'learning_rate': 0.00039991900609080466, 'n_estimators': 178, 'criterion': 'squared_error', 'min_samples_split': 2, 'min_samples_leaf': 1, 'min_weight_fraction_leaf': 0.09439969776666977, 'min_impurity_decrease': 0.1967927510377394, 'max_features': 0.08648663076483316, 'subsample': 0.019821675209228885, 'dropout_rate': 0.9163211886919448, 'ccp_alpha': 0.10446034572584258}. Best is trial 802 with value: 0.8492679411913457.[0m
[32m[I 2022-04-21 20:35:22,560][0m Trial 885 finished with value: 0.8457793920885317 and parameters: {'loss': 'coxph', 'learning_rate': 0.00029066079196378176, 'n_estimators': 289, 'criterion': 'friedman_mse', 'min_samples_split': 2, 'min_samples_leaf': 1, 'min_weight_fraction_leaf': 0.050152097329414363, 'min_impurity_decrease': 0.22437294685392498, 'max_features': 0.13562856322547678, 'subsample': 0.05676210836716609, 'dropout_rate': 0.9478701100026773, 'ccp_alpha': 0.35846419014591047}. Best is trial 802 with value: 0.8492679411913457.[0m
