[32m[I 2022-04-21 19:10:56,028][0m Trial 625 finished with value: 0.65 and parameters: {'loss': 'coxph', 'learning_rate': 0.00039705623155413054, 'n_estimators': 332, 'criterion': 'friedman_mse', 'min_samples_split': 3, 'min_samples_leaf': 1, 'min_weight_fraction_leaf': 0.14476150524356915, 'min_impurity_decrease': 0.24397767335343837, 'max_features': 0.4149688220931906, 'subsample': 0.0949529952921489, 'dropout_rate': 0.4691233138427611, 'ccp_alpha': 3.556761460714813}. Best is trial 583 with value: 0.8480221917497749.[0m
[32m[I 2022-04-21 19:11:11,686][0m Trial 626 finished with value: 0.8364134736184597 and parameters: {'loss': 'coxph', 'learning_rate': 0.000326017190508162, 'n_estimators': 348, 'criterion': 'friedman_mse', 'min_samples_split': 3, 'min_samples_leaf': 1, 'min_weight_fraction_leaf': 0.15310237776263544, 'min_impurity_decrease': 0.24969754731988075, 'max_features': 0.3944596411017641, 'subsample': 0.8974857910425078, 'dropout_rate': 0.48984883683376745, 'ccp_alpha': 0.08442210350472046}. Best is trial 583 with value: 0.8480221917497749.[0m
[32m[I 2022-04-21 19:11:33,098][0m Trial 627 finished with value: 0.8442929422247065 and parameters: {'loss': 'coxph', 'learning_rate': 0.00034723082008506336, 'n_estimators': 325, 'criterion': 'friedman_mse', 'min_samples_split': 3, 'min_samples_leaf': 1, 'min_weight_fraction_leaf': 0.15924503011098207, 'min_impurity_decrease': 0.2273478981463, 'max_features': 0.25827358037889436, 'subsample': 0.05181173793253464, 'dropout_rate': 0.4648398397447579, 'ccp_alpha': 0.08666964325308667}. Best is trial 583 with value: 0.8480221917497749.[0m
[32m[I 2022-04-21 19:11:51,240][0m Trial 628 finished with value: 0.8460537217580345 and parameters: {'loss': 'coxph', 'learning_rate': 0.00035848299831551795, 'n_estimators': 339, 'criterion': 'friedman_mse', 'min_samples_split': 3, 'min_samples_leaf': 1, 'min_weight_fraction_leaf': 0.1632926918125142, 'min_impurity_decrease': 0.2382293880778231, 'max_features': 0.43278230130141143, 'subsample': 0.08449303963315653, 'dropout_rate': 0.4137006910351514, 'ccp_alpha': 0.0032157890138194978}. Best is trial 583 with value: 0.8480221917497749.[0m
[32m[I 2022-04-21 19:12:06,492][0m Trial 629 finished with value: 0.8327104162454841 and parameters: {'loss': 'coxph', 'learning_rate': 0.0004727312035427978, 'n_estimators': 321, 'criterion': 'friedman_mse', 'min_samples_split': 3, 'min_samples_leaf': 1, 'min_weight_fraction_leaf': 0.14519451168844227, 'min_impurity_decrease': 0.24912603808396894, 'max_features': 0.2804573338142088, 'subsample': 0.027824869106195076, 'dropout_rate': 0.44561876346419793, 'ccp_alpha': 0.9745844919850584}. Best is trial 583 with value: 0.8480221917497749.[0m
[32m[I 2022-04-21 19:12:20,914][0m Trial 630 finished with value: 0.65 and parameters: {'loss': 'coxph', 'learning_rate': 0.0003056030075993163, 'n_estimators': 344, 'criterion': 'friedman_mse', 'min_samples_split': 3, 'min_samples_leaf': 1, 'min_weight_fraction_leaf': 0.13530077018358166, 'min_impurity_decrease': 0.22009630381014328, 'max_features': 0.36259234215967434, 'subsample': 0.7123986616590869, 'dropout_rate': 0.5358637405168527, 'ccp_alpha': 0.8368860860941463}. Best is trial 583 with value: 0.8480221917497749.[0m
[32m[I 2022-04-21 19:12:35,646][0m Trial 631 finished with value: 0.8438965980623243 and parameters: {'loss': 'coxph', 'learning_rate': 0.0004430272710920222, 'n_estimators': 325, 'criterion': 'friedman_mse', 'min_samples_split': 3, 'min_samples_leaf': 1, 'min_weight_fraction_leaf': 0.15982333326488624, 'min_impurity_decrease': 0.25874710129467215, 'max_features': 0.9109042794704434, 'subsample': 0.06921484477955528, 'dropout_rate': 0.4895774769190799, 'ccp_alpha': 0.19026150960595017}. Best is trial 583 with value: 0.8480221917497749.[0m
[32m[I 2022-04-21 19:12:57,450][0m Trial 632 finished with value: 0.8371903130477852 and parameters: {'loss': 'coxph', 'learning_rate': 0.000849149259228608, 'n_estimators': 363, 'criterion': 'friedman_mse', 'min_samples_split': 6, 'min_samples_leaf': 1, 'min_weight_fraction_leaf': 0.16596915515936617, 'min_impurity_decrease': 0.26033226967570866, 'max_features': 0.33099170676696643, 'subsample': 0.3672394752763277, 'dropout_rate': 0.4586248517536028, 'ccp_alpha': 0.1721944902462601}. Best is trial 583 with value: 0.8480221917497749.[0m
/media/san2_ssd/data/Workdir/survival/venv/lib/python3.8/site-packages/sksurv/ensemble/boosting.py:955: RuntimeWarning: divide by zero encountered in log
  time = numpy.log(time)
/media/san2_ssd/data/Workdir/survival/venv/lib/python3.8/site-packages/sksurv/ensemble/boosting.py:955: RuntimeWarning: divide by zero encountered in log
  time = numpy.log(time)
/media/san2_ssd/data/Workdir/survival/venv/lib/python3.8/site-packages/sksurv/ensemble/boosting.py:955: RuntimeWarning: divide by zero encountered in log
  time = numpy.log(time)
/media/san2_ssd/data/Workdir/survival/venv/lib/python3.8/site-packages/sksurv/ensemble/boosting.py:955: RuntimeWarning: divide by zero encountered in log
  time = numpy.log(time)
[32m[I 2022-04-21 19:13:04,567][0m Trial 633 finished with value: -0.4646473540832739 and parameters: {'loss': 'squared', 'learning_rate': 0.00031742984582723945, 'n_estimators': 336, 'criterion': 'squared_error', 'min_samples_split': 3, 'min_samples_leaf': 1, 'min_weight_fraction_leaf': 0.13116461868438065, 'min_impurity_decrease': 0.23126885445554674, 'max_features': 0.3773533959645349, 'subsample': 0.09862849760160314, 'dropout_rate': 0.18217995350596727, 'ccp_alpha': 0.003853094401416031}. Best is trial 583 with value: 0.8480221917497749.[0m
[32m[I 2022-04-21 19:13:24,752][0m Trial 634 finished with value: 0.8455339675184442 and parameters: {'loss': 'coxph', 'learning_rate': 0.0003716331720435386, 'n_estimators': 318, 'criterion': 'friedman_mse', 'min_samples_split': 3, 'min_samples_leaf': 1, 'min_weight_fraction_leaf': 0.11747944047716258, 'min_impurity_decrease': 0.5321943544762292, 'max_features': 0.35067678163321364, 'subsample': 0.055481899798987794, 'dropout_rate': 0.5214321414271044, 'ccp_alpha': 0.0018899765640641142}. Best is trial 583 with value: 0.8480221917497749.[0m
[32m[I 2022-04-21 19:13:41,899][0m Trial 635 finished with value: 0.65 and parameters: {'loss': 'coxph', 'learning_rate': 0.0007426933487317995, 'n_estimators': 350, 'criterion': 'friedman_mse', 'min_samples_split': 3, 'min_samples_leaf': 1, 'min_weight_fraction_leaf': 0.15145710835703433, 'min_impurity_decrease': 0.20451283763624264, 'max_features': 0.39383812118983297, 'subsample': 0.01775907913126925, 'dropout_rate': 0.5126187965216288, 'ccp_alpha': 0.23749954629048659}. Best is trial 583 with value: 0.8480221917497749.[0m
[32m[I 2022-04-21 19:14:02,506][0m Trial 636 finished with value: 0.8452515956310425 and parameters: {'loss': 'coxph', 'learning_rate': 0.0015921246782735407, 'n_estimators': 331, 'criterion': 'friedman_mse', 'min_samples_split': 3, 'min_samples_leaf': 1, 'min_weight_fraction_leaf': 0.1634655558606883, 'min_impurity_decrease': 0.2614885526219863, 'max_features': 0.31204684762802337, 'subsample': 0.07753557066990119, 'dropout_rate': 0.12139536308478203, 'ccp_alpha': 0.09262010175867294}. Best is trial 583 with value: 0.8480221917497749.[0m
[32m[I 2022-04-21 19:14:17,524][0m Trial 637 finished with value: 0.7171866314495462 and parameters: {'loss': 'coxph', 'learning_rate': 0.0010614183801983966, 'n_estimators': 318, 'criterion': 'friedman_mse', 'min_samples_split': 3, 'min_samples_leaf': 1, 'min_weight_fraction_leaf': 0.14135237124765868, 'min_impurity_decrease': 0.2181564638844336, 'max_features': 0.4207097889962841, 'subsample': 0.9703523482154854, 'dropout_rate': 0.5110552041952746, 'ccp_alpha': 0.13166440271872434}. Best is trial 583 with value: 0.8480221917497749.[0m
[32m[I 2022-04-21 19:14:49,787][0m Trial 638 finished with value: 0.65 and parameters: {'loss': 'coxph', 'learning_rate': 0.0004993022299223054, 'n_estimators': 349, 'criterion': 'friedman_mse', 'min_samples_split': 3, 'min_samples_leaf': 10, 'min_weight_fraction_leaf': 0.17062566982543798, 'min_impurity_decrease': 0.2489428240567438, 'max_features': 0.362309945210812, 'subsample': 0.044298753759673924, 'dropout_rate': 0.178094570955542, 'ccp_alpha': 0.2437969252021839}. Best is trial 583 with value: 0.8480221917497749.[0m
[32m[I 2022-04-21 19:15:24,161][0m Trial 639 finished with value: 0.8391055319701854 and parameters: {'loss': 'coxph', 'learning_rate': 0.0006104791682695495, 'n_estimators': 363, 'criterion': 'absolute_error', 'min_samples_split': 3, 'min_samples_leaf': 1, 'min_weight_fraction_leaf': 0.1561843415388166, 'min_impurity_decrease': 0.018814816799211154, 'max_features': 0.2923122123210531, 'subsample': 0.10578104150156153, 'dropout_rate': 0.10625713964488817, 'ccp_alpha': 0.099161661601215}. Best is trial 583 with value: 0.8480221917497749.[0m
[32m[I 2022-04-21 19:15:38,110][0m Trial 640 finished with value: 0.65 and parameters: {'loss': 'coxph', 'learning_rate': 0.0003197185233961036, 'n_estimators': 334, 'criterion': 'friedman_mse', 'min_samples_split': 7, 'min_samples_leaf': 1, 'min_weight_fraction_leaf': 0.14817031773844266, 'min_impurity_decrease': 0.26345306422860515, 'max_features': 0.2467214451299553, 'subsample': 0.07062957877173011, 'dropout_rate': 0.477950283672333, 'ccp_alpha': 4.501108481016192}. Best is trial 583 with value: 0.8480221917497749.[0m
[32m[I 2022-04-21 19:16:01,898][0m Trial 641 finished with value: 0.8454403944663925 and parameters: {'loss': 'coxph', 'learning_rate': 0.00045298137149054035, 'n_estimators': 316, 'criterion': 'friedman_mse', 'min_samples_split': 3, 'min_samples_leaf': 1, 'min_weight_fraction_leaf': 0.1686394877724467, 'min_impurity_decrease': 0.22936028218717824, 'max_features': 0.44460659940395014, 'subsample': 0.08703592108048465, 'dropout_rate': 0.16388634016078146, 'ccp_alpha': 0.17742823317537826}. Best is trial 583 with value: 0.8480221917497749.[0m
[32m[I 2022-04-21 19:16:25,256][0m Trial 642 finished with value: 0.7065714617798216 and parameters: {'loss': 'coxph', 'learning_rate': 0.0002633734308981186, 'n_estimators': 354, 'criterion': 'friedman_mse', 'min_samples_split': 3, 'min_samples_leaf': 1, 'min_weight_fraction_leaf': 0.16146108058066397, 'min_impurity_decrease': 0.20837525083768513, 'max_features': 0.340453700313414, 'subsample': 0.3111482921664175, 'dropout_rate': 0.4388726780500676, 'ccp_alpha': 0.3074877121697561}. Best is trial 583 with value: 0.8480221917497749.[0m
[32m[I 2022-04-21 19:16:52,349][0m Trial 643 finished with value: 0.8429467018293366 and parameters: {'loss': 'coxph', 'learning_rate': 0.00035505753796790475, 'n_estimators': 379, 'criterion': 'friedman_mse', 'min_samples_split': 6, 'min_samples_leaf': 1, 'min_weight_fraction_leaf': 0.1283792549080292, 'min_impurity_decrease': 0.2675018628179544, 'max_features': 0.39386802825461475, 'subsample': 0.05800853131098011, 'dropout_rate': 0.3187962864815922, 'ccp_alpha': 0.08686360853265049}. Best is trial 583 with value: 0.8480221917497749.[0m
[32m[I 2022-04-21 19:17:16,321][0m Trial 644 finished with value: 0.8435470672189359 and parameters: {'loss': 'coxph', 'learning_rate': 0.001979920469234856, 'n_estimators': 314, 'criterion': 'friedman_mse', 'min_samples_split': 3, 'min_samples_leaf': 1, 'min_weight_fraction_leaf': 0.13774354744251954, 'min_impurity_decrease': 0.2514418506703108, 'max_features': 0.41035898208361854, 'subsample': 0.0379056663609979, 'dropout_rate': 0.08016210938700179, 'ccp_alpha': 0.003686000618543795}. Best is trial 583 with value: 0.8480221917497749.[0m
[32m[I 2022-04-21 19:17:31,910][0m Trial 645 finished with value: 0.8368028179116356 and parameters: {'loss': 'coxph', 'learning_rate': 0.0025552177713636464, 'n_estimators': 332, 'criterion': 'friedman_mse', 'min_samples_split': 3, 'min_samples_leaf': 1, 'min_weight_fraction_leaf': 0.15376790577459082, 'min_impurity_decrease': 0.16280342569325623, 'max_features': 0.3755512246376738, 'subsample': 0.09090778957534572, 'dropout_rate': 0.566616139914871, 'ccp_alpha': 0.43134185258744034}. Best is trial 583 with value: 0.8480221917497749.[0m
[32m[I 2022-04-21 19:17:53,004][0m Trial 646 finished with value: 0.8427985259151228 and parameters: {'loss': 'coxph', 'learning_rate': 0.0005215832919533387, 'n_estimators': 313, 'criterion': 'friedman_mse', 'min_samples_split': 3, 'min_samples_leaf': 1, 'min_weight_fraction_leaf': 0.169958707474884, 'min_impurity_decrease': 0.2351424597705318, 'max_features': 0.3158766736555302, 'subsample': 0.10755195076444626, 'dropout_rate': 0.12945032352367114, 'ccp_alpha': 0.20329103677013388}. Best is trial 583 with value: 0.8480221917497749.[0m
[32m[I 2022-04-21 19:18:12,807][0m Trial 647 finished with value: 0.65 and parameters: {'loss': 'coxph', 'learning_rate': 0.0007505840065841858, 'n_estimators': 340, 'criterion': 'friedman_mse', 'min_samples_split': 3, 'min_samples_leaf': 9, 'min_weight_fraction_leaf': 0.2721550003121116, 'min_impurity_decrease': 0.19985077657194122, 'max_features': 0.27624111389038, 'subsample': 0.06593268291044371, 'dropout_rate': 0.15318926117029932, 'ccp_alpha': 0.1385137547731001}. Best is trial 583 with value: 0.8480221917497749.[0m
[32m[I 2022-04-21 19:21:21,842][0m Trial 648 finished with value: 0.8435442233394468 and parameters: {'loss': 'coxph', 'learning_rate': 0.0003970893901595477, 'n_estimators': 994, 'criterion': 'friedman_mse', 'min_samples_split': 3, 'min_samples_leaf': 1, 'min_weight_fraction_leaf': 0.1424828312745551, 'min_impurity_decrease': 0.2692895206227523, 'max_features': 0.9783691303675836, 'subsample': 0.022353727113275934, 'dropout_rate': 0.1785973903734861, 'ccp_alpha': 0.24858359159133783}. Best is trial 583 with value: 0.8480221917497749.[0m
[32m[I 2022-04-21 19:21:56,214][0m Trial 649 finished with value: 0.8436902319864984 and parameters: {'loss': 'coxph', 'learning_rate': 0.00027708029876698194, 'n_estimators': 353, 'criterion': 'friedman_mse', 'min_samples_split': 3, 'min_samples_leaf': 1, 'min_weight_fraction_leaf': 0.17133697285503593, 'min_impurity_decrease': 0.2805101250942723, 'max_features': 0.34151079879477697, 'subsample': 0.04870985771161131, 'dropout_rate': 0.1134350406055992, 'ccp_alpha': 0.09259076440846653}. Best is trial 583 with value: 0.8480221917497749.[0m
[32m[I 2022-04-21 19:22:24,597][0m Trial 650 finished with value: 0.842235917820453 and parameters: {'loss': 'coxph', 'learning_rate': 0.0011140356699565635, 'n_estimators': 374, 'criterion': 'friedman_mse', 'min_samples_split': 3, 'min_samples_leaf': 1, 'min_weight_fraction_leaf': 0.15758335452926728, 'min_impurity_decrease': 0.2439556692758956, 'max_features': 0.36994713991575306, 'subsample': 0.07551542745421017, 'dropout_rate': 0.13518101921365958, 'ccp_alpha': 0.34257004759147625}. Best is trial 583 with value: 0.8480221917497749.[0m
[32m[I 2022-04-21 19:22:42,411][0m Trial 651 finished with value: 0.8423286426954812 and parameters: {'loss': 'coxph', 'learning_rate': 0.00048133004110039677, 'n_estimators': 336, 'criterion': 'friedman_mse', 'min_samples_split': 3, 'min_samples_leaf': 1, 'min_weight_fraction_leaf': 0.14609144371820007, 'min_impurity_decrease': 0.5593483521674503, 'max_features': 0.9302893051565118, 'subsample': 0.08786851647960331, 'dropout_rate': 0.40181719060099286, 'ccp_alpha': 0.10259706488855896}. Best is trial 583 with value: 0.8480221917497749.[0m
[32m[I 2022-04-21 19:23:08,731][0m Trial 652 finished with value: 0.8461368353467318 and parameters: {'loss': 'coxph', 'learning_rate': 0.0006608477571807227, 'n_estimators': 316, 'criterion': 'friedman_mse', 'min_samples_split': 3, 'min_samples_leaf': 1, 'min_weight_fraction_leaf': 0.1619520450491212, 'min_impurity_decrease': 0.21486937356879607, 'max_features': 0.389568400555544, 'subsample': 0.03840966834597804, 'dropout_rate': 0.09407536756279758, 'ccp_alpha': 0.0033997781412637047}. Best is trial 583 with value: 0.8480221917497749.[0m
/media/san2_ssd/data/Workdir/survival/venv/lib/python3.8/site-packages/sksurv/ensemble/boosting.py:955: RuntimeWarning: divide by zero encountered in log
  time = numpy.log(time)
/media/san2_ssd/data/Workdir/survival/venv/lib/python3.8/site-packages/sksurv/ensemble/boosting.py:955: RuntimeWarning: divide by zero encountered in log
  time = numpy.log(time)
/media/san2_ssd/data/Workdir/survival/venv/lib/python3.8/site-packages/sksurv/ensemble/boosting.py:955: RuntimeWarning: divide by zero encountered in log
  time = numpy.log(time)
/media/san2_ssd/data/Workdir/survival/venv/lib/python3.8/site-packages/sksurv/ensemble/boosting.py:955: RuntimeWarning: divide by zero encountered in log
  time = numpy.log(time)
[32m[I 2022-04-21 19:23:17,458][0m Trial 653 finished with value: -0.45 and parameters: {'loss': 'squared', 'learning_rate': 0.0014943233233665697, 'n_estimators': 314, 'criterion': 'friedman_mse', 'min_samples_split': 3, 'min_samples_leaf': 1, 'min_weight_fraction_leaf': 0.15247614880361293, 'min_impurity_decrease': 0.21513808469205817, 'max_features': 0.21185567022911372, 'subsample': 0.01626355718564507, 'dropout_rate': 0.0810325040335258, 'ccp_alpha': 0.0025667416399702547}. Best is trial 583 with value: 0.8480221917497749.[0m
[32m[I 2022-04-21 19:23:50,739][0m Trial 654 finished with value: 0.8439818336676111 and parameters: {'loss': 'coxph', 'learning_rate': 0.0007929559285188496, 'n_estimators': 306, 'criterion': 'squared_error', 'min_samples_split': 3, 'min_samples_leaf': 1, 'min_weight_fraction_leaf': 0.16108425200676768, 'min_impurity_decrease': 0.1902480164421405, 'max_features': 0.35955937001010774, 'subsample': 0.037349286427848696, 'dropout_rate': 0.06274527646212584, 'ccp_alpha': 0.21753788082191935}. Best is trial 583 with value: 0.8480221917497749.[0m
[32m[I 2022-04-21 19:24:25,613][0m Trial 655 finished with value: 0.65 and parameters: {'loss': 'coxph', 'learning_rate': 0.0010075352315238352, 'n_estimators': 354, 'criterion': 'friedman_mse', 'min_samples_split': 3, 'min_samples_leaf': 1, 'min_weight_fraction_leaf': 0.1064298762242465, 'min_impurity_decrease': 0.21863654205795527, 'max_features': 0.3902251937336213, 'subsample': 0.0028666899733408163, 'dropout_rate': 0.10130920288502879, 'ccp_alpha': 0.15609083823102585}. Best is trial 583 with value: 0.8480221917497749.[0m
[32m[I 2022-04-21 19:24:47,907][0m Trial 656 finished with value: 0.8436747845298477 and parameters: {'loss': 'coxph', 'learning_rate': 0.0008917958481036941, 'n_estimators': 326, 'criterion': 'friedman_mse', 'min_samples_split': 3, 'min_samples_leaf': 1, 'min_weight_fraction_leaf': 0.130621879230749, 'min_impurity_decrease': 0.12608011950790243, 'max_features': 0.32882490439591816, 'subsample': 0.025968594090183754, 'dropout_rate': 0.08380534875383742, 'ccp_alpha': 0.2813475348605088}. Best is trial 583 with value: 0.8480221917497749.[0m
[32m[I 2022-04-21 19:25:15,149][0m Trial 657 finished with value: 0.8415797949337339 and parameters: {'loss': 'coxph', 'learning_rate': 0.0007198768156539681, 'n_estimators': 303, 'criterion': 'friedman_mse', 'min_samples_split': 3, 'min_samples_leaf': 1, 'min_weight_fraction_leaf': 0.11960878422060897, 'min_impurity_decrease': 0.18929765763751805, 'max_features': 0.35451417433575094, 'subsample': 0.2845991615446884, 'dropout_rate': 0.050940204898069046, 'ccp_alpha': 0.09951991628835428}. Best is trial 583 with value: 0.8480221917497749.[0m
[32m[I 2022-04-21 19:25:37,126][0m Trial 658 finished with value: 0.65 and parameters: {'loss': 'coxph', 'learning_rate': 0.0006477369456463497, 'n_estimators': 337, 'criterion': 'friedman_mse', 'min_samples_split': 3, 'min_samples_leaf': 1, 'min_weight_fraction_leaf': 0.14404765190192373, 'min_impurity_decrease': 0.16819885078217064, 'max_features': 0.30050325903868214, 'subsample': 0.0018629241780282885, 'dropout_rate': 0.0911461194711237, 'ccp_alpha': 0.41062489493012755}. Best is trial 583 with value: 0.8480221917497749.[0m
[32m[I 2022-04-21 19:26:03,834][0m Trial 659 finished with value: 0.843631442113957 and parameters: {'loss': 'coxph', 'learning_rate': 0.0013380368106344343, 'n_estimators': 370, 'criterion': 'absolute_error', 'min_samples_split': 3, 'min_samples_leaf': 1, 'min_weight_fraction_leaf': 0.16093223756945593, 'min_impurity_decrease': 0.22020976960358365, 'max_features': 0.38913653633666045, 'subsample': 0.04782473595256967, 'dropout_rate': 0.4755360906180283, 'ccp_alpha': 0.18934909833422267}. Best is trial 583 with value: 0.8480221917497749.[0m
[32m[I 2022-04-21 19:26:37,285][0m Trial 660 finished with value: 0.8465598988179754 and parameters: {'loss': 'coxph', 'learning_rate': 0.0006235854517500041, 'n_estimators': 324, 'criterion': 'friedman_mse', 'min_samples_split': 3, 'min_samples_leaf': 1, 'min_weight_fraction_leaf': 0.17128625472709658, 'min_impurity_decrease': 0.24736616507898615, 'max_features': 0.37287947558137574, 'subsample': 0.04155982120448338, 'dropout_rate': 0.10316483465343873, 'ccp_alpha': 0.08810026292611235}. Best is trial 583 with value: 0.8480221917497749.[0m
[32m[I 2022-04-21 19:27:06,028][0m Trial 661 finished with value: 0.8450659709285986 and parameters: {'loss': 'coxph', 'learning_rate': 0.0006175192791378725, 'n_estimators': 326, 'criterion': 'friedman_mse', 'min_samples_split': 3, 'min_samples_leaf': 1, 'min_weight_fraction_leaf': 0.174972030744829, 'min_impurity_decrease': 0.23015100283198248, 'max_features': 0.381972037378115, 'subsample': 0.022428360231172204, 'dropout_rate': 0.0684347349326347, 'ccp_alpha': 0.006844589626289893}. Best is trial 583 with value: 0.8480221917497749.[0m
