[32m[I 2022-04-22 00:27:40,405][0m Trial 284 finished with value: 0.6699672701305094 and parameters: {'alpha': 4.729679951989938, 'ties': 'breslow'}. Best is trial 51 with value: 0.6718225721814719.[0m
[32m[I 2022-04-22 00:28:06,300][0m Trial 285 finished with value: 0.6715828289199117 and parameters: {'alpha': 3.7932588205560167, 'ties': 'breslow'}. Best is trial 51 with value: 0.6718225721814719.[0m
[32m[I 2022-04-22 00:28:30,496][0m Trial 286 finished with value: 0.6711982740031293 and parameters: {'alpha': 3.6970073228282785, 'ties': 'breslow'}. Best is trial 51 with value: 0.6718225721814719.[0m
[32m[I 2022-04-22 00:29:00,768][0m Trial 287 finished with value: 0.6705615341410874 and parameters: {'alpha': 4.122618692845372, 'ties': 'breslow'}. Best is trial 51 with value: 0.6718225721814719.[0m
[32m[I 2022-04-22 00:29:31,489][0m Trial 288 finished with value: 0.6712563165473625 and parameters: {'alpha': 3.901655059758359, 'ties': 'breslow'}. Best is trial 51 with value: 0.6718225721814719.[0m
[32m[I 2022-04-22 00:30:00,759][0m Trial 289 finished with value: 0.6711972604594469 and parameters: {'alpha': 3.571145399672823, 'ties': 'efron'}. Best is trial 51 with value: 0.6718225721814719.[0m
[32m[I 2022-04-22 00:30:31,563][0m Trial 290 finished with value: 0.6714206959499815 and parameters: {'alpha': 3.8235127131052926, 'ties': 'breslow'}. Best is trial 51 with value: 0.6718225721814719.[0m
[32m[I 2022-04-22 00:31:02,711][0m Trial 291 finished with value: 0.6708098592683656 and parameters: {'alpha': 3.966646600310324, 'ties': 'breslow'}. Best is trial 51 with value: 0.6718225721814719.[0m
[32m[I 2022-04-22 00:31:32,160][0m Trial 292 finished with value: 0.6715134091726827 and parameters: {'alpha': 3.756550018773129, 'ties': 'breslow'}. Best is trial 51 with value: 0.6718225721814719.[0m
[32m[I 2022-04-22 00:32:01,606][0m Trial 293 finished with value: 0.6708528438624721 and parameters: {'alpha': 3.505757235489279, 'ties': 'breslow'}. Best is trial 51 with value: 0.6718225721814719.[0m
[32m[I 2022-04-22 00:32:31,330][0m Trial 294 finished with value: 0.6712758842947594 and parameters: {'alpha': 3.6981219412190374, 'ties': 'breslow'}. Best is trial 51 with value: 0.6718225721814719.[0m
[32m[I 2022-04-22 00:33:01,182][0m Trial 295 finished with value: 0.6705534885276953 and parameters: {'alpha': 3.3512297123686565, 'ties': 'breslow'}. Best is trial 51 with value: 0.6718225721814719.[0m
[32m[I 2022-04-22 00:33:32,318][0m Trial 296 finished with value: 0.6713323130079433 and parameters: {'alpha': 3.8432721899034368, 'ties': 'breslow'}. Best is trial 51 with value: 0.6718225721814719.[0m
[32m[I 2022-04-22 00:34:04,602][0m Trial 297 finished with value: 0.670957560396671 and parameters: {'alpha': 3.6541880161312643, 'ties': 'breslow'}. Best is trial 51 with value: 0.6718225721814719.[0m
[32m[I 2022-04-22 00:34:35,955][0m Trial 298 finished with value: 0.6704232670604819 and parameters: {'alpha': 3.9988404664573336, 'ties': 'breslow'}. Best is trial 51 with value: 0.6718225721814719.[0m
[32m[I 2022-04-22 00:35:06,961][0m Trial 299 finished with value: 0.6712563165473625 and parameters: {'alpha': 3.901233598359022, 'ties': 'breslow'}. Best is trial 51 with value: 0.6718225721814719.[0m
[32m[I 2022-04-22 00:35:37,354][0m Trial 300 finished with value: 0.6715828289199117 and parameters: {'alpha': 3.794596511974919, 'ties': 'breslow'}. Best is trial 51 with value: 0.6718225721814719.[0m
[32m[I 2022-04-22 00:36:09,290][0m Trial 301 finished with value: 0.6710392443611095 and parameters: {'alpha': 3.606366580640335, 'ties': 'breslow'}. Best is trial 51 with value: 0.6718225721814719.[0m
[32m[I 2022-04-22 00:36:41,087][0m Trial 302 finished with value: 0.6716673515982117 and parameters: {'alpha': 3.7662128579051677, 'ties': 'breslow'}. Best is trial 51 with value: 0.6718225721814719.[0m
[32m[I 2022-04-22 00:37:12,837][0m Trial 303 finished with value: 0.6714381495717138 and parameters: {'alpha': 3.719641141917252, 'ties': 'breslow'}. Best is trial 51 with value: 0.6718225721814719.[0m
[32m[I 2022-04-22 00:37:42,714][0m Trial 304 finished with value: 0.6709366444585252 and parameters: {'alpha': 3.4823223753787973, 'ties': 'breslow'}. Best is trial 51 with value: 0.6718225721814719.[0m
[32m[I 2022-04-22 00:38:15,653][0m Trial 305 finished with value: 0.6712563165473625 and parameters: {'alpha': 3.901790474471236, 'ties': 'breslow'}. Best is trial 51 with value: 0.6718225721814719.[0m
[32m[I 2022-04-22 00:38:48,674][0m Trial 306 finished with value: 0.6707257400948092 and parameters: {'alpha': 4.080195277094591, 'ties': 'breslow'}. Best is trial 51 with value: 0.6718225721814719.[0m
[32m[I 2022-04-22 00:39:21,511][0m Trial 307 finished with value: 0.6710385818290442 and parameters: {'alpha': 3.6199321283386174, 'ties': 'breslow'}. Best is trial 51 with value: 0.6718225721814719.[0m
[32m[I 2022-04-22 00:39:53,534][0m Trial 308 finished with value: 0.6714261077667124 and parameters: {'alpha': 3.7617168395992806, 'ties': 'efron'}. Best is trial 51 with value: 0.6718225721814719.[0m
[32m[I 2022-04-22 00:40:24,511][0m Trial 309 finished with value: 0.6712563165473625 and parameters: {'alpha': 3.8970453147036674, 'ties': 'breslow'}. Best is trial 51 with value: 0.6718225721814719.[0m
[32m[I 2022-04-22 00:41:01,011][0m Trial 310 finished with value: 0.6711167223457152 and parameters: {'alpha': 3.6877469916019616, 'ties': 'breslow'}. Best is trial 51 with value: 0.6718225721814719.[0m
[32m[I 2022-04-22 00:41:42,446][0m Trial 311 finished with value: 0.6714246373157657 and parameters: {'alpha': 3.8093150371393834, 'ties': 'breslow'}. Best is trial 51 with value: 0.6718225721814719.[0m
[32m[I 2022-04-22 00:42:19,855][0m Trial 312 finished with value: 0.6709611038444385 and parameters: {'alpha': 3.569292843529755, 'ties': 'breslow'}. Best is trial 51 with value: 0.6718225721814719.[0m
[32m[I 2022-04-22 00:42:58,156][0m Trial 313 finished with value: 0.6708098592683656 and parameters: {'alpha': 3.965334151790496, 'ties': 'breslow'}. Best is trial 51 with value: 0.6718225721814719.[0m
[32m[I 2022-04-22 00:43:38,501][0m Trial 314 finished with value: 0.6711982740031293 and parameters: {'alpha': 3.693497768495406, 'ties': 'breslow'}. Best is trial 51 with value: 0.6718225721814719.[0m
[32m[I 2022-04-22 00:44:30,213][0m Trial 315 finished with value: 0.6687367004424981 and parameters: {'alpha': 0.5830509577728868, 'ties': 'breslow'}. Best is trial 51 with value: 0.6718225721814719.[0m
[32m[I 2022-04-22 00:45:02,632][0m Trial 316 finished with value: 0.6714206959499815 and parameters: {'alpha': 3.8270143679857274, 'ties': 'breslow'}. Best is trial 51 with value: 0.6718225721814719.[0m
[32m[I 2022-04-22 00:45:34,996][0m Trial 317 finished with value: 0.6710127541802161 and parameters: {'alpha': 3.4383912348948216, 'ties': 'breslow'}. Best is trial 51 with value: 0.6718225721814719.[0m
[32m[I 2022-04-22 00:46:06,284][0m Trial 318 finished with value: 0.6703459645816847 and parameters: {'alpha': 3.9832378420356656, 'ties': 'breslow'}. Best is trial 51 with value: 0.6718225721814719.[0m
[32m[I 2022-04-22 00:46:38,674][0m Trial 319 finished with value: 0.6706392344897626 and parameters: {'alpha': 4.200503663607525, 'ties': 'breslow'}. Best is trial 51 with value: 0.6718225721814719.[0m
[32m[I 2022-04-22 00:47:11,724][0m Trial 320 finished with value: 0.6715134091726827 and parameters: {'alpha': 3.7594741756308148, 'ties': 'breslow'}. Best is trial 51 with value: 0.6718225721814719.[0m
[32m[I 2022-04-22 00:47:43,973][0m Trial 321 finished with value: 0.6714105858316386 and parameters: {'alpha': 3.8596099089734595, 'ties': 'breslow'}. Best is trial 51 with value: 0.6718225721814719.[0m
[32m[I 2022-04-22 00:48:16,804][0m Trial 322 finished with value: 0.6710385818290442 and parameters: {'alpha': 3.6200542876681303, 'ties': 'breslow'}. Best is trial 51 with value: 0.6718225721814719.[0m
[32m[I 2022-04-22 00:48:50,547][0m Trial 323 finished with value: 0.6713605392800839 and parameters: {'alpha': 3.7444392674036737, 'ties': 'breslow'}. Best is trial 51 with value: 0.6718225721814719.[0m
[32m[I 2022-04-22 00:49:22,649][0m Trial 324 finished with value: 0.6705709596314063 and parameters: {'alpha': 4.0405602996798855, 'ties': 'breslow'}. Best is trial 51 with value: 0.6718225721814719.[0m
[32m[I 2022-04-22 00:49:54,802][0m Trial 325 finished with value: 0.6713323130079433 and parameters: {'alpha': 3.8464826180456995, 'ties': 'breslow'}. Best is trial 51 with value: 0.6718225721814719.[0m
[32m[I 2022-04-22 00:50:26,536][0m Trial 326 finished with value: 0.6709611038444385 and parameters: {'alpha': 3.5815994667152795, 'ties': 'breslow'}. Best is trial 51 with value: 0.6718225721814719.[0m
[32m[I 2022-04-22 00:50:58,799][0m Trial 327 finished with value: 0.6712792954355025 and parameters: {'alpha': 3.71619877909995, 'ties': 'breslow'}. Best is trial 51 with value: 0.6718225721814719.[0m
[32m[I 2022-04-22 00:51:30,421][0m Trial 328 finished with value: 0.671120215034261 and parameters: {'alpha': 3.9391338983780666, 'ties': 'breslow'}. Best is trial 51 with value: 0.6718225721814719.[0m
[32m[I 2022-04-22 00:52:03,252][0m Trial 329 finished with value: 0.6712630044518841 and parameters: {'alpha': 3.792476814699779, 'ties': 'efron'}. Best is trial 51 with value: 0.6718225721814719.[0m
[32m[I 2022-04-22 00:52:34,963][0m Trial 330 finished with value: 0.670957560396671 and parameters: {'alpha': 3.657788795531203, 'ties': 'breslow'}. Best is trial 51 with value: 0.6718225721814719.[0m
[32m[I 2022-04-22 00:53:07,388][0m Trial 331 finished with value: 0.6710883379454154 and parameters: {'alpha': 3.517545931033006, 'ties': 'breslow'}. Best is trial 51 with value: 0.6718225721814719.[0m
[32m[I 2022-04-22 00:53:39,359][0m Trial 332 finished with value: 0.6713378682047766 and parameters: {'alpha': 3.8854294832567398, 'ties': 'breslow'}. Best is trial 51 with value: 0.6718225721814719.[0m
[32m[I 2022-04-22 00:54:12,751][0m Trial 333 finished with value: 0.6704072839027255 and parameters: {'alpha': 4.101536435245105, 'ties': 'breslow'}. Best is trial 51 with value: 0.6718225721814719.[0m
[32m[I 2022-04-22 00:54:44,168][0m Trial 334 finished with value: 0.6711167223457152 and parameters: {'alpha': 3.6824108696860454, 'ties': 'breslow'}. Best is trial 51 with value: 0.6718225721814719.[0m
[32m[I 2022-04-22 00:55:17,623][0m Trial 335 finished with value: 0.6713391442925675 and parameters: {'alpha': 3.8290108571033197, 'ties': 'breslow'}. Best is trial 51 with value: 0.6718225721814719.[0m
[32m[I 2022-04-22 00:55:52,796][0m Trial 336 finished with value: 0.6701957588016824 and parameters: {'alpha': 2.96568809399372, 'ties': 'breslow'}. Best is trial 51 with value: 0.6718225721814719.[0m
[32m[I 2022-04-22 00:56:24,867][0m Trial 337 finished with value: 0.6704232670604819 and parameters: {'alpha': 3.9950964644540576, 'ties': 'breslow'}. Best is trial 51 with value: 0.6718225721814719.[0m
[32m[I 2022-04-22 00:56:54,491][0m Trial 338 finished with value: 0.6713605392800839 and parameters: {'alpha': 3.738644097058212, 'ties': 'breslow'}. Best is trial 51 with value: 0.6718225721814719.[0m
[32m[I 2022-04-22 00:57:27,501][0m Trial 339 finished with value: 0.6714139969723817 and parameters: {'alpha': 3.878085034330016, 'ties': 'breslow'}. Best is trial 51 with value: 0.6718225721814719.[0m
[32m[I 2022-04-22 00:58:02,710][0m Trial 340 finished with value: 0.6678656105701971 and parameters: {'alpha': 2.027136423818247, 'ties': 'breslow'}. Best is trial 51 with value: 0.6718225721814719.[0m
[32m[I 2022-04-22 00:58:36,391][0m Trial 341 finished with value: 0.6710392443611095 and parameters: {'alpha': 3.6038303253815345, 'ties': 'breslow'}. Best is trial 51 with value: 0.6718225721814719.[0m
[32m[I 2022-04-22 00:59:07,879][0m Trial 342 finished with value: 0.6718225721814719 and parameters: {'alpha': 3.771745346680711, 'ties': 'breslow'}. Best is trial 51 with value: 0.6718225721814719.[0m
[32m[I 2022-04-22 00:59:40,040][0m Trial 343 finished with value: 0.6708528438624721 and parameters: {'alpha': 3.506380788355057, 'ties': 'breslow'}. Best is trial 51 with value: 0.6718225721814719.[0m
[32m[I 2022-04-22 01:00:12,920][0m Trial 344 finished with value: 0.671035170688301 and parameters: {'alpha': 3.6763044070638102, 'ties': 'breslow'}. Best is trial 51 with value: 0.6718225721814719.[0m
[32m[I 2022-04-22 01:00:45,943][0m Trial 345 finished with value: 0.6718225721814719 and parameters: {'alpha': 3.772872192681565, 'ties': 'breslow'}. Best is trial 51 with value: 0.6718225721814719.[0m
[32m[I 2022-04-22 01:01:17,260][0m Trial 346 finished with value: 0.6712563165473625 and parameters: {'alpha': 3.915382349453881, 'ties': 'breslow'}. Best is trial 51 with value: 0.6718225721814719.[0m
[32m[I 2022-04-22 01:01:47,587][0m Trial 347 finished with value: 0.6714313272902276 and parameters: {'alpha': 3.7191831860758, 'ties': 'efron'}. Best is trial 51 with value: 0.6718225721814719.[0m
[32m[I 2022-04-22 01:02:21,228][0m Trial 348 finished with value: 0.6709611038444385 and parameters: {'alpha': 3.594269076584588, 'ties': 'breslow'}. Best is trial 51 with value: 0.6718225721814719.[0m
[32m[I 2022-04-22 01:02:52,835][0m Trial 349 finished with value: 0.6710078424695338 and parameters: {'alpha': 3.400034182511707, 'ties': 'breslow'}. Best is trial 51 with value: 0.6718225721814719.[0m
[32m[I 2022-04-22 01:03:25,538][0m Trial 350 finished with value: 0.6712618418137702 and parameters: {'alpha': 3.832868915201688, 'ties': 'breslow'}. Best is trial 51 with value: 0.6718225721814719.[0m
[32m[I 2022-04-22 01:03:56,110][0m Trial 351 finished with value: 0.6708864992150974 and parameters: {'alpha': 3.97208129197769, 'ties': 'breslow'}. Best is trial 51 with value: 0.6718225721814719.[0m
[32m[I 2022-04-22 01:04:29,172][0m Trial 352 finished with value: 0.671035170688301 and parameters: {'alpha': 3.6770824842872876, 'ties': 'breslow'}. Best is trial 51 with value: 0.6718225721814719.[0m
[32m[I 2022-04-22 01:05:03,004][0m Trial 353 finished with value: 0.6715828289199117 and parameters: {'alpha': 3.792138857896266, 'ties': 'breslow'}. Best is trial 51 with value: 0.6718225721814719.[0m
[32m[I 2022-04-22 01:05:35,643][0m Trial 354 finished with value: 0.6712563165473625 and parameters: {'alpha': 3.8964271097988203, 'ties': 'breslow'}. Best is trial 51 with value: 0.6718225721814719.[0m
[32m[I 2022-04-22 01:06:07,856][0m Trial 355 finished with value: 0.6709611038444385 and parameters: {'alpha': 3.56589127108795, 'ties': 'breslow'}. Best is trial 51 with value: 0.6718225721814719.[0m
[32m[I 2022-04-22 01:06:38,502][0m Trial 356 finished with value: 0.6707257400948092 and parameters: {'alpha': 4.074246890298298, 'ties': 'breslow'}. Best is trial 51 with value: 0.6718225721814719.[0m
[32m[I 2022-04-22 01:07:13,052][0m Trial 357 finished with value: 0.6714381495717138 and parameters: {'alpha': 3.7249012102526606, 'ties': 'breslow'}. Best is trial 51 with value: 0.6718225721814719.[0m
[32m[I 2022-04-22 01:07:55,452][0m Trial 358 finished with value: 0.6663821385904269 and parameters: {'alpha': 1.3130430818072416, 'ties': 'breslow'}. Best is trial 51 with value: 0.6718225721814719.[0m
[32m[I 2022-04-22 01:08:28,368][0m Trial 359 finished with value: 0.6715828289199117 and parameters: {'alpha': 3.787774848117324, 'ties': 'breslow'}. Best is trial 51 with value: 0.6718225721814719.[0m
[32m[I 2022-04-22 01:09:01,341][0m Trial 360 finished with value: 0.6709609715374141 and parameters: {'alpha': 3.628053074445197, 'ties': 'breslow'}. Best is trial 51 with value: 0.6718225721814719.[0m
[32m[I 2022-04-22 01:09:35,467][0m Trial 361 finished with value: 0.6712563165473625 and parameters: {'alpha': 3.910386194492128, 'ties': 'breslow'}. Best is trial 51 with value: 0.6718225721814719.[0m
[32m[I 2022-04-22 01:10:07,942][0m Trial 362 finished with value: 0.6718225721814719 and parameters: {'alpha': 3.7736913128874536, 'ties': 'breslow'}. Best is trial 51 with value: 0.6718225721814719.[0m
[32m[I 2022-04-22 01:10:40,208][0m Trial 363 finished with value: 0.670419017881865 and parameters: {'alpha': 4.014861705837646, 'ties': 'breslow'}. Best is trial 51 with value: 0.6718225721814719.[0m
[32m[I 2022-04-22 01:11:13,654][0m Trial 364 finished with value: 0.6710116979986835 and parameters: {'alpha': 3.515016111617271, 'ties': 'breslow'}. Best is trial 51 with value: 0.6718225721814719.[0m
[32m[I 2022-04-22 01:11:45,714][0m Trial 365 finished with value: 0.6711167223457152 and parameters: {'alpha': 3.681001976311641, 'ties': 'breslow'}. Best is trial 51 with value: 0.6718225721814719.[0m
[32m[I 2022-04-22 01:12:17,588][0m Trial 366 finished with value: 0.6713323130079433 and parameters: {'alpha': 3.8486792660733515, 'ties': 'breslow'}. Best is trial 51 with value: 0.6718225721814719.[0m
[32m[I 2022-04-22 01:12:49,997][0m Trial 367 finished with value: 0.6715076594241265 and parameters: {'alpha': 3.7518583013942335, 'ties': 'efron'}. Best is trial 51 with value: 0.6718225721814719.[0m
[32m[I 2022-04-22 01:13:22,529][0m Trial 368 finished with value: 0.6704774340876366 and parameters: {'alpha': 3.277511015055217, 'ties': 'breslow'}. Best is trial 51 with value: 0.6718225721814719.[0m
[32m[I 2022-04-22 01:13:53,916][0m Trial 369 finished with value: 0.671120215034261 and parameters: {'alpha': 3.9421788711507393, 'ties': 'breslow'}. Best is trial 51 with value: 0.6718225721814719.[0m
[32m[I 2022-04-22 01:14:25,925][0m Trial 370 finished with value: 0.6709609715374141 and parameters: {'alpha': 3.6336398773071688, 'ties': 'breslow'}. Best is trial 51 with value: 0.6718225721814719.[0m
[32m[I 2022-04-22 01:14:57,997][0m Trial 371 finished with value: 0.6718225721814719 and parameters: {'alpha': 3.77104847970739, 'ties': 'breslow'}. Best is trial 51 with value: 0.6718225721814719.[0m
[32m[I 2022-04-22 01:15:31,462][0m Trial 372 finished with value: 0.6704033425369416 and parameters: {'alpha': 4.145531816332811, 'ties': 'breslow'}. Best is trial 51 with value: 0.6718225721814719.[0m
[32m[I 2022-04-22 01:16:04,021][0m Trial 373 finished with value: 0.6710859829862048 and parameters: {'alpha': 3.413673855571479, 'ties': 'breslow'}. Best is trial 51 with value: 0.6718225721814719.[0m
[32m[I 2022-04-22 01:16:34,077][0m Trial 374 finished with value: 0.6714381495717138 and parameters: {'alpha': 3.7211448952436257, 'ties': 'breslow'}. Best is trial 51 with value: 0.6718225721814719.[0m
[32m[I 2022-04-22 01:17:05,670][0m Trial 375 finished with value: 0.671193319093663 and parameters: {'alpha': 3.5406256431200487, 'ties': 'breslow'}. Best is trial 51 with value: 0.6718225721814719.[0m
[32m[I 2022-04-22 01:17:38,560][0m Trial 376 finished with value: 0.6714921374890528 and parameters: {'alpha': 3.871802608131639, 'ties': 'breslow'}. Best is trial 51 with value: 0.6718225721814719.[0m
[32m[I 2022-04-22 01:18:10,695][0m Trial 377 finished with value: 0.670957560396671 and parameters: {'alpha': 3.650693497835991, 'ties': 'breslow'}. Best is trial 51 with value: 0.6718225721814719.[0m
[32m[I 2022-04-22 01:18:44,525][0m Trial 378 finished with value: 0.6716643805773258 and parameters: {'alpha': 3.782108826408799, 'ties': 'breslow'}. Best is trial 51 with value: 0.6718225721814719.[0m
[32m[I 2022-04-22 01:19:16,594][0m Trial 379 finished with value: 0.6715828289199117 and parameters: {'alpha': 3.793311508034682, 'ties': 'breslow'}. Best is trial 51 with value: 0.6718225721814719.[0m
[32m[I 2022-04-22 01:19:49,426][0m Trial 380 finished with value: 0.6708098592683656 and parameters: {'alpha': 3.9690787977877857, 'ties': 'breslow'}. Best is trial 51 with value: 0.6718225721814719.[0m
[32m[I 2022-04-22 01:20:21,455][0m Trial 381 finished with value: 0.6713378682047766 and parameters: {'alpha': 3.87957967678337, 'ties': 'breslow'}. Best is trial 51 with value: 0.6718225721814719.[0m
[32m[I 2022-04-22 01:20:52,280][0m Trial 382 finished with value: 0.6710385818290442 and parameters: {'alpha': 3.6150803927817305, 'ties': 'breslow'}. Best is trial 51 with value: 0.6718225721814719.[0m
[32m[I 2022-04-22 01:21:25,211][0m Trial 383 finished with value: 0.6714381495717138 and parameters: {'alpha': 3.7374495476972593, 'ties': 'breslow'}. Best is trial 51 with value: 0.6718225721814719.[0m
[32m[I 2022-04-22 01:21:57,186][0m Trial 384 finished with value: 0.6713391442925675 and parameters: {'alpha': 3.829596755956269, 'ties': 'breslow'}. Best is trial 51 with value: 0.6718225721814719.[0m
[32m[I 2022-04-22 01:22:29,380][0m Trial 385 finished with value: 0.6705709596314063 and parameters: {'alpha': 4.04049020169219, 'ties': 'breslow'}. Best is trial 51 with value: 0.6718225721814719.[0m
[32m[I 2022-04-22 01:23:01,566][0m Trial 386 finished with value: 0.6708528438624721 and parameters: {'alpha': 3.4940439070415836, 'ties': 'breslow'}. Best is trial 51 with value: 0.6718225721814719.[0m
[32m[I 2022-04-22 01:23:32,817][0m Trial 387 finished with value: 0.6711167223457152 and parameters: {'alpha': 3.6874392034083407, 'ties': 'breslow'}. Best is trial 51 with value: 0.6718225721814719.[0m
[32m[I 2022-04-22 01:24:03,495][0m Trial 388 finished with value: 0.6709417116028501 and parameters: {'alpha': 3.9360530060667056, 'ties': 'efron'}. Best is trial 51 with value: 0.6718225721814719.[0m
[32m[I 2022-04-22 01:24:33,695][0m Trial 389 finished with value: 0.6713605392800839 and parameters: {'alpha': 3.738667811734571, 'ties': 'breslow'}. Best is trial 51 with value: 0.6718225721814719.[0m
[32m[I 2022-04-22 01:25:03,632][0m Trial 390 finished with value: 0.6709611038444385 and parameters: {'alpha': 3.5868893813485583, 'ties': 'breslow'}. Best is trial 51 with value: 0.6718225721814719.[0m
