[32m[I 2022-04-23 12:27:45,090][0m Trial 303 finished with value: 0.6237937850702095 and parameters: {'n_hidden': 32, 'mixture_components': 4, 'use_sparse_layer': False, 'use_batchnorm': False, 'use_dropout': True, 'dropout': 0.09536782421434005, 'mlp_size_1': 2, 'mlp_size_2': 0, 'mlp_size_3': 0, 'kernel': 'Normal', 'loss_name': 'CensoredNLLLoss'}. Best is trial 123 with value: 0.6857038111174789.[0m
[32m[I 2022-04-23 12:28:57,771][0m Trial 304 finished with value: 0.6393648530377669 and parameters: {'n_hidden': 128, 'mixture_components': 9, 'use_sparse_layer': False, 'use_batchnorm': False, 'use_dropout': True, 'dropout': 0.5882331345263054, 'mlp_size_1': 4, 'mlp_size_2': 0, 'mlp_size_3': 0, 'kernel': 'Normal', 'loss_name': 'CensoredNLLLoss'}. Best is trial 123 with value: 0.6857038111174789.[0m
[32m[I 2022-04-23 12:30:14,385][0m Trial 305 finished with value: 0.6720097334804268 and parameters: {'n_hidden': 512, 'mixture_components': 5, 'use_sparse_layer': False, 'use_batchnorm': False, 'use_dropout': True, 'dropout': 0.055400283809637164, 'mlp_size_1': 5, 'mlp_size_2': 1, 'mlp_size_3': 0, 'kernel': 'Normal', 'loss_name': 'CensoredNLLLoss'}. Best is trial 123 with value: 0.6857038111174789.[0m
[32m[I 2022-04-23 12:31:46,036][0m Trial 306 finished with value: 0.6805722868116153 and parameters: {'n_hidden': 2048, 'mixture_components': 3, 'use_sparse_layer': False, 'use_batchnorm': False, 'use_dropout': True, 'dropout': 0.07498761430457172, 'mlp_size_1': 7, 'mlp_size_2': 1, 'mlp_size_3': 0, 'kernel': 'Normal', 'loss_name': 'CensoredNLLLoss'}. Best is trial 123 with value: 0.6857038111174789.[0m
[32m[I 2022-04-23 12:33:02,552][0m Trial 307 finished with value: 0.6662789856174911 and parameters: {'n_hidden': 512, 'mixture_components': 3, 'use_sparse_layer': False, 'use_batchnorm': False, 'use_dropout': True, 'dropout': 0.0395348453584617, 'mlp_size_1': 6, 'mlp_size_2': 0, 'mlp_size_3': 0, 'kernel': 'Normal', 'loss_name': 'CensoredNLLLoss'}. Best is trial 123 with value: 0.6857038111174789.[0m
[32m[I 2022-04-23 12:34:51,276][0m Trial 308 finished with value: 0.5965584378969042 and parameters: {'n_hidden': 512, 'mixture_components': 3, 'use_sparse_layer': False, 'use_batchnorm': True, 'use_dropout': False, 'mlp_size_1': 6, 'mlp_size_2': 0, 'mlp_size_3': 0, 'kernel': 'Normal', 'loss_name': 'CensoredNLLLoss'}. Best is trial 123 with value: 0.6857038111174789.[0m
[32m[I 2022-04-23 12:36:21,287][0m Trial 309 finished with value: 0.6617596100662669 and parameters: {'n_hidden': 2048, 'mixture_components': 3, 'use_sparse_layer': False, 'use_batchnorm': False, 'use_dropout': True, 'dropout': 0.08288764484817314, 'mlp_size_1': 7, 'mlp_size_2': 1, 'mlp_size_3': 0, 'kernel': 'Normal', 'loss_name': 'AlternativeNLLLoss'}. Best is trial 123 with value: 0.6857038111174789.[0m
[32m[I 2022-04-23 12:37:31,892][0m Trial 310 finished with value: 0.6164479832329551 and parameters: {'n_hidden': 512, 'mixture_components': 3, 'use_sparse_layer': False, 'use_batchnorm': False, 'use_dropout': True, 'dropout': 0.06655314524354777, 'mlp_size_1': 6, 'mlp_size_2': 0, 'mlp_size_3': 0, 'kernel': 'Normal', 'loss_name': 'CensoredNLLLoss'}. Best is trial 123 with value: 0.6857038111174789.[0m
[32m[I 2022-04-23 12:38:38,214][0m Trial 311 finished with value: 0.6740202048188224 and parameters: {'n_hidden': 512, 'mixture_components': 3, 'use_sparse_layer': False, 'use_batchnorm': False, 'use_dropout': True, 'dropout': 0.09801869677647543, 'mlp_size_1': 6, 'mlp_size_2': 0, 'mlp_size_3': 0, 'kernel': 'Normal', 'loss_name': 'CensoredNLLLoss'}. Best is trial 123 with value: 0.6857038111174789.[0m
[32m[I 2022-04-23 12:39:45,562][0m Trial 312 finished with value: 0.674038395517823 and parameters: {'n_hidden': 512, 'mixture_components': 4, 'use_sparse_layer': False, 'use_batchnorm': False, 'use_dropout': True, 'dropout': 0.1148461179160222, 'mlp_size_1': 6, 'mlp_size_2': 0, 'mlp_size_3': 0, 'kernel': 'Normal', 'loss_name': 'NLLLoss'}. Best is trial 123 with value: 0.6857038111174789.[0m
[32m[I 2022-04-23 12:40:58,933][0m Trial 313 finished with value: 0.6557848423166884 and parameters: {'n_hidden': 2048, 'mixture_components': 3, 'use_sparse_layer': False, 'use_batchnorm': False, 'use_dropout': True, 'dropout': 0.1497129573017813, 'mlp_size_1': 7, 'mlp_size_2': 1, 'mlp_size_3': 0, 'kernel': 'Normal', 'loss_name': 'NLLLoss'}. Best is trial 123 with value: 0.6857038111174789.[0m
[32m[I 2022-04-23 12:42:09,880][0m Trial 314 finished with value: 0.6518690465439707 and parameters: {'n_hidden': 512, 'mixture_components': 4, 'use_sparse_layer': False, 'use_batchnorm': False, 'use_dropout': True, 'dropout': 0.07239260826784404, 'mlp_size_1': 5, 'mlp_size_2': 1, 'mlp_size_3': 0, 'kernel': 'Normal', 'loss_name': 'CensoredNLLLoss'}. Best is trial 123 with value: 0.6857038111174789.[0m
[32m[I 2022-04-23 12:43:19,007][0m Trial 315 finished with value: 0.610506561368681 and parameters: {'n_hidden': 1024, 'mixture_components': 5, 'use_sparse_layer': False, 'use_batchnorm': False, 'use_dropout': True, 'dropout': 0.11451726890778686, 'mlp_size_1': 7, 'mlp_size_2': 0, 'mlp_size_3': 0, 'kernel': 'Normal', 'loss_name': 'NLLLoss'}. Best is trial 123 with value: 0.6857038111174789.[0m
[32m[I 2022-04-23 12:44:32,247][0m Trial 316 finished with value: 0.6565258970531228 and parameters: {'n_hidden': 512, 'mixture_components': 5, 'use_sparse_layer': False, 'use_batchnorm': False, 'use_dropout': True, 'dropout': 0.481797851226736, 'mlp_size_1': 5, 'mlp_size_2': 1, 'mlp_size_3': 0, 'kernel': 'Normal', 'loss_name': 'CensoredNLLLoss'}. Best is trial 123 with value: 0.6857038111174789.[0m
[32m[I 2022-04-23 12:45:37,035][0m Trial 317 finished with value: 0.6467540938997924 and parameters: {'n_hidden': 2048, 'mixture_components': 3, 'use_sparse_layer': False, 'use_batchnorm': False, 'use_dropout': True, 'dropout': 0.002032640284709397, 'mlp_size_1': 7, 'mlp_size_2': 1, 'mlp_size_3': 0, 'kernel': 'Normal', 'loss_name': 'NLLLoss'}. Best is trial 123 with value: 0.6857038111174789.[0m
[32m[I 2022-04-23 12:46:58,656][0m Trial 318 finished with value: 0.6696821482534802 and parameters: {'n_hidden': 512, 'mixture_components': 4, 'use_sparse_layer': False, 'use_batchnorm': False, 'use_dropout': True, 'dropout': 0.15786666146746814, 'mlp_size_1': 5, 'mlp_size_2': 1, 'mlp_size_3': 0, 'kernel': 'Normal', 'loss_name': 'CensoredNLLLoss'}. Best is trial 123 with value: 0.6857038111174789.[0m
[32m[I 2022-04-23 12:47:47,734][0m Trial 319 finished with value: 0.6621436684034288 and parameters: {'n_hidden': 256, 'mixture_components': 3, 'use_sparse_layer': False, 'use_batchnorm': False, 'use_dropout': True, 'dropout': 0.21015777736993135, 'mlp_size_1': 5, 'mlp_size_2': 0, 'mlp_size_3': 0, 'kernel': 'Normal', 'loss_name': 'NLLLoss'}. Best is trial 123 with value: 0.6857038111174789.[0m
[32m[I 2022-04-23 12:48:32,068][0m Trial 320 finished with value: 0.6473850623539805 and parameters: {'n_hidden': 512, 'mixture_components': 4, 'use_sparse_layer': False, 'use_batchnorm': False, 'use_dropout': False, 'mlp_size_1': 5, 'mlp_size_2': 1, 'mlp_size_3': 0, 'kernel': 'Normal', 'loss_name': 'NLLLoss'}. Best is trial 123 with value: 0.6857038111174789.[0m
[32m[I 2022-04-23 12:49:56,193][0m Trial 321 finished with value: 0.6692356786836596 and parameters: {'n_hidden': 2048, 'mixture_components': 3, 'use_sparse_layer': False, 'use_batchnorm': False, 'use_dropout': True, 'dropout': 0.045140586158392004, 'mlp_size_1': 7, 'mlp_size_2': 1, 'mlp_size_3': 0, 'kernel': 'Normal', 'loss_name': 'CensoredNLLLoss'}. Best is trial 123 with value: 0.6857038111174789.[0m
[32m[I 2022-04-23 12:50:48,536][0m Trial 322 finished with value: 0.6674994059174233 and parameters: {'n_hidden': 512, 'mixture_components': 5, 'use_sparse_layer': True, 'use_sparse_loss': False, 'use_batchnorm': False, 'use_dropout': True, 'dropout': 0.09997433117611056, 'mlp_size_1': 5, 'mlp_size_2': 1, 'mlp_size_3': 0, 'kernel': 'Normal', 'loss_name': 'NLLLoss'}. Best is trial 123 with value: 0.6857038111174789.[0m
[32m[I 2022-04-23 12:51:27,295][0m Trial 323 finished with value: -0.6696264731306557 and parameters: {'n_hidden': 512, 'mixture_components': 9, 'use_sparse_layer': False, 'use_batchnorm': False, 'use_dropout': True, 'dropout': 0.0825381928749979, 'mlp_size_1': 6, 'mlp_size_2': 0, 'mlp_size_3': 0, 'kernel': 'Exponential', 'loss_name': 'CensoredNLLLoss'}. Best is trial 123 with value: 0.6857038111174789.[0m
[32m[I 2022-04-23 12:52:58,317][0m Trial 324 finished with value: 0.6694836207106254 and parameters: {'n_hidden': 2048, 'mixture_components': 4, 'use_sparse_layer': False, 'use_batchnorm': False, 'use_dropout': True, 'dropout': 0.18125759175818548, 'mlp_size_1': 8, 'mlp_size_2': 0, 'mlp_size_3': 0, 'kernel': 'Normal', 'loss_name': 'NLLLoss'}. Best is trial 123 with value: 0.6857038111174789.[0m
[32m[I 2022-04-23 12:54:07,834][0m Trial 325 finished with value: 0.6608646641415155 and parameters: {'n_hidden': 512, 'mixture_components': 3, 'use_sparse_layer': False, 'use_batchnorm': False, 'use_dropout': True, 'dropout': 0.12452418957716016, 'mlp_size_1': 5, 'mlp_size_2': 1, 'mlp_size_3': 0, 'kernel': 'Normal', 'loss_name': 'CensoredNLLLoss'}. Best is trial 123 with value: 0.6857038111174789.[0m
[32m[I 2022-04-23 12:56:00,419][0m Trial 326 finished with value: 0.598658481178816 and parameters: {'n_hidden': 512, 'mixture_components': 5, 'use_sparse_layer': False, 'use_batchnorm': True, 'use_dropout': True, 'dropout': 0.14466945401088502, 'mlp_size_1': 5, 'mlp_size_2': 1, 'mlp_size_3': 0, 'kernel': 'Normal', 'loss_name': 'NLLLoss'}. Best is trial 123 with value: 0.6857038111174789.[0m
[32m[I 2022-04-23 12:57:40,707][0m Trial 327 finished with value: 0.672072628343351 and parameters: {'n_hidden': 2048, 'mixture_components': 3, 'use_sparse_layer': False, 'use_batchnorm': False, 'use_dropout': True, 'dropout': 0.2071143043292701, 'mlp_size_1': 7, 'mlp_size_2': 1, 'mlp_size_3': 0, 'kernel': 'LogLogistic', 'loss_name': 'CensoredNLLLoss'}. Best is trial 123 with value: 0.6857038111174789.[0m
[32m[I 2022-04-23 12:58:45,779][0m Trial 328 finished with value: 0.6824946189352388 and parameters: {'n_hidden': 512, 'mixture_components': 9, 'use_sparse_layer': False, 'use_batchnorm': False, 'use_dropout': True, 'dropout': 0.1735475268629301, 'mlp_size_1': 5, 'mlp_size_2': 1, 'mlp_size_3': 0, 'kernel': 'Normal', 'loss_name': 'NLLLoss'}. Best is trial 123 with value: 0.6857038111174789.[0m
[32m[I 2022-04-23 12:59:45,796][0m Trial 329 finished with value: 0.6579461462601982 and parameters: {'n_hidden': 512, 'mixture_components': 9, 'use_sparse_layer': False, 'use_batchnorm': False, 'use_dropout': True, 'dropout': 0.1849543429871139, 'mlp_size_1': 5, 'mlp_size_2': 1, 'mlp_size_3': 0, 'kernel': 'Normal', 'loss_name': 'NLLLoss'}. Best is trial 123 with value: 0.6857038111174789.[0m
[32m[I 2022-04-23 13:00:39,248][0m Trial 330 finished with value: 0.6563595964061366 and parameters: {'n_hidden': 512, 'mixture_components': 9, 'use_sparse_layer': True, 'use_sparse_loss': False, 'use_batchnorm': False, 'use_dropout': True, 'dropout': 0.1268696385011947, 'mlp_size_1': 5, 'mlp_size_2': 1, 'mlp_size_3': 0, 'kernel': 'Normal', 'loss_name': 'NLLLoss'}. Best is trial 123 with value: 0.6857038111174789.[0m
[32m[I 2022-04-23 13:01:25,182][0m Trial 331 finished with value: 0.6312644670663743 and parameters: {'n_hidden': 512, 'mixture_components': 9, 'use_sparse_layer': False, 'use_batchnorm': False, 'use_dropout': False, 'mlp_size_1': 5, 'mlp_size_2': 1, 'mlp_size_3': 0, 'kernel': 'Normal', 'loss_name': 'NLLLoss'}. Best is trial 123 with value: 0.6857038111174789.[0m
[32m[I 2022-04-23 13:02:18,130][0m Trial 332 finished with value: 0.656393535584374 and parameters: {'n_hidden': 512, 'mixture_components': 9, 'use_sparse_layer': False, 'use_batchnorm': False, 'use_dropout': True, 'dropout': 0.07419484795057354, 'mlp_size_1': 5, 'mlp_size_2': 1, 'mlp_size_3': 0, 'kernel': 'Normal', 'loss_name': 'NLLLoss'}. Best is trial 123 with value: 0.6857038111174789.[0m
[32m[I 2022-04-23 13:03:26,967][0m Trial 333 finished with value: 0.6613540291421872 and parameters: {'n_hidden': 512, 'mixture_components': 9, 'use_sparse_layer': False, 'use_batchnorm': False, 'use_dropout': True, 'dropout': 0.15232453773572258, 'mlp_size_1': 5, 'mlp_size_2': 1, 'mlp_size_3': 0, 'kernel': 'Normal', 'loss_name': 'NLLLoss'}. Best is trial 123 with value: 0.6857038111174789.[0m
[32m[I 2022-04-23 13:04:16,963][0m Trial 334 finished with value: 0.6713355415688831 and parameters: {'n_hidden': 512, 'mixture_components': 9, 'use_sparse_layer': False, 'use_batchnorm': False, 'use_dropout': True, 'dropout': 0.11070966183391266, 'mlp_size_1': 5, 'mlp_size_2': 1, 'mlp_size_3': 0, 'kernel': 'Normal', 'loss_name': 'NLLLoss'}. Best is trial 123 with value: 0.6857038111174789.[0m
[32m[I 2022-04-23 13:05:10,611][0m Trial 335 finished with value: 0.6244875867638675 and parameters: {'n_hidden': 32, 'mixture_components': 4, 'use_sparse_layer': False, 'use_batchnorm': False, 'use_dropout': True, 'dropout': 0.027823208523901258, 'mlp_size_1': 2, 'mlp_size_2': 0, 'mlp_size_3': 0, 'kernel': 'Normal', 'loss_name': 'NLLLoss'}. Best is trial 123 with value: 0.6857038111174789.[0m
[32m[I 2022-04-23 13:06:06,760][0m Trial 336 finished with value: 0.6617769256215428 and parameters: {'n_hidden': 512, 'mixture_components': 10, 'use_sparse_layer': False, 'use_batchnorm': False, 'use_dropout': True, 'dropout': 0.19502401819270043, 'mlp_size_1': 5, 'mlp_size_2': 1, 'mlp_size_3': 0, 'kernel': 'Normal', 'loss_name': 'NLLLoss'}. Best is trial 123 with value: 0.6857038111174789.[0m
[32m[I 2022-04-23 13:07:27,456][0m Trial 337 finished with value: 0.6655425251139033 and parameters: {'n_hidden': 64, 'mixture_components': 5, 'use_sparse_layer': False, 'use_batchnorm': False, 'use_dropout': True, 'dropout': 0.21476168902173043, 'mlp_size_1': 3, 'mlp_size_2': 0, 'mlp_size_3': 0, 'kernel': 'Normal', 'loss_name': 'AlternativeNLLLoss'}. Best is trial 123 with value: 0.6857038111174789.[0m
[32m[I 2022-04-23 13:08:21,893][0m Trial 338 finished with value: 0.6756560558809547 and parameters: {'n_hidden': 512, 'mixture_components': 3, 'use_sparse_layer': True, 'use_sparse_loss': False, 'use_batchnorm': False, 'use_dropout': True, 'dropout': 0.1686672893976995, 'mlp_size_1': 5, 'mlp_size_2': 1, 'mlp_size_3': 0, 'kernel': 'Normal', 'loss_name': 'NLLLoss'}. Best is trial 123 with value: 0.6857038111174789.[0m
[32m[I 2022-04-23 13:09:14,485][0m Trial 339 finished with value: 0.6417039660610065 and parameters: {'n_hidden': 512, 'mixture_components': 4, 'use_sparse_layer': False, 'use_batchnorm': False, 'use_dropout': True, 'dropout': 0.05424902300128486, 'mlp_size_1': 6, 'mlp_size_2': 0, 'mlp_size_3': 0, 'kernel': 'Normal', 'loss_name': 'NLLLoss'}. Best is trial 123 with value: 0.6857038111174789.[0m
[32m[I 2022-04-23 13:10:24,741][0m Trial 340 finished with value: 0.667359385655805 and parameters: {'n_hidden': 512, 'mixture_components': 4, 'use_sparse_layer': False, 'use_batchnorm': False, 'use_dropout': True, 'dropout': 0.14665777296001134, 'mlp_size_1': 5, 'mlp_size_2': 1, 'mlp_size_3': 0, 'kernel': 'Normal', 'loss_name': 'NLLLoss'}. Best is trial 123 with value: 0.6857038111174789.[0m
[32m[I 2022-04-23 13:11:20,826][0m Trial 341 finished with value: 0.6598455788831268 and parameters: {'n_hidden': 128, 'mixture_components': 3, 'use_sparse_layer': False, 'use_batchnorm': False, 'use_dropout': True, 'dropout': 0.12687658100177343, 'mlp_size_1': 4, 'mlp_size_2': 0, 'mlp_size_3': 0, 'kernel': 'Normal', 'loss_name': 'NLLLoss'}. Best is trial 123 with value: 0.6857038111174789.[0m
[32m[I 2022-04-23 13:12:14,154][0m Trial 342 finished with value: 0.6570342076063016 and parameters: {'n_hidden': 512, 'mixture_components': 9, 'use_sparse_layer': False, 'use_batchnorm': False, 'use_dropout': True, 'dropout': 0.3903981769910748, 'mlp_size_1': 5, 'mlp_size_2': 1, 'mlp_size_3': 0, 'kernel': 'Normal', 'loss_name': 'NLLLoss'}. Best is trial 123 with value: 0.6857038111174789.[0m
[32m[I 2022-04-23 13:12:59,525][0m Trial 343 finished with value: 0.6350547112975491 and parameters: {'n_hidden': 512, 'mixture_components': 5, 'use_sparse_layer': False, 'use_batchnorm': False, 'use_dropout': False, 'mlp_size_1': 5, 'mlp_size_2': 1, 'mlp_size_3': 0, 'kernel': 'Normal', 'loss_name': 'NLLLoss'}. Best is trial 123 with value: 0.6857038111174789.[0m
[32m[I 2022-04-23 13:13:51,942][0m Trial 344 finished with value: 0.6611427309048636 and parameters: {'n_hidden': 512, 'mixture_components': 4, 'use_sparse_layer': False, 'use_batchnorm': False, 'use_dropout': True, 'dropout': 0.0968529294478076, 'mlp_size_1': 6, 'mlp_size_2': 0, 'mlp_size_3': 0, 'kernel': 'Normal', 'loss_name': 'NLLLoss'}. Best is trial 123 with value: 0.6857038111174789.[0m
[32m[I 2022-04-23 13:14:41,241][0m Trial 345 finished with value: 0.6770452351512615 and parameters: {'n_hidden': 512, 'mixture_components': 3, 'use_sparse_layer': False, 'use_batchnorm': False, 'use_dropout': True, 'dropout': 0.18339854472965464, 'mlp_size_1': 5, 'mlp_size_2': 1, 'mlp_size_3': 0, 'kernel': 'Normal', 'loss_name': 'NLLLoss'}. Best is trial 123 with value: 0.6857038111174789.[0m
[32m[I 2022-04-23 13:17:03,249][0m Trial 346 finished with value: 0.6334688304062164 and parameters: {'n_hidden': 512, 'mixture_components': 3, 'use_sparse_layer': True, 'use_sparse_loss': False, 'use_batchnorm': True, 'use_dropout': True, 'dropout': 0.18546036124172624, 'mlp_size_1': 5, 'mlp_size_2': 1, 'mlp_size_3': 0, 'kernel': 'Normal', 'loss_name': 'NLLLoss'}. Best is trial 123 with value: 0.6857038111174789.[0m
[32m[I 2022-04-23 13:18:23,935][0m Trial 347 finished with value: 0.6650471122648467 and parameters: {'n_hidden': 1024, 'mixture_components': 3, 'use_sparse_layer': False, 'use_batchnorm': False, 'use_dropout': True, 'dropout': 0.20923156532202133, 'mlp_size_1': 7, 'mlp_size_2': 0, 'mlp_size_3': 0, 'kernel': 'Normal', 'loss_name': 'CensoredNLLLoss'}. Best is trial 123 with value: 0.6857038111174789.[0m
[32m[I 2022-04-23 13:19:06,975][0m Trial 348 finished with value: 0.6619489684402248 and parameters: {'n_hidden': 512, 'mixture_components': 3, 'use_sparse_layer': False, 'use_batchnorm': False, 'use_dropout': True, 'dropout': 0.1737331599437191, 'mlp_size_1': 5, 'mlp_size_2': 1, 'mlp_size_3': 0, 'kernel': 'Exponential', 'loss_name': 'NLLLoss'}. Best is trial 123 with value: 0.6857038111174789.[0m
[32m[I 2022-04-23 13:20:21,006][0m Trial 349 finished with value: 0.6749863529411982 and parameters: {'n_hidden': 512, 'mixture_components': 3, 'use_sparse_layer': False, 'use_batchnorm': False, 'use_dropout': True, 'dropout': 0.218364039624312, 'mlp_size_1': 5, 'mlp_size_2': 1, 'mlp_size_3': 0, 'kernel': 'Normal', 'loss_name': 'CensoredNLLLoss'}. Best is trial 123 with value: 0.6857038111174789.[0m
[32m[I 2022-04-23 13:21:18,928][0m Trial 350 finished with value: 0.6701502412010397 and parameters: {'n_hidden': 512, 'mixture_components': 3, 'use_sparse_layer': False, 'use_batchnorm': False, 'use_dropout': True, 'dropout': 0.19415021104512625, 'mlp_size_1': 5, 'mlp_size_2': 1, 'mlp_size_3': 0, 'kernel': 'Normal', 'loss_name': 'NLLLoss'}. Best is trial 123 with value: 0.6857038111174789.[0m
[32m[I 2022-04-23 13:22:09,628][0m Trial 351 finished with value: 0.6763276288050637 and parameters: {'n_hidden': 512, 'mixture_components': 3, 'use_sparse_layer': False, 'use_batchnorm': False, 'use_dropout': True, 'dropout': 0.16009186052894359, 'mlp_size_1': 5, 'mlp_size_2': 1, 'mlp_size_3': 0, 'kernel': 'Normal', 'loss_name': 'NLLLoss'}. Best is trial 123 with value: 0.6857038111174789.[0m
[32m[I 2022-04-23 13:23:06,512][0m Trial 352 finished with value: 0.6152876078519551 and parameters: {'n_hidden': 256, 'mixture_components': 9, 'use_sparse_layer': False, 'use_batchnorm': False, 'use_dropout': True, 'dropout': 0.16897758237175464, 'mlp_size_1': 5, 'mlp_size_2': 0, 'mlp_size_3': 0, 'kernel': 'LogLogistic', 'loss_name': 'CensoredNLLLoss'}. Best is trial 123 with value: 0.6857038111174789.[0m
[32m[I 2022-04-23 13:24:09,139][0m Trial 353 finished with value: 0.6262944911702488 and parameters: {'n_hidden': 512, 'mixture_components': 3, 'use_sparse_layer': False, 'use_batchnorm': False, 'use_dropout': True, 'dropout': 0.8423582401822013, 'mlp_size_1': 5, 'mlp_size_2': 1, 'mlp_size_3': 0, 'kernel': 'Normal', 'loss_name': 'AlternativeNLLLoss'}. Best is trial 123 with value: 0.6857038111174789.[0m
[32m[I 2022-04-23 13:25:44,797][0m Trial 354 finished with value: 0.6581030200092849 and parameters: {'n_hidden': 2048, 'mixture_components': 1, 'use_sparse_layer': True, 'use_sparse_loss': True, 'lmbd': 0.009104232949841617, 'use_batchnorm': False, 'use_dropout': True, 'dropout': 0.14477698577378645, 'mlp_size_1': 7, 'mlp_size_2': 1, 'mlp_size_3': 0, 'kernel': 'Normal', 'loss_name': 'NLLLoss'}. Best is trial 123 with value: 0.6857038111174789.[0m
[32m[I 2022-04-23 13:26:51,699][0m Trial 355 finished with value: 0.6566179444979541 and parameters: {'n_hidden': 512, 'mixture_components': 4, 'use_sparse_layer': False, 'use_batchnorm': False, 'use_dropout': False, 'mlp_size_1': 5, 'mlp_size_2': 1, 'mlp_size_3': 0, 'kernel': 'Normal', 'loss_name': 'CensoredNLLLoss'}. Best is trial 123 with value: 0.6857038111174789.[0m
[32m[I 2022-04-23 13:27:53,826][0m Trial 356 finished with value: 0.6633091987811517 and parameters: {'n_hidden': 512, 'mixture_components': 3, 'use_sparse_layer': False, 'use_batchnorm': False, 'use_dropout': True, 'dropout': 0.19308724620242707, 'mlp_size_1': 5, 'mlp_size_2': 1, 'mlp_size_3': 0, 'kernel': 'Normal', 'loss_name': 'NLLLoss'}. Best is trial 123 with value: 0.6857038111174789.[0m
