[32m[I 2022-04-21 11:39:22,813][0m Trial 381 finished with value: 0.672500033520157 and parameters: {'splitter': 'best', 'min_samples_split': 0.046964517302130415, 'min_samples_leaf': 0.04142504553358834, 'min_weight_fraction_leaf': 0.2826230819245765, 'max_features': 0.43462448267106235}. Best is trial 208 with value: 0.8264270922211081.[0m
[32m[I 2022-04-21 11:39:22,971][0m Trial 382 finished with value: 0.6487229799318462 and parameters: {'splitter': 'best', 'min_samples_split': 0.0730290680508934, 'min_samples_leaf': 0.48356708840322127, 'min_weight_fraction_leaf': 0.010331595962849102, 'max_features': 0.7837626062675029}. Best is trial 208 with value: 0.8264270922211081.[0m
[32m[I 2022-04-21 11:39:23,581][0m Trial 383 finished with value: 0.7922340978780162 and parameters: {'splitter': 'best', 'min_samples_split': 0.1118271004577263, 'min_samples_leaf': 0.009743169126114098, 'min_weight_fraction_leaf': 0.03885186264060428, 'max_features': 0.3706631826903399}. Best is trial 208 with value: 0.8264270922211081.[0m
[32m[I 2022-04-21 11:39:23,956][0m Trial 384 finished with value: 0.5587137595437769 and parameters: {'splitter': 'best', 'min_samples_split': 0.08484139435578504, 'min_samples_leaf': 0.019934854029402645, 'min_weight_fraction_leaf': 0.4498732483780847, 'max_features': 0.5939937366180105}. Best is trial 208 with value: 0.8264270922211081.[0m
[32m[I 2022-04-21 11:39:24,131][0m Trial 385 finished with value: 0.570793744165484 and parameters: {'splitter': 'best', 'min_samples_split': 0.12016663572773986, 'min_samples_leaf': 0.3841522095069482, 'min_weight_fraction_leaf': 0.006499549655953067, 'max_features': 0.33519862020972196}. Best is trial 208 with value: 0.8264270922211081.[0m
[32m[I 2022-04-21 11:39:24,458][0m Trial 386 finished with value: 0.8135498066099602 and parameters: {'splitter': 'best', 'min_samples_split': 0.19081817523753797, 'min_samples_leaf': 0.02979283969860505, 'min_weight_fraction_leaf': 0.02082970503722728, 'max_features': 0.4125886612918639}. Best is trial 208 with value: 0.8264270922211081.[0m
[32m[I 2022-04-21 11:39:24,681][0m Trial 387 finished with value: 0.6728892537474418 and parameters: {'splitter': 'random', 'min_samples_split': 0.09874914489709291, 'min_samples_leaf': 0.22490952303882508, 'min_weight_fraction_leaf': 0.01588909359361315, 'max_features': 0.3025789223277984}. Best is trial 208 with value: 0.8264270922211081.[0m
[32m[I 2022-04-21 11:39:25,254][0m Trial 388 finished with value: 0.8107889398507778 and parameters: {'splitter': 'best', 'min_samples_split': 0.1103683401140638, 'min_samples_leaf': 0.013025278940983692, 'min_weight_fraction_leaf': 0.00046352954733196866, 'max_features': 0.38505928065421147}. Best is trial 208 with value: 0.8264270922211081.[0m
[32m[I 2022-04-21 11:39:25,663][0m Trial 389 finished with value: 0.7995460735035287 and parameters: {'splitter': 'best', 'min_samples_split': 0.07839102227605683, 'min_samples_leaf': 0.008672022564902668, 'min_weight_fraction_leaf': 0.06169482783703705, 'max_features': 0.3603499195779963}. Best is trial 208 with value: 0.8264270922211081.[0m
[32m[I 2022-04-21 11:39:26,260][0m Trial 390 finished with value: 0.8067242744812393 and parameters: {'splitter': 'best', 'min_samples_split': 0.09191998315801553, 'min_samples_leaf': 0.021371198694995014, 'min_weight_fraction_leaf': 0.030924108090303444, 'max_features': 0.42614744477463296}. Best is trial 208 with value: 0.8264270922211081.[0m
[32m[I 2022-04-21 11:39:26,671][0m Trial 391 finished with value: 0.6704296704278526 and parameters: {'splitter': 'best', 'min_samples_split': 0.06491145599361862, 'min_samples_leaf': 0.03809817619425006, 'min_weight_fraction_leaf': 0.24091279145677233, 'max_features': 0.39905784818451784}. Best is trial 208 with value: 0.8264270922211081.[0m
/media/san2_ssd/data/Workdir/survival/utils.py:305: RuntimeWarning: invalid value encountered in true_divide
  pdfs = np.gradient(1-survs,axis=1)/norms
[32m[I 2022-04-21 11:39:27,383][0m Trial 392 finished with value: 0.8119311836198102 and parameters: {'splitter': 'best', 'min_samples_split': 0.1019300650507736, 'min_samples_leaf': 0.009058996301137545, 'min_weight_fraction_leaf': 0.0001483175600137561, 'max_features': 0.3412761025302241}. Best is trial 208 with value: 0.8264270922211081.[0m
[32m[I 2022-04-21 11:39:27,811][0m Trial 393 finished with value: 0.8206088196954472 and parameters: {'splitter': 'best', 'min_samples_split': 0.11926429249791946, 'min_samples_leaf': 0.001293268970630178, 'min_weight_fraction_leaf': 0.017062119306567813, 'max_features': 0.3716847894393194}. Best is trial 208 with value: 0.8264270922211081.[0m
[32m[I 2022-04-21 11:39:28,214][0m Trial 394 finished with value: 0.7937647802588381 and parameters: {'splitter': 'best', 'min_samples_split': 0.1192826370766836, 'min_samples_leaf': 0.00813226105846692, 'min_weight_fraction_leaf': 0.04430946570043791, 'max_features': 0.36361798429026615}. Best is trial 208 with value: 0.8264270922211081.[0m
[32m[I 2022-04-21 11:39:28,695][0m Trial 395 finished with value: 0.807785174313117 and parameters: {'splitter': 'best', 'min_samples_split': 0.11953701574243321, 'min_samples_leaf': 0.0016280104857106115, 'min_weight_fraction_leaf': 0.032990546434867006, 'max_features': 0.31761423060830735}. Best is trial 208 with value: 0.8264270922211081.[0m
[32m[I 2022-04-21 11:39:28,999][0m Trial 396 finished with value: 0.7043093653255006 and parameters: {'splitter': 'best', 'min_samples_split': 0.4043270991775422, 'min_samples_leaf': 0.018503993410265325, 'min_weight_fraction_leaf': 0.02450911872827593, 'max_features': 0.2803717194394762}. Best is trial 208 with value: 0.8264270922211081.[0m
/media/san2_ssd/data/Workdir/survival/utils.py:305: RuntimeWarning: invalid value encountered in true_divide
  pdfs = np.gradient(1-survs,axis=1)/norms
[32m[I 2022-04-21 11:39:29,449][0m Trial 397 finished with value: 0.7184480064350066 and parameters: {'splitter': 'best', 'min_samples_split': 0.3741901171486847, 'min_samples_leaf': 0.002021741497983027, 'min_weight_fraction_leaf': 0.016942689217177682, 'max_features': 0.346264500243222}. Best is trial 208 with value: 0.8264270922211081.[0m
[32m[I 2022-04-21 11:39:29,740][0m Trial 398 finished with value: 0.8202642242182842 and parameters: {'splitter': 'best', 'min_samples_split': 0.13067445631623298, 'min_samples_leaf': 0.01743313601728093, 'min_weight_fraction_leaf': 0.008993264810240433, 'max_features': 0.37851457693398965}. Best is trial 208 with value: 0.8264270922211081.[0m
[32m[I 2022-04-21 11:39:30,064][0m Trial 399 finished with value: 0.7959040537745821 and parameters: {'splitter': 'best', 'min_samples_split': 0.12580214922380803, 'min_samples_leaf': 0.02664567847607617, 'min_weight_fraction_leaf': 0.009593626408886254, 'max_features': 0.3683099648322494}. Best is trial 208 with value: 0.8264270922211081.[0m
/media/san2_ssd/data/Workdir/survival/utils.py:305: RuntimeWarning: invalid value encountered in true_divide
  pdfs = np.gradient(1-survs,axis=1)/norms
[32m[I 2022-04-21 11:39:30,217][0m Trial 400 finished with value: 0.8089353113068626 and parameters: {'splitter': 'random', 'min_samples_split': 0.1318674388634745, 'min_samples_leaf': 0.001251810591380749, 'min_weight_fraction_leaf': 0.010080522048854994, 'max_features': 0.32544377897405036}. Best is trial 208 with value: 0.8264270922211081.[0m
[32m[I 2022-04-21 11:39:30,512][0m Trial 401 finished with value: 0.8139606146569196 and parameters: {'splitter': 'best', 'min_samples_split': 0.13304283344595436, 'min_samples_leaf': 0.021101336988129254, 'min_weight_fraction_leaf': 0.015412124453347125, 'max_features': 0.37907474241341044}. Best is trial 208 with value: 0.8264270922211081.[0m
[32m[I 2022-04-21 11:39:30,964][0m Trial 402 finished with value: 0.8220563450973206 and parameters: {'splitter': 'best', 'min_samples_split': 0.11186569518169637, 'min_samples_leaf': 0.01965307495805599, 'min_weight_fraction_leaf': 0.007802747559893886, 'max_features': 0.34650397626262286}. Best is trial 208 with value: 0.8264270922211081.[0m
[32m[I 2022-04-21 11:39:31,085][0m Trial 403 finished with value: 0.6860231569672623 and parameters: {'splitter': 'best', 'min_samples_split': 0.11893069918402907, 'min_samples_leaf': 0.2087006250410982, 'min_weight_fraction_leaf': 0.021420344472788126, 'max_features': 0.30861284417323065}. Best is trial 208 with value: 0.8264270922211081.[0m
[32m[I 2022-04-21 11:39:31,503][0m Trial 404 finished with value: 0.8011338329660159 and parameters: {'splitter': 'best', 'min_samples_split': 0.13873150086388747, 'min_samples_leaf': 0.030602935213087608, 'min_weight_fraction_leaf': 0.00808498828568246, 'max_features': 0.3434226571066927}. Best is trial 208 with value: 0.8264270922211081.[0m
/media/san2_ssd/data/Workdir/survival/utils.py:305: RuntimeWarning: invalid value encountered in true_divide
  pdfs = np.gradient(1-survs,axis=1)/norms
[32m[I 2022-04-21 11:39:32,152][0m Trial 405 finished with value: 0.8102395458634367 and parameters: {'splitter': 'best', 'min_samples_split': 0.11385554307585305, 'min_samples_leaf': 0.018004912721649002, 'min_weight_fraction_leaf': 0.0005210352436479018, 'max_features': 0.33468744529318323}. Best is trial 208 with value: 0.8264270922211081.[0m
[32m[I 2022-04-21 11:39:32,861][0m Trial 406 finished with value: 0.8050960588059409 and parameters: {'splitter': 'best', 'min_samples_split': 0.28780192329913423, 'min_samples_leaf': 0.015731475103274176, 'min_weight_fraction_leaf': 0.0169546742097267, 'max_features': 0.2899421528284032}. Best is trial 208 with value: 0.8264270922211081.[0m
[32m[I 2022-04-21 11:39:33,449][0m Trial 407 finished with value: 0.7991887896754692 and parameters: {'splitter': 'best', 'min_samples_split': 0.12692344611027181, 'min_samples_leaf': 0.030245077874402098, 'min_weight_fraction_leaf': 0.0331241007801181, 'max_features': 0.36469150831401786}. Best is trial 208 with value: 0.8264270922211081.[0m
[32m[I 2022-04-21 11:39:33,886][0m Trial 408 finished with value: 0.8094591835438036 and parameters: {'splitter': 'best', 'min_samples_split': 0.05493352994134354, 'min_samples_leaf': 0.04140929192853769, 'min_weight_fraction_leaf': 2.4983036894504068e-05, 'max_features': 0.3534512072232145}. Best is trial 208 with value: 0.8264270922211081.[0m
[32m[I 2022-04-21 11:39:34,322][0m Trial 409 finished with value: 0.8067856555270128 and parameters: {'splitter': 'best', 'min_samples_split': 0.10664416602353985, 'min_samples_leaf': 0.016218169335000997, 'min_weight_fraction_leaf': 0.02344729233051021, 'max_features': 0.3194741125902691}. Best is trial 208 with value: 0.8264270922211081.[0m
[32m[I 2022-04-21 11:39:34,922][0m Trial 410 finished with value: 0.8053898464857688 and parameters: {'splitter': 'best', 'min_samples_split': 0.07194936260094288, 'min_samples_leaf': 0.02323617253952523, 'min_weight_fraction_leaf': 0.10934833740601946, 'max_features': 0.8089532935766761}. Best is trial 208 with value: 0.8264270922211081.[0m
[32m[I 2022-04-21 11:39:35,129][0m Trial 411 finished with value: 0.8111087255555478 and parameters: {'splitter': 'random', 'min_samples_split': 0.0891488555190637, 'min_samples_leaf': 0.0013822377278174328, 'min_weight_fraction_leaf': 0.014407735813906884, 'max_features': 0.37825045491730386}. Best is trial 208 with value: 0.8264270922211081.[0m
[32m[I 2022-04-21 11:39:35,574][0m Trial 412 finished with value: 0.7955344136823349 and parameters: {'splitter': 'best', 'min_samples_split': 0.02520228415226075, 'min_samples_leaf': 0.01031260332983291, 'min_weight_fraction_leaf': 0.08094958269307104, 'max_features': 0.5112738740178289}. Best is trial 208 with value: 0.8264270922211081.[0m
[32m[I 2022-04-21 11:39:35,841][0m Trial 413 finished with value: 0.8070566427442175 and parameters: {'splitter': 'best', 'min_samples_split': 0.11672795665198427, 'min_samples_leaf': 0.032996492335525415, 'min_weight_fraction_leaf': 0.008857335584270687, 'max_features': 0.3451851018344883}. Best is trial 208 with value: 0.8264270922211081.[0m
/media/san2_ssd/data/Workdir/survival/utils.py:305: RuntimeWarning: invalid value encountered in true_divide
  pdfs = np.gradient(1-survs,axis=1)/norms
[32m[I 2022-04-21 11:39:36,172][0m Trial 414 finished with value: 0.8139244116906242 and parameters: {'splitter': 'best', 'min_samples_split': 0.13105258980548445, 'min_samples_leaf': 0.015813996405512662, 'min_weight_fraction_leaf': 0.025535769235714847, 'max_features': 0.3845721950102663}. Best is trial 208 with value: 0.8264270922211081.[0m
[32m[I 2022-04-21 11:39:36,696][0m Trial 415 finished with value: 0.8176326077949092 and parameters: {'splitter': 'best', 'min_samples_split': 0.10985124305005523, 'min_samples_leaf': 0.02570386720937242, 'min_weight_fraction_leaf': 0.009588104721562787, 'max_features': 0.46816792344938823}. Best is trial 208 with value: 0.8264270922211081.[0m
[32m[I 2022-04-21 11:39:37,315][0m Trial 416 finished with value: 0.8007213611387811 and parameters: {'splitter': 'best', 'min_samples_split': 0.09658252103820476, 'min_samples_leaf': 0.051156382240316225, 'min_weight_fraction_leaf': 0.038663213797625454, 'max_features': 0.34878264182426333}. Best is trial 208 with value: 0.8264270922211081.[0m
/media/san2_ssd/data/Workdir/survival/utils.py:305: RuntimeWarning: invalid value encountered in true_divide
  pdfs = np.gradient(1-survs,axis=1)/norms
/media/san2_ssd/data/Workdir/survival/utils.py:305: RuntimeWarning: invalid value encountered in true_divide
  pdfs = np.gradient(1-survs,axis=1)/norms
/media/san2_ssd/data/Workdir/survival/utils.py:305: RuntimeWarning: invalid value encountered in true_divide
  pdfs = np.gradient(1-survs,axis=1)/norms
[32m[I 2022-04-21 11:39:37,987][0m Trial 417 finished with value: 0.8178607555271927 and parameters: {'splitter': 'best', 'min_samples_split': 0.06090950383781406, 'min_samples_leaf': 0.010585340349892185, 'min_weight_fraction_leaf': 0.01782034795977303, 'max_features': 0.32041085865369134}. Best is trial 208 with value: 0.8264270922211081.[0m
[32m[I 2022-04-21 11:39:38,341][0m Trial 418 finished with value: 0.45310702796855046 and parameters: {'splitter': 'best', 'min_samples_split': 0.08545559214134545, 'min_samples_leaf': 0.02654406513374026, 'min_weight_fraction_leaf': 0.49992478003484175, 'max_features': 0.3632133077367273}. Best is trial 208 with value: 0.8264270922211081.[0m
[32m[I 2022-04-21 11:39:38,914][0m Trial 419 finished with value: 0.8014645736738361 and parameters: {'splitter': 'best', 'min_samples_split': 0.1424225114909444, 'min_samples_leaf': 0.039434973384971275, 'min_weight_fraction_leaf': 0.0003988670039009098, 'max_features': 0.2156997631176656}. Best is trial 208 with value: 0.8264270922211081.[0m
[32m[I 2022-04-21 11:39:39,647][0m Trial 420 finished with value: 0.8045356795130365 and parameters: {'splitter': 'best', 'min_samples_split': 0.07740235704569601, 'min_samples_leaf': 0.016181545479610496, 'min_weight_fraction_leaf': 0.029581646260483287, 'max_features': 0.569325124124075}. Best is trial 208 with value: 0.8264270922211081.[0m
[32m[I 2022-04-21 11:39:40,499][0m Trial 421 finished with value: 0.8142561023586572 and parameters: {'splitter': 'best', 'min_samples_split': 0.10936260597237273, 'min_samples_leaf': 0.0013824950124107678, 'min_weight_fraction_leaf': 0.015752615120102405, 'max_features': 0.42106840706273385}. Best is trial 208 with value: 0.8264270922211081.[0m
[32m[I 2022-04-21 11:39:40,912][0m Trial 422 finished with value: 0.8031919366659915 and parameters: {'splitter': 'best', 'min_samples_split': 0.1211225269368332, 'min_samples_leaf': 0.011772609984847578, 'min_weight_fraction_leaf': 0.0510751937060941, 'max_features': 0.3945415834424615}. Best is trial 208 with value: 0.8264270922211081.[0m
[32m[I 2022-04-21 11:39:41,100][0m Trial 423 finished with value: 0.8153521250161798 and parameters: {'splitter': 'random', 'min_samples_split': 0.10034516322386847, 'min_samples_leaf': 0.02346820688776627, 'min_weight_fraction_leaf': 0.008439997151028847, 'max_features': 0.29670419196850356}. Best is trial 208 with value: 0.8264270922211081.[0m
[32m[I 2022-04-21 11:39:41,300][0m Trial 424 finished with value: 0.7956239512305079 and parameters: {'splitter': 'best', 'min_samples_split': 0.09104663687879226, 'min_samples_leaf': 0.10595889338898726, 'min_weight_fraction_leaf': 0.024894559278633734, 'max_features': 0.26795455868055623}. Best is trial 208 with value: 0.8264270922211081.[0m
[32m[I 2022-04-21 11:39:41,518][0m Trial 425 finished with value: 0.8029688641650239 and parameters: {'splitter': 'best', 'min_samples_split': 0.1255543914135669, 'min_samples_leaf': 0.1686160216859835, 'min_weight_fraction_leaf': 0.03695243466454541, 'max_features': 0.44416769347203094}. Best is trial 208 with value: 0.8264270922211081.[0m
[32m[I 2022-04-21 11:39:41,906][0m Trial 426 finished with value: 0.8025737095599096 and parameters: {'splitter': 'best', 'min_samples_split': 0.06891680062802927, 'min_samples_leaf': 0.059196503751039076, 'min_weight_fraction_leaf': 0.0130767747040501, 'max_features': 0.3774927288326986}. Best is trial 208 with value: 0.8264270922211081.[0m
[32m[I 2022-04-21 11:39:42,475][0m Trial 427 finished with value: 0.8074891135113795 and parameters: {'splitter': 'best', 'min_samples_split': 0.10957057295006004, 'min_samples_leaf': 0.035171577416048795, 'min_weight_fraction_leaf': 0.007745342362737553, 'max_features': 0.41005636855929084}. Best is trial 208 with value: 0.8264270922211081.[0m
[32m[I 2022-04-21 11:39:42,771][0m Trial 428 finished with value: 0.5699430469924989 and parameters: {'splitter': 'best', 'min_samples_split': 0.08076132699469155, 'min_samples_leaf': 0.010598142441311059, 'min_weight_fraction_leaf': 0.3793292615885473, 'max_features': 0.36038378190405884}. Best is trial 208 with value: 0.8264270922211081.[0m
[32m[I 2022-04-21 11:39:43,499][0m Trial 429 finished with value: 0.8058694226076693 and parameters: {'splitter': 'best', 'min_samples_split': 0.0973194190313766, 'min_samples_leaf': 0.001584396204739564, 'min_weight_fraction_leaf': 0.023296652004100592, 'max_features': 0.3877529662540547}. Best is trial 208 with value: 0.8264270922211081.[0m
/media/san2_ssd/data/Workdir/survival/utils.py:305: RuntimeWarning: invalid value encountered in true_divide
  pdfs = np.gradient(1-survs,axis=1)/norms
/media/san2_ssd/data/Workdir/survival/utils.py:305: RuntimeWarning: invalid value encountered in true_divide
  pdfs = np.gradient(1-survs,axis=1)/norms
/media/san2_ssd/data/Workdir/survival/utils.py:305: RuntimeWarning: invalid value encountered in true_divide
  pdfs = np.gradient(1-survs,axis=1)/norms
/media/san2_ssd/data/Workdir/survival/utils.py:305: RuntimeWarning: invalid value encountered in true_divide
  pdfs = np.gradient(1-survs,axis=1)/norms
/media/san2_ssd/data/Workdir/survival/utils.py:305: RuntimeWarning: invalid value encountered in true_divide
  pdfs = np.gradient(1-survs,axis=1)/norms
[32m[I 2022-04-21 11:39:44,382][0m Trial 430 finished with value: 0.8173993006584205 and parameters: {'splitter': 'best', 'min_samples_split': 0.040132370877237145, 'min_samples_leaf': 0.019288463323178028, 'min_weight_fraction_leaf': 0.0001322391830667217, 'max_features': 0.7275483566396993}. Best is trial 208 with value: 0.8264270922211081.[0m
[32m[I 2022-04-21 11:39:44,618][0m Trial 431 finished with value: 0.8023706060652062 and parameters: {'splitter': 'best', 'min_samples_split': 0.13708317313320784, 'min_samples_leaf': 0.028469358968297442, 'min_weight_fraction_leaf': 0.01743028560229126, 'max_features': 0.32989816493715524}. Best is trial 208 with value: 0.8264270922211081.[0m
/media/san2_ssd/data/Workdir/survival/utils.py:305: RuntimeWarning: invalid value encountered in true_divide
  pdfs = np.gradient(1-survs,axis=1)/norms
[32m[I 2022-04-21 11:39:45,011][0m Trial 432 finished with value: 0.8165832218714539 and parameters: {'splitter': 'best', 'min_samples_split': 0.11092275684491774, 'min_samples_leaf': 0.01086880409079554, 'min_weight_fraction_leaf': 0.00011558162002549277, 'max_features': 0.4103253429204622}. Best is trial 208 with value: 0.8264270922211081.[0m
[32m[I 2022-04-21 11:39:45,232][0m Trial 433 finished with value: 0.7969375026237422 and parameters: {'splitter': 'best', 'min_samples_split': 0.1237577884614749, 'min_samples_leaf': 0.042333812109676974, 'min_weight_fraction_leaf': 0.03074293052423173, 'max_features': 0.33605727284657194}. Best is trial 208 with value: 0.8264270922211081.[0m
[32m[I 2022-04-21 11:39:45,306][0m Trial 434 finished with value: 0.3587626774868874 and parameters: {'splitter': 'random', 'min_samples_split': 0.08567289064540808, 'min_samples_leaf': 0.019680677461808446, 'min_weight_fraction_leaf': 0.3045932672403792, 'max_features': 0.14106342841613595}. Best is trial 208 with value: 0.8264270922211081.[0m
/media/san2_ssd/data/Workdir/survival/utils.py:305: RuntimeWarning: invalid value encountered in true_divide
  pdfs = np.gradient(1-survs,axis=1)/norms
[32m[I 2022-04-21 11:39:45,716][0m Trial 435 finished with value: 0.8271205444415821 and parameters: {'splitter': 'best', 'min_samples_split': 0.1059689184869954, 'min_samples_leaf': 0.009137756359910622, 'min_weight_fraction_leaf': 0.00982988266321199, 'max_features': 0.4265727952135367}. Best is trial 435 with value: 0.8271205444415821.[0m
