[32m[I 2022-04-22 04:00:32,560][0m Trial 712 finished with value: 0.6711796766006307 and parameters: {'alpha': 3.9253006071994814, 'ties': 'breslow'}. Best is trial 51 with value: 0.6718225721814719.[0m
[32m[I 2022-04-22 04:01:01,013][0m Trial 713 finished with value: 0.6713565979142997 and parameters: {'alpha': 3.71703254664193, 'ties': 'breslow'}. Best is trial 51 with value: 0.6718225721814719.[0m
[32m[I 2022-04-22 04:01:29,995][0m Trial 714 finished with value: 0.6713323130079433 and parameters: {'alpha': 3.8460890641104326, 'ties': 'breslow'}. Best is trial 51 with value: 0.6718225721814719.[0m
[32m[I 2022-04-22 04:01:58,303][0m Trial 715 finished with value: 0.6710385818290442 and parameters: {'alpha': 3.618113717835911, 'ties': 'breslow'}. Best is trial 51 with value: 0.6718225721814719.[0m
[32m[I 2022-04-22 04:02:26,452][0m Trial 716 finished with value: 0.6708528438624721 and parameters: {'alpha': 3.4928338267948846, 'ties': 'breslow'}. Best is trial 51 with value: 0.6718225721814719.[0m
[32m[I 2022-04-22 04:02:52,478][0m Trial 717 finished with value: 0.6713605392800839 and parameters: {'alpha': 3.7398056146243017, 'ties': 'breslow'}. Best is trial 51 with value: 0.6718225721814719.[0m
[32m[I 2022-04-22 04:03:19,771][0m Trial 718 finished with value: 0.6710232632602642 and parameters: {'alpha': 3.915571491370868, 'ties': 'efron'}. Best is trial 51 with value: 0.6718225721814719.[0m
[32m[I 2022-04-22 04:03:49,104][0m Trial 719 finished with value: 0.6715012772624975 and parameters: {'alpha': 3.80814235493367, 'ties': 'breslow'}. Best is trial 51 with value: 0.6718225721814719.[0m
[32m[I 2022-04-22 04:04:17,113][0m Trial 720 finished with value: 0.671035170688301 and parameters: {'alpha': 3.66498742043235, 'ties': 'breslow'}. Best is trial 51 with value: 0.6718225721814719.[0m
[32m[I 2022-04-22 04:04:45,651][0m Trial 721 finished with value: 0.6705709596314063 and parameters: {'alpha': 4.046439294118922, 'ties': 'breslow'}. Best is trial 51 with value: 0.6718225721814719.[0m
[32m[I 2022-04-22 04:05:14,156][0m Trial 722 finished with value: 0.6709611038444385 and parameters: {'alpha': 3.5690565343785847, 'ties': 'breslow'}. Best is trial 51 with value: 0.6718225721814719.[0m
[32m[I 2022-04-22 04:05:44,499][0m Trial 723 finished with value: 0.6713378682047766 and parameters: {'alpha': 3.880850864925735, 'ties': 'breslow'}. Best is trial 51 with value: 0.6718225721814719.[0m
[32m[I 2022-04-22 04:06:14,579][0m Trial 724 finished with value: 0.6713571281393407 and parameters: {'alpha': 3.7462531224605393, 'ties': 'breslow'}. Best is trial 51 with value: 0.6718225721814719.[0m
[32m[I 2022-04-22 04:06:43,033][0m Trial 725 finished with value: 0.671035170688301 and parameters: {'alpha': 3.6750416141162403, 'ties': 'breslow'}. Best is trial 51 with value: 0.6718225721814719.[0m
[32m[I 2022-04-22 04:07:12,986][0m Trial 726 finished with value: 0.6703459645816847 and parameters: {'alpha': 3.9837477557544476, 'ties': 'breslow'}. Best is trial 51 with value: 0.6718225721814719.[0m
[32m[I 2022-04-22 04:07:41,612][0m Trial 727 finished with value: 0.6704848941943556 and parameters: {'alpha': 4.130621816369145, 'ties': 'breslow'}. Best is trial 51 with value: 0.6718225721814719.[0m
[32m[I 2022-04-22 04:08:07,858][0m Trial 728 finished with value: 0.6713391442925675 and parameters: {'alpha': 3.8294210046210906, 'ties': 'breslow'}. Best is trial 51 with value: 0.6718225721814719.[0m
[32m[I 2022-04-22 04:08:35,653][0m Trial 729 finished with value: 0.6715134091726827 and parameters: {'alpha': 3.758546596188088, 'ties': 'breslow'}. Best is trial 51 with value: 0.6718225721814719.[0m
[32m[I 2022-04-22 04:08:59,629][0m Trial 730 finished with value: 0.6709264231191441 and parameters: {'alpha': 3.3818875940309865, 'ties': 'breslow'}. Best is trial 51 with value: 0.6718225721814719.[0m
[32m[I 2022-04-22 04:09:28,033][0m Trial 731 finished with value: 0.6709611038444385 and parameters: {'alpha': 3.5823319937314286, 'ties': 'breslow'}. Best is trial 51 with value: 0.6718225721814719.[0m
[32m[I 2022-04-22 04:09:56,885][0m Trial 732 finished with value: 0.6712563165473625 and parameters: {'alpha': 3.9058676335291955, 'ties': 'breslow'}. Best is trial 51 with value: 0.6718225721814719.[0m
[32m[I 2022-04-22 04:10:23,329][0m Trial 733 finished with value: 0.6715012772624975 and parameters: {'alpha': 3.7993079454874668, 'ties': 'breslow'}. Best is trial 51 with value: 0.6718225721814719.[0m
[32m[I 2022-04-22 04:10:50,568][0m Trial 734 finished with value: 0.6711977437780883 and parameters: {'alpha': 3.7044064440476863, 'ties': 'breslow'}. Best is trial 51 with value: 0.6718225721814719.[0m
[32m[I 2022-04-22 04:11:18,552][0m Trial 735 finished with value: 0.6709609715374141 and parameters: {'alpha': 3.628742561399974, 'ties': 'breslow'}. Best is trial 51 with value: 0.6718225721814719.[0m
[32m[I 2022-04-22 04:11:47,382][0m Trial 736 finished with value: 0.6707094963536256 and parameters: {'alpha': 3.9534244089758146, 'ties': 'efron'}. Best is trial 51 with value: 0.6718225721814719.[0m
[32m[I 2022-04-22 04:12:14,787][0m Trial 737 finished with value: 0.6708528438624721 and parameters: {'alpha': 3.488648693236583, 'ties': 'breslow'}. Best is trial 51 with value: 0.6718225721814719.[0m
[32m[I 2022-04-22 04:12:42,930][0m Trial 738 finished with value: 0.6713323130079433 and parameters: {'alpha': 3.8443705430219586, 'ties': 'breslow'}. Best is trial 51 with value: 0.6718225721814719.[0m
[32m[I 2022-04-22 04:13:10,628][0m Trial 739 finished with value: 0.6712758842947594 and parameters: {'alpha': 3.6992841112221173, 'ties': 'breslow'}. Best is trial 51 with value: 0.6718225721814719.[0m
[32m[I 2022-04-22 04:13:39,115][0m Trial 740 finished with value: 0.6709611038444385 and parameters: {'alpha': 3.5840217850843192, 'ties': 'breslow'}. Best is trial 51 with value: 0.6718225721814719.[0m
[32m[I 2022-04-22 04:14:07,907][0m Trial 741 finished with value: 0.6716643805773258 and parameters: {'alpha': 3.7819893548630286, 'ties': 'breslow'}. Best is trial 51 with value: 0.6718225721814719.[0m
[32m[I 2022-04-22 04:14:36,589][0m Trial 742 finished with value: 0.6704196804139302 and parameters: {'alpha': 4.024855199723667, 'ties': 'breslow'}. Best is trial 51 with value: 0.6718225721814719.[0m
[32m[I 2022-04-22 04:15:04,800][0m Trial 743 finished with value: 0.6714955486297959 and parameters: {'alpha': 3.878814610197249, 'ties': 'breslow'}. Best is trial 51 with value: 0.6718225721814719.[0m
[32m[I 2022-04-22 04:15:28,647][0m Trial 744 finished with value: 0.6713571281393407 and parameters: {'alpha': 3.7487574652495548, 'ties': 'breslow'}. Best is trial 51 with value: 0.6718225721814719.[0m
[32m[I 2022-04-22 04:15:56,673][0m Trial 745 finished with value: 0.670957560396671 and parameters: {'alpha': 3.6558508026098466, 'ties': 'breslow'}. Best is trial 51 with value: 0.6718225721814719.[0m
[32m[I 2022-04-22 04:16:24,281][0m Trial 746 finished with value: 0.6711796766006307 and parameters: {'alpha': 3.923845737465574, 'ties': 'breslow'}. Best is trial 51 with value: 0.6718225721814719.[0m
[32m[I 2022-04-22 04:16:54,390][0m Trial 747 finished with value: 0.6713571281393407 and parameters: {'alpha': 3.748653433228256, 'ties': 'breslow'}. Best is trial 51 with value: 0.6718225721814719.[0m
[32m[I 2022-04-22 04:17:24,309][0m Trial 748 finished with value: 0.6713323130079433 and parameters: {'alpha': 3.848204451014558, 'ties': 'breslow'}. Best is trial 51 with value: 0.6718225721814719.[0m
[32m[I 2022-04-22 04:17:54,088][0m Trial 749 finished with value: 0.6703833523716461 and parameters: {'alpha': 4.42041837967637, 'ties': 'breslow'}. Best is trial 51 with value: 0.6718225721814719.[0m
[32m[I 2022-04-22 04:18:22,368][0m Trial 750 finished with value: 0.6711926565615977 and parameters: {'alpha': 3.5333922796576185, 'ties': 'breslow'}. Best is trial 51 with value: 0.6718225721814719.[0m
[32m[I 2022-04-22 04:18:50,217][0m Trial 751 finished with value: 0.6705615341410874 and parameters: {'alpha': 4.1180764867326936, 'ties': 'breslow'}. Best is trial 51 with value: 0.6718225721814719.[0m
[32m[I 2022-04-22 04:19:20,259][0m Trial 752 finished with value: 0.671035170688301 and parameters: {'alpha': 3.67132554629793, 'ties': 'breslow'}. Best is trial 51 with value: 0.6718225721814719.[0m
[32m[I 2022-04-22 04:19:50,484][0m Trial 753 finished with value: 0.6703459645816847 and parameters: {'alpha': 3.982137787660035, 'ties': 'breslow'}. Best is trial 51 with value: 0.6718225721814719.[0m
[32m[I 2022-04-22 04:20:32,425][0m Trial 754 finished with value: 0.6683475876309644 and parameters: {'alpha': 0.5623235523697778, 'ties': 'efron'}. Best is trial 51 with value: 0.6718225721814719.[0m
[32m[I 2022-04-22 04:21:00,388][0m Trial 755 finished with value: 0.6704218476680716 and parameters: {'alpha': 4.531794213024784, 'ties': 'breslow'}. Best is trial 51 with value: 0.6718225721814719.[0m
[32m[I 2022-04-22 04:21:28,872][0m Trial 756 finished with value: 0.6715012772624975 and parameters: {'alpha': 3.8016126005503588, 'ties': 'breslow'}. Best is trial 51 with value: 0.6718225721814719.[0m
[32m[I 2022-04-22 04:21:56,998][0m Trial 757 finished with value: 0.6712563165473625 and parameters: {'alpha': 3.89195611618367, 'ties': 'breslow'}. Best is trial 51 with value: 0.6718225721814719.[0m
[32m[I 2022-04-22 04:22:25,512][0m Trial 758 finished with value: 0.671089394126948 and parameters: {'alpha': 3.4300660077849163, 'ties': 'breslow'}. Best is trial 51 with value: 0.6718225721814719.[0m
[32m[I 2022-04-22 04:22:55,326][0m Trial 759 finished with value: 0.6710392443611095 and parameters: {'alpha': 3.602040645349367, 'ties': 'breslow'}. Best is trial 51 with value: 0.6718225721814719.[0m
[32m[I 2022-04-22 04:23:24,599][0m Trial 760 finished with value: 0.6714381495717138 and parameters: {'alpha': 3.7206217757573072, 'ties': 'breslow'}. Best is trial 51 with value: 0.6718225721814719.[0m
[32m[I 2022-04-22 04:23:53,826][0m Trial 761 finished with value: 0.6716643805773258 and parameters: {'alpha': 3.7840385413629853, 'ties': 'breslow'}. Best is trial 51 with value: 0.6718225721814719.[0m
[32m[I 2022-04-22 04:24:21,812][0m Trial 762 finished with value: 0.6707310562196291 and parameters: {'alpha': 3.978612777763064, 'ties': 'breslow'}. Best is trial 51 with value: 0.6718225721814719.[0m
[32m[I 2022-04-22 04:24:50,913][0m Trial 763 finished with value: 0.671035170688301 and parameters: {'alpha': 3.6702407902115493, 'ties': 'breslow'}. Best is trial 51 with value: 0.6718225721814719.[0m
[32m[I 2022-04-22 04:25:19,681][0m Trial 764 finished with value: 0.6713323130079433 and parameters: {'alpha': 3.8411647277033265, 'ties': 'breslow'}. Best is trial 51 with value: 0.6718225721814719.[0m
[32m[I 2022-04-22 04:25:50,508][0m Trial 765 finished with value: 0.6711918185237238 and parameters: {'alpha': 3.5271854507164226, 'ties': 'breslow'}. Best is trial 51 with value: 0.6718225721814719.[0m
[32m[I 2022-04-22 04:26:19,105][0m Trial 766 finished with value: 0.6711982740031293 and parameters: {'alpha': 3.6966187209248655, 'ties': 'breslow'}. Best is trial 51 with value: 0.6718225721814719.[0m
[32m[I 2022-04-22 04:26:42,653][0m Trial 767 finished with value: 0.6715828289199117 and parameters: {'alpha': 3.789033972397222, 'ties': 'breslow'}. Best is trial 51 with value: 0.6718225721814719.[0m
[32m[I 2022-04-22 04:27:00,181][0m Trial 768 finished with value: 0.6712563165473625 and parameters: {'alpha': 3.9082315296711108, 'ties': 'breslow'}. Best is trial 51 with value: 0.6718225721814719.[0m
[32m[I 2022-04-22 04:27:18,891][0m Trial 769 finished with value: 0.6707257400948092 and parameters: {'alpha': 4.065559927543811, 'ties': 'breslow'}. Best is trial 51 with value: 0.6718225721814719.[0m
[32m[I 2022-04-22 04:27:38,981][0m Trial 770 finished with value: 0.6709611038444385 and parameters: {'alpha': 3.5807816084977575, 'ties': 'breslow'}. Best is trial 51 with value: 0.6718225721814719.[0m
[32m[I 2022-04-22 04:28:01,134][0m Trial 771 finished with value: 0.6714206959499815 and parameters: {'alpha': 3.827461081214209, 'ties': 'breslow'}. Best is trial 51 with value: 0.6718225721814719.[0m
[32m[I 2022-04-22 04:28:28,931][0m Trial 772 finished with value: 0.6709609715374141 and parameters: {'alpha': 3.6306006914838878, 'ties': 'breslow'}. Best is trial 51 with value: 0.6718225721814719.[0m
[32m[I 2022-04-22 04:28:56,644][0m Trial 773 finished with value: 0.6705386198613059 and parameters: {'alpha': 4.2093585791903685, 'ties': 'breslow'}. Best is trial 51 with value: 0.6718225721814719.[0m
[32m[I 2022-04-22 04:29:24,315][0m Trial 774 finished with value: 0.6713571281393407 and parameters: {'alpha': 3.747782541235377, 'ties': 'breslow'}. Best is trial 51 with value: 0.6718225721814719.[0m
[32m[I 2022-04-22 04:29:52,700][0m Trial 775 finished with value: 0.6708644091240529 and parameters: {'alpha': 3.9455599010282087, 'ties': 'efron'}. Best is trial 51 with value: 0.6718225721814719.[0m
[32m[I 2022-04-22 04:30:21,675][0m Trial 776 finished with value: 0.6714096154867404 and parameters: {'alpha': 3.8521295496304075, 'ties': 'breslow'}. Best is trial 51 with value: 0.6718225721814719.[0m
[32m[I 2022-04-22 04:30:48,818][0m Trial 777 finished with value: 0.6711167223457152 and parameters: {'alpha': 3.6839355987247133, 'ties': 'breslow'}. Best is trial 51 with value: 0.6718225721814719.[0m
[32m[I 2022-04-22 04:31:17,044][0m Trial 778 finished with value: 0.6717449618898417 and parameters: {'alpha': 3.7670553387231793, 'ties': 'breslow'}. Best is trial 51 with value: 0.6718225721814719.[0m
[32m[I 2022-04-22 04:31:42,451][0m Trial 779 finished with value: 0.670419017881865 and parameters: {'alpha': 4.014396205128487, 'ties': 'breslow'}. Best is trial 51 with value: 0.6718225721814719.[0m
[32m[I 2022-04-22 04:32:08,116][0m Trial 780 finished with value: 0.6709366444585252 and parameters: {'alpha': 3.4802609751146862, 'ties': 'breslow'}. Best is trial 51 with value: 0.6718225721814719.[0m
[32m[I 2022-04-22 04:32:35,252][0m Trial 781 finished with value: 0.6712563165473625 and parameters: {'alpha': 3.893964474256777, 'ties': 'breslow'}. Best is trial 51 with value: 0.6718225721814719.[0m
[32m[I 2022-04-22 04:33:01,164][0m Trial 782 finished with value: 0.6709609715374141 and parameters: {'alpha': 3.6297677457491804, 'ties': 'breslow'}. Best is trial 51 with value: 0.6718225721814719.[0m
[32m[I 2022-04-22 04:33:28,500][0m Trial 783 finished with value: 0.6700806149536447 and parameters: {'alpha': 3.2398448972776857, 'ties': 'breslow'}. Best is trial 51 with value: 0.6718225721814719.[0m
[32m[I 2022-04-22 04:33:57,296][0m Trial 784 finished with value: 0.6718225721814719 and parameters: {'alpha': 3.7698333785866267, 'ties': 'breslow'}. Best is trial 51 with value: 0.6718225721814719.[0m
[32m[I 2022-04-22 04:34:23,780][0m Trial 785 finished with value: 0.6715828289199117 and parameters: {'alpha': 3.7906885752009303, 'ties': 'breslow'}. Best is trial 51 with value: 0.6718225721814719.[0m
[32m[I 2022-04-22 04:34:52,928][0m Trial 786 finished with value: 0.6711982740031293 and parameters: {'alpha': 3.6938153792302177, 'ties': 'breslow'}. Best is trial 51 with value: 0.6718225721814719.[0m
[32m[I 2022-04-22 04:35:20,147][0m Trial 787 finished with value: 0.6712563165473625 and parameters: {'alpha': 3.8916904320639314, 'ties': 'breslow'}. Best is trial 51 with value: 0.6718225721814719.[0m
[32m[I 2022-04-22 04:35:47,752][0m Trial 788 finished with value: 0.6710387141360685 and parameters: {'alpha': 3.5645525442376123, 'ties': 'breslow'}. Best is trial 51 with value: 0.6718225721814719.[0m
[32m[I 2022-04-22 04:36:16,162][0m Trial 789 finished with value: 0.6703417154030678 and parameters: {'alpha': 4.002112675059258, 'ties': 'breslow'}. Best is trial 51 with value: 0.6718225721814719.[0m
[32m[I 2022-04-22 04:36:42,841][0m Trial 790 finished with value: 0.6715828289199117 and parameters: {'alpha': 3.790243224120385, 'ties': 'breslow'}. Best is trial 51 with value: 0.6718225721814719.[0m
[32m[I 2022-04-22 04:37:10,690][0m Trial 791 finished with value: 0.6711167223457152 and parameters: {'alpha': 3.6886936439786764, 'ties': 'breslow'}. Best is trial 51 with value: 0.6718225721814719.[0m
[32m[I 2022-04-22 04:37:37,102][0m Trial 792 finished with value: 0.6714872257783704 and parameters: {'alpha': 3.8553743481298772, 'ties': 'breslow'}. Best is trial 51 with value: 0.6718225721814719.[0m
[32m[I 2022-04-22 04:38:01,665][0m Trial 793 finished with value: 0.6709611038444385 and parameters: {'alpha': 3.5905376678072303, 'ties': 'breslow'}. Best is trial 51 with value: 0.6718225721814719.[0m
[32m[I 2022-04-22 04:38:31,194][0m Trial 794 finished with value: 0.6709219857925888 and parameters: {'alpha': 3.3867655074163245, 'ties': 'efron'}. Best is trial 51 with value: 0.6718225721814719.[0m
[32m[I 2022-04-22 04:38:59,560][0m Trial 795 finished with value: 0.6710429125554638 and parameters: {'alpha': 3.944726955407857, 'ties': 'breslow'}. Best is trial 51 with value: 0.6718225721814719.[0m
[32m[I 2022-04-22 04:39:28,085][0m Trial 796 finished with value: 0.6704839238494573 and parameters: {'alpha': 4.110926470036406, 'ties': 'breslow'}. Best is trial 51 with value: 0.6718225721814719.[0m
[32m[I 2022-04-22 04:39:54,890][0m Trial 797 finished with value: 0.6714381495717138 and parameters: {'alpha': 3.737837451384182, 'ties': 'breslow'}. Best is trial 51 with value: 0.6718225721814719.[0m
[32m[I 2022-04-22 04:40:23,792][0m Trial 798 finished with value: 0.6711765621996422 and parameters: {'alpha': 3.837388736196919, 'ties': 'breslow'}. Best is trial 51 with value: 0.6718225721814719.[0m
[32m[I 2022-04-22 04:40:51,289][0m Trial 799 finished with value: 0.670957560396671 and parameters: {'alpha': 3.661576288671175, 'ties': 'breslow'}. Best is trial 51 with value: 0.6718225721814719.[0m
[32m[I 2022-04-22 04:41:18,773][0m Trial 800 finished with value: 0.6709366444585252 and parameters: {'alpha': 3.4784299895071573, 'ties': 'breslow'}. Best is trial 51 with value: 0.6718225721814719.[0m
[32m[I 2022-04-22 04:41:48,326][0m Trial 801 finished with value: 0.6714352686560117 and parameters: {'alpha': 3.751276035556458, 'ties': 'breslow'}. Best is trial 51 with value: 0.6718225721814719.[0m
[32m[I 2022-04-22 04:42:15,148][0m Trial 802 finished with value: 0.6712563165473625 and parameters: {'alpha': 3.9034630130907493, 'ties': 'breslow'}. Best is trial 51 with value: 0.6718225721814719.[0m
[32m[I 2022-04-22 04:42:42,020][0m Trial 803 finished with value: 0.6710392443611095 and parameters: {'alpha': 3.602483153431792, 'ties': 'breslow'}. Best is trial 51 with value: 0.6718225721814719.[0m
[32m[I 2022-04-22 04:43:08,607][0m Trial 804 finished with value: 0.6715012772624975 and parameters: {'alpha': 3.7989975613736084, 'ties': 'breslow'}. Best is trial 51 with value: 0.6718225721814719.[0m
[32m[I 2022-04-22 04:43:36,485][0m Trial 805 finished with value: 0.6708098592683656 and parameters: {'alpha': 3.955229571974492, 'ties': 'breslow'}. Best is trial 51 with value: 0.6718225721814719.[0m
[32m[I 2022-04-22 04:44:04,213][0m Trial 806 finished with value: 0.6711167223457152 and parameters: {'alpha': 3.68935309344412, 'ties': 'breslow'}. Best is trial 51 with value: 0.6718225721814719.[0m
[32m[I 2022-04-22 04:44:32,060][0m Trial 807 finished with value: 0.6706491001480773 and parameters: {'alpha': 4.050510390560045, 'ties': 'breslow'}. Best is trial 51 with value: 0.6718225721814719.[0m
[32m[I 2022-04-22 04:44:58,780][0m Trial 808 finished with value: 0.6712618418137702 and parameters: {'alpha': 3.833379996141356, 'ties': 'breslow'}. Best is trial 51 with value: 0.6718225721814719.[0m
[32m[I 2022-04-22 04:45:26,341][0m Trial 809 finished with value: 0.6714381495717138 and parameters: {'alpha': 3.722673343422336, 'ties': 'breslow'}. Best is trial 51 with value: 0.6718225721814719.[0m
[32m[I 2022-04-22 04:45:52,747][0m Trial 810 finished with value: 0.6709611038444385 and parameters: {'alpha': 3.582261078022669, 'ties': 'breslow'}. Best is trial 51 with value: 0.6718225721814719.[0m
[32m[I 2022-04-22 04:46:19,345][0m Trial 811 finished with value: 0.6714105858316386 and parameters: {'alpha': 3.8634202877465826, 'ties': 'breslow'}. Best is trial 51 with value: 0.6718225721814719.[0m
[32m[I 2022-04-22 04:46:48,995][0m Trial 812 finished with value: 0.6715076594241265 and parameters: {'alpha': 3.7524579572100945, 'ties': 'efron'}. Best is trial 51 with value: 0.6718225721814719.[0m
[32m[I 2022-04-22 04:47:17,544][0m Trial 813 finished with value: 0.6708098592683656 and parameters: {'alpha': 3.9543912683710545, 'ties': 'breslow'}. Best is trial 51 with value: 0.6718225721814719.[0m
[32m[I 2022-04-22 04:47:45,704][0m Trial 814 finished with value: 0.670957560396671 and parameters: {'alpha': 3.655383828865078, 'ties': 'breslow'}. Best is trial 51 with value: 0.6718225721814719.[0m
[32m[I 2022-04-22 04:48:14,951][0m Trial 815 finished with value: 0.6700267039990222 and parameters: {'alpha': 2.869757139349599, 'ties': 'breslow'}. Best is trial 51 with value: 0.6718225721814719.[0m
[32m[I 2022-04-22 04:48:44,970][0m Trial 816 finished with value: 0.6715012772624975 and parameters: {'alpha': 3.7998196928999217, 'ties': 'breslow'}. Best is trial 51 with value: 0.6718225721814719.[0m
[32m[I 2022-04-22 04:49:13,634][0m Trial 817 finished with value: 0.6709611038444385 and parameters: {'alpha': 3.5687289367559814, 'ties': 'breslow'}. Best is trial 51 with value: 0.6718225721814719.[0m
[32m[I 2022-04-22 04:49:45,306][0m Trial 818 finished with value: 0.6702959960976916 and parameters: {'alpha': 3.032948751176052, 'ties': 'breslow'}. Best is trial 51 with value: 0.6718225721814719.[0m
