[32m[I 2022-04-21 20:04:38,547][0m Trial 736 finished with value: 0.841163702083222 and parameters: {'loss': 'coxph', 'learning_rate': 0.00020958150627324915, 'n_estimators': 324, 'criterion': 'friedman_mse', 'min_samples_split': 3, 'min_samples_leaf': 1, 'min_weight_fraction_leaf': 0.14238820478960268, 'min_impurity_decrease': 0.14916430788265106, 'max_features': 0.3070919991889972, 'subsample': 0.0774113283484191, 'dropout_rate': 0.02740780614446292, 'ccp_alpha': 0.17800409949188384}. Best is trial 583 with value: 0.8480221917497749.[0m
[32m[I 2022-04-21 20:05:08,668][0m Trial 737 finished with value: 0.8439363012668133 and parameters: {'loss': 'coxph', 'learning_rate': 0.0002778910308067599, 'n_estimators': 352, 'criterion': 'friedman_mse', 'min_samples_split': 3, 'min_samples_leaf': 1, 'min_weight_fraction_leaf': 0.14349841796102825, 'min_impurity_decrease': 0.1197796607207175, 'max_features': 0.2685083201450182, 'subsample': 0.07103661014391788, 'dropout_rate': 0.06676902285496053, 'ccp_alpha': 0.16868619650805536}. Best is trial 583 with value: 0.8480221917497749.[0m
[32m[I 2022-04-21 20:05:41,600][0m Trial 738 finished with value: 0.65 and parameters: {'loss': 'coxph', 'learning_rate': 0.00017080438796608307, 'n_estimators': 344, 'criterion': 'friedman_mse', 'min_samples_split': 9, 'min_samples_leaf': 1, 'min_weight_fraction_leaf': 0.13491080125698973, 'min_impurity_decrease': 0.1124603144531778, 'max_features': 0.2938325732041139, 'subsample': 0.10215251383265044, 'dropout_rate': 0.06258466623940494, 'ccp_alpha': 2.9306914767039354}. Best is trial 583 with value: 0.8480221917497749.[0m
[32m[I 2022-04-21 20:06:17,789][0m Trial 739 finished with value: 0.8477900077662672 and parameters: {'loss': 'coxph', 'learning_rate': 0.00023842646258113558, 'n_estimators': 321, 'criterion': 'friedman_mse', 'min_samples_split': 3, 'min_samples_leaf': 1, 'min_weight_fraction_leaf': 0.12592147594967404, 'min_impurity_decrease': 0.1693233247143932, 'max_features': 0.32859378987822735, 'subsample': 0.12891920197197976, 'dropout_rate': 0.031188147962187995, 'ccp_alpha': 0.0842981725274999}. Best is trial 583 with value: 0.8480221917497749.[0m
[32m[I 2022-04-21 20:06:51,896][0m Trial 740 finished with value: 0.7002676119308331 and parameters: {'loss': 'coxph', 'learning_rate': 0.000311847330751045, 'n_estimators': 320, 'criterion': 'friedman_mse', 'min_samples_split': 3, 'min_samples_leaf': 9, 'min_weight_fraction_leaf': 0.11600123320141935, 'min_impurity_decrease': 0.1574360300234426, 'max_features': 0.3210623788947226, 'subsample': 0.12533305899588604, 'dropout_rate': 0.014627314140949026, 'ccp_alpha': 0.3324087474283899}. Best is trial 583 with value: 0.8480221917497749.[0m
[32m[I 2022-04-21 20:07:17,951][0m Trial 741 finished with value: 0.8410188003154234 and parameters: {'loss': 'coxph', 'learning_rate': 0.00023265311633075166, 'n_estimators': 315, 'criterion': 'friedman_mse', 'min_samples_split': 3, 'min_samples_leaf': 1, 'min_weight_fraction_leaf': 0.12552621984724943, 'min_impurity_decrease': 0.1676070375480017, 'max_features': 0.3215394361242311, 'subsample': 0.14477063715816957, 'dropout_rate': 0.006902110854682328, 'ccp_alpha': 0.25832627675509984}. Best is trial 583 with value: 0.8480221917497749.[0m
[32m[I 2022-04-21 20:07:55,667][0m Trial 742 finished with value: 0.8421070840966388 and parameters: {'loss': 'coxph', 'learning_rate': 0.00021865365754097075, 'n_estimators': 335, 'criterion': 'friedman_mse', 'min_samples_split': 3, 'min_samples_leaf': 1, 'min_weight_fraction_leaf': 0.10855999978737843, 'min_impurity_decrease': 0.172784678181259, 'max_features': 0.33449207569493095, 'subsample': 0.12579088142651576, 'dropout_rate': 0.0017259652775141105, 'ccp_alpha': 0.08981007401933506}. Best is trial 583 with value: 0.8480221917497749.[0m
[32m[I 2022-04-21 20:08:24,436][0m Trial 743 finished with value: 0.841293859149453 and parameters: {'loss': 'coxph', 'learning_rate': 0.0003141985856676416, 'n_estimators': 319, 'criterion': 'friedman_mse', 'min_samples_split': 3, 'min_samples_leaf': 1, 'min_weight_fraction_leaf': 0.10025428762994291, 'min_impurity_decrease': 0.12022155990729208, 'max_features': 0.3146698920566533, 'subsample': 0.09066278092675543, 'dropout_rate': 0.032008143370765726, 'ccp_alpha': 0.23481593438908796}. Best is trial 583 with value: 0.8480221917497749.[0m
[32m[I 2022-04-21 20:08:54,744][0m Trial 744 finished with value: 0.8437454191696847 and parameters: {'loss': 'coxph', 'learning_rate': 0.00025503030766234206, 'n_estimators': 341, 'criterion': 'friedman_mse', 'min_samples_split': 3, 'min_samples_leaf': 1, 'min_weight_fraction_leaf': 0.125395636651472, 'min_impurity_decrease': 0.142735416672561, 'max_features': 0.2990150593086774, 'subsample': 0.1122547094454493, 'dropout_rate': 0.04140943828872584, 'ccp_alpha': 0.0024901577388752594}. Best is trial 583 with value: 0.8480221917497749.[0m
[32m[I 2022-04-21 20:09:35,585][0m Trial 745 finished with value: 0.8428022338603949 and parameters: {'loss': 'coxph', 'learning_rate': 0.00019231460458032148, 'n_estimators': 357, 'criterion': 'friedman_mse', 'min_samples_split': 3, 'min_samples_leaf': 1, 'min_weight_fraction_leaf': 0.13401040242188367, 'min_impurity_decrease': 0.1809168460664357, 'max_features': 0.3287582297953541, 'subsample': 0.1482386072381961, 'dropout_rate': 0.0325963947410005, 'ccp_alpha': 0.14888185568228107}. Best is trial 583 with value: 0.8480221917497749.[0m
[32m[I 2022-04-21 20:09:43,259][0m Trial 746 finished with value: 0.65 and parameters: {'loss': 'coxph', 'learning_rate': 0.00032637536794015995, 'n_estimators': 325, 'criterion': 'friedman_mse', 'min_samples_split': 10, 'min_samples_leaf': 1, 'min_weight_fraction_leaf': 0.11954030320269049, 'min_impurity_decrease': 0.16053886762039685, 'max_features': 0.31087859403784857, 'subsample': 0.07114231198715264, 'dropout_rate': 0.8619075948101251, 'ccp_alpha': 1.3718689622891482}. Best is trial 583 with value: 0.8480221917497749.[0m
[32m[I 2022-04-21 20:10:11,182][0m Trial 747 finished with value: 0.65 and parameters: {'loss': 'coxph', 'learning_rate': 0.0002207384183435257, 'n_estimators': 312, 'criterion': 'squared_error', 'min_samples_split': 3, 'min_samples_leaf': 1, 'min_weight_fraction_leaf': 0.1354988349812646, 'min_impurity_decrease': 0.13800301096621445, 'max_features': 0.338441406938734, 'subsample': 0.08244758087189812, 'dropout_rate': 0.061776114897045833, 'ccp_alpha': 4.959209137971297}. Best is trial 583 with value: 0.8480221917497749.[0m
[32m[I 2022-04-21 20:10:44,573][0m Trial 748 finished with value: 0.6805299599089005 and parameters: {'loss': 'coxph', 'learning_rate': 0.0002757857375895841, 'n_estimators': 365, 'criterion': 'friedman_mse', 'min_samples_split': 3, 'min_samples_leaf': 1, 'min_weight_fraction_leaf': 0.14207478961649564, 'min_impurity_decrease': 0.18165413782356907, 'max_features': 0.3309823735870457, 'subsample': 0.5130734534053122, 'dropout_rate': 0.0351707321272087, 'ccp_alpha': 0.3105523296503473}. Best is trial 583 with value: 0.8480221917497749.[0m
[32m[I 2022-04-21 20:11:15,452][0m Trial 749 finished with value: 0.8396255077056098 and parameters: {'loss': 'coxph', 'learning_rate': 0.0001582407087376221, 'n_estimators': 334, 'criterion': 'friedman_mse', 'min_samples_split': 3, 'min_samples_leaf': 1, 'min_weight_fraction_leaf': 0.12479607153718318, 'min_impurity_decrease': 0.1639966537641281, 'max_features': 0.33235814507511924, 'subsample': 0.6282835175314214, 'dropout_rate': 0.02308090223416668, 'ccp_alpha': 0.08743544716906307}. Best is trial 583 with value: 0.8480221917497749.[0m
[32m[I 2022-04-21 20:11:48,412][0m Trial 750 finished with value: 0.8352353949590137 and parameters: {'loss': 'coxph', 'learning_rate': 0.00034917117460000395, 'n_estimators': 347, 'criterion': 'friedman_mse', 'min_samples_split': 3, 'min_samples_leaf': 1, 'min_weight_fraction_leaf': 0.14360834340314527, 'min_impurity_decrease': 0.12739494822872202, 'max_features': 0.2753973589445258, 'subsample': 0.4181315995693096, 'dropout_rate': 0.05814601970713845, 'ccp_alpha': 0.18386694592518646}. Best is trial 583 with value: 0.8480221917497749.[0m
[32m[I 2022-04-21 20:12:21,006][0m Trial 751 finished with value: 0.8419962488576171 and parameters: {'loss': 'coxph', 'learning_rate': 0.00020650695468201114, 'n_estimators': 313, 'criterion': 'friedman_mse', 'min_samples_split': 3, 'min_samples_leaf': 1, 'min_weight_fraction_leaf': 0.1007491822211383, 'min_impurity_decrease': 0.19192253321798405, 'max_features': 0.298562477352724, 'subsample': 0.10801107188713524, 'dropout_rate': 0.06877116977787441, 'ccp_alpha': 0.09028553543293444}. Best is trial 583 with value: 0.8480221917497749.[0m
[32m[I 2022-04-21 20:12:49,430][0m Trial 752 finished with value: 0.8427391948960656 and parameters: {'loss': 'coxph', 'learning_rate': 0.0001619901574666099, 'n_estimators': 329, 'criterion': 'absolute_error', 'min_samples_split': 3, 'min_samples_leaf': 1, 'min_weight_fraction_leaf': 0.11316486463621586, 'min_impurity_decrease': 0.15162015433920398, 'max_features': 0.25192702607601514, 'subsample': 0.0696658917347491, 'dropout_rate': 0.04709407126717339, 'ccp_alpha': 0.002874291514874002}. Best is trial 583 with value: 0.8480221917497749.[0m
[32m[I 2022-04-21 20:13:23,958][0m Trial 753 finished with value: 0.7380600970085802 and parameters: {'loss': 'coxph', 'learning_rate': 0.0002599913728197754, 'n_estimators': 363, 'criterion': 'friedman_mse', 'min_samples_split': 3, 'min_samples_leaf': 1, 'min_weight_fraction_leaf': 0.13287874024202823, 'min_impurity_decrease': 0.1745887830967629, 'max_features': 0.3058075577497921, 'subsample': 0.13414871554783397, 'dropout_rate': 0.006693990203158945, 'ccp_alpha': 0.37235174223454204}. Best is trial 583 with value: 0.8480221917497749.[0m
/media/san2_ssd/data/Workdir/survival/venv/lib/python3.8/site-packages/sksurv/ensemble/boosting.py:955: RuntimeWarning: divide by zero encountered in log
  time = numpy.log(time)
/media/san2_ssd/data/Workdir/survival/venv/lib/python3.8/site-packages/sksurv/ensemble/boosting.py:955: RuntimeWarning: divide by zero encountered in log
  time = numpy.log(time)
/media/san2_ssd/data/Workdir/survival/venv/lib/python3.8/site-packages/sksurv/ensemble/boosting.py:955: RuntimeWarning: divide by zero encountered in log
  time = numpy.log(time)
/media/san2_ssd/data/Workdir/survival/venv/lib/python3.8/site-packages/sksurv/ensemble/boosting.py:955: RuntimeWarning: divide by zero encountered in log
  time = numpy.log(time)
[32m[I 2022-04-21 20:13:30,504][0m Trial 754 finished with value: -0.46667268029349207 and parameters: {'loss': 'squared', 'learning_rate': 0.0003840513018442791, 'n_estimators': 337, 'criterion': 'friedman_mse', 'min_samples_split': 3, 'min_samples_leaf': 1, 'min_weight_fraction_leaf': 0.1420112881368867, 'min_impurity_decrease': 0.09272263362653682, 'max_features': 0.27707971777839724, 'subsample': 0.09280495519843367, 'dropout_rate': 0.06221225767106915, 'ccp_alpha': 0.24153387266516987}. Best is trial 583 with value: 0.8480221917497749.[0m
[32m[I 2022-04-21 20:13:57,805][0m Trial 755 finished with value: 0.8435087647684174 and parameters: {'loss': 'coxph', 'learning_rate': 0.0001955038694811832, 'n_estimators': 308, 'criterion': 'friedman_mse', 'min_samples_split': 3, 'min_samples_leaf': 1, 'min_weight_fraction_leaf': 0.12590047187523568, 'min_impurity_decrease': 0.19181694053147508, 'max_features': 0.1769675796402458, 'subsample': 0.06534705572321796, 'dropout_rate': 0.022720939748268887, 'ccp_alpha': 0.15968925680459592}. Best is trial 583 with value: 0.8480221917497749.[0m
[32m[I 2022-04-21 20:14:29,248][0m Trial 756 finished with value: 0.8437622197120668 and parameters: {'loss': 'coxph', 'learning_rate': 0.0002862240660111022, 'n_estimators': 323, 'criterion': 'friedman_mse', 'min_samples_split': 3, 'min_samples_leaf': 1, 'min_weight_fraction_leaf': 0.14630219653034202, 'min_impurity_decrease': 0.11547217620362336, 'max_features': 0.3374452036535063, 'subsample': 0.1143242685205407, 'dropout_rate': 0.0767073396027924, 'ccp_alpha': 0.1147301517822908}. Best is trial 583 with value: 0.8480221917497749.[0m
[32m[I 2022-04-21 20:15:06,569][0m Trial 757 finished with value: 0.8456740614840609 and parameters: {'loss': 'coxph', 'learning_rate': 0.00016932224272143268, 'n_estimators': 351, 'criterion': 'friedman_mse', 'min_samples_split': 3, 'min_samples_leaf': 1, 'min_weight_fraction_leaf': 0.13396020105763395, 'min_impurity_decrease': 0.1448248569238784, 'max_features': 0.3163983647306948, 'subsample': 0.08544656960667062, 'dropout_rate': 0.03879249488985393, 'ccp_alpha': 0.0016156690498850546}. Best is trial 583 with value: 0.8480221917497749.[0m
[32m[I 2022-04-21 20:15:39,150][0m Trial 758 finished with value: 0.65 and parameters: {'loss': 'coxph', 'learning_rate': 0.00021955709356567436, 'n_estimators': 341, 'criterion': 'friedman_mse', 'min_samples_split': 3, 'min_samples_leaf': 5, 'min_weight_fraction_leaf': 0.11499895930447543, 'min_impurity_decrease': 0.16273771967053047, 'max_features': 0.11042602630972465, 'subsample': 0.0680268161275225, 'dropout_rate': 0.0014356634362803211, 'ccp_alpha': 0.0024210122005812185}. Best is trial 583 with value: 0.8480221917497749.[0m
[32m[I 2022-04-21 20:16:06,260][0m Trial 759 finished with value: 0.8434904663696534 and parameters: {'loss': 'coxph', 'learning_rate': 0.0003327304352541013, 'n_estimators': 368, 'criterion': 'friedman_mse', 'min_samples_split': 3, 'min_samples_leaf': 1, 'min_weight_fraction_leaf': 0.14764671143099423, 'min_impurity_decrease': 0.19262362661899396, 'max_features': 0.2887683124621592, 'subsample': 0.09958942965416276, 'dropout_rate': 0.08167200932255425, 'ccp_alpha': 0.24233598248971072}. Best is trial 583 with value: 0.8480221917497749.[0m
[32m[I 2022-04-21 20:16:27,800][0m Trial 760 finished with value: 0.8369402125580987 and parameters: {'loss': 'coxph', 'learning_rate': 0.00015458445500510638, 'n_estimators': 302, 'criterion': 'friedman_mse', 'min_samples_split': 3, 'min_samples_leaf': 1, 'min_weight_fraction_leaf': 0.12774278729658983, 'min_impurity_decrease': 0.12799759834717156, 'max_features': 0.3266617639904136, 'subsample': 0.14018806191014804, 'dropout_rate': 0.061073449640873106, 'ccp_alpha': 0.32804260923117823}. Best is trial 583 with value: 0.8480221917497749.[0m
[32m[I 2022-04-21 20:17:02,938][0m Trial 761 finished with value: 0.8436847499002841 and parameters: {'loss': 'coxph', 'learning_rate': 0.00025750521687296907, 'n_estimators': 324, 'criterion': 'friedman_mse', 'min_samples_split': 3, 'min_samples_leaf': 1, 'min_weight_fraction_leaf': 0.1394954075676393, 'min_impurity_decrease': 0.1773820371796298, 'max_features': 0.3401343934706764, 'subsample': 0.06040115097875337, 'dropout_rate': 0.039492277123771576, 'ccp_alpha': 0.15207427675038293}. Best is trial 583 with value: 0.8480221917497749.[0m
[32m[I 2022-04-21 20:17:38,247][0m Trial 762 finished with value: 0.8434901519180229 and parameters: {'loss': 'coxph', 'learning_rate': 0.0003958623107573688, 'n_estimators': 354, 'criterion': 'friedman_mse', 'min_samples_split': 3, 'min_samples_leaf': 1, 'min_weight_fraction_leaf': 0.14799566784407311, 'min_impurity_decrease': 0.15147523230225396, 'max_features': 0.2978529372760623, 'subsample': 0.08471368068633696, 'dropout_rate': 0.0833357214498126, 'ccp_alpha': 0.11564736923484185}. Best is trial 583 with value: 0.8480221917497749.[0m
[32m[I 2022-04-21 20:18:03,745][0m Trial 763 finished with value: 0.7327801508699157 and parameters: {'loss': 'coxph', 'learning_rate': 0.00020682996359117106, 'n_estimators': 318, 'criterion': 'friedman_mse', 'min_samples_split': 2, 'min_samples_leaf': 1, 'min_weight_fraction_leaf': 0.12161817903439714, 'min_impurity_decrease': 0.185195188150758, 'max_features': 0.24680975130156563, 'subsample': 0.11951824469966826, 'dropout_rate': 0.05004156721422516, 'ccp_alpha': 0.4344056241920899}. Best is trial 583 with value: 0.8480221917497749.[0m
[32m[I 2022-04-21 20:18:39,700][0m Trial 764 finished with value: 0.8434561945377841 and parameters: {'loss': 'coxph', 'learning_rate': 0.0001497436049837683, 'n_estimators': 341, 'criterion': 'friedman_mse', 'min_samples_split': 3, 'min_samples_leaf': 1, 'min_weight_fraction_leaf': 0.13250363171768795, 'min_impurity_decrease': 0.11708373596328137, 'max_features': 0.2819491604627522, 'subsample': 0.06144784135868811, 'dropout_rate': 0.07771571978763409, 'ccp_alpha': 0.21971631879673684}. Best is trial 583 with value: 0.8480221917497749.[0m
[32m[I 2022-04-21 20:19:07,546][0m Trial 765 finished with value: 0.84321189640606 and parameters: {'loss': 'coxph', 'learning_rate': 0.0002636927327113025, 'n_estimators': 301, 'criterion': 'friedman_mse', 'min_samples_split': 3, 'min_samples_leaf': 1, 'min_weight_fraction_leaf': 0.1062342179210208, 'min_impurity_decrease': 0.1624187410926478, 'max_features': 0.19742961490591673, 'subsample': 0.08759709606670062, 'dropout_rate': 0.022513748874757107, 'ccp_alpha': 0.08492917036585534}. Best is trial 583 with value: 0.8480221917497749.[0m
[32m[I 2022-04-21 20:19:32,441][0m Trial 766 finished with value: 0.8445421498438135 and parameters: {'loss': 'coxph', 'learning_rate': 0.00045445342073760264, 'n_estimators': 332, 'criterion': 'friedman_mse', 'min_samples_split': 3, 'min_samples_leaf': 1, 'min_weight_fraction_leaf': 0.09157832180561455, 'min_impurity_decrease': 0.19874921283924557, 'max_features': 0.3186098480917766, 'subsample': 0.10051827371774569, 'dropout_rate': 0.0849331077039219, 'ccp_alpha': 0.08672395776537316}. Best is trial 583 with value: 0.8480221917497749.[0m
[32m[I 2022-04-21 20:20:07,853][0m Trial 767 finished with value: 0.65 and parameters: {'loss': 'coxph', 'learning_rate': 7.867177295338434e-06, 'n_estimators': 369, 'criterion': 'friedman_mse', 'min_samples_split': 3, 'min_samples_leaf': 1, 'min_weight_fraction_leaf': 0.14687758575952664, 'min_impurity_decrease': 0.14306839058325724, 'max_features': 0.30801209896429577, 'subsample': 0.06487543245390169, 'dropout_rate': 0.06394657240638012, 'ccp_alpha': 2.019157741626708}. Best is trial 583 with value: 0.8480221917497749.[0m
[32m[I 2022-04-21 20:20:33,165][0m Trial 768 finished with value: 0.8368652945723069 and parameters: {'loss': 'coxph', 'learning_rate': 0.0003380406276202965, 'n_estimators': 314, 'criterion': 'friedman_mse', 'min_samples_split': 3, 'min_samples_leaf': 1, 'min_weight_fraction_leaf': 0.13534026166155175, 'min_impurity_decrease': 0.07691259460522842, 'max_features': 0.34130537740353467, 'subsample': 0.11952486894525852, 'dropout_rate': 0.0899775740175923, 'ccp_alpha': 0.28320442191219786}. Best is trial 583 with value: 0.8480221917497749.[0m
[32m[I 2022-04-21 20:21:06,717][0m Trial 769 finished with value: 0.8430981118078428 and parameters: {'loss': 'coxph', 'learning_rate': 0.0001951263090012091, 'n_estimators': 353, 'criterion': 'friedman_mse', 'min_samples_split': 3, 'min_samples_leaf': 1, 'min_weight_fraction_leaf': 0.15346227381254604, 'min_impurity_decrease': 0.19495860538274887, 'max_features': 0.26391304881494765, 'subsample': 0.07488052532115123, 'dropout_rate': 0.03777839829287462, 'ccp_alpha': 0.18134108133930468}. Best is trial 583 with value: 0.8480221917497749.[0m
[32m[I 2022-04-21 20:21:51,745][0m Trial 770 finished with value: 0.8427980768982991 and parameters: {'loss': 'coxph', 'learning_rate': 0.00025661110734027123, 'n_estimators': 384, 'criterion': 'squared_error', 'min_samples_split': 3, 'min_samples_leaf': 1, 'min_weight_fraction_leaf': 0.11848690633673889, 'min_impurity_decrease': 0.15449141112165454, 'max_features': 0.3354858370599186, 'subsample': 0.10199627851293677, 'dropout_rate': 0.022705559245878734, 'ccp_alpha': 0.09229124169868044}. Best is trial 583 with value: 0.8480221917497749.[0m
[32m[I 2022-04-21 20:22:21,676][0m Trial 771 finished with value: 0.8449438962569481 and parameters: {'loss': 'coxph', 'learning_rate': 0.00017601461266315797, 'n_estimators': 332, 'criterion': 'friedman_mse', 'min_samples_split': 3, 'min_samples_leaf': 1, 'min_weight_fraction_leaf': 0.13974868832926857, 'min_impurity_decrease': 0.1360439252901923, 'max_features': 0.2936016853263839, 'subsample': 0.0499473141312611, 'dropout_rate': 0.09983085902402569, 'ccp_alpha': 0.23637225169743176}. Best is trial 583 with value: 0.8480221917497749.[0m
/media/san2_ssd/data/Workdir/survival/venv/lib/python3.8/site-packages/sksurv/ensemble/boosting.py:955: RuntimeWarning: divide by zero encountered in log
  time = numpy.log(time)
/media/san2_ssd/data/Workdir/survival/venv/lib/python3.8/site-packages/sksurv/ensemble/boosting.py:955: RuntimeWarning: divide by zero encountered in log
  time = numpy.log(time)
/media/san2_ssd/data/Workdir/survival/venv/lib/python3.8/site-packages/sksurv/ensemble/boosting.py:955: RuntimeWarning: divide by zero encountered in log
  time = numpy.log(time)
/media/san2_ssd/data/Workdir/survival/venv/lib/python3.8/site-packages/sksurv/ensemble/boosting.py:955: RuntimeWarning: divide by zero encountered in log
  time = numpy.log(time)
[32m[I 2022-04-21 20:22:27,263][0m Trial 772 finished with value: -0.4655948883637083 and parameters: {'loss': 'squared', 'learning_rate': 0.0001511061109311415, 'n_estimators': 307, 'criterion': 'friedman_mse', 'min_samples_split': 3, 'min_samples_leaf': 1, 'min_weight_fraction_leaf': 0.15237854349264898, 'min_impurity_decrease': 0.17073475983060538, 'max_features': 0.3143518555232895, 'subsample': 0.13924312311769188, 'dropout_rate': 0.05506569128573256, 'ccp_alpha': 0.09199686402195772}. Best is trial 583 with value: 0.8480221917497749.[0m
