No protocol specified
[32m[I 2022-04-21 11:36:54,551][0m A new study created in memory with name: no-name-7fdd550b-7ebb-4f5e-a9c1-22b2cc4805e1[0m
[32m[I 2022-04-21 11:36:54,715][0m Trial 0 finished with value: 0.680426703380846 and parameters: {'splitter': 'best', 'min_samples_split': 0.25598894425981955, 'min_samples_leaf': 0.07797246886471365, 'min_weight_fraction_leaf': 0.23537090161881785, 'max_features': 0.8435492018298536}. Best is trial 0 with value: 0.680426703380846.[0m
[32m[I 2022-04-21 11:36:54,758][0m Trial 1 finished with value: 0.5613562542650286 and parameters: {'splitter': 'random', 'min_samples_split': 0.4757550183891008, 'min_samples_leaf': 0.15299103895933772, 'min_weight_fraction_leaf': 0.4305673234258081, 'max_features': 0.34686004762030853}. Best is trial 0 with value: 0.680426703380846.[0m
[32m[I 2022-04-21 11:36:54,804][0m Trial 2 finished with value: 0.6432737211752574 and parameters: {'splitter': 'random', 'min_samples_split': 0.11220428249779879, 'min_samples_leaf': 0.4443450980175485, 'min_weight_fraction_leaf': 0.17464999270876247, 'max_features': 0.9432825169881571}. Best is trial 0 with value: 0.680426703380846.[0m
[32m[I 2022-04-21 11:36:54,881][0m Trial 3 finished with value: 0.674459108722817 and parameters: {'splitter': 'best', 'min_samples_split': 0.18982862636168257, 'min_samples_leaf': 0.2670610307569291, 'min_weight_fraction_leaf': 0.1986926688052717, 'max_features': 0.6960027132377725}. Best is trial 0 with value: 0.680426703380846.[0m
[32m[I 2022-04-21 11:36:54,942][0m Trial 4 finished with value: 0.46991866821558936 and parameters: {'splitter': 'best', 'min_samples_split': 0.2552457701722882, 'min_samples_leaf': 0.400042149047959, 'min_weight_fraction_leaf': 0.03240763724308565, 'max_features': 0.9831768212286304}. Best is trial 0 with value: 0.680426703380846.[0m
[32m[I 2022-04-21 11:36:55,037][0m Trial 5 finished with value: 0.6882582335121891 and parameters: {'splitter': 'best', 'min_samples_split': 0.3875425077233403, 'min_samples_leaf': 0.23372279080698022, 'min_weight_fraction_leaf': 0.04840955656993606, 'max_features': 0.9210823777981126}. Best is trial 5 with value: 0.6882582335121891.[0m
[32m[I 2022-04-21 11:36:55,192][0m Trial 6 finished with value: 0.6818950012019809 and parameters: {'splitter': 'best', 'min_samples_split': 0.23419386310357215, 'min_samples_leaf': 0.09922032421866288, 'min_weight_fraction_leaf': 0.22458287910258795, 'max_features': 0.6634236681644473}. Best is trial 5 with value: 0.6882582335121891.[0m
[32m[I 2022-04-21 11:36:55,251][0m Trial 7 finished with value: 0.6653911985177325 and parameters: {'splitter': 'best', 'min_samples_split': 0.0949708242788865, 'min_samples_leaf': 0.26785255672354685, 'min_weight_fraction_leaf': 0.12546300419620138, 'max_features': 0.36911369829828833}. Best is trial 5 with value: 0.6882582335121891.[0m
[32m[I 2022-04-21 11:36:55,305][0m Trial 8 finished with value: 0.5623807931412842 and parameters: {'splitter': 'best', 'min_samples_split': 0.34429898553499316, 'min_samples_leaf': 0.4314248158437866, 'min_weight_fraction_leaf': 0.33916525791796326, 'max_features': 0.18164051492199096}. Best is trial 5 with value: 0.6882582335121891.[0m
[32m[I 2022-04-21 11:36:55,376][0m Trial 9 finished with value: 0.6758655579011814 and parameters: {'splitter': 'best', 'min_samples_split': 0.186427885120836, 'min_samples_leaf': 0.2842803245053812, 'min_weight_fraction_leaf': 0.1143652758057262, 'max_features': 0.9397171380120544}. Best is trial 5 with value: 0.6882582335121891.[0m
[32m[I 2022-04-21 11:36:55,435][0m Trial 10 finished with value: 0.35 and parameters: {'splitter': 'random', 'min_samples_split': 0.4852796451426481, 'min_samples_leaf': 0.18440958979582034, 'min_weight_fraction_leaf': 0.03588701156027181, 'max_features': 0.0006486981915836965}. Best is trial 5 with value: 0.6882582335121891.[0m
[32m[I 2022-04-21 11:36:55,583][0m Trial 11 finished with value: 0.572315614132625 and parameters: {'splitter': 'best', 'min_samples_split': 0.3632737997627185, 'min_samples_leaf': 0.029870770986573994, 'min_weight_fraction_leaf': 0.3233430214203181, 'max_features': 0.6462880376725137}. Best is trial 5 with value: 0.6882582335121891.[0m
[32m[I 2022-04-21 11:36:55,717][0m Trial 12 finished with value: 0.5491558876860484 and parameters: {'splitter': 'best', 'min_samples_split': 0.002188584733190585, 'min_samples_leaf': 0.13341583409950564, 'min_weight_fraction_leaf': 0.4883523678407714, 'max_features': 0.6987775243646848}. Best is trial 5 with value: 0.6882582335121891.[0m
[32m[I 2022-04-21 11:36:55,821][0m Trial 13 finished with value: 0.5683801958776981 and parameters: {'splitter': 'best', 'min_samples_split': 0.3766916895885307, 'min_samples_leaf': 0.3502762365709506, 'min_weight_fraction_leaf': 0.3149544011263812, 'max_features': 0.5413168044948335}. Best is trial 5 with value: 0.6882582335121891.[0m
[32m[I 2022-04-21 11:36:55,890][0m Trial 14 finished with value: 0.8019499992979708 and parameters: {'splitter': 'random', 'min_samples_split': 0.3114850876992986, 'min_samples_leaf': 0.20205384308376015, 'min_weight_fraction_leaf': 0.10024660831423395, 'max_features': 0.7856230676767169}. Best is trial 14 with value: 0.8019499992979708.[0m
[32m[I 2022-04-21 11:36:55,956][0m Trial 15 finished with value: 0.7976776700827786 and parameters: {'splitter': 'random', 'min_samples_split': 0.4249993127231638, 'min_samples_leaf': 0.2099492782200015, 'min_weight_fraction_leaf': 0.00925019383178427, 'max_features': 0.7663880224439211}. Best is trial 14 with value: 0.8019499992979708.[0m
[32m[I 2022-04-21 11:36:56,032][0m Trial 16 finished with value: 0.7018169118643576 and parameters: {'splitter': 'random', 'min_samples_split': 0.4296201551158503, 'min_samples_leaf': 0.1963068678360142, 'min_weight_fraction_leaf': 0.10961367075031105, 'max_features': 0.7980624325411598}. Best is trial 14 with value: 0.8019499992979708.[0m
[32m[I 2022-04-21 11:36:56,099][0m Trial 17 finished with value: 0.47167109324319767 and parameters: {'splitter': 'random', 'min_samples_split': 0.3115927474254306, 'min_samples_leaf': 0.32846721743058194, 'min_weight_fraction_leaf': 0.014275957934997446, 'max_features': 0.49215170996077173}. Best is trial 14 with value: 0.8019499992979708.[0m
[32m[I 2022-04-21 11:36:56,172][0m Trial 18 finished with value: 0.7984622019961984 and parameters: {'splitter': 'random', 'min_samples_split': 0.4249559466617906, 'min_samples_leaf': 0.21411130363328612, 'min_weight_fraction_leaf': 0.08746162085144546, 'max_features': 0.8078102484762925}. Best is trial 14 with value: 0.8019499992979708.[0m
[32m[I 2022-04-21 11:36:56,240][0m Trial 19 finished with value: 0.35 and parameters: {'splitter': 'random', 'min_samples_split': 0.3333380560604305, 'min_samples_leaf': 0.4993906319193636, 'min_weight_fraction_leaf': 0.15630145891443475, 'max_features': 0.5710881174170892}. Best is trial 14 with value: 0.8019499992979708.[0m
[32m[I 2022-04-21 11:36:56,299][0m Trial 20 finished with value: 0.5685513460241312 and parameters: {'splitter': 'random', 'min_samples_split': 0.2983586870742937, 'min_samples_leaf': 0.33475425149214233, 'min_weight_fraction_leaf': 0.06706556735094768, 'max_features': 0.8640025657317585}. Best is trial 14 with value: 0.8019499992979708.[0m
[32m[I 2022-04-21 11:36:56,377][0m Trial 21 finished with value: 0.796949621512619 and parameters: {'splitter': 'random', 'min_samples_split': 0.4218106795189532, 'min_samples_leaf': 0.21881585382879506, 'min_weight_fraction_leaf': 0.08367903621497133, 'max_features': 0.7531510098841047}. Best is trial 14 with value: 0.8019499992979708.[0m
[32m[I 2022-04-21 11:36:56,441][0m Trial 22 finished with value: 0.6914700031717669 and parameters: {'splitter': 'random', 'min_samples_split': 0.4170004399248608, 'min_samples_leaf': 0.18752089504106015, 'min_weight_fraction_leaf': 0.0034238563329290327, 'max_features': 0.8080496686063302}. Best is trial 14 with value: 0.8019499992979708.[0m
[32m[I 2022-04-21 11:36:56,518][0m Trial 23 finished with value: 0.6941207960897303 and parameters: {'splitter': 'random', 'min_samples_split': 0.4680546073641164, 'min_samples_leaf': 0.14412132760784677, 'min_weight_fraction_leaf': 0.09049534131104903, 'max_features': 0.6051957004759779}. Best is trial 14 with value: 0.8019499992979708.[0m
[32m[I 2022-04-21 11:36:56,581][0m Trial 24 finished with value: 0.6728852818140099 and parameters: {'splitter': 'random', 'min_samples_split': 0.43234999060051177, 'min_samples_leaf': 0.3024346094990509, 'min_weight_fraction_leaf': 0.14699229081181822, 'max_features': 0.7501107416098838}. Best is trial 14 with value: 0.8019499992979708.[0m
[32m[I 2022-04-21 11:36:56,643][0m Trial 25 finished with value: 0.5807967841952093 and parameters: {'splitter': 'random', 'min_samples_split': 0.4964049358698543, 'min_samples_leaf': 0.23297897555320868, 'min_weight_fraction_leaf': 0.2745306429299678, 'max_features': 0.4361937747070974}. Best is trial 14 with value: 0.8019499992979708.[0m
[32m[I 2022-04-21 11:36:56,726][0m Trial 26 finished with value: 0.7160300686071169 and parameters: {'splitter': 'random', 'min_samples_split': 0.29526585942329886, 'min_samples_leaf': 0.09560709806359358, 'min_weight_fraction_leaf': 0.06635971171268762, 'max_features': 0.8432320864754687}. Best is trial 14 with value: 0.8019499992979708.[0m
[32m[I 2022-04-21 11:36:56,815][0m Trial 27 finished with value: 0.6914006296246076 and parameters: {'splitter': 'random', 'min_samples_split': 0.39303928838338287, 'min_samples_leaf': 0.015751663042720437, 'min_weight_fraction_leaf': 0.1826754158595782, 'max_features': 0.7389306680566033}. Best is trial 14 with value: 0.8019499992979708.[0m
[32m[I 2022-04-21 11:36:56,890][0m Trial 28 finished with value: 0.6038443849206094 and parameters: {'splitter': 'random', 'min_samples_split': 0.45225260855655264, 'min_samples_leaf': 0.16762501179982575, 'min_weight_fraction_leaf': 0.0017211808020710095, 'max_features': 0.9054751023634933}. Best is trial 14 with value: 0.8019499992979708.[0m
[32m[I 2022-04-21 11:36:56,956][0m Trial 29 finished with value: 0.7701266427181186 and parameters: {'splitter': 'random', 'min_samples_split': 0.2716689509613441, 'min_samples_leaf': 0.11366418689706431, 'min_weight_fraction_leaf': 0.2644749418072975, 'max_features': 0.994630008208426}. Best is trial 14 with value: 0.8019499992979708.[0m
[32m[I 2022-04-21 11:36:57,077][0m Trial 30 finished with value: 0.7967430297737246 and parameters: {'splitter': 'random', 'min_samples_split': 0.22595861293676506, 'min_samples_leaf': 0.05622823528126186, 'min_weight_fraction_leaf': 0.22010930754296726, 'max_features': 0.855885046962182}. Best is trial 14 with value: 0.8019499992979708.[0m
[32m[I 2022-04-21 11:36:57,214][0m Trial 31 finished with value: 0.7886101118225275 and parameters: {'splitter': 'random', 'min_samples_split': 0.4086453055755557, 'min_samples_leaf': 0.21737483039977312, 'min_weight_fraction_leaf': 0.08279539216885176, 'max_features': 0.7632441084982694}. Best is trial 14 with value: 0.8019499992979708.[0m
[32m[I 2022-04-21 11:36:57,353][0m Trial 32 finished with value: 0.6858438066982677 and parameters: {'splitter': 'random', 'min_samples_split': 0.4429555008738793, 'min_samples_leaf': 0.2154151381193577, 'min_weight_fraction_leaf': 0.13968529375863536, 'max_features': 0.6355926912034244}. Best is trial 14 with value: 0.8019499992979708.[0m
[32m[I 2022-04-21 11:36:57,492][0m Trial 33 finished with value: 0.6799707038090638 and parameters: {'splitter': 'random', 'min_samples_split': 0.3517249269255732, 'min_samples_leaf': 0.24898725257561205, 'min_weight_fraction_leaf': 0.09589020381510331, 'max_features': 0.7954125626877254}. Best is trial 14 with value: 0.8019499992979708.[0m
[32m[I 2022-04-21 11:36:57,636][0m Trial 34 finished with value: 0.6084708121234452 and parameters: {'splitter': 'random', 'min_samples_split': 0.467054716308285, 'min_samples_leaf': 0.17036363864398785, 'min_weight_fraction_leaf': 0.058437634088257986, 'max_features': 0.7131695644134053}. Best is trial 14 with value: 0.8019499992979708.[0m
[32m[I 2022-04-21 11:36:57,711][0m Trial 35 finished with value: 0.674010956740911 and parameters: {'splitter': 'random', 'min_samples_split': 0.3996783602292383, 'min_samples_leaf': 0.2977413536573741, 'min_weight_fraction_leaf': 0.03117255788753831, 'max_features': 0.8612789014320443}. Best is trial 14 with value: 0.8019499992979708.[0m
[32m[I 2022-04-21 11:36:57,770][0m Trial 36 finished with value: 0.4495795502534917 and parameters: {'splitter': 'random', 'min_samples_split': 0.3278754230836503, 'min_samples_leaf': 0.1312920892772847, 'min_weight_fraction_leaf': 0.3978486249307978, 'max_features': 0.49354160088351884}. Best is trial 14 with value: 0.8019499992979708.[0m
[32m[I 2022-04-21 11:36:57,860][0m Trial 37 finished with value: 0.7992112597444759 and parameters: {'splitter': 'random', 'min_samples_split': 0.3798569594904801, 'min_samples_leaf': 0.20525356413972126, 'min_weight_fraction_leaf': 0.18416537924657742, 'max_features': 0.6995615187696638}. Best is trial 14 with value: 0.8019499992979708.[0m
[32m[I 2022-04-21 11:36:57,968][0m Trial 38 finished with value: 0.6690405535151701 and parameters: {'splitter': 'random', 'min_samples_split': 0.36143808995392096, 'min_samples_leaf': 0.2542877401394651, 'min_weight_fraction_leaf': 0.18406150090472506, 'max_features': 0.5881630277649479}. Best is trial 14 with value: 0.8019499992979708.[0m
[32m[I 2022-04-21 11:36:58,062][0m Trial 39 finished with value: 0.7931606555145491 and parameters: {'splitter': 'random', 'min_samples_split': 0.2808238221731374, 'min_samples_leaf': 0.15887662377321637, 'min_weight_fraction_leaf': 0.20675637243078485, 'max_features': 0.6737893641986875}. Best is trial 14 with value: 0.8019499992979708.[0m
[32m[I 2022-04-21 11:36:58,129][0m Trial 40 finished with value: 0.5623107839941583 and parameters: {'splitter': 'random', 'min_samples_split': 0.3757423769635874, 'min_samples_leaf': 0.36723392785981157, 'min_weight_fraction_leaf': 0.16012620766933688, 'max_features': 0.9209166569227089}. Best is trial 14 with value: 0.8019499992979708.[0m
[32m[I 2022-04-21 11:36:58,202][0m Trial 41 finished with value: 0.8031950732010482 and parameters: {'splitter': 'random', 'min_samples_split': 0.4478907989320124, 'min_samples_leaf': 0.2192037076714436, 'min_weight_fraction_leaf': 0.12485892323042913, 'max_features': 0.7759088800355497}. Best is trial 41 with value: 0.8031950732010482.[0m
[32m[I 2022-04-21 11:36:58,269][0m Trial 42 finished with value: 0.6707921639669081 and parameters: {'splitter': 'random', 'min_samples_split': 0.4455316774869832, 'min_samples_leaf': 0.2758387582142967, 'min_weight_fraction_leaf': 0.1300573777761251, 'max_features': 0.8013372170679447}. Best is trial 41 with value: 0.8031950732010482.[0m
[32m[I 2022-04-21 11:36:58,339][0m Trial 43 finished with value: 0.7985068940825443 and parameters: {'splitter': 'random', 'min_samples_split': 0.3912172226104214, 'min_samples_leaf': 0.19856905032064578, 'min_weight_fraction_leaf': 0.10777619044903522, 'max_features': 0.8984102790477521}. Best is trial 41 with value: 0.8031950732010482.[0m
[32m[I 2022-04-21 11:36:58,413][0m Trial 44 finished with value: 0.5797267441936222 and parameters: {'splitter': 'random', 'min_samples_split': 0.31703177949965133, 'min_samples_leaf': 0.24395698777554622, 'min_weight_fraction_leaf': 0.1218681136394206, 'max_features': 0.9609087191892077}. Best is trial 41 with value: 0.8031950732010482.[0m
[32m[I 2022-04-21 11:36:58,499][0m Trial 45 finished with value: 0.7974704466572615 and parameters: {'splitter': 'random', 'min_samples_split': 0.3891122117496134, 'min_samples_leaf': 0.19230332552358848, 'min_weight_fraction_leaf': 0.1722473327950496, 'max_features': 0.8881021102357042}. Best is trial 41 with value: 0.8031950732010482.[0m
[32m[I 2022-04-21 11:36:58,635][0m Trial 46 finished with value: 0.7947115814547928 and parameters: {'splitter': 'best', 'min_samples_split': 0.46993412684442804, 'min_samples_leaf': 0.17371857414056957, 'min_weight_fraction_leaf': 0.10325483143691408, 'max_features': 0.6984900145407027}. Best is trial 41 with value: 0.8031950732010482.[0m
[32m[I 2022-04-21 11:36:58,710][0m Trial 47 finished with value: 0.7755332026495355 and parameters: {'splitter': 'random', 'min_samples_split': 0.3553028998508665, 'min_samples_leaf': 0.26158460640068, 'min_weight_fraction_leaf': 0.2512507466501077, 'max_features': 0.32257549436089283}. Best is trial 41 with value: 0.8031950732010482.[0m
[32m[I 2022-04-21 11:36:58,811][0m Trial 48 finished with value: 0.8120167347509565 and parameters: {'splitter': 'random', 'min_samples_split': 0.16480861387736567, 'min_samples_leaf': 0.06857766010641134, 'min_weight_fraction_leaf': 0.1293242796192888, 'max_features': 0.9615610937477802}. Best is trial 48 with value: 0.8120167347509565.[0m
[32m[I 2022-04-21 11:36:59,141][0m Trial 49 finished with value: 0.599658605492846 and parameters: {'splitter': 'best', 'min_samples_split': 0.14434356999802594, 'min_samples_leaf': 0.0650364312697676, 'min_weight_fraction_leaf': 0.18827133049752295, 'max_features': 0.9295602714654063}. Best is trial 48 with value: 0.8120167347509565.[0m
[32m[I 2022-04-21 11:36:59,270][0m Trial 50 finished with value: 0.800354465473785 and parameters: {'splitter': 'random', 'min_samples_split': 0.08371820500715624, 'min_samples_leaf': 0.11102793380057338, 'min_weight_fraction_leaf': 0.20908273275556824, 'max_features': 0.9824515604732328}. Best is trial 48 with value: 0.8120167347509565.[0m
[32m[I 2022-04-21 11:36:59,396][0m Trial 51 finished with value: 0.7965655166972938 and parameters: {'splitter': 'random', 'min_samples_split': 0.06488558281864154, 'min_samples_leaf': 0.0496063080808065, 'min_weight_fraction_leaf': 0.2136128008681521, 'max_features': 0.9950458564794562}. Best is trial 48 with value: 0.8120167347509565.[0m
[32m[I 2022-04-21 11:36:59,573][0m Trial 52 finished with value: 0.581155686377178 and parameters: {'splitter': 'random', 'min_samples_split': 0.14468315293482642, 'min_samples_leaf': 0.08864012213941896, 'min_weight_fraction_leaf': 0.2358816594851646, 'max_features': 0.9469290243553131}. Best is trial 48 with value: 0.8120167347509565.[0m
[32m[I 2022-04-21 11:36:59,718][0m Trial 53 finished with value: 0.8016167827506285 and parameters: {'splitter': 'random', 'min_samples_split': 0.04447119109329115, 'min_samples_leaf': 0.11634292749757083, 'min_weight_fraction_leaf': 0.16538008594764053, 'max_features': 0.8880268383070903}. Best is trial 48 with value: 0.8120167347509565.[0m
[32m[I 2022-04-21 11:36:59,896][0m Trial 54 finished with value: 0.8061359668763007 and parameters: {'splitter': 'random', 'min_samples_split': 0.044290465798552926, 'min_samples_leaf': 0.11409942592227752, 'min_weight_fraction_leaf': 0.16153105687295444, 'max_features': 0.8353870895834918}. Best is trial 48 with value: 0.8120167347509565.[0m
[32m[I 2022-04-21 11:37:00,000][0m Trial 55 finished with value: 0.8111770657003451 and parameters: {'splitter': 'random', 'min_samples_split': 0.03946974722124032, 'min_samples_leaf': 0.12260112123692997, 'min_weight_fraction_leaf': 0.1451735291232653, 'max_features': 0.9688962082827146}. Best is trial 48 with value: 0.8120167347509565.[0m
[32m[I 2022-04-21 11:37:00,384][0m Trial 56 finished with value: 0.8032454478637987 and parameters: {'splitter': 'best', 'min_samples_split': 0.012780969970572032, 'min_samples_leaf': 0.07856540252930666, 'min_weight_fraction_leaf': 0.1541957501851501, 'max_features': 0.8235955325970884}. Best is trial 48 with value: 0.8120167347509565.[0m
[32m[I 2022-04-21 11:37:00,700][0m Trial 57 finished with value: 0.8028844813302308 and parameters: {'splitter': 'best', 'min_samples_split': 0.00874503642370521, 'min_samples_leaf': 0.035487234990512026, 'min_weight_fraction_leaf': 0.1418021121358619, 'max_features': 0.8345986556783269}. Best is trial 48 with value: 0.8120167347509565.[0m
[32m[I 2022-04-21 11:37:00,958][0m Trial 58 finished with value: 0.8028844813302308 and parameters: {'splitter': 'best', 'min_samples_split': 0.0053191529342646315, 'min_samples_leaf': 0.041407047389428187, 'min_weight_fraction_leaf': 0.14422518988177488, 'max_features': 0.8312431539047206}. Best is trial 48 with value: 0.8120167347509565.[0m
[32m[I 2022-04-21 11:37:01,048][0m Trial 59 finished with value: 0.7985553920037619 and parameters: {'splitter': 'best', 'min_samples_split': 0.02632227019092685, 'min_samples_leaf': 0.06927009644468057, 'min_weight_fraction_leaf': 0.12427113414351325, 'max_features': 0.13268499017389102}. Best is trial 48 with value: 0.8120167347509565.[0m
[32m[I 2022-04-21 11:37:01,387][0m Trial 60 finished with value: 0.8003511089746593 and parameters: {'splitter': 'best', 'min_samples_split': 0.12040835988437593, 'min_samples_leaf': 0.0038332514385435446, 'min_weight_fraction_leaf': 0.14686732535115596, 'max_features': 0.8245367743598065}. Best is trial 48 with value: 0.8120167347509565.[0m
[32m[I 2022-04-21 11:37:01,694][0m Trial 61 finished with value: 0.8079484483762414 and parameters: {'splitter': 'best', 'min_samples_split': 0.008404767796983691, 'min_samples_leaf': 0.0410305550653697, 'min_weight_fraction_leaf': 0.13535708375560385, 'max_features': 0.9553648985352768}. Best is trial 48 with value: 0.8120167347509565.[0m
[32m[I 2022-04-21 11:37:02,252][0m Trial 62 finished with value: 0.8016361061007746 and parameters: {'splitter': 'best', 'min_samples_split': 0.03426496842347075, 'min_samples_leaf': 0.03048735107866611, 'min_weight_fraction_leaf': 0.1281726969430508, 'max_features': 0.9604917419151492}. Best is trial 48 with value: 0.8120167347509565.[0m
