[32m[I 2022-04-21 11:38:28,077][0m Trial 214 finished with value: 0.8423527006348241 and parameters: {'alpha': 0.9255850433680408, 'ties': 'breslow'}. Best is trial 13 with value: 0.8423527006348241.[0m
[32m[I 2022-04-21 11:38:28,297][0m Trial 215 finished with value: 0.8423527006348241 and parameters: {'alpha': 0.768126320683975, 'ties': 'efron'}. Best is trial 13 with value: 0.8423527006348241.[0m
[32m[I 2022-04-21 11:38:28,593][0m Trial 216 finished with value: 0.842183674410227 and parameters: {'alpha': 0.6165072281370738, 'ties': 'efron'}. Best is trial 13 with value: 0.8423527006348241.[0m
[32m[I 2022-04-21 11:38:28,871][0m Trial 217 finished with value: 0.8405579528608467 and parameters: {'alpha': 4.820456315427987, 'ties': 'breslow'}. Best is trial 13 with value: 0.8423527006348241.[0m
[32m[I 2022-04-21 11:38:29,113][0m Trial 218 finished with value: 0.8423527006348241 and parameters: {'alpha': 0.8174801420218352, 'ties': 'efron'}. Best is trial 13 with value: 0.8423527006348241.[0m
[32m[I 2022-04-21 11:38:29,361][0m Trial 219 finished with value: 0.8414545406933376 and parameters: {'alpha': 0.9664513609772891, 'ties': 'efron'}. Best is trial 13 with value: 0.8423527006348241.[0m
[32m[I 2022-04-21 11:38:29,681][0m Trial 220 finished with value: 0.8423527006348241 and parameters: {'alpha': 0.7261600664015492, 'ties': 'breslow'}. Best is trial 13 with value: 0.8423527006348241.[0m
[32m[I 2022-04-21 11:38:30,030][0m Trial 221 finished with value: 0.8423527006348241 and parameters: {'alpha': 0.7457145800085451, 'ties': 'breslow'}. Best is trial 13 with value: 0.8423527006348241.[0m
[32m[I 2022-04-21 11:38:30,522][0m Trial 222 finished with value: 0.8423527006348241 and parameters: {'alpha': 0.7394371809425048, 'ties': 'efron'}. Best is trial 13 with value: 0.8423527006348241.[0m
[32m[I 2022-04-21 11:38:30,784][0m Trial 223 finished with value: 0.8423527006348241 and parameters: {'alpha': 0.8570728915568999, 'ties': 'breslow'}. Best is trial 13 with value: 0.8423527006348241.[0m
[32m[I 2022-04-21 11:38:31,087][0m Trial 224 finished with value: 0.8423527006348241 and parameters: {'alpha': 0.8497138143681692, 'ties': 'efron'}. Best is trial 13 with value: 0.8423527006348241.[0m
[32m[I 2022-04-21 11:38:31,408][0m Trial 225 finished with value: 0.8414545406933376 and parameters: {'alpha': 1.0016726622668009, 'ties': 'breslow'}. Best is trial 13 with value: 0.8423527006348241.[0m
[32m[I 2022-04-21 11:38:31,690][0m Trial 226 finished with value: 0.842183674410227 and parameters: {'alpha': 0.5871229034924905, 'ties': 'breslow'}. Best is trial 13 with value: 0.8423527006348241.[0m
[32m[I 2022-04-21 11:38:31,914][0m Trial 227 finished with value: 0.8423527006348241 and parameters: {'alpha': 0.8848842507193446, 'ties': 'breslow'}. Best is trial 13 with value: 0.8423527006348241.[0m
[32m[I 2022-04-21 11:38:32,161][0m Trial 228 finished with value: 0.8414545406933376 and parameters: {'alpha': 1.061370949201842, 'ties': 'breslow'}. Best is trial 13 with value: 0.8423527006348241.[0m
[32m[I 2022-04-21 11:38:32,463][0m Trial 229 finished with value: 0.8414545406933376 and parameters: {'alpha': 0.9628649814498349, 'ties': 'breslow'}. Best is trial 13 with value: 0.8423527006348241.[0m
[32m[I 2022-04-21 11:38:32,784][0m Trial 230 finished with value: 0.8414545406933376 and parameters: {'alpha': 0.8864081841909515, 'ties': 'efron'}. Best is trial 13 with value: 0.8423527006348241.[0m
[32m[I 2022-04-21 11:38:33,070][0m Trial 231 finished with value: 0.8414545406933376 and parameters: {'alpha': 0.8788780369006598, 'ties': 'efron'}. Best is trial 13 with value: 0.8423527006348241.[0m
[32m[I 2022-04-21 11:38:33,387][0m Trial 232 finished with value: 0.842183674410227 and parameters: {'alpha': 0.6858702885920329, 'ties': 'breslow'}. Best is trial 13 with value: 0.8423527006348241.[0m
[32m[I 2022-04-21 11:38:33,699][0m Trial 233 finished with value: 0.8423527006348241 and parameters: {'alpha': 0.8066172996416656, 'ties': 'breslow'}. Best is trial 13 with value: 0.8423527006348241.[0m
[32m[I 2022-04-21 11:38:33,922][0m Trial 234 finished with value: 0.8423527006348241 and parameters: {'alpha': 0.7883664318291445, 'ties': 'breslow'}. Best is trial 13 with value: 0.8423527006348241.[0m
[32m[I 2022-04-21 11:38:34,132][0m Trial 235 finished with value: 0.842183674410227 and parameters: {'alpha': 0.6375838852276003, 'ties': 'breslow'}. Best is trial 13 with value: 0.8423527006348241.[0m
[32m[I 2022-04-21 11:38:34,333][0m Trial 236 finished with value: 0.8423527006348241 and parameters: {'alpha': 0.90062723673957, 'ties': 'breslow'}. Best is trial 13 with value: 0.8423527006348241.[0m
[32m[I 2022-04-21 11:38:34,518][0m Trial 237 finished with value: 0.842183674410227 and parameters: {'alpha': 0.6848804981008568, 'ties': 'breslow'}. Best is trial 13 with value: 0.8423527006348241.[0m
[32m[I 2022-04-21 11:38:34,704][0m Trial 238 finished with value: 0.8423527006348241 and parameters: {'alpha': 0.7078044873177528, 'ties': 'breslow'}. Best is trial 13 with value: 0.8423527006348241.[0m
[32m[I 2022-04-21 11:38:34,882][0m Trial 239 finished with value: 0.842183674410227 and parameters: {'alpha': 0.49313932392029974, 'ties': 'breslow'}. Best is trial 13 with value: 0.8423527006348241.[0m
[32m[I 2022-04-21 11:38:35,065][0m Trial 240 finished with value: 0.8423527006348241 and parameters: {'alpha': 0.7827408812313122, 'ties': 'breslow'}. Best is trial 13 with value: 0.8423527006348241.[0m
[32m[I 2022-04-21 11:38:35,300][0m Trial 241 finished with value: 0.8423527006348241 and parameters: {'alpha': 0.8136666943450019, 'ties': 'breslow'}. Best is trial 13 with value: 0.8423527006348241.[0m
[32m[I 2022-04-21 11:38:35,483][0m Trial 242 finished with value: 0.8414545406933376 and parameters: {'alpha': 0.9850394029816357, 'ties': 'breslow'}. Best is trial 13 with value: 0.8423527006348241.[0m
[32m[I 2022-04-21 11:38:35,678][0m Trial 243 finished with value: 0.8423527006348241 and parameters: {'alpha': 0.7389372132382226, 'ties': 'efron'}. Best is trial 13 with value: 0.8423527006348241.[0m
[32m[I 2022-04-21 11:38:35,856][0m Trial 244 finished with value: 0.8423527006348241 and parameters: {'alpha': 0.9259844125321997, 'ties': 'breslow'}. Best is trial 13 with value: 0.8423527006348241.[0m
[32m[I 2022-04-21 11:38:36,031][0m Trial 245 finished with value: 0.8414545406933376 and parameters: {'alpha': 0.9647749212933528, 'ties': 'breslow'}. Best is trial 13 with value: 0.8423527006348241.[0m
[32m[I 2022-04-21 11:38:36,201][0m Trial 246 finished with value: 0.8423527006348241 and parameters: {'alpha': 0.8164875540033365, 'ties': 'breslow'}. Best is trial 13 with value: 0.8423527006348241.[0m
[32m[I 2022-04-21 11:38:36,420][0m Trial 247 finished with value: 0.8414545406933376 and parameters: {'alpha': 1.0455230193617324, 'ties': 'breslow'}. Best is trial 13 with value: 0.8423527006348241.[0m
[32m[I 2022-04-21 11:38:36,826][0m Trial 248 finished with value: 0.8423527006348241 and parameters: {'alpha': 0.725909885918075, 'ties': 'efron'}. Best is trial 13 with value: 0.8423527006348241.[0m
[32m[I 2022-04-21 11:38:37,009][0m Trial 249 finished with value: 0.8423527006348241 and parameters: {'alpha': 0.857511300217971, 'ties': 'breslow'}. Best is trial 13 with value: 0.8423527006348241.[0m
[32m[I 2022-04-21 11:38:37,380][0m Trial 250 finished with value: 0.8423527006348241 and parameters: {'alpha': 0.8339887148478301, 'ties': 'breslow'}. Best is trial 13 with value: 0.8423527006348241.[0m
[32m[I 2022-04-21 11:38:37,767][0m Trial 251 finished with value: 0.842183674410227 and parameters: {'alpha': 0.5879664893849018, 'ties': 'efron'}. Best is trial 13 with value: 0.8423527006348241.[0m
[32m[I 2022-04-21 11:38:38,137][0m Trial 252 finished with value: 0.8414545406933376 and parameters: {'alpha': 1.1414956726293295, 'ties': 'breslow'}. Best is trial 13 with value: 0.8423527006348241.[0m
[32m[I 2022-04-21 11:38:38,494][0m Trial 253 finished with value: 0.8423527006348241 and parameters: {'alpha': 0.9097778526925969, 'ties': 'breslow'}. Best is trial 13 with value: 0.8423527006348241.[0m
[32m[I 2022-04-21 11:38:38,708][0m Trial 254 finished with value: 0.842183674410227 and parameters: {'alpha': 0.6225646070605573, 'ties': 'breslow'}. Best is trial 13 with value: 0.8423527006348241.[0m
[32m[I 2022-04-21 11:38:38,977][0m Trial 255 finished with value: 0.8414545406933376 and parameters: {'alpha': 1.0452919909560958, 'ties': 'efron'}. Best is trial 13 with value: 0.8423527006348241.[0m
[32m[I 2022-04-21 11:38:39,261][0m Trial 256 finished with value: 0.8423527006348241 and parameters: {'alpha': 0.7068080988111165, 'ties': 'efron'}. Best is trial 13 with value: 0.8423527006348241.[0m
[32m[I 2022-04-21 11:38:39,563][0m Trial 257 finished with value: 0.8423527006348241 and parameters: {'alpha': 0.7665506442932136, 'ties': 'breslow'}. Best is trial 13 with value: 0.8423527006348241.[0m
[32m[I 2022-04-21 11:38:39,831][0m Trial 258 finished with value: 0.842183674410227 and parameters: {'alpha': 0.656503570536231, 'ties': 'efron'}. Best is trial 13 with value: 0.8423527006348241.[0m
[32m[I 2022-04-21 11:38:40,094][0m Trial 259 finished with value: 0.8423527006348241 and parameters: {'alpha': 0.8189207547312103, 'ties': 'breslow'}. Best is trial 13 with value: 0.8423527006348241.[0m
[32m[I 2022-04-21 11:38:40,469][0m Trial 260 finished with value: 0.842183674410227 and parameters: {'alpha': 0.5284145029902061, 'ties': 'efron'}. Best is trial 13 with value: 0.8423527006348241.[0m
[32m[I 2022-04-21 11:38:40,678][0m Trial 261 finished with value: 0.8423527006348241 and parameters: {'alpha': 0.908693899875033, 'ties': 'breslow'}. Best is trial 13 with value: 0.8423527006348241.[0m
[32m[I 2022-04-21 11:38:41,062][0m Trial 262 finished with value: 0.8423527006348241 and parameters: {'alpha': 0.7373343078977882, 'ties': 'efron'}. Best is trial 13 with value: 0.8423527006348241.[0m
[32m[I 2022-04-21 11:38:41,379][0m Trial 263 finished with value: 0.8412855144687406 and parameters: {'alpha': 1.9606633405333564, 'ties': 'breslow'}. Best is trial 13 with value: 0.8423527006348241.[0m
[32m[I 2022-04-21 11:38:41,608][0m Trial 264 finished with value: 0.8423527006348241 and parameters: {'alpha': 0.8062512784520122, 'ties': 'breslow'}. Best is trial 13 with value: 0.8423527006348241.[0m
[32m[I 2022-04-21 11:38:41,958][0m Trial 265 finished with value: 0.8412855144687406 and parameters: {'alpha': 1.6959267695448774, 'ties': 'breslow'}. Best is trial 13 with value: 0.8423527006348241.[0m
[32m[I 2022-04-21 11:38:42,231][0m Trial 266 finished with value: 0.842183674410227 and parameters: {'alpha': 0.580645842527718, 'ties': 'efron'}. Best is trial 13 with value: 0.8423527006348241.[0m
[32m[I 2022-04-21 11:38:42,652][0m Trial 267 finished with value: 0.842183674410227 and parameters: {'alpha': 0.6879072849636865, 'ties': 'breslow'}. Best is trial 13 with value: 0.8423527006348241.[0m
[32m[I 2022-04-21 11:38:43,120][0m Trial 268 finished with value: 0.8414545406933376 and parameters: {'alpha': 0.9603147425209468, 'ties': 'breslow'}. Best is trial 13 with value: 0.8423527006348241.[0m
[32m[I 2022-04-21 11:38:43,652][0m Trial 269 finished with value: 0.8423527006348241 and parameters: {'alpha': 0.754562971492937, 'ties': 'efron'}. Best is trial 13 with value: 0.8423527006348241.[0m
[32m[I 2022-04-21 11:38:43,957][0m Trial 270 finished with value: 0.8423527006348241 and parameters: {'alpha': 0.8582993789294616, 'ties': 'breslow'}. Best is trial 13 with value: 0.8423527006348241.[0m
[32m[I 2022-04-21 11:38:44,274][0m Trial 271 finished with value: 0.8423527006348241 and parameters: {'alpha': 0.8869492096610491, 'ties': 'breslow'}. Best is trial 13 with value: 0.8423527006348241.[0m
[32m[I 2022-04-21 11:38:44,748][0m Trial 272 finished with value: 0.8423527006348241 and parameters: {'alpha': 0.7612502950432795, 'ties': 'efron'}. Best is trial 13 with value: 0.8423527006348241.[0m
[32m[I 2022-04-21 11:38:45,028][0m Trial 273 finished with value: 0.842183674410227 and parameters: {'alpha': 0.6504716551233235, 'ties': 'breslow'}. Best is trial 13 with value: 0.8423527006348241.[0m
[32m[I 2022-04-21 11:38:45,275][0m Trial 274 finished with value: 0.8414545406933376 and parameters: {'alpha': 1.024904432193571, 'ties': 'breslow'}. Best is trial 13 with value: 0.8423527006348241.[0m
[32m[I 2022-04-21 11:38:45,669][0m Trial 275 finished with value: 0.842183674410227 and parameters: {'alpha': 0.3964898922408156, 'ties': 'efron'}. Best is trial 13 with value: 0.8423527006348241.[0m
[32m[I 2022-04-21 11:38:45,971][0m Trial 276 finished with value: 0.842183674410227 and parameters: {'alpha': 0.5390849762632366, 'ties': 'breslow'}. Best is trial 13 with value: 0.8423527006348241.[0m
[32m[I 2022-04-21 11:38:46,131][0m Trial 277 finished with value: 0.8423527006348241 and parameters: {'alpha': 0.8525665822092957, 'ties': 'breslow'}. Best is trial 13 with value: 0.8423527006348241.[0m
[32m[I 2022-04-21 11:38:46,571][0m Trial 278 finished with value: 0.841474844739692 and parameters: {'alpha': 2.6166918236671854, 'ties': 'efron'}. Best is trial 13 with value: 0.8423527006348241.[0m
[32m[I 2022-04-21 11:38:46,965][0m Trial 279 finished with value: 0.8423527006348241 and parameters: {'alpha': 0.9246268253949723, 'ties': 'breslow'}. Best is trial 13 with value: 0.8423527006348241.[0m
[32m[I 2022-04-21 11:38:47,327][0m Trial 280 finished with value: 0.8414545406933376 and parameters: {'alpha': 1.168379635149417, 'ties': 'breslow'}. Best is trial 13 with value: 0.8423527006348241.[0m
[32m[I 2022-04-21 11:38:47,770][0m Trial 281 finished with value: 0.8423527006348241 and parameters: {'alpha': 0.7624026780677691, 'ties': 'breslow'}. Best is trial 13 with value: 0.8423527006348241.[0m
[32m[I 2022-04-21 11:38:48,159][0m Trial 282 finished with value: 0.8423527006348241 and parameters: {'alpha': 0.8131312331452843, 'ties': 'breslow'}. Best is trial 13 with value: 0.8423527006348241.[0m
[32m[I 2022-04-21 11:38:48,526][0m Trial 283 finished with value: 0.842183674410227 and parameters: {'alpha': 0.6259688590849641, 'ties': 'breslow'}. Best is trial 13 with value: 0.8423527006348241.[0m
[32m[I 2022-04-21 11:38:48,878][0m Trial 284 finished with value: 0.842183674410227 and parameters: {'alpha': 0.6829526210306368, 'ties': 'breslow'}. Best is trial 13 with value: 0.8423527006348241.[0m
[32m[I 2022-04-21 11:38:49,042][0m Trial 285 finished with value: 0.842183674410227 and parameters: {'alpha': 0.48081118876503953, 'ties': 'breslow'}. Best is trial 13 with value: 0.8423527006348241.[0m
[32m[I 2022-04-21 11:38:49,215][0m Trial 286 finished with value: 0.842183674410227 and parameters: {'alpha': 0.6597295647363578, 'ties': 'breslow'}. Best is trial 13 with value: 0.8423527006348241.[0m
[32m[I 2022-04-21 11:38:49,383][0m Trial 287 finished with value: 0.8423527006348241 and parameters: {'alpha': 0.8132039126803678, 'ties': 'breslow'}. Best is trial 13 with value: 0.8423527006348241.[0m
[32m[I 2022-04-21 11:38:49,569][0m Trial 288 finished with value: 0.8423527006348241 and parameters: {'alpha': 0.7860154870832922, 'ties': 'breslow'}. Best is trial 13 with value: 0.8423527006348241.[0m
[32m[I 2022-04-21 11:38:49,760][0m Trial 289 finished with value: 0.8414545406933376 and parameters: {'alpha': 0.9725128876359469, 'ties': 'breslow'}. Best is trial 13 with value: 0.8423527006348241.[0m
[32m[I 2022-04-21 11:38:49,923][0m Trial 290 finished with value: 0.8423527006348241 and parameters: {'alpha': 0.7322024108766412, 'ties': 'breslow'}. Best is trial 13 with value: 0.8423527006348241.[0m
[32m[I 2022-04-21 11:38:50,090][0m Trial 291 finished with value: 0.8407234838742553 and parameters: {'alpha': 3.671003805531421, 'ties': 'breslow'}. Best is trial 13 with value: 0.8423527006348241.[0m
[32m[I 2022-04-21 11:38:50,347][0m Trial 292 finished with value: 0.842183674410227 and parameters: {'alpha': 0.5771874672009518, 'ties': 'breslow'}. Best is trial 13 with value: 0.8423527006348241.[0m
[32m[I 2022-04-21 11:38:50,650][0m Trial 293 finished with value: 0.841305818515095 and parameters: {'alpha': 3.099272361820379, 'ties': 'breslow'}. Best is trial 13 with value: 0.8423527006348241.[0m
[32m[I 2022-04-21 11:38:51,040][0m Trial 294 finished with value: 0.8423527006348241 and parameters: {'alpha': 0.9254387972219825, 'ties': 'breslow'}. Best is trial 13 with value: 0.8423527006348241.[0m
[32m[I 2022-04-21 11:38:51,419][0m Trial 295 finished with value: 0.8414545406933376 and parameters: {'alpha': 1.0758770427751392, 'ties': 'breslow'}. Best is trial 13 with value: 0.8423527006348241.[0m
[32m[I 2022-04-21 11:38:51,861][0m Trial 296 finished with value: 0.8414545406933376 and parameters: {'alpha': 0.960188634257217, 'ties': 'efron'}. Best is trial 13 with value: 0.8423527006348241.[0m
[32m[I 2022-04-21 11:38:52,210][0m Trial 297 finished with value: 0.8414545406933376 and parameters: {'alpha': 0.9191494831349081, 'ties': 'efron'}. Best is trial 13 with value: 0.8423527006348241.[0m
[32m[I 2022-04-21 11:38:52,527][0m Trial 298 finished with value: 0.842183674410227 and parameters: {'alpha': 0.6983488977056587, 'ties': 'breslow'}. Best is trial 13 with value: 0.8423527006348241.[0m
[32m[I 2022-04-21 11:38:52,770][0m Trial 299 finished with value: 0.8423527006348241 and parameters: {'alpha': 0.8539266749234966, 'ties': 'breslow'}. Best is trial 13 with value: 0.8423527006348241.[0m
[32m[I 2022-04-21 11:38:53,103][0m Trial 300 finished with value: 0.8414545406933376 and parameters: {'alpha': 1.071905520343963, 'ties': 'breslow'}. Best is trial 13 with value: 0.8423527006348241.[0m
[32m[I 2022-04-21 11:38:53,300][0m Trial 301 finished with value: 0.842183674410227 and parameters: {'alpha': 0.5662093623205839, 'ties': 'breslow'}. Best is trial 13 with value: 0.8423527006348241.[0m
[32m[I 2022-04-21 11:38:53,600][0m Trial 302 finished with value: 0.8423527006348241 and parameters: {'alpha': 0.7118871099823421, 'ties': 'breslow'}. Best is trial 13 with value: 0.8423527006348241.[0m
[32m[I 2022-04-21 11:38:53,926][0m Trial 303 finished with value: 0.8423527006348241 and parameters: {'alpha': 0.8371609623244862, 'ties': 'efron'}. Best is trial 13 with value: 0.8423527006348241.[0m
[32m[I 2022-04-21 11:38:54,225][0m Trial 304 finished with value: 0.8414545406933376 and parameters: {'alpha': 0.8867610305927465, 'ties': 'efron'}. Best is trial 13 with value: 0.8423527006348241.[0m
[32m[I 2022-04-21 11:38:54,417][0m Trial 305 finished with value: 0.8423527006348241 and parameters: {'alpha': 0.7601219594957568, 'ties': 'breslow'}. Best is trial 13 with value: 0.8423527006348241.[0m
[32m[I 2022-04-21 11:38:54,717][0m Trial 306 finished with value: 0.8423527006348241 and parameters: {'alpha': 0.7797063728840368, 'ties': 'efron'}. Best is trial 13 with value: 0.8423527006348241.[0m
[32m[I 2022-04-21 11:38:54,870][0m Trial 307 finished with value: 0.8414545406933376 and parameters: {'alpha': 0.9392376950022362, 'ties': 'breslow'}. Best is trial 13 with value: 0.8423527006348241.[0m
[32m[I 2022-04-21 11:38:55,204][0m Trial 308 finished with value: 0.842183674410227 and parameters: {'alpha': 0.6431872276360585, 'ties': 'efron'}. Best is trial 13 with value: 0.8423527006348241.[0m
[32m[I 2022-04-21 11:38:55,542][0m Trial 309 finished with value: 0.8423527006348241 and parameters: {'alpha': 0.7276363730816385, 'ties': 'breslow'}. Best is trial 13 with value: 0.8423527006348241.[0m
[32m[I 2022-04-21 11:38:55,723][0m Trial 310 finished with value: 0.842183674410227 and parameters: {'alpha': 0.49321124160151764, 'ties': 'efron'}. Best is trial 13 with value: 0.8423527006348241.[0m
[32m[I 2022-04-21 11:38:56,016][0m Trial 311 finished with value: 0.8407234838742553 and parameters: {'alpha': 4.284458640636659, 'ties': 'efron'}. Best is trial 13 with value: 0.8423527006348241.[0m
[32m[I 2022-04-21 11:38:56,205][0m Trial 312 finished with value: 0.8414545406933376 and parameters: {'alpha': 1.0762096039912956, 'ties': 'breslow'}. Best is trial 13 with value: 0.8423527006348241.[0m
[32m[I 2022-04-21 11:38:56,429][0m Trial 313 finished with value: 0.841474844739692 and parameters: {'alpha': 2.8832127944781605, 'ties': 'breslow'}. Best is trial 13 with value: 0.8423527006348241.[0m
[32m[I 2022-04-21 11:38:56,688][0m Trial 314 finished with value: 0.842183674410227 and parameters: {'alpha': 0.3193011779506399, 'ties': 'breslow'}. Best is trial 13 with value: 0.8423527006348241.[0m
[32m[I 2022-04-21 11:38:56,894][0m Trial 315 finished with value: 0.8423527006348241 and parameters: {'alpha': 0.8689735479862393, 'ties': 'breslow'}. Best is trial 13 with value: 0.8423527006348241.[0m
[32m[I 2022-04-21 11:38:57,292][0m Trial 316 finished with value: 0.8414545406933376 and parameters: {'alpha': 1.002710985980468, 'ties': 'efron'}. Best is trial 13 with value: 0.8423527006348241.[0m
[32m[I 2022-04-21 11:38:57,467][0m Trial 317 finished with value: 0.8423527006348241 and parameters: {'alpha': 0.7744045347401458, 'ties': 'efron'}. Best is trial 13 with value: 0.8423527006348241.[0m
[32m[I 2022-04-21 11:38:57,698][0m Trial 318 finished with value: 0.8423527006348241 and parameters: {'alpha': 0.8564062175724482, 'ties': 'breslow'}. Best is trial 13 with value: 0.8423527006348241.[0m
[32m[I 2022-04-21 11:38:57,952][0m Trial 319 finished with value: 0.8423527006348241 and parameters: {'alpha': 0.8764888875014479, 'ties': 'breslow'}. Best is trial 13 with value: 0.8423527006348241.[0m
[32m[I 2022-04-21 11:38:58,263][0m Trial 320 finished with value: 0.8414545406933376 and parameters: {'alpha': 1.18188236545595, 'ties': 'breslow'}. Best is trial 13 with value: 0.8423527006348241.[0m
