[32m[I 2022-04-21 23:51:37,242][0m Trial 742 finished with value: 0.824726317170067 and parameters: {'loss': 'coxph', 'learning_rate': 0.005147164342193983, 'n_estimators': 989, 'criterion': 'friedman_mse', 'min_samples_split': 2, 'min_samples_leaf': 10, 'min_weight_fraction_leaf': 0.021606237477328656, 'min_impurity_decrease': 0.9620147572729056, 'max_features': 0.25661758216273084, 'subsample': 0.3695159301952874, 'dropout_rate': 0.14442486975267665, 'ccp_alpha': 0.09714923409819859}. Best is trial 664 with value: 0.8342316538423719.[0m
[32m[I 2022-04-21 23:56:46,765][0m Trial 743 finished with value: 0.49041219013993487 and parameters: {'loss': 'coxph', 'learning_rate': 0.003108332571811751, 'n_estimators': 909, 'criterion': 'friedman_mse', 'min_samples_split': 2, 'min_samples_leaf': 9, 'min_weight_fraction_leaf': 0.029763901121068578, 'min_impurity_decrease': 0.9258286236031794, 'max_features': 0.24005235680791942, 'subsample': 0.33538501023052414, 'dropout_rate': 0.21348194787450306, 'ccp_alpha': 0.18334458070444437}. Best is trial 664 with value: 0.8342316538423719.[0m
[32m[I 2022-04-22 00:02:46,403][0m Trial 744 finished with value: 0.8315293066093581 and parameters: {'loss': 'coxph', 'learning_rate': 0.004770761923668278, 'n_estimators': 994, 'criterion': 'friedman_mse', 'min_samples_split': 2, 'min_samples_leaf': 9, 'min_weight_fraction_leaf': 0.011054841744125476, 'min_impurity_decrease': 0.9581032256701406, 'max_features': 0.2825029865229621, 'subsample': 0.3640294694036485, 'dropout_rate': 0.23656460484432962, 'ccp_alpha': 0.0022041189468229535}. Best is trial 664 with value: 0.8342316538423719.[0m
[32m[I 2022-04-22 00:08:29,181][0m Trial 745 finished with value: 0.7135741225045453 and parameters: {'loss': 'coxph', 'learning_rate': 0.005459024319882975, 'n_estimators': 983, 'criterion': 'friedman_mse', 'min_samples_split': 2, 'min_samples_leaf': 7, 'min_weight_fraction_leaf': 0.0106343413856946, 'min_impurity_decrease': 0.9141130807239495, 'max_features': 0.2923872229068267, 'subsample': 0.7584682079623, 'dropout_rate': 0.226239811424639, 'ccp_alpha': 0.09043035316490536}. Best is trial 664 with value: 0.8342316538423719.[0m
[32m[I 2022-04-22 00:15:05,331][0m Trial 746 finished with value: 0.49517644084823703 and parameters: {'loss': 'coxph', 'learning_rate': 0.006520834375549846, 'n_estimators': 1000, 'criterion': 'friedman_mse', 'min_samples_split': 7, 'min_samples_leaf': 9, 'min_weight_fraction_leaf': 0.011903940630870073, 'min_impurity_decrease': 0.9568875035376483, 'max_features': 0.27931822526015626, 'subsample': 0.36790655258739047, 'dropout_rate': 0.17593105107108492, 'ccp_alpha': 0.17687283737341844}. Best is trial 664 with value: 0.8342316538423719.[0m
[32m[I 2022-04-22 00:20:41,967][0m Trial 747 finished with value: 0.8303838477929076 and parameters: {'loss': 'coxph', 'learning_rate': 0.004850458989019097, 'n_estimators': 996, 'criterion': 'friedman_mse', 'min_samples_split': 2, 'min_samples_leaf': 9, 'min_weight_fraction_leaf': 0.0019930812592105947, 'min_impurity_decrease': 0.93017910358802, 'max_features': 0.3178690278810969, 'subsample': 0.3566051808030195, 'dropout_rate': 0.2417007662426991, 'ccp_alpha': 0.0019226022289196823}. Best is trial 664 with value: 0.8342316538423719.[0m
[32m[I 2022-04-22 00:26:04,110][0m Trial 748 finished with value: 0.25 and parameters: {'loss': 'coxph', 'learning_rate': 0.006082818365903713, 'n_estimators': 955, 'criterion': 'friedman_mse', 'min_samples_split': 2, 'min_samples_leaf': 9, 'min_weight_fraction_leaf': 0.019451369675270346, 'min_impurity_decrease': 0.9540135495538417, 'max_features': 0.3580672963822965, 'subsample': 0.3186509979305033, 'dropout_rate': 0.15713262430176642, 'ccp_alpha': 2.620147361294284}. Best is trial 664 with value: 0.8342316538423719.[0m
/media/san2_ssd/data/Workdir/survival/venv/lib/python3.8/site-packages/sksurv/ensemble/boosting.py:955: RuntimeWarning: divide by zero encountered in log
  time = numpy.log(time)
/media/san2_ssd/data/Workdir/survival/venv/lib/python3.8/site-packages/sksurv/ensemble/boosting.py:955: RuntimeWarning: divide by zero encountered in log
  time = numpy.log(time)
/media/san2_ssd/data/Workdir/survival/venv/lib/python3.8/site-packages/sksurv/ensemble/boosting.py:955: RuntimeWarning: divide by zero encountered in log
  time = numpy.log(time)
/media/san2_ssd/data/Workdir/survival/venv/lib/python3.8/site-packages/sksurv/ensemble/boosting.py:955: RuntimeWarning: divide by zero encountered in log
  time = numpy.log(time)
[32m[I 2022-04-22 00:27:16,967][0m Trial 749 finished with value: -0.45 and parameters: {'loss': 'squared', 'learning_rate': 0.004545025476376511, 'n_estimators': 927, 'criterion': 'squared_error', 'min_samples_split': 2, 'min_samples_leaf': 9, 'min_weight_fraction_leaf': 0.001575449152354749, 'min_impurity_decrease': 0.8995243200870688, 'max_features': 0.30136918150136643, 'subsample': 0.37184719509459535, 'dropout_rate': 0.1877085450502189, 'ccp_alpha': 0.26966371844894005}. Best is trial 664 with value: 0.8342316538423719.[0m
[32m[I 2022-04-22 00:32:20,952][0m Trial 750 finished with value: 0.8270569325216455 and parameters: {'loss': 'coxph', 'learning_rate': 0.007597376899596455, 'n_estimators': 929, 'criterion': 'friedman_mse', 'min_samples_split': 2, 'min_samples_leaf': 9, 'min_weight_fraction_leaf': 0.018434220536250552, 'min_impurity_decrease': 0.9415999701560064, 'max_features': 0.3355840281627873, 'subsample': 0.333780713195389, 'dropout_rate': 0.21716447513167975, 'ccp_alpha': 0.09064624986484403}. Best is trial 664 with value: 0.8342316538423719.[0m
[32m[I 2022-04-22 00:37:43,037][0m Trial 751 finished with value: 0.25 and parameters: {'loss': 'coxph', 'learning_rate': 0.005481892946089635, 'n_estimators': 998, 'criterion': 'absolute_error', 'min_samples_split': 2, 'min_samples_leaf': 9, 'min_weight_fraction_leaf': 0.010927785495996599, 'min_impurity_decrease': 0.8611241582171927, 'max_features': 0.1864380064220107, 'subsample': 0.3127272825384221, 'dropout_rate': 0.25877552212533117, 'ccp_alpha': 0.004703126278297632}. Best is trial 664 with value: 0.8342316538423719.[0m
[32m[I 2022-04-22 00:41:45,503][0m Trial 752 finished with value: 0.8118616640488245 and parameters: {'loss': 'coxph', 'learning_rate': 0.002841682154649034, 'n_estimators': 864, 'criterion': 'friedman_mse', 'min_samples_split': 2, 'min_samples_leaf': 9, 'min_weight_fraction_leaf': 0.020379947189570438, 'min_impurity_decrease': 0.975407832393622, 'max_features': 0.22565025594310636, 'subsample': 0.3486153687570389, 'dropout_rate': 0.21082313406111886, 'ccp_alpha': 0.16035981983402617}. Best is trial 664 with value: 0.8342316538423719.[0m
[32m[I 2022-04-22 00:46:35,429][0m Trial 753 finished with value: 0.8237372290781924 and parameters: {'loss': 'coxph', 'learning_rate': 0.006900581283863691, 'n_estimators': 938, 'criterion': 'friedman_mse', 'min_samples_split': 2, 'min_samples_leaf': 7, 'min_weight_fraction_leaf': 0.008649379978959643, 'min_impurity_decrease': 0.9142854920696032, 'max_features': 0.31363450886902466, 'subsample': 0.3698828952413258, 'dropout_rate': 0.3151241274039656, 'ccp_alpha': 0.10168913850096098}. Best is trial 664 with value: 0.8342316538423719.[0m
[32m[I 2022-04-22 00:50:38,870][0m Trial 754 finished with value: 0.8258609800085106 and parameters: {'loss': 'coxph', 'learning_rate': 0.004055817802142739, 'n_estimators': 821, 'criterion': 'friedman_mse', 'min_samples_split': 2, 'min_samples_leaf': 10, 'min_weight_fraction_leaf': 0.03288346588801038, 'min_impurity_decrease': 0.942221654234352, 'max_features': 0.27593639364002415, 'subsample': 0.3326034318441207, 'dropout_rate': 0.22960692727196183, 'ccp_alpha': 0.08872904849085961}. Best is trial 664 with value: 0.8342316538423719.[0m
[32m[I 2022-04-22 00:54:40,340][0m Trial 755 finished with value: 0.25 and parameters: {'loss': 'coxph', 'learning_rate': 0.00514235472596243, 'n_estimators': 871, 'criterion': 'friedman_mse', 'min_samples_split': 2, 'min_samples_leaf': 7, 'min_weight_fraction_leaf': 0.0218757708479537, 'min_impurity_decrease': 0.8888408026984529, 'max_features': 0.2903257985794588, 'subsample': 0.3150672187456421, 'dropout_rate': 0.29075431973191984, 'ccp_alpha': 0.4610422720289637}. Best is trial 664 with value: 0.8342316538423719.[0m
[32m[I 2022-04-22 01:00:30,280][0m Trial 756 finished with value: 0.8316252799445045 and parameters: {'loss': 'coxph', 'learning_rate': 0.007744161132418442, 'n_estimators': 951, 'criterion': 'friedman_mse', 'min_samples_split': 2, 'min_samples_leaf': 9, 'min_weight_fraction_leaf': 0.0016451666066278226, 'min_impurity_decrease': 0.9666359872052621, 'max_features': 0.34756436680128017, 'subsample': 0.3502683306776727, 'dropout_rate': 0.20191516138484533, 'ccp_alpha': 0.003252811328243511}. Best is trial 664 with value: 0.8342316538423719.[0m
[32m[I 2022-04-22 01:05:51,338][0m Trial 757 finished with value: 0.2567931854342576 and parameters: {'loss': 'coxph', 'learning_rate': 0.0059948778606899525, 'n_estimators': 951, 'criterion': 'friedman_mse', 'min_samples_split': 2, 'min_samples_leaf': 9, 'min_weight_fraction_leaf': 0.00886698826852713, 'min_impurity_decrease': 0.9630741002926917, 'max_features': 0.3675202224684886, 'subsample': 0.35065786898939394, 'dropout_rate': 0.2023619874644292, 'ccp_alpha': 0.2576586146345406}. Best is trial 664 with value: 0.8342316538423719.[0m
[32m[I 2022-04-22 01:11:46,133][0m Trial 758 finished with value: 0.8316391705743271 and parameters: {'loss': 'coxph', 'learning_rate': 0.007865995183628604, 'n_estimators': 914, 'criterion': 'friedman_mse', 'min_samples_split': 2, 'min_samples_leaf': 9, 'min_weight_fraction_leaf': 0.008572906433219143, 'min_impurity_decrease': 0.9776715452781695, 'max_features': 0.3532965501315334, 'subsample': 0.31185814400322454, 'dropout_rate': 0.17708448078463618, 'ccp_alpha': 0.0015612162258405037}. Best is trial 664 with value: 0.8342316538423719.[0m
[32m[I 2022-04-22 01:16:11,209][0m Trial 759 finished with value: 0.809017791086671 and parameters: {'loss': 'coxph', 'learning_rate': 0.007470869100892285, 'n_estimators': 850, 'criterion': 'friedman_mse', 'min_samples_split': 2, 'min_samples_leaf': 9, 'min_weight_fraction_leaf': 0.012976806299260122, 'min_impurity_decrease': 0.9452861795302887, 'max_features': 0.35566653996036623, 'subsample': 0.3069587389508303, 'dropout_rate': 0.1759158324488455, 'ccp_alpha': 0.18198279421593747}. Best is trial 664 with value: 0.8342316538423719.[0m
[32m[I 2022-04-22 01:22:03,993][0m Trial 760 finished with value: 0.8290893097498557 and parameters: {'loss': 'coxph', 'learning_rate': 0.008635569968225206, 'n_estimators': 905, 'criterion': 'friedman_mse', 'min_samples_split': 2, 'min_samples_leaf': 9, 'min_weight_fraction_leaf': 0.0015190813947975855, 'min_impurity_decrease': 0.9705873894088665, 'max_features': 0.34164739162195695, 'subsample': 0.30683538646653946, 'dropout_rate': 0.15627147356572116, 'ccp_alpha': 0.001664186232662748}. Best is trial 664 with value: 0.8342316538423719.[0m
[32m[I 2022-04-22 01:27:23,899][0m Trial 761 finished with value: 0.25662745571200507 and parameters: {'loss': 'coxph', 'learning_rate': 0.008133460936019375, 'n_estimators': 907, 'criterion': 'friedman_mse', 'min_samples_split': 2, 'min_samples_leaf': 9, 'min_weight_fraction_leaf': 0.018510523758573576, 'min_impurity_decrease': 0.9156741970464756, 'max_features': 0.32822800530776985, 'subsample': 0.3253575211834794, 'dropout_rate': 0.18224021977378144, 'ccp_alpha': 0.34763517197328764}. Best is trial 664 with value: 0.8342316538423719.[0m
[32m[I 2022-04-22 01:31:20,026][0m Trial 762 finished with value: 0.8306209453629944 and parameters: {'loss': 'coxph', 'learning_rate': 0.0065792923918553455, 'n_estimators': 795, 'criterion': 'friedman_mse', 'min_samples_split': 2, 'min_samples_leaf': 9, 'min_weight_fraction_leaf': 0.011363997966057434, 'min_impurity_decrease': 0.9336865446852253, 'max_features': 0.3524898621938884, 'subsample': 0.3091736532033435, 'dropout_rate': 0.20294255526809393, 'ccp_alpha': 0.0017903282388189536}. Best is trial 664 with value: 0.8342316538423719.[0m
[32m[I 2022-04-22 01:34:51,043][0m Trial 763 finished with value: 0.8129451390038096 and parameters: {'loss': 'coxph', 'learning_rate': 0.008837011492388795, 'n_estimators': 803, 'criterion': 'friedman_mse', 'min_samples_split': 2, 'min_samples_leaf': 10, 'min_weight_fraction_leaf': 0.011053936289417698, 'min_impurity_decrease': 0.9381993863449359, 'max_features': 0.3527191949031589, 'subsample': 0.33197971052841607, 'dropout_rate': 0.19790053755858272, 'ccp_alpha': 0.15587161148164871}. Best is trial 664 with value: 0.8342316538423719.[0m
[32m[I 2022-04-22 01:38:34,571][0m Trial 764 finished with value: 0.8263320269939829 and parameters: {'loss': 'coxph', 'learning_rate': 0.006788484459369607, 'n_estimators': 788, 'criterion': 'friedman_mse', 'min_samples_split': 2, 'min_samples_leaf': 9, 'min_weight_fraction_leaf': 0.025444957234642192, 'min_impurity_decrease': 0.9599927457074703, 'max_features': 0.36875401056738405, 'subsample': 0.2988562768171574, 'dropout_rate': 0.15438989366764985, 'ccp_alpha': 0.09389661800081604}. Best is trial 664 with value: 0.8342316538423719.[0m
[32m[I 2022-04-22 01:42:38,068][0m Trial 765 finished with value: 0.3811755851689217 and parameters: {'loss': 'coxph', 'learning_rate': 0.008745782734854794, 'n_estimators': 832, 'criterion': 'friedman_mse', 'min_samples_split': 2, 'min_samples_leaf': 9, 'min_weight_fraction_leaf': 0.011641973594177827, 'min_impurity_decrease': 0.9757548155508509, 'max_features': 0.3446445910735862, 'subsample': 0.31071466889346816, 'dropout_rate': 0.17405222092453607, 'ccp_alpha': 0.24884790349138852}. Best is trial 664 with value: 0.8342316538423719.[0m
[32m[I 2022-04-22 01:47:03,131][0m Trial 766 finished with value: 0.8276502270833666 and parameters: {'loss': 'coxph', 'learning_rate': 0.006951233274317995, 'n_estimators': 852, 'criterion': 'friedman_mse', 'min_samples_split': 2, 'min_samples_leaf': 7, 'min_weight_fraction_leaf': 0.001958873806708757, 'min_impurity_decrease': 0.9414843810806143, 'max_features': 0.3243689979893316, 'subsample': 0.32749226400163833, 'dropout_rate': 0.20494801032843607, 'ccp_alpha': 0.09254258024737219}. Best is trial 664 with value: 0.8342316538423719.[0m
[32m[I 2022-04-22 01:50:47,343][0m Trial 767 finished with value: 0.7084533724678529 and parameters: {'loss': 'coxph', 'learning_rate': 0.006571001580174592, 'n_estimators': 797, 'criterion': 'friedman_mse', 'min_samples_split': 10, 'min_samples_leaf': 10, 'min_weight_fraction_leaf': 0.02199214594802582, 'min_impurity_decrease': 0.9599939454489904, 'max_features': 0.37208440770792767, 'subsample': 0.33180169538278115, 'dropout_rate': 0.13383474679568969, 'ccp_alpha': 0.1775888970375153}. Best is trial 664 with value: 0.8342316538423719.[0m
/media/san2_ssd/data/Workdir/survival/venv/lib/python3.8/site-packages/sksurv/ensemble/boosting.py:955: RuntimeWarning: divide by zero encountered in log
  time = numpy.log(time)
/media/san2_ssd/data/Workdir/survival/venv/lib/python3.8/site-packages/sksurv/ensemble/boosting.py:955: RuntimeWarning: divide by zero encountered in log
  time = numpy.log(time)
/media/san2_ssd/data/Workdir/survival/venv/lib/python3.8/site-packages/sksurv/ensemble/boosting.py:955: RuntimeWarning: divide by zero encountered in log
  time = numpy.log(time)
/media/san2_ssd/data/Workdir/survival/venv/lib/python3.8/site-packages/sksurv/ensemble/boosting.py:955: RuntimeWarning: divide by zero encountered in log
  time = numpy.log(time)
[32m[I 2022-04-22 01:51:45,849][0m Trial 768 finished with value: -0.46740815852298906 and parameters: {'loss': 'squared', 'learning_rate': 0.008506689186850639, 'n_estimators': 869, 'criterion': 'friedman_mse', 'min_samples_split': 2, 'min_samples_leaf': 9, 'min_weight_fraction_leaf': 0.001121113266065803, 'min_impurity_decrease': 0.927508003495922, 'max_features': 0.34252776817033137, 'subsample': 0.34711174822987206, 'dropout_rate': 0.19471604502236203, 'ccp_alpha': 0.0011435503765654033}. Best is trial 664 with value: 0.8342316538423719.[0m
[32m[I 2022-04-22 01:57:29,947][0m Trial 769 finished with value: 0.8284685706227627 and parameters: {'loss': 'coxph', 'learning_rate': 0.005933245975203281, 'n_estimators': 999, 'criterion': 'friedman_mse', 'min_samples_split': 2, 'min_samples_leaf': 9, 'min_weight_fraction_leaf': 0.0310597044131496, 'min_impurity_decrease': 0.9819201782770508, 'max_features': 0.3202095666605464, 'subsample': 0.30742172173481935, 'dropout_rate': 0.21181710210667198, 'ccp_alpha': 0.09124875818477371}. Best is trial 664 with value: 0.8342316538423719.[0m
[32m[I 2022-04-22 02:01:26,183][0m Trial 770 finished with value: 0.4945873630238425 and parameters: {'loss': 'coxph', 'learning_rate': 0.009049573388784855, 'n_estimators': 835, 'criterion': 'friedman_mse', 'min_samples_split': 2, 'min_samples_leaf': 9, 'min_weight_fraction_leaf': 0.011670567699550605, 'min_impurity_decrease': 0.8729568286423559, 'max_features': 0.3641914867172935, 'subsample': 0.2949736186717298, 'dropout_rate': 0.17293670995392516, 'ccp_alpha': 0.24349297476842788}. Best is trial 664 with value: 0.8342316538423719.[0m
[32m[I 2022-04-22 02:04:17,857][0m Trial 771 finished with value: 0.25 and parameters: {'loss': 'coxph', 'learning_rate': 0.005988514814882719, 'n_estimators': 780, 'criterion': 'squared_error', 'min_samples_split': 2, 'min_samples_leaf': 9, 'min_weight_fraction_leaf': 0.018823660563241112, 'min_impurity_decrease': 0.8994007260869532, 'max_features': 0.3096902451934826, 'subsample': 0.34018668711247, 'dropout_rate': 0.233336095269858, 'ccp_alpha': 0.08987441342019127}. Best is trial 664 with value: 0.8342316538423719.[0m
[32m[I 2022-04-22 02:09:44,814][0m Trial 772 finished with value: 0.8296419260063146 and parameters: {'loss': 'coxph', 'learning_rate': 0.007247642413861623, 'n_estimators': 949, 'criterion': 'friedman_mse', 'min_samples_split': 2, 'min_samples_leaf': 9, 'min_weight_fraction_leaf': 0.03234030033444297, 'min_impurity_decrease': 0.9545849911767856, 'max_features': 0.33972718498062465, 'subsample': 0.27736606509879347, 'dropout_rate': 0.18710117002627796, 'ccp_alpha': 0.0016377846790182331}. Best is trial 664 with value: 0.8342316538423719.[0m
[32m[I 2022-04-22 02:14:10,654][0m Trial 773 finished with value: 0.7018173582528828 and parameters: {'loss': 'coxph', 'learning_rate': 0.005389542573777379, 'n_estimators': 897, 'criterion': 'friedman_mse', 'min_samples_split': 2, 'min_samples_leaf': 9, 'min_weight_fraction_leaf': 0.013017687262635781, 'min_impurity_decrease': 0.9999170061339233, 'max_features': 0.3244430948577129, 'subsample': 0.3096968379922822, 'dropout_rate': 0.22978622910535962, 'ccp_alpha': 0.17254427833733127}. Best is trial 664 with value: 0.8342316538423719.[0m
[32m[I 2022-04-22 02:18:02,021][0m Trial 774 finished with value: 0.2503270102305002 and parameters: {'loss': 'coxph', 'learning_rate': 0.007791179616899197, 'n_estimators': 824, 'criterion': 'friedman_mse', 'min_samples_split': 2, 'min_samples_leaf': 9, 'min_weight_fraction_leaf': 0.0272538390755259, 'min_impurity_decrease': 0.9305459102971729, 'max_features': 0.3058593945695665, 'subsample': 0.3478050357856324, 'dropout_rate': 0.2043017284204535, 'ccp_alpha': 0.34744431148546545}. Best is trial 664 with value: 0.8342316538423719.[0m
[32m[I 2022-04-22 02:22:41,528][0m Trial 775 finished with value: 0.8300618171776468 and parameters: {'loss': 'coxph', 'learning_rate': 0.009638626774041897, 'n_estimators': 864, 'criterion': 'friedman_mse', 'min_samples_split': 2, 'min_samples_leaf': 9, 'min_weight_fraction_leaf': 0.010327620656659726, 'min_impurity_decrease': 0.8352285283487164, 'max_features': 0.3783664154379599, 'subsample': 0.32561913254990504, 'dropout_rate': 0.15070581822104487, 'ccp_alpha': 0.0025870869514068185}. Best is trial 664 with value: 0.8342316538423719.[0m
[32m[I 2022-04-22 02:28:03,795][0m Trial 776 finished with value: 0.25 and parameters: {'loss': 'coxph', 'learning_rate': 0.005745633277491333, 'n_estimators': 956, 'criterion': 'absolute_error', 'min_samples_split': 2, 'min_samples_leaf': 9, 'min_weight_fraction_leaf': 0.019786202421034967, 'min_impurity_decrease': 0.9632357608327323, 'max_features': 0.3518064341691132, 'subsample': 0.3701141529579327, 'dropout_rate': 0.1212632034443009, 'ccp_alpha': 0.16285248278936795}. Best is trial 664 with value: 0.8342316538423719.[0m
[32m[I 2022-04-22 02:33:51,476][0m Trial 777 finished with value: 0.8293882039535829 and parameters: {'loss': 'coxph', 'learning_rate': 0.006684184210094725, 'n_estimators': 999, 'criterion': 'friedman_mse', 'min_samples_split': 2, 'min_samples_leaf': 7, 'min_weight_fraction_leaf': 0.008139411054385232, 'min_impurity_decrease': 0.9286764135329858, 'max_features': 0.2988837584438954, 'subsample': 0.2929941642130165, 'dropout_rate': 0.21105079751890926, 'ccp_alpha': 0.09098692200729272}. Best is trial 664 with value: 0.8342316538423719.[0m
[32m[I 2022-04-22 02:37:42,437][0m Trial 778 finished with value: 0.8013219635127422 and parameters: {'loss': 'coxph', 'learning_rate': 0.004951609673775341, 'n_estimators': 787, 'criterion': 'friedman_mse', 'min_samples_split': 2, 'min_samples_leaf': 9, 'min_weight_fraction_leaf': 0.304936763134383, 'min_impurity_decrease': 0.8928283772212047, 'max_features': 0.3280474944570859, 'subsample': 0.3332258899969534, 'dropout_rate': 0.17231624480298802, 'ccp_alpha': 0.09133387889909655}. Best is trial 664 with value: 0.8342316538423719.[0m
