[32m[I 2022-04-22 00:50:14,842][0m Trial 694 finished with value: 0.6759629738459128 and parameters: {'loss': 'coxph', 'learning_rate': 5.773371373452318e-05, 'n_estimators': 244, 'criterion': 'friedman_mse', 'min_samples_split': 5, 'min_samples_leaf': 9, 'min_weight_fraction_leaf': 0.21720740925919851, 'min_impurity_decrease': 0.0195623840677822, 'max_features': 0.7686206175673129, 'subsample': 0.22230512787530082, 'dropout_rate': 0.6795647594666305, 'ccp_alpha': 0.18505251303795}. Best is trial 187 with value: 0.6933481836305168.[0m
[32m[I 2022-04-22 00:50:24,541][0m Trial 695 finished with value: 0.6889575311221086 and parameters: {'loss': 'coxph', 'learning_rate': 0.00021022980388338183, 'n_estimators': 282, 'criterion': 'squared_error', 'min_samples_split': 7, 'min_samples_leaf': 9, 'min_weight_fraction_leaf': 0.20231760056811587, 'min_impurity_decrease': 0.06458627847776453, 'max_features': 0.7495947497470499, 'subsample': 0.2500484336268209, 'dropout_rate': 0.5669099863023079, 'ccp_alpha': 0.11638634692022407}. Best is trial 187 with value: 0.6933481836305168.[0m
[32m[I 2022-04-22 00:50:37,364][0m Trial 696 finished with value: 0.6874416016474514 and parameters: {'loss': 'coxph', 'learning_rate': 8.519751113857434e-05, 'n_estimators': 265, 'criterion': 'squared_error', 'min_samples_split': 7, 'min_samples_leaf': 9, 'min_weight_fraction_leaf': 0.17452829035625836, 'min_impurity_decrease': 0.035251974160862204, 'max_features': 0.7578086232845845, 'subsample': 0.19667487411816095, 'dropout_rate': 0.6022732588209732, 'ccp_alpha': 0.0031264827942700107}. Best is trial 187 with value: 0.6933481836305168.[0m
[32m[I 2022-04-22 00:50:45,992][0m Trial 697 finished with value: 0.6305188913409012 and parameters: {'loss': 'coxph', 'learning_rate': 2.1677485361641516e-05, 'n_estimators': 284, 'criterion': 'squared_error', 'min_samples_split': 7, 'min_samples_leaf': 8, 'min_weight_fraction_leaf': 0.18334296725454147, 'min_impurity_decrease': 0.05293403297373965, 'max_features': 0.6625607944774452, 'subsample': 0.26915682870660423, 'dropout_rate': 0.6132635323364695, 'ccp_alpha': 0.39792651226644216}. Best is trial 187 with value: 0.6933481836305168.[0m
[32m[I 2022-04-22 00:50:47,645][0m Trial 698 finished with value: 0.6649278943012369 and parameters: {'loss': 'coxph', 'learning_rate': 0.0001423663483336529, 'n_estimators': 120, 'criterion': 'squared_error', 'min_samples_split': 5, 'min_samples_leaf': 9, 'min_weight_fraction_leaf': 0.23521822737509163, 'min_impurity_decrease': 0.07846711311034718, 'max_features': 0.7434154702799839, 'subsample': 0.23031750257022432, 'dropout_rate': 0.6650994051343854, 'ccp_alpha': 0.23994799593560187}. Best is trial 187 with value: 0.6933481836305168.[0m
[32m[I 2022-04-22 00:51:03,416][0m Trial 699 finished with value: 0.6856237164282594 and parameters: {'loss': 'coxph', 'learning_rate': 4.77506299317126e-05, 'n_estimators': 292, 'criterion': 'squared_error', 'min_samples_split': 7, 'min_samples_leaf': 9, 'min_weight_fraction_leaf': 0.20864398196866243, 'min_impurity_decrease': 0.02039897075103813, 'max_features': 0.826091216952769, 'subsample': 0.17310694918856911, 'dropout_rate': 0.5709867270636158, 'ccp_alpha': 0.1013562658641304}. Best is trial 187 with value: 0.6933481836305168.[0m
[32m[I 2022-04-22 00:51:07,473][0m Trial 700 finished with value: 0.6768543440975572 and parameters: {'loss': 'coxph', 'learning_rate': 3.0109805299242596e-05, 'n_estimators': 141, 'criterion': 'squared_error', 'min_samples_split': 7, 'min_samples_leaf': 9, 'min_weight_fraction_leaf': 0.22561638066091055, 'min_impurity_decrease': 0.05369504744881066, 'max_features': 0.8020478536592065, 'subsample': 0.2646729015736443, 'dropout_rate': 0.6343279583630332, 'ccp_alpha': 0.15173415537214519}. Best is trial 187 with value: 0.6933481836305168.[0m
[32m[I 2022-04-22 00:51:17,539][0m Trial 701 finished with value: 0.6647221083144021 and parameters: {'loss': 'coxph', 'learning_rate': 0.00010544678564188825, 'n_estimators': 261, 'criterion': 'squared_error', 'min_samples_split': 7, 'min_samples_leaf': 9, 'min_weight_fraction_leaf': 0.19101608518770047, 'min_impurity_decrease': 0.019176671349609143, 'max_features': 0.8276455060605873, 'subsample': 0.23885173118185726, 'dropout_rate': 0.599810153187926, 'ccp_alpha': 0.28985153896345084}. Best is trial 187 with value: 0.6933481836305168.[0m
[32m[I 2022-04-22 00:51:39,253][0m Trial 702 finished with value: 0.6893302548327132 and parameters: {'loss': 'coxph', 'learning_rate': 6.289853285089349e-05, 'n_estimators': 422, 'criterion': 'squared_error', 'min_samples_split': 7, 'min_samples_leaf': 9, 'min_weight_fraction_leaf': 0.20124730558638695, 'min_impurity_decrease': 0.08881558070227402, 'max_features': 0.8090089794589937, 'subsample': 0.3992645702216384, 'dropout_rate': 0.6459239141358228, 'ccp_alpha': 0.09062124243016365}. Best is trial 187 with value: 0.6933481836305168.[0m
[32m[I 2022-04-22 00:52:04,916][0m Trial 703 finished with value: 0.6846860545865473 and parameters: {'loss': 'coxph', 'learning_rate': 4.215367491815193e-05, 'n_estimators': 443, 'criterion': 'squared_error', 'min_samples_split': 8, 'min_samples_leaf': 9, 'min_weight_fraction_leaf': 0.17760567636567565, 'min_impurity_decrease': 0.08038217014573808, 'max_features': 0.860356957255382, 'subsample': 0.3870248936212747, 'dropout_rate': 0.6691904895940329, 'ccp_alpha': 0.17762066270636628}. Best is trial 187 with value: 0.6933481836305168.[0m
/media/san2_ssd/data/Workdir/survival/venv/lib/python3.8/site-packages/sksurv/ensemble/boosting.py:955: RuntimeWarning: divide by zero encountered in log
  time = numpy.log(time)
/media/san2_ssd/data/Workdir/survival/venv/lib/python3.8/site-packages/sksurv/ensemble/boosting.py:955: RuntimeWarning: divide by zero encountered in log
  time = numpy.log(time)
/media/san2_ssd/data/Workdir/survival/venv/lib/python3.8/site-packages/sksurv/ensemble/boosting.py:955: RuntimeWarning: divide by zero encountered in log
  time = numpy.log(time)
/media/san2_ssd/data/Workdir/survival/venv/lib/python3.8/site-packages/sksurv/ensemble/boosting.py:955: RuntimeWarning: divide by zero encountered in log
  time = numpy.log(time)
[32m[I 2022-04-22 00:52:08,978][0m Trial 704 finished with value: -0.7317286726923086 and parameters: {'loss': 'squared', 'learning_rate': 6.144020224677598e-05, 'n_estimators': 441, 'criterion': 'absolute_error', 'min_samples_split': 7, 'min_samples_leaf': 9, 'min_weight_fraction_leaf': 0.193793179022238, 'min_impurity_decrease': 0.1012002154219167, 'max_features': 0.838541779434185, 'subsample': 0.2790790933476596, 'dropout_rate': 0.657427170153283, 'ccp_alpha': 0.07296032506433175}. Best is trial 187 with value: 0.6933481836305168.[0m
[32m[I 2022-04-22 00:52:36,855][0m Trial 705 finished with value: 0.5 and parameters: {'loss': 'coxph', 'learning_rate': 4.9518742251810595e-05, 'n_estimators': 458, 'criterion': 'squared_error', 'min_samples_split': 7, 'min_samples_leaf': 9, 'min_weight_fraction_leaf': 0.16767122388697583, 'min_impurity_decrease': 0.09540844699706105, 'max_features': 0.7869347914356433, 'subsample': 0.424116456909317, 'dropout_rate': 0.6509614203371399, 'ccp_alpha': 2.995709233138633}. Best is trial 187 with value: 0.6933481836305168.[0m
[32m[I 2022-04-22 00:53:03,855][0m Trial 706 finished with value: 0.6652175387040767 and parameters: {'loss': 'coxph', 'learning_rate': 3.450888556297139e-05, 'n_estimators': 428, 'criterion': 'squared_error', 'min_samples_split': 7, 'min_samples_leaf': 9, 'min_weight_fraction_leaf': 0.18630840527242032, 'min_impurity_decrease': 0.08355048671050558, 'max_features': 0.8468134770431919, 'subsample': 0.4067706848641306, 'dropout_rate': 0.6867092008134896, 'ccp_alpha': 0.25198479694301434}. Best is trial 187 with value: 0.6933481836305168.[0m
[32m[I 2022-04-22 00:53:23,263][0m Trial 707 finished with value: 0.5 and parameters: {'loss': 'coxph', 'learning_rate': 6.715435484278364e-05, 'n_estimators': 413, 'criterion': 'friedman_mse', 'min_samples_split': 7, 'min_samples_leaf': 9, 'min_weight_fraction_leaf': 0.20400426413151013, 'min_impurity_decrease': 0.2615458071980644, 'max_features': 0.5207865774002137, 'subsample': 0.25479600511271444, 'dropout_rate': 0.645956944820548, 'ccp_alpha': 1.6646126572304294}. Best is trial 187 with value: 0.6933481836305168.[0m
[32m[I 2022-04-22 00:53:41,936][0m Trial 708 finished with value: 0.5 and parameters: {'loss': 'coxph', 'learning_rate': 5.456915332320757e-05, 'n_estimators': 402, 'criterion': 'squared_error', 'min_samples_split': 7, 'min_samples_leaf': 9, 'min_weight_fraction_leaf': 0.19834996656506373, 'min_impurity_decrease': 0.07055931604399447, 'max_features': 0.798904151170629, 'subsample': 0.49935793634602094, 'dropout_rate': 0.6384327006195154, 'ccp_alpha': 0.5218230413486166}. Best is trial 187 with value: 0.6933481836305168.[0m
[32m[I 2022-04-22 00:54:08,194][0m Trial 709 finished with value: 0.6867730172762803 and parameters: {'loss': 'coxph', 'learning_rate': 3.9614055413789006e-05, 'n_estimators': 439, 'criterion': 'squared_error', 'min_samples_split': 7, 'min_samples_leaf': 9, 'min_weight_fraction_leaf': 0.24670989533826665, 'min_impurity_decrease': 0.08724982690027903, 'max_features': 0.8262631793848194, 'subsample': 0.2933341104403219, 'dropout_rate': 0.6261352135311901, 'ccp_alpha': 0.0010452202680528572}. Best is trial 187 with value: 0.6933481836305168.[0m
[32m[I 2022-04-22 00:54:35,095][0m Trial 710 finished with value: 0.6763264809107504 and parameters: {'loss': 'coxph', 'learning_rate': 7.95492862296539e-05, 'n_estimators': 420, 'criterion': 'squared_error', 'min_samples_split': 8, 'min_samples_leaf': 9, 'min_weight_fraction_leaf': 0.1851597111601544, 'min_impurity_decrease': 0.0960286685990711, 'max_features': 0.8101960678526835, 'subsample': 0.26737454590980686, 'dropout_rate': 0.6098161647360515, 'ccp_alpha': 0.16544797841618225}. Best is trial 187 with value: 0.6933481836305168.[0m
[32m[I 2022-04-22 00:54:41,783][0m Trial 711 finished with value: 0.5933055595250503 and parameters: {'loss': 'coxph', 'learning_rate': 2.8825260414884165e-05, 'n_estimators': 275, 'criterion': 'squared_error', 'min_samples_split': 6, 'min_samples_leaf': 8, 'min_weight_fraction_leaf': 0.1568481123099293, 'min_impurity_decrease': 0.06518238632221666, 'max_features': 0.8511260743424902, 'subsample': 0.46599902929254533, 'dropout_rate': 0.689871388360491, 'ccp_alpha': 0.35579548588096765}. Best is trial 187 with value: 0.6933481836305168.[0m
[32m[I 2022-04-22 00:55:08,220][0m Trial 712 finished with value: 0.6839865926876627 and parameters: {'loss': 'coxph', 'learning_rate': 0.04670394446213446, 'n_estimators': 468, 'criterion': 'squared_error', 'min_samples_split': 7, 'min_samples_leaf': 9, 'min_weight_fraction_leaf': 0.22024546963819114, 'min_impurity_decrease': 0.05731484580282838, 'max_features': 0.7791373791138761, 'subsample': 0.3663289433472475, 'dropout_rate': 0.6246564611712027, 'ccp_alpha': 0.0847956783695141}. Best is trial 187 with value: 0.6933481836305168.[0m
[32m[I 2022-04-22 00:55:13,951][0m Trial 713 finished with value: 0.6762726908154166 and parameters: {'loss': 'coxph', 'learning_rate': 5.5879260105852504e-05, 'n_estimators': 237, 'criterion': 'squared_error', 'min_samples_split': 7, 'min_samples_leaf': 9, 'min_weight_fraction_leaf': 0.200197490763026, 'min_impurity_decrease': 0.10071455582424364, 'max_features': 0.8338652545510445, 'subsample': 0.21560445753125926, 'dropout_rate': 0.5880562650440168, 'ccp_alpha': 0.21131804249043123}. Best is trial 187 with value: 0.6933481836305168.[0m
[32m[I 2022-04-22 00:55:25,351][0m Trial 714 finished with value: 0.6837601927479514 and parameters: {'loss': 'coxph', 'learning_rate': 6.797998157215959e-05, 'n_estimators': 295, 'criterion': 'squared_error', 'min_samples_split': 9, 'min_samples_leaf': 8, 'min_weight_fraction_leaf': 0.17765501324103894, 'min_impurity_decrease': 0.07365515252644032, 'max_features': 0.7457180855893383, 'subsample': 0.297687142827764, 'dropout_rate': 0.6448722456766659, 'ccp_alpha': 0.08705060155626797}. Best is trial 187 with value: 0.6933481836305168.[0m
[32m[I 2022-04-22 00:55:38,299][0m Trial 715 finished with value: 0.666091769413209 and parameters: {'loss': 'coxph', 'learning_rate': 3.963847123995547e-05, 'n_estimators': 251, 'criterion': 'absolute_error', 'min_samples_split': 7, 'min_samples_leaf': 9, 'min_weight_fraction_leaf': 0.208541964456394, 'min_impurity_decrease': 0.05022318485197607, 'max_features': 0.877328442538519, 'subsample': 0.2785402122533505, 'dropout_rate': 0.46824425633624994, 'ccp_alpha': 0.16657367173516444}. Best is trial 187 with value: 0.6933481836305168.[0m
[32m[I 2022-04-22 00:55:59,090][0m Trial 716 finished with value: 0.6868359927249265 and parameters: {'loss': 'coxph', 'learning_rate': 4.504065002232191e-05, 'n_estimators': 417, 'criterion': 'squared_error', 'min_samples_split': 7, 'min_samples_leaf': 7, 'min_weight_fraction_leaf': 0.2605383176583196, 'min_impurity_decrease': 0.04089740155561689, 'max_features': 0.8618411012940109, 'subsample': 0.24042167935407963, 'dropout_rate': 0.6223851681468952, 'ccp_alpha': 0.00778547253735212}. Best is trial 187 with value: 0.6933481836305168.[0m
[32m[I 2022-04-22 00:56:09,080][0m Trial 717 finished with value: 0.6652535759877798 and parameters: {'loss': 'coxph', 'learning_rate': 0.0002074211938662298, 'n_estimators': 287, 'criterion': 'squared_error', 'min_samples_split': 7, 'min_samples_leaf': 9, 'min_weight_fraction_leaf': 0.168751612440423, 'min_impurity_decrease': 0.06750859093822831, 'max_features': 0.6841540972926078, 'subsample': 0.26076282692776814, 'dropout_rate': 0.672592498579052, 'ccp_alpha': 0.30069975651145797}. Best is trial 187 with value: 0.6933481836305168.[0m
[32m[I 2022-04-22 00:56:20,854][0m Trial 718 finished with value: 0.5 and parameters: {'loss': 'coxph', 'learning_rate': 7.955298149749931e-05, 'n_estimators': 300, 'criterion': 'squared_error', 'min_samples_split': 7, 'min_samples_leaf': 9, 'min_weight_fraction_leaf': 0.19376945606772714, 'min_impurity_decrease': 0.6267498817504984, 'max_features': 0.808150086166132, 'subsample': 0.4353519663272602, 'dropout_rate': 0.5940394017394752, 'ccp_alpha': 0.003804972521223901}. Best is trial 187 with value: 0.6933481836305168.[0m
[32m[I 2022-04-22 00:56:27,627][0m Trial 719 finished with value: 0.6778863859301575 and parameters: {'loss': 'coxph', 'learning_rate': 5.1594630549036014e-05, 'n_estimators': 262, 'criterion': 'friedman_mse', 'min_samples_split': 6, 'min_samples_leaf': 9, 'min_weight_fraction_leaf': 0.13630409555941658, 'min_impurity_decrease': 0.09247981070670891, 'max_features': 0.3437054229596177, 'subsample': 0.31112453347311875, 'dropout_rate': 0.6088724339281164, 'ccp_alpha': 0.15857708031867146}. Best is trial 187 with value: 0.6933481836305168.[0m
[32m[I 2022-04-22 00:56:45,372][0m Trial 720 finished with value: 0.5885897812904826 and parameters: {'loss': 'coxph', 'learning_rate': 6.508306863349351e-05, 'n_estimators': 275, 'criterion': 'squared_error', 'min_samples_split': 7, 'min_samples_leaf': 9, 'min_weight_fraction_leaf': 0.21624334976975926, 'min_impurity_decrease': 0.041905359766252676, 'max_features': 0.2977878043949468, 'subsample': 0.2880528904201745, 'dropout_rate': 0.6540512164067107, 'ccp_alpha': 0.442888276326988}. Best is trial 187 with value: 0.6933481836305168.[0m
/media/san2_ssd/data/Workdir/survival/venv/lib/python3.8/site-packages/sksurv/ensemble/boosting.py:955: RuntimeWarning: divide by zero encountered in log
  time = numpy.log(time)
/media/san2_ssd/data/Workdir/survival/venv/lib/python3.8/site-packages/sksurv/ensemble/boosting.py:955: RuntimeWarning: divide by zero encountered in log
  time = numpy.log(time)
/media/san2_ssd/data/Workdir/survival/venv/lib/python3.8/site-packages/sksurv/ensemble/boosting.py:955: RuntimeWarning: divide by zero encountered in log
  time = numpy.log(time)
/media/san2_ssd/data/Workdir/survival/venv/lib/python3.8/site-packages/sksurv/ensemble/boosting.py:955: RuntimeWarning: divide by zero encountered in log
  time = numpy.log(time)
[32m[I 2022-04-22 00:56:55,434][0m Trial 721 finished with value: -0.7297033464820903 and parameters: {'loss': 'squared', 'learning_rate': 3.391464599747323e-05, 'n_estimators': 593, 'criterion': 'squared_error', 'min_samples_split': 7, 'min_samples_leaf': 9, 'min_weight_fraction_leaf': 0.23230365156205185, 'min_impurity_decrease': 0.06836484296216365, 'max_features': 0.8298966981354217, 'subsample': 0.3477196437216666, 'dropout_rate': 0.6238621376717054, 'ccp_alpha': 0.2361234172544308}. Best is trial 187 with value: 0.6933481836305168.[0m
[32m[I 2022-04-22 00:57:05,312][0m Trial 722 finished with value: 0.6792027375957114 and parameters: {'loss': 'coxph', 'learning_rate': 0.00017355783687053917, 'n_estimators': 304, 'criterion': 'squared_error', 'min_samples_split': 7, 'min_samples_leaf': 9, 'min_weight_fraction_leaf': 0.1837991184316267, 'min_impurity_decrease': 0.05030456674941364, 'max_features': 0.38109492756826885, 'subsample': 0.39415109671651694, 'dropout_rate': 0.5742287964219059, 'ccp_alpha': 0.08804229666505559}. Best is trial 187 with value: 0.6933481836305168.[0m
[32m[I 2022-04-22 00:57:33,186][0m Trial 723 finished with value: 0.6888178699010089 and parameters: {'loss': 'coxph', 'learning_rate': 2.226949474120336e-05, 'n_estimators': 395, 'criterion': 'squared_error', 'min_samples_split': 7, 'min_samples_leaf': 9, 'min_weight_fraction_leaf': 0.20197543098215606, 'min_impurity_decrease': 0.03402634494393368, 'max_features': 0.7096411582002702, 'subsample': 0.24733404350111737, 'dropout_rate': 0.5408751324376503, 'ccp_alpha': 0.0011267096018611616}. Best is trial 187 with value: 0.6933481836305168.[0m
[32m[I 2022-04-22 00:57:50,144][0m Trial 724 finished with value: 0.6816740324363769 and parameters: {'loss': 'coxph', 'learning_rate': 4.7175441164966586e-05, 'n_estimators': 425, 'criterion': 'squared_error', 'min_samples_split': 7, 'min_samples_leaf': 9, 'min_weight_fraction_leaf': 0.22200590031574133, 'min_impurity_decrease': 0.07981891699834627, 'max_features': 0.9847978018200904, 'subsample': 0.3257832499469592, 'dropout_rate': 0.7042181799716015, 'ccp_alpha': 0.1524701802650337}. Best is trial 187 with value: 0.6933481836305168.[0m
[32m[I 2022-04-22 00:58:09,020][0m Trial 725 finished with value: 0.6387214481334189 and parameters: {'loss': 'coxph', 'learning_rate': 8.72022279488164e-05, 'n_estimators': 312, 'criterion': 'squared_error', 'min_samples_split': 7, 'min_samples_leaf': 9, 'min_weight_fraction_leaf': 0.24147935962289221, 'min_impurity_decrease': 0.3511077903941616, 'max_features': 0.8457450949937454, 'subsample': 0.3023768118927515, 'dropout_rate': 0.1530111750752047, 'ccp_alpha': 0.304150533160809}. Best is trial 187 with value: 0.6933481836305168.[0m
[32m[I 2022-04-22 00:58:18,939][0m Trial 726 finished with value: 0.6817793650445781 and parameters: {'loss': 'coxph', 'learning_rate': 5.913603492290081e-05, 'n_estimators': 286, 'criterion': 'squared_error', 'min_samples_split': 7, 'min_samples_leaf': 8, 'min_weight_fraction_leaf': 0.1907316891322946, 'min_impurity_decrease': 0.10962582934053443, 'max_features': 0.999661979870996, 'subsample': 0.19857335350551858, 'dropout_rate': 0.5795478423611844, 'ccp_alpha': 0.10590868015142893}. Best is trial 187 with value: 0.6933481836305168.[0m
[32m[I 2022-04-22 00:58:36,304][0m Trial 727 finished with value: 0.6690791727599606 and parameters: {'loss': 'coxph', 'learning_rate': 7.32690626344014e-05, 'n_estimators': 273, 'criterion': 'squared_error', 'min_samples_split': 7, 'min_samples_leaf': 9, 'min_weight_fraction_leaf': 0.17377488196298396, 'min_impurity_decrease': 0.05980930672345139, 'max_features': 0.7668306112330706, 'subsample': 0.27423784041351, 'dropout_rate': 0.12567639021553886, 'ccp_alpha': 0.22867103998255323}. Best is trial 187 with value: 0.6933481836305168.[0m
[32m[I 2022-04-22 00:58:38,861][0m Trial 728 finished with value: 0.6574029752897521 and parameters: {'loss': 'coxph', 'learning_rate': 0.00011898667938534617, 'n_estimators': 110, 'criterion': 'absolute_error', 'min_samples_split': 7, 'min_samples_leaf': 9, 'min_weight_fraction_leaf': 0.39228719741875107, 'min_impurity_decrease': 0.03779989755531332, 'max_features': 0.8695116109545258, 'subsample': 0.22381512576350115, 'dropout_rate': 0.6029568281593354, 'ccp_alpha': 0.1190401310141264}. Best is trial 187 with value: 0.6933481836305168.[0m
[32m[I 2022-04-22 00:59:02,137][0m Trial 729 finished with value: 0.5827751132342576 and parameters: {'loss': 'coxph', 'learning_rate': 2.9380768777987288e-05, 'n_estimators': 294, 'criterion': 'squared_error', 'min_samples_split': 8, 'min_samples_leaf': 9, 'min_weight_fraction_leaf': 0.21192457984723456, 'min_impurity_decrease': 0.09370146750290656, 'max_features': 0.002571476864771105, 'subsample': 0.36413214665262006, 'dropout_rate': 0.1082774814200189, 'ccp_alpha': 0.3802135338495546}. Best is trial 187 with value: 0.6933481836305168.[0m
[32m[I 2022-04-22 00:59:08,288][0m Trial 730 finished with value: 0.6870845093923378 and parameters: {'loss': 'coxph', 'learning_rate': 0.0001526993821477769, 'n_estimators': 254, 'criterion': 'squared_error', 'min_samples_split': 7, 'min_samples_leaf': 10, 'min_weight_fraction_leaf': 0.19783640741399927, 'min_impurity_decrease': 0.07007746167570204, 'max_features': 0.4119412969206975, 'subsample': 0.2901107846037202, 'dropout_rate': 0.645705031882712, 'ccp_alpha': 0.07554688787076846}. Best is trial 187 with value: 0.6933481836305168.[0m
