[32m[I 2022-04-23 04:59:19,998][0m Trial 743 finished with value: 0.656482330387292 and parameters: {'loss': 'coxph', 'learning_rate': 0.040020019574776175, 'n_estimators': 586, 'criterion': 'friedman_mse', 'min_samples_split': 9, 'min_samples_leaf': 4, 'min_weight_fraction_leaf': 0.04973552423601452, 'min_impurity_decrease': 0.4241364575669288, 'max_features': 0.5299510065535017, 'subsample': 0.3034989597999388, 'dropout_rate': 0.2015815272823468, 'ccp_alpha': 0.08308777248009715}. Best is trial 690 with value: 0.6691837560454439.[0m
[32m[I 2022-04-23 05:00:48,166][0m Trial 744 finished with value: 0.6617924336926098 and parameters: {'loss': 'coxph', 'learning_rate': 0.05330912578336278, 'n_estimators': 564, 'criterion': 'friedman_mse', 'min_samples_split': 9, 'min_samples_leaf': 4, 'min_weight_fraction_leaf': 0.038827324610888565, 'min_impurity_decrease': 0.44911089219590006, 'max_features': 0.5597196882355293, 'subsample': 0.28618209186796545, 'dropout_rate': 0.13858395190815792, 'ccp_alpha': 0.0036899030766525905}. Best is trial 690 with value: 0.6691837560454439.[0m
[32m[I 2022-04-23 05:02:16,008][0m Trial 745 finished with value: 0.6059129380193475 and parameters: {'loss': 'coxph', 'learning_rate': 0.03625136784609661, 'n_estimators': 594, 'criterion': 'friedman_mse', 'min_samples_split': 9, 'min_samples_leaf': 4, 'min_weight_fraction_leaf': 0.051071834113659884, 'min_impurity_decrease': 0.4907998769281404, 'max_features': 0.571765372331026, 'subsample': 0.32730533716633325, 'dropout_rate': 0.18062923679669596, 'ccp_alpha': 0.16926405854494012}. Best is trial 690 with value: 0.6691837560454439.[0m
[32m[I 2022-04-23 05:03:54,022][0m Trial 746 finished with value: 0.5 and parameters: {'loss': 'coxph', 'learning_rate': 0.06251505111134616, 'n_estimators': 655, 'criterion': 'friedman_mse', 'min_samples_split': 9, 'min_samples_leaf': 9, 'min_weight_fraction_leaf': 0.034854143408807894, 'min_impurity_decrease': 0.4616731974460906, 'max_features': 0.5450062470840406, 'subsample': 0.2769646197989022, 'dropout_rate': 0.21535558243198644, 'ccp_alpha': 1.6279163763597155}. Best is trial 690 with value: 0.6691837560454439.[0m
[32m[I 2022-04-23 05:05:28,014][0m Trial 747 finished with value: 0.5 and parameters: {'loss': 'coxph', 'learning_rate': 0.08084453138059614, 'n_estimators': 622, 'criterion': 'friedman_mse', 'min_samples_split': 9, 'min_samples_leaf': 4, 'min_weight_fraction_leaf': 0.39666298859364685, 'min_impurity_decrease': 0.44899200027511726, 'max_features': 0.5772558352877094, 'subsample': 0.24883247223392493, 'dropout_rate': 0.15519333868398671, 'ccp_alpha': 1.4250302474739696}. Best is trial 690 with value: 0.6691837560454439.[0m
/media/san2_ssd/data/Workdir/survival/venv/lib/python3.8/site-packages/sksurv/ensemble/boosting.py:955: RuntimeWarning: divide by zero encountered in log
  time = numpy.log(time)
/media/san2_ssd/data/Workdir/survival/venv/lib/python3.8/site-packages/sksurv/ensemble/boosting.py:955: RuntimeWarning: divide by zero encountered in log
  time = numpy.log(time)
/media/san2_ssd/data/Workdir/survival/venv/lib/python3.8/site-packages/sksurv/ensemble/boosting.py:955: RuntimeWarning: divide by zero encountered in log
  time = numpy.log(time)
/media/san2_ssd/data/Workdir/survival/venv/lib/python3.8/site-packages/sksurv/ensemble/boosting.py:955: RuntimeWarning: divide by zero encountered in log
  time = numpy.log(time)
[32m[I 2022-04-23 05:05:45,260][0m Trial 748 finished with value: -0.7374803744371843 and parameters: {'loss': 'squared', 'learning_rate': 0.051063083817839035, 'n_estimators': 598, 'criterion': 'friedman_mse', 'min_samples_split': 8, 'min_samples_leaf': 4, 'min_weight_fraction_leaf': 0.04534490368160325, 'min_impurity_decrease': 0.48076063947351244, 'max_features': 0.531303824725579, 'subsample': 0.30924971680542573, 'dropout_rate': 0.19850304766891255, 'ccp_alpha': 0.0902449175005426}. Best is trial 690 with value: 0.6691837560454439.[0m
[32m[I 2022-04-23 05:07:43,208][0m Trial 749 finished with value: 0.5 and parameters: {'loss': 'coxph', 'learning_rate': 0.08322027281983337, 'n_estimators': 683, 'criterion': 'friedman_mse', 'min_samples_split': 9, 'min_samples_leaf': 4, 'min_weight_fraction_leaf': 0.018695134382194965, 'min_impurity_decrease': 0.45863468568823945, 'max_features': 0.18678157803753892, 'subsample': 0.21044741162627767, 'dropout_rate': 0.1795752308367649, 'ccp_alpha': 1.1827513574965232}. Best is trial 690 with value: 0.6691837560454439.[0m
[32m[I 2022-04-23 05:09:00,416][0m Trial 750 finished with value: 0.5 and parameters: {'loss': 'coxph', 'learning_rate': 0.06637279653490799, 'n_estimators': 558, 'criterion': 'squared_error', 'min_samples_split': 9, 'min_samples_leaf': 5, 'min_weight_fraction_leaf': 0.02819847425785464, 'min_impurity_decrease': 0.42758444378851984, 'max_features': 0.5544344205317422, 'subsample': 0.29229652934814887, 'dropout_rate': 0.1667746282590447, 'ccp_alpha': 0.0031290595786345674}. Best is trial 690 with value: 0.6691837560454439.[0m
[32m[I 2022-04-23 05:10:37,500][0m Trial 751 finished with value: 0.6594390267307294 and parameters: {'loss': 'coxph', 'learning_rate': 0.049222848797587315, 'n_estimators': 621, 'criterion': 'friedman_mse', 'min_samples_split': 9, 'min_samples_leaf': 4, 'min_weight_fraction_leaf': 0.008479710944470989, 'min_impurity_decrease': 0.35684228675962076, 'max_features': 0.5819982105611654, 'subsample': 0.25941500594620537, 'dropout_rate': 0.21775359047615012, 'ccp_alpha': 0.001208872607346988}. Best is trial 690 with value: 0.6691837560454439.[0m
[32m[I 2022-04-23 05:12:25,088][0m Trial 752 finished with value: 0.5761662865421536 and parameters: {'loss': 'coxph', 'learning_rate': 0.09923052238207729, 'n_estimators': 660, 'criterion': 'friedman_mse', 'min_samples_split': 9, 'min_samples_leaf': 4, 'min_weight_fraction_leaf': 0.047546020606464234, 'min_impurity_decrease': 0.5075839414585606, 'max_features': 0.594425128517837, 'subsample': 0.22712036089380014, 'dropout_rate': 0.20255184862161635, 'ccp_alpha': 0.2707114075096954}. Best is trial 690 with value: 0.6691837560454439.[0m
[32m[I 2022-04-23 05:13:46,017][0m Trial 753 finished with value: 0.6146672026566138 and parameters: {'loss': 'coxph', 'learning_rate': 0.03515121647745252, 'n_estimators': 564, 'criterion': 'friedman_mse', 'min_samples_split': 9, 'min_samples_leaf': 4, 'min_weight_fraction_leaf': 0.0403689183111752, 'min_impurity_decrease': 0.4358821419256924, 'max_features': 0.511104806908244, 'subsample': 0.33847318671926885, 'dropout_rate': 0.12390040609461045, 'ccp_alpha': 0.18231341633488524}. Best is trial 690 with value: 0.6691837560454439.[0m
[32m[I 2022-04-23 05:16:07,989][0m Trial 754 finished with value: 0.6394218691624538 and parameters: {'loss': 'coxph', 'learning_rate': 0.06387203113692806, 'n_estimators': 754, 'criterion': 'friedman_mse', 'min_samples_split': 9, 'min_samples_leaf': 4, 'min_weight_fraction_leaf': 0.05672315819090769, 'min_impurity_decrease': 0.40393421020104725, 'max_features': 0.6135334226153605, 'subsample': 0.26980912087367753, 'dropout_rate': 0.15399794482550874, 'ccp_alpha': 0.15351463191471623}. Best is trial 690 with value: 0.6691837560454439.[0m
[32m[I 2022-04-23 05:18:19,741][0m Trial 755 finished with value: 0.6394158303539681 and parameters: {'loss': 'coxph', 'learning_rate': 0.08157042870443619, 'n_estimators': 707, 'criterion': 'friedman_mse', 'min_samples_split': 9, 'min_samples_leaf': 4, 'min_weight_fraction_leaf': 0.0019971747811404336, 'min_impurity_decrease': 0.32457198314788144, 'max_features': 0.5645532245967955, 'subsample': 0.3185333958023636, 'dropout_rate': 0.09932236540871264, 'ccp_alpha': 0.12274140099558532}. Best is trial 690 with value: 0.6691837560454439.[0m
[32m[I 2022-04-23 05:19:40,603][0m Trial 756 finished with value: 0.5372437760686757 and parameters: {'loss': 'coxph', 'learning_rate': 0.0531116015615928, 'n_estimators': 595, 'criterion': 'friedman_mse', 'min_samples_split': 9, 'min_samples_leaf': 4, 'min_weight_fraction_leaf': 0.021701410574987257, 'min_impurity_decrease': 0.4749175623503751, 'max_features': 0.5954879932654686, 'subsample': 0.2949968100954348, 'dropout_rate': 0.22243527946114972, 'ccp_alpha': 0.2824428613924532}. Best is trial 690 with value: 0.6691837560454439.[0m
[32m[I 2022-04-23 05:21:22,094][0m Trial 757 finished with value: 0.650721267186694 and parameters: {'loss': 'coxph', 'learning_rate': 0.06762841138825147, 'n_estimators': 636, 'criterion': 'friedman_mse', 'min_samples_split': 9, 'min_samples_leaf': 4, 'min_weight_fraction_leaf': 0.05646442740362397, 'min_impurity_decrease': 0.4653112018635857, 'max_features': 0.3058083438677643, 'subsample': 0.24843061460938876, 'dropout_rate': 0.18675281155650758, 'ccp_alpha': 0.0891084634716721}. Best is trial 690 with value: 0.6691837560454439.[0m
[32m[I 2022-04-23 05:22:57,007][0m Trial 758 finished with value: 0.5 and parameters: {'loss': 'coxph', 'learning_rate': 0.09917010536212774, 'n_estimators': 601, 'criterion': 'friedman_mse', 'min_samples_split': 9, 'min_samples_leaf': 4, 'min_weight_fraction_leaf': 0.030076378154665694, 'min_impurity_decrease': 0.5065506337305861, 'max_features': 0.5268923533204192, 'subsample': 0.28114143776794914, 'dropout_rate': 0.14226823654930446, 'ccp_alpha': 0.838389766009676}. Best is trial 690 with value: 0.6691837560454439.[0m
[32m[I 2022-04-23 05:23:04,662][0m Trial 759 finished with value: 0.6529687382723974 and parameters: {'loss': 'coxph', 'learning_rate': 0.04231102380120511, 'n_estimators': 157, 'criterion': 'friedman_mse', 'min_samples_split': 9, 'min_samples_leaf': 4, 'min_weight_fraction_leaf': 0.0169661600418863, 'min_impurity_decrease': 0.5478477907209001, 'max_features': 0.5545917169649008, 'subsample': 0.179063260913502, 'dropout_rate': 0.1702646358086083, 'ccp_alpha': 0.0036554008908468846}. Best is trial 690 with value: 0.6691837560454439.[0m
[32m[I 2022-04-23 05:24:29,167][0m Trial 760 finished with value: 0.6640653022837768 and parameters: {'loss': 'coxph', 'learning_rate': 0.05718721414252706, 'n_estimators': 565, 'criterion': 'friedman_mse', 'min_samples_split': 9, 'min_samples_leaf': 5, 'min_weight_fraction_leaf': 0.03837947212412922, 'min_impurity_decrease': 0.47313128705993374, 'max_features': 0.604539848952038, 'subsample': 0.26021159533020227, 'dropout_rate': 0.20593833893866081, 'ccp_alpha': 0.0010121243493477236}. Best is trial 690 with value: 0.6691837560454439.[0m
[32m[I 2022-04-23 05:25:42,787][0m Trial 761 finished with value: 0.6580013736090581 and parameters: {'loss': 'coxph', 'learning_rate': 1.0037369079648768e-06, 'n_estimators': 558, 'criterion': 'friedman_mse', 'min_samples_split': 9, 'min_samples_leaf': 5, 'min_weight_fraction_leaf': 0.045876878933311556, 'min_impurity_decrease': 0.43298277226602233, 'max_features': 0.5761320471876872, 'subsample': 0.2256716465735768, 'dropout_rate': 0.21970464158261052, 'ccp_alpha': 0.1819169062839011}. Best is trial 690 with value: 0.6691837560454439.[0m
[32m[I 2022-04-23 05:26:59,158][0m Trial 762 finished with value: 0.6595573851048663 and parameters: {'loss': 'coxph', 'learning_rate': 0.07900531016911908, 'n_estimators': 550, 'criterion': 'friedman_mse', 'min_samples_split': 9, 'min_samples_leaf': 5, 'min_weight_fraction_leaf': 0.036657001931990486, 'min_impurity_decrease': 0.40893870132060445, 'max_features': 0.5900383547009603, 'subsample': 0.3046904660833777, 'dropout_rate': 0.19877736289688103, 'ccp_alpha': 0.08356404311070528}. Best is trial 690 with value: 0.6691837560454439.[0m
[32m[I 2022-04-23 05:28:18,646][0m Trial 763 finished with value: 0.5 and parameters: {'loss': 'coxph', 'learning_rate': 0.05991032160996818, 'n_estimators': 555, 'criterion': 'absolute_error', 'min_samples_split': 8, 'min_samples_leaf': 5, 'min_weight_fraction_leaf': 0.0567349107901224, 'min_impurity_decrease': 0.44358823691144994, 'max_features': 0.6050180004161451, 'subsample': 0.6061498995182195, 'dropout_rate': 0.22630146973482426, 'ccp_alpha': 0.24380613868656242}. Best is trial 690 with value: 0.6691837560454439.[0m
[32m[I 2022-04-23 05:30:07,045][0m Trial 764 finished with value: 0.6606340072840868 and parameters: {'loss': 'coxph', 'learning_rate': 0.0720432139076085, 'n_estimators': 655, 'criterion': 'friedman_mse', 'min_samples_split': 9, 'min_samples_leaf': 5, 'min_weight_fraction_leaf': 0.048089877980273824, 'min_impurity_decrease': 0.4801596859547973, 'max_features': 0.5461273200774358, 'subsample': 0.1999930132678291, 'dropout_rate': 0.2114022253164735, 'ccp_alpha': 0.0016443891063150258}. Best is trial 690 with value: 0.6691837560454439.[0m
[32m[I 2022-04-23 05:31:00,980][0m Trial 765 finished with value: 0.5 and parameters: {'loss': 'coxph', 'learning_rate': 0.056490502143201386, 'n_estimators': 573, 'criterion': 'friedman_mse', 'min_samples_split': 9, 'min_samples_leaf': 5, 'min_weight_fraction_leaf': 0.05411335527320008, 'min_impurity_decrease': 0.46530304411573337, 'max_features': 0.0563799452940673, 'subsample': 0.23925609967606382, 'dropout_rate': 0.5038237144386508, 'ccp_alpha': 0.3947040486706088}. Best is trial 690 with value: 0.6691837560454439.[0m
[32m[I 2022-04-23 05:32:31,219][0m Trial 766 finished with value: 0.5 and parameters: {'loss': 'coxph', 'learning_rate': 0.09929460866604667, 'n_estimators': 629, 'criterion': 'friedman_mse', 'min_samples_split': 9, 'min_samples_leaf': 5, 'min_weight_fraction_leaf': 0.03627706829084058, 'min_impurity_decrease': 0.4711224318352434, 'max_features': 0.9000401355428018, 'subsample': 0.28124905025287716, 'dropout_rate': 0.23161710817759984, 'ccp_alpha': 4.179742268256892}. Best is trial 690 with value: 0.6691837560454439.[0m
/media/san2_ssd/data/Workdir/survival/venv/lib/python3.8/site-packages/sksurv/ensemble/boosting.py:955: RuntimeWarning: divide by zero encountered in log
  time = numpy.log(time)
/media/san2_ssd/data/Workdir/survival/venv/lib/python3.8/site-packages/sksurv/ensemble/boosting.py:955: RuntimeWarning: divide by zero encountered in log
  time = numpy.log(time)
/media/san2_ssd/data/Workdir/survival/venv/lib/python3.8/site-packages/sksurv/ensemble/boosting.py:955: RuntimeWarning: divide by zero encountered in log
  time = numpy.log(time)
/media/san2_ssd/data/Workdir/survival/venv/lib/python3.8/site-packages/sksurv/ensemble/boosting.py:955: RuntimeWarning: divide by zero encountered in log
  time = numpy.log(time)
[32m[I 2022-04-23 05:32:55,377][0m Trial 767 finished with value: -0.7296034834313234 and parameters: {'loss': 'squared', 'learning_rate': 0.07053724765161656, 'n_estimators': 706, 'criterion': 'friedman_mse', 'min_samples_split': 9, 'min_samples_leaf': 4, 'min_weight_fraction_leaf': 0.1599923738037625, 'min_impurity_decrease': 0.44792326070153016, 'max_features': 0.5632309664701416, 'subsample': 0.31612277437499514, 'dropout_rate': 0.19718370066142887, 'ccp_alpha': 0.10625413265823672}. Best is trial 690 with value: 0.6691837560454439.[0m
[32m[I 2022-04-23 05:34:28,864][0m Trial 768 finished with value: 0.6319963942938687 and parameters: {'loss': 'coxph', 'learning_rate': 0.0001082986453107958, 'n_estimators': 611, 'criterion': 'friedman_mse', 'min_samples_split': 9, 'min_samples_leaf': 5, 'min_weight_fraction_leaf': 0.04401286612256351, 'min_impurity_decrease': 0.8240355438225363, 'max_features': 0.5803531711437797, 'subsample': 0.25610511151871546, 'dropout_rate': 0.18995352660956769, 'ccp_alpha': 0.15556556036832855}. Best is trial 690 with value: 0.6691837560454439.[0m
[32m[I 2022-04-23 05:35:50,049][0m Trial 769 finished with value: 0.6482277145347121 and parameters: {'loss': 'coxph', 'learning_rate': 0.08013774445381855, 'n_estimators': 577, 'criterion': 'friedman_mse', 'min_samples_split': 7, 'min_samples_leaf': 5, 'min_weight_fraction_leaf': 0.060743121963390434, 'min_impurity_decrease': 0.38762081330781606, 'max_features': 0.5174993974756057, 'subsample': 0.33595171836396825, 'dropout_rate': 0.206918643779572, 'ccp_alpha': 0.09293728671243305}. Best is trial 690 with value: 0.6691837560454439.[0m
[32m[I 2022-04-23 05:37:03,283][0m Trial 770 finished with value: 0.5306685887469793 and parameters: {'loss': 'coxph', 'learning_rate': 0.05262358440966974, 'n_estimators': 549, 'criterion': 'friedman_mse', 'min_samples_split': 8, 'min_samples_leaf': 6, 'min_weight_fraction_leaf': 0.03361551220395505, 'min_impurity_decrease': 0.6065453033481066, 'max_features': 0.6173296023140186, 'subsample': 0.27010795434236007, 'dropout_rate': 0.23598847965712044, 'ccp_alpha': 0.28209074340065315}. Best is trial 690 with value: 0.6691837560454439.[0m
[32m[I 2022-04-23 05:38:51,682][0m Trial 771 finished with value: 0.6555216348831677 and parameters: {'loss': 'coxph', 'learning_rate': 0.06345967522521828, 'n_estimators': 668, 'criterion': 'friedman_mse', 'min_samples_split': 9, 'min_samples_leaf': 5, 'min_weight_fraction_leaf': 0.06184916668764212, 'min_impurity_decrease': 0.5258973814391064, 'max_features': 0.5403852109010632, 'subsample': 0.29286541024876395, 'dropout_rate': 0.1767683413061898, 'ccp_alpha': 0.09382551825772537}. Best is trial 690 with value: 0.6691837560454439.[0m
[32m[I 2022-04-23 05:40:52,545][0m Trial 772 finished with value: 0.5 and parameters: {'loss': 'coxph', 'learning_rate': 0.08236452276094379, 'n_estimators': 728, 'criterion': 'squared_error', 'min_samples_split': 9, 'min_samples_leaf': 10, 'min_weight_fraction_leaf': 0.051699033065769756, 'min_impurity_decrease': 0.5111473200687606, 'max_features': 0.58791263133973, 'subsample': 0.23418955632003252, 'dropout_rate': 0.21291191607157128, 'ccp_alpha': 0.5447438048061761}. Best is trial 690 with value: 0.6691837560454439.[0m
[32m[I 2022-04-23 05:42:21,954][0m Trial 773 finished with value: 0.6383869999142366 and parameters: {'loss': 'coxph', 'learning_rate': 0.0470348245532468, 'n_estimators': 629, 'criterion': 'friedman_mse', 'min_samples_split': 9, 'min_samples_leaf': 6, 'min_weight_fraction_leaf': 0.039340952435230836, 'min_impurity_decrease': 0.4868347184873545, 'max_features': 0.6096768587409291, 'subsample': 0.2106318298201886, 'dropout_rate': 0.2374794933661103, 'ccp_alpha': 0.1921957803896046}. Best is trial 690 with value: 0.6691837560454439.[0m
[32m[I 2022-04-23 05:43:41,601][0m Trial 774 finished with value: 0.58885724464568 and parameters: {'loss': 'coxph', 'learning_rate': 0.09889523009070347, 'n_estimators': 580, 'criterion': 'friedman_mse', 'min_samples_split': 9, 'min_samples_leaf': 6, 'min_weight_fraction_leaf': 0.3293723214778557, 'min_impurity_decrease': 0.7994197569216981, 'max_features': 0.5687590816775839, 'subsample': 0.3085932141985512, 'dropout_rate': 0.18501865849628182, 'ccp_alpha': 0.08437635782989654}. Best is trial 690 with value: 0.6691837560454439.[0m
[32m[I 2022-04-23 05:43:50,103][0m Trial 775 finished with value: 0.6596608285500746 and parameters: {'loss': 'coxph', 'learning_rate': 0.06512739115550038, 'n_estimators': 169, 'criterion': 'friedman_mse', 'min_samples_split': 9, 'min_samples_leaf': 5, 'min_weight_fraction_leaf': 0.027519242703860476, 'min_impurity_decrease': 0.46781025232720186, 'max_features': 0.49800917321760235, 'subsample': 0.25916848272609866, 'dropout_rate': 0.20116652879082972, 'ccp_alpha': 0.005538789966209276}. Best is trial 690 with value: 0.6691837560454439.[0m
[32m[I 2022-04-23 05:45:00,113][0m Trial 776 finished with value: 0.6266029743695483 and parameters: {'loss': 'coxph', 'learning_rate': 0.08076009781018476, 'n_estimators': 549, 'criterion': 'friedman_mse', 'min_samples_split': 9, 'min_samples_leaf': 4, 'min_weight_fraction_leaf': 0.06332780005117981, 'min_impurity_decrease': 0.4328989238304427, 'max_features': 0.6019859171021019, 'subsample': 0.28281839308915135, 'dropout_rate': 0.22520796867290624, 'ccp_alpha': 0.1914595431459427}. Best is trial 690 with value: 0.6691837560454439.[0m
[32m[I 2022-04-23 05:46:53,944][0m Trial 777 finished with value: 0.6570981916947451 and parameters: {'loss': 'coxph', 'learning_rate': 0.09970625116208197, 'n_estimators': 681, 'criterion': 'friedman_mse', 'min_samples_split': 9, 'min_samples_leaf': 7, 'min_weight_fraction_leaf': 0.047050701588241164, 'min_impurity_decrease': 0.5034701888770945, 'max_features': 0.6321020958486581, 'subsample': 0.23906100557481424, 'dropout_rate': 0.18886693777995686, 'ccp_alpha': 0.09801792528508088}. Best is trial 690 with value: 0.6691837560454439.[0m
[32m[I 2022-04-23 05:48:31,924][0m Trial 778 finished with value: 0.5 and parameters: {'loss': 'coxph', 'learning_rate': 0.058653696389904815, 'n_estimators': 622, 'criterion': 'friedman_mse', 'min_samples_split': 9, 'min_samples_leaf': 4, 'min_weight_fraction_leaf': 0.029135322254417763, 'min_impurity_decrease': 0.5463414464958631, 'max_features': 0.5339685269866185, 'subsample': 0.329868096946069, 'dropout_rate': 0.16749743475807566, 'ccp_alpha': 4.805310193694176}. Best is trial 690 with value: 0.6691837560454439.[0m
[32m[I 2022-04-23 05:49:30,639][0m Trial 779 finished with value: 0.660114110377795 and parameters: {'loss': 'coxph', 'learning_rate': 0.04763434812318455, 'n_estimators': 770, 'criterion': 'friedman_mse', 'min_samples_split': 8, 'min_samples_leaf': 4, 'min_weight_fraction_leaf': 0.05522703085782447, 'min_impurity_decrease': 0.8267895815778716, 'max_features': 0.826650357926417, 'subsample': 0.2687749687796468, 'dropout_rate': 0.768004408996076, 'ccp_alpha': 0.0032970627574971166}. Best is trial 690 with value: 0.6691837560454439.[0m
