No protocol specified
[32m[I 2022-04-21 11:37:51,651][0m A new study created in memory with name: no-name-88562750-20d5-499e-b4a8-2b8a1006a41f[0m
/media/san2_ssd/data/Workdir/survival/venv/lib/python3.8/site-packages/sksurv/ensemble/boosting.py:955: RuntimeWarning: divide by zero encountered in log
  time = numpy.log(time)
/media/san2_ssd/data/Workdir/survival/venv/lib/python3.8/site-packages/sksurv/ensemble/boosting.py:955: RuntimeWarning: divide by zero encountered in log
  time = numpy.log(time)
/media/san2_ssd/data/Workdir/survival/venv/lib/python3.8/site-packages/sksurv/ensemble/boosting.py:955: RuntimeWarning: divide by zero encountered in log
  time = numpy.log(time)
/media/san2_ssd/data/Workdir/survival/venv/lib/python3.8/site-packages/sksurv/ensemble/boosting.py:955: RuntimeWarning: divide by zero encountered in log
  time = numpy.log(time)
[32m[I 2022-04-21 11:37:54,034][0m Trial 0 finished with value: -0.45 and parameters: {'loss': 'squared', 'learning_rate': 3.0192045006175576e-05, 'n_estimators': 207, 'criterion': 'absolute_error', 'min_samples_split': 10, 'min_samples_leaf': 4, 'min_weight_fraction_leaf': 0.3032650253272454, 'min_impurity_decrease': 0.9450514216460172, 'max_features': 0.853492007598269, 'subsample': 0.5783511467676198, 'dropout_rate': 0.4602738785469951, 'ccp_alpha': 1.5967762821355889}. Best is trial 0 with value: -0.45.[0m
[32m[I 2022-04-21 11:39:26,797][0m Trial 1 finished with value: 0.6598665909009627 and parameters: {'loss': 'coxph', 'learning_rate': 9.741689897242478e-05, 'n_estimators': 585, 'criterion': 'absolute_error', 'min_samples_split': 7, 'min_samples_leaf': 1, 'min_weight_fraction_leaf': 0.2914510630514377, 'min_impurity_decrease': 0.1460741480243698, 'max_features': 0.10918991878165252, 'subsample': 0.8440774926005647, 'dropout_rate': 0.15522151730044953, 'ccp_alpha': 0.015548122308882174}. Best is trial 1 with value: 0.6598665909009627.[0m
[32m[I 2022-04-21 11:39:42,184][0m Trial 2 finished with value: 0.65 and parameters: {'loss': 'coxph', 'learning_rate': 0.00513594460057579, 'n_estimators': 237, 'criterion': 'friedman_mse', 'min_samples_split': 5, 'min_samples_leaf': 4, 'min_weight_fraction_leaf': 0.09607340579677437, 'min_impurity_decrease': 0.9732367878505486, 'max_features': 0.9242753382045785, 'subsample': 0.35761043530984765, 'dropout_rate': 0.36136676026651027, 'ccp_alpha': 0.6786677857323666}. Best is trial 1 with value: 0.6598665909009627.[0m
[32m[I 2022-04-21 11:39:46,409][0m Trial 3 finished with value: 0.65 and parameters: {'loss': 'coxph', 'learning_rate': 2.2039326235656974e-06, 'n_estimators': 114, 'criterion': 'squared_error', 'min_samples_split': 10, 'min_samples_leaf': 10, 'min_weight_fraction_leaf': 0.13657223462625748, 'min_impurity_decrease': 0.06530159776264345, 'max_features': 0.6494996796045712, 'subsample': 0.45847380307132746, 'dropout_rate': 0.057149408288673986, 'ccp_alpha': 0.6230498100731456}. Best is trial 1 with value: 0.6598665909009627.[0m
/media/san2_ssd/data/Workdir/survival/venv/lib/python3.8/site-packages/sksurv/ensemble/boosting.py:955: RuntimeWarning: divide by zero encountered in log
  time = numpy.log(time)
/media/san2_ssd/data/Workdir/survival/venv/lib/python3.8/site-packages/sksurv/ensemble/boosting.py:955: RuntimeWarning: divide by zero encountered in log
  time = numpy.log(time)
/media/san2_ssd/data/Workdir/survival/venv/lib/python3.8/site-packages/sksurv/ensemble/boosting.py:955: RuntimeWarning: divide by zero encountered in log
  time = numpy.log(time)
/media/san2_ssd/data/Workdir/survival/venv/lib/python3.8/site-packages/sksurv/ensemble/boosting.py:955: RuntimeWarning: divide by zero encountered in log
  time = numpy.log(time)
[32m[I 2022-04-21 11:39:52,593][0m Trial 4 finished with value: -0.45 and parameters: {'loss': 'squared', 'learning_rate': 0.00841034390798228, 'n_estimators': 294, 'criterion': 'squared_error', 'min_samples_split': 7, 'min_samples_leaf': 3, 'min_weight_fraction_leaf': 0.3567276925513816, 'min_impurity_decrease': 0.005495565341814144, 'max_features': 0.6742964074834555, 'subsample': 0.29168819867803414, 'dropout_rate': 0.02274248772009313, 'ccp_alpha': 2.262966736807256}. Best is trial 1 with value: 0.6598665909009627.[0m
/media/san2_ssd/data/Workdir/survival/venv/lib/python3.8/site-packages/sksurv/ensemble/boosting.py:955: RuntimeWarning: divide by zero encountered in log
  time = numpy.log(time)
/media/san2_ssd/data/Workdir/survival/venv/lib/python3.8/site-packages/sksurv/ensemble/boosting.py:955: RuntimeWarning: divide by zero encountered in log
  time = numpy.log(time)
/media/san2_ssd/data/Workdir/survival/venv/lib/python3.8/site-packages/sksurv/ensemble/boosting.py:955: RuntimeWarning: divide by zero encountered in log
  time = numpy.log(time)
/media/san2_ssd/data/Workdir/survival/venv/lib/python3.8/site-packages/sksurv/ensemble/boosting.py:955: RuntimeWarning: divide by zero encountered in log
  time = numpy.log(time)
[32m[I 2022-04-21 11:39:53,598][0m Trial 5 finished with value: -0.45 and parameters: {'loss': 'squared', 'learning_rate': 0.00014587040874376029, 'n_estimators': 227, 'criterion': 'squared_error', 'min_samples_split': 4, 'min_samples_leaf': 5, 'min_weight_fraction_leaf': 0.4094001604690695, 'min_impurity_decrease': 0.46141788145739504, 'max_features': 0.20648694087585448, 'subsample': 0.6673136931865624, 'dropout_rate': 0.8538050832651296, 'ccp_alpha': 4.140761880530798}. Best is trial 1 with value: 0.6598665909009627.[0m
[32m[I 2022-04-21 11:40:07,784][0m Trial 6 finished with value: 0.65 and parameters: {'loss': 'coxph', 'learning_rate': 1.398274679082999e-05, 'n_estimators': 370, 'criterion': 'friedman_mse', 'min_samples_split': 7, 'min_samples_leaf': 10, 'min_weight_fraction_leaf': 0.45680899954634635, 'min_impurity_decrease': 0.864836199325421, 'max_features': 0.7691851139493334, 'subsample': 0.6739900688154152, 'dropout_rate': 0.8099438207907639, 'ccp_alpha': 0.41018186805145485}. Best is trial 1 with value: 0.6598665909009627.[0m
/media/san2_ssd/data/Workdir/survival/venv/lib/python3.8/site-packages/sksurv/ensemble/boosting.py:955: RuntimeWarning: divide by zero encountered in log
  time = numpy.log(time)
/media/san2_ssd/data/Workdir/survival/venv/lib/python3.8/site-packages/sksurv/ensemble/boosting.py:955: RuntimeWarning: divide by zero encountered in log
  time = numpy.log(time)
/media/san2_ssd/data/Workdir/survival/venv/lib/python3.8/site-packages/sksurv/ensemble/boosting.py:955: RuntimeWarning: divide by zero encountered in log
  time = numpy.log(time)
/media/san2_ssd/data/Workdir/survival/venv/lib/python3.8/site-packages/sksurv/ensemble/boosting.py:955: RuntimeWarning: divide by zero encountered in log
  time = numpy.log(time)
[32m[I 2022-04-21 11:40:08,863][0m Trial 7 finished with value: -0.45 and parameters: {'loss': 'squared', 'learning_rate': 0.01817692107488159, 'n_estimators': 125, 'criterion': 'absolute_error', 'min_samples_split': 3, 'min_samples_leaf': 4, 'min_weight_fraction_leaf': 0.06663180610402551, 'min_impurity_decrease': 0.6783767177619198, 'max_features': 0.7583142112956051, 'subsample': 0.31606341157473333, 'dropout_rate': 0.4283402383231186, 'ccp_alpha': 1.146437796333704}. Best is trial 1 with value: 0.6598665909009627.[0m
[32m[I 2022-04-21 11:40:11,745][0m Trial 8 finished with value: 0.65 and parameters: {'loss': 'coxph', 'learning_rate': 1.7071429167320552e-06, 'n_estimators': 139, 'criterion': 'absolute_error', 'min_samples_split': 10, 'min_samples_leaf': 1, 'min_weight_fraction_leaf': 0.009231596905498088, 'min_impurity_decrease': 0.9562327881053986, 'max_features': 0.15091902848593952, 'subsample': 0.30982403639936706, 'dropout_rate': 0.7978164875863869, 'ccp_alpha': 2.975730474727708}. Best is trial 1 with value: 0.6598665909009627.[0m
[32m[I 2022-04-21 11:41:08,805][0m Trial 9 finished with value: 0.65 and parameters: {'loss': 'coxph', 'learning_rate': 0.004320388701308029, 'n_estimators': 408, 'criterion': 'absolute_error', 'min_samples_split': 3, 'min_samples_leaf': 4, 'min_weight_fraction_leaf': 0.428563931205359, 'min_impurity_decrease': 0.6242330363529489, 'max_features': 0.8083478326444885, 'subsample': 0.4535877193785351, 'dropout_rate': 0.042800178123130084, 'ccp_alpha': 1.0310411261722368}. Best is trial 1 with value: 0.6598665909009627.[0m
[32m[I 2022-04-21 11:44:33,904][0m Trial 10 finished with value: 0.65 and parameters: {'loss': 'coxph', 'learning_rate': 0.0004336473675629811, 'n_estimators': 879, 'criterion': 'absolute_error', 'min_samples_split': 8, 'min_samples_leaf': 8, 'min_weight_fraction_leaf': 0.2219561024963038, 'min_impurity_decrease': 0.24720709423306791, 'max_features': 0.3857097122813486, 'subsample': 0.9931389675196696, 'dropout_rate': 0.23948906551697735, 'ccp_alpha': 4.854359331739387}. Best is trial 1 with value: 0.6598665909009627.[0m
[32m[I 2022-04-21 11:46:23,754][0m Trial 11 finished with value: 0.8450457333064163 and parameters: {'loss': 'coxph', 'learning_rate': 0.0980077188392637, 'n_estimators': 649, 'criterion': 'friedman_mse', 'min_samples_split': 5, 'min_samples_leaf': 1, 'min_weight_fraction_leaf': 0.18483110059577074, 'min_impurity_decrease': 0.30031630668200765, 'max_features': 0.4298941954228189, 'subsample': 0.11497773977878434, 'dropout_rate': 0.2817636780886225, 'ccp_alpha': 0.1109513598683306}. Best is trial 11 with value: 0.8450457333064163.[0m
[32m[I 2022-04-21 11:49:13,754][0m Trial 12 finished with value: 0.65 and parameters: {'loss': 'coxph', 'learning_rate': 0.0830953966043697, 'n_estimators': 762, 'criterion': 'friedman_mse', 'min_samples_split': 6, 'min_samples_leaf': 1, 'min_weight_fraction_leaf': 0.20259509004188675, 'min_impurity_decrease': 0.2820692977828748, 'max_features': 0.42247967035314143, 'subsample': 0.033305170167385226, 'dropout_rate': 0.27838400069372815, 'ccp_alpha': 0.023169747761603767}. Best is trial 11 with value: 0.8450457333064163.[0m
[32m[I 2022-04-21 11:50:03,892][0m Trial 13 finished with value: 0.65 and parameters: {'loss': 'coxph', 'learning_rate': 0.0006657758299516539, 'n_estimators': 568, 'criterion': 'friedman_mse', 'min_samples_split': 5, 'min_samples_leaf': 2, 'min_weight_fraction_leaf': 0.273738349073929, 'min_impurity_decrease': 0.2410085444196549, 'max_features': 0.0394038147814816, 'subsample': 0.9422130850018872, 'dropout_rate': 0.5998954970012033, 'ccp_alpha': 1.8587883515343502}. Best is trial 11 with value: 0.8450457333064163.[0m
[32m[I 2022-04-21 11:51:26,291][0m Trial 14 finished with value: 0.65 and parameters: {'loss': 'coxph', 'learning_rate': 6.94110836806599e-05, 'n_estimators': 574, 'criterion': 'friedman_mse', 'min_samples_split': 8, 'min_samples_leaf': 7, 'min_weight_fraction_leaf': 0.1733127756993162, 'min_impurity_decrease': 0.38176995038192046, 'max_features': 0.2584526296407561, 'subsample': 0.010910534641122238, 'dropout_rate': 0.17986720141802653, 'ccp_alpha': 2.917785092361882}. Best is trial 11 with value: 0.8450457333064163.[0m
[32m[I 2022-04-21 11:52:24,279][0m Trial 15 finished with value: 0.6748574707404235 and parameters: {'loss': 'coxph', 'learning_rate': 0.0014104362010441678, 'n_estimators': 585, 'criterion': 'absolute_error', 'min_samples_split': 2, 'min_samples_leaf': 2, 'min_weight_fraction_leaf': 0.3183862288837764, 'min_impurity_decrease': 0.15428433326794766, 'max_features': 0.5175200054631548, 'subsample': 0.8192175108433751, 'dropout_rate': 0.5951599284732287, 'ccp_alpha': 0.04343058616898232}. Best is trial 11 with value: 0.8450457333064163.[0m
[32m[I 2022-04-21 11:54:39,187][0m Trial 16 finished with value: 0.65 and parameters: {'loss': 'coxph', 'learning_rate': 0.08232508453522416, 'n_estimators': 957, 'criterion': 'friedman_mse', 'min_samples_split': 2, 'min_samples_leaf': 2, 'min_weight_fraction_leaf': 0.4993233418720258, 'min_impurity_decrease': 0.3658288662588275, 'max_features': 0.5516141956985351, 'subsample': 0.16896302991675372, 'dropout_rate': 0.631010140797158, 'ccp_alpha': 1.3900684811595883}. Best is trial 11 with value: 0.8450457333064163.[0m
[32m[I 2022-04-21 11:55:35,135][0m Trial 17 finished with value: 0.65 and parameters: {'loss': 'coxph', 'learning_rate': 0.0015365141068273058, 'n_estimators': 681, 'criterion': 'friedman_mse', 'min_samples_split': 2, 'min_samples_leaf': 2, 'min_weight_fraction_leaf': 0.3452849395659749, 'min_impurity_decrease': 0.14128891646824, 'max_features': 0.33567517859046914, 'subsample': 0.7649021280765111, 'dropout_rate': 0.6447742122062192, 'ccp_alpha': 2.300533873776695}. Best is trial 11 with value: 0.8450457333064163.[0m
/media/san2_ssd/data/Workdir/survival/venv/lib/python3.8/site-packages/sksurv/ensemble/boosting.py:955: RuntimeWarning: divide by zero encountered in log
  time = numpy.log(time)
/media/san2_ssd/data/Workdir/survival/venv/lib/python3.8/site-packages/sksurv/ensemble/boosting.py:955: RuntimeWarning: divide by zero encountered in log
  time = numpy.log(time)
/media/san2_ssd/data/Workdir/survival/venv/lib/python3.8/site-packages/sksurv/ensemble/boosting.py:955: RuntimeWarning: divide by zero encountered in log
  time = numpy.log(time)
/media/san2_ssd/data/Workdir/survival/venv/lib/python3.8/site-packages/sksurv/ensemble/boosting.py:955: RuntimeWarning: divide by zero encountered in log
  time = numpy.log(time)
[32m[I 2022-04-21 11:55:40,421][0m Trial 18 finished with value: -0.45 and parameters: {'loss': 'squared', 'learning_rate': 0.02308337222583722, 'n_estimators': 460, 'criterion': 'absolute_error', 'min_samples_split': 4, 'min_samples_leaf': 7, 'min_weight_fraction_leaf': 0.24632367459111276, 'min_impurity_decrease': 0.5938422574918675, 'max_features': 0.5666913694427131, 'subsample': 0.15760928207486413, 'dropout_rate': 0.5376098681931667, 'ccp_alpha': 3.746904605564601}. Best is trial 11 with value: 0.8450457333064163.[0m
[32m[I 2022-04-21 11:56:19,060][0m Trial 19 finished with value: 0.65 and parameters: {'loss': 'coxph', 'learning_rate': 0.0015595228066080209, 'n_estimators': 473, 'criterion': 'squared_error', 'min_samples_split': 3, 'min_samples_leaf': 3, 'min_weight_fraction_leaf': 0.36312271864475393, 'min_impurity_decrease': 0.16243957630602435, 'max_features': 0.4919898870241536, 'subsample': 0.5745950183795289, 'dropout_rate': 0.34678121910300386, 'ccp_alpha': 0.729543952545455}. Best is trial 11 with value: 0.8450457333064163.[0m
[32m[I 2022-04-21 11:56:24,749][0m Trial 20 finished with value: 0.65 and parameters: {'loss': 'coxph', 'learning_rate': 0.027679681759132206, 'n_estimators': 343, 'criterion': 'friedman_mse', 'min_samples_split': 5, 'min_samples_leaf': 6, 'min_weight_fraction_leaf': 0.16641118867750854, 'min_impurity_decrease': 0.5027477834139129, 'max_features': 0.29778964251350115, 'subsample': 0.848349277956976, 'dropout_rate': 0.9560232672210831, 'ccp_alpha': 1.8507723065645298}. Best is trial 11 with value: 0.8450457333064163.[0m
[32m[I 2022-04-21 11:58:09,052][0m Trial 21 finished with value: 0.6598665909009627 and parameters: {'loss': 'coxph', 'learning_rate': 6.078907254400591e-06, 'n_estimators': 649, 'criterion': 'absolute_error', 'min_samples_split': 8, 'min_samples_leaf': 1, 'min_weight_fraction_leaf': 0.28191404895217154, 'min_impurity_decrease': 0.13652232842158485, 'max_features': 0.004542854064804577, 'subsample': 0.7744904174884893, 'dropout_rate': 0.15706075611073572, 'ccp_alpha': 0.17782722044387825}. Best is trial 11 with value: 0.8450457333064163.[0m
[32m[I 2022-04-21 12:00:34,129][0m Trial 22 finished with value: 0.65 and parameters: {'loss': 'coxph', 'learning_rate': 7.198042825928857e-06, 'n_estimators': 743, 'criterion': 'absolute_error', 'min_samples_split': 9, 'min_samples_leaf': 1, 'min_weight_fraction_leaf': 0.318637370719323, 'min_impurity_decrease': 0.3343921766796834, 'max_features': 0.025635846976441556, 'subsample': 0.7516765359177334, 'dropout_rate': 0.1836486558735997, 'ccp_alpha': 0.2565571005544853}. Best is trial 11 with value: 0.8450457333064163.[0m
[32m[I 2022-04-21 12:01:08,299][0m Trial 23 finished with value: 0.719348985387283 and parameters: {'loss': 'coxph', 'learning_rate': 0.00014161849442232934, 'n_estimators': 514, 'criterion': 'absolute_error', 'min_samples_split': 6, 'min_samples_leaf': 2, 'min_weight_fraction_leaf': 0.2461328511743836, 'min_impurity_decrease': 0.05152346347153211, 'max_features': 0.4590394167234215, 'subsample': 0.8556609517110099, 'dropout_rate': 0.7065551887187717, 'ccp_alpha': 0.03565663844993613}. Best is trial 11 with value: 0.8450457333064163.[0m
[32m[I 2022-04-21 12:01:43,874][0m Trial 24 finished with value: 0.65 and parameters: {'loss': 'coxph', 'learning_rate': 0.00022440878594614296, 'n_estimators': 480, 'criterion': 'absolute_error', 'min_samples_split': 6, 'min_samples_leaf': 3, 'min_weight_fraction_leaf': 0.21934668817100078, 'min_impurity_decrease': 0.07177954814883143, 'max_features': 0.47808927754803676, 'subsample': 0.9018022669524915, 'dropout_rate': 0.660492472613177, 'ccp_alpha': 0.915769115308898}. Best is trial 11 with value: 0.8450457333064163.[0m
[32m[I 2022-04-21 12:03:14,389][0m Trial 25 finished with value: 0.65 and parameters: {'loss': 'coxph', 'learning_rate': 0.000638408790626516, 'n_estimators': 808, 'criterion': 'absolute_error', 'min_samples_split': 6, 'min_samples_leaf': 2, 'min_weight_fraction_leaf': 0.13669845044832016, 'min_impurity_decrease': 0.011324867804792985, 'max_features': 0.619399847287863, 'subsample': 0.653331610917444, 'dropout_rate': 0.7245771307721216, 'ccp_alpha': 0.48732572624530235}. Best is trial 11 with value: 0.8450457333064163.[0m
/media/san2_ssd/data/Workdir/survival/venv/lib/python3.8/site-packages/sksurv/ensemble/boosting.py:955: RuntimeWarning: divide by zero encountered in log
  time = numpy.log(time)
/media/san2_ssd/data/Workdir/survival/venv/lib/python3.8/site-packages/sksurv/ensemble/boosting.py:955: RuntimeWarning: divide by zero encountered in log
  time = numpy.log(time)
/media/san2_ssd/data/Workdir/survival/venv/lib/python3.8/site-packages/sksurv/ensemble/boosting.py:955: RuntimeWarning: divide by zero encountered in log
  time = numpy.log(time)
/media/san2_ssd/data/Workdir/survival/venv/lib/python3.8/site-packages/sksurv/ensemble/boosting.py:955: RuntimeWarning: divide by zero encountered in log
  time = numpy.log(time)
[32m[I 2022-04-21 12:03:18,317][0m Trial 26 finished with value: -0.45 and parameters: {'loss': 'squared', 'learning_rate': 4.2098988981865995e-05, 'n_estimators': 301, 'criterion': 'absolute_error', 'min_samples_split': 4, 'min_samples_leaf': 3, 'min_weight_fraction_leaf': 0.2379482109111556, 'min_impurity_decrease': 0.23141245047411535, 'max_features': 0.4073607390568519, 'subsample': 0.17366324779626674, 'dropout_rate': 0.5039970610605534, 'ccp_alpha': 1.2458138749866798}. Best is trial 11 with value: 0.8450457333064163.[0m
[32m[I 2022-04-21 12:04:05,826][0m Trial 27 finished with value: 0.65 and parameters: {'loss': 'coxph', 'learning_rate': 0.0011709151741633196, 'n_estimators': 521, 'criterion': 'friedman_mse', 'min_samples_split': 2, 'min_samples_leaf': 5, 'min_weight_fraction_leaf': 0.184749763204272, 'min_impurity_decrease': 0.4479105662475571, 'max_features': 0.5580114182897016, 'subsample': 0.854542872362079, 'dropout_rate': 0.5595679176646042, 'ccp_alpha': 0.3258331600960423}. Best is trial 11 with value: 0.8450457333064163.[0m
[32m[I 2022-04-21 12:04:30,881][0m Trial 28 finished with value: 0.65 and parameters: {'loss': 'coxph', 'learning_rate': 0.0030574195588117486, 'n_estimators': 997, 'criterion': 'squared_error', 'min_samples_split': 5, 'min_samples_leaf': 2, 'min_weight_fraction_leaf': 0.3968702807182238, 'min_impurity_decrease': 0.08067659760234738, 'max_features': 0.4572345282026987, 'subsample': 0.5427035351720233, 'dropout_rate': 0.9903688596873972, 'ccp_alpha': 0.8786806468853409}. Best is trial 11 with value: 0.8450457333064163.[0m
/media/san2_ssd/data/Workdir/survival/venv/lib/python3.8/site-packages/sksurv/ensemble/boosting.py:955: RuntimeWarning: divide by zero encountered in log
  time = numpy.log(time)
/media/san2_ssd/data/Workdir/survival/venv/lib/python3.8/site-packages/sksurv/ensemble/boosting.py:955: RuntimeWarning: divide by zero encountered in log
  time = numpy.log(time)
/media/san2_ssd/data/Workdir/survival/venv/lib/python3.8/site-packages/sksurv/ensemble/boosting.py:955: RuntimeWarning: divide by zero encountered in log
  time = numpy.log(time)
/media/san2_ssd/data/Workdir/survival/venv/lib/python3.8/site-packages/sksurv/ensemble/boosting.py:955: RuntimeWarning: divide by zero encountered in log
  time = numpy.log(time)
[32m[I 2022-04-21 12:04:35,295][0m Trial 29 finished with value: -0.45 and parameters: {'loss': 'squared', 'learning_rate': 2.1947322558976323e-05, 'n_estimators': 392, 'criterion': 'absolute_error', 'min_samples_split': 4, 'min_samples_leaf': 3, 'min_weight_fraction_leaf': 0.31690015835807717, 'min_impurity_decrease': 0.29134854315254743, 'max_features': 0.34263271209787854, 'subsample': 0.7044701311269769, 'dropout_rate': 0.4538411350860838, 'ccp_alpha': 1.4733439916187556}. Best is trial 11 with value: 0.8450457333064163.[0m
[32m[I 2022-04-21 12:04:40,947][0m Trial 30 finished with value: 0.65 and parameters: {'loss': 'coxph', 'learning_rate': 0.0002777724886367638, 'n_estimators': 167, 'criterion': 'absolute_error', 'min_samples_split': 3, 'min_samples_leaf': 2, 'min_weight_fraction_leaf': 0.2608702348566907, 'min_impurity_decrease': 0.18489794202719834, 'max_features': 0.6985898023074246, 'subsample': 0.9972963259125661, 'dropout_rate': 0.3709480099180936, 'ccp_alpha': 1.8833161320253493}. Best is trial 11 with value: 0.8450457333064163.[0m
