[32m[I 2022-04-21 11:44:36,900][0m Trial 210 finished with value: 0.5900515018384349 and parameters: {'splitter': 'best', 'min_samples_split': 0.13684866518820774, 'min_samples_leaf': 0.20025589940964972, 'min_weight_fraction_leaf': 0.020399196897402605, 'max_features': 0.6143875882381296}. Best is trial 203 with value: 0.6541339470014573.[0m
[32m[I 2022-04-21 11:44:37,650][0m Trial 211 finished with value: 0.6533825795151853 and parameters: {'splitter': 'best', 'min_samples_split': 0.11800011739516242, 'min_samples_leaf': 0.015281425247315104, 'min_weight_fraction_leaf': 0.010087020209224673, 'max_features': 0.5996742802518977}. Best is trial 203 with value: 0.6541339470014573.[0m
[32m[I 2022-04-21 11:44:39,734][0m Trial 212 finished with value: 0.6260023202830455 and parameters: {'splitter': 'best', 'min_samples_split': 0.12727791407358832, 'min_samples_leaf': 0.0012488594301836228, 'min_weight_fraction_leaf': 0.0006930168395589131, 'max_features': 0.6287775617548452}. Best is trial 203 with value: 0.6541339470014573.[0m
[32m[I 2022-04-21 11:44:40,074][0m Trial 213 finished with value: 0.6400355064093011 and parameters: {'splitter': 'best', 'min_samples_split': 0.1541677743480308, 'min_samples_leaf': 0.018670492063521227, 'min_weight_fraction_leaf': 0.009448265227898957, 'max_features': 0.6107977787227381}. Best is trial 203 with value: 0.6541339470014573.[0m
[32m[I 2022-04-21 11:44:40,436][0m Trial 214 finished with value: 0.6189634392076034 and parameters: {'splitter': 'best', 'min_samples_split': 0.1558737352531745, 'min_samples_leaf': 0.013364294286584305, 'min_weight_fraction_leaf': 0.019551777832660794, 'max_features': 0.5588400309850456}. Best is trial 203 with value: 0.6541339470014573.[0m
[32m[I 2022-04-21 11:44:40,821][0m Trial 215 finished with value: 0.6351505415910068 and parameters: {'splitter': 'best', 'min_samples_split': 0.14154160639894284, 'min_samples_leaf': 0.01922348948548557, 'min_weight_fraction_leaf': 0.01017698183939239, 'max_features': 0.6443639144183751}. Best is trial 203 with value: 0.6541339470014573.[0m
[32m[I 2022-04-21 11:44:41,215][0m Trial 216 finished with value: 0.6381626837476617 and parameters: {'splitter': 'best', 'min_samples_split': 0.17775513335855309, 'min_samples_leaf': 0.019152485514138458, 'min_weight_fraction_leaf': 0.00994224732238673, 'max_features': 0.6453780212733181}. Best is trial 203 with value: 0.6541339470014573.[0m
[32m[I 2022-04-21 11:44:41,770][0m Trial 217 finished with value: 0.6358099220743574 and parameters: {'splitter': 'best', 'min_samples_split': 0.16778829595953096, 'min_samples_leaf': 0.009135556220171082, 'min_weight_fraction_leaf': 0.009853311197387266, 'max_features': 0.6839759146139603}. Best is trial 203 with value: 0.6541339470014573.[0m
[32m[I 2022-04-21 11:44:42,639][0m Trial 218 finished with value: 0.6392417672060883 and parameters: {'splitter': 'best', 'min_samples_split': 0.16746762779850502, 'min_samples_leaf': 0.008610575618803027, 'min_weight_fraction_leaf': 0.011389710236814312, 'max_features': 0.6607976626127425}. Best is trial 203 with value: 0.6541339470014573.[0m
[32m[I 2022-04-21 11:44:43,203][0m Trial 219 finished with value: 0.653371047252673 and parameters: {'splitter': 'best', 'min_samples_split': 0.1635344714093462, 'min_samples_leaf': 0.009308327362509642, 'min_weight_fraction_leaf': 0.008894234424733239, 'max_features': 0.6777540191483677}. Best is trial 203 with value: 0.6541339470014573.[0m
[32m[I 2022-04-21 11:44:43,447][0m Trial 220 finished with value: 0.5494999010603218 and parameters: {'splitter': 'best', 'min_samples_split': 0.17374501126876235, 'min_samples_leaf': 0.0010564467178735167, 'min_weight_fraction_leaf': 0.254189640157181, 'max_features': 0.6683178720192471}. Best is trial 203 with value: 0.6541339470014573.[0m
[32m[I 2022-04-21 11:44:43,947][0m Trial 221 finished with value: 0.6393909969157736 and parameters: {'splitter': 'best', 'min_samples_split': 0.16731786643664126, 'min_samples_leaf': 0.011563408008237668, 'min_weight_fraction_leaf': 0.009117571531162333, 'max_features': 0.6871473458826133}. Best is trial 203 with value: 0.6541339470014573.[0m
[32m[I 2022-04-21 11:44:44,610][0m Trial 222 finished with value: 0.6429651277647178 and parameters: {'splitter': 'best', 'min_samples_split': 0.16844276239763054, 'min_samples_leaf': 0.010191418943080746, 'min_weight_fraction_leaf': 0.00944334533442186, 'max_features': 0.676978900439336}. Best is trial 203 with value: 0.6541339470014573.[0m
[32m[I 2022-04-21 11:44:45,456][0m Trial 223 finished with value: 0.6419970483217401 and parameters: {'splitter': 'best', 'min_samples_split': 0.1672676410031531, 'min_samples_leaf': 0.010157697848548503, 'min_weight_fraction_leaf': 0.016912261048826573, 'max_features': 0.6925579118642325}. Best is trial 203 with value: 0.6541339470014573.[0m
[32m[I 2022-04-21 11:44:46,140][0m Trial 224 finished with value: 0.6461001444457344 and parameters: {'splitter': 'best', 'min_samples_split': 0.1926757623424305, 'min_samples_leaf': 0.009334518024430494, 'min_weight_fraction_leaf': 0.015437129259619105, 'max_features': 0.6932384853933585}. Best is trial 203 with value: 0.6541339470014573.[0m
[32m[I 2022-04-21 11:44:46,964][0m Trial 225 finished with value: 0.6424993976166793 and parameters: {'splitter': 'best', 'min_samples_split': 0.19849767678545593, 'min_samples_leaf': 0.010257766564938875, 'min_weight_fraction_leaf': 0.015882307536601126, 'max_features': 0.685153836086166}. Best is trial 203 with value: 0.6541339470014573.[0m
[32m[I 2022-04-21 11:44:47,819][0m Trial 226 finished with value: 0.6395782507909178 and parameters: {'splitter': 'best', 'min_samples_split': 0.1876387123468534, 'min_samples_leaf': 0.010604907474650076, 'min_weight_fraction_leaf': 0.019643067495048048, 'max_features': 0.6964317020546205}. Best is trial 203 with value: 0.6541339470014573.[0m
[32m[I 2022-04-21 11:44:48,556][0m Trial 227 finished with value: 0.6269229444451476 and parameters: {'splitter': 'best', 'min_samples_split': 0.19585618045553613, 'min_samples_leaf': 0.0013159133528535642, 'min_weight_fraction_leaf': 0.021594788180795597, 'max_features': 0.6965633821130778}. Best is trial 203 with value: 0.6541339470014573.[0m
[32m[I 2022-04-21 11:44:49,333][0m Trial 228 finished with value: 0.627551215739785 and parameters: {'splitter': 'best', 'min_samples_split': 0.20848366934021714, 'min_samples_leaf': 0.009862981844935581, 'min_weight_fraction_leaf': 0.01833835322732908, 'max_features': 0.7110659328367812}. Best is trial 203 with value: 0.6541339470014573.[0m
[32m[I 2022-04-21 11:44:49,480][0m Trial 229 finished with value: 0.536760391755396 and parameters: {'splitter': 'best', 'min_samples_split': 0.18161052758039617, 'min_samples_leaf': 0.009354829906623785, 'min_weight_fraction_leaf': 0.36816379789389314, 'max_features': 0.6855531996986328}. Best is trial 203 with value: 0.6541339470014573.[0m
[32m[I 2022-04-21 11:44:49,834][0m Trial 230 finished with value: 0.616456183817416 and parameters: {'splitter': 'best', 'min_samples_split': 0.20033467973158547, 'min_samples_leaf': 0.011597876599658236, 'min_weight_fraction_leaf': 0.03736807749672121, 'max_features': 0.7309582407585149}. Best is trial 203 with value: 0.6541339470014573.[0m
[32m[I 2022-04-21 11:44:50,238][0m Trial 231 finished with value: 0.6244025173555844 and parameters: {'splitter': 'best', 'min_samples_split': 0.18704008201341474, 'min_samples_leaf': 0.019413673525752746, 'min_weight_fraction_leaf': 0.017239633631151285, 'max_features': 0.6743074980266928}. Best is trial 203 with value: 0.6541339470014573.[0m
[32m[I 2022-04-21 11:44:50,305][0m Trial 232 finished with value: 0.536760391755396 and parameters: {'splitter': 'best', 'min_samples_split': 0.17878844962539397, 'min_samples_leaf': 0.36007157015635044, 'min_weight_fraction_leaf': 0.024107117352816662, 'max_features': 0.70021094700717}. Best is trial 203 with value: 0.6541339470014573.[0m
[32m[I 2022-04-21 11:44:50,800][0m Trial 233 finished with value: 0.6192613106588929 and parameters: {'splitter': 'best', 'min_samples_split': 0.16849046798444442, 'min_samples_leaf': 0.009554606836681747, 'min_weight_fraction_leaf': 0.015678115688151348, 'max_features': 0.6628717272741947}. Best is trial 203 with value: 0.6541339470014573.[0m
[32m[I 2022-04-21 11:44:51,771][0m Trial 234 finished with value: 0.6295737150941452 and parameters: {'splitter': 'best', 'min_samples_split': 0.1632167427057034, 'min_samples_leaf': 0.001458796364408924, 'min_weight_fraction_leaf': 0.018035813019204525, 'max_features': 0.7172050399319939}. Best is trial 203 with value: 0.6541339470014573.[0m
[32m[I 2022-04-21 11:44:52,175][0m Trial 235 finished with value: 0.625969380592313 and parameters: {'splitter': 'best', 'min_samples_split': 0.17654458191078748, 'min_samples_leaf': 0.021394680150933022, 'min_weight_fraction_leaf': 0.010905386391781407, 'max_features': 0.6828085379117536}. Best is trial 203 with value: 0.6541339470014573.[0m
[32m[I 2022-04-21 11:44:52,665][0m Trial 236 finished with value: 0.6156110434940163 and parameters: {'splitter': 'best', 'min_samples_split': 0.16578632473973415, 'min_samples_leaf': 0.01363634484780684, 'min_weight_fraction_leaf': 0.028395443278752756, 'max_features': 0.6637038692513522}. Best is trial 203 with value: 0.6541339470014573.[0m
[32m[I 2022-04-21 11:44:53,017][0m Trial 237 finished with value: 0.623903447416121 and parameters: {'splitter': 'best', 'min_samples_split': 0.1976760624805742, 'min_samples_leaf': 0.023674171151771253, 'min_weight_fraction_leaf': 0.008499972422523337, 'max_features': 0.6428092096982504}. Best is trial 203 with value: 0.6541339470014573.[0m
[32m[I 2022-04-21 11:44:53,534][0m Trial 238 finished with value: 0.6421139613288164 and parameters: {'splitter': 'best', 'min_samples_split': 0.2168242197381135, 'min_samples_leaf': 0.011883402833753299, 'min_weight_fraction_leaf': 0.00011396647783536509, 'max_features': 0.6933032879555598}. Best is trial 203 with value: 0.6541339470014573.[0m
[32m[I 2022-04-21 11:44:54,082][0m Trial 239 finished with value: 0.641708536022413 and parameters: {'splitter': 'best', 'min_samples_split': 0.18999394902944394, 'min_samples_leaf': 0.009991098913870736, 'min_weight_fraction_leaf': 0.0012478099066097308, 'max_features': 0.6953203916613243}. Best is trial 203 with value: 0.6541339470014573.[0m
[32m[I 2022-04-21 11:44:54,257][0m Trial 240 finished with value: 0.5436001977432146 and parameters: {'splitter': 'best', 'min_samples_split': 0.18922264473601483, 'min_samples_leaf': 0.009982144995972756, 'min_weight_fraction_leaf': 0.2996455022830286, 'max_features': 0.7277684641189588}. Best is trial 203 with value: 0.6541339470014573.[0m
[32m[I 2022-04-21 11:44:56,592][0m Trial 241 finished with value: 0.6377118921512174 and parameters: {'splitter': 'best', 'min_samples_split': 0.19113561139111188, 'min_samples_leaf': 0.0014816301315462733, 'min_weight_fraction_leaf': 0.0015913684174173577, 'max_features': 0.6985885679913949}. Best is trial 203 with value: 0.6541339470014573.[0m
[32m[I 2022-04-21 11:44:57,359][0m Trial 242 finished with value: 0.6326443216053014 and parameters: {'splitter': 'best', 'min_samples_split': 0.21778669961679514, 'min_samples_leaf': 0.012347827726437766, 'min_weight_fraction_leaf': 0.00028482687269051167, 'max_features': 0.6771009151742104}. Best is trial 203 with value: 0.6541339470014573.[0m
[32m[I 2022-04-21 11:44:57,991][0m Trial 243 finished with value: 0.6336179545555712 and parameters: {'splitter': 'best', 'min_samples_split': 0.20536149571560336, 'min_samples_leaf': 0.026961172900741542, 'min_weight_fraction_leaf': 0.009811921385007371, 'max_features': 0.6878518368975369}. Best is trial 203 with value: 0.6541339470014573.[0m
[32m[I 2022-04-21 11:44:58,654][0m Trial 244 finished with value: 0.6293590530770403 and parameters: {'splitter': 'best', 'min_samples_split': 0.17780350743501758, 'min_samples_leaf': 0.018887929754093227, 'min_weight_fraction_leaf': 0.023504317645722427, 'max_features': 0.6538045797423033}. Best is trial 203 with value: 0.6541339470014573.[0m
[32m[I 2022-04-21 11:44:59,699][0m Trial 245 finished with value: 0.6323966152682544 and parameters: {'splitter': 'best', 'min_samples_split': 0.15486541182426591, 'min_samples_leaf': 0.009646860397839187, 'min_weight_fraction_leaf': 0.00016027268583724587, 'max_features': 0.7011957431515837}. Best is trial 203 with value: 0.6541339470014573.[0m
[32m[I 2022-04-21 11:45:00,068][0m Trial 246 finished with value: 0.6265459888391859 and parameters: {'splitter': 'best', 'min_samples_split': 0.2164350600591231, 'min_samples_leaf': 0.023123184548635628, 'min_weight_fraction_leaf': 0.013283863220276805, 'max_features': 0.7228853214497051}. Best is trial 203 with value: 0.6541339470014573.[0m
[32m[I 2022-04-21 11:45:00,705][0m Trial 247 finished with value: 0.6280904497069116 and parameters: {'splitter': 'best', 'min_samples_split': 0.1713916973220593, 'min_samples_leaf': 0.0014594578130388558, 'min_weight_fraction_leaf': 0.02471021248449012, 'max_features': 0.6681064041402133}. Best is trial 203 with value: 0.6541339470014573.[0m
[32m[I 2022-04-21 11:45:01,310][0m Trial 248 finished with value: 0.6231685713935141 and parameters: {'splitter': 'best', 'min_samples_split': 0.18177764767864732, 'min_samples_leaf': 0.01324116862468467, 'min_weight_fraction_leaf': 0.009755896443067175, 'max_features': 0.6405555269282663}. Best is trial 203 with value: 0.6541339470014573.[0m
[32m[I 2022-04-21 11:45:01,668][0m Trial 249 finished with value: 0.6208221222696967 and parameters: {'splitter': 'best', 'min_samples_split': 0.1598778762117068, 'min_samples_leaf': 0.02500657259100952, 'min_weight_fraction_leaf': 0.036458791343893154, 'max_features': 0.6575158649962309}. Best is trial 203 with value: 0.6541339470014573.[0m
[32m[I 2022-04-21 11:45:01,725][0m Trial 250 finished with value: 0.5155975170068372 and parameters: {'splitter': 'best', 'min_samples_split': 0.15051434414779302, 'min_samples_leaf': 0.426774565781444, 'min_weight_fraction_leaf': 0.00012208007113876165, 'max_features': 0.6810507689676066}. Best is trial 203 with value: 0.6541339470014573.[0m
[32m[I 2022-04-21 11:45:02,025][0m Trial 251 finished with value: 0.622112931614396 and parameters: {'splitter': 'best', 'min_samples_split': 0.18730977378689928, 'min_samples_leaf': 0.031048755328955964, 'min_weight_fraction_leaf': 0.016147581384096277, 'max_features': 0.6325200014046887}. Best is trial 203 with value: 0.6541339470014573.[0m
[32m[I 2022-04-21 11:45:02,423][0m Trial 252 finished with value: 0.6295339555274602 and parameters: {'splitter': 'best', 'min_samples_split': 0.20025369060157258, 'min_samples_leaf': 0.012649152417859537, 'min_weight_fraction_leaf': 0.027407484173063636, 'max_features': 0.7102944110024676}. Best is trial 203 with value: 0.6541339470014573.[0m
[32m[I 2022-04-21 11:45:03,696][0m Trial 253 finished with value: 0.6427899359288036 and parameters: {'splitter': 'best', 'min_samples_split': 0.16900529854173998, 'min_samples_leaf': 0.01766390022626934, 'min_weight_fraction_leaf': 0.009060755009024864, 'max_features': 0.7389230712653306}. Best is trial 203 with value: 0.6541339470014573.[0m
[32m[I 2022-04-21 11:45:04,452][0m Trial 254 finished with value: 0.633865953841214 and parameters: {'splitter': 'best', 'min_samples_split': 0.16570414684847767, 'min_samples_leaf': 0.007151595551254624, 'min_weight_fraction_leaf': 0.018920662638877525, 'max_features': 0.7208760533302524}. Best is trial 203 with value: 0.6541339470014573.[0m
[32m[I 2022-04-21 11:45:04,999][0m Trial 255 finished with value: 0.6146113684570681 and parameters: {'splitter': 'best', 'min_samples_split': 0.15404293457781787, 'min_samples_leaf': 0.030176187338397033, 'min_weight_fraction_leaf': 0.009205872766459988, 'max_features': 0.6938752455911683}. Best is trial 203 with value: 0.6541339470014573.[0m
[32m[I 2022-04-21 11:45:05,630][0m Trial 256 finished with value: 0.6233924335315478 and parameters: {'splitter': 'best', 'min_samples_split': 0.1465057129868157, 'min_samples_leaf': 0.018647470109526523, 'min_weight_fraction_leaf': 0.03437414949434332, 'max_features': 0.7458299000095289}. Best is trial 203 with value: 0.6541339470014573.[0m
[32m[I 2022-04-21 11:45:06,669][0m Trial 257 finished with value: 0.6468955053984677 and parameters: {'splitter': 'best', 'min_samples_split': 0.16406477900571517, 'min_samples_leaf': 0.00869526265273762, 'min_weight_fraction_leaf': 0.0003369241045117746, 'max_features': 0.7365364117528563}. Best is trial 203 with value: 0.6541339470014573.[0m
[32m[I 2022-04-21 11:45:08,350][0m Trial 258 finished with value: 0.62012785439808 and parameters: {'splitter': 'best', 'min_samples_split': 0.15986795821639407, 'min_samples_leaf': 0.0010804699436368897, 'min_weight_fraction_leaf': 0.0005793834947250415, 'max_features': 0.7423870774777661}. Best is trial 203 with value: 0.6541339470014573.[0m
[32m[I 2022-04-21 11:45:08,431][0m Trial 259 finished with value: 0.5468289365265718 and parameters: {'splitter': 'best', 'min_samples_split': 0.17290706183768775, 'min_samples_leaf': 0.2649293103737431, 'min_weight_fraction_leaf': 0.02208278172075101, 'max_features': 0.7122314919120089}. Best is trial 203 with value: 0.6541339470014573.[0m
[32m[I 2022-04-21 11:45:08,801][0m Trial 260 finished with value: 0.6371845225736621 and parameters: {'splitter': 'best', 'min_samples_split': 0.19145803577586457, 'min_samples_leaf': 0.03129478254900925, 'min_weight_fraction_leaf': 0.008100853657729962, 'max_features': 0.7537179250325652}. Best is trial 203 with value: 0.6541339470014573.[0m
[32m[I 2022-04-21 11:45:08,895][0m Trial 261 finished with value: 0.5835763928485636 and parameters: {'splitter': 'best', 'min_samples_split': 0.15041691918665873, 'min_samples_leaf': 0.22895272028225258, 'min_weight_fraction_leaf': 0.018733855128351934, 'max_features': 0.7344917856196983}. Best is trial 203 with value: 0.6541339470014573.[0m
[32m[I 2022-04-21 11:45:09,379][0m Trial 262 finished with value: 0.6465245213729514 and parameters: {'splitter': 'best', 'min_samples_split': 0.21243034791684595, 'min_samples_leaf': 0.019686704403830316, 'min_weight_fraction_leaf': 0.00025118628744517923, 'max_features': 0.694473443632494}. Best is trial 203 with value: 0.6541339470014573.[0m
[32m[I 2022-04-21 11:45:09,751][0m Trial 263 finished with value: 0.6224426206382228 and parameters: {'splitter': 'best', 'min_samples_split': 0.21354272721635423, 'min_samples_leaf': 0.024604238142601268, 'min_weight_fraction_leaf': 0.0008799979664512545, 'max_features': 0.7035477969622299}. Best is trial 203 with value: 0.6541339470014573.[0m
[32m[I 2022-04-21 11:45:09,909][0m Trial 264 finished with value: 0.5508258458890045 and parameters: {'splitter': 'best', 'min_samples_split': 0.22848554786160266, 'min_samples_leaf': 0.2942673557221156, 'min_weight_fraction_leaf': 6.209009430168983e-05, 'max_features': 0.6139290189368132}. Best is trial 203 with value: 0.6541339470014573.[0m
[32m[I 2022-04-21 11:45:10,732][0m Trial 265 finished with value: 0.6368584855088489 and parameters: {'splitter': 'best', 'min_samples_split': 0.2074744859064362, 'min_samples_leaf': 0.019721030300731208, 'min_weight_fraction_leaf': 0.029946989193752445, 'max_features': 0.600007881644999}. Best is trial 203 with value: 0.6541339470014573.[0m
[32m[I 2022-04-21 11:45:11,544][0m Trial 266 finished with value: 0.6283431698748969 and parameters: {'splitter': 'best', 'min_samples_split': 0.19638555991531925, 'min_samples_leaf': 0.030616581551457925, 'min_weight_fraction_leaf': 0.022987780433314828, 'max_features': 0.6699384147845261}. Best is trial 203 with value: 0.6541339470014573.[0m
[32m[I 2022-04-21 11:45:12,919][0m Trial 267 finished with value: 0.6289473794578456 and parameters: {'splitter': 'best', 'min_samples_split': 0.14331389306506045, 'min_samples_leaf': 0.0012530880340952712, 'min_weight_fraction_leaf': 0.016375378858495875, 'max_features': 0.5217899098112403}. Best is trial 203 with value: 0.6541339470014573.[0m
[32m[I 2022-04-21 11:45:13,889][0m Trial 268 finished with value: 0.6354039141112086 and parameters: {'splitter': 'best', 'min_samples_split': 0.1126622615115635, 'min_samples_leaf': 0.015121317017898206, 'min_weight_fraction_leaf': 0.03715061078071928, 'max_features': 0.6357098889428626}. Best is trial 203 with value: 0.6541339470014573.[0m
[32m[I 2022-04-21 11:45:14,247][0m Trial 269 finished with value: 0.5837259983719282 and parameters: {'splitter': 'best', 'min_samples_split': 0.18558382429244574, 'min_samples_leaf': 0.020813544076140337, 'min_weight_fraction_leaf': 0.010592273884354938, 'max_features': 0.039588843443641664}. Best is trial 203 with value: 0.6541339470014573.[0m
[32m[I 2022-04-21 11:45:14,825][0m Trial 270 finished with value: 0.6001277537884453 and parameters: {'splitter': 'best', 'min_samples_split': 0.4007504866352424, 'min_samples_leaf': 0.03438483385885035, 'min_weight_fraction_leaf': 9.719426962037647e-05, 'max_features': 0.7281269574419926}. Best is trial 203 with value: 0.6541339470014573.[0m
[32m[I 2022-04-21 11:45:15,345][0m Trial 271 finished with value: 0.5963225891900402 and parameters: {'splitter': 'best', 'min_samples_split': 0.14033244557208413, 'min_samples_leaf': 0.010056929063281813, 'min_weight_fraction_leaf': 0.21561942043383936, 'max_features': 0.679388134527197}. Best is trial 203 with value: 0.6541339470014573.[0m
[32m[I 2022-04-21 11:45:15,949][0m Trial 272 finished with value: 0.6151903571837795 and parameters: {'splitter': 'best', 'min_samples_split': 0.2026688120323465, 'min_samples_leaf': 0.023133685900165096, 'min_weight_fraction_leaf': 0.016857114498047672, 'max_features': 0.6050648334147463}. Best is trial 203 with value: 0.6541339470014573.[0m
