[32m[I 2022-04-21 20:40:46,651][0m Trial 997 finished with value: 0.65 and parameters: {'loss': 'coxph', 'learning_rate': 1.2547559266153227e-06, 'n_estimators': 141, 'criterion': 'squared_error', 'min_samples_split': 2, 'min_samples_leaf': 1, 'min_weight_fraction_leaf': 0.054748570942107194, 'min_impurity_decrease': 0.2914323482014784, 'max_features': 0.19450369515890512, 'subsample': 0.0017917355609720943, 'dropout_rate': 0.7976353989949755, 'ccp_alpha': 0.10139047958753418}. Best is trial 935 with value: 0.8497573035489246.[0m
[32m[I 2022-04-21 20:40:49,090][0m Trial 998 finished with value: 0.8389086036818101 and parameters: {'loss': 'coxph', 'learning_rate': 2.035436996775175e-06, 'n_estimators': 122, 'criterion': 'friedman_mse', 'min_samples_split': 2, 'min_samples_leaf': 1, 'min_weight_fraction_leaf': 0.021380604241856473, 'min_impurity_decrease': 0.2936021108357581, 'max_features': 0.17811979248667703, 'subsample': 0.05285797735070986, 'dropout_rate': 0.8478694289650845, 'ccp_alpha': 0.21084781680550024}. Best is trial 935 with value: 0.8497573035489246.[0m
[32m[I 2022-04-21 20:40:50,745][0m Trial 999 finished with value: 0.8435392070576029 and parameters: {'loss': 'coxph', 'learning_rate': 1.4110674451368758e-06, 'n_estimators': 106, 'criterion': 'friedman_mse', 'min_samples_split': 2, 'min_samples_leaf': 1, 'min_weight_fraction_leaf': 0.04796968603699064, 'min_impurity_decrease': 0.25495653328013707, 'max_features': 0.13452466658533851, 'subsample': 0.01845746801959848, 'dropout_rate': 0.8598067610301372, 'ccp_alpha': 0.10860354561030977}. Best is trial 935 with value: 0.8497573035489246.[0m
[32m[I 2022-04-21 20:40:50,751][0m A new study created in memory with name: no-name-f8372186-b47b-4d5e-8a0d-d9e956a8acd0[0m
/media/san2_ssd/data/Workdir/survival/venv/lib/python3.8/site-packages/sksurv/ensemble/boosting.py:955: RuntimeWarning: divide by zero encountered in log
  time = numpy.log(time)
/media/san2_ssd/data/Workdir/survival/venv/lib/python3.8/site-packages/sksurv/ensemble/boosting.py:955: RuntimeWarning: divide by zero encountered in log
  time = numpy.log(time)
/media/san2_ssd/data/Workdir/survival/venv/lib/python3.8/site-packages/sksurv/ensemble/boosting.py:955: RuntimeWarning: divide by zero encountered in log
  time = numpy.log(time)
/media/san2_ssd/data/Workdir/survival/venv/lib/python3.8/site-packages/sksurv/ensemble/boosting.py:955: RuntimeWarning: divide by zero encountered in log
  time = numpy.log(time)
[32m[I 2022-04-21 20:40:51,157][0m Trial 0 finished with value: -0.7 and parameters: {'loss': 'squared', 'learning_rate': 3.055311919883917e-05, 'n_estimators': 153, 'criterion': 'absolute_error', 'min_samples_split': 9, 'min_samples_leaf': 4, 'min_weight_fraction_leaf': 0.3198852489925918, 'min_impurity_decrease': 0.5718901273880198, 'max_features': 0.12567255576937944, 'subsample': 0.3893110833784079, 'dropout_rate': 0.6925366342773788, 'ccp_alpha': 0.1310947560033205}. Best is trial 0 with value: -0.7.[0m
/media/san2_ssd/data/Workdir/survival/venv/lib/python3.8/site-packages/sksurv/ensemble/boosting.py:955: RuntimeWarning: divide by zero encountered in log
  time = numpy.log(time)
/media/san2_ssd/data/Workdir/survival/venv/lib/python3.8/site-packages/sksurv/ensemble/boosting.py:955: RuntimeWarning: divide by zero encountered in log
  time = numpy.log(time)
/media/san2_ssd/data/Workdir/survival/venv/lib/python3.8/site-packages/sksurv/ensemble/boosting.py:955: RuntimeWarning: divide by zero encountered in log
  time = numpy.log(time)
/media/san2_ssd/data/Workdir/survival/venv/lib/python3.8/site-packages/sksurv/ensemble/boosting.py:955: RuntimeWarning: divide by zero encountered in log
  time = numpy.log(time)
[32m[I 2022-04-21 20:40:57,850][0m Trial 1 finished with value: -0.7 and parameters: {'loss': 'squared', 'learning_rate': 0.0022132103139657633, 'n_estimators': 438, 'criterion': 'absolute_error', 'min_samples_split': 8, 'min_samples_leaf': 5, 'min_weight_fraction_leaf': 0.12240931855491143, 'min_impurity_decrease': 0.087717911145091, 'max_features': 0.9048660825274122, 'subsample': 0.8391711079029115, 'dropout_rate': 0.4765580097228106, 'ccp_alpha': 0.7616648044207582}. Best is trial 0 with value: -0.7.[0m
/media/san2_ssd/data/Workdir/survival/venv/lib/python3.8/site-packages/sksurv/ensemble/boosting.py:955: RuntimeWarning: divide by zero encountered in log
  time = numpy.log(time)
/media/san2_ssd/data/Workdir/survival/venv/lib/python3.8/site-packages/sksurv/ensemble/boosting.py:955: RuntimeWarning: divide by zero encountered in log
  time = numpy.log(time)
/media/san2_ssd/data/Workdir/survival/venv/lib/python3.8/site-packages/sksurv/ensemble/boosting.py:955: RuntimeWarning: divide by zero encountered in log
  time = numpy.log(time)
/media/san2_ssd/data/Workdir/survival/venv/lib/python3.8/site-packages/sksurv/ensemble/boosting.py:955: RuntimeWarning: divide by zero encountered in log
  time = numpy.log(time)
[32m[I 2022-04-21 20:40:59,582][0m Trial 2 finished with value: -0.7 and parameters: {'loss': 'squared', 'learning_rate': 5.171323403489735e-05, 'n_estimators': 212, 'criterion': 'friedman_mse', 'min_samples_split': 10, 'min_samples_leaf': 5, 'min_weight_fraction_leaf': 0.40271879764699536, 'min_impurity_decrease': 0.4476077462092009, 'max_features': 0.02821125374078365, 'subsample': 0.5124643662143998, 'dropout_rate': 0.10021957442997997, 'ccp_alpha': 3.3493035586173843}. Best is trial 0 with value: -0.7.[0m
[32m[I 2022-04-21 20:43:49,433][0m Trial 3 finished with value: 0.5 and parameters: {'loss': 'coxph', 'learning_rate': 0.07285667834116019, 'n_estimators': 791, 'criterion': 'friedman_mse', 'min_samples_split': 7, 'min_samples_leaf': 6, 'min_weight_fraction_leaf': 0.3971979151970702, 'min_impurity_decrease': 0.4577810485249249, 'max_features': 0.8514451247764554, 'subsample': 0.0426438227863944, 'dropout_rate': 0.0188694148803199, 'ccp_alpha': 4.5536760231423346}. Best is trial 3 with value: 0.5.[0m
[32m[I 2022-04-21 20:44:01,213][0m Trial 4 finished with value: 0.5 and parameters: {'loss': 'coxph', 'learning_rate': 0.00010389424101655554, 'n_estimators': 319, 'criterion': 'squared_error', 'min_samples_split': 7, 'min_samples_leaf': 6, 'min_weight_fraction_leaf': 0.15279644911883244, 'min_impurity_decrease': 0.4776195195552936, 'max_features': 0.24139709820054947, 'subsample': 0.06477134374996589, 'dropout_rate': 0.8341865824533901, 'ccp_alpha': 4.330199008980494}. Best is trial 3 with value: 0.5.[0m
/media/san2_ssd/data/Workdir/survival/venv/lib/python3.8/site-packages/sksurv/ensemble/boosting.py:955: RuntimeWarning: divide by zero encountered in log
  time = numpy.log(time)
/media/san2_ssd/data/Workdir/survival/venv/lib/python3.8/site-packages/sksurv/ensemble/boosting.py:955: RuntimeWarning: divide by zero encountered in log
  time = numpy.log(time)
/media/san2_ssd/data/Workdir/survival/venv/lib/python3.8/site-packages/sksurv/ensemble/boosting.py:955: RuntimeWarning: divide by zero encountered in log
  time = numpy.log(time)
/media/san2_ssd/data/Workdir/survival/venv/lib/python3.8/site-packages/sksurv/ensemble/boosting.py:955: RuntimeWarning: divide by zero encountered in log
  time = numpy.log(time)
[32m[I 2022-04-21 20:44:02,474][0m Trial 5 finished with value: -0.7 and parameters: {'loss': 'squared', 'learning_rate': 2.867327453134414e-06, 'n_estimators': 324, 'criterion': 'absolute_error', 'min_samples_split': 3, 'min_samples_leaf': 9, 'min_weight_fraction_leaf': 0.40597975037995604, 'min_impurity_decrease': 0.6170682567291925, 'max_features': 0.94905798527415, 'subsample': 0.47369716447200755, 'dropout_rate': 0.8164085146339787, 'ccp_alpha': 4.047696523809383}. Best is trial 3 with value: 0.5.[0m
/media/san2_ssd/data/Workdir/survival/venv/lib/python3.8/site-packages/sksurv/ensemble/boosting.py:955: RuntimeWarning: divide by zero encountered in log
  time = numpy.log(time)
/media/san2_ssd/data/Workdir/survival/venv/lib/python3.8/site-packages/sksurv/ensemble/boosting.py:955: RuntimeWarning: divide by zero encountered in log
  time = numpy.log(time)
/media/san2_ssd/data/Workdir/survival/venv/lib/python3.8/site-packages/sksurv/ensemble/boosting.py:955: RuntimeWarning: divide by zero encountered in log
  time = numpy.log(time)
/media/san2_ssd/data/Workdir/survival/venv/lib/python3.8/site-packages/sksurv/ensemble/boosting.py:955: RuntimeWarning: divide by zero encountered in log
  time = numpy.log(time)
[32m[I 2022-04-21 20:44:04,477][0m Trial 6 finished with value: -0.7 and parameters: {'loss': 'squared', 'learning_rate': 0.0010833866794286392, 'n_estimators': 203, 'criterion': 'absolute_error', 'min_samples_split': 6, 'min_samples_leaf': 5, 'min_weight_fraction_leaf': 0.28564015847596635, 'min_impurity_decrease': 0.5601201762568416, 'max_features': 0.692824107943079, 'subsample': 0.8489527459905771, 'dropout_rate': 0.3952465540211084, 'ccp_alpha': 1.501523307067723}. Best is trial 3 with value: 0.5.[0m
/media/san2_ssd/data/Workdir/survival/venv/lib/python3.8/site-packages/sksurv/ensemble/boosting.py:955: RuntimeWarning: divide by zero encountered in log
  time = numpy.log(time)
/media/san2_ssd/data/Workdir/survival/venv/lib/python3.8/site-packages/sksurv/ensemble/boosting.py:955: RuntimeWarning: divide by zero encountered in log
  time = numpy.log(time)
/media/san2_ssd/data/Workdir/survival/venv/lib/python3.8/site-packages/sksurv/ensemble/boosting.py:955: RuntimeWarning: divide by zero encountered in log
  time = numpy.log(time)
/media/san2_ssd/data/Workdir/survival/venv/lib/python3.8/site-packages/sksurv/ensemble/boosting.py:955: RuntimeWarning: divide by zero encountered in log
  time = numpy.log(time)
[32m[I 2022-04-21 20:44:38,712][0m Trial 7 finished with value: -0.7 and parameters: {'loss': 'squared', 'learning_rate': 0.0006550884052488634, 'n_estimators': 851, 'criterion': 'squared_error', 'min_samples_split': 4, 'min_samples_leaf': 3, 'min_weight_fraction_leaf': 0.23787240010530195, 'min_impurity_decrease': 0.3086217217291003, 'max_features': 0.927353081398337, 'subsample': 0.9894049644538863, 'dropout_rate': 0.23192297088738756, 'ccp_alpha': 3.315847953270031}. Best is trial 3 with value: 0.5.[0m
/media/san2_ssd/data/Workdir/survival/venv/lib/python3.8/site-packages/sksurv/ensemble/boosting.py:955: RuntimeWarning: divide by zero encountered in log
  time = numpy.log(time)
/media/san2_ssd/data/Workdir/survival/venv/lib/python3.8/site-packages/sksurv/ensemble/boosting.py:955: RuntimeWarning: divide by zero encountered in log
  time = numpy.log(time)
/media/san2_ssd/data/Workdir/survival/venv/lib/python3.8/site-packages/sksurv/ensemble/boosting.py:955: RuntimeWarning: divide by zero encountered in log
  time = numpy.log(time)
/media/san2_ssd/data/Workdir/survival/venv/lib/python3.8/site-packages/sksurv/ensemble/boosting.py:955: RuntimeWarning: divide by zero encountered in log
  time = numpy.log(time)
[32m[I 2022-04-21 20:44:39,804][0m Trial 8 finished with value: -0.7 and parameters: {'loss': 'squared', 'learning_rate': 0.008094506871532433, 'n_estimators': 354, 'criterion': 'absolute_error', 'min_samples_split': 9, 'min_samples_leaf': 8, 'min_weight_fraction_leaf': 0.23197628539431936, 'min_impurity_decrease': 0.8178625523596781, 'max_features': 0.13764971406291382, 'subsample': 0.5314146273982515, 'dropout_rate': 0.9216213426668393, 'ccp_alpha': 4.189597103890413}. Best is trial 3 with value: 0.5.[0m
/media/san2_ssd/data/Workdir/survival/venv/lib/python3.8/site-packages/sksurv/ensemble/boosting.py:955: RuntimeWarning: divide by zero encountered in log
  time = numpy.log(time)
/media/san2_ssd/data/Workdir/survival/venv/lib/python3.8/site-packages/sksurv/ensemble/boosting.py:955: RuntimeWarning: divide by zero encountered in log
  time = numpy.log(time)
/media/san2_ssd/data/Workdir/survival/venv/lib/python3.8/site-packages/sksurv/ensemble/boosting.py:955: RuntimeWarning: divide by zero encountered in log
  time = numpy.log(time)
/media/san2_ssd/data/Workdir/survival/venv/lib/python3.8/site-packages/sksurv/ensemble/boosting.py:955: RuntimeWarning: divide by zero encountered in log
  time = numpy.log(time)
[32m[I 2022-04-21 20:45:25,480][0m Trial 9 finished with value: -0.7 and parameters: {'loss': 'squared', 'learning_rate': 3.4780148226624037e-06, 'n_estimators': 970, 'criterion': 'absolute_error', 'min_samples_split': 10, 'min_samples_leaf': 1, 'min_weight_fraction_leaf': 0.0365215479669577, 'min_impurity_decrease': 0.7322681923563586, 'max_features': 0.4898714726294325, 'subsample': 0.27951705278031574, 'dropout_rate': 0.26043231012573265, 'ccp_alpha': 3.1191663443760653}. Best is trial 3 with value: 0.5.[0m
[32m[I 2022-04-21 20:46:57,786][0m Trial 10 finished with value: 0.5 and parameters: {'loss': 'coxph', 'learning_rate': 0.09670453790030276, 'n_estimators': 569, 'criterion': 'friedman_mse', 'min_samples_split': 5, 'min_samples_leaf': 7, 'min_weight_fraction_leaf': 0.49855582666428644, 'min_impurity_decrease': 0.9247206884474586, 'max_features': 0.6212486746459225, 'subsample': 0.019798979811121893, 'dropout_rate': 0.014012103831830231, 'ccp_alpha': 1.8608972860983717}. Best is trial 3 with value: 0.5.[0m
[32m[I 2022-04-21 20:46:59,167][0m Trial 11 finished with value: 0.5 and parameters: {'loss': 'coxph', 'learning_rate': 0.09152466802503466, 'n_estimators': 102, 'criterion': 'squared_error', 'min_samples_split': 7, 'min_samples_leaf': 7, 'min_weight_fraction_leaf': 0.13414627926996017, 'min_impurity_decrease': 0.28417310115764804, 'max_features': 0.3311016142598931, 'subsample': 0.0010430667780904068, 'dropout_rate': 0.6271749463474565, 'ccp_alpha': 4.9973933695333095}. Best is trial 3 with value: 0.5.[0m
[32m[I 2022-04-21 20:47:10,655][0m Trial 12 finished with value: 0.5 and parameters: {'loss': 'coxph', 'learning_rate': 4.5425204808423963e-05, 'n_estimators': 610, 'criterion': 'squared_error', 'min_samples_split': 7, 'min_samples_leaf': 10, 'min_weight_fraction_leaf': 0.13227966760360998, 'min_impurity_decrease': 0.368668523345833, 'max_features': 0.3426557863183729, 'subsample': 0.15799862304349585, 'dropout_rate': 0.9569612398238956, 'ccp_alpha': 4.735939798264447}. Best is trial 3 with value: 0.5.[0m
[32m[I 2022-04-21 20:47:58,840][0m Trial 13 finished with value: 0.5 and parameters: {'loss': 'coxph', 'learning_rate': 0.00788215115150874, 'n_estimators': 659, 'criterion': 'friedman_mse', 'min_samples_split': 6, 'min_samples_leaf': 7, 'min_weight_fraction_leaf': 0.37649989446538407, 'min_impurity_decrease': 0.10013117636690011, 'max_features': 0.7090797053199969, 'subsample': 0.18432779956505937, 'dropout_rate': 0.6483127914207717, 'ccp_alpha': 4.0786223263944805}. Best is trial 3 with value: 0.5.[0m
[32m[I 2022-04-21 20:48:05,306][0m Trial 14 finished with value: 0.5 and parameters: {'loss': 'coxph', 'learning_rate': 0.00024222875071770627, 'n_estimators': 249, 'criterion': 'squared_error', 'min_samples_split': 2, 'min_samples_leaf': 3, 'min_weight_fraction_leaf': 0.48912036213837334, 'min_impurity_decrease': 0.22143044785583782, 'max_features': 0.3523281968018368, 'subsample': 0.1293036115985677, 'dropout_rate': 0.7874287650387104, 'ccp_alpha': 2.534288526711914}. Best is trial 3 with value: 0.5.[0m
[32m[I 2022-04-21 20:48:42,585][0m Trial 15 finished with value: 0.5 and parameters: {'loss': 'coxph', 'learning_rate': 0.0001804499408625859, 'n_estimators': 454, 'criterion': 'friedman_mse', 'min_samples_split': 7, 'min_samples_leaf': 6, 'min_weight_fraction_leaf': 0.021286671679850877, 'min_impurity_decrease': 0.43200609857843897, 'max_features': 0.805335070445992, 'subsample': 0.29092471961053185, 'dropout_rate': 0.358151854955275, 'ccp_alpha': 4.435742365934702}. Best is trial 3 with value: 0.5.[0m
[32m[I 2022-04-21 20:48:45,766][0m Trial 16 finished with value: 0.5 and parameters: {'loss': 'coxph', 'learning_rate': 0.013647348255506175, 'n_estimators': 146, 'criterion': 'friedman_mse', 'min_samples_split': 5, 'min_samples_leaf': 1, 'min_weight_fraction_leaf': 0.19883140719534306, 'min_impurity_decrease': 0.6833186721589084, 'max_features': 0.4784658204145742, 'subsample': 0.634131130238758, 'dropout_rate': 0.5420699800314187, 'ccp_alpha': 3.6681036320123352}. Best is trial 3 with value: 0.5.[0m
[32m[I 2022-04-21 20:48:55,469][0m Trial 17 finished with value: 0.5 and parameters: {'loss': 'coxph', 'learning_rate': 0.0128097252022279, 'n_estimators': 215, 'criterion': 'squared_error', 'min_samples_split': 2, 'min_samples_leaf': 1, 'min_weight_fraction_leaf': 0.4614784900877982, 'min_impurity_decrease': 0.173415067237718, 'max_features': 0.4847327179932933, 'subsample': 0.6609575694562191, 'dropout_rate': 0.5547975283113495, 'ccp_alpha': 2.3581735582938235}. Best is trial 3 with value: 0.5.[0m
[32m[I 2022-04-21 20:49:29,294][0m Trial 18 finished with value: 0.5 and parameters: {'loss': 'coxph', 'learning_rate': 7.273559643316547e-06, 'n_estimators': 453, 'criterion': 'friedman_mse', 'min_samples_split': 2, 'min_samples_leaf': 2, 'min_weight_fraction_leaf': 0.00906861443526153, 'min_impurity_decrease': 0.011801653027119663, 'max_features': 0.7974780391845597, 'subsample': 0.6321176644113393, 'dropout_rate': 0.3559829226661211, 'ccp_alpha': 2.4632177823247283}. Best is trial 3 with value: 0.5.[0m
[32m[I 2022-04-21 20:49:31,117][0m Trial 19 finished with value: 0.5 and parameters: {'loss': 'coxph', 'learning_rate': 8.273516851901098e-06, 'n_estimators': 101, 'criterion': 'friedman_mse', 'min_samples_split': 4, 'min_samples_leaf': 2, 'min_weight_fraction_leaf': 0.08075961154561484, 'min_impurity_decrease': 0.6360809547802947, 'max_features': 0.5776736136623526, 'subsample': 0.6630003656281941, 'dropout_rate': 0.4825594804922536, 'ccp_alpha': 2.7633169492006946}. Best is trial 3 with value: 0.5.[0m
[32m[I 2022-04-21 20:49:32,570][0m Trial 20 finished with value: 0.5 and parameters: {'loss': 'coxph', 'learning_rate': 1.146074988847258e-05, 'n_estimators': 101, 'criterion': 'squared_error', 'min_samples_split': 3, 'min_samples_leaf': 2, 'min_weight_fraction_leaf': 0.34023324810042177, 'min_impurity_decrease': 0.18162612095296243, 'max_features': 0.597686119035957, 'subsample': 0.7251014704608962, 'dropout_rate': 0.5101203848821141, 'ccp_alpha': 2.4100708504875}. Best is trial 3 with value: 0.5.[0m
[32m[I 2022-04-21 20:50:22,851][0m Trial 21 finished with value: 0.5 and parameters: {'loss': 'coxph', 'learning_rate': 0.028815125927353104, 'n_estimators': 484, 'criterion': 'friedman_mse', 'min_samples_split': 2, 'min_samples_leaf': 2, 'min_weight_fraction_leaf': 0.48216454197071307, 'min_impurity_decrease': 0.9909857617777035, 'max_features': 0.6962394710690902, 'subsample': 0.7700067863036067, 'dropout_rate': 0.1616949222759323, 'ccp_alpha': 1.8567802408528622}. Best is trial 3 with value: 0.5.[0m
[32m[I 2022-04-21 20:51:13,743][0m Trial 22 finished with value: 0.5 and parameters: {'loss': 'coxph', 'learning_rate': 1.3270972825723997e-06, 'n_estimators': 542, 'criterion': 'friedman_mse', 'min_samples_split': 4, 'min_samples_leaf': 3, 'min_weight_fraction_leaf': 0.06780021664803378, 'min_impurity_decrease': 0.9339884868291161, 'max_features': 0.6042578803370061, 'subsample': 0.5916373458170147, 'dropout_rate': 0.35250849471982404, 'ccp_alpha': 1.5716893435581856}. Best is trial 3 with value: 0.5.[0m
[32m[I 2022-04-21 20:51:15,016][0m Trial 23 finished with value: 0.5 and parameters: {'loss': 'coxph', 'learning_rate': 1.5435011094544788e-05, 'n_estimators': 105, 'criterion': 'squared_error', 'min_samples_split': 4, 'min_samples_leaf': 4, 'min_weight_fraction_leaf': 0.18044817963417925, 'min_impurity_decrease': 0.30761729251105474, 'max_features': 0.38722974002680777, 'subsample': 0.7246742685282035, 'dropout_rate': 0.6781649235044858, 'ccp_alpha': 4.96765946836411}. Best is trial 3 with value: 0.5.[0m
[32m[I 2022-04-21 20:51:17,739][0m Trial 24 finished with value: 0.5 and parameters: {'loss': 'coxph', 'learning_rate': 0.035228437307836126, 'n_estimators': 132, 'criterion': 'squared_error', 'min_samples_split': 3, 'min_samples_leaf': 8, 'min_weight_fraction_leaf': 0.3300052594255502, 'min_impurity_decrease': 0.20772683128284775, 'max_features': 0.7074528404729759, 'subsample': 0.8597402801950188, 'dropout_rate': 0.5955540919530254, 'ccp_alpha': 1.9765005423795838}. Best is trial 3 with value: 0.5.[0m
[32m[I 2022-04-21 20:52:41,083][0m Trial 25 finished with value: 0.5 and parameters: {'loss': 'coxph', 'learning_rate': 1.4895012407778892e-06, 'n_estimators': 586, 'criterion': 'friedman_mse', 'min_samples_split': 5, 'min_samples_leaf': 10, 'min_weight_fraction_leaf': 0.07433201463085176, 'min_impurity_decrease': 0.9790418362679434, 'max_features': 0.4088039888906392, 'subsample': 0.4199250632949385, 'dropout_rate': 0.18208018183660796, 'ccp_alpha': 1.0683832752081655}. Best is trial 3 with value: 0.5.[0m
[32m[I 2022-04-21 20:53:03,655][0m Trial 26 finished with value: 0.5 and parameters: {'loss': 'coxph', 'learning_rate': 2.7413070412425795e-05, 'n_estimators': 718, 'criterion': 'squared_error', 'min_samples_split': 4, 'min_samples_leaf': 4, 'min_weight_fraction_leaf': 0.17677808520603477, 'min_impurity_decrease': 0.32741243306458584, 'max_features': 0.29003268304765434, 'subsample': 0.5431050873145338, 'dropout_rate': 0.9350393882372801, 'ccp_alpha': 4.969394990862792}. Best is trial 3 with value: 0.5.[0m
[32m[I 2022-04-21 20:53:05,344][0m Trial 27 finished with value: 0.5 and parameters: {'loss': 'coxph', 'learning_rate': 0.004070595951184921, 'n_estimators': 124, 'criterion': 'squared_error', 'min_samples_split': 3, 'min_samples_leaf': 8, 'min_weight_fraction_leaf': 0.353311138008062, 'min_impurity_decrease': 0.07215657545933812, 'max_features': 0.7258495457055194, 'subsample': 0.9749519741051746, 'dropout_rate': 0.6745662280983089, 'ccp_alpha': 3.780742242121429}. Best is trial 3 with value: 0.5.[0m
