[32m[I 2022-04-22 01:25:35,546][0m Trial 391 finished with value: 0.6714105858316386 and parameters: {'alpha': 3.8670201909247384, 'ties': 'breslow'}. Best is trial 51 with value: 0.6718225721814719.[0m
[32m[I 2022-04-22 01:26:06,203][0m Trial 392 finished with value: 0.6711167223457152 and parameters: {'alpha': 3.6801177237741536, 'ties': 'breslow'}. Best is trial 51 with value: 0.6718225721814719.[0m
[32m[I 2022-04-22 01:26:36,608][0m Trial 393 finished with value: 0.6713323130079433 and parameters: {'alpha': 3.841872656577278, 'ties': 'breslow'}. Best is trial 51 with value: 0.6718225721814719.[0m
[32m[I 2022-04-22 01:27:09,758][0m Trial 394 finished with value: 0.670477785051115 and parameters: {'alpha': 3.0878039854741575, 'ties': 'breslow'}. Best is trial 51 with value: 0.6718225721814719.[0m
[32m[I 2022-04-22 01:27:40,904][0m Trial 395 finished with value: 0.6707310562196291 and parameters: {'alpha': 3.977439077822227, 'ties': 'breslow'}. Best is trial 51 with value: 0.6718225721814719.[0m
[32m[I 2022-04-22 01:28:10,251][0m Trial 396 finished with value: 0.6713605392800839 and parameters: {'alpha': 3.7418342214416054, 'ties': 'breslow'}. Best is trial 51 with value: 0.6718225721814719.[0m
[32m[I 2022-04-22 01:28:40,637][0m Trial 397 finished with value: 0.6703826466407967 and parameters: {'alpha': 4.25260485477975, 'ties': 'breslow'}. Best is trial 51 with value: 0.6718225721814719.[0m
[32m[I 2022-04-22 01:29:12,124][0m Trial 398 finished with value: 0.6709611038444385 and parameters: {'alpha': 3.5870815912347402, 'ties': 'breslow'}. Best is trial 51 with value: 0.6718225721814719.[0m
[32m[I 2022-04-22 01:29:44,280][0m Trial 399 finished with value: 0.6715012772624975 and parameters: {'alpha': 3.800908084667782, 'ties': 'breslow'}. Best is trial 51 with value: 0.6718225721814719.[0m
[32m[I 2022-04-22 01:30:15,141][0m Trial 400 finished with value: 0.6715134091726827 and parameters: {'alpha': 3.7579748066512195, 'ties': 'breslow'}. Best is trial 51 with value: 0.6718225721814719.[0m
[32m[I 2022-04-22 01:30:45,803][0m Trial 401 finished with value: 0.6711724463543013 and parameters: {'alpha': 3.455258422245561, 'ties': 'breslow'}. Best is trial 51 with value: 0.6718225721814719.[0m
[32m[I 2022-04-22 01:31:14,325][0m Trial 402 finished with value: 0.6705709596314063 and parameters: {'alpha': 4.043381941904476, 'ties': 'breslow'}. Best is trial 51 with value: 0.6718225721814719.[0m
[32m[I 2022-04-22 01:31:44,467][0m Trial 403 finished with value: 0.6712563165473625 and parameters: {'alpha': 3.9104214906380683, 'ties': 'breslow'}. Best is trial 51 with value: 0.6718225721814719.[0m
[32m[I 2022-04-22 01:32:15,614][0m Trial 404 finished with value: 0.6709609715374141 and parameters: {'alpha': 3.631813226674833, 'ties': 'breslow'}. Best is trial 51 with value: 0.6718225721814719.[0m
[32m[I 2022-04-22 01:32:46,386][0m Trial 405 finished with value: 0.6714105858316386 and parameters: {'alpha': 3.8574007119495137, 'ties': 'breslow'}. Best is trial 51 with value: 0.6718225721814719.[0m
[32m[I 2022-04-22 01:33:16,473][0m Trial 406 finished with value: 0.6711167223457152 and parameters: {'alpha': 3.6802844199840865, 'ties': 'breslow'}. Best is trial 51 with value: 0.6718225721814719.[0m
[32m[I 2022-04-22 01:33:47,177][0m Trial 407 finished with value: 0.6704630956462883 and parameters: {'alpha': 4.375024096988451, 'ties': 'efron'}. Best is trial 51 with value: 0.6718225721814719.[0m
[32m[I 2022-04-22 01:34:17,687][0m Trial 408 finished with value: 0.6710387141360685 and parameters: {'alpha': 3.5506592220881332, 'ties': 'breslow'}. Best is trial 51 with value: 0.6718225721814719.[0m
[32m[I 2022-04-22 01:34:46,711][0m Trial 409 finished with value: 0.6703459645816847 and parameters: {'alpha': 3.984400863186333, 'ties': 'breslow'}. Best is trial 51 with value: 0.6718225721814719.[0m
[32m[I 2022-04-22 01:35:38,724][0m Trial 410 finished with value: 0.6670031352614979 and parameters: {'alpha': 0.23364000695718534, 'ties': 'breslow'}. Best is trial 51 with value: 0.6718225721814719.[0m
[32m[I 2022-04-22 01:36:08,316][0m Trial 411 finished with value: 0.6702660968597705 and parameters: {'alpha': 4.5111467730980745, 'ties': 'breslow'}. Best is trial 51 with value: 0.6718225721814719.[0m
[32m[I 2022-04-22 01:36:37,853][0m Trial 412 finished with value: 0.6718225721814719 and parameters: {'alpha': 3.7743090692145143, 'ties': 'breslow'}. Best is trial 51 with value: 0.6718225721814719.[0m
[32m[I 2022-04-22 01:37:06,287][0m Trial 413 finished with value: 0.671035170688301 and parameters: {'alpha': 3.6736766390413904, 'ties': 'breslow'}. Best is trial 51 with value: 0.6718225721814719.[0m
[32m[I 2022-04-22 01:37:35,488][0m Trial 414 finished with value: 0.6715012772624975 and parameters: {'alpha': 3.8050576667475955, 'ties': 'breslow'}. Best is trial 51 with value: 0.6718225721814719.[0m
[32m[I 2022-04-22 01:38:03,809][0m Trial 415 finished with value: 0.6712563165473625 and parameters: {'alpha': 3.9061066878522905, 'ties': 'breslow'}. Best is trial 51 with value: 0.6718225721814719.[0m
[32m[I 2022-04-22 01:38:32,520][0m Trial 416 finished with value: 0.6714381495717138 and parameters: {'alpha': 3.7341207766921003, 'ties': 'breslow'}. Best is trial 51 with value: 0.6718225721814719.[0m
[32m[I 2022-04-22 01:39:02,197][0m Trial 417 finished with value: 0.6705615341410874 and parameters: {'alpha': 4.121429903075535, 'ties': 'breslow'}. Best is trial 51 with value: 0.6718225721814719.[0m
[32m[I 2022-04-22 01:39:31,679][0m Trial 418 finished with value: 0.6710385818290442 and parameters: {'alpha': 3.6143776110258394, 'ties': 'breslow'}. Best is trial 51 with value: 0.6718225721814719.[0m
[32m[I 2022-04-22 01:40:01,757][0m Trial 419 finished with value: 0.6714246373157657 and parameters: {'alpha': 3.8126693215484657, 'ties': 'breslow'}. Best is trial 51 with value: 0.6718225721814719.[0m
[32m[I 2022-04-22 01:40:31,383][0m Trial 420 finished with value: 0.6697918724481443 and parameters: {'alpha': 2.824967391439489, 'ties': 'breslow'}. Best is trial 51 with value: 0.6718225721814719.[0m
[32m[I 2022-04-22 01:41:01,028][0m Trial 421 finished with value: 0.6711796766006307 and parameters: {'alpha': 3.928301197126482, 'ties': 'breslow'}. Best is trial 51 with value: 0.6718225721814719.[0m
[32m[I 2022-04-22 01:41:30,020][0m Trial 422 finished with value: 0.6703204352405969 and parameters: {'alpha': 3.3292889827826024, 'ties': 'breslow'}. Best is trial 51 with value: 0.6718225721814719.[0m
[32m[I 2022-04-22 01:42:03,734][0m Trial 423 finished with value: 0.66614061244355 and parameters: {'alpha': 0.9242475312816483, 'ties': 'breslow'}. Best is trial 51 with value: 0.6718225721814719.[0m
[32m[I 2022-04-22 01:42:32,083][0m Trial 424 finished with value: 0.6708528438624721 and parameters: {'alpha': 3.5079976995880013, 'ties': 'breslow'}. Best is trial 51 with value: 0.6718225721814719.[0m
[32m[I 2022-04-22 01:43:04,579][0m Trial 425 finished with value: 0.6691365501306924 and parameters: {'alpha': 2.3705365055564425, 'ties': 'breslow'}. Best is trial 51 with value: 0.6718225721814719.[0m
[32m[I 2022-04-22 01:43:33,594][0m Trial 426 finished with value: 0.6713531867735566 and parameters: {'alpha': 3.726851007123548, 'ties': 'efron'}. Best is trial 51 with value: 0.6718225721814719.[0m
[32m[I 2022-04-22 01:44:02,908][0m Trial 427 finished with value: 0.6698813369874539 and parameters: {'alpha': 4.8324339623478885, 'ties': 'breslow'}. Best is trial 51 with value: 0.6718225721814719.[0m
[32m[I 2022-04-22 01:44:31,317][0m Trial 428 finished with value: 0.6714096154867404 and parameters: {'alpha': 3.8536662488462126, 'ties': 'breslow'}. Best is trial 51 with value: 0.6718225721814719.[0m
[32m[I 2022-04-22 01:44:59,566][0m Trial 429 finished with value: 0.6714352686560117 and parameters: {'alpha': 3.749868062751672, 'ties': 'breslow'}. Best is trial 51 with value: 0.6718225721814719.[0m
[32m[I 2022-04-22 01:45:28,100][0m Trial 430 finished with value: 0.670419017881865 and parameters: {'alpha': 4.01172633988798, 'ties': 'breslow'}. Best is trial 51 with value: 0.6718225721814719.[0m
[32m[I 2022-04-22 01:45:54,576][0m Trial 431 finished with value: 0.670957560396671 and parameters: {'alpha': 3.650972753778638, 'ties': 'breslow'}. Best is trial 51 with value: 0.6718225721814719.[0m
[32m[I 2022-04-22 01:46:24,319][0m Trial 432 finished with value: 0.6714105858316386 and parameters: {'alpha': 3.86556353056889, 'ties': 'breslow'}. Best is trial 51 with value: 0.6718225721814719.[0m
[32m[I 2022-04-22 01:46:52,299][0m Trial 433 finished with value: 0.6710392443611095 and parameters: {'alpha': 3.604247512568435, 'ties': 'breslow'}. Best is trial 51 with value: 0.6718225721814719.[0m
[32m[I 2022-04-22 01:47:21,532][0m Trial 434 finished with value: 0.6716673515982117 and parameters: {'alpha': 3.762925221568542, 'ties': 'breslow'}. Best is trial 51 with value: 0.6718225721814719.[0m
[32m[I 2022-04-22 01:47:50,366][0m Trial 435 finished with value: 0.6716673515982117 and parameters: {'alpha': 3.7664889453053068, 'ties': 'breslow'}. Best is trial 51 with value: 0.6718225721814719.[0m
[32m[I 2022-04-22 01:48:20,186][0m Trial 436 finished with value: 0.6710127541802161 and parameters: {'alpha': 3.439401191849614, 'ties': 'breslow'}. Best is trial 51 with value: 0.6718225721814719.[0m
[32m[I 2022-04-22 01:48:49,059][0m Trial 437 finished with value: 0.6711167223457152 and parameters: {'alpha': 3.6880253401615386, 'ties': 'breslow'}. Best is trial 51 with value: 0.6718225721814719.[0m
[32m[I 2022-04-22 01:49:18,782][0m Trial 438 finished with value: 0.6711145160449266 and parameters: {'alpha': 3.5285923235719845, 'ties': 'breslow'}. Best is trial 51 with value: 0.6718225721814719.[0m
[32m[I 2022-04-22 01:49:48,424][0m Trial 439 finished with value: 0.6716643805773258 and parameters: {'alpha': 3.785610432425077, 'ties': 'breslow'}. Best is trial 51 with value: 0.6718225721814719.[0m
[32m[I 2022-04-22 01:50:14,724][0m Trial 440 finished with value: 0.6708098592683656 and parameters: {'alpha': 3.953311313726402, 'ties': 'breslow'}. Best is trial 51 with value: 0.6718225721814719.[0m
[32m[I 2022-04-22 01:50:44,933][0m Trial 441 finished with value: 0.6707257400948092 and parameters: {'alpha': 4.075180820778896, 'ties': 'breslow'}. Best is trial 51 with value: 0.6718225721814719.[0m
[32m[I 2022-04-22 01:51:14,373][0m Trial 442 finished with value: 0.6714105858316386 and parameters: {'alpha': 3.870754436865692, 'ties': 'breslow'}. Best is trial 51 with value: 0.6718225721814719.[0m
[32m[I 2022-04-22 01:51:43,701][0m Trial 443 finished with value: 0.670957560396671 and parameters: {'alpha': 3.654607150457421, 'ties': 'breslow'}. Best is trial 51 with value: 0.6718225721814719.[0m
[32m[I 2022-04-22 01:52:12,995][0m Trial 444 finished with value: 0.6714381495717138 and parameters: {'alpha': 3.7355443491858313, 'ties': 'breslow'}. Best is trial 51 with value: 0.6718225721814719.[0m
[32m[I 2022-04-22 01:52:41,495][0m Trial 445 finished with value: 0.6709611038444385 and parameters: {'alpha': 3.5677868197569578, 'ties': 'breslow'}. Best is trial 51 with value: 0.6718225721814719.[0m
[32m[I 2022-04-22 01:53:10,835][0m Trial 446 finished with value: 0.6712563165473625 and parameters: {'alpha': 3.9160655711799204, 'ties': 'breslow'}. Best is trial 51 with value: 0.6718225721814719.[0m
[32m[I 2022-04-22 01:53:41,152][0m Trial 447 finished with value: 0.6715012772624975 and parameters: {'alpha': 3.807065850857643, 'ties': 'breslow'}. Best is trial 51 with value: 0.6718225721814719.[0m
[32m[I 2022-04-22 01:54:11,191][0m Trial 448 finished with value: 0.6711167223457152 and parameters: {'alpha': 3.679130475385898, 'ties': 'breslow'}. Best is trial 51 with value: 0.6718225721814719.[0m
[32m[I 2022-04-22 01:54:42,038][0m Trial 449 finished with value: 0.670413702666439 and parameters: {'alpha': 3.9793761139654675, 'ties': 'efron'}. Best is trial 51 with value: 0.6718225721814719.[0m
[32m[I 2022-04-22 01:55:18,490][0m Trial 450 finished with value: 0.666770228664916 and parameters: {'alpha': 1.5960240632660432, 'ties': 'breslow'}. Best is trial 51 with value: 0.6718225721814719.[0m
[32m[I 2022-04-22 01:55:48,583][0m Trial 451 finished with value: 0.6713323130079433 and parameters: {'alpha': 3.845982913763656, 'ties': 'breslow'}. Best is trial 51 with value: 0.6718225721814719.[0m
[32m[I 2022-04-22 01:56:18,545][0m Trial 452 finished with value: 0.6706400725276364 and parameters: {'alpha': 4.168947091226643, 'ties': 'breslow'}. Best is trial 51 with value: 0.6718225721814719.[0m
[32m[I 2022-04-22 01:56:47,555][0m Trial 453 finished with value: 0.6710392443611095 and parameters: {'alpha': 3.6036291686041393, 'ties': 'breslow'}. Best is trial 51 with value: 0.6718225721814719.[0m
[32m[I 2022-04-22 01:57:15,739][0m Trial 454 finished with value: 0.6714381495717138 and parameters: {'alpha': 3.7205851921695157, 'ties': 'breslow'}. Best is trial 51 with value: 0.6718225721814719.[0m
[32m[I 2022-04-22 01:57:45,750][0m Trial 455 finished with value: 0.6716643805773258 and parameters: {'alpha': 3.7841573859116022, 'ties': 'breslow'}. Best is trial 51 with value: 0.6718225721814719.[0m
[32m[I 2022-04-22 01:58:16,016][0m Trial 456 finished with value: 0.6712563165473625 and parameters: {'alpha': 3.912498433171651, 'ties': 'breslow'}. Best is trial 51 with value: 0.6718225721814719.[0m
[32m[I 2022-04-22 01:58:46,351][0m Trial 457 finished with value: 0.6696849069598934 and parameters: {'alpha': 2.608591589136073, 'ties': 'breslow'}. Best is trial 51 with value: 0.6718225721814719.[0m
[32m[I 2022-04-22 01:59:18,030][0m Trial 458 finished with value: 0.6710116979986835 and parameters: {'alpha': 3.5117292614288527, 'ties': 'breslow'}. Best is trial 51 with value: 0.6718225721814719.[0m
[32m[I 2022-04-22 01:59:48,452][0m Trial 459 finished with value: 0.6714381495717138 and parameters: {'alpha': 3.7220278479086533, 'ties': 'breslow'}. Best is trial 51 with value: 0.6718225721814719.[0m
[32m[I 2022-04-22 02:00:18,916][0m Trial 460 finished with value: 0.6713323130079433 and parameters: {'alpha': 3.8449121927101673, 'ties': 'breslow'}. Best is trial 51 with value: 0.6718225721814719.[0m
[32m[I 2022-04-22 02:00:49,241][0m Trial 461 finished with value: 0.6709609715374141 and parameters: {'alpha': 3.6268025624353126, 'ties': 'breslow'}. Best is trial 51 with value: 0.6718225721814719.[0m
[32m[I 2022-04-22 02:01:17,712][0m Trial 462 finished with value: 0.6708098592683656 and parameters: {'alpha': 3.9582500138808387, 'ties': 'breslow'}. Best is trial 51 with value: 0.6718225721814719.[0m
[32m[I 2022-04-22 02:01:48,809][0m Trial 463 finished with value: 0.6707257400948092 and parameters: {'alpha': 4.0612324636940995, 'ties': 'breslow'}. Best is trial 51 with value: 0.6718225721814719.[0m
[32m[I 2022-04-22 02:02:19,425][0m Trial 464 finished with value: 0.6715828289199117 and parameters: {'alpha': 3.78760072380369, 'ties': 'breslow'}. Best is trial 51 with value: 0.6718225721814719.[0m
[32m[I 2022-04-22 02:02:49,731][0m Trial 465 finished with value: 0.6711173848777806 and parameters: {'alpha': 3.6805127146427834, 'ties': 'efron'}. Best is trial 51 with value: 0.6718225721814719.[0m
[32m[I 2022-04-22 02:03:20,233][0m Trial 466 finished with value: 0.6714096154867404 and parameters: {'alpha': 3.8518046629970115, 'ties': 'breslow'}. Best is trial 51 with value: 0.6718225721814719.[0m
[32m[I 2022-04-22 02:03:48,861][0m Trial 467 finished with value: 0.6716673515982117 and parameters: {'alpha': 3.766574611950425, 'ties': 'breslow'}. Best is trial 51 with value: 0.6718225721814719.[0m
[32m[I 2022-04-22 02:04:18,831][0m Trial 468 finished with value: 0.6710908946968871 and parameters: {'alpha': 3.449957056965111, 'ties': 'breslow'}. Best is trial 51 with value: 0.6718225721814719.[0m
[32m[I 2022-04-22 02:04:48,052][0m Trial 469 finished with value: 0.6717410205240577 and parameters: {'alpha': 3.7777104486933455, 'ties': 'breslow'}. Best is trial 51 with value: 0.6718225721814719.[0m
[32m[I 2022-04-22 02:05:17,391][0m Trial 470 finished with value: 0.6711160166148658 and parameters: {'alpha': 3.549205625862725, 'ties': 'breslow'}. Best is trial 51 with value: 0.6718225721814719.[0m
[32m[I 2022-04-22 02:05:47,618][0m Trial 471 finished with value: 0.671035170688301 and parameters: {'alpha': 3.6647974094966322, 'ties': 'breslow'}. Best is trial 51 with value: 0.6718225721814719.[0m
[32m[I 2022-04-22 02:06:17,960][0m Trial 472 finished with value: 0.6711796766006307 and parameters: {'alpha': 3.920723808789244, 'ties': 'breslow'}. Best is trial 51 with value: 0.6718225721814719.[0m
[32m[I 2022-04-22 02:06:47,588][0m Trial 473 finished with value: 0.6716673515982117 and parameters: {'alpha': 3.762009414176857, 'ties': 'breslow'}. Best is trial 51 with value: 0.6718225721814719.[0m
[32m[I 2022-04-22 02:07:17,905][0m Trial 474 finished with value: 0.6714381495717138 and parameters: {'alpha': 3.7284698579125974, 'ties': 'breslow'}. Best is trial 51 with value: 0.6718225721814719.[0m
[32m[I 2022-04-22 02:07:47,839][0m Trial 475 finished with value: 0.6709611038444385 and parameters: {'alpha': 3.585371247241309, 'ties': 'breslow'}. Best is trial 51 with value: 0.6718225721814719.[0m
[32m[I 2022-04-22 02:08:17,266][0m Trial 476 finished with value: 0.6706525112888204 and parameters: {'alpha': 4.030405330720421, 'ties': 'breslow'}. Best is trial 51 with value: 0.6718225721814719.[0m
[32m[I 2022-04-22 02:08:46,908][0m Trial 477 finished with value: 0.6713378682047766 and parameters: {'alpha': 3.8839524350795296, 'ties': 'breslow'}. Best is trial 51 with value: 0.6718225721814719.[0m
[32m[I 2022-04-22 02:09:18,056][0m Trial 478 finished with value: 0.6712758842947594 and parameters: {'alpha': 3.7030233986487997, 'ties': 'breslow'}. Best is trial 51 with value: 0.6718225721814719.[0m
[32m[I 2022-04-22 02:09:49,235][0m Trial 479 finished with value: 0.6715828289199117 and parameters: {'alpha': 3.789892200527787, 'ties': 'breslow'}. Best is trial 51 with value: 0.6718225721814719.[0m
[32m[I 2022-04-22 02:10:20,102][0m Trial 480 finished with value: 0.6710392443611095 and parameters: {'alpha': 3.6036327564428317, 'ties': 'breslow'}. Best is trial 51 with value: 0.6718225721814719.[0m
[32m[I 2022-04-22 02:10:50,497][0m Trial 481 finished with value: 0.6710078424695338 and parameters: {'alpha': 3.4113368608923453, 'ties': 'breslow'}. Best is trial 51 with value: 0.6718225721814719.[0m
[32m[I 2022-04-22 02:11:21,024][0m Trial 482 finished with value: 0.6713323130079433 and parameters: {'alpha': 3.8415879391995125, 'ties': 'breslow'}. Best is trial 51 with value: 0.6718225721814719.[0m
[32m[I 2022-04-22 02:11:53,462][0m Trial 483 finished with value: 0.6714381495717138 and parameters: {'alpha': 3.7309166554155087, 'ties': 'breslow'}. Best is trial 51 with value: 0.6718225721814719.[0m
[32m[I 2022-04-22 02:12:23,925][0m Trial 484 finished with value: 0.6703459645816847 and parameters: {'alpha': 3.9833057406624315, 'ties': 'breslow'}. Best is trial 51 with value: 0.6718225721814719.[0m
[32m[I 2022-04-22 02:12:54,086][0m Trial 485 finished with value: 0.6712716351161425 and parameters: {'alpha': 3.629421404717907, 'ties': 'efron'}. Best is trial 51 with value: 0.6718225721814719.[0m
[32m[I 2022-04-22 02:13:24,830][0m Trial 486 finished with value: 0.6714096154867404 and parameters: {'alpha': 3.85184453193524, 'ties': 'breslow'}. Best is trial 51 with value: 0.6718225721814719.[0m
[32m[I 2022-04-22 02:13:54,549][0m Trial 487 finished with value: 0.6711160166148658 and parameters: {'alpha': 3.548692316809377, 'ties': 'breslow'}. Best is trial 51 with value: 0.6718225721814719.[0m
[32m[I 2022-04-22 02:14:23,957][0m Trial 488 finished with value: 0.6713571281393407 and parameters: {'alpha': 3.748719008597249, 'ties': 'breslow'}. Best is trial 51 with value: 0.6718225721814719.[0m
[32m[I 2022-04-22 02:14:53,079][0m Trial 489 finished with value: 0.6711932683344413 and parameters: {'alpha': 3.930360785220943, 'ties': 'breslow'}. Best is trial 51 with value: 0.6718225721814719.[0m
[32m[I 2022-04-22 02:15:21,921][0m Trial 490 finished with value: 0.671035170688301 and parameters: {'alpha': 3.6680633722618743, 'ties': 'breslow'}. Best is trial 51 with value: 0.6718225721814719.[0m
[32m[I 2022-04-22 02:15:51,174][0m Trial 491 finished with value: 0.6702357032298804 and parameters: {'alpha': 3.207760962193761, 'ties': 'breslow'}. Best is trial 51 with value: 0.6718225721814719.[0m
[32m[I 2022-04-22 02:16:20,007][0m Trial 492 finished with value: 0.6705615341410874 and parameters: {'alpha': 4.120737416928518, 'ties': 'breslow'}. Best is trial 51 with value: 0.6718225721814719.[0m
[32m[I 2022-04-22 02:16:47,559][0m Trial 493 finished with value: 0.6712618418137702 and parameters: {'alpha': 3.8311004344453274, 'ties': 'breslow'}. Best is trial 51 with value: 0.6718225721814719.[0m
[32m[I 2022-04-22 02:17:17,061][0m Trial 494 finished with value: 0.6709366444585252 and parameters: {'alpha': 3.4762841449445983, 'ties': 'breslow'}. Best is trial 51 with value: 0.6718225721814719.[0m
[32m[I 2022-04-22 02:17:45,530][0m Trial 495 finished with value: 0.6713605392800839 and parameters: {'alpha': 3.7405668792953075, 'ties': 'breslow'}. Best is trial 51 with value: 0.6718225721814719.[0m
[32m[I 2022-04-22 02:18:14,061][0m Trial 496 finished with value: 0.670419017881865 and parameters: {'alpha': 4.012843051591115, 'ties': 'breslow'}. Best is trial 51 with value: 0.6718225721814719.[0m
[32m[I 2022-04-22 02:18:41,287][0m Trial 497 finished with value: 0.671035170688301 and parameters: {'alpha': 3.6729012614960546, 'ties': 'breslow'}. Best is trial 51 with value: 0.6718225721814719.[0m
