[32m[I 2022-04-21 20:54:14,572][0m Trial 28 finished with value: 0.5 and parameters: {'loss': 'coxph', 'learning_rate': 0.02974336117007384, 'n_estimators': 638, 'criterion': 'friedman_mse', 'min_samples_split': 6, 'min_samples_leaf': 10, 'min_weight_fraction_leaf': 0.28666974108288856, 'min_impurity_decrease': 0.1327530423157891, 'max_features': 0.7603126265605389, 'subsample': 0.29782388248935576, 'dropout_rate': 0.600083268751058, 'ccp_alpha': 0.8687788296889621}. Best is trial 3 with value: 0.5.[0m
[32m[I 2022-04-21 20:54:22,213][0m Trial 29 finished with value: 0.6232232833521446 and parameters: {'loss': 'coxph', 'learning_rate': 0.0004223905151759266, 'n_estimators': 257, 'criterion': 'squared_error', 'min_samples_split': 5, 'min_samples_leaf': 4, 'min_weight_fraction_leaf': 0.09277315165279085, 'min_impurity_decrease': 0.2543622308383631, 'max_features': 0.2477059059314872, 'subsample': 0.4196157114974929, 'dropout_rate': 0.7567619406090648, 'ccp_alpha': 0.17317769172342112}. Best is trial 29 with value: 0.6232232833521446.[0m
[32m[I 2022-04-21 20:54:25,184][0m Trial 30 finished with value: 0.5 and parameters: {'loss': 'coxph', 'learning_rate': 0.0016292617326180048, 'n_estimators': 176, 'criterion': 'squared_error', 'min_samples_split': 3, 'min_samples_leaf': 4, 'min_weight_fraction_leaf': 0.28096764158027443, 'min_impurity_decrease': 0.01306945513263967, 'max_features': 0.24399192124841784, 'subsample': 0.9548018586078811, 'dropout_rate': 0.7341001799916289, 'ccp_alpha': 3.674698636744199}. Best is trial 29 with value: 0.6232232833521446.[0m
[32m[I 2022-04-21 20:54:37,703][0m Trial 31 finished with value: 0.6645282883055869 and parameters: {'loss': 'coxph', 'learning_rate': 0.00020068375219746155, 'n_estimators': 388, 'criterion': 'friedman_mse', 'min_samples_split': 6, 'min_samples_leaf': 9, 'min_weight_fraction_leaf': 0.2822358462980416, 'min_impurity_decrease': 0.10332693864751982, 'max_features': 0.800114933251032, 'subsample': 0.318319559576345, 'dropout_rate': 0.7430950017650552, 'ccp_alpha': 0.22914983521553667}. Best is trial 31 with value: 0.6645282883055869.[0m
[32m[I 2022-04-21 20:54:44,436][0m Trial 32 finished with value: 0.6842082681032632 and parameters: {'loss': 'coxph', 'learning_rate': 0.0041055689050327505, 'n_estimators': 253, 'criterion': 'friedman_mse', 'min_samples_split': 6, 'min_samples_leaf': 9, 'min_weight_fraction_leaf': 0.2897849493669591, 'min_impurity_decrease': 0.10122544514444032, 'max_features': 0.7820766249150315, 'subsample': 0.3215423992777705, 'dropout_rate': 0.704632461004615, 'ccp_alpha': 0.04003678498304222}. Best is trial 32 with value: 0.6842082681032632.[0m
[32m[I 2022-04-21 20:54:49,792][0m Trial 33 finished with value: 0.6842082681032632 and parameters: {'loss': 'coxph', 'learning_rate': 0.0006102078259821121, 'n_estimators': 259, 'criterion': 'squared_error', 'min_samples_split': 8, 'min_samples_leaf': 9, 'min_weight_fraction_leaf': 0.27054165448781725, 'min_impurity_decrease': 0.010277453181874507, 'max_features': 0.14497181980079765, 'subsample': 0.37027481307027854, 'dropout_rate': 0.7545393330331572, 'ccp_alpha': 0.04733639468877326}. Best is trial 32 with value: 0.6842082681032632.[0m
[32m[I 2022-04-21 20:54:59,914][0m Trial 34 finished with value: 0.6819977577625689 and parameters: {'loss': 'coxph', 'learning_rate': 0.0005339715368776829, 'n_estimators': 274, 'criterion': 'friedman_mse', 'min_samples_split': 8, 'min_samples_leaf': 9, 'min_weight_fraction_leaf': 0.259027849368727, 'min_impurity_decrease': 0.060334202861247695, 'max_features': 0.050217973484721956, 'subsample': 0.3584285728155255, 'dropout_rate': 0.7507975086903268, 'ccp_alpha': 0.013639791644034845}. Best is trial 32 with value: 0.6842082681032632.[0m
[32m[I 2022-04-21 20:55:09,255][0m Trial 35 finished with value: 0.6819977577625689 and parameters: {'loss': 'coxph', 'learning_rate': 0.002401736833036316, 'n_estimators': 376, 'criterion': 'friedman_mse', 'min_samples_split': 8, 'min_samples_leaf': 9, 'min_weight_fraction_leaf': 0.26169446155020215, 'min_impurity_decrease': 0.04990782484937062, 'max_features': 0.02926564461689446, 'subsample': 0.3687249883457441, 'dropout_rate': 0.8755914720194031, 'ccp_alpha': 0.03311767923687414}. Best is trial 32 with value: 0.6842082681032632.[0m
[32m[I 2022-04-21 20:55:14,925][0m Trial 36 finished with value: 0.5 and parameters: {'loss': 'coxph', 'learning_rate': 0.002947076412078482, 'n_estimators': 279, 'criterion': 'friedman_mse', 'min_samples_split': 8, 'min_samples_leaf': 9, 'min_weight_fraction_leaf': 0.21315204105399405, 'min_impurity_decrease': 0.041642090484692196, 'max_features': 0.005979314341059718, 'subsample': 0.37360736281017976, 'dropout_rate': 0.8723786289261527, 'ccp_alpha': 0.6061466883385911}. Best is trial 32 with value: 0.6842082681032632.[0m
/media/san2_ssd/data/Workdir/survival/venv/lib/python3.8/site-packages/sksurv/ensemble/boosting.py:955: RuntimeWarning: divide by zero encountered in log
  time = numpy.log(time)
/media/san2_ssd/data/Workdir/survival/venv/lib/python3.8/site-packages/sksurv/ensemble/boosting.py:955: RuntimeWarning: divide by zero encountered in log
  time = numpy.log(time)
/media/san2_ssd/data/Workdir/survival/venv/lib/python3.8/site-packages/sksurv/ensemble/boosting.py:955: RuntimeWarning: divide by zero encountered in log
  time = numpy.log(time)
/media/san2_ssd/data/Workdir/survival/venv/lib/python3.8/site-packages/sksurv/ensemble/boosting.py:955: RuntimeWarning: divide by zero encountered in log
  time = numpy.log(time)
[32m[I 2022-04-21 20:55:15,528][0m Trial 37 finished with value: -0.7309394300370865 and parameters: {'loss': 'squared', 'learning_rate': 0.0007661599852314963, 'n_estimators': 285, 'criterion': 'friedman_mse', 'min_samples_split': 8, 'min_samples_leaf': 9, 'min_weight_fraction_leaf': 0.2588991754633513, 'min_impurity_decrease': 0.14879918156038424, 'max_features': 0.07869876012272407, 'subsample': 0.22899339419646267, 'dropout_rate': 0.9935693683471458, 'ccp_alpha': 0.5555380313173481}. Best is trial 32 with value: 0.6842082681032632.[0m
[32m[I 2022-04-21 20:55:26,769][0m Trial 38 finished with value: 0.6837472988064728 and parameters: {'loss': 'coxph', 'learning_rate': 9.649454579714475e-05, 'n_estimators': 378, 'criterion': 'friedman_mse', 'min_samples_split': 9, 'min_samples_leaf': 8, 'min_weight_fraction_leaf': 0.31284112794130464, 'min_impurity_decrease': 0.06178917260821633, 'max_features': 0.1526624070273192, 'subsample': 0.37600732738711773, 'dropout_rate': 0.8452255327562638, 'ccp_alpha': 0.05268148065562737}. Best is trial 32 with value: 0.6842082681032632.[0m
/media/san2_ssd/data/Workdir/survival/venv/lib/python3.8/site-packages/sksurv/ensemble/boosting.py:955: RuntimeWarning: divide by zero encountered in log
  time = numpy.log(time)
/media/san2_ssd/data/Workdir/survival/venv/lib/python3.8/site-packages/sksurv/ensemble/boosting.py:955: RuntimeWarning: divide by zero encountered in log
  time = numpy.log(time)
/media/san2_ssd/data/Workdir/survival/venv/lib/python3.8/site-packages/sksurv/ensemble/boosting.py:955: RuntimeWarning: divide by zero encountered in log
  time = numpy.log(time)
/media/san2_ssd/data/Workdir/survival/venv/lib/python3.8/site-packages/sksurv/ensemble/boosting.py:955: RuntimeWarning: divide by zero encountered in log
  time = numpy.log(time)
[32m[I 2022-04-21 20:55:28,743][0m Trial 39 finished with value: -0.7197331818019252 and parameters: {'loss': 'squared', 'learning_rate': 0.0013910035781869454, 'n_estimators': 391, 'criterion': 'absolute_error', 'min_samples_split': 9, 'min_samples_leaf': 8, 'min_weight_fraction_leaf': 0.3067475875785654, 'min_impurity_decrease': 0.005572419215087193, 'max_features': 0.15635802168203192, 'subsample': 0.46625258708950007, 'dropout_rate': 0.8692841151697187, 'ccp_alpha': 0.42213119313091907}. Best is trial 32 with value: 0.6842082681032632.[0m
[32m[I 2022-04-21 20:55:31,975][0m Trial 40 finished with value: 0.5 and parameters: {'loss': 'coxph', 'learning_rate': 0.00010076390796226619, 'n_estimators': 218, 'criterion': 'friedman_mse', 'min_samples_split': 10, 'min_samples_leaf': 10, 'min_weight_fraction_leaf': 0.31920053942364435, 'min_impurity_decrease': 0.10248347074851595, 'max_features': 0.17084342481675957, 'subsample': 0.10437993337705781, 'dropout_rate': 0.8521643092119342, 'ccp_alpha': 1.1879902526044248}. Best is trial 32 with value: 0.6842082681032632.[0m
[32m[I 2022-04-21 20:55:39,687][0m Trial 41 finished with value: 0.6819977577625689 and parameters: {'loss': 'coxph', 'learning_rate': 0.00047529092404052884, 'n_estimators': 324, 'criterion': 'friedman_mse', 'min_samples_split': 8, 'min_samples_leaf': 9, 'min_weight_fraction_leaf': 0.2560899383584591, 'min_impurity_decrease': 0.058169869629877566, 'max_features': 0.09566027381876024, 'subsample': 0.3584755947484521, 'dropout_rate': 0.7982687330668262, 'ccp_alpha': 0.023349099873204725}. Best is trial 32 with value: 0.6842082681032632.[0m
[32m[I 2022-04-21 20:55:47,672][0m Trial 42 finished with value: 0.6319698677428901 and parameters: {'loss': 'coxph', 'learning_rate': 9.382015567847007e-05, 'n_estimators': 321, 'criterion': 'friedman_mse', 'min_samples_split': 9, 'min_samples_leaf': 8, 'min_weight_fraction_leaf': 0.2358734486017984, 'min_impurity_decrease': 0.13727394946761495, 'max_features': 0.09172801395240082, 'subsample': 0.23481079701336072, 'dropout_rate': 0.8161646645881722, 'ccp_alpha': 0.35482358160054217}. Best is trial 32 with value: 0.6842082681032632.[0m
[32m[I 2022-04-21 20:55:49,689][0m Trial 43 finished with value: 0.6530782674142787 and parameters: {'loss': 'coxph', 'learning_rate': 0.004082886854801096, 'n_estimators': 182, 'criterion': 'friedman_mse', 'min_samples_split': 9, 'min_samples_leaf': 9, 'min_weight_fraction_leaf': 0.36620140561246595, 'min_impurity_decrease': 0.05305675308393897, 'max_features': 0.041071236766325306, 'subsample': 0.4615990824785885, 'dropout_rate': 0.902281553510408, 'ccp_alpha': 0.04445874517072383}. Best is trial 32 with value: 0.6842082681032632.[0m
/media/san2_ssd/data/Workdir/survival/venv/lib/python3.8/site-packages/sksurv/ensemble/boosting.py:955: RuntimeWarning: divide by zero encountered in log
  time = numpy.log(time)
/media/san2_ssd/data/Workdir/survival/venv/lib/python3.8/site-packages/sksurv/ensemble/boosting.py:955: RuntimeWarning: divide by zero encountered in log
  time = numpy.log(time)
/media/san2_ssd/data/Workdir/survival/venv/lib/python3.8/site-packages/sksurv/ensemble/boosting.py:955: RuntimeWarning: divide by zero encountered in log
  time = numpy.log(time)
/media/san2_ssd/data/Workdir/survival/venv/lib/python3.8/site-packages/sksurv/ensemble/boosting.py:955: RuntimeWarning: divide by zero encountered in log
  time = numpy.log(time)
[32m[I 2022-04-21 20:55:51,095][0m Trial 44 finished with value: -0.7 and parameters: {'loss': 'squared', 'learning_rate': 0.0009345950932970211, 'n_estimators': 345, 'criterion': 'absolute_error', 'min_samples_split': 8, 'min_samples_leaf': 9, 'min_weight_fraction_leaf': 0.29902621852456773, 'min_impurity_decrease': 0.2465843464487951, 'max_features': 0.989328850430953, 'subsample': 0.3432138938403529, 'dropout_rate': 0.8054294939953169, 'ccp_alpha': 0.765433740265541}. Best is trial 32 with value: 0.6842082681032632.[0m
[32m[I 2022-04-21 20:55:56,973][0m Trial 45 finished with value: 0.6237907883092254 and parameters: {'loss': 'coxph', 'learning_rate': 0.00217229557773362, 'n_estimators': 245, 'criterion': 'friedman_mse', 'min_samples_split': 8, 'min_samples_leaf': 7, 'min_weight_fraction_leaf': 0.21253277621675756, 'min_impurity_decrease': 0.09169397750151898, 'max_features': 0.1835932505558397, 'subsample': 0.2444116119130219, 'dropout_rate': 0.7049741904330421, 'ccp_alpha': 0.3481144239602748}. Best is trial 32 with value: 0.6842082681032632.[0m
[32m[I 2022-04-21 20:56:01,248][0m Trial 46 finished with value: 0.5 and parameters: {'loss': 'coxph', 'learning_rate': 0.00029296531023650143, 'n_estimators': 377, 'criterion': 'friedman_mse', 'min_samples_split': 10, 'min_samples_leaf': 10, 'min_weight_fraction_leaf': 0.409525961000202, 'min_impurity_decrease': 0.0012502406298786628, 'max_features': 0.10621587988015195, 'subsample': 0.43678069410357434, 'dropout_rate': 0.9827243693342649, 'ccp_alpha': 1.0102038586974458}. Best is trial 32 with value: 0.6842082681032632.[0m
[32m[I 2022-04-21 20:56:08,569][0m Trial 47 finished with value: 0.5 and parameters: {'loss': 'coxph', 'learning_rate': 5.1179439524470787e-05, 'n_estimators': 308, 'criterion': 'friedman_mse', 'min_samples_split': 7, 'min_samples_leaf': 8, 'min_weight_fraction_leaf': 0.25948591782133895, 'min_impurity_decrease': 0.17560313797174126, 'max_features': 0.1807868324063824, 'subsample': 0.3860163635280726, 'dropout_rate': 0.7855504126146622, 'ccp_alpha': 0.4986520461022473}. Best is trial 32 with value: 0.6842082681032632.[0m
/media/san2_ssd/data/Workdir/survival/venv/lib/python3.8/site-packages/sksurv/ensemble/boosting.py:955: RuntimeWarning: divide by zero encountered in log
  time = numpy.log(time)
/media/san2_ssd/data/Workdir/survival/venv/lib/python3.8/site-packages/sksurv/ensemble/boosting.py:955: RuntimeWarning: divide by zero encountered in log
  time = numpy.log(time)
/media/san2_ssd/data/Workdir/survival/venv/lib/python3.8/site-packages/sksurv/ensemble/boosting.py:955: RuntimeWarning: divide by zero encountered in log
  time = numpy.log(time)
/media/san2_ssd/data/Workdir/survival/venv/lib/python3.8/site-packages/sksurv/ensemble/boosting.py:955: RuntimeWarning: divide by zero encountered in log
  time = numpy.log(time)
[32m[I 2022-04-21 20:56:12,209][0m Trial 48 finished with value: -0.7 and parameters: {'loss': 'squared', 'learning_rate': 0.00013954402505628484, 'n_estimators': 416, 'criterion': 'absolute_error', 'min_samples_split': 9, 'min_samples_leaf': 9, 'min_weight_fraction_leaf': 0.30996336698919835, 'min_impurity_decrease': 0.046031413649252506, 'max_features': 0.8856904018786144, 'subsample': 0.19231489491254053, 'dropout_rate': 0.8958801618947437, 'ccp_alpha': 1.3436719540147923}. Best is trial 32 with value: 0.6842082681032632.[0m
[32m[I 2022-04-21 20:56:38,879][0m Trial 49 finished with value: 0.6789573650170684 and parameters: {'loss': 'coxph', 'learning_rate': 0.0004138833656038426, 'n_estimators': 499, 'criterion': 'friedman_mse', 'min_samples_split': 7, 'min_samples_leaf': 8, 'min_weight_fraction_leaf': 0.2194560410957249, 'min_impurity_decrease': 0.3825001848448882, 'max_features': 0.21775548664959837, 'subsample': 0.5050081291435149, 'dropout_rate': 0.7099113813797299, 'ccp_alpha': 0.006113501688574975}. Best is trial 32 with value: 0.6842082681032632.[0m
[32m[I 2022-04-21 20:56:49,112][0m Trial 50 finished with value: 0.5 and parameters: {'loss': 'coxph', 'learning_rate': 0.005354510378288924, 'n_estimators': 288, 'criterion': 'friedman_mse', 'min_samples_split': 8, 'min_samples_leaf': 7, 'min_weight_fraction_leaf': 0.2635509013595928, 'min_impurity_decrease': 0.5625697770314406, 'max_features': 0.0278807181446069, 'subsample': 0.3240347751479459, 'dropout_rate': 0.8392996479194974, 'ccp_alpha': 0.6814286565652509}. Best is trial 32 with value: 0.6842082681032632.[0m
[32m[I 2022-04-21 20:56:53,444][0m Trial 51 finished with value: 0.6636900948801576 and parameters: {'loss': 'coxph', 'learning_rate': 0.0005213686440271118, 'n_estimators': 231, 'criterion': 'friedman_mse', 'min_samples_split': 8, 'min_samples_leaf': 9, 'min_weight_fraction_leaf': 0.2473381810357225, 'min_impurity_decrease': 0.06767768754794412, 'max_features': 0.0735739781426972, 'subsample': 0.37922475081761875, 'dropout_rate': 0.7667670743163475, 'ccp_alpha': 0.1864996640089571}. Best is trial 32 with value: 0.6842082681032632.[0m
[32m[I 2022-04-21 20:57:05,040][0m Trial 52 finished with value: 0.6842082681032632 and parameters: {'loss': 'coxph', 'learning_rate': 0.0007852583096456787, 'n_estimators': 342, 'criterion': 'friedman_mse', 'min_samples_split': 8, 'min_samples_leaf': 10, 'min_weight_fraction_leaf': 0.2707802097882326, 'min_impurity_decrease': 0.12386347696136543, 'max_features': 0.12392525775856716, 'subsample': 0.3449363022047345, 'dropout_rate': 0.6541278883764983, 'ccp_alpha': 0.020387840586417093}. Best is trial 32 with value: 0.6842082681032632.[0m
[32m[I 2022-04-21 20:57:10,406][0m Trial 53 finished with value: 0.6169002832546728 and parameters: {'loss': 'coxph', 'learning_rate': 0.002008314054437818, 'n_estimators': 186, 'criterion': 'friedman_mse', 'min_samples_split': 7, 'min_samples_leaf': 10, 'min_weight_fraction_leaf': 0.2785690252881995, 'min_impurity_decrease': 0.15495413856973184, 'max_features': 0.12176539549643947, 'subsample': 0.26639883114954355, 'dropout_rate': 0.6207870568488608, 'ccp_alpha': 0.33051346576661894}. Best is trial 32 with value: 0.6842082681032632.[0m
[32m[I 2022-04-21 20:57:17,867][0m Trial 54 finished with value: 0.5 and parameters: {'loss': 'coxph', 'learning_rate': 0.0011149719607269242, 'n_estimators': 267, 'criterion': 'friedman_mse', 'min_samples_split': 9, 'min_samples_leaf': 10, 'min_weight_fraction_leaf': 0.33558023615787014, 'min_impurity_decrease': 0.10567603528771949, 'max_features': 0.28803177606027197, 'subsample': 0.3314955982762499, 'dropout_rate': 0.6548401343565382, 'ccp_alpha': 0.8383030127654457}. Best is trial 32 with value: 0.6842082681032632.[0m
[32m[I 2022-04-21 20:57:27,888][0m Trial 55 finished with value: 0.6636900948801576 and parameters: {'loss': 'coxph', 'learning_rate': 0.0005876364464949451, 'n_estimators': 334, 'criterion': 'friedman_mse', 'min_samples_split': 10, 'min_samples_leaf': 10, 'min_weight_fraction_leaf': 0.18892195592307903, 'min_impurity_decrease': 0.5146231811401375, 'max_features': 0.1356032081070567, 'subsample': 0.5470783543830906, 'dropout_rate': 0.7176248324096677, 'ccp_alpha': 0.17433265015871147}. Best is trial 32 with value: 0.6842082681032632.[0m
[32m[I 2022-04-21 20:57:46,875][0m Trial 56 finished with value: 0.5 and parameters: {'loss': 'coxph', 'learning_rate': 0.008796510491293989, 'n_estimators': 311, 'criterion': 'friedman_mse', 'min_samples_split': 6, 'min_samples_leaf': 6, 'min_weight_fraction_leaf': 0.15398318441452163, 'min_impurity_decrease': 0.21570708611687872, 'max_features': 0.19886807198215806, 'subsample': 0.4248591610348087, 'dropout_rate': 0.4227260746690815, 'ccp_alpha': 0.5847355017527756}. Best is trial 32 with value: 0.6842082681032632.[0m
[32m[I 2022-04-21 20:57:52,366][0m Trial 57 finished with value: 0.5 and parameters: {'loss': 'coxph', 'learning_rate': 7.121868064746155e-05, 'n_estimators': 196, 'criterion': 'absolute_error', 'min_samples_split': 7, 'min_samples_leaf': 9, 'min_weight_fraction_leaf': 0.3896702147539348, 'min_impurity_decrease': 0.13083236142040366, 'max_features': 0.535876844134731, 'subsample': 0.273869283780872, 'dropout_rate': 0.5674675483842486, 'ccp_alpha': 0.33274148635528183}. Best is trial 32 with value: 0.6842082681032632.[0m
/media/san2_ssd/data/Workdir/survival/venv/lib/python3.8/site-packages/sksurv/ensemble/boosting.py:955: RuntimeWarning: divide by zero encountered in log
  time = numpy.log(time)
/media/san2_ssd/data/Workdir/survival/venv/lib/python3.8/site-packages/sksurv/ensemble/boosting.py:955: RuntimeWarning: divide by zero encountered in log
  time = numpy.log(time)
/media/san2_ssd/data/Workdir/survival/venv/lib/python3.8/site-packages/sksurv/ensemble/boosting.py:955: RuntimeWarning: divide by zero encountered in log
  time = numpy.log(time)
/media/san2_ssd/data/Workdir/survival/venv/lib/python3.8/site-packages/sksurv/ensemble/boosting.py:955: RuntimeWarning: divide by zero encountered in log
  time = numpy.log(time)
[32m[I 2022-04-21 20:57:53,310][0m Trial 58 finished with value: -0.7297033464820903 and parameters: {'loss': 'squared', 'learning_rate': 0.0027523188132774806, 'n_estimators': 360, 'criterion': 'friedman_mse', 'min_samples_split': 9, 'min_samples_leaf': 9, 'min_weight_fraction_leaf': 0.23521371745753158, 'min_impurity_decrease': 0.02947523797867206, 'max_features': 0.05307158219557617, 'subsample': 0.1893366951161958, 'dropout_rate': 0.9440438153726805, 'ccp_alpha': 0.022982400254644264}. Best is trial 32 with value: 0.6842082681032632.[0m
[32m[I 2022-04-21 20:58:09,995][0m Trial 59 finished with value: 0.6636900948801576 and parameters: {'loss': 'coxph', 'learning_rate': 0.00031902558332277394, 'n_estimators': 421, 'criterion': 'friedman_mse', 'min_samples_split': 7, 'min_samples_leaf': 7, 'min_weight_fraction_leaf': 0.30135572700708824, 'min_impurity_decrease': 0.18943681254334033, 'max_features': 0.6519903117788688, 'subsample': 0.40627041687548043, 'dropout_rate': 0.8299352762581398, 'ccp_alpha': 0.2282439320848246}. Best is trial 32 with value: 0.6842082681032632.[0m
[32m[I 2022-04-21 20:58:14,349][0m Trial 60 finished with value: 0.5 and parameters: {'loss': 'coxph', 'learning_rate': 2.7605646277246103e-05, 'n_estimators': 240, 'criterion': 'squared_error', 'min_samples_split': 8, 'min_samples_leaf': 8, 'min_weight_fraction_leaf': 0.27160309409796934, 'min_impurity_decrease': 0.8117556074698601, 'max_features': 0.4438414053480044, 'subsample': 0.4685721997944828, 'dropout_rate': 0.7944148872431397, 'ccp_alpha': 0.9469076812552857}. Best is trial 32 with value: 0.6842082681032632.[0m
[32m[I 2022-04-21 20:58:21,431][0m Trial 61 finished with value: 0.6758731102664459 and parameters: {'loss': 'coxph', 'learning_rate': 0.00015129131731193274, 'n_estimators': 294, 'criterion': 'friedman_mse', 'min_samples_split': 8, 'min_samples_leaf': 10, 'min_weight_fraction_leaf': 0.2501495996217658, 'min_impurity_decrease': 0.06492773116909539, 'max_features': 0.05611403951509465, 'subsample': 0.3801366709654122, 'dropout_rate': 0.7597967933158896, 'ccp_alpha': 0.014712713988088558}. Best is trial 32 with value: 0.6842082681032632.[0m
