[32m[I 2022-04-22 00:38:41,558][0m Trial 657 finished with value: 0.6888544885995797 and parameters: {'loss': 'coxph', 'learning_rate': 3.505143675110887e-05, 'n_estimators': 367, 'criterion': 'squared_error', 'min_samples_split': 7, 'min_samples_leaf': 10, 'min_weight_fraction_leaf': 0.18247074629497892, 'min_impurity_decrease': 0.04000104523612123, 'max_features': 0.9425297673119786, 'subsample': 0.268886498324717, 'dropout_rate': 0.034078258296015414, 'ccp_alpha': 0.1535171774726567}. Best is trial 187 with value: 0.6933481836305168.[0m
[32m[I 2022-04-22 00:38:46,336][0m Trial 658 finished with value: 0.6877564027001777 and parameters: {'loss': 'coxph', 'learning_rate': 7.693504815006749e-05, 'n_estimators': 101, 'criterion': 'squared_error', 'min_samples_split': 7, 'min_samples_leaf': 6, 'min_weight_fraction_leaf': 0.19908570433501763, 'min_impurity_decrease': 0.001360606000184044, 'max_features': 0.9084038088389309, 'subsample': 0.32040118813165086, 'dropout_rate': 0.11259430151404787, 'ccp_alpha': 0.09139386414586918}. Best is trial 187 with value: 0.6933481836305168.[0m
[32m[I 2022-04-22 00:39:19,032][0m Trial 659 finished with value: 0.6652856559522944 and parameters: {'loss': 'coxph', 'learning_rate': 4.795440306292893e-05, 'n_estimators': 326, 'criterion': 'squared_error', 'min_samples_split': 6, 'min_samples_leaf': 9, 'min_weight_fraction_leaf': 0.2127610453258252, 'min_impurity_decrease': 0.08008509910113373, 'max_features': 0.9739614574635631, 'subsample': 0.28324052104800634, 'dropout_rate': 0.04651930633261032, 'ccp_alpha': 0.24899483754542756}. Best is trial 187 with value: 0.6933481836305168.[0m
[32m[I 2022-04-22 00:39:41,478][0m Trial 660 finished with value: 0.6853313870796096 and parameters: {'loss': 'coxph', 'learning_rate': 9.009293713699561e-05, 'n_estimators': 304, 'criterion': 'squared_error', 'min_samples_split': 7, 'min_samples_leaf': 10, 'min_weight_fraction_leaf': 0.23997721680532222, 'min_impurity_decrease': 0.051850370368111486, 'max_features': 0.8212999445044412, 'subsample': 0.23758503005654694, 'dropout_rate': 0.0744818564033508, 'ccp_alpha': 0.09945524270492263}. Best is trial 187 with value: 0.6933481836305168.[0m
[32m[I 2022-04-22 00:40:14,181][0m Trial 661 finished with value: 0.6330631599944342 and parameters: {'loss': 'coxph', 'learning_rate': 5.9086662854964795e-05, 'n_estimators': 349, 'criterion': 'squared_error', 'min_samples_split': 7, 'min_samples_leaf': 10, 'min_weight_fraction_leaf': 0.4171163605312677, 'min_impurity_decrease': 0.0310690124322489, 'max_features': 0.8746307366267242, 'subsample': 0.3376005092489898, 'dropout_rate': 0.014785798579536226, 'ccp_alpha': 0.2177741315509965}. Best is trial 187 with value: 0.6933481836305168.[0m
[32m[I 2022-04-22 00:40:35,898][0m Trial 662 finished with value: 0.6888309091370933 and parameters: {'loss': 'coxph', 'learning_rate': 0.00011067196993211176, 'n_estimators': 316, 'criterion': 'squared_error', 'min_samples_split': 7, 'min_samples_leaf': 10, 'min_weight_fraction_leaf': 0.19288524204454133, 'min_impurity_decrease': 0.0657940790443513, 'max_features': 0.999723716907009, 'subsample': 0.30547812659402557, 'dropout_rate': 0.05496667112964348, 'ccp_alpha': 0.002378435386363384}. Best is trial 187 with value: 0.6933481836305168.[0m
/media/san2_ssd/data/Workdir/survival/venv/lib/python3.8/site-packages/sksurv/ensemble/boosting.py:955: RuntimeWarning: divide by zero encountered in log
  time = numpy.log(time)
/media/san2_ssd/data/Workdir/survival/venv/lib/python3.8/site-packages/sksurv/ensemble/boosting.py:955: RuntimeWarning: divide by zero encountered in log
  time = numpy.log(time)
/media/san2_ssd/data/Workdir/survival/venv/lib/python3.8/site-packages/sksurv/ensemble/boosting.py:955: RuntimeWarning: divide by zero encountered in log
  time = numpy.log(time)
/media/san2_ssd/data/Workdir/survival/venv/lib/python3.8/site-packages/sksurv/ensemble/boosting.py:955: RuntimeWarning: divide by zero encountered in log
  time = numpy.log(time)
[32m[I 2022-04-22 00:40:42,187][0m Trial 663 finished with value: -0.7297033464820903 and parameters: {'loss': 'squared', 'learning_rate': 4.5136561519367675e-05, 'n_estimators': 336, 'criterion': 'squared_error', 'min_samples_split': 7, 'min_samples_leaf': 10, 'min_weight_fraction_leaf': 0.1239185832626523, 'min_impurity_decrease': 0.0179076727435655, 'max_features': 0.7909399673067675, 'subsample': 0.25835934654629883, 'dropout_rate': 0.07748305059984067, 'ccp_alpha': 0.3268297326695409}. Best is trial 187 with value: 0.6933481836305168.[0m
[32m[I 2022-04-22 00:41:06,081][0m Trial 664 finished with value: 0.6849283213550063 and parameters: {'loss': 'coxph', 'learning_rate': 0.00015214501800661024, 'n_estimators': 302, 'criterion': 'squared_error', 'min_samples_split': 8, 'min_samples_leaf': 9, 'min_weight_fraction_leaf': 0.16555099906221094, 'min_impurity_decrease': 0.04641242537535978, 'max_features': 0.8613157163984286, 'subsample': 0.3264080033224933, 'dropout_rate': 0.0326024158741285, 'ccp_alpha': 0.154899117397701}. Best is trial 187 with value: 0.6933481836305168.[0m
[32m[I 2022-04-22 00:41:48,869][0m Trial 665 finished with value: 0.628086143308687 and parameters: {'loss': 'coxph', 'learning_rate': 3.3349674879449304e-05, 'n_estimators': 390, 'criterion': 'squared_error', 'min_samples_split': 7, 'min_samples_leaf': 10, 'min_weight_fraction_leaf': 0.18175109504882586, 'min_impurity_decrease': 0.40131495976714504, 'max_features': 0.9270881621618454, 'subsample': 0.29978436761096033, 'dropout_rate': 0.09475827831723069, 'ccp_alpha': 0.0031552008375505397}. Best is trial 187 with value: 0.6933481836305168.[0m
[32m[I 2022-04-22 00:42:22,190][0m Trial 666 finished with value: 0.685865065284552 and parameters: {'loss': 'coxph', 'learning_rate': 7.007883657051045e-05, 'n_estimators': 365, 'criterion': 'squared_error', 'min_samples_split': 7, 'min_samples_leaf': 10, 'min_weight_fraction_leaf': 0.25434122856771535, 'min_impurity_decrease': 0.07863266599750382, 'max_features': 0.9597868682050432, 'subsample': 0.27472225836898284, 'dropout_rate': 0.12884373059122498, 'ccp_alpha': 0.09198686312742202}. Best is trial 187 with value: 0.6933481836305168.[0m
[32m[I 2022-04-22 00:42:57,171][0m Trial 667 finished with value: 0.5 and parameters: {'loss': 'coxph', 'learning_rate': 5.273044397638598e-05, 'n_estimators': 323, 'criterion': 'absolute_error', 'min_samples_split': 7, 'min_samples_leaf': 10, 'min_weight_fraction_leaf': 0.2226661499273051, 'min_impurity_decrease': 0.03119397628260219, 'max_features': 0.8288884211025029, 'subsample': 0.5953664138164766, 'dropout_rate': 0.0014640317823157618, 'ccp_alpha': 1.2632892049308586}. Best is trial 187 with value: 0.6933481836305168.[0m
[32m[I 2022-04-22 00:43:37,265][0m Trial 668 finished with value: 0.663568189711216 and parameters: {'loss': 'coxph', 'learning_rate': 8.77540363982964e-05, 'n_estimators': 350, 'criterion': 'friedman_mse', 'min_samples_split': 7, 'min_samples_leaf': 9, 'min_weight_fraction_leaf': 0.20824641197546764, 'min_impurity_decrease': 0.880446892088862, 'max_features': 0.43990065626683716, 'subsample': 0.3535351702358545, 'dropout_rate': 0.053843307137452834, 'ccp_alpha': 0.24543709429672683}. Best is trial 187 with value: 0.6933481836305168.[0m
[32m[I 2022-04-22 00:44:04,248][0m Trial 669 finished with value: 0.5 and parameters: {'loss': 'coxph', 'learning_rate': 6.043491582989342e-05, 'n_estimators': 309, 'criterion': 'squared_error', 'min_samples_split': 7, 'min_samples_leaf': 10, 'min_weight_fraction_leaf': 0.20243037339648207, 'min_impurity_decrease': 0.08886700556729224, 'max_features': 0.900534891739523, 'subsample': 0.21864083375902693, 'dropout_rate': 0.026263457235233247, 'ccp_alpha': 2.59759393318504}. Best is trial 187 with value: 0.6933481836305168.[0m
[32m[I 2022-04-22 00:44:22,265][0m Trial 670 finished with value: 0.6782803382029832 and parameters: {'loss': 'coxph', 'learning_rate': 4.2166601935237734e-05, 'n_estimators': 273, 'criterion': 'squared_error', 'min_samples_split': 7, 'min_samples_leaf': 10, 'min_weight_fraction_leaf': 0.22845472585020324, 'min_impurity_decrease': 0.002318348123762283, 'max_features': 0.9401285530702238, 'subsample': 0.2898606033644549, 'dropout_rate': 0.10700373002181342, 'ccp_alpha': 0.15385745301154743}. Best is trial 187 with value: 0.6933481836305168.[0m
[32m[I 2022-04-22 00:44:34,714][0m Trial 671 finished with value: 0.6865641757931813 and parameters: {'loss': 'coxph', 'learning_rate': 0.00011623033449471157, 'n_estimators': 331, 'criterion': 'squared_error', 'min_samples_split': 6, 'min_samples_leaf': 10, 'min_weight_fraction_leaf': 0.18958351947688123, 'min_impurity_decrease': 0.05472831320253321, 'max_features': 0.8535736941772487, 'subsample': 0.32284767325757663, 'dropout_rate': 0.6414747522537666, 'ccp_alpha': 0.08759911270081741}. Best is trial 187 with value: 0.6933481836305168.[0m
[32m[I 2022-04-22 00:45:06,496][0m Trial 672 finished with value: 0.6556203951897036 and parameters: {'loss': 'coxph', 'learning_rate': 2.2267110599490197e-06, 'n_estimators': 296, 'criterion': 'squared_error', 'min_samples_split': 7, 'min_samples_leaf': 10, 'min_weight_fraction_leaf': 0.1726207512427269, 'min_impurity_decrease': 0.023112407458105694, 'max_features': 0.8090239561076465, 'subsample': 0.24358665054019238, 'dropout_rate': 0.07909459446439882, 'ccp_alpha': 0.42040389156789204}. Best is trial 187 with value: 0.6933481836305168.[0m
[32m[I 2022-04-22 00:45:24,857][0m Trial 673 finished with value: 0.5 and parameters: {'loss': 'coxph', 'learning_rate': 0.0001610497208120052, 'n_estimators': 375, 'criterion': 'squared_error', 'min_samples_split': 7, 'min_samples_leaf': 9, 'min_weight_fraction_leaf': 0.21400081019389391, 'min_impurity_decrease': 0.06231669207453783, 'max_features': 0.8789006220150062, 'subsample': 0.2694911828085852, 'dropout_rate': 0.6736767366076885, 'ccp_alpha': 0.7089321892210633}. Best is trial 187 with value: 0.6933481836305168.[0m
[32m[I 2022-04-22 00:45:51,600][0m Trial 674 finished with value: 0.6876609983767911 and parameters: {'loss': 'coxph', 'learning_rate': 2.4830574990289923e-05, 'n_estimators': 279, 'criterion': 'squared_error', 'min_samples_split': 7, 'min_samples_leaf': 10, 'min_weight_fraction_leaf': 0.19593489513125661, 'min_impurity_decrease': 0.001331059954651949, 'max_features': 0.9774014715405384, 'subsample': 0.3095186925321004, 'dropout_rate': 0.13910592096832208, 'ccp_alpha': 0.0046612793977855865}. Best is trial 187 with value: 0.6933481836305168.[0m
[32m[I 2022-04-22 00:46:37,242][0m Trial 675 finished with value: 0.5 and parameters: {'loss': 'coxph', 'learning_rate': 7.409711287025068e-05, 'n_estimators': 403, 'criterion': 'squared_error', 'min_samples_split': 7, 'min_samples_leaf': 10, 'min_weight_fraction_leaf': 0.2389454025076721, 'min_impurity_decrease': 0.03821800077674758, 'max_features': 0.914557267261528, 'subsample': 0.3403171880809873, 'dropout_rate': 0.03512571696340909, 'ccp_alpha': 2.777544245109382}. Best is trial 187 with value: 0.6933481836305168.[0m
[32m[I 2022-04-22 00:47:00,925][0m Trial 676 finished with value: 0.5 and parameters: {'loss': 'coxph', 'learning_rate': 3.336557921436706e-05, 'n_estimators': 317, 'criterion': 'absolute_error', 'min_samples_split': 7, 'min_samples_leaf': 10, 'min_weight_fraction_leaf': 0.21999067203983, 'min_impurity_decrease': 0.4787466849770994, 'max_features': 0.8436225588929107, 'subsample': 0.2837707642142467, 'dropout_rate': 0.05353978889542821, 'ccp_alpha': 0.26926943535293113}. Best is trial 187 with value: 0.6933481836305168.[0m
[32m[I 2022-04-22 00:47:31,214][0m Trial 677 finished with value: 0.6828581039172315 and parameters: {'loss': 'coxph', 'learning_rate': 5.194549930651798e-05, 'n_estimators': 350, 'criterion': 'squared_error', 'min_samples_split': 7, 'min_samples_leaf': 10, 'min_weight_fraction_leaf': 0.18356293635718782, 'min_impurity_decrease': 0.07152890385055388, 'max_features': 0.9602271922366729, 'subsample': 0.3734712019378126, 'dropout_rate': 0.06679358775685446, 'ccp_alpha': 0.1665697260012192}. Best is trial 187 with value: 0.6933481836305168.[0m
[32m[I 2022-04-22 00:47:41,640][0m Trial 678 finished with value: 0.6902091171912802 and parameters: {'loss': 'coxph', 'learning_rate': 8.943722628724439e-05, 'n_estimators': 255, 'criterion': 'squared_error', 'min_samples_split': 7, 'min_samples_leaf': 9, 'min_weight_fraction_leaf': 0.20555278429804386, 'min_impurity_decrease': 0.05138634962028186, 'max_features': 0.7726591867678496, 'subsample': 0.25696081291214345, 'dropout_rate': 0.6124501675403653, 'ccp_alpha': 0.0017853347681765492}. Best is trial 187 with value: 0.6933481836305168.[0m
[32m[I 2022-04-22 00:47:50,889][0m Trial 679 finished with value: 0.6473867648980227 and parameters: {'loss': 'coxph', 'learning_rate': 0.00010580231417605025, 'n_estimators': 253, 'criterion': 'squared_error', 'min_samples_split': 8, 'min_samples_leaf': 9, 'min_weight_fraction_leaf': 0.026974932376630706, 'min_impurity_decrease': 0.2973196326544969, 'max_features': 0.7959098704338561, 'subsample': 0.30007957471663604, 'dropout_rate': 0.6263773155675549, 'ccp_alpha': 0.09210552277305084}. Best is trial 187 with value: 0.6933481836305168.[0m
[32m[I 2022-04-22 00:48:01,252][0m Trial 680 finished with value: 0.6652535759877798 and parameters: {'loss': 'coxph', 'learning_rate': 0.00013100382118924492, 'n_estimators': 261, 'criterion': 'squared_error', 'min_samples_split': 7, 'min_samples_leaf': 9, 'min_weight_fraction_leaf': 0.2020624310382686, 'min_impurity_decrease': 0.021296883343081444, 'max_features': 0.7711475039237938, 'subsample': 0.2616037598450264, 'dropout_rate': 0.606779644024865, 'ccp_alpha': 0.314660979596021}. Best is trial 187 with value: 0.6933481836305168.[0m
[32m[I 2022-04-22 00:48:07,091][0m Trial 681 finished with value: 0.5 and parameters: {'loss': 'coxph', 'learning_rate': 0.00016682982785375745, 'n_estimators': 249, 'criterion': 'squared_error', 'min_samples_split': 7, 'min_samples_leaf': 9, 'min_weight_fraction_leaf': 0.15962329651508206, 'min_impurity_decrease': 0.042064892895639916, 'max_features': 0.7851334646447768, 'subsample': 0.3234544845082229, 'dropout_rate': 0.6488989703808254, 'ccp_alpha': 4.396204198667737}. Best is trial 187 with value: 0.6933481836305168.[0m
/media/san2_ssd/data/Workdir/survival/venv/lib/python3.8/site-packages/sksurv/ensemble/boosting.py:955: RuntimeWarning: divide by zero encountered in log
  time = numpy.log(time)
/media/san2_ssd/data/Workdir/survival/venv/lib/python3.8/site-packages/sksurv/ensemble/boosting.py:955: RuntimeWarning: divide by zero encountered in log
  time = numpy.log(time)
/media/san2_ssd/data/Workdir/survival/venv/lib/python3.8/site-packages/sksurv/ensemble/boosting.py:955: RuntimeWarning: divide by zero encountered in log
  time = numpy.log(time)
/media/san2_ssd/data/Workdir/survival/venv/lib/python3.8/site-packages/sksurv/ensemble/boosting.py:955: RuntimeWarning: divide by zero encountered in log
  time = numpy.log(time)
[32m[I 2022-04-22 00:48:08,407][0m Trial 682 finished with value: -0.7276780202718721 and parameters: {'loss': 'squared', 'learning_rate': 9.718274789828422e-05, 'n_estimators': 262, 'criterion': 'friedman_mse', 'min_samples_split': 7, 'min_samples_leaf': 9, 'min_weight_fraction_leaf': 0.1763305046345893, 'min_impurity_decrease': 0.09113812995235684, 'max_features': 0.8145359252286886, 'subsample': 0.2849285745046932, 'dropout_rate': 0.5922037692483636, 'ccp_alpha': 0.1802839541344161}. Best is trial 187 with value: 0.6933481836305168.[0m
[32m[I 2022-04-22 00:48:19,248][0m Trial 683 finished with value: 0.6874499110604904 and parameters: {'loss': 'coxph', 'learning_rate': 0.0001334217873981419, 'n_estimators': 277, 'criterion': 'squared_error', 'min_samples_split': 7, 'min_samples_leaf': 8, 'min_weight_fraction_leaf': 0.19136199196040815, 'min_impurity_decrease': 0.06301168513865701, 'max_features': 0.8150462445302947, 'subsample': 0.31248159770223977, 'dropout_rate': 0.6105373606605354, 'ccp_alpha': 0.0013743537072880146}. Best is trial 187 with value: 0.6933481836305168.[0m
[32m[I 2022-04-22 00:48:31,803][0m Trial 684 finished with value: 0.6905573778681429 and parameters: {'loss': 'coxph', 'learning_rate': 7.422670357866038e-05, 'n_estimators': 257, 'criterion': 'squared_error', 'min_samples_split': 6, 'min_samples_leaf': 9, 'min_weight_fraction_leaf': 0.21258771563481346, 'min_impurity_decrease': 0.018581064789402663, 'max_features': 0.7674932406804585, 'subsample': 0.22542445691844482, 'dropout_rate': 0.6195481230902828, 'ccp_alpha': 0.10099266212357351}. Best is trial 187 with value: 0.6933481836305168.[0m
[32m[I 2022-04-22 00:48:41,151][0m Trial 685 finished with value: 0.6690252936165911 and parameters: {'loss': 'coxph', 'learning_rate': 8.200744224733098e-05, 'n_estimators': 251, 'criterion': 'squared_error', 'min_samples_split': 6, 'min_samples_leaf': 9, 'min_weight_fraction_leaf': 0.20648593852099942, 'min_impurity_decrease': 0.045801999231441196, 'max_features': 0.7341675203072942, 'subsample': 0.182825419913947, 'dropout_rate': 0.626833670611092, 'ccp_alpha': 0.22065659220197173}. Best is trial 187 with value: 0.6933481836305168.[0m
[32m[I 2022-04-22 00:48:54,406][0m Trial 686 finished with value: 0.6867634664520427 and parameters: {'loss': 'coxph', 'learning_rate': 9.066925097392191e-05, 'n_estimators': 257, 'criterion': 'squared_error', 'min_samples_split': 5, 'min_samples_leaf': 9, 'min_weight_fraction_leaf': 0.1973238474024956, 'min_impurity_decrease': 0.08755933926477538, 'max_features': 0.783278050712585, 'subsample': 0.22101171481937026, 'dropout_rate': 0.6331356965594661, 'ccp_alpha': 0.084603348583146}. Best is trial 187 with value: 0.6933481836305168.[0m
[32m[I 2022-04-22 00:49:06,532][0m Trial 687 finished with value: 0.6855503665118032 and parameters: {'loss': 'coxph', 'learning_rate': 0.0001301178682494147, 'n_estimators': 274, 'criterion': 'squared_error', 'min_samples_split': 6, 'min_samples_leaf': 9, 'min_weight_fraction_leaf': 0.18346958780350622, 'min_impurity_decrease': 0.03301595923771669, 'max_features': 0.7688592936175356, 'subsample': 0.2103281645420655, 'dropout_rate': 0.6488700366071912, 'ccp_alpha': 0.09433149997110263}. Best is trial 187 with value: 0.6933481836305168.[0m
[32m[I 2022-04-22 00:49:14,288][0m Trial 688 finished with value: 0.6788646919298593 and parameters: {'loss': 'coxph', 'learning_rate': 6.806496277941604e-05, 'n_estimators': 247, 'criterion': 'squared_error', 'min_samples_split': 6, 'min_samples_leaf': 9, 'min_weight_fraction_leaf': 0.1498984434773692, 'min_impurity_decrease': 0.06308230213235935, 'max_features': 0.7908188449084531, 'subsample': 0.1858420626746198, 'dropout_rate': 0.6167711944622974, 'ccp_alpha': 0.1752663405926663}. Best is trial 187 with value: 0.6933481836305168.[0m
[32m[I 2022-04-22 00:49:25,635][0m Trial 689 finished with value: 0.6636900948801576 and parameters: {'loss': 'coxph', 'learning_rate': 0.0001789354870891056, 'n_estimators': 260, 'criterion': 'squared_error', 'min_samples_split': 6, 'min_samples_leaf': 9, 'min_weight_fraction_leaf': 0.21261764131244254, 'min_impurity_decrease': 0.05027512955789447, 'max_features': 0.7244737303896174, 'subsample': 0.23131616752702902, 'dropout_rate': 0.5906933342725729, 'ccp_alpha': 0.33853095087858326}. Best is trial 187 with value: 0.6933481836305168.[0m
[32m[I 2022-04-22 00:49:32,363][0m Trial 690 finished with value: 0.6870475428905367 and parameters: {'loss': 'coxph', 'learning_rate': 9.887481210466642e-05, 'n_estimators': 267, 'criterion': 'absolute_error', 'min_samples_split': 6, 'min_samples_leaf': 9, 'min_weight_fraction_leaf': 0.22812566432343978, 'min_impurity_decrease': 0.02271792010795807, 'max_features': 0.6251012101575082, 'subsample': 0.23764317627084441, 'dropout_rate': 0.6598171227058517, 'ccp_alpha': 0.08459252111039725}. Best is trial 187 with value: 0.6933481836305168.[0m
[32m[I 2022-04-22 00:49:50,447][0m Trial 691 finished with value: 0.5 and parameters: {'loss': 'coxph', 'learning_rate': 0.00011432305929060725, 'n_estimators': 271, 'criterion': 'squared_error', 'min_samples_split': 6, 'min_samples_leaf': 8, 'min_weight_fraction_leaf': 0.2727066692944376, 'min_impurity_decrease': 0.07612647447607689, 'max_features': 0.8008608393980807, 'subsample': 0.1520456314117935, 'dropout_rate': 0.6094111180362085, 'ccp_alpha': 4.559284294969874}. Best is trial 187 with value: 0.6933481836305168.[0m
[32m[I 2022-04-22 00:50:00,304][0m Trial 692 finished with value: 0.687189616386195 and parameters: {'loss': 'coxph', 'learning_rate': 7.557775357183144e-05, 'n_estimators': 254, 'criterion': 'squared_error', 'min_samples_split': 8, 'min_samples_leaf': 9, 'min_weight_fraction_leaf': 0.1671742369554755, 'min_impurity_decrease': 0.04065674108289084, 'max_features': 0.7794905168927675, 'subsample': 0.2058556754988102, 'dropout_rate': 0.5878235239035448, 'ccp_alpha': 0.004719993948863702}. Best is trial 187 with value: 0.6933481836305168.[0m
[32m[I 2022-04-22 00:50:06,680][0m Trial 693 finished with value: 0.665349982231404 and parameters: {'loss': 'coxph', 'learning_rate': 4.015324573317777e-05, 'n_estimators': 243, 'criterion': 'squared_error', 'min_samples_split': 4, 'min_samples_leaf': 9, 'min_weight_fraction_leaf': 0.1931423804292396, 'min_impurity_decrease': 0.09552602161387005, 'max_features': 0.7588397750905318, 'subsample': 0.25039304027006826, 'dropout_rate': 0.6308110615338272, 'ccp_alpha': 0.25577874952160595}. Best is trial 187 with value: 0.6933481836305168.[0m
