[32m[I 2022-04-22 23:17:29,337][0m Trial 506 finished with value: 0.6785524514211875 and parameters: {'n_hidden': 32, 'mixture_components': 2, 'use_sparse_layer': False, 'use_batchnorm': False, 'use_dropout': False, 'mlp_size_1': 2, 'mlp_size_2': 0, 'mlp_size_3': 0, 'kernel': 'LogLogistic', 'loss_name': 'NLLLoss'}. Best is trial 164 with value: 0.7011621788753918.[0m
[32m[I 2022-04-22 23:18:20,035][0m Trial 507 finished with value: 0.68067467850585 and parameters: {'n_hidden': 1024, 'mixture_components': 5, 'use_sparse_layer': False, 'use_batchnorm': False, 'use_dropout': False, 'mlp_size_1': 6, 'mlp_size_2': 0, 'mlp_size_3': 1, 'kernel': 'LogLogistic', 'loss_name': 'NLLLoss'}. Best is trial 164 with value: 0.7011621788753918.[0m
[32m[I 2022-04-22 23:20:08,654][0m Trial 508 finished with value: 0.5882016636685872 and parameters: {'n_hidden': 1024, 'mixture_components': 2, 'use_sparse_layer': False, 'use_batchnorm': True, 'use_dropout': False, 'mlp_size_1': 6, 'mlp_size_2': 0, 'mlp_size_3': 1, 'kernel': 'LogLogistic', 'loss_name': 'NLLLoss'}. Best is trial 164 with value: 0.7011621788753918.[0m
[32m[I 2022-04-22 23:20:52,234][0m Trial 509 finished with value: 0.6877260498398111 and parameters: {'n_hidden': 1024, 'mixture_components': 4, 'use_sparse_layer': False, 'use_batchnorm': False, 'use_dropout': False, 'mlp_size_1': 6, 'mlp_size_2': 0, 'mlp_size_3': 1, 'kernel': 'LogLogistic', 'loss_name': 'NLLLoss'}. Best is trial 164 with value: 0.7011621788753918.[0m
[32m[I 2022-04-22 23:21:31,754][0m Trial 510 finished with value: 0.6846411728896991 and parameters: {'n_hidden': 1024, 'mixture_components': 8, 'use_sparse_layer': False, 'use_batchnorm': False, 'use_dropout': False, 'mlp_size_1': 6, 'mlp_size_2': 0, 'mlp_size_3': 1, 'kernel': 'Gumbel', 'loss_name': 'NLLLoss'}. Best is trial 164 with value: 0.7011621788753918.[0m
[32m[I 2022-04-22 23:22:29,615][0m Trial 511 finished with value: 0.6859019594759292 and parameters: {'n_hidden': 1024, 'mixture_components': 2, 'use_sparse_layer': False, 'use_batchnorm': False, 'use_dropout': False, 'mlp_size_1': 6, 'mlp_size_2': 0, 'mlp_size_3': 1, 'kernel': 'Logistic', 'loss_name': 'NLLLoss'}. Best is trial 164 with value: 0.7011621788753918.[0m
[32m[I 2022-04-22 23:23:11,003][0m Trial 512 finished with value: 0.6322405096085124 and parameters: {'n_hidden': 1024, 'mixture_components': 8, 'use_sparse_layer': False, 'use_batchnorm': False, 'use_dropout': False, 'mlp_size_1': 6, 'mlp_size_2': 0, 'mlp_size_3': 1, 'kernel': 'Gumbel', 'loss_name': 'NLLLoss'}. Best is trial 164 with value: 0.7011621788753918.[0m
[32m[I 2022-04-22 23:23:54,187][0m Trial 513 finished with value: 0.684471623958977 and parameters: {'n_hidden': 1024, 'mixture_components': 2, 'use_sparse_layer': True, 'use_sparse_loss': True, 'lmbd': 0.0015550272090926575, 'use_batchnorm': False, 'use_dropout': False, 'mlp_size_1': 6, 'mlp_size_2': 0, 'mlp_size_3': 1, 'kernel': 'Gumbel', 'loss_name': 'NLLLoss'}. Best is trial 164 with value: 0.7011621788753918.[0m
[32m[I 2022-04-22 23:24:40,480][0m Trial 514 finished with value: 0.6728682922860785 and parameters: {'n_hidden': 512, 'mixture_components': 7, 'use_sparse_layer': False, 'use_batchnorm': False, 'use_dropout': False, 'mlp_size_1': 6, 'mlp_size_2': 0, 'mlp_size_3': 0, 'kernel': 'LogLogistic', 'loss_name': 'NLLLoss'}. Best is trial 164 with value: 0.7011621788753918.[0m
[32m[I 2022-04-22 23:25:14,557][0m Trial 515 finished with value: -0.6652700129995923 and parameters: {'n_hidden': 1024, 'mixture_components': 10, 'use_sparse_layer': False, 'use_batchnorm': False, 'use_dropout': False, 'mlp_size_1': 6, 'mlp_size_2': 0, 'mlp_size_3': 1, 'kernel': 'Exponential', 'loss_name': 'CensoredNLLLoss'}. Best is trial 164 with value: 0.7011621788753918.[0m
[32m[I 2022-04-22 23:26:12,324][0m Trial 516 finished with value: 0.6828329845111674 and parameters: {'n_hidden': 128, 'mixture_components': 2, 'use_sparse_layer': False, 'use_batchnorm': False, 'use_dropout': False, 'mlp_size_1': 4, 'mlp_size_2': 0, 'mlp_size_3': 0, 'kernel': 'Gumbel', 'loss_name': 'NLLLoss'}. Best is trial 164 with value: 0.7011621788753918.[0m
[32m[I 2022-04-22 23:26:57,141][0m Trial 517 finished with value: 0.6947915316789511 and parameters: {'n_hidden': 1024, 'mixture_components': 8, 'use_sparse_layer': False, 'use_batchnorm': False, 'use_dropout': False, 'mlp_size_1': 6, 'mlp_size_2': 0, 'mlp_size_3': 1, 'kernel': 'Logistic', 'loss_name': 'AlternativeNLLLoss'}. Best is trial 164 with value: 0.7011621788753918.[0m
[32m[I 2022-04-22 23:27:40,931][0m Trial 518 finished with value: 0.6919268014250004 and parameters: {'n_hidden': 1024, 'mixture_components': 8, 'use_sparse_layer': False, 'use_batchnorm': False, 'use_dropout': False, 'mlp_size_1': 6, 'mlp_size_2': 0, 'mlp_size_3': 1, 'kernel': 'Logistic', 'loss_name': 'NLLLoss'}. Best is trial 164 with value: 0.7011621788753918.[0m
[32m[I 2022-04-22 23:28:41,385][0m Trial 519 finished with value: 0.6789768622702302 and parameters: {'n_hidden': 64, 'mixture_components': 2, 'use_sparse_layer': False, 'use_batchnorm': False, 'use_dropout': False, 'mlp_size_1': 3, 'mlp_size_2': 0, 'mlp_size_3': 0, 'kernel': 'Logistic', 'loss_name': 'AlternativeNLLLoss'}. Best is trial 164 with value: 0.7011621788753918.[0m
[32m[I 2022-04-22 23:29:17,762][0m Trial 520 finished with value: 0.6880454245949684 and parameters: {'n_hidden': 1024, 'mixture_components': 4, 'use_sparse_layer': False, 'use_batchnorm': False, 'use_dropout': False, 'mlp_size_1': 1, 'mlp_size_2': 1, 'mlp_size_3': 5, 'kernel': 'Logistic', 'loss_name': 'NLLLoss'}. Best is trial 164 with value: 0.7011621788753918.[0m
[32m[I 2022-04-22 23:30:19,578][0m Trial 521 finished with value: 0.6918706513102747 and parameters: {'n_hidden': 2048, 'mixture_components': 2, 'use_sparse_layer': False, 'use_batchnorm': False, 'use_dropout': False, 'mlp_size_1': 8, 'mlp_size_2': 0, 'mlp_size_3': 0, 'kernel': 'Logistic', 'loss_name': 'AlternativeNLLLoss'}. Best is trial 164 with value: 0.7011621788753918.[0m
[32m[I 2022-04-22 23:31:18,381][0m Trial 522 finished with value: 0.6952127752039777 and parameters: {'n_hidden': 1024, 'mixture_components': 8, 'use_sparse_layer': False, 'use_batchnorm': False, 'use_dropout': False, 'mlp_size_1': 6, 'mlp_size_2': 0, 'mlp_size_3': 1, 'kernel': 'Logistic', 'loss_name': 'AlternativeNLLLoss'}. Best is trial 164 with value: 0.7011621788753918.[0m
[32m[I 2022-04-22 23:32:11,408][0m Trial 523 finished with value: 0.6855036098048058 and parameters: {'n_hidden': 1024, 'mixture_components': 8, 'use_sparse_layer': False, 'use_batchnorm': False, 'use_dropout': False, 'mlp_size_1': 6, 'mlp_size_2': 0, 'mlp_size_3': 1, 'kernel': 'Logistic', 'loss_name': 'AlternativeNLLLoss'}. Best is trial 164 with value: 0.7011621788753918.[0m
[32m[I 2022-04-22 23:33:12,924][0m Trial 524 finished with value: 0.684359960989758 and parameters: {'n_hidden': 1024, 'mixture_components': 8, 'use_sparse_layer': False, 'use_batchnorm': False, 'use_dropout': True, 'dropout': 0.08454180853114629, 'mlp_size_1': 6, 'mlp_size_2': 0, 'mlp_size_3': 1, 'kernel': 'Logistic', 'loss_name': 'AlternativeNLLLoss'}. Best is trial 164 with value: 0.7011621788753918.[0m
[32m[I 2022-04-22 23:34:02,899][0m Trial 525 finished with value: 0.6740410112461543 and parameters: {'n_hidden': 1024, 'mixture_components': 8, 'use_sparse_layer': False, 'use_batchnorm': False, 'use_dropout': False, 'mlp_size_1': 6, 'mlp_size_2': 0, 'mlp_size_3': 1, 'kernel': 'Logistic', 'loss_name': 'AlternativeNLLLoss'}. Best is trial 164 with value: 0.7011621788753918.[0m
[32m[I 2022-04-22 23:34:53,389][0m Trial 526 finished with value: 0.676646020433563 and parameters: {'n_hidden': 1024, 'mixture_components': 8, 'use_sparse_layer': True, 'use_sparse_loss': False, 'use_batchnorm': False, 'use_dropout': False, 'mlp_size_1': 6, 'mlp_size_2': 0, 'mlp_size_3': 1, 'kernel': 'Logistic', 'loss_name': 'AlternativeNLLLoss'}. Best is trial 164 with value: 0.7011621788753918.[0m
[32m[I 2022-04-22 23:35:39,985][0m Trial 527 finished with value: 0.6825307998157026 and parameters: {'n_hidden': 1024, 'mixture_components': 8, 'use_sparse_layer': False, 'use_batchnorm': False, 'use_dropout': False, 'mlp_size_1': 6, 'mlp_size_2': 0, 'mlp_size_3': 1, 'kernel': 'Logistic', 'loss_name': 'AlternativeNLLLoss'}. Best is trial 164 with value: 0.7011621788753918.[0m
[32m[I 2022-04-22 23:36:26,290][0m Trial 528 finished with value: 0.6636366788683239 and parameters: {'n_hidden': 1024, 'mixture_components': 8, 'use_sparse_layer': False, 'use_batchnorm': False, 'use_dropout': False, 'mlp_size_1': 6, 'mlp_size_2': 0, 'mlp_size_3': 1, 'kernel': 'Logistic', 'loss_name': 'AlternativeNLLLoss'}. Best is trial 164 with value: 0.7011621788753918.[0m
[32m[I 2022-04-22 23:38:27,216][0m Trial 529 finished with value: 0.6784772223992442 and parameters: {'n_hidden': 1024, 'mixture_components': 8, 'use_sparse_layer': False, 'use_batchnorm': True, 'use_dropout': False, 'mlp_size_1': 6, 'mlp_size_2': 0, 'mlp_size_3': 1, 'kernel': 'Logistic', 'loss_name': 'AlternativeNLLLoss'}. Best is trial 164 with value: 0.7011621788753918.[0m
[32m[I 2022-04-22 23:39:13,282][0m Trial 530 finished with value: 0.7027982899957603 and parameters: {'n_hidden': 1024, 'mixture_components': 7, 'use_sparse_layer': False, 'use_batchnorm': False, 'use_dropout': False, 'mlp_size_1': 6, 'mlp_size_2': 0, 'mlp_size_3': 1, 'kernel': 'Logistic', 'loss_name': 'AlternativeNLLLoss'}. Best is trial 530 with value: 0.7027982899957603.[0m
[32m[I 2022-04-22 23:40:03,542][0m Trial 531 finished with value: 0.6898956328365417 and parameters: {'n_hidden': 512, 'mixture_components': 8, 'use_sparse_layer': False, 'use_batchnorm': False, 'use_dropout': False, 'mlp_size_1': 6, 'mlp_size_2': 0, 'mlp_size_3': 0, 'kernel': 'Logistic', 'loss_name': 'AlternativeNLLLoss'}. Best is trial 530 with value: 0.7027982899957603.[0m
[32m[I 2022-04-22 23:41:00,415][0m Trial 532 finished with value: 0.6897977613474329 and parameters: {'n_hidden': 1024, 'mixture_components': 7, 'use_sparse_layer': False, 'use_batchnorm': False, 'use_dropout': False, 'mlp_size_1': 6, 'mlp_size_2': 0, 'mlp_size_3': 1, 'kernel': 'Logistic', 'loss_name': 'AlternativeNLLLoss'}. Best is trial 530 with value: 0.7027982899957603.[0m
[32m[I 2022-04-22 23:42:10,324][0m Trial 533 finished with value: 0.6768146200207803 and parameters: {'n_hidden': 1024, 'mixture_components': 7, 'use_sparse_layer': False, 'use_batchnorm': False, 'use_dropout': False, 'mlp_size_1': 6, 'mlp_size_2': 0, 'mlp_size_3': 1, 'kernel': 'Logistic', 'loss_name': 'AlternativeNLLLoss'}. Best is trial 530 with value: 0.7027982899957603.[0m
[32m[I 2022-04-22 23:43:15,828][0m Trial 534 finished with value: 0.6756164723703505 and parameters: {'n_hidden': 1024, 'mixture_components': 7, 'use_sparse_layer': False, 'use_batchnorm': False, 'use_dropout': False, 'mlp_size_1': 6, 'mlp_size_2': 0, 'mlp_size_3': 1, 'kernel': 'Logistic', 'loss_name': 'AlternativeNLLLoss'}. Best is trial 530 with value: 0.7027982899957603.[0m
[32m[I 2022-04-22 23:44:15,281][0m Trial 535 finished with value: 0.6843396614084792 and parameters: {'n_hidden': 2048, 'mixture_components': 6, 'use_sparse_layer': False, 'use_batchnorm': False, 'use_dropout': False, 'mlp_size_1': 5, 'mlp_size_2': 2, 'mlp_size_3': 1, 'kernel': 'Logistic', 'loss_name': 'AlternativeNLLLoss'}. Best is trial 530 with value: 0.7027982899957603.[0m
[32m[I 2022-04-22 23:45:21,461][0m Trial 536 finished with value: 0.6692907770620695 and parameters: {'n_hidden': 32, 'mixture_components': 6, 'use_sparse_layer': False, 'use_batchnorm': False, 'use_dropout': False, 'mlp_size_1': 2, 'mlp_size_2': 0, 'mlp_size_3': 0, 'kernel': 'Logistic', 'loss_name': 'AlternativeNLLLoss'}. Best is trial 530 with value: 0.7027982899957603.[0m
[32m[I 2022-04-22 23:46:13,057][0m Trial 537 finished with value: 0.6882854101706177 and parameters: {'n_hidden': 1024, 'mixture_components': 8, 'use_sparse_layer': True, 'use_sparse_loss': True, 'lmbd': 1.8485662403651987e-05, 'use_batchnorm': False, 'use_dropout': False, 'mlp_size_1': 6, 'mlp_size_2': 0, 'mlp_size_3': 1, 'kernel': 'Logistic', 'loss_name': 'AlternativeNLLLoss'}. Best is trial 530 with value: 0.7027982899957603.[0m
[32m[I 2022-04-22 23:47:01,142][0m Trial 538 finished with value: 0.6820140313682881 and parameters: {'n_hidden': 1024, 'mixture_components': 8, 'use_sparse_layer': False, 'use_batchnorm': False, 'use_dropout': False, 'mlp_size_1': 6, 'mlp_size_2': 0, 'mlp_size_3': 1, 'kernel': 'Logistic', 'loss_name': 'CensoredNLLLoss'}. Best is trial 530 with value: 0.7027982899957603.[0m
[32m[I 2022-04-22 23:47:47,055][0m Trial 539 finished with value: 0.678548669848104 and parameters: {'n_hidden': 1024, 'mixture_components': 7, 'use_sparse_layer': False, 'use_batchnorm': False, 'use_dropout': False, 'mlp_size_1': 6, 'mlp_size_2': 0, 'mlp_size_3': 1, 'kernel': 'Logistic', 'loss_name': 'AlternativeNLLLoss'}. Best is trial 530 with value: 0.7027982899957603.[0m
[32m[I 2022-04-22 23:48:34,316][0m Trial 540 finished with value: 0.6710578550691798 and parameters: {'n_hidden': 1024, 'mixture_components': 8, 'use_sparse_layer': False, 'use_batchnorm': False, 'use_dropout': False, 'mlp_size_1': 6, 'mlp_size_2': 0, 'mlp_size_3': 1, 'kernel': 'Logistic', 'loss_name': 'AlternativeNLLLoss'}. Best is trial 530 with value: 0.7027982899957603.[0m
[32m[I 2022-04-22 23:49:38,115][0m Trial 541 finished with value: 0.6853681105160663 and parameters: {'n_hidden': 1024, 'mixture_components': 5, 'use_sparse_layer': False, 'use_batchnorm': False, 'use_dropout': False, 'mlp_size_1': 6, 'mlp_size_2': 0, 'mlp_size_3': 1, 'kernel': 'Logistic', 'loss_name': 'AlternativeNLLLoss'}. Best is trial 530 with value: 0.7027982899957603.[0m
[32m[I 2022-04-22 23:50:24,372][0m Trial 542 finished with value: 0.6850986487035512 and parameters: {'n_hidden': 1024, 'mixture_components': 8, 'use_sparse_layer': False, 'use_batchnorm': False, 'use_dropout': False, 'mlp_size_1': 6, 'mlp_size_2': 0, 'mlp_size_3': 1, 'kernel': 'Logistic', 'loss_name': 'AlternativeNLLLoss'}. Best is trial 530 with value: 0.7027982899957603.[0m
[32m[I 2022-04-22 23:51:10,732][0m Trial 543 finished with value: 0.6795486803883175 and parameters: {'n_hidden': 1024, 'mixture_components': 8, 'use_sparse_layer': False, 'use_batchnorm': False, 'use_dropout': True, 'dropout': 0.22028802204976272, 'mlp_size_1': 6, 'mlp_size_2': 0, 'mlp_size_3': 1, 'kernel': 'Logistic', 'loss_name': 'AlternativeNLLLoss'}. Best is trial 530 with value: 0.7027982899957603.[0m
[32m[I 2022-04-22 23:51:59,049][0m Trial 544 finished with value: 0.6806125060085588 and parameters: {'n_hidden': 1024, 'mixture_components': 8, 'use_sparse_layer': False, 'use_batchnorm': False, 'use_dropout': False, 'mlp_size_1': 6, 'mlp_size_2': 0, 'mlp_size_3': 1, 'kernel': 'Logistic', 'loss_name': 'AlternativeNLLLoss'}. Best is trial 530 with value: 0.7027982899957603.[0m
[32m[I 2022-04-22 23:53:02,244][0m Trial 545 finished with value: 0.6859118896728804 and parameters: {'n_hidden': 512, 'mixture_components': 8, 'use_sparse_layer': False, 'use_batchnorm': False, 'use_dropout': False, 'mlp_size_1': 6, 'mlp_size_2': 0, 'mlp_size_3': 0, 'kernel': 'Logistic', 'loss_name': 'AlternativeNLLLoss'}. Best is trial 530 with value: 0.7027982899957603.[0m
[32m[I 2022-04-22 23:53:56,381][0m Trial 546 finished with value: 0.6764635104125822 and parameters: {'n_hidden': 128, 'mixture_components': 10, 'use_sparse_layer': False, 'use_batchnorm': False, 'use_dropout': False, 'mlp_size_1': 4, 'mlp_size_2': 0, 'mlp_size_3': 0, 'kernel': 'LogLogistic', 'loss_name': 'AlternativeNLLLoss'}. Best is trial 530 with value: 0.7027982899957603.[0m
[32m[I 2022-04-22 23:54:54,297][0m Trial 547 finished with value: 0.6869404238903669 and parameters: {'n_hidden': 1024, 'mixture_components': 7, 'use_sparse_layer': False, 'use_batchnorm': False, 'use_dropout': False, 'mlp_size_1': 6, 'mlp_size_2': 0, 'mlp_size_3': 1, 'kernel': 'Logistic', 'loss_name': 'AlternativeNLLLoss'}. Best is trial 530 with value: 0.7027982899957603.[0m
[32m[I 2022-04-22 23:57:03,926][0m Trial 548 finished with value: 0.6362836124823309 and parameters: {'n_hidden': 64, 'mixture_components': 8, 'use_sparse_layer': False, 'use_batchnorm': True, 'use_dropout': False, 'mlp_size_1': 3, 'mlp_size_2': 0, 'mlp_size_3': 0, 'kernel': 'Logistic', 'loss_name': 'AlternativeNLLLoss'}. Best is trial 530 with value: 0.7027982899957603.[0m
[32m[I 2022-04-22 23:57:38,300][0m Trial 549 finished with value: -0.6676052288474572 and parameters: {'n_hidden': 1024, 'mixture_components': 8, 'use_sparse_layer': True, 'use_sparse_loss': True, 'lmbd': 0.09930612166672315, 'use_batchnorm': False, 'use_dropout': False, 'mlp_size_1': 6, 'mlp_size_2': 0, 'mlp_size_3': 1, 'kernel': 'Exponential', 'loss_name': 'AlternativeNLLLoss'}. Best is trial 530 with value: 0.7027982899957603.[0m
[32m[I 2022-04-22 23:58:22,885][0m Trial 550 finished with value: 0.6812468346281768 and parameters: {'n_hidden': 1024, 'mixture_components': 9, 'use_sparse_layer': False, 'use_batchnorm': False, 'use_dropout': False, 'mlp_size_1': 6, 'mlp_size_2': 0, 'mlp_size_3': 1, 'kernel': 'LogLogistic', 'loss_name': 'AlternativeNLLLoss'}. Best is trial 530 with value: 0.7027982899957603.[0m
[32m[I 2022-04-22 23:59:34,772][0m Trial 551 finished with value: 0.6817481835938718 and parameters: {'n_hidden': 2048, 'mixture_components': 4, 'use_sparse_layer': False, 'use_batchnorm': False, 'use_dropout': False, 'mlp_size_1': 8, 'mlp_size_2': 0, 'mlp_size_3': 0, 'kernel': 'Logistic', 'loss_name': 'AlternativeNLLLoss'}. Best is trial 530 with value: 0.7027982899957603.[0m
[32m[I 2022-04-23 00:00:26,224][0m Trial 552 finished with value: 0.6934152964674969 and parameters: {'n_hidden': 1024, 'mixture_components': 9, 'use_sparse_layer': False, 'use_batchnorm': False, 'use_dropout': False, 'mlp_size_1': 6, 'mlp_size_2': 0, 'mlp_size_3': 1, 'kernel': 'Logistic', 'loss_name': 'AlternativeNLLLoss'}. Best is trial 530 with value: 0.7027982899957603.[0m
[32m[I 2022-04-23 00:01:10,917][0m Trial 553 finished with value: 0.6438046572169733 and parameters: {'n_hidden': 1024, 'mixture_components': 5, 'use_sparse_layer': False, 'use_batchnorm': False, 'use_dropout': False, 'mlp_size_1': 6, 'mlp_size_2': 0, 'mlp_size_3': 1, 'kernel': 'LogLogistic', 'loss_name': 'AlternativeNLLLoss'}. Best is trial 530 with value: 0.7027982899957603.[0m
[32m[I 2022-04-23 00:02:15,533][0m Trial 554 finished with value: 0.6744047041391742 and parameters: {'n_hidden': 1024, 'mixture_components': 7, 'use_sparse_layer': False, 'use_batchnorm': False, 'use_dropout': False, 'mlp_size_1': 6, 'mlp_size_2': 0, 'mlp_size_3': 1, 'kernel': 'Logistic', 'loss_name': 'AlternativeNLLLoss'}. Best is trial 530 with value: 0.7027982899957603.[0m
[32m[I 2022-04-23 00:03:16,144][0m Trial 555 finished with value: 0.6777548182819275 and parameters: {'n_hidden': 1024, 'mixture_components': 8, 'use_sparse_layer': False, 'use_batchnorm': False, 'use_dropout': False, 'mlp_size_1': 6, 'mlp_size_2': 0, 'mlp_size_3': 1, 'kernel': 'LogLogistic', 'loss_name': 'AlternativeNLLLoss'}. Best is trial 530 with value: 0.7027982899957603.[0m
[32m[I 2022-04-23 00:03:55,969][0m Trial 556 finished with value: 0.6702629385700849 and parameters: {'n_hidden': 1024, 'mixture_components': 10, 'use_sparse_layer': False, 'use_batchnorm': False, 'use_dropout': False, 'mlp_size_1': 6, 'mlp_size_2': 0, 'mlp_size_3': 1, 'kernel': 'Logistic', 'loss_name': 'NLLLoss'}. Best is trial 530 with value: 0.7027982899957603.[0m
[32m[I 2022-04-23 00:04:34,947][0m Trial 557 finished with value: 0.6790828849459959 and parameters: {'n_hidden': 1024, 'mixture_components': 8, 'use_sparse_layer': False, 'use_batchnorm': False, 'use_dropout': False, 'mlp_size_1': 6, 'mlp_size_2': 0, 'mlp_size_3': 1, 'kernel': 'Gumbel', 'loss_name': 'NLLLoss'}. Best is trial 530 with value: 0.7027982899957603.[0m
[32m[I 2022-04-23 00:05:33,557][0m Trial 558 finished with value: 0.6800327751569653 and parameters: {'n_hidden': 1024, 'mixture_components': 6, 'use_sparse_layer': False, 'use_batchnorm': False, 'use_dropout': False, 'mlp_size_1': 6, 'mlp_size_2': 0, 'mlp_size_3': 1, 'kernel': 'Normal', 'loss_name': 'NLLLoss'}. Best is trial 530 with value: 0.7027982899957603.[0m
[32m[I 2022-04-23 00:06:07,612][0m Trial 559 finished with value: 0.6803110733253191 and parameters: {'n_hidden': 1024, 'mixture_components': 9, 'use_sparse_layer': False, 'use_batchnorm': False, 'use_dropout': False, 'mlp_size_1': 6, 'mlp_size_2': 0, 'mlp_size_3': 1, 'kernel': 'Exponential', 'loss_name': 'NLLLoss'}. Best is trial 530 with value: 0.7027982899957603.[0m
[32m[I 2022-04-23 00:06:57,937][0m Trial 560 finished with value: 0.6922094949328287 and parameters: {'n_hidden': 1024, 'mixture_components': 8, 'use_sparse_layer': True, 'use_sparse_loss': False, 'use_batchnorm': False, 'use_dropout': False, 'mlp_size_1': 6, 'mlp_size_2': 0, 'mlp_size_3': 1, 'kernel': 'Logistic', 'loss_name': 'NLLLoss'}. Best is trial 530 with value: 0.7027982899957603.[0m
[32m[I 2022-04-23 00:07:43,800][0m Trial 561 finished with value: 0.6874164943045589 and parameters: {'n_hidden': 512, 'mixture_components': 4, 'use_sparse_layer': False, 'use_batchnorm': False, 'use_dropout': False, 'mlp_size_1': 6, 'mlp_size_2': 0, 'mlp_size_3': 0, 'kernel': 'Gumbel', 'loss_name': 'CensoredNLLLoss'}. Best is trial 530 with value: 0.7027982899957603.[0m
[32m[I 2022-04-23 00:08:24,620][0m Trial 562 finished with value: 0.6386635223383749 and parameters: {'n_hidden': 1024, 'mixture_components': 9, 'use_sparse_layer': False, 'use_batchnorm': False, 'use_dropout': True, 'dropout': 0.7105523610187737, 'mlp_size_1': 6, 'mlp_size_2': 0, 'mlp_size_3': 1, 'kernel': 'Normal', 'loss_name': 'NLLLoss'}. Best is trial 530 with value: 0.7027982899957603.[0m
