[32m[I 2022-04-21 11:49:07,150][0m Trial 651 finished with value: 0.6467986952299172 and parameters: {'splitter': 'best', 'min_samples_split': 0.18435900648332165, 'min_samples_leaf': 0.009502977060323284, 'min_weight_fraction_leaf': 0.019797706510314737, 'max_features': 0.693494456027368}. Best is trial 507 with value: 0.6585778818712512.[0m
[32m[I 2022-04-21 11:49:07,557][0m Trial 652 finished with value: 0.6124756406477633 and parameters: {'splitter': 'best', 'min_samples_split': 0.19655611346021729, 'min_samples_leaf': 0.010176465557379518, 'min_weight_fraction_leaf': 0.04336150724013151, 'max_features': 0.6782214969967685}. Best is trial 507 with value: 0.6585778818712512.[0m
[32m[I 2022-04-21 11:49:08,018][0m Trial 653 finished with value: 0.6214947353769331 and parameters: {'splitter': 'best', 'min_samples_split': 0.1729412065255622, 'min_samples_leaf': 0.019151188195144525, 'min_weight_fraction_leaf': 0.02267684554667215, 'max_features': 0.6986951190284597}. Best is trial 507 with value: 0.6585778818712512.[0m
[32m[I 2022-04-21 11:49:08,145][0m Trial 654 finished with value: 0.5358564240914311 and parameters: {'splitter': 'best', 'min_samples_split': 0.1874459836163131, 'min_samples_leaf': 0.39672566188104774, 'min_weight_fraction_leaf': 0.35822447349987935, 'max_features': 0.6771661789591288}. Best is trial 507 with value: 0.6585778818712512.[0m
[32m[I 2022-04-21 11:49:08,668][0m Trial 655 finished with value: 0.6018179323018611 and parameters: {'splitter': 'best', 'min_samples_split': 0.19384595808841404, 'min_samples_leaf': 0.028348121702868635, 'min_weight_fraction_leaf': 0.06757222060299478, 'max_features': 0.6922166476691517}. Best is trial 507 with value: 0.6585778818712512.[0m
[32m[I 2022-04-21 11:49:09,500][0m Trial 656 finished with value: 0.6280058316791098 and parameters: {'splitter': 'best', 'min_samples_split': 0.18250262621396285, 'min_samples_leaf': 0.00894182510899438, 'min_weight_fraction_leaf': 0.035905733953019416, 'max_features': 0.7439222981623899}. Best is trial 507 with value: 0.6585778818712512.[0m
[32m[I 2022-04-21 11:49:10,025][0m Trial 657 finished with value: 0.6229904473777491 and parameters: {'splitter': 'best', 'min_samples_split': 0.16924515659246644, 'min_samples_leaf': 0.001025756984693935, 'min_weight_fraction_leaf': 0.02086666632263441, 'max_features': 0.7104722816542428}. Best is trial 507 with value: 0.6585778818712512.[0m
[32m[I 2022-04-21 11:49:10,721][0m Trial 658 finished with value: 0.6285424700983423 and parameters: {'splitter': 'best', 'min_samples_split': 0.17786959971354882, 'min_samples_leaf': 0.017992381438599547, 'min_weight_fraction_leaf': 0.014946810379983314, 'max_features': 0.653910692384571}. Best is trial 507 with value: 0.6585778818712512.[0m
[32m[I 2022-04-21 11:49:11,129][0m Trial 659 finished with value: 0.6103456413638738 and parameters: {'splitter': 'best', 'min_samples_split': 0.1841926618847652, 'min_samples_leaf': 0.029008819742331236, 'min_weight_fraction_leaf': 0.1670971175662368, 'max_features': 0.6885238756645933}. Best is trial 507 with value: 0.6585778818712512.[0m
[32m[I 2022-04-21 11:49:12,134][0m Trial 660 finished with value: 0.6163265590910145 and parameters: {'splitter': 'best', 'min_samples_split': 0.16470678684913592, 'min_samples_leaf': 0.011893243718142056, 'min_weight_fraction_leaf': 0.014743230489013976, 'max_features': 0.6584888708092412}. Best is trial 507 with value: 0.6585778818712512.[0m
[32m[I 2022-04-21 11:49:12,782][0m Trial 661 finished with value: 0.6162512728477931 and parameters: {'splitter': 'best', 'min_samples_split': 0.18914047909492687, 'min_samples_leaf': 0.03828010874569207, 'min_weight_fraction_leaf': 0.029309879560118695, 'max_features': 0.7621770061038422}. Best is trial 507 with value: 0.6585778818712512.[0m
[32m[I 2022-04-21 11:49:12,915][0m Trial 662 finished with value: 0.5421960700702187 and parameters: {'splitter': 'best', 'min_samples_split': 0.17503735825664907, 'min_samples_leaf': 0.33530823436227214, 'min_weight_fraction_leaf': 0.05253551764164267, 'max_features': 0.6690559714665666}. Best is trial 507 with value: 0.6585778818712512.[0m
[32m[I 2022-04-21 11:49:13,224][0m Trial 663 finished with value: 0.6155982409264781 and parameters: {'splitter': 'best', 'min_samples_split': 0.15734091468852862, 'min_samples_leaf': 0.02047026449660567, 'min_weight_fraction_leaf': 0.008352159709127368, 'max_features': 0.2778278234447706}. Best is trial 507 with value: 0.6585778818712512.[0m
[32m[I 2022-04-21 11:49:13,891][0m Trial 664 finished with value: 0.6361751753787634 and parameters: {'splitter': 'best', 'min_samples_split': 0.15220464646922624, 'min_samples_leaf': 0.009156802598832711, 'min_weight_fraction_leaf': 0.02130930527700979, 'max_features': 0.7238751828091652}. Best is trial 507 with value: 0.6585778818712512.[0m
[32m[I 2022-04-21 11:49:15,029][0m Trial 665 finished with value: 0.6252759281825627 and parameters: {'splitter': 'best', 'min_samples_split': 0.1652061009795853, 'min_samples_leaf': 0.001538228716814565, 'min_weight_fraction_leaf': 0.03825438379031189, 'max_features': 0.7017589461150643}. Best is trial 507 with value: 0.6585778818712512.[0m
[32m[I 2022-04-21 11:49:15,821][0m Trial 666 finished with value: 0.6250494840860364 and parameters: {'splitter': 'best', 'min_samples_split': 0.17987131538256565, 'min_samples_leaf': 0.025865630777511264, 'min_weight_fraction_leaf': 0.008855483618840674, 'max_features': 0.6490499091988599}. Best is trial 507 with value: 0.6585778818712512.[0m
[32m[I 2022-04-21 11:49:17,261][0m Trial 667 finished with value: 0.6358404931285645 and parameters: {'splitter': 'best', 'min_samples_split': 0.2000853637653714, 'min_samples_leaf': 0.016831883751140385, 'min_weight_fraction_leaf': 0.0002950188610324877, 'max_features': 0.7418978130702433}. Best is trial 507 with value: 0.6585778818712512.[0m
[32m[I 2022-04-21 11:49:18,782][0m Trial 668 finished with value: 0.6326196122438025 and parameters: {'splitter': 'best', 'min_samples_split': 0.1376149372253392, 'min_samples_leaf': 0.009702444531708251, 'min_weight_fraction_leaf': 0.016240048412138147, 'max_features': 0.7122635231816343}. Best is trial 507 with value: 0.6585778818712512.[0m
[32m[I 2022-04-21 11:49:19,523][0m Trial 669 finished with value: 0.6211371811930111 and parameters: {'splitter': 'best', 'min_samples_split': 0.14733896895157075, 'min_samples_leaf': 0.04311760934224354, 'min_weight_fraction_leaf': 0.02867844187687311, 'max_features': 0.6832919142686722}. Best is trial 507 with value: 0.6585778818712512.[0m
[32m[I 2022-04-21 11:49:20,371][0m Trial 670 finished with value: 0.6319308951822896 and parameters: {'splitter': 'best', 'min_samples_split': 0.1685437083022505, 'min_samples_leaf': 0.024291177365909924, 'min_weight_fraction_leaf': 0.009312488972943001, 'max_features': 0.7752369858939594}. Best is trial 507 with value: 0.6585778818712512.[0m
[32m[I 2022-04-21 11:49:20,875][0m Trial 671 finished with value: 0.6323908240554015 and parameters: {'splitter': 'best', 'min_samples_split': 0.15194934607228922, 'min_samples_leaf': 0.03297103019237893, 'min_weight_fraction_leaf': 0.0005071221565774893, 'max_features': 0.6342194692698145}. Best is trial 507 with value: 0.6585778818712512.[0m
[32m[I 2022-04-21 11:49:21,456][0m Trial 672 finished with value: 0.6287429324139239 and parameters: {'splitter': 'best', 'min_samples_split': 0.1597028947719908, 'min_samples_leaf': 0.017071130919669858, 'min_weight_fraction_leaf': 0.022654585057638454, 'max_features': 0.6630648365321907}. Best is trial 507 with value: 0.6585778818712512.[0m
[32m[I 2022-04-21 11:49:23,184][0m Trial 673 finished with value: 0.6450676162368824 and parameters: {'splitter': 'best', 'min_samples_split': 0.1761497700494492, 'min_samples_leaf': 0.0016863799557551148, 'min_weight_fraction_leaf': 0.0001524165219209707, 'max_features': 0.6441557726003841}. Best is trial 507 with value: 0.6585778818712512.[0m
[32m[I 2022-04-21 11:49:24,253][0m Trial 674 finished with value: 0.6458082536281056 and parameters: {'splitter': 'best', 'min_samples_split': 0.13670558543556133, 'min_samples_leaf': 0.012259406209657915, 'min_weight_fraction_leaf': 0.015194438691857163, 'max_features': 0.7802557422882954}. Best is trial 507 with value: 0.6585778818712512.[0m
[32m[I 2022-04-21 11:49:25,618][0m Trial 675 finished with value: 0.6078508812811256 and parameters: {'splitter': 'best', 'min_samples_split': 0.13730250104026684, 'min_samples_leaf': 0.0014653351321438546, 'min_weight_fraction_leaf': 0.04423370715457184, 'max_features': 0.7787637311788546}. Best is trial 507 with value: 0.6585778818712512.[0m
[32m[I 2022-04-21 11:49:26,493][0m Trial 676 finished with value: 0.6184293651420352 and parameters: {'splitter': 'best', 'min_samples_split': 0.12649761986694513, 'min_samples_leaf': 0.011554863932219661, 'min_weight_fraction_leaf': 0.03432385660515182, 'max_features': 0.7826919182486763}. Best is trial 507 with value: 0.6585778818712512.[0m
[32m[I 2022-04-21 11:49:27,609][0m Trial 677 finished with value: 0.6258993360654831 and parameters: {'splitter': 'best', 'min_samples_split': 0.19194464309619255, 'min_samples_leaf': 0.010598876701371404, 'min_weight_fraction_leaf': 0.022073731222221463, 'max_features': 0.8130016041787421}. Best is trial 507 with value: 0.6585778818712512.[0m
[32m[I 2022-04-21 11:49:28,667][0m Trial 678 finished with value: 0.6294249815353788 and parameters: {'splitter': 'best', 'min_samples_split': 0.11964477809003349, 'min_samples_leaf': 0.017666536772412297, 'min_weight_fraction_leaf': 0.028777226876848958, 'max_features': 0.8048383268657653}. Best is trial 507 with value: 0.6585778818712512.[0m
[32m[I 2022-04-21 11:49:29,306][0m Trial 679 finished with value: 0.6324091915498579 and parameters: {'splitter': 'best', 'min_samples_split': 0.1339098576408114, 'min_samples_leaf': 0.00833799691502719, 'min_weight_fraction_leaf': 0.015877585025930487, 'max_features': 0.7578870183482661}. Best is trial 507 with value: 0.6585778818712512.[0m
[32m[I 2022-04-21 11:49:29,499][0m Trial 680 finished with value: 0.606254634025204 and parameters: {'splitter': 'best', 'min_samples_split': 0.14016886755661043, 'min_samples_leaf': 0.1264078880211385, 'min_weight_fraction_leaf': 0.01745580989249517, 'max_features': 0.788624791969225}. Best is trial 507 with value: 0.6585778818712512.[0m
[32m[I 2022-04-21 11:49:29,892][0m Trial 681 finished with value: 0.6250384750891247 and parameters: {'splitter': 'best', 'min_samples_split': 0.11447277138307647, 'min_samples_leaf': 0.01870064019204347, 'min_weight_fraction_leaf': 0.04078551545137118, 'max_features': 0.7438755026163614}. Best is trial 507 with value: 0.6585778818712512.[0m
[32m[I 2022-04-21 11:49:30,478][0m Trial 682 finished with value: 0.6372197967589448 and parameters: {'splitter': 'best', 'min_samples_split': 0.12968754857823994, 'min_samples_leaf': 0.0016709201396558453, 'min_weight_fraction_leaf': 0.0282877611214404, 'max_features': 0.7946514166794054}. Best is trial 507 with value: 0.6585778818712512.[0m
[32m[I 2022-04-21 11:49:30,963][0m Trial 683 finished with value: 0.6257797064905583 and parameters: {'splitter': 'best', 'min_samples_split': 0.1411772619920681, 'min_samples_leaf': 0.023393009740891285, 'min_weight_fraction_leaf': 0.013955742293737042, 'max_features': 0.769942560391042}. Best is trial 507 with value: 0.6585778818712512.[0m
[32m[I 2022-04-21 11:49:31,865][0m Trial 684 finished with value: 0.6291801664121616 and parameters: {'splitter': 'best', 'min_samples_split': 0.12014189027097456, 'min_samples_leaf': 0.009475799483343416, 'min_weight_fraction_leaf': 0.009302565035581781, 'max_features': 0.7435709966464521}. Best is trial 507 with value: 0.6585778818712512.[0m
[32m[I 2022-04-21 11:49:32,383][0m Trial 685 finished with value: 0.6364969744563436 and parameters: {'splitter': 'best', 'min_samples_split': 0.10945343139086519, 'min_samples_leaf': 0.01728405866198588, 'min_weight_fraction_leaf': 0.023600955421902128, 'max_features': 0.724587960533931}. Best is trial 507 with value: 0.6585778818712512.[0m
[32m[I 2022-04-21 11:49:32,605][0m Trial 686 finished with value: 0.625079463461218 and parameters: {'splitter': 'random', 'min_samples_split': 0.1250400533362934, 'min_samples_leaf': 0.009624528281689927, 'min_weight_fraction_leaf': 0.00011716492882865939, 'max_features': 0.829063727017401}. Best is trial 507 with value: 0.6585778818712512.[0m
[32m[I 2022-04-21 11:49:33,300][0m Trial 687 finished with value: 0.6229503207383453 and parameters: {'splitter': 'best', 'min_samples_split': 0.14538199185837108, 'min_samples_leaf': 0.02667059388235541, 'min_weight_fraction_leaf': 0.03254864976687014, 'max_features': 0.7004859494565274}. Best is trial 507 with value: 0.6585778818712512.[0m
[32m[I 2022-04-21 11:49:34,270][0m Trial 688 finished with value: 0.6612018755665507 and parameters: {'splitter': 'best', 'min_samples_split': 0.181488236332204, 'min_samples_leaf': 0.0015599524210311543, 'min_weight_fraction_leaf': 0.010651339121299435, 'max_features': 0.8065393331335484}. Best is trial 688 with value: 0.6612018755665507.[0m
[32m[I 2022-04-21 11:49:34,940][0m Trial 689 finished with value: 0.6402585155327861 and parameters: {'splitter': 'best', 'min_samples_split': 0.19976198100318626, 'min_samples_leaf': 0.018457047056817236, 'min_weight_fraction_leaf': 0.011338722069597138, 'max_features': 0.798479476110614}. Best is trial 688 with value: 0.6612018755665507.[0m
[32m[I 2022-04-21 11:49:35,606][0m Trial 690 finished with value: 0.6258993360654831 and parameters: {'splitter': 'best', 'min_samples_split': 0.194764943655199, 'min_samples_leaf': 0.0256774545948149, 'min_weight_fraction_leaf': 0.011323355223870783, 'max_features': 0.8138661966182971}. Best is trial 688 with value: 0.6612018755665507.[0m
[32m[I 2022-04-21 11:49:36,542][0m Trial 691 finished with value: 0.6554009277254302 and parameters: {'splitter': 'best', 'min_samples_split': 0.18407648212271288, 'min_samples_leaf': 0.00970777031093545, 'min_weight_fraction_leaf': 0.008871480817423397, 'max_features': 0.8541179930022066}. Best is trial 688 with value: 0.6612018755665507.[0m
[32m[I 2022-04-21 11:49:38,077][0m Trial 692 finished with value: 0.6393601627593697 and parameters: {'splitter': 'best', 'min_samples_split': 0.18104447074976204, 'min_samples_leaf': 0.0013925212338521814, 'min_weight_fraction_leaf': 0.006671013942986552, 'max_features': 0.8468284073228223}. Best is trial 688 with value: 0.6612018755665507.[0m
[32m[I 2022-04-21 11:49:38,629][0m Trial 693 finished with value: 0.6303884222594404 and parameters: {'splitter': 'best', 'min_samples_split': 0.18836935986803527, 'min_samples_leaf': 0.010806107500606905, 'min_weight_fraction_leaf': 0.0009485390271107225, 'max_features': 0.6784057614784024}. Best is trial 688 with value: 0.6612018755665507.[0m
[32m[I 2022-04-21 11:49:39,718][0m Trial 694 finished with value: 0.6369762286137417 and parameters: {'splitter': 'best', 'min_samples_split': 0.18353195610851492, 'min_samples_leaf': 0.001029408211155677, 'min_weight_fraction_leaf': 0.008709952189883356, 'max_features': 0.8684387833536201}. Best is trial 688 with value: 0.6612018755665507.[0m
[32m[I 2022-04-21 11:49:40,327][0m Trial 695 finished with value: 0.6221384463494977 and parameters: {'splitter': 'best', 'min_samples_split': 0.2080788215550074, 'min_samples_leaf': 0.02944192372233434, 'min_weight_fraction_leaf': 0.0003419823809384456, 'max_features': 0.893688469068634}. Best is trial 688 with value: 0.6612018755665507.[0m
[32m[I 2022-04-21 11:49:40,907][0m Trial 696 finished with value: 0.6300913579885522 and parameters: {'splitter': 'best', 'min_samples_split': 0.19954180095918495, 'min_samples_leaf': 0.017240284023997007, 'min_weight_fraction_leaf': 0.018739184205187914, 'max_features': 0.9491084891902987}. Best is trial 688 with value: 0.6612018755665507.[0m
[32m[I 2022-04-21 11:49:40,976][0m Trial 697 finished with value: 0.5174275190875536 and parameters: {'splitter': 'best', 'min_samples_split': 0.18568375578203353, 'min_samples_leaf': 0.45495706077062226, 'min_weight_fraction_leaf': 0.016760246697211316, 'max_features': 0.821639228704767}. Best is trial 688 with value: 0.6612018755665507.[0m
[32m[I 2022-04-21 11:49:41,123][0m Trial 698 finished with value: 0.5860135540595597 and parameters: {'splitter': 'best', 'min_samples_split': 0.17537424001646745, 'min_samples_leaf': 0.03474108395821188, 'min_weight_fraction_leaf': 0.0076368359344078885, 'max_features': 0.1682719984846992}. Best is trial 688 with value: 0.6612018755665507.[0m
[32m[I 2022-04-21 11:49:41,429][0m Trial 699 finished with value: 0.5878536894259169 and parameters: {'splitter': 'best', 'min_samples_split': 0.19264313692942184, 'min_samples_leaf': 0.009625955975701681, 'min_weight_fraction_leaf': 0.20253467544636114, 'max_features': 0.6678025227660288}. Best is trial 688 with value: 0.6612018755665507.[0m
[32m[I 2022-04-21 11:49:41,808][0m Trial 700 finished with value: 0.6158849438706083 and parameters: {'splitter': 'best', 'min_samples_split': 0.20400827189726894, 'min_samples_leaf': 0.02215017102320816, 'min_weight_fraction_leaf': 5.2848315896332834e-05, 'max_features': 0.703735861044592}. Best is trial 688 with value: 0.6612018755665507.[0m
[32m[I 2022-04-21 11:49:42,655][0m Trial 701 finished with value: 0.622693313584491 and parameters: {'splitter': 'best', 'min_samples_split': 0.17158219707531192, 'min_samples_leaf': 0.0012849225423711638, 'min_weight_fraction_leaf': 0.024245363189385125, 'max_features': 0.8529215354538469}. Best is trial 688 with value: 0.6612018755665507.[0m
[32m[I 2022-04-21 11:49:43,109][0m Trial 702 finished with value: 0.6446620200377409 and parameters: {'splitter': 'best', 'min_samples_split': 0.18500058123429958, 'min_samples_leaf': 0.01916058032659178, 'min_weight_fraction_leaf': 0.014006620808175146, 'max_features': 0.6894318924334855}. Best is trial 688 with value: 0.6612018755665507.[0m
[32m[I 2022-04-21 11:49:43,353][0m Trial 703 finished with value: 0.6272904640081398 and parameters: {'splitter': 'best', 'min_samples_split': 0.16876594598295597, 'min_samples_leaf': 0.04341595378414284, 'min_weight_fraction_leaf': 1.5818960790242034e-05, 'max_features': 0.6441315582515442}. Best is trial 688 with value: 0.6612018755665507.[0m
[32m[I 2022-04-21 11:49:43,833][0m Trial 704 finished with value: 0.6235460711941629 and parameters: {'splitter': 'best', 'min_samples_split': 0.17665525219574488, 'min_samples_leaf': 0.01228444851976786, 'min_weight_fraction_leaf': 0.02823939770203427, 'max_features': 0.8588218217672587}. Best is trial 688 with value: 0.6612018755665507.[0m
[32m[I 2022-04-21 11:49:44,047][0m Trial 705 finished with value: 0.6155668968205753 and parameters: {'splitter': 'random', 'min_samples_split': 0.1904894655269922, 'min_samples_leaf': 0.026433426072969928, 'min_weight_fraction_leaf': 0.016400763338591962, 'max_features': 0.8237327964460726}. Best is trial 688 with value: 0.6612018755665507.[0m
[32m[I 2022-04-21 11:49:45,111][0m Trial 706 finished with value: 0.633822046824337 and parameters: {'splitter': 'best', 'min_samples_split': 0.17699223724706636, 'min_samples_leaf': 0.001182591624578701, 'min_weight_fraction_leaf': 0.00920222329996188, 'max_features': 0.9359039989696795}. Best is trial 688 with value: 0.6612018755665507.[0m
[32m[I 2022-04-21 11:49:45,471][0m Trial 707 finished with value: 0.6274851394360803 and parameters: {'splitter': 'best', 'min_samples_split': 0.16733490993570033, 'min_samples_leaf': 0.03666250874784295, 'min_weight_fraction_leaf': 0.03734615241911416, 'max_features': 0.8442493412059222}. Best is trial 688 with value: 0.6612018755665507.[0m
[32m[I 2022-04-21 11:49:46,245][0m Trial 708 finished with value: 0.6259776834118961 and parameters: {'splitter': 'best', 'min_samples_split': 0.18280891247123343, 'min_samples_leaf': 0.016472788587501824, 'min_weight_fraction_leaf': 0.0244790696424376, 'max_features': 0.9045685640334308}. Best is trial 688 with value: 0.6612018755665507.[0m
[32m[I 2022-04-21 11:49:46,944][0m Trial 709 finished with value: 0.6388373194138296 and parameters: {'splitter': 'best', 'min_samples_split': 0.19495412673403265, 'min_samples_leaf': 0.011352651705455248, 'min_weight_fraction_leaf': 0.009471602802018756, 'max_features': 0.8380936181151002}. Best is trial 688 with value: 0.6612018755665507.[0m
[32m[I 2022-04-21 11:49:47,427][0m Trial 710 finished with value: 0.6268667571250306 and parameters: {'splitter': 'best', 'min_samples_split': 0.1593834118101222, 'min_samples_leaf': 0.02415431735838791, 'min_weight_fraction_leaf': 0.00018358930980543614, 'max_features': 0.8765945426552509}. Best is trial 688 with value: 0.6612018755665507.[0m
[32m[I 2022-04-21 11:49:47,524][0m Trial 711 finished with value: 0.5488206957621745 and parameters: {'splitter': 'best', 'min_samples_split': 0.16526525838854372, 'min_samples_leaf': 0.28591336969462405, 'min_weight_fraction_leaf': 0.05656465604684726, 'max_features': 0.8837280715156769}. Best is trial 688 with value: 0.6612018755665507.[0m
[32m[I 2022-04-21 11:49:48,478][0m Trial 712 finished with value: 0.6237310189950108 and parameters: {'splitter': 'best', 'min_samples_split': 0.18270197663149496, 'min_samples_leaf': 0.008119224602526476, 'min_weight_fraction_leaf': 0.020002431125735028, 'max_features': 0.8690522306018826}. Best is trial 688 with value: 0.6612018755665507.[0m
[32m[I 2022-04-21 11:49:49,382][0m Trial 713 finished with value: 0.6117800984921018 and parameters: {'splitter': 'best', 'min_samples_split': 0.17292532619708983, 'min_samples_leaf': 0.030062523112506727, 'min_weight_fraction_leaf': 0.03378276737431314, 'max_features': 0.6611072307289813}. Best is trial 688 with value: 0.6612018755665507.[0m
