[32m[I 2022-04-21 11:45:35,075][0m Trial 927 finished with value: 0.6829090813866752 and parameters: {'alpha': 1.1095513837678959, 'ties': 'breslow'}. Best is trial 26 with value: 0.6847054012696481.[0m
[32m[I 2022-04-21 11:45:35,378][0m Trial 928 finished with value: 0.684367348820454 and parameters: {'alpha': 0.6209088581738846, 'ties': 'efron'}. Best is trial 26 with value: 0.6847054012696481.[0m
[32m[I 2022-04-21 11:45:35,745][0m Trial 929 finished with value: 0.684367348820454 and parameters: {'alpha': 0.5884394346908148, 'ties': 'efron'}. Best is trial 26 with value: 0.6847054012696481.[0m
[32m[I 2022-04-21 11:45:36,208][0m Trial 930 finished with value: 0.6847054012696481 and parameters: {'alpha': 0.7113077788600062, 'ties': 'efron'}. Best is trial 26 with value: 0.6847054012696481.[0m
[32m[I 2022-04-21 11:45:36,589][0m Trial 931 finished with value: 0.6829496894793843 and parameters: {'alpha': 2.652361357085163, 'ties': 'efron'}. Best is trial 26 with value: 0.6847054012696481.[0m
[32m[I 2022-04-21 11:45:36,828][0m Trial 932 finished with value: 0.6829090813866752 and parameters: {'alpha': 0.8702218356299315, 'ties': 'efron'}. Best is trial 26 with value: 0.6847054012696481.[0m
[32m[I 2022-04-21 11:45:37,075][0m Trial 933 finished with value: 0.6814469677485105 and parameters: {'alpha': 4.634477340088084, 'ties': 'efron'}. Best is trial 26 with value: 0.6847054012696481.[0m
[32m[I 2022-04-21 11:45:37,482][0m Trial 934 finished with value: 0.684367348820454 and parameters: {'alpha': 0.46908169131281646, 'ties': 'breslow'}. Best is trial 26 with value: 0.6847054012696481.[0m
[32m[I 2022-04-21 11:45:37,803][0m Trial 935 finished with value: 0.6847054012696481 and parameters: {'alpha': 0.8943133245086687, 'ties': 'breslow'}. Best is trial 26 with value: 0.6847054012696481.[0m
[32m[I 2022-04-21 11:45:38,223][0m Trial 936 finished with value: 0.6829090813866752 and parameters: {'alpha': 0.9983777252720105, 'ties': 'breslow'}. Best is trial 26 with value: 0.6847054012696481.[0m
[32m[I 2022-04-21 11:45:38,618][0m Trial 937 finished with value: 0.6847054012696481 and parameters: {'alpha': 0.8293904253062225, 'ties': 'efron'}. Best is trial 26 with value: 0.6847054012696481.[0m
[32m[I 2022-04-21 11:45:38,873][0m Trial 938 finished with value: 0.6847054012696481 and parameters: {'alpha': 0.8617968370568285, 'ties': 'breslow'}. Best is trial 26 with value: 0.6847054012696481.[0m
[32m[I 2022-04-21 11:45:39,088][0m Trial 939 finished with value: 0.6847054012696481 and parameters: {'alpha': 0.7494847982241911, 'ties': 'efron'}. Best is trial 26 with value: 0.6847054012696481.[0m
[32m[I 2022-04-21 11:45:39,229][0m Trial 940 finished with value: 0.6847054012696481 and parameters: {'alpha': 0.7243454936133099, 'ties': 'efron'}. Best is trial 26 with value: 0.6847054012696481.[0m
[32m[I 2022-04-21 11:45:39,436][0m Trial 941 finished with value: 0.684367348820454 and parameters: {'alpha': 0.5806979692547873, 'ties': 'efron'}. Best is trial 26 with value: 0.6847054012696481.[0m
[32m[I 2022-04-21 11:45:39,751][0m Trial 942 finished with value: 0.6847054012696481 and parameters: {'alpha': 0.9102464804122763, 'ties': 'breslow'}. Best is trial 26 with value: 0.6847054012696481.[0m
[32m[I 2022-04-21 11:45:40,000][0m Trial 943 finished with value: 0.6829090813866752 and parameters: {'alpha': 1.2730390041541375, 'ties': 'breslow'}. Best is trial 26 with value: 0.6847054012696481.[0m
[32m[I 2022-04-21 11:45:40,214][0m Trial 944 finished with value: 0.6847054012696481 and parameters: {'alpha': 0.7529880407916402, 'ties': 'breslow'}. Best is trial 26 with value: 0.6847054012696481.[0m
[32m[I 2022-04-21 11:45:40,443][0m Trial 945 finished with value: 0.684367348820454 and parameters: {'alpha': 0.6938235423281924, 'ties': 'breslow'}. Best is trial 26 with value: 0.6847054012696481.[0m
[32m[I 2022-04-21 11:45:40,572][0m Trial 946 finished with value: 0.684367348820454 and parameters: {'alpha': 0.4792687043354741, 'ties': 'breslow'}. Best is trial 26 with value: 0.6847054012696481.[0m
[32m[I 2022-04-21 11:45:40,805][0m Trial 947 finished with value: 0.684367348820454 and parameters: {'alpha': 0.6383626396294317, 'ties': 'efron'}. Best is trial 26 with value: 0.6847054012696481.[0m
[32m[I 2022-04-21 11:45:41,021][0m Trial 948 finished with value: 0.684367348820454 and parameters: {'alpha': 0.6407855943160514, 'ties': 'efron'}. Best is trial 26 with value: 0.6847054012696481.[0m
[32m[I 2022-04-21 11:45:41,218][0m Trial 949 finished with value: 0.6829090813866752 and parameters: {'alpha': 1.1604495578964975, 'ties': 'breslow'}. Best is trial 26 with value: 0.6847054012696481.[0m
[32m[I 2022-04-21 11:45:41,589][0m Trial 950 finished with value: 0.6829090813866752 and parameters: {'alpha': 0.9981047276798642, 'ties': 'efron'}. Best is trial 26 with value: 0.6847054012696481.[0m
[32m[I 2022-04-21 11:45:41,930][0m Trial 951 finished with value: 0.6826116370301901 and parameters: {'alpha': 3.1893747973931648, 'ties': 'efron'}. Best is trial 26 with value: 0.6847054012696481.[0m
[32m[I 2022-04-21 11:45:42,311][0m Trial 952 finished with value: 0.6847054012696481 and parameters: {'alpha': 0.7815796209746543, 'ties': 'efron'}. Best is trial 26 with value: 0.6847054012696481.[0m
[32m[I 2022-04-21 11:45:42,484][0m Trial 953 finished with value: 0.6847054012696481 and parameters: {'alpha': 0.825831613746415, 'ties': 'breslow'}. Best is trial 26 with value: 0.6847054012696481.[0m
[32m[I 2022-04-21 11:45:42,684][0m Trial 954 finished with value: 0.6847054012696481 and parameters: {'alpha': 0.7799232978991487, 'ties': 'efron'}. Best is trial 26 with value: 0.6847054012696481.[0m
[32m[I 2022-04-21 11:45:42,875][0m Trial 955 finished with value: 0.6847054012696481 and parameters: {'alpha': 0.814426170168499, 'ties': 'breslow'}. Best is trial 26 with value: 0.6847054012696481.[0m
[32m[I 2022-04-21 11:45:43,113][0m Trial 956 finished with value: 0.6847054012696481 and parameters: {'alpha': 0.7432602139227296, 'ties': 'efron'}. Best is trial 26 with value: 0.6847054012696481.[0m
[32m[I 2022-04-21 11:45:43,528][0m Trial 957 finished with value: 0.6829090813866752 and parameters: {'alpha': 1.0685689923773947, 'ties': 'breslow'}. Best is trial 26 with value: 0.6847054012696481.[0m
[32m[I 2022-04-21 11:45:43,805][0m Trial 958 finished with value: 0.6829090813866752 and parameters: {'alpha': 0.9979563286550917, 'ties': 'efron'}. Best is trial 26 with value: 0.6847054012696481.[0m
[32m[I 2022-04-21 11:45:44,002][0m Trial 959 finished with value: 0.6847054012696481 and parameters: {'alpha': 0.9019035673682366, 'ties': 'breslow'}. Best is trial 26 with value: 0.6847054012696481.[0m
[32m[I 2022-04-21 11:45:44,231][0m Trial 960 finished with value: 0.6829090813866752 and parameters: {'alpha': 1.4179140347535055, 'ties': 'breslow'}. Best is trial 26 with value: 0.6847054012696481.[0m
[32m[I 2022-04-21 11:45:44,514][0m Trial 961 finished with value: 0.6829090813866752 and parameters: {'alpha': 0.9481833962266684, 'ties': 'efron'}. Best is trial 26 with value: 0.6847054012696481.[0m
[32m[I 2022-04-21 11:45:44,805][0m Trial 962 finished with value: 0.6847054012696481 and parameters: {'alpha': 0.9142133696229279, 'ties': 'breslow'}. Best is trial 26 with value: 0.6847054012696481.[0m
[32m[I 2022-04-21 11:45:45,070][0m Trial 963 finished with value: 0.6829090813866752 and parameters: {'alpha': 1.0727295658955276, 'ties': 'breslow'}. Best is trial 26 with value: 0.6847054012696481.[0m
[32m[I 2022-04-21 11:45:45,230][0m Trial 964 finished with value: 0.6829090813866752 and parameters: {'alpha': 0.9680415792955649, 'ties': 'breslow'}. Best is trial 26 with value: 0.6847054012696481.[0m
[32m[I 2022-04-21 11:45:45,367][0m Trial 965 finished with value: 0.684367348820454 and parameters: {'alpha': 0.6362518626829476, 'ties': 'efron'}. Best is trial 26 with value: 0.6847054012696481.[0m
[32m[I 2022-04-21 11:45:45,596][0m Trial 966 finished with value: 0.6847054012696481 and parameters: {'alpha': 0.8401935301674281, 'ties': 'breslow'}. Best is trial 26 with value: 0.6847054012696481.[0m
[32m[I 2022-04-21 11:45:45,758][0m Trial 967 finished with value: 0.684367348820454 and parameters: {'alpha': 0.5231587467800091, 'ties': 'efron'}. Best is trial 26 with value: 0.6847054012696481.[0m
[32m[I 2022-04-21 11:45:45,889][0m Trial 968 finished with value: 0.6847054012696481 and parameters: {'alpha': 0.8760140126137067, 'ties': 'breslow'}. Best is trial 26 with value: 0.6847054012696481.[0m
[32m[I 2022-04-21 11:45:46,017][0m Trial 969 finished with value: 0.6829090813866752 and parameters: {'alpha': 1.0359876668110957, 'ties': 'breslow'}. Best is trial 26 with value: 0.6847054012696481.[0m
[32m[I 2022-04-21 11:45:46,288][0m Trial 970 finished with value: 0.6829090813866752 and parameters: {'alpha': 1.1405728191607318, 'ties': 'breslow'}. Best is trial 26 with value: 0.6847054012696481.[0m
[32m[I 2022-04-21 11:45:46,539][0m Trial 971 finished with value: 0.6829090813866752 and parameters: {'alpha': 0.9525940390693538, 'ties': 'breslow'}. Best is trial 26 with value: 0.6847054012696481.[0m
[32m[I 2022-04-21 11:45:46,805][0m Trial 972 finished with value: 0.6847054012696481 and parameters: {'alpha': 0.9338319202420777, 'ties': 'breslow'}. Best is trial 26 with value: 0.6847054012696481.[0m
[32m[I 2022-04-21 11:45:47,116][0m Trial 973 finished with value: 0.6829090813866752 and parameters: {'alpha': 1.194823373922829, 'ties': 'breslow'}. Best is trial 26 with value: 0.6847054012696481.[0m
[32m[I 2022-04-21 11:45:47,407][0m Trial 974 finished with value: 0.6847054012696481 and parameters: {'alpha': 0.7193018154743471, 'ties': 'efron'}. Best is trial 26 with value: 0.6847054012696481.[0m
[32m[I 2022-04-21 11:45:47,678][0m Trial 975 finished with value: 0.6829090813866752 and parameters: {'alpha': 1.1296805076152994, 'ties': 'breslow'}. Best is trial 26 with value: 0.6847054012696481.[0m
[32m[I 2022-04-21 11:45:47,925][0m Trial 976 finished with value: 0.6847054012696481 and parameters: {'alpha': 0.8638138262176958, 'ties': 'breslow'}. Best is trial 26 with value: 0.6847054012696481.[0m
[32m[I 2022-04-21 11:45:48,209][0m Trial 977 finished with value: 0.6847054012696481 and parameters: {'alpha': 0.8314048077670392, 'ties': 'efron'}. Best is trial 26 with value: 0.6847054012696481.[0m
[32m[I 2022-04-21 11:45:48,557][0m Trial 978 finished with value: 0.6814469677485105 and parameters: {'alpha': 3.679349500289027, 'ties': 'efron'}. Best is trial 26 with value: 0.6847054012696481.[0m
[32m[I 2022-04-21 11:45:48,817][0m Trial 979 finished with value: 0.6847054012696481 and parameters: {'alpha': 0.8702335683735075, 'ties': 'breslow'}. Best is trial 26 with value: 0.6847054012696481.[0m
[32m[I 2022-04-21 11:45:49,100][0m Trial 980 finished with value: 0.6847054012696481 and parameters: {'alpha': 0.8598484862857652, 'ties': 'efron'}. Best is trial 26 with value: 0.6847054012696481.[0m
[32m[I 2022-04-21 11:45:49,352][0m Trial 981 finished with value: 0.6847054012696481 and parameters: {'alpha': 0.7508184325017333, 'ties': 'efron'}. Best is trial 26 with value: 0.6847054012696481.[0m
[32m[I 2022-04-21 11:45:49,584][0m Trial 982 finished with value: 0.684367348820454 and parameters: {'alpha': 0.6753871016566906, 'ties': 'efron'}. Best is trial 26 with value: 0.6847054012696481.[0m
[32m[I 2022-04-21 11:45:49,961][0m Trial 983 finished with value: 0.6829090813866752 and parameters: {'alpha': 1.022121672095029, 'ties': 'efron'}. Best is trial 26 with value: 0.6847054012696481.[0m
[32m[I 2022-04-21 11:45:50,230][0m Trial 984 finished with value: 0.684367348820454 and parameters: {'alpha': 0.5349580900313127, 'ties': 'efron'}. Best is trial 26 with value: 0.6847054012696481.[0m
[32m[I 2022-04-21 11:45:50,823][0m Trial 985 finished with value: 0.684367348820454 and parameters: {'alpha': 0.6737107456931608, 'ties': 'efron'}. Best is trial 26 with value: 0.6847054012696481.[0m
[32m[I 2022-04-21 11:45:51,210][0m Trial 986 finished with value: 0.6829090813866752 and parameters: {'alpha': 0.916941455099231, 'ties': 'efron'}. Best is trial 26 with value: 0.6847054012696481.[0m
[32m[I 2022-04-21 11:45:51,566][0m Trial 987 finished with value: 0.684367348820454 and parameters: {'alpha': 0.38668279945443795, 'ties': 'breslow'}. Best is trial 26 with value: 0.6847054012696481.[0m
[32m[I 2022-04-21 11:45:51,854][0m Trial 988 finished with value: 0.684367348820454 and parameters: {'alpha': 0.596036805874609, 'ties': 'breslow'}. Best is trial 26 with value: 0.6847054012696481.[0m
[32m[I 2022-04-21 11:45:52,083][0m Trial 989 finished with value: 0.684367348820454 and parameters: {'alpha': 0.5528288348431218, 'ties': 'efron'}. Best is trial 26 with value: 0.6847054012696481.[0m
[32m[I 2022-04-21 11:45:52,280][0m Trial 990 finished with value: 0.6847054012696481 and parameters: {'alpha': 0.7644103676272347, 'ties': 'efron'}. Best is trial 26 with value: 0.6847054012696481.[0m
[32m[I 2022-04-21 11:45:52,568][0m Trial 991 finished with value: 0.6847054012696481 and parameters: {'alpha': 0.8389942310560022, 'ties': 'breslow'}. Best is trial 26 with value: 0.6847054012696481.[0m
[32m[I 2022-04-21 11:45:52,966][0m Trial 992 finished with value: 0.6847054012696481 and parameters: {'alpha': 0.7457942043246791, 'ties': 'breslow'}. Best is trial 26 with value: 0.6847054012696481.[0m
[32m[I 2022-04-21 11:45:53,196][0m Trial 993 finished with value: 0.6829090813866752 and parameters: {'alpha': 1.0211020010829632, 'ties': 'breslow'}. Best is trial 26 with value: 0.6847054012696481.[0m
[32m[I 2022-04-21 11:45:53,624][0m Trial 994 finished with value: 0.6847054012696481 and parameters: {'alpha': 0.7851326281063017, 'ties': 'breslow'}. Best is trial 26 with value: 0.6847054012696481.[0m
[32m[I 2022-04-21 11:45:53,979][0m Trial 995 finished with value: 0.684367348820454 and parameters: {'alpha': 0.6623673393195291, 'ties': 'breslow'}. Best is trial 26 with value: 0.6847054012696481.[0m
[32m[I 2022-04-21 11:45:54,242][0m Trial 996 finished with value: 0.682571028937481 and parameters: {'alpha': 1.7167605255845353, 'ties': 'efron'}. Best is trial 26 with value: 0.6847054012696481.[0m
[32m[I 2022-04-21 11:45:54,437][0m Trial 997 finished with value: 0.684367348820454 and parameters: {'alpha': 0.4800115086582087, 'ties': 'breslow'}. Best is trial 26 with value: 0.6847054012696481.[0m
[32m[I 2022-04-21 11:45:54,724][0m Trial 998 finished with value: 0.684367348820454 and parameters: {'alpha': 0.5984490697880296, 'ties': 'efron'}. Best is trial 26 with value: 0.6847054012696481.[0m
[32m[I 2022-04-21 11:45:54,915][0m Trial 999 finished with value: 0.6847054012696481 and parameters: {'alpha': 0.917265826078236, 'ties': 'breslow'}. Best is trial 26 with value: 0.6847054012696481.[0m
CoxPH
Running Optimizer with LogRank binary scoring
{'alpha': 0.7163033054514019, 'ties': 'efron', 'UnoC_LR': 0.8423527006348241}
Running Optimizer normaly
{'alpha': 0.7532346161291328, 'ties': 'efron', 'UnoC': 0.6847054012696481}
