[32m[I 2022-04-21 22:36:00,268][0m Trial 70 finished with value: 0.6714139969723817 and parameters: {'alpha': 3.8743963683586022, 'ties': 'breslow'}. Best is trial 51 with value: 0.6718225721814719.[0m
[32m[I 2022-04-21 22:36:31,602][0m Trial 71 finished with value: 0.6705615341410874 and parameters: {'alpha': 4.126466560051554, 'ties': 'breslow'}. Best is trial 51 with value: 0.6718225721814719.[0m
[32m[I 2022-04-21 22:37:03,107][0m Trial 72 finished with value: 0.6718225721814719 and parameters: {'alpha': 3.768619162105725, 'ties': 'breslow'}. Best is trial 51 with value: 0.6718225721814719.[0m
[32m[I 2022-04-21 22:37:35,092][0m Trial 73 finished with value: 0.6713605392800839 and parameters: {'alpha': 3.7441106997585902, 'ties': 'breslow'}. Best is trial 51 with value: 0.6718225721814719.[0m
[32m[I 2022-04-21 22:38:06,979][0m Trial 74 finished with value: 0.6704232670604819 and parameters: {'alpha': 4.000644552547541, 'ties': 'breslow'}. Best is trial 51 with value: 0.6718225721814719.[0m
[32m[I 2022-04-21 22:38:39,154][0m Trial 75 finished with value: 0.6705372947971752 and parameters: {'alpha': 4.384296370919608, 'ties': 'breslow'}. Best is trial 51 with value: 0.6718225721814719.[0m
[32m[I 2022-04-21 22:39:10,876][0m Trial 76 finished with value: 0.6710387141360685 and parameters: {'alpha': 3.5650198502867676, 'ties': 'breslow'}. Best is trial 51 with value: 0.6718225721814719.[0m
[32m[I 2022-04-21 22:39:44,378][0m Trial 77 finished with value: 0.6706612182846206 and parameters: {'alpha': 3.3518537424551083, 'ties': 'efron'}. Best is trial 51 with value: 0.6718225721814719.[0m
[32m[I 2022-04-21 22:40:17,708][0m Trial 78 finished with value: 0.6698715135347545 and parameters: {'alpha': 2.786000880983308, 'ties': 'breslow'}. Best is trial 51 with value: 0.6718225721814719.[0m
[32m[I 2022-04-21 22:40:51,406][0m Trial 79 finished with value: 0.6704776527440905 and parameters: {'alpha': 3.1315546960695326, 'ties': 'breslow'}. Best is trial 51 with value: 0.6718225721814719.[0m
[32m[I 2022-04-21 22:41:23,897][0m Trial 80 finished with value: 0.6714246373157657 and parameters: {'alpha': 3.8134061542868487, 'ties': 'breslow'}. Best is trial 51 with value: 0.6718225721814719.[0m
[32m[I 2022-04-21 22:41:53,886][0m Trial 81 finished with value: 0.6714381495717138 and parameters: {'alpha': 3.7309886998081696, 'ties': 'breslow'}. Best is trial 51 with value: 0.6718225721814719.[0m
[32m[I 2022-04-21 22:42:26,184][0m Trial 82 finished with value: 0.6711724463543013 and parameters: {'alpha': 3.455329298503781, 'ties': 'breslow'}. Best is trial 51 with value: 0.6718225721814719.[0m
[32m[I 2022-04-21 22:42:59,098][0m Trial 83 finished with value: 0.6715012772624975 and parameters: {'alpha': 3.8000217717443134, 'ties': 'breslow'}. Best is trial 51 with value: 0.6718225721814719.[0m
[32m[I 2022-04-21 22:43:30,660][0m Trial 84 finished with value: 0.6712748199918555 and parameters: {'alpha': 3.9327764431094505, 'ties': 'breslow'}. Best is trial 51 with value: 0.6718225721814719.[0m
[32m[I 2022-04-21 22:44:01,877][0m Trial 85 finished with value: 0.6706392344897626 and parameters: {'alpha': 4.204566982991743, 'ties': 'breslow'}. Best is trial 51 with value: 0.6718225721814719.[0m
[32m[I 2022-04-21 22:44:31,999][0m Trial 86 finished with value: 0.6710392443611095 and parameters: {'alpha': 3.5957338113430235, 'ties': 'breslow'}. Best is trial 51 with value: 0.6718225721814719.[0m
[32m[I 2022-04-21 22:45:09,580][0m Trial 87 finished with value: 0.6675167478414177 and parameters: {'alpha': 1.9899051383447508, 'ties': 'breslow'}. Best is trial 51 with value: 0.6718225721814719.[0m
[32m[I 2022-04-21 22:45:40,319][0m Trial 88 finished with value: 0.6716673515982117 and parameters: {'alpha': 3.7643105248604867, 'ties': 'breslow'}. Best is trial 51 with value: 0.6718225721814719.[0m
[32m[I 2022-04-21 22:46:11,761][0m Trial 89 finished with value: 0.6705766654873282 and parameters: {'alpha': 3.276344573069789, 'ties': 'efron'}. Best is trial 51 with value: 0.6718225721814719.[0m
[32m[I 2022-04-21 22:46:44,371][0m Trial 90 finished with value: 0.6705709596314063 and parameters: {'alpha': 4.049374619814357, 'ties': 'breslow'}. Best is trial 51 with value: 0.6718225721814719.[0m
[32m[I 2022-04-21 22:47:16,762][0m Trial 91 finished with value: 0.6714246373157657 and parameters: {'alpha': 3.8139767368642623, 'ties': 'breslow'}. Best is trial 51 with value: 0.6718225721814719.[0m
[32m[I 2022-04-21 22:47:47,568][0m Trial 92 finished with value: 0.6712748199918555 and parameters: {'alpha': 3.931289442709698, 'ties': 'breslow'}. Best is trial 51 with value: 0.6718225721814719.[0m
[32m[I 2022-04-21 22:48:20,703][0m Trial 93 finished with value: 0.6709609715374141 and parameters: {'alpha': 3.629850513440053, 'ties': 'breslow'}. Best is trial 51 with value: 0.6718225721814719.[0m
[32m[I 2022-04-21 22:48:52,788][0m Trial 94 finished with value: 0.6710908946968871 and parameters: {'alpha': 3.459605980229856, 'ties': 'breslow'}. Best is trial 51 with value: 0.6718225721814719.[0m
[32m[I 2022-04-21 22:49:24,177][0m Trial 95 finished with value: 0.6714352686560117 and parameters: {'alpha': 3.7498544722056915, 'ties': 'breslow'}. Best is trial 51 with value: 0.6718225721814719.[0m
[32m[I 2022-04-21 22:49:55,153][0m Trial 96 finished with value: 0.6703830445588134 and parameters: {'alpha': 4.365403488826461, 'ties': 'breslow'}. Best is trial 51 with value: 0.6718225721814719.[0m
[32m[I 2022-04-21 22:50:26,074][0m Trial 97 finished with value: 0.6703831768658377 and parameters: {'alpha': 4.232788712782644, 'ties': 'breslow'}. Best is trial 51 with value: 0.6718225721814719.[0m
[32m[I 2022-04-21 22:50:57,515][0m Trial 98 finished with value: 0.6714246373157657 and parameters: {'alpha': 3.8106611455456445, 'ties': 'breslow'}. Best is trial 51 with value: 0.6718225721814719.[0m
[32m[I 2022-04-21 22:51:27,834][0m Trial 99 finished with value: 0.6705615341410874 and parameters: {'alpha': 4.119606890299984, 'ties': 'breslow'}. Best is trial 51 with value: 0.6718225721814719.[0m
[32m[I 2022-04-21 22:51:58,847][0m Trial 100 finished with value: 0.6702465439025429 and parameters: {'alpha': 3.2986854953327285, 'ties': 'breslow'}. Best is trial 51 with value: 0.6718225721814719.[0m
[32m[I 2022-04-21 22:52:28,766][0m Trial 101 finished with value: 0.6711167223457152 and parameters: {'alpha': 3.6876856683732617, 'ties': 'breslow'}. Best is trial 51 with value: 0.6718225721814719.[0m
[32m[I 2022-04-21 22:52:59,963][0m Trial 102 finished with value: 0.6712748199918555 and parameters: {'alpha': 3.9332198904421336, 'ties': 'breslow'}. Best is trial 51 with value: 0.6718225721814719.[0m
[32m[I 2022-04-21 22:53:31,735][0m Trial 103 finished with value: 0.6710387141360685 and parameters: {'alpha': 3.55115156509263, 'ties': 'breslow'}. Best is trial 51 with value: 0.6718225721814719.[0m
[32m[I 2022-04-21 22:54:01,111][0m Trial 104 finished with value: 0.6710859829862048 and parameters: {'alpha': 3.414202403075512, 'ties': 'breslow'}. Best is trial 51 with value: 0.6718225721814719.[0m
[32m[I 2022-04-21 22:54:32,765][0m Trial 105 finished with value: 0.6714352686560117 and parameters: {'alpha': 3.7518032931074856, 'ties': 'breslow'}. Best is trial 51 with value: 0.6718225721814719.[0m
[32m[I 2022-04-21 22:55:10,827][0m Trial 106 finished with value: 0.6659951428777996 and parameters: {'alpha': 1.2816147763640444, 'ties': 'breslow'}. Best is trial 51 with value: 0.6718225721814719.[0m
[32m[I 2022-04-21 22:55:41,704][0m Trial 107 finished with value: 0.6704983121089949 and parameters: {'alpha': 4.5538666510161265, 'ties': 'efron'}. Best is trial 51 with value: 0.6718225721814719.[0m
[32m[I 2022-04-21 22:56:11,777][0m Trial 108 finished with value: 0.6704196804139302 and parameters: {'alpha': 4.023338844471437, 'ties': 'breslow'}. Best is trial 51 with value: 0.6718225721814719.[0m
[32m[I 2022-04-21 22:56:40,763][0m Trial 109 finished with value: 0.671035170688301 and parameters: {'alpha': 3.6688040695015562, 'ties': 'breslow'}. Best is trial 51 with value: 0.6718225721814719.[0m
[32m[I 2022-04-21 22:57:12,099][0m Trial 110 finished with value: 0.6712563165473625 and parameters: {'alpha': 3.8869175237613427, 'ties': 'breslow'}. Best is trial 51 with value: 0.6718225721814719.[0m
[32m[I 2022-04-21 22:57:43,505][0m Trial 111 finished with value: 0.6714381495717138 and parameters: {'alpha': 3.7365179095258383, 'ties': 'breslow'}. Best is trial 51 with value: 0.6718225721814719.[0m
[32m[I 2022-04-21 22:58:15,872][0m Trial 112 finished with value: 0.6709611038444385 and parameters: {'alpha': 3.5790343572710652, 'ties': 'breslow'}. Best is trial 51 with value: 0.6718225721814719.[0m
[32m[I 2022-04-21 22:58:46,084][0m Trial 113 finished with value: 0.6713430856583515 and parameters: {'alpha': 3.8222466174780236, 'ties': 'breslow'}. Best is trial 51 with value: 0.6718225721814719.[0m
[32m[I 2022-04-21 22:59:17,018][0m Trial 114 finished with value: 0.6708864992150974 and parameters: {'alpha': 3.971475710069552, 'ties': 'breslow'}. Best is trial 51 with value: 0.6718225721814719.[0m
[32m[I 2022-04-21 22:59:49,311][0m Trial 115 finished with value: 0.6713605392800839 and parameters: {'alpha': 3.738568181555807, 'ties': 'breslow'}. Best is trial 51 with value: 0.6718225721814719.[0m
[32m[I 2022-04-21 23:00:20,876][0m Trial 116 finished with value: 0.6710923952668263 and parameters: {'alpha': 3.472783722245806, 'ties': 'breslow'}. Best is trial 51 with value: 0.6718225721814719.[0m
[32m[I 2022-04-21 23:00:49,965][0m Trial 117 finished with value: 0.6705624622360065 and parameters: {'alpha': 4.185078442454413, 'ties': 'breslow'}. Best is trial 51 with value: 0.6718225721814719.[0m
[32m[I 2022-04-21 23:01:19,195][0m Trial 118 finished with value: 0.6704845863815228 and parameters: {'alpha': 4.099514552135086, 'ties': 'breslow'}. Best is trial 51 with value: 0.6718225721814719.[0m
[32m[I 2022-04-21 23:01:50,281][0m Trial 119 finished with value: 0.670957560396671 and parameters: {'alpha': 3.655614340229631, 'ties': 'breslow'}. Best is trial 51 with value: 0.6718225721814719.[0m
[32m[I 2022-04-21 23:02:36,842][0m Trial 120 finished with value: 0.6673782250021351 and parameters: {'alpha': 0.40866055654906264, 'ties': 'breslow'}. Best is trial 51 with value: 0.6718225721814719.[0m
[32m[I 2022-04-21 23:03:07,997][0m Trial 121 finished with value: 0.6715134091726827 and parameters: {'alpha': 3.7576567706102213, 'ties': 'breslow'}. Best is trial 51 with value: 0.6718225721814719.[0m
[32m[I 2022-04-21 23:03:38,447][0m Trial 122 finished with value: 0.6714105858316386 and parameters: {'alpha': 3.8708682901326656, 'ties': 'breslow'}. Best is trial 51 with value: 0.6718225721814719.[0m
[32m[I 2022-04-21 23:04:07,632][0m Trial 123 finished with value: 0.6711160166148658 and parameters: {'alpha': 3.5348809008370248, 'ties': 'breslow'}. Best is trial 51 with value: 0.6718225721814719.[0m
[32m[I 2022-04-21 23:04:38,274][0m Trial 124 finished with value: 0.6707658929071851 and parameters: {'alpha': 3.3705175679749413, 'ties': 'breslow'}. Best is trial 51 with value: 0.6718225721814719.[0m
[32m[I 2022-04-21 23:05:08,179][0m Trial 125 finished with value: 0.670419017881865 and parameters: {'alpha': 4.010764137240359, 'ties': 'breslow'}. Best is trial 51 with value: 0.6718225721814719.[0m
[32m[I 2022-04-21 23:05:38,359][0m Trial 126 finished with value: 0.6714352686560117 and parameters: {'alpha': 3.753929764288823, 'ties': 'breslow'}. Best is trial 51 with value: 0.6718225721814719.[0m
[32m[I 2022-04-21 23:06:12,272][0m Trial 127 finished with value: 0.6705719724330997 and parameters: {'alpha': 3.2173561390264944, 'ties': 'efron'}. Best is trial 51 with value: 0.6718225721814719.[0m
[32m[I 2022-04-21 23:06:43,633][0m Trial 128 finished with value: 0.670957560396671 and parameters: {'alpha': 3.6365666617105927, 'ties': 'breslow'}. Best is trial 51 with value: 0.6718225721814719.[0m
[32m[I 2022-04-21 23:07:13,999][0m Trial 129 finished with value: 0.6714139969723817 and parameters: {'alpha': 3.8770146486828234, 'ties': 'breslow'}. Best is trial 51 with value: 0.6718225721814719.[0m
[32m[I 2022-04-21 23:07:44,582][0m Trial 130 finished with value: 0.6708528438624721 and parameters: {'alpha': 3.506232132382837, 'ties': 'breslow'}. Best is trial 51 with value: 0.6718225721814719.[0m
[32m[I 2022-04-21 23:08:14,822][0m Trial 131 finished with value: 0.6714381495717138 and parameters: {'alpha': 3.7217679588392767, 'ties': 'breslow'}. Best is trial 51 with value: 0.6718225721814719.[0m
[32m[I 2022-04-21 23:08:45,553][0m Trial 132 finished with value: 0.6711796766006307 and parameters: {'alpha': 3.9264772105188004, 'ties': 'breslow'}. Best is trial 51 with value: 0.6718225721814719.[0m
[32m[I 2022-04-21 23:09:16,081][0m Trial 133 finished with value: 0.6713571281393407 and parameters: {'alpha': 3.7486689926714294, 'ties': 'breslow'}. Best is trial 51 with value: 0.6718225721814719.[0m
[32m[I 2022-04-21 23:09:46,442][0m Trial 134 finished with value: 0.6713391442925675 and parameters: {'alpha': 3.8299762840473335, 'ties': 'breslow'}. Best is trial 51 with value: 0.6718225721814719.[0m
[32m[I 2022-04-21 23:10:16,621][0m Trial 135 finished with value: 0.6710392443611095 and parameters: {'alpha': 3.6111474072751792, 'ties': 'breslow'}. Best is trial 51 with value: 0.6718225721814719.[0m
[32m[I 2022-04-21 23:10:46,604][0m Trial 136 finished with value: 0.6705709596314063 and parameters: {'alpha': 4.046678615576445, 'ties': 'breslow'}. Best is trial 51 with value: 0.6718225721814719.[0m
[32m[I 2022-04-21 23:11:16,715][0m Trial 137 finished with value: 0.6713605392800839 and parameters: {'alpha': 3.744164666742167, 'ties': 'breslow'}. Best is trial 51 with value: 0.6718225721814719.[0m
[32m[I 2022-04-21 23:11:46,330][0m Trial 138 finished with value: 0.6703047285363338 and parameters: {'alpha': 4.288251653867007, 'ties': 'breslow'}. Best is trial 51 with value: 0.6718225721814719.[0m
[32m[I 2022-04-21 23:12:17,500][0m Trial 139 finished with value: 0.6704067536776845 and parameters: {'alpha': 4.134881489174637, 'ties': 'breslow'}. Best is trial 51 with value: 0.6718225721814719.[0m
[32m[I 2022-04-21 23:12:46,765][0m Trial 140 finished with value: 0.6708098592683656 and parameters: {'alpha': 3.9679742137928375, 'ties': 'breslow'}. Best is trial 51 with value: 0.6718225721814719.[0m
[32m[I 2022-04-21 23:13:18,232][0m Trial 141 finished with value: 0.6711982740031293 and parameters: {'alpha': 3.6945712659476824, 'ties': 'breslow'}. Best is trial 51 with value: 0.6718225721814719.[0m
[32m[I 2022-04-21 23:13:46,105][0m Trial 142 finished with value: 0.6709611038444385 and parameters: {'alpha': 3.5820919625589647, 'ties': 'breslow'}. Best is trial 51 with value: 0.6718225721814719.[0m
[32m[I 2022-04-21 23:14:15,926][0m Trial 143 finished with value: 0.6715012772624975 and parameters: {'alpha': 3.7999460201907276, 'ties': 'breslow'}. Best is trial 51 with value: 0.6718225721814719.[0m
[32m[I 2022-04-21 23:14:44,839][0m Trial 144 finished with value: 0.6712547027163132 and parameters: {'alpha': 3.840771211591291, 'ties': 'breslow'}. Best is trial 51 with value: 0.6718225721814719.[0m
[32m[I 2022-04-21 23:15:13,337][0m Trial 145 finished with value: 0.6709366444585252 and parameters: {'alpha': 3.482759724837492, 'ties': 'breslow'}. Best is trial 51 with value: 0.6718225721814719.[0m
[32m[I 2022-04-21 23:15:43,240][0m Trial 146 finished with value: 0.6710078424695338 and parameters: {'alpha': 3.403123747177136, 'ties': 'breslow'}. Best is trial 51 with value: 0.6718225721814719.[0m
[32m[I 2022-04-21 23:16:11,963][0m Trial 147 finished with value: 0.6715012772624975 and parameters: {'alpha': 3.8067134522497894, 'ties': 'breslow'}. Best is trial 51 with value: 0.6718225721814719.[0m
[32m[I 2022-04-21 23:16:39,751][0m Trial 148 finished with value: 0.6709417116028501 and parameters: {'alpha': 3.9369394259254507, 'ties': 'efron'}. Best is trial 51 with value: 0.6718225721814719.[0m
[32m[I 2022-04-21 23:17:09,822][0m Trial 149 finished with value: 0.6712618418137702 and parameters: {'alpha': 3.832215113536689, 'ties': 'breslow'}. Best is trial 51 with value: 0.6718225721814719.[0m
[32m[I 2022-04-21 23:17:40,154][0m Trial 150 finished with value: 0.6707257400948092 and parameters: {'alpha': 4.083039879123855, 'ties': 'breslow'}. Best is trial 51 with value: 0.6718225721814719.[0m
[32m[I 2022-04-21 23:18:11,249][0m Trial 151 finished with value: 0.671035170688301 and parameters: {'alpha': 3.671124196673301, 'ties': 'breslow'}. Best is trial 51 with value: 0.6718225721814719.[0m
[32m[I 2022-04-21 23:18:42,236][0m Trial 152 finished with value: 0.6718225721814719 and parameters: {'alpha': 3.771873481036766, 'ties': 'breslow'}. Best is trial 51 with value: 0.6718225721814719.[0m
[32m[I 2022-04-21 23:19:10,159][0m Trial 153 finished with value: 0.6710392443611095 and parameters: {'alpha': 3.596681364021036, 'ties': 'breslow'}. Best is trial 51 with value: 0.6718225721814719.[0m
[32m[I 2022-04-21 23:19:39,078][0m Trial 154 finished with value: 0.6715828289199117 and parameters: {'alpha': 3.7967964668900915, 'ties': 'breslow'}. Best is trial 51 with value: 0.6718225721814719.[0m
[32m[I 2022-04-21 23:20:09,939][0m Trial 155 finished with value: 0.6715012772624975 and parameters: {'alpha': 3.809024005984054, 'ties': 'breslow'}. Best is trial 51 with value: 0.6718225721814719.[0m
[32m[I 2022-04-21 23:20:41,796][0m Trial 156 finished with value: 0.671120215034261 and parameters: {'alpha': 3.9437432464258464, 'ties': 'breslow'}. Best is trial 51 with value: 0.6718225721814719.[0m
[32m[I 2022-04-21 23:21:13,163][0m Trial 157 finished with value: 0.6714246373157657 and parameters: {'alpha': 3.8116131483305544, 'ties': 'breslow'}. Best is trial 51 with value: 0.6718225721814719.[0m
[32m[I 2022-04-21 23:21:44,617][0m Trial 158 finished with value: 0.6707257400948092 and parameters: {'alpha': 4.067499271474579, 'ties': 'breslow'}. Best is trial 51 with value: 0.6718225721814719.[0m
[32m[I 2022-04-21 23:22:14,846][0m Trial 159 finished with value: 0.6712563165473625 and parameters: {'alpha': 3.888802922276904, 'ties': 'breslow'}. Best is trial 51 with value: 0.6718225721814719.[0m
[32m[I 2022-04-21 23:22:45,884][0m Trial 160 finished with value: 0.6704232670604819 and parameters: {'alpha': 3.994160362792891, 'ties': 'breslow'}. Best is trial 51 with value: 0.6718225721814719.[0m
[32m[I 2022-04-21 23:23:17,240][0m Trial 161 finished with value: 0.670957560396671 and parameters: {'alpha': 3.6485364429360088, 'ties': 'breslow'}. Best is trial 51 with value: 0.6718225721814719.[0m
[32m[I 2022-04-21 23:23:46,140][0m Trial 162 finished with value: 0.6716643805773258 and parameters: {'alpha': 3.7829452804595007, 'ties': 'breslow'}. Best is trial 51 with value: 0.6718225721814719.[0m
[32m[I 2022-04-21 23:24:18,785][0m Trial 163 finished with value: 0.6718225721814719 and parameters: {'alpha': 3.774828945529129, 'ties': 'breslow'}. Best is trial 51 with value: 0.6718225721814719.[0m
[32m[I 2022-04-21 23:24:50,308][0m Trial 164 finished with value: 0.6715012772624975 and parameters: {'alpha': 3.7981118088223056, 'ties': 'breslow'}. Best is trial 51 with value: 0.6718225721814719.[0m
[32m[I 2022-04-21 23:25:20,210][0m Trial 165 finished with value: 0.6714246373157657 and parameters: {'alpha': 3.814366052526637, 'ties': 'breslow'}. Best is trial 51 with value: 0.6718225721814719.[0m
[32m[I 2022-04-21 23:25:49,800][0m Trial 166 finished with value: 0.6711145160449266 and parameters: {'alpha': 3.5300106332665346, 'ties': 'breslow'}. Best is trial 51 with value: 0.6718225721814719.[0m
[32m[I 2022-04-21 23:26:18,442][0m Trial 167 finished with value: 0.6712563165473625 and parameters: {'alpha': 3.9019306122678223, 'ties': 'breslow'}. Best is trial 51 with value: 0.6718225721814719.[0m
[32m[I 2022-04-21 23:26:47,556][0m Trial 168 finished with value: 0.6710387141360685 and parameters: {'alpha': 3.558870012151106, 'ties': 'breslow'}. Best is trial 51 with value: 0.6718225721814719.[0m
[32m[I 2022-04-21 23:27:17,155][0m Trial 169 finished with value: 0.670957560396671 and parameters: {'alpha': 3.6583161856415334, 'ties': 'breslow'}. Best is trial 51 with value: 0.6718225721814719.[0m
[32m[I 2022-04-21 23:27:48,808][0m Trial 170 finished with value: 0.6703417154030678 and parameters: {'alpha': 4.003978574615099, 'ties': 'breslow'}. Best is trial 51 with value: 0.6718225721814719.[0m
[32m[I 2022-04-21 23:28:17,593][0m Trial 171 finished with value: 0.6715828289199117 and parameters: {'alpha': 3.7933158588832625, 'ties': 'breslow'}. Best is trial 51 with value: 0.6718225721814719.[0m
[32m[I 2022-04-21 23:28:46,811][0m Trial 172 finished with value: 0.6713605392800839 and parameters: {'alpha': 3.741737420505208, 'ties': 'breslow'}. Best is trial 51 with value: 0.6718225721814719.[0m
[32m[I 2022-04-21 23:29:16,564][0m Trial 173 finished with value: 0.6713378682047766 and parameters: {'alpha': 3.88471243925803, 'ties': 'breslow'}. Best is trial 51 with value: 0.6718225721814719.[0m
[32m[I 2022-04-21 23:29:46,850][0m Trial 174 finished with value: 0.6705624622360065 and parameters: {'alpha': 4.18213885267855, 'ties': 'breslow'}. Best is trial 51 with value: 0.6718225721814719.[0m
[32m[I 2022-04-21 23:30:15,500][0m Trial 175 finished with value: 0.6715012772624975 and parameters: {'alpha': 3.803778491133511, 'ties': 'breslow'}. Best is trial 51 with value: 0.6718225721814719.[0m
[32m[I 2022-04-21 23:30:45,955][0m Trial 176 finished with value: 0.670957560396671 and parameters: {'alpha': 3.6483841138461455, 'ties': 'breslow'}. Best is trial 51 with value: 0.6718225721814719.[0m
