[32m[I 2022-04-23 16:57:36,173][0m Trial 517 finished with value: 0.6749106336272943 and parameters: {'n_hidden': 2048, 'mixture_components': 5, 'use_sparse_layer': False, 'use_batchnorm': False, 'use_dropout': True, 'dropout': 0.24902205156928248, 'mlp_size_1': 4, 'mlp_size_2': 3, 'mlp_size_3': 1, 'kernel': 'Normal', 'loss_name': 'CensoredNLLLoss'}. Best is trial 123 with value: 0.6857038111174789.[0m
[32m[I 2022-04-23 16:58:59,137][0m Trial 518 finished with value: 0.6705289636677784 and parameters: {'n_hidden': 64, 'mixture_components': 5, 'use_sparse_layer': False, 'use_batchnorm': False, 'use_dropout': True, 'dropout': 0.15587715217981105, 'mlp_size_1': 3, 'mlp_size_2': 0, 'mlp_size_3': 0, 'kernel': 'Normal', 'loss_name': 'CensoredNLLLoss'}. Best is trial 123 with value: 0.6857038111174789.[0m
[32m[I 2022-04-23 17:00:07,940][0m Trial 519 finished with value: 0.6431397539281136 and parameters: {'n_hidden': 128, 'mixture_components': 5, 'use_sparse_layer': False, 'use_batchnorm': False, 'use_dropout': True, 'dropout': 0.03594265518129758, 'mlp_size_1': 4, 'mlp_size_2': 0, 'mlp_size_3': 0, 'kernel': 'Normal', 'loss_name': 'CensoredNLLLoss'}. Best is trial 123 with value: 0.6857038111174789.[0m
[32m[I 2022-04-23 17:01:58,532][0m Trial 520 finished with value: 0.6759415596502155 and parameters: {'n_hidden': 2048, 'mixture_components': 5, 'use_sparse_layer': False, 'use_batchnorm': False, 'use_dropout': True, 'dropout': 0.13755288874879734, 'mlp_size_1': 4, 'mlp_size_2': 3, 'mlp_size_3': 1, 'kernel': 'Normal', 'loss_name': 'CensoredNLLLoss'}. Best is trial 123 with value: 0.6857038111174789.[0m
[32m[I 2022-04-23 17:03:28,982][0m Trial 521 finished with value: 0.6839697266920883 and parameters: {'n_hidden': 2048, 'mixture_components': 2, 'use_sparse_layer': False, 'use_batchnorm': False, 'use_dropout': True, 'dropout': 0.22366795757310481, 'mlp_size_1': 4, 'mlp_size_2': 3, 'mlp_size_3': 1, 'kernel': 'Normal', 'loss_name': 'CensoredNLLLoss'}. Best is trial 123 with value: 0.6857038111174789.[0m
[32m[I 2022-04-23 17:04:59,304][0m Trial 522 finished with value: 0.6672637189718541 and parameters: {'n_hidden': 2048, 'mixture_components': 2, 'use_sparse_layer': False, 'use_batchnorm': False, 'use_dropout': True, 'dropout': 0.23480989262336438, 'mlp_size_1': 4, 'mlp_size_2': 3, 'mlp_size_3': 1, 'kernel': 'Normal', 'loss_name': 'CensoredNLLLoss'}. Best is trial 123 with value: 0.6857038111174789.[0m
[32m[I 2022-04-23 17:06:29,818][0m Trial 523 finished with value: 0.6706955201067787 and parameters: {'n_hidden': 2048, 'mixture_components': 2, 'use_sparse_layer': False, 'use_batchnorm': False, 'use_dropout': True, 'dropout': 0.2911385120845429, 'mlp_size_1': 4, 'mlp_size_2': 3, 'mlp_size_3': 1, 'kernel': 'Normal', 'loss_name': 'CensoredNLLLoss'}. Best is trial 123 with value: 0.6857038111174789.[0m
[32m[I 2022-04-23 17:09:42,498][0m Trial 524 finished with value: 0.6358576121270986 and parameters: {'n_hidden': 2048, 'mixture_components': 2, 'use_sparse_layer': False, 'use_batchnorm': True, 'use_dropout': True, 'dropout': 0.1730627983824484, 'mlp_size_1': 4, 'mlp_size_2': 3, 'mlp_size_3': 1, 'kernel': 'Normal', 'loss_name': 'CensoredNLLLoss'}. Best is trial 123 with value: 0.6857038111174789.[0m
[32m[I 2022-04-23 17:11:02,953][0m Trial 525 finished with value: 0.6666306034866303 and parameters: {'n_hidden': 2048, 'mixture_components': 2, 'use_sparse_layer': False, 'use_batchnorm': False, 'use_dropout': False, 'mlp_size_1': 4, 'mlp_size_2': 3, 'mlp_size_3': 1, 'kernel': 'Normal', 'loss_name': 'CensoredNLLLoss'}. Best is trial 123 with value: 0.6857038111174789.[0m
[32m[I 2022-04-23 17:12:29,556][0m Trial 526 finished with value: 0.6888255136338752 and parameters: {'n_hidden': 2048, 'mixture_components': 2, 'use_sparse_layer': False, 'use_batchnorm': False, 'use_dropout': True, 'dropout': 0.1249911409794454, 'mlp_size_1': 4, 'mlp_size_2': 3, 'mlp_size_3': 1, 'kernel': 'LogLogistic', 'loss_name': 'CensoredNLLLoss'}. Best is trial 526 with value: 0.6888255136338752.[0m
[32m[I 2022-04-23 17:13:38,398][0m Trial 527 finished with value: 0.6687502999447374 and parameters: {'n_hidden': 2048, 'mixture_components': 2, 'use_sparse_layer': False, 'use_batchnorm': False, 'use_dropout': True, 'dropout': 0.1494868801141807, 'mlp_size_1': 4, 'mlp_size_2': 3, 'mlp_size_3': 1, 'kernel': 'LogLogistic', 'loss_name': 'CensoredNLLLoss'}. Best is trial 526 with value: 0.6888255136338752.[0m
[32m[I 2022-04-23 17:15:05,704][0m Trial 528 finished with value: 0.6617717584279827 and parameters: {'n_hidden': 2048, 'mixture_components': 2, 'use_sparse_layer': True, 'use_sparse_loss': False, 'use_batchnorm': False, 'use_dropout': True, 'dropout': 0.26289198604280895, 'mlp_size_1': 4, 'mlp_size_2': 3, 'mlp_size_3': 1, 'kernel': 'Gumbel', 'loss_name': 'CensoredNLLLoss'}. Best is trial 526 with value: 0.6888255136338752.[0m
[32m[I 2022-04-23 17:16:32,467][0m Trial 529 finished with value: 0.6786544641943209 and parameters: {'n_hidden': 2048, 'mixture_components': 2, 'use_sparse_layer': False, 'use_batchnorm': False, 'use_dropout': True, 'dropout': 0.12369156490025038, 'mlp_size_1': 4, 'mlp_size_2': 3, 'mlp_size_3': 1, 'kernel': 'Normal', 'loss_name': 'CensoredNLLLoss'}. Best is trial 526 with value: 0.6888255136338752.[0m
[32m[I 2022-04-23 17:17:51,621][0m Trial 530 finished with value: 0.6805857938028388 and parameters: {'n_hidden': 2048, 'mixture_components': 2, 'use_sparse_layer': False, 'use_batchnorm': False, 'use_dropout': True, 'dropout': 0.19300354411791726, 'mlp_size_1': 4, 'mlp_size_2': 3, 'mlp_size_3': 1, 'kernel': 'LogLogistic', 'loss_name': 'CensoredNLLLoss'}. Best is trial 526 with value: 0.6888255136338752.[0m
[32m[I 2022-04-23 17:19:09,243][0m Trial 531 finished with value: 0.672504585841275 and parameters: {'n_hidden': 2048, 'mixture_components': 2, 'use_sparse_layer': False, 'use_batchnorm': False, 'use_dropout': True, 'dropout': 0.21666506382394002, 'mlp_size_1': 3, 'mlp_size_2': 3, 'mlp_size_3': 1, 'kernel': 'LogLogistic', 'loss_name': 'CensoredNLLLoss'}. Best is trial 526 with value: 0.6888255136338752.[0m
[32m[I 2022-04-23 17:20:26,106][0m Trial 532 finished with value: 0.679128974683443 and parameters: {'n_hidden': 2048, 'mixture_components': 2, 'use_sparse_layer': False, 'use_batchnorm': False, 'use_dropout': True, 'dropout': 0.19165563479589404, 'mlp_size_1': 4, 'mlp_size_2': 3, 'mlp_size_3': 1, 'kernel': 'LogLogistic', 'loss_name': 'CensoredNLLLoss'}. Best is trial 526 with value: 0.6888255136338752.[0m
[32m[I 2022-04-23 17:21:45,596][0m Trial 533 finished with value: 0.675833311360359 and parameters: {'n_hidden': 2048, 'mixture_components': 2, 'use_sparse_layer': False, 'use_batchnorm': False, 'use_dropout': True, 'dropout': 0.20171342678476017, 'mlp_size_1': 4, 'mlp_size_2': 3, 'mlp_size_3': 1, 'kernel': 'LogLogistic', 'loss_name': 'CensoredNLLLoss'}. Best is trial 526 with value: 0.6888255136338752.[0m
[32m[I 2022-04-23 17:23:00,845][0m Trial 534 finished with value: 0.6872895461688815 and parameters: {'n_hidden': 2048, 'mixture_components': 2, 'use_sparse_layer': False, 'use_batchnorm': False, 'use_dropout': True, 'dropout': 0.23303441279580778, 'mlp_size_1': 4, 'mlp_size_2': 3, 'mlp_size_3': 1, 'kernel': 'LogLogistic', 'loss_name': 'CensoredNLLLoss'}. Best is trial 526 with value: 0.6888255136338752.[0m
[32m[I 2022-04-23 17:24:18,578][0m Trial 535 finished with value: 0.6757020499960253 and parameters: {'n_hidden': 2048, 'mixture_components': 2, 'use_sparse_layer': False, 'use_batchnorm': False, 'use_dropout': True, 'dropout': 0.2679124996792953, 'mlp_size_1': 4, 'mlp_size_2': 3, 'mlp_size_3': 1, 'kernel': 'LogLogistic', 'loss_name': 'CensoredNLLLoss'}. Best is trial 526 with value: 0.6888255136338752.[0m
[32m[I 2022-04-23 17:25:56,567][0m Trial 536 finished with value: 0.672461551557367 and parameters: {'n_hidden': 2048, 'mixture_components': 1, 'use_sparse_layer': False, 'use_batchnorm': False, 'use_dropout': True, 'dropout': 0.2369569114697642, 'mlp_size_1': 4, 'mlp_size_2': 3, 'mlp_size_3': 1, 'kernel': 'LogLogistic', 'loss_name': 'CensoredNLLLoss'}. Best is trial 526 with value: 0.6888255136338752.[0m
[32m[I 2022-04-23 17:27:20,152][0m Trial 537 finished with value: 0.6760235686213615 and parameters: {'n_hidden': 2048, 'mixture_components': 2, 'use_sparse_layer': False, 'use_batchnorm': False, 'use_dropout': True, 'dropout': 0.2571719109692413, 'mlp_size_1': 4, 'mlp_size_2': 3, 'mlp_size_3': 1, 'kernel': 'LogLogistic', 'loss_name': 'CensoredNLLLoss'}. Best is trial 526 with value: 0.6888255136338752.[0m
[32m[I 2022-04-23 17:28:26,956][0m Trial 538 finished with value: 0.671566386530193 and parameters: {'n_hidden': 2048, 'mixture_components': 2, 'use_sparse_layer': False, 'use_batchnorm': False, 'use_dropout': False, 'mlp_size_1': 4, 'mlp_size_2': 3, 'mlp_size_3': 1, 'kernel': 'LogLogistic', 'loss_name': 'CensoredNLLLoss'}. Best is trial 526 with value: 0.6888255136338752.[0m
[32m[I 2022-04-23 17:29:59,450][0m Trial 539 finished with value: 0.6788540866068822 and parameters: {'n_hidden': 2048, 'mixture_components': 2, 'use_sparse_layer': False, 'use_batchnorm': False, 'use_dropout': True, 'dropout': 0.23334952244276935, 'mlp_size_1': 4, 'mlp_size_2': 3, 'mlp_size_3': 1, 'kernel': 'LogLogistic', 'loss_name': 'CensoredNLLLoss'}. Best is trial 526 with value: 0.6888255136338752.[0m
[32m[I 2022-04-23 17:31:13,886][0m Trial 540 finished with value: 0.6714414856702797 and parameters: {'n_hidden': 2048, 'mixture_components': 2, 'use_sparse_layer': True, 'use_sparse_loss': False, 'use_batchnorm': False, 'use_dropout': True, 'dropout': 0.05920517872930636, 'mlp_size_1': 4, 'mlp_size_2': 3, 'mlp_size_3': 1, 'kernel': 'LogLogistic', 'loss_name': 'CensoredNLLLoss'}. Best is trial 526 with value: 0.6888255136338752.[0m
[32m[I 2022-04-23 17:32:26,060][0m Trial 541 finished with value: 0.6762528176924161 and parameters: {'n_hidden': 2048, 'mixture_components': 2, 'use_sparse_layer': False, 'use_batchnorm': False, 'use_dropout': True, 'dropout': 0.2208055235833596, 'mlp_size_1': 4, 'mlp_size_2': 3, 'mlp_size_3': 1, 'kernel': 'LogLogistic', 'loss_name': 'CensoredNLLLoss'}. Best is trial 526 with value: 0.6888255136338752.[0m
[32m[I 2022-04-23 17:33:37,913][0m Trial 542 finished with value: 0.6683993668477032 and parameters: {'n_hidden': 2048, 'mixture_components': 1, 'use_sparse_layer': False, 'use_batchnorm': False, 'use_dropout': True, 'dropout': 0.08716966014278575, 'mlp_size_1': 4, 'mlp_size_2': 3, 'mlp_size_3': 1, 'kernel': 'LogLogistic', 'loss_name': 'CensoredNLLLoss'}. Best is trial 526 with value: 0.6888255136338752.[0m
[32m[I 2022-04-23 17:34:48,044][0m Trial 543 finished with value: 0.6644952730680451 and parameters: {'n_hidden': 2048, 'mixture_components': 2, 'use_sparse_layer': False, 'use_batchnorm': False, 'use_dropout': True, 'dropout': 0.0421256648774562, 'mlp_size_1': 4, 'mlp_size_2': 3, 'mlp_size_3': 1, 'kernel': 'LogLogistic', 'loss_name': 'CensoredNLLLoss'}. Best is trial 526 with value: 0.6888255136338752.[0m
[32m[I 2022-04-23 17:36:03,867][0m Trial 544 finished with value: 0.665972828258157 and parameters: {'n_hidden': 2048, 'mixture_components': 2, 'use_sparse_layer': False, 'use_batchnorm': False, 'use_dropout': True, 'dropout': 0.025517210693624334, 'mlp_size_1': 4, 'mlp_size_2': 3, 'mlp_size_3': 1, 'kernel': 'LogLogistic', 'loss_name': 'AlternativeNLLLoss'}. Best is trial 526 with value: 0.6888255136338752.[0m
[32m[I 2022-04-23 17:38:36,740][0m Trial 545 finished with value: 0.6355835060968451 and parameters: {'n_hidden': 2048, 'mixture_components': 2, 'use_sparse_layer': False, 'use_batchnorm': True, 'use_dropout': True, 'dropout': 0.24761200574619968, 'mlp_size_1': 4, 'mlp_size_2': 3, 'mlp_size_3': 1, 'kernel': 'LogLogistic', 'loss_name': 'CensoredNLLLoss'}. Best is trial 526 with value: 0.6888255136338752.[0m
[32m[I 2022-04-23 17:39:51,494][0m Trial 546 finished with value: 0.6847251604511326 and parameters: {'n_hidden': 2048, 'mixture_components': 2, 'use_sparse_layer': False, 'use_batchnorm': False, 'use_dropout': True, 'dropout': 0.29245213876768916, 'mlp_size_1': 3, 'mlp_size_2': 3, 'mlp_size_3': 1, 'kernel': 'LogLogistic', 'loss_name': 'CensoredNLLLoss'}. Best is trial 526 with value: 0.6888255136338752.[0m
[32m[I 2022-04-23 17:41:13,308][0m Trial 547 finished with value: 0.6842496909184183 and parameters: {'n_hidden': 2048, 'mixture_components': 2, 'use_sparse_layer': False, 'use_batchnorm': False, 'use_dropout': True, 'dropout': 0.2675327452803981, 'mlp_size_1': 3, 'mlp_size_2': 3, 'mlp_size_3': 1, 'kernel': 'LogLogistic', 'loss_name': 'CensoredNLLLoss'}. Best is trial 526 with value: 0.6888255136338752.[0m
[32m[I 2022-04-23 17:42:32,283][0m Trial 548 finished with value: 0.6729646952758995 and parameters: {'n_hidden': 2048, 'mixture_components': 2, 'use_sparse_layer': False, 'use_batchnorm': False, 'use_dropout': True, 'dropout': 0.3030756174657736, 'mlp_size_1': 3, 'mlp_size_2': 3, 'mlp_size_3': 1, 'kernel': 'LogLogistic', 'loss_name': 'CensoredNLLLoss'}. Best is trial 526 with value: 0.6888255136338752.[0m
[32m[I 2022-04-23 17:43:50,291][0m Trial 549 finished with value: 0.6736685585378492 and parameters: {'n_hidden': 2048, 'mixture_components': 2, 'use_sparse_layer': False, 'use_batchnorm': False, 'use_dropout': True, 'dropout': 0.2882055484862837, 'mlp_size_1': 4, 'mlp_size_2': 3, 'mlp_size_3': 1, 'kernel': 'LogLogistic', 'loss_name': 'CensoredNLLLoss'}. Best is trial 526 with value: 0.6888255136338752.[0m
[32m[I 2022-04-23 17:44:50,982][0m Trial 550 finished with value: 0.6599602665149982 and parameters: {'n_hidden': 2048, 'mixture_components': 2, 'use_sparse_layer': False, 'use_batchnorm': False, 'use_dropout': False, 'mlp_size_1': 3, 'mlp_size_2': 3, 'mlp_size_3': 1, 'kernel': 'LogLogistic', 'loss_name': 'CensoredNLLLoss'}. Best is trial 526 with value: 0.6888255136338752.[0m
[32m[I 2022-04-23 17:46:08,958][0m Trial 551 finished with value: 0.6925048594105658 and parameters: {'n_hidden': 2048, 'mixture_components': 2, 'use_sparse_layer': False, 'use_batchnorm': False, 'use_dropout': True, 'dropout': 0.28300419815290545, 'mlp_size_1': 3, 'mlp_size_2': 3, 'mlp_size_3': 1, 'kernel': 'LogLogistic', 'loss_name': 'CensoredNLLLoss'}. Best is trial 551 with value: 0.6925048594105658.[0m
[32m[I 2022-04-23 17:47:19,645][0m Trial 552 finished with value: 0.6743330607229023 and parameters: {'n_hidden': 2048, 'mixture_components': 2, 'use_sparse_layer': False, 'use_batchnorm': False, 'use_dropout': True, 'dropout': 0.298286686062327, 'mlp_size_1': 3, 'mlp_size_2': 3, 'mlp_size_3': 1, 'kernel': 'LogLogistic', 'loss_name': 'CensoredNLLLoss'}. Best is trial 551 with value: 0.6925048594105658.[0m
[32m[I 2022-04-23 17:48:43,925][0m Trial 553 finished with value: 0.6813294384126816 and parameters: {'n_hidden': 2048, 'mixture_components': 1, 'use_sparse_layer': True, 'use_sparse_loss': True, 'lmbd': 0.0032045681408242425, 'use_batchnorm': False, 'use_dropout': True, 'dropout': 0.3163107376022905, 'mlp_size_1': 3, 'mlp_size_2': 3, 'mlp_size_3': 1, 'kernel': 'LogLogistic', 'loss_name': 'CensoredNLLLoss'}. Best is trial 551 with value: 0.6925048594105658.[0m
[32m[I 2022-04-23 17:50:01,487][0m Trial 554 finished with value: 0.670986266334755 and parameters: {'n_hidden': 2048, 'mixture_components': 1, 'use_sparse_layer': True, 'use_sparse_loss': True, 'lmbd': 0.00511544866021737, 'use_batchnorm': False, 'use_dropout': True, 'dropout': 0.32587334070909296, 'mlp_size_1': 3, 'mlp_size_2': 3, 'mlp_size_3': 1, 'kernel': 'LogLogistic', 'loss_name': 'CensoredNLLLoss'}. Best is trial 551 with value: 0.6925048594105658.[0m
[32m[I 2022-04-23 17:51:19,653][0m Trial 555 finished with value: 0.6703680463546215 and parameters: {'n_hidden': 2048, 'mixture_components': 1, 'use_sparse_layer': True, 'use_sparse_loss': True, 'lmbd': 0.020902027103439018, 'use_batchnorm': False, 'use_dropout': True, 'dropout': 0.3217323726367335, 'mlp_size_1': 3, 'mlp_size_2': 3, 'mlp_size_3': 1, 'kernel': 'LogLogistic', 'loss_name': 'CensoredNLLLoss'}. Best is trial 551 with value: 0.6925048594105658.[0m
[32m[I 2022-04-23 17:52:36,773][0m Trial 556 finished with value: 0.6519083398417879 and parameters: {'n_hidden': 2048, 'mixture_components': 2, 'use_sparse_layer': True, 'use_sparse_loss': True, 'lmbd': 0.002222003019757826, 'use_batchnorm': False, 'use_dropout': True, 'dropout': 0.262138565897535, 'mlp_size_1': 3, 'mlp_size_2': 3, 'mlp_size_3': 1, 'kernel': 'LogLogistic', 'loss_name': 'CensoredNLLLoss'}. Best is trial 551 with value: 0.6925048594105658.[0m
[32m[I 2022-04-23 17:53:57,254][0m Trial 557 finished with value: 0.6696765976031583 and parameters: {'n_hidden': 2048, 'mixture_components': 1, 'use_sparse_layer': True, 'use_sparse_loss': True, 'lmbd': 0.023347738326761625, 'use_batchnorm': False, 'use_dropout': True, 'dropout': 0.2882368424879584, 'mlp_size_1': 3, 'mlp_size_2': 3, 'mlp_size_3': 1, 'kernel': 'LogLogistic', 'loss_name': 'CensoredNLLLoss'}. Best is trial 551 with value: 0.6925048594105658.[0m
[32m[I 2022-04-23 17:55:05,326][0m Trial 558 finished with value: 0.6673729097739391 and parameters: {'n_hidden': 1024, 'mixture_components': 1, 'use_sparse_layer': True, 'use_sparse_loss': True, 'lmbd': 0.0008422055913786409, 'use_batchnorm': False, 'use_dropout': True, 'dropout': 0.3047527747209392, 'mlp_size_1': 3, 'mlp_size_2': 3, 'mlp_size_3': 1, 'kernel': 'LogLogistic', 'loss_name': 'CensoredNLLLoss'}. Best is trial 551 with value: 0.6925048594105658.[0m
[32m[I 2022-04-23 17:56:33,391][0m Trial 559 finished with value: 0.6717445499812645 and parameters: {'n_hidden': 2048, 'mixture_components': 1, 'use_sparse_layer': True, 'use_sparse_loss': True, 'lmbd': 0.06472439914492858, 'use_batchnorm': False, 'use_dropout': True, 'dropout': 0.2744561120236804, 'mlp_size_1': 3, 'mlp_size_2': 3, 'mlp_size_3': 1, 'kernel': 'LogLogistic', 'loss_name': 'CensoredNLLLoss'}. Best is trial 551 with value: 0.6925048594105658.[0m
[32m[I 2022-04-23 17:57:56,412][0m Trial 560 finished with value: 0.6787614025707922 and parameters: {'n_hidden': 2048, 'mixture_components': 2, 'use_sparse_layer': True, 'use_sparse_loss': True, 'lmbd': 0.0043526660647175254, 'use_batchnorm': False, 'use_dropout': True, 'dropout': 0.2677219346708595, 'mlp_size_1': 3, 'mlp_size_2': 3, 'mlp_size_3': 1, 'kernel': 'LogLogistic', 'loss_name': 'CensoredNLLLoss'}. Best is trial 551 with value: 0.6925048594105658.[0m
[32m[I 2022-04-23 17:59:11,405][0m Trial 561 finished with value: 0.6636225102533458 and parameters: {'n_hidden': 2048, 'mixture_components': 1, 'use_sparse_layer': True, 'use_sparse_loss': True, 'lmbd': 0.0014622986147682145, 'use_batchnorm': False, 'use_dropout': True, 'dropout': 0.34519506572951214, 'mlp_size_1': 3, 'mlp_size_2': 4, 'mlp_size_3': 1, 'kernel': 'LogLogistic', 'loss_name': 'CensoredNLLLoss'}. Best is trial 551 with value: 0.6925048594105658.[0m
[32m[I 2022-04-23 18:00:01,056][0m Trial 562 finished with value: 0.6166508795281577 and parameters: {'n_hidden': 256, 'mixture_components': 2, 'use_sparse_layer': True, 'use_sparse_loss': True, 'lmbd': 0.020205046095239224, 'use_batchnorm': False, 'use_dropout': False, 'mlp_size_1': 4, 'mlp_size_2': 1, 'mlp_size_3': 0, 'kernel': 'LogLogistic', 'loss_name': 'CensoredNLLLoss'}. Best is trial 551 with value: 0.6925048594105658.[0m
[32m[I 2022-04-23 18:01:48,716][0m Trial 563 finished with value: 0.671170320092499 and parameters: {'n_hidden': 2048, 'mixture_components': 2, 'use_sparse_layer': True, 'use_sparse_loss': True, 'lmbd': 8.703147759489647e-05, 'use_batchnorm': False, 'use_dropout': True, 'dropout': 0.30486226238842995, 'mlp_size_1': 3, 'mlp_size_2': 3, 'mlp_size_3': 1, 'kernel': 'LogLogistic', 'loss_name': 'AlternativeNLLLoss'}. Best is trial 551 with value: 0.6925048594105658.[0m
[32m[I 2022-04-23 18:05:06,372][0m Trial 564 finished with value: 0.6407556864410904 and parameters: {'n_hidden': 2048, 'mixture_components': 2, 'use_sparse_layer': True, 'use_sparse_loss': True, 'lmbd': 0.0007316867581814934, 'use_batchnorm': True, 'use_dropout': True, 'dropout': 0.28662498215956933, 'mlp_size_1': 3, 'mlp_size_2': 3, 'mlp_size_3': 1, 'kernel': 'LogLogistic', 'loss_name': 'CensoredNLLLoss'}. Best is trial 551 with value: 0.6925048594105658.[0m
[32m[I 2022-04-23 18:06:20,389][0m Trial 565 finished with value: 0.6714592944144016 and parameters: {'n_hidden': 2048, 'mixture_components': 1, 'use_sparse_layer': True, 'use_sparse_loss': True, 'lmbd': 0.0021183070951189343, 'use_batchnorm': False, 'use_dropout': True, 'dropout': 0.28374531686282206, 'mlp_size_1': 3, 'mlp_size_2': 3, 'mlp_size_3': 1, 'kernel': 'LogLogistic', 'loss_name': 'CensoredNLLLoss'}. Best is trial 551 with value: 0.6925048594105658.[0m
[32m[I 2022-04-23 18:07:31,687][0m Trial 566 finished with value: 0.6665920131708142 and parameters: {'n_hidden': 2048, 'mixture_components': 2, 'use_sparse_layer': False, 'use_batchnorm': False, 'use_dropout': True, 'dropout': 0.250487172417524, 'mlp_size_1': 3, 'mlp_size_2': 3, 'mlp_size_3': 1, 'kernel': 'LogLogistic', 'loss_name': 'CensoredNLLLoss'}. Best is trial 551 with value: 0.6925048594105658.[0m
[32m[I 2022-04-23 18:08:34,732][0m Trial 567 finished with value: 0.6730289361699229 and parameters: {'n_hidden': 1024, 'mixture_components': 2, 'use_sparse_layer': False, 'use_batchnorm': False, 'use_dropout': True, 'dropout': 0.32730758374987506, 'mlp_size_1': 3, 'mlp_size_2': 3, 'mlp_size_3': 1, 'kernel': 'LogLogistic', 'loss_name': 'CensoredNLLLoss'}. Best is trial 551 with value: 0.6925048594105658.[0m
