[32m[I 2022-04-21 11:47:14,324][0m Trial 462 finished with value: 0.627392333051251 and parameters: {'splitter': 'best', 'min_samples_split': 0.1249946529524838, 'min_samples_leaf': 0.02912398016490575, 'min_weight_fraction_leaf': 0.0002828907595878328, 'max_features': 0.6016502893450857}. Best is trial 203 with value: 0.6541339470014573.[0m
[32m[I 2022-04-21 11:47:14,953][0m Trial 463 finished with value: 0.6264960233458562 and parameters: {'splitter': 'best', 'min_samples_split': 0.11201909496230711, 'min_samples_leaf': 0.019092631228412173, 'min_weight_fraction_leaf': 0.018355837319037546, 'max_features': 0.6417591865739972}. Best is trial 203 with value: 0.6541339470014573.[0m
[32m[I 2022-04-21 11:47:15,392][0m Trial 464 finished with value: 0.6321029045747961 and parameters: {'splitter': 'best', 'min_samples_split': 0.1351349206520025, 'min_samples_leaf': 0.010088505270221693, 'min_weight_fraction_leaf': 0.05931120304445606, 'max_features': 0.5722473715397266}. Best is trial 203 with value: 0.6541339470014573.[0m
[32m[I 2022-04-21 11:47:15,599][0m Trial 465 finished with value: 0.550080104839742 and parameters: {'splitter': 'best', 'min_samples_split': 0.09721991681803854, 'min_samples_leaf': 0.02094541403651457, 'min_weight_fraction_leaf': 0.2624673640513082, 'max_features': 0.7608851965442408}. Best is trial 203 with value: 0.6541339470014573.[0m
[32m[I 2022-04-21 11:47:16,137][0m Trial 466 finished with value: 0.6067781695632727 and parameters: {'splitter': 'best', 'min_samples_split': 0.15260755722152355, 'min_samples_leaf': 0.038027578606455725, 'min_weight_fraction_leaf': 0.009704175737431242, 'max_features': 0.6067768192568702}. Best is trial 203 with value: 0.6541339470014573.[0m
[32m[I 2022-04-21 11:47:16,690][0m Trial 467 finished with value: 0.6301474224446342 and parameters: {'splitter': 'best', 'min_samples_split': 0.08026886140265446, 'min_samples_leaf': 0.0011921534020316923, 'min_weight_fraction_leaf': 0.0471044441211765, 'max_features': 0.6198309063119006}. Best is trial 203 with value: 0.6541339470014573.[0m
[32m[I 2022-04-21 11:47:17,030][0m Trial 468 finished with value: 0.6135577092526493 and parameters: {'splitter': 'best', 'min_samples_split': 0.12256434945442424, 'min_samples_leaf': 0.0012080494237171474, 'min_weight_fraction_leaf': 0.11185650311273757, 'max_features': 0.5558982209738701}. Best is trial 203 with value: 0.6541339470014573.[0m
[32m[I 2022-04-21 11:47:17,649][0m Trial 469 finished with value: 0.6359814928930485 and parameters: {'splitter': 'best', 'min_samples_split': 0.10687969712413928, 'min_samples_leaf': 0.016291145607781807, 'min_weight_fraction_leaf': 0.026191249925189262, 'max_features': 0.7249363064924707}. Best is trial 203 with value: 0.6541339470014573.[0m
[32m[I 2022-04-21 11:47:17,749][0m Trial 470 finished with value: 0.5133003329278907 and parameters: {'splitter': 'best', 'min_samples_split': 0.14010917841147102, 'min_samples_leaf': 0.4468930510951725, 'min_weight_fraction_leaf': 0.008196590755444764, 'max_features': 0.6442680499640783}. Best is trial 203 with value: 0.6541339470014573.[0m
[32m[I 2022-04-21 11:47:18,219][0m Trial 471 finished with value: 0.6241769767575021 and parameters: {'splitter': 'best', 'min_samples_split': 0.1499682620985211, 'min_samples_leaf': 0.03096442167263188, 'min_weight_fraction_leaf': 0.018052875685553606, 'max_features': 0.5817965234130527}. Best is trial 203 with value: 0.6541339470014573.[0m
[32m[I 2022-04-21 11:47:18,784][0m Trial 472 finished with value: 0.6250087835210562 and parameters: {'splitter': 'best', 'min_samples_split': 0.15730789862931782, 'min_samples_leaf': 0.011713983106915514, 'min_weight_fraction_leaf': 9.011628212767596e-05, 'max_features': 0.6251192799113883}. Best is trial 203 with value: 0.6541339470014573.[0m
[32m[I 2022-04-21 11:47:19,217][0m Trial 473 finished with value: 0.5908891967675781 and parameters: {'splitter': 'best', 'min_samples_split': 0.13295345515063114, 'min_samples_leaf': 0.04541772741912269, 'min_weight_fraction_leaf': 0.03591808731994428, 'max_features': 0.7467873403816646}. Best is trial 203 with value: 0.6541339470014573.[0m
[32m[I 2022-04-21 11:47:19,688][0m Trial 474 finished with value: 0.6142262167079198 and parameters: {'splitter': 'best', 'min_samples_split': 0.09215579769375308, 'min_samples_leaf': 0.025581595165644167, 'min_weight_fraction_leaf': 0.015162412456543997, 'max_features': 0.7162447428665434}. Best is trial 203 with value: 0.6541339470014573.[0m
[32m[I 2022-04-21 11:47:20,251][0m Trial 475 finished with value: 0.6251868418407549 and parameters: {'splitter': 'best', 'min_samples_split': 0.11256945754080717, 'min_samples_leaf': 0.010964313434514096, 'min_weight_fraction_leaf': 0.02610739497733146, 'max_features': 0.7841375030541758}. Best is trial 203 with value: 0.6541339470014573.[0m
[32m[I 2022-04-21 11:47:20,893][0m Trial 476 finished with value: 0.6177572733342738 and parameters: {'splitter': 'best', 'min_samples_split': 0.12292032249309946, 'min_samples_leaf': 0.018356796076983983, 'min_weight_fraction_leaf': 0.011070293446416, 'max_features': 0.6566906459396781}. Best is trial 203 with value: 0.6541339470014573.[0m
[32m[I 2022-04-21 11:47:21,581][0m Trial 477 finished with value: 0.6264900362060452 and parameters: {'splitter': 'best', 'min_samples_split': 0.14392599992175029, 'min_samples_leaf': 0.00964075065434814, 'min_weight_fraction_leaf': 0.03346793556791547, 'max_features': 0.5952367181955972}. Best is trial 203 with value: 0.6541339470014573.[0m
[32m[I 2022-04-21 11:47:22,808][0m Trial 478 finished with value: 0.6202389165757187 and parameters: {'splitter': 'best', 'min_samples_split': 0.10188961414213493, 'min_samples_leaf': 0.0010675678922921993, 'min_weight_fraction_leaf': 0.008203665820372737, 'max_features': 0.6289489093566594}. Best is trial 203 with value: 0.6541339470014573.[0m
[32m[I 2022-04-21 11:47:23,353][0m Trial 479 finished with value: 0.6352700174136692 and parameters: {'splitter': 'best', 'min_samples_split': 0.15727019109086518, 'min_samples_leaf': 0.024581151982842706, 'min_weight_fraction_leaf': 0.02305727499422582, 'max_features': 0.7611267086486465}. Best is trial 203 with value: 0.6541339470014573.[0m
[32m[I 2022-04-21 11:47:23,744][0m Trial 480 finished with value: 0.6392075342293182 and parameters: {'splitter': 'best', 'min_samples_split': 0.13063548008984271, 'min_samples_leaf': 0.03321031736631225, 'min_weight_fraction_leaf': 0.016906707840858886, 'max_features': 0.7346341489049308}. Best is trial 203 with value: 0.6541339470014573.[0m
[32m[I 2022-04-21 11:47:24,212][0m Trial 481 finished with value: 0.6388916392371009 and parameters: {'splitter': 'best', 'min_samples_split': 0.11570757837817806, 'min_samples_leaf': 0.0180068216411076, 'min_weight_fraction_leaf': 0.041081744874879006, 'max_features': 0.517702785722339}. Best is trial 203 with value: 0.6541339470014573.[0m
[32m[I 2022-04-21 11:47:24,666][0m Trial 482 finished with value: 0.6230003349123607 and parameters: {'splitter': 'best', 'min_samples_split': 0.13903640058231945, 'min_samples_leaf': 0.00940956560234021, 'min_weight_fraction_leaf': 0.00010618350663711348, 'max_features': 0.5444432369747568}. Best is trial 203 with value: 0.6541339470014573.[0m
[32m[I 2022-04-21 11:47:25,520][0m Trial 483 finished with value: 0.6401760534379675 and parameters: {'splitter': 'best', 'min_samples_split': 0.08642369651762288, 'min_samples_leaf': 0.0013600333395334101, 'min_weight_fraction_leaf': 0.008709780736186353, 'max_features': 0.6525314317336524}. Best is trial 203 with value: 0.6541339470014573.[0m
[32m[I 2022-04-21 11:47:26,028][0m Trial 484 finished with value: 0.6362609793811317 and parameters: {'splitter': 'best', 'min_samples_split': 0.12117325417937663, 'min_samples_leaf': 0.02662680217475679, 'min_weight_fraction_leaf': 0.023967451997302776, 'max_features': 0.6095426425728292}. Best is trial 203 with value: 0.6541339470014573.[0m
[32m[I 2022-04-21 11:47:26,614][0m Trial 485 finished with value: 0.6300571591968402 and parameters: {'splitter': 'best', 'min_samples_split': 0.1611459649655685, 'min_samples_leaf': 0.017054222417079334, 'min_weight_fraction_leaf': 0.016766521969550554, 'max_features': 0.5814038453685958}. Best is trial 203 with value: 0.6541339470014573.[0m
[32m[I 2022-04-21 11:47:27,099][0m Trial 486 finished with value: 0.6235626194999705 and parameters: {'splitter': 'best', 'min_samples_split': 0.10812469490877832, 'min_samples_leaf': 0.010269424698533064, 'min_weight_fraction_leaf': 0.033753192724982256, 'max_features': 0.7182821338001585}. Best is trial 203 with value: 0.6541339470014573.[0m
[32m[I 2022-04-21 11:47:27,364][0m Trial 487 finished with value: 0.604782802347825 and parameters: {'splitter': 'best', 'min_samples_split': 0.13243313108075996, 'min_samples_leaf': 0.041473057107584796, 'min_weight_fraction_leaf': 0.00018782597526880926, 'max_features': 0.6361596771385382}. Best is trial 203 with value: 0.6541339470014573.[0m
[32m[I 2022-04-21 11:47:27,489][0m Trial 488 finished with value: 0.6008588406318298 and parameters: {'splitter': 'best', 'min_samples_split': 0.14654950018668264, 'min_samples_leaf': 0.14504061883530261, 'min_weight_fraction_leaf': 0.008569565025491105, 'max_features': 0.6140329687290478}. Best is trial 203 with value: 0.6541339470014573.[0m
[32m[I 2022-04-21 11:47:28,128][0m Trial 489 finished with value: 0.6141802322515008 and parameters: {'splitter': 'best', 'min_samples_split': 0.12419224421820743, 'min_samples_leaf': 0.0010084587882211943, 'min_weight_fraction_leaf': 0.05293097351124117, 'max_features': 0.5663611809693249}. Best is trial 203 with value: 0.6541339470014573.[0m
[32m[I 2022-04-21 11:47:28,784][0m Trial 490 finished with value: 0.6233743659729314 and parameters: {'splitter': 'best', 'min_samples_split': 0.10279586576816756, 'min_samples_leaf': 0.028526123764120198, 'min_weight_fraction_leaf': 0.02702035708380182, 'max_features': 0.653931813635824}. Best is trial 203 with value: 0.6541339470014573.[0m
[32m[I 2022-04-21 11:47:29,522][0m Trial 491 finished with value: 0.6399502932600563 and parameters: {'splitter': 'best', 'min_samples_split': 0.15181932718231728, 'min_samples_leaf': 0.01868555219766223, 'min_weight_fraction_leaf': 0.016406563222620872, 'max_features': 0.6002485133815759}. Best is trial 203 with value: 0.6541339470014573.[0m
[32m[I 2022-04-21 11:47:30,372][0m Trial 492 finished with value: 0.6241807113175853 and parameters: {'splitter': 'best', 'min_samples_split': 0.11456163377625152, 'min_samples_leaf': 0.014790826280958447, 'min_weight_fraction_leaf': 0.008203548404400192, 'max_features': 0.713015785884808}. Best is trial 203 with value: 0.6541339470014573.[0m
[32m[I 2022-04-21 11:47:30,675][0m Trial 493 finished with value: 0.6240456694557045 and parameters: {'splitter': 'best', 'min_samples_split': 0.1743588408812046, 'min_samples_leaf': 0.009300203969500122, 'min_weight_fraction_leaf': 0.02135910146457714, 'max_features': 0.2384609434451146}. Best is trial 203 with value: 0.6541339470014573.[0m
[32m[I 2022-04-21 11:47:31,346][0m Trial 494 finished with value: 0.6238054962511534 and parameters: {'splitter': 'best', 'min_samples_split': 0.1379093576743174, 'min_samples_leaf': 0.03541479623290393, 'min_weight_fraction_leaf': 0.04171758086211019, 'max_features': 0.7426566856387445}. Best is trial 203 with value: 0.6541339470014573.[0m
[32m[I 2022-04-21 11:47:31,731][0m Trial 495 finished with value: 0.5793617203459235 and parameters: {'splitter': 'best', 'min_samples_split': 0.0928151874856148, 'min_samples_leaf': 0.023124297330065244, 'min_weight_fraction_leaf': 0.20564781702975138, 'max_features': 0.780289928694433}. Best is trial 203 with value: 0.6541339470014573.[0m
[32m[I 2022-04-21 11:47:31,913][0m Trial 496 finished with value: 0.5754649634882707 and parameters: {'splitter': 'best', 'min_samples_split': 0.1277557615560787, 'min_samples_leaf': 0.23929499291815615, 'min_weight_fraction_leaf': 0.031120611646594878, 'max_features': 0.6224412056622604}. Best is trial 203 with value: 0.6541339470014573.[0m
[32m[I 2022-04-21 11:47:32,474][0m Trial 497 finished with value: 0.6112055988199361 and parameters: {'splitter': 'best', 'min_samples_split': 0.16025219025754894, 'min_samples_leaf': 0.04995168828047575, 'min_weight_fraction_leaf': 0.007809057321950731, 'max_features': 0.6631254989121658}. Best is trial 203 with value: 0.6541339470014573.[0m
[32m[I 2022-04-21 11:47:33,122][0m Trial 498 finished with value: 0.6435397041943084 and parameters: {'splitter': 'best', 'min_samples_split': 0.1444810373048276, 'min_samples_leaf': 0.010380956371023676, 'min_weight_fraction_leaf': 0.018215379182832878, 'max_features': 0.5838589530465591}. Best is trial 203 with value: 0.6541339470014573.[0m
[32m[I 2022-04-21 11:47:33,733][0m Trial 499 finished with value: 0.6304985980461856 and parameters: {'splitter': 'best', 'min_samples_split': 0.11182270106518394, 'min_samples_leaf': 0.02427840032526223, 'min_weight_fraction_leaf': 0.0001390719697655987, 'max_features': 0.7097800831270037}. Best is trial 203 with value: 0.6541339470014573.[0m
[32m[I 2022-04-21 11:47:34,433][0m Trial 500 finished with value: 0.6257491372958419 and parameters: {'splitter': 'best', 'min_samples_split': 0.07522565865207087, 'min_samples_leaf': 0.0013420468263721282, 'min_weight_fraction_leaf': 0.028051760291958765, 'max_features': 0.6388215852577306}. Best is trial 203 with value: 0.6541339470014573.[0m
[32m[I 2022-04-21 11:47:35,148][0m Trial 501 finished with value: 0.6288118617298181 and parameters: {'splitter': 'best', 'min_samples_split': 0.12002070732530923, 'min_samples_leaf': 0.010506282404202209, 'min_weight_fraction_leaf': 0.016239708324925127, 'max_features': 0.758194317748675}. Best is trial 203 with value: 0.6541339470014573.[0m
[32m[I 2022-04-21 11:47:36,019][0m Trial 502 finished with value: 0.624077470339105 and parameters: {'splitter': 'best', 'min_samples_split': 0.13238693607922283, 'min_samples_leaf': 0.001003715295289677, 'min_weight_fraction_leaf': 0.009035186304019026, 'max_features': 0.5580783198727297}. Best is trial 203 with value: 0.6541339470014573.[0m
[32m[I 2022-04-21 11:47:36,446][0m Trial 503 finished with value: 0.6151716448068714 and parameters: {'splitter': 'best', 'min_samples_split': 0.17499912277219834, 'min_samples_leaf': 0.029902943875161587, 'min_weight_fraction_leaf': 0.02342118481091897, 'max_features': 0.6743308757307509}. Best is trial 203 with value: 0.6541339470014573.[0m
[32m[I 2022-04-21 11:47:36,911][0m Trial 504 finished with value: 0.6094932864562338 and parameters: {'splitter': 'best', 'min_samples_split': 0.15094525995772778, 'min_samples_leaf': 0.018523528445041102, 'min_weight_fraction_leaf': 0.037447277050277214, 'max_features': 0.603997571139113}. Best is trial 203 with value: 0.6541339470014573.[0m
[32m[I 2022-04-21 11:47:37,838][0m Trial 505 finished with value: 0.6454777962136065 and parameters: {'splitter': 'best', 'min_samples_split': 0.10141112490168105, 'min_samples_leaf': 0.01694104813250705, 'min_weight_fraction_leaf': 0.008623417264855054, 'max_features': 0.8107712071894884}. Best is trial 203 with value: 0.6541339470014573.[0m
[32m[I 2022-04-21 11:47:38,707][0m Trial 506 finished with value: 0.629150361197733 and parameters: {'splitter': 'best', 'min_samples_split': 0.09056673927579104, 'min_samples_leaf': 0.010003029643228228, 'min_weight_fraction_leaf': 0.0006208600938081871, 'max_features': 0.7755596129689101}. Best is trial 203 with value: 0.6541339470014573.[0m
[32m[I 2022-04-21 11:47:39,420][0m Trial 507 finished with value: 0.6585778818712512 and parameters: {'splitter': 'best', 'min_samples_split': 0.10369615970792996, 'min_samples_leaf': 0.01686245807559797, 'min_weight_fraction_leaf': 0.015515629508164461, 'max_features': 0.8059399637962052}. Best is trial 507 with value: 0.6585778818712512.[0m
[32m[I 2022-04-21 11:47:39,703][0m Trial 508 finished with value: 0.5889213174920773 and parameters: {'splitter': 'best', 'min_samples_split': 0.09917205339167473, 'min_samples_leaf': 0.037627693132586244, 'min_weight_fraction_leaf': 0.22719716744634375, 'max_features': 0.8590878202954334}. Best is trial 507 with value: 0.6585778818712512.[0m
[32m[I 2022-04-21 11:47:40,959][0m Trial 509 finished with value: 0.6348569225482148 and parameters: {'splitter': 'best', 'min_samples_split': 0.08500102616309449, 'min_samples_leaf': 0.019815035707037847, 'min_weight_fraction_leaf': 0.015607051349874817, 'max_features': 0.8036000042307783}. Best is trial 507 with value: 0.6585778818712512.[0m
[32m[I 2022-04-21 11:47:41,510][0m Trial 510 finished with value: 0.6183271193431306 and parameters: {'splitter': 'best', 'min_samples_split': 0.10626574357572713, 'min_samples_leaf': 0.03133379597766924, 'min_weight_fraction_leaf': 0.04675271852357926, 'max_features': 0.8453575342286369}. Best is trial 507 with value: 0.6585778818712512.[0m
[32m[I 2022-04-21 11:47:42,699][0m Trial 511 finished with value: 0.6340487003578622 and parameters: {'splitter': 'best', 'min_samples_split': 0.09975279267178154, 'min_samples_leaf': 0.01754128428654854, 'min_weight_fraction_leaf': 0.030485895185394456, 'max_features': 0.8227984910960362}. Best is trial 507 with value: 0.6585778818712512.[0m
[32m[I 2022-04-21 11:47:43,139][0m Trial 512 finished with value: 0.5446312282652499 and parameters: {'splitter': 'best', 'min_samples_split': 0.11120711391994388, 'min_samples_leaf': 0.009761504071961958, 'min_weight_fraction_leaf': 0.32205065218372103, 'max_features': 0.7874968286218887}. Best is trial 507 with value: 0.6585778818712512.[0m
[32m[I 2022-04-21 11:47:43,752][0m Trial 513 finished with value: 0.6351193334606599 and parameters: {'splitter': 'best', 'min_samples_split': 0.09849891606283037, 'min_samples_leaf': 0.021574649263096483, 'min_weight_fraction_leaf': 0.02259709169238529, 'max_features': 0.796343646924125}. Best is trial 507 with value: 0.6585778818712512.[0m
[32m[I 2022-04-21 11:47:44,941][0m Trial 514 finished with value: 0.6428333122622598 and parameters: {'splitter': 'best', 'min_samples_split': 0.11803277017398464, 'min_samples_leaf': 0.010016576440666052, 'min_weight_fraction_leaf': 0.00013685536032063592, 'max_features': 0.833615896191791}. Best is trial 507 with value: 0.6585778818712512.[0m
[32m[I 2022-04-21 11:47:46,635][0m Trial 515 finished with value: 0.6403626174063135 and parameters: {'splitter': 'best', 'min_samples_split': 0.08116663084281629, 'min_samples_leaf': 0.0010914681607559172, 'min_weight_fraction_leaf': 0.009652451795863838, 'max_features': 0.7843360292636627}. Best is trial 507 with value: 0.6585778818712512.[0m
[32m[I 2022-04-21 11:47:47,730][0m Trial 516 finished with value: 0.619608273261982 and parameters: {'splitter': 'best', 'min_samples_split': 0.09304019148022807, 'min_samples_leaf': 0.031219918416713958, 'min_weight_fraction_leaf': 0.01604194108818794, 'max_features': 0.8013377284631364}. Best is trial 507 with value: 0.6585778818712512.[0m
[32m[I 2022-04-21 11:47:48,507][0m Trial 517 finished with value: 0.6352197800687207 and parameters: {'splitter': 'best', 'min_samples_split': 0.06711886857661639, 'min_samples_leaf': 0.0010354601892219456, 'min_weight_fraction_leaf': 0.032943867001795316, 'max_features': 0.5302909374942626}. Best is trial 507 with value: 0.6585778818712512.[0m
[32m[I 2022-04-21 11:47:49,069][0m Trial 518 finished with value: 0.6181974382903507 and parameters: {'splitter': 'best', 'min_samples_split': 0.10392608309212653, 'min_samples_leaf': 0.042055387704218516, 'min_weight_fraction_leaf': 0.00985161429456466, 'max_features': 0.8116987971169597}. Best is trial 507 with value: 0.6585778818712512.[0m
[32m[I 2022-04-21 11:47:49,443][0m Trial 519 finished with value: 0.5484698426793557 and parameters: {'splitter': 'best', 'min_samples_split': 0.11317485433261999, 'min_samples_leaf': 0.01755009388205798, 'min_weight_fraction_leaf': 0.29995376622160336, 'max_features': 0.8504246504765028}. Best is trial 507 with value: 0.6585778818712512.[0m
[32m[I 2022-04-21 11:47:49,934][0m Trial 520 finished with value: 0.6369832017281383 and parameters: {'splitter': 'best', 'min_samples_split': 0.1205536588681331, 'min_samples_leaf': 0.025921958389704382, 'min_weight_fraction_leaf': 0.023653594501095554, 'max_features': 0.8008891921279455}. Best is trial 507 with value: 0.6585778818712512.[0m
[32m[I 2022-04-21 11:47:50,558][0m Trial 521 finished with value: 0.6247586849919432 and parameters: {'splitter': 'best', 'min_samples_split': 0.12394342367707739, 'min_samples_leaf': 0.012477992464085225, 'min_weight_fraction_leaf': 0.009121232028770517, 'max_features': 0.8379753611603422}. Best is trial 507 with value: 0.6585778818712512.[0m
[32m[I 2022-04-21 11:47:51,144][0m Trial 522 finished with value: 0.6285385588023151 and parameters: {'splitter': 'best', 'min_samples_split': 0.11126913366071194, 'min_samples_leaf': 0.019334247081488773, 'min_weight_fraction_leaf': 0.0002243593686680017, 'max_features': 0.8214975477778917}. Best is trial 507 with value: 0.6585778818712512.[0m
[32m[I 2022-04-21 11:47:51,307][0m Trial 523 finished with value: 0.6093294299257582 and parameters: {'splitter': 'best', 'min_samples_split': 0.09122296258893371, 'min_samples_leaf': 0.010355974517025175, 'min_weight_fraction_leaf': 0.03787110301118918, 'max_features': 0.13740483361377936}. Best is trial 507 with value: 0.6585778818712512.[0m
[32m[I 2022-04-21 11:47:51,483][0m Trial 524 finished with value: 0.5155975170068372 and parameters: {'splitter': 'best', 'min_samples_split': 0.13194954219061425, 'min_samples_leaf': 0.0010693376175551746, 'min_weight_fraction_leaf': 0.42925610970944117, 'max_features': 0.5702050337478837}. Best is trial 507 with value: 0.6585778818712512.[0m
