[32m[I 2022-04-21 23:48:07,080][0m Trial 213 finished with value: 0.8321721721887272 and parameters: {'n_hidden': 256, 'mixture_components': 5, 'use_sparse_layer': True, 'use_sparse_loss': False, 'use_batchnorm': True, 'use_dropout': True, 'dropout': 0.631028923654449, 'mlp_size_1': 0, 'mlp_size_2': 5, 'mlp_size_3': 0, 'kernel': 'Logistic', 'loss_name': 'NLLLoss'}. Best is trial 22 with value: 0.8433318468070169.[0m
[32m[I 2022-04-21 23:52:54,050][0m Trial 214 finished with value: 0.8331971138387896 and parameters: {'n_hidden': 256, 'mixture_components': 5, 'use_sparse_layer': True, 'use_sparse_loss': False, 'use_batchnorm': True, 'use_dropout': True, 'dropout': 0.7021021833362595, 'mlp_size_1': 0, 'mlp_size_2': 5, 'mlp_size_3': 0, 'kernel': 'Exponential', 'loss_name': 'NLLLoss'}. Best is trial 22 with value: 0.8433318468070169.[0m
[32m[I 2022-04-21 23:57:14,932][0m Trial 215 finished with value: 0.834864686308084 and parameters: {'n_hidden': 256, 'mixture_components': 5, 'use_sparse_layer': True, 'use_sparse_loss': False, 'use_batchnorm': True, 'use_dropout': True, 'dropout': 0.5928397398319717, 'mlp_size_1': 0, 'mlp_size_2': 5, 'mlp_size_3': 0, 'kernel': 'Exponential', 'loss_name': 'NLLLoss'}. Best is trial 22 with value: 0.8433318468070169.[0m
[32m[I 2022-04-22 00:02:12,245][0m Trial 216 finished with value: 0.2956111877201359 and parameters: {'n_hidden': 32, 'mixture_components': 9, 'use_sparse_layer': True, 'use_sparse_loss': False, 'use_batchnorm': True, 'use_dropout': True, 'dropout': 0.58168436068987, 'mlp_size_1': 2, 'mlp_size_2': 0, 'mlp_size_3': 0, 'kernel': 'Normal', 'loss_name': 'NLLLoss'}. Best is trial 22 with value: 0.8433318468070169.[0m
[32m[I 2022-04-22 00:07:42,413][0m Trial 217 finished with value: 0.8334979627323043 and parameters: {'n_hidden': 64, 'mixture_components': 6, 'use_sparse_layer': True, 'use_sparse_loss': False, 'use_batchnorm': True, 'use_dropout': True, 'dropout': 0.5145911362545296, 'mlp_size_1': 0, 'mlp_size_2': 3, 'mlp_size_3': 0, 'kernel': 'Logistic', 'loss_name': 'NLLLoss'}. Best is trial 22 with value: 0.8433318468070169.[0m
[32m[I 2022-04-22 00:13:36,861][0m Trial 218 finished with value: 0.8177624208677461 and parameters: {'n_hidden': 256, 'mixture_components': 3, 'use_sparse_layer': True, 'use_sparse_loss': False, 'use_batchnorm': True, 'use_dropout': True, 'dropout': 0.6764392955003409, 'mlp_size_1': 3, 'mlp_size_2': 1, 'mlp_size_3': 0, 'kernel': 'Exponential', 'loss_name': 'NLLLoss'}. Best is trial 22 with value: 0.8433318468070169.[0m
[32m[I 2022-04-22 00:15:38,898][0m Trial 219 finished with value: -0.3362818094547308 and parameters: {'n_hidden': 512, 'mixture_components': 5, 'use_sparse_layer': True, 'use_sparse_loss': False, 'use_batchnorm': True, 'use_dropout': True, 'dropout': 0.34897174665883035, 'mlp_size_1': 0, 'mlp_size_2': 6, 'mlp_size_3': 0, 'kernel': 'Gumbel', 'loss_name': 'CensoredNLLLoss'}. Best is trial 22 with value: 0.8433318468070169.[0m
[32m[I 2022-04-22 00:19:54,906][0m Trial 220 finished with value: 0.8248938020277776 and parameters: {'n_hidden': 256, 'mixture_components': 5, 'use_sparse_layer': True, 'use_sparse_loss': False, 'use_batchnorm': False, 'use_dropout': True, 'dropout': 0.1540021586723326, 'mlp_size_1': 0, 'mlp_size_2': 5, 'mlp_size_3': 0, 'kernel': 'Exponential', 'loss_name': 'NLLLoss'}. Best is trial 22 with value: 0.8433318468070169.[0m
[32m[I 2022-04-22 00:24:47,232][0m Trial 221 finished with value: 0.8361080940468696 and parameters: {'n_hidden': 256, 'mixture_components': 5, 'use_sparse_layer': True, 'use_sparse_loss': False, 'use_batchnorm': True, 'use_dropout': True, 'dropout': 0.6033499169494401, 'mlp_size_1': 0, 'mlp_size_2': 5, 'mlp_size_3': 0, 'kernel': 'Exponential', 'loss_name': 'NLLLoss'}. Best is trial 22 with value: 0.8433318468070169.[0m
[32m[I 2022-04-22 00:29:32,233][0m Trial 222 finished with value: 0.835768070104638 and parameters: {'n_hidden': 256, 'mixture_components': 5, 'use_sparse_layer': True, 'use_sparse_loss': False, 'use_batchnorm': True, 'use_dropout': True, 'dropout': 0.6589587375625764, 'mlp_size_1': 0, 'mlp_size_2': 5, 'mlp_size_3': 0, 'kernel': 'Exponential', 'loss_name': 'NLLLoss'}. Best is trial 22 with value: 0.8433318468070169.[0m
[32m[I 2022-04-22 00:33:48,117][0m Trial 223 finished with value: 0.834352942124227 and parameters: {'n_hidden': 256, 'mixture_components': 5, 'use_sparse_layer': True, 'use_sparse_loss': False, 'use_batchnorm': True, 'use_dropout': True, 'dropout': 0.6630905088068648, 'mlp_size_1': 0, 'mlp_size_2': 5, 'mlp_size_3': 0, 'kernel': 'Exponential', 'loss_name': 'NLLLoss'}. Best is trial 22 with value: 0.8433318468070169.[0m
[32m[I 2022-04-22 00:38:48,609][0m Trial 224 finished with value: 0.832166977487994 and parameters: {'n_hidden': 256, 'mixture_components': 5, 'use_sparse_layer': True, 'use_sparse_loss': False, 'use_batchnorm': True, 'use_dropout': True, 'dropout': 0.6246594890869549, 'mlp_size_1': 0, 'mlp_size_2': 5, 'mlp_size_3': 0, 'kernel': 'Exponential', 'loss_name': 'NLLLoss'}. Best is trial 22 with value: 0.8433318468070169.[0m
[32m[I 2022-04-22 00:43:51,293][0m Trial 225 finished with value: 0.831139951367654 and parameters: {'n_hidden': 256, 'mixture_components': 5, 'use_sparse_layer': True, 'use_sparse_loss': False, 'use_batchnorm': True, 'use_dropout': True, 'dropout': 0.648968276897286, 'mlp_size_1': 0, 'mlp_size_2': 5, 'mlp_size_3': 0, 'kernel': 'Exponential', 'loss_name': 'NLLLoss'}. Best is trial 22 with value: 0.8433318468070169.[0m
[32m[I 2022-04-22 00:48:20,148][0m Trial 226 finished with value: 0.8352296677318953 and parameters: {'n_hidden': 256, 'mixture_components': 5, 'use_sparse_layer': True, 'use_sparse_loss': False, 'use_batchnorm': True, 'use_dropout': True, 'dropout': 0.5491531342948157, 'mlp_size_1': 0, 'mlp_size_2': 5, 'mlp_size_3': 0, 'kernel': 'Exponential', 'loss_name': 'NLLLoss'}. Best is trial 22 with value: 0.8433318468070169.[0m
[32m[I 2022-04-22 00:53:15,883][0m Trial 227 finished with value: 0.8322821029094986 and parameters: {'n_hidden': 256, 'mixture_components': 5, 'use_sparse_layer': True, 'use_sparse_loss': False, 'use_batchnorm': True, 'use_dropout': True, 'dropout': 0.5507606722676142, 'mlp_size_1': 0, 'mlp_size_2': 5, 'mlp_size_3': 0, 'kernel': 'Exponential', 'loss_name': 'NLLLoss'}. Best is trial 22 with value: 0.8433318468070169.[0m
[32m[I 2022-04-22 00:58:18,217][0m Trial 228 finished with value: 0.8335040293377591 and parameters: {'n_hidden': 256, 'mixture_components': 5, 'use_sparse_layer': True, 'use_sparse_loss': False, 'use_batchnorm': True, 'use_dropout': True, 'dropout': 0.5924148877018942, 'mlp_size_1': 0, 'mlp_size_2': 5, 'mlp_size_3': 0, 'kernel': 'Exponential', 'loss_name': 'NLLLoss'}. Best is trial 22 with value: 0.8433318468070169.[0m
[32m[I 2022-04-22 01:00:36,595][0m Trial 229 finished with value: -0.2326108580647701 and parameters: {'n_hidden': 256, 'mixture_components': 5, 'use_sparse_layer': True, 'use_sparse_loss': False, 'use_batchnorm': True, 'use_dropout': True, 'dropout': 0.6187060495564012, 'mlp_size_1': 0, 'mlp_size_2': 5, 'mlp_size_3': 0, 'kernel': 'Exponential', 'loss_name': 'AlternativeNLLLoss'}. Best is trial 22 with value: 0.8433318468070169.[0m
[32m[I 2022-04-22 01:02:29,855][0m Trial 230 finished with value: -0.5 and parameters: {'n_hidden': 256, 'mixture_components': 4, 'use_sparse_layer': True, 'use_sparse_loss': False, 'use_batchnorm': True, 'use_dropout': True, 'dropout': 0.9702315368831258, 'mlp_size_1': 0, 'mlp_size_2': 5, 'mlp_size_3': 0, 'kernel': 'Exponential', 'loss_name': 'NLLLoss'}. Best is trial 22 with value: 0.8433318468070169.[0m
[32m[I 2022-04-22 01:07:40,372][0m Trial 231 finished with value: 0.8293248350562109 and parameters: {'n_hidden': 256, 'mixture_components': 5, 'use_sparse_layer': True, 'use_sparse_loss': False, 'use_batchnorm': True, 'use_dropout': True, 'dropout': 0.5731797501477708, 'mlp_size_1': 0, 'mlp_size_2': 5, 'mlp_size_3': 0, 'kernel': 'Exponential', 'loss_name': 'NLLLoss'}. Best is trial 22 with value: 0.8433318468070169.[0m
[32m[I 2022-04-22 01:13:19,867][0m Trial 232 finished with value: 0.7240036890420477 and parameters: {'n_hidden': 256, 'mixture_components': 5, 'use_sparse_layer': True, 'use_sparse_loss': False, 'use_batchnorm': True, 'use_dropout': True, 'dropout': 0.5294885533543449, 'mlp_size_1': 0, 'mlp_size_2': 5, 'mlp_size_3': 0, 'kernel': 'Normal', 'loss_name': 'NLLLoss'}. Best is trial 22 with value: 0.8433318468070169.[0m
[32m[I 2022-04-22 01:18:05,380][0m Trial 233 finished with value: 0.8363854039618271 and parameters: {'n_hidden': 256, 'mixture_components': 5, 'use_sparse_layer': True, 'use_sparse_loss': False, 'use_batchnorm': True, 'use_dropout': True, 'dropout': 0.47960605150253965, 'mlp_size_1': 0, 'mlp_size_2': 5, 'mlp_size_3': 0, 'kernel': 'Exponential', 'loss_name': 'NLLLoss'}. Best is trial 22 with value: 0.8433318468070169.[0m
[32m[I 2022-04-22 01:22:58,403][0m Trial 234 finished with value: 0.8312747546322938 and parameters: {'n_hidden': 256, 'mixture_components': 5, 'use_sparse_layer': True, 'use_sparse_loss': False, 'use_batchnorm': True, 'use_dropout': True, 'dropout': 0.02080540138101125, 'mlp_size_1': 0, 'mlp_size_2': 5, 'mlp_size_3': 0, 'kernel': 'Exponential', 'loss_name': 'NLLLoss'}. Best is trial 22 with value: 0.8433318468070169.[0m
[32m[I 2022-04-22 01:28:11,194][0m Trial 235 finished with value: 0.8329334914294186 and parameters: {'n_hidden': 256, 'mixture_components': 1, 'use_sparse_layer': True, 'use_sparse_loss': False, 'use_batchnorm': True, 'use_dropout': True, 'dropout': 0.46366860049122927, 'mlp_size_1': 0, 'mlp_size_2': 5, 'mlp_size_3': 0, 'kernel': 'Exponential', 'loss_name': 'NLLLoss'}. Best is trial 22 with value: 0.8433318468070169.[0m
[32m[I 2022-04-22 01:32:56,389][0m Trial 236 finished with value: 0.8337431446813495 and parameters: {'n_hidden': 256, 'mixture_components': 5, 'use_sparse_layer': True, 'use_sparse_loss': False, 'use_batchnorm': True, 'use_dropout': True, 'dropout': 0.687245138480536, 'mlp_size_1': 0, 'mlp_size_2': 5, 'mlp_size_3': 0, 'kernel': 'Exponential', 'loss_name': 'NLLLoss'}. Best is trial 22 with value: 0.8433318468070169.[0m
[32m[I 2022-04-22 01:34:49,922][0m Trial 237 finished with value: -0.33786663546527085 and parameters: {'n_hidden': 1024, 'mixture_components': 5, 'use_sparse_layer': True, 'use_sparse_loss': False, 'use_batchnorm': True, 'use_dropout': True, 'dropout': 0.4844417412995301, 'mlp_size_1': 6, 'mlp_size_2': 1, 'mlp_size_3': 0, 'kernel': 'Exponential', 'loss_name': 'CensoredNLLLoss'}. Best is trial 22 with value: 0.8433318468070169.[0m
[32m[I 2022-04-22 01:38:46,391][0m Trial 238 finished with value: 0.8347984885325378 and parameters: {'n_hidden': 256, 'mixture_components': 5, 'use_sparse_layer': True, 'use_sparse_loss': False, 'use_batchnorm': True, 'use_dropout': True, 'dropout': 0.517181960605755, 'mlp_size_1': 0, 'mlp_size_2': 5, 'mlp_size_3': 0, 'kernel': 'Exponential', 'loss_name': 'NLLLoss'}. Best is trial 22 with value: 0.8433318468070169.[0m
[32m[I 2022-04-22 01:42:57,124][0m Trial 239 finished with value: 0.8219945521544665 and parameters: {'n_hidden': 256, 'mixture_components': 5, 'use_sparse_layer': True, 'use_sparse_loss': False, 'use_batchnorm': True, 'use_dropout': True, 'dropout': 0.5041992351657039, 'mlp_size_1': 3, 'mlp_size_2': 1, 'mlp_size_3': 0, 'kernel': 'Exponential', 'loss_name': 'NLLLoss'}. Best is trial 22 with value: 0.8433318468070169.[0m
[32m[I 2022-04-22 01:47:50,888][0m Trial 240 finished with value: 0.8350305682022245 and parameters: {'n_hidden': 512, 'mixture_components': 5, 'use_sparse_layer': True, 'use_sparse_loss': True, 'lmbd': 4.507912012629211e-06, 'use_batchnorm': True, 'use_dropout': True, 'dropout': 0.6468044460559704, 'mlp_size_1': 0, 'mlp_size_2': 6, 'mlp_size_3': 0, 'kernel': 'Exponential', 'loss_name': 'NLLLoss'}. Best is trial 22 with value: 0.8433318468070169.[0m
[32m[I 2022-04-22 01:52:39,792][0m Trial 241 finished with value: 0.8349696590309723 and parameters: {'n_hidden': 512, 'mixture_components': 5, 'use_sparse_layer': True, 'use_sparse_loss': True, 'lmbd': 8.017861614970424e-06, 'use_batchnorm': True, 'use_dropout': True, 'dropout': 0.6413458736446296, 'mlp_size_1': 0, 'mlp_size_2': 6, 'mlp_size_3': 0, 'kernel': 'Exponential', 'loss_name': 'NLLLoss'}. Best is trial 22 with value: 0.8433318468070169.[0m
[32m[I 2022-04-22 01:57:41,580][0m Trial 242 finished with value: 0.8343703877261458 and parameters: {'n_hidden': 512, 'mixture_components': 5, 'use_sparse_layer': True, 'use_sparse_loss': True, 'lmbd': 4.837062646700755e-06, 'use_batchnorm': True, 'use_dropout': True, 'dropout': 0.6342488242586267, 'mlp_size_1': 0, 'mlp_size_2': 6, 'mlp_size_3': 0, 'kernel': 'Exponential', 'loss_name': 'NLLLoss'}. Best is trial 22 with value: 0.8433318468070169.[0m
[32m[I 2022-04-22 02:02:22,550][0m Trial 243 finished with value: 0.8347877412605509 and parameters: {'n_hidden': 512, 'mixture_components': 5, 'use_sparse_layer': True, 'use_sparse_loss': True, 'lmbd': 8.848096107646898e-06, 'use_batchnorm': True, 'use_dropout': True, 'dropout': 0.6632671553121537, 'mlp_size_1': 0, 'mlp_size_2': 6, 'mlp_size_3': 0, 'kernel': 'Exponential', 'loss_name': 'NLLLoss'}. Best is trial 22 with value: 0.8433318468070169.[0m
[32m[I 2022-04-22 02:07:13,941][0m Trial 244 finished with value: 0.8365160214564957 and parameters: {'n_hidden': 512, 'mixture_components': 5, 'use_sparse_layer': True, 'use_sparse_loss': True, 'lmbd': 9.234431846131885e-05, 'use_batchnorm': True, 'use_dropout': True, 'dropout': 0.6088086378406706, 'mlp_size_1': 0, 'mlp_size_2': 6, 'mlp_size_3': 0, 'kernel': 'Exponential', 'loss_name': 'NLLLoss'}. Best is trial 22 with value: 0.8433318468070169.[0m
[32m[I 2022-04-22 02:13:08,399][0m Trial 245 finished with value: 0.715940968250188 and parameters: {'n_hidden': 512, 'mixture_components': 5, 'use_sparse_layer': True, 'use_sparse_loss': True, 'lmbd': 9.325243075739855e-05, 'use_batchnorm': True, 'use_dropout': True, 'dropout': 0.6083849873733649, 'mlp_size_1': 5, 'mlp_size_2': 1, 'mlp_size_3': 0, 'kernel': 'Exponential', 'loss_name': 'NLLLoss'}. Best is trial 22 with value: 0.8433318468070169.[0m
[32m[I 2022-04-22 02:18:25,179][0m Trial 246 finished with value: 0.6177969939462694 and parameters: {'n_hidden': 512, 'mixture_components': 5, 'use_sparse_layer': True, 'use_sparse_loss': True, 'lmbd': 4.641953083033581e-06, 'use_batchnorm': True, 'use_dropout': True, 'dropout': 0.6449382727566352, 'mlp_size_1': 0, 'mlp_size_2': 6, 'mlp_size_3': 0, 'kernel': 'Normal', 'loss_name': 'NLLLoss'}. Best is trial 22 with value: 0.8433318468070169.[0m
[32m[I 2022-04-22 02:23:11,867][0m Trial 247 finished with value: 0.8338688224868026 and parameters: {'n_hidden': 512, 'mixture_components': 5, 'use_sparse_layer': True, 'use_sparse_loss': True, 'lmbd': 6.174777603623228e-05, 'use_batchnorm': True, 'use_dropout': True, 'dropout': 0.6678041939456311, 'mlp_size_1': 0, 'mlp_size_2': 6, 'mlp_size_3': 0, 'kernel': 'Exponential', 'loss_name': 'NLLLoss'}. Best is trial 22 with value: 0.8433318468070169.[0m
[32m[I 2022-04-22 02:25:30,605][0m Trial 248 finished with value: -0.23492513178918933 and parameters: {'n_hidden': 512, 'mixture_components': 5, 'use_sparse_layer': True, 'use_sparse_loss': True, 'lmbd': 3.102544997614918e-06, 'use_batchnorm': True, 'use_dropout': True, 'dropout': 0.7053749870049816, 'mlp_size_1': 0, 'mlp_size_2': 6, 'mlp_size_3': 0, 'kernel': 'Exponential', 'loss_name': 'CensoredNLLLoss'}. Best is trial 22 with value: 0.8433318468070169.[0m
[32m[I 2022-04-22 02:30:50,159][0m Trial 249 finished with value: 0.831216949564211 and parameters: {'n_hidden': 512, 'mixture_components': 5, 'use_sparse_layer': True, 'use_sparse_loss': True, 'lmbd': 0.00028122212925047266, 'use_batchnorm': True, 'use_dropout': True, 'dropout': 0.5931478472146804, 'mlp_size_1': 0, 'mlp_size_2': 6, 'mlp_size_3': 0, 'kernel': 'Exponential', 'loss_name': 'NLLLoss'}. Best is trial 22 with value: 0.8433318468070169.[0m
[32m[I 2022-04-22 02:36:20,290][0m Trial 250 finished with value: 0.8150910412386011 and parameters: {'n_hidden': 512, 'mixture_components': 10, 'use_sparse_layer': True, 'use_sparse_loss': True, 'lmbd': 1.1928268512776914e-05, 'use_batchnorm': True, 'use_dropout': True, 'dropout': 0.6183525386068577, 'mlp_size_1': 0, 'mlp_size_2': 6, 'mlp_size_3': 0, 'kernel': 'Normal', 'loss_name': 'NLLLoss'}. Best is trial 22 with value: 0.8433318468070169.[0m
[32m[I 2022-04-22 02:42:20,520][0m Trial 251 finished with value: 0.8330940169238676 and parameters: {'n_hidden': 512, 'mixture_components': 4, 'use_sparse_layer': True, 'use_sparse_loss': True, 'lmbd': 4.204287205212221e-05, 'use_batchnorm': True, 'use_dropout': True, 'dropout': 0.652792112336547, 'mlp_size_1': 0, 'mlp_size_2': 6, 'mlp_size_3': 0, 'kernel': 'Exponential', 'loss_name': 'NLLLoss'}. Best is trial 22 with value: 0.8433318468070169.[0m
[32m[I 2022-04-22 02:46:51,352][0m Trial 252 finished with value: 0.8326851996765571 and parameters: {'n_hidden': 512, 'mixture_components': 9, 'use_sparse_layer': True, 'use_sparse_loss': True, 'lmbd': 0.0002209272618640033, 'use_batchnorm': True, 'use_dropout': True, 'dropout': 0.5504559336718639, 'mlp_size_1': 0, 'mlp_size_2': 6, 'mlp_size_3': 0, 'kernel': 'Exponential', 'loss_name': 'NLLLoss'}. Best is trial 22 with value: 0.8433318468070169.[0m
[32m[I 2022-04-22 02:51:20,181][0m Trial 253 finished with value: 0.8366226546492499 and parameters: {'n_hidden': 512, 'mixture_components': 5, 'use_sparse_layer': True, 'use_sparse_loss': True, 'lmbd': 8.046270464570767e-06, 'use_batchnorm': True, 'use_dropout': True, 'dropout': 0.6302947611289023, 'mlp_size_1': 0, 'mlp_size_2': 6, 'mlp_size_3': 0, 'kernel': 'Exponential', 'loss_name': 'NLLLoss'}. Best is trial 22 with value: 0.8433318468070169.[0m
[32m[I 2022-04-22 02:57:05,639][0m Trial 254 finished with value: 0.8374807655923098 and parameters: {'n_hidden': 512, 'mixture_components': 5, 'use_sparse_layer': True, 'use_sparse_loss': True, 'lmbd': 5.248889662307298e-06, 'use_batchnorm': True, 'use_dropout': True, 'dropout': 0.6854965045246468, 'mlp_size_1': 0, 'mlp_size_2': 6, 'mlp_size_3': 0, 'kernel': 'LogLogistic', 'loss_name': 'NLLLoss'}. Best is trial 22 with value: 0.8433318468070169.[0m
[32m[I 2022-04-22 03:03:33,683][0m Trial 255 finished with value: 0.7338169617138238 and parameters: {'n_hidden': 512, 'mixture_components': 2, 'use_sparse_layer': True, 'use_sparse_loss': True, 'lmbd': 2.129996086882506e-06, 'use_batchnorm': True, 'use_dropout': True, 'dropout': 0.6843787423295865, 'mlp_size_1': 0, 'mlp_size_2': 6, 'mlp_size_3': 0, 'kernel': 'LogLogistic', 'loss_name': 'CensoredNLLLoss'}. Best is trial 22 with value: 0.8433318468070169.[0m
[32m[I 2022-04-22 03:08:58,792][0m Trial 256 finished with value: 0.8324422721097721 and parameters: {'n_hidden': 512, 'mixture_components': 5, 'use_sparse_layer': True, 'use_sparse_loss': True, 'lmbd': 1.0465531084884234e-05, 'use_batchnorm': True, 'use_dropout': True, 'dropout': 0.618174654875406, 'mlp_size_1': 0, 'mlp_size_2': 6, 'mlp_size_3': 0, 'kernel': 'LogLogistic', 'loss_name': 'NLLLoss'}. Best is trial 22 with value: 0.8433318468070169.[0m
[32m[I 2022-04-22 03:15:29,961][0m Trial 257 finished with value: 0.8299615358581235 and parameters: {'n_hidden': 512, 'mixture_components': 5, 'use_sparse_layer': True, 'use_sparse_loss': True, 'lmbd': 1.0336512578678825e-06, 'use_batchnorm': True, 'use_dropout': True, 'dropout': 0.7171458688364745, 'mlp_size_1': 0, 'mlp_size_2': 6, 'mlp_size_3': 0, 'kernel': 'LogLogistic', 'loss_name': 'NLLLoss'}. Best is trial 22 with value: 0.8433318468070169.[0m
[32m[I 2022-04-22 03:19:21,411][0m Trial 258 finished with value: 0.6190424314923699 and parameters: {'n_hidden': 64, 'mixture_components': 5, 'use_sparse_layer': True, 'use_sparse_loss': True, 'lmbd': 2.366102084502735e-05, 'use_batchnorm': True, 'use_dropout': True, 'dropout': 0.12860254538509086, 'mlp_size_1': 0, 'mlp_size_2': 3, 'mlp_size_3': 0, 'kernel': 'LogLogistic', 'loss_name': 'NLLLoss'}. Best is trial 22 with value: 0.8433318468070169.[0m
[32m[I 2022-04-22 03:25:13,461][0m Trial 259 finished with value: 0.3071538557585106 and parameters: {'n_hidden': 512, 'mixture_components': 5, 'use_sparse_layer': True, 'use_sparse_loss': True, 'lmbd': 4.422175165756253e-06, 'use_batchnorm': True, 'use_dropout': True, 'dropout': 0.6677656154840694, 'mlp_size_1': 5, 'mlp_size_2': 1, 'mlp_size_3': 0, 'kernel': 'LogLogistic', 'loss_name': 'NLLLoss'}. Best is trial 22 with value: 0.8433318468070169.[0m
[32m[I 2022-04-22 03:31:18,077][0m Trial 260 finished with value: 0.8225399875412374 and parameters: {'n_hidden': 512, 'mixture_components': 9, 'use_sparse_layer': True, 'use_sparse_loss': False, 'use_batchnorm': True, 'use_dropout': True, 'dropout': 0.6973742034047292, 'mlp_size_1': 0, 'mlp_size_2': 6, 'mlp_size_3': 0, 'kernel': 'Normal', 'loss_name': 'NLLLoss'}. Best is trial 22 with value: 0.8433318468070169.[0m
[32m[I 2022-04-22 03:33:23,995][0m Trial 261 finished with value: 0.4911310253171858 and parameters: {'n_hidden': 2048, 'mixture_components': 5, 'use_sparse_layer': True, 'use_sparse_loss': False, 'use_batchnorm': False, 'use_dropout': True, 'dropout': 0.4354777125090442, 'mlp_size_1': 4, 'mlp_size_2': 4, 'mlp_size_3': 0, 'kernel': 'Gumbel', 'loss_name': 'CensoredNLLLoss'}. Best is trial 22 with value: 0.8433318468070169.[0m
[32m[I 2022-04-22 03:39:41,806][0m Trial 262 finished with value: 0.5293923138756526 and parameters: {'n_hidden': 512, 'mixture_components': 4, 'use_sparse_layer': True, 'use_sparse_loss': False, 'use_batchnorm': True, 'use_dropout': True, 'dropout': 0.30292828679004596, 'mlp_size_1': 0, 'mlp_size_2': 6, 'mlp_size_3': 0, 'kernel': 'Logistic', 'loss_name': 'AlternativeNLLLoss'}. Best is trial 22 with value: 0.8433318468070169.[0m
