[32m[I 2022-04-21 20:29:19,076][0m Trial 223 finished with value: 0.839843955676538 and parameters: {'n_hidden': 512, 'mixture_components': 5, 'use_sparse_layer': False, 'use_batchnorm': False, 'use_dropout': False, 'mlp_size_1': 6, 'mlp_size_2': 0, 'mlp_size_3': 0, 'kernel': 'Exponential', 'loss_name': 'NLLLoss'}. Best is trial 17 with value: 0.8538600001453517.[0m
[32m[I 2022-04-21 20:31:16,254][0m Trial 224 finished with value: 0.7207499073531272 and parameters: {'n_hidden': 512, 'mixture_components': 5, 'use_sparse_layer': False, 'use_batchnorm': False, 'use_dropout': False, 'mlp_size_1': 6, 'mlp_size_2': 0, 'mlp_size_3': 0, 'kernel': 'LogLogistic', 'loss_name': 'NLLLoss'}. Best is trial 17 with value: 0.8538600001453517.[0m
[32m[I 2022-04-21 20:33:36,062][0m Trial 225 finished with value: 0.8386512303889768 and parameters: {'n_hidden': 512, 'mixture_components': 5, 'use_sparse_layer': False, 'use_batchnorm': False, 'use_dropout': False, 'mlp_size_1': 6, 'mlp_size_2': 0, 'mlp_size_3': 0, 'kernel': 'Normal', 'loss_name': 'NLLLoss'}. Best is trial 17 with value: 0.8538600001453517.[0m
[32m[I 2022-04-21 20:34:56,885][0m Trial 226 finished with value: -0.23510941268075763 and parameters: {'n_hidden': 1024, 'mixture_components': 6, 'use_sparse_layer': False, 'use_batchnorm': False, 'use_dropout': False, 'mlp_size_1': 5, 'mlp_size_2': 1, 'mlp_size_3': 1, 'kernel': 'Exponential', 'loss_name': 'AlternativeNLLLoss'}. Best is trial 17 with value: 0.8538600001453517.[0m
[32m[I 2022-04-21 20:37:27,077][0m Trial 227 finished with value: 0.8350337930940557 and parameters: {'n_hidden': 2048, 'mixture_components': 9, 'use_sparse_layer': True, 'use_sparse_loss': False, 'use_batchnorm': False, 'use_dropout': False, 'mlp_size_1': 7, 'mlp_size_2': 1, 'mlp_size_3': 0, 'kernel': 'LogLogistic', 'loss_name': 'CensoredNLLLoss'}. Best is trial 17 with value: 0.8538600001453517.[0m
[32m[I 2022-04-21 20:39:45,499][0m Trial 228 finished with value: 0.837133859532468 and parameters: {'n_hidden': 512, 'mixture_components': 5, 'use_sparse_layer': False, 'use_batchnorm': False, 'use_dropout': False, 'mlp_size_1': 6, 'mlp_size_2': 0, 'mlp_size_3': 0, 'kernel': 'Normal', 'loss_name': 'AlternativeNLLLoss'}. Best is trial 17 with value: 0.8538600001453517.[0m
[32m[I 2022-04-21 20:41:51,388][0m Trial 229 finished with value: 0.8415437949221085 and parameters: {'n_hidden': 128, 'mixture_components': 3, 'use_sparse_layer': False, 'use_batchnorm': False, 'use_dropout': False, 'mlp_size_1': 4, 'mlp_size_2': 0, 'mlp_size_3': 0, 'kernel': 'LogLogistic', 'loss_name': 'NLLLoss'}. Best is trial 17 with value: 0.8538600001453517.[0m
[32m[I 2022-04-21 20:44:37,253][0m Trial 230 finished with value: 0.7436977201173123 and parameters: {'n_hidden': 512, 'mixture_components': 5, 'use_sparse_layer': False, 'use_batchnorm': False, 'use_dropout': False, 'mlp_size_1': 6, 'mlp_size_2': 0, 'mlp_size_3': 0, 'kernel': 'Normal', 'loss_name': 'AlternativeNLLLoss'}. Best is trial 17 with value: 0.8538600001453517.[0m
[32m[I 2022-04-21 20:46:59,384][0m Trial 231 finished with value: 0.743289325820456 and parameters: {'n_hidden': 512, 'mixture_components': 3, 'use_sparse_layer': False, 'use_batchnorm': False, 'use_dropout': False, 'mlp_size_1': 6, 'mlp_size_2': 0, 'mlp_size_3': 0, 'kernel': 'Logistic', 'loss_name': 'NLLLoss'}. Best is trial 17 with value: 0.8538600001453517.[0m
[32m[I 2022-04-21 20:49:20,685][0m Trial 232 finished with value: 0.7409093682765041 and parameters: {'n_hidden': 512, 'mixture_components': 3, 'use_sparse_layer': False, 'use_batchnorm': False, 'use_dropout': False, 'mlp_size_1': 6, 'mlp_size_2': 0, 'mlp_size_3': 0, 'kernel': 'Logistic', 'loss_name': 'NLLLoss'}. Best is trial 17 with value: 0.8538600001453517.[0m
[32m[I 2022-04-21 20:51:44,451][0m Trial 233 finished with value: 0.7475984760154442 and parameters: {'n_hidden': 512, 'mixture_components': 3, 'use_sparse_layer': False, 'use_batchnorm': False, 'use_dropout': False, 'mlp_size_1': 6, 'mlp_size_2': 0, 'mlp_size_3': 0, 'kernel': 'Logistic', 'loss_name': 'NLLLoss'}. Best is trial 17 with value: 0.8538600001453517.[0m
[32m[I 2022-04-21 20:53:54,160][0m Trial 234 finished with value: 0.8453418492107124 and parameters: {'n_hidden': 512, 'mixture_components': 4, 'use_sparse_layer': False, 'use_batchnorm': False, 'use_dropout': False, 'mlp_size_1': 6, 'mlp_size_2': 0, 'mlp_size_3': 0, 'kernel': 'LogLogistic', 'loss_name': 'NLLLoss'}. Best is trial 17 with value: 0.8538600001453517.[0m
[32m[I 2022-04-21 20:55:43,559][0m Trial 235 finished with value: 0.8429549413209616 and parameters: {'n_hidden': 1024, 'mixture_components': 4, 'use_sparse_layer': False, 'use_batchnorm': False, 'use_dropout': False, 'mlp_size_1': 5, 'mlp_size_2': 1, 'mlp_size_3': 0, 'kernel': 'LogLogistic', 'loss_name': 'NLLLoss'}. Best is trial 17 with value: 0.8538600001453517.[0m
[32m[I 2022-04-21 20:58:06,662][0m Trial 236 finished with value: 0.8409676465671361 and parameters: {'n_hidden': 512, 'mixture_components': 4, 'use_sparse_layer': False, 'use_batchnorm': False, 'use_dropout': False, 'mlp_size_1': 6, 'mlp_size_2': 0, 'mlp_size_3': 0, 'kernel': 'LogLogistic', 'loss_name': 'NLLLoss'}. Best is trial 17 with value: 0.8538600001453517.[0m
[32m[I 2022-04-21 21:00:47,078][0m Trial 237 finished with value: 0.8110623275667619 and parameters: {'n_hidden': 2048, 'mixture_components': 4, 'use_sparse_layer': True, 'use_sparse_loss': False, 'use_batchnorm': False, 'use_dropout': False, 'mlp_size_1': 8, 'mlp_size_2': 0, 'mlp_size_3': 0, 'kernel': 'LogLogistic', 'loss_name': 'AlternativeNLLLoss'}. Best is trial 17 with value: 0.8538600001453517.[0m
[32m[I 2022-04-21 21:02:45,828][0m Trial 238 finished with value: 0.8482184409001723 and parameters: {'n_hidden': 512, 'mixture_components': 4, 'use_sparse_layer': False, 'use_batchnorm': False, 'use_dropout': False, 'mlp_size_1': 6, 'mlp_size_2': 0, 'mlp_size_3': 0, 'kernel': 'LogLogistic', 'loss_name': 'NLLLoss'}. Best is trial 17 with value: 0.8538600001453517.[0m
[32m[I 2022-04-21 21:05:38,898][0m Trial 239 finished with value: 0.8373486617703157 and parameters: {'n_hidden': 512, 'mixture_components': 4, 'use_sparse_layer': False, 'use_batchnorm': False, 'use_dropout': False, 'mlp_size_1': 6, 'mlp_size_2': 0, 'mlp_size_3': 0, 'kernel': 'LogLogistic', 'loss_name': 'NLLLoss'}. Best is trial 17 with value: 0.8538600001453517.[0m
[32m[I 2022-04-21 21:09:07,457][0m Trial 240 finished with value: 0.8368662241886187 and parameters: {'n_hidden': 32, 'mixture_components': 4, 'use_sparse_layer': False, 'use_batchnorm': False, 'use_dropout': True, 'dropout': 0.13754349120700204, 'mlp_size_1': 2, 'mlp_size_2': 0, 'mlp_size_3': 0, 'kernel': 'LogLogistic', 'loss_name': 'AlternativeNLLLoss'}. Best is trial 17 with value: 0.8538600001453517.[0m
[32m[I 2022-04-21 21:11:52,551][0m Trial 241 finished with value: 0.8311311987307267 and parameters: {'n_hidden': 512, 'mixture_components': 4, 'use_sparse_layer': False, 'use_batchnorm': False, 'use_dropout': False, 'mlp_size_1': 6, 'mlp_size_2': 0, 'mlp_size_3': 0, 'kernel': 'LogLogistic', 'loss_name': 'NLLLoss'}. Best is trial 17 with value: 0.8538600001453517.[0m
[32m[I 2022-04-21 21:13:44,427][0m Trial 242 finished with value: 0.7374908459685579 and parameters: {'n_hidden': 512, 'mixture_components': 4, 'use_sparse_layer': False, 'use_batchnorm': False, 'use_dropout': False, 'mlp_size_1': 6, 'mlp_size_2': 0, 'mlp_size_3': 0, 'kernel': 'LogLogistic', 'loss_name': 'NLLLoss'}. Best is trial 17 with value: 0.8538600001453517.[0m
[32m[I 2022-04-21 21:15:17,429][0m Trial 243 finished with value: 0.8388997362243987 and parameters: {'n_hidden': 512, 'mixture_components': 4, 'use_sparse_layer': False, 'use_batchnorm': False, 'use_dropout': False, 'mlp_size_1': 6, 'mlp_size_2': 0, 'mlp_size_3': 0, 'kernel': 'LogLogistic', 'loss_name': 'NLLLoss'}. Best is trial 17 with value: 0.8538600001453517.[0m
[32m[I 2022-04-21 21:16:53,256][0m Trial 244 finished with value: 0.8347179208467219 and parameters: {'n_hidden': 512, 'mixture_components': 5, 'use_sparse_layer': False, 'use_batchnorm': False, 'use_dropout': False, 'mlp_size_1': 6, 'mlp_size_2': 0, 'mlp_size_3': 0, 'kernel': 'LogLogistic', 'loss_name': 'NLLLoss'}. Best is trial 17 with value: 0.8538600001453517.[0m
[32m[I 2022-04-21 21:19:26,571][0m Trial 245 finished with value: 0.8360530426389261 and parameters: {'n_hidden': 1024, 'mixture_components': 6, 'use_sparse_layer': False, 'use_batchnorm': False, 'use_dropout': False, 'mlp_size_1': 5, 'mlp_size_2': 1, 'mlp_size_3': 1, 'kernel': 'Normal', 'loss_name': 'NLLLoss'}. Best is trial 17 with value: 0.8538600001453517.[0m
[32m[I 2022-04-21 21:21:49,795][0m Trial 246 finished with value: 0.8457221839537746 and parameters: {'n_hidden': 512, 'mixture_components': 4, 'use_sparse_layer': False, 'use_batchnorm': False, 'use_dropout': False, 'mlp_size_1': 6, 'mlp_size_2': 0, 'mlp_size_3': 0, 'kernel': 'LogLogistic', 'loss_name': 'CensoredNLLLoss'}. Best is trial 17 with value: 0.8538600001453517.[0m
[32m[I 2022-04-21 21:24:05,595][0m Trial 247 finished with value: 0.8365712135356104 and parameters: {'n_hidden': 512, 'mixture_components': 4, 'use_sparse_layer': False, 'use_batchnorm': False, 'use_dropout': False, 'mlp_size_1': 6, 'mlp_size_2': 0, 'mlp_size_3': 0, 'kernel': 'LogLogistic', 'loss_name': 'CensoredNLLLoss'}. Best is trial 17 with value: 0.8538600001453517.[0m
[32m[I 2022-04-21 21:26:23,249][0m Trial 248 finished with value: 0.837208897569052 and parameters: {'n_hidden': 2048, 'mixture_components': 4, 'use_sparse_layer': True, 'use_sparse_loss': True, 'lmbd': 0.00022097643758063748, 'use_batchnorm': False, 'use_dropout': False, 'mlp_size_1': 7, 'mlp_size_2': 1, 'mlp_size_3': 0, 'kernel': 'LogLogistic', 'loss_name': 'CensoredNLLLoss'}. Best is trial 17 with value: 0.8538600001453517.[0m
[32m[I 2022-04-21 21:28:32,440][0m Trial 249 finished with value: 0.8253843663680145 and parameters: {'n_hidden': 512, 'mixture_components': 4, 'use_sparse_layer': False, 'use_batchnorm': False, 'use_dropout': False, 'mlp_size_1': 6, 'mlp_size_2': 0, 'mlp_size_3': 0, 'kernel': 'LogLogistic', 'loss_name': 'CensoredNLLLoss'}. Best is trial 17 with value: 0.8538600001453517.[0m
[32m[I 2022-04-21 21:31:08,977][0m Trial 250 finished with value: 0.8436224946532288 and parameters: {'n_hidden': 64, 'mixture_components': 4, 'use_sparse_layer': False, 'use_batchnorm': False, 'use_dropout': False, 'mlp_size_1': 3, 'mlp_size_2': 0, 'mlp_size_3': 0, 'kernel': 'LogLogistic', 'loss_name': 'CensoredNLLLoss'}. Best is trial 17 with value: 0.8538600001453517.[0m
[32m[I 2022-04-21 21:35:21,281][0m Trial 251 finished with value: 0.5200247453664004 and parameters: {'n_hidden': 1024, 'mixture_components': 4, 'use_sparse_layer': False, 'use_batchnorm': True, 'use_dropout': False, 'mlp_size_1': 5, 'mlp_size_2': 2, 'mlp_size_3': 0, 'kernel': 'Gumbel', 'loss_name': 'CensoredNLLLoss'}. Best is trial 17 with value: 0.8538600001453517.[0m
[32m[I 2022-04-21 21:37:46,858][0m Trial 252 finished with value: 0.8351207153339658 and parameters: {'n_hidden': 512, 'mixture_components': 8, 'use_sparse_layer': True, 'use_sparse_loss': False, 'use_batchnorm': False, 'use_dropout': False, 'mlp_size_1': 6, 'mlp_size_2': 0, 'mlp_size_3': 0, 'kernel': 'Normal', 'loss_name': 'AlternativeNLLLoss'}. Best is trial 17 with value: 0.8538600001453517.[0m
[32m[I 2022-04-21 21:39:53,966][0m Trial 253 finished with value: 0.8440511917694729 and parameters: {'n_hidden': 2048, 'mixture_components': 4, 'use_sparse_layer': False, 'use_batchnorm': False, 'use_dropout': False, 'mlp_size_1': 7, 'mlp_size_2': 1, 'mlp_size_3': 0, 'kernel': 'LogLogistic', 'loss_name': 'AlternativeNLLLoss'}. Best is trial 17 with value: 0.8538600001453517.[0m
[32m[I 2022-04-21 21:42:52,637][0m Trial 254 finished with value: 0.8418072142704778 and parameters: {'n_hidden': 512, 'mixture_components': 7, 'use_sparse_layer': False, 'use_batchnorm': False, 'use_dropout': False, 'mlp_size_1': 6, 'mlp_size_2': 0, 'mlp_size_3': 0, 'kernel': 'Normal', 'loss_name': 'AlternativeNLLLoss'}. Best is trial 17 with value: 0.8538600001453517.[0m
[32m[I 2022-04-21 21:44:42,776][0m Trial 255 finished with value: 0.8407656555993832 and parameters: {'n_hidden': 256, 'mixture_components': 4, 'use_sparse_layer': False, 'use_batchnorm': False, 'use_dropout': False, 'mlp_size_1': 5, 'mlp_size_2': 0, 'mlp_size_3': 0, 'kernel': 'LogLogistic', 'loss_name': 'CensoredNLLLoss'}. Best is trial 17 with value: 0.8538600001453517.[0m
[32m[I 2022-04-21 21:46:52,100][0m Trial 256 finished with value: 0.8376459478351486 and parameters: {'n_hidden': 1024, 'mixture_components': 3, 'use_sparse_layer': False, 'use_batchnorm': False, 'use_dropout': False, 'mlp_size_1': 5, 'mlp_size_2': 1, 'mlp_size_3': 1, 'kernel': 'Normal', 'loss_name': 'AlternativeNLLLoss'}. Best is trial 17 with value: 0.8538600001453517.[0m
[32m[I 2022-04-21 21:48:58,856][0m Trial 257 finished with value: 0.8398828168214919 and parameters: {'n_hidden': 512, 'mixture_components': 4, 'use_sparse_layer': True, 'use_sparse_loss': False, 'use_batchnorm': False, 'use_dropout': False, 'mlp_size_1': 6, 'mlp_size_2': 0, 'mlp_size_3': 0, 'kernel': 'LogLogistic', 'loss_name': 'AlternativeNLLLoss'}. Best is trial 17 with value: 0.8538600001453517.[0m
[32m[I 2022-04-21 21:51:21,623][0m Trial 258 finished with value: 0.8405406397076705 and parameters: {'n_hidden': 2048, 'mixture_components': 6, 'use_sparse_layer': False, 'use_batchnorm': False, 'use_dropout': False, 'mlp_size_1': 7, 'mlp_size_2': 1, 'mlp_size_3': 0, 'kernel': 'Normal', 'loss_name': 'AlternativeNLLLoss'}. Best is trial 17 with value: 0.8538600001453517.[0m
[32m[I 2022-04-21 21:53:03,531][0m Trial 259 finished with value: 0.8390611885421004 and parameters: {'n_hidden': 512, 'mixture_components': 5, 'use_sparse_layer': False, 'use_batchnorm': False, 'use_dropout': False, 'mlp_size_1': 6, 'mlp_size_2': 0, 'mlp_size_3': 0, 'kernel': 'LogLogistic', 'loss_name': 'CensoredNLLLoss'}. Best is trial 17 with value: 0.8538600001453517.[0m
[32m[I 2022-04-21 21:55:04,754][0m Trial 260 finished with value: 0.8434918751514043 and parameters: {'n_hidden': 512, 'mixture_components': 9, 'use_sparse_layer': False, 'use_batchnorm': False, 'use_dropout': False, 'mlp_size_1': 6, 'mlp_size_2': 0, 'mlp_size_3': 0, 'kernel': 'Normal', 'loss_name': 'NLLLoss'}. Best is trial 17 with value: 0.8538600001453517.[0m
[32m[I 2022-04-21 21:56:54,118][0m Trial 261 finished with value: 0.8416053226671238 and parameters: {'n_hidden': 2048, 'mixture_components': 3, 'use_sparse_layer': False, 'use_batchnorm': False, 'use_dropout': False, 'mlp_size_1': 7, 'mlp_size_2': 1, 'mlp_size_3': 0, 'kernel': 'LogLogistic', 'loss_name': 'AlternativeNLLLoss'}. Best is trial 17 with value: 0.8538600001453517.[0m
[32m[I 2022-04-21 21:58:29,459][0m Trial 262 finished with value: 0.8400663903660167 and parameters: {'n_hidden': 1024, 'mixture_components': 5, 'use_sparse_layer': True, 'use_sparse_loss': False, 'use_batchnorm': False, 'use_dropout': False, 'mlp_size_1': 3, 'mlp_size_2': 3, 'mlp_size_3': 1, 'kernel': 'Normal', 'loss_name': 'NLLLoss'}. Best is trial 17 with value: 0.8538600001453517.[0m
[32m[I 2022-04-21 22:00:02,810][0m Trial 263 finished with value: 0.8428276463056941 and parameters: {'n_hidden': 512, 'mixture_components': 4, 'use_sparse_layer': False, 'use_batchnorm': False, 'use_dropout': False, 'mlp_size_1': 6, 'mlp_size_2': 0, 'mlp_size_3': 0, 'kernel': 'LogLogistic', 'loss_name': 'AlternativeNLLLoss'}. Best is trial 17 with value: 0.8538600001453517.[0m
[32m[I 2022-04-21 22:02:08,914][0m Trial 264 finished with value: 0.4375860929922328 and parameters: {'n_hidden': 512, 'mixture_components': 4, 'use_sparse_layer': False, 'use_batchnorm': False, 'use_dropout': True, 'dropout': 0.7362001052966465, 'mlp_size_1': 6, 'mlp_size_2': 0, 'mlp_size_3': 0, 'kernel': 'Normal', 'loss_name': 'NLLLoss'}. Best is trial 17 with value: 0.8538600001453517.[0m
[32m[I 2022-04-21 22:05:24,093][0m Trial 265 finished with value: 0.8427006143936506 and parameters: {'n_hidden': 2048, 'mixture_components': 5, 'use_sparse_layer': False, 'use_batchnorm': False, 'use_dropout': False, 'mlp_size_1': 8, 'mlp_size_2': 0, 'mlp_size_3': 0, 'kernel': 'LogLogistic', 'loss_name': 'AlternativeNLLLoss'}. Best is trial 17 with value: 0.8538600001453517.[0m
[32m[I 2022-04-21 22:06:47,809][0m Trial 266 finished with value: 0.7216473591269568 and parameters: {'n_hidden': 1024, 'mixture_components': 2, 'use_sparse_layer': False, 'use_batchnorm': False, 'use_dropout': False, 'mlp_size_1': 5, 'mlp_size_2': 1, 'mlp_size_3': 1, 'kernel': 'Normal', 'loss_name': 'NLLLoss'}. Best is trial 17 with value: 0.8538600001453517.[0m
[32m[I 2022-04-21 22:08:27,332][0m Trial 267 finished with value: 0.8332829360073385 and parameters: {'n_hidden': 512, 'mixture_components': 6, 'use_sparse_layer': True, 'use_sparse_loss': False, 'use_batchnorm': False, 'use_dropout': False, 'mlp_size_1': 6, 'mlp_size_2': 0, 'mlp_size_3': 0, 'kernel': 'LogLogistic', 'loss_name': 'CensoredNLLLoss'}. Best is trial 17 with value: 0.8538600001453517.[0m
[32m[I 2022-04-21 22:11:08,939][0m Trial 268 finished with value: 0.8282391857538387 and parameters: {'n_hidden': 128, 'mixture_components': 4, 'use_sparse_layer': False, 'use_batchnorm': False, 'use_dropout': False, 'mlp_size_1': 4, 'mlp_size_2': 0, 'mlp_size_3': 0, 'kernel': 'Normal', 'loss_name': 'AlternativeNLLLoss'}. Best is trial 17 with value: 0.8538600001453517.[0m
[32m[I 2022-04-21 22:15:32,942][0m Trial 269 finished with value: 0.7297420503042076 and parameters: {'n_hidden': 512, 'mixture_components': 3, 'use_sparse_layer': False, 'use_batchnorm': True, 'use_dropout': False, 'mlp_size_1': 6, 'mlp_size_2': 0, 'mlp_size_3': 0, 'kernel': 'LogLogistic', 'loss_name': 'NLLLoss'}. Best is trial 17 with value: 0.8538600001453517.[0m
[32m[I 2022-04-21 22:18:07,045][0m Trial 270 finished with value: 0.8428465133102016 and parameters: {'n_hidden': 2048, 'mixture_components': 5, 'use_sparse_layer': False, 'use_batchnorm': False, 'use_dropout': False, 'mlp_size_1': 8, 'mlp_size_2': 0, 'mlp_size_3': 0, 'kernel': 'Normal', 'loss_name': 'AlternativeNLLLoss'}. Best is trial 17 with value: 0.8538600001453517.[0m
[32m[I 2022-04-21 22:19:49,483][0m Trial 271 finished with value: 0.8437573009818546 and parameters: {'n_hidden': 512, 'mixture_components': 9, 'use_sparse_layer': False, 'use_batchnorm': False, 'use_dropout': False, 'mlp_size_1': 6, 'mlp_size_2': 0, 'mlp_size_3': 0, 'kernel': 'LogLogistic', 'loss_name': 'NLLLoss'}. Best is trial 17 with value: 0.8538600001453517.[0m
[32m[I 2022-04-21 22:21:24,009][0m Trial 272 finished with value: 0.8358183795719238 and parameters: {'n_hidden': 1024, 'mixture_components': 5, 'use_sparse_layer': False, 'use_batchnorm': False, 'use_dropout': False, 'mlp_size_1': 3, 'mlp_size_2': 2, 'mlp_size_3': 0, 'kernel': 'Normal', 'loss_name': 'AlternativeNLLLoss'}. Best is trial 17 with value: 0.8538600001453517.[0m
[32m[I 2022-04-21 22:24:02,188][0m Trial 273 finished with value: 0.7350688965550874 and parameters: {'n_hidden': 32, 'mixture_components': 4, 'use_sparse_layer': True, 'use_sparse_loss': True, 'lmbd': 1.3596665882457006e-06, 'use_batchnorm': False, 'use_dropout': False, 'mlp_size_1': 2, 'mlp_size_2': 0, 'mlp_size_3': 0, 'kernel': 'LogLogistic', 'loss_name': 'NLLLoss'}. Best is trial 17 with value: 0.8538600001453517.[0m
[32m[I 2022-04-21 22:26:23,545][0m Trial 274 finished with value: 0.8353277179327122 and parameters: {'n_hidden': 512, 'mixture_components': 6, 'use_sparse_layer': False, 'use_batchnorm': False, 'use_dropout': False, 'mlp_size_1': 6, 'mlp_size_2': 0, 'mlp_size_3': 0, 'kernel': 'Normal', 'loss_name': 'CensoredNLLLoss'}. Best is trial 17 with value: 0.8538600001453517.[0m
[32m[I 2022-04-21 22:28:47,357][0m Trial 275 finished with value: 0.8347450250281746 and parameters: {'n_hidden': 2048, 'mixture_components': 5, 'use_sparse_layer': False, 'use_batchnorm': False, 'use_dropout': False, 'mlp_size_1': 7, 'mlp_size_2': 1, 'mlp_size_3': 0, 'kernel': 'LogLogistic', 'loss_name': 'AlternativeNLLLoss'}. Best is trial 17 with value: 0.8538600001453517.[0m
[32m[I 2022-04-21 22:30:32,004][0m Trial 276 finished with value: 0.7394671827209743 and parameters: {'n_hidden': 512, 'mixture_components': 3, 'use_sparse_layer': False, 'use_batchnorm': False, 'use_dropout': False, 'mlp_size_1': 6, 'mlp_size_2': 0, 'mlp_size_3': 0, 'kernel': 'Gumbel', 'loss_name': 'NLLLoss'}. Best is trial 17 with value: 0.8538600001453517.[0m
[32m[I 2022-04-21 22:32:47,579][0m Trial 277 finished with value: 0.8423299437597015 and parameters: {'n_hidden': 1024, 'mixture_components': 7, 'use_sparse_layer': False, 'use_batchnorm': False, 'use_dropout': False, 'mlp_size_1': 5, 'mlp_size_2': 1, 'mlp_size_3': 1, 'kernel': 'Normal', 'loss_name': 'AlternativeNLLLoss'}. Best is trial 17 with value: 0.8538600001453517.[0m
[32m[I 2022-04-21 22:34:57,410][0m Trial 278 finished with value: 0.8344386047716135 and parameters: {'n_hidden': 64, 'mixture_components': 10, 'use_sparse_layer': True, 'use_sparse_loss': False, 'use_batchnorm': False, 'use_dropout': False, 'mlp_size_1': 3, 'mlp_size_2': 0, 'mlp_size_3': 0, 'kernel': 'LogLogistic', 'loss_name': 'NLLLoss'}. Best is trial 17 with value: 0.8538600001453517.[0m
[32m[I 2022-04-21 22:37:51,174][0m Trial 279 finished with value: 0.8405279628144389 and parameters: {'n_hidden': 512, 'mixture_components': 4, 'use_sparse_layer': False, 'use_batchnorm': False, 'use_dropout': False, 'mlp_size_1': 6, 'mlp_size_2': 0, 'mlp_size_3': 0, 'kernel': 'Normal', 'loss_name': 'AlternativeNLLLoss'}. Best is trial 17 with value: 0.8538600001453517.[0m
