[32m[I 2022-04-21 11:51:13,057][0m Trial 840 finished with value: 0.5415004343670349 and parameters: {'splitter': 'best', 'min_samples_split': 0.0617887111352874, 'min_samples_leaf': 0.3123688108071551, 'min_weight_fraction_leaf': 0.03152476212917513, 'max_features': 0.794246195069119}. Best is trial 688 with value: 0.6612018755665507.[0m
[32m[I 2022-04-21 11:51:13,726][0m Trial 841 finished with value: 0.6451554278020452 and parameters: {'splitter': 'best', 'min_samples_split': 0.08877189605505854, 'min_samples_leaf': 0.0169496434424488, 'min_weight_fraction_leaf': 0.009049065505109206, 'max_features': 0.834889031600043}. Best is trial 688 with value: 0.6612018755665507.[0m
[32m[I 2022-04-21 11:51:14,453][0m Trial 842 finished with value: 0.6347059769425569 and parameters: {'splitter': 'best', 'min_samples_split': 0.13179625031906772, 'min_samples_leaf': 0.0016047034768999538, 'min_weight_fraction_leaf': 0.024050888198434123, 'max_features': 0.8034701725524436}. Best is trial 688 with value: 0.6612018755665507.[0m
[32m[I 2022-04-21 11:51:14,601][0m Trial 843 finished with value: 0.5192071084029 and parameters: {'splitter': 'best', 'min_samples_split': 0.10263727418039692, 'min_samples_leaf': 0.02662638073787585, 'min_weight_fraction_leaf': 0.38843558946196, 'max_features': 0.8423012980209952}. Best is trial 688 with value: 0.6612018755665507.[0m
[32m[I 2022-04-21 11:51:15,128][0m Trial 844 finished with value: 0.6021076969242027 and parameters: {'splitter': 'best', 'min_samples_split': 0.12097907446707307, 'min_samples_leaf': 0.0011287579887500107, 'min_weight_fraction_leaf': 0.1304782054453734, 'max_features': 0.7769664013072769}. Best is trial 688 with value: 0.6612018755665507.[0m
[32m[I 2022-04-21 11:51:15,875][0m Trial 845 finished with value: 0.643532875934488 and parameters: {'splitter': 'best', 'min_samples_split': 0.11191695348572833, 'min_samples_leaf': 0.01765812853293594, 'min_weight_fraction_leaf': 0.01458111676908968, 'max_features': 0.8648818032036667}. Best is trial 688 with value: 0.6612018755665507.[0m
[32m[I 2022-04-21 11:51:16,488][0m Trial 846 finished with value: 0.6245429793205581 and parameters: {'splitter': 'best', 'min_samples_split': 0.13683407275034112, 'min_samples_leaf': 0.03887321291235422, 'min_weight_fraction_leaf': 0.008695577543754768, 'max_features': 0.8153595856886721}. Best is trial 688 with value: 0.6612018755665507.[0m
[32m[I 2022-04-21 11:51:16,756][0m Trial 847 finished with value: 0.5992839839146578 and parameters: {'splitter': 'best', 'min_samples_split': 0.07152478640232521, 'min_samples_leaf': 0.05445175841625334, 'min_weight_fraction_leaf': 0.025508789899365312, 'max_features': 0.7715406753473182}. Best is trial 688 with value: 0.6612018755665507.[0m
[32m[I 2022-04-21 11:51:17,753][0m Trial 848 finished with value: 0.6418472603381595 and parameters: {'splitter': 'best', 'min_samples_split': 0.12465366660882218, 'min_samples_leaf': 0.009806681847775863, 'min_weight_fraction_leaf': 0.0002834874980685437, 'max_features': 0.7998172080227643}. Best is trial 688 with value: 0.6612018755665507.[0m
[32m[I 2022-04-21 11:51:17,971][0m Trial 849 finished with value: 0.5368679149266262 and parameters: {'splitter': 'best', 'min_samples_split': 0.09998151566068644, 'min_samples_leaf': 0.025386700492296008, 'min_weight_fraction_leaf': 0.24707097393250593, 'max_features': 0.8522204100330641}. Best is trial 688 with value: 0.6612018755665507.[0m
[32m[I 2022-04-21 11:51:18,518][0m Trial 850 finished with value: 0.6355595418210056 and parameters: {'splitter': 'best', 'min_samples_split': 0.3616666123760623, 'min_samples_leaf': 0.010086387465534419, 'min_weight_fraction_leaf': 0.017089056850384338, 'max_features': 0.8851252898319759}. Best is trial 688 with value: 0.6612018755665507.[0m
[32m[I 2022-04-21 11:51:19,150][0m Trial 851 finished with value: 0.6260049840859236 and parameters: {'splitter': 'best', 'min_samples_split': 0.1160820289361963, 'min_samples_leaf': 0.0012091942246040335, 'min_weight_fraction_leaf': 0.03779296171718604, 'max_features': 0.8300090812766191}. Best is trial 688 with value: 0.6612018755665507.[0m
[32m[I 2022-04-21 11:51:19,645][0m Trial 852 finished with value: 0.6151622080340123 and parameters: {'splitter': 'best', 'min_samples_split': 0.1391584030754239, 'min_samples_leaf': 0.03265834403494559, 'min_weight_fraction_leaf': 0.00026076972006320795, 'max_features': 0.7898259637403828}. Best is trial 688 with value: 0.6612018755665507.[0m
[32m[I 2022-04-21 11:51:20,155][0m Trial 853 finished with value: 0.6024554347420921 and parameters: {'splitter': 'best', 'min_samples_split': 0.45891739993551584, 'min_samples_leaf': 0.01780243820380205, 'min_weight_fraction_leaf': 0.028185957556516636, 'max_features': 0.5570336863646567}. Best is trial 688 with value: 0.6612018755665507.[0m
[32m[I 2022-04-21 11:51:21,018][0m Trial 854 finished with value: 0.6314742407672063 and parameters: {'splitter': 'best', 'min_samples_split': 0.10779574612030281, 'min_samples_leaf': 0.019041568384673, 'min_weight_fraction_leaf': 0.010236463523364986, 'max_features': 0.8229100374713078}. Best is trial 688 with value: 0.6612018755665507.[0m
[32m[I 2022-04-21 11:51:21,595][0m Trial 855 finished with value: 0.6364760096342171 and parameters: {'splitter': 'best', 'min_samples_split': 0.12963591496604515, 'min_samples_leaf': 0.0012014325073859886, 'min_weight_fraction_leaf': 0.01669599306640262, 'max_features': 0.5376474848332975}. Best is trial 688 with value: 0.6612018755665507.[0m
[32m[I 2022-04-21 11:51:21,728][0m Trial 856 finished with value: 0.6171863044381742 and parameters: {'splitter': 'random', 'min_samples_split': 0.08803670639060089, 'min_samples_leaf': 0.02758574391154893, 'min_weight_fraction_leaf': 0.009145477529996976, 'max_features': 0.8127620681409565}. Best is trial 688 with value: 0.6612018755665507.[0m
[32m[I 2022-04-21 11:51:21,867][0m Trial 857 finished with value: 0.5712315500243037 and parameters: {'splitter': 'best', 'min_samples_split': 0.11906911435228032, 'min_samples_leaf': 0.1971764613298853, 'min_weight_fraction_leaf': 0.023999927979598955, 'max_features': 0.5724481087641031}. Best is trial 688 with value: 0.6612018755665507.[0m
[32m[I 2022-04-21 11:51:22,591][0m Trial 858 finished with value: 0.6398604062622232 and parameters: {'splitter': 'best', 'min_samples_split': 0.09943879141525686, 'min_samples_leaf': 0.013282097819892282, 'min_weight_fraction_leaf': 0.0004978918437088149, 'max_features': 0.7753166686465105}. Best is trial 688 with value: 0.6612018755665507.[0m
[32m[I 2022-04-21 11:51:23,226][0m Trial 859 finished with value: 0.6466536038095437 and parameters: {'splitter': 'best', 'min_samples_split': 0.07922304261949738, 'min_samples_leaf': 0.009518949854266441, 'min_weight_fraction_leaf': 0.03045047592772294, 'max_features': 0.7993064050911133}. Best is trial 688 with value: 0.6612018755665507.[0m
[32m[I 2022-04-21 11:51:23,735][0m Trial 860 finished with value: 0.6180667500229832 and parameters: {'splitter': 'best', 'min_samples_split': 0.14491853708714597, 'min_samples_leaf': 0.03978152016393789, 'min_weight_fraction_leaf': 0.016624200507241907, 'max_features': 0.7693578156850598}. Best is trial 688 with value: 0.6612018755665507.[0m
[32m[I 2022-04-21 11:51:24,216][0m Trial 861 finished with value: 0.5943706445761483 and parameters: {'splitter': 'best', 'min_samples_split': 0.12484468921049438, 'min_samples_leaf': 0.023816065630858373, 'min_weight_fraction_leaf': 0.0003712045951251977, 'max_features': 0.33576082387696915}. Best is trial 688 with value: 0.6612018755665507.[0m
[32m[I 2022-04-21 11:51:24,668][0m Trial 862 finished with value: 0.6199513518962129 and parameters: {'splitter': 'best', 'min_samples_split': 0.09325184932323329, 'min_samples_leaf': 0.08897463950749811, 'min_weight_fraction_leaf': 0.04281152182440551, 'max_features': 0.8394913032542218}. Best is trial 688 with value: 0.6612018755665507.[0m
[32m[I 2022-04-21 11:51:25,419][0m Trial 863 finished with value: 0.6336553356793638 and parameters: {'splitter': 'best', 'min_samples_split': 0.11060027096127527, 'min_samples_leaf': 0.016753342807953524, 'min_weight_fraction_leaf': 0.015672096449780553, 'max_features': 0.8611566581281251}. Best is trial 688 with value: 0.6612018755665507.[0m
[32m[I 2022-04-21 11:51:26,006][0m Trial 864 finished with value: 0.6391647404537902 and parameters: {'splitter': 'best', 'min_samples_split': 0.13005579041313564, 'min_samples_leaf': 0.009928078479926938, 'min_weight_fraction_leaf': 0.00928328806120939, 'max_features': 0.5925532745409297}. Best is trial 688 with value: 0.6612018755665507.[0m
[32m[I 2022-04-21 11:51:26,383][0m Trial 865 finished with value: 0.6219785019051542 and parameters: {'splitter': 'best', 'min_samples_split': 0.1396875415035959, 'min_samples_leaf': 0.033087025587385854, 'min_weight_fraction_leaf': 0.02470796857991251, 'max_features': 0.8107407509184044}. Best is trial 688 with value: 0.6612018755665507.[0m
[32m[I 2022-04-21 11:51:26,990][0m Trial 866 finished with value: 0.6005986323929283 and parameters: {'splitter': 'best', 'min_samples_split': 0.11539682541792298, 'min_samples_leaf': 0.022758173165360815, 'min_weight_fraction_leaf': 0.03512712184103427, 'max_features': 0.7851405782796231}. Best is trial 688 with value: 0.6612018755665507.[0m
[32m[I 2022-04-21 11:51:27,412][0m Trial 867 finished with value: 0.6152759774147899 and parameters: {'splitter': 'best', 'min_samples_split': 0.10330617309929693, 'min_samples_leaf': 0.010156692981366839, 'min_weight_fraction_leaf': 0.009232048787885147, 'max_features': 0.21767959514852192}. Best is trial 688 with value: 0.6612018755665507.[0m
[32m[I 2022-04-21 11:51:27,890][0m Trial 868 finished with value: 0.6364410201284816 and parameters: {'splitter': 'best', 'min_samples_split': 0.08827788912284958, 'min_samples_leaf': 0.0011538977847643846, 'min_weight_fraction_leaf': 0.019540763490573394, 'max_features': 0.5156405927223504}. Best is trial 688 with value: 0.6612018755665507.[0m
[32m[I 2022-04-21 11:51:28,227][0m Trial 869 finished with value: 0.6162473590654353 and parameters: {'splitter': 'best', 'min_samples_split': 0.13395926442533412, 'min_samples_leaf': 0.04792822499627409, 'min_weight_fraction_leaf': 0.008167972849414427, 'max_features': 0.829462889929086}. Best is trial 688 with value: 0.6612018755665507.[0m
[32m[I 2022-04-21 11:51:28,633][0m Trial 870 finished with value: 0.630421096377787 and parameters: {'splitter': 'best', 'min_samples_split': 0.1476615116015472, 'min_samples_leaf': 0.0011354461694296223, 'min_weight_fraction_leaf': 0.02414470274955833, 'max_features': 0.5716163393510523}. Best is trial 688 with value: 0.6612018755665507.[0m
[32m[I 2022-04-21 11:51:28,706][0m Trial 871 finished with value: 0.5421960700702187 and parameters: {'splitter': 'best', 'min_samples_split': 0.11572256810056133, 'min_samples_leaf': 0.339069706734212, 'min_weight_fraction_leaf': 0.0004789953354637359, 'max_features': 0.7611997582889888}. Best is trial 688 with value: 0.6612018755665507.[0m
[32m[I 2022-04-21 11:51:29,099][0m Trial 872 finished with value: 0.6334616589014601 and parameters: {'splitter': 'best', 'min_samples_split': 0.1267603330778926, 'min_samples_leaf': 0.018410094531210435, 'min_weight_fraction_leaf': 0.01662672776051686, 'max_features': 0.615817187124124}. Best is trial 688 with value: 0.6612018755665507.[0m
[32m[I 2022-04-21 11:51:29,447][0m Trial 873 finished with value: 0.6099134885652864 and parameters: {'splitter': 'best', 'min_samples_split': 0.10480068569941786, 'min_samples_leaf': 0.02989075165030785, 'min_weight_fraction_leaf': 0.049391999716423426, 'max_features': 0.7959013080934971}. Best is trial 688 with value: 0.6612018755665507.[0m
[32m[I 2022-04-21 11:51:30,060][0m Trial 874 finished with value: 0.6233962599591458 and parameters: {'splitter': 'best', 'min_samples_split': 0.07608688787908817, 'min_samples_leaf': 0.015103229408835921, 'min_weight_fraction_leaf': 0.032597907167293626, 'max_features': 0.848916462694164}. Best is trial 688 with value: 0.6612018755665507.[0m
[32m[I 2022-04-21 11:51:30,233][0m Trial 875 finished with value: 0.6375071252643514 and parameters: {'splitter': 'random', 'min_samples_split': 0.09435202835294486, 'min_samples_leaf': 0.010675688204293567, 'min_weight_fraction_leaf': 0.05996851895836518, 'max_features': 0.5864882178247139}. Best is trial 688 with value: 0.6612018755665507.[0m
[32m[I 2022-04-21 11:51:30,658][0m Trial 876 finished with value: 0.6167152172640723 and parameters: {'splitter': 'best', 'min_samples_split': 0.33108432678046806, 'min_samples_leaf': 0.02476340464092694, 'min_weight_fraction_leaf': 0.09418077475620125, 'max_features': 0.8191923666462758}. Best is trial 688 with value: 0.6612018755665507.[0m
[32m[I 2022-04-21 11:51:32,053][0m Trial 877 finished with value: 0.627202276202856 and parameters: {'splitter': 'best', 'min_samples_split': 0.1384162557269671, 'min_samples_leaf': 0.0010276733726554193, 'min_weight_fraction_leaf': 0.008796445944505906, 'max_features': 0.635219168126673}. Best is trial 688 with value: 0.6612018755665507.[0m
[32m[I 2022-04-21 11:51:32,419][0m Trial 878 finished with value: 0.6265124525706742 and parameters: {'splitter': 'best', 'min_samples_split': 0.11947067119330088, 'min_samples_leaf': 0.037756103481309096, 'min_weight_fraction_leaf': 4.271391960621577e-05, 'max_features': 0.8807211942750376}. Best is trial 688 with value: 0.6612018755665507.[0m
[32m[I 2022-04-21 11:51:32,713][0m Trial 879 finished with value: 0.6095530902185942 and parameters: {'splitter': 'best', 'min_samples_split': 0.15012993058781213, 'min_samples_leaf': 0.01791879776635993, 'min_weight_fraction_leaf': 0.018051636838726133, 'max_features': 0.4747075846593188}. Best is trial 688 with value: 0.6612018755665507.[0m
[32m[I 2022-04-21 11:51:33,125][0m Trial 880 finished with value: 0.6193593373070841 and parameters: {'splitter': 'best', 'min_samples_split': 0.10870189358935495, 'min_samples_leaf': 0.009007217541224594, 'min_weight_fraction_leaf': 0.0284400200701473, 'max_features': 0.7870331126051378}. Best is trial 688 with value: 0.6612018755665507.[0m
[32m[I 2022-04-21 11:51:33,424][0m Trial 881 finished with value: 0.6264660952496188 and parameters: {'splitter': 'best', 'min_samples_split': 0.12348865750938254, 'min_samples_leaf': 0.0284776914552757, 'min_weight_fraction_leaf': 0.009878495043661027, 'max_features': 0.6027787510924766}. Best is trial 688 with value: 0.6612018755665507.[0m
[32m[I 2022-04-21 11:51:34,223][0m Trial 882 finished with value: 0.6187483218261642 and parameters: {'splitter': 'best', 'min_samples_split': 0.06705034670231194, 'min_samples_leaf': 0.017472785719279425, 'min_weight_fraction_leaf': 0.017851015652158006, 'max_features': 0.7702476779510269}. Best is trial 688 with value: 0.6612018755665507.[0m
[32m[I 2022-04-21 11:51:34,412][0m Trial 883 finished with value: 0.6019064120027753 and parameters: {'splitter': 'best', 'min_samples_split': 0.13460667280157243, 'min_samples_leaf': 0.09909838455028452, 'min_weight_fraction_leaf': 0.15818904482880974, 'max_features': 0.5581389757789517}. Best is trial 688 with value: 0.6612018755665507.[0m
[32m[I 2022-04-21 11:51:34,604][0m Trial 884 finished with value: 0.5816963628403365 and parameters: {'splitter': 'best', 'min_samples_split': 0.0852716080021306, 'min_samples_leaf': 0.218708050300902, 'min_weight_fraction_leaf': 0.008476325845830414, 'max_features': 0.6286015952059693}. Best is trial 688 with value: 0.6612018755665507.[0m
[32m[I 2022-04-21 11:51:34,769][0m Trial 885 finished with value: 0.49820239377188164 and parameters: {'splitter': 'best', 'min_samples_split': 0.09897542949444753, 'min_samples_leaf': 0.02351115854461346, 'min_weight_fraction_leaf': 0.4857033110736838, 'max_features': 0.8370933747583452}. Best is trial 688 with value: 0.6612018755665507.[0m
[32m[I 2022-04-21 11:51:35,384][0m Trial 886 finished with value: 0.6183755494368351 and parameters: {'splitter': 'best', 'min_samples_split': 0.11299611941341708, 'min_samples_leaf': 0.009690961676681412, 'min_weight_fraction_leaf': 0.03541036902524504, 'max_features': 0.8064065604437607}. Best is trial 688 with value: 0.6612018755665507.[0m
[32m[I 2022-04-21 11:51:35,723][0m Trial 887 finished with value: 0.5983291369638791 and parameters: {'splitter': 'best', 'min_samples_split': 0.145906645737779, 'min_samples_leaf': 0.043165209613639205, 'min_weight_fraction_leaf': 0.00025180486331979353, 'max_features': 0.6008772938721063}. Best is trial 688 with value: 0.6612018755665507.[0m
[32m[I 2022-04-21 11:51:36,399][0m Trial 888 finished with value: 0.6271254639958601 and parameters: {'splitter': 'best', 'min_samples_split': 0.12962478010241077, 'min_samples_leaf': 0.009519502406749251, 'min_weight_fraction_leaf': 0.023240558392074957, 'max_features': 0.6433050291657486}. Best is trial 688 with value: 0.6612018755665507.[0m
[32m[I 2022-04-21 11:51:37,175][0m Trial 889 finished with value: 0.6170688049622217 and parameters: {'splitter': 'best', 'min_samples_split': 0.09486860906461696, 'min_samples_leaf': 0.03218360028347962, 'min_weight_fraction_leaf': 0.017043767891420668, 'max_features': 0.7527689416269657}. Best is trial 688 with value: 0.6612018755665507.[0m
[32m[I 2022-04-21 11:51:38,601][0m Trial 890 finished with value: 0.615130005727537 and parameters: {'splitter': 'best', 'min_samples_split': 0.12065199398758888, 'min_samples_leaf': 0.01883286479064855, 'min_weight_fraction_leaf': 0.04022300593088765, 'max_features': 0.8550381581717843}. Best is trial 688 with value: 0.6612018755665507.[0m
[32m[I 2022-04-21 11:51:40,683][0m Trial 891 finished with value: 0.6350513326705286 and parameters: {'splitter': 'best', 'min_samples_split': 0.10911293169159456, 'min_samples_leaf': 0.009466698505675214, 'min_weight_fraction_leaf': 0.00813131604023635, 'max_features': 0.820564538993016}. Best is trial 688 with value: 0.6612018755665507.[0m
[32m[I 2022-04-21 11:51:41,283][0m Trial 892 finished with value: 0.6268981679820875 and parameters: {'splitter': 'best', 'min_samples_split': 0.13932946307395955, 'min_samples_leaf': 0.023798808679360215, 'min_weight_fraction_leaf': 0.02717600365009337, 'max_features': 0.5438936788854175}. Best is trial 688 with value: 0.6612018755665507.[0m
[32m[I 2022-04-21 11:51:42,106][0m Trial 893 finished with value: 0.6443520175895796 and parameters: {'splitter': 'best', 'min_samples_split': 0.15281472847285138, 'min_samples_leaf': 0.009413809556602442, 'min_weight_fraction_leaf': 0.015432175306042196, 'max_features': 0.6238430352927066}. Best is trial 688 with value: 0.6612018755665507.[0m
[32m[I 2022-04-21 11:51:42,384][0m Trial 894 finished with value: 0.6314634026142935 and parameters: {'splitter': 'best', 'min_samples_split': 0.1281068181073951, 'min_samples_leaf': 0.03435732216439331, 'min_weight_fraction_leaf': 0.01023786714019776, 'max_features': 0.5794253337875505}. Best is trial 688 with value: 0.6612018755665507.[0m
[32m[I 2022-04-21 11:51:42,468][0m Trial 895 finished with value: 0.6200359506660961 and parameters: {'splitter': 'random', 'min_samples_split': 0.07871245024871143, 'min_samples_leaf': 0.01706778966254352, 'min_weight_fraction_leaf': 7.99187267456359e-05, 'max_features': 0.3146336339625515}. Best is trial 688 with value: 0.6612018755665507.[0m
[32m[I 2022-04-21 11:51:43,149][0m Trial 896 finished with value: 0.6470826334233346 and parameters: {'splitter': 'best', 'min_samples_split': 0.10303524772329603, 'min_samples_leaf': 0.0016773527805469413, 'min_weight_fraction_leaf': 0.026283873618272086, 'max_features': 0.7936183183525557}. Best is trial 688 with value: 0.6612018755665507.[0m
[32m[I 2022-04-21 11:51:43,638][0m Trial 897 finished with value: 0.6109230847142351 and parameters: {'splitter': 'best', 'min_samples_split': 0.10308174437103171, 'min_samples_leaf': 0.0010303228773828124, 'min_weight_fraction_leaf': 0.04154476357983275, 'max_features': 0.7845715050885501}. Best is trial 688 with value: 0.6612018755665507.[0m
[32m[I 2022-04-21 11:51:44,134][0m Trial 898 finished with value: 0.6111761550415238 and parameters: {'splitter': 'best', 'min_samples_split': 0.09563469992697422, 'min_samples_leaf': 0.008957835170295655, 'min_weight_fraction_leaf': 0.03957584025775654, 'max_features': 0.800514954943083}. Best is trial 688 with value: 0.6612018755665507.[0m
[32m[I 2022-04-21 11:51:44,730][0m Trial 899 finished with value: 0.6112724401206363 and parameters: {'splitter': 'best', 'min_samples_split': 0.08440857714113215, 'min_samples_leaf': 0.001867580889687404, 'min_weight_fraction_leaf': 0.058166073219905794, 'max_features': 0.8323412829757997}. Best is trial 688 with value: 0.6612018755665507.[0m
[32m[I 2022-04-21 11:51:45,076][0m Trial 900 finished with value: 0.6009677888931083 and parameters: {'splitter': 'best', 'min_samples_split': 0.10538652857863792, 'min_samples_leaf': 0.018109359154361897, 'min_weight_fraction_leaf': 0.04840724485724843, 'max_features': 0.8069456266199546}. Best is trial 688 with value: 0.6612018755665507.[0m
[32m[I 2022-04-21 11:51:45,540][0m Trial 901 finished with value: 0.6181812772529071 and parameters: {'splitter': 'best', 'min_samples_split': 0.09058979031009907, 'min_samples_leaf': 0.009534001821740553, 'min_weight_fraction_leaf': 0.02871131182666626, 'max_features': 0.8115297686650067}. Best is trial 688 with value: 0.6612018755665507.[0m
[32m[I 2022-04-21 11:51:45,991][0m Trial 902 finished with value: 0.6243718475474742 and parameters: {'splitter': 'best', 'min_samples_split': 0.11657919869672703, 'min_samples_leaf': 0.02572864356658484, 'min_weight_fraction_leaf': 0.03341874455144679, 'max_features': 0.7887665203480079}. Best is trial 688 with value: 0.6612018755665507.[0m
