[32m[I 2022-04-21 11:39:33,670][0m Trial 387 finished with value: 0.6738476114655684 and parameters: {'splitter': 'random', 'min_samples_split': 0.3545322353069009, 'min_samples_leaf': 0.11093026203634437, 'min_weight_fraction_leaf': 0.1810309294590388, 'max_features': 0.9127157389161442}. Best is trial 11 with value: 0.6773038119717333.[0m
[32m[I 2022-04-21 11:39:33,731][0m Trial 388 finished with value: 0.6738476114655684 and parameters: {'splitter': 'random', 'min_samples_split': 0.35643197030193874, 'min_samples_leaf': 0.018731184038874134, 'min_weight_fraction_leaf': 0.19788822102275674, 'max_features': 0.9416417354254554}. Best is trial 11 with value: 0.6773038119717333.[0m
[32m[I 2022-04-21 11:39:33,798][0m Trial 389 finished with value: 0.6586187582319654 and parameters: {'splitter': 'random', 'min_samples_split': 0.3381639916493218, 'min_samples_leaf': 0.163957828890828, 'min_weight_fraction_leaf': 0.21471836084118437, 'max_features': 0.9187744649962061}. Best is trial 11 with value: 0.6773038119717333.[0m
[32m[I 2022-04-21 11:39:33,843][0m Trial 390 finished with value: 0.662800366349585 and parameters: {'splitter': 'random', 'min_samples_split': 0.07178522377157215, 'min_samples_leaf': 0.029551167607017884, 'min_weight_fraction_leaf': 0.1652996198365008, 'max_features': 0.8926295031026079}. Best is trial 11 with value: 0.6773038119717333.[0m
[32m[I 2022-04-21 11:39:33,874][0m Trial 391 finished with value: 0.6738476114655684 and parameters: {'splitter': 'random', 'min_samples_split': 0.19698129432649933, 'min_samples_leaf': 0.08303992987973227, 'min_weight_fraction_leaf': 0.174519364965073, 'max_features': 0.8062167922530973}. Best is trial 11 with value: 0.6773038119717333.[0m
[32m[I 2022-04-21 11:39:33,906][0m Trial 392 finished with value: 0.6738476114655684 and parameters: {'splitter': 'random', 'min_samples_split': 0.3711436972727978, 'min_samples_leaf': 0.01459785795177963, 'min_weight_fraction_leaf': 0.18635201779946498, 'max_features': 0.917149021072563}. Best is trial 11 with value: 0.6773038119717333.[0m
[32m[I 2022-04-21 11:39:33,978][0m Trial 393 finished with value: 0.6738476114655684 and parameters: {'splitter': 'random', 'min_samples_split': 0.4245846122235429, 'min_samples_leaf': 0.15210882316685118, 'min_weight_fraction_leaf': 0.17443205076165114, 'max_features': 0.9286286080386448}. Best is trial 11 with value: 0.6773038119717333.[0m
[32m[I 2022-04-21 11:39:34,036][0m Trial 394 finished with value: 0.6640701022932763 and parameters: {'splitter': 'random', 'min_samples_split': 0.4332068357856406, 'min_samples_leaf': 0.14303365502669116, 'min_weight_fraction_leaf': 0.06447484242197982, 'max_features': 0.8825132547213037}. Best is trial 11 with value: 0.6773038119717333.[0m
[32m[I 2022-04-21 11:39:34,081][0m Trial 395 finished with value: 0.6738476114655684 and parameters: {'splitter': 'random', 'min_samples_split': 0.3360397706763359, 'min_samples_leaf': 0.008556050370532715, 'min_weight_fraction_leaf': 0.18598212614030044, 'max_features': 0.9982102417048521}. Best is trial 11 with value: 0.6773038119717333.[0m
[32m[I 2022-04-21 11:39:34,134][0m Trial 396 finished with value: 0.6738476114655684 and parameters: {'splitter': 'random', 'min_samples_split': 0.3474206871580486, 'min_samples_leaf': 0.020019986666073405, 'min_weight_fraction_leaf': 0.19255797010199324, 'max_features': 0.859863340038568}. Best is trial 11 with value: 0.6773038119717333.[0m
[32m[I 2022-04-21 11:39:34,214][0m Trial 397 finished with value: 0.6586187582319654 and parameters: {'splitter': 'random', 'min_samples_split': 0.3660666365684578, 'min_samples_leaf': 0.002803232072673155, 'min_weight_fraction_leaf': 0.20266043058053662, 'max_features': 0.9426694144032433}. Best is trial 11 with value: 0.6773038119717333.[0m
[32m[I 2022-04-21 11:39:34,277][0m Trial 398 finished with value: 0.6738476114655684 and parameters: {'splitter': 'random', 'min_samples_split': 0.17294606448944083, 'min_samples_leaf': 0.1911646205564649, 'min_weight_fraction_leaf': 0.14153775730895946, 'max_features': 0.839161166364771}. Best is trial 11 with value: 0.6773038119717333.[0m
[32m[I 2022-04-21 11:39:34,315][0m Trial 399 finished with value: 0.5 and parameters: {'splitter': 'random', 'min_samples_split': 0.47070573471756744, 'min_samples_leaf': 0.0027695625299332827, 'min_weight_fraction_leaf': 0.19428350725004928, 'max_features': 0.6804559371932395}. Best is trial 11 with value: 0.6773038119717333.[0m
[32m[I 2022-04-21 11:39:34,376][0m Trial 400 finished with value: 0.662800366349585 and parameters: {'splitter': 'random', 'min_samples_split': 0.28635393315231217, 'min_samples_leaf': 0.14170993800155351, 'min_weight_fraction_leaf': 0.16120390588249586, 'max_features': 0.8428066941543569}. Best is trial 11 with value: 0.6773038119717333.[0m
[32m[I 2022-04-21 11:39:34,445][0m Trial 401 finished with value: 0.6215155824977587 and parameters: {'splitter': 'random', 'min_samples_split': 0.1662102230037988, 'min_samples_leaf': 0.08998127337376968, 'min_weight_fraction_leaf': 0.22913869022184208, 'max_features': 0.9663873928129398}. Best is trial 11 with value: 0.6773038119717333.[0m
[32m[I 2022-04-21 11:39:34,505][0m Trial 402 finished with value: 0.6598137568019723 and parameters: {'splitter': 'best', 'min_samples_split': 0.3103741390931126, 'min_samples_leaf': 0.04017975065629535, 'min_weight_fraction_leaf': 0.18007303816294512, 'max_features': 0.9099669344059121}. Best is trial 11 with value: 0.6773038119717333.[0m
[32m[I 2022-04-21 11:39:34,539][0m Trial 403 finished with value: 0.6738476114655684 and parameters: {'splitter': 'random', 'min_samples_split': 0.44933860644577567, 'min_samples_leaf': 0.027758506937396725, 'min_weight_fraction_leaf': 0.17352531662925216, 'max_features': 0.9727085263566121}. Best is trial 11 with value: 0.6773038119717333.[0m
[32m[I 2022-04-21 11:39:34,572][0m Trial 404 finished with value: 0.6738476114655684 and parameters: {'splitter': 'random', 'min_samples_split': 0.4567619674822977, 'min_samples_leaf': 0.03408755034447826, 'min_weight_fraction_leaf': 0.16876672434366932, 'max_features': 0.9461223555638436}. Best is trial 11 with value: 0.6773038119717333.[0m
[32m[I 2022-04-21 11:39:34,607][0m Trial 405 finished with value: 0.6640701022932763 and parameters: {'splitter': 'random', 'min_samples_split': 0.4787353664262032, 'min_samples_leaf': 0.04620342722839625, 'min_weight_fraction_leaf': 0.10498834884700517, 'max_features': 0.9975420940460196}. Best is trial 11 with value: 0.6773038119717333.[0m
[32m[I 2022-04-21 11:39:34,640][0m Trial 406 finished with value: 0.6586187582319654 and parameters: {'splitter': 'random', 'min_samples_split': 0.4308826745339534, 'min_samples_leaf': 0.05779535291802488, 'min_weight_fraction_leaf': 0.20633599777043513, 'max_features': 0.9305733900538457}. Best is trial 11 with value: 0.6773038119717333.[0m
[32m[I 2022-04-21 11:39:34,674][0m Trial 407 finished with value: 0.6556570012431993 and parameters: {'splitter': 'random', 'min_samples_split': 0.1003377702939683, 'min_samples_leaf': 0.06142208743880145, 'min_weight_fraction_leaf': 0.014822407106973601, 'max_features': 0.8773450322300929}. Best is trial 11 with value: 0.6773038119717333.[0m
[32m[I 2022-04-21 11:39:34,707][0m Trial 408 finished with value: 0.6543938115635641 and parameters: {'splitter': 'random', 'min_samples_split': 0.09079422744409374, 'min_samples_leaf': 0.13992242113023382, 'min_weight_fraction_leaf': 0.1592268193265493, 'max_features': 0.9858860375036432}. Best is trial 11 with value: 0.6773038119717333.[0m
[32m[I 2022-04-21 11:39:34,741][0m Trial 409 finished with value: 0.6551405301163737 and parameters: {'splitter': 'random', 'min_samples_split': 0.19410093468824122, 'min_samples_leaf': 0.1326790858671075, 'min_weight_fraction_leaf': 0.22218373707454758, 'max_features': 0.9861932546972093}. Best is trial 11 with value: 0.6773038119717333.[0m
[32m[I 2022-04-21 11:39:34,818][0m Trial 410 finished with value: 0.6738476114655684 and parameters: {'splitter': 'random', 'min_samples_split': 0.19105734137942043, 'min_samples_leaf': 0.17432020879443877, 'min_weight_fraction_leaf': 0.004505947998515666, 'max_features': 0.97829711828246}. Best is trial 11 with value: 0.6773038119717333.[0m
[32m[I 2022-04-21 11:39:34,903][0m Trial 411 finished with value: 0.6738476114655684 and parameters: {'splitter': 'random', 'min_samples_split': 0.43765199967558877, 'min_samples_leaf': 0.1717252800279083, 'min_weight_fraction_leaf': 0.0008669631228386404, 'max_features': 0.9480984014291163}. Best is trial 11 with value: 0.6773038119717333.[0m
[32m[I 2022-04-21 11:39:34,941][0m Trial 412 finished with value: 0.6586187582319654 and parameters: {'splitter': 'random', 'min_samples_split': 0.2716986332163667, 'min_samples_leaf': 0.05315965227194539, 'min_weight_fraction_leaf': 0.21194534061224632, 'max_features': 0.8585556353048714}. Best is trial 11 with value: 0.6773038119717333.[0m
[32m[I 2022-04-21 11:39:34,975][0m Trial 413 finished with value: 0.6586187582319654 and parameters: {'splitter': 'random', 'min_samples_split': 0.15232932624371495, 'min_samples_leaf': 0.02409691025718355, 'min_weight_fraction_leaf': 0.2038602242294682, 'max_features': 0.9600015175773946}. Best is trial 11 with value: 0.6773038119717333.[0m
[32m[I 2022-04-21 11:39:35,011][0m Trial 414 finished with value: 0.6738476114655684 and parameters: {'splitter': 'random', 'min_samples_split': 0.14798035782965802, 'min_samples_leaf': 0.024953920343523887, 'min_weight_fraction_leaf': 0.20000357318446632, 'max_features': 0.9510919825629404}. Best is trial 11 with value: 0.6773038119717333.[0m
[32m[I 2022-04-21 11:39:35,044][0m Trial 415 finished with value: 0.6738476114655684 and parameters: {'splitter': 'random', 'min_samples_split': 0.019145047285965278, 'min_samples_leaf': 0.002635696958949934, 'min_weight_fraction_leaf': 0.18454519540567682, 'max_features': 0.9590026635805808}. Best is trial 11 with value: 0.6773038119717333.[0m
[32m[I 2022-04-21 11:39:35,078][0m Trial 416 finished with value: 0.6738476114655684 and parameters: {'splitter': 'random', 'min_samples_split': 0.38363360183171075, 'min_samples_leaf': 0.01020137599500949, 'min_weight_fraction_leaf': 0.19202450588995476, 'max_features': 0.9965370879409402}. Best is trial 11 with value: 0.6773038119717333.[0m
[32m[I 2022-04-21 11:39:35,111][0m Trial 417 finished with value: 0.6738476114655684 and parameters: {'splitter': 'random', 'min_samples_split': 0.20310733602286854, 'min_samples_leaf': 0.012684676124849982, 'min_weight_fraction_leaf': 0.18998474963711695, 'max_features': 0.9980726882867551}. Best is trial 11 with value: 0.6773038119717333.[0m
[32m[I 2022-04-21 11:39:35,144][0m Trial 418 finished with value: 0.6738476114655684 and parameters: {'splitter': 'random', 'min_samples_split': 0.19394066236865845, 'min_samples_leaf': 0.017801225492348118, 'min_weight_fraction_leaf': 0.17477690751575284, 'max_features': 0.9703275242499171}. Best is trial 11 with value: 0.6773038119717333.[0m
[32m[I 2022-04-21 11:39:35,177][0m Trial 419 finished with value: 0.6738476114655684 and parameters: {'splitter': 'random', 'min_samples_split': 0.23571843423304062, 'min_samples_leaf': 0.0017542470261544883, 'min_weight_fraction_leaf': 0.1928446969547347, 'max_features': 0.9600195721636909}. Best is trial 11 with value: 0.6773038119717333.[0m
[32m[I 2022-04-21 11:39:35,229][0m Trial 420 finished with value: 0.6636900948801576 and parameters: {'splitter': 'best', 'min_samples_split': 0.0025469663587878097, 'min_samples_leaf': 0.0026555440918916854, 'min_weight_fraction_leaf': 0.18471908098903608, 'max_features': 0.9994249192981945}. Best is trial 11 with value: 0.6773038119717333.[0m
[32m[I 2022-04-21 11:39:35,295][0m Trial 421 finished with value: 0.5931624331547747 and parameters: {'splitter': 'random', 'min_samples_split': 0.18501690109284194, 'min_samples_leaf': 0.08009071097560042, 'min_weight_fraction_leaf': 0.2449472240963857, 'max_features': 0.8215425219853344}. Best is trial 11 with value: 0.6773038119717333.[0m
[32m[I 2022-04-21 11:39:35,356][0m Trial 422 finished with value: 0.6640701022932763 and parameters: {'splitter': 'random', 'min_samples_split': 0.2761457400942584, 'min_samples_leaf': 0.12781326958886718, 'min_weight_fraction_leaf': 0.02446026265524273, 'max_features': 0.8968353465548239}. Best is trial 11 with value: 0.6773038119717333.[0m
[32m[I 2022-04-21 11:39:35,452][0m Trial 423 finished with value: 0.6738476114655684 and parameters: {'splitter': 'random', 'min_samples_split': 0.256055581259665, 'min_samples_leaf': 0.18531606205796228, 'min_weight_fraction_leaf': 0.12501070610314557, 'max_features': 0.8402522053146718}. Best is trial 11 with value: 0.6773038119717333.[0m
[32m[I 2022-04-21 11:39:35,567][0m Trial 424 finished with value: 0.6738476114655684 and parameters: {'splitter': 'random', 'min_samples_split': 0.25403084304583756, 'min_samples_leaf': 0.1891164197252862, 'min_weight_fraction_leaf': 0.1267302943085153, 'max_features': 0.836624736287436}. Best is trial 11 with value: 0.6773038119717333.[0m
[32m[I 2022-04-21 11:39:35,743][0m Trial 425 finished with value: 0.6738476114655684 and parameters: {'splitter': 'random', 'min_samples_split': 0.322521248022911, 'min_samples_leaf': 0.011208374408841832, 'min_weight_fraction_leaf': 0.17914438453699177, 'max_features': 0.9357165909056161}. Best is trial 11 with value: 0.6773038119717333.[0m
[32m[I 2022-04-21 11:39:36,018][0m Trial 426 finished with value: 0.5 and parameters: {'splitter': 'random', 'min_samples_split': 0.3707593651642758, 'min_samples_leaf': 0.001187366274649215, 'min_weight_fraction_leaf': 0.18204904449962986, 'max_features': 0.33542088832933825}. Best is trial 11 with value: 0.6773038119717333.[0m
[32m[I 2022-04-21 11:39:36,287][0m Trial 427 finished with value: 0.5305100038533069 and parameters: {'splitter': 'random', 'min_samples_split': 0.31779808697190304, 'min_samples_leaf': 0.11172854314960501, 'min_weight_fraction_leaf': 0.17616597763032146, 'max_features': 0.7890052639798869}. Best is trial 11 with value: 0.6773038119717333.[0m
[32m[I 2022-04-21 11:39:36,559][0m Trial 428 finished with value: 0.6586187582319654 and parameters: {'splitter': 'random', 'min_samples_split': 0.3561195424595153, 'min_samples_leaf': 0.10182734661772877, 'min_weight_fraction_leaf': 0.20205521840970606, 'max_features': 0.9050881371644434}. Best is trial 11 with value: 0.6773038119717333.[0m
[32m[I 2022-04-21 11:39:36,730][0m Trial 429 finished with value: 0.6543938115635641 and parameters: {'splitter': 'random', 'min_samples_split': 0.0798686787602377, 'min_samples_leaf': 0.1583032216702538, 'min_weight_fraction_leaf': 0.15230696081714465, 'max_features': 0.9358986038940472}. Best is trial 11 with value: 0.6773038119717333.[0m
[32m[I 2022-04-21 11:39:36,783][0m Trial 430 finished with value: 0.662800366349585 and parameters: {'splitter': 'random', 'min_samples_split': 0.16054397688859837, 'min_samples_leaf': 0.16367403494170846, 'min_weight_fraction_leaf': 0.15471524547606869, 'max_features': 0.9419167159608498}. Best is trial 11 with value: 0.6773038119717333.[0m
[32m[I 2022-04-21 11:39:36,857][0m Trial 431 finished with value: 0.662800366349585 and parameters: {'splitter': 'random', 'min_samples_split': 0.4103253860331568, 'min_samples_leaf': 0.036722551165493764, 'min_weight_fraction_leaf': 0.15980554074542805, 'max_features': 0.8879181346850626}. Best is trial 11 with value: 0.6773038119717333.[0m
[32m[I 2022-04-21 11:39:36,940][0m Trial 432 finished with value: 0.6586187582319654 and parameters: {'splitter': 'random', 'min_samples_split': 0.24556906872961914, 'min_samples_leaf': 0.20989523513937347, 'min_weight_fraction_leaf': 0.14207518316820064, 'max_features': 0.8525119410374596}. Best is trial 11 with value: 0.6773038119717333.[0m
[32m[I 2022-04-21 11:39:37,006][0m Trial 433 finished with value: 0.6738476114655684 and parameters: {'splitter': 'random', 'min_samples_split': 0.4427553567122488, 'min_samples_leaf': 0.18220376316911444, 'min_weight_fraction_leaf': 0.14913938085997627, 'max_features': 0.8662076631726424}. Best is trial 11 with value: 0.6773038119717333.[0m
[32m[I 2022-04-21 11:39:37,121][0m Trial 434 finished with value: 0.6738476114655684 and parameters: {'splitter': 'random', 'min_samples_split': 0.023564737812355786, 'min_samples_leaf': 0.015515044169753453, 'min_weight_fraction_leaf': 0.19525530350119275, 'max_features': 0.9178958111393523}. Best is trial 11 with value: 0.6773038119717333.[0m
[32m[I 2022-04-21 11:39:37,179][0m Trial 435 finished with value: 0.6586187582319654 and parameters: {'splitter': 'random', 'min_samples_split': 0.031162400987051378, 'min_samples_leaf': 0.01154995050366029, 'min_weight_fraction_leaf': 0.20998106539922415, 'max_features': 0.8945129956082817}. Best is trial 11 with value: 0.6773038119717333.[0m
[32m[I 2022-04-21 11:39:37,255][0m Trial 436 finished with value: 0.5889594645659965 and parameters: {'splitter': 'random', 'min_samples_split': 0.21979040515050613, 'min_samples_leaf': 0.23294849236101436, 'min_weight_fraction_leaf': 0.1676008663293623, 'max_features': 0.80436322564157}. Best is trial 11 with value: 0.6773038119717333.[0m
[32m[I 2022-04-21 11:39:37,389][0m Trial 437 finished with value: 0.6738476114655684 and parameters: {'splitter': 'random', 'min_samples_split': 0.45609161787707647, 'min_samples_leaf': 0.19519336088886002, 'min_weight_fraction_leaf': 0.13371934293655213, 'max_features': 0.9574766393220603}. Best is trial 11 with value: 0.6773038119717333.[0m
[32m[I 2022-04-21 11:39:37,479][0m Trial 438 finished with value: 0.6738476114655684 and parameters: {'splitter': 'random', 'min_samples_split': 0.16270372743752587, 'min_samples_leaf': 0.08208361967070701, 'min_weight_fraction_leaf': 0.1693254877491216, 'max_features': 0.9667468840918099}. Best is trial 11 with value: 0.6773038119717333.[0m
[32m[I 2022-04-21 11:39:37,559][0m Trial 439 finished with value: 0.6738476114655684 and parameters: {'splitter': 'random', 'min_samples_split': 0.459448935532495, 'min_samples_leaf': 0.09384401292365158, 'min_weight_fraction_leaf': 0.18802531507248987, 'max_features': 0.9526997609023242}. Best is trial 11 with value: 0.6773038119717333.[0m
[32m[I 2022-04-21 11:39:37,632][0m Trial 440 finished with value: 0.6551405301163737 and parameters: {'splitter': 'random', 'min_samples_split': 0.20607856907050845, 'min_samples_leaf': 0.09489631860593101, 'min_weight_fraction_leaf': 0.21926092458098384, 'max_features': 0.9792464871721639}. Best is trial 11 with value: 0.6773038119717333.[0m
[32m[I 2022-04-21 11:39:37,682][0m Trial 441 finished with value: 0.6598137568019723 and parameters: {'splitter': 'best', 'min_samples_split': 0.2828378126785255, 'min_samples_leaf': 0.04446273784862435, 'min_weight_fraction_leaf': 0.17989393868512862, 'max_features': 0.9213114983226008}. Best is trial 11 with value: 0.6773038119717333.[0m
[32m[I 2022-04-21 11:39:37,754][0m Trial 442 finished with value: 0.662800366349585 and parameters: {'splitter': 'random', 'min_samples_split': 0.061638624605772074, 'min_samples_leaf': 0.1522750176624588, 'min_weight_fraction_leaf': 0.16564566774954786, 'max_features': 0.9436134044813835}. Best is trial 11 with value: 0.6773038119717333.[0m
[32m[I 2022-04-21 11:39:37,823][0m Trial 443 finished with value: 0.6586187582319654 and parameters: {'splitter': 'random', 'min_samples_split': 0.11784911109964778, 'min_samples_leaf': 0.02803703410772779, 'min_weight_fraction_leaf': 0.20142290699794288, 'max_features': 0.8724706677481143}. Best is trial 11 with value: 0.6773038119717333.[0m
[32m[I 2022-04-21 11:39:37,889][0m Trial 444 finished with value: 0.6543938115635641 and parameters: {'splitter': 'random', 'min_samples_split': 0.2739035535839094, 'min_samples_leaf': 0.06882694851792776, 'min_weight_fraction_leaf': 0.1590326398585789, 'max_features': 0.9258987922866841}. Best is trial 11 with value: 0.6773038119717333.[0m
[32m[I 2022-04-21 11:39:37,958][0m Trial 445 finished with value: 0.6586187582319654 and parameters: {'splitter': 'random', 'min_samples_split': 0.29903227354499756, 'min_samples_leaf': 0.20287945631507803, 'min_weight_fraction_leaf': 0.0454476060286931, 'max_features': 0.8140871486057635}. Best is trial 11 with value: 0.6773038119717333.[0m
[32m[I 2022-04-21 11:39:38,024][0m Trial 446 finished with value: 0.6586187582319654 and parameters: {'splitter': 'random', 'min_samples_split': 0.18441882891068237, 'min_samples_leaf': 0.2026530675151215, 'min_weight_fraction_leaf': 0.18222961026190804, 'max_features': 0.9729809887705073}. Best is trial 11 with value: 0.6773038119717333.[0m
[32m[I 2022-04-21 11:39:38,106][0m Trial 447 finished with value: 0.6738476114655684 and parameters: {'splitter': 'random', 'min_samples_split': 0.39421163280338584, 'min_samples_leaf': 0.1783213409734771, 'min_weight_fraction_leaf': 0.15691058021329207, 'max_features': 0.9347771420659451}. Best is trial 11 with value: 0.6773038119717333.[0m
[32m[I 2022-04-21 11:39:38,167][0m Trial 448 finished with value: 0.6738476114655684 and parameters: {'splitter': 'random', 'min_samples_split': 0.39754385388413255, 'min_samples_leaf': 0.10847034561730383, 'min_weight_fraction_leaf': 0.16942935293595765, 'max_features': 0.9112038734293894}. Best is trial 11 with value: 0.6773038119717333.[0m
[32m[I 2022-04-21 11:39:38,240][0m Trial 449 finished with value: 0.6738476114655684 and parameters: {'splitter': 'random', 'min_samples_split': 0.3943491458160312, 'min_samples_leaf': 0.12075017110009767, 'min_weight_fraction_leaf': 0.19075024235242047, 'max_features': 0.8814629422584196}. Best is trial 11 with value: 0.6773038119717333.[0m
