[32m[I 2022-04-21 16:43:27,791][0m Trial 629 finished with value: -0.46608187823439823 and parameters: {'loss': 'squared', 'learning_rate': 0.01055685163146246, 'n_estimators': 987, 'criterion': 'friedman_mse', 'min_samples_split': 2, 'min_samples_leaf': 5, 'min_weight_fraction_leaf': 0.05828044586434301, 'min_impurity_decrease': 0.5091442512872664, 'max_features': 0.3217650515822361, 'subsample': 0.35061786973525, 'dropout_rate': 0.2985617150494138, 'ccp_alpha': 0.2614265221336797}. Best is trial 486 with value: 0.8320137528916117.[0m
[32m[I 2022-04-21 16:45:38,621][0m Trial 630 finished with value: 0.8275900507603351 and parameters: {'loss': 'coxph', 'learning_rate': 0.00755966029828794, 'n_estimators': 654, 'criterion': 'friedman_mse', 'min_samples_split': 2, 'min_samples_leaf': 5, 'min_weight_fraction_leaf': 0.048953371670555655, 'min_impurity_decrease': 0.8934593200186071, 'max_features': 0.2666237580634568, 'subsample': 0.3025100170055752, 'dropout_rate': 0.3851808805225324, 'ccp_alpha': 0.08478635245161972}. Best is trial 486 with value: 0.8320137528916117.[0m
[32m[I 2022-04-21 16:46:00,145][0m Trial 631 finished with value: 0.698644779346337 and parameters: {'loss': 'coxph', 'learning_rate': 0.01064761622930538, 'n_estimators': 694, 'criterion': 'friedman_mse', 'min_samples_split': 2, 'min_samples_leaf': 5, 'min_weight_fraction_leaf': 0.04166273443783562, 'min_impurity_decrease': 0.8758201141827945, 'max_features': 0.33241756603596156, 'subsample': 0.3281453473627846, 'dropout_rate': 0.9751291707097066, 'ccp_alpha': 0.17473499084063215}. Best is trial 486 with value: 0.8320137528916117.[0m
[32m[I 2022-04-21 16:46:20,066][0m Trial 632 finished with value: 0.8317475680516242 and parameters: {'loss': 'coxph', 'learning_rate': 0.008036331072689942, 'n_estimators': 627, 'criterion': 'friedman_mse', 'min_samples_split': 2, 'min_samples_leaf': 5, 'min_weight_fraction_leaf': 0.019589928359550323, 'min_impurity_decrease': 0.5550006887834613, 'max_features': 0.3205715111849129, 'subsample': 0.3552477323632115, 'dropout_rate': 0.9825011527214967, 'ccp_alpha': 0.0020849057032735915}. Best is trial 486 with value: 0.8320137528916117.[0m
[32m[I 2022-04-21 16:48:37,661][0m Trial 633 finished with value: 0.8217695932644681 and parameters: {'loss': 'coxph', 'learning_rate': 0.007289236753643539, 'n_estimators': 635, 'criterion': 'friedman_mse', 'min_samples_split': 2, 'min_samples_leaf': 5, 'min_weight_fraction_leaf': 0.011509842576539725, 'min_impurity_decrease': 0.9020311827993793, 'max_features': 0.2908288504422126, 'subsample': 0.35330102714502715, 'dropout_rate': 0.2797373779530723, 'ccp_alpha': 0.09304553372089468}. Best is trial 486 with value: 0.8320137528916117.[0m
[32m[I 2022-04-21 16:50:34,986][0m Trial 634 finished with value: 0.25 and parameters: {'loss': 'coxph', 'learning_rate': 0.008339808071710397, 'n_estimators': 656, 'criterion': 'squared_error', 'min_samples_split': 2, 'min_samples_leaf': 5, 'min_weight_fraction_leaf': 0.008540129260143752, 'min_impurity_decrease': 0.5695885919566254, 'max_features': 0.31283434304390634, 'subsample': 0.31666466243925095, 'dropout_rate': 0.41211263489424194, 'ccp_alpha': 0.0019351599936575257}. Best is trial 486 with value: 0.8320137528916117.[0m
[32m[I 2022-04-21 16:50:59,533][0m Trial 635 finished with value: 0.3848126137618765 and parameters: {'loss': 'coxph', 'learning_rate': 0.005841508985931513, 'n_estimators': 617, 'criterion': 'friedman_mse', 'min_samples_split': 2, 'min_samples_leaf': 5, 'min_weight_fraction_leaf': 0.016023492719583633, 'min_impurity_decrease': 0.9372811712931939, 'max_features': 0.2716711166453738, 'subsample': 0.3393223798578083, 'dropout_rate': 0.9605239090721414, 'ccp_alpha': 0.19073291072402068}. Best is trial 486 with value: 0.8320137528916117.[0m
[32m[I 2022-04-21 16:51:21,300][0m Trial 636 finished with value: 0.2503270102305002 and parameters: {'loss': 'coxph', 'learning_rate': 0.008727278115060693, 'n_estimators': 691, 'criterion': 'friedman_mse', 'min_samples_split': 2, 'min_samples_leaf': 6, 'min_weight_fraction_leaf': 0.026827553736816855, 'min_impurity_decrease': 0.7898119258317798, 'max_features': 0.32803651572807, 'subsample': 0.3580934822547601, 'dropout_rate': 0.966609826023082, 'ccp_alpha': 0.3780534668588546}. Best is trial 486 with value: 0.8320137528916117.[0m
[32m[I 2022-04-21 16:51:51,890][0m Trial 637 finished with value: 0.8315923795771241 and parameters: {'loss': 'coxph', 'learning_rate': 0.006301343888974218, 'n_estimators': 724, 'criterion': 'friedman_mse', 'min_samples_split': 2, 'min_samples_leaf': 5, 'min_weight_fraction_leaf': 0.01592141014888909, 'min_impurity_decrease': 0.9133818589401339, 'max_features': 0.25100011192561633, 'subsample': 0.33230267866258567, 'dropout_rate': 0.980715645861624, 'ccp_alpha': 0.0046308062763922315}. Best is trial 486 with value: 0.8320137528916117.[0m
[32m[I 2022-04-21 16:52:13,780][0m Trial 638 finished with value: 0.25 and parameters: {'loss': 'coxph', 'learning_rate': 0.005549014855557591, 'n_estimators': 726, 'criterion': 'absolute_error', 'min_samples_split': 2, 'min_samples_leaf': 5, 'min_weight_fraction_leaf': 0.015019854584262513, 'min_impurity_decrease': 0.8588853511394595, 'max_features': 0.30741956476264143, 'subsample': 0.32413337609855997, 'dropout_rate': 0.9778467661424642, 'ccp_alpha': 0.0864815332114766}. Best is trial 486 with value: 0.8320137528916117.[0m
[32m[I 2022-04-21 16:52:31,589][0m Trial 639 finished with value: 0.25662745571200507 and parameters: {'loss': 'coxph', 'learning_rate': 0.006599888447696141, 'n_estimators': 745, 'criterion': 'friedman_mse', 'min_samples_split': 2, 'min_samples_leaf': 5, 'min_weight_fraction_leaf': 0.0063846150935584975, 'min_impurity_decrease': 0.9251535629704893, 'max_features': 0.2454804987916689, 'subsample': 0.3369860647093312, 'dropout_rate': 0.9836938204751429, 'ccp_alpha': 0.26501141667776035}. Best is trial 486 with value: 0.8320137528916117.[0m
[32m[I 2022-04-21 16:52:55,445][0m Trial 640 finished with value: 0.8060395363608084 and parameters: {'loss': 'coxph', 'learning_rate': 0.004788730063383939, 'n_estimators': 695, 'criterion': 'friedman_mse', 'min_samples_split': 2, 'min_samples_leaf': 5, 'min_weight_fraction_leaf': 0.024238158918596778, 'min_impurity_decrease': 0.5608225771309243, 'max_features': 0.3231876042761408, 'subsample': 0.3065207508371076, 'dropout_rate': 0.9588186305099037, 'ccp_alpha': 0.16464055416374404}. Best is trial 486 with value: 0.8320137528916117.[0m
[32m[I 2022-04-21 16:53:16,398][0m Trial 641 finished with value: 0.8277686441823121 and parameters: {'loss': 'coxph', 'learning_rate': 0.007259662701903466, 'n_estimators': 774, 'criterion': 'friedman_mse', 'min_samples_split': 2, 'min_samples_leaf': 5, 'min_weight_fraction_leaf': 0.0176504079636069, 'min_impurity_decrease': 0.9587240087547548, 'max_features': 0.2231303972398778, 'subsample': 0.35499311987944726, 'dropout_rate': 0.9777798174937365, 'ccp_alpha': 0.07765070992313303}. Best is trial 486 with value: 0.8320137528916117.[0m
[32m[I 2022-04-21 16:53:36,470][0m Trial 642 finished with value: 0.7975568352449403 and parameters: {'loss': 'coxph', 'learning_rate': 0.009595824679131348, 'n_estimators': 666, 'criterion': 'friedman_mse', 'min_samples_split': 2, 'min_samples_leaf': 5, 'min_weight_fraction_leaf': 0.02958614164919072, 'min_impurity_decrease': 0.9416127997187338, 'max_features': 0.331742426631178, 'subsample': 0.3246576839580013, 'dropout_rate': 0.9561726678278686, 'ccp_alpha': 0.17171948897782768}. Best is trial 486 with value: 0.8320137528916117.[0m
[32m[I 2022-04-21 16:57:30,251][0m Trial 643 finished with value: 0.8307409340174567 and parameters: {'loss': 'coxph', 'learning_rate': 0.00536127851296383, 'n_estimators': 916, 'criterion': 'friedman_mse', 'min_samples_split': 2, 'min_samples_leaf': 5, 'min_weight_fraction_leaf': 0.010652490697489803, 'min_impurity_decrease': 0.913207737942381, 'max_features': 0.306546008151021, 'subsample': 0.35179870162732807, 'dropout_rate': 0.3503771693622396, 'ccp_alpha': 0.0028380587263121}. Best is trial 486 with value: 0.8320137528916117.[0m
[32m[I 2022-04-21 17:02:01,556][0m Trial 644 finished with value: 0.826119728622302 and parameters: {'loss': 'coxph', 'learning_rate': 0.005166329609750404, 'n_estimators': 954, 'criterion': 'friedman_mse', 'min_samples_split': 2, 'min_samples_leaf': 5, 'min_weight_fraction_leaf': 0.003914595271464856, 'min_impurity_decrease': 0.9035623850077273, 'max_features': 0.2051448629446952, 'subsample': 0.30629693216617104, 'dropout_rate': 0.2349602491033964, 'ccp_alpha': 0.10206883693953656}. Best is trial 486 with value: 0.8320137528916117.[0m
[32m[I 2022-04-21 17:06:26,081][0m Trial 645 finished with value: 0.25 and parameters: {'loss': 'coxph', 'learning_rate': 0.00600796349850418, 'n_estimators': 900, 'criterion': 'friedman_mse', 'min_samples_split': 2, 'min_samples_leaf': 5, 'min_weight_fraction_leaf': 0.012725835381348003, 'min_impurity_decrease': 0.9540756230272457, 'max_features': 0.28963954174284023, 'subsample': 0.3351737571488699, 'dropout_rate': 0.2171780794004894, 'ccp_alpha': 2.7979374871328258}. Best is trial 486 with value: 0.8320137528916117.[0m
[32m[I 2022-04-21 17:10:31,635][0m Trial 646 finished with value: 0.8312093955672332 and parameters: {'loss': 'coxph', 'learning_rate': 0.004761235797876979, 'n_estimators': 842, 'criterion': 'friedman_mse', 'min_samples_split': 2, 'min_samples_leaf': 6, 'min_weight_fraction_leaf': 0.008862588113677594, 'min_impurity_decrease': 0.8836055501601605, 'max_features': 0.2966043243773309, 'subsample': 0.3412013317582359, 'dropout_rate': 0.190344978231058, 'ccp_alpha': 0.0010543330930908763}. Best is trial 486 with value: 0.8320137528916117.[0m
[32m[I 2022-04-21 17:13:27,280][0m Trial 647 finished with value: 0.25 and parameters: {'loss': 'coxph', 'learning_rate': 0.004637117428889093, 'n_estimators': 782, 'criterion': 'friedman_mse', 'min_samples_split': 2, 'min_samples_leaf': 6, 'min_weight_fraction_leaf': 0.003189699930324287, 'min_impurity_decrease': 0.9052212613353937, 'max_features': 0.2483929255870648, 'subsample': 0.5628870573197797, 'dropout_rate': 0.34338282739211196, 'ccp_alpha': 3.816254700663545}. Best is trial 486 with value: 0.8320137528916117.[0m
[32m[I 2022-04-21 17:18:23,212][0m Trial 648 finished with value: 0.3574378011585709 and parameters: {'loss': 'coxph', 'learning_rate': 0.004832577849690721, 'n_estimators': 921, 'criterion': 'friedman_mse', 'min_samples_split': 2, 'min_samples_leaf': 6, 'min_weight_fraction_leaf': 0.0015797431876869387, 'min_impurity_decrease': 0.9193011052297047, 'max_features': 0.2920808568096506, 'subsample': 0.3469532593449181, 'dropout_rate': 0.1182855173135447, 'ccp_alpha': 0.30647009017202786}. Best is trial 486 with value: 0.8320137528916117.[0m
/media/san2_ssd/data/Workdir/survival/venv/lib/python3.8/site-packages/sksurv/ensemble/boosting.py:955: RuntimeWarning: divide by zero encountered in log
  time = numpy.log(time)
/media/san2_ssd/data/Workdir/survival/venv/lib/python3.8/site-packages/sksurv/ensemble/boosting.py:955: RuntimeWarning: divide by zero encountered in log
  time = numpy.log(time)
/media/san2_ssd/data/Workdir/survival/venv/lib/python3.8/site-packages/sksurv/ensemble/boosting.py:955: RuntimeWarning: divide by zero encountered in log
  time = numpy.log(time)
/media/san2_ssd/data/Workdir/survival/venv/lib/python3.8/site-packages/sksurv/ensemble/boosting.py:955: RuntimeWarning: divide by zero encountered in log
  time = numpy.log(time)
[32m[I 2022-04-21 17:19:26,547][0m Trial 649 finished with value: -0.4668385039427065 and parameters: {'loss': 'squared', 'learning_rate': 0.005731591189780619, 'n_estimators': 885, 'criterion': 'friedman_mse', 'min_samples_split': 2, 'min_samples_leaf': 7, 'min_weight_fraction_leaf': 0.004515132734596186, 'min_impurity_decrease': 0.9653885303287788, 'max_features': 0.3202423602742086, 'subsample': 0.3170130680586639, 'dropout_rate': 0.1612190447062738, 'ccp_alpha': 0.006329019344844479}. Best is trial 486 with value: 0.8320137528916117.[0m
[32m[I 2022-04-21 17:23:08,425][0m Trial 650 finished with value: 0.5961733286262227 and parameters: {'loss': 'coxph', 'learning_rate': 0.004448818582382622, 'n_estimators': 794, 'criterion': 'friedman_mse', 'min_samples_split': 2, 'min_samples_leaf': 5, 'min_weight_fraction_leaf': 0.006735544195391624, 'min_impurity_decrease': 0.846803980888895, 'max_features': 0.3354685731543954, 'subsample': 0.351024173064662, 'dropout_rate': 0.07978908374141408, 'ccp_alpha': 0.1744587871749246}. Best is trial 486 with value: 0.8320137528916117.[0m
[32m[I 2022-04-21 17:26:24,046][0m Trial 651 finished with value: 0.8311316442121697 and parameters: {'loss': 'coxph', 'learning_rate': 0.006588537359447627, 'n_estimators': 800, 'criterion': 'friedman_mse', 'min_samples_split': 2, 'min_samples_leaf': 5, 'min_weight_fraction_leaf': 0.015693875390753224, 'min_impurity_decrease': 0.8952754172945626, 'max_features': 0.26954749694112484, 'subsample': 0.31720647100133526, 'dropout_rate': 0.3023007347729384, 'ccp_alpha': 0.004406283923143425}. Best is trial 486 with value: 0.8320137528916117.[0m
[32m[I 2022-04-21 17:30:48,804][0m Trial 652 finished with value: 0.8278024779535323 and parameters: {'loss': 'coxph', 'learning_rate': 0.005881201584655327, 'n_estimators': 901, 'criterion': 'friedman_mse', 'min_samples_split': 2, 'min_samples_leaf': 6, 'min_weight_fraction_leaf': 0.017223853043416257, 'min_impurity_decrease': 0.8994719369074432, 'max_features': 0.26646976550480883, 'subsample': 0.3042674330757719, 'dropout_rate': 0.3311277687433002, 'ccp_alpha': 0.09623685748833757}. Best is trial 486 with value: 0.8320137528916117.[0m
[32m[I 2022-04-21 17:33:59,370][0m Trial 653 finished with value: 0.25 and parameters: {'loss': 'coxph', 'learning_rate': 0.006322118973419307, 'n_estimators': 829, 'criterion': 'friedman_mse', 'min_samples_split': 2, 'min_samples_leaf': 6, 'min_weight_fraction_leaf': 0.022613627622369417, 'min_impurity_decrease': 0.9274282532569413, 'max_features': 0.24866189139611386, 'subsample': 0.2937895574948749, 'dropout_rate': 0.3147893252020011, 'ccp_alpha': 3.438742684548903}. Best is trial 486 with value: 0.8320137528916117.[0m
[32m[I 2022-04-21 17:36:53,828][0m Trial 654 finished with value: 0.3724754458444661 and parameters: {'loss': 'coxph', 'learning_rate': 0.004361965860270012, 'n_estimators': 761, 'criterion': 'friedman_mse', 'min_samples_split': 2, 'min_samples_leaf': 6, 'min_weight_fraction_leaf': 0.019169362696391547, 'min_impurity_decrease': 0.8584360060726165, 'max_features': 0.2668604195183832, 'subsample': 0.3183658098627586, 'dropout_rate': 0.27829318778942896, 'ccp_alpha': 0.2454189398556151}. Best is trial 486 with value: 0.8320137528916117.[0m
[32m[I 2022-04-21 17:40:17,524][0m Trial 655 finished with value: 0.8317266235971392 and parameters: {'loss': 'coxph', 'learning_rate': 0.004797242712894837, 'n_estimators': 811, 'criterion': 'friedman_mse', 'min_samples_split': 2, 'min_samples_leaf': 6, 'min_weight_fraction_leaf': 0.009987542169610642, 'min_impurity_decrease': 0.854574841930571, 'max_features': 0.2772057572709968, 'subsample': 0.3273074673532654, 'dropout_rate': 0.2995719585896992, 'ccp_alpha': 0.002870078570190983}. Best is trial 486 with value: 0.8320137528916117.[0m
[32m[I 2022-04-21 17:44:11,391][0m Trial 656 finished with value: 0.8232204653397897 and parameters: {'loss': 'coxph', 'learning_rate': 0.005107211464886726, 'n_estimators': 887, 'criterion': 'friedman_mse', 'min_samples_split': 2, 'min_samples_leaf': 6, 'min_weight_fraction_leaf': 0.014191249938273686, 'min_impurity_decrease': 0.8733086415215774, 'max_features': 0.27156738506993344, 'subsample': 0.33099226109798324, 'dropout_rate': 0.30553418925535775, 'ccp_alpha': 0.09623435310880428}. Best is trial 486 with value: 0.8320137528916117.[0m
[32m[I 2022-04-21 17:47:35,815][0m Trial 657 finished with value: 0.25 and parameters: {'loss': 'coxph', 'learning_rate': 0.007508889788389174, 'n_estimators': 861, 'criterion': 'squared_error', 'min_samples_split': 2, 'min_samples_leaf': 6, 'min_weight_fraction_leaf': 0.015763412866633603, 'min_impurity_decrease': 0.8929682602739869, 'max_features': 0.2287737056955874, 'subsample': 0.3266645361487162, 'dropout_rate': 0.2926921682693307, 'ccp_alpha': 0.0017032414379557527}. Best is trial 486 with value: 0.8320137528916117.[0m
[32m[I 2022-04-21 17:50:36,543][0m Trial 658 finished with value: 0.6994789724890953 and parameters: {'loss': 'coxph', 'learning_rate': 0.006572269944462573, 'n_estimators': 847, 'criterion': 'friedman_mse', 'min_samples_split': 2, 'min_samples_leaf': 6, 'min_weight_fraction_leaf': 0.0015891783011844325, 'min_impurity_decrease': 0.9135624288864241, 'max_features': 0.29830641878941805, 'subsample': 0.36095824400589493, 'dropout_rate': 0.36884072704246873, 'ccp_alpha': 0.17469632200897556}. Best is trial 486 with value: 0.8320137528916117.[0m
[32m[I 2022-04-21 17:55:36,205][0m Trial 659 finished with value: 0.25 and parameters: {'loss': 'coxph', 'learning_rate': 0.008216007418822663, 'n_estimators': 948, 'criterion': 'absolute_error', 'min_samples_split': 2, 'min_samples_leaf': 6, 'min_weight_fraction_leaf': 0.012318905845892264, 'min_impurity_decrease': 0.8926484312930567, 'max_features': 0.2818778425654501, 'subsample': 0.8667099945405083, 'dropout_rate': 0.2545444537566699, 'ccp_alpha': 3.2961968321567325}. Best is trial 486 with value: 0.8320137528916117.[0m
[32m[I 2022-04-21 17:59:00,082][0m Trial 660 finished with value: 0.8235472518084844 and parameters: {'loss': 'coxph', 'learning_rate': 0.00501601341033818, 'n_estimators': 828, 'criterion': 'friedman_mse', 'min_samples_split': 2, 'min_samples_leaf': 6, 'min_weight_fraction_leaf': 0.009751450047263577, 'min_impurity_decrease': 0.8824415418466893, 'max_features': 0.25741116976671713, 'subsample': 0.30816295284490847, 'dropout_rate': 0.31853589096443813, 'ccp_alpha': 0.09331020321925179}. Best is trial 486 with value: 0.8320137528916117.[0m
[32m[I 2022-04-21 18:03:20,531][0m Trial 661 finished with value: 0.8309984243879379 and parameters: {'loss': 'coxph', 'learning_rate': 0.005935712010439676, 'n_estimators': 832, 'criterion': 'friedman_mse', 'min_samples_split': 2, 'min_samples_leaf': 7, 'min_weight_fraction_leaf': 0.020268944309270422, 'min_impurity_decrease': 0.9277431632709429, 'max_features': 0.3051093462664815, 'subsample': 0.34413351686666066, 'dropout_rate': 0.28692479361560513, 'ccp_alpha': 0.0018656280665420527}. Best is trial 486 with value: 0.8320137528916117.[0m
[32m[I 2022-04-21 18:07:22,432][0m Trial 662 finished with value: 0.25886811916973224 and parameters: {'loss': 'coxph', 'learning_rate': 0.004619637858322604, 'n_estimators': 860, 'criterion': 'friedman_mse', 'min_samples_split': 2, 'min_samples_leaf': 6, 'min_weight_fraction_leaf': 0.019409657924486227, 'min_impurity_decrease': 0.9250160573067238, 'max_features': 0.304564450651544, 'subsample': 0.34227382874796813, 'dropout_rate': 0.2695732327539762, 'ccp_alpha': 0.25847865150602156}. Best is trial 486 with value: 0.8320137528916117.[0m
[32m[I 2022-04-21 18:10:21,338][0m Trial 663 finished with value: 0.25 and parameters: {'loss': 'coxph', 'learning_rate': 0.0062904720160694184, 'n_estimators': 825, 'criterion': 'friedman_mse', 'min_samples_split': 2, 'min_samples_leaf': 7, 'min_weight_fraction_leaf': 0.01025735840726955, 'min_impurity_decrease': 0.9102763345754792, 'max_features': 0.29140488128325276, 'subsample': 0.361714624551351, 'dropout_rate': 0.31864820649498343, 'ccp_alpha': 0.42735285523345407}. Best is trial 486 with value: 0.8320137528916117.[0m
[32m[I 2022-04-21 18:14:03,698][0m Trial 664 finished with value: 0.8342316538423719 and parameters: {'loss': 'coxph', 'learning_rate': 0.005572339735315853, 'n_estimators': 815, 'criterion': 'friedman_mse', 'min_samples_split': 2, 'min_samples_leaf': 7, 'min_weight_fraction_leaf': 0.0012810954291225807, 'min_impurity_decrease': 0.9338140230576383, 'max_features': 0.23775963970847247, 'subsample': 0.32358724358158886, 'dropout_rate': 0.20043817808261977, 'ccp_alpha': 0.001640732255497497}. Best is trial 664 with value: 0.8342316538423719.[0m
[32m[I 2022-04-21 18:18:10,958][0m Trial 665 finished with value: 0.693555326785616 and parameters: {'loss': 'coxph', 'learning_rate': 0.004780987166120787, 'n_estimators': 864, 'criterion': 'friedman_mse', 'min_samples_split': 2, 'min_samples_leaf': 6, 'min_weight_fraction_leaf': 0.008996709004498216, 'min_impurity_decrease': 0.9466748185018226, 'max_features': 0.2412194802575878, 'subsample': 0.3260897914786043, 'dropout_rate': 0.196965416608792, 'ccp_alpha': 0.17355782624506702}. Best is trial 664 with value: 0.8342316538423719.[0m
[32m[I 2022-04-21 18:22:41,000][0m Trial 666 finished with value: 0.8252860047640507 and parameters: {'loss': 'coxph', 'learning_rate': 0.0043411194279392535, 'n_estimators': 899, 'criterion': 'friedman_mse', 'min_samples_split': 2, 'min_samples_leaf': 6, 'min_weight_fraction_leaf': 0.02070269288855568, 'min_impurity_decrease': 0.9380879578380322, 'max_features': 0.22104718291162184, 'subsample': 0.3229457312158973, 'dropout_rate': 0.17562168481147122, 'ccp_alpha': 0.1015795225123644}. Best is trial 664 with value: 0.8342316538423719.[0m
[32m[I 2022-04-21 18:26:18,574][0m Trial 667 finished with value: 0.2503270102305002 and parameters: {'loss': 'coxph', 'learning_rate': 0.008095068573579455, 'n_estimators': 814, 'criterion': 'friedman_mse', 'min_samples_split': 2, 'min_samples_leaf': 7, 'min_weight_fraction_leaf': 0.008963908298452198, 'min_impurity_decrease': 0.881116302335971, 'max_features': 0.1914787511960574, 'subsample': 0.3447851518640641, 'dropout_rate': 0.21994529636739263, 'ccp_alpha': 0.32970618912618077}. Best is trial 664 with value: 0.8342316538423719.[0m
