[32m[I 2022-04-22 21:06:17,929][0m Trial 408 finished with value: 0.6531168767208442 and parameters: {'loss': 'coxph', 'learning_rate': 0.07946940071840868, 'n_estimators': 861, 'criterion': 'friedman_mse', 'min_samples_split': 10, 'min_samples_leaf': 3, 'min_weight_fraction_leaf': 0.06779324765171703, 'min_impurity_decrease': 0.879222222290558, 'max_features': 0.721891591718164, 'subsample': 0.28292783295436974, 'dropout_rate': 0.2351188665078441, 'ccp_alpha': 0.09041497209820532}. Best is trial 218 with value: 0.6659976583847056.[0m
[32m[I 2022-04-22 21:09:04,980][0m Trial 409 finished with value: 0.5 and parameters: {'loss': 'coxph', 'learning_rate': 0.04116865874732106, 'n_estimators': 907, 'criterion': 'friedman_mse', 'min_samples_split': 10, 'min_samples_leaf': 3, 'min_weight_fraction_leaf': 0.04801060462167575, 'min_impurity_decrease': 0.842465466885027, 'max_features': 0.7292091391727485, 'subsample': 0.24699241765691443, 'dropout_rate': 0.3164161122228062, 'ccp_alpha': 2.6184160559400227}. Best is trial 218 with value: 0.6659976583847056.[0m
[32m[I 2022-04-22 21:10:55,802][0m Trial 410 finished with value: 0.5 and parameters: {'loss': 'coxph', 'learning_rate': 0.0645416393537716, 'n_estimators': 858, 'criterion': 'friedman_mse', 'min_samples_split': 10, 'min_samples_leaf': 4, 'min_weight_fraction_leaf': 0.07582497935724204, 'min_impurity_decrease': 0.9697402052151021, 'max_features': 0.7462956012422864, 'subsample': 0.2874512923474623, 'dropout_rate': 0.5382938866907842, 'ccp_alpha': 3.1982877921746757}. Best is trial 218 with value: 0.6659976583847056.[0m
[32m[I 2022-04-22 21:14:02,893][0m Trial 411 finished with value: 0.5 and parameters: {'loss': 'coxph', 'learning_rate': 0.046391580714156076, 'n_estimators': 929, 'criterion': 'squared_error', 'min_samples_split': 10, 'min_samples_leaf': 3, 'min_weight_fraction_leaf': 0.05345522096335639, 'min_impurity_decrease': 0.8879552575506875, 'max_features': 0.7077369192214593, 'subsample': 0.2710801578327272, 'dropout_rate': 0.2635993886538389, 'ccp_alpha': 0.08766334689255419}. Best is trial 218 with value: 0.6659976583847056.[0m
[32m[I 2022-04-22 21:16:24,825][0m Trial 412 finished with value: 0.6586009375767519 and parameters: {'loss': 'coxph', 'learning_rate': 0.02802553077005342, 'n_estimators': 815, 'criterion': 'friedman_mse', 'min_samples_split': 10, 'min_samples_leaf': 3, 'min_weight_fraction_leaf': 0.06781137458998285, 'min_impurity_decrease': 0.9236368963380334, 'max_features': 0.6885545715210184, 'subsample': 0.3041714741701913, 'dropout_rate': 0.3428246682738246, 'ccp_alpha': 0.0018559217121932128}. Best is trial 218 with value: 0.6659976583847056.[0m
[32m[I 2022-04-22 21:18:41,262][0m Trial 413 finished with value: 0.6484439783023236 and parameters: {'loss': 'coxph', 'learning_rate': 0.08673764794474483, 'n_estimators': 759, 'criterion': 'friedman_mse', 'min_samples_split': 10, 'min_samples_leaf': 3, 'min_weight_fraction_leaf': 0.07965544678519311, 'min_impurity_decrease': 0.8688668613784294, 'max_features': 0.7523086758453116, 'subsample': 0.24667877955138257, 'dropout_rate': 0.20191833851981267, 'ccp_alpha': 0.18172216876468808}. Best is trial 218 with value: 0.6659976583847056.[0m
[32m[I 2022-04-22 21:21:33,571][0m Trial 414 finished with value: 0.5720420534194033 and parameters: {'loss': 'coxph', 'learning_rate': 0.05755172997823397, 'n_estimators': 877, 'criterion': 'friedman_mse', 'min_samples_split': 10, 'min_samples_leaf': 3, 'min_weight_fraction_leaf': 0.05752338658043599, 'min_impurity_decrease': 0.9430303707635688, 'max_features': 0.6715195748705542, 'subsample': 0.22490321926742335, 'dropout_rate': 0.24533191574801833, 'ccp_alpha': 0.3057833845178342}. Best is trial 218 with value: 0.6659976583847056.[0m
[32m[I 2022-04-22 21:25:09,685][0m Trial 415 finished with value: 0.6549190984770688 and parameters: {'loss': 'coxph', 'learning_rate': 0.03377404390371684, 'n_estimators': 959, 'criterion': 'friedman_mse', 'min_samples_split': 10, 'min_samples_leaf': 3, 'min_weight_fraction_leaf': 0.07329106089905046, 'min_impurity_decrease': 0.8146902812626143, 'max_features': 0.7174139679935474, 'subsample': 0.2944479020350873, 'dropout_rate': 0.22603400562288598, 'ccp_alpha': 0.09411763137863628}. Best is trial 218 with value: 0.6659976583847056.[0m
[32m[I 2022-04-22 21:26:28,407][0m Trial 416 finished with value: 0.6253699448949561 and parameters: {'loss': 'coxph', 'learning_rate': 0.04247361802375643, 'n_estimators': 576, 'criterion': 'friedman_mse', 'min_samples_split': 10, 'min_samples_leaf': 3, 'min_weight_fraction_leaf': 0.10006754397529538, 'min_impurity_decrease': 0.9088297195254088, 'max_features': 0.6985209023891868, 'subsample': 0.2663762044660115, 'dropout_rate': 0.21026288530623868, 'ccp_alpha': 0.18786329373459634}. Best is trial 218 with value: 0.6659976583847056.[0m
/media/san2_ssd/data/Workdir/survival/venv/lib/python3.8/site-packages/sksurv/ensemble/boosting.py:955: RuntimeWarning: divide by zero encountered in log
  time = numpy.log(time)
/media/san2_ssd/data/Workdir/survival/venv/lib/python3.8/site-packages/sksurv/ensemble/boosting.py:955: RuntimeWarning: divide by zero encountered in log
  time = numpy.log(time)
/media/san2_ssd/data/Workdir/survival/venv/lib/python3.8/site-packages/sksurv/ensemble/boosting.py:955: RuntimeWarning: divide by zero encountered in log
  time = numpy.log(time)
/media/san2_ssd/data/Workdir/survival/venv/lib/python3.8/site-packages/sksurv/ensemble/boosting.py:955: RuntimeWarning: divide by zero encountered in log
  time = numpy.log(time)
[32m[I 2022-04-22 21:27:06,313][0m Trial 417 finished with value: -0.7228764502474097 and parameters: {'loss': 'squared', 'learning_rate': 0.06403499413092531, 'n_estimators': 917, 'criterion': 'friedman_mse', 'min_samples_split': 10, 'min_samples_leaf': 3, 'min_weight_fraction_leaf': 0.1954238894158496, 'min_impurity_decrease': 0.9807190454060583, 'max_features': 0.5729099736166796, 'subsample': 0.3374748453672805, 'dropout_rate': 0.28805079039386433, 'ccp_alpha': 0.007448431908202701}. Best is trial 218 with value: 0.6659976583847056.[0m
[32m[I 2022-04-22 21:28:25,360][0m Trial 418 finished with value: 0.6631473189030151 and parameters: {'loss': 'coxph', 'learning_rate': 0.09859603788357486, 'n_estimators': 546, 'criterion': 'friedman_mse', 'min_samples_split': 10, 'min_samples_leaf': 3, 'min_weight_fraction_leaf': 0.0845716635751443, 'min_impurity_decrease': 0.8880725262700051, 'max_features': 0.7712243589364421, 'subsample': 0.3071351398140228, 'dropout_rate': 0.18253429594252085, 'ccp_alpha': 0.0019451660877649977}. Best is trial 218 with value: 0.6659976583847056.[0m
[32m[I 2022-04-22 21:29:34,415][0m Trial 419 finished with value: 0.6471782531526424 and parameters: {'loss': 'coxph', 'learning_rate': 0.07616951833630571, 'n_estimators': 550, 'criterion': 'friedman_mse', 'min_samples_split': 10, 'min_samples_leaf': 4, 'min_weight_fraction_leaf': 0.11338233800057691, 'min_impurity_decrease': 0.9992408299212113, 'max_features': 0.7819386906508503, 'subsample': 0.2805237880570226, 'dropout_rate': 0.3094276084973523, 'ccp_alpha': 0.1192315838011436}. Best is trial 218 with value: 0.6659976583847056.[0m
[32m[I 2022-04-22 21:31:04,337][0m Trial 420 finished with value: 0.5619472483870744 and parameters: {'loss': 'coxph', 'learning_rate': 0.09321626182259767, 'n_estimators': 604, 'criterion': 'friedman_mse', 'min_samples_split': 10, 'min_samples_leaf': 3, 'min_weight_fraction_leaf': 0.08685195804408417, 'min_impurity_decrease': 0.8538337632468301, 'max_features': 0.7862495110174288, 'subsample': 0.30551701748468796, 'dropout_rate': 0.18061009954199148, 'ccp_alpha': 0.2522608652047957}. Best is trial 218 with value: 0.6659976583847056.[0m
[32m[I 2022-04-22 21:34:07,035][0m Trial 421 finished with value: 0.6590899470235299 and parameters: {'loss': 'coxph', 'learning_rate': 0.09077474641795538, 'n_estimators': 832, 'criterion': 'friedman_mse', 'min_samples_split': 10, 'min_samples_leaf': 3, 'min_weight_fraction_leaf': 0.09522504429801698, 'min_impurity_decrease': 0.3692859316703705, 'max_features': 0.7563212137708223, 'subsample': 0.24531908725066848, 'dropout_rate': 0.18457497384567859, 'ccp_alpha': 0.00441653609676154}. Best is trial 218 with value: 0.6659976583847056.[0m
[32m[I 2022-04-22 21:37:23,829][0m Trial 422 finished with value: 0.6399077491369414 and parameters: {'loss': 'coxph', 'learning_rate': 0.0698318102035013, 'n_estimators': 989, 'criterion': 'friedman_mse', 'min_samples_split': 10, 'min_samples_leaf': 3, 'min_weight_fraction_leaf': 0.08615394365153127, 'min_impurity_decrease': 0.9257310979356692, 'max_features': 0.8045449793159374, 'subsample': 0.261545395391633, 'dropout_rate': 0.33090286389717827, 'ccp_alpha': 0.16357678442974435}. Best is trial 218 with value: 0.6659976583847056.[0m
[32m[I 2022-04-22 21:38:33,764][0m Trial 423 finished with value: 0.6499506087193236 and parameters: {'loss': 'coxph', 'learning_rate': 0.056977768125405275, 'n_estimators': 552, 'criterion': 'friedman_mse', 'min_samples_split': 10, 'min_samples_leaf': 3, 'min_weight_fraction_leaf': 0.06266210706632398, 'min_impurity_decrease': 0.8785519642464598, 'max_features': 0.8189173627598391, 'subsample': 0.2886753681433263, 'dropout_rate': 0.26748324100361187, 'ccp_alpha': 0.09651606789097927}. Best is trial 218 with value: 0.6659976583847056.[0m
[32m[I 2022-04-22 21:39:41,286][0m Trial 424 finished with value: 0.5 and parameters: {'loss': 'coxph', 'learning_rate': 0.09741405068994062, 'n_estimators': 577, 'criterion': 'friedman_mse', 'min_samples_split': 10, 'min_samples_leaf': 3, 'min_weight_fraction_leaf': 0.10527117414537891, 'min_impurity_decrease': 0.9653276992914729, 'max_features': 0.5448931733424283, 'subsample': 0.30706990215179747, 'dropout_rate': 0.3477619528171957, 'ccp_alpha': 0.3805276458302314}. Best is trial 218 with value: 0.6659976583847056.[0m
[32m[I 2022-04-22 21:40:46,547][0m Trial 425 finished with value: 0.6498604578369558 and parameters: {'loss': 'coxph', 'learning_rate': 0.07156952111047711, 'n_estimators': 535, 'criterion': 'friedman_mse', 'min_samples_split': 10, 'min_samples_leaf': 4, 'min_weight_fraction_leaf': 0.12549944619584458, 'min_impurity_decrease': 0.9059735613019302, 'max_features': 0.7733535070954187, 'subsample': 0.22360387193695935, 'dropout_rate': 0.25356133777896833, 'ccp_alpha': 0.11150625025602776}. Best is trial 218 with value: 0.6659976583847056.[0m
[32m[I 2022-04-22 21:42:57,544][0m Trial 426 finished with value: 0.5633974513596522 and parameters: {'loss': 'coxph', 'learning_rate': 0.051024546618805816, 'n_estimators': 794, 'criterion': 'friedman_mse', 'min_samples_split': 10, 'min_samples_leaf': 3, 'min_weight_fraction_leaf': 0.04291278858373371, 'min_impurity_decrease': 0.936012754773829, 'max_features': 0.558521138573115, 'subsample': 0.277090610957694, 'dropout_rate': 0.29493154592331466, 'ccp_alpha': 0.24543388031876354}. Best is trial 218 with value: 0.6659976583847056.[0m
[32m[I 2022-04-22 21:44:02,565][0m Trial 427 finished with value: 0.5 and parameters: {'loss': 'coxph', 'learning_rate': 0.09947442077919376, 'n_estimators': 526, 'criterion': 'absolute_error', 'min_samples_split': 10, 'min_samples_leaf': 3, 'min_weight_fraction_leaf': 0.08273096974958626, 'min_impurity_decrease': 0.8812197409810496, 'max_features': 0.6033766845906624, 'subsample': 0.25553934247811083, 'dropout_rate': 0.23360277678483604, 'ccp_alpha': 0.09375792478925964}. Best is trial 218 with value: 0.6659976583847056.[0m
[32m[I 2022-04-22 21:45:19,973][0m Trial 428 finished with value: 0.5847465066620734 and parameters: {'loss': 'coxph', 'learning_rate': 0.023463868817418763, 'n_estimators': 568, 'criterion': 'friedman_mse', 'min_samples_split': 10, 'min_samples_leaf': 3, 'min_weight_fraction_leaf': 0.06831538053698981, 'min_impurity_decrease': 0.8322553835130361, 'max_features': 0.5423986466268838, 'subsample': 0.3238009633203351, 'dropout_rate': 0.19258564384206914, 'ccp_alpha': 0.18148647594840883}. Best is trial 218 with value: 0.6659976583847056.[0m
[32m[I 2022-04-22 21:46:15,711][0m Trial 429 finished with value: 0.5 and parameters: {'loss': 'coxph', 'learning_rate': 0.07577285482461477, 'n_estimators': 523, 'criterion': 'friedman_mse', 'min_samples_split': 10, 'min_samples_leaf': 3, 'min_weight_fraction_leaf': 0.09433957862602169, 'min_impurity_decrease': 0.9554280640289174, 'max_features': 0.5825640150808076, 'subsample': 0.2930004490520346, 'dropout_rate': 0.3531458037426457, 'ccp_alpha': 0.7672443122533441}. Best is trial 218 with value: 0.6659976583847056.[0m
[32m[I 2022-04-22 21:48:24,519][0m Trial 430 finished with value: 0.661112636270266 and parameters: {'loss': 'coxph', 'learning_rate': 0.05082634152146848, 'n_estimators': 749, 'criterion': 'friedman_mse', 'min_samples_split': 10, 'min_samples_leaf': 3, 'min_weight_fraction_leaf': 0.07856481607935509, 'min_impurity_decrease': 0.914808110877152, 'max_features': 0.747273907321003, 'subsample': 0.2353665736513651, 'dropout_rate': 0.31996709818419367, 'ccp_alpha': 0.004972446752044685}. Best is trial 218 with value: 0.6659976583847056.[0m
[32m[I 2022-04-22 21:51:08,712][0m Trial 431 finished with value: 0.6311635910073277 and parameters: {'loss': 'coxph', 'learning_rate': 0.03473263401700119, 'n_estimators': 846, 'criterion': 'friedman_mse', 'min_samples_split': 10, 'min_samples_leaf': 3, 'min_weight_fraction_leaf': 0.054740717330854796, 'min_impurity_decrease': 0.8660158214945455, 'max_features': 0.6783700424906629, 'subsample': 0.6876762187225959, 'dropout_rate': 0.26896534654665244, 'ccp_alpha': 0.08295535540759164}. Best is trial 218 with value: 0.6659976583847056.[0m
[32m[I 2022-04-22 21:52:01,525][0m Trial 432 finished with value: 0.5499574280638839 and parameters: {'loss': 'coxph', 'learning_rate': 0.061306382254287015, 'n_estimators': 468, 'criterion': 'friedman_mse', 'min_samples_split': 10, 'min_samples_leaf': 3, 'min_weight_fraction_leaf': 0.06924182840498984, 'min_impurity_decrease': 0.8962491165840638, 'max_features': 0.532890686157404, 'subsample': 0.2681483296091979, 'dropout_rate': 0.2127881000434748, 'ccp_alpha': 0.2828305914819971}. Best is trial 218 with value: 0.6659976583847056.[0m
[32m[I 2022-04-22 21:53:20,598][0m Trial 433 finished with value: 0.5 and parameters: {'loss': 'coxph', 'learning_rate': 0.028017976152289698, 'n_estimators': 638, 'criterion': 'squared_error', 'min_samples_split': 10, 'min_samples_leaf': 3, 'min_weight_fraction_leaf': 0.08531534702071897, 'min_impurity_decrease': 0.9345842713117138, 'max_features': 0.7066696664881246, 'subsample': 0.3101247659811376, 'dropout_rate': 0.3640884957290506, 'ccp_alpha': 0.006877306495537439}. Best is trial 218 with value: 0.6659976583847056.[0m
[32m[I 2022-04-22 21:54:17,367][0m Trial 434 finished with value: 0.5758208394588863 and parameters: {'loss': 'coxph', 'learning_rate': 0.044867364755021136, 'n_estimators': 501, 'criterion': 'friedman_mse', 'min_samples_split': 10, 'min_samples_leaf': 3, 'min_weight_fraction_leaf': 0.10304363534081233, 'min_impurity_decrease': 0.9164131663646964, 'max_features': 0.5640796350603681, 'subsample': 0.3336068335968406, 'dropout_rate': 0.2466104902955133, 'ccp_alpha': 0.18323449200236316}. Best is trial 218 with value: 0.6659976583847056.[0m
[32m[I 2022-04-22 21:55:39,917][0m Trial 435 finished with value: 0.6629287605623773 and parameters: {'loss': 'coxph', 'learning_rate': 0.07653424651997034, 'n_estimators': 596, 'criterion': 'friedman_mse', 'min_samples_split': 10, 'min_samples_leaf': 3, 'min_weight_fraction_leaf': 0.06169881150447264, 'min_impurity_decrease': 0.955684782779216, 'max_features': 0.1454918756071178, 'subsample': 0.2824936391757544, 'dropout_rate': 0.27901076460023194, 'ccp_alpha': 0.0012688677353488928}. Best is trial 218 with value: 0.6659976583847056.[0m
/media/san2_ssd/data/Workdir/survival/venv/lib/python3.8/site-packages/sksurv/ensemble/boosting.py:955: RuntimeWarning: divide by zero encountered in log
  time = numpy.log(time)
/media/san2_ssd/data/Workdir/survival/venv/lib/python3.8/site-packages/sksurv/ensemble/boosting.py:955: RuntimeWarning: divide by zero encountered in log
  time = numpy.log(time)
/media/san2_ssd/data/Workdir/survival/venv/lib/python3.8/site-packages/sksurv/ensemble/boosting.py:955: RuntimeWarning: divide by zero encountered in log
  time = numpy.log(time)
/media/san2_ssd/data/Workdir/survival/venv/lib/python3.8/site-packages/sksurv/ensemble/boosting.py:955: RuntimeWarning: divide by zero encountered in log
  time = numpy.log(time)
[32m[I 2022-04-22 21:56:14,950][0m Trial 436 finished with value: -0.7355150491407283 and parameters: {'loss': 'squared', 'learning_rate': 0.08022804139724701, 'n_estimators': 898, 'criterion': 'friedman_mse', 'min_samples_split': 10, 'min_samples_leaf': 3, 'min_weight_fraction_leaf': 0.037920018983559886, 'min_impurity_decrease': 0.9480158143486638, 'max_features': 0.6069378768683257, 'subsample': 0.27820110705176226, 'dropout_rate': 0.3250697109051503, 'ccp_alpha': 0.10183356469917101}. Best is trial 218 with value: 0.6659976583847056.[0m
[32m[I 2022-04-22 21:57:19,269][0m Trial 437 finished with value: 0.6152843022771022 and parameters: {'loss': 'coxph', 'learning_rate': 8.976854499722812e-05, 'n_estimators': 528, 'criterion': 'friedman_mse', 'min_samples_split': 10, 'min_samples_leaf': 3, 'min_weight_fraction_leaf': 0.05548834992076278, 'min_impurity_decrease': 0.8922991612964336, 'max_features': 0.1635351286746618, 'subsample': 0.25414746004503125, 'dropout_rate': 0.2843426836606646, 'ccp_alpha': 0.17609168551246862}. Best is trial 218 with value: 0.6659976583847056.[0m
[32m[I 2022-04-22 21:58:42,911][0m Trial 438 finished with value: 0.6525672944931327 and parameters: {'loss': 'coxph', 'learning_rate': 0.06723182368289973, 'n_estimators': 596, 'criterion': 'friedman_mse', 'min_samples_split': 10, 'min_samples_leaf': 3, 'min_weight_fraction_leaf': 0.04468145253846868, 'min_impurity_decrease': 0.8478392016859868, 'max_features': 0.5898094144496506, 'subsample': 0.2164904940342541, 'dropout_rate': 0.3082527489954393, 'ccp_alpha': 0.0033275011511490604}. Best is trial 218 with value: 0.6659976583847056.[0m
[32m[I 2022-04-22 21:59:30,892][0m Trial 439 finished with value: 0.649471766192395 and parameters: {'loss': 'coxph', 'learning_rate': 0.09982993932663671, 'n_estimators': 462, 'criterion': 'friedman_mse', 'min_samples_split': 10, 'min_samples_leaf': 3, 'min_weight_fraction_leaf': 0.06133999274906528, 'min_impurity_decrease': 0.9200449725560742, 'max_features': 0.8368509195388949, 'subsample': 0.2924090996648616, 'dropout_rate': 0.2878611951459206, 'ccp_alpha': 0.0929563899169438}. Best is trial 218 with value: 0.6659976583847056.[0m
[32m[I 2022-04-22 22:01:14,379][0m Trial 440 finished with value: 0.5126008909630098 and parameters: {'loss': 'coxph', 'learning_rate': 0.020404444138754724, 'n_estimators': 694, 'criterion': 'friedman_mse', 'min_samples_split': 10, 'min_samples_leaf': 7, 'min_weight_fraction_leaf': 0.07191557385748829, 'min_impurity_decrease': 0.8691442226120332, 'max_features': 0.007643596118458773, 'subsample': 0.24082955226287517, 'dropout_rate': 0.3051474689139257, 'ccp_alpha': 0.3112097944865358}. Best is trial 218 with value: 0.6659976583847056.[0m
[32m[I 2022-04-22 22:02:08,064][0m Trial 441 finished with value: 0.6012417969392297 and parameters: {'loss': 'coxph', 'learning_rate': 0.07864260970577225, 'n_estimators': 491, 'criterion': 'friedman_mse', 'min_samples_split': 10, 'min_samples_leaf': 3, 'min_weight_fraction_leaf': 0.0632426308313845, 'min_impurity_decrease': 0.9337398333880998, 'max_features': 0.570633591432805, 'subsample': 0.27103122282188086, 'dropout_rate': 0.26962070532190535, 'ccp_alpha': 0.1756461799853719}. Best is trial 218 with value: 0.6659976583847056.[0m
[32m[I 2022-04-22 22:03:16,352][0m Trial 442 finished with value: 0.6604022748964015 and parameters: {'loss': 'coxph', 'learning_rate': 0.06546373953845652, 'n_estimators': 536, 'criterion': 'friedman_mse', 'min_samples_split': 10, 'min_samples_leaf': 3, 'min_weight_fraction_leaf': 0.05027464783475312, 'min_impurity_decrease': 0.8913466414166769, 'max_features': 0.6580027763120412, 'subsample': 0.2561625331869711, 'dropout_rate': 0.2638176289732417, 'ccp_alpha': 0.0035623750071993275}. Best is trial 218 with value: 0.6659976583847056.[0m
[32m[I 2022-04-22 22:06:08,619][0m Trial 443 finished with value: 0.6498329638675672 and parameters: {'loss': 'coxph', 'learning_rate': 0.016225873910598588, 'n_estimators': 934, 'criterion': 'friedman_mse', 'min_samples_split': 10, 'min_samples_leaf': 3, 'min_weight_fraction_leaf': 0.07632980365489768, 'min_impurity_decrease': 0.9083702336605236, 'max_features': 0.6199013339745262, 'subsample': 0.2989673713798965, 'dropout_rate': 0.338725041858861, 'ccp_alpha': 0.10941990687057573}. Best is trial 218 with value: 0.6659976583847056.[0m
[32m[I 2022-04-22 22:07:05,062][0m Trial 444 finished with value: 0.6277880171887761 and parameters: {'loss': 'coxph', 'learning_rate': 0.06222668617233757, 'n_estimators': 470, 'criterion': 'friedman_mse', 'min_samples_split': 10, 'min_samples_leaf': 3, 'min_weight_fraction_leaf': 0.06470117960368059, 'min_impurity_decrease': 0.9564796079671101, 'max_features': 0.5465256912141615, 'subsample': 0.2818899745583119, 'dropout_rate': 0.20072106566764242, 'ccp_alpha': 0.2091903116748688}. Best is trial 218 with value: 0.6659976583847056.[0m
