[32m[I 2022-04-21 13:39:35,337][0m Trial 746 finished with value: 0.91497034203054 and parameters: {'alpha': 2.1494679490821995, 'ties': 'breslow'}. Best is trial 411 with value: 0.91502674920718.[0m
[32m[I 2022-04-21 13:39:46,289][0m Trial 747 finished with value: 0.9149927724889796 and parameters: {'alpha': 2.0107874465902786, 'ties': 'breslow'}. Best is trial 411 with value: 0.91502674920718.[0m
[32m[I 2022-04-21 13:39:54,539][0m Trial 748 finished with value: 0.9149989737246619 and parameters: {'alpha': 1.735322749800836, 'ties': 'breslow'}. Best is trial 411 with value: 0.91502674920718.[0m
[32m[I 2022-04-21 13:40:03,769][0m Trial 749 finished with value: 0.915025624834913 and parameters: {'alpha': 1.8961445034880338, 'ties': 'breslow'}. Best is trial 411 with value: 0.91502674920718.[0m
[32m[I 2022-04-21 13:40:13,039][0m Trial 750 finished with value: 0.914993885750788 and parameters: {'alpha': 2.0004447442081217, 'ties': 'breslow'}. Best is trial 411 with value: 0.91502674920718.[0m
[32m[I 2022-04-21 13:40:23,685][0m Trial 751 finished with value: 0.9149849647784143 and parameters: {'alpha': 1.6393202513568272, 'ties': 'breslow'}. Best is trial 411 with value: 0.91502674920718.[0m
[32m[I 2022-04-21 13:40:32,662][0m Trial 752 finished with value: 0.9150112331983717 and parameters: {'alpha': 1.8168917034743501, 'ties': 'breslow'}. Best is trial 411 with value: 0.91502674920718.[0m
[32m[I 2022-04-21 13:40:42,370][0m Trial 753 finished with value: 0.9149694127960155 and parameters: {'alpha': 2.2135739175813773, 'ties': 'breslow'}. Best is trial 411 with value: 0.91502674920718.[0m
[32m[I 2022-04-21 13:40:50,897][0m Trial 754 finished with value: 0.9150216185824629 and parameters: {'alpha': 1.9241617101095612, 'ties': 'breslow'}. Best is trial 411 with value: 0.91502674920718.[0m
[32m[I 2022-04-21 13:40:59,007][0m Trial 755 finished with value: 0.9149979385774106 and parameters: {'alpha': 1.7207565277694445, 'ties': 'breslow'}. Best is trial 411 with value: 0.91502674920718.[0m
[32m[I 2022-04-21 13:41:08,267][0m Trial 756 finished with value: 0.91497101972396 and parameters: {'alpha': 2.075378599538685, 'ties': 'breslow'}. Best is trial 411 with value: 0.91502674920718.[0m
[32m[I 2022-04-21 13:41:17,750][0m Trial 757 finished with value: 0.915016981382494 and parameters: {'alpha': 1.8395118630819567, 'ties': 'breslow'}. Best is trial 411 with value: 0.91502674920718.[0m
[32m[I 2022-04-21 13:41:24,798][0m Trial 758 finished with value: 0.91502378177988 and parameters: {'alpha': 1.9778305484291583, 'ties': 'breslow'}. Best is trial 411 with value: 0.91502674920718.[0m
[32m[I 2022-04-21 13:41:35,312][0m Trial 759 finished with value: 0.9150193680417941 and parameters: {'alpha': 1.8826911293981026, 'ties': 'breslow'}. Best is trial 411 with value: 0.91502674920718.[0m
[32m[I 2022-04-21 13:41:48,841][0m Trial 760 finished with value: 0.9150070132768351 and parameters: {'alpha': 1.759760817597701, 'ties': 'breslow'}. Best is trial 411 with value: 0.91502674920718.[0m
[32m[I 2022-04-21 13:42:08,334][0m Trial 761 finished with value: 0.9149440558316506 and parameters: {'alpha': 2.1087963522230933, 'ties': 'efron'}. Best is trial 411 with value: 0.91502674920718.[0m
[32m[I 2022-04-21 13:42:20,530][0m Trial 762 finished with value: 0.9149921281280307 and parameters: {'alpha': 2.0063750480834623, 'ties': 'breslow'}. Best is trial 411 with value: 0.91502674920718.[0m
[32m[I 2022-04-21 13:42:31,770][0m Trial 763 finished with value: 0.9149773522690994 and parameters: {'alpha': 1.570873364367998, 'ties': 'breslow'}. Best is trial 411 with value: 0.91502674920718.[0m
[32m[I 2022-04-21 13:42:44,485][0m Trial 764 finished with value: 0.9150210346513074 and parameters: {'alpha': 1.9226620339695928, 'ties': 'breslow'}. Best is trial 411 with value: 0.91502674920718.[0m
[32m[I 2022-04-21 13:42:56,646][0m Trial 765 finished with value: 0.9149468875506226 and parameters: {'alpha': 2.9153118608705446, 'ties': 'breslow'}. Best is trial 411 with value: 0.91502674920718.[0m
[32m[I 2022-04-21 13:43:09,273][0m Trial 766 finished with value: 0.9150152739601252 and parameters: {'alpha': 1.824499956073338, 'ties': 'breslow'}. Best is trial 411 with value: 0.91502674920718.[0m
[32m[I 2022-04-21 13:43:17,851][0m Trial 767 finished with value: 0.9149923327332319 and parameters: {'alpha': 1.6718521871928314, 'ties': 'breslow'}. Best is trial 411 with value: 0.91502674920718.[0m
[32m[I 2022-04-21 13:43:27,902][0m Trial 768 finished with value: 0.9149824157716008 and parameters: {'alpha': 2.0374138414865137, 'ties': 'breslow'}. Best is trial 411 with value: 0.91502674920718.[0m
[32m[I 2022-04-21 13:43:41,074][0m Trial 769 finished with value: 0.9149739610526197 and parameters: {'alpha': 2.1816808135960373, 'ties': 'breslow'}. Best is trial 411 with value: 0.91502674920718.[0m
[32m[I 2022-04-21 13:43:55,900][0m Trial 770 finished with value: 0.9150221461520367 and parameters: {'alpha': 1.9167666590636856, 'ties': 'breslow'}. Best is trial 411 with value: 0.91502674920718.[0m
[32m[I 2022-04-21 13:44:05,311][0m Trial 771 finished with value: 0.9150088225712206 and parameters: {'alpha': 1.7548046188787692, 'ties': 'breslow'}. Best is trial 411 with value: 0.91502674920718.[0m
[32m[I 2022-04-21 13:44:18,859][0m Trial 772 finished with value: 0.9150146100425749 and parameters: {'alpha': 1.8237488065741372, 'ties': 'breslow'}. Best is trial 411 with value: 0.91502674920718.[0m
[32m[I 2022-04-21 13:44:30,127][0m Trial 773 finished with value: 0.9150230039888758 and parameters: {'alpha': 1.9814134459608503, 'ties': 'breslow'}. Best is trial 411 with value: 0.91502674920718.[0m
[32m[I 2022-04-21 13:44:37,326][0m Trial 774 finished with value: 0.9149721098951371 and parameters: {'alpha': 2.104924056552854, 'ties': 'breslow'}. Best is trial 411 with value: 0.91502674920718.[0m
[32m[I 2022-04-21 13:44:47,259][0m Trial 775 finished with value: 0.9149655002298992 and parameters: {'alpha': 2.3255962305545728, 'ties': 'breslow'}. Best is trial 411 with value: 0.91502674920718.[0m
[32m[I 2022-04-21 13:44:56,851][0m Trial 776 finished with value: 0.9150221414535806 and parameters: {'alpha': 1.886578719808484, 'ties': 'breslow'}. Best is trial 411 with value: 0.91502674920718.[0m
[32m[I 2022-04-21 13:45:05,551][0m Trial 777 finished with value: 0.9149890676707855 and parameters: {'alpha': 1.690124780790408, 'ties': 'breslow'}. Best is trial 411 with value: 0.91502674920718.[0m
[32m[I 2022-04-21 13:45:15,175][0m Trial 778 finished with value: 0.9149834741384406 and parameters: {'alpha': 2.0333197498824016, 'ties': 'breslow'}. Best is trial 411 with value: 0.91502674920718.[0m
[32m[I 2022-04-21 13:45:26,967][0m Trial 779 finished with value: 0.9150105474555167 and parameters: {'alpha': 1.810189886018908, 'ties': 'breslow'}. Best is trial 411 with value: 0.91502674920718.[0m
[32m[I 2022-04-21 13:45:37,378][0m Trial 780 finished with value: 0.915024818857226 and parameters: {'alpha': 1.9422224699115735, 'ties': 'breslow'}. Best is trial 411 with value: 0.91502674920718.[0m
[32m[I 2022-04-21 13:45:53,394][0m Trial 781 finished with value: 0.9149407554500041 and parameters: {'alpha': 2.7773878135676564, 'ties': 'efron'}. Best is trial 411 with value: 0.91502674920718.[0m
[32m[I 2022-04-21 13:46:03,529][0m Trial 782 finished with value: 0.9149834528014358 and parameters: {'alpha': 1.6042361864981691, 'ties': 'breslow'}. Best is trial 411 with value: 0.91502674920718.[0m
[32m[I 2022-04-21 13:46:14,777][0m Trial 783 finished with value: 0.9150192810129392 and parameters: {'alpha': 1.8829856619580712, 'ties': 'breslow'}. Best is trial 411 with value: 0.91502674920718.[0m
[32m[I 2022-04-21 13:46:24,553][0m Trial 784 finished with value: 0.9149784269474841 and parameters: {'alpha': 2.1206942272595635, 'ties': 'breslow'}. Best is trial 411 with value: 0.91502674920718.[0m
[32m[I 2022-04-21 13:46:35,455][0m Trial 785 finished with value: 0.9150055474119642 and parameters: {'alpha': 1.7697104956120766, 'ties': 'breslow'}. Best is trial 411 with value: 0.91502674920718.[0m
[32m[I 2022-04-21 13:46:45,196][0m Trial 786 finished with value: 0.9150222971778501 and parameters: {'alpha': 1.9860344252871365, 'ties': 'breslow'}. Best is trial 411 with value: 0.91502674920718.[0m
[32m[I 2022-04-21 13:46:58,166][0m Trial 787 finished with value: 0.9150179353890394 and parameters: {'alpha': 1.8550799690970268, 'ties': 'breslow'}. Best is trial 411 with value: 0.91502674920718.[0m
[32m[I 2022-04-21 13:47:11,384][0m Trial 788 finished with value: 0.9148218499201419 and parameters: {'alpha': 0.47306210885652833, 'ties': 'breslow'}. Best is trial 411 with value: 0.91502674920718.[0m
[32m[I 2022-04-21 13:47:20,860][0m Trial 789 finished with value: 0.9149827158907616 and parameters: {'alpha': 2.0342366521217796, 'ties': 'breslow'}. Best is trial 411 with value: 0.91502674920718.[0m
[32m[I 2022-04-21 13:47:30,031][0m Trial 790 finished with value: 0.9149987135720405 and parameters: {'alpha': 1.7193747124692549, 'ties': 'breslow'}. Best is trial 411 with value: 0.91502674920718.[0m
[32m[I 2022-04-21 13:47:41,671][0m Trial 791 finished with value: 0.9149050240151299 and parameters: {'alpha': 4.221601653033181, 'ties': 'breslow'}. Best is trial 411 with value: 0.91502674920718.[0m
[32m[I 2022-04-21 13:47:53,483][0m Trial 792 finished with value: 0.915024513035306 and parameters: {'alpha': 1.9424434833189221, 'ties': 'breslow'}. Best is trial 411 with value: 0.91502674920718.[0m
[32m[I 2022-04-21 13:48:03,532][0m Trial 793 finished with value: 0.9149708658580152 and parameters: {'alpha': 2.149053962023853, 'ties': 'breslow'}. Best is trial 411 with value: 0.91502674920718.[0m
[32m[I 2022-04-21 13:48:13,272][0m Trial 794 finished with value: 0.9149691728320597 and parameters: {'alpha': 2.2398805138471416, 'ties': 'breslow'}. Best is trial 411 with value: 0.91502674920718.[0m
[32m[I 2022-04-21 13:48:22,472][0m Trial 795 finished with value: 0.9150117699142614 and parameters: {'alpha': 1.8141233688851393, 'ties': 'breslow'}. Best is trial 411 with value: 0.91502674920718.[0m
[32m[I 2022-04-21 13:48:31,412][0m Trial 796 finished with value: 0.9150226216073225 and parameters: {'alpha': 1.9488265426333964, 'ties': 'breslow'}. Best is trial 411 with value: 0.91502674920718.[0m
[32m[I 2022-04-21 13:48:42,198][0m Trial 797 finished with value: 0.9149777127284032 and parameters: {'alpha': 2.0588253315218115, 'ties': 'breslow'}. Best is trial 411 with value: 0.91502674920718.[0m
[32m[I 2022-04-21 13:48:51,753][0m Trial 798 finished with value: 0.915018033509375 and parameters: {'alpha': 1.8664563193752735, 'ties': 'breslow'}. Best is trial 411 with value: 0.91502674920718.[0m
[32m[I 2022-04-21 13:49:02,334][0m Trial 799 finished with value: 0.9149627891988935 and parameters: {'alpha': 2.4428167073761204, 'ties': 'breslow'}. Best is trial 411 with value: 0.91502674920718.[0m
[32m[I 2022-04-21 13:49:18,377][0m Trial 800 finished with value: 0.9148973254563975 and parameters: {'alpha': 1.6397762349265579, 'ties': 'efron'}. Best is trial 411 with value: 0.91502674920718.[0m
[32m[I 2022-04-21 13:49:28,481][0m Trial 801 finished with value: 0.915008120267418 and parameters: {'alpha': 1.7519092637818203, 'ties': 'breslow'}. Best is trial 411 with value: 0.91502674920718.[0m
[32m[I 2022-04-21 13:49:38,039][0m Trial 802 finished with value: 0.9150217633950776 and parameters: {'alpha': 1.932870047495438, 'ties': 'breslow'}. Best is trial 411 with value: 0.91502674920718.[0m
[32m[I 2022-04-21 13:49:48,869][0m Trial 803 finished with value: 0.9149760426768518 and parameters: {'alpha': 2.060122880843884, 'ties': 'breslow'}. Best is trial 411 with value: 0.91502674920718.[0m
[32m[I 2022-04-21 13:49:56,629][0m Trial 804 finished with value: 0.9150112289030933 and parameters: {'alpha': 1.8159597702244326, 'ties': 'breslow'}. Best is trial 411 with value: 0.91502674920718.[0m
[32m[I 2022-04-21 13:50:06,187][0m Trial 805 finished with value: 0.9150224456161332 and parameters: {'alpha': 1.9600570333790088, 'ties': 'breslow'}. Best is trial 411 with value: 0.91502674920718.[0m
[32m[I 2022-04-21 13:50:15,152][0m Trial 806 finished with value: 0.9149749407971672 and parameters: {'alpha': 1.5013933862515008, 'ties': 'breslow'}. Best is trial 411 with value: 0.91502674920718.[0m
[32m[I 2022-04-21 13:50:24,094][0m Trial 807 finished with value: 0.9149737635486039 and parameters: {'alpha': 2.169216182910933, 'ties': 'breslow'}. Best is trial 411 with value: 0.91502674920718.[0m
[32m[I 2022-04-21 13:50:31,036][0m Trial 808 finished with value: 0.914991907529054 and parameters: {'alpha': 1.696120203631448, 'ties': 'breslow'}. Best is trial 411 with value: 0.91502674920718.[0m
[32m[I 2022-04-21 13:50:41,542][0m Trial 809 finished with value: 0.915020294746469 and parameters: {'alpha': 1.875530317200534, 'ties': 'breslow'}. Best is trial 411 with value: 0.91502674920718.[0m
[32m[I 2022-04-21 13:50:49,944][0m Trial 810 finished with value: 0.914982830960948 and parameters: {'alpha': 2.031793437950853, 'ties': 'breslow'}. Best is trial 411 with value: 0.91502674920718.[0m
[32m[I 2022-04-21 13:50:57,244][0m Trial 811 finished with value: 0.9150065098833963 and parameters: {'alpha': 1.773999779076688, 'ties': 'breslow'}. Best is trial 411 with value: 0.91502674920718.[0m
[32m[I 2022-04-21 13:51:05,734][0m Trial 812 finished with value: 0.9150219310985707 and parameters: {'alpha': 1.925749621008041, 'ties': 'breslow'}. Best is trial 411 with value: 0.91502674920718.[0m
[32m[I 2022-04-21 13:51:14,667][0m Trial 813 finished with value: 0.9149940725628223 and parameters: {'alpha': 2.0227110298064575, 'ties': 'breslow'}. Best is trial 411 with value: 0.91502674920718.[0m
[32m[I 2022-04-21 13:51:25,172][0m Trial 814 finished with value: 0.9150173338555296 and parameters: {'alpha': 1.8352977732031976, 'ties': 'breslow'}. Best is trial 411 with value: 0.91502674920718.[0m
[32m[I 2022-04-21 13:51:33,763][0m Trial 815 finished with value: 0.9149827603834838 and parameters: {'alpha': 1.601339446646958, 'ties': 'breslow'}. Best is trial 411 with value: 0.91502674920718.[0m
[32m[I 2022-04-21 13:51:40,896][0m Trial 816 finished with value: 0.9149674307510983 and parameters: {'alpha': 2.252445239050502, 'ties': 'breslow'}. Best is trial 411 with value: 0.91502674920718.[0m
[32m[I 2022-04-21 13:51:52,583][0m Trial 817 finished with value: 0.9150231589820048 and parameters: {'alpha': 1.9512209129104248, 'ties': 'breslow'}. Best is trial 411 with value: 0.91502674920718.[0m
[32m[I 2022-04-21 13:52:02,637][0m Trial 818 finished with value: 0.9149759355202047 and parameters: {'alpha': 2.128858324410218, 'ties': 'breslow'}. Best is trial 411 with value: 0.91502674920718.[0m
[32m[I 2022-04-21 13:52:15,043][0m Trial 819 finished with value: 0.9148935569208663 and parameters: {'alpha': 1.7210324623997004, 'ties': 'efron'}. Best is trial 411 with value: 0.91502674920718.[0m
[32m[I 2022-04-21 13:52:24,517][0m Trial 820 finished with value: 0.9150174709569848 and parameters: {'alpha': 1.870402862050987, 'ties': 'breslow'}. Best is trial 411 with value: 0.91502674920718.[0m
[32m[I 2022-04-21 13:52:34,335][0m Trial 821 finished with value: 0.9149744640266274 and parameters: {'alpha': 2.067499656687895, 'ties': 'breslow'}. Best is trial 411 with value: 0.91502674920718.[0m
[32m[I 2022-04-21 13:52:43,049][0m Trial 822 finished with value: 0.9150048908722648 and parameters: {'alpha': 1.7862144955935337, 'ties': 'breslow'}. Best is trial 411 with value: 0.91502674920718.[0m
[32m[I 2022-04-21 13:52:53,980][0m Trial 823 finished with value: 0.9150233978994337 and parameters: {'alpha': 1.984200541847575, 'ties': 'breslow'}. Best is trial 411 with value: 0.91502674920718.[0m
[32m[I 2022-04-21 13:53:02,554][0m Trial 824 finished with value: 0.9150246758749704 and parameters: {'alpha': 1.8948352048927146, 'ties': 'breslow'}. Best is trial 411 with value: 0.91502674920718.[0m
[32m[I 2022-04-21 13:53:09,262][0m Trial 825 finished with value: 0.9149912469502954 and parameters: {'alpha': 1.6682508848244557, 'ties': 'breslow'}. Best is trial 411 with value: 0.91502674920718.[0m
[32m[I 2022-04-21 13:53:17,236][0m Trial 826 finished with value: 0.9150151637875072 and parameters: {'alpha': 1.8272436663055787, 'ties': 'breslow'}. Best is trial 411 with value: 0.91502674920718.[0m
[32m[I 2022-04-21 13:53:26,230][0m Trial 827 finished with value: 0.9149765221782374 and parameters: {'alpha': 2.125399726577593, 'ties': 'breslow'}. Best is trial 411 with value: 0.91502674920718.[0m
[32m[I 2022-04-21 13:53:38,673][0m Trial 828 finished with value: 0.915023978702114 and parameters: {'alpha': 1.982727120023104, 'ties': 'breslow'}. Best is trial 411 with value: 0.91502674920718.[0m
[32m[I 2022-04-21 13:53:49,751][0m Trial 829 finished with value: 0.9150054735946188 and parameters: {'alpha': 1.7656744933604032, 'ties': 'breslow'}. Best is trial 411 with value: 0.91502674920718.[0m
[32m[I 2022-04-21 13:53:58,491][0m Trial 830 finished with value: 0.9150212177092822 and parameters: {'alpha': 1.8859803509022204, 'ties': 'breslow'}. Best is trial 411 with value: 0.91502674920718.[0m
[32m[I 2022-04-21 13:54:09,992][0m Trial 831 finished with value: 0.9149620577870975 and parameters: {'alpha': 1.2845307791914018, 'ties': 'breslow'}. Best is trial 411 with value: 0.91502674920718.[0m
[32m[I 2022-04-21 13:54:20,588][0m Trial 832 finished with value: 0.9149807122732202 and parameters: {'alpha': 2.0494125781435075, 'ties': 'breslow'}. Best is trial 411 with value: 0.91502674920718.[0m
[32m[I 2022-04-21 13:54:29,135][0m Trial 833 finished with value: 0.9150245770226608 and parameters: {'alpha': 1.9411433978890913, 'ties': 'breslow'}. Best is trial 411 with value: 0.91502674920718.[0m
[32m[I 2022-04-21 13:54:39,728][0m Trial 834 finished with value: 0.9149993774937821 and parameters: {'alpha': 1.7381288074349688, 'ties': 'breslow'}. Best is trial 411 with value: 0.91502674920718.[0m
[32m[I 2022-04-21 13:54:49,591][0m Trial 835 finished with value: 0.9149676702023861 and parameters: {'alpha': 2.2171967627414717, 'ties': 'breslow'}. Best is trial 411 with value: 0.91502674920718.[0m
[32m[I 2022-04-21 13:54:59,547][0m Trial 836 finished with value: 0.9150177718008325 and parameters: {'alpha': 1.86630557823735, 'ties': 'breslow'}. Best is trial 411 with value: 0.91502674920718.[0m
[32m[I 2022-04-21 13:55:12,960][0m Trial 837 finished with value: 0.9149297208172605 and parameters: {'alpha': 2.033878402603285, 'ties': 'efron'}. Best is trial 411 with value: 0.91502674920718.[0m
[32m[I 2022-04-21 13:55:22,770][0m Trial 838 finished with value: 0.9149577959613027 and parameters: {'alpha': 1.071371968652394, 'ties': 'breslow'}. Best is trial 411 with value: 0.91502674920718.[0m
[32m[I 2022-04-21 13:55:30,944][0m Trial 839 finished with value: 0.9149727852922916 and parameters: {'alpha': 1.535329404042115, 'ties': 'breslow'}. Best is trial 411 with value: 0.91502674920718.[0m
[32m[I 2022-04-21 13:55:38,559][0m Trial 840 finished with value: 0.9150238211744842 and parameters: {'alpha': 1.9429710362912866, 'ties': 'breslow'}. Best is trial 411 with value: 0.91502674920718.[0m
[32m[I 2022-04-21 13:55:47,089][0m Trial 841 finished with value: 0.9150092053246676 and parameters: {'alpha': 1.805164746625597, 'ties': 'breslow'}. Best is trial 411 with value: 0.91502674920718.[0m
[32m[I 2022-04-21 13:55:57,396][0m Trial 842 finished with value: 0.9149898474306589 and parameters: {'alpha': 1.6634241190978534, 'ties': 'breslow'}. Best is trial 411 with value: 0.91502674920718.[0m
[32m[I 2022-04-21 13:56:06,186][0m Trial 843 finished with value: 0.9149716781659347 and parameters: {'alpha': 2.085750211004577, 'ties': 'breslow'}. Best is trial 411 with value: 0.91502674920718.[0m
[32m[I 2022-04-21 13:56:19,468][0m Trial 844 finished with value: 0.9150190258876216 and parameters: {'alpha': 1.8815137575392742, 'ties': 'breslow'}. Best is trial 411 with value: 0.91502674920718.[0m
[32m[I 2022-04-21 13:56:31,669][0m Trial 845 finished with value: 0.9149926644572277 and parameters: {'alpha': 1.993963164072384, 'ties': 'breslow'}. Best is trial 411 with value: 0.91502674920718.[0m
[32m[I 2022-04-21 13:56:41,227][0m Trial 846 finished with value: 0.9150067956432822 and parameters: {'alpha': 1.7793673167172122, 'ties': 'breslow'}. Best is trial 411 with value: 0.91502674920718.[0m
[32m[I 2022-04-21 13:56:52,374][0m Trial 847 finished with value: 0.914971695465216 and parameters: {'alpha': 2.1556430388107577, 'ties': 'breslow'}. Best is trial 411 with value: 0.91502674920718.[0m
[32m[I 2022-04-21 13:57:04,007][0m Trial 848 finished with value: 0.9150225555935835 and parameters: {'alpha': 1.9550840480457303, 'ties': 'breslow'}. Best is trial 411 with value: 0.91502674920718.[0m
[32m[I 2022-04-21 13:57:13,208][0m Trial 849 finished with value: 0.9150166598910128 and parameters: {'alpha': 1.8345725531445445, 'ties': 'breslow'}. Best is trial 411 with value: 0.91502674920718.[0m
[32m[I 2022-04-21 13:57:21,934][0m Trial 850 finished with value: 0.9149994762946008 and parameters: {'alpha': 1.7323260399925664, 'ties': 'breslow'}. Best is trial 411 with value: 0.91502674920718.[0m
[32m[I 2022-04-21 13:57:34,825][0m Trial 851 finished with value: 0.9149707544764041 and parameters: {'alpha': 2.0796886417756366, 'ties': 'breslow'}. Best is trial 411 with value: 0.91502674920718.[0m
[32m[I 2022-04-21 13:57:44,042][0m Trial 852 finished with value: 0.9149656249206835 and parameters: {'alpha': 2.323128880062367, 'ties': 'breslow'}. Best is trial 411 with value: 0.91502674920718.[0m
