[32m[I 2022-05-15 14:55:05,644][0m Trial 544 finished with value: 0.7628732689031882 and parameters: {'loss': 'coxph', 'learning_rate': 0.00036885074210476094, 'n_estimators': 588, 'criterion': 'friedman_mse', 'min_samples_split': 4, 'min_samples_leaf': 5, 'min_weight_fraction_leaf': 0.10790825834262692, 'min_impurity_decrease': 0.8641502652387794, 'max_features': 0.7490137385150126, 'subsample': 0.14464451165023126, 'dropout_rate': 0.6537043073921739, 'ccp_alpha': 0.17999288955862205}. Best is trial 533 with value: 0.8527111020940833.[0m
[32m[I 2022-05-15 15:16:07,259][0m Trial 545 finished with value: 0.7828313502161028 and parameters: {'loss': 'coxph', 'learning_rate': 6.880285329235481e-05, 'n_estimators': 450, 'criterion': 'friedman_mse', 'min_samples_split': 4, 'min_samples_leaf': 5, 'min_weight_fraction_leaf': 0.09059532445911989, 'min_impurity_decrease': 0.8964071874535644, 'max_features': 0.7732598996834265, 'subsample': 0.11622195469985114, 'dropout_rate': 0.6818700922513058, 'ccp_alpha': 0.09017702949039788}. Best is trial 533 with value: 0.8527111020940833.[0m
[32m[I 2022-05-15 15:45:56,080][0m Trial 546 finished with value: 0.7637447259490078 and parameters: {'loss': 'coxph', 'learning_rate': 5.961953829167919e-05, 'n_estimators': 609, 'criterion': 'friedman_mse', 'min_samples_split': 4, 'min_samples_leaf': 5, 'min_weight_fraction_leaf': 0.12117628933565533, 'min_impurity_decrease': 0.9263997174396686, 'max_features': 0.8057613476977902, 'subsample': 0.07990078317065175, 'dropout_rate': 0.7253310846330857, 'ccp_alpha': 0.28050859065750683}. Best is trial 533 with value: 0.8527111020940833.[0m
[32m[I 2022-05-15 16:21:52,735][0m Trial 547 finished with value: 0.7958949498607708 and parameters: {'loss': 'coxph', 'learning_rate': 8.305590457597854e-05, 'n_estimators': 665, 'criterion': 'friedman_mse', 'min_samples_split': 5, 'min_samples_leaf': 5, 'min_weight_fraction_leaf': 0.060893926316028954, 'min_impurity_decrease': 0.6726200472619025, 'max_features': 0.7273034605402032, 'subsample': 0.0025148611779947892, 'dropout_rate': 0.6978145236630242, 'ccp_alpha': 0.15555621716325393}. Best is trial 533 with value: 0.8527111020940833.[0m
[32m[I 2022-05-15 16:49:52,624][0m Trial 548 finished with value: 0.847804381820487 and parameters: {'loss': 'coxph', 'learning_rate': 4.5587893691284546e-05, 'n_estimators': 500, 'criterion': 'friedman_mse', 'min_samples_split': 4, 'min_samples_leaf': 5, 'min_weight_fraction_leaf': 0.07747458830742246, 'min_impurity_decrease': 0.8689900891589646, 'max_features': 0.7697636128673806, 'subsample': 0.03423529883651062, 'dropout_rate': 0.1893048621324968, 'ccp_alpha': 0.003992279648064466}. Best is trial 533 with value: 0.8527111020940833.[0m
[32m[I 2022-05-15 17:16:47,347][0m Trial 549 finished with value: 0.7993691865772246 and parameters: {'loss': 'coxph', 'learning_rate': 4.2386766048869585e-05, 'n_estimators': 497, 'criterion': 'friedman_mse', 'min_samples_split': 4, 'min_samples_leaf': 5, 'min_weight_fraction_leaf': 0.08461624453101903, 'min_impurity_decrease': 0.703604839532126, 'max_features': 0.7894996865437663, 'subsample': 0.03716547569796291, 'dropout_rate': 0.2790963907503952, 'ccp_alpha': 0.09814585665359521}. Best is trial 533 with value: 0.8527111020940833.[0m
[32m[I 2022-05-15 17:46:13,216][0m Trial 550 finished with value: 0.845301541549712 and parameters: {'loss': 'coxph', 'learning_rate': 3.8977021763437694e-05, 'n_estimators': 518, 'criterion': 'friedman_mse', 'min_samples_split': 3, 'min_samples_leaf': 6, 'min_weight_fraction_leaf': 0.07692293244973687, 'min_impurity_decrease': 0.8370572471949498, 'max_features': 0.7726814759659879, 'subsample': 0.02543163816501648, 'dropout_rate': 0.18330995923282684, 'ccp_alpha': 0.002801644295266177}. Best is trial 533 with value: 0.8527111020940833.[0m
[32m[I 2022-05-15 18:10:25,466][0m Trial 551 finished with value: 0.7658286814360189 and parameters: {'loss': 'coxph', 'learning_rate': 4.832867252104711e-05, 'n_estimators': 486, 'criterion': 'friedman_mse', 'min_samples_split': 4, 'min_samples_leaf': 5, 'min_weight_fraction_leaf': 0.10049375529962223, 'min_impurity_decrease': 0.865474159091763, 'max_features': 0.75934383791023, 'subsample': 0.05325691853308687, 'dropout_rate': 0.7473967296805732, 'ccp_alpha': 0.2403969269493714}. Best is trial 533 with value: 0.8527111020940833.[0m
[32m[I 2022-05-15 18:38:57,788][0m Trial 552 finished with value: 0.8495374164103051 and parameters: {'loss': 'coxph', 'learning_rate': 0.00015583067518221995, 'n_estimators': 550, 'criterion': 'friedman_mse', 'min_samples_split': 5, 'min_samples_leaf': 5, 'min_weight_fraction_leaf': 0.11506858898432468, 'min_impurity_decrease': 0.7511887721568691, 'max_features': 0.7961534996579106, 'subsample': 0.0338327952767845, 'dropout_rate': 0.724493286444685, 'ccp_alpha': 0.0016382688947306745}. Best is trial 533 with value: 0.8527111020940833.[0m
[32m[I 2022-05-15 19:07:40,879][0m Trial 553 finished with value: 0.7699463071949829 and parameters: {'loss': 'coxph', 'learning_rate': 0.00014644836968639204, 'n_estimators': 570, 'criterion': 'friedman_mse', 'min_samples_split': 5, 'min_samples_leaf': 6, 'min_weight_fraction_leaf': 0.11417955282658422, 'min_impurity_decrease': 0.7329051208139834, 'max_features': 0.8073818615008065, 'subsample': 0.05484299592957382, 'dropout_rate': 0.7065058169410257, 'ccp_alpha': 0.1739527345766176}. Best is trial 533 with value: 0.8527111020940833.[0m
[32m[I 2022-05-15 19:33:41,209][0m Trial 554 finished with value: 0.7720294922439288 and parameters: {'loss': 'coxph', 'learning_rate': 0.00012662583317984773, 'n_estimators': 535, 'criterion': 'friedman_mse', 'min_samples_split': 5, 'min_samples_leaf': 5, 'min_weight_fraction_leaf': 0.12724374177545442, 'min_impurity_decrease': 0.7559023461362296, 'max_features': 0.8052620493402288, 'subsample': 0.18286318604064658, 'dropout_rate': 0.042474837719567865, 'ccp_alpha': 0.08959431784548082}. Best is trial 533 with value: 0.8527111020940833.[0m
/media/san2_ssd/data/Workdir/survival/venv/lib/python3.8/site-packages/sksurv/ensemble/boosting.py:955: RuntimeWarning: divide by zero encountered in log
  time = numpy.log(time)
/media/san2_ssd/data/Workdir/survival/venv/lib/python3.8/site-packages/sksurv/ensemble/boosting.py:955: RuntimeWarning: divide by zero encountered in log
  time = numpy.log(time)
/media/san2_ssd/data/Workdir/survival/venv/lib/python3.8/site-packages/sksurv/ensemble/boosting.py:955: RuntimeWarning: divide by zero encountered in log
  time = numpy.log(time)
/media/san2_ssd/data/Workdir/survival/venv/lib/python3.8/site-packages/sksurv/ensemble/boosting.py:955: RuntimeWarning: divide by zero encountered in log
  time = numpy.log(time)
/media/san2_ssd/data/Workdir/survival/venv/lib/python3.8/site-packages/sksurv/ensemble/boosting.py:955: RuntimeWarning: divide by zero encountered in log
  time = numpy.log(time)
[32m[I 2022-05-15 19:33:41,277][0m Trial 555 finished with value: -1.0 and parameters: {'loss': 'squared', 'learning_rate': 0.00029924076087964823, 'n_estimators': 537, 'criterion': 'friedman_mse', 'min_samples_split': 5, 'min_samples_leaf': 5, 'min_weight_fraction_leaf': 0.11119285647485026, 'min_impurity_decrease': 0.7634423505849822, 'max_features': 0.7853189212636348, 'subsample': 0.0692992961561972, 'dropout_rate': 0.6772315327983897, 'ccp_alpha': 0.31347770939982095}. Best is trial 533 with value: 0.8527111020940833.[0m
[32m[I 2022-05-15 20:00:05,165][0m Trial 556 finished with value: 0.5 and parameters: {'loss': 'coxph', 'learning_rate': 0.0002195118426515848, 'n_estimators': 559, 'criterion': 'friedman_mse', 'min_samples_split': 5, 'min_samples_leaf': 5, 'min_weight_fraction_leaf': 0.12178427237447058, 'min_impurity_decrease': 0.7735790691654969, 'max_features': 0.8151907567064607, 'subsample': 0.1066974212145165, 'dropout_rate': 0.6995236177182137, 'ccp_alpha': 2.232634861902428}. Best is trial 533 with value: 0.8527111020940833.[0m
[32m[I 2022-05-15 20:23:39,799][0m Trial 557 finished with value: 0.8528522853979229 and parameters: {'loss': 'coxph', 'learning_rate': 0.00017908173774631086, 'n_estimators': 518, 'criterion': 'friedman_mse', 'min_samples_split': 5, 'min_samples_leaf': 5, 'min_weight_fraction_leaf': 0.08993372507041653, 'min_impurity_decrease': 0.8226357019408503, 'max_features': 0.7584930141565914, 'subsample': 0.15210628645951133, 'dropout_rate': 0.7122730175883454, 'ccp_alpha': 0.0011654329536012354}. Best is trial 557 with value: 0.8528522853979229.[0m
[32m[I 2022-05-15 20:46:44,869][0m Trial 558 finished with value: 0.7625662750161178 and parameters: {'loss': 'coxph', 'learning_rate': 0.0001675375238348196, 'n_estimators': 514, 'criterion': 'friedman_mse', 'min_samples_split': 5, 'min_samples_leaf': 5, 'min_weight_fraction_leaf': 0.09076709346300492, 'min_impurity_decrease': 0.8138428176481493, 'max_features': 0.7506895748654887, 'subsample': 0.16043666236849147, 'dropout_rate': 0.6661104208637818, 'ccp_alpha': 0.1814824774829196}. Best is trial 557 with value: 0.8528522853979229.[0m
[32m[I 2022-05-15 21:14:34,519][0m Trial 559 finished with value: 0.5 and parameters: {'loss': 'coxph', 'learning_rate': 0.00020513082975869945, 'n_estimators': 510, 'criterion': 'squared_error', 'min_samples_split': 5, 'min_samples_leaf': 5, 'min_weight_fraction_leaf': 0.07667779652964307, 'min_impurity_decrease': 0.8370372815215757, 'max_features': 0.7717623395011386, 'subsample': 0.03555251559177882, 'dropout_rate': 0.09275829286574594, 'ccp_alpha': 2.536034217822435}. Best is trial 557 with value: 0.8528522853979229.[0m
[32m[I 2022-05-15 21:42:25,603][0m Trial 560 finished with value: 0.7919861740629821 and parameters: {'loss': 'coxph', 'learning_rate': 0.00013517552482343609, 'n_estimators': 555, 'criterion': 'friedman_mse', 'min_samples_split': 5, 'min_samples_leaf': 5, 'min_weight_fraction_leaf': 0.0845776529380484, 'min_impurity_decrease': 0.8123157582157263, 'max_features': 0.7092948708385579, 'subsample': 0.06110977602374212, 'dropout_rate': 0.6915812863891901, 'ccp_alpha': 0.08962925523910781}. Best is trial 557 with value: 0.8528522853979229.[0m
[32m[I 2022-05-15 22:13:56,192][0m Trial 561 finished with value: 0.8350256742107364 and parameters: {'loss': 'coxph', 'learning_rate': 0.0001702045820909478, 'n_estimators': 591, 'criterion': 'friedman_mse', 'min_samples_split': 5, 'min_samples_leaf': 5, 'min_weight_fraction_leaf': 0.10504261452980232, 'min_impurity_decrease': 0.8511491409671501, 'max_features': 0.7596625785827348, 'subsample': 0.013972037057498173, 'dropout_rate': 0.7147804957754215, 'ccp_alpha': 0.003033231647255094}. Best is trial 557 with value: 0.8528522853979229.[0m
[32m[I 2022-05-15 22:36:07,383][0m Trial 562 finished with value: 0.762558304892895 and parameters: {'loss': 'coxph', 'learning_rate': 0.0001057427232764091, 'n_estimators': 494, 'criterion': 'friedman_mse', 'min_samples_split': 5, 'min_samples_leaf': 5, 'min_weight_fraction_leaf': 0.06778792972591288, 'min_impurity_decrease': 0.7843813439078104, 'max_features': 0.7918135287005912, 'subsample': 0.15579188424162668, 'dropout_rate': 0.6832600142098406, 'ccp_alpha': 0.17818568221826733}. Best is trial 557 with value: 0.8528522853979229.[0m
[32m[I 2022-05-15 23:07:34,214][0m Trial 563 finished with value: 0.7959148961492112 and parameters: {'loss': 'coxph', 'learning_rate': 9.702435198787973e-05, 'n_estimators': 618, 'criterion': 'friedman_mse', 'min_samples_split': 4, 'min_samples_leaf': 7, 'min_weight_fraction_leaf': 0.0964588050125467, 'min_impurity_decrease': 0.7422068529548452, 'max_features': 0.7279020858538572, 'subsample': 0.0442342937450203, 'dropout_rate': 0.7524838324906308, 'ccp_alpha': 0.0901086309761871}. Best is trial 557 with value: 0.8528522853979229.[0m
[32m[I 2022-05-15 23:32:32,285][0m Trial 564 finished with value: 0.7624159005935065 and parameters: {'loss': 'coxph', 'learning_rate': 0.0001952404414289474, 'n_estimators': 533, 'criterion': 'friedman_mse', 'min_samples_split': 5, 'min_samples_leaf': 5, 'min_weight_fraction_leaf': 0.11578444034553842, 'min_impurity_decrease': 0.8732178779779074, 'max_features': 0.7533113697597609, 'subsample': 0.18750594928566644, 'dropout_rate': 0.24304030302141133, 'ccp_alpha': 0.25749603892401385}. Best is trial 557 with value: 0.8528522853979229.[0m
[32m[I 2022-05-15 23:55:30,486][0m Trial 565 finished with value: 0.5 and parameters: {'loss': 'coxph', 'learning_rate': 0.00012665588691864615, 'n_estimators': 482, 'criterion': 'friedman_mse', 'min_samples_split': 4, 'min_samples_leaf': 6, 'min_weight_fraction_leaf': 0.1273050208665396, 'min_impurity_decrease': 0.9559800294159984, 'max_features': 0.678316558898487, 'subsample': 0.0886141461737383, 'dropout_rate': 0.7293870503991758, 'ccp_alpha': 0.4915931378365064}. Best is trial 557 with value: 0.8528522853979229.[0m
[32m[I 2022-05-16 00:17:15,682][0m Trial 566 finished with value: 0.7783493337484421 and parameters: {'loss': 'coxph', 'learning_rate': 7.771101918738381e-05, 'n_estimators': 465, 'criterion': 'friedman_mse', 'min_samples_split': 4, 'min_samples_leaf': 5, 'min_weight_fraction_leaf': 0.10244833994209511, 'min_impurity_decrease': 0.9412534867319334, 'max_features': 0.7988861665070218, 'subsample': 0.11842243410180057, 'dropout_rate': 0.6659081657297556, 'ccp_alpha': 0.09534831937566018}. Best is trial 557 with value: 0.8528522853979229.[0m
[32m[I 2022-05-16 00:45:18,241][0m Trial 567 finished with value: 0.5 and parameters: {'loss': 'coxph', 'learning_rate': 9.234473455710562e-05, 'n_estimators': 572, 'criterion': 'friedman_mse', 'min_samples_split': 3, 'min_samples_leaf': 5, 'min_weight_fraction_leaf': 0.08506538509698097, 'min_impurity_decrease': 0.8279684430612817, 'max_features': 0.7367649743537582, 'subsample': 0.07278367304117775, 'dropout_rate': 0.7016545685931771, 'ccp_alpha': 1.765800740068241}. Best is trial 557 with value: 0.8528522853979229.[0m
[32m[I 2022-05-16 01:13:26,083][0m Trial 568 finished with value: 0.7870729272575787 and parameters: {'loss': 'coxph', 'learning_rate': 0.0002664894572244742, 'n_estimators': 517, 'criterion': 'friedman_mse', 'min_samples_split': 4, 'min_samples_leaf': 5, 'min_weight_fraction_leaf': 0.07488508208574915, 'min_impurity_decrease': 0.9136969442681758, 'max_features': 0.7749330161365625, 'subsample': 0.050409805669660496, 'dropout_rate': 0.1443829422552688, 'ccp_alpha': 0.15856214492346024}. Best is trial 557 with value: 0.8528522853979229.[0m
[32m[I 2022-05-16 01:39:36,892][0m Trial 569 finished with value: 0.786159861060814 and parameters: {'loss': 'coxph', 'learning_rate': 7.101302826865726e-05, 'n_estimators': 548, 'criterion': 'friedman_mse', 'min_samples_split': 5, 'min_samples_leaf': 6, 'min_weight_fraction_leaf': 0.11206556127305949, 'min_impurity_decrease': 0.9761508231469067, 'max_features': 0.7059663337240603, 'subsample': 0.10077002891486384, 'dropout_rate': 0.7104917604247113, 'ccp_alpha': 0.09302732495317123}. Best is trial 557 with value: 0.8528522853979229.[0m
[32m[I 2022-05-16 02:05:25,023][0m Trial 570 finished with value: 0.8474787791090582 and parameters: {'loss': 'coxph', 'learning_rate': 0.00015075681204037647, 'n_estimators': 496, 'criterion': 'friedman_mse', 'min_samples_split': 4, 'min_samples_leaf': 5, 'min_weight_fraction_leaf': 0.09270990606982696, 'min_impurity_decrease': 0.7243950810407779, 'max_features': 0.8201082922979889, 'subsample': 0.031210286572761314, 'dropout_rate': 0.6872407484929254, 'ccp_alpha': 0.006011168427595991}. Best is trial 557 with value: 0.8528522853979229.[0m
[32m[I 2022-05-16 02:31:49,889][0m Trial 571 finished with value: 0.8282047948261472 and parameters: {'loss': 'coxph', 'learning_rate': 0.00015226982566989057, 'n_estimators': 493, 'criterion': 'friedman_mse', 'min_samples_split': 4, 'min_samples_leaf': 5, 'min_weight_fraction_leaf': 0.09291671503622745, 'min_impurity_decrease': 0.6867632691612641, 'max_features': 0.8172801197675965, 'subsample': 0.00912974221918543, 'dropout_rate': 0.6583207819845687, 'ccp_alpha': 0.003870380415766093}. Best is trial 557 with value: 0.8528522853979229.[0m
[32m[I 2022-05-16 02:55:49,270][0m Trial 572 finished with value: 0.7674329457280931 and parameters: {'loss': 'coxph', 'learning_rate': 0.00016169782961484823, 'n_estimators': 465, 'criterion': 'friedman_mse', 'min_samples_split': 4, 'min_samples_leaf': 5, 'min_weight_fraction_leaf': 0.1034420941648054, 'min_impurity_decrease': 0.734036085137802, 'max_features': 0.7861571010255006, 'subsample': 0.029869194610069396, 'dropout_rate': 0.6763046074863374, 'ccp_alpha': 0.22483901100414616}. Best is trial 557 with value: 0.8528522853979229.[0m
[32m[I 2022-05-16 03:20:33,239][0m Trial 573 finished with value: 0.8538054350764822 and parameters: {'loss': 'coxph', 'learning_rate': 0.00011597684446991895, 'n_estimators': 501, 'criterion': 'friedman_mse', 'min_samples_split': 4, 'min_samples_leaf': 5, 'min_weight_fraction_leaf': 0.08055736062982839, 'min_impurity_decrease': 0.7125907244949252, 'max_features': 0.7621590147641549, 'subsample': 0.13897490055986625, 'dropout_rate': 0.32781267450400436, 'ccp_alpha': 0.0012769773742300045}. Best is trial 573 with value: 0.8538054350764822.[0m
[32m[I 2022-05-16 03:41:44,823][0m Trial 574 finished with value: 0.7395539553815311 and parameters: {'loss': 'coxph', 'learning_rate': 0.00017743516491412834, 'n_estimators': 483, 'criterion': 'friedman_mse', 'min_samples_split': 4, 'min_samples_leaf': 5, 'min_weight_fraction_leaf': 0.07705193101493218, 'min_impurity_decrease': 0.7111528836841416, 'max_features': 0.7669157532203674, 'subsample': 0.16743464390518328, 'dropout_rate': 0.7290416205843531, 'ccp_alpha': 0.3207701229777289}. Best is trial 573 with value: 0.8538054350764822.[0m
[32m[I 2022-05-16 04:06:31,516][0m Trial 575 finished with value: 0.7833246684199285 and parameters: {'loss': 'coxph', 'learning_rate': 0.00012019197577057742, 'n_estimators': 499, 'criterion': 'friedman_mse', 'min_samples_split': 4, 'min_samples_leaf': 5, 'min_weight_fraction_leaf': 0.0639057677718522, 'min_impurity_decrease': 0.7214396133831732, 'max_features': 0.7997104720592996, 'subsample': 0.1461699486726916, 'dropout_rate': 0.06916844151272816, 'ccp_alpha': 0.15785891479194106}. Best is trial 573 with value: 0.8538054350764822.[0m
/media/san2_ssd/data/Workdir/survival/venv/lib/python3.8/site-packages/sksurv/ensemble/boosting.py:955: RuntimeWarning: divide by zero encountered in log
  time = numpy.log(time)
/media/san2_ssd/data/Workdir/survival/venv/lib/python3.8/site-packages/sksurv/ensemble/boosting.py:955: RuntimeWarning: divide by zero encountered in log
  time = numpy.log(time)
/media/san2_ssd/data/Workdir/survival/venv/lib/python3.8/site-packages/sksurv/ensemble/boosting.py:955: RuntimeWarning: divide by zero encountered in log
  time = numpy.log(time)
/media/san2_ssd/data/Workdir/survival/venv/lib/python3.8/site-packages/sksurv/ensemble/boosting.py:955: RuntimeWarning: divide by zero encountered in log
  time = numpy.log(time)
/media/san2_ssd/data/Workdir/survival/venv/lib/python3.8/site-packages/sksurv/ensemble/boosting.py:955: RuntimeWarning: divide by zero encountered in log
  time = numpy.log(time)
[32m[I 2022-05-16 04:06:31,585][0m Trial 576 finished with value: -1.0 and parameters: {'loss': 'squared', 'learning_rate': 0.000140160814727776, 'n_estimators': 525, 'criterion': 'friedman_mse', 'min_samples_split': 5, 'min_samples_leaf': 5, 'min_weight_fraction_leaf': 0.08693214392630756, 'min_impurity_decrease': 0.7518442877824216, 'max_features': 0.8172790061459443, 'subsample': 0.12803910080159647, 'dropout_rate': 0.2903525874322197, 'ccp_alpha': 0.08852897999170241}. Best is trial 573 with value: 0.8538054350764822.[0m
[32m[I 2022-05-16 04:28:27,616][0m Trial 577 finished with value: 0.7625994752874989 and parameters: {'loss': 'coxph', 'learning_rate': 5.381577867712397e-05, 'n_estimators': 457, 'criterion': 'friedman_mse', 'min_samples_split': 2, 'min_samples_leaf': 5, 'min_weight_fraction_leaf': 0.05335117245674854, 'min_impurity_decrease': 0.6944357925214841, 'max_features': 0.7850372543011097, 'subsample': 0.13499419766387352, 'dropout_rate': 0.3227283019257827, 'ccp_alpha': 0.23588869971532753}. Best is trial 573 with value: 0.8538054350764822.[0m
[32m[I 2022-05-16 04:50:17,226][0m Trial 578 finished with value: 0.7891377399936427 and parameters: {'loss': 'coxph', 'learning_rate': 0.00022667588563741705, 'n_estimators': 513, 'criterion': 'friedman_mse', 'min_samples_split': 4, 'min_samples_leaf': 5, 'min_weight_fraction_leaf': 0.0910490275017762, 'min_impurity_decrease': 0.7702284407762522, 'max_features': 0.7589759880698594, 'subsample': 0.1997683125523585, 'dropout_rate': 0.751069498426629, 'ccp_alpha': 0.08808062233952056}. Best is trial 573 with value: 0.8538054350764822.[0m
[32m[I 2022-05-16 05:15:59,550][0m Trial 579 finished with value: 0.5 and parameters: {'loss': 'coxph', 'learning_rate': 6.853719434536522e-05, 'n_estimators': 547, 'criterion': 'squared_error', 'min_samples_split': 4, 'min_samples_leaf': 5, 'min_weight_fraction_leaf': 0.07209768748142217, 'min_impurity_decrease': 0.716483692741837, 'max_features': 0.800478371100546, 'subsample': 0.16986624621612045, 'dropout_rate': 0.2296786559235675, 'ccp_alpha': 0.003860413367766079}. Best is trial 573 with value: 0.8538054350764822.[0m
[32m[I 2022-05-16 05:39:33,131][0m Trial 580 finished with value: 0.7934449743798349 and parameters: {'loss': 'coxph', 'learning_rate': 0.0003265540388775726, 'n_estimators': 445, 'criterion': 'friedman_mse', 'min_samples_split': 3, 'min_samples_leaf': 5, 'min_weight_fraction_leaf': 0.08303097465052506, 'min_impurity_decrease': 0.7862086869815513, 'max_features': 0.8262411096796753, 'subsample': 0.002415112718646091, 'dropout_rate': 0.7134066405480927, 'ccp_alpha': 0.17260139764433477}. Best is trial 573 with value: 0.8538054350764822.[0m
