[32m[I 2022-05-14 00:33:42,988][0m Trial 433 finished with value: 0.7819618003851723 and parameters: {'loss': 'coxph', 'learning_rate': 2.435336905281442e-05, 'n_estimators': 367, 'criterion': 'friedman_mse', 'min_samples_split': 6, 'min_samples_leaf': 4, 'min_weight_fraction_leaf': 0.14343889476273916, 'min_impurity_decrease': 0.04399957858360273, 'max_features': 0.8983654808158247, 'subsample': 0.05367065530623338, 'dropout_rate': 0.7213353081645626, 'ccp_alpha': 0.09377398988832554}. Best is trial 417 with value: 0.8454377430438574.[0m
/media/san2_ssd/data/Workdir/survival/venv/lib/python3.8/site-packages/sksurv/ensemble/boosting.py:955: RuntimeWarning: divide by zero encountered in log
  time = numpy.log(time)
/media/san2_ssd/data/Workdir/survival/venv/lib/python3.8/site-packages/sksurv/ensemble/boosting.py:955: RuntimeWarning: divide by zero encountered in log
  time = numpy.log(time)
/media/san2_ssd/data/Workdir/survival/venv/lib/python3.8/site-packages/sksurv/ensemble/boosting.py:955: RuntimeWarning: divide by zero encountered in log
  time = numpy.log(time)
/media/san2_ssd/data/Workdir/survival/venv/lib/python3.8/site-packages/sksurv/ensemble/boosting.py:955: RuntimeWarning: divide by zero encountered in log
  time = numpy.log(time)
/media/san2_ssd/data/Workdir/survival/venv/lib/python3.8/site-packages/sksurv/ensemble/boosting.py:955: RuntimeWarning: divide by zero encountered in log
  time = numpy.log(time)
[32m[I 2022-05-14 00:33:43,057][0m Trial 434 finished with value: -1.0 and parameters: {'loss': 'squared', 'learning_rate': 0.00013552490891589425, 'n_estimators': 330, 'criterion': 'friedman_mse', 'min_samples_split': 6, 'min_samples_leaf': 4, 'min_weight_fraction_leaf': 0.16900289863427903, 'min_impurity_decrease': 0.022734348318606927, 'max_features': 0.8465478485874945, 'subsample': 0.12783708318825604, 'dropout_rate': 0.6864887415484204, 'ccp_alpha': 0.26767174969803575}. Best is trial 417 with value: 0.8454377430438574.[0m
[32m[I 2022-05-14 00:52:05,993][0m Trial 435 finished with value: 0.8441920645369615 and parameters: {'loss': 'coxph', 'learning_rate': 2.1682194383168863e-05, 'n_estimators': 385, 'criterion': 'friedman_mse', 'min_samples_split': 6, 'min_samples_leaf': 5, 'min_weight_fraction_leaf': 0.15250563479965926, 'min_impurity_decrease': 0.04775301136266151, 'max_features': 0.872811901308036, 'subsample': 0.0985046823845352, 'dropout_rate': 0.6665844661450321, 'ccp_alpha': 0.0039492711845208655}. Best is trial 417 with value: 0.8454377430438574.[0m
[32m[I 2022-05-14 01:10:43,092][0m Trial 436 finished with value: 0.7702234396469698 and parameters: {'loss': 'coxph', 'learning_rate': 3.145424425851276e-05, 'n_estimators': 393, 'criterion': 'friedman_mse', 'min_samples_split': 6, 'min_samples_leaf': 5, 'min_weight_fraction_leaf': 0.14850489593633576, 'min_impurity_decrease': 0.049979335396961276, 'max_features': 0.8729131382786, 'subsample': 0.10029807083503822, 'dropout_rate': 0.663722635804936, 'ccp_alpha': 0.18240469871385037}. Best is trial 417 with value: 0.8454377430438574.[0m
[32m[I 2022-05-14 01:28:05,681][0m Trial 437 finished with value: 0.8416548835372044 and parameters: {'loss': 'coxph', 'learning_rate': 2.3400068205385658e-05, 'n_estimators': 351, 'criterion': 'friedman_mse', 'min_samples_split': 6, 'min_samples_leaf': 5, 'min_weight_fraction_leaf': 0.15669129851744595, 'min_impurity_decrease': 0.0013100289507387355, 'max_features': 0.8836117535282383, 'subsample': 0.07175596697672432, 'dropout_rate': 0.5786890687070162, 'ccp_alpha': 0.004658612033628755}. Best is trial 417 with value: 0.8454377430438574.[0m
[32m[I 2022-05-14 01:48:10,636][0m Trial 438 finished with value: 0.7698039011529489 and parameters: {'loss': 'coxph', 'learning_rate': 4.9981103274302516e-05, 'n_estimators': 407, 'criterion': 'friedman_mse', 'min_samples_split': 6, 'min_samples_leaf': 5, 'min_weight_fraction_leaf': 0.1558490764116086, 'min_impurity_decrease': 0.0011485962023289943, 'max_features': 0.9042616944035247, 'subsample': 0.06952898915362349, 'dropout_rate': 0.6271460473063148, 'ccp_alpha': 0.10441501922382244}. Best is trial 417 with value: 0.8454377430438574.[0m
[32m[I 2022-05-14 02:07:01,221][0m Trial 439 finished with value: 0.7410127930218101 and parameters: {'loss': 'coxph', 'learning_rate': 2.2357211129070233e-05, 'n_estimators': 372, 'criterion': 'friedman_mse', 'min_samples_split': 6, 'min_samples_leaf': 5, 'min_weight_fraction_leaf': 0.14038759656088418, 'min_impurity_decrease': 0.047889788202091305, 'max_features': 0.8860782543676333, 'subsample': 0.04333447625200195, 'dropout_rate': 0.5708640067183487, 'ccp_alpha': 0.396910697329406}. Best is trial 417 with value: 0.8454377430438574.[0m
[32m[I 2022-05-14 02:24:04,682][0m Trial 440 finished with value: 0.8367319303644951 and parameters: {'loss': 'coxph', 'learning_rate': 3.0121207306270093e-05, 'n_estimators': 358, 'criterion': 'friedman_mse', 'min_samples_split': 6, 'min_samples_leaf': 5, 'min_weight_fraction_leaf': 0.13393829001734986, 'min_impurity_decrease': 0.8785031351016328, 'max_features': 0.8999906259071258, 'subsample': 0.10071384922321866, 'dropout_rate': 0.659750485251919, 'ccp_alpha': 0.0055265254266466755}. Best is trial 417 with value: 0.8454377430438574.[0m
[32m[I 2022-05-14 02:42:17,665][0m Trial 441 finished with value: 0.7657868178083884 and parameters: {'loss': 'coxph', 'learning_rate': 4.454256983386629e-05, 'n_estimators': 353, 'criterion': 'friedman_mse', 'min_samples_split': 6, 'min_samples_leaf': 5, 'min_weight_fraction_leaf': 0.14911050184101418, 'min_impurity_decrease': 0.036631943939845917, 'max_features': 0.907076128188338, 'subsample': 0.0242204547087375, 'dropout_rate': 0.651691544796724, 'ccp_alpha': 0.16665393509611962}. Best is trial 417 with value: 0.8454377430438574.[0m
[32m[I 2022-05-14 02:58:51,906][0m Trial 442 finished with value: 0.7565603126460219 and parameters: {'loss': 'coxph', 'learning_rate': 2.725040057201928e-05, 'n_estimators': 355, 'criterion': 'friedman_mse', 'min_samples_split': 6, 'min_samples_leaf': 5, 'min_weight_fraction_leaf': 0.12275003176772789, 'min_impurity_decrease': 0.8967048293018862, 'max_features': 0.9098117091403013, 'subsample': 0.11300513133354104, 'dropout_rate': 0.6295822587314421, 'ccp_alpha': 0.10269274900959617}. Best is trial 417 with value: 0.8454377430438574.[0m
[32m[I 2022-05-14 03:15:24,014][0m Trial 443 finished with value: 0.8476953560150641 and parameters: {'loss': 'coxph', 'learning_rate': 3.4973086883945715e-05, 'n_estimators': 337, 'criterion': 'friedman_mse', 'min_samples_split': 6, 'min_samples_leaf': 5, 'min_weight_fraction_leaf': 0.13699322117305626, 'min_impurity_decrease': 0.8065065874034811, 'max_features': 0.8730802206529502, 'subsample': 0.06623993056833044, 'dropout_rate': 0.6959374901266222, 'ccp_alpha': 0.004576274468061689}. Best is trial 443 with value: 0.8476953560150641.[0m
[32m[I 2022-05-14 03:33:54,346][0m Trial 444 finished with value: 0.8500879532981875 and parameters: {'loss': 'coxph', 'learning_rate': 3.613848091946851e-05, 'n_estimators': 374, 'criterion': 'friedman_mse', 'min_samples_split': 6, 'min_samples_leaf': 5, 'min_weight_fraction_leaf': 0.1312566822571228, 'min_impurity_decrease': 0.7886544604082815, 'max_features': 0.8437411772172401, 'subsample': 0.06469333077280945, 'dropout_rate': 0.6814290120050204, 'ccp_alpha': 0.001512527653108517}. Best is trial 444 with value: 0.8500879532981875.[0m
[32m[I 2022-05-14 03:52:00,089][0m Trial 445 finished with value: 0.5 and parameters: {'loss': 'coxph', 'learning_rate': 5.746234459067927e-05, 'n_estimators': 368, 'criterion': 'friedman_mse', 'min_samples_split': 6, 'min_samples_leaf': 5, 'min_weight_fraction_leaf': 0.12534807915560428, 'min_impurity_decrease': 0.9984271517603069, 'max_features': 0.8281237215035078, 'subsample': 0.05870736540193623, 'dropout_rate': 0.677100117916671, 'ccp_alpha': 1.86266638860436}. Best is trial 444 with value: 0.8500879532981875.[0m
[32m[I 2022-05-14 04:11:06,310][0m Trial 446 finished with value: 0.5 and parameters: {'loss': 'coxph', 'learning_rate': 4.055262144314214e-05, 'n_estimators': 381, 'criterion': 'friedman_mse', 'min_samples_split': 6, 'min_samples_leaf': 5, 'min_weight_fraction_leaf': 0.1119240365383721, 'min_impurity_decrease': 0.8090926998172162, 'max_features': 0.8523324255020689, 'subsample': 0.04109288297216601, 'dropout_rate': 0.7012206920382108, 'ccp_alpha': 4.372018741260883}. Best is trial 444 with value: 0.8500879532981875.[0m
[32m[I 2022-05-14 04:27:28,288][0m Trial 447 finished with value: 0.7642853255548012 and parameters: {'loss': 'coxph', 'learning_rate': 3.63110230786112e-05, 'n_estimators': 337, 'criterion': 'friedman_mse', 'min_samples_split': 6, 'min_samples_leaf': 6, 'min_weight_fraction_leaf': 0.13294096520655202, 'min_impurity_decrease': 0.7765677341398488, 'max_features': 0.8378616677659613, 'subsample': 0.07163336957974203, 'dropout_rate': 0.675038326555169, 'ccp_alpha': 0.26540456374178684}. Best is trial 444 with value: 0.8500879532981875.[0m
[32m[I 2022-05-14 04:44:46,630][0m Trial 448 finished with value: 0.7696416562827493 and parameters: {'loss': 'coxph', 'learning_rate': 2.802634086290548e-05, 'n_estimators': 356, 'criterion': 'friedman_mse', 'min_samples_split': 6, 'min_samples_leaf': 5, 'min_weight_fraction_leaf': 0.1327721674397814, 'min_impurity_decrease': 0.8268547731947647, 'max_features': 0.8680487693368997, 'subsample': 0.07531486980377183, 'dropout_rate': 0.6461643921561125, 'ccp_alpha': 0.17021226592369554}. Best is trial 444 with value: 0.8500879532981875.[0m
[32m[I 2022-05-14 05:01:07,177][0m Trial 449 finished with value: 0.8048533975515995 and parameters: {'loss': 'coxph', 'learning_rate': 4.4605427457068206e-05, 'n_estimators': 323, 'criterion': 'friedman_mse', 'min_samples_split': 6, 'min_samples_leaf': 6, 'min_weight_fraction_leaf': 0.10587428580812537, 'min_impurity_decrease': 0.01565573721504803, 'max_features': 0.846077802008279, 'subsample': 0.03299304636765434, 'dropout_rate': 0.7072150846805632, 'ccp_alpha': 0.09869798289315361}. Best is trial 444 with value: 0.8500879532981875.[0m
[32m[I 2022-05-14 05:21:01,721][0m Trial 450 finished with value: 0.8495400105710033 and parameters: {'loss': 'coxph', 'learning_rate': 3.640737050900846e-05, 'n_estimators': 412, 'criterion': 'friedman_mse', 'min_samples_split': 5, 'min_samples_leaf': 5, 'min_weight_fraction_leaf': 0.1205689732581808, 'min_impurity_decrease': 0.8563764714965535, 'max_features': 0.8037814834225527, 'subsample': 0.08719003024900093, 'dropout_rate': 0.6935973843138126, 'ccp_alpha': 0.0034872781797509137}. Best is trial 444 with value: 0.8500879532981875.[0m
[32m[I 2022-05-14 05:41:12,056][0m Trial 451 finished with value: 0.8490964403768702 and parameters: {'loss': 'coxph', 'learning_rate': 8.271039948536676e-05, 'n_estimators': 417, 'criterion': 'friedman_mse', 'min_samples_split': 5, 'min_samples_leaf': 5, 'min_weight_fraction_leaf': 0.13983459210353127, 'min_impurity_decrease': 0.9225695234371563, 'max_features': 0.7910487817193895, 'subsample': 0.08825288966112074, 'dropout_rate': 0.6896737176140602, 'ccp_alpha': 0.0013582739927555244}. Best is trial 444 with value: 0.8500879532981875.[0m
[32m[I 2022-05-14 06:02:23,019][0m Trial 452 finished with value: 0.8499758148858693 and parameters: {'loss': 'coxph', 'learning_rate': 6.532513850663032e-05, 'n_estimators': 435, 'criterion': 'friedman_mse', 'min_samples_split': 5, 'min_samples_leaf': 5, 'min_weight_fraction_leaf': 0.12886635439306818, 'min_impurity_decrease': 0.8603363949360652, 'max_features': 0.8306393827495441, 'subsample': 0.08472777452098816, 'dropout_rate': 0.6860832670838918, 'ccp_alpha': 0.0010317622192319948}. Best is trial 444 with value: 0.8500879532981875.[0m
[32m[I 2022-05-14 06:22:57,169][0m Trial 453 finished with value: 0.5 and parameters: {'loss': 'coxph', 'learning_rate': 7.052088488717571e-05, 'n_estimators': 432, 'criterion': 'friedman_mse', 'min_samples_split': 5, 'min_samples_leaf': 5, 'min_weight_fraction_leaf': 0.11862134773511698, 'min_impurity_decrease': 0.961282437748434, 'max_features': 0.8018607196447833, 'subsample': 0.09253429356735843, 'dropout_rate': 0.6797147941538373, 'ccp_alpha': 4.064412883772726}. Best is trial 444 with value: 0.8500879532981875.[0m
[32m[I 2022-05-14 06:42:20,772][0m Trial 454 finished with value: 0.766264536145422 and parameters: {'loss': 'coxph', 'learning_rate': 5.7149307593794095e-05, 'n_estimators': 392, 'criterion': 'friedman_mse', 'min_samples_split': 6, 'min_samples_leaf': 5, 'min_weight_fraction_leaf': 0.10263233181766022, 'min_impurity_decrease': 0.854323940483052, 'max_features': 0.7844453963073067, 'subsample': 0.058663925194056554, 'dropout_rate': 0.691847258653902, 'ccp_alpha': 0.2326212393640598}. Best is trial 444 with value: 0.8500879532981875.[0m
[32m[I 2022-05-14 07:02:28,107][0m Trial 455 finished with value: 0.7825570187554641 and parameters: {'loss': 'coxph', 'learning_rate': 6.412172724295212e-05, 'n_estimators': 417, 'criterion': 'friedman_mse', 'min_samples_split': 5, 'min_samples_leaf': 5, 'min_weight_fraction_leaf': 0.12169691245328529, 'min_impurity_decrease': 0.870562048514478, 'max_features': 0.8392286274291334, 'subsample': 0.08593704408462464, 'dropout_rate': 0.6649711754559969, 'ccp_alpha': 0.10012550584678698}. Best is trial 444 with value: 0.8500879532981875.[0m
/media/san2_ssd/data/Workdir/survival/venv/lib/python3.8/site-packages/sksurv/ensemble/boosting.py:955: RuntimeWarning: divide by zero encountered in log
  time = numpy.log(time)
/media/san2_ssd/data/Workdir/survival/venv/lib/python3.8/site-packages/sksurv/ensemble/boosting.py:955: RuntimeWarning: divide by zero encountered in log
  time = numpy.log(time)
/media/san2_ssd/data/Workdir/survival/venv/lib/python3.8/site-packages/sksurv/ensemble/boosting.py:955: RuntimeWarning: divide by zero encountered in log
  time = numpy.log(time)
/media/san2_ssd/data/Workdir/survival/venv/lib/python3.8/site-packages/sksurv/ensemble/boosting.py:955: RuntimeWarning: divide by zero encountered in log
  time = numpy.log(time)
/media/san2_ssd/data/Workdir/survival/venv/lib/python3.8/site-packages/sksurv/ensemble/boosting.py:955: RuntimeWarning: divide by zero encountered in log
  time = numpy.log(time)
[32m[I 2022-05-14 07:02:28,173][0m Trial 456 finished with value: -1.0 and parameters: {'loss': 'squared', 'learning_rate': 5.0767858819018583e-05, 'n_estimators': 446, 'criterion': 'friedman_mse', 'min_samples_split': 5, 'min_samples_leaf': 5, 'min_weight_fraction_leaf': 0.1268443035343516, 'min_impurity_decrease': 0.8745203469665727, 'max_features': 0.8171449988265641, 'subsample': 0.10063607546153643, 'dropout_rate': 0.7355374053281396, 'ccp_alpha': 0.17169580342359328}. Best is trial 444 with value: 0.8500879532981875.[0m
[32m[I 2022-05-14 07:22:05,900][0m Trial 457 finished with value: 0.739997679503699 and parameters: {'loss': 'coxph', 'learning_rate': 4.0384859694226084e-05, 'n_estimators': 430, 'criterion': 'friedman_mse', 'min_samples_split': 4, 'min_samples_leaf': 5, 'min_weight_fraction_leaf': 0.11549872744215123, 'min_impurity_decrease': 0.8790408159019535, 'max_features': 0.8151549810379505, 'subsample': 0.13077096307311992, 'dropout_rate': 0.7052462315964959, 'ccp_alpha': 0.3033750741438684}. Best is trial 444 with value: 0.8500879532981875.[0m
[32m[I 2022-05-14 07:41:40,191][0m Trial 458 finished with value: 0.8496122667131868 and parameters: {'loss': 'coxph', 'learning_rate': 4.472453575449713e-05, 'n_estimators': 393, 'criterion': 'friedman_mse', 'min_samples_split': 5, 'min_samples_leaf': 5, 'min_weight_fraction_leaf': 0.1377050366546774, 'min_impurity_decrease': 0.8428253774052245, 'max_features': 0.8079933358655381, 'subsample': 0.06330028978893823, 'dropout_rate': 0.6588416636482437, 'ccp_alpha': 0.0014177526708267594}. Best is trial 444 with value: 0.8500879532981875.[0m
[32m[I 2022-05-14 08:02:15,671][0m Trial 459 finished with value: 0.7813369035860783 and parameters: {'loss': 'coxph', 'learning_rate': 3.623583219385551e-05, 'n_estimators': 409, 'criterion': 'friedman_mse', 'min_samples_split': 5, 'min_samples_leaf': 5, 'min_weight_fraction_leaf': 0.13666024005887437, 'min_impurity_decrease': 0.8346968161920687, 'max_features': 0.8186834963745928, 'subsample': 0.05427161505580133, 'dropout_rate': 0.60223908898551, 'ccp_alpha': 0.11578950047036178}. Best is trial 444 with value: 0.8500879532981875.[0m
[32m[I 2022-05-14 08:24:42,281][0m Trial 460 finished with value: 0.5 and parameters: {'loss': 'coxph', 'learning_rate': 8.167872205796123e-05, 'n_estimators': 461, 'criterion': 'friedman_mse', 'min_samples_split': 5, 'min_samples_leaf': 5, 'min_weight_fraction_leaf': 0.07856146860818033, 'min_impurity_decrease': 0.9219073731480596, 'max_features': 0.8063057658690245, 'subsample': 0.07796762609049002, 'dropout_rate': 0.6384111189978199, 'ccp_alpha': 0.44492866593290875}. Best is trial 444 with value: 0.8500879532981875.[0m
[32m[I 2022-05-14 08:45:11,145][0m Trial 461 finished with value: 0.8021069602470418 and parameters: {'loss': 'coxph', 'learning_rate': 9.382178802758433e-05, 'n_estimators': 401, 'criterion': 'friedman_mse', 'min_samples_split': 5, 'min_samples_leaf': 5, 'min_weight_fraction_leaf': 0.1336676960287778, 'min_impurity_decrease': 0.8500086915821446, 'max_features': 0.789345522784724, 'subsample': 0.0353171835496491, 'dropout_rate': 0.6596404140566535, 'ccp_alpha': 0.09380666044236013}. Best is trial 444 with value: 0.8500879532981875.[0m
[32m[I 2022-05-14 09:03:45,917][0m Trial 462 finished with value: 0.7652689828679478 and parameters: {'loss': 'coxph', 'learning_rate': 7.70258580673682e-05, 'n_estimators': 379, 'criterion': 'friedman_mse', 'min_samples_split': 5, 'min_samples_leaf': 5, 'min_weight_fraction_leaf': 0.13844097804284866, 'min_impurity_decrease': 0.9124892167948752, 'max_features': 0.7921686694650691, 'subsample': 0.06728600909360231, 'dropout_rate': 0.677180142510136, 'ccp_alpha': 0.20048178714924034}. Best is trial 444 with value: 0.8500879532981875.[0m
[32m[I 2022-05-14 09:24:01,151][0m Trial 463 finished with value: 0.8433773429108088 and parameters: {'loss': 'coxph', 'learning_rate': 4.799831689482868e-05, 'n_estimators': 423, 'criterion': 'friedman_mse', 'min_samples_split': 5, 'min_samples_leaf': 5, 'min_weight_fraction_leaf': 0.12774946840710708, 'min_impurity_decrease': 0.7937575531393627, 'max_features': 0.8200588773459672, 'subsample': 0.09763957170055217, 'dropout_rate': 0.6848773426301308, 'ccp_alpha': 0.004637449136951784}. Best is trial 444 with value: 0.8500879532981875.[0m
[32m[I 2022-05-14 09:47:09,133][0m Trial 464 finished with value: 0.7772712870862908 and parameters: {'loss': 'coxph', 'learning_rate': 5.328590959391887e-05, 'n_estimators': 478, 'criterion': 'friedman_mse', 'min_samples_split': 5, 'min_samples_leaf': 5, 'min_weight_fraction_leaf': 0.11340853140387899, 'min_impurity_decrease': 0.8486077849610165, 'max_features': 0.8250225855032671, 'subsample': 0.09947652748782068, 'dropout_rate': 0.5833415072420237, 'ccp_alpha': 0.08801095156626418}. Best is trial 444 with value: 0.8500879532981875.[0m
[32m[I 2022-05-14 10:08:59,269][0m Trial 465 finished with value: 0.5 and parameters: {'loss': 'coxph', 'learning_rate': 4.8356043279999826e-05, 'n_estimators': 420, 'criterion': 'squared_error', 'min_samples_split': 5, 'min_samples_leaf': 5, 'min_weight_fraction_leaf': 0.12586343369770386, 'min_impurity_decrease': 0.7997239535820935, 'max_features': 0.7980142075324332, 'subsample': 0.01321017808986133, 'dropout_rate': 0.6911683558566406, 'ccp_alpha': 0.1824101553241194}. Best is trial 444 with value: 0.8500879532981875.[0m
[32m[I 2022-05-14 10:27:44,283][0m Trial 466 finished with value: 0.7784793168827071 and parameters: {'loss': 'coxph', 'learning_rate': 5.995872748500215e-05, 'n_estimators': 400, 'criterion': 'friedman_mse', 'min_samples_split': 5, 'min_samples_leaf': 5, 'min_weight_fraction_leaf': 0.13227083703307796, 'min_impurity_decrease': 0.8066335780462092, 'max_features': 0.8248824340896009, 'subsample': 0.1150658765345991, 'dropout_rate': 0.6200579707446323, 'ccp_alpha': 0.09318872014600843}. Best is trial 444 with value: 0.8500879532981875.[0m
[32m[I 2022-05-14 10:51:53,148][0m Trial 467 finished with value: 0.8516197331307722 and parameters: {'loss': 'coxph', 'learning_rate': 6.993800838896705e-05, 'n_estimators': 494, 'criterion': 'friedman_mse', 'min_samples_split': 5, 'min_samples_leaf': 5, 'min_weight_fraction_leaf': 0.09146967989196818, 'min_impurity_decrease': 0.7465964581685578, 'max_features': 0.7763878319521894, 'subsample': 0.09134407188543049, 'dropout_rate': 0.655041671855703, 'ccp_alpha': 0.0029922927072097705}. Best is trial 467 with value: 0.8516197331307722.[0m
[32m[I 2022-05-14 11:12:15,932][0m Trial 468 finished with value: 0.7415111163497647 and parameters: {'loss': 'coxph', 'learning_rate': 9.910383784605058e-05, 'n_estimators': 420, 'criterion': 'friedman_mse', 'min_samples_split': 5, 'min_samples_leaf': 5, 'min_weight_fraction_leaf': 0.09583039687664865, 'min_impurity_decrease': 0.768934003198012, 'max_features': 0.7533670316584303, 'subsample': 0.07835860060144956, 'dropout_rate': 0.6671832840259452, 'ccp_alpha': 0.3121335214315831}. Best is trial 467 with value: 0.8516197331307722.[0m
[32m[I 2022-05-14 11:36:45,426][0m Trial 469 finished with value: 0.7914852612890741 and parameters: {'loss': 'coxph', 'learning_rate': 7.31632004554948e-05, 'n_estimators': 485, 'criterion': 'friedman_mse', 'min_samples_split': 5, 'min_samples_leaf': 6, 'min_weight_fraction_leaf': 0.14215293313717836, 'min_impurity_decrease': 0.7474750412675685, 'max_features': 0.7650119814650725, 'subsample': 0.05374173630932899, 'dropout_rate': 0.6523482874491721, 'ccp_alpha': 0.0882815012660024}. Best is trial 467 with value: 0.8516197331307722.[0m
