[32m[I 2022-04-21 13:57:51,310][0m Trial 853 finished with value: 0.9149868681530915 and parameters: {'alpha': 1.621669532649677, 'ties': 'breslow'}. Best is trial 411 with value: 0.91502674920718.[0m
[32m[I 2022-04-21 13:57:58,395][0m Trial 854 finished with value: 0.9150268460560183 and parameters: {'alpha': 1.902531234373698, 'ties': 'breslow'}. Best is trial 854 with value: 0.9150268460560183.[0m
[32m[I 2022-04-21 13:58:07,597][0m Trial 855 finished with value: 0.915021822362257 and parameters: {'alpha': 1.9248033266598845, 'ties': 'breslow'}. Best is trial 854 with value: 0.9150268460560183.[0m
[32m[I 2022-04-21 13:58:24,861][0m Trial 856 finished with value: 0.9149053813205829 and parameters: {'alpha': 1.8499244599259723, 'ties': 'efron'}. Best is trial 854 with value: 0.9150268460560183.[0m
[32m[I 2022-04-21 13:58:35,008][0m Trial 857 finished with value: 0.9150240261828599 and parameters: {'alpha': 1.9886671694932652, 'ties': 'breslow'}. Best is trial 854 with value: 0.9150268460560183.[0m
[32m[I 2022-04-21 13:58:42,412][0m Trial 858 finished with value: 0.9149695438075007 and parameters: {'alpha': 2.1529708822729403, 'ties': 'breslow'}. Best is trial 854 with value: 0.9150268460560183.[0m
[32m[I 2022-04-21 13:58:50,408][0m Trial 859 finished with value: 0.914992578781877 and parameters: {'alpha': 1.6825012382620468, 'ties': 'breslow'}. Best is trial 854 with value: 0.9150268460560183.[0m
[32m[I 2022-04-21 13:58:59,423][0m Trial 860 finished with value: 0.9149776142363972 and parameters: {'alpha': 2.056402419582091, 'ties': 'breslow'}. Best is trial 854 with value: 0.9150268460560183.[0m
[32m[I 2022-04-21 13:59:07,262][0m Trial 861 finished with value: 0.9150074713701268 and parameters: {'alpha': 1.8024445909474471, 'ties': 'breslow'}. Best is trial 854 with value: 0.9150268460560183.[0m
[32m[I 2022-04-21 13:59:16,792][0m Trial 862 finished with value: 0.915026161088238 and parameters: {'alpha': 1.9066157704236795, 'ties': 'breslow'}. Best is trial 854 with value: 0.9150268460560183.[0m
[32m[I 2022-04-21 13:59:24,644][0m Trial 863 finished with value: 0.9150199209040748 and parameters: {'alpha': 1.9293035566956152, 'ties': 'breslow'}. Best is trial 854 with value: 0.9150268460560183.[0m
[32m[I 2022-04-21 13:59:33,830][0m Trial 864 finished with value: 0.914992594842521 and parameters: {'alpha': 2.0101606492441646, 'ties': 'breslow'}. Best is trial 854 with value: 0.9150268460560183.[0m
[32m[I 2022-04-21 13:59:43,779][0m Trial 865 finished with value: 0.9150195884577144 and parameters: {'alpha': 1.8496020075605313, 'ties': 'breslow'}. Best is trial 854 with value: 0.9150268460560183.[0m
[32m[I 2022-04-21 13:59:52,415][0m Trial 866 finished with value: 0.9149983256753277 and parameters: {'alpha': 1.7375152764589286, 'ties': 'breslow'}. Best is trial 854 with value: 0.9150268460560183.[0m
[32m[I 2022-04-21 14:00:01,955][0m Trial 867 finished with value: 0.9150254598642178 and parameters: {'alpha': 1.9044485809773914, 'ties': 'breslow'}. Best is trial 854 with value: 0.9150268460560183.[0m
[32m[I 2022-04-21 14:00:11,412][0m Trial 868 finished with value: 0.9149743670478789 and parameters: {'alpha': 2.195620524040827, 'ties': 'breslow'}. Best is trial 854 with value: 0.9150268460560183.[0m
[32m[I 2022-04-21 14:00:20,595][0m Trial 869 finished with value: 0.9149707544764041 and parameters: {'alpha': 2.07969399183896, 'ties': 'breslow'}. Best is trial 854 with value: 0.9150268460560183.[0m
[32m[I 2022-04-21 14:00:29,543][0m Trial 870 finished with value: 0.9149719190185375 and parameters: {'alpha': 1.4360278814922913, 'ties': 'breslow'}. Best is trial 854 with value: 0.9150268460560183.[0m
[32m[I 2022-04-21 14:00:39,876][0m Trial 871 finished with value: 0.9149786933904178 and parameters: {'alpha': 1.5784424287027288, 'ties': 'breslow'}. Best is trial 854 with value: 0.9150268460560183.[0m
[32m[I 2022-04-21 14:00:48,575][0m Trial 872 finished with value: 0.9150220734198621 and parameters: {'alpha': 1.96845746249467, 'ties': 'breslow'}. Best is trial 854 with value: 0.9150268460560183.[0m
[32m[I 2022-04-21 14:00:57,796][0m Trial 873 finished with value: 0.915009231099335 and parameters: {'alpha': 1.7819925265576124, 'ties': 'breslow'}. Best is trial 854 with value: 0.9150268460560183.[0m
[32m[I 2022-04-21 14:01:03,083][0m Trial 874 finished with value: 0.9150173861114794 and parameters: {'alpha': 1.8469086240075998, 'ties': 'breslow'}. Best is trial 854 with value: 0.9150268460560183.[0m
[32m[I 2022-04-21 14:01:14,411][0m Trial 875 finished with value: 0.9149359828412041 and parameters: {'alpha': 3.3904903625811924, 'ties': 'breslow'}. Best is trial 854 with value: 0.9150268460560183.[0m
[32m[I 2022-04-21 14:01:27,216][0m Trial 876 finished with value: 0.9149215234032718 and parameters: {'alpha': 3.953260220918198, 'ties': 'breslow'}. Best is trial 854 with value: 0.9150268460560183.[0m
[32m[I 2022-04-21 14:01:44,914][0m Trial 877 finished with value: 0.9149299656164379 and parameters: {'alpha': 2.020758614621482, 'ties': 'efron'}. Best is trial 854 with value: 0.9150268460560183.[0m
[32m[I 2022-04-21 14:01:55,314][0m Trial 878 finished with value: 0.9149907929596462 and parameters: {'alpha': 1.6870212306132144, 'ties': 'breslow'}. Best is trial 854 with value: 0.9150268460560183.[0m
[32m[I 2022-04-21 14:02:05,296][0m Trial 879 finished with value: 0.9150193413882199 and parameters: {'alpha': 1.880013809821975, 'ties': 'breslow'}. Best is trial 854 with value: 0.9150268460560183.[0m
[32m[I 2022-04-21 14:02:14,359][0m Trial 880 finished with value: 0.9149763941542878 and parameters: {'alpha': 2.11309812886859, 'ties': 'breslow'}. Best is trial 854 with value: 0.9150268460560183.[0m
[32m[I 2022-04-21 14:02:24,821][0m Trial 881 finished with value: 0.9150246033073952 and parameters: {'alpha': 1.9759468530288644, 'ties': 'breslow'}. Best is trial 854 with value: 0.9150268460560183.[0m
[32m[I 2022-04-21 14:02:33,836][0m Trial 882 finished with value: 0.9150055539943953 and parameters: {'alpha': 1.7930994967052658, 'ties': 'breslow'}. Best is trial 854 with value: 0.9150268460560183.[0m
[32m[I 2022-04-21 14:02:44,377][0m Trial 883 finished with value: 0.9149706141982865 and parameters: {'alpha': 2.2458244291017304, 'ties': 'breslow'}. Best is trial 854 with value: 0.9150268460560183.[0m
[32m[I 2022-04-21 14:02:54,933][0m Trial 884 finished with value: 0.9150256287615269 and parameters: {'alpha': 1.8925332049532073, 'ties': 'breslow'}. Best is trial 854 with value: 0.9150268460560183.[0m
[32m[I 2022-04-21 14:03:03,117][0m Trial 885 finished with value: 0.9149818860765947 and parameters: {'alpha': 2.038137454525865, 'ties': 'breslow'}. Best is trial 854 with value: 0.9150268460560183.[0m
[32m[I 2022-04-21 14:03:16,170][0m Trial 886 finished with value: 0.9149982418132068 and parameters: {'alpha': 1.7365404158109923, 'ties': 'breslow'}. Best is trial 854 with value: 0.9150268460560183.[0m
[32m[I 2022-04-21 14:03:28,434][0m Trial 887 finished with value: 0.9150219727861193 and parameters: {'alpha': 1.932488194349586, 'ties': 'breslow'}. Best is trial 854 with value: 0.9150268460560183.[0m
[32m[I 2022-04-21 14:03:40,081][0m Trial 888 finished with value: 0.9149755795297894 and parameters: {'alpha': 2.1115733955656473, 'ties': 'breslow'}. Best is trial 854 with value: 0.9150268460560183.[0m
[32m[I 2022-04-21 14:03:51,219][0m Trial 889 finished with value: 0.9150163423549337 and parameters: {'alpha': 1.829380924826279, 'ties': 'breslow'}. Best is trial 854 with value: 0.9150268460560183.[0m
[32m[I 2022-04-21 14:04:00,537][0m Trial 890 finished with value: 0.9149909261765821 and parameters: {'alpha': 1.6665733516541859, 'ties': 'breslow'}. Best is trial 854 with value: 0.9150268460560183.[0m
[32m[I 2022-04-21 14:04:13,241][0m Trial 891 finished with value: 0.9150233886727215 and parameters: {'alpha': 1.983567199690583, 'ties': 'breslow'}. Best is trial 854 with value: 0.9150268460560183.[0m
[32m[I 2022-04-21 14:04:21,987][0m Trial 892 finished with value: 0.9150243350952462 and parameters: {'alpha': 1.8879975630468355, 'ties': 'breslow'}. Best is trial 854 with value: 0.9150268460560183.[0m
[32m[I 2022-04-21 14:04:30,208][0m Trial 893 finished with value: 0.9149921051391743 and parameters: {'alpha': 2.0117810672889216, 'ties': 'breslow'}. Best is trial 854 with value: 0.9150268460560183.[0m
[32m[I 2022-04-21 14:04:38,606][0m Trial 894 finished with value: 0.9150008043275456 and parameters: {'alpha': 1.7401752178946879, 'ties': 'breslow'}. Best is trial 854 with value: 0.9150268460560183.[0m
[32m[I 2022-04-21 14:04:52,183][0m Trial 895 finished with value: 0.9148999974796153 and parameters: {'alpha': 1.8321231527192117, 'ties': 'efron'}. Best is trial 854 with value: 0.9150268460560183.[0m
[32m[I 2022-04-21 14:05:01,679][0m Trial 896 finished with value: 0.9149734958852959 and parameters: {'alpha': 2.168566006653419, 'ties': 'breslow'}. Best is trial 854 with value: 0.9150268460560183.[0m
[32m[I 2022-04-21 14:05:12,234][0m Trial 897 finished with value: 0.914926474130181 and parameters: {'alpha': 0.9196911058906359, 'ties': 'breslow'}. Best is trial 854 with value: 0.9150268460560183.[0m
[32m[I 2022-04-21 14:05:20,981][0m Trial 898 finished with value: 0.9149829905081068 and parameters: {'alpha': 1.5993946503196226, 'ties': 'breslow'}. Best is trial 854 with value: 0.9150268460560183.[0m
[32m[I 2022-04-21 14:05:30,021][0m Trial 899 finished with value: 0.915021305820942 and parameters: {'alpha': 1.9209560977695674, 'ties': 'breslow'}. Best is trial 854 with value: 0.9150268460560183.[0m
[32m[I 2022-04-21 14:05:38,343][0m Trial 900 finished with value: 0.914957008929451 and parameters: {'alpha': 2.5543076600125354, 'ties': 'breslow'}. Best is trial 854 with value: 0.9150268460560183.[0m
[32m[I 2022-04-21 14:05:48,004][0m Trial 901 finished with value: 0.91497522843089 and parameters: {'alpha': 2.071073895946465, 'ties': 'breslow'}. Best is trial 854 with value: 0.9150268460560183.[0m
[32m[I 2022-04-21 14:05:59,471][0m Trial 902 finished with value: 0.9150059586475668 and parameters: {'alpha': 1.793837454006598, 'ties': 'breslow'}. Best is trial 854 with value: 0.9150268460560183.[0m
[32m[I 2022-04-21 14:06:11,250][0m Trial 903 finished with value: 0.915026275270758 and parameters: {'alpha': 1.9383606844261112, 'ties': 'breslow'}. Best is trial 854 with value: 0.9150268460560183.[0m
[32m[I 2022-04-21 14:06:20,793][0m Trial 904 finished with value: 0.9149926049057537 and parameters: {'alpha': 2.010022262472889, 'ties': 'breslow'}. Best is trial 854 with value: 0.9150268460560183.[0m
[32m[I 2022-04-21 14:06:29,551][0m Trial 905 finished with value: 0.9149711917680404 and parameters: {'alpha': 2.1471501943189453, 'ties': 'breslow'}. Best is trial 854 with value: 0.9150268460560183.[0m
[32m[I 2022-04-21 14:06:41,769][0m Trial 906 finished with value: 0.9149645117677355 and parameters: {'alpha': 2.312481783205109, 'ties': 'breslow'}. Best is trial 854 with value: 0.9150268460560183.[0m
[32m[I 2022-04-21 14:06:49,829][0m Trial 907 finished with value: 0.9150209389740611 and parameters: {'alpha': 1.9582105216503336, 'ties': 'breslow'}. Best is trial 854 with value: 0.9150268460560183.[0m
[32m[I 2022-04-21 14:06:59,748][0m Trial 908 finished with value: 0.9149804770228995 and parameters: {'alpha': 2.0489986673171403, 'ties': 'breslow'}. Best is trial 854 with value: 0.9150268460560183.[0m
[32m[I 2022-04-21 14:07:09,255][0m Trial 909 finished with value: 0.9150253789006456 and parameters: {'alpha': 1.9037424576246336, 'ties': 'breslow'}. Best is trial 854 with value: 0.9150268460560183.[0m
[32m[I 2022-04-21 14:07:18,174][0m Trial 910 finished with value: 0.9149680623971772 and parameters: {'alpha': 2.21776963533033, 'ties': 'breslow'}. Best is trial 854 with value: 0.9150268460560183.[0m
[32m[I 2022-04-21 14:07:26,174][0m Trial 911 finished with value: 0.9150060974840057 and parameters: {'alpha': 1.7454080646518184, 'ties': 'breslow'}. Best is trial 854 with value: 0.9150268460560183.[0m
[32m[I 2022-04-21 14:07:34,795][0m Trial 912 finished with value: 0.9150235215915931 and parameters: {'alpha': 1.9779703698519453, 'ties': 'breslow'}. Best is trial 854 with value: 0.9150268460560183.[0m
[32m[I 2022-04-21 14:07:44,610][0m Trial 913 finished with value: 0.915017206160423 and parameters: {'alpha': 1.8333959936240032, 'ties': 'breslow'}. Best is trial 854 with value: 0.9150268460560183.[0m
[32m[I 2022-04-21 14:07:58,943][0m Trial 914 finished with value: 0.914937370965007 and parameters: {'alpha': 2.0869778377614105, 'ties': 'efron'}. Best is trial 854 with value: 0.9150268460560183.[0m
[32m[I 2022-04-21 14:08:08,116][0m Trial 915 finished with value: 0.9149846158049033 and parameters: {'alpha': 1.654236257298844, 'ties': 'breslow'}. Best is trial 854 with value: 0.9150268460560183.[0m
[32m[I 2022-04-21 14:08:18,164][0m Trial 916 finished with value: 0.915025552142007 and parameters: {'alpha': 1.9134719158437257, 'ties': 'breslow'}. Best is trial 854 with value: 0.9150268460560183.[0m
[32m[I 2022-04-21 14:08:28,719][0m Trial 917 finished with value: 0.9150057288995948 and parameters: {'alpha': 1.7909122504633983, 'ties': 'breslow'}. Best is trial 854 with value: 0.9150268460560183.[0m
[32m[I 2022-04-21 14:08:40,331][0m Trial 918 finished with value: 0.9149952574782733 and parameters: {'alpha': 1.9967410932448142, 'ties': 'breslow'}. Best is trial 854 with value: 0.9150268460560183.[0m
[32m[I 2022-04-21 14:08:51,913][0m Trial 919 finished with value: 0.914961372339002 and parameters: {'alpha': 2.4051026196823604, 'ties': 'breslow'}. Best is trial 854 with value: 0.9150268460560183.[0m
[32m[I 2022-04-21 14:09:03,844][0m Trial 920 finished with value: 0.914972991405184 and parameters: {'alpha': 2.102851163750859, 'ties': 'breslow'}. Best is trial 854 with value: 0.9150268460560183.[0m
[32m[I 2022-04-21 14:09:12,523][0m Trial 921 finished with value: 0.9150163272084388 and parameters: {'alpha': 1.8412451169229556, 'ties': 'breslow'}. Best is trial 854 with value: 0.9150268460560183.[0m
[32m[I 2022-04-21 14:09:22,698][0m Trial 922 finished with value: 0.9149991952916936 and parameters: {'alpha': 1.7345347419527468, 'ties': 'breslow'}. Best is trial 854 with value: 0.9150268460560183.[0m
[32m[I 2022-04-21 14:09:33,012][0m Trial 923 finished with value: 0.9150225750822665 and parameters: {'alpha': 1.9465004865806301, 'ties': 'breslow'}. Best is trial 854 with value: 0.9150268460560183.[0m
[32m[I 2022-04-21 14:09:41,995][0m Trial 924 finished with value: 0.9150178601294439 and parameters: {'alpha': 1.8699375971406988, 'ties': 'breslow'}. Best is trial 854 with value: 0.9150268460560183.[0m
[32m[I 2022-04-21 14:09:50,235][0m Trial 925 finished with value: 0.9149732627540341 and parameters: {'alpha': 2.1846009141026643, 'ties': 'breslow'}. Best is trial 854 with value: 0.9150268460560183.[0m
[32m[I 2022-04-21 14:10:01,656][0m Trial 926 finished with value: 0.9149936186446936 and parameters: {'alpha': 2.025753663686969, 'ties': 'breslow'}. Best is trial 854 with value: 0.9150268460560183.[0m
[32m[I 2022-04-21 14:10:12,089][0m Trial 927 finished with value: 0.9149801677909709 and parameters: {'alpha': 1.5881624073038703, 'ties': 'breslow'}. Best is trial 854 with value: 0.9150268460560183.[0m
[32m[I 2022-04-21 14:10:21,083][0m Trial 928 finished with value: 0.9149971371907428 and parameters: {'alpha': 1.7176075657046739, 'ties': 'breslow'}. Best is trial 854 with value: 0.9150268460560183.[0m
[32m[I 2022-04-21 14:10:32,849][0m Trial 929 finished with value: 0.9150248759417892 and parameters: {'alpha': 1.9350715760820596, 'ties': 'breslow'}. Best is trial 854 with value: 0.9150268460560183.[0m
[32m[I 2022-04-21 14:10:41,944][0m Trial 930 finished with value: 0.9150113247800704 and parameters: {'alpha': 1.813719019110783, 'ties': 'breslow'}. Best is trial 854 with value: 0.9150268460560183.[0m
[32m[I 2022-04-21 14:10:52,631][0m Trial 931 finished with value: 0.914976610059884 and parameters: {'alpha': 2.0638474798337834, 'ties': 'breslow'}. Best is trial 854 with value: 0.9150268460560183.[0m
[32m[I 2022-04-21 14:11:03,652][0m Trial 932 finished with value: 0.9149213468342134 and parameters: {'alpha': 3.5333359357234597, 'ties': 'breslow'}. Best is trial 854 with value: 0.9150268460560183.[0m
[32m[I 2022-04-21 14:11:16,635][0m Trial 933 finished with value: 0.9149127066195663 and parameters: {'alpha': 1.889533483061632, 'ties': 'efron'}. Best is trial 854 with value: 0.9150268460560183.[0m
[32m[I 2022-04-21 14:11:26,931][0m Trial 934 finished with value: 0.9150239401382418 and parameters: {'alpha': 1.9876360493169543, 'ties': 'breslow'}. Best is trial 854 with value: 0.9150268460560183.[0m
[32m[I 2022-04-21 14:11:35,429][0m Trial 935 finished with value: 0.9149729058012148 and parameters: {'alpha': 2.1070898713339705, 'ties': 'breslow'}. Best is trial 854 with value: 0.9150268460560183.[0m
[32m[I 2022-04-21 14:11:43,276][0m Trial 936 finished with value: 0.9149744208231642 and parameters: {'alpha': 1.5062498226075796, 'ties': 'breslow'}. Best is trial 854 with value: 0.9150268460560183.[0m
[32m[I 2022-04-21 14:11:53,138][0m Trial 937 finished with value: 0.9150066721766311 and parameters: {'alpha': 1.8003635381436727, 'ties': 'breslow'}. Best is trial 854 with value: 0.9150268460560183.[0m
[32m[I 2022-04-21 14:12:02,924][0m Trial 938 finished with value: 0.9150247267400005 and parameters: {'alpha': 1.911055151387274, 'ties': 'breslow'}. Best is trial 854 with value: 0.9150268460560183.[0m
[32m[I 2022-04-21 14:12:15,162][0m Trial 939 finished with value: 0.9149914292309338 and parameters: {'alpha': 1.677155224209435, 'ties': 'breslow'}. Best is trial 854 with value: 0.9150268460560183.[0m
[32m[I 2022-04-21 14:12:24,411][0m Trial 940 finished with value: 0.9149648864662581 and parameters: {'alpha': 2.271758072610432, 'ties': 'breslow'}. Best is trial 854 with value: 0.9150268460560183.[0m
[32m[I 2022-04-21 14:12:34,947][0m Trial 941 finished with value: 0.9149939305947677 and parameters: {'alpha': 2.0235052639246565, 'ties': 'breslow'}. Best is trial 854 with value: 0.9150268460560183.[0m
[32m[I 2022-04-21 14:12:44,476][0m Trial 942 finished with value: 0.915006186668578 and parameters: {'alpha': 1.7801449386378332, 'ties': 'breslow'}. Best is trial 854 with value: 0.9150268460560183.[0m
[32m[I 2022-04-21 14:12:52,934][0m Trial 943 finished with value: 0.9150191550604646 and parameters: {'alpha': 1.88183133998156, 'ties': 'breslow'}. Best is trial 854 with value: 0.9150268460560183.[0m
[32m[I 2022-04-21 14:13:04,394][0m Trial 944 finished with value: 0.914973719798985 and parameters: {'alpha': 2.139322830470658, 'ties': 'breslow'}. Best is trial 854 with value: 0.9150268460560183.[0m
[32m[I 2022-04-21 14:13:12,882][0m Trial 945 finished with value: 0.9150237001871051 and parameters: {'alpha': 1.9822982719487237, 'ties': 'breslow'}. Best is trial 854 with value: 0.9150268460560183.[0m
[32m[I 2022-04-21 14:13:22,173][0m Trial 946 finished with value: 0.914992823164304 and parameters: {'alpha': 1.7072882423541407, 'ties': 'breslow'}. Best is trial 854 with value: 0.9150268460560183.[0m
[32m[I 2022-04-21 14:13:31,005][0m Trial 947 finished with value: 0.9150195768829702 and parameters: {'alpha': 1.8499818036866091, 'ties': 'breslow'}. Best is trial 854 with value: 0.9150268460560183.[0m
[32m[I 2022-04-21 14:13:39,895][0m Trial 948 finished with value: 0.9150224401439322 and parameters: {'alpha': 1.9449182642945588, 'ties': 'breslow'}. Best is trial 854 with value: 0.9150268460560183.[0m
[32m[I 2022-04-21 14:13:50,579][0m Trial 949 finished with value: 0.9149773054089291 and parameters: {'alpha': 2.058563094884436, 'ties': 'breslow'}. Best is trial 854 with value: 0.9150268460560183.[0m
[32m[I 2022-04-21 14:13:59,793][0m Trial 950 finished with value: 0.9150148737649053 and parameters: {'alpha': 1.8378462594317864, 'ties': 'breslow'}. Best is trial 854 with value: 0.9150268460560183.[0m
[32m[I 2022-04-21 14:14:16,533][0m Trial 951 finished with value: 0.9149526452839609 and parameters: {'alpha': 2.209249006371285, 'ties': 'efron'}. Best is trial 854 with value: 0.9150268460560183.[0m
[32m[I 2022-04-21 14:14:27,582][0m Trial 952 finished with value: 0.9150076829681979 and parameters: {'alpha': 1.7581066788143285, 'ties': 'breslow'}. Best is trial 854 with value: 0.9150268460560183.[0m
[32m[I 2022-04-21 14:14:36,401][0m Trial 953 finished with value: 0.9150219382290328 and parameters: {'alpha': 1.961397431965343, 'ties': 'breslow'}. Best is trial 854 with value: 0.9150268460560183.[0m
[32m[I 2022-04-21 14:14:45,896][0m Trial 954 finished with value: 0.914987376889987 and parameters: {'alpha': 1.6238434161187196, 'ties': 'breslow'}. Best is trial 854 with value: 0.9150268460560183.[0m
[32m[I 2022-04-21 14:14:55,125][0m Trial 955 finished with value: 0.9149716288310558 and parameters: {'alpha': 2.089668500640227, 'ties': 'breslow'}. Best is trial 854 with value: 0.9150268460560183.[0m
[32m[I 2022-04-21 14:15:04,674][0m Trial 956 finished with value: 0.9150197110019993 and parameters: {'alpha': 1.877757217239494, 'ties': 'breslow'}. Best is trial 854 with value: 0.9150268460560183.[0m
[32m[I 2022-04-21 14:15:13,255][0m Trial 957 finished with value: 0.9149937072552055 and parameters: {'alpha': 1.9930527415640027, 'ties': 'breslow'}. Best is trial 854 with value: 0.9150268460560183.[0m
[32m[I 2022-04-21 14:15:22,627][0m Trial 958 finished with value: 0.9150064739379287 and parameters: {'alpha': 1.7681529047790148, 'ties': 'breslow'}. Best is trial 854 with value: 0.9150268460560183.[0m
