[32m[I 2022-04-28 10:30:39,547][0m Trial 830 finished with value: 0.8211075786778942 and parameters: {'n_hidden': 2048, 'mixture_components': 6, 'use_sparse_layer': False, 'use_batchnorm': False, 'use_dropout': False, 'mlp_size_1': 8, 'mlp_size_2': 0, 'mlp_size_3': 0, 'kernel': 'Normal', 'loss_name': 'CensoredNLLLoss'}. Best is trial 644 with value: 0.8553858439194377.[0m
[32m[I 2022-04-28 10:36:13,504][0m Trial 831 finished with value: 0.8531177054222117 and parameters: {'n_hidden': 2048, 'mixture_components': 4, 'use_sparse_layer': False, 'use_batchnorm': False, 'use_dropout': False, 'mlp_size_1': 7, 'mlp_size_2': 1, 'mlp_size_3': 0, 'kernel': 'Normal', 'loss_name': 'CensoredNLLLoss'}. Best is trial 644 with value: 0.8553858439194377.[0m
[32m[I 2022-04-28 10:41:23,782][0m Trial 832 finished with value: 0.83383489532678 and parameters: {'n_hidden': 64, 'mixture_components': 4, 'use_sparse_layer': False, 'use_batchnorm': False, 'use_dropout': False, 'mlp_size_1': 0, 'mlp_size_2': 1, 'mlp_size_3': 0, 'kernel': 'LogLogistic', 'loss_name': 'CensoredNLLLoss'}. Best is trial 644 with value: 0.8553858439194377.[0m
[32m[I 2022-04-28 10:46:23,861][0m Trial 833 finished with value: 0.810272788544293 and parameters: {'n_hidden': 2048, 'mixture_components': 3, 'use_sparse_layer': False, 'use_batchnorm': False, 'use_dropout': False, 'mlp_size_1': 7, 'mlp_size_2': 1, 'mlp_size_3': 0, 'kernel': 'Normal', 'loss_name': 'NLLLoss'}. Best is trial 644 with value: 0.8553858439194377.[0m
[32m[I 2022-04-28 10:51:47,718][0m Trial 834 finished with value: 0.8390999600319109 and parameters: {'n_hidden': 2048, 'mixture_components': 6, 'use_sparse_layer': False, 'use_batchnorm': False, 'use_dropout': False, 'mlp_size_1': 7, 'mlp_size_2': 1, 'mlp_size_3': 0, 'kernel': 'Normal', 'loss_name': 'CensoredNLLLoss'}. Best is trial 644 with value: 0.8553858439194377.[0m
[32m[I 2022-04-28 10:56:25,798][0m Trial 835 finished with value: 0.8447968664473609 and parameters: {'n_hidden': 2048, 'mixture_components': 4, 'use_sparse_layer': False, 'use_batchnorm': False, 'use_dropout': False, 'mlp_size_1': 7, 'mlp_size_2': 1, 'mlp_size_3': 0, 'kernel': 'Logistic', 'loss_name': 'CensoredNLLLoss'}. Best is trial 644 with value: 0.8553858439194377.[0m
[32m[I 2022-04-28 11:02:13,791][0m Trial 836 finished with value: 0.8526218281373256 and parameters: {'n_hidden': 2048, 'mixture_components': 6, 'use_sparse_layer': False, 'use_batchnorm': False, 'use_dropout': False, 'mlp_size_1': 7, 'mlp_size_2': 1, 'mlp_size_3': 0, 'kernel': 'Normal', 'loss_name': 'CensoredNLLLoss'}. Best is trial 644 with value: 0.8553858439194377.[0m
[32m[I 2022-04-28 11:05:57,404][0m Trial 837 finished with value: 0.8506046452363147 and parameters: {'n_hidden': 256, 'mixture_components': 4, 'use_sparse_layer': False, 'use_batchnorm': False, 'use_dropout': False, 'mlp_size_1': 5, 'mlp_size_2': 0, 'mlp_size_3': 0, 'kernel': 'LogLogistic', 'loss_name': 'CensoredNLLLoss'}. Best is trial 644 with value: 0.8553858439194377.[0m
[32m[I 2022-04-28 11:11:36,933][0m Trial 838 finished with value: 0.8530199155115497 and parameters: {'n_hidden': 2048, 'mixture_components': 4, 'use_sparse_layer': False, 'use_batchnorm': False, 'use_dropout': False, 'mlp_size_1': 7, 'mlp_size_2': 1, 'mlp_size_3': 0, 'kernel': 'Normal', 'loss_name': 'CensoredNLLLoss'}. Best is trial 644 with value: 0.8553858439194377.[0m
[32m[I 2022-04-28 11:17:13,099][0m Trial 839 finished with value: 0.845001615975469 and parameters: {'n_hidden': 2048, 'mixture_components': 3, 'use_sparse_layer': False, 'use_batchnorm': False, 'use_dropout': False, 'mlp_size_1': 7, 'mlp_size_2': 1, 'mlp_size_3': 0, 'kernel': 'Normal', 'loss_name': 'CensoredNLLLoss'}. Best is trial 644 with value: 0.8553858439194377.[0m
[32m[I 2022-04-28 11:21:20,302][0m Trial 840 finished with value: 0.8280296070307619 and parameters: {'n_hidden': 32, 'mixture_components': 6, 'use_sparse_layer': False, 'use_batchnorm': False, 'use_dropout': False, 'mlp_size_1': 1, 'mlp_size_2': 1, 'mlp_size_3': 0, 'kernel': 'Exponential', 'loss_name': 'NLLLoss'}. Best is trial 644 with value: 0.8553858439194377.[0m
[32m[I 2022-04-28 11:27:11,094][0m Trial 841 finished with value: 0.8534552553675697 and parameters: {'n_hidden': 2048, 'mixture_components': 4, 'use_sparse_layer': False, 'use_batchnorm': False, 'use_dropout': False, 'mlp_size_1': 7, 'mlp_size_2': 1, 'mlp_size_3': 0, 'kernel': 'Normal', 'loss_name': 'CensoredNLLLoss'}. Best is trial 644 with value: 0.8553858439194377.[0m
[32m[I 2022-04-28 11:30:54,013][0m Trial 842 finished with value: 0.3845367899609203 and parameters: {'n_hidden': 2048, 'mixture_components': 4, 'use_sparse_layer': False, 'use_batchnorm': False, 'use_dropout': False, 'mlp_size_1': 7, 'mlp_size_2': 1, 'mlp_size_3': 0, 'kernel': 'LogLogistic', 'loss_name': 'CensoredNLLLoss'}. Best is trial 644 with value: 0.8553858439194377.[0m
[32m[I 2022-04-28 11:36:21,050][0m Trial 843 finished with value: 0.8518942565397671 and parameters: {'n_hidden': 2048, 'mixture_components': 6, 'use_sparse_layer': False, 'use_batchnorm': False, 'use_dropout': False, 'mlp_size_1': 6, 'mlp_size_2': 1, 'mlp_size_3': 0, 'kernel': 'Normal', 'loss_name': 'CensoredNLLLoss'}. Best is trial 644 with value: 0.8553858439194377.[0m
[32m[I 2022-04-28 11:42:18,227][0m Trial 844 finished with value: 0.8536548278766164 and parameters: {'n_hidden': 2048, 'mixture_components': 4, 'use_sparse_layer': False, 'use_batchnorm': False, 'use_dropout': False, 'mlp_size_1': 7, 'mlp_size_2': 1, 'mlp_size_3': 0, 'kernel': 'Normal', 'loss_name': 'CensoredNLLLoss'}. Best is trial 644 with value: 0.8553858439194377.[0m
[32m[I 2022-04-28 11:47:51,607][0m Trial 845 finished with value: 0.853203620227357 and parameters: {'n_hidden': 2048, 'mixture_components': 6, 'use_sparse_layer': False, 'use_batchnorm': False, 'use_dropout': False, 'mlp_size_1': 7, 'mlp_size_2': 1, 'mlp_size_3': 0, 'kernel': 'Normal', 'loss_name': 'CensoredNLLLoss'}. Best is trial 644 with value: 0.8553858439194377.[0m
[32m[I 2022-04-28 11:51:30,944][0m Trial 846 finished with value: 0.8299873616800246 and parameters: {'n_hidden': 128, 'mixture_components': 4, 'use_sparse_layer': False, 'use_batchnorm': False, 'use_dropout': False, 'mlp_size_1': 4, 'mlp_size_2': 0, 'mlp_size_3': 0, 'kernel': 'LogLogistic', 'loss_name': 'CensoredNLLLoss'}. Best is trial 644 with value: 0.8553858439194377.[0m
[32m[I 2022-04-28 11:57:43,811][0m Trial 847 finished with value: 0.8520893781515584 and parameters: {'n_hidden': 2048, 'mixture_components': 3, 'use_sparse_layer': False, 'use_batchnorm': False, 'use_dropout': False, 'mlp_size_1': 7, 'mlp_size_2': 1, 'mlp_size_3': 0, 'kernel': 'Normal', 'loss_name': 'AlternativeNLLLoss'}. Best is trial 644 with value: 0.8553858439194377.[0m
[32m[I 2022-04-28 12:10:12,260][0m Trial 848 finished with value: 0.8379622415655144 and parameters: {'n_hidden': 2048, 'mixture_components': 5, 'use_sparse_layer': False, 'use_batchnorm': True, 'use_dropout': False, 'mlp_size_1': 7, 'mlp_size_2': 1, 'mlp_size_3': 0, 'kernel': 'Normal', 'loss_name': 'AlternativeNLLLoss'}. Best is trial 644 with value: 0.8553858439194377.[0m
[32m[I 2022-04-28 12:15:24,030][0m Trial 849 finished with value: 0.8512860099907744 and parameters: {'n_hidden': 2048, 'mixture_components': 4, 'use_sparse_layer': False, 'use_batchnorm': False, 'use_dropout': False, 'mlp_size_1': 8, 'mlp_size_2': 0, 'mlp_size_3': 0, 'kernel': 'LogLogistic', 'loss_name': 'CensoredNLLLoss'}. Best is trial 644 with value: 0.8553858439194377.[0m
[32m[I 2022-04-28 12:19:46,062][0m Trial 850 finished with value: 0.8274488923664605 and parameters: {'n_hidden': 1024, 'mixture_components': 5, 'use_sparse_layer': False, 'use_batchnorm': False, 'use_dropout': False, 'mlp_size_1': 7, 'mlp_size_2': 0, 'mlp_size_3': 0, 'kernel': 'Normal', 'loss_name': 'NLLLoss'}. Best is trial 644 with value: 0.8553858439194377.[0m
[32m[I 2022-04-28 12:26:02,106][0m Trial 851 finished with value: 0.8520458361526833 and parameters: {'n_hidden': 2048, 'mixture_components': 2, 'use_sparse_layer': False, 'use_batchnorm': False, 'use_dropout': False, 'mlp_size_1': 7, 'mlp_size_2': 1, 'mlp_size_3': 0, 'kernel': 'Normal', 'loss_name': 'AlternativeNLLLoss'}. Best is trial 644 with value: 0.8553858439194377.[0m
[32m[I 2022-04-28 12:31:45,401][0m Trial 852 finished with value: 0.8524177127996125 and parameters: {'n_hidden': 2048, 'mixture_components': 3, 'use_sparse_layer': False, 'use_batchnorm': False, 'use_dropout': False, 'mlp_size_1': 7, 'mlp_size_2': 1, 'mlp_size_3': 0, 'kernel': 'Normal', 'loss_name': 'AlternativeNLLLoss'}. Best is trial 644 with value: 0.8553858439194377.[0m
[32m[I 2022-04-28 12:36:27,261][0m Trial 853 finished with value: 0.8498269202385382 and parameters: {'n_hidden': 2048, 'mixture_components': 8, 'use_sparse_layer': False, 'use_batchnorm': False, 'use_dropout': False, 'mlp_size_1': 7, 'mlp_size_2': 1, 'mlp_size_3': 0, 'kernel': 'LogLogistic', 'loss_name': 'CensoredNLLLoss'}. Best is trial 644 with value: 0.8553858439194377.[0m
[32m[I 2022-04-28 12:42:15,817][0m Trial 854 finished with value: 0.8489760520318276 and parameters: {'n_hidden': 2048, 'mixture_components': 6, 'use_sparse_layer': False, 'use_batchnorm': False, 'use_dropout': False, 'mlp_size_1': 7, 'mlp_size_2': 1, 'mlp_size_3': 0, 'kernel': 'Normal', 'loss_name': 'AlternativeNLLLoss'}. Best is trial 644 with value: 0.8553858439194377.[0m
[32m[I 2022-04-28 12:48:17,400][0m Trial 855 finished with value: 0.8533233196021468 and parameters: {'n_hidden': 2048, 'mixture_components': 4, 'use_sparse_layer': False, 'use_batchnorm': False, 'use_dropout': False, 'mlp_size_1': 7, 'mlp_size_2': 1, 'mlp_size_3': 0, 'kernel': 'Normal', 'loss_name': 'AlternativeNLLLoss'}. Best is trial 644 with value: 0.8553858439194377.[0m
[32m[I 2022-04-28 12:51:41,934][0m Trial 856 finished with value: 0.0734306499685263 and parameters: {'n_hidden': 2048, 'mixture_components': 4, 'use_sparse_layer': False, 'use_batchnorm': False, 'use_dropout': True, 'dropout': 0.9534516635973396, 'mlp_size_1': 7, 'mlp_size_2': 1, 'mlp_size_3': 0, 'kernel': 'Normal', 'loss_name': 'AlternativeNLLLoss'}. Best is trial 644 with value: 0.8553858439194377.[0m
[32m[I 2022-04-28 12:57:40,780][0m Trial 857 finished with value: 0.8527479872092407 and parameters: {'n_hidden': 2048, 'mixture_components': 5, 'use_sparse_layer': False, 'use_batchnorm': False, 'use_dropout': False, 'mlp_size_1': 7, 'mlp_size_2': 1, 'mlp_size_3': 0, 'kernel': 'LogLogistic', 'loss_name': 'CensoredNLLLoss'}. Best is trial 644 with value: 0.8553858439194377.[0m
[32m[I 2022-04-28 13:02:35,784][0m Trial 858 finished with value: 0.47098130147294165 and parameters: {'n_hidden': 2048, 'mixture_components': 6, 'use_sparse_layer': False, 'use_batchnorm': False, 'use_dropout': False, 'mlp_size_1': 6, 'mlp_size_2': 1, 'mlp_size_3': 0, 'kernel': 'Normal', 'loss_name': 'AlternativeNLLLoss'}. Best is trial 644 with value: 0.8553858439194377.[0m
[32m[I 2022-04-28 13:07:53,299][0m Trial 859 finished with value: 0.842190769548723 and parameters: {'n_hidden': 2048, 'mixture_components': 5, 'use_sparse_layer': False, 'use_batchnorm': False, 'use_dropout': False, 'mlp_size_1': 7, 'mlp_size_2': 1, 'mlp_size_3': 0, 'kernel': 'Normal', 'loss_name': 'AlternativeNLLLoss'}. Best is trial 644 with value: 0.8553858439194377.[0m
[32m[I 2022-04-28 13:13:48,940][0m Trial 860 finished with value: 0.8406665693036686 and parameters: {'n_hidden': 64, 'mixture_components': 4, 'use_sparse_layer': False, 'use_batchnorm': False, 'use_dropout': False, 'mlp_size_1': 1, 'mlp_size_2': 1, 'mlp_size_3': 0, 'kernel': 'Normal', 'loss_name': 'CensoredNLLLoss'}. Best is trial 644 with value: 0.8553858439194377.[0m
[32m[I 2022-04-28 13:19:29,556][0m Trial 861 finished with value: 0.8495905960145045 and parameters: {'n_hidden': 2048, 'mixture_components': 5, 'use_sparse_layer': False, 'use_batchnorm': False, 'use_dropout': False, 'mlp_size_1': 8, 'mlp_size_2': 0, 'mlp_size_3': 0, 'kernel': 'Logistic', 'loss_name': 'AlternativeNLLLoss'}. Best is trial 644 with value: 0.8553858439194377.[0m
[32m[I 2022-04-28 13:24:12,104][0m Trial 862 finished with value: 0.8404410168362249 and parameters: {'n_hidden': 2048, 'mixture_components': 6, 'use_sparse_layer': False, 'use_batchnorm': False, 'use_dropout': False, 'mlp_size_1': 7, 'mlp_size_2': 1, 'mlp_size_3': 0, 'kernel': 'LogLogistic', 'loss_name': 'AlternativeNLLLoss'}. Best is trial 644 with value: 0.8553858439194377.[0m
[32m[I 2022-04-28 13:30:14,125][0m Trial 863 finished with value: 0.8546017258093533 and parameters: {'n_hidden': 2048, 'mixture_components': 5, 'use_sparse_layer': False, 'use_batchnorm': False, 'use_dropout': False, 'mlp_size_1': 7, 'mlp_size_2': 1, 'mlp_size_3': 0, 'kernel': 'Normal', 'loss_name': 'AlternativeNLLLoss'}. Best is trial 644 with value: 0.8553858439194377.[0m
[32m[I 2022-04-28 13:36:07,994][0m Trial 864 finished with value: 0.854188909495926 and parameters: {'n_hidden': 2048, 'mixture_components': 5, 'use_sparse_layer': False, 'use_batchnorm': False, 'use_dropout': False, 'mlp_size_1': 7, 'mlp_size_2': 1, 'mlp_size_3': 0, 'kernel': 'Normal', 'loss_name': 'AlternativeNLLLoss'}. Best is trial 644 with value: 0.8553858439194377.[0m
[32m[I 2022-04-28 13:41:45,566][0m Trial 865 finished with value: 0.8364358015174338 and parameters: {'n_hidden': 2048, 'mixture_components': 5, 'use_sparse_layer': False, 'use_batchnorm': False, 'use_dropout': False, 'mlp_size_1': 7, 'mlp_size_2': 1, 'mlp_size_3': 0, 'kernel': 'Normal', 'loss_name': 'AlternativeNLLLoss'}. Best is trial 644 with value: 0.8553858439194377.[0m
[32m[I 2022-04-28 13:47:41,553][0m Trial 866 finished with value: 0.8521129778274673 and parameters: {'n_hidden': 2048, 'mixture_components': 5, 'use_sparse_layer': False, 'use_batchnorm': False, 'use_dropout': False, 'mlp_size_1': 7, 'mlp_size_2': 1, 'mlp_size_3': 0, 'kernel': 'Normal', 'loss_name': 'AlternativeNLLLoss'}. Best is trial 644 with value: 0.8553858439194377.[0m
[32m[I 2022-04-28 13:54:30,961][0m Trial 867 finished with value: 0.8430615002140238 and parameters: {'n_hidden': 32, 'mixture_components': 5, 'use_sparse_layer': False, 'use_batchnorm': False, 'use_dropout': False, 'mlp_size_1': 1, 'mlp_size_2': 1, 'mlp_size_3': 0, 'kernel': 'Normal', 'loss_name': 'AlternativeNLLLoss'}. Best is trial 644 with value: 0.8553858439194377.[0m
[32m[I 2022-04-28 14:00:40,643][0m Trial 868 finished with value: 0.8474963097685608 and parameters: {'n_hidden': 256, 'mixture_components': 5, 'use_sparse_layer': False, 'use_batchnorm': True, 'use_dropout': False, 'mlp_size_1': 5, 'mlp_size_2': 0, 'mlp_size_3': 0, 'kernel': 'Normal', 'loss_name': 'AlternativeNLLLoss'}. Best is trial 644 with value: 0.8553858439194377.[0m
[32m[I 2022-04-28 14:06:46,198][0m Trial 869 finished with value: 0.8372091455668436 and parameters: {'n_hidden': 2048, 'mixture_components': 5, 'use_sparse_layer': False, 'use_batchnorm': False, 'use_dropout': False, 'mlp_size_1': 7, 'mlp_size_2': 1, 'mlp_size_3': 0, 'kernel': 'Normal', 'loss_name': 'AlternativeNLLLoss'}. Best is trial 644 with value: 0.8553858439194377.[0m
[32m[I 2022-04-28 14:12:54,179][0m Trial 870 finished with value: 0.8541255120677074 and parameters: {'n_hidden': 2048, 'mixture_components': 5, 'use_sparse_layer': False, 'use_batchnorm': False, 'use_dropout': False, 'mlp_size_1': 7, 'mlp_size_2': 1, 'mlp_size_3': 0, 'kernel': 'Normal', 'loss_name': 'AlternativeNLLLoss'}. Best is trial 644 with value: 0.8553858439194377.[0m
[32m[I 2022-04-28 14:18:16,910][0m Trial 871 finished with value: 0.8478357594959955 and parameters: {'n_hidden': 2048, 'mixture_components': 5, 'use_sparse_layer': False, 'use_batchnorm': False, 'use_dropout': False, 'mlp_size_1': 7, 'mlp_size_2': 1, 'mlp_size_3': 0, 'kernel': 'Normal', 'loss_name': 'AlternativeNLLLoss'}. Best is trial 644 with value: 0.8553858439194377.[0m
[32m[I 2022-04-28 14:24:11,226][0m Trial 872 finished with value: 0.8531364142299092 and parameters: {'n_hidden': 2048, 'mixture_components': 5, 'use_sparse_layer': False, 'use_batchnorm': False, 'use_dropout': False, 'mlp_size_1': 7, 'mlp_size_2': 1, 'mlp_size_3': 0, 'kernel': 'Normal', 'loss_name': 'AlternativeNLLLoss'}. Best is trial 644 with value: 0.8553858439194377.[0m
[32m[I 2022-04-28 14:29:24,297][0m Trial 873 finished with value: 0.8319190585342244 and parameters: {'n_hidden': 128, 'mixture_components': 5, 'use_sparse_layer': False, 'use_batchnorm': False, 'use_dropout': False, 'mlp_size_1': 0, 'mlp_size_2': 1, 'mlp_size_3': 2, 'kernel': 'Normal', 'loss_name': 'AlternativeNLLLoss'}. Best is trial 644 with value: 0.8553858439194377.[0m
[32m[I 2022-04-28 14:34:42,075][0m Trial 874 finished with value: 0.732778639714503 and parameters: {'n_hidden': 2048, 'mixture_components': 5, 'use_sparse_layer': False, 'use_batchnorm': False, 'use_dropout': False, 'mlp_size_1': 7, 'mlp_size_2': 1, 'mlp_size_3': 0, 'kernel': 'Normal', 'loss_name': 'AlternativeNLLLoss'}. Best is trial 644 with value: 0.8553858439194377.[0m
[32m[I 2022-04-28 14:41:28,690][0m Trial 875 finished with value: 0.8552836225341871 and parameters: {'n_hidden': 2048, 'mixture_components': 7, 'use_sparse_layer': False, 'use_batchnorm': False, 'use_dropout': False, 'mlp_size_1': 7, 'mlp_size_2': 1, 'mlp_size_3': 0, 'kernel': 'Normal', 'loss_name': 'AlternativeNLLLoss'}. Best is trial 644 with value: 0.8553858439194377.[0m
[32m[I 2022-04-28 14:48:00,231][0m Trial 876 finished with value: 0.8522569635620044 and parameters: {'n_hidden': 2048, 'mixture_components': 5, 'use_sparse_layer': False, 'use_batchnorm': False, 'use_dropout': False, 'mlp_size_1': 7, 'mlp_size_2': 1, 'mlp_size_3': 0, 'kernel': 'Normal', 'loss_name': 'AlternativeNLLLoss'}. Best is trial 644 with value: 0.8553858439194377.[0m
[32m[I 2022-04-28 14:52:15,250][0m Trial 877 finished with value: 0.7879297506134284 and parameters: {'n_hidden': 2048, 'mixture_components': 7, 'use_sparse_layer': False, 'use_batchnorm': False, 'use_dropout': True, 'dropout': 0.8970558006823045, 'mlp_size_1': 6, 'mlp_size_2': 1, 'mlp_size_3': 0, 'kernel': 'Normal', 'loss_name': 'AlternativeNLLLoss'}. Best is trial 644 with value: 0.8553858439194377.[0m
[32m[I 2022-04-28 14:56:39,028][0m Trial 878 finished with value: 0.8228102163708471 and parameters: {'n_hidden': 2048, 'mixture_components': 7, 'use_sparse_layer': False, 'use_batchnorm': False, 'use_dropout': False, 'mlp_size_1': 7, 'mlp_size_2': 1, 'mlp_size_3': 0, 'kernel': 'Normal', 'loss_name': 'AlternativeNLLLoss'}. Best is trial 644 with value: 0.8553858439194377.[0m
[32m[I 2022-04-28 15:01:48,550][0m Trial 879 finished with value: 0.8284898318865833 and parameters: {'n_hidden': 2048, 'mixture_components': 7, 'use_sparse_layer': False, 'use_batchnorm': False, 'use_dropout': False, 'mlp_size_1': 7, 'mlp_size_2': 1, 'mlp_size_3': 0, 'kernel': 'Normal', 'loss_name': 'AlternativeNLLLoss'}. Best is trial 644 with value: 0.8553858439194377.[0m
[32m[I 2022-04-28 15:04:01,440][0m Trial 880 finished with value: -1.0 and parameters: {'n_hidden': 1024, 'mixture_components': 5, 'use_sparse_layer': False, 'use_batchnorm': False, 'use_dropout': False, 'mlp_size_1': 7, 'mlp_size_2': 0, 'mlp_size_3': 0, 'kernel': 'Exponential', 'loss_name': 'AlternativeNLLLoss'}. Best is trial 644 with value: 0.8553858439194377.[0m
[32m[I 2022-04-28 15:10:25,217][0m Trial 881 finished with value: 0.8528834292539947 and parameters: {'n_hidden': 2048, 'mixture_components': 8, 'use_sparse_layer': False, 'use_batchnorm': False, 'use_dropout': False, 'mlp_size_1': 7, 'mlp_size_2': 1, 'mlp_size_3': 0, 'kernel': 'Normal', 'loss_name': 'AlternativeNLLLoss'}. Best is trial 644 with value: 0.8553858439194377.[0m
[32m[I 2022-04-28 15:16:40,919][0m Trial 882 finished with value: 0.8520320963030595 and parameters: {'n_hidden': 2048, 'mixture_components': 8, 'use_sparse_layer': False, 'use_batchnorm': False, 'use_dropout': False, 'mlp_size_1': 8, 'mlp_size_2': 0, 'mlp_size_3': 0, 'kernel': 'Normal', 'loss_name': 'AlternativeNLLLoss'}. Best is trial 644 with value: 0.8553858439194377.[0m
[32m[I 2022-04-28 15:22:33,154][0m Trial 883 finished with value: 0.8510088743342991 and parameters: {'n_hidden': 2048, 'mixture_components': 5, 'use_sparse_layer': False, 'use_batchnorm': False, 'use_dropout': False, 'mlp_size_1': 7, 'mlp_size_2': 1, 'mlp_size_3': 0, 'kernel': 'Normal', 'loss_name': 'AlternativeNLLLoss'}. Best is trial 644 with value: 0.8553858439194377.[0m
[32m[I 2022-04-28 15:28:12,318][0m Trial 884 finished with value: 0.8495569382940584 and parameters: {'n_hidden': 2048, 'mixture_components': 7, 'use_sparse_layer': False, 'use_batchnorm': False, 'use_dropout': False, 'mlp_size_1': 7, 'mlp_size_2': 1, 'mlp_size_3': 0, 'kernel': 'Normal', 'loss_name': 'AlternativeNLLLoss'}. Best is trial 644 with value: 0.8553858439194377.[0m
[32m[I 2022-04-28 15:33:39,094][0m Trial 885 finished with value: 0.8496658644730415 and parameters: {'n_hidden': 2048, 'mixture_components': 8, 'use_sparse_layer': False, 'use_batchnorm': False, 'use_dropout': False, 'mlp_size_1': 7, 'mlp_size_2': 1, 'mlp_size_3': 0, 'kernel': 'Normal', 'loss_name': 'AlternativeNLLLoss'}. Best is trial 644 with value: 0.8553858439194377.[0m
[32m[I 2022-04-28 15:37:56,928][0m Trial 886 finished with value: 0.826477652803303 and parameters: {'n_hidden': 2048, 'mixture_components': 7, 'use_sparse_layer': False, 'use_batchnorm': False, 'use_dropout': False, 'mlp_size_1': 7, 'mlp_size_2': 1, 'mlp_size_3': 0, 'kernel': 'Normal', 'loss_name': 'NLLLoss'}. Best is trial 644 with value: 0.8553858439194377.[0m
