[32m[I 2022-05-12 07:17:22,511][0m Trial 323 finished with value: 0.7664479895672539 and parameters: {'loss': 'coxph', 'learning_rate': 2.206128961007771e-05, 'n_estimators': 901, 'criterion': 'absolute_error', 'min_samples_split': 7, 'min_samples_leaf': 2, 'min_weight_fraction_leaf': 0.19577607212619172, 'min_impurity_decrease': 0.023367155383026323, 'max_features': 0.9327824948565885, 'subsample': 0.21438227141126348, 'dropout_rate': 0.8051419185275903, 'ccp_alpha': 0.11478043234103857}. Best is trial 285 with value: 0.8408994882022112.[0m
[32m[I 2022-05-12 07:58:12,700][0m Trial 324 finished with value: 0.8094388963210614 and parameters: {'loss': 'coxph', 'learning_rate': 3.8104427305775026e-05, 'n_estimators': 853, 'criterion': 'absolute_error', 'min_samples_split': 8, 'min_samples_leaf': 2, 'min_weight_fraction_leaf': 0.17687226522044033, 'min_impurity_decrease': 0.0565090003999751, 'max_features': 0.8715326567267944, 'subsample': 0.35268134616580565, 'dropout_rate': 0.8553967401852017, 'ccp_alpha': 0.0029100373072187373}. Best is trial 285 with value: 0.8408994882022112.[0m
[32m[I 2022-05-12 08:43:39,338][0m Trial 325 finished with value: 0.7725047989700163 and parameters: {'loss': 'coxph', 'learning_rate': 1.3367533228682545e-05, 'n_estimators': 949, 'criterion': 'absolute_error', 'min_samples_split': 8, 'min_samples_leaf': 2, 'min_weight_fraction_leaf': 0.18672766013063646, 'min_impurity_decrease': 0.0010130900702706204, 'max_features': 0.9409968555766903, 'subsample': 0.14417291277200459, 'dropout_rate': 0.8374145892392392, 'ccp_alpha': 0.12910654452265735}. Best is trial 285 with value: 0.8408994882022112.[0m
[32m[I 2022-05-12 09:30:59,840][0m Trial 326 finished with value: 0.5 and parameters: {'loss': 'coxph', 'learning_rate': 8.963736943217466e-06, 'n_estimators': 909, 'criterion': 'absolute_error', 'min_samples_split': 6, 'min_samples_leaf': 2, 'min_weight_fraction_leaf': 0.16713019102753168, 'min_impurity_decrease': 0.03864020713922375, 'max_features': 0.9051553916505227, 'subsample': 0.41644438864484057, 'dropout_rate': 0.7974974265609982, 'ccp_alpha': 0.2500458912648084}. Best is trial 285 with value: 0.8408994882022112.[0m
[32m[I 2022-05-12 10:16:26,920][0m Trial 327 finished with value: 0.7655324696029311 and parameters: {'loss': 'coxph', 'learning_rate': 1.8956118961260103e-05, 'n_estimators': 947, 'criterion': 'absolute_error', 'min_samples_split': 7, 'min_samples_leaf': 2, 'min_weight_fraction_leaf': 0.19375563098157628, 'min_impurity_decrease': 0.019182113492999885, 'max_features': 0.8892665608659546, 'subsample': 0.2521333068305039, 'dropout_rate': 0.7404751328224113, 'ccp_alpha': 0.10844241407587918}. Best is trial 285 with value: 0.8408994882022112.[0m
[32m[I 2022-05-12 10:57:17,553][0m Trial 328 finished with value: 0.5 and parameters: {'loss': 'coxph', 'learning_rate': 1.1975740251703024e-05, 'n_estimators': 877, 'criterion': 'absolute_error', 'min_samples_split': 8, 'min_samples_leaf': 2, 'min_weight_fraction_leaf': 0.22498014765591184, 'min_impurity_decrease': 0.06175491723575045, 'max_features': 0.9215984304292533, 'subsample': 0.3355865661128247, 'dropout_rate': 0.820118001364861, 'ccp_alpha': 3.45846713801213}. Best is trial 285 with value: 0.8408994882022112.[0m
[32m[I 2022-05-12 11:39:42,387][0m Trial 329 finished with value: 0.7627155671860799 and parameters: {'loss': 'coxph', 'learning_rate': 3.00613321191845e-05, 'n_estimators': 810, 'criterion': 'absolute_error', 'min_samples_split': 8, 'min_samples_leaf': 2, 'min_weight_fraction_leaf': 0.17503075215659833, 'min_impurity_decrease': 0.1018491823786643, 'max_features': 0.9445823809034114, 'subsample': 0.4678812739055579, 'dropout_rate': 0.8848126243490408, 'ccp_alpha': 0.0025645160080867532}. Best is trial 285 with value: 0.8408994882022112.[0m
[32m[I 2022-05-12 12:16:20,480][0m Trial 330 finished with value: 0.5 and parameters: {'loss': 'coxph', 'learning_rate': 1.5492053184689088e-05, 'n_estimators': 948, 'criterion': 'squared_error', 'min_samples_split': 7, 'min_samples_leaf': 2, 'min_weight_fraction_leaf': 0.21098053263442348, 'min_impurity_decrease': 0.04305276435374103, 'max_features': 0.24761995262984582, 'subsample': 0.288114175396424, 'dropout_rate': 0.861672148494302, 'ccp_alpha': 0.9775769353153873}. Best is trial 285 with value: 0.8408994882022112.[0m
[32m[I 2022-05-12 12:38:38,557][0m Trial 331 finished with value: 0.7395625705274085 and parameters: {'loss': 'coxph', 'learning_rate': 2.1475025192973057e-05, 'n_estimators': 457, 'criterion': 'absolute_error', 'min_samples_split': 8, 'min_samples_leaf': 2, 'min_weight_fraction_leaf': 0.19650300576174115, 'min_impurity_decrease': 0.02052521913123475, 'max_features': 0.9699576682371008, 'subsample': 0.3694861357519974, 'dropout_rate': 0.7772277665305146, 'ccp_alpha': 0.19242344896232022}. Best is trial 285 with value: 0.8408994882022112.[0m
[32m[I 2022-05-12 13:23:41,458][0m Trial 332 finished with value: 0.7626255639193589 and parameters: {'loss': 'coxph', 'learning_rate': 1.3109358451100224e-05, 'n_estimators': 903, 'criterion': 'absolute_error', 'min_samples_split': 7, 'min_samples_leaf': 2, 'min_weight_fraction_leaf': 0.18346494645888353, 'min_impurity_decrease': 0.05603769368564801, 'max_features': 0.9162168024016256, 'subsample': 0.39412029600603876, 'dropout_rate': 0.8372170021815507, 'ccp_alpha': 0.10392902092746822}. Best is trial 285 with value: 0.8408994882022112.[0m
/media/san2_ssd/data/Workdir/survival/venv/lib/python3.8/site-packages/sksurv/ensemble/boosting.py:955: RuntimeWarning: divide by zero encountered in log
  time = numpy.log(time)
/media/san2_ssd/data/Workdir/survival/venv/lib/python3.8/site-packages/sksurv/ensemble/boosting.py:955: RuntimeWarning: divide by zero encountered in log
  time = numpy.log(time)
/media/san2_ssd/data/Workdir/survival/venv/lib/python3.8/site-packages/sksurv/ensemble/boosting.py:955: RuntimeWarning: divide by zero encountered in log
  time = numpy.log(time)
/media/san2_ssd/data/Workdir/survival/venv/lib/python3.8/site-packages/sksurv/ensemble/boosting.py:955: RuntimeWarning: divide by zero encountered in log
  time = numpy.log(time)
/media/san2_ssd/data/Workdir/survival/venv/lib/python3.8/site-packages/sksurv/ensemble/boosting.py:955: RuntimeWarning: divide by zero encountered in log
  time = numpy.log(time)
[32m[I 2022-05-12 13:23:41,516][0m Trial 333 finished with value: -1.0 and parameters: {'loss': 'squared', 'learning_rate': 1.7214033993644533e-05, 'n_estimators': 158, 'criterion': 'absolute_error', 'min_samples_split': 8, 'min_samples_leaf': 2, 'min_weight_fraction_leaf': 0.14938940559479874, 'min_impurity_decrease': 0.03920178926265321, 'max_features': 0.8934165369750339, 'subsample': 0.4122290991684764, 'dropout_rate': 0.8143376934057398, 'ccp_alpha': 0.33857619055744775}. Best is trial 285 with value: 0.8408994882022112.[0m
[32m[I 2022-05-12 14:00:39,049][0m Trial 334 finished with value: 0.8202346129801604 and parameters: {'loss': 'coxph', 'learning_rate': 9.21147325947033e-06, 'n_estimators': 858, 'criterion': 'absolute_error', 'min_samples_split': 7, 'min_samples_leaf': 3, 'min_weight_fraction_leaf': 0.16930490208532725, 'min_impurity_decrease': 0.01824423864117007, 'max_features': 0.3143669443720579, 'subsample': 0.3176921707171489, 'dropout_rate': 0.721471768914507, 'ccp_alpha': 0.0017178162978386453}. Best is trial 285 with value: 0.8408994882022112.[0m
[32m[I 2022-05-12 14:35:16,299][0m Trial 335 finished with value: 0.7857186277337185 and parameters: {'loss': 'coxph', 'learning_rate': 9.10053680382455e-06, 'n_estimators': 829, 'criterion': 'absolute_error', 'min_samples_split': 8, 'min_samples_leaf': 3, 'min_weight_fraction_leaf': 0.16741685461083852, 'min_impurity_decrease': 0.0012028219704048639, 'max_features': 0.2205555312069069, 'subsample': 0.3241909252354372, 'dropout_rate': 0.7040909572145586, 'ccp_alpha': 0.12745017085723953}. Best is trial 285 with value: 0.8408994882022112.[0m
[32m[I 2022-05-12 15:11:27,876][0m Trial 336 finished with value: 0.7392325403351245 and parameters: {'loss': 'coxph', 'learning_rate': 1.205611854502339e-05, 'n_estimators': 861, 'criterion': 'absolute_error', 'min_samples_split': 8, 'min_samples_leaf': 3, 'min_weight_fraction_leaf': 0.15463586675676086, 'min_impurity_decrease': 0.024518485192812845, 'max_features': 0.34093457341295186, 'subsample': 0.35962620436306886, 'dropout_rate': 0.7340748947012393, 'ccp_alpha': 0.21877549189411297}. Best is trial 285 with value: 0.8408994882022112.[0m
[32m[I 2022-05-12 15:27:16,388][0m Trial 337 finished with value: 0.7988021605513008 and parameters: {'loss': 'coxph', 'learning_rate': 9.246854615389443e-06, 'n_estimators': 340, 'criterion': 'absolute_error', 'min_samples_split': 8, 'min_samples_leaf': 2, 'min_weight_fraction_leaf': 0.17607444440737408, 'min_impurity_decrease': 0.09509101803889863, 'max_features': 0.9361511380939121, 'subsample': 0.1238600070766667, 'dropout_rate': 0.8703643998651219, 'ccp_alpha': 0.10022671300556078}. Best is trial 285 with value: 0.8408994882022112.[0m
[32m[I 2022-05-12 16:10:32,529][0m Trial 338 finished with value: 0.7700039546753216 and parameters: {'loss': 'coxph', 'learning_rate': 1.5566851878182114e-05, 'n_estimators': 847, 'criterion': 'absolute_error', 'min_samples_split': 7, 'min_samples_leaf': 3, 'min_weight_fraction_leaf': 0.18172121046908774, 'min_impurity_decrease': 0.017573012729802724, 'max_features': 0.9682196153088385, 'subsample': 0.37965581169622975, 'dropout_rate': 0.7619443761699403, 'ccp_alpha': 0.099649311076986}. Best is trial 285 with value: 0.8408994882022112.[0m
[32m[I 2022-05-12 16:51:12,053][0m Trial 339 finished with value: 0.5 and parameters: {'loss': 'coxph', 'learning_rate': 1.1397391627862348e-05, 'n_estimators': 876, 'criterion': 'absolute_error', 'min_samples_split': 8, 'min_samples_leaf': 2, 'min_weight_fraction_leaf': 0.16235354022081955, 'min_impurity_decrease': 0.06624265392753732, 'max_features': 0.9420922172789781, 'subsample': 0.2738845664310696, 'dropout_rate': 0.8917839231965622, 'ccp_alpha': 1.4393425577180503}. Best is trial 285 with value: 0.8408994882022112.[0m
[32m[I 2022-05-12 17:42:40,790][0m Trial 340 finished with value: 0.5 and parameters: {'loss': 'coxph', 'learning_rate': 9.511432270011162e-06, 'n_estimators': 946, 'criterion': 'absolute_error', 'min_samples_split': 8, 'min_samples_leaf': 2, 'min_weight_fraction_leaf': 0.1963000050675694, 'min_impurity_decrease': 0.019226063544635203, 'max_features': 0.913853645679543, 'subsample': 0.17376822147422724, 'dropout_rate': 0.7147654949639742, 'ccp_alpha': 1.3072521385712232}. Best is trial 285 with value: 0.8408994882022112.[0m
[32m[I 2022-05-12 18:11:11,176][0m Trial 341 finished with value: 0.7877641266807459 and parameters: {'loss': 'coxph', 'learning_rate': 1.3623290864013107e-05, 'n_estimators': 802, 'criterion': 'squared_error', 'min_samples_split': 7, 'min_samples_leaf': 2, 'min_weight_fraction_leaf': 0.2131441779806788, 'min_impurity_decrease': 0.03892925132099467, 'max_features': 0.13149913250567602, 'subsample': 0.4142470137947761, 'dropout_rate': 0.7840894992887826, 'ccp_alpha': 0.002219608222163846}. Best is trial 285 with value: 0.8408994882022112.[0m
[32m[I 2022-05-12 18:49:50,071][0m Trial 342 finished with value: 0.7409320602928269 and parameters: {'loss': 'coxph', 'learning_rate': 1.80028602482218e-05, 'n_estimators': 899, 'criterion': 'absolute_error', 'min_samples_split': 8, 'min_samples_leaf': 2, 'min_weight_fraction_leaf': 0.17260503727031212, 'min_impurity_decrease': 0.0020585300409591972, 'max_features': 0.2853339561147077, 'subsample': 0.22756135532502209, 'dropout_rate': 0.8477900470752732, 'ccp_alpha': 0.21298077565228626}. Best is trial 285 with value: 0.8408994882022112.[0m
[32m[I 2022-05-12 19:37:11,445][0m Trial 343 finished with value: 0.7631474654908387 and parameters: {'loss': 'coxph', 'learning_rate': 2.7878579991636623e-05, 'n_estimators': 955, 'criterion': 'absolute_error', 'min_samples_split': 7, 'min_samples_leaf': 2, 'min_weight_fraction_leaf': 0.1865630529446915, 'min_impurity_decrease': 0.05838555565138616, 'max_features': 0.94790117348467, 'subsample': 0.3430936458708171, 'dropout_rate': 0.7547222825458775, 'ccp_alpha': 0.10943681967889657}. Best is trial 285 with value: 0.8408994882022112.[0m
[32m[I 2022-05-12 20:18:40,026][0m Trial 344 finished with value: 0.5 and parameters: {'loss': 'coxph', 'learning_rate': 8.93185812279102e-06, 'n_estimators': 843, 'criterion': 'absolute_error', 'min_samples_split': 8, 'min_samples_leaf': 2, 'min_weight_fraction_leaf': 0.18461726667339373, 'min_impurity_decrease': 0.035977406914246106, 'max_features': 0.9221508832620479, 'subsample': 0.39003888973757783, 'dropout_rate': 0.8686803461859752, 'ccp_alpha': 0.3055009845661281}. Best is trial 285 with value: 0.8408994882022112.[0m
[32m[I 2022-05-12 21:03:22,970][0m Trial 345 finished with value: 0.7401002323583683 and parameters: {'loss': 'coxph', 'learning_rate': 1.2052965724405832e-05, 'n_estimators': 905, 'criterion': 'absolute_error', 'min_samples_split': 8, 'min_samples_leaf': 2, 'min_weight_fraction_leaf': 0.1987029545644775, 'min_impurity_decrease': 0.020820556125159984, 'max_features': 0.9651063181332279, 'subsample': 0.3646705661797621, 'dropout_rate': 0.8305127592187548, 'ccp_alpha': 0.18165250833794905}. Best is trial 285 with value: 0.8408994882022112.[0m
[32m[I 2022-05-12 21:43:48,399][0m Trial 346 finished with value: 0.7850564707495666 and parameters: {'loss': 'coxph', 'learning_rate': 1.7440399000284133e-05, 'n_estimators': 954, 'criterion': 'absolute_error', 'min_samples_split': 8, 'min_samples_leaf': 2, 'min_weight_fraction_leaf': 0.1440470394840638, 'min_impurity_decrease': 0.09333466761968187, 'max_features': 0.4396128102198062, 'subsample': 0.2559687579886489, 'dropout_rate': 0.8870479423156901, 'ccp_alpha': 0.08961792376658989}. Best is trial 285 with value: 0.8408994882022112.[0m
[32m[I 2022-05-12 22:29:24,180][0m Trial 347 finished with value: 0.8012612886334599 and parameters: {'loss': 'coxph', 'learning_rate': 1.4381684044323194e-05, 'n_estimators': 876, 'criterion': 'absolute_error', 'min_samples_split': 7, 'min_samples_leaf': 2, 'min_weight_fraction_leaf': 0.21036904945956303, 'min_impurity_decrease': 0.061289921769783456, 'max_features': 0.9364578179053191, 'subsample': 0.20637538469102248, 'dropout_rate': 0.3883655367154984, 'ccp_alpha': 0.08835395171434807}. Best is trial 285 with value: 0.8408994882022112.[0m
[32m[I 2022-05-12 23:08:59,855][0m Trial 348 finished with value: 0.8147562519553061 and parameters: {'loss': 'coxph', 'learning_rate': 2.332583725022781e-05, 'n_estimators': 812, 'criterion': 'absolute_error', 'min_samples_split': 7, 'min_samples_leaf': 3, 'min_weight_fraction_leaf': 0.17094231515890787, 'min_impurity_decrease': 0.039921788416650464, 'max_features': 0.9018887417908219, 'subsample': 0.3212152890397333, 'dropout_rate': 0.7926021546027905, 'ccp_alpha': 0.0017610122717923987}. Best is trial 285 with value: 0.8408994882022112.[0m
[32m[I 2022-05-12 23:53:26,742][0m Trial 349 finished with value: 0.7399257982904462 and parameters: {'loss': 'coxph', 'learning_rate': 1.114493417667184e-05, 'n_estimators': 922, 'criterion': 'absolute_error', 'min_samples_split': 8, 'min_samples_leaf': 2, 'min_weight_fraction_leaf': 0.15902686389177528, 'min_impurity_decrease': 0.01855465565264609, 'max_features': 0.8626701754232133, 'subsample': 0.3382937843106401, 'dropout_rate': 0.8522556879205767, 'ccp_alpha': 0.2309899460586172}. Best is trial 285 with value: 0.8408994882022112.[0m
[32m[I 2022-05-13 00:27:08,060][0m Trial 350 finished with value: 0.7606921389603751 and parameters: {'loss': 'coxph', 'learning_rate': 1.9367636016421756e-05, 'n_estimators': 956, 'criterion': 'squared_error', 'min_samples_split': 8, 'min_samples_leaf': 2, 'min_weight_fraction_leaf': 0.22099953400183298, 'min_impurity_decrease': 0.001022265139699486, 'max_features': 0.04443080532967003, 'subsample': 0.418086301964226, 'dropout_rate': 0.8274401776220871, 'ccp_alpha': 0.10513464463177742}. Best is trial 285 with value: 0.8408994882022112.[0m
[32m[I 2022-05-13 01:11:01,759][0m Trial 351 finished with value: 0.5 and parameters: {'loss': 'coxph', 'learning_rate': 9.139063582666194e-06, 'n_estimators': 875, 'criterion': 'absolute_error', 'min_samples_split': 7, 'min_samples_leaf': 2, 'min_weight_fraction_leaf': 0.19775633718890032, 'min_impurity_decrease': 0.06501068442001812, 'max_features': 0.9559476609093333, 'subsample': 0.3895942805043912, 'dropout_rate': 0.7792867535663865, 'ccp_alpha': 2.6782946613966727}. Best is trial 285 with value: 0.8408994882022112.[0m
/media/san2_ssd/data/Workdir/survival/venv/lib/python3.8/site-packages/sksurv/ensemble/boosting.py:955: RuntimeWarning: divide by zero encountered in log
  time = numpy.log(time)
/media/san2_ssd/data/Workdir/survival/venv/lib/python3.8/site-packages/sksurv/ensemble/boosting.py:955: RuntimeWarning: divide by zero encountered in log
  time = numpy.log(time)
/media/san2_ssd/data/Workdir/survival/venv/lib/python3.8/site-packages/sksurv/ensemble/boosting.py:955: RuntimeWarning: divide by zero encountered in log
  time = numpy.log(time)
/media/san2_ssd/data/Workdir/survival/venv/lib/python3.8/site-packages/sksurv/ensemble/boosting.py:955: RuntimeWarning: divide by zero encountered in log
  time = numpy.log(time)
/media/san2_ssd/data/Workdir/survival/venv/lib/python3.8/site-packages/sksurv/ensemble/boosting.py:955: RuntimeWarning: divide by zero encountered in log
  time = numpy.log(time)
[32m[I 2022-05-13 01:11:01,819][0m Trial 352 finished with value: -1.0 and parameters: {'loss': 'squared', 'learning_rate': 1.510302808198243e-05, 'n_estimators': 908, 'criterion': 'absolute_error', 'min_samples_split': 7, 'min_samples_leaf': 2, 'min_weight_fraction_leaf': 0.18096141597795323, 'min_impurity_decrease': 0.04256354690632287, 'max_features': 0.9291469645555307, 'subsample': 0.235841997383275, 'dropout_rate': 0.6307889769628265, 'ccp_alpha': 0.0024332451166793508}. Best is trial 285 with value: 0.8408994882022112.[0m
[32m[I 2022-05-13 01:57:04,450][0m Trial 353 finished with value: 0.5 and parameters: {'loss': 'coxph', 'learning_rate': 3.182034798135981e-05, 'n_estimators': 852, 'criterion': 'absolute_error', 'min_samples_split': 8, 'min_samples_leaf': 3, 'min_weight_fraction_leaf': 0.1910113544292794, 'min_impurity_decrease': 0.024181207025531636, 'max_features': 0.9736465961859558, 'subsample': 0.4631762479828161, 'dropout_rate': 0.8519529204499647, 'ccp_alpha': 0.3496337351254483}. Best is trial 285 with value: 0.8408994882022112.[0m
[32m[I 2022-05-13 02:42:34,130][0m Trial 354 finished with value: 0.7417879587599961 and parameters: {'loss': 'coxph', 'learning_rate': 2.348317298081409e-05, 'n_estimators': 950, 'criterion': 'absolute_error', 'min_samples_split': 8, 'min_samples_leaf': 2, 'min_weight_fraction_leaf': 0.1709260406350211, 'min_impurity_decrease': 0.06647175551627613, 'max_features': 0.9100439802446776, 'subsample': 0.2996975799192559, 'dropout_rate': 0.8127199738944358, 'ccp_alpha': 0.184603189324107}. Best is trial 285 with value: 0.8408994882022112.[0m
[32m[I 2022-05-13 03:20:56,600][0m Trial 355 finished with value: 0.8176524238656672 and parameters: {'loss': 'coxph', 'learning_rate': 1.2476850194689082e-05, 'n_estimators': 797, 'criterion': 'absolute_error', 'min_samples_split': 7, 'min_samples_leaf': 2, 'min_weight_fraction_leaf': 0.1992445545758034, 'min_impurity_decrease': 0.04403671257963286, 'max_features': 0.9442950582185721, 'subsample': 0.3678738434137247, 'dropout_rate': 0.8922507544668018, 'ccp_alpha': 0.003213426709565044}. Best is trial 285 with value: 0.8408994882022112.[0m
[32m[I 2022-05-13 04:03:16,654][0m Trial 356 finished with value: 0.7635814696088488 and parameters: {'loss': 'coxph', 'learning_rate': 1.2473471997314772e-05, 'n_estimators': 907, 'criterion': 'absolute_error', 'min_samples_split': 8, 'min_samples_leaf': 2, 'min_weight_fraction_leaf': 0.20691590085063646, 'min_impurity_decrease': 0.09649362658417832, 'max_features': 0.9491339283461115, 'subsample': 0.3506079579581842, 'dropout_rate': 0.8924973961825952, 'ccp_alpha': 0.10656731142607226}. Best is trial 285 with value: 0.8408994882022112.[0m
[32m[I 2022-05-13 04:42:34,450][0m Trial 357 finished with value: 0.6408202622492942 and parameters: {'loss': 'coxph', 'learning_rate': 9.080793124992305e-06, 'n_estimators': 801, 'criterion': 'absolute_error', 'min_samples_split': 8, 'min_samples_leaf': 2, 'min_weight_fraction_leaf': 0.17921098711399208, 'min_impurity_decrease': 0.019638363298895792, 'max_features': 0.9747736540867789, 'subsample': 0.37080127894527853, 'dropout_rate': 0.8905722340486086, 'ccp_alpha': 0.2408299424504878}. Best is trial 285 with value: 0.8408994882022112.[0m
[32m[I 2022-05-13 05:19:24,433][0m Trial 358 finished with value: 0.758038031693733 and parameters: {'loss': 'coxph', 'learning_rate': 1.4651076939596957e-05, 'n_estimators': 955, 'criterion': 'friedman_mse', 'min_samples_split': 7, 'min_samples_leaf': 2, 'min_weight_fraction_leaf': 0.19943837668173597, 'min_impurity_decrease': 0.046009257471180516, 'max_features': 0.945995061694403, 'subsample': 0.35603589788300594, 'dropout_rate': 0.7487374000678187, 'ccp_alpha': 0.10124298354417514}. Best is trial 285 with value: 0.8408994882022112.[0m
[32m[I 2022-05-13 06:00:35,018][0m Trial 359 finished with value: 0.8035454190096989 and parameters: {'loss': 'coxph', 'learning_rate': 1.0574718457842353e-05, 'n_estimators': 837, 'criterion': 'absolute_error', 'min_samples_split': 8, 'min_samples_leaf': 10, 'min_weight_fraction_leaf': 0.21414457053304473, 'min_impurity_decrease': 0.0010194549607202147, 'max_features': 0.926994799660877, 'subsample': 0.3820436274985716, 'dropout_rate': 0.7898557611354333, 'ccp_alpha': 0.0045542671630701805}. Best is trial 285 with value: 0.8408994882022112.[0m
