[32m[I 2022-04-21 16:38:48,652][0m Trial 118 finished with value: 0.7763163625037182 and parameters: {'splitter': 'best', 'min_samples_split': 0.36094094891192896, 'min_samples_leaf': 0.02283595736721964, 'min_weight_fraction_leaf': 0.03805922699845568, 'max_features': 0.9316993360463202}. Best is trial 52 with value: 0.8098214582394094.[0m
[32m[I 2022-04-21 16:41:03,477][0m Trial 119 finished with value: 0.8073137491125417 and parameters: {'splitter': 'best', 'min_samples_split': 0.3187161908781415, 'min_samples_leaf': 0.04265369726381804, 'min_weight_fraction_leaf': 0.062459508676735644, 'max_features': 0.9998614925285892}. Best is trial 52 with value: 0.8098214582394094.[0m
[32m[I 2022-04-21 16:42:16,512][0m Trial 120 finished with value: 0.7846697638111764 and parameters: {'splitter': 'best', 'min_samples_split': 0.11979260259208192, 'min_samples_leaf': 0.03369781017967181, 'min_weight_fraction_leaf': 0.0600463346466656, 'max_features': 0.4825246920915839}. Best is trial 52 with value: 0.8098214582394094.[0m
[32m[I 2022-04-21 16:44:00,285][0m Trial 121 finished with value: 0.8088224119909885 and parameters: {'splitter': 'best', 'min_samples_split': 0.31771552100285594, 'min_samples_leaf': 0.051146312552462915, 'min_weight_fraction_leaf': 0.09183815841374571, 'max_features': 0.9994015855219995}. Best is trial 52 with value: 0.8098214582394094.[0m
[32m[I 2022-04-21 16:45:54,507][0m Trial 122 finished with value: 0.7785244238481704 and parameters: {'splitter': 'best', 'min_samples_split': 0.1880920147796425, 'min_samples_leaf': 0.06391694690795188, 'min_weight_fraction_leaf': 0.07316911093571855, 'max_features': 0.9754531967404305}. Best is trial 52 with value: 0.8098214582394094.[0m
[32m[I 2022-04-21 16:47:59,167][0m Trial 123 finished with value: 0.7697058357331048 and parameters: {'splitter': 'best', 'min_samples_split': 0.3168798306336273, 'min_samples_leaf': 0.042236101487163225, 'min_weight_fraction_leaf': 0.09305714356429795, 'max_features': 0.9496987021838068}. Best is trial 52 with value: 0.8098214582394094.[0m
[32m[I 2022-04-21 16:49:41,118][0m Trial 124 finished with value: 0.8042671262291442 and parameters: {'splitter': 'best', 'min_samples_split': 0.37059298341945807, 'min_samples_leaf': 0.05467672062738679, 'min_weight_fraction_leaf': 0.10192663242715426, 'max_features': 0.9992669228122797}. Best is trial 52 with value: 0.8098214582394094.[0m
[32m[I 2022-04-21 16:51:27,815][0m Trial 125 finished with value: 0.7646576021046032 and parameters: {'splitter': 'best', 'min_samples_split': 0.40096379833783385, 'min_samples_leaf': 0.05040880006163788, 'min_weight_fraction_leaf': 0.08789816509411899, 'max_features': 0.9595992424757959}. Best is trial 52 with value: 0.8098214582394094.[0m
[32m[I 2022-04-21 16:53:23,927][0m Trial 126 finished with value: 0.80403961787407 and parameters: {'splitter': 'best', 'min_samples_split': 0.3711998805098841, 'min_samples_leaf': 0.011579805437123641, 'min_weight_fraction_leaf': 0.09932951803417839, 'max_features': 0.9973645780948701}. Best is trial 52 with value: 0.8098214582394094.[0m
[32m[I 2022-04-21 16:55:34,330][0m Trial 127 finished with value: 0.7652851525192869 and parameters: {'splitter': 'best', 'min_samples_split': 0.424456957620041, 'min_samples_leaf': 0.00456876246848778, 'min_weight_fraction_leaf': 0.10492433266924187, 'max_features': 0.9230058193112758}. Best is trial 52 with value: 0.8098214582394094.[0m
[32m[I 2022-04-21 16:57:27,082][0m Trial 128 finished with value: 0.8042565076571403 and parameters: {'splitter': 'best', 'min_samples_split': 0.3726300455016127, 'min_samples_leaf': 0.03816407136906297, 'min_weight_fraction_leaf': 0.057363969063273824, 'max_features': 0.9962469866513227}. Best is trial 52 with value: 0.8098214582394094.[0m
[32m[I 2022-04-21 16:59:25,753][0m Trial 129 finished with value: 0.8042565076571403 and parameters: {'splitter': 'best', 'min_samples_split': 0.37988948009699147, 'min_samples_leaf': 0.018858729323865755, 'min_weight_fraction_leaf': 0.06835623382525362, 'max_features': 0.9983980189738209}. Best is trial 52 with value: 0.8098214582394094.[0m
[32m[I 2022-04-21 17:01:17,247][0m Trial 130 finished with value: 0.8042565076571403 and parameters: {'splitter': 'best', 'min_samples_split': 0.3799727815413715, 'min_samples_leaf': 0.017235813038980585, 'min_weight_fraction_leaf': 0.06256716254173166, 'max_features': 0.998434964686569}. Best is trial 52 with value: 0.8098214582394094.[0m
[32m[I 2022-04-21 17:03:18,690][0m Trial 131 finished with value: 0.8042565076571403 and parameters: {'splitter': 'best', 'min_samples_split': 0.37262146882890956, 'min_samples_leaf': 0.010801866247780817, 'min_weight_fraction_leaf': 0.05510242387235509, 'max_features': 0.9997486008555468}. Best is trial 52 with value: 0.8098214582394094.[0m
[32m[I 2022-04-21 17:05:24,485][0m Trial 132 finished with value: 0.777149053865059 and parameters: {'splitter': 'best', 'min_samples_split': 0.3760159748223412, 'min_samples_leaf': 0.018094036877358277, 'min_weight_fraction_leaf': 0.05729941026338482, 'max_features': 0.969101384994004}. Best is trial 52 with value: 0.8098214582394094.[0m
[32m[I 2022-04-21 17:07:29,524][0m Trial 133 finished with value: 0.8047621072111616 and parameters: {'splitter': 'best', 'min_samples_split': 0.4102130771729419, 'min_samples_leaf': 0.011779780540192505, 'min_weight_fraction_leaf': 0.02921647082158592, 'max_features': 0.9997411486660445}. Best is trial 52 with value: 0.8098214582394094.[0m
[32m[I 2022-04-21 17:09:50,166][0m Trial 134 finished with value: 0.8047621072111616 and parameters: {'splitter': 'best', 'min_samples_split': 0.41123703473394513, 'min_samples_leaf': 0.0019328809507405172, 'min_weight_fraction_leaf': 0.01790376781310845, 'max_features': 0.9990246759860226}. Best is trial 52 with value: 0.8098214582394094.[0m
[32m[I 2022-04-21 17:12:44,131][0m Trial 135 finished with value: 0.778401332174713 and parameters: {'splitter': 'best', 'min_samples_split': 0.450135505406101, 'min_samples_leaf': 0.0020912903802911484, 'min_weight_fraction_leaf': 0.01801240036615794, 'max_features': 0.9554279470779182}. Best is trial 52 with value: 0.8098214582394094.[0m
[32m[I 2022-04-21 17:14:53,861][0m Trial 136 finished with value: 0.777149053865059 and parameters: {'splitter': 'best', 'min_samples_split': 0.4107157086280932, 'min_samples_leaf': 0.012743349410718363, 'min_weight_fraction_leaf': 0.03869911512389476, 'max_features': 0.9735310962726326}. Best is trial 52 with value: 0.8098214582394094.[0m
[32m[I 2022-04-21 17:17:06,896][0m Trial 137 finished with value: 0.7752004983264025 and parameters: {'splitter': 'best', 'min_samples_split': 0.38738410913933863, 'min_samples_leaf': 0.02605404939908534, 'min_weight_fraction_leaf': 0.033538387695401364, 'max_features': 0.9390348800340196}. Best is trial 52 with value: 0.8098214582394094.[0m
[32m[I 2022-04-21 17:19:26,595][0m Trial 138 finished with value: 0.8047621072111616 and parameters: {'splitter': 'best', 'min_samples_split': 0.41447041549101216, 'min_samples_leaf': 0.013269691518388997, 'min_weight_fraction_leaf': 0.0026406523959007985, 'max_features': 0.9961228900942188}. Best is trial 52 with value: 0.8098214582394094.[0m
[32m[I 2022-04-21 17:21:53,070][0m Trial 139 finished with value: 0.7764527766360565 and parameters: {'splitter': 'best', 'min_samples_split': 0.4288861652844993, 'min_samples_leaf': 0.01395142623548127, 'min_weight_fraction_leaf': 0.004999028696390469, 'max_features': 0.9384772422086534}. Best is trial 52 with value: 0.8098214582394094.[0m
[32m[I 2022-04-21 17:21:54,078][0m Trial 140 finished with value: 0.8055043242234469 and parameters: {'splitter': 'random', 'min_samples_split': 0.4110192288108788, 'min_samples_leaf': 0.030753768914261338, 'min_weight_fraction_leaf': 0.015548754495061184, 'max_features': 0.91239744155702}. Best is trial 52 with value: 0.8098214582394094.[0m
[32m[I 2022-04-21 17:21:55,001][0m Trial 141 finished with value: 0.7956688077045122 and parameters: {'splitter': 'random', 'min_samples_split': 0.41431648434940127, 'min_samples_leaf': 0.02927749566818699, 'min_weight_fraction_leaf': 0.010814068014933238, 'max_features': 0.9809353770641271}. Best is trial 52 with value: 0.8098214582394094.[0m
[32m[I 2022-04-21 17:21:55,531][0m Trial 142 finished with value: 0.7700841532483584 and parameters: {'splitter': 'random', 'min_samples_split': 0.3954281991612361, 'min_samples_leaf': 0.04015064407633954, 'min_weight_fraction_leaf': 0.012118410814042229, 'max_features': 0.9658305920451984}. Best is trial 52 with value: 0.8098214582394094.[0m
[32m[I 2022-04-21 17:21:56,378][0m Trial 143 finished with value: 0.8012060642796557 and parameters: {'splitter': 'random', 'min_samples_split': 0.38113948744233467, 'min_samples_leaf': 0.010064274650902578, 'min_weight_fraction_leaf': 0.027483552161518883, 'max_features': 0.9991916196251936}. Best is trial 52 with value: 0.8098214582394094.[0m
[32m[I 2022-04-21 17:21:57,211][0m Trial 144 finished with value: 0.8055043242234469 and parameters: {'splitter': 'random', 'min_samples_split': 0.4090477920842472, 'min_samples_leaf': 0.025048430629325345, 'min_weight_fraction_leaf': 0.04527724548492379, 'max_features': 0.9129524280105508}. Best is trial 52 with value: 0.8098214582394094.[0m
[32m[I 2022-04-21 17:21:57,827][0m Trial 145 finished with value: 0.8055043242234469 and parameters: {'splitter': 'random', 'min_samples_split': 0.4061345610100602, 'min_samples_leaf': 0.02864959666944033, 'min_weight_fraction_leaf': 0.04569469922059789, 'max_features': 0.9205548141698054}. Best is trial 52 with value: 0.8098214582394094.[0m
[32m[I 2022-04-21 17:21:58,567][0m Trial 146 finished with value: 0.8034308649461976 and parameters: {'splitter': 'random', 'min_samples_split': 0.4394208131078061, 'min_samples_leaf': 0.001526454788342728, 'min_weight_fraction_leaf': 0.04709025396082954, 'max_features': 0.9119001002172872}. Best is trial 52 with value: 0.8098214582394094.[0m
[32m[I 2022-04-21 17:21:59,049][0m Trial 147 finished with value: 0.7682350893242956 and parameters: {'splitter': 'random', 'min_samples_split': 0.4097872018713831, 'min_samples_leaf': 0.029808740865362497, 'min_weight_fraction_leaf': 0.027713859520315243, 'max_features': 0.8696384978683438}. Best is trial 52 with value: 0.8098214582394094.[0m
[32m[I 2022-04-21 17:21:59,560][0m Trial 148 finished with value: 0.7940372022789198 and parameters: {'splitter': 'random', 'min_samples_split': 0.40412767905948266, 'min_samples_leaf': 0.0361713453524998, 'min_weight_fraction_leaf': 0.00015692252258076413, 'max_features': 0.8973945837032165}. Best is trial 52 with value: 0.8098214582394094.[0m
[32m[I 2022-04-21 17:22:00,031][0m Trial 149 finished with value: 0.7622833616501206 and parameters: {'splitter': 'random', 'min_samples_split': 0.4681740879553042, 'min_samples_leaf': 0.025676637964778537, 'min_weight_fraction_leaf': 0.04294292943320313, 'max_features': 0.6826720640260171}. Best is trial 52 with value: 0.8098214582394094.[0m
[32m[I 2022-04-21 17:22:01,952][0m Trial 150 finished with value: 0.7985740514989451 and parameters: {'splitter': 'random', 'min_samples_split': 0.3925033507553797, 'min_samples_leaf': 0.048831072451400566, 'min_weight_fraction_leaf': 0.05408545614735641, 'max_features': 0.9433765363109353}. Best is trial 52 with value: 0.8098214582394094.[0m
[32m[I 2022-04-21 17:22:02,588][0m Trial 151 finished with value: 0.7669759123387727 and parameters: {'splitter': 'random', 'min_samples_split': 0.4201587416214143, 'min_samples_leaf': 0.019325853455695322, 'min_weight_fraction_leaf': 0.06791235226367906, 'max_features': 0.9648761399506204}. Best is trial 52 with value: 0.8098214582394094.[0m
[32m[I 2022-04-21 17:22:03,179][0m Trial 152 finished with value: 0.7980018169667117 and parameters: {'splitter': 'random', 'min_samples_split': 0.3841651487040394, 'min_samples_leaf': 0.037632337921367054, 'min_weight_fraction_leaf': 0.014070117658502006, 'max_features': 0.9779875304935142}. Best is trial 52 with value: 0.8098214582394094.[0m
[32m[I 2022-04-21 17:22:04,015][0m Trial 153 finished with value: 0.8066965187270891 and parameters: {'splitter': 'random', 'min_samples_split': 0.43080293714609574, 'min_samples_leaf': 0.01936507967161709, 'min_weight_fraction_leaf': 0.029389355220812485, 'max_features': 0.924040126575121}. Best is trial 52 with value: 0.8098214582394094.[0m
[32m[I 2022-04-21 17:22:05,201][0m Trial 154 finished with value: 0.8093784233342556 and parameters: {'splitter': 'random', 'min_samples_split': 0.426399489196049, 'min_samples_leaf': 0.019733778643968143, 'min_weight_fraction_leaf': 0.028011735643424705, 'max_features': 0.925493700677849}. Best is trial 52 with value: 0.8098214582394094.[0m
[32m[I 2022-04-21 17:22:05,968][0m Trial 155 finished with value: 0.8093784233342556 and parameters: {'splitter': 'random', 'min_samples_split': 0.4427633273993309, 'min_samples_leaf': 0.010899510387218321, 'min_weight_fraction_leaf': 0.024956012976212683, 'max_features': 0.914667868013199}. Best is trial 52 with value: 0.8098214582394094.[0m
[32m[I 2022-04-21 17:22:06,461][0m Trial 156 finished with value: 0.7822297967131655 and parameters: {'splitter': 'random', 'min_samples_split': 0.42982601563324535, 'min_samples_leaf': 0.045388457758354615, 'min_weight_fraction_leaf': 0.024621252418345507, 'max_features': 0.8398917533693483}. Best is trial 52 with value: 0.8098214582394094.[0m
[32m[I 2022-04-21 17:22:06,938][0m Trial 157 finished with value: 0.7682350893242956 and parameters: {'splitter': 'random', 'min_samples_split': 0.4434980744166289, 'min_samples_leaf': 0.02906391371698345, 'min_weight_fraction_leaf': 0.034882265356842086, 'max_features': 0.8782211811988664}. Best is trial 52 with value: 0.8098214582394094.[0m
[32m[I 2022-04-21 17:22:07,544][0m Trial 158 finished with value: 0.8093784233342556 and parameters: {'splitter': 'random', 'min_samples_split': 0.45209949469181676, 'min_samples_leaf': 0.021587393350357843, 'min_weight_fraction_leaf': 0.00046437221260808154, 'max_features': 0.914211503623392}. Best is trial 52 with value: 0.8098214582394094.[0m
[32m[I 2022-04-21 17:22:08,275][0m Trial 159 finished with value: 0.8093784233342556 and parameters: {'splitter': 'random', 'min_samples_split': 0.46620167348730324, 'min_samples_leaf': 0.003997279643919681, 'min_weight_fraction_leaf': 0.019398078566021403, 'max_features': 0.9102958703468496}. Best is trial 52 with value: 0.8098214582394094.[0m
[32m[I 2022-04-21 17:22:08,878][0m Trial 160 finished with value: 0.7826753799505408 and parameters: {'splitter': 'random', 'min_samples_split': 0.48878737924731913, 'min_samples_leaf': 0.00465366070732569, 'min_weight_fraction_leaf': 0.017471618451376028, 'max_features': 0.8963435377832859}. Best is trial 52 with value: 0.8098214582394094.[0m
[32m[I 2022-04-21 17:22:09,604][0m Trial 161 finished with value: 0.8093784233342556 and parameters: {'splitter': 'random', 'min_samples_split': 0.45764124531407796, 'min_samples_leaf': 0.0013941525849607561, 'min_weight_fraction_leaf': 0.006897590673493773, 'max_features': 0.9188845653749124}. Best is trial 52 with value: 0.8098214582394094.[0m
[32m[I 2022-04-21 17:22:10,248][0m Trial 162 finished with value: 0.7806483750376062 and parameters: {'splitter': 'random', 'min_samples_split': 0.4643713442690361, 'min_samples_leaf': 0.002280785082697757, 'min_weight_fraction_leaf': 0.000858921469170694, 'max_features': 0.8576305860479877}. Best is trial 52 with value: 0.8098214582394094.[0m
[32m[I 2022-04-21 17:22:11,411][0m Trial 163 finished with value: 0.8093784233342556 and parameters: {'splitter': 'random', 'min_samples_split': 0.45653106108973446, 'min_samples_leaf': 0.02369844876995405, 'min_weight_fraction_leaf': 0.01035878203021411, 'max_features': 0.907274062395718}. Best is trial 52 with value: 0.8098214582394094.[0m
[32m[I 2022-04-21 17:22:12,576][0m Trial 164 finished with value: 0.7682350893242956 and parameters: {'splitter': 'random', 'min_samples_split': 0.4539226042017483, 'min_samples_leaf': 0.024660195303300624, 'min_weight_fraction_leaf': 0.010688927633637236, 'max_features': 0.8836972431771628}. Best is trial 52 with value: 0.8098214582394094.[0m
[32m[I 2022-04-21 17:22:13,655][0m Trial 165 finished with value: 0.8093784233342556 and parameters: {'splitter': 'random', 'min_samples_split': 0.48287334852085717, 'min_samples_leaf': 0.02480294456396081, 'min_weight_fraction_leaf': 0.02675546316085619, 'max_features': 0.9209188813053735}. Best is trial 52 with value: 0.8098214582394094.[0m
[32m[I 2022-04-21 17:22:14,685][0m Trial 166 finished with value: 0.8093784233342556 and parameters: {'splitter': 'random', 'min_samples_split': 0.4788484106163857, 'min_samples_leaf': 0.02674445080417958, 'min_weight_fraction_leaf': 0.02530694323428346, 'max_features': 0.9174826767387743}. Best is trial 52 with value: 0.8098214582394094.[0m
[32m[I 2022-04-21 17:22:16,073][0m Trial 167 finished with value: 0.8034308649461976 and parameters: {'splitter': 'random', 'min_samples_split': 0.47308873145384667, 'min_samples_leaf': 0.03304071648138965, 'min_weight_fraction_leaf': 0.04504186217255547, 'max_features': 0.9181207939773184}. Best is trial 52 with value: 0.8098214582394094.[0m
[32m[I 2022-04-21 17:22:16,709][0m Trial 168 finished with value: 0.7682350893242956 and parameters: {'splitter': 'random', 'min_samples_split': 0.4809940161162985, 'min_samples_leaf': 0.023433160136179843, 'min_weight_fraction_leaf': 0.0324450005094228, 'max_features': 0.8652503153524975}. Best is trial 52 with value: 0.8098214582394094.[0m
[32m[I 2022-04-21 17:22:17,322][0m Trial 169 finished with value: 0.8034308649461976 and parameters: {'splitter': 'random', 'min_samples_split': 0.4939054748702497, 'min_samples_leaf': 0.05568544373516182, 'min_weight_fraction_leaf': 0.020561080875167396, 'max_features': 0.9094299802894658}. Best is trial 52 with value: 0.8098214582394094.[0m
[32m[I 2022-04-21 17:22:18,078][0m Trial 170 finished with value: 0.7878705917949307 and parameters: {'splitter': 'random', 'min_samples_split': 0.47568136744782885, 'min_samples_leaf': 0.04209091955516078, 'min_weight_fraction_leaf': 0.03652148977173367, 'max_features': 0.8936052857203806}. Best is trial 52 with value: 0.8098214582394094.[0m
[32m[I 2022-04-21 17:22:19,000][0m Trial 171 finished with value: 0.7986065975584268 and parameters: {'splitter': 'random', 'min_samples_split': 0.4531446774106353, 'min_samples_leaf': 0.0010519391610773234, 'min_weight_fraction_leaf': 0.02086463372241489, 'max_features': 0.9304849353440331}. Best is trial 52 with value: 0.8098214582394094.[0m
[32m[I 2022-04-21 17:22:19,661][0m Trial 172 finished with value: 0.8093784233342556 and parameters: {'splitter': 'random', 'min_samples_split': 0.4841523190389286, 'min_samples_leaf': 0.019610509252255742, 'min_weight_fraction_leaf': 0.0011137271115815714, 'max_features': 0.9141824199218337}. Best is trial 52 with value: 0.8098214582394094.[0m
[32m[I 2022-04-21 17:22:20,206][0m Trial 173 finished with value: 0.7780330074642946 and parameters: {'splitter': 'random', 'min_samples_split': 0.46237431660411454, 'min_samples_leaf': 0.028779608666433275, 'min_weight_fraction_leaf': 0.004391593833049701, 'max_features': 0.8285205897739754}. Best is trial 52 with value: 0.8098214582394094.[0m
[32m[I 2022-04-21 17:22:20,808][0m Trial 174 finished with value: 0.8093784233342556 and parameters: {'splitter': 'random', 'min_samples_split': 0.4888589736826546, 'min_samples_leaf': 0.01983331046170403, 'min_weight_fraction_leaf': 0.011804043673819618, 'max_features': 0.9105667282562161}. Best is trial 52 with value: 0.8098214582394094.[0m
[32m[I 2022-04-21 17:22:21,335][0m Trial 175 finished with value: 0.7682350893242956 and parameters: {'splitter': 'random', 'min_samples_split': 0.48577907715674734, 'min_samples_leaf': 0.03864151556408057, 'min_weight_fraction_leaf': 0.012522439674822819, 'max_features': 0.8807249973204598}. Best is trial 52 with value: 0.8098214582394094.[0m
[32m[I 2022-04-21 17:22:21,970][0m Trial 176 finished with value: 0.8023549216988499 and parameters: {'splitter': 'random', 'min_samples_split': 0.49837952170194955, 'min_samples_leaf': 0.01225898000645399, 'min_weight_fraction_leaf': 0.025073755761253202, 'max_features': 0.9225743444511343}. Best is trial 52 with value: 0.8098214582394094.[0m
[32m[I 2022-04-21 17:22:22,928][0m Trial 177 finished with value: 0.7852035056309633 and parameters: {'splitter': 'random', 'min_samples_split': 0.45684490717018333, 'min_samples_leaf': 0.019090321482201265, 'min_weight_fraction_leaf': 0.00020594620866671437, 'max_features': 0.8575476011339669}. Best is trial 52 with value: 0.8098214582394094.[0m
[32m[I 2022-04-21 17:22:23,651][0m Trial 178 finished with value: 0.7940372022789198 and parameters: {'splitter': 'random', 'min_samples_split': 0.4449453745804789, 'min_samples_leaf': 0.04887954099510294, 'min_weight_fraction_leaf': 0.009250204399006076, 'max_features': 0.8998683710741447}. Best is trial 52 with value: 0.8098214582394094.[0m
[32m[I 2022-04-21 17:22:24,522][0m Trial 179 finished with value: 0.7907011627675173 and parameters: {'splitter': 'random', 'min_samples_split': 0.4788699836221703, 'min_samples_leaf': 0.021830936076268556, 'min_weight_fraction_leaf': 0.04333977955708714, 'max_features': 0.9340359134258366}. Best is trial 52 with value: 0.8098214582394094.[0m
[32m[I 2022-04-21 17:22:25,016][0m Trial 180 finished with value: 0.6851609036733942 and parameters: {'splitter': 'random', 'min_samples_split': 0.4336028179705399, 'min_samples_leaf': 0.33586748950381184, 'min_weight_fraction_leaf': 0.0273520704689262, 'max_features': 0.8881767950478496}. Best is trial 52 with value: 0.8098214582394094.[0m
