[32m[I 2022-04-21 17:51:18,936][0m Trial 684 finished with value: 0.7827797694220563 and parameters: {'splitter': 'random', 'min_samples_split': 0.18336514766980236, 'min_samples_leaf': 0.0676706528550553, 'min_weight_fraction_leaf': 0.0882256333291444, 'max_features': 0.9603555690660625}. Best is trial 660 with value: 0.812979986296886.[0m
[32m[I 2022-04-21 17:51:19,909][0m Trial 685 finished with value: 0.8014664542297467 and parameters: {'splitter': 'random', 'min_samples_split': 0.19375551436769628, 'min_samples_leaf': 0.050695967521937065, 'min_weight_fraction_leaf': 0.0627130623046231, 'max_features': 0.9464949671042405}. Best is trial 660 with value: 0.812979986296886.[0m
[32m[I 2022-04-21 17:51:20,673][0m Trial 686 finished with value: 0.7910427894874178 and parameters: {'splitter': 'random', 'min_samples_split': 0.21203305165848785, 'min_samples_leaf': 0.10021212856334316, 'min_weight_fraction_leaf': 0.04967588235392217, 'max_features': 0.9122459332384967}. Best is trial 660 with value: 0.812979986296886.[0m
[32m[I 2022-04-21 17:51:21,402][0m Trial 687 finished with value: 0.7859323797026866 and parameters: {'splitter': 'random', 'min_samples_split': 0.21486344207879843, 'min_samples_leaf': 0.08566079964328432, 'min_weight_fraction_leaf': 0.04531049135941974, 'max_features': 0.8493197541333686}. Best is trial 660 with value: 0.812979986296886.[0m
[32m[I 2022-04-21 17:51:22,146][0m Trial 688 finished with value: 0.7718868808796099 and parameters: {'splitter': 'random', 'min_samples_split': 0.1841314811711658, 'min_samples_leaf': 0.07776058320512055, 'min_weight_fraction_leaf': 0.06623549916117834, 'max_features': 0.8805322624870576}. Best is trial 660 with value: 0.812979986296886.[0m
[32m[I 2022-04-21 17:51:22,605][0m Trial 689 finished with value: 0.8118070902918568 and parameters: {'splitter': 'random', 'min_samples_split': 0.2250552366533519, 'min_samples_leaf': 0.0945455976319072, 'min_weight_fraction_leaf': 0.02935678505904043, 'max_features': 0.9227602893248492}. Best is trial 660 with value: 0.812979986296886.[0m
[32m[I 2022-04-21 17:51:23,008][0m Trial 690 finished with value: 0.7938919373914886 and parameters: {'splitter': 'random', 'min_samples_split': 0.23186203734836708, 'min_samples_leaf': 0.12035562580284645, 'min_weight_fraction_leaf': 0.0844802739335333, 'max_features': 0.9905788052282917}. Best is trial 660 with value: 0.812979986296886.[0m
[32m[I 2022-04-21 17:51:23,408][0m Trial 691 finished with value: 0.7719324174672123 and parameters: {'splitter': 'random', 'min_samples_split': 0.23318887619603862, 'min_samples_leaf': 0.10521272202887541, 'min_weight_fraction_leaf': 0.06977007095805982, 'max_features': 0.9605227653055394}. Best is trial 660 with value: 0.812979986296886.[0m
[32m[I 2022-04-21 17:51:23,884][0m Trial 692 finished with value: 0.766889522743911 and parameters: {'splitter': 'random', 'min_samples_split': 0.19812094562129623, 'min_samples_leaf': 0.0968930777364415, 'min_weight_fraction_leaf': 0.031600514461308946, 'max_features': 0.9433418403221318}. Best is trial 660 with value: 0.812979986296886.[0m
[32m[I 2022-04-21 17:51:24,526][0m Trial 693 finished with value: 0.7615277014798395 and parameters: {'splitter': 'random', 'min_samples_split': 0.1546688318332401, 'min_samples_leaf': 0.11218975577382265, 'min_weight_fraction_leaf': 0.03405807354902382, 'max_features': 0.9389163308297576}. Best is trial 660 with value: 0.812979986296886.[0m
[32m[I 2022-04-21 17:51:25,155][0m Trial 694 finished with value: 0.7736909014053488 and parameters: {'splitter': 'random', 'min_samples_split': 0.22767756198955896, 'min_samples_leaf': 0.09310954207335373, 'min_weight_fraction_leaf': 0.06351088836691478, 'max_features': 0.9699477073767192}. Best is trial 660 with value: 0.812979986296886.[0m
[32m[I 2022-04-21 17:51:25,570][0m Trial 695 finished with value: 0.7770104689803705 and parameters: {'splitter': 'random', 'min_samples_split': 0.21006466066181087, 'min_samples_leaf': 0.10063566243951613, 'min_weight_fraction_leaf': 0.03157751469535197, 'max_features': 0.8626023570050481}. Best is trial 660 with value: 0.812979986296886.[0m
[32m[I 2022-04-21 17:51:26,111][0m Trial 696 finished with value: 0.7728980719554821 and parameters: {'splitter': 'random', 'min_samples_split': 0.22651575429917079, 'min_samples_leaf': 0.06335502759249022, 'min_weight_fraction_leaf': 0.08650902355693316, 'max_features': 0.9376253309819373}. Best is trial 660 with value: 0.812979986296886.[0m
[32m[I 2022-04-21 17:51:26,665][0m Trial 697 finished with value: 0.8117112467042403 and parameters: {'splitter': 'random', 'min_samples_split': 0.22036174093957409, 'min_samples_leaf': 0.04985712977955746, 'min_weight_fraction_leaf': 0.07366017924298929, 'max_features': 0.9246580190554353}. Best is trial 660 with value: 0.812979986296886.[0m
[32m[I 2022-04-21 17:51:27,115][0m Trial 698 finished with value: 0.7757083619500019 and parameters: {'splitter': 'random', 'min_samples_split': 0.21730001022139225, 'min_samples_leaf': 0.08804238803420603, 'min_weight_fraction_leaf': 0.053773386831814735, 'max_features': 0.960397471098672}. Best is trial 660 with value: 0.812979986296886.[0m
[32m[I 2022-04-21 17:51:27,512][0m Trial 699 finished with value: 0.7950481493355436 and parameters: {'splitter': 'random', 'min_samples_split': 0.22673484178510542, 'min_samples_leaf': 0.1095850646128604, 'min_weight_fraction_leaf': 0.07243764158402607, 'max_features': 0.8949736698319872}. Best is trial 660 with value: 0.812979986296886.[0m
[32m[I 2022-04-21 17:51:28,041][0m Trial 700 finished with value: 0.8103055101534433 and parameters: {'splitter': 'random', 'min_samples_split': 0.2065649930272075, 'min_samples_leaf': 0.08137410777744836, 'min_weight_fraction_leaf': 0.026846998122246248, 'max_features': 0.912988079283405}. Best is trial 660 with value: 0.812979986296886.[0m
[32m[I 2022-04-21 17:51:28,565][0m Trial 701 finished with value: 0.8033421267320839 and parameters: {'splitter': 'random', 'min_samples_split': 0.21970543074593193, 'min_samples_leaf': 0.09477312150646447, 'min_weight_fraction_leaf': 0.043891692711606284, 'max_features': 0.9812146932411497}. Best is trial 660 with value: 0.812979986296886.[0m
[32m[I 2022-04-21 17:51:28,999][0m Trial 702 finished with value: 0.7715843536708841 and parameters: {'splitter': 'random', 'min_samples_split': 0.2019587633026593, 'min_samples_leaf': 0.08831995845789521, 'min_weight_fraction_leaf': 0.0584980416203406, 'max_features': 0.9487582994471387}. Best is trial 660 with value: 0.812979986296886.[0m
[32m[I 2022-04-21 17:51:29,409][0m Trial 703 finished with value: 0.7762683710639544 and parameters: {'splitter': 'random', 'min_samples_split': 0.22158247566458295, 'min_samples_leaf': 0.0993922489193184, 'min_weight_fraction_leaf': 0.03060839881147525, 'max_features': 0.8806488573740251}. Best is trial 660 with value: 0.812979986296886.[0m
[32m[I 2022-04-21 17:51:29,922][0m Trial 704 finished with value: 0.8035718007169903 and parameters: {'splitter': 'random', 'min_samples_split': 0.16933207385423749, 'min_samples_leaf': 0.06134711190981171, 'min_weight_fraction_leaf': 0.06119724017873489, 'max_features': 0.9315791193434622}. Best is trial 660 with value: 0.812979986296886.[0m
[32m[I 2022-04-21 17:51:30,381][0m Trial 705 finished with value: 0.810095230018675 and parameters: {'splitter': 'random', 'min_samples_split': 0.2323957479932314, 'min_samples_leaf': 0.07730398727904542, 'min_weight_fraction_leaf': 0.0785997088043725, 'max_features': 0.9239914351194786}. Best is trial 660 with value: 0.812979986296886.[0m
[32m[I 2022-04-21 17:51:31,035][0m Trial 706 finished with value: 0.7734762229234688 and parameters: {'splitter': 'random', 'min_samples_split': 0.20053943578268818, 'min_samples_leaf': 0.04785313549687698, 'min_weight_fraction_leaf': 0.09648288036395591, 'max_features': 0.9571216640121054}. Best is trial 660 with value: 0.812979986296886.[0m
[32m[I 2022-04-21 17:51:31,596][0m Trial 707 finished with value: 0.8014664542297467 and parameters: {'splitter': 'random', 'min_samples_split': 0.18893014962834626, 'min_samples_leaf': 0.046732381502106686, 'min_weight_fraction_leaf': 0.06943491499084474, 'max_features': 0.9336533331882892}. Best is trial 660 with value: 0.812979986296886.[0m
[32m[I 2022-04-21 17:51:32,043][0m Trial 708 finished with value: 0.7755601220641086 and parameters: {'splitter': 'random', 'min_samples_split': 0.21551724000110642, 'min_samples_leaf': 0.08200667736205983, 'min_weight_fraction_leaf': 0.07805391908434509, 'max_features': 0.9749521516438213}. Best is trial 660 with value: 0.812979986296886.[0m
[32m[I 2022-04-21 17:51:32,278][0m Trial 709 finished with value: 0.5 and parameters: {'splitter': 'random', 'min_samples_split': 0.23605985633270332, 'min_samples_leaf': 0.11826295537486388, 'min_weight_fraction_leaf': 0.26824655022025556, 'max_features': 0.19861441951649839}. Best is trial 660 with value: 0.812979986296886.[0m
[32m[I 2022-04-21 17:51:32,860][0m Trial 710 finished with value: 0.7594491636389396 and parameters: {'splitter': 'random', 'min_samples_split': 0.14044508105098283, 'min_samples_leaf': 0.10505892944717588, 'min_weight_fraction_leaf': 0.17604229285262354, 'max_features': 0.8212484893294193}. Best is trial 660 with value: 0.812979986296886.[0m
[32m[I 2022-04-21 17:51:33,544][0m Trial 711 finished with value: 0.7957436417338504 and parameters: {'splitter': 'random', 'min_samples_split': 0.22413591552036388, 'min_samples_leaf': 0.08765996139468632, 'min_weight_fraction_leaf': 0.027384528557230278, 'max_features': 0.7254615718790423}. Best is trial 660 with value: 0.812979986296886.[0m
[32m[I 2022-04-21 17:51:34,031][0m Trial 712 finished with value: 0.8116491001060812 and parameters: {'splitter': 'random', 'min_samples_split': 0.20658802526745298, 'min_samples_leaf': 0.09528543128258708, 'min_weight_fraction_leaf': 0.06140070210453536, 'max_features': 0.9248487593190585}. Best is trial 660 with value: 0.812979986296886.[0m
[32m[I 2022-04-21 17:51:34,543][0m Trial 713 finished with value: 0.7963475833141842 and parameters: {'splitter': 'random', 'min_samples_split': 0.20185687182458845, 'min_samples_leaf': 0.1021429302005426, 'min_weight_fraction_leaf': 0.045397288050310854, 'max_features': 0.8983741614703977}. Best is trial 660 with value: 0.812979986296886.[0m
[32m[I 2022-04-21 17:51:35,029][0m Trial 714 finished with value: 0.7950481493355436 and parameters: {'splitter': 'random', 'min_samples_split': 0.192269188966112, 'min_samples_leaf': 0.11311464371367373, 'min_weight_fraction_leaf': 0.05025687333646265, 'max_features': 0.9048535751862082}. Best is trial 660 with value: 0.812979986296886.[0m
[32m[I 2022-04-21 17:51:35,472][0m Trial 715 finished with value: 0.8038629403272314 and parameters: {'splitter': 'random', 'min_samples_split': 0.21310351855792473, 'min_samples_leaf': 0.09497355363395354, 'min_weight_fraction_leaf': 0.0408460170239069, 'max_features': 0.9992982616804839}. Best is trial 660 with value: 0.812979986296886.[0m
[32m[I 2022-04-21 17:51:35,981][0m Trial 716 finished with value: 0.8118369659618357 and parameters: {'splitter': 'random', 'min_samples_split': 0.205193514049248, 'min_samples_leaf': 0.05675806574020013, 'min_weight_fraction_leaf': 0.07534507776967705, 'max_features': 0.9172648248555021}. Best is trial 660 with value: 0.812979986296886.[0m
[32m[I 2022-04-21 17:51:36,359][0m Trial 717 finished with value: 0.7606486144365292 and parameters: {'splitter': 'random', 'min_samples_split': 0.20676413815942443, 'min_samples_leaf': 0.13767402844880094, 'min_weight_fraction_leaf': 0.07411120369735902, 'max_features': 0.9426267805477044}. Best is trial 660 with value: 0.812979986296886.[0m
[32m[I 2022-04-21 17:51:36,757][0m Trial 718 finished with value: 0.7719324174672123 and parameters: {'splitter': 'random', 'min_samples_split': 0.1943774575870452, 'min_samples_leaf': 0.10626080095097609, 'min_weight_fraction_leaf': 0.06637447447076257, 'max_features': 0.953738583967813}. Best is trial 660 with value: 0.812979986296886.[0m
[32m[I 2022-04-21 17:51:37,305][0m Trial 719 finished with value: 0.7976792616534624 and parameters: {'splitter': 'random', 'min_samples_split': 0.1781386728535326, 'min_samples_leaf': 0.04675337076805955, 'min_weight_fraction_leaf': 0.05836341265265164, 'max_features': 0.7718240283932228}. Best is trial 660 with value: 0.812979986296886.[0m
[32m[I 2022-04-21 17:51:37,841][0m Trial 720 finished with value: 0.7975378967093356 and parameters: {'splitter': 'random', 'min_samples_split': 0.2124951564513279, 'min_samples_leaf': 0.12279982657120019, 'min_weight_fraction_leaf': 0.05274343124801219, 'max_features': 0.8889455465790552}. Best is trial 660 with value: 0.812979986296886.[0m
[32m[I 2022-04-21 17:51:38,340][0m Trial 721 finished with value: 0.8127009333290912 and parameters: {'splitter': 'random', 'min_samples_split': 0.2053239703370718, 'min_samples_leaf': 0.0930863151793751, 'min_weight_fraction_leaf': 0.06281705137417526, 'max_features': 0.9111355733514996}. Best is trial 660 with value: 0.812979986296886.[0m
[32m[I 2022-04-21 17:51:38,594][0m Trial 722 finished with value: 0.5 and parameters: {'splitter': 'random', 'min_samples_split': 0.18454478271402214, 'min_samples_leaf': 0.09702859432534605, 'min_weight_fraction_leaf': 0.06467513931275212, 'max_features': 0.10776370089467086}. Best is trial 660 with value: 0.812979986296886.[0m
[32m[I 2022-04-21 17:51:39,409][0m Trial 723 finished with value: 0.7753029299686315 and parameters: {'splitter': 'random', 'min_samples_split': 0.20059479097115382, 'min_samples_leaf': 0.11490873798604395, 'min_weight_fraction_leaf': 0.07138758853538425, 'max_features': 0.8643390479982572}. Best is trial 660 with value: 0.812979986296886.[0m
[32m[I 2022-04-21 17:51:40,521][0m Trial 724 finished with value: 0.6936629927209751 and parameters: {'splitter': 'random', 'min_samples_split': 0.21039707273759728, 'min_samples_leaf': 0.10008457543382362, 'min_weight_fraction_leaf': 0.057436340189479546, 'max_features': 0.44238357904727693}. Best is trial 660 with value: 0.812979986296886.[0m
[32m[I 2022-04-21 17:51:41,418][0m Trial 725 finished with value: 0.775031299830497 and parameters: {'splitter': 'random', 'min_samples_split': 0.19193927703498154, 'min_samples_leaf': 0.08919165201772714, 'min_weight_fraction_leaf': 0.04488767286003794, 'max_features': 0.8786839609113843}. Best is trial 660 with value: 0.812979986296886.[0m
[32m[I 2022-04-21 17:51:41,830][0m Trial 726 finished with value: 0.7470560610037319 and parameters: {'splitter': 'random', 'min_samples_split': 0.2207171848806207, 'min_samples_leaf': 0.0929299955134348, 'min_weight_fraction_leaf': 0.24441177101299386, 'max_features': 0.9044074183558287}. Best is trial 660 with value: 0.812979986296886.[0m
[32m[I 2022-04-21 17:51:42,439][0m Trial 727 finished with value: 0.7673744954917263 and parameters: {'splitter': 'random', 'min_samples_split': 0.2120352028497667, 'min_samples_leaf': 0.11080522324805193, 'min_weight_fraction_leaf': 0.05194059190393741, 'max_features': 0.9238414623363138}. Best is trial 660 with value: 0.812979986296886.[0m
[32m[I 2022-04-21 17:51:43,299][0m Trial 728 finished with value: 0.7950481493355436 and parameters: {'splitter': 'random', 'min_samples_split': 0.20234566819298488, 'min_samples_leaf': 0.10524478018661357, 'min_weight_fraction_leaf': 0.06162998414657398, 'max_features': 0.8994844663528931}. Best is trial 660 with value: 0.812979986296886.[0m
[32m[I 2022-04-21 17:51:44,045][0m Trial 729 finished with value: 0.8118070902918568 and parameters: {'splitter': 'random', 'min_samples_split': 0.22530562722337072, 'min_samples_leaf': 0.06036140510467215, 'min_weight_fraction_leaf': 0.09194537809115508, 'max_features': 0.9217243013476898}. Best is trial 660 with value: 0.812979986296886.[0m
[32m[I 2022-04-21 17:51:44,590][0m Trial 730 finished with value: 0.6851609036733942 and parameters: {'splitter': 'random', 'min_samples_split': 0.22263761033873655, 'min_samples_leaf': 0.2823102475197002, 'min_weight_fraction_leaf': 0.0768157380420585, 'max_features': 0.9205267256140236}. Best is trial 660 with value: 0.812979986296886.[0m
[32m[I 2022-04-21 17:51:45,362][0m Trial 731 finished with value: 0.7752997467662333 and parameters: {'splitter': 'random', 'min_samples_split': 0.23229647178325669, 'min_samples_leaf': 0.05535294540648657, 'min_weight_fraction_leaf': 0.07998723245838714, 'max_features': 0.8809585396198063}. Best is trial 660 with value: 0.812979986296886.[0m
[32m[I 2022-04-21 17:51:45,774][0m Trial 732 finished with value: 0.7863357705405841 and parameters: {'splitter': 'random', 'min_samples_split': 0.2177126292020074, 'min_samples_leaf': 0.09022226209695675, 'min_weight_fraction_leaf': 0.0434147366815279, 'max_features': 0.8490039237423206}. Best is trial 660 with value: 0.812979986296886.[0m
[32m[I 2022-04-21 17:51:46,160][0m Trial 733 finished with value: 0.8037033163003654 and parameters: {'splitter': 'random', 'min_samples_split': 0.19973426344391534, 'min_samples_leaf': 0.10353073478563822, 'min_weight_fraction_leaf': 0.06535858157903714, 'max_features': 0.6283068753466348}. Best is trial 660 with value: 0.812979986296886.[0m
[32m[I 2022-04-21 17:51:46,629][0m Trial 734 finished with value: 0.810095230018675 and parameters: {'splitter': 'random', 'min_samples_split': 0.23295944387194137, 'min_samples_leaf': 0.074576071138479, 'min_weight_fraction_leaf': 0.03572462690225253, 'max_features': 0.9086655772575234}. Best is trial 660 with value: 0.812979986296886.[0m
[32m[I 2022-04-21 17:51:47,188][0m Trial 735 finished with value: 0.7862860845139761 and parameters: {'splitter': 'random', 'min_samples_split': 0.22408002858692536, 'min_samples_leaf': 0.08333577549374341, 'min_weight_fraction_leaf': 0.06375332966883285, 'max_features': 0.9417621717902526}. Best is trial 660 with value: 0.812979986296886.[0m
[32m[I 2022-04-21 17:51:47,705][0m Trial 736 finished with value: 0.6851609036733942 and parameters: {'splitter': 'random', 'min_samples_split': 0.18585881447072827, 'min_samples_leaf': 0.12417766587598561, 'min_weight_fraction_leaf': 0.41280804636135304, 'max_features': 0.8946092333954293}. Best is trial 660 with value: 0.812979986296886.[0m
[32m[I 2022-04-21 17:51:48,505][0m Trial 737 finished with value: 0.781058729976787 and parameters: {'splitter': 'random', 'min_samples_split': 0.20648479845500387, 'min_samples_leaf': 0.06770906602091739, 'min_weight_fraction_leaf': 0.09310514289245003, 'max_features': 0.5827541327466946}. Best is trial 660 with value: 0.812979986296886.[0m
[32m[I 2022-04-21 17:51:49,203][0m Trial 738 finished with value: 0.8123191241087102 and parameters: {'splitter': 'random', 'min_samples_split': 0.21565453753588845, 'min_samples_leaf': 0.06014312906067966, 'min_weight_fraction_leaf': 0.07244614797151261, 'max_features': 0.9087922058780017}. Best is trial 660 with value: 0.812979986296886.[0m
[32m[I 2022-04-21 17:51:50,121][0m Trial 739 finished with value: 0.776504596791727 and parameters: {'splitter': 'random', 'min_samples_split': 0.212006179154726, 'min_samples_leaf': 0.057665281194211375, 'min_weight_fraction_leaf': 0.07549762345854996, 'max_features': 0.9563303948374159}. Best is trial 660 with value: 0.812979986296886.[0m
[32m[I 2022-04-21 17:51:50,543][0m Trial 740 finished with value: 0.8118070902918568 and parameters: {'splitter': 'random', 'min_samples_split': 0.22245202101180897, 'min_samples_leaf': 0.0952802789109534, 'min_weight_fraction_leaf': 0.07146812497757499, 'max_features': 0.9261293555812636}. Best is trial 660 with value: 0.812979986296886.[0m
[32m[I 2022-04-21 17:51:50,934][0m Trial 741 finished with value: 0.7753061015962935 and parameters: {'splitter': 'random', 'min_samples_split': 0.22129070715515686, 'min_samples_leaf': 0.11643582466951644, 'min_weight_fraction_leaf': 0.06966639365710378, 'max_features': 0.8725281864586005}. Best is trial 660 with value: 0.812979986296886.[0m
[32m[I 2022-04-21 17:51:51,348][0m Trial 742 finished with value: 0.7648505649133345 and parameters: {'splitter': 'random', 'min_samples_split': 0.22690293800874353, 'min_samples_leaf': 0.09799066856497947, 'min_weight_fraction_leaf': 0.055106797858893344, 'max_features': 0.9395327195601137}. Best is trial 660 with value: 0.812979986296886.[0m
[32m[I 2022-04-21 17:51:51,755][0m Trial 743 finished with value: 0.7950481493355436 and parameters: {'splitter': 'random', 'min_samples_split': 0.20544393047348558, 'min_samples_leaf': 0.11060524799904131, 'min_weight_fraction_leaf': 0.06505853120430498, 'max_features': 0.896092576173228}. Best is trial 660 with value: 0.812979986296886.[0m
[32m[I 2022-04-21 17:51:52,296][0m Trial 744 finished with value: 0.8033421267320839 and parameters: {'splitter': 'random', 'min_samples_split': 0.21769459713178946, 'min_samples_leaf': 0.09530299365132021, 'min_weight_fraction_leaf': 0.07395550447266336, 'max_features': 0.9777240027489917}. Best is trial 660 with value: 0.812979986296886.[0m
[32m[I 2022-04-21 17:51:53,111][0m Trial 745 finished with value: 0.6560310623209986 and parameters: {'splitter': 'random', 'min_samples_split': 0.22935189953180682, 'min_samples_leaf': 0.12639049912381592, 'min_weight_fraction_leaf': 0.052474712690291456, 'max_features': 0.3154796472934429}. Best is trial 660 with value: 0.812979986296886.[0m
[32m[I 2022-04-21 17:51:53,752][0m Trial 746 finished with value: 0.7728780673444804 and parameters: {'splitter': 'random', 'min_samples_split': 0.19982480507618405, 'min_samples_leaf': 0.10480720499310814, 'min_weight_fraction_leaf': 0.07146296547904316, 'max_features': 0.9177650421060373}. Best is trial 660 with value: 0.812979986296886.[0m
