[32m[I 2022-05-16 21:01:27,905][0m Trial 618 finished with value: 0.7643379543533518 and parameters: {'loss': 'coxph', 'learning_rate': 9.013884420915478e-05, 'n_estimators': 454, 'criterion': 'friedman_mse', 'min_samples_split': 3, 'min_samples_leaf': 5, 'min_weight_fraction_leaf': 0.08819836236523797, 'min_impurity_decrease': 0.7458921958493107, 'max_features': 0.7506171192628879, 'subsample': 0.06618238459520848, 'dropout_rate': 0.09711590237602352, 'ccp_alpha': 0.18908075861578047}. Best is trial 573 with value: 0.8538054350764822.[0m
[32m[I 2022-05-16 21:33:32,537][0m Trial 619 finished with value: 0.8506156793013074 and parameters: {'loss': 'coxph', 'learning_rate': 0.00021868085867950897, 'n_estimators': 586, 'criterion': 'friedman_mse', 'min_samples_split': 5, 'min_samples_leaf': 6, 'min_weight_fraction_leaf': 0.123968961705723, 'min_impurity_decrease': 0.9570467633018279, 'max_features': 0.7942988605709236, 'subsample': 0.09294219195706627, 'dropout_rate': 0.1070084124118413, 'ccp_alpha': 0.002513612844067834}. Best is trial 573 with value: 0.8538054350764822.[0m
[32m[I 2022-05-16 22:04:55,195][0m Trial 620 finished with value: 0.781156725755814 and parameters: {'loss': 'coxph', 'learning_rate': 0.0002284229502419023, 'n_estimators': 599, 'criterion': 'friedman_mse', 'min_samples_split': 5, 'min_samples_leaf': 5, 'min_weight_fraction_leaf': 0.12149689181580167, 'min_impurity_decrease': 0.9608860417267459, 'max_features': 0.8013827109846907, 'subsample': 0.11158876351807567, 'dropout_rate': 0.11871128754946492, 'ccp_alpha': 0.08672345123897174}. Best is trial 573 with value: 0.8538054350764822.[0m
[32m[I 2022-05-16 22:35:08,323][0m Trial 621 finished with value: 0.783198706711696 and parameters: {'loss': 'coxph', 'learning_rate': 0.00028145536941369425, 'n_estimators': 573, 'criterion': 'friedman_mse', 'min_samples_split': 5, 'min_samples_leaf': 5, 'min_weight_fraction_leaf': 0.12179771488135763, 'min_impurity_decrease': 0.9715039456764627, 'max_features': 0.7323694202560759, 'subsample': 0.09603514294752491, 'dropout_rate': 0.13915721100283643, 'ccp_alpha': 0.09621786786278314}. Best is trial 573 with value: 0.8538054350764822.[0m
[32m[I 2022-05-16 23:02:16,018][0m Trial 622 finished with value: 0.7625707434068506 and parameters: {'loss': 'coxph', 'learning_rate': 0.0002023516690292438, 'n_estimators': 540, 'criterion': 'friedman_mse', 'min_samples_split': 5, 'min_samples_leaf': 5, 'min_weight_fraction_leaf': 0.13373911835622984, 'min_impurity_decrease': 0.9298507868681105, 'max_features': 0.7686494654398387, 'subsample': 0.13823430814890353, 'dropout_rate': 0.12803341008092536, 'ccp_alpha': 0.24186565804652627}. Best is trial 573 with value: 0.8538054350764822.[0m
[32m[I 2022-05-16 23:33:33,215][0m Trial 623 finished with value: 0.5 and parameters: {'loss': 'coxph', 'learning_rate': 0.00015258709550762116, 'n_estimators': 615, 'criterion': 'squared_error', 'min_samples_split': 5, 'min_samples_leaf': 5, 'min_weight_fraction_leaf': 0.11108419379449529, 'min_impurity_decrease': 0.9488297714989142, 'max_features': 0.6661111528101978, 'subsample': 0.1229307498550608, 'dropout_rate': 0.09478248550517111, 'ccp_alpha': 0.0011488338848180428}. Best is trial 573 with value: 0.8538054350764822.[0m
[32m[I 2022-05-17 00:02:15,827][0m Trial 624 finished with value: 0.7910641089855822 and parameters: {'loss': 'coxph', 'learning_rate': 0.00031104212445049714, 'n_estimators': 543, 'criterion': 'friedman_mse', 'min_samples_split': 5, 'min_samples_leaf': 5, 'min_weight_fraction_leaf': 0.12680067912425097, 'min_impurity_decrease': 0.953630097769685, 'max_features': 0.701381422234206, 'subsample': 0.08920864960417248, 'dropout_rate': 0.10854172495790317, 'ccp_alpha': 0.16949012182744827}. Best is trial 573 with value: 0.8538054350764822.[0m
[32m[I 2022-05-17 00:33:31,030][0m Trial 625 finished with value: 0.7908442976255395 and parameters: {'loss': 'coxph', 'learning_rate': 0.0001973947845529319, 'n_estimators': 579, 'criterion': 'friedman_mse', 'min_samples_split': 5, 'min_samples_leaf': 6, 'min_weight_fraction_leaf': 0.06750315370571172, 'min_impurity_decrease': 0.9803698380135945, 'max_features': 0.7932754389587615, 'subsample': 0.0874325832063955, 'dropout_rate': 0.055829464377601695, 'ccp_alpha': 0.09281562828672654}. Best is trial 573 with value: 0.8538054350764822.[0m
[32m[I 2022-05-17 00:56:54,291][0m Trial 626 finished with value: 0.8530485226998529 and parameters: {'loss': 'coxph', 'learning_rate': 7.232810390654675e-05, 'n_estimators': 472, 'criterion': 'friedman_mse', 'min_samples_split': 3, 'min_samples_leaf': 5, 'min_weight_fraction_leaf': 0.08127263408087335, 'min_impurity_decrease': 0.9915971726054598, 'max_features': 0.7508722375435123, 'subsample': 0.16713554172799722, 'dropout_rate': 0.10471863513719404, 'ccp_alpha': 0.0018972148999314314}. Best is trial 573 with value: 0.8538054350764822.[0m
[32m[I 2022-05-17 01:18:30,511][0m Trial 627 finished with value: 0.7390792369686546 and parameters: {'loss': 'coxph', 'learning_rate': 7.231885083296565e-05, 'n_estimators': 464, 'criterion': 'friedman_mse', 'min_samples_split': 3, 'min_samples_leaf': 5, 'min_weight_fraction_leaf': 0.08081862677651966, 'min_impurity_decrease': 0.9936079131734203, 'max_features': 0.757304991299695, 'subsample': 0.18953759308718257, 'dropout_rate': 0.032086996557755154, 'ccp_alpha': 0.36703425079819985}. Best is trial 573 with value: 0.8538054350764822.[0m
[32m[I 2022-05-17 01:51:46,648][0m Trial 628 finished with value: 0.762469285110868 and parameters: {'loss': 'coxph', 'learning_rate': 6.143397383161172e-05, 'n_estimators': 657, 'criterion': 'friedman_mse', 'min_samples_split': 3, 'min_samples_leaf': 5, 'min_weight_fraction_leaf': 0.07305074662888142, 'min_impurity_decrease': 0.9932446093911921, 'max_features': 0.7763181418464292, 'subsample': 0.16527425052657865, 'dropout_rate': 0.09019832430457309, 'ccp_alpha': 0.17907387129901098}. Best is trial 573 with value: 0.8538054350764822.[0m
[32m[I 2022-05-17 02:12:58,579][0m Trial 629 finished with value: 0.7597762207394518 and parameters: {'loss': 'coxph', 'learning_rate': 7.110966705254382e-05, 'n_estimators': 440, 'criterion': 'friedman_mse', 'min_samples_split': 3, 'min_samples_leaf': 5, 'min_weight_fraction_leaf': 0.1389259526249969, 'min_impurity_decrease': 0.9470479602725471, 'max_features': 0.7967849082623922, 'subsample': 0.15331555076543835, 'dropout_rate': 0.12867655729504618, 'ccp_alpha': 0.10131289818613697}. Best is trial 573 with value: 0.8538054350764822.[0m
[32m[I 2022-05-17 02:36:20,418][0m Trial 630 finished with value: 0.8537685107632056 and parameters: {'loss': 'coxph', 'learning_rate': 5.5822296021535804e-05, 'n_estimators': 473, 'criterion': 'friedman_mse', 'min_samples_split': 3, 'min_samples_leaf': 5, 'min_weight_fraction_leaf': 0.06081654904557844, 'min_impurity_decrease': 0.9794395910862044, 'max_features': 0.7528766860618182, 'subsample': 0.1707681001192006, 'dropout_rate': 0.0749058718130313, 'ccp_alpha': 0.002337164215670444}. Best is trial 573 with value: 0.8538054350764822.[0m
[32m[I 2022-05-17 02:58:24,859][0m Trial 631 finished with value: 0.7624254325675295 and parameters: {'loss': 'coxph', 'learning_rate': 5.523259907298636e-05, 'n_estimators': 467, 'criterion': 'friedman_mse', 'min_samples_split': 3, 'min_samples_leaf': 5, 'min_weight_fraction_leaf': 0.06044051405368658, 'min_impurity_decrease': 0.9699775537295862, 'max_features': 0.7206539313583021, 'subsample': 0.1824229602977717, 'dropout_rate': 0.08646203358544238, 'ccp_alpha': 0.25101826829331947}. Best is trial 573 with value: 0.8538054350764822.[0m
[32m[I 2022-05-17 03:23:36,838][0m Trial 632 finished with value: 0.8548074589601917 and parameters: {'loss': 'coxph', 'learning_rate': 5.793055685480786e-05, 'n_estimators': 505, 'criterion': 'friedman_mse', 'min_samples_split': 3, 'min_samples_leaf': 6, 'min_weight_fraction_leaf': 0.06252069472277046, 'min_impurity_decrease': 0.9975625039474595, 'max_features': 0.7438542277661921, 'subsample': 0.17645136649059306, 'dropout_rate': 0.06618817813950181, 'ccp_alpha': 0.001224143040972984}. Best is trial 632 with value: 0.8548074589601917.[0m
/media/san2_ssd/data/Workdir/survival/venv/lib/python3.8/site-packages/sksurv/ensemble/boosting.py:955: RuntimeWarning: divide by zero encountered in log
  time = numpy.log(time)
/media/san2_ssd/data/Workdir/survival/venv/lib/python3.8/site-packages/sksurv/ensemble/boosting.py:955: RuntimeWarning: divide by zero encountered in log
  time = numpy.log(time)
/media/san2_ssd/data/Workdir/survival/venv/lib/python3.8/site-packages/sksurv/ensemble/boosting.py:955: RuntimeWarning: divide by zero encountered in log
  time = numpy.log(time)
/media/san2_ssd/data/Workdir/survival/venv/lib/python3.8/site-packages/sksurv/ensemble/boosting.py:955: RuntimeWarning: divide by zero encountered in log
  time = numpy.log(time)
/media/san2_ssd/data/Workdir/survival/venv/lib/python3.8/site-packages/sksurv/ensemble/boosting.py:955: RuntimeWarning: divide by zero encountered in log
  time = numpy.log(time)
[32m[I 2022-05-17 03:23:36,909][0m Trial 633 finished with value: -1.0 and parameters: {'loss': 'squared', 'learning_rate': 5.591387971585283e-05, 'n_estimators': 513, 'criterion': 'friedman_mse', 'min_samples_split': 3, 'min_samples_leaf': 9, 'min_weight_fraction_leaf': 0.06795137747150128, 'min_impurity_decrease': 0.9824778871480464, 'max_features': 0.7391934666198828, 'subsample': 0.2076393923558361, 'dropout_rate': 0.059403179972121446, 'ccp_alpha': 0.09920148200518947}. Best is trial 632 with value: 0.8548074589601917.[0m
[32m[I 2022-05-17 03:46:10,199][0m Trial 634 finished with value: 0.7624627678420826 and parameters: {'loss': 'coxph', 'learning_rate': 6.540113239225587e-05, 'n_estimators': 477, 'criterion': 'friedman_mse', 'min_samples_split': 3, 'min_samples_leaf': 6, 'min_weight_fraction_leaf': 0.051254039546026024, 'min_impurity_decrease': 0.9915051602028135, 'max_features': 0.7294959301902382, 'subsample': 0.19446708330962492, 'dropout_rate': 0.03606361273157138, 'ccp_alpha': 0.17434782819516506}. Best is trial 632 with value: 0.8548074589601917.[0m
[32m[I 2022-05-17 04:11:33,399][0m Trial 635 finished with value: 0.7856538745359322 and parameters: {'loss': 'coxph', 'learning_rate': 8.514216097012084e-05, 'n_estimators': 518, 'criterion': 'friedman_mse', 'min_samples_split': 3, 'min_samples_leaf': 6, 'min_weight_fraction_leaf': 0.08341600798303928, 'min_impurity_decrease': 0.9753359790917471, 'max_features': 0.7496002911344316, 'subsample': 0.17405244843968545, 'dropout_rate': 0.026706371232390794, 'ccp_alpha': 0.09863901171484835}. Best is trial 632 with value: 0.8548074589601917.[0m
[32m[I 2022-05-17 04:33:41,905][0m Trial 636 finished with value: 0.7391284931129656 and parameters: {'loss': 'coxph', 'learning_rate': 0.032118683821265134, 'n_estimators': 479, 'criterion': 'friedman_mse', 'min_samples_split': 3, 'min_samples_leaf': 6, 'min_weight_fraction_leaf': 0.0763679434825145, 'min_impurity_decrease': 0.966168213236339, 'max_features': 0.7155856382662452, 'subsample': 0.1937888157242863, 'dropout_rate': 0.08692226399889608, 'ccp_alpha': 0.3439483130813031}. Best is trial 632 with value: 0.8548074589601917.[0m
[32m[I 2022-05-17 05:01:41,622][0m Trial 637 finished with value: 0.7633511784663367 and parameters: {'loss': 'coxph', 'learning_rate': 5.5577779472866054e-05, 'n_estimators': 560, 'criterion': 'friedman_mse', 'min_samples_split': 3, 'min_samples_leaf': 6, 'min_weight_fraction_leaf': 0.08445488355138862, 'min_impurity_decrease': 0.9839601021690693, 'max_features': 0.7550506112701386, 'subsample': 0.16162669595320042, 'dropout_rate': 0.0031713554859836013, 'ccp_alpha': 0.24335778319615456}. Best is trial 632 with value: 0.8548074589601917.[0m
[32m[I 2022-05-17 05:26:32,119][0m Trial 638 finished with value: 0.7798759700568791 and parameters: {'loss': 'coxph', 'learning_rate': 0.0003645164676797674, 'n_estimators': 502, 'criterion': 'friedman_mse', 'min_samples_split': 3, 'min_samples_leaf': 6, 'min_weight_fraction_leaf': 0.06753814316656372, 'min_impurity_decrease': 0.9676049791519976, 'max_features': 0.7361667362785914, 'subsample': 0.15399227658650047, 'dropout_rate': 0.06269178835744346, 'ccp_alpha': 0.09303575012529143}. Best is trial 632 with value: 0.8548074589601917.[0m
[32m[I 2022-05-17 05:52:25,601][0m Trial 639 finished with value: 0.76237786196376 and parameters: {'loss': 'coxph', 'learning_rate': 6.93856324121697e-05, 'n_estimators': 532, 'criterion': 'friedman_mse', 'min_samples_split': 3, 'min_samples_leaf': 6, 'min_weight_fraction_leaf': 0.103147680740758, 'min_impurity_decrease': 0.9885016085992027, 'max_features': 0.761456810255329, 'subsample': 0.17805642534626345, 'dropout_rate': 0.06401967745299779, 'ccp_alpha': 0.17783768520642187}. Best is trial 632 with value: 0.8548074589601917.[0m
[32m[I 2022-05-17 06:16:49,818][0m Trial 640 finished with value: 0.8526214318230316 and parameters: {'loss': 'coxph', 'learning_rate': 0.00023887994600567739, 'n_estimators': 485, 'criterion': 'friedman_mse', 'min_samples_split': 3, 'min_samples_leaf': 5, 'min_weight_fraction_leaf': 0.08991382950601863, 'min_impurity_decrease': 0.9481860179815954, 'max_features': 0.7183693536271001, 'subsample': 0.15854669406678576, 'dropout_rate': 0.07261347619134537, 'ccp_alpha': 0.0015454577549982819}. Best is trial 632 with value: 0.8548074589601917.[0m
[32m[I 2022-05-17 06:38:31,786][0m Trial 641 finished with value: 0.8519448033504912 and parameters: {'loss': 'coxph', 'learning_rate': 0.00025460513852714503, 'n_estimators': 458, 'criterion': 'friedman_mse', 'min_samples_split': 3, 'min_samples_leaf': 5, 'min_weight_fraction_leaf': 0.08473113487520835, 'min_impurity_decrease': 0.9930516837862415, 'max_features': 0.709295931220456, 'subsample': 0.19899173305967793, 'dropout_rate': 0.14573522602122144, 'ccp_alpha': 0.0022614964769041737}. Best is trial 632 with value: 0.8548074589601917.[0m
[32m[I 2022-05-17 07:01:08,839][0m Trial 642 finished with value: 0.7885576103378945 and parameters: {'loss': 'coxph', 'learning_rate': 0.00048545747653272594, 'n_estimators': 481, 'criterion': 'friedman_mse', 'min_samples_split': 3, 'min_samples_leaf': 5, 'min_weight_fraction_leaf': 0.0890499366176511, 'min_impurity_decrease': 0.9561959515493655, 'max_features': 0.7016306641589826, 'subsample': 0.19966719750118667, 'dropout_rate': 0.07223827626896336, 'ccp_alpha': 0.09464179421650185}. Best is trial 632 with value: 0.8548074589601917.[0m
[32m[I 2022-05-17 07:23:11,142][0m Trial 643 finished with value: 0.75811485503268 and parameters: {'loss': 'coxph', 'learning_rate': 0.00027356192168028566, 'n_estimators': 461, 'criterion': 'friedman_mse', 'min_samples_split': 3, 'min_samples_leaf': 6, 'min_weight_fraction_leaf': 0.07323461644794317, 'min_impurity_decrease': 0.9468906729343297, 'max_features': 0.7116597786767669, 'subsample': 0.1649022178758425, 'dropout_rate': 0.10723693841260808, 'ccp_alpha': 0.2717030316117782}. Best is trial 632 with value: 0.8548074589601917.[0m
[32m[I 2022-05-17 07:46:33,513][0m Trial 644 finished with value: 0.7689608821989209 and parameters: {'loss': 'coxph', 'learning_rate': 0.0002352056802808252, 'n_estimators': 487, 'criterion': 'friedman_mse', 'min_samples_split': 3, 'min_samples_leaf': 7, 'min_weight_fraction_leaf': 0.0795622385762798, 'min_impurity_decrease': 0.9961610738752151, 'max_features': 0.6758027505829785, 'subsample': 0.17047240430283506, 'dropout_rate': 0.10541052878983882, 'ccp_alpha': 0.17102860878689935}. Best is trial 632 with value: 0.8548074589601917.[0m
[32m[I 2022-05-17 08:07:15,874][0m Trial 645 finished with value: 0.5 and parameters: {'loss': 'coxph', 'learning_rate': 0.0002749123350426494, 'n_estimators': 457, 'criterion': 'squared_error', 'min_samples_split': 3, 'min_samples_leaf': 5, 'min_weight_fraction_leaf': 0.059793487781524816, 'min_impurity_decrease': 0.9944362913469638, 'max_features': 0.7214186846545588, 'subsample': 0.20252582322062015, 'dropout_rate': 0.1061733462053499, 'ccp_alpha': 0.0036071111719694748}. Best is trial 632 with value: 0.8548074589601917.[0m
[32m[I 2022-05-17 08:30:42,875][0m Trial 646 finished with value: 0.7853473392883833 and parameters: {'loss': 'coxph', 'learning_rate': 0.00036091821534226095, 'n_estimators': 503, 'criterion': 'friedman_mse', 'min_samples_split': 3, 'min_samples_leaf': 5, 'min_weight_fraction_leaf': 0.09087375130352905, 'min_impurity_decrease': 0.999798819210791, 'max_features': 0.7245100378446052, 'subsample': 0.21346529783823587, 'dropout_rate': 0.09787666387145492, 'ccp_alpha': 0.08499315841194986}. Best is trial 632 with value: 0.8548074589601917.[0m
[32m[I 2022-05-17 08:53:12,362][0m Trial 647 finished with value: 0.784840269357129 and parameters: {'loss': 'coxph', 'learning_rate': 0.0002152207748423495, 'n_estimators': 470, 'criterion': 'friedman_mse', 'min_samples_split': 3, 'min_samples_leaf': 5, 'min_weight_fraction_leaf': 0.07852359830205538, 'min_impurity_decrease': 0.9600439052266936, 'max_features': 0.6902225531299966, 'subsample': 0.181719375319791, 'dropout_rate': 0.042664481154178244, 'ccp_alpha': 0.09777534305607416}. Best is trial 632 with value: 0.8548074589601917.[0m
[32m[I 2022-05-17 09:16:38,976][0m Trial 648 finished with value: 0.7624382479406393 and parameters: {'loss': 'coxph', 'learning_rate': 0.00032421962083448776, 'n_estimators': 480, 'criterion': 'friedman_mse', 'min_samples_split': 3, 'min_samples_leaf': 4, 'min_weight_fraction_leaf': 0.08955541831132746, 'min_impurity_decrease': 0.9420099236252099, 'max_features': 0.7416760260550878, 'subsample': 0.15795120904711688, 'dropout_rate': 0.054609860467855154, 'ccp_alpha': 0.20357497431289664}. Best is trial 632 with value: 0.8548074589601917.[0m
[32m[I 2022-05-17 09:38:06,576][0m Trial 649 finished with value: 0.5 and parameters: {'loss': 'coxph', 'learning_rate': 0.00024233628764884315, 'n_estimators': 447, 'criterion': 'friedman_mse', 'min_samples_split': 3, 'min_samples_leaf': 6, 'min_weight_fraction_leaf': 0.06599373201932346, 'min_impurity_decrease': 0.9728866943182398, 'max_features': 0.708560648538747, 'subsample': 0.14799362417287792, 'dropout_rate': 0.07030945590987715, 'ccp_alpha': 2.0927528899404515}. Best is trial 632 with value: 0.8548074589601917.[0m
[32m[I 2022-05-17 10:06:22,782][0m Trial 650 finished with value: 0.781084429072589 and parameters: {'loss': 'coxph', 'learning_rate': 0.0018507267873067656, 'n_estimators': 514, 'criterion': 'friedman_mse', 'min_samples_split': 3, 'min_samples_leaf': 5, 'min_weight_fraction_leaf': 0.07308180606964829, 'min_impurity_decrease': 0.9996748822673168, 'max_features': 0.7382807755130387, 'subsample': 0.14014299288483434, 'dropout_rate': 0.0775485737075351, 'ccp_alpha': 0.09683815921050211}. Best is trial 632 with value: 0.8548074589601917.[0m
[32m[I 2022-05-17 10:28:55,788][0m Trial 651 finished with value: 0.5 and parameters: {'loss': 'coxph', 'learning_rate': 0.00018065163727502362, 'n_estimators': 485, 'criterion': 'friedman_mse', 'min_samples_split': 3, 'min_samples_leaf': 5, 'min_weight_fraction_leaf': 0.09665941403067083, 'min_impurity_decrease': 0.9735761729621469, 'max_features': 0.7466699912852145, 'subsample': 0.21548969427585973, 'dropout_rate': 0.12317951436453148, 'ccp_alpha': 0.65573947908229}. Best is trial 632 with value: 0.8548074589601917.[0m
/media/san2_ssd/data/Workdir/survival/venv/lib/python3.8/site-packages/sksurv/ensemble/boosting.py:955: RuntimeWarning: divide by zero encountered in log
  time = numpy.log(time)
/media/san2_ssd/data/Workdir/survival/venv/lib/python3.8/site-packages/sksurv/ensemble/boosting.py:955: RuntimeWarning: divide by zero encountered in log
  time = numpy.log(time)
/media/san2_ssd/data/Workdir/survival/venv/lib/python3.8/site-packages/sksurv/ensemble/boosting.py:955: RuntimeWarning: divide by zero encountered in log
  time = numpy.log(time)
/media/san2_ssd/data/Workdir/survival/venv/lib/python3.8/site-packages/sksurv/ensemble/boosting.py:955: RuntimeWarning: divide by zero encountered in log
  time = numpy.log(time)
/media/san2_ssd/data/Workdir/survival/venv/lib/python3.8/site-packages/sksurv/ensemble/boosting.py:955: RuntimeWarning: divide by zero encountered in log
  time = numpy.log(time)
[32m[I 2022-05-17 10:28:55,863][0m Trial 652 finished with value: -1.0 and parameters: {'loss': 'squared', 'learning_rate': 9.658238310112949e-05, 'n_estimators': 439, 'criterion': 'friedman_mse', 'min_samples_split': 3, 'min_samples_leaf': 5, 'min_weight_fraction_leaf': 0.053547553689850855, 'min_impurity_decrease': 0.9398950452570998, 'max_features': 0.7246902267676247, 'subsample': 0.18231659427609653, 'dropout_rate': 0.14296530639335547, 'ccp_alpha': 1.015034655657114}. Best is trial 632 with value: 0.8548074589601917.[0m
[32m[I 2022-05-17 10:53:58,665][0m Trial 653 finished with value: 0.7628927666425376 and parameters: {'loss': 'coxph', 'learning_rate': 6.72006951625825e-05, 'n_estimators': 505, 'criterion': 'friedman_mse', 'min_samples_split': 3, 'min_samples_leaf': 5, 'min_weight_fraction_leaf': 0.08382411072410795, 'min_impurity_decrease': 0.9162938547357413, 'max_features': 0.7592431345387107, 'subsample': 0.14098475424653095, 'dropout_rate': 0.09354366094461528, 'ccp_alpha': 0.2570610530674645}. Best is trial 632 with value: 0.8548074589601917.[0m
[32m[I 2022-05-17 11:18:53,959][0m Trial 654 finished with value: 0.5 and parameters: {'loss': 'coxph', 'learning_rate': 0.00044063411113691556, 'n_estimators': 525, 'criterion': 'friedman_mse', 'min_samples_split': 3, 'min_samples_leaf': 5, 'min_weight_fraction_leaf': 0.09996775783287751, 'min_impurity_decrease': 0.9644897062546094, 'max_features': 0.6932476084431958, 'subsample': 0.17071740726237136, 'dropout_rate': 0.10921060095944699, 'ccp_alpha': 1.3799864144356597}. Best is trial 632 with value: 0.8548074589601917.[0m
