[32m[I 2022-04-28 05:10:50,461][0m Trial 772 finished with value: 0.852034011675124 and parameters: {'n_hidden': 2048, 'mixture_components': 4, 'use_sparse_layer': False, 'use_batchnorm': False, 'use_dropout': False, 'mlp_size_1': 7, 'mlp_size_2': 1, 'mlp_size_3': 0, 'kernel': 'Normal', 'loss_name': 'CensoredNLLLoss'}. Best is trial 644 with value: 0.8553858439194377.[0m
[32m[I 2022-04-28 05:16:36,118][0m Trial 773 finished with value: 0.8520397127422425 and parameters: {'n_hidden': 2048, 'mixture_components': 4, 'use_sparse_layer': False, 'use_batchnorm': False, 'use_dropout': False, 'mlp_size_1': 7, 'mlp_size_2': 1, 'mlp_size_3': 0, 'kernel': 'Normal', 'loss_name': 'CensoredNLLLoss'}. Best is trial 644 with value: 0.8553858439194377.[0m
[32m[I 2022-04-28 05:21:20,178][0m Trial 774 finished with value: 0.8499384892409052 and parameters: {'n_hidden': 2048, 'mixture_components': 4, 'use_sparse_layer': False, 'use_batchnorm': False, 'use_dropout': False, 'mlp_size_1': 7, 'mlp_size_2': 1, 'mlp_size_3': 0, 'kernel': 'LogLogistic', 'loss_name': 'CensoredNLLLoss'}. Best is trial 644 with value: 0.8553858439194377.[0m
[32m[I 2022-04-28 05:27:08,092][0m Trial 775 finished with value: 0.8551187089960367 and parameters: {'n_hidden': 2048, 'mixture_components': 4, 'use_sparse_layer': False, 'use_batchnorm': False, 'use_dropout': False, 'mlp_size_1': 7, 'mlp_size_2': 1, 'mlp_size_3': 0, 'kernel': 'Normal', 'loss_name': 'CensoredNLLLoss'}. Best is trial 644 with value: 0.8553858439194377.[0m
[32m[I 2022-04-28 05:33:37,674][0m Trial 776 finished with value: 0.8331576797361965 and parameters: {'n_hidden': 64, 'mixture_components': 4, 'use_sparse_layer': False, 'use_batchnorm': False, 'use_dropout': False, 'mlp_size_1': 0, 'mlp_size_2': 3, 'mlp_size_3': 0, 'kernel': 'Normal', 'loss_name': 'CensoredNLLLoss'}. Best is trial 644 with value: 0.8553858439194377.[0m
[32m[I 2022-04-28 05:39:40,445][0m Trial 777 finished with value: 0.8533233078226562 and parameters: {'n_hidden': 2048, 'mixture_components': 4, 'use_sparse_layer': False, 'use_batchnorm': False, 'use_dropout': False, 'mlp_size_1': 7, 'mlp_size_2': 1, 'mlp_size_3': 0, 'kernel': 'Normal', 'loss_name': 'CensoredNLLLoss'}. Best is trial 644 with value: 0.8553858439194377.[0m
[32m[I 2022-04-28 05:44:34,417][0m Trial 778 finished with value: 0.840661621153974 and parameters: {'n_hidden': 2048, 'mixture_components': 4, 'use_sparse_layer': False, 'use_batchnorm': False, 'use_dropout': False, 'mlp_size_1': 7, 'mlp_size_2': 1, 'mlp_size_3': 0, 'kernel': 'LogLogistic', 'loss_name': 'CensoredNLLLoss'}. Best is trial 644 with value: 0.8553858439194377.[0m
[32m[I 2022-04-28 05:49:51,108][0m Trial 779 finished with value: 0.843021715466076 and parameters: {'n_hidden': 2048, 'mixture_components': 4, 'use_sparse_layer': False, 'use_batchnorm': False, 'use_dropout': False, 'mlp_size_1': 7, 'mlp_size_2': 1, 'mlp_size_3': 0, 'kernel': 'Normal', 'loss_name': 'CensoredNLLLoss'}. Best is trial 644 with value: 0.8553858439194377.[0m
[32m[I 2022-04-28 05:55:54,310][0m Trial 780 finished with value: 0.8534624365434575 and parameters: {'n_hidden': 2048, 'mixture_components': 6, 'use_sparse_layer': False, 'use_batchnorm': False, 'use_dropout': False, 'mlp_size_1': 7, 'mlp_size_2': 1, 'mlp_size_3': 0, 'kernel': 'Normal', 'loss_name': 'CensoredNLLLoss'}. Best is trial 644 with value: 0.8553858439194377.[0m
[32m[I 2022-04-28 06:00:35,825][0m Trial 781 finished with value: 0.8456042301470887 and parameters: {'n_hidden': 256, 'mixture_components': 4, 'use_sparse_layer': False, 'use_batchnorm': False, 'use_dropout': False, 'mlp_size_1': 5, 'mlp_size_2': 0, 'mlp_size_3': 0, 'kernel': 'Normal', 'loss_name': 'CensoredNLLLoss'}. Best is trial 644 with value: 0.8553858439194377.[0m
[32m[I 2022-04-28 06:05:36,612][0m Trial 782 finished with value: 0.8490199444501509 and parameters: {'n_hidden': 32, 'mixture_components': 1, 'use_sparse_layer': False, 'use_batchnorm': False, 'use_dropout': False, 'mlp_size_1': 1, 'mlp_size_2': 1, 'mlp_size_3': 0, 'kernel': 'LogLogistic', 'loss_name': 'CensoredNLLLoss'}. Best is trial 644 with value: 0.8553858439194377.[0m
[32m[I 2022-04-28 06:11:13,067][0m Trial 783 finished with value: 0.8541423326067022 and parameters: {'n_hidden': 2048, 'mixture_components': 6, 'use_sparse_layer': False, 'use_batchnorm': False, 'use_dropout': False, 'mlp_size_1': 7, 'mlp_size_2': 1, 'mlp_size_3': 0, 'kernel': 'Normal', 'loss_name': 'CensoredNLLLoss'}. Best is trial 644 with value: 0.8553858439194377.[0m
[32m[I 2022-04-28 06:16:57,480][0m Trial 784 finished with value: 0.850749722233094 and parameters: {'n_hidden': 2048, 'mixture_components': 4, 'use_sparse_layer': False, 'use_batchnorm': False, 'use_dropout': False, 'mlp_size_1': 7, 'mlp_size_2': 1, 'mlp_size_3': 0, 'kernel': 'Normal', 'loss_name': 'CensoredNLLLoss'}. Best is trial 644 with value: 0.8553858439194377.[0m
[32m[I 2022-04-28 06:22:23,811][0m Trial 785 finished with value: 0.8457172631608794 and parameters: {'n_hidden': 2048, 'mixture_components': 4, 'use_sparse_layer': False, 'use_batchnorm': False, 'use_dropout': False, 'mlp_size_1': 7, 'mlp_size_2': 1, 'mlp_size_3': 0, 'kernel': 'Normal', 'loss_name': 'CensoredNLLLoss'}. Best is trial 644 with value: 0.8553858439194377.[0m
[32m[I 2022-04-28 06:26:49,780][0m Trial 786 finished with value: 0.8414283710600483 and parameters: {'n_hidden': 2048, 'mixture_components': 2, 'use_sparse_layer': False, 'use_batchnorm': False, 'use_dropout': False, 'mlp_size_1': 7, 'mlp_size_2': 1, 'mlp_size_3': 0, 'kernel': 'Logistic', 'loss_name': 'CensoredNLLLoss'}. Best is trial 644 with value: 0.8553858439194377.[0m
[32m[I 2022-04-28 06:31:37,878][0m Trial 787 finished with value: 0.6819797594668034 and parameters: {'n_hidden': 2048, 'mixture_components': 6, 'use_sparse_layer': False, 'use_batchnorm': False, 'use_dropout': False, 'mlp_size_1': 8, 'mlp_size_2': 0, 'mlp_size_3': 0, 'kernel': 'LogLogistic', 'loss_name': 'CensoredNLLLoss'}. Best is trial 644 with value: 0.8553858439194377.[0m
[32m[I 2022-04-28 06:36:45,548][0m Trial 788 finished with value: 0.8341778461883769 and parameters: {'n_hidden': 128, 'mixture_components': 4, 'use_sparse_layer': False, 'use_batchnorm': False, 'use_dropout': False, 'mlp_size_1': 0, 'mlp_size_2': 1, 'mlp_size_3': 0, 'kernel': 'Normal', 'loss_name': 'CensoredNLLLoss'}. Best is trial 644 with value: 0.8553858439194377.[0m
[32m[I 2022-04-28 06:42:33,953][0m Trial 789 finished with value: 0.850405675836547 and parameters: {'n_hidden': 2048, 'mixture_components': 4, 'use_sparse_layer': False, 'use_batchnorm': False, 'use_dropout': False, 'mlp_size_1': 7, 'mlp_size_2': 1, 'mlp_size_3': 0, 'kernel': 'Normal', 'loss_name': 'CensoredNLLLoss'}. Best is trial 644 with value: 0.8553858439194377.[0m
[32m[I 2022-04-28 06:48:31,550][0m Trial 790 finished with value: 0.8543371931900777 and parameters: {'n_hidden': 2048, 'mixture_components': 6, 'use_sparse_layer': False, 'use_batchnorm': False, 'use_dropout': False, 'mlp_size_1': 7, 'mlp_size_2': 1, 'mlp_size_3': 0, 'kernel': 'Normal', 'loss_name': 'CensoredNLLLoss'}. Best is trial 644 with value: 0.8553858439194377.[0m
[32m[I 2022-04-28 06:59:08,299][0m Trial 791 finished with value: 0.8443098937976149 and parameters: {'n_hidden': 2048, 'mixture_components': 6, 'use_sparse_layer': False, 'use_batchnorm': True, 'use_dropout': False, 'mlp_size_1': 7, 'mlp_size_2': 1, 'mlp_size_3': 0, 'kernel': 'LogLogistic', 'loss_name': 'CensoredNLLLoss'}. Best is trial 644 with value: 0.8553858439194377.[0m
[32m[I 2022-04-28 07:04:34,710][0m Trial 792 finished with value: 0.8504369226911944 and parameters: {'n_hidden': 2048, 'mixture_components': 6, 'use_sparse_layer': False, 'use_batchnorm': False, 'use_dropout': False, 'mlp_size_1': 7, 'mlp_size_2': 1, 'mlp_size_3': 0, 'kernel': 'Normal', 'loss_name': 'CensoredNLLLoss'}. Best is trial 644 with value: 0.8553858439194377.[0m
[32m[I 2022-04-28 07:07:29,798][0m Trial 793 finished with value: -1.0 and parameters: {'n_hidden': 2048, 'mixture_components': 6, 'use_sparse_layer': False, 'use_batchnorm': False, 'use_dropout': False, 'mlp_size_1': 7, 'mlp_size_2': 1, 'mlp_size_3': 0, 'kernel': 'Exponential', 'loss_name': 'CensoredNLLLoss'}. Best is trial 644 with value: 0.8553858439194377.[0m
[32m[I 2022-04-28 07:12:20,284][0m Trial 794 finished with value: 0.8243508474800306 and parameters: {'n_hidden': 1024, 'mixture_components': 7, 'use_sparse_layer': False, 'use_batchnorm': False, 'use_dropout': False, 'mlp_size_1': 7, 'mlp_size_2': 0, 'mlp_size_3': 0, 'kernel': 'Normal', 'loss_name': 'CensoredNLLLoss'}. Best is trial 644 with value: 0.8553858439194377.[0m
[32m[I 2022-04-28 07:17:59,475][0m Trial 795 finished with value: 0.8528162631363335 and parameters: {'n_hidden': 2048, 'mixture_components': 6, 'use_sparse_layer': False, 'use_batchnorm': False, 'use_dropout': False, 'mlp_size_1': 7, 'mlp_size_2': 1, 'mlp_size_3': 0, 'kernel': 'Normal', 'loss_name': 'CensoredNLLLoss'}. Best is trial 644 with value: 0.8553858439194377.[0m
[32m[I 2022-04-28 07:23:26,743][0m Trial 796 finished with value: 0.8501075671255698 and parameters: {'n_hidden': 2048, 'mixture_components': 6, 'use_sparse_layer': False, 'use_batchnorm': False, 'use_dropout': False, 'mlp_size_1': 7, 'mlp_size_2': 1, 'mlp_size_3': 0, 'kernel': 'LogLogistic', 'loss_name': 'CensoredNLLLoss'}. Best is trial 644 with value: 0.8553858439194377.[0m
[32m[I 2022-04-28 07:29:12,159][0m Trial 797 finished with value: 0.8507258547692009 and parameters: {'n_hidden': 2048, 'mixture_components': 6, 'use_sparse_layer': False, 'use_batchnorm': False, 'use_dropout': False, 'mlp_size_1': 7, 'mlp_size_2': 1, 'mlp_size_3': 0, 'kernel': 'Normal', 'loss_name': 'CensoredNLLLoss'}. Best is trial 644 with value: 0.8553858439194377.[0m
[32m[I 2022-04-28 07:34:24,008][0m Trial 798 finished with value: 0.8389479506831691 and parameters: {'n_hidden': 2048, 'mixture_components': 6, 'use_sparse_layer': False, 'use_batchnorm': False, 'use_dropout': False, 'mlp_size_1': 7, 'mlp_size_2': 1, 'mlp_size_3': 0, 'kernel': 'Normal', 'loss_name': 'CensoredNLLLoss'}. Best is trial 644 with value: 0.8553858439194377.[0m
[32m[I 2022-04-28 07:39:51,198][0m Trial 799 finished with value: 0.8459093446672898 and parameters: {'n_hidden': 2048, 'mixture_components': 6, 'use_sparse_layer': False, 'use_batchnorm': False, 'use_dropout': False, 'mlp_size_1': 7, 'mlp_size_2': 1, 'mlp_size_3': 0, 'kernel': 'Normal', 'loss_name': 'CensoredNLLLoss'}. Best is trial 644 with value: 0.8553858439194377.[0m
[32m[I 2022-04-28 07:43:52,004][0m Trial 800 finished with value: 0.8105645351864125 and parameters: {'n_hidden': 2048, 'mixture_components': 6, 'use_sparse_layer': False, 'use_batchnorm': False, 'use_dropout': False, 'mlp_size_1': 8, 'mlp_size_2': 0, 'mlp_size_3': 0, 'kernel': 'LogLogistic', 'loss_name': 'CensoredNLLLoss'}. Best is trial 644 with value: 0.8553858439194377.[0m
[32m[I 2022-04-28 07:49:21,292][0m Trial 801 finished with value: 0.8514291167217681 and parameters: {'n_hidden': 2048, 'mixture_components': 6, 'use_sparse_layer': False, 'use_batchnorm': False, 'use_dropout': False, 'mlp_size_1': 7, 'mlp_size_2': 1, 'mlp_size_3': 0, 'kernel': 'Normal', 'loss_name': 'CensoredNLLLoss'}. Best is trial 644 with value: 0.8553858439194377.[0m
[32m[I 2022-04-28 07:54:46,244][0m Trial 802 finished with value: 0.8454117921966559 and parameters: {'n_hidden': 2048, 'mixture_components': 6, 'use_sparse_layer': False, 'use_batchnorm': False, 'use_dropout': False, 'mlp_size_1': 7, 'mlp_size_2': 1, 'mlp_size_3': 0, 'kernel': 'Normal', 'loss_name': 'CensoredNLLLoss'}. Best is trial 644 with value: 0.8553858439194377.[0m
[32m[I 2022-04-28 08:00:08,340][0m Trial 803 finished with value: 0.8493783933551878 and parameters: {'n_hidden': 2048, 'mixture_components': 6, 'use_sparse_layer': False, 'use_batchnorm': False, 'use_dropout': False, 'mlp_size_1': 7, 'mlp_size_2': 1, 'mlp_size_3': 0, 'kernel': 'Normal', 'loss_name': 'CensoredNLLLoss'}. Best is trial 644 with value: 0.8553858439194377.[0m
[32m[I 2022-04-28 08:05:12,740][0m Trial 804 finished with value: 0.8430469381212253 and parameters: {'n_hidden': 64, 'mixture_components': 3, 'use_sparse_layer': False, 'use_batchnorm': False, 'use_dropout': False, 'mlp_size_1': 3, 'mlp_size_2': 0, 'mlp_size_3': 0, 'kernel': 'LogLogistic', 'loss_name': 'CensoredNLLLoss'}. Best is trial 644 with value: 0.8553858439194377.[0m
[32m[I 2022-04-28 08:10:45,027][0m Trial 805 finished with value: 0.8540251966616388 and parameters: {'n_hidden': 2048, 'mixture_components': 4, 'use_sparse_layer': False, 'use_batchnorm': False, 'use_dropout': False, 'mlp_size_1': 7, 'mlp_size_2': 1, 'mlp_size_3': 0, 'kernel': 'Normal', 'loss_name': 'CensoredNLLLoss'}. Best is trial 644 with value: 0.8553858439194377.[0m
[32m[I 2022-04-28 08:16:23,511][0m Trial 806 finished with value: 0.8487119416552684 and parameters: {'n_hidden': 2048, 'mixture_components': 6, 'use_sparse_layer': False, 'use_batchnorm': False, 'use_dropout': False, 'mlp_size_1': 7, 'mlp_size_2': 1, 'mlp_size_3': 0, 'kernel': 'Normal', 'loss_name': 'CensoredNLLLoss'}. Best is trial 644 with value: 0.8553858439194377.[0m
[32m[I 2022-04-28 08:21:44,444][0m Trial 807 finished with value: 0.8502845567788558 and parameters: {'n_hidden': 2048, 'mixture_components': 4, 'use_sparse_layer': False, 'use_batchnorm': False, 'use_dropout': False, 'mlp_size_1': 7, 'mlp_size_2': 1, 'mlp_size_3': 0, 'kernel': 'LogLogistic', 'loss_name': 'CensoredNLLLoss'}. Best is trial 644 with value: 0.8553858439194377.[0m
[32m[I 2022-04-28 08:27:25,403][0m Trial 808 finished with value: 0.8533179235911857 and parameters: {'n_hidden': 2048, 'mixture_components': 4, 'use_sparse_layer': False, 'use_batchnorm': False, 'use_dropout': False, 'mlp_size_1': 7, 'mlp_size_2': 1, 'mlp_size_3': 0, 'kernel': 'Normal', 'loss_name': 'CensoredNLLLoss'}. Best is trial 644 with value: 0.8553858439194377.[0m
[32m[I 2022-04-28 08:33:10,155][0m Trial 809 finished with value: 0.8528667663822767 and parameters: {'n_hidden': 2048, 'mixture_components': 6, 'use_sparse_layer': False, 'use_batchnorm': False, 'use_dropout': False, 'mlp_size_1': 6, 'mlp_size_2': 1, 'mlp_size_3': 1, 'kernel': 'Normal', 'loss_name': 'CensoredNLLLoss'}. Best is trial 644 with value: 0.8553858439194377.[0m
[32m[I 2022-04-28 08:38:25,607][0m Trial 810 finished with value: 0.8407434418736519 and parameters: {'n_hidden': 256, 'mixture_components': 3, 'use_sparse_layer': False, 'use_batchnorm': True, 'use_dropout': False, 'mlp_size_1': 5, 'mlp_size_2': 0, 'mlp_size_3': 0, 'kernel': 'Logistic', 'loss_name': 'CensoredNLLLoss'}. Best is trial 644 with value: 0.8553858439194377.[0m
[32m[I 2022-04-28 08:44:40,988][0m Trial 811 finished with value: 0.8532465850509146 and parameters: {'n_hidden': 2048, 'mixture_components': 4, 'use_sparse_layer': False, 'use_batchnorm': False, 'use_dropout': False, 'mlp_size_1': 7, 'mlp_size_2': 1, 'mlp_size_3': 0, 'kernel': 'Normal', 'loss_name': 'CensoredNLLLoss'}. Best is trial 644 with value: 0.8553858439194377.[0m
[32m[I 2022-04-28 08:50:05,648][0m Trial 812 finished with value: 0.8465023334803383 and parameters: {'n_hidden': 32, 'mixture_components': 3, 'use_sparse_layer': False, 'use_batchnorm': False, 'use_dropout': False, 'mlp_size_1': 1, 'mlp_size_2': 1, 'mlp_size_3': 0, 'kernel': 'LogLogistic', 'loss_name': 'CensoredNLLLoss'}. Best is trial 644 with value: 0.8553858439194377.[0m
[32m[I 2022-04-28 08:56:01,601][0m Trial 813 finished with value: 0.8544994870988525 and parameters: {'n_hidden': 2048, 'mixture_components': 6, 'use_sparse_layer': False, 'use_batchnorm': False, 'use_dropout': False, 'mlp_size_1': 7, 'mlp_size_2': 1, 'mlp_size_3': 0, 'kernel': 'Normal', 'loss_name': 'CensoredNLLLoss'}. Best is trial 644 with value: 0.8553858439194377.[0m
[32m[I 2022-04-28 09:02:11,941][0m Trial 814 finished with value: 0.8541750552325607 and parameters: {'n_hidden': 2048, 'mixture_components': 4, 'use_sparse_layer': False, 'use_batchnorm': False, 'use_dropout': False, 'mlp_size_1': 7, 'mlp_size_2': 1, 'mlp_size_3': 0, 'kernel': 'Normal', 'loss_name': 'CensoredNLLLoss'}. Best is trial 644 with value: 0.8553858439194377.[0m
[32m[I 2022-04-28 09:08:00,154][0m Trial 815 finished with value: 0.8530200136178259 and parameters: {'n_hidden': 2048, 'mixture_components': 4, 'use_sparse_layer': False, 'use_batchnorm': False, 'use_dropout': False, 'mlp_size_1': 7, 'mlp_size_2': 1, 'mlp_size_3': 0, 'kernel': 'Normal', 'loss_name': 'CensoredNLLLoss'}. Best is trial 644 with value: 0.8553858439194377.[0m
[32m[I 2022-04-28 09:11:48,891][0m Trial 816 finished with value: 0.8500011410502152 and parameters: {'n_hidden': 128, 'mixture_components': 6, 'use_sparse_layer': False, 'use_batchnorm': False, 'use_dropout': False, 'mlp_size_1': 3, 'mlp_size_2': 1, 'mlp_size_3': 0, 'kernel': 'LogLogistic', 'loss_name': 'CensoredNLLLoss'}. Best is trial 644 with value: 0.8553858439194377.[0m
[32m[I 2022-04-28 09:14:36,395][0m Trial 817 finished with value: -1.0 and parameters: {'n_hidden': 2048, 'mixture_components': 2, 'use_sparse_layer': False, 'use_batchnorm': False, 'use_dropout': False, 'mlp_size_1': 7, 'mlp_size_2': 1, 'mlp_size_3': 0, 'kernel': 'Exponential', 'loss_name': 'CensoredNLLLoss'}. Best is trial 644 with value: 0.8553858439194377.[0m
[32m[I 2022-04-28 09:20:38,719][0m Trial 818 finished with value: 0.8532132880106623 and parameters: {'n_hidden': 2048, 'mixture_components': 4, 'use_sparse_layer': False, 'use_batchnorm': False, 'use_dropout': False, 'mlp_size_1': 7, 'mlp_size_2': 1, 'mlp_size_3': 0, 'kernel': 'Normal', 'loss_name': 'CensoredNLLLoss'}. Best is trial 644 with value: 0.8553858439194377.[0m
[32m[I 2022-04-28 09:26:00,567][0m Trial 819 finished with value: 0.7955679528522112 and parameters: {'n_hidden': 2048, 'mixture_components': 4, 'use_sparse_layer': False, 'use_batchnorm': False, 'use_dropout': False, 'mlp_size_1': 7, 'mlp_size_2': 1, 'mlp_size_3': 0, 'kernel': 'Normal', 'loss_name': 'NLLLoss'}. Best is trial 644 with value: 0.8553858439194377.[0m
[32m[I 2022-04-28 09:32:28,960][0m Trial 820 finished with value: 0.8537400800762279 and parameters: {'n_hidden': 2048, 'mixture_components': 7, 'use_sparse_layer': False, 'use_batchnorm': False, 'use_dropout': False, 'mlp_size_1': 8, 'mlp_size_2': 0, 'mlp_size_3': 0, 'kernel': 'Normal', 'loss_name': 'CensoredNLLLoss'}. Best is trial 644 with value: 0.8553858439194377.[0m
[32m[I 2022-04-28 09:37:31,411][0m Trial 821 finished with value: 0.8523132354237335 and parameters: {'n_hidden': 2048, 'mixture_components': 7, 'use_sparse_layer': False, 'use_batchnorm': False, 'use_dropout': False, 'mlp_size_1': 7, 'mlp_size_2': 1, 'mlp_size_3': 0, 'kernel': 'LogLogistic', 'loss_name': 'CensoredNLLLoss'}. Best is trial 644 with value: 0.8553858439194377.[0m
[32m[I 2022-04-28 09:42:11,823][0m Trial 822 finished with value: 0.852757134556219 and parameters: {'n_hidden': 1024, 'mixture_components': 3, 'use_sparse_layer': False, 'use_batchnorm': False, 'use_dropout': False, 'mlp_size_1': 7, 'mlp_size_2': 0, 'mlp_size_3': 0, 'kernel': 'Normal', 'loss_name': 'CensoredNLLLoss'}. Best is trial 644 with value: 0.8553858439194377.[0m
[32m[I 2022-04-28 09:47:19,094][0m Trial 823 finished with value: 0.8539617828182579 and parameters: {'n_hidden': 2048, 'mixture_components': 6, 'use_sparse_layer': False, 'use_batchnorm': False, 'use_dropout': False, 'mlp_size_1': 6, 'mlp_size_2': 1, 'mlp_size_3': 0, 'kernel': 'Normal', 'loss_name': 'CensoredNLLLoss'}. Best is trial 644 with value: 0.8553858439194377.[0m
[32m[I 2022-04-28 09:53:02,277][0m Trial 824 finished with value: 0.8412207179327774 and parameters: {'n_hidden': 2048, 'mixture_components': 4, 'use_sparse_layer': False, 'use_batchnorm': False, 'use_dropout': False, 'mlp_size_1': 7, 'mlp_size_2': 1, 'mlp_size_3': 0, 'kernel': 'Normal', 'loss_name': 'CensoredNLLLoss'}. Best is trial 644 with value: 0.8553858439194377.[0m
[32m[I 2022-04-28 09:58:22,593][0m Trial 825 finished with value: 0.852326448039955 and parameters: {'n_hidden': 2048, 'mixture_components': 4, 'use_sparse_layer': False, 'use_batchnorm': False, 'use_dropout': False, 'mlp_size_1': 7, 'mlp_size_2': 1, 'mlp_size_3': 0, 'kernel': 'LogLogistic', 'loss_name': 'CensoredNLLLoss'}. Best is trial 644 with value: 0.8553858439194377.[0m
[32m[I 2022-04-28 10:02:32,327][0m Trial 826 finished with value: 0.8237806586418014 and parameters: {'n_hidden': 2048, 'mixture_components': 6, 'use_sparse_layer': False, 'use_batchnorm': False, 'use_dropout': False, 'mlp_size_1': 7, 'mlp_size_2': 1, 'mlp_size_3': 0, 'kernel': 'Normal', 'loss_name': 'NLLLoss'}. Best is trial 644 with value: 0.8553858439194377.[0m
[32m[I 2022-04-28 10:08:34,307][0m Trial 827 finished with value: 0.8536662207478068 and parameters: {'n_hidden': 2048, 'mixture_components': 4, 'use_sparse_layer': False, 'use_batchnorm': False, 'use_dropout': False, 'mlp_size_1': 7, 'mlp_size_2': 1, 'mlp_size_3': 0, 'kernel': 'Normal', 'loss_name': 'CensoredNLLLoss'}. Best is trial 644 with value: 0.8553858439194377.[0m
[32m[I 2022-04-28 10:13:45,088][0m Trial 828 finished with value: 0.8542369773664804 and parameters: {'n_hidden': 2048, 'mixture_components': 4, 'use_sparse_layer': False, 'use_batchnorm': False, 'use_dropout': False, 'mlp_size_1': 7, 'mlp_size_2': 1, 'mlp_size_3': 0, 'kernel': 'LogLogistic', 'loss_name': 'CensoredNLLLoss'}. Best is trial 644 with value: 0.8553858439194377.[0m
[32m[I 2022-04-28 10:25:23,898][0m Trial 829 finished with value: 0.8453770800293364 and parameters: {'n_hidden': 2048, 'mixture_components': 9, 'use_sparse_layer': False, 'use_batchnorm': True, 'use_dropout': False, 'mlp_size_1': 7, 'mlp_size_2': 1, 'mlp_size_3': 0, 'kernel': 'Normal', 'loss_name': 'CensoredNLLLoss'}. Best is trial 644 with value: 0.8553858439194377.[0m
