[32m[I 2022-04-21 11:48:57,619][0m Trial 62 finished with value: 0.884186949569173 and parameters: {'splitter': 'random', 'min_samples_split': 0.05480597713459377, 'min_samples_leaf': 0.006448731965102034, 'min_weight_fraction_leaf': 0.09516224123091388, 'max_features': 0.9502530077721769}. Best is trial 55 with value: 0.9086552789532311.[0m
[32m[I 2022-04-21 11:49:00,419][0m Trial 63 finished with value: 0.9072641501313635 and parameters: {'splitter': 'random', 'min_samples_split': 0.07789805452849297, 'min_samples_leaf': 0.038982424420829505, 'min_weight_fraction_leaf': 0.048045854944212624, 'max_features': 0.9215395998934431}. Best is trial 55 with value: 0.9086552789532311.[0m
[32m[I 2022-04-21 11:49:02,511][0m Trial 64 finished with value: 0.8926631628244426 and parameters: {'splitter': 'random', 'min_samples_split': 0.07765912600828347, 'min_samples_leaf': 0.039012715628744976, 'min_weight_fraction_leaf': 0.04935876543609935, 'max_features': 0.8208873548867713}. Best is trial 55 with value: 0.9086552789532311.[0m
[32m[I 2022-04-21 11:49:05,064][0m Trial 65 finished with value: 0.9036931089339376 and parameters: {'splitter': 'random', 'min_samples_split': 0.10314354141199263, 'min_samples_leaf': 0.04958410423628605, 'min_weight_fraction_leaf': 0.016857034474951255, 'max_features': 0.9178830149381657}. Best is trial 55 with value: 0.9086552789532311.[0m
[32m[I 2022-04-21 11:49:06,132][0m Trial 66 finished with value: 0.8987967791750613 and parameters: {'splitter': 'random', 'min_samples_split': 0.10436614991178483, 'min_samples_leaf': 0.08506525903660686, 'min_weight_fraction_leaf': 0.01457304575591166, 'max_features': 0.9026694191898368}. Best is trial 55 with value: 0.9086552789532311.[0m
[32m[I 2022-04-21 11:49:07,903][0m Trial 67 finished with value: 0.8944830792374917 and parameters: {'splitter': 'random', 'min_samples_split': 0.1292608077503549, 'min_samples_leaf': 0.05530519202270238, 'min_weight_fraction_leaf': 0.07903304029357175, 'max_features': 0.8576427388885564}. Best is trial 55 with value: 0.9086552789532311.[0m
[32m[I 2022-04-21 11:49:10,159][0m Trial 68 finished with value: 0.9003596525461918 and parameters: {'splitter': 'random', 'min_samples_split': 0.14363508475594894, 'min_samples_leaf': 0.04109328175258824, 'min_weight_fraction_leaf': 0.01654289589746162, 'max_features': 0.7313837757653275}. Best is trial 55 with value: 0.9086552789532311.[0m
[32m[I 2022-04-21 11:52:47,070][0m Trial 69 finished with value: 0.8890849065734259 and parameters: {'splitter': 'best', 'min_samples_split': 0.07460734892592182, 'min_samples_leaf': 0.004827047433982601, 'min_weight_fraction_leaf': 0.06197883534046675, 'max_features': 0.9257336675296292}. Best is trial 55 with value: 0.9086552789532311.[0m
[32m[I 2022-04-21 11:52:48,395][0m Trial 70 finished with value: 0.8796641217629549 and parameters: {'splitter': 'random', 'min_samples_split': 0.38948239418657415, 'min_samples_leaf': 0.13795094426340976, 'min_weight_fraction_leaf': 0.04099399307955641, 'max_features': 0.7056412408197321}. Best is trial 55 with value: 0.9086552789532311.[0m
[32m[I 2022-04-21 11:52:49,667][0m Trial 71 finished with value: 0.9018639759736125 and parameters: {'splitter': 'random', 'min_samples_split': 0.02575203806018884, 'min_samples_leaf': 0.030232277267010645, 'min_weight_fraction_leaf': 0.046979131622508455, 'max_features': 0.7695247894303285}. Best is trial 55 with value: 0.9086552789532311.[0m
[32m[I 2022-04-21 11:52:51,247][0m Trial 72 finished with value: 0.8023968637333418 and parameters: {'splitter': 'random', 'min_samples_split': 0.06159218426755395, 'min_samples_leaf': 0.015318242124628336, 'min_weight_fraction_leaf': 0.00063637608068709, 'max_features': 0.9197523782457693}. Best is trial 55 with value: 0.9086552789532311.[0m
[32m[I 2022-04-21 11:52:52,284][0m Trial 73 finished with value: 0.6858869850908569 and parameters: {'splitter': 'random', 'min_samples_split': 0.3013417612660969, 'min_samples_leaf': 0.06591560778972103, 'min_weight_fraction_leaf': 0.0714473521664249, 'max_features': 0.8811389052260612}. Best is trial 55 with value: 0.9086552789532311.[0m
[32m[I 2022-04-21 11:52:53,663][0m Trial 74 finished with value: 0.49665005585483823 and parameters: {'splitter': 'random', 'min_samples_split': 0.48082822151414883, 'min_samples_leaf': 0.050709854220287426, 'min_weight_fraction_leaf': 0.0929247252215267, 'max_features': 0.9809070402194737}. Best is trial 55 with value: 0.9086552789532311.[0m
[32m[I 2022-04-21 11:52:55,629][0m Trial 75 finished with value: 0.8934171262844186 and parameters: {'splitter': 'random', 'min_samples_split': 0.09966042235410146, 'min_samples_leaf': 0.0012834906471542624, 'min_weight_fraction_leaf': 0.015399295119997616, 'max_features': 0.8317516081151487}. Best is trial 55 with value: 0.9086552789532311.[0m
[32m[I 2022-04-21 11:52:58,293][0m Trial 76 finished with value: 0.9012595172398659 and parameters: {'splitter': 'random', 'min_samples_split': 0.0843224480892319, 'min_samples_leaf': 0.07354507926735637, 'min_weight_fraction_leaf': 0.05919206536532554, 'max_features': 0.939219989576719}. Best is trial 55 with value: 0.9086552789532311.[0m
[32m[I 2022-04-21 11:53:00,710][0m Trial 77 finished with value: 0.9020158378674562 and parameters: {'splitter': 'random', 'min_samples_split': 0.014270943934307067, 'min_samples_leaf': 0.0324614078009515, 'min_weight_fraction_leaf': 0.040614275957888295, 'max_features': 0.8644358756644932}. Best is trial 55 with value: 0.9086552789532311.[0m
[32m[I 2022-04-21 11:53:01,948][0m Trial 78 finished with value: 0.8912869799969183 and parameters: {'splitter': 'random', 'min_samples_split': 0.03130102679978013, 'min_samples_leaf': 0.04506027864332067, 'min_weight_fraction_leaf': 0.015084728917073579, 'max_features': 0.8071305654789518}. Best is trial 55 with value: 0.9086552789532311.[0m
[32m[I 2022-04-21 11:53:51,048][0m Trial 79 finished with value: 0.2828328603381454 and parameters: {'splitter': 'best', 'min_samples_split': 0.052571320222734114, 'min_samples_leaf': 0.09065076303423825, 'min_weight_fraction_leaf': 0.3147834421110042, 'max_features': 0.6710705991824253}. Best is trial 55 with value: 0.9086552789532311.[0m
[32m[I 2022-04-21 11:53:52,437][0m Trial 80 finished with value: 0.8178487859129329 and parameters: {'splitter': 'random', 'min_samples_split': 0.06853616098651594, 'min_samples_leaf': 0.11332132815010103, 'min_weight_fraction_leaf': 0.03469074719733073, 'max_features': 0.3351023627335826}. Best is trial 55 with value: 0.9086552789532311.[0m
[32m[I 2022-04-21 11:53:54,498][0m Trial 81 finished with value: 0.90631379897085 and parameters: {'splitter': 'random', 'min_samples_split': 0.0475132215845396, 'min_samples_leaf': 0.019624650451901378, 'min_weight_fraction_leaf': 0.03099929282770248, 'max_features': 0.9470409081796295}. Best is trial 55 with value: 0.9086552789532311.[0m
[32m[I 2022-04-21 11:53:56,808][0m Trial 82 finished with value: 0.9070566812878429 and parameters: {'splitter': 'random', 'min_samples_split': 0.035226581003077045, 'min_samples_leaf': 0.02350798627715396, 'min_weight_fraction_leaf': 0.05380659212766489, 'max_features': 0.916972294992574}. Best is trial 55 with value: 0.9086552789532311.[0m
[32m[I 2022-04-21 11:53:57,768][0m Trial 83 finished with value: 0.25 and parameters: {'splitter': 'random', 'min_samples_split': 0.03501270689315718, 'min_samples_leaf': 0.015346127060190949, 'min_weight_fraction_leaf': 0.4924199335007722, 'max_features': 0.912437502257055}. Best is trial 55 with value: 0.9086552789532311.[0m
[32m[I 2022-04-21 11:53:58,770][0m Trial 84 finished with value: 0.8937633239781638 and parameters: {'splitter': 'random', 'min_samples_split': 0.131546245512855, 'min_samples_leaf': 0.03375275883632457, 'min_weight_fraction_leaf': 0.07320748157755577, 'max_features': 0.8456455693229175}. Best is trial 55 with value: 0.9086552789532311.[0m
[32m[I 2022-04-21 11:53:59,780][0m Trial 85 finished with value: 0.902730023317034 and parameters: {'splitter': 'random', 'min_samples_split': 0.0878766332042133, 'min_samples_leaf': 0.06291192929381749, 'min_weight_fraction_leaf': 0.02350372763414948, 'max_features': 0.9416589501581691}. Best is trial 55 with value: 0.9086552789532311.[0m
[32m[I 2022-04-21 11:54:00,631][0m Trial 86 finished with value: 0.25 and parameters: {'splitter': 'random', 'min_samples_split': 0.047423270918582776, 'min_samples_leaf': 0.012396970702057006, 'min_weight_fraction_leaf': 0.46977544586775766, 'max_features': 0.08455005979536484}. Best is trial 55 with value: 0.9086552789532311.[0m
[32m[I 2022-04-21 11:54:02,370][0m Trial 87 finished with value: 0.9017520051580299 and parameters: {'splitter': 'random', 'min_samples_split': 0.06785737403234354, 'min_samples_leaf': 0.05381443880007328, 'min_weight_fraction_leaf': 0.06304158795926273, 'max_features': 0.8805338361946158}. Best is trial 55 with value: 0.9086552789532311.[0m
[32m[I 2022-04-21 11:54:04,584][0m Trial 88 finished with value: 0.9052787105007816 and parameters: {'splitter': 'random', 'min_samples_split': 0.014820340204097674, 'min_samples_leaf': 0.07398357584118767, 'min_weight_fraction_leaf': 0.0015555382765878277, 'max_features': 0.9892556342778631}. Best is trial 55 with value: 0.9086552789532311.[0m
[32m[I 2022-04-21 11:54:06,122][0m Trial 89 finished with value: 0.3425804518366971 and parameters: {'splitter': 'random', 'min_samples_split': 0.010829150676278654, 'min_samples_leaf': 0.44550755680715953, 'min_weight_fraction_leaf': 0.001616678193282992, 'max_features': 0.9873839124252597}. Best is trial 55 with value: 0.9086552789532311.[0m
[32m[I 2022-04-21 11:54:08,181][0m Trial 90 finished with value: 0.899273654986886 and parameters: {'splitter': 'random', 'min_samples_split': 0.03588016494975207, 'min_samples_leaf': 0.07460236714659127, 'min_weight_fraction_leaf': 0.03565929285816466, 'max_features': 0.904785433373298}. Best is trial 55 with value: 0.9086552789532311.[0m
[32m[I 2022-04-21 11:54:11,007][0m Trial 91 finished with value: 0.9060976186625135 and parameters: {'splitter': 'random', 'min_samples_split': 0.05532021943525074, 'min_samples_leaf': 0.027415201284597172, 'min_weight_fraction_leaf': 0.015724455745123822, 'max_features': 0.9498486366267022}. Best is trial 55 with value: 0.9086552789532311.[0m
[32m[I 2022-04-21 11:54:13,352][0m Trial 92 finished with value: 0.9018094977324141 and parameters: {'splitter': 'random', 'min_samples_split': 0.00850815474339317, 'min_samples_leaf': 0.036970365299151105, 'min_weight_fraction_leaf': 0.01016894567641516, 'max_features': 0.940791558188972}. Best is trial 55 with value: 0.9086552789532311.[0m
[32m[I 2022-04-21 11:54:15,253][0m Trial 93 finished with value: 0.9056670158739475 and parameters: {'splitter': 'random', 'min_samples_split': 0.055803197428511725, 'min_samples_leaf': 0.001032854492116736, 'min_weight_fraction_leaf': 0.02293524098405411, 'max_features': 0.9999218445207787}. Best is trial 55 with value: 0.9086552789532311.[0m
[32m[I 2022-04-21 11:54:17,269][0m Trial 94 finished with value: 0.905950724341903 and parameters: {'splitter': 'random', 'min_samples_split': 0.05802465278908778, 'min_samples_leaf': 0.02661925121981601, 'min_weight_fraction_leaf': 0.03112483725812193, 'max_features': 0.9998000406560492}. Best is trial 55 with value: 0.9086552789532311.[0m
[32m[I 2022-04-21 11:54:19,062][0m Trial 95 finished with value: 0.9068079156547334 and parameters: {'splitter': 'random', 'min_samples_split': 0.05686228908511928, 'min_samples_leaf': 0.0015557973476582228, 'min_weight_fraction_leaf': 0.05608865608088241, 'max_features': 0.992070938075407}. Best is trial 55 with value: 0.9086552789532311.[0m
[32m[I 2022-04-21 11:54:20,325][0m Trial 96 finished with value: 0.90561048956243 and parameters: {'splitter': 'random', 'min_samples_split': 0.05821838562007359, 'min_samples_leaf': 0.0038846773736664897, 'min_weight_fraction_leaf': 0.08340720962038164, 'max_features': 0.9878589250035742}. Best is trial 55 with value: 0.9086552789532311.[0m
[32m[I 2022-04-21 11:57:08,309][0m Trial 97 finished with value: 0.890947846419127 and parameters: {'splitter': 'best', 'min_samples_split': 0.060472188720049384, 'min_samples_leaf': 0.010735159705764613, 'min_weight_fraction_leaf': 0.08561271480269851, 'max_features': 0.974887081121539}. Best is trial 55 with value: 0.9086552789532311.[0m
[32m[I 2022-04-21 11:57:10,236][0m Trial 98 finished with value: 0.8857666750938831 and parameters: {'splitter': 'random', 'min_samples_split': 0.07260419408438543, 'min_samples_leaf': 0.004377621521191656, 'min_weight_fraction_leaf': 0.12035412767693442, 'max_features': 0.9544136184687008}. Best is trial 55 with value: 0.9086552789532311.[0m
[32m[I 2022-04-21 11:57:11,859][0m Trial 99 finished with value: 0.9052217976712347 and parameters: {'splitter': 'random', 'min_samples_split': 0.05282700314694352, 'min_samples_leaf': 0.024501277651975933, 'min_weight_fraction_leaf': 0.05429652615858658, 'max_features': 0.997011796205457}. Best is trial 55 with value: 0.9086552789532311.[0m
[32m[I 2022-04-21 11:57:13,343][0m Trial 100 finished with value: 0.3425804518366971 and parameters: {'splitter': 'random', 'min_samples_split': 0.08015083139419489, 'min_samples_leaf': 0.27212905379246594, 'min_weight_fraction_leaf': 0.06472054416962195, 'max_features': 0.9467398813668161}. Best is trial 55 with value: 0.9086552789532311.[0m
[32m[I 2022-04-21 11:57:14,939][0m Trial 101 finished with value: 0.9046547426286041 and parameters: {'splitter': 'random', 'min_samples_split': 0.045636626945928765, 'min_samples_leaf': 0.03618934659847897, 'min_weight_fraction_leaf': 0.034375724444665426, 'max_features': 0.9789295897574047}. Best is trial 55 with value: 0.9086552789532311.[0m
[32m[I 2022-04-21 11:57:16,978][0m Trial 102 finished with value: 0.9034374163035555 and parameters: {'splitter': 'random', 'min_samples_split': 0.02126431026200795, 'min_samples_leaf': 0.002047091841061898, 'min_weight_fraction_leaf': 0.0418713034410869, 'max_features': 0.9947143047736254}. Best is trial 55 with value: 0.9086552789532311.[0m
[32m[I 2022-04-21 11:57:18,078][0m Trial 103 finished with value: 0.8776840608889188 and parameters: {'splitter': 'random', 'min_samples_split': 0.03093566725956929, 'min_samples_leaf': 0.022481327067571853, 'min_weight_fraction_leaf': 0.027823101414375967, 'max_features': 0.3103478959024377}. Best is trial 55 with value: 0.9086552789532311.[0m
[32m[I 2022-04-21 11:57:20,341][0m Trial 104 finished with value: 0.8860467541556452 and parameters: {'splitter': 'random', 'min_samples_split': 0.057710084334400724, 'min_samples_leaf': 0.014091816543696751, 'min_weight_fraction_leaf': 0.09849710016012428, 'max_features': 0.958476034426546}. Best is trial 55 with value: 0.9086552789532311.[0m
[32m[I 2022-04-21 11:57:22,022][0m Trial 105 finished with value: 0.9013643976816244 and parameters: {'splitter': 'random', 'min_samples_split': 0.04257774119425954, 'min_samples_leaf': 0.04392018116368507, 'min_weight_fraction_leaf': 0.008218449478999707, 'max_features': 0.9982056030701434}. Best is trial 55 with value: 0.9086552789532311.[0m
[32m[I 2022-04-21 11:57:23,739][0m Trial 106 finished with value: 0.8976236008789762 and parameters: {'splitter': 'random', 'min_samples_split': 0.06579627083561095, 'min_samples_leaf': 0.026848359047024095, 'min_weight_fraction_leaf': 0.053933418175059145, 'max_features': 0.9731785943130689}. Best is trial 55 with value: 0.9086552789532311.[0m
[32m[I 2022-04-21 11:57:24,834][0m Trial 107 finished with value: 0.3425804518366971 and parameters: {'splitter': 'random', 'min_samples_split': 0.018824171741236805, 'min_samples_leaf': 0.3429201431323562, 'min_weight_fraction_leaf': 0.0814249866333083, 'max_features': 0.936742094103334}. Best is trial 55 with value: 0.9086552789532311.[0m
[32m[I 2022-04-21 11:57:26,283][0m Trial 108 finished with value: 0.902246201953389 and parameters: {'splitter': 'random', 'min_samples_split': 0.09381333532554384, 'min_samples_leaf': 0.05995000843869753, 'min_weight_fraction_leaf': 0.024506710939442258, 'max_features': 0.8831143555904561}. Best is trial 55 with value: 0.9086552789532311.[0m
[32m[I 2022-04-21 11:57:27,583][0m Trial 109 finished with value: 0.9068606357063546 and parameters: {'splitter': 'random', 'min_samples_split': 0.001825576289454886, 'min_samples_leaf': 0.012700066475370534, 'min_weight_fraction_leaf': 0.04644392381082624, 'max_features': 0.9242347887545477}. Best is trial 55 with value: 0.9086552789532311.[0m
[32m[I 2022-04-21 11:57:29,302][0m Trial 110 finished with value: 0.3425804518366971 and parameters: {'splitter': 'random', 'min_samples_split': 0.03273708006881398, 'min_samples_leaf': 0.015926565597769705, 'min_weight_fraction_leaf': 0.33669039909993026, 'max_features': 0.9247264442342726}. Best is trial 55 with value: 0.9086552789532311.[0m
[32m[I 2022-04-21 11:57:31,265][0m Trial 111 finished with value: 0.9027516482401932 and parameters: {'splitter': 'random', 'min_samples_split': 0.0035075186880292597, 'min_samples_leaf': 0.0012474298417611343, 'min_weight_fraction_leaf': 0.048182614222456926, 'max_features': 0.9578466345433309}. Best is trial 55 with value: 0.9086552789532311.[0m
[32m[I 2022-04-21 11:57:32,831][0m Trial 112 finished with value: 0.9045937879879432 and parameters: {'splitter': 'random', 'min_samples_split': 0.04996108718327401, 'min_samples_leaf': 0.03297412591709453, 'min_weight_fraction_leaf': 0.02080454412300073, 'max_features': 0.983567883092868}. Best is trial 55 with value: 0.9086552789532311.[0m
[32m[I 2022-04-21 11:57:34,108][0m Trial 113 finished with value: 0.9083645748386966 and parameters: {'splitter': 'random', 'min_samples_split': 0.018538557493180997, 'min_samples_leaf': 0.0396630212358073, 'min_weight_fraction_leaf': 0.03885488107391179, 'max_features': 0.9092886009914529}. Best is trial 55 with value: 0.9086552789532311.[0m
[32m[I 2022-04-21 11:57:35,302][0m Trial 114 finished with value: 0.8947348861544251 and parameters: {'splitter': 'random', 'min_samples_split': 0.026205422525505687, 'min_samples_leaf': 0.0452176501846821, 'min_weight_fraction_leaf': 0.06777327613666351, 'max_features': 0.8718289364359595}. Best is trial 55 with value: 0.9086552789532311.[0m
[32m[I 2022-04-21 11:57:36,263][0m Trial 115 finished with value: 0.3425804518366971 and parameters: {'splitter': 'random', 'min_samples_split': 0.039471972579441274, 'min_samples_leaf': 0.22583610545174287, 'min_weight_fraction_leaf': 0.2953306392830951, 'max_features': 0.9084027551644992}. Best is trial 55 with value: 0.9086552789532311.[0m
[32m[I 2022-04-21 12:00:06,040][0m Trial 116 finished with value: 0.889075652371738 and parameters: {'splitter': 'best', 'min_samples_split': 0.3456978392768938, 'min_samples_leaf': 0.023065662474750743, 'min_weight_fraction_leaf': 0.0422658598978727, 'max_features': 0.9380038277873691}. Best is trial 55 with value: 0.9086552789532311.[0m
[32m[I 2022-04-21 12:00:07,129][0m Trial 117 finished with value: 0.8992083114066525 and parameters: {'splitter': 'random', 'min_samples_split': 0.0771721454096912, 'min_samples_leaf': 0.011433380351348868, 'min_weight_fraction_leaf': 0.06030805512972877, 'max_features': 0.9006169927375195}. Best is trial 55 with value: 0.9086552789532311.[0m
[32m[I 2022-04-21 12:00:08,087][0m Trial 118 finished with value: 0.903282669524702 and parameters: {'splitter': 'random', 'min_samples_split': 0.05876941756342476, 'min_samples_leaf': 0.040161368888382114, 'min_weight_fraction_leaf': 0.03274400085851275, 'max_features': 0.960866255439463}. Best is trial 55 with value: 0.9086552789532311.[0m
[32m[I 2022-04-21 12:00:09,495][0m Trial 119 finished with value: 0.8846393237360853 and parameters: {'splitter': 'random', 'min_samples_split': 0.0010748751552863214, 'min_samples_leaf': 0.029796048424670953, 'min_weight_fraction_leaf': 0.07399496647533145, 'max_features': 0.5637207516530347}. Best is trial 55 with value: 0.9086552789532311.[0m
[32m[I 2022-04-21 12:00:11,193][0m Trial 120 finished with value: 0.903499310317087 and parameters: {'splitter': 'random', 'min_samples_split': 0.04046190497246539, 'min_samples_leaf': 0.0557199214767109, 'min_weight_fraction_leaf': 0.05299268330363313, 'max_features': 0.931596037420167}. Best is trial 55 with value: 0.9086552789532311.[0m
[32m[I 2022-04-21 12:00:13,755][0m Trial 121 finished with value: 0.9016374923816247 and parameters: {'splitter': 'random', 'min_samples_split': 0.02141488769591233, 'min_samples_leaf': 0.018683873915826096, 'min_weight_fraction_leaf': 0.012690876351426229, 'max_features': 0.9782569391556619}. Best is trial 55 with value: 0.9086552789532311.[0m
[32m[I 2022-04-21 12:00:16,217][0m Trial 122 finished with value: 0.9043281366168217 and parameters: {'splitter': 'random', 'min_samples_split': 0.015791670628629968, 'min_samples_leaf': 0.009760924470466444, 'min_weight_fraction_leaf': 0.040568791680372245, 'max_features': 0.9957627736038142}. Best is trial 55 with value: 0.9086552789532311.[0m
/media/san2_ssd/data/Workdir/survival/utils.py:305: RuntimeWarning: invalid value encountered in true_divide
  pdfs = np.gradient(1-survs,axis=1)/norms
[32m[I 2022-04-21 12:00:18,006][0m Trial 123 finished with value: 0.8954251327502893 and parameters: {'splitter': 'random', 'min_samples_split': 0.02734422202360849, 'min_samples_leaf': 0.0011052884701088527, 'min_weight_fraction_leaf': 0.009920790087157908, 'max_features': 0.9588958859756338}. Best is trial 55 with value: 0.9086552789532311.[0m
