[32m[I 2022-04-25 10:45:21,289][0m Trial 17 finished with value: 0.8312952215776441 and parameters: {'n_hidden': 64, 'mixture_components': 6, 'use_sparse_layer': False, 'use_batchnorm': False, 'use_dropout': True, 'dropout': 0.2533070299573224, 'mlp_size_1': 2, 'mlp_size_2': 1, 'mlp_size_3': 0, 'kernel': 'Normal', 'loss_name': 'CensoredNLLLoss'}. Best is trial 11 with value: 0.8478685398855831.[0m
[32m[I 2022-04-25 10:46:51,198][0m Trial 18 finished with value: -1.0 and parameters: {'n_hidden': 128, 'mixture_components': 5, 'use_sparse_layer': False, 'use_batchnorm': False, 'use_dropout': True, 'dropout': 0.4482945576518089, 'mlp_size_1': 3, 'mlp_size_2': 1, 'mlp_size_3': 0, 'kernel': 'Exponential', 'loss_name': 'CensoredNLLLoss'}. Best is trial 11 with value: 0.8478685398855831.[0m
[32m[I 2022-04-25 10:52:10,850][0m Trial 19 finished with value: 0.8473646040587935 and parameters: {'n_hidden': 512, 'mixture_components': 1, 'use_sparse_layer': True, 'use_sparse_loss': False, 'use_batchnorm': True, 'use_dropout': True, 'dropout': 0.1787928287330247, 'mlp_size_1': 4, 'mlp_size_2': 1, 'mlp_size_3': 1, 'kernel': 'Logistic', 'loss_name': 'AlternativeNLLLoss'}. Best is trial 11 with value: 0.8478685398855831.[0m
[32m[I 2022-04-25 10:54:12,995][0m Trial 20 finished with value: -1.0 and parameters: {'n_hidden': 256, 'mixture_components': 2, 'use_sparse_layer': True, 'use_sparse_loss': False, 'use_batchnorm': True, 'use_dropout': True, 'dropout': 0.9668801742389304, 'mlp_size_1': 4, 'mlp_size_2': 0, 'mlp_size_3': 1, 'kernel': 'Logistic', 'loss_name': 'AlternativeNLLLoss'}. Best is trial 11 with value: 0.8478685398855831.[0m
[32m[I 2022-04-25 11:01:26,510][0m Trial 21 finished with value: 0.8493919504395265 and parameters: {'n_hidden': 512, 'mixture_components': 1, 'use_sparse_layer': True, 'use_sparse_loss': False, 'use_batchnorm': True, 'use_dropout': True, 'dropout': 0.19517509340230405, 'mlp_size_1': 4, 'mlp_size_2': 1, 'mlp_size_3': 1, 'kernel': 'Logistic', 'loss_name': 'AlternativeNLLLoss'}. Best is trial 21 with value: 0.8493919504395265.[0m
[32m[I 2022-04-25 11:07:12,134][0m Trial 22 finished with value: 0.8457051559326171 and parameters: {'n_hidden': 512, 'mixture_components': 1, 'use_sparse_layer': True, 'use_sparse_loss': False, 'use_batchnorm': True, 'use_dropout': True, 'dropout': 0.1809371876516088, 'mlp_size_1': 4, 'mlp_size_2': 1, 'mlp_size_3': 1, 'kernel': 'Logistic', 'loss_name': 'AlternativeNLLLoss'}. Best is trial 21 with value: 0.8493919504395265.[0m
[32m[I 2022-04-25 11:13:27,695][0m Trial 23 finished with value: 0.8462197137224818 and parameters: {'n_hidden': 512, 'mixture_components': 1, 'use_sparse_layer': True, 'use_sparse_loss': False, 'use_batchnorm': True, 'use_dropout': True, 'dropout': 0.159195578997839, 'mlp_size_1': 5, 'mlp_size_2': 1, 'mlp_size_3': 0, 'kernel': 'Logistic', 'loss_name': 'AlternativeNLLLoss'}. Best is trial 21 with value: 0.8493919504395265.[0m
[32m[I 2022-04-25 11:19:21,081][0m Trial 24 finished with value: 0.8482275837083572 and parameters: {'n_hidden': 512, 'mixture_components': 1, 'use_sparse_layer': True, 'use_sparse_loss': False, 'use_batchnorm': True, 'use_dropout': True, 'dropout': 0.031039731129908266, 'mlp_size_1': 4, 'mlp_size_2': 1, 'mlp_size_3': 1, 'kernel': 'Logistic', 'loss_name': 'AlternativeNLLLoss'}. Best is trial 21 with value: 0.8493919504395265.[0m
[32m[I 2022-04-25 11:24:25,551][0m Trial 25 finished with value: 0.8336579122391825 and parameters: {'n_hidden': 256, 'mixture_components': 2, 'use_sparse_layer': True, 'use_sparse_loss': False, 'use_batchnorm': True, 'use_dropout': True, 'dropout': 0.011169915906265093, 'mlp_size_1': 4, 'mlp_size_2': 1, 'mlp_size_3': 0, 'kernel': 'Logistic', 'loss_name': 'AlternativeNLLLoss'}. Best is trial 21 with value: 0.8493919504395265.[0m
[32m[I 2022-04-25 11:28:01,234][0m Trial 26 finished with value: 0.8539967281394194 and parameters: {'n_hidden': 512, 'mixture_components': 5, 'use_sparse_layer': False, 'use_batchnorm': False, 'use_dropout': True, 'dropout': 0.09401558473778288, 'mlp_size_1': 5, 'mlp_size_2': 1, 'mlp_size_3': 0, 'kernel': 'Logistic', 'loss_name': 'AlternativeNLLLoss'}. Best is trial 26 with value: 0.8539967281394194.[0m
[32m[I 2022-04-25 11:35:26,614][0m Trial 27 finished with value: 0.8455011577392326 and parameters: {'n_hidden': 512, 'mixture_components': 5, 'use_sparse_layer': True, 'use_sparse_loss': False, 'use_batchnorm': True, 'use_dropout': True, 'dropout': 0.06809560281995795, 'mlp_size_1': 5, 'mlp_size_2': 1, 'mlp_size_3': 0, 'kernel': 'Logistic', 'loss_name': 'AlternativeNLLLoss'}. Best is trial 26 with value: 0.8539967281394194.[0m
[32m[I 2022-04-25 11:38:53,290][0m Trial 28 finished with value: 0.8459046787708381 and parameters: {'n_hidden': 512, 'mixture_components': 2, 'use_sparse_layer': False, 'use_batchnorm': False, 'use_dropout': True, 'dropout': 0.07358269881308774, 'mlp_size_1': 6, 'mlp_size_2': 0, 'mlp_size_3': 0, 'kernel': 'Logistic', 'loss_name': 'AlternativeNLLLoss'}. Best is trial 26 with value: 0.8539967281394194.[0m
[32m[I 2022-04-25 11:41:56,019][0m Trial 29 finished with value: 0.8491792767679716 and parameters: {'n_hidden': 512, 'mixture_components': 1, 'use_sparse_layer': False, 'use_batchnorm': False, 'use_dropout': False, 'mlp_size_1': 6, 'mlp_size_2': 0, 'mlp_size_3': 0, 'kernel': 'Logistic', 'loss_name': 'AlternativeNLLLoss'}. Best is trial 26 with value: 0.8539967281394194.[0m
[32m[I 2022-04-25 11:44:01,329][0m Trial 30 finished with value: -1.0 and parameters: {'n_hidden': 512, 'mixture_components': 3, 'use_sparse_layer': False, 'use_batchnorm': False, 'use_dropout': False, 'mlp_size_1': 6, 'mlp_size_2': 0, 'mlp_size_3': 0, 'kernel': 'Exponential', 'loss_name': 'AlternativeNLLLoss'}. Best is trial 26 with value: 0.8539967281394194.[0m
[32m[I 2022-04-25 11:46:50,808][0m Trial 31 finished with value: 0.8467697855950602 and parameters: {'n_hidden': 512, 'mixture_components': 1, 'use_sparse_layer': False, 'use_batchnorm': False, 'use_dropout': False, 'mlp_size_1': 5, 'mlp_size_2': 1, 'mlp_size_3': 0, 'kernel': 'Logistic', 'loss_name': 'AlternativeNLLLoss'}. Best is trial 26 with value: 0.8539967281394194.[0m
[32m[I 2022-04-25 11:50:24,386][0m Trial 32 finished with value: 0.8407661537700278 and parameters: {'n_hidden': 512, 'mixture_components': 2, 'use_sparse_layer': False, 'use_batchnorm': False, 'use_dropout': False, 'mlp_size_1': 6, 'mlp_size_2': 0, 'mlp_size_3': 0, 'kernel': 'Logistic', 'loss_name': 'AlternativeNLLLoss'}. Best is trial 26 with value: 0.8539967281394194.[0m
[32m[I 2022-04-25 11:53:15,592][0m Trial 33 finished with value: 0.8482820345928367 and parameters: {'n_hidden': 512, 'mixture_components': 1, 'use_sparse_layer': False, 'use_batchnorm': False, 'use_dropout': False, 'mlp_size_1': 5, 'mlp_size_2': 1, 'mlp_size_3': 0, 'kernel': 'Logistic', 'loss_name': 'AlternativeNLLLoss'}. Best is trial 26 with value: 0.8539967281394194.[0m
[32m[I 2022-04-25 11:58:04,598][0m Trial 34 finished with value: 0.8445946038001633 and parameters: {'n_hidden': 64, 'mixture_components': 3, 'use_sparse_layer': False, 'use_batchnorm': False, 'use_dropout': False, 'mlp_size_1': 3, 'mlp_size_2': 0, 'mlp_size_3': 0, 'kernel': 'Logistic', 'loss_name': 'AlternativeNLLLoss'}. Best is trial 26 with value: 0.8539967281394194.[0m
[32m[I 2022-04-25 12:01:51,259][0m Trial 35 finished with value: 0.8218210516025553 and parameters: {'n_hidden': 512, 'mixture_components': 4, 'use_sparse_layer': False, 'use_batchnorm': False, 'use_dropout': False, 'mlp_size_1': 6, 'mlp_size_2': 0, 'mlp_size_3': 0, 'kernel': 'Logistic', 'loss_name': 'AlternativeNLLLoss'}. Best is trial 26 with value: 0.8539967281394194.[0m
[32m[I 2022-04-25 12:03:08,281][0m Trial 36 finished with value: -1.0 and parameters: {'n_hidden': 32, 'mixture_components': 2, 'use_sparse_layer': False, 'use_batchnorm': False, 'use_dropout': False, 'mlp_size_1': 2, 'mlp_size_2': 0, 'mlp_size_3': 0, 'kernel': 'Exponential', 'loss_name': 'AlternativeNLLLoss'}. Best is trial 26 with value: 0.8539967281394194.[0m
[32m[I 2022-04-25 12:06:23,249][0m Trial 37 finished with value: 0.8375269887976924 and parameters: {'n_hidden': 512, 'mixture_components': 4, 'use_sparse_layer': False, 'use_batchnorm': False, 'use_dropout': False, 'mlp_size_1': 5, 'mlp_size_2': 1, 'mlp_size_3': 0, 'kernel': 'LogLogistic', 'loss_name': 'AlternativeNLLLoss'}. Best is trial 26 with value: 0.8539967281394194.[0m
[32m[I 2022-04-25 12:10:02,385][0m Trial 38 finished with value: 0.8339917105229244 and parameters: {'n_hidden': 1024, 'mixture_components': 3, 'use_sparse_layer': False, 'use_batchnorm': False, 'use_dropout': False, 'mlp_size_1': 7, 'mlp_size_2': 0, 'mlp_size_3': 0, 'kernel': 'Logistic', 'loss_name': 'NLLLoss'}. Best is trial 26 with value: 0.8539967281394194.[0m
[32m[I 2022-04-25 12:13:36,003][0m Trial 39 finished with value: 0.8471938698419489 and parameters: {'n_hidden': 128, 'mixture_components': 1, 'use_sparse_layer': False, 'use_batchnorm': False, 'use_dropout': False, 'mlp_size_1': 4, 'mlp_size_2': 0, 'mlp_size_3': 0, 'kernel': 'Logistic', 'loss_name': 'AlternativeNLLLoss'}. Best is trial 26 with value: 0.8539967281394194.[0m
[32m[I 2022-04-25 12:18:38,265][0m Trial 40 finished with value: 0.8520935364955321 and parameters: {'n_hidden': 2048, 'mixture_components': 2, 'use_sparse_layer': False, 'use_batchnorm': False, 'use_dropout': False, 'mlp_size_1': 8, 'mlp_size_2': 0, 'mlp_size_3': 0, 'kernel': 'LogLogistic', 'loss_name': 'AlternativeNLLLoss'}. Best is trial 26 with value: 0.8539967281394194.[0m
[32m[I 2022-04-25 12:24:49,391][0m Trial 41 finished with value: 0.8484777498990915 and parameters: {'n_hidden': 2048, 'mixture_components': 2, 'use_sparse_layer': False, 'use_batchnorm': False, 'use_dropout': False, 'mlp_size_1': 8, 'mlp_size_2': 0, 'mlp_size_3': 0, 'kernel': 'LogLogistic', 'loss_name': 'AlternativeNLLLoss'}. Best is trial 26 with value: 0.8539967281394194.[0m
[32m[I 2022-04-25 12:29:38,073][0m Trial 42 finished with value: 0.7801227000663709 and parameters: {'n_hidden': 2048, 'mixture_components': 2, 'use_sparse_layer': False, 'use_batchnorm': False, 'use_dropout': False, 'mlp_size_1': 8, 'mlp_size_2': 0, 'mlp_size_3': 0, 'kernel': 'LogLogistic', 'loss_name': 'AlternativeNLLLoss'}. Best is trial 26 with value: 0.8539967281394194.[0m
[32m[I 2022-04-25 12:34:57,303][0m Trial 43 finished with value: 0.8519982676938307 and parameters: {'n_hidden': 2048, 'mixture_components': 3, 'use_sparse_layer': False, 'use_batchnorm': False, 'use_dropout': False, 'mlp_size_1': 8, 'mlp_size_2': 0, 'mlp_size_3': 0, 'kernel': 'LogLogistic', 'loss_name': 'AlternativeNLLLoss'}. Best is trial 26 with value: 0.8539967281394194.[0m
[32m[I 2022-04-25 12:39:35,851][0m Trial 44 finished with value: 0.8134690744744555 and parameters: {'n_hidden': 2048, 'mixture_components': 3, 'use_sparse_layer': False, 'use_batchnorm': False, 'use_dropout': False, 'mlp_size_1': 7, 'mlp_size_2': 0, 'mlp_size_3': 0, 'kernel': 'LogLogistic', 'loss_name': 'NLLLoss'}. Best is trial 26 with value: 0.8539967281394194.[0m
[32m[I 2022-04-25 12:44:21,181][0m Trial 45 finished with value: 0.8495427864331033 and parameters: {'n_hidden': 2048, 'mixture_components': 5, 'use_sparse_layer': False, 'use_batchnorm': False, 'use_dropout': False, 'mlp_size_1': 8, 'mlp_size_2': 0, 'mlp_size_3': 0, 'kernel': 'LogLogistic', 'loss_name': 'AlternativeNLLLoss'}. Best is trial 26 with value: 0.8539967281394194.[0m
[32m[I 2022-04-25 12:48:42,496][0m Trial 46 finished with value: 0.8330665840718169 and parameters: {'n_hidden': 2048, 'mixture_components': 5, 'use_sparse_layer': False, 'use_batchnorm': False, 'use_dropout': False, 'mlp_size_1': 8, 'mlp_size_2': 0, 'mlp_size_3': 0, 'kernel': 'LogLogistic', 'loss_name': 'AlternativeNLLLoss'}. Best is trial 26 with value: 0.8539967281394194.[0m
[32m[I 2022-04-25 12:52:43,450][0m Trial 47 finished with value: 0.7596113785098948 and parameters: {'n_hidden': 2048, 'mixture_components': 4, 'use_sparse_layer': False, 'use_batchnorm': False, 'use_dropout': False, 'mlp_size_1': 7, 'mlp_size_2': 0, 'mlp_size_3': 1, 'kernel': 'LogLogistic', 'loss_name': 'NLLLoss'}. Best is trial 26 with value: 0.8539967281394194.[0m
[32m[I 2022-04-25 12:57:09,757][0m Trial 48 finished with value: 0.8396190430618977 and parameters: {'n_hidden': 2048, 'mixture_components': 6, 'use_sparse_layer': False, 'use_batchnorm': False, 'use_dropout': False, 'mlp_size_1': 8, 'mlp_size_2': 0, 'mlp_size_3': 0, 'kernel': 'LogLogistic', 'loss_name': 'AlternativeNLLLoss'}. Best is trial 26 with value: 0.8539967281394194.[0m
[32m[I 2022-04-25 13:01:32,621][0m Trial 49 finished with value: 0.8390598083125855 and parameters: {'n_hidden': 2048, 'mixture_components': 5, 'use_sparse_layer': False, 'use_batchnorm': False, 'use_dropout': False, 'mlp_size_1': 7, 'mlp_size_2': 0, 'mlp_size_3': 0, 'kernel': 'LogLogistic', 'loss_name': 'AlternativeNLLLoss'}. Best is trial 26 with value: 0.8539967281394194.[0m
[32m[I 2022-04-25 13:07:02,471][0m Trial 50 finished with value: 0.8521011070683299 and parameters: {'n_hidden': 2048, 'mixture_components': 4, 'use_sparse_layer': False, 'use_batchnorm': False, 'use_dropout': False, 'mlp_size_1': 8, 'mlp_size_2': 0, 'mlp_size_3': 0, 'kernel': 'LogLogistic', 'loss_name': 'AlternativeNLLLoss'}. Best is trial 26 with value: 0.8539967281394194.[0m
[32m[I 2022-04-25 13:11:39,377][0m Trial 51 finished with value: 0.7758449399416817 and parameters: {'n_hidden': 2048, 'mixture_components': 4, 'use_sparse_layer': False, 'use_batchnorm': False, 'use_dropout': False, 'mlp_size_1': 8, 'mlp_size_2': 0, 'mlp_size_3': 0, 'kernel': 'LogLogistic', 'loss_name': 'AlternativeNLLLoss'}. Best is trial 26 with value: 0.8539967281394194.[0m
[32m[I 2022-04-25 13:16:10,196][0m Trial 52 finished with value: 0.4791591925182993 and parameters: {'n_hidden': 2048, 'mixture_components': 5, 'use_sparse_layer': False, 'use_batchnorm': False, 'use_dropout': False, 'mlp_size_1': 8, 'mlp_size_2': 0, 'mlp_size_3': 0, 'kernel': 'LogLogistic', 'loss_name': 'AlternativeNLLLoss'}. Best is trial 26 with value: 0.8539967281394194.[0m
[32m[I 2022-04-25 13:20:32,943][0m Trial 53 finished with value: 0.8475935125032734 and parameters: {'n_hidden': 2048, 'mixture_components': 3, 'use_sparse_layer': False, 'use_batchnorm': False, 'use_dropout': False, 'mlp_size_1': 7, 'mlp_size_2': 0, 'mlp_size_3': 0, 'kernel': 'LogLogistic', 'loss_name': 'AlternativeNLLLoss'}. Best is trial 26 with value: 0.8539967281394194.[0m
[32m[I 2022-04-25 13:25:43,442][0m Trial 54 finished with value: 0.8385390512754523 and parameters: {'n_hidden': 32, 'mixture_components': 6, 'use_sparse_layer': False, 'use_batchnorm': False, 'use_dropout': False, 'mlp_size_1': 1, 'mlp_size_2': 0, 'mlp_size_3': 0, 'kernel': 'LogLogistic', 'loss_name': 'AlternativeNLLLoss'}. Best is trial 26 with value: 0.8539967281394194.[0m
[32m[I 2022-04-25 13:30:21,361][0m Trial 55 finished with value: 0.8302031674968312 and parameters: {'n_hidden': 1024, 'mixture_components': 4, 'use_sparse_layer': False, 'use_batchnorm': True, 'use_dropout': True, 'dropout': 0.5965482093157356, 'mlp_size_1': 7, 'mlp_size_2': 0, 'mlp_size_3': 0, 'kernel': 'LogLogistic', 'loss_name': 'AlternativeNLLLoss'}. Best is trial 26 with value: 0.8539967281394194.[0m
[32m[I 2022-04-25 13:34:19,353][0m Trial 56 finished with value: 0.7744692098087947 and parameters: {'n_hidden': 2048, 'mixture_components': 5, 'use_sparse_layer': True, 'use_sparse_loss': True, 'lmbd': 3.967974122788947e-06, 'use_batchnorm': False, 'use_dropout': False, 'mlp_size_1': 8, 'mlp_size_2': 0, 'mlp_size_3': 0, 'kernel': 'LogLogistic', 'loss_name': 'NLLLoss'}. Best is trial 26 with value: 0.8539967281394194.[0m
[32m[I 2022-04-25 13:36:50,484][0m Trial 57 finished with value: 0.8322902726584251 and parameters: {'n_hidden': 64, 'mixture_components': 3, 'use_sparse_layer': False, 'use_batchnorm': False, 'use_dropout': True, 'dropout': 0.353459414809954, 'mlp_size_1': 2, 'mlp_size_2': 0, 'mlp_size_3': 1, 'kernel': 'LogLogistic', 'loss_name': 'AlternativeNLLLoss'}. Best is trial 26 with value: 0.8539967281394194.[0m
[32m[I 2022-04-25 13:39:56,190][0m Trial 58 finished with value: -1.0 and parameters: {'n_hidden': 2048, 'mixture_components': 4, 'use_sparse_layer': True, 'use_sparse_loss': True, 'lmbd': 0.05348920248310349, 'use_batchnorm': True, 'use_dropout': True, 'dropout': 0.6946170719717297, 'mlp_size_1': 8, 'mlp_size_2': 0, 'mlp_size_3': 0, 'kernel': 'Exponential', 'loss_name': 'AlternativeNLLLoss'}. Best is trial 26 with value: 0.8539967281394194.[0m
[32m[I 2022-04-25 13:44:57,192][0m Trial 59 finished with value: 0.851469649880014 and parameters: {'n_hidden': 128, 'mixture_components': 6, 'use_sparse_layer': False, 'use_batchnorm': False, 'use_dropout': False, 'mlp_size_1': 4, 'mlp_size_2': 0, 'mlp_size_3': 0, 'kernel': 'LogLogistic', 'loss_name': 'AlternativeNLLLoss'}. Best is trial 26 with value: 0.8539967281394194.[0m
[32m[I 2022-04-25 13:49:14,807][0m Trial 60 finished with value: 0.8501424147674272 and parameters: {'n_hidden': 128, 'mixture_components': 8, 'use_sparse_layer': False, 'use_batchnorm': False, 'use_dropout': False, 'mlp_size_1': 4, 'mlp_size_2': 0, 'mlp_size_3': 0, 'kernel': 'LogLogistic', 'loss_name': 'AlternativeNLLLoss'}. Best is trial 26 with value: 0.8539967281394194.[0m
[32m[I 2022-04-25 13:53:31,800][0m Trial 61 finished with value: 0.8504395254812109 and parameters: {'n_hidden': 128, 'mixture_components': 10, 'use_sparse_layer': False, 'use_batchnorm': False, 'use_dropout': False, 'mlp_size_1': 4, 'mlp_size_2': 0, 'mlp_size_3': 0, 'kernel': 'LogLogistic', 'loss_name': 'AlternativeNLLLoss'}. Best is trial 26 with value: 0.8539967281394194.[0m
[32m[I 2022-04-25 13:57:03,832][0m Trial 62 finished with value: 0.8451262347213205 and parameters: {'n_hidden': 128, 'mixture_components': 10, 'use_sparse_layer': False, 'use_batchnorm': False, 'use_dropout': False, 'mlp_size_1': 4, 'mlp_size_2': 0, 'mlp_size_3': 0, 'kernel': 'LogLogistic', 'loss_name': 'AlternativeNLLLoss'}. Best is trial 26 with value: 0.8539967281394194.[0m
[32m[I 2022-04-25 14:00:54,266][0m Trial 63 finished with value: 0.8421627765957815 and parameters: {'n_hidden': 128, 'mixture_components': 8, 'use_sparse_layer': False, 'use_batchnorm': False, 'use_dropout': False, 'mlp_size_1': 4, 'mlp_size_2': 0, 'mlp_size_3': 0, 'kernel': 'LogLogistic', 'loss_name': 'AlternativeNLLLoss'}. Best is trial 26 with value: 0.8539967281394194.[0m
[32m[I 2022-04-25 14:06:09,561][0m Trial 64 finished with value: 0.8518168069967462 and parameters: {'n_hidden': 128, 'mixture_components': 9, 'use_sparse_layer': False, 'use_batchnorm': False, 'use_dropout': False, 'mlp_size_1': 4, 'mlp_size_2': 0, 'mlp_size_3': 0, 'kernel': 'LogLogistic', 'loss_name': 'AlternativeNLLLoss'}. Best is trial 26 with value: 0.8539967281394194.[0m
[32m[I 2022-04-25 14:10:17,742][0m Trial 65 finished with value: 0.8465634022247588 and parameters: {'n_hidden': 128, 'mixture_components': 9, 'use_sparse_layer': False, 'use_batchnorm': False, 'use_dropout': False, 'mlp_size_1': 4, 'mlp_size_2': 0, 'mlp_size_3': 0, 'kernel': 'LogLogistic', 'loss_name': 'AlternativeNLLLoss'}. Best is trial 26 with value: 0.8539967281394194.[0m
[32m[I 2022-04-25 14:13:43,456][0m Trial 66 finished with value: 0.8262186607612592 and parameters: {'n_hidden': 128, 'mixture_components': 10, 'use_sparse_layer': False, 'use_batchnorm': False, 'use_dropout': False, 'mlp_size_1': 4, 'mlp_size_2': 0, 'mlp_size_3': 0, 'kernel': 'LogLogistic', 'loss_name': 'CensoredNLLLoss'}. Best is trial 26 with value: 0.8539967281394194.[0m
[32m[I 2022-04-25 14:18:16,084][0m Trial 67 finished with value: 0.8480852609747036 and parameters: {'n_hidden': 128, 'mixture_components': 9, 'use_sparse_layer': False, 'use_batchnorm': False, 'use_dropout': False, 'mlp_size_1': 4, 'mlp_size_2': 0, 'mlp_size_3': 0, 'kernel': 'LogLogistic', 'loss_name': 'AlternativeNLLLoss'}. Best is trial 26 with value: 0.8539967281394194.[0m
[32m[I 2022-04-25 14:22:46,844][0m Trial 68 finished with value: 0.8433387609996741 and parameters: {'n_hidden': 128, 'mixture_components': 10, 'use_sparse_layer': False, 'use_batchnorm': False, 'use_dropout': False, 'mlp_size_1': 4, 'mlp_size_2': 0, 'mlp_size_3': 0, 'kernel': 'LogLogistic', 'loss_name': 'AlternativeNLLLoss'}. Best is trial 26 with value: 0.8539967281394194.[0m
[32m[I 2022-04-25 14:27:39,731][0m Trial 69 finished with value: 0.8510154586393378 and parameters: {'n_hidden': 128, 'mixture_components': 9, 'use_sparse_layer': False, 'use_batchnorm': False, 'use_dropout': False, 'mlp_size_1': 4, 'mlp_size_2': 0, 'mlp_size_3': 0, 'kernel': 'LogLogistic', 'loss_name': 'AlternativeNLLLoss'}. Best is trial 26 with value: 0.8539967281394194.[0m
[32m[I 2022-04-25 14:29:11,357][0m Trial 70 finished with value: -1.0 and parameters: {'n_hidden': 128, 'mixture_components': 7, 'use_sparse_layer': False, 'use_batchnorm': False, 'use_dropout': False, 'mlp_size_1': 4, 'mlp_size_2': 0, 'mlp_size_3': 0, 'kernel': 'Exponential', 'loss_name': 'AlternativeNLLLoss'}. Best is trial 26 with value: 0.8539967281394194.[0m
[32m[I 2022-04-25 14:33:12,754][0m Trial 71 finished with value: 0.8517801706804125 and parameters: {'n_hidden': 128, 'mixture_components': 9, 'use_sparse_layer': False, 'use_batchnorm': False, 'use_dropout': False, 'mlp_size_1': 4, 'mlp_size_2': 0, 'mlp_size_3': 0, 'kernel': 'LogLogistic', 'loss_name': 'AlternativeNLLLoss'}. Best is trial 26 with value: 0.8539967281394194.[0m
