[32m[I 2022-04-28 21:07:56,473][0m Trial 944 finished with value: 0.3746156733387484 and parameters: {'n_hidden': 2048, 'mixture_components': 10, 'use_sparse_layer': False, 'use_batchnorm': False, 'use_dropout': False, 'mlp_size_1': 7, 'mlp_size_2': 1, 'mlp_size_3': 0, 'kernel': 'Normal', 'loss_name': 'AlternativeNLLLoss'}. Best is trial 927 with value: 0.8554191678795904.[0m
[32m[I 2022-04-28 21:14:26,934][0m Trial 945 finished with value: 0.853937515054023 and parameters: {'n_hidden': 2048, 'mixture_components': 5, 'use_sparse_layer': False, 'use_batchnorm': False, 'use_dropout': False, 'mlp_size_1': 7, 'mlp_size_2': 1, 'mlp_size_3': 0, 'kernel': 'Normal', 'loss_name': 'AlternativeNLLLoss'}. Best is trial 927 with value: 0.8554191678795904.[0m
[32m[I 2022-04-28 21:24:57,147][0m Trial 946 finished with value: 0.8276391503728886 and parameters: {'n_hidden': 2048, 'mixture_components': 5, 'use_sparse_layer': False, 'use_batchnorm': True, 'use_dropout': False, 'mlp_size_1': 7, 'mlp_size_2': 1, 'mlp_size_3': 0, 'kernel': 'LogLogistic', 'loss_name': 'AlternativeNLLLoss'}. Best is trial 927 with value: 0.8554191678795904.[0m
[32m[I 2022-04-28 21:30:55,220][0m Trial 947 finished with value: 0.8535238604941944 and parameters: {'n_hidden': 2048, 'mixture_components': 5, 'use_sparse_layer': False, 'use_batchnorm': False, 'use_dropout': False, 'mlp_size_1': 7, 'mlp_size_2': 1, 'mlp_size_3': 0, 'kernel': 'Normal', 'loss_name': 'AlternativeNLLLoss'}. Best is trial 927 with value: 0.8554191678795904.[0m
[32m[I 2022-04-28 21:36:33,409][0m Trial 948 finished with value: 0.8501985662641548 and parameters: {'n_hidden': 64, 'mixture_components': 5, 'use_sparse_layer': False, 'use_batchnorm': False, 'use_dropout': False, 'mlp_size_1': 2, 'mlp_size_2': 1, 'mlp_size_3': 0, 'kernel': 'Normal', 'loss_name': 'AlternativeNLLLoss'}. Best is trial 927 with value: 0.8554191678795904.[0m
[32m[I 2022-04-28 21:42:25,655][0m Trial 949 finished with value: 0.8523610178027479 and parameters: {'n_hidden': 2048, 'mixture_components': 5, 'use_sparse_layer': False, 'use_batchnorm': False, 'use_dropout': False, 'mlp_size_1': 6, 'mlp_size_2': 1, 'mlp_size_3': 0, 'kernel': 'Normal', 'loss_name': 'AlternativeNLLLoss'}. Best is trial 927 with value: 0.8554191678795904.[0m
[32m[I 2022-04-28 21:47:23,952][0m Trial 950 finished with value: 0.8520057864088721 and parameters: {'n_hidden': 2048, 'mixture_components': 5, 'use_sparse_layer': False, 'use_batchnorm': False, 'use_dropout': False, 'mlp_size_1': 7, 'mlp_size_2': 1, 'mlp_size_3': 0, 'kernel': 'LogLogistic', 'loss_name': 'AlternativeNLLLoss'}. Best is trial 927 with value: 0.8554191678795904.[0m
[32m[I 2022-04-28 21:53:13,486][0m Trial 951 finished with value: 0.8526387204282037 and parameters: {'n_hidden': 2048, 'mixture_components': 7, 'use_sparse_layer': False, 'use_batchnorm': False, 'use_dropout': False, 'mlp_size_1': 7, 'mlp_size_2': 1, 'mlp_size_3': 0, 'kernel': 'Normal', 'loss_name': 'AlternativeNLLLoss'}. Best is trial 927 with value: 0.8554191678795904.[0m
[32m[I 2022-04-28 21:58:58,007][0m Trial 952 finished with value: 0.8538777412086255 and parameters: {'n_hidden': 2048, 'mixture_components': 5, 'use_sparse_layer': False, 'use_batchnorm': False, 'use_dropout': False, 'mlp_size_1': 7, 'mlp_size_2': 1, 'mlp_size_3': 0, 'kernel': 'Normal', 'loss_name': 'AlternativeNLLLoss'}. Best is trial 927 with value: 0.8554191678795904.[0m
[32m[I 2022-04-28 22:04:10,442][0m Trial 953 finished with value: 0.8524752375198339 and parameters: {'n_hidden': 256, 'mixture_components': 5, 'use_sparse_layer': False, 'use_batchnorm': False, 'use_dropout': False, 'mlp_size_1': 5, 'mlp_size_2': 0, 'mlp_size_3': 0, 'kernel': 'Normal', 'loss_name': 'AlternativeNLLLoss'}. Best is trial 927 with value: 0.8554191678795904.[0m
[32m[I 2022-04-28 22:07:59,065][0m Trial 954 finished with value: 0.7921578703679091 and parameters: {'n_hidden': 2048, 'mixture_components': 5, 'use_sparse_layer': False, 'use_batchnorm': False, 'use_dropout': True, 'dropout': 0.8504735123774988, 'mlp_size_1': 8, 'mlp_size_2': 0, 'mlp_size_3': 0, 'kernel': 'LogLogistic', 'loss_name': 'NLLLoss'}. Best is trial 927 with value: 0.8554191678795904.[0m
[32m[I 2022-04-28 22:14:38,024][0m Trial 955 finished with value: 0.8386071313734412 and parameters: {'n_hidden': 32, 'mixture_components': 3, 'use_sparse_layer': False, 'use_batchnorm': False, 'use_dropout': False, 'mlp_size_1': 0, 'mlp_size_2': 1, 'mlp_size_3': 1, 'kernel': 'Normal', 'loss_name': 'AlternativeNLLLoss'}. Best is trial 927 with value: 0.8554191678795904.[0m
[32m[I 2022-04-28 22:19:48,113][0m Trial 956 finished with value: 0.48333170048920654 and parameters: {'n_hidden': 2048, 'mixture_components': 8, 'use_sparse_layer': False, 'use_batchnorm': False, 'use_dropout': False, 'mlp_size_1': 7, 'mlp_size_2': 1, 'mlp_size_3': 0, 'kernel': 'Normal', 'loss_name': 'AlternativeNLLLoss'}. Best is trial 927 with value: 0.8554191678795904.[0m
[32m[I 2022-04-28 22:25:54,487][0m Trial 957 finished with value: 0.8541158051285173 and parameters: {'n_hidden': 2048, 'mixture_components': 5, 'use_sparse_layer': False, 'use_batchnorm': False, 'use_dropout': False, 'mlp_size_1': 7, 'mlp_size_2': 1, 'mlp_size_3': 0, 'kernel': 'Normal', 'loss_name': 'AlternativeNLLLoss'}. Best is trial 927 with value: 0.8554191678795904.[0m
[32m[I 2022-04-28 22:31:16,059][0m Trial 958 finished with value: 0.8387747412854841 and parameters: {'n_hidden': 2048, 'mixture_components': 5, 'use_sparse_layer': False, 'use_batchnorm': False, 'use_dropout': False, 'mlp_size_1': 7, 'mlp_size_2': 1, 'mlp_size_3': 0, 'kernel': 'Normal', 'loss_name': 'AlternativeNLLLoss'}. Best is trial 927 with value: 0.8554191678795904.[0m
[32m[I 2022-04-28 22:36:23,764][0m Trial 959 finished with value: 0.8452981649472242 and parameters: {'n_hidden': 2048, 'mixture_components': 6, 'use_sparse_layer': False, 'use_batchnorm': False, 'use_dropout': False, 'mlp_size_1': 7, 'mlp_size_2': 1, 'mlp_size_3': 0, 'kernel': 'LogLogistic', 'loss_name': 'AlternativeNLLLoss'}. Best is trial 927 with value: 0.8554191678795904.[0m
[32m[I 2022-04-28 22:42:06,286][0m Trial 960 finished with value: 0.8511141649262693 and parameters: {'n_hidden': 2048, 'mixture_components': 5, 'use_sparse_layer': False, 'use_batchnorm': False, 'use_dropout': False, 'mlp_size_1': 7, 'mlp_size_2': 1, 'mlp_size_3': 0, 'kernel': 'Logistic', 'loss_name': 'AlternativeNLLLoss'}. Best is trial 927 with value: 0.8554191678795904.[0m
[32m[I 2022-04-28 22:46:34,879][0m Trial 961 finished with value: 0.8481730553420919 and parameters: {'n_hidden': 128, 'mixture_components': 5, 'use_sparse_layer': False, 'use_batchnorm': False, 'use_dropout': False, 'mlp_size_1': 4, 'mlp_size_2': 0, 'mlp_size_3': 0, 'kernel': 'Normal', 'loss_name': 'AlternativeNLLLoss'}. Best is trial 927 with value: 0.8554191678795904.[0m
[32m[I 2022-04-28 22:52:19,390][0m Trial 962 finished with value: 0.8528752726118295 and parameters: {'n_hidden': 2048, 'mixture_components': 2, 'use_sparse_layer': False, 'use_batchnorm': False, 'use_dropout': False, 'mlp_size_1': 7, 'mlp_size_2': 1, 'mlp_size_3': 0, 'kernel': 'Normal', 'loss_name': 'AlternativeNLLLoss'}. Best is trial 927 with value: 0.8554191678795904.[0m
[32m[I 2022-04-28 22:58:17,527][0m Trial 963 finished with value: 0.8529013804265742 and parameters: {'n_hidden': 2048, 'mixture_components': 6, 'use_sparse_layer': False, 'use_batchnorm': False, 'use_dropout': False, 'mlp_size_1': 7, 'mlp_size_2': 1, 'mlp_size_3': 0, 'kernel': 'Normal', 'loss_name': 'AlternativeNLLLoss'}. Best is trial 927 with value: 0.8554191678795904.[0m
[32m[I 2022-04-28 23:02:33,792][0m Trial 964 finished with value: 0.7845997053350933 and parameters: {'n_hidden': 2048, 'mixture_components': 3, 'use_sparse_layer': False, 'use_batchnorm': False, 'use_dropout': False, 'mlp_size_1': 7, 'mlp_size_2': 1, 'mlp_size_3': 0, 'kernel': 'LogLogistic', 'loss_name': 'AlternativeNLLLoss'}. Best is trial 927 with value: 0.8554191678795904.[0m
[32m[I 2022-04-28 23:13:24,205][0m Trial 965 finished with value: 0.8427901193382935 and parameters: {'n_hidden': 2048, 'mixture_components': 5, 'use_sparse_layer': False, 'use_batchnorm': True, 'use_dropout': False, 'mlp_size_1': 7, 'mlp_size_2': 1, 'mlp_size_3': 0, 'kernel': 'Normal', 'loss_name': 'AlternativeNLLLoss'}. Best is trial 927 with value: 0.8554191678795904.[0m
[32m[I 2022-04-28 23:15:27,920][0m Trial 966 finished with value: -1.0 and parameters: {'n_hidden': 1024, 'mixture_components': 5, 'use_sparse_layer': False, 'use_batchnorm': False, 'use_dropout': False, 'mlp_size_1': 7, 'mlp_size_2': 0, 'mlp_size_3': 0, 'kernel': 'Exponential', 'loss_name': 'AlternativeNLLLoss'}. Best is trial 927 with value: 0.8554191678795904.[0m
[32m[I 2022-04-28 23:21:10,415][0m Trial 967 finished with value: 0.8551445639341451 and parameters: {'n_hidden': 2048, 'mixture_components': 5, 'use_sparse_layer': False, 'use_batchnorm': False, 'use_dropout': False, 'mlp_size_1': 6, 'mlp_size_2': 1, 'mlp_size_3': 1, 'kernel': 'Normal', 'loss_name': 'AlternativeNLLLoss'}. Best is trial 927 with value: 0.8554191678795904.[0m
[32m[I 2022-04-28 23:26:37,109][0m Trial 968 finished with value: 0.8526839764981261 and parameters: {'n_hidden': 2048, 'mixture_components': 5, 'use_sparse_layer': False, 'use_batchnorm': False, 'use_dropout': False, 'mlp_size_1': 6, 'mlp_size_2': 1, 'mlp_size_3': 0, 'kernel': 'Normal', 'loss_name': 'AlternativeNLLLoss'}. Best is trial 927 with value: 0.8554191678795904.[0m
[32m[I 2022-04-28 23:32:45,715][0m Trial 969 finished with value: 0.8541242704709535 and parameters: {'n_hidden': 2048, 'mixture_components': 5, 'use_sparse_layer': False, 'use_batchnorm': False, 'use_dropout': False, 'mlp_size_1': 6, 'mlp_size_2': 1, 'mlp_size_3': 1, 'kernel': 'Normal', 'loss_name': 'AlternativeNLLLoss'}. Best is trial 927 with value: 0.8554191678795904.[0m
[32m[I 2022-04-28 23:37:34,674][0m Trial 970 finished with value: 0.8354106304252374 and parameters: {'n_hidden': 2048, 'mixture_components': 5, 'use_sparse_layer': False, 'use_batchnorm': False, 'use_dropout': False, 'mlp_size_1': 8, 'mlp_size_2': 0, 'mlp_size_3': 0, 'kernel': 'LogLogistic', 'loss_name': 'AlternativeNLLLoss'}. Best is trial 927 with value: 0.8554191678795904.[0m
[32m[I 2022-04-28 23:43:20,492][0m Trial 971 finished with value: 0.8515659144575493 and parameters: {'n_hidden': 2048, 'mixture_components': 5, 'use_sparse_layer': False, 'use_batchnorm': False, 'use_dropout': False, 'mlp_size_1': 6, 'mlp_size_2': 1, 'mlp_size_3': 1, 'kernel': 'Normal', 'loss_name': 'AlternativeNLLLoss'}. Best is trial 927 with value: 0.8554191678795904.[0m
[32m[I 2022-04-28 23:48:16,679][0m Trial 972 finished with value: 0.8381578355268811 and parameters: {'n_hidden': 2048, 'mixture_components': 5, 'use_sparse_layer': False, 'use_batchnorm': False, 'use_dropout': False, 'mlp_size_1': 8, 'mlp_size_2': 0, 'mlp_size_3': 0, 'kernel': 'Normal', 'loss_name': 'AlternativeNLLLoss'}. Best is trial 927 with value: 0.8554191678795904.[0m
[32m[I 2022-04-28 23:51:52,510][0m Trial 973 finished with value: 0.811274805812508 and parameters: {'n_hidden': 2048, 'mixture_components': 5, 'use_sparse_layer': False, 'use_batchnorm': False, 'use_dropout': True, 'dropout': 0.6632967077867882, 'mlp_size_1': 6, 'mlp_size_2': 1, 'mlp_size_3': 1, 'kernel': 'Normal', 'loss_name': 'AlternativeNLLLoss'}. Best is trial 927 with value: 0.8554191678795904.[0m
[32m[I 2022-04-28 23:56:38,299][0m Trial 974 finished with value: 0.8522773373689907 and parameters: {'n_hidden': 2048, 'mixture_components': 5, 'use_sparse_layer': False, 'use_batchnorm': False, 'use_dropout': False, 'mlp_size_1': 6, 'mlp_size_2': 1, 'mlp_size_3': 1, 'kernel': 'LogLogistic', 'loss_name': 'AlternativeNLLLoss'}. Best is trial 927 with value: 0.8554191678795904.[0m
[32m[I 2022-04-29 00:01:57,528][0m Trial 975 finished with value: 0.7421392887675798 and parameters: {'n_hidden': 2048, 'mixture_components': 5, 'use_sparse_layer': False, 'use_batchnorm': False, 'use_dropout': False, 'mlp_size_1': 8, 'mlp_size_2': 0, 'mlp_size_3': 0, 'kernel': 'Normal', 'loss_name': 'AlternativeNLLLoss'}. Best is trial 927 with value: 0.8554191678795904.[0m
[32m[I 2022-04-29 00:08:07,840][0m Trial 976 finished with value: 0.8512473916719555 and parameters: {'n_hidden': 64, 'mixture_components': 5, 'use_sparse_layer': False, 'use_batchnorm': False, 'use_dropout': False, 'mlp_size_1': 3, 'mlp_size_2': 0, 'mlp_size_3': 0, 'kernel': 'Normal', 'loss_name': 'AlternativeNLLLoss'}. Best is trial 927 with value: 0.8554191678795904.[0m
[32m[I 2022-04-29 00:14:08,893][0m Trial 977 finished with value: 0.8537766787645781 and parameters: {'n_hidden': 2048, 'mixture_components': 5, 'use_sparse_layer': False, 'use_batchnorm': False, 'use_dropout': False, 'mlp_size_1': 7, 'mlp_size_2': 1, 'mlp_size_3': 0, 'kernel': 'Normal', 'loss_name': 'AlternativeNLLLoss'}. Best is trial 927 with value: 0.8554191678795904.[0m
[32m[I 2022-04-29 00:18:12,796][0m Trial 978 finished with value: 0.836972868739527 and parameters: {'n_hidden': 2048, 'mixture_components': 5, 'use_sparse_layer': False, 'use_batchnorm': False, 'use_dropout': False, 'mlp_size_1': 7, 'mlp_size_2': 1, 'mlp_size_3': 0, 'kernel': 'LogLogistic', 'loss_name': 'AlternativeNLLLoss'}. Best is trial 927 with value: 0.8554191678795904.[0m
[32m[I 2022-04-29 00:23:51,593][0m Trial 979 finished with value: 0.8516375633534983 and parameters: {'n_hidden': 2048, 'mixture_components': 5, 'use_sparse_layer': False, 'use_batchnorm': False, 'use_dropout': False, 'mlp_size_1': 6, 'mlp_size_2': 1, 'mlp_size_3': 1, 'kernel': 'Normal', 'loss_name': 'AlternativeNLLLoss'}. Best is trial 927 with value: 0.8554191678795904.[0m
[32m[I 2022-04-29 00:28:52,481][0m Trial 980 finished with value: 0.4848412007554961 and parameters: {'n_hidden': 2048, 'mixture_components': 5, 'use_sparse_layer': False, 'use_batchnorm': False, 'use_dropout': False, 'mlp_size_1': 7, 'mlp_size_2': 1, 'mlp_size_3': 0, 'kernel': 'Normal', 'loss_name': 'AlternativeNLLLoss'}. Best is trial 927 with value: 0.8554191678795904.[0m
[32m[I 2022-04-29 00:34:12,871][0m Trial 981 finished with value: 0.8538566951908042 and parameters: {'n_hidden': 2048, 'mixture_components': 3, 'use_sparse_layer': False, 'use_batchnorm': False, 'use_dropout': False, 'mlp_size_1': 7, 'mlp_size_2': 1, 'mlp_size_3': 0, 'kernel': 'Normal', 'loss_name': 'AlternativeNLLLoss'}. Best is trial 927 with value: 0.8554191678795904.[0m
[32m[I 2022-04-29 00:38:08,451][0m Trial 982 finished with value: 0.8252008071852664 and parameters: {'n_hidden': 256, 'mixture_components': 5, 'use_sparse_layer': False, 'use_batchnorm': False, 'use_dropout': False, 'mlp_size_1': 5, 'mlp_size_2': 0, 'mlp_size_3': 0, 'kernel': 'Normal', 'loss_name': 'AlternativeNLLLoss'}. Best is trial 927 with value: 0.8554191678795904.[0m
[32m[I 2022-04-29 00:43:22,537][0m Trial 983 finished with value: 0.8439608271091952 and parameters: {'n_hidden': 32, 'mixture_components': 5, 'use_sparse_layer': False, 'use_batchnorm': False, 'use_dropout': False, 'mlp_size_1': 2, 'mlp_size_2': 0, 'mlp_size_3': 0, 'kernel': 'LogLogistic', 'loss_name': 'AlternativeNLLLoss'}. Best is trial 927 with value: 0.8554191678795904.[0m
[32m[I 2022-04-29 00:53:32,212][0m Trial 984 finished with value: 0.830688668758157 and parameters: {'n_hidden': 2048, 'mixture_components': 5, 'use_sparse_layer': False, 'use_batchnorm': True, 'use_dropout': False, 'mlp_size_1': 8, 'mlp_size_2': 0, 'mlp_size_3': 0, 'kernel': 'Logistic', 'loss_name': 'AlternativeNLLLoss'}. Best is trial 927 with value: 0.8554191678795904.[0m
[32m[I 2022-04-29 00:58:59,193][0m Trial 985 finished with value: 0.8491783202114558 and parameters: {'n_hidden': 2048, 'mixture_components': 5, 'use_sparse_layer': False, 'use_batchnorm': False, 'use_dropout': False, 'mlp_size_1': 7, 'mlp_size_2': 1, 'mlp_size_3': 0, 'kernel': 'Normal', 'loss_name': 'AlternativeNLLLoss'}. Best is trial 927 with value: 0.8554191678795904.[0m
[32m[I 2022-04-29 01:04:42,246][0m Trial 986 finished with value: 0.8431081120881005 and parameters: {'n_hidden': 2048, 'mixture_components': 5, 'use_sparse_layer': False, 'use_batchnorm': False, 'use_dropout': False, 'mlp_size_1': 7, 'mlp_size_2': 1, 'mlp_size_3': 0, 'kernel': 'Normal', 'loss_name': 'AlternativeNLLLoss'}. Best is trial 927 with value: 0.8554191678795904.[0m
[32m[I 2022-04-29 01:10:23,963][0m Trial 987 finished with value: 0.8548962739195393 and parameters: {'n_hidden': 2048, 'mixture_components': 5, 'use_sparse_layer': False, 'use_batchnorm': False, 'use_dropout': False, 'mlp_size_1': 7, 'mlp_size_2': 1, 'mlp_size_3': 0, 'kernel': 'Normal', 'loss_name': 'AlternativeNLLLoss'}. Best is trial 927 with value: 0.8554191678795904.[0m
[32m[I 2022-04-29 01:15:56,264][0m Trial 988 finished with value: 0.8536809186508327 and parameters: {'n_hidden': 2048, 'mixture_components': 5, 'use_sparse_layer': False, 'use_batchnorm': False, 'use_dropout': False, 'mlp_size_1': 7, 'mlp_size_2': 1, 'mlp_size_3': 0, 'kernel': 'Normal', 'loss_name': 'AlternativeNLLLoss'}. Best is trial 927 with value: 0.8554191678795904.[0m
[32m[I 2022-04-29 01:18:47,196][0m Trial 989 finished with value: 0.8074235825750626 and parameters: {'n_hidden': 128, 'mixture_components': 5, 'use_sparse_layer': False, 'use_batchnorm': False, 'use_dropout': False, 'mlp_size_1': 4, 'mlp_size_2': 0, 'mlp_size_3': 0, 'kernel': 'Normal', 'loss_name': 'NLLLoss'}. Best is trial 927 with value: 0.8554191678795904.[0m
[32m[I 2022-04-29 01:24:15,606][0m Trial 990 finished with value: 0.8524343257804979 and parameters: {'n_hidden': 2048, 'mixture_components': 5, 'use_sparse_layer': False, 'use_batchnorm': False, 'use_dropout': False, 'mlp_size_1': 7, 'mlp_size_2': 1, 'mlp_size_3': 0, 'kernel': 'Normal', 'loss_name': 'AlternativeNLLLoss'}. Best is trial 927 with value: 0.8554191678795904.[0m
[32m[I 2022-04-29 01:29:29,582][0m Trial 991 finished with value: 0.48538695270929894 and parameters: {'n_hidden': 2048, 'mixture_components': 5, 'use_sparse_layer': False, 'use_batchnorm': False, 'use_dropout': False, 'mlp_size_1': 7, 'mlp_size_2': 1, 'mlp_size_3': 0, 'kernel': 'Normal', 'loss_name': 'AlternativeNLLLoss'}. Best is trial 927 with value: 0.8554191678795904.[0m
[32m[I 2022-04-29 01:32:45,263][0m Trial 992 finished with value: 0.41928336042579845 and parameters: {'n_hidden': 2048, 'mixture_components': 5, 'use_sparse_layer': False, 'use_batchnorm': False, 'use_dropout': True, 'dropout': 0.9438934662259071, 'mlp_size_1': 7, 'mlp_size_2': 1, 'mlp_size_3': 0, 'kernel': 'Normal', 'loss_name': 'AlternativeNLLLoss'}. Best is trial 927 with value: 0.8554191678795904.[0m
[32m[I 2022-04-29 01:38:56,070][0m Trial 993 finished with value: 0.728256593725028 and parameters: {'n_hidden': 2048, 'mixture_components': 5, 'use_sparse_layer': False, 'use_batchnorm': False, 'use_dropout': False, 'mlp_size_1': 7, 'mlp_size_2': 1, 'mlp_size_3': 0, 'kernel': 'Normal', 'loss_name': 'AlternativeNLLLoss'}. Best is trial 927 with value: 0.8554191678795904.[0m
[32m[I 2022-04-29 01:44:10,254][0m Trial 994 finished with value: 0.8438051582336878 and parameters: {'n_hidden': 1024, 'mixture_components': 5, 'use_sparse_layer': False, 'use_batchnorm': False, 'use_dropout': False, 'mlp_size_1': 7, 'mlp_size_2': 0, 'mlp_size_3': 0, 'kernel': 'Normal', 'loss_name': 'AlternativeNLLLoss'}. Best is trial 927 with value: 0.8554191678795904.[0m
[32m[I 2022-04-29 01:49:30,313][0m Trial 995 finished with value: 0.4829152354901729 and parameters: {'n_hidden': 2048, 'mixture_components': 5, 'use_sparse_layer': False, 'use_batchnorm': False, 'use_dropout': False, 'mlp_size_1': 7, 'mlp_size_2': 1, 'mlp_size_3': 0, 'kernel': 'Normal', 'loss_name': 'AlternativeNLLLoss'}. Best is trial 927 with value: 0.8554191678795904.[0m
[32m[I 2022-04-29 01:54:54,959][0m Trial 996 finished with value: 0.838721119226034 and parameters: {'n_hidden': 2048, 'mixture_components': 5, 'use_sparse_layer': False, 'use_batchnorm': False, 'use_dropout': False, 'mlp_size_1': 8, 'mlp_size_2': 0, 'mlp_size_3': 0, 'kernel': 'Normal', 'loss_name': 'AlternativeNLLLoss'}. Best is trial 927 with value: 0.8554191678795904.[0m
[32m[I 2022-04-29 02:00:48,095][0m Trial 997 finished with value: 0.8538126733064859 and parameters: {'n_hidden': 2048, 'mixture_components': 5, 'use_sparse_layer': False, 'use_batchnorm': False, 'use_dropout': False, 'mlp_size_1': 7, 'mlp_size_2': 1, 'mlp_size_3': 0, 'kernel': 'Normal', 'loss_name': 'AlternativeNLLLoss'}. Best is trial 927 with value: 0.8554191678795904.[0m
[32m[I 2022-04-29 02:06:35,650][0m Trial 998 finished with value: 0.8531233583372849 and parameters: {'n_hidden': 2048, 'mixture_components': 5, 'use_sparse_layer': False, 'use_batchnorm': False, 'use_dropout': False, 'mlp_size_1': 7, 'mlp_size_2': 1, 'mlp_size_3': 0, 'kernel': 'Normal', 'loss_name': 'AlternativeNLLLoss'}. Best is trial 927 with value: 0.8554191678795904.[0m
