[32m[I 2022-05-11 08:06:54,752][0m Trial 287 finished with value: 0.7480152293811242 and parameters: {'loss': 'coxph', 'learning_rate': 1.4069836706656176e-05, 'n_estimators': 897, 'criterion': 'absolute_error', 'min_samples_split': 7, 'min_samples_leaf': 2, 'min_weight_fraction_leaf': 0.17436636084323523, 'min_impurity_decrease': 0.0019037714748159594, 'max_features': 0.8994417392521057, 'subsample': 0.2412513357915883, 'dropout_rate': 0.79093003635251, 'ccp_alpha': 0.17254734490663237}. Best is trial 285 with value: 0.8408994882022112.[0m
[32m[I 2022-05-11 08:51:15,288][0m Trial 288 finished with value: 0.7644205853613165 and parameters: {'loss': 'coxph', 'learning_rate': 1.5611710770368492e-05, 'n_estimators': 915, 'criterion': 'absolute_error', 'min_samples_split': 7, 'min_samples_leaf': 2, 'min_weight_fraction_leaf': 0.1777601692623103, 'min_impurity_decrease': 0.01719280918971387, 'max_features': 0.9311431962700063, 'subsample': 0.2708693214638659, 'dropout_rate': 0.7593072448942197, 'ccp_alpha': 0.14462672065006094}. Best is trial 285 with value: 0.8408994882022112.[0m
[32m[I 2022-05-11 09:30:30,642][0m Trial 289 finished with value: 0.7651267843433869 and parameters: {'loss': 'coxph', 'learning_rate': 2.3599565047847503e-05, 'n_estimators': 843, 'criterion': 'absolute_error', 'min_samples_split': 7, 'min_samples_leaf': 2, 'min_weight_fraction_leaf': 0.19229591156802617, 'min_impurity_decrease': 0.04769380421810408, 'max_features': 0.8878372042338049, 'subsample': 0.23513106187746574, 'dropout_rate': 0.8133381608897042, 'ccp_alpha': 0.16500907761814193}. Best is trial 285 with value: 0.8408994882022112.[0m
[32m[I 2022-05-11 10:15:45,522][0m Trial 290 finished with value: 0.819914184944748 and parameters: {'loss': 'coxph', 'learning_rate': 1.8320162327073628e-05, 'n_estimators': 917, 'criterion': 'absolute_error', 'min_samples_split': 7, 'min_samples_leaf': 2, 'min_weight_fraction_leaf': 0.18063067725386128, 'min_impurity_decrease': 0.019750408887783486, 'max_features': 0.9270212549875354, 'subsample': 0.34193286100231124, 'dropout_rate': 0.7989003254552232, 'ccp_alpha': 0.011525708595877465}. Best is trial 285 with value: 0.8408994882022112.[0m
[32m[I 2022-05-11 10:58:08,651][0m Trial 291 finished with value: 0.8199419820298752 and parameters: {'loss': 'coxph', 'learning_rate': 1.947736105881039e-05, 'n_estimators': 889, 'criterion': 'absolute_error', 'min_samples_split': 7, 'min_samples_leaf': 2, 'min_weight_fraction_leaf': 0.19171737018845803, 'min_impurity_decrease': 0.018930016835072727, 'max_features': 0.8551374807416214, 'subsample': 0.1748375945788772, 'dropout_rate': 0.7996740243821544, 'ccp_alpha': 0.003994398582742902}. Best is trial 285 with value: 0.8408994882022112.[0m
[32m[I 2022-05-11 11:38:34,828][0m Trial 292 finished with value: 0.8203123366982753 and parameters: {'loss': 'coxph', 'learning_rate': 1.858582460685963e-05, 'n_estimators': 847, 'criterion': 'absolute_error', 'min_samples_split': 7, 'min_samples_leaf': 2, 'min_weight_fraction_leaf': 0.17875079620252673, 'min_impurity_decrease': 0.02452015088826226, 'max_features': 0.8620487973345008, 'subsample': 0.17725962244228247, 'dropout_rate': 0.7979397193265496, 'ccp_alpha': 0.00462408878293432}. Best is trial 285 with value: 0.8408994882022112.[0m
[32m[I 2022-05-11 12:20:32,311][0m Trial 293 finished with value: 0.5 and parameters: {'loss': 'coxph', 'learning_rate': 1.9776888388308357e-05, 'n_estimators': 895, 'criterion': 'absolute_error', 'min_samples_split': 7, 'min_samples_leaf': 2, 'min_weight_fraction_leaf': 0.18125769556820576, 'min_impurity_decrease': 0.021459897441635727, 'max_features': 0.8569158156566657, 'subsample': 0.16600191958730218, 'dropout_rate': 0.8276294294831077, 'ccp_alpha': 4.232112616063899}. Best is trial 285 with value: 0.8408994882022112.[0m
/media/san2_ssd/data/Workdir/survival/venv/lib/python3.8/site-packages/sksurv/ensemble/boosting.py:955: RuntimeWarning: divide by zero encountered in log
  time = numpy.log(time)
/media/san2_ssd/data/Workdir/survival/venv/lib/python3.8/site-packages/sksurv/ensemble/boosting.py:955: RuntimeWarning: divide by zero encountered in log
  time = numpy.log(time)
/media/san2_ssd/data/Workdir/survival/venv/lib/python3.8/site-packages/sksurv/ensemble/boosting.py:955: RuntimeWarning: divide by zero encountered in log
  time = numpy.log(time)
/media/san2_ssd/data/Workdir/survival/venv/lib/python3.8/site-packages/sksurv/ensemble/boosting.py:955: RuntimeWarning: divide by zero encountered in log
  time = numpy.log(time)
/media/san2_ssd/data/Workdir/survival/venv/lib/python3.8/site-packages/sksurv/ensemble/boosting.py:955: RuntimeWarning: divide by zero encountered in log
  time = numpy.log(time)
[32m[I 2022-05-11 12:20:32,366][0m Trial 294 finished with value: -1.0 and parameters: {'loss': 'squared', 'learning_rate': 2.651103055143649e-05, 'n_estimators': 841, 'criterion': 'absolute_error', 'min_samples_split': 7, 'min_samples_leaf': 2, 'min_weight_fraction_leaf': 0.19173576786504523, 'min_impurity_decrease': 0.01600145023124589, 'max_features': 0.8563553672451611, 'subsample': 0.3400868473510654, 'dropout_rate': 0.7983854328970218, 'ccp_alpha': 0.23681699306623344}. Best is trial 285 with value: 0.8408994882022112.[0m
[32m[I 2022-05-11 13:04:00,069][0m Trial 295 finished with value: 0.7655020206264588 and parameters: {'loss': 'coxph', 'learning_rate': 1.8012347044877336e-05, 'n_estimators': 903, 'criterion': 'absolute_error', 'min_samples_split': 7, 'min_samples_leaf': 2, 'min_weight_fraction_leaf': 0.17421350892299903, 'min_impurity_decrease': 0.001798149293471954, 'max_features': 0.9177029095544263, 'subsample': 0.22635504584446026, 'dropout_rate': 0.7587566622920797, 'ccp_alpha': 0.14342027569148794}. Best is trial 285 with value: 0.8408994882022112.[0m
[32m[I 2022-05-11 13:47:54,087][0m Trial 296 finished with value: 0.8170220534360577 and parameters: {'loss': 'coxph', 'learning_rate': 2.1830577160290886e-05, 'n_estimators': 919, 'criterion': 'absolute_error', 'min_samples_split': 7, 'min_samples_leaf': 2, 'min_weight_fraction_leaf': 0.1916589957199985, 'min_impurity_decrease': 0.04283931366436577, 'max_features': 0.8861454672514915, 'subsample': 0.3034687675333527, 'dropout_rate': 0.8057618399374094, 'ccp_alpha': 0.001345739606776599}. Best is trial 285 with value: 0.8408994882022112.[0m
[32m[I 2022-05-11 14:28:09,082][0m Trial 297 finished with value: 0.7663549336060287 and parameters: {'loss': 'coxph', 'learning_rate': 2.3028514034748314e-05, 'n_estimators': 859, 'criterion': 'absolute_error', 'min_samples_split': 7, 'min_samples_leaf': 2, 'min_weight_fraction_leaf': 0.1920348439231, 'min_impurity_decrease': 0.04333634582390164, 'max_features': 0.881982849988164, 'subsample': 0.19923721614282847, 'dropout_rate': 0.8034494487151368, 'ccp_alpha': 0.1527982883975691}. Best is trial 285 with value: 0.8408994882022112.[0m
[32m[I 2022-05-11 15:12:10,371][0m Trial 298 finished with value: 0.7394657492836626 and parameters: {'loss': 'coxph', 'learning_rate': 3.823018703553307e-05, 'n_estimators': 923, 'criterion': 'absolute_error', 'min_samples_split': 6, 'min_samples_leaf': 2, 'min_weight_fraction_leaf': 0.1714895830227319, 'min_impurity_decrease': 0.021167282099758294, 'max_features': 0.8887110639350784, 'subsample': 0.30775905643834955, 'dropout_rate': 0.8301048760911768, 'ccp_alpha': 0.24733689747272208}. Best is trial 285 with value: 0.8408994882022112.[0m
[32m[I 2022-05-11 15:53:20,123][0m Trial 299 finished with value: 0.8169423503999569 and parameters: {'loss': 'coxph', 'learning_rate': 1.8255815640544465e-05, 'n_estimators': 844, 'criterion': 'absolute_error', 'min_samples_split': 7, 'min_samples_leaf': 2, 'min_weight_fraction_leaf': 0.1837452296327131, 'min_impurity_decrease': 0.04663135705519448, 'max_features': 0.9099691098372268, 'subsample': 0.11829040560315808, 'dropout_rate': 0.8069423482994292, 'ccp_alpha': 0.004478760910031268}. Best is trial 285 with value: 0.8408994882022112.[0m
[32m[I 2022-05-11 16:16:59,405][0m Trial 300 finished with value: 0.7651233303841398 and parameters: {'loss': 'coxph', 'learning_rate': 2.4167109544729506e-05, 'n_estimators': 517, 'criterion': 'absolute_error', 'min_samples_split': 7, 'min_samples_leaf': 2, 'min_weight_fraction_leaf': 0.19231095482145277, 'min_impurity_decrease': 0.020085426475169844, 'max_features': 0.8558974315076762, 'subsample': 0.18088958187087795, 'dropout_rate': 0.8434485987538557, 'ccp_alpha': 0.12820054168981876}. Best is trial 285 with value: 0.8408994882022112.[0m
[32m[I 2022-05-11 16:59:19,244][0m Trial 301 finished with value: 0.5 and parameters: {'loss': 'coxph', 'learning_rate': 2.8894668272874177e-05, 'n_estimators': 887, 'criterion': 'absolute_error', 'min_samples_split': 7, 'min_samples_leaf': 2, 'min_weight_fraction_leaf': 0.1806413855587091, 'min_impurity_decrease': 0.0027556772330517105, 'max_features': 0.9318552191823141, 'subsample': 0.28290201317153957, 'dropout_rate': 0.7794297571805783, 'ccp_alpha': 2.150521120476193}. Best is trial 285 with value: 0.8408994882022112.[0m
[32m[I 2022-05-11 17:42:20,627][0m Trial 302 finished with value: 0.5 and parameters: {'loss': 'coxph', 'learning_rate': 1.4120567866226942e-05, 'n_estimators': 926, 'criterion': 'absolute_error', 'min_samples_split': 7, 'min_samples_leaf': 2, 'min_weight_fraction_leaf': 0.19342959713675825, 'min_impurity_decrease': 0.03933338427952533, 'max_features': 0.8792413826898335, 'subsample': 0.200841909744427, 'dropout_rate': 0.8247309009636546, 'ccp_alpha': 1.7608170028945778}. Best is trial 285 with value: 0.8408994882022112.[0m
[32m[I 2022-05-11 18:20:52,826][0m Trial 303 finished with value: 0.7642560708572822 and parameters: {'loss': 'coxph', 'learning_rate': 1.6307896165573334e-05, 'n_estimators': 816, 'criterion': 'absolute_error', 'min_samples_split': 7, 'min_samples_leaf': 2, 'min_weight_fraction_leaf': 0.18011470202508068, 'min_impurity_decrease': 0.09922190746200624, 'max_features': 0.9131037382393108, 'subsample': 0.3144785215748185, 'dropout_rate': 0.7763009181666344, 'ccp_alpha': 0.12868980156575385}. Best is trial 285 with value: 0.8408994882022112.[0m
[32m[I 2022-05-11 19:02:34,593][0m Trial 304 finished with value: 0.7401789215644428 and parameters: {'loss': 'coxph', 'learning_rate': 1.9700282422170853e-05, 'n_estimators': 886, 'criterion': 'absolute_error', 'min_samples_split': 7, 'min_samples_leaf': 2, 'min_weight_fraction_leaf': 0.17038087031672672, 'min_impurity_decrease': 0.05397302149029462, 'max_features': 0.9278097444737214, 'subsample': 0.24324496748355057, 'dropout_rate': 0.8074965934576852, 'ccp_alpha': 0.2462430945322901}. Best is trial 285 with value: 0.8408994882022112.[0m
[32m[I 2022-05-11 19:48:16,196][0m Trial 305 finished with value: 0.7626110807900136 and parameters: {'loss': 'coxph', 'learning_rate': 1.4075585381877706e-05, 'n_estimators': 935, 'criterion': 'absolute_error', 'min_samples_split': 6, 'min_samples_leaf': 2, 'min_weight_fraction_leaf': 0.19431112224196542, 'min_impurity_decrease': 0.022900555800078534, 'max_features': 0.8907892709282819, 'subsample': 0.37322892898726373, 'dropout_rate': 0.8420548481122446, 'ccp_alpha': 0.1365473858791594}. Best is trial 285 with value: 0.8408994882022112.[0m
[32m[I 2022-05-11 20:28:10,452][0m Trial 306 finished with value: 0.8025164999714575 and parameters: {'loss': 'coxph', 'learning_rate': 2.147961264124536e-05, 'n_estimators': 841, 'criterion': 'absolute_error', 'min_samples_split': 7, 'min_samples_leaf': 3, 'min_weight_fraction_leaf': 0.21831086198299135, 'min_impurity_decrease': 0.02613986416563699, 'max_features': 0.9314241714901251, 'subsample': 0.26689351612907586, 'dropout_rate': 0.756326711125946, 'ccp_alpha': 0.0028373234999286073}. Best is trial 285 with value: 0.8408994882022112.[0m
[32m[I 2022-05-11 21:12:31,956][0m Trial 307 finished with value: 0.7642555419696183 and parameters: {'loss': 'coxph', 'learning_rate': 1.772237727094693e-05, 'n_estimators': 927, 'criterion': 'absolute_error', 'min_samples_split': 7, 'min_samples_leaf': 2, 'min_weight_fraction_leaf': 0.18294151302830508, 'min_impurity_decrease': 0.04065987650268553, 'max_features': 0.9118880573041861, 'subsample': 0.32705113542383896, 'dropout_rate': 0.8500360299552164, 'ccp_alpha': 0.12005969128282043}. Best is trial 285 with value: 0.8408994882022112.[0m
[32m[I 2022-05-11 21:56:35,300][0m Trial 308 finished with value: 0.5 and parameters: {'loss': 'coxph', 'learning_rate': 3.4379352032955626e-05, 'n_estimators': 880, 'criterion': 'absolute_error', 'min_samples_split': 7, 'min_samples_leaf': 2, 'min_weight_fraction_leaf': 0.1682750058583988, 'min_impurity_decrease': 0.0018107040601386716, 'max_features': 0.8710716120017475, 'subsample': 0.37936990495945444, 'dropout_rate': 0.791690776934769, 'ccp_alpha': 0.25302470442816827}. Best is trial 285 with value: 0.8408994882022112.[0m
[32m[I 2022-05-11 22:40:43,299][0m Trial 309 finished with value: 0.798457272751479 and parameters: {'loss': 'coxph', 'learning_rate': 1.3967458966525064e-05, 'n_estimators': 934, 'criterion': 'absolute_error', 'min_samples_split': 7, 'min_samples_leaf': 2, 'min_weight_fraction_leaf': 0.19177206408485045, 'min_impurity_decrease': 0.10485819915721548, 'max_features': 0.8968561941509544, 'subsample': 0.15713624966703943, 'dropout_rate': 0.8272523830298039, 'ccp_alpha': 0.006944163174399585}. Best is trial 285 with value: 0.8408994882022112.[0m
[32m[I 2022-05-11 23:22:56,586][0m Trial 310 finished with value: 0.8115488329089139 and parameters: {'loss': 'coxph', 'learning_rate': 2.572987891993016e-05, 'n_estimators': 886, 'criterion': 'absolute_error', 'min_samples_split': 7, 'min_samples_leaf': 2, 'min_weight_fraction_leaf': 0.149350927028089, 'min_impurity_decrease': 0.05275064802484938, 'max_features': 0.9324334184623447, 'subsample': 0.29258705248676053, 'dropout_rate': 0.8843158124756572, 'ccp_alpha': 0.0014978613675183331}. Best is trial 285 with value: 0.8408994882022112.[0m
[32m[I 2022-05-12 00:02:30,324][0m Trial 311 finished with value: 0.7635814696088488 and parameters: {'loss': 'coxph', 'learning_rate': 1.3153419341194806e-05, 'n_estimators': 811, 'criterion': 'absolute_error', 'min_samples_split': 7, 'min_samples_leaf': 2, 'min_weight_fraction_leaf': 0.17615833361220423, 'min_impurity_decrease': 0.018977537397475517, 'max_features': 0.9075642931283543, 'subsample': 0.3387172347200171, 'dropout_rate': 0.8113440169373897, 'ccp_alpha': 0.10843055337607742}. Best is trial 285 with value: 0.8408994882022112.[0m
[32m[I 2022-05-12 00:48:58,515][0m Trial 312 finished with value: 0.7630253142040082 and parameters: {'loss': 'coxph', 'learning_rate': 1.7426832003692608e-05, 'n_estimators': 939, 'criterion': 'absolute_error', 'min_samples_split': 7, 'min_samples_leaf': 2, 'min_weight_fraction_leaf': 0.22797415535023824, 'min_impurity_decrease': 0.054058380848794337, 'max_features': 0.935367342330709, 'subsample': 0.3577416575505843, 'dropout_rate': 0.6971178164035017, 'ccp_alpha': 0.1372526756951604}. Best is trial 285 with value: 0.8408994882022112.[0m
[32m[I 2022-05-12 01:30:20,205][0m Trial 313 finished with value: 0.7391975032646316 and parameters: {'loss': 'coxph', 'learning_rate': 2.0174051741154293e-05, 'n_estimators': 847, 'criterion': 'absolute_error', 'min_samples_split': 7, 'min_samples_leaf': 2, 'min_weight_fraction_leaf': 0.1941287773137002, 'min_impurity_decrease': 0.03190409404100587, 'max_features': 0.8856472010501187, 'subsample': 0.3858133329357864, 'dropout_rate': 0.8437257013340587, 'ccp_alpha': 0.21644920658222364}. Best is trial 285 with value: 0.8408994882022112.[0m
/media/san2_ssd/data/Workdir/survival/venv/lib/python3.8/site-packages/sksurv/ensemble/boosting.py:955: RuntimeWarning: divide by zero encountered in log
  time = numpy.log(time)
/media/san2_ssd/data/Workdir/survival/venv/lib/python3.8/site-packages/sksurv/ensemble/boosting.py:955: RuntimeWarning: divide by zero encountered in log
  time = numpy.log(time)
/media/san2_ssd/data/Workdir/survival/venv/lib/python3.8/site-packages/sksurv/ensemble/boosting.py:955: RuntimeWarning: divide by zero encountered in log
  time = numpy.log(time)
/media/san2_ssd/data/Workdir/survival/venv/lib/python3.8/site-packages/sksurv/ensemble/boosting.py:955: RuntimeWarning: divide by zero encountered in log
  time = numpy.log(time)
/media/san2_ssd/data/Workdir/survival/venv/lib/python3.8/site-packages/sksurv/ensemble/boosting.py:955: RuntimeWarning: divide by zero encountered in log
  time = numpy.log(time)
[32m[I 2022-05-12 01:30:20,263][0m Trial 314 finished with value: -1.0 and parameters: {'loss': 'squared', 'learning_rate': 1.3672057926907222e-05, 'n_estimators': 891, 'criterion': 'absolute_error', 'min_samples_split': 7, 'min_samples_leaf': 2, 'min_weight_fraction_leaf': 0.18371900707705754, 'min_impurity_decrease': 0.0033151340601022313, 'max_features': 0.8517475594355239, 'subsample': 0.2738493566566595, 'dropout_rate': 0.7796042355360616, 'ccp_alpha': 0.002767432088895537}. Best is trial 285 with value: 0.8408994882022112.[0m
[32m[I 2022-05-12 02:13:35,224][0m Trial 315 finished with value: 0.7655235515374972 and parameters: {'loss': 'coxph', 'learning_rate': 2.8613713643860425e-05, 'n_estimators': 941, 'criterion': 'absolute_error', 'min_samples_split': 6, 'min_samples_leaf': 2, 'min_weight_fraction_leaf': 0.21503029547347866, 'min_impurity_decrease': 0.0408165482273105, 'max_features': 0.918836366582674, 'subsample': 0.22803360197869363, 'dropout_rate': 0.8609007929211779, 'ccp_alpha': 0.12317265380736686}. Best is trial 285 with value: 0.8408994882022112.[0m
[32m[I 2022-05-12 02:55:58,792][0m Trial 316 finished with value: 0.7712146259402315 and parameters: {'loss': 'coxph', 'learning_rate': 1.668811356198904e-05, 'n_estimators': 907, 'criterion': 'absolute_error', 'min_samples_split': 7, 'min_samples_leaf': 3, 'min_weight_fraction_leaf': 0.16416933729449648, 'min_impurity_decrease': 0.10415122790426076, 'max_features': 0.9335096317257071, 'subsample': 0.30321525115191744, 'dropout_rate': 0.880649364589308, 'ccp_alpha': 0.003343398072876755}. Best is trial 285 with value: 0.8408994882022112.[0m
[32m[I 2022-05-12 03:14:04,537][0m Trial 317 finished with value: 0.5 and parameters: {'loss': 'coxph', 'learning_rate': 2.1538668783893773e-05, 'n_estimators': 388, 'criterion': 'absolute_error', 'min_samples_split': 7, 'min_samples_leaf': 2, 'min_weight_fraction_leaf': 0.18525070172932853, 'min_impurity_decrease': 0.017757153108441347, 'max_features': 0.8960655149731326, 'subsample': 0.3419105884600043, 'dropout_rate': 0.8278077401042061, 'ccp_alpha': 2.0068337100005094}. Best is trial 285 with value: 0.8408994882022112.[0m
[32m[I 2022-05-12 03:54:12,353][0m Trial 318 finished with value: 0.7664050478793831 and parameters: {'loss': 'coxph', 'learning_rate': 1.2025708731363947e-05, 'n_estimators': 846, 'criterion': 'absolute_error', 'min_samples_split': 7, 'min_samples_leaf': 2, 'min_weight_fraction_leaf': 0.1738788387472713, 'min_impurity_decrease': 0.05496598868318148, 'max_features': 0.9114145339415795, 'subsample': 0.18766311776283218, 'dropout_rate': 0.7992251619153083, 'ccp_alpha': 0.1109284826328514}. Best is trial 285 with value: 0.8408994882022112.[0m
[32m[I 2022-05-12 04:40:07,035][0m Trial 319 finished with value: 0.5931531718985059 and parameters: {'loss': 'coxph', 'learning_rate': 1.6284680949768454e-05, 'n_estimators': 941, 'criterion': 'absolute_error', 'min_samples_split': 7, 'min_samples_leaf': 2, 'min_weight_fraction_leaf': 0.19670839181431576, 'min_impurity_decrease': 0.029727368145998533, 'max_features': 0.9406387128296275, 'subsample': 0.3687028352763131, 'dropout_rate': 0.8517569382802628, 'ccp_alpha': 0.2499258474169951}. Best is trial 285 with value: 0.8408994882022112.[0m
[32m[I 2022-05-12 05:11:59,495][0m Trial 320 finished with value: 0.7628637730879696 and parameters: {'loss': 'coxph', 'learning_rate': 1.2776844662952011e-05, 'n_estimators': 875, 'criterion': 'squared_error', 'min_samples_split': 7, 'min_samples_leaf': 2, 'min_weight_fraction_leaf': 0.18625356277478744, 'min_impurity_decrease': 0.0017840281618901263, 'max_features': 0.8736946059344489, 'subsample': 0.3870114112631861, 'dropout_rate': 0.8231512472018307, 'ccp_alpha': 0.11017086282010587}. Best is trial 285 with value: 0.8408994882022112.[0m
[32m[I 2022-05-12 05:48:47,110][0m Trial 321 finished with value: 0.8144999312849526 and parameters: {'loss': 'coxph', 'learning_rate': 2.5627647778269783e-05, 'n_estimators': 811, 'criterion': 'absolute_error', 'min_samples_split': 7, 'min_samples_leaf': 2, 'min_weight_fraction_leaf': 0.2151708223326051, 'min_impurity_decrease': 0.05860790118853069, 'max_features': 0.9213174707194736, 'subsample': 0.2507071759845809, 'dropout_rate': 0.880795438990251, 'ccp_alpha': 0.0034819574417529753}. Best is trial 285 with value: 0.8408994882022112.[0m
[32m[I 2022-05-12 06:34:46,506][0m Trial 322 finished with value: 0.7404768621191613 and parameters: {'loss': 'coxph', 'learning_rate': 1.6552164698326832e-05, 'n_estimators': 941, 'criterion': 'absolute_error', 'min_samples_split': 6, 'min_samples_leaf': 3, 'min_weight_fraction_leaf': 0.15984111104445037, 'min_impurity_decrease': 0.034471626201392845, 'max_features': 0.9021806406003969, 'subsample': 0.31531670796990935, 'dropout_rate': 0.7679094394705012, 'ccp_alpha': 0.23242378225076368}. Best is trial 285 with value: 0.8408994882022112.[0m
