[32m[I 2022-04-21 17:50:41,677][0m Trial 621 finished with value: 0.5 and parameters: {'splitter': 'random', 'min_samples_split': 0.2508149253303385, 'min_samples_leaf': 0.06488564161279001, 'min_weight_fraction_leaf': 0.4995048789434865, 'max_features': 0.8839498246775677}. Best is trial 441 with value: 0.8118070902918568.[0m
[32m[I 2022-04-21 17:50:42,240][0m Trial 622 finished with value: 0.8013149256955499 and parameters: {'splitter': 'random', 'min_samples_split': 0.26140779315712337, 'min_samples_leaf': 0.06467440491707946, 'min_weight_fraction_leaf': 0.058406473413954565, 'max_features': 0.9524328251490437}. Best is trial 441 with value: 0.8118070902918568.[0m
[32m[I 2022-04-21 17:50:43,171][0m Trial 623 finished with value: 0.7753061015962935 and parameters: {'splitter': 'random', 'min_samples_split': 0.248671028023014, 'min_samples_leaf': 0.1160086820066278, 'min_weight_fraction_leaf': 0.04179259726202027, 'max_features': 0.8644316873080237}. Best is trial 441 with value: 0.8118070902918568.[0m
[32m[I 2022-04-21 17:50:44,044][0m Trial 624 finished with value: 0.8092642586581607 and parameters: {'splitter': 'random', 'min_samples_split': 0.304000335721207, 'min_samples_leaf': 0.08216081364397271, 'min_weight_fraction_leaf': 0.06877655009751871, 'max_features': 0.9288747089651973}. Best is trial 441 with value: 0.8118070902918568.[0m
[32m[I 2022-04-21 17:50:44,471][0m Trial 625 finished with value: 0.7719074084544244 and parameters: {'splitter': 'random', 'min_samples_split': 0.2605254226541951, 'min_samples_leaf': 0.09913754731816987, 'min_weight_fraction_leaf': 0.056047245158487295, 'max_features': 0.9622139500609582}. Best is trial 441 with value: 0.8118070902918568.[0m
[32m[I 2022-04-21 17:50:44,986][0m Trial 626 finished with value: 0.7651648883729563 and parameters: {'splitter': 'random', 'min_samples_split': 0.22933925437876884, 'min_samples_leaf': 0.07956351700632708, 'min_weight_fraction_leaf': 0.09067985004676224, 'max_features': 0.936570893109394}. Best is trial 441 with value: 0.8118070902918568.[0m
[32m[I 2022-04-21 17:50:45,518][0m Trial 627 finished with value: 0.810455310005268 and parameters: {'splitter': 'random', 'min_samples_split': 0.28284304769655083, 'min_samples_leaf': 0.05188785652529992, 'min_weight_fraction_leaf': 0.08081608087061584, 'max_features': 0.9236641722120317}. Best is trial 441 with value: 0.8118070902918568.[0m
[32m[I 2022-04-21 17:50:46,063][0m Trial 628 finished with value: 0.8009445588935037 and parameters: {'splitter': 'random', 'min_samples_split': 0.2645359391465244, 'min_samples_leaf': 0.09129704093295646, 'min_weight_fraction_leaf': 0.04548826008966877, 'max_features': 0.8982265360918891}. Best is trial 441 with value: 0.8118070902918568.[0m
[32m[I 2022-04-21 17:50:46,889][0m Trial 629 finished with value: 0.795073011130887 and parameters: {'splitter': 'random', 'min_samples_split': 0.23687921371006526, 'min_samples_leaf': 0.10784670419681974, 'min_weight_fraction_leaf': 0.03573916712866282, 'max_features': 0.9068545616338685}. Best is trial 441 with value: 0.8118070902918568.[0m
[32m[I 2022-04-21 17:50:47,623][0m Trial 630 finished with value: 0.7762683710639544 and parameters: {'splitter': 'random', 'min_samples_split': 0.24346626842276836, 'min_samples_leaf': 0.08975392472358915, 'min_weight_fraction_leaf': 0.03678711727036589, 'max_features': 0.8823364293393781}. Best is trial 441 with value: 0.8118070902918568.[0m
[32m[I 2022-04-21 17:50:48,380][0m Trial 631 finished with value: 0.7645740679077611 and parameters: {'splitter': 'random', 'min_samples_split': 0.2884897701579672, 'min_samples_leaf': 0.10142457334399681, 'min_weight_fraction_leaf': 0.11175149666054077, 'max_features': 0.9093455261416625}. Best is trial 441 with value: 0.8118070902918568.[0m
[32m[I 2022-04-21 17:50:48,711][0m Trial 632 finished with value: 0.6347683570359614 and parameters: {'splitter': 'random', 'min_samples_split': 0.2550085373654806, 'min_samples_leaf': 0.08249785302274595, 'min_weight_fraction_leaf': 0.04988233288103187, 'max_features': 0.34030575075260683}. Best is trial 441 with value: 0.8118070902918568.[0m
[32m[I 2022-04-21 17:50:49,316][0m Trial 633 finished with value: 0.810455310005268 and parameters: {'splitter': 'random', 'min_samples_split': 0.27618890798559065, 'min_samples_leaf': 0.07445446075569122, 'min_weight_fraction_leaf': 0.06390361521990329, 'max_features': 0.921612558243361}. Best is trial 441 with value: 0.8118070902918568.[0m
[32m[I 2022-04-21 17:50:49,962][0m Trial 634 finished with value: 0.7983676136505885 and parameters: {'splitter': 'random', 'min_samples_split': 0.2706118361991935, 'min_samples_leaf': 0.09166564051746161, 'min_weight_fraction_leaf': 0.036589437532899734, 'max_features': 0.8893559434532051}. Best is trial 441 with value: 0.8118070902918568.[0m
[32m[I 2022-04-21 17:50:50,721][0m Trial 635 finished with value: 0.7606017517027581 and parameters: {'splitter': 'random', 'min_samples_split': 0.2969141044372053, 'min_samples_leaf': 0.05307299484210425, 'min_weight_fraction_leaf': 0.1618314725614715, 'max_features': 0.9144343695458003}. Best is trial 441 with value: 0.8118070902918568.[0m
[32m[I 2022-04-21 17:50:51,401][0m Trial 636 finished with value: 0.810455310005268 and parameters: {'splitter': 'random', 'min_samples_split': 0.2643902529483446, 'min_samples_leaf': 0.07626291879801739, 'min_weight_fraction_leaf': 0.06809907824828781, 'max_features': 0.9150378729958483}. Best is trial 441 with value: 0.8118070902918568.[0m
[32m[I 2022-04-21 17:50:51,820][0m Trial 637 finished with value: 0.7974219172465695 and parameters: {'splitter': 'random', 'min_samples_split': 0.2523278411847759, 'min_samples_leaf': 0.11097696276551862, 'min_weight_fraction_leaf': 0.04459194129807067, 'max_features': 0.8865518810561166}. Best is trial 441 with value: 0.8118070902918568.[0m
[32m[I 2022-04-21 17:50:52,272][0m Trial 638 finished with value: 0.7645669710097607 and parameters: {'splitter': 'random', 'min_samples_split': 0.2671764132655181, 'min_samples_leaf': 0.08941961477119571, 'min_weight_fraction_leaf': 0.06230321471056632, 'max_features': 0.9457686755057764}. Best is trial 441 with value: 0.8118070902918568.[0m
[32m[I 2022-04-21 17:50:52,849][0m Trial 639 finished with value: 0.7719372154426677 and parameters: {'splitter': 'random', 'min_samples_split': 0.25986401481427185, 'min_samples_leaf': 0.10116433452230053, 'min_weight_fraction_leaf': 0.05108480429927065, 'max_features': 0.970107469243813}. Best is trial 441 with value: 0.8118070902918568.[0m
[32m[I 2022-04-21 17:50:53,491][0m Trial 640 finished with value: 0.7857016468841971 and parameters: {'splitter': 'random', 'min_samples_split': 0.2939912997329995, 'min_samples_leaf': 0.08675060624437753, 'min_weight_fraction_leaf': 0.03220817396608222, 'max_features': 0.8560365991672807}. Best is trial 441 with value: 0.8118070902918568.[0m
[32m[I 2022-04-21 17:50:53,894][0m Trial 641 finished with value: 0.7658405528004703 and parameters: {'splitter': 'random', 'min_samples_split': 0.2765565382188396, 'min_samples_leaf': 0.11939631500567145, 'min_weight_fraction_leaf': 0.05434983486148279, 'max_features': 0.9084055761871498}. Best is trial 441 with value: 0.8118070902918568.[0m
[32m[I 2022-04-21 17:50:54,328][0m Trial 642 finished with value: 0.775684232099894 and parameters: {'splitter': 'random', 'min_samples_split': 0.267632829347876, 'min_samples_leaf': 0.08180126111045301, 'min_weight_fraction_leaf': 0.0322699338306956, 'max_features': 0.8694384109410837}. Best is trial 441 with value: 0.8118070902918568.[0m
[32m[I 2022-04-21 17:50:55,420][0m Trial 643 finished with value: 0.761721948889693 and parameters: {'splitter': 'random', 'min_samples_split': 0.24856703229524144, 'min_samples_leaf': 0.09618137257779359, 'min_weight_fraction_leaf': 0.04684258519667167, 'max_features': 0.9471948107496064}. Best is trial 441 with value: 0.8118070902918568.[0m
[32m[I 2022-04-21 17:50:56,219][0m Trial 644 finished with value: 0.8032272519689826 and parameters: {'splitter': 'random', 'min_samples_split': 0.28421659864628757, 'min_samples_leaf': 0.07282768053785905, 'min_weight_fraction_leaf': 0.07609894456840607, 'max_features': 0.9819748319240614}. Best is trial 441 with value: 0.8118070902918568.[0m
[32m[I 2022-04-21 17:50:56,948][0m Trial 645 finished with value: 0.7645669710097607 and parameters: {'splitter': 'random', 'min_samples_split': 0.302547188706365, 'min_samples_leaf': 0.06036698879663642, 'min_weight_fraction_leaf': 0.08997667147302632, 'max_features': 0.9363807230287086}. Best is trial 441 with value: 0.8118070902918568.[0m
[32m[I 2022-04-21 17:50:57,451][0m Trial 646 finished with value: 0.8123191241087102 and parameters: {'splitter': 'random', 'min_samples_split': 0.21620049228835883, 'min_samples_leaf': 0.06721026951288829, 'min_weight_fraction_leaf': 0.07296359541157985, 'max_features': 0.9295317274685986}. Best is trial 646 with value: 0.8123191241087102.[0m
[32m[I 2022-04-21 17:50:57,917][0m Trial 647 finished with value: 0.7755601220641086 and parameters: {'splitter': 'random', 'min_samples_split': 0.2183741917301817, 'min_samples_leaf': 0.07582198424305683, 'min_weight_fraction_leaf': 0.056617833500472774, 'max_features': 0.9587459869595436}. Best is trial 646 with value: 0.8123191241087102.[0m
[32m[I 2022-04-21 17:50:58,331][0m Trial 648 finished with value: 0.7950481493355436 and parameters: {'splitter': 'random', 'min_samples_split': 0.22016953591255264, 'min_samples_leaf': 0.11119962622663151, 'min_weight_fraction_leaf': 0.0726877126717235, 'max_features': 0.8944323677426237}. Best is trial 646 with value: 0.8123191241087102.[0m
[32m[I 2022-04-21 17:50:58,759][0m Trial 649 finished with value: 0.7648505649133345 and parameters: {'splitter': 'random', 'min_samples_split': 0.2285621358451958, 'min_samples_leaf': 0.09489867394049997, 'min_weight_fraction_leaf': 0.04522262168008774, 'max_features': 0.9384676703489961}. Best is trial 646 with value: 0.8123191241087102.[0m
[32m[I 2022-04-21 17:50:59,085][0m Trial 650 finished with value: 0.7595444725272662 and parameters: {'splitter': 'random', 'min_samples_split': 0.23811087021813032, 'min_samples_leaf': 0.19357038295852308, 'min_weight_fraction_leaf': 0.05761871666970613, 'max_features': 0.9589594692792494}. Best is trial 646 with value: 0.8123191241087102.[0m
[32m[I 2022-04-21 17:50:59,709][0m Trial 651 finished with value: 0.8118348628302042 and parameters: {'splitter': 'random', 'min_samples_split': 0.1952083905566578, 'min_samples_leaf': 0.08604727860285168, 'min_weight_fraction_leaf': 0.040200963273251164, 'max_features': 0.9145877722828971}. Best is trial 646 with value: 0.8123191241087102.[0m
[32m[I 2022-04-21 17:51:00,450][0m Trial 652 finished with value: 0.797004317397622 and parameters: {'splitter': 'random', 'min_samples_split': 0.24042159624022433, 'min_samples_leaf': 0.08778607112903292, 'min_weight_fraction_leaf': 0.032281269129494375, 'max_features': 0.8975181366563493}. Best is trial 646 with value: 0.8123191241087102.[0m
[32m[I 2022-04-21 17:51:01,067][0m Trial 653 finished with value: 0.7658556353315025 and parameters: {'splitter': 'random', 'min_samples_split': 0.1959176413990238, 'min_samples_leaf': 0.12482753745619526, 'min_weight_fraction_leaf': 0.04899536784692465, 'max_features': 0.9302043711288178}. Best is trial 646 with value: 0.8123191241087102.[0m
[32m[I 2022-04-21 17:51:01,503][0m Trial 654 finished with value: 0.6851609036733942 and parameters: {'splitter': 'random', 'min_samples_split': 0.2541673109982137, 'min_samples_leaf': 0.26484211795394996, 'min_weight_fraction_leaf': 0.45671990457120876, 'max_features': 0.8781071238431359}. Best is trial 646 with value: 0.8123191241087102.[0m
[32m[I 2022-04-21 17:51:02,475][0m Trial 655 finished with value: 0.7827838325788022 and parameters: {'splitter': 'random', 'min_samples_split': 0.1944378547194559, 'min_samples_leaf': 0.05275116434547377, 'min_weight_fraction_leaf': 0.10309677200440778, 'max_features': 0.9288590419638276}. Best is trial 646 with value: 0.8123191241087102.[0m
[32m[I 2022-04-21 17:51:03,221][0m Trial 656 finished with value: 0.778044445459057 and parameters: {'splitter': 'random', 'min_samples_split': 0.2069211488795964, 'min_samples_leaf': 0.07038107309518479, 'min_weight_fraction_leaf': 0.06897084308718524, 'max_features': 0.9757092394242943}. Best is trial 646 with value: 0.8123191241087102.[0m
[32m[I 2022-04-21 17:51:03,695][0m Trial 657 finished with value: 0.7604146064075576 and parameters: {'splitter': 'random', 'min_samples_split': 0.155002516752568, 'min_samples_leaf': 0.10302744134714242, 'min_weight_fraction_leaf': 0.05557438061417928, 'max_features': 0.9485918071812516}. Best is trial 646 with value: 0.8123191241087102.[0m
[32m[I 2022-04-21 17:51:04,043][0m Trial 658 finished with value: 0.7300752222156879 and parameters: {'splitter': 'random', 'min_samples_split': 0.18737037857376104, 'min_samples_leaf': 0.0966888517478561, 'min_weight_fraction_leaf': 0.03236303116607806, 'max_features': 0.2861265252408182}. Best is trial 646 with value: 0.8123191241087102.[0m
[32m[I 2022-04-21 17:51:04,353][0m Trial 659 finished with value: 0.5517679298481906 and parameters: {'splitter': 'random', 'min_samples_split': 0.20557653963196978, 'min_samples_leaf': 0.07578971686573728, 'min_weight_fraction_leaf': 0.06309968814446318, 'max_features': 0.15940562481779363}. Best is trial 646 with value: 0.8123191241087102.[0m
[32m[I 2022-04-21 17:51:04,888][0m Trial 660 finished with value: 0.812979986296886 and parameters: {'splitter': 'random', 'min_samples_split': 0.22650471181828488, 'min_samples_leaf': 0.06831755687690105, 'min_weight_fraction_leaf': 0.06495741658958049, 'max_features': 0.9283964680727208}. Best is trial 660 with value: 0.812979986296886.[0m
[32m[I 2022-04-21 17:51:05,334][0m Trial 661 finished with value: 0.797004317397622 and parameters: {'splitter': 'random', 'min_samples_split': 0.21791243088577916, 'min_samples_leaf': 0.08627541129215474, 'min_weight_fraction_leaf': 0.04458388570669923, 'max_features': 0.9020531246318961}. Best is trial 660 with value: 0.812979986296886.[0m
[32m[I 2022-04-21 17:51:05,733][0m Trial 662 finished with value: 0.7758676430167728 and parameters: {'splitter': 'random', 'min_samples_split': 0.21516579050003365, 'min_samples_leaf': 0.10777383680498281, 'min_weight_fraction_leaf': 0.03933431918976365, 'max_features': 0.8812996811809969}. Best is trial 660 with value: 0.812979986296886.[0m
[32m[I 2022-04-21 17:51:06,187][0m Trial 663 finished with value: 0.8114885156191761 and parameters: {'splitter': 'random', 'min_samples_split': 0.20377271368292202, 'min_samples_leaf': 0.08916914654593301, 'min_weight_fraction_leaf': 0.05670430552022438, 'max_features': 0.9151159888186454}. Best is trial 660 with value: 0.812979986296886.[0m
[32m[I 2022-04-21 17:51:06,689][0m Trial 664 finished with value: 0.7919721644069176 and parameters: {'splitter': 'random', 'min_samples_split': 0.19427972756958864, 'min_samples_leaf': 0.0634244280817729, 'min_weight_fraction_leaf': 0.07480495568973354, 'max_features': 0.9572281809608001}. Best is trial 660 with value: 0.812979986296886.[0m
[32m[I 2022-04-21 17:51:06,964][0m Trial 665 finished with value: 0.6851609036733942 and parameters: {'splitter': 'random', 'min_samples_split': 0.20313868831756432, 'min_samples_leaf': 0.4146670792789942, 'min_weight_fraction_leaf': 0.05188672207197266, 'max_features': 0.9115004263229272}. Best is trial 660 with value: 0.812979986296886.[0m
[32m[I 2022-04-21 17:51:07,545][0m Trial 666 finished with value: 0.8004146498568669 and parameters: {'splitter': 'random', 'min_samples_split': 0.16469149559743804, 'min_samples_leaf': 0.06851210050893564, 'min_weight_fraction_leaf': 0.0791097714754635, 'max_features': 0.9388727282634511}. Best is trial 660 with value: 0.812979986296886.[0m
[32m[I 2022-04-21 17:51:07,943][0m Trial 667 finished with value: 0.6851609036733942 and parameters: {'splitter': 'random', 'min_samples_split': 0.20705034370543338, 'min_samples_leaf': 0.09939427172809634, 'min_weight_fraction_leaf': 0.34480963134512804, 'max_features': 0.8991034770707684}. Best is trial 660 with value: 0.812979986296886.[0m
[32m[I 2022-04-21 17:51:08,410][0m Trial 668 finished with value: 0.7902550972893546 and parameters: {'splitter': 'random', 'min_samples_split': 0.21137439083249132, 'min_samples_leaf': 0.08319065311087041, 'min_weight_fraction_leaf': 0.055711246181488996, 'max_features': 0.9401194180835737}. Best is trial 660 with value: 0.812979986296886.[0m
[32m[I 2022-04-21 17:51:08,905][0m Trial 669 finished with value: 0.7714704644521999 and parameters: {'splitter': 'random', 'min_samples_split': 0.1762867183228053, 'min_samples_leaf': 0.11632112104008646, 'min_weight_fraction_leaf': 0.06426398372691694, 'max_features': 0.9649967455304479}. Best is trial 660 with value: 0.812979986296886.[0m
[32m[I 2022-04-21 17:51:09,387][0m Trial 670 finished with value: 0.7594491636389396 and parameters: {'splitter': 'random', 'min_samples_split': 0.22390189906964414, 'min_samples_leaf': 0.050364889338279505, 'min_weight_fraction_leaf': 0.2046356493305247, 'max_features': 0.9202358281199206}. Best is trial 660 with value: 0.812979986296886.[0m
[32m[I 2022-04-21 17:51:10,357][0m Trial 671 finished with value: 0.8109156144305031 and parameters: {'splitter': 'random', 'min_samples_split': 0.2121596174981758, 'min_samples_leaf': 0.09042743977614431, 'min_weight_fraction_leaf': 0.0660835230934847, 'max_features': 0.917958264299038}. Best is trial 660 with value: 0.812979986296886.[0m
[32m[I 2022-04-21 17:51:11,128][0m Trial 672 finished with value: 0.8026252493996646 and parameters: {'splitter': 'random', 'min_samples_split': 0.19659858442430247, 'min_samples_leaf': 0.09713788585663073, 'min_weight_fraction_leaf': 0.058505861714031424, 'max_features': 0.9156993295075074}. Best is trial 660 with value: 0.812979986296886.[0m
[32m[I 2022-04-21 17:51:11,537][0m Trial 673 finished with value: 0.7758676430167728 and parameters: {'splitter': 'random', 'min_samples_split': 0.1870071251136438, 'min_samples_leaf': 0.10809130716166004, 'min_weight_fraction_leaf': 0.04710069160888029, 'max_features': 0.863115525811597}. Best is trial 660 with value: 0.812979986296886.[0m
[32m[I 2022-04-21 17:51:12,005][0m Trial 674 finished with value: 0.7969658937357031 and parameters: {'splitter': 'random', 'min_samples_split': 0.21115763917537808, 'min_samples_leaf': 0.0731652687373655, 'min_weight_fraction_leaf': 0.08013635822661783, 'max_features': 0.8953138711442917}. Best is trial 660 with value: 0.812979986296886.[0m
[32m[I 2022-04-21 17:51:12,423][0m Trial 675 finished with value: 0.7646111151693326 and parameters: {'splitter': 'random', 'min_samples_split': 0.2013510848254645, 'min_samples_leaf': 0.09134298575254969, 'min_weight_fraction_leaf': 0.06804337878318502, 'max_features': 0.6887804128946344}. Best is trial 660 with value: 0.812979986296886.[0m
[32m[I 2022-04-21 17:51:12,981][0m Trial 676 finished with value: 0.6851609036733942 and parameters: {'splitter': 'random', 'min_samples_split': 0.21603080796614738, 'min_samples_leaf': 0.10569279289956066, 'min_weight_fraction_leaf': 0.29069010953927643, 'max_features': 0.8779763119771202}. Best is trial 660 with value: 0.812979986296886.[0m
[32m[I 2022-04-21 17:51:13,615][0m Trial 677 finished with value: 0.7572439607101853 and parameters: {'splitter': 'random', 'min_samples_split': 0.2043694166195424, 'min_samples_leaf': 0.1279918279723382, 'min_weight_fraction_leaf': 0.03931303227332091, 'max_features': 0.838228878934622}. Best is trial 660 with value: 0.812979986296886.[0m
[32m[I 2022-04-21 17:51:14,206][0m Trial 678 finished with value: 0.7989883908314254 and parameters: {'splitter': 'random', 'min_samples_split': 0.1873374932284761, 'min_samples_leaf': 0.13490660382939193, 'min_weight_fraction_leaf': 0.05926044482850448, 'max_features': 0.8953098528318103}. Best is trial 660 with value: 0.812979986296886.[0m
[32m[I 2022-04-21 17:51:15,017][0m Trial 679 finished with value: 0.8109241414219486 and parameters: {'splitter': 'random', 'min_samples_split': 0.17978987956956133, 'min_samples_leaf': 0.07812060369326757, 'min_weight_fraction_leaf': 0.07259492694680417, 'max_features': 0.9808319017653246}. Best is trial 660 with value: 0.812979986296886.[0m
[32m[I 2022-04-21 17:51:15,693][0m Trial 680 finished with value: 0.8076867374825181 and parameters: {'splitter': 'random', 'min_samples_split': 0.17333912181575634, 'min_samples_leaf': 0.09409271318588487, 'min_weight_fraction_leaf': 0.07231876061002435, 'max_features': 0.9912319014842684}. Best is trial 660 with value: 0.812979986296886.[0m
[32m[I 2022-04-21 17:51:16,483][0m Trial 681 finished with value: 0.8099374079354827 and parameters: {'splitter': 'random', 'min_samples_split': 0.17834086638588995, 'min_samples_leaf': 0.08668194132200058, 'min_weight_fraction_leaf': 0.06005228418284532, 'max_features': 0.9813717573935364}. Best is trial 660 with value: 0.812979986296886.[0m
[32m[I 2022-04-21 17:51:17,162][0m Trial 682 finished with value: 0.8033124487774332 and parameters: {'splitter': 'random', 'min_samples_split': 0.17130987149695995, 'min_samples_leaf': 0.11342425882130258, 'min_weight_fraction_leaf': 0.053989953012366136, 'max_features': 0.987404862837565}. Best is trial 660 with value: 0.812979986296886.[0m
[32m[I 2022-04-21 17:51:18,036][0m Trial 683 finished with value: 0.7755939744759767 and parameters: {'splitter': 'random', 'min_samples_split': 0.22448906883005623, 'min_samples_leaf': 0.05330960886689623, 'min_weight_fraction_leaf': 0.06919419503153616, 'max_features': 0.9719315178135483}. Best is trial 660 with value: 0.812979986296886.[0m
