[32m[I 2022-05-18 15:27:57,680][0m Trial 730 finished with value: 0.5 and parameters: {'loss': 'coxph', 'learning_rate': 0.024163430675692592, 'n_estimators': 520, 'criterion': 'squared_error', 'min_samples_split': 3, 'min_samples_leaf': 5, 'min_weight_fraction_leaf': 0.05049432443657959, 'min_impurity_decrease': 0.6267929822273189, 'max_features': 0.550172458199427, 'subsample': 0.12739972644458214, 'dropout_rate': 0.015333897796458605, 'ccp_alpha': 0.17061885056200726}. Best is trial 729 with value: 0.8593892830611674.[0m
/media/san2_ssd/data/Workdir/survival/venv/lib/python3.8/site-packages/sksurv/ensemble/boosting.py:955: RuntimeWarning: divide by zero encountered in log
  time = numpy.log(time)
/media/san2_ssd/data/Workdir/survival/venv/lib/python3.8/site-packages/sksurv/ensemble/boosting.py:955: RuntimeWarning: divide by zero encountered in log
  time = numpy.log(time)
/media/san2_ssd/data/Workdir/survival/venv/lib/python3.8/site-packages/sksurv/ensemble/boosting.py:955: RuntimeWarning: divide by zero encountered in log
  time = numpy.log(time)
/media/san2_ssd/data/Workdir/survival/venv/lib/python3.8/site-packages/sksurv/ensemble/boosting.py:955: RuntimeWarning: divide by zero encountered in log
  time = numpy.log(time)
/media/san2_ssd/data/Workdir/survival/venv/lib/python3.8/site-packages/sksurv/ensemble/boosting.py:955: RuntimeWarning: divide by zero encountered in log
  time = numpy.log(time)
[32m[I 2022-05-18 15:27:57,754][0m Trial 731 finished with value: -1.0 and parameters: {'loss': 'squared', 'learning_rate': 0.02940012679792715, 'n_estimators': 555, 'criterion': 'friedman_mse', 'min_samples_split': 3, 'min_samples_leaf': 5, 'min_weight_fraction_leaf': 0.036462311297114, 'min_impurity_decrease': 0.5781602711905629, 'max_features': 0.510612139584179, 'subsample': 0.11380842297429876, 'dropout_rate': 0.0010054143684238752, 'ccp_alpha': 0.2599482199445095}. Best is trial 729 with value: 0.8593892830611674.[0m
[32m[I 2022-05-18 15:54:19,464][0m Trial 732 finished with value: 0.8003767683862252 and parameters: {'loss': 'coxph', 'learning_rate': 0.021454103954789094, 'n_estimators': 541, 'criterion': 'friedman_mse', 'min_samples_split': 3, 'min_samples_leaf': 5, 'min_weight_fraction_leaf': 0.060069451630838266, 'min_impurity_decrease': 0.630029613758884, 'max_features': 0.5704464208663996, 'subsample': 0.13886982538760953, 'dropout_rate': 0.0009055327965373991, 'ccp_alpha': 0.09238480819669873}. Best is trial 729 with value: 0.8593892830611674.[0m
[32m[I 2022-05-18 16:21:00,464][0m Trial 733 finished with value: 0.7935311769471849 and parameters: {'loss': 'coxph', 'learning_rate': 0.028921691122055927, 'n_estimators': 549, 'criterion': 'friedman_mse', 'min_samples_split': 3, 'min_samples_leaf': 5, 'min_weight_fraction_leaf': 0.04577427680280386, 'min_impurity_decrease': 0.5970673931142129, 'max_features': 0.5822738793288679, 'subsample': 0.1392202019484354, 'dropout_rate': 0.04526778731815201, 'ccp_alpha': 0.088493457481228}. Best is trial 729 with value: 0.8593892830611674.[0m
[32m[I 2022-05-18 16:49:20,142][0m Trial 734 finished with value: 0.8558251608425194 and parameters: {'loss': 'coxph', 'learning_rate': 0.020804563106375837, 'n_estimators': 551, 'criterion': 'friedman_mse', 'min_samples_split': 3, 'min_samples_leaf': 4, 'min_weight_fraction_leaf': 0.06360745012320664, 'min_impurity_decrease': 0.6169998920914246, 'max_features': 0.6041019002541438, 'subsample': 0.11350681752746582, 'dropout_rate': 0.02453791457481895, 'ccp_alpha': 0.0044698881436089615}. Best is trial 729 with value: 0.8593892830611674.[0m
[32m[I 2022-05-18 17:16:05,482][0m Trial 735 finished with value: 0.7625920931388284 and parameters: {'loss': 'coxph', 'learning_rate': 0.019066468872550098, 'n_estimators': 541, 'criterion': 'friedman_mse', 'min_samples_split': 3, 'min_samples_leaf': 4, 'min_weight_fraction_leaf': 0.05694090017830702, 'min_impurity_decrease': 0.6457429904774826, 'max_features': 0.5957786765946983, 'subsample': 0.11720555970208356, 'dropout_rate': 0.02999877816035068, 'ccp_alpha': 0.15498418949790901}. Best is trial 729 with value: 0.8593892830611674.[0m
[32m[I 2022-05-18 17:44:27,894][0m Trial 736 finished with value: 0.8549616184602746 and parameters: {'loss': 'coxph', 'learning_rate': 0.02599175067275351, 'n_estimators': 555, 'criterion': 'friedman_mse', 'min_samples_split': 3, 'min_samples_leaf': 4, 'min_weight_fraction_leaf': 0.06374559295859875, 'min_impurity_decrease': 0.6103860804985288, 'max_features': 0.617472529157373, 'subsample': 0.12269410594557041, 'dropout_rate': 0.0535073312752235, 'ccp_alpha': 0.0014529786029851806}. Best is trial 729 with value: 0.8593892830611674.[0m
[32m[I 2022-05-18 18:12:07,624][0m Trial 737 finished with value: 0.741474124646949 and parameters: {'loss': 'coxph', 'learning_rate': 0.0330143972562095, 'n_estimators': 560, 'criterion': 'friedman_mse', 'min_samples_split': 2, 'min_samples_leaf': 4, 'min_weight_fraction_leaf': 0.03154949459896387, 'min_impurity_decrease': 0.6111117677214909, 'max_features': 0.5495465762695227, 'subsample': 0.10839388041666559, 'dropout_rate': 0.06007667994929318, 'ccp_alpha': 0.2943348895625453}. Best is trial 729 with value: 0.8593892830611674.[0m
[32m[I 2022-05-18 18:39:28,918][0m Trial 738 finished with value: 0.7949955031680835 and parameters: {'loss': 'coxph', 'learning_rate': 0.02712753457079219, 'n_estimators': 556, 'criterion': 'friedman_mse', 'min_samples_split': 3, 'min_samples_leaf': 4, 'min_weight_fraction_leaf': 0.05806781108879347, 'min_impurity_decrease': 0.5969779955841398, 'max_features': 0.6017071811537937, 'subsample': 0.12648973614114498, 'dropout_rate': 0.05007877043904241, 'ccp_alpha': 0.09690624823314933}. Best is trial 729 with value: 0.8593892830611674.[0m
[32m[I 2022-05-18 19:06:36,444][0m Trial 739 finished with value: 0.7636651267804859 and parameters: {'loss': 'coxph', 'learning_rate': 0.01517390734600923, 'n_estimators': 542, 'criterion': 'friedman_mse', 'min_samples_split': 3, 'min_samples_leaf': 4, 'min_weight_fraction_leaf': 0.06322686525840866, 'min_impurity_decrease': 0.5717548343823675, 'max_features': 0.6059695407740434, 'subsample': 0.10460000596843841, 'dropout_rate': 0.033954521867754314, 'ccp_alpha': 0.19202898475442337}. Best is trial 729 with value: 0.8593892830611674.[0m
[32m[I 2022-05-18 19:33:07,657][0m Trial 740 finished with value: 0.7976696088916782 and parameters: {'loss': 'coxph', 'learning_rate': 0.021404535298300047, 'n_estimators': 535, 'criterion': 'friedman_mse', 'min_samples_split': 3, 'min_samples_leaf': 4, 'min_weight_fraction_leaf': 0.04223472055428211, 'min_impurity_decrease': 0.643299430158273, 'max_features': 0.6042828386730501, 'subsample': 0.11614339660297092, 'dropout_rate': 0.023642580500218446, 'ccp_alpha': 0.09623506199204898}. Best is trial 729 with value: 0.8593892830611674.[0m
[32m[I 2022-05-18 20:01:05,092][0m Trial 741 finished with value: 0.7635289961919173 and parameters: {'loss': 'coxph', 'learning_rate': 0.04568056216267942, 'n_estimators': 562, 'criterion': 'friedman_mse', 'min_samples_split': 3, 'min_samples_leaf': 6, 'min_weight_fraction_leaf': 0.051309254395365, 'min_impurity_decrease': 0.6323657624049825, 'max_features': 0.6248015563976366, 'subsample': 0.10680791933486045, 'dropout_rate': 0.048637154472025726, 'ccp_alpha': 0.24107262248402325}. Best is trial 729 with value: 0.8593892830611674.[0m
[32m[I 2022-05-18 20:26:43,687][0m Trial 742 finished with value: 0.8032126382326694 and parameters: {'loss': 'coxph', 'learning_rate': 0.0375473617364495, 'n_estimators': 531, 'criterion': 'friedman_mse', 'min_samples_split': 3, 'min_samples_leaf': 4, 'min_weight_fraction_leaf': 0.06420410242725808, 'min_impurity_decrease': 0.6694974184915329, 'max_features': 0.5800788742762992, 'subsample': 0.14209836276072138, 'dropout_rate': 0.025009816146093815, 'ccp_alpha': 0.0897565809254306}. Best is trial 729 with value: 0.8593892830611674.[0m
[32m[I 2022-05-18 20:54:48,578][0m Trial 743 finished with value: 0.7706741648122646 and parameters: {'loss': 'coxph', 'learning_rate': 0.02060455410363101, 'n_estimators': 561, 'criterion': 'friedman_mse', 'min_samples_split': 3, 'min_samples_leaf': 4, 'min_weight_fraction_leaf': 0.06706696770907307, 'min_impurity_decrease': 0.5522200901118904, 'max_features': 0.6224081171984284, 'subsample': 0.10688983029871726, 'dropout_rate': 0.06375994496599667, 'ccp_alpha': 0.17144669175331645}. Best is trial 729 with value: 0.8593892830611674.[0m
[32m[I 2022-05-18 21:21:13,933][0m Trial 744 finished with value: 0.8606198786784194 and parameters: {'loss': 'coxph', 'learning_rate': 0.027460977178186578, 'n_estimators': 523, 'criterion': 'friedman_mse', 'min_samples_split': 3, 'min_samples_leaf': 4, 'min_weight_fraction_leaf': 0.055400505001512765, 'min_impurity_decrease': 0.6090365066477035, 'max_features': 0.5619352009672446, 'subsample': 0.13283461022604187, 'dropout_rate': 0.0026846325807422695, 'ccp_alpha': 0.0015036829324960167}. Best is trial 744 with value: 0.8606198786784194.[0m
[32m[I 2022-05-18 21:26:34,384][0m Trial 745 finished with value: 0.8552562301931346 and parameters: {'loss': 'coxph', 'learning_rate': 0.025214703454480642, 'n_estimators': 122, 'criterion': 'friedman_mse', 'min_samples_split': 3, 'min_samples_leaf': 4, 'min_weight_fraction_leaf': 0.022369980426837882, 'min_impurity_decrease': 0.6313821937396337, 'max_features': 0.5619319685836067, 'subsample': 0.12677825850987198, 'dropout_rate': 0.001993498082693176, 'ccp_alpha': 0.0010028496212468466}. Best is trial 744 with value: 0.8606198786784194.[0m
[32m[I 2022-05-18 21:32:57,885][0m Trial 746 finished with value: 0.5 and parameters: {'loss': 'coxph', 'learning_rate': 0.02485499970824782, 'n_estimators': 147, 'criterion': 'friedman_mse', 'min_samples_split': 3, 'min_samples_leaf': 4, 'min_weight_fraction_leaf': 0.036225169911172736, 'min_impurity_decrease': 0.6161738140069712, 'max_features': 0.5688186036199872, 'subsample': 0.12534795898856343, 'dropout_rate': 0.006831440115274902, 'ccp_alpha': 0.4302538939685841}. Best is trial 744 with value: 0.8606198786784194.[0m
[32m[I 2022-05-18 21:58:27,090][0m Trial 747 finished with value: 0.8006184574368186 and parameters: {'loss': 'coxph', 'learning_rate': 0.02837867241934379, 'n_estimators': 525, 'criterion': 'friedman_mse', 'min_samples_split': 3, 'min_samples_leaf': 4, 'min_weight_fraction_leaf': 0.045621258775868596, 'min_impurity_decrease': 0.6008895361760305, 'max_features': 0.5490969143698154, 'subsample': 0.13433295505279108, 'dropout_rate': 0.022982308893726155, 'ccp_alpha': 0.09669179835615221}. Best is trial 744 with value: 0.8606198786784194.[0m
[32m[I 2022-05-18 22:26:59,396][0m Trial 748 finished with value: 0.8580972385355838 and parameters: {'loss': 'coxph', 'learning_rate': 0.038484244687748415, 'n_estimators': 566, 'criterion': 'friedman_mse', 'min_samples_split': 3, 'min_samples_leaf': 4, 'min_weight_fraction_leaf': 0.013179778411527732, 'min_impurity_decrease': 0.6205279487655473, 'max_features': 0.5547579858553041, 'subsample': 0.14511068802679655, 'dropout_rate': 0.036413338756587116, 'ccp_alpha': 0.0012233564384763536}. Best is trial 744 with value: 0.8606198786784194.[0m
[32m[I 2022-05-18 22:32:56,845][0m Trial 749 finished with value: 0.7392887046509526 and parameters: {'loss': 'coxph', 'learning_rate': 0.041273453024727104, 'n_estimators': 140, 'criterion': 'friedman_mse', 'min_samples_split': 2, 'min_samples_leaf': 4, 'min_weight_fraction_leaf': 0.033363392418447144, 'min_impurity_decrease': 0.5837820732110482, 'max_features': 0.5284603385492048, 'subsample': 0.14710205171249435, 'dropout_rate': 0.04243506783081212, 'ccp_alpha': 0.2900671163036343}. Best is trial 744 with value: 0.8606198786784194.[0m
[32m[I 2022-05-18 23:00:46,689][0m Trial 750 finished with value: 0.7636000840246535 and parameters: {'loss': 'coxph', 'learning_rate': 0.032384810865318595, 'n_estimators': 579, 'criterion': 'friedman_mse', 'min_samples_split': 3, 'min_samples_leaf': 4, 'min_weight_fraction_leaf': 0.0010121642756155541, 'min_impurity_decrease': 0.6519558950427424, 'max_features': 0.526911005588329, 'subsample': 0.1513256122240777, 'dropout_rate': 0.0012844640288021034, 'ccp_alpha': 0.17686930874278292}. Best is trial 744 with value: 0.8606198786784194.[0m
/media/san2_ssd/data/Workdir/survival/venv/lib/python3.8/site-packages/sksurv/ensemble/boosting.py:955: RuntimeWarning: divide by zero encountered in log
  time = numpy.log(time)
/media/san2_ssd/data/Workdir/survival/venv/lib/python3.8/site-packages/sksurv/ensemble/boosting.py:955: RuntimeWarning: divide by zero encountered in log
  time = numpy.log(time)
/media/san2_ssd/data/Workdir/survival/venv/lib/python3.8/site-packages/sksurv/ensemble/boosting.py:955: RuntimeWarning: divide by zero encountered in log
  time = numpy.log(time)
/media/san2_ssd/data/Workdir/survival/venv/lib/python3.8/site-packages/sksurv/ensemble/boosting.py:955: RuntimeWarning: divide by zero encountered in log
  time = numpy.log(time)
/media/san2_ssd/data/Workdir/survival/venv/lib/python3.8/site-packages/sksurv/ensemble/boosting.py:955: RuntimeWarning: divide by zero encountered in log
  time = numpy.log(time)
[32m[I 2022-05-18 23:00:46,764][0m Trial 751 finished with value: -1.0 and parameters: {'loss': 'squared', 'learning_rate': 0.044590801172279565, 'n_estimators': 570, 'criterion': 'friedman_mse', 'min_samples_split': 3, 'min_samples_leaf': 4, 'min_weight_fraction_leaf': 0.029701110933648953, 'min_impurity_decrease': 0.6221198942078061, 'max_features': 0.568311742090331, 'subsample': 0.13426266283163502, 'dropout_rate': 0.025216775661049837, 'ccp_alpha': 0.10263939929920389}. Best is trial 744 with value: 0.8606198786784194.[0m
[32m[I 2022-05-18 23:08:33,735][0m Trial 752 finished with value: 0.8594179480054251 and parameters: {'loss': 'coxph', 'learning_rate': 0.05603426750635345, 'n_estimators': 173, 'criterion': 'friedman_mse', 'min_samples_split': 3, 'min_samples_leaf': 4, 'min_weight_fraction_leaf': 0.013750806848807763, 'min_impurity_decrease': 0.6263280749331626, 'max_features': 0.5565593209449902, 'subsample': 0.12206125901401237, 'dropout_rate': 0.001905959576649248, 'ccp_alpha': 0.0035450023527734747}. Best is trial 744 with value: 0.8606198786784194.[0m
[32m[I 2022-05-18 23:14:24,330][0m Trial 753 finished with value: 0.5 and parameters: {'loss': 'coxph', 'learning_rate': 0.059043443571181985, 'n_estimators': 133, 'criterion': 'squared_error', 'min_samples_split': 3, 'min_samples_leaf': 4, 'min_weight_fraction_leaf': 0.017506910209929512, 'min_impurity_decrease': 0.6248359068967906, 'max_features': 0.5581968154927135, 'subsample': 0.11106784100271155, 'dropout_rate': 0.0381362263368263, 'ccp_alpha': 0.09397450570146346}. Best is trial 744 with value: 0.8606198786784194.[0m
[32m[I 2022-05-18 23:22:17,595][0m Trial 754 finished with value: 0.5 and parameters: {'loss': 'coxph', 'learning_rate': 0.06552931846167052, 'n_estimators': 180, 'criterion': 'friedman_mse', 'min_samples_split': 3, 'min_samples_leaf': 4, 'min_weight_fraction_leaf': 0.023697737945994106, 'min_impurity_decrease': 0.6392471554723319, 'max_features': 0.5485710961375503, 'subsample': 0.1258398120237451, 'dropout_rate': 0.019296144471548305, 'ccp_alpha': 3.732130741029816}. Best is trial 744 with value: 0.8606198786784194.[0m
[32m[I 2022-05-18 23:27:34,627][0m Trial 755 finished with value: 0.7632033540241028 and parameters: {'loss': 'coxph', 'learning_rate': 0.04287690658284034, 'n_estimators': 120, 'criterion': 'friedman_mse', 'min_samples_split': 3, 'min_samples_leaf': 4, 'min_weight_fraction_leaf': 0.010995116006984149, 'min_impurity_decrease': 0.603723030990977, 'max_features': 0.5878937123563253, 'subsample': 0.11078870336696658, 'dropout_rate': 0.004706870502219489, 'ccp_alpha': 0.22305751395447349}. Best is trial 744 with value: 0.8606198786784194.[0m
[32m[I 2022-05-18 23:32:58,206][0m Trial 756 finished with value: 0.7934991984413367 and parameters: {'loss': 'coxph', 'learning_rate': 0.025988455409216415, 'n_estimators': 125, 'criterion': 'friedman_mse', 'min_samples_split': 3, 'min_samples_leaf': 4, 'min_weight_fraction_leaf': 0.014155105927556314, 'min_impurity_decrease': 0.5615568666278915, 'max_features': 0.5011271339352669, 'subsample': 0.1311730520394852, 'dropout_rate': 0.05293599684379961, 'ccp_alpha': 0.09242255548084577}. Best is trial 744 with value: 0.8606198786784194.[0m
[32m[I 2022-05-18 23:40:57,842][0m Trial 757 finished with value: 0.763061309945744 and parameters: {'loss': 'coxph', 'learning_rate': 0.017021413833625345, 'n_estimators': 178, 'criterion': 'friedman_mse', 'min_samples_split': 3, 'min_samples_leaf': 4, 'min_weight_fraction_leaf': 0.017883645657131655, 'min_impurity_decrease': 0.6091671205911297, 'max_features': 0.5223101163272041, 'subsample': 0.10862899296714336, 'dropout_rate': 0.0224959825192216, 'ccp_alpha': 0.17392885766908722}. Best is trial 744 with value: 0.8606198786784194.[0m
[32m[I 2022-05-18 23:45:21,287][0m Trial 758 finished with value: 0.8553322276928317 and parameters: {'loss': 'coxph', 'learning_rate': 0.05335778711189727, 'n_estimators': 103, 'criterion': 'friedman_mse', 'min_samples_split': 3, 'min_samples_leaf': 4, 'min_weight_fraction_leaf': 0.025993454340033313, 'min_impurity_decrease': 0.6440310050419585, 'max_features': 0.5705760969426751, 'subsample': 0.14301864377774892, 'dropout_rate': 0.03543903032637425, 'ccp_alpha': 0.003808862699529061}. Best is trial 744 with value: 0.8606198786784194.[0m
[32m[I 2022-05-18 23:54:18,099][0m Trial 759 finished with value: 0.8618735483942033 and parameters: {'loss': 'coxph', 'learning_rate': 0.07440310825085955, 'n_estimators': 203, 'criterion': 'friedman_mse', 'min_samples_split': 3, 'min_samples_leaf': 4, 'min_weight_fraction_leaf': 0.022805299697031434, 'min_impurity_decrease': 0.6525263632470739, 'max_features': 0.5651148218756145, 'subsample': 0.15107725015042955, 'dropout_rate': 0.000576048780773299, 'ccp_alpha': 0.0016903151999849162}. Best is trial 759 with value: 0.8618735483942033.[0m
[32m[I 2022-05-19 00:02:34,234][0m Trial 760 finished with value: 0.5 and parameters: {'loss': 'coxph', 'learning_rate': 0.06874820511751562, 'n_estimators': 194, 'criterion': 'friedman_mse', 'min_samples_split': 3, 'min_samples_leaf': 4, 'min_weight_fraction_leaf': 0.008834434732289783, 'min_impurity_decrease': 0.6565105894885875, 'max_features': 0.5686922864927555, 'subsample': 0.15535742239425915, 'dropout_rate': 0.0003481863841277629, 'ccp_alpha': 1.2278436432183222}. Best is trial 759 with value: 0.8618735483942033.[0m
[32m[I 2022-05-19 00:06:47,977][0m Trial 761 finished with value: 0.7392887046509526 and parameters: {'loss': 'coxph', 'learning_rate': 0.04850122558233253, 'n_estimators': 101, 'criterion': 'friedman_mse', 'min_samples_split': 3, 'min_samples_leaf': 4, 'min_weight_fraction_leaf': 0.014936207631904425, 'min_impurity_decrease': 0.6216760775947163, 'max_features': 0.5441236496096777, 'subsample': 0.16465105526989565, 'dropout_rate': 0.03864544417267321, 'ccp_alpha': 0.26392578645690934}. Best is trial 759 with value: 0.8618735483942033.[0m
[32m[I 2022-05-19 00:11:41,082][0m Trial 762 finished with value: 0.7391916238289179 and parameters: {'loss': 'coxph', 'learning_rate': 0.05163243325349519, 'n_estimators': 108, 'criterion': 'friedman_mse', 'min_samples_split': 3, 'min_samples_leaf': 4, 'min_weight_fraction_leaf': 0.00179242803709034, 'min_impurity_decrease': 0.6429940821278189, 'max_features': 0.591716805718746, 'subsample': 0.12782404553182716, 'dropout_rate': 0.0005274766501141195, 'ccp_alpha': 0.35894784523934853}. Best is trial 759 with value: 0.8618735483942033.[0m
[32m[I 2022-05-19 00:16:20,426][0m Trial 763 finished with value: 0.8567471970941339 and parameters: {'loss': 'coxph', 'learning_rate': 0.09100859346899362, 'n_estimators': 103, 'criterion': 'friedman_mse', 'min_samples_split': 3, 'min_samples_leaf': 4, 'min_weight_fraction_leaf': 0.025661649551202818, 'min_impurity_decrease': 0.6742912171425682, 'max_features': 0.568105217808098, 'subsample': 0.13950383962253238, 'dropout_rate': 0.058781366320141776, 'ccp_alpha': 0.00284540649946018}. Best is trial 759 with value: 0.8618735483942033.[0m
[32m[I 2022-05-19 00:21:06,705][0m Trial 764 finished with value: 0.7629815879723698 and parameters: {'loss': 'coxph', 'learning_rate': 0.08491268622507167, 'n_estimators': 105, 'criterion': 'friedman_mse', 'min_samples_split': 3, 'min_samples_leaf': 4, 'min_weight_fraction_leaf': 0.023409132282521224, 'min_impurity_decrease': 0.6739659650297023, 'max_features': 0.559390243241753, 'subsample': 0.1313553044889832, 'dropout_rate': 0.04993532014646741, 'ccp_alpha': 0.17949351340341138}. Best is trial 759 with value: 0.8618735483942033.[0m
[32m[I 2022-05-19 00:28:15,480][0m Trial 765 finished with value: 0.7978266104039646 and parameters: {'loss': 'coxph', 'learning_rate': 0.08642639466561036, 'n_estimators': 155, 'criterion': 'friedman_mse', 'min_samples_split': 3, 'min_samples_leaf': 4, 'min_weight_fraction_leaf': 0.02005423097142539, 'min_impurity_decrease': 0.6403210354932471, 'max_features': 0.5791368887606491, 'subsample': 0.14290792519521556, 'dropout_rate': 0.019757084681816823, 'ccp_alpha': 0.09304757938434902}. Best is trial 759 with value: 0.8618735483942033.[0m
[32m[I 2022-05-19 00:33:30,854][0m Trial 766 finished with value: 0.8570101252825202 and parameters: {'loss': 'coxph', 'learning_rate': 0.07073258268638666, 'n_estimators': 114, 'criterion': 'friedman_mse', 'min_samples_split': 3, 'min_samples_leaf': 4, 'min_weight_fraction_leaf': 0.022834319919282534, 'min_impurity_decrease': 0.5857493743341071, 'max_features': 0.5348874575948244, 'subsample': 0.12481708917495389, 'dropout_rate': 0.037254014172347305, 'ccp_alpha': 0.0016264342185654743}. Best is trial 759 with value: 0.8618735483942033.[0m
