[32m[I 2022-05-09 13:02:01,862][0m Trial 213 finished with value: 0.7627497708431493 and parameters: {'loss': 'coxph', 'learning_rate': 6.979151539077456e-06, 'n_estimators': 962, 'criterion': 'friedman_mse', 'min_samples_split': 8, 'min_samples_leaf': 2, 'min_weight_fraction_leaf': 0.2616185042172779, 'min_impurity_decrease': 0.13785256769594523, 'max_features': 0.998851684559258, 'subsample': 0.5362065332032135, 'dropout_rate': 0.9733402043257576, 'ccp_alpha': 0.12188676422693867}. Best is trial 193 with value: 0.7721311423051299.[0m
[32m[I 2022-05-09 13:33:28,340][0m Trial 214 finished with value: 0.7627745575913757 and parameters: {'loss': 'coxph', 'learning_rate': 7.512450667833157e-06, 'n_estimators': 989, 'criterion': 'friedman_mse', 'min_samples_split': 8, 'min_samples_leaf': 2, 'min_weight_fraction_leaf': 0.24053777488042266, 'min_impurity_decrease': 0.13000958009779995, 'max_features': 0.999135999216576, 'subsample': 0.5301072524331243, 'dropout_rate': 0.9755414490845943, 'ccp_alpha': 0.10212441318635396}. Best is trial 193 with value: 0.7721311423051299.[0m
[32m[I 2022-05-09 14:04:52,678][0m Trial 215 finished with value: 0.7627745575913757 and parameters: {'loss': 'coxph', 'learning_rate': 7.204461726738442e-06, 'n_estimators': 988, 'criterion': 'friedman_mse', 'min_samples_split': 8, 'min_samples_leaf': 2, 'min_weight_fraction_leaf': 0.23708652661317653, 'min_impurity_decrease': 0.12496259780427574, 'max_features': 0.9719290593185679, 'subsample': 0.5284998015205538, 'dropout_rate': 0.9764370934371003, 'ccp_alpha': 0.0935686527803714}. Best is trial 193 with value: 0.7721311423051299.[0m
[32m[I 2022-05-09 14:37:24,263][0m Trial 216 finished with value: 0.763068069998613 and parameters: {'loss': 'coxph', 'learning_rate': 1.1603556859226923e-05, 'n_estimators': 997, 'criterion': 'friedman_mse', 'min_samples_split': 8, 'min_samples_leaf': 2, 'min_weight_fraction_leaf': 0.23694615031812064, 'min_impurity_decrease': 0.12419600278967893, 'max_features': 0.97103107242125, 'subsample': 0.47909691894803885, 'dropout_rate': 0.9714433736170088, 'ccp_alpha': 0.08541987731490414}. Best is trial 193 with value: 0.7721311423051299.[0m
[32m[I 2022-05-09 15:08:39,306][0m Trial 217 finished with value: 0.7611631174729896 and parameters: {'loss': 'coxph', 'learning_rate': 1.1583507450848229e-05, 'n_estimators': 988, 'criterion': 'friedman_mse', 'min_samples_split': 8, 'min_samples_leaf': 2, 'min_weight_fraction_leaf': 0.23960976945638543, 'min_impurity_decrease': 0.12810896882433975, 'max_features': 0.970202947022159, 'subsample': 0.5486138707576421, 'dropout_rate': 0.9724264322505145, 'ccp_alpha': 0.09401058182549721}. Best is trial 193 with value: 0.7721311423051299.[0m
/media/san2_ssd/data/Workdir/survival/venv/lib/python3.8/site-packages/sksurv/ensemble/boosting.py:955: RuntimeWarning: divide by zero encountered in log
  time = numpy.log(time)
/media/san2_ssd/data/Workdir/survival/venv/lib/python3.8/site-packages/sksurv/ensemble/boosting.py:955: RuntimeWarning: divide by zero encountered in log
  time = numpy.log(time)
/media/san2_ssd/data/Workdir/survival/venv/lib/python3.8/site-packages/sksurv/ensemble/boosting.py:955: RuntimeWarning: divide by zero encountered in log
  time = numpy.log(time)
/media/san2_ssd/data/Workdir/survival/venv/lib/python3.8/site-packages/sksurv/ensemble/boosting.py:955: RuntimeWarning: divide by zero encountered in log
  time = numpy.log(time)
/media/san2_ssd/data/Workdir/survival/venv/lib/python3.8/site-packages/sksurv/ensemble/boosting.py:955: RuntimeWarning: divide by zero encountered in log
  time = numpy.log(time)
[32m[I 2022-05-09 15:08:39,358][0m Trial 218 finished with value: -1.0 and parameters: {'loss': 'squared', 'learning_rate': 1.1299823038764527e-05, 'n_estimators': 995, 'criterion': 'friedman_mse', 'min_samples_split': 8, 'min_samples_leaf': 2, 'min_weight_fraction_leaf': 0.23765699462173195, 'min_impurity_decrease': 0.12554250303963016, 'max_features': 0.9721269587196566, 'subsample': 0.47741406970125166, 'dropout_rate': 0.9788647988112061, 'ccp_alpha': 0.08072795487160496}. Best is trial 193 with value: 0.7721311423051299.[0m
[32m[I 2022-05-09 15:41:42,915][0m Trial 219 finished with value: 0.7627745575913757 and parameters: {'loss': 'coxph', 'learning_rate': 8.64886601951283e-06, 'n_estimators': 998, 'criterion': 'friedman_mse', 'min_samples_split': 8, 'min_samples_leaf': 2, 'min_weight_fraction_leaf': 0.24567663116954602, 'min_impurity_decrease': 0.08302407906057675, 'max_features': 0.9676972673075174, 'subsample': 0.446834628375141, 'dropout_rate': 0.9764910984989722, 'ccp_alpha': 0.08635901407416209}. Best is trial 193 with value: 0.7721311423051299.[0m
[32m[I 2022-05-09 16:14:18,433][0m Trial 220 finished with value: 0.7627745575913757 and parameters: {'loss': 'coxph', 'learning_rate': 7.448174521833886e-06, 'n_estimators': 986, 'criterion': 'friedman_mse', 'min_samples_split': 8, 'min_samples_leaf': 2, 'min_weight_fraction_leaf': 0.24285899057671384, 'min_impurity_decrease': 0.08631798553076708, 'max_features': 0.9668263992106058, 'subsample': 0.4512530769661004, 'dropout_rate': 0.9757059813542325, 'ccp_alpha': 0.08676096111889198}. Best is trial 193 with value: 0.7721311423051299.[0m
[32m[I 2022-05-09 16:47:25,779][0m Trial 221 finished with value: 0.7627745575913757 and parameters: {'loss': 'coxph', 'learning_rate': 7.328388601748437e-06, 'n_estimators': 995, 'criterion': 'friedman_mse', 'min_samples_split': 8, 'min_samples_leaf': 2, 'min_weight_fraction_leaf': 0.24303413448218894, 'min_impurity_decrease': 0.12716364060133367, 'max_features': 0.9649890357904406, 'subsample': 0.4397261007717472, 'dropout_rate': 0.9770609592258455, 'ccp_alpha': 0.08511953798896421}. Best is trial 193 with value: 0.7721311423051299.[0m
[32m[I 2022-05-09 17:20:38,015][0m Trial 222 finished with value: 0.7627745575913757 and parameters: {'loss': 'coxph', 'learning_rate': 7.495452974798145e-06, 'n_estimators': 999, 'criterion': 'friedman_mse', 'min_samples_split': 8, 'min_samples_leaf': 2, 'min_weight_fraction_leaf': 0.24354053425289468, 'min_impurity_decrease': 0.06863172222415256, 'max_features': 0.9649027047203904, 'subsample': 0.4383943676170031, 'dropout_rate': 0.9809581508504525, 'ccp_alpha': 0.08823025630255592}. Best is trial 193 with value: 0.7721311423051299.[0m
[32m[I 2022-05-09 17:54:26,733][0m Trial 223 finished with value: 0.7627745575913757 and parameters: {'loss': 'coxph', 'learning_rate': 7.4097544232484815e-06, 'n_estimators': 998, 'criterion': 'friedman_mse', 'min_samples_split': 8, 'min_samples_leaf': 2, 'min_weight_fraction_leaf': 0.24245502633253072, 'min_impurity_decrease': 0.07390381074300136, 'max_features': 0.9625866119794184, 'subsample': 0.4260446240715366, 'dropout_rate': 0.9566881979049993, 'ccp_alpha': 0.08895218746529919}. Best is trial 193 with value: 0.7721311423051299.[0m
[32m[I 2022-05-09 18:27:37,316][0m Trial 224 finished with value: 0.7628214435492846 and parameters: {'loss': 'coxph', 'learning_rate': 9.971310703103865e-06, 'n_estimators': 983, 'criterion': 'friedman_mse', 'min_samples_split': 8, 'min_samples_leaf': 2, 'min_weight_fraction_leaf': 0.2436838519190788, 'min_impurity_decrease': 0.07733428161538021, 'max_features': 0.9678605754464619, 'subsample': 0.432533889215645, 'dropout_rate': 0.9543514818742727, 'ccp_alpha': 0.0750302484545695}. Best is trial 193 with value: 0.7721311423051299.[0m
[32m[I 2022-05-09 19:01:13,288][0m Trial 225 finished with value: 0.8069337356428422 and parameters: {'loss': 'coxph', 'learning_rate': 8.603118893821441e-06, 'n_estimators': 1000, 'criterion': 'friedman_mse', 'min_samples_split': 8, 'min_samples_leaf': 2, 'min_weight_fraction_leaf': 0.22294059759086804, 'min_impurity_decrease': 0.08389811396107809, 'max_features': 0.9607342234156522, 'subsample': 0.43965148040763724, 'dropout_rate': 0.9562603705109537, 'ccp_alpha': 0.017905250889935984}. Best is trial 225 with value: 0.8069337356428422.[0m
[32m[I 2022-05-09 19:35:02,241][0m Trial 226 finished with value: 0.8078296329753603 and parameters: {'loss': 'coxph', 'learning_rate': 1.0035672506409028e-05, 'n_estimators': 999, 'criterion': 'friedman_mse', 'min_samples_split': 8, 'min_samples_leaf': 2, 'min_weight_fraction_leaf': 0.21293086010481116, 'min_impurity_decrease': 0.08703780536687827, 'max_features': 0.9588004638855424, 'subsample': 0.43489656438477003, 'dropout_rate': 0.9537850219669005, 'ccp_alpha': 0.004171921885814667}. Best is trial 226 with value: 0.8078296329753603.[0m
[32m[I 2022-05-09 20:08:43,734][0m Trial 227 finished with value: 0.8080828140453018 and parameters: {'loss': 'coxph', 'learning_rate': 1.0858567740254925e-05, 'n_estimators': 1000, 'criterion': 'friedman_mse', 'min_samples_split': 8, 'min_samples_leaf': 2, 'min_weight_fraction_leaf': 0.21221327803317538, 'min_impurity_decrease': 0.07803065420614694, 'max_features': 0.9607346166371514, 'subsample': 0.4420644473396222, 'dropout_rate': 0.9515902334429462, 'ccp_alpha': 0.019246800779622153}. Best is trial 227 with value: 0.8080828140453018.[0m
[32m[I 2022-05-09 20:42:30,149][0m Trial 228 finished with value: 0.8043764773485954 and parameters: {'loss': 'coxph', 'learning_rate': 1.0081050077148368e-05, 'n_estimators': 998, 'criterion': 'friedman_mse', 'min_samples_split': 8, 'min_samples_leaf': 2, 'min_weight_fraction_leaf': 0.2163626338669712, 'min_impurity_decrease': 0.08164287696381496, 'max_features': 0.9542860072016212, 'subsample': 0.4380287434723755, 'dropout_rate': 0.9496861996402038, 'ccp_alpha': 0.0025564406705921028}. Best is trial 227 with value: 0.8080828140453018.[0m
[32m[I 2022-05-09 21:16:19,873][0m Trial 229 finished with value: 0.816378597196113 and parameters: {'loss': 'coxph', 'learning_rate': 1.0065228110798526e-05, 'n_estimators': 1000, 'criterion': 'friedman_mse', 'min_samples_split': 8, 'min_samples_leaf': 2, 'min_weight_fraction_leaf': 0.2060059344920604, 'min_impurity_decrease': 0.07925552951902058, 'max_features': 0.9549742705715418, 'subsample': 0.43503693323551057, 'dropout_rate': 0.9547948492630731, 'ccp_alpha': 0.012228940987202716}. Best is trial 229 with value: 0.816378597196113.[0m
[32m[I 2022-05-09 21:49:51,909][0m Trial 230 finished with value: 0.8014976674918808 and parameters: {'loss': 'coxph', 'learning_rate': 9.085889480053902e-06, 'n_estimators': 994, 'criterion': 'friedman_mse', 'min_samples_split': 8, 'min_samples_leaf': 2, 'min_weight_fraction_leaf': 0.22373083633022253, 'min_impurity_decrease': 0.08132020657378516, 'max_features': 0.9570536261259293, 'subsample': 0.4428802991336834, 'dropout_rate': 0.9481109144712666, 'ccp_alpha': 0.00878756705094011}. Best is trial 229 with value: 0.816378597196113.[0m
[32m[I 2022-05-09 22:23:31,709][0m Trial 231 finished with value: 0.8182549857492674 and parameters: {'loss': 'coxph', 'learning_rate': 1.0216344062988419e-05, 'n_estimators': 995, 'criterion': 'friedman_mse', 'min_samples_split': 8, 'min_samples_leaf': 2, 'min_weight_fraction_leaf': 0.20541492565782132, 'min_impurity_decrease': 0.07672120376160586, 'max_features': 0.9561166251610009, 'subsample': 0.43959370771210876, 'dropout_rate': 0.9505722989396458, 'ccp_alpha': 0.005954330736158975}. Best is trial 231 with value: 0.8182549857492674.[0m
[32m[I 2022-05-09 22:57:22,694][0m Trial 232 finished with value: 0.8193139354873846 and parameters: {'loss': 'coxph', 'learning_rate': 1.002807564740521e-05, 'n_estimators': 998, 'criterion': 'friedman_mse', 'min_samples_split': 8, 'min_samples_leaf': 2, 'min_weight_fraction_leaf': 0.19983588224049467, 'min_impurity_decrease': 0.07704480230452049, 'max_features': 0.9551926899974422, 'subsample': 0.4388706630194756, 'dropout_rate': 0.9502297985465092, 'ccp_alpha': 0.00505367187594255}. Best is trial 232 with value: 0.8193139354873846.[0m
[32m[I 2022-05-09 23:29:56,682][0m Trial 233 finished with value: 0.8106205062208967 and parameters: {'loss': 'coxph', 'learning_rate': 1.0580760900248987e-05, 'n_estimators': 965, 'criterion': 'friedman_mse', 'min_samples_split': 8, 'min_samples_leaf': 2, 'min_weight_fraction_leaf': 0.2069064477258442, 'min_impurity_decrease': 0.07758737476553808, 'max_features': 0.9530012936446246, 'subsample': 0.43814680327163563, 'dropout_rate': 0.9507538186938674, 'ccp_alpha': 0.015047766772938958}. Best is trial 232 with value: 0.8193139354873846.[0m
[32m[I 2022-05-10 00:03:49,500][0m Trial 234 finished with value: 0.8040047660486618 and parameters: {'loss': 'coxph', 'learning_rate': 9.898967488349993e-06, 'n_estimators': 1000, 'criterion': 'friedman_mse', 'min_samples_split': 8, 'min_samples_leaf': 2, 'min_weight_fraction_leaf': 0.20377464945945678, 'min_impurity_decrease': 0.07518864920591634, 'max_features': 0.9560885598915513, 'subsample': 0.43606711257918657, 'dropout_rate': 0.948638103937844, 'ccp_alpha': 0.026182011999748775}. Best is trial 232 with value: 0.8193139354873846.[0m
[32m[I 2022-05-10 00:38:35,427][0m Trial 235 finished with value: 0.8077251168660208 and parameters: {'loss': 'coxph', 'learning_rate': 9.893832031625726e-06, 'n_estimators': 999, 'criterion': 'friedman_mse', 'min_samples_split': 8, 'min_samples_leaf': 2, 'min_weight_fraction_leaf': 0.20154276937176993, 'min_impurity_decrease': 0.07465974039678183, 'max_features': 0.9532703496623377, 'subsample': 0.4210633731761973, 'dropout_rate': 0.9139269491245067, 'ccp_alpha': 0.01847355800887781}. Best is trial 232 with value: 0.8193139354873846.[0m
[32m[I 2022-05-10 01:12:49,516][0m Trial 236 finished with value: 0.8188191004499311 and parameters: {'loss': 'coxph', 'learning_rate': 1.0109539813617483e-05, 'n_estimators': 993, 'criterion': 'friedman_mse', 'min_samples_split': 8, 'min_samples_leaf': 2, 'min_weight_fraction_leaf': 0.204842671338819, 'min_impurity_decrease': 0.06945293312570626, 'max_features': 0.9558654471398181, 'subsample': 0.4371538568339227, 'dropout_rate': 0.9178080934893498, 'ccp_alpha': 0.003560325437013512}. Best is trial 232 with value: 0.8193139354873846.[0m
[32m[I 2022-05-10 01:46:30,989][0m Trial 237 finished with value: 0.8149990615311118 and parameters: {'loss': 'coxph', 'learning_rate': 1.0478386708203949e-05, 'n_estimators': 978, 'criterion': 'friedman_mse', 'min_samples_split': 8, 'min_samples_leaf': 2, 'min_weight_fraction_leaf': 0.19907325881732924, 'min_impurity_decrease': 0.07179086734813284, 'max_features': 0.9516932912807926, 'subsample': 0.43601744173962, 'dropout_rate': 0.9142372026031154, 'ccp_alpha': 0.012520553078268189}. Best is trial 232 with value: 0.8193139354873846.[0m
[32m[I 2022-05-10 02:21:00,586][0m Trial 238 finished with value: 0.8195840847751142 and parameters: {'loss': 'coxph', 'learning_rate': 1.0867153399048746e-05, 'n_estimators': 993, 'criterion': 'friedman_mse', 'min_samples_split': 8, 'min_samples_leaf': 2, 'min_weight_fraction_leaf': 0.2005355475057458, 'min_impurity_decrease': 0.07333274002142276, 'max_features': 0.959290369201346, 'subsample': 0.4330692584533097, 'dropout_rate': 0.9075840195578835, 'ccp_alpha': 0.0010104753391709659}. Best is trial 238 with value: 0.8195840847751142.[0m
[32m[I 2022-05-10 02:54:59,139][0m Trial 239 finished with value: 0.8170121098771583 and parameters: {'loss': 'coxph', 'learning_rate': 1.0548890898976075e-05, 'n_estimators': 988, 'criterion': 'friedman_mse', 'min_samples_split': 8, 'min_samples_leaf': 2, 'min_weight_fraction_leaf': 0.20543681575291495, 'min_impurity_decrease': 0.07231084402349061, 'max_features': 0.9567268685064265, 'subsample': 0.4385592076280642, 'dropout_rate': 0.9138260283746595, 'ccp_alpha': 0.010274249010600629}. Best is trial 238 with value: 0.8195840847751142.[0m
[32m[I 2022-05-10 03:29:54,238][0m Trial 240 finished with value: 0.8066269352000749 and parameters: {'loss': 'coxph', 'learning_rate': 1.1054784008904311e-05, 'n_estimators': 996, 'criterion': 'friedman_mse', 'min_samples_split': 8, 'min_samples_leaf': 2, 'min_weight_fraction_leaf': 0.2035630659136985, 'min_impurity_decrease': 0.06477503027481112, 'max_features': 0.9499633332542596, 'subsample': 0.4100700327594561, 'dropout_rate': 0.9118115936598162, 'ccp_alpha': 0.02175994515693836}. Best is trial 238 with value: 0.8195840847751142.[0m
[32m[I 2022-05-10 04:04:57,833][0m Trial 241 finished with value: 0.8065645450792452 and parameters: {'loss': 'coxph', 'learning_rate': 1.2126515112827593e-05, 'n_estimators': 998, 'criterion': 'friedman_mse', 'min_samples_split': 8, 'min_samples_leaf': 2, 'min_weight_fraction_leaf': 0.2036327323642344, 'min_impurity_decrease': 0.06320313453545608, 'max_features': 0.9531102859405876, 'subsample': 0.4036546091748693, 'dropout_rate': 0.9151241229526996, 'ccp_alpha': 0.022578919629070136}. Best is trial 238 with value: 0.8195840847751142.[0m
[32m[I 2022-05-10 04:40:09,451][0m Trial 242 finished with value: 0.8188969826777471 and parameters: {'loss': 'coxph', 'learning_rate': 1.2302538335053029e-05, 'n_estimators': 1000, 'criterion': 'friedman_mse', 'min_samples_split': 8, 'min_samples_leaf': 2, 'min_weight_fraction_leaf': 0.20325085217290337, 'min_impurity_decrease': 0.0571150688541866, 'max_features': 0.9470201004396936, 'subsample': 0.4065268093208939, 'dropout_rate': 0.9127269172259301, 'ccp_alpha': 0.00867727912406692}. Best is trial 238 with value: 0.8195840847751142.[0m
[32m[I 2022-05-10 05:15:24,505][0m Trial 243 finished with value: 0.8110468777901978 and parameters: {'loss': 'coxph', 'learning_rate': 1.0623947237828417e-05, 'n_estimators': 1000, 'criterion': 'friedman_mse', 'min_samples_split': 8, 'min_samples_leaf': 2, 'min_weight_fraction_leaf': 0.20469127858568292, 'min_impurity_decrease': 0.07504184039268412, 'max_features': 0.9493307869114953, 'subsample': 0.4022947473631171, 'dropout_rate': 0.9130727843568944, 'ccp_alpha': 0.0156334464092151}. Best is trial 238 with value: 0.8195840847751142.[0m
[32m[I 2022-05-10 05:50:57,901][0m Trial 244 finished with value: 0.8048792868813252 and parameters: {'loss': 'coxph', 'learning_rate': 1.0628255743052687e-05, 'n_estimators': 999, 'criterion': 'friedman_mse', 'min_samples_split': 8, 'min_samples_leaf': 2, 'min_weight_fraction_leaf': 0.2056058501883651, 'min_impurity_decrease': 0.06847164583966153, 'max_features': 0.9441813651096133, 'subsample': 0.39342419129229167, 'dropout_rate': 0.9015570155355986, 'ccp_alpha': 0.024941133012832233}. Best is trial 238 with value: 0.8195840847751142.[0m
[32m[I 2022-05-10 06:24:15,946][0m Trial 245 finished with value: 0.8046247778593795 and parameters: {'loss': 'coxph', 'learning_rate': 1.1984887015326403e-05, 'n_estimators': 955, 'criterion': 'friedman_mse', 'min_samples_split': 8, 'min_samples_leaf': 2, 'min_weight_fraction_leaf': 0.20251579533007397, 'min_impurity_decrease': 0.05954671375034427, 'max_features': 0.9454352654613829, 'subsample': 0.41292299625663437, 'dropout_rate': 0.9101529097779512, 'ccp_alpha': 0.0364400044610263}. Best is trial 238 with value: 0.8195840847751142.[0m
[32m[I 2022-05-10 06:57:46,427][0m Trial 246 finished with value: 0.8062264101314355 and parameters: {'loss': 'coxph', 'learning_rate': 1.1872100377198978e-05, 'n_estimators': 948, 'criterion': 'friedman_mse', 'min_samples_split': 8, 'min_samples_leaf': 2, 'min_weight_fraction_leaf': 0.2019408811594389, 'min_impurity_decrease': 0.054735770738572484, 'max_features': 0.9461780247556633, 'subsample': 0.39753691844745215, 'dropout_rate': 0.9059888911740842, 'ccp_alpha': 0.02290915842311595}. Best is trial 238 with value: 0.8195840847751142.[0m
[32m[I 2022-05-10 07:31:10,094][0m Trial 247 finished with value: 0.8104323684383538 and parameters: {'loss': 'coxph', 'learning_rate': 1.2237927278535503e-05, 'n_estimators': 946, 'criterion': 'friedman_mse', 'min_samples_split': 8, 'min_samples_leaf': 2, 'min_weight_fraction_leaf': 0.20534462727213076, 'min_impurity_decrease': 0.051866916737191016, 'max_features': 0.9436316997553861, 'subsample': 0.39994630070573667, 'dropout_rate': 0.9049216440164303, 'ccp_alpha': 0.016764300228735284}. Best is trial 238 with value: 0.8195840847751142.[0m
[32m[I 2022-05-10 08:04:45,357][0m Trial 248 finished with value: 0.8032096999014751 and parameters: {'loss': 'coxph', 'learning_rate': 1.2626235688488985e-05, 'n_estimators': 943, 'criterion': 'friedman_mse', 'min_samples_split': 8, 'min_samples_leaf': 2, 'min_weight_fraction_leaf': 0.20388241331319681, 'min_impurity_decrease': 0.05364821274758997, 'max_features': 0.9432210550525199, 'subsample': 0.4024505077594154, 'dropout_rate': 0.8742048448051826, 'ccp_alpha': 0.03134420348867405}. Best is trial 238 with value: 0.8195840847751142.[0m
[32m[I 2022-05-10 08:38:30,553][0m Trial 249 finished with value: 0.8196153157527369 and parameters: {'loss': 'coxph', 'learning_rate': 1.3439568472197576e-05, 'n_estimators': 942, 'criterion': 'friedman_mse', 'min_samples_split': 8, 'min_samples_leaf': 2, 'min_weight_fraction_leaf': 0.20342193060836208, 'min_impurity_decrease': 0.05237208067437983, 'max_features': 0.9410625038375978, 'subsample': 0.39978283828471, 'dropout_rate': 0.8750509041265373, 'ccp_alpha': 0.007461861244758934}. Best is trial 249 with value: 0.8196153157527369.[0m
[32m[I 2022-05-10 09:13:02,109][0m Trial 250 finished with value: 0.8082765705777641 and parameters: {'loss': 'coxph', 'learning_rate': 1.3600200278639261e-05, 'n_estimators': 956, 'criterion': 'friedman_mse', 'min_samples_split': 8, 'min_samples_leaf': 2, 'min_weight_fraction_leaf': 0.20254609576238078, 'min_impurity_decrease': 0.055246445820032006, 'max_features': 0.9417582730489396, 'subsample': 0.40514972219217366, 'dropout_rate': 0.8400142309506575, 'ccp_alpha': 0.018837061225318898}. Best is trial 249 with value: 0.8196153157527369.[0m
