[32m[I 2022-04-21 17:23:21,132][0m Trial 244 finished with value: 0.7826753799505408 and parameters: {'splitter': 'random', 'min_samples_split': 0.49710525268535755, 'min_samples_leaf': 0.008017536299015748, 'min_weight_fraction_leaf': 0.07680433538484151, 'max_features': 0.9060993322998669}. Best is trial 52 with value: 0.8098214582394094.[0m
[32m[I 2022-04-21 17:23:22,317][0m Trial 245 finished with value: 0.8064539092033647 and parameters: {'splitter': 'random', 'min_samples_split': 0.4758783488766565, 'min_samples_leaf': 0.02491372878674865, 'min_weight_fraction_leaf': 0.09477829870006264, 'max_features': 0.9239066628371474}. Best is trial 52 with value: 0.8098214582394094.[0m
[32m[I 2022-04-21 17:23:23,112][0m Trial 246 finished with value: 0.7876970696400019 and parameters: {'splitter': 'random', 'min_samples_split': 0.4777236933925228, 'min_samples_leaf': 0.021557219325620804, 'min_weight_fraction_leaf': 0.009908296744318017, 'max_features': 0.8905634914767966}. Best is trial 52 with value: 0.8098214582394094.[0m
[32m[I 2022-04-21 17:23:24,328][0m Trial 247 finished with value: 0.7588833507751127 and parameters: {'splitter': 'random', 'min_samples_split': 0.4689154317934369, 'min_samples_leaf': 0.025923914303002626, 'min_weight_fraction_leaf': 0.08905794761816829, 'max_features': 0.9505770447657449}. Best is trial 52 with value: 0.8098214582394094.[0m
[32m[I 2022-04-21 17:23:25,427][0m Trial 248 finished with value: 0.7907011627675173 and parameters: {'splitter': 'random', 'min_samples_split': 0.48480343719117674, 'min_samples_leaf': 0.037068639136730114, 'min_weight_fraction_leaf': 0.03314336130202534, 'max_features': 0.940047424830152}. Best is trial 52 with value: 0.8098214582394094.[0m
[32m[I 2022-04-21 17:23:26,698][0m Trial 249 finished with value: 0.8086407729100451 and parameters: {'splitter': 'random', 'min_samples_split': 0.32262434215870395, 'min_samples_leaf': 0.026406229205021475, 'min_weight_fraction_leaf': 0.09446432023230858, 'max_features': 0.9260659274950565}. Best is trial 52 with value: 0.8098214582394094.[0m
[32m[I 2022-04-21 17:23:27,839][0m Trial 250 finished with value: 0.8064539092033647 and parameters: {'splitter': 'random', 'min_samples_split': 0.3263351518103845, 'min_samples_leaf': 0.01006845822431659, 'min_weight_fraction_leaf': 0.09263618330489967, 'max_features': 0.9299527192545343}. Best is trial 52 with value: 0.8098214582394094.[0m
[32m[I 2022-04-21 17:23:28,579][0m Trial 251 finished with value: 0.7712570165694584 and parameters: {'splitter': 'random', 'min_samples_split': 0.32516884026843396, 'min_samples_leaf': 0.06686361688945022, 'min_weight_fraction_leaf': 0.09571365628438316, 'max_features': 0.9761634368173444}. Best is trial 52 with value: 0.8098214582394094.[0m
[32m[I 2022-04-21 17:23:29,661][0m Trial 252 finished with value: 0.7712570165694584 and parameters: {'splitter': 'random', 'min_samples_split': 0.3301706866623053, 'min_samples_leaf': 0.016587017173894915, 'min_weight_fraction_leaf': 0.09643274319371241, 'max_features': 0.9629431832147416}. Best is trial 52 with value: 0.8098214582394094.[0m
[32m[I 2022-04-21 17:23:30,888][0m Trial 253 finished with value: 0.7967066593147615 and parameters: {'splitter': 'random', 'min_samples_split': 0.3458482722616604, 'min_samples_leaf': 0.0022899280872308372, 'min_weight_fraction_leaf': 0.095501485011076, 'max_features': 0.8863960140177506}. Best is trial 52 with value: 0.8098214582394094.[0m
[32m[I 2022-04-21 17:23:31,402][0m Trial 254 finished with value: 0.7594491636389396 and parameters: {'splitter': 'random', 'min_samples_split': 0.33470809917826383, 'min_samples_leaf': 0.019000316554882754, 'min_weight_fraction_leaf': 0.22566441569009466, 'max_features': 0.9378547216054046}. Best is trial 52 with value: 0.8098214582394094.[0m
[32m[I 2022-04-21 17:23:31,950][0m Trial 255 finished with value: 0.771048895131327 and parameters: {'splitter': 'random', 'min_samples_split': 0.3142292986528705, 'min_samples_leaf': 0.023664327893548737, 'min_weight_fraction_leaf': 0.08950006736365515, 'max_features': 0.9579423293637772}. Best is trial 52 with value: 0.8098214582394094.[0m
[32m[I 2022-04-21 17:23:32,395][0m Trial 256 finished with value: 0.7682350893242956 and parameters: {'splitter': 'random', 'min_samples_split': 0.32419844430452405, 'min_samples_leaf': 0.0416199331107206, 'min_weight_fraction_leaf': 0.08286832660414906, 'max_features': 0.8715242987875942}. Best is trial 52 with value: 0.8098214582394094.[0m
[32m[I 2022-04-21 17:23:32,878][0m Trial 257 finished with value: 0.7523929447209141 and parameters: {'splitter': 'random', 'min_samples_split': 0.48984001836389524, 'min_samples_leaf': 0.03324202826455684, 'min_weight_fraction_leaf': 0.10839424774123149, 'max_features': 0.931072764840595}. Best is trial 52 with value: 0.8098214582394094.[0m
[32m[I 2022-04-21 17:23:33,226][0m Trial 258 finished with value: 0.6851609036733942 and parameters: {'splitter': 'random', 'min_samples_split': 0.3118975276174365, 'min_samples_leaf': 0.0583041535857482, 'min_weight_fraction_leaf': 0.30770643143007953, 'max_features': 0.9783100493374531}. Best is trial 52 with value: 0.8098214582394094.[0m
[32m[I 2022-04-21 17:23:33,793][0m Trial 259 finished with value: 0.7555141384748583 and parameters: {'splitter': 'random', 'min_samples_split': 0.4679170506962248, 'min_samples_leaf': 0.009945123315207036, 'min_weight_fraction_leaf': 0.11010217791100693, 'max_features': 0.9258625704169144}. Best is trial 52 with value: 0.8098214582394094.[0m
[32m[I 2022-04-21 17:23:34,435][0m Trial 260 finished with value: 0.7845762418897589 and parameters: {'splitter': 'random', 'min_samples_split': 0.47918974933633773, 'min_samples_leaf': 0.001650412699956522, 'min_weight_fraction_leaf': 0.10001874261298206, 'max_features': 0.9007873511004644}. Best is trial 52 with value: 0.8098214582394094.[0m
[32m[I 2022-04-21 17:23:35,743][0m Trial 261 finished with value: 0.7669759123387727 and parameters: {'splitter': 'random', 'min_samples_split': 0.49972780044187964, 'min_samples_leaf': 0.05246929372560105, 'min_weight_fraction_leaf': 0.08881684549564689, 'max_features': 0.954833740698966}. Best is trial 52 with value: 0.8098214582394094.[0m
[32m[I 2022-04-21 17:23:36,540][0m Trial 262 finished with value: 0.6851609036733942 and parameters: {'splitter': 'random', 'min_samples_split': 0.45805037263279313, 'min_samples_leaf': 0.042626623480993275, 'min_weight_fraction_leaf': 0.4445822074996041, 'max_features': 0.9077403887661804}. Best is trial 52 with value: 0.8098214582394094.[0m
[32m[I 2022-04-21 17:23:37,736][0m Trial 263 finished with value: 0.7849983543526184 and parameters: {'splitter': 'random', 'min_samples_split': 0.4801863344687747, 'min_samples_leaf': 0.010978300531519023, 'min_weight_fraction_leaf': 0.000983821649670067, 'max_features': 0.8865206031736698}. Best is trial 52 with value: 0.8098214582394094.[0m
[32m[I 2022-04-21 17:23:38,367][0m Trial 264 finished with value: 0.7643145523409592 and parameters: {'splitter': 'random', 'min_samples_split': 0.30502718042882543, 'min_samples_leaf': 0.017802497293732292, 'min_weight_fraction_leaf': 0.11242022903634266, 'max_features': 0.9376182619622694}. Best is trial 52 with value: 0.8098214582394094.[0m
[32m[I 2022-04-21 17:23:39,041][0m Trial 265 finished with value: 0.8032272519689826 and parameters: {'splitter': 'random', 'min_samples_split': 0.31915960371803426, 'min_samples_leaf': 0.013389753132048909, 'min_weight_fraction_leaf': 0.07259409886469395, 'max_features': 0.9813353461720948}. Best is trial 52 with value: 0.8098214582394094.[0m
[32m[I 2022-04-21 17:23:39,542][0m Trial 266 finished with value: 0.7822297967131655 and parameters: {'splitter': 'random', 'min_samples_split': 0.46888885367665156, 'min_samples_leaf': 0.029649119406662157, 'min_weight_fraction_leaf': 0.024232019759822344, 'max_features': 0.8581044191469924}. Best is trial 52 with value: 0.8098214582394094.[0m
[32m[I 2022-04-21 17:23:40,053][0m Trial 267 finished with value: 0.809119915576133 and parameters: {'splitter': 'random', 'min_samples_split': 0.49164492271054333, 'min_samples_leaf': 0.02629622467532604, 'min_weight_fraction_leaf': 0.008518807340257646, 'max_features': 0.7448395715606334}. Best is trial 52 with value: 0.8098214582394094.[0m
[32m[I 2022-04-21 17:23:40,765][0m Trial 268 finished with value: 0.7669759123387727 and parameters: {'splitter': 'random', 'min_samples_split': 0.48863077700237423, 'min_samples_leaf': 0.009320166497461277, 'min_weight_fraction_leaf': 0.001108678875846163, 'max_features': 0.957901402874593}. Best is trial 52 with value: 0.8098214582394094.[0m
[32m[I 2022-04-21 17:23:41,633][0m Trial 269 finished with value: 0.7835953200878014 and parameters: {'splitter': 'random', 'min_samples_split': 0.4992802092814715, 'min_samples_leaf': 0.019131447043530626, 'min_weight_fraction_leaf': 0.01023379154447077, 'max_features': 0.6447887899245013}. Best is trial 52 with value: 0.8098214582394094.[0m
[32m[I 2022-04-21 17:23:42,403][0m Trial 270 finished with value: 0.8005305401417377 and parameters: {'splitter': 'random', 'min_samples_split': 0.4815625002030786, 'min_samples_leaf': 0.041589618327111305, 'min_weight_fraction_leaf': 0.01240677739213587, 'max_features': 0.7592518083205853}. Best is trial 52 with value: 0.8098214582394094.[0m
[32m[I 2022-04-21 17:23:42,695][0m Trial 271 finished with value: 0.7378925598125704 and parameters: {'splitter': 'random', 'min_samples_split': 0.490225953673854, 'min_samples_leaf': 0.2528044674503885, 'min_weight_fraction_leaf': 0.020262704980251553, 'max_features': 0.9775442471733261}. Best is trial 52 with value: 0.8098214582394094.[0m
[32m[I 2022-04-21 17:23:43,254][0m Trial 272 finished with value: 0.7780330074642946 and parameters: {'splitter': 'random', 'min_samples_split': 0.4720648201838684, 'min_samples_leaf': 0.026437780208541966, 'min_weight_fraction_leaf': 0.010804448623328154, 'max_features': 0.8320907508744055}. Best is trial 52 with value: 0.8098214582394094.[0m
[32m[I 2022-04-21 17:23:43,878][0m Trial 273 finished with value: 0.7907011627675173 and parameters: {'splitter': 'random', 'min_samples_split': 0.4582623222808483, 'min_samples_leaf': 0.03561203560364972, 'min_weight_fraction_leaf': 0.02993545532925973, 'max_features': 0.9367012013147713}. Best is trial 52 with value: 0.8098214582394094.[0m
[32m[I 2022-04-21 17:23:44,703][0m Trial 274 finished with value: 0.8093784233342556 and parameters: {'splitter': 'random', 'min_samples_split': 0.47812713606603846, 'min_samples_leaf': 0.022839724078229214, 'min_weight_fraction_leaf': 0.020217156144807853, 'max_features': 0.9079858661362553}. Best is trial 52 with value: 0.8098214582394094.[0m
[32m[I 2022-04-21 17:23:45,880][0m Trial 275 finished with value: 0.7774681960600297 and parameters: {'splitter': 'random', 'min_samples_split': 0.4774324315061324, 'min_samples_leaf': 0.0018988798178147838, 'min_weight_fraction_leaf': 0.00028656466811879597, 'max_features': 0.742203827026541}. Best is trial 52 with value: 0.8098214582394094.[0m
[32m[I 2022-04-21 17:23:47,571][0m Trial 276 finished with value: 0.7887233277515623 and parameters: {'splitter': 'random', 'min_samples_split': 0.48767014613268606, 'min_samples_leaf': 0.018957755028224263, 'min_weight_fraction_leaf': 0.019507832087844967, 'max_features': 0.9496539026574835}. Best is trial 52 with value: 0.8098214582394094.[0m
[32m[I 2022-04-21 17:23:48,540][0m Trial 277 finished with value: 0.7682350893242956 and parameters: {'splitter': 'random', 'min_samples_split': 0.4690757541016366, 'min_samples_leaf': 0.024331380083856474, 'min_weight_fraction_leaf': 0.009927149898453313, 'max_features': 0.8730593048793509}. Best is trial 52 with value: 0.8098214582394094.[0m
[32m[I 2022-04-21 17:23:49,684][0m Trial 278 finished with value: 0.7957810780959156 and parameters: {'splitter': 'random', 'min_samples_split': 0.2946030195858097, 'min_samples_leaf': 0.013030094483368327, 'min_weight_fraction_leaf': 0.019578495369270074, 'max_features': 0.8930238198573228}. Best is trial 52 with value: 0.8098214582394094.[0m
[32m[I 2022-04-21 17:23:50,360][0m Trial 279 finished with value: 0.7386276461199078 and parameters: {'splitter': 'random', 'min_samples_split': 0.4617846979859658, 'min_samples_leaf': 0.03622719520183813, 'min_weight_fraction_leaf': 0.2544896779299238, 'max_features': 0.6970826188334759}. Best is trial 52 with value: 0.8098214582394094.[0m
[32m[I 2022-04-21 17:23:51,644][0m Trial 280 finished with value: 0.7959079930278019 and parameters: {'splitter': 'random', 'min_samples_split': 0.48146168439734516, 'min_samples_leaf': 0.05311700718212785, 'min_weight_fraction_leaf': 0.09958402476799064, 'max_features': 0.9223597879890372}. Best is trial 52 with value: 0.8098214582394094.[0m
[32m[I 2022-04-21 17:23:52,458][0m Trial 281 finished with value: 0.7852035056309633 and parameters: {'splitter': 'random', 'min_samples_split': 0.3417150252778695, 'min_samples_leaf': 0.02196056298887364, 'min_weight_fraction_leaf': 0.008968473264153839, 'max_features': 0.8514061475561442}. Best is trial 52 with value: 0.8098214582394094.[0m
[32m[I 2022-04-21 17:23:53,198][0m Trial 282 finished with value: 0.7669759123387727 and parameters: {'splitter': 'random', 'min_samples_split': 0.4508165163519966, 'min_samples_leaf': 0.0016562131714385787, 'min_weight_fraction_leaf': 0.028003410695981064, 'max_features': 0.9717499165978841}. Best is trial 52 with value: 0.8098214582394094.[0m
[32m[I 2022-04-21 17:23:55,098][0m Trial 283 finished with value: 0.810095230018675 and parameters: {'splitter': 'random', 'min_samples_split': 0.21374539598767012, 'min_samples_leaf': 0.01221044971697506, 'min_weight_fraction_leaf': 0.08061924223223187, 'max_features': 0.9079730481691105}. Best is trial 283 with value: 0.810095230018675.[0m
[32m[I 2022-04-21 17:23:56,001][0m Trial 284 finished with value: 0.7826753799505408 and parameters: {'splitter': 'random', 'min_samples_split': 0.49165741974780647, 'min_samples_leaf': 0.012721425588350975, 'min_weight_fraction_leaf': 0.08809489561527079, 'max_features': 0.8845258501524982}. Best is trial 283 with value: 0.810095230018675.[0m
[32m[I 2022-04-21 17:23:56,666][0m Trial 285 finished with value: 0.7588833507751127 and parameters: {'splitter': 'random', 'min_samples_split': 0.4733533103427985, 'min_samples_leaf': 0.008101521844981982, 'min_weight_fraction_leaf': 0.10305959903906026, 'max_features': 0.9498393891824053}. Best is trial 283 with value: 0.810095230018675.[0m
[32m[I 2022-04-21 17:23:56,953][0m Trial 286 finished with value: 0.6851609036733942 and parameters: {'splitter': 'random', 'min_samples_split': 0.2129133532708226, 'min_samples_leaf': 0.27835755655181815, 'min_weight_fraction_leaf': 0.08077860824959605, 'max_features': 0.9807333888957219}. Best is trial 283 with value: 0.810095230018675.[0m
[32m[I 2022-04-21 17:23:57,892][0m Trial 287 finished with value: 0.7967010100642509 and parameters: {'splitter': 'random', 'min_samples_split': 0.16276334789096716, 'min_samples_leaf': 0.018262533387038836, 'min_weight_fraction_leaf': 0.019499979349807448, 'max_features': 0.9012757925867514}. Best is trial 283 with value: 0.810095230018675.[0m
[32m[I 2022-04-21 17:23:59,002][0m Trial 288 finished with value: 0.8034308649461976 and parameters: {'splitter': 'random', 'min_samples_split': 0.49933126879825396, 'min_samples_leaf': 0.030714199344109808, 'min_weight_fraction_leaf': 0.0003882600926991645, 'max_features': 0.9296127571373018}. Best is trial 283 with value: 0.810095230018675.[0m
[32m[I 2022-04-21 17:23:59,579][0m Trial 289 finished with value: 0.6851609036733942 and parameters: {'splitter': 'random', 'min_samples_split': 0.24776038754377747, 'min_samples_leaf': 0.36866717360127593, 'min_weight_fraction_leaf': 0.11696708617662475, 'max_features': 0.9596813405131844}. Best is trial 283 with value: 0.810095230018675.[0m
[32m[I 2022-04-21 17:24:00,497][0m Trial 290 finished with value: 0.8041114130336753 and parameters: {'splitter': 'random', 'min_samples_split': 0.19836671844368944, 'min_samples_leaf': 0.025199470191570168, 'min_weight_fraction_leaf': 0.01018175736864387, 'max_features': 0.7889523705444379}. Best is trial 283 with value: 0.810095230018675.[0m
[32m[I 2022-04-21 17:24:01,032][0m Trial 291 finished with value: 0.7470560610037319 and parameters: {'splitter': 'random', 'min_samples_split': 0.18565259271033732, 'min_samples_leaf': 0.22115222835062537, 'min_weight_fraction_leaf': 0.09149335884332152, 'max_features': 0.8720456599907103}. Best is trial 283 with value: 0.810095230018675.[0m
[32m[I 2022-04-21 17:24:02,086][0m Trial 292 finished with value: 0.809714995828562 and parameters: {'splitter': 'random', 'min_samples_split': 0.3193070868503188, 'min_samples_leaf': 0.01051792824289537, 'min_weight_fraction_leaf': 0.020990283896082304, 'max_features': 0.9138381573365241}. Best is trial 283 with value: 0.810095230018675.[0m
[32m[I 2022-04-21 17:24:03,052][0m Trial 293 finished with value: 0.7957810780959156 and parameters: {'splitter': 'random', 'min_samples_split': 0.32330787916175513, 'min_samples_leaf': 0.010826277248521738, 'min_weight_fraction_leaf': 0.019085296780190775, 'max_features': 0.8983928315221388}. Best is trial 283 with value: 0.810095230018675.[0m
[32m[I 2022-04-21 17:24:03,776][0m Trial 294 finished with value: 0.8067402639479017 and parameters: {'splitter': 'random', 'min_samples_split': 0.22987433668966784, 'min_samples_leaf': 0.021254239228264436, 'min_weight_fraction_leaf': 0.023386218771745806, 'max_features': 0.5659592500080222}. Best is trial 283 with value: 0.810095230018675.[0m
[32m[I 2022-04-21 17:24:04,490][0m Trial 295 finished with value: 0.7957581768696851 and parameters: {'splitter': 'random', 'min_samples_split': 0.2192616606408367, 'min_samples_leaf': 0.008982700362576476, 'min_weight_fraction_leaf': 0.02991467306753655, 'max_features': 0.5058070735886996}. Best is trial 283 with value: 0.810095230018675.[0m
[32m[I 2022-04-21 17:24:06,607][0m Trial 296 finished with value: 0.791850202753184 and parameters: {'splitter': 'random', 'min_samples_split': 0.21823027267826087, 'min_samples_leaf': 0.0019523464525075009, 'min_weight_fraction_leaf': 0.01623037532177882, 'max_features': 0.733795234388049}. Best is trial 283 with value: 0.810095230018675.[0m
[32m[I 2022-04-21 17:24:07,556][0m Trial 297 finished with value: 0.7970820363199602 and parameters: {'splitter': 'random', 'min_samples_split': 0.22755536982939428, 'min_samples_leaf': 0.038209742570502796, 'min_weight_fraction_leaf': 0.0359593090473386, 'max_features': 0.9840520521296114}. Best is trial 283 with value: 0.810095230018675.[0m
[32m[I 2022-04-21 17:24:08,348][0m Trial 298 finished with value: 0.8071621576647475 and parameters: {'splitter': 'random', 'min_samples_split': 0.2356895711324618, 'min_samples_leaf': 0.01867158146765966, 'min_weight_fraction_leaf': 0.008680789249031703, 'max_features': 0.9419559225126543}. Best is trial 283 with value: 0.810095230018675.[0m
[32m[I 2022-04-21 17:24:09,952][0m Trial 299 finished with value: 0.7608074382464944 and parameters: {'splitter': 'random', 'min_samples_split': 0.22801564026383736, 'min_samples_leaf': 0.017420302949107288, 'min_weight_fraction_leaf': 0.008335404859944264, 'max_features': 0.2965711515490361}. Best is trial 283 with value: 0.810095230018675.[0m
[32m[I 2022-04-21 17:26:39,769][0m Trial 300 finished with value: 0.7956725763535124 and parameters: {'splitter': 'best', 'min_samples_split': 0.23839114420144825, 'min_samples_leaf': 0.018454107255478185, 'min_weight_fraction_leaf': 0.021545982029845145, 'max_features': 0.9522405820507002}. Best is trial 283 with value: 0.810095230018675.[0m
[32m[I 2022-04-21 17:26:40,433][0m Trial 301 finished with value: 0.5 and parameters: {'splitter': 'random', 'min_samples_split': 0.24142161426427916, 'min_samples_leaf': 0.4963535411854283, 'min_weight_fraction_leaf': 0.0003102994932432726, 'max_features': 0.5740777133509647}. Best is trial 283 with value: 0.810095230018675.[0m
[32m[I 2022-04-21 17:26:40,858][0m Trial 302 finished with value: 0.5 and parameters: {'splitter': 'random', 'min_samples_split': 0.2848071933354119, 'min_samples_leaf': 0.19412635240685427, 'min_weight_fraction_leaf': 0.029458829028285942, 'max_features': 0.17523576673624947}. Best is trial 283 with value: 0.810095230018675.[0m
[32m[I 2022-04-21 17:26:41,715][0m Trial 303 finished with value: 0.7356309129333576 and parameters: {'splitter': 'random', 'min_samples_split': 0.2023521327275223, 'min_samples_leaf': 0.0010424176837167762, 'min_weight_fraction_leaf': 0.014327063698622263, 'max_features': 0.365232416896317}. Best is trial 283 with value: 0.810095230018675.[0m
[32m[I 2022-04-21 17:28:53,994][0m Trial 304 finished with value: 0.7776941145139753 and parameters: {'splitter': 'best', 'min_samples_split': 0.2502997801750641, 'min_samples_leaf': 0.031638986584986296, 'min_weight_fraction_leaf': 0.008494246563505697, 'max_features': 0.9866232315220924}. Best is trial 283 with value: 0.810095230018675.[0m
[32m[I 2022-04-21 17:28:54,872][0m Trial 305 finished with value: 0.7969658937357031 and parameters: {'splitter': 'random', 'min_samples_split': 0.22971708214878164, 'min_samples_leaf': 0.0756049872346822, 'min_weight_fraction_leaf': 0.02462635012286562, 'max_features': 0.9031079353020885}. Best is trial 283 with value: 0.810095230018675.[0m
[32m[I 2022-04-21 17:28:55,239][0m Trial 306 finished with value: 0.6851609036733942 and parameters: {'splitter': 'random', 'min_samples_split': 0.21273930779099162, 'min_samples_leaf': 0.4501199613210728, 'min_weight_fraction_leaf': 0.017642563973756104, 'max_features': 0.9628908491896903}. Best is trial 283 with value: 0.810095230018675.[0m
