[32m[I 2022-05-14 11:58:46,893][0m Trial 470 finished with value: 0.763920593732814 and parameters: {'loss': 'coxph', 'learning_rate': 5.1079291238129286e-05, 'n_estimators': 460, 'criterion': 'friedman_mse', 'min_samples_split': 5, 'min_samples_leaf': 5, 'min_weight_fraction_leaf': 0.0872748415123313, 'min_impurity_decrease': 0.8262459569506889, 'max_features': 0.7789198909040099, 'subsample': 0.09141192401135026, 'dropout_rate': 0.7114385764634067, 'ccp_alpha': 0.22097893268404156}. Best is trial 467 with value: 0.8516197331307722.[0m
[32m[I 2022-05-14 12:15:35,017][0m Trial 471 finished with value: 0.8474039970564895 and parameters: {'loss': 'coxph', 'learning_rate': 4.2776284423062446e-05, 'n_estimators': 371, 'criterion': 'friedman_mse', 'min_samples_split': 4, 'min_samples_leaf': 5, 'min_weight_fraction_leaf': 0.05602761130386918, 'min_impurity_decrease': 0.9315049242588499, 'max_features': 0.8379641857761587, 'subsample': 0.14204655293977844, 'dropout_rate': 0.6888335127309517, 'ccp_alpha': 0.003986216215957017}. Best is trial 467 with value: 0.8516197331307722.[0m
[32m[I 2022-05-14 12:32:29,241][0m Trial 472 finished with value: 0.7689525418291605 and parameters: {'loss': 'coxph', 'learning_rate': 4.103634822554636e-05, 'n_estimators': 377, 'criterion': 'friedman_mse', 'min_samples_split': 5, 'min_samples_leaf': 5, 'min_weight_fraction_leaf': 0.014827705479437778, 'min_impurity_decrease': 0.8850326078884467, 'max_features': 0.7976717106076626, 'subsample': 0.14691066172270292, 'dropout_rate': 0.6872690681312313, 'ccp_alpha': 0.09636583871488208}. Best is trial 467 with value: 0.8516197331307722.[0m
[32m[I 2022-05-14 12:49:02,051][0m Trial 473 finished with value: 0.7698163690351654 and parameters: {'loss': 'coxph', 'learning_rate': 6.720792748804929e-05, 'n_estimators': 360, 'criterion': 'friedman_mse', 'min_samples_split': 3, 'min_samples_leaf': 5, 'min_weight_fraction_leaf': 0.0687004095000226, 'min_impurity_decrease': 0.9391571934147523, 'max_features': 0.8128325763507905, 'subsample': 0.11825049214872438, 'dropout_rate': 0.7221450795197969, 'ccp_alpha': 0.18468179106738467}. Best is trial 467 with value: 0.8516197331307722.[0m
[32m[I 2022-05-14 13:07:45,190][0m Trial 474 finished with value: 0.8404188928130651 and parameters: {'loss': 'coxph', 'learning_rate': 4.829069515420745e-05, 'n_estimators': 392, 'criterion': 'friedman_mse', 'min_samples_split': 4, 'min_samples_leaf': 5, 'min_weight_fraction_leaf': 0.028700771310816404, 'min_impurity_decrease': 0.7974882613149307, 'max_features': 0.8354787191202065, 'subsample': 0.10022504631020489, 'dropout_rate': 0.6572217605250603, 'ccp_alpha': 0.005577250715671547}. Best is trial 467 with value: 0.8516197331307722.[0m
[32m[I 2022-05-14 13:25:36,961][0m Trial 475 finished with value: 0.7758590966617389 and parameters: {'loss': 'coxph', 'learning_rate': 0.00011628475128406335, 'n_estimators': 389, 'criterion': 'friedman_mse', 'min_samples_split': 4, 'min_samples_leaf': 5, 'min_weight_fraction_leaf': 0.051594890263477494, 'min_impurity_decrease': 0.7913566968507318, 'max_features': 0.834547217240313, 'subsample': 0.1310923757297554, 'dropout_rate': 0.6378392832822126, 'ccp_alpha': 0.10823351052683296}. Best is trial 467 with value: 0.8516197331307722.[0m
/media/san2_ssd/data/Workdir/survival/venv/lib/python3.8/site-packages/sksurv/ensemble/boosting.py:955: RuntimeWarning: divide by zero encountered in log
  time = numpy.log(time)
/media/san2_ssd/data/Workdir/survival/venv/lib/python3.8/site-packages/sksurv/ensemble/boosting.py:955: RuntimeWarning: divide by zero encountered in log
  time = numpy.log(time)
/media/san2_ssd/data/Workdir/survival/venv/lib/python3.8/site-packages/sksurv/ensemble/boosting.py:955: RuntimeWarning: divide by zero encountered in log
  time = numpy.log(time)
/media/san2_ssd/data/Workdir/survival/venv/lib/python3.8/site-packages/sksurv/ensemble/boosting.py:955: RuntimeWarning: divide by zero encountered in log
  time = numpy.log(time)
/media/san2_ssd/data/Workdir/survival/venv/lib/python3.8/site-packages/sksurv/ensemble/boosting.py:955: RuntimeWarning: divide by zero encountered in log
  time = numpy.log(time)
[32m[I 2022-05-14 13:25:37,026][0m Trial 476 finished with value: -1.0 and parameters: {'loss': 'squared', 'learning_rate': 8.047197306421148e-05, 'n_estimators': 412, 'criterion': 'friedman_mse', 'min_samples_split': 4, 'min_samples_leaf': 5, 'min_weight_fraction_leaf': 0.031974371242516814, 'min_impurity_decrease': 0.7836359899157865, 'max_features': 0.8004084311718772, 'subsample': 0.10255594771874654, 'dropout_rate': 0.6598947510445383, 'ccp_alpha': 0.005986884451868797}. Best is trial 467 with value: 0.8516197331307722.[0m
[32m[I 2022-05-14 13:45:08,188][0m Trial 477 finished with value: 0.852091417636734 and parameters: {'loss': 'coxph', 'learning_rate': 5.5257996706924015e-05, 'n_estimators': 433, 'criterion': 'friedman_mse', 'min_samples_split': 4, 'min_samples_leaf': 5, 'min_weight_fraction_leaf': 0.10476479151576301, 'min_impurity_decrease': 0.9235097719181223, 'max_features': 0.7718545939380324, 'subsample': 0.15442287267201416, 'dropout_rate': 0.6894221951035167, 'ccp_alpha': 0.0015759927588878879}. Best is trial 477 with value: 0.852091417636734.[0m
[32m[I 2022-05-14 14:05:05,760][0m Trial 478 finished with value: 0.739698045027106 and parameters: {'loss': 'coxph', 'learning_rate': 6.0182593285787435e-05, 'n_estimators': 446, 'criterion': 'friedman_mse', 'min_samples_split': 4, 'min_samples_leaf': 5, 'min_weight_fraction_leaf': 0.06584471555502074, 'min_impurity_decrease': 0.9130867196772243, 'max_features': 0.8050525694385323, 'subsample': 0.15231626317029454, 'dropout_rate': 0.6852156836060856, 'ccp_alpha': 0.31606164298137956}. Best is trial 477 with value: 0.852091417636734.[0m
[32m[I 2022-05-14 14:25:07,706][0m Trial 479 finished with value: 0.7629331386047549 and parameters: {'loss': 'coxph', 'learning_rate': 4.8448086479818946e-05, 'n_estimators': 437, 'criterion': 'friedman_mse', 'min_samples_split': 4, 'min_samples_leaf': 5, 'min_weight_fraction_leaf': 0.11924204643479513, 'min_impurity_decrease': 0.9741417148100286, 'max_features': 0.7895111155793282, 'subsample': 0.13423543124212595, 'dropout_rate': 0.6592818971156869, 'ccp_alpha': 0.2081741641116313}. Best is trial 477 with value: 0.852091417636734.[0m
[32m[I 2022-05-14 14:44:27,939][0m Trial 480 finished with value: 0.782540174244585 and parameters: {'loss': 'coxph', 'learning_rate': 4.173031243538042e-05, 'n_estimators': 399, 'criterion': 'friedman_mse', 'min_samples_split': 4, 'min_samples_leaf': 5, 'min_weight_fraction_leaf': 0.10830733741296467, 'min_impurity_decrease': 0.9241227812908114, 'max_features': 0.7543623827867988, 'subsample': 0.08627469711864981, 'dropout_rate': 0.6130520542220037, 'ccp_alpha': 0.10419393030503911}. Best is trial 477 with value: 0.852091417636734.[0m
[32m[I 2022-05-14 15:01:41,475][0m Trial 481 finished with value: 0.8494844650414717 and parameters: {'loss': 'coxph', 'learning_rate': 3.505743577207919e-05, 'n_estimators': 371, 'criterion': 'friedman_mse', 'min_samples_split': 4, 'min_samples_leaf': 5, 'min_weight_fraction_leaf': 0.05970723213944894, 'min_impurity_decrease': 0.8148774660260858, 'max_features': 0.7690606751594731, 'subsample': 0.11782212593848806, 'dropout_rate': 0.7021725684242636, 'ccp_alpha': 0.003651375671631642}. Best is trial 477 with value: 0.852091417636734.[0m
[32m[I 2022-05-14 15:24:54,585][0m Trial 482 finished with value: 0.7699583883886848 and parameters: {'loss': 'coxph', 'learning_rate': 6.40984855830269e-05, 'n_estimators': 500, 'criterion': 'friedman_mse', 'min_samples_split': 4, 'min_samples_leaf': 5, 'min_weight_fraction_leaf': 0.055870621359799214, 'min_impurity_decrease': 0.8166819204823422, 'max_features': 0.7683527182028996, 'subsample': 0.12310551135787427, 'dropout_rate': 0.7024134708592836, 'ccp_alpha': 0.18238364134485024}. Best is trial 477 with value: 0.852091417636734.[0m
[32m[I 2022-05-14 15:41:39,513][0m Trial 483 finished with value: 0.8523596708873636 and parameters: {'loss': 'coxph', 'learning_rate': 4.768503825094363e-05, 'n_estimators': 376, 'criterion': 'friedman_mse', 'min_samples_split': 4, 'min_samples_leaf': 5, 'min_weight_fraction_leaf': 0.07778761297081223, 'min_impurity_decrease': 0.7160813220089441, 'max_features': 0.7415614575380414, 'subsample': 0.15536336749726062, 'dropout_rate': 0.7128979079495745, 'ccp_alpha': 0.002399975728487624}. Best is trial 483 with value: 0.8523596708873636.[0m
[32m[I 2022-05-14 15:58:08,363][0m Trial 484 finished with value: 0.7876728908805768 and parameters: {'loss': 'coxph', 'learning_rate': 8.514831286067947e-05, 'n_estimators': 376, 'criterion': 'friedman_mse', 'min_samples_split': 4, 'min_samples_leaf': 5, 'min_weight_fraction_leaf': 0.08811607374793295, 'min_impurity_decrease': 0.7319655936424551, 'max_features': 0.7458716715657661, 'subsample': 0.1640766731022774, 'dropout_rate': 0.7164717320116828, 'ccp_alpha': 0.09716554433282718}. Best is trial 483 with value: 0.8523596708873636.[0m
[32m[I 2022-05-14 16:17:03,544][0m Trial 485 finished with value: 0.5 and parameters: {'loss': 'coxph', 'learning_rate': 5.463164447596509e-05, 'n_estimators': 418, 'criterion': 'friedman_mse', 'min_samples_split': 4, 'min_samples_leaf': 6, 'min_weight_fraction_leaf': 0.033367735180085546, 'min_impurity_decrease': 0.7597117321645417, 'max_features': 0.7813763209188113, 'subsample': 0.13503141555162776, 'dropout_rate': 0.6936514359999887, 'ccp_alpha': 1.599001884356842}. Best is trial 483 with value: 0.8523596708873636.[0m
[32m[I 2022-05-14 16:33:57,475][0m Trial 486 finished with value: 0.7581342342744543 and parameters: {'loss': 'coxph', 'learning_rate': 4.584154982521178e-05, 'n_estimators': 380, 'criterion': 'friedman_mse', 'min_samples_split': 4, 'min_samples_leaf': 5, 'min_weight_fraction_leaf': 0.07515918769728079, 'min_impurity_decrease': 0.8371397890223724, 'max_features': 0.7722283029609399, 'subsample': 0.1492958731445896, 'dropout_rate': 0.7248449592651004, 'ccp_alpha': 0.262155770345928}. Best is trial 483 with value: 0.8523596708873636.[0m
[32m[I 2022-05-14 16:52:30,774][0m Trial 487 finished with value: 0.7808246089876324 and parameters: {'loss': 'coxph', 'learning_rate': 3.614337772130116e-05, 'n_estimators': 401, 'criterion': 'friedman_mse', 'min_samples_split': 4, 'min_samples_leaf': 5, 'min_weight_fraction_leaf': 0.060278599724559206, 'min_impurity_decrease': 0.7927050053476545, 'max_features': 0.7686669556935772, 'subsample': 0.11809242517465945, 'dropout_rate': 0.6998595378922436, 'ccp_alpha': 0.16004917654256007}. Best is trial 483 with value: 0.8523596708873636.[0m
[32m[I 2022-05-14 17:11:31,652][0m Trial 488 finished with value: 0.7909670371836226 and parameters: {'loss': 'coxph', 'learning_rate': 6.989206816106536e-05, 'n_estimators': 390, 'criterion': 'friedman_mse', 'min_samples_split': 4, 'min_samples_leaf': 5, 'min_weight_fraction_leaf': 0.0944016279429198, 'min_impurity_decrease': 0.6994341604308753, 'max_features': 0.7800509812067691, 'subsample': 0.07299228570311915, 'dropout_rate': 0.680354411675, 'ccp_alpha': 0.09524625148908096}. Best is trial 483 with value: 0.8523596708873636.[0m
[32m[I 2022-05-14 17:33:28,407][0m Trial 489 finished with value: 0.8472497430672078 and parameters: {'loss': 'coxph', 'learning_rate': 4.686476742281217e-05, 'n_estimators': 430, 'criterion': 'friedman_mse', 'min_samples_split': 3, 'min_samples_leaf': 5, 'min_weight_fraction_leaf': 0.027023900547604188, 'min_impurity_decrease': 0.7663089950316906, 'max_features': 0.8197252252010305, 'subsample': 0.03991124096876671, 'dropout_rate': 0.704816377806079, 'ccp_alpha': 0.003179313354317767}. Best is trial 483 with value: 0.8523596708873636.[0m
[32m[I 2022-05-14 17:55:35,764][0m Trial 490 finished with value: 0.7494931043601476 and parameters: {'loss': 'coxph', 'learning_rate': 5.065060981824316e-05, 'n_estimators': 427, 'criterion': 'friedman_mse', 'min_samples_split': 3, 'min_samples_leaf': 5, 'min_weight_fraction_leaf': 0.08234638823602887, 'min_impurity_decrease': 0.7486169756944806, 'max_features': 0.7376032366774097, 'subsample': 0.015698980263090943, 'dropout_rate': 0.7117156922947427, 'ccp_alpha': 0.4117572033975891}. Best is trial 483 with value: 0.8523596708873636.[0m
[32m[I 2022-05-14 18:19:56,677][0m Trial 491 finished with value: 0.7686812052810128 and parameters: {'loss': 'coxph', 'learning_rate': 6.035363571039387e-05, 'n_estimators': 469, 'criterion': 'friedman_mse', 'min_samples_split': 5, 'min_samples_leaf': 5, 'min_weight_fraction_leaf': 0.04319275206133382, 'min_impurity_decrease': 0.7639863531536983, 'max_features': 0.7334143805252417, 'subsample': 0.02800072262130484, 'dropout_rate': 0.6395131585305134, 'ccp_alpha': 0.261528448848852}. Best is trial 483 with value: 0.8523596708873636.[0m
[32m[I 2022-05-14 18:47:47,535][0m Trial 492 finished with value: 0.7967859974308336 and parameters: {'loss': 'coxph', 'learning_rate': 3.971797288237569e-05, 'n_estimators': 546, 'criterion': 'friedman_mse', 'min_samples_split': 3, 'min_samples_leaf': 5, 'min_weight_fraction_leaf': 0.01812823363818082, 'min_impurity_decrease': 0.8080159321453492, 'max_features': 0.8113300823399598, 'subsample': 0.04647153343928069, 'dropout_rate': 0.6866475917765378, 'ccp_alpha': 0.09122652523070479}. Best is trial 483 with value: 0.8523596708873636.[0m
[32m[I 2022-05-14 19:09:56,016][0m Trial 493 finished with value: 0.7643569219449017 and parameters: {'loss': 'coxph', 'learning_rate': 4.45806984548402e-05, 'n_estimators': 447, 'criterion': 'friedman_mse', 'min_samples_split': 3, 'min_samples_leaf': 5, 'min_weight_fraction_leaf': 0.00633057304217103, 'min_impurity_decrease': 0.7780422186141912, 'max_features': 0.8194873374804117, 'subsample': 0.06508107846388764, 'dropout_rate': 0.6709985429047055, 'ccp_alpha': 0.1743000957580217}. Best is trial 483 with value: 0.8523596708873636.[0m
[32m[I 2022-05-14 19:28:16,730][0m Trial 494 finished with value: 0.848908565049552 and parameters: {'loss': 'coxph', 'learning_rate': 0.00010888040388710966, 'n_estimators': 365, 'criterion': 'friedman_mse', 'min_samples_split': 4, 'min_samples_leaf': 6, 'min_weight_fraction_leaf': 0.09948716647932164, 'min_impurity_decrease': 0.7297147064710124, 'max_features': 0.7866809995188146, 'subsample': 0.04488036460781443, 'dropout_rate': 0.7270613559506316, 'ccp_alpha': 0.0042976607923900035}. Best is trial 483 with value: 0.8523596708873636.[0m
[32m[I 2022-05-14 19:46:40,304][0m Trial 495 finished with value: 0.7928699175238777 and parameters: {'loss': 'coxph', 'learning_rate': 9.036756633502812e-05, 'n_estimators': 366, 'criterion': 'friedman_mse', 'min_samples_split': 5, 'min_samples_leaf': 6, 'min_weight_fraction_leaf': 0.10614277039883355, 'min_impurity_decrease': 0.74025674494349, 'max_features': 0.7883645267182332, 'subsample': 0.04050389497974415, 'dropout_rate': 0.7292643109333213, 'ccp_alpha': 0.09994202412563825}. Best is trial 483 with value: 0.8523596708873636.[0m
/media/san2_ssd/data/Workdir/survival/venv/lib/python3.8/site-packages/sksurv/ensemble/boosting.py:955: RuntimeWarning: divide by zero encountered in log
  time = numpy.log(time)
/media/san2_ssd/data/Workdir/survival/venv/lib/python3.8/site-packages/sksurv/ensemble/boosting.py:955: RuntimeWarning: divide by zero encountered in log
  time = numpy.log(time)
/media/san2_ssd/data/Workdir/survival/venv/lib/python3.8/site-packages/sksurv/ensemble/boosting.py:955: RuntimeWarning: divide by zero encountered in log
  time = numpy.log(time)
/media/san2_ssd/data/Workdir/survival/venv/lib/python3.8/site-packages/sksurv/ensemble/boosting.py:955: RuntimeWarning: divide by zero encountered in log
  time = numpy.log(time)
/media/san2_ssd/data/Workdir/survival/venv/lib/python3.8/site-packages/sksurv/ensemble/boosting.py:955: RuntimeWarning: divide by zero encountered in log
  time = numpy.log(time)
[32m[I 2022-05-14 19:46:40,371][0m Trial 496 finished with value: -1.0 and parameters: {'loss': 'squared', 'learning_rate': 0.00011222114323797268, 'n_estimators': 351, 'criterion': 'friedman_mse', 'min_samples_split': 2, 'min_samples_leaf': 6, 'min_weight_fraction_leaf': 0.07600571928194835, 'min_impurity_decrease': 0.7145302299975523, 'max_features': 0.7633294809280557, 'subsample': 0.004787430731804765, 'dropout_rate': 0.7071197254953155, 'ccp_alpha': 0.33240654049610663}. Best is trial 483 with value: 0.8523596708873636.[0m
[32m[I 2022-05-14 20:07:07,549][0m Trial 497 finished with value: 0.5 and parameters: {'loss': 'coxph', 'learning_rate': 0.00017075862602380364, 'n_estimators': 410, 'criterion': 'friedman_mse', 'min_samples_split': 4, 'min_samples_leaf': 6, 'min_weight_fraction_leaf': 0.06326985019930415, 'min_impurity_decrease': 0.7217934685284988, 'max_features': 0.7992722761217282, 'subsample': 0.04569984542190492, 'dropout_rate': 0.7253557119493463, 'ccp_alpha': 0.8872398372470974}. Best is trial 483 with value: 0.8523596708873636.[0m
[32m[I 2022-05-14 20:25:01,272][0m Trial 498 finished with value: 0.7875858886129418 and parameters: {'loss': 'coxph', 'learning_rate': 7.632107339818547e-05, 'n_estimators': 368, 'criterion': 'friedman_mse', 'min_samples_split': 5, 'min_samples_leaf': 6, 'min_weight_fraction_leaf': 0.10644945330641309, 'min_impurity_decrease': 0.9397836180273856, 'max_features': 0.7450976758192668, 'subsample': 0.07209528847150183, 'dropout_rate': 0.6974718946104204, 'ccp_alpha': 0.094903073322365}. Best is trial 483 with value: 0.8523596708873636.[0m
[32m[I 2022-05-14 20:47:12,483][0m Trial 499 finished with value: 0.8453569128747163 and parameters: {'loss': 'coxph', 'learning_rate': 3.4499404832281206e-05, 'n_estimators': 431, 'criterion': 'friedman_mse', 'min_samples_split': 4, 'min_samples_leaf': 5, 'min_weight_fraction_leaf': 0.09661319664328799, 'min_impurity_decrease': 0.8975781423430544, 'max_features': 0.7792995788834409, 'subsample': 0.028560220367504646, 'dropout_rate': 0.7346722332450294, 'ccp_alpha': 0.002334318259337086}. Best is trial 483 with value: 0.8523596708873636.[0m
[32m[I 2022-05-14 21:08:59,161][0m Trial 500 finished with value: 0.7663768627035109 and parameters: {'loss': 'coxph', 'learning_rate': 3.5503340863377877e-05, 'n_estimators': 431, 'criterion': 'friedman_mse', 'min_samples_split': 4, 'min_samples_leaf': 5, 'min_weight_fraction_leaf': 0.09781892780538248, 'min_impurity_decrease': 0.8543547853039546, 'max_features': 0.7839590485117836, 'subsample': 0.04196221829702514, 'dropout_rate': 0.7092812747474526, 'ccp_alpha': 0.21369320925962035}. Best is trial 483 with value: 0.8523596708873636.[0m
[32m[I 2022-05-14 21:32:14,418][0m Trial 501 finished with value: 0.8096271854049812 and parameters: {'loss': 'coxph', 'learning_rate': 3.580314514375651e-05, 'n_estimators': 451, 'criterion': 'friedman_mse', 'min_samples_split': 4, 'min_samples_leaf': 4, 'min_weight_fraction_leaf': 0.08506048700431802, 'min_impurity_decrease': 0.9046719186776941, 'max_features': 0.8034485831182647, 'subsample': 0.023862291952639832, 'dropout_rate': 0.736877258666558, 'ccp_alpha': 0.09329867691000683}. Best is trial 483 with value: 0.8523596708873636.[0m
[32m[I 2022-05-14 21:52:37,198][0m Trial 502 finished with value: 0.8521363559583275 and parameters: {'loss': 'coxph', 'learning_rate': 6.342631907176564e-05, 'n_estimators': 410, 'criterion': 'friedman_mse', 'min_samples_split': 4, 'min_samples_leaf': 5, 'min_weight_fraction_leaf': 0.09344505235206964, 'min_impurity_decrease': 0.9292541669600207, 'max_features': 0.7645246230283663, 'subsample': 0.06386596348343329, 'dropout_rate': 0.6867021777843161, 'ccp_alpha': 0.0022774768440953328}. Best is trial 483 with value: 0.8523596708873636.[0m
[32m[I 2022-05-14 22:17:22,871][0m Trial 503 finished with value: 0.8512037719002652 and parameters: {'loss': 'coxph', 'learning_rate': 6.001159514312622e-05, 'n_estimators': 488, 'criterion': 'friedman_mse', 'min_samples_split': 4, 'min_samples_leaf': 5, 'min_weight_fraction_leaf': 0.0887861928266425, 'min_impurity_decrease': 0.9343938553076406, 'max_features': 0.7297573703967429, 'subsample': 0.05396448381042783, 'dropout_rate': 0.6781749381443019, 'ccp_alpha': 0.0027880398475256325}. Best is trial 483 with value: 0.8523596708873636.[0m
[32m[I 2022-05-14 22:42:05,145][0m Trial 504 finished with value: 0.7651517348572672 and parameters: {'loss': 'coxph', 'learning_rate': 6.965236706545903e-05, 'n_estimators': 494, 'criterion': 'friedman_mse', 'min_samples_split': 4, 'min_samples_leaf': 5, 'min_weight_fraction_leaf': 0.09281544991930878, 'min_impurity_decrease': 0.9291224009630262, 'max_features': 0.7236880314979681, 'subsample': 0.05898768812898571, 'dropout_rate': 0.6791164539294728, 'ccp_alpha': 0.19083416646079732}. Best is trial 483 with value: 0.8523596708873636.[0m
[32m[I 2022-05-14 23:02:45,558][0m Trial 505 finished with value: 0.5 and parameters: {'loss': 'coxph', 'learning_rate': 5.990936528589634e-05, 'n_estimators': 428, 'criterion': 'friedman_mse', 'min_samples_split': 4, 'min_samples_leaf': 5, 'min_weight_fraction_leaf': 0.08431908085182288, 'min_impurity_decrease': 0.9560151356145425, 'max_features': 0.7557367233098892, 'subsample': 0.07796616871998532, 'dropout_rate': 0.6861421415565531, 'ccp_alpha': 2.8302415808513977}. Best is trial 483 with value: 0.8523596708873636.[0m
[32m[I 2022-05-14 23:27:29,750][0m Trial 506 finished with value: 0.8525407582567747 and parameters: {'loss': 'coxph', 'learning_rate': 0.0001011899622139033, 'n_estimators': 517, 'criterion': 'friedman_mse', 'min_samples_split': 4, 'min_samples_leaf': 5, 'min_weight_fraction_leaf': 0.09648384093416845, 'min_impurity_decrease': 0.909739057581749, 'max_features': 0.7291346864765277, 'subsample': 0.10782706979680463, 'dropout_rate': 0.701968578269612, 'ccp_alpha': 0.0016624165178188806}. Best is trial 506 with value: 0.8525407582567747.[0m
