[32m[I 2022-04-21 13:34:18,999][0m Trial 745 finished with value: 0.901307764010767 and parameters: {'splitter': 'random', 'min_samples_split': 0.06782524403821041, 'min_samples_leaf': 0.0406664504715195, 'min_weight_fraction_leaf': 0.0003877520740579142, 'max_features': 0.9327278351786251}. Best is trial 677 with value: 0.9113497956229912.[0m
[32m[I 2022-04-21 13:37:08,455][0m Trial 746 finished with value: 0.8800741437236865 and parameters: {'splitter': 'best', 'min_samples_split': 0.05079408043320875, 'min_samples_leaf': 0.03906837104233908, 'min_weight_fraction_leaf': 0.015393250404511154, 'max_features': 0.97366980631727}. Best is trial 677 with value: 0.9113497956229912.[0m
[32m[I 2022-04-21 13:37:10,803][0m Trial 747 finished with value: 0.9037203765356641 and parameters: {'splitter': 'random', 'min_samples_split': 0.0342417063262446, 'min_samples_leaf': 0.0332582275727409, 'min_weight_fraction_leaf': 0.02778884971717888, 'max_features': 0.9482208384538064}. Best is trial 677 with value: 0.9113497956229912.[0m
[32m[I 2022-04-21 13:37:13,149][0m Trial 748 finished with value: 0.9068911098091308 and parameters: {'splitter': 'random', 'min_samples_split': 0.011632139762217386, 'min_samples_leaf': 0.011769423543951097, 'min_weight_fraction_leaf': 0.07163418983935718, 'max_features': 0.9240148855645761}. Best is trial 677 with value: 0.9113497956229912.[0m
[32m[I 2022-04-21 13:37:14,884][0m Trial 749 finished with value: 0.895032418842477 and parameters: {'splitter': 'random', 'min_samples_split': 0.05833800749807754, 'min_samples_leaf': 0.05961144161561424, 'min_weight_fraction_leaf': 0.010547003426797923, 'max_features': 0.9627357396186138}. Best is trial 677 with value: 0.9113497956229912.[0m
[32m[I 2022-04-21 13:37:17,537][0m Trial 750 finished with value: 0.9045718234905971 and parameters: {'splitter': 'random', 'min_samples_split': 0.07764823314790228, 'min_samples_leaf': 0.019184217438848156, 'min_weight_fraction_leaf': 0.012122674841809945, 'max_features': 0.8958568844967902}. Best is trial 677 with value: 0.9113497956229912.[0m
[32m[I 2022-04-21 13:37:21,617][0m Trial 751 finished with value: 0.9060494330738085 and parameters: {'splitter': 'random', 'min_samples_split': 0.2022868617142688, 'min_samples_leaf': 0.010420729425369887, 'min_weight_fraction_leaf': 0.0231918890856738, 'max_features': 0.9124810645456792}. Best is trial 677 with value: 0.9113497956229912.[0m
[32m[I 2022-04-21 13:37:24,073][0m Trial 752 finished with value: 0.8747265025785319 and parameters: {'splitter': 'random', 'min_samples_split': 0.04576841844654552, 'min_samples_leaf': 0.02407011542093314, 'min_weight_fraction_leaf': 0.2005542015223757, 'max_features': 0.8597565293367858}. Best is trial 677 with value: 0.9113497956229912.[0m
[32m[I 2022-04-21 13:37:26,150][0m Trial 753 finished with value: 0.9010934120632308 and parameters: {'splitter': 'random', 'min_samples_split': 0.062460393198027105, 'min_samples_leaf': 0.048483691032118297, 'min_weight_fraction_leaf': 0.01828565334749106, 'max_features': 0.8860866478124321}. Best is trial 677 with value: 0.9113497956229912.[0m
[32m[I 2022-04-21 13:37:27,071][0m Trial 754 finished with value: 0.3425804518366971 and parameters: {'splitter': 'random', 'min_samples_split': 0.028067348354681006, 'min_samples_leaf': 0.28108921330681025, 'min_weight_fraction_leaf': 0.3836419431620972, 'max_features': 0.9415634605682919}. Best is trial 677 with value: 0.9113497956229912.[0m
/media/san2_ssd/data/Workdir/survival/utils.py:305: RuntimeWarning: invalid value encountered in true_divide
  pdfs = np.gradient(1-survs,axis=1)/norms
/media/san2_ssd/data/Workdir/survival/utils.py:305: RuntimeWarning: invalid value encountered in true_divide
  pdfs = np.gradient(1-survs,axis=1)/norms
[32m[I 2022-04-21 13:37:29,654][0m Trial 755 finished with value: 0.8872173997610775 and parameters: {'splitter': 'random', 'min_samples_split': 0.04694837566002977, 'min_samples_leaf': 0.001469721957799387, 'min_weight_fraction_leaf': 0.0006794567025802875, 'max_features': 0.9126383652516805}. Best is trial 677 with value: 0.9113497956229912.[0m
[32m[I 2022-04-21 13:37:31,582][0m Trial 756 finished with value: 0.9008314675145135 and parameters: {'splitter': 'random', 'min_samples_split': 0.16635382194259138, 'min_samples_leaf': 0.0339736969609536, 'min_weight_fraction_leaf': 0.012353962156863284, 'max_features': 0.9805826671204304}. Best is trial 677 with value: 0.9113497956229912.[0m
[32m[I 2022-04-21 13:37:33,539][0m Trial 757 finished with value: 0.8989568511519733 and parameters: {'splitter': 'random', 'min_samples_split': 0.022721070222718243, 'min_samples_leaf': 0.018794414985408268, 'min_weight_fraction_leaf': 0.05229033991806949, 'max_features': 0.876355966674537}. Best is trial 677 with value: 0.9113497956229912.[0m
[32m[I 2022-04-21 13:37:34,851][0m Trial 758 finished with value: 0.9062022122659787 and parameters: {'splitter': 'random', 'min_samples_split': 0.04376544203057211, 'min_samples_leaf': 0.06532149296208176, 'min_weight_fraction_leaf': 0.02329858853164853, 'max_features': 0.9284029644780499}. Best is trial 677 with value: 0.9113497956229912.[0m
[32m[I 2022-04-21 13:37:36,983][0m Trial 759 finished with value: 0.9007285034987813 and parameters: {'splitter': 'random', 'min_samples_split': 0.057212903753098954, 'min_samples_leaf': 0.04542454045438316, 'min_weight_fraction_leaf': 0.030624425625377028, 'max_features': 0.9465267447389349}. Best is trial 677 with value: 0.9113497956229912.[0m
[32m[I 2022-04-21 13:37:40,030][0m Trial 760 finished with value: 0.8985926428317897 and parameters: {'splitter': 'random', 'min_samples_split': 0.008933553666194369, 'min_samples_leaf': 0.026169158487443365, 'min_weight_fraction_leaf': 0.04207149758814678, 'max_features': 0.9626649224443019}. Best is trial 677 with value: 0.9113497956229912.[0m
[32m[I 2022-04-21 13:37:42,201][0m Trial 761 finished with value: 0.9062492856134329 and parameters: {'splitter': 'random', 'min_samples_split': 0.03538675275033614, 'min_samples_leaf': 0.038620964003936345, 'min_weight_fraction_leaf': 0.06293143803893335, 'max_features': 0.9292843300381767}. Best is trial 677 with value: 0.9113497956229912.[0m
[32m[I 2022-04-21 13:37:44,605][0m Trial 762 finished with value: 0.9019224779523574 and parameters: {'splitter': 'random', 'min_samples_split': 0.019633006601272294, 'min_samples_leaf': 0.034092615278027545, 'min_weight_fraction_leaf': 0.05059316132193195, 'max_features': 0.8973455448955598}. Best is trial 677 with value: 0.9113497956229912.[0m
[32m[I 2022-04-21 13:37:46,202][0m Trial 763 finished with value: 0.8797245818194697 and parameters: {'splitter': 'random', 'min_samples_split': 0.11593061830654103, 'min_samples_leaf': 0.2243463923495956, 'min_weight_fraction_leaf': 0.016438402519890784, 'max_features': 0.9175797994535567}. Best is trial 677 with value: 0.9113497956229912.[0m
[32m[I 2022-04-21 13:37:47,652][0m Trial 764 finished with value: 0.9043294038359925 and parameters: {'splitter': 'random', 'min_samples_split': 0.005089899360358231, 'min_samples_leaf': 0.011778533311358192, 'min_weight_fraction_leaf': 0.03796226193490726, 'max_features': 0.9762124308578224}. Best is trial 677 with value: 0.9113497956229912.[0m
[32m[I 2022-04-21 13:40:36,195][0m Trial 765 finished with value: 0.8833409953731335 and parameters: {'splitter': 'best', 'min_samples_split': 0.08545857515227778, 'min_samples_leaf': 0.04815289195083872, 'min_weight_fraction_leaf': 0.008500947294083017, 'max_features': 0.9473862298395112}. Best is trial 677 with value: 0.9113497956229912.[0m
[32m[I 2022-04-21 13:40:37,981][0m Trial 766 finished with value: 0.8992375277910541 and parameters: {'splitter': 'random', 'min_samples_split': 0.06511245273893838, 'min_samples_leaf': 0.06276371579360346, 'min_weight_fraction_leaf': 0.024006751795608676, 'max_features': 0.8906426800637424}. Best is trial 677 with value: 0.9113497956229912.[0m
[32m[I 2022-04-21 13:40:39,947][0m Trial 767 finished with value: 0.9008722581953383 and parameters: {'splitter': 'random', 'min_samples_split': 0.07214542927767607, 'min_samples_leaf': 0.03797299287283768, 'min_weight_fraction_leaf': 0.02741386500146191, 'max_features': 0.9304068510137934}. Best is trial 677 with value: 0.9113497956229912.[0m
[32m[I 2022-04-21 13:40:41,870][0m Trial 768 finished with value: 0.8987113981507207 and parameters: {'splitter': 'random', 'min_samples_split': 0.031116855131357733, 'min_samples_leaf': 0.03336845909340872, 'min_weight_fraction_leaf': 0.0449481754612029, 'max_features': 0.9665174537659356}. Best is trial 677 with value: 0.9113497956229912.[0m
[32m[I 2022-04-21 13:40:42,877][0m Trial 769 finished with value: 0.3425804518366971 and parameters: {'splitter': 'random', 'min_samples_split': 0.05015977948214277, 'min_samples_leaf': 0.3502293974620841, 'min_weight_fraction_leaf': 0.01706681448022479, 'max_features': 0.947981886637121}. Best is trial 677 with value: 0.9113497956229912.[0m
/media/san2_ssd/data/Workdir/survival/utils.py:305: RuntimeWarning: invalid value encountered in true_divide
  pdfs = np.gradient(1-survs,axis=1)/norms
[32m[I 2022-04-21 13:40:45,263][0m Trial 770 finished with value: 0.9004306433425286 and parameters: {'splitter': 'random', 'min_samples_split': 0.05666337728709344, 'min_samples_leaf': 0.009587437807955821, 'min_weight_fraction_leaf': 8.132618831638294e-05, 'max_features': 0.903995093281131}. Best is trial 677 with value: 0.9113497956229912.[0m
[32m[I 2022-04-21 13:40:49,208][0m Trial 771 finished with value: 0.909165075309631 and parameters: {'splitter': 'random', 'min_samples_split': 0.07574343264328767, 'min_samples_leaf': 0.0014422357272671832, 'min_weight_fraction_leaf': 0.030388194628133774, 'max_features': 0.9095245135395268}. Best is trial 677 with value: 0.9113497956229912.[0m
[32m[I 2022-04-21 13:40:51,654][0m Trial 772 finished with value: 0.9066472692687254 and parameters: {'splitter': 'random', 'min_samples_split': 0.09298797951393623, 'min_samples_leaf': 0.0013149781981177736, 'min_weight_fraction_leaf': 0.009813303100449252, 'max_features': 0.8491775868024128}. Best is trial 677 with value: 0.9113497956229912.[0m
[32m[I 2022-04-21 13:40:53,284][0m Trial 773 finished with value: 0.903075220830123 and parameters: {'splitter': 'random', 'min_samples_split': 0.08144271288801465, 'min_samples_leaf': 0.017696655679391844, 'min_weight_fraction_leaf': 0.020783414561349176, 'max_features': 0.9212256388360949}. Best is trial 677 with value: 0.9113497956229912.[0m
[32m[I 2022-04-21 13:40:55,806][0m Trial 774 finished with value: 0.9016046532652758 and parameters: {'splitter': 'random', 'min_samples_split': 0.09146987766715829, 'min_samples_leaf': 0.022633308134907472, 'min_weight_fraction_leaf': 0.03148794160907915, 'max_features': 0.8729524606438834}. Best is trial 677 with value: 0.9113497956229912.[0m
[32m[I 2022-04-21 13:40:59,543][0m Trial 775 finished with value: 0.9013083365345068 and parameters: {'splitter': 'random', 'min_samples_split': 0.07051167400573041, 'min_samples_leaf': 0.0020261827899095853, 'min_weight_fraction_leaf': 0.031897763426199474, 'max_features': 0.8947467249002697}. Best is trial 677 with value: 0.9113497956229912.[0m
[32m[I 2022-04-21 13:41:01,136][0m Trial 776 finished with value: 0.32767858544876927 and parameters: {'splitter': 'random', 'min_samples_split': 0.36390320268355475, 'min_samples_leaf': 0.010087803775855966, 'min_weight_fraction_leaf': 0.03321983804574979, 'max_features': 0.08303051867299133}. Best is trial 677 with value: 0.9113497956229912.[0m
[32m[I 2022-04-21 13:41:05,739][0m Trial 777 finished with value: 0.9035046257376027 and parameters: {'splitter': 'random', 'min_samples_split': 0.10029951515762484, 'min_samples_leaf': 0.0010348797844454988, 'min_weight_fraction_leaf': 0.041642813452661784, 'max_features': 0.9780447226787722}. Best is trial 677 with value: 0.9113497956229912.[0m
[32m[I 2022-04-21 13:41:07,797][0m Trial 778 finished with value: 0.902527848210046 and parameters: {'splitter': 'random', 'min_samples_split': 0.07661274155926195, 'min_samples_leaf': 0.026276850609285533, 'min_weight_fraction_leaf': 0.05667767744728991, 'max_features': 0.867779071392877}. Best is trial 677 with value: 0.9113497956229912.[0m
[32m[I 2022-04-21 13:41:09,144][0m Trial 779 finished with value: 0.8804391066728773 and parameters: {'splitter': 'random', 'min_samples_split': 0.0843209331247833, 'min_samples_leaf': 0.1503396579544385, 'min_weight_fraction_leaf': 0.03379108339481713, 'max_features': 0.937371800332796}. Best is trial 677 with value: 0.9113497956229912.[0m
[32m[I 2022-04-21 13:41:10,895][0m Trial 780 finished with value: 0.9027516482401932 and parameters: {'splitter': 'random', 'min_samples_split': 0.06423894945982973, 'min_samples_leaf': 0.017421152343672773, 'min_weight_fraction_leaf': 0.047470357160901276, 'max_features': 0.9541105876896177}. Best is trial 677 with value: 0.9113497956229912.[0m
[32m[I 2022-04-21 13:41:13,106][0m Trial 781 finished with value: 0.9050025333556938 and parameters: {'splitter': 'random', 'min_samples_split': 0.07206547532070727, 'min_samples_leaf': 0.0013279376820350998, 'min_weight_fraction_leaf': 0.02711758501968558, 'max_features': 0.9024365403919579}. Best is trial 677 with value: 0.9113497956229912.[0m
[32m[I 2022-04-21 13:41:14,516][0m Trial 782 finished with value: 0.8797245818194697 and parameters: {'splitter': 'random', 'min_samples_split': 0.05861268115035407, 'min_samples_leaf': 0.044720311849924366, 'min_weight_fraction_leaf': 0.22089692692805316, 'max_features': 0.918361160891369}. Best is trial 677 with value: 0.9113497956229912.[0m
[32m[I 2022-04-21 13:44:06,129][0m Trial 783 finished with value: 0.8911487348855749 and parameters: {'splitter': 'best', 'min_samples_split': 0.085611523684646, 'min_samples_leaf': 0.02728331191616876, 'min_weight_fraction_leaf': 0.08906944432825026, 'max_features': 0.9377117430065867}. Best is trial 677 with value: 0.9113497956229912.[0m
[32m[I 2022-04-21 13:44:07,928][0m Trial 784 finished with value: 0.25 and parameters: {'splitter': 'random', 'min_samples_split': 0.07288438886086226, 'min_samples_leaf': 0.055750959156442806, 'min_weight_fraction_leaf': 0.4375950928015791, 'max_features': 0.2791759248360294}. Best is trial 677 with value: 0.9113497956229912.[0m
[32m[I 2022-04-21 13:44:09,344][0m Trial 785 finished with value: 0.9020072040629742 and parameters: {'splitter': 'random', 'min_samples_split': 0.03619025416783117, 'min_samples_leaf': 0.017909978733397388, 'min_weight_fraction_leaf': 0.024826163922906916, 'max_features': 0.8877220873775343}. Best is trial 677 with value: 0.9113497956229912.[0m
[32m[I 2022-04-21 13:44:10,727][0m Trial 786 finished with value: 0.3425804518366971 and parameters: {'splitter': 'random', 'min_samples_split': 0.042270631971756616, 'min_samples_leaf': 0.011055298201864718, 'min_weight_fraction_leaf': 0.3540516986963786, 'max_features': 0.9101227306428965}. Best is trial 677 with value: 0.9113497956229912.[0m
[32m[I 2022-04-21 13:44:12,388][0m Trial 787 finished with value: 0.3808458535226341 and parameters: {'splitter': 'random', 'min_samples_split': 0.3413565945542111, 'min_samples_leaf': 0.21211928887894574, 'min_weight_fraction_leaf': 0.03546450189724444, 'max_features': 0.34815070308127427}. Best is trial 677 with value: 0.9113497956229912.[0m
[32m[I 2022-04-21 13:44:13,917][0m Trial 788 finished with value: 0.900567237461102 and parameters: {'splitter': 'random', 'min_samples_split': 0.10522866608079649, 'min_samples_leaf': 0.026590394754747282, 'min_weight_fraction_leaf': 0.053769888088951355, 'max_features': 0.8845458688337876}. Best is trial 677 with value: 0.9113497956229912.[0m
[32m[I 2022-04-21 13:44:16,377][0m Trial 789 finished with value: 0.8983536937664327 and parameters: {'splitter': 'random', 'min_samples_split': 0.0665918424786845, 'min_samples_leaf': 0.0010516458294790518, 'min_weight_fraction_leaf': 0.03959719730965955, 'max_features': 0.9042106459392187}. Best is trial 677 with value: 0.9113497956229912.[0m
[32m[I 2022-04-21 13:44:18,105][0m Trial 790 finished with value: 0.8769988622894775 and parameters: {'splitter': 'random', 'min_samples_split': 0.041250126975890485, 'min_samples_leaf': 0.030357283210601174, 'min_weight_fraction_leaf': 0.022330092563702636, 'max_features': 0.2130774983902095}. Best is trial 677 with value: 0.9113497956229912.[0m
[32m[I 2022-04-21 13:44:20,341][0m Trial 791 finished with value: 0.8988732100546617 and parameters: {'splitter': 'random', 'min_samples_split': 0.08125192630937113, 'min_samples_leaf': 0.016641882446320783, 'min_weight_fraction_leaf': 0.03011541794979947, 'max_features': 0.9567763905426097}. Best is trial 677 with value: 0.9113497956229912.[0m
[32m[I 2022-04-21 13:44:21,670][0m Trial 792 finished with value: 0.3425804518366971 and parameters: {'splitter': 'random', 'min_samples_split': 0.05580994083126323, 'min_samples_leaf': 0.39023213606945184, 'min_weight_fraction_leaf': 0.011388779712295537, 'max_features': 0.9827787048119357}. Best is trial 677 with value: 0.9113497956229912.[0m
[32m[I 2022-04-21 13:44:23,456][0m Trial 793 finished with value: 0.9084754307305454 and parameters: {'splitter': 'random', 'min_samples_split': 0.05094156833372514, 'min_samples_leaf': 0.040093903498545067, 'min_weight_fraction_leaf': 0.015653288421079405, 'max_features': 0.9276838872840113}. Best is trial 677 with value: 0.9113497956229912.[0m
[32m[I 2022-04-21 13:44:24,738][0m Trial 794 finished with value: 0.3604231857506432 and parameters: {'splitter': 'random', 'min_samples_split': 0.06273881337178308, 'min_samples_leaf': 0.2592315503270774, 'min_weight_fraction_leaf': 0.01562525696736535, 'max_features': 0.9434096112389153}. Best is trial 677 with value: 0.9113497956229912.[0m
[32m[I 2022-04-21 13:44:26,036][0m Trial 795 finished with value: 0.9033252103990833 and parameters: {'splitter': 'random', 'min_samples_split': 0.051248828042901054, 'min_samples_leaf': 0.04023661700153806, 'min_weight_fraction_leaf': 0.01851250341821603, 'max_features': 0.9687252764989519}. Best is trial 677 with value: 0.9113497956229912.[0m
[32m[I 2022-04-21 13:44:27,362][0m Trial 796 finished with value: 0.907126691429978 and parameters: {'splitter': 'random', 'min_samples_split': 0.07158950390823171, 'min_samples_leaf': 0.0774876155182078, 'min_weight_fraction_leaf': 0.022197078664240165, 'max_features': 0.927325508293276}. Best is trial 677 with value: 0.9113497956229912.[0m
[32m[I 2022-04-21 13:44:28,652][0m Trial 797 finished with value: 0.9024190271417079 and parameters: {'splitter': 'random', 'min_samples_split': 0.060500298069806585, 'min_samples_leaf': 0.049759495248635516, 'min_weight_fraction_leaf': 0.01078037846899518, 'max_features': 0.9557295470211097}. Best is trial 677 with value: 0.9113497956229912.[0m
[32m[I 2022-04-21 13:44:30,599][0m Trial 798 finished with value: 0.9021409287938459 and parameters: {'splitter': 'random', 'min_samples_split': 0.13150873827371426, 'min_samples_leaf': 0.023090225221943598, 'min_weight_fraction_leaf': 0.02107286218249188, 'max_features': 0.930665827437577}. Best is trial 677 with value: 0.9113497956229912.[0m
[32m[I 2022-04-21 13:44:33,482][0m Trial 799 finished with value: 0.9059483789402029 and parameters: {'splitter': 'random', 'min_samples_split': 0.04499016076116921, 'min_samples_leaf': 0.033114168482350964, 'min_weight_fraction_leaf': 0.029201642157281365, 'max_features': 0.9748900588291082}. Best is trial 677 with value: 0.9113497956229912.[0m
/media/san2_ssd/data/Workdir/survival/utils.py:305: RuntimeWarning: invalid value encountered in true_divide
  pdfs = np.gradient(1-survs,axis=1)/norms
[32m[I 2022-04-21 13:44:34,944][0m Trial 800 finished with value: 0.8991031764850339 and parameters: {'splitter': 'random', 'min_samples_split': 0.05237356100226335, 'min_samples_leaf': 0.011134646354765078, 'min_weight_fraction_leaf': 0.007217770329094391, 'max_features': 0.920177506980161}. Best is trial 677 with value: 0.9113497956229912.[0m
[32m[I 2022-04-21 13:44:37,232][0m Trial 801 finished with value: 0.9056335117828306 and parameters: {'splitter': 'random', 'min_samples_split': 0.07694346321719668, 'min_samples_leaf': 0.01773654570108192, 'min_weight_fraction_leaf': 0.020032602850801273, 'max_features': 0.9472065908557737}. Best is trial 677 with value: 0.9113497956229912.[0m
[32m[I 2022-04-21 13:44:39,742][0m Trial 802 finished with value: 0.8981978305076502 and parameters: {'splitter': 'random', 'min_samples_split': 0.37945935804108516, 'min_samples_leaf': 0.05542118053156561, 'min_weight_fraction_leaf': 0.02890300536977655, 'max_features': 0.9052167051330388}. Best is trial 677 with value: 0.9113497956229912.[0m
[32m[I 2022-04-21 13:47:54,956][0m Trial 803 finished with value: 0.8822215895954297 and parameters: {'splitter': 'best', 'min_samples_split': 0.06384364692402546, 'min_samples_leaf': 0.03650339497753563, 'min_weight_fraction_leaf': 0.00047933963044926794, 'max_features': 0.9601166079954633}. Best is trial 677 with value: 0.9113497956229912.[0m
[32m[I 2022-04-21 13:47:58,141][0m Trial 804 finished with value: 0.8949047955759983 and parameters: {'splitter': 'random', 'min_samples_split': 0.043435277416561446, 'min_samples_leaf': 0.011067237583179332, 'min_weight_fraction_leaf': 0.12416054998373627, 'max_features': 0.9840804057118585}. Best is trial 677 with value: 0.9113497956229912.[0m
[32m[I 2022-04-21 13:47:59,398][0m Trial 805 finished with value: 0.8785738179195745 and parameters: {'splitter': 'random', 'min_samples_split': 0.055069766592944665, 'min_samples_leaf': 0.02622879271387814, 'min_weight_fraction_leaf': 0.1453500241767778, 'max_features': 0.933147158751248}. Best is trial 677 with value: 0.9113497956229912.[0m
