[32m[I 2022-04-21 17:42:21,774][0m Trial 369 finished with value: 0.7682350893242956 and parameters: {'splitter': 'random', 'min_samples_split': 0.49067911626533856, 'min_samples_leaf': 0.021536117747006797, 'min_weight_fraction_leaf': 0.05410540128670391, 'max_features': 0.8668136493873901}. Best is trial 309 with value: 0.8113132095609382.[0m
[32m[I 2022-04-21 17:42:22,439][0m Trial 370 finished with value: 0.8055043242234469 and parameters: {'splitter': 'random', 'min_samples_split': 0.3364129818754239, 'min_samples_leaf': 0.034294526385275415, 'min_weight_fraction_leaf': 0.07185849607132458, 'max_features': 0.9135602320978257}. Best is trial 309 with value: 0.8113132095609382.[0m
[32m[I 2022-04-21 17:44:06,096][0m Trial 371 finished with value: 0.7717986372157506 and parameters: {'splitter': 'best', 'min_samples_split': 0.46915459764865375, 'min_samples_leaf': 0.05306826299136646, 'min_weight_fraction_leaf': 0.00759468108079716, 'max_features': 0.894856296687451}. Best is trial 309 with value: 0.8113132095609382.[0m
[32m[I 2022-04-21 17:44:06,698][0m Trial 372 finished with value: 0.7909988873237964 and parameters: {'splitter': 'random', 'min_samples_split': 0.4829075546368722, 'min_samples_leaf': 0.026559500383838128, 'min_weight_fraction_leaf': 0.026389005505164796, 'max_features': 0.9472794218428993}. Best is trial 309 with value: 0.8113132095609382.[0m
[32m[I 2022-04-21 17:44:07,100][0m Trial 373 finished with value: 0.6851609036733942 and parameters: {'splitter': 'random', 'min_samples_split': 0.3032443011797906, 'min_samples_leaf': 0.016227013665356435, 'min_weight_fraction_leaf': 0.3345158257615425, 'max_features': 0.9248211217606115}. Best is trial 309 with value: 0.8113132095609382.[0m
[32m[I 2022-04-21 17:44:07,685][0m Trial 374 finished with value: 0.7932696037348775 and parameters: {'splitter': 'random', 'min_samples_split': 0.45859702578218614, 'min_samples_leaf': 0.03728328755735279, 'min_weight_fraction_leaf': 0.04244607856732115, 'max_features': 0.9831245239717088}. Best is trial 309 with value: 0.8113132095609382.[0m
[32m[I 2022-04-21 17:44:08,308][0m Trial 375 finished with value: 0.7826753799505408 and parameters: {'splitter': 'random', 'min_samples_split': 0.49959797865034583, 'min_samples_leaf': 0.013144281286646648, 'min_weight_fraction_leaf': 0.017455718791145495, 'max_features': 0.892439995049048}. Best is trial 309 with value: 0.8113132095609382.[0m
[32m[I 2022-04-21 17:46:37,739][0m Trial 376 finished with value: 0.7746638618522877 and parameters: {'splitter': 'best', 'min_samples_split': 0.1772915341210965, 'min_samples_leaf': 0.02398516635554247, 'min_weight_fraction_leaf': 2.0022412979321116e-05, 'max_features': 0.9669507666436967}. Best is trial 309 with value: 0.8113132095609382.[0m
[32m[I 2022-04-21 17:46:38,496][0m Trial 377 finished with value: 0.7985740514989451 and parameters: {'splitter': 'random', 'min_samples_split': 0.36060144371359576, 'min_samples_leaf': 0.008265326071108248, 'min_weight_fraction_leaf': 0.03032833271321801, 'max_features': 0.93612402978845}. Best is trial 309 with value: 0.8113132095609382.[0m
[32m[I 2022-04-21 17:46:38,959][0m Trial 378 finished with value: 0.7682350893242956 and parameters: {'splitter': 'random', 'min_samples_split': 0.4795632850937969, 'min_samples_leaf': 0.04431438066546831, 'min_weight_fraction_leaf': 0.009078684037987797, 'max_features': 0.8748061983474641}. Best is trial 309 with value: 0.8113132095609382.[0m
[32m[I 2022-04-21 17:46:39,711][0m Trial 379 finished with value: 0.8092642586581607 and parameters: {'splitter': 'random', 'min_samples_split': 0.3155986859875185, 'min_samples_leaf': 0.060609756225040626, 'min_weight_fraction_leaf': 0.019172803679640367, 'max_features': 0.9136186467713735}. Best is trial 309 with value: 0.8113132095609382.[0m
[32m[I 2022-04-21 17:46:40,807][0m Trial 380 finished with value: 0.7963956610153005 and parameters: {'splitter': 'random', 'min_samples_split': 0.3176758518753756, 'min_samples_leaf': 0.049244363904204135, 'min_weight_fraction_leaf': 0.04255289256608677, 'max_features': 0.9043065063978666}. Best is trial 309 with value: 0.8113132095609382.[0m
[32m[I 2022-04-21 17:48:18,609][0m Trial 381 finished with value: 0.7779438911830183 and parameters: {'splitter': 'best', 'min_samples_split': 0.3282178350913161, 'min_samples_leaf': 0.06800504394977508, 'min_weight_fraction_leaf': 0.05721227702517731, 'max_features': 0.8693730719832794}. Best is trial 309 with value: 0.8113132095609382.[0m
[32m[I 2022-04-21 17:48:19,432][0m Trial 382 finished with value: 0.8092642586581607 and parameters: {'splitter': 'random', 'min_samples_split': 0.30984544537480513, 'min_samples_leaf': 0.05800112979587195, 'min_weight_fraction_leaf': 0.023492673452174248, 'max_features': 0.917430294476697}. Best is trial 309 with value: 0.8113132095609382.[0m
[32m[I 2022-04-21 17:48:20,049][0m Trial 383 finished with value: 0.7494530051570637 and parameters: {'splitter': 'random', 'min_samples_split': 0.2938874577952804, 'min_samples_leaf': 0.05988334039693406, 'min_weight_fraction_leaf': 0.20498436195053663, 'max_features': 0.8373491248992955}. Best is trial 309 with value: 0.8113132095609382.[0m
[32m[I 2022-04-21 17:48:20,527][0m Trial 384 finished with value: 0.8092642586581607 and parameters: {'splitter': 'random', 'min_samples_split': 0.3030665340579401, 'min_samples_leaf': 0.06155184314712947, 'min_weight_fraction_leaf': 0.03269091586073279, 'max_features': 0.9179107256330106}. Best is trial 309 with value: 0.8113132095609382.[0m
[32m[I 2022-04-21 17:48:20,971][0m Trial 385 finished with value: 0.810455310005268 and parameters: {'splitter': 'random', 'min_samples_split': 0.2840814246252179, 'min_samples_leaf': 0.07925156102252852, 'min_weight_fraction_leaf': 0.03562259676482607, 'max_features': 0.916925000456207}. Best is trial 309 with value: 0.8113132095609382.[0m
[32m[I 2022-04-21 17:48:21,429][0m Trial 386 finished with value: 0.810455310005268 and parameters: {'splitter': 'random', 'min_samples_split': 0.2948464761522542, 'min_samples_leaf': 0.07622137389553049, 'min_weight_fraction_leaf': 0.03977321716509184, 'max_features': 0.9181278249216007}. Best is trial 309 with value: 0.8113132095609382.[0m
[32m[I 2022-04-21 17:48:21,897][0m Trial 387 finished with value: 0.7963956610153005 and parameters: {'splitter': 'random', 'min_samples_split': 0.2870410824491678, 'min_samples_leaf': 0.07984457941516608, 'min_weight_fraction_leaf': 0.04030798292894438, 'max_features': 0.8895316213216055}. Best is trial 309 with value: 0.8113132095609382.[0m
[32m[I 2022-04-21 17:48:22,741][0m Trial 388 finished with value: 0.8092642586581607 and parameters: {'splitter': 'random', 'min_samples_split': 0.29809703526290826, 'min_samples_leaf': 0.0858782481556314, 'min_weight_fraction_leaf': 0.03347941283284617, 'max_features': 0.9168287499510224}. Best is trial 309 with value: 0.8113132095609382.[0m
[32m[I 2022-04-21 17:48:23,308][0m Trial 389 finished with value: 0.8112229513277963 and parameters: {'splitter': 'random', 'min_samples_split': 0.28393949719427075, 'min_samples_leaf': 0.09212651633497965, 'min_weight_fraction_leaf': 0.03587511105200172, 'max_features': 0.9118649732536278}. Best is trial 309 with value: 0.8113132095609382.[0m
[32m[I 2022-04-21 17:48:23,750][0m Trial 390 finished with value: 0.810455310005268 and parameters: {'splitter': 'random', 'min_samples_split': 0.27247168119316706, 'min_samples_leaf': 0.08470289522226743, 'min_weight_fraction_leaf': 0.03850096447031898, 'max_features': 0.9097521069255579}. Best is trial 309 with value: 0.8113132095609382.[0m
[32m[I 2022-04-21 17:48:24,182][0m Trial 391 finished with value: 0.810455310005268 and parameters: {'splitter': 'random', 'min_samples_split': 0.2690229453237237, 'min_samples_leaf': 0.08828618735168732, 'min_weight_fraction_leaf': 0.04484196204872881, 'max_features': 0.9118841581528019}. Best is trial 309 with value: 0.8113132095609382.[0m
[32m[I 2022-04-21 17:48:24,800][0m Trial 392 finished with value: 0.795784225190699 and parameters: {'splitter': 'random', 'min_samples_split': 0.2751957385504319, 'min_samples_leaf': 0.09828290417090604, 'min_weight_fraction_leaf': 0.047628202662831236, 'max_features': 0.8882721289263843}. Best is trial 309 with value: 0.8113132095609382.[0m
[32m[I 2022-04-21 17:48:25,238][0m Trial 393 finished with value: 0.7963956610153005 and parameters: {'splitter': 'random', 'min_samples_split': 0.27935637065630925, 'min_samples_leaf': 0.07515812418902137, 'min_weight_fraction_leaf': 0.04836276958587746, 'max_features': 0.9057093669255782}. Best is trial 309 with value: 0.8113132095609382.[0m
[32m[I 2022-04-21 17:48:25,647][0m Trial 394 finished with value: 0.775684232099894 and parameters: {'splitter': 'random', 'min_samples_split': 0.2726641480601803, 'min_samples_leaf': 0.08627585201048521, 'min_weight_fraction_leaf': 0.03846490645863107, 'max_features': 0.8691564558841336}. Best is trial 309 with value: 0.8113132095609382.[0m
[32m[I 2022-04-21 17:48:26,069][0m Trial 395 finished with value: 0.7998727310858353 and parameters: {'splitter': 'random', 'min_samples_split': 0.26599717793804284, 'min_samples_leaf': 0.08870006571147027, 'min_weight_fraction_leaf': 0.037900706922343604, 'max_features': 0.9050449231957076}. Best is trial 309 with value: 0.8113132095609382.[0m
[32m[I 2022-04-21 17:48:26,457][0m Trial 396 finished with value: 0.7989883908314254 and parameters: {'splitter': 'random', 'min_samples_split': 0.2795313394318225, 'min_samples_leaf': 0.10630859831554168, 'min_weight_fraction_leaf': 0.049596993113651726, 'max_features': 0.8844061455980529}. Best is trial 309 with value: 0.8113132095609382.[0m
[32m[I 2022-04-21 17:48:26,863][0m Trial 397 finished with value: 0.775684232099894 and parameters: {'splitter': 'random', 'min_samples_split': 0.2857812884940144, 'min_samples_leaf': 0.09379607644323795, 'min_weight_fraction_leaf': 0.032694400560795006, 'max_features': 0.8614104410448087}. Best is trial 309 with value: 0.8113132095609382.[0m
[32m[I 2022-04-21 17:48:27,307][0m Trial 398 finished with value: 0.810455310005268 and parameters: {'splitter': 'random', 'min_samples_split': 0.26401524183475983, 'min_samples_leaf': 0.07899348266627707, 'min_weight_fraction_leaf': 0.04264090142447491, 'max_features': 0.9162827011439334}. Best is trial 309 with value: 0.8113132095609382.[0m
[32m[I 2022-04-21 17:48:27,756][0m Trial 399 finished with value: 0.7959093412886257 and parameters: {'splitter': 'random', 'min_samples_split': 0.2547295077089331, 'min_samples_leaf': 0.07604338107933349, 'min_weight_fraction_leaf': 0.05351491770518049, 'max_features': 0.8902332231886636}. Best is trial 309 with value: 0.8113132095609382.[0m
[32m[I 2022-04-21 17:48:28,361][0m Trial 400 finished with value: 0.810455310005268 and parameters: {'splitter': 'random', 'min_samples_split': 0.26534377098306544, 'min_samples_leaf': 0.0755046835905581, 'min_weight_fraction_leaf': 0.04399800512977217, 'max_features': 0.9132375521174055}. Best is trial 309 with value: 0.8113132095609382.[0m
[32m[I 2022-04-21 17:48:28,797][0m Trial 401 finished with value: 0.7996671387894261 and parameters: {'splitter': 'random', 'min_samples_split': 0.2621317061758949, 'min_samples_leaf': 0.0840246212236979, 'min_weight_fraction_leaf': 0.043309012876495, 'max_features': 0.8998952635658226}. Best is trial 309 with value: 0.8113132095609382.[0m
[32m[I 2022-04-21 17:48:29,322][0m Trial 402 finished with value: 0.7862150500822881 and parameters: {'splitter': 'random', 'min_samples_split': 0.24612466217093065, 'min_samples_leaf': 0.09610969391508808, 'min_weight_fraction_leaf': 0.05702041650116561, 'max_features': 0.8550630486749863}. Best is trial 309 with value: 0.8113132095609382.[0m
[32m[I 2022-04-21 17:48:30,067][0m Trial 403 finished with value: 0.7752602854405427 and parameters: {'splitter': 'random', 'min_samples_split': 0.26674689328316437, 'min_samples_leaf': 0.075270476244356, 'min_weight_fraction_leaf': 0.0486574555470232, 'max_features': 0.8770112006006339}. Best is trial 309 with value: 0.8113132095609382.[0m
[32m[I 2022-04-21 17:48:30,690][0m Trial 404 finished with value: 0.810455310005268 and parameters: {'splitter': 'random', 'min_samples_split': 0.273517947256986, 'min_samples_leaf': 0.08246445431428741, 'min_weight_fraction_leaf': 0.03287326801858875, 'max_features': 0.9197643623520436}. Best is trial 309 with value: 0.8113132095609382.[0m
[32m[I 2022-04-21 17:48:31,312][0m Trial 405 finished with value: 0.6853429419932293 and parameters: {'splitter': 'random', 'min_samples_split': 0.25950242190470557, 'min_samples_leaf': 0.10333941900799315, 'min_weight_fraction_leaf': 0.041025099781098785, 'max_features': 0.23867108332050896}. Best is trial 309 with value: 0.8113132095609382.[0m
[32m[I 2022-04-21 17:48:31,774][0m Trial 406 finished with value: 0.7910101893696445 and parameters: {'splitter': 'random', 'min_samples_split': 0.27058971847443547, 'min_samples_leaf': 0.08270375285574388, 'min_weight_fraction_leaf': 0.03913825888378274, 'max_features': 0.9304104859262025}. Best is trial 309 with value: 0.8113132095609382.[0m
[32m[I 2022-04-21 17:48:32,194][0m Trial 407 finished with value: 0.7977286215404128 and parameters: {'splitter': 'random', 'min_samples_split': 0.2764305632080201, 'min_samples_leaf': 0.09306966422285878, 'min_weight_fraction_leaf': 0.05011059676272164, 'max_features': 0.9044790166946097}. Best is trial 309 with value: 0.8113132095609382.[0m
[32m[I 2022-04-21 17:48:32,622][0m Trial 408 finished with value: 0.7594491636389396 and parameters: {'splitter': 'random', 'min_samples_split': 0.2622393699598732, 'min_samples_leaf': 0.07422787130291572, 'min_weight_fraction_leaf': 0.23549431608403332, 'max_features': 0.9359739709676453}. Best is trial 309 with value: 0.8113132095609382.[0m
[32m[I 2022-04-21 17:48:33,068][0m Trial 409 finished with value: 0.7970346531254762 and parameters: {'splitter': 'random', 'min_samples_split': 0.2735650512613161, 'min_samples_leaf': 0.08055197621877946, 'min_weight_fraction_leaf': 0.03131796997430214, 'max_features': 0.8863435564305737}. Best is trial 309 with value: 0.8113132095609382.[0m
[32m[I 2022-04-21 17:48:33,451][0m Trial 410 finished with value: 0.7653965927093083 and parameters: {'splitter': 'random', 'min_samples_split': 0.2573685691163401, 'min_samples_leaf': 0.11665211791352109, 'min_weight_fraction_leaf': 0.03811581182805503, 'max_features': 0.9165328146921098}. Best is trial 309 with value: 0.8113132095609382.[0m
[32m[I 2022-04-21 17:48:34,259][0m Trial 411 finished with value: 0.7967066593147615 and parameters: {'splitter': 'random', 'min_samples_split': 0.28758637049212704, 'min_samples_leaf': 0.09058879644754345, 'min_weight_fraction_leaf': 0.02707762768577885, 'max_features': 0.8952645281710839}. Best is trial 309 with value: 0.8113132095609382.[0m
[32m[I 2022-04-21 17:48:34,959][0m Trial 412 finished with value: 0.810455310005268 and parameters: {'splitter': 'random', 'min_samples_split': 0.27620620488928627, 'min_samples_leaf': 0.06909958193195197, 'min_weight_fraction_leaf': 0.05887767067316495, 'max_features': 0.9282961793527279}. Best is trial 309 with value: 0.8113132095609382.[0m
[32m[I 2022-04-21 17:48:35,612][0m Trial 413 finished with value: 0.8016555385919716 and parameters: {'splitter': 'random', 'min_samples_split': 0.28167048731851463, 'min_samples_leaf': 0.06837172954859458, 'min_weight_fraction_leaf': 0.06148253512695081, 'max_features': 0.9424764454921776}. Best is trial 309 with value: 0.8113132095609382.[0m
[32m[I 2022-04-21 17:48:36,142][0m Trial 414 finished with value: 0.810455310005268 and parameters: {'splitter': 'random', 'min_samples_split': 0.2724918363572561, 'min_samples_leaf': 0.07996673147260129, 'min_weight_fraction_leaf': 0.059962074465041745, 'max_features': 0.9257868647972671}. Best is trial 309 with value: 0.8113132095609382.[0m
[32m[I 2022-04-21 17:48:36,799][0m Trial 415 finished with value: 0.8112229513277963 and parameters: {'splitter': 'random', 'min_samples_split': 0.266834100434997, 'min_samples_leaf': 0.09545077931720715, 'min_weight_fraction_leaf': 0.05954785299665441, 'max_features': 0.9263787511753115}. Best is trial 309 with value: 0.8113132095609382.[0m
[32m[I 2022-04-21 17:48:37,360][0m Trial 416 finished with value: 0.7644772297015148 and parameters: {'splitter': 'random', 'min_samples_split': 0.26207009869534614, 'min_samples_leaf': 0.10340000726910892, 'min_weight_fraction_leaf': 0.055703222531187986, 'max_features': 0.9337735235827924}. Best is trial 309 with value: 0.8113132095609382.[0m
[32m[I 2022-04-21 17:48:37,982][0m Trial 417 finished with value: 0.8112229513277963 and parameters: {'splitter': 'random', 'min_samples_split': 0.27499683383528617, 'min_samples_leaf': 0.0912766136471598, 'min_weight_fraction_leaf': 0.06464949695824244, 'max_features': 0.9245717297014118}. Best is trial 309 with value: 0.8113132095609382.[0m
[32m[I 2022-04-21 17:48:38,567][0m Trial 418 finished with value: 0.7754953816212059 and parameters: {'splitter': 'random', 'min_samples_split': 0.2735912459434718, 'min_samples_leaf': 0.08675270928849153, 'min_weight_fraction_leaf': 0.05890709346024403, 'max_features': 0.9516276342420107}. Best is trial 309 with value: 0.8113132095609382.[0m
[32m[I 2022-04-21 17:48:38,987][0m Trial 419 finished with value: 0.7660361862171381 and parameters: {'splitter': 'random', 'min_samples_split': 0.2681945730666302, 'min_samples_leaf': 0.10537157093643224, 'min_weight_fraction_leaf': 0.06678091406021816, 'max_features': 0.928554198436005}. Best is trial 309 with value: 0.8113132095609382.[0m
[32m[I 2022-04-21 17:48:39,419][0m Trial 420 finished with value: 0.7967066593147615 and parameters: {'splitter': 'random', 'min_samples_split': 0.2815789487816488, 'min_samples_leaf': 0.09168237387163196, 'min_weight_fraction_leaf': 0.06569852768995785, 'max_features': 0.9047644302248681}. Best is trial 309 with value: 0.8113132095609382.[0m
[32m[I 2022-04-21 17:48:39,980][0m Trial 421 finished with value: 0.7987030519824894 and parameters: {'splitter': 'random', 'min_samples_split': 0.2528136430450621, 'min_samples_leaf': 0.07803528921037078, 'min_weight_fraction_leaf': 0.05939770949774406, 'max_features': 0.9482012876904012}. Best is trial 309 with value: 0.8113132095609382.[0m
[32m[I 2022-04-21 17:48:40,587][0m Trial 422 finished with value: 0.8010494796202396 and parameters: {'splitter': 'random', 'min_samples_split': 0.2688101175073312, 'min_samples_leaf': 0.09560371565464401, 'min_weight_fraction_leaf': 0.06568471045453506, 'max_features': 0.9272747741735744}. Best is trial 309 with value: 0.8113132095609382.[0m
[32m[I 2022-04-21 17:48:41,044][0m Trial 423 finished with value: 0.7967066593147615 and parameters: {'splitter': 'random', 'min_samples_split': 0.28811658285866915, 'min_samples_leaf': 0.08372599979723411, 'min_weight_fraction_leaf': 0.05040772228063592, 'max_features': 0.8838160304010709}. Best is trial 309 with value: 0.8113132095609382.[0m
[32m[I 2022-04-21 17:48:41,690][0m Trial 424 finished with value: 0.7656953864653061 and parameters: {'splitter': 'random', 'min_samples_split': 0.2614931178198284, 'min_samples_leaf': 0.11275214229560232, 'min_weight_fraction_leaf': 0.06515156362986682, 'max_features': 0.9155778117090717}. Best is trial 309 with value: 0.8113132095609382.[0m
[32m[I 2022-04-21 17:48:42,184][0m Trial 425 finished with value: 0.8016555385919716 and parameters: {'splitter': 'random', 'min_samples_split': 0.2795656338035302, 'min_samples_leaf': 0.0701645063031048, 'min_weight_fraction_leaf': 0.052691588515181034, 'max_features': 0.9485304250924849}. Best is trial 309 with value: 0.8113132095609382.[0m
[32m[I 2022-04-21 17:48:42,986][0m Trial 426 finished with value: 0.7857016468841971 and parameters: {'splitter': 'random', 'min_samples_split': 0.2888584005291021, 'min_samples_leaf': 0.09842050840043332, 'min_weight_fraction_leaf': 0.057078656420179, 'max_features': 0.858298457379067}. Best is trial 309 with value: 0.8113132095609382.[0m
[32m[I 2022-04-21 17:48:43,814][0m Trial 427 finished with value: 0.775684232099894 and parameters: {'splitter': 'random', 'min_samples_split': 0.26831210608290396, 'min_samples_leaf': 0.07835027098436516, 'min_weight_fraction_leaf': 0.04802480367872993, 'max_features': 0.8794048154668329}. Best is trial 309 with value: 0.8113132095609382.[0m
[32m[I 2022-04-21 17:48:44,289][0m Trial 428 finished with value: 0.7966546589745455 and parameters: {'splitter': 'random', 'min_samples_split': 0.25608384259046835, 'min_samples_leaf': 0.06866120988172349, 'min_weight_fraction_leaf': 0.07403731559327185, 'max_features': 0.8973005646688207}. Best is trial 309 with value: 0.8113132095609382.[0m
[32m[I 2022-04-21 17:48:44,749][0m Trial 429 finished with value: 0.810455310005268 and parameters: {'splitter': 'random', 'min_samples_split': 0.2806767540565284, 'min_samples_leaf': 0.08702279079915762, 'min_weight_fraction_leaf': 0.059882959645349204, 'max_features': 0.9245457405085443}. Best is trial 309 with value: 0.8113132095609382.[0m
[32m[I 2022-04-21 17:48:45,193][0m Trial 430 finished with value: 0.7707466208696517 and parameters: {'splitter': 'random', 'min_samples_split': 0.27560008529705066, 'min_samples_leaf': 0.08832336235107516, 'min_weight_fraction_leaf': 0.06744712923088757, 'max_features': 0.9375916603165945}. Best is trial 309 with value: 0.8113132095609382.[0m
[32m[I 2022-04-21 17:48:45,592][0m Trial 431 finished with value: 0.7718175427041111 and parameters: {'splitter': 'random', 'min_samples_split': 0.2807506356326041, 'min_samples_leaf': 0.10227361616163824, 'min_weight_fraction_leaf': 0.04893794256367589, 'max_features': 0.956609383094416}. Best is trial 309 with value: 0.8113132095609382.[0m
