No protocol specified
[32m[I 2022-05-06 13:29:58,209][0m A new study created in memory with name: no-name-496ae8c0-fcac-44b2-b695-9aa3b3db1be1[0m
/media/san2_ssd/data/Workdir/survival/venv/lib/python3.8/site-packages/sksurv/ensemble/boosting.py:955: RuntimeWarning: divide by zero encountered in log
  time = numpy.log(time)
/media/san2_ssd/data/Workdir/survival/venv/lib/python3.8/site-packages/sksurv/ensemble/boosting.py:955: RuntimeWarning: divide by zero encountered in log
  time = numpy.log(time)
/media/san2_ssd/data/Workdir/survival/venv/lib/python3.8/site-packages/sksurv/ensemble/boosting.py:955: RuntimeWarning: divide by zero encountered in log
  time = numpy.log(time)
/media/san2_ssd/data/Workdir/survival/venv/lib/python3.8/site-packages/sksurv/ensemble/boosting.py:955: RuntimeWarning: divide by zero encountered in log
  time = numpy.log(time)
/media/san2_ssd/data/Workdir/survival/venv/lib/python3.8/site-packages/sksurv/ensemble/boosting.py:955: RuntimeWarning: divide by zero encountered in log
  time = numpy.log(time)
[32m[I 2022-05-06 13:29:58,244][0m Trial 0 finished with value: -1.0 and parameters: {'loss': 'squared', 'learning_rate': 1.143245333182473e-06, 'n_estimators': 204, 'criterion': 'absolute_error', 'min_samples_split': 4, 'min_samples_leaf': 7, 'min_weight_fraction_leaf': 0.4750139176289389, 'min_impurity_decrease': 0.5351972140141242, 'max_features': 0.273064914237568, 'subsample': 0.08659069351257175, 'dropout_rate': 0.24617706372982073, 'ccp_alpha': 1.0116879959370895}. Best is trial 0 with value: -1.0.[0m
/media/san2_ssd/data/Workdir/survival/venv/lib/python3.8/site-packages/sksurv/ensemble/boosting.py:955: RuntimeWarning: divide by zero encountered in log
  time = numpy.log(time)
/media/san2_ssd/data/Workdir/survival/venv/lib/python3.8/site-packages/sksurv/ensemble/boosting.py:955: RuntimeWarning: divide by zero encountered in log
  time = numpy.log(time)
/media/san2_ssd/data/Workdir/survival/venv/lib/python3.8/site-packages/sksurv/ensemble/boosting.py:955: RuntimeWarning: divide by zero encountered in log
  time = numpy.log(time)
/media/san2_ssd/data/Workdir/survival/venv/lib/python3.8/site-packages/sksurv/ensemble/boosting.py:955: RuntimeWarning: divide by zero encountered in log
  time = numpy.log(time)
/media/san2_ssd/data/Workdir/survival/venv/lib/python3.8/site-packages/sksurv/ensemble/boosting.py:955: RuntimeWarning: divide by zero encountered in log
  time = numpy.log(time)
[32m[I 2022-05-06 13:29:58,255][0m Trial 1 finished with value: -1.0 and parameters: {'loss': 'squared', 'learning_rate': 0.00071281722554679, 'n_estimators': 731, 'criterion': 'absolute_error', 'min_samples_split': 10, 'min_samples_leaf': 8, 'min_weight_fraction_leaf': 0.40754295843986454, 'min_impurity_decrease': 0.27299444299255704, 'max_features': 0.7333728348711375, 'subsample': 0.2888353424346788, 'dropout_rate': 0.1341209771778229, 'ccp_alpha': 0.864483452143466}. Best is trial 0 with value: -1.0.[0m
/media/san2_ssd/data/Workdir/survival/venv/lib/python3.8/site-packages/sksurv/ensemble/boosting.py:955: RuntimeWarning: divide by zero encountered in log
  time = numpy.log(time)
/media/san2_ssd/data/Workdir/survival/venv/lib/python3.8/site-packages/sksurv/ensemble/boosting.py:955: RuntimeWarning: divide by zero encountered in log
  time = numpy.log(time)
/media/san2_ssd/data/Workdir/survival/venv/lib/python3.8/site-packages/sksurv/ensemble/boosting.py:955: RuntimeWarning: divide by zero encountered in log
  time = numpy.log(time)
/media/san2_ssd/data/Workdir/survival/venv/lib/python3.8/site-packages/sksurv/ensemble/boosting.py:955: RuntimeWarning: divide by zero encountered in log
  time = numpy.log(time)
/media/san2_ssd/data/Workdir/survival/venv/lib/python3.8/site-packages/sksurv/ensemble/boosting.py:955: RuntimeWarning: divide by zero encountered in log
  time = numpy.log(time)
[32m[I 2022-05-06 13:29:58,266][0m Trial 2 finished with value: -1.0 and parameters: {'loss': 'squared', 'learning_rate': 0.00012852856121662443, 'n_estimators': 132, 'criterion': 'friedman_mse', 'min_samples_split': 6, 'min_samples_leaf': 7, 'min_weight_fraction_leaf': 0.10702704647325638, 'min_impurity_decrease': 0.18372913885153536, 'max_features': 0.736831579919534, 'subsample': 0.07284139917562617, 'dropout_rate': 0.3130069515690618, 'ccp_alpha': 0.4093210742361919}. Best is trial 0 with value: -1.0.[0m
[32m[I 2022-05-06 14:04:25,785][0m Trial 3 finished with value: 0.5 and parameters: {'loss': 'coxph', 'learning_rate': 1.26875645153429e-05, 'n_estimators': 917, 'criterion': 'friedman_mse', 'min_samples_split': 10, 'min_samples_leaf': 8, 'min_weight_fraction_leaf': 0.4090032622922635, 'min_impurity_decrease': 0.4850867239478763, 'max_features': 0.69152303329941, 'subsample': 0.9588288694411098, 'dropout_rate': 0.7259655286314374, 'ccp_alpha': 1.645905022023634}. Best is trial 3 with value: 0.5.[0m
[32m[I 2022-05-06 14:14:59,245][0m Trial 4 finished with value: 0.5 and parameters: {'loss': 'coxph', 'learning_rate': 5.511223840547475e-05, 'n_estimators': 136, 'criterion': 'absolute_error', 'min_samples_split': 7, 'min_samples_leaf': 10, 'min_weight_fraction_leaf': 0.02062974734362, 'min_impurity_decrease': 0.6147415294726559, 'max_features': 0.7401094241548974, 'subsample': 0.9579451775150896, 'dropout_rate': 0.6893113580881209, 'ccp_alpha': 2.1728050027893935}. Best is trial 3 with value: 0.5.[0m
/media/san2_ssd/data/Workdir/survival/venv/lib/python3.8/site-packages/sksurv/ensemble/boosting.py:955: RuntimeWarning: divide by zero encountered in log
  time = numpy.log(time)
/media/san2_ssd/data/Workdir/survival/venv/lib/python3.8/site-packages/sksurv/ensemble/boosting.py:955: RuntimeWarning: divide by zero encountered in log
  time = numpy.log(time)
/media/san2_ssd/data/Workdir/survival/venv/lib/python3.8/site-packages/sksurv/ensemble/boosting.py:955: RuntimeWarning: divide by zero encountered in log
  time = numpy.log(time)
/media/san2_ssd/data/Workdir/survival/venv/lib/python3.8/site-packages/sksurv/ensemble/boosting.py:955: RuntimeWarning: divide by zero encountered in log
  time = numpy.log(time)
/media/san2_ssd/data/Workdir/survival/venv/lib/python3.8/site-packages/sksurv/ensemble/boosting.py:955: RuntimeWarning: divide by zero encountered in log
  time = numpy.log(time)
[32m[I 2022-05-06 14:14:59,258][0m Trial 5 finished with value: -1.0 and parameters: {'loss': 'squared', 'learning_rate': 1.1075087507978578e-06, 'n_estimators': 990, 'criterion': 'squared_error', 'min_samples_split': 10, 'min_samples_leaf': 10, 'min_weight_fraction_leaf': 0.2636207132198281, 'min_impurity_decrease': 0.18870381780702103, 'max_features': 0.7682188621375576, 'subsample': 0.7726463560260283, 'dropout_rate': 0.49212334767788124, 'ccp_alpha': 4.522316812510302}. Best is trial 3 with value: 0.5.[0m
[32m[I 2022-05-06 14:39:54,495][0m Trial 6 finished with value: 0.5 and parameters: {'loss': 'coxph', 'learning_rate': 1.9736744557263337e-06, 'n_estimators': 656, 'criterion': 'squared_error', 'min_samples_split': 10, 'min_samples_leaf': 4, 'min_weight_fraction_leaf': 0.4156924411570397, 'min_impurity_decrease': 0.6552216480194738, 'max_features': 0.3410584834692374, 'subsample': 0.7138434342759833, 'dropout_rate': 0.011217496150909279, 'ccp_alpha': 3.2119724943924712}. Best is trial 3 with value: 0.5.[0m
/media/san2_ssd/data/Workdir/survival/venv/lib/python3.8/site-packages/sksurv/ensemble/boosting.py:955: RuntimeWarning: divide by zero encountered in log
  time = numpy.log(time)
/media/san2_ssd/data/Workdir/survival/venv/lib/python3.8/site-packages/sksurv/ensemble/boosting.py:955: RuntimeWarning: divide by zero encountered in log
  time = numpy.log(time)
/media/san2_ssd/data/Workdir/survival/venv/lib/python3.8/site-packages/sksurv/ensemble/boosting.py:955: RuntimeWarning: divide by zero encountered in log
  time = numpy.log(time)
/media/san2_ssd/data/Workdir/survival/venv/lib/python3.8/site-packages/sksurv/ensemble/boosting.py:955: RuntimeWarning: divide by zero encountered in log
  time = numpy.log(time)
/media/san2_ssd/data/Workdir/survival/venv/lib/python3.8/site-packages/sksurv/ensemble/boosting.py:955: RuntimeWarning: divide by zero encountered in log
  time = numpy.log(time)
[32m[I 2022-05-06 14:39:54,508][0m Trial 7 finished with value: -1.0 and parameters: {'loss': 'squared', 'learning_rate': 0.06244545442773238, 'n_estimators': 415, 'criterion': 'squared_error', 'min_samples_split': 7, 'min_samples_leaf': 8, 'min_weight_fraction_leaf': 0.07714198863394055, 'min_impurity_decrease': 0.3780707982371836, 'max_features': 0.3555326148118544, 'subsample': 0.637509324429894, 'dropout_rate': 0.7201700277665238, 'ccp_alpha': 4.841032748420917}. Best is trial 3 with value: 0.5.[0m
/media/san2_ssd/data/Workdir/survival/venv/lib/python3.8/site-packages/sksurv/ensemble/boosting.py:955: RuntimeWarning: divide by zero encountered in log
  time = numpy.log(time)
/media/san2_ssd/data/Workdir/survival/venv/lib/python3.8/site-packages/sksurv/ensemble/boosting.py:955: RuntimeWarning: divide by zero encountered in log
  time = numpy.log(time)
/media/san2_ssd/data/Workdir/survival/venv/lib/python3.8/site-packages/sksurv/ensemble/boosting.py:955: RuntimeWarning: divide by zero encountered in log
  time = numpy.log(time)
/media/san2_ssd/data/Workdir/survival/venv/lib/python3.8/site-packages/sksurv/ensemble/boosting.py:955: RuntimeWarning: divide by zero encountered in log
  time = numpy.log(time)
/media/san2_ssd/data/Workdir/survival/venv/lib/python3.8/site-packages/sksurv/ensemble/boosting.py:955: RuntimeWarning: divide by zero encountered in log
  time = numpy.log(time)
[32m[I 2022-05-06 14:39:54,519][0m Trial 8 finished with value: -1.0 and parameters: {'loss': 'squared', 'learning_rate': 2.386372744438225e-06, 'n_estimators': 195, 'criterion': 'friedman_mse', 'min_samples_split': 5, 'min_samples_leaf': 2, 'min_weight_fraction_leaf': 0.2827165189099407, 'min_impurity_decrease': 0.6391631561371478, 'max_features': 0.05737936655936535, 'subsample': 0.07297148442600168, 'dropout_rate': 0.043256123415367886, 'ccp_alpha': 3.38413218514441}. Best is trial 3 with value: 0.5.[0m
/media/san2_ssd/data/Workdir/survival/venv/lib/python3.8/site-packages/sksurv/ensemble/boosting.py:955: RuntimeWarning: divide by zero encountered in log
  time = numpy.log(time)
/media/san2_ssd/data/Workdir/survival/venv/lib/python3.8/site-packages/sksurv/ensemble/boosting.py:955: RuntimeWarning: divide by zero encountered in log
  time = numpy.log(time)
/media/san2_ssd/data/Workdir/survival/venv/lib/python3.8/site-packages/sksurv/ensemble/boosting.py:955: RuntimeWarning: divide by zero encountered in log
  time = numpy.log(time)
/media/san2_ssd/data/Workdir/survival/venv/lib/python3.8/site-packages/sksurv/ensemble/boosting.py:955: RuntimeWarning: divide by zero encountered in log
  time = numpy.log(time)
/media/san2_ssd/data/Workdir/survival/venv/lib/python3.8/site-packages/sksurv/ensemble/boosting.py:955: RuntimeWarning: divide by zero encountered in log
  time = numpy.log(time)
[32m[I 2022-05-06 14:39:54,531][0m Trial 9 finished with value: -1.0 and parameters: {'loss': 'squared', 'learning_rate': 0.001970160200003968, 'n_estimators': 153, 'criterion': 'friedman_mse', 'min_samples_split': 8, 'min_samples_leaf': 2, 'min_weight_fraction_leaf': 0.35716450041332726, 'min_impurity_decrease': 0.9663177634957411, 'max_features': 0.7133659983383203, 'subsample': 0.5072590717695554, 'dropout_rate': 0.759987897516963, 'ccp_alpha': 1.7168425889523273}. Best is trial 3 with value: 0.5.[0m
[32m[I 2022-05-06 14:52:49,145][0m Trial 10 finished with value: 0.5 and parameters: {'loss': 'coxph', 'learning_rate': 1.7713381849729616e-05, 'n_estimators': 365, 'criterion': 'friedman_mse', 'min_samples_split': 2, 'min_samples_leaf': 5, 'min_weight_fraction_leaf': 0.18875514273163535, 'min_impurity_decrease': 0.8648759131113641, 'max_features': 0.950067858442865, 'subsample': 0.9701589269072126, 'dropout_rate': 0.9557057630463317, 'ccp_alpha': 2.992093131253016}. Best is trial 3 with value: 0.5.[0m
[32m[I 2022-05-06 15:10:30,174][0m Trial 11 finished with value: 0.5 and parameters: {'loss': 'coxph', 'learning_rate': 3.787374560475058e-05, 'n_estimators': 268, 'criterion': 'absolute_error', 'min_samples_split': 8, 'min_samples_leaf': 10, 'min_weight_fraction_leaf': 0.034408562096128595, 'min_impurity_decrease': 0.7418244017205589, 'max_features': 0.5720518741885774, 'subsample': 0.9309345119884723, 'dropout_rate': 0.6647024871322711, 'ccp_alpha': 1.9802288609930185}. Best is trial 3 with value: 0.5.[0m
[32m[I 2022-05-06 16:01:40,144][0m Trial 12 finished with value: 0.5 and parameters: {'loss': 'coxph', 'learning_rate': 1.9158276496334456e-05, 'n_estimators': 518, 'criterion': 'absolute_error', 'min_samples_split': 8, 'min_samples_leaf': 9, 'min_weight_fraction_leaf': 0.18864959388061006, 'min_impurity_decrease': 0.012033590418593199, 'max_features': 0.9170808868035311, 'subsample': 0.8647521271701144, 'dropout_rate': 0.9455443758459673, 'ccp_alpha': 2.1502833203851384}. Best is trial 3 with value: 0.5.[0m
[32m[I 2022-05-06 16:11:12,667][0m Trial 13 finished with value: 0.5 and parameters: {'loss': 'coxph', 'learning_rate': 0.004003637161384003, 'n_estimators': 258, 'criterion': 'friedman_mse', 'min_samples_split': 4, 'min_samples_leaf': 10, 'min_weight_fraction_leaf': 0.4936949734911705, 'min_impurity_decrease': 0.419180548163323, 'max_features': 0.5341015084696598, 'subsample': 0.9970899688616819, 'dropout_rate': 0.5048755908493928, 'ccp_alpha': 1.3592750169243222}. Best is trial 3 with value: 0.5.[0m
[32m[I 2022-05-06 16:56:02,521][0m Trial 14 finished with value: 0.5 and parameters: {'loss': 'coxph', 'learning_rate': 0.00013445820020722683, 'n_estimators': 943, 'criterion': 'absolute_error', 'min_samples_split': 9, 'min_samples_leaf': 6, 'min_weight_fraction_leaf': 0.32097064580401147, 'min_impurity_decrease': 0.5232438744727512, 'max_features': 0.6015899601303234, 'subsample': 0.5725274691566372, 'dropout_rate': 0.5238750051669665, 'ccp_alpha': 2.570295043950783}. Best is trial 3 with value: 0.5.[0m
[32m[I 2022-05-06 17:00:20,682][0m Trial 15 finished with value: 0.5 and parameters: {'loss': 'coxph', 'learning_rate': 7.246853747984079e-06, 'n_estimators': 122, 'criterion': 'friedman_mse', 'min_samples_split': 6, 'min_samples_leaf': 8, 'min_weight_fraction_leaf': 0.17217206988604009, 'min_impurity_decrease': 0.7810887516643965, 'max_features': 0.8633976691616363, 'subsample': 0.3516233961900199, 'dropout_rate': 0.8485323148913713, 'ccp_alpha': 3.9097930502293705}. Best is trial 3 with value: 0.5.[0m
[32m[I 2022-05-06 17:27:08,024][0m Trial 16 finished with value: 0.5 and parameters: {'loss': 'coxph', 'learning_rate': 7.347512381050869e-05, 'n_estimators': 509, 'criterion': 'absolute_error', 'min_samples_split': 2, 'min_samples_leaf': 9, 'min_weight_fraction_leaf': 0.003114102539184021, 'min_impurity_decrease': 0.6197650899667376, 'max_features': 0.4328993539927101, 'subsample': 0.8221191336919113, 'dropout_rate': 0.6131542870982364, 'ccp_alpha': 0.32900406184224606}. Best is trial 3 with value: 0.5.[0m
[32m[I 2022-05-06 17:47:15,156][0m Trial 17 finished with value: 0.5 and parameters: {'loss': 'coxph', 'learning_rate': 0.00027541461762092795, 'n_estimators': 558, 'criterion': 'absolute_error', 'min_samples_split': 2, 'min_samples_leaf': 4, 'min_weight_fraction_leaf': 0.321993390658262, 'min_impurity_decrease': 0.33496234619250687, 'max_features': 0.10157653448807413, 'subsample': 0.5892660705713026, 'dropout_rate': 0.5118390507770769, 'ccp_alpha': 0.13975062133344424}. Best is trial 3 with value: 0.5.[0m
[32m[I 2022-05-06 17:50:52,842][0m Trial 18 finished with value: 0.5 and parameters: {'loss': 'coxph', 'learning_rate': 0.02237243486019666, 'n_estimators': 102, 'criterion': 'friedman_mse', 'min_samples_split': 3, 'min_samples_leaf': 4, 'min_weight_fraction_leaf': 0.19977972178723025, 'min_impurity_decrease': 0.8484596706887102, 'max_features': 0.06921349039793011, 'subsample': 0.32987293641502535, 'dropout_rate': 0.8693476795277166, 'ccp_alpha': 4.159713810241559}. Best is trial 3 with value: 0.5.[0m
[32m[I 2022-05-06 18:07:15,072][0m Trial 19 finished with value: 0.5 and parameters: {'loss': 'coxph', 'learning_rate': 0.03009955331853576, 'n_estimators': 459, 'criterion': 'squared_error', 'min_samples_split': 3, 'min_samples_leaf': 1, 'min_weight_fraction_leaf': 0.12709144268041478, 'min_impurity_decrease': 0.9514282412380717, 'max_features': 0.18375504414153426, 'subsample': 0.3497166781053295, 'dropout_rate': 0.8634370170566882, 'ccp_alpha': 4.1852681385900015}. Best is trial 3 with value: 0.5.[0m
[32m[I 2022-05-06 18:24:43,098][0m Trial 20 finished with value: 0.5 and parameters: {'loss': 'coxph', 'learning_rate': 0.010486521230613817, 'n_estimators': 480, 'criterion': 'squared_error', 'min_samples_split': 3, 'min_samples_leaf': 1, 'min_weight_fraction_leaf': 0.1166890074049167, 'min_impurity_decrease': 0.9846829341397645, 'max_features': 0.1791636931382697, 'subsample': 0.4306817999366385, 'dropout_rate': 0.3714253714160535, 'ccp_alpha': 0.0017831756504086693}. Best is trial 3 with value: 0.5.[0m
[32m[I 2022-05-06 18:38:28,193][0m Trial 21 finished with value: 0.5 and parameters: {'loss': 'coxph', 'learning_rate': 0.0006742375087751243, 'n_estimators': 347, 'criterion': 'friedman_mse', 'min_samples_split': 2, 'min_samples_leaf': 4, 'min_weight_fraction_leaf': 0.21643742173425054, 'min_impurity_decrease': 0.8619840402539437, 'max_features': 0.009666397825872863, 'subsample': 0.2162497259697127, 'dropout_rate': 0.9763121991368795, 'ccp_alpha': 2.8005177040840596}. Best is trial 3 with value: 0.5.[0m
[32m[I 2022-05-06 18:52:59,342][0m Trial 22 finished with value: 0.5 and parameters: {'loss': 'coxph', 'learning_rate': 0.07683504510982267, 'n_estimators': 358, 'criterion': 'squared_error', 'min_samples_split': 3, 'min_samples_leaf': 5, 'min_weight_fraction_leaf': 0.14793943045037558, 'min_impurity_decrease': 0.8646773742030205, 'max_features': 0.997276558151719, 'subsample': 0.2122753217186416, 'dropout_rate': 0.8665782890864001, 'ccp_alpha': 4.043616286045336}. Best is trial 3 with value: 0.5.[0m
[32m[I 2022-05-06 19:02:37,443][0m Trial 23 finished with value: 0.5 and parameters: {'loss': 'coxph', 'learning_rate': 0.014874335889311582, 'n_estimators': 276, 'criterion': 'squared_error', 'min_samples_split': 4, 'min_samples_leaf': 1, 'min_weight_fraction_leaf': 0.0708271438384957, 'min_impurity_decrease': 0.9816900297886264, 'max_features': 0.18754039441036957, 'subsample': 0.427335052308373, 'dropout_rate': 0.36494818731622336, 'ccp_alpha': 3.64305346284484}. Best is trial 3 with value: 0.5.[0m
[32m[I 2022-05-06 19:14:33,264][0m Trial 24 finished with value: 0.5 and parameters: {'loss': 'coxph', 'learning_rate': 0.005294754859741474, 'n_estimators': 285, 'criterion': 'squared_error', 'min_samples_split': 5, 'min_samples_leaf': 3, 'min_weight_fraction_leaf': 0.05496546014526263, 'min_impurity_decrease': 0.7546880832302453, 'max_features': 0.17586098385927276, 'subsample': 0.21297893685575625, 'dropout_rate': 0.41227394167845044, 'ccp_alpha': 2.5027600071637797}. Best is trial 3 with value: 0.5.[0m
[32m[I 2022-05-06 19:29:00,356][0m Trial 25 finished with value: 0.5 and parameters: {'loss': 'coxph', 'learning_rate': 0.0013717695578301745, 'n_estimators': 338, 'criterion': 'absolute_error', 'min_samples_split': 3, 'min_samples_leaf': 5, 'min_weight_fraction_leaf': 0.222890019803639, 'min_impurity_decrease': 0.0011460297541748682, 'max_features': 0.9601023508976518, 'subsample': 0.19223788570958544, 'dropout_rate': 0.9984834481834501, 'ccp_alpha': 2.7494973930172084}. Best is trial 3 with value: 0.5.[0m
[32m[I 2022-05-06 19:35:53,689][0m Trial 26 finished with value: 0.5 and parameters: {'loss': 'coxph', 'learning_rate': 0.07481685277133933, 'n_estimators': 210, 'criterion': 'squared_error', 'min_samples_split': 4, 'min_samples_leaf': 6, 'min_weight_fraction_leaf': 0.1503228883577308, 'min_impurity_decrease': 0.14876718855455803, 'max_features': 0.8822993951764238, 'subsample': 0.4653478120418486, 'dropout_rate': 0.8070967650648845, 'ccp_alpha': 3.5520355706417774}. Best is trial 3 with value: 0.5.[0m
[32m[I 2022-05-06 19:45:20,705][0m Trial 27 finished with value: 0.5 and parameters: {'loss': 'coxph', 'learning_rate': 0.004319290127888957, 'n_estimators': 270, 'criterion': 'squared_error', 'min_samples_split': 5, 'min_samples_leaf': 2, 'min_weight_fraction_leaf': 0.05859711510814797, 'min_impurity_decrease': 0.4505049023920301, 'max_features': 0.4887778077856346, 'subsample': 0.41558022718800536, 'dropout_rate': 0.4232890656667019, 'ccp_alpha': 1.2709085901721635}. Best is trial 3 with value: 0.5.[0m
[32m[I 2022-05-06 19:55:34,560][0m Trial 28 finished with value: 0.5 and parameters: {'loss': 'coxph', 'learning_rate': 0.0040477395915295335, 'n_estimators': 228, 'criterion': 'friedman_mse', 'min_samples_split': 5, 'min_samples_leaf': 3, 'min_weight_fraction_leaf': 0.49593920765672733, 'min_impurity_decrease': 0.0191267572223662, 'max_features': 0.60222948278698, 'subsample': 0.1527452232547168, 'dropout_rate': 0.18403654652898288, 'ccp_alpha': 2.45033727448015}. Best is trial 3 with value: 0.5.[0m
[32m[I 2022-05-06 20:05:12,866][0m Trial 29 finished with value: 0.5 and parameters: {'loss': 'coxph', 'learning_rate': 0.0002710725134749635, 'n_estimators': 178, 'criterion': 'absolute_error', 'min_samples_split': 4, 'min_samples_leaf': 6, 'min_weight_fraction_leaf': 0.2379718831465455, 'min_impurity_decrease': 0.09581081750581259, 'max_features': 0.8239219114060441, 'subsample': 0.5681470388143299, 'dropout_rate': 0.6076862539593783, 'ccp_alpha': 2.72101325160281}. Best is trial 3 with value: 0.5.[0m
