[32m[I 2022-04-21 12:27:42,594][0m Trial 319 finished with value: 0.9149923995419167 and parameters: {'alpha': 1.6719809817626814, 'ties': 'breslow'}. Best is trial 224 with value: 0.9150266259409126.[0m
[32m[I 2022-04-21 12:27:50,111][0m Trial 320 finished with value: 0.9150145471736291 and parameters: {'alpha': 1.8229761159885485, 'ties': 'breslow'}. Best is trial 224 with value: 0.9150266259409126.[0m
[32m[I 2022-04-21 12:27:59,735][0m Trial 321 finished with value: 0.9149394003302772 and parameters: {'alpha': 2.9970621434952567, 'ties': 'breslow'}. Best is trial 224 with value: 0.9150266259409126.[0m
[32m[I 2022-04-21 12:28:10,493][0m Trial 322 finished with value: 0.9149792585954188 and parameters: {'alpha': 2.0526400964650016, 'ties': 'breslow'}. Best is trial 224 with value: 0.9150266259409126.[0m
[32m[I 2022-04-21 12:28:20,286][0m Trial 323 finished with value: 0.9150204162375852 and parameters: {'alpha': 1.8744043727309712, 'ties': 'breslow'}. Best is trial 224 with value: 0.9150266259409126.[0m
[32m[I 2022-04-21 12:28:30,655][0m Trial 324 finished with value: 0.9149742629108782 and parameters: {'alpha': 1.4920737349003752, 'ties': 'breslow'}. Best is trial 224 with value: 0.9150266259409126.[0m
[32m[I 2022-04-21 12:28:41,017][0m Trial 325 finished with value: 0.9149296060550896 and parameters: {'alpha': 3.2214529086126715, 'ties': 'breslow'}. Best is trial 224 with value: 0.9150266259409126.[0m
[32m[I 2022-04-21 12:28:50,458][0m Trial 326 finished with value: 0.9149094202191131 and parameters: {'alpha': 0.8854830485934877, 'ties': 'breslow'}. Best is trial 224 with value: 0.9150266259409126.[0m
[32m[I 2022-04-21 12:28:59,118][0m Trial 327 finished with value: 0.914992380668008 and parameters: {'alpha': 2.010429439455589, 'ties': 'breslow'}. Best is trial 224 with value: 0.9150266259409126.[0m
[32m[I 2022-04-21 12:29:08,043][0m Trial 328 finished with value: 0.9149999841634514 and parameters: {'alpha': 1.7400804219807444, 'ties': 'breslow'}. Best is trial 224 with value: 0.9150266259409126.[0m
[32m[I 2022-04-21 12:29:18,279][0m Trial 329 finished with value: 0.9149717633487702 and parameters: {'alpha': 2.163439004453944, 'ties': 'breslow'}. Best is trial 224 with value: 0.9150266259409126.[0m
[32m[I 2022-04-21 12:29:27,269][0m Trial 330 finished with value: 0.915024858891153 and parameters: {'alpha': 1.9110392014239237, 'ties': 'breslow'}. Best is trial 224 with value: 0.9150266259409126.[0m
[32m[I 2022-04-21 12:29:34,510][0m Trial 331 finished with value: 0.9150217027724945 and parameters: {'alpha': 1.9188275145658573, 'ties': 'breslow'}. Best is trial 224 with value: 0.9150266259409126.[0m
[32m[I 2022-04-21 12:29:43,053][0m Trial 332 finished with value: 0.9149819761558451 and parameters: {'alpha': 1.6026029719979906, 'ties': 'breslow'}. Best is trial 224 with value: 0.9150266259409126.[0m
[32m[I 2022-04-21 12:29:50,490][0m Trial 333 finished with value: 0.9150094314705427 and parameters: {'alpha': 1.8074658055729953, 'ties': 'breslow'}. Best is trial 224 with value: 0.9150266259409126.[0m
[32m[I 2022-04-21 12:30:05,372][0m Trial 334 finished with value: 0.9148904194662573 and parameters: {'alpha': 4.5173274301132125, 'ties': 'efron'}. Best is trial 224 with value: 0.9150266259409126.[0m
[32m[I 2022-04-21 12:30:13,723][0m Trial 335 finished with value: 0.9149946426142547 and parameters: {'alpha': 1.9976636093967766, 'ties': 'breslow'}. Best is trial 224 with value: 0.9150266259409126.[0m
[32m[I 2022-04-21 12:30:23,755][0m Trial 336 finished with value: 0.9150167807980474 and parameters: {'alpha': 1.8584227466918555, 'ties': 'breslow'}. Best is trial 224 with value: 0.9150266259409126.[0m
[32m[I 2022-04-21 12:30:33,604][0m Trial 337 finished with value: 0.9149648328406045 and parameters: {'alpha': 2.369987399303926, 'ties': 'breslow'}. Best is trial 224 with value: 0.9150266259409126.[0m
[32m[I 2022-04-21 12:30:40,311][0m Trial 338 finished with value: 0.9149707693551488 and parameters: {'alpha': 2.093467219546249, 'ties': 'breslow'}. Best is trial 224 with value: 0.9150266259409126.[0m
[32m[I 2022-04-21 12:30:47,507][0m Trial 339 finished with value: 0.9149918992994323 and parameters: {'alpha': 1.702753369100298, 'ties': 'breslow'}. Best is trial 224 with value: 0.9150266259409126.[0m
[32m[I 2022-04-21 12:30:53,519][0m Trial 340 finished with value: 0.9150245552180374 and parameters: {'alpha': 1.942187231378567, 'ties': 'breslow'}. Best is trial 224 with value: 0.9150266259409126.[0m
[32m[I 2022-04-21 12:31:01,649][0m Trial 341 finished with value: 0.9150145471736291 and parameters: {'alpha': 1.8229527036688633, 'ties': 'breslow'}. Best is trial 224 with value: 0.9150266259409126.[0m
[32m[I 2022-04-21 12:31:10,745][0m Trial 342 finished with value: 0.9149922861465061 and parameters: {'alpha': 2.0051592891629535, 'ties': 'breslow'}. Best is trial 224 with value: 0.9150266259409126.[0m
[32m[I 2022-04-21 12:31:21,146][0m Trial 343 finished with value: 0.9150217027724945 and parameters: {'alpha': 1.9188957979043322, 'ties': 'breslow'}. Best is trial 224 with value: 0.9150266259409126.[0m
[32m[I 2022-04-21 12:31:28,884][0m Trial 344 finished with value: 0.9149737178143003 and parameters: {'alpha': 2.139285299232567, 'ties': 'breslow'}. Best is trial 224 with value: 0.9150266259409126.[0m
[32m[I 2022-04-21 12:31:37,991][0m Trial 345 finished with value: 0.9150055203256382 and parameters: {'alpha': 1.7766843189446624, 'ties': 'breslow'}. Best is trial 224 with value: 0.9150266259409126.[0m
[32m[I 2022-04-21 12:31:47,441][0m Trial 346 finished with value: 0.9149832865228067 and parameters: {'alpha': 2.032669257538675, 'ties': 'breslow'}. Best is trial 224 with value: 0.9150266259409126.[0m
[32m[I 2022-04-21 12:31:57,644][0m Trial 347 finished with value: 0.9150258941989851 and parameters: {'alpha': 1.8963790656863295, 'ties': 'breslow'}. Best is trial 224 with value: 0.9150266259409126.[0m
[32m[I 2022-04-21 12:32:07,465][0m Trial 348 finished with value: 0.915016204171329 and parameters: {'alpha': 1.8639345112400514, 'ties': 'breslow'}. Best is trial 224 with value: 0.9150266259409126.[0m
[32m[I 2022-04-21 12:32:16,446][0m Trial 349 finished with value: 0.9149880475564046 and parameters: {'alpha': 1.624931050617501, 'ties': 'breslow'}. Best is trial 224 with value: 0.9150266259409126.[0m
[32m[I 2022-04-21 12:32:26,649][0m Trial 350 finished with value: 0.9149698194709759 and parameters: {'alpha': 2.219754647443278, 'ties': 'breslow'}. Best is trial 224 with value: 0.9150266259409126.[0m
[32m[I 2022-04-21 12:32:36,827][0m Trial 351 finished with value: 0.9149964095580396 and parameters: {'alpha': 1.715594499240891, 'ties': 'breslow'}. Best is trial 224 with value: 0.9150266259409126.[0m
[32m[I 2022-04-21 12:32:46,094][0m Trial 352 finished with value: 0.9150126393746237 and parameters: {'alpha': 1.8194874915301236, 'ties': 'breslow'}. Best is trial 224 with value: 0.9150266259409126.[0m
[32m[I 2022-04-21 12:32:56,675][0m Trial 353 finished with value: 0.915022244010671 and parameters: {'alpha': 1.9562996181092054, 'ties': 'breslow'}. Best is trial 224 with value: 0.9150266259409126.[0m
[32m[I 2022-04-21 12:33:09,374][0m Trial 354 finished with value: 0.9149298966546479 and parameters: {'alpha': 2.0588370441709776, 'ties': 'efron'}. Best is trial 224 with value: 0.9150266259409126.[0m
[32m[I 2022-04-21 12:33:20,578][0m Trial 355 finished with value: 0.9150244780781993 and parameters: {'alpha': 1.8885512787863667, 'ties': 'breslow'}. Best is trial 224 with value: 0.9150266259409126.[0m
[32m[I 2022-04-21 12:33:30,891][0m Trial 356 finished with value: 0.9149724287660927 and parameters: {'alpha': 1.4306367460729401, 'ties': 'breslow'}. Best is trial 224 with value: 0.9150266259409126.[0m
[32m[I 2022-04-21 12:33:40,317][0m Trial 357 finished with value: 0.9149987876624982 and parameters: {'alpha': 1.7375938587684583, 'ties': 'breslow'}. Best is trial 224 with value: 0.9150266259409126.[0m
[32m[I 2022-04-21 12:33:51,117][0m Trial 358 finished with value: 0.9150238262644586 and parameters: {'alpha': 1.9803230033850063, 'ties': 'breslow'}. Best is trial 224 with value: 0.9150266259409126.[0m
[32m[I 2022-04-21 12:34:02,433][0m Trial 359 finished with value: 0.9150166354348034 and parameters: {'alpha': 1.831283248779413, 'ties': 'breslow'}. Best is trial 224 with value: 0.9150266259409126.[0m
[32m[I 2022-04-21 12:34:11,964][0m Trial 360 finished with value: 0.9149577520956118 and parameters: {'alpha': 2.5623853203543243, 'ties': 'breslow'}. Best is trial 224 with value: 0.9150266259409126.[0m
[32m[I 2022-04-21 12:34:19,754][0m Trial 361 finished with value: 0.9149745793780408 and parameters: {'alpha': 2.1325441954948072, 'ties': 'breslow'}. Best is trial 224 with value: 0.9150266259409126.[0m
[32m[I 2022-04-21 12:34:31,166][0m Trial 362 finished with value: 0.9149542320206316 and parameters: {'alpha': 2.8592656103452505, 'ties': 'breslow'}. Best is trial 224 with value: 0.9150266259409126.[0m
[32m[I 2022-04-21 12:34:40,066][0m Trial 363 finished with value: 0.9149704770801315 and parameters: {'alpha': 1.5581663649115183, 'ties': 'breslow'}. Best is trial 224 with value: 0.9150266259409126.[0m
[32m[I 2022-04-21 12:34:49,182][0m Trial 364 finished with value: 0.9150197199260918 and parameters: {'alpha': 1.9280827216990808, 'ties': 'breslow'}. Best is trial 224 with value: 0.9150266259409126.[0m
[32m[I 2022-04-21 12:34:58,990][0m Trial 365 finished with value: 0.9149927144901907 and parameters: {'alpha': 1.6823779522889926, 'ties': 'breslow'}. Best is trial 224 with value: 0.9150266259409126.[0m
[32m[I 2022-04-21 12:35:09,580][0m Trial 366 finished with value: 0.9149811849689355 and parameters: {'alpha': 2.0401478846302115, 'ties': 'breslow'}. Best is trial 224 with value: 0.9150266259409126.[0m
[32m[I 2022-04-21 12:35:20,384][0m Trial 367 finished with value: 0.9150130102006578 and parameters: {'alpha': 1.8218875805598902, 'ties': 'breslow'}. Best is trial 224 with value: 0.9150266259409126.[0m
[32m[I 2022-04-21 12:35:29,298][0m Trial 368 finished with value: 0.9150252726011955 and parameters: {'alpha': 1.9095172846802073, 'ties': 'breslow'}. Best is trial 224 with value: 0.9150266259409126.[0m
[32m[I 2022-04-21 12:35:39,152][0m Trial 369 finished with value: 0.9150076829681979 and parameters: {'alpha': 1.7578794863024474, 'ties': 'breslow'}. Best is trial 224 with value: 0.9150266259409126.[0m
[32m[I 2022-04-21 12:35:49,352][0m Trial 370 finished with value: 0.9149916544838366 and parameters: {'alpha': 2.0053715918442276, 'ties': 'breslow'}. Best is trial 224 with value: 0.9150266259409126.[0m
[32m[I 2022-04-21 12:35:59,801][0m Trial 371 finished with value: 0.9149614131842567 and parameters: {'alpha': 2.2979002929649113, 'ties': 'breslow'}. Best is trial 224 with value: 0.9150266259409126.[0m
[32m[I 2022-04-21 12:36:10,095][0m Trial 372 finished with value: 0.9149726454377956 and parameters: {'alpha': 2.1066069377695467, 'ties': 'breslow'}. Best is trial 224 with value: 0.9150266259409126.[0m
[32m[I 2022-04-21 12:36:24,599][0m Trial 373 finished with value: 0.9149137461174549 and parameters: {'alpha': 1.8913342490923382, 'ties': 'efron'}. Best is trial 224 with value: 0.9150266259409126.[0m
[32m[I 2022-04-21 12:36:35,238][0m Trial 374 finished with value: 0.9150058295187463 and parameters: {'alpha': 1.793925137230501, 'ties': 'breslow'}. Best is trial 224 with value: 0.9150266259409126.[0m
[32m[I 2022-04-21 12:36:46,033][0m Trial 375 finished with value: 0.914972788104903 and parameters: {'alpha': 2.1994747854315886, 'ties': 'breslow'}. Best is trial 224 with value: 0.9150266259409126.[0m
[32m[I 2022-04-21 12:36:56,366][0m Trial 376 finished with value: 0.9149914478648637 and parameters: {'alpha': 1.664935204050073, 'ties': 'breslow'}. Best is trial 224 with value: 0.9150266259409126.[0m
[32m[I 2022-04-21 12:37:06,439][0m Trial 377 finished with value: 0.9149447860522063 and parameters: {'alpha': 1.1200669859977528, 'ties': 'breslow'}. Best is trial 224 with value: 0.9150266259409126.[0m
[32m[I 2022-04-21 12:37:14,832][0m Trial 378 finished with value: 0.9149938837661032 and parameters: {'alpha': 2.000275548234448, 'ties': 'breslow'}. Best is trial 224 with value: 0.9150266259409126.[0m
[32m[I 2022-04-21 12:37:23,606][0m Trial 379 finished with value: 0.9150245313575087 and parameters: {'alpha': 1.889007519656677, 'ties': 'breslow'}. Best is trial 224 with value: 0.9150266259409126.[0m
[32m[I 2022-04-21 12:37:31,483][0m Trial 380 finished with value: 0.9150074623994652 and parameters: {'alpha': 1.7603198452960962, 'ties': 'breslow'}. Best is trial 224 with value: 0.9150266259409126.[0m
[32m[I 2022-04-21 12:37:41,911][0m Trial 381 finished with value: 0.9150216341149143 and parameters: {'alpha': 1.9615880014709444, 'ties': 'breslow'}. Best is trial 224 with value: 0.9150266259409126.[0m
[32m[I 2022-04-21 12:37:51,149][0m Trial 382 finished with value: 0.9149745057707204 and parameters: {'alpha': 2.073428031413357, 'ties': 'breslow'}. Best is trial 224 with value: 0.9150266259409126.[0m
[32m[I 2022-04-21 12:37:59,639][0m Trial 383 finished with value: 0.9150161620019601 and parameters: {'alpha': 1.8569818443926995, 'ties': 'breslow'}. Best is trial 224 with value: 0.9150266259409126.[0m
[32m[I 2022-04-21 12:38:06,389][0m Trial 384 finished with value: 0.9149784283146992 and parameters: {'alpha': 1.576911217557475, 'ties': 'breslow'}. Best is trial 224 with value: 0.9150266259409126.[0m
[32m[I 2022-04-21 12:38:16,850][0m Trial 385 finished with value: 0.9148675888761899 and parameters: {'alpha': 0.6140378940360942, 'ties': 'breslow'}. Best is trial 224 with value: 0.9150266259409126.[0m
[32m[I 2022-04-21 12:38:25,687][0m Trial 386 finished with value: 0.9150226853509335 and parameters: {'alpha': 1.9689298847178016, 'ties': 'breslow'}. Best is trial 224 with value: 0.9150266259409126.[0m
[32m[I 2022-04-21 12:38:33,363][0m Trial 387 finished with value: 0.9149963001629302 and parameters: {'alpha': 1.7165238132179963, 'ties': 'breslow'}. Best is trial 224 with value: 0.9150266259409126.[0m
[32m[I 2022-04-21 12:38:42,391][0m Trial 388 finished with value: 0.9149709943014639 and parameters: {'alpha': 2.147876893226808, 'ties': 'breslow'}. Best is trial 224 with value: 0.9150266259409126.[0m
[32m[I 2022-04-21 12:38:53,251][0m Trial 389 finished with value: 0.9150164764367323 and parameters: {'alpha': 1.8299565756110105, 'ties': 'breslow'}. Best is trial 224 with value: 0.9150266259409126.[0m
[32m[I 2022-04-21 12:39:04,334][0m Trial 390 finished with value: 0.9150257541686159 and parameters: {'alpha': 1.9137851584846075, 'ties': 'breslow'}. Best is trial 224 with value: 0.9150266259409126.[0m
[32m[I 2022-04-21 12:39:15,716][0m Trial 391 finished with value: 0.914976744471657 and parameters: {'alpha': 2.056687431533805, 'ties': 'breslow'}. Best is trial 224 with value: 0.9150266259409126.[0m
[32m[I 2022-04-21 12:39:23,936][0m Trial 392 finished with value: 0.9150065370554132 and parameters: {'alpha': 1.7899129797792084, 'ties': 'breslow'}. Best is trial 224 with value: 0.9150266259409126.[0m
[32m[I 2022-04-21 12:39:33,430][0m Trial 393 finished with value: 0.9150216719479308 and parameters: {'alpha': 1.9250385047762817, 'ties': 'breslow'}. Best is trial 224 with value: 0.9150266259409126.[0m
[32m[I 2022-04-21 12:39:43,691][0m Trial 394 finished with value: 0.914982280024898 and parameters: {'alpha': 2.0372568175697956, 'ties': 'breslow'}. Best is trial 224 with value: 0.9150266259409126.[0m
[32m[I 2022-04-21 12:39:56,425][0m Trial 395 finished with value: 0.914899757547829 and parameters: {'alpha': 1.6553431443570645, 'ties': 'efron'}. Best is trial 224 with value: 0.9150266259409126.[0m
[32m[I 2022-04-21 12:40:06,072][0m Trial 396 finished with value: 0.9146348162707125 and parameters: {'alpha': 0.06690622612777641, 'ties': 'breslow'}. Best is trial 224 with value: 0.9150266259409126.[0m
[32m[I 2022-04-21 12:40:15,915][0m Trial 397 finished with value: 0.9150176515842853 and parameters: {'alpha': 1.8715423046801685, 'ties': 'breslow'}. Best is trial 224 with value: 0.9150266259409126.[0m
[32m[I 2022-04-21 12:40:27,230][0m Trial 398 finished with value: 0.9149704267079748 and parameters: {'alpha': 2.211754908190644, 'ties': 'breslow'}. Best is trial 224 with value: 0.9150266259409126.[0m
[32m[I 2022-04-21 12:40:38,131][0m Trial 399 finished with value: 0.9150241557491118 and parameters: {'alpha': 1.9732129833129535, 'ties': 'breslow'}. Best is trial 224 with value: 0.9150266259409126.[0m
[32m[I 2022-04-21 12:40:49,607][0m Trial 400 finished with value: 0.9149224334387673 and parameters: {'alpha': 4.044723626872914, 'ties': 'breslow'}. Best is trial 224 with value: 0.9150266259409126.[0m
[32m[I 2022-04-21 12:40:58,839][0m Trial 401 finished with value: 0.9150060345033457 and parameters: {'alpha': 1.774465970358668, 'ties': 'breslow'}. Best is trial 224 with value: 0.9150266259409126.[0m
[32m[I 2022-04-21 12:41:09,015][0m Trial 402 finished with value: 0.9149721422775505 and parameters: {'alpha': 2.104046790313669, 'ties': 'breslow'}. Best is trial 224 with value: 0.9150266259409126.[0m
[32m[I 2022-04-21 12:41:19,787][0m Trial 403 finished with value: 0.9150250691356435 and parameters: {'alpha': 1.9050539616315685, 'ties': 'breslow'}. Best is trial 224 with value: 0.9150266259409126.[0m
[32m[I 2022-04-21 12:41:29,593][0m Trial 404 finished with value: 0.9150153826405901 and parameters: {'alpha': 1.8381509922290902, 'ties': 'breslow'}. Best is trial 224 with value: 0.9150266259409126.[0m
[32m[I 2022-04-21 12:41:38,075][0m Trial 405 finished with value: 0.9149980677062309 and parameters: {'alpha': 1.7208273769826734, 'ties': 'breslow'}. Best is trial 224 with value: 0.9150266259409126.[0m
[32m[I 2022-04-21 12:41:48,023][0m Trial 406 finished with value: 0.9149952271886423 and parameters: {'alpha': 1.9961269308835696, 'ties': 'breslow'}. Best is trial 224 with value: 0.9150266259409126.[0m
[32m[I 2022-04-21 12:41:59,090][0m Trial 407 finished with value: 0.9150195803138674 and parameters: {'alpha': 1.9301965774438417, 'ties': 'breslow'}. Best is trial 224 with value: 0.9150266259409126.[0m
[32m[I 2022-04-21 12:42:10,854][0m Trial 408 finished with value: 0.9149880555887083 and parameters: {'alpha': 1.6129520727973672, 'ties': 'breslow'}. Best is trial 224 with value: 0.9150266259409126.[0m
[32m[I 2022-04-21 12:42:20,338][0m Trial 409 finished with value: 0.9150132304906148 and parameters: {'alpha': 1.819450208256475, 'ties': 'breslow'}. Best is trial 224 with value: 0.9150266259409126.[0m
[32m[I 2022-04-21 12:42:30,642][0m Trial 410 finished with value: 0.914976286078694 and parameters: {'alpha': 2.0633004975861526, 'ties': 'breslow'}. Best is trial 224 with value: 0.9150266259409126.[0m
[32m[I 2022-04-21 12:42:43,148][0m Trial 411 finished with value: 0.91502674920718 and parameters: {'alpha': 1.902054266365928, 'ties': 'breslow'}. Best is trial 411 with value: 0.91502674920718.[0m
[32m[I 2022-04-21 12:42:58,062][0m Trial 412 finished with value: 0.914893314373931 and parameters: {'alpha': 1.718633068141449, 'ties': 'efron'}. Best is trial 411 with value: 0.91502674920718.[0m
[32m[I 2022-04-21 12:43:08,271][0m Trial 413 finished with value: 0.9149728412806063 and parameters: {'alpha': 2.162115920258274, 'ties': 'breslow'}. Best is trial 411 with value: 0.91502674920718.[0m
[32m[I 2022-04-21 12:43:19,087][0m Trial 414 finished with value: 0.9149925342907599 and parameters: {'alpha': 1.994322563203316, 'ties': 'breslow'}. Best is trial 411 with value: 0.91502674920718.[0m
[32m[I 2022-04-21 12:43:31,815][0m Trial 415 finished with value: 0.9150166354348034 and parameters: {'alpha': 1.831295585806097, 'ties': 'breslow'}. Best is trial 411 with value: 0.91502674920718.[0m
[32m[I 2022-04-21 12:43:41,776][0m Trial 416 finished with value: 0.9150266259409126 and parameters: {'alpha': 1.9016679977485846, 'ties': 'breslow'}. Best is trial 411 with value: 0.91502674920718.[0m
[32m[I 2022-04-21 12:43:51,768][0m Trial 417 finished with value: 0.9149981911649595 and parameters: {'alpha': 1.7371776673079773, 'ties': 'breslow'}. Best is trial 411 with value: 0.91502674920718.[0m
[32m[I 2022-04-21 12:44:02,018][0m Trial 418 finished with value: 0.9150197423906026 and parameters: {'alpha': 1.8793182205736085, 'ties': 'breslow'}. Best is trial 411 with value: 0.91502674920718.[0m
[32m[I 2022-04-21 12:44:12,615][0m Trial 419 finished with value: 0.9149930185115185 and parameters: {'alpha': 2.0293599881605284, 'ties': 'breslow'}. Best is trial 411 with value: 0.91502674920718.[0m
[32m[I 2022-04-21 12:44:23,442][0m Trial 420 finished with value: 0.914962921362411 and parameters: {'alpha': 1.2989485995755037, 'ties': 'breslow'}. Best is trial 411 with value: 0.91502674920718.[0m
[32m[I 2022-04-21 12:44:32,261][0m Trial 421 finished with value: 0.9149849627937294 and parameters: {'alpha': 1.6391705101110978, 'ties': 'breslow'}. Best is trial 411 with value: 0.91502674920718.[0m
[32m[I 2022-04-21 12:44:42,663][0m Trial 422 finished with value: 0.9150060694281468 and parameters: {'alpha': 1.7842168606580107, 'ties': 'breslow'}. Best is trial 411 with value: 0.91502674920718.[0m
[32m[I 2022-04-21 12:44:53,483][0m Trial 423 finished with value: 0.9150220658428843 and parameters: {'alpha': 1.9534059323811075, 'ties': 'breslow'}. Best is trial 411 with value: 0.91502674920718.[0m
[32m[I 2022-04-21 12:45:01,794][0m Trial 424 finished with value: 0.914974534568708 and parameters: {'alpha': 1.5165483938114637, 'ties': 'breslow'}. Best is trial 411 with value: 0.91502674920718.[0m
