[32m[I 2022-05-19 03:41:53,713][0m Trial 804 finished with value: 0.7626508911808816 and parameters: {'loss': 'coxph', 'learning_rate': 0.026248185713714612, 'n_estimators': 113, 'criterion': 'friedman_mse', 'min_samples_split': 3, 'min_samples_leaf': 4, 'min_weight_fraction_leaf': 0.019033676578418215, 'min_impurity_decrease': 0.5879650858991331, 'max_features': 0.5551557581731713, 'subsample': 0.12093187980348591, 'dropout_rate': 0.033787798897155566, 'ccp_alpha': 0.20101401337434233}. Best is trial 759 with value: 0.8618735483942033.[0m
[32m[I 2022-05-19 03:46:28,648][0m Trial 805 finished with value: 0.7933364472363358 and parameters: {'loss': 'coxph', 'learning_rate': 0.03822088382923362, 'n_estimators': 105, 'criterion': 'friedman_mse', 'min_samples_split': 3, 'min_samples_leaf': 4, 'min_weight_fraction_leaf': 0.007721942443007647, 'min_impurity_decrease': 0.5679820458985416, 'max_features': 0.615359947485171, 'subsample': 0.11907020856159484, 'dropout_rate': 0.071671370446444, 'ccp_alpha': 0.09473937051170195}. Best is trial 759 with value: 0.8618735483942033.[0m
[32m[I 2022-05-19 03:51:52,732][0m Trial 806 finished with value: 0.7456442998480292 and parameters: {'loss': 'coxph', 'learning_rate': 0.019466816665692267, 'n_estimators': 121, 'criterion': 'friedman_mse', 'min_samples_split': 3, 'min_samples_leaf': 4, 'min_weight_fraction_leaf': 0.0015591094575664738, 'min_impurity_decrease': 0.5952455131627019, 'max_features': 0.5969487915974315, 'subsample': 0.09978184533028711, 'dropout_rate': 0.019550412773842396, 'ccp_alpha': 0.2747841326871306}. Best is trial 759 with value: 0.8618735483942033.[0m
[32m[I 2022-05-19 03:56:33,351][0m Trial 807 finished with value: 0.795930730906203 and parameters: {'loss': 'coxph', 'learning_rate': 0.030930930699920204, 'n_estimators': 109, 'criterion': 'friedman_mse', 'min_samples_split': 3, 'min_samples_leaf': 4, 'min_weight_fraction_leaf': 0.025901435050729907, 'min_impurity_decrease': 0.6187577441232159, 'max_features': 0.5812641989144759, 'subsample': 0.1318824216988877, 'dropout_rate': 0.0391366768790156, 'ccp_alpha': 0.08936824711470548}. Best is trial 759 with value: 0.8618735483942033.[0m
[32m[I 2022-05-19 04:01:42,532][0m Trial 808 finished with value: 0.7949774528815409 and parameters: {'loss': 'coxph', 'learning_rate': 0.04425297061259999, 'n_estimators': 120, 'criterion': 'friedman_mse', 'min_samples_split': 3, 'min_samples_leaf': 4, 'min_weight_fraction_leaf': 0.016430560240867385, 'min_impurity_decrease': 0.5459822301229297, 'max_features': 0.5430828897524759, 'subsample': 0.13445635834839248, 'dropout_rate': 0.018568012998511036, 'ccp_alpha': 0.09272464651231634}. Best is trial 759 with value: 0.8618735483942033.[0m
[32m[I 2022-05-19 04:06:32,426][0m Trial 809 finished with value: 0.7623783664745569 and parameters: {'loss': 'coxph', 'learning_rate': 0.02267542425708687, 'n_estimators': 109, 'criterion': 'friedman_mse', 'min_samples_split': 3, 'min_samples_leaf': 4, 'min_weight_fraction_leaf': 0.04204410215612834, 'min_impurity_decrease': 0.5918825629400785, 'max_features': 0.5658184734369969, 'subsample': 0.10185504863071121, 'dropout_rate': 0.05590911729412485, 'ccp_alpha': 0.21980899188572442}. Best is trial 759 with value: 0.8618735483942033.[0m
[32m[I 2022-05-19 04:12:39,416][0m Trial 810 finished with value: 0.7389253054414523 and parameters: {'loss': 'coxph', 'learning_rate': 0.032362603143603334, 'n_estimators': 141, 'criterion': 'friedman_mse', 'min_samples_split': 3, 'min_samples_leaf': 4, 'min_weight_fraction_leaf': 0.03175010702331152, 'min_impurity_decrease': 0.6127183056847788, 'max_features': 0.6302683129632356, 'subsample': 0.12429058675871058, 'dropout_rate': 0.03821039812945864, 'ccp_alpha': 0.38079469658511783}. Best is trial 759 with value: 0.8618735483942033.[0m
/media/san2_ssd/data/Workdir/survival/venv/lib/python3.8/site-packages/sksurv/ensemble/boosting.py:955: RuntimeWarning: divide by zero encountered in log
  time = numpy.log(time)
/media/san2_ssd/data/Workdir/survival/venv/lib/python3.8/site-packages/sksurv/ensemble/boosting.py:955: RuntimeWarning: divide by zero encountered in log
  time = numpy.log(time)
/media/san2_ssd/data/Workdir/survival/venv/lib/python3.8/site-packages/sksurv/ensemble/boosting.py:955: RuntimeWarning: divide by zero encountered in log
  time = numpy.log(time)
/media/san2_ssd/data/Workdir/survival/venv/lib/python3.8/site-packages/sksurv/ensemble/boosting.py:955: RuntimeWarning: divide by zero encountered in log
  time = numpy.log(time)
/media/san2_ssd/data/Workdir/survival/venv/lib/python3.8/site-packages/sksurv/ensemble/boosting.py:955: RuntimeWarning: divide by zero encountered in log
  time = numpy.log(time)
[32m[I 2022-05-19 04:12:39,494][0m Trial 811 finished with value: -1.0 and parameters: {'loss': 'squared', 'learning_rate': 0.02429775166672512, 'n_estimators': 116, 'criterion': 'friedman_mse', 'min_samples_split': 3, 'min_samples_leaf': 4, 'min_weight_fraction_leaf': 0.01037069639593097, 'min_impurity_decrease': 0.6834168897084897, 'max_features': 0.5963211309042904, 'subsample': 0.09887370508675572, 'dropout_rate': 0.0009685563665330198, 'ccp_alpha': 0.08560074456947322}. Best is trial 759 with value: 0.8618735483942033.[0m
[32m[I 2022-05-19 04:17:02,063][0m Trial 812 finished with value: 0.7689470404787653 and parameters: {'loss': 'coxph', 'learning_rate': 0.041490938339710744, 'n_estimators': 104, 'criterion': 'friedman_mse', 'min_samples_split': 3, 'min_samples_leaf': 4, 'min_weight_fraction_leaf': 0.022602701731035173, 'min_impurity_decrease': 0.6327202517821099, 'max_features': 0.5584256799495884, 'subsample': 0.14643623523038357, 'dropout_rate': 0.07410592948514459, 'ccp_alpha': 0.17137676473239724}. Best is trial 759 with value: 0.8618735483942033.[0m
[32m[I 2022-05-19 04:21:57,486][0m Trial 813 finished with value: 0.8527879590650672 and parameters: {'loss': 'coxph', 'learning_rate': 0.021183660737796227, 'n_estimators': 112, 'criterion': 'friedman_mse', 'min_samples_split': 2, 'min_samples_leaf': 4, 'min_weight_fraction_leaf': 0.03105296338546664, 'min_impurity_decrease': 0.6581520751565024, 'max_features': 0.5156654900693985, 'subsample': 0.11779820495748884, 'dropout_rate': 0.026798817446440755, 'ccp_alpha': 0.001550886504331558}. Best is trial 759 with value: 0.8618735483942033.[0m
[32m[I 2022-05-19 04:26:13,112][0m Trial 814 finished with value: 0.8546088331779034 and parameters: {'loss': 'coxph', 'learning_rate': 0.050958148950388034, 'n_estimators': 100, 'criterion': 'friedman_mse', 'min_samples_split': 3, 'min_samples_leaf': 4, 'min_weight_fraction_leaf': 0.042899923463549774, 'min_impurity_decrease': 0.5689013053701156, 'max_features': 0.5334202115949166, 'subsample': 0.14237971856818055, 'dropout_rate': 0.017315161165141615, 'ccp_alpha': 0.00212567351280856}. Best is trial 759 with value: 0.8618735483942033.[0m
[32m[I 2022-05-19 04:30:27,886][0m Trial 815 finished with value: 0.7448734165951313 and parameters: {'loss': 'coxph', 'learning_rate': 0.05273473351039297, 'n_estimators': 100, 'criterion': 'friedman_mse', 'min_samples_split': 3, 'min_samples_leaf': 4, 'min_weight_fraction_leaf': 0.0012274942409737435, 'min_impurity_decrease': 0.5730113667483386, 'max_features': 0.5284487405378846, 'subsample': 0.13726342678659745, 'dropout_rate': 0.017556632300307472, 'ccp_alpha': 0.24639393748096985}. Best is trial 759 with value: 0.8618735483942033.[0m
[32m[I 2022-05-19 04:35:08,265][0m Trial 816 finished with value: 0.7961091011920842 and parameters: {'loss': 'coxph', 'learning_rate': 0.07681119169629713, 'n_estimators': 105, 'criterion': 'friedman_mse', 'min_samples_split': 3, 'min_samples_leaf': 4, 'min_weight_fraction_leaf': 0.04277348438448526, 'min_impurity_decrease': 0.5213489733505421, 'max_features': 0.5757155329799609, 'subsample': 0.09779692810828404, 'dropout_rate': 0.0010233850381805472, 'ccp_alpha': 0.09271782213831972}. Best is trial 759 with value: 0.8618735483942033.[0m
[32m[I 2022-05-19 04:39:37,795][0m Trial 817 finished with value: 0.5 and parameters: {'loss': 'coxph', 'learning_rate': 0.03864139156016662, 'n_estimators': 104, 'criterion': 'squared_error', 'min_samples_split': 3, 'min_samples_leaf': 4, 'min_weight_fraction_leaf': 0.019958288460387497, 'min_impurity_decrease': 0.5933038008125682, 'max_features': 0.5494059557330301, 'subsample': 0.11792995425302863, 'dropout_rate': 0.04120217321137024, 'ccp_alpha': 0.17420184139473763}. Best is trial 759 with value: 0.8618735483942033.[0m
[32m[I 2022-05-19 04:43:52,126][0m Trial 818 finished with value: 0.8003882538645352 and parameters: {'loss': 'coxph', 'learning_rate': 0.09911916538066773, 'n_estimators': 100, 'criterion': 'friedman_mse', 'min_samples_split': 3, 'min_samples_leaf': 4, 'min_weight_fraction_leaf': 0.03359209235944429, 'min_impurity_decrease': 0.6196625651312898, 'max_features': 0.614618210367972, 'subsample': 0.13996727225179142, 'dropout_rate': 0.01976595690000027, 'ccp_alpha': 0.09389562898139117}. Best is trial 759 with value: 0.8618735483942033.[0m
[32m[I 2022-05-19 04:48:57,356][0m Trial 819 finished with value: 0.7394532885764438 and parameters: {'loss': 'coxph', 'learning_rate': 0.029449086171492514, 'n_estimators': 117, 'criterion': 'friedman_mse', 'min_samples_split': 2, 'min_samples_leaf': 4, 'min_weight_fraction_leaf': 0.04185635535728773, 'min_impurity_decrease': 0.5629424716794179, 'max_features': 0.5123825903699416, 'subsample': 0.1181365571559807, 'dropout_rate': 0.049289927884019286, 'ccp_alpha': 0.32524012815983905}. Best is trial 759 with value: 0.8618735483942033.[0m
[32m[I 2022-05-19 04:53:48,720][0m Trial 820 finished with value: 0.8560120942561549 and parameters: {'loss': 'coxph', 'learning_rate': 0.05518843795757599, 'n_estimators': 108, 'criterion': 'friedman_mse', 'min_samples_split': 3, 'min_samples_leaf': 4, 'min_weight_fraction_leaf': 0.013866808625469663, 'min_impurity_decrease': 0.6035105266562242, 'max_features': 0.5370342209576584, 'subsample': 0.09554103590272531, 'dropout_rate': 9.173968638465394e-05, 'ccp_alpha': 0.004341707025611279}. Best is trial 759 with value: 0.8618735483942033.[0m
[32m[I 2022-05-19 04:58:47,994][0m Trial 821 finished with value: 0.7636358386702804 and parameters: {'loss': 'coxph', 'learning_rate': 0.05615646577451586, 'n_estimators': 111, 'criterion': 'friedman_mse', 'min_samples_split': 3, 'min_samples_leaf': 4, 'min_weight_fraction_leaf': 0.012912374574405265, 'min_impurity_decrease': 0.597670022866407, 'max_features': 0.5260215861998585, 'subsample': 0.08911226249149648, 'dropout_rate': 0.02171394020859111, 'ccp_alpha': 0.15923904282435797}. Best is trial 759 with value: 0.8618735483942033.[0m
[32m[I 2022-05-19 05:03:35,243][0m Trial 822 finished with value: 0.8039520393734326 and parameters: {'loss': 'coxph', 'learning_rate': 0.04957503687204959, 'n_estimators': 107, 'criterion': 'friedman_mse', 'min_samples_split': 3, 'min_samples_leaf': 4, 'min_weight_fraction_leaf': 0.02357940878230974, 'min_impurity_decrease': 0.571788018160193, 'max_features': 0.5724343625998238, 'subsample': 0.09368929509464846, 'dropout_rate': 0.00037041779751764703, 'ccp_alpha': 0.0797715372060358}. Best is trial 759 with value: 0.8618735483942033.[0m
[32m[I 2022-05-19 05:08:31,416][0m Trial 823 finished with value: 0.7631975067887338 and parameters: {'loss': 'coxph', 'learning_rate': 0.07722836518094155, 'n_estimators': 111, 'criterion': 'friedman_mse', 'min_samples_split': 3, 'min_samples_leaf': 4, 'min_weight_fraction_leaf': 0.007574280796386018, 'min_impurity_decrease': 0.5454507286317313, 'max_features': 0.5363100354847659, 'subsample': 0.09779333972083973, 'dropout_rate': 0.01760516528615721, 'ccp_alpha': 0.22647044975674602}. Best is trial 759 with value: 0.8618735483942033.[0m
[32m[I 2022-05-19 05:17:35,240][0m Trial 824 finished with value: 0.8020051565607786 and parameters: {'loss': 'coxph', 'learning_rate': 0.06650538248293056, 'n_estimators': 202, 'criterion': 'friedman_mse', 'min_samples_split': 3, 'min_samples_leaf': 4, 'min_weight_fraction_leaf': 0.026660064283544012, 'min_impurity_decrease': 0.6040491402641535, 'max_features': 0.5915543043002282, 'subsample': 0.11681360008769084, 'dropout_rate': 0.04079731887395464, 'ccp_alpha': 0.07552140085215957}. Best is trial 759 with value: 0.8618735483942033.[0m
[32m[I 2022-05-19 05:22:57,449][0m Trial 825 finished with value: 0.8554739119692039 and parameters: {'loss': 'coxph', 'learning_rate': 0.04297837459028201, 'n_estimators': 121, 'criterion': 'friedman_mse', 'min_samples_split': 3, 'min_samples_leaf': 4, 'min_weight_fraction_leaf': 0.020085119635924367, 'min_impurity_decrease': 0.6269423879910604, 'max_features': 0.4909829937278595, 'subsample': 0.11050891219303109, 'dropout_rate': 0.01962498533602358, 'ccp_alpha': 0.005063127251116788}. Best is trial 759 with value: 0.8618735483942033.[0m
[32m[I 2022-05-19 05:28:27,248][0m Trial 826 finished with value: 0.8560561454478519 and parameters: {'loss': 'coxph', 'learning_rate': 0.054054168718468756, 'n_estimators': 122, 'criterion': 'friedman_mse', 'min_samples_split': 3, 'min_samples_leaf': 4, 'min_weight_fraction_leaf': 0.03633568502980251, 'min_impurity_decrease': 0.6301327582047844, 'max_features': 0.4848371181262896, 'subsample': 0.09888817523865931, 'dropout_rate': 0.0008867693206759566, 'ccp_alpha': 0.003238982865568787}. Best is trial 759 with value: 0.8618735483942033.[0m
[32m[I 2022-05-19 05:33:54,774][0m Trial 827 finished with value: 0.5 and parameters: {'loss': 'coxph', 'learning_rate': 0.047837639627919135, 'n_estimators': 122, 'criterion': 'friedman_mse', 'min_samples_split': 3, 'min_samples_leaf': 4, 'min_weight_fraction_leaf': 0.03561854629004447, 'min_impurity_decrease': 0.6313078171734846, 'max_features': 0.49041846057255883, 'subsample': 0.09258930785899852, 'dropout_rate': 0.014540078006812117, 'ccp_alpha': 0.452593871982255}. Best is trial 759 with value: 0.8618735483942033.[0m
[32m[I 2022-05-19 05:40:00,094][0m Trial 828 finished with value: 0.761156342443166 and parameters: {'loss': 'coxph', 'learning_rate': 0.053769168828589516, 'n_estimators': 134, 'criterion': 'friedman_mse', 'min_samples_split': 3, 'min_samples_leaf': 4, 'min_weight_fraction_leaf': 0.020899728684231497, 'min_impurity_decrease': 0.616338957807609, 'max_features': 0.4755668421497898, 'subsample': 0.08737145582768072, 'dropout_rate': 0.00023170894195228642, 'ccp_alpha': 0.16324146811831897}. Best is trial 759 with value: 0.8618735483942033.[0m
/media/san2_ssd/data/Workdir/survival/venv/lib/python3.8/site-packages/sksurv/ensemble/boosting.py:955: RuntimeWarning: divide by zero encountered in log
  time = numpy.log(time)
/media/san2_ssd/data/Workdir/survival/venv/lib/python3.8/site-packages/sksurv/ensemble/boosting.py:955: RuntimeWarning: divide by zero encountered in log
  time = numpy.log(time)
/media/san2_ssd/data/Workdir/survival/venv/lib/python3.8/site-packages/sksurv/ensemble/boosting.py:955: RuntimeWarning: divide by zero encountered in log
  time = numpy.log(time)
/media/san2_ssd/data/Workdir/survival/venv/lib/python3.8/site-packages/sksurv/ensemble/boosting.py:955: RuntimeWarning: divide by zero encountered in log
  time = numpy.log(time)
/media/san2_ssd/data/Workdir/survival/venv/lib/python3.8/site-packages/sksurv/ensemble/boosting.py:955: RuntimeWarning: divide by zero encountered in log
  time = numpy.log(time)
[32m[I 2022-05-19 05:40:00,173][0m Trial 829 finished with value: -1.0 and parameters: {'loss': 'squared', 'learning_rate': 0.06534181801416919, 'n_estimators': 126, 'criterion': 'friedman_mse', 'min_samples_split': 3, 'min_samples_leaf': 4, 'min_weight_fraction_leaf': 0.04445002195059808, 'min_impurity_decrease': 0.6375980021017306, 'max_features': 0.48843944967326697, 'subsample': 0.10480078212943023, 'dropout_rate': 0.039647351949724845, 'ccp_alpha': 0.0025792860958798666}. Best is trial 759 with value: 0.8618735483942033.[0m
[32m[I 2022-05-19 05:45:29,303][0m Trial 830 finished with value: 0.739946674081185 and parameters: {'loss': 'coxph', 'learning_rate': 0.045129911324319684, 'n_estimators': 122, 'criterion': 'friedman_mse', 'min_samples_split': 3, 'min_samples_leaf': 4, 'min_weight_fraction_leaf': 0.03166587941296637, 'min_impurity_decrease': 0.6179071518860372, 'max_features': 0.541800407514969, 'subsample': 0.09114529179994246, 'dropout_rate': 0.0006827915627543484, 'ccp_alpha': 0.28261919159994}. Best is trial 759 with value: 0.8618735483942033.[0m
[32m[I 2022-05-19 05:50:26,560][0m Trial 831 finished with value: 0.7624925576679074 and parameters: {'loss': 'coxph', 'learning_rate': 0.04235437603356136, 'n_estimators': 117, 'criterion': 'friedman_mse', 'min_samples_split': 3, 'min_samples_leaf': 4, 'min_weight_fraction_leaf': 0.018522771567893486, 'min_impurity_decrease': 0.6490582727786013, 'max_features': 0.5001010181599355, 'subsample': 0.1439221446963845, 'dropout_rate': 0.05870715948560406, 'ccp_alpha': 0.16522902679960186}. Best is trial 759 with value: 0.8618735483942033.[0m
[32m[I 2022-05-19 05:56:16,272][0m Trial 832 finished with value: 0.8578303519138608 and parameters: {'loss': 'coxph', 'learning_rate': 0.05920013434412493, 'n_estimators': 131, 'criterion': 'friedman_mse', 'min_samples_split': 3, 'min_samples_leaf': 4, 'min_weight_fraction_leaf': 0.044098176586113265, 'min_impurity_decrease': 0.602407597979924, 'max_features': 0.5155399946131491, 'subsample': 0.11416001081764403, 'dropout_rate': 0.0003262885829410898, 'ccp_alpha': 0.002085322589195803}. Best is trial 759 with value: 0.8618735483942033.[0m
[32m[I 2022-05-19 06:03:03,486][0m Trial 833 finished with value: 0.7705454098934588 and parameters: {'loss': 'coxph', 'learning_rate': 0.06904813415730347, 'n_estimators': 149, 'criterion': 'friedman_mse', 'min_samples_split': 3, 'min_samples_leaf': 4, 'min_weight_fraction_leaf': 0.030862001949406106, 'min_impurity_decrease': 0.6081478069877384, 'max_features': 0.5120891883569308, 'subsample': 0.08775081102810608, 'dropout_rate': 3.3322921692124224e-06, 'ccp_alpha': 0.1471363857828239}. Best is trial 759 with value: 0.8618735483942033.[0m
[32m[I 2022-05-19 06:08:41,555][0m Trial 834 finished with value: 0.7988393619361187 and parameters: {'loss': 'coxph', 'learning_rate': 0.036364347545674976, 'n_estimators': 127, 'criterion': 'friedman_mse', 'min_samples_split': 3, 'min_samples_leaf': 4, 'min_weight_fraction_leaf': 0.018090051983298674, 'min_impurity_decrease': 0.6325944081069484, 'max_features': 0.510126231431998, 'subsample': 0.10670566601087501, 'dropout_rate': 0.02743498755628669, 'ccp_alpha': 0.09305058866130665}. Best is trial 759 with value: 0.8618735483942033.[0m
[32m[I 2022-05-19 06:14:38,266][0m Trial 835 finished with value: 0.7445529591376999 and parameters: {'loss': 'coxph', 'learning_rate': 0.09852635956287059, 'n_estimators': 135, 'criterion': 'friedman_mse', 'min_samples_split': 3, 'min_samples_leaf': 4, 'min_weight_fraction_leaf': 0.03575733298032155, 'min_impurity_decrease': 0.6000976308727486, 'max_features': 0.5524901548432297, 'subsample': 0.11198058683514059, 'dropout_rate': 0.041269135711832924, 'ccp_alpha': 0.2557077706480328}. Best is trial 759 with value: 0.8618735483942033.[0m
[32m[I 2022-05-19 06:22:09,293][0m Trial 836 finished with value: 0.7913962829242166 and parameters: {'loss': 'coxph', 'learning_rate': 0.08064399079596274, 'n_estimators': 164, 'criterion': 'friedman_mse', 'min_samples_split': 3, 'min_samples_leaf': 4, 'min_weight_fraction_leaf': 0.0471721216769821, 'min_impurity_decrease': 0.648021254207814, 'max_features': 0.4879524495175796, 'subsample': 0.08723873875732016, 'dropout_rate': 0.015218199307124168, 'ccp_alpha': 0.11049343982345979}. Best is trial 759 with value: 0.8618735483942033.[0m
[32m[I 2022-05-19 06:27:57,388][0m Trial 837 finished with value: 0.8059396403125986 and parameters: {'loss': 'coxph', 'learning_rate': 0.06210597291706913, 'n_estimators': 131, 'criterion': 'friedman_mse', 'min_samples_split': 3, 'min_samples_leaf': 4, 'min_weight_fraction_leaf': 0.02813024227541468, 'min_impurity_decrease': 0.6213079075677874, 'max_features': 0.5228179092499982, 'subsample': 0.109587053478571, 'dropout_rate': 0.0008663812510648721, 'ccp_alpha': 0.08168120163973462}. Best is trial 759 with value: 0.8618735483942033.[0m
[32m[I 2022-05-19 06:33:08,417][0m Trial 838 finished with value: 0.7630268268204479 and parameters: {'loss': 'coxph', 'learning_rate': 0.03954438712977252, 'n_estimators': 120, 'criterion': 'friedman_mse', 'min_samples_split': 3, 'min_samples_leaf': 4, 'min_weight_fraction_leaf': 0.012184000004077171, 'min_impurity_decrease': 0.6641485563238531, 'max_features': 0.556985984088813, 'subsample': 0.1270641276557607, 'dropout_rate': 0.05524425075623176, 'ccp_alpha': 0.17330544465056708}. Best is trial 759 with value: 0.8618735483942033.[0m
[32m[I 2022-05-19 06:39:24,856][0m Trial 839 finished with value: 0.5 and parameters: {'loss': 'coxph', 'learning_rate': 0.027444615540279285, 'n_estimators': 142, 'criterion': 'squared_error', 'min_samples_split': 3, 'min_samples_leaf': 4, 'min_weight_fraction_leaf': 0.023934265909399056, 'min_impurity_decrease': 0.5914050705550092, 'max_features': 0.5592419916120984, 'subsample': 0.10618065657211698, 'dropout_rate': 0.035090639011435325, 'ccp_alpha': 0.3020397047990499}. Best is trial 759 with value: 0.8618735483942033.[0m
[32m[I 2022-05-19 06:45:37,445][0m Trial 840 finished with value: 0.855361728091865 and parameters: {'loss': 'coxph', 'learning_rate': 0.06117674407721563, 'n_estimators': 136, 'criterion': 'friedman_mse', 'min_samples_split': 2, 'min_samples_leaf': 4, 'min_weight_fraction_leaf': 0.04715643851914382, 'min_impurity_decrease': 0.6447460260560113, 'max_features': 0.47605438822554635, 'subsample': 0.09080175289856396, 'dropout_rate': 0.021760732026471243, 'ccp_alpha': 0.0026001375358696245}. Best is trial 759 with value: 0.8618735483942033.[0m
