[32m[I 2022-05-13 14:09:50,905][0m Trial 396 finished with value: 0.7876441155482113 and parameters: {'loss': 'coxph', 'learning_rate': 2.0920553400975242e-05, 'n_estimators': 368, 'criterion': 'friedman_mse', 'min_samples_split': 6, 'min_samples_leaf': 2, 'min_weight_fraction_leaf': 0.1231439166100885, 'min_impurity_decrease': 0.01630802553959336, 'max_features': 0.8343744948278133, 'subsample': 0.04976692355803995, 'dropout_rate': 0.7226328084046238, 'ccp_alpha': 0.09889077108826985}. Best is trial 285 with value: 0.8408994882022112.[0m
[32m[I 2022-05-13 14:25:00,530][0m Trial 397 finished with value: 0.7434160870911009 and parameters: {'loss': 'coxph', 'learning_rate': 1.2187989452198916e-05, 'n_estimators': 310, 'criterion': 'absolute_error', 'min_samples_split': 8, 'min_samples_leaf': 2, 'min_weight_fraction_leaf': 0.16859055342267099, 'min_impurity_decrease': 0.003051154580060997, 'max_features': 0.862601905816012, 'subsample': 0.08644157004932586, 'dropout_rate': 0.5433080348283363, 'ccp_alpha': 0.254781765581866}. Best is trial 285 with value: 0.8408994882022112.[0m
[32m[I 2022-05-13 14:39:01,534][0m Trial 398 finished with value: 0.7799616869567894 and parameters: {'loss': 'coxph', 'learning_rate': 1.4893667716214867e-05, 'n_estimators': 290, 'criterion': 'friedman_mse', 'min_samples_split': 8, 'min_samples_leaf': 2, 'min_weight_fraction_leaf': 0.18386832308334478, 'min_impurity_decrease': 0.031219647153721424, 'max_features': 0.874164914257923, 'subsample': 0.06684649718489646, 'dropout_rate': 0.7484086683893013, 'ccp_alpha': 0.09410644030229304}. Best is trial 285 with value: 0.8408994882022112.[0m
[32m[I 2022-05-13 14:51:30,510][0m Trial 399 finished with value: 0.7398643612703788 and parameters: {'loss': 'coxph', 'learning_rate': 1.9451928658465005e-05, 'n_estimators': 273, 'criterion': 'absolute_error', 'min_samples_split': 8, 'min_samples_leaf': 2, 'min_weight_fraction_leaf': 0.19841161961308926, 'min_impurity_decrease': 0.012496893692600645, 'max_features': 0.8407953141954594, 'subsample': 0.3072267852337973, 'dropout_rate': 0.6856744683666067, 'ccp_alpha': 0.17900722259386534}. Best is trial 285 with value: 0.8408994882022112.[0m
[32m[I 2022-05-13 15:07:09,687][0m Trial 400 finished with value: 0.8206128179258041 and parameters: {'loss': 'coxph', 'learning_rate': 1.2000475542740697e-05, 'n_estimators': 338, 'criterion': 'friedman_mse', 'min_samples_split': 8, 'min_samples_leaf': 3, 'min_weight_fraction_leaf': 0.19097177357365672, 'min_impurity_decrease': 0.0451247748401822, 'max_features': 0.9040446759664903, 'subsample': 0.10899396822282591, 'dropout_rate': 0.7737349941420201, 'ccp_alpha': 0.005952338592959013}. Best is trial 285 with value: 0.8408994882022112.[0m
[32m[I 2022-05-13 15:24:51,057][0m Trial 401 finished with value: 0.8414502237418834 and parameters: {'loss': 'coxph', 'learning_rate': 8.335504349676454e-06, 'n_estimators': 350, 'criterion': 'friedman_mse', 'min_samples_split': 8, 'min_samples_leaf': 3, 'min_weight_fraction_leaf': 0.17888779801555735, 'min_impurity_decrease': 0.001419434199461292, 'max_features': 0.8681232054056452, 'subsample': 0.03794214008628055, 'dropout_rate': 0.7320734500882925, 'ccp_alpha': 0.0046800146025851724}. Best is trial 401 with value: 0.8414502237418834.[0m
[32m[I 2022-05-13 15:40:46,836][0m Trial 402 finished with value: 0.7857419912849648 and parameters: {'loss': 'coxph', 'learning_rate': 7.262003009236897e-06, 'n_estimators': 319, 'criterion': 'friedman_mse', 'min_samples_split': 8, 'min_samples_leaf': 3, 'min_weight_fraction_leaf': 0.1588321777918421, 'min_impurity_decrease': 0.0043312460845037915, 'max_features': 0.8538008897652365, 'subsample': 0.040977518788243725, 'dropout_rate': 0.743515663910744, 'ccp_alpha': 0.09876407858340669}. Best is trial 401 with value: 0.8414502237418834.[0m
[32m[I 2022-05-13 16:00:57,807][0m Trial 403 finished with value: 0.7661181560485824 and parameters: {'loss': 'coxph', 'learning_rate': 8.244265152297463e-06, 'n_estimators': 357, 'criterion': 'friedman_mse', 'min_samples_split': 8, 'min_samples_leaf': 3, 'min_weight_fraction_leaf': 0.17034971444655309, 'min_impurity_decrease': 0.031203154558731745, 'max_features': 0.8679143307761842, 'subsample': 0.04542993985187095, 'dropout_rate': 0.7623750804098778, 'ccp_alpha': 0.27085931558859494}. Best is trial 401 with value: 0.8414502237418834.[0m
[32m[I 2022-05-13 16:14:53,371][0m Trial 404 finished with value: 0.7780577361108391 and parameters: {'loss': 'coxph', 'learning_rate': 5.34344197750913e-06, 'n_estimators': 333, 'criterion': 'friedman_mse', 'min_samples_split': 8, 'min_samples_leaf': 3, 'min_weight_fraction_leaf': 0.19238009280412105, 'min_impurity_decrease': 0.04522286915821668, 'max_features': 0.884459964363821, 'subsample': 0.20481014872349704, 'dropout_rate': 0.7036491600611418, 'ccp_alpha': 0.09360491565109359}. Best is trial 401 with value: 0.8414502237418834.[0m
[32m[I 2022-05-13 16:32:06,186][0m Trial 405 finished with value: 0.7658617767517555 and parameters: {'loss': 'coxph', 'learning_rate': 1.040928134690264e-05, 'n_estimators': 351, 'criterion': 'friedman_mse', 'min_samples_split': 8, 'min_samples_leaf': 3, 'min_weight_fraction_leaf': 0.17923511401295397, 'min_impurity_decrease': 0.013162732962304939, 'max_features': 0.8213709506002085, 'subsample': 0.060165181487878285, 'dropout_rate': 0.7276620627540664, 'ccp_alpha': 0.18210740117942223}. Best is trial 401 with value: 0.8414502237418834.[0m
[32m[I 2022-05-13 16:46:24,298][0m Trial 406 finished with value: 0.7877451163710578 and parameters: {'loss': 'coxph', 'learning_rate': 8.218073976701169e-06, 'n_estimators': 312, 'criterion': 'friedman_mse', 'min_samples_split': 8, 'min_samples_leaf': 3, 'min_weight_fraction_leaf': 0.18654819109391263, 'min_impurity_decrease': 0.0012163045845909604, 'max_features': 0.16149599156758399, 'subsample': 0.11319860025264401, 'dropout_rate': 0.7167608606078787, 'ccp_alpha': 0.0842078947851708}. Best is trial 401 with value: 0.8414502237418834.[0m
[32m[I 2022-05-13 17:03:48,137][0m Trial 407 finished with value: 0.5 and parameters: {'loss': 'coxph', 'learning_rate': 1.1315642010393135e-05, 'n_estimators': 341, 'criterion': 'friedman_mse', 'min_samples_split': 8, 'min_samples_leaf': 3, 'min_weight_fraction_leaf': 0.16443559025506066, 'min_impurity_decrease': 0.03507101721050198, 'max_features': 0.8477870358079482, 'subsample': 0.018590877664332355, 'dropout_rate': 0.7705630973192767, 'ccp_alpha': 3.013059523437999}. Best is trial 401 with value: 0.8414502237418834.[0m
[32m[I 2022-05-13 17:21:25,052][0m Trial 408 finished with value: 0.7961578973723185 and parameters: {'loss': 'coxph', 'learning_rate': 2.8758860830863377e-05, 'n_estimators': 337, 'criterion': 'friedman_mse', 'min_samples_split': 8, 'min_samples_leaf': 3, 'min_weight_fraction_leaf': 0.17506995250707036, 'min_impurity_decrease': 0.9454117079986801, 'max_features': 0.20427181000850642, 'subsample': 0.0027915439959173075, 'dropout_rate': 0.739935656225421, 'ccp_alpha': 0.18750777994617324}. Best is trial 401 with value: 0.8414502237418834.[0m
[32m[I 2022-05-13 17:39:58,429][0m Trial 409 finished with value: 0.8203381853594486 and parameters: {'loss': 'coxph', 'learning_rate': 1.5962881257728562e-05, 'n_estimators': 386, 'criterion': 'friedman_mse', 'min_samples_split': 8, 'min_samples_leaf': 4, 'min_weight_fraction_leaf': 0.19362775325245823, 'min_impurity_decrease': 0.023995193459471917, 'max_features': 0.8895020316194954, 'subsample': 0.09045063805268846, 'dropout_rate': 0.6727169923078229, 'ccp_alpha': 0.006469164608741146}. Best is trial 401 with value: 0.8414502237418834.[0m
[32m[I 2022-05-13 17:54:32,836][0m Trial 410 finished with value: 0.8299485048275438 and parameters: {'loss': 'coxph', 'learning_rate': 2.305372004660077e-05, 'n_estimators': 306, 'criterion': 'friedman_mse', 'min_samples_split': 6, 'min_samples_leaf': 5, 'min_weight_fraction_leaf': 0.19068075411431762, 'min_impurity_decrease': 0.01839766931368638, 'max_features': 0.8816887232503092, 'subsample': 0.09024895821249138, 'dropout_rate': 0.6765207320158636, 'ccp_alpha': 0.0035664456053781154}. Best is trial 401 with value: 0.8414502237418834.[0m
[32m[I 2022-05-13 18:10:42,599][0m Trial 411 finished with value: 0.8418216748393912 and parameters: {'loss': 'coxph', 'learning_rate': 2.457802681299155e-05, 'n_estimators': 331, 'criterion': 'friedman_mse', 'min_samples_split': 6, 'min_samples_leaf': 3, 'min_weight_fraction_leaf': 0.18896505629764793, 'min_impurity_decrease': 0.0017752579159884786, 'max_features': 0.8837488646699426, 'subsample': 0.07113986568916775, 'dropout_rate': 0.6876517354903992, 'ccp_alpha': 0.001753903405385891}. Best is trial 411 with value: 0.8418216748393912.[0m
[32m[I 2022-05-13 18:26:02,426][0m Trial 412 finished with value: 0.7409580587674347 and parameters: {'loss': 'coxph', 'learning_rate': 2.6120016865683885e-05, 'n_estimators': 321, 'criterion': 'friedman_mse', 'min_samples_split': 6, 'min_samples_leaf': 4, 'min_weight_fraction_leaf': 0.15142356784886352, 'min_impurity_decrease': 0.01661301400615231, 'max_features': 0.8626977709890904, 'subsample': 0.08436102973428376, 'dropout_rate': 0.6460878226695396, 'ccp_alpha': 0.33814659128681634}. Best is trial 411 with value: 0.8418216748393912.[0m
/media/san2_ssd/data/Workdir/survival/venv/lib/python3.8/site-packages/sksurv/ensemble/boosting.py:955: RuntimeWarning: divide by zero encountered in log
  time = numpy.log(time)
/media/san2_ssd/data/Workdir/survival/venv/lib/python3.8/site-packages/sksurv/ensemble/boosting.py:955: RuntimeWarning: divide by zero encountered in log
  time = numpy.log(time)
/media/san2_ssd/data/Workdir/survival/venv/lib/python3.8/site-packages/sksurv/ensemble/boosting.py:955: RuntimeWarning: divide by zero encountered in log
  time = numpy.log(time)
/media/san2_ssd/data/Workdir/survival/venv/lib/python3.8/site-packages/sksurv/ensemble/boosting.py:955: RuntimeWarning: divide by zero encountered in log
  time = numpy.log(time)
/media/san2_ssd/data/Workdir/survival/venv/lib/python3.8/site-packages/sksurv/ensemble/boosting.py:955: RuntimeWarning: divide by zero encountered in log
  time = numpy.log(time)
[32m[I 2022-05-13 18:26:02,489][0m Trial 413 finished with value: -1.0 and parameters: {'loss': 'squared', 'learning_rate': 2.3927858580456378e-05, 'n_estimators': 326, 'criterion': 'friedman_mse', 'min_samples_split': 6, 'min_samples_leaf': 5, 'min_weight_fraction_leaf': 0.18925444322311957, 'min_impurity_decrease': 0.0017096003503917802, 'max_features': 0.8784960092103351, 'subsample': 0.02484733786318083, 'dropout_rate': 0.6793043366279282, 'ccp_alpha': 0.0956748298579556}. Best is trial 411 with value: 0.8418216748393912.[0m
[32m[I 2022-05-13 18:45:58,046][0m Trial 414 finished with value: 0.7639475520453191 and parameters: {'loss': 'coxph', 'learning_rate': 3.774612630284485e-05, 'n_estimators': 409, 'criterion': 'friedman_mse', 'min_samples_split': 6, 'min_samples_leaf': 4, 'min_weight_fraction_leaf': 0.17277532990831657, 'min_impurity_decrease': 0.02034832857501632, 'max_features': 0.8408006217416463, 'subsample': 0.07635264860472665, 'dropout_rate': 0.6671732601288042, 'ccp_alpha': 0.2038793961010495}. Best is trial 411 with value: 0.8418216748393912.[0m
[32m[I 2022-05-13 19:02:28,867][0m Trial 415 finished with value: 0.7635227887730508 and parameters: {'loss': 'coxph', 'learning_rate': 3.066770559933533e-05, 'n_estimators': 350, 'criterion': 'friedman_mse', 'min_samples_split': 6, 'min_samples_leaf': 3, 'min_weight_fraction_leaf': 0.09558769322161467, 'min_impurity_decrease': 0.0017440534980164356, 'max_features': 0.8783422387527392, 'subsample': 0.0981933006018207, 'dropout_rate': 0.6861307749174552, 'ccp_alpha': 0.10079324897428976}. Best is trial 411 with value: 0.8418216748393912.[0m
[32m[I 2022-05-13 19:20:21,777][0m Trial 416 finished with value: 0.8447197993720043 and parameters: {'loss': 'coxph', 'learning_rate': 1.9679169840704166e-05, 'n_estimators': 367, 'criterion': 'friedman_mse', 'min_samples_split': 6, 'min_samples_leaf': 5, 'min_weight_fraction_leaf': 0.17943248904008835, 'min_impurity_decrease': 0.024261987933447096, 'max_features': 0.8893896683938042, 'subsample': 0.07394567459689101, 'dropout_rate': 0.7103761717682507, 'ccp_alpha': 0.0015436319779411761}. Best is trial 416 with value: 0.8447197993720043.[0m
[32m[I 2022-05-13 19:38:06,376][0m Trial 417 finished with value: 0.8454377430438574 and parameters: {'loss': 'coxph', 'learning_rate': 2.1537651362464204e-05, 'n_estimators': 360, 'criterion': 'friedman_mse', 'min_samples_split': 6, 'min_samples_leaf': 4, 'min_weight_fraction_leaf': 0.16251591424521838, 'min_impurity_decrease': 0.001344479269291287, 'max_features': 0.8602168990461299, 'subsample': 0.06499645834178083, 'dropout_rate': 0.6943241880956365, 'ccp_alpha': 0.0033961222526033125}. Best is trial 417 with value: 0.8454377430438574.[0m
[32m[I 2022-05-13 19:56:49,746][0m Trial 418 finished with value: 0.7652262653391505 and parameters: {'loss': 'coxph', 'learning_rate': 3.692789943237296e-05, 'n_estimators': 383, 'criterion': 'friedman_mse', 'min_samples_split': 6, 'min_samples_leaf': 5, 'min_weight_fraction_leaf': 0.15529486044038068, 'min_impurity_decrease': 0.0023694369412340377, 'max_features': 0.8599153064186937, 'subsample': 0.0668490343837067, 'dropout_rate': 0.7175400511195835, 'ccp_alpha': 0.17529381610324485}. Best is trial 417 with value: 0.8454377430438574.[0m
[32m[I 2022-05-13 20:13:54,759][0m Trial 419 finished with value: 0.7593889763776627 and parameters: {'loss': 'coxph', 'learning_rate': 2.4132811702480267e-05, 'n_estimators': 363, 'criterion': 'friedman_mse', 'min_samples_split': 5, 'min_samples_leaf': 6, 'min_weight_fraction_leaf': 0.1646222519496852, 'min_impurity_decrease': 0.025375325874689714, 'max_features': 0.8850218001908727, 'subsample': 0.10247998235537326, 'dropout_rate': 0.6738035273561578, 'ccp_alpha': 0.27259953293234823}. Best is trial 417 with value: 0.8454377430438574.[0m
[32m[I 2022-05-13 20:32:51,702][0m Trial 420 finished with value: 0.5 and parameters: {'loss': 'coxph', 'learning_rate': 3.129401864326138e-05, 'n_estimators': 374, 'criterion': 'friedman_mse', 'min_samples_split': 6, 'min_samples_leaf': 5, 'min_weight_fraction_leaf': 0.1805648452356255, 'min_impurity_decrease': 0.027853850656943926, 'max_features': 0.8584593838250009, 'subsample': 0.03163823215312109, 'dropout_rate': 0.7033400103150172, 'ccp_alpha': 4.648243566120959}. Best is trial 417 with value: 0.8454377430438574.[0m
[32m[I 2022-05-13 20:52:15,930][0m Trial 421 finished with value: 0.8443976552902572 and parameters: {'loss': 'coxph', 'learning_rate': 5.4765218318899236e-05, 'n_estimators': 400, 'criterion': 'friedman_mse', 'min_samples_split': 6, 'min_samples_leaf': 4, 'min_weight_fraction_leaf': 0.1644723844961716, 'min_impurity_decrease': 0.002338288655764128, 'max_features': 0.8927787869561138, 'subsample': 0.08223421157917682, 'dropout_rate': 0.7056667635557841, 'ccp_alpha': 0.0013780314281659372}. Best is trial 417 with value: 0.8454377430438574.[0m
[32m[I 2022-05-13 21:08:57,643][0m Trial 422 finished with value: 0.764545303348095 and parameters: {'loss': 'coxph', 'learning_rate': 4.600941702143259e-05, 'n_estimators': 346, 'criterion': 'friedman_mse', 'min_samples_split': 6, 'min_samples_leaf': 4, 'min_weight_fraction_leaf': 0.14991164336250964, 'min_impurity_decrease': 0.01708851337094892, 'max_features': 0.8940464863545147, 'subsample': 0.0813447237168775, 'dropout_rate': 0.6512969082434796, 'ccp_alpha': 0.11820723334376444}. Best is trial 417 with value: 0.8454377430438574.[0m
[32m[I 2022-05-13 21:28:16,544][0m Trial 423 finished with value: 0.8441073479849713 and parameters: {'loss': 'coxph', 'learning_rate': 2.16924704075459e-05, 'n_estimators': 417, 'criterion': 'friedman_mse', 'min_samples_split': 6, 'min_samples_leaf': 5, 'min_weight_fraction_leaf': 0.15936305468010015, 'min_impurity_decrease': 0.0017852430199785095, 'max_features': 0.8767581320263288, 'subsample': 0.1281964048052835, 'dropout_rate': 0.6916994866034732, 'ccp_alpha': 0.0016987077911604532}. Best is trial 417 with value: 0.8454377430438574.[0m
[32m[I 2022-05-13 21:47:13,660][0m Trial 424 finished with value: 0.769079635498864 and parameters: {'loss': 'coxph', 'learning_rate': 5.647683928614783e-05, 'n_estimators': 398, 'criterion': 'friedman_mse', 'min_samples_split': 6, 'min_samples_leaf': 5, 'min_weight_fraction_leaf': 0.1458426192240936, 'min_impurity_decrease': 0.0011573573197041851, 'max_features': 0.87060750497023, 'subsample': 0.09648172937289246, 'dropout_rate': 0.6627659945463126, 'ccp_alpha': 0.17063264945774614}. Best is trial 417 with value: 0.8454377430438574.[0m
[32m[I 2022-05-13 22:07:53,619][0m Trial 425 finished with value: 0.7848654958217224 and parameters: {'loss': 'coxph', 'learning_rate': 3.66538019659638e-05, 'n_estimators': 416, 'criterion': 'friedman_mse', 'min_samples_split': 6, 'min_samples_leaf': 5, 'min_weight_fraction_leaf': 0.12908198182231498, 'min_impurity_decrease': 0.001715529103395494, 'max_features': 0.8266443764205034, 'subsample': 0.05730585688636211, 'dropout_rate': 0.6977177767866641, 'ccp_alpha': 0.09536312172124438}. Best is trial 417 with value: 0.8454377430438574.[0m
[32m[I 2022-05-13 22:28:22,063][0m Trial 426 finished with value: 0.7395411790253362 and parameters: {'loss': 'coxph', 'learning_rate': 2.2588698101690544e-05, 'n_estimators': 443, 'criterion': 'friedman_mse', 'min_samples_split': 6, 'min_samples_leaf': 5, 'min_weight_fraction_leaf': 0.1381747116735504, 'min_impurity_decrease': 0.03428180102819442, 'max_features': 0.8819513839417122, 'subsample': 0.1183688649449469, 'dropout_rate': 0.6912424502821704, 'ccp_alpha': 0.3631499423038136}. Best is trial 417 with value: 0.8454377430438574.[0m
[32m[I 2022-05-13 22:45:31,234][0m Trial 427 finished with value: 0.8454365332492845 and parameters: {'loss': 'coxph', 'learning_rate': 2.7805347270214374e-05, 'n_estimators': 376, 'criterion': 'friedman_mse', 'min_samples_split': 6, 'min_samples_leaf': 4, 'min_weight_fraction_leaf': 0.15937045275757103, 'min_impurity_decrease': 0.03600316339613909, 'max_features': 0.8524869265644398, 'subsample': 0.1326053927066044, 'dropout_rate': 0.7218104364267923, 'ccp_alpha': 0.002185415931322345}. Best is trial 417 with value: 0.8454377430438574.[0m
[32m[I 2022-05-13 23:03:54,551][0m Trial 428 finished with value: 0.7627269979594576 and parameters: {'loss': 'coxph', 'learning_rate': 6.530457547294454e-05, 'n_estimators': 396, 'criterion': 'friedman_mse', 'min_samples_split': 6, 'min_samples_leaf': 5, 'min_weight_fraction_leaf': 0.15527501298306726, 'min_impurity_decrease': 0.03874024933471777, 'max_features': 0.8361791411531931, 'subsample': 0.11147564050740116, 'dropout_rate': 0.7219297394255921, 'ccp_alpha': 0.2607038556190503}. Best is trial 417 with value: 0.8454377430438574.[0m
[32m[I 2022-05-13 23:21:39,961][0m Trial 429 finished with value: 0.7814062465691669 and parameters: {'loss': 'coxph', 'learning_rate': 2.887800310416598e-05, 'n_estimators': 366, 'criterion': 'friedman_mse', 'min_samples_split': 6, 'min_samples_leaf': 4, 'min_weight_fraction_leaf': 0.15900097708804006, 'min_impurity_decrease': 0.0021922109881087268, 'max_features': 0.7908802940652255, 'subsample': 0.07249774838459926, 'dropout_rate': 0.707522497538794, 'ccp_alpha': 0.09853199521823668}. Best is trial 417 with value: 0.8454377430438574.[0m
[32m[I 2022-05-13 23:37:18,274][0m Trial 430 finished with value: 0.5 and parameters: {'loss': 'coxph', 'learning_rate': 3.38338624241118e-05, 'n_estimators': 349, 'criterion': 'friedman_mse', 'min_samples_split': 6, 'min_samples_leaf': 4, 'min_weight_fraction_leaf': 0.1636216222892381, 'min_impurity_decrease': 0.03720743347440583, 'max_features': 0.8996804211058514, 'subsample': 0.14256052772018202, 'dropout_rate': 0.6442711220372965, 'ccp_alpha': 1.2018326320585206}. Best is trial 417 with value: 0.8454377430438574.[0m
[32m[I 2022-05-13 23:55:46,775][0m Trial 431 finished with value: 0.7778479337472245 and parameters: {'loss': 'coxph', 'learning_rate': 2.5545096143900763e-05, 'n_estimators': 382, 'criterion': 'friedman_mse', 'min_samples_split': 6, 'min_samples_leaf': 4, 'min_weight_fraction_leaf': 0.14075715237259398, 'min_impurity_decrease': 0.0017633532366977123, 'max_features': 0.8794832816996859, 'subsample': 0.08638347012704234, 'dropout_rate': 0.6084668635576076, 'ccp_alpha': 0.17706636418551305}. Best is trial 417 with value: 0.8454377430438574.[0m
[32m[I 2022-05-14 00:15:32,240][0m Trial 432 finished with value: 0.7705740083947255 and parameters: {'loss': 'coxph', 'learning_rate': 4.084173330881411e-05, 'n_estimators': 431, 'criterion': 'friedman_mse', 'min_samples_split': 5, 'min_samples_leaf': 4, 'min_weight_fraction_leaf': 0.16558023420221524, 'min_impurity_decrease': 0.022163136052898307, 'max_features': 0.86120676729909, 'subsample': 0.12985973857264957, 'dropout_rate': 0.6964671957086884, 'ccp_alpha': 0.08397897039292908}. Best is trial 417 with value: 0.8454377430438574.[0m
