[32m[I 2022-04-21 12:29:30,699][0m Trial 373 finished with value: 0.9068422141505674 and parameters: {'splitter': 'random', 'min_samples_split': 0.05634518961821417, 'min_samples_leaf': 0.0258892642616545, 'min_weight_fraction_leaf': 0.04584648003978056, 'max_features': 0.9293958358550429}. Best is trial 253 with value: 0.9108382257790575.[0m
[32m[I 2022-04-21 12:29:31,854][0m Trial 374 finished with value: 0.9028294134628162 and parameters: {'splitter': 'random', 'min_samples_split': 0.04765892970876905, 'min_samples_leaf': 0.023674522354241785, 'min_weight_fraction_leaf': 0.03981786144435984, 'max_features': 0.9618519052519798}. Best is trial 253 with value: 0.9108382257790575.[0m
[32m[I 2022-04-21 12:32:21,612][0m Trial 375 finished with value: 0.8795786726456061 and parameters: {'splitter': 'best', 'min_samples_split': 0.06156529789845873, 'min_samples_leaf': 0.04015141161056049, 'min_weight_fraction_leaf': 0.055169655141208855, 'max_features': 0.8929206364822079}. Best is trial 253 with value: 0.9108382257790575.[0m
[32m[I 2022-04-21 12:32:24,532][0m Trial 376 finished with value: 0.9032494501931787 and parameters: {'splitter': 'random', 'min_samples_split': 0.04027495671088801, 'min_samples_leaf': 0.02765911500950554, 'min_weight_fraction_leaf': 0.02589134610658587, 'max_features': 0.9173290213383393}. Best is trial 253 with value: 0.9108382257790575.[0m
[32m[I 2022-04-21 12:32:25,971][0m Trial 377 finished with value: 0.8806277071744931 and parameters: {'splitter': 'random', 'min_samples_split': 0.05630254271421231, 'min_samples_leaf': 0.018463057407537075, 'min_weight_fraction_leaf': 0.18850387978708183, 'max_features': 0.9418544029276072}. Best is trial 253 with value: 0.9108382257790575.[0m
[32m[I 2022-04-21 12:32:27,230][0m Trial 378 finished with value: 0.8966713100078065 and parameters: {'splitter': 'random', 'min_samples_split': 0.2103436312201653, 'min_samples_leaf': 0.05214101147660359, 'min_weight_fraction_leaf': 0.039623166781724735, 'max_features': 0.8516398534673881}. Best is trial 253 with value: 0.9108382257790575.[0m
[32m[I 2022-04-21 12:32:28,376][0m Trial 379 finished with value: 0.8862774952961452 and parameters: {'splitter': 'random', 'min_samples_split': 0.0339870620513504, 'min_samples_leaf': 0.0012990516722608501, 'min_weight_fraction_leaf': 0.061858340434810644, 'max_features': 0.699818717284182}. Best is trial 253 with value: 0.9108382257790575.[0m
[32m[I 2022-04-21 12:32:29,291][0m Trial 380 finished with value: 0.9000837539538395 and parameters: {'splitter': 'random', 'min_samples_split': 0.020100976622859604, 'min_samples_leaf': 0.04552408702836097, 'min_weight_fraction_leaf': 0.030368465136514484, 'max_features': 0.8762818842587081}. Best is trial 253 with value: 0.9108382257790575.[0m
[32m[I 2022-04-21 12:32:30,381][0m Trial 381 finished with value: 0.37352803050186595 and parameters: {'splitter': 'random', 'min_samples_split': 0.0736148917951554, 'min_samples_leaf': 0.06402945305231117, 'min_weight_fraction_leaf': 0.2510805434220622, 'max_features': 0.8978798868552772}. Best is trial 253 with value: 0.9108382257790575.[0m
[32m[I 2022-04-21 12:32:31,441][0m Trial 382 finished with value: 0.8970532862545018 and parameters: {'splitter': 'random', 'min_samples_split': 0.009427957386102944, 'min_samples_leaf': 0.02978052450435898, 'min_weight_fraction_leaf': 0.011986324580423409, 'max_features': 0.9211375745560615}. Best is trial 253 with value: 0.9108382257790575.[0m
[32m[I 2022-04-21 12:32:33,280][0m Trial 383 finished with value: 0.9035511139963326 and parameters: {'splitter': 'random', 'min_samples_split': 0.02435111443357351, 'min_samples_leaf': 0.03686856171320719, 'min_weight_fraction_leaf': 0.051327216239272534, 'max_features': 0.9476735469062604}. Best is trial 253 with value: 0.9108382257790575.[0m
[32m[I 2022-04-21 12:32:35,373][0m Trial 384 finished with value: 0.9031838186963095 and parameters: {'splitter': 'random', 'min_samples_split': 0.047116455738779144, 'min_samples_leaf': 0.018279113268190945, 'min_weight_fraction_leaf': 0.04354749796208819, 'max_features': 0.9359082378494242}. Best is trial 253 with value: 0.9108382257790575.[0m
[32m[I 2022-04-21 12:32:36,456][0m Trial 385 finished with value: 0.9052787105007816 and parameters: {'splitter': 'random', 'min_samples_split': 0.0557938795333793, 'min_samples_leaf': 0.030968711522871825, 'min_weight_fraction_leaf': 0.07357288169879089, 'max_features': 0.9998827809994016}. Best is trial 253 with value: 0.9108382257790575.[0m
[32m[I 2022-04-21 12:32:38,034][0m Trial 386 finished with value: 0.892464916619988 and parameters: {'splitter': 'random', 'min_samples_split': 0.029791204881426055, 'min_samples_leaf': 0.012024580061240717, 'min_weight_fraction_leaf': 0.01921308217715214, 'max_features': 0.9127653382452666}. Best is trial 253 with value: 0.9108382257790575.[0m
/media/san2_ssd/data/Workdir/survival/utils.py:305: RuntimeWarning: invalid value encountered in true_divide
  pdfs = np.gradient(1-survs,axis=1)/norms
/media/san2_ssd/data/Workdir/survival/utils.py:305: RuntimeWarning: invalid value encountered in true_divide
  pdfs = np.gradient(1-survs,axis=1)/norms
[32m[I 2022-04-21 12:32:40,208][0m Trial 387 finished with value: 0.8905089653299552 and parameters: {'splitter': 'random', 'min_samples_split': 0.01701853722976111, 'min_samples_leaf': 0.01219255006768491, 'min_weight_fraction_leaf': 0.0042280693899546355, 'max_features': 0.9587402103168914}. Best is trial 253 with value: 0.9108382257790575.[0m
[32m[I 2022-04-21 12:32:42,176][0m Trial 388 finished with value: 0.9043263933869776 and parameters: {'splitter': 'random', 'min_samples_split': 0.03791618398002307, 'min_samples_leaf': 0.01898543998820671, 'min_weight_fraction_leaf': 0.02875140494806591, 'max_features': 0.9282504152147818}. Best is trial 253 with value: 0.9108382257790575.[0m
[32m[I 2022-04-21 12:32:43,768][0m Trial 389 finished with value: 0.7797722362636331 and parameters: {'splitter': 'random', 'min_samples_split': 0.0014812660627724816, 'min_samples_leaf': 0.17085737167064463, 'min_weight_fraction_leaf': 0.05128073105152895, 'max_features': 0.9732140321552896}. Best is trial 253 with value: 0.9108382257790575.[0m
[32m[I 2022-04-21 12:32:46,814][0m Trial 390 finished with value: 0.9007452129784117 and parameters: {'splitter': 'random', 'min_samples_split': 0.04442301000413977, 'min_samples_leaf': 0.03334823971921213, 'min_weight_fraction_leaf': 0.038012804436535666, 'max_features': 0.8748270124425449}. Best is trial 253 with value: 0.9108382257790575.[0m
[32m[I 2022-04-21 12:32:48,776][0m Trial 391 finished with value: 0.3425804518366971 and parameters: {'splitter': 'random', 'min_samples_split': 0.030381125310156357, 'min_samples_leaf': 0.4132409660186789, 'min_weight_fraction_leaf': 0.022808658968401636, 'max_features': 0.9057888519211597}. Best is trial 253 with value: 0.9108382257790575.[0m
[32m[I 2022-04-21 12:32:50,208][0m Trial 392 finished with value: 0.901462456492738 and parameters: {'splitter': 'random', 'min_samples_split': 0.0843978933087606, 'min_samples_leaf': 0.04133424062670594, 'min_weight_fraction_leaf': 2.491473861338661e-05, 'max_features': 0.8891245732704306}. Best is trial 253 with value: 0.9108382257790575.[0m
[32m[I 2022-04-21 12:32:51,416][0m Trial 393 finished with value: 0.905549190419951 and parameters: {'splitter': 'random', 'min_samples_split': 0.05912041270150899, 'min_samples_leaf': 0.024622685296586472, 'min_weight_fraction_leaf': 0.08831667399845189, 'max_features': 0.9199818634015665}. Best is trial 253 with value: 0.9108382257790575.[0m
[32m[I 2022-04-21 12:32:52,395][0m Trial 394 finished with value: 0.3425804518366971 and parameters: {'splitter': 'random', 'min_samples_split': 0.017292281428929766, 'min_samples_leaf': 0.36708165379700364, 'min_weight_fraction_leaf': 0.060785733869280135, 'max_features': 0.9511147199878045}. Best is trial 253 with value: 0.9108382257790575.[0m
[32m[I 2022-04-21 12:35:32,606][0m Trial 395 finished with value: 0.8844408616298978 and parameters: {'splitter': 'best', 'min_samples_split': 0.05506969094624956, 'min_samples_leaf': 0.028588576456765054, 'min_weight_fraction_leaf': 0.046418382609769326, 'max_features': 0.9334906370955173}. Best is trial 253 with value: 0.9108382257790575.[0m
[32m[I 2022-04-21 12:35:34,241][0m Trial 396 finished with value: 0.8981978305076502 and parameters: {'splitter': 'random', 'min_samples_split': 0.31156466213584244, 'min_samples_leaf': 0.008109682599448116, 'min_weight_fraction_leaf': 0.0329054718271488, 'max_features': 0.8953244399010691}. Best is trial 253 with value: 0.9108382257790575.[0m
[32m[I 2022-04-21 12:35:35,431][0m Trial 397 finished with value: 0.8867816391734646 and parameters: {'splitter': 'random', 'min_samples_split': 0.11508692634833884, 'min_samples_leaf': 0.08136945693084849, 'min_weight_fraction_leaf': 0.014269580681420424, 'max_features': 0.8636308002906581}. Best is trial 253 with value: 0.9108382257790575.[0m
[32m[I 2022-04-21 12:35:37,042][0m Trial 398 finished with value: 0.9060898160213577 and parameters: {'splitter': 'random', 'min_samples_split': 0.0661609265507549, 'min_samples_leaf': 0.055802408476449725, 'min_weight_fraction_leaf': 0.039078358504041164, 'max_features': 0.9100171045188629}. Best is trial 253 with value: 0.9108382257790575.[0m
[32m[I 2022-04-21 12:35:40,816][0m Trial 399 finished with value: 0.8976236008789762 and parameters: {'splitter': 'random', 'min_samples_split': 0.027355465468665064, 'min_samples_leaf': 0.017665212342632314, 'min_weight_fraction_leaf': 0.054507771985258975, 'max_features': 0.9705309900385658}. Best is trial 253 with value: 0.9108382257790575.[0m
[32m[I 2022-04-21 12:35:43,101][0m Trial 400 finished with value: 0.8951814716020939 and parameters: {'splitter': 'random', 'min_samples_split': 0.04658519773945127, 'min_samples_leaf': 0.042552633146517485, 'min_weight_fraction_leaf': 0.10151566486339836, 'max_features': 0.9223699836780401}. Best is trial 253 with value: 0.9108382257790575.[0m
[32m[I 2022-04-21 12:35:44,715][0m Trial 401 finished with value: 0.9005591712457959 and parameters: {'splitter': 'random', 'min_samples_split': 0.07924987562851643, 'min_samples_leaf': 0.0485041683819419, 'min_weight_fraction_leaf': 0.028627609357028065, 'max_features': 0.8826065266846693}. Best is trial 253 with value: 0.9108382257790575.[0m
[32m[I 2022-04-21 12:35:46,147][0m Trial 402 finished with value: 0.902740814539612 and parameters: {'splitter': 'random', 'min_samples_split': 0.010234081004849734, 'min_samples_leaf': 0.03412642314543568, 'min_weight_fraction_leaf': 0.06823792717351654, 'max_features': 0.9443067288219387}. Best is trial 253 with value: 0.9108382257790575.[0m
[32m[I 2022-04-21 12:35:47,894][0m Trial 403 finished with value: 0.9093247923494931 and parameters: {'splitter': 'random', 'min_samples_split': 0.038184735472059646, 'min_samples_leaf': 0.002393755452499164, 'min_weight_fraction_leaf': 0.04339165653915136, 'max_features': 0.9277680248802564}. Best is trial 253 with value: 0.9108382257790575.[0m
[32m[I 2022-04-21 12:35:50,035][0m Trial 404 finished with value: 0.9056478681165739 and parameters: {'splitter': 'random', 'min_samples_split': 0.03814528750725828, 'min_samples_leaf': 0.007795714125306292, 'min_weight_fraction_leaf': 0.02298195892642938, 'max_features': 0.9581392108156759}. Best is trial 253 with value: 0.9108382257790575.[0m
[32m[I 2022-04-21 12:35:51,208][0m Trial 405 finished with value: 0.9012084908481176 and parameters: {'splitter': 'random', 'min_samples_split': 0.1499320096495788, 'min_samples_leaf': 0.0042476764023256924, 'min_weight_fraction_leaf': 0.03794120931533782, 'max_features': 0.8999156722938041}. Best is trial 253 with value: 0.9108382257790575.[0m
[32m[I 2022-04-21 12:35:52,434][0m Trial 406 finished with value: 0.9027693922858063 and parameters: {'splitter': 'random', 'min_samples_split': 0.021751262451208953, 'min_samples_leaf': 0.018043152132139816, 'min_weight_fraction_leaf': 0.014491520452437437, 'max_features': 0.985583803875794}. Best is trial 253 with value: 0.9108382257790575.[0m
[32m[I 2022-04-21 12:35:53,245][0m Trial 407 finished with value: 0.3425804518366971 and parameters: {'splitter': 'random', 'min_samples_split': 0.030661384468797282, 'min_samples_leaf': 0.001937620253866866, 'min_weight_fraction_leaf': 0.28470834636747866, 'max_features': 0.9337642121983342}. Best is trial 253 with value: 0.9108382257790575.[0m
[32m[I 2022-04-21 12:35:54,041][0m Trial 408 finished with value: 0.3743192651811828 and parameters: {'splitter': 'random', 'min_samples_split': 0.011010719348421601, 'min_samples_leaf': 0.14080917430077255, 'min_weight_fraction_leaf': 0.05401710160277906, 'max_features': 0.5767353551948042}. Best is trial 253 with value: 0.9108382257790575.[0m
[32m[I 2022-04-21 12:35:56,087][0m Trial 409 finished with value: 0.898982060681632 and parameters: {'splitter': 'random', 'min_samples_split': 0.039594163632220215, 'min_samples_leaf': 0.022554895073089325, 'min_weight_fraction_leaf': 0.02937218145407857, 'max_features': 0.9123424726663427}. Best is trial 253 with value: 0.9108382257790575.[0m
[32m[I 2022-04-21 12:35:57,740][0m Trial 410 finished with value: 0.9035160154447034 and parameters: {'splitter': 'random', 'min_samples_split': 0.017963670724801706, 'min_samples_leaf': 0.03520325192073984, 'min_weight_fraction_leaf': 0.04393998419742189, 'max_features': 0.9434869511281885}. Best is trial 253 with value: 0.9108382257790575.[0m
[32m[I 2022-04-21 12:36:00,062][0m Trial 411 finished with value: 0.88773659847461 and parameters: {'splitter': 'random', 'min_samples_split': 0.04879779626536429, 'min_samples_leaf': 0.01690470989933883, 'min_weight_fraction_leaf': 0.07915359644280978, 'max_features': 0.8834210536660522}. Best is trial 253 with value: 0.9108382257790575.[0m
[32m[I 2022-04-21 12:36:01,866][0m Trial 412 finished with value: 0.9034506400171134 and parameters: {'splitter': 'random', 'min_samples_split': 0.0022206078135216176, 'min_samples_leaf': 0.051279829752302455, 'min_weight_fraction_leaf': 0.020351720017788753, 'max_features': 0.9240115594985583}. Best is trial 253 with value: 0.9108382257790575.[0m
[32m[I 2022-04-21 12:36:03,446][0m Trial 413 finished with value: 0.8942999721283542 and parameters: {'splitter': 'random', 'min_samples_split': 0.03228461354386499, 'min_samples_leaf': 0.010335826562644701, 'min_weight_fraction_leaf': 0.0611843238144361, 'max_features': 0.9630138480730993}. Best is trial 253 with value: 0.9108382257790575.[0m
[32m[I 2022-04-21 12:38:42,432][0m Trial 414 finished with value: 0.8845650710856635 and parameters: {'splitter': 'best', 'min_samples_split': 0.06425921579151792, 'min_samples_leaf': 0.029050305986886134, 'min_weight_fraction_leaf': 0.03643320223123213, 'max_features': 0.900290336671046}. Best is trial 253 with value: 0.9108382257790575.[0m
[32m[I 2022-04-21 12:38:44,403][0m Trial 415 finished with value: 0.8996328653152602 and parameters: {'splitter': 'random', 'min_samples_split': 0.04413707690904623, 'min_samples_leaf': 0.0013446676793915369, 'min_weight_fraction_leaf': 0.04951185661704207, 'max_features': 0.8377386699712828}. Best is trial 253 with value: 0.9108382257790575.[0m
[32m[I 2022-04-21 12:38:45,701][0m Trial 416 finished with value: 0.8880528777886332 and parameters: {'splitter': 'random', 'min_samples_split': 0.02121352672238604, 'min_samples_leaf': 0.04076612338153875, 'min_weight_fraction_leaf': 0.008716771016769731, 'max_features': 0.3523506008026028}. Best is trial 253 with value: 0.9108382257790575.[0m
[32m[I 2022-04-21 12:38:47,791][0m Trial 417 finished with value: 0.9026990429796106 and parameters: {'splitter': 'random', 'min_samples_split': 0.02668898589823354, 'min_samples_leaf': 0.0642402326524087, 'min_weight_fraction_leaf': 0.02647914033368559, 'max_features': 0.9416592223163787}. Best is trial 253 with value: 0.9108382257790575.[0m
[32m[I 2022-04-21 12:38:49,850][0m Trial 418 finished with value: 0.9020158378674562 and parameters: {'splitter': 'random', 'min_samples_split': 0.07133267120501643, 'min_samples_leaf': 0.023170854835054537, 'min_weight_fraction_leaf': 0.04072698827767937, 'max_features': 0.8621471858994153}. Best is trial 253 with value: 0.9108382257790575.[0m
[32m[I 2022-04-21 12:38:51,400][0m Trial 419 finished with value: 0.9041469514705007 and parameters: {'splitter': 'random', 'min_samples_split': 0.05269002724362427, 'min_samples_leaf': 0.037764358536316614, 'min_weight_fraction_leaf': 0.03343716633028769, 'max_features': 0.9161437054140817}. Best is trial 253 with value: 0.9108382257790575.[0m
[32m[I 2022-04-21 12:38:52,739][0m Trial 420 finished with value: 0.899921373696795 and parameters: {'splitter': 'random', 'min_samples_split': 0.011595917266028995, 'min_samples_leaf': 0.013128343133142588, 'min_weight_fraction_leaf': 0.0711338848943996, 'max_features': 0.898272300780057}. Best is trial 253 with value: 0.9108382257790575.[0m
[32m[I 2022-04-21 12:38:53,786][0m Trial 421 finished with value: 0.9035511139963326 and parameters: {'splitter': 'random', 'min_samples_split': 0.037572249283805134, 'min_samples_leaf': 0.051022943952039074, 'min_weight_fraction_leaf': 0.019192329454840097, 'max_features': 0.9309622355758228}. Best is trial 253 with value: 0.9108382257790575.[0m
[32m[I 2022-04-21 12:38:54,782][0m Trial 422 finished with value: 0.895032418842477 and parameters: {'splitter': 'random', 'min_samples_split': 0.06145616387315417, 'min_samples_leaf': 0.029757590094355576, 'min_weight_fraction_leaf': 0.05805749328497487, 'max_features': 0.9640482644601508}. Best is trial 253 with value: 0.9108382257790575.[0m
[32m[I 2022-04-21 12:38:55,897][0m Trial 423 finished with value: 0.8992952551169019 and parameters: {'splitter': 'random', 'min_samples_split': 0.10298518483958267, 'min_samples_leaf': 0.0225895214827719, 'min_weight_fraction_leaf': 0.0491013784583264, 'max_features': 0.8802317647428108}. Best is trial 253 with value: 0.9108382257790575.[0m
[32m[I 2022-04-21 12:38:57,111][0m Trial 424 finished with value: 0.9072947925307032 and parameters: {'splitter': 'random', 'min_samples_split': 0.0878087421687736, 'min_samples_leaf': 0.04447174326416349, 'min_weight_fraction_leaf': 0.011241812064727661, 'max_features': 0.9197498941388326}. Best is trial 253 with value: 0.9108382257790575.[0m
[32m[I 2022-04-21 12:38:58,645][0m Trial 425 finished with value: 0.9037732091415368 and parameters: {'splitter': 'random', 'min_samples_split': 0.08418249256577684, 'min_samples_leaf': 0.058911108311132165, 'min_weight_fraction_leaf': 0.006205859532208917, 'max_features': 0.9077161688035569}. Best is trial 253 with value: 0.9108382257790575.[0m
[32m[I 2022-04-21 12:39:00,222][0m Trial 426 finished with value: 0.9034826218079669 and parameters: {'splitter': 'random', 'min_samples_split': 0.09875203256328477, 'min_samples_leaf': 0.046008427283154185, 'min_weight_fraction_leaf': 0.0001613550349217202, 'max_features': 0.9466554631049469}. Best is trial 253 with value: 0.9108382257790575.[0m
[32m[I 2022-04-21 12:39:01,402][0m Trial 427 finished with value: 0.3425804518366971 and parameters: {'splitter': 'random', 'min_samples_split': 0.07316280914384823, 'min_samples_leaf': 0.04154020526757445, 'min_weight_fraction_leaf': 0.3271079583303943, 'max_features': 0.926468139115427}. Best is trial 253 with value: 0.9108382257790575.[0m
[32m[I 2022-04-21 12:39:02,798][0m Trial 428 finished with value: 0.9016162839818364 and parameters: {'splitter': 'random', 'min_samples_split': 0.09051822814288486, 'min_samples_leaf': 0.05033967024202355, 'min_weight_fraction_leaf': 0.012398268960443616, 'max_features': 0.8910292331470867}. Best is trial 253 with value: 0.9108382257790575.[0m
[32m[I 2022-04-21 12:39:04,427][0m Trial 429 finished with value: 0.9052787105007816 and parameters: {'splitter': 'random', 'min_samples_split': 0.06831970148588527, 'min_samples_leaf': 0.07262211949210158, 'min_weight_fraction_leaf': 0.014917327383537368, 'max_features': 0.9846208941137513}. Best is trial 253 with value: 0.9108382257790575.[0m
[32m[I 2022-04-21 12:39:06,264][0m Trial 430 finished with value: 0.8995861043133718 and parameters: {'splitter': 'random', 'min_samples_split': 0.08130804421599923, 'min_samples_leaf': 0.06176173608373573, 'min_weight_fraction_leaf': 0.022396979915843787, 'max_features': 0.8564908328360938}. Best is trial 253 with value: 0.9108382257790575.[0m
[32m[I 2022-04-21 12:39:07,475][0m Trial 431 finished with value: 0.8990752789457561 and parameters: {'splitter': 'random', 'min_samples_split': 0.05077126849975483, 'min_samples_leaf': 0.037825742793267905, 'min_weight_fraction_leaf': 0.027490818570381985, 'max_features': 0.90682036119647}. Best is trial 253 with value: 0.9108382257790575.[0m
[32m[I 2022-04-21 12:39:08,460][0m Trial 432 finished with value: 0.9053238947287141 and parameters: {'splitter': 'random', 'min_samples_split': 0.056863248452937415, 'min_samples_leaf': 0.03205508454844499, 'min_weight_fraction_leaf': 0.008837719611709023, 'max_features': 0.9477119639875694}. Best is trial 253 with value: 0.9108382257790575.[0m
[32m[I 2022-04-21 12:39:09,581][0m Trial 433 finished with value: 0.576187385278785 and parameters: {'splitter': 'random', 'min_samples_split': 0.4537052671713328, 'min_samples_leaf': 0.0528824814348986, 'min_weight_fraction_leaf': 0.23783246651750573, 'max_features': 0.9210606970217361}. Best is trial 253 with value: 0.9108382257790575.[0m
[32m[I 2022-04-21 12:41:29,126][0m Trial 434 finished with value: 0.8850946826443999 and parameters: {'splitter': 'best', 'min_samples_split': 0.04190929823340618, 'min_samples_leaf': 0.043453354963015084, 'min_weight_fraction_leaf': 0.03219407419035078, 'max_features': 0.8765685376070959}. Best is trial 253 with value: 0.9108382257790575.[0m
