[32m[I 2022-04-24 21:03:56,447][0m Trial 848 finished with value: 0.9003004673700736 and parameters: {'n_hidden': 256, 'mixture_components': 5, 'use_sparse_layer': False, 'use_batchnorm': True, 'use_dropout': False, 'mlp_size_1': 5, 'mlp_size_2': 0, 'mlp_size_3': 0, 'kernel': 'Normal', 'loss_name': 'NLLLoss'}. Best is trial 647 with value: 0.9282546649369519.[0m
[32m[I 2022-04-24 21:08:17,113][0m Trial 849 finished with value: 0.42430574521705056 and parameters: {'n_hidden': 1024, 'mixture_components': 5, 'use_sparse_layer': False, 'use_batchnorm': False, 'use_dropout': True, 'dropout': 0.29522016438003884, 'mlp_size_1': 6, 'mlp_size_2': 1, 'mlp_size_3': 0, 'kernel': 'Normal', 'loss_name': 'AlternativeNLLLoss'}. Best is trial 647 with value: 0.9282546649369519.[0m
[32m[I 2022-04-24 21:13:31,625][0m Trial 850 finished with value: 0.9264515755343801 and parameters: {'n_hidden': 1024, 'mixture_components': 5, 'use_sparse_layer': True, 'use_sparse_loss': True, 'lmbd': 3.8874105240598836e-05, 'use_batchnorm': False, 'use_dropout': False, 'mlp_size_1': 6, 'mlp_size_2': 1, 'mlp_size_3': 0, 'kernel': 'Normal', 'loss_name': 'CensoredNLLLoss'}. Best is trial 647 with value: 0.9282546649369519.[0m
[32m[I 2022-04-24 21:17:50,578][0m Trial 851 finished with value: 0.9276938195174669 and parameters: {'n_hidden': 1024, 'mixture_components': 4, 'use_sparse_layer': False, 'use_batchnorm': False, 'use_dropout': False, 'mlp_size_1': 6, 'mlp_size_2': 1, 'mlp_size_3': 0, 'kernel': 'LogLogistic', 'loss_name': 'AlternativeNLLLoss'}. Best is trial 647 with value: 0.9282546649369519.[0m
[32m[I 2022-04-24 21:21:56,616][0m Trial 852 finished with value: 0.9243731133778705 and parameters: {'n_hidden': 1024, 'mixture_components': 4, 'use_sparse_layer': False, 'use_batchnorm': False, 'use_dropout': False, 'mlp_size_1': 6, 'mlp_size_2': 1, 'mlp_size_3': 0, 'kernel': 'LogLogistic', 'loss_name': 'AlternativeNLLLoss'}. Best is trial 647 with value: 0.9282546649369519.[0m
[32m[I 2022-04-24 21:25:34,705][0m Trial 853 finished with value: 0.9207671397280652 and parameters: {'n_hidden': 1024, 'mixture_components': 4, 'use_sparse_layer': False, 'use_batchnorm': False, 'use_dropout': False, 'mlp_size_1': 6, 'mlp_size_2': 1, 'mlp_size_3': 0, 'kernel': 'LogLogistic', 'loss_name': 'AlternativeNLLLoss'}. Best is trial 647 with value: 0.9282546649369519.[0m
[32m[I 2022-04-24 21:30:09,188][0m Trial 854 finished with value: 0.8226355186230112 and parameters: {'n_hidden': 2048, 'mixture_components': 4, 'use_sparse_layer': False, 'use_batchnorm': False, 'use_dropout': False, 'mlp_size_1': 7, 'mlp_size_2': 1, 'mlp_size_3': 0, 'kernel': 'LogLogistic', 'loss_name': 'AlternativeNLLLoss'}. Best is trial 647 with value: 0.9282546649369519.[0m
[32m[I 2022-04-24 21:34:20,121][0m Trial 855 finished with value: 0.9262823556798315 and parameters: {'n_hidden': 1024, 'mixture_components': 4, 'use_sparse_layer': False, 'use_batchnorm': False, 'use_dropout': False, 'mlp_size_1': 6, 'mlp_size_2': 1, 'mlp_size_3': 0, 'kernel': 'LogLogistic', 'loss_name': 'CensoredNLLLoss'}. Best is trial 647 with value: 0.9282546649369519.[0m
[32m[I 2022-04-24 21:37:47,283][0m Trial 856 finished with value: 0.8966070001542408 and parameters: {'n_hidden': 1024, 'mixture_components': 4, 'use_sparse_layer': False, 'use_batchnorm': False, 'use_dropout': False, 'mlp_size_1': 6, 'mlp_size_2': 1, 'mlp_size_3': 0, 'kernel': 'LogLogistic', 'loss_name': 'AlternativeNLLLoss'}. Best is trial 647 with value: 0.9282546649369519.[0m
[32m[I 2022-04-24 21:41:57,417][0m Trial 857 finished with value: 0.9258708986220461 and parameters: {'n_hidden': 1024, 'mixture_components': 4, 'use_sparse_layer': False, 'use_batchnorm': False, 'use_dropout': False, 'mlp_size_1': 6, 'mlp_size_2': 1, 'mlp_size_3': 0, 'kernel': 'LogLogistic', 'loss_name': 'AlternativeNLLLoss'}. Best is trial 647 with value: 0.9282546649369519.[0m
[32m[I 2022-04-24 21:46:02,779][0m Trial 858 finished with value: 0.9247450897062752 and parameters: {'n_hidden': 1024, 'mixture_components': 4, 'use_sparse_layer': False, 'use_batchnorm': False, 'use_dropout': False, 'mlp_size_1': 6, 'mlp_size_2': 1, 'mlp_size_3': 0, 'kernel': 'Logistic', 'loss_name': 'AlternativeNLLLoss'}. Best is trial 647 with value: 0.9282546649369519.[0m
[32m[I 2022-04-24 21:50:26,715][0m Trial 859 finished with value: 0.8256180923932593 and parameters: {'n_hidden': 1024, 'mixture_components': 4, 'use_sparse_layer': False, 'use_batchnorm': False, 'use_dropout': False, 'mlp_size_1': 6, 'mlp_size_2': 1, 'mlp_size_3': 0, 'kernel': 'LogLogistic', 'loss_name': 'CensoredNLLLoss'}. Best is trial 647 with value: 0.9282546649369519.[0m
[32m[I 2022-04-24 21:53:15,569][0m Trial 860 finished with value: 0.6838045869136264 and parameters: {'n_hidden': 512, 'mixture_components': 4, 'use_sparse_layer': False, 'use_batchnorm': False, 'use_dropout': False, 'mlp_size_1': 6, 'mlp_size_2': 0, 'mlp_size_3': 0, 'kernel': 'LogLogistic', 'loss_name': 'AlternativeNLLLoss'}. Best is trial 647 with value: 0.9282546649369519.[0m
[32m[I 2022-04-24 21:57:08,058][0m Trial 861 finished with value: 0.9269914603594589 and parameters: {'n_hidden': 1024, 'mixture_components': 4, 'use_sparse_layer': False, 'use_batchnorm': False, 'use_dropout': False, 'mlp_size_1': 6, 'mlp_size_2': 1, 'mlp_size_3': 0, 'kernel': 'LogLogistic', 'loss_name': 'AlternativeNLLLoss'}. Best is trial 647 with value: 0.9282546649369519.[0m
[32m[I 2022-04-24 22:00:10,144][0m Trial 862 finished with value: 0.6367844176771281 and parameters: {'n_hidden': 1024, 'mixture_components': 7, 'use_sparse_layer': False, 'use_batchnorm': False, 'use_dropout': False, 'mlp_size_1': 6, 'mlp_size_2': 1, 'mlp_size_3': 0, 'kernel': 'LogLogistic', 'loss_name': 'AlternativeNLLLoss'}. Best is trial 647 with value: 0.9282546649369519.[0m
[32m[I 2022-04-24 22:05:33,578][0m Trial 863 finished with value: 0.9235668397497323 and parameters: {'n_hidden': 32, 'mixture_components': 4, 'use_sparse_layer': False, 'use_batchnorm': False, 'use_dropout': False, 'mlp_size_1': 2, 'mlp_size_2': 0, 'mlp_size_3': 0, 'kernel': 'LogLogistic', 'loss_name': 'AlternativeNLLLoss'}. Best is trial 647 with value: 0.9282546649369519.[0m
[32m[I 2022-04-24 22:09:30,235][0m Trial 864 finished with value: 0.922711433730432 and parameters: {'n_hidden': 1024, 'mixture_components': 4, 'use_sparse_layer': False, 'use_batchnorm': False, 'use_dropout': False, 'mlp_size_1': 6, 'mlp_size_2': 1, 'mlp_size_3': 0, 'kernel': 'LogLogistic', 'loss_name': 'CensoredNLLLoss'}. Best is trial 647 with value: 0.9282546649369519.[0m
[32m[I 2022-04-24 22:11:53,777][0m Trial 865 finished with value: -0.5 and parameters: {'n_hidden': 1024, 'mixture_components': 4, 'use_sparse_layer': False, 'use_batchnorm': False, 'use_dropout': False, 'mlp_size_1': 6, 'mlp_size_2': 1, 'mlp_size_3': 0, 'kernel': 'Exponential', 'loss_name': 'AlternativeNLLLoss'}. Best is trial 647 with value: 0.9282546649369519.[0m
[32m[I 2022-04-24 22:14:43,549][0m Trial 866 finished with value: 0.41597496693863284 and parameters: {'n_hidden': 1024, 'mixture_components': 4, 'use_sparse_layer': False, 'use_batchnorm': False, 'use_dropout': True, 'dropout': 0.5596713345935059, 'mlp_size_1': 6, 'mlp_size_2': 1, 'mlp_size_3': 0, 'kernel': 'LogLogistic', 'loss_name': 'AlternativeNLLLoss'}. Best is trial 647 with value: 0.9282546649369519.[0m
[32m[I 2022-04-24 22:20:07,551][0m Trial 867 finished with value: 0.8142244320913266 and parameters: {'n_hidden': 1024, 'mixture_components': 4, 'use_sparse_layer': False, 'use_batchnorm': True, 'use_dropout': False, 'mlp_size_1': 6, 'mlp_size_2': 1, 'mlp_size_3': 0, 'kernel': 'LogLogistic', 'loss_name': 'AlternativeNLLLoss'}. Best is trial 647 with value: 0.9282546649369519.[0m
[32m[I 2022-04-24 22:23:58,542][0m Trial 868 finished with value: 0.9227942593930484 and parameters: {'n_hidden': 128, 'mixture_components': 5, 'use_sparse_layer': False, 'use_batchnorm': False, 'use_dropout': False, 'mlp_size_1': 4, 'mlp_size_2': 0, 'mlp_size_3': 0, 'kernel': 'LogLogistic', 'loss_name': 'CensoredNLLLoss'}. Best is trial 647 with value: 0.9282546649369519.[0m
[32m[I 2022-04-24 22:27:55,873][0m Trial 869 finished with value: 0.9271556386995414 and parameters: {'n_hidden': 1024, 'mixture_components': 4, 'use_sparse_layer': False, 'use_batchnorm': False, 'use_dropout': False, 'mlp_size_1': 6, 'mlp_size_2': 1, 'mlp_size_3': 0, 'kernel': 'LogLogistic', 'loss_name': 'AlternativeNLLLoss'}. Best is trial 647 with value: 0.9282546649369519.[0m
[32m[I 2022-04-24 22:32:36,833][0m Trial 870 finished with value: 0.807857586012061 and parameters: {'n_hidden': 2048, 'mixture_components': 4, 'use_sparse_layer': True, 'use_sparse_loss': False, 'use_batchnorm': False, 'use_dropout': False, 'mlp_size_1': 7, 'mlp_size_2': 1, 'mlp_size_3': 0, 'kernel': 'Normal', 'loss_name': 'NLLLoss'}. Best is trial 647 with value: 0.9282546649369519.[0m
[32m[I 2022-04-24 22:37:52,089][0m Trial 871 finished with value: 0.9269190441614246 and parameters: {'n_hidden': 1024, 'mixture_components': 4, 'use_sparse_layer': False, 'use_batchnorm': False, 'use_dropout': False, 'mlp_size_1': 6, 'mlp_size_2': 1, 'mlp_size_3': 0, 'kernel': 'Normal', 'loss_name': 'AlternativeNLLLoss'}. Best is trial 647 with value: 0.9282546649369519.[0m
[32m[I 2022-04-24 22:42:29,549][0m Trial 872 finished with value: 0.9197442901054629 and parameters: {'n_hidden': 1024, 'mixture_components': 5, 'use_sparse_layer': False, 'use_batchnorm': False, 'use_dropout': False, 'mlp_size_1': 6, 'mlp_size_2': 1, 'mlp_size_3': 0, 'kernel': 'Normal', 'loss_name': 'AlternativeNLLLoss'}. Best is trial 647 with value: 0.9282546649369519.[0m
[32m[I 2022-04-24 22:47:39,851][0m Trial 873 finished with value: 0.9258478949292861 and parameters: {'n_hidden': 1024, 'mixture_components': 7, 'use_sparse_layer': False, 'use_batchnorm': False, 'use_dropout': False, 'mlp_size_1': 6, 'mlp_size_2': 1, 'mlp_size_3': 0, 'kernel': 'Normal', 'loss_name': 'CensoredNLLLoss'}. Best is trial 647 with value: 0.9282546649369519.[0m
[32m[I 2022-04-24 22:52:33,267][0m Trial 874 finished with value: 0.9246045642917791 and parameters: {'n_hidden': 1024, 'mixture_components': 5, 'use_sparse_layer': False, 'use_batchnorm': False, 'use_dropout': False, 'mlp_size_1': 6, 'mlp_size_2': 1, 'mlp_size_3': 0, 'kernel': 'Normal', 'loss_name': 'AlternativeNLLLoss'}. Best is trial 647 with value: 0.9282546649369519.[0m
[32m[I 2022-04-24 22:59:00,482][0m Trial 875 finished with value: 0.8258606842997454 and parameters: {'n_hidden': 64, 'mixture_components': 4, 'use_sparse_layer': False, 'use_batchnorm': False, 'use_dropout': False, 'mlp_size_1': 3, 'mlp_size_2': 0, 'mlp_size_3': 0, 'kernel': 'Normal', 'loss_name': 'AlternativeNLLLoss'}. Best is trial 647 with value: 0.9282546649369519.[0m
[32m[I 2022-04-24 23:04:16,461][0m Trial 876 finished with value: 0.925860663215141 and parameters: {'n_hidden': 1024, 'mixture_components': 5, 'use_sparse_layer': False, 'use_batchnorm': False, 'use_dropout': False, 'mlp_size_1': 6, 'mlp_size_2': 1, 'mlp_size_3': 0, 'kernel': 'Normal', 'loss_name': 'AlternativeNLLLoss'}. Best is trial 647 with value: 0.9282546649369519.[0m
[32m[I 2022-04-24 23:08:45,384][0m Trial 877 finished with value: 0.9250738918259331 and parameters: {'n_hidden': 256, 'mixture_components': 5, 'use_sparse_layer': False, 'use_batchnorm': False, 'use_dropout': False, 'mlp_size_1': 5, 'mlp_size_2': 0, 'mlp_size_3': 0, 'kernel': 'Normal', 'loss_name': 'AlternativeNLLLoss'}. Best is trial 647 with value: 0.9282546649369519.[0m
[32m[I 2022-04-24 23:11:20,833][0m Trial 878 finished with value: 0.40854858708745195 and parameters: {'n_hidden': 1024, 'mixture_components': 5, 'use_sparse_layer': False, 'use_batchnorm': False, 'use_dropout': False, 'mlp_size_1': 0, 'mlp_size_2': 2, 'mlp_size_3': 0, 'kernel': 'Normal', 'loss_name': 'CensoredNLLLoss'}. Best is trial 647 with value: 0.9282546649369519.[0m
[32m[I 2022-04-24 23:13:32,948][0m Trial 879 finished with value: -0.5 and parameters: {'n_hidden': 1024, 'mixture_components': 5, 'use_sparse_layer': False, 'use_batchnorm': False, 'use_dropout': False, 'mlp_size_1': 6, 'mlp_size_2': 1, 'mlp_size_3': 0, 'kernel': 'Exponential', 'loss_name': 'AlternativeNLLLoss'}. Best is trial 647 with value: 0.9282546649369519.[0m
[32m[I 2022-04-24 23:18:09,644][0m Trial 880 finished with value: 0.9276182411534443 and parameters: {'n_hidden': 1024, 'mixture_components': 5, 'use_sparse_layer': False, 'use_batchnorm': False, 'use_dropout': False, 'mlp_size_1': 6, 'mlp_size_2': 1, 'mlp_size_3': 0, 'kernel': 'Normal', 'loss_name': 'AlternativeNLLLoss'}. Best is trial 647 with value: 0.9282546649369519.[0m
[32m[I 2022-04-24 23:22:43,723][0m Trial 881 finished with value: 0.9273133834808949 and parameters: {'n_hidden': 1024, 'mixture_components': 4, 'use_sparse_layer': False, 'use_batchnorm': False, 'use_dropout': False, 'mlp_size_1': 6, 'mlp_size_2': 1, 'mlp_size_3': 0, 'kernel': 'Normal', 'loss_name': 'AlternativeNLLLoss'}. Best is trial 647 with value: 0.9282546649369519.[0m
[32m[I 2022-04-24 23:27:57,526][0m Trial 882 finished with value: 0.926342341493174 and parameters: {'n_hidden': 1024, 'mixture_components': 5, 'use_sparse_layer': False, 'use_batchnorm': False, 'use_dropout': False, 'mlp_size_1': 6, 'mlp_size_2': 1, 'mlp_size_3': 0, 'kernel': 'Normal', 'loss_name': 'AlternativeNLLLoss'}. Best is trial 647 with value: 0.9282546649369519.[0m
[32m[I 2022-04-24 23:31:40,319][0m Trial 883 finished with value: 0.5861023169449705 and parameters: {'n_hidden': 1024, 'mixture_components': 6, 'use_sparse_layer': False, 'use_batchnorm': False, 'use_dropout': False, 'mlp_size_1': 7, 'mlp_size_2': 0, 'mlp_size_3': 0, 'kernel': 'LogLogistic', 'loss_name': 'AlternativeNLLLoss'}. Best is trial 647 with value: 0.9282546649369519.[0m
[32m[I 2022-04-24 23:36:18,164][0m Trial 884 finished with value: 0.9255755112235804 and parameters: {'n_hidden': 1024, 'mixture_components': 5, 'use_sparse_layer': False, 'use_batchnorm': False, 'use_dropout': False, 'mlp_size_1': 6, 'mlp_size_2': 1, 'mlp_size_3': 0, 'kernel': 'Normal', 'loss_name': 'AlternativeNLLLoss'}. Best is trial 647 with value: 0.9282546649369519.[0m
[32m[I 2022-04-24 23:43:23,268][0m Trial 885 finished with value: 0.9268963677210375 and parameters: {'n_hidden': 2048, 'mixture_components': 7, 'use_sparse_layer': False, 'use_batchnorm': False, 'use_dropout': False, 'mlp_size_1': 7, 'mlp_size_2': 1, 'mlp_size_3': 0, 'kernel': 'Normal', 'loss_name': 'AlternativeNLLLoss'}. Best is trial 647 with value: 0.9282546649369519.[0m
[32m[I 2022-04-24 23:47:51,127][0m Trial 886 finished with value: 0.41976885178316714 and parameters: {'n_hidden': 1024, 'mixture_components': 4, 'use_sparse_layer': False, 'use_batchnorm': False, 'use_dropout': True, 'dropout': 0.44648969117161386, 'mlp_size_1': 6, 'mlp_size_2': 1, 'mlp_size_3': 0, 'kernel': 'Normal', 'loss_name': 'AlternativeNLLLoss'}. Best is trial 647 with value: 0.9282546649369519.[0m
[32m[I 2022-04-24 23:52:35,312][0m Trial 887 finished with value: 0.9232586251527245 and parameters: {'n_hidden': 1024, 'mixture_components': 6, 'use_sparse_layer': False, 'use_batchnorm': False, 'use_dropout': False, 'mlp_size_1': 6, 'mlp_size_2': 1, 'mlp_size_3': 0, 'kernel': 'Normal', 'loss_name': 'AlternativeNLLLoss'}. Best is trial 647 with value: 0.9282546649369519.[0m
[32m[I 2022-04-25 00:00:50,722][0m Trial 888 finished with value: 0.8124057579106811 and parameters: {'n_hidden': 1024, 'mixture_components': 5, 'use_sparse_layer': False, 'use_batchnorm': True, 'use_dropout': False, 'mlp_size_1': 6, 'mlp_size_2': 1, 'mlp_size_3': 0, 'kernel': 'Normal', 'loss_name': 'AlternativeNLLLoss'}. Best is trial 647 with value: 0.9282546649369519.[0m
[32m[I 2022-04-25 00:06:33,334][0m Trial 889 finished with value: 0.9249116758498662 and parameters: {'n_hidden': 1024, 'mixture_components': 6, 'use_sparse_layer': True, 'use_sparse_loss': True, 'lmbd': 0.027044954197459576, 'use_batchnorm': False, 'use_dropout': False, 'mlp_size_1': 6, 'mlp_size_2': 1, 'mlp_size_3': 0, 'kernel': 'Normal', 'loss_name': 'AlternativeNLLLoss'}. Best is trial 647 with value: 0.9282546649369519.[0m
[32m[I 2022-04-25 00:11:28,837][0m Trial 890 finished with value: 0.9262564156944538 and parameters: {'n_hidden': 1024, 'mixture_components': 5, 'use_sparse_layer': False, 'use_batchnorm': False, 'use_dropout': False, 'mlp_size_1': 6, 'mlp_size_2': 1, 'mlp_size_3': 0, 'kernel': 'Normal', 'loss_name': 'AlternativeNLLLoss'}. Best is trial 647 with value: 0.9282546649369519.[0m
[32m[I 2022-04-25 00:15:42,104][0m Trial 891 finished with value: 0.9170986008912487 and parameters: {'n_hidden': 1024, 'mixture_components': 5, 'use_sparse_layer': False, 'use_batchnorm': False, 'use_dropout': False, 'mlp_size_1': 6, 'mlp_size_2': 1, 'mlp_size_3': 0, 'kernel': 'Logistic', 'loss_name': 'AlternativeNLLLoss'}. Best is trial 647 with value: 0.9282546649369519.[0m
[32m[I 2022-04-25 00:20:27,580][0m Trial 892 finished with value: 0.9255145031475778 and parameters: {'n_hidden': 512, 'mixture_components': 6, 'use_sparse_layer': False, 'use_batchnorm': False, 'use_dropout': False, 'mlp_size_1': 6, 'mlp_size_2': 0, 'mlp_size_3': 0, 'kernel': 'Normal', 'loss_name': 'AlternativeNLLLoss'}. Best is trial 647 with value: 0.9282546649369519.[0m
[32m[I 2022-04-25 00:25:26,854][0m Trial 893 finished with value: 0.9265087277886559 and parameters: {'n_hidden': 1024, 'mixture_components': 4, 'use_sparse_layer': False, 'use_batchnorm': False, 'use_dropout': False, 'mlp_size_1': 6, 'mlp_size_2': 1, 'mlp_size_3': 0, 'kernel': 'Normal', 'loss_name': 'AlternativeNLLLoss'}. Best is trial 647 with value: 0.9282546649369519.[0m
[32m[I 2022-04-25 00:33:30,043][0m Trial 894 finished with value: 0.9236402284780917 and parameters: {'n_hidden': 32, 'mixture_components': 5, 'use_sparse_layer': False, 'use_batchnorm': False, 'use_dropout': False, 'mlp_size_1': 2, 'mlp_size_2': 0, 'mlp_size_3': 0, 'kernel': 'Normal', 'loss_name': 'AlternativeNLLLoss'}. Best is trial 647 with value: 0.9282546649369519.[0m
[32m[I 2022-04-25 00:38:15,320][0m Trial 895 finished with value: 0.9273712580217243 and parameters: {'n_hidden': 1024, 'mixture_components': 5, 'use_sparse_layer': False, 'use_batchnorm': False, 'use_dropout': False, 'mlp_size_1': 6, 'mlp_size_2': 1, 'mlp_size_3': 0, 'kernel': 'Normal', 'loss_name': 'AlternativeNLLLoss'}. Best is trial 647 with value: 0.9282546649369519.[0m
[32m[I 2022-04-25 00:42:55,204][0m Trial 896 finished with value: 0.9249560015776014 and parameters: {'n_hidden': 128, 'mixture_components': 5, 'use_sparse_layer': False, 'use_batchnorm': False, 'use_dropout': False, 'mlp_size_1': 4, 'mlp_size_2': 0, 'mlp_size_3': 0, 'kernel': 'Normal', 'loss_name': 'AlternativeNLLLoss'}. Best is trial 647 with value: 0.9282546649369519.[0m
[32m[I 2022-04-25 00:46:47,889][0m Trial 897 finished with value: 0.9267601480751487 and parameters: {'n_hidden': 1024, 'mixture_components': 6, 'use_sparse_layer': False, 'use_batchnorm': False, 'use_dropout': False, 'mlp_size_1': 6, 'mlp_size_2': 1, 'mlp_size_3': 0, 'kernel': 'LogLogistic', 'loss_name': 'AlternativeNLLLoss'}. Best is trial 647 with value: 0.9282546649369519.[0m
[32m[I 2022-04-25 00:51:57,893][0m Trial 898 finished with value: 0.9264297879620711 and parameters: {'n_hidden': 1024, 'mixture_components': 5, 'use_sparse_layer': False, 'use_batchnorm': False, 'use_dropout': False, 'mlp_size_1': 6, 'mlp_size_2': 1, 'mlp_size_3': 0, 'kernel': 'Normal', 'loss_name': 'AlternativeNLLLoss'}. Best is trial 647 with value: 0.9282546649369519.[0m
[32m[I 2022-04-25 00:56:34,523][0m Trial 899 finished with value: 0.8268235439511701 and parameters: {'n_hidden': 1024, 'mixture_components': 6, 'use_sparse_layer': False, 'use_batchnorm': False, 'use_dropout': False, 'mlp_size_1': 6, 'mlp_size_2': 1, 'mlp_size_3': 0, 'kernel': 'Normal', 'loss_name': 'AlternativeNLLLoss'}. Best is trial 647 with value: 0.9282546649369519.[0m
[32m[I 2022-04-25 01:00:58,485][0m Trial 900 finished with value: 0.8185668626008802 and parameters: {'n_hidden': 1024, 'mixture_components': 5, 'use_sparse_layer': False, 'use_batchnorm': False, 'use_dropout': False, 'mlp_size_1': 6, 'mlp_size_2': 1, 'mlp_size_3': 0, 'kernel': 'Normal', 'loss_name': 'AlternativeNLLLoss'}. Best is trial 647 with value: 0.9282546649369519.[0m
[32m[I 2022-04-25 01:05:45,869][0m Trial 901 finished with value: 0.8226982797906846 and parameters: {'n_hidden': 1024, 'mixture_components': 4, 'use_sparse_layer': False, 'use_batchnorm': False, 'use_dropout': False, 'mlp_size_1': 7, 'mlp_size_2': 0, 'mlp_size_3': 0, 'kernel': 'Normal', 'loss_name': 'AlternativeNLLLoss'}. Best is trial 647 with value: 0.9282546649369519.[0m
[32m[I 2022-04-25 01:11:43,526][0m Trial 902 finished with value: 0.6416403080365509 and parameters: {'n_hidden': 2048, 'mixture_components': 7, 'use_sparse_layer': False, 'use_batchnorm': False, 'use_dropout': False, 'mlp_size_1': 7, 'mlp_size_2': 1, 'mlp_size_3': 0, 'kernel': 'Normal', 'loss_name': 'AlternativeNLLLoss'}. Best is trial 647 with value: 0.9282546649369519.[0m
[32m[I 2022-04-25 01:16:30,956][0m Trial 903 finished with value: 0.9271159603036448 and parameters: {'n_hidden': 1024, 'mixture_components': 5, 'use_sparse_layer': False, 'use_batchnorm': False, 'use_dropout': False, 'mlp_size_1': 6, 'mlp_size_2': 1, 'mlp_size_3': 0, 'kernel': 'Normal', 'loss_name': 'AlternativeNLLLoss'}. Best is trial 647 with value: 0.9282546649369519.[0m
[32m[I 2022-04-25 01:22:55,346][0m Trial 904 finished with value: 0.9252420709852542 and parameters: {'n_hidden': 64, 'mixture_components': 6, 'use_sparse_layer': False, 'use_batchnorm': False, 'use_dropout': False, 'mlp_size_1': 3, 'mlp_size_2': 0, 'mlp_size_3': 0, 'kernel': 'Normal', 'loss_name': 'AlternativeNLLLoss'}. Best is trial 647 with value: 0.9282546649369519.[0m
