[32m[I 2022-05-07 02:37:32,112][0m Trial 63 finished with value: 0.6949753977621199 and parameters: {'loss': 'coxph', 'learning_rate': 0.00039766276353561024, 'n_estimators': 630, 'criterion': 'friedman_mse', 'min_samples_split': 8, 'min_samples_leaf': 3, 'min_weight_fraction_leaf': 0.4300427993430014, 'min_impurity_decrease': 0.23851268021232017, 'max_features': 0.6536888491681684, 'subsample': 0.9273762704894146, 'dropout_rate': 0.9239352856454752, 'ccp_alpha': 0.10335957655946526}. Best is trial 63 with value: 0.6949753977621199.[0m
[32m[I 2022-05-07 02:59:03,870][0m Trial 64 finished with value: 0.5 and parameters: {'loss': 'coxph', 'learning_rate': 0.0004230748393423762, 'n_estimators': 643, 'criterion': 'friedman_mse', 'min_samples_split': 8, 'min_samples_leaf': 4, 'min_weight_fraction_leaf': 0.3604929810076616, 'min_impurity_decrease': 0.6975723003632156, 'max_features': 0.5513927425119916, 'subsample': 0.9006489053528218, 'dropout_rate': 0.9268798435763157, 'ccp_alpha': 4.970101649486741}. Best is trial 63 with value: 0.6949753977621199.[0m
[32m[I 2022-05-07 03:02:21,700][0m Trial 65 finished with value: 0.5 and parameters: {'loss': 'coxph', 'learning_rate': 0.00019979518231662735, 'n_estimators': 104, 'criterion': 'friedman_mse', 'min_samples_split': 8, 'min_samples_leaf': 3, 'min_weight_fraction_leaf': 0.42851456505630664, 'min_impurity_decrease': 0.22966191427028138, 'max_features': 0.6210790579374875, 'subsample': 0.8287596278053111, 'dropout_rate': 0.8166617582304369, 'ccp_alpha': 0.25086336608317505}. Best is trial 63 with value: 0.6949753977621199.[0m
[32m[I 2022-05-07 03:22:32,703][0m Trial 66 finished with value: 0.7386449248380516 and parameters: {'loss': 'coxph', 'learning_rate': 9.955534090145929e-05, 'n_estimators': 599, 'criterion': 'friedman_mse', 'min_samples_split': 8, 'min_samples_leaf': 4, 'min_weight_fraction_leaf': 0.36016940953722826, 'min_impurity_decrease': 0.6818289214523385, 'max_features': 0.5536460396586034, 'subsample': 0.9106040410370777, 'dropout_rate': 0.9307565397036035, 'ccp_alpha': 0.07608191476828918}. Best is trial 66 with value: 0.7386449248380516.[0m
[32m[I 2022-05-07 03:25:57,412][0m Trial 67 finished with value: 0.5 and parameters: {'loss': 'coxph', 'learning_rate': 9.436905855403009e-05, 'n_estimators': 101, 'criterion': 'friedman_mse', 'min_samples_split': 8, 'min_samples_leaf': 3, 'min_weight_fraction_leaf': 0.48220189653233786, 'min_impurity_decrease': 0.659321244850889, 'max_features': 0.6628300664384448, 'subsample': 0.9383796275698029, 'dropout_rate': 0.9265318507878362, 'ccp_alpha': 0.24167582092076154}. Best is trial 66 with value: 0.7386449248380516.[0m
[32m[I 2022-05-07 03:46:05,325][0m Trial 68 finished with value: 0.5 and parameters: {'loss': 'coxph', 'learning_rate': 3.259000346956411e-05, 'n_estimators': 560, 'criterion': 'squared_error', 'min_samples_split': 9, 'min_samples_leaf': 4, 'min_weight_fraction_leaf': 0.40118068279186986, 'min_impurity_decrease': 0.5624603578928242, 'max_features': 0.5678238412245927, 'subsample': 0.9725177188937834, 'dropout_rate': 0.826548535009482, 'ccp_alpha': 0.013879554632164906}. Best is trial 66 with value: 0.7386449248380516.[0m
[32m[I 2022-05-07 04:14:54,262][0m Trial 69 finished with value: 0.5 and parameters: {'loss': 'coxph', 'learning_rate': 9.344563884243774e-05, 'n_estimators': 826, 'criterion': 'friedman_mse', 'min_samples_split': 10, 'min_samples_leaf': 4, 'min_weight_fraction_leaf': 0.47725171576053843, 'min_impurity_decrease': 0.6497340443888909, 'max_features': 0.49652835332565254, 'subsample': 0.9389927253545408, 'dropout_rate': 0.9029762268481122, 'ccp_alpha': 0.4017495552717447}. Best is trial 66 with value: 0.7386449248380516.[0m
/media/san2_ssd/data/Workdir/survival/venv/lib/python3.8/site-packages/sksurv/ensemble/boosting.py:955: RuntimeWarning: divide by zero encountered in log
  time = numpy.log(time)
/media/san2_ssd/data/Workdir/survival/venv/lib/python3.8/site-packages/sksurv/ensemble/boosting.py:955: RuntimeWarning: divide by zero encountered in log
  time = numpy.log(time)
/media/san2_ssd/data/Workdir/survival/venv/lib/python3.8/site-packages/sksurv/ensemble/boosting.py:955: RuntimeWarning: divide by zero encountered in log
  time = numpy.log(time)
/media/san2_ssd/data/Workdir/survival/venv/lib/python3.8/site-packages/sksurv/ensemble/boosting.py:955: RuntimeWarning: divide by zero encountered in log
  time = numpy.log(time)
/media/san2_ssd/data/Workdir/survival/venv/lib/python3.8/site-packages/sksurv/ensemble/boosting.py:955: RuntimeWarning: divide by zero encountered in log
  time = numpy.log(time)
[32m[I 2022-05-07 04:14:54,307][0m Trial 70 finished with value: -1.0 and parameters: {'loss': 'squared', 'learning_rate': 3.6802232075982825e-05, 'n_estimators': 558, 'criterion': 'friedman_mse', 'min_samples_split': 10, 'min_samples_leaf': 4, 'min_weight_fraction_leaf': 0.4119136299649279, 'min_impurity_decrease': 0.5959042493776128, 'max_features': 0.5034565043659978, 'subsample': 0.9616490124853745, 'dropout_rate': 0.8324402518991186, 'ccp_alpha': 0.45229892841825153}. Best is trial 66 with value: 0.7386449248380516.[0m
[32m[I 2022-05-07 04:42:01,544][0m Trial 71 finished with value: 0.5 and parameters: {'loss': 'coxph', 'learning_rate': 0.00010561946994014231, 'n_estimators': 682, 'criterion': 'friedman_mse', 'min_samples_split': 7, 'min_samples_leaf': 4, 'min_weight_fraction_leaf': 0.4321062330586951, 'min_impurity_decrease': 0.7157720612228589, 'max_features': 0.505876832231148, 'subsample': 0.8469691397452935, 'dropout_rate': 0.026098778753314383, 'ccp_alpha': 4.752669361845427}. Best is trial 66 with value: 0.7386449248380516.[0m
[32m[I 2022-05-07 05:16:18,253][0m Trial 72 finished with value: 0.5 and parameters: {'loss': 'coxph', 'learning_rate': 0.00568232273512473, 'n_estimators': 612, 'criterion': 'absolute_error', 'min_samples_split': 6, 'min_samples_leaf': 2, 'min_weight_fraction_leaf': 0.0033503992207706765, 'min_impurity_decrease': 0.39331250575951004, 'max_features': 0.32362040666156894, 'subsample': 0.0027259255825598586, 'dropout_rate': 0.3251280837312921, 'ccp_alpha': 2.3008656154383123}. Best is trial 66 with value: 0.7386449248380516.[0m
[32m[I 2022-05-07 05:37:05,635][0m Trial 73 finished with value: 0.5 and parameters: {'loss': 'coxph', 'learning_rate': 0.014636473365872526, 'n_estimators': 418, 'criterion': 'squared_error', 'min_samples_split': 8, 'min_samples_leaf': 2, 'min_weight_fraction_leaf': 0.038495420905887354, 'min_impurity_decrease': 0.9075163345871722, 'max_features': 0.7653641607690138, 'subsample': 0.04601485197208747, 'dropout_rate': 0.7436690990322747, 'ccp_alpha': 0.15434587925324517}. Best is trial 66 with value: 0.7386449248380516.[0m
[32m[I 2022-05-07 05:49:24,054][0m Trial 74 finished with value: 0.5 and parameters: {'loss': 'coxph', 'learning_rate': 0.006021738965022781, 'n_estimators': 253, 'criterion': 'absolute_error', 'min_samples_split': 6, 'min_samples_leaf': 2, 'min_weight_fraction_leaf': 0.01728490738101294, 'min_impurity_decrease': 0.045802580716598026, 'max_features': 0.5381688504474108, 'subsample': 0.09430022474639012, 'dropout_rate': 0.2894081472324445, 'ccp_alpha': 3.2609632947377643}. Best is trial 66 with value: 0.7386449248380516.[0m
[32m[I 2022-05-07 06:04:15,377][0m Trial 75 finished with value: 0.5 and parameters: {'loss': 'coxph', 'learning_rate': 0.026950489684816514, 'n_estimators': 429, 'criterion': 'squared_error', 'min_samples_split': 8, 'min_samples_leaf': 3, 'min_weight_fraction_leaf': 0.3441132280333583, 'min_impurity_decrease': 0.7856267733803924, 'max_features': 0.6404820661988092, 'subsample': 0.9143901855792282, 'dropout_rate': 0.7308187190089384, 'ccp_alpha': 0.6943203935133926}. Best is trial 66 with value: 0.7386449248380516.[0m
[32m[I 2022-05-07 06:08:16,934][0m Trial 76 finished with value: 0.6137256357891866 and parameters: {'loss': 'coxph', 'learning_rate': 2.2014322709131942e-05, 'n_estimators': 114, 'criterion': 'friedman_mse', 'min_samples_split': 2, 'min_samples_leaf': 3, 'min_weight_fraction_leaf': 0.4808791896420587, 'min_impurity_decrease': 0.7391474451497931, 'max_features': 0.673752026608343, 'subsample': 0.9920972035255144, 'dropout_rate': 0.9391369339653268, 'ccp_alpha': 0.20675823923796122}. Best is trial 66 with value: 0.7386449248380516.[0m
[32m[I 2022-05-07 06:21:28,707][0m Trial 77 finished with value: 0.5 and parameters: {'loss': 'coxph', 'learning_rate': 2.0180190381511127e-05, 'n_estimators': 373, 'criterion': 'squared_error', 'min_samples_split': 2, 'min_samples_leaf': 5, 'min_weight_fraction_leaf': 0.17429325342869267, 'min_impurity_decrease': 0.8251198440432915, 'max_features': 0.14453635220006167, 'subsample': 0.9987829097351874, 'dropout_rate': 0.9738543134131862, 'ccp_alpha': 2.914385838695748}. Best is trial 66 with value: 0.7386449248380516.[0m
[32m[I 2022-05-07 06:27:02,165][0m Trial 78 finished with value: 0.5 and parameters: {'loss': 'coxph', 'learning_rate': 0.00020425202575822, 'n_estimators': 122, 'criterion': 'absolute_error', 'min_samples_split': 9, 'min_samples_leaf': 6, 'min_weight_fraction_leaf': 0.37515109639112254, 'min_impurity_decrease': 0.3305221575779289, 'max_features': 0.6814556733456497, 'subsample': 0.6057083997637145, 'dropout_rate': 0.6603181674351775, 'ccp_alpha': 0.5581294944732189}. Best is trial 66 with value: 0.7386449248380516.[0m
[32m[I 2022-05-07 06:47:12,694][0m Trial 79 finished with value: 0.5 and parameters: {'loss': 'coxph', 'learning_rate': 4.567846068982327e-06, 'n_estimators': 550, 'criterion': 'squared_error', 'min_samples_split': 2, 'min_samples_leaf': 5, 'min_weight_fraction_leaf': 0.39256440298812056, 'min_impurity_decrease': 0.7598915647526185, 'max_features': 0.6013412784489822, 'subsample': 0.9851404039255125, 'dropout_rate': 0.774699248101902, 'ccp_alpha': 0.032645143319433995}. Best is trial 66 with value: 0.7386449248380516.[0m
[32m[I 2022-05-07 07:16:59,325][0m Trial 80 finished with value: 0.5 and parameters: {'loss': 'coxph', 'learning_rate': 2.3128031936577836e-05, 'n_estimators': 853, 'criterion': 'friedman_mse', 'min_samples_split': 10, 'min_samples_leaf': 5, 'min_weight_fraction_leaf': 0.4782049002035586, 'min_impurity_decrease': 0.6477249531859433, 'max_features': 0.057093451884093024, 'subsample': 0.9421652275720389, 'dropout_rate': 0.8922987917156279, 'ccp_alpha': 0.30379435082350303}. Best is trial 66 with value: 0.7386449248380516.[0m
[32m[I 2022-05-07 07:22:35,745][0m Trial 81 finished with value: 0.5 and parameters: {'loss': 'coxph', 'learning_rate': 0.002558674501317276, 'n_estimators': 115, 'criterion': 'absolute_error', 'min_samples_split': 7, 'min_samples_leaf': 7, 'min_weight_fraction_leaf': 0.3858192188184985, 'min_impurity_decrease': 0.16771647864347833, 'max_features': 0.6976202658346421, 'subsample': 0.6574352435241045, 'dropout_rate': 0.10267746845636518, 'ccp_alpha': 1.884521468851409}. Best is trial 66 with value: 0.7386449248380516.[0m
[32m[I 2022-05-07 07:28:55,730][0m Trial 82 finished with value: 0.5 and parameters: {'loss': 'coxph', 'learning_rate': 6.360686799433666e-05, 'n_estimators': 197, 'criterion': 'friedman_mse', 'min_samples_split': 9, 'min_samples_leaf': 8, 'min_weight_fraction_leaf': 0.30668901742068855, 'min_impurity_decrease': 0.12461792397087237, 'max_features': 0.7447927786721675, 'subsample': 0.5372566624374632, 'dropout_rate': 0.573831788825372, 'ccp_alpha': 0.5554086481578377}. Best is trial 66 with value: 0.7386449248380516.[0m
[32m[I 2022-05-07 07:36:24,882][0m Trial 83 finished with value: 0.5 and parameters: {'loss': 'coxph', 'learning_rate': 5.594220129065837e-05, 'n_estimators': 235, 'criterion': 'friedman_mse', 'min_samples_split': 9, 'min_samples_leaf': 8, 'min_weight_fraction_leaf': 0.32488616883444216, 'min_impurity_decrease': 0.3515293250477942, 'max_features': 0.7906588638802977, 'subsample': 0.6247906648067495, 'dropout_rate': 0.4929499487336438, 'ccp_alpha': 1.0939520185028553}. Best is trial 66 with value: 0.7386449248380516.[0m
[32m[I 2022-05-07 07:41:11,482][0m Trial 84 finished with value: 0.5 and parameters: {'loss': 'coxph', 'learning_rate': 1.0223657817075605e-05, 'n_estimators': 145, 'criterion': 'friedman_mse', 'min_samples_split': 7, 'min_samples_leaf': 8, 'min_weight_fraction_leaf': 0.45562184216429674, 'min_impurity_decrease': 0.5462161384995702, 'max_features': 0.919566621941146, 'subsample': 0.8622309602739228, 'dropout_rate': 0.5657364701087579, 'ccp_alpha': 0.5354103272116282}. Best is trial 66 with value: 0.7386449248380516.[0m
[32m[I 2022-05-07 08:03:12,035][0m Trial 85 finished with value: 0.5 and parameters: {'loss': 'coxph', 'learning_rate': 0.009325200834209383, 'n_estimators': 480, 'criterion': 'absolute_error', 'min_samples_split': 2, 'min_samples_leaf': 3, 'min_weight_fraction_leaf': 0.2740265548935077, 'min_impurity_decrease': 0.03589294948743724, 'max_features': 0.08220285519660302, 'subsample': 0.08395338383646644, 'dropout_rate': 0.9896355672934544, 'ccp_alpha': 2.280595987222412}. Best is trial 66 with value: 0.7386449248380516.[0m
[32m[I 2022-05-07 08:07:21,376][0m Trial 86 finished with value: 0.5 and parameters: {'loss': 'coxph', 'learning_rate': 0.0006339504044212123, 'n_estimators': 133, 'criterion': 'friedman_mse', 'min_samples_split': 8, 'min_samples_leaf': 9, 'min_weight_fraction_leaf': 0.4623008541124673, 'min_impurity_decrease': 0.5704267932311006, 'max_features': 0.7246363371966947, 'subsample': 0.736935262667285, 'dropout_rate': 0.5409457641950375, 'ccp_alpha': 1.5589355794122866}. Best is trial 66 with value: 0.7386449248380516.[0m
[32m[I 2022-05-07 08:11:19,642][0m Trial 87 finished with value: 0.5 and parameters: {'loss': 'coxph', 'learning_rate': 2.5974259291391027e-05, 'n_estimators': 126, 'criterion': 'friedman_mse', 'min_samples_split': 8, 'min_samples_leaf': 9, 'min_weight_fraction_leaf': 0.41685811153215757, 'min_impurity_decrease': 0.5166775847820669, 'max_features': 0.7111657590741565, 'subsample': 0.7934411500679938, 'dropout_rate': 0.688488158008093, 'ccp_alpha': 0.8088235660800321}. Best is trial 66 with value: 0.7386449248380516.[0m
/media/san2_ssd/data/Workdir/survival/venv/lib/python3.8/site-packages/sksurv/ensemble/boosting.py:955: RuntimeWarning: divide by zero encountered in log
  time = numpy.log(time)
/media/san2_ssd/data/Workdir/survival/venv/lib/python3.8/site-packages/sksurv/ensemble/boosting.py:955: RuntimeWarning: divide by zero encountered in log
  time = numpy.log(time)
/media/san2_ssd/data/Workdir/survival/venv/lib/python3.8/site-packages/sksurv/ensemble/boosting.py:955: RuntimeWarning: divide by zero encountered in log
  time = numpy.log(time)
/media/san2_ssd/data/Workdir/survival/venv/lib/python3.8/site-packages/sksurv/ensemble/boosting.py:955: RuntimeWarning: divide by zero encountered in log
  time = numpy.log(time)
/media/san2_ssd/data/Workdir/survival/venv/lib/python3.8/site-packages/sksurv/ensemble/boosting.py:955: RuntimeWarning: divide by zero encountered in log
  time = numpy.log(time)
[32m[I 2022-05-07 08:11:19,687][0m Trial 88 finished with value: -1.0 and parameters: {'loss': 'squared', 'learning_rate': 0.0006099499657340835, 'n_estimators': 743, 'criterion': 'friedman_mse', 'min_samples_split': 7, 'min_samples_leaf': 4, 'min_weight_fraction_leaf': 0.44801045590542676, 'min_impurity_decrease': 0.6181163297828002, 'max_features': 0.41568088557978194, 'subsample': 0.8824486975172292, 'dropout_rate': 0.0711785767489718, 'ccp_alpha': 0.16719388527476509}. Best is trial 66 with value: 0.7386449248380516.[0m
[32m[I 2022-05-07 08:17:42,621][0m Trial 89 finished with value: 0.5 and parameters: {'loss': 'coxph', 'learning_rate': 0.0003073674808145002, 'n_estimators': 141, 'criterion': 'absolute_error', 'min_samples_split': 6, 'min_samples_leaf': 2, 'min_weight_fraction_leaf': 0.00813075843606339, 'min_impurity_decrease': 0.45387824383759934, 'max_features': 0.5939609372911137, 'subsample': 0.1047836429619449, 'dropout_rate': 0.9677216722155149, 'ccp_alpha': 2.570654915525483}. Best is trial 66 with value: 0.7386449248380516.[0m
[32m[I 2022-05-07 08:41:23,549][0m Trial 90 finished with value: 0.5 and parameters: {'loss': 'coxph', 'learning_rate': 0.0004988849180658429, 'n_estimators': 707, 'criterion': 'friedman_mse', 'min_samples_split': 7, 'min_samples_leaf': 4, 'min_weight_fraction_leaf': 0.49708359680615655, 'min_impurity_decrease': 0.6865486235626935, 'max_features': 0.37511598682206126, 'subsample': 0.899874397701568, 'dropout_rate': 0.9262979526090869, 'ccp_alpha': 0.3510374674838872}. Best is trial 66 with value: 0.7386449248380516.[0m
[32m[I 2022-05-07 09:00:59,212][0m Trial 91 finished with value: 0.5 and parameters: {'loss': 'coxph', 'learning_rate': 0.0003675095107565548, 'n_estimators': 620, 'criterion': 'friedman_mse', 'min_samples_split': 8, 'min_samples_leaf': 10, 'min_weight_fraction_leaf': 0.36705489272728675, 'min_impurity_decrease': 0.7265487582589649, 'max_features': 0.41872385847311466, 'subsample': 0.7344101838341975, 'dropout_rate': 0.8520309501995015, 'ccp_alpha': 4.705674121013126}. Best is trial 66 with value: 0.7386449248380516.[0m
[32m[I 2022-05-07 09:04:27,214][0m Trial 92 finished with value: 0.5 and parameters: {'loss': 'coxph', 'learning_rate': 0.00018268298894331055, 'n_estimators': 110, 'criterion': 'friedman_mse', 'min_samples_split': 8, 'min_samples_leaf': 3, 'min_weight_fraction_leaf': 0.4277523076566769, 'min_impurity_decrease': 0.6860853258000903, 'max_features': 0.5623031623067923, 'subsample': 0.8315968966681674, 'dropout_rate': 0.936383644350251, 'ccp_alpha': 0.2370474404261088}. Best is trial 66 with value: 0.7386449248380516.[0m
[32m[I 2022-05-07 09:12:57,695][0m Trial 93 finished with value: 0.5 and parameters: {'loss': 'coxph', 'learning_rate': 0.00016292740559936718, 'n_estimators': 187, 'criterion': 'absolute_error', 'min_samples_split': 9, 'min_samples_leaf': 7, 'min_weight_fraction_leaf': 0.2510131454525547, 'min_impurity_decrease': 0.47765407317199826, 'max_features': 0.7909962153211962, 'subsample': 0.5509177923107218, 'dropout_rate': 0.9456533117419244, 'ccp_alpha': 0.6851030844801411}. Best is trial 66 with value: 0.7386449248380516.[0m
[32m[I 2022-05-07 09:21:29,272][0m Trial 94 finished with value: 0.5 and parameters: {'loss': 'coxph', 'learning_rate': 0.00016560015402471883, 'n_estimators': 187, 'criterion': 'absolute_error', 'min_samples_split': 9, 'min_samples_leaf': 7, 'min_weight_fraction_leaf': 0.25260481136528395, 'min_impurity_decrease': 0.4847450821362301, 'max_features': 0.8035254799877501, 'subsample': 0.5339784953725739, 'dropout_rate': 0.6246834535193642, 'ccp_alpha': 1.1874752602007865}. Best is trial 66 with value: 0.7386449248380516.[0m
[32m[I 2022-05-07 09:46:47,719][0m Trial 95 finished with value: 0.5 and parameters: {'loss': 'coxph', 'learning_rate': 1.4818573727770393e-05, 'n_estimators': 755, 'criterion': 'friedman_mse', 'min_samples_split': 8, 'min_samples_leaf': 4, 'min_weight_fraction_leaf': 0.4277688502549626, 'min_impurity_decrease': 0.28535090697939786, 'max_features': 0.6289665559940116, 'subsample': 0.8737794126657205, 'dropout_rate': 0.8808187424699359, 'ccp_alpha': 4.961837235507064}. Best is trial 66 with value: 0.7386449248380516.[0m
[32m[I 2022-05-07 09:50:11,801][0m Trial 96 finished with value: 0.6949676240296154 and parameters: {'loss': 'coxph', 'learning_rate': 0.00036566889349278945, 'n_estimators': 102, 'criterion': 'friedman_mse', 'min_samples_split': 8, 'min_samples_leaf': 3, 'min_weight_fraction_leaf': 0.4857430116646, 'min_impurity_decrease': 0.25589301796581065, 'max_features': 0.6590631956096545, 'subsample': 0.9181316616038085, 'dropout_rate': 0.9138850944354324, 'ccp_alpha': 0.19220282399416855}. Best is trial 66 with value: 0.7386449248380516.[0m
[32m[I 2022-05-07 09:53:43,857][0m Trial 97 finished with value: 0.5 and parameters: {'loss': 'coxph', 'learning_rate': 0.00011883563690063519, 'n_estimators': 105, 'criterion': 'friedman_mse', 'min_samples_split': 8, 'min_samples_leaf': 3, 'min_weight_fraction_leaf': 0.4834732278108118, 'min_impurity_decrease': 0.23575237851033798, 'max_features': 0.6638691308210753, 'subsample': 0.9253456479344143, 'dropout_rate': 0.8228050087788891, 'ccp_alpha': 0.23601073435008688}. Best is trial 66 with value: 0.7386449248380516.[0m
[32m[I 2022-05-07 10:27:44,664][0m Trial 98 finished with value: 0.6949753977621199 and parameters: {'loss': 'coxph', 'learning_rate': 0.00025027139363278136, 'n_estimators': 965, 'criterion': 'friedman_mse', 'min_samples_split': 10, 'min_samples_leaf': 3, 'min_weight_fraction_leaf': 0.4703604507558193, 'min_impurity_decrease': 0.6376287406341096, 'max_features': 0.5774621762300772, 'subsample': 0.9516495094400312, 'dropout_rate': 0.9258549943431128, 'ccp_alpha': 0.034090850720887064}. Best is trial 66 with value: 0.7386449248380516.[0m
[32m[I 2022-05-07 11:02:40,992][0m Trial 99 finished with value: 0.7124542399630291 and parameters: {'loss': 'coxph', 'learning_rate': 8.366130346571546e-05, 'n_estimators': 980, 'criterion': 'friedman_mse', 'min_samples_split': 10, 'min_samples_leaf': 3, 'min_weight_fraction_leaf': 0.47245461962392815, 'min_impurity_decrease': 0.622943709601917, 'max_features': 0.5833905690233208, 'subsample': 0.952939362786013, 'dropout_rate': 0.9073775463701251, 'ccp_alpha': 0.017639283335980138}. Best is trial 66 with value: 0.7386449248380516.[0m
