[32m[I 2022-04-21 20:14:24,233][0m Trial 51 finished with value: 0.6392963059025613 and parameters: {'n_hidden': 2048, 'mixture_components': 8, 'use_sparse_layer': False, 'use_batchnorm': False, 'use_dropout': False, 'mlp_size_1': 5, 'mlp_size_2': 3, 'mlp_size_3': 0, 'kernel': 'LogLogistic', 'loss_name': 'AlternativeNLLLoss'}. Best is trial 49 with value: 0.9262536277993192.[0m
[32m[I 2022-04-21 20:22:08,402][0m Trial 52 finished with value: 0.9241553311053698 and parameters: {'n_hidden': 2048, 'mixture_components': 9, 'use_sparse_layer': False, 'use_batchnorm': False, 'use_dropout': False, 'mlp_size_1': 4, 'mlp_size_2': 3, 'mlp_size_3': 0, 'kernel': 'LogLogistic', 'loss_name': 'AlternativeNLLLoss'}. Best is trial 49 with value: 0.9262536277993192.[0m
[32m[I 2022-04-21 20:30:01,756][0m Trial 53 finished with value: 0.9238848541539365 and parameters: {'n_hidden': 2048, 'mixture_components': 10, 'use_sparse_layer': False, 'use_batchnorm': False, 'use_dropout': False, 'mlp_size_1': 5, 'mlp_size_2': 3, 'mlp_size_3': 0, 'kernel': 'LogLogistic', 'loss_name': 'AlternativeNLLLoss'}. Best is trial 49 with value: 0.9262536277993192.[0m
[32m[I 2022-04-21 20:39:47,418][0m Trial 54 finished with value: 0.924943362605849 and parameters: {'n_hidden': 2048, 'mixture_components': 8, 'use_sparse_layer': False, 'use_batchnorm': False, 'use_dropout': False, 'mlp_size_1': 6, 'mlp_size_2': 2, 'mlp_size_3': 0, 'kernel': 'LogLogistic', 'loss_name': 'AlternativeNLLLoss'}. Best is trial 49 with value: 0.9262536277993192.[0m
[32m[I 2022-04-21 20:49:21,582][0m Trial 55 finished with value: 0.8715020042585447 and parameters: {'n_hidden': 2048, 'mixture_components': 8, 'use_sparse_layer': False, 'use_batchnorm': False, 'use_dropout': False, 'mlp_size_1': 6, 'mlp_size_2': 2, 'mlp_size_3': 0, 'kernel': 'LogLogistic', 'loss_name': 'AlternativeNLLLoss'}. Best is trial 49 with value: 0.9262536277993192.[0m
[32m[I 2022-04-21 21:01:24,814][0m Trial 56 finished with value: 0.9267746932835493 and parameters: {'n_hidden': 2048, 'mixture_components': 7, 'use_sparse_layer': False, 'use_batchnorm': False, 'use_dropout': False, 'mlp_size_1': 6, 'mlp_size_2': 2, 'mlp_size_3': 0, 'kernel': 'Normal', 'loss_name': 'AlternativeNLLLoss'}. Best is trial 56 with value: 0.9267746932835493.[0m
[32m[I 2022-04-21 21:11:23,051][0m Trial 57 finished with value: 0.9269497638144524 and parameters: {'n_hidden': 1024, 'mixture_components': 7, 'use_sparse_layer': False, 'use_batchnorm': False, 'use_dropout': False, 'mlp_size_1': 6, 'mlp_size_2': 1, 'mlp_size_3': 0, 'kernel': 'Normal', 'loss_name': 'AlternativeNLLLoss'}. Best is trial 57 with value: 0.9269497638144524.[0m
[32m[I 2022-04-21 21:29:57,204][0m Trial 58 finished with value: 0.7196694936626604 and parameters: {'n_hidden': 1024, 'mixture_components': 6, 'use_sparse_layer': False, 'use_batchnorm': True, 'use_dropout': False, 'mlp_size_1': 6, 'mlp_size_2': 1, 'mlp_size_3': 0, 'kernel': 'Normal', 'loss_name': 'AlternativeNLLLoss'}. Best is trial 57 with value: 0.9269497638144524.[0m
[32m[I 2022-04-21 21:40:42,015][0m Trial 59 finished with value: 0.8215060798649721 and parameters: {'n_hidden': 1024, 'mixture_components': 7, 'use_sparse_layer': False, 'use_batchnorm': False, 'use_dropout': False, 'mlp_size_1': 7, 'mlp_size_2': 0, 'mlp_size_3': 0, 'kernel': 'Normal', 'loss_name': 'AlternativeNLLLoss'}. Best is trial 57 with value: 0.9269497638144524.[0m
[32m[I 2022-04-21 21:50:50,264][0m Trial 60 finished with value: 0.9265623823778751 and parameters: {'n_hidden': 1024, 'mixture_components': 7, 'use_sparse_layer': False, 'use_batchnorm': False, 'use_dropout': False, 'mlp_size_1': 6, 'mlp_size_2': 1, 'mlp_size_3': 0, 'kernel': 'Normal', 'loss_name': 'AlternativeNLLLoss'}. Best is trial 57 with value: 0.9269497638144524.[0m
[32m[I 2022-04-21 21:59:22,894][0m Trial 61 finished with value: 0.9261304519468861 and parameters: {'n_hidden': 1024, 'mixture_components': 6, 'use_sparse_layer': False, 'use_batchnorm': False, 'use_dropout': False, 'mlp_size_1': 6, 'mlp_size_2': 1, 'mlp_size_3': 0, 'kernel': 'Normal', 'loss_name': 'AlternativeNLLLoss'}. Best is trial 57 with value: 0.9269497638144524.[0m
[32m[I 2022-04-21 22:09:39,945][0m Trial 62 finished with value: 0.9264212529795672 and parameters: {'n_hidden': 1024, 'mixture_components': 7, 'use_sparse_layer': False, 'use_batchnorm': False, 'use_dropout': False, 'mlp_size_1': 6, 'mlp_size_2': 1, 'mlp_size_3': 0, 'kernel': 'Normal', 'loss_name': 'AlternativeNLLLoss'}. Best is trial 57 with value: 0.9269497638144524.[0m
[32m[I 2022-04-21 22:18:39,107][0m Trial 63 finished with value: 0.9218009866791043 and parameters: {'n_hidden': 1024, 'mixture_components': 6, 'use_sparse_layer': False, 'use_batchnorm': False, 'use_dropout': False, 'mlp_size_1': 6, 'mlp_size_2': 1, 'mlp_size_3': 0, 'kernel': 'Normal', 'loss_name': 'AlternativeNLLLoss'}. Best is trial 57 with value: 0.9269497638144524.[0m
[32m[I 2022-04-21 22:27:07,523][0m Trial 64 finished with value: 0.9236597673547446 and parameters: {'n_hidden': 1024, 'mixture_components': 7, 'use_sparse_layer': False, 'use_batchnorm': False, 'use_dropout': False, 'mlp_size_1': 6, 'mlp_size_2': 1, 'mlp_size_3': 0, 'kernel': 'Normal', 'loss_name': 'AlternativeNLLLoss'}. Best is trial 57 with value: 0.9269497638144524.[0m
[32m[I 2022-04-21 22:37:35,063][0m Trial 65 finished with value: 0.8181841336220879 and parameters: {'n_hidden': 1024, 'mixture_components': 6, 'use_sparse_layer': False, 'use_batchnorm': False, 'use_dropout': False, 'mlp_size_1': 7, 'mlp_size_2': 0, 'mlp_size_3': 0, 'kernel': 'Normal', 'loss_name': 'AlternativeNLLLoss'}. Best is trial 57 with value: 0.9269497638144524.[0m
[32m[I 2022-04-21 22:47:00,609][0m Trial 66 finished with value: 0.9226619536515244 and parameters: {'n_hidden': 1024, 'mixture_components': 7, 'use_sparse_layer': False, 'use_batchnorm': False, 'use_dropout': False, 'mlp_size_1': 6, 'mlp_size_2': 1, 'mlp_size_3': 0, 'kernel': 'Normal', 'loss_name': 'AlternativeNLLLoss'}. Best is trial 57 with value: 0.9269497638144524.[0m
[32m[I 2022-04-21 22:56:44,907][0m Trial 67 finished with value: 0.9264417741680037 and parameters: {'n_hidden': 1024, 'mixture_components': 7, 'use_sparse_layer': False, 'use_batchnorm': False, 'use_dropout': False, 'mlp_size_1': 5, 'mlp_size_2': 2, 'mlp_size_3': 0, 'kernel': 'Normal', 'loss_name': 'AlternativeNLLLoss'}. Best is trial 57 with value: 0.9269497638144524.[0m
[32m[I 2022-04-21 23:05:53,871][0m Trial 68 finished with value: 0.9268909802174468 and parameters: {'n_hidden': 1024, 'mixture_components': 7, 'use_sparse_layer': False, 'use_batchnorm': False, 'use_dropout': False, 'mlp_size_1': 5, 'mlp_size_2': 2, 'mlp_size_3': 0, 'kernel': 'Normal', 'loss_name': 'AlternativeNLLLoss'}. Best is trial 57 with value: 0.9269497638144524.[0m
[32m[I 2022-04-21 23:22:34,942][0m Trial 69 finished with value: 0.8119083549136408 and parameters: {'n_hidden': 1024, 'mixture_components': 7, 'use_sparse_layer': False, 'use_batchnorm': True, 'use_dropout': False, 'mlp_size_1': 5, 'mlp_size_2': 2, 'mlp_size_3': 0, 'kernel': 'Normal', 'loss_name': 'AlternativeNLLLoss'}. Best is trial 57 with value: 0.9269497638144524.[0m
[32m[I 2022-04-21 23:30:58,048][0m Trial 70 finished with value: 0.9264422975996348 and parameters: {'n_hidden': 1024, 'mixture_components': 7, 'use_sparse_layer': False, 'use_batchnorm': False, 'use_dropout': False, 'mlp_size_1': 5, 'mlp_size_2': 2, 'mlp_size_3': 0, 'kernel': 'Normal', 'loss_name': 'AlternativeNLLLoss'}. Best is trial 57 with value: 0.9269497638144524.[0m
[32m[I 2022-04-21 23:40:03,181][0m Trial 71 finished with value: 0.9260639087761003 and parameters: {'n_hidden': 1024, 'mixture_components': 7, 'use_sparse_layer': False, 'use_batchnorm': False, 'use_dropout': False, 'mlp_size_1': 5, 'mlp_size_2': 2, 'mlp_size_3': 0, 'kernel': 'Normal', 'loss_name': 'AlternativeNLLLoss'}. Best is trial 57 with value: 0.9269497638144524.[0m
[32m[I 2022-04-21 23:48:54,874][0m Trial 72 finished with value: 0.9266652785520829 and parameters: {'n_hidden': 1024, 'mixture_components': 7, 'use_sparse_layer': False, 'use_batchnorm': False, 'use_dropout': False, 'mlp_size_1': 5, 'mlp_size_2': 2, 'mlp_size_3': 0, 'kernel': 'Normal', 'loss_name': 'AlternativeNLLLoss'}. Best is trial 57 with value: 0.9269497638144524.[0m
[32m[I 2022-04-21 23:57:33,844][0m Trial 73 finished with value: 0.9252885741279094 and parameters: {'n_hidden': 1024, 'mixture_components': 6, 'use_sparse_layer': False, 'use_batchnorm': False, 'use_dropout': False, 'mlp_size_1': 5, 'mlp_size_2': 2, 'mlp_size_3': 0, 'kernel': 'Normal', 'loss_name': 'AlternativeNLLLoss'}. Best is trial 57 with value: 0.9269497638144524.[0m
[32m[I 2022-04-22 00:07:16,427][0m Trial 74 finished with value: 0.9263203806927274 and parameters: {'n_hidden': 1024, 'mixture_components': 5, 'use_sparse_layer': False, 'use_batchnorm': False, 'use_dropout': False, 'mlp_size_1': 5, 'mlp_size_2': 2, 'mlp_size_3': 0, 'kernel': 'Normal', 'loss_name': 'AlternativeNLLLoss'}. Best is trial 57 with value: 0.9269497638144524.[0m
[32m[I 2022-04-22 00:15:45,747][0m Trial 75 finished with value: 0.9111268703959524 and parameters: {'n_hidden': 1024, 'mixture_components': 7, 'use_sparse_layer': False, 'use_batchnorm': False, 'use_dropout': False, 'mlp_size_1': 5, 'mlp_size_2': 2, 'mlp_size_3': 0, 'kernel': 'Normal', 'loss_name': 'AlternativeNLLLoss'}. Best is trial 57 with value: 0.9269497638144524.[0m
[32m[I 2022-04-22 00:25:41,824][0m Trial 76 finished with value: 0.926142366875313 and parameters: {'n_hidden': 1024, 'mixture_components': 7, 'use_sparse_layer': False, 'use_batchnorm': False, 'use_dropout': False, 'mlp_size_1': 6, 'mlp_size_2': 1, 'mlp_size_3': 0, 'kernel': 'Normal', 'loss_name': 'AlternativeNLLLoss'}. Best is trial 57 with value: 0.9269497638144524.[0m
[32m[I 2022-04-22 00:35:17,867][0m Trial 77 finished with value: 0.8202802894824804 and parameters: {'n_hidden': 1024, 'mixture_components': 8, 'use_sparse_layer': False, 'use_batchnorm': False, 'use_dropout': False, 'mlp_size_1': 7, 'mlp_size_2': 0, 'mlp_size_3': 0, 'kernel': 'Normal', 'loss_name': 'AlternativeNLLLoss'}. Best is trial 57 with value: 0.9269497638144524.[0m
[32m[I 2022-04-22 00:46:14,978][0m Trial 78 finished with value: 0.9269261897470094 and parameters: {'n_hidden': 512, 'mixture_components': 6, 'use_sparse_layer': False, 'use_batchnorm': False, 'use_dropout': False, 'mlp_size_1': 5, 'mlp_size_2': 1, 'mlp_size_3': 0, 'kernel': 'Normal', 'loss_name': 'AlternativeNLLLoss'}. Best is trial 57 with value: 0.9269497638144524.[0m
[32m[I 2022-04-22 00:55:37,154][0m Trial 79 finished with value: 0.8152820882515284 and parameters: {'n_hidden': 512, 'mixture_components': 6, 'use_sparse_layer': False, 'use_batchnorm': False, 'use_dropout': False, 'mlp_size_1': 5, 'mlp_size_2': 1, 'mlp_size_3': 0, 'kernel': 'Normal', 'loss_name': 'AlternativeNLLLoss'}. Best is trial 57 with value: 0.9269497638144524.[0m
[32m[I 2022-04-22 01:07:22,777][0m Trial 80 finished with value: 0.9253191272665576 and parameters: {'n_hidden': 512, 'mixture_components': 6, 'use_sparse_layer': False, 'use_batchnorm': False, 'use_dropout': False, 'mlp_size_1': 5, 'mlp_size_2': 1, 'mlp_size_3': 0, 'kernel': 'Normal', 'loss_name': 'AlternativeNLLLoss'}. Best is trial 57 with value: 0.9269497638144524.[0m
[32m[I 2022-04-22 01:18:47,851][0m Trial 81 finished with value: 0.9264962552522853 and parameters: {'n_hidden': 512, 'mixture_components': 7, 'use_sparse_layer': False, 'use_batchnorm': False, 'use_dropout': False, 'mlp_size_1': 5, 'mlp_size_2': 1, 'mlp_size_3': 0, 'kernel': 'Normal', 'loss_name': 'AlternativeNLLLoss'}. Best is trial 57 with value: 0.9269497638144524.[0m
[32m[I 2022-04-22 01:29:27,718][0m Trial 82 finished with value: 0.9256692842206597 and parameters: {'n_hidden': 512, 'mixture_components': 7, 'use_sparse_layer': False, 'use_batchnorm': False, 'use_dropout': False, 'mlp_size_1': 5, 'mlp_size_2': 1, 'mlp_size_3': 0, 'kernel': 'Normal', 'loss_name': 'AlternativeNLLLoss'}. Best is trial 57 with value: 0.9269497638144524.[0m
[32m[I 2022-04-22 01:37:08,846][0m Trial 83 finished with value: 0.9152333480700786 and parameters: {'n_hidden': 512, 'mixture_components': 7, 'use_sparse_layer': False, 'use_batchnorm': False, 'use_dropout': False, 'mlp_size_1': 5, 'mlp_size_2': 1, 'mlp_size_3': 0, 'kernel': 'Normal', 'loss_name': 'NLLLoss'}. Best is trial 57 with value: 0.9269497638144524.[0m
[32m[I 2022-04-22 01:46:27,639][0m Trial 84 finished with value: 0.9263415323458399 and parameters: {'n_hidden': 512, 'mixture_components': 8, 'use_sparse_layer': False, 'use_batchnorm': False, 'use_dropout': False, 'mlp_size_1': 4, 'mlp_size_2': 2, 'mlp_size_3': 0, 'kernel': 'Normal', 'loss_name': 'AlternativeNLLLoss'}. Best is trial 57 with value: 0.9269497638144524.[0m
[32m[I 2022-04-22 02:02:03,575][0m Trial 85 finished with value: 0.9236908902945433 and parameters: {'n_hidden': 64, 'mixture_components': 6, 'use_sparse_layer': False, 'use_batchnorm': False, 'use_dropout': False, 'mlp_size_1': 3, 'mlp_size_2': 0, 'mlp_size_3': 0, 'kernel': 'Normal', 'loss_name': 'AlternativeNLLLoss'}. Best is trial 57 with value: 0.9269497638144524.[0m
[32m[I 2022-04-22 02:15:31,692][0m Trial 86 finished with value: 0.8238810516926989 and parameters: {'n_hidden': 256, 'mixture_components': 7, 'use_sparse_layer': False, 'use_batchnorm': True, 'use_dropout': False, 'mlp_size_1': 5, 'mlp_size_2': 0, 'mlp_size_3': 0, 'kernel': 'Normal', 'loss_name': 'AlternativeNLLLoss'}. Best is trial 57 with value: 0.9269497638144524.[0m
[32m[I 2022-04-22 02:26:20,254][0m Trial 87 finished with value: 0.9255034861211733 and parameters: {'n_hidden': 512, 'mixture_components': 6, 'use_sparse_layer': False, 'use_batchnorm': False, 'use_dropout': False, 'mlp_size_1': 5, 'mlp_size_2': 1, 'mlp_size_3': 0, 'kernel': 'Normal', 'loss_name': 'AlternativeNLLLoss'}. Best is trial 57 with value: 0.9269497638144524.[0m
[32m[I 2022-04-22 02:32:55,230][0m Trial 88 finished with value: 0.41243581957549524 and parameters: {'n_hidden': 1024, 'mixture_components': 5, 'use_sparse_layer': False, 'use_batchnorm': False, 'use_dropout': True, 'dropout': 0.8072221138760056, 'mlp_size_1': 6, 'mlp_size_2': 1, 'mlp_size_3': 0, 'kernel': 'Normal', 'loss_name': 'AlternativeNLLLoss'}. Best is trial 57 with value: 0.9269497638144524.[0m
[32m[I 2022-04-22 02:43:08,983][0m Trial 89 finished with value: 0.9255579935948981 and parameters: {'n_hidden': 1024, 'mixture_components': 8, 'use_sparse_layer': False, 'use_batchnorm': False, 'use_dropout': False, 'mlp_size_1': 4, 'mlp_size_2': 2, 'mlp_size_3': 1, 'kernel': 'Normal', 'loss_name': 'AlternativeNLLLoss'}. Best is trial 57 with value: 0.9269497638144524.[0m
[32m[I 2022-04-22 02:46:51,875][0m Trial 90 finished with value: 0.8912267194475095 and parameters: {'n_hidden': 512, 'mixture_components': 7, 'use_sparse_layer': False, 'use_batchnorm': False, 'use_dropout': False, 'mlp_size_1': 5, 'mlp_size_2': 1, 'mlp_size_3': 0, 'kernel': 'Exponential', 'loss_name': 'NLLLoss'}. Best is trial 57 with value: 0.9269497638144524.[0m
[32m[I 2022-04-22 02:56:09,847][0m Trial 91 finished with value: 0.9240925849415103 and parameters: {'n_hidden': 1024, 'mixture_components': 7, 'use_sparse_layer': False, 'use_batchnorm': False, 'use_dropout': False, 'mlp_size_1': 6, 'mlp_size_2': 1, 'mlp_size_3': 0, 'kernel': 'Normal', 'loss_name': 'AlternativeNLLLoss'}. Best is trial 57 with value: 0.9269497638144524.[0m
[32m[I 2022-04-22 03:04:52,906][0m Trial 92 finished with value: 0.9262107751403466 and parameters: {'n_hidden': 1024, 'mixture_components': 7, 'use_sparse_layer': False, 'use_batchnorm': False, 'use_dropout': False, 'mlp_size_1': 6, 'mlp_size_2': 1, 'mlp_size_3': 0, 'kernel': 'Normal', 'loss_name': 'AlternativeNLLLoss'}. Best is trial 57 with value: 0.9269497638144524.[0m
[32m[I 2022-04-22 03:12:44,243][0m Trial 93 finished with value: 0.9210391844969203 and parameters: {'n_hidden': 1024, 'mixture_components': 7, 'use_sparse_layer': False, 'use_batchnorm': False, 'use_dropout': False, 'mlp_size_1': 6, 'mlp_size_2': 1, 'mlp_size_3': 0, 'kernel': 'Normal', 'loss_name': 'AlternativeNLLLoss'}. Best is trial 57 with value: 0.9269497638144524.[0m
[32m[I 2022-04-22 03:22:45,614][0m Trial 94 finished with value: 0.9262499046727644 and parameters: {'n_hidden': 1024, 'mixture_components': 8, 'use_sparse_layer': False, 'use_batchnorm': False, 'use_dropout': False, 'mlp_size_1': 7, 'mlp_size_2': 0, 'mlp_size_3': 0, 'kernel': 'Normal', 'loss_name': 'AlternativeNLLLoss'}. Best is trial 57 with value: 0.9269497638144524.[0m
[32m[I 2022-04-22 03:36:59,030][0m Trial 95 finished with value: 0.8248077901264453 and parameters: {'n_hidden': 64, 'mixture_components': 6, 'use_sparse_layer': False, 'use_batchnorm': False, 'use_dropout': False, 'mlp_size_1': 3, 'mlp_size_2': 0, 'mlp_size_3': 0, 'kernel': 'Normal', 'loss_name': 'AlternativeNLLLoss'}. Best is trial 57 with value: 0.9269497638144524.[0m
[32m[I 2022-04-22 03:45:52,851][0m Trial 96 finished with value: 0.926198878804725 and parameters: {'n_hidden': 1024, 'mixture_components': 7, 'use_sparse_layer': False, 'use_batchnorm': False, 'use_dropout': False, 'mlp_size_1': 6, 'mlp_size_2': 1, 'mlp_size_3': 0, 'kernel': 'Normal', 'loss_name': 'AlternativeNLLLoss'}. Best is trial 57 with value: 0.9269497638144524.[0m
[32m[I 2022-04-22 03:54:36,476][0m Trial 97 finished with value: 0.9270336422274961 and parameters: {'n_hidden': 1024, 'mixture_components': 8, 'use_sparse_layer': False, 'use_batchnorm': False, 'use_dropout': False, 'mlp_size_1': 5, 'mlp_size_2': 2, 'mlp_size_3': 0, 'kernel': 'Normal', 'loss_name': 'AlternativeNLLLoss'}. Best is trial 97 with value: 0.9270336422274961.[0m
[32m[I 2022-04-22 04:02:59,601][0m Trial 98 finished with value: 0.9259472033908995 and parameters: {'n_hidden': 256, 'mixture_components': 8, 'use_sparse_layer': False, 'use_batchnorm': False, 'use_dropout': False, 'mlp_size_1': 5, 'mlp_size_2': 0, 'mlp_size_3': 0, 'kernel': 'Logistic', 'loss_name': 'AlternativeNLLLoss'}. Best is trial 97 with value: 0.9270336422274961.[0m
[32m[I 2022-04-22 04:09:53,436][0m Trial 99 finished with value: 0.41516470554368246 and parameters: {'n_hidden': 512, 'mixture_components': 8, 'use_sparse_layer': False, 'use_batchnorm': False, 'use_dropout': True, 'dropout': 0.5763134281082432, 'mlp_size_1': 5, 'mlp_size_2': 1, 'mlp_size_3': 0, 'kernel': 'Normal', 'loss_name': 'AlternativeNLLLoss'}. Best is trial 97 with value: 0.9270336422274961.[0m
[32m[I 2022-04-22 04:24:37,367][0m Trial 100 finished with value: 0.8996346461883885 and parameters: {'n_hidden': 1024, 'mixture_components': 6, 'use_sparse_layer': False, 'use_batchnorm': True, 'use_dropout': False, 'mlp_size_1': 4, 'mlp_size_2': 2, 'mlp_size_3': 1, 'kernel': 'Normal', 'loss_name': 'AlternativeNLLLoss'}. Best is trial 97 with value: 0.9270336422274961.[0m
[32m[I 2022-04-22 04:34:04,658][0m Trial 101 finished with value: 0.9251284160899704 and parameters: {'n_hidden': 1024, 'mixture_components': 7, 'use_sparse_layer': False, 'use_batchnorm': False, 'use_dropout': False, 'mlp_size_1': 5, 'mlp_size_2': 2, 'mlp_size_3': 0, 'kernel': 'Normal', 'loss_name': 'AlternativeNLLLoss'}. Best is trial 97 with value: 0.9270336422274961.[0m
[32m[I 2022-04-22 04:43:01,972][0m Trial 102 finished with value: 0.9244981260174512 and parameters: {'n_hidden': 1024, 'mixture_components': 7, 'use_sparse_layer': False, 'use_batchnorm': False, 'use_dropout': False, 'mlp_size_1': 6, 'mlp_size_2': 1, 'mlp_size_3': 0, 'kernel': 'Normal', 'loss_name': 'AlternativeNLLLoss'}. Best is trial 97 with value: 0.9270336422274961.[0m
[32m[I 2022-04-22 04:52:05,726][0m Trial 103 finished with value: 0.9244430080332849 and parameters: {'n_hidden': 1024, 'mixture_components': 7, 'use_sparse_layer': False, 'use_batchnorm': False, 'use_dropout': False, 'mlp_size_1': 6, 'mlp_size_2': 1, 'mlp_size_3': 0, 'kernel': 'Normal', 'loss_name': 'AlternativeNLLLoss'}. Best is trial 97 with value: 0.9270336422274961.[0m
[32m[I 2022-04-22 05:00:28,976][0m Trial 104 finished with value: 0.9255597075645199 and parameters: {'n_hidden': 1024, 'mixture_components': 8, 'use_sparse_layer': False, 'use_batchnorm': False, 'use_dropout': False, 'mlp_size_1': 5, 'mlp_size_2': 2, 'mlp_size_3': 0, 'kernel': 'Normal', 'loss_name': 'AlternativeNLLLoss'}. Best is trial 97 with value: 0.9270336422274961.[0m
[32m[I 2022-04-22 05:04:52,204][0m Trial 105 finished with value: -0.5 and parameters: {'n_hidden': 1024, 'mixture_components': 7, 'use_sparse_layer': False, 'use_batchnorm': False, 'use_dropout': False, 'mlp_size_1': 5, 'mlp_size_2': 2, 'mlp_size_3': 0, 'kernel': 'Exponential', 'loss_name': 'AlternativeNLLLoss'}. Best is trial 97 with value: 0.9270336422274961.[0m
[32m[I 2022-04-22 05:14:40,382][0m Trial 106 finished with value: 0.9249787186603706 and parameters: {'n_hidden': 1024, 'mixture_components': 8, 'use_sparse_layer': False, 'use_batchnorm': False, 'use_dropout': False, 'mlp_size_1': 6, 'mlp_size_2': 1, 'mlp_size_3': 0, 'kernel': 'Normal', 'loss_name': 'AlternativeNLLLoss'}. Best is trial 97 with value: 0.9270336422274961.[0m
[32m[I 2022-04-22 05:22:03,720][0m Trial 107 finished with value: 0.9068691560651658 and parameters: {'n_hidden': 1024, 'mixture_components': 6, 'use_sparse_layer': False, 'use_batchnorm': False, 'use_dropout': False, 'mlp_size_1': 4, 'mlp_size_2': 2, 'mlp_size_3': 0, 'kernel': 'Normal', 'loss_name': 'NLLLoss'}. Best is trial 97 with value: 0.9270336422274961.[0m
