[32m[I 2022-05-18 00:52:21,241][0m Trial 692 finished with value: 0.7691197150206472 and parameters: {'loss': 'coxph', 'learning_rate': 0.017592601007405038, 'n_estimators': 442, 'criterion': 'friedman_mse', 'min_samples_split': 4, 'min_samples_leaf': 5, 'min_weight_fraction_leaf': 0.065649908643208, 'min_impurity_decrease': 0.6605282927414342, 'max_features': 0.6533507338902376, 'subsample': 0.18009097275984068, 'dropout_rate': 0.3266666973285682, 'ccp_alpha': 0.1645785679432964}. Best is trial 632 with value: 0.8548074589601917.[0m
[32m[I 2022-05-18 01:14:41,001][0m Trial 693 finished with value: 0.786771217645246 and parameters: {'loss': 'coxph', 'learning_rate': 0.028450411343294586, 'n_estimators': 496, 'criterion': 'friedman_mse', 'min_samples_split': 4, 'min_samples_leaf': 5, 'min_weight_fraction_leaf': 0.08361614062396049, 'min_impurity_decrease': 0.6756221068126508, 'max_features': 0.6669865906894682, 'subsample': 0.20494305741169877, 'dropout_rate': 0.37340025845803354, 'ccp_alpha': 0.08807209684577759}. Best is trial 632 with value: 0.8548074589601917.[0m
[32m[I 2022-05-18 01:36:00,361][0m Trial 694 finished with value: 0.7624814719031616 and parameters: {'loss': 'coxph', 'learning_rate': 0.022883193967529834, 'n_estimators': 462, 'criterion': 'friedman_mse', 'min_samples_split': 4, 'min_samples_leaf': 5, 'min_weight_fraction_leaf': 0.057795674243061555, 'min_impurity_decrease': 0.6457170289253762, 'max_features': 0.690107818885027, 'subsample': 0.1766618299298313, 'dropout_rate': 0.30634487698796625, 'ccp_alpha': 0.2282051763328254}. Best is trial 632 with value: 0.8548074589601917.[0m
[32m[I 2022-05-18 01:58:36,871][0m Trial 695 finished with value: 0.7897985035658333 and parameters: {'loss': 'coxph', 'learning_rate': 0.003410746002792244, 'n_estimators': 483, 'criterion': 'friedman_mse', 'min_samples_split': 4, 'min_samples_leaf': 5, 'min_weight_fraction_leaf': 0.07756241941424859, 'min_impurity_decrease': 0.942167212567803, 'max_features': 0.6228417254246739, 'subsample': 0.16299323821385067, 'dropout_rate': 0.3538089533242463, 'ccp_alpha': 0.0919897276133903}. Best is trial 632 with value: 0.8548074589601917.[0m
[32m[I 2022-05-18 02:19:23,772][0m Trial 696 finished with value: 0.8456424476611055 and parameters: {'loss': 'coxph', 'learning_rate': 0.012258036718339232, 'n_estimators': 432, 'criterion': 'friedman_mse', 'min_samples_split': 4, 'min_samples_leaf': 4, 'min_weight_fraction_leaf': 0.08588461667887845, 'min_impurity_decrease': 0.9210947829327464, 'max_features': 0.7112860273851269, 'subsample': 0.13871226956140853, 'dropout_rate': 0.3588607247764115, 'ccp_alpha': 0.003656318103099074}. Best is trial 632 with value: 0.8548074589601917.[0m
[32m[I 2022-05-18 02:40:50,502][0m Trial 697 finished with value: 0.7394532885764438 and parameters: {'loss': 'coxph', 'learning_rate': 0.0062671192963367015, 'n_estimators': 473, 'criterion': 'friedman_mse', 'min_samples_split': 4, 'min_samples_leaf': 5, 'min_weight_fraction_leaf': 0.06777189252859106, 'min_impurity_decrease': 0.895697045850813, 'max_features': 0.6666797347656446, 'subsample': 0.1917910061465158, 'dropout_rate': 0.32251523305652946, 'ccp_alpha': 0.31615329325585567}. Best is trial 632 with value: 0.8548074589601917.[0m
[32m[I 2022-05-18 03:00:58,973][0m Trial 698 finished with value: 0.8437812262343416 and parameters: {'loss': 'coxph', 'learning_rate': 0.03437748954531072, 'n_estimators': 447, 'criterion': 'friedman_mse', 'min_samples_split': 4, 'min_samples_leaf': 5, 'min_weight_fraction_leaf': 0.09211040592107791, 'min_impurity_decrease': 0.9651920789479319, 'max_features': 0.695332403688333, 'subsample': 0.21435881278709448, 'dropout_rate': 0.3216011577157145, 'ccp_alpha': 0.0035839992928752874}. Best is trial 632 with value: 0.8548074589601917.[0m
[32m[I 2022-05-18 03:24:09,194][0m Trial 699 finished with value: 0.7624852131895019 and parameters: {'loss': 'coxph', 'learning_rate': 0.004370890010370253, 'n_estimators': 499, 'criterion': 'friedman_mse', 'min_samples_split': 4, 'min_samples_leaf': 5, 'min_weight_fraction_leaf': 0.04711117601612087, 'min_impurity_decrease': 0.9997669024153492, 'max_features': 0.6508652407103481, 'subsample': 0.16175332729698821, 'dropout_rate': 0.41466628177406195, 'ccp_alpha': 0.1914734171257838}. Best is trial 632 with value: 0.8548074589601917.[0m
[32m[I 2022-05-18 03:43:59,012][0m Trial 700 finished with value: 0.7775843894348504 and parameters: {'loss': 'coxph', 'learning_rate': 0.00961252746214795, 'n_estimators': 416, 'criterion': 'friedman_mse', 'min_samples_split': 4, 'min_samples_leaf': 5, 'min_weight_fraction_leaf': 0.07832630562736749, 'min_impurity_decrease': 0.9501481899899645, 'max_features': 0.715109773219122, 'subsample': 0.13821649350209503, 'dropout_rate': 0.280174766807074, 'ccp_alpha': 0.16070572834856903}. Best is trial 632 with value: 0.8548074589601917.[0m
[32m[I 2022-05-18 04:07:19,815][0m Trial 701 finished with value: 0.5 and parameters: {'loss': 'coxph', 'learning_rate': 0.011799010831981975, 'n_estimators': 517, 'criterion': 'friedman_mse', 'min_samples_split': 4, 'min_samples_leaf': 5, 'min_weight_fraction_leaf': 0.06275059906825574, 'min_impurity_decrease': 0.912925128399375, 'max_features': 0.7254716567785787, 'subsample': 0.18338096262022346, 'dropout_rate': 0.3932574468065451, 'ccp_alpha': 4.319429225476921}. Best is trial 632 with value: 0.8548074589601917.[0m
[32m[I 2022-05-18 04:28:37,616][0m Trial 702 finished with value: 0.7879988572587597 and parameters: {'loss': 'coxph', 'learning_rate': 0.01808167406537858, 'n_estimators': 453, 'criterion': 'friedman_mse', 'min_samples_split': 4, 'min_samples_leaf': 5, 'min_weight_fraction_leaf': 0.09413772560026926, 'min_impurity_decrease': 0.7068254366898741, 'max_features': 0.69421622109829, 'subsample': 0.15424904748218682, 'dropout_rate': 0.3410976119397021, 'ccp_alpha': 0.09407653108392484}. Best is trial 632 with value: 0.8548074589601917.[0m
[32m[I 2022-05-18 04:51:52,985][0m Trial 703 finished with value: 0.7878500349757174 and parameters: {'loss': 'coxph', 'learning_rate': 0.02403962330235204, 'n_estimators': 479, 'criterion': 'friedman_mse', 'min_samples_split': 4, 'min_samples_leaf': 4, 'min_weight_fraction_leaf': 0.07385845220803014, 'min_impurity_decrease': 0.9790698547403242, 'max_features': 0.7349622598983574, 'subsample': 0.1262516531935787, 'dropout_rate': 0.35909194706279146, 'ccp_alpha': 0.09244654593775255}. Best is trial 632 with value: 0.8548074589601917.[0m
[32m[I 2022-05-18 05:11:49,531][0m Trial 704 finished with value: 0.5 and parameters: {'loss': 'coxph', 'learning_rate': 0.03920651699115963, 'n_estimators': 436, 'criterion': 'friedman_mse', 'min_samples_split': 4, 'min_samples_leaf': 5, 'min_weight_fraction_leaf': 0.08470593410174561, 'min_impurity_decrease': 0.9263672949845962, 'max_features': 0.6271547545123339, 'subsample': 0.16523075404206047, 'dropout_rate': 0.3247356305002403, 'ccp_alpha': 4.6214944402843425}. Best is trial 632 with value: 0.8548074589601917.[0m
[32m[I 2022-05-18 05:36:20,849][0m Trial 705 finished with value: 0.5 and parameters: {'loss': 'coxph', 'learning_rate': 0.01202611588297277, 'n_estimators': 511, 'criterion': 'friedman_mse', 'min_samples_split': 4, 'min_samples_leaf': 5, 'min_weight_fraction_leaf': 0.09350859922676887, 'min_impurity_decrease': 0.9472274813319099, 'max_features': 0.7019646812583459, 'subsample': 0.13545739956973735, 'dropout_rate': 0.295135067128924, 'ccp_alpha': 0.8015993518799127}. Best is trial 632 with value: 0.8548074589601917.[0m
[32m[I 2022-05-18 05:57:38,771][0m Trial 706 finished with value: 0.7624285871041548 and parameters: {'loss': 'coxph', 'learning_rate': 0.016603440823414417, 'n_estimators': 488, 'criterion': 'friedman_mse', 'min_samples_split': 4, 'min_samples_leaf': 5, 'min_weight_fraction_leaf': 0.07022546720807961, 'min_impurity_decrease': 0.8945039755520703, 'max_features': 0.7351832986939612, 'subsample': 0.226555382910671, 'dropout_rate': 0.3964309573043343, 'ccp_alpha': 0.24195281445787567}. Best is trial 632 with value: 0.8548074589601917.[0m
[32m[I 2022-05-18 06:19:04,606][0m Trial 707 finished with value: 0.5 and parameters: {'loss': 'coxph', 'learning_rate': 0.0024844303907234234, 'n_estimators': 468, 'criterion': 'friedman_mse', 'min_samples_split': 4, 'min_samples_leaf': 5, 'min_weight_fraction_leaf': 0.08420338947831027, 'min_impurity_decrease': 0.9646337243213338, 'max_features': 0.6778584664966154, 'subsample': 0.17954249459319563, 'dropout_rate': 0.2514824162193948, 'ccp_alpha': 0.4487850697018278}. Best is trial 632 with value: 0.8548074589601917.[0m
[32m[I 2022-05-18 06:38:19,456][0m Trial 708 finished with value: 0.5 and parameters: {'loss': 'coxph', 'learning_rate': 0.007004879329615021, 'n_estimators': 418, 'criterion': 'squared_error', 'min_samples_split': 4, 'min_samples_leaf': 5, 'min_weight_fraction_leaf': 0.05508268617958356, 'min_impurity_decrease': 0.9339554934661478, 'max_features': 0.7150542839846792, 'subsample': 0.14823080013915393, 'dropout_rate': 0.3759126030760546, 'ccp_alpha': 0.09258463851968687}. Best is trial 632 with value: 0.8548074589601917.[0m
[32m[I 2022-05-18 06:58:14,394][0m Trial 709 finished with value: 0.7624852131895019 and parameters: {'loss': 'coxph', 'learning_rate': 0.004800887486995915, 'n_estimators': 443, 'criterion': 'friedman_mse', 'min_samples_split': 3, 'min_samples_leaf': 5, 'min_weight_fraction_leaf': 0.037429721265819275, 'min_impurity_decrease': 0.9062182944425446, 'max_features': 0.7534832846804158, 'subsample': 0.19770578726074994, 'dropout_rate': 0.32761085538624835, 'ccp_alpha': 0.16875080379793544}. Best is trial 632 with value: 0.8548074589601917.[0m
/media/san2_ssd/data/Workdir/survival/venv/lib/python3.8/site-packages/sksurv/ensemble/boosting.py:955: RuntimeWarning: divide by zero encountered in log
  time = numpy.log(time)
/media/san2_ssd/data/Workdir/survival/venv/lib/python3.8/site-packages/sksurv/ensemble/boosting.py:955: RuntimeWarning: divide by zero encountered in log
  time = numpy.log(time)
/media/san2_ssd/data/Workdir/survival/venv/lib/python3.8/site-packages/sksurv/ensemble/boosting.py:955: RuntimeWarning: divide by zero encountered in log
  time = numpy.log(time)
/media/san2_ssd/data/Workdir/survival/venv/lib/python3.8/site-packages/sksurv/ensemble/boosting.py:955: RuntimeWarning: divide by zero encountered in log
  time = numpy.log(time)
/media/san2_ssd/data/Workdir/survival/venv/lib/python3.8/site-packages/sksurv/ensemble/boosting.py:955: RuntimeWarning: divide by zero encountered in log
  time = numpy.log(time)
[32m[I 2022-05-18 06:58:14,474][0m Trial 710 finished with value: -1.0 and parameters: {'loss': 'squared', 'learning_rate': 0.01789011486783277, 'n_estimators': 526, 'criterion': 'friedman_mse', 'min_samples_split': 4, 'min_samples_leaf': 4, 'min_weight_fraction_leaf': 0.09812986485550346, 'min_impurity_decrease': 0.8830946298288, 'max_features': 0.7325161543996279, 'subsample': 0.1684444048828543, 'dropout_rate': 0.35522696706943163, 'ccp_alpha': 0.0027802541289919953}. Best is trial 632 with value: 0.8548074589601917.[0m
[32m[I 2022-05-18 07:19:53,065][0m Trial 711 finished with value: 0.7398672134515036 and parameters: {'loss': 'coxph', 'learning_rate': 0.0018567565705212054, 'n_estimators': 462, 'criterion': 'friedman_mse', 'min_samples_split': 3, 'min_samples_leaf': 5, 'min_weight_fraction_leaf': 0.07804980670446267, 'min_impurity_decrease': 0.9800337239052826, 'max_features': 0.7193932563974219, 'subsample': 0.12514126607241102, 'dropout_rate': 0.548676269209306, 'ccp_alpha': 0.3289542670589535}. Best is trial 632 with value: 0.8548074589601917.[0m
[32m[I 2022-05-18 07:44:56,215][0m Trial 712 finished with value: 0.7929031200603459 and parameters: {'loss': 'coxph', 'learning_rate': 0.012992693136517826, 'n_estimators': 501, 'criterion': 'friedman_mse', 'min_samples_split': 4, 'min_samples_leaf': 5, 'min_weight_fraction_leaf': 0.08617920342897036, 'min_impurity_decrease': 0.9456887574605083, 'max_features': 0.6546589955456575, 'subsample': 0.14563832152626566, 'dropout_rate': 0.02688717287392013, 'ccp_alpha': 0.08157482822145828}. Best is trial 632 with value: 0.8548074589601917.[0m
[32m[I 2022-05-18 08:07:59,307][0m Trial 713 finished with value: 0.5 and parameters: {'loss': 'coxph', 'learning_rate': 0.009618105097346858, 'n_estimators': 478, 'criterion': 'friedman_mse', 'min_samples_split': 4, 'min_samples_leaf': 5, 'min_weight_fraction_leaf': 0.06958743627380849, 'min_impurity_decrease': 0.7038149031534326, 'max_features': 0.7469840188551814, 'subsample': 0.11790237587637979, 'dropout_rate': 0.3489726157036079, 'ccp_alpha': 1.116742912005704}. Best is trial 632 with value: 0.8548074589601917.[0m
[32m[I 2022-05-18 08:27:18,030][0m Trial 714 finished with value: 0.5 and parameters: {'loss': 'coxph', 'learning_rate': 0.02805610570975177, 'n_estimators': 432, 'criterion': 'friedman_mse', 'min_samples_split': 3, 'min_samples_leaf': 5, 'min_weight_fraction_leaf': 0.09990062104197417, 'min_impurity_decrease': 0.9204277948648429, 'max_features': 0.6919804525220741, 'subsample': 0.18849920721936492, 'dropout_rate': 0.30261527758387224, 'ccp_alpha': 3.4595950607574215}. Best is trial 632 with value: 0.8548074589601917.[0m
[32m[I 2022-05-18 08:48:42,099][0m Trial 715 finished with value: 0.7635097100717669 and parameters: {'loss': 'coxph', 'learning_rate': 5.077769548481105e-05, 'n_estimators': 456, 'criterion': 'friedman_mse', 'min_samples_split': 4, 'min_samples_leaf': 5, 'min_weight_fraction_leaf': 0.058406387598753884, 'min_impurity_decrease': 0.9666018860328559, 'max_features': 0.7608582830230847, 'subsample': 0.16319742850012453, 'dropout_rate': 0.2764296924235215, 'ccp_alpha': 0.17696591055778}. Best is trial 632 with value: 0.8548074589601917.[0m
[32m[I 2022-05-18 09:17:29,543][0m Trial 716 finished with value: 0.8541982429549234 and parameters: {'loss': 'coxph', 'learning_rate': 0.020468028482337728, 'n_estimators': 539, 'criterion': 'friedman_mse', 'min_samples_split': 3, 'min_samples_leaf': 5, 'min_weight_fraction_leaf': 0.08739222659736884, 'min_impurity_decrease': 0.6705897044555446, 'max_features': 0.6013500098297434, 'subsample': 0.1225070786223524, 'dropout_rate': 0.021512686671320107, 'ccp_alpha': 0.001103643003721031}. Best is trial 632 with value: 0.8548074589601917.[0m
[32m[I 2022-05-18 09:45:44,923][0m Trial 717 finished with value: 0.8560199199002689 and parameters: {'loss': 'coxph', 'learning_rate': 0.02093789227726983, 'n_estimators': 533, 'criterion': 'friedman_mse', 'min_samples_split': 3, 'min_samples_leaf': 5, 'min_weight_fraction_leaf': 0.07964624438590966, 'min_impurity_decrease': 0.6721219795413137, 'max_features': 0.6052040180106943, 'subsample': 0.1289361538602616, 'dropout_rate': 0.015592203947004437, 'ccp_alpha': 0.002931661940339077}. Best is trial 717 with value: 0.8560199199002689.[0m
[32m[I 2022-05-18 10:13:47,467][0m Trial 718 finished with value: 0.856384589627367 and parameters: {'loss': 'coxph', 'learning_rate': 0.0224556586910938, 'n_estimators': 523, 'criterion': 'friedman_mse', 'min_samples_split': 3, 'min_samples_leaf': 5, 'min_weight_fraction_leaf': 0.07557075581307221, 'min_impurity_decrease': 0.6332226429859548, 'max_features': 0.5715045424171374, 'subsample': 0.11504080726731637, 'dropout_rate': 0.01508405723430925, 'ccp_alpha': 0.001127873222373672}. Best is trial 718 with value: 0.856384589627367.[0m
[32m[I 2022-05-18 10:40:35,414][0m Trial 719 finished with value: 0.7631648759762124 and parameters: {'loss': 'coxph', 'learning_rate': 0.009696814363545424, 'n_estimators': 519, 'criterion': 'friedman_mse', 'min_samples_split': 3, 'min_samples_leaf': 5, 'min_weight_fraction_leaf': 0.06620302844022125, 'min_impurity_decrease': 0.611290415855273, 'max_features': 0.5377117538169112, 'subsample': 0.11035147824888872, 'dropout_rate': 0.024787471553657958, 'ccp_alpha': 0.24283571633268936}. Best is trial 718 with value: 0.856384589627367.[0m
[32m[I 2022-05-18 11:07:14,344][0m Trial 720 finished with value: 0.8585904802270813 and parameters: {'loss': 'coxph', 'learning_rate': 0.021599893522997512, 'n_estimators': 504, 'criterion': 'friedman_mse', 'min_samples_split': 3, 'min_samples_leaf': 5, 'min_weight_fraction_leaf': 0.04530693420946026, 'min_impurity_decrease': 0.6296247591306308, 'max_features': 0.5940767174944486, 'subsample': 0.12374321988912923, 'dropout_rate': 0.013517504428607526, 'ccp_alpha': 0.0014478944903368529}. Best is trial 720 with value: 0.8585904802270813.[0m
[32m[I 2022-05-18 11:34:30,178][0m Trial 721 finished with value: 0.7876420310998978 and parameters: {'loss': 'coxph', 'learning_rate': 0.02032470884928359, 'n_estimators': 528, 'criterion': 'friedman_mse', 'min_samples_split': 3, 'min_samples_leaf': 5, 'min_weight_fraction_leaf': 0.04536223443527157, 'min_impurity_decrease': 0.6318020376402702, 'max_features': 0.5819937113073395, 'subsample': 0.11571841688536702, 'dropout_rate': 0.03625255282865868, 'ccp_alpha': 0.14879978728446402}. Best is trial 720 with value: 0.8585904802270813.[0m
[32m[I 2022-05-18 12:00:55,305][0m Trial 722 finished with value: 0.802863877106146 and parameters: {'loss': 'coxph', 'learning_rate': 0.02411892041209398, 'n_estimators': 506, 'criterion': 'friedman_mse', 'min_samples_split': 3, 'min_samples_leaf': 5, 'min_weight_fraction_leaf': 0.03596396534214605, 'min_impurity_decrease': 0.6451771644951656, 'max_features': 0.5996642767932203, 'subsample': 0.1269975650028315, 'dropout_rate': 0.012784624376528818, 'ccp_alpha': 0.0979336337599875}. Best is trial 720 with value: 0.8585904802270813.[0m
[32m[I 2022-05-18 12:29:47,155][0m Trial 723 finished with value: 0.8027375125148504 and parameters: {'loss': 'coxph', 'learning_rate': 0.022613761467504576, 'n_estimators': 535, 'criterion': 'friedman_mse', 'min_samples_split': 3, 'min_samples_leaf': 4, 'min_weight_fraction_leaf': 0.05226619678691041, 'min_impurity_decrease': 0.6513373749685674, 'max_features': 0.6254909601813478, 'subsample': 0.11726074447720536, 'dropout_rate': 0.022783523681092835, 'ccp_alpha': 0.09885685320138732}. Best is trial 720 with value: 0.8585904802270813.[0m
[32m[I 2022-05-18 12:54:48,179][0m Trial 724 finished with value: 0.758181921729853 and parameters: {'loss': 'coxph', 'learning_rate': 0.07216505763873972, 'n_estimators': 504, 'criterion': 'friedman_mse', 'min_samples_split': 3, 'min_samples_leaf': 5, 'min_weight_fraction_leaf': 0.05992492766542508, 'min_impurity_decrease': 0.6642994315459694, 'max_features': 0.5642852600141633, 'subsample': 0.13730357748718688, 'dropout_rate': 0.010301703851994984, 'ccp_alpha': 0.2425984934588421}. Best is trial 720 with value: 0.8585904802270813.[0m
[32m[I 2022-05-18 13:18:56,853][0m Trial 725 finished with value: 0.7906983918150801 and parameters: {'loss': 'coxph', 'learning_rate': 0.03608645240959898, 'n_estimators': 486, 'criterion': 'friedman_mse', 'min_samples_split': 3, 'min_samples_leaf': 5, 'min_weight_fraction_leaf': 0.04164505898517468, 'min_impurity_decrease': 0.6126664074433321, 'max_features': 0.6132989776170538, 'subsample': 0.11630872775241309, 'dropout_rate': 0.006241401753574717, 'ccp_alpha': 0.09353620360972004}. Best is trial 720 with value: 0.8585904802270813.[0m
[32m[I 2022-05-18 13:43:18,197][0m Trial 726 finished with value: 0.7395018797606732 and parameters: {'loss': 'coxph', 'learning_rate': 0.015110376121915719, 'n_estimators': 519, 'criterion': 'friedman_mse', 'min_samples_split': 3, 'min_samples_leaf': 9, 'min_weight_fraction_leaf': 0.04881898733519482, 'min_impurity_decrease': 0.6674363632845253, 'max_features': 0.6008577525165768, 'subsample': 0.138974399050188, 'dropout_rate': 0.045295861175063956, 'ccp_alpha': 0.35729461910150795}. Best is trial 720 with value: 0.8585904802270813.[0m
[32m[I 2022-05-18 14:07:32,262][0m Trial 727 finished with value: 0.7642374885686183 and parameters: {'loss': 'coxph', 'learning_rate': 0.04885708090206379, 'n_estimators': 496, 'criterion': 'friedman_mse', 'min_samples_split': 3, 'min_samples_leaf': 5, 'min_weight_fraction_leaf': 0.07391701991438322, 'min_impurity_decrease': 0.6910920412633665, 'max_features': 0.5828584193924005, 'subsample': 0.11153683649088855, 'dropout_rate': 0.0323253836598135, 'ccp_alpha': 0.16635388043030985}. Best is trial 720 with value: 0.8585904802270813.[0m
[32m[I 2022-05-18 14:35:03,136][0m Trial 728 finished with value: 0.8574740493503228 and parameters: {'loss': 'coxph', 'learning_rate': 0.025797642329818172, 'n_estimators': 540, 'criterion': 'friedman_mse', 'min_samples_split': 3, 'min_samples_leaf': 5, 'min_weight_fraction_leaf': 0.06247379863061055, 'min_impurity_decrease': 0.6741344631157816, 'max_features': 0.6170746778529203, 'subsample': 0.12206451159364834, 'dropout_rate': 0.019338288015715317, 'ccp_alpha': 0.002731900030746388}. Best is trial 720 with value: 0.8585904802270813.[0m
[32m[I 2022-05-18 15:03:09,545][0m Trial 729 finished with value: 0.8593892830611674 and parameters: {'loss': 'coxph', 'learning_rate': 0.024269249770668987, 'n_estimators': 545, 'criterion': 'friedman_mse', 'min_samples_split': 3, 'min_samples_leaf': 5, 'min_weight_fraction_leaf': 0.05998851397969404, 'min_impurity_decrease': 0.6313972958836286, 'max_features': 0.590195521534423, 'subsample': 0.11514807964109458, 'dropout_rate': 0.00432959392135809, 'ccp_alpha': 0.0035390752493686716}. Best is trial 729 with value: 0.8593892830611674.[0m
