[32m[I 2022-04-21 15:17:29,993][0m Trial 385 finished with value: 0.8300394352238769 and parameters: {'alpha': 1.930126028159782, 'ties': 'breslow'}. Best is trial 211 with value: 0.830053417686198.[0m
[32m[I 2022-04-21 15:17:39,787][0m Trial 386 finished with value: 0.8299628954302506 and parameters: {'alpha': 2.040452589204641, 'ties': 'breslow'}. Best is trial 211 with value: 0.830053417686198.[0m
[32m[I 2022-04-21 15:17:46,577][0m Trial 387 finished with value: 0.8299444910721198 and parameters: {'alpha': 2.1607585618060563, 'ties': 'breslow'}. Best is trial 211 with value: 0.830053417686198.[0m
[32m[I 2022-04-21 15:17:57,282][0m Trial 388 finished with value: 0.8297800348308971 and parameters: {'alpha': 1.5766904895233294, 'ties': 'efron'}. Best is trial 211 with value: 0.830053417686198.[0m
[32m[I 2022-04-21 15:18:05,477][0m Trial 389 finished with value: 0.8300340598071527 and parameters: {'alpha': 1.8315671437712442, 'ties': 'breslow'}. Best is trial 211 with value: 0.830053417686198.[0m
[32m[I 2022-04-21 15:18:13,655][0m Trial 390 finished with value: 0.8300438453633131 and parameters: {'alpha': 1.9603362644922315, 'ties': 'breslow'}. Best is trial 211 with value: 0.830053417686198.[0m
[32m[I 2022-04-21 15:18:24,261][0m Trial 391 finished with value: 0.8299310004597986 and parameters: {'alpha': 2.3260401262198562, 'ties': 'breslow'}. Best is trial 211 with value: 0.830053417686198.[0m
[32m[I 2022-04-21 15:18:32,584][0m Trial 392 finished with value: 0.8299849053959996 and parameters: {'alpha': 1.7024073493102088, 'ties': 'breslow'}. Best is trial 211 with value: 0.830053417686198.[0m
[32m[I 2022-04-21 15:18:39,368][0m Trial 393 finished with value: 0.8299638667428735 and parameters: {'alpha': 2.0379322486737053, 'ties': 'breslow'}. Best is trial 211 with value: 0.830053417686198.[0m
[32m[I 2022-04-21 15:18:47,267][0m Trial 394 finished with value: 0.8300344695221418 and parameters: {'alpha': 1.8685844306259505, 'ties': 'breslow'}. Best is trial 211 with value: 0.830053417686198.[0m
[32m[I 2022-04-21 15:18:57,468][0m Trial 395 finished with value: 0.8300131403607226 and parameters: {'alpha': 1.7811573885316048, 'ties': 'breslow'}. Best is trial 211 with value: 0.830053417686198.[0m
[32m[I 2022-04-21 15:19:04,960][0m Trial 396 finished with value: 0.8300504699841393 and parameters: {'alpha': 1.940038684906157, 'ties': 'breslow'}. Best is trial 211 with value: 0.830053417686198.[0m
[32m[I 2022-04-21 15:19:12,844][0m Trial 397 finished with value: 0.8300445534941476 and parameters: {'alpha': 1.9169934677174796, 'ties': 'breslow'}. Best is trial 211 with value: 0.830053417686198.[0m
[32m[I 2022-04-21 15:19:21,848][0m Trial 398 finished with value: 0.82995238301848 and parameters: {'alpha': 2.1281753830599666, 'ties': 'breslow'}. Best is trial 211 with value: 0.830053417686198.[0m
[32m[I 2022-04-21 15:19:29,666][0m Trial 399 finished with value: 0.8299843264355946 and parameters: {'alpha': 1.6808516556518862, 'ties': 'breslow'}. Best is trial 211 with value: 0.830053417686198.[0m
[32m[I 2022-04-21 15:19:37,311][0m Trial 400 finished with value: 0.82998716844528 and parameters: {'alpha': 1.99224856579724, 'ties': 'breslow'}. Best is trial 211 with value: 0.830053417686198.[0m
[32m[I 2022-04-21 15:19:44,470][0m Trial 401 finished with value: 0.8300208662353985 and parameters: {'alpha': 1.8116072819660767, 'ties': 'breslow'}. Best is trial 211 with value: 0.830053417686198.[0m
[32m[I 2022-04-21 15:19:51,578][0m Trial 402 finished with value: 0.8300497177823063 and parameters: {'alpha': 1.9109111315427985, 'ties': 'breslow'}. Best is trial 211 with value: 0.830053417686198.[0m
[32m[I 2022-04-21 15:20:00,324][0m Trial 403 finished with value: 0.8300368212399001 and parameters: {'alpha': 1.8804180934166326, 'ties': 'breslow'}. Best is trial 211 with value: 0.830053417686198.[0m
[32m[I 2022-04-21 15:20:08,165][0m Trial 404 finished with value: 0.8299432785570946 and parameters: {'alpha': 1.5327790933334855, 'ties': 'breslow'}. Best is trial 211 with value: 0.830053417686198.[0m
[32m[I 2022-04-21 15:20:15,615][0m Trial 405 finished with value: 0.8300118584490269 and parameters: {'alpha': 1.7730983603744812, 'ties': 'breslow'}. Best is trial 211 with value: 0.830053417686198.[0m
[32m[I 2022-04-21 15:20:25,280][0m Trial 406 finished with value: 0.8299402603442907 and parameters: {'alpha': 2.094241317079162, 'ties': 'breslow'}. Best is trial 211 with value: 0.830053417686198.[0m
[32m[I 2022-04-21 15:20:33,417][0m Trial 407 finished with value: 0.8300515024357914 and parameters: {'alpha': 1.9076889384442508, 'ties': 'breslow'}. Best is trial 211 with value: 0.830053417686198.[0m
[32m[I 2022-04-21 15:20:39,759][0m Trial 408 finished with value: 0.8299689751630387 and parameters: {'alpha': 1.6553469221316905, 'ties': 'breslow'}. Best is trial 211 with value: 0.830053417686198.[0m
[32m[I 2022-04-21 15:20:49,804][0m Trial 409 finished with value: 0.8298296172000317 and parameters: {'alpha': 1.8956965287940926, 'ties': 'efron'}. Best is trial 211 with value: 0.830053417686198.[0m
[32m[I 2022-04-21 15:20:55,908][0m Trial 410 finished with value: 0.830009691065283 and parameters: {'alpha': 1.7869890091621075, 'ties': 'breslow'}. Best is trial 211 with value: 0.830053417686198.[0m
[32m[I 2022-04-21 15:21:03,949][0m Trial 411 finished with value: 0.8299872985988103 and parameters: {'alpha': 2.0177171366099147, 'ties': 'breslow'}. Best is trial 211 with value: 0.830053417686198.[0m
[32m[I 2022-04-21 15:21:09,514][0m Trial 412 finished with value: 0.8300399584427597 and parameters: {'alpha': 1.9278877268349923, 'ties': 'breslow'}. Best is trial 211 with value: 0.830053417686198.[0m
[32m[I 2022-04-21 15:21:15,043][0m Trial 413 finished with value: 0.8299378587602233 and parameters: {'alpha': 2.216031881320243, 'ties': 'breslow'}. Best is trial 211 with value: 0.830053417686198.[0m
[32m[I 2022-04-21 15:21:23,646][0m Trial 414 finished with value: 0.8300335689201772 and parameters: {'alpha': 1.840339131485896, 'ties': 'breslow'}. Best is trial 211 with value: 0.830053417686198.[0m
[32m[I 2022-04-21 15:21:35,255][0m Trial 415 finished with value: 0.8299988162452292 and parameters: {'alpha': 1.7281999371244452, 'ties': 'breslow'}. Best is trial 211 with value: 0.830053417686198.[0m
[32m[I 2022-04-21 15:21:43,908][0m Trial 416 finished with value: 0.8299473371260584 and parameters: {'alpha': 2.068554234444564, 'ties': 'breslow'}. Best is trial 211 with value: 0.830053417686198.[0m
[32m[I 2022-04-21 15:21:52,097][0m Trial 417 finished with value: 0.830048993227121 and parameters: {'alpha': 1.9162988298484376, 'ties': 'breslow'}. Best is trial 211 with value: 0.830053417686198.[0m
[32m[I 2022-04-21 15:22:01,006][0m Trial 418 finished with value: 0.8299631604417108 and parameters: {'alpha': 1.6028256966057897, 'ties': 'breslow'}. Best is trial 211 with value: 0.830053417686198.[0m
[32m[I 2022-04-21 15:22:07,417][0m Trial 419 finished with value: 0.829987706916884 and parameters: {'alpha': 2.0261178205163604, 'ties': 'breslow'}. Best is trial 211 with value: 0.830053417686198.[0m
[32m[I 2022-04-21 15:22:17,483][0m Trial 420 finished with value: 0.8300261928902071 and parameters: {'alpha': 1.821302773705366, 'ties': 'breslow'}. Best is trial 211 with value: 0.830053417686198.[0m
[32m[I 2022-04-21 15:22:26,977][0m Trial 421 finished with value: 0.8299457223613944 and parameters: {'alpha': 2.1441949569425884, 'ties': 'breslow'}. Best is trial 211 with value: 0.830053417686198.[0m
[32m[I 2022-04-21 15:22:35,046][0m Trial 422 finished with value: 0.8300491393574866 and parameters: {'alpha': 1.9416095976895054, 'ties': 'breslow'}. Best is trial 211 with value: 0.830053417686198.[0m
[32m[I 2022-04-21 15:22:42,177][0m Trial 423 finished with value: 0.8300165314104813 and parameters: {'alpha': 1.7541127955561702, 'ties': 'breslow'}. Best is trial 211 with value: 0.830053417686198.[0m
[32m[I 2022-04-21 15:22:48,939][0m Trial 424 finished with value: 0.8300487664280795 and parameters: {'alpha': 1.8898857122409634, 'ties': 'breslow'}. Best is trial 211 with value: 0.830053417686198.[0m
[32m[I 2022-04-21 15:22:56,586][0m Trial 425 finished with value: 0.8300473442651815 and parameters: {'alpha': 1.9882592034155038, 'ties': 'breslow'}. Best is trial 211 with value: 0.830053417686198.[0m
[32m[I 2022-04-21 15:23:03,566][0m Trial 426 finished with value: 0.8299407496632518 and parameters: {'alpha': 2.0939794648009498, 'ties': 'breslow'}. Best is trial 211 with value: 0.830053417686198.[0m
[32m[I 2022-04-21 15:23:11,787][0m Trial 427 finished with value: 0.8299835591236487 and parameters: {'alpha': 1.6845152530988035, 'ties': 'breslow'}. Best is trial 211 with value: 0.830053417686198.[0m
[32m[I 2022-04-21 15:23:23,780][0m Trial 428 finished with value: 0.8298019667848491 and parameters: {'alpha': 1.8355365110731958, 'ties': 'efron'}. Best is trial 211 with value: 0.830053417686198.[0m
[32m[I 2022-04-21 15:23:34,656][0m Trial 429 finished with value: 0.8300477508123638 and parameters: {'alpha': 1.9705267963136754, 'ties': 'breslow'}. Best is trial 211 with value: 0.830053417686198.[0m
[32m[I 2022-04-21 15:23:42,179][0m Trial 430 finished with value: 0.829940046094085 and parameters: {'alpha': 2.225258243719885, 'ties': 'breslow'}. Best is trial 211 with value: 0.830053417686198.[0m
[32m[I 2022-04-21 15:23:49,387][0m Trial 431 finished with value: 0.8300118110053397 and parameters: {'alpha': 1.7968137541417617, 'ties': 'breslow'}. Best is trial 211 with value: 0.830053417686198.[0m
[32m[I 2022-04-21 15:23:56,574][0m Trial 432 finished with value: 0.829959710229932 and parameters: {'alpha': 2.051842005475716, 'ties': 'breslow'}. Best is trial 211 with value: 0.830053417686198.[0m
[32m[I 2022-04-21 15:24:04,303][0m Trial 433 finished with value: 0.8300393050039702 and parameters: {'alpha': 1.8787157523914857, 'ties': 'breslow'}. Best is trial 211 with value: 0.830053417686198.[0m
[32m[I 2022-04-21 15:24:12,626][0m Trial 434 finished with value: 0.8300429135740066 and parameters: {'alpha': 1.9543256597836265, 'ties': 'breslow'}. Best is trial 211 with value: 0.830053417686198.[0m
[32m[I 2022-04-21 15:24:18,872][0m Trial 435 finished with value: 0.8299996763274373 and parameters: {'alpha': 1.7248222156520514, 'ties': 'breslow'}. Best is trial 211 with value: 0.830053417686198.[0m
[32m[I 2022-04-21 15:24:25,677][0m Trial 436 finished with value: 0.8299477925403783 and parameters: {'alpha': 2.107459573390976, 'ties': 'breslow'}. Best is trial 211 with value: 0.830053417686198.[0m
[32m[I 2022-04-21 15:24:32,982][0m Trial 437 finished with value: 0.8300394764469614 and parameters: {'alpha': 1.8758796825056183, 'ties': 'breslow'}. Best is trial 211 with value: 0.830053417686198.[0m
[32m[I 2022-04-21 15:24:39,570][0m Trial 438 finished with value: 0.8299845125784711 and parameters: {'alpha': 2.008461142317126, 'ties': 'breslow'}. Best is trial 211 with value: 0.830053417686198.[0m
[32m[I 2022-04-21 15:24:47,804][0m Trial 439 finished with value: 0.8300114816587147 and parameters: {'alpha': 1.765943093725901, 'ties': 'breslow'}. Best is trial 211 with value: 0.830053417686198.[0m
[32m[I 2022-04-21 15:24:55,585][0m Trial 440 finished with value: 0.8299685663903451 and parameters: {'alpha': 1.6061112578738745, 'ties': 'breslow'}. Best is trial 211 with value: 0.830053417686198.[0m
[32m[I 2022-04-21 15:25:03,733][0m Trial 441 finished with value: 0.8299474256102307 and parameters: {'alpha': 2.1719781033493706, 'ties': 'breslow'}. Best is trial 211 with value: 0.830053417686198.[0m
[32m[I 2022-04-21 15:25:11,198][0m Trial 442 finished with value: 0.8299306688821773 and parameters: {'alpha': 2.3239157336136995, 'ties': 'breslow'}. Best is trial 211 with value: 0.830053417686198.[0m
[32m[I 2022-04-21 15:25:21,303][0m Trial 443 finished with value: 0.8300440290349048 and parameters: {'alpha': 1.9242753066618907, 'ties': 'breslow'}. Best is trial 211 with value: 0.830053417686198.[0m
[32m[I 2022-04-21 15:25:29,090][0m Trial 444 finished with value: 0.8300336792364472 and parameters: {'alpha': 1.8341683558569686, 'ties': 'breslow'}. Best is trial 211 with value: 0.830053417686198.[0m
[32m[I 2022-04-21 15:25:37,705][0m Trial 445 finished with value: 0.8299882392195712 and parameters: {'alpha': 2.015626573139859, 'ties': 'breslow'}. Best is trial 211 with value: 0.830053417686198.[0m
[32m[I 2022-04-21 15:25:45,286][0m Trial 446 finished with value: 0.8299448049181046 and parameters: {'alpha': 2.083416024343956, 'ties': 'breslow'}. Best is trial 211 with value: 0.830053417686198.[0m
[32m[I 2022-04-21 15:25:58,750][0m Trial 447 finished with value: 0.8297583737472373 and parameters: {'alpha': 1.185515307650363, 'ties': 'efron'}. Best is trial 211 with value: 0.830053417686198.[0m
[32m[I 2022-04-21 15:26:03,845][0m Trial 448 finished with value: 0.8299848505595646 and parameters: {'alpha': 1.7019091658916659, 'ties': 'breslow'}. Best is trial 211 with value: 0.830053417686198.[0m
[32m[I 2022-04-21 15:26:14,563][0m Trial 449 finished with value: 0.8300408934149287 and parameters: {'alpha': 1.9312453997147319, 'ties': 'breslow'}. Best is trial 211 with value: 0.830053417686198.[0m
[32m[I 2022-04-21 15:26:22,541][0m Trial 450 finished with value: 0.8300329528734645 and parameters: {'alpha': 1.8300667822288208, 'ties': 'breslow'}. Best is trial 211 with value: 0.830053417686198.[0m
[32m[I 2022-04-21 15:26:31,115][0m Trial 451 finished with value: 0.8299475051283295 and parameters: {'alpha': 1.4797280675789444, 'ties': 'breslow'}. Best is trial 211 with value: 0.830053417686198.[0m
[32m[I 2022-04-21 15:26:37,190][0m Trial 452 finished with value: 0.8299881400836643 and parameters: {'alpha': 2.0133546058201537, 'ties': 'breslow'}. Best is trial 211 with value: 0.830053417686198.[0m
[32m[I 2022-04-21 15:26:46,399][0m Trial 453 finished with value: 0.8299143867513434 and parameters: {'alpha': 2.5576540848741622, 'ties': 'breslow'}. Best is trial 211 with value: 0.830053417686198.[0m
[32m[I 2022-04-21 15:26:54,969][0m Trial 454 finished with value: 0.8299470199528015 and parameters: {'alpha': 2.19203253428054, 'ties': 'breslow'}. Best is trial 211 with value: 0.830053417686198.[0m
[32m[I 2022-04-21 15:27:01,139][0m Trial 455 finished with value: 0.8300505993145091 and parameters: {'alpha': 1.9103707226859947, 'ties': 'breslow'}. Best is trial 211 with value: 0.830053417686198.[0m
[32m[I 2022-04-21 15:27:09,623][0m Trial 456 finished with value: 0.8300129465125675 and parameters: {'alpha': 1.7646490959635606, 'ties': 'breslow'}. Best is trial 211 with value: 0.830053417686198.[0m
[32m[I 2022-04-21 15:27:16,889][0m Trial 457 finished with value: 0.8300386287484744 and parameters: {'alpha': 1.8843095248123187, 'ties': 'breslow'}. Best is trial 211 with value: 0.830053417686198.[0m
[32m[I 2022-04-21 15:27:24,413][0m Trial 458 finished with value: 0.8299815851184255 and parameters: {'alpha': 1.6671067529191095, 'ties': 'breslow'}. Best is trial 211 with value: 0.830053417686198.[0m
[32m[I 2022-04-21 15:27:34,574][0m Trial 459 finished with value: 0.8299436222162389 and parameters: {'alpha': 2.0957204721585643, 'ties': 'breslow'}. Best is trial 211 with value: 0.830053417686198.[0m
[32m[I 2022-04-21 15:27:44,899][0m Trial 460 finished with value: 0.8300425318688166 and parameters: {'alpha': 1.9638923636822636, 'ties': 'breslow'}. Best is trial 211 with value: 0.830053417686198.[0m
[32m[I 2022-04-21 15:27:52,375][0m Trial 461 finished with value: 0.8300262252609795 and parameters: {'alpha': 1.8188588851072611, 'ties': 'breslow'}. Best is trial 211 with value: 0.830053417686198.[0m
[32m[I 2022-04-21 15:28:00,654][0m Trial 462 finished with value: 0.8298703224175309 and parameters: {'alpha': 3.1654424286395204, 'ties': 'breslow'}. Best is trial 211 with value: 0.830053417686198.[0m
[32m[I 2022-04-21 15:28:08,065][0m Trial 463 finished with value: 0.8300480859866779 and parameters: {'alpha': 1.8900872218374896, 'ties': 'breslow'}. Best is trial 211 with value: 0.830053417686198.[0m
[32m[I 2022-04-21 15:28:16,089][0m Trial 464 finished with value: 0.8299590619052608 and parameters: {'alpha': 2.050458552985868, 'ties': 'breslow'}. Best is trial 211 with value: 0.830053417686198.[0m
[32m[I 2022-04-21 15:28:24,279][0m Trial 465 finished with value: 0.8300152572067097 and parameters: {'alpha': 1.7567629829129274, 'ties': 'breslow'}. Best is trial 211 with value: 0.830053417686198.[0m
[32m[I 2022-04-21 15:28:35,027][0m Trial 466 finished with value: 0.8300465574887378 and parameters: {'alpha': 1.9724117648077777, 'ties': 'breslow'}. Best is trial 211 with value: 0.830053417686198.[0m
[32m[I 2022-04-21 15:28:44,255][0m Trial 467 finished with value: 0.8299680373662884 and parameters: {'alpha': 1.6498648994787712, 'ties': 'breslow'}. Best is trial 211 with value: 0.830053417686198.[0m
[32m[I 2022-04-21 15:28:59,346][0m Trial 468 finished with value: 0.8298236310068668 and parameters: {'alpha': 1.885097553777768, 'ties': 'efron'}. Best is trial 211 with value: 0.830053417686198.[0m
[32m[I 2022-04-21 15:29:09,314][0m Trial 469 finished with value: 0.8299414451707292 and parameters: {'alpha': 2.1487490085940206, 'ties': 'breslow'}. Best is trial 211 with value: 0.830053417686198.[0m
[32m[I 2022-04-21 15:29:16,901][0m Trial 470 finished with value: 0.829924656371311 and parameters: {'alpha': 2.275030371554909, 'ties': 'breslow'}. Best is trial 211 with value: 0.830053417686198.[0m
[32m[I 2022-04-21 15:29:25,531][0m Trial 471 finished with value: 0.8300116590374926 and parameters: {'alpha': 1.793909217065446, 'ties': 'breslow'}. Best is trial 211 with value: 0.830053417686198.[0m
[32m[I 2022-04-21 15:29:32,417][0m Trial 472 finished with value: 0.8299845794946453 and parameters: {'alpha': 2.011527622260449, 'ties': 'breslow'}. Best is trial 211 with value: 0.830053417686198.[0m
[32m[I 2022-04-21 15:29:41,460][0m Trial 473 finished with value: 0.8300532698936506 and parameters: {'alpha': 1.901231393765926, 'ties': 'breslow'}. Best is trial 211 with value: 0.830053417686198.[0m
[32m[I 2022-04-21 15:29:48,983][0m Trial 474 finished with value: 0.8299619890516109 and parameters: {'alpha': 1.5861699749165958, 'ties': 'breslow'}. Best is trial 211 with value: 0.830053417686198.[0m
[32m[I 2022-04-21 15:29:55,672][0m Trial 475 finished with value: 0.8300333872637987 and parameters: {'alpha': 1.8305971682554123, 'ties': 'breslow'}. Best is trial 211 with value: 0.830053417686198.[0m
[32m[I 2022-04-21 15:30:02,654][0m Trial 476 finished with value: 0.8299476073193712 and parameters: {'alpha': 2.0688367984105644, 'ties': 'breslow'}. Best is trial 211 with value: 0.830053417686198.[0m
[32m[I 2022-04-21 15:30:08,875][0m Trial 477 finished with value: 0.8299958385895614 and parameters: {'alpha': 1.721656440214143, 'ties': 'breslow'}. Best is trial 211 with value: 0.830053417686198.[0m
[32m[I 2022-04-21 15:30:17,806][0m Trial 478 finished with value: 0.8299873905512285 and parameters: {'alpha': 1.9951959436224407, 'ties': 'breslow'}. Best is trial 211 with value: 0.830053417686198.[0m
[32m[I 2022-04-21 15:30:24,441][0m Trial 479 finished with value: 0.8300374636435993 and parameters: {'alpha': 1.883320248915439, 'ties': 'breslow'}. Best is trial 211 with value: 0.830053417686198.[0m
[32m[I 2022-04-21 15:30:34,706][0m Trial 480 finished with value: 0.8299390879042985 and parameters: {'alpha': 2.153115217778931, 'ties': 'breslow'}. Best is trial 211 with value: 0.830053417686198.[0m
[32m[I 2022-04-21 15:30:44,804][0m Trial 481 finished with value: 0.8300448830042303 and parameters: {'alpha': 1.9596352439888842, 'ties': 'breslow'}. Best is trial 211 with value: 0.830053417686198.[0m
[32m[I 2022-04-21 15:30:52,868][0m Trial 482 finished with value: 0.8300160601758083 and parameters: {'alpha': 1.7562043948801, 'ties': 'breslow'}. Best is trial 211 with value: 0.830053417686198.[0m
[32m[I 2022-04-21 15:31:00,453][0m Trial 483 finished with value: 0.8300512778649962 and parameters: {'alpha': 1.8930119438961654, 'ties': 'breslow'}. Best is trial 211 with value: 0.830053417686198.[0m
[32m[I 2022-04-21 15:31:07,889][0m Trial 484 finished with value: 0.8300292200851498 and parameters: {'alpha': 1.8237064481837548, 'ties': 'breslow'}. Best is trial 211 with value: 0.830053417686198.[0m
[32m[I 2022-04-21 15:31:16,361][0m Trial 485 finished with value: 0.8299696227796627 and parameters: {'alpha': 1.6513642798651178, 'ties': 'breslow'}. Best is trial 211 with value: 0.830053417686198.[0m
[32m[I 2022-04-21 15:31:25,588][0m Trial 486 finished with value: 0.8298361374985556 and parameters: {'alpha': 1.9084432448682942, 'ties': 'efron'}. Best is trial 211 with value: 0.830053417686198.[0m
[32m[I 2022-04-21 15:31:32,464][0m Trial 487 finished with value: 0.8299416303400419 and parameters: {'alpha': 1.531400005280568, 'ties': 'breslow'}. Best is trial 211 with value: 0.830053417686198.[0m
[32m[I 2022-04-21 15:31:39,662][0m Trial 488 finished with value: 0.8300127162803722 and parameters: {'alpha': 1.7905230653747934, 'ties': 'breslow'}. Best is trial 211 with value: 0.830053417686198.[0m
[32m[I 2022-04-21 15:31:47,269][0m Trial 489 finished with value: 0.8299543629688533 and parameters: {'alpha': 2.0580274198666544, 'ties': 'breslow'}. Best is trial 211 with value: 0.830053417686198.[0m
[32m[I 2022-04-21 15:31:54,507][0m Trial 490 finished with value: 0.8300509329431719 and parameters: {'alpha': 1.899695724876912, 'ties': 'breslow'}. Best is trial 211 with value: 0.830053417686198.[0m
[32m[I 2022-04-21 15:32:04,578][0m Trial 491 finished with value: 0.8299414277009662 and parameters: {'alpha': 1.4177725976354552, 'ties': 'breslow'}. Best is trial 211 with value: 0.830053417686198.[0m
