[32m[I 2022-04-21 13:03:47,313][0m Trial 532 finished with value: 0.9149941504276239 and parameters: {'alpha': 2.000913751084898, 'ties': 'breslow'}. Best is trial 411 with value: 0.91502674920718.[0m
[32m[I 2022-04-21 13:03:57,017][0m Trial 533 finished with value: 0.914985459715098 and parameters: {'alpha': 1.6508759095930665, 'ties': 'breslow'}. Best is trial 411 with value: 0.91502674920718.[0m
[32m[I 2022-04-21 13:04:07,868][0m Trial 534 finished with value: 0.914960640945667 and parameters: {'alpha': 2.4947248610548316, 'ties': 'breslow'}. Best is trial 411 with value: 0.91502674920718.[0m
[32m[I 2022-04-21 13:04:17,244][0m Trial 535 finished with value: 0.9150174709569848 and parameters: {'alpha': 1.8703776378897767, 'ties': 'breslow'}. Best is trial 411 with value: 0.91502674920718.[0m
[32m[I 2022-04-21 13:04:27,055][0m Trial 536 finished with value: 0.9149991932163992 and parameters: {'alpha': 1.7340531866962017, 'ties': 'breslow'}. Best is trial 411 with value: 0.91502674920718.[0m
[32m[I 2022-04-21 13:04:37,099][0m Trial 537 finished with value: 0.9149711303057362 and parameters: {'alpha': 2.0770811989692284, 'ties': 'breslow'}. Best is trial 411 with value: 0.91502674920718.[0m
[32m[I 2022-04-21 13:04:46,269][0m Trial 538 finished with value: 0.9150234328950239 and parameters: {'alpha': 1.9430833747702823, 'ties': 'breslow'}. Best is trial 411 with value: 0.91502674920718.[0m
[32m[I 2022-04-21 13:04:55,831][0m Trial 539 finished with value: 0.9150149010413176 and parameters: {'alpha': 1.8273498912130886, 'ties': 'breslow'}. Best is trial 411 with value: 0.91502674920718.[0m
[32m[I 2022-04-21 13:05:07,399][0m Trial 540 finished with value: 0.9149053255565441 and parameters: {'alpha': 4.23109655865467, 'ties': 'breslow'}. Best is trial 411 with value: 0.91502674920718.[0m
[32m[I 2022-04-21 13:05:16,144][0m Trial 541 finished with value: 0.9149694127960155 and parameters: {'alpha': 2.2135245036224793, 'ties': 'breslow'}. Best is trial 411 with value: 0.91502674920718.[0m
[32m[I 2022-04-21 13:05:25,626][0m Trial 542 finished with value: 0.9150246048706988 and parameters: {'alpha': 1.9764291290571105, 'ties': 'breslow'}. Best is trial 411 with value: 0.91502674920718.[0m
[32m[I 2022-04-21 13:05:35,348][0m Trial 543 finished with value: 0.9150051823195483 and parameters: {'alpha': 1.7963511011188988, 'ties': 'breslow'}. Best is trial 411 with value: 0.91502674920718.[0m
[32m[I 2022-04-21 13:05:44,847][0m Trial 544 finished with value: 0.9147672099272418 and parameters: {'alpha': 0.3061547376911107, 'ties': 'breslow'}. Best is trial 411 with value: 0.91502674920718.[0m
[32m[I 2022-04-21 13:05:54,843][0m Trial 545 finished with value: 0.9150255956004063 and parameters: {'alpha': 1.899683249288518, 'ties': 'breslow'}. Best is trial 411 with value: 0.91502674920718.[0m
[32m[I 2022-04-21 13:06:04,680][0m Trial 546 finished with value: 0.914976479464847 and parameters: {'alpha': 2.0634999968868075, 'ties': 'breslow'}. Best is trial 411 with value: 0.91502674920718.[0m
[32m[I 2022-04-21 13:06:14,431][0m Trial 547 finished with value: 0.9150253626619413 and parameters: {'alpha': 1.8956744492310393, 'ties': 'breslow'}. Best is trial 411 with value: 0.91502674920718.[0m
[32m[I 2022-04-21 13:06:24,646][0m Trial 548 finished with value: 0.914987533134596 and parameters: {'alpha': 1.6245808959371204, 'ties': 'breslow'}. Best is trial 411 with value: 0.91502674920718.[0m
[32m[I 2022-04-21 13:06:33,860][0m Trial 549 finished with value: 0.9148941419309926 and parameters: {'alpha': 1.7861484790420386, 'ties': 'efron'}. Best is trial 411 with value: 0.91502674920718.[0m
[32m[I 2022-04-21 13:06:44,864][0m Trial 550 finished with value: 0.9149935786964438 and parameters: {'alpha': 1.9912152104675434, 'ties': 'breslow'}. Best is trial 411 with value: 0.91502674920718.[0m
[32m[I 2022-04-21 13:06:55,108][0m Trial 551 finished with value: 0.9150255441254682 and parameters: {'alpha': 1.8924484032887803, 'ties': 'breslow'}. Best is trial 411 with value: 0.91502674920718.[0m
[32m[I 2022-04-21 13:07:06,245][0m Trial 552 finished with value: 0.9149921883956946 and parameters: {'alpha': 1.7026240223533293, 'ties': 'breslow'}. Best is trial 411 with value: 0.91502674920718.[0m
[32m[I 2022-04-21 13:07:17,326][0m Trial 553 finished with value: 0.9149712885188365 and parameters: {'alpha': 2.08283049751697, 'ties': 'breslow'}. Best is trial 411 with value: 0.91502674920718.[0m
[32m[I 2022-04-21 13:07:27,037][0m Trial 554 finished with value: 0.915020294746469 and parameters: {'alpha': 1.8755856208906754, 'ties': 'breslow'}. Best is trial 411 with value: 0.91502674920718.[0m
[32m[I 2022-04-21 13:07:36,108][0m Trial 555 finished with value: 0.9149706029996715 and parameters: {'alpha': 2.1479808487358745, 'ties': 'breslow'}. Best is trial 411 with value: 0.91502674920718.[0m
[32m[I 2022-04-21 13:07:46,746][0m Trial 556 finished with value: 0.9150089525930399 and parameters: {'alpha': 1.7548498955127936, 'ties': 'breslow'}. Best is trial 411 with value: 0.91502674920718.[0m
[32m[I 2022-04-21 13:07:56,775][0m Trial 557 finished with value: 0.9150214567870034 and parameters: {'alpha': 1.9543433948369968, 'ties': 'breslow'}. Best is trial 411 with value: 0.91502674920718.[0m
[32m[I 2022-04-21 13:08:05,952][0m Trial 558 finished with value: 0.9150179412396783 and parameters: {'alpha': 1.8621556432663788, 'ties': 'breslow'}. Best is trial 411 with value: 0.91502674920718.[0m
[32m[I 2022-04-21 13:08:15,362][0m Trial 559 finished with value: 0.9149763486348027 and parameters: {'alpha': 1.493791618398662, 'ties': 'breslow'}. Best is trial 411 with value: 0.91502674920718.[0m
[32m[I 2022-04-21 13:08:23,824][0m Trial 560 finished with value: 0.9149816870599168 and parameters: {'alpha': 2.040694660239976, 'ties': 'breslow'}. Best is trial 411 with value: 0.91502674920718.[0m
[32m[I 2022-04-21 13:08:32,445][0m Trial 561 finished with value: 0.9150065370554132 and parameters: {'alpha': 1.7897954636508862, 'ties': 'breslow'}. Best is trial 411 with value: 0.91502674920718.[0m
[32m[I 2022-04-21 13:08:42,679][0m Trial 562 finished with value: 0.915024896125801 and parameters: {'alpha': 1.9348988850090765, 'ties': 'breslow'}. Best is trial 411 with value: 0.91502674920718.[0m
[32m[I 2022-04-21 13:08:52,594][0m Trial 563 finished with value: 0.9149852968153717 and parameters: {'alpha': 1.6590735153127558, 'ties': 'breslow'}. Best is trial 411 with value: 0.91502674920718.[0m
[32m[I 2022-04-21 13:09:02,297][0m Trial 564 finished with value: 0.9149668526763449 and parameters: {'alpha': 2.317576795403228, 'ties': 'breslow'}. Best is trial 411 with value: 0.91502674920718.[0m
[32m[I 2022-04-21 13:09:11,848][0m Trial 565 finished with value: 0.9149916544838366 and parameters: {'alpha': 2.0053453504734495, 'ties': 'breslow'}. Best is trial 411 with value: 0.91502674920718.[0m
[32m[I 2022-04-21 13:09:21,429][0m Trial 566 finished with value: 0.9148685917726513 and parameters: {'alpha': 0.6309576513670918, 'ties': 'breslow'}. Best is trial 411 with value: 0.91502674920718.[0m
[32m[I 2022-04-21 13:09:30,748][0m Trial 567 finished with value: 0.9149720281291749 and parameters: {'alpha': 2.1790668450549773, 'ties': 'breslow'}. Best is trial 411 with value: 0.91502674920718.[0m
[32m[I 2022-04-21 13:09:44,660][0m Trial 568 finished with value: 0.9149004515891311 and parameters: {'alpha': 1.8310556705814844, 'ties': 'efron'}. Best is trial 411 with value: 0.91502674920718.[0m
[32m[I 2022-04-21 13:09:54,115][0m Trial 569 finished with value: 0.915026055535438 and parameters: {'alpha': 1.9089180892672275, 'ties': 'breslow'}. Best is trial 411 with value: 0.91502674920718.[0m
[32m[I 2022-04-21 13:10:03,826][0m Trial 570 finished with value: 0.9149959455582707 and parameters: {'alpha': 1.715077259726368, 'ties': 'breslow'}. Best is trial 411 with value: 0.91502674920718.[0m
[32m[I 2022-04-21 13:10:13,538][0m Trial 571 finished with value: 0.9149938098535451 and parameters: {'alpha': 2.0132883400787147, 'ties': 'breslow'}. Best is trial 411 with value: 0.91502674920718.[0m
[32m[I 2022-04-21 13:10:22,468][0m Trial 572 finished with value: 0.9150246473988177 and parameters: {'alpha': 1.8884931668464016, 'ties': 'breslow'}. Best is trial 411 with value: 0.91502674920718.[0m
[32m[I 2022-04-21 13:10:32,206][0m Trial 573 finished with value: 0.9149751069362392 and parameters: {'alpha': 2.111849272883718, 'ties': 'breslow'}. Best is trial 411 with value: 0.91502674920718.[0m
[32m[I 2022-04-21 13:10:39,723][0m Trial 574 finished with value: 0.9150063293691277 and parameters: {'alpha': 1.7994923820480795, 'ties': 'breslow'}. Best is trial 411 with value: 0.91502674920718.[0m
[32m[I 2022-04-21 13:10:51,030][0m Trial 575 finished with value: 0.9149404270721966 and parameters: {'alpha': 3.108891070597953, 'ties': 'breslow'}. Best is trial 411 with value: 0.91502674920718.[0m
[32m[I 2022-04-21 13:11:01,051][0m Trial 576 finished with value: 0.9149733101015787 and parameters: {'alpha': 1.3493634974175595, 'ties': 'breslow'}. Best is trial 411 with value: 0.91502674920718.[0m
[32m[I 2022-04-21 13:11:10,770][0m Trial 577 finished with value: 0.9149714186300096 and parameters: {'alpha': 1.5556510694991577, 'ties': 'breslow'}. Best is trial 411 with value: 0.91502674920718.[0m
[32m[I 2022-04-21 13:11:20,224][0m Trial 578 finished with value: 0.9150223694156641 and parameters: {'alpha': 1.9491066452751717, 'ties': 'breslow'}. Best is trial 411 with value: 0.91502674920718.[0m
[32m[I 2022-04-21 13:11:30,308][0m Trial 579 finished with value: 0.9149998073446692 and parameters: {'alpha': 1.7292848857142977, 'ties': 'breslow'}. Best is trial 411 with value: 0.91502674920718.[0m
[32m[I 2022-04-21 13:11:40,425][0m Trial 580 finished with value: 0.9149827916379326 and parameters: {'alpha': 2.043968635311391, 'ties': 'breslow'}. Best is trial 411 with value: 0.91502674920718.[0m
[32m[I 2022-04-21 13:11:50,656][0m Trial 581 finished with value: 0.9150172487217072 and parameters: {'alpha': 1.8659767886774163, 'ties': 'breslow'}. Best is trial 411 with value: 0.91502674920718.[0m
[32m[I 2022-04-21 13:12:02,051][0m Trial 582 finished with value: 0.9150220562990258 and parameters: {'alpha': 1.9606603523382207, 'ties': 'breslow'}. Best is trial 411 with value: 0.91502674920718.[0m
[32m[I 2022-04-21 13:12:12,751][0m Trial 583 finished with value: 0.9149697325169441 and parameters: {'alpha': 2.228180420877557, 'ties': 'breslow'}. Best is trial 411 with value: 0.91502674920718.[0m
[32m[I 2022-04-21 13:12:23,071][0m Trial 584 finished with value: 0.9150117699142614 and parameters: {'alpha': 1.814124609287754, 'ties': 'breslow'}. Best is trial 411 with value: 0.91502674920718.[0m
[32m[I 2022-04-21 13:12:33,530][0m Trial 585 finished with value: 0.9149534722884347 and parameters: {'alpha': 2.766850076011428, 'ties': 'breslow'}. Best is trial 411 with value: 0.91502674920718.[0m
[32m[I 2022-04-21 13:12:43,334][0m Trial 586 finished with value: 0.9149884205563957 and parameters: {'alpha': 1.63405226687137, 'ties': 'breslow'}. Best is trial 411 with value: 0.91502674920718.[0m
[32m[I 2022-04-21 13:12:52,467][0m Trial 587 finished with value: 0.9149712791663948 and parameters: {'alpha': 2.0789801538961794, 'ties': 'breslow'}. Best is trial 411 with value: 0.91502674920718.[0m
[32m[I 2022-04-21 13:13:06,838][0m Trial 588 finished with value: 0.9149120880743759 and parameters: {'alpha': 1.886945023552738, 'ties': 'efron'}. Best is trial 411 with value: 0.91502674920718.[0m
[32m[I 2022-04-21 13:13:15,343][0m Trial 589 finished with value: 0.9150245995671966 and parameters: {'alpha': 1.9754607500047567, 'ties': 'breslow'}. Best is trial 411 with value: 0.91502674920718.[0m
[32m[I 2022-04-21 13:13:24,838][0m Trial 590 finished with value: 0.9149906407571867 and parameters: {'alpha': 1.6939611786102216, 'ties': 'breslow'}. Best is trial 411 with value: 0.91502674920718.[0m
[32m[I 2022-04-21 13:13:35,580][0m Trial 591 finished with value: 0.9150106948140853 and parameters: {'alpha': 1.8104181244471504, 'ties': 'breslow'}. Best is trial 411 with value: 0.91502674920718.[0m
[32m[I 2022-04-21 13:13:45,134][0m Trial 592 finished with value: 0.9149732759236715 and parameters: {'alpha': 2.140172038312244, 'ties': 'breslow'}. Best is trial 411 with value: 0.91502674920718.[0m
[32m[I 2022-04-21 13:13:52,998][0m Trial 593 finished with value: 0.9150201582089175 and parameters: {'alpha': 1.928735374927495, 'ties': 'breslow'}. Best is trial 411 with value: 0.91502674920718.[0m
[32m[I 2022-04-21 13:14:04,143][0m Trial 594 finished with value: 0.9149520267357779 and parameters: {'alpha': 1.0185779774896737, 'ties': 'breslow'}. Best is trial 411 with value: 0.91502674920718.[0m
[32m[I 2022-04-21 13:14:14,222][0m Trial 595 finished with value: 0.9149925853513695 and parameters: {'alpha': 2.02851680960172, 'ties': 'breslow'}. Best is trial 411 with value: 0.91502674920718.[0m
[32m[I 2022-04-21 13:14:23,228][0m Trial 596 finished with value: 0.9150058092398599 and parameters: {'alpha': 1.78426935308547, 'ties': 'breslow'}. Best is trial 411 with value: 0.91502674920718.[0m
[32m[I 2022-04-21 13:14:33,326][0m Trial 597 finished with value: 0.9150197379020535 and parameters: {'alpha': 1.879288150359745, 'ties': 'breslow'}. Best is trial 411 with value: 0.91502674920718.[0m
[32m[I 2022-04-21 13:14:43,655][0m Trial 598 finished with value: 0.91499535735511 and parameters: {'alpha': 1.9959531683336154, 'ties': 'breslow'}. Best is trial 411 with value: 0.91502674920718.[0m
[32m[I 2022-04-21 13:14:53,020][0m Trial 599 finished with value: 0.915007054794245 and parameters: {'alpha': 1.7508139430678928, 'ties': 'breslow'}. Best is trial 411 with value: 0.91502674920718.[0m
[32m[I 2022-04-21 13:15:01,693][0m Trial 600 finished with value: 0.914981864896034 and parameters: {'alpha': 1.5849598637216165, 'ties': 'breslow'}. Best is trial 411 with value: 0.91502674920718.[0m
[32m[I 2022-04-21 13:15:11,764][0m Trial 601 finished with value: 0.9150244250340422 and parameters: {'alpha': 1.8913588695608197, 'ties': 'breslow'}. Best is trial 411 with value: 0.91502674920718.[0m
[32m[I 2022-04-21 13:15:22,616][0m Trial 602 finished with value: 0.9149754842566397 and parameters: {'alpha': 2.1311853681824084, 'ties': 'breslow'}. Best is trial 411 with value: 0.91502674920718.[0m
[32m[I 2022-04-21 13:15:32,034][0m Trial 603 finished with value: 0.9149927724889796 and parameters: {'alpha': 2.0107568718075184, 'ties': 'breslow'}. Best is trial 411 with value: 0.91502674920718.[0m
[32m[I 2022-04-21 13:15:42,852][0m Trial 604 finished with value: 0.9149928833919077 and parameters: {'alpha': 1.703858612624988, 'ties': 'breslow'}. Best is trial 411 with value: 0.91502674920718.[0m
[32m[I 2022-04-21 13:15:53,635][0m Trial 605 finished with value: 0.9150174595391954 and parameters: {'alpha': 1.8695231854958954, 'ties': 'breslow'}. Best is trial 411 with value: 0.91502674920718.[0m
[32m[I 2022-04-21 13:16:04,343][0m Trial 606 finished with value: 0.9149703036000671 and parameters: {'alpha': 2.2254120489396665, 'ties': 'breslow'}. Best is trial 411 with value: 0.91502674920718.[0m
[32m[I 2022-04-21 13:16:17,200][0m Trial 607 finished with value: 0.9149299435005883 and parameters: {'alpha': 1.9602684461932858, 'ties': 'efron'}. Best is trial 411 with value: 0.91502674920718.[0m
[32m[I 2022-04-21 13:16:26,963][0m Trial 608 finished with value: 0.9150073407750895 and parameters: {'alpha': 1.8021567171244517, 'ties': 'breslow'}. Best is trial 411 with value: 0.91502674920718.[0m
[32m[I 2022-04-21 13:16:37,623][0m Trial 609 finished with value: 0.9148659180817079 and parameters: {'alpha': 4.957942275840471, 'ties': 'breslow'}. Best is trial 411 with value: 0.91502674920718.[0m
[32m[I 2022-04-21 13:16:48,336][0m Trial 610 finished with value: 0.914971922339204 and parameters: {'alpha': 2.086763723257373, 'ties': 'breslow'}. Best is trial 411 with value: 0.91502674920718.[0m
[32m[I 2022-04-21 13:16:57,331][0m Trial 611 finished with value: 0.9150220245023657 and parameters: {'alpha': 1.9204521800017231, 'ties': 'breslow'}. Best is trial 411 with value: 0.91502674920718.[0m
[32m[I 2022-04-21 13:17:05,596][0m Trial 612 finished with value: 0.914998146794631 and parameters: {'alpha': 1.7368616542648354, 'ties': 'breslow'}. Best is trial 411 with value: 0.91502674920718.[0m
[32m[I 2022-04-21 13:17:14,980][0m Trial 613 finished with value: 0.9149810377469164 and parameters: {'alpha': 2.038349968833452, 'ties': 'breslow'}. Best is trial 411 with value: 0.91502674920718.[0m
[32m[I 2022-04-21 13:17:24,729][0m Trial 614 finished with value: 0.9150150039313729 and parameters: {'alpha': 1.8378689179321264, 'ties': 'breslow'}. Best is trial 411 with value: 0.91502674920718.[0m
[32m[I 2022-04-21 13:17:32,831][0m Trial 615 finished with value: 0.9150245128526864 and parameters: {'alpha': 1.933898317849958, 'ties': 'breslow'}. Best is trial 411 with value: 0.91502674920718.[0m
[32m[I 2022-04-21 13:17:41,631][0m Trial 616 finished with value: 0.914988577201617 and parameters: {'alpha': 1.6131406207889962, 'ties': 'breslow'}. Best is trial 411 with value: 0.91502674920718.[0m
[32m[I 2022-04-21 13:17:51,136][0m Trial 617 finished with value: 0.914962508105809 and parameters: {'alpha': 2.3557553875583386, 'ties': 'breslow'}. Best is trial 411 with value: 0.91502674920718.[0m
[32m[I 2022-04-21 13:18:00,510][0m Trial 618 finished with value: 0.914977603458668 and parameters: {'alpha': 2.1232620408958156, 'ties': 'breslow'}. Best is trial 411 with value: 0.91502674920718.[0m
[32m[I 2022-04-21 13:18:09,290][0m Trial 619 finished with value: 0.9150112331983717 and parameters: {'alpha': 1.8169299960395109, 'ties': 'breslow'}. Best is trial 411 with value: 0.91502674920718.[0m
[32m[I 2022-04-21 13:18:18,855][0m Trial 620 finished with value: 0.9149774304213549 and parameters: {'alpha': 1.457089898639722, 'ties': 'breslow'}. Best is trial 411 with value: 0.91502674920718.[0m
[32m[I 2022-04-21 13:18:27,717][0m Trial 621 finished with value: 0.9149949947320835 and parameters: {'alpha': 1.99698703912684, 'ties': 'breslow'}. Best is trial 411 with value: 0.91502674920718.[0m
[32m[I 2022-04-21 13:18:37,553][0m Trial 622 finished with value: 0.9149894515307281 and parameters: {'alpha': 1.6886787952478062, 'ties': 'breslow'}. Best is trial 411 with value: 0.91502674920718.[0m
[32m[I 2022-04-21 13:18:45,656][0m Trial 623 finished with value: 0.9150250615164156 and parameters: {'alpha': 1.8977645444753106, 'ties': 'breslow'}. Best is trial 411 with value: 0.91502674920718.[0m
[32m[I 2022-04-21 13:18:55,561][0m Trial 624 finished with value: 0.9150060952412622 and parameters: {'alpha': 1.7688445245926667, 'ties': 'breslow'}. Best is trial 411 with value: 0.91502674920718.[0m
[32m[I 2022-04-21 13:19:05,769][0m Trial 625 finished with value: 0.9149847928834017 and parameters: {'alpha': 2.0473116888674467, 'ties': 'breslow'}. Best is trial 411 with value: 0.91502674920718.[0m
[32m[I 2022-04-21 13:19:16,966][0m Trial 626 finished with value: 0.9149207654570505 and parameters: {'alpha': 3.522491700574218, 'ties': 'breslow'}. Best is trial 411 with value: 0.91502674920718.[0m
[32m[I 2022-04-21 13:19:32,393][0m Trial 627 finished with value: 0.9149549909410535 and parameters: {'alpha': 2.1807456797981226, 'ties': 'efron'}. Best is trial 411 with value: 0.91502674920718.[0m
[32m[I 2022-04-21 13:19:41,680][0m Trial 628 finished with value: 0.9150257900727107 and parameters: {'alpha': 1.9389358889407011, 'ties': 'breslow'}. Best is trial 411 with value: 0.91502674920718.[0m
[32m[I 2022-04-21 13:19:50,198][0m Trial 629 finished with value: 0.9150214210789016 and parameters: {'alpha': 1.9663078747884746, 'ties': 'breslow'}. Best is trial 411 with value: 0.91502674920718.[0m
[32m[I 2022-04-21 13:19:59,050][0m Trial 630 finished with value: 0.9149728532449599 and parameters: {'alpha': 2.0856314372511218, 'ties': 'breslow'}. Best is trial 411 with value: 0.91502674920718.[0m
[32m[I 2022-04-21 13:20:08,618][0m Trial 631 finished with value: 0.914967289113903 and parameters: {'alpha': 2.253117501005793, 'ties': 'breslow'}. Best is trial 411 with value: 0.91502674920718.[0m
[32m[I 2022-04-21 13:20:18,913][0m Trial 632 finished with value: 0.915011247220383 and parameters: {'alpha': 1.8178525917813697, 'ties': 'breslow'}. Best is trial 411 with value: 0.91502674920718.[0m
[32m[I 2022-04-21 13:20:32,502][0m Trial 633 finished with value: 0.9149935842226398 and parameters: {'alpha': 1.9922471628788982, 'ties': 'breslow'}. Best is trial 411 with value: 0.91502674920718.[0m
[32m[I 2022-04-21 13:20:41,887][0m Trial 634 finished with value: 0.9150240524903873 and parameters: {'alpha': 1.8906339233524254, 'ties': 'breslow'}. Best is trial 411 with value: 0.91502674920718.[0m
[32m[I 2022-04-21 13:20:52,459][0m Trial 635 finished with value: 0.9150054225731964 and parameters: {'alpha': 1.7475338177823767, 'ties': 'breslow'}. Best is trial 411 with value: 0.91502674920718.[0m
[32m[I 2022-04-21 13:21:02,919][0m Trial 636 finished with value: 0.9149707054626305 and parameters: {'alpha': 2.094960781059244, 'ties': 'breslow'}. Best is trial 411 with value: 0.91502674920718.[0m
[32m[I 2022-04-21 13:21:12,842][0m Trial 637 finished with value: 0.9150218359616675 and parameters: {'alpha': 1.9551281881819353, 'ties': 'breslow'}. Best is trial 411 with value: 0.91502674920718.[0m
[32m[I 2022-04-21 13:21:23,574][0m Trial 638 finished with value: 0.9149913317181559 and parameters: {'alpha': 1.666154881515535, 'ties': 'breslow'}. Best is trial 411 with value: 0.91502674920718.[0m
