[32m[I 2022-05-10 09:46:54,855][0m Trial 251 finished with value: 0.8162546510348164 and parameters: {'loss': 'coxph', 'learning_rate': 1.4024204966571002e-05, 'n_estimators': 941, 'criterion': 'friedman_mse', 'min_samples_split': 8, 'min_samples_leaf': 2, 'min_weight_fraction_leaf': 0.20282075413611184, 'min_impurity_decrease': 0.048335347319933025, 'max_features': 0.9378287646016614, 'subsample': 0.39217871569012686, 'dropout_rate': 0.871642915882044, 'ccp_alpha': 0.012659874507615118}. Best is trial 249 with value: 0.8196153157527369.[0m
[32m[I 2022-05-10 10:21:57,503][0m Trial 252 finished with value: 0.8207210655554549 and parameters: {'loss': 'coxph', 'learning_rate': 1.4810002409191362e-05, 'n_estimators': 942, 'criterion': 'friedman_mse', 'min_samples_split': 8, 'min_samples_leaf': 2, 'min_weight_fraction_leaf': 0.18621295845516136, 'min_impurity_decrease': 0.031662768833594285, 'max_features': 0.930681151677018, 'subsample': 0.36696905283287723, 'dropout_rate': 0.84933373754842, 'ccp_alpha': 0.006045991990530405}. Best is trial 252 with value: 0.8207210655554549.[0m
/media/san2_ssd/data/Workdir/survival/venv/lib/python3.8/site-packages/sksurv/ensemble/boosting.py:955: RuntimeWarning: divide by zero encountered in log
  time = numpy.log(time)
/media/san2_ssd/data/Workdir/survival/venv/lib/python3.8/site-packages/sksurv/ensemble/boosting.py:955: RuntimeWarning: divide by zero encountered in log
  time = numpy.log(time)
/media/san2_ssd/data/Workdir/survival/venv/lib/python3.8/site-packages/sksurv/ensemble/boosting.py:955: RuntimeWarning: divide by zero encountered in log
  time = numpy.log(time)
/media/san2_ssd/data/Workdir/survival/venv/lib/python3.8/site-packages/sksurv/ensemble/boosting.py:955: RuntimeWarning: divide by zero encountered in log
  time = numpy.log(time)
/media/san2_ssd/data/Workdir/survival/venv/lib/python3.8/site-packages/sksurv/ensemble/boosting.py:955: RuntimeWarning: divide by zero encountered in log
  time = numpy.log(time)
[32m[I 2022-05-10 10:21:57,556][0m Trial 253 finished with value: -1.0 and parameters: {'loss': 'squared', 'learning_rate': 1.8829587144624575e-05, 'n_estimators': 942, 'criterion': 'friedman_mse', 'min_samples_split': 7, 'min_samples_leaf': 2, 'min_weight_fraction_leaf': 0.18636218921823025, 'min_impurity_decrease': 0.03283511193908166, 'max_features': 0.9241621286929139, 'subsample': 0.34854237457297504, 'dropout_rate': 0.8398442215627355, 'ccp_alpha': 0.01544414328808797}. Best is trial 252 with value: 0.8207210655554549.[0m
[32m[I 2022-05-10 10:56:20,635][0m Trial 254 finished with value: 0.8098570383284937 and parameters: {'loss': 'coxph', 'learning_rate': 1.3994574565034903e-05, 'n_estimators': 937, 'criterion': 'friedman_mse', 'min_samples_split': 8, 'min_samples_leaf': 2, 'min_weight_fraction_leaf': 0.2142824987244492, 'min_impurity_decrease': 0.05386945416614697, 'max_features': 0.9384788729965245, 'subsample': 0.3778131079398973, 'dropout_rate': 0.8538488053003929, 'ccp_alpha': 0.008546068887931111}. Best is trial 252 with value: 0.8207210655554549.[0m
[32m[I 2022-05-10 11:30:52,265][0m Trial 255 finished with value: 0.8209934684194824 and parameters: {'loss': 'coxph', 'learning_rate': 1.4744640672663973e-05, 'n_estimators': 937, 'criterion': 'friedman_mse', 'min_samples_split': 8, 'min_samples_leaf': 2, 'min_weight_fraction_leaf': 0.19233668643346494, 'min_impurity_decrease': 0.05298663560643496, 'max_features': 0.9300443615970044, 'subsample': 0.38038257446955515, 'dropout_rate': 0.8490020003049993, 'ccp_alpha': 0.004228858368953147}. Best is trial 255 with value: 0.8209934684194824.[0m
[32m[I 2022-05-10 12:04:59,586][0m Trial 256 finished with value: 0.8185299077879808 and parameters: {'loss': 'coxph', 'learning_rate': 1.656224358333417e-05, 'n_estimators': 928, 'criterion': 'friedman_mse', 'min_samples_split': 8, 'min_samples_leaf': 2, 'min_weight_fraction_leaf': 0.18671451864249597, 'min_impurity_decrease': 0.017338164712935478, 'max_features': 0.9274209390859013, 'subsample': 0.38079840298385004, 'dropout_rate': 0.8472402632514195, 'ccp_alpha': 0.011388267340506734}. Best is trial 255 with value: 0.8209934684194824.[0m
[32m[I 2022-05-10 12:39:09,579][0m Trial 257 finished with value: 0.8207717886182204 and parameters: {'loss': 'coxph', 'learning_rate': 1.4696047573233155e-05, 'n_estimators': 929, 'criterion': 'friedman_mse', 'min_samples_split': 8, 'min_samples_leaf': 2, 'min_weight_fraction_leaf': 0.1882472582267039, 'min_impurity_decrease': 0.02010197273779947, 'max_features': 0.9232148990208813, 'subsample': 0.38026038534528195, 'dropout_rate': 0.846657216560058, 'ccp_alpha': 0.008248796521119756}. Best is trial 255 with value: 0.8209934684194824.[0m
[32m[I 2022-05-10 13:13:10,703][0m Trial 258 finished with value: 0.8225696861210512 and parameters: {'loss': 'coxph', 'learning_rate': 1.4439314047805253e-05, 'n_estimators': 923, 'criterion': 'friedman_mse', 'min_samples_split': 8, 'min_samples_leaf': 2, 'min_weight_fraction_leaf': 0.18730126718907858, 'min_impurity_decrease': 0.028161950582471878, 'max_features': 0.9201151080481469, 'subsample': 0.3770841914527615, 'dropout_rate': 0.8518750314479, 'ccp_alpha': 0.0023102414224661846}. Best is trial 258 with value: 0.8225696861210512.[0m
[32m[I 2022-05-10 13:47:55,798][0m Trial 259 finished with value: 0.821591195201219 and parameters: {'loss': 'coxph', 'learning_rate': 1.6429391303804183e-05, 'n_estimators': 917, 'criterion': 'friedman_mse', 'min_samples_split': 8, 'min_samples_leaf': 2, 'min_weight_fraction_leaf': 0.18646508420572971, 'min_impurity_decrease': 0.017201176353679556, 'max_features': 0.9159028156350407, 'subsample': 0.36110052901828615, 'dropout_rate': 0.8076505395952862, 'ccp_alpha': 0.006951952973077796}. Best is trial 258 with value: 0.8225696861210512.[0m
[32m[I 2022-05-10 14:22:17,404][0m Trial 260 finished with value: 0.8222072884706918 and parameters: {'loss': 'coxph', 'learning_rate': 1.578995628506248e-05, 'n_estimators': 920, 'criterion': 'friedman_mse', 'min_samples_split': 8, 'min_samples_leaf': 2, 'min_weight_fraction_leaf': 0.18871005331938792, 'min_impurity_decrease': 0.018936553642826925, 'max_features': 0.9192389222081544, 'subsample': 0.3627949239111181, 'dropout_rate': 0.8423268765059369, 'ccp_alpha': 0.0024891531475345376}. Best is trial 258 with value: 0.8225696861210512.[0m
[32m[I 2022-05-10 14:56:36,713][0m Trial 261 finished with value: 0.7628533044152672 and parameters: {'loss': 'coxph', 'learning_rate': 1.6249495265238207e-05, 'n_estimators': 918, 'criterion': 'friedman_mse', 'min_samples_split': 8, 'min_samples_leaf': 2, 'min_weight_fraction_leaf': 0.18724968851679344, 'min_impurity_decrease': 0.020379728166000394, 'max_features': 0.9187712555443898, 'subsample': 0.36328927738655814, 'dropout_rate': 0.8092301987627479, 'ccp_alpha': 0.22815508752803965}. Best is trial 258 with value: 0.8225696861210512.[0m
[32m[I 2022-05-10 15:31:42,411][0m Trial 262 finished with value: 0.7626005050712699 and parameters: {'loss': 'coxph', 'learning_rate': 1.8278137538743636e-05, 'n_estimators': 920, 'criterion': 'friedman_mse', 'min_samples_split': 7, 'min_samples_leaf': 2, 'min_weight_fraction_leaf': 0.17335883726664025, 'min_impurity_decrease': 0.0062692449518266385, 'max_features': 0.9063561967209748, 'subsample': 0.3285597182058334, 'dropout_rate': 0.8348438755015419, 'ccp_alpha': 0.1933931727198548}. Best is trial 258 with value: 0.8225696861210512.[0m
[32m[I 2022-05-10 16:05:13,103][0m Trial 263 finished with value: 0.7628533044152672 and parameters: {'loss': 'coxph', 'learning_rate': 2.2614825252504144e-05, 'n_estimators': 921, 'criterion': 'friedman_mse', 'min_samples_split': 8, 'min_samples_leaf': 2, 'min_weight_fraction_leaf': 0.18882547859083773, 'min_impurity_decrease': 0.03519589546557002, 'max_features': 0.9257990887809052, 'subsample': 0.38202178889849003, 'dropout_rate': 0.8483648856025829, 'ccp_alpha': 0.21002019337390623}. Best is trial 258 with value: 0.8225696861210512.[0m
[32m[I 2022-05-10 16:39:26,946][0m Trial 264 finished with value: 0.8217700831191113 and parameters: {'loss': 'coxph', 'learning_rate': 1.569113001893739e-05, 'n_estimators': 882, 'criterion': 'friedman_mse', 'min_samples_split': 8, 'min_samples_leaf': 2, 'min_weight_fraction_leaf': 0.1615745865341756, 'min_impurity_decrease': 0.025751024734359574, 'max_features': 0.9288392472406376, 'subsample': 0.3385503002526525, 'dropout_rate': 0.7846086588963819, 'ccp_alpha': 0.008349916275252717}. Best is trial 258 with value: 0.8225696861210512.[0m
[32m[I 2022-05-10 17:21:14,141][0m Trial 265 finished with value: 0.8189820641750958 and parameters: {'loss': 'coxph', 'learning_rate': 1.461637207271653e-05, 'n_estimators': 866, 'criterion': 'absolute_error', 'min_samples_split': 8, 'min_samples_leaf': 2, 'min_weight_fraction_leaf': 0.1817105349868265, 'min_impurity_decrease': 0.025818585231659964, 'max_features': 0.9026391148056019, 'subsample': 0.33324796132636075, 'dropout_rate': 0.8256751943375955, 'ccp_alpha': 0.0027949727183085443}. Best is trial 258 with value: 0.8225696861210512.[0m
[32m[I 2022-05-10 18:04:07,351][0m Trial 266 finished with value: 0.8167353942692592 and parameters: {'loss': 'coxph', 'learning_rate': 1.497235475811148e-05, 'n_estimators': 866, 'criterion': 'absolute_error', 'min_samples_split': 8, 'min_samples_leaf': 2, 'min_weight_fraction_leaf': 0.1602103077340586, 'min_impurity_decrease': 0.030630433682076384, 'max_features': 0.9019511081739421, 'subsample': 0.33068209961625744, 'dropout_rate': 0.7869229672163962, 'ccp_alpha': 0.008242376852596886}. Best is trial 258 with value: 0.8225696861210512.[0m
[32m[I 2022-05-10 18:46:30,133][0m Trial 267 finished with value: 0.7417854369583767 and parameters: {'loss': 'coxph', 'learning_rate': 1.5089552762454724e-05, 'n_estimators': 865, 'criterion': 'absolute_error', 'min_samples_split': 8, 'min_samples_leaf': 2, 'min_weight_fraction_leaf': 0.16462407360005035, 'min_impurity_decrease': 0.02791541147614631, 'max_features': 0.8973016659255776, 'subsample': 0.32591607810337786, 'dropout_rate': 0.7844018343825234, 'ccp_alpha': 0.19286600906097354}. Best is trial 258 with value: 0.8225696861210512.[0m
[32m[I 2022-05-10 19:27:51,165][0m Trial 268 finished with value: 0.7417928129963759 and parameters: {'loss': 'coxph', 'learning_rate': 1.4784636244351982e-05, 'n_estimators': 870, 'criterion': 'absolute_error', 'min_samples_split': 8, 'min_samples_leaf': 2, 'min_weight_fraction_leaf': 0.18416632197396754, 'min_impurity_decrease': 0.0016322248970819745, 'max_features': 0.9243036964389729, 'subsample': 0.3027129619259731, 'dropout_rate': 0.8191666865067588, 'ccp_alpha': 0.2006444591884734}. Best is trial 258 with value: 0.8225696861210512.[0m
[32m[I 2022-05-10 20:10:59,239][0m Trial 269 finished with value: 0.8129607792743079 and parameters: {'loss': 'coxph', 'learning_rate': 1.9438351589259127e-05, 'n_estimators': 876, 'criterion': 'absolute_error', 'min_samples_split': 8, 'min_samples_leaf': 2, 'min_weight_fraction_leaf': 0.14063383938713836, 'min_impurity_decrease': 0.04129151789108295, 'max_features': 0.9061802098363518, 'subsample': 0.35208527475539575, 'dropout_rate': 0.8594720737958462, 'ccp_alpha': 0.006248693420948773}. Best is trial 258 with value: 0.8225696861210512.[0m
[32m[I 2022-05-10 20:53:38,299][0m Trial 270 finished with value: 0.81415928901122 and parameters: {'loss': 'coxph', 'learning_rate': 2.0221530824316338e-05, 'n_estimators': 868, 'criterion': 'absolute_error', 'min_samples_split': 8, 'min_samples_leaf': 2, 'min_weight_fraction_leaf': 0.16158261809453683, 'min_impurity_decrease': 0.038432580744319295, 'max_features': 0.904910771151096, 'subsample': 0.35675543983543684, 'dropout_rate': 0.8666692882567527, 'ccp_alpha': 0.0032090228086149855}. Best is trial 258 with value: 0.8225696861210512.[0m
[32m[I 2022-05-10 21:36:56,554][0m Trial 271 finished with value: 0.5 and parameters: {'loss': 'coxph', 'learning_rate': 2.172804085513476e-05, 'n_estimators': 869, 'criterion': 'absolute_error', 'min_samples_split': 8, 'min_samples_leaf': 2, 'min_weight_fraction_leaf': 0.13208754808371673, 'min_impurity_decrease': 0.02150145678543398, 'max_features': 0.9070757758406259, 'subsample': 0.3484732588354477, 'dropout_rate': 0.7945682353233897, 'ccp_alpha': 3.7948800111736847}. Best is trial 258 with value: 0.8225696861210512.[0m
[32m[I 2022-05-10 22:20:31,558][0m Trial 272 finished with value: 0.740309912250767 and parameters: {'loss': 'coxph', 'learning_rate': 1.990690749134655e-05, 'n_estimators': 884, 'criterion': 'absolute_error', 'min_samples_split': 8, 'min_samples_leaf': 2, 'min_weight_fraction_leaf': 0.17917328045281564, 'min_impurity_decrease': 0.03148854935664729, 'max_features': 0.897469992912621, 'subsample': 0.35968747320957634, 'dropout_rate': 0.7680429363342071, 'ccp_alpha': 0.2112032050380383}. Best is trial 258 with value: 0.8225696861210512.[0m
/media/san2_ssd/data/Workdir/survival/venv/lib/python3.8/site-packages/sksurv/ensemble/boosting.py:955: RuntimeWarning: divide by zero encountered in log
  time = numpy.log(time)
/media/san2_ssd/data/Workdir/survival/venv/lib/python3.8/site-packages/sksurv/ensemble/boosting.py:955: RuntimeWarning: divide by zero encountered in log
  time = numpy.log(time)
/media/san2_ssd/data/Workdir/survival/venv/lib/python3.8/site-packages/sksurv/ensemble/boosting.py:955: RuntimeWarning: divide by zero encountered in log
  time = numpy.log(time)
/media/san2_ssd/data/Workdir/survival/venv/lib/python3.8/site-packages/sksurv/ensemble/boosting.py:955: RuntimeWarning: divide by zero encountered in log
  time = numpy.log(time)
/media/san2_ssd/data/Workdir/survival/venv/lib/python3.8/site-packages/sksurv/ensemble/boosting.py:955: RuntimeWarning: divide by zero encountered in log
  time = numpy.log(time)
[32m[I 2022-05-10 22:20:31,614][0m Trial 273 finished with value: -1.0 and parameters: {'loss': 'squared', 'learning_rate': 1.8172632343742538e-05, 'n_estimators': 907, 'criterion': 'absolute_error', 'min_samples_split': 8, 'min_samples_leaf': 2, 'min_weight_fraction_leaf': 0.16593237135340919, 'min_impurity_decrease': 0.10251525639873622, 'max_features': 0.9209611160951178, 'subsample': 0.3147663654037425, 'dropout_rate': 0.8130254017996791, 'ccp_alpha': 0.19918258536019626}. Best is trial 258 with value: 0.8225696861210512.[0m
[32m[I 2022-05-10 23:00:23,055][0m Trial 274 finished with value: 0.8172893907452344 and parameters: {'loss': 'coxph', 'learning_rate': 2.5772425973139137e-05, 'n_estimators': 858, 'criterion': 'absolute_error', 'min_samples_split': 7, 'min_samples_leaf': 2, 'min_weight_fraction_leaf': 0.1923618643213059, 'min_impurity_decrease': 0.03992034324247966, 'max_features': 0.9246258938667717, 'subsample': 0.2703024234106549, 'dropout_rate': 0.8708028290211913, 'ccp_alpha': 0.00718721093899408}. Best is trial 258 with value: 0.8225696861210512.[0m
[32m[I 2022-05-10 23:41:15,492][0m Trial 275 finished with value: 0.817295606226323 and parameters: {'loss': 'coxph', 'learning_rate': 2.5444929130732028e-05, 'n_estimators': 875, 'criterion': 'absolute_error', 'min_samples_split': 7, 'min_samples_leaf': 2, 'min_weight_fraction_leaf': 0.19251652106344022, 'min_impurity_decrease': 0.03981101471887708, 'max_features': 0.9078835196005082, 'subsample': 0.28400830148336803, 'dropout_rate': 0.8663725498173893, 'ccp_alpha': 0.005726034660440643}. Best is trial 258 with value: 0.8225696861210512.[0m
[32m[I 2022-05-11 00:21:14,740][0m Trial 276 finished with value: 0.817231232439557 and parameters: {'loss': 'coxph', 'learning_rate': 2.5025372120529085e-05, 'n_estimators': 860, 'criterion': 'absolute_error', 'min_samples_split': 7, 'min_samples_leaf': 2, 'min_weight_fraction_leaf': 0.19149774152846658, 'min_impurity_decrease': 0.03922442901771195, 'max_features': 0.9178741396320631, 'subsample': 0.2543515610970936, 'dropout_rate': 0.86368844042628, 'ccp_alpha': 0.0014861757272642123}. Best is trial 258 with value: 0.8225696861210512.[0m
[32m[I 2022-05-11 01:01:30,605][0m Trial 277 finished with value: 0.7430620677571902 and parameters: {'loss': 'coxph', 'learning_rate': 2.8200794288508424e-05, 'n_estimators': 858, 'criterion': 'absolute_error', 'min_samples_split': 7, 'min_samples_leaf': 2, 'min_weight_fraction_leaf': 0.14040751431813786, 'min_impurity_decrease': 0.016213036151635867, 'max_features': 0.8932680067765586, 'subsample': 0.2604730002013246, 'dropout_rate': 0.8695969826231398, 'ccp_alpha': 0.1969251224769846}. Best is trial 258 with value: 0.8225696861210512.[0m
[32m[I 2022-05-11 01:44:27,875][0m Trial 278 finished with value: 0.8152628293609278 and parameters: {'loss': 'coxph', 'learning_rate': 3.2314799044316915e-05, 'n_estimators': 856, 'criterion': 'absolute_error', 'min_samples_split': 7, 'min_samples_leaf': 2, 'min_weight_fraction_leaf': 0.15564929733571692, 'min_impurity_decrease': 0.03818276734502971, 'max_features': 0.9144904325025329, 'subsample': 0.3708351494284358, 'dropout_rate': 0.8589907260771634, 'ccp_alpha': 0.005547434279057668}. Best is trial 258 with value: 0.8225696861210512.[0m
[32m[I 2022-05-11 02:24:11,810][0m Trial 279 finished with value: 0.5 and parameters: {'loss': 'coxph', 'learning_rate': 3.3228663343733595e-05, 'n_estimators': 849, 'criterion': 'absolute_error', 'min_samples_split': 7, 'min_samples_leaf': 2, 'min_weight_fraction_leaf': 0.189891221429298, 'min_impurity_decrease': 0.03443858834616119, 'max_features': 0.922773315939836, 'subsample': 0.28860525657579866, 'dropout_rate': 0.8236899748052439, 'ccp_alpha': 3.130221920245227}. Best is trial 258 with value: 0.8225696861210512.[0m
[32m[I 2022-05-11 03:04:32,670][0m Trial 280 finished with value: 0.7430636356070043 and parameters: {'loss': 'coxph', 'learning_rate': 2.4591992370852643e-05, 'n_estimators': 857, 'criterion': 'absolute_error', 'min_samples_split': 7, 'min_samples_leaf': 2, 'min_weight_fraction_leaf': 0.15552969897393384, 'min_impurity_decrease': 0.007361167750062129, 'max_features': 0.9169765380706044, 'subsample': 0.2553038617198498, 'dropout_rate': 0.8665411629472246, 'ccp_alpha': 0.174194879635727}. Best is trial 258 with value: 0.8225696861210512.[0m
[32m[I 2022-05-11 03:48:38,287][0m Trial 281 finished with value: 0.73990673841948 and parameters: {'loss': 'coxph', 'learning_rate': 2.429587359365348e-05, 'n_estimators': 904, 'criterion': 'absolute_error', 'min_samples_split': 7, 'min_samples_leaf': 2, 'min_weight_fraction_leaf': 0.19314938228818251, 'min_impurity_decrease': 0.03547196605199353, 'max_features': 0.8839460919922976, 'subsample': 0.3731362048926871, 'dropout_rate': 0.8403237966222826, 'ccp_alpha': 0.18790267863815455}. Best is trial 258 with value: 0.8225696861210512.[0m
[32m[I 2022-05-11 04:31:08,071][0m Trial 282 finished with value: 0.7418113213616025 and parameters: {'loss': 'coxph', 'learning_rate': 1.6777028058260443e-05, 'n_estimators': 900, 'criterion': 'absolute_error', 'min_samples_split': 7, 'min_samples_leaf': 2, 'min_weight_fraction_leaf': 0.16713052491066924, 'min_impurity_decrease': 0.024025487959340938, 'max_features': 0.9274860195364646, 'subsample': 0.28536796439759643, 'dropout_rate': 0.8818730197524829, 'ccp_alpha': 0.17687442339498588}. Best is trial 258 with value: 0.8225696861210512.[0m
[32m[I 2022-05-11 05:11:56,109][0m Trial 283 finished with value: 0.8407903835327689 and parameters: {'loss': 'coxph', 'learning_rate': 1.572276621036692e-05, 'n_estimators': 855, 'criterion': 'absolute_error', 'min_samples_split': 7, 'min_samples_leaf': 2, 'min_weight_fraction_leaf': 0.1765304751590074, 'min_impurity_decrease': 0.00220694954843758, 'max_features': 0.9064662765529572, 'subsample': 0.23977835628602492, 'dropout_rate': 0.7996450409546699, 'ccp_alpha': 0.0054047616374525735}. Best is trial 283 with value: 0.8407903835327689.[0m
[32m[I 2022-05-11 05:56:43,127][0m Trial 284 finished with value: 0.8394175419279764 and parameters: {'loss': 'coxph', 'learning_rate': 1.4899448640551539e-05, 'n_estimators': 913, 'criterion': 'absolute_error', 'min_samples_split': 7, 'min_samples_leaf': 2, 'min_weight_fraction_leaf': 0.17602093108205916, 'min_impurity_decrease': 0.0016439963175203997, 'max_features': 0.9320517409492273, 'subsample': 0.2286877154208842, 'dropout_rate': 0.7505188938339481, 'ccp_alpha': 0.0010214773063019012}. Best is trial 283 with value: 0.8407903835327689.[0m
[32m[I 2022-05-11 06:40:04,279][0m Trial 285 finished with value: 0.8408994882022112 and parameters: {'loss': 'coxph', 'learning_rate': 1.5136849884342692e-05, 'n_estimators': 903, 'criterion': 'absolute_error', 'min_samples_split': 7, 'min_samples_leaf': 2, 'min_weight_fraction_leaf': 0.1768857100532132, 'min_impurity_decrease': 0.004673880908316963, 'max_features': 0.9237468057370685, 'subsample': 0.2380212272076106, 'dropout_rate': 0.8005116790269571, 'ccp_alpha': 0.00240787843932071}. Best is trial 285 with value: 0.8408994882022112.[0m
[32m[I 2022-05-11 07:24:16,597][0m Trial 286 finished with value: 0.748916079689564 and parameters: {'loss': 'coxph', 'learning_rate': 1.5620353826933545e-05, 'n_estimators': 917, 'criterion': 'absolute_error', 'min_samples_split': 7, 'min_samples_leaf': 2, 'min_weight_fraction_leaf': 0.18054741683983364, 'min_impurity_decrease': 0.005156233397129666, 'max_features': 0.928282770221969, 'subsample': 0.21502358322757484, 'dropout_rate': 0.7418891642187833, 'ccp_alpha': 0.17700669018014914}. Best is trial 285 with value: 0.8408994882022112.[0m
