[32m[I 2022-04-21 18:19:21,092][0m Trial 999 finished with value: 0.7941913163037727 and parameters: {'splitter': 'random', 'min_samples_split': 0.16706270227161998, 'min_samples_leaf': 0.017672126448863575, 'min_weight_fraction_leaf': 0.06491919152064823, 'max_features': 0.9743032321312087}. Best is trial 987 with value: 0.814216204003355.[0m
SurvivalTree
Running Optimizer with LogRank binary scoring
{'splitter': 'random', 'min_samples_split': 0.055712934537462955, 'min_samples_leaf': 0.03408515454971367, 'min_weight_fraction_leaf': 0.02670977990584805, 'max_features': 0.922010288159367, 'UnoC_LR': 0.9113497956229912}
Running Optimizer normaly
{'splitter': 'random', 'min_samples_split': 0.16757347345383158, 'min_samples_leaf': 0.016931189695610048, 'min_weight_fraction_leaf': 0.06830819473749297, 'max_features': 0.929829119479573, 'UnoC': 0.814216204003355}
