[32m[I 2022-05-19 06:51:32,627][0m Trial 841 finished with value: 0.8003094992426105 and parameters: {'loss': 'coxph', 'learning_rate': 0.06349369109674476, 'n_estimators': 130, 'criterion': 'friedman_mse', 'min_samples_split': 2, 'min_samples_leaf': 4, 'min_weight_fraction_leaf': 0.04487861305095077, 'min_impurity_decrease': 0.6531842260246883, 'max_features': 0.4751944300225485, 'subsample': 0.08417313868137963, 'dropout_rate': 0.02238305205938659, 'ccp_alpha': 0.09653170555360269}. Best is trial 759 with value: 0.8618735483942033.[0m
[32m[I 2022-05-19 06:57:45,257][0m Trial 842 finished with value: 0.7620429557362783 and parameters: {'loss': 'coxph', 'learning_rate': 0.0791023033618086, 'n_estimators': 138, 'criterion': 'friedman_mse', 'min_samples_split': 2, 'min_samples_leaf': 4, 'min_weight_fraction_leaf': 0.037092426614406544, 'min_impurity_decrease': 0.6779237543060749, 'max_features': 0.6318007871125748, 'subsample': 0.0954097510624147, 'dropout_rate': 0.0001866137677617826, 'ccp_alpha': 0.22049590362335858}. Best is trial 759 with value: 0.8618735483942033.[0m
[32m[I 2022-05-19 07:03:29,764][0m Trial 843 finished with value: 0.8540449595068977 and parameters: {'loss': 'coxph', 'learning_rate': 0.0551980049845526, 'n_estimators': 125, 'criterion': 'friedman_mse', 'min_samples_split': 3, 'min_samples_leaf': 4, 'min_weight_fraction_leaf': 0.016165885705040853, 'min_impurity_decrease': 0.6384422125012572, 'max_features': 0.467472666900235, 'subsample': 0.08289499437698933, 'dropout_rate': 0.02033406553231238, 'ccp_alpha': 0.0012446839941067254}. Best is trial 759 with value: 0.8618735483942033.[0m
[32m[I 2022-05-19 07:08:42,605][0m Trial 844 finished with value: 0.5 and parameters: {'loss': 'coxph', 'learning_rate': 0.03691321457029424, 'n_estimators': 119, 'criterion': 'friedman_mse', 'min_samples_split': 2, 'min_samples_leaf': 4, 'min_weight_fraction_leaf': 0.027621367479740592, 'min_impurity_decrease': 0.6271086099622835, 'max_features': 0.49831757248094843, 'subsample': 0.11023455622148094, 'dropout_rate': 0.04269983643909664, 'ccp_alpha': 4.1596169251903605}. Best is trial 759 with value: 0.8618735483942033.[0m
[32m[I 2022-05-19 07:14:55,425][0m Trial 845 finished with value: 0.7988232731592523 and parameters: {'loss': 'coxph', 'learning_rate': 0.048729211840644146, 'n_estimators': 136, 'criterion': 'friedman_mse', 'min_samples_split': 2, 'min_samples_leaf': 4, 'min_weight_fraction_leaf': 0.04810969499787393, 'min_impurity_decrease': 0.6562211808017501, 'max_features': 0.5172423569143811, 'subsample': 0.08338986343372823, 'dropout_rate': 0.018409549209860286, 'ccp_alpha': 0.09573962145590276}. Best is trial 759 with value: 0.8618735483942033.[0m
[32m[I 2022-05-19 07:20:15,248][0m Trial 846 finished with value: 0.7631723301163886 and parameters: {'loss': 'coxph', 'learning_rate': 0.06263691702788735, 'n_estimators': 122, 'criterion': 'friedman_mse', 'min_samples_split': 2, 'min_samples_leaf': 4, 'min_weight_fraction_leaf': 0.038903549600869364, 'min_impurity_decrease': 0.6112001004979809, 'max_features': 0.5924711833321711, 'subsample': 0.11962490516382, 'dropout_rate': 0.030574494965108015, 'ccp_alpha': 0.17278677262901054}. Best is trial 759 with value: 0.8618735483942033.[0m
[32m[I 2022-05-19 07:26:56,992][0m Trial 847 finished with value: 0.8535001239105187 and parameters: {'loss': 'coxph', 'learning_rate': 0.031090654333318046, 'n_estimators': 147, 'criterion': 'friedman_mse', 'min_samples_split': 2, 'min_samples_leaf': 4, 'min_weight_fraction_leaf': 0.001920964620482024, 'min_impurity_decrease': 0.685003695375623, 'max_features': 0.4082241434218798, 'subsample': 0.09691144506792906, 'dropout_rate': 0.0005519928403402287, 'ccp_alpha': 0.00267502106522932}. Best is trial 759 with value: 0.8618735483942033.[0m
[32m[I 2022-05-19 07:31:55,022][0m Trial 848 finished with value: 0.7391284034784593 and parameters: {'loss': 'coxph', 'learning_rate': 0.08124092652333315, 'n_estimators': 116, 'criterion': 'friedman_mse', 'min_samples_split': 2, 'min_samples_leaf': 4, 'min_weight_fraction_leaf': 0.026320120555210658, 'min_impurity_decrease': 0.6392131466553184, 'max_features': 0.6158281257046376, 'subsample': 0.130432327020733, 'dropout_rate': 0.05391013300096664, 'ccp_alpha': 0.34573242596392456}. Best is trial 759 with value: 0.8618735483942033.[0m
/media/san2_ssd/data/Workdir/survival/venv/lib/python3.8/site-packages/sksurv/ensemble/boosting.py:955: RuntimeWarning: divide by zero encountered in log
  time = numpy.log(time)
/media/san2_ssd/data/Workdir/survival/venv/lib/python3.8/site-packages/sksurv/ensemble/boosting.py:955: RuntimeWarning: divide by zero encountered in log
  time = numpy.log(time)
/media/san2_ssd/data/Workdir/survival/venv/lib/python3.8/site-packages/sksurv/ensemble/boosting.py:955: RuntimeWarning: divide by zero encountered in log
  time = numpy.log(time)
/media/san2_ssd/data/Workdir/survival/venv/lib/python3.8/site-packages/sksurv/ensemble/boosting.py:955: RuntimeWarning: divide by zero encountered in log
  time = numpy.log(time)
/media/san2_ssd/data/Workdir/survival/venv/lib/python3.8/site-packages/sksurv/ensemble/boosting.py:955: RuntimeWarning: divide by zero encountered in log
  time = numpy.log(time)
[32m[I 2022-05-19 07:31:55,107][0m Trial 849 finished with value: -1.0 and parameters: {'loss': 'squared', 'learning_rate': 0.04352218433306976, 'n_estimators': 129, 'criterion': 'friedman_mse', 'min_samples_split': 3, 'min_samples_leaf': 4, 'min_weight_fraction_leaf': 0.012689157190305455, 'min_impurity_decrease': 0.6603604642653442, 'max_features': 0.4468769024626843, 'subsample': 0.1152888331803457, 'dropout_rate': 0.020732911471872215, 'ccp_alpha': 0.09572273351921552}. Best is trial 759 with value: 0.8618735483942033.[0m
[32m[I 2022-05-19 07:36:56,657][0m Trial 850 finished with value: 0.8542101193148879 and parameters: {'loss': 'coxph', 'learning_rate': 0.026063384000777762, 'n_estimators': 110, 'criterion': 'friedman_mse', 'min_samples_split': 2, 'min_samples_leaf': 4, 'min_weight_fraction_leaf': 0.03676476472554694, 'min_impurity_decrease': 0.6078573674607498, 'max_features': 0.5377917320012292, 'subsample': 0.08371486749316101, 'dropout_rate': 0.00011586906068561734, 'ccp_alpha': 0.001238525935139192}. Best is trial 759 with value: 0.8618735483942033.[0m
[32m[I 2022-05-19 07:45:10,196][0m Trial 851 finished with value: 0.7591185971404509 and parameters: {'loss': 'coxph', 'learning_rate': 0.05672080246022515, 'n_estimators': 188, 'criterion': 'friedman_mse', 'min_samples_split': 3, 'min_samples_leaf': 4, 'min_weight_fraction_leaf': 0.02054820568778254, 'min_impurity_decrease': 0.6293789767634956, 'max_features': 0.5752133474133602, 'subsample': 0.13209127485790467, 'dropout_rate': 0.03698804947541221, 'ccp_alpha': 0.234130402642901}. Best is trial 759 with value: 0.8618735483942033.[0m
[32m[I 2022-05-19 07:51:11,346][0m Trial 852 finished with value: 0.8544937338121802 and parameters: {'loss': 'coxph', 'learning_rate': 0.03606565684368245, 'n_estimators': 134, 'criterion': 'friedman_mse', 'min_samples_split': 3, 'min_samples_leaf': 4, 'min_weight_fraction_leaf': 0.048009916426391276, 'min_impurity_decrease': 0.5937338253479423, 'max_features': 0.5485396284315266, 'subsample': 0.10544081542124298, 'dropout_rate': 0.020720412062989146, 'ccp_alpha': 0.002204568804335641}. Best is trial 759 with value: 0.8618735483942033.[0m
[32m[I 2022-05-19 07:56:28,420][0m Trial 853 finished with value: 0.7624561548597544 and parameters: {'loss': 'coxph', 'learning_rate': 0.08115817093305823, 'n_estimators': 125, 'criterion': 'friedman_mse', 'min_samples_split': 2, 'min_samples_leaf': 4, 'min_weight_fraction_leaf': 0.029132126719122166, 'min_impurity_decrease': 0.6468358870619166, 'max_features': 0.5867296420357553, 'subsample': 0.1476624956230503, 'dropout_rate': 0.0556108459007259, 'ccp_alpha': 0.15954688368586015}. Best is trial 759 with value: 0.8618735483942033.[0m
[32m[I 2022-05-19 08:01:22,278][0m Trial 854 finished with value: 0.7967046398878544 and parameters: {'loss': 'coxph', 'learning_rate': 0.04582695608131113, 'n_estimators': 114, 'criterion': 'friedman_mse', 'min_samples_split': 3, 'min_samples_leaf': 4, 'min_weight_fraction_leaf': 0.014590174580334016, 'min_impurity_decrease': 0.6736123653205616, 'max_features': 0.5668187801635973, 'subsample': 0.13110436333997721, 'dropout_rate': 0.03818802004684883, 'ccp_alpha': 0.09575468241144479}. Best is trial 759 with value: 0.8618735483942033.[0m
[32m[I 2022-05-19 08:06:04,136][0m Trial 855 finished with value: 0.7906634132224155 and parameters: {'loss': 'coxph', 'learning_rate': 0.0629742865067822, 'n_estimators': 106, 'criterion': 'friedman_mse', 'min_samples_split': 3, 'min_samples_leaf': 4, 'min_weight_fraction_leaf': 0.03693281448747807, 'min_impurity_decrease': 0.6205334409302194, 'max_features': 0.6318231991508372, 'subsample': 0.10198401885403596, 'dropout_rate': 0.017210439320141595, 'ccp_alpha': 0.09338605183929076}. Best is trial 759 with value: 0.8618735483942033.[0m
[32m[I 2022-05-19 08:11:19,899][0m Trial 856 finished with value: 0.7630396873302312 and parameters: {'loss': 'coxph', 'learning_rate': 0.019720506430225104, 'n_estimators': 121, 'criterion': 'friedman_mse', 'min_samples_split': 3, 'min_samples_leaf': 4, 'min_weight_fraction_leaf': 0.0011034920191094234, 'min_impurity_decrease': 0.5852455742326798, 'max_features': 0.5056520559985749, 'subsample': 0.11911496056711664, 'dropout_rate': 0.07783073819155345, 'ccp_alpha': 0.23940634393170884}. Best is trial 759 with value: 0.8618735483942033.[0m
[32m[I 2022-05-19 08:17:18,632][0m Trial 857 finished with value: 0.7813299966205685 and parameters: {'loss': 'coxph', 'learning_rate': 0.09848392177036171, 'n_estimators': 131, 'criterion': 'friedman_mse', 'min_samples_split': 3, 'min_samples_leaf': 4, 'min_weight_fraction_leaf': 0.05015781053428603, 'min_impurity_decrease': 0.6440785221085885, 'max_features': 0.6093485920645639, 'subsample': 0.08170631784254977, 'dropout_rate': 0.036939092846961945, 'ccp_alpha': 0.10141129100333564}. Best is trial 759 with value: 0.8618735483942033.[0m
[32m[I 2022-05-19 08:22:23,387][0m Trial 858 finished with value: 0.8562352829226343 and parameters: {'loss': 'coxph', 'learning_rate': 0.032108322588652094, 'n_estimators': 117, 'criterion': 'friedman_mse', 'min_samples_split': 3, 'min_samples_leaf': 4, 'min_weight_fraction_leaf': 0.023602546098577575, 'min_impurity_decrease': 0.6121156856427427, 'max_features': 0.5341106981789545, 'subsample': 0.1315877685658685, 'dropout_rate': 0.0010615255567028338, 'ccp_alpha': 0.0012925891839288878}. Best is trial 759 with value: 0.8618735483942033.[0m
[32m[I 2022-05-19 08:27:16,002][0m Trial 859 finished with value: 0.7387659041638717 and parameters: {'loss': 'coxph', 'learning_rate': 0.040012383247173766, 'n_estimators': 116, 'criterion': 'friedman_mse', 'min_samples_split': 2, 'min_samples_leaf': 4, 'min_weight_fraction_leaf': 0.021734275722107968, 'min_impurity_decrease': 0.6936881061684435, 'max_features': 0.5322418978453392, 'subsample': 0.14720000326752217, 'dropout_rate': 0.013346901621812086, 'ccp_alpha': 0.3672114049056798}. Best is trial 759 with value: 0.8618735483942033.[0m
[32m[I 2022-05-19 08:31:50,476][0m Trial 860 finished with value: 0.5 and parameters: {'loss': 'coxph', 'learning_rate': 0.03242997301964787, 'n_estimators': 110, 'criterion': 'squared_error', 'min_samples_split': 3, 'min_samples_leaf': 4, 'min_weight_fraction_leaf': 0.010142655838175873, 'min_impurity_decrease': 0.6647936899728332, 'max_features': 0.48328486299138745, 'subsample': 0.15379665916439186, 'dropout_rate': 0.0004616824432129126, 'ccp_alpha': 0.17657679999789713}. Best is trial 759 with value: 0.8618735483942033.[0m
[32m[I 2022-05-19 08:37:08,427][0m Trial 861 finished with value: 0.807292375571033 and parameters: {'loss': 'coxph', 'learning_rate': 0.04967944648649654, 'n_estimators': 119, 'criterion': 'friedman_mse', 'min_samples_split': 3, 'min_samples_leaf': 4, 'min_weight_fraction_leaf': 0.030146171258297803, 'min_impurity_decrease': 0.6233938500448257, 'max_features': 0.5451145769534939, 'subsample': 0.10159321737194393, 'dropout_rate': 0.01784901783304092, 'ccp_alpha': 0.09220007687095151}. Best is trial 759 with value: 0.8618735483942033.[0m
[32m[I 2022-05-19 08:42:31,686][0m Trial 862 finished with value: 0.7491296785917656 and parameters: {'loss': 'coxph', 'learning_rate': 0.0673752221460676, 'n_estimators': 126, 'criterion': 'friedman_mse', 'min_samples_split': 3, 'min_samples_leaf': 4, 'min_weight_fraction_leaf': 0.018799015278315324, 'min_impurity_decrease': 0.5980404755616973, 'max_features': 0.5182462525324926, 'subsample': 0.13703814713036533, 'dropout_rate': 0.0012068689815367007, 'ccp_alpha': 0.2475414248081496}. Best is trial 759 with value: 0.8618735483942033.[0m
[32m[I 2022-05-19 08:49:36,538][0m Trial 863 finished with value: 0.8574330799279639 and parameters: {'loss': 'coxph', 'learning_rate': 0.05390396586561417, 'n_estimators': 158, 'criterion': 'friedman_mse', 'min_samples_split': 3, 'min_samples_leaf': 4, 'min_weight_fraction_leaf': 0.010318099521065589, 'min_impurity_decrease': 0.6402314214498807, 'max_features': 0.5606605325342119, 'subsample': 0.11661326753924624, 'dropout_rate': 0.03259480069193702, 'ccp_alpha': 0.0015326528536207854}. Best is trial 759 with value: 0.8618735483942033.[0m
[32m[I 2022-05-19 08:57:33,816][0m Trial 864 finished with value: 0.763971694763024 and parameters: {'loss': 'coxph', 'learning_rate': 0.053036254856323746, 'n_estimators': 173, 'criterion': 'friedman_mse', 'min_samples_split': 3, 'min_samples_leaf': 4, 'min_weight_fraction_leaf': 0.011114897645388425, 'min_impurity_decrease': 0.6523956210018129, 'max_features': 0.5682231636485963, 'subsample': 0.08485858627822486, 'dropout_rate': 0.03503076748694382, 'ccp_alpha': 0.17510009572505958}. Best is trial 759 with value: 0.8618735483942033.[0m
[32m[I 2022-05-19 09:04:00,426][0m Trial 865 finished with value: 0.8578549652474766 and parameters: {'loss': 'coxph', 'learning_rate': 0.0764127473199818, 'n_estimators': 143, 'criterion': 'friedman_mse', 'min_samples_split': 3, 'min_samples_leaf': 4, 'min_weight_fraction_leaf': 0.009235395150286319, 'min_impurity_decrease': 0.6732796367017627, 'max_features': 0.5855995154646698, 'subsample': 0.10539715313958992, 'dropout_rate': 0.03400976278944491, 'ccp_alpha': 0.0024912935805014753}. Best is trial 759 with value: 0.8618735483942033.[0m
[32m[I 2022-05-19 09:11:13,771][0m Trial 866 finished with value: 0.795956316959906 and parameters: {'loss': 'coxph', 'learning_rate': 0.07688192662542709, 'n_estimators': 157, 'criterion': 'friedman_mse', 'min_samples_split': 2, 'min_samples_leaf': 4, 'min_weight_fraction_leaf': 0.0056789088878084724, 'min_impurity_decrease': 0.683886947514011, 'max_features': 0.5876320482705044, 'subsample': 0.08064696142514743, 'dropout_rate': 0.06266518727115657, 'ccp_alpha': 0.10548270641066224}. Best is trial 759 with value: 0.8618735483942033.[0m
[32m[I 2022-05-19 09:17:54,918][0m Trial 867 finished with value: 0.7627505819506094 and parameters: {'loss': 'coxph', 'learning_rate': 0.09879266223641221, 'n_estimators': 149, 'criterion': 'friedman_mse', 'min_samples_split': 3, 'min_samples_leaf': 4, 'min_weight_fraction_leaf': 0.00195596870250523, 'min_impurity_decrease': 0.6753173331733898, 'max_features': 0.498826168129073, 'subsample': 0.10097809856653692, 'dropout_rate': 0.040412476834851885, 'ccp_alpha': 0.15813371693970613}. Best is trial 759 with value: 0.8618735483942033.[0m
[32m[I 2022-05-19 09:24:37,565][0m Trial 868 finished with value: 0.796749389989093 and parameters: {'loss': 'coxph', 'learning_rate': 0.06065535700842679, 'n_estimators': 151, 'criterion': 'friedman_mse', 'min_samples_split': 3, 'min_samples_leaf': 3, 'min_weight_fraction_leaf': 0.01159984431993322, 'min_impurity_decrease': 0.6641126595362017, 'max_features': 0.5963723072823139, 'subsample': 0.11059869410595857, 'dropout_rate': 0.03313215292206065, 'ccp_alpha': 0.09218979889465499}. Best is trial 759 with value: 0.8618735483942033.[0m
[32m[I 2022-05-19 09:31:51,654][0m Trial 869 finished with value: 0.7456703258420424 and parameters: {'loss': 'coxph', 'learning_rate': 0.07808372740049971, 'n_estimators': 161, 'criterion': 'friedman_mse', 'min_samples_split': 3, 'min_samples_leaf': 4, 'min_weight_fraction_leaf': 0.012131524862711657, 'min_impurity_decrease': 0.6958992094678849, 'max_features': 0.5239779970715965, 'subsample': 0.09880114240458861, 'dropout_rate': 0.05882898386421816, 'ccp_alpha': 0.2648954805389475}. Best is trial 759 with value: 0.8618735483942033.[0m
/media/san2_ssd/data/Workdir/survival/venv/lib/python3.8/site-packages/sksurv/ensemble/boosting.py:955: RuntimeWarning: divide by zero encountered in log
  time = numpy.log(time)
/media/san2_ssd/data/Workdir/survival/venv/lib/python3.8/site-packages/sksurv/ensemble/boosting.py:955: RuntimeWarning: divide by zero encountered in log
  time = numpy.log(time)
/media/san2_ssd/data/Workdir/survival/venv/lib/python3.8/site-packages/sksurv/ensemble/boosting.py:955: RuntimeWarning: divide by zero encountered in log
  time = numpy.log(time)
/media/san2_ssd/data/Workdir/survival/venv/lib/python3.8/site-packages/sksurv/ensemble/boosting.py:955: RuntimeWarning: divide by zero encountered in log
  time = numpy.log(time)
/media/san2_ssd/data/Workdir/survival/venv/lib/python3.8/site-packages/sksurv/ensemble/boosting.py:955: RuntimeWarning: divide by zero encountered in log
  time = numpy.log(time)
[32m[I 2022-05-19 09:31:51,736][0m Trial 870 finished with value: -1.0 and parameters: {'loss': 'squared', 'learning_rate': 0.061878772436867686, 'n_estimators': 170, 'criterion': 'friedman_mse', 'min_samples_split': 3, 'min_samples_leaf': 4, 'min_weight_fraction_leaf': 0.03290380065803375, 'min_impurity_decrease': 0.6422863324192655, 'max_features': 0.5742521415105283, 'subsample': 0.11489486510369232, 'dropout_rate': 0.01929755498587786, 'ccp_alpha': 0.10310134748694179}. Best is trial 759 with value: 0.8618735483942033.[0m
[32m[I 2022-05-19 09:38:29,376][0m Trial 871 finished with value: 0.8552105927804595 and parameters: {'loss': 'coxph', 'learning_rate': 0.07803083909424337, 'n_estimators': 144, 'criterion': 'friedman_mse', 'min_samples_split': 3, 'min_samples_leaf': 4, 'min_weight_fraction_leaf': 0.01789183698811913, 'min_impurity_decrease': 0.573460567625038, 'max_features': 0.4566374077590034, 'subsample': 0.08591224432514269, 'dropout_rate': 0.04077889951830284, 'ccp_alpha': 0.003675587281126187}. Best is trial 759 with value: 0.8618735483942033.[0m
[32m[I 2022-05-19 09:44:57,604][0m Trial 872 finished with value: 0.5 and parameters: {'loss': 'coxph', 'learning_rate': 0.04887018547134814, 'n_estimators': 142, 'criterion': 'friedman_mse', 'min_samples_split': 3, 'min_samples_leaf': 4, 'min_weight_fraction_leaf': 0.04219492674982962, 'min_impurity_decrease': 0.6084377972436344, 'max_features': 0.5550429936853156, 'subsample': 0.07928987878973123, 'dropout_rate': 0.07514463430623378, 'ccp_alpha': 1.4784556805700895}. Best is trial 759 with value: 0.8618735483942033.[0m
[32m[I 2022-05-19 09:50:46,355][0m Trial 873 finished with value: 0.5 and parameters: {'loss': 'coxph', 'learning_rate': 0.05707112106720737, 'n_estimators': 134, 'criterion': 'friedman_mse', 'min_samples_split': 3, 'min_samples_leaf': 4, 'min_weight_fraction_leaf': 0.028449395196848026, 'min_impurity_decrease': 0.6551316461131667, 'max_features': 0.58573730129255, 'subsample': 0.12344120581555701, 'dropout_rate': 0.019993168476551332, 'ccp_alpha': 0.49934643755915076}. Best is trial 759 with value: 0.8618735483942033.[0m
[32m[I 2022-05-19 09:56:47,279][0m Trial 874 finished with value: 0.7632707504016196 and parameters: {'loss': 'coxph', 'learning_rate': 0.0710880638964621, 'n_estimators': 135, 'criterion': 'friedman_mse', 'min_samples_split': 3, 'min_samples_leaf': 4, 'min_weight_fraction_leaf': 0.0021013149287104887, 'min_impurity_decrease': 0.5869503874140938, 'max_features': 0.5278760817138719, 'subsample': 0.10232911246091722, 'dropout_rate': 0.05082253385730272, 'ccp_alpha': 0.1837567460116983}. Best is trial 759 with value: 0.8618735483942033.[0m
[32m[I 2022-05-19 10:02:51,262][0m Trial 875 finished with value: 0.7395546137869218 and parameters: {'loss': 'coxph', 'learning_rate': 0.04925791266856766, 'n_estimators': 141, 'criterion': 'friedman_mse', 'min_samples_split': 3, 'min_samples_leaf': 4, 'min_weight_fraction_leaf': 0.016065845596979197, 'min_impurity_decrease': 0.6730457446501603, 'max_features': 0.6071984285538209, 'subsample': 0.1333893133501449, 'dropout_rate': 0.01927456889492274, 'ccp_alpha': 0.32467436519063314}. Best is trial 759 with value: 0.8618735483942033.[0m
[32m[I 2022-05-19 10:09:53,254][0m Trial 876 finished with value: 0.8564328298369389 and parameters: {'loss': 'coxph', 'learning_rate': 0.04339532572453133, 'n_estimators': 157, 'criterion': 'friedman_mse', 'min_samples_split': 2, 'min_samples_leaf': 4, 'min_weight_fraction_leaf': 0.035314498718729506, 'min_impurity_decrease': 0.6224388625611813, 'max_features': 0.483152355126579, 'subsample': 0.11609297794825209, 'dropout_rate': 0.0011188440867531003, 'ccp_alpha': 0.002433738172904096}. Best is trial 759 with value: 0.8618735483942033.[0m
[32m[I 2022-05-19 10:17:01,096][0m Trial 877 finished with value: 0.8012303872578048 and parameters: {'loss': 'coxph', 'learning_rate': 0.037993811247355104, 'n_estimators': 155, 'criterion': 'friedman_mse', 'min_samples_split': 2, 'min_samples_leaf': 3, 'min_weight_fraction_leaf': 0.04186809312614939, 'min_impurity_decrease': 0.6094327967872248, 'max_features': 0.48397347204168895, 'subsample': 0.08237565015701426, 'dropout_rate': 0.01709493777082306, 'ccp_alpha': 0.0927209301261718}. Best is trial 759 with value: 0.8618735483942033.[0m
