[32m[I 2022-04-25 01:27:58,563][0m Trial 905 finished with value: 0.9264524735913767 and parameters: {'n_hidden': 1024, 'mixture_components': 6, 'use_sparse_layer': False, 'use_batchnorm': False, 'use_dropout': False, 'mlp_size_1': 6, 'mlp_size_2': 1, 'mlp_size_3': 0, 'kernel': 'Normal', 'loss_name': 'AlternativeNLLLoss'}. Best is trial 647 with value: 0.9282546649369519.[0m
[32m[I 2022-04-25 01:34:57,001][0m Trial 906 finished with value: 0.910159032044843 and parameters: {'n_hidden': 1024, 'mixture_components': 5, 'use_sparse_layer': False, 'use_batchnorm': True, 'use_dropout': True, 'dropout': 0.6054561894614964, 'mlp_size_1': 6, 'mlp_size_2': 1, 'mlp_size_3': 0, 'kernel': 'Exponential', 'loss_name': 'NLLLoss'}. Best is trial 647 with value: 0.9282546649369519.[0m
[32m[I 2022-04-25 01:39:48,613][0m Trial 907 finished with value: 0.9199581020089243 and parameters: {'n_hidden': 256, 'mixture_components': 5, 'use_sparse_layer': False, 'use_batchnorm': False, 'use_dropout': False, 'mlp_size_1': 5, 'mlp_size_2': 0, 'mlp_size_3': 0, 'kernel': 'Normal', 'loss_name': 'AlternativeNLLLoss'}. Best is trial 647 with value: 0.9282546649369519.[0m
[32m[I 2022-04-25 01:44:54,125][0m Trial 908 finished with value: 0.8063386764796056 and parameters: {'n_hidden': 1024, 'mixture_components': 5, 'use_sparse_layer': True, 'use_sparse_loss': False, 'use_batchnorm': False, 'use_dropout': False, 'mlp_size_1': 6, 'mlp_size_2': 1, 'mlp_size_3': 0, 'kernel': 'Normal', 'loss_name': 'AlternativeNLLLoss'}. Best is trial 647 with value: 0.9282546649369519.[0m
[32m[I 2022-04-25 01:50:05,422][0m Trial 909 finished with value: 0.9260234845550943 and parameters: {'n_hidden': 1024, 'mixture_components': 6, 'use_sparse_layer': False, 'use_batchnorm': False, 'use_dropout': False, 'mlp_size_1': 6, 'mlp_size_2': 1, 'mlp_size_3': 0, 'kernel': 'Normal', 'loss_name': 'AlternativeNLLLoss'}. Best is trial 647 with value: 0.9282546649369519.[0m
[32m[I 2022-04-25 01:53:49,343][0m Trial 910 finished with value: 0.9251425748261204 and parameters: {'n_hidden': 1024, 'mixture_components': 4, 'use_sparse_layer': False, 'use_batchnorm': False, 'use_dropout': False, 'mlp_size_1': 6, 'mlp_size_2': 1, 'mlp_size_3': 0, 'kernel': 'LogLogistic', 'loss_name': 'AlternativeNLLLoss'}. Best is trial 647 with value: 0.9282546649369519.[0m
[32m[I 2022-04-25 01:58:36,459][0m Trial 911 finished with value: 0.9252774679289372 and parameters: {'n_hidden': 1024, 'mixture_components': 5, 'use_sparse_layer': False, 'use_batchnorm': False, 'use_dropout': False, 'mlp_size_1': 6, 'mlp_size_2': 1, 'mlp_size_3': 0, 'kernel': 'Normal', 'loss_name': 'AlternativeNLLLoss'}. Best is trial 647 with value: 0.9282546649369519.[0m
[32m[I 2022-04-25 02:03:05,821][0m Trial 912 finished with value: 0.914048349666702 and parameters: {'n_hidden': 1024, 'mixture_components': 6, 'use_sparse_layer': False, 'use_batchnorm': False, 'use_dropout': False, 'mlp_size_1': 6, 'mlp_size_2': 1, 'mlp_size_3': 0, 'kernel': 'Normal', 'loss_name': 'AlternativeNLLLoss'}. Best is trial 647 with value: 0.9282546649369519.[0m
[32m[I 2022-04-25 02:08:29,740][0m Trial 913 finished with value: 0.9263458662836473 and parameters: {'n_hidden': 1024, 'mixture_components': 5, 'use_sparse_layer': False, 'use_batchnorm': False, 'use_dropout': False, 'mlp_size_1': 6, 'mlp_size_2': 1, 'mlp_size_3': 0, 'kernel': 'Normal', 'loss_name': 'AlternativeNLLLoss'}. Best is trial 647 with value: 0.9282546649369519.[0m
[32m[I 2022-04-25 02:13:10,728][0m Trial 914 finished with value: 0.9267605735664984 and parameters: {'n_hidden': 1024, 'mixture_components': 4, 'use_sparse_layer': False, 'use_batchnorm': False, 'use_dropout': False, 'mlp_size_1': 6, 'mlp_size_2': 1, 'mlp_size_3': 0, 'kernel': 'Normal', 'loss_name': 'AlternativeNLLLoss'}. Best is trial 647 with value: 0.9282546649369519.[0m
[32m[I 2022-04-25 02:18:11,161][0m Trial 915 finished with value: 0.927238340786003 and parameters: {'n_hidden': 1024, 'mixture_components': 5, 'use_sparse_layer': False, 'use_batchnorm': False, 'use_dropout': False, 'mlp_size_1': 6, 'mlp_size_2': 1, 'mlp_size_3': 0, 'kernel': 'Normal', 'loss_name': 'AlternativeNLLLoss'}. Best is trial 647 with value: 0.9282546649369519.[0m
[32m[I 2022-04-25 02:21:48,708][0m Trial 916 finished with value: 0.8124173947233183 and parameters: {'n_hidden': 1024, 'mixture_components': 6, 'use_sparse_layer': False, 'use_batchnorm': False, 'use_dropout': False, 'mlp_size_1': 6, 'mlp_size_2': 1, 'mlp_size_3': 0, 'kernel': 'Logistic', 'loss_name': 'AlternativeNLLLoss'}. Best is trial 647 with value: 0.9282546649369519.[0m
[32m[I 2022-04-25 02:27:03,842][0m Trial 917 finished with value: 0.9204758000038599 and parameters: {'n_hidden': 2048, 'mixture_components': 5, 'use_sparse_layer': False, 'use_batchnorm': False, 'use_dropout': False, 'mlp_size_1': 7, 'mlp_size_2': 1, 'mlp_size_3': 0, 'kernel': 'Normal', 'loss_name': 'AlternativeNLLLoss'}. Best is trial 647 with value: 0.9282546649369519.[0m
[32m[I 2022-04-25 02:32:02,467][0m Trial 918 finished with value: 0.9263706326623226 and parameters: {'n_hidden': 1024, 'mixture_components': 6, 'use_sparse_layer': False, 'use_batchnorm': False, 'use_dropout': False, 'mlp_size_1': 6, 'mlp_size_2': 1, 'mlp_size_3': 0, 'kernel': 'Normal', 'loss_name': 'AlternativeNLLLoss'}. Best is trial 647 with value: 0.9282546649369519.[0m
[32m[I 2022-04-25 02:36:06,128][0m Trial 919 finished with value: 0.8197142459561091 and parameters: {'n_hidden': 512, 'mixture_components': 5, 'use_sparse_layer': False, 'use_batchnorm': False, 'use_dropout': False, 'mlp_size_1': 6, 'mlp_size_2': 0, 'mlp_size_3': 0, 'kernel': 'Normal', 'loss_name': 'AlternativeNLLLoss'}. Best is trial 647 with value: 0.9282546649369519.[0m
[32m[I 2022-04-25 02:40:45,346][0m Trial 920 finished with value: 0.9225412173968028 and parameters: {'n_hidden': 1024, 'mixture_components': 7, 'use_sparse_layer': False, 'use_batchnorm': False, 'use_dropout': False, 'mlp_size_1': 6, 'mlp_size_2': 1, 'mlp_size_3': 0, 'kernel': 'Normal', 'loss_name': 'AlternativeNLLLoss'}. Best is trial 647 with value: 0.9282546649369519.[0m
[32m[I 2022-04-25 02:45:05,828][0m Trial 921 finished with value: 0.9243679810102726 and parameters: {'n_hidden': 1024, 'mixture_components': 6, 'use_sparse_layer': False, 'use_batchnorm': False, 'use_dropout': False, 'mlp_size_1': 6, 'mlp_size_2': 1, 'mlp_size_3': 0, 'kernel': 'Normal', 'loss_name': 'AlternativeNLLLoss'}. Best is trial 647 with value: 0.9282546649369519.[0m
[32m[I 2022-04-25 02:50:29,644][0m Trial 922 finished with value: 0.9267376192288775 and parameters: {'n_hidden': 1024, 'mixture_components': 5, 'use_sparse_layer': False, 'use_batchnorm': False, 'use_dropout': False, 'mlp_size_1': 6, 'mlp_size_2': 1, 'mlp_size_3': 0, 'kernel': 'Normal', 'loss_name': 'AlternativeNLLLoss'}. Best is trial 647 with value: 0.9282546649369519.[0m
[32m[I 2022-04-25 02:58:30,839][0m Trial 923 finished with value: 0.9241612851581863 and parameters: {'n_hidden': 32, 'mixture_components': 5, 'use_sparse_layer': False, 'use_batchnorm': False, 'use_dropout': False, 'mlp_size_1': 2, 'mlp_size_2': 0, 'mlp_size_3': 0, 'kernel': 'Normal', 'loss_name': 'AlternativeNLLLoss'}. Best is trial 647 with value: 0.9282546649369519.[0m
[32m[I 2022-04-25 03:01:03,207][0m Trial 924 finished with value: 0.41284607897624725 and parameters: {'n_hidden': 1024, 'mixture_components': 4, 'use_sparse_layer': False, 'use_batchnorm': False, 'use_dropout': True, 'dropout': 0.7497351368929032, 'mlp_size_1': 6, 'mlp_size_2': 1, 'mlp_size_3': 0, 'kernel': 'LogLogistic', 'loss_name': 'NLLLoss'}. Best is trial 647 with value: 0.9282546649369519.[0m
[32m[I 2022-04-25 03:05:49,502][0m Trial 925 finished with value: 0.8217745401759107 and parameters: {'n_hidden': 1024, 'mixture_components': 6, 'use_sparse_layer': False, 'use_batchnorm': False, 'use_dropout': False, 'mlp_size_1': 6, 'mlp_size_2': 1, 'mlp_size_3': 0, 'kernel': 'Normal', 'loss_name': 'AlternativeNLLLoss'}. Best is trial 647 with value: 0.9282546649369519.[0m
[32m[I 2022-04-25 03:13:33,618][0m Trial 926 finished with value: 0.7142784884899681 and parameters: {'n_hidden': 1024, 'mixture_components': 5, 'use_sparse_layer': False, 'use_batchnorm': True, 'use_dropout': False, 'mlp_size_1': 6, 'mlp_size_2': 1, 'mlp_size_3': 0, 'kernel': 'Normal', 'loss_name': 'AlternativeNLLLoss'}. Best is trial 647 with value: 0.9282546649369519.[0m
[32m[I 2022-04-25 03:19:25,298][0m Trial 927 finished with value: 0.9253200231335033 and parameters: {'n_hidden': 128, 'mixture_components': 6, 'use_sparse_layer': True, 'use_sparse_loss': True, 'lmbd': 0.04613026324065552, 'use_batchnorm': False, 'use_dropout': False, 'mlp_size_1': 4, 'mlp_size_2': 0, 'mlp_size_3': 0, 'kernel': 'Normal', 'loss_name': 'AlternativeNLLLoss'}. Best is trial 647 with value: 0.9282546649369519.[0m
[32m[I 2022-04-25 03:24:37,758][0m Trial 928 finished with value: 0.9275801118313266 and parameters: {'n_hidden': 1024, 'mixture_components': 5, 'use_sparse_layer': False, 'use_batchnorm': False, 'use_dropout': False, 'mlp_size_1': 6, 'mlp_size_2': 1, 'mlp_size_3': 0, 'kernel': 'Normal', 'loss_name': 'AlternativeNLLLoss'}. Best is trial 647 with value: 0.9282546649369519.[0m
[32m[I 2022-04-25 03:29:28,070][0m Trial 929 finished with value: 0.9270101143310988 and parameters: {'n_hidden': 1024, 'mixture_components': 5, 'use_sparse_layer': False, 'use_batchnorm': False, 'use_dropout': False, 'mlp_size_1': 6, 'mlp_size_2': 1, 'mlp_size_3': 0, 'kernel': 'Normal', 'loss_name': 'AlternativeNLLLoss'}. Best is trial 647 with value: 0.9282546649369519.[0m
[32m[I 2022-04-25 03:31:37,990][0m Trial 930 finished with value: -0.5 and parameters: {'n_hidden': 1024, 'mixture_components': 6, 'use_sparse_layer': False, 'use_batchnorm': False, 'use_dropout': False, 'mlp_size_1': 6, 'mlp_size_2': 1, 'mlp_size_3': 0, 'kernel': 'Exponential', 'loss_name': 'AlternativeNLLLoss'}. Best is trial 647 with value: 0.9282546649369519.[0m
[32m[I 2022-04-25 03:38:12,177][0m Trial 931 finished with value: 0.9239448010102912 and parameters: {'n_hidden': 64, 'mixture_components': 5, 'use_sparse_layer': False, 'use_batchnorm': False, 'use_dropout': False, 'mlp_size_1': 3, 'mlp_size_2': 0, 'mlp_size_3': 0, 'kernel': 'Normal', 'loss_name': 'AlternativeNLLLoss'}. Best is trial 647 with value: 0.9282546649369519.[0m
[32m[I 2022-04-25 03:43:02,378][0m Trial 932 finished with value: 0.9267868706214136 and parameters: {'n_hidden': 1024, 'mixture_components': 4, 'use_sparse_layer': False, 'use_batchnorm': False, 'use_dropout': False, 'mlp_size_1': 6, 'mlp_size_2': 1, 'mlp_size_3': 0, 'kernel': 'Normal', 'loss_name': 'AlternativeNLLLoss'}. Best is trial 647 with value: 0.9282546649369519.[0m
[32m[I 2022-04-25 03:47:31,601][0m Trial 933 finished with value: 0.53310403403378 and parameters: {'n_hidden': 2048, 'mixture_components': 6, 'use_sparse_layer': False, 'use_batchnorm': False, 'use_dropout': False, 'mlp_size_1': 7, 'mlp_size_2': 1, 'mlp_size_3': 0, 'kernel': 'Normal', 'loss_name': 'AlternativeNLLLoss'}. Best is trial 647 with value: 0.9282546649369519.[0m
[32m[I 2022-04-25 03:52:19,408][0m Trial 934 finished with value: 0.9261098039947175 and parameters: {'n_hidden': 1024, 'mixture_components': 5, 'use_sparse_layer': False, 'use_batchnorm': False, 'use_dropout': False, 'mlp_size_1': 6, 'mlp_size_2': 1, 'mlp_size_3': 0, 'kernel': 'Normal', 'loss_name': 'AlternativeNLLLoss'}. Best is trial 647 with value: 0.9282546649369519.[0m
[32m[I 2022-04-25 03:57:28,537][0m Trial 935 finished with value: 0.8263439735098782 and parameters: {'n_hidden': 1024, 'mixture_components': 4, 'use_sparse_layer': False, 'use_batchnorm': False, 'use_dropout': False, 'mlp_size_1': 6, 'mlp_size_2': 1, 'mlp_size_3': 0, 'kernel': 'Normal', 'loss_name': 'AlternativeNLLLoss'}. Best is trial 647 with value: 0.9282546649369519.[0m
[32m[I 2022-04-25 04:02:03,069][0m Trial 936 finished with value: 0.9255191179823654 and parameters: {'n_hidden': 256, 'mixture_components': 7, 'use_sparse_layer': False, 'use_batchnorm': False, 'use_dropout': False, 'mlp_size_1': 5, 'mlp_size_2': 0, 'mlp_size_3': 0, 'kernel': 'Normal', 'loss_name': 'AlternativeNLLLoss'}. Best is trial 647 with value: 0.9282546649369519.[0m
[32m[I 2022-04-25 04:05:37,840][0m Trial 937 finished with value: 0.7862856010700802 and parameters: {'n_hidden': 1024, 'mixture_components': 5, 'use_sparse_layer': False, 'use_batchnorm': False, 'use_dropout': False, 'mlp_size_1': 6, 'mlp_size_2': 1, 'mlp_size_3': 0, 'kernel': 'LogLogistic', 'loss_name': 'AlternativeNLLLoss'}. Best is trial 647 with value: 0.9282546649369519.[0m
[32m[I 2022-04-25 04:10:59,238][0m Trial 938 finished with value: 0.9271484617110495 and parameters: {'n_hidden': 1024, 'mixture_components': 6, 'use_sparse_layer': False, 'use_batchnorm': False, 'use_dropout': False, 'mlp_size_1': 6, 'mlp_size_2': 1, 'mlp_size_3': 0, 'kernel': 'Normal', 'loss_name': 'AlternativeNLLLoss'}. Best is trial 647 with value: 0.9282546649369519.[0m
[32m[I 2022-04-25 04:15:29,699][0m Trial 939 finished with value: 0.8197439926309908 and parameters: {'n_hidden': 1024, 'mixture_components': 5, 'use_sparse_layer': False, 'use_batchnorm': False, 'use_dropout': False, 'mlp_size_1': 6, 'mlp_size_2': 1, 'mlp_size_3': 0, 'kernel': 'Normal', 'loss_name': 'AlternativeNLLLoss'}. Best is trial 647 with value: 0.9282546649369519.[0m
[32m[I 2022-04-25 04:20:25,701][0m Trial 940 finished with value: 0.8261137575916917 and parameters: {'n_hidden': 1024, 'mixture_components': 5, 'use_sparse_layer': False, 'use_batchnorm': False, 'use_dropout': False, 'mlp_size_1': 6, 'mlp_size_2': 1, 'mlp_size_3': 0, 'kernel': 'Normal', 'loss_name': 'AlternativeNLLLoss'}. Best is trial 647 with value: 0.9282546649369519.[0m
[32m[I 2022-04-25 04:25:58,348][0m Trial 941 finished with value: 0.926303974640933 and parameters: {'n_hidden': 1024, 'mixture_components': 6, 'use_sparse_layer': False, 'use_batchnorm': False, 'use_dropout': False, 'mlp_size_1': 6, 'mlp_size_2': 1, 'mlp_size_3': 0, 'kernel': 'Normal', 'loss_name': 'AlternativeNLLLoss'}. Best is trial 647 with value: 0.9282546649369519.[0m
[32m[I 2022-04-25 04:30:16,645][0m Trial 942 finished with value: 0.9121129191618665 and parameters: {'n_hidden': 1024, 'mixture_components': 8, 'use_sparse_layer': False, 'use_batchnorm': False, 'use_dropout': False, 'mlp_size_1': 6, 'mlp_size_2': 1, 'mlp_size_3': 0, 'kernel': 'Normal', 'loss_name': 'NLLLoss'}. Best is trial 647 with value: 0.9282546649369519.[0m
[32m[I 2022-04-25 04:34:56,104][0m Trial 943 finished with value: 0.9265410822782968 and parameters: {'n_hidden': 1024, 'mixture_components': 4, 'use_sparse_layer': False, 'use_batchnorm': False, 'use_dropout': False, 'mlp_size_1': 6, 'mlp_size_2': 1, 'mlp_size_3': 0, 'kernel': 'Normal', 'loss_name': 'AlternativeNLLLoss'}. Best is trial 647 with value: 0.9282546649369519.[0m
[32m[I 2022-04-25 04:39:16,250][0m Trial 944 finished with value: 0.4064780346794229 and parameters: {'n_hidden': 1024, 'mixture_components': 5, 'use_sparse_layer': False, 'use_batchnorm': True, 'use_dropout': True, 'dropout': 0.7010453109773072, 'mlp_size_1': 6, 'mlp_size_2': 1, 'mlp_size_3': 0, 'kernel': 'Normal', 'loss_name': 'AlternativeNLLLoss'}. Best is trial 647 with value: 0.9282546649369519.[0m
[32m[I 2022-04-25 04:44:34,270][0m Trial 945 finished with value: 0.9245442670101447 and parameters: {'n_hidden': 1024, 'mixture_components': 6, 'use_sparse_layer': False, 'use_batchnorm': False, 'use_dropout': False, 'mlp_size_1': 6, 'mlp_size_2': 1, 'mlp_size_3': 0, 'kernel': 'Normal', 'loss_name': 'AlternativeNLLLoss'}. Best is trial 647 with value: 0.9282546649369519.[0m
[32m[I 2022-04-25 04:48:25,374][0m Trial 946 finished with value: 0.9232933768727051 and parameters: {'n_hidden': 1024, 'mixture_components': 5, 'use_sparse_layer': True, 'use_sparse_loss': False, 'use_batchnorm': False, 'use_dropout': False, 'mlp_size_1': 6, 'mlp_size_2': 1, 'mlp_size_3': 0, 'kernel': 'Logistic', 'loss_name': 'AlternativeNLLLoss'}. Best is trial 647 with value: 0.9282546649369519.[0m
[32m[I 2022-04-25 04:54:42,862][0m Trial 947 finished with value: 0.9266149125313097 and parameters: {'n_hidden': 2048, 'mixture_components': 6, 'use_sparse_layer': False, 'use_batchnorm': False, 'use_dropout': False, 'mlp_size_1': 7, 'mlp_size_2': 1, 'mlp_size_3': 0, 'kernel': 'Normal', 'loss_name': 'AlternativeNLLLoss'}. Best is trial 647 with value: 0.9282546649369519.[0m
[32m[I 2022-04-25 05:00:29,381][0m Trial 948 finished with value: 0.9269303745064097 and parameters: {'n_hidden': 1024, 'mixture_components': 5, 'use_sparse_layer': False, 'use_batchnorm': False, 'use_dropout': False, 'mlp_size_1': 6, 'mlp_size_2': 1, 'mlp_size_3': 0, 'kernel': 'Normal', 'loss_name': 'AlternativeNLLLoss'}. Best is trial 647 with value: 0.9282546649369519.[0m
[32m[I 2022-04-25 05:04:23,533][0m Trial 949 finished with value: 0.721441024130531 and parameters: {'n_hidden': 512, 'mixture_components': 4, 'use_sparse_layer': False, 'use_batchnorm': False, 'use_dropout': False, 'mlp_size_1': 6, 'mlp_size_2': 0, 'mlp_size_3': 0, 'kernel': 'Normal', 'loss_name': 'AlternativeNLLLoss'}. Best is trial 647 with value: 0.9282546649369519.[0m
[32m[I 2022-04-25 05:09:08,977][0m Trial 950 finished with value: 0.9259376430558068 and parameters: {'n_hidden': 1024, 'mixture_components': 5, 'use_sparse_layer': False, 'use_batchnorm': False, 'use_dropout': False, 'mlp_size_1': 6, 'mlp_size_2': 1, 'mlp_size_3': 0, 'kernel': 'Normal', 'loss_name': 'AlternativeNLLLoss'}. Best is trial 647 with value: 0.9282546649369519.[0m
[32m[I 2022-04-25 05:12:53,872][0m Trial 951 finished with value: 0.9264275212633866 and parameters: {'n_hidden': 1024, 'mixture_components': 6, 'use_sparse_layer': False, 'use_batchnorm': False, 'use_dropout': False, 'mlp_size_1': 6, 'mlp_size_2': 1, 'mlp_size_3': 0, 'kernel': 'LogLogistic', 'loss_name': 'AlternativeNLLLoss'}. Best is trial 647 with value: 0.9282546649369519.[0m
[32m[I 2022-04-25 05:19:50,231][0m Trial 952 finished with value: 0.9220959147774538 and parameters: {'n_hidden': 32, 'mixture_components': 5, 'use_sparse_layer': False, 'use_batchnorm': False, 'use_dropout': False, 'mlp_size_1': 2, 'mlp_size_2': 0, 'mlp_size_3': 0, 'kernel': 'Normal', 'loss_name': 'AlternativeNLLLoss'}. Best is trial 647 with value: 0.9282546649369519.[0m
[32m[I 2022-04-25 05:24:48,362][0m Trial 953 finished with value: 0.9262870073778542 and parameters: {'n_hidden': 1024, 'mixture_components': 6, 'use_sparse_layer': False, 'use_batchnorm': False, 'use_dropout': False, 'mlp_size_1': 6, 'mlp_size_2': 1, 'mlp_size_3': 0, 'kernel': 'Normal', 'loss_name': 'AlternativeNLLLoss'}. Best is trial 647 with value: 0.9282546649369519.[0m
[32m[I 2022-04-25 05:27:08,692][0m Trial 954 finished with value: -0.5 and parameters: {'n_hidden': 1024, 'mixture_components': 7, 'use_sparse_layer': False, 'use_batchnorm': False, 'use_dropout': False, 'mlp_size_1': 1, 'mlp_size_2': 4, 'mlp_size_3': 0, 'kernel': 'Exponential', 'loss_name': 'AlternativeNLLLoss'}. Best is trial 647 with value: 0.9282546649369519.[0m
[32m[I 2022-04-25 05:31:44,520][0m Trial 955 finished with value: 0.9220081388410296 and parameters: {'n_hidden': 128, 'mixture_components': 5, 'use_sparse_layer': False, 'use_batchnorm': False, 'use_dropout': False, 'mlp_size_1': 4, 'mlp_size_2': 0, 'mlp_size_3': 0, 'kernel': 'Normal', 'loss_name': 'AlternativeNLLLoss'}. Best is trial 647 with value: 0.9282546649369519.[0m
[32m[I 2022-04-25 05:36:04,903][0m Trial 956 finished with value: 0.8167136920092835 and parameters: {'n_hidden': 1024, 'mixture_components': 5, 'use_sparse_layer': False, 'use_batchnorm': False, 'use_dropout': False, 'mlp_size_1': 6, 'mlp_size_2': 1, 'mlp_size_3': 0, 'kernel': 'Normal', 'loss_name': 'AlternativeNLLLoss'}. Best is trial 647 with value: 0.9282546649369519.[0m
[32m[I 2022-04-25 05:41:22,815][0m Trial 957 finished with value: 0.9274467014004903 and parameters: {'n_hidden': 1024, 'mixture_components': 6, 'use_sparse_layer': False, 'use_batchnorm': False, 'use_dropout': False, 'mlp_size_1': 6, 'mlp_size_2': 1, 'mlp_size_3': 0, 'kernel': 'Normal', 'loss_name': 'AlternativeNLLLoss'}. Best is trial 647 with value: 0.9282546649369519.[0m
[32m[I 2022-04-25 05:46:12,526][0m Trial 958 finished with value: 0.8271397873798438 and parameters: {'n_hidden': 1024, 'mixture_components': 6, 'use_sparse_layer': False, 'use_batchnorm': False, 'use_dropout': False, 'mlp_size_1': 6, 'mlp_size_2': 1, 'mlp_size_3': 0, 'kernel': 'Normal', 'loss_name': 'AlternativeNLLLoss'}. Best is trial 647 with value: 0.9282546649369519.[0m
[32m[I 2022-04-25 05:51:22,174][0m Trial 959 finished with value: 0.9261366523478468 and parameters: {'n_hidden': 1024, 'mixture_components': 6, 'use_sparse_layer': False, 'use_batchnorm': False, 'use_dropout': False, 'mlp_size_1': 6, 'mlp_size_2': 1, 'mlp_size_3': 0, 'kernel': 'Normal', 'loss_name': 'AlternativeNLLLoss'}. Best is trial 647 with value: 0.9282546649369519.[0m
[32m[I 2022-04-25 05:56:10,146][0m Trial 960 finished with value: 0.7728483219364536 and parameters: {'n_hidden': 1024, 'mixture_components': 6, 'use_sparse_layer': False, 'use_batchnorm': False, 'use_dropout': False, 'mlp_size_1': 6, 'mlp_size_2': 1, 'mlp_size_3': 0, 'kernel': 'Normal', 'loss_name': 'AlternativeNLLLoss'}. Best is trial 647 with value: 0.9282546649369519.[0m
[32m[I 2022-04-25 06:00:34,440][0m Trial 961 finished with value: 0.9158122345370703 and parameters: {'n_hidden': 64, 'mixture_components': 6, 'use_sparse_layer': False, 'use_batchnorm': False, 'use_dropout': False, 'mlp_size_1': 3, 'mlp_size_2': 0, 'mlp_size_3': 0, 'kernel': 'Normal', 'loss_name': 'NLLLoss'}. Best is trial 647 with value: 0.9282546649369519.[0m
