[32m[I 2022-04-21 17:48:46,055][0m Trial 432 finished with value: 0.810455310005268 and parameters: {'splitter': 'random', 'min_samples_split': 0.2921169880020028, 'min_samples_leaf': 0.0813247228696983, 'min_weight_fraction_leaf': 0.07519558233302838, 'max_features': 0.9251019995872525}. Best is trial 309 with value: 0.8113132095609382.[0m
[32m[I 2022-04-21 17:48:46,639][0m Trial 433 finished with value: 0.8027100826224253 and parameters: {'splitter': 'random', 'min_samples_split': 0.29337849085972806, 'min_samples_leaf': 0.08114922245055677, 'min_weight_fraction_leaf': 0.0639947268118312, 'max_features': 0.9321180663066154}. Best is trial 309 with value: 0.8113132095609382.[0m
[32m[I 2022-04-21 17:48:47,366][0m Trial 434 finished with value: 0.8112229513277963 and parameters: {'splitter': 'random', 'min_samples_split': 0.29498743800585564, 'min_samples_leaf': 0.09181287891287482, 'min_weight_fraction_leaf': 0.06835343190993196, 'max_features': 0.924630584429355}. Best is trial 309 with value: 0.8113132095609382.[0m
[32m[I 2022-04-21 17:48:47,894][0m Trial 435 finished with value: 0.7718175427041111 and parameters: {'splitter': 'random', 'min_samples_split': 0.2856710826513513, 'min_samples_leaf': 0.11005521028393596, 'min_weight_fraction_leaf': 0.07305584166366728, 'max_features': 0.9564356662563505}. Best is trial 309 with value: 0.8113132095609382.[0m
[32m[I 2022-04-21 17:48:48,727][0m Trial 436 finished with value: 0.7645669710097607 and parameters: {'splitter': 'random', 'min_samples_split': 0.2961487458122559, 'min_samples_leaf': 0.09355508997611815, 'min_weight_fraction_leaf': 0.07698544253611214, 'max_features': 0.9353955026897809}. Best is trial 309 with value: 0.8113132095609382.[0m
[32m[I 2022-04-21 17:48:49,775][0m Trial 437 finished with value: 0.810455310005268 and parameters: {'splitter': 'random', 'min_samples_split': 0.27071730849526604, 'min_samples_leaf': 0.07212545142802113, 'min_weight_fraction_leaf': 0.0815595051259086, 'max_features': 0.9080379369618307}. Best is trial 309 with value: 0.8113132095609382.[0m
[32m[I 2022-04-21 17:48:50,612][0m Trial 438 finished with value: 0.7970346531254762 and parameters: {'splitter': 'random', 'min_samples_split': 0.26997914184242927, 'min_samples_leaf': 0.07110788632367873, 'min_weight_fraction_leaf': 0.07740155987102317, 'max_features': 0.8999595707011424}. Best is trial 309 with value: 0.8113132095609382.[0m
[32m[I 2022-04-21 17:48:51,436][0m Trial 439 finished with value: 0.775684232099894 and parameters: {'splitter': 'random', 'min_samples_split': 0.28054522792022113, 'min_samples_leaf': 0.08297912040296936, 'min_weight_fraction_leaf': 0.07681328816354446, 'max_features': 0.8738169622180625}. Best is trial 309 with value: 0.8113132095609382.[0m
[32m[I 2022-04-21 17:48:52,547][0m Trial 440 finished with value: 0.7963956610153005 and parameters: {'splitter': 'random', 'min_samples_split': 0.2907857289687047, 'min_samples_leaf': 0.0697133321414909, 'min_weight_fraction_leaf': 0.0651533184254729, 'max_features': 0.8966036478974914}. Best is trial 309 with value: 0.8113132095609382.[0m
[32m[I 2022-04-21 17:48:53,188][0m Trial 441 finished with value: 0.8118070902918568 and parameters: {'splitter': 'random', 'min_samples_split': 0.2531902635668789, 'min_samples_leaf': 0.0931297579967919, 'min_weight_fraction_leaf': 0.0603528083317094, 'max_features': 0.9262490348475276}. Best is trial 441 with value: 0.8118070902918568.[0m
[32m[I 2022-04-21 17:48:53,970][0m Trial 442 finished with value: 0.8004594915507802 and parameters: {'splitter': 'random', 'min_samples_split': 0.25677351364398054, 'min_samples_leaf': 0.09603160711062936, 'min_weight_fraction_leaf': 0.08030275366866764, 'max_features': 0.9237809656905984}. Best is trial 441 with value: 0.8118070902918568.[0m
[32m[I 2022-04-21 17:48:54,798][0m Trial 443 finished with value: 0.7754953816212059 and parameters: {'splitter': 'random', 'min_samples_split': 0.26422766287124405, 'min_samples_leaf': 0.08681603212230089, 'min_weight_fraction_leaf': 0.061374716639646436, 'max_features': 0.9522375853475643}. Best is trial 441 with value: 0.8118070902918568.[0m
[32m[I 2022-04-21 17:48:55,492][0m Trial 444 finished with value: 0.7994496272441898 and parameters: {'splitter': 'random', 'min_samples_split': 0.24562911612862626, 'min_samples_leaf': 0.07763976805225638, 'min_weight_fraction_leaf': 0.06916374116950104, 'max_features': 0.9383776031444159}. Best is trial 441 with value: 0.8118070902918568.[0m
[32m[I 2022-04-21 17:48:55,968][0m Trial 445 finished with value: 0.7989883908314254 and parameters: {'splitter': 'random', 'min_samples_split': 0.2734248546951085, 'min_samples_leaf': 0.11581633386560389, 'min_weight_fraction_leaf': 0.08160875712125257, 'max_features': 0.9051040784519025}. Best is trial 441 with value: 0.8118070902918568.[0m
[32m[I 2022-04-21 17:48:56,645][0m Trial 446 finished with value: 0.7755871272429775 and parameters: {'splitter': 'random', 'min_samples_split': 0.24910159459707024, 'min_samples_leaf': 0.10216224243944223, 'min_weight_fraction_leaf': 0.057353234171541784, 'max_features': 0.8484698989114192}. Best is trial 441 with value: 0.8118070902918568.[0m
[32m[I 2022-04-21 17:48:57,072][0m Trial 447 finished with value: 0.5 and parameters: {'splitter': 'random', 'min_samples_split': 0.2963749718355016, 'min_samples_leaf': 0.09003569877273698, 'min_weight_fraction_leaf': 0.054583895496423104, 'max_features': 0.03720737921568407}. Best is trial 441 with value: 0.8118070902918568.[0m
[32m[I 2022-04-21 17:48:57,827][0m Trial 448 finished with value: 0.810455310005268 and parameters: {'splitter': 'random', 'min_samples_split': 0.2655713400665745, 'min_samples_leaf': 0.07898003416159767, 'min_weight_fraction_leaf': 0.06861463027026884, 'max_features': 0.9252310238029405}. Best is trial 441 with value: 0.8118070902918568.[0m
[32m[I 2022-04-21 17:48:58,582][0m Trial 449 finished with value: 0.7737414327341314 and parameters: {'splitter': 'random', 'min_samples_split': 0.26294919493352437, 'min_samples_leaf': 0.07684905400912105, 'min_weight_fraction_leaf': 0.06329008380994831, 'max_features': 0.9616442445245161}. Best is trial 441 with value: 0.8118070902918568.[0m
[32m[I 2022-04-21 17:48:59,080][0m Trial 450 finished with value: 0.8016555385919716 and parameters: {'splitter': 'random', 'min_samples_split': 0.27525083528884114, 'min_samples_leaf': 0.06847530105175864, 'min_weight_fraction_leaf': 0.06909726280998356, 'max_features': 0.9321039652905874}. Best is trial 441 with value: 0.8118070902918568.[0m
[32m[I 2022-04-21 17:48:59,912][0m Trial 451 finished with value: 0.7608512019286453 and parameters: {'splitter': 'random', 'min_samples_split': 0.25381673798386073, 'min_samples_leaf': 0.12346607877026701, 'min_weight_fraction_leaf': 0.08238848482837997, 'max_features': 0.9441850920802153}. Best is trial 441 with value: 0.8118070902918568.[0m
[32m[I 2022-04-21 17:49:00,676][0m Trial 452 finished with value: 0.810455310005268 and parameters: {'splitter': 'random', 'min_samples_split': 0.2853366667346723, 'min_samples_leaf': 0.08555684275527414, 'min_weight_fraction_leaf': 0.05522432284405031, 'max_features': 0.921747954657599}. Best is trial 441 with value: 0.8118070902918568.[0m
[32m[I 2022-04-21 17:49:01,103][0m Trial 453 finished with value: 0.775684232099894 and parameters: {'splitter': 'random', 'min_samples_split': 0.2846334838473556, 'min_samples_leaf': 0.08696157887953711, 'min_weight_fraction_leaf': 0.07356770000152277, 'max_features': 0.877758235991524}. Best is trial 441 with value: 0.8118070902918568.[0m
[32m[I 2022-04-21 17:49:01,506][0m Trial 454 finished with value: 0.7720767720828625 and parameters: {'splitter': 'random', 'min_samples_split': 0.2662136885650365, 'min_samples_leaf': 0.10500969348894115, 'min_weight_fraction_leaf': 0.06007671294800201, 'max_features': 0.9188605439707487}. Best is trial 441 with value: 0.8118070902918568.[0m
[32m[I 2022-04-21 17:49:02,312][0m Trial 455 finished with value: 0.7737414327341314 and parameters: {'splitter': 'random', 'min_samples_split': 0.2936619645613418, 'min_samples_leaf': 0.07992896164011648, 'min_weight_fraction_leaf': 0.05524972768242744, 'max_features': 0.9559869232232437}. Best is trial 441 with value: 0.8118070902918568.[0m
[32m[I 2022-04-21 17:49:03,132][0m Trial 456 finished with value: 0.7967066593147615 and parameters: {'splitter': 'random', 'min_samples_split': 0.28062114518056275, 'min_samples_leaf': 0.09671495099956484, 'min_weight_fraction_leaf': 0.07035974255738851, 'max_features': 0.8936963794737336}. Best is trial 441 with value: 0.8118070902918568.[0m
[32m[I 2022-04-21 17:49:03,656][0m Trial 457 finished with value: 0.810455310005268 and parameters: {'splitter': 'random', 'min_samples_split': 0.27055091746028953, 'min_samples_leaf': 0.0695563243377923, 'min_weight_fraction_leaf': 0.05146177946415055, 'max_features': 0.9250366424383478}. Best is trial 441 with value: 0.8118070902918568.[0m
[32m[I 2022-04-21 17:49:04,154][0m Trial 458 finished with value: 0.8016555385919716 and parameters: {'splitter': 'random', 'min_samples_split': 0.2721468227190047, 'min_samples_leaf': 0.06917127237645623, 'min_weight_fraction_leaf': 0.05371934847757506, 'max_features': 0.9375833618103737}. Best is trial 441 with value: 0.8118070902918568.[0m
[32m[I 2022-04-21 17:49:04,588][0m Trial 459 finished with value: 0.7744410765962746 and parameters: {'splitter': 'random', 'min_samples_split': 0.25546667351004715, 'min_samples_leaf': 0.08551000251194453, 'min_weight_fraction_leaf': 0.06717115334405575, 'max_features': 0.9683889832561647}. Best is trial 441 with value: 0.8118070902918568.[0m
[32m[I 2022-04-21 17:49:05,066][0m Trial 460 finished with value: 0.810455310005268 and parameters: {'splitter': 'random', 'min_samples_split': 0.2837464893314135, 'min_samples_leaf': 0.0724939585432786, 'min_weight_fraction_leaf': 0.07877267831151052, 'max_features': 0.922607966184276}. Best is trial 441 with value: 0.8118070902918568.[0m
[32m[I 2022-04-21 17:49:05,700][0m Trial 461 finished with value: 0.8000164571488835 and parameters: {'splitter': 'random', 'min_samples_split': 0.3002261465904787, 'min_samples_leaf': 0.07415163196794003, 'min_weight_fraction_leaf': 0.07851723798971344, 'max_features': 0.9486189384694633}. Best is trial 441 with value: 0.8118070902918568.[0m
[32m[I 2022-04-21 17:49:06,574][0m Trial 462 finished with value: 0.810455310005268 and parameters: {'splitter': 'random', 'min_samples_split': 0.2856299433437618, 'min_samples_leaf': 0.06376364672248278, 'min_weight_fraction_leaf': 0.0815141688482842, 'max_features': 0.9251818510720718}. Best is trial 441 with value: 0.8118070902918568.[0m
[32m[I 2022-04-21 17:49:07,271][0m Trial 463 finished with value: 0.810455310005268 and parameters: {'splitter': 'random', 'min_samples_split': 0.28550006212032136, 'min_samples_leaf': 0.06867039850336093, 'min_weight_fraction_leaf': 0.08380296647227842, 'max_features': 0.9245934564285239}. Best is trial 441 with value: 0.8118070902918568.[0m
[32m[I 2022-04-21 17:49:08,488][0m Trial 464 finished with value: 0.810455310005268 and parameters: {'splitter': 'random', 'min_samples_split': 0.28416482869516824, 'min_samples_leaf': 0.06719125744887895, 'min_weight_fraction_leaf': 0.0894074634683143, 'max_features': 0.9268933349643708}. Best is trial 441 with value: 0.8118070902918568.[0m
[32m[I 2022-04-21 17:49:09,044][0m Trial 465 finished with value: 0.810455310005268 and parameters: {'splitter': 'random', 'min_samples_split': 0.2829073404972543, 'min_samples_leaf': 0.06469850975974674, 'min_weight_fraction_leaf': 0.08613124735301032, 'max_features': 0.9297505860453654}. Best is trial 441 with value: 0.8118070902918568.[0m
[32m[I 2022-04-21 17:49:09,556][0m Trial 466 finished with value: 0.7910101893696445 and parameters: {'splitter': 'random', 'min_samples_split': 0.28643793375671817, 'min_samples_leaf': 0.06380189457162462, 'min_weight_fraction_leaf': 0.082581299955445, 'max_features': 0.935782733495831}. Best is trial 441 with value: 0.8118070902918568.[0m
[32m[I 2022-04-21 17:49:10,041][0m Trial 467 finished with value: 0.7737414327341314 and parameters: {'splitter': 'random', 'min_samples_split': 0.27835726756922985, 'min_samples_leaf': 0.06816480400465703, 'min_weight_fraction_leaf': 0.08572450554319848, 'max_features': 0.9589109961515094}. Best is trial 441 with value: 0.8118070902918568.[0m
[32m[I 2022-04-21 17:49:10,804][0m Trial 468 finished with value: 0.7754953816212059 and parameters: {'splitter': 'random', 'min_samples_split': 0.26545763910548414, 'min_samples_leaf': 0.06443008004907828, 'min_weight_fraction_leaf': 0.08651672778015657, 'max_features': 0.9346283603474953}. Best is trial 441 with value: 0.8118070902918568.[0m
[32m[I 2022-04-21 17:49:11,276][0m Trial 469 finished with value: 0.810455310005268 and parameters: {'splitter': 'random', 'min_samples_split': 0.2940486780505871, 'min_samples_leaf': 0.08073099533900616, 'min_weight_fraction_leaf': 0.07117711847995474, 'max_features': 0.9248084325212376}. Best is trial 441 with value: 0.8118070902918568.[0m
[32m[I 2022-04-21 17:49:11,854][0m Trial 470 finished with value: 0.8000720969939668 and parameters: {'splitter': 'random', 'min_samples_split': 0.2956965602491976, 'min_samples_leaf': 0.0778625641419158, 'min_weight_fraction_leaf': 0.0717712017696108, 'max_features': 0.948837866263981}. Best is trial 441 with value: 0.8118070902918568.[0m
[32m[I 2022-04-21 17:49:12,163][0m Trial 471 finished with value: 0.5 and parameters: {'splitter': 'random', 'min_samples_split': 0.27736026303954187, 'min_samples_leaf': 0.06324916719078405, 'min_weight_fraction_leaf': 0.09853994369621187, 'max_features': 0.14380369512270214}. Best is trial 441 with value: 0.8118070902918568.[0m
[32m[I 2022-04-21 17:49:12,619][0m Trial 472 finished with value: 0.810455310005268 and parameters: {'splitter': 'random', 'min_samples_split': 0.26536518488124405, 'min_samples_leaf': 0.08638423559637771, 'min_weight_fraction_leaf': 0.06140485251554058, 'max_features': 0.9099737269401563}. Best is trial 441 with value: 0.8118070902918568.[0m
[32m[I 2022-04-21 17:49:13,103][0m Trial 473 finished with value: 0.810455310005268 and parameters: {'splitter': 'random', 'min_samples_split': 0.29276603339952756, 'min_samples_leaf': 0.07536286486677622, 'min_weight_fraction_leaf': 0.07255888439768365, 'max_features': 0.9285160921744401}. Best is trial 441 with value: 0.8118070902918568.[0m
[32m[I 2022-04-21 17:49:13,847][0m Trial 474 finished with value: 0.7645669710097607 and parameters: {'splitter': 'random', 'min_samples_split': 0.29738414871602675, 'min_samples_leaf': 0.09596190117840041, 'min_weight_fraction_leaf': 0.07107248638851606, 'max_features': 0.9479735138510673}. Best is trial 441 with value: 0.8118070902918568.[0m
[32m[I 2022-04-21 17:49:14,325][0m Trial 475 finished with value: 0.797004317397622 and parameters: {'splitter': 'random', 'min_samples_split': 0.24539701225792082, 'min_samples_leaf': 0.08668665784112993, 'min_weight_fraction_leaf': 0.0595930018853727, 'max_features': 0.8957381244031691}. Best is trial 441 with value: 0.8118070902918568.[0m
[32m[I 2022-04-21 17:49:14,691][0m Trial 476 finished with value: 0.6851609036733942 and parameters: {'splitter': 'random', 'min_samples_split': 0.27143009413198266, 'min_samples_leaf': 0.07471023127951365, 'min_weight_fraction_leaf': 0.47140574746601743, 'max_features': 0.9160388021410887}. Best is trial 441 with value: 0.8118070902918568.[0m
[32m[I 2022-04-21 17:49:15,290][0m Trial 477 finished with value: 0.7985823099778446 and parameters: {'splitter': 'random', 'min_samples_split': 0.26021220009170837, 'min_samples_leaf': 0.09305185110333428, 'min_weight_fraction_leaf': 0.050337895382403144, 'max_features': 0.8922275455580074}. Best is trial 441 with value: 0.8118070902918568.[0m
[32m[I 2022-04-21 17:49:15,787][0m Trial 478 finished with value: 0.7737414327341314 and parameters: {'splitter': 'random', 'min_samples_split': 0.28342365190757984, 'min_samples_leaf': 0.06494526672986436, 'min_weight_fraction_leaf': 0.08607617775879783, 'max_features': 0.9671997035701695}. Best is trial 441 with value: 0.8118070902918568.[0m
[32m[I 2022-04-21 17:49:16,594][0m Trial 479 finished with value: 0.7645669710097607 and parameters: {'splitter': 'random', 'min_samples_split': 0.28494504489285977, 'min_samples_leaf': 0.10712902052867473, 'min_weight_fraction_leaf': 0.06034378029251986, 'max_features': 0.94909958903006}. Best is trial 441 with value: 0.8118070902918568.[0m
[32m[I 2022-04-21 17:49:17,123][0m Trial 480 finished with value: 0.7967066593147615 and parameters: {'splitter': 'random', 'min_samples_split': 0.29931925322746067, 'min_samples_leaf': 0.08331113856354108, 'min_weight_fraction_leaf': 0.06504961626325627, 'max_features': 0.9047153401026812}. Best is trial 441 with value: 0.8118070902918568.[0m
[32m[I 2022-04-21 17:49:17,638][0m Trial 481 finished with value: 0.8100341546310684 and parameters: {'splitter': 'random', 'min_samples_split': 0.26064284488507966, 'min_samples_leaf': 0.06301489837937993, 'min_weight_fraction_leaf': 0.08793116668691837, 'max_features': 0.9275052180500911}. Best is trial 441 with value: 0.8118070902918568.[0m
[32m[I 2022-04-21 17:49:18,078][0m Trial 482 finished with value: 0.775684232099894 and parameters: {'splitter': 'random', 'min_samples_split': 0.2683765523791249, 'min_samples_leaf': 0.09018664376892963, 'min_weight_fraction_leaf': 0.05019508694299392, 'max_features': 0.870456963188682}. Best is trial 441 with value: 0.8118070902918568.[0m
[32m[I 2022-04-21 17:49:18,527][0m Trial 483 finished with value: 0.6967201618688251 and parameters: {'splitter': 'random', 'min_samples_split': 0.2496477870363435, 'min_samples_leaf': 0.1014107430721288, 'min_weight_fraction_leaf': 0.058839361423496585, 'max_features': 0.4070794843555875}. Best is trial 441 with value: 0.8118070902918568.[0m
[32m[I 2022-04-21 17:49:19,150][0m Trial 484 finished with value: 0.7656045799191056 and parameters: {'splitter': 'random', 'min_samples_split': 0.28485551667646436, 'min_samples_leaf': 0.11220532295831405, 'min_weight_fraction_leaf': 0.10149213064929341, 'max_features': 0.9117106523925894}. Best is trial 441 with value: 0.8118070902918568.[0m
[32m[I 2022-04-21 17:49:19,951][0m Trial 485 finished with value: 0.7970346531254762 and parameters: {'splitter': 'random', 'min_samples_split': 0.2725890853011474, 'min_samples_leaf': 0.07570830827408075, 'min_weight_fraction_leaf': 0.04879739925445318, 'max_features': 0.8912521235766118}. Best is trial 441 with value: 0.8118070902918568.[0m
[32m[I 2022-04-21 17:49:20,413][0m Trial 486 finished with value: 0.7910101893696445 and parameters: {'splitter': 'random', 'min_samples_split': 0.2909846413036048, 'min_samples_leaf': 0.08244228608266349, 'min_weight_fraction_leaf': 0.0751729959831833, 'max_features': 0.9365267717539476}. Best is trial 441 with value: 0.8118070902918568.[0m
[32m[I 2022-04-21 17:49:20,841][0m Trial 487 finished with value: 0.771048895131327 and parameters: {'splitter': 'random', 'min_samples_split': 0.3027808638394444, 'min_samples_leaf': 0.09284132001529716, 'min_weight_fraction_leaf': 0.07903570252366317, 'max_features': 0.9656637761363462}. Best is trial 441 with value: 0.8118070902918568.[0m
[32m[I 2022-04-21 17:49:21,619][0m Trial 488 finished with value: 0.8016555385919716 and parameters: {'splitter': 'random', 'min_samples_split': 0.27082305089736536, 'min_samples_leaf': 0.07347721802121424, 'min_weight_fraction_leaf': 0.07469742016806578, 'max_features': 0.9312398694100193}. Best is trial 441 with value: 0.8118070902918568.[0m
[32m[I 2022-04-21 17:49:22,244][0m Trial 489 finished with value: 0.810455310005268 and parameters: {'splitter': 'random', 'min_samples_split': 0.2882359658044428, 'min_samples_leaf': 0.061466808214401175, 'min_weight_fraction_leaf': 0.08492657526564709, 'max_features': 0.92779968587483}. Best is trial 441 with value: 0.8118070902918568.[0m
[32m[I 2022-04-21 17:49:22,713][0m Trial 490 finished with value: 0.7985823099778446 and parameters: {'splitter': 'random', 'min_samples_split': 0.25949939809326134, 'min_samples_leaf': 0.08409608575795578, 'min_weight_fraction_leaf': 0.06451088468244036, 'max_features': 0.9040553176533599}. Best is trial 441 with value: 0.8118070902918568.[0m
[32m[I 2022-04-21 17:49:23,211][0m Trial 491 finished with value: 0.8010330688421948 and parameters: {'splitter': 'random', 'min_samples_split': 0.25259467055097656, 'min_samples_leaf': 0.07276571892573627, 'min_weight_fraction_leaf': 0.06839737505496452, 'max_features': 0.9518080929061832}. Best is trial 441 with value: 0.8118070902918568.[0m
[32m[I 2022-04-21 17:49:24,443][0m Trial 492 finished with value: 0.7731857347031788 and parameters: {'splitter': 'random', 'min_samples_split': 0.29432016864008753, 'min_samples_leaf': 0.10240589280471846, 'min_weight_fraction_leaf': 0.06632658271844982, 'max_features': 0.8808229148071702}. Best is trial 441 with value: 0.8118070902918568.[0m
[32m[I 2022-04-21 17:49:25,352][0m Trial 493 finished with value: 0.8112229513277963 and parameters: {'splitter': 'random', 'min_samples_split': 0.27177169764775, 'min_samples_leaf': 0.09303421890810896, 'min_weight_fraction_leaf': 0.052933104260534054, 'max_features': 0.9122965388116628}. Best is trial 441 with value: 0.8118070902918568.[0m
[32m[I 2022-04-21 17:49:25,954][0m Trial 494 finished with value: 0.7977286215404128 and parameters: {'splitter': 'random', 'min_samples_split': 0.27590482535989, 'min_samples_leaf': 0.09725011455523189, 'min_weight_fraction_leaf': 0.04464264702852099, 'max_features': 0.8937476415392799}. Best is trial 441 with value: 0.8118070902918568.[0m
