[32m[I 2022-04-21 13:05:57,563][0m Trial 558 finished with value: 0.9086394753954801 and parameters: {'splitter': 'random', 'min_samples_split': 0.028178921433263043, 'min_samples_leaf': 0.02743120787687288, 'min_weight_fraction_leaf': 0.010153861068161473, 'max_features': 0.9993132294376093}. Best is trial 253 with value: 0.9108382257790575.[0m
[32m[I 2022-04-21 13:06:00,016][0m Trial 559 finished with value: 0.9000015412708067 and parameters: {'splitter': 'random', 'min_samples_split': 0.04342590804409274, 'min_samples_leaf': 0.036008693302964426, 'min_weight_fraction_leaf': 0.0005455955112243505, 'max_features': 0.9330852253208939}. Best is trial 253 with value: 0.9108382257790575.[0m
[32m[I 2022-04-21 13:06:02,188][0m Trial 560 finished with value: 0.3425804518366971 and parameters: {'splitter': 'random', 'min_samples_split': 0.03348422000041034, 'min_samples_leaf': 0.029328836870021583, 'min_weight_fraction_leaf': 0.263971031716439, 'max_features': 0.9803689508149864}. Best is trial 253 with value: 0.9108382257790575.[0m
[32m[I 2022-04-21 13:06:03,704][0m Trial 561 finished with value: 0.9034514892362143 and parameters: {'splitter': 'random', 'min_samples_split': 0.026159340688860326, 'min_samples_leaf': 0.04259136312383814, 'min_weight_fraction_leaf': 0.008854560566775157, 'max_features': 0.9534313334976726}. Best is trial 253 with value: 0.9108382257790575.[0m
[32m[I 2022-04-21 13:06:07,057][0m Trial 562 finished with value: 0.9070833854398213 and parameters: {'splitter': 'random', 'min_samples_split': 0.04284833092372022, 'min_samples_leaf': 0.02686112453898726, 'min_weight_fraction_leaf': 0.012932989111401571, 'max_features': 0.9282293753433111}. Best is trial 253 with value: 0.9108382257790575.[0m
[32m[I 2022-04-21 13:06:09,549][0m Trial 563 finished with value: 0.9051181024825057 and parameters: {'splitter': 'random', 'min_samples_split': 0.027020225428260713, 'min_samples_leaf': 0.03798853427234608, 'min_weight_fraction_leaf': 0.00836545842457901, 'max_features': 0.9787366212872968}. Best is trial 253 with value: 0.9108382257790575.[0m
[32m[I 2022-04-21 13:06:11,992][0m Trial 564 finished with value: 0.9073139826865949 and parameters: {'splitter': 'random', 'min_samples_split': 0.04005507465287654, 'min_samples_leaf': 0.022071208605492703, 'min_weight_fraction_leaf': 0.018149266924207902, 'max_features': 0.9530334012166062}. Best is trial 253 with value: 0.9108382257790575.[0m
[32m[I 2022-04-21 13:06:13,320][0m Trial 565 finished with value: 0.9034820918949675 and parameters: {'splitter': 'random', 'min_samples_split': 0.024563271806749717, 'min_samples_leaf': 0.05200191395281248, 'min_weight_fraction_leaf': 0.020298437661607445, 'max_features': 0.927613827837984}. Best is trial 253 with value: 0.9108382257790575.[0m
[32m[I 2022-04-21 13:06:14,775][0m Trial 566 finished with value: 0.8899472584647764 and parameters: {'splitter': 'random', 'min_samples_split': 0.047646217198092, 'min_samples_leaf': 0.16124056075931992, 'min_weight_fraction_leaf': 0.04109018508192695, 'max_features': 0.9054004491748585}. Best is trial 253 with value: 0.9108382257790575.[0m
[32m[I 2022-04-21 13:06:16,270][0m Trial 567 finished with value: 0.9037054486999534 and parameters: {'splitter': 'random', 'min_samples_split': 0.008419568952418553, 'min_samples_leaf': 0.03442559102717518, 'min_weight_fraction_leaf': 0.028600698420200923, 'max_features': 0.959521910397099}. Best is trial 253 with value: 0.9108382257790575.[0m
[32m[I 2022-04-21 13:06:17,496][0m Trial 568 finished with value: 0.9029178694892874 and parameters: {'splitter': 'random', 'min_samples_split': 0.03471637897117738, 'min_samples_leaf': 0.018971340229324812, 'min_weight_fraction_leaf': 0.009827444859144132, 'max_features': 0.5200952529877669}. Best is trial 253 with value: 0.9108382257790575.[0m
[32m[I 2022-04-21 13:06:19,001][0m Trial 569 finished with value: 0.9034514892362143 and parameters: {'splitter': 'random', 'min_samples_split': 0.01701164820065249, 'min_samples_leaf': 0.04262122727775435, 'min_weight_fraction_leaf': 0.0003697270042085435, 'max_features': 0.9351816638112278}. Best is trial 253 with value: 0.9108382257790575.[0m
[32m[I 2022-04-21 13:06:21,035][0m Trial 570 finished with value: 0.8974873053399548 and parameters: {'splitter': 'random', 'min_samples_split': 0.028255480938777937, 'min_samples_leaf': 0.025889872381667286, 'min_weight_fraction_leaf': 0.053037090077531726, 'max_features': 0.9733511036287551}. Best is trial 253 with value: 0.9108382257790575.[0m
[32m[I 2022-04-21 13:06:23,750][0m Trial 571 finished with value: 0.9045866004827283 and parameters: {'splitter': 'random', 'min_samples_split': 0.04252463026852772, 'min_samples_leaf': 0.018951866919748, 'min_weight_fraction_leaf': 0.036424148536084215, 'max_features': 0.9991424775007542}. Best is trial 253 with value: 0.9108382257790575.[0m
[32m[I 2022-04-21 13:06:25,982][0m Trial 572 finished with value: 0.8804910533104108 and parameters: {'splitter': 'random', 'min_samples_split': 0.01687105861307436, 'min_samples_leaf': 0.033628590253754954, 'min_weight_fraction_leaf': 0.1812709172786256, 'max_features': 0.9096111630979257}. Best is trial 253 with value: 0.9108382257790575.[0m
[32m[I 2022-04-21 13:08:40,091][0m Trial 573 finished with value: 0.8799497339202482 and parameters: {'splitter': 'best', 'min_samples_split': 0.0470780771255493, 'min_samples_leaf': 0.04971341421888015, 'min_weight_fraction_leaf': 0.022798342028240437, 'max_features': 0.9425990780469754}. Best is trial 253 with value: 0.9108382257790575.[0m
[32m[I 2022-04-21 13:08:41,101][0m Trial 574 finished with value: 0.8842681971396938 and parameters: {'splitter': 'random', 'min_samples_split': 0.03128594677977324, 'min_samples_leaf': 0.011947370326687086, 'min_weight_fraction_leaf': 0.04599246209464861, 'max_features': 0.3762056965526729}. Best is trial 253 with value: 0.9108382257790575.[0m
[32m[I 2022-04-21 13:08:42,188][0m Trial 575 finished with value: 0.8961284409840953 and parameters: {'splitter': 'random', 'min_samples_split': 0.0015097120466271603, 'min_samples_leaf': 0.02529290011885254, 'min_weight_fraction_leaf': 0.01610066680393595, 'max_features': 0.9196212471848741}. Best is trial 253 with value: 0.9108382257790575.[0m
[32m[I 2022-04-21 13:08:44,707][0m Trial 576 finished with value: 0.8987882212583397 and parameters: {'splitter': 'random', 'min_samples_split': 0.019494165405715906, 'min_samples_leaf': 0.03786409844905579, 'min_weight_fraction_leaf': 0.031768400025950966, 'max_features': 0.895718794496047}. Best is trial 253 with value: 0.9108382257790575.[0m
[32m[I 2022-04-21 13:08:47,599][0m Trial 577 finished with value: 0.3425804518366971 and parameters: {'splitter': 'random', 'min_samples_split': 0.1911219526885534, 'min_samples_leaf': 0.01885877375684171, 'min_weight_fraction_leaf': 0.30304922704933934, 'max_features': 0.9556743209128381}. Best is trial 253 with value: 0.9108382257790575.[0m
[32m[I 2022-04-21 13:08:50,145][0m Trial 578 finished with value: 0.9068149719282539 and parameters: {'splitter': 'random', 'min_samples_split': 0.009453991824383862, 'min_samples_leaf': 0.0550055105739308, 'min_weight_fraction_leaf': 0.03825808720222064, 'max_features': 0.984332877282547}. Best is trial 253 with value: 0.9108382257790575.[0m
[32m[I 2022-04-21 13:08:52,903][0m Trial 579 finished with value: 0.9061697835248047 and parameters: {'splitter': 'random', 'min_samples_split': 0.03850922360142514, 'min_samples_leaf': 0.031687833239373984, 'min_weight_fraction_leaf': 0.024230414922347333, 'max_features': 0.9400575674384986}. Best is trial 253 with value: 0.9108382257790575.[0m
[32m[I 2022-04-21 13:08:54,630][0m Trial 580 finished with value: 0.9034820918949675 and parameters: {'splitter': 'random', 'min_samples_split': 0.024758608568661154, 'min_samples_leaf': 0.01154735763145803, 'min_weight_fraction_leaf': 0.05201414563084836, 'max_features': 0.919986246832945}. Best is trial 253 with value: 0.9108382257790575.[0m
[32m[I 2022-04-21 13:08:56,148][0m Trial 581 finished with value: 0.9075017303083565 and parameters: {'splitter': 'random', 'min_samples_split': 0.04535324563645041, 'min_samples_leaf': 0.023571740665208805, 'min_weight_fraction_leaf': 0.00824893689484399, 'max_features': 0.9640394776732136}. Best is trial 253 with value: 0.9108382257790575.[0m
[32m[I 2022-04-21 13:08:57,583][0m Trial 582 finished with value: 0.9028895378184684 and parameters: {'splitter': 'random', 'min_samples_split': 0.028083557839149672, 'min_samples_leaf': 0.04266985878504884, 'min_weight_fraction_leaf': 0.030967790851702696, 'max_features': 0.8915714690294407}. Best is trial 253 with value: 0.9108382257790575.[0m
/media/san2_ssd/data/Workdir/survival/utils.py:305: RuntimeWarning: invalid value encountered in true_divide
  pdfs = np.gradient(1-survs,axis=1)/norms
[32m[I 2022-04-21 13:09:00,043][0m Trial 583 finished with value: 0.798082152582671 and parameters: {'splitter': 'random', 'min_samples_split': 0.00987701275114613, 'min_samples_leaf': 0.012981993827515961, 'min_weight_fraction_leaf': 0.015281764076885364, 'max_features': 0.9794088628154014}. Best is trial 253 with value: 0.9108382257790575.[0m
[32m[I 2022-04-21 13:09:01,744][0m Trial 584 finished with value: 0.9042575015591646 and parameters: {'splitter': 'random', 'min_samples_split': 0.049448603744240795, 'min_samples_leaf': 0.0313693048009777, 'min_weight_fraction_leaf': 0.04214199282881791, 'max_features': 0.9455381001976286}. Best is trial 253 with value: 0.9108382257790575.[0m
[32m[I 2022-04-21 13:09:03,105][0m Trial 585 finished with value: 0.9070037192002103 and parameters: {'splitter': 'random', 'min_samples_split': 0.035530989933759805, 'min_samples_leaf': 0.046595598284261505, 'min_weight_fraction_leaf': 0.02369150241341879, 'max_features': 0.9185678220217779}. Best is trial 253 with value: 0.9108382257790575.[0m
[32m[I 2022-04-21 13:09:04,204][0m Trial 586 finished with value: 0.9002255937495669 and parameters: {'splitter': 'random', 'min_samples_split': 0.016789070944660516, 'min_samples_leaf': 0.020821461644430245, 'min_weight_fraction_leaf': 0.035540186915167124, 'max_features': 0.8768314263926152}. Best is trial 253 with value: 0.9108382257790575.[0m
[32m[I 2022-04-21 13:09:05,947][0m Trial 587 finished with value: 0.9063452115209426 and parameters: {'splitter': 'random', 'min_samples_split': 0.052183427297250846, 'min_samples_leaf': 0.009875414676392165, 'min_weight_fraction_leaf': 0.01888744906997375, 'max_features': 0.9634697766298362}. Best is trial 253 with value: 0.9108382257790575.[0m
[32m[I 2022-04-21 13:09:07,464][0m Trial 588 finished with value: 0.8993793342742565 and parameters: {'splitter': 'random', 'min_samples_split': 0.001341952623310029, 'min_samples_leaf': 0.03482572072798379, 'min_weight_fraction_leaf': 0.05563148539831471, 'max_features': 0.9038523020644574}. Best is trial 253 with value: 0.9108382257790575.[0m
[32m[I 2022-04-21 13:09:08,440][0m Trial 589 finished with value: 0.8806277071744931 and parameters: {'splitter': 'random', 'min_samples_split': 0.026218794384891858, 'min_samples_leaf': 0.1851313400949918, 'min_weight_fraction_leaf': 0.009295382637670359, 'max_features': 0.9384596867010842}. Best is trial 253 with value: 0.9108382257790575.[0m
[32m[I 2022-04-21 13:09:10,282][0m Trial 590 finished with value: 0.696875459376303 and parameters: {'splitter': 'random', 'min_samples_split': 0.4463465668548176, 'min_samples_leaf': 0.02456020534887969, 'min_weight_fraction_leaf': 0.0450695316725682, 'max_features': 0.9836000823832461}. Best is trial 253 with value: 0.9108382257790575.[0m
[32m[I 2022-04-21 13:11:34,636][0m Trial 591 finished with value: 0.8899048484712256 and parameters: {'splitter': 'best', 'min_samples_split': 0.019578564052140167, 'min_samples_leaf': 0.05737143152899103, 'min_weight_fraction_leaf': 0.02950527267836145, 'max_features': 0.9200526100552804}. Best is trial 253 with value: 0.9108382257790575.[0m
[32m[I 2022-04-21 13:11:35,733][0m Trial 592 finished with value: 0.9013347848102073 and parameters: {'splitter': 'random', 'min_samples_split': 0.03787667511671626, 'min_samples_leaf': 0.04314126890418045, 'min_weight_fraction_leaf': 0.01938543447242294, 'max_features': 0.9990145803772266}. Best is trial 253 with value: 0.9108382257790575.[0m
[32m[I 2022-04-21 13:11:38,385][0m Trial 593 finished with value: 0.9014505351659079 and parameters: {'splitter': 'random', 'min_samples_split': 0.00982455885783913, 'min_samples_leaf': 0.012177496120179682, 'min_weight_fraction_leaf': 0.036358321166468956, 'max_features': 0.9536408706743612}. Best is trial 253 with value: 0.9108382257790575.[0m
[32m[I 2022-04-21 13:11:41,391][0m Trial 594 finished with value: 0.9053587044566571 and parameters: {'splitter': 'random', 'min_samples_split': 0.03183683065178934, 'min_samples_leaf': 0.028683498959204124, 'min_weight_fraction_leaf': 0.007352662499022104, 'max_features': 0.8957362187305368}. Best is trial 253 with value: 0.9108382257790575.[0m
[32m[I 2022-04-21 13:11:42,113][0m Trial 595 finished with value: 0.25 and parameters: {'splitter': 'random', 'min_samples_split': 0.05197359169507639, 'min_samples_leaf': 0.43759805363933557, 'min_weight_fraction_leaf': 0.02808777371793955, 'max_features': 0.5472233198336972}. Best is trial 253 with value: 0.9108382257790575.[0m
[32m[I 2022-04-21 13:11:43,261][0m Trial 596 finished with value: 0.9046892116671279 and parameters: {'splitter': 'random', 'min_samples_split': 0.42525335756086746, 'min_samples_leaf': 0.019083238867276902, 'min_weight_fraction_leaf': 0.0002492637768806531, 'max_features': 0.9296160309388264}. Best is trial 253 with value: 0.9108382257790575.[0m
[32m[I 2022-04-21 13:11:45,226][0m Trial 597 finished with value: 0.8988433204303405 and parameters: {'splitter': 'random', 'min_samples_split': 0.017827412391476987, 'min_samples_leaf': 0.03877005423555838, 'min_weight_fraction_leaf': 0.04508814546539129, 'max_features': 0.8601475113117978}. Best is trial 253 with value: 0.9108382257790575.[0m
[32m[I 2022-04-21 13:11:46,838][0m Trial 598 finished with value: 0.890482997054866 and parameters: {'splitter': 'random', 'min_samples_split': 0.03863569123301432, 'min_samples_leaf': 0.06867089427935164, 'min_weight_fraction_leaf': 0.019341393825371034, 'max_features': 0.9716528557813578}. Best is trial 253 with value: 0.9108382257790575.[0m
[32m[I 2022-04-21 13:11:49,301][0m Trial 599 finished with value: 0.9010981909983877 and parameters: {'splitter': 'random', 'min_samples_split': 0.027229370700551557, 'min_samples_leaf': 0.009554867186152605, 'min_weight_fraction_leaf': 0.029905547820992216, 'max_features': 0.9999303059405914}. Best is trial 253 with value: 0.9108382257790575.[0m
[32m[I 2022-04-21 13:11:50,314][0m Trial 600 finished with value: 0.9035374272070019 and parameters: {'splitter': 'random', 'min_samples_split': 0.008186717171710326, 'min_samples_leaf': 0.030366904004018994, 'min_weight_fraction_leaf': 0.05348865133848632, 'max_features': 0.9411892077727921}. Best is trial 253 with value: 0.9108382257790575.[0m
[32m[I 2022-04-21 13:11:51,950][0m Trial 601 finished with value: 0.3425804518366971 and parameters: {'splitter': 'random', 'min_samples_split': 0.21480995834068747, 'min_samples_leaf': 0.374819398158051, 'min_weight_fraction_leaf': 0.01394834374746728, 'max_features': 0.9031024920019944}. Best is trial 253 with value: 0.9108382257790575.[0m
[32m[I 2022-04-21 13:11:54,213][0m Trial 602 finished with value: 0.9024755452585527 and parameters: {'splitter': 'random', 'min_samples_split': 0.04362898465625255, 'min_samples_leaf': 0.04943161432829493, 'min_weight_fraction_leaf': 0.03886153386343522, 'max_features': 0.9601285193688627}. Best is trial 253 with value: 0.9108382257790575.[0m
[32m[I 2022-04-21 13:11:56,817][0m Trial 603 finished with value: 0.9053171478998795 and parameters: {'splitter': 'random', 'min_samples_split': 0.02497220036180081, 'min_samples_leaf': 0.019625951312854332, 'min_weight_fraction_leaf': 0.02276436477330456, 'max_features': 0.9321600768609555}. Best is trial 253 with value: 0.9108382257790575.[0m
[32m[I 2022-04-21 13:11:57,903][0m Trial 604 finished with value: 0.9036661199772602 and parameters: {'splitter': 'random', 'min_samples_split': 0.17616973322375837, 'min_samples_leaf': 0.036443898977423166, 'min_weight_fraction_leaf': 0.033878022991377876, 'max_features': 0.6153890325132515}. Best is trial 253 with value: 0.9108382257790575.[0m
[32m[I 2022-04-21 13:11:59,732][0m Trial 605 finished with value: 0.9068422141505674 and parameters: {'splitter': 'random', 'min_samples_split': 0.05458618913784477, 'min_samples_leaf': 0.0015280496215336128, 'min_weight_fraction_leaf': 0.04589244905765982, 'max_features': 0.9186824830949497}. Best is trial 253 with value: 0.9108382257790575.[0m
[32m[I 2022-04-21 13:12:00,772][0m Trial 606 finished with value: 0.3841175446621478 and parameters: {'splitter': 'random', 'min_samples_split': 0.49176336736222137, 'min_samples_leaf': 0.01907024432765329, 'min_weight_fraction_leaf': 0.013479798916477482, 'max_features': 0.8771884418864933}. Best is trial 253 with value: 0.9108382257790575.[0m
[32m[I 2022-04-21 13:12:02,304][0m Trial 607 finished with value: 0.9036203255502164 and parameters: {'splitter': 'random', 'min_samples_split': 0.016034771692881335, 'min_samples_leaf': 0.030364472324995933, 'min_weight_fraction_leaf': 0.0266950251998576, 'max_features': 0.949709113950347}. Best is trial 253 with value: 0.9108382257790575.[0m
[32m[I 2022-04-21 13:12:03,596][0m Trial 608 finished with value: 0.9070842947877626 and parameters: {'splitter': 'random', 'min_samples_split': 0.03578817677682899, 'min_samples_leaf': 0.047522241511309564, 'min_weight_fraction_leaf': 0.06136467761230674, 'max_features': 0.9805538725660826}. Best is trial 253 with value: 0.9108382257790575.[0m
[32m[I 2022-04-21 13:12:05,481][0m Trial 609 finished with value: 0.9083645748386966 and parameters: {'splitter': 'random', 'min_samples_split': 0.008542557092419089, 'min_samples_leaf': 0.009966113601363562, 'min_weight_fraction_leaf': 0.03933154306100012, 'max_features': 0.9090233419361442}. Best is trial 253 with value: 0.9108382257790575.[0m
[32m[I 2022-04-21 13:15:05,966][0m Trial 610 finished with value: 0.8834404233312864 and parameters: {'splitter': 'best', 'min_samples_split': 0.008465796963955564, 'min_samples_leaf': 0.022041935818085806, 'min_weight_fraction_leaf': 0.04978802343672581, 'max_features': 0.8919212598286945}. Best is trial 253 with value: 0.9108382257790575.[0m
[32m[I 2022-04-21 13:15:06,849][0m Trial 611 finished with value: 0.9027521621117234 and parameters: {'splitter': 'random', 'min_samples_split': 0.35783716669182447, 'min_samples_leaf': 0.05769978107282371, 'min_weight_fraction_leaf': 0.042024893527003566, 'max_features': 0.9102148890069232}. Best is trial 253 with value: 0.9108382257790575.[0m
[32m[I 2022-04-21 13:15:07,950][0m Trial 612 finished with value: 0.9060898160213577 and parameters: {'splitter': 'random', 'min_samples_split': 0.01104376471089795, 'min_samples_leaf': 0.04158158746813719, 'min_weight_fraction_leaf': 0.05592269108260627, 'max_features': 0.9260063601541748}. Best is trial 253 with value: 0.9108382257790575.[0m
[32m[I 2022-04-21 13:15:09,167][0m Trial 613 finished with value: 0.8996357911488795 and parameters: {'splitter': 'random', 'min_samples_split': 0.0039797230528582014, 'min_samples_leaf': 0.01105933003701449, 'min_weight_fraction_leaf': 0.0357642874616496, 'max_features': 0.8844379426492601}. Best is trial 253 with value: 0.9108382257790575.[0m
[32m[I 2022-04-21 13:15:10,123][0m Trial 614 finished with value: 0.8792766235598422 and parameters: {'splitter': 'random', 'min_samples_split': 0.02512564268224868, 'min_samples_leaf': 0.02847087043811835, 'min_weight_fraction_leaf': 0.04407826807139243, 'max_features': 0.30222910740676656}. Best is trial 253 with value: 0.9108382257790575.[0m
[32m[I 2022-04-21 13:15:11,731][0m Trial 615 finished with value: 0.910004371893559 and parameters: {'splitter': 'random', 'min_samples_split': 0.01868061234880662, 'min_samples_leaf': 0.01876812255659213, 'min_weight_fraction_leaf': 0.03441233599636451, 'max_features': 0.913763367037731}. Best is trial 253 with value: 0.9108382257790575.[0m
[32m[I 2022-04-21 13:15:13,489][0m Trial 616 finished with value: 0.8991188212984321 and parameters: {'splitter': 'random', 'min_samples_split': 0.019598477999046314, 'min_samples_leaf': 0.009392758388353104, 'min_weight_fraction_leaf': 0.05628409046274417, 'max_features': 0.9050210735613192}. Best is trial 253 with value: 0.9108382257790575.[0m
[32m[I 2022-04-21 13:15:14,378][0m Trial 617 finished with value: 0.37352803050186595 and parameters: {'splitter': 'random', 'min_samples_split': 0.033139452337821104, 'min_samples_leaf': 0.2481682576150193, 'min_weight_fraction_leaf': 0.04226883565849979, 'max_features': 0.8728723700486014}. Best is trial 253 with value: 0.9108382257790575.[0m
[32m[I 2022-04-21 13:15:15,387][0m Trial 618 finished with value: 0.3425804518366971 and parameters: {'splitter': 'random', 'min_samples_split': 0.019583775418995055, 'min_samples_leaf': 0.3103645845607804, 'min_weight_fraction_leaf': 0.061906934816008924, 'max_features': 0.9090777147988185}. Best is trial 253 with value: 0.9108382257790575.[0m
[32m[I 2022-04-21 13:15:17,163][0m Trial 619 finished with value: 0.9029953854647415 and parameters: {'splitter': 'random', 'min_samples_split': 0.029496977241215687, 'min_samples_leaf': 0.036441681684951904, 'min_weight_fraction_leaf': 0.03122822024643541, 'max_features': 0.8924363552066285}. Best is trial 253 with value: 0.9108382257790575.[0m
