[32m[I 2022-04-21 12:12:41,522][0m Trial 249 finished with value: 0.902863816032033 and parameters: {'splitter': 'random', 'min_samples_split': 0.05109888872153843, 'min_samples_leaf': 0.023504028831873323, 'min_weight_fraction_leaf': 0.03292178392931623, 'max_features': 0.9035420906868509}. Best is trial 232 with value: 0.909669016857861.[0m
[32m[I 2022-04-21 12:12:42,837][0m Trial 250 finished with value: 0.9034327170609309 and parameters: {'splitter': 'random', 'min_samples_split': 0.04043591409822266, 'min_samples_leaf': 0.0012210390158352256, 'min_weight_fraction_leaf': 0.05536195987881413, 'max_features': 0.9414581922556271}. Best is trial 232 with value: 0.909669016857861.[0m
[32m[I 2022-04-21 12:12:44,038][0m Trial 251 finished with value: 0.9083327455927108 and parameters: {'splitter': 'random', 'min_samples_split': 0.023634462769032687, 'min_samples_leaf': 0.033496222991388165, 'min_weight_fraction_leaf': 0.024691144356504456, 'max_features': 0.9143799044318764}. Best is trial 232 with value: 0.909669016857861.[0m
[32m[I 2022-04-21 12:12:45,463][0m Trial 252 finished with value: 0.8979187506590325 and parameters: {'splitter': 'random', 'min_samples_split': 0.020295981153675015, 'min_samples_leaf': 0.032296470209930726, 'min_weight_fraction_leaf': 0.012725374937109204, 'max_features': 0.8878873794415668}. Best is trial 232 with value: 0.909669016857861.[0m
[32m[I 2022-04-21 12:12:47,128][0m Trial 253 finished with value: 0.9108382257790575 and parameters: {'splitter': 'random', 'min_samples_split': 0.028037300456375428, 'min_samples_leaf': 0.01853602557414284, 'min_weight_fraction_leaf': 0.023602422671999662, 'max_features': 0.9212147358692193}. Best is trial 253 with value: 0.9108382257790575.[0m
[32m[I 2022-04-21 12:12:49,336][0m Trial 254 finished with value: 0.9080462680244221 and parameters: {'splitter': 'random', 'min_samples_split': 0.01043933421630414, 'min_samples_leaf': 0.021986804208717334, 'min_weight_fraction_leaf': 0.018911279670032744, 'max_features': 0.9203855306984777}. Best is trial 253 with value: 0.9108382257790575.[0m
[32m[I 2022-04-21 12:12:50,267][0m Trial 255 finished with value: 0.3425804518366971 and parameters: {'splitter': 'random', 'min_samples_split': 0.008529276542399357, 'min_samples_leaf': 0.42290755893402987, 'min_weight_fraction_leaf': 0.018577889413742978, 'max_features': 0.9333029056104151}. Best is trial 253 with value: 0.9108382257790575.[0m
[32m[I 2022-04-21 12:12:52,044][0m Trial 256 finished with value: 0.6774791800414284 and parameters: {'splitter': 'random', 'min_samples_split': 0.02012634301498903, 'min_samples_leaf': 0.01857071865867138, 'min_weight_fraction_leaf': 0.23744104882915268, 'max_features': 0.9189926006874016}. Best is trial 253 with value: 0.9108382257790575.[0m
[32m[I 2022-04-21 12:12:53,945][0m Trial 257 finished with value: 0.9013336702065711 and parameters: {'splitter': 'random', 'min_samples_split': 0.014748991203423992, 'min_samples_leaf': 0.02428817941116428, 'min_weight_fraction_leaf': 0.002364500075999837, 'max_features': 0.8951844866597679}. Best is trial 253 with value: 0.9108382257790575.[0m
[32m[I 2022-04-21 12:12:56,637][0m Trial 258 finished with value: 0.90631379897085 and parameters: {'splitter': 'random', 'min_samples_split': 0.029977307956561085, 'min_samples_leaf': 0.016220304864310767, 'min_weight_fraction_leaf': 0.0311052535457978, 'max_features': 0.9496176022707453}. Best is trial 253 with value: 0.9108382257790575.[0m
[32m[I 2022-04-21 12:15:26,586][0m Trial 259 finished with value: 0.8877716530075939 and parameters: {'splitter': 'best', 'min_samples_split': 0.02965330019698877, 'min_samples_leaf': 0.029869279457430092, 'min_weight_fraction_leaf': 0.012146097287937621, 'max_features': 0.8782868830749958}. Best is trial 253 with value: 0.9108382257790575.[0m
[32m[I 2022-04-21 12:15:28,450][0m Trial 260 finished with value: 0.8962421327210034 and parameters: {'splitter': 'random', 'min_samples_split': 0.002426608549080122, 'min_samples_leaf': 0.012222645741374272, 'min_weight_fraction_leaf': 0.0253383955279289, 'max_features': 0.9284251444667234}. Best is trial 253 with value: 0.9108382257790575.[0m
[32m[I 2022-04-21 12:15:30,195][0m Trial 261 finished with value: 0.9041457305738018 and parameters: {'splitter': 'random', 'min_samples_split': 0.012115721218737774, 'min_samples_leaf': 0.03743215467572972, 'min_weight_fraction_leaf': 0.03602300475033133, 'max_features': 0.9092433301990854}. Best is trial 253 with value: 0.9108382257790575.[0m
[32m[I 2022-04-21 12:15:32,766][0m Trial 262 finished with value: 0.9026691529049948 and parameters: {'splitter': 'random', 'min_samples_split': 0.026071212796896868, 'min_samples_leaf': 0.024907939574163904, 'min_weight_fraction_leaf': 0.0406871035296362, 'max_features': 0.9613192624377336}. Best is trial 253 with value: 0.9108382257790575.[0m
[32m[I 2022-04-21 12:15:34,443][0m Trial 263 finished with value: 0.9000015412708067 and parameters: {'splitter': 'random', 'min_samples_split': 0.03596732776333492, 'min_samples_leaf': 0.03605649927043119, 'min_weight_fraction_leaf': 0.025010552183193122, 'max_features': 0.9366048611532756}. Best is trial 253 with value: 0.9108382257790575.[0m
[32m[I 2022-04-21 12:15:35,862][0m Trial 264 finished with value: 0.9008465312785429 and parameters: {'splitter': 'random', 'min_samples_split': 0.020627666699164486, 'min_samples_leaf': 0.0169233451677824, 'min_weight_fraction_leaf': 0.04689734901170528, 'max_features': 0.8607366660815237}. Best is trial 253 with value: 0.9108382257790575.[0m
[32m[I 2022-04-21 12:15:37,681][0m Trial 265 finished with value: 0.901386206482013 and parameters: {'splitter': 'random', 'min_samples_split': 0.04299278394416578, 'min_samples_leaf': 0.023927149634075877, 'min_weight_fraction_leaf': 0.01214090508039051, 'max_features': 0.8956709934620352}. Best is trial 253 with value: 0.9108382257790575.[0m
[32m[I 2022-04-21 12:15:38,787][0m Trial 266 finished with value: 0.9027521621117234 and parameters: {'splitter': 'random', 'min_samples_split': 0.37828129966782637, 'min_samples_leaf': 0.008918232341011082, 'min_weight_fraction_leaf': 0.030674109226785956, 'max_features': 0.9182693376485942}. Best is trial 253 with value: 0.9108382257790575.[0m
[32m[I 2022-04-21 12:15:40,332][0m Trial 267 finished with value: 0.9026990429796106 and parameters: {'splitter': 'random', 'min_samples_split': 0.03162280546664078, 'min_samples_leaf': 0.0514624935591558, 'min_weight_fraction_leaf': 0.06417600082077343, 'max_features': 0.9483355400280411}. Best is trial 253 with value: 0.9108382257790575.[0m
[32m[I 2022-04-21 12:15:42,389][0m Trial 268 finished with value: 0.9010934120632308 and parameters: {'splitter': 'random', 'min_samples_split': 0.012083709149433462, 'min_samples_leaf': 0.039526621195664864, 'min_weight_fraction_leaf': 0.048258083139818345, 'max_features': 0.8966246316969827}. Best is trial 253 with value: 0.9108382257790575.[0m
[32m[I 2022-04-21 12:15:44,398][0m Trial 269 finished with value: 0.9037426174420805 and parameters: {'splitter': 'random', 'min_samples_split': 0.0219084737860984, 'min_samples_leaf': 0.030868336685937886, 'min_weight_fraction_leaf': 0.03832689717773991, 'max_features': 0.9227912025599248}. Best is trial 253 with value: 0.9108382257790575.[0m
[32m[I 2022-04-21 12:15:46,228][0m Trial 270 finished with value: 0.9014999230212325 and parameters: {'splitter': 'random', 'min_samples_split': 0.0452232102492574, 'min_samples_leaf': 0.018597871499553352, 'min_weight_fraction_leaf': 0.00042013856101387123, 'max_features': 0.8701227693993381}. Best is trial 253 with value: 0.9108382257790575.[0m
[32m[I 2022-04-21 12:15:48,847][0m Trial 271 finished with value: 0.9032639482001971 and parameters: {'splitter': 'random', 'min_samples_split': 0.035294337761386595, 'min_samples_leaf': 0.02844263548319327, 'min_weight_fraction_leaf': 0.02061896433709151, 'max_features': 0.9604432368824762}. Best is trial 253 with value: 0.9108382257790575.[0m
[32m[I 2022-04-21 12:15:50,528][0m Trial 272 finished with value: 0.3425804518366971 and parameters: {'splitter': 'random', 'min_samples_split': 0.05066288270696799, 'min_samples_leaf': 0.06293406886935018, 'min_weight_fraction_leaf': 0.41345116697297135, 'max_features': 0.9125412070944212}. Best is trial 253 with value: 0.9108382257790575.[0m
[32m[I 2022-04-21 12:15:52,826][0m Trial 273 finished with value: 0.9040780628827217 and parameters: {'splitter': 'random', 'min_samples_split': 0.0022884762776677614, 'min_samples_leaf': 0.04247053583044369, 'min_weight_fraction_leaf': 0.057218754515910714, 'max_features': 0.9370230492766035}. Best is trial 253 with value: 0.9108382257790575.[0m
[32m[I 2022-04-21 12:15:55,672][0m Trial 274 finished with value: 0.8907962585385985 and parameters: {'splitter': 'random', 'min_samples_split': 0.026700184709488758, 'min_samples_leaf': 0.007761537444609044, 'min_weight_fraction_leaf': 0.07046350392437727, 'max_features': 0.8828614562679407}. Best is trial 253 with value: 0.9108382257790575.[0m
[32m[I 2022-04-21 12:15:57,290][0m Trial 275 finished with value: 0.8995694559748797 and parameters: {'splitter': 'random', 'min_samples_split': 0.05741745977334935, 'min_samples_leaf': 0.15132501981589042, 'min_weight_fraction_leaf': 0.029858080286917808, 'max_features': 0.9045062724878229}. Best is trial 253 with value: 0.9108382257790575.[0m
[32m[I 2022-04-21 12:15:59,273][0m Trial 276 finished with value: 0.8997711530875474 and parameters: {'splitter': 'random', 'min_samples_split': 0.04191244231450671, 'min_samples_leaf': 0.05108266417810013, 'min_weight_fraction_leaf': 0.04575267609003062, 'max_features': 0.8446301665208257}. Best is trial 253 with value: 0.9108382257790575.[0m
[32m[I 2022-04-21 12:16:01,527][0m Trial 277 finished with value: 0.9034448158741533 and parameters: {'splitter': 'random', 'min_samples_split': 0.010386829601550318, 'min_samples_leaf': 0.031888457729159825, 'min_weight_fraction_leaf': 0.038192943942533975, 'max_features': 0.9750245189758691}. Best is trial 253 with value: 0.9108382257790575.[0m
[32m[I 2022-04-21 12:18:46,744][0m Trial 278 finished with value: 0.8882263883180282 and parameters: {'splitter': 'best', 'min_samples_split': 0.47746931648226926, 'min_samples_leaf': 0.019202930695552473, 'min_weight_fraction_leaf': 0.017309632789178703, 'max_features': 0.9339388040841615}. Best is trial 253 with value: 0.9108382257790575.[0m
[32m[I 2022-04-21 12:18:48,380][0m Trial 279 finished with value: 0.8797245818194697 and parameters: {'splitter': 'random', 'min_samples_split': 0.01913671005844178, 'min_samples_leaf': 0.04129898137124444, 'min_weight_fraction_leaf': 0.19920948908315814, 'max_features': 0.911337021100426}. Best is trial 253 with value: 0.9108382257790575.[0m
[32m[I 2022-04-21 12:18:49,215][0m Trial 280 finished with value: 0.3425804518366971 and parameters: {'splitter': 'random', 'min_samples_split': 0.05684307561623328, 'min_samples_leaf': 0.013088201619328207, 'min_weight_fraction_leaf': 0.29858116292806436, 'max_features': 0.949088243182404}. Best is trial 253 with value: 0.9108382257790575.[0m
[32m[I 2022-04-21 12:18:50,747][0m Trial 281 finished with value: 0.8991941328692677 and parameters: {'splitter': 'random', 'min_samples_split': 0.03671423360706069, 'min_samples_leaf': 0.023641174743072046, 'min_weight_fraction_leaf': 0.058395574362329186, 'max_features': 0.8894106416726487}. Best is trial 253 with value: 0.9108382257790575.[0m
[32m[I 2022-04-21 12:18:52,447][0m Trial 282 finished with value: 0.904042237336791 and parameters: {'splitter': 'random', 'min_samples_split': 0.047546113104879356, 'min_samples_leaf': 0.05732871470334812, 'min_weight_fraction_leaf': 0.05032283514375227, 'max_features': 0.9241126252769678}. Best is trial 253 with value: 0.9108382257790575.[0m
[32m[I 2022-04-21 12:18:54,643][0m Trial 283 finished with value: 0.8862851391299547 and parameters: {'splitter': 'random', 'min_samples_split': 0.0805067415917781, 'min_samples_leaf': 0.12913405770139758, 'min_weight_fraction_leaf': 0.0764837541455991, 'max_features': 0.8725912574425783}. Best is trial 253 with value: 0.9108382257790575.[0m
[32m[I 2022-04-21 12:18:57,795][0m Trial 284 finished with value: 0.9045005964965582 and parameters: {'splitter': 'random', 'min_samples_split': 0.06494676325144635, 'min_samples_leaf': 0.03460162441093137, 'min_weight_fraction_leaf': 0.027784986361656237, 'max_features': 0.9579371168875312}. Best is trial 253 with value: 0.9108382257790575.[0m
[32m[I 2022-04-21 12:19:00,160][0m Trial 285 finished with value: 0.9007285034987813 and parameters: {'splitter': 'random', 'min_samples_split': 0.02661178565227538, 'min_samples_leaf': 0.045242944617888685, 'min_weight_fraction_leaf': 0.03945180338110709, 'max_features': 0.9319360677693844}. Best is trial 253 with value: 0.9108382257790575.[0m
[32m[I 2022-04-21 12:19:01,378][0m Trial 286 finished with value: 0.7884756581942877 and parameters: {'splitter': 'random', 'min_samples_split': 0.051339123599025045, 'min_samples_leaf': 0.0012925791918680617, 'min_weight_fraction_leaf': 0.06190147167766765, 'max_features': 0.17596697877181627}. Best is trial 253 with value: 0.9108382257790575.[0m
[32m[I 2022-04-21 12:19:03,728][0m Trial 287 finished with value: 0.9020088082556542 and parameters: {'splitter': 'random', 'min_samples_split': 0.037748876997010274, 'min_samples_leaf': 0.026455201864671343, 'min_weight_fraction_leaf': 0.012669075121460748, 'max_features': 0.9015053746992101}. Best is trial 253 with value: 0.9108382257790575.[0m
[32m[I 2022-04-21 12:19:05,875][0m Trial 288 finished with value: 0.9027516482401932 and parameters: {'splitter': 'random', 'min_samples_split': 0.09574816560873575, 'min_samples_leaf': 0.010852664280146314, 'min_weight_fraction_leaf': 0.04822227544770858, 'max_features': 0.9743817662497979}. Best is trial 253 with value: 0.9108382257790575.[0m
[32m[I 2022-04-21 12:19:07,461][0m Trial 289 finished with value: 0.909537474018656 and parameters: {'splitter': 'random', 'min_samples_split': 0.01649525146622347, 'min_samples_leaf': 0.03485035578537446, 'min_weight_fraction_leaf': 0.030661709912676097, 'max_features': 0.9226852152526922}. Best is trial 253 with value: 0.9108382257790575.[0m
[32m[I 2022-04-21 12:19:08,465][0m Trial 290 finished with value: 0.9036820653658436 and parameters: {'splitter': 'random', 'min_samples_split': 0.018854976049940984, 'min_samples_leaf': 0.04948365825073104, 'min_weight_fraction_leaf': 0.023365909574648798, 'max_features': 0.9390747286522021}. Best is trial 253 with value: 0.9108382257790575.[0m
[32m[I 2022-04-21 12:19:09,958][0m Trial 291 finished with value: 0.902863816032033 and parameters: {'splitter': 'random', 'min_samples_split': 0.008903233045482012, 'min_samples_leaf': 0.021197274114079307, 'min_weight_fraction_leaf': 0.032870830874357965, 'max_features': 0.891941203417117}. Best is trial 253 with value: 0.9108382257790575.[0m
[32m[I 2022-04-21 12:19:10,926][0m Trial 292 finished with value: 0.908522913864583 and parameters: {'splitter': 'random', 'min_samples_split': 0.0129871583559596, 'min_samples_leaf': 0.038844624442396294, 'min_weight_fraction_leaf': 0.021368023240627747, 'max_features': 0.9131467491843488}. Best is trial 253 with value: 0.9108382257790575.[0m
[32m[I 2022-04-21 12:19:12,152][0m Trial 293 finished with value: 0.9059263915791119 and parameters: {'splitter': 'random', 'min_samples_split': 0.002282940150379012, 'min_samples_leaf': 0.032750805673339455, 'min_weight_fraction_leaf': 0.017560512379292403, 'max_features': 0.9460576154115272}. Best is trial 253 with value: 0.9108382257790575.[0m
[32m[I 2022-04-21 12:19:13,525][0m Trial 294 finished with value: 0.9049884986385026 and parameters: {'splitter': 'random', 'min_samples_split': 0.019073193588460068, 'min_samples_leaf': 0.015252077472420026, 'min_weight_fraction_leaf': 0.006057105786074768, 'max_features': 0.9197725592400715}. Best is trial 253 with value: 0.9108382257790575.[0m
[32m[I 2022-04-21 12:19:14,626][0m Trial 295 finished with value: 0.25 and parameters: {'splitter': 'random', 'min_samples_split': 0.012113724027057446, 'min_samples_leaf': 0.0386719971981315, 'min_weight_fraction_leaf': 0.02468619057377496, 'max_features': 0.04648116806481545}. Best is trial 253 with value: 0.9108382257790575.[0m
[32m[I 2022-04-21 12:19:16,152][0m Trial 296 finished with value: 0.9050929575523581 and parameters: {'splitter': 'random', 'min_samples_split': 0.026744870228267735, 'min_samples_leaf': 0.025933559731689867, 'min_weight_fraction_leaf': 0.029739222247626526, 'max_features': 0.8690629300084391}. Best is trial 253 with value: 0.9108382257790575.[0m
/media/san2_ssd/data/Workdir/survival/utils.py:305: RuntimeWarning: invalid value encountered in true_divide
  pdfs = np.gradient(1-survs,axis=1)/norms
[32m[I 2022-04-21 12:22:53,486][0m Trial 297 finished with value: 0.8815896717243522 and parameters: {'splitter': 'best', 'min_samples_split': 0.031481450922322116, 'min_samples_leaf': 0.009353354059284957, 'min_weight_fraction_leaf': 0.010205488057562644, 'max_features': 0.9616923325701315}. Best is trial 253 with value: 0.9108382257790575.[0m
[32m[I 2022-04-21 12:22:54,633][0m Trial 298 finished with value: 0.90615548909462 and parameters: {'splitter': 'random', 'min_samples_split': 0.013610740832092821, 'min_samples_leaf': 0.06153285681009782, 'min_weight_fraction_leaf': 0.042706599515579376, 'max_features': 0.9296221454351855}. Best is trial 253 with value: 0.9108382257790575.[0m
[32m[I 2022-04-21 12:22:56,222][0m Trial 299 finished with value: 0.9054864748933162 and parameters: {'splitter': 'random', 'min_samples_split': 0.03174309481100214, 'min_samples_leaf': 0.021646512244198488, 'min_weight_fraction_leaf': 0.01839247537277086, 'max_features': 0.899704255264559}. Best is trial 253 with value: 0.9108382257790575.[0m
[32m[I 2022-04-21 12:22:58,272][0m Trial 300 finished with value: 0.9046547426286041 and parameters: {'splitter': 'random', 'min_samples_split': 0.0015115220017420487, 'min_samples_leaf': 0.036233321528528074, 'min_weight_fraction_leaf': 0.03274351390986356, 'max_features': 0.980327080956554}. Best is trial 253 with value: 0.9108382257790575.[0m
[32m[I 2022-04-21 12:23:00,414][0m Trial 301 finished with value: 0.9020208222400783 and parameters: {'splitter': 'random', 'min_samples_split': 0.022876060966990998, 'min_samples_leaf': 0.02881710878826839, 'min_weight_fraction_leaf': 0.05309396686019744, 'max_features': 0.8858006934458917}. Best is trial 253 with value: 0.9108382257790575.[0m
[32m[I 2022-04-21 12:23:01,751][0m Trial 302 finished with value: 0.3425804518366971 and parameters: {'splitter': 'random', 'min_samples_split': 0.04176553579663117, 'min_samples_leaf': 0.05254752167670253, 'min_weight_fraction_leaf': 0.3648053694640152, 'max_features': 0.9180653451679361}. Best is trial 253 with value: 0.9108382257790575.[0m
[32m[I 2022-04-21 12:23:03,449][0m Trial 303 finished with value: 0.9012166028809331 and parameters: {'splitter': 'random', 'min_samples_split': 0.015007553026765858, 'min_samples_leaf': 0.0018472811436257563, 'min_weight_fraction_leaf': 0.04108467149881955, 'max_features': 0.9491758682653524}. Best is trial 253 with value: 0.9108382257790575.[0m
[32m[I 2022-04-21 12:23:04,098][0m Trial 304 finished with value: 0.3425804518366971 and parameters: {'splitter': 'random', 'min_samples_split': 0.04537260523104314, 'min_samples_leaf': 0.2706478275421502, 'min_weight_fraction_leaf': 0.02124966972749017, 'max_features': 0.9327349063935642}. Best is trial 253 with value: 0.9108382257790575.[0m
[32m[I 2022-04-21 12:23:05,201][0m Trial 305 finished with value: 0.8995403787142979 and parameters: {'splitter': 'random', 'min_samples_split': 0.028665340551552225, 'min_samples_leaf': 0.01686583681442916, 'min_weight_fraction_leaf': 0.0494753573003656, 'max_features': 0.9056018459869692}. Best is trial 253 with value: 0.9108382257790575.[0m
[32m[I 2022-04-21 12:23:06,231][0m Trial 306 finished with value: 0.9008825739572117 and parameters: {'splitter': 'random', 'min_samples_split': 0.03738411691857818, 'min_samples_leaf': 0.04125502192927587, 'min_weight_fraction_leaf': 0.03098550834876379, 'max_features': 0.8780601846743508}. Best is trial 253 with value: 0.9108382257790575.[0m
[32m[I 2022-04-21 12:23:07,515][0m Trial 307 finished with value: 0.8922707762436165 and parameters: {'splitter': 'random', 'min_samples_split': 0.05548222815547288, 'min_samples_leaf': 0.07363003106876631, 'min_weight_fraction_leaf': 0.06715005591515977, 'max_features': 0.9571487387827454}. Best is trial 253 with value: 0.9108382257790575.[0m
[32m[I 2022-04-21 12:23:08,571][0m Trial 308 finished with value: 0.8795265918100839 and parameters: {'splitter': 'random', 'min_samples_split': 0.010429049827735945, 'min_samples_leaf': 0.19013603084443326, 'min_weight_fraction_leaf': 0.039799034117628515, 'max_features': 0.8486949832030297}. Best is trial 253 with value: 0.9108382257790575.[0m
[32m[I 2022-04-21 12:23:10,376][0m Trial 309 finished with value: 0.9043263933869776 and parameters: {'splitter': 'random', 'min_samples_split': 0.0243012178521585, 'min_samples_leaf': 0.028681463091798764, 'min_weight_fraction_leaf': 0.006574172354531921, 'max_features': 0.9183218173795084}. Best is trial 253 with value: 0.9108382257790575.[0m
[32m[I 2022-04-21 12:23:11,613][0m Trial 310 finished with value: 0.3425804518366971 and parameters: {'splitter': 'random', 'min_samples_split': 0.04781906842805292, 'min_samples_leaf': 0.016582145449351205, 'min_weight_fraction_leaf': 0.4623118006085185, 'max_features': 0.8961305895441425}. Best is trial 253 with value: 0.9108382257790575.[0m
