[32m[I 2022-04-23 06:04:51,987][0m Trial 392 finished with value: 0.9255092733915781 and parameters: {'n_hidden': 128, 'mixture_components': 3, 'use_sparse_layer': False, 'use_batchnorm': False, 'use_dropout': False, 'mlp_size_1': 4, 'mlp_size_2': 0, 'mlp_size_3': 0, 'kernel': 'Normal', 'loss_name': 'AlternativeNLLLoss'}. Best is trial 386 with value: 0.9276577369576131.[0m
[32m[I 2022-04-23 06:08:22,101][0m Trial 393 finished with value: 0.817166560877031 and parameters: {'n_hidden': 1024, 'mixture_components': 8, 'use_sparse_layer': False, 'use_batchnorm': False, 'use_dropout': False, 'mlp_size_1': 6, 'mlp_size_2': 1, 'mlp_size_3': 0, 'kernel': 'Normal', 'loss_name': 'NLLLoss'}. Best is trial 386 with value: 0.9276577369576131.[0m
[32m[I 2022-04-23 06:12:36,491][0m Trial 394 finished with value: 0.9263585031196749 and parameters: {'n_hidden': 1024, 'mixture_components': 6, 'use_sparse_layer': False, 'use_batchnorm': False, 'use_dropout': False, 'mlp_size_1': 6, 'mlp_size_2': 1, 'mlp_size_3': 0, 'kernel': 'Logistic', 'loss_name': 'AlternativeNLLLoss'}. Best is trial 386 with value: 0.9276577369576131.[0m
[32m[I 2022-04-23 06:17:47,176][0m Trial 395 finished with value: 0.9268513367415089 and parameters: {'n_hidden': 1024, 'mixture_components': 5, 'use_sparse_layer': False, 'use_batchnorm': False, 'use_dropout': False, 'mlp_size_1': 6, 'mlp_size_2': 1, 'mlp_size_3': 0, 'kernel': 'Normal', 'loss_name': 'AlternativeNLLLoss'}. Best is trial 386 with value: 0.9276577369576131.[0m
[32m[I 2022-04-23 06:23:14,225][0m Trial 396 finished with value: 0.9259357258646551 and parameters: {'n_hidden': 1024, 'mixture_components': 4, 'use_sparse_layer': False, 'use_batchnorm': False, 'use_dropout': False, 'mlp_size_1': 6, 'mlp_size_2': 1, 'mlp_size_3': 0, 'kernel': 'Normal', 'loss_name': 'AlternativeNLLLoss'}. Best is trial 386 with value: 0.9276577369576131.[0m
[32m[I 2022-04-23 06:30:25,267][0m Trial 397 finished with value: 0.9249359842613799 and parameters: {'n_hidden': 64, 'mixture_components': 6, 'use_sparse_layer': False, 'use_batchnorm': False, 'use_dropout': False, 'mlp_size_1': 3, 'mlp_size_2': 0, 'mlp_size_3': 0, 'kernel': 'Normal', 'loss_name': 'AlternativeNLLLoss'}. Best is trial 386 with value: 0.9276577369576131.[0m
[32m[I 2022-04-23 06:36:01,113][0m Trial 398 finished with value: 0.9275027973734448 and parameters: {'n_hidden': 1024, 'mixture_components': 6, 'use_sparse_layer': False, 'use_batchnorm': False, 'use_dropout': False, 'mlp_size_1': 6, 'mlp_size_2': 1, 'mlp_size_3': 0, 'kernel': 'Normal', 'loss_name': 'AlternativeNLLLoss'}. Best is trial 386 with value: 0.9276577369576131.[0m
[32m[I 2022-04-23 06:40:44,256][0m Trial 399 finished with value: 0.8222045533880437 and parameters: {'n_hidden': 1024, 'mixture_components': 6, 'use_sparse_layer': False, 'use_batchnorm': False, 'use_dropout': False, 'mlp_size_1': 1, 'mlp_size_2': 2, 'mlp_size_3': 4, 'kernel': 'Normal', 'loss_name': 'AlternativeNLLLoss'}. Best is trial 386 with value: 0.9276577369576131.[0m
[32m[I 2022-04-23 06:45:45,677][0m Trial 400 finished with value: 0.9267295637654744 and parameters: {'n_hidden': 1024, 'mixture_components': 6, 'use_sparse_layer': False, 'use_batchnorm': False, 'use_dropout': False, 'mlp_size_1': 6, 'mlp_size_2': 1, 'mlp_size_3': 0, 'kernel': 'Normal', 'loss_name': 'CensoredNLLLoss'}. Best is trial 386 with value: 0.9276577369576131.[0m
[32m[I 2022-04-23 06:48:53,214][0m Trial 401 finished with value: 0.21847722178890838 and parameters: {'n_hidden': 1024, 'mixture_components': 8, 'use_sparse_layer': False, 'use_batchnorm': False, 'use_dropout': True, 'dropout': 0.6313992253015885, 'mlp_size_1': 6, 'mlp_size_2': 1, 'mlp_size_3': 0, 'kernel': 'Normal', 'loss_name': 'AlternativeNLLLoss'}. Best is trial 386 with value: 0.9276577369576131.[0m
[32m[I 2022-04-23 06:55:40,179][0m Trial 402 finished with value: 0.8241416848447713 and parameters: {'n_hidden': 256, 'mixture_components': 6, 'use_sparse_layer': False, 'use_batchnorm': True, 'use_dropout': False, 'mlp_size_1': 5, 'mlp_size_2': 0, 'mlp_size_3': 0, 'kernel': 'Normal', 'loss_name': 'AlternativeNLLLoss'}. Best is trial 386 with value: 0.9276577369576131.[0m
[32m[I 2022-04-23 07:01:10,198][0m Trial 403 finished with value: 0.9259559234251384 and parameters: {'n_hidden': 1024, 'mixture_components': 6, 'use_sparse_layer': True, 'use_sparse_loss': True, 'lmbd': 2.988690382471913e-06, 'use_batchnorm': False, 'use_dropout': False, 'mlp_size_1': 6, 'mlp_size_2': 1, 'mlp_size_3': 0, 'kernel': 'Normal', 'loss_name': 'AlternativeNLLLoss'}. Best is trial 386 with value: 0.9276577369576131.[0m
[32m[I 2022-04-23 07:06:15,599][0m Trial 404 finished with value: 0.9259662333814648 and parameters: {'n_hidden': 1024, 'mixture_components': 6, 'use_sparse_layer': False, 'use_batchnorm': False, 'use_dropout': False, 'mlp_size_1': 6, 'mlp_size_2': 1, 'mlp_size_3': 0, 'kernel': 'Normal', 'loss_name': 'AlternativeNLLLoss'}. Best is trial 386 with value: 0.9276577369576131.[0m
[32m[I 2022-04-23 07:09:23,454][0m Trial 405 finished with value: -0.5 and parameters: {'n_hidden': 2048, 'mixture_components': 6, 'use_sparse_layer': False, 'use_batchnorm': False, 'use_dropout': False, 'mlp_size_1': 8, 'mlp_size_2': 0, 'mlp_size_3': 0, 'kernel': 'Exponential', 'loss_name': 'AlternativeNLLLoss'}. Best is trial 386 with value: 0.9276577369576131.[0m
[32m[I 2022-04-23 07:13:45,499][0m Trial 406 finished with value: 0.9261784923047859 and parameters: {'n_hidden': 1024, 'mixture_components': 5, 'use_sparse_layer': False, 'use_batchnorm': False, 'use_dropout': False, 'mlp_size_1': 6, 'mlp_size_2': 1, 'mlp_size_3': 0, 'kernel': 'LogLogistic', 'loss_name': 'AlternativeNLLLoss'}. Best is trial 386 with value: 0.9276577369576131.[0m
[32m[I 2022-04-23 07:18:20,803][0m Trial 407 finished with value: 0.9240695475778832 and parameters: {'n_hidden': 1024, 'mixture_components': 8, 'use_sparse_layer': False, 'use_batchnorm': False, 'use_dropout': False, 'mlp_size_1': 6, 'mlp_size_2': 1, 'mlp_size_3': 0, 'kernel': 'Normal', 'loss_name': 'AlternativeNLLLoss'}. Best is trial 386 with value: 0.9276577369576131.[0m
[32m[I 2022-04-23 07:23:23,395][0m Trial 408 finished with value: 0.9254311727656231 and parameters: {'n_hidden': 1024, 'mixture_components': 5, 'use_sparse_layer': False, 'use_batchnorm': False, 'use_dropout': False, 'mlp_size_1': 6, 'mlp_size_2': 1, 'mlp_size_3': 0, 'kernel': 'Normal', 'loss_name': 'AlternativeNLLLoss'}. Best is trial 386 with value: 0.9276577369576131.[0m
[32m[I 2022-04-23 07:28:39,612][0m Trial 409 finished with value: 0.9268634844452679 and parameters: {'n_hidden': 1024, 'mixture_components': 6, 'use_sparse_layer': False, 'use_batchnorm': False, 'use_dropout': False, 'mlp_size_1': 6, 'mlp_size_2': 1, 'mlp_size_3': 0, 'kernel': 'Normal', 'loss_name': 'CensoredNLLLoss'}. Best is trial 386 with value: 0.9276577369576131.[0m
[32m[I 2022-04-23 07:33:43,951][0m Trial 410 finished with value: 0.927002486200203 and parameters: {'n_hidden': 1024, 'mixture_components': 5, 'use_sparse_layer': False, 'use_batchnorm': False, 'use_dropout': False, 'mlp_size_1': 6, 'mlp_size_2': 1, 'mlp_size_3': 0, 'kernel': 'Normal', 'loss_name': 'AlternativeNLLLoss'}. Best is trial 386 with value: 0.9276577369576131.[0m
[32m[I 2022-04-23 07:38:48,179][0m Trial 411 finished with value: 0.92531186893053 and parameters: {'n_hidden': 1024, 'mixture_components': 5, 'use_sparse_layer': False, 'use_batchnorm': False, 'use_dropout': False, 'mlp_size_1': 6, 'mlp_size_2': 1, 'mlp_size_3': 0, 'kernel': 'Normal', 'loss_name': 'AlternativeNLLLoss'}. Best is trial 386 with value: 0.9276577369576131.[0m
[32m[I 2022-04-23 07:44:35,754][0m Trial 412 finished with value: 0.927659276427188 and parameters: {'n_hidden': 1024, 'mixture_components': 5, 'use_sparse_layer': False, 'use_batchnorm': False, 'use_dropout': False, 'mlp_size_1': 6, 'mlp_size_2': 1, 'mlp_size_3': 0, 'kernel': 'Normal', 'loss_name': 'AlternativeNLLLoss'}. Best is trial 412 with value: 0.927659276427188.[0m
[32m[I 2022-04-23 07:49:33,917][0m Trial 413 finished with value: 0.9221899999092107 and parameters: {'n_hidden': 1024, 'mixture_components': 5, 'use_sparse_layer': False, 'use_batchnorm': False, 'use_dropout': False, 'mlp_size_1': 6, 'mlp_size_2': 1, 'mlp_size_3': 0, 'kernel': 'Normal', 'loss_name': 'AlternativeNLLLoss'}. Best is trial 412 with value: 0.927659276427188.[0m
[32m[I 2022-04-23 07:54:12,973][0m Trial 414 finished with value: 0.9268663161632151 and parameters: {'n_hidden': 1024, 'mixture_components': 5, 'use_sparse_layer': False, 'use_batchnorm': False, 'use_dropout': False, 'mlp_size_1': 6, 'mlp_size_2': 1, 'mlp_size_3': 0, 'kernel': 'Normal', 'loss_name': 'AlternativeNLLLoss'}. Best is trial 412 with value: 0.927659276427188.[0m
[32m[I 2022-04-23 07:59:20,484][0m Trial 415 finished with value: 0.9259425122634074 and parameters: {'n_hidden': 1024, 'mixture_components': 5, 'use_sparse_layer': False, 'use_batchnorm': False, 'use_dropout': False, 'mlp_size_1': 5, 'mlp_size_2': 2, 'mlp_size_3': 0, 'kernel': 'Normal', 'loss_name': 'AlternativeNLLLoss'}. Best is trial 412 with value: 0.927659276427188.[0m
[32m[I 2022-04-23 08:02:47,488][0m Trial 416 finished with value: 0.9198408399759062 and parameters: {'n_hidden': 1024, 'mixture_components': 4, 'use_sparse_layer': False, 'use_batchnorm': False, 'use_dropout': False, 'mlp_size_1': 6, 'mlp_size_2': 1, 'mlp_size_3': 0, 'kernel': 'Normal', 'loss_name': 'NLLLoss'}. Best is trial 412 with value: 0.927659276427188.[0m
[32m[I 2022-04-23 08:07:54,816][0m Trial 417 finished with value: 0.9263470287637681 and parameters: {'n_hidden': 1024, 'mixture_components': 5, 'use_sparse_layer': False, 'use_batchnorm': False, 'use_dropout': False, 'mlp_size_1': 6, 'mlp_size_2': 1, 'mlp_size_3': 0, 'kernel': 'Normal', 'loss_name': 'AlternativeNLLLoss'}. Best is trial 412 with value: 0.927659276427188.[0m
[32m[I 2022-04-23 08:12:51,753][0m Trial 418 finished with value: 0.8242937491783595 and parameters: {'n_hidden': 1024, 'mixture_components': 2, 'use_sparse_layer': False, 'use_batchnorm': False, 'use_dropout': False, 'mlp_size_1': 6, 'mlp_size_2': 1, 'mlp_size_3': 0, 'kernel': 'Normal', 'loss_name': 'AlternativeNLLLoss'}. Best is trial 412 with value: 0.927659276427188.[0m
[32m[I 2022-04-23 08:20:13,217][0m Trial 419 finished with value: 0.9209220683312223 and parameters: {'n_hidden': 32, 'mixture_components': 5, 'use_sparse_layer': False, 'use_batchnorm': False, 'use_dropout': False, 'mlp_size_1': 2, 'mlp_size_2': 0, 'mlp_size_3': 0, 'kernel': 'Normal', 'loss_name': 'CensoredNLLLoss'}. Best is trial 412 with value: 0.927659276427188.[0m
[32m[I 2022-04-23 08:23:48,472][0m Trial 420 finished with value: 0.4136860139766231 and parameters: {'n_hidden': 1024, 'mixture_components': 4, 'use_sparse_layer': False, 'use_batchnorm': False, 'use_dropout': True, 'dropout': 0.515620952903368, 'mlp_size_1': 6, 'mlp_size_2': 1, 'mlp_size_3': 0, 'kernel': 'Normal', 'loss_name': 'AlternativeNLLLoss'}. Best is trial 412 with value: 0.927659276427188.[0m
[32m[I 2022-04-23 08:30:26,014][0m Trial 421 finished with value: 0.8077958916056709 and parameters: {'n_hidden': 1024, 'mixture_components': 6, 'use_sparse_layer': False, 'use_batchnorm': True, 'use_dropout': False, 'mlp_size_1': 5, 'mlp_size_2': 2, 'mlp_size_3': 0, 'kernel': 'Logistic', 'loss_name': 'AlternativeNLLLoss'}. Best is trial 412 with value: 0.927659276427188.[0m
[32m[I 2022-04-23 08:35:18,372][0m Trial 422 finished with value: 0.9240519322226219 and parameters: {'n_hidden': 128, 'mixture_components': 5, 'use_sparse_layer': False, 'use_batchnorm': False, 'use_dropout': False, 'mlp_size_1': 4, 'mlp_size_2': 0, 'mlp_size_3': 0, 'kernel': 'Normal', 'loss_name': 'AlternativeNLLLoss'}. Best is trial 412 with value: 0.927659276427188.[0m
[32m[I 2022-04-23 08:40:10,445][0m Trial 423 finished with value: 0.8240671316263011 and parameters: {'n_hidden': 1024, 'mixture_components': 4, 'use_sparse_layer': True, 'use_sparse_loss': True, 'lmbd': 7.243047971582245e-05, 'use_batchnorm': False, 'use_dropout': False, 'mlp_size_1': 6, 'mlp_size_2': 1, 'mlp_size_3': 0, 'kernel': 'Normal', 'loss_name': 'AlternativeNLLLoss'}. Best is trial 412 with value: 0.927659276427188.[0m
[32m[I 2022-04-23 08:45:21,192][0m Trial 424 finished with value: 0.9268043743720125 and parameters: {'n_hidden': 1024, 'mixture_components': 6, 'use_sparse_layer': False, 'use_batchnorm': False, 'use_dropout': False, 'mlp_size_1': 6, 'mlp_size_2': 1, 'mlp_size_3': 0, 'kernel': 'Normal', 'loss_name': 'AlternativeNLLLoss'}. Best is trial 412 with value: 0.927659276427188.[0m
[32m[I 2022-04-23 08:50:09,858][0m Trial 425 finished with value: 0.9265305393044126 and parameters: {'n_hidden': 1024, 'mixture_components': 5, 'use_sparse_layer': False, 'use_batchnorm': False, 'use_dropout': False, 'mlp_size_1': 6, 'mlp_size_2': 1, 'mlp_size_3': 0, 'kernel': 'Normal', 'loss_name': 'AlternativeNLLLoss'}. Best is trial 412 with value: 0.927659276427188.[0m
[32m[I 2022-04-23 08:55:09,298][0m Trial 426 finished with value: 0.9267280606045605 and parameters: {'n_hidden': 1024, 'mixture_components': 6, 'use_sparse_layer': False, 'use_batchnorm': False, 'use_dropout': False, 'mlp_size_1': 6, 'mlp_size_2': 1, 'mlp_size_3': 0, 'kernel': 'Normal', 'loss_name': 'AlternativeNLLLoss'}. Best is trial 412 with value: 0.927659276427188.[0m
[32m[I 2022-04-23 09:00:08,148][0m Trial 427 finished with value: 0.9262790745077739 and parameters: {'n_hidden': 1024, 'mixture_components': 5, 'use_sparse_layer': False, 'use_batchnorm': False, 'use_dropout': False, 'mlp_size_1': 6, 'mlp_size_2': 1, 'mlp_size_3': 0, 'kernel': 'Normal', 'loss_name': 'CensoredNLLLoss'}. Best is trial 412 with value: 0.927659276427188.[0m
[32m[I 2022-04-23 09:04:50,999][0m Trial 428 finished with value: 0.9243307622579723 and parameters: {'n_hidden': 1024, 'mixture_components': 3, 'use_sparse_layer': False, 'use_batchnorm': False, 'use_dropout': False, 'mlp_size_1': 5, 'mlp_size_2': 2, 'mlp_size_3': 0, 'kernel': 'Normal', 'loss_name': 'AlternativeNLLLoss'}. Best is trial 412 with value: 0.927659276427188.[0m
[32m[I 2022-04-23 09:11:54,560][0m Trial 429 finished with value: 0.9219590362362629 and parameters: {'n_hidden': 64, 'mixture_components': 4, 'use_sparse_layer': False, 'use_batchnorm': False, 'use_dropout': False, 'mlp_size_1': 3, 'mlp_size_2': 0, 'mlp_size_3': 0, 'kernel': 'Normal', 'loss_name': 'AlternativeNLLLoss'}. Best is trial 412 with value: 0.927659276427188.[0m
[32m[I 2022-04-23 09:16:40,036][0m Trial 430 finished with value: 0.9233286506490049 and parameters: {'n_hidden': 1024, 'mixture_components': 6, 'use_sparse_layer': False, 'use_batchnorm': False, 'use_dropout': False, 'mlp_size_1': 6, 'mlp_size_2': 1, 'mlp_size_3': 0, 'kernel': 'Normal', 'loss_name': 'AlternativeNLLLoss'}. Best is trial 412 with value: 0.927659276427188.[0m
[32m[I 2022-04-23 09:20:26,337][0m Trial 431 finished with value: 0.7884411711154631 and parameters: {'n_hidden': 256, 'mixture_components': 6, 'use_sparse_layer': False, 'use_batchnorm': False, 'use_dropout': False, 'mlp_size_1': 5, 'mlp_size_2': 0, 'mlp_size_3': 0, 'kernel': 'LogLogistic', 'loss_name': 'AlternativeNLLLoss'}. Best is trial 412 with value: 0.927659276427188.[0m
[32m[I 2022-04-23 09:23:02,968][0m Trial 432 finished with value: -0.5 and parameters: {'n_hidden': 1024, 'mixture_components': 5, 'use_sparse_layer': False, 'use_batchnorm': False, 'use_dropout': False, 'mlp_size_1': 6, 'mlp_size_2': 1, 'mlp_size_3': 0, 'kernel': 'Exponential', 'loss_name': 'AlternativeNLLLoss'}. Best is trial 412 with value: 0.927659276427188.[0m
[32m[I 2022-04-23 09:28:30,793][0m Trial 433 finished with value: 0.9261437311504869 and parameters: {'n_hidden': 1024, 'mixture_components': 5, 'use_sparse_layer': False, 'use_batchnorm': False, 'use_dropout': False, 'mlp_size_1': 6, 'mlp_size_2': 1, 'mlp_size_3': 0, 'kernel': 'Normal', 'loss_name': 'AlternativeNLLLoss'}. Best is trial 412 with value: 0.927659276427188.[0m
[32m[I 2022-04-23 09:34:21,438][0m Trial 434 finished with value: 0.9266318096432105 and parameters: {'n_hidden': 1024, 'mixture_components': 6, 'use_sparse_layer': False, 'use_batchnorm': False, 'use_dropout': False, 'mlp_size_1': 6, 'mlp_size_2': 1, 'mlp_size_3': 0, 'kernel': 'Normal', 'loss_name': 'AlternativeNLLLoss'}. Best is trial 412 with value: 0.927659276427188.[0m
[32m[I 2022-04-23 09:39:58,198][0m Trial 435 finished with value: 0.926772122763267 and parameters: {'n_hidden': 1024, 'mixture_components': 4, 'use_sparse_layer': False, 'use_batchnorm': False, 'use_dropout': False, 'mlp_size_1': 6, 'mlp_size_2': 1, 'mlp_size_3': 0, 'kernel': 'Normal', 'loss_name': 'AlternativeNLLLoss'}. Best is trial 412 with value: 0.927659276427188.[0m
[32m[I 2022-04-23 09:46:13,048][0m Trial 436 finished with value: 0.8227238656557467 and parameters: {'n_hidden': 2048, 'mixture_components': 5, 'use_sparse_layer': False, 'use_batchnorm': False, 'use_dropout': False, 'mlp_size_1': 8, 'mlp_size_2': 0, 'mlp_size_3': 0, 'kernel': 'Normal', 'loss_name': 'CensoredNLLLoss'}. Best is trial 412 with value: 0.927659276427188.[0m
[32m[I 2022-04-23 09:51:13,684][0m Trial 437 finished with value: 0.9249078891841502 and parameters: {'n_hidden': 1024, 'mixture_components': 6, 'use_sparse_layer': False, 'use_batchnorm': False, 'use_dropout': False, 'mlp_size_1': 6, 'mlp_size_2': 1, 'mlp_size_3': 0, 'kernel': 'Normal', 'loss_name': 'AlternativeNLLLoss'}. Best is trial 412 with value: 0.927659276427188.[0m
[32m[I 2022-04-23 09:56:31,057][0m Trial 438 finished with value: 0.9259580637805037 and parameters: {'n_hidden': 1024, 'mixture_components': 5, 'use_sparse_layer': False, 'use_batchnorm': False, 'use_dropout': False, 'mlp_size_1': 6, 'mlp_size_2': 1, 'mlp_size_3': 0, 'kernel': 'Normal', 'loss_name': 'AlternativeNLLLoss'}. Best is trial 412 with value: 0.927659276427188.[0m
[32m[I 2022-04-23 10:01:53,799][0m Trial 439 finished with value: 0.42163967100311217 and parameters: {'n_hidden': 1024, 'mixture_components': 1, 'use_sparse_layer': False, 'use_batchnorm': False, 'use_dropout': True, 'dropout': 0.4130065555831676, 'mlp_size_1': 5, 'mlp_size_2': 2, 'mlp_size_3': 0, 'kernel': 'Normal', 'loss_name': 'AlternativeNLLLoss'}. Best is trial 412 with value: 0.927659276427188.[0m
[32m[I 2022-04-23 10:10:56,592][0m Trial 440 finished with value: 0.8158884098493973 and parameters: {'n_hidden': 1024, 'mixture_components': 6, 'use_sparse_layer': False, 'use_batchnorm': True, 'use_dropout': False, 'mlp_size_1': 6, 'mlp_size_2': 1, 'mlp_size_3': 0, 'kernel': 'Normal', 'loss_name': 'AlternativeNLLLoss'}. Best is trial 412 with value: 0.927659276427188.[0m
[32m[I 2022-04-23 10:16:07,608][0m Trial 441 finished with value: 0.7253097320879005 and parameters: {'n_hidden': 1024, 'mixture_components': 3, 'use_sparse_layer': False, 'use_batchnorm': False, 'use_dropout': False, 'mlp_size_1': 6, 'mlp_size_2': 1, 'mlp_size_3': 0, 'kernel': 'Normal', 'loss_name': 'AlternativeNLLLoss'}. Best is trial 412 with value: 0.927659276427188.[0m
[32m[I 2022-04-23 10:20:39,357][0m Trial 442 finished with value: 0.914017788171033 and parameters: {'n_hidden': 1024, 'mixture_components': 6, 'use_sparse_layer': True, 'use_sparse_loss': True, 'lmbd': 0.012688972853496109, 'use_batchnorm': False, 'use_dropout': False, 'mlp_size_1': 6, 'mlp_size_2': 1, 'mlp_size_3': 0, 'kernel': 'Normal', 'loss_name': 'NLLLoss'}. Best is trial 412 with value: 0.927659276427188.[0m
[32m[I 2022-04-23 10:25:57,465][0m Trial 443 finished with value: 0.9257764171516383 and parameters: {'n_hidden': 1024, 'mixture_components': 5, 'use_sparse_layer': False, 'use_batchnorm': False, 'use_dropout': False, 'mlp_size_1': 6, 'mlp_size_2': 1, 'mlp_size_3': 0, 'kernel': 'Normal', 'loss_name': 'AlternativeNLLLoss'}. Best is trial 412 with value: 0.927659276427188.[0m
[32m[I 2022-04-23 10:30:18,411][0m Trial 444 finished with value: 0.9257580238914 and parameters: {'n_hidden': 1024, 'mixture_components': 4, 'use_sparse_layer': False, 'use_batchnorm': False, 'use_dropout': False, 'mlp_size_1': 5, 'mlp_size_2': 2, 'mlp_size_3': 0, 'kernel': 'Logistic', 'loss_name': 'AlternativeNLLLoss'}. Best is trial 412 with value: 0.927659276427188.[0m
[32m[I 2022-04-23 10:35:34,500][0m Trial 445 finished with value: 0.9267752554401063 and parameters: {'n_hidden': 1024, 'mixture_components': 5, 'use_sparse_layer': False, 'use_batchnorm': False, 'use_dropout': False, 'mlp_size_1': 6, 'mlp_size_2': 1, 'mlp_size_3': 0, 'kernel': 'Normal', 'loss_name': 'CensoredNLLLoss'}. Best is trial 412 with value: 0.927659276427188.[0m
[32m[I 2022-04-23 10:40:35,200][0m Trial 446 finished with value: 0.9257431839645893 and parameters: {'n_hidden': 1024, 'mixture_components': 6, 'use_sparse_layer': False, 'use_batchnorm': False, 'use_dropout': False, 'mlp_size_1': 6, 'mlp_size_2': 1, 'mlp_size_3': 0, 'kernel': 'Normal', 'loss_name': 'AlternativeNLLLoss'}. Best is trial 412 with value: 0.927659276427188.[0m
[32m[I 2022-04-23 10:47:37,905][0m Trial 447 finished with value: 0.9225358341459111 and parameters: {'n_hidden': 32, 'mixture_components': 5, 'use_sparse_layer': False, 'use_batchnorm': False, 'use_dropout': False, 'mlp_size_1': 2, 'mlp_size_2': 0, 'mlp_size_3': 0, 'kernel': 'Normal', 'loss_name': 'AlternativeNLLLoss'}. Best is trial 412 with value: 0.927659276427188.[0m
[32m[I 2022-04-23 10:52:55,360][0m Trial 448 finished with value: 0.9260728428137156 and parameters: {'n_hidden': 1024, 'mixture_components': 6, 'use_sparse_layer': False, 'use_batchnorm': False, 'use_dropout': False, 'mlp_size_1': 6, 'mlp_size_2': 1, 'mlp_size_3': 0, 'kernel': 'Normal', 'loss_name': 'AlternativeNLLLoss'}. Best is trial 412 with value: 0.927659276427188.[0m
