[32m[I 2022-04-21 17:22:25,686][0m Trial 181 finished with value: 0.8034308649461976 and parameters: {'splitter': 'random', 'min_samples_split': 0.47092810202911783, 'min_samples_leaf': 0.03302740519777776, 'min_weight_fraction_leaf': 0.03574090491911233, 'max_features': 0.9124585713412116}. Best is trial 52 with value: 0.8098214582394094.[0m
[32m[I 2022-04-21 17:22:27,134][0m Trial 182 finished with value: 0.8093784233342556 and parameters: {'splitter': 'random', 'min_samples_split': 0.48610261422336926, 'min_samples_leaf': 0.02169397277983565, 'min_weight_fraction_leaf': 0.014836563148053922, 'max_features': 0.9196016256362043}. Best is trial 52 with value: 0.8098214582394094.[0m
[32m[I 2022-04-21 17:22:28,756][0m Trial 183 finished with value: 0.7907011627675173 and parameters: {'splitter': 'random', 'min_samples_split': 0.4868512969644108, 'min_samples_leaf': 0.04205551063526203, 'min_weight_fraction_leaf': 0.014580765235476833, 'max_features': 0.9398506560392983}. Best is trial 52 with value: 0.8098214582394094.[0m
[32m[I 2022-04-21 17:22:29,784][0m Trial 184 finished with value: 0.8034308649461976 and parameters: {'splitter': 'random', 'min_samples_split': 0.46576871235897394, 'min_samples_leaf': 0.02032203502151271, 'min_weight_fraction_leaf': 0.048180917791823326, 'max_features': 0.9232760885551051}. Best is trial 52 with value: 0.8098214582394094.[0m
[32m[I 2022-04-21 17:22:30,687][0m Trial 185 finished with value: 0.7682350893242956 and parameters: {'splitter': 'random', 'min_samples_split': 0.44344270945274367, 'min_samples_leaf': 0.012408984663588469, 'min_weight_fraction_leaf': 0.0306625585191055, 'max_features': 0.8737930535388194}. Best is trial 52 with value: 0.8098214582394094.[0m
[32m[I 2022-04-21 17:22:31,227][0m Trial 186 finished with value: 0.7940372022789198 and parameters: {'splitter': 'random', 'min_samples_split': 0.45783034737211836, 'min_samples_leaf': 0.05916245246963819, 'min_weight_fraction_leaf': 0.01138207261559134, 'max_features': 0.9010222952803113}. Best is trial 52 with value: 0.8098214582394094.[0m
[32m[I 2022-04-21 17:22:32,331][0m Trial 187 finished with value: 0.7907011627675173 and parameters: {'splitter': 'random', 'min_samples_split': 0.47814418511281287, 'min_samples_leaf': 0.03195513561009927, 'min_weight_fraction_leaf': 0.019716111095945423, 'max_features': 0.9447201819723786}. Best is trial 52 with value: 0.8098214582394094.[0m
[32m[I 2022-04-21 17:22:32,677][0m Trial 188 finished with value: 0.6851609036733942 and parameters: {'splitter': 'random', 'min_samples_split': 0.4494803983316569, 'min_samples_leaf': 0.3019042083561277, 'min_weight_fraction_leaf': 0.0011622039830490828, 'max_features': 0.8458573638291087}. Best is trial 52 with value: 0.8098214582394094.[0m
[32m[I 2022-04-21 17:22:33,687][0m Trial 189 finished with value: 0.7983619900412802 and parameters: {'splitter': 'random', 'min_samples_split': 0.49813874689103044, 'min_samples_leaf': 0.021251192757999308, 'min_weight_fraction_leaf': 0.0794155172311812, 'max_features': 0.6164525639412892}. Best is trial 52 with value: 0.8098214582394094.[0m
[32m[I 2022-04-21 17:22:34,183][0m Trial 190 finished with value: 0.7669759123387727 and parameters: {'splitter': 'random', 'min_samples_split': 0.48130435764892077, 'min_samples_leaf': 0.04837286025576816, 'min_weight_fraction_leaf': 0.02128897514614777, 'max_features': 0.9543716297237007}. Best is trial 52 with value: 0.8098214582394094.[0m
[32m[I 2022-04-21 17:22:35,369][0m Trial 191 finished with value: 0.8055043242234469 and parameters: {'splitter': 'random', 'min_samples_split': 0.4301487184804673, 'min_samples_leaf': 0.02916697587176774, 'min_weight_fraction_leaf': 0.03948719267089953, 'max_features': 0.9174774105439566}. Best is trial 52 with value: 0.8098214582394094.[0m
[32m[I 2022-04-21 17:22:36,399][0m Trial 192 finished with value: 0.8081696907818106 and parameters: {'splitter': 'random', 'min_samples_split': 0.46579934875352735, 'min_samples_leaf': 0.012518541216357955, 'min_weight_fraction_leaf': 0.028218929205477916, 'max_features': 0.9082531366505575}. Best is trial 52 with value: 0.8098214582394094.[0m
[32m[I 2022-04-21 17:22:37,341][0m Trial 193 finished with value: 0.7940372022789198 and parameters: {'splitter': 'random', 'min_samples_split': 0.43965205014045705, 'min_samples_leaf': 0.012831265538502827, 'min_weight_fraction_leaf': 0.03559488788452751, 'max_features': 0.9055614142502941}. Best is trial 52 with value: 0.8098214582394094.[0m
[32m[I 2022-04-21 17:22:38,130][0m Trial 194 finished with value: 0.7682350893242956 and parameters: {'splitter': 'random', 'min_samples_split': 0.4669343257467515, 'min_samples_leaf': 0.01334267651586921, 'min_weight_fraction_leaf': 0.009407137224882258, 'max_features': 0.8828246226768809}. Best is trial 52 with value: 0.8098214582394094.[0m
[32m[I 2022-04-21 17:22:39,173][0m Trial 195 finished with value: 0.7907011627675173 and parameters: {'splitter': 'random', 'min_samples_split': 0.4915454553367762, 'min_samples_leaf': 0.035429248731760954, 'min_weight_fraction_leaf': 0.026425017526243433, 'max_features': 0.933297918936234}. Best is trial 52 with value: 0.8098214582394094.[0m
[32m[I 2022-04-21 17:22:40,621][0m Trial 196 finished with value: 0.7986065975584268 and parameters: {'splitter': 'random', 'min_samples_split': 0.4596914368945376, 'min_samples_leaf': 0.0074913196444960535, 'min_weight_fraction_leaf': 0.01672244794396572, 'max_features': 0.9459226920175987}. Best is trial 52 with value: 0.8098214582394094.[0m
[32m[I 2022-04-21 17:22:41,427][0m Trial 197 finished with value: 0.7317355771834004 and parameters: {'splitter': 'random', 'min_samples_split': 0.47586696520778415, 'min_samples_leaf': 0.022195049310281382, 'min_weight_fraction_leaf': 0.026937630525987723, 'max_features': 0.23006106427397055}. Best is trial 52 with value: 0.8098214582394094.[0m
[32m[I 2022-04-21 17:22:42,579][0m Trial 198 finished with value: 0.7826753799505408 and parameters: {'splitter': 'random', 'min_samples_split': 0.48600716352780654, 'min_samples_leaf': 0.03784003343971218, 'min_weight_fraction_leaf': 7.777940523329141e-05, 'max_features': 0.9064362425114301}. Best is trial 52 with value: 0.8098214582394094.[0m
[32m[I 2022-04-21 17:22:43,459][0m Trial 199 finished with value: 0.7682350893242956 and parameters: {'splitter': 'random', 'min_samples_split': 0.45210863604349766, 'min_samples_leaf': 0.021033254981268464, 'min_weight_fraction_leaf': 0.010257092314608671, 'max_features': 0.8654440040933662}. Best is trial 52 with value: 0.8098214582394094.[0m
[32m[I 2022-04-21 17:22:44,442][0m Trial 200 finished with value: 0.7669759123387727 and parameters: {'splitter': 'random', 'min_samples_split': 0.42763488486028367, 'min_samples_leaf': 0.0013898639428099081, 'min_weight_fraction_leaf': 0.037439730365663, 'max_features': 0.9567605485284619}. Best is trial 52 with value: 0.8098214582394094.[0m
[32m[I 2022-04-21 17:22:45,249][0m Trial 201 finished with value: 0.8055043242234469 and parameters: {'splitter': 'random', 'min_samples_split': 0.43234739495787855, 'min_samples_leaf': 0.028339006886771205, 'min_weight_fraction_leaf': 0.05077305244544166, 'max_features': 0.9189620322730917}. Best is trial 52 with value: 0.8098214582394094.[0m
[32m[I 2022-04-21 17:22:45,677][0m Trial 202 finished with value: 0.6851609036733942 and parameters: {'splitter': 'random', 'min_samples_split': 0.4403820793315663, 'min_samples_leaf': 0.3945561631394766, 'min_weight_fraction_leaf': 0.05590572804560867, 'max_features': 0.9273108065774369}. Best is trial 52 with value: 0.8098214582394094.[0m
[32m[I 2022-04-21 17:22:46,572][0m Trial 203 finished with value: 0.7940372022789198 and parameters: {'splitter': 'random', 'min_samples_split': 0.4641023822667304, 'min_samples_leaf': 0.027226981698771576, 'min_weight_fraction_leaf': 0.04418417913421498, 'max_features': 0.8870632688655626}. Best is trial 52 with value: 0.8098214582394094.[0m
[32m[I 2022-04-21 17:22:47,399][0m Trial 204 finished with value: 0.8055043242234469 and parameters: {'splitter': 'random', 'min_samples_split': 0.431910361372843, 'min_samples_leaf': 0.04462989225937357, 'min_weight_fraction_leaf': 0.06821337468629339, 'max_features': 0.9170566200110037}. Best is trial 52 with value: 0.8098214582394094.[0m
[32m[I 2022-04-21 17:22:48,394][0m Trial 205 finished with value: 0.791646519528385 and parameters: {'splitter': 'random', 'min_samples_split': 0.47130107799721277, 'min_samples_leaf': 0.012282101646288807, 'min_weight_fraction_leaf': 0.021042283936570455, 'max_features': 0.9030334484649085}. Best is trial 52 with value: 0.8098214582394094.[0m
[32m[I 2022-04-21 17:22:49,259][0m Trial 206 finished with value: 0.7907011627675173 and parameters: {'splitter': 'random', 'min_samples_split': 0.43520292292530877, 'min_samples_leaf': 0.04458267668451529, 'min_weight_fraction_leaf': 0.07475043950778426, 'max_features': 0.9363165705908568}. Best is trial 52 with value: 0.8098214582394094.[0m
[32m[I 2022-04-21 17:22:50,112][0m Trial 207 finished with value: 0.7826753799505408 and parameters: {'splitter': 'random', 'min_samples_split': 0.4881355052583616, 'min_samples_leaf': 0.01978552798011191, 'min_weight_fraction_leaf': 0.01322835009685226, 'max_features': 0.8931141112833411}. Best is trial 52 with value: 0.8098214582394094.[0m
[32m[I 2022-04-21 17:22:50,694][0m Trial 208 finished with value: 0.7669759123387727 and parameters: {'splitter': 'random', 'min_samples_split': 0.42492095574852684, 'min_samples_leaf': 0.05524619401702728, 'min_weight_fraction_leaf': 0.0672728606912077, 'max_features': 0.9588241915844026}. Best is trial 52 with value: 0.8098214582394094.[0m
[32m[I 2022-04-21 17:22:51,272][0m Trial 209 finished with value: 0.8034308649461976 and parameters: {'splitter': 'random', 'min_samples_split': 0.44606000523971845, 'min_samples_leaf': 0.030776973577047687, 'min_weight_fraction_leaf': 0.03049117263503511, 'max_features': 0.9284659134971843}. Best is trial 52 with value: 0.8098214582394094.[0m
[32m[I 2022-04-21 17:22:51,976][0m Trial 210 finished with value: 0.7786172064758383 and parameters: {'splitter': 'random', 'min_samples_split': 0.47461871513631665, 'min_samples_leaf': 0.010278642898341244, 'min_weight_fraction_leaf': 0.021166807616166988, 'max_features': 0.8595494225127359}. Best is trial 52 with value: 0.8098214582394094.[0m
[32m[I 2022-04-21 17:22:52,564][0m Trial 211 finished with value: 0.8034308649461976 and parameters: {'splitter': 'random', 'min_samples_split': 0.4567818877880407, 'min_samples_leaf': 0.041785203656544895, 'min_weight_fraction_leaf': 0.08316542466596064, 'max_features': 0.9182761131483765}. Best is trial 52 with value: 0.8098214582394094.[0m
[32m[I 2022-04-21 17:22:53,190][0m Trial 212 finished with value: 0.8055043242234469 and parameters: {'splitter': 'random', 'min_samples_split': 0.42288445108704587, 'min_samples_leaf': 0.02795436322981421, 'min_weight_fraction_leaf': 0.0517281680475045, 'max_features': 0.9135465685563329}. Best is trial 52 with value: 0.8098214582394094.[0m
[32m[I 2022-04-21 17:22:54,573][0m Trial 213 finished with value: 0.7682350893242956 and parameters: {'splitter': 'random', 'min_samples_split': 0.42124490973735107, 'min_samples_leaf': 0.02376297056801608, 'min_weight_fraction_leaf': 0.047924495406570386, 'max_features': 0.8829731215582137}. Best is trial 52 with value: 0.8098214582394094.[0m
[32m[I 2022-04-21 17:22:54,861][0m Trial 214 finished with value: 0.5 and parameters: {'splitter': 'random', 'min_samples_split': 0.4485627107144523, 'min_samples_leaf': 0.030081604166262606, 'min_weight_fraction_leaf': 0.05721733242185792, 'max_features': 0.055426346638248025}. Best is trial 52 with value: 0.8098214582394094.[0m
[32m[I 2022-04-21 17:22:55,338][0m Trial 215 finished with value: 0.7907011627675173 and parameters: {'splitter': 'random', 'min_samples_split': 0.49935808336891707, 'min_samples_leaf': 0.048526434729528056, 'min_weight_fraction_leaf': 0.010716472960519419, 'max_features': 0.9497648486963557}. Best is trial 52 with value: 0.8098214582394094.[0m
[32m[I 2022-04-21 17:22:55,781][0m Trial 216 finished with value: 0.7669759123387727 and parameters: {'splitter': 'random', 'min_samples_split': 0.462525800583889, 'min_samples_leaf': 0.06140991806311177, 'min_weight_fraction_leaf': 0.0354658441863345, 'max_features': 0.9672883331003937}. Best is trial 52 with value: 0.8098214582394094.[0m
[32m[I 2022-04-21 17:22:56,302][0m Trial 217 finished with value: 0.8055043242234469 and parameters: {'splitter': 'random', 'min_samples_split': 0.4345074029754337, 'min_samples_leaf': 0.03844822319573804, 'min_weight_fraction_leaf': 0.02911677290197415, 'max_features': 0.9083577942670134}. Best is trial 52 with value: 0.8098214582394094.[0m
[32m[I 2022-04-21 17:22:57,498][0m Trial 218 finished with value: 0.7940372022789198 and parameters: {'splitter': 'random', 'min_samples_split': 0.4728984625986679, 'min_samples_leaf': 0.0012927398994901293, 'min_weight_fraction_leaf': 0.028505232282461174, 'max_features': 0.9016476629897278}. Best is trial 52 with value: 0.8098214582394094.[0m
[32m[I 2022-04-21 17:22:58,316][0m Trial 219 finished with value: 0.7986065975584268 and parameters: {'splitter': 'random', 'min_samples_split': 0.4549837449374332, 'min_samples_leaf': 0.014510846145172073, 'min_weight_fraction_leaf': 0.018580229334285374, 'max_features': 0.9450787825303658}. Best is trial 52 with value: 0.8098214582394094.[0m
[32m[I 2022-04-21 17:22:58,829][0m Trial 220 finished with value: 0.7692787026015602 and parameters: {'splitter': 'random', 'min_samples_split': 0.3998098291000553, 'min_samples_leaf': 0.021666449150499274, 'min_weight_fraction_leaf': 0.045076737434750824, 'max_features': 0.813512966559798}. Best is trial 52 with value: 0.8098214582394094.[0m
[32m[I 2022-04-21 17:22:59,506][0m Trial 221 finished with value: 0.8055043242234469 and parameters: {'splitter': 'random', 'min_samples_split': 0.429028469694081, 'min_samples_leaf': 0.03147150547797393, 'min_weight_fraction_leaf': 0.06284538531526318, 'max_features': 0.9178125626743923}. Best is trial 52 with value: 0.8098214582394094.[0m
[32m[I 2022-04-21 17:23:00,146][0m Trial 222 finished with value: 0.8055043242234469 and parameters: {'splitter': 'random', 'min_samples_split': 0.41931180088074543, 'min_samples_leaf': 0.03305437275706126, 'min_weight_fraction_leaf': 0.0368007256526301, 'max_features': 0.9260836515073778}. Best is trial 52 with value: 0.8098214582394094.[0m
[32m[I 2022-04-21 17:23:00,614][0m Trial 223 finished with value: 0.7682350893242956 and parameters: {'splitter': 'random', 'min_samples_split': 0.41980970292416836, 'min_samples_leaf': 0.0343484577615783, 'min_weight_fraction_leaf': 0.007812929656664962, 'max_features': 0.8775383646328615}. Best is trial 52 with value: 0.8098214582394094.[0m
[32m[I 2022-04-21 17:23:01,304][0m Trial 224 finished with value: 0.7907011627675173 and parameters: {'splitter': 'random', 'min_samples_split': 0.4859655273491465, 'min_samples_leaf': 0.014421662441358498, 'min_weight_fraction_leaf': 0.03920497719242848, 'max_features': 0.9327695421321966}. Best is trial 52 with value: 0.8098214582394094.[0m
[32m[I 2022-04-21 17:23:01,802][0m Trial 225 finished with value: 0.7669759123387727 and parameters: {'splitter': 'random', 'min_samples_split': 0.4421492982401898, 'min_samples_leaf': 0.03365461191306609, 'min_weight_fraction_leaf': 0.0006171116486399526, 'max_features': 0.967606737249607}. Best is trial 52 with value: 0.8098214582394094.[0m
[32m[I 2022-04-21 17:23:02,827][0m Trial 226 finished with value: 0.7942583354593905 and parameters: {'splitter': 'random', 'min_samples_split': 0.40377076626927916, 'min_samples_leaf': 0.019939560813300457, 'min_weight_fraction_leaf': 0.022841946700187188, 'max_features': 0.896294839595384}. Best is trial 52 with value: 0.8098214582394094.[0m
[32m[I 2022-04-21 17:23:03,956][0m Trial 227 finished with value: 0.8055043242234469 and parameters: {'splitter': 'random', 'min_samples_split': 0.43543978625239765, 'min_samples_leaf': 0.04579573325506856, 'min_weight_fraction_leaf': 0.06481219861528278, 'max_features': 0.9147452963444836}. Best is trial 52 with value: 0.8098214582394094.[0m
[32m[I 2022-04-21 17:23:04,646][0m Trial 228 finished with value: 0.7669759123387727 and parameters: {'splitter': 'random', 'min_samples_split': 0.48218623042301856, 'min_samples_leaf': 0.05022107868733314, 'min_weight_fraction_leaf': 0.013048222773730914, 'max_features': 0.9544801680639905}. Best is trial 52 with value: 0.8098214582394094.[0m
[32m[I 2022-04-21 17:23:05,543][0m Trial 229 finished with value: 0.7682350893242956 and parameters: {'splitter': 'random', 'min_samples_split': 0.4521362380855464, 'min_samples_leaf': 0.009291950759357546, 'min_weight_fraction_leaf': 0.03918345214946391, 'max_features': 0.8825853325285762}. Best is trial 52 with value: 0.8098214582394094.[0m
[32m[I 2022-04-21 17:23:06,108][0m Trial 230 finished with value: 0.8034308649461976 and parameters: {'splitter': 'random', 'min_samples_split': 0.4652786374992743, 'min_samples_leaf': 0.023695928548524245, 'min_weight_fraction_leaf': 0.0517659729367704, 'max_features': 0.9235476468325339}. Best is trial 52 with value: 0.8098214582394094.[0m
[32m[I 2022-04-21 17:23:06,633][0m Trial 231 finished with value: 0.7985740514989451 and parameters: {'splitter': 'random', 'min_samples_split': 0.4127393776245456, 'min_samples_leaf': 0.03899407596795883, 'min_weight_fraction_leaf': 0.029285244395327707, 'max_features': 0.9319805006446226}. Best is trial 52 with value: 0.8098214582394094.[0m
[32m[I 2022-04-21 17:23:07,179][0m Trial 232 finished with value: 0.7940372022789198 and parameters: {'splitter': 'random', 'min_samples_split': 0.43756641894357295, 'min_samples_leaf': 0.023690542443714945, 'min_weight_fraction_leaf': 0.05008211879721, 'max_features': 0.9024186677462642}. Best is trial 52 with value: 0.8098214582394094.[0m
[32m[I 2022-04-21 17:23:08,232][0m Trial 233 finished with value: 0.8055043242234469 and parameters: {'splitter': 'random', 'min_samples_split': 0.4246219587991436, 'min_samples_leaf': 0.010147263996311738, 'min_weight_fraction_leaf': 0.07265358104511138, 'max_features': 0.9140653403368217}. Best is trial 52 with value: 0.8098214582394094.[0m
[32m[I 2022-04-21 17:23:09,036][0m Trial 234 finished with value: 0.7994642352450484 and parameters: {'splitter': 'random', 'min_samples_split': 0.4117970052278626, 'min_samples_leaf': 0.008804600381324669, 'min_weight_fraction_leaf': 0.018048333218909723, 'max_features': 0.9409126247450913}. Best is trial 52 with value: 0.8098214582394094.[0m
[32m[I 2022-04-21 17:23:09,934][0m Trial 235 finished with value: 0.7940372022789198 and parameters: {'splitter': 'random', 'min_samples_split': 0.42205642867621357, 'min_samples_leaf': 0.01612113926827246, 'min_weight_fraction_leaf': 0.07789807521370094, 'max_features': 0.8988071980933526}. Best is trial 52 with value: 0.8098214582394094.[0m
[32m[I 2022-04-21 17:23:11,122][0m Trial 236 finished with value: 0.7669759123387727 and parameters: {'splitter': 'random', 'min_samples_split': 0.43255771880211763, 'min_samples_leaf': 0.04824576991816099, 'min_weight_fraction_leaf': 0.06029529689302822, 'max_features': 0.9696691437284449}. Best is trial 52 with value: 0.8098214582394094.[0m
[32m[I 2022-04-21 17:23:12,365][0m Trial 237 finished with value: 0.8034308649461976 and parameters: {'splitter': 'random', 'min_samples_split': 0.47467247564685233, 'min_samples_leaf': 0.02876876023436914, 'min_weight_fraction_leaf': 0.04589338304983326, 'max_features': 0.9159180001319165}. Best is trial 52 with value: 0.8098214582394094.[0m
[32m[I 2022-04-21 17:23:14,359][0m Trial 238 finished with value: 0.7682350893242956 and parameters: {'splitter': 'random', 'min_samples_split': 0.43998702078748664, 'min_samples_leaf': 0.0010377627984378985, 'min_weight_fraction_leaf': 0.07482292184563502, 'max_features': 0.8676242450185907}. Best is trial 52 with value: 0.8098214582394094.[0m
[32m[I 2022-04-21 17:23:16,471][0m Trial 239 finished with value: 0.7907011627675173 and parameters: {'splitter': 'random', 'min_samples_split': 0.45744828900075657, 'min_samples_leaf': 0.01320437027737228, 'min_weight_fraction_leaf': 0.06591686436893673, 'max_features': 0.9441610479611806}. Best is trial 52 with value: 0.8098214582394094.[0m
[32m[I 2022-04-21 17:23:17,267][0m Trial 240 finished with value: 0.7940372022789198 and parameters: {'splitter': 'random', 'min_samples_split': 0.4450965800601299, 'min_samples_leaf': 0.04156611651603568, 'min_weight_fraction_leaf': 0.025680029969231806, 'max_features': 0.9013477754053462}. Best is trial 52 with value: 0.8098214582394094.[0m
[32m[I 2022-04-21 17:23:18,105][0m Trial 241 finished with value: 0.8055043242234469 and parameters: {'splitter': 'random', 'min_samples_split': 0.4283909673532254, 'min_samples_leaf': 0.03301152256542964, 'min_weight_fraction_leaf': 0.08627779958464948, 'max_features': 0.9252569394900256}. Best is trial 52 with value: 0.8098214582394094.[0m
[32m[I 2022-04-21 17:23:18,933][0m Trial 242 finished with value: 0.8064539092033647 and parameters: {'splitter': 'random', 'min_samples_split': 0.4924759404123976, 'min_samples_leaf': 0.026333309244598667, 'min_weight_fraction_leaf': 0.09121267502137209, 'max_features': 0.9238608855109945}. Best is trial 52 with value: 0.8098214582394094.[0m
[32m[I 2022-04-21 17:23:19,744][0m Trial 243 finished with value: 0.7669759123387727 and parameters: {'splitter': 'random', 'min_samples_split': 0.4909155405819138, 'min_samples_leaf': 0.0184338684341058, 'min_weight_fraction_leaf': 0.08427469802748615, 'max_features': 0.9753606468763942}. Best is trial 52 with value: 0.8098214582394094.[0m
