[32m[I 2022-05-17 11:40:59,282][0m Trial 655 finished with value: 0.5 and parameters: {'loss': 'coxph', 'learning_rate': 0.00017839860393914286, 'n_estimators': 475, 'criterion': 'friedman_mse', 'min_samples_split': 3, 'min_samples_leaf': 5, 'min_weight_fraction_leaf': 0.08787797003788288, 'min_impurity_decrease': 0.9321465074977667, 'max_features': 0.7189338467326798, 'subsample': 0.18750984649373542, 'dropout_rate': 0.04544946728085408, 'ccp_alpha': 0.5153960813640358}. Best is trial 632 with value: 0.8548074589601917.[0m
[32m[I 2022-05-17 12:03:56,752][0m Trial 656 finished with value: 0.8516635616416351 and parameters: {'loss': 'coxph', 'learning_rate': 8.290871770208666e-05, 'n_estimators': 449, 'criterion': 'friedman_mse', 'min_samples_split': 3, 'min_samples_leaf': 5, 'min_weight_fraction_leaf': 0.07786676374961549, 'min_impurity_decrease': 0.9511804516841437, 'max_features': 0.6695808675513927, 'subsample': 0.13744104853504147, 'dropout_rate': 0.015078812428323318, 'ccp_alpha': 0.0017160605322846247}. Best is trial 632 with value: 0.8548074589601917.[0m
[32m[I 2022-05-17 12:26:38,654][0m Trial 657 finished with value: 0.8442580423898379 and parameters: {'loss': 'coxph', 'learning_rate': 8.808187304404485e-05, 'n_estimators': 450, 'criterion': 'friedman_mse', 'min_samples_split': 3, 'min_samples_leaf': 5, 'min_weight_fraction_leaf': 0.06638207315831171, 'min_impurity_decrease': 0.9461857643038281, 'max_features': 0.6671840551059063, 'subsample': 0.14009102388290298, 'dropout_rate': 0.04438201798606956, 'ccp_alpha': 0.004724056184101427}. Best is trial 632 with value: 0.8548074589601917.[0m
[32m[I 2022-05-17 12:49:07,921][0m Trial 658 finished with value: 0.853628062050307 and parameters: {'loss': 'coxph', 'learning_rate': 0.0005569521417773004, 'n_estimators': 450, 'criterion': 'friedman_mse', 'min_samples_split': 3, 'min_samples_leaf': 5, 'min_weight_fraction_leaf': 0.07977425249590982, 'min_impurity_decrease': 0.9677313588914533, 'max_features': 0.7000401861748252, 'subsample': 0.16212167015901321, 'dropout_rate': 0.00016314236828575066, 'ccp_alpha': 0.00199165905093656}. Best is trial 632 with value: 0.8548074589601917.[0m
[32m[I 2022-05-17 13:11:05,584][0m Trial 659 finished with value: 0.7848736615205707 and parameters: {'loss': 'coxph', 'learning_rate': 0.0006310416100678189, 'n_estimators': 454, 'criterion': 'friedman_mse', 'min_samples_split': 3, 'min_samples_leaf': 6, 'min_weight_fraction_leaf': 0.07340000468909638, 'min_impurity_decrease': 0.9765899691005624, 'max_features': 0.6709435206052264, 'subsample': 0.16436478242461458, 'dropout_rate': 0.02046062203388893, 'ccp_alpha': 0.1665291131166189}. Best is trial 632 with value: 0.8548074589601917.[0m
[32m[I 2022-05-17 13:33:18,015][0m Trial 660 finished with value: 0.739676423472362 and parameters: {'loss': 'coxph', 'learning_rate': 0.0003953463920664758, 'n_estimators': 458, 'criterion': 'friedman_mse', 'min_samples_split': 3, 'min_samples_leaf': 5, 'min_weight_fraction_leaf': 0.0775187794190427, 'min_impurity_decrease': 0.9498934001373227, 'max_features': 0.6839940224586363, 'subsample': 0.15191909947303234, 'dropout_rate': 0.07660371678594377, 'ccp_alpha': 0.3153097641257195}. Best is trial 632 with value: 0.8548074589601917.[0m
[32m[I 2022-05-17 13:54:06,119][0m Trial 661 finished with value: 0.7907977232582448 and parameters: {'loss': 'coxph', 'learning_rate': 0.00028786094290788233, 'n_estimators': 442, 'criterion': 'friedman_mse', 'min_samples_split': 3, 'min_samples_leaf': 5, 'min_weight_fraction_leaf': 0.05049644698950312, 'min_impurity_decrease': 0.9705674800661553, 'max_features': 0.6936607456881047, 'subsample': 0.19741143784597373, 'dropout_rate': 0.004779032932052996, 'ccp_alpha': 0.11133615657281348}. Best is trial 632 with value: 0.8548074589601917.[0m
[32m[I 2022-05-17 14:17:28,593][0m Trial 662 finished with value: 0.7921678867227031 and parameters: {'loss': 'coxph', 'learning_rate': 0.0007753905873362744, 'n_estimators': 466, 'criterion': 'friedman_mse', 'min_samples_split': 3, 'min_samples_leaf': 6, 'min_weight_fraction_leaf': 0.06317739337521977, 'min_impurity_decrease': 0.9992009551719719, 'max_features': 0.715597716876639, 'subsample': 0.1383073256358588, 'dropout_rate': 0.007959547401000244, 'ccp_alpha': 0.09079528702020442}. Best is trial 632 with value: 0.8548074589601917.[0m
[32m[I 2022-05-17 14:37:50,133][0m Trial 663 finished with value: 0.7624804586840075 and parameters: {'loss': 'coxph', 'learning_rate': 0.0010239640359979436, 'n_estimators': 428, 'criterion': 'friedman_mse', 'min_samples_split': 3, 'min_samples_leaf': 5, 'min_weight_fraction_leaf': 0.09222242569379899, 'min_impurity_decrease': 0.9282643130596828, 'max_features': 0.6961206283932397, 'subsample': 0.1742550010125755, 'dropout_rate': 0.03293637922357301, 'ccp_alpha': 0.18965315851127898}. Best is trial 632 with value: 0.8548074589601917.[0m
[32m[I 2022-05-17 15:01:45,872][0m Trial 664 finished with value: 0.7909828826033296 and parameters: {'loss': 'coxph', 'learning_rate': 0.0006940123853093388, 'n_estimators': 486, 'criterion': 'friedman_mse', 'min_samples_split': 3, 'min_samples_leaf': 4, 'min_weight_fraction_leaf': 0.08003449796385054, 'min_impurity_decrease': 0.953877651218825, 'max_features': 0.6556819278387795, 'subsample': 0.1571597228883397, 'dropout_rate': 0.05447016832680616, 'ccp_alpha': 0.11079160881606677}. Best is trial 632 with value: 0.8548074589601917.[0m
[32m[I 2022-05-17 15:22:55,788][0m Trial 665 finished with value: 0.5 and parameters: {'loss': 'coxph', 'learning_rate': 0.0002405721879821174, 'n_estimators': 434, 'criterion': 'squared_error', 'min_samples_split': 3, 'min_samples_leaf': 5, 'min_weight_fraction_leaf': 0.08956429673650632, 'min_impurity_decrease': 0.921808778572593, 'max_features': 0.7047141335579437, 'subsample': 0.13409717140008948, 'dropout_rate': 0.02298375358636021, 'ccp_alpha': 0.08883065437927666}. Best is trial 632 with value: 0.8548074589601917.[0m
[32m[I 2022-05-17 15:44:38,612][0m Trial 666 finished with value: 0.5 and parameters: {'loss': 'coxph', 'learning_rate': 0.0005375273780623969, 'n_estimators': 465, 'criterion': 'friedman_mse', 'min_samples_split': 3, 'min_samples_leaf': 5, 'min_weight_fraction_leaf': 0.07365307770057787, 'min_impurity_decrease': 0.9758822578294539, 'max_features': 0.7217917724879448, 'subsample': 0.1876834211632217, 'dropout_rate': 0.0019424660398001097, 'ccp_alpha': 0.3958699892825252}. Best is trial 632 with value: 0.8548074589601917.[0m
[32m[I 2022-05-17 16:08:49,055][0m Trial 667 finished with value: 0.7631120699447851 and parameters: {'loss': 'coxph', 'learning_rate': 0.00013266626849194995, 'n_estimators': 494, 'criterion': 'friedman_mse', 'min_samples_split': 3, 'min_samples_leaf': 5, 'min_weight_fraction_leaf': 0.08573967106264116, 'min_impurity_decrease': 0.9091146670770961, 'max_features': 0.7513118767171284, 'subsample': 0.1671860380370013, 'dropout_rate': 0.01563956769354939, 'ccp_alpha': 0.18614129016418704}. Best is trial 632 with value: 0.8548074589601917.[0m
[32m[I 2022-05-17 16:40:37,324][0m Trial 668 finished with value: 0.7595592143416269 and parameters: {'loss': 'coxph', 'learning_rate': 0.0003710207518514498, 'n_estimators': 609, 'criterion': 'friedman_mse', 'min_samples_split': 3, 'min_samples_leaf': 5, 'min_weight_fraction_leaf': 0.05920629023289699, 'min_impurity_decrease': 0.9591774417787782, 'max_features': 0.7281936312851925, 'subsample': 0.12728472184421383, 'dropout_rate': 0.021367721149584358, 'ccp_alpha': 0.2823991866763529}. Best is trial 632 with value: 0.8548074589601917.[0m
[32m[I 2022-05-17 17:01:17,512][0m Trial 669 finished with value: 0.5 and parameters: {'loss': 'coxph', 'learning_rate': 0.00012413863579533333, 'n_estimators': 432, 'criterion': 'friedman_mse', 'min_samples_split': 3, 'min_samples_leaf': 5, 'min_weight_fraction_leaf': 0.09793347445250002, 'min_impurity_decrease': 0.9370524395115496, 'max_features': 0.7041533812692242, 'subsample': 0.14946669438237886, 'dropout_rate': 0.06428227925928733, 'ccp_alpha': 1.9539271173157444}. Best is trial 632 with value: 0.8548074589601917.[0m
[32m[I 2022-05-17 17:22:38,200][0m Trial 670 finished with value: 0.7911193004284053 and parameters: {'loss': 'coxph', 'learning_rate': 0.00021102652752685446, 'n_estimators': 463, 'criterion': 'friedman_mse', 'min_samples_split': 3, 'min_samples_leaf': 6, 'min_weight_fraction_leaf': 0.07159959327431199, 'min_impurity_decrease': 0.9799800150088457, 'max_features': 0.7414929195683296, 'subsample': 0.22160910880355367, 'dropout_rate': 0.03905976014179402, 'ccp_alpha': 0.08984357344260191}. Best is trial 632 with value: 0.8548074589601917.[0m
[32m[I 2022-05-17 17:51:48,215][0m Trial 671 finished with value: 0.5 and parameters: {'loss': 'coxph', 'learning_rate': 0.0001635016315600409, 'n_estimators': 581, 'criterion': 'friedman_mse', 'min_samples_split': 3, 'min_samples_leaf': 5, 'min_weight_fraction_leaf': 0.08123557888511354, 'min_impurity_decrease': 0.9992973920507996, 'max_features': 0.6809368102525434, 'subsample': 0.13180228369486444, 'dropout_rate': 0.08421334040288193, 'ccp_alpha': 1.5438085738169551}. Best is trial 632 with value: 0.8548074589601917.[0m
[32m[I 2022-05-17 18:15:56,605][0m Trial 672 finished with value: 0.7872264002537773 and parameters: {'loss': 'coxph', 'learning_rate': 0.0001073408703522409, 'n_estimators': 495, 'criterion': 'friedman_mse', 'min_samples_split': 3, 'min_samples_leaf': 5, 'min_weight_fraction_leaf': 0.10500935825218599, 'min_impurity_decrease': 0.894087751060442, 'max_features': 0.7657198473108168, 'subsample': 0.17723604839776158, 'dropout_rate': 0.00026871874133564677, 'ccp_alpha': 0.08449103388793147}. Best is trial 632 with value: 0.8548074589601917.[0m
/media/san2_ssd/data/Workdir/survival/venv/lib/python3.8/site-packages/sksurv/ensemble/boosting.py:955: RuntimeWarning: divide by zero encountered in log
  time = numpy.log(time)
/media/san2_ssd/data/Workdir/survival/venv/lib/python3.8/site-packages/sksurv/ensemble/boosting.py:955: RuntimeWarning: divide by zero encountered in log
  time = numpy.log(time)
/media/san2_ssd/data/Workdir/survival/venv/lib/python3.8/site-packages/sksurv/ensemble/boosting.py:955: RuntimeWarning: divide by zero encountered in log
  time = numpy.log(time)
/media/san2_ssd/data/Workdir/survival/venv/lib/python3.8/site-packages/sksurv/ensemble/boosting.py:955: RuntimeWarning: divide by zero encountered in log
  time = numpy.log(time)
/media/san2_ssd/data/Workdir/survival/venv/lib/python3.8/site-packages/sksurv/ensemble/boosting.py:955: RuntimeWarning: divide by zero encountered in log
  time = numpy.log(time)
[32m[I 2022-05-17 18:15:56,680][0m Trial 673 finished with value: -1.0 and parameters: {'loss': 'squared', 'learning_rate': 6.917559789786105e-05, 'n_estimators': 643, 'criterion': 'friedman_mse', 'min_samples_split': 3, 'min_samples_leaf': 4, 'min_weight_fraction_leaf': 0.09177045955581442, 'min_impurity_decrease': 0.9521552651618033, 'max_features': 0.7309276242250362, 'subsample': 0.15290388074643468, 'dropout_rate': 0.11860973765881697, 'ccp_alpha': 0.006893116560676012}. Best is trial 632 with value: 0.8548074589601917.[0m
[32m[I 2022-05-17 18:41:27,553][0m Trial 674 finished with value: 0.7624645105783383 and parameters: {'loss': 'coxph', 'learning_rate': 0.0005522077186289187, 'n_estimators': 533, 'criterion': 'friedman_mse', 'min_samples_split': 3, 'min_samples_leaf': 5, 'min_weight_fraction_leaf': 0.04928422563180822, 'min_impurity_decrease': 0.9401760620000519, 'max_features': 0.7568077365397745, 'subsample': 0.20047024749174344, 'dropout_rate': 0.051298510481382786, 'ccp_alpha': 0.19637933838757823}. Best is trial 632 with value: 0.8548074589601917.[0m
[32m[I 2022-05-17 19:03:05,315][0m Trial 675 finished with value: 0.8534811991411464 and parameters: {'loss': 'coxph', 'learning_rate': 5.48433889669877e-05, 'n_estimators': 442, 'criterion': 'friedman_mse', 'min_samples_split': 3, 'min_samples_leaf': 5, 'min_weight_fraction_leaf': 0.06665606194947096, 'min_impurity_decrease': 0.9137745544040591, 'max_features': 0.7747873789813801, 'subsample': 0.12376108641951564, 'dropout_rate': 0.3766898356816228, 'ccp_alpha': 0.0028316545021021084}. Best is trial 632 with value: 0.8548074589601917.[0m
[32m[I 2022-05-17 19:27:36,476][0m Trial 676 finished with value: 0.841265175729893 and parameters: {'loss': 'coxph', 'learning_rate': 5.242495506238879e-05, 'n_estimators': 477, 'criterion': 'friedman_mse', 'min_samples_split': 3, 'min_samples_leaf': 10, 'min_weight_fraction_leaf': 0.039927159167693176, 'min_impurity_decrease': 0.9194988703380147, 'max_features': 0.7745665651349108, 'subsample': 0.12802699238939647, 'dropout_rate': 0.0763697576698687, 'ccp_alpha': 0.006166667787020926}. Best is trial 632 with value: 0.8548074589601917.[0m
[32m[I 2022-05-17 19:48:51,600][0m Trial 677 finished with value: 0.7695016727893657 and parameters: {'loss': 'coxph', 'learning_rate': 0.00030903452858617973, 'n_estimators': 451, 'criterion': 'friedman_mse', 'min_samples_split': 3, 'min_samples_leaf': 5, 'min_weight_fraction_leaf': 0.057649105496941015, 'min_impurity_decrease': 0.9074599866015647, 'max_features': 0.7449884588892757, 'subsample': 0.15573011256880578, 'dropout_rate': 0.30820525503830926, 'ccp_alpha': 0.17355593388099866}. Best is trial 632 with value: 0.8548074589601917.[0m
[32m[I 2022-05-17 20:14:23,095][0m Trial 678 finished with value: 0.7632001616780194 and parameters: {'loss': 'coxph', 'learning_rate': 0.00019754726468301743, 'n_estimators': 505, 'criterion': 'friedman_mse', 'min_samples_split': 3, 'min_samples_leaf': 6, 'min_weight_fraction_leaf': 0.0651257745496776, 'min_impurity_decrease': 0.9578935596492802, 'max_features': 0.703821121395491, 'subsample': 0.12299974049169679, 'dropout_rate': 0.1092600997320618, 'ccp_alpha': 0.2689527656076086}. Best is trial 632 with value: 0.8548074589601917.[0m
[32m[I 2022-05-17 20:39:39,571][0m Trial 679 finished with value: 0.7831086286611119 and parameters: {'loss': 'coxph', 'learning_rate': 0.00013799790378587917, 'n_estimators': 540, 'criterion': 'friedman_mse', 'min_samples_split': 3, 'min_samples_leaf': 4, 'min_weight_fraction_leaf': 0.0747043260748023, 'min_impurity_decrease': 0.9281157937328753, 'max_features': 0.7251779235228588, 'subsample': 0.17314758899111243, 'dropout_rate': 0.37969628143867085, 'ccp_alpha': 0.09946336297117239}. Best is trial 632 with value: 0.8548074589601917.[0m
[32m[I 2022-05-17 21:07:33,513][0m Trial 680 finished with value: 0.7782056378375296 and parameters: {'loss': 'coxph', 'learning_rate': 9.042720314022137e-05, 'n_estimators': 563, 'criterion': 'friedman_mse', 'min_samples_split': 3, 'min_samples_leaf': 5, 'min_weight_fraction_leaf': 0.08297348433083034, 'min_impurity_decrease': 0.9772504376446055, 'max_features': 0.7710940629950724, 'subsample': 0.12311355504133832, 'dropout_rate': 0.34059990535122653, 'ccp_alpha': 0.17620357284950958}. Best is trial 632 with value: 0.8548074589601917.[0m
[32m[I 2022-05-17 21:29:34,260][0m Trial 681 finished with value: 0.7897878394855736 and parameters: {'loss': 'coxph', 'learning_rate': 5.731539998702219e-05, 'n_estimators': 480, 'criterion': 'friedman_mse', 'min_samples_split': 3, 'min_samples_leaf': 5, 'min_weight_fraction_leaf': 0.06655814030622725, 'min_impurity_decrease': 0.9640465525494281, 'max_features': 0.7519327242130188, 'subsample': 0.1898197133143801, 'dropout_rate': 0.3303910073087272, 'ccp_alpha': 0.08594006827500525}. Best is trial 632 with value: 0.8548074589601917.[0m
[32m[I 2022-05-17 21:49:35,531][0m Trial 682 finished with value: 0.8525734008506426 and parameters: {'loss': 'coxph', 'learning_rate': 0.013375091123333361, 'n_estimators': 420, 'criterion': 'friedman_mse', 'min_samples_split': 4, 'min_samples_leaf': 5, 'min_weight_fraction_leaf': 0.08196146503440843, 'min_impurity_decrease': 0.9402330818932568, 'max_features': 0.7161035730257673, 'subsample': 0.14620843570324793, 'dropout_rate': 0.3740859152439382, 'ccp_alpha': 0.0018665886653615159}. Best is trial 632 with value: 0.8548074589601917.[0m
[32m[I 2022-05-17 22:10:44,158][0m Trial 683 finished with value: 0.8528603143309266 and parameters: {'loss': 'coxph', 'learning_rate': 0.01723203975686227, 'n_estimators': 440, 'criterion': 'friedman_mse', 'min_samples_split': 4, 'min_samples_leaf': 5, 'min_weight_fraction_leaf': 0.0801252282753811, 'min_impurity_decrease': 0.9414273907341205, 'max_features': 0.6725588114064198, 'subsample': 0.14674822159767842, 'dropout_rate': 0.35245430381113496, 'ccp_alpha': 0.001793479742092268}. Best is trial 632 with value: 0.8548074589601917.[0m
[32m[I 2022-05-17 22:30:21,470][0m Trial 684 finished with value: 0.7395411790253362 and parameters: {'loss': 'coxph', 'learning_rate': 7.65576924065733e-05, 'n_estimators': 424, 'criterion': 'friedman_mse', 'min_samples_split': 4, 'min_samples_leaf': 5, 'min_weight_fraction_leaf': 0.073355529580553, 'min_impurity_decrease': 0.9068026150924566, 'max_features': 0.6857813645724607, 'subsample': 0.1517003844073282, 'dropout_rate': 0.3472439303771683, 'ccp_alpha': 0.3490423348878563}. Best is trial 632 with value: 0.8548074589601917.[0m
[32m[I 2022-05-17 22:50:36,552][0m Trial 685 finished with value: 0.7635097100717669 and parameters: {'loss': 'coxph', 'learning_rate': 0.019883990017296908, 'n_estimators': 442, 'criterion': 'friedman_mse', 'min_samples_split': 4, 'min_samples_leaf': 5, 'min_weight_fraction_leaf': 0.06044757710761, 'min_impurity_decrease': 0.9341780728070715, 'max_features': 0.6671680370802795, 'subsample': 0.17273566069629048, 'dropout_rate': 0.3676602817187921, 'ccp_alpha': 0.1718028102548296}. Best is trial 632 with value: 0.8548074589601917.[0m
[32m[I 2022-05-17 23:12:12,192][0m Trial 686 finished with value: 0.7871960601644075 and parameters: {'loss': 'coxph', 'learning_rate': 0.008224488565874901, 'n_estimators': 458, 'criterion': 'friedman_mse', 'min_samples_split': 4, 'min_samples_leaf': 5, 'min_weight_fraction_leaf': 0.0811873222764767, 'min_impurity_decrease': 0.9208910056769498, 'max_features': 0.6408102429772663, 'subsample': 0.1457557015039072, 'dropout_rate': 0.398583680980282, 'ccp_alpha': 0.08953756860828897}. Best is trial 632 with value: 0.8548074589601917.[0m
[32m[I 2022-05-17 23:30:18,261][0m Trial 687 finished with value: 0.5 and parameters: {'loss': 'coxph', 'learning_rate': 0.09897766208483459, 'n_estimators': 421, 'criterion': 'squared_error', 'min_samples_split': 4, 'min_samples_leaf': 5, 'min_weight_fraction_leaf': 0.05138054816074556, 'min_impurity_decrease': 0.9383203195432658, 'max_features': 0.6759315361470304, 'subsample': 0.21610697699507592, 'dropout_rate': 0.37050571640736246, 'ccp_alpha': 0.2478212627480641}. Best is trial 632 with value: 0.8548074589601917.[0m
[32m[I 2022-05-17 23:49:41,529][0m Trial 688 finished with value: 0.7869238840112908 and parameters: {'loss': 'coxph', 'learning_rate': 0.0140871730127418, 'n_estimators': 421, 'criterion': 'friedman_mse', 'min_samples_split': 4, 'min_samples_leaf': 5, 'min_weight_fraction_leaf': 0.06982789212440448, 'min_impurity_decrease': 0.9802764384608678, 'max_features': 0.7093327625427011, 'subsample': 0.16304055078402438, 'dropout_rate': 0.3840160168815396, 'ccp_alpha': 0.0924612242863417}. Best is trial 632 with value: 0.8548074589601917.[0m
[32m[I 2022-05-18 00:10:40,355][0m Trial 689 finished with value: 0.5 and parameters: {'loss': 'coxph', 'learning_rate': 0.014215324344516856, 'n_estimators': 449, 'criterion': 'friedman_mse', 'min_samples_split': 4, 'min_samples_leaf': 5, 'min_weight_fraction_leaf': 0.08864112832548271, 'min_impurity_decrease': 0.8996506237576695, 'max_features': 0.6415434386817254, 'subsample': 0.14548613119672157, 'dropout_rate': 0.3458051647075435, 'ccp_alpha': 2.40885506083385}. Best is trial 632 with value: 0.8548074589601917.[0m
[32m[I 2022-05-18 00:32:07,328][0m Trial 690 finished with value: 0.8512970808592593 and parameters: {'loss': 'coxph', 'learning_rate': 0.016869429212271362, 'n_estimators': 462, 'criterion': 'friedman_mse', 'min_samples_split': 4, 'min_samples_leaf': 5, 'min_weight_fraction_leaf': 0.08178768119697336, 'min_impurity_decrease': 0.6663417737471391, 'max_features': 0.6651464884925871, 'subsample': 0.19146722811630867, 'dropout_rate': 0.3243148970378164, 'ccp_alpha': 0.0022799793034117503}. Best is trial 632 with value: 0.8548074589601917.[0m
/media/san2_ssd/data/Workdir/survival/venv/lib/python3.8/site-packages/sksurv/ensemble/boosting.py:955: RuntimeWarning: divide by zero encountered in log
  time = numpy.log(time)
/media/san2_ssd/data/Workdir/survival/venv/lib/python3.8/site-packages/sksurv/ensemble/boosting.py:955: RuntimeWarning: divide by zero encountered in log
  time = numpy.log(time)
/media/san2_ssd/data/Workdir/survival/venv/lib/python3.8/site-packages/sksurv/ensemble/boosting.py:955: RuntimeWarning: divide by zero encountered in log
  time = numpy.log(time)
/media/san2_ssd/data/Workdir/survival/venv/lib/python3.8/site-packages/sksurv/ensemble/boosting.py:955: RuntimeWarning: divide by zero encountered in log
  time = numpy.log(time)
/media/san2_ssd/data/Workdir/survival/venv/lib/python3.8/site-packages/sksurv/ensemble/boosting.py:955: RuntimeWarning: divide by zero encountered in log
  time = numpy.log(time)
[32m[I 2022-05-18 00:32:07,404][0m Trial 691 finished with value: -1.0 and parameters: {'loss': 'squared', 'learning_rate': 0.011386997019857773, 'n_estimators': 467, 'criterion': 'friedman_mse', 'min_samples_split': 4, 'min_samples_leaf': 5, 'min_weight_fraction_leaf': 0.07579114126754333, 'min_impurity_decrease': 0.6858167476408831, 'max_features': 0.6788206066878094, 'subsample': 0.20030336119270176, 'dropout_rate': 0.29504617693964447, 'ccp_alpha': 0.0012062943445374247}. Best is trial 632 with value: 0.8548074589601917.[0m
