[32m[I 2022-05-14 23:52:15,119][0m Trial 507 finished with value: 0.7884076422966573 and parameters: {'loss': 'coxph', 'learning_rate': 9.940290568144697e-05, 'n_estimators': 525, 'criterion': 'friedman_mse', 'min_samples_split': 4, 'min_samples_leaf': 5, 'min_weight_fraction_leaf': 0.09855895687180607, 'min_impurity_decrease': 0.8990244426359801, 'max_features': 0.7303637748963961, 'subsample': 0.11114760918731721, 'dropout_rate': 0.7031105733525792, 'ccp_alpha': 0.16132584863624974}. Best is trial 506 with value: 0.8525407582567747.[0m
[32m[I 2022-05-15 00:17:05,945][0m Trial 508 finished with value: 0.7588157061719294 and parameters: {'loss': 'coxph', 'learning_rate': 0.00010799865785444645, 'n_estimators': 514, 'criterion': 'friedman_mse', 'min_samples_split': 4, 'min_samples_leaf': 5, 'min_weight_fraction_leaf': 0.10242326306265458, 'min_impurity_decrease': 0.8953221702036215, 'max_features': 0.717803873976583, 'subsample': 0.09043284360918277, 'dropout_rate': 0.6695165060765647, 'ccp_alpha': 0.2852354080641557}. Best is trial 506 with value: 0.8525407582567747.[0m
[32m[I 2022-05-15 00:38:23,660][0m Trial 509 finished with value: 0.7829891519068803 and parameters: {'loss': 'coxph', 'learning_rate': 8.735628682144082e-05, 'n_estimators': 457, 'criterion': 'friedman_mse', 'min_samples_split': 4, 'min_samples_leaf': 5, 'min_weight_fraction_leaf': 0.0788088120996632, 'min_impurity_decrease': 0.9256512447131205, 'max_features': 0.7493414078977048, 'subsample': 0.11560497366732825, 'dropout_rate': 0.7114997219549898, 'ccp_alpha': 0.10172223805456701}. Best is trial 506 with value: 0.8525407582567747.[0m
[32m[I 2022-05-15 01:06:43,001][0m Trial 510 finished with value: 0.785969062756803 and parameters: {'loss': 'coxph', 'learning_rate': 0.00012682213672659498, 'n_estimators': 560, 'criterion': 'friedman_mse', 'min_samples_split': 4, 'min_samples_leaf': 5, 'min_weight_fraction_leaf': 0.06948138528740855, 'min_impurity_decrease': 0.9574100626268789, 'max_features': 0.7607788943207763, 'subsample': 0.054363088268078244, 'dropout_rate': 0.6922439141150064, 'ccp_alpha': 0.09810030724573889}. Best is trial 506 with value: 0.8525407582567747.[0m
[32m[I 2022-05-15 01:28:10,084][0m Trial 511 finished with value: 0.7628732689031882 and parameters: {'loss': 'coxph', 'learning_rate': 7.499700476308751e-05, 'n_estimators': 474, 'criterion': 'friedman_mse', 'min_samples_split': 4, 'min_samples_leaf': 5, 'min_weight_fraction_leaf': 0.11472882491582366, 'min_impurity_decrease': 0.8608053796353708, 'max_features': 0.7772183584911769, 'subsample': 0.1407757028984098, 'dropout_rate': 0.7265610300593789, 'ccp_alpha': 0.1799244637332741}. Best is trial 506 with value: 0.8525407582567747.[0m
[32m[I 2022-05-15 01:48:09,899][0m Trial 512 finished with value: 0.8449531458086412 and parameters: {'loss': 'coxph', 'learning_rate': 5.800413036603332e-05, 'n_estimators': 409, 'criterion': 'friedman_mse', 'min_samples_split': 4, 'min_samples_leaf': 5, 'min_weight_fraction_leaf': 0.0459629514634183, 'min_impurity_decrease': 0.888521811611012, 'max_features': 0.7407013750940565, 'subsample': 0.08238864319314425, 'dropout_rate': 0.6407012128328611, 'ccp_alpha': 0.006102870795106503}. Best is trial 506 with value: 0.8525407582567747.[0m
[32m[I 2022-05-15 02:08:01,059][0m Trial 513 finished with value: 0.7843081916100796 and parameters: {'loss': 'coxph', 'learning_rate': 0.00014375975424374716, 'n_estimators': 413, 'criterion': 'friedman_mse', 'min_samples_split': 4, 'min_samples_leaf': 5, 'min_weight_fraction_leaf': 0.0470768954568635, 'min_impurity_decrease': 0.8942412129194098, 'max_features': 0.7390821014741088, 'subsample': 0.09401188474132131, 'dropout_rate': 0.6457693747454184, 'ccp_alpha': 0.09328149142207431}. Best is trial 506 with value: 0.8525407582567747.[0m
[32m[I 2022-05-15 02:36:48,453][0m Trial 514 finished with value: 0.5 and parameters: {'loss': 'coxph', 'learning_rate': 5.8770389075803674e-05, 'n_estimators': 537, 'criterion': 'friedman_mse', 'min_samples_split': 4, 'min_samples_leaf': 4, 'min_weight_fraction_leaf': 0.054767952099009684, 'min_impurity_decrease': 0.8683702917610276, 'max_features': 0.7014118981270032, 'subsample': 0.001398622127861189, 'dropout_rate': 0.6294454343589505, 'ccp_alpha': 0.26622321399008836}. Best is trial 506 with value: 0.8525407582567747.[0m
[32m[I 2022-05-15 03:01:46,310][0m Trial 515 finished with value: 0.5 and parameters: {'loss': 'coxph', 'learning_rate': 5.236750089469123e-05, 'n_estimators': 484, 'criterion': 'squared_error', 'min_samples_split': 4, 'min_samples_leaf': 5, 'min_weight_fraction_leaf': 0.08744862505578672, 'min_impurity_decrease': 0.9149957773355368, 'max_features': 0.7650870914936629, 'subsample': 0.026124606942900273, 'dropout_rate': 0.6682882038404806, 'ccp_alpha': 3.6206189680066148}. Best is trial 506 with value: 0.8525407582567747.[0m
/media/san2_ssd/data/Workdir/survival/venv/lib/python3.8/site-packages/sksurv/ensemble/boosting.py:955: RuntimeWarning: divide by zero encountered in log
  time = numpy.log(time)
/media/san2_ssd/data/Workdir/survival/venv/lib/python3.8/site-packages/sksurv/ensemble/boosting.py:955: RuntimeWarning: divide by zero encountered in log
  time = numpy.log(time)
/media/san2_ssd/data/Workdir/survival/venv/lib/python3.8/site-packages/sksurv/ensemble/boosting.py:955: RuntimeWarning: divide by zero encountered in log
  time = numpy.log(time)
/media/san2_ssd/data/Workdir/survival/venv/lib/python3.8/site-packages/sksurv/ensemble/boosting.py:955: RuntimeWarning: divide by zero encountered in log
  time = numpy.log(time)
/media/san2_ssd/data/Workdir/survival/venv/lib/python3.8/site-packages/sksurv/ensemble/boosting.py:955: RuntimeWarning: divide by zero encountered in log
  time = numpy.log(time)
[32m[I 2022-05-15 03:01:46,378][0m Trial 516 finished with value: -1.0 and parameters: {'loss': 'squared', 'learning_rate': 8.515105477554225e-05, 'n_estimators': 441, 'criterion': 'friedman_mse', 'min_samples_split': 4, 'min_samples_leaf': 5, 'min_weight_fraction_leaf': 0.04280078206423038, 'min_impurity_decrease': 0.8312058656579556, 'max_features': 0.7284097106378232, 'subsample': 0.10810862682844945, 'dropout_rate': 0.6992520529494768, 'ccp_alpha': 0.186016797759329}. Best is trial 506 with value: 0.8525407582567747.[0m
[32m[I 2022-05-15 03:20:34,427][0m Trial 517 finished with value: 0.7862777438103292 and parameters: {'loss': 'coxph', 'learning_rate': 6.692767984474454e-05, 'n_estimators': 407, 'criterion': 'friedman_mse', 'min_samples_split': 3, 'min_samples_leaf': 6, 'min_weight_fraction_leaf': 0.10070510313757082, 'min_impurity_decrease': 0.9827486863487616, 'max_features': 0.7780514554385128, 'subsample': 0.12646105525207316, 'dropout_rate': 0.6496054671131674, 'ccp_alpha': 0.09155512892441622}. Best is trial 506 with value: 0.8525407582567747.[0m
[32m[I 2022-05-15 03:46:48,742][0m Trial 518 finished with value: 0.8508081601834373 and parameters: {'loss': 'coxph', 'learning_rate': 4.548286359503659e-05, 'n_estimators': 578, 'criterion': 'friedman_mse', 'min_samples_split': 4, 'min_samples_leaf': 5, 'min_weight_fraction_leaf': 0.11474146491879145, 'min_impurity_decrease': 0.881990580834138, 'max_features': 0.7336591956063383, 'subsample': 0.15846454061943197, 'dropout_rate': 0.7185765192164232, 'ccp_alpha': 0.0024237588052923907}. Best is trial 506 with value: 0.8525407582567747.[0m
[32m[I 2022-05-15 04:09:13,670][0m Trial 519 finished with value: 0.7823089040345683 and parameters: {'loss': 'coxph', 'learning_rate': 4.4281825863370656e-05, 'n_estimators': 503, 'criterion': 'friedman_mse', 'min_samples_split': 4, 'min_samples_leaf': 5, 'min_weight_fraction_leaf': 0.0686637387787952, 'min_impurity_decrease': 0.8866374289005095, 'max_features': 0.719594846687028, 'subsample': 0.1562167708272753, 'dropout_rate': 0.7354979440744916, 'ccp_alpha': 0.16442089147323657}. Best is trial 506 with value: 0.8525407582567747.[0m
[32m[I 2022-05-15 04:35:28,530][0m Trial 520 finished with value: 0.8506867718610687 and parameters: {'loss': 'coxph', 'learning_rate': 0.00020166866555426823, 'n_estimators': 578, 'criterion': 'friedman_mse', 'min_samples_split': 4, 'min_samples_leaf': 5, 'min_weight_fraction_leaf': 0.11225602166258392, 'min_impurity_decrease': 0.9039904217166636, 'max_features': 0.7472204300423063, 'subsample': 0.158350742844576, 'dropout_rate': 0.7133676951970042, 'ccp_alpha': 0.0025923662290820272}. Best is trial 506 with value: 0.8525407582567747.[0m
[32m[I 2022-05-15 05:02:27,043][0m Trial 521 finished with value: 0.7855973807133763 and parameters: {'loss': 'coxph', 'learning_rate': 0.00013541819456975118, 'n_estimators': 602, 'criterion': 'friedman_mse', 'min_samples_split': 4, 'min_samples_leaf': 6, 'min_weight_fraction_leaf': 0.11416569603838492, 'min_impurity_decrease': 0.9488285159548697, 'max_features': 0.6994290445987895, 'subsample': 0.16461941761901241, 'dropout_rate': 0.71436860727102, 'ccp_alpha': 0.09610638461389659}. Best is trial 506 with value: 0.8525407582567747.[0m
[32m[I 2022-05-15 05:32:46,774][0m Trial 522 finished with value: 0.8507581599964841 and parameters: {'loss': 'coxph', 'learning_rate': 0.0002198028835065687, 'n_estimators': 598, 'criterion': 'friedman_mse', 'min_samples_split': 4, 'min_samples_leaf': 5, 'min_weight_fraction_leaf': 0.08830579314925278, 'min_impurity_decrease': 0.9074095383889218, 'max_features': 0.7344747245748546, 'subsample': 0.054202477829009985, 'dropout_rate': 0.7393835034792297, 'ccp_alpha': 0.0037615861749350572}. Best is trial 506 with value: 0.8525407582567747.[0m
[32m[I 2022-05-15 06:02:45,693][0m Trial 523 finished with value: 0.7477815918146185 and parameters: {'loss': 'coxph', 'learning_rate': 0.0003171100325339873, 'n_estimators': 596, 'criterion': 'friedman_mse', 'min_samples_split': 4, 'min_samples_leaf': 4, 'min_weight_fraction_leaf': 0.0975825288942093, 'min_impurity_decrease': 0.9326703666036167, 'max_features': 0.7393114561642167, 'subsample': 0.05027655171673368, 'dropout_rate': 0.7355837763801237, 'ccp_alpha': 0.3353433641706872}. Best is trial 506 with value: 0.8525407582567747.[0m
[32m[I 2022-05-15 06:35:52,225][0m Trial 524 finished with value: 0.7716438752406868 and parameters: {'loss': 'coxph', 'learning_rate': 0.00023870237689518624, 'n_estimators': 638, 'criterion': 'friedman_mse', 'min_samples_split': 4, 'min_samples_leaf': 5, 'min_weight_fraction_leaf': 0.08946556654813738, 'min_impurity_decrease': 0.9050336916399335, 'max_features': 0.7493439923463061, 'subsample': 0.027771604883730358, 'dropout_rate': 0.7457009176974941, 'ccp_alpha': 0.23989847615382245}. Best is trial 506 with value: 0.8525407582567747.[0m
[32m[I 2022-05-15 07:04:43,817][0m Trial 525 finished with value: 0.7859554138977685 and parameters: {'loss': 'coxph', 'learning_rate': 0.00018065152014930727, 'n_estimators': 576, 'criterion': 'friedman_mse', 'min_samples_split': 4, 'min_samples_leaf': 5, 'min_weight_fraction_leaf': 0.11366787722146675, 'min_impurity_decrease': 0.8693893612756453, 'max_features': 0.7090817611172192, 'subsample': 0.05961353990386066, 'dropout_rate': 0.7176028504865973, 'ccp_alpha': 0.09969242548108453}. Best is trial 506 with value: 0.8525407582567747.[0m
[32m[I 2022-05-15 07:32:09,323][0m Trial 526 finished with value: 0.7774795550229737 and parameters: {'loss': 'coxph', 'learning_rate': 0.00026211376838562516, 'n_estimators': 537, 'criterion': 'friedman_mse', 'min_samples_split': 4, 'min_samples_leaf': 4, 'min_weight_fraction_leaf': 0.10591738830295824, 'min_impurity_decrease': 0.9122813186564146, 'max_features': 0.7303872956076054, 'subsample': 0.03991366037625392, 'dropout_rate': 0.7145479563292608, 'ccp_alpha': 0.16874268905623874}. Best is trial 506 with value: 0.8525407582567747.[0m
[32m[I 2022-05-15 07:59:26,860][0m Trial 527 finished with value: 0.5 and parameters: {'loss': 'coxph', 'learning_rate': 7.717619262702652e-05, 'n_estimators': 561, 'criterion': 'friedman_mse', 'min_samples_split': 4, 'min_samples_leaf': 5, 'min_weight_fraction_leaf': 0.07899785068970264, 'min_impurity_decrease': 0.932870181882926, 'max_features': 0.755198869615392, 'subsample': 0.07510630230996675, 'dropout_rate': 0.7358739427062118, 'ccp_alpha': 3.3271950076265244}. Best is trial 506 with value: 0.8525407582567747.[0m
[32m[I 2022-05-15 08:25:28,814][0m Trial 528 finished with value: 0.7868353971086408 and parameters: {'loss': 'coxph', 'learning_rate': 0.00010617180222754607, 'n_estimators': 577, 'criterion': 'friedman_mse', 'min_samples_split': 4, 'min_samples_leaf': 5, 'min_weight_fraction_leaf': 0.05790738047803312, 'min_impurity_decrease': 0.8868749834151829, 'max_features': 0.7682789436624063, 'subsample': 0.15660915809978623, 'dropout_rate': 0.7115006402307406, 'ccp_alpha': 0.09699684170436962}. Best is trial 506 with value: 0.8525407582567747.[0m
[32m[I 2022-05-15 08:55:37,085][0m Trial 529 finished with value: 0.790677570372765 and parameters: {'loss': 'coxph', 'learning_rate': 0.00016290487298548589, 'n_estimators': 603, 'criterion': 'friedman_mse', 'min_samples_split': 4, 'min_samples_leaf': 5, 'min_weight_fraction_leaf': 0.025378604400195095, 'min_impurity_decrease': 0.847280285937138, 'max_features': 0.7286528615142159, 'subsample': 0.059630087195540846, 'dropout_rate': 0.7430078113687836, 'ccp_alpha': 0.09438967317777215}. Best is trial 506 with value: 0.8525407582567747.[0m
[32m[I 2022-05-15 09:20:19,801][0m Trial 530 finished with value: 0.7693816216027455 and parameters: {'loss': 'coxph', 'learning_rate': 0.0002362571189171048, 'n_estimators': 475, 'criterion': 'friedman_mse', 'min_samples_split': 3, 'min_samples_leaf': 4, 'min_weight_fraction_leaf': 0.08730718220485574, 'min_impurity_decrease': 0.9069145700099962, 'max_features': 0.7513064760786677, 'subsample': 0.020682445159114625, 'dropout_rate': 0.694393529891183, 'ccp_alpha': 0.2438828754228209}. Best is trial 506 with value: 0.8525407582567747.[0m
[32m[I 2022-05-15 09:51:36,347][0m Trial 531 finished with value: 0.5948783936539526 and parameters: {'loss': 'coxph', 'learning_rate': 0.00021187491655796326, 'n_estimators': 646, 'criterion': 'friedman_mse', 'min_samples_split': 4, 'min_samples_leaf': 5, 'min_weight_fraction_leaf': 0.07360619087272227, 'min_impurity_decrease': 0.871882241082678, 'max_features': 0.7120098813152832, 'subsample': 0.08708688469063941, 'dropout_rate': 0.7179645381887411, 'ccp_alpha': 0.4172506318885054}. Best is trial 506 with value: 0.8525407582567747.[0m
[32m[I 2022-05-15 10:14:56,207][0m Trial 532 finished with value: 0.7864390850098857 and parameters: {'loss': 'coxph', 'learning_rate': 6.034631108115214e-05, 'n_estimators': 509, 'criterion': 'friedman_mse', 'min_samples_split': 4, 'min_samples_leaf': 5, 'min_weight_fraction_leaf': 0.10470563125859415, 'min_impurity_decrease': 0.9668726587241578, 'max_features': 0.7761287754803144, 'subsample': 0.13981865923420597, 'dropout_rate': 0.6774639428914482, 'ccp_alpha': 0.08568928230243977}. Best is trial 506 with value: 0.8525407582567747.[0m
[32m[I 2022-05-15 10:34:48,490][0m Trial 533 finished with value: 0.8527111020940833 and parameters: {'loss': 'coxph', 'learning_rate': 0.00010286569285396716, 'n_estimators': 394, 'criterion': 'friedman_mse', 'min_samples_split': 4, 'min_samples_leaf': 5, 'min_weight_fraction_leaf': 0.09480789512338678, 'min_impurity_decrease': 0.8860965855481255, 'max_features': 0.7914238295675481, 'subsample': 0.04769818032922759, 'dropout_rate': 0.6976649587540545, 'ccp_alpha': 0.0013841012274757483}. Best is trial 533 with value: 0.8527111020940833.[0m
[32m[I 2022-05-15 10:54:17,014][0m Trial 534 finished with value: 0.7648662309515548 and parameters: {'loss': 'coxph', 'learning_rate': 0.00013278717637143453, 'n_estimators': 383, 'criterion': 'friedman_mse', 'min_samples_split': 4, 'min_samples_leaf': 5, 'min_weight_fraction_leaf': 0.09365949360639803, 'min_impurity_decrease': 0.9016633755455201, 'max_features': 0.7849389926873127, 'subsample': 0.029743021313605754, 'dropout_rate': 0.7475203362299785, 'ccp_alpha': 0.1765990255422986}. Best is trial 533 with value: 0.8527111020940833.[0m
[32m[I 2022-05-15 11:26:56,505][0m Trial 535 finished with value: 0.8460614179531876 and parameters: {'loss': 'coxph', 'learning_rate': 0.00010111427731964654, 'n_estimators': 630, 'criterion': 'friedman_mse', 'min_samples_split': 4, 'min_samples_leaf': 6, 'min_weight_fraction_leaf': 0.1183117975312596, 'min_impurity_decrease': 0.8841897417732755, 'max_features': 0.7436048889878094, 'subsample': 0.048458715706487326, 'dropout_rate': 0.6743964526211673, 'ccp_alpha': 0.005246523367154738}. Best is trial 533 with value: 0.8527111020940833.[0m
[32m[I 2022-05-15 11:58:47,998][0m Trial 536 finished with value: 0.5 and parameters: {'loss': 'coxph', 'learning_rate': 0.0001130937102312529, 'n_estimators': 627, 'criterion': 'squared_error', 'min_samples_split': 4, 'min_samples_leaf': 6, 'min_weight_fraction_leaf': 0.11888411371487255, 'min_impurity_decrease': 0.8833485419634468, 'max_features': 0.7409791525033492, 'subsample': 0.05024246032263651, 'dropout_rate': 0.6563506571798486, 'ccp_alpha': 0.2546189669159817}. Best is trial 533 with value: 0.8527111020940833.[0m
/media/san2_ssd/data/Workdir/survival/venv/lib/python3.8/site-packages/sksurv/ensemble/boosting.py:955: RuntimeWarning: divide by zero encountered in log
  time = numpy.log(time)
/media/san2_ssd/data/Workdir/survival/venv/lib/python3.8/site-packages/sksurv/ensemble/boosting.py:955: RuntimeWarning: divide by zero encountered in log
  time = numpy.log(time)
/media/san2_ssd/data/Workdir/survival/venv/lib/python3.8/site-packages/sksurv/ensemble/boosting.py:955: RuntimeWarning: divide by zero encountered in log
  time = numpy.log(time)
/media/san2_ssd/data/Workdir/survival/venv/lib/python3.8/site-packages/sksurv/ensemble/boosting.py:955: RuntimeWarning: divide by zero encountered in log
  time = numpy.log(time)
/media/san2_ssd/data/Workdir/survival/venv/lib/python3.8/site-packages/sksurv/ensemble/boosting.py:955: RuntimeWarning: divide by zero encountered in log
  time = numpy.log(time)
[32m[I 2022-05-15 11:58:48,067][0m Trial 537 finished with value: -1.0 and parameters: {'loss': 'squared', 'learning_rate': 9.568002339354419e-05, 'n_estimators': 578, 'criterion': 'friedman_mse', 'min_samples_split': 4, 'min_samples_leaf': 6, 'min_weight_fraction_leaf': 0.11016919965486255, 'min_impurity_decrease': 0.8582358823425528, 'max_features': 0.7590069015440014, 'subsample': 0.013757153711566425, 'dropout_rate': 0.6712838832511242, 'ccp_alpha': 0.09234496980786863}. Best is trial 533 with value: 0.8527111020940833.[0m
[32m[I 2022-05-15 12:27:22,694][0m Trial 538 finished with value: 0.8347205952601403 and parameters: {'loss': 'coxph', 'learning_rate': 0.00019904640286680727, 'n_estimators': 628, 'criterion': 'friedman_mse', 'min_samples_split': 4, 'min_samples_leaf': 6, 'min_weight_fraction_leaf': 0.09521212306898316, 'min_impurity_decrease': 0.9278291952965291, 'max_features': 0.690594290257154, 'subsample': 0.17942632127230196, 'dropout_rate': 0.6211434446551862, 'ccp_alpha': 0.007099167881112283}. Best is trial 533 with value: 0.8527111020940833.[0m
[32m[I 2022-05-15 12:54:29,064][0m Trial 539 finished with value: 0.7665470828156906 and parameters: {'loss': 'coxph', 'learning_rate': 0.0001582159131610514, 'n_estimators': 528, 'criterion': 'friedman_mse', 'min_samples_split': 4, 'min_samples_leaf': 7, 'min_weight_fraction_leaf': 0.12082548398800273, 'min_impurity_decrease': 0.8421414455029566, 'max_features': 0.793628117618254, 'subsample': 0.037321727990902304, 'dropout_rate': 0.6884407325067805, 'ccp_alpha': 0.16029302053652786}. Best is trial 533 with value: 0.8527111020940833.[0m
[32m[I 2022-05-15 13:18:12,173][0m Trial 540 finished with value: 0.792484536443096 and parameters: {'loss': 'coxph', 'learning_rate': 9.234284538934283e-05, 'n_estimators': 465, 'criterion': 'friedman_mse', 'min_samples_split': 4, 'min_samples_leaf': 6, 'min_weight_fraction_leaf': 0.08195247206465359, 'min_impurity_decrease': 0.8900240091744083, 'max_features': 0.765991906320101, 'subsample': 0.04366869692220194, 'dropout_rate': 0.6446929994135346, 'ccp_alpha': 0.09370303357660924}. Best is trial 533 with value: 0.8527111020940833.[0m
[32m[I 2022-05-15 13:45:49,926][0m Trial 541 finished with value: 0.7428546837660059 and parameters: {'loss': 'coxph', 'learning_rate': 7.601444382847918e-05, 'n_estimators': 550, 'criterion': 'friedman_mse', 'min_samples_split': 4, 'min_samples_leaf': 5, 'min_weight_fraction_leaf': 0.10125222370970667, 'min_impurity_decrease': 0.9163960229053787, 'max_features': 0.7342835698086392, 'subsample': 0.054849157262899496, 'dropout_rate': 0.6743393216019623, 'ccp_alpha': 0.36469345044735324}. Best is trial 533 with value: 0.8527111020940833.[0m
[32m[I 2022-05-15 14:07:12,869][0m Trial 542 finished with value: 0.5 and parameters: {'loss': 'coxph', 'learning_rate': 0.00012223945830825957, 'n_estimators': 436, 'criterion': 'friedman_mse', 'min_samples_split': 4, 'min_samples_leaf': 5, 'min_weight_fraction_leaf': 0.06952035522230926, 'min_impurity_decrease': 0.8200284383505654, 'max_features': 0.7128810353812657, 'subsample': 0.06392744488059628, 'dropout_rate': 0.6979824966441976, 'ccp_alpha': 3.872777605678792}. Best is trial 533 with value: 0.8527111020940833.[0m
[32m[I 2022-05-15 14:27:57,362][0m Trial 543 finished with value: 0.8383113487354373 and parameters: {'loss': 'coxph', 'learning_rate': 0.00010136030522639368, 'n_estimators': 398, 'criterion': 'friedman_mse', 'min_samples_split': 3, 'min_samples_leaf': 6, 'min_weight_fraction_leaf': 0.03990903945040872, 'min_impurity_decrease': 0.9462963957186421, 'max_features': 0.794344912582528, 'subsample': 0.01634583617630167, 'dropout_rate': 0.7261011297959696, 'ccp_alpha': 0.0036774466765683075}. Best is trial 533 with value: 0.8527111020940833.[0m
