[32m[I 2022-04-21 14:24:47,224][0m Trial 992 finished with value: 0.9093247923494931 and parameters: {'splitter': 'random', 'min_samples_split': 0.046209942369207654, 'min_samples_leaf': 0.042917423614809005, 'min_weight_fraction_leaf': 0.030032031818171614, 'max_features': 0.9210193206313189}. Best is trial 677 with value: 0.9113497956229912.[0m
[32m[I 2022-04-21 14:24:48,460][0m Trial 993 finished with value: 0.9026499938596528 and parameters: {'splitter': 'random', 'min_samples_split': 0.03767389877839099, 'min_samples_leaf': 0.04883277816406008, 'min_weight_fraction_leaf': 0.04167992063481513, 'max_features': 0.9743025313308806}. Best is trial 677 with value: 0.9113497956229912.[0m
[32m[I 2022-04-21 14:24:50,170][0m Trial 994 finished with value: 0.8983929270548761 and parameters: {'splitter': 'random', 'min_samples_split': 0.04361909133826043, 'min_samples_leaf': 0.03133874617078672, 'min_weight_fraction_leaf': 0.029173851662911254, 'max_features': 0.43422881092751925}. Best is trial 677 with value: 0.9113497956229912.[0m
[32m[I 2022-04-21 14:24:51,124][0m Trial 995 finished with value: 0.3425804518366971 and parameters: {'splitter': 'random', 'min_samples_split': 0.03192483111402421, 'min_samples_leaf': 0.4202661083680934, 'min_weight_fraction_leaf': 0.053752574048681834, 'max_features': 0.933500443828993}. Best is trial 677 with value: 0.9113497956229912.[0m
[32m[I 2022-04-21 14:24:53,717][0m Trial 996 finished with value: 0.3425804518366971 and parameters: {'splitter': 'random', 'min_samples_split': 0.043497344032841445, 'min_samples_leaf': 0.01772958566023262, 'min_weight_fraction_leaf': 0.4560051336439028, 'max_features': 0.8653019234723965}. Best is trial 677 with value: 0.9113497956229912.[0m
[32m[I 2022-04-21 14:28:46,404][0m Trial 997 finished with value: 0.8850256497440171 and parameters: {'splitter': 'best', 'min_samples_split': 0.03536978500201567, 'min_samples_leaf': 0.009300600856889885, 'min_weight_fraction_leaf': 0.03243124607259701, 'max_features': 0.9515138450514224}. Best is trial 677 with value: 0.9113497956229912.[0m
[32m[I 2022-04-21 14:28:47,845][0m Trial 998 finished with value: 0.9019123597504416 and parameters: {'splitter': 'random', 'min_samples_split': 0.049355802947500776, 'min_samples_leaf': 0.025502573643269903, 'min_weight_fraction_leaf': 0.0064225534974360005, 'max_features': 0.8969765490625627}. Best is trial 677 with value: 0.9113497956229912.[0m
[32m[I 2022-04-21 14:28:50,101][0m Trial 999 finished with value: 0.9093247923494931 and parameters: {'splitter': 'random', 'min_samples_split': 0.03297302243412711, 'min_samples_leaf': 0.03891048065142849, 'min_weight_fraction_leaf': 0.043290052873460404, 'max_features': 0.9175664707880434}. Best is trial 677 with value: 0.9113497956229912.[0m
[32m[I 2022-04-21 14:28:50,108][0m A new study created in memory with name: no-name-4616e25f-e35d-419c-86db-7c1fbfa39bf0[0m
[32m[I 2022-04-21 14:28:50,355][0m Trial 0 finished with value: 0.5044016526611106 and parameters: {'splitter': 'random', 'min_samples_split': 0.2701905694197161, 'min_samples_leaf': 0.2400616194527951, 'min_weight_fraction_leaf': 0.4263358309212197, 'max_features': 0.6436594936895718}. Best is trial 0 with value: 0.5044016526611106.[0m
[32m[I 2022-04-21 14:29:07,533][0m Trial 1 finished with value: 0.578937303832889 and parameters: {'splitter': 'best', 'min_samples_split': 0.10144964838248012, 'min_samples_leaf': 0.11946672572839186, 'min_weight_fraction_leaf': 0.06458070313752107, 'max_features': 0.10546891151451065}. Best is trial 1 with value: 0.578937303832889.[0m
[32m[I 2022-04-21 14:29:21,890][0m Trial 2 finished with value: 0.5656657206762908 and parameters: {'splitter': 'best', 'min_samples_split': 0.29859717234961664, 'min_samples_leaf': 0.3899853105320103, 'min_weight_fraction_leaf': 0.11424263786376554, 'max_features': 0.6609681862273754}. Best is trial 1 with value: 0.578937303832889.[0m
[32m[I 2022-04-21 14:29:34,782][0m Trial 3 finished with value: 0.5656657206762908 and parameters: {'splitter': 'best', 'min_samples_split': 0.13696842623347297, 'min_samples_leaf': 0.39094066686140766, 'min_weight_fraction_leaf': 0.2071755594574894, 'max_features': 0.7095861156732157}. Best is trial 1 with value: 0.578937303832889.[0m
[32m[I 2022-04-21 14:29:35,886][0m Trial 4 finished with value: 0.5065908818887879 and parameters: {'splitter': 'random', 'min_samples_split': 0.42373667080308447, 'min_samples_leaf': 0.25117845764392865, 'min_weight_fraction_leaf': 0.40235047946914765, 'max_features': 0.6224978770890088}. Best is trial 1 with value: 0.578937303832889.[0m
[32m[I 2022-04-21 14:30:52,901][0m Trial 5 finished with value: 0.7403281935839677 and parameters: {'splitter': 'best', 'min_samples_split': 0.2505069393535733, 'min_samples_leaf': 0.04051159651536483, 'min_weight_fraction_leaf': 0.09300957236448909, 'max_features': 0.4670264635604927}. Best is trial 5 with value: 0.7403281935839677.[0m
[32m[I 2022-04-21 14:31:50,224][0m Trial 6 finished with value: 0.7504134203636259 and parameters: {'splitter': 'best', 'min_samples_split': 0.21648839967233655, 'min_samples_leaf': 0.11990843395748237, 'min_weight_fraction_leaf': 0.16805453196949766, 'max_features': 0.4563980411474904}. Best is trial 6 with value: 0.7504134203636259.[0m
[32m[I 2022-04-21 14:31:50,625][0m Trial 7 finished with value: 0.6851609036733942 and parameters: {'splitter': 'random', 'min_samples_split': 0.13585470096504998, 'min_samples_leaf': 0.15793840198793857, 'min_weight_fraction_leaf': 0.4386953619949152, 'max_features': 0.7759504337288894}. Best is trial 6 with value: 0.7504134203636259.[0m
[32m[I 2022-04-21 14:31:50,985][0m Trial 8 finished with value: 0.5065908818887879 and parameters: {'splitter': 'random', 'min_samples_split': 0.1624632629598578, 'min_samples_leaf': 0.14506010119820728, 'min_weight_fraction_leaf': 0.35407080350398995, 'max_features': 0.47426057112809494}. Best is trial 6 with value: 0.7504134203636259.[0m
[32m[I 2022-04-21 14:32:45,467][0m Trial 9 finished with value: 0.7199088740763058 and parameters: {'splitter': 'best', 'min_samples_split': 0.020865304770264565, 'min_samples_leaf': 0.013347911800103335, 'min_weight_fraction_leaf': 0.24746465379096094, 'max_features': 0.42110376636034375}. Best is trial 6 with value: 0.7504134203636259.[0m
[32m[I 2022-04-21 14:32:47,181][0m Trial 10 finished with value: 0.5613926499130392 and parameters: {'splitter': 'best', 'min_samples_split': 0.41770537362329213, 'min_samples_leaf': 0.4893835636095246, 'min_weight_fraction_leaf': 0.00661567872842439, 'max_features': 0.9646785209846603}. Best is trial 6 with value: 0.7504134203636259.[0m
[32m[I 2022-04-21 14:33:54,272][0m Trial 11 finished with value: 0.7360365827194171 and parameters: {'splitter': 'best', 'min_samples_split': 0.3184464008888418, 'min_samples_leaf': 0.012923458700924647, 'min_weight_fraction_leaf': 0.15995129273298087, 'max_features': 0.2825094747614164}. Best is trial 6 with value: 0.7504134203636259.[0m
[32m[I 2022-04-21 14:34:42,352][0m Trial 12 finished with value: 0.5883881111361685 and parameters: {'splitter': 'best', 'min_samples_split': 0.24094403723126956, 'min_samples_leaf': 0.07798879072611611, 'min_weight_fraction_leaf': 0.30918040831670407, 'max_features': 0.29549179676867043}. Best is trial 6 with value: 0.7504134203636259.[0m
[32m[I 2022-04-21 14:35:12,312][0m Trial 13 finished with value: 0.5683796711170785 and parameters: {'splitter': 'best', 'min_samples_split': 0.22083820753895383, 'min_samples_leaf': 0.21914935901910482, 'min_weight_fraction_leaf': 0.12025379578854611, 'max_features': 0.3175091811212837}. Best is trial 6 with value: 0.7504134203636259.[0m
[32m[I 2022-04-21 14:35:16,496][0m Trial 14 finished with value: 0.6380791915184503 and parameters: {'splitter': 'best', 'min_samples_split': 0.3439583308009615, 'min_samples_leaf': 0.08425950552616686, 'min_weight_fraction_leaf': 0.19307373547768225, 'max_features': 0.018968159802147277}. Best is trial 6 with value: 0.7504134203636259.[0m
[32m[I 2022-04-21 14:37:10,069][0m Trial 15 finished with value: 0.7697672774234361 and parameters: {'splitter': 'best', 'min_samples_split': 0.20487511405513517, 'min_samples_leaf': 0.056081216222508515, 'min_weight_fraction_leaf': 0.00530022069684527, 'max_features': 0.5242043998342976}. Best is trial 15 with value: 0.7697672774234361.[0m
[32m[I 2022-04-21 14:38:07,012][0m Trial 16 finished with value: 0.7315356009540477 and parameters: {'splitter': 'best', 'min_samples_split': 0.03196854323697776, 'min_samples_leaf': 0.2050998531867575, 'min_weight_fraction_leaf': 0.00531642694968267, 'max_features': 0.8272827253052095}. Best is trial 15 with value: 0.7697672774234361.[0m
[32m[I 2022-04-21 14:38:36,652][0m Trial 17 finished with value: 0.5656657206762908 and parameters: {'splitter': 'best', 'min_samples_split': 0.36640666644219655, 'min_samples_leaf': 0.2968316310940577, 'min_weight_fraction_leaf': 0.0531922069767891, 'max_features': 0.565853970013967}. Best is trial 15 with value: 0.7697672774234361.[0m
[32m[I 2022-04-21 14:38:37,327][0m Trial 18 finished with value: 0.5 and parameters: {'splitter': 'random', 'min_samples_split': 0.2051205985630244, 'min_samples_leaf': 0.08353822404227979, 'min_weight_fraction_leaf': 0.2941853537315988, 'max_features': 0.21365351880386355}. Best is trial 15 with value: 0.7697672774234361.[0m
[32m[I 2022-04-21 14:39:10,852][0m Trial 19 finished with value: 0.6679051254153651 and parameters: {'splitter': 'best', 'min_samples_split': 0.4985100882718375, 'min_samples_leaf': 0.16975377965595684, 'min_weight_fraction_leaf': 0.1549386120532465, 'max_features': 0.39313299676554037}. Best is trial 15 with value: 0.7697672774234361.[0m
[32m[I 2022-04-21 14:39:31,552][0m Trial 20 finished with value: 0.5656657206762908 and parameters: {'splitter': 'best', 'min_samples_split': 0.06642247374356935, 'min_samples_leaf': 0.31993774388545754, 'min_weight_fraction_leaf': 0.26192584732853597, 'max_features': 0.5484018997992457}. Best is trial 15 with value: 0.7697672774234361.[0m
[32m[I 2022-04-21 14:40:55,450][0m Trial 21 finished with value: 0.7990795087393392 and parameters: {'splitter': 'best', 'min_samples_split': 0.1977242043156587, 'min_samples_leaf': 0.04781990719590433, 'min_weight_fraction_leaf': 0.05079554907164102, 'max_features': 0.48214874325501345}. Best is trial 21 with value: 0.7990795087393392.[0m
[32m[I 2022-04-21 14:42:39,675][0m Trial 22 finished with value: 0.7579048478948857 and parameters: {'splitter': 'best', 'min_samples_split': 0.18809286181239143, 'min_samples_leaf': 0.062498276056128454, 'min_weight_fraction_leaf': 0.04305465389480355, 'max_features': 0.38520343508533705}. Best is trial 21 with value: 0.7990795087393392.[0m
[32m[I 2022-04-21 14:44:29,102][0m Trial 23 finished with value: 0.7564930084972422 and parameters: {'splitter': 'best', 'min_samples_split': 0.17517956557710257, 'min_samples_leaf': 0.053953307166222444, 'min_weight_fraction_leaf': 0.055043533451132005, 'max_features': 0.36041004892956685}. Best is trial 21 with value: 0.7990795087393392.[0m
[32m[I 2022-04-21 14:46:15,607][0m Trial 24 finished with value: 0.7455104358169615 and parameters: {'splitter': 'best', 'min_samples_split': 0.09898256191472357, 'min_samples_leaf': 0.013009925664332574, 'min_weight_fraction_leaf': 0.004056471646751381, 'max_features': 0.2129582758888318}. Best is trial 21 with value: 0.7990795087393392.[0m
[32m[I 2022-04-21 14:47:11,166][0m Trial 25 finished with value: 0.7483052972241296 and parameters: {'splitter': 'best', 'min_samples_split': 0.17523714641365945, 'min_samples_leaf': 0.10696983271021016, 'min_weight_fraction_leaf': 0.04662417139980384, 'max_features': 0.5536641665790715}. Best is trial 21 with value: 0.7990795087393392.[0m
[32m[I 2022-04-21 14:47:11,741][0m Trial 26 finished with value: 0.5 and parameters: {'splitter': 'random', 'min_samples_split': 0.292511070980582, 'min_samples_leaf': 0.052673181971709795, 'min_weight_fraction_leaf': 0.49468578646101224, 'max_features': 0.17309965900847335}. Best is trial 21 with value: 0.7990795087393392.[0m
[32m[I 2022-04-21 14:48:02,169][0m Trial 27 finished with value: 0.7335805744029138 and parameters: {'splitter': 'best', 'min_samples_split': 0.1118904396347278, 'min_samples_leaf': 0.051554194338699094, 'min_weight_fraction_leaf': 0.09045601144034436, 'max_features': 0.3702824116327045}. Best is trial 21 with value: 0.7990795087393392.[0m
[32m[I 2022-04-21 14:48:37,927][0m Trial 28 finished with value: 0.6036009887109496 and parameters: {'splitter': 'best', 'min_samples_split': 0.17549793042846423, 'min_samples_leaf': 0.18609445462131857, 'min_weight_fraction_leaf': 0.12762114848818687, 'max_features': 0.5142319291825158}. Best is trial 21 with value: 0.7990795087393392.[0m
[32m[I 2022-04-21 14:48:38,194][0m Trial 29 finished with value: 0.679039760596615 and parameters: {'splitter': 'random', 'min_samples_split': 0.267435660881285, 'min_samples_leaf': 0.2644615102654655, 'min_weight_fraction_leaf': 0.03246517802076427, 'max_features': 0.616395824991051}. Best is trial 21 with value: 0.7990795087393392.[0m
[32m[I 2022-04-21 14:50:47,524][0m Trial 30 finished with value: 0.7815211886325184 and parameters: {'splitter': 'best', 'min_samples_split': 0.20995584778467036, 'min_samples_leaf': 0.001648307318241754, 'min_weight_fraction_leaf': 0.08011435398917179, 'max_features': 0.7187769868274163}. Best is trial 21 with value: 0.7990795087393392.[0m
[32m[I 2022-04-21 14:53:11,745][0m Trial 31 finished with value: 0.781106787871176 and parameters: {'splitter': 'best', 'min_samples_split': 0.20977614700259675, 'min_samples_leaf': 0.006664977549957318, 'min_weight_fraction_leaf': 0.0883254669195691, 'max_features': 0.8769601709166424}. Best is trial 21 with value: 0.7990795087393392.[0m
[32m[I 2022-04-21 14:55:40,552][0m Trial 32 finished with value: 0.7922767734150464 and parameters: {'splitter': 'best', 'min_samples_split': 0.23663845903048636, 'min_samples_leaf': 0.009101599596830948, 'min_weight_fraction_leaf': 0.07332609850876479, 'max_features': 0.8944545076856292}. Best is trial 21 with value: 0.7990795087393392.[0m
[32m[I 2022-04-21 14:58:09,055][0m Trial 33 finished with value: 0.7819372066920061 and parameters: {'splitter': 'best', 'min_samples_split': 0.2492799648603296, 'min_samples_leaf': 0.009084383332242155, 'min_weight_fraction_leaf': 0.090289911633171, 'max_features': 0.9418439342924949}. Best is trial 21 with value: 0.7990795087393392.[0m
[32m[I 2022-04-21 14:59:34,503][0m Trial 34 finished with value: 0.806531454967271 and parameters: {'splitter': 'best', 'min_samples_split': 0.26654590526333966, 'min_samples_leaf': 0.11256035119465914, 'min_weight_fraction_leaf': 0.08068083653023729, 'max_features': 0.982667377446224}. Best is trial 34 with value: 0.806531454967271.[0m
[32m[I 2022-04-21 15:00:57,488][0m Trial 35 finished with value: 0.8010670256869684 and parameters: {'splitter': 'best', 'min_samples_split': 0.2935038386998698, 'min_samples_leaf': 0.09687654585695495, 'min_weight_fraction_leaf': 0.1322312809381358, 'max_features': 0.9933256843774586}. Best is trial 34 with value: 0.806531454967271.[0m
[32m[I 2022-04-21 15:02:05,858][0m Trial 36 finished with value: 0.8007553391102904 and parameters: {'splitter': 'best', 'min_samples_split': 0.2980141426398911, 'min_samples_leaf': 0.12352561250334192, 'min_weight_fraction_leaf': 0.1357950755624334, 'max_features': 0.9922283914887453}. Best is trial 34 with value: 0.806531454967271.[0m
[32m[I 2022-04-21 15:03:13,203][0m Trial 37 finished with value: 0.7655179129747802 and parameters: {'splitter': 'best', 'min_samples_split': 0.3011425529658014, 'min_samples_leaf': 0.12390090948779715, 'min_weight_fraction_leaf': 0.21246804274240674, 'max_features': 0.9926917911702788}. Best is trial 34 with value: 0.806531454967271.[0m
[32m[I 2022-04-21 15:03:14,017][0m Trial 38 finished with value: 0.7658405528004703 and parameters: {'splitter': 'random', 'min_samples_split': 0.3872777882699776, 'min_samples_leaf': 0.13921335451273412, 'min_weight_fraction_leaf': 0.13577931560252463, 'max_features': 0.911337150088906}. Best is trial 34 with value: 0.806531454967271.[0m
[32m[I 2022-04-21 15:04:25,194][0m Trial 39 finished with value: 0.7290185106355987 and parameters: {'splitter': 'best', 'min_samples_split': 0.33314410041320436, 'min_samples_leaf': 0.09280287671993537, 'min_weight_fraction_leaf': 0.19534382424703933, 'max_features': 0.8441485790943168}. Best is trial 34 with value: 0.806531454967271.[0m
[32m[I 2022-04-21 15:05:07,595][0m Trial 40 finished with value: 0.5886636817935722 and parameters: {'splitter': 'best', 'min_samples_split': 0.28111966817268025, 'min_samples_leaf': 0.17180075650959936, 'min_weight_fraction_leaf': 0.22810721113717902, 'max_features': 0.7908001710688175}. Best is trial 34 with value: 0.806531454967271.[0m
[32m[I 2022-04-21 15:06:37,729][0m Trial 41 finished with value: 0.773044192568482 and parameters: {'splitter': 'best', 'min_samples_split': 0.2605040459445846, 'min_samples_leaf': 0.11171835277567863, 'min_weight_fraction_leaf': 0.11084058065761823, 'max_features': 0.9138133760823843}. Best is trial 34 with value: 0.806531454967271.[0m
[32m[I 2022-04-21 15:08:23,810][0m Trial 42 finished with value: 0.7974423907004571 and parameters: {'splitter': 'best', 'min_samples_split': 0.31222321947682097, 'min_samples_leaf': 0.03354791239045747, 'min_weight_fraction_leaf': 0.15515922092648737, 'max_features': 0.9874822431717274}. Best is trial 34 with value: 0.806531454967271.[0m
[32m[I 2022-04-21 15:09:35,527][0m Trial 43 finished with value: 0.7974457397693147 and parameters: {'splitter': 'best', 'min_samples_split': 0.3051411554150172, 'min_samples_leaf': 0.1384306069736725, 'min_weight_fraction_leaf': 0.15553535649716682, 'max_features': 0.9992117820819771}. Best is trial 34 with value: 0.806531454967271.[0m
[32m[I 2022-04-21 15:10:33,328][0m Trial 44 finished with value: 0.7315655190205596 and parameters: {'splitter': 'best', 'min_samples_split': 0.3553563937074607, 'min_samples_leaf': 0.14472775490361178, 'min_weight_fraction_leaf': 0.1739049587745743, 'max_features': 0.7173366972676712}. Best is trial 34 with value: 0.806531454967271.[0m
[32m[I 2022-04-21 15:11:50,317][0m Trial 45 finished with value: 0.7664211250015003 and parameters: {'splitter': 'best', 'min_samples_split': 0.39462114461719017, 'min_samples_leaf': 0.13033572688847433, 'min_weight_fraction_leaf': 0.10915016819397624, 'max_features': 0.9443374368767908}. Best is trial 34 with value: 0.806531454967271.[0m
[32m[I 2022-04-21 15:11:50,786][0m Trial 46 finished with value: 0.7660841954414641 and parameters: {'splitter': 'random', 'min_samples_split': 0.3281149281540511, 'min_samples_leaf': 0.22193277418115986, 'min_weight_fraction_leaf': 0.14380132106299695, 'max_features': 0.7964480075397402}. Best is trial 34 with value: 0.806531454967271.[0m
[32m[I 2022-04-21 15:13:08,958][0m Trial 47 finished with value: 0.7538432623674571 and parameters: {'splitter': 'best', 'min_samples_split': 0.28106086352777304, 'min_samples_leaf': 0.09953444018493814, 'min_weight_fraction_leaf': 0.17700571842513152, 'max_features': 0.8489269159856899}. Best is trial 34 with value: 0.806531454967271.[0m
[32m[I 2022-04-21 15:14:07,246][0m Trial 48 finished with value: 0.7878962887912342 and parameters: {'splitter': 'best', 'min_samples_split': 0.14024502463211064, 'min_samples_leaf': 0.15917842343677244, 'min_weight_fraction_leaf': 0.03112384894236639, 'max_features': 0.9899000410531915}. Best is trial 34 with value: 0.806531454967271.[0m
[32m[I 2022-04-21 15:14:08,689][0m Trial 49 finished with value: 0.5613926499130392 and parameters: {'splitter': 'best', 'min_samples_split': 0.23416695661817902, 'min_samples_leaf': 0.4874373926663572, 'min_weight_fraction_leaf': 0.11730147133263709, 'max_features': 0.6684730088634978}. Best is trial 34 with value: 0.806531454967271.[0m
[32m[I 2022-04-21 15:15:00,028][0m Trial 50 finished with value: 0.7293424162157807 and parameters: {'splitter': 'best', 'min_samples_split': 0.46270521205604, 'min_samples_leaf': 0.1977686715702645, 'min_weight_fraction_leaf': 0.06750204742571882, 'max_features': 0.7603231322481525}. Best is trial 34 with value: 0.806531454967271.[0m
[32m[I 2022-04-21 15:16:41,510][0m Trial 51 finished with value: 0.768486413673652 and parameters: {'splitter': 'best', 'min_samples_split': 0.31460486429423135, 'min_samples_leaf': 0.07565781761902474, 'min_weight_fraction_leaf': 0.14635235565967056, 'max_features': 0.9626668291263549}. Best is trial 34 with value: 0.806531454967271.[0m
[32m[I 2022-04-21 15:18:40,995][0m Trial 52 finished with value: 0.8098214582394094 and parameters: {'splitter': 'best', 'min_samples_split': 0.3060955570326737, 'min_samples_leaf': 0.03469052379082065, 'min_weight_fraction_leaf': 0.10644417320940264, 'max_features': 0.9926646562079212}. Best is trial 52 with value: 0.8098214582394094.[0m
[32m[I 2022-04-21 15:20:40,212][0m Trial 53 finished with value: 0.771421433167667 and parameters: {'splitter': 'best', 'min_samples_split': 0.2928723956606953, 'min_samples_leaf': 0.03618100307621905, 'min_weight_fraction_leaf': 0.10882072199172528, 'max_features': 0.8738001447821155}. Best is trial 52 with value: 0.8098214582394094.[0m
[32m[I 2022-04-21 15:22:25,328][0m Trial 54 finished with value: 0.7234296998593567 and parameters: {'splitter': 'best', 'min_samples_split': 0.36290283596447037, 'min_samples_leaf': 0.0330415337247556, 'min_weight_fraction_leaf': 0.18177137099781723, 'max_features': 0.9439239701978588}. Best is trial 52 with value: 0.8098214582394094.[0m
