[32m[I 2022-05-19 23:11:02,587][0m Trial 989 finished with value: 0.7833577194449071 and parameters: {'loss': 'coxph', 'learning_rate': 0.09946540098045342, 'n_estimators': 229, 'criterion': 'friedman_mse', 'min_samples_split': 3, 'min_samples_leaf': 3, 'min_weight_fraction_leaf': 0.04215770571684421, 'min_impurity_decrease': 0.4322666912910525, 'max_features': 0.5634261086317734, 'subsample': 0.22773036310420716, 'dropout_rate': 0.018374230915662235, 'ccp_alpha': 0.10135323417393055}. Best is trial 899 with value: 0.8627512492330924.[0m
[32m[I 2022-05-19 23:20:14,395][0m Trial 990 finished with value: 0.5 and parameters: {'loss': 'coxph', 'learning_rate': 0.07916385484397635, 'n_estimators': 234, 'criterion': 'squared_error', 'min_samples_split': 3, 'min_samples_leaf': 3, 'min_weight_fraction_leaf': 0.05147626954449112, 'min_impurity_decrease': 0.4823117271513123, 'max_features': 0.5683761309747796, 'subsample': 0.24503955271212768, 'dropout_rate': 0.00036988697686490477, 'ccp_alpha': 0.24531958406294238}. Best is trial 899 with value: 0.8627512492330924.[0m
[32m[I 2022-05-19 23:29:09,582][0m Trial 991 finished with value: 0.7857846313848252 and parameters: {'loss': 'coxph', 'learning_rate': 0.07960052739695783, 'n_estimators': 221, 'criterion': 'friedman_mse', 'min_samples_split': 3, 'min_samples_leaf': 3, 'min_weight_fraction_leaf': 0.05332368950229258, 'min_impurity_decrease': 0.44850202332799977, 'max_features': 0.5787606256207667, 'subsample': 0.22556205909203259, 'dropout_rate': 0.03538386983957795, 'ccp_alpha': 0.09501462592782194}. Best is trial 899 with value: 0.8627512492330924.[0m
[32m[I 2022-05-19 23:37:11,520][0m Trial 992 finished with value: 0.5 and parameters: {'loss': 'coxph', 'learning_rate': 0.08100753287098311, 'n_estimators': 208, 'criterion': 'friedman_mse', 'min_samples_split': 3, 'min_samples_leaf': 3, 'min_weight_fraction_leaf': 0.045345092820208474, 'min_impurity_decrease': 0.46305557719271273, 'max_features': 0.5569655463068105, 'subsample': 0.2571406068014892, 'dropout_rate': 0.000994094875914325, 'ccp_alpha': 0.3817907966784265}. Best is trial 899 with value: 0.8627512492330924.[0m
[32m[I 2022-05-19 23:45:49,321][0m Trial 993 finished with value: 0.7625959552947382 and parameters: {'loss': 'coxph', 'learning_rate': 0.09786142822569699, 'n_estimators': 214, 'criterion': 'friedman_mse', 'min_samples_split': 3, 'min_samples_leaf': 3, 'min_weight_fraction_leaf': 0.0557098496164418, 'min_impurity_decrease': 0.474455208393173, 'max_features': 0.573992626796928, 'subsample': 0.21947529910453772, 'dropout_rate': 0.00017634138736570895, 'ccp_alpha': 0.1841129111530409}. Best is trial 899 with value: 0.8627512492330924.[0m
[32m[I 2022-05-19 23:54:49,988][0m Trial 994 finished with value: 0.8015314284439656 and parameters: {'loss': 'coxph', 'learning_rate': 0.06663955984916628, 'n_estimators': 218, 'criterion': 'friedman_mse', 'min_samples_split': 3, 'min_samples_leaf': 3, 'min_weight_fraction_leaf': 0.04136160195591103, 'min_impurity_decrease': 0.42372659028919457, 'max_features': 0.55099645464096, 'subsample': 0.20100635335810585, 'dropout_rate': 0.029666692471568244, 'ccp_alpha': 0.0935458206002313}. Best is trial 899 with value: 0.8627512492330924.[0m
[32m[I 2022-05-20 00:03:00,098][0m Trial 995 finished with value: 0.7626221933816584 and parameters: {'loss': 'coxph', 'learning_rate': 0.0791562162334981, 'n_estimators': 203, 'criterion': 'friedman_mse', 'min_samples_split': 3, 'min_samples_leaf': 3, 'min_weight_fraction_leaf': 0.035055862953219094, 'min_impurity_decrease': 0.4823714114974217, 'max_features': 0.5813492231352224, 'subsample': 0.21955639523947013, 'dropout_rate': 0.018144301817894583, 'ccp_alpha': 0.17169791671229484}. Best is trial 899 with value: 0.8627512492330924.[0m
[32m[I 2022-05-20 00:12:17,106][0m Trial 996 finished with value: 0.8003439047571799 and parameters: {'loss': 'coxph', 'learning_rate': 0.062085472367148224, 'n_estimators': 225, 'criterion': 'friedman_mse', 'min_samples_split': 3, 'min_samples_leaf': 3, 'min_weight_fraction_leaf': 0.05416238801781891, 'min_impurity_decrease': 0.4489543738864777, 'max_features': 0.557115480536532, 'subsample': 0.20281543823866752, 'dropout_rate': 0.05225827517533746, 'ccp_alpha': 0.09705765555760634}. Best is trial 899 with value: 0.8627512492330924.[0m
[32m[I 2022-05-20 00:18:07,134][0m Trial 997 finished with value: 0.5 and parameters: {'loss': 'coxph', 'learning_rate': 0.09846260920466526, 'n_estimators': 146, 'criterion': 'friedman_mse', 'min_samples_split': 3, 'min_samples_leaf': 3, 'min_weight_fraction_leaf': 0.03905818858334854, 'min_impurity_decrease': 0.5030387760686146, 'max_features': 0.5873013412635705, 'subsample': 0.2028204383445688, 'dropout_rate': 0.0318025475042465, 'ccp_alpha': 1.278485084289494}. Best is trial 899 with value: 0.8627512492330924.[0m
[32m[I 2022-05-20 00:25:59,917][0m Trial 998 finished with value: 0.5 and parameters: {'loss': 'coxph', 'learning_rate': 0.06980202967276695, 'n_estimators': 200, 'criterion': 'friedman_mse', 'min_samples_split': 3, 'min_samples_leaf': 3, 'min_weight_fraction_leaf': 0.04694316012171818, 'min_impurity_decrease': 0.4028706730699911, 'max_features': 0.6601131389632782, 'subsample': 0.2341903386612012, 'dropout_rate': 0.02088621947554185, 'ccp_alpha': 0.5434895422731963}. Best is trial 899 with value: 0.8627512492330924.[0m
[32m[I 2022-05-20 00:34:54,609][0m Trial 999 finished with value: 0.8569335657274273 and parameters: {'loss': 'coxph', 'learning_rate': 0.05309918433782179, 'n_estimators': 215, 'criterion': 'friedman_mse', 'min_samples_split': 3, 'min_samples_leaf': 3, 'min_weight_fraction_leaf': 0.03450358282838717, 'min_impurity_decrease': 0.469383654223705, 'max_features': 0.6341388013305612, 'subsample': 0.2101635286389858, 'dropout_rate': 0.05491763241749725, 'ccp_alpha': 0.004803237626665462}. Best is trial 899 with value: 0.8627512492330924.[0m
BoostingSurvival
Running Optimizer normaly
{'loss': 'coxph', 'learning_rate': 0.09450938081019804, 'n_estimators': 152, 'criterion': 'friedman_mse', 'min_samples_split': 3, 'min_samples_leaf': 3, 'min_weight_fraction_leaf': 0.01641918596620047, 'min_impurity_decrease': 0.6059208066615676, 'max_features': 0.6360435181524643, 'subsample': 0.1099890912801106, 'dropout_rate': 0.00042444183152235, 'ccp_alpha': 0.0018042303936572587, 'UnoC': 0.8627512492330924}
