[32m[I 2022-05-07 11:43:54,210][0m Trial 100 finished with value: 0.6947281500587387 and parameters: {'loss': 'coxph', 'learning_rate': 4.7497269243814855e-05, 'n_estimators': 927, 'criterion': 'friedman_mse', 'min_samples_split': 10, 'min_samples_leaf': 3, 'min_weight_fraction_leaf': 0.49010733083643254, 'min_impurity_decrease': 0.6305563649943561, 'max_features': 0.523737542718497, 'subsample': 0.8627720979762195, 'dropout_rate': 0.001350193416320953, 'ccp_alpha': 0.14171184047121177}. Best is trial 66 with value: 0.7386449248380516.[0m
[32m[I 2022-05-07 12:15:17,297][0m Trial 101 finished with value: 0.6949753977621199 and parameters: {'loss': 'coxph', 'learning_rate': 0.000249421534673431, 'n_estimators': 946, 'criterion': 'friedman_mse', 'min_samples_split': 10, 'min_samples_leaf': 3, 'min_weight_fraction_leaf': 0.46814299292002987, 'min_impurity_decrease': 0.6033133293235801, 'max_features': 0.5883151772775624, 'subsample': 0.8522693803014486, 'dropout_rate': 0.9104879853497146, 'ccp_alpha': 0.08315075820388959}. Best is trial 66 with value: 0.7386449248380516.[0m
[32m[I 2022-05-07 12:44:42,831][0m Trial 102 finished with value: 0.5 and parameters: {'loss': 'coxph', 'learning_rate': 0.00011528967442329355, 'n_estimators': 908, 'criterion': 'friedman_mse', 'min_samples_split': 10, 'min_samples_leaf': 3, 'min_weight_fraction_leaf': 0.46644574970182207, 'min_impurity_decrease': 0.6641976654735356, 'max_features': 0.5005672563140101, 'subsample': 0.8500926537406276, 'dropout_rate': 0.9587021909088825, 'ccp_alpha': 0.40328270201918376}. Best is trial 66 with value: 0.7386449248380516.[0m
[32m[I 2022-05-07 13:17:44,798][0m Trial 103 finished with value: 0.7234171480109823 and parameters: {'loss': 'coxph', 'learning_rate': 4.5863396078126315e-05, 'n_estimators': 989, 'criterion': 'friedman_mse', 'min_samples_split': 10, 'min_samples_leaf': 3, 'min_weight_fraction_leaf': 0.48865996569074793, 'min_impurity_decrease': 0.41090993503292794, 'max_features': 0.5872951799817194, 'subsample': 0.8510335093240803, 'dropout_rate': 0.9066166000476918, 'ccp_alpha': 0.004212772302923884}. Best is trial 66 with value: 0.7386449248380516.[0m
[32m[I 2022-05-07 13:52:32,022][0m Trial 104 finished with value: 0.6921346557819299 and parameters: {'loss': 'coxph', 'learning_rate': 4.925407335583884e-05, 'n_estimators': 971, 'criterion': 'friedman_mse', 'min_samples_split': 10, 'min_samples_leaf': 3, 'min_weight_fraction_leaf': 0.4914310347240568, 'min_impurity_decrease': 0.3937410721054657, 'max_features': 0.5840669010119999, 'subsample': 0.9662145857788683, 'dropout_rate': 0.9162028152274813, 'ccp_alpha': 0.08316647673068721}. Best is trial 66 with value: 0.7386449248380516.[0m
[32m[I 2022-05-07 14:27:27,213][0m Trial 105 finished with value: 0.6939556647615982 and parameters: {'loss': 'coxph', 'learning_rate': 2.9957696040293007e-05, 'n_estimators': 977, 'criterion': 'friedman_mse', 'min_samples_split': 10, 'min_samples_leaf': 3, 'min_weight_fraction_leaf': 0.48910074250024266, 'min_impurity_decrease': 0.6278564954284744, 'max_features': 0.5846538829249461, 'subsample': 0.9597951873621168, 'dropout_rate': 0.9088066654651921, 'ccp_alpha': 0.101548454278842}. Best is trial 66 with value: 0.7386449248380516.[0m
[32m[I 2022-05-07 15:02:58,088][0m Trial 106 finished with value: 0.6923741297528067 and parameters: {'loss': 'coxph', 'learning_rate': 4.445315066947616e-05, 'n_estimators': 967, 'criterion': 'friedman_mse', 'min_samples_split': 10, 'min_samples_leaf': 3, 'min_weight_fraction_leaf': 0.4911832656148397, 'min_impurity_decrease': 0.6320231235535485, 'max_features': 0.5865645838985061, 'subsample': 0.9738725527792277, 'dropout_rate': 0.8626238192751596, 'ccp_alpha': 0.08273846489694081}. Best is trial 66 with value: 0.7386449248380516.[0m
[32m[I 2022-05-07 15:39:02,777][0m Trial 107 finished with value: 0.6939556647615982 and parameters: {'loss': 'coxph', 'learning_rate': 4.9006848145694144e-05, 'n_estimators': 994, 'criterion': 'friedman_mse', 'min_samples_split': 10, 'min_samples_leaf': 3, 'min_weight_fraction_leaf': 0.48985506584122473, 'min_impurity_decrease': 0.6190177809858574, 'max_features': 0.5869018091009667, 'subsample': 0.9549832843991208, 'dropout_rate': 0.8620948618281924, 'ccp_alpha': 0.06764396844916931}. Best is trial 66 with value: 0.7386449248380516.[0m
/media/san2_ssd/data/Workdir/survival/venv/lib/python3.8/site-packages/sksurv/ensemble/boosting.py:955: RuntimeWarning: divide by zero encountered in log
  time = numpy.log(time)
/media/san2_ssd/data/Workdir/survival/venv/lib/python3.8/site-packages/sksurv/ensemble/boosting.py:955: RuntimeWarning: divide by zero encountered in log
  time = numpy.log(time)
/media/san2_ssd/data/Workdir/survival/venv/lib/python3.8/site-packages/sksurv/ensemble/boosting.py:955: RuntimeWarning: divide by zero encountered in log
  time = numpy.log(time)
/media/san2_ssd/data/Workdir/survival/venv/lib/python3.8/site-packages/sksurv/ensemble/boosting.py:955: RuntimeWarning: divide by zero encountered in log
  time = numpy.log(time)
/media/san2_ssd/data/Workdir/survival/venv/lib/python3.8/site-packages/sksurv/ensemble/boosting.py:955: RuntimeWarning: divide by zero encountered in log
  time = numpy.log(time)
[32m[I 2022-05-07 15:39:02,826][0m Trial 108 finished with value: -1.0 and parameters: {'loss': 'squared', 'learning_rate': 4.6631820616949645e-05, 'n_estimators': 902, 'criterion': 'friedman_mse', 'min_samples_split': 10, 'min_samples_leaf': 3, 'min_weight_fraction_leaf': 0.4720610675341278, 'min_impurity_decrease': 0.6340571447193142, 'max_features': 0.6093580625294865, 'subsample': 0.9153145422150427, 'dropout_rate': 0.8536311758096204, 'ccp_alpha': 0.09818483249191427}. Best is trial 66 with value: 0.7386449248380516.[0m
[32m[I 2022-05-07 16:14:34,466][0m Trial 109 finished with value: 0.5732881461781723 and parameters: {'loss': 'coxph', 'learning_rate': 8.012376173129029e-05, 'n_estimators': 987, 'criterion': 'friedman_mse', 'min_samples_split': 10, 'min_samples_leaf': 3, 'min_weight_fraction_leaf': 0.4999342780916973, 'min_impurity_decrease': 0.6072685445231828, 'max_features': 0.5717430993947265, 'subsample': 0.9575703587956083, 'dropout_rate': 0.8686140748417734, 'ccp_alpha': 0.03156825807924187}. Best is trial 66 with value: 0.7386449248380516.[0m
[32m[I 2022-05-07 16:45:04,108][0m Trial 110 finished with value: 0.5 and parameters: {'loss': 'coxph', 'learning_rate': 0.0002533465888209056, 'n_estimators': 865, 'criterion': 'friedman_mse', 'min_samples_split': 10, 'min_samples_leaf': 3, 'min_weight_fraction_leaf': 0.44474226315765925, 'min_impurity_decrease': 0.5412276882141462, 'max_features': 0.530638731400649, 'subsample': 0.952562266034077, 'dropout_rate': 0.904289342461178, 'ccp_alpha': 0.45287895383648163}. Best is trial 66 with value: 0.7386449248380516.[0m
[32m[I 2022-05-07 17:19:26,622][0m Trial 111 finished with value: 0.6949753977621199 and parameters: {'loss': 'coxph', 'learning_rate': 2.7899322706814645e-05, 'n_estimators': 993, 'criterion': 'friedman_mse', 'min_samples_split': 10, 'min_samples_leaf': 3, 'min_weight_fraction_leaf': 0.4701102700966501, 'min_impurity_decrease': 0.5876252510309928, 'max_features': 0.5854835980023986, 'subsample': 0.917536561121741, 'dropout_rate': 0.9124846367844709, 'ccp_alpha': 0.1263648452485074}. Best is trial 66 with value: 0.7386449248380516.[0m
[32m[I 2022-05-07 17:52:31,631][0m Trial 112 finished with value: 0.5 and parameters: {'loss': 'coxph', 'learning_rate': 2.881116335163427e-05, 'n_estimators': 939, 'criterion': 'friedman_mse', 'min_samples_split': 10, 'min_samples_leaf': 2, 'min_weight_fraction_leaf': 0.4890370377549794, 'min_impurity_decrease': 0.6319991606965418, 'max_features': 0.5837476325893224, 'subsample': 0.9338346250836563, 'dropout_rate': 0.8732525645291676, 'ccp_alpha': 0.3304369567319081}. Best is trial 66 with value: 0.7386449248380516.[0m
[32m[I 2022-05-07 18:19:44,959][0m Trial 113 finished with value: 0.7285355426529809 and parameters: {'loss': 'coxph', 'learning_rate': 4.344626365347655e-05, 'n_estimators': 794, 'criterion': 'friedman_mse', 'min_samples_split': 10, 'min_samples_leaf': 3, 'min_weight_fraction_leaf': 0.46695882835417213, 'min_impurity_decrease': 0.5879126724131293, 'max_features': 0.6389950863328294, 'subsample': 0.9117885496538332, 'dropout_rate': 0.9111941740051434, 'ccp_alpha': 0.004220653705487824}. Best is trial 66 with value: 0.7386449248380516.[0m
[32m[I 2022-05-07 18:44:46,516][0m Trial 114 finished with value: 0.6949753977621199 and parameters: {'loss': 'coxph', 'learning_rate': 1.5682788990565044e-05, 'n_estimators': 788, 'criterion': 'friedman_mse', 'min_samples_split': 10, 'min_samples_leaf': 3, 'min_weight_fraction_leaf': 0.46739700422947306, 'min_impurity_decrease': 0.5929214248872312, 'max_features': 0.6398008605404117, 'subsample': 0.8098803483347093, 'dropout_rate': 0.9590081007986961, 'ccp_alpha': 0.1250927612859191}. Best is trial 66 with value: 0.7386449248380516.[0m
[32m[I 2022-05-07 19:11:51,543][0m Trial 115 finished with value: 0.7283188603678152 and parameters: {'loss': 'coxph', 'learning_rate': 1.468350910995542e-05, 'n_estimators': 791, 'criterion': 'friedman_mse', 'min_samples_split': 10, 'min_samples_leaf': 2, 'min_weight_fraction_leaf': 0.4706573053530186, 'min_impurity_decrease': 0.5849441154596575, 'max_features': 0.6351122055450146, 'subsample': 0.9088092923828069, 'dropout_rate': 0.9094134904551665, 'ccp_alpha': 0.005783820997090197}. Best is trial 66 with value: 0.7386449248380516.[0m
[32m[I 2022-05-07 19:36:38,814][0m Trial 116 finished with value: 0.5 and parameters: {'loss': 'coxph', 'learning_rate': 1.3420462565470153e-05, 'n_estimators': 781, 'criterion': 'friedman_mse', 'min_samples_split': 10, 'min_samples_leaf': 2, 'min_weight_fraction_leaf': 0.47335429341080787, 'min_impurity_decrease': 0.5908109452828018, 'max_features': 0.6382104436107551, 'subsample': 0.8139381837971198, 'dropout_rate': 0.9632191880989687, 'ccp_alpha': 0.3255029261028608}. Best is trial 66 with value: 0.7386449248380516.[0m
[32m[I 2022-05-07 20:01:55,385][0m Trial 117 finished with value: 0.6949753977621199 and parameters: {'loss': 'coxph', 'learning_rate': 8.417659196041178e-06, 'n_estimators': 784, 'criterion': 'friedman_mse', 'min_samples_split': 10, 'min_samples_leaf': 2, 'min_weight_fraction_leaf': 0.4680429903297438, 'min_impurity_decrease': 0.5888069096767077, 'max_features': 0.6179627633792055, 'subsample': 0.8571272066509067, 'dropout_rate': 0.9810440929729929, 'ccp_alpha': 0.16823208824289898}. Best is trial 66 with value: 0.7386449248380516.[0m
[32m[I 2022-05-07 20:27:55,525][0m Trial 118 finished with value: 0.5 and parameters: {'loss': 'coxph', 'learning_rate': 5.772127929800174e-06, 'n_estimators': 792, 'criterion': 'friedman_mse', 'min_samples_split': 10, 'min_samples_leaf': 2, 'min_weight_fraction_leaf': 0.46866278041312004, 'min_impurity_decrease': 0.5536534806126945, 'max_features': 0.6197475271755163, 'subsample': 0.9101796504486812, 'dropout_rate': 0.9959710957941524, 'ccp_alpha': 0.44859675454104736}. Best is trial 66 with value: 0.7386449248380516.[0m
[32m[I 2022-05-07 20:55:59,567][0m Trial 119 finished with value: 0.729228750375561 and parameters: {'loss': 'coxph', 'learning_rate': 1.6554484648811274e-05, 'n_estimators': 866, 'criterion': 'friedman_mse', 'min_samples_split': 9, 'min_samples_leaf': 2, 'min_weight_fraction_leaf': 0.4444056756824742, 'min_impurity_decrease': 0.5839735946200132, 'max_features': 0.6481582908482345, 'subsample': 0.8395267382879892, 'dropout_rate': 0.954260305229218, 'ccp_alpha': 0.00538352984189111}. Best is trial 66 with value: 0.7386449248380516.[0m
[32m[I 2022-05-07 21:23:49,555][0m Trial 120 finished with value: 0.7295362528619932 and parameters: {'loss': 'coxph', 'learning_rate': 8.794917378678808e-06, 'n_estimators': 870, 'criterion': 'friedman_mse', 'min_samples_split': 10, 'min_samples_leaf': 2, 'min_weight_fraction_leaf': 0.43842421111232766, 'min_impurity_decrease': 0.528453403409415, 'max_features': 0.6450430734808301, 'subsample': 0.8062473944156482, 'dropout_rate': 0.9478128558958862, 'ccp_alpha': 0.0050247584214822925}. Best is trial 66 with value: 0.7386449248380516.[0m
[32m[I 2022-05-07 21:51:25,947][0m Trial 121 finished with value: 0.728617390462394 and parameters: {'loss': 'coxph', 'learning_rate': 9.088626056013858e-06, 'n_estimators': 867, 'criterion': 'friedman_mse', 'min_samples_split': 10, 'min_samples_leaf': 2, 'min_weight_fraction_leaf': 0.45504493977553434, 'min_impurity_decrease': 0.5301968137745751, 'max_features': 0.6450157890515014, 'subsample': 0.8008360973173648, 'dropout_rate': 0.9520531944270912, 'ccp_alpha': 0.0014891391466209727}. Best is trial 66 with value: 0.7386449248380516.[0m
[32m[I 2022-05-07 22:19:29,880][0m Trial 122 finished with value: 0.6957116657146543 and parameters: {'loss': 'coxph', 'learning_rate': 8.953109066725278e-06, 'n_estimators': 873, 'criterion': 'friedman_mse', 'min_samples_split': 9, 'min_samples_leaf': 1, 'min_weight_fraction_leaf': 0.440328402142943, 'min_impurity_decrease': 0.527897428428765, 'max_features': 0.6937321889721464, 'subsample': 0.845833423083267, 'dropout_rate': 0.9790933035144669, 'ccp_alpha': 0.03354695499146072}. Best is trial 66 with value: 0.7386449248380516.[0m
[32m[I 2022-05-07 22:47:16,024][0m Trial 123 finished with value: 0.7300030090921789 and parameters: {'loss': 'coxph', 'learning_rate': 1.7168666012920475e-05, 'n_estimators': 882, 'criterion': 'friedman_mse', 'min_samples_split': 9, 'min_samples_leaf': 1, 'min_weight_fraction_leaf': 0.4392434044610438, 'min_impurity_decrease': 0.5222151792353872, 'max_features': 0.6927420070481523, 'subsample': 0.7723092889922575, 'dropout_rate': 0.956185867229627, 'ccp_alpha': 0.005388996628186499}. Best is trial 66 with value: 0.7386449248380516.[0m
[32m[I 2022-05-07 23:14:59,553][0m Trial 124 finished with value: 0.7178343677862291 and parameters: {'loss': 'coxph', 'learning_rate': 3.283468001251044e-06, 'n_estimators': 858, 'criterion': 'friedman_mse', 'min_samples_split': 9, 'min_samples_leaf': 1, 'min_weight_fraction_leaf': 0.43901890550072603, 'min_impurity_decrease': 0.5283146106997395, 'max_features': 0.6952806973662614, 'subsample': 0.7784142189019472, 'dropout_rate': 0.8945560942990393, 'ccp_alpha': 0.01696763326787011}. Best is trial 66 with value: 0.7386449248380516.[0m
[32m[I 2022-05-07 23:42:12,722][0m Trial 125 finished with value: 0.7263108932778638 and parameters: {'loss': 'coxph', 'learning_rate': 3.0090326721178145e-06, 'n_estimators': 873, 'criterion': 'friedman_mse', 'min_samples_split': 9, 'min_samples_leaf': 1, 'min_weight_fraction_leaf': 0.43992156618964595, 'min_impurity_decrease': 0.5315526914481741, 'max_features': 0.6908927628538869, 'subsample': 0.7737246090602686, 'dropout_rate': 0.9777491834125838, 'ccp_alpha': 0.00814516471290444}. Best is trial 66 with value: 0.7386449248380516.[0m
[32m[I 2022-05-08 00:08:25,770][0m Trial 126 finished with value: 0.7459781277037708 and parameters: {'loss': 'coxph', 'learning_rate': 2.672336109405596e-06, 'n_estimators': 858, 'criterion': 'friedman_mse', 'min_samples_split': 9, 'min_samples_leaf': 1, 'min_weight_fraction_leaf': 0.4045130286820286, 'min_impurity_decrease': 0.5260690892410762, 'max_features': 0.6904446814227635, 'subsample': 0.6909773345872231, 'dropout_rate': 0.9834186721135093, 'ccp_alpha': 0.004551535990379265}. Best is trial 126 with value: 0.7459781277037708.[0m
/media/san2_ssd/data/Workdir/survival/venv/lib/python3.8/site-packages/sksurv/ensemble/boosting.py:955: RuntimeWarning: divide by zero encountered in log
  time = numpy.log(time)
/media/san2_ssd/data/Workdir/survival/venv/lib/python3.8/site-packages/sksurv/ensemble/boosting.py:955: RuntimeWarning: divide by zero encountered in log
  time = numpy.log(time)
/media/san2_ssd/data/Workdir/survival/venv/lib/python3.8/site-packages/sksurv/ensemble/boosting.py:955: RuntimeWarning: divide by zero encountered in log
  time = numpy.log(time)
/media/san2_ssd/data/Workdir/survival/venv/lib/python3.8/site-packages/sksurv/ensemble/boosting.py:955: RuntimeWarning: divide by zero encountered in log
  time = numpy.log(time)
/media/san2_ssd/data/Workdir/survival/venv/lib/python3.8/site-packages/sksurv/ensemble/boosting.py:955: RuntimeWarning: divide by zero encountered in log
  time = numpy.log(time)
[32m[I 2022-05-08 00:08:25,817][0m Trial 127 finished with value: -1.0 and parameters: {'loss': 'squared', 'learning_rate': 2.1599722899977284e-06, 'n_estimators': 871, 'criterion': 'friedman_mse', 'min_samples_split': 9, 'min_samples_leaf': 1, 'min_weight_fraction_leaf': 0.41639692242258586, 'min_impurity_decrease': 0.5289446041495248, 'max_features': 0.69533671764633, 'subsample': 0.6987022209586685, 'dropout_rate': 0.9975197900786053, 'ccp_alpha': 0.28660209419746413}. Best is trial 126 with value: 0.7459781277037708.[0m
[32m[I 2022-05-08 00:34:29,955][0m Trial 128 finished with value: 0.7175515286856645 and parameters: {'loss': 'coxph', 'learning_rate': 1.4658745708754017e-06, 'n_estimators': 822, 'criterion': 'friedman_mse', 'min_samples_split': 9, 'min_samples_leaf': 1, 'min_weight_fraction_leaf': 0.4403469351271028, 'min_impurity_decrease': 0.4952719286301811, 'max_features': 0.7387474628855352, 'subsample': 0.7897436088474337, 'dropout_rate': 0.9507997039451452, 'ccp_alpha': 0.01242459152242285}. Best is trial 126 with value: 0.7459781277037708.[0m
[32m[I 2022-05-08 01:00:29,609][0m Trial 129 finished with value: 0.5 and parameters: {'loss': 'coxph', 'learning_rate': 1.3821421497544272e-06, 'n_estimators': 829, 'criterion': 'friedman_mse', 'min_samples_split': 9, 'min_samples_leaf': 1, 'min_weight_fraction_leaf': 0.44977489838381923, 'min_impurity_decrease': 0.497378315346008, 'max_features': 0.7411172601976311, 'subsample': 0.7660095320680489, 'dropout_rate': 0.9497902641550287, 'ccp_alpha': 0.3436119704019776}. Best is trial 126 with value: 0.7459781277037708.[0m
[32m[I 2022-05-08 01:27:12,308][0m Trial 130 finished with value: 0.7466373356025244 and parameters: {'loss': 'coxph', 'learning_rate': 3.274559013079134e-06, 'n_estimators': 825, 'criterion': 'friedman_mse', 'min_samples_split': 9, 'min_samples_leaf': 1, 'min_weight_fraction_leaf': 0.4046260114970594, 'min_impurity_decrease': 0.5097106562468667, 'max_features': 0.6812890183682104, 'subsample': 0.7759924786641992, 'dropout_rate': 0.8833652287269848, 'ccp_alpha': 0.009730307433538404}. Best is trial 130 with value: 0.7466373356025244.[0m
[32m[I 2022-05-08 01:53:16,160][0m Trial 131 finished with value: 0.7462281808128257 and parameters: {'loss': 'coxph', 'learning_rate': 3.022872524715546e-06, 'n_estimators': 825, 'criterion': 'friedman_mse', 'min_samples_split': 9, 'min_samples_leaf': 1, 'min_weight_fraction_leaf': 0.4040086479864239, 'min_impurity_decrease': 0.4278553208053511, 'max_features': 0.6790639453798687, 'subsample': 0.7776894369753562, 'dropout_rate': 0.9480562549233666, 'ccp_alpha': 0.004855383930219346}. Best is trial 130 with value: 0.7466373356025244.[0m
[32m[I 2022-05-08 02:14:48,455][0m Trial 132 finished with value: 0.7256466683052263 and parameters: {'loss': 'coxph', 'learning_rate': 3.43576318619107e-06, 'n_estimators': 671, 'criterion': 'friedman_mse', 'min_samples_split': 9, 'min_samples_leaf': 1, 'min_weight_fraction_leaf': 0.403284871886511, 'min_impurity_decrease': 0.42295929520481346, 'max_features': 0.6801570202050803, 'subsample': 0.788398372759667, 'dropout_rate': 0.8858542263641332, 'ccp_alpha': 0.25647065665199126}. Best is trial 130 with value: 0.7466373356025244.[0m
[32m[I 2022-05-08 02:37:01,338][0m Trial 133 finished with value: 0.7284517141754614 and parameters: {'loss': 'coxph', 'learning_rate': 3.093422393946866e-06, 'n_estimators': 696, 'criterion': 'friedman_mse', 'min_samples_split': 9, 'min_samples_leaf': 1, 'min_weight_fraction_leaf': 0.40118318014805227, 'min_impurity_decrease': 0.42777229313346843, 'max_features': 0.6782823816181407, 'subsample': 0.7676228870885992, 'dropout_rate': 0.8874022278756516, 'ccp_alpha': 0.21609911689428235}. Best is trial 130 with value: 0.7466373356025244.[0m
[32m[I 2022-05-08 02:58:55,950][0m Trial 134 finished with value: 0.722387956897169 and parameters: {'loss': 'coxph', 'learning_rate': 2.997387524974745e-06, 'n_estimators': 695, 'criterion': 'friedman_mse', 'min_samples_split': 9, 'min_samples_leaf': 1, 'min_weight_fraction_leaf': 0.40954385664159443, 'min_impurity_decrease': 0.3951264203751813, 'max_features': 0.6774577793780305, 'subsample': 0.7140512507949807, 'dropout_rate': 0.8890285712385118, 'ccp_alpha': 0.2343880084108394}. Best is trial 130 with value: 0.7466373356025244.[0m
[32m[I 2022-05-08 03:21:51,373][0m Trial 135 finished with value: 0.7295841244148488 and parameters: {'loss': 'coxph', 'learning_rate': 4.9881448736469275e-06, 'n_estimators': 738, 'criterion': 'friedman_mse', 'min_samples_split': 9, 'min_samples_leaf': 1, 'min_weight_fraction_leaf': 0.39856998068021077, 'min_impurity_decrease': 0.44539880951555566, 'max_features': 0.6556381978698709, 'subsample': 0.7615007853858905, 'dropout_rate': 0.9677957210862548, 'ccp_alpha': 0.2813992975002901}. Best is trial 130 with value: 0.7466373356025244.[0m
[32m[I 2022-05-08 03:42:35,207][0m Trial 136 finished with value: 0.5 and parameters: {'loss': 'coxph', 'learning_rate': 4.356582026642332e-06, 'n_estimators': 670, 'criterion': 'friedman_mse', 'min_samples_split': 9, 'min_samples_leaf': 1, 'min_weight_fraction_leaf': 0.4028851458628008, 'min_impurity_decrease': 0.43584330918894876, 'max_features': 0.7137017678671366, 'subsample': 0.7531047655776448, 'dropout_rate': 0.9701594707421191, 'ccp_alpha': 0.41901099258429303}. Best is trial 130 with value: 0.7466373356025244.[0m
