[32m[I 2022-05-19 10:24:28,217][0m Trial 878 finished with value: 0.7632689188372149 and parameters: {'loss': 'coxph', 'learning_rate': 0.030891550205479304, 'n_estimators': 166, 'criterion': 'friedman_mse', 'min_samples_split': 2, 'min_samples_leaf': 4, 'min_weight_fraction_leaf': 0.03799891714486873, 'min_impurity_decrease': 0.5534615547993614, 'max_features': 0.4330698934725504, 'subsample': 0.10420541545953142, 'dropout_rate': 0.0006658439576411972, 'ccp_alpha': 0.18073195289081828}. Best is trial 759 with value: 0.8618735483942033.[0m
[32m[I 2022-05-19 10:31:53,487][0m Trial 879 finished with value: 0.8548290885888793 and parameters: {'loss': 'coxph', 'learning_rate': 0.043263352642312854, 'n_estimators': 159, 'criterion': 'friedman_mse', 'min_samples_split': 2, 'min_samples_leaf': 4, 'min_weight_fraction_leaf': 0.04750125986247762, 'min_impurity_decrease': 0.6197235636912467, 'max_features': 0.5042530469118499, 'subsample': 0.07776668637946704, 'dropout_rate': 0.03322235080386688, 'ccp_alpha': 0.0037819280154572366}. Best is trial 759 with value: 0.8618735483942033.[0m
[32m[I 2022-05-19 10:38:13,994][0m Trial 880 finished with value: 0.5 and parameters: {'loss': 'coxph', 'learning_rate': 0.03439697616791946, 'n_estimators': 144, 'criterion': 'friedman_mse', 'min_samples_split': 2, 'min_samples_leaf': 4, 'min_weight_fraction_leaf': 0.03101384105516907, 'min_impurity_decrease': 0.5906011540454025, 'max_features': 0.47000862882970557, 'subsample': 0.11323455293943163, 'dropout_rate': 0.0011793650217149267, 'ccp_alpha': 4.480596917573456}. Best is trial 759 with value: 0.8618735483942033.[0m
[32m[I 2022-05-19 10:45:02,951][0m Trial 881 finished with value: 0.5 and parameters: {'loss': 'coxph', 'learning_rate': 0.08372994151802637, 'n_estimators': 152, 'criterion': 'squared_error', 'min_samples_split': 2, 'min_samples_leaf': 4, 'min_weight_fraction_leaf': 0.04985993302258715, 'min_impurity_decrease': 0.6483029987532679, 'max_features': 0.482260779529117, 'subsample': 0.09645546381230452, 'dropout_rate': 4.530596052880904e-05, 'ccp_alpha': 2.294218640630993}. Best is trial 759 with value: 0.8618735483942033.[0m
[32m[I 2022-05-19 10:51:52,522][0m Trial 882 finished with value: 0.7980953469940401 and parameters: {'loss': 'coxph', 'learning_rate': 0.04492370289572267, 'n_estimators': 155, 'criterion': 'friedman_mse', 'min_samples_split': 2, 'min_samples_leaf': 4, 'min_weight_fraction_leaf': 0.023942799065817096, 'min_impurity_decrease': 0.6957339586304128, 'max_features': 0.5160154054968387, 'subsample': 0.11972197721532107, 'dropout_rate': 0.032662486848819186, 'ccp_alpha': 0.09240130292721471}. Best is trial 759 with value: 0.8618735483942033.[0m
[32m[I 2022-05-19 10:57:50,666][0m Trial 883 finished with value: 0.7494369960892269 and parameters: {'loss': 'coxph', 'learning_rate': 0.016705970200632622, 'n_estimators': 138, 'criterion': 'friedman_mse', 'min_samples_split': 2, 'min_samples_leaf': 4, 'min_weight_fraction_leaf': 0.03668589439755268, 'min_impurity_decrease': 0.6199630576247809, 'max_features': 0.5278404009860257, 'subsample': 0.12948126039162206, 'dropout_rate': 0.019476632833619438, 'ccp_alpha': 0.26168369854543233}. Best is trial 759 with value: 0.8618735483942033.[0m
[32m[I 2022-05-19 11:04:34,301][0m Trial 884 finished with value: 0.855148886635865 and parameters: {'loss': 'coxph', 'learning_rate': 0.061417258076235194, 'n_estimators': 147, 'criterion': 'friedman_mse', 'min_samples_split': 2, 'min_samples_leaf': 4, 'min_weight_fraction_leaf': 0.028130672463156103, 'min_impurity_decrease': 0.5778187569055049, 'max_features': 0.45792816212804527, 'subsample': 0.09494834787244112, 'dropout_rate': 0.03674860474587467, 'ccp_alpha': 0.0026581941061343908}. Best is trial 759 with value: 0.8618735483942033.[0m
[32m[I 2022-05-19 11:11:00,925][0m Trial 885 finished with value: 0.7640511600505793 and parameters: {'loss': 'coxph', 'learning_rate': 0.029396739234228586, 'n_estimators': 140, 'criterion': 'friedman_mse', 'min_samples_split': 2, 'min_samples_leaf': 4, 'min_weight_fraction_leaf': 0.0492476937759337, 'min_impurity_decrease': 0.6392774021507542, 'max_features': 0.5426046922541398, 'subsample': 0.07856827872684391, 'dropout_rate': 0.01779774927911289, 'ccp_alpha': 0.16570310042658898}. Best is trial 759 with value: 0.8618735483942033.[0m
[32m[I 2022-05-19 11:18:05,220][0m Trial 886 finished with value: 0.7877394418893081 and parameters: {'loss': 'coxph', 'learning_rate': 0.022729842308830767, 'n_estimators': 159, 'criterion': 'friedman_mse', 'min_samples_split': 2, 'min_samples_leaf': 4, 'min_weight_fraction_leaf': 0.03768166660616577, 'min_impurity_decrease': 0.663298494171351, 'max_features': 0.6312581382628404, 'subsample': 0.11301960820560664, 'dropout_rate': 0.044523659334808785, 'ccp_alpha': 0.08920078517972878}. Best is trial 759 with value: 0.8618735483942033.[0m
/media/san2_ssd/data/Workdir/survival/venv/lib/python3.8/site-packages/sksurv/ensemble/boosting.py:955: RuntimeWarning: divide by zero encountered in log
  time = numpy.log(time)
/media/san2_ssd/data/Workdir/survival/venv/lib/python3.8/site-packages/sksurv/ensemble/boosting.py:955: RuntimeWarning: divide by zero encountered in log
  time = numpy.log(time)
/media/san2_ssd/data/Workdir/survival/venv/lib/python3.8/site-packages/sksurv/ensemble/boosting.py:955: RuntimeWarning: divide by zero encountered in log
  time = numpy.log(time)
/media/san2_ssd/data/Workdir/survival/venv/lib/python3.8/site-packages/sksurv/ensemble/boosting.py:955: RuntimeWarning: divide by zero encountered in log
  time = numpy.log(time)
/media/san2_ssd/data/Workdir/survival/venv/lib/python3.8/site-packages/sksurv/ensemble/boosting.py:955: RuntimeWarning: divide by zero encountered in log
  time = numpy.log(time)
[32m[I 2022-05-19 11:18:05,302][0m Trial 887 finished with value: -1.0 and parameters: {'loss': 'squared', 'learning_rate': 0.045920419901613746, 'n_estimators': 130, 'criterion': 'friedman_mse', 'min_samples_split': 3, 'min_samples_leaf': 4, 'min_weight_fraction_leaf': 0.018521615205564244, 'min_impurity_decrease': 0.6013852052291898, 'max_features': 0.5004384512294957, 'subsample': 0.13225939437926593, 'dropout_rate': 0.01818533694616001, 'ccp_alpha': 0.08722220949092153}. Best is trial 759 with value: 0.8618735483942033.[0m
[32m[I 2022-05-19 11:26:01,295][0m Trial 888 finished with value: 0.8592020400310549 and parameters: {'loss': 'coxph', 'learning_rate': 0.07008686009986036, 'n_estimators': 173, 'criterion': 'friedman_mse', 'min_samples_split': 3, 'min_samples_leaf': 3, 'min_weight_fraction_leaf': 0.02961854641592743, 'min_impurity_decrease': 0.6269380778013377, 'max_features': 0.5951411900264428, 'subsample': 0.10009366646073926, 'dropout_rate': 0.03314364950050673, 'ccp_alpha': 0.002007671888156285}. Best is trial 759 with value: 0.8618735483942033.[0m
[32m[I 2022-05-19 11:34:01,633][0m Trial 889 finished with value: 0.7392355003210432 and parameters: {'loss': 'coxph', 'learning_rate': 0.09453306198070259, 'n_estimators': 173, 'criterion': 'friedman_mse', 'min_samples_split': 3, 'min_samples_leaf': 3, 'min_weight_fraction_leaf': 0.05124657021397783, 'min_impurity_decrease': 0.6175867696272119, 'max_features': 0.6007137640888555, 'subsample': 0.07501986257952864, 'dropout_rate': 0.0223330272497093, 'ccp_alpha': 0.3694663501322265}. Best is trial 759 with value: 0.8618735483942033.[0m
[32m[I 2022-05-19 11:41:58,186][0m Trial 890 finished with value: 0.7578063219355121 and parameters: {'loss': 'coxph', 'learning_rate': 0.07235697015776503, 'n_estimators': 175, 'criterion': 'friedman_mse', 'min_samples_split': 2, 'min_samples_leaf': 3, 'min_weight_fraction_leaf': 0.03750195850069937, 'min_impurity_decrease': 0.5639922741499758, 'max_features': 0.5898205043531304, 'subsample': 0.0960701081877041, 'dropout_rate': 0.00035117923660674203, 'ccp_alpha': 0.22959117310659}. Best is trial 759 with value: 0.8618735483942033.[0m
[32m[I 2022-05-19 11:50:35,044][0m Trial 891 finished with value: 0.5 and parameters: {'loss': 'coxph', 'learning_rate': 0.0726188316338844, 'n_estimators': 187, 'criterion': 'friedman_mse', 'min_samples_split': 3, 'min_samples_leaf': 3, 'min_weight_fraction_leaf': 0.022127956632825803, 'min_impurity_decrease': 0.5976588181831585, 'max_features': 0.5558525600816224, 'subsample': 0.08089105254290718, 'dropout_rate': 0.05467477106691898, 'ccp_alpha': 3.0889922790608333}. Best is trial 759 with value: 0.8618735483942033.[0m
[32m[I 2022-05-19 11:58:09,185][0m Trial 892 finished with value: 0.7911791996414053 and parameters: {'loss': 'coxph', 'learning_rate': 0.03525562793422279, 'n_estimators': 168, 'criterion': 'friedman_mse', 'min_samples_split': 3, 'min_samples_leaf': 3, 'min_weight_fraction_leaf': 0.042365522136326106, 'min_impurity_decrease': 0.6281827957089828, 'max_features': 0.6109983010983401, 'subsample': 0.10599526844813814, 'dropout_rate': 0.019836104149314325, 'ccp_alpha': 0.09409475361735518}. Best is trial 759 with value: 0.8618735483942033.[0m
[32m[I 2022-05-19 12:05:32,550][0m Trial 893 finished with value: 0.7650737423518297 and parameters: {'loss': 'coxph', 'learning_rate': 0.0870945344855939, 'n_estimators': 164, 'criterion': 'friedman_mse', 'min_samples_split': 3, 'min_samples_leaf': 3, 'min_weight_fraction_leaf': 0.03195286724403115, 'min_impurity_decrease': 0.6754065477777905, 'max_features': 0.4884300337721183, 'subsample': 0.10070040054988932, 'dropout_rate': 0.0015743599020727889, 'ccp_alpha': 0.17542443554993947}. Best is trial 759 with value: 0.8618735483942033.[0m
[32m[I 2022-05-19 12:11:25,949][0m Trial 894 finished with value: 0.8587303449254395 and parameters: {'loss': 'coxph', 'learning_rate': 0.09950406633813501, 'n_estimators': 127, 'criterion': 'friedman_mse', 'min_samples_split': 3, 'min_samples_leaf': 3, 'min_weight_fraction_leaf': 0.013110482897777796, 'min_impurity_decrease': 0.5866803031681753, 'max_features': 0.5418223852704649, 'subsample': 0.07607126915435669, 'dropout_rate': 8.051272635268528e-05, 'ccp_alpha': 0.0022757785759858523}. Best is trial 759 with value: 0.8618735483942033.[0m
[32m[I 2022-05-19 12:20:29,072][0m Trial 895 finished with value: 0.765194246689999 and parameters: {'loss': 'coxph', 'learning_rate': 0.07294982350503673, 'n_estimators': 193, 'criterion': 'friedman_mse', 'min_samples_split': 3, 'min_samples_leaf': 3, 'min_weight_fraction_leaf': 0.010644539793616542, 'min_impurity_decrease': 0.5489451545143705, 'max_features': 0.5398466004215481, 'subsample': 0.07250549960887986, 'dropout_rate': 0.0007957141600709304, 'ccp_alpha': 0.16210731227068773}. Best is trial 759 with value: 0.8618735483942033.[0m
[32m[I 2022-05-19 12:28:33,845][0m Trial 896 finished with value: 0.802439056326963 and parameters: {'loss': 'coxph', 'learning_rate': 0.019333918718756216, 'n_estimators': 181, 'criterion': 'friedman_mse', 'min_samples_split': 3, 'min_samples_leaf': 3, 'min_weight_fraction_leaf': 0.012388709288890163, 'min_impurity_decrease': 0.5764759723746623, 'max_features': 0.5579880770643734, 'subsample': 0.1176154918125305, 'dropout_rate': 0.0006864887152169222, 'ccp_alpha': 0.09201699179285322}. Best is trial 759 with value: 0.8618735483942033.[0m
[32m[I 2022-05-19 12:36:55,612][0m Trial 897 finished with value: 0.7398643612703788 and parameters: {'loss': 'coxph', 'learning_rate': 0.09706578320819151, 'n_estimators': 180, 'criterion': 'friedman_mse', 'min_samples_split': 3, 'min_samples_leaf': 3, 'min_weight_fraction_leaf': 0.020950642582387876, 'min_impurity_decrease': 0.5888908082715649, 'max_features': 0.5800887239125683, 'subsample': 0.0737571725759342, 'dropout_rate': 0.039512879095849815, 'ccp_alpha': 0.3013767203731299}. Best is trial 759 with value: 0.8618735483942033.[0m
[32m[I 2022-05-19 12:42:29,112][0m Trial 898 finished with value: 0.8016715904102328 and parameters: {'loss': 'coxph', 'learning_rate': 0.027206622318834896, 'n_estimators': 128, 'criterion': 'friedman_mse', 'min_samples_split': 3, 'min_samples_leaf': 3, 'min_weight_fraction_leaf': 0.0017516500356599685, 'min_impurity_decrease': 0.5340813625059678, 'max_features': 0.5300452184252412, 'subsample': 0.12593533666789675, 'dropout_rate': 0.027290915304022608, 'ccp_alpha': 0.08931239264906782}. Best is trial 759 with value: 0.8618735483942033.[0m
[32m[I 2022-05-19 12:49:20,431][0m Trial 899 finished with value: 0.8627512492330924 and parameters: {'loss': 'coxph', 'learning_rate': 0.09450938081019804, 'n_estimators': 152, 'criterion': 'friedman_mse', 'min_samples_split': 3, 'min_samples_leaf': 3, 'min_weight_fraction_leaf': 0.01641918596620047, 'min_impurity_decrease': 0.6059208066615676, 'max_features': 0.6360435181524643, 'subsample': 0.1099890912801106, 'dropout_rate': 0.00042444183152235, 'ccp_alpha': 0.0018042303936572587}. Best is trial 899 with value: 0.8627512492330924.[0m
[32m[I 2022-05-19 12:56:12,625][0m Trial 900 finished with value: 0.7620538775690948 and parameters: {'loss': 'coxph', 'learning_rate': 0.09015646477220363, 'n_estimators': 152, 'criterion': 'friedman_mse', 'min_samples_split': 3, 'min_samples_leaf': 3, 'min_weight_fraction_leaf': 0.011330751029696435, 'min_impurity_decrease': 0.5768975622767426, 'max_features': 0.6272762497927009, 'subsample': 0.09417451593779376, 'dropout_rate': 1.443605164149625e-05, 'ccp_alpha': 0.21923033881705287}. Best is trial 899 with value: 0.8627512492330924.[0m
[32m[I 2022-05-19 13:03:18,615][0m Trial 901 finished with value: 0.8613596498943237 and parameters: {'loss': 'coxph', 'learning_rate': 0.09264405949533479, 'n_estimators': 158, 'criterion': 'friedman_mse', 'min_samples_split': 3, 'min_samples_leaf': 3, 'min_weight_fraction_leaf': 0.030104391550419066, 'min_impurity_decrease': 0.6070524783907219, 'max_features': 0.6354861967090453, 'subsample': 0.11509431586530931, 'dropout_rate': 2.9148700085288026e-05, 'ccp_alpha': 0.0032866594006482836}. Best is trial 899 with value: 0.8627512492330924.[0m
[32m[I 2022-05-19 13:09:54,740][0m Trial 902 finished with value: 0.7635000698980268 and parameters: {'loss': 'coxph', 'learning_rate': 0.09868604895201373, 'n_estimators': 143, 'criterion': 'friedman_mse', 'min_samples_split': 3, 'min_samples_leaf': 3, 'min_weight_fraction_leaf': 0.029496943517747197, 'min_impurity_decrease': 0.5602377854963428, 'max_features': 0.6288308537886717, 'subsample': 0.07399814704434843, 'dropout_rate': 0.0011874338894167615, 'ccp_alpha': 0.16530774463235437}. Best is trial 899 with value: 0.8627512492330924.[0m
[32m[I 2022-05-19 13:16:55,267][0m Trial 903 finished with value: 0.7894470644694751 and parameters: {'loss': 'coxph', 'learning_rate': 0.08366409856648933, 'n_estimators': 161, 'criterion': 'friedman_mse', 'min_samples_split': 3, 'min_samples_leaf': 3, 'min_weight_fraction_leaf': 0.01664813643439019, 'min_impurity_decrease': 0.5810321280638723, 'max_features': 0.6393765667575569, 'subsample': 0.13390280644333777, 'dropout_rate': 0.017530284205430395, 'ccp_alpha': 0.09079919505946417}. Best is trial 899 with value: 0.8627512492330924.[0m
[32m[I 2022-05-19 13:24:07,011][0m Trial 904 finished with value: 0.5 and parameters: {'loss': 'coxph', 'learning_rate': 0.07683454649233483, 'n_estimators': 169, 'criterion': 'squared_error', 'min_samples_split': 3, 'min_samples_leaf': 3, 'min_weight_fraction_leaf': 0.027102409721365472, 'min_impurity_decrease': 0.5957587628838926, 'max_features': 0.6344613432805363, 'subsample': 0.1488177988886572, 'dropout_rate': 0.0005277732791598919, 'ccp_alpha': 0.24546123061529124}. Best is trial 899 with value: 0.8627512492330924.[0m
[32m[I 2022-05-19 13:31:19,519][0m Trial 905 finished with value: 0.7733690920168775 and parameters: {'loss': 'coxph', 'learning_rate': 0.09594513323083219, 'n_estimators': 159, 'criterion': 'friedman_mse', 'min_samples_split': 3, 'min_samples_leaf': 3, 'min_weight_fraction_leaf': 0.01123274359689477, 'min_impurity_decrease': 0.6054868152393785, 'max_features': 0.5885353103014075, 'subsample': 0.09491331865540516, 'dropout_rate': 0.04305730772799088, 'ccp_alpha': 0.11061713449654349}. Best is trial 899 with value: 0.8627512492330924.[0m
/media/san2_ssd/data/Workdir/survival/venv/lib/python3.8/site-packages/sksurv/ensemble/boosting.py:955: RuntimeWarning: divide by zero encountered in log
  time = numpy.log(time)
/media/san2_ssd/data/Workdir/survival/venv/lib/python3.8/site-packages/sksurv/ensemble/boosting.py:955: RuntimeWarning: divide by zero encountered in log
  time = numpy.log(time)
/media/san2_ssd/data/Workdir/survival/venv/lib/python3.8/site-packages/sksurv/ensemble/boosting.py:955: RuntimeWarning: divide by zero encountered in log
  time = numpy.log(time)
/media/san2_ssd/data/Workdir/survival/venv/lib/python3.8/site-packages/sksurv/ensemble/boosting.py:955: RuntimeWarning: divide by zero encountered in log
  time = numpy.log(time)
/media/san2_ssd/data/Workdir/survival/venv/lib/python3.8/site-packages/sksurv/ensemble/boosting.py:955: RuntimeWarning: divide by zero encountered in log
  time = numpy.log(time)
[32m[I 2022-05-19 13:31:19,602][0m Trial 906 finished with value: -1.0 and parameters: {'loss': 'squared', 'learning_rate': 0.07333522964074682, 'n_estimators': 155, 'criterion': 'friedman_mse', 'min_samples_split': 3, 'min_samples_leaf': 3, 'min_weight_fraction_leaf': 0.020073933684067593, 'min_impurity_decrease': 0.604413889051074, 'max_features': 0.6135605651712958, 'subsample': 0.12195401650820904, 'dropout_rate': 0.03746338828922705, 'ccp_alpha': 0.170589534182174}. Best is trial 899 with value: 0.8627512492330924.[0m
[32m[I 2022-05-19 13:37:57,883][0m Trial 907 finished with value: 0.5 and parameters: {'loss': 'coxph', 'learning_rate': 0.0659525377553106, 'n_estimators': 150, 'criterion': 'friedman_mse', 'min_samples_split': 3, 'min_samples_leaf': 3, 'min_weight_fraction_leaf': 0.03285279140060905, 'min_impurity_decrease': 0.5526473449001741, 'max_features': 0.5520057751497813, 'subsample': 0.1088391801691205, 'dropout_rate': 0.022131957453017482, 'ccp_alpha': 0.4382493321858912}. Best is trial 899 with value: 0.8627512492330924.[0m
[32m[I 2022-05-19 13:45:58,915][0m Trial 908 finished with value: 0.8038019920533177 and parameters: {'loss': 'coxph', 'learning_rate': 0.08297008557458736, 'n_estimators': 172, 'criterion': 'friedman_mse', 'min_samples_split': 3, 'min_samples_leaf': 3, 'min_weight_fraction_leaf': 0.001380751954028139, 'min_impurity_decrease': 0.6056618328098159, 'max_features': 0.5702402335974145, 'subsample': 0.07364554178021696, 'dropout_rate': 0.05656317332692032, 'ccp_alpha': 0.0873767394505504}. Best is trial 899 with value: 0.8627512492330924.[0m
[32m[I 2022-05-19 13:52:25,812][0m Trial 909 finished with value: 0.8606302174536113 and parameters: {'loss': 'coxph', 'learning_rate': 0.06277482066988474, 'n_estimators': 147, 'criterion': 'friedman_mse', 'min_samples_split': 3, 'min_samples_leaf': 3, 'min_weight_fraction_leaf': 0.024690534991149954, 'min_impurity_decrease': 0.5789972864421268, 'max_features': 0.6423561988606643, 'subsample': 0.13423182560111024, 'dropout_rate': 8.021021027792999e-05, 'ccp_alpha': 0.0014990835252420408}. Best is trial 899 with value: 0.8627512492330924.[0m
[32m[I 2022-05-19 13:58:34,356][0m Trial 910 finished with value: 0.5 and parameters: {'loss': 'coxph', 'learning_rate': 0.09921818124104823, 'n_estimators': 146, 'criterion': 'friedman_mse', 'min_samples_split': 3, 'min_samples_leaf': 3, 'min_weight_fraction_leaf': 0.03638293776972937, 'min_impurity_decrease': 0.569986085707005, 'max_features': 0.6283021812480651, 'subsample': 0.15386987990872214, 'dropout_rate': 0.018489752237137135, 'ccp_alpha': 4.97595102344785}. Best is trial 899 with value: 0.8627512492330924.[0m
[32m[I 2022-05-19 14:05:06,059][0m Trial 911 finished with value: 0.5 and parameters: {'loss': 'coxph', 'learning_rate': 0.06338097937120007, 'n_estimators': 152, 'criterion': 'friedman_mse', 'min_samples_split': 3, 'min_samples_leaf': 3, 'min_weight_fraction_leaf': 0.026447462132305158, 'min_impurity_decrease': 0.5145992168492215, 'max_features': 0.6396085712908562, 'subsample': 0.1356286068437348, 'dropout_rate': 0.03796100619446645, 'ccp_alpha': 0.86687236403047}. Best is trial 899 with value: 0.8627512492330924.[0m
[32m[I 2022-05-19 14:12:19,158][0m Trial 912 finished with value: 0.8609010112729244 and parameters: {'loss': 'coxph', 'learning_rate': 0.07612334552602418, 'n_estimators': 167, 'criterion': 'friedman_mse', 'min_samples_split': 3, 'min_samples_leaf': 3, 'min_weight_fraction_leaf': 0.037854391632554635, 'min_impurity_decrease': 0.535955732329364, 'max_features': 0.6493169422898292, 'subsample': 0.15272615794951822, 'dropout_rate': 0.017328267348362056, 'ccp_alpha': 0.004029157910860375}. Best is trial 899 with value: 0.8627512492330924.[0m
[32m[I 2022-05-19 14:19:17,650][0m Trial 913 finished with value: 0.8617793051344167 and parameters: {'loss': 'coxph', 'learning_rate': 0.09719450725222548, 'n_estimators': 161, 'criterion': 'friedman_mse', 'min_samples_split': 3, 'min_samples_leaf': 3, 'min_weight_fraction_leaf': 0.036982082055210384, 'min_impurity_decrease': 0.5348362465312158, 'max_features': 0.6372924585348975, 'subsample': 0.15143661628900387, 'dropout_rate': 0.0005604345158397826, 'ccp_alpha': 0.0016533892171527033}. Best is trial 899 with value: 0.8627512492330924.[0m
[32m[I 2022-05-19 14:26:09,846][0m Trial 914 finished with value: 0.7396325788658592 and parameters: {'loss': 'coxph', 'learning_rate': 0.09576525439753351, 'n_estimators': 163, 'criterion': 'friedman_mse', 'min_samples_split': 3, 'min_samples_leaf': 3, 'min_weight_fraction_leaf': 0.04032762548583967, 'min_impurity_decrease': 0.5423302306415912, 'max_features': 0.6256363610295401, 'subsample': 0.15798740073692463, 'dropout_rate': 0.08146801417242125, 'ccp_alpha': 0.3141193348566049}. Best is trial 899 with value: 0.8627512492330924.[0m
