No protocol specified
[32m[I 2022-04-21 11:35:29,638][0m A new study created in memory with name: no-name-25dda8e6-302e-4bcb-8095-2c9da95e07c8[0m
2022-04-21 11:35:29.673465: E tensorflow/stream_executor/cuda/cuda_driver.cc:271] failed call to cuInit: CUDA_ERROR_NO_DEVICE: no CUDA-capable device is detected
2022-04-21 11:35:29.673549: I tensorflow/stream_executor/cuda/cuda_diagnostics.cc:156] kernel driver does not appear to be running on this host (nbcwdc01): /proc/driver/nvidia/version does not exist
2022-04-21 11:35:29.674167: I tensorflow/core/platform/cpu_feature_guard.cc:151] This TensorFlow binary is optimized with oneAPI Deep Neural Network Library (oneDNN) to use the following CPU instructions in performance-critical operations:  AVX2 AVX512F FMA
To enable them in other operations, rebuild TensorFlow with the appropriate compiler flags.
WARNING:tensorflow:Setting parallel_iterations > 1 has no effect when executing eagerly. Consider calling map_fn with tf.function to execute fn in parallel.
[32m[I 2022-04-21 11:50:11,593][0m Trial 0 finished with value: 0.6087054595028379 and parameters: {'n_hidden': 2048, 'mixture_components': 10, 'use_sparse_layer': False, 'use_batchnorm': True, 'use_dropout': True, 'dropout': 0.6924551084768965, 'mlp_size_1': 8, 'mlp_size_2': 0, 'mlp_size_3': 0, 'kernel': 'Exponential', 'loss_name': 'NLLLoss'}. Best is trial 0 with value: 0.6087054595028379.[0m
[32m[I 2022-04-21 11:53:58,509][0m Trial 1 finished with value: 0.3973685758806321 and parameters: {'n_hidden': 128, 'mixture_components': 8, 'use_sparse_layer': False, 'use_batchnorm': False, 'use_dropout': True, 'dropout': 0.9132511926753775, 'mlp_size_1': 2, 'mlp_size_2': 0, 'mlp_size_3': 0, 'kernel': 'LogLogistic', 'loss_name': 'NLLLoss'}. Best is trial 0 with value: 0.6087054595028379.[0m
[32m[I 2022-04-21 12:03:56,247][0m Trial 2 finished with value: 0.9221395725268866 and parameters: {'n_hidden': 256, 'mixture_components': 7, 'use_sparse_layer': True, 'use_sparse_loss': False, 'use_batchnorm': False, 'use_dropout': True, 'dropout': 0.04132497686998193, 'mlp_size_1': 1, 'mlp_size_2': 1, 'mlp_size_3': 0, 'kernel': 'LogLogistic', 'loss_name': 'CensoredNLLLoss'}. Best is trial 2 with value: 0.9221395725268866.[0m
[32m[I 2022-04-21 12:08:58,293][0m Trial 3 finished with value: -0.5 and parameters: {'n_hidden': 64, 'mixture_components': 9, 'use_sparse_layer': False, 'use_batchnorm': True, 'use_dropout': True, 'dropout': 0.9554967165825465, 'mlp_size_1': 3, 'mlp_size_2': 0, 'mlp_size_3': 0, 'kernel': 'Normal', 'loss_name': 'CensoredNLLLoss'}. Best is trial 2 with value: 0.9221395725268866.[0m
[32m[I 2022-04-21 12:21:51,189][0m Trial 4 finished with value: 0.9028405101182895 and parameters: {'n_hidden': 64, 'mixture_components': 7, 'use_sparse_layer': True, 'use_sparse_loss': True, 'lmbd': 0.08964893308886787, 'use_batchnorm': False, 'use_dropout': False, 'mlp_size_1': 1, 'mlp_size_2': 0, 'mlp_size_3': 1, 'kernel': 'LogLogistic', 'loss_name': 'NLLLoss'}. Best is trial 2 with value: 0.9221395725268866.[0m
[32m[I 2022-04-21 12:27:24,843][0m Trial 5 finished with value: -0.5 and parameters: {'n_hidden': 512, 'mixture_components': 1, 'use_sparse_layer': True, 'use_sparse_loss': False, 'use_batchnorm': False, 'use_dropout': False, 'mlp_size_1': 2, 'mlp_size_2': 3, 'mlp_size_3': 1, 'kernel': 'Exponential', 'loss_name': 'AlternativeNLLLoss'}. Best is trial 2 with value: 0.9221395725268866.[0m
[32m[I 2022-04-21 12:36:21,639][0m Trial 6 finished with value: 0.6165188926488645 and parameters: {'n_hidden': 64, 'mixture_components': 9, 'use_sparse_layer': False, 'use_batchnorm': True, 'use_dropout': True, 'dropout': 0.3247015496503928, 'mlp_size_1': 3, 'mlp_size_2': 0, 'mlp_size_3': 0, 'kernel': 'Normal', 'loss_name': 'NLLLoss'}. Best is trial 2 with value: 0.9221395725268866.[0m
[32m[I 2022-04-21 12:41:44,781][0m Trial 7 finished with value: 0.6050743225574097 and parameters: {'n_hidden': 64, 'mixture_components': 6, 'use_sparse_layer': False, 'use_batchnorm': False, 'use_dropout': True, 'dropout': 0.3949610344462421, 'mlp_size_1': 1, 'mlp_size_2': 1, 'mlp_size_3': 1, 'kernel': 'Logistic', 'loss_name': 'CensoredNLLLoss'}. Best is trial 2 with value: 0.9221395725268866.[0m
[32m[I 2022-04-21 12:57:02,025][0m Trial 8 finished with value: 0.42515608894763507 and parameters: {'n_hidden': 2048, 'mixture_components': 1, 'use_sparse_layer': True, 'use_sparse_loss': True, 'lmbd': 0.0005059024629879753, 'use_batchnorm': False, 'use_dropout': True, 'dropout': 0.26364222299359763, 'mlp_size_1': 0, 'mlp_size_2': 7, 'mlp_size_3': 1, 'kernel': 'LogLogistic', 'loss_name': 'AlternativeNLLLoss'}. Best is trial 2 with value: 0.9221395725268866.[0m
[32m[I 2022-04-21 13:04:15,212][0m Trial 9 finished with value: 0.6227647538473529 and parameters: {'n_hidden': 512, 'mixture_components': 2, 'use_sparse_layer': True, 'use_sparse_loss': False, 'use_batchnorm': False, 'use_dropout': False, 'mlp_size_1': 2, 'mlp_size_2': 2, 'mlp_size_3': 0, 'kernel': 'Logistic', 'loss_name': 'AlternativeNLLLoss'}. Best is trial 2 with value: 0.9221395725268866.[0m
[32m[I 2022-04-21 13:20:28,360][0m Trial 10 finished with value: 0.6160257901832504 and parameters: {'n_hidden': 256, 'mixture_components': 4, 'use_sparse_layer': True, 'use_sparse_loss': False, 'use_batchnorm': True, 'use_dropout': True, 'dropout': 0.026605087317979333, 'mlp_size_1': 5, 'mlp_size_2': 0, 'mlp_size_3': 0, 'kernel': 'LogLogistic', 'loss_name': 'CensoredNLLLoss'}. Best is trial 2 with value: 0.9221395725268866.[0m
[32m[I 2022-04-21 13:29:32,306][0m Trial 11 finished with value: 0.8978452122599165 and parameters: {'n_hidden': 1024, 'mixture_components': 6, 'use_sparse_layer': True, 'use_sparse_loss': True, 'lmbd': 0.09535020883832825, 'use_batchnorm': False, 'use_dropout': False, 'mlp_size_1': 0, 'mlp_size_2': 4, 'mlp_size_3': 3, 'kernel': 'LogLogistic', 'loss_name': 'NLLLoss'}. Best is trial 2 with value: 0.9221395725268866.[0m
[32m[I 2022-04-21 13:37:54,851][0m Trial 12 finished with value: 0.9214848080217166 and parameters: {'n_hidden': 256, 'mixture_components': 7, 'use_sparse_layer': True, 'use_sparse_loss': True, 'lmbd': 0.09707670965407489, 'use_batchnorm': False, 'use_dropout': False, 'mlp_size_1': 1, 'mlp_size_2': 1, 'mlp_size_3': 2, 'kernel': 'LogLogistic', 'loss_name': 'CensoredNLLLoss'}. Best is trial 2 with value: 0.9221395725268866.[0m
[32m[I 2022-04-21 13:46:35,851][0m Trial 13 finished with value: 0.921602249813809 and parameters: {'n_hidden': 256, 'mixture_components': 5, 'use_sparse_layer': True, 'use_sparse_loss': True, 'lmbd': 1.2779437754300568e-06, 'use_batchnorm': False, 'use_dropout': False, 'mlp_size_1': 1, 'mlp_size_2': 2, 'mlp_size_3': 2, 'kernel': 'LogLogistic', 'loss_name': 'CensoredNLLLoss'}. Best is trial 2 with value: 0.9221395725268866.[0m
[32m[I 2022-04-21 13:55:49,429][0m Trial 14 finished with value: 0.8183363576941286 and parameters: {'n_hidden': 256, 'mixture_components': 4, 'use_sparse_layer': True, 'use_sparse_loss': False, 'use_batchnorm': False, 'use_dropout': False, 'mlp_size_1': 0, 'mlp_size_2': 2, 'mlp_size_3': 2, 'kernel': 'LogLogistic', 'loss_name': 'CensoredNLLLoss'}. Best is trial 2 with value: 0.9221395725268866.[0m
[32m[I 2022-04-21 14:12:00,290][0m Trial 15 finished with value: 0.9220066700103597 and parameters: {'n_hidden': 32, 'mixture_components': 4, 'use_sparse_layer': True, 'use_sparse_loss': False, 'use_batchnorm': False, 'use_dropout': False, 'mlp_size_1': 1, 'mlp_size_2': 1, 'mlp_size_3': 0, 'kernel': 'LogLogistic', 'loss_name': 'CensoredNLLLoss'}. Best is trial 2 with value: 0.9221395725268866.[0m
[32m[I 2022-04-21 14:26:47,477][0m Trial 16 finished with value: 0.9233256844026331 and parameters: {'n_hidden': 32, 'mixture_components': 3, 'use_sparse_layer': True, 'use_sparse_loss': False, 'use_batchnorm': False, 'use_dropout': True, 'dropout': 0.07070967460392528, 'mlp_size_1': 1, 'mlp_size_2': 1, 'mlp_size_3': 0, 'kernel': 'Logistic', 'loss_name': 'CensoredNLLLoss'}. Best is trial 16 with value: 0.9233256844026331.[0m
[32m[I 2022-04-21 14:42:31,494][0m Trial 17 finished with value: 0.9206877620820508 and parameters: {'n_hidden': 32, 'mixture_components': 3, 'use_sparse_layer': True, 'use_sparse_loss': False, 'use_batchnorm': False, 'use_dropout': True, 'dropout': 0.061856449435001175, 'mlp_size_1': 0, 'mlp_size_2': 1, 'mlp_size_3': 0, 'kernel': 'Logistic', 'loss_name': 'CensoredNLLLoss'}. Best is trial 16 with value: 0.9233256844026331.[0m
[32m[I 2022-04-21 14:59:48,264][0m Trial 18 finished with value: 0.818693063237872 and parameters: {'n_hidden': 32, 'mixture_components': 3, 'use_sparse_layer': True, 'use_sparse_loss': False, 'use_batchnorm': True, 'use_dropout': True, 'dropout': 0.17909509187013709, 'mlp_size_1': 1, 'mlp_size_2': 1, 'mlp_size_3': 0, 'kernel': 'Logistic', 'loss_name': 'CensoredNLLLoss'}. Best is trial 16 with value: 0.9233256844026331.[0m
[32m[I 2022-04-21 15:07:52,301][0m Trial 19 finished with value: 0.41747854858776223 and parameters: {'n_hidden': 128, 'mixture_components': 5, 'use_sparse_layer': True, 'use_sparse_loss': False, 'use_batchnorm': False, 'use_dropout': True, 'dropout': 0.5687385497326464, 'mlp_size_1': 2, 'mlp_size_2': 1, 'mlp_size_3': 0, 'kernel': 'Logistic', 'loss_name': 'CensoredNLLLoss'}. Best is trial 16 with value: 0.9233256844026331.[0m
[32m[I 2022-04-21 15:18:50,429][0m Trial 20 finished with value: 0.8267217976853365 and parameters: {'n_hidden': 1024, 'mixture_components': 7, 'use_sparse_layer': True, 'use_sparse_loss': False, 'use_batchnorm': False, 'use_dropout': True, 'dropout': 0.1348845884837194, 'mlp_size_1': 5, 'mlp_size_2': 1, 'mlp_size_3': 0, 'kernel': 'Normal', 'loss_name': 'AlternativeNLLLoss'}. Best is trial 16 with value: 0.9233256844026331.[0m
[32m[I 2022-04-21 15:22:34,504][0m Trial 21 finished with value: -0.5 and parameters: {'n_hidden': 32, 'mixture_components': 4, 'use_sparse_layer': True, 'use_sparse_loss': False, 'use_batchnorm': False, 'use_dropout': False, 'mlp_size_1': 1, 'mlp_size_2': 1, 'mlp_size_3': 0, 'kernel': 'Exponential', 'loss_name': 'CensoredNLLLoss'}. Best is trial 16 with value: 0.9233256844026331.[0m
[32m[I 2022-04-21 15:30:37,459][0m Trial 22 finished with value: 0.4142573599424769 and parameters: {'n_hidden': 32, 'mixture_components': 2, 'use_sparse_layer': True, 'use_sparse_loss': False, 'use_batchnorm': False, 'use_dropout': True, 'dropout': 0.4776394422503478, 'mlp_size_1': 1, 'mlp_size_2': 1, 'mlp_size_3': 0, 'kernel': 'Logistic', 'loss_name': 'CensoredNLLLoss'}. Best is trial 16 with value: 0.9233256844026331.[0m
[32m[I 2022-04-21 15:46:44,446][0m Trial 23 finished with value: 0.9215038623098726 and parameters: {'n_hidden': 32, 'mixture_components': 3, 'use_sparse_layer': True, 'use_sparse_loss': False, 'use_batchnorm': False, 'use_dropout': False, 'mlp_size_1': 1, 'mlp_size_2': 1, 'mlp_size_3': 0, 'kernel': 'LogLogistic', 'loss_name': 'CensoredNLLLoss'}. Best is trial 16 with value: 0.9233256844026331.[0m
[32m[I 2022-04-21 15:55:27,123][0m Trial 24 finished with value: 0.7168339762999392 and parameters: {'n_hidden': 32, 'mixture_components': 5, 'use_sparse_layer': True, 'use_sparse_loss': False, 'use_batchnorm': False, 'use_dropout': True, 'dropout': 0.17420281365689683, 'mlp_size_1': 1, 'mlp_size_2': 1, 'mlp_size_3': 0, 'kernel': 'LogLogistic', 'loss_name': 'CensoredNLLLoss'}. Best is trial 16 with value: 0.9233256844026331.[0m
[32m[I 2022-04-21 16:11:51,435][0m Trial 25 finished with value: 0.5211463252620582 and parameters: {'n_hidden': 32, 'mixture_components': 2, 'use_sparse_layer': True, 'use_sparse_loss': False, 'use_batchnorm': False, 'use_dropout': True, 'dropout': 0.003895058166742564, 'mlp_size_1': 1, 'mlp_size_2': 1, 'mlp_size_3': 0, 'kernel': 'Logistic', 'loss_name': 'CensoredNLLLoss'}. Best is trial 16 with value: 0.9233256844026331.[0m
[32m[I 2022-04-21 16:16:52,962][0m Trial 26 finished with value: -0.5 and parameters: {'n_hidden': 256, 'mixture_components': 6, 'use_sparse_layer': False, 'use_batchnorm': True, 'use_dropout': False, 'mlp_size_1': 3, 'mlp_size_2': 2, 'mlp_size_3': 0, 'kernel': 'Exponential', 'loss_name': 'CensoredNLLLoss'}. Best is trial 16 with value: 0.9233256844026331.[0m
[32m[I 2022-04-21 16:25:08,376][0m Trial 27 finished with value: 0.4123238242945509 and parameters: {'n_hidden': 32, 'mixture_components': 4, 'use_sparse_layer': True, 'use_sparse_loss': False, 'use_batchnorm': False, 'use_dropout': True, 'dropout': 0.758713401896983, 'mlp_size_1': 1, 'mlp_size_2': 1, 'mlp_size_3': 0, 'kernel': 'Normal', 'loss_name': 'CensoredNLLLoss'}. Best is trial 16 with value: 0.9233256844026331.[0m
[32m[I 2022-04-21 16:36:02,446][0m Trial 28 finished with value: 0.9230791486406205 and parameters: {'n_hidden': 128, 'mixture_components': 8, 'use_sparse_layer': True, 'use_sparse_loss': False, 'use_batchnorm': False, 'use_dropout': False, 'mlp_size_1': 2, 'mlp_size_2': 1, 'mlp_size_3': 0, 'kernel': 'LogLogistic', 'loss_name': 'CensoredNLLLoss'}. Best is trial 16 with value: 0.9233256844026331.[0m
[32m[I 2022-04-21 16:41:08,001][0m Trial 29 finished with value: -0.5 and parameters: {'n_hidden': 128, 'mixture_components': 10, 'use_sparse_layer': False, 'use_batchnorm': True, 'use_dropout': True, 'dropout': 0.296390843509028, 'mlp_size_1': 2, 'mlp_size_2': 2, 'mlp_size_3': 0, 'kernel': 'Exponential', 'loss_name': 'AlternativeNLLLoss'}. Best is trial 16 with value: 0.9233256844026331.[0m
[32m[I 2022-04-21 16:49:07,259][0m Trial 30 finished with value: 0.5385273517721223 and parameters: {'n_hidden': 2048, 'mixture_components': 8, 'use_sparse_layer': True, 'use_sparse_loss': False, 'use_batchnorm': False, 'use_dropout': True, 'dropout': 0.12128573675890897, 'mlp_size_1': 7, 'mlp_size_2': 1, 'mlp_size_3': 0, 'kernel': 'Logistic', 'loss_name': 'NLLLoss'}. Best is trial 16 with value: 0.9233256844026331.[0m
[32m[I 2022-04-21 16:59:37,074][0m Trial 31 finished with value: 0.9232189800767507 and parameters: {'n_hidden': 128, 'mixture_components': 9, 'use_sparse_layer': True, 'use_sparse_loss': False, 'use_batchnorm': False, 'use_dropout': False, 'mlp_size_1': 2, 'mlp_size_2': 1, 'mlp_size_3': 0, 'kernel': 'LogLogistic', 'loss_name': 'CensoredNLLLoss'}. Best is trial 16 with value: 0.9233256844026331.[0m
[32m[I 2022-04-21 17:09:13,132][0m Trial 32 finished with value: 0.9222329616355687 and parameters: {'n_hidden': 128, 'mixture_components': 8, 'use_sparse_layer': True, 'use_sparse_loss': False, 'use_batchnorm': False, 'use_dropout': False, 'mlp_size_1': 2, 'mlp_size_2': 1, 'mlp_size_3': 0, 'kernel': 'LogLogistic', 'loss_name': 'CensoredNLLLoss'}. Best is trial 16 with value: 0.9233256844026331.[0m
[32m[I 2022-04-21 17:19:46,337][0m Trial 33 finished with value: 0.9251578316370667 and parameters: {'n_hidden': 128, 'mixture_components': 10, 'use_sparse_layer': True, 'use_sparse_loss': False, 'use_batchnorm': False, 'use_dropout': False, 'mlp_size_1': 2, 'mlp_size_2': 1, 'mlp_size_3': 0, 'kernel': 'LogLogistic', 'loss_name': 'CensoredNLLLoss'}. Best is trial 33 with value: 0.9251578316370667.[0m
[32m[I 2022-04-21 17:28:49,520][0m Trial 34 finished with value: 0.9214507926121163 and parameters: {'n_hidden': 128, 'mixture_components': 10, 'use_sparse_layer': False, 'use_batchnorm': False, 'use_dropout': False, 'mlp_size_1': 2, 'mlp_size_2': 0, 'mlp_size_3': 1, 'kernel': 'LogLogistic', 'loss_name': 'CensoredNLLLoss'}. Best is trial 33 with value: 0.9251578316370667.[0m
[32m[I 2022-04-21 17:38:28,152][0m Trial 35 finished with value: 0.9246305020347547 and parameters: {'n_hidden': 128, 'mixture_components': 9, 'use_sparse_layer': True, 'use_sparse_loss': False, 'use_batchnorm': False, 'use_dropout': False, 'mlp_size_1': 3, 'mlp_size_2': 1, 'mlp_size_3': 0, 'kernel': 'LogLogistic', 'loss_name': 'CensoredNLLLoss'}. Best is trial 33 with value: 0.9251578316370667.[0m
[32m[I 2022-04-21 17:48:22,793][0m Trial 36 finished with value: 0.9087588349431476 and parameters: {'n_hidden': 128, 'mixture_components': 9, 'use_sparse_layer': True, 'use_sparse_loss': False, 'use_batchnorm': False, 'use_dropout': False, 'mlp_size_1': 3, 'mlp_size_2': 1, 'mlp_size_3': 0, 'kernel': 'LogLogistic', 'loss_name': 'NLLLoss'}. Best is trial 33 with value: 0.9251578316370667.[0m
[32m[I 2022-04-21 18:01:58,321][0m Trial 37 finished with value: 0.917523042396223 and parameters: {'n_hidden': 128, 'mixture_components': 10, 'use_sparse_layer': True, 'use_sparse_loss': False, 'use_batchnorm': True, 'use_dropout': False, 'mlp_size_1': 3, 'mlp_size_2': 1, 'mlp_size_3': 0, 'kernel': 'Normal', 'loss_name': 'CensoredNLLLoss'}. Best is trial 33 with value: 0.9251578316370667.[0m
[32m[I 2022-04-21 18:11:09,312][0m Trial 38 finished with value: 0.9257019275078534 and parameters: {'n_hidden': 128, 'mixture_components': 9, 'use_sparse_layer': False, 'use_batchnorm': False, 'use_dropout': False, 'mlp_size_1': 3, 'mlp_size_2': 1, 'mlp_size_3': 0, 'kernel': 'LogLogistic', 'loss_name': 'CensoredNLLLoss'}. Best is trial 38 with value: 0.9257019275078534.[0m
[32m[I 2022-04-21 18:19:42,740][0m Trial 39 finished with value: 0.9129977986775832 and parameters: {'n_hidden': 128, 'mixture_components': 9, 'use_sparse_layer': False, 'use_batchnorm': False, 'use_dropout': False, 'mlp_size_1': 4, 'mlp_size_2': 0, 'mlp_size_3': 0, 'kernel': 'LogLogistic', 'loss_name': 'NLLLoss'}. Best is trial 38 with value: 0.9257019275078534.[0m
[32m[I 2022-04-21 18:23:34,537][0m Trial 40 finished with value: -0.5 and parameters: {'n_hidden': 512, 'mixture_components': 10, 'use_sparse_layer': False, 'use_batchnorm': False, 'use_dropout': False, 'mlp_size_1': 4, 'mlp_size_2': 0, 'mlp_size_3': 1, 'kernel': 'Exponential', 'loss_name': 'AlternativeNLLLoss'}. Best is trial 38 with value: 0.9257019275078534.[0m
[32m[I 2022-04-21 18:35:23,521][0m Trial 41 finished with value: 0.9239019032146449 and parameters: {'n_hidden': 128, 'mixture_components': 9, 'use_sparse_layer': False, 'use_batchnorm': False, 'use_dropout': False, 'mlp_size_1': 3, 'mlp_size_2': 1, 'mlp_size_3': 0, 'kernel': 'LogLogistic', 'loss_name': 'CensoredNLLLoss'}. Best is trial 38 with value: 0.9257019275078534.[0m
[32m[I 2022-04-21 18:44:13,194][0m Trial 42 finished with value: 0.923070518861512 and parameters: {'n_hidden': 128, 'mixture_components': 9, 'use_sparse_layer': False, 'use_batchnorm': False, 'use_dropout': False, 'mlp_size_1': 3, 'mlp_size_2': 1, 'mlp_size_3': 0, 'kernel': 'LogLogistic', 'loss_name': 'CensoredNLLLoss'}. Best is trial 38 with value: 0.9257019275078534.[0m
[32m[I 2022-04-21 18:53:56,433][0m Trial 43 finished with value: 0.9250265399983808 and parameters: {'n_hidden': 128, 'mixture_components': 10, 'use_sparse_layer': False, 'use_batchnorm': False, 'use_dropout': False, 'mlp_size_1': 3, 'mlp_size_2': 1, 'mlp_size_3': 0, 'kernel': 'LogLogistic', 'loss_name': 'CensoredNLLLoss'}. Best is trial 38 with value: 0.9257019275078534.[0m
[32m[I 2022-04-21 19:01:59,693][0m Trial 44 finished with value: 0.9237890001563717 and parameters: {'n_hidden': 128, 'mixture_components': 10, 'use_sparse_layer': False, 'use_batchnorm': False, 'use_dropout': False, 'mlp_size_1': 3, 'mlp_size_2': 1, 'mlp_size_3': 0, 'kernel': 'LogLogistic', 'loss_name': 'CensoredNLLLoss'}. Best is trial 38 with value: 0.9257019275078534.[0m
[32m[I 2022-04-21 19:10:34,280][0m Trial 45 finished with value: 0.9244868516157825 and parameters: {'n_hidden': 128, 'mixture_components': 9, 'use_sparse_layer': False, 'use_batchnorm': False, 'use_dropout': False, 'mlp_size_1': 3, 'mlp_size_2': 1, 'mlp_size_3': 0, 'kernel': 'LogLogistic', 'loss_name': 'CensoredNLLLoss'}. Best is trial 38 with value: 0.9257019275078534.[0m
[32m[I 2022-04-21 19:24:40,818][0m Trial 46 finished with value: 0.921859876394994 and parameters: {'n_hidden': 64, 'mixture_components': 8, 'use_sparse_layer': False, 'use_batchnorm': True, 'use_dropout': False, 'mlp_size_1': 3, 'mlp_size_2': 0, 'mlp_size_3': 0, 'kernel': 'LogLogistic', 'loss_name': 'CensoredNLLLoss'}. Best is trial 38 with value: 0.9257019275078534.[0m
[32m[I 2022-04-21 19:35:48,289][0m Trial 47 finished with value: 0.9236031992211269 and parameters: {'n_hidden': 128, 'mixture_components': 10, 'use_sparse_layer': False, 'use_batchnorm': False, 'use_dropout': False, 'mlp_size_1': 4, 'mlp_size_2': 0, 'mlp_size_3': 0, 'kernel': 'LogLogistic', 'loss_name': 'CensoredNLLLoss'}. Best is trial 38 with value: 0.9257019275078534.[0m
[32m[I 2022-04-21 19:45:36,414][0m Trial 48 finished with value: 0.9259820305382661 and parameters: {'n_hidden': 2048, 'mixture_components': 9, 'use_sparse_layer': False, 'use_batchnorm': False, 'use_dropout': False, 'mlp_size_1': 4, 'mlp_size_2': 3, 'mlp_size_3': 0, 'kernel': 'LogLogistic', 'loss_name': 'AlternativeNLLLoss'}. Best is trial 48 with value: 0.9259820305382661.[0m
[32m[I 2022-04-21 19:57:13,461][0m Trial 49 finished with value: 0.9262536277993192 and parameters: {'n_hidden': 2048, 'mixture_components': 7, 'use_sparse_layer': False, 'use_batchnorm': False, 'use_dropout': False, 'mlp_size_1': 6, 'mlp_size_2': 2, 'mlp_size_3': 0, 'kernel': 'LogLogistic', 'loss_name': 'AlternativeNLLLoss'}. Best is trial 49 with value: 0.9262536277993192.[0m
[32m[I 2022-04-21 20:06:21,709][0m Trial 50 finished with value: 0.7928507439741072 and parameters: {'n_hidden': 2048, 'mixture_components': 7, 'use_sparse_layer': False, 'use_batchnorm': False, 'use_dropout': False, 'mlp_size_1': 7, 'mlp_size_2': 1, 'mlp_size_3': 0, 'kernel': 'LogLogistic', 'loss_name': 'AlternativeNLLLoss'}. Best is trial 49 with value: 0.9262536277993192.[0m
