[32m[I 2022-04-21 17:28:56,363][0m Trial 307 finished with value: 0.8015130700946372 and parameters: {'splitter': 'random', 'min_samples_split': 0.3078671440530989, 'min_samples_leaf': 0.017759221602549863, 'min_weight_fraction_leaf': 0.03524243631239199, 'max_features': 0.9409442911669504}. Best is trial 283 with value: 0.810095230018675.[0m
[32m[I 2022-04-21 17:31:02,181][0m Trial 308 finished with value: 0.7786677981894146 and parameters: {'splitter': 'best', 'min_samples_split': 0.31410127986387365, 'min_samples_leaf': 0.03749020081324776, 'min_weight_fraction_leaf': 0.007740746487484348, 'max_features': 0.870015257898867}. Best is trial 283 with value: 0.810095230018675.[0m
[32m[I 2022-04-21 17:31:02,959][0m Trial 309 finished with value: 0.8113132095609382 and parameters: {'splitter': 'random', 'min_samples_split': 0.2574828096201177, 'min_samples_leaf': 0.02675941681065471, 'min_weight_fraction_leaf': 0.02507822861755715, 'max_features': 0.9124834797095797}. Best is trial 309 with value: 0.8113132095609382.[0m
[32m[I 2022-04-21 17:31:03,337][0m Trial 310 finished with value: 0.7809047252093795 and parameters: {'splitter': 'random', 'min_samples_split': 0.2099187927477868, 'min_samples_leaf': 0.029123655140423366, 'min_weight_fraction_leaf': 0.027545084500247917, 'max_features': 0.39007516704842854}. Best is trial 309 with value: 0.8113132095609382.[0m
[32m[I 2022-04-21 17:31:04,006][0m Trial 311 finished with value: 0.7872345411495396 and parameters: {'splitter': 'random', 'min_samples_split': 0.23414651599291567, 'min_samples_leaf': 0.016867420566368977, 'min_weight_fraction_leaf': 0.03755701587678249, 'max_features': 0.8436757412210892}. Best is trial 309 with value: 0.8113132095609382.[0m
[32m[I 2022-04-21 17:31:04,355][0m Trial 312 finished with value: 0.742279462834223 and parameters: {'splitter': 'random', 'min_samples_split': 0.4649170696716024, 'min_samples_leaf': 0.042974875398300166, 'min_weight_fraction_leaf': 0.01742692740644163, 'max_features': 0.5479176801388302}. Best is trial 309 with value: 0.8113132095609382.[0m
[32m[I 2022-04-21 17:31:04,754][0m Trial 313 finished with value: 0.7805540663117425 and parameters: {'splitter': 'random', 'min_samples_split': 0.30205321085525577, 'min_samples_leaf': 0.02411237245235483, 'min_weight_fraction_leaf': 0.00046587300648954014, 'max_features': 0.596174469070077}. Best is trial 309 with value: 0.8113132095609382.[0m
[32m[I 2022-04-21 17:31:05,693][0m Trial 314 finished with value: 0.796816187395015 and parameters: {'splitter': 'random', 'min_samples_split': 0.255929392877978, 'min_samples_leaf': 0.009412320508351757, 'min_weight_fraction_leaf': 0.02693968740923433, 'max_features': 0.8897356839883838}. Best is trial 309 with value: 0.8113132095609382.[0m
[32m[I 2022-04-21 17:31:06,445][0m Trial 315 finished with value: 0.8034308649461976 and parameters: {'splitter': 'random', 'min_samples_split': 0.4581204455871059, 'min_samples_leaf': 0.04804135019899432, 'min_weight_fraction_leaf': 0.014337793549185976, 'max_features': 0.9118870823838735}. Best is trial 309 with value: 0.8113132095609382.[0m
[32m[I 2022-04-21 17:31:07,389][0m Trial 316 finished with value: 0.6851609036733942 and parameters: {'splitter': 'random', 'min_samples_split': 0.35590959502522673, 'min_samples_leaf': 0.03027764269065457, 'min_weight_fraction_leaf': 0.28195524640860925, 'max_features': 0.9144734397360305}. Best is trial 309 with value: 0.8113132095609382.[0m
[32m[I 2022-04-21 17:31:09,152][0m Trial 317 finished with value: 0.7682350893242956 and parameters: {'splitter': 'random', 'min_samples_split': 0.3356141697131356, 'min_samples_leaf': 0.0013349253890806573, 'min_weight_fraction_leaf': 0.03821255478837514, 'max_features': 0.875851060232357}. Best is trial 309 with value: 0.8113132095609382.[0m
[32m[I 2022-04-21 17:31:10,433][0m Trial 318 finished with value: 0.7942583354593905 and parameters: {'splitter': 'random', 'min_samples_split': 0.44871508254118797, 'min_samples_leaf': 0.016631827946168173, 'min_weight_fraction_leaf': 0.02233032682442601, 'max_features': 0.8932603640804706}. Best is trial 309 with value: 0.8113132095609382.[0m
[32m[I 2022-04-21 17:31:11,294][0m Trial 319 finished with value: 0.7986065975584268 and parameters: {'splitter': 'random', 'min_samples_split': 0.4704613969582639, 'min_samples_leaf': 0.022660238427320473, 'min_weight_fraction_leaf': 0.0073323803334508775, 'max_features': 0.9412509214318818}. Best is trial 309 with value: 0.8113132095609382.[0m
[32m[I 2022-04-21 17:31:12,556][0m Trial 320 finished with value: 0.8034308649461976 and parameters: {'splitter': 'random', 'min_samples_split': 0.4831400825250915, 'min_samples_leaf': 0.0362651864467354, 'min_weight_fraction_leaf': 0.022558313556181594, 'max_features': 0.9132043093722673}. Best is trial 309 with value: 0.8113132095609382.[0m
[32m[I 2022-04-21 17:31:13,533][0m Trial 321 finished with value: 0.6851609036733942 and parameters: {'splitter': 'random', 'min_samples_split': 0.26422815559118396, 'min_samples_leaf': 0.014881411663379238, 'min_weight_fraction_leaf': 0.38711542099152074, 'max_features': 0.8012300141468043}. Best is trial 309 with value: 0.8113132095609382.[0m
[32m[I 2022-04-21 17:31:14,747][0m Trial 322 finished with value: 0.7907011627675173 and parameters: {'splitter': 'random', 'min_samples_split': 0.4607545385846233, 'min_samples_leaf': 0.05378166379658353, 'min_weight_fraction_leaf': 0.009592536732146082, 'max_features': 0.9311505427777638}. Best is trial 309 with value: 0.8113132095609382.[0m
[32m[I 2022-04-21 17:31:16,740][0m Trial 323 finished with value: 0.7869556057273523 and parameters: {'splitter': 'random', 'min_samples_split': 0.2414589171101433, 'min_samples_leaf': 0.009824224588634405, 'min_weight_fraction_leaf': 0.03930339737027643, 'max_features': 0.8539377832365469}. Best is trial 309 with value: 0.8113132095609382.[0m
[32m[I 2022-04-21 17:31:18,241][0m Trial 324 finished with value: 0.7954639943749765 and parameters: {'splitter': 'random', 'min_samples_split': 0.2219123937328486, 'min_samples_leaf': 0.026822773784421744, 'min_weight_fraction_leaf': 0.02942192120753217, 'max_features': 0.8887529617635019}. Best is trial 309 with value: 0.8113132095609382.[0m
[32m[I 2022-04-21 17:31:19,609][0m Trial 325 finished with value: 0.8066820802404091 and parameters: {'splitter': 'random', 'min_samples_split': 0.31904988814124524, 'min_samples_leaf': 0.03622329315417247, 'min_weight_fraction_leaf': 0.015922488013945656, 'max_features': 0.915059928634794}. Best is trial 309 with value: 0.8113132095609382.[0m
[32m[I 2022-04-21 17:31:21,160][0m Trial 326 finished with value: 0.7909988873237964 and parameters: {'splitter': 'random', 'min_samples_split': 0.48237051248472795, 'min_samples_leaf': 0.021728760980094675, 'min_weight_fraction_leaf': 0.0015779441516278175, 'max_features': 0.9474038128477786}. Best is trial 309 with value: 0.8113132095609382.[0m
[32m[I 2022-04-21 17:31:22,595][0m Trial 327 finished with value: 0.7940372022789198 and parameters: {'splitter': 'random', 'min_samples_split': 0.44802012380192335, 'min_samples_leaf': 0.009055677128782778, 'min_weight_fraction_leaf': 0.030051904695177274, 'max_features': 0.9036513303398572}. Best is trial 309 with value: 0.8113132095609382.[0m
[32m[I 2022-04-21 17:31:23,035][0m Trial 328 finished with value: 0.7682350893242956 and parameters: {'splitter': 'random', 'min_samples_split': 0.4671769240017803, 'min_samples_leaf': 0.04202340546002388, 'min_weight_fraction_leaf': 0.01339645359321184, 'max_features': 0.8736505045432553}. Best is trial 309 with value: 0.8113132095609382.[0m
[32m[I 2022-04-21 17:31:23,738][0m Trial 329 finished with value: 0.7763611526220765 and parameters: {'splitter': 'random', 'min_samples_split': 0.275552928171815, 'min_samples_leaf': 0.0012088712544422557, 'min_weight_fraction_leaf': 0.044224586004493055, 'max_features': 0.9662972363763039}. Best is trial 309 with value: 0.8113132095609382.[0m
[32m[I 2022-04-21 17:31:24,316][0m Trial 330 finished with value: 0.8081696907818106 and parameters: {'splitter': 'random', 'min_samples_split': 0.333216243412293, 'min_samples_leaf': 0.028553928629168605, 'min_weight_fraction_leaf': 0.022497422736681726, 'max_features': 0.9285675774481104}. Best is trial 309 with value: 0.8113132095609382.[0m
[32m[I 2022-04-21 17:31:24,715][0m Trial 331 finished with value: 0.7815587045884869 and parameters: {'splitter': 'random', 'min_samples_split': 0.32976362889140154, 'min_samples_leaf': 0.06074696363114168, 'min_weight_fraction_leaf': 0.020221207271823135, 'max_features': 0.6556553647976588}. Best is trial 309 with value: 0.8113132095609382.[0m
[32m[I 2022-04-21 17:31:25,396][0m Trial 332 finished with value: 0.8019259546233739 and parameters: {'splitter': 'random', 'min_samples_split': 0.3016826632352411, 'min_samples_leaf': 0.028117115507792324, 'min_weight_fraction_leaf': 0.009523557704974303, 'max_features': 0.9362330826625325}. Best is trial 309 with value: 0.8113132095609382.[0m
[32m[I 2022-04-21 17:31:26,331][0m Trial 333 finished with value: 0.7963956610153005 and parameters: {'splitter': 'random', 'min_samples_split': 0.3420222365534099, 'min_samples_leaf': 0.04792233866128075, 'min_weight_fraction_leaf': 0.0009525515569863766, 'max_features': 0.8931779968498302}. Best is trial 309 with value: 0.8113132095609382.[0m
[32m[I 2022-04-21 17:31:27,272][0m Trial 334 finished with value: 0.8066820802404091 and parameters: {'splitter': 'random', 'min_samples_split': 0.31991177313505453, 'min_samples_leaf': 0.03276208619541369, 'min_weight_fraction_leaf': 0.02229334762835969, 'max_features': 0.9184163941272798}. Best is trial 309 with value: 0.8113132095609382.[0m
[32m[I 2022-04-21 17:31:27,883][0m Trial 335 finished with value: 0.7774475066269884 and parameters: {'splitter': 'random', 'min_samples_split': 0.31120847727883305, 'min_samples_leaf': 0.017146955489925484, 'min_weight_fraction_leaf': 0.015131675354829033, 'max_features': 0.9587733522294011}. Best is trial 309 with value: 0.8113132095609382.[0m
[32m[I 2022-04-21 17:31:28,410][0m Trial 336 finished with value: 0.7950617409610365 and parameters: {'splitter': 'random', 'min_samples_split': 0.32942107134717546, 'min_samples_leaf': 0.03820373699844471, 'min_weight_fraction_leaf': 0.03432620927006504, 'max_features': 0.6707183606506989}. Best is trial 309 with value: 0.8113132095609382.[0m
[32m[I 2022-04-21 17:31:29,137][0m Trial 337 finished with value: 0.8038058009578595 and parameters: {'splitter': 'random', 'min_samples_split': 0.29343244530907153, 'min_samples_leaf': 0.01066387123946567, 'min_weight_fraction_leaf': 0.007354110027471096, 'max_features': 0.99901602857781}. Best is trial 309 with value: 0.8113132095609382.[0m
[32m[I 2022-04-21 17:31:29,689][0m Trial 338 finished with value: 0.7964623548471422 and parameters: {'splitter': 'random', 'min_samples_split': 0.4771697804593134, 'min_samples_leaf': 0.02666976062937224, 'min_weight_fraction_leaf': 0.02697753494234708, 'max_features': 0.9411753163453068}. Best is trial 309 with value: 0.8113132095609382.[0m
[32m[I 2022-04-21 17:31:30,075][0m Trial 339 finished with value: 0.7245655965123662 and parameters: {'splitter': 'random', 'min_samples_split': 0.49119820107680007, 'min_samples_leaf': 0.017819086707000845, 'min_weight_fraction_leaf': 0.014952644472165539, 'max_features': 0.4465570204235546}. Best is trial 309 with value: 0.8113132095609382.[0m
[32m[I 2022-04-21 17:31:30,561][0m Trial 340 finished with value: 0.8055043242234469 and parameters: {'splitter': 'random', 'min_samples_split': 0.346708362905624, 'min_samples_leaf': 0.04701274652654615, 'min_weight_fraction_leaf': 0.04383034992262132, 'max_features': 0.9074441909501314}. Best is trial 309 with value: 0.8113132095609382.[0m
[32m[I 2022-04-21 17:33:19,944][0m Trial 341 finished with value: 0.7735323767891866 and parameters: {'splitter': 'best', 'min_samples_split': 0.46534976522926325, 'min_samples_leaf': 0.029210504091609513, 'min_weight_fraction_leaf': 0.0004327999634119687, 'max_features': 0.7059926769735296}. Best is trial 309 with value: 0.8113132095609382.[0m
[32m[I 2022-04-21 17:33:20,530][0m Trial 342 finished with value: 0.7669759123387727 and parameters: {'splitter': 'random', 'min_samples_split': 0.4854298513294551, 'min_samples_leaf': 0.010366842477303217, 'min_weight_fraction_leaf': 0.022667764810685196, 'max_features': 0.9742978088269295}. Best is trial 309 with value: 0.8113132095609382.[0m
[32m[I 2022-04-21 17:33:20,931][0m Trial 343 finished with value: 0.7705741729504169 and parameters: {'splitter': 'random', 'min_samples_split': 0.334064541833866, 'min_samples_leaf': 0.035946445548691294, 'min_weight_fraction_leaf': 0.053555570684551086, 'max_features': 0.5397280777301514}. Best is trial 309 with value: 0.8113132095609382.[0m
[32m[I 2022-04-21 17:33:21,514][0m Trial 344 finished with value: 0.8020772014016302 and parameters: {'splitter': 'random', 'min_samples_split': 0.23620106432584037, 'min_samples_leaf': 0.02039367217471765, 'min_weight_fraction_leaf': 0.03664085950733928, 'max_features': 0.7795091824810976}. Best is trial 309 with value: 0.8113132095609382.[0m
[32m[I 2022-04-21 17:33:21,977][0m Trial 345 finished with value: 0.7668481980218484 and parameters: {'splitter': 'random', 'min_samples_split': 0.31738132989158296, 'min_samples_leaf': 0.05958361983915166, 'min_weight_fraction_leaf': 0.00976379992095025, 'max_features': 0.8233185430632558}. Best is trial 309 with value: 0.8113132095609382.[0m
[32m[I 2022-04-21 17:35:16,879][0m Trial 346 finished with value: 0.7764527766360565 and parameters: {'splitter': 'best', 'min_samples_split': 0.45615160327167664, 'min_samples_leaf': 0.009336312167563863, 'min_weight_fraction_leaf': 0.022873703138726394, 'max_features': 0.8608409207379987}. Best is trial 309 with value: 0.8113132095609382.[0m
[32m[I 2022-04-21 17:35:18,477][0m Trial 347 finished with value: 0.7906856301444736 and parameters: {'splitter': 'random', 'min_samples_split': 0.20629137328519953, 'min_samples_leaf': 0.0012045968069870471, 'min_weight_fraction_leaf': 8.258951328553635e-05, 'max_features': 0.8862033869650865}. Best is trial 309 with value: 0.8113132095609382.[0m
[32m[I 2022-04-21 17:35:19,466][0m Trial 348 finished with value: 0.8034308649461976 and parameters: {'splitter': 'random', 'min_samples_split': 0.47508294286556646, 'min_samples_leaf': 0.025648407817765086, 'min_weight_fraction_leaf': 0.03218831604415457, 'max_features': 0.9276269445802887}. Best is trial 309 with value: 0.8113132095609382.[0m
[32m[I 2022-04-21 17:35:20,302][0m Trial 349 finished with value: 0.8015130700946372 and parameters: {'splitter': 'random', 'min_samples_split': 0.309352462495502, 'min_samples_leaf': 0.04078237181422437, 'min_weight_fraction_leaf': 0.015462569648683724, 'max_features': 0.9469495973153523}. Best is trial 309 with value: 0.8113132095609382.[0m
[32m[I 2022-04-21 17:37:36,518][0m Trial 350 finished with value: 0.7936177378682692 and parameters: {'splitter': 'best', 'min_samples_split': 0.22367705913821673, 'min_samples_leaf': 0.017637833478458924, 'min_weight_fraction_leaf': 0.042693238379302785, 'max_features': 0.9058057914868815}. Best is trial 309 with value: 0.8113132095609382.[0m
[32m[I 2022-04-21 17:37:37,210][0m Trial 351 finished with value: 0.7669759123387727 and parameters: {'splitter': 'random', 'min_samples_split': 0.4920127575677264, 'min_samples_leaf': 0.031936589712734664, 'min_weight_fraction_leaf': 0.009803109006676861, 'max_features': 0.964435426267807}. Best is trial 309 with value: 0.8113132095609382.[0m
[32m[I 2022-04-21 17:37:37,848][0m Trial 352 finished with value: 0.8034308649461976 and parameters: {'splitter': 'random', 'min_samples_split': 0.4770187736089844, 'min_samples_leaf': 0.051044097516285886, 'min_weight_fraction_leaf': 0.023810729126700514, 'max_features': 0.9262964340383723}. Best is trial 309 with value: 0.8113132095609382.[0m
[32m[I 2022-04-21 17:37:39,527][0m Trial 353 finished with value: 0.7991004406191502 and parameters: {'splitter': 'random', 'min_samples_split': 0.19512914170325918, 'min_samples_leaf': 0.023299847276481857, 'min_weight_fraction_leaf': 0.032922360337144164, 'max_features': 0.8797170017698036}. Best is trial 309 with value: 0.8113132095609382.[0m
[32m[I 2022-04-21 17:37:40,925][0m Trial 354 finished with value: 0.7951709218837852 and parameters: {'splitter': 'random', 'min_samples_split': 0.4625646143510131, 'min_samples_leaf': 0.010012146587674022, 'min_weight_fraction_leaf': 0.05997518444023121, 'max_features': 0.9844372186379384}. Best is trial 309 with value: 0.8113132095609382.[0m
[32m[I 2022-04-21 17:38:27,850][0m Trial 355 finished with value: 0.6924683586039395 and parameters: {'splitter': 'best', 'min_samples_split': 0.4509143698396605, 'min_samples_leaf': 0.03941681729233145, 'min_weight_fraction_leaf': 0.017660765069443484, 'max_features': 0.3345530402065312}. Best is trial 309 with value: 0.8113132095609382.[0m
[32m[I 2022-04-21 17:38:28,380][0m Trial 356 finished with value: 0.7826753799505408 and parameters: {'splitter': 'random', 'min_samples_split': 0.48593273529436926, 'min_samples_leaf': 0.018739066030001438, 'min_weight_fraction_leaf': 0.009667154235850756, 'max_features': 0.9042298118650856}. Best is trial 309 with value: 0.8113132095609382.[0m
[32m[I 2022-04-21 17:38:29,272][0m Trial 357 finished with value: 0.7997328877334624 and parameters: {'splitter': 'random', 'min_samples_split': 0.35283630846744296, 'min_samples_leaf': 0.001512487191426765, 'min_weight_fraction_leaf': 0.02518619825898709, 'max_features': 0.9306725293017492}. Best is trial 309 with value: 0.8113132095609382.[0m
[32m[I 2022-04-21 17:38:30,848][0m Trial 358 finished with value: 0.8015130700946372 and parameters: {'splitter': 'random', 'min_samples_split': 0.3226298664734268, 'min_samples_leaf': 0.028926591573238847, 'min_weight_fraction_leaf': 0.047022744169792574, 'max_features': 0.9489887515996106}. Best is trial 309 with value: 0.8113132095609382.[0m
[32m[I 2022-04-21 17:38:32,399][0m Trial 359 finished with value: 0.7975714877445785 and parameters: {'splitter': 'random', 'min_samples_split': 0.49951953363009555, 'min_samples_leaf': 0.012155304897489446, 'min_weight_fraction_leaf': 0.008916829596182679, 'max_features': 0.60641863795743}. Best is trial 309 with value: 0.8113132095609382.[0m
[32m[I 2022-04-21 17:40:22,545][0m Trial 360 finished with value: 0.7922767734150464 and parameters: {'splitter': 'best', 'min_samples_split': 0.2492139175422641, 'min_samples_leaf': 0.07014825792869718, 'min_weight_fraction_leaf': 0.00017209387045918553, 'max_features': 0.886846952566388}. Best is trial 309 with value: 0.8113132095609382.[0m
[32m[I 2022-04-21 17:40:23,003][0m Trial 361 finished with value: 0.7919927504282628 and parameters: {'splitter': 'random', 'min_samples_split': 0.4657941049419473, 'min_samples_leaf': 0.033961636946601245, 'min_weight_fraction_leaf': 0.03336435625918506, 'max_features': 0.6350835348287058}. Best is trial 309 with value: 0.8113132095609382.[0m
[32m[I 2022-04-21 17:40:23,651][0m Trial 362 finished with value: 0.8093784233342556 and parameters: {'splitter': 'random', 'min_samples_split': 0.473302155610018, 'min_samples_leaf': 0.022588728390680254, 'min_weight_fraction_leaf': 0.018745587183790956, 'max_features': 0.9181051818060275}. Best is trial 309 with value: 0.8113132095609382.[0m
[32m[I 2022-04-21 17:40:24,141][0m Trial 363 finished with value: 0.8034308649461976 and parameters: {'splitter': 'random', 'min_samples_split': 0.4734980907889206, 'min_samples_leaf': 0.04696526445834812, 'min_weight_fraction_leaf': 0.016036002989155668, 'max_features': 0.9207344401110743}. Best is trial 309 with value: 0.8113132095609382.[0m
[32m[I 2022-04-21 17:40:24,683][0m Trial 364 finished with value: 0.7826753799505408 and parameters: {'splitter': 'random', 'min_samples_split': 0.4817007739049983, 'min_samples_leaf': 0.0136002227236538, 'min_weight_fraction_leaf': 0.01582688485011071, 'max_features': 0.9042139072289892}. Best is trial 309 with value: 0.8113132095609382.[0m
[32m[I 2022-04-21 17:40:25,682][0m Trial 365 finished with value: 0.7822297967131655 and parameters: {'splitter': 'random', 'min_samples_split': 0.45887955510264106, 'min_samples_leaf': 0.027683014710692816, 'min_weight_fraction_leaf': 0.03614007863420952, 'max_features': 0.8472325127354112}. Best is trial 309 with value: 0.8113132095609382.[0m
[32m[I 2022-04-21 17:42:19,319][0m Trial 366 finished with value: 0.7722355105284119 and parameters: {'splitter': 'best', 'min_samples_split': 0.47297014141322014, 'min_samples_leaf': 0.0427870651795225, 'min_weight_fraction_leaf': 0.009020764335810168, 'max_features': 0.9406214025896461}. Best is trial 309 with value: 0.8113132095609382.[0m
[32m[I 2022-04-21 17:42:20,040][0m Trial 367 finished with value: 0.7951031913465975 and parameters: {'splitter': 'random', 'min_samples_split': 0.44693186816386804, 'min_samples_leaf': 0.010304175995472446, 'min_weight_fraction_leaf': 0.027757864143060276, 'max_features': 0.9994374418293305}. Best is trial 309 with value: 0.8113132095609382.[0m
[32m[I 2022-04-21 17:42:21,015][0m Trial 368 finished with value: 0.7774475066269884 and parameters: {'splitter': 'random', 'min_samples_split': 0.28830306292374697, 'min_samples_leaf': 0.001193257539033054, 'min_weight_fraction_leaf': 0.019132802897532115, 'max_features': 0.9664742450295227}. Best is trial 309 with value: 0.8113132095609382.[0m
