[32m[I 2022-04-25 18:45:29,143][0m Trial 128 finished with value: 0.8125147687854073 and parameters: {'n_hidden': 2048, 'mixture_components': 5, 'use_sparse_layer': True, 'use_sparse_loss': True, 'lmbd': 1.227666981975355e-05, 'use_batchnorm': False, 'use_dropout': False, 'mlp_size_1': 7, 'mlp_size_2': 1, 'mlp_size_3': 0, 'kernel': 'Logistic', 'loss_name': 'CensoredNLLLoss'}. Best is trial 96 with value: 0.8543418990987799.[0m
[32m[I 2022-04-25 18:50:23,432][0m Trial 129 finished with value: 0.852105091268759 and parameters: {'n_hidden': 2048, 'mixture_components': 5, 'use_sparse_layer': True, 'use_sparse_loss': True, 'lmbd': 4.7543495458914695e-05, 'use_batchnorm': False, 'use_dropout': False, 'mlp_size_1': 6, 'mlp_size_2': 1, 'mlp_size_3': 0, 'kernel': 'Logistic', 'loss_name': 'AlternativeNLLLoss'}. Best is trial 96 with value: 0.8543418990987799.[0m
[32m[I 2022-04-25 18:53:48,197][0m Trial 130 finished with value: 0.8428526820257678 and parameters: {'n_hidden': 512, 'mixture_components': 5, 'use_sparse_layer': True, 'use_sparse_loss': True, 'lmbd': 5.1221202312675865e-05, 'use_batchnorm': False, 'use_dropout': False, 'mlp_size_1': 6, 'mlp_size_2': 0, 'mlp_size_3': 0, 'kernel': 'Logistic', 'loss_name': 'CensoredNLLLoss'}. Best is trial 96 with value: 0.8543418990987799.[0m
[32m[I 2022-04-25 18:58:54,867][0m Trial 131 finished with value: 0.8535248092413159 and parameters: {'n_hidden': 2048, 'mixture_components': 5, 'use_sparse_layer': True, 'use_sparse_loss': True, 'lmbd': 1.0679383435972959e-05, 'use_batchnorm': False, 'use_dropout': False, 'mlp_size_1': 7, 'mlp_size_2': 1, 'mlp_size_3': 0, 'kernel': 'Logistic', 'loss_name': 'AlternativeNLLLoss'}. Best is trial 96 with value: 0.8543418990987799.[0m
[32m[I 2022-04-25 19:03:59,265][0m Trial 132 finished with value: 0.8521128326198631 and parameters: {'n_hidden': 2048, 'mixture_components': 5, 'use_sparse_layer': True, 'use_sparse_loss': True, 'lmbd': 8.391882956604183e-06, 'use_batchnorm': False, 'use_dropout': False, 'mlp_size_1': 7, 'mlp_size_2': 1, 'mlp_size_3': 0, 'kernel': 'Logistic', 'loss_name': 'AlternativeNLLLoss'}. Best is trial 96 with value: 0.8543418990987799.[0m
[32m[I 2022-04-25 19:09:35,132][0m Trial 133 finished with value: 0.8534764382500148 and parameters: {'n_hidden': 2048, 'mixture_components': 5, 'use_sparse_layer': True, 'use_sparse_loss': True, 'lmbd': 6.820424641839327e-06, 'use_batchnorm': False, 'use_dropout': False, 'mlp_size_1': 7, 'mlp_size_2': 1, 'mlp_size_3': 0, 'kernel': 'Logistic', 'loss_name': 'AlternativeNLLLoss'}. Best is trial 96 with value: 0.8543418990987799.[0m
[32m[I 2022-04-25 19:14:39,862][0m Trial 134 finished with value: 0.8532207949486083 and parameters: {'n_hidden': 2048, 'mixture_components': 5, 'use_sparse_layer': True, 'use_sparse_loss': True, 'lmbd': 5.7271326101278614e-06, 'use_batchnorm': False, 'use_dropout': False, 'mlp_size_1': 7, 'mlp_size_2': 1, 'mlp_size_3': 0, 'kernel': 'Logistic', 'loss_name': 'AlternativeNLLLoss'}. Best is trial 96 with value: 0.8543418990987799.[0m
[32m[I 2022-04-25 19:19:30,484][0m Trial 135 finished with value: 0.8124886924340269 and parameters: {'n_hidden': 2048, 'mixture_components': 5, 'use_sparse_layer': True, 'use_sparse_loss': True, 'lmbd': 6.8682204051718045e-06, 'use_batchnorm': False, 'use_dropout': False, 'mlp_size_1': 7, 'mlp_size_2': 1, 'mlp_size_3': 0, 'kernel': 'Logistic', 'loss_name': 'AlternativeNLLLoss'}. Best is trial 96 with value: 0.8543418990987799.[0m
[32m[I 2022-04-25 19:24:35,874][0m Trial 136 finished with value: 0.8521898421534347 and parameters: {'n_hidden': 2048, 'mixture_components': 5, 'use_sparse_layer': True, 'use_sparse_loss': True, 'lmbd': 1.7424953652642726e-05, 'use_batchnorm': False, 'use_dropout': False, 'mlp_size_1': 7, 'mlp_size_2': 1, 'mlp_size_3': 0, 'kernel': 'Logistic', 'loss_name': 'AlternativeNLLLoss'}. Best is trial 96 with value: 0.8543418990987799.[0m
[32m[I 2022-04-25 19:28:26,065][0m Trial 137 finished with value: 0.7064444927100738 and parameters: {'n_hidden': 2048, 'mixture_components': 5, 'use_sparse_layer': True, 'use_sparse_loss': True, 'lmbd': 4.864911093965661e-06, 'use_batchnorm': False, 'use_dropout': False, 'mlp_size_1': 7, 'mlp_size_2': 1, 'mlp_size_3': 0, 'kernel': 'Logistic', 'loss_name': 'AlternativeNLLLoss'}. Best is trial 96 with value: 0.8543418990987799.[0m
[32m[I 2022-04-25 19:32:13,379][0m Trial 138 finished with value: 0.8376847920098729 and parameters: {'n_hidden': 2048, 'mixture_components': 5, 'use_sparse_layer': True, 'use_sparse_loss': True, 'lmbd': 1.723668451066875e-05, 'use_batchnorm': False, 'use_dropout': True, 'dropout': 0.4327461276839011, 'mlp_size_1': 7, 'mlp_size_2': 1, 'mlp_size_3': 0, 'kernel': 'Logistic', 'loss_name': 'CensoredNLLLoss'}. Best is trial 96 with value: 0.8543418990987799.[0m
[32m[I 2022-04-25 19:41:28,708][0m Trial 139 finished with value: 0.8452234916982724 and parameters: {'n_hidden': 2048, 'mixture_components': 6, 'use_sparse_layer': True, 'use_sparse_loss': True, 'lmbd': 0.00011524034206917868, 'use_batchnorm': True, 'use_dropout': False, 'mlp_size_1': 7, 'mlp_size_2': 1, 'mlp_size_3': 0, 'kernel': 'Logistic', 'loss_name': 'AlternativeNLLLoss'}. Best is trial 96 with value: 0.8543418990987799.[0m
[32m[I 2022-04-25 19:47:04,893][0m Trial 140 finished with value: 0.8449679421634956 and parameters: {'n_hidden': 64, 'mixture_components': 5, 'use_sparse_layer': True, 'use_sparse_loss': True, 'lmbd': 2.7415364949482762e-06, 'use_batchnorm': False, 'use_dropout': False, 'mlp_size_1': 1, 'mlp_size_2': 1, 'mlp_size_3': 0, 'kernel': 'Logistic', 'loss_name': 'CensoredNLLLoss'}. Best is trial 96 with value: 0.8543418990987799.[0m
[32m[I 2022-04-25 19:52:09,408][0m Trial 141 finished with value: 0.8477469238728996 and parameters: {'n_hidden': 2048, 'mixture_components': 4, 'use_sparse_layer': True, 'use_sparse_loss': True, 'lmbd': 3.055897729847044e-05, 'use_batchnorm': False, 'use_dropout': False, 'mlp_size_1': 7, 'mlp_size_2': 1, 'mlp_size_3': 0, 'kernel': 'Logistic', 'loss_name': 'AlternativeNLLLoss'}. Best is trial 96 with value: 0.8543418990987799.[0m
[32m[I 2022-04-25 19:57:25,493][0m Trial 142 finished with value: 0.8079213134030218 and parameters: {'n_hidden': 2048, 'mixture_components': 4, 'use_sparse_layer': True, 'use_sparse_loss': True, 'lmbd': 7.214572530927565e-06, 'use_batchnorm': False, 'use_dropout': False, 'mlp_size_1': 7, 'mlp_size_2': 1, 'mlp_size_3': 0, 'kernel': 'Logistic', 'loss_name': 'AlternativeNLLLoss'}. Best is trial 96 with value: 0.8543418990987799.[0m
[32m[I 2022-04-25 20:01:16,223][0m Trial 143 finished with value: 0.8498483882922535 and parameters: {'n_hidden': 256, 'mixture_components': 5, 'use_sparse_layer': True, 'use_sparse_loss': True, 'lmbd': 6.72811776588264e-05, 'use_batchnorm': False, 'use_dropout': False, 'mlp_size_1': 5, 'mlp_size_2': 0, 'mlp_size_3': 0, 'kernel': 'Logistic', 'loss_name': 'AlternativeNLLLoss'}. Best is trial 96 with value: 0.8543418990987799.[0m
[32m[I 2022-04-25 20:06:08,946][0m Trial 144 finished with value: 0.8383979137472972 and parameters: {'n_hidden': 2048, 'mixture_components': 4, 'use_sparse_layer': True, 'use_sparse_loss': True, 'lmbd': 1.2060033902095532e-06, 'use_batchnorm': False, 'use_dropout': False, 'mlp_size_1': 7, 'mlp_size_2': 1, 'mlp_size_3': 0, 'kernel': 'Logistic', 'loss_name': 'AlternativeNLLLoss'}. Best is trial 96 with value: 0.8543418990987799.[0m
[32m[I 2022-04-25 20:12:05,915][0m Trial 145 finished with value: 0.8369823338874763 and parameters: {'n_hidden': 32, 'mixture_components': 3, 'use_sparse_layer': True, 'use_sparse_loss': True, 'lmbd': 2.1474142727018783e-05, 'use_batchnorm': False, 'use_dropout': False, 'mlp_size_1': 2, 'mlp_size_2': 0, 'mlp_size_3': 0, 'kernel': 'Logistic', 'loss_name': 'AlternativeNLLLoss'}. Best is trial 96 with value: 0.8543418990987799.[0m
[32m[I 2022-04-25 20:15:28,168][0m Trial 146 finished with value: 0.8412335313409478 and parameters: {'n_hidden': 512, 'mixture_components': 5, 'use_sparse_layer': True, 'use_sparse_loss': True, 'lmbd': 0.0017985415013500761, 'use_batchnorm': False, 'use_dropout': False, 'mlp_size_1': 6, 'mlp_size_2': 0, 'mlp_size_3': 0, 'kernel': 'Logistic', 'loss_name': 'AlternativeNLLLoss'}. Best is trial 96 with value: 0.8543418990987799.[0m
[32m[I 2022-04-25 20:20:49,570][0m Trial 147 finished with value: 0.8530763272909956 and parameters: {'n_hidden': 2048, 'mixture_components': 6, 'use_sparse_layer': True, 'use_sparse_loss': True, 'lmbd': 0.00020255310559979305, 'use_batchnorm': False, 'use_dropout': False, 'mlp_size_1': 7, 'mlp_size_2': 1, 'mlp_size_3': 0, 'kernel': 'Logistic', 'loss_name': 'AlternativeNLLLoss'}. Best is trial 96 with value: 0.8543418990987799.[0m
[32m[I 2022-04-25 20:25:19,544][0m Trial 148 finished with value: 0.8390145999973309 and parameters: {'n_hidden': 2048, 'mixture_components': 6, 'use_sparse_layer': True, 'use_sparse_loss': True, 'lmbd': 0.0002904143592993051, 'use_batchnorm': False, 'use_dropout': False, 'mlp_size_1': 7, 'mlp_size_2': 1, 'mlp_size_3': 0, 'kernel': 'Logistic', 'loss_name': 'NLLLoss'}. Best is trial 96 with value: 0.8543418990987799.[0m
[32m[I 2022-04-25 20:29:55,017][0m Trial 149 finished with value: 0.8378828942082773 and parameters: {'n_hidden': 2048, 'mixture_components': 6, 'use_sparse_layer': True, 'use_sparse_loss': True, 'lmbd': 0.00018596540181387973, 'use_batchnorm': False, 'use_dropout': False, 'mlp_size_1': 7, 'mlp_size_2': 1, 'mlp_size_3': 0, 'kernel': 'Logistic', 'loss_name': 'CensoredNLLLoss'}. Best is trial 96 with value: 0.8543418990987799.[0m
[32m[I 2022-04-25 20:33:39,424][0m Trial 150 finished with value: 0.8263481640785848 and parameters: {'n_hidden': 2048, 'mixture_components': 6, 'use_sparse_layer': True, 'use_sparse_loss': True, 'lmbd': 0.0016534148067820899, 'use_batchnorm': False, 'use_dropout': True, 'dropout': 0.25160843095039537, 'mlp_size_1': 7, 'mlp_size_2': 1, 'mlp_size_3': 0, 'kernel': 'Logistic', 'loss_name': 'AlternativeNLLLoss'}. Best is trial 96 with value: 0.8543418990987799.[0m
[32m[I 2022-04-25 20:39:10,376][0m Trial 151 finished with value: 0.849284886736578 and parameters: {'n_hidden': 2048, 'mixture_components': 5, 'use_sparse_layer': True, 'use_sparse_loss': True, 'lmbd': 8.207515572174145e-05, 'use_batchnorm': False, 'use_dropout': False, 'mlp_size_1': 7, 'mlp_size_2': 1, 'mlp_size_3': 0, 'kernel': 'Logistic', 'loss_name': 'AlternativeNLLLoss'}. Best is trial 96 with value: 0.8543418990987799.[0m
[32m[I 2022-04-25 20:43:43,363][0m Trial 152 finished with value: 0.8401737027881285 and parameters: {'n_hidden': 2048, 'mixture_components': 4, 'use_sparse_layer': True, 'use_sparse_loss': True, 'lmbd': 1.0478894144011369e-05, 'use_batchnorm': False, 'use_dropout': False, 'mlp_size_1': 7, 'mlp_size_2': 1, 'mlp_size_3': 0, 'kernel': 'Logistic', 'loss_name': 'AlternativeNLLLoss'}. Best is trial 96 with value: 0.8543418990987799.[0m
[32m[I 2022-04-25 20:48:53,964][0m Trial 153 finished with value: 0.8478431804011792 and parameters: {'n_hidden': 64, 'mixture_components': 5, 'use_sparse_layer': True, 'use_sparse_loss': True, 'lmbd': 5.216309013328359e-06, 'use_batchnorm': False, 'use_dropout': False, 'mlp_size_1': 3, 'mlp_size_2': 0, 'mlp_size_3': 0, 'kernel': 'Logistic', 'loss_name': 'AlternativeNLLLoss'}. Best is trial 96 with value: 0.8543418990987799.[0m
[32m[I 2022-04-25 20:53:16,490][0m Trial 154 finished with value: 0.8286445499667607 and parameters: {'n_hidden': 2048, 'mixture_components': 6, 'use_sparse_layer': True, 'use_sparse_loss': True, 'lmbd': 0.00046175963410973164, 'use_batchnorm': False, 'use_dropout': False, 'mlp_size_1': 7, 'mlp_size_2': 1, 'mlp_size_3': 0, 'kernel': 'Logistic', 'loss_name': 'AlternativeNLLLoss'}. Best is trial 96 with value: 0.8543418990987799.[0m
[32m[I 2022-04-25 20:59:23,435][0m Trial 155 finished with value: 0.8531801602303821 and parameters: {'n_hidden': 2048, 'mixture_components': 7, 'use_sparse_layer': True, 'use_sparse_loss': True, 'lmbd': 3.3051081888836514e-06, 'use_batchnorm': False, 'use_dropout': False, 'mlp_size_1': 7, 'mlp_size_2': 1, 'mlp_size_3': 0, 'kernel': 'Normal', 'loss_name': 'AlternativeNLLLoss'}. Best is trial 96 with value: 0.8543418990987799.[0m
[32m[I 2022-04-25 21:05:42,835][0m Trial 156 finished with value: 0.8522451308036711 and parameters: {'n_hidden': 2048, 'mixture_components': 7, 'use_sparse_layer': True, 'use_sparse_loss': True, 'lmbd': 3.1042208525321625e-06, 'use_batchnorm': False, 'use_dropout': False, 'mlp_size_1': 7, 'mlp_size_2': 1, 'mlp_size_3': 0, 'kernel': 'Normal', 'loss_name': 'CensoredNLLLoss'}. Best is trial 96 with value: 0.8543418990987799.[0m
[32m[I 2022-04-25 21:11:50,303][0m Trial 157 finished with value: 0.8489734514427336 and parameters: {'n_hidden': 2048, 'mixture_components': 7, 'use_sparse_layer': True, 'use_sparse_loss': True, 'lmbd': 3.080943006881224e-05, 'use_batchnorm': False, 'use_dropout': False, 'mlp_size_1': 7, 'mlp_size_2': 1, 'mlp_size_3': 0, 'kernel': 'Normal', 'loss_name': 'AlternativeNLLLoss'}. Best is trial 96 with value: 0.8543418990987799.[0m
[32m[I 2022-04-25 21:17:29,775][0m Trial 158 finished with value: 0.850175469657704 and parameters: {'n_hidden': 2048, 'mixture_components': 7, 'use_sparse_layer': True, 'use_sparse_loss': True, 'lmbd': 2.524559171129421e-06, 'use_batchnorm': False, 'use_dropout': False, 'mlp_size_1': 7, 'mlp_size_2': 1, 'mlp_size_3': 0, 'kernel': 'Normal', 'loss_name': 'CensoredNLLLoss'}. Best is trial 96 with value: 0.8543418990987799.[0m
[32m[I 2022-04-25 21:20:28,413][0m Trial 159 finished with value: -1.0 and parameters: {'n_hidden': 2048, 'mixture_components': 6, 'use_sparse_layer': True, 'use_sparse_loss': True, 'lmbd': 1.0618236258883475e-05, 'use_batchnorm': False, 'use_dropout': False, 'mlp_size_1': 7, 'mlp_size_2': 1, 'mlp_size_3': 0, 'kernel': 'Exponential', 'loss_name': 'AlternativeNLLLoss'}. Best is trial 96 with value: 0.8543418990987799.[0m
[32m[I 2022-04-25 21:26:02,181][0m Trial 160 finished with value: 0.8276293955043006 and parameters: {'n_hidden': 2048, 'mixture_components': 7, 'use_sparse_layer': True, 'use_sparse_loss': True, 'lmbd': 4.88215466966079e-06, 'use_batchnorm': False, 'use_dropout': False, 'mlp_size_1': 7, 'mlp_size_2': 1, 'mlp_size_3': 0, 'kernel': 'Normal', 'loss_name': 'CensoredNLLLoss'}. Best is trial 96 with value: 0.8543418990987799.[0m
[32m[I 2022-04-25 21:31:48,668][0m Trial 161 finished with value: 0.79084441964556 and parameters: {'n_hidden': 2048, 'mixture_components': 7, 'use_sparse_layer': True, 'use_sparse_loss': True, 'lmbd': 3.317174061069393e-06, 'use_batchnorm': False, 'use_dropout': False, 'mlp_size_1': 7, 'mlp_size_2': 1, 'mlp_size_3': 0, 'kernel': 'Normal', 'loss_name': 'CensoredNLLLoss'}. Best is trial 96 with value: 0.8543418990987799.[0m
[32m[I 2022-04-25 21:38:04,965][0m Trial 162 finished with value: 0.8526603320686515 and parameters: {'n_hidden': 2048, 'mixture_components': 7, 'use_sparse_layer': True, 'use_sparse_loss': True, 'lmbd': 1.6316911725209063e-05, 'use_batchnorm': False, 'use_dropout': False, 'mlp_size_1': 7, 'mlp_size_2': 1, 'mlp_size_3': 0, 'kernel': 'Normal', 'loss_name': 'CensoredNLLLoss'}. Best is trial 96 with value: 0.8543418990987799.[0m
[32m[I 2022-04-25 21:44:00,872][0m Trial 163 finished with value: 0.8518526865622233 and parameters: {'n_hidden': 2048, 'mixture_components': 7, 'use_sparse_layer': True, 'use_sparse_loss': True, 'lmbd': 1.7340235328418783e-05, 'use_batchnorm': False, 'use_dropout': False, 'mlp_size_1': 7, 'mlp_size_2': 1, 'mlp_size_3': 0, 'kernel': 'Normal', 'loss_name': 'CensoredNLLLoss'}. Best is trial 96 with value: 0.8543418990987799.[0m
[32m[I 2022-04-25 21:50:05,628][0m Trial 164 finished with value: 0.8523858849772872 and parameters: {'n_hidden': 2048, 'mixture_components': 7, 'use_sparse_layer': True, 'use_sparse_loss': True, 'lmbd': 2.9650728488370385e-05, 'use_batchnorm': False, 'use_dropout': False, 'mlp_size_1': 7, 'mlp_size_2': 1, 'mlp_size_3': 0, 'kernel': 'Normal', 'loss_name': 'CensoredNLLLoss'}. Best is trial 96 with value: 0.8543418990987799.[0m
[32m[I 2022-04-25 21:55:41,004][0m Trial 165 finished with value: 0.8534946789054931 and parameters: {'n_hidden': 2048, 'mixture_components': 5, 'use_sparse_layer': True, 'use_sparse_loss': True, 'lmbd': 1.2607311870726113e-05, 'use_batchnorm': False, 'use_dropout': False, 'mlp_size_1': 7, 'mlp_size_2': 1, 'mlp_size_3': 0, 'kernel': 'Normal', 'loss_name': 'CensoredNLLLoss'}. Best is trial 96 with value: 0.8543418990987799.[0m
[32m[I 2022-04-25 22:00:54,119][0m Trial 166 finished with value: 0.8078864419020014 and parameters: {'n_hidden': 2048, 'mixture_components': 5, 'use_sparse_layer': True, 'use_sparse_loss': True, 'lmbd': 1.2153440003110136e-05, 'use_batchnorm': False, 'use_dropout': False, 'mlp_size_1': 7, 'mlp_size_2': 1, 'mlp_size_3': 0, 'kernel': 'Normal', 'loss_name': 'AlternativeNLLLoss'}. Best is trial 96 with value: 0.8543418990987799.[0m
[32m[I 2022-04-25 22:07:05,571][0m Trial 167 finished with value: 0.8532503976075272 and parameters: {'n_hidden': 2048, 'mixture_components': 5, 'use_sparse_layer': True, 'use_sparse_loss': True, 'lmbd': 7.5322451783650905e-06, 'use_batchnorm': False, 'use_dropout': False, 'mlp_size_1': 7, 'mlp_size_2': 1, 'mlp_size_3': 0, 'kernel': 'Normal', 'loss_name': 'CensoredNLLLoss'}. Best is trial 96 with value: 0.8543418990987799.[0m
[32m[I 2022-04-25 22:10:52,345][0m Trial 168 finished with value: 0.23070614366836634 and parameters: {'n_hidden': 2048, 'mixture_components': 5, 'use_sparse_layer': True, 'use_sparse_loss': True, 'lmbd': 8.619765144557607e-06, 'use_batchnorm': True, 'use_dropout': True, 'dropout': 0.8897720436896678, 'mlp_size_1': 7, 'mlp_size_2': 1, 'mlp_size_3': 0, 'kernel': 'Normal', 'loss_name': 'AlternativeNLLLoss'}. Best is trial 96 with value: 0.8543418990987799.[0m
[32m[I 2022-04-25 22:16:57,317][0m Trial 169 finished with value: 0.840477493228096 and parameters: {'n_hidden': 2048, 'mixture_components': 5, 'use_sparse_layer': True, 'use_sparse_loss': True, 'lmbd': 6.3717611015416775e-06, 'use_batchnorm': False, 'use_dropout': False, 'mlp_size_1': 8, 'mlp_size_2': 0, 'mlp_size_3': 0, 'kernel': 'Normal', 'loss_name': 'CensoredNLLLoss'}. Best is trial 96 with value: 0.8543418990987799.[0m
[32m[I 2022-04-25 22:23:00,405][0m Trial 170 finished with value: 0.8540579383972228 and parameters: {'n_hidden': 2048, 'mixture_components': 5, 'use_sparse_layer': True, 'use_sparse_loss': True, 'lmbd': 1.3388308061554649e-05, 'use_batchnorm': False, 'use_dropout': False, 'mlp_size_1': 7, 'mlp_size_2': 1, 'mlp_size_3': 0, 'kernel': 'Normal', 'loss_name': 'AlternativeNLLLoss'}. Best is trial 96 with value: 0.8543418990987799.[0m
[32m[I 2022-04-25 22:28:14,075][0m Trial 171 finished with value: 0.8244212448534982 and parameters: {'n_hidden': 2048, 'mixture_components': 5, 'use_sparse_layer': True, 'use_sparse_loss': True, 'lmbd': 1.564575697816931e-05, 'use_batchnorm': False, 'use_dropout': False, 'mlp_size_1': 7, 'mlp_size_2': 1, 'mlp_size_3': 0, 'kernel': 'Normal', 'loss_name': 'AlternativeNLLLoss'}. Best is trial 96 with value: 0.8543418990987799.[0m
[32m[I 2022-04-25 22:33:48,689][0m Trial 172 finished with value: 0.7310422147347859 and parameters: {'n_hidden': 2048, 'mixture_components': 5, 'use_sparse_layer': True, 'use_sparse_loss': True, 'lmbd': 9.481216047861524e-06, 'use_batchnorm': False, 'use_dropout': False, 'mlp_size_1': 7, 'mlp_size_2': 1, 'mlp_size_3': 0, 'kernel': 'Normal', 'loss_name': 'AlternativeNLLLoss'}. Best is trial 96 with value: 0.8543418990987799.[0m
[32m[I 2022-04-25 22:39:07,717][0m Trial 173 finished with value: 0.8504436116857585 and parameters: {'n_hidden': 2048, 'mixture_components': 5, 'use_sparse_layer': True, 'use_sparse_loss': True, 'lmbd': 2.2936792446273923e-05, 'use_batchnorm': False, 'use_dropout': False, 'mlp_size_1': 7, 'mlp_size_2': 1, 'mlp_size_3': 0, 'kernel': 'Normal', 'loss_name': 'AlternativeNLLLoss'}. Best is trial 96 with value: 0.8543418990987799.[0m
[32m[I 2022-04-25 22:45:10,996][0m Trial 174 finished with value: 0.850536740781717 and parameters: {'n_hidden': 2048, 'mixture_components': 5, 'use_sparse_layer': True, 'use_sparse_loss': True, 'lmbd': 1.8185644830749066e-06, 'use_batchnorm': False, 'use_dropout': False, 'mlp_size_1': 7, 'mlp_size_2': 1, 'mlp_size_3': 0, 'kernel': 'Normal', 'loss_name': 'AlternativeNLLLoss'}. Best is trial 96 with value: 0.8543418990987799.[0m
[32m[I 2022-04-25 22:51:15,211][0m Trial 175 finished with value: 0.8522610881937436 and parameters: {'n_hidden': 2048, 'mixture_components': 5, 'use_sparse_layer': True, 'use_sparse_loss': True, 'lmbd': 4.707701870482814e-05, 'use_batchnorm': False, 'use_dropout': False, 'mlp_size_1': 7, 'mlp_size_2': 1, 'mlp_size_3': 0, 'kernel': 'Normal', 'loss_name': 'AlternativeNLLLoss'}. Best is trial 96 with value: 0.8543418990987799.[0m
[32m[I 2022-04-25 22:56:44,087][0m Trial 176 finished with value: 0.84811303318344 and parameters: {'n_hidden': 2048, 'mixture_components': 6, 'use_sparse_layer': True, 'use_sparse_loss': True, 'lmbd': 1.325037141540116e-05, 'use_batchnorm': False, 'use_dropout': False, 'mlp_size_1': 7, 'mlp_size_2': 1, 'mlp_size_3': 0, 'kernel': 'Normal', 'loss_name': 'CensoredNLLLoss'}. Best is trial 96 with value: 0.8543418990987799.[0m
[32m[I 2022-04-25 23:03:12,120][0m Trial 177 finished with value: 0.8390438657341626 and parameters: {'n_hidden': 64, 'mixture_components': 5, 'use_sparse_layer': True, 'use_sparse_loss': True, 'lmbd': 4.4536138413741435e-06, 'use_batchnorm': False, 'use_dropout': False, 'mlp_size_1': 1, 'mlp_size_2': 1, 'mlp_size_3': 0, 'kernel': 'Normal', 'loss_name': 'AlternativeNLLLoss'}. Best is trial 96 with value: 0.8543418990987799.[0m
