[32m[I 2022-05-19 14:33:10,209][0m Trial 915 finished with value: 0.7622252038747479 and parameters: {'loss': 'coxph', 'learning_rate': 0.07626686989292594, 'n_estimators': 165, 'criterion': 'friedman_mse', 'min_samples_split': 3, 'min_samples_leaf': 3, 'min_weight_fraction_leaf': 0.02696226595291913, 'min_impurity_decrease': 0.5366023242026667, 'max_features': 0.6496805154067171, 'subsample': 0.15497096581203607, 'dropout_rate': 0.0571645877964386, 'ccp_alpha': 0.1681907844855712}. Best is trial 899 with value: 0.8627512492330924.[0m
[32m[I 2022-05-19 14:40:53,735][0m Trial 916 finished with value: 0.7397649314446237 and parameters: {'loss': 'coxph', 'learning_rate': 0.08043258056477093, 'n_estimators': 181, 'criterion': 'friedman_mse', 'min_samples_split': 3, 'min_samples_leaf': 3, 'min_weight_fraction_leaf': 0.02000021897653968, 'min_impurity_decrease': 0.5211663395919389, 'max_features': 0.6574647134463343, 'subsample': 0.15245548433948794, 'dropout_rate': 0.03536905316003831, 'ccp_alpha': 0.24462085972107245}. Best is trial 899 with value: 0.8627512492330924.[0m
[32m[I 2022-05-19 14:47:45,640][0m Trial 917 finished with value: 0.7900869412975473 and parameters: {'loss': 'coxph', 'learning_rate': 0.06856269239672554, 'n_estimators': 161, 'criterion': 'friedman_mse', 'min_samples_split': 3, 'min_samples_leaf': 3, 'min_weight_fraction_leaf': 0.03264446807401351, 'min_impurity_decrease': 0.4928447735686805, 'max_features': 0.6348806014880564, 'subsample': 0.15242131682389498, 'dropout_rate': 0.00020579780731210234, 'ccp_alpha': 0.0995824740468844}. Best is trial 899 with value: 0.8627512492330924.[0m
[32m[I 2022-05-19 14:55:10,059][0m Trial 918 finished with value: 0.7990311628829423 and parameters: {'loss': 'coxph', 'learning_rate': 0.09451562106047433, 'n_estimators': 171, 'criterion': 'friedman_mse', 'min_samples_split': 3, 'min_samples_leaf': 3, 'min_weight_fraction_leaf': 0.04677693675614873, 'min_impurity_decrease': 0.4964309448313714, 'max_features': 0.6474731966942343, 'subsample': 0.14024266950925166, 'dropout_rate': 0.019868090981507425, 'ccp_alpha': 0.09559499196970313}. Best is trial 899 with value: 0.8627512492330924.[0m
[32m[I 2022-05-19 15:01:38,646][0m Trial 919 finished with value: 0.7939734630119186 and parameters: {'loss': 'coxph', 'learning_rate': 0.07770212686629514, 'n_estimators': 154, 'criterion': 'friedman_mse', 'min_samples_split': 3, 'min_samples_leaf': 3, 'min_weight_fraction_leaf': 0.024113079085196443, 'min_impurity_decrease': 0.5253025110828493, 'max_features': 0.6480878262466382, 'subsample': 0.16342064746362217, 'dropout_rate': 0.048861832695321114, 'ccp_alpha': 0.09006583281913542}. Best is trial 899 with value: 0.8627512492330924.[0m
[32m[I 2022-05-19 15:08:20,822][0m Trial 920 finished with value: 0.7629598295595723 and parameters: {'loss': 'coxph', 'learning_rate': 0.0971166470714818, 'n_estimators': 157, 'criterion': 'friedman_mse', 'min_samples_split': 3, 'min_samples_leaf': 3, 'min_weight_fraction_leaf': 0.03964499439402958, 'min_impurity_decrease': 0.5565614172555879, 'max_features': 0.6168992123558661, 'subsample': 0.14688598832265795, 'dropout_rate': 0.033792896781132856, 'ccp_alpha': 0.17704251741331506}. Best is trial 899 with value: 0.8627512492330924.[0m
[32m[I 2022-05-19 15:14:46,324][0m Trial 921 finished with value: 0.5 and parameters: {'loss': 'coxph', 'learning_rate': 0.09831507840690967, 'n_estimators': 150, 'criterion': 'friedman_mse', 'min_samples_split': 3, 'min_samples_leaf': 3, 'min_weight_fraction_leaf': 0.012870973923804728, 'min_impurity_decrease': 0.5110612886808101, 'max_features': 0.6030953330023419, 'subsample': 0.13770955342124622, 'dropout_rate': 0.019192990388194477, 'ccp_alpha': 2.601104680308691}. Best is trial 899 with value: 0.8627512492330924.[0m
[32m[I 2022-05-19 15:22:15,235][0m Trial 922 finished with value: 0.8011815716144953 and parameters: {'loss': 'coxph', 'learning_rate': 0.06892921286664855, 'n_estimators': 176, 'criterion': 'friedman_mse', 'min_samples_split': 3, 'min_samples_leaf': 3, 'min_weight_fraction_leaf': 0.030511844891668118, 'min_impurity_decrease': 0.5332051490949885, 'max_features': 0.5917883826085453, 'subsample': 0.15777825182720695, 'dropout_rate': 0.07367968509469734, 'ccp_alpha': 0.09530782278440432}. Best is trial 899 with value: 0.8627512492330924.[0m
[32m[I 2022-05-19 15:29:26,627][0m Trial 923 finished with value: 0.7446316241415264 and parameters: {'loss': 'coxph', 'learning_rate': 0.06442397723484856, 'n_estimators': 165, 'criterion': 'friedman_mse', 'min_samples_split': 3, 'min_samples_leaf': 3, 'min_weight_fraction_leaf': 0.01981814783284697, 'min_impurity_decrease': 0.5687951783049217, 'max_features': 0.6122433720775, 'subsample': 0.12947493151394865, 'dropout_rate': 0.017294009359666074, 'ccp_alpha': 0.23828389899620994}. Best is trial 899 with value: 0.8627512492330924.[0m
[32m[I 2022-05-19 15:35:44,232][0m Trial 924 finished with value: 0.5 and parameters: {'loss': 'coxph', 'learning_rate': 0.05837469405201492, 'n_estimators': 146, 'criterion': 'squared_error', 'min_samples_split': 3, 'min_samples_leaf': 3, 'min_weight_fraction_leaf': 0.04986532876492299, 'min_impurity_decrease': 0.5567145188299553, 'max_features': 0.6462586539422129, 'subsample': 0.13021055390045924, 'dropout_rate': 0.0006060602208848784, 'ccp_alpha': 2.8149101526645564}. Best is trial 899 with value: 0.8627512492330924.[0m
/media/san2_ssd/data/Workdir/survival/venv/lib/python3.8/site-packages/sksurv/ensemble/boosting.py:955: RuntimeWarning: divide by zero encountered in log
  time = numpy.log(time)
/media/san2_ssd/data/Workdir/survival/venv/lib/python3.8/site-packages/sksurv/ensemble/boosting.py:955: RuntimeWarning: divide by zero encountered in log
  time = numpy.log(time)
/media/san2_ssd/data/Workdir/survival/venv/lib/python3.8/site-packages/sksurv/ensemble/boosting.py:955: RuntimeWarning: divide by zero encountered in log
  time = numpy.log(time)
/media/san2_ssd/data/Workdir/survival/venv/lib/python3.8/site-packages/sksurv/ensemble/boosting.py:955: RuntimeWarning: divide by zero encountered in log
  time = numpy.log(time)
/media/san2_ssd/data/Workdir/survival/venv/lib/python3.8/site-packages/sksurv/ensemble/boosting.py:955: RuntimeWarning: divide by zero encountered in log
  time = numpy.log(time)
[32m[I 2022-05-19 15:35:44,315][0m Trial 925 finished with value: -1.0 and parameters: {'loss': 'squared', 'learning_rate': 0.07782591574624786, 'n_estimators': 158, 'criterion': 'friedman_mse', 'min_samples_split': 3, 'min_samples_leaf': 3, 'min_weight_fraction_leaf': 0.03950003185863564, 'min_impurity_decrease': 0.5771747928483592, 'max_features': 0.5829225940015286, 'subsample': 0.16080319282018868, 'dropout_rate': 0.04876450850627226, 'ccp_alpha': 0.07994243320075758}. Best is trial 899 with value: 0.8627512492330924.[0m
[32m[I 2022-05-19 15:43:09,806][0m Trial 926 finished with value: 0.7394998058809559 and parameters: {'loss': 'coxph', 'learning_rate': 0.05460769438280822, 'n_estimators': 169, 'criterion': 'friedman_mse', 'min_samples_split': 3, 'min_samples_leaf': 3, 'min_weight_fraction_leaf': 0.011191889496574712, 'min_impurity_decrease': 0.585694880755032, 'max_features': 0.5630635614304165, 'subsample': 0.1188456554317611, 'dropout_rate': 0.03622759666720285, 'ccp_alpha': 0.3581064637267074}. Best is trial 899 with value: 0.8627512492330924.[0m
[32m[I 2022-05-19 15:49:29,014][0m Trial 927 finished with value: 0.7605309280144456 and parameters: {'loss': 'coxph', 'learning_rate': 0.07978955153182168, 'n_estimators': 147, 'criterion': 'friedman_mse', 'min_samples_split': 3, 'min_samples_leaf': 3, 'min_weight_fraction_leaf': 0.029142363545889227, 'min_impurity_decrease': 0.4741423325545831, 'max_features': 0.006173499317336961, 'subsample': 0.13216507275210623, 'dropout_rate': 0.01838657650322928, 'ccp_alpha': 0.16569589912854732}. Best is trial 899 with value: 0.8627512492330924.[0m
[32m[I 2022-05-19 15:57:22,452][0m Trial 928 finished with value: 0.8566625849566979 and parameters: {'loss': 'coxph', 'learning_rate': 0.06479690087829451, 'n_estimators': 183, 'criterion': 'friedman_mse', 'min_samples_split': 3, 'min_samples_leaf': 3, 'min_weight_fraction_leaf': 0.021582254504485594, 'min_impurity_decrease': 0.5590008277108712, 'max_features': 0.6170056535142873, 'subsample': 0.15580985217431376, 'dropout_rate': 0.06593241076869047, 'ccp_alpha': 0.0054820778451161525}. Best is trial 899 with value: 0.8627512492330924.[0m
[32m[I 2022-05-19 16:05:13,182][0m Trial 929 finished with value: 0.8560683703600415 and parameters: {'loss': 'coxph', 'learning_rate': 0.06972573705402799, 'n_estimators': 187, 'criterion': 'friedman_mse', 'min_samples_split': 3, 'min_samples_leaf': 3, 'min_weight_fraction_leaf': 0.015814505761353934, 'min_impurity_decrease': 0.539225620157012, 'max_features': 0.648365001937824, 'subsample': 0.18465763453389156, 'dropout_rate': 0.08357715522514662, 'ccp_alpha': 0.004312091653810126}. Best is trial 899 with value: 0.8627512492330924.[0m
[32m[I 2022-05-19 16:13:28,473][0m Trial 930 finished with value: 0.7403654531057985 and parameters: {'loss': 'coxph', 'learning_rate': 0.08617054815077328, 'n_estimators': 197, 'criterion': 'friedman_mse', 'min_samples_split': 3, 'min_samples_leaf': 3, 'min_weight_fraction_leaf': 0.008590821148317301, 'min_impurity_decrease': 0.5500140036046609, 'max_features': 0.6223388039592919, 'subsample': 0.17480296627228176, 'dropout_rate': 0.06628238418113333, 'ccp_alpha': 0.24952286595049042}. Best is trial 899 with value: 0.8627512492330924.[0m
[32m[I 2022-05-19 16:21:20,762][0m Trial 931 finished with value: 0.8570797108103478 and parameters: {'loss': 'coxph', 'learning_rate': 0.06397769350035325, 'n_estimators': 184, 'criterion': 'friedman_mse', 'min_samples_split': 3, 'min_samples_leaf': 3, 'min_weight_fraction_leaf': 0.02300262663938607, 'min_impurity_decrease': 0.5627469166384043, 'max_features': 0.6161518615368263, 'subsample': 0.16764363720829262, 'dropout_rate': 0.05270773575636889, 'ccp_alpha': 0.002417714435616743}. Best is trial 899 with value: 0.8627512492330924.[0m
[32m[I 2022-05-19 16:28:46,546][0m Trial 932 finished with value: 0.7626242759960601 and parameters: {'loss': 'coxph', 'learning_rate': 0.09674314046445534, 'n_estimators': 181, 'criterion': 'friedman_mse', 'min_samples_split': 3, 'min_samples_leaf': 3, 'min_weight_fraction_leaf': 0.0023513590616183293, 'min_impurity_decrease': 0.5198568382202685, 'max_features': 0.6198004070387494, 'subsample': 0.1929753074654697, 'dropout_rate': 0.07123534452016464, 'ccp_alpha': 0.17089070241096435}. Best is trial 899 with value: 0.8627512492330924.[0m
[32m[I 2022-05-19 16:36:34,748][0m Trial 933 finished with value: 0.7923915025965179 and parameters: {'loss': 'coxph', 'learning_rate': 0.06935843769037262, 'n_estimators': 185, 'criterion': 'friedman_mse', 'min_samples_split': 3, 'min_samples_leaf': 3, 'min_weight_fraction_leaf': 0.020008056617191357, 'min_impurity_decrease': 0.5014397715411874, 'max_features': 0.6355397737235632, 'subsample': 0.16813628621259952, 'dropout_rate': 0.08684560024371285, 'ccp_alpha': 0.09060701612857805}. Best is trial 899 with value: 0.8627512492330924.[0m
[32m[I 2022-05-19 16:43:44,446][0m Trial 934 finished with value: 0.762446887533015 and parameters: {'loss': 'coxph', 'learning_rate': 0.06369722276521865, 'n_estimators': 174, 'criterion': 'friedman_mse', 'min_samples_split': 3, 'min_samples_leaf': 3, 'min_weight_fraction_leaf': 0.040894456934162854, 'min_impurity_decrease': 0.5469003294458461, 'max_features': 0.5979090631539646, 'subsample': 0.18847816875696105, 'dropout_rate': 0.06729360603747463, 'ccp_alpha': 0.1762690076203266}. Best is trial 899 with value: 0.8627512492330924.[0m
[32m[I 2022-05-19 16:52:40,465][0m Trial 935 finished with value: 0.7962662361618159 and parameters: {'loss': 'coxph', 'learning_rate': 0.09787393467052784, 'n_estimators': 210, 'criterion': 'friedman_mse', 'min_samples_split': 3, 'min_samples_leaf': 3, 'min_weight_fraction_leaf': 0.05082889479311474, 'min_impurity_decrease': 0.5596616151019773, 'max_features': 0.6468647075750957, 'subsample': 0.16837602315508915, 'dropout_rate': 0.04599522648935198, 'ccp_alpha': 0.08921430047464896}. Best is trial 899 with value: 0.8627512492330924.[0m
[32m[I 2022-05-19 17:01:22,716][0m Trial 936 finished with value: 0.8556885917420566 and parameters: {'loss': 'coxph', 'learning_rate': 0.050759217688381694, 'n_estimators': 201, 'criterion': 'friedman_mse', 'min_samples_split': 3, 'min_samples_leaf': 3, 'min_weight_fraction_leaf': 0.00967954624562023, 'min_impurity_decrease': 0.5648697660872999, 'max_features': 0.6119097616963719, 'subsample': 0.1592039067343506, 'dropout_rate': 0.058526594372167666, 'ccp_alpha': 0.005586132355193258}. Best is trial 899 with value: 0.8627512492330924.[0m
[32m[I 2022-05-19 17:08:26,298][0m Trial 937 finished with value: 0.7391975032646316 and parameters: {'loss': 'coxph', 'learning_rate': 0.07587475645897027, 'n_estimators': 176, 'criterion': 'friedman_mse', 'min_samples_split': 3, 'min_samples_leaf': 3, 'min_weight_fraction_leaf': 0.03341692406475809, 'min_impurity_decrease': 0.5742034867396067, 'max_features': 0.5989110957262234, 'subsample': 0.21032105321671352, 'dropout_rate': 0.048918354599726585, 'ccp_alpha': 0.3068479908144302}. Best is trial 899 with value: 0.8627512492330924.[0m
[32m[I 2022-05-19 17:15:42,995][0m Trial 938 finished with value: 0.8586838631357603 and parameters: {'loss': 'coxph', 'learning_rate': 0.06196588014099429, 'n_estimators': 169, 'criterion': 'friedman_mse', 'min_samples_split': 3, 'min_samples_leaf': 3, 'min_weight_fraction_leaf': 0.022267248306486354, 'min_impurity_decrease': 0.5313159173127545, 'max_features': 0.6168602246005951, 'subsample': 0.1586236169610713, 'dropout_rate': 0.0345914013835946, 'ccp_alpha': 0.004427901522243606}. Best is trial 899 with value: 0.8627512492330924.[0m
[32m[I 2022-05-19 17:22:40,453][0m Trial 939 finished with value: 0.8569323088317884 and parameters: {'loss': 'coxph', 'learning_rate': 0.06628139408922075, 'n_estimators': 167, 'criterion': 'friedman_mse', 'min_samples_split': 3, 'min_samples_leaf': 3, 'min_weight_fraction_leaf': 0.019435304753205016, 'min_impurity_decrease': 0.5069672459200479, 'max_features': 0.6344498445104246, 'subsample': 0.18898478393201493, 'dropout_rate': 0.06848971809858817, 'ccp_alpha': 0.00228202289296253}. Best is trial 899 with value: 0.8627512492330924.[0m
[32m[I 2022-05-19 17:30:23,739][0m Trial 940 finished with value: 0.7624456717099986 and parameters: {'loss': 'coxph', 'learning_rate': 0.06402659240090763, 'n_estimators': 190, 'criterion': 'friedman_mse', 'min_samples_split': 3, 'min_samples_leaf': 3, 'min_weight_fraction_leaf': 0.016856811557699674, 'min_impurity_decrease': 0.5122637870136247, 'max_features': 0.6431025989588728, 'subsample': 0.2050376719360045, 'dropout_rate': 0.09001037124666787, 'ccp_alpha': 0.16735459515828618}. Best is trial 899 with value: 0.8627512492330924.[0m
[32m[I 2022-05-19 17:37:41,081][0m Trial 941 finished with value: 0.7993087357136955 and parameters: {'loss': 'coxph', 'learning_rate': 0.09907999754096583, 'n_estimators': 176, 'criterion': 'friedman_mse', 'min_samples_split': 3, 'min_samples_leaf': 3, 'min_weight_fraction_leaf': 0.0016942117799138429, 'min_impurity_decrease': 0.48027099041129007, 'max_features': 0.6314455949601933, 'subsample': 0.18369328640879834, 'dropout_rate': 0.0771953774160022, 'ccp_alpha': 0.09533281828494757}. Best is trial 899 with value: 0.8627512492330924.[0m
[32m[I 2022-05-19 17:44:32,710][0m Trial 942 finished with value: 0.5 and parameters: {'loss': 'coxph', 'learning_rate': 0.0770473134268688, 'n_estimators': 169, 'criterion': 'friedman_mse', 'min_samples_split': 3, 'min_samples_leaf': 3, 'min_weight_fraction_leaf': 0.019104968029406987, 'min_impurity_decrease': 0.4947401826089803, 'max_features': 0.6577460160558295, 'subsample': 0.19313485433387592, 'dropout_rate': 0.0649749907612367, 'ccp_alpha': 0.698038969890391}. Best is trial 899 with value: 0.8627512492330924.[0m
[32m[I 2022-05-19 17:51:01,811][0m Trial 943 finished with value: 0.7395444899627648 and parameters: {'loss': 'coxph', 'learning_rate': 0.06030135779730548, 'n_estimators': 165, 'criterion': 'friedman_mse', 'min_samples_split': 3, 'min_samples_leaf': 3, 'min_weight_fraction_leaf': 0.022803181844660063, 'min_impurity_decrease': 0.5288921204278852, 'max_features': 0.6255412719214055, 'subsample': 0.2288355593654377, 'dropout_rate': 0.08192505877115762, 'ccp_alpha': 0.251818550866858}. Best is trial 899 with value: 0.8627512492330924.[0m
[32m[I 2022-05-19 17:58:04,918][0m Trial 944 finished with value: 0.8576357297566745 and parameters: {'loss': 'coxph', 'learning_rate': 0.0794953063817616, 'n_estimators': 168, 'criterion': 'friedman_mse', 'min_samples_split': 3, 'min_samples_leaf': 3, 'min_weight_fraction_leaf': 0.009364123294759632, 'min_impurity_decrease': 0.529095232362546, 'max_features': 0.6204507412856188, 'subsample': 0.1799446508948577, 'dropout_rate': 0.05764299071348908, 'ccp_alpha': 0.003095955771457829}. Best is trial 899 with value: 0.8627512492330924.[0m
/media/san2_ssd/data/Workdir/survival/venv/lib/python3.8/site-packages/sksurv/ensemble/boosting.py:955: RuntimeWarning: divide by zero encountered in log
  time = numpy.log(time)
/media/san2_ssd/data/Workdir/survival/venv/lib/python3.8/site-packages/sksurv/ensemble/boosting.py:955: RuntimeWarning: divide by zero encountered in log
  time = numpy.log(time)
/media/san2_ssd/data/Workdir/survival/venv/lib/python3.8/site-packages/sksurv/ensemble/boosting.py:955: RuntimeWarning: divide by zero encountered in log
  time = numpy.log(time)
/media/san2_ssd/data/Workdir/survival/venv/lib/python3.8/site-packages/sksurv/ensemble/boosting.py:955: RuntimeWarning: divide by zero encountered in log
  time = numpy.log(time)
/media/san2_ssd/data/Workdir/survival/venv/lib/python3.8/site-packages/sksurv/ensemble/boosting.py:955: RuntimeWarning: divide by zero encountered in log
  time = numpy.log(time)
[32m[I 2022-05-19 17:58:05,002][0m Trial 945 finished with value: -1.0 and parameters: {'loss': 'squared', 'learning_rate': 0.08067240607296321, 'n_estimators': 162, 'criterion': 'squared_error', 'min_samples_split': 3, 'min_samples_leaf': 3, 'min_weight_fraction_leaf': 0.008037290213090159, 'min_impurity_decrease': 0.51730519859573, 'max_features': 0.6357710776532005, 'subsample': 0.20683919079549737, 'dropout_rate': 0.04912088227089134, 'ccp_alpha': 0.15905760621752243}. Best is trial 899 with value: 0.8627512492330924.[0m
[32m[I 2022-05-19 18:04:48,929][0m Trial 946 finished with value: 0.7756858257094071 and parameters: {'loss': 'coxph', 'learning_rate': 0.07867441531399783, 'n_estimators': 167, 'criterion': 'friedman_mse', 'min_samples_split': 3, 'min_samples_leaf': 3, 'min_weight_fraction_leaf': 0.009750114262655839, 'min_impurity_decrease': 0.4970402512045386, 'max_features': 0.6552302444608215, 'subsample': 0.2076286300927873, 'dropout_rate': 0.04151684342052178, 'ccp_alpha': 0.09549783917289213}. Best is trial 899 with value: 0.8627512492330924.[0m
[32m[I 2022-05-19 18:11:58,728][0m Trial 947 finished with value: 0.8586378670034567 and parameters: {'loss': 'coxph', 'learning_rate': 0.0984958730843367, 'n_estimators': 171, 'criterion': 'friedman_mse', 'min_samples_split': 3, 'min_samples_leaf': 3, 'min_weight_fraction_leaf': 0.0010225874154638388, 'min_impurity_decrease': 0.5387474881266674, 'max_features': 0.6079214324803628, 'subsample': 0.18281614851439293, 'dropout_rate': 0.054764809857208246, 'ccp_alpha': 0.0029161944863284515}. Best is trial 899 with value: 0.8627512492330924.[0m
[32m[I 2022-05-19 18:18:41,054][0m Trial 948 finished with value: 0.5 and parameters: {'loss': 'coxph', 'learning_rate': 0.09909452873896919, 'n_estimators': 171, 'criterion': 'friedman_mse', 'min_samples_split': 3, 'min_samples_leaf': 3, 'min_weight_fraction_leaf': 0.0011195700138606874, 'min_impurity_decrease': 0.5312309015479221, 'max_features': 0.6079204011286082, 'subsample': 0.22687318241332383, 'dropout_rate': 0.08433321674908253, 'ccp_alpha': 0.4198393688143051}. Best is trial 899 with value: 0.8627512492330924.[0m
[32m[I 2022-05-19 18:25:28,861][0m Trial 949 finished with value: 0.7395101701335326 and parameters: {'loss': 'coxph', 'learning_rate': 0.09866697556018723, 'n_estimators': 168, 'criterion': 'friedman_mse', 'min_samples_split': 3, 'min_samples_leaf': 3, 'min_weight_fraction_leaf': 0.009640445956899713, 'min_impurity_decrease': 0.531838717366574, 'max_features': 0.6167483072246063, 'subsample': 0.19851936778375573, 'dropout_rate': 0.09032140602632661, 'ccp_alpha': 0.25733379458645955}. Best is trial 899 with value: 0.8627512492330924.[0m
[32m[I 2022-05-19 18:33:00,513][0m Trial 950 finished with value: 0.7975324190789003 and parameters: {'loss': 'coxph', 'learning_rate': 0.07811025130607893, 'n_estimators': 181, 'criterion': 'friedman_mse', 'min_samples_split': 3, 'min_samples_leaf': 3, 'min_weight_fraction_leaf': 0.0032247997296188397, 'min_impurity_decrease': 0.5050859116970823, 'max_features': 0.6356996628788961, 'subsample': 0.1811678870099565, 'dropout_rate': 0.061103382337003125, 'ccp_alpha': 0.09634937392047248}. Best is trial 899 with value: 0.8627512492330924.[0m
[32m[I 2022-05-19 18:40:21,196][0m Trial 951 finished with value: 0.8579480539212708 and parameters: {'loss': 'coxph', 'learning_rate': 0.07941707184860619, 'n_estimators': 176, 'criterion': 'friedman_mse', 'min_samples_split': 3, 'min_samples_leaf': 3, 'min_weight_fraction_leaf': 0.011972680130365447, 'min_impurity_decrease': 0.47861331134108076, 'max_features': 0.606107863316363, 'subsample': 0.18911034253675907, 'dropout_rate': 0.061275235415597484, 'ccp_alpha': 0.0025270696745894714}. Best is trial 899 with value: 0.8627512492330924.[0m
