[32m[I 2022-04-21 18:10:06,061][0m Trial 936 finished with value: 0.7991857362369337 and parameters: {'splitter': 'random', 'min_samples_split': 0.19833046026942988, 'min_samples_leaf': 0.046726163101400736, 'min_weight_fraction_leaf': 0.08247023193474311, 'max_features': 0.8910890993387971}. Best is trial 841 with value: 0.81405645651816.[0m
[32m[I 2022-04-21 18:10:07,452][0m Trial 937 finished with value: 0.768574227297895 and parameters: {'splitter': 'random', 'min_samples_split': 0.2067962100811891, 'min_samples_leaf': 0.0628541267028024, 'min_weight_fraction_leaf': 0.11213245375873501, 'max_features': 0.9244661566774454}. Best is trial 841 with value: 0.81405645651816.[0m
[32m[I 2022-04-21 18:10:08,676][0m Trial 938 finished with value: 0.81405645651816 and parameters: {'splitter': 'random', 'min_samples_split': 0.19065684461788251, 'min_samples_leaf': 0.058773112321636, 'min_weight_fraction_leaf': 0.09459815393223134, 'max_features': 0.9135166958776187}. Best is trial 841 with value: 0.81405645651816.[0m
[32m[I 2022-04-21 18:10:10,030][0m Trial 939 finished with value: 0.7714019223406113 and parameters: {'splitter': 'random', 'min_samples_split': 0.18489163248468646, 'min_samples_leaf': 0.04684742272896443, 'min_weight_fraction_leaf': 0.09886338050627613, 'max_features': 0.9576338866597305}. Best is trial 841 with value: 0.81405645651816.[0m
[32m[I 2022-04-21 18:12:31,103][0m Trial 940 finished with value: 0.7686460849469195 and parameters: {'splitter': 'best', 'min_samples_split': 0.1734767427332297, 'min_samples_leaf': 0.025361045000678206, 'min_weight_fraction_leaf': 0.0727223511191057, 'max_features': 0.9318189764644323}. Best is trial 841 with value: 0.81405645651816.[0m
[32m[I 2022-04-21 18:12:31,629][0m Trial 941 finished with value: 0.804727850752705 and parameters: {'splitter': 'random', 'min_samples_split': 0.19218116576406163, 'min_samples_leaf': 0.06419791642156567, 'min_weight_fraction_leaf': 0.10208214234273638, 'max_features': 0.9773217749328754}. Best is trial 841 with value: 0.81405645651816.[0m
[32m[I 2022-04-21 18:12:32,417][0m Trial 942 finished with value: 0.7752835040527123 and parameters: {'splitter': 'random', 'min_samples_split': 0.18295370822272913, 'min_samples_leaf': 0.05823668523223299, 'min_weight_fraction_leaf': 0.11803989817084531, 'max_features': 0.868836147806381}. Best is trial 841 with value: 0.81405645651816.[0m
[32m[I 2022-04-21 18:12:34,058][0m Trial 943 finished with value: 0.8115153744138326 and parameters: {'splitter': 'random', 'min_samples_split': 0.16117986881566893, 'min_samples_leaf': 0.05193855563038504, 'min_weight_fraction_leaf': 0.09048916890179241, 'max_features': 0.9124673203736301}. Best is trial 841 with value: 0.81405645651816.[0m
[32m[I 2022-04-21 18:12:35,493][0m Trial 944 finished with value: 0.7762683710639544 and parameters: {'splitter': 'random', 'min_samples_split': 0.20165806105255313, 'min_samples_leaf': 0.04114727436287789, 'min_weight_fraction_leaf': 0.09166780462352196, 'max_features': 0.8796724929021729}. Best is trial 841 with value: 0.81405645651816.[0m
[32m[I 2022-04-21 18:12:37,029][0m Trial 945 finished with value: 0.7723776342856198 and parameters: {'splitter': 'random', 'min_samples_split': 0.1718226812192989, 'min_samples_leaf': 0.05455539984664288, 'min_weight_fraction_leaf': 0.1042142999718231, 'max_features': 0.8534516943050635}. Best is trial 841 with value: 0.81405645651816.[0m
[32m[I 2022-04-21 18:12:38,070][0m Trial 946 finished with value: 0.7982919779568716 and parameters: {'splitter': 'random', 'min_samples_split': 0.18460075350818284, 'min_samples_leaf': 0.03798273539882833, 'min_weight_fraction_leaf': 0.08487155573096461, 'max_features': 0.8947370571035164}. Best is trial 841 with value: 0.81405645651816.[0m
[32m[I 2022-04-21 18:12:38,892][0m Trial 947 finished with value: 0.7993115714817124 and parameters: {'splitter': 'random', 'min_samples_split': 0.1903182152142283, 'min_samples_leaf': 0.070672179189675, 'min_weight_fraction_leaf': 0.07716251680178346, 'max_features': 0.902567219928432}. Best is trial 841 with value: 0.81405645651816.[0m
[32m[I 2022-04-21 18:12:40,329][0m Trial 948 finished with value: 0.7571150653891973 and parameters: {'splitter': 'random', 'min_samples_split': 0.20176640146743094, 'min_samples_leaf': 0.06248316266142604, 'min_weight_fraction_leaf': 0.11585775679284985, 'max_features': 0.9410229163718776}. Best is trial 841 with value: 0.81405645651816.[0m
[32m[I 2022-04-21 18:12:41,545][0m Trial 949 finished with value: 0.8026252493996646 and parameters: {'splitter': 'random', 'min_samples_split': 0.17356544012501343, 'min_samples_leaf': 0.04958572023847366, 'min_weight_fraction_leaf': 0.09677039509094494, 'max_features': 0.9190150632797981}. Best is trial 841 with value: 0.81405645651816.[0m
[32m[I 2022-04-21 18:12:42,604][0m Trial 950 finished with value: 0.8118348628302042 and parameters: {'splitter': 'random', 'min_samples_split': 0.19272612036128994, 'min_samples_leaf': 0.03665408148713047, 'min_weight_fraction_leaf': 0.08393718108478052, 'max_features': 0.9118958277327885}. Best is trial 841 with value: 0.81405645651816.[0m
[32m[I 2022-04-21 18:12:43,280][0m Trial 951 finished with value: 0.7226849701002491 and parameters: {'splitter': 'random', 'min_samples_split': 0.18943921656409698, 'min_samples_leaf': 0.027438693190883823, 'min_weight_fraction_leaf': 0.08783088573472345, 'max_features': 0.3514374852294373}. Best is trial 841 with value: 0.81405645651816.[0m
[32m[I 2022-04-21 18:12:44,081][0m Trial 952 finished with value: 0.7701589543847446 and parameters: {'splitter': 'random', 'min_samples_split': 0.1828387872078259, 'min_samples_leaf': 0.03595584568938714, 'min_weight_fraction_leaf': 0.08314627360548286, 'max_features': 0.8769218211659187}. Best is trial 841 with value: 0.81405645651816.[0m
[32m[I 2022-04-21 18:12:45,072][0m Trial 953 finished with value: 0.7950481493355436 and parameters: {'splitter': 'random', 'min_samples_split': 0.19785372322096392, 'min_samples_leaf': 0.026062534877920325, 'min_weight_fraction_leaf': 0.10900249275782056, 'max_features': 0.8926444805154631}. Best is trial 841 with value: 0.81405645651816.[0m
[32m[I 2022-04-21 18:12:46,124][0m Trial 954 finished with value: 0.8026252493996646 and parameters: {'splitter': 'random', 'min_samples_split': 0.1633621946206369, 'min_samples_leaf': 0.03643931616492922, 'min_weight_fraction_leaf': 0.09785964286510587, 'max_features': 0.9094431296205584}. Best is trial 841 with value: 0.81405645651816.[0m
[32m[I 2022-04-21 18:12:47,286][0m Trial 955 finished with value: 0.8004809897354652 and parameters: {'splitter': 'random', 'min_samples_split': 0.1949411639497288, 'min_samples_leaf': 0.02421260708961005, 'min_weight_fraction_leaf': 0.07818145364062398, 'max_features': 0.9491161821520988}. Best is trial 841 with value: 0.81405645651816.[0m
[32m[I 2022-04-21 18:12:48,289][0m Trial 956 finished with value: 0.7720801546226492 and parameters: {'splitter': 'random', 'min_samples_split': 0.14371347144222846, 'min_samples_leaf': 0.038117694747376814, 'min_weight_fraction_leaf': 0.09196417363752538, 'max_features': 0.8746600338641244}. Best is trial 841 with value: 0.81405645651816.[0m
[32m[I 2022-04-21 18:12:49,193][0m Trial 957 finished with value: 0.7922666996614897 and parameters: {'splitter': 'random', 'min_samples_split': 0.20737809905973625, 'min_samples_leaf': 0.04775770021886483, 'min_weight_fraction_leaf': 0.08336287117091049, 'max_features': 0.9361135440678587}. Best is trial 841 with value: 0.81405645651816.[0m
[32m[I 2022-04-21 18:12:49,924][0m Trial 958 finished with value: 0.6851609036733942 and parameters: {'splitter': 'random', 'min_samples_split': 0.17620601364497743, 'min_samples_leaf': 0.04386278253055678, 'min_weight_fraction_leaf': 0.3047353765932861, 'max_features': 0.8448099012624165}. Best is trial 841 with value: 0.81405645651816.[0m
[32m[I 2022-04-21 18:12:50,754][0m Trial 959 finished with value: 0.7955548541161894 and parameters: {'splitter': 'random', 'min_samples_split': 0.1810055285734298, 'min_samples_leaf': 0.05385693347563488, 'min_weight_fraction_leaf': 0.10344297823113222, 'max_features': 0.8933337230210937}. Best is trial 841 with value: 0.81405645651816.[0m
[32m[I 2022-04-21 18:12:51,563][0m Trial 960 finished with value: 0.7658405528004703 and parameters: {'splitter': 'random', 'min_samples_split': 0.20340741336998017, 'min_samples_leaf': 0.033137114642069074, 'min_weight_fraction_leaf': 0.13459035600790054, 'max_features': 0.9186273972869501}. Best is trial 841 with value: 0.81405645651816.[0m
[32m[I 2022-04-21 18:14:40,071][0m Trial 961 finished with value: 0.7797482763180699 and parameters: {'splitter': 'best', 'min_samples_split': 0.1961754201304819, 'min_samples_leaf': 0.0462851198385574, 'min_weight_fraction_leaf': 0.09382636793362106, 'max_features': 0.9677625930192122}. Best is trial 841 with value: 0.81405645651816.[0m
[32m[I 2022-04-21 18:14:40,972][0m Trial 962 finished with value: 0.6851609036733942 and parameters: {'splitter': 'random', 'min_samples_split': 0.19280372063578555, 'min_samples_leaf': 0.02889301112588015, 'min_weight_fraction_leaf': 0.3275125676663452, 'max_features': 0.9441046727464989}. Best is trial 841 with value: 0.81405645651816.[0m
[32m[I 2022-04-21 18:14:41,935][0m Trial 963 finished with value: 0.7669765669570419 and parameters: {'splitter': 'random', 'min_samples_split': 0.1686677035337888, 'min_samples_leaf': 0.022825360475932005, 'min_weight_fraction_leaf': 0.11932446452858242, 'max_features': 0.9087813588412857}. Best is trial 841 with value: 0.81405645651816.[0m
[32m[I 2022-04-21 18:14:42,509][0m Trial 964 finished with value: 0.6851609036733942 and parameters: {'splitter': 'random', 'min_samples_split': 0.18452776756445355, 'min_samples_leaf': 0.05716869803827529, 'min_weight_fraction_leaf': 0.27516506880207536, 'max_features': 0.8856214541016065}. Best is trial 841 with value: 0.81405645651816.[0m
[32m[I 2022-04-21 18:14:43,373][0m Trial 965 finished with value: 0.810095230018675 and parameters: {'splitter': 'random', 'min_samples_split': 0.21108429430424436, 'min_samples_leaf': 0.04134880747494346, 'min_weight_fraction_leaf': 0.08054208436104146, 'max_features': 0.9212954002373098}. Best is trial 841 with value: 0.81405645651816.[0m
[32m[I 2022-04-21 18:14:44,243][0m Trial 966 finished with value: 0.8006369606719289 and parameters: {'splitter': 'random', 'min_samples_split': 0.18943747096648958, 'min_samples_leaf': 0.06867916718122179, 'min_weight_fraction_leaf': 0.07050399227984665, 'max_features': 0.8993868177390317}. Best is trial 841 with value: 0.81405645651816.[0m
[32m[I 2022-04-21 18:14:45,287][0m Trial 967 finished with value: 0.811172459749413 and parameters: {'splitter': 'random', 'min_samples_split': 0.17900222419262196, 'min_samples_leaf': 0.020994727338038047, 'min_weight_fraction_leaf': 0.06976726791491299, 'max_features': 0.9832074934492763}. Best is trial 841 with value: 0.81405645651816.[0m
[32m[I 2022-04-21 18:14:46,135][0m Trial 968 finished with value: 0.7608782133457546 and parameters: {'splitter': 'random', 'min_samples_split': 0.19955164473418383, 'min_samples_leaf': 0.03452493050436047, 'min_weight_fraction_leaf': 0.16933797137800688, 'max_features': 0.9532697661828572}. Best is trial 841 with value: 0.81405645651816.[0m
[32m[I 2022-04-21 18:14:46,868][0m Trial 969 finished with value: 0.8107576242447273 and parameters: {'splitter': 'random', 'min_samples_split': 0.20648987119892284, 'min_samples_leaf': 0.053697981976318754, 'min_weight_fraction_leaf': 0.08960483706939469, 'max_features': 0.9287320850429434}. Best is trial 841 with value: 0.81405645651816.[0m
[32m[I 2022-04-21 18:14:47,357][0m Trial 970 finished with value: 0.7768649483984913 and parameters: {'splitter': 'random', 'min_samples_split': 0.19215991174350316, 'min_samples_leaf': 0.059214016467815114, 'min_weight_fraction_leaf': 0.10496605841591011, 'max_features': 0.8653914207847586}. Best is trial 841 with value: 0.81405645651816.[0m
[32m[I 2022-04-21 18:14:47,939][0m Trial 971 finished with value: 0.8059322031277507 and parameters: {'splitter': 'random', 'min_samples_split': 0.21033445903964396, 'min_samples_leaf': 0.045821790054174735, 'min_weight_fraction_leaf': 0.07945114623306704, 'max_features': 0.9361948964729853}. Best is trial 841 with value: 0.81405645651816.[0m
[32m[I 2022-04-21 18:14:48,487][0m Trial 972 finished with value: 0.7583888457217192 and parameters: {'splitter': 'random', 'min_samples_split': 0.15942146415551856, 'min_samples_leaf': 0.06367985890696007, 'min_weight_fraction_leaf': 0.09785394467843482, 'max_features': 0.8328568232310384}. Best is trial 841 with value: 0.81405645651816.[0m
[32m[I 2022-04-21 18:14:49,463][0m Trial 973 finished with value: 0.8118071124607781 and parameters: {'splitter': 'random', 'min_samples_split': 0.17079433241435402, 'min_samples_leaf': 0.053190551800611136, 'min_weight_fraction_leaf': 0.08557780840566317, 'max_features': 0.9085671939724709}. Best is trial 841 with value: 0.81405645651816.[0m
[32m[I 2022-04-21 18:14:50,343][0m Trial 974 finished with value: 0.7971668024681263 and parameters: {'splitter': 'random', 'min_samples_split': 0.147013705992491, 'min_samples_leaf': 0.03951435068348521, 'min_weight_fraction_leaf': 0.07794501972761816, 'max_features': 0.8884803397177364}. Best is trial 841 with value: 0.81405645651816.[0m
[32m[I 2022-04-21 18:14:51,167][0m Trial 975 finished with value: 0.8118071124607781 and parameters: {'splitter': 'random', 'min_samples_split': 0.15582901139735444, 'min_samples_leaf': 0.04999223934711915, 'min_weight_fraction_leaf': 0.08475699442147049, 'max_features': 0.9082072060894495}. Best is trial 841 with value: 0.81405645651816.[0m
[32m[I 2022-04-21 18:14:52,077][0m Trial 976 finished with value: 0.771366849611596 and parameters: {'splitter': 'random', 'min_samples_split': 0.13639347201643148, 'min_samples_leaf': 0.04620635907906844, 'min_weight_fraction_leaf': 0.08790258999881886, 'max_features': 0.8610577444113797}. Best is trial 841 with value: 0.81405645651816.[0m
[32m[I 2022-04-21 18:14:52,975][0m Trial 977 finished with value: 0.771366849611596 and parameters: {'splitter': 'random', 'min_samples_split': 0.15132888863661476, 'min_samples_leaf': 0.05064315976659981, 'min_weight_fraction_leaf': 0.08792000217660338, 'max_features': 0.8820209879621046}. Best is trial 841 with value: 0.81405645651816.[0m
[32m[I 2022-04-21 18:14:53,698][0m Trial 978 finished with value: 0.796464483701099 and parameters: {'splitter': 'random', 'min_samples_split': 0.1588753806128771, 'min_samples_leaf': 0.03635132079251829, 'min_weight_fraction_leaf': 0.09855110150792312, 'max_features': 0.8941258517079481}. Best is trial 841 with value: 0.81405645651816.[0m
[32m[I 2022-04-21 18:16:42,298][0m Trial 979 finished with value: 0.775843076070473 and parameters: {'splitter': 'best', 'min_samples_split': 0.1543133871284204, 'min_samples_leaf': 0.05117351927637627, 'min_weight_fraction_leaf': 0.08073351556608019, 'max_features': 0.9059659809750752}. Best is trial 841 with value: 0.81405645651816.[0m
[32m[I 2022-04-21 18:16:42,861][0m Trial 980 finished with value: 0.7758676430167728 and parameters: {'splitter': 'random', 'min_samples_split': 0.14314850206186333, 'min_samples_leaf': 0.024093772788670174, 'min_weight_fraction_leaf': 0.10843386833865916, 'max_features': 0.875829744290231}. Best is trial 841 with value: 0.81405645651816.[0m
[32m[I 2022-04-21 18:16:43,798][0m Trial 981 finished with value: 0.8118071124607781 and parameters: {'splitter': 'random', 'min_samples_split': 0.16517144806702214, 'min_samples_leaf': 0.0342952843406206, 'min_weight_fraction_leaf': 0.08609913468746208, 'max_features': 0.9100831414635776}. Best is trial 841 with value: 0.81405645651816.[0m
[32m[I 2022-04-21 18:16:44,578][0m Trial 982 finished with value: 0.7897404182326776 and parameters: {'splitter': 'random', 'min_samples_split': 0.1628039393358539, 'min_samples_leaf': 0.02282724799359724, 'min_weight_fraction_leaf': 0.09730367020532785, 'max_features': 0.8483293720288816}. Best is trial 841 with value: 0.81405645651816.[0m
[32m[I 2022-04-21 18:16:45,714][0m Trial 983 finished with value: 0.81330893366864 and parameters: {'splitter': 'random', 'min_samples_split': 0.16982652730980688, 'min_samples_leaf': 0.03144434263941303, 'min_weight_fraction_leaf': 0.0751791011383143, 'max_features': 0.9118189068082185}. Best is trial 841 with value: 0.81405645651816.[0m
[32m[I 2022-04-21 18:16:46,369][0m Trial 984 finished with value: 0.8136777308354739 and parameters: {'splitter': 'random', 'min_samples_split': 0.1698700492554117, 'min_samples_leaf': 0.026346555428477164, 'min_weight_fraction_leaf': 0.07209841695561428, 'max_features': 0.9283598266020713}. Best is trial 841 with value: 0.81405645651816.[0m
[32m[I 2022-04-21 18:16:47,054][0m Trial 985 finished with value: 0.7922172949223686 and parameters: {'splitter': 'random', 'min_samples_split': 0.17408149919541854, 'min_samples_leaf': 0.01909438981654908, 'min_weight_fraction_leaf': 0.07211883107190538, 'max_features': 0.9605107907077928}. Best is trial 841 with value: 0.81405645651816.[0m
[32m[I 2022-04-21 18:16:47,825][0m Trial 986 finished with value: 0.8014664542297467 and parameters: {'splitter': 'random', 'min_samples_split': 0.17614583425655497, 'min_samples_leaf': 0.029808838412297277, 'min_weight_fraction_leaf': 0.07236492249050933, 'max_features': 0.9412933562336865}. Best is trial 841 with value: 0.81405645651816.[0m
[32m[I 2022-04-21 18:16:49,050][0m Trial 987 finished with value: 0.814216204003355 and parameters: {'splitter': 'random', 'min_samples_split': 0.16757347345383158, 'min_samples_leaf': 0.016931189695610048, 'min_weight_fraction_leaf': 0.06830819473749297, 'max_features': 0.929829119479573}. Best is trial 987 with value: 0.814216204003355.[0m
[32m[I 2022-04-21 18:16:50,820][0m Trial 988 finished with value: 0.7972079173554942 and parameters: {'splitter': 'random', 'min_samples_split': 0.16505895873123652, 'min_samples_leaf': 0.014002880773981315, 'min_weight_fraction_leaf': 0.06835866287289788, 'max_features': 0.9660856175755801}. Best is trial 987 with value: 0.814216204003355.[0m
[32m[I 2022-04-21 18:16:52,855][0m Trial 989 finished with value: 0.8123313604570471 and parameters: {'splitter': 'random', 'min_samples_split': 0.16591575776076076, 'min_samples_leaf': 0.01742197324099293, 'min_weight_fraction_leaf': 0.06744196450842371, 'max_features': 0.9884921491761605}. Best is trial 987 with value: 0.814216204003355.[0m
[32m[I 2022-04-21 18:16:53,830][0m Trial 990 finished with value: 0.8123313604570471 and parameters: {'splitter': 'random', 'min_samples_split': 0.15375447780194273, 'min_samples_leaf': 0.021999166213642122, 'min_weight_fraction_leaf': 0.0673134193805997, 'max_features': 0.9894399987019143}. Best is trial 987 with value: 0.814216204003355.[0m
[32m[I 2022-04-21 18:16:55,095][0m Trial 991 finished with value: 0.8112608144456873 and parameters: {'splitter': 'random', 'min_samples_split': 0.14299883995919027, 'min_samples_leaf': 0.01073770440960088, 'min_weight_fraction_leaf': 0.0688814252325292, 'max_features': 0.9978158678720601}. Best is trial 987 with value: 0.814216204003355.[0m
[32m[I 2022-04-21 18:16:56,262][0m Trial 992 finished with value: 0.8105578435284831 and parameters: {'splitter': 'random', 'min_samples_split': 0.14770270128276755, 'min_samples_leaf': 0.015702303582082317, 'min_weight_fraction_leaf': 0.0660999957585135, 'max_features': 0.9994100645223818}. Best is trial 987 with value: 0.814216204003355.[0m
[32m[I 2022-04-21 18:16:57,063][0m Trial 993 finished with value: 0.8111398242727826 and parameters: {'splitter': 'random', 'min_samples_split': 0.15976563250162276, 'min_samples_leaf': 0.004137898213283267, 'min_weight_fraction_leaf': 0.07013759750702478, 'max_features': 0.9859786709382814}. Best is trial 987 with value: 0.814216204003355.[0m
[32m[I 2022-04-21 18:16:57,814][0m Trial 994 finished with value: 0.81065975309549 and parameters: {'splitter': 'random', 'min_samples_split': 0.13581489307309477, 'min_samples_leaf': 0.01370125567836048, 'min_weight_fraction_leaf': 0.06574286635329496, 'max_features': 0.9929300116496985}. Best is trial 987 with value: 0.814216204003355.[0m
[32m[I 2022-04-21 18:16:58,680][0m Trial 995 finished with value: 0.8096684771780506 and parameters: {'splitter': 'random', 'min_samples_split': 0.1571090126308267, 'min_samples_leaf': 0.01755371160378106, 'min_weight_fraction_leaf': 0.06464826352385908, 'max_features': 0.9952074921210184}. Best is trial 987 with value: 0.814216204003355.[0m
[32m[I 2022-04-21 18:16:59,484][0m Trial 996 finished with value: 0.8105574210015632 and parameters: {'splitter': 'random', 'min_samples_split': 0.1326709145690298, 'min_samples_leaf': 0.021034430855655345, 'min_weight_fraction_leaf': 0.07441704807513819, 'max_features': 0.9945360106770137}. Best is trial 987 with value: 0.814216204003355.[0m
[32m[I 2022-04-21 18:17:00,531][0m Trial 997 finished with value: 0.8111398242727826 and parameters: {'splitter': 'random', 'min_samples_split': 0.15422361512617283, 'min_samples_leaf': 0.015102374073672955, 'min_weight_fraction_leaf': 0.07016241804027924, 'max_features': 0.9795590792992462}. Best is trial 987 with value: 0.814216204003355.[0m
[32m[I 2022-04-21 18:19:20,426][0m Trial 998 finished with value: 0.7757701047512134 and parameters: {'splitter': 'best', 'min_samples_split': 0.14689594914802367, 'min_samples_leaf': 0.022877305447477393, 'min_weight_fraction_leaf': 0.07573780021020168, 'max_features': 0.9890737443750922}. Best is trial 987 with value: 0.814216204003355.[0m
