[32m[I 2022-04-21 12:00:18,928][0m Trial 124 finished with value: 0.902140109659386 and parameters: {'splitter': 'random', 'min_samples_split': 0.049335917110600834, 'min_samples_leaf': 0.04412721643368906, 'min_weight_fraction_leaf': 0.029542209467318073, 'max_features': 0.9020465424755334}. Best is trial 55 with value: 0.9086552789532311.[0m
[32m[I 2022-04-21 12:00:20,518][0m Trial 125 finished with value: 0.9052787105007816 and parameters: {'splitter': 'random', 'min_samples_split': 0.014125454121927415, 'min_samples_leaf': 0.0712523498846023, 'min_weight_fraction_leaf': 0.0004906806972828082, 'max_features': 0.976929961790723}. Best is trial 55 with value: 0.9086552789532311.[0m
[32m[I 2022-04-21 12:00:21,585][0m Trial 126 finished with value: 0.9057190707266007 and parameters: {'splitter': 'random', 'min_samples_split': 0.06937389932760589, 'min_samples_leaf': 0.03116063944747912, 'min_weight_fraction_leaf': 0.08865377147494058, 'max_features': 0.9291290829152968}. Best is trial 55 with value: 0.9086552789532311.[0m
[32m[I 2022-04-21 12:00:22,616][0m Trial 127 finished with value: 0.9068256577302423 and parameters: {'splitter': 'random', 'min_samples_split': 0.08681025771267677, 'min_samples_leaf': 0.033009635007377885, 'min_weight_fraction_leaf': 0.09209558480964936, 'max_features': 0.9176085726483866}. Best is trial 55 with value: 0.9086552789532311.[0m
[32m[I 2022-04-21 12:00:24,468][0m Trial 128 finished with value: 0.8772129199342136 and parameters: {'splitter': 'random', 'min_samples_split': 0.11174802700295072, 'min_samples_leaf': 0.030325132077879006, 'min_weight_fraction_leaf': 0.11248472808578577, 'max_features': 0.83986089218635}. Best is trial 55 with value: 0.9086552789532311.[0m
[32m[I 2022-04-21 12:00:25,659][0m Trial 129 finished with value: 0.8850062337572423 and parameters: {'splitter': 'random', 'min_samples_split': 0.08954366065042199, 'min_samples_leaf': 0.06210111605217446, 'min_weight_fraction_leaf': 0.09040965856146291, 'max_features': 0.8722965209609227}. Best is trial 55 with value: 0.9086552789532311.[0m
[32m[I 2022-04-21 12:00:26,535][0m Trial 130 finished with value: 0.8916529360693985 and parameters: {'splitter': 'random', 'min_samples_split': 0.0837269064196276, 'min_samples_leaf': 0.04960648870850863, 'min_weight_fraction_leaf': 0.10270534008050733, 'max_features': 0.9195878683287287}. Best is trial 55 with value: 0.9086552789532311.[0m
[32m[I 2022-04-21 12:00:27,585][0m Trial 131 finished with value: 0.9010747749856449 and parameters: {'splitter': 'random', 'min_samples_split': 0.060458851367623245, 'min_samples_leaf': 0.01963135439055186, 'min_weight_fraction_leaf': 0.08059473505977377, 'max_features': 0.9437654229634936}. Best is trial 55 with value: 0.9086552789532311.[0m
[32m[I 2022-04-21 12:00:28,505][0m Trial 132 finished with value: 0.9003825648926451 and parameters: {'splitter': 'random', 'min_samples_split': 0.07269025381774893, 'min_samples_leaf': 0.03563729050232537, 'min_weight_fraction_leaf': 0.07004780690154704, 'max_features': 0.6341061590075098}. Best is trial 55 with value: 0.9086552789532311.[0m
[32m[I 2022-04-21 12:00:30,325][0m Trial 133 finished with value: 0.9063150089472296 and parameters: {'splitter': 'random', 'min_samples_split': 0.06751833740598508, 'min_samples_leaf': 0.010700138465970127, 'min_weight_fraction_leaf': 0.05674456257186216, 'max_features': 0.9159106547788082}. Best is trial 55 with value: 0.9086552789532311.[0m
[32m[I 2022-04-21 12:00:32,236][0m Trial 134 finished with value: 0.8993212043793811 and parameters: {'splitter': 'random', 'min_samples_split': 0.26240009484098903, 'min_samples_leaf': 0.024511884000592954, 'min_weight_fraction_leaf': 0.05834019197229081, 'max_features': 0.8921177002835697}. Best is trial 55 with value: 0.9086552789532311.[0m
[32m[I 2022-04-21 12:00:33,557][0m Trial 135 finished with value: 0.9002203016602127 and parameters: {'splitter': 'random', 'min_samples_split': 0.06815310565273021, 'min_samples_leaf': 0.01145948654132224, 'min_weight_fraction_leaf': 0.04138842717421904, 'max_features': 0.8590807721776358}. Best is trial 55 with value: 0.9086552789532311.[0m
[32m[I 2022-04-21 12:00:34,942][0m Trial 136 finished with value: 0.9060020889765367 and parameters: {'splitter': 'random', 'min_samples_split': 0.20239806074230876, 'min_samples_leaf': 0.03914322896008352, 'min_weight_fraction_leaf': 0.051076563640643814, 'max_features': 0.9187847045781967}. Best is trial 55 with value: 0.9086552789532311.[0m
[32m[I 2022-04-21 12:00:36,553][0m Trial 137 finished with value: 0.9047083501638242 and parameters: {'splitter': 'random', 'min_samples_split': 0.1991864865218996, 'min_samples_leaf': 0.03922241543561019, 'min_weight_fraction_leaf': 0.04633924720851161, 'max_features': 0.918394866068726}. Best is trial 55 with value: 0.9086552789532311.[0m
[32m[I 2022-04-21 12:02:47,224][0m Trial 138 finished with value: 0.8918339680415375 and parameters: {'splitter': 'best', 'min_samples_split': 0.15778961369912387, 'min_samples_leaf': 0.05331677308076889, 'min_weight_fraction_leaf': 0.06731230868410233, 'max_features': 0.8852794270605576}. Best is trial 55 with value: 0.9086552789532311.[0m
[32m[I 2022-04-21 12:02:48,724][0m Trial 139 finished with value: 0.8804391066728773 and parameters: {'splitter': 'random', 'min_samples_split': 0.03462760430612978, 'min_samples_leaf': 0.028127748008396635, 'min_weight_fraction_leaf': 0.14958985914276385, 'max_features': 0.9364166258289676}. Best is trial 55 with value: 0.9086552789532311.[0m
[32m[I 2022-04-21 12:02:50,256][0m Trial 140 finished with value: 0.8797245818194697 and parameters: {'splitter': 'random', 'min_samples_split': 0.29058774262839643, 'min_samples_leaf': 0.20584017880812644, 'min_weight_fraction_leaf': 0.054685565867465695, 'max_features': 0.9111631019895794}. Best is trial 55 with value: 0.9086552789532311.[0m
[32m[I 2022-04-21 12:02:52,383][0m Trial 141 finished with value: 0.9046928582960954 and parameters: {'splitter': 'random', 'min_samples_split': 0.10116155055447544, 'min_samples_leaf': 0.016740760045115217, 'min_weight_fraction_leaf': 0.03304419379506383, 'max_features': 0.9613385379147835}. Best is trial 55 with value: 0.9086552789532311.[0m
[32m[I 2022-04-21 12:02:53,199][0m Trial 142 finished with value: 0.8743854158178429 and parameters: {'splitter': 'random', 'min_samples_split': 0.24340008837923774, 'min_samples_leaf': 0.03507337888160787, 'min_weight_fraction_leaf': 0.022058758357295864, 'max_features': 0.29942614668347345}. Best is trial 55 with value: 0.9086552789532311.[0m
[32m[I 2022-04-21 12:02:54,550][0m Trial 143 finished with value: 0.8871969543648227 and parameters: {'splitter': 'random', 'min_samples_split': 0.05084034299984151, 'min_samples_leaf': 0.011723735499308321, 'min_weight_fraction_leaf': 0.04828645352147182, 'max_features': 0.5063512042397358}. Best is trial 55 with value: 0.9086552789532311.[0m
[32m[I 2022-04-21 12:02:55,425][0m Trial 144 finished with value: 0.8861863677961773 and parameters: {'splitter': 'random', 'min_samples_split': 0.07721010607644696, 'min_samples_leaf': 0.024179816697827015, 'min_weight_fraction_leaf': 0.0372024664645569, 'max_features': 0.45269538191925207}. Best is trial 55 with value: 0.9086552789532311.[0m
[32m[I 2022-04-21 12:02:57,092][0m Trial 145 finished with value: 0.903731830880018 and parameters: {'splitter': 'random', 'min_samples_split': 0.04184936882753852, 'min_samples_leaf': 0.04007661973827165, 'min_weight_fraction_leaf': 0.06101722429653311, 'max_features': 0.9377109610353522}. Best is trial 55 with value: 0.9086552789532311.[0m
[32m[I 2022-04-21 12:02:58,166][0m Trial 146 finished with value: 0.8957571001625728 and parameters: {'splitter': 'random', 'min_samples_split': 0.06922154003460533, 'min_samples_leaf': 0.04874654450489535, 'min_weight_fraction_leaf': 0.07668779259907688, 'max_features': 0.9664875377726135}. Best is trial 55 with value: 0.9086552789532311.[0m
[32m[I 2022-04-21 12:02:59,372][0m Trial 147 finished with value: 0.8804391066728773 and parameters: {'splitter': 'random', 'min_samples_split': 0.05234571721224833, 'min_samples_leaf': 0.019516750823128943, 'min_weight_fraction_leaf': 0.1784351421316748, 'max_features': 0.949009462982921}. Best is trial 55 with value: 0.9086552789532311.[0m
[32m[I 2022-04-21 12:03:00,906][0m Trial 148 finished with value: 0.9012444390090693 and parameters: {'splitter': 'random', 'min_samples_split': 0.0901858405719759, 'min_samples_leaf': 0.0012856312875126827, 'min_weight_fraction_leaf': 0.018566229727422126, 'max_features': 0.37573394927050613}. Best is trial 55 with value: 0.9086552789532311.[0m
[32m[I 2022-04-21 12:03:04,013][0m Trial 149 finished with value: 0.3425804518366971 and parameters: {'splitter': 'random', 'min_samples_split': 0.027830485093791553, 'min_samples_leaf': 0.059438228263019754, 'min_weight_fraction_leaf': 0.39545936722834163, 'max_features': 0.8995309050917394}. Best is trial 55 with value: 0.9086552789532311.[0m
[32m[I 2022-04-21 12:03:05,373][0m Trial 150 finished with value: 0.3425804518366971 and parameters: {'splitter': 'random', 'min_samples_split': 0.42140218046252176, 'min_samples_leaf': 0.3897650082508497, 'min_weight_fraction_leaf': 0.0927537172899641, 'max_features': 0.9234642947579086}. Best is trial 55 with value: 0.9086552789532311.[0m
[32m[I 2022-04-21 12:03:07,790][0m Trial 151 finished with value: 0.9049687039677414 and parameters: {'splitter': 'random', 'min_samples_split': 0.06242029694454912, 'min_samples_leaf': 0.009071143595933983, 'min_weight_fraction_leaf': 0.08736990635897901, 'max_features': 0.9989883611874526}. Best is trial 55 with value: 0.9086552789532311.[0m
[32m[I 2022-04-21 12:03:10,020][0m Trial 152 finished with value: 0.8981254360748355 and parameters: {'splitter': 'random', 'min_samples_split': 0.05625445056690885, 'min_samples_leaf': 0.028649034248557415, 'min_weight_fraction_leaf': 0.05237788313526069, 'max_features': 0.9758836073241018}. Best is trial 55 with value: 0.9086552789532311.[0m
[32m[I 2022-04-21 12:03:12,202][0m Trial 153 finished with value: 0.8996946774896605 and parameters: {'splitter': 'random', 'min_samples_split': 0.03966761071364101, 'min_samples_leaf': 0.0014270194466434113, 'min_weight_fraction_leaf': 0.027001021433823182, 'max_features': 0.9475815571315349}. Best is trial 55 with value: 0.9086552789532311.[0m
[32m[I 2022-04-21 12:03:13,504][0m Trial 154 finished with value: 0.8964694900904302 and parameters: {'splitter': 'random', 'min_samples_split': 0.224561920767541, 'min_samples_leaf': 0.01440203399027183, 'min_weight_fraction_leaf': 0.064743037912435, 'max_features': 0.8674698660426894}. Best is trial 55 with value: 0.9086552789532311.[0m
[32m[I 2022-04-21 12:03:15,152][0m Trial 155 finished with value: 0.8961086474611843 and parameters: {'splitter': 'random', 'min_samples_split': 0.0829672760643055, 'min_samples_leaf': 0.031969663507832285, 'min_weight_fraction_leaf': 0.07964360159142922, 'max_features': 0.9688420131573101}. Best is trial 55 with value: 0.9086552789532311.[0m
[32m[I 2022-04-21 12:03:16,878][0m Trial 156 finished with value: 0.9093247923494931 and parameters: {'splitter': 'random', 'min_samples_split': 0.06496485429212351, 'min_samples_leaf': 0.019673800994710926, 'min_weight_fraction_leaf': 0.04269940105159406, 'max_features': 0.9205957211154263}. Best is trial 156 with value: 0.9093247923494931.[0m
[32m[I 2022-04-21 12:03:18,022][0m Trial 157 finished with value: 0.9066476863686745 and parameters: {'splitter': 'random', 'min_samples_split': 0.06959626904656101, 'min_samples_leaf': 0.04505836113865895, 'min_weight_fraction_leaf': 0.03825627086358184, 'max_features': 0.9112869049896312}. Best is trial 156 with value: 0.9093247923494931.[0m
[32m[I 2022-04-21 12:03:19,003][0m Trial 158 finished with value: 0.9033644086047593 and parameters: {'splitter': 'random', 'min_samples_split': 0.0754980024518532, 'min_samples_leaf': 0.04157216051528158, 'min_weight_fraction_leaf': 0.04318399234279918, 'max_features': 0.8882736887224925}. Best is trial 156 with value: 0.9093247923494931.[0m
[32m[I 2022-04-21 12:05:40,151][0m Trial 159 finished with value: 0.8921633333797561 and parameters: {'splitter': 'best', 'min_samples_split': 0.12390935977956326, 'min_samples_leaf': 0.043548151309819934, 'min_weight_fraction_leaf': 0.03615495723311599, 'max_features': 0.8496315853797953}. Best is trial 156 with value: 0.9093247923494931.[0m
[32m[I 2022-04-21 12:05:41,963][0m Trial 160 finished with value: 0.9062695799297755 and parameters: {'splitter': 'random', 'min_samples_split': 0.09639048182817692, 'min_samples_leaf': 0.051465634546281586, 'min_weight_fraction_leaf': 0.05533909854120809, 'max_features': 0.9251964896536164}. Best is trial 156 with value: 0.9093247923494931.[0m
[32m[I 2022-04-21 12:05:43,359][0m Trial 161 finished with value: 0.8973853107205472 and parameters: {'splitter': 'random', 'min_samples_split': 0.09778693133130306, 'min_samples_leaf': 0.053588982918266165, 'min_weight_fraction_leaf': 0.05499385147433014, 'max_features': 0.9126875796197608}. Best is trial 156 with value: 0.9093247923494931.[0m
[32m[I 2022-04-21 12:05:45,039][0m Trial 162 finished with value: 0.8920294249252674 and parameters: {'splitter': 'random', 'min_samples_split': 0.10899514260517418, 'min_samples_leaf': 0.022859942071768564, 'min_weight_fraction_leaf': 0.045952579345641974, 'max_features': 0.9273072931469161}. Best is trial 156 with value: 0.9093247923494931.[0m
[32m[I 2022-04-21 12:05:45,933][0m Trial 163 finished with value: 0.9001845856327348 and parameters: {'splitter': 'random', 'min_samples_split': 0.06330693627557851, 'min_samples_leaf': 0.06665902886225092, 'min_weight_fraction_leaf': 0.03201149531451028, 'max_features': 0.8934279090504352}. Best is trial 156 with value: 0.9093247923494931.[0m
[32m[I 2022-04-21 12:05:47,393][0m Trial 164 finished with value: 0.9068911098091308 and parameters: {'splitter': 'random', 'min_samples_split': 0.045942547128671754, 'min_samples_leaf': 0.033170027954836076, 'min_weight_fraction_leaf': 0.0711243388155671, 'max_features': 0.9127177031883549}. Best is trial 156 with value: 0.9093247923494931.[0m
[32m[I 2022-04-21 12:05:48,210][0m Trial 165 finished with value: 0.88773659847461 and parameters: {'splitter': 'random', 'min_samples_split': 0.0445269735818525, 'min_samples_leaf': 0.0792447811788221, 'min_weight_fraction_leaf': 0.06601826724962705, 'max_features': 0.8714657893953648}. Best is trial 156 with value: 0.9093247923494931.[0m
[32m[I 2022-04-21 12:05:49,109][0m Trial 166 finished with value: 0.9070480032749634 and parameters: {'splitter': 'random', 'min_samples_split': 0.034256858677082114, 'min_samples_leaf': 0.048803636161176084, 'min_weight_fraction_leaf': 0.05344779933922513, 'max_features': 0.9077738825683211}. Best is trial 156 with value: 0.9093247923494931.[0m
[32m[I 2022-04-21 12:05:49,902][0m Trial 167 finished with value: 0.30666891715272176 and parameters: {'splitter': 'random', 'min_samples_split': 0.0329074724944655, 'min_samples_leaf': 0.47999917118349206, 'min_weight_fraction_leaf': 0.05591178778943449, 'max_features': 0.9007535057611571}. Best is trial 156 with value: 0.9093247923494931.[0m
[32m[I 2022-04-21 12:05:50,861][0m Trial 168 finished with value: 0.8995314988765198 and parameters: {'splitter': 'random', 'min_samples_split': 0.010922170612169782, 'min_samples_leaf': 0.04888217448071716, 'min_weight_fraction_leaf': 0.046953948831171266, 'max_features': 0.842000473763869}. Best is trial 156 with value: 0.9093247923494931.[0m
[32m[I 2022-04-21 12:05:51,796][0m Trial 169 finished with value: 0.8451219750681368 and parameters: {'splitter': 'random', 'min_samples_split': 0.01950301352189577, 'min_samples_leaf': 0.06721439980043062, 'min_weight_fraction_leaf': 0.0675020094331128, 'max_features': 0.1805044381737425}. Best is trial 156 with value: 0.9093247923494931.[0m
[32m[I 2022-04-21 12:05:54,029][0m Trial 170 finished with value: 0.9042756275805692 and parameters: {'splitter': 'random', 'min_samples_split': 0.030407247799414706, 'min_samples_leaf': 0.03844099365192355, 'min_weight_fraction_leaf': 0.058404663152046773, 'max_features': 0.9090004570357142}. Best is trial 156 with value: 0.9093247923494931.[0m
[32m[I 2022-04-21 12:05:55,381][0m Trial 171 finished with value: 0.8797245818194697 and parameters: {'splitter': 'random', 'min_samples_split': 0.047520969668166366, 'min_samples_leaf': 0.024709462797624406, 'min_weight_fraction_leaf': 0.21955536123112626, 'max_features': 0.9516917981570361}. Best is trial 156 with value: 0.9093247923494931.[0m
[32m[I 2022-04-21 12:05:57,201][0m Trial 172 finished with value: 0.9095021896609154 and parameters: {'splitter': 'random', 'min_samples_split': 0.03859991544291197, 'min_samples_leaf': 0.017650521315610894, 'min_weight_fraction_leaf': 0.0346333404763178, 'max_features': 0.9289103234948243}. Best is trial 172 with value: 0.9095021896609154.[0m
[32m[I 2022-04-21 12:05:59,830][0m Trial 173 finished with value: 0.900645838278433 and parameters: {'splitter': 'random', 'min_samples_split': 0.03883513759404178, 'min_samples_leaf': 0.020026224523547523, 'min_weight_fraction_leaf': 0.04592599297231407, 'max_features': 0.8778296394461753}. Best is trial 172 with value: 0.9095021896609154.[0m
[32m[I 2022-04-21 12:06:01,429][0m Trial 174 finished with value: 0.9044255538510549 and parameters: {'splitter': 'random', 'min_samples_split': 0.1721557275240002, 'min_samples_leaf': 0.03616795399875998, 'min_weight_fraction_leaf': 0.03629688154614985, 'max_features': 0.9294821357817739}. Best is trial 172 with value: 0.9095021896609154.[0m
[32m[I 2022-04-21 12:06:02,345][0m Trial 175 finished with value: 0.3425804518366971 and parameters: {'splitter': 'random', 'min_samples_split': 0.0024660575397283946, 'min_samples_leaf': 0.3025359681920377, 'min_weight_fraction_leaf': 0.019745020422986446, 'max_features': 0.9107210625370532}. Best is trial 172 with value: 0.9095021896609154.[0m
[32m[I 2022-04-21 12:06:04,170][0m Trial 176 finished with value: 0.9007612454971856 and parameters: {'splitter': 'random', 'min_samples_split': 0.026551239504156457, 'min_samples_leaf': 0.013392992927579188, 'min_weight_fraction_leaf': 0.07539035077551406, 'max_features': 0.9423411822379368}. Best is trial 172 with value: 0.9095021896609154.[0m
[32m[I 2022-04-21 12:06:05,874][0m Trial 177 finished with value: 0.8913312774318995 and parameters: {'splitter': 'random', 'min_samples_split': 0.05093188963864666, 'min_samples_leaf': 0.05650287397424286, 'min_weight_fraction_leaf': 0.012506951328904371, 'max_features': 0.8241585496435638}. Best is trial 172 with value: 0.9095021896609154.[0m
[32m[I 2022-04-21 12:06:08,297][0m Trial 178 finished with value: 0.9005591712457959 and parameters: {'splitter': 'random', 'min_samples_split': 0.01874469719144039, 'min_samples_leaf': 0.04890414919931964, 'min_weight_fraction_leaf': 0.038690061791902416, 'max_features': 0.8825989170339847}. Best is trial 172 with value: 0.9095021896609154.[0m
[32m[I 2022-04-21 12:06:10,238][0m Trial 179 finished with value: 0.9035635389392083 and parameters: {'splitter': 'random', 'min_samples_split': 0.08501211205292405, 'min_samples_leaf': 0.033613463290533725, 'min_weight_fraction_leaf': 0.052225579010306805, 'max_features': 0.9148712167181458}. Best is trial 172 with value: 0.9095021896609154.[0m
[32m[I 2022-04-21 12:06:11,057][0m Trial 180 finished with value: 0.8804391066728773 and parameters: {'splitter': 'random', 'min_samples_split': 0.035406349680584176, 'min_samples_leaf': 0.17198846270829374, 'min_weight_fraction_leaf': 0.027729759177359377, 'max_features': 0.9525049369623332}. Best is trial 172 with value: 0.9095021896609154.[0m
[32m[I 2022-04-21 12:06:12,248][0m Trial 181 finished with value: 0.905477027395356 and parameters: {'splitter': 'random', 'min_samples_split': 0.06380697967788451, 'min_samples_leaf': 0.02406030155708637, 'min_weight_fraction_leaf': 0.030822278449513782, 'max_features': 0.9290995137891547}. Best is trial 172 with value: 0.9095021896609154.[0m
[32m[I 2022-04-21 12:06:13,336][0m Trial 182 finished with value: 0.8881805763110382 and parameters: {'splitter': 'random', 'min_samples_split': 0.32046280843239894, 'min_samples_leaf': 0.012880741570405245, 'min_weight_fraction_leaf': 0.04166403990557941, 'max_features': 0.9667453935296357}. Best is trial 172 with value: 0.9095021896609154.[0m
[32m[I 2022-04-21 12:06:15,141][0m Trial 183 finished with value: 0.8992083114066525 and parameters: {'splitter': 'random', 'min_samples_split': 0.07265011050226332, 'min_samples_leaf': 0.02916202947745186, 'min_weight_fraction_leaf': 0.06069860409046327, 'max_features': 0.898995359950227}. Best is trial 172 with value: 0.9095021896609154.[0m
[32m[I 2022-04-21 12:06:17,045][0m Trial 184 finished with value: 0.9034514892362143 and parameters: {'splitter': 'random', 'min_samples_split': 0.046498960014892135, 'min_samples_leaf': 0.042624198151880725, 'min_weight_fraction_leaf': 0.0196828347019675, 'max_features': 0.945422516353073}. Best is trial 172 with value: 0.9095021896609154.[0m
[32m[I 2022-04-21 12:06:19,267][0m Trial 185 finished with value: 0.8909831993229916 and parameters: {'splitter': 'random', 'min_samples_split': 0.05515088323516824, 'min_samples_leaf': 0.01889320713667076, 'min_weight_fraction_leaf': 0.07215800108845546, 'max_features': 0.9743229994359606}. Best is trial 172 with value: 0.9095021896609154.[0m
[32m[I 2022-04-21 12:06:21,231][0m Trial 186 finished with value: 0.8992145331854671 and parameters: {'splitter': 'random', 'min_samples_split': 0.07857130750218255, 'min_samples_leaf': 0.009207671348129519, 'min_weight_fraction_leaf': 0.05006685615047497, 'max_features': 0.862856751852605}. Best is trial 172 with value: 0.9095021896609154.[0m
