[32m[I 2022-04-21 12:06:22,585][0m Trial 187 finished with value: 0.904155886199334 and parameters: {'splitter': 'random', 'min_samples_split': 0.02488058172852222, 'min_samples_leaf': 0.031687306074579584, 'min_weight_fraction_leaf': 0.034293372854113185, 'max_features': 0.9318783885856249}. Best is trial 172 with value: 0.9095021896609154.[0m
[32m[I 2022-04-21 12:06:24,350][0m Trial 188 finished with value: 0.9062723785826744 and parameters: {'splitter': 'random', 'min_samples_split': 0.040515452435276, 'min_samples_leaf': 0.018891073591618995, 'min_weight_fraction_leaf': 0.06107235047465199, 'max_features': 0.915803574301882}. Best is trial 172 with value: 0.9095021896609154.[0m
[32m[I 2022-04-21 12:06:26,392][0m Trial 189 finished with value: 0.9000540072333021 and parameters: {'splitter': 'random', 'min_samples_split': 0.011493552405617906, 'min_samples_leaf': 0.016938124321426627, 'min_weight_fraction_leaf': 0.0635200324645298, 'max_features': 0.8927889920132371}. Best is trial 172 with value: 0.9095021896609154.[0m
[32m[I 2022-04-21 12:09:06,737][0m Trial 190 finished with value: 0.8864034443125206 and parameters: {'splitter': 'best', 'min_samples_split': 0.04232567298822164, 'min_samples_leaf': 0.04359575143998358, 'min_weight_fraction_leaf': 0.05589801266740921, 'max_features': 0.9122067351375283}. Best is trial 172 with value: 0.9095021896609154.[0m
[32m[I 2022-04-21 12:09:07,943][0m Trial 191 finished with value: 0.9012166028809331 and parameters: {'splitter': 'random', 'min_samples_split': 0.06850505789226896, 'min_samples_leaf': 0.026547438484365873, 'min_weight_fraction_leaf': 0.040974978102066746, 'max_features': 0.9509918149004155}. Best is trial 172 with value: 0.9095021896609154.[0m
[32m[I 2022-04-21 12:09:09,411][0m Trial 192 finished with value: 0.9074875537595901 and parameters: {'splitter': 'random', 'min_samples_split': 0.057701772416230986, 'min_samples_leaf': 0.009151033307684145, 'min_weight_fraction_leaf': 0.02580783686340583, 'max_features': 0.9226044742832397}. Best is trial 172 with value: 0.9095021896609154.[0m
[32m[I 2022-04-21 12:09:10,656][0m Trial 193 finished with value: 0.9068422141505674 and parameters: {'splitter': 'random', 'min_samples_split': 0.03558669312003067, 'min_samples_leaf': 0.013593097895993255, 'min_weight_fraction_leaf': 0.046004157420869725, 'max_features': 0.9246635368869622}. Best is trial 172 with value: 0.9095021896609154.[0m
/media/san2_ssd/data/Workdir/survival/utils.py:305: RuntimeWarning: invalid value encountered in true_divide
  pdfs = np.gradient(1-survs,axis=1)/norms
[32m[I 2022-04-21 12:09:12,994][0m Trial 194 finished with value: 0.8966194468318086 and parameters: {'splitter': 'random', 'min_samples_split': 0.0348269149534035, 'min_samples_leaf': 0.009615592303604396, 'min_weight_fraction_leaf': 0.010055543549818267, 'max_features': 0.9283699012546107}. Best is trial 172 with value: 0.9095021896609154.[0m
[32m[I 2022-04-21 12:09:14,748][0m Trial 195 finished with value: 0.9036473849109148 and parameters: {'splitter': 'random', 'min_samples_split': 0.04736033981527098, 'min_samples_leaf': 0.008509828176048277, 'min_weight_fraction_leaf': 0.024688290738255944, 'max_features': 0.8711908601368339}. Best is trial 172 with value: 0.9095021896609154.[0m
[32m[I 2022-04-21 12:09:16,286][0m Trial 196 finished with value: 0.8998618876210257 and parameters: {'splitter': 'random', 'min_samples_split': 0.02423734231822701, 'min_samples_leaf': 0.017894302663752946, 'min_weight_fraction_leaf': 0.07210223019682302, 'max_features': 0.8967393067345949}. Best is trial 172 with value: 0.9095021896609154.[0m
[32m[I 2022-04-21 12:09:18,873][0m Trial 197 finished with value: 0.9031838186963095 and parameters: {'splitter': 'random', 'min_samples_split': 0.060059733201877595, 'min_samples_leaf': 0.001893310523342689, 'min_weight_fraction_leaf': 0.04356030855595566, 'max_features': 0.9474260937347536}. Best is trial 172 with value: 0.9095021896609154.[0m
[32m[I 2022-04-21 12:09:20,889][0m Trial 198 finished with value: 0.904042237336791 and parameters: {'splitter': 'random', 'min_samples_split': 0.0376111666731849, 'min_samples_leaf': 0.018916078737925196, 'min_weight_fraction_leaf': 0.05729874757484346, 'max_features': 0.9181727056128025}. Best is trial 172 with value: 0.9095021896609154.[0m
[32m[I 2022-04-21 12:09:22,727][0m Trial 199 finished with value: 0.9024303078238637 and parameters: {'splitter': 'random', 'min_samples_split': 0.05043190237791119, 'min_samples_leaf': 0.03169730706692708, 'min_weight_fraction_leaf': 0.03250240745038553, 'max_features': 0.8910350390863755}. Best is trial 172 with value: 0.9095021896609154.[0m
[32m[I 2022-04-21 12:09:25,228][0m Trial 200 finished with value: 0.9053437771463837 and parameters: {'splitter': 'random', 'min_samples_split': 0.01194372035407994, 'min_samples_leaf': 0.010369559333377493, 'min_weight_fraction_leaf': 0.01968609085892151, 'max_features': 0.9623466550706544}. Best is trial 172 with value: 0.9095021896609154.[0m
[32m[I 2022-04-21 12:09:26,339][0m Trial 201 finished with value: 0.9060447271538505 and parameters: {'splitter': 'random', 'min_samples_split': 0.0316719479495014, 'min_samples_leaf': 0.03660433388560796, 'min_weight_fraction_leaf': 0.04896446933399002, 'max_features': 0.9260232682428445}. Best is trial 172 with value: 0.9095021896609154.[0m
[32m[I 2022-04-21 12:09:27,425][0m Trial 202 finished with value: 0.9046404359471021 and parameters: {'splitter': 'random', 'min_samples_split': 0.02914976659462066, 'min_samples_leaf': 0.02155983873683793, 'min_weight_fraction_leaf': 0.05004027925540072, 'max_features': 0.9339408577731174}. Best is trial 172 with value: 0.9095021896609154.[0m
[32m[I 2022-04-21 12:09:28,732][0m Trial 203 finished with value: 0.9062228404242789 and parameters: {'splitter': 'random', 'min_samples_split': 0.04108996983368891, 'min_samples_leaf': 0.03239031818672702, 'min_weight_fraction_leaf': 0.0641588814825019, 'max_features': 0.907807365409843}. Best is trial 172 with value: 0.9095021896609154.[0m
[32m[I 2022-04-21 12:09:31,547][0m Trial 204 finished with value: 0.9069974386025395 and parameters: {'splitter': 'random', 'min_samples_split': 0.05756127195795614, 'min_samples_leaf': 0.029581849115620965, 'min_weight_fraction_leaf': 0.0701887882154827, 'max_features': 0.9092780177230754}. Best is trial 172 with value: 0.9095021896609154.[0m
[32m[I 2022-04-21 12:09:33,444][0m Trial 205 finished with value: 0.9002066548752167 and parameters: {'splitter': 'random', 'min_samples_split': 0.06415833091761194, 'min_samples_leaf': 0.04820457640578911, 'min_weight_fraction_leaf': 0.06756019346591283, 'max_features': 0.9062745585758456}. Best is trial 172 with value: 0.9095021896609154.[0m
[32m[I 2022-04-21 12:09:34,112][0m Trial 206 finished with value: 0.37352803050186595 and parameters: {'splitter': 'random', 'min_samples_split': 0.054923984284927466, 'min_samples_leaf': 0.25151735888386306, 'min_weight_fraction_leaf': 0.08029933011060585, 'max_features': 0.8827294103292388}. Best is trial 172 with value: 0.9095021896609154.[0m
[32m[I 2022-04-21 12:09:35,438][0m Trial 207 finished with value: 0.8992461538746557 and parameters: {'splitter': 'random', 'min_samples_split': 0.09125227511426798, 'min_samples_leaf': 0.03035136013978678, 'min_weight_fraction_leaf': 0.06024481300805784, 'max_features': 0.8546637754661269}. Best is trial 172 with value: 0.9095021896609154.[0m
[32m[I 2022-04-21 12:09:36,511][0m Trial 208 finished with value: 0.9037732091415368 and parameters: {'splitter': 'random', 'min_samples_split': 0.041993555925908616, 'min_samples_leaf': 0.05892699210337205, 'min_weight_fraction_leaf': 0.03922465289697398, 'max_features': 0.9089852697796792}. Best is trial 172 with value: 0.9095021896609154.[0m
[32m[I 2022-04-21 12:09:38,893][0m Trial 209 finished with value: 0.902690856489136 and parameters: {'splitter': 'random', 'min_samples_split': 0.07679614923996267, 'min_samples_leaf': 0.011512403355989027, 'min_weight_fraction_leaf': 0.07162779150163559, 'max_features': 0.9411552521438613}. Best is trial 172 with value: 0.9095021896609154.[0m
[32m[I 2022-04-21 12:09:40,188][0m Trial 210 finished with value: 0.9018336115011181 and parameters: {'splitter': 'random', 'min_samples_split': 0.02010939515381855, 'min_samples_leaf': 0.02460056183314562, 'min_weight_fraction_leaf': 0.027459227270591878, 'max_features': 0.8818683767806346}. Best is trial 172 with value: 0.9095021896609154.[0m
[32m[I 2022-04-21 12:09:41,216][0m Trial 211 finished with value: 0.8942088709112894 and parameters: {'splitter': 'random', 'min_samples_split': 0.04592396750440018, 'min_samples_leaf': 0.017295316976896707, 'min_weight_fraction_leaf': 0.06255681817760919, 'max_features': 0.5923585202233654}. Best is trial 172 with value: 0.9095021896609154.[0m
[32m[I 2022-04-21 12:09:43,096][0m Trial 212 finished with value: 0.9070814935893926 and parameters: {'splitter': 'random', 'min_samples_split': 0.05788699657200613, 'min_samples_leaf': 0.03881007477728518, 'min_weight_fraction_leaf': 0.04761264145926081, 'max_features': 0.9159293370805371}. Best is trial 172 with value: 0.9095021896609154.[0m
[32m[I 2022-04-21 12:09:44,841][0m Trial 213 finished with value: 0.9072947925307032 and parameters: {'splitter': 'random', 'min_samples_split': 0.06436994341981103, 'min_samples_leaf': 0.038743795363398593, 'min_weight_fraction_leaf': 0.04432919688904058, 'max_features': 0.9167620440773758}. Best is trial 172 with value: 0.9095021896609154.[0m
[32m[I 2022-04-21 12:09:46,156][0m Trial 214 finished with value: 0.9068422141505674 and parameters: {'splitter': 'random', 'min_samples_split': 0.06519388716088284, 'min_samples_leaf': 0.039702648701906346, 'min_weight_fraction_leaf': 0.04589201737347342, 'max_features': 0.911486929761239}. Best is trial 172 with value: 0.9095021896609154.[0m
[32m[I 2022-04-21 12:09:47,688][0m Trial 215 finished with value: 0.9087331346382612 and parameters: {'splitter': 'random', 'min_samples_split': 0.07094830506932887, 'min_samples_leaf': 0.04359404265290939, 'min_weight_fraction_leaf': 0.04214182809878811, 'max_features': 0.9270707152336589}. Best is trial 172 with value: 0.9095021896609154.[0m
[32m[I 2022-04-21 12:09:49,276][0m Trial 216 finished with value: 0.8992532008105938 and parameters: {'splitter': 'random', 'min_samples_split': 0.06412800645287087, 'min_samples_leaf': 0.04054490130334516, 'min_weight_fraction_leaf': 0.04075045895315475, 'max_features': 0.897402366922943}. Best is trial 172 with value: 0.9095021896609154.[0m
[32m[I 2022-04-21 12:09:52,231][0m Trial 217 finished with value: 0.9066476863686745 and parameters: {'splitter': 'random', 'min_samples_split': 0.06941019921677569, 'min_samples_leaf': 0.04495170733986286, 'min_weight_fraction_leaf': 0.04264299415080754, 'max_features': 0.9224158995478933}. Best is trial 172 with value: 0.9095021896609154.[0m
[32m[I 2022-04-21 12:09:54,885][0m Trial 218 finished with value: 0.895032418842477 and parameters: {'splitter': 'random', 'min_samples_split': 0.07393458110040022, 'min_samples_leaf': 0.058730725665993834, 'min_weight_fraction_leaf': 0.03423596427898276, 'max_features': 0.9634865568902277}. Best is trial 172 with value: 0.9095021896609154.[0m
[32m[I 2022-04-21 12:09:56,188][0m Trial 219 finished with value: 0.9032601542542545 and parameters: {'splitter': 'random', 'min_samples_split': 0.08342291449713422, 'min_samples_leaf': 0.04652367507518407, 'min_weight_fraction_leaf': 0.04542271557576173, 'max_features': 0.9373399621104715}. Best is trial 172 with value: 0.9095021896609154.[0m
[32m[I 2022-04-21 12:09:57,101][0m Trial 220 finished with value: 0.9030275165877539 and parameters: {'splitter': 'random', 'min_samples_split': 0.07088965751507369, 'min_samples_leaf': 0.03690601192799701, 'min_weight_fraction_leaf': 0.02834689659437293, 'max_features': 0.8744377351532614}. Best is trial 172 with value: 0.9095021896609154.[0m
[32m[I 2022-04-21 12:09:58,471][0m Trial 221 finished with value: 0.9068422141505674 and parameters: {'splitter': 'random', 'min_samples_split': 0.055369920979243245, 'min_samples_leaf': 0.02513473608807823, 'min_weight_fraction_leaf': 0.04556515406799219, 'max_features': 0.917423100712223}. Best is trial 172 with value: 0.9095021896609154.[0m
[32m[I 2022-04-21 12:09:59,531][0m Trial 222 finished with value: 0.9066476863686745 and parameters: {'splitter': 'random', 'min_samples_split': 0.060002693381576926, 'min_samples_leaf': 0.04278447819500463, 'min_weight_fraction_leaf': 0.045295863785321425, 'max_features': 0.9202217148025054}. Best is trial 172 with value: 0.9095021896609154.[0m
[32m[I 2022-04-21 12:10:01,611][0m Trial 223 finished with value: 0.9010934120632308 and parameters: {'splitter': 'random', 'min_samples_split': 0.06385184879806868, 'min_samples_leaf': 0.04815411788509097, 'min_weight_fraction_leaf': 0.047096599221491134, 'max_features': 0.8961199780619257}. Best is trial 172 with value: 0.9095021896609154.[0m
[32m[I 2022-04-21 12:10:04,449][0m Trial 224 finished with value: 0.9084754307305454 and parameters: {'splitter': 'random', 'min_samples_split': 0.05812706101553508, 'min_samples_leaf': 0.039521469518666856, 'min_weight_fraction_leaf': 0.040242022057942764, 'max_features': 0.9165205027217834}. Best is trial 172 with value: 0.9095021896609154.[0m
[32m[I 2022-04-21 12:10:06,042][0m Trial 225 finished with value: 0.906372481287167 and parameters: {'splitter': 'random', 'min_samples_split': 0.05725258581898597, 'min_samples_leaf': 0.06257881748812545, 'min_weight_fraction_leaf': 0.04093801882367935, 'max_features': 0.924141473816378}. Best is trial 172 with value: 0.9095021896609154.[0m
[32m[I 2022-04-21 12:10:09,877][0m Trial 226 finished with value: 0.9010934120632308 and parameters: {'splitter': 'random', 'min_samples_split': 0.07845601745105493, 'min_samples_leaf': 0.04134795109067087, 'min_weight_fraction_leaf': 0.04837796617596102, 'max_features': 0.8858768172476585}. Best is trial 172 with value: 0.9095021896609154.[0m
[32m[I 2022-04-21 12:10:10,816][0m Trial 227 finished with value: 0.25 and parameters: {'splitter': 'random', 'min_samples_split': 0.05613756476522713, 'min_samples_leaf': 0.05524185175741645, 'min_weight_fraction_leaf': 0.036204454956448924, 'max_features': 0.007007447516110654}. Best is trial 172 with value: 0.9095021896609154.[0m
[32m[I 2022-04-21 12:10:12,035][0m Trial 228 finished with value: 0.9066353678353799 and parameters: {'splitter': 'random', 'min_samples_split': 0.06879658090343915, 'min_samples_leaf': 0.03575399490927951, 'min_weight_fraction_leaf': 0.02724591521833225, 'max_features': 0.9091847818107038}. Best is trial 172 with value: 0.9095021896609154.[0m
[32m[I 2022-04-21 12:10:13,098][0m Trial 229 finished with value: 0.9034873013225866 and parameters: {'splitter': 'random', 'min_samples_split': 0.0558000470729468, 'min_samples_leaf': 0.04628374747416194, 'min_weight_fraction_leaf': 0.040432694216327135, 'max_features': 0.9403599546680554}. Best is trial 172 with value: 0.9095021896609154.[0m
[32m[I 2022-04-21 12:12:04,387][0m Trial 230 finished with value: 0.8915138170507435 and parameters: {'splitter': 'best', 'min_samples_split': 0.08552729825698645, 'min_samples_leaf': 0.069576697461817, 'min_weight_fraction_leaf': 0.0525042957031472, 'max_features': 0.8580435834119319}. Best is trial 172 with value: 0.9095021896609154.[0m
[32m[I 2022-04-21 12:12:05,782][0m Trial 231 finished with value: 0.9068152472936305 and parameters: {'splitter': 'random', 'min_samples_split': 0.07197105653937372, 'min_samples_leaf': 0.03528931401704147, 'min_weight_fraction_leaf': 0.023646754830165508, 'max_features': 0.9127002269055841}. Best is trial 172 with value: 0.9095021896609154.[0m
[32m[I 2022-04-21 12:12:07,184][0m Trial 232 finished with value: 0.909669016857861 and parameters: {'splitter': 'random', 'min_samples_split': 0.07313233324052631, 'min_samples_leaf': 0.03249718625361474, 'min_weight_fraction_leaf': 0.018475968854336312, 'max_features': 0.9275263079512096}. Best is trial 232 with value: 0.909669016857861.[0m
[32m[I 2022-04-21 12:12:08,395][0m Trial 233 finished with value: 0.9010176062653141 and parameters: {'splitter': 'random', 'min_samples_split': 0.07884494072788725, 'min_samples_leaf': 0.029446546979285573, 'min_weight_fraction_leaf': 0.017418605933400905, 'max_features': 0.9024072945640657}. Best is trial 232 with value: 0.909669016857861.[0m
[32m[I 2022-04-21 12:12:09,894][0m Trial 234 finished with value: 0.9008851374841147 and parameters: {'splitter': 'random', 'min_samples_split': 0.06110246623182393, 'min_samples_leaf': 0.0313858818372673, 'min_weight_fraction_leaf': 0.02366337581783847, 'max_features': 0.9282120784259575}. Best is trial 232 with value: 0.909669016857861.[0m
[32m[I 2022-04-21 12:12:12,011][0m Trial 235 finished with value: 0.9012447598312658 and parameters: {'splitter': 'random', 'min_samples_split': 0.07098138528602681, 'min_samples_leaf': 0.024998860518809438, 'min_weight_fraction_leaf': 0.011902466438526316, 'max_features': 0.954780323483759}. Best is trial 232 with value: 0.909669016857861.[0m
[32m[I 2022-04-21 12:12:14,514][0m Trial 236 finished with value: 0.9037426174420805 and parameters: {'splitter': 'random', 'min_samples_split': 0.05221588466427008, 'min_samples_leaf': 0.03816991583182624, 'min_weight_fraction_leaf': 0.03152830231426218, 'max_features': 0.9279601900767165}. Best is trial 232 with value: 0.909669016857861.[0m
[32m[I 2022-04-21 12:12:17,514][0m Trial 237 finished with value: 0.8985930992886282 and parameters: {'splitter': 'random', 'min_samples_split': 0.0906848876501588, 'min_samples_leaf': 0.05424158768602636, 'min_weight_fraction_leaf': 0.03586783205062829, 'max_features': 0.8834447995006166}. Best is trial 232 with value: 0.909669016857861.[0m
[32m[I 2022-04-21 12:12:20,373][0m Trial 238 finished with value: 0.9015125789252096 and parameters: {'splitter': 'random', 'min_samples_split': 0.050158407054404164, 'min_samples_leaf': 0.025092900009355594, 'min_weight_fraction_leaf': 0.023201677420640422, 'max_features': 0.9052884726502124}. Best is trial 232 with value: 0.909669016857861.[0m
[32m[I 2022-04-21 12:12:22,349][0m Trial 239 finished with value: 0.9034873013225866 and parameters: {'splitter': 'random', 'min_samples_split': 0.0630131539184226, 'min_samples_leaf': 0.03808300196001965, 'min_weight_fraction_leaf': 0.04601669494524019, 'max_features': 0.9438357943348712}. Best is trial 232 with value: 0.909669016857861.[0m
[32m[I 2022-04-21 12:12:24,020][0m Trial 240 finished with value: 0.9024210217185529 and parameters: {'splitter': 'random', 'min_samples_split': 0.07718537579540607, 'min_samples_leaf': 0.045689918344619815, 'min_weight_fraction_leaf': 0.05095527066849753, 'max_features': 0.9213639117652299}. Best is trial 232 with value: 0.909669016857861.[0m
[32m[I 2022-04-21 12:12:26,461][0m Trial 241 finished with value: 0.906827328529473 and parameters: {'splitter': 'random', 'min_samples_split': 0.07054275613249991, 'min_samples_leaf': 0.04484696653922958, 'min_weight_fraction_leaf': 0.03794970638241057, 'max_features': 0.9111191101597766}. Best is trial 232 with value: 0.909669016857861.[0m
[32m[I 2022-04-21 12:12:28,218][0m Trial 242 finished with value: 0.3425804518366971 and parameters: {'splitter': 'random', 'min_samples_split': 0.06325225049620255, 'min_samples_leaf': 0.0318621612260176, 'min_weight_fraction_leaf': 0.2699021588777992, 'max_features': 0.9017005508621626}. Best is trial 232 with value: 0.909669016857861.[0m
[32m[I 2022-04-21 12:12:29,590][0m Trial 243 finished with value: 0.9030485291402208 and parameters: {'splitter': 'random', 'min_samples_split': 0.07099621429304347, 'min_samples_leaf': 0.05265767720881033, 'min_weight_fraction_leaf': 0.031328587577595594, 'max_features': 0.8871881934048949}. Best is trial 232 with value: 0.909669016857861.[0m
[32m[I 2022-04-21 12:12:32,104][0m Trial 244 finished with value: 0.9093247923494931 and parameters: {'splitter': 'random', 'min_samples_split': 0.052604273992375744, 'min_samples_leaf': 0.02250864821281427, 'min_weight_fraction_leaf': 0.04276476342353567, 'max_features': 0.929794546177508}. Best is trial 232 with value: 0.909669016857861.[0m
[32m[I 2022-04-21 12:12:34,446][0m Trial 245 finished with value: 0.9043007992464906 and parameters: {'splitter': 'random', 'min_samples_split': 0.04933269672842636, 'min_samples_leaf': 0.015600550783695525, 'min_weight_fraction_leaf': 0.006883411123213407, 'max_features': 0.9737783245914154}. Best is trial 232 with value: 0.909669016857861.[0m
[32m[I 2022-04-21 12:12:36,916][0m Trial 246 finished with value: 0.9007176334869353 and parameters: {'splitter': 'random', 'min_samples_split': 0.0350582472187735, 'min_samples_leaf': 0.024602070461003808, 'min_weight_fraction_leaf': 0.03946422841048593, 'max_features': 0.9376236501332201}. Best is trial 232 with value: 0.909669016857861.[0m
[32m[I 2022-04-21 12:12:39,452][0m Trial 247 finished with value: 0.8968064343262334 and parameters: {'splitter': 'random', 'min_samples_split': 0.0021401822287866155, 'min_samples_leaf': 0.010902644460668466, 'min_weight_fraction_leaf': 0.05320254890106285, 'max_features': 0.9567848801918022}. Best is trial 232 with value: 0.909669016857861.[0m
[32m[I 2022-04-21 12:12:40,367][0m Trial 248 finished with value: 0.3425804518366971 and parameters: {'splitter': 'random', 'min_samples_split': 0.08576152899188433, 'min_samples_leaf': 0.36544238161646536, 'min_weight_fraction_leaf': 0.01991820107757772, 'max_features': 0.8697763125142696}. Best is trial 232 with value: 0.909669016857861.[0m
