[32m[I 2022-04-25 14:37:15,634][0m Trial 72 finished with value: 0.8489599305749111 and parameters: {'n_hidden': 128, 'mixture_components': 9, 'use_sparse_layer': False, 'use_batchnorm': False, 'use_dropout': False, 'mlp_size_1': 4, 'mlp_size_2': 0, 'mlp_size_3': 0, 'kernel': 'LogLogistic', 'loss_name': 'AlternativeNLLLoss'}. Best is trial 26 with value: 0.8539967281394194.[0m
[32m[I 2022-04-25 14:41:13,901][0m Trial 73 finished with value: 0.8481274578137027 and parameters: {'n_hidden': 128, 'mixture_components': 8, 'use_sparse_layer': False, 'use_batchnorm': False, 'use_dropout': False, 'mlp_size_1': 3, 'mlp_size_2': 0, 'mlp_size_3': 0, 'kernel': 'LogLogistic', 'loss_name': 'AlternativeNLLLoss'}. Best is trial 26 with value: 0.8539967281394194.[0m
[32m[I 2022-04-25 14:44:57,607][0m Trial 74 finished with value: 0.8211959498652884 and parameters: {'n_hidden': 128, 'mixture_components': 8, 'use_sparse_layer': False, 'use_batchnorm': False, 'use_dropout': False, 'mlp_size_1': 4, 'mlp_size_2': 0, 'mlp_size_3': 0, 'kernel': 'LogLogistic', 'loss_name': 'AlternativeNLLLoss'}. Best is trial 26 with value: 0.8539967281394194.[0m
[32m[I 2022-04-25 14:53:06,272][0m Trial 75 finished with value: 0.8491382877707933 and parameters: {'n_hidden': 32, 'mixture_components': 9, 'use_sparse_layer': False, 'use_batchnorm': False, 'use_dropout': False, 'mlp_size_1': 2, 'mlp_size_2': 0, 'mlp_size_3': 0, 'kernel': 'Normal', 'loss_name': 'AlternativeNLLLoss'}. Best is trial 26 with value: 0.8539967281394194.[0m
[32m[I 2022-04-25 14:57:02,238][0m Trial 76 finished with value: 0.8510570657280685 and parameters: {'n_hidden': 1024, 'mixture_components': 9, 'use_sparse_layer': False, 'use_batchnorm': False, 'use_dropout': False, 'mlp_size_1': 3, 'mlp_size_2': 3, 'mlp_size_3': 0, 'kernel': 'LogLogistic', 'loss_name': 'CensoredNLLLoss'}. Best is trial 26 with value: 0.8539967281394194.[0m
[32m[I 2022-04-25 15:00:36,038][0m Trial 77 finished with value: 0.8509089117612131 and parameters: {'n_hidden': 1024, 'mixture_components': 6, 'use_sparse_layer': False, 'use_batchnorm': False, 'use_dropout': False, 'mlp_size_1': 3, 'mlp_size_2': 3, 'mlp_size_3': 0, 'kernel': 'LogLogistic', 'loss_name': 'CensoredNLLLoss'}. Best is trial 26 with value: 0.8539967281394194.[0m
[32m[I 2022-04-25 15:04:39,624][0m Trial 78 finished with value: 0.8525244269839056 and parameters: {'n_hidden': 1024, 'mixture_components': 7, 'use_sparse_layer': False, 'use_batchnorm': False, 'use_dropout': False, 'mlp_size_1': 3, 'mlp_size_2': 4, 'mlp_size_3': 0, 'kernel': 'LogLogistic', 'loss_name': 'CensoredNLLLoss'}. Best is trial 26 with value: 0.8539967281394194.[0m
[32m[I 2022-04-25 15:08:12,992][0m Trial 79 finished with value: 0.7923369916056295 and parameters: {'n_hidden': 1024, 'mixture_components': 7, 'use_sparse_layer': False, 'use_batchnorm': False, 'use_dropout': False, 'mlp_size_1': 5, 'mlp_size_2': 2, 'mlp_size_3': 0, 'kernel': 'LogLogistic', 'loss_name': 'CensoredNLLLoss'}. Best is trial 26 with value: 0.8539967281394194.[0m
[32m[I 2022-04-25 15:12:37,050][0m Trial 80 finished with value: 0.8479342255174702 and parameters: {'n_hidden': 256, 'mixture_components': 6, 'use_sparse_layer': False, 'use_batchnorm': False, 'use_dropout': False, 'mlp_size_1': 5, 'mlp_size_2': 0, 'mlp_size_3': 0, 'kernel': 'Normal', 'loss_name': 'CensoredNLLLoss'}. Best is trial 26 with value: 0.8539967281394194.[0m
[32m[I 2022-04-25 15:16:40,743][0m Trial 81 finished with value: 0.8513621152884616 and parameters: {'n_hidden': 1024, 'mixture_components': 7, 'use_sparse_layer': False, 'use_batchnorm': False, 'use_dropout': False, 'mlp_size_1': 3, 'mlp_size_2': 4, 'mlp_size_3': 0, 'kernel': 'LogLogistic', 'loss_name': 'CensoredNLLLoss'}. Best is trial 26 with value: 0.8539967281394194.[0m
[32m[I 2022-04-25 15:20:00,396][0m Trial 82 finished with value: 0.8335523292527268 and parameters: {'n_hidden': 1024, 'mixture_components': 7, 'use_sparse_layer': False, 'use_batchnorm': False, 'use_dropout': False, 'mlp_size_1': 3, 'mlp_size_2': 4, 'mlp_size_3': 0, 'kernel': 'LogLogistic', 'loss_name': 'CensoredNLLLoss'}. Best is trial 26 with value: 0.8539967281394194.[0m
[32m[I 2022-04-25 15:23:38,911][0m Trial 83 finished with value: 0.8516209134649607 and parameters: {'n_hidden': 1024, 'mixture_components': 6, 'use_sparse_layer': False, 'use_batchnorm': False, 'use_dropout': False, 'mlp_size_1': 3, 'mlp_size_2': 4, 'mlp_size_3': 0, 'kernel': 'LogLogistic', 'loss_name': 'CensoredNLLLoss'}. Best is trial 26 with value: 0.8539967281394194.[0m
[32m[I 2022-04-25 15:27:12,775][0m Trial 84 finished with value: 0.8373878093992262 and parameters: {'n_hidden': 1024, 'mixture_components': 5, 'use_sparse_layer': False, 'use_batchnorm': False, 'use_dropout': False, 'mlp_size_1': 0, 'mlp_size_2': 4, 'mlp_size_3': 1, 'kernel': 'LogLogistic', 'loss_name': 'CensoredNLLLoss'}. Best is trial 26 with value: 0.8539967281394194.[0m
[32m[I 2022-04-25 15:32:27,753][0m Trial 85 finished with value: 0.8529876003848134 and parameters: {'n_hidden': 64, 'mixture_components': 6, 'use_sparse_layer': False, 'use_batchnorm': False, 'use_dropout': False, 'mlp_size_1': 3, 'mlp_size_2': 0, 'mlp_size_3': 0, 'kernel': 'LogLogistic', 'loss_name': 'CensoredNLLLoss'}. Best is trial 26 with value: 0.8539967281394194.[0m
[32m[I 2022-04-25 15:37:30,344][0m Trial 86 finished with value: 0.8486472768078167 and parameters: {'n_hidden': 64, 'mixture_components': 6, 'use_sparse_layer': False, 'use_batchnorm': False, 'use_dropout': False, 'mlp_size_1': 3, 'mlp_size_2': 0, 'mlp_size_3': 0, 'kernel': 'LogLogistic', 'loss_name': 'CensoredNLLLoss'}. Best is trial 26 with value: 0.8539967281394194.[0m
[32m[I 2022-04-25 15:38:53,761][0m Trial 87 finished with value: -1.0 and parameters: {'n_hidden': 64, 'mixture_components': 6, 'use_sparse_layer': False, 'use_batchnorm': False, 'use_dropout': True, 'dropout': 0.8569394243247037, 'mlp_size_1': 3, 'mlp_size_2': 0, 'mlp_size_3': 0, 'kernel': 'Exponential', 'loss_name': 'CensoredNLLLoss'}. Best is trial 26 with value: 0.8539967281394194.[0m
[32m[I 2022-04-25 15:44:22,480][0m Trial 88 finished with value: 0.8433294851369431 and parameters: {'n_hidden': 64, 'mixture_components': 3, 'use_sparse_layer': False, 'use_batchnorm': False, 'use_dropout': False, 'mlp_size_1': 3, 'mlp_size_2': 0, 'mlp_size_3': 0, 'kernel': 'LogLogistic', 'loss_name': 'CensoredNLLLoss'}. Best is trial 26 with value: 0.8539967281394194.[0m
[32m[I 2022-04-25 15:48:20,406][0m Trial 89 finished with value: 0.8443500779657948 and parameters: {'n_hidden': 64, 'mixture_components': 4, 'use_sparse_layer': False, 'use_batchnorm': False, 'use_dropout': False, 'mlp_size_1': 3, 'mlp_size_2': 0, 'mlp_size_3': 0, 'kernel': 'LogLogistic', 'loss_name': 'CensoredNLLLoss'}. Best is trial 26 with value: 0.8539967281394194.[0m
[32m[I 2022-04-25 15:51:33,452][0m Trial 90 finished with value: 0.8187088858546886 and parameters: {'n_hidden': 1024, 'mixture_components': 8, 'use_sparse_layer': False, 'use_batchnorm': False, 'use_dropout': False, 'mlp_size_1': 2, 'mlp_size_2': 5, 'mlp_size_3': 0, 'kernel': 'LogLogistic', 'loss_name': 'NLLLoss'}. Best is trial 26 with value: 0.8539967281394194.[0m
[32m[I 2022-04-25 15:55:53,490][0m Trial 91 finished with value: 0.7691369359156466 and parameters: {'n_hidden': 2048, 'mixture_components': 6, 'use_sparse_layer': False, 'use_batchnorm': False, 'use_dropout': False, 'mlp_size_1': 8, 'mlp_size_2': 0, 'mlp_size_3': 0, 'kernel': 'LogLogistic', 'loss_name': 'CensoredNLLLoss'}. Best is trial 26 with value: 0.8539967281394194.[0m
[32m[I 2022-04-25 15:59:41,560][0m Trial 92 finished with value: 0.8496697514392155 and parameters: {'n_hidden': 1024, 'mixture_components': 5, 'use_sparse_layer': False, 'use_batchnorm': False, 'use_dropout': False, 'mlp_size_1': 2, 'mlp_size_2': 4, 'mlp_size_3': 0, 'kernel': 'LogLogistic', 'loss_name': 'CensoredNLLLoss'}. Best is trial 26 with value: 0.8539967281394194.[0m
[32m[I 2022-04-25 16:04:06,266][0m Trial 93 finished with value: 0.8517394975349106 and parameters: {'n_hidden': 2048, 'mixture_components': 6, 'use_sparse_layer': False, 'use_batchnorm': False, 'use_dropout': False, 'mlp_size_1': 3, 'mlp_size_2': 4, 'mlp_size_3': 0, 'kernel': 'LogLogistic', 'loss_name': 'CensoredNLLLoss'}. Best is trial 26 with value: 0.8539967281394194.[0m
[32m[I 2022-04-25 16:08:44,060][0m Trial 94 finished with value: 0.8528543779059033 and parameters: {'n_hidden': 2048, 'mixture_components': 5, 'use_sparse_layer': False, 'use_batchnorm': False, 'use_dropout': False, 'mlp_size_1': 3, 'mlp_size_2': 4, 'mlp_size_3': 0, 'kernel': 'LogLogistic', 'loss_name': 'CensoredNLLLoss'}. Best is trial 26 with value: 0.8539967281394194.[0m
[32m[I 2022-04-25 16:11:59,028][0m Trial 95 finished with value: 0.45925862440975906 and parameters: {'n_hidden': 2048, 'mixture_components': 5, 'use_sparse_layer': False, 'use_batchnorm': False, 'use_dropout': True, 'dropout': 0.8245975209501242, 'mlp_size_1': 2, 'mlp_size_2': 5, 'mlp_size_3': 0, 'kernel': 'LogLogistic', 'loss_name': 'CensoredNLLLoss'}. Best is trial 26 with value: 0.8539967281394194.[0m
[32m[I 2022-04-25 16:16:59,691][0m Trial 96 finished with value: 0.8543418990987799 and parameters: {'n_hidden': 2048, 'mixture_components': 4, 'use_sparse_layer': False, 'use_batchnorm': False, 'use_dropout': False, 'mlp_size_1': 7, 'mlp_size_2': 1, 'mlp_size_3': 0, 'kernel': 'LogLogistic', 'loss_name': 'CensoredNLLLoss'}. Best is trial 96 with value: 0.8543418990987799.[0m
[32m[I 2022-04-25 16:22:11,993][0m Trial 97 finished with value: 0.851237474406048 and parameters: {'n_hidden': 2048, 'mixture_components': 4, 'use_sparse_layer': False, 'use_batchnorm': False, 'use_dropout': False, 'mlp_size_1': 7, 'mlp_size_2': 1, 'mlp_size_3': 0, 'kernel': 'Logistic', 'loss_name': 'CensoredNLLLoss'}. Best is trial 96 with value: 0.8543418990987799.[0m
[32m[I 2022-04-25 16:27:31,953][0m Trial 98 finished with value: 0.8507125234079412 and parameters: {'n_hidden': 2048, 'mixture_components': 4, 'use_sparse_layer': False, 'use_batchnorm': False, 'use_dropout': False, 'mlp_size_1': 8, 'mlp_size_2': 0, 'mlp_size_3': 0, 'kernel': 'LogLogistic', 'loss_name': 'CensoredNLLLoss'}. Best is trial 96 with value: 0.8543418990987799.[0m
[32m[I 2022-04-25 16:30:29,592][0m Trial 99 finished with value: 0.8104808483905384 and parameters: {'n_hidden': 2048, 'mixture_components': 4, 'use_sparse_layer': False, 'use_batchnorm': False, 'use_dropout': True, 'dropout': 0.7237136199811418, 'mlp_size_1': 7, 'mlp_size_2': 1, 'mlp_size_3': 0, 'kernel': 'LogLogistic', 'loss_name': 'NLLLoss'}. Best is trial 96 with value: 0.8543418990987799.[0m
[32m[I 2022-04-25 16:42:44,564][0m Trial 100 finished with value: 0.8388620537254828 and parameters: {'n_hidden': 2048, 'mixture_components': 3, 'use_sparse_layer': True, 'use_sparse_loss': True, 'lmbd': 2.493519317300633e-06, 'use_batchnorm': True, 'use_dropout': False, 'mlp_size_1': 6, 'mlp_size_2': 2, 'mlp_size_3': 0, 'kernel': 'Normal', 'loss_name': 'CensoredNLLLoss'}. Best is trial 96 with value: 0.8543418990987799.[0m
[32m[I 2022-04-25 16:47:31,123][0m Trial 101 finished with value: 0.8511713314508341 and parameters: {'n_hidden': 2048, 'mixture_components': 5, 'use_sparse_layer': False, 'use_batchnorm': False, 'use_dropout': False, 'mlp_size_1': 8, 'mlp_size_2': 0, 'mlp_size_3': 0, 'kernel': 'LogLogistic', 'loss_name': 'CensoredNLLLoss'}. Best is trial 96 with value: 0.8543418990987799.[0m
[32m[I 2022-04-25 16:51:58,895][0m Trial 102 finished with value: 0.7434697370347794 and parameters: {'n_hidden': 2048, 'mixture_components': 5, 'use_sparse_layer': False, 'use_batchnorm': False, 'use_dropout': False, 'mlp_size_1': 8, 'mlp_size_2': 0, 'mlp_size_3': 0, 'kernel': 'LogLogistic', 'loss_name': 'CensoredNLLLoss'}. Best is trial 96 with value: 0.8543418990987799.[0m
[32m[I 2022-04-25 16:56:13,448][0m Trial 103 finished with value: 0.8493175331753177 and parameters: {'n_hidden': 2048, 'mixture_components': 3, 'use_sparse_layer': False, 'use_batchnorm': False, 'use_dropout': False, 'mlp_size_1': 3, 'mlp_size_2': 4, 'mlp_size_3': 0, 'kernel': 'LogLogistic', 'loss_name': 'CensoredNLLLoss'}. Best is trial 96 with value: 0.8543418990987799.[0m
[32m[I 2022-04-25 17:00:51,782][0m Trial 104 finished with value: 0.8534340729531076 and parameters: {'n_hidden': 2048, 'mixture_components': 2, 'use_sparse_layer': False, 'use_batchnorm': False, 'use_dropout': False, 'mlp_size_1': 7, 'mlp_size_2': 1, 'mlp_size_3': 0, 'kernel': 'LogLogistic', 'loss_name': 'CensoredNLLLoss'}. Best is trial 96 with value: 0.8543418990987799.[0m
[32m[I 2022-04-25 17:06:09,415][0m Trial 105 finished with value: 0.8515127946287528 and parameters: {'n_hidden': 2048, 'mixture_components': 2, 'use_sparse_layer': False, 'use_batchnorm': False, 'use_dropout': False, 'mlp_size_1': 7, 'mlp_size_2': 1, 'mlp_size_3': 0, 'kernel': 'LogLogistic', 'loss_name': 'CensoredNLLLoss'}. Best is trial 96 with value: 0.8543418990987799.[0m
[32m[I 2022-04-25 17:07:25,663][0m Trial 106 finished with value: -1.0 and parameters: {'n_hidden': 32, 'mixture_components': 2, 'use_sparse_layer': False, 'use_batchnorm': False, 'use_dropout': False, 'mlp_size_1': 2, 'mlp_size_2': 0, 'mlp_size_3': 0, 'kernel': 'Exponential', 'loss_name': 'AlternativeNLLLoss'}. Best is trial 96 with value: 0.8543418990987799.[0m
[32m[I 2022-04-25 17:10:28,785][0m Trial 107 finished with value: 0.8398363312145527 and parameters: {'n_hidden': 256, 'mixture_components': 2, 'use_sparse_layer': False, 'use_batchnorm': False, 'use_dropout': False, 'mlp_size_1': 5, 'mlp_size_2': 0, 'mlp_size_3': 0, 'kernel': 'LogLogistic', 'loss_name': 'AlternativeNLLLoss'}. Best is trial 96 with value: 0.8543418990987799.[0m
[32m[I 2022-04-25 17:15:37,206][0m Trial 108 finished with value: 0.8524996130815667 and parameters: {'n_hidden': 2048, 'mixture_components': 2, 'use_sparse_layer': False, 'use_batchnorm': False, 'use_dropout': False, 'mlp_size_1': 7, 'mlp_size_2': 1, 'mlp_size_3': 0, 'kernel': 'Logistic', 'loss_name': 'CensoredNLLLoss'}. Best is trial 96 with value: 0.8543418990987799.[0m
[32m[I 2022-04-25 17:18:29,312][0m Trial 109 finished with value: -1.0 and parameters: {'n_hidden': 2048, 'mixture_components': 2, 'use_sparse_layer': False, 'use_batchnorm': False, 'use_dropout': True, 'dropout': 0.9993046026166346, 'mlp_size_1': 7, 'mlp_size_2': 1, 'mlp_size_3': 0, 'kernel': 'Logistic', 'loss_name': 'CensoredNLLLoss'}. Best is trial 96 with value: 0.8543418990987799.[0m
[32m[I 2022-04-25 17:23:14,943][0m Trial 110 finished with value: 0.8453364772394719 and parameters: {'n_hidden': 2048, 'mixture_components': 2, 'use_sparse_layer': False, 'use_batchnorm': False, 'use_dropout': False, 'mlp_size_1': 6, 'mlp_size_2': 1, 'mlp_size_3': 0, 'kernel': 'Logistic', 'loss_name': 'CensoredNLLLoss'}. Best is trial 96 with value: 0.8543418990987799.[0m
[32m[I 2022-04-25 17:27:48,343][0m Trial 111 finished with value: 0.8480944420943667 and parameters: {'n_hidden': 2048, 'mixture_components': 3, 'use_sparse_layer': False, 'use_batchnorm': False, 'use_dropout': False, 'mlp_size_1': 7, 'mlp_size_2': 1, 'mlp_size_3': 0, 'kernel': 'Logistic', 'loss_name': 'CensoredNLLLoss'}. Best is trial 96 with value: 0.8543418990987799.[0m
[32m[I 2022-04-25 17:32:02,453][0m Trial 112 finished with value: 0.8482184079849479 and parameters: {'n_hidden': 2048, 'mixture_components': 1, 'use_sparse_layer': False, 'use_batchnorm': False, 'use_dropout': False, 'mlp_size_1': 8, 'mlp_size_2': 0, 'mlp_size_3': 0, 'kernel': 'Logistic', 'loss_name': 'CensoredNLLLoss'}. Best is trial 96 with value: 0.8543418990987799.[0m
[32m[I 2022-04-25 17:36:44,270][0m Trial 113 finished with value: 0.8522050462488899 and parameters: {'n_hidden': 512, 'mixture_components': 4, 'use_sparse_layer': False, 'use_batchnorm': False, 'use_dropout': False, 'mlp_size_1': 6, 'mlp_size_2': 0, 'mlp_size_3': 0, 'kernel': 'Logistic', 'loss_name': 'AlternativeNLLLoss'}. Best is trial 96 with value: 0.8543418990987799.[0m
[32m[I 2022-04-25 17:40:25,574][0m Trial 114 finished with value: 0.8511960304203294 and parameters: {'n_hidden': 512, 'mixture_components': 3, 'use_sparse_layer': False, 'use_batchnorm': False, 'use_dropout': False, 'mlp_size_1': 6, 'mlp_size_2': 0, 'mlp_size_3': 0, 'kernel': 'Logistic', 'loss_name': 'CensoredNLLLoss'}. Best is trial 96 with value: 0.8543418990987799.[0m
[32m[I 2022-04-25 17:43:52,380][0m Trial 115 finished with value: 0.8361683276676679 and parameters: {'n_hidden': 512, 'mixture_components': 4, 'use_sparse_layer': False, 'use_batchnorm': False, 'use_dropout': False, 'mlp_size_1': 6, 'mlp_size_2': 0, 'mlp_size_3': 0, 'kernel': 'Logistic', 'loss_name': 'AlternativeNLLLoss'}. Best is trial 96 with value: 0.8543418990987799.[0m
[32m[I 2022-04-25 17:46:44,866][0m Trial 116 finished with value: 0.8293908827665144 and parameters: {'n_hidden': 512, 'mixture_components': 4, 'use_sparse_layer': False, 'use_batchnorm': False, 'use_dropout': False, 'mlp_size_1': 6, 'mlp_size_2': 0, 'mlp_size_3': 0, 'kernel': 'Logistic', 'loss_name': 'NLLLoss'}. Best is trial 96 with value: 0.8543418990987799.[0m
[32m[I 2022-04-25 17:51:26,232][0m Trial 117 finished with value: 0.8389124142386224 and parameters: {'n_hidden': 512, 'mixture_components': 2, 'use_sparse_layer': False, 'use_batchnorm': True, 'use_dropout': False, 'mlp_size_1': 6, 'mlp_size_2': 0, 'mlp_size_3': 0, 'kernel': 'Logistic', 'loss_name': 'AlternativeNLLLoss'}. Best is trial 96 with value: 0.8543418990987799.[0m
[32m[I 2022-04-25 17:56:30,675][0m Trial 118 finished with value: 0.8467224294951731 and parameters: {'n_hidden': 64, 'mixture_components': 5, 'use_sparse_layer': False, 'use_batchnorm': False, 'use_dropout': False, 'mlp_size_1': 3, 'mlp_size_2': 0, 'mlp_size_3': 0, 'kernel': 'Logistic', 'loss_name': 'CensoredNLLLoss'}. Best is trial 96 with value: 0.8543418990987799.[0m
[32m[I 2022-04-25 18:01:40,797][0m Trial 119 finished with value: 0.8527202217354158 and parameters: {'n_hidden': 2048, 'mixture_components': 4, 'use_sparse_layer': True, 'use_sparse_loss': True, 'lmbd': 3.601075567109758e-05, 'use_batchnorm': False, 'use_dropout': False, 'mlp_size_1': 7, 'mlp_size_2': 1, 'mlp_size_3': 0, 'kernel': 'Logistic', 'loss_name': 'AlternativeNLLLoss'}. Best is trial 96 with value: 0.8543418990987799.[0m
[32m[I 2022-04-25 18:05:43,403][0m Trial 120 finished with value: 0.8329274418119915 and parameters: {'n_hidden': 2048, 'mixture_components': 4, 'use_sparse_layer': True, 'use_sparse_loss': True, 'lmbd': 3.8290282010397064e-05, 'use_batchnorm': False, 'use_dropout': True, 'dropout': 0.5767346109316852, 'mlp_size_1': 7, 'mlp_size_2': 1, 'mlp_size_3': 0, 'kernel': 'Logistic', 'loss_name': 'AlternativeNLLLoss'}. Best is trial 96 with value: 0.8543418990987799.[0m
[32m[I 2022-04-25 18:10:42,398][0m Trial 121 finished with value: 0.8533908766270241 and parameters: {'n_hidden': 2048, 'mixture_components': 4, 'use_sparse_layer': True, 'use_sparse_loss': True, 'lmbd': 1.4767131265861085e-05, 'use_batchnorm': False, 'use_dropout': False, 'mlp_size_1': 7, 'mlp_size_2': 1, 'mlp_size_3': 0, 'kernel': 'Logistic', 'loss_name': 'AlternativeNLLLoss'}. Best is trial 96 with value: 0.8543418990987799.[0m
[32m[I 2022-04-25 18:16:34,223][0m Trial 122 finished with value: 0.8490204197580866 and parameters: {'n_hidden': 2048, 'mixture_components': 4, 'use_sparse_layer': True, 'use_sparse_loss': True, 'lmbd': 2.26822870834806e-05, 'use_batchnorm': False, 'use_dropout': False, 'mlp_size_1': 7, 'mlp_size_2': 1, 'mlp_size_3': 0, 'kernel': 'Logistic', 'loss_name': 'AlternativeNLLLoss'}. Best is trial 96 with value: 0.8543418990987799.[0m
[32m[I 2022-04-25 18:21:39,253][0m Trial 123 finished with value: 0.8529307762882933 and parameters: {'n_hidden': 2048, 'mixture_components': 3, 'use_sparse_layer': True, 'use_sparse_loss': True, 'lmbd': 1.3988888929665698e-05, 'use_batchnorm': False, 'use_dropout': False, 'mlp_size_1': 7, 'mlp_size_2': 1, 'mlp_size_3': 0, 'kernel': 'Logistic', 'loss_name': 'AlternativeNLLLoss'}. Best is trial 96 with value: 0.8543418990987799.[0m
[32m[I 2022-04-25 18:25:55,028][0m Trial 124 finished with value: 0.8003848645614624 and parameters: {'n_hidden': 2048, 'mixture_components': 4, 'use_sparse_layer': True, 'use_sparse_loss': True, 'lmbd': 1.2581068236543254e-05, 'use_batchnorm': False, 'use_dropout': False, 'mlp_size_1': 7, 'mlp_size_2': 1, 'mlp_size_3': 0, 'kernel': 'Logistic', 'loss_name': 'AlternativeNLLLoss'}. Best is trial 96 with value: 0.8543418990987799.[0m
[32m[I 2022-04-25 18:30:48,539][0m Trial 125 finished with value: 0.8503372589420405 and parameters: {'n_hidden': 2048, 'mixture_components': 4, 'use_sparse_layer': True, 'use_sparse_loss': True, 'lmbd': 1.3744231778173546e-06, 'use_batchnorm': False, 'use_dropout': False, 'mlp_size_1': 7, 'mlp_size_2': 1, 'mlp_size_3': 0, 'kernel': 'Logistic', 'loss_name': 'AlternativeNLLLoss'}. Best is trial 96 with value: 0.8543418990987799.[0m
[32m[I 2022-04-25 18:36:23,452][0m Trial 126 finished with value: 0.8528626871277327 and parameters: {'n_hidden': 2048, 'mixture_components': 5, 'use_sparse_layer': True, 'use_sparse_loss': True, 'lmbd': 8.64718542981226e-05, 'use_batchnorm': False, 'use_dropout': False, 'mlp_size_1': 7, 'mlp_size_2': 1, 'mlp_size_3': 0, 'kernel': 'Logistic', 'loss_name': 'AlternativeNLLLoss'}. Best is trial 96 with value: 0.8543418990987799.[0m
[32m[I 2022-04-25 18:41:20,705][0m Trial 127 finished with value: 0.8481960335874309 and parameters: {'n_hidden': 2048, 'mixture_components': 5, 'use_sparse_layer': True, 'use_sparse_loss': True, 'lmbd': 0.00013687432635003534, 'use_batchnorm': False, 'use_dropout': False, 'mlp_size_1': 7, 'mlp_size_2': 1, 'mlp_size_3': 0, 'kernel': 'Logistic', 'loss_name': 'AlternativeNLLLoss'}. Best is trial 96 with value: 0.8543418990987799.[0m
