[32m[I 2022-04-21 13:21:33,057][0m Trial 639 finished with value: 0.9150161971866198 and parameters: {'alpha': 1.8415756097897644, 'ties': 'breslow'}. Best is trial 411 with value: 0.91502674920718.[0m
[32m[I 2022-04-21 13:21:43,605][0m Trial 640 finished with value: 0.9149950244306767 and parameters: {'alpha': 2.0191287837939087, 'ties': 'breslow'}. Best is trial 411 with value: 0.91502674920718.[0m
[32m[I 2022-04-21 13:21:53,256][0m Trial 641 finished with value: 0.9149726698427246 and parameters: {'alpha': 2.1598321361670743, 'ties': 'breslow'}. Best is trial 411 with value: 0.91502674920718.[0m
[32m[I 2022-04-21 13:22:01,140][0m Trial 642 finished with value: 0.915018033509375 and parameters: {'alpha': 1.8665524911670754, 'ties': 'breslow'}. Best is trial 411 with value: 0.91502674920718.[0m
[32m[I 2022-04-21 13:22:10,027][0m Trial 643 finished with value: 0.9150259936027835 and parameters: {'alpha': 1.9388624963824106, 'ties': 'breslow'}. Best is trial 411 with value: 0.91502674920718.[0m
[32m[I 2022-04-21 13:22:20,291][0m Trial 644 finished with value: 0.9149798540773186 and parameters: {'alpha': 2.0517201645721315, 'ties': 'breslow'}. Best is trial 411 with value: 0.91502674920718.[0m
[32m[I 2022-04-21 13:22:33,255][0m Trial 645 finished with value: 0.9149278620062054 and parameters: {'alpha': 1.9475621792313913, 'ties': 'efron'}. Best is trial 411 with value: 0.91502674920718.[0m
[32m[I 2022-04-21 13:22:43,696][0m Trial 646 finished with value: 0.9149595900111211 and parameters: {'alpha': 2.6078450021486677, 'ties': 'breslow'}. Best is trial 411 with value: 0.91502674920718.[0m
[32m[I 2022-04-21 13:22:51,934][0m Trial 647 finished with value: 0.915004840760235 and parameters: {'alpha': 1.7762313384165211, 'ties': 'breslow'}. Best is trial 411 with value: 0.91502674920718.[0m
[32m[I 2022-04-21 13:23:01,195][0m Trial 648 finished with value: 0.9147117766092598 and parameters: {'alpha': 0.18270660552852735, 'ties': 'breslow'}. Best is trial 411 with value: 0.91502674920718.[0m
[32m[I 2022-04-21 13:23:09,821][0m Trial 649 finished with value: 0.9150218374287318 and parameters: {'alpha': 1.9479408002964729, 'ties': 'breslow'}. Best is trial 411 with value: 0.91502674920718.[0m
[32m[I 2022-04-21 13:23:18,485][0m Trial 650 finished with value: 0.9150158112940243 and parameters: {'alpha': 1.8287644660690765, 'ties': 'breslow'}. Best is trial 411 with value: 0.91502674920718.[0m
[32m[I 2022-04-21 13:23:27,304][0m Trial 651 finished with value: 0.9149817470066924 and parameters: {'alpha': 1.6031761286358868, 'ties': 'breslow'}. Best is trial 411 with value: 0.91502674920718.[0m
[32m[I 2022-04-21 13:23:35,854][0m Trial 652 finished with value: 0.9149713262342338 and parameters: {'alpha': 2.226216219844732, 'ties': 'breslow'}. Best is trial 411 with value: 0.91502674920718.[0m
[32m[I 2022-04-21 13:23:46,295][0m Trial 653 finished with value: 0.9149723338743222 and parameters: {'alpha': 2.090115886946997, 'ties': 'breslow'}. Best is trial 411 with value: 0.91502674920718.[0m
[32m[I 2022-04-21 13:23:56,086][0m Trial 654 finished with value: 0.9149979790670171 and parameters: {'alpha': 1.7368306926372281, 'ties': 'breslow'}. Best is trial 411 with value: 0.91502674920718.[0m
[32m[I 2022-04-21 13:24:05,378][0m Trial 655 finished with value: 0.9149943938627642 and parameters: {'alpha': 1.9925528274888338, 'ties': 'breslow'}. Best is trial 411 with value: 0.91502674920718.[0m
[32m[I 2022-04-21 13:24:17,168][0m Trial 656 finished with value: 0.91502269850768 and parameters: {'alpha': 1.88757650894363, 'ties': 'breslow'}. Best is trial 411 with value: 0.91502674920718.[0m
[32m[I 2022-04-21 13:24:25,951][0m Trial 657 finished with value: 0.9150065904748045 and parameters: {'alpha': 1.7798654757448027, 'ties': 'breslow'}. Best is trial 411 with value: 0.91502674920718.[0m
[32m[I 2022-04-21 13:24:35,355][0m Trial 658 finished with value: 0.9149749525252007 and parameters: {'alpha': 2.1303956807086513, 'ties': 'breslow'}. Best is trial 411 with value: 0.91502674920718.[0m
[32m[I 2022-04-21 13:24:45,219][0m Trial 659 finished with value: 0.9149910488958752 and parameters: {'alpha': 1.6660767442126287, 'ties': 'breslow'}. Best is trial 411 with value: 0.91502674920718.[0m
[32m[I 2022-04-21 13:24:54,838][0m Trial 660 finished with value: 0.9149930027484927 and parameters: {'alpha': 2.016406071198981, 'ties': 'breslow'}. Best is trial 411 with value: 0.91502674920718.[0m
[32m[I 2022-04-21 13:25:05,366][0m Trial 661 finished with value: 0.9150193413882199 and parameters: {'alpha': 1.8799237401595708, 'ties': 'breslow'}. Best is trial 411 with value: 0.91502674920718.[0m
[32m[I 2022-04-21 13:25:16,995][0m Trial 662 finished with value: 0.9150251395809776 and parameters: {'alpha': 1.935307836649117, 'ties': 'breslow'}. Best is trial 411 with value: 0.91502674920718.[0m
[32m[I 2022-04-21 13:25:27,487][0m Trial 663 finished with value: 0.9150145457074125 and parameters: {'alpha': 1.822676903759527, 'ties': 'breslow'}. Best is trial 411 with value: 0.91502674920718.[0m
[32m[I 2022-04-21 13:25:41,201][0m Trial 664 finished with value: 0.9148857207730032 and parameters: {'alpha': 1.561097238147393, 'ties': 'efron'}. Best is trial 411 with value: 0.91502674920718.[0m
[32m[I 2022-04-21 13:25:50,448][0m Trial 665 finished with value: 0.9149765717647815 and parameters: {'alpha': 2.060584957812843, 'ties': 'breslow'}. Best is trial 411 with value: 0.91502674920718.[0m
[32m[I 2022-04-21 13:26:01,324][0m Trial 666 finished with value: 0.9150088455700969 and parameters: {'alpha': 1.753869822311883, 'ties': 'breslow'}. Best is trial 411 with value: 0.91502674920718.[0m
[32m[I 2022-04-21 13:26:11,716][0m Trial 667 finished with value: 0.9150221823514755 and parameters: {'alpha': 1.9595041129207524, 'ties': 'breslow'}. Best is trial 411 with value: 0.91502674920718.[0m
[32m[I 2022-04-21 13:26:23,952][0m Trial 668 finished with value: 0.9149626628592159 and parameters: {'alpha': 2.413688195815264, 'ties': 'breslow'}. Best is trial 411 with value: 0.91502674920718.[0m
[32m[I 2022-04-21 13:26:35,083][0m Trial 669 finished with value: 0.914971669599157 and parameters: {'alpha': 2.1576139765867923, 'ties': 'breslow'}. Best is trial 411 with value: 0.91502674920718.[0m
[32m[I 2022-04-21 13:26:43,470][0m Trial 670 finished with value: 0.915016553008007 and parameters: {'alpha': 1.864643622575579, 'ties': 'breslow'}. Best is trial 411 with value: 0.91502674920718.[0m
[32m[I 2022-04-21 13:26:54,283][0m Trial 671 finished with value: 0.9149659316690224 and parameters: {'alpha': 2.281577671734557, 'ties': 'breslow'}. Best is trial 411 with value: 0.91502674920718.[0m
[32m[I 2022-04-21 13:27:04,655][0m Trial 672 finished with value: 0.9149928210035279 and parameters: {'alpha': 1.6975149245464742, 'ties': 'breslow'}. Best is trial 411 with value: 0.91502674920718.[0m
[32m[I 2022-04-21 13:27:16,526][0m Trial 673 finished with value: 0.9149511171680089 and parameters: {'alpha': 1.1786509010068749, 'ties': 'breslow'}. Best is trial 411 with value: 0.91502674920718.[0m
[32m[I 2022-04-21 13:27:25,149][0m Trial 674 finished with value: 0.9149927223656016 and parameters: {'alpha': 2.0290169208178934, 'ties': 'breslow'}. Best is trial 411 with value: 0.91502674920718.[0m
[32m[I 2022-04-21 13:27:33,925][0m Trial 675 finished with value: 0.9150256744428196 and parameters: {'alpha': 1.8938434907490145, 'ties': 'breslow'}. Best is trial 411 with value: 0.91502674920718.[0m
[32m[I 2022-04-21 13:27:43,620][0m Trial 676 finished with value: 0.9150165297245451 and parameters: {'alpha': 1.8346574126413548, 'ties': 'breslow'}. Best is trial 411 with value: 0.91502674920718.[0m
[32m[I 2022-04-21 13:27:54,537][0m Trial 677 finished with value: 0.9150214351712265 and parameters: {'alpha': 1.9659232789674363, 'ties': 'breslow'}. Best is trial 411 with value: 0.91502674920718.[0m
[32m[I 2022-04-21 13:28:05,297][0m Trial 678 finished with value: 0.9149980677062309 and parameters: {'alpha': 1.7208925618481774, 'ties': 'breslow'}. Best is trial 411 with value: 0.91502674920718.[0m
[32m[I 2022-04-21 13:28:15,651][0m Trial 679 finished with value: 0.9150202938813976 and parameters: {'alpha': 1.9276630917384323, 'ties': 'breslow'}. Best is trial 411 with value: 0.91502674920718.[0m
[32m[I 2022-04-21 13:28:25,584][0m Trial 680 finished with value: 0.9149392557728231 and parameters: {'alpha': 3.2745960331041557, 'ties': 'breslow'}. Best is trial 411 with value: 0.91502674920718.[0m
[32m[I 2022-04-21 13:28:34,846][0m Trial 681 finished with value: 0.9149712863895033 and parameters: {'alpha': 2.08267499275223, 'ties': 'breslow'}. Best is trial 411 with value: 0.91502674920718.[0m
[32m[I 2022-04-21 13:28:45,325][0m Trial 682 finished with value: 0.9150073407750895 and parameters: {'alpha': 1.802023523848837, 'ties': 'breslow'}. Best is trial 411 with value: 0.91502674920718.[0m
[32m[I 2022-04-21 13:28:55,521][0m Trial 683 finished with value: 0.915022006423262 and parameters: {'alpha': 1.8865159699947187, 'ties': 'breslow'}. Best is trial 411 with value: 0.91502674920718.[0m
[32m[I 2022-04-21 13:29:06,071][0m Trial 684 finished with value: 0.9149936262383342 and parameters: {'alpha': 2.0180202529450977, 'ties': 'breslow'}. Best is trial 411 with value: 0.91502674920718.[0m
[32m[I 2022-04-21 13:29:22,066][0m Trial 685 finished with value: 0.9149539114429833 and parameters: {'alpha': 2.1848522936831234, 'ties': 'efron'}. Best is trial 411 with value: 0.91502674920718.[0m
[32m[I 2022-04-21 13:29:31,775][0m Trial 686 finished with value: 0.9150170900102867 and parameters: {'alpha': 1.8364326449167365, 'ties': 'breslow'}. Best is trial 411 with value: 0.91502674920718.[0m
[32m[I 2022-04-21 13:29:41,716][0m Trial 687 finished with value: 0.9149915800160164 and parameters: {'alpha': 1.6649133293576375, 'ties': 'breslow'}. Best is trial 411 with value: 0.91502674920718.[0m
[32m[I 2022-04-21 13:29:52,006][0m Trial 688 finished with value: 0.915026275270758 and parameters: {'alpha': 1.9383280680565547, 'ties': 'breslow'}. Best is trial 411 with value: 0.91502674920718.[0m
[32m[I 2022-04-21 13:30:01,453][0m Trial 689 finished with value: 0.9149787937662314 and parameters: {'alpha': 2.054424668967647, 'ties': 'breslow'}. Best is trial 411 with value: 0.91502674920718.[0m
[32m[I 2022-04-21 13:30:11,436][0m Trial 690 finished with value: 0.9150220613543356 and parameters: {'alpha': 1.9532329380476428, 'ties': 'breslow'}. Best is trial 411 with value: 0.91502674920718.[0m
[32m[I 2022-04-21 13:30:20,879][0m Trial 691 finished with value: 0.9149712270470582 and parameters: {'alpha': 2.1570965569722254, 'ties': 'breslow'}. Best is trial 411 with value: 0.91502674920718.[0m
[32m[I 2022-04-21 13:30:29,903][0m Trial 692 finished with value: 0.9150055730662462 and parameters: {'alpha': 1.7484352905950689, 'ties': 'breslow'}. Best is trial 411 with value: 0.91502674920718.[0m
[32m[I 2022-04-21 13:30:40,357][0m Trial 693 finished with value: 0.9149740153092015 and parameters: {'alpha': 1.507210630169818, 'ties': 'breslow'}. Best is trial 411 with value: 0.91502674920718.[0m
[32m[I 2022-04-21 13:30:49,163][0m Trial 694 finished with value: 0.9149934078125872 and parameters: {'alpha': 1.9945231715217986, 'ties': 'breslow'}. Best is trial 411 with value: 0.91502674920718.[0m
[32m[I 2022-04-21 13:30:58,149][0m Trial 695 finished with value: 0.9150152739601252 and parameters: {'alpha': 1.8245532961409092, 'ties': 'breslow'}. Best is trial 411 with value: 0.91502674920718.[0m
[32m[I 2022-04-21 13:31:08,154][0m Trial 696 finished with value: 0.9149709735903677 and parameters: {'alpha': 2.0952610598255323, 'ties': 'breslow'}. Best is trial 411 with value: 0.91502674920718.[0m
[32m[I 2022-04-21 13:31:19,141][0m Trial 697 finished with value: 0.9150217054072545 and parameters: {'alpha': 1.9228093930861065, 'ties': 'breslow'}. Best is trial 411 with value: 0.91502674920718.[0m
[32m[I 2022-04-21 13:31:28,354][0m Trial 698 finished with value: 0.9149938098535451 and parameters: {'alpha': 2.0132796980927252, 'ties': 'breslow'}. Best is trial 411 with value: 0.91502674920718.[0m
[32m[I 2022-04-21 13:31:37,439][0m Trial 699 finished with value: 0.9150051202429893 and parameters: {'alpha': 1.7707342005207607, 'ties': 'breslow'}. Best is trial 411 with value: 0.91502674920718.[0m
[32m[I 2022-04-21 13:31:47,196][0m Trial 700 finished with value: 0.9150258832974364 and parameters: {'alpha': 1.9135983855065377, 'ties': 'breslow'}. Best is trial 411 with value: 0.91502674920718.[0m
[32m[I 2022-04-21 13:31:57,668][0m Trial 701 finished with value: 0.9149857463144665 and parameters: {'alpha': 1.6404931415553183, 'ties': 'breslow'}. Best is trial 411 with value: 0.91502674920718.[0m
[32m[I 2022-04-21 13:32:07,788][0m Trial 702 finished with value: 0.9150220123247601 and parameters: {'alpha': 1.8870782375319421, 'ties': 'breslow'}. Best is trial 411 with value: 0.91502674920718.[0m
[32m[I 2022-04-21 13:32:18,427][0m Trial 703 finished with value: 0.9149640351699375 and parameters: {'alpha': 2.263912869797876, 'ties': 'breslow'}. Best is trial 411 with value: 0.91502674920718.[0m
[32m[I 2022-04-21 13:32:31,881][0m Trial 704 finished with value: 0.9149385714657324 and parameters: {'alpha': 2.0939868666618455, 'ties': 'efron'}. Best is trial 411 with value: 0.91502674920718.[0m
[32m[I 2022-04-21 13:32:42,706][0m Trial 705 finished with value: 0.9150248909132296 and parameters: {'alpha': 1.976686094816279, 'ties': 'breslow'}. Best is trial 411 with value: 0.91502674920718.[0m
[32m[I 2022-04-21 13:32:52,307][0m Trial 706 finished with value: 0.9150160764893283 and parameters: {'alpha': 1.8289969922974276, 'ties': 'breslow'}. Best is trial 411 with value: 0.91502674920718.[0m
[32m[I 2022-04-21 13:33:01,865][0m Trial 707 finished with value: 0.9149929628894495 and parameters: {'alpha': 1.7011248939910744, 'ties': 'breslow'}. Best is trial 411 with value: 0.91502674920718.[0m
[32m[I 2022-04-21 13:33:11,709][0m Trial 708 finished with value: 0.9150224253747471 and parameters: {'alpha': 1.923424911035196, 'ties': 'breslow'}. Best is trial 411 with value: 0.91502674920718.[0m
[32m[I 2022-04-21 13:33:21,087][0m Trial 709 finished with value: 0.9149813625274847 and parameters: {'alpha': 2.039403533289205, 'ties': 'breslow'}. Best is trial 411 with value: 0.91502674920718.[0m
[32m[I 2022-04-21 13:33:30,236][0m Trial 710 finished with value: 0.9149714067139522 and parameters: {'alpha': 2.1764517165835024, 'ties': 'breslow'}. Best is trial 411 with value: 0.91502674920718.[0m
[32m[I 2022-04-21 13:33:38,960][0m Trial 711 finished with value: 0.9150048455326415 and parameters: {'alpha': 1.7870562067591114, 'ties': 'breslow'}. Best is trial 411 with value: 0.91502674920718.[0m
[32m[I 2022-04-21 13:33:49,176][0m Trial 712 finished with value: 0.914980450976889 and parameters: {'alpha': 1.5880935601021808, 'ties': 'breslow'}. Best is trial 411 with value: 0.91502674920718.[0m
[32m[I 2022-04-21 13:33:58,298][0m Trial 713 finished with value: 0.9150258999529134 and parameters: {'alpha': 1.9067520016394217, 'ties': 'breslow'}. Best is trial 411 with value: 0.91502674920718.[0m
[32m[I 2022-04-21 13:34:09,846][0m Trial 714 finished with value: 0.9150162023953499 and parameters: {'alpha': 1.8575220894770077, 'ties': 'breslow'}. Best is trial 411 with value: 0.91502674920718.[0m
[32m[I 2022-04-21 13:34:20,710][0m Trial 715 finished with value: 0.9149942778957276 and parameters: {'alpha': 1.995734751998036, 'ties': 'breslow'}. Best is trial 411 with value: 0.91502674920718.[0m
[32m[I 2022-04-21 13:34:31,174][0m Trial 716 finished with value: 0.9150001592565561 and parameters: {'alpha': 1.7298656269550263, 'ties': 'breslow'}. Best is trial 411 with value: 0.91502674920718.[0m
[32m[I 2022-04-21 13:34:41,042][0m Trial 717 finished with value: 0.9149712381744897 and parameters: {'alpha': 2.086536630510343, 'ties': 'breslow'}. Best is trial 411 with value: 0.91502674920718.[0m
[32m[I 2022-04-21 13:34:52,994][0m Trial 718 finished with value: 0.9150199769072266 and parameters: {'alpha': 1.9299857888378373, 'ties': 'breslow'}. Best is trial 411 with value: 0.91502674920718.[0m
[32m[I 2022-04-21 13:35:03,750][0m Trial 719 finished with value: 0.9150157976456331 and parameters: {'alpha': 1.8282130754229833, 'ties': 'breslow'}. Best is trial 411 with value: 0.91502674920718.[0m
[32m[I 2022-04-21 13:35:13,937][0m Trial 720 finished with value: 0.915022035953473 and parameters: {'alpha': 1.9552570343786777, 'ties': 'breslow'}. Best is trial 411 with value: 0.91502674920718.[0m
[32m[I 2022-04-21 13:35:23,493][0m Trial 721 finished with value: 0.9149990520704385 and parameters: {'alpha': 1.7338748043491492, 'ties': 'breslow'}. Best is trial 411 with value: 0.91502674920718.[0m
[32m[I 2022-04-21 13:35:33,762][0m Trial 722 finished with value: 0.9148941582525947 and parameters: {'alpha': 4.591663194666449, 'ties': 'breslow'}. Best is trial 411 with value: 0.91502674920718.[0m
[32m[I 2022-04-21 13:35:48,211][0m Trial 723 finished with value: 0.9149473612360326 and parameters: {'alpha': 2.134209488627362, 'ties': 'efron'}. Best is trial 411 with value: 0.91502674920718.[0m
[32m[I 2022-04-21 13:35:57,264][0m Trial 724 finished with value: 0.9150171084637199 and parameters: {'alpha': 1.8565768964786649, 'ties': 'breslow'}. Best is trial 411 with value: 0.91502674920718.[0m
[32m[I 2022-04-21 13:36:04,715][0m Trial 725 finished with value: 0.9149933153841936 and parameters: {'alpha': 2.0264740424982914, 'ties': 'breslow'}. Best is trial 411 with value: 0.91502674920718.[0m
[32m[I 2022-04-21 13:36:13,309][0m Trial 726 finished with value: 0.9149655123181955 and parameters: {'alpha': 2.320577507354879, 'ties': 'breslow'}. Best is trial 411 with value: 0.91502674920718.[0m
[32m[I 2022-04-21 13:36:23,915][0m Trial 727 finished with value: 0.9149865700218698 and parameters: {'alpha': 1.64082733374919, 'ties': 'breslow'}. Best is trial 411 with value: 0.91502674920718.[0m
[32m[I 2022-04-21 13:36:34,069][0m Trial 728 finished with value: 0.9150214323542432 and parameters: {'alpha': 1.9179353187208488, 'ties': 'breslow'}. Best is trial 411 with value: 0.91502674920718.[0m
[32m[I 2022-04-21 13:36:43,260][0m Trial 729 finished with value: 0.915009530594976 and parameters: {'alpha': 1.7827692903493904, 'ties': 'breslow'}. Best is trial 411 with value: 0.91502674920718.[0m
[32m[I 2022-04-21 13:36:53,640][0m Trial 730 finished with value: 0.9149928994714769 and parameters: {'alpha': 2.030681849101474, 'ties': 'breslow'}. Best is trial 411 with value: 0.91502674920718.[0m
[32m[I 2022-04-21 13:37:03,314][0m Trial 731 finished with value: 0.9149006534849278 and parameters: {'alpha': 0.8136491160841621, 'ties': 'breslow'}. Best is trial 411 with value: 0.91502674920718.[0m
[32m[I 2022-04-21 13:37:12,174][0m Trial 732 finished with value: 0.91497006626225 and parameters: {'alpha': 1.4077970487652576, 'ties': 'breslow'}. Best is trial 411 with value: 0.91502674920718.[0m
[32m[I 2022-04-21 13:37:22,233][0m Trial 733 finished with value: 0.9150174714660174 and parameters: {'alpha': 1.8607332098309912, 'ties': 'breslow'}. Best is trial 411 with value: 0.91502674920718.[0m
[32m[I 2022-04-21 13:37:33,216][0m Trial 734 finished with value: 0.9149689352613676 and parameters: {'alpha': 2.2186974964642845, 'ties': 'breslow'}. Best is trial 411 with value: 0.91502674920718.[0m
[32m[I 2022-04-21 13:37:42,783][0m Trial 735 finished with value: 0.915021919296767 and parameters: {'alpha': 1.944482174235313, 'ties': 'breslow'}. Best is trial 411 with value: 0.91502674920718.[0m
[32m[I 2022-04-21 13:37:50,044][0m Trial 736 finished with value: 0.915005093244163 and parameters: {'alpha': 1.7855462492080967, 'ties': 'breslow'}. Best is trial 411 with value: 0.91502674920718.[0m
[32m[I 2022-04-21 13:38:02,229][0m Trial 737 finished with value: 0.914973238114918 and parameters: {'alpha': 2.101695619096949, 'ties': 'breslow'}. Best is trial 411 with value: 0.91502674920718.[0m
[32m[I 2022-04-21 13:38:10,750][0m Trial 738 finished with value: 0.9149910556953609 and parameters: {'alpha': 1.6765800843721383, 'ties': 'breslow'}. Best is trial 411 with value: 0.91502674920718.[0m
[32m[I 2022-04-21 13:38:20,910][0m Trial 739 finished with value: 0.9150252902243861 and parameters: {'alpha': 1.9895013250172346, 'ties': 'breslow'}. Best is trial 411 with value: 0.91502674920718.[0m
[32m[I 2022-04-21 13:38:31,807][0m Trial 740 finished with value: 0.9150192122593996 and parameters: {'alpha': 1.8800475014542173, 'ties': 'breslow'}. Best is trial 411 with value: 0.91502674920718.[0m
[32m[I 2022-04-21 13:38:43,583][0m Trial 741 finished with value: 0.9150061855340171 and parameters: {'alpha': 1.784566050969372, 'ties': 'breslow'}. Best is trial 411 with value: 0.91502674920718.[0m
[32m[I 2022-04-21 13:38:55,344][0m Trial 742 finished with value: 0.9148766745630355 and parameters: {'alpha': 1.5178303232967387, 'ties': 'efron'}. Best is trial 411 with value: 0.91502674920718.[0m
[32m[I 2022-04-21 13:39:05,777][0m Trial 743 finished with value: 0.9149711771728605 and parameters: {'alpha': 2.076481104362042, 'ties': 'breslow'}. Best is trial 411 with value: 0.91502674920718.[0m
[32m[I 2022-04-21 13:39:15,069][0m Trial 744 finished with value: 0.9150234015967891 and parameters: {'alpha': 1.9434935721851372, 'ties': 'breslow'}. Best is trial 411 with value: 0.91502674920718.[0m
[32m[I 2022-04-21 13:39:26,134][0m Trial 745 finished with value: 0.9150181667440007 and parameters: {'alpha': 1.8549973521378722, 'ties': 'breslow'}. Best is trial 411 with value: 0.91502674920718.[0m
