[32m[I 2022-04-21 13:48:01,475][0m Trial 806 finished with value: 0.9093247923494931 and parameters: {'splitter': 'random', 'min_samples_split': 0.0699675816193786, 'min_samples_leaf': 0.04276944170695901, 'min_weight_fraction_leaf': 0.036865159566478484, 'max_features': 0.9177071148151218}. Best is trial 677 with value: 0.9113497956229912.[0m
[32m[I 2022-04-21 13:48:03,464][0m Trial 807 finished with value: 0.8801663204029481 and parameters: {'splitter': 'random', 'min_samples_split': 0.08995899269610769, 'min_samples_leaf': 0.12189961276101796, 'min_weight_fraction_leaf': 0.0485000558018532, 'max_features': 0.9452851407595708}. Best is trial 677 with value: 0.9113497956229912.[0m
[32m[I 2022-04-21 13:48:04,758][0m Trial 808 finished with value: 0.9062022122659787 and parameters: {'splitter': 'random', 'min_samples_split': 0.07935642659549216, 'min_samples_leaf': 0.06533740719584738, 'min_weight_fraction_leaf': 0.06035225969897573, 'max_features': 0.9184259749780538}. Best is trial 677 with value: 0.9113497956229912.[0m
[32m[I 2022-04-21 13:48:06,724][0m Trial 809 finished with value: 0.9025493650677878 and parameters: {'splitter': 'random', 'min_samples_split': 0.09093163636729042, 'min_samples_leaf': 0.05016170940606479, 'min_weight_fraction_leaf': 0.041883613888383055, 'max_features': 0.9648279189339916}. Best is trial 677 with value: 0.9113497956229912.[0m
[32m[I 2022-04-21 13:48:08,623][0m Trial 810 finished with value: 0.9034327170609309 and parameters: {'splitter': 'random', 'min_samples_split': 0.07143784554053603, 'min_samples_leaf': 0.055408143135735735, 'min_weight_fraction_leaf': 0.0359462710491214, 'max_features': 0.9324159447546201}. Best is trial 677 with value: 0.9113497956229912.[0m
[32m[I 2022-04-21 13:48:10,446][0m Trial 811 finished with value: 0.9016162839818364 and parameters: {'splitter': 'random', 'min_samples_split': 0.07958622630626794, 'min_samples_leaf': 0.045300374219947856, 'min_weight_fraction_leaf': 0.0501056604428294, 'max_features': 0.8982722712602059}. Best is trial 677 with value: 0.9113497956229912.[0m
[32m[I 2022-04-21 13:48:12,779][0m Trial 812 finished with value: 0.902348563436209 and parameters: {'splitter': 'random', 'min_samples_split': 0.06692554441790755, 'min_samples_leaf': 0.04420206859273752, 'min_weight_fraction_leaf': 0.07038755882466599, 'max_features': 0.9505706737834787}. Best is trial 677 with value: 0.9113497956229912.[0m
[32m[I 2022-04-21 13:48:15,437][0m Trial 813 finished with value: 0.9013255026991291 and parameters: {'splitter': 'random', 'min_samples_split': 0.2579793578855625, 'min_samples_leaf': 0.07492062270104272, 'min_weight_fraction_leaf': 0.03756360788852784, 'max_features': 0.9830301678734372}. Best is trial 677 with value: 0.9113497956229912.[0m
[32m[I 2022-04-21 13:48:18,235][0m Trial 814 finished with value: 0.904042237336791 and parameters: {'splitter': 'random', 'min_samples_split': 0.09469361630649115, 'min_samples_leaf': 0.057191410202968404, 'min_weight_fraction_leaf': 0.046087369922306956, 'max_features': 0.9141110015905126}. Best is trial 677 with value: 0.9113497956229912.[0m
[32m[I 2022-04-21 13:48:20,382][0m Trial 815 finished with value: 0.8998304406220624 and parameters: {'splitter': 'random', 'min_samples_split': 0.0715040483887503, 'min_samples_leaf': 0.03885968785361947, 'min_weight_fraction_leaf': 0.032756544081263564, 'max_features': 0.9346981043087484}. Best is trial 677 with value: 0.9113497956229912.[0m
[32m[I 2022-04-21 13:48:21,924][0m Trial 816 finished with value: 0.8991769880577024 and parameters: {'splitter': 'random', 'min_samples_split': 0.0595680615002543, 'min_samples_leaf': 0.0482262698629019, 'min_weight_fraction_leaf': 0.0584458411804127, 'max_features': 0.8882869563326596}. Best is trial 677 with value: 0.9113497956229912.[0m
[32m[I 2022-04-21 13:48:24,258][0m Trial 817 finished with value: 0.9003011938078893 and parameters: {'splitter': 'random', 'min_samples_split': 0.07714480660159916, 'min_samples_leaf': 0.03243484453307372, 'min_weight_fraction_leaf': 0.028986030407968415, 'max_features': 0.9615969377432932}. Best is trial 677 with value: 0.9113497956229912.[0m
[32m[I 2022-04-21 13:48:26,820][0m Trial 818 finished with value: 0.9093247923494931 and parameters: {'splitter': 'random', 'min_samples_split': 0.06686488916502321, 'min_samples_leaf': 0.042663399886587905, 'min_weight_fraction_leaf': 0.0433081758785206, 'max_features': 0.9167084646086969}. Best is trial 677 with value: 0.9113497956229912.[0m
[32m[I 2022-04-21 13:48:29,686][0m Trial 819 finished with value: 0.8991637258224479 and parameters: {'splitter': 'random', 'min_samples_split': 0.07879171383982592, 'min_samples_leaf': 0.06192598848778874, 'min_weight_fraction_leaf': 0.05617319858491449, 'max_features': 0.8572891471437343}. Best is trial 677 with value: 0.9113497956229912.[0m
[32m[I 2022-04-21 13:48:32,624][0m Trial 820 finished with value: 0.9068422141505674 and parameters: {'splitter': 'random', 'min_samples_split': 0.0670590918061147, 'min_samples_leaf': 0.042118167127377024, 'min_weight_fraction_leaf': 0.04566232329405585, 'max_features': 0.9180267899291021}. Best is trial 677 with value: 0.9113497956229912.[0m
[32m[I 2022-04-21 13:48:34,553][0m Trial 821 finished with value: 0.9035374272070019 and parameters: {'splitter': 'random', 'min_samples_split': 0.0852910896548502, 'min_samples_leaf': 0.05274550876061218, 'min_weight_fraction_leaf': 0.014588280410736877, 'max_features': 0.9427844083395824}. Best is trial 677 with value: 0.9113497956229912.[0m
[32m[I 2022-04-21 13:51:48,991][0m Trial 822 finished with value: 0.8950625146057991 and parameters: {'splitter': 'best', 'min_samples_split': 0.10205737165436217, 'min_samples_leaf': 0.03091574773223428, 'min_weight_fraction_leaf': 0.06930088876380168, 'max_features': 0.8851122043665128}. Best is trial 677 with value: 0.9113497956229912.[0m
[32m[I 2022-04-21 13:51:50,452][0m Trial 823 finished with value: 0.9000540072333021 and parameters: {'splitter': 'random', 'min_samples_split': 0.0905701297547393, 'min_samples_leaf': 0.03504958250635197, 'min_weight_fraction_leaf': 0.06341047894380769, 'max_features': 0.900689714155123}. Best is trial 677 with value: 0.9113497956229912.[0m
[32m[I 2022-04-21 13:51:51,777][0m Trial 824 finished with value: 0.8858040165188574 and parameters: {'splitter': 'random', 'min_samples_split': 0.06326573449342932, 'min_samples_leaf': 0.07109404145861904, 'min_weight_fraction_leaf': 0.04930371536340972, 'max_features': 0.8346769331378392}. Best is trial 677 with value: 0.9113497956229912.[0m
[32m[I 2022-04-21 13:51:54,014][0m Trial 825 finished with value: 0.9070070993898618 and parameters: {'splitter': 'random', 'min_samples_split': 0.06930522335540346, 'min_samples_leaf': 0.04646045203531279, 'min_weight_fraction_leaf': 0.0358929520607101, 'max_features': 0.9804880512153015}. Best is trial 677 with value: 0.9113497956229912.[0m
[32m[I 2022-04-21 13:51:56,811][0m Trial 826 finished with value: 0.907205270918622 and parameters: {'splitter': 'random', 'min_samples_split': 0.07992397289361647, 'min_samples_leaf': 0.025218321104588153, 'min_weight_fraction_leaf': 0.05288272034471217, 'max_features': 0.9101543386458361}. Best is trial 677 with value: 0.9113497956229912.[0m
[32m[I 2022-04-21 13:51:57,911][0m Trial 827 finished with value: 0.8866881905797304 and parameters: {'splitter': 'random', 'min_samples_split': 0.06945597819315034, 'min_samples_leaf': 0.08592955109115888, 'min_weight_fraction_leaf': 0.08013934751584409, 'max_features': 0.8805371026883941}. Best is trial 677 with value: 0.9113497956229912.[0m
[32m[I 2022-04-21 13:52:00,243][0m Trial 828 finished with value: 0.9016525472581363 and parameters: {'splitter': 'random', 'min_samples_split': 0.2801297622117066, 'min_samples_leaf': 0.0390369346489925, 'min_weight_fraction_leaf': 0.026709128180696037, 'max_features': 0.935846175233112}. Best is trial 677 with value: 0.9113497956229912.[0m
[32m[I 2022-04-21 13:52:02,289][0m Trial 829 finished with value: 0.899104059033407 and parameters: {'splitter': 'random', 'min_samples_split': 0.06041619916493744, 'min_samples_leaf': 0.02410544498092168, 'min_weight_fraction_leaf': 0.041613295406435956, 'max_features': 0.9033905116465857}. Best is trial 677 with value: 0.9113497956229912.[0m
[32m[I 2022-04-21 13:52:04,933][0m Trial 830 finished with value: 0.903331391592884 and parameters: {'splitter': 'random', 'min_samples_split': 0.10945166916709811, 'min_samples_leaf': 0.03033015705913318, 'min_weight_fraction_leaf': 0.04300963217204082, 'max_features': 0.9997128115486308}. Best is trial 677 with value: 0.9113497956229912.[0m
[32m[I 2022-04-21 13:52:06,775][0m Trial 831 finished with value: 0.8973014932577141 and parameters: {'splitter': 'random', 'min_samples_split': 0.0463177869412905, 'min_samples_leaf': 0.055459369572435524, 'min_weight_fraction_leaf': 0.01840557412351084, 'max_features': 0.9601969285423713}. Best is trial 677 with value: 0.9113497956229912.[0m
[32m[I 2022-04-21 13:52:08,567][0m Trial 832 finished with value: 0.901617330983847 and parameters: {'splitter': 'random', 'min_samples_split': 0.08709093917912876, 'min_samples_leaf': 0.018799412431801818, 'min_weight_fraction_leaf': 0.06176561685661516, 'max_features': 0.8664482089518558}. Best is trial 677 with value: 0.9113497956229912.[0m
[32m[I 2022-04-21 13:52:11,494][0m Trial 833 finished with value: 0.9041457305738018 and parameters: {'splitter': 'random', 'min_samples_split': 0.052762841739147866, 'min_samples_leaf': 0.037604753284246145, 'min_weight_fraction_leaf': 0.0324280721523765, 'max_features': 0.9220251516975262}. Best is trial 677 with value: 0.9113497956229912.[0m
[32m[I 2022-04-21 13:52:14,014][0m Trial 834 finished with value: 0.9026990429796106 and parameters: {'splitter': 'random', 'min_samples_split': 0.037478068296056266, 'min_samples_leaf': 0.06354705206330935, 'min_weight_fraction_leaf': 0.017428177244101502, 'max_features': 0.9440120614500527}. Best is trial 677 with value: 0.9113497956229912.[0m
[32m[I 2022-04-21 13:52:16,769][0m Trial 835 finished with value: 0.900988759400066 and parameters: {'splitter': 'random', 'min_samples_split': 0.07311950702079512, 'min_samples_leaf': 0.047552340311228805, 'min_weight_fraction_leaf': 0.04444897349788127, 'max_features': 0.8984357141980828}. Best is trial 677 with value: 0.9113497956229912.[0m
[32m[I 2022-04-21 13:52:18,804][0m Trial 836 finished with value: 0.7797722362636331 and parameters: {'splitter': 'random', 'min_samples_split': 0.054030001699042526, 'min_samples_leaf': 0.024880543226489263, 'min_weight_fraction_leaf': 0.18608399318577612, 'max_features': 0.9639957838321662}. Best is trial 677 with value: 0.9113497956229912.[0m
[32m[I 2022-04-21 13:52:21,116][0m Trial 837 finished with value: 0.9057067955155589 and parameters: {'splitter': 'random', 'min_samples_split': 0.06531285674049675, 'min_samples_leaf': 0.016808782435070436, 'min_weight_fraction_leaf': 0.037300406453427054, 'max_features': 0.9186510289681377}. Best is trial 677 with value: 0.9113497956229912.[0m
[32m[I 2022-04-21 13:52:23,602][0m Trial 838 finished with value: 0.9009816885237264 and parameters: {'splitter': 'random', 'min_samples_split': 0.1476556484994626, 'min_samples_leaf': 0.03942043580981899, 'min_weight_fraction_leaf': 0.02671690360658367, 'max_features': 0.9364238595105795}. Best is trial 677 with value: 0.9113497956229912.[0m
[32m[I 2022-04-21 13:52:26,728][0m Trial 839 finished with value: 0.9053238947287141 and parameters: {'splitter': 'random', 'min_samples_split': 0.028788893750419164, 'min_samples_leaf': 0.032060602548504354, 'min_weight_fraction_leaf': 0.009877693552845998, 'max_features': 0.9495297403980381}. Best is trial 677 with value: 0.9113497956229912.[0m
[32m[I 2022-04-21 13:52:29,284][0m Trial 840 finished with value: 0.907128987570806 and parameters: {'splitter': 'random', 'min_samples_split': 0.035837928458069074, 'min_samples_leaf': 0.04848105084878303, 'min_weight_fraction_leaf': 0.02364672137295208, 'max_features': 0.9833922311852092}. Best is trial 677 with value: 0.9113497956229912.[0m
[32m[I 2022-04-21 13:56:11,741][0m Trial 841 finished with value: 0.8833527420174333 and parameters: {'splitter': 'best', 'min_samples_split': 0.07819580305772289, 'min_samples_leaf': 0.00919442008875761, 'min_weight_fraction_leaf': 0.05173722280013709, 'max_features': 0.8931331480898931}. Best is trial 677 with value: 0.9113497956229912.[0m
[32m[I 2022-04-21 13:56:13,614][0m Trial 842 finished with value: 0.909998203716954 and parameters: {'splitter': 'random', 'min_samples_split': 0.04873249252060691, 'min_samples_leaf': 0.020315177003950722, 'min_weight_fraction_leaf': 0.007660692189565695, 'max_features': 0.9289191697603728}. Best is trial 677 with value: 0.9113497956229912.[0m
/media/san2_ssd/data/Workdir/survival/utils.py:305: RuntimeWarning: invalid value encountered in true_divide
  pdfs = np.gradient(1-survs,axis=1)/norms
/media/san2_ssd/data/Workdir/survival/utils.py:305: RuntimeWarning: invalid value encountered in true_divide
  pdfs = np.gradient(1-survs,axis=1)/norms
[32m[I 2022-04-21 13:56:17,814][0m Trial 843 finished with value: 0.7972274356465012 and parameters: {'splitter': 'random', 'min_samples_split': 0.02292093813573895, 'min_samples_leaf': 0.009629272311435785, 'min_weight_fraction_leaf': 0.0003622972952192563, 'max_features': 0.9638388029173894}. Best is trial 677 with value: 0.9113497956229912.[0m
[32m[I 2022-04-21 13:56:20,803][0m Trial 844 finished with value: 0.9061294826044133 and parameters: {'splitter': 'random', 'min_samples_split': 0.04438424972805638, 'min_samples_leaf': 0.018044614010109233, 'min_weight_fraction_leaf': 0.010500574782228225, 'max_features': 0.929566339524355}. Best is trial 677 with value: 0.9113497956229912.[0m
[32m[I 2022-04-21 13:56:22,228][0m Trial 845 finished with value: 0.9091913780925596 and parameters: {'splitter': 'random', 'min_samples_split': 0.030015695211443247, 'min_samples_leaf': 0.019916745438688085, 'min_weight_fraction_leaf': 0.028584591601756137, 'max_features': 0.9521509275930435}. Best is trial 677 with value: 0.9113497956229912.[0m
[32m[I 2022-04-21 13:56:24,048][0m Trial 846 finished with value: 0.9059201263721925 and parameters: {'splitter': 'random', 'min_samples_split': 0.02171076379714943, 'min_samples_leaf': 0.02649122582598968, 'min_weight_fraction_leaf': 0.006311336159806728, 'max_features': 0.9846322667018947}. Best is trial 677 with value: 0.9113497956229912.[0m
[32m[I 2022-04-21 13:56:25,605][0m Trial 847 finished with value: 0.9075017303083565 and parameters: {'splitter': 'random', 'min_samples_split': 0.028920750748348673, 'min_samples_leaf': 0.023768618443402462, 'min_weight_fraction_leaf': 0.0001363878777177023, 'max_features': 0.9597567407498391}. Best is trial 677 with value: 0.9113497956229912.[0m
[32m[I 2022-04-21 13:56:26,563][0m Trial 848 finished with value: 0.8803525245465874 and parameters: {'splitter': 'random', 'min_samples_split': 0.01729355925008395, 'min_samples_leaf': 0.19371856112221844, 'min_weight_fraction_leaf': 0.033207671057461675, 'max_features': 0.9172946713536485}. Best is trial 677 with value: 0.9113497956229912.[0m
[32m[I 2022-04-21 13:56:28,130][0m Trial 849 finished with value: 0.9031211015629509 and parameters: {'splitter': 'random', 'min_samples_split': 0.0014373240624610817, 'min_samples_leaf': 0.029252907317351418, 'min_weight_fraction_leaf': 0.018177957340762874, 'max_features': 0.9758582903611379}. Best is trial 677 with value: 0.9113497956229912.[0m
[32m[I 2022-04-21 13:56:29,865][0m Trial 850 finished with value: 0.9059407356973013 and parameters: {'splitter': 'random', 'min_samples_split': 0.09756946048065662, 'min_samples_leaf': 0.019646581229250677, 'min_weight_fraction_leaf': 0.02630959982173267, 'max_features': 0.9495636100728397}. Best is trial 677 with value: 0.9113497956229912.[0m
[32m[I 2022-04-21 13:56:31,523][0m Trial 851 finished with value: 0.9067296039241688 and parameters: {'splitter': 'random', 'min_samples_split': 0.053245150378136666, 'min_samples_leaf': 0.03318206045030268, 'min_weight_fraction_leaf': 0.03679367492456797, 'max_features': 0.911781646836392}. Best is trial 677 with value: 0.9113497956229912.[0m
[32m[I 2022-04-21 13:56:33,682][0m Trial 852 finished with value: 0.9093512604340045 and parameters: {'splitter': 'random', 'min_samples_split': 0.05942755459498031, 'min_samples_leaf': 0.02242779319194732, 'min_weight_fraction_leaf': 0.008725105199905613, 'max_features': 0.9344759986902549}. Best is trial 677 with value: 0.9113497956229912.[0m
[32m[I 2022-04-21 13:56:35,887][0m Trial 853 finished with value: 0.9035997787811236 and parameters: {'splitter': 'random', 'min_samples_split': 0.061613551105510665, 'min_samples_leaf': 0.018211881289796086, 'min_weight_fraction_leaf': 0.00883033052238286, 'max_features': 0.970580032373749}. Best is trial 677 with value: 0.9113497956229912.[0m
[32m[I 2022-04-21 13:56:38,263][0m Trial 854 finished with value: 0.3604231857506432 and parameters: {'splitter': 'random', 'min_samples_split': 0.07094900317469086, 'min_samples_leaf': 0.017415768066077413, 'min_weight_fraction_leaf': 0.2599527545138615, 'max_features': 0.9467488668511754}. Best is trial 677 with value: 0.9113497956229912.[0m
[32m[I 2022-04-21 13:56:40,811][0m Trial 855 finished with value: 0.9104032752949409 and parameters: {'splitter': 'random', 'min_samples_split': 0.059217454745427306, 'min_samples_leaf': 0.025078863481134188, 'min_weight_fraction_leaf': 0.010775091270286138, 'max_features': 0.9829390640890467}. Best is trial 677 with value: 0.9113497956229912.[0m
[32m[I 2022-04-21 13:56:42,881][0m Trial 856 finished with value: 0.8998192810385295 and parameters: {'splitter': 'random', 'min_samples_split': 0.066532427599422, 'min_samples_leaf': 0.013453153182236801, 'min_weight_fraction_leaf': 0.007515619889575784, 'max_features': 0.9347396658986412}. Best is trial 677 with value: 0.9113497956229912.[0m
[32m[I 2022-04-21 13:56:45,659][0m Trial 857 finished with value: 0.9077118845428525 and parameters: {'splitter': 'random', 'min_samples_split': 0.08374159746447386, 'min_samples_leaf': 0.022443131761409663, 'min_weight_fraction_leaf': 0.0007837794957381433, 'max_features': 0.9586564924373219}. Best is trial 677 with value: 0.9113497956229912.[0m
[32m[I 2022-04-21 13:56:48,512][0m Trial 858 finished with value: 0.9065248871384238 and parameters: {'splitter': 'random', 'min_samples_split': 0.06305093101115503, 'min_samples_leaf': 0.010385025683588347, 'min_weight_fraction_leaf': 0.015719646237987342, 'max_features': 0.9321735909448486}. Best is trial 677 with value: 0.9113497956229912.[0m
[32m[I 2022-04-21 13:56:50,261][0m Trial 859 finished with value: 0.902134529735885 and parameters: {'splitter': 'random', 'min_samples_split': 0.07683840362657379, 'min_samples_leaf': 0.02578843005986149, 'min_weight_fraction_leaf': 0.021008690009713445, 'max_features': 0.9499719189769669}. Best is trial 677 with value: 0.9113497956229912.[0m
[32m[I 2022-04-21 13:56:51,749][0m Trial 860 finished with value: 0.9046892116671279 and parameters: {'splitter': 'random', 'min_samples_split': 0.4323819306719483, 'min_samples_leaf': 0.010475999362639068, 'min_weight_fraction_leaf': 8.08150937133224e-05, 'max_features': 0.9249690870247409}. Best is trial 677 with value: 0.9113497956229912.[0m
[32m[I 2022-04-21 14:00:22,778][0m Trial 861 finished with value: 0.8870095283492985 and parameters: {'splitter': 'best', 'min_samples_split': 0.06275064013976771, 'min_samples_leaf': 0.01918562292395135, 'min_weight_fraction_leaf': 0.02920264707933291, 'max_features': 0.9674494688871627}. Best is trial 677 with value: 0.9113497956229912.[0m
[32m[I 2022-04-21 14:00:24,613][0m Trial 862 finished with value: 0.28857300337727976 and parameters: {'splitter': 'random', 'min_samples_split': 0.05527751032614949, 'min_samples_leaf': 0.03027812247249261, 'min_weight_fraction_leaf': 0.48208670080344174, 'max_features': 0.9428828749336736}. Best is trial 677 with value: 0.9113497956229912.[0m
[32m[I 2022-04-21 14:00:26,993][0m Trial 863 finished with value: 0.8954742204750549 and parameters: {'splitter': 'random', 'min_samples_split': 0.06975478367665766, 'min_samples_leaf': 0.019316834736982688, 'min_weight_fraction_leaf': 0.01973440653000556, 'max_features': 0.9055870662315813}. Best is trial 677 with value: 0.9113497956229912.[0m
[32m[I 2022-04-21 14:00:28,631][0m Trial 864 finished with value: 0.9093247923494931 and parameters: {'splitter': 'random', 'min_samples_split': 0.08694385711132654, 'min_samples_leaf': 0.009739840978578676, 'min_weight_fraction_leaf': 0.04338346059641028, 'max_features': 0.9257169377692701}. Best is trial 677 with value: 0.9113497956229912.[0m
[32m[I 2022-04-21 14:00:30,364][0m Trial 865 finished with value: 0.9001715184399007 and parameters: {'splitter': 'random', 'min_samples_split': 0.09480756701413885, 'min_samples_leaf': 0.0013251595147217056, 'min_weight_fraction_leaf': 0.06542765258389097, 'max_features': 0.8893958327079892}. Best is trial 677 with value: 0.9113497956229912.[0m
[32m[I 2022-04-21 14:00:31,797][0m Trial 866 finished with value: 0.3425804518366971 and parameters: {'splitter': 'random', 'min_samples_split': 0.08308467254464896, 'min_samples_leaf': 0.44566892302778605, 'min_weight_fraction_leaf': 0.05593272041279165, 'max_features': 0.9181621099283417}. Best is trial 677 with value: 0.9113497956229912.[0m
[32m[I 2022-04-21 14:00:33,342][0m Trial 867 finished with value: 0.900988759400066 and parameters: {'splitter': 'random', 'min_samples_split': 0.09230500345046724, 'min_samples_leaf': 0.03248402972791742, 'min_weight_fraction_leaf': 0.04761884991232099, 'max_features': 0.9048754943512632}. Best is trial 677 with value: 0.9113497956229912.[0m
