[32m[I 2022-04-21 18:05:09,724][0m Trial 873 finished with value: 0.8026252493996646 and parameters: {'splitter': 'random', 'min_samples_split': 0.1882925643153915, 'min_samples_leaf': 0.04183972022145898, 'min_weight_fraction_leaf': 0.09702412024617416, 'max_features': 0.9133993260694969}. Best is trial 841 with value: 0.81405645651816.[0m
[32m[I 2022-04-21 18:05:10,312][0m Trial 874 finished with value: 0.7950481493355436 and parameters: {'splitter': 'random', 'min_samples_split': 0.20874844578500262, 'min_samples_leaf': 0.06062474190787231, 'min_weight_fraction_leaf': 0.1142625163354069, 'max_features': 0.890958840581072}. Best is trial 841 with value: 0.81405645651816.[0m
[32m[I 2022-04-21 18:05:10,878][0m Trial 875 finished with value: 0.8009685914141167 and parameters: {'splitter': 'random', 'min_samples_split': 0.2193785810175587, 'min_samples_leaf': 0.03432530775275293, 'min_weight_fraction_leaf': 0.07464212348325734, 'max_features': 0.944948556432841}. Best is trial 841 with value: 0.81405645651816.[0m
[32m[I 2022-04-21 18:05:11,359][0m Trial 876 finished with value: 0.7672437310246556 and parameters: {'splitter': 'random', 'min_samples_split': 0.19968539572775215, 'min_samples_leaf': 0.07274157872764543, 'min_weight_fraction_leaf': 0.1052044122382244, 'max_features': 0.9214718782549326}. Best is trial 841 with value: 0.81405645651816.[0m
[32m[I 2022-04-21 18:05:12,032][0m Trial 877 finished with value: 0.7908191139219142 and parameters: {'splitter': 'random', 'min_samples_split': 0.17447735341422208, 'min_samples_leaf': 0.051729572943491106, 'min_weight_fraction_leaf': 0.08725630635477781, 'max_features': 0.969844558494523}. Best is trial 841 with value: 0.81405645651816.[0m
[32m[I 2022-04-21 18:05:12,464][0m Trial 878 finished with value: 0.7594491636389396 and parameters: {'splitter': 'random', 'min_samples_split': 0.18734372771480506, 'min_samples_leaf': 0.07417835918172046, 'min_weight_fraction_leaf': 0.19713354020994273, 'max_features': 0.9000532308322885}. Best is trial 841 with value: 0.81405645651816.[0m
[32m[I 2022-04-21 18:05:12,727][0m Trial 879 finished with value: 0.6851609036733942 and parameters: {'splitter': 'random', 'min_samples_split': 0.21094889088017973, 'min_samples_leaf': 0.46534678874051266, 'min_weight_fraction_leaf': 0.12515669887002565, 'max_features': 0.9375878018087852}. Best is trial 841 with value: 0.81405645651816.[0m
[32m[I 2022-04-21 18:05:13,186][0m Trial 880 finished with value: 0.7748758001068818 and parameters: {'splitter': 'random', 'min_samples_split': 0.23317029360897934, 'min_samples_leaf': 0.0600296574876373, 'min_weight_fraction_leaf': 0.07453731181864429, 'max_features': 0.8782482559112408}. Best is trial 841 with value: 0.81405645651816.[0m
[32m[I 2022-04-21 18:05:14,133][0m Trial 881 finished with value: 0.7734762229234688 and parameters: {'splitter': 'random', 'min_samples_split': 0.20031221205814498, 'min_samples_leaf': 0.045583070624178636, 'min_weight_fraction_leaf': 0.09651538207020224, 'max_features': 0.9540566049085558}. Best is trial 841 with value: 0.81405645651816.[0m
[32m[I 2022-04-21 18:05:14,720][0m Trial 882 finished with value: 0.7594491636389396 and parameters: {'splitter': 'random', 'min_samples_split': 0.22115142942644483, 'min_samples_leaf': 0.22441625171089885, 'min_weight_fraction_leaf': 0.08062281537228279, 'max_features': 0.9205744185819078}. Best is trial 841 with value: 0.81405645651816.[0m
[32m[I 2022-04-21 18:05:16,057][0m Trial 883 finished with value: 0.8130545549727758 and parameters: {'splitter': 'random', 'min_samples_split': 0.1854568280208573, 'min_samples_leaf': 0.035091431709626274, 'min_weight_fraction_leaf': 0.07395721443121482, 'max_features': 0.9102715770429208}. Best is trial 841 with value: 0.81405645651816.[0m
[32m[I 2022-04-21 18:05:17,158][0m Trial 884 finished with value: 0.789155801902836 and parameters: {'splitter': 'random', 'min_samples_split': 0.16543725658858055, 'min_samples_leaf': 0.03193001296173716, 'min_weight_fraction_leaf': 0.08750619520531656, 'max_features': 0.8600107633687796}. Best is trial 841 with value: 0.81405645651816.[0m
[32m[I 2022-04-21 18:05:17,861][0m Trial 885 finished with value: 0.7978584574512089 and parameters: {'splitter': 'random', 'min_samples_split': 0.18080847118012205, 'min_samples_leaf': 0.029046652847208997, 'min_weight_fraction_leaf': 0.09476717181242293, 'max_features': 0.8860706711362708}. Best is trial 841 with value: 0.81405645651816.[0m
[32m[I 2022-04-21 18:05:18,204][0m Trial 886 finished with value: 0.759078736015785 and parameters: {'splitter': 'random', 'min_samples_split': 0.18366233768332685, 'min_samples_leaf': 0.0375207771654157, 'min_weight_fraction_leaf': 0.07371190498765409, 'max_features': 0.12931890510897126}. Best is trial 841 with value: 0.81405645651816.[0m
[32m[I 2022-04-21 18:05:22,042][0m Trial 887 finished with value: 0.7186918014636094 and parameters: {'splitter': 'best', 'min_samples_split': 0.16734038938780654, 'min_samples_leaf': 0.03258327362504377, 'min_weight_fraction_leaf': 0.10569665364032493, 'max_features': 3.5394245851805284e-05}. Best is trial 841 with value: 0.81405645651816.[0m
[32m[I 2022-04-21 18:05:22,681][0m Trial 888 finished with value: 0.7978005705293684 and parameters: {'splitter': 'random', 'min_samples_split': 0.19256397381861845, 'min_samples_leaf': 0.042140535232619396, 'min_weight_fraction_leaf': 0.08551297870620618, 'max_features': 0.9039091358535539}. Best is trial 841 with value: 0.81405645651816.[0m
[32m[I 2022-04-21 18:05:23,129][0m Trial 889 finished with value: 0.7988924395991376 and parameters: {'splitter': 'random', 'min_samples_split': 0.17321105435341982, 'min_samples_leaf': 0.05138401854340649, 'min_weight_fraction_leaf': 0.07505487404738805, 'max_features': 0.5057087823756021}. Best is trial 841 with value: 0.81405645651816.[0m
[32m[I 2022-04-21 18:05:23,705][0m Trial 890 finished with value: 0.7986085342820521 and parameters: {'splitter': 'random', 'min_samples_split': 0.19076351484512127, 'min_samples_leaf': 0.047810144207400124, 'min_weight_fraction_leaf': 0.08422519371356992, 'max_features': 0.8992384787088489}. Best is trial 841 with value: 0.81405645651816.[0m
[32m[I 2022-04-21 18:05:24,238][0m Trial 891 finished with value: 0.7857786715500163 and parameters: {'splitter': 'random', 'min_samples_split': 0.1999446493348652, 'min_samples_leaf': 0.031234685804584446, 'min_weight_fraction_leaf': 0.09943408544748632, 'max_features': 0.839864447713048}. Best is trial 841 with value: 0.81405645651816.[0m
[32m[I 2022-04-21 18:05:24,569][0m Trial 892 finished with value: 0.5 and parameters: {'splitter': 'random', 'min_samples_split': 0.1817025448987321, 'min_samples_leaf': 0.059478889373759204, 'min_weight_fraction_leaf': 0.48823250439290355, 'max_features': 0.8775606612867841}. Best is trial 841 with value: 0.81405645651816.[0m
[32m[I 2022-04-21 18:05:25,233][0m Trial 893 finished with value: 0.8123191241087102 and parameters: {'splitter': 'random', 'min_samples_split': 0.23592685586632098, 'min_samples_leaf': 0.03923271757864703, 'min_weight_fraction_leaf': 0.07260028205684327, 'max_features': 0.9129743687894101}. Best is trial 841 with value: 0.81405645651816.[0m
[32m[I 2022-04-21 18:05:26,605][0m Trial 894 finished with value: 0.7853856366298533 and parameters: {'splitter': 'random', 'min_samples_split': 0.23684242138952563, 'min_samples_leaf': 0.030660150395201778, 'min_weight_fraction_leaf': 0.09003216384732214, 'max_features': 0.8546419441831217}. Best is trial 841 with value: 0.81405645651816.[0m
[32m[I 2022-04-21 18:05:28,104][0m Trial 895 finished with value: 0.7756865903037555 and parameters: {'splitter': 'random', 'min_samples_split': 0.23294093088063866, 'min_samples_leaf': 0.039638781848834806, 'min_weight_fraction_leaf': 0.07251946890436868, 'max_features': 0.8697798349178747}. Best is trial 841 with value: 0.81405645651816.[0m
[32m[I 2022-04-21 18:05:28,969][0m Trial 896 finished with value: 0.5065908818887879 and parameters: {'splitter': 'random', 'min_samples_split': 0.14987177721938189, 'min_samples_leaf': 0.41041823557645396, 'min_weight_fraction_leaf': 0.11016642434325773, 'max_features': 0.7117757342468515}. Best is trial 841 with value: 0.81405645651816.[0m
[32m[I 2022-04-21 18:05:30,149][0m Trial 897 finished with value: 0.7991857362369337 and parameters: {'splitter': 'random', 'min_samples_split': 0.19073973260688007, 'min_samples_leaf': 0.04211614761887684, 'min_weight_fraction_leaf': 0.08165925229137515, 'max_features': 0.8973188798333583}. Best is trial 841 with value: 0.81405645651816.[0m
[32m[I 2022-04-21 18:05:30,885][0m Trial 898 finished with value: 0.8118070902918568 and parameters: {'splitter': 'random', 'min_samples_split': 0.2400162819467147, 'min_samples_leaf': 0.0594453179636662, 'min_weight_fraction_leaf': 0.09281911207257708, 'max_features': 0.9126528912401934}. Best is trial 841 with value: 0.81405645651816.[0m
[32m[I 2022-04-21 18:05:31,575][0m Trial 899 finished with value: 0.795073011130887 and parameters: {'splitter': 'random', 'min_samples_split': 0.23938129425080837, 'min_samples_leaf': 0.05631298773121752, 'min_weight_fraction_leaf': 0.11781811552140896, 'max_features': 0.9023025675739202}. Best is trial 841 with value: 0.81405645651816.[0m
[32m[I 2022-04-21 18:05:32,616][0m Trial 900 finished with value: 0.7495675337107501 and parameters: {'splitter': 'random', 'min_samples_split': 0.24273394642744758, 'min_samples_leaf': 0.04315514702118922, 'min_weight_fraction_leaf': 0.09491347173628294, 'max_features': 0.555436540928612}. Best is trial 841 with value: 0.81405645651816.[0m
[32m[I 2022-04-21 18:05:33,132][0m Trial 901 finished with value: 0.7770104689803705 and parameters: {'splitter': 'random', 'min_samples_split': 0.19901681463302134, 'min_samples_leaf': 0.029628941703599622, 'min_weight_fraction_leaf': 0.10475891872729394, 'max_features': 0.8735810493885934}. Best is trial 841 with value: 0.81405645651816.[0m
[32m[I 2022-04-21 18:07:47,983][0m Trial 902 finished with value: 0.7692961011008336 and parameters: {'splitter': 'best', 'min_samples_split': 0.1781739742238588, 'min_samples_leaf': 0.029654538178668383, 'min_weight_fraction_leaf': 0.07081170091274656, 'max_features': 0.8914487914991636}. Best is trial 841 with value: 0.81405645651816.[0m
[32m[I 2022-04-21 18:07:48,693][0m Trial 903 finished with value: 0.7672437310246556 and parameters: {'splitter': 'random', 'min_samples_split': 0.24111701348134942, 'min_samples_leaf': 0.06096167023790678, 'min_weight_fraction_leaf': 0.10578508519245532, 'max_features': 0.9126297256108072}. Best is trial 841 with value: 0.81405645651816.[0m
[32m[I 2022-04-21 18:07:49,408][0m Trial 904 finished with value: 0.8048989660050093 and parameters: {'splitter': 'random', 'min_samples_split': 0.21277081150840135, 'min_samples_leaf': 0.07210724934383794, 'min_weight_fraction_leaf': 0.08046946995647371, 'max_features': 0.9400606968254563}. Best is trial 841 with value: 0.81405645651816.[0m
[32m[I 2022-04-21 18:07:50,253][0m Trial 905 finished with value: 0.8008085001193752 and parameters: {'splitter': 'random', 'min_samples_split': 0.2273409561691663, 'min_samples_leaf': 0.051038379529401996, 'min_weight_fraction_leaf': 0.09573459935249075, 'max_features': 0.9171469176883047}. Best is trial 841 with value: 0.81405645651816.[0m
[32m[I 2022-04-21 18:07:50,847][0m Trial 906 finished with value: 0.764347802167604 and parameters: {'splitter': 'random', 'min_samples_split': 0.22360499015958676, 'min_samples_leaf': 0.03843558851933947, 'min_weight_fraction_leaf': 0.09001696518290339, 'max_features': 0.9509437176634161}. Best is trial 841 with value: 0.81405645651816.[0m
[32m[I 2022-04-21 18:07:51,143][0m Trial 907 finished with value: 0.6851609036733942 and parameters: {'splitter': 'random', 'min_samples_split': 0.17071816568569562, 'min_samples_leaf': 0.2639361083604596, 'min_weight_fraction_leaf': 0.43512920158290896, 'max_features': 0.9327399355025797}. Best is trial 841 with value: 0.81405645651816.[0m
[32m[I 2022-04-21 18:07:51,632][0m Trial 908 finished with value: 0.77745043025634 and parameters: {'splitter': 'random', 'min_samples_split': 0.20606915782972007, 'min_samples_leaf': 0.06278684345298112, 'min_weight_fraction_leaf': 0.1296390565930321, 'max_features': 0.985104398387798}. Best is trial 841 with value: 0.81405645651816.[0m
[32m[I 2022-04-21 18:07:52,135][0m Trial 909 finished with value: 0.7978584574512089 and parameters: {'splitter': 'random', 'min_samples_split': 0.1891966142164846, 'min_samples_leaf': 0.0540386400670319, 'min_weight_fraction_leaf': 0.09796221178511083, 'max_features': 0.8887986200699345}. Best is trial 841 with value: 0.81405645651816.[0m
[32m[I 2022-04-21 18:07:52,667][0m Trial 910 finished with value: 0.7755601220641086 and parameters: {'splitter': 'random', 'min_samples_split': 0.2146963534514775, 'min_samples_leaf': 0.04452250353533161, 'min_weight_fraction_leaf': 0.0851764294538081, 'max_features': 0.9625382499135688}. Best is trial 841 with value: 0.81405645651816.[0m
[32m[I 2022-04-21 18:07:53,093][0m Trial 911 finished with value: 0.7646745680022595 and parameters: {'splitter': 'random', 'min_samples_split': 0.16040562309782522, 'min_samples_leaf': 0.06054876728215372, 'min_weight_fraction_leaf': 0.11317696267001306, 'max_features': 0.6102115291377908}. Best is trial 841 with value: 0.81405645651816.[0m
[32m[I 2022-04-21 18:07:54,093][0m Trial 912 finished with value: 0.7728980719554821 and parameters: {'splitter': 'random', 'min_samples_split': 0.22846793007129923, 'min_samples_leaf': 0.051041654263195645, 'min_weight_fraction_leaf': 0.08676148375863127, 'max_features': 0.9324310532226031}. Best is trial 841 with value: 0.81405645651816.[0m
[32m[I 2022-04-21 18:07:55,416][0m Trial 913 finished with value: 0.813044970304316 and parameters: {'splitter': 'random', 'min_samples_split': 0.19978385894405903, 'min_samples_leaf': 0.06488073723222014, 'min_weight_fraction_leaf': 0.07616073712172969, 'max_features': 0.9162957640588307}. Best is trial 841 with value: 0.81405645651816.[0m
[32m[I 2022-04-21 18:07:57,115][0m Trial 914 finished with value: 0.8015770744895733 and parameters: {'splitter': 'random', 'min_samples_split': 0.18352551651824578, 'min_samples_leaf': 0.03848451715048046, 'min_weight_fraction_leaf': 0.06997987478903944, 'max_features': 0.9028479323824541}. Best is trial 841 with value: 0.81405645651816.[0m
[32m[I 2022-04-21 18:07:58,193][0m Trial 915 finished with value: 0.7895193221775532 and parameters: {'splitter': 'random', 'min_samples_split': 0.19415009641846434, 'min_samples_leaf': 0.06960379301584439, 'min_weight_fraction_leaf': 0.07453124928740061, 'max_features': 0.8507766874207638}. Best is trial 841 with value: 0.81405645651816.[0m
[32m[I 2022-04-21 18:07:58,941][0m Trial 916 finished with value: 0.7741165873793839 and parameters: {'splitter': 'random', 'min_samples_split': 0.19926793897769213, 'min_samples_leaf': 0.06816984312832133, 'min_weight_fraction_leaf': 0.07698200522145918, 'max_features': 0.8760767213594414}. Best is trial 841 with value: 0.81405645651816.[0m
[32m[I 2022-04-21 18:07:59,776][0m Trial 917 finished with value: 0.8006041051142392 and parameters: {'splitter': 'random', 'min_samples_split': 0.12550565039295164, 'min_samples_leaf': 0.07071557581847698, 'min_weight_fraction_leaf': 0.07807605499149294, 'max_features': 0.9478462974060827}. Best is trial 841 with value: 0.81405645651816.[0m
[32m[I 2022-04-21 18:08:00,620][0m Trial 918 finished with value: 0.8136513154604847 and parameters: {'splitter': 'random', 'min_samples_split': 0.17978374745886222, 'min_samples_leaf': 0.05519633759304276, 'min_weight_fraction_leaf': 0.09243295815624955, 'max_features': 0.9159953819572081}. Best is trial 841 with value: 0.81405645651816.[0m
[32m[I 2022-04-21 18:08:01,345][0m Trial 919 finished with value: 0.747698629189036 and parameters: {'splitter': 'random', 'min_samples_split': 0.1798495488761018, 'min_samples_leaf': 0.029677103262888388, 'min_weight_fraction_leaf': 0.253983198436225, 'max_features': 0.9314446252682156}. Best is trial 841 with value: 0.81405645651816.[0m
[32m[I 2022-04-21 18:08:02,272][0m Trial 920 finished with value: 0.7983683186822056 and parameters: {'splitter': 'random', 'min_samples_split': 0.1781656093865759, 'min_samples_leaf': 0.043397533170627174, 'min_weight_fraction_leaf': 0.08387316039492794, 'max_features': 0.8901531120955126}. Best is trial 841 with value: 0.81405645651816.[0m
[32m[I 2022-04-21 18:09:56,357][0m Trial 921 finished with value: 0.7814847080734515 and parameters: {'splitter': 'best', 'min_samples_split': 0.16539513524509392, 'min_samples_leaf': 0.05414570365996556, 'min_weight_fraction_leaf': 0.10065110426993741, 'max_features': 0.911923405264498}. Best is trial 841 with value: 0.81405645651816.[0m
[32m[I 2022-04-21 18:09:57,305][0m Trial 922 finished with value: 0.8138778969781588 and parameters: {'splitter': 'random', 'min_samples_split': 0.18981273788165348, 'min_samples_leaf': 0.04615796505629053, 'min_weight_fraction_leaf': 0.0933291955949142, 'max_features': 0.9206317282050059}. Best is trial 841 with value: 0.81405645651816.[0m
[32m[I 2022-04-21 18:09:58,215][0m Trial 923 finished with value: 0.7754031767912688 and parameters: {'splitter': 'random', 'min_samples_split': 0.17020726993985227, 'min_samples_leaf': 0.044560551526946, 'min_weight_fraction_leaf': 0.113430290294121, 'max_features': 0.8822138895070646}. Best is trial 841 with value: 0.81405645651816.[0m
[32m[I 2022-04-21 18:09:58,784][0m Trial 924 finished with value: 0.7834213924220762 and parameters: {'splitter': 'random', 'min_samples_split': 0.18523876810173828, 'min_samples_leaf': 0.031167684668916198, 'min_weight_fraction_leaf': 0.0694457151779682, 'max_features': 0.8686431366891505}. Best is trial 841 with value: 0.81405645651816.[0m
[32m[I 2022-04-21 18:09:59,382][0m Trial 925 finished with value: 0.7723243810292996 and parameters: {'splitter': 'random', 'min_samples_split': 0.17308717181979655, 'min_samples_leaf': 0.04977395603834958, 'min_weight_fraction_leaf': 0.10471123618386716, 'max_features': 0.9639810896046045}. Best is trial 841 with value: 0.81405645651816.[0m
[32m[I 2022-04-21 18:10:00,151][0m Trial 926 finished with value: 0.7708286911707153 and parameters: {'splitter': 'random', 'min_samples_split': 0.15392894564236975, 'min_samples_leaf': 0.036819288551324554, 'min_weight_fraction_leaf': 0.07014499278444278, 'max_features': 0.8252801277219651}. Best is trial 841 with value: 0.81405645651816.[0m
[32m[I 2022-04-21 18:10:00,676][0m Trial 927 finished with value: 0.7640334787079823 and parameters: {'splitter': 'random', 'min_samples_split': 0.1914996295393682, 'min_samples_leaf': 0.05441057808738707, 'min_weight_fraction_leaf': 0.10239355036196818, 'max_features': 0.9394345913244941}. Best is trial 841 with value: 0.81405645651816.[0m
[32m[I 2022-04-21 18:10:01,301][0m Trial 928 finished with value: 0.7978584574512089 and parameters: {'splitter': 'random', 'min_samples_split': 0.17336734874132956, 'min_samples_leaf': 0.0272621583405625, 'min_weight_fraction_leaf': 0.09057980380979992, 'max_features': 0.9048745235372205}. Best is trial 841 with value: 0.81405645651816.[0m
[32m[I 2022-04-21 18:10:01,792][0m Trial 929 finished with value: 0.7500172046332256 and parameters: {'splitter': 'random', 'min_samples_split': 0.18339771714720887, 'min_samples_leaf': 0.047064143073929164, 'min_weight_fraction_leaf': 0.12385949485555704, 'max_features': 0.8603058194201256}. Best is trial 841 with value: 0.81405645651816.[0m
[32m[I 2022-04-21 18:10:02,308][0m Trial 930 finished with value: 0.8067937121479776 and parameters: {'splitter': 'random', 'min_samples_split': 0.19439554464502262, 'min_samples_leaf': 0.038110513678566084, 'min_weight_fraction_leaf': 0.09547848221709525, 'max_features': 0.757822795098973}. Best is trial 841 with value: 0.81405645651816.[0m
[32m[I 2022-04-21 18:10:02,998][0m Trial 931 finished with value: 0.7982919779568716 and parameters: {'splitter': 'random', 'min_samples_split': 0.18735138499720813, 'min_samples_leaf': 0.026654395868021506, 'min_weight_fraction_leaf': 0.08481096175110746, 'max_features': 0.8932441801363649}. Best is trial 841 with value: 0.81405645651816.[0m
[32m[I 2022-04-21 18:10:03,553][0m Trial 932 finished with value: 0.7991389119497595 and parameters: {'splitter': 'random', 'min_samples_split': 0.1782369064556675, 'min_samples_leaf': 0.042277605054366486, 'min_weight_fraction_leaf': 0.1533614136003614, 'max_features': 0.9056441247629412}. Best is trial 841 with value: 0.81405645651816.[0m
[32m[I 2022-04-21 18:10:04,030][0m Trial 933 finished with value: 0.7672437310246556 and parameters: {'splitter': 'random', 'min_samples_split': 0.1990658377567663, 'min_samples_leaf': 0.06033600367435789, 'min_weight_fraction_leaf': 0.10687857527702281, 'max_features': 0.9116152710072655}. Best is trial 841 with value: 0.81405645651816.[0m
[32m[I 2022-04-21 18:10:04,279][0m Trial 934 finished with value: 0.5 and parameters: {'splitter': 'random', 'min_samples_split': 0.1902374895179609, 'min_samples_leaf': 0.05423721158897454, 'min_weight_fraction_leaf': 0.0952034729729459, 'max_features': 0.19405335487732817}. Best is trial 841 with value: 0.81405645651816.[0m
[32m[I 2022-04-21 18:10:04,847][0m Trial 935 finished with value: 0.7887511950181615 and parameters: {'splitter': 'random', 'min_samples_split': 0.16226489673811986, 'min_samples_leaf': 0.03393856292812209, 'min_weight_fraction_leaf': 0.08427853300053197, 'max_features': 0.9451959702847955}. Best is trial 841 with value: 0.81405645651816.[0m
