[32m[I 2022-04-21 13:15:18,805][0m Trial 620 finished with value: 0.9071375353864349 and parameters: {'splitter': 'random', 'min_samples_split': 0.04365343734843141, 'min_samples_leaf': 0.026681249216270773, 'min_weight_fraction_leaf': 0.04727805046893088, 'max_features': 0.9240389398372647}. Best is trial 253 with value: 0.9108382257790575.[0m
[32m[I 2022-04-21 13:15:19,717][0m Trial 621 finished with value: 0.25 and parameters: {'splitter': 'random', 'min_samples_split': 0.016034686912928052, 'min_samples_leaf': 0.0012293560997861004, 'min_weight_fraction_leaf': 0.03551208504562789, 'max_features': 0.03688385722516646}. Best is trial 253 with value: 0.9108382257790575.[0m
[32m[I 2022-04-21 13:15:20,743][0m Trial 622 finished with value: 0.907205270918622 and parameters: {'splitter': 'random', 'min_samples_split': 0.03772182856848401, 'min_samples_leaf': 0.04946389954885655, 'min_weight_fraction_leaf': 0.053071646373107795, 'max_features': 0.911895782599677}. Best is trial 253 with value: 0.9108382257790575.[0m
[32m[I 2022-04-21 13:15:22,610][0m Trial 623 finished with value: 0.8992122028855217 and parameters: {'splitter': 'random', 'min_samples_split': 0.23635825010603972, 'min_samples_leaf': 0.017478684686681394, 'min_weight_fraction_leaf': 0.03629367432977348, 'max_features': 0.9360804829336428}. Best is trial 253 with value: 0.9108382257790575.[0m
[32m[I 2022-04-21 13:15:24,413][0m Trial 624 finished with value: 0.9031181346902735 and parameters: {'splitter': 'random', 'min_samples_split': 0.025843167867650903, 'min_samples_leaf': 0.0372259638306119, 'min_weight_fraction_leaf': 0.028295013947926877, 'max_features': 0.8670603421893126}. Best is trial 253 with value: 0.9108382257790575.[0m
[32m[I 2022-04-21 13:15:25,235][0m Trial 625 finished with value: 0.25 and parameters: {'splitter': 'random', 'min_samples_split': 0.01728067546804154, 'min_samples_leaf': 0.02517525434734587, 'min_weight_fraction_leaf': 0.49869128677538704, 'max_features': 0.8888020130357558}. Best is trial 253 with value: 0.9108382257790575.[0m
[32m[I 2022-04-21 13:15:26,778][0m Trial 626 finished with value: 0.9099889314668935 and parameters: {'splitter': 'random', 'min_samples_split': 0.0012747030769126866, 'min_samples_leaf': 0.01099120568193376, 'min_weight_fraction_leaf': 0.04203110508362069, 'max_features': 0.9280041523668199}. Best is trial 253 with value: 0.9108382257790575.[0m
[32m[I 2022-04-21 13:15:27,856][0m Trial 627 finished with value: 0.25 and parameters: {'splitter': 'random', 'min_samples_split': 0.0021364863882902064, 'min_samples_leaf': 0.0010476929714306506, 'min_weight_fraction_leaf': 0.2817711086099287, 'max_features': 0.1065764764382523}. Best is trial 253 with value: 0.9108382257790575.[0m
[32m[I 2022-04-21 13:15:30,043][0m Trial 628 finished with value: 0.902730023317034 and parameters: {'splitter': 'random', 'min_samples_split': 0.003353393339597825, 'min_samples_leaf': 0.013185169430779551, 'min_weight_fraction_leaf': 0.06208893701989826, 'max_features': 0.9399769128728577}. Best is trial 253 with value: 0.9108382257790575.[0m
[32m[I 2022-04-21 13:15:33,693][0m Trial 629 finished with value: 0.9065635563080218 and parameters: {'splitter': 'random', 'min_samples_split': 0.0018698122736412106, 'min_samples_leaf': 0.008767085877890574, 'min_weight_fraction_leaf': 0.049145990321176815, 'max_features': 0.912071256673068}. Best is trial 253 with value: 0.9108382257790575.[0m
[32m[I 2022-04-21 13:18:49,605][0m Trial 630 finished with value: 0.8836262333781315 and parameters: {'splitter': 'best', 'min_samples_split': 0.048234372606579784, 'min_samples_leaf': 0.013689198649599714, 'min_weight_fraction_leaf': 0.04435335712529536, 'max_features': 0.940020319561729}. Best is trial 253 with value: 0.9108382257790575.[0m
[32m[I 2022-04-21 13:18:50,911][0m Trial 631 finished with value: 0.8999669702127399 and parameters: {'splitter': 'random', 'min_samples_split': 0.032124124506713835, 'min_samples_leaf': 0.0640697196075982, 'min_weight_fraction_leaf': 0.05833795680020869, 'max_features': 0.9006255101767258}. Best is trial 253 with value: 0.9108382257790575.[0m
[32m[I 2022-04-21 13:18:51,974][0m Trial 632 finished with value: 0.9083645748386966 and parameters: {'splitter': 'random', 'min_samples_split': 0.016076534340288884, 'min_samples_leaf': 0.03090108748984516, 'min_weight_fraction_leaf': 0.03970402375247396, 'max_features': 0.927178686977901}. Best is trial 253 with value: 0.9108382257790575.[0m
[32m[I 2022-04-21 13:18:53,382][0m Trial 633 finished with value: 0.8998175692062501 and parameters: {'splitter': 'random', 'min_samples_split': 0.013155558567534266, 'min_samples_leaf': 0.001207892239126429, 'min_weight_fraction_leaf': 0.05134705413257239, 'max_features': 0.8457377256542484}. Best is trial 253 with value: 0.9108382257790575.[0m
[32m[I 2022-04-21 13:18:55,941][0m Trial 634 finished with value: 0.9087331346382612 and parameters: {'splitter': 'random', 'min_samples_split': 0.014315722047969907, 'min_samples_leaf': 0.04389653164207458, 'min_weight_fraction_leaf': 0.0423759106352287, 'max_features': 0.9221249770973032}. Best is trial 253 with value: 0.9108382257790575.[0m
[32m[I 2022-04-21 13:18:57,186][0m Trial 635 finished with value: 0.9002066548752167 and parameters: {'splitter': 'random', 'min_samples_split': 0.022253194082053583, 'min_samples_leaf': 0.05642778379793311, 'min_weight_fraction_leaf': 0.06833989811624938, 'max_features': 0.8914716476683266}. Best is trial 253 with value: 0.9108382257790575.[0m
[32m[I 2022-04-21 13:18:58,485][0m Trial 636 finished with value: 0.8928893912212787 and parameters: {'splitter': 'random', 'min_samples_split': 0.0014506988239914639, 'min_samples_leaf': 0.0467140809501354, 'min_weight_fraction_leaf': 0.05489121745838685, 'max_features': 0.3232963807609192}. Best is trial 253 with value: 0.9108382257790575.[0m
[32m[I 2022-04-21 13:19:00,079][0m Trial 637 finished with value: 0.9067548055488868 and parameters: {'splitter': 'random', 'min_samples_split': 0.05438486473684326, 'min_samples_leaf': 0.06613446747138302, 'min_weight_fraction_leaf': 0.062318683314531984, 'max_features': 0.9188895427095933}. Best is trial 253 with value: 0.9108382257790575.[0m
[32m[I 2022-04-21 13:19:01,980][0m Trial 638 finished with value: 0.9072947925307032 and parameters: {'splitter': 'random', 'min_samples_split': 0.01194746745026305, 'min_samples_leaf': 0.04329224995905068, 'min_weight_fraction_leaf': 0.04412515224024286, 'max_features': 0.919296111265015}. Best is trial 253 with value: 0.9108382257790575.[0m
[32m[I 2022-04-21 13:19:03,797][0m Trial 639 finished with value: 0.8881696961725091 and parameters: {'splitter': 'random', 'min_samples_split': 0.040830167263228426, 'min_samples_leaf': 0.07332404962892887, 'min_weight_fraction_leaf': 0.049549757758005665, 'max_features': 0.871894893098338}. Best is trial 253 with value: 0.9108382257790575.[0m
[32m[I 2022-04-21 13:19:05,912][0m Trial 640 finished with value: 0.9042811943299844 and parameters: {'splitter': 'random', 'min_samples_split': 0.020698541649378392, 'min_samples_leaf': 0.05112513774588348, 'min_weight_fraction_leaf': 0.04148337520372436, 'max_features': 0.9041241599570169}. Best is trial 253 with value: 0.9108382257790575.[0m
[32m[I 2022-04-21 13:19:07,065][0m Trial 641 finished with value: 0.3425804518366971 and parameters: {'splitter': 'random', 'min_samples_split': 0.03413547893168052, 'min_samples_leaf': 0.3291272469218862, 'min_weight_fraction_leaf': 0.038550157120381304, 'max_features': 0.9285708287264018}. Best is trial 253 with value: 0.9108382257790575.[0m
[32m[I 2022-04-21 13:19:10,010][0m Trial 642 finished with value: 0.9030485291402208 and parameters: {'splitter': 'random', 'min_samples_split': 0.012374165131416731, 'min_samples_leaf': 0.038670352606722413, 'min_weight_fraction_leaf': 0.0527007428329135, 'max_features': 0.8948239349526471}. Best is trial 253 with value: 0.9108382257790575.[0m
[32m[I 2022-04-21 13:19:11,216][0m Trial 643 finished with value: 0.8879338215083864 and parameters: {'splitter': 'random', 'min_samples_split': 0.05136915681342597, 'min_samples_leaf': 0.11044867012802151, 'min_weight_fraction_leaf': 0.03921442706840306, 'max_features': 0.8809215739662476}. Best is trial 253 with value: 0.9108382257790575.[0m
[32m[I 2022-04-21 13:19:12,929][0m Trial 644 finished with value: 0.9062492856134329 and parameters: {'splitter': 'random', 'min_samples_split': 0.0256458273055271, 'min_samples_leaf': 0.05529064914573973, 'min_weight_fraction_leaf': 0.06326654160328674, 'max_features': 0.9251521159541954}. Best is trial 253 with value: 0.9108382257790575.[0m
[32m[I 2022-04-21 13:19:14,492][0m Trial 645 finished with value: 0.892018040551451 and parameters: {'splitter': 'random', 'min_samples_split': 0.04050140280538041, 'min_samples_leaf': 0.036628473299480074, 'min_weight_fraction_leaf': 0.04290915956081421, 'max_features': 0.418033943570574}. Best is trial 253 with value: 0.9108382257790575.[0m
[32m[I 2022-04-21 13:19:16,317][0m Trial 646 finished with value: 0.8993126280028336 and parameters: {'splitter': 'random', 'min_samples_split': 0.017383774486387005, 'min_samples_leaf': 0.031650968084818376, 'min_weight_fraction_leaf': 0.03615954701684812, 'max_features': 0.904619985302513}. Best is trial 253 with value: 0.9108382257790575.[0m
[32m[I 2022-04-21 13:19:17,467][0m Trial 647 finished with value: 0.896186555698479 and parameters: {'splitter': 'random', 'min_samples_split': 0.05713321533793184, 'min_samples_leaf': 0.08317156591174844, 'min_weight_fraction_leaf': 0.052230992531515794, 'max_features': 0.9317467375235721}. Best is trial 253 with value: 0.9108382257790575.[0m
[32m[I 2022-04-21 13:19:18,849][0m Trial 648 finished with value: 0.9018111709833354 and parameters: {'splitter': 'random', 'min_samples_split': 0.002590640341126082, 'min_samples_leaf': 0.04294369637885493, 'min_weight_fraction_leaf': 0.034001829531693804, 'max_features': 0.8632339012538738}. Best is trial 253 with value: 0.9108382257790575.[0m
[32m[I 2022-04-21 13:19:20,152][0m Trial 649 finished with value: 0.904042237336791 and parameters: {'splitter': 'random', 'min_samples_split': 0.029006794572101584, 'min_samples_leaf': 0.057054780484592296, 'min_weight_fraction_leaf': 0.04717053045005526, 'max_features': 0.9104818574461048}. Best is trial 253 with value: 0.9108382257790575.[0m
[32m[I 2022-04-21 13:19:49,088][0m Trial 650 finished with value: 0.2968584229853844 and parameters: {'splitter': 'best', 'min_samples_split': 0.001167524677024528, 'min_samples_leaf': 0.29010050055164416, 'min_weight_fraction_leaf': 0.03218048772794589, 'max_features': 0.9396787402906926}. Best is trial 253 with value: 0.9108382257790575.[0m
[32m[I 2022-04-21 13:19:50,711][0m Trial 651 finished with value: 0.9070503168545198 and parameters: {'splitter': 'random', 'min_samples_split': 0.15767198747684869, 'min_samples_leaf': 0.029652495977532868, 'min_weight_fraction_leaf': 0.062473850421151694, 'max_features': 0.9211896940342738}. Best is trial 253 with value: 0.9108382257790575.[0m
[32m[I 2022-04-21 13:19:52,950][0m Trial 652 finished with value: 0.9010860579662859 and parameters: {'splitter': 'random', 'min_samples_split': 0.04764431381916068, 'min_samples_leaf': 0.04702254884634292, 'min_weight_fraction_leaf': 0.04231689228466166, 'max_features': 0.8839691704749608}. Best is trial 253 with value: 0.9108382257790575.[0m
[32m[I 2022-04-21 13:19:54,170][0m Trial 653 finished with value: 0.9063099857339173 and parameters: {'splitter': 'random', 'min_samples_split': 0.060842192114430656, 'min_samples_leaf': 0.023149255136535714, 'min_weight_fraction_leaf': 0.0293262218828199, 'max_features': 0.9441717204552793}. Best is trial 253 with value: 0.9108382257790575.[0m
[32m[I 2022-04-21 13:19:55,117][0m Trial 654 finished with value: 0.9005607942209475 and parameters: {'splitter': 'random', 'min_samples_split': 0.01885018334784374, 'min_samples_leaf': 0.03773639218714951, 'min_weight_fraction_leaf': 0.053974994140722904, 'max_features': 0.9036270775138588}. Best is trial 253 with value: 0.9108382257790575.[0m
[32m[I 2022-04-21 13:19:57,530][0m Trial 655 finished with value: 0.9067296039241688 and parameters: {'splitter': 'random', 'min_samples_split': 0.03327968669039316, 'min_samples_leaf': 0.021292409279049854, 'min_weight_fraction_leaf': 0.03684281221729983, 'max_features': 0.928153549523988}. Best is trial 253 with value: 0.9108382257790575.[0m
[32m[I 2022-04-21 13:19:59,963][0m Trial 656 finished with value: 0.9061697835248047 and parameters: {'splitter': 'random', 'min_samples_split': 0.00971859211826009, 'min_samples_leaf': 0.03170231658856698, 'min_weight_fraction_leaf': 0.027531000434188324, 'max_features': 0.9506025783906966}. Best is trial 253 with value: 0.9108382257790575.[0m
[32m[I 2022-04-21 13:20:01,511][0m Trial 657 finished with value: 0.7858608332138486 and parameters: {'splitter': 'random', 'min_samples_split': 0.04379265465815731, 'min_samples_leaf': 0.13740332577013303, 'min_weight_fraction_leaf': 0.07262099584859086, 'max_features': 0.8809325605491117}. Best is trial 253 with value: 0.9108382257790575.[0m
[32m[I 2022-04-21 13:20:03,547][0m Trial 658 finished with value: 0.9070305473596058 and parameters: {'splitter': 'random', 'min_samples_split': 0.0201886408455903, 'min_samples_leaf': 0.045358349001500306, 'min_weight_fraction_leaf': 0.04706877001380659, 'max_features': 0.9097069933964441}. Best is trial 253 with value: 0.9108382257790575.[0m
[32m[I 2022-04-21 13:20:05,475][0m Trial 659 finished with value: 0.9043549329480047 and parameters: {'splitter': 'random', 'min_samples_split': 0.033005207581637296, 'min_samples_leaf': 0.018173154728157143, 'min_weight_fraction_leaf': 0.025342404041652646, 'max_features': 0.8516831074433939}. Best is trial 253 with value: 0.9108382257790575.[0m
[32m[I 2022-04-21 13:20:07,326][0m Trial 660 finished with value: 0.9052276550026338 and parameters: {'splitter': 'random', 'min_samples_split': 0.27364424284103733, 'min_samples_leaf': 0.03163088937693757, 'min_weight_fraction_leaf': 0.03636594417993198, 'max_features': 0.9292938036360257}. Best is trial 253 with value: 0.9108382257790575.[0m
[32m[I 2022-04-21 13:20:08,875][0m Trial 661 finished with value: 0.8999669702127399 and parameters: {'splitter': 'random', 'min_samples_split': 0.06257274641997497, 'min_samples_leaf': 0.06409686801948218, 'min_weight_fraction_leaf': 0.052567973687571795, 'max_features': 0.8962335621356524}. Best is trial 253 with value: 0.9108382257790575.[0m
[32m[I 2022-04-21 13:20:10,031][0m Trial 662 finished with value: 0.25 and parameters: {'splitter': 'random', 'min_samples_split': 0.010129876398643472, 'min_samples_leaf': 0.46777122206102834, 'min_weight_fraction_leaf': 0.04295988436377884, 'max_features': 0.4571956461870887}. Best is trial 253 with value: 0.9108382257790575.[0m
[32m[I 2022-04-21 13:20:10,996][0m Trial 663 finished with value: 0.3425804518366971 and parameters: {'splitter': 'random', 'min_samples_split': 0.025350197239376454, 'min_samples_leaf': 0.4093827882938571, 'min_weight_fraction_leaf': 0.025219739828016206, 'max_features': 0.948894656629166}. Best is trial 253 with value: 0.9108382257790575.[0m
[32m[I 2022-04-21 13:20:13,073][0m Trial 664 finished with value: 0.9029079631932408 and parameters: {'splitter': 'random', 'min_samples_split': 0.24585201418837033, 'min_samples_leaf': 0.019964921899847957, 'min_weight_fraction_leaf': 0.037330788173640814, 'max_features': 0.9200734627054692}. Best is trial 253 with value: 0.9108382257790575.[0m
[32m[I 2022-04-21 13:20:14,673][0m Trial 665 finished with value: 0.8991797470552921 and parameters: {'splitter': 'random', 'min_samples_split': 0.04110682942593056, 'min_samples_leaf': 0.009616270695758228, 'min_weight_fraction_leaf': 0.060985499426627815, 'max_features': 0.8991766619881993}. Best is trial 253 with value: 0.9108382257790575.[0m
[32m[I 2022-04-21 13:20:15,491][0m Trial 666 finished with value: 0.8804391066728773 and parameters: {'splitter': 'random', 'min_samples_split': 0.30323645359466206, 'min_samples_leaf': 0.05126373651054736, 'min_weight_fraction_leaf': 0.16522988716734194, 'max_features': 0.9486752993168129}. Best is trial 253 with value: 0.9108382257790575.[0m
[32m[I 2022-04-21 13:20:16,542][0m Trial 667 finished with value: 0.9088794235055886 and parameters: {'splitter': 'random', 'min_samples_split': 0.05221886120187566, 'min_samples_leaf': 0.04050554234431279, 'min_weight_fraction_leaf': 0.022297481186617167, 'max_features': 0.9221899817069127}. Best is trial 253 with value: 0.9108382257790575.[0m
[32m[I 2022-04-21 13:22:47,823][0m Trial 668 finished with value: 0.8827710416143066 and parameters: {'splitter': 'best', 'min_samples_split': 0.04860597754161288, 'min_samples_leaf': 0.055328709529345745, 'min_weight_fraction_leaf': 0.03036671544920321, 'max_features': 0.9184661195992111}. Best is trial 253 with value: 0.9108382257790575.[0m
[32m[I 2022-04-21 13:22:50,288][0m Trial 669 finished with value: 0.9035582354654401 and parameters: {'splitter': 'random', 'min_samples_split': 0.03292835690648217, 'min_samples_leaf': 0.04158300564041886, 'min_weight_fraction_leaf': 0.04717367926133401, 'max_features': 0.9332192833616627}. Best is trial 253 with value: 0.9108382257790575.[0m
[32m[I 2022-04-21 13:22:52,543][0m Trial 670 finished with value: 0.9020158378674562 and parameters: {'splitter': 'random', 'min_samples_split': 0.019743407796144957, 'min_samples_leaf': 0.040518181058841723, 'min_weight_fraction_leaf': 0.0144830012342581, 'max_features': 0.8813697093603646}. Best is trial 253 with value: 0.9108382257790575.[0m
[32m[I 2022-04-21 13:22:54,947][0m Trial 671 finished with value: 0.9000158729749556 and parameters: {'splitter': 'random', 'min_samples_split': 0.03935213559695745, 'min_samples_leaf': 0.027094421363277096, 'min_weight_fraction_leaf': 0.035117039611459955, 'max_features': 0.9013875136500948}. Best is trial 253 with value: 0.9108382257790575.[0m
[32m[I 2022-04-21 13:22:56,300][0m Trial 672 finished with value: 0.3425804518366971 and parameters: {'splitter': 'random', 'min_samples_split': 0.05018746929661922, 'min_samples_leaf': 0.00891944565599963, 'min_weight_fraction_leaf': 0.313184994399158, 'max_features': 0.9466380564004268}. Best is trial 253 with value: 0.9108382257790575.[0m
[32m[I 2022-04-21 13:22:57,252][0m Trial 673 finished with value: 0.9062920203359605 and parameters: {'splitter': 'random', 'min_samples_split': 0.01040995119184383, 'min_samples_leaf': 0.059845329062813424, 'min_weight_fraction_leaf': 0.017593381740226677, 'max_features': 0.918290558596908}. Best is trial 253 with value: 0.9108382257790575.[0m
[32m[I 2022-04-21 13:22:59,660][0m Trial 674 finished with value: 0.9075831418152458 and parameters: {'splitter': 'random', 'min_samples_split': 0.029249559840701957, 'min_samples_leaf': 0.0010638181223647167, 'min_weight_fraction_leaf': 0.02422466685566689, 'max_features': 0.9348586194526469}. Best is trial 253 with value: 0.9108382257790575.[0m
[32m[I 2022-04-21 13:23:00,907][0m Trial 675 finished with value: 0.8993793342742565 and parameters: {'splitter': 'random', 'min_samples_split': 0.023499651534341602, 'min_samples_leaf': 0.02122716703340736, 'min_weight_fraction_leaf': 0.0558608676761269, 'max_features': 0.8869870851313666}. Best is trial 253 with value: 0.9108382257790575.[0m
[32m[I 2022-04-21 13:23:02,456][0m Trial 676 finished with value: 0.898961792721623 and parameters: {'splitter': 'random', 'min_samples_split': 0.03889533900870124, 'min_samples_leaf': 0.04614549366382513, 'min_weight_fraction_leaf': 0.041803340010191634, 'max_features': 0.9537613962037069}. Best is trial 253 with value: 0.9108382257790575.[0m
[32m[I 2022-04-21 13:23:03,758][0m Trial 677 finished with value: 0.9113497956229912 and parameters: {'splitter': 'random', 'min_samples_split': 0.055712934537462955, 'min_samples_leaf': 0.03408515454971367, 'min_weight_fraction_leaf': 0.02670977990584805, 'max_features': 0.922010288159367}. Best is trial 677 with value: 0.9113497956229912.[0m
[32m[I 2022-04-21 13:23:04,902][0m Trial 678 finished with value: 0.904106913162738 and parameters: {'splitter': 'random', 'min_samples_split': 0.05564049735966593, 'min_samples_leaf': 0.03402014262775686, 'min_weight_fraction_leaf': 0.033576430968352465, 'max_features': 0.9317851879673434}. Best is trial 677 with value: 0.9113497956229912.[0m
[32m[I 2022-04-21 13:23:06,654][0m Trial 679 finished with value: 0.9069974386025395 and parameters: {'splitter': 'random', 'min_samples_split': 0.056163093778230144, 'min_samples_leaf': 0.07014978681130166, 'min_weight_fraction_leaf': 0.04804894699457566, 'max_features': 0.9079804657386149}. Best is trial 677 with value: 0.9113497956229912.[0m
[32m[I 2022-04-21 13:23:08,718][0m Trial 680 finished with value: 0.8919583131299689 and parameters: {'splitter': 'random', 'min_samples_split': 0.066454105105309, 'min_samples_leaf': 0.015308475055547747, 'min_weight_fraction_leaf': 0.06528258840921569, 'max_features': 0.9545003466570595}. Best is trial 677 with value: 0.9113497956229912.[0m
[32m[I 2022-04-21 13:23:11,069][0m Trial 681 finished with value: 0.8879338215083864 and parameters: {'splitter': 'random', 'min_samples_split': 0.048904694098896494, 'min_samples_leaf': 0.025938101347939203, 'min_weight_fraction_leaf': 0.11029031780983123, 'max_features': 0.8718749445394559}. Best is trial 677 with value: 0.9113497956229912.[0m
[32m[I 2022-04-21 13:23:12,723][0m Trial 682 finished with value: 0.9071375353864349 and parameters: {'splitter': 'random', 'min_samples_split': 0.060246703997433836, 'min_samples_leaf': 0.04733216248993785, 'min_weight_fraction_leaf': 0.024315159160782595, 'max_features': 0.9272746383762779}. Best is trial 677 with value: 0.9113497956229912.[0m
