[32m[I 2022-04-26 04:01:54,772][0m Trial 228 finished with value: 0.8493986742790522 and parameters: {'n_hidden': 2048, 'mixture_components': 4, 'use_sparse_layer': True, 'use_sparse_loss': True, 'lmbd': 0.003867122882748039, 'use_batchnorm': False, 'use_dropout': True, 'dropout': 0.11222005099525513, 'mlp_size_1': 7, 'mlp_size_2': 1, 'mlp_size_3': 0, 'kernel': 'Normal', 'loss_name': 'AlternativeNLLLoss'}. Best is trial 205 with value: 0.8548990439632759.[0m
[32m[I 2022-04-26 04:09:06,427][0m Trial 229 finished with value: 0.8424233895901484 and parameters: {'n_hidden': 32, 'mixture_components': 5, 'use_sparse_layer': True, 'use_sparse_loss': True, 'lmbd': 1.878670775247857e-05, 'use_batchnorm': False, 'use_dropout': False, 'mlp_size_1': 2, 'mlp_size_2': 0, 'mlp_size_3': 0, 'kernel': 'Normal', 'loss_name': 'AlternativeNLLLoss'}. Best is trial 205 with value: 0.8548990439632759.[0m
[32m[I 2022-04-26 04:13:56,168][0m Trial 230 finished with value: 0.849403299390741 and parameters: {'n_hidden': 256, 'mixture_components': 5, 'use_sparse_layer': True, 'use_sparse_loss': False, 'use_batchnorm': False, 'use_dropout': False, 'mlp_size_1': 5, 'mlp_size_2': 0, 'mlp_size_3': 0, 'kernel': 'Normal', 'loss_name': 'AlternativeNLLLoss'}. Best is trial 205 with value: 0.8548990439632759.[0m
[32m[I 2022-04-26 04:19:48,427][0m Trial 231 finished with value: 0.8383628258133478 and parameters: {'n_hidden': 2048, 'mixture_components': 6, 'use_sparse_layer': True, 'use_sparse_loss': True, 'lmbd': 0.00024251016104759242, 'use_batchnorm': False, 'use_dropout': False, 'mlp_size_1': 7, 'mlp_size_2': 1, 'mlp_size_3': 0, 'kernel': 'Normal', 'loss_name': 'AlternativeNLLLoss'}. Best is trial 205 with value: 0.8548990439632759.[0m
[32m[I 2022-04-26 04:25:52,243][0m Trial 232 finished with value: 0.852921439832824 and parameters: {'n_hidden': 2048, 'mixture_components': 5, 'use_sparse_layer': True, 'use_sparse_loss': True, 'lmbd': 4.814449148261615e-06, 'use_batchnorm': False, 'use_dropout': False, 'mlp_size_1': 7, 'mlp_size_2': 1, 'mlp_size_3': 0, 'kernel': 'Normal', 'loss_name': 'AlternativeNLLLoss'}. Best is trial 205 with value: 0.8548990439632759.[0m
[32m[I 2022-04-26 04:31:05,269][0m Trial 233 finished with value: 0.8443991795436154 and parameters: {'n_hidden': 2048, 'mixture_components': 1, 'use_sparse_layer': True, 'use_sparse_loss': True, 'lmbd': 2.434407574940936e-05, 'use_batchnorm': False, 'use_dropout': False, 'mlp_size_1': 7, 'mlp_size_2': 1, 'mlp_size_3': 0, 'kernel': 'Normal', 'loss_name': 'AlternativeNLLLoss'}. Best is trial 205 with value: 0.8548990439632759.[0m
[32m[I 2022-04-26 04:36:55,818][0m Trial 234 finished with value: 0.8527072393337303 and parameters: {'n_hidden': 2048, 'mixture_components': 5, 'use_sparse_layer': True, 'use_sparse_loss': True, 'lmbd': 5.892521785680099e-06, 'use_batchnorm': False, 'use_dropout': False, 'mlp_size_1': 7, 'mlp_size_2': 1, 'mlp_size_3': 0, 'kernel': 'Normal', 'loss_name': 'AlternativeNLLLoss'}. Best is trial 205 with value: 0.8548990439632759.[0m
[32m[I 2022-04-26 04:42:42,033][0m Trial 235 finished with value: 0.8511831036091705 and parameters: {'n_hidden': 2048, 'mixture_components': 6, 'use_sparse_layer': True, 'use_sparse_loss': True, 'lmbd': 9.315372088291518e-06, 'use_batchnorm': False, 'use_dropout': False, 'mlp_size_1': 7, 'mlp_size_2': 1, 'mlp_size_3': 0, 'kernel': 'Normal', 'loss_name': 'AlternativeNLLLoss'}. Best is trial 205 with value: 0.8548990439632759.[0m
[32m[I 2022-04-26 04:47:32,947][0m Trial 236 finished with value: 0.8304924451016573 and parameters: {'n_hidden': 2048, 'mixture_components': 4, 'use_sparse_layer': True, 'use_sparse_loss': True, 'lmbd': 0.00011089484991670059, 'use_batchnorm': False, 'use_dropout': False, 'mlp_size_1': 7, 'mlp_size_2': 1, 'mlp_size_3': 0, 'kernel': 'Normal', 'loss_name': 'NLLLoss'}. Best is trial 205 with value: 0.8548990439632759.[0m
[32m[I 2022-04-26 04:58:03,610][0m Trial 237 finished with value: 0.8376942421050574 and parameters: {'n_hidden': 2048, 'mixture_components': 5, 'use_sparse_layer': True, 'use_sparse_loss': True, 'lmbd': 1.5497186025817147e-05, 'use_batchnorm': True, 'use_dropout': False, 'mlp_size_1': 7, 'mlp_size_2': 1, 'mlp_size_3': 0, 'kernel': 'Normal', 'loss_name': 'AlternativeNLLLoss'}. Best is trial 205 with value: 0.8548990439632759.[0m
[32m[I 2022-04-26 05:04:06,555][0m Trial 238 finished with value: 0.849525508948832 and parameters: {'n_hidden': 2048, 'mixture_components': 6, 'use_sparse_layer': True, 'use_sparse_loss': True, 'lmbd': 1.1405723720219297e-05, 'use_batchnorm': False, 'use_dropout': False, 'mlp_size_1': 7, 'mlp_size_2': 1, 'mlp_size_3': 0, 'kernel': 'Normal', 'loss_name': 'AlternativeNLLLoss'}. Best is trial 205 with value: 0.8548990439632759.[0m
[32m[I 2022-04-26 05:10:06,373][0m Trial 239 finished with value: 0.8523077306343001 and parameters: {'n_hidden': 2048, 'mixture_components': 4, 'use_sparse_layer': True, 'use_sparse_loss': True, 'lmbd': 6.356698154008021e-06, 'use_batchnorm': False, 'use_dropout': False, 'mlp_size_1': 7, 'mlp_size_2': 1, 'mlp_size_3': 0, 'kernel': 'Normal', 'loss_name': 'AlternativeNLLLoss'}. Best is trial 205 with value: 0.8548990439632759.[0m
[32m[I 2022-04-26 05:13:01,193][0m Trial 240 finished with value: -1.0 and parameters: {'n_hidden': 2048, 'mixture_components': 5, 'use_sparse_layer': True, 'use_sparse_loss': True, 'lmbd': 5.6978374313891395e-05, 'use_batchnorm': False, 'use_dropout': False, 'mlp_size_1': 7, 'mlp_size_2': 1, 'mlp_size_3': 0, 'kernel': 'Exponential', 'loss_name': 'AlternativeNLLLoss'}. Best is trial 205 with value: 0.8548990439632759.[0m
[32m[I 2022-04-26 05:19:28,694][0m Trial 241 finished with value: 0.8541205962967691 and parameters: {'n_hidden': 2048, 'mixture_components': 3, 'use_sparse_layer': True, 'use_sparse_loss': True, 'lmbd': 2.570316342071913e-06, 'use_batchnorm': False, 'use_dropout': False, 'mlp_size_1': 7, 'mlp_size_2': 1, 'mlp_size_3': 0, 'kernel': 'Normal', 'loss_name': 'AlternativeNLLLoss'}. Best is trial 205 with value: 0.8548990439632759.[0m
[32m[I 2022-04-26 05:25:21,967][0m Trial 242 finished with value: 0.8535017940877824 and parameters: {'n_hidden': 2048, 'mixture_components': 3, 'use_sparse_layer': True, 'use_sparse_loss': True, 'lmbd': 2.6632823665193927e-06, 'use_batchnorm': False, 'use_dropout': False, 'mlp_size_1': 7, 'mlp_size_2': 1, 'mlp_size_3': 0, 'kernel': 'Normal', 'loss_name': 'AlternativeNLLLoss'}. Best is trial 205 with value: 0.8548990439632759.[0m
[32m[I 2022-04-26 05:31:15,731][0m Trial 243 finished with value: 0.8523531521275153 and parameters: {'n_hidden': 2048, 'mixture_components': 3, 'use_sparse_layer': True, 'use_sparse_loss': True, 'lmbd': 2.506932638413133e-06, 'use_batchnorm': False, 'use_dropout': False, 'mlp_size_1': 7, 'mlp_size_2': 1, 'mlp_size_3': 0, 'kernel': 'Normal', 'loss_name': 'AlternativeNLLLoss'}. Best is trial 205 with value: 0.8548990439632759.[0m
[32m[I 2022-04-26 05:37:29,662][0m Trial 244 finished with value: 0.852336657292429 and parameters: {'n_hidden': 2048, 'mixture_components': 3, 'use_sparse_layer': True, 'use_sparse_loss': True, 'lmbd': 2.7257896674967113e-06, 'use_batchnorm': False, 'use_dropout': False, 'mlp_size_1': 7, 'mlp_size_2': 1, 'mlp_size_3': 0, 'kernel': 'Normal', 'loss_name': 'AlternativeNLLLoss'}. Best is trial 205 with value: 0.8548990439632759.[0m
[32m[I 2022-04-26 05:43:32,547][0m Trial 245 finished with value: 0.8545704269818799 and parameters: {'n_hidden': 2048, 'mixture_components': 3, 'use_sparse_layer': True, 'use_sparse_loss': True, 'lmbd': 8.531059629506541e-06, 'use_batchnorm': False, 'use_dropout': False, 'mlp_size_1': 7, 'mlp_size_2': 1, 'mlp_size_3': 0, 'kernel': 'Normal', 'loss_name': 'AlternativeNLLLoss'}. Best is trial 205 with value: 0.8548990439632759.[0m
[32m[I 2022-04-26 05:49:42,097][0m Trial 246 finished with value: 0.8527629885399234 and parameters: {'n_hidden': 2048, 'mixture_components': 3, 'use_sparse_layer': True, 'use_sparse_loss': True, 'lmbd': 8.786287611688474e-06, 'use_batchnorm': False, 'use_dropout': False, 'mlp_size_1': 7, 'mlp_size_2': 1, 'mlp_size_3': 0, 'kernel': 'Normal', 'loss_name': 'AlternativeNLLLoss'}. Best is trial 205 with value: 0.8548990439632759.[0m
[32m[I 2022-04-26 05:55:36,330][0m Trial 247 finished with value: 0.8475923522984473 and parameters: {'n_hidden': 2048, 'mixture_components': 3, 'use_sparse_layer': True, 'use_sparse_loss': True, 'lmbd': 1.4647794675077562e-05, 'use_batchnorm': False, 'use_dropout': False, 'mlp_size_1': 7, 'mlp_size_2': 1, 'mlp_size_3': 0, 'kernel': 'Normal', 'loss_name': 'AlternativeNLLLoss'}. Best is trial 205 with value: 0.8548990439632759.[0m
[32m[I 2022-04-26 06:01:19,477][0m Trial 248 finished with value: 0.85222676823909 and parameters: {'n_hidden': 2048, 'mixture_components': 3, 'use_sparse_layer': True, 'use_sparse_loss': True, 'lmbd': 7.0175483046675425e-06, 'use_batchnorm': False, 'use_dropout': False, 'mlp_size_1': 7, 'mlp_size_2': 1, 'mlp_size_3': 0, 'kernel': 'Normal', 'loss_name': 'AlternativeNLLLoss'}. Best is trial 205 with value: 0.8548990439632759.[0m
[32m[I 2022-04-26 06:05:52,286][0m Trial 249 finished with value: 0.8524595996906952 and parameters: {'n_hidden': 512, 'mixture_components': 2, 'use_sparse_layer': True, 'use_sparse_loss': True, 'lmbd': 1.1553365593127274e-05, 'use_batchnorm': False, 'use_dropout': False, 'mlp_size_1': 6, 'mlp_size_2': 0, 'mlp_size_3': 0, 'kernel': 'Normal', 'loss_name': 'AlternativeNLLLoss'}. Best is trial 205 with value: 0.8548990439632759.[0m
[32m[I 2022-04-26 06:11:05,812][0m Trial 250 finished with value: 0.8446840465463156 and parameters: {'n_hidden': 2048, 'mixture_components': 3, 'use_sparse_layer': True, 'use_sparse_loss': True, 'lmbd': 4.831474643610547e-06, 'use_batchnorm': False, 'use_dropout': True, 'dropout': 0.39535134090241986, 'mlp_size_1': 8, 'mlp_size_2': 0, 'mlp_size_3': 0, 'kernel': 'Normal', 'loss_name': 'AlternativeNLLLoss'}. Best is trial 205 with value: 0.8548990439632759.[0m
[32m[I 2022-04-26 06:16:58,275][0m Trial 251 finished with value: 0.8488452572933337 and parameters: {'n_hidden': 2048, 'mixture_components': 3, 'use_sparse_layer': True, 'use_sparse_loss': True, 'lmbd': 1.825578029711607e-05, 'use_batchnorm': False, 'use_dropout': False, 'mlp_size_1': 7, 'mlp_size_2': 1, 'mlp_size_3': 0, 'kernel': 'Normal', 'loss_name': 'AlternativeNLLLoss'}. Best is trial 205 with value: 0.8548990439632759.[0m
[32m[I 2022-04-26 06:23:03,567][0m Trial 252 finished with value: 0.8537218098647423 and parameters: {'n_hidden': 2048, 'mixture_components': 3, 'use_sparse_layer': True, 'use_sparse_loss': True, 'lmbd': 8.46590630412809e-06, 'use_batchnorm': False, 'use_dropout': False, 'mlp_size_1': 7, 'mlp_size_2': 1, 'mlp_size_3': 0, 'kernel': 'Normal', 'loss_name': 'AlternativeNLLLoss'}. Best is trial 205 with value: 0.8548990439632759.[0m
[32m[I 2022-04-26 06:28:36,603][0m Trial 253 finished with value: 0.8503533800087506 and parameters: {'n_hidden': 2048, 'mixture_components': 3, 'use_sparse_layer': True, 'use_sparse_loss': True, 'lmbd': 9.090734552280217e-06, 'use_batchnorm': False, 'use_dropout': False, 'mlp_size_1': 7, 'mlp_size_2': 1, 'mlp_size_3': 0, 'kernel': 'Normal', 'loss_name': 'AlternativeNLLLoss'}. Best is trial 205 with value: 0.8548990439632759.[0m
[32m[I 2022-04-26 06:34:15,430][0m Trial 254 finished with value: 0.8520851914014035 and parameters: {'n_hidden': 2048, 'mixture_components': 3, 'use_sparse_layer': True, 'use_sparse_loss': True, 'lmbd': 1.225148197349492e-05, 'use_batchnorm': False, 'use_dropout': False, 'mlp_size_1': 7, 'mlp_size_2': 1, 'mlp_size_3': 0, 'kernel': 'Normal', 'loss_name': 'AlternativeNLLLoss'}. Best is trial 205 with value: 0.8548990439632759.[0m
[32m[I 2022-04-26 06:40:32,137][0m Trial 255 finished with value: 0.8529030054883882 and parameters: {'n_hidden': 2048, 'mixture_components': 3, 'use_sparse_layer': True, 'use_sparse_loss': False, 'use_batchnorm': False, 'use_dropout': False, 'mlp_size_1': 7, 'mlp_size_2': 1, 'mlp_size_3': 0, 'kernel': 'Normal', 'loss_name': 'AlternativeNLLLoss'}. Best is trial 205 with value: 0.8548990439632759.[0m
[32m[I 2022-04-26 06:46:59,830][0m Trial 256 finished with value: 0.8507517609824671 and parameters: {'n_hidden': 2048, 'mixture_components': 2, 'use_sparse_layer': True, 'use_sparse_loss': True, 'lmbd': 4.021878206147233e-05, 'use_batchnorm': False, 'use_dropout': False, 'mlp_size_1': 7, 'mlp_size_2': 1, 'mlp_size_3': 0, 'kernel': 'Normal', 'loss_name': 'AlternativeNLLLoss'}. Best is trial 205 with value: 0.8548990439632759.[0m
[32m[I 2022-04-26 06:52:59,552][0m Trial 257 finished with value: 0.8498916566160648 and parameters: {'n_hidden': 2048, 'mixture_components': 3, 'use_sparse_layer': True, 'use_sparse_loss': True, 'lmbd': 1.3945643232534856e-06, 'use_batchnorm': False, 'use_dropout': False, 'mlp_size_1': 7, 'mlp_size_2': 1, 'mlp_size_3': 0, 'kernel': 'Normal', 'loss_name': 'AlternativeNLLLoss'}. Best is trial 205 with value: 0.8548990439632759.[0m
[32m[I 2022-04-26 06:57:54,500][0m Trial 258 finished with value: 0.7876816193076648 and parameters: {'n_hidden': 2048, 'mixture_components': 3, 'use_sparse_layer': True, 'use_sparse_loss': True, 'lmbd': 8.11007362299351e-06, 'use_batchnorm': False, 'use_dropout': False, 'mlp_size_1': 7, 'mlp_size_2': 1, 'mlp_size_3': 0, 'kernel': 'Normal', 'loss_name': 'NLLLoss'}. Best is trial 205 with value: 0.8548990439632759.[0m
[32m[I 2022-04-26 07:03:48,276][0m Trial 259 finished with value: 0.8519673249578794 and parameters: {'n_hidden': 2048, 'mixture_components': 4, 'use_sparse_layer': True, 'use_sparse_loss': True, 'lmbd': 2.7788904221363972e-05, 'use_batchnorm': False, 'use_dropout': False, 'mlp_size_1': 7, 'mlp_size_2': 1, 'mlp_size_3': 0, 'kernel': 'Normal', 'loss_name': 'AlternativeNLLLoss'}. Best is trial 205 with value: 0.8548990439632759.[0m
[32m[I 2022-04-26 07:09:17,266][0m Trial 260 finished with value: 0.85073405151401 and parameters: {'n_hidden': 2048, 'mixture_components': 2, 'use_sparse_layer': True, 'use_sparse_loss': True, 'lmbd': 1.3530383734806728e-05, 'use_batchnorm': False, 'use_dropout': False, 'mlp_size_1': 7, 'mlp_size_2': 1, 'mlp_size_3': 0, 'kernel': 'Normal', 'loss_name': 'AlternativeNLLLoss'}. Best is trial 205 with value: 0.8548990439632759.[0m
[32m[I 2022-04-26 07:12:36,733][0m Trial 261 finished with value: 0.8441620781419086 and parameters: {'n_hidden': 256, 'mixture_components': 3, 'use_sparse_layer': True, 'use_sparse_loss': True, 'lmbd': 1.0216832194236388e-06, 'use_batchnorm': False, 'use_dropout': True, 'dropout': 0.3171167175119335, 'mlp_size_1': 5, 'mlp_size_2': 0, 'mlp_size_3': 0, 'kernel': 'Normal', 'loss_name': 'AlternativeNLLLoss'}. Best is trial 205 with value: 0.8548990439632759.[0m
[32m[I 2022-04-26 07:24:28,322][0m Trial 262 finished with value: 0.8408067418959039 and parameters: {'n_hidden': 2048, 'mixture_components': 4, 'use_sparse_layer': True, 'use_sparse_loss': True, 'lmbd': 6.272911273239491e-06, 'use_batchnorm': True, 'use_dropout': False, 'mlp_size_1': 8, 'mlp_size_2': 0, 'mlp_size_3': 0, 'kernel': 'Normal', 'loss_name': 'AlternativeNLLLoss'}. Best is trial 205 with value: 0.8548990439632759.[0m
[32m[I 2022-04-26 07:31:45,355][0m Trial 263 finished with value: 0.8408810858824669 and parameters: {'n_hidden': 32, 'mixture_components': 3, 'use_sparse_layer': True, 'use_sparse_loss': True, 'lmbd': 9.53259173313363e-06, 'use_batchnorm': False, 'use_dropout': False, 'mlp_size_1': 2, 'mlp_size_2': 0, 'mlp_size_3': 0, 'kernel': 'Normal', 'loss_name': 'AlternativeNLLLoss'}. Best is trial 205 with value: 0.8548990439632759.[0m
[32m[I 2022-04-26 07:36:46,549][0m Trial 264 finished with value: 0.8519613946663395 and parameters: {'n_hidden': 512, 'mixture_components': 4, 'use_sparse_layer': True, 'use_sparse_loss': True, 'lmbd': 2.1910464710715776e-05, 'use_batchnorm': False, 'use_dropout': False, 'mlp_size_1': 6, 'mlp_size_2': 0, 'mlp_size_3': 0, 'kernel': 'Normal', 'loss_name': 'AlternativeNLLLoss'}. Best is trial 205 with value: 0.8548990439632759.[0m
[32m[I 2022-04-26 07:42:58,255][0m Trial 265 finished with value: 0.8542950881527144 and parameters: {'n_hidden': 2048, 'mixture_components': 5, 'use_sparse_layer': True, 'use_sparse_loss': True, 'lmbd': 4.086640373800271e-06, 'use_batchnorm': False, 'use_dropout': False, 'mlp_size_1': 7, 'mlp_size_2': 1, 'mlp_size_3': 0, 'kernel': 'Normal', 'loss_name': 'AlternativeNLLLoss'}. Best is trial 205 with value: 0.8548990439632759.[0m
[32m[I 2022-04-26 07:48:49,012][0m Trial 266 finished with value: 0.8541560789030909 and parameters: {'n_hidden': 2048, 'mixture_components': 3, 'use_sparse_layer': True, 'use_sparse_loss': True, 'lmbd': 4.414500811190734e-06, 'use_batchnorm': False, 'use_dropout': False, 'mlp_size_1': 7, 'mlp_size_2': 1, 'mlp_size_3': 0, 'kernel': 'Normal', 'loss_name': 'AlternativeNLLLoss'}. Best is trial 205 with value: 0.8548990439632759.[0m
[32m[I 2022-04-26 07:54:13,669][0m Trial 267 finished with value: 0.8505788480348178 and parameters: {'n_hidden': 2048, 'mixture_components': 3, 'use_sparse_layer': True, 'use_sparse_loss': True, 'lmbd': 4.141094822729443e-06, 'use_batchnorm': False, 'use_dropout': False, 'mlp_size_1': 7, 'mlp_size_2': 1, 'mlp_size_3': 0, 'kernel': 'Normal', 'loss_name': 'AlternativeNLLLoss'}. Best is trial 205 with value: 0.8548990439632759.[0m
[32m[I 2022-04-26 07:59:57,762][0m Trial 268 finished with value: 0.8478112944566011 and parameters: {'n_hidden': 2048, 'mixture_components': 3, 'use_sparse_layer': True, 'use_sparse_loss': True, 'lmbd': 5.2071239082262895e-06, 'use_batchnorm': False, 'use_dropout': False, 'mlp_size_1': 7, 'mlp_size_2': 1, 'mlp_size_3': 0, 'kernel': 'Normal', 'loss_name': 'AlternativeNLLLoss'}. Best is trial 205 with value: 0.8548990439632759.[0m
[32m[I 2022-04-26 08:05:22,441][0m Trial 269 finished with value: 0.8517762498500083 and parameters: {'n_hidden': 2048, 'mixture_components': 4, 'use_sparse_layer': True, 'use_sparse_loss': True, 'lmbd': 2.0370102848345e-06, 'use_batchnorm': False, 'use_dropout': False, 'mlp_size_1': 7, 'mlp_size_2': 1, 'mlp_size_3': 0, 'kernel': 'Normal', 'loss_name': 'AlternativeNLLLoss'}. Best is trial 205 with value: 0.8548990439632759.[0m
[32m[I 2022-04-26 08:12:09,999][0m Trial 270 finished with value: 0.8524106092737792 and parameters: {'n_hidden': 2048, 'mixture_components': 3, 'use_sparse_layer': True, 'use_sparse_loss': True, 'lmbd': 4.072557618212204e-06, 'use_batchnorm': False, 'use_dropout': False, 'mlp_size_1': 7, 'mlp_size_2': 1, 'mlp_size_3': 0, 'kernel': 'Normal', 'loss_name': 'AlternativeNLLLoss'}. Best is trial 205 with value: 0.8548990439632759.[0m
[32m[I 2022-04-26 08:18:23,271][0m Trial 271 finished with value: 0.8517307145413145 and parameters: {'n_hidden': 2048, 'mixture_components': 3, 'use_sparse_layer': True, 'use_sparse_loss': True, 'lmbd': 0.00036321485941175356, 'use_batchnorm': False, 'use_dropout': False, 'mlp_size_1': 7, 'mlp_size_2': 1, 'mlp_size_3': 0, 'kernel': 'Normal', 'loss_name': 'AlternativeNLLLoss'}. Best is trial 205 with value: 0.8548990439632759.[0m
[32m[I 2022-04-26 08:21:19,438][0m Trial 272 finished with value: -1.0 and parameters: {'n_hidden': 2048, 'mixture_components': 3, 'use_sparse_layer': True, 'use_sparse_loss': True, 'lmbd': 7.546253175002089e-06, 'use_batchnorm': False, 'use_dropout': True, 'dropout': 0.6171047631873515, 'mlp_size_1': 7, 'mlp_size_2': 1, 'mlp_size_3': 0, 'kernel': 'Exponential', 'loss_name': 'AlternativeNLLLoss'}. Best is trial 205 with value: 0.8548990439632759.[0m
[32m[I 2022-04-26 08:27:03,155][0m Trial 273 finished with value: 0.8492547173303944 and parameters: {'n_hidden': 2048, 'mixture_components': 2, 'use_sparse_layer': True, 'use_sparse_loss': False, 'use_batchnorm': False, 'use_dropout': False, 'mlp_size_1': 7, 'mlp_size_2': 1, 'mlp_size_3': 0, 'kernel': 'Normal', 'loss_name': 'AlternativeNLLLoss'}. Best is trial 205 with value: 0.8548990439632759.[0m
[32m[I 2022-04-26 08:32:42,340][0m Trial 274 finished with value: 0.8507400338082188 and parameters: {'n_hidden': 2048, 'mixture_components': 4, 'use_sparse_layer': True, 'use_sparse_loss': True, 'lmbd': 5.72432841696429e-06, 'use_batchnorm': False, 'use_dropout': False, 'mlp_size_1': 7, 'mlp_size_2': 1, 'mlp_size_3': 0, 'kernel': 'Normal', 'loss_name': 'AlternativeNLLLoss'}. Best is trial 205 with value: 0.8548990439632759.[0m
[32m[I 2022-04-26 08:38:41,615][0m Trial 275 finished with value: 0.848525814728152 and parameters: {'n_hidden': 2048, 'mixture_components': 3, 'use_sparse_layer': True, 'use_sparse_loss': True, 'lmbd': 1.1422330714186212e-05, 'use_batchnorm': False, 'use_dropout': False, 'mlp_size_1': 8, 'mlp_size_2': 0, 'mlp_size_3': 0, 'kernel': 'Normal', 'loss_name': 'AlternativeNLLLoss'}. Best is trial 205 with value: 0.8548990439632759.[0m
[32m[I 2022-04-26 08:42:41,782][0m Trial 276 finished with value: 0.8042653211718628 and parameters: {'n_hidden': 1024, 'mixture_components': 3, 'use_sparse_layer': True, 'use_sparse_loss': True, 'lmbd': 3.1863943744597185e-06, 'use_batchnorm': False, 'use_dropout': False, 'mlp_size_1': 7, 'mlp_size_2': 0, 'mlp_size_3': 0, 'kernel': 'Normal', 'loss_name': 'AlternativeNLLLoss'}. Best is trial 205 with value: 0.8548990439632759.[0m
[32m[I 2022-04-26 08:49:04,631][0m Trial 277 finished with value: 0.8538985508281455 and parameters: {'n_hidden': 2048, 'mixture_components': 4, 'use_sparse_layer': True, 'use_sparse_loss': True, 'lmbd': 2.993465845884504e-06, 'use_batchnorm': False, 'use_dropout': False, 'mlp_size_1': 7, 'mlp_size_2': 1, 'mlp_size_3': 0, 'kernel': 'Normal', 'loss_name': 'AlternativeNLLLoss'}. Best is trial 205 with value: 0.8548990439632759.[0m
