[32m[I 2022-04-21 14:15:31,472][0m Trial 959 finished with value: 0.9150250394689676 and parameters: {'alpha': 1.9101391283004259, 'ties': 'breslow'}. Best is trial 854 with value: 0.9150268460560183.[0m
[32m[I 2022-04-21 14:15:41,867][0m Trial 960 finished with value: 0.9149771829506432 and parameters: {'alpha': 2.0578389136686805, 'ties': 'breslow'}. Best is trial 854 with value: 0.9150268460560183.[0m
[32m[I 2022-04-21 14:15:54,227][0m Trial 961 finished with value: 0.9149911870815446 and parameters: {'alpha': 1.6645468476741427, 'ties': 'breslow'}. Best is trial 854 with value: 0.9150268460560183.[0m
[32m[I 2022-04-21 14:16:04,027][0m Trial 962 finished with value: 0.9150157976456331 and parameters: {'alpha': 1.8282608238147602, 'ties': 'breslow'}. Best is trial 854 with value: 0.9150268460560183.[0m
[32m[I 2022-04-21 14:16:14,523][0m Trial 963 finished with value: 0.9149734957406472 and parameters: {'alpha': 2.168791031694523, 'ties': 'breslow'}. Best is trial 854 with value: 0.9150268460560183.[0m
[32m[I 2022-04-21 14:16:25,602][0m Trial 964 finished with value: 0.9150216684684503 and parameters: {'alpha': 1.9537491467180832, 'ties': 'breslow'}. Best is trial 854 with value: 0.9150268460560183.[0m
[32m[I 2022-04-21 14:16:36,521][0m Trial 965 finished with value: 0.9150074600009214 and parameters: {'alpha': 1.755644603521335, 'ties': 'breslow'}. Best is trial 854 with value: 0.9150268460560183.[0m
[32m[I 2022-04-21 14:16:47,016][0m Trial 966 finished with value: 0.915018113780571 and parameters: {'alpha': 1.8730161264554357, 'ties': 'breslow'}. Best is trial 854 with value: 0.9150268460560183.[0m
[32m[I 2022-04-21 14:16:56,408][0m Trial 967 finished with value: 0.9149939381244557 and parameters: {'alpha': 2.0229025880871623, 'ties': 'breslow'}. Best is trial 854 with value: 0.9150268460560183.[0m
[32m[I 2022-04-21 14:17:05,027][0m Trial 968 finished with value: 0.9150252328679557 and parameters: {'alpha': 1.9403668221952675, 'ties': 'breslow'}. Best is trial 854 with value: 0.9150268460560183.[0m
[32m[I 2022-04-21 14:17:17,429][0m Trial 969 finished with value: 0.9149721098951371 and parameters: {'alpha': 2.1049346366187227, 'ties': 'breslow'}. Best is trial 854 with value: 0.9150268460560183.[0m
[32m[I 2022-04-21 14:17:35,443][0m Trial 970 finished with value: 0.9148987219178976 and parameters: {'alpha': 1.8200010821635342, 'ties': 'efron'}. Best is trial 854 with value: 0.9150268460560183.[0m
[32m[I 2022-04-21 14:17:45,462][0m Trial 971 finished with value: 0.9149727487410834 and parameters: {'alpha': 1.3488764545637753, 'ties': 'breslow'}. Best is trial 854 with value: 0.9150268460560183.[0m
[32m[I 2022-04-21 14:17:54,164][0m Trial 972 finished with value: 0.9149737561828699 and parameters: {'alpha': 1.5435231524398887, 'ties': 'breslow'}. Best is trial 854 with value: 0.9150268460560183.[0m
[32m[I 2022-04-21 14:18:05,440][0m Trial 973 finished with value: 0.9149946617824692 and parameters: {'alpha': 1.9982040635170082, 'ties': 'breslow'}. Best is trial 854 with value: 0.9150268460560183.[0m
[32m[I 2022-04-21 14:18:16,570][0m Trial 974 finished with value: 0.9149355292114878 and parameters: {'alpha': 3.007722168289066, 'ties': 'breslow'}. Best is trial 854 with value: 0.9150268460560183.[0m
[32m[I 2022-04-21 14:18:26,259][0m Trial 975 finished with value: 0.9149917753779014 and parameters: {'alpha': 1.6962681781481335, 'ties': 'breslow'}. Best is trial 854 with value: 0.9150268460560183.[0m
[32m[I 2022-04-21 14:18:35,591][0m Trial 976 finished with value: 0.9150242059664258 and parameters: {'alpha': 1.8877580494606023, 'ties': 'breslow'}. Best is trial 854 with value: 0.9150268460560183.[0m
[32m[I 2022-04-21 14:18:45,392][0m Trial 977 finished with value: 0.9150069471745761 and parameters: {'alpha': 1.7903330832213722, 'ties': 'breslow'}. Best is trial 854 with value: 0.9150268460560183.[0m
[32m[I 2022-04-21 14:18:55,104][0m Trial 978 finished with value: 0.9149625069886778 and parameters: {'alpha': 2.294624003847073, 'ties': 'breslow'}. Best is trial 854 with value: 0.9150268460560183.[0m
[32m[I 2022-04-21 14:19:05,636][0m Trial 979 finished with value: 0.9149735386698612 and parameters: {'alpha': 2.1403074416533743, 'ties': 'breslow'}. Best is trial 854 with value: 0.9150268460560183.[0m
[32m[I 2022-04-21 14:19:15,875][0m Trial 980 finished with value: 0.9150212628089219 and parameters: {'alpha': 1.9628030694997245, 'ties': 'breslow'}. Best is trial 854 with value: 0.9150268460560183.[0m
[32m[I 2022-04-21 14:19:26,284][0m Trial 981 finished with value: 0.9149830803662935 and parameters: {'alpha': 2.0444046766578263, 'ties': 'breslow'}. Best is trial 854 with value: 0.9150268460560183.[0m
[32m[I 2022-04-21 14:19:38,388][0m Trial 982 finished with value: 0.9150177709078336 and parameters: {'alpha': 1.8663526372915058, 'ties': 'breslow'}. Best is trial 854 with value: 0.9150268460560183.[0m
[32m[I 2022-04-21 14:19:47,999][0m Trial 983 finished with value: 0.9149952978094037 and parameters: {'alpha': 1.713691796752855, 'ties': 'breslow'}. Best is trial 854 with value: 0.9150268460560183.[0m
[32m[I 2022-04-21 14:19:58,170][0m Trial 984 finished with value: 0.9150208775494345 and parameters: {'alpha': 1.9270611312621797, 'ties': 'breslow'}. Best is trial 854 with value: 0.9150268460560183.[0m
[32m[I 2022-04-21 14:20:09,389][0m Trial 985 finished with value: 0.9150070187412851 and parameters: {'alpha': 1.8015708646606126, 'ties': 'breslow'}. Best is trial 854 with value: 0.9150268460560183.[0m
[32m[I 2022-04-21 14:20:18,603][0m Trial 986 finished with value: 0.9149876808052155 and parameters: {'alpha': 1.628495666362719, 'ties': 'breslow'}. Best is trial 854 with value: 0.9150268460560183.[0m
[32m[I 2022-04-21 14:20:28,512][0m Trial 987 finished with value: 0.9149747418436313 and parameters: {'alpha': 2.061565038592572, 'ties': 'breslow'}. Best is trial 854 with value: 0.9150268460560183.[0m
[32m[I 2022-04-21 14:20:39,895][0m Trial 988 finished with value: 0.9149704267079748 and parameters: {'alpha': 2.211764481772725, 'ties': 'breslow'}. Best is trial 854 with value: 0.9150268460560183.[0m
[32m[I 2022-04-21 14:20:54,914][0m Trial 989 finished with value: 0.9149440931036776 and parameters: {'alpha': 2.6597936868864767, 'ties': 'efron'}. Best is trial 854 with value: 0.9150268460560183.[0m
[32m[I 2022-04-21 14:21:06,379][0m Trial 990 finished with value: 0.9150224891341561 and parameters: {'alpha': 1.9527629852645267, 'ties': 'breslow'}. Best is trial 854 with value: 0.9150268460560183.[0m
[32m[I 2022-04-21 14:21:17,017][0m Trial 991 finished with value: 0.915011247220383 and parameters: {'alpha': 1.8178789880030286, 'ties': 'breslow'}. Best is trial 854 with value: 0.9150268460560183.[0m
[32m[I 2022-04-21 14:21:27,604][0m Trial 992 finished with value: 0.9150199498941596 and parameters: {'alpha': 1.8790026649711793, 'ties': 'breslow'}. Best is trial 854 with value: 0.9150268460560183.[0m
[32m[I 2022-04-21 14:21:36,895][0m Trial 993 finished with value: 0.9149923611215552 and parameters: {'alpha': 2.009231790440147, 'ties': 'breslow'}. Best is trial 854 with value: 0.9150268460560183.[0m
[32m[I 2022-04-21 14:21:49,226][0m Trial 994 finished with value: 0.9149932124499687 and parameters: {'alpha': 1.6977773020925304, 'ties': 'breslow'}. Best is trial 854 with value: 0.9150268460560183.[0m
[32m[I 2022-04-21 14:21:58,715][0m Trial 995 finished with value: 0.9149729976536805 and parameters: {'alpha': 2.103369187032177, 'ties': 'breslow'}. Best is trial 854 with value: 0.9150268460560183.[0m
[32m[I 2022-04-21 14:22:09,821][0m Trial 996 finished with value: 0.9150199498941596 and parameters: {'alpha': 1.878897646228812, 'ties': 'breslow'}. Best is trial 854 with value: 0.9150268460560183.[0m
[32m[I 2022-04-21 14:22:18,965][0m Trial 997 finished with value: 0.9150054693603302 and parameters: {'alpha': 1.7478850247061892, 'ties': 'breslow'}. Best is trial 854 with value: 0.9150268460560183.[0m
[32m[I 2022-04-21 14:22:29,073][0m Trial 998 finished with value: 0.9149939151694235 and parameters: {'alpha': 1.9999772610500666, 'ties': 'breslow'}. Best is trial 854 with value: 0.9150268460560183.[0m
[32m[I 2022-04-21 14:22:39,992][0m Trial 999 finished with value: 0.9150220919449537 and parameters: {'alpha': 1.9190351953521334, 'ties': 'breslow'}. Best is trial 854 with value: 0.9150268460560183.[0m
[32m[I 2022-04-21 14:22:39,998][0m A new study created in memory with name: no-name-439da791-c836-40c5-ac35-bf3396382b33[0m
[32m[I 2022-04-21 14:22:52,032][0m Trial 0 finished with value: 0.8297585472671045 and parameters: {'alpha': 1.1373493346321268, 'ties': 'efron'}. Best is trial 0 with value: 0.8297585472671045.[0m
[32m[I 2022-04-21 14:23:07,321][0m Trial 1 finished with value: 0.8298274284743361 and parameters: {'alpha': 3.82986770377473, 'ties': 'efron'}. Best is trial 1 with value: 0.8298274284743361.[0m
[32m[I 2022-04-21 14:23:17,097][0m Trial 2 finished with value: 0.8299043225613374 and parameters: {'alpha': 2.8911940794839026, 'ties': 'breslow'}. Best is trial 2 with value: 0.8299043225613374.[0m
[32m[I 2022-04-21 14:23:28,621][0m Trial 3 finished with value: 0.8295005151813417 and parameters: {'alpha': 0.639976752214144, 'ties': 'efron'}. Best is trial 2 with value: 0.8299043225613374.[0m
[32m[I 2022-04-21 14:23:40,779][0m Trial 4 finished with value: 0.8299174152721195 and parameters: {'alpha': 2.271945734877616, 'ties': 'efron'}. Best is trial 4 with value: 0.8299174152721195.[0m
[32m[I 2022-04-21 14:23:51,333][0m Trial 5 finished with value: 0.829838099120513 and parameters: {'alpha': 3.516810071902254, 'ties': 'breslow'}. Best is trial 4 with value: 0.8299174152721195.[0m
[32m[I 2022-04-21 14:23:59,606][0m Trial 6 finished with value: 0.8298765494275979 and parameters: {'alpha': 3.1275707525075718, 'ties': 'breslow'}. Best is trial 4 with value: 0.8299174152721195.[0m
[32m[I 2022-04-21 14:24:08,388][0m Trial 7 finished with value: 0.8299186713308112 and parameters: {'alpha': 2.701568062237139, 'ties': 'breslow'}. Best is trial 7 with value: 0.8299186713308112.[0m
[32m[I 2022-04-21 14:24:20,748][0m Trial 8 finished with value: 0.8297789006691128 and parameters: {'alpha': 4.118634363317223, 'ties': 'efron'}. Best is trial 7 with value: 0.8299186713308112.[0m
[32m[I 2022-04-21 14:24:33,930][0m Trial 9 finished with value: 0.8297314876272484 and parameters: {'alpha': 4.999041303633792, 'ties': 'efron'}. Best is trial 7 with value: 0.8299186713308112.[0m
[32m[I 2022-04-21 14:24:41,147][0m Trial 10 finished with value: 0.8300137702478319 and parameters: {'alpha': 1.8012931696384187, 'ties': 'breslow'}. Best is trial 10 with value: 0.8300137702478319.[0m
[32m[I 2022-04-21 14:24:50,823][0m Trial 11 finished with value: 0.8299798322756461 and parameters: {'alpha': 1.6919251209553814, 'ties': 'breslow'}. Best is trial 10 with value: 0.8300137702478319.[0m
[32m[I 2022-04-21 14:25:00,450][0m Trial 12 finished with value: 0.8299797341974922 and parameters: {'alpha': 1.6908012432911461, 'ties': 'breslow'}. Best is trial 10 with value: 0.8300137702478319.[0m
[32m[I 2022-04-21 14:25:10,282][0m Trial 13 finished with value: 0.8294046413142372 and parameters: {'alpha': 0.22022882902081808, 'ties': 'breslow'}. Best is trial 10 with value: 0.8300137702478319.[0m
[32m[I 2022-04-21 14:25:17,577][0m Trial 14 finished with value: 0.8300397355584487 and parameters: {'alpha': 1.879107503753807, 'ties': 'breslow'}. Best is trial 14 with value: 0.8300397355584487.[0m
[32m[I 2022-04-21 14:25:26,517][0m Trial 15 finished with value: 0.8299575875324627 and parameters: {'alpha': 2.0544229971648975, 'ties': 'breslow'}. Best is trial 14 with value: 0.8300397355584487.[0m
[32m[I 2022-04-21 14:25:33,948][0m Trial 16 finished with value: 0.829903719029202 and parameters: {'alpha': 1.0179183285137792, 'ties': 'breslow'}. Best is trial 14 with value: 0.8300397355584487.[0m
[32m[I 2022-04-21 14:25:40,729][0m Trial 17 finished with value: 0.8299526690257547 and parameters: {'alpha': 1.4885128448820708, 'ties': 'breslow'}. Best is trial 14 with value: 0.8300397355584487.[0m
[32m[I 2022-04-21 14:25:48,994][0m Trial 18 finished with value: 0.829326949288502 and parameters: {'alpha': 0.10402903978609013, 'ties': 'breslow'}. Best is trial 14 with value: 0.8300397355584487.[0m
[32m[I 2022-04-21 14:25:55,782][0m Trial 19 finished with value: 0.829929971736951 and parameters: {'alpha': 2.270334927558608, 'ties': 'breslow'}. Best is trial 14 with value: 0.8300397355584487.[0m
[32m[I 2022-04-21 14:26:02,937][0m Trial 20 finished with value: 0.8298221992551766 and parameters: {'alpha': 0.8771034578696044, 'ties': 'breslow'}. Best is trial 14 with value: 0.8300397355584487.[0m
[32m[I 2022-04-21 14:26:12,341][0m Trial 21 finished with value: 0.8300316027431057 and parameters: {'alpha': 1.8422569957802646, 'ties': 'breslow'}. Best is trial 14 with value: 0.8300397355584487.[0m
[32m[I 2022-04-21 14:26:22,128][0m Trial 22 finished with value: 0.830047844647839 and parameters: {'alpha': 1.8907973779595733, 'ties': 'breslow'}. Best is trial 22 with value: 0.830047844647839.[0m
[32m[I 2022-04-21 14:26:30,932][0m Trial 23 finished with value: 0.82992823222058 and parameters: {'alpha': 1.3194260199752557, 'ties': 'breslow'}. Best is trial 22 with value: 0.830047844647839.[0m
[32m[I 2022-04-21 14:26:42,177][0m Trial 24 finished with value: 0.8299274768581426 and parameters: {'alpha': 2.3604201841607666, 'ties': 'breslow'}. Best is trial 22 with value: 0.830047844647839.[0m
[32m[I 2022-04-21 14:26:49,936][0m Trial 25 finished with value: 0.8297368364826987 and parameters: {'alpha': 0.6438713269497487, 'ties': 'breslow'}. Best is trial 22 with value: 0.830047844647839.[0m
[32m[I 2022-04-21 14:26:57,737][0m Trial 26 finished with value: 0.8298705726269329 and parameters: {'alpha': 3.165128062000931, 'ties': 'breslow'}. Best is trial 22 with value: 0.830047844647839.[0m
[32m[I 2022-04-21 14:27:05,436][0m Trial 27 finished with value: 0.8299878261664844 and parameters: {'alpha': 2.017827171107588, 'ties': 'breslow'}. Best is trial 22 with value: 0.830047844647839.[0m
[32m[I 2022-04-21 14:27:13,906][0m Trial 28 finished with value: 0.8299130286996871 and parameters: {'alpha': 2.6382331670197443, 'ties': 'breslow'}. Best is trial 22 with value: 0.830047844647839.[0m
[32m[I 2022-04-21 14:27:30,214][0m Trial 29 finished with value: 0.8297324444784593 and parameters: {'alpha': 1.2919209524621422, 'ties': 'efron'}. Best is trial 22 with value: 0.830047844647839.[0m
[32m[I 2022-04-21 14:27:37,800][0m Trial 30 finished with value: 0.8300522862392109 and parameters: {'alpha': 1.9385221234427068, 'ties': 'breslow'}. Best is trial 30 with value: 0.8300522862392109.[0m
[32m[I 2022-04-21 14:27:48,352][0m Trial 31 finished with value: 0.830041207553141 and parameters: {'alpha': 1.9576918696474646, 'ties': 'breslow'}. Best is trial 30 with value: 0.8300522862392109.[0m
[32m[I 2022-04-21 14:27:56,945][0m Trial 32 finished with value: 0.8299375934515538 and parameters: {'alpha': 1.4139612598721594, 'ties': 'breslow'}. Best is trial 30 with value: 0.8300522862392109.[0m
[32m[I 2022-04-21 14:28:05,575][0m Trial 33 finished with value: 0.829949093922556 and parameters: {'alpha': 2.126678329367449, 'ties': 'breslow'}. Best is trial 30 with value: 0.8300522862392109.[0m
[32m[I 2022-04-21 14:28:15,560][0m Trial 34 finished with value: 0.8298905280068263 and parameters: {'alpha': 2.6011373004719767, 'ties': 'efron'}. Best is trial 30 with value: 0.8300522862392109.[0m
[32m[I 2022-04-21 14:28:23,077][0m Trial 35 finished with value: 0.8299582896508001 and parameters: {'alpha': 1.5801014835323286, 'ties': 'breslow'}. Best is trial 30 with value: 0.8300522862392109.[0m
[32m[I 2022-04-21 14:28:30,257][0m Trial 36 finished with value: 0.8299062404594413 and parameters: {'alpha': 2.8462342625130646, 'ties': 'breslow'}. Best is trial 30 with value: 0.8300522862392109.[0m
[32m[I 2022-04-21 14:28:42,541][0m Trial 37 finished with value: 0.8297331112189331 and parameters: {'alpha': 1.0344278520213785, 'ties': 'efron'}. Best is trial 30 with value: 0.8300522862392109.[0m
[32m[I 2022-04-21 14:28:52,487][0m Trial 38 finished with value: 0.8299250714301607 and parameters: {'alpha': 2.414186258635312, 'ties': 'breslow'}. Best is trial 30 with value: 0.8300522862392109.[0m
[32m[I 2022-04-21 14:28:59,570][0m Trial 39 finished with value: 0.8298295107255866 and parameters: {'alpha': 3.5702466487247633, 'ties': 'breslow'}. Best is trial 30 with value: 0.8300522862392109.[0m
[32m[I 2022-04-21 14:29:11,392][0m Trial 40 finished with value: 0.8298319766129569 and parameters: {'alpha': 1.9012340830515162, 'ties': 'efron'}. Best is trial 30 with value: 0.8300522862392109.[0m
[32m[I 2022-04-21 14:29:20,093][0m Trial 41 finished with value: 0.8300437266725755 and parameters: {'alpha': 1.9458844735280796, 'ties': 'breslow'}. Best is trial 30 with value: 0.8300522862392109.[0m
[32m[I 2022-04-21 14:29:27,782][0m Trial 42 finished with value: 0.8299473998750893 and parameters: {'alpha': 2.1723421554093694, 'ties': 'breslow'}. Best is trial 30 with value: 0.8300522862392109.[0m
[32m[I 2022-04-21 14:29:38,792][0m Trial 43 finished with value: 0.8300436638026302 and parameters: {'alpha': 1.9186094960770803, 'ties': 'breslow'}. Best is trial 30 with value: 0.8300522862392109.[0m
[32m[I 2022-04-21 14:29:44,120][0m Trial 44 finished with value: 0.829881648548009 and parameters: {'alpha': 3.107654575586518, 'ties': 'breslow'}. Best is trial 30 with value: 0.8300522862392109.[0m
[32m[I 2022-04-21 14:29:49,847][0m Trial 45 finished with value: 0.8299742461654954 and parameters: {'alpha': 1.6261278739393654, 'ties': 'breslow'}. Best is trial 30 with value: 0.8300522862392109.[0m
[32m[I 2022-04-21 14:29:59,820][0m Trial 46 finished with value: 0.8299136822378129 and parameters: {'alpha': 1.2268007653852226, 'ties': 'breslow'}. Best is trial 30 with value: 0.8300522862392109.[0m
[32m[I 2022-04-21 14:30:08,534][0m Trial 47 finished with value: 0.8299241823754256 and parameters: {'alpha': 2.4639774079385046, 'ties': 'breslow'}. Best is trial 30 with value: 0.8300522862392109.[0m
[32m[I 2022-04-21 14:30:24,274][0m Trial 48 finished with value: 0.8297781427877388 and parameters: {'alpha': 4.144979871030229, 'ties': 'efron'}. Best is trial 30 with value: 0.8300522862392109.[0m
[32m[I 2022-04-21 14:30:32,779][0m Trial 49 finished with value: 0.8298063267139065 and parameters: {'alpha': 0.7991454505912357, 'ties': 'breslow'}. Best is trial 30 with value: 0.8300522862392109.[0m
[32m[I 2022-04-21 14:30:40,701][0m Trial 50 finished with value: 0.8299987996701012 and parameters: {'alpha': 1.7324302641126463, 'ties': 'breslow'}. Best is trial 30 with value: 0.8300522862392109.[0m
[32m[I 2022-04-21 14:30:51,065][0m Trial 51 finished with value: 0.8300491104360749 and parameters: {'alpha': 1.9420255498762125, 'ties': 'breslow'}. Best is trial 30 with value: 0.8300522862392109.[0m
[32m[I 2022-04-21 14:30:59,736][0m Trial 52 finished with value: 0.8300502791619554 and parameters: {'alpha': 1.9352383643319984, 'ties': 'breslow'}. Best is trial 30 with value: 0.8300522862392109.[0m
[32m[I 2022-04-21 14:31:07,649][0m Trial 53 finished with value: 0.8299407442069857 and parameters: {'alpha': 2.241171084599086, 'ties': 'breslow'}. Best is trial 30 with value: 0.8300522862392109.[0m
[32m[I 2022-04-21 14:31:18,239][0m Trial 54 finished with value: 0.8299053613497769 and parameters: {'alpha': 2.838016783808164, 'ties': 'breslow'}. Best is trial 30 with value: 0.8300522862392109.[0m
[32m[I 2022-04-21 14:31:26,906][0m Trial 55 finished with value: 0.8299482855449781 and parameters: {'alpha': 1.5177196008436735, 'ties': 'breslow'}. Best is trial 30 with value: 0.8300522862392109.[0m
[32m[I 2022-04-21 14:31:35,911][0m Trial 56 finished with value: 0.8299537213604532 and parameters: {'alpha': 2.0594777981606383, 'ties': 'breslow'}. Best is trial 30 with value: 0.8300522862392109.[0m
[32m[I 2022-04-21 14:31:43,201][0m Trial 57 finished with value: 0.8299852596896697 and parameters: {'alpha': 1.6967678375032007, 'ties': 'breslow'}. Best is trial 30 with value: 0.8300522862392109.[0m
[32m[I 2022-04-21 14:31:53,403][0m Trial 58 finished with value: 0.8299354167436359 and parameters: {'alpha': 2.318613392186961, 'ties': 'breslow'}. Best is trial 30 with value: 0.8300522862392109.[0m
[32m[I 2022-04-21 14:32:02,932][0m Trial 59 finished with value: 0.8300408324751704 and parameters: {'alpha': 1.8744183895837818, 'ties': 'breslow'}. Best is trial 30 with value: 0.8300522862392109.[0m
[32m[I 2022-04-21 14:32:11,451][0m Trial 60 finished with value: 0.8299099370775401 and parameters: {'alpha': 2.5032256524530503, 'ties': 'breslow'}. Best is trial 30 with value: 0.8300522862392109.[0m
[32m[I 2022-04-21 14:32:21,563][0m Trial 61 finished with value: 0.8300435972698365 and parameters: {'alpha': 1.95344806058467, 'ties': 'breslow'}. Best is trial 30 with value: 0.8300522862392109.[0m
[32m[I 2022-04-21 14:32:27,897][0m Trial 62 finished with value: 0.8299353823156457 and parameters: {'alpha': 1.4034770650468193, 'ties': 'breslow'}. Best is trial 30 with value: 0.8300522862392109.[0m
[32m[I 2022-04-21 14:32:36,760][0m Trial 63 finished with value: 0.8300194160386972 and parameters: {'alpha': 1.7836597507812295, 'ties': 'breslow'}. Best is trial 30 with value: 0.8300522862392109.[0m
[32m[I 2022-04-21 14:32:45,238][0m Trial 64 finished with value: 0.8299498919368042 and parameters: {'alpha': 2.130693322907598, 'ties': 'breslow'}. Best is trial 30 with value: 0.8300522862392109.[0m
