[32m[I 2022-04-21 15:32:14,702][0m Trial 492 finished with value: 0.8300008965675418 and parameters: {'alpha': 1.7267066550797996, 'ties': 'breslow'}. Best is trial 211 with value: 0.830053417686198.[0m
[32m[I 2022-04-21 15:32:23,232][0m Trial 493 finished with value: 0.8300352221963335 and parameters: {'alpha': 1.8558405919114, 'ties': 'breslow'}. Best is trial 211 with value: 0.830053417686198.[0m
[32m[I 2022-04-21 15:32:30,917][0m Trial 494 finished with value: 0.8300408934149287 and parameters: {'alpha': 1.9311884854624117, 'ties': 'breslow'}. Best is trial 211 with value: 0.830053417686198.[0m
[32m[I 2022-04-21 15:32:40,262][0m Trial 495 finished with value: 0.8299665730456134 and parameters: {'alpha': 2.032759097287996, 'ties': 'breslow'}. Best is trial 211 with value: 0.830053417686198.[0m
[32m[I 2022-04-21 15:32:48,279][0m Trial 496 finished with value: 0.829977874151497 and parameters: {'alpha': 1.6896791906313997, 'ties': 'breslow'}. Best is trial 211 with value: 0.830053417686198.[0m
[32m[I 2022-04-21 15:32:55,899][0m Trial 497 finished with value: 0.8300332670003927 and parameters: {'alpha': 1.8322783652378947, 'ties': 'breslow'}. Best is trial 211 with value: 0.830053417686198.[0m
[32m[I 2022-04-21 15:33:05,117][0m Trial 498 finished with value: 0.8300425220345801 and parameters: {'alpha': 1.9636260361839835, 'ties': 'breslow'}. Best is trial 211 with value: 0.830053417686198.[0m
[32m[I 2022-04-21 15:33:13,487][0m Trial 499 finished with value: 0.829951885727087 and parameters: {'alpha': 2.1125257867783596, 'ties': 'breslow'}. Best is trial 211 with value: 0.830053417686198.[0m
[32m[I 2022-04-21 15:33:22,210][0m Trial 500 finished with value: 0.8300398997883194 and parameters: {'alpha': 1.878804654972327, 'ties': 'breslow'}. Best is trial 211 with value: 0.830053417686198.[0m
[32m[I 2022-04-21 15:33:28,866][0m Trial 501 finished with value: 0.8300116454641652 and parameters: {'alpha': 1.770092731233057, 'ties': 'breslow'}. Best is trial 211 with value: 0.830053417686198.[0m
[32m[I 2022-04-21 15:33:36,741][0m Trial 502 finished with value: 0.8299390414574173 and parameters: {'alpha': 2.2352192544794227, 'ties': 'breslow'}. Best is trial 211 with value: 0.830053417686198.[0m
[32m[I 2022-04-21 15:33:42,563][0m Trial 503 finished with value: 0.8300504171685483 and parameters: {'alpha': 1.9742790522991351, 'ties': 'breslow'}. Best is trial 211 with value: 0.830053417686198.[0m
[32m[I 2022-04-21 15:33:52,638][0m Trial 504 finished with value: 0.8299653796299747 and parameters: {'alpha': 2.0318871470549658, 'ties': 'breslow'}. Best is trial 211 with value: 0.830053417686198.[0m
[32m[I 2022-04-21 15:34:01,872][0m Trial 505 finished with value: 0.8300439820814927 and parameters: {'alpha': 1.948131268691508, 'ties': 'breslow'}. Best is trial 211 with value: 0.830053417686198.[0m
[32m[I 2022-04-21 15:34:10,059][0m Trial 506 finished with value: 0.8299453751872404 and parameters: {'alpha': 2.0848403810701277, 'ties': 'breslow'}. Best is trial 211 with value: 0.830053417686198.[0m
[32m[I 2022-04-21 15:34:24,265][0m Trial 507 finished with value: 0.829928697678398 and parameters: {'alpha': 2.409487655706554, 'ties': 'efron'}. Best is trial 211 with value: 0.830053417686198.[0m
[32m[I 2022-04-21 15:34:32,796][0m Trial 508 finished with value: 0.8300332129171031 and parameters: {'alpha': 1.8302053320788505, 'ties': 'breslow'}. Best is trial 211 with value: 0.830053417686198.[0m
[32m[I 2022-04-21 15:34:41,015][0m Trial 509 finished with value: 0.8297389342746075 and parameters: {'alpha': 4.765485611289183, 'ties': 'breslow'}. Best is trial 211 with value: 0.830053417686198.[0m
[32m[I 2022-04-21 15:34:48,308][0m Trial 510 finished with value: 0.8299734777592451 and parameters: {'alpha': 1.6217947535096435, 'ties': 'breslow'}. Best is trial 211 with value: 0.830053417686198.[0m
[32m[I 2022-04-21 15:34:56,540][0m Trial 511 finished with value: 0.8299441272327381 and parameters: {'alpha': 2.159282766584474, 'ties': 'breslow'}. Best is trial 211 with value: 0.830053417686198.[0m
[32m[I 2022-04-21 15:35:03,065][0m Trial 512 finished with value: 0.8300442278436326 and parameters: {'alpha': 1.9642944124612685, 'ties': 'breslow'}. Best is trial 211 with value: 0.830053417686198.[0m
[32m[I 2022-04-21 15:35:11,346][0m Trial 513 finished with value: 0.8300355826234739 and parameters: {'alpha': 1.8719017509988671, 'ties': 'breslow'}. Best is trial 211 with value: 0.830053417686198.[0m
[32m[I 2022-04-21 15:35:20,215][0m Trial 514 finished with value: 0.8299991974534755 and parameters: {'alpha': 1.7316017608334198, 'ties': 'breslow'}. Best is trial 211 with value: 0.830053417686198.[0m
[32m[I 2022-04-21 15:35:27,177][0m Trial 515 finished with value: 0.8299675442814027 and parameters: {'alpha': 2.0332031206318613, 'ties': 'breslow'}. Best is trial 211 with value: 0.830053417686198.[0m
[32m[I 2022-04-21 15:35:33,815][0m Trial 516 finished with value: 0.8300498701774324 and parameters: {'alpha': 1.892224056378324, 'ties': 'breslow'}. Best is trial 211 with value: 0.830053417686198.[0m
[32m[I 2022-04-21 15:35:42,183][0m Trial 517 finished with value: 0.8300126815811613 and parameters: {'alpha': 1.7678297241684533, 'ties': 'breslow'}. Best is trial 211 with value: 0.830053417686198.[0m
[32m[I 2022-04-21 15:35:49,421][0m Trial 518 finished with value: 0.830043405239838 and parameters: {'alpha': 1.9647101459167189, 'ties': 'breslow'}. Best is trial 211 with value: 0.830053417686198.[0m
[32m[I 2022-04-21 15:35:56,718][0m Trial 519 finished with value: 0.8299463794907485 and parameters: {'alpha': 2.137649557559256, 'ties': 'breslow'}. Best is trial 211 with value: 0.830053417686198.[0m
[32m[I 2022-04-21 15:36:03,530][0m Trial 520 finished with value: 0.8300326544168779 and parameters: {'alpha': 1.8413674532564832, 'ties': 'breslow'}. Best is trial 211 with value: 0.830053417686198.[0m
[32m[I 2022-04-21 15:36:11,229][0m Trial 521 finished with value: 0.829981852642461 and parameters: {'alpha': 1.6662799768038496, 'ties': 'breslow'}. Best is trial 211 with value: 0.830053417686198.[0m
[32m[I 2022-04-21 15:36:17,779][0m Trial 522 finished with value: 0.8299847726221096 and parameters: {'alpha': 2.008359149672844, 'ties': 'breslow'}. Best is trial 211 with value: 0.830053417686198.[0m
[32m[I 2022-04-21 15:36:26,698][0m Trial 523 finished with value: 0.829938029238772 and parameters: {'alpha': 2.2428071146335955, 'ties': 'breslow'}. Best is trial 211 with value: 0.830053417686198.[0m
[32m[I 2022-04-21 15:36:34,284][0m Trial 524 finished with value: 0.8300405351902953 and parameters: {'alpha': 1.8761410092858517, 'ties': 'breslow'}. Best is trial 211 with value: 0.830053417686198.[0m
[32m[I 2022-04-21 15:36:42,557][0m Trial 525 finished with value: 0.8298843221939439 and parameters: {'alpha': 2.9509526001682316, 'ties': 'breslow'}. Best is trial 211 with value: 0.830053417686198.[0m
[32m[I 2022-04-21 15:36:51,917][0m Trial 526 finished with value: 0.8298754016674963 and parameters: {'alpha': 2.0824847222465817, 'ties': 'efron'}. Best is trial 211 with value: 0.830053417686198.[0m
[32m[I 2022-04-21 15:37:00,156][0m Trial 527 finished with value: 0.8299480557369698 and parameters: {'alpha': 1.56203746046409, 'ties': 'breslow'}. Best is trial 211 with value: 0.830053417686198.[0m
[32m[I 2022-04-21 15:37:08,345][0m Trial 528 finished with value: 0.8300140795758386 and parameters: {'alpha': 1.7621010214798978, 'ties': 'breslow'}. Best is trial 211 with value: 0.830053417686198.[0m
[32m[I 2022-04-21 15:37:16,040][0m Trial 529 finished with value: 0.8300457704930222 and parameters: {'alpha': 1.948939612074142, 'ties': 'breslow'}. Best is trial 211 with value: 0.830053417686198.[0m
[32m[I 2022-04-21 15:37:23,176][0m Trial 530 finished with value: 0.8300229803661328 and parameters: {'alpha': 1.816102763662009, 'ties': 'breslow'}. Best is trial 211 with value: 0.830053417686198.[0m
[32m[I 2022-04-21 15:37:30,068][0m Trial 531 finished with value: 0.8299881271371969 and parameters: {'alpha': 2.0137621057814767, 'ties': 'breslow'}. Best is trial 211 with value: 0.830053417686198.[0m
[32m[I 2022-04-21 15:37:40,483][0m Trial 532 finished with value: 0.8300497877073403 and parameters: {'alpha': 1.9096933753047476, 'ties': 'breslow'}. Best is trial 211 with value: 0.830053417686198.[0m
[32m[I 2022-04-21 15:37:47,747][0m Trial 533 finished with value: 0.8299445847175131 and parameters: {'alpha': 2.1581594899187704, 'ties': 'breslow'}. Best is trial 211 with value: 0.830053417686198.[0m
[32m[I 2022-04-21 15:37:53,094][0m Trial 534 finished with value: 0.8299799439480798 and parameters: {'alpha': 1.6879901360368623, 'ties': 'breslow'}. Best is trial 211 with value: 0.830053417686198.[0m
[32m[I 2022-04-21 15:38:01,701][0m Trial 535 finished with value: 0.8299582160789825 and parameters: {'alpha': 2.054288066840887, 'ties': 'breslow'}. Best is trial 211 with value: 0.830053417686198.[0m
[32m[I 2022-04-21 15:38:10,656][0m Trial 536 finished with value: 0.8300399584427597 and parameters: {'alpha': 1.927836673887988, 'ties': 'breslow'}. Best is trial 211 with value: 0.830053417686198.[0m
[32m[I 2022-04-21 15:38:16,553][0m Trial 537 finished with value: 0.8300086519900549 and parameters: {'alpha': 1.7871062734470171, 'ties': 'breslow'}. Best is trial 211 with value: 0.830053417686198.[0m
[32m[I 2022-04-21 15:38:23,372][0m Trial 538 finished with value: 0.83004697160252 and parameters: {'alpha': 1.9708920796600382, 'ties': 'breslow'}. Best is trial 211 with value: 0.830053417686198.[0m
[32m[I 2022-04-21 15:38:31,547][0m Trial 539 finished with value: 0.83003232400392 and parameters: {'alpha': 1.8569469715555948, 'ties': 'breslow'}. Best is trial 211 with value: 0.830053417686198.[0m
[32m[I 2022-04-21 15:38:40,499][0m Trial 540 finished with value: 0.8299433769130502 and parameters: {'alpha': 2.0879386761201144, 'ties': 'breslow'}. Best is trial 211 with value: 0.830053417686198.[0m
[32m[I 2022-04-21 15:38:47,538][0m Trial 541 finished with value: 0.8299990175368336 and parameters: {'alpha': 1.7243699559101198, 'ties': 'breslow'}. Best is trial 211 with value: 0.830053417686198.[0m
[32m[I 2022-04-21 15:38:54,567][0m Trial 542 finished with value: 0.8300512996718004 and parameters: {'alpha': 1.9033207391805098, 'ties': 'breslow'}. Best is trial 211 with value: 0.830053417686198.[0m
[32m[I 2022-04-21 15:38:59,596][0m Trial 543 finished with value: 0.829972616772887 and parameters: {'alpha': 1.6445890860429826, 'ties': 'breslow'}. Best is trial 211 with value: 0.830053417686198.[0m
[32m[I 2022-04-21 15:39:06,394][0m Trial 544 finished with value: 0.8298511743430511 and parameters: {'alpha': 4.096919345140572, 'ties': 'breslow'}. Best is trial 211 with value: 0.830053417686198.[0m
[32m[I 2022-04-21 15:39:19,360][0m Trial 545 finished with value: 0.8298513754884984 and parameters: {'alpha': 3.413118975113851, 'ties': 'efron'}. Best is trial 211 with value: 0.830053417686198.[0m
[32m[I 2022-04-21 15:39:26,766][0m Trial 546 finished with value: 0.8300315189018267 and parameters: {'alpha': 1.8253259690045232, 'ties': 'breslow'}. Best is trial 211 with value: 0.830053417686198.[0m
[32m[I 2022-04-21 15:39:33,267][0m Trial 547 finished with value: 0.8300504670587193 and parameters: {'alpha': 1.8990159082052342, 'ties': 'breslow'}. Best is trial 211 with value: 0.830053417686198.[0m
[32m[I 2022-04-21 15:39:41,547][0m Trial 548 finished with value: 0.8299980079438353 and parameters: {'alpha': 1.7388686503429858, 'ties': 'breslow'}. Best is trial 211 with value: 0.830053417686198.[0m
[32m[I 2022-04-21 15:39:49,842][0m Trial 549 finished with value: 0.8300484119328516 and parameters: {'alpha': 1.8877881243231225, 'ties': 'breslow'}. Best is trial 211 with value: 0.830053417686198.[0m
[32m[I 2022-04-21 15:39:56,849][0m Trial 550 finished with value: 0.829957870217602 and parameters: {'alpha': 1.59029079216501, 'ties': 'breslow'}. Best is trial 211 with value: 0.830053417686198.[0m
[32m[I 2022-04-21 15:40:06,066][0m Trial 551 finished with value: 0.8300254777756303 and parameters: {'alpha': 1.8207745668205975, 'ties': 'breslow'}. Best is trial 211 with value: 0.830053417686198.[0m
[32m[I 2022-04-21 15:40:17,719][0m Trial 552 finished with value: 0.8300506506005053 and parameters: {'alpha': 1.8980641492036001, 'ties': 'breslow'}. Best is trial 211 with value: 0.830053417686198.[0m
[32m[I 2022-04-21 15:40:28,154][0m Trial 553 finished with value: 0.8298196820056443 and parameters: {'alpha': 4.3288833652510625, 'ties': 'breslow'}. Best is trial 211 with value: 0.830053417686198.[0m
[32m[I 2022-04-21 15:40:35,658][0m Trial 554 finished with value: 0.8300103283350481 and parameters: {'alpha': 1.7434677542636834, 'ties': 'breslow'}. Best is trial 211 with value: 0.830053417686198.[0m
[32m[I 2022-04-21 15:40:43,628][0m Trial 555 finished with value: 0.830048958231693 and parameters: {'alpha': 1.8887748584062567, 'ties': 'breslow'}. Best is trial 211 with value: 0.830053417686198.[0m
[32m[I 2022-04-21 15:40:51,868][0m Trial 556 finished with value: 0.829963027721373 and parameters: {'alpha': 2.041232370199702, 'ties': 'breslow'}. Best is trial 211 with value: 0.830053417686198.[0m
[32m[I 2022-04-21 15:41:06,120][0m Trial 557 finished with value: 0.8300491598233194 and parameters: {'alpha': 1.9408798057018362, 'ties': 'breslow'}. Best is trial 211 with value: 0.830053417686198.[0m
[32m[I 2022-04-21 15:41:15,982][0m Trial 558 finished with value: 0.8299490691374161 and parameters: {'alpha': 1.5165844139074367, 'ties': 'breslow'}. Best is trial 211 with value: 0.830053417686198.[0m
[32m[I 2022-04-21 15:41:24,572][0m Trial 559 finished with value: 0.8300172398147911 and parameters: {'alpha': 1.80631710968401, 'ties': 'breslow'}. Best is trial 211 with value: 0.830053417686198.[0m
[32m[I 2022-04-21 15:41:32,839][0m Trial 560 finished with value: 0.8299815955288743 and parameters: {'alpha': 1.6644548470761555, 'ties': 'breslow'}. Best is trial 211 with value: 0.830053417686198.[0m
[32m[I 2022-04-21 15:41:44,437][0m Trial 561 finished with value: 0.8299400961482333 and parameters: {'alpha': 2.206705676034075, 'ties': 'breslow'}. Best is trial 211 with value: 0.830053417686198.[0m
[32m[I 2022-04-21 15:41:51,836][0m Trial 562 finished with value: 0.8299661722073001 and parameters: {'alpha': 2.0336301558324767, 'ties': 'breslow'}. Best is trial 211 with value: 0.830053417686198.[0m
[32m[I 2022-04-21 15:41:59,145][0m Trial 563 finished with value: 0.8300357131875774 and parameters: {'alpha': 1.8671572467039024, 'ties': 'breslow'}. Best is trial 211 with value: 0.830053417686198.[0m
[32m[I 2022-04-21 15:42:08,244][0m Trial 564 finished with value: 0.8299566880043333 and parameters: {'alpha': 2.1199254121109714, 'ties': 'breslow'}. Best is trial 211 with value: 0.830053417686198.[0m
[32m[I 2022-04-21 15:42:16,405][0m Trial 565 finished with value: 0.8300432023920816 and parameters: {'alpha': 1.9584454561217026, 'ties': 'breslow'}. Best is trial 211 with value: 0.830053417686198.[0m
[32m[I 2022-04-21 15:42:26,667][0m Trial 566 finished with value: 0.8297932326448839 and parameters: {'alpha': 1.8093426010689937, 'ties': 'efron'}. Best is trial 211 with value: 0.830053417686198.[0m
[32m[I 2022-04-21 15:42:34,849][0m Trial 567 finished with value: 0.8299138260073201 and parameters: {'alpha': 2.6589313983383134, 'ties': 'breslow'}. Best is trial 211 with value: 0.830053417686198.[0m
[32m[I 2022-04-21 15:42:43,833][0m Trial 568 finished with value: 0.8299983885080928 and parameters: {'alpha': 1.7342281687977164, 'ties': 'breslow'}. Best is trial 211 with value: 0.830053417686198.[0m
[32m[I 2022-04-21 15:42:51,265][0m Trial 569 finished with value: 0.8299264492082308 and parameters: {'alpha': 2.3540723194719892, 'ties': 'breslow'}. Best is trial 211 with value: 0.830053417686198.[0m
[32m[I 2022-04-21 15:42:57,737][0m Trial 570 finished with value: 0.830050874267686 and parameters: {'alpha': 1.913154421505682, 'ties': 'breslow'}. Best is trial 211 with value: 0.830053417686198.[0m
[32m[I 2022-04-21 15:43:07,114][0m Trial 571 finished with value: 0.8299708898674911 and parameters: {'alpha': 2.0460426125943876, 'ties': 'breslow'}. Best is trial 211 with value: 0.830053417686198.[0m
[32m[I 2022-04-21 15:43:13,332][0m Trial 572 finished with value: 0.8300451106582285 and parameters: {'alpha': 1.9686716198437628, 'ties': 'breslow'}. Best is trial 211 with value: 0.830053417686198.[0m
[32m[I 2022-04-21 15:43:19,145][0m Trial 573 finished with value: 0.829941716556057 and parameters: {'alpha': 2.1483340251396124, 'ties': 'breslow'}. Best is trial 211 with value: 0.830053417686198.[0m
[32m[I 2022-04-21 15:43:27,137][0m Trial 574 finished with value: 0.8300328583420988 and parameters: {'alpha': 1.8357526738302348, 'ties': 'breslow'}. Best is trial 211 with value: 0.830053417686198.[0m
[32m[I 2022-04-21 15:43:34,105][0m Trial 575 finished with value: 0.8300474055845996 and parameters: {'alpha': 1.9809215521892807, 'ties': 'breslow'}. Best is trial 211 with value: 0.830053417686198.[0m
[32m[I 2022-04-21 15:43:39,278][0m Trial 576 finished with value: 0.8298600066793815 and parameters: {'alpha': 0.9581052220896895, 'ties': 'breslow'}. Best is trial 211 with value: 0.830053417686198.[0m
[32m[I 2022-04-21 15:43:46,403][0m Trial 577 finished with value: 0.8299861645670019 and parameters: {'alpha': 1.6976899270340546, 'ties': 'breslow'}. Best is trial 211 with value: 0.830053417686198.[0m
[32m[I 2022-04-21 15:43:54,526][0m Trial 578 finished with value: 0.8300515151185672 and parameters: {'alpha': 1.8955409336175217, 'ties': 'breslow'}. Best is trial 211 with value: 0.830053417686198.[0m
[32m[I 2022-04-21 15:44:00,905][0m Trial 579 finished with value: 0.8299743487053786 and parameters: {'alpha': 1.611763520698793, 'ties': 'breslow'}. Best is trial 211 with value: 0.830053417686198.[0m
[32m[I 2022-04-21 15:44:06,443][0m Trial 580 finished with value: 0.8300107776752046 and parameters: {'alpha': 1.7765335147477357, 'ties': 'breslow'}. Best is trial 211 with value: 0.830053417686198.[0m
[32m[I 2022-04-21 15:44:15,383][0m Trial 581 finished with value: 0.830039047603468 and parameters: {'alpha': 1.8785625746502763, 'ties': 'breslow'}. Best is trial 211 with value: 0.830053417686198.[0m
[32m[I 2022-04-21 15:44:22,841][0m Trial 582 finished with value: 0.8299609537565017 and parameters: {'alpha': 2.0491301205906374, 'ties': 'breslow'}. Best is trial 211 with value: 0.830053417686198.[0m
[32m[I 2022-04-21 15:44:31,437][0m Trial 583 finished with value: 0.8300117603903974 and parameters: {'alpha': 1.7661323728150067, 'ties': 'breslow'}. Best is trial 211 with value: 0.830053417686198.[0m
[32m[I 2022-04-21 15:44:39,379][0m Trial 584 finished with value: 0.8296276896263226 and parameters: {'alpha': 0.4640331520557326, 'ties': 'breslow'}. Best is trial 211 with value: 0.830053417686198.[0m
[32m[I 2022-04-21 15:44:51,490][0m Trial 585 finished with value: 0.8298352250096652 and parameters: {'alpha': 1.9020907058404237, 'ties': 'efron'}. Best is trial 211 with value: 0.830053417686198.[0m
[32m[I 2022-04-21 15:44:59,451][0m Trial 586 finished with value: 0.8299315357369468 and parameters: {'alpha': 2.2587370592359433, 'ties': 'breslow'}. Best is trial 211 with value: 0.830053417686198.[0m
[32m[I 2022-04-21 15:45:08,381][0m Trial 587 finished with value: 0.82994699660641 and parameters: {'alpha': 2.102003774011941, 'ties': 'breslow'}. Best is trial 211 with value: 0.830053417686198.[0m
[32m[I 2022-04-21 15:45:17,440][0m Trial 588 finished with value: 0.8299469709868926 and parameters: {'alpha': 1.3759151815845327, 'ties': 'breslow'}. Best is trial 211 with value: 0.830053417686198.[0m
[32m[I 2022-04-21 15:45:25,561][0m Trial 589 finished with value: 0.8299839248143996 and parameters: {'alpha': 1.6745688609531315, 'ties': 'breslow'}. Best is trial 211 with value: 0.830053417686198.[0m
[32m[I 2022-04-21 15:45:35,246][0m Trial 590 finished with value: 0.8300329367286772 and parameters: {'alpha': 1.8291205107233757, 'ties': 'breslow'}. Best is trial 211 with value: 0.830053417686198.[0m
[32m[I 2022-04-21 15:45:43,245][0m Trial 591 finished with value: 0.8300461923172369 and parameters: {'alpha': 1.9850518621982076, 'ties': 'breslow'}. Best is trial 211 with value: 0.830053417686198.[0m
[32m[I 2022-04-21 15:45:49,037][0m Trial 592 finished with value: 0.8300505528563262 and parameters: {'alpha': 1.8942821809202264, 'ties': 'breslow'}. Best is trial 211 with value: 0.830053417686198.[0m
[32m[I 2022-04-21 15:45:57,300][0m Trial 593 finished with value: 0.8300502157255807 and parameters: {'alpha': 1.8952755043923726, 'ties': 'breslow'}. Best is trial 211 with value: 0.830053417686198.[0m
[32m[I 2022-04-21 15:46:05,902][0m Trial 594 finished with value: 0.8300122214312102 and parameters: {'alpha': 1.7736452756665342, 'ties': 'breslow'}. Best is trial 211 with value: 0.830053417686198.[0m
[32m[I 2022-04-21 15:46:15,477][0m Trial 595 finished with value: 0.8299859240947238 and parameters: {'alpha': 2.0276764720714984, 'ties': 'breslow'}. Best is trial 211 with value: 0.830053417686198.[0m
[32m[I 2022-04-21 15:46:23,457][0m Trial 596 finished with value: 0.8299578160804796 and parameters: {'alpha': 1.5896782530385127, 'ties': 'breslow'}. Best is trial 211 with value: 0.830053417686198.[0m
[32m[I 2022-04-21 15:46:30,948][0m Trial 597 finished with value: 0.829944148760046 and parameters: {'alpha': 2.155326295978116, 'ties': 'breslow'}. Best is trial 211 with value: 0.830053417686198.[0m
[32m[I 2022-04-21 15:46:39,621][0m Trial 598 finished with value: 0.8300439076780709 and parameters: {'alpha': 1.9193728028048873, 'ties': 'breslow'}. Best is trial 211 with value: 0.830053417686198.[0m
