[32m[I 2022-04-24 02:02:25,067][0m Trial 620 finished with value: 0.9263106612648373 and parameters: {'n_hidden': 1024, 'mixture_components': 5, 'use_sparse_layer': False, 'use_batchnorm': False, 'use_dropout': False, 'mlp_size_1': 6, 'mlp_size_2': 1, 'mlp_size_3': 0, 'kernel': 'Normal', 'loss_name': 'AlternativeNLLLoss'}. Best is trial 477 with value: 0.9281730871914304.[0m
[32m[I 2022-04-24 02:07:01,353][0m Trial 621 finished with value: 0.9254575045528519 and parameters: {'n_hidden': 1024, 'mixture_components': 6, 'use_sparse_layer': False, 'use_batchnorm': False, 'use_dropout': False, 'mlp_size_1': 6, 'mlp_size_2': 1, 'mlp_size_3': 0, 'kernel': 'Logistic', 'loss_name': 'CensoredNLLLoss'}. Best is trial 477 with value: 0.9281730871914304.[0m
[32m[I 2022-04-24 02:12:35,857][0m Trial 622 finished with value: 0.9258707700392879 and parameters: {'n_hidden': 1024, 'mixture_components': 5, 'use_sparse_layer': False, 'use_batchnorm': False, 'use_dropout': False, 'mlp_size_1': 6, 'mlp_size_2': 1, 'mlp_size_3': 0, 'kernel': 'Normal', 'loss_name': 'AlternativeNLLLoss'}. Best is trial 477 with value: 0.9281730871914304.[0m
[32m[I 2022-04-24 02:15:49,859][0m Trial 623 finished with value: 0.8162066029043853 and parameters: {'n_hidden': 512, 'mixture_components': 6, 'use_sparse_layer': False, 'use_batchnorm': False, 'use_dropout': False, 'mlp_size_1': 6, 'mlp_size_2': 0, 'mlp_size_3': 0, 'kernel': 'Normal', 'loss_name': 'NLLLoss'}. Best is trial 477 with value: 0.9281730871914304.[0m
[32m[I 2022-04-24 02:21:22,835][0m Trial 624 finished with value: 0.9259471097151912 and parameters: {'n_hidden': 1024, 'mixture_components': 5, 'use_sparse_layer': False, 'use_batchnorm': False, 'use_dropout': False, 'mlp_size_1': 6, 'mlp_size_2': 1, 'mlp_size_3': 0, 'kernel': 'Normal', 'loss_name': 'AlternativeNLLLoss'}. Best is trial 477 with value: 0.9281730871914304.[0m
[32m[I 2022-04-24 02:26:55,147][0m Trial 625 finished with value: 0.926543897869991 and parameters: {'n_hidden': 1024, 'mixture_components': 6, 'use_sparse_layer': False, 'use_batchnorm': False, 'use_dropout': False, 'mlp_size_1': 6, 'mlp_size_2': 1, 'mlp_size_3': 0, 'kernel': 'Normal', 'loss_name': 'CensoredNLLLoss'}. Best is trial 477 with value: 0.9281730871914304.[0m
[32m[I 2022-04-24 02:34:11,511][0m Trial 626 finished with value: 0.9229673033997383 and parameters: {'n_hidden': 32, 'mixture_components': 5, 'use_sparse_layer': False, 'use_batchnorm': False, 'use_dropout': False, 'mlp_size_1': 2, 'mlp_size_2': 0, 'mlp_size_3': 0, 'kernel': 'Normal', 'loss_name': 'AlternativeNLLLoss'}. Best is trial 477 with value: 0.9281730871914304.[0m
[32m[I 2022-04-24 02:39:24,563][0m Trial 627 finished with value: 0.9269089055094426 and parameters: {'n_hidden': 1024, 'mixture_components': 5, 'use_sparse_layer': False, 'use_batchnorm': False, 'use_dropout': False, 'mlp_size_1': 6, 'mlp_size_2': 1, 'mlp_size_3': 0, 'kernel': 'Normal', 'loss_name': 'AlternativeNLLLoss'}. Best is trial 477 with value: 0.9281730871914304.[0m
[32m[I 2022-04-24 02:44:25,593][0m Trial 628 finished with value: 0.918997054821444 and parameters: {'n_hidden': 1024, 'mixture_components': 7, 'use_sparse_layer': False, 'use_batchnorm': False, 'use_dropout': False, 'mlp_size_1': 6, 'mlp_size_2': 1, 'mlp_size_3': 0, 'kernel': 'Normal', 'loss_name': 'AlternativeNLLLoss'}. Best is trial 477 with value: 0.9281730871914304.[0m
[32m[I 2022-04-24 02:49:28,613][0m Trial 629 finished with value: 0.9262484375200601 and parameters: {'n_hidden': 1024, 'mixture_components': 6, 'use_sparse_layer': False, 'use_batchnorm': False, 'use_dropout': False, 'mlp_size_1': 6, 'mlp_size_2': 1, 'mlp_size_3': 0, 'kernel': 'Normal', 'loss_name': 'CensoredNLLLoss'}. Best is trial 477 with value: 0.9281730871914304.[0m
[32m[I 2022-04-24 02:54:40,657][0m Trial 630 finished with value: 0.9261953119772178 and parameters: {'n_hidden': 1024, 'mixture_components': 5, 'use_sparse_layer': False, 'use_batchnorm': False, 'use_dropout': False, 'mlp_size_1': 6, 'mlp_size_2': 1, 'mlp_size_3': 0, 'kernel': 'Normal', 'loss_name': 'AlternativeNLLLoss'}. Best is trial 477 with value: 0.9281730871914304.[0m
[32m[I 2022-04-24 03:00:14,938][0m Trial 631 finished with value: 0.9259882382539301 and parameters: {'n_hidden': 128, 'mixture_components': 6, 'use_sparse_layer': False, 'use_batchnorm': False, 'use_dropout': False, 'mlp_size_1': 4, 'mlp_size_2': 0, 'mlp_size_3': 0, 'kernel': 'Normal', 'loss_name': 'AlternativeNLLLoss'}. Best is trial 477 with value: 0.9281730871914304.[0m
[32m[I 2022-04-24 03:04:43,278][0m Trial 632 finished with value: 0.9259519948836153 and parameters: {'n_hidden': 1024, 'mixture_components': 6, 'use_sparse_layer': False, 'use_batchnorm': False, 'use_dropout': False, 'mlp_size_1': 6, 'mlp_size_2': 1, 'mlp_size_3': 0, 'kernel': 'LogLogistic', 'loss_name': 'CensoredNLLLoss'}. Best is trial 477 with value: 0.9281730871914304.[0m
[32m[I 2022-04-24 03:06:56,495][0m Trial 633 finished with value: -0.5 and parameters: {'n_hidden': 1024, 'mixture_components': 5, 'use_sparse_layer': False, 'use_batchnorm': False, 'use_dropout': False, 'mlp_size_1': 6, 'mlp_size_2': 1, 'mlp_size_3': 0, 'kernel': 'Exponential', 'loss_name': 'AlternativeNLLLoss'}. Best is trial 477 with value: 0.9281730871914304.[0m
[32m[I 2022-04-24 03:11:17,139][0m Trial 634 finished with value: 0.9203255098385504 and parameters: {'n_hidden': 1024, 'mixture_components': 5, 'use_sparse_layer': False, 'use_batchnorm': False, 'use_dropout': False, 'mlp_size_1': 6, 'mlp_size_2': 1, 'mlp_size_3': 0, 'kernel': 'Normal', 'loss_name': 'AlternativeNLLLoss'}. Best is trial 477 with value: 0.9281730871914304.[0m
[32m[I 2022-04-24 03:16:11,990][0m Trial 635 finished with value: 0.4180074863695883 and parameters: {'n_hidden': 1024, 'mixture_components': 6, 'use_sparse_layer': False, 'use_batchnorm': False, 'use_dropout': True, 'dropout': 0.43969227950832407, 'mlp_size_1': 6, 'mlp_size_2': 1, 'mlp_size_3': 0, 'kernel': 'Normal', 'loss_name': 'CensoredNLLLoss'}. Best is trial 477 with value: 0.9281730871914304.[0m
[32m[I 2022-04-24 03:22:30,703][0m Trial 636 finished with value: 0.71849476242826 and parameters: {'n_hidden': 64, 'mixture_components': 5, 'use_sparse_layer': False, 'use_batchnorm': True, 'use_dropout': False, 'mlp_size_1': 3, 'mlp_size_2': 0, 'mlp_size_3': 0, 'kernel': 'Normal', 'loss_name': 'AlternativeNLLLoss'}. Best is trial 477 with value: 0.9281730871914304.[0m
[32m[I 2022-04-24 03:27:54,229][0m Trial 637 finished with value: 0.9268073210053289 and parameters: {'n_hidden': 1024, 'mixture_components': 6, 'use_sparse_layer': False, 'use_batchnorm': False, 'use_dropout': False, 'mlp_size_1': 6, 'mlp_size_2': 1, 'mlp_size_3': 0, 'kernel': 'Normal', 'loss_name': 'AlternativeNLLLoss'}. Best is trial 477 with value: 0.9281730871914304.[0m
[32m[I 2022-04-24 03:32:19,426][0m Trial 638 finished with value: 0.8970474820372651 and parameters: {'n_hidden': 1024, 'mixture_components': 5, 'use_sparse_layer': True, 'use_sparse_loss': False, 'use_batchnorm': False, 'use_dropout': False, 'mlp_size_1': 6, 'mlp_size_2': 1, 'mlp_size_3': 0, 'kernel': 'Normal', 'loss_name': 'AlternativeNLLLoss'}. Best is trial 477 with value: 0.9281730871914304.[0m
[32m[I 2022-04-24 03:36:46,845][0m Trial 639 finished with value: 0.9252091204722037 and parameters: {'n_hidden': 256, 'mixture_components': 7, 'use_sparse_layer': False, 'use_batchnorm': False, 'use_dropout': False, 'mlp_size_1': 5, 'mlp_size_2': 0, 'mlp_size_3': 0, 'kernel': 'Normal', 'loss_name': 'CensoredNLLLoss'}. Best is trial 477 with value: 0.9281730871914304.[0m
[32m[I 2022-04-24 03:41:29,593][0m Trial 640 finished with value: 0.8126062221579724 and parameters: {'n_hidden': 1024, 'mixture_components': 5, 'use_sparse_layer': False, 'use_batchnorm': False, 'use_dropout': False, 'mlp_size_1': 6, 'mlp_size_2': 1, 'mlp_size_3': 0, 'kernel': 'Normal', 'loss_name': 'AlternativeNLLLoss'}. Best is trial 477 with value: 0.9281730871914304.[0m
[32m[I 2022-04-24 03:46:23,405][0m Trial 641 finished with value: 0.9271427090170647 and parameters: {'n_hidden': 1024, 'mixture_components': 6, 'use_sparse_layer': False, 'use_batchnorm': False, 'use_dropout': False, 'mlp_size_1': 6, 'mlp_size_2': 1, 'mlp_size_3': 0, 'kernel': 'Normal', 'loss_name': 'AlternativeNLLLoss'}. Best is trial 477 with value: 0.9281730871914304.[0m
[32m[I 2022-04-24 03:51:21,551][0m Trial 642 finished with value: 0.9266876857883746 and parameters: {'n_hidden': 1024, 'mixture_components': 3, 'use_sparse_layer': False, 'use_batchnorm': False, 'use_dropout': False, 'mlp_size_1': 6, 'mlp_size_2': 1, 'mlp_size_3': 0, 'kernel': 'Normal', 'loss_name': 'CensoredNLLLoss'}. Best is trial 477 with value: 0.9281730871914304.[0m
[32m[I 2022-04-24 03:56:16,649][0m Trial 643 finished with value: 0.9262807094866383 and parameters: {'n_hidden': 1024, 'mixture_components': 5, 'use_sparse_layer': False, 'use_batchnorm': False, 'use_dropout': False, 'mlp_size_1': 6, 'mlp_size_2': 1, 'mlp_size_3': 0, 'kernel': 'Normal', 'loss_name': 'AlternativeNLLLoss'}. Best is trial 477 with value: 0.9281730871914304.[0m
[32m[I 2022-04-24 04:01:43,227][0m Trial 644 finished with value: 0.92629536488098 and parameters: {'n_hidden': 2048, 'mixture_components': 6, 'use_sparse_layer': False, 'use_batchnorm': False, 'use_dropout': False, 'mlp_size_1': 5, 'mlp_size_2': 2, 'mlp_size_3': 0, 'kernel': 'Normal', 'loss_name': 'AlternativeNLLLoss'}. Best is trial 477 with value: 0.9281730871914304.[0m
[32m[I 2022-04-24 04:05:59,600][0m Trial 645 finished with value: 0.9266175575932156 and parameters: {'n_hidden': 1024, 'mixture_components': 5, 'use_sparse_layer': False, 'use_batchnorm': False, 'use_dropout': False, 'mlp_size_1': 6, 'mlp_size_2': 1, 'mlp_size_3': 0, 'kernel': 'Logistic', 'loss_name': 'CensoredNLLLoss'}. Best is trial 477 with value: 0.9281730871914304.[0m
[32m[I 2022-04-24 04:09:56,441][0m Trial 646 finished with value: 0.9149009218709112 and parameters: {'n_hidden': 1024, 'mixture_components': 6, 'use_sparse_layer': False, 'use_batchnorm': False, 'use_dropout': False, 'mlp_size_1': 6, 'mlp_size_2': 1, 'mlp_size_3': 0, 'kernel': 'Normal', 'loss_name': 'NLLLoss'}. Best is trial 477 with value: 0.9281730871914304.[0m
[32m[I 2022-04-24 04:15:20,175][0m Trial 647 finished with value: 0.9282546649369519 and parameters: {'n_hidden': 1024, 'mixture_components': 5, 'use_sparse_layer': False, 'use_batchnorm': False, 'use_dropout': False, 'mlp_size_1': 6, 'mlp_size_2': 1, 'mlp_size_3': 0, 'kernel': 'Normal', 'loss_name': 'AlternativeNLLLoss'}. Best is trial 647 with value: 0.9282546649369519.[0m
[32m[I 2022-04-24 04:19:39,778][0m Trial 648 finished with value: 0.7198573526851376 and parameters: {'n_hidden': 1024, 'mixture_components': 5, 'use_sparse_layer': False, 'use_batchnorm': False, 'use_dropout': False, 'mlp_size_1': 0, 'mlp_size_2': 3, 'mlp_size_3': 4, 'kernel': 'Normal', 'loss_name': 'AlternativeNLLLoss'}. Best is trial 647 with value: 0.9282546649369519.[0m
[32m[I 2022-04-24 04:24:54,644][0m Trial 649 finished with value: 0.9259497126167326 and parameters: {'n_hidden': 1024, 'mixture_components': 5, 'use_sparse_layer': False, 'use_batchnorm': False, 'use_dropout': False, 'mlp_size_1': 6, 'mlp_size_2': 1, 'mlp_size_3': 0, 'kernel': 'Normal', 'loss_name': 'AlternativeNLLLoss'}. Best is trial 647 with value: 0.9282546649369519.[0m
[32m[I 2022-04-24 04:29:52,519][0m Trial 650 finished with value: 0.9260770947216592 and parameters: {'n_hidden': 1024, 'mixture_components': 5, 'use_sparse_layer': False, 'use_batchnorm': False, 'use_dropout': False, 'mlp_size_1': 6, 'mlp_size_2': 1, 'mlp_size_3': 0, 'kernel': 'Normal', 'loss_name': 'CensoredNLLLoss'}. Best is trial 647 with value: 0.9282546649369519.[0m
[32m[I 2022-04-24 04:34:45,612][0m Trial 651 finished with value: 0.9274997933263827 and parameters: {'n_hidden': 1024, 'mixture_components': 5, 'use_sparse_layer': False, 'use_batchnorm': False, 'use_dropout': False, 'mlp_size_1': 6, 'mlp_size_2': 1, 'mlp_size_3': 0, 'kernel': 'Normal', 'loss_name': 'AlternativeNLLLoss'}. Best is trial 647 with value: 0.9282546649369519.[0m
[32m[I 2022-04-24 04:39:38,683][0m Trial 652 finished with value: 0.9256989969015279 and parameters: {'n_hidden': 1024, 'mixture_components': 2, 'use_sparse_layer': False, 'use_batchnorm': False, 'use_dropout': False, 'mlp_size_1': 6, 'mlp_size_2': 1, 'mlp_size_3': 0, 'kernel': 'Normal', 'loss_name': 'AlternativeNLLLoss'}. Best is trial 647 with value: 0.9282546649369519.[0m
[32m[I 2022-04-24 04:44:21,705][0m Trial 653 finished with value: 0.925765355413731 and parameters: {'n_hidden': 1024, 'mixture_components': 5, 'use_sparse_layer': False, 'use_batchnorm': False, 'use_dropout': False, 'mlp_size_1': 6, 'mlp_size_2': 1, 'mlp_size_3': 0, 'kernel': 'Normal', 'loss_name': 'AlternativeNLLLoss'}. Best is trial 647 with value: 0.9282546649369519.[0m
[32m[I 2022-04-24 04:51:18,789][0m Trial 654 finished with value: 0.9234007594243654 and parameters: {'n_hidden': 32, 'mixture_components': 5, 'use_sparse_layer': False, 'use_batchnorm': False, 'use_dropout': False, 'mlp_size_1': 2, 'mlp_size_2': 0, 'mlp_size_3': 0, 'kernel': 'Normal', 'loss_name': 'CensoredNLLLoss'}. Best is trial 647 with value: 0.9282546649369519.[0m
[32m[I 2022-04-24 04:54:33,463][0m Trial 655 finished with value: 0.788042623896836 and parameters: {'n_hidden': 512, 'mixture_components': 5, 'use_sparse_layer': False, 'use_batchnorm': False, 'use_dropout': False, 'mlp_size_1': 6, 'mlp_size_2': 0, 'mlp_size_3': 0, 'kernel': 'LogLogistic', 'loss_name': 'AlternativeNLLLoss'}. Best is trial 647 with value: 0.9282546649369519.[0m
[32m[I 2022-04-24 05:02:12,612][0m Trial 656 finished with value: 0.8227935333206812 and parameters: {'n_hidden': 1024, 'mixture_components': 5, 'use_sparse_layer': False, 'use_batchnorm': True, 'use_dropout': True, 'dropout': 0.2695392784453434, 'mlp_size_1': 6, 'mlp_size_2': 1, 'mlp_size_3': 0, 'kernel': 'Normal', 'loss_name': 'AlternativeNLLLoss'}. Best is trial 647 with value: 0.9282546649369519.[0m
[32m[I 2022-04-24 05:04:23,982][0m Trial 657 finished with value: -0.5 and parameters: {'n_hidden': 1024, 'mixture_components': 5, 'use_sparse_layer': False, 'use_batchnorm': False, 'use_dropout': False, 'mlp_size_1': 6, 'mlp_size_2': 1, 'mlp_size_3': 0, 'kernel': 'Exponential', 'loss_name': 'CensoredNLLLoss'}. Best is trial 647 with value: 0.9282546649369519.[0m
[32m[I 2022-04-24 05:09:34,243][0m Trial 658 finished with value: 0.8208482323594406 and parameters: {'n_hidden': 1024, 'mixture_components': 5, 'use_sparse_layer': True, 'use_sparse_loss': True, 'lmbd': 0.00024145960335812707, 'use_batchnorm': False, 'use_dropout': False, 'mlp_size_1': 6, 'mlp_size_2': 1, 'mlp_size_3': 0, 'kernel': 'Normal', 'loss_name': 'AlternativeNLLLoss'}. Best is trial 647 with value: 0.9282546649369519.[0m
[32m[I 2022-04-24 05:14:28,985][0m Trial 659 finished with value: 0.9243736027998741 and parameters: {'n_hidden': 128, 'mixture_components': 5, 'use_sparse_layer': False, 'use_batchnorm': False, 'use_dropout': False, 'mlp_size_1': 4, 'mlp_size_2': 0, 'mlp_size_3': 0, 'kernel': 'Normal', 'loss_name': 'AlternativeNLLLoss'}. Best is trial 647 with value: 0.9282546649369519.[0m
[32m[I 2022-04-24 05:19:26,709][0m Trial 660 finished with value: 0.9263988909479336 and parameters: {'n_hidden': 1024, 'mixture_components': 5, 'use_sparse_layer': False, 'use_batchnorm': False, 'use_dropout': False, 'mlp_size_1': 6, 'mlp_size_2': 1, 'mlp_size_3': 0, 'kernel': 'Normal', 'loss_name': 'CensoredNLLLoss'}. Best is trial 647 with value: 0.9282546649369519.[0m
[32m[I 2022-04-24 05:24:12,375][0m Trial 661 finished with value: 0.9267843135154947 and parameters: {'n_hidden': 1024, 'mixture_components': 5, 'use_sparse_layer': False, 'use_batchnorm': False, 'use_dropout': False, 'mlp_size_1': 6, 'mlp_size_2': 1, 'mlp_size_3': 0, 'kernel': 'Normal', 'loss_name': 'AlternativeNLLLoss'}. Best is trial 647 with value: 0.9282546649369519.[0m
[32m[I 2022-04-24 05:29:18,707][0m Trial 662 finished with value: 0.9233031661635248 and parameters: {'n_hidden': 1024, 'mixture_components': 3, 'use_sparse_layer': False, 'use_batchnorm': False, 'use_dropout': False, 'mlp_size_1': 6, 'mlp_size_2': 1, 'mlp_size_3': 0, 'kernel': 'Normal', 'loss_name': 'AlternativeNLLLoss'}. Best is trial 647 with value: 0.9282546649369519.[0m
[32m[I 2022-04-24 05:33:23,337][0m Trial 663 finished with value: 0.8166912869015002 and parameters: {'n_hidden': 1024, 'mixture_components': 5, 'use_sparse_layer': False, 'use_batchnorm': False, 'use_dropout': False, 'mlp_size_1': 6, 'mlp_size_2': 1, 'mlp_size_3': 0, 'kernel': 'Normal', 'loss_name': 'AlternativeNLLLoss'}. Best is trial 647 with value: 0.9282546649369519.[0m
[32m[I 2022-04-24 05:38:22,056][0m Trial 664 finished with value: 0.7197064628687027 and parameters: {'n_hidden': 1024, 'mixture_components': 5, 'use_sparse_layer': False, 'use_batchnorm': False, 'use_dropout': False, 'mlp_size_1': 6, 'mlp_size_2': 1, 'mlp_size_3': 0, 'kernel': 'Normal', 'loss_name': 'CensoredNLLLoss'}. Best is trial 647 with value: 0.9282546649369519.[0m
[32m[I 2022-04-24 05:42:31,066][0m Trial 665 finished with value: 0.42342139313239063 and parameters: {'n_hidden': 1024, 'mixture_components': 1, 'use_sparse_layer': False, 'use_batchnorm': False, 'use_dropout': False, 'mlp_size_1': 6, 'mlp_size_2': 1, 'mlp_size_3': 0, 'kernel': 'Normal', 'loss_name': 'AlternativeNLLLoss'}. Best is trial 647 with value: 0.9282546649369519.[0m
[32m[I 2022-04-24 05:47:29,304][0m Trial 666 finished with value: 0.9251524019923725 and parameters: {'n_hidden': 1024, 'mixture_components': 5, 'use_sparse_layer': False, 'use_batchnorm': False, 'use_dropout': False, 'mlp_size_1': 6, 'mlp_size_2': 1, 'mlp_size_3': 0, 'kernel': 'Normal', 'loss_name': 'AlternativeNLLLoss'}. Best is trial 647 with value: 0.9282546649369519.[0m
[32m[I 2022-04-24 05:55:00,713][0m Trial 667 finished with value: 0.9258417448537519 and parameters: {'n_hidden': 64, 'mixture_components': 5, 'use_sparse_layer': False, 'use_batchnorm': False, 'use_dropout': False, 'mlp_size_1': 3, 'mlp_size_2': 0, 'mlp_size_3': 0, 'kernel': 'Normal', 'loss_name': 'CensoredNLLLoss'}. Best is trial 647 with value: 0.9282546649369519.[0m
[32m[I 2022-04-24 05:58:32,859][0m Trial 668 finished with value: 0.9142473182091081 and parameters: {'n_hidden': 1024, 'mixture_components': 5, 'use_sparse_layer': False, 'use_batchnorm': False, 'use_dropout': False, 'mlp_size_1': 6, 'mlp_size_2': 1, 'mlp_size_3': 0, 'kernel': 'Normal', 'loss_name': 'NLLLoss'}. Best is trial 647 with value: 0.9282546649369519.[0m
[32m[I 2022-04-24 06:04:18,519][0m Trial 669 finished with value: 0.9269275593588542 and parameters: {'n_hidden': 2048, 'mixture_components': 5, 'use_sparse_layer': False, 'use_batchnorm': False, 'use_dropout': False, 'mlp_size_1': 7, 'mlp_size_2': 1, 'mlp_size_3': 0, 'kernel': 'Normal', 'loss_name': 'AlternativeNLLLoss'}. Best is trial 647 with value: 0.9282546649369519.[0m
[32m[I 2022-04-24 06:09:01,589][0m Trial 670 finished with value: 0.9247084226816658 and parameters: {'n_hidden': 256, 'mixture_components': 5, 'use_sparse_layer': False, 'use_batchnorm': False, 'use_dropout': False, 'mlp_size_1': 5, 'mlp_size_2': 0, 'mlp_size_3': 0, 'kernel': 'Normal', 'loss_name': 'AlternativeNLLLoss'}. Best is trial 647 with value: 0.9282546649369519.[0m
[32m[I 2022-04-24 06:13:23,535][0m Trial 671 finished with value: 0.9268715358788313 and parameters: {'n_hidden': 1024, 'mixture_components': 5, 'use_sparse_layer': False, 'use_batchnorm': False, 'use_dropout': False, 'mlp_size_1': 6, 'mlp_size_2': 1, 'mlp_size_3': 0, 'kernel': 'Logistic', 'loss_name': 'CensoredNLLLoss'}. Best is trial 647 with value: 0.9282546649369519.[0m
[32m[I 2022-04-24 06:19:15,067][0m Trial 672 finished with value: 0.9260779914584496 and parameters: {'n_hidden': 1024, 'mixture_components': 5, 'use_sparse_layer': False, 'use_batchnorm': False, 'use_dropout': False, 'mlp_size_1': 6, 'mlp_size_2': 1, 'mlp_size_3': 0, 'kernel': 'Normal', 'loss_name': 'AlternativeNLLLoss'}. Best is trial 647 with value: 0.9282546649369519.[0m
[32m[I 2022-04-24 06:24:19,852][0m Trial 673 finished with value: 0.9265231669485237 and parameters: {'n_hidden': 1024, 'mixture_components': 5, 'use_sparse_layer': False, 'use_batchnorm': False, 'use_dropout': False, 'mlp_size_1': 6, 'mlp_size_2': 1, 'mlp_size_3': 0, 'kernel': 'Normal', 'loss_name': 'AlternativeNLLLoss'}. Best is trial 647 with value: 0.9282546649369519.[0m
[32m[I 2022-04-24 06:30:04,939][0m Trial 674 finished with value: 0.8266471716257933 and parameters: {'n_hidden': 1024, 'mixture_components': 7, 'use_sparse_layer': False, 'use_batchnorm': False, 'use_dropout': False, 'mlp_size_1': 6, 'mlp_size_2': 1, 'mlp_size_3': 0, 'kernel': 'Normal', 'loss_name': 'AlternativeNLLLoss'}. Best is trial 647 with value: 0.9282546649369519.[0m
[32m[I 2022-04-24 06:33:09,146][0m Trial 675 finished with value: -0.5 and parameters: {'n_hidden': 1024, 'mixture_components': 5, 'use_sparse_layer': False, 'use_batchnorm': True, 'use_dropout': True, 'dropout': 0.9869379413460211, 'mlp_size_1': 6, 'mlp_size_2': 1, 'mlp_size_3': 0, 'kernel': 'Normal', 'loss_name': 'CensoredNLLLoss'}. Best is trial 647 with value: 0.9282546649369519.[0m
[32m[I 2022-04-24 06:38:25,181][0m Trial 676 finished with value: 0.8160016524332742 and parameters: {'n_hidden': 1024, 'mixture_components': 6, 'use_sparse_layer': False, 'use_batchnorm': False, 'use_dropout': False, 'mlp_size_1': 6, 'mlp_size_2': 1, 'mlp_size_3': 0, 'kernel': 'Normal', 'loss_name': 'AlternativeNLLLoss'}. Best is trial 647 with value: 0.9282546649369519.[0m
