[32m[I 2022-04-21 15:24:14,576][0m Trial 55 finished with value: 0.770276104809629 and parameters: {'splitter': 'best', 'min_samples_split': 0.27466077067408246, 'min_samples_leaf': 0.08087520072384381, 'min_weight_fraction_leaf': 0.10106589310568166, 'max_features': 0.9214686062644641}. Best is trial 52 with value: 0.8098214582394094.[0m
[32m[I 2022-04-21 15:25:49,054][0m Trial 56 finished with value: 0.8010670256869684 and parameters: {'splitter': 'best', 'min_samples_split': 0.3416321521512268, 'min_samples_leaf': 0.06818958997231178, 'min_weight_fraction_leaf': 0.1316934878605644, 'max_features': 0.9993593182940819}. Best is trial 52 with value: 0.8098214582394094.[0m
[32m[I 2022-04-21 15:27:03,031][0m Trial 57 finished with value: 0.7541174524930444 and parameters: {'splitter': 'best', 'min_samples_split': 0.3832317654142948, 'min_samples_leaf': 0.0741221996426381, 'min_weight_fraction_leaf': 0.02413975100251084, 'max_features': 0.4296835887579756}. Best is trial 52 with value: 0.8098214582394094.[0m
[32m[I 2022-04-21 15:27:03,585][0m Trial 58 finished with value: 0.6851609036733942 and parameters: {'splitter': 'random', 'min_samples_split': 0.3499683552178496, 'min_samples_leaf': 0.11083764029367059, 'min_weight_fraction_leaf': 0.3533273020550518, 'max_features': 0.8228558733317693}. Best is trial 52 with value: 0.8098214582394094.[0m
[32m[I 2022-04-21 15:29:13,302][0m Trial 59 finished with value: 0.7805696675578225 and parameters: {'splitter': 'best', 'min_samples_split': 0.32942252541952344, 'min_samples_leaf': 0.03307052871908764, 'min_weight_fraction_leaf': 0.06739997374904146, 'max_features': 0.9592098388577442}. Best is trial 52 with value: 0.8098214582394094.[0m
[32m[I 2022-04-21 15:30:08,846][0m Trial 60 finished with value: 0.6501036168878294 and parameters: {'splitter': 'best', 'min_samples_split': 0.43679024777345954, 'min_samples_leaf': 0.06613725559853009, 'min_weight_fraction_leaf': 0.24285069145393448, 'max_features': 0.8792462404469227}. Best is trial 52 with value: 0.8098214582394094.[0m
[32m[I 2022-04-21 15:31:27,363][0m Trial 61 finished with value: 0.8024106782833111 and parameters: {'splitter': 'best', 'min_samples_split': 0.30246527196624967, 'min_samples_leaf': 0.0939920072627603, 'min_weight_fraction_leaf': 0.12457895151209158, 'max_features': 0.9970836011710053}. Best is trial 52 with value: 0.8098214582394094.[0m
[32m[I 2022-04-21 15:33:06,714][0m Trial 62 finished with value: 0.7759334503059073 and parameters: {'splitter': 'best', 'min_samples_split': 0.259649263033975, 'min_samples_leaf': 0.09500902398704064, 'min_weight_fraction_leaf': 0.06292093119696125, 'max_features': 0.9258888426559708}. Best is trial 52 with value: 0.8098214582394094.[0m
[32m[I 2022-04-21 15:34:25,581][0m Trial 63 finished with value: 0.7700091576984286 and parameters: {'splitter': 'best', 'min_samples_split': 0.22460904917871585, 'min_samples_leaf': 0.12180356257615446, 'min_weight_fraction_leaf': 0.1250031420852697, 'max_features': 0.9617926923324879}. Best is trial 52 with value: 0.8098214582394094.[0m
[32m[I 2022-04-21 15:35:20,072][0m Trial 64 finished with value: 0.7504134203636259 and parameters: {'splitter': 'best', 'min_samples_split': 0.34243565228095574, 'min_samples_leaf': 0.027471911806819065, 'min_weight_fraction_leaf': 0.13415607658562412, 'max_features': 0.4650172391720855}. Best is trial 52 with value: 0.8098214582394094.[0m
[32m[I 2022-04-21 15:35:35,850][0m Trial 65 finished with value: 0.5831980110332164 and parameters: {'splitter': 'best', 'min_samples_split': 0.2962792325734425, 'min_samples_leaf': 0.3503665293524253, 'min_weight_fraction_leaf': 0.022356326443151567, 'max_features': 0.993362105869602}. Best is trial 52 with value: 0.8098214582394094.[0m
[32m[I 2022-04-21 15:36:37,337][0m Trial 66 finished with value: 0.779715662528776 and parameters: {'splitter': 'best', 'min_samples_split': 0.24556413485064976, 'min_samples_leaf': 0.06239294303077497, 'min_weight_fraction_leaf': 0.09745737124884371, 'max_features': 0.586324842791423}. Best is trial 52 with value: 0.8098214582394094.[0m
[32m[I 2022-04-21 15:38:39,737][0m Trial 67 finished with value: 0.767719767350515 and parameters: {'splitter': 'best', 'min_samples_split': 0.322347485449942, 'min_samples_leaf': 0.052384810585096364, 'min_weight_fraction_leaf': 0.08365113880041103, 'max_features': 0.9023236624753216}. Best is trial 52 with value: 0.8098214582394094.[0m
[32m[I 2022-04-21 15:38:40,391][0m Trial 68 finished with value: 0.7901630403585613 and parameters: {'splitter': 'random', 'min_samples_split': 0.19578765609393184, 'min_samples_leaf': 0.09229271070908371, 'min_weight_fraction_leaf': 0.0480680886260301, 'max_features': 0.8572453111188687}. Best is trial 52 with value: 0.8098214582394094.[0m
[32m[I 2022-04-21 15:39:19,730][0m Trial 69 finished with value: 0.6585465174901886 and parameters: {'splitter': 'best', 'min_samples_split': 0.26411382096125324, 'min_samples_leaf': 0.16317810040407954, 'min_weight_fraction_leaf': 0.206976111995137, 'max_features': 0.4933053569513876}. Best is trial 52 with value: 0.8098214582394094.[0m
[32m[I 2022-04-21 15:41:13,047][0m Trial 70 finished with value: 0.7686846440525638 and parameters: {'splitter': 'best', 'min_samples_split': 0.3767005865742822, 'min_samples_leaf': 0.045823545044761944, 'min_weight_fraction_leaf': 0.16596241467152062, 'max_features': 0.9701677692713121}. Best is trial 52 with value: 0.8098214582394094.[0m
[32m[I 2022-04-21 15:42:29,461][0m Trial 71 finished with value: 0.7978100731356487 and parameters: {'splitter': 'best', 'min_samples_split': 0.3096954917631957, 'min_samples_leaf': 0.1095628188821633, 'min_weight_fraction_leaf': 0.14721881222717514, 'max_features': 0.9953127088562281}. Best is trial 52 with value: 0.8098214582394094.[0m
[32m[I 2022-04-21 15:43:53,891][0m Trial 72 finished with value: 0.7664211250015003 and parameters: {'splitter': 'best', 'min_samples_split': 0.28475317905043235, 'min_samples_leaf': 0.11596437089833031, 'min_weight_fraction_leaf': 0.1269244604333239, 'max_features': 0.9319389057406477}. Best is trial 52 with value: 0.8098214582394094.[0m
[32m[I 2022-04-21 15:43:59,869][0m Trial 73 finished with value: 0.6945793732499012 and parameters: {'splitter': 'best', 'min_samples_split': 0.3395869305114138, 'min_samples_leaf': 0.020080293250238412, 'min_weight_fraction_leaf': 0.13941684616782096, 'max_features': 0.013753755470055862}. Best is trial 52 with value: 0.8098214582394094.[0m
[32m[I 2022-04-21 15:45:23,930][0m Trial 74 finished with value: 0.7655179129747802 and parameters: {'splitter': 'best', 'min_samples_split': 0.3051444137610964, 'min_samples_leaf': 0.07021866658045567, 'min_weight_fraction_leaf': 0.19239418300716238, 'max_features': 0.9988061066234698}. Best is trial 52 with value: 0.8098214582394094.[0m
[32m[I 2022-04-21 15:46:23,416][0m Trial 75 finished with value: 0.6337582352510112 and parameters: {'splitter': 'best', 'min_samples_split': 0.39913191529179054, 'min_samples_leaf': 0.10212153472990862, 'min_weight_fraction_leaf': 0.27694463418763754, 'max_features': 0.8950620374813127}. Best is trial 52 with value: 0.8098214582394094.[0m
[32m[I 2022-04-21 15:48:04,661][0m Trial 76 finished with value: 0.7675327736631239 and parameters: {'splitter': 'best', 'min_samples_split': 0.31822397931804747, 'min_samples_leaf': 0.0857530256002217, 'min_weight_fraction_leaf': 0.0776754857176056, 'max_features': 0.9569258758126437}. Best is trial 52 with value: 0.8098214582394094.[0m
[32m[I 2022-04-21 15:48:57,638][0m Trial 77 finished with value: 0.7624188554358108 and parameters: {'splitter': 'best', 'min_samples_split': 0.36985734150373617, 'min_samples_leaf': 0.1830805181432541, 'min_weight_fraction_leaf': 0.10363321413263721, 'max_features': 0.9700059118995554}. Best is trial 52 with value: 0.8098214582394094.[0m
[32m[I 2022-04-21 15:50:00,550][0m Trial 78 finished with value: 0.7610867650978954 and parameters: {'splitter': 'best', 'min_samples_split': 0.22395682966987435, 'min_samples_leaf': 0.1503424153455712, 'min_weight_fraction_leaf': 0.11584360486033832, 'max_features': 0.9359867032827566}. Best is trial 52 with value: 0.8098214582394094.[0m
[32m[I 2022-04-21 15:51:03,649][0m Trial 79 finished with value: 0.7612790386890407 and parameters: {'splitter': 'best', 'min_samples_split': 0.25308362070386653, 'min_samples_leaf': 0.12989385809672807, 'min_weight_fraction_leaf': 0.1480827056658089, 'max_features': 0.8112530333330844}. Best is trial 52 with value: 0.8098214582394094.[0m
[32m[I 2022-04-21 15:51:04,077][0m Trial 80 finished with value: 0.6851609036733942 and parameters: {'splitter': 'random', 'min_samples_split': 0.27860899748795764, 'min_samples_leaf': 0.26314520082250004, 'min_weight_fraction_leaf': 0.05562314304024754, 'max_features': 0.9073400143787408}. Best is trial 52 with value: 0.8098214582394094.[0m
[32m[I 2022-04-21 15:52:05,726][0m Trial 81 finished with value: 0.7821623704935332 and parameters: {'splitter': 'best', 'min_samples_split': 0.30467868113506746, 'min_samples_leaf': 0.1388039648289933, 'min_weight_fraction_leaf': 0.16197771102736871, 'max_features': 0.9783821132196945}. Best is trial 52 with value: 0.8098214582394094.[0m
[32m[I 2022-04-21 15:53:17,450][0m Trial 82 finished with value: 0.7886865521027902 and parameters: {'splitter': 'best', 'min_samples_split': 0.2945135379433525, 'min_samples_leaf': 0.10416825124513222, 'min_weight_fraction_leaf': 0.15689907617162163, 'max_features': 0.9980805517686311}. Best is trial 52 with value: 0.8098214582394094.[0m
[32m[I 2022-04-21 15:54:26,095][0m Trial 83 finished with value: 0.8017452605096006 and parameters: {'splitter': 'best', 'min_samples_split': 0.2690747103112001, 'min_samples_leaf': 0.13114891621221525, 'min_weight_fraction_leaf': 0.09376577790234426, 'max_features': 0.9991787498318546}. Best is trial 52 with value: 0.8098214582394094.[0m
[32m[I 2022-04-21 15:56:13,655][0m Trial 84 finished with value: 0.771421433167667 and parameters: {'splitter': 'best', 'min_samples_split': 0.2707396112702062, 'min_samples_leaf': 0.06256973406064459, 'min_weight_fraction_leaf': 0.09255455496837743, 'max_features': 0.9426500555629247}. Best is trial 52 with value: 0.8098214582394094.[0m
[32m[I 2022-04-21 15:56:32,095][0m Trial 85 finished with value: 0.5746265107748781 and parameters: {'splitter': 'best', 'min_samples_split': 0.23138439482797013, 'min_samples_leaf': 0.08275903806081669, 'min_weight_fraction_leaf': 0.1201510380445311, 'max_features': 0.0984751826638488}. Best is trial 52 with value: 0.8098214582394094.[0m
[32m[I 2022-04-21 15:57:19,950][0m Trial 86 finished with value: 0.7307666982697777 and parameters: {'splitter': 'best', 'min_samples_split': 0.15067151970662776, 'min_samples_leaf': 0.04679502931643015, 'min_weight_fraction_leaf': 0.07920037642049758, 'max_features': 0.3332793681380437}. Best is trial 52 with value: 0.8098214582394094.[0m
[32m[I 2022-04-21 15:58:32,013][0m Trial 87 finished with value: 0.7656912694404895 and parameters: {'splitter': 'best', 'min_samples_split': 0.3568300096430079, 'min_samples_leaf': 0.11821560142151741, 'min_weight_fraction_leaf': 0.1383736893170277, 'max_features': 0.8858736775435836}. Best is trial 52 with value: 0.8098214582394094.[0m
[32m[I 2022-04-21 16:01:05,497][0m Trial 88 finished with value: 0.7918763498175893 and parameters: {'splitter': 'best', 'min_samples_split': 0.28825082405091845, 'min_samples_leaf': 0.020844294310132544, 'min_weight_fraction_leaf': 0.040943971450285915, 'max_features': 0.9701749211237104}. Best is trial 52 with value: 0.8098214582394094.[0m
[32m[I 2022-04-21 16:01:10,839][0m Trial 89 finished with value: 0.5664237612821506 and parameters: {'splitter': 'best', 'min_samples_split': 0.33407397590517723, 'min_samples_leaf': 0.4462510151414457, 'min_weight_fraction_leaf': 0.06416924932666312, 'max_features': 0.8652177051726029}. Best is trial 52 with value: 0.8098214582394094.[0m
[32m[I 2022-04-21 16:02:05,125][0m Trial 90 finished with value: 0.7538432623674571 and parameters: {'splitter': 'best', 'min_samples_split': 0.3148499482263059, 'min_samples_leaf': 0.17790511935652115, 'min_weight_fraction_leaf': 0.10049793755353192, 'max_features': 0.7562719930895316}. Best is trial 52 with value: 0.8098214582394094.[0m
[32m[I 2022-04-21 16:03:07,057][0m Trial 91 finished with value: 0.7977964830320455 and parameters: {'splitter': 'best', 'min_samples_split': 0.30534471181342515, 'min_samples_leaf': 0.1518216633660916, 'min_weight_fraction_leaf': 0.12973879789546547, 'max_features': 0.9978157189820259}. Best is trial 52 with value: 0.8098214582394094.[0m
[32m[I 2022-04-21 16:04:28,719][0m Trial 92 finished with value: 0.7686276857211853 and parameters: {'splitter': 'best', 'min_samples_split': 0.2707868658288716, 'min_samples_leaf': 0.15370352397914128, 'min_weight_fraction_leaf': 0.12955176766120438, 'max_features': 0.9763172417333319}. Best is trial 52 with value: 0.8098214582394094.[0m
[32m[I 2022-04-21 16:06:14,929][0m Trial 93 finished with value: 0.7779449456812738 and parameters: {'splitter': 'best', 'min_samples_split': 0.2547557271563406, 'min_samples_leaf': 0.091300347784325, 'min_weight_fraction_leaf': 0.1147488956890434, 'max_features': 0.9200201753603056}. Best is trial 52 with value: 0.8098214582394094.[0m
[32m[I 2022-04-21 16:07:41,915][0m Trial 94 finished with value: 0.7664211250015003 and parameters: {'splitter': 'best', 'min_samples_split': 0.32527324377829037, 'min_samples_leaf': 0.1270817850174411, 'min_weight_fraction_leaf': 0.09088060990271656, 'max_features': 0.9450220486385441}. Best is trial 52 with value: 0.8098214582394094.[0m
[32m[I 2022-04-21 16:08:55,065][0m Trial 95 finished with value: 0.7655179129747802 and parameters: {'splitter': 'best', 'min_samples_split': 0.3075477669338761, 'min_samples_leaf': 0.10989514635589834, 'min_weight_fraction_leaf': 0.18177207718308144, 'max_features': 0.9973059300676964}. Best is trial 52 with value: 0.8098214582394094.[0m
[32m[I 2022-04-21 16:10:14,396][0m Trial 96 finished with value: 0.7686186192092668 and parameters: {'splitter': 'best', 'min_samples_split': 0.2893879025907816, 'min_samples_leaf': 0.1350856903445009, 'min_weight_fraction_leaf': 0.14832026570251133, 'max_features': 0.9573264983279619}. Best is trial 52 with value: 0.8098214582394094.[0m
[32m[I 2022-04-21 16:11:38,353][0m Trial 97 finished with value: 0.7644127293975835 and parameters: {'splitter': 'best', 'min_samples_split': 0.24003887455640016, 'min_samples_leaf': 0.07343097375499141, 'min_weight_fraction_leaf': 0.019034050572770536, 'max_features': 0.4232138801744113}. Best is trial 52 with value: 0.8098214582394094.[0m
[32m[I 2022-04-21 16:12:20,424][0m Trial 98 finished with value: 0.7324617836052734 and parameters: {'splitter': 'best', 'min_samples_split': 0.3474656853755184, 'min_samples_leaf': 0.20208280196741793, 'min_weight_fraction_leaf': 0.11015001748998676, 'max_features': 0.9289799759013061}. Best is trial 52 with value: 0.8098214582394094.[0m
[32m[I 2022-04-21 16:12:21,103][0m Trial 99 finished with value: 0.7726821364188898 and parameters: {'splitter': 'random', 'min_samples_split': 0.3000263792806188, 'min_samples_leaf': 0.059226615589721365, 'min_weight_fraction_leaf': 0.08305204560807371, 'max_features': 0.9747256879942441}. Best is trial 52 with value: 0.8098214582394094.[0m
[32m[I 2022-04-21 16:13:05,140][0m Trial 100 finished with value: 0.5621894026178899 and parameters: {'splitter': 'best', 'min_samples_split': 0.2728837444910585, 'min_samples_leaf': 0.09785736606912938, 'min_weight_fraction_leaf': 0.4839321725237704, 'max_features': 0.8423789952458626}. Best is trial 52 with value: 0.8098214582394094.[0m
[32m[I 2022-04-21 16:14:14,521][0m Trial 101 finished with value: 0.7655179129747802 and parameters: {'splitter': 'best', 'min_samples_split': 0.3110233754917701, 'min_samples_leaf': 0.15334746111926054, 'min_weight_fraction_leaf': 0.166674781252487, 'max_features': 0.9956749563482704}. Best is trial 52 with value: 0.8098214582394094.[0m
[32m[I 2022-04-21 16:14:55,407][0m Trial 102 finished with value: 0.7041501846013248 and parameters: {'splitter': 'best', 'min_samples_split': 0.3214683164801016, 'min_samples_leaf': 0.23340896966441121, 'min_weight_fraction_leaf': 0.13329888205247356, 'max_features': 0.9560720058396511}. Best is trial 52 with value: 0.8098214582394094.[0m
[32m[I 2022-04-21 16:16:17,089][0m Trial 103 finished with value: 0.7634553498332147 and parameters: {'splitter': 'best', 'min_samples_split': 0.28268776839569193, 'min_samples_leaf': 0.14458163562951268, 'min_weight_fraction_leaf': 0.12036219983760027, 'max_features': 0.9116424098970193}. Best is trial 52 with value: 0.8098214582394094.[0m
[32m[I 2022-04-21 16:17:38,395][0m Trial 104 finished with value: 0.7978823913739485 and parameters: {'splitter': 'best', 'min_samples_split': 0.3353134500084892, 'min_samples_leaf': 0.1219180635318351, 'min_weight_fraction_leaf': 0.15064160483480898, 'max_features': 0.9834905579142683}. Best is trial 52 with value: 0.8098214582394094.[0m
[32m[I 2022-04-21 16:18:14,774][0m Trial 105 finished with value: 0.5656657206762908 and parameters: {'splitter': 'best', 'min_samples_split': 0.33555119368795866, 'min_samples_leaf': 0.1663363528246353, 'min_weight_fraction_leaf': 0.333990754587014, 'max_features': 0.5257536945296187}. Best is trial 52 with value: 0.8098214582394094.[0m
[32m[I 2022-04-21 16:19:36,064][0m Trial 106 finished with value: 0.7701151914885289 and parameters: {'splitter': 'best', 'min_samples_split': 0.26039018885769444, 'min_samples_leaf': 0.11980572137324635, 'min_weight_fraction_leaf': 0.10294697716916035, 'max_features': 0.9436175206939802}. Best is trial 52 with value: 0.8098214582394094.[0m
[32m[I 2022-04-21 16:20:22,795][0m Trial 107 finished with value: 0.5656657206762908 and parameters: {'splitter': 'best', 'min_samples_split': 0.3536951146549397, 'min_samples_leaf': 0.10336659793878461, 'min_weight_fraction_leaf': 0.40670515910276545, 'max_features': 0.888713090729779}. Best is trial 52 with value: 0.8098214582394094.[0m
[32m[I 2022-04-21 16:22:01,043][0m Trial 108 finished with value: 0.7978823913739485 and parameters: {'splitter': 'best', 'min_samples_split': 0.11822486319020108, 'min_samples_leaf': 0.0861118171496144, 'min_weight_fraction_leaf': 0.1490498074748171, 'max_features': 0.977254491600491}. Best is trial 52 with value: 0.8098214582394094.[0m
[32m[I 2022-04-21 16:23:52,687][0m Trial 109 finished with value: 0.7383169136962514 and parameters: {'splitter': 'best', 'min_samples_split': 0.088530706903208, 'min_samples_leaf': 0.042481795369216827, 'min_weight_fraction_leaf': 0.19459052086628825, 'max_features': 0.9745574212891722}. Best is trial 52 with value: 0.8098214582394094.[0m
[32m[I 2022-04-21 16:25:38,872][0m Trial 110 finished with value: 0.7614520810799611 and parameters: {'splitter': 'best', 'min_samples_split': 0.006127670608796015, 'min_samples_leaf': 0.08681417496248506, 'min_weight_fraction_leaf': 0.14672124720457466, 'max_features': 0.9261682553064913}. Best is trial 52 with value: 0.8098214582394094.[0m
[32m[I 2022-04-21 16:27:02,447][0m Trial 111 finished with value: 0.7655179129747802 and parameters: {'splitter': 'best', 'min_samples_split': 0.06802708865257301, 'min_samples_leaf': 0.1110786562854654, 'min_weight_fraction_leaf': 0.17083046774761576, 'max_features': 0.9821185990270178}. Best is trial 52 with value: 0.8098214582394094.[0m
[32m[I 2022-04-21 16:28:01,518][0m Trial 112 finished with value: 0.7547923749782108 and parameters: {'splitter': 'best', 'min_samples_split': 0.04641061963677631, 'min_samples_leaf': 0.07801402098544086, 'min_weight_fraction_leaf': 0.12787993726563968, 'max_features': 0.448070303618909}. Best is trial 52 with value: 0.8098214582394094.[0m
[32m[I 2022-04-21 16:29:45,493][0m Trial 113 finished with value: 0.7683316235205436 and parameters: {'splitter': 'best', 'min_samples_split': 0.2958393057064142, 'min_samples_leaf': 0.12933347432408152, 'min_weight_fraction_leaf': 0.14024389250830005, 'max_features': 0.9554868250870658}. Best is trial 52 with value: 0.8098214582394094.[0m
[32m[I 2022-04-21 16:31:35,656][0m Trial 114 finished with value: 0.7977587789269581 and parameters: {'splitter': 'best', 'min_samples_split': 0.13070013203406927, 'min_samples_leaf': 0.05560956653414331, 'min_weight_fraction_leaf': 0.15246448588009376, 'max_features': 0.9816176639584605}. Best is trial 52 with value: 0.8098214582394094.[0m
[32m[I 2022-04-21 16:33:52,292][0m Trial 115 finished with value: 0.8073137491125417 and parameters: {'splitter': 'best', 'min_samples_split': 0.3259262376236991, 'min_samples_leaf': 0.07023443690230362, 'min_weight_fraction_leaf': 0.07344691664518302, 'max_features': 0.9989466241662738}. Best is trial 52 with value: 0.8098214582394094.[0m
[32m[I 2022-04-21 16:33:53,893][0m Trial 116 finished with value: 0.7963956610153005 and parameters: {'splitter': 'random', 'min_samples_split': 0.3412723076391192, 'min_samples_leaf': 0.06936946227284102, 'min_weight_fraction_leaf': 0.072577512589588, 'max_features': 0.9027418866722696}. Best is trial 52 with value: 0.8098214582394094.[0m
[32m[I 2022-04-21 16:35:58,807][0m Trial 117 finished with value: 0.7669811647491456 and parameters: {'splitter': 'best', 'min_samples_split': 0.32702611535972864, 'min_samples_leaf': 0.095435042648741, 'min_weight_fraction_leaf': 0.04970647223807963, 'max_features': 0.9558107696990763}. Best is trial 52 with value: 0.8098214582394094.[0m
