[32m[I 2022-04-21 12:45:11,704][0m Trial 425 finished with value: 0.9149652557457028 and parameters: {'alpha': 2.270451579397078, 'ties': 'breslow'}. Best is trial 411 with value: 0.91502674920718.[0m
[32m[I 2022-04-21 12:45:20,760][0m Trial 426 finished with value: 0.9149721905903421 and parameters: {'alpha': 2.0909757807839493, 'ties': 'breslow'}. Best is trial 411 with value: 0.91502674920718.[0m
[32m[I 2022-04-21 12:45:31,347][0m Trial 427 finished with value: 0.9150204094210158 and parameters: {'alpha': 1.8740241528324084, 'ties': 'breslow'}. Best is trial 411 with value: 0.91502674920718.[0m
[32m[I 2022-04-21 12:45:42,810][0m Trial 428 finished with value: 0.9150063498575678 and parameters: {'alpha': 1.7895809992931828, 'ties': 'breslow'}. Best is trial 411 with value: 0.91502674920718.[0m
[32m[I 2022-04-21 12:45:54,285][0m Trial 429 finished with value: 0.9150221148818506 and parameters: {'alpha': 1.9561964838209036, 'ties': 'breslow'}. Best is trial 411 with value: 0.91502674920718.[0m
[32m[I 2022-04-21 12:46:04,523][0m Trial 430 finished with value: 0.914973850713803 and parameters: {'alpha': 2.1390135690780006, 'ties': 'breslow'}. Best is trial 411 with value: 0.91502674920718.[0m
[32m[I 2022-04-21 12:46:15,752][0m Trial 431 finished with value: 0.9150255207070798 and parameters: {'alpha': 1.9034347584359683, 'ties': 'breslow'}. Best is trial 411 with value: 0.91502674920718.[0m
[32m[I 2022-04-21 12:46:27,185][0m Trial 432 finished with value: 0.9149920340889768 and parameters: {'alpha': 1.6809743309933416, 'ties': 'breslow'}. Best is trial 411 with value: 0.91502674920718.[0m
[32m[I 2022-04-21 12:46:41,543][0m Trial 433 finished with value: 0.9149288835143036 and parameters: {'alpha': 2.032160140270239, 'ties': 'efron'}. Best is trial 411 with value: 0.91502674920718.[0m
[32m[I 2022-04-21 12:46:52,501][0m Trial 434 finished with value: 0.9150129489604989 and parameters: {'alpha': 1.8209644157420626, 'ties': 'breslow'}. Best is trial 411 with value: 0.91502674920718.[0m
[32m[I 2022-04-21 12:47:03,501][0m Trial 435 finished with value: 0.9150239129715197 and parameters: {'alpha': 1.8903742621706932, 'ties': 'breslow'}. Best is trial 411 with value: 0.91502674920718.[0m
[32m[I 2022-04-21 12:47:15,498][0m Trial 436 finished with value: 0.9149929026554473 and parameters: {'alpha': 2.0111540362806215, 'ties': 'breslow'}. Best is trial 411 with value: 0.91502674920718.[0m
[32m[I 2022-04-21 12:47:26,932][0m Trial 437 finished with value: 0.9150067758692465 and parameters: {'alpha': 1.7616477100872887, 'ties': 'breslow'}. Best is trial 411 with value: 0.91502674920718.[0m
[32m[I 2022-04-21 12:47:37,225][0m Trial 438 finished with value: 0.9150213361816878 and parameters: {'alpha': 1.960739749808003, 'ties': 'breslow'}. Best is trial 411 with value: 0.91502674920718.[0m
[32m[I 2022-04-21 12:47:48,779][0m Trial 439 finished with value: 0.9149915760778683 and parameters: {'alpha': 1.6778176463154697, 'ties': 'breslow'}. Best is trial 411 with value: 0.91502674920718.[0m
[32m[I 2022-04-21 12:48:00,421][0m Trial 440 finished with value: 0.9149741379253064 and parameters: {'alpha': 2.135886240426909, 'ties': 'breslow'}. Best is trial 411 with value: 0.91502674920718.[0m
[32m[I 2022-04-21 12:48:12,422][0m Trial 441 finished with value: 0.9150262402732124 and parameters: {'alpha': 1.9009454011185372, 'ties': 'breslow'}. Best is trial 411 with value: 0.91502674920718.[0m
[32m[I 2022-04-21 12:48:22,907][0m Trial 442 finished with value: 0.9150166776457114 and parameters: {'alpha': 1.833539970148307, 'ties': 'breslow'}. Best is trial 411 with value: 0.91502674920718.[0m
[32m[I 2022-04-21 12:48:31,968][0m Trial 443 finished with value: 0.9149801663247541 and parameters: {'alpha': 1.5885139025617205, 'ties': 'breslow'}. Best is trial 411 with value: 0.91502674920718.[0m
[32m[I 2022-04-21 12:48:41,972][0m Trial 444 finished with value: 0.9149629707580968 and parameters: {'alpha': 2.4160380718570247, 'ties': 'breslow'}. Best is trial 411 with value: 0.91502674920718.[0m
[32m[I 2022-04-21 12:48:52,818][0m Trial 445 finished with value: 0.9149759139766008 and parameters: {'alpha': 2.0603228533343003, 'ties': 'breslow'}. Best is trial 411 with value: 0.91502674920718.[0m
[32m[I 2022-04-21 12:49:03,577][0m Trial 446 finished with value: 0.9150258863197684 and parameters: {'alpha': 1.9138496574420922, 'ties': 'breslow'}. Best is trial 411 with value: 0.91502674920718.[0m
[32m[I 2022-04-21 12:49:14,254][0m Trial 447 finished with value: 0.9150246127332158 and parameters: {'alpha': 1.8888036385649372, 'ties': 'breslow'}. Best is trial 411 with value: 0.91502674920718.[0m
[32m[I 2022-04-21 12:49:24,365][0m Trial 448 finished with value: 0.915005942586135 and parameters: {'alpha': 1.7715539006154075, 'ties': 'breslow'}. Best is trial 411 with value: 0.91502674920718.[0m
[32m[I 2022-04-21 12:49:36,110][0m Trial 449 finished with value: 0.9149703941845819 and parameters: {'alpha': 2.20867756318951, 'ties': 'breslow'}. Best is trial 411 with value: 0.91502674920718.[0m
[32m[I 2022-04-21 12:49:46,141][0m Trial 450 finished with value: 0.9149928375722134 and parameters: {'alpha': 2.01108686517573, 'ties': 'breslow'}. Best is trial 411 with value: 0.91502674920718.[0m
[32m[I 2022-04-21 12:49:58,049][0m Trial 451 finished with value: 0.9150212090574612 and parameters: {'alpha': 1.9211440523339436, 'ties': 'breslow'}. Best is trial 411 with value: 0.91502674920718.[0m
[32m[I 2022-04-21 12:50:08,534][0m Trial 452 finished with value: 0.914999771086037 and parameters: {'alpha': 1.7245395414607247, 'ties': 'breslow'}. Best is trial 411 with value: 0.91502674920718.[0m
[32m[I 2022-04-21 12:50:17,814][0m Trial 453 finished with value: 0.9150159025328243 and parameters: {'alpha': 1.857198605820154, 'ties': 'breslow'}. Best is trial 411 with value: 0.91502674920718.[0m
[32m[I 2022-04-21 12:50:34,047][0m Trial 454 finished with value: 0.914939465445326 and parameters: {'alpha': 2.1026169889954867, 'ties': 'efron'}. Best is trial 411 with value: 0.91502674920718.[0m
[32m[I 2022-04-21 12:50:45,697][0m Trial 455 finished with value: 0.9150243596551938 and parameters: {'alpha': 1.9795392248414052, 'ties': 'breslow'}. Best is trial 411 with value: 0.91502674920718.[0m
[32m[I 2022-04-21 12:50:57,239][0m Trial 456 finished with value: 0.9150230126069966 and parameters: {'alpha': 1.9518660794774811, 'ties': 'breslow'}. Best is trial 411 with value: 0.91502674920718.[0m
[32m[I 2022-04-21 12:51:07,604][0m Trial 457 finished with value: 0.9150111255274961 and parameters: {'alpha': 1.8122840560666107, 'ties': 'breslow'}. Best is trial 411 with value: 0.91502674920718.[0m
[32m[I 2022-04-21 12:51:17,008][0m Trial 458 finished with value: 0.9149635717903097 and parameters: {'alpha': 2.306112533204702, 'ties': 'breslow'}. Best is trial 411 with value: 0.91502674920718.[0m
[32m[I 2022-04-21 12:51:28,375][0m Trial 459 finished with value: 0.9149716751517609 and parameters: {'alpha': 1.421269290640839, 'ties': 'breslow'}. Best is trial 411 with value: 0.91502674920718.[0m
[32m[I 2022-04-21 12:51:39,286][0m Trial 460 finished with value: 0.9149998538678332 and parameters: {'alpha': 1.7265225838850289, 'ties': 'breslow'}. Best is trial 411 with value: 0.91502674920718.[0m
[32m[I 2022-04-21 12:51:50,823][0m Trial 461 finished with value: 0.9149819333714367 and parameters: {'alpha': 2.0378416296805573, 'ties': 'breslow'}. Best is trial 411 with value: 0.91502674920718.[0m
[32m[I 2022-04-21 12:52:00,185][0m Trial 462 finished with value: 0.9150174529787399 and parameters: {'alpha': 1.8713833358177638, 'ties': 'breslow'}. Best is trial 411 with value: 0.91502674920718.[0m
[32m[I 2022-04-21 12:52:09,256][0m Trial 463 finished with value: 0.9149845266455348 and parameters: {'alpha': 1.6369341456768352, 'ties': 'breslow'}. Best is trial 411 with value: 0.91502674920718.[0m
[32m[I 2022-04-21 12:52:19,580][0m Trial 464 finished with value: 0.9149779447338086 and parameters: {'alpha': 2.1240268727779306, 'ties': 'breslow'}. Best is trial 411 with value: 0.91502674920718.[0m
[32m[I 2022-04-21 12:52:29,755][0m Trial 465 finished with value: 0.9150218374287318 and parameters: {'alpha': 1.947884580680627, 'ties': 'breslow'}. Best is trial 411 with value: 0.91502674920718.[0m
[32m[I 2022-04-21 12:52:39,577][0m Trial 466 finished with value: 0.9150059055026698 and parameters: {'alpha': 1.7968575671074154, 'ties': 'breslow'}. Best is trial 411 with value: 0.91502674920718.[0m
[32m[I 2022-04-21 12:52:50,458][0m Trial 467 finished with value: 0.9149936186446936 and parameters: {'alpha': 2.025645501836601, 'ties': 'breslow'}. Best is trial 411 with value: 0.91502674920718.[0m
[32m[I 2022-04-21 12:52:59,886][0m Trial 468 finished with value: 0.9150174518870537 and parameters: {'alpha': 1.8709639954607087, 'ties': 'breslow'}. Best is trial 411 with value: 0.91502674920718.[0m
[32m[I 2022-04-21 12:53:10,225][0m Trial 469 finished with value: 0.9149991314180161 and parameters: {'alpha': 1.732734691101429, 'ties': 'breslow'}. Best is trial 411 with value: 0.91502674920718.[0m
[32m[I 2022-04-21 12:53:19,830][0m Trial 470 finished with value: 0.9149728987707357 and parameters: {'alpha': 2.1731204052720066, 'ties': 'breslow'}. Best is trial 411 with value: 0.91502674920718.[0m
[32m[I 2022-04-21 12:53:30,031][0m Trial 471 finished with value: 0.9150220458676847 and parameters: {'alpha': 1.944371864380636, 'ties': 'breslow'}. Best is trial 411 with value: 0.91502674920718.[0m
[32m[I 2022-04-21 12:53:42,598][0m Trial 472 finished with value: 0.9148835569279191 and parameters: {'alpha': 1.5529161081629712, 'ties': 'efron'}. Best is trial 411 with value: 0.91502674920718.[0m
[32m[I 2022-04-21 12:53:52,396][0m Trial 473 finished with value: 0.9150151352260171 and parameters: {'alpha': 1.827063907695924, 'ties': 'breslow'}. Best is trial 411 with value: 0.91502674920718.[0m
[32m[I 2022-04-21 12:54:02,356][0m Trial 474 finished with value: 0.914973449144 and parameters: {'alpha': 2.0659991342221207, 'ties': 'breslow'}. Best is trial 411 with value: 0.91502674920718.[0m
[32m[I 2022-04-21 12:54:11,809][0m Trial 475 finished with value: 0.9150243640338387 and parameters: {'alpha': 1.9159076517124871, 'ties': 'breslow'}. Best is trial 411 with value: 0.91502674920718.[0m
[32m[I 2022-04-21 12:54:22,579][0m Trial 476 finished with value: 0.9150093045231611 and parameters: {'alpha': 1.8069261988473584, 'ties': 'breslow'}. Best is trial 411 with value: 0.91502674920718.[0m
[32m[I 2022-04-21 12:54:32,579][0m Trial 477 finished with value: 0.9149921632177973 and parameters: {'alpha': 1.680854619226244, 'ties': 'breslow'}. Best is trial 411 with value: 0.91502674920718.[0m
[32m[I 2022-04-21 12:54:45,508][0m Trial 478 finished with value: 0.9149094573289027 and parameters: {'alpha': 3.8141310704046005, 'ties': 'breslow'}. Best is trial 411 with value: 0.91502674920718.[0m
[32m[I 2022-04-21 12:54:55,842][0m Trial 479 finished with value: 0.9149939171541084 and parameters: {'alpha': 1.9997686448359704, 'ties': 'breslow'}. Best is trial 411 with value: 0.91502674920718.[0m
[32m[I 2022-04-21 12:55:07,132][0m Trial 480 finished with value: 0.9150188075019772 and parameters: {'alpha': 1.8809034359005747, 'ties': 'breslow'}. Best is trial 411 with value: 0.91502674920718.[0m
[32m[I 2022-04-21 12:55:17,658][0m Trial 481 finished with value: 0.9149696259467248 and parameters: {'alpha': 2.2198628028077474, 'ties': 'breslow'}. Best is trial 411 with value: 0.91502674920718.[0m
[32m[I 2022-04-21 12:55:28,708][0m Trial 482 finished with value: 0.9149770091204644 and parameters: {'alpha': 2.0568992994536157, 'ties': 'breslow'}. Best is trial 411 with value: 0.91502674920718.[0m
[32m[I 2022-04-21 12:55:38,138][0m Trial 483 finished with value: 0.9150063507505667 and parameters: {'alpha': 1.789431420298327, 'ties': 'breslow'}. Best is trial 411 with value: 0.91502674920718.[0m
[32m[I 2022-04-21 12:55:48,490][0m Trial 484 finished with value: 0.9150219226816565 and parameters: {'alpha': 1.9603310367363636, 'ties': 'breslow'}. Best is trial 411 with value: 0.91502674920718.[0m
[32m[I 2022-04-21 12:55:57,837][0m Trial 485 finished with value: 0.9149873951562913 and parameters: {'alpha': 1.6320432100493851, 'ties': 'breslow'}. Best is trial 411 with value: 0.91502674920718.[0m
[32m[I 2022-04-21 12:56:08,476][0m Trial 486 finished with value: 0.9150251809169421 and parameters: {'alpha': 1.889463663066165, 'ties': 'breslow'}. Best is trial 411 with value: 0.91502674920718.[0m
[32m[I 2022-04-21 12:56:18,054][0m Trial 487 finished with value: 0.9149714903080272 and parameters: {'alpha': 2.092052203774558, 'ties': 'breslow'}. Best is trial 411 with value: 0.91502674920718.[0m
[32m[I 2022-04-21 12:56:28,094][0m Trial 488 finished with value: 0.9150000969359995 and parameters: {'alpha': 1.7256221709224304, 'ties': 'breslow'}. Best is trial 411 with value: 0.91502674920718.[0m
[32m[I 2022-04-21 12:56:38,243][0m Trial 489 finished with value: 0.915023199256171 and parameters: {'alpha': 1.9692129053854923, 'ties': 'breslow'}. Best is trial 411 with value: 0.91502674920718.[0m
[32m[I 2022-04-21 12:56:49,528][0m Trial 490 finished with value: 0.9150169398186832 and parameters: {'alpha': 1.8336169273864946, 'ties': 'breslow'}. Best is trial 411 with value: 0.91502674920718.[0m
[32m[I 2022-04-21 12:57:06,118][0m Trial 491 finished with value: 0.9149476302778373 and parameters: {'alpha': 2.13063123402068, 'ties': 'efron'}. Best is trial 411 with value: 0.91502674920718.[0m
[32m[I 2022-04-21 12:57:16,370][0m Trial 492 finished with value: 0.9150237799745137 and parameters: {'alpha': 1.9831709674772173, 'ties': 'breslow'}. Best is trial 411 with value: 0.91502674920718.[0m
[32m[I 2022-04-21 12:57:25,751][0m Trial 493 finished with value: 0.9150076062959045 and parameters: {'alpha': 1.755763729361126, 'ties': 'breslow'}. Best is trial 411 with value: 0.91502674920718.[0m
[32m[I 2022-04-21 12:57:35,685][0m Trial 494 finished with value: 0.9150176820890387 and parameters: {'alpha': 1.8623584852678923, 'ties': 'breslow'}. Best is trial 411 with value: 0.91502674920718.[0m
[32m[I 2022-04-21 12:57:45,673][0m Trial 495 finished with value: 0.9149836287115176 and parameters: {'alpha': 2.045507554902012, 'ties': 'breslow'}. Best is trial 411 with value: 0.91502674920718.[0m
[32m[I 2022-04-21 12:57:54,834][0m Trial 496 finished with value: 0.9150217027724945 and parameters: {'alpha': 1.9187637685947887, 'ties': 'breslow'}. Best is trial 411 with value: 0.91502674920718.[0m
[32m[I 2022-04-21 12:58:03,748][0m Trial 497 finished with value: 0.9149892003069675 and parameters: {'alpha': 1.6893944564197039, 'ties': 'breslow'}. Best is trial 411 with value: 0.91502674920718.[0m
[32m[I 2022-04-21 12:58:12,050][0m Trial 498 finished with value: 0.9149740167152569 and parameters: {'alpha': 1.5003402193963398, 'ties': 'breslow'}. Best is trial 411 with value: 0.91502674920718.[0m
[32m[I 2022-04-21 12:58:21,561][0m Trial 499 finished with value: 0.9150077138701567 and parameters: {'alpha': 1.8027527082892303, 'ties': 'breslow'}. Best is trial 411 with value: 0.91502674920718.[0m
[32m[I 2022-04-21 12:58:30,274][0m Trial 500 finished with value: 0.9149692825172412 and parameters: {'alpha': 2.243282426870072, 'ties': 'breslow'}. Best is trial 411 with value: 0.91502674920718.[0m
[32m[I 2022-04-21 12:58:39,583][0m Trial 501 finished with value: 0.9150223521253136 and parameters: {'alpha': 1.9651935748941889, 'ties': 'breslow'}. Best is trial 411 with value: 0.91502674920718.[0m
[32m[I 2022-04-21 12:58:48,489][0m Trial 502 finished with value: 0.9149716414632744 and parameters: {'alpha': 2.0811480847688726, 'ties': 'breslow'}. Best is trial 411 with value: 0.91502674920718.[0m
[32m[I 2022-04-21 12:58:57,886][0m Trial 503 finished with value: 0.9150204054806018 and parameters: {'alpha': 1.8768697760102135, 'ties': 'breslow'}. Best is trial 411 with value: 0.91502674920718.[0m
[32m[I 2022-04-21 12:59:07,775][0m Trial 504 finished with value: 0.9150063328304157 and parameters: {'alpha': 1.7493309197271723, 'ties': 'breslow'}. Best is trial 411 with value: 0.91502674920718.[0m
[32m[I 2022-04-21 12:59:17,807][0m Trial 505 finished with value: 0.914986126757654 and parameters: {'alpha': 1.6090225791642716, 'ties': 'breslow'}. Best is trial 411 with value: 0.91502674920718.[0m
[32m[I 2022-04-21 12:59:26,574][0m Trial 506 finished with value: 0.9149921586397616 and parameters: {'alpha': 2.0073592862675387, 'ties': 'breslow'}. Best is trial 411 with value: 0.91502674920718.[0m
[32m[I 2022-04-21 12:59:36,820][0m Trial 507 finished with value: 0.914972732334404 and parameters: {'alpha': 2.1671918416718645, 'ties': 'breslow'}. Best is trial 411 with value: 0.91502674920718.[0m
[32m[I 2022-04-21 12:59:48,544][0m Trial 508 finished with value: 0.9148706069195359 and parameters: {'alpha': 4.74537558251723, 'ties': 'breslow'}. Best is trial 411 with value: 0.91502674920718.[0m
[32m[I 2022-04-21 12:59:59,158][0m Trial 509 finished with value: 0.9150194443960563 and parameters: {'alpha': 1.8842931440820216, 'ties': 'breslow'}. Best is trial 411 with value: 0.91502674920718.[0m
[32m[I 2022-04-21 13:00:11,985][0m Trial 510 finished with value: 0.9148974042189563 and parameters: {'alpha': 1.8114801902354105, 'ties': 'efron'}. Best is trial 411 with value: 0.91502674920718.[0m
[32m[I 2022-04-21 13:00:22,108][0m Trial 511 finished with value: 0.9150212628089219 and parameters: {'alpha': 1.9628617414685032, 'ties': 'breslow'}. Best is trial 411 with value: 0.91502674920718.[0m
[32m[I 2022-04-21 13:00:30,905][0m Trial 512 finished with value: 0.9149911619961951 and parameters: {'alpha': 1.6769537892159605, 'ties': 'breslow'}. Best is trial 411 with value: 0.91502674920718.[0m
[32m[I 2022-04-21 13:00:40,675][0m Trial 513 finished with value: 0.9149706753574118 and parameters: {'alpha': 2.077623630339427, 'ties': 'breslow'}. Best is trial 411 with value: 0.91502674920718.[0m
[32m[I 2022-04-21 13:00:50,012][0m Trial 514 finished with value: 0.9150216719479308 and parameters: {'alpha': 1.9253314596947888, 'ties': 'breslow'}. Best is trial 411 with value: 0.91502674920718.[0m
[32m[I 2022-04-21 13:01:00,758][0m Trial 515 finished with value: 0.9150065613798649 and parameters: {'alpha': 1.7782866239150479, 'ties': 'breslow'}. Best is trial 411 with value: 0.91502674920718.[0m
[32m[I 2022-04-21 13:01:10,889][0m Trial 516 finished with value: 0.9150197407983771 and parameters: {'alpha': 1.8847419098519678, 'ties': 'breslow'}. Best is trial 411 with value: 0.91502674920718.[0m
[32m[I 2022-04-21 13:01:20,894][0m Trial 517 finished with value: 0.914992474464125 and parameters: {'alpha': 2.004688937734113, 'ties': 'breslow'}. Best is trial 411 with value: 0.91502674920718.[0m
[32m[I 2022-04-21 13:01:32,812][0m Trial 518 finished with value: 0.9149644848853417 and parameters: {'alpha': 2.3097787037414963, 'ties': 'breslow'}. Best is trial 411 with value: 0.91502674920718.[0m
[32m[I 2022-04-21 13:01:43,202][0m Trial 519 finished with value: 0.9150114896678844 and parameters: {'alpha': 1.8162649899934333, 'ties': 'breslow'}. Best is trial 411 with value: 0.91502674920718.[0m
[32m[I 2022-04-21 13:01:52,505][0m Trial 520 finished with value: 0.9149725590624387 and parameters: {'alpha': 2.158240053564047, 'ties': 'breslow'}. Best is trial 411 with value: 0.91502674920718.[0m
[32m[I 2022-04-21 13:02:00,490][0m Trial 521 finished with value: 0.9149917732485683 and parameters: {'alpha': 1.6964662692395027, 'ties': 'breslow'}. Best is trial 411 with value: 0.91502674920718.[0m
[32m[I 2022-04-21 13:02:09,958][0m Trial 522 finished with value: 0.9149942077309635 and parameters: {'alpha': 2.023035478061451, 'ties': 'breslow'}. Best is trial 411 with value: 0.91502674920718.[0m
[32m[I 2022-04-21 13:02:18,745][0m Trial 523 finished with value: 0.915021469818966 and parameters: {'alpha': 1.9214376262672355, 'ties': 'breslow'}. Best is trial 411 with value: 0.91502674920718.[0m
[32m[I 2022-04-21 13:02:28,552][0m Trial 524 finished with value: 0.9150077138701567 and parameters: {'alpha': 1.8027166214310633, 'ties': 'breslow'}. Best is trial 411 with value: 0.91502674920718.[0m
[32m[I 2022-04-21 13:02:37,698][0m Trial 525 finished with value: 0.9149784110691932 and parameters: {'alpha': 1.5751827595959282, 'ties': 'breslow'}. Best is trial 411 with value: 0.91502674920718.[0m
[32m[I 2022-04-21 13:02:47,163][0m Trial 526 finished with value: 0.9149742769719917 and parameters: {'alpha': 2.06729197092328, 'ties': 'breslow'}. Best is trial 411 with value: 0.91502674920718.[0m
[32m[I 2022-04-21 13:02:56,579][0m Trial 527 finished with value: 0.9150254508335232 and parameters: {'alpha': 1.8975441532368915, 'ties': 'breslow'}. Best is trial 411 with value: 0.91502674920718.[0m
[32m[I 2022-04-21 13:03:05,227][0m Trial 528 finished with value: 0.9149992629779089 and parameters: {'alpha': 1.7400217119532735, 'ties': 'breslow'}. Best is trial 411 with value: 0.91502674920718.[0m
[32m[I 2022-04-21 13:03:17,261][0m Trial 529 finished with value: 0.9149288412673094 and parameters: {'alpha': 1.9632317925517235, 'ties': 'efron'}. Best is trial 411 with value: 0.91502674920718.[0m
[32m[I 2022-04-21 13:03:27,694][0m Trial 530 finished with value: 0.9150172569826589 and parameters: {'alpha': 1.8467411245636556, 'ties': 'breslow'}. Best is trial 411 with value: 0.91502674920718.[0m
[32m[I 2022-04-21 13:03:37,460][0m Trial 531 finished with value: 0.9149753551278191 and parameters: {'alpha': 2.1310743016771476, 'ties': 'breslow'}. Best is trial 411 with value: 0.91502674920718.[0m
