[32m[I 2022-04-21 12:10:27,898][0m Trial 213 finished with value: 0.9150160683565993 and parameters: {'alpha': 1.857324911618229, 'ties': 'breslow'}. Best is trial 140 with value: 0.915026486073581.[0m
[32m[I 2022-04-21 12:10:36,607][0m Trial 214 finished with value: 0.9149922613207787 and parameters: {'alpha': 1.7053257655899015, 'ties': 'breslow'}. Best is trial 140 with value: 0.915026486073581.[0m
[32m[I 2022-04-21 12:10:45,682][0m Trial 215 finished with value: 0.9150237217349897 and parameters: {'alpha': 1.9115273425369261, 'ties': 'breslow'}. Best is trial 140 with value: 0.915026486073581.[0m
[32m[I 2022-04-21 12:10:55,706][0m Trial 216 finished with value: 0.9150066524653095 and parameters: {'alpha': 1.7611144519824262, 'ties': 'breslow'}. Best is trial 140 with value: 0.915026486073581.[0m
[32m[I 2022-04-21 12:11:05,368][0m Trial 217 finished with value: 0.9149926536022065 and parameters: {'alpha': 2.027326239313563, 'ties': 'breslow'}. Best is trial 140 with value: 0.915026486073581.[0m
[32m[I 2022-04-21 12:11:14,305][0m Trial 218 finished with value: 0.9150186299750764 and parameters: {'alpha': 1.881264497059686, 'ties': 'breslow'}. Best is trial 140 with value: 0.915026486073581.[0m
[32m[I 2022-04-21 12:11:23,615][0m Trial 219 finished with value: 0.9149912084206371 and parameters: {'alpha': 1.6674109177208916, 'ties': 'breslow'}. Best is trial 140 with value: 0.915026486073581.[0m
[32m[I 2022-04-21 12:11:38,188][0m Trial 220 finished with value: 0.9149473047786539 and parameters: {'alpha': 2.1292797847579688, 'ties': 'efron'}. Best is trial 140 with value: 0.915026486073581.[0m
[32m[I 2022-04-21 12:11:46,989][0m Trial 221 finished with value: 0.9150237435574938 and parameters: {'alpha': 1.9335372287336283, 'ties': 'breslow'}. Best is trial 140 with value: 0.915026486073581.[0m
[32m[I 2022-04-21 12:11:59,404][0m Trial 222 finished with value: 0.9150256182175832 and parameters: {'alpha': 1.913460351624453, 'ties': 'breslow'}. Best is trial 140 with value: 0.915026486073581.[0m
[32m[I 2022-04-21 12:12:09,527][0m Trial 223 finished with value: 0.9150095375643426 and parameters: {'alpha': 1.8078542880202806, 'ties': 'breslow'}. Best is trial 140 with value: 0.915026486073581.[0m
[32m[I 2022-04-21 12:12:19,228][0m Trial 224 finished with value: 0.9150266259409126 and parameters: {'alpha': 1.9017160261051502, 'ties': 'breslow'}. Best is trial 224 with value: 0.9150266259409126.[0m
[32m[I 2022-04-21 12:12:26,967][0m Trial 225 finished with value: 0.9150167480009767 and parameters: {'alpha': 1.8590958069292578, 'ties': 'breslow'}. Best is trial 224 with value: 0.9150266259409126.[0m
[32m[I 2022-04-21 12:12:35,770][0m Trial 226 finished with value: 0.9149831565009874 and parameters: {'alpha': 2.032874936774018, 'ties': 'breslow'}. Best is trial 224 with value: 0.9150266259409126.[0m
[32m[I 2022-04-21 12:12:45,560][0m Trial 227 finished with value: 0.9150088309267186 and parameters: {'alpha': 1.7546108573291945, 'ties': 'breslow'}. Best is trial 224 with value: 0.9150266259409126.[0m
[32m[I 2022-04-21 12:12:53,797][0m Trial 228 finished with value: 0.914799052102221 and parameters: {'alpha': 0.4031091176428627, 'ties': 'breslow'}. Best is trial 224 with value: 0.9150266259409126.[0m
[32m[I 2022-04-21 12:13:02,442][0m Trial 229 finished with value: 0.9150260619706214 and parameters: {'alpha': 1.8967828692354687, 'ties': 'breslow'}. Best is trial 224 with value: 0.9150266259409126.[0m
[32m[I 2022-04-21 12:13:11,482][0m Trial 230 finished with value: 0.9150152775556751 and parameters: {'alpha': 1.8248286300630099, 'ties': 'breslow'}. Best is trial 224 with value: 0.9150266259409126.[0m
[32m[I 2022-04-21 12:13:22,141][0m Trial 231 finished with value: 0.9150249511368918 and parameters: {'alpha': 1.9148192921530973, 'ties': 'breslow'}. Best is trial 224 with value: 0.9150266259409126.[0m
[32m[I 2022-04-21 12:13:31,719][0m Trial 232 finished with value: 0.9150261431196054 and parameters: {'alpha': 1.9384333258157984, 'ties': 'breslow'}. Best is trial 224 with value: 0.9150266259409126.[0m
[32m[I 2022-04-21 12:13:43,336][0m Trial 233 finished with value: 0.9149940635685985 and parameters: {'alpha': 2.013742584148037, 'ties': 'breslow'}. Best is trial 224 with value: 0.9150266259409126.[0m
[32m[I 2022-04-21 12:13:51,926][0m Trial 234 finished with value: 0.9150257512178956 and parameters: {'alpha': 1.9076079764044966, 'ties': 'breslow'}. Best is trial 224 with value: 0.9150266259409126.[0m
[32m[I 2022-04-21 12:14:00,082][0m Trial 235 finished with value: 0.9150065663740301 and parameters: {'alpha': 1.745189063130482, 'ties': 'breslow'}. Best is trial 224 with value: 0.9150266259409126.[0m
[32m[I 2022-04-21 12:14:10,194][0m Trial 236 finished with value: 0.9150204449125978 and parameters: {'alpha': 1.9318108683040782, 'ties': 'breslow'}. Best is trial 224 with value: 0.9150266259409126.[0m
[32m[I 2022-04-21 12:14:19,771][0m Trial 237 finished with value: 0.9149720700904851 and parameters: {'alpha': 2.0903645615676956, 'ties': 'breslow'}. Best is trial 224 with value: 0.9150266259409126.[0m
[32m[I 2022-04-21 12:14:29,901][0m Trial 238 finished with value: 0.9150163660052468 and parameters: {'alpha': 1.8461882802104037, 'ties': 'breslow'}. Best is trial 224 with value: 0.9150266259409126.[0m
[32m[I 2022-04-21 12:14:39,854][0m Trial 239 finished with value: 0.9149949947320835 and parameters: {'alpha': 1.9970256454322461, 'ties': 'breslow'}. Best is trial 224 with value: 0.9150266259409126.[0m
[32m[I 2022-04-21 12:14:50,370][0m Trial 240 finished with value: 0.9149839782038516 and parameters: {'alpha': 1.5960027823618093, 'ties': 'breslow'}. Best is trial 224 with value: 0.9150266259409126.[0m
[32m[I 2022-04-21 12:15:00,677][0m Trial 241 finished with value: 0.9150223004433571 and parameters: {'alpha': 1.887316260542039, 'ties': 'breslow'}. Best is trial 224 with value: 0.9150266259409126.[0m
[32m[I 2022-04-21 12:15:09,725][0m Trial 242 finished with value: 0.9150235656915834 and parameters: {'alpha': 1.9799526090418207, 'ties': 'breslow'}. Best is trial 224 with value: 0.9150266259409126.[0m
[32m[I 2022-04-21 12:15:19,720][0m Trial 243 finished with value: 0.9150081602543718 and parameters: {'alpha': 1.7562846144248165, 'ties': 'breslow'}. Best is trial 224 with value: 0.9150266259409126.[0m
[32m[I 2022-04-21 12:15:29,630][0m Trial 244 finished with value: 0.9150166048548247 and parameters: {'alpha': 1.859570096049316, 'ties': 'breslow'}. Best is trial 224 with value: 0.9150266259409126.[0m
[32m[I 2022-04-21 12:15:40,020][0m Trial 245 finished with value: 0.914976052334671 and parameters: {'alpha': 2.0623871636753446, 'ties': 'breslow'}. Best is trial 224 with value: 0.9150266259409126.[0m
[32m[I 2022-04-21 12:15:49,162][0m Trial 246 finished with value: 0.914925551818734 and parameters: {'alpha': 3.451605695775302, 'ties': 'breslow'}. Best is trial 224 with value: 0.9150266259409126.[0m
[32m[I 2022-04-21 12:16:00,369][0m Trial 247 finished with value: 0.9150194325777787 and parameters: {'alpha': 1.9282560561658837, 'ties': 'breslow'}. Best is trial 224 with value: 0.9150266259409126.[0m
[32m[I 2022-04-21 12:16:10,139][0m Trial 248 finished with value: 0.9150061902641282 and parameters: {'alpha': 1.780083494780558, 'ties': 'breslow'}. Best is trial 224 with value: 0.9150266259409126.[0m
[32m[I 2022-04-21 12:16:20,498][0m Trial 249 finished with value: 0.9149736183876923 and parameters: {'alpha': 2.1362400794771212, 'ties': 'breslow'}. Best is trial 224 with value: 0.9150266259409126.[0m
[32m[I 2022-04-21 12:16:31,203][0m Trial 250 finished with value: 0.9150231263551012 and parameters: {'alpha': 1.9837298915616954, 'ties': 'breslow'}. Best is trial 224 with value: 0.9150266259409126.[0m
[32m[I 2022-04-21 12:16:41,841][0m Trial 251 finished with value: 0.9150190431771528 and parameters: {'alpha': 1.851182081397513, 'ties': 'breslow'}. Best is trial 224 with value: 0.9150266259409126.[0m
[32m[I 2022-04-21 12:16:50,719][0m Trial 252 finished with value: 0.9149923993342162 and parameters: {'alpha': 1.6792168313186195, 'ties': 'breslow'}. Best is trial 224 with value: 0.9150266259409126.[0m
[32m[I 2022-04-21 12:17:00,293][0m Trial 253 finished with value: 0.9150212090574612 and parameters: {'alpha': 1.9211951473399107, 'ties': 'breslow'}. Best is trial 224 with value: 0.9150266259409126.[0m
[32m[I 2022-04-21 12:17:10,075][0m Trial 254 finished with value: 0.9149817784134159 and parameters: {'alpha': 2.0474687781368526, 'ties': 'breslow'}. Best is trial 224 with value: 0.9150266259409126.[0m
[32m[I 2022-04-21 12:17:24,762][0m Trial 255 finished with value: 0.9148952329285359 and parameters: {'alpha': 1.789825995778064, 'ties': 'efron'}. Best is trial 224 with value: 0.9150266259409126.[0m
[32m[I 2022-04-21 12:17:35,140][0m Trial 256 finished with value: 0.914970866753254 and parameters: {'alpha': 2.2304957913926695, 'ties': 'breslow'}. Best is trial 224 with value: 0.9150266259409126.[0m
[32m[I 2022-04-21 12:17:45,185][0m Trial 257 finished with value: 0.9150256220890753 and parameters: {'alpha': 1.9074391841175078, 'ties': 'breslow'}. Best is trial 224 with value: 0.9150266259409126.[0m
[32m[I 2022-04-21 12:17:55,295][0m Trial 258 finished with value: 0.9150202938813976 and parameters: {'alpha': 1.92764862590476, 'ties': 'breslow'}. Best is trial 224 with value: 0.9150266259409126.[0m
[32m[I 2022-04-21 12:18:03,676][0m Trial 259 finished with value: 0.9149903375426254 and parameters: {'alpha': 1.6873760058537048, 'ties': 'breslow'}. Best is trial 224 with value: 0.9150266259409126.[0m
[32m[I 2022-04-21 12:18:13,134][0m Trial 260 finished with value: 0.9149712003116044 and parameters: {'alpha': 2.098104577810997, 'ties': 'breslow'}. Best is trial 224 with value: 0.9150266259409126.[0m
[32m[I 2022-04-21 12:18:25,166][0m Trial 261 finished with value: 0.9150145164617397 and parameters: {'alpha': 1.8261128966039033, 'ties': 'breslow'}. Best is trial 224 with value: 0.9150266259409126.[0m
[32m[I 2022-04-21 12:18:33,999][0m Trial 262 finished with value: 0.9149942778957276 and parameters: {'alpha': 1.9956849463434736, 'ties': 'breslow'}. Best is trial 224 with value: 0.9150266259409126.[0m
[32m[I 2022-04-21 12:18:43,368][0m Trial 263 finished with value: 0.9150243810888018 and parameters: {'alpha': 1.8884150703659284, 'ties': 'breslow'}. Best is trial 224 with value: 0.9150266259409126.[0m
[32m[I 2022-04-21 12:18:53,518][0m Trial 264 finished with value: 0.915006936605503 and parameters: {'alpha': 1.7813761155091357, 'ties': 'breslow'}. Best is trial 224 with value: 0.9150266259409126.[0m
[32m[I 2022-04-21 12:19:01,782][0m Trial 265 finished with value: 0.9149697913069936 and parameters: {'alpha': 2.165597793245372, 'ties': 'breslow'}. Best is trial 224 with value: 0.9150266259409126.[0m
[32m[I 2022-04-21 12:19:10,609][0m Trial 266 finished with value: 0.915020294746469 and parameters: {'alpha': 1.875612273491214, 'ties': 'breslow'}. Best is trial 224 with value: 0.9150266259409126.[0m
[32m[I 2022-04-21 12:19:18,451][0m Trial 267 finished with value: 0.9149863901007306 and parameters: {'alpha': 1.6428884998592517, 'ties': 'breslow'}. Best is trial 224 with value: 0.9150266259409126.[0m
[32m[I 2022-04-21 12:19:26,300][0m Trial 268 finished with value: 0.9149752893545955 and parameters: {'alpha': 2.061444694832387, 'ties': 'breslow'}. Best is trial 224 with value: 0.9150266259409126.[0m
[32m[I 2022-04-21 12:19:36,192][0m Trial 269 finished with value: 0.9149935822919938 and parameters: {'alpha': 1.9913853187945574, 'ties': 'breslow'}. Best is trial 224 with value: 0.9150266259409126.[0m
[32m[I 2022-04-21 12:19:45,148][0m Trial 270 finished with value: 0.9150055344435639 and parameters: {'alpha': 1.7478728743258767, 'ties': 'breslow'}. Best is trial 224 with value: 0.9150266259409126.[0m
[32m[I 2022-04-21 12:19:54,428][0m Trial 271 finished with value: 0.915017600978804 and parameters: {'alpha': 1.8701922027940696, 'ties': 'breslow'}. Best is trial 224 with value: 0.9150266259409126.[0m
[32m[I 2022-04-21 12:20:04,214][0m Trial 272 finished with value: 0.9149936262383342 and parameters: {'alpha': 2.0180318969406823, 'ties': 'breslow'}. Best is trial 224 with value: 0.9150266259409126.[0m
[32m[I 2022-04-21 12:20:12,367][0m Trial 273 finished with value: 0.9149719328890017 and parameters: {'alpha': 1.558995495121565, 'ties': 'breslow'}. Best is trial 224 with value: 0.9150266259409126.[0m
[32m[I 2022-04-21 12:20:22,373][0m Trial 274 finished with value: 0.9150147941146523 and parameters: {'alpha': 1.8386541668260261, 'ties': 'breslow'}. Best is trial 224 with value: 0.9150266259409126.[0m
[32m[I 2022-04-21 12:20:33,772][0m Trial 275 finished with value: 0.9149272178422073 and parameters: {'alpha': 1.924053411386055, 'ties': 'efron'}. Best is trial 224 with value: 0.9150266259409126.[0m
[32m[I 2022-04-21 12:20:43,898][0m Trial 276 finished with value: 0.9149939244404545 and parameters: {'alpha': 1.7123707790487863, 'ties': 'breslow'}. Best is trial 224 with value: 0.9150266259409126.[0m
[32m[I 2022-04-21 12:20:53,717][0m Trial 277 finished with value: 0.9149745557008309 and parameters: {'alpha': 2.134282376673684, 'ties': 'breslow'}. Best is trial 224 with value: 0.9150266259409126.[0m
[32m[I 2022-04-21 12:21:01,786][0m Trial 278 finished with value: 0.914994277002729 and parameters: {'alpha': 1.9955393156356136, 'ties': 'breslow'}. Best is trial 224 with value: 0.9150266259409126.[0m
[32m[I 2022-04-21 12:21:10,901][0m Trial 279 finished with value: 0.9150105474555167 and parameters: {'alpha': 1.8101454561214798, 'ties': 'breslow'}. Best is trial 224 with value: 0.9150266259409126.[0m
[32m[I 2022-04-21 12:21:21,006][0m Trial 280 finished with value: 0.9150250434728353 and parameters: {'alpha': 1.9130251536230773, 'ties': 'breslow'}. Best is trial 224 with value: 0.9150266259409126.[0m
[32m[I 2022-04-21 12:21:31,103][0m Trial 281 finished with value: 0.9150237694299447 and parameters: {'alpha': 1.890860144229508, 'ties': 'breslow'}. Best is trial 224 with value: 0.9150266259409126.[0m
[32m[I 2022-04-21 12:21:39,647][0m Trial 282 finished with value: 0.9149922732324705 and parameters: {'alpha': 1.6789287955715122, 'ties': 'breslow'}. Best is trial 224 with value: 0.9150266259409126.[0m
[32m[I 2022-04-21 12:21:48,601][0m Trial 283 finished with value: 0.915009530594976 and parameters: {'alpha': 1.7827649300336321, 'ties': 'breslow'}. Best is trial 224 with value: 0.9150266259409126.[0m
[32m[I 2022-04-21 12:21:57,422][0m Trial 284 finished with value: 0.9149752214932269 and parameters: {'alpha': 2.0704781455765144, 'ties': 'breslow'}. Best is trial 224 with value: 0.9150266259409126.[0m
[32m[I 2022-04-21 12:22:06,165][0m Trial 285 finished with value: 0.915025552142007 and parameters: {'alpha': 1.9134665953362173, 'ties': 'breslow'}. Best is trial 224 with value: 0.9150266259409126.[0m
[32m[I 2022-04-21 12:22:13,586][0m Trial 286 finished with value: 0.9149750809964765 and parameters: {'alpha': 1.512555433790694, 'ties': 'breslow'}. Best is trial 224 with value: 0.9150266259409126.[0m
[32m[I 2022-04-21 12:22:21,914][0m Trial 287 finished with value: 0.9150198970189389 and parameters: {'alpha': 1.8732553968095966, 'ties': 'breslow'}. Best is trial 224 with value: 0.9150266259409126.[0m
[32m[I 2022-04-21 12:22:32,058][0m Trial 288 finished with value: 0.9149991781769268 and parameters: {'alpha': 1.73366732232245, 'ties': 'breslow'}. Best is trial 224 with value: 0.9150266259409126.[0m
[32m[I 2022-04-21 12:22:41,212][0m Trial 289 finished with value: 0.9150258746978617 and parameters: {'alpha': 1.9080038024883779, 'ties': 'breslow'}. Best is trial 224 with value: 0.9150266259409126.[0m
[32m[I 2022-04-21 12:22:50,258][0m Trial 290 finished with value: 0.9149691597142869 and parameters: {'alpha': 2.152455765973765, 'ties': 'breslow'}. Best is trial 224 with value: 0.9150266259409126.[0m
[32m[I 2022-04-21 12:22:58,531][0m Trial 291 finished with value: 0.9150213374344995 and parameters: {'alpha': 1.9673823228859186, 'ties': 'breslow'}. Best is trial 224 with value: 0.9150266259409126.[0m
[32m[I 2022-04-21 12:23:08,473][0m Trial 292 finished with value: 0.914968737639499 and parameters: {'alpha': 2.248752603023619, 'ties': 'breslow'}. Best is trial 224 with value: 0.9150266259409126.[0m
[32m[I 2022-04-21 12:23:18,444][0m Trial 293 finished with value: 0.9150077138701567 and parameters: {'alpha': 1.8027453832685019, 'ties': 'breslow'}. Best is trial 224 with value: 0.9150266259409126.[0m
[32m[I 2022-04-21 12:23:29,223][0m Trial 294 finished with value: 0.9149873252084545 and parameters: {'alpha': 1.6254417521821085, 'ties': 'breslow'}. Best is trial 224 with value: 0.9150266259409126.[0m
[32m[I 2022-04-21 12:23:39,284][0m Trial 295 finished with value: 0.9150217633950776 and parameters: {'alpha': 1.9328102874586117, 'ties': 'breslow'}. Best is trial 224 with value: 0.9150266259409126.[0m
[32m[I 2022-04-21 12:23:48,577][0m Trial 296 finished with value: 0.9149816441718027 and parameters: {'alpha': 2.0414965050459086, 'ties': 'breslow'}. Best is trial 224 with value: 0.9150266259409126.[0m
[32m[I 2022-04-21 12:24:02,486][0m Trial 297 finished with value: 0.9149016121648288 and parameters: {'alpha': 1.8278420240682223, 'ties': 'efron'}. Best is trial 224 with value: 0.9150266259409126.[0m
[32m[I 2022-04-21 12:24:13,650][0m Trial 298 finished with value: 0.9149707544764041 and parameters: {'alpha': 2.0797073124747114, 'ties': 'breslow'}. Best is trial 224 with value: 0.9150266259409126.[0m
[32m[I 2022-04-21 12:24:23,701][0m Trial 299 finished with value: 0.9150009334563661 and parameters: {'alpha': 1.7402558826528962, 'ties': 'breslow'}. Best is trial 224 with value: 0.9150266259409126.[0m
[32m[I 2022-04-21 12:24:32,226][0m Trial 300 finished with value: 0.9150221630571268 and parameters: {'alpha': 1.9231182915118805, 'ties': 'breslow'}. Best is trial 224 with value: 0.9150266259409126.[0m
[32m[I 2022-04-21 12:24:42,482][0m Trial 301 finished with value: 0.9150223698791686 and parameters: {'alpha': 1.9863090959245462, 'ties': 'breslow'}. Best is trial 224 with value: 0.9150266259409126.[0m
[32m[I 2022-04-21 12:24:52,716][0m Trial 302 finished with value: 0.9149084416462341 and parameters: {'alpha': 3.7335356933383164, 'ties': 'breslow'}. Best is trial 224 with value: 0.9150266259409126.[0m
[32m[I 2022-04-21 12:25:02,201][0m Trial 303 finished with value: 0.9150133630635761 and parameters: {'alpha': 1.821169809911553, 'ties': 'breslow'}. Best is trial 224 with value: 0.9150266259409126.[0m
[32m[I 2022-04-21 12:25:12,658][0m Trial 304 finished with value: 0.914985501934374 and parameters: {'alpha': 1.6419546208312141, 'ties': 'breslow'}. Best is trial 224 with value: 0.9150266259409126.[0m
[32m[I 2022-04-21 12:25:22,266][0m Trial 305 finished with value: 0.9149736567391878 and parameters: {'alpha': 2.1754303967745954, 'ties': 'breslow'}. Best is trial 224 with value: 0.9150266259409126.[0m
[32m[I 2022-04-21 12:25:31,581][0m Trial 306 finished with value: 0.9149813942411675 and parameters: {'alpha': 2.04112884332306, 'ties': 'breslow'}. Best is trial 224 with value: 0.9150266259409126.[0m
[32m[I 2022-04-21 12:25:41,023][0m Trial 307 finished with value: 0.9150242474714325 and parameters: {'alpha': 1.8883744651263872, 'ties': 'breslow'}. Best is trial 224 with value: 0.9150266259409126.[0m
[32m[I 2022-04-21 12:25:50,427][0m Trial 308 finished with value: 0.9150009334563661 and parameters: {'alpha': 1.740248267973499, 'ties': 'breslow'}. Best is trial 224 with value: 0.9150266259409126.[0m
[32m[I 2022-04-21 12:26:00,357][0m Trial 309 finished with value: 0.9150247575677246 and parameters: {'alpha': 1.9345940906512993, 'ties': 'breslow'}. Best is trial 224 with value: 0.9150266259409126.[0m
[32m[I 2022-04-21 12:26:10,537][0m Trial 310 finished with value: 0.9149738493030778 and parameters: {'alpha': 2.1023396761143593, 'ties': 'breslow'}. Best is trial 224 with value: 0.9150266259409126.[0m
[32m[I 2022-04-21 12:26:20,265][0m Trial 311 finished with value: 0.9150227077345099 and parameters: {'alpha': 1.9853165079796964, 'ties': 'breslow'}. Best is trial 224 with value: 0.9150266259409126.[0m
[32m[I 2022-04-21 12:26:30,295][0m Trial 312 finished with value: 0.9150150039313729 and parameters: {'alpha': 1.8378610218854634, 'ties': 'breslow'}. Best is trial 224 with value: 0.9150266259409126.[0m
[32m[I 2022-04-21 12:26:39,886][0m Trial 313 finished with value: 0.9149577656012365 and parameters: {'alpha': 2.6940696680419647, 'ties': 'breslow'}. Best is trial 224 with value: 0.9150266259409126.[0m
[32m[I 2022-04-21 12:26:55,457][0m Trial 314 finished with value: 0.9149276856585665 and parameters: {'alpha': 1.9514783091119383, 'ties': 'efron'}. Best is trial 224 with value: 0.9150266259409126.[0m
[32m[I 2022-04-21 12:27:05,907][0m Trial 315 finished with value: 0.9150080171256828 and parameters: {'alpha': 1.7552803833294974, 'ties': 'breslow'}. Best is trial 224 with value: 0.9150266259409126.[0m
[32m[I 2022-04-21 12:27:15,280][0m Trial 316 finished with value: 0.9149715461451711 and parameters: {'alpha': 2.087240351054535, 'ties': 'breslow'}. Best is trial 224 with value: 0.9150266259409126.[0m
[32m[I 2022-04-21 12:27:25,610][0m Trial 317 finished with value: 0.9149674262470533 and parameters: {'alpha': 2.2512896484113285, 'ties': 'breslow'}. Best is trial 224 with value: 0.9150266259409126.[0m
[32m[I 2022-04-21 12:27:34,823][0m Trial 318 finished with value: 0.9150257512178956 and parameters: {'alpha': 1.9077261151998495, 'ties': 'breslow'}. Best is trial 224 with value: 0.9150266259409126.[0m
