[32m[I 2022-04-23 10:58:19,198][0m Trial 449 finished with value: 0.8260273122233153 and parameters: {'n_hidden': 1024, 'mixture_components': 4, 'use_sparse_layer': False, 'use_batchnorm': False, 'use_dropout': False, 'mlp_size_1': 6, 'mlp_size_2': 1, 'mlp_size_3': 0, 'kernel': 'Normal', 'loss_name': 'AlternativeNLLLoss'}. Best is trial 412 with value: 0.927659276427188.[0m
[32m[I 2022-04-23 11:03:39,212][0m Trial 450 finished with value: 0.9265254017390736 and parameters: {'n_hidden': 1024, 'mixture_components': 6, 'use_sparse_layer': False, 'use_batchnorm': False, 'use_dropout': False, 'mlp_size_1': 6, 'mlp_size_2': 1, 'mlp_size_3': 0, 'kernel': 'Normal', 'loss_name': 'AlternativeNLLLoss'}. Best is trial 412 with value: 0.927659276427188.[0m
[32m[I 2022-04-23 11:08:52,741][0m Trial 451 finished with value: 0.8254439015160988 and parameters: {'n_hidden': 1024, 'mixture_components': 5, 'use_sparse_layer': False, 'use_batchnorm': False, 'use_dropout': False, 'mlp_size_1': 6, 'mlp_size_2': 1, 'mlp_size_3': 0, 'kernel': 'Normal', 'loss_name': 'AlternativeNLLLoss'}. Best is trial 412 with value: 0.927659276427188.[0m
[32m[I 2022-04-23 11:13:20,011][0m Trial 452 finished with value: 0.8228444099425491 and parameters: {'n_hidden': 128, 'mixture_components': 8, 'use_sparse_layer': False, 'use_batchnorm': False, 'use_dropout': False, 'mlp_size_1': 4, 'mlp_size_2': 0, 'mlp_size_3': 0, 'kernel': 'Normal', 'loss_name': 'AlternativeNLLLoss'}. Best is trial 412 with value: 0.927659276427188.[0m
[32m[I 2022-04-23 11:18:16,632][0m Trial 453 finished with value: 0.9256435964568984 and parameters: {'n_hidden': 1024, 'mixture_components': 7, 'use_sparse_layer': False, 'use_batchnorm': False, 'use_dropout': False, 'mlp_size_1': 5, 'mlp_size_2': 2, 'mlp_size_3': 0, 'kernel': 'Normal', 'loss_name': 'CensoredNLLLoss'}. Best is trial 412 with value: 0.927659276427188.[0m
[32m[I 2022-04-23 11:23:49,241][0m Trial 454 finished with value: 0.9244305446418245 and parameters: {'n_hidden': 1024, 'mixture_components': 6, 'use_sparse_layer': False, 'use_batchnorm': False, 'use_dropout': False, 'mlp_size_1': 6, 'mlp_size_2': 1, 'mlp_size_3': 0, 'kernel': 'Normal', 'loss_name': 'AlternativeNLLLoss'}. Best is trial 412 with value: 0.927659276427188.[0m
[32m[I 2022-04-23 11:28:37,614][0m Trial 455 finished with value: 0.9258537678196375 and parameters: {'n_hidden': 1024, 'mixture_components': 5, 'use_sparse_layer': False, 'use_batchnorm': False, 'use_dropout': False, 'mlp_size_1': 6, 'mlp_size_2': 1, 'mlp_size_3': 0, 'kernel': 'LogLogistic', 'loss_name': 'AlternativeNLLLoss'}. Best is trial 412 with value: 0.927659276427188.[0m
[32m[I 2022-04-23 11:31:10,673][0m Trial 456 finished with value: -0.5 and parameters: {'n_hidden': 1024, 'mixture_components': 4, 'use_sparse_layer': False, 'use_batchnorm': False, 'use_dropout': False, 'mlp_size_1': 6, 'mlp_size_2': 1, 'mlp_size_3': 0, 'kernel': 'Exponential', 'loss_name': 'AlternativeNLLLoss'}. Best is trial 412 with value: 0.927659276427188.[0m
[32m[I 2022-04-23 11:38:04,708][0m Trial 457 finished with value: 0.9234175461240189 and parameters: {'n_hidden': 64, 'mixture_components': 5, 'use_sparse_layer': False, 'use_batchnorm': False, 'use_dropout': False, 'mlp_size_1': 3, 'mlp_size_2': 0, 'mlp_size_3': 0, 'kernel': 'Normal', 'loss_name': 'AlternativeNLLLoss'}. Best is trial 412 with value: 0.927659276427188.[0m
[32m[I 2022-04-23 11:43:39,910][0m Trial 458 finished with value: 0.9264015163975874 and parameters: {'n_hidden': 1024, 'mixture_components': 6, 'use_sparse_layer': False, 'use_batchnorm': False, 'use_dropout': False, 'mlp_size_1': 6, 'mlp_size_2': 1, 'mlp_size_3': 0, 'kernel': 'Normal', 'loss_name': 'AlternativeNLLLoss'}. Best is trial 412 with value: 0.927659276427188.[0m
[32m[I 2022-04-23 11:53:02,474][0m Trial 459 finished with value: 0.8234643004106017 and parameters: {'n_hidden': 1024, 'mixture_components': 6, 'use_sparse_layer': False, 'use_batchnorm': True, 'use_dropout': True, 'dropout': 0.332673238886289, 'mlp_size_1': 5, 'mlp_size_2': 2, 'mlp_size_3': 0, 'kernel': 'Normal', 'loss_name': 'AlternativeNLLLoss'}. Best is trial 412 with value: 0.927659276427188.[0m
[32m[I 2022-04-23 11:56:25,293][0m Trial 460 finished with value: 0.9160012513781375 and parameters: {'n_hidden': 256, 'mixture_components': 5, 'use_sparse_layer': False, 'use_batchnorm': False, 'use_dropout': False, 'mlp_size_1': 5, 'mlp_size_2': 0, 'mlp_size_3': 0, 'kernel': 'Normal', 'loss_name': 'NLLLoss'}. Best is trial 412 with value: 0.927659276427188.[0m
[32m[I 2022-04-23 12:01:47,494][0m Trial 461 finished with value: 0.9263948821100005 and parameters: {'n_hidden': 1024, 'mixture_components': 4, 'use_sparse_layer': False, 'use_batchnorm': False, 'use_dropout': False, 'mlp_size_1': 6, 'mlp_size_2': 1, 'mlp_size_3': 0, 'kernel': 'Normal', 'loss_name': 'AlternativeNLLLoss'}. Best is trial 412 with value: 0.927659276427188.[0m
[32m[I 2022-04-23 12:08:42,949][0m Trial 462 finished with value: 0.8266720656957351 and parameters: {'n_hidden': 2048, 'mixture_components': 3, 'use_sparse_layer': True, 'use_sparse_loss': True, 'lmbd': 0.002775995058386774, 'use_batchnorm': False, 'use_dropout': False, 'mlp_size_1': 7, 'mlp_size_2': 1, 'mlp_size_3': 0, 'kernel': 'Normal', 'loss_name': 'AlternativeNLLLoss'}. Best is trial 412 with value: 0.927659276427188.[0m
[32m[I 2022-04-23 12:14:21,996][0m Trial 463 finished with value: 0.8264659541828653 and parameters: {'n_hidden': 1024, 'mixture_components': 2, 'use_sparse_layer': False, 'use_batchnorm': False, 'use_dropout': False, 'mlp_size_1': 6, 'mlp_size_2': 1, 'mlp_size_3': 0, 'kernel': 'Normal', 'loss_name': 'CensoredNLLLoss'}. Best is trial 412 with value: 0.927659276427188.[0m
[32m[I 2022-04-23 12:20:05,178][0m Trial 464 finished with value: 0.9251501675825102 and parameters: {'n_hidden': 1024, 'mixture_components': 6, 'use_sparse_layer': False, 'use_batchnorm': False, 'use_dropout': False, 'mlp_size_1': 6, 'mlp_size_2': 1, 'mlp_size_3': 0, 'kernel': 'Normal', 'loss_name': 'AlternativeNLLLoss'}. Best is trial 412 with value: 0.927659276427188.[0m
[32m[I 2022-04-23 12:25:25,224][0m Trial 465 finished with value: 0.9273691332519858 and parameters: {'n_hidden': 1024, 'mixture_components': 5, 'use_sparse_layer': False, 'use_batchnorm': False, 'use_dropout': False, 'mlp_size_1': 6, 'mlp_size_2': 1, 'mlp_size_3': 0, 'kernel': 'Normal', 'loss_name': 'AlternativeNLLLoss'}. Best is trial 412 with value: 0.927659276427188.[0m
[32m[I 2022-04-23 12:30:17,466][0m Trial 466 finished with value: 0.9262415998525135 and parameters: {'n_hidden': 1024, 'mixture_components': 5, 'use_sparse_layer': False, 'use_batchnorm': False, 'use_dropout': False, 'mlp_size_1': 6, 'mlp_size_2': 1, 'mlp_size_3': 0, 'kernel': 'Normal', 'loss_name': 'AlternativeNLLLoss'}. Best is trial 412 with value: 0.927659276427188.[0m
[32m[I 2022-04-23 12:35:06,918][0m Trial 467 finished with value: 0.9266862967868541 and parameters: {'n_hidden': 1024, 'mixture_components': 5, 'use_sparse_layer': False, 'use_batchnorm': False, 'use_dropout': False, 'mlp_size_1': 6, 'mlp_size_2': 1, 'mlp_size_3': 0, 'kernel': 'Normal', 'loss_name': 'AlternativeNLLLoss'}. Best is trial 412 with value: 0.927659276427188.[0m
[32m[I 2022-04-23 12:40:33,823][0m Trial 468 finished with value: 0.9267728928864379 and parameters: {'n_hidden': 1024, 'mixture_components': 5, 'use_sparse_layer': False, 'use_batchnorm': False, 'use_dropout': False, 'mlp_size_1': 6, 'mlp_size_2': 1, 'mlp_size_3': 0, 'kernel': 'Normal', 'loss_name': 'AlternativeNLLLoss'}. Best is trial 412 with value: 0.927659276427188.[0m
[32m[I 2022-04-23 12:43:46,218][0m Trial 469 finished with value: 0.8146215690592504 and parameters: {'n_hidden': 1024, 'mixture_components': 5, 'use_sparse_layer': False, 'use_batchnorm': False, 'use_dropout': False, 'mlp_size_1': 5, 'mlp_size_2': 2, 'mlp_size_3': 0, 'kernel': 'Logistic', 'loss_name': 'AlternativeNLLLoss'}. Best is trial 412 with value: 0.927659276427188.[0m
[32m[I 2022-04-23 12:49:24,964][0m Trial 470 finished with value: 0.926748177918574 and parameters: {'n_hidden': 1024, 'mixture_components': 5, 'use_sparse_layer': False, 'use_batchnorm': False, 'use_dropout': False, 'mlp_size_1': 7, 'mlp_size_2': 0, 'mlp_size_3': 0, 'kernel': 'Normal', 'loss_name': 'AlternativeNLLLoss'}. Best is trial 412 with value: 0.927659276427188.[0m
[32m[I 2022-04-23 12:54:55,244][0m Trial 471 finished with value: 0.9263809098847645 and parameters: {'n_hidden': 1024, 'mixture_components': 5, 'use_sparse_layer': False, 'use_batchnorm': False, 'use_dropout': False, 'mlp_size_1': 6, 'mlp_size_2': 1, 'mlp_size_3': 0, 'kernel': 'Normal', 'loss_name': 'AlternativeNLLLoss'}. Best is trial 412 with value: 0.927659276427188.[0m
[32m[I 2022-04-23 12:59:59,141][0m Trial 472 finished with value: 0.9243917529547199 and parameters: {'n_hidden': 1024, 'mixture_components': 5, 'use_sparse_layer': False, 'use_batchnorm': False, 'use_dropout': False, 'mlp_size_1': 6, 'mlp_size_2': 1, 'mlp_size_3': 0, 'kernel': 'Normal', 'loss_name': 'CensoredNLLLoss'}. Best is trial 412 with value: 0.927659276427188.[0m
[32m[I 2022-04-23 13:05:04,339][0m Trial 473 finished with value: 0.9251285154678788 and parameters: {'n_hidden': 1024, 'mixture_components': 4, 'use_sparse_layer': False, 'use_batchnorm': False, 'use_dropout': False, 'mlp_size_1': 6, 'mlp_size_2': 1, 'mlp_size_3': 0, 'kernel': 'Normal', 'loss_name': 'AlternativeNLLLoss'}. Best is trial 412 with value: 0.927659276427188.[0m
[32m[I 2022-04-23 13:10:25,247][0m Trial 474 finished with value: 0.9272193815720629 and parameters: {'n_hidden': 1024, 'mixture_components': 5, 'use_sparse_layer': False, 'use_batchnorm': False, 'use_dropout': False, 'mlp_size_1': 6, 'mlp_size_2': 1, 'mlp_size_3': 0, 'kernel': 'Normal', 'loss_name': 'AlternativeNLLLoss'}. Best is trial 412 with value: 0.927659276427188.[0m
[32m[I 2022-04-23 13:15:59,257][0m Trial 475 finished with value: 0.9267311655862527 and parameters: {'n_hidden': 1024, 'mixture_components': 6, 'use_sparse_layer': False, 'use_batchnorm': False, 'use_dropout': False, 'mlp_size_1': 6, 'mlp_size_2': 1, 'mlp_size_3': 0, 'kernel': 'Normal', 'loss_name': 'AlternativeNLLLoss'}. Best is trial 412 with value: 0.927659276427188.[0m
[32m[I 2022-04-23 13:23:21,596][0m Trial 476 finished with value: 0.9230578739112059 and parameters: {'n_hidden': 32, 'mixture_components': 5, 'use_sparse_layer': False, 'use_batchnorm': False, 'use_dropout': False, 'mlp_size_1': 2, 'mlp_size_2': 0, 'mlp_size_3': 0, 'kernel': 'Normal', 'loss_name': 'AlternativeNLLLoss'}. Best is trial 412 with value: 0.927659276427188.[0m
[32m[I 2022-04-23 13:28:43,222][0m Trial 477 finished with value: 0.9281730871914304 and parameters: {'n_hidden': 1024, 'mixture_components': 6, 'use_sparse_layer': False, 'use_batchnorm': False, 'use_dropout': False, 'mlp_size_1': 6, 'mlp_size_2': 1, 'mlp_size_3': 0, 'kernel': 'Normal', 'loss_name': 'AlternativeNLLLoss'}. Best is trial 477 with value: 0.9281730871914304.[0m
[32m[I 2022-04-23 13:33:32,012][0m Trial 478 finished with value: 0.6262122377348189 and parameters: {'n_hidden': 1024, 'mixture_components': 6, 'use_sparse_layer': False, 'use_batchnorm': False, 'use_dropout': True, 'dropout': 0.22025426965467498, 'mlp_size_1': 6, 'mlp_size_2': 1, 'mlp_size_3': 0, 'kernel': 'Normal', 'loss_name': 'AlternativeNLLLoss'}. Best is trial 477 with value: 0.9281730871914304.[0m
[32m[I 2022-04-23 13:39:00,137][0m Trial 479 finished with value: 0.9271615733002971 and parameters: {'n_hidden': 1024, 'mixture_components': 6, 'use_sparse_layer': False, 'use_batchnorm': False, 'use_dropout': False, 'mlp_size_1': 6, 'mlp_size_2': 1, 'mlp_size_3': 0, 'kernel': 'Normal', 'loss_name': 'AlternativeNLLLoss'}. Best is trial 477 with value: 0.9281730871914304.[0m
[32m[I 2022-04-23 13:45:26,375][0m Trial 480 finished with value: 0.8142955394309199 and parameters: {'n_hidden': 1024, 'mixture_components': 6, 'use_sparse_layer': False, 'use_batchnorm': True, 'use_dropout': False, 'mlp_size_1': 6, 'mlp_size_2': 1, 'mlp_size_3': 0, 'kernel': 'LogLogistic', 'loss_name': 'AlternativeNLLLoss'}. Best is trial 477 with value: 0.9281730871914304.[0m
[32m[I 2022-04-23 13:50:27,736][0m Trial 481 finished with value: 0.9258159219099065 and parameters: {'n_hidden': 128, 'mixture_components': 6, 'use_sparse_layer': False, 'use_batchnorm': False, 'use_dropout': False, 'mlp_size_1': 4, 'mlp_size_2': 0, 'mlp_size_3': 0, 'kernel': 'Normal', 'loss_name': 'CensoredNLLLoss'}. Best is trial 477 with value: 0.9281730871914304.[0m
[32m[I 2022-04-23 13:52:46,959][0m Trial 482 finished with value: -0.5 and parameters: {'n_hidden': 1024, 'mixture_components': 6, 'use_sparse_layer': False, 'use_batchnorm': False, 'use_dropout': False, 'mlp_size_1': 6, 'mlp_size_2': 1, 'mlp_size_3': 0, 'kernel': 'Exponential', 'loss_name': 'AlternativeNLLLoss'}. Best is trial 477 with value: 0.9281730871914304.[0m
[32m[I 2022-04-23 13:58:06,067][0m Trial 483 finished with value: 0.9264486799713391 and parameters: {'n_hidden': 1024, 'mixture_components': 6, 'use_sparse_layer': True, 'use_sparse_loss': True, 'lmbd': 5.700865846613078e-06, 'use_batchnorm': False, 'use_dropout': False, 'mlp_size_1': 6, 'mlp_size_2': 1, 'mlp_size_3': 0, 'kernel': 'Normal', 'loss_name': 'AlternativeNLLLoss'}. Best is trial 477 with value: 0.9281730871914304.[0m
[32m[I 2022-04-23 14:03:53,111][0m Trial 484 finished with value: 0.9267600907480649 and parameters: {'n_hidden': 1024, 'mixture_components': 6, 'use_sparse_layer': False, 'use_batchnorm': False, 'use_dropout': False, 'mlp_size_1': 6, 'mlp_size_2': 1, 'mlp_size_3': 0, 'kernel': 'Normal', 'loss_name': 'AlternativeNLLLoss'}. Best is trial 477 with value: 0.9281730871914304.[0m
[32m[I 2022-04-23 14:11:08,657][0m Trial 485 finished with value: 0.92221170716344 and parameters: {'n_hidden': 64, 'mixture_components': 6, 'use_sparse_layer': False, 'use_batchnorm': False, 'use_dropout': False, 'mlp_size_1': 3, 'mlp_size_2': 0, 'mlp_size_3': 0, 'kernel': 'Normal', 'loss_name': 'AlternativeNLLLoss'}. Best is trial 477 with value: 0.9281730871914304.[0m
[32m[I 2022-04-23 14:16:10,452][0m Trial 486 finished with value: 0.8271404148570412 and parameters: {'n_hidden': 1024, 'mixture_components': 5, 'use_sparse_layer': False, 'use_batchnorm': False, 'use_dropout': False, 'mlp_size_1': 6, 'mlp_size_2': 1, 'mlp_size_3': 0, 'kernel': 'Normal', 'loss_name': 'AlternativeNLLLoss'}. Best is trial 477 with value: 0.9281730871914304.[0m
[32m[I 2022-04-23 14:19:54,864][0m Trial 487 finished with value: 0.9084321754486252 and parameters: {'n_hidden': 1024, 'mixture_components': 5, 'use_sparse_layer': False, 'use_batchnorm': False, 'use_dropout': False, 'mlp_size_1': 7, 'mlp_size_2': 0, 'mlp_size_3': 0, 'kernel': 'Normal', 'loss_name': 'NLLLoss'}. Best is trial 477 with value: 0.9281730871914304.[0m
[32m[I 2022-04-23 14:25:21,721][0m Trial 488 finished with value: 0.9259708913186614 and parameters: {'n_hidden': 1024, 'mixture_components': 4, 'use_sparse_layer': False, 'use_batchnorm': False, 'use_dropout': False, 'mlp_size_1': 6, 'mlp_size_2': 1, 'mlp_size_3': 0, 'kernel': 'Normal', 'loss_name': 'AlternativeNLLLoss'}. Best is trial 477 with value: 0.9281730871914304.[0m
[32m[I 2022-04-23 14:30:28,953][0m Trial 489 finished with value: 0.9272090696539174 and parameters: {'n_hidden': 1024, 'mixture_components': 6, 'use_sparse_layer': False, 'use_batchnorm': False, 'use_dropout': False, 'mlp_size_1': 6, 'mlp_size_2': 1, 'mlp_size_3': 0, 'kernel': 'Normal', 'loss_name': 'AlternativeNLLLoss'}. Best is trial 477 with value: 0.9281730871914304.[0m
[32m[I 2022-04-23 14:35:06,730][0m Trial 490 finished with value: 0.8227674702878833 and parameters: {'n_hidden': 256, 'mixture_components': 6, 'use_sparse_layer': False, 'use_batchnorm': False, 'use_dropout': False, 'mlp_size_1': 5, 'mlp_size_2': 0, 'mlp_size_3': 0, 'kernel': 'Normal', 'loss_name': 'AlternativeNLLLoss'}. Best is trial 477 with value: 0.9281730871914304.[0m
[32m[I 2022-04-23 14:40:33,718][0m Trial 491 finished with value: 0.9268776619107577 and parameters: {'n_hidden': 1024, 'mixture_components': 6, 'use_sparse_layer': False, 'use_batchnorm': False, 'use_dropout': False, 'mlp_size_1': 6, 'mlp_size_2': 1, 'mlp_size_3': 0, 'kernel': 'Normal', 'loss_name': 'CensoredNLLLoss'}. Best is trial 477 with value: 0.9281730871914304.[0m
[32m[I 2022-04-23 14:46:03,688][0m Trial 492 finished with value: 0.9242793696698349 and parameters: {'n_hidden': 1024, 'mixture_components': 6, 'use_sparse_layer': False, 'use_batchnorm': False, 'use_dropout': False, 'mlp_size_1': 6, 'mlp_size_2': 1, 'mlp_size_3': 0, 'kernel': 'Normal', 'loss_name': 'AlternativeNLLLoss'}. Best is trial 477 with value: 0.9281730871914304.[0m
[32m[I 2022-04-23 14:52:42,170][0m Trial 493 finished with value: 0.9266259076166673 and parameters: {'n_hidden': 2048, 'mixture_components': 6, 'use_sparse_layer': False, 'use_batchnorm': False, 'use_dropout': False, 'mlp_size_1': 6, 'mlp_size_2': 2, 'mlp_size_3': 0, 'kernel': 'Normal', 'loss_name': 'AlternativeNLLLoss'}. Best is trial 477 with value: 0.9281730871914304.[0m
[32m[I 2022-04-23 14:58:07,146][0m Trial 494 finished with value: 0.9240041936228455 and parameters: {'n_hidden': 1024, 'mixture_components': 6, 'use_sparse_layer': False, 'use_batchnorm': False, 'use_dropout': False, 'mlp_size_1': 6, 'mlp_size_2': 1, 'mlp_size_3': 0, 'kernel': 'Normal', 'loss_name': 'AlternativeNLLLoss'}. Best is trial 477 with value: 0.9281730871914304.[0m
[32m[I 2022-04-23 15:03:08,750][0m Trial 495 finished with value: 0.8187623908114163 and parameters: {'n_hidden': 1024, 'mixture_components': 6, 'use_sparse_layer': False, 'use_batchnorm': False, 'use_dropout': False, 'mlp_size_1': 6, 'mlp_size_2': 1, 'mlp_size_3': 0, 'kernel': 'Normal', 'loss_name': 'AlternativeNLLLoss'}. Best is trial 477 with value: 0.9281730871914304.[0m
[32m[I 2022-04-23 15:09:06,314][0m Trial 496 finished with value: 0.9267836804493708 and parameters: {'n_hidden': 1024, 'mixture_components': 6, 'use_sparse_layer': False, 'use_batchnorm': False, 'use_dropout': False, 'mlp_size_1': 6, 'mlp_size_2': 1, 'mlp_size_3': 0, 'kernel': 'Normal', 'loss_name': 'AlternativeNLLLoss'}. Best is trial 477 with value: 0.9281730871914304.[0m
[32m[I 2022-04-23 15:14:40,715][0m Trial 497 finished with value: 0.9270869874451735 and parameters: {'n_hidden': 1024, 'mixture_components': 6, 'use_sparse_layer': False, 'use_batchnorm': False, 'use_dropout': False, 'mlp_size_1': 6, 'mlp_size_2': 1, 'mlp_size_3': 0, 'kernel': 'Normal', 'loss_name': 'AlternativeNLLLoss'}. Best is trial 477 with value: 0.9281730871914304.[0m
[32m[I 2022-04-23 15:19:58,354][0m Trial 498 finished with value: 0.9264388022026363 and parameters: {'n_hidden': 1024, 'mixture_components': 6, 'use_sparse_layer': False, 'use_batchnorm': False, 'use_dropout': False, 'mlp_size_1': 6, 'mlp_size_2': 1, 'mlp_size_3': 0, 'kernel': 'Normal', 'loss_name': 'AlternativeNLLLoss'}. Best is trial 477 with value: 0.9281730871914304.[0m
[32m[I 2022-04-23 15:22:44,605][0m Trial 499 finished with value: 0.40268276373203904 and parameters: {'n_hidden': 1024, 'mixture_components': 6, 'use_sparse_layer': False, 'use_batchnorm': False, 'use_dropout': True, 'dropout': 0.8073625893601717, 'mlp_size_1': 6, 'mlp_size_2': 1, 'mlp_size_3': 0, 'kernel': 'Logistic', 'loss_name': 'AlternativeNLLLoss'}. Best is trial 477 with value: 0.9281730871914304.[0m
[32m[I 2022-04-23 15:28:08,292][0m Trial 500 finished with value: 0.9269455927637267 and parameters: {'n_hidden': 1024, 'mixture_components': 6, 'use_sparse_layer': False, 'use_batchnorm': False, 'use_dropout': False, 'mlp_size_1': 6, 'mlp_size_2': 1, 'mlp_size_3': 0, 'kernel': 'Normal', 'loss_name': 'CensoredNLLLoss'}. Best is trial 477 with value: 0.9281730871914304.[0m
[32m[I 2022-04-23 15:38:46,646][0m Trial 501 finished with value: 0.7193955108299799 and parameters: {'n_hidden': 1024, 'mixture_components': 6, 'use_sparse_layer': False, 'use_batchnorm': True, 'use_dropout': False, 'mlp_size_1': 6, 'mlp_size_2': 1, 'mlp_size_3': 0, 'kernel': 'Normal', 'loss_name': 'AlternativeNLLLoss'}. Best is trial 477 with value: 0.9281730871914304.[0m
[32m[I 2022-04-23 15:44:31,721][0m Trial 502 finished with value: 0.9257988778997689 and parameters: {'n_hidden': 1024, 'mixture_components': 6, 'use_sparse_layer': True, 'use_sparse_loss': False, 'use_batchnorm': False, 'use_dropout': False, 'mlp_size_1': 6, 'mlp_size_2': 1, 'mlp_size_3': 0, 'kernel': 'Normal', 'loss_name': 'AlternativeNLLLoss'}. Best is trial 477 with value: 0.9281730871914304.[0m
[32m[I 2022-04-23 15:49:23,194][0m Trial 503 finished with value: 0.925100093803971 and parameters: {'n_hidden': 1024, 'mixture_components': 4, 'use_sparse_layer': False, 'use_batchnorm': False, 'use_dropout': False, 'mlp_size_1': 6, 'mlp_size_2': 1, 'mlp_size_3': 0, 'kernel': 'Normal', 'loss_name': 'AlternativeNLLLoss'}. Best is trial 477 with value: 0.9281730871914304.[0m
[32m[I 2022-04-23 15:54:55,532][0m Trial 504 finished with value: 0.9263916543254137 and parameters: {'n_hidden': 1024, 'mixture_components': 6, 'use_sparse_layer': False, 'use_batchnorm': False, 'use_dropout': False, 'mlp_size_1': 6, 'mlp_size_2': 1, 'mlp_size_3': 0, 'kernel': 'Normal', 'loss_name': 'AlternativeNLLLoss'}. Best is trial 477 with value: 0.9281730871914304.[0m
[32m[I 2022-04-23 16:02:37,638][0m Trial 505 finished with value: 0.9211197012347567 and parameters: {'n_hidden': 32, 'mixture_components': 7, 'use_sparse_layer': False, 'use_batchnorm': False, 'use_dropout': False, 'mlp_size_1': 2, 'mlp_size_2': 0, 'mlp_size_3': 0, 'kernel': 'Normal', 'loss_name': 'AlternativeNLLLoss'}. Best is trial 477 with value: 0.9281730871914304.[0m
