[32m[I 2022-04-21 17:59:14,776][0m Trial 810 finished with value: 0.7713064877834921 and parameters: {'splitter': 'random', 'min_samples_split': 0.21725614950872882, 'min_samples_leaf': 0.035563714123195034, 'min_weight_fraction_leaf': 0.07840345937210258, 'max_features': 0.6617967594642439}. Best is trial 786 with value: 0.8131474120894296.[0m
[32m[I 2022-04-21 17:59:15,294][0m Trial 811 finished with value: 0.7950481493355436 and parameters: {'splitter': 'random', 'min_samples_split': 0.17366730891186, 'min_samples_leaf': 0.04831012479593646, 'min_weight_fraction_leaf': 0.10466731015859947, 'max_features': 0.9017386637264385}. Best is trial 786 with value: 0.8131474120894296.[0m
[32m[I 2022-04-21 17:59:15,795][0m Trial 812 finished with value: 0.8118070902918568 and parameters: {'splitter': 'random', 'min_samples_split': 0.2076795419196005, 'min_samples_leaf': 0.06339830830113424, 'min_weight_fraction_leaf': 0.09221634511753297, 'max_features': 0.9254856341347616}. Best is trial 786 with value: 0.8131474120894296.[0m
[32m[I 2022-04-21 17:59:16,371][0m Trial 813 finished with value: 0.6936954883523313 and parameters: {'splitter': 'random', 'min_samples_split': 0.2074175939378187, 'min_samples_leaf': 0.05970132397518001, 'min_weight_fraction_leaf': 0.11727467758685507, 'max_features': 0.4156914621942428}. Best is trial 786 with value: 0.8131474120894296.[0m
[32m[I 2022-04-21 17:59:17,239][0m Trial 814 finished with value: 0.7604146064075576 and parameters: {'splitter': 'random', 'min_samples_split': 0.1970451960764359, 'min_samples_leaf': 0.06447220017081765, 'min_weight_fraction_leaf': 0.10905365514407687, 'max_features': 0.944855973808403}. Best is trial 786 with value: 0.8131474120894296.[0m
[32m[I 2022-04-21 17:59:18,162][0m Trial 815 finished with value: 0.7731419115791673 and parameters: {'splitter': 'random', 'min_samples_split': 0.22327266371392704, 'min_samples_leaf': 0.03978234074750163, 'min_weight_fraction_leaf': 0.09713415916454898, 'max_features': 0.9672309380852877}. Best is trial 786 with value: 0.8131474120894296.[0m
[32m[I 2022-04-21 17:59:18,713][0m Trial 816 finished with value: 0.8138778969781588 and parameters: {'splitter': 'random', 'min_samples_split': 0.18324608490374794, 'min_samples_leaf': 0.05367447283923322, 'min_weight_fraction_leaf': 0.0938571969569442, 'max_features': 0.9227379396670219}. Best is trial 816 with value: 0.8138778969781588.[0m
[32m[I 2022-04-21 17:59:19,264][0m Trial 817 finished with value: 0.7964275140437305 and parameters: {'splitter': 'random', 'min_samples_split': 0.14553825035610968, 'min_samples_leaf': 0.05198706052556057, 'min_weight_fraction_leaf': 0.10146282759900292, 'max_features': 0.888435674465098}. Best is trial 816 with value: 0.8138778969781588.[0m
[32m[I 2022-04-21 17:59:19,792][0m Trial 818 finished with value: 0.7672437310246556 and parameters: {'splitter': 'random', 'min_samples_split': 0.19128656264137353, 'min_samples_leaf': 0.04661302381459906, 'min_weight_fraction_leaf': 0.10960918236617462, 'max_features': 0.9238485298108227}. Best is trial 816 with value: 0.8138778969781588.[0m
[32m[I 2022-04-21 17:59:20,152][0m Trial 819 finished with value: 0.6851609036733942 and parameters: {'splitter': 'random', 'min_samples_split': 0.18261262167921058, 'min_samples_leaf': 0.059963786906545434, 'min_weight_fraction_leaf': 0.3929343846589609, 'max_features': 0.9064927626540251}. Best is trial 816 with value: 0.8138778969781588.[0m
[32m[I 2022-04-21 17:59:20,722][0m Trial 820 finished with value: 0.7683738991383459 and parameters: {'splitter': 'random', 'min_samples_split': 0.17804610293323503, 'min_samples_leaf': 0.0394599921365196, 'min_weight_fraction_leaf': 0.0939733212891811, 'max_features': 0.9457214879117349}. Best is trial 816 with value: 0.8138778969781588.[0m
[32m[I 2022-04-21 17:59:21,484][0m Trial 821 finished with value: 0.7683738991383459 and parameters: {'splitter': 'random', 'min_samples_split': 0.16923283798333502, 'min_samples_leaf': 0.05481243528947879, 'min_weight_fraction_leaf': 0.0936325264109269, 'max_features': 0.9306002365195049}. Best is trial 816 with value: 0.8138778969781588.[0m
[32m[I 2022-04-21 17:59:22,683][0m Trial 822 finished with value: 0.775676330893629 and parameters: {'splitter': 'random', 'min_samples_split': 0.20762339186462114, 'min_samples_leaf': 0.044486366698168495, 'min_weight_fraction_leaf': 0.0876499031404661, 'max_features': 0.9649973618333114}. Best is trial 816 with value: 0.8138778969781588.[0m
[32m[I 2022-04-21 17:59:23,526][0m Trial 823 finished with value: 0.7603326408058964 and parameters: {'splitter': 'random', 'min_samples_split': 0.18583323401516463, 'min_samples_leaf': 0.06008876413948769, 'min_weight_fraction_leaf': 0.11897055889805772, 'max_features': 0.9462063517991935}. Best is trial 816 with value: 0.8138778969781588.[0m
[32m[I 2022-04-21 17:59:23,848][0m Trial 824 finished with value: 0.7571356357837435 and parameters: {'splitter': 'random', 'min_samples_split': 0.19990180319108375, 'min_samples_leaf': 0.18458456696410758, 'min_weight_fraction_leaf': 0.10198817171132846, 'max_features': 0.8613749103255304}. Best is trial 816 with value: 0.8138778969781588.[0m
[32m[I 2022-04-21 17:59:24,324][0m Trial 825 finished with value: 0.8109156144305031 and parameters: {'splitter': 'random', 'min_samples_split': 0.2139386300366302, 'min_samples_leaf': 0.06669119384173958, 'min_weight_fraction_leaf': 0.08911562732739789, 'max_features': 0.919531593550541}. Best is trial 816 with value: 0.8138778969781588.[0m
[32m[I 2022-04-21 18:01:15,197][0m Trial 826 finished with value: 0.7821670488513982 and parameters: {'splitter': 'best', 'min_samples_split': 0.2321482116474114, 'min_samples_leaf': 0.05008459497824029, 'min_weight_fraction_leaf': 0.10335866891818825, 'max_features': 0.8888045202143829}. Best is trial 816 with value: 0.8138778969781588.[0m
[32m[I 2022-04-21 18:01:15,806][0m Trial 827 finished with value: 0.8122382536681017 and parameters: {'splitter': 'random', 'min_samples_split': 0.19347238552732066, 'min_samples_leaf': 0.03513939629154879, 'min_weight_fraction_leaf': 0.08687950913810548, 'max_features': 0.9293186810730975}. Best is trial 816 with value: 0.8138778969781588.[0m
[32m[I 2022-04-21 18:01:16,389][0m Trial 828 finished with value: 0.766889522743911 and parameters: {'splitter': 'random', 'min_samples_split': 0.15945306816001792, 'min_samples_leaf': 0.032209297246902385, 'min_weight_fraction_leaf': 0.09937023881330478, 'max_features': 0.9432385215953552}. Best is trial 816 with value: 0.8138778969781588.[0m
[32m[I 2022-04-21 18:01:17,369][0m Trial 829 finished with value: 0.7719324174672123 and parameters: {'splitter': 'random', 'min_samples_split': 0.17832469456401762, 'min_samples_leaf': 0.03295454372440995, 'min_weight_fraction_leaf': 0.10743356735873025, 'max_features': 0.9714561318253297}. Best is trial 816 with value: 0.8138778969781588.[0m
[32m[I 2022-04-21 18:01:19,139][0m Trial 830 finished with value: 0.8114112826585449 and parameters: {'splitter': 'random', 'min_samples_split': 0.19089656573798544, 'min_samples_leaf': 0.04052047449612985, 'min_weight_fraction_leaf': 0.08870778125997944, 'max_features': 0.9105612907900585}. Best is trial 816 with value: 0.8138778969781588.[0m
[32m[I 2022-04-21 18:01:19,880][0m Trial 831 finished with value: 0.7974219172465695 and parameters: {'splitter': 'random', 'min_samples_split': 0.18880303534605206, 'min_samples_leaf': 0.04207951682349362, 'min_weight_fraction_leaf': 0.12479237356500675, 'max_features': 0.9018286400124641}. Best is trial 816 with value: 0.8138778969781588.[0m
[32m[I 2022-04-21 18:01:20,393][0m Trial 832 finished with value: 0.8026252493996646 and parameters: {'splitter': 'random', 'min_samples_split': 0.16566489449252964, 'min_samples_leaf': 0.050454469927226755, 'min_weight_fraction_leaf': 0.09649410755832917, 'max_features': 0.9226646399225803}. Best is trial 816 with value: 0.8138778969781588.[0m
[32m[I 2022-04-21 18:01:20,975][0m Trial 833 finished with value: 0.7599396771893412 and parameters: {'splitter': 'random', 'min_samples_split': 0.1977132299192726, 'min_samples_leaf': 0.04148725254935524, 'min_weight_fraction_leaf': 0.11328062078989518, 'max_features': 0.940846341727142}. Best is trial 816 with value: 0.8138778969781588.[0m
[32m[I 2022-04-21 18:01:21,273][0m Trial 834 finished with value: 0.7470560610037319 and parameters: {'splitter': 'random', 'min_samples_split': 0.1823608472186404, 'min_samples_leaf': 0.2413271273876827, 'min_weight_fraction_leaf': 0.09082938130379996, 'max_features': 0.888991880891684}. Best is trial 816 with value: 0.8138778969781588.[0m
[32m[I 2022-04-21 18:01:21,816][0m Trial 835 finished with value: 0.7857292911203255 and parameters: {'splitter': 'random', 'min_samples_split': 0.19287298657606888, 'min_samples_leaf': 0.04413576460408455, 'min_weight_fraction_leaf': 0.08837113639429758, 'max_features': 0.964293117810822}. Best is trial 816 with value: 0.8138778969781588.[0m
[32m[I 2022-04-21 18:01:22,415][0m Trial 836 finished with value: 0.810626858487724 and parameters: {'splitter': 'random', 'min_samples_split': 0.20582210008232296, 'min_samples_leaf': 0.055971404851188074, 'min_weight_fraction_leaf': 0.0842426209763712, 'max_features': 0.9134220907590447}. Best is trial 816 with value: 0.8138778969781588.[0m
[32m[I 2022-04-21 18:01:22,892][0m Trial 837 finished with value: 0.7640334787079823 and parameters: {'splitter': 'random', 'min_samples_split': 0.17661016809157232, 'min_samples_leaf': 0.06371062307921826, 'min_weight_fraction_leaf': 0.1024677221314383, 'max_features': 0.9334972787025235}. Best is trial 816 with value: 0.8138778969781588.[0m
[32m[I 2022-04-21 18:01:23,979][0m Trial 838 finished with value: 0.7736441906372783 and parameters: {'splitter': 'random', 'min_samples_split': 0.18790655108622992, 'min_samples_leaf': 0.03642489839505757, 'min_weight_fraction_leaf': 0.09410641482497528, 'max_features': 0.8658769823905994}. Best is trial 816 with value: 0.8138778969781588.[0m
[32m[I 2022-04-21 18:01:24,940][0m Trial 839 finished with value: 0.7922666996614897 and parameters: {'splitter': 'random', 'min_samples_split': 0.20128746343661647, 'min_samples_leaf': 0.04830060577351617, 'min_weight_fraction_leaf': 0.08316858910669671, 'max_features': 0.9523744165765311}. Best is trial 816 with value: 0.8138778969781588.[0m
[32m[I 2022-04-21 18:01:25,960][0m Trial 840 finished with value: 0.7989883908314254 and parameters: {'splitter': 'random', 'min_samples_split': 0.2136574960268663, 'min_samples_leaf': 0.05465171128814746, 'min_weight_fraction_leaf': 0.1323001527394266, 'max_features': 0.90362864793568}. Best is trial 816 with value: 0.8138778969781588.[0m
[32m[I 2022-04-21 18:01:26,570][0m Trial 841 finished with value: 0.81405645651816 and parameters: {'splitter': 'random', 'min_samples_split': 0.19515428763717937, 'min_samples_leaf': 0.036636088476742046, 'min_weight_fraction_leaf': 0.09406212541692716, 'max_features': 0.9266165008803299}. Best is trial 841 with value: 0.81405645651816.[0m
[32m[I 2022-04-21 18:01:27,136][0m Trial 842 finished with value: 0.7723243810292996 and parameters: {'splitter': 'random', 'min_samples_split': 0.20258358312875724, 'min_samples_leaf': 0.036055342073128306, 'min_weight_fraction_leaf': 0.10311319007373303, 'max_features': 0.9600673448694551}. Best is trial 841 with value: 0.81405645651816.[0m
[32m[I 2022-04-21 18:01:27,478][0m Trial 843 finished with value: 0.6853429419932293 and parameters: {'splitter': 'random', 'min_samples_split': 0.17278312137562357, 'min_samples_leaf': 0.06687099597669081, 'min_weight_fraction_leaf': 0.09639395483453242, 'max_features': 0.2556733109310878}. Best is trial 841 with value: 0.81405645651816.[0m
[32m[I 2022-04-21 18:01:28,244][0m Trial 844 finished with value: 0.7969658937357031 and parameters: {'splitter': 'random', 'min_samples_split': 0.21915894351453188, 'min_samples_leaf': 0.03530965661078815, 'min_weight_fraction_leaf': 0.08158207473088507, 'max_features': 0.8858308731194566}. Best is trial 841 with value: 0.81405645651816.[0m
[32m[I 2022-04-21 18:01:28,917][0m Trial 845 finished with value: 0.7604146064075576 and parameters: {'splitter': 'random', 'min_samples_split': 0.20882821086371697, 'min_samples_leaf': 0.05704023543713098, 'min_weight_fraction_leaf': 0.10747097485979168, 'max_features': 0.9369032238816908}. Best is trial 841 with value: 0.81405645651816.[0m
[32m[I 2022-04-21 18:03:08,066][0m Trial 846 finished with value: 0.7778300008989885 and parameters: {'splitter': 'best', 'min_samples_split': 0.21982946288736827, 'min_samples_leaf': 0.06563623942793484, 'min_weight_fraction_leaf': 0.11530134026002638, 'max_features': 0.804457054368371}. Best is trial 841 with value: 0.81405645651816.[0m
[32m[I 2022-04-21 18:03:08,627][0m Trial 847 finished with value: 0.81405645651816 and parameters: {'splitter': 'random', 'min_samples_split': 0.19514565631873568, 'min_samples_leaf': 0.0462818369685763, 'min_weight_fraction_leaf': 0.0943965544338714, 'max_features': 0.9288768081738933}. Best is trial 841 with value: 0.81405645651816.[0m
[32m[I 2022-04-21 18:03:09,544][0m Trial 848 finished with value: 0.7720965784000893 and parameters: {'splitter': 'random', 'min_samples_split': 0.20174001455438592, 'min_samples_leaf': 0.051726597144863835, 'min_weight_fraction_leaf': 0.12153671302802321, 'max_features': 0.9756133246826363}. Best is trial 841 with value: 0.81405645651816.[0m
[32m[I 2022-04-21 18:03:10,359][0m Trial 849 finished with value: 0.760240958952549 and parameters: {'splitter': 'random', 'min_samples_split': 0.20904554166091888, 'min_samples_leaf': 0.06969618714489861, 'min_weight_fraction_leaf': 0.11000387030368632, 'max_features': 0.949661261956526}. Best is trial 841 with value: 0.81405645651816.[0m
[32m[I 2022-04-21 18:03:11,124][0m Trial 850 finished with value: 0.8130902205849437 and parameters: {'splitter': 'random', 'min_samples_split': 0.1829683252466965, 'min_samples_leaf': 0.06375332717864561, 'min_weight_fraction_leaf': 0.07842030010212755, 'max_features': 0.9289686280944023}. Best is trial 841 with value: 0.81405645651816.[0m
[32m[I 2022-04-21 18:03:12,131][0m Trial 851 finished with value: 0.8073000540135682 and parameters: {'splitter': 'random', 'min_samples_split': 0.18105961724536196, 'min_samples_leaf': 0.05895939271960912, 'min_weight_fraction_leaf': 0.0965408223984147, 'max_features': 0.9779367858171787}. Best is trial 841 with value: 0.81405645651816.[0m
[32m[I 2022-04-21 18:03:13,095][0m Trial 852 finished with value: 0.7887511950181615 and parameters: {'splitter': 'random', 'min_samples_split': 0.17392759450072204, 'min_samples_leaf': 0.051104607654546386, 'min_weight_fraction_leaf': 0.08427253303583833, 'max_features': 0.9499289757871949}. Best is trial 841 with value: 0.81405645651816.[0m
[32m[I 2022-04-21 18:03:13,949][0m Trial 853 finished with value: 0.7594491636389396 and parameters: {'splitter': 'random', 'min_samples_split': 0.18552035638728162, 'min_samples_leaf': 0.06134360094757167, 'min_weight_fraction_leaf': 0.2350985827102918, 'max_features': 0.931366547685961}. Best is trial 841 with value: 0.81405645651816.[0m
[32m[I 2022-04-21 18:03:14,742][0m Trial 854 finished with value: 0.7741498796916009 and parameters: {'splitter': 'random', 'min_samples_split': 0.19229174124583118, 'min_samples_leaf': 0.06821992916335956, 'min_weight_fraction_leaf': 0.09584508757226841, 'max_features': 0.9653534987855595}. Best is trial 841 with value: 0.81405645651816.[0m
[32m[I 2022-04-21 18:03:15,853][0m Trial 855 finished with value: 0.7926669874429307 and parameters: {'splitter': 'random', 'min_samples_split': 0.1572980266750824, 'min_samples_leaf': 0.04731657573230639, 'min_weight_fraction_leaf': 0.08156389241827833, 'max_features': 0.9376274221702331}. Best is trial 841 with value: 0.81405645651816.[0m
[32m[I 2022-04-21 18:03:16,600][0m Trial 856 finished with value: 0.7980151116536407 and parameters: {'splitter': 'random', 'min_samples_split': 0.22735175552033382, 'min_samples_leaf': 0.03121718864623565, 'min_weight_fraction_leaf': 0.08005435865031105, 'max_features': 0.9519867319543878}. Best is trial 841 with value: 0.81405645651816.[0m
[32m[I 2022-04-21 18:03:17,085][0m Trial 857 finished with value: 0.7683738991383459 and parameters: {'splitter': 'random', 'min_samples_split': 0.1815564265420366, 'min_samples_leaf': 0.05706802626232419, 'min_weight_fraction_leaf': 0.09600281675134327, 'max_features': 0.930955594147699}. Best is trial 841 with value: 0.81405645651816.[0m
[32m[I 2022-04-21 18:03:17,535][0m Trial 858 finished with value: 0.7689568660930187 and parameters: {'splitter': 'random', 'min_samples_split': 0.1967782490191967, 'min_samples_leaf': 0.06738764366216, 'min_weight_fraction_leaf': 0.11268231340301312, 'max_features': 0.9192123048168138}. Best is trial 841 with value: 0.81405645651816.[0m
[32m[I 2022-04-21 18:03:18,167][0m Trial 859 finished with value: 0.8109241414219486 and parameters: {'splitter': 'random', 'min_samples_split': 0.1666026244395604, 'min_samples_leaf': 0.044151156919857194, 'min_weight_fraction_leaf': 0.07833898195859632, 'max_features': 0.978760954744441}. Best is trial 841 with value: 0.81405645651816.[0m
[32m[I 2022-04-21 18:03:18,744][0m Trial 860 finished with value: 0.7604146064075576 and parameters: {'splitter': 'random', 'min_samples_split': 0.21788402905453122, 'min_samples_leaf': 0.05659482186471496, 'min_weight_fraction_leaf': 0.10310809789101058, 'max_features': 0.95127087551488}. Best is trial 841 with value: 0.81405645651816.[0m
[32m[I 2022-04-21 18:03:19,357][0m Trial 861 finished with value: 0.797004317397622 and parameters: {'splitter': 'random', 'min_samples_split': 0.2121786780320597, 'min_samples_leaf': 0.07127775479847677, 'min_weight_fraction_leaf': 0.09017716719477255, 'max_features': 0.8988343004419797}. Best is trial 841 with value: 0.81405645651816.[0m
[32m[I 2022-04-21 18:03:19,971][0m Trial 862 finished with value: 0.810095230018675 and parameters: {'splitter': 'random', 'min_samples_split': 0.23051661589323158, 'min_samples_leaf': 0.03380869897891139, 'min_weight_fraction_leaf': 0.07718872287299483, 'max_features': 0.9276493497430082}. Best is trial 841 with value: 0.81405645651816.[0m
[32m[I 2022-04-21 18:03:20,554][0m Trial 863 finished with value: 0.8122382536681017 and parameters: {'splitter': 'random', 'min_samples_split': 0.1910195986561103, 'min_samples_leaf': 0.048047784780949884, 'min_weight_fraction_leaf': 0.08751205264081152, 'max_features': 0.9114301422114691}. Best is trial 841 with value: 0.81405645651816.[0m
[32m[I 2022-04-21 18:05:05,026][0m Trial 864 finished with value: 0.7816797235114026 and parameters: {'splitter': 'best', 'min_samples_split': 0.19678177174914108, 'min_samples_leaf': 0.06348759484990017, 'min_weight_fraction_leaf': 0.07824849980546178, 'max_features': 0.8794625786841274}. Best is trial 841 with value: 0.81405645651816.[0m
[32m[I 2022-04-21 18:05:05,530][0m Trial 865 finished with value: 0.7971038134617532 and parameters: {'splitter': 'random', 'min_samples_split': 0.20848717412695825, 'min_samples_leaf': 0.04955773913686982, 'min_weight_fraction_leaf': 0.08620755364844743, 'max_features': 0.9032211864574464}. Best is trial 841 with value: 0.81405645651816.[0m
[32m[I 2022-04-21 18:05:06,004][0m Trial 866 finished with value: 0.7950481493355436 and parameters: {'splitter': 'random', 'min_samples_split': 0.1901639170829552, 'min_samples_leaf': 0.05781009086276406, 'min_weight_fraction_leaf': 0.10421792760288742, 'max_features': 0.9004979182306302}. Best is trial 841 with value: 0.81405645651816.[0m
[32m[I 2022-04-21 18:05:06,479][0m Trial 867 finished with value: 0.8009685914141167 and parameters: {'splitter': 'random', 'min_samples_split': 0.2230917033421976, 'min_samples_leaf': 0.07043361597650633, 'min_weight_fraction_leaf': 0.0742815173537753, 'max_features': 0.9409213271704152}. Best is trial 841 with value: 0.81405645651816.[0m
[32m[I 2022-04-21 18:05:06,935][0m Trial 868 finished with value: 0.7629787824508487 and parameters: {'splitter': 'random', 'min_samples_split': 0.20266294866650658, 'min_samples_leaf': 0.05091559927885805, 'min_weight_fraction_leaf': 0.14371325726107145, 'max_features': 0.9121234325030109}. Best is trial 841 with value: 0.81405645651816.[0m
[32m[I 2022-04-21 18:05:07,389][0m Trial 869 finished with value: 0.7762683710639544 and parameters: {'splitter': 'random', 'min_samples_split': 0.21444870833901386, 'min_samples_leaf': 0.0626765872733119, 'min_weight_fraction_leaf': 0.09429022293908619, 'max_features': 0.8820255375538704}. Best is trial 841 with value: 0.81405645651816.[0m
[32m[I 2022-04-21 18:05:07,983][0m Trial 870 finished with value: 0.7897581309279001 and parameters: {'splitter': 'random', 'min_samples_split': 0.19611255515747975, 'min_samples_leaf': 0.06905028678234461, 'min_weight_fraction_leaf': 0.08047343093127006, 'max_features': 0.8552480152864184}. Best is trial 841 with value: 0.81405645651816.[0m
[32m[I 2022-04-21 18:05:08,593][0m Trial 871 finished with value: 0.8009685914141167 and parameters: {'splitter': 'random', 'min_samples_split': 0.227731730451409, 'min_samples_leaf': 0.07229286777366704, 'min_weight_fraction_leaf': 0.07386948106343381, 'max_features': 0.9326489161764546}. Best is trial 841 with value: 0.81405645651816.[0m
[32m[I 2022-04-21 18:05:09,090][0m Trial 872 finished with value: 0.7757083619500019 and parameters: {'splitter': 'random', 'min_samples_split': 0.23813566011325962, 'min_samples_leaf': 0.051126398544222046, 'min_weight_fraction_leaf': 0.08764936862997995, 'max_features': 0.9632685495668201}. Best is trial 841 with value: 0.81405645651816.[0m
