No protocol specified
[32m[I 2022-04-21 11:35:50,320][0m A new study created in memory with name: no-name-a9cee04a-eb26-468f-afb9-2f4648c4f2dc[0m
[32m[I 2022-04-21 11:35:50,922][0m Trial 0 finished with value: 0.25 and parameters: {'splitter': 'random', 'min_samples_split': 0.4072481478078783, 'min_samples_leaf': 0.47172424975631655, 'min_weight_fraction_leaf': 0.28968730818185806, 'max_features': 0.33348198380598615}. Best is trial 0 with value: 0.25.[0m
[32m[I 2022-04-21 11:35:52,357][0m Trial 1 finished with value: 0.2497431534278292 and parameters: {'splitter': 'best', 'min_samples_split': 0.13414586443942395, 'min_samples_leaf': 0.3438357424775086, 'min_weight_fraction_leaf': 0.22808797826640803, 'max_features': 0.015456415772838406}. Best is trial 0 with value: 0.25.[0m
[32m[I 2022-04-21 11:35:56,770][0m Trial 2 finished with value: 0.2828328603381454 and parameters: {'splitter': 'best', 'min_samples_split': 0.22414631178686303, 'min_samples_leaf': 0.4402295262934089, 'min_weight_fraction_leaf': 0.17781199640210021, 'max_features': 0.7560221658908415}. Best is trial 2 with value: 0.2828328603381454.[0m
[32m[I 2022-04-21 11:35:57,906][0m Trial 3 finished with value: 0.278994822974659 and parameters: {'splitter': 'best', 'min_samples_split': 0.4435715148928608, 'min_samples_leaf': 0.490683083680449, 'min_weight_fraction_leaf': 0.34965033986680055, 'max_features': 0.6142438677468558}. Best is trial 2 with value: 0.2828328603381454.[0m
[32m[I 2022-04-21 11:35:58,476][0m Trial 4 finished with value: 0.25 and parameters: {'splitter': 'random', 'min_samples_split': 0.4196721886699619, 'min_samples_leaf': 0.32137727191415266, 'min_weight_fraction_leaf': 0.26230853730861653, 'max_features': 0.1927865579084853}. Best is trial 2 with value: 0.2828328603381454.[0m
[32m[I 2022-04-21 11:36:00,205][0m Trial 5 finished with value: 0.33171227637632716 and parameters: {'splitter': 'best', 'min_samples_split': 0.4407026857100789, 'min_samples_leaf': 0.23400159359417372, 'min_weight_fraction_leaf': 0.3129797336476829, 'max_features': 0.04796869865539555}. Best is trial 5 with value: 0.33171227637632716.[0m
[32m[I 2022-04-21 11:36:35,642][0m Trial 6 finished with value: 0.3277299289850921 and parameters: {'splitter': 'best', 'min_samples_split': 0.28754675137994856, 'min_samples_leaf': 0.19631347113294456, 'min_weight_fraction_leaf': 0.14746671838006614, 'max_features': 0.778483790829835}. Best is trial 5 with value: 0.33171227637632716.[0m
[32m[I 2022-04-21 11:36:38,155][0m Trial 7 finished with value: 0.2826039517414384 and parameters: {'splitter': 'best', 'min_samples_split': 0.21621326350619552, 'min_samples_leaf': 0.46878613154746895, 'min_weight_fraction_leaf': 0.3216627942358384, 'max_features': 0.8896062821304255}. Best is trial 5 with value: 0.33171227637632716.[0m
[32m[I 2022-04-21 11:36:38,813][0m Trial 8 finished with value: 0.25 and parameters: {'splitter': 'random', 'min_samples_split': 0.33242180202947047, 'min_samples_leaf': 0.3203067906590273, 'min_weight_fraction_leaf': 0.436777257837369, 'max_features': 0.4521413965906079}. Best is trial 5 with value: 0.33171227637632716.[0m
[32m[I 2022-04-21 11:36:39,784][0m Trial 9 finished with value: 0.274193828324201 and parameters: {'splitter': 'best', 'min_samples_split': 0.3148067149210259, 'min_samples_leaf': 0.49535049788595886, 'min_weight_fraction_leaf': 0.02635989923908849, 'max_features': 0.9372593360444196}. Best is trial 5 with value: 0.33171227637632716.[0m
[32m[I 2022-04-21 11:36:42,656][0m Trial 10 finished with value: 0.24524347699111657 and parameters: {'splitter': 'best', 'min_samples_split': 0.027684688192684187, 'min_samples_leaf': 0.046239013491062436, 'min_weight_fraction_leaf': 0.49206382365557977, 'max_features': 0.05687991950727714}. Best is trial 5 with value: 0.33171227637632716.[0m
[32m[I 2022-04-21 11:37:26,234][0m Trial 11 finished with value: 0.8499172765957258 and parameters: {'splitter': 'best', 'min_samples_split': 0.32575662135399247, 'min_samples_leaf': 0.15022632836462563, 'min_weight_fraction_leaf': 0.12669139531067306, 'max_features': 0.6052507243152396}. Best is trial 11 with value: 0.8499172765957258.[0m
[32m[I 2022-04-21 11:38:10,226][0m Trial 12 finished with value: 0.2857254397969234 and parameters: {'splitter': 'best', 'min_samples_split': 0.49319227009175637, 'min_samples_leaf': 0.1570541125965879, 'min_weight_fraction_leaf': 0.07327682320269555, 'max_features': 0.574467198200083}. Best is trial 11 with value: 0.8499172765957258.[0m
[32m[I 2022-04-21 11:39:00,236][0m Trial 13 finished with value: 0.6102210002515662 and parameters: {'splitter': 'best', 'min_samples_split': 0.36865129464727214, 'min_samples_leaf': 0.08392868253294583, 'min_weight_fraction_leaf': 0.08922123678581634, 'max_features': 0.338672521470192}. Best is trial 11 with value: 0.8499172765957258.[0m
[32m[I 2022-04-21 11:39:02,315][0m Trial 14 finished with value: 0.36391903775901974 and parameters: {'splitter': 'random', 'min_samples_split': 0.35415507753321573, 'min_samples_leaf': 0.08322665324299315, 'min_weight_fraction_leaf': 0.10745120524958401, 'max_features': 0.39489046393399974}. Best is trial 11 with value: 0.8499172765957258.[0m
[32m[I 2022-04-21 11:41:36,532][0m Trial 15 finished with value: 0.8967637954490966 and parameters: {'splitter': 'best', 'min_samples_split': 0.15642906182542762, 'min_samples_leaf': 0.006097131329297789, 'min_weight_fraction_leaf': 0.0026056078871731364, 'max_features': 0.6362987049749824}. Best is trial 15 with value: 0.8967637954490966.[0m
[32m[I 2022-04-21 11:42:36,079][0m Trial 16 finished with value: 0.8538321656297129 and parameters: {'splitter': 'best', 'min_samples_split': 0.14397621405648084, 'min_samples_leaf': 0.1377288928393388, 'min_weight_fraction_leaf': 0.015722990367676312, 'max_features': 0.6720356551972397}. Best is trial 15 with value: 0.8967637954490966.[0m
[32m[I 2022-04-21 11:45:40,257][0m Trial 17 finished with value: 0.8903551076444189 and parameters: {'splitter': 'best', 'min_samples_split': 0.1426688785890038, 'min_samples_leaf': 0.004088713241238291, 'min_weight_fraction_leaf': 0.011938600952194388, 'max_features': 0.7305096023886295}. Best is trial 15 with value: 0.8967637954490966.[0m
[32m[I 2022-04-21 11:45:42,848][0m Trial 18 finished with value: 0.9028588885846606 and parameters: {'splitter': 'random', 'min_samples_split': 0.04056521723871992, 'min_samples_leaf': 0.01646518893947143, 'min_weight_fraction_leaf': 0.016365010550971355, 'max_features': 0.8162986684494806}. Best is trial 18 with value: 0.9028588885846606.[0m
[32m[I 2022-04-21 11:45:45,026][0m Trial 19 finished with value: 0.8797245818194697 and parameters: {'splitter': 'random', 'min_samples_split': 0.02126632734963671, 'min_samples_leaf': 0.003483028083260486, 'min_weight_fraction_leaf': 0.21169026903428192, 'max_features': 0.9993652874602776}. Best is trial 18 with value: 0.9028588885846606.[0m
[32m[I 2022-04-21 11:45:45,915][0m Trial 20 finished with value: 0.8941704631046383 and parameters: {'splitter': 'random', 'min_samples_split': 0.09164548447172004, 'min_samples_leaf': 0.07421305621251019, 'min_weight_fraction_leaf': 0.060988695566073475, 'max_features': 0.51949918861082}. Best is trial 18 with value: 0.9028588885846606.[0m
[32m[I 2022-04-21 11:45:46,953][0m Trial 21 finished with value: 0.897288420825103 and parameters: {'splitter': 'random', 'min_samples_split': 0.07484827338092573, 'min_samples_leaf': 0.06513145374806972, 'min_weight_fraction_leaf': 0.05694747179598593, 'max_features': 0.8526054431751655}. Best is trial 18 with value: 0.9028588885846606.[0m
[32m[I 2022-04-21 11:45:48,457][0m Trial 22 finished with value: 0.8904502946671784 and parameters: {'splitter': 'random', 'min_samples_split': 0.088401778847837, 'min_samples_leaf': 0.04298420737339887, 'min_weight_fraction_leaf': 0.041870716660486154, 'max_features': 0.8323946629847929}. Best is trial 18 with value: 0.9028588885846606.[0m
[32m[I 2022-04-21 11:45:49,373][0m Trial 23 finished with value: 0.8876514649843157 and parameters: {'splitter': 'random', 'min_samples_split': 0.0689840278441287, 'min_samples_leaf': 0.11392638329234203, 'min_weight_fraction_leaf': 0.0032622724630536823, 'max_features': 0.8685728999271679}. Best is trial 18 with value: 0.9028588885846606.[0m
[32m[I 2022-04-21 11:45:50,438][0m Trial 24 finished with value: 0.8765578933258826 and parameters: {'splitter': 'random', 'min_samples_split': 0.18404754661355968, 'min_samples_leaf': 0.03401281272977727, 'min_weight_fraction_leaf': 0.16108469298267616, 'max_features': 0.6866590640267}. Best is trial 18 with value: 0.9028588885846606.[0m
[32m[I 2022-04-21 11:45:51,541][0m Trial 25 finished with value: 0.8806038654580085 and parameters: {'splitter': 'random', 'min_samples_split': 0.002960631626274801, 'min_samples_leaf': 0.10601425742980715, 'min_weight_fraction_leaf': 0.059909543537283116, 'max_features': 0.8312952775464897}. Best is trial 18 with value: 0.9028588885846606.[0m
[32m[I 2022-04-21 11:45:52,423][0m Trial 26 finished with value: 0.8801626937635778 and parameters: {'splitter': 'random', 'min_samples_split': 0.05449651874755079, 'min_samples_leaf': 0.18839792507825634, 'min_weight_fraction_leaf': 0.10168685757809297, 'max_features': 0.9996402911227131}. Best is trial 18 with value: 0.9028588885846606.[0m
[32m[I 2022-04-21 11:45:54,218][0m Trial 27 finished with value: 0.9046641256239003 and parameters: {'splitter': 'random', 'min_samples_split': 0.12092234555019166, 'min_samples_leaf': 0.02675826863360095, 'min_weight_fraction_leaf': 0.05029700929799695, 'max_features': 0.9181665293858119}. Best is trial 27 with value: 0.9046641256239003.[0m
[32m[I 2022-04-21 11:45:55,273][0m Trial 28 finished with value: 0.8797245818194697 and parameters: {'splitter': 'random', 'min_samples_split': 0.1123484359405592, 'min_samples_leaf': 0.04235368359272077, 'min_weight_fraction_leaf': 0.20262602100468985, 'max_features': 0.9244074058964776}. Best is trial 27 with value: 0.9046641256239003.[0m
[32m[I 2022-04-21 11:45:56,287][0m Trial 29 finished with value: 0.8842973118032521 and parameters: {'splitter': 'random', 'min_samples_split': 0.06819823628525012, 'min_samples_leaf': 0.06303475447159779, 'min_weight_fraction_leaf': 0.11953747399420539, 'max_features': 0.8012729814017358}. Best is trial 27 with value: 0.9046641256239003.[0m
[32m[I 2022-04-21 11:45:57,123][0m Trial 30 finished with value: 0.3604231857506432 and parameters: {'splitter': 'random', 'min_samples_split': 0.18108586243182687, 'min_samples_leaf': 0.25784174307962404, 'min_weight_fraction_leaf': 0.04851522784405355, 'max_features': 0.9305089508380318}. Best is trial 27 with value: 0.9046641256239003.[0m
/media/san2_ssd/data/Workdir/survival/utils.py:305: RuntimeWarning: invalid value encountered in true_divide
  pdfs = np.gradient(1-survs,axis=1)/norms
/media/san2_ssd/data/Workdir/survival/utils.py:305: RuntimeWarning: invalid value encountered in true_divide
  pdfs = np.gradient(1-survs,axis=1)/norms
/media/san2_ssd/data/Workdir/survival/utils.py:305: RuntimeWarning: invalid value encountered in true_divide
  pdfs = np.gradient(1-survs,axis=1)/norms
[32m[I 2022-04-21 11:45:58,986][0m Trial 31 finished with value: 0.8910241045812904 and parameters: {'splitter': 'random', 'min_samples_split': 0.03826202545205823, 'min_samples_leaf': 0.001577016762806905, 'min_weight_fraction_leaf': 0.005948940117922038, 'max_features': 0.6937510174898314}. Best is trial 27 with value: 0.9046641256239003.[0m
[32m[I 2022-04-21 11:46:00,916][0m Trial 32 finished with value: 0.8931994759094909 and parameters: {'splitter': 'random', 'min_samples_split': 0.17116891682035082, 'min_samples_leaf': 0.02849087503238712, 'min_weight_fraction_leaf': 0.06285612776193447, 'max_features': 0.8582133133740207}. Best is trial 27 with value: 0.9046641256239003.[0m
[32m[I 2022-04-21 11:46:02,649][0m Trial 33 finished with value: 0.8931870628461397 and parameters: {'splitter': 'random', 'min_samples_split': 0.11827064743253116, 'min_samples_leaf': 0.10228368426657145, 'min_weight_fraction_leaf': 0.08375300819132692, 'max_features': 0.7503280392605061}. Best is trial 27 with value: 0.9046641256239003.[0m
[32m[I 2022-04-21 11:46:03,541][0m Trial 34 finished with value: 0.25329544094439393 and parameters: {'splitter': 'random', 'min_samples_split': 0.2661468694612136, 'min_samples_leaf': 0.3974574903273225, 'min_weight_fraction_leaf': 0.03453574156552911, 'max_features': 0.65108401792074}. Best is trial 27 with value: 0.9046641256239003.[0m
[32m[I 2022-04-21 11:46:04,930][0m Trial 35 finished with value: 0.3776293528011464 and parameters: {'splitter': 'random', 'min_samples_split': 0.21779962782965814, 'min_samples_leaf': 0.02250486191955143, 'min_weight_fraction_leaf': 0.25311665587146454, 'max_features': 0.5296387652802155}. Best is trial 27 with value: 0.9046641256239003.[0m
[32m[I 2022-04-21 11:46:06,541][0m Trial 36 finished with value: 0.8798406548819061 and parameters: {'splitter': 'random', 'min_samples_split': 0.09328883504226446, 'min_samples_leaf': 0.06233334215047714, 'min_weight_fraction_leaf': 0.13368205505982061, 'max_features': 0.7876807394136601}. Best is trial 27 with value: 0.9046641256239003.[0m
[32m[I 2022-04-21 11:46:07,523][0m Trial 37 finished with value: 0.8785678178918717 and parameters: {'splitter': 'random', 'min_samples_split': 0.15830799829440906, 'min_samples_leaf': 0.18252423976320595, 'min_weight_fraction_leaf': 0.0393281914200528, 'max_features': 0.7198426977145084}. Best is trial 27 with value: 0.9046641256239003.[0m
[32m[I 2022-04-21 11:47:51,442][0m Trial 38 finished with value: 0.8911769277926463 and parameters: {'splitter': 'best', 'min_samples_split': 0.1201906324928252, 'min_samples_leaf': 0.11782742296104215, 'min_weight_fraction_leaf': 0.08581854153753335, 'max_features': 0.8947645023026212}. Best is trial 27 with value: 0.9046641256239003.[0m
[32m[I 2022-04-21 11:47:52,378][0m Trial 39 finished with value: 0.25 and parameters: {'splitter': 'random', 'min_samples_split': 0.2408148357313945, 'min_samples_leaf': 0.2172920182961094, 'min_weight_fraction_leaf': 0.19230289260672867, 'max_features': 0.22388482729764908}. Best is trial 27 with value: 0.9046641256239003.[0m
[32m[I 2022-04-21 11:48:20,922][0m Trial 40 finished with value: 0.2914511293662345 and parameters: {'splitter': 'best', 'min_samples_split': 0.1976351114346898, 'min_samples_leaf': 0.28858271563925925, 'min_weight_fraction_leaf': 0.35519957996051377, 'max_features': 0.9586661528895593}. Best is trial 27 with value: 0.9046641256239003.[0m
[32m[I 2022-04-21 11:48:22,035][0m Trial 41 finished with value: 0.8870402747115171 and parameters: {'splitter': 'random', 'min_samples_split': 0.09568433099882831, 'min_samples_leaf': 0.07675651854531006, 'min_weight_fraction_leaf': 0.0007812216467028357, 'max_features': 0.47512735057777544}. Best is trial 27 with value: 0.9046641256239003.[0m
[32m[I 2022-04-21 11:48:23,334][0m Trial 42 finished with value: 0.3676773400207146 and parameters: {'splitter': 'random', 'min_samples_split': 0.0631392153216343, 'min_samples_leaf': 0.06756923697576143, 'min_weight_fraction_leaf': 0.1642580552511587, 'max_features': 0.5420042428139495}. Best is trial 27 with value: 0.9046641256239003.[0m
[32m[I 2022-04-21 11:48:25,042][0m Trial 43 finished with value: 0.9060889153451036 and parameters: {'splitter': 'random', 'min_samples_split': 0.044015336487661066, 'min_samples_leaf': 0.023866229036477643, 'min_weight_fraction_leaf': 0.05878231402491366, 'max_features': 0.6258209563978452}. Best is trial 43 with value: 0.9060889153451036.[0m
[32m[I 2022-04-21 11:48:26,262][0m Trial 44 finished with value: 0.9040073930761461 and parameters: {'splitter': 'random', 'min_samples_split': 0.01116740360198882, 'min_samples_leaf': 0.024057574165184663, 'min_weight_fraction_leaf': 0.024574994360465827, 'max_features': 0.8033964513685253}. Best is trial 43 with value: 0.9060889153451036.[0m
[32m[I 2022-04-21 11:48:28,111][0m Trial 45 finished with value: 0.8983225462608744 and parameters: {'splitter': 'random', 'min_samples_split': 0.037238755218445434, 'min_samples_leaf': 0.027596120218316082, 'min_weight_fraction_leaf': 0.03190689297097729, 'max_features': 0.8181859095109606}. Best is trial 43 with value: 0.9060889153451036.[0m
[32m[I 2022-04-21 11:48:29,206][0m Trial 46 finished with value: 0.897985230753892 and parameters: {'splitter': 'random', 'min_samples_split': 0.04050698773522643, 'min_samples_leaf': 0.03586919483689725, 'min_weight_fraction_leaf': 0.026843600790991157, 'max_features': 0.7923274103151828}. Best is trial 43 with value: 0.9060889153451036.[0m
[32m[I 2022-04-21 11:48:29,966][0m Trial 47 finished with value: 0.25329544094439393 and parameters: {'splitter': 'random', 'min_samples_split': 0.030958622174067925, 'min_samples_leaf': 0.3876992475675896, 'min_weight_fraction_leaf': 0.39315134014467545, 'max_features': 0.5977811406842277}. Best is trial 43 with value: 0.9060889153451036.[0m
[32m[I 2022-04-21 11:48:30,867][0m Trial 48 finished with value: 0.8740243698329191 and parameters: {'splitter': 'random', 'min_samples_split': 0.0036937933938115883, 'min_samples_leaf': 0.12873549445479426, 'min_weight_fraction_leaf': 0.10410380308870001, 'max_features': 0.7578123518612926}. Best is trial 43 with value: 0.9060889153451036.[0m
[32m[I 2022-04-21 11:48:32,919][0m Trial 49 finished with value: 0.8994941954157127 and parameters: {'splitter': 'random', 'min_samples_split': 0.04477939825242856, 'min_samples_leaf': 0.0946441981364313, 'min_weight_fraction_leaf': 0.13774158498201758, 'max_features': 0.8938536287526695}. Best is trial 43 with value: 0.9060889153451036.[0m
[32m[I 2022-04-21 11:48:33,995][0m Trial 50 finished with value: 0.3425804518366971 and parameters: {'splitter': 'random', 'min_samples_split': 0.0107645177462595, 'min_samples_leaf': 0.16362288725440488, 'min_weight_fraction_leaf': 0.27104177421779496, 'max_features': 0.8863522991423181}. Best is trial 43 with value: 0.9060889153451036.[0m
[32m[I 2022-04-21 11:48:37,102][0m Trial 51 finished with value: 0.9025708195758826 and parameters: {'splitter': 'random', 'min_samples_split': 0.046633145241784794, 'min_samples_leaf': 0.01940506500347925, 'min_weight_fraction_leaf': 0.028084236273373794, 'max_features': 0.9592952969362046}. Best is trial 43 with value: 0.9060889153451036.[0m
[32m[I 2022-04-21 11:48:38,797][0m Trial 52 finished with value: 0.8861559110076815 and parameters: {'splitter': 'random', 'min_samples_split': 0.058865446874218616, 'min_samples_leaf': 0.09775101368535123, 'min_weight_fraction_leaf': 0.07565786348753334, 'max_features': 0.9624310001719002}. Best is trial 43 with value: 0.9060889153451036.[0m
[32m[I 2022-04-21 11:48:39,903][0m Trial 53 finished with value: 0.7829202764002352 and parameters: {'splitter': 'random', 'min_samples_split': 0.04549496012802059, 'min_samples_leaf': 0.053259737658457804, 'min_weight_fraction_leaf': 0.13850755410268875, 'max_features': 0.9241445419289968}. Best is trial 43 with value: 0.9060889153451036.[0m
[32m[I 2022-04-21 11:48:41,973][0m Trial 54 finished with value: 0.9013336702065711 and parameters: {'splitter': 'random', 'min_samples_split': 0.015032237721089033, 'min_samples_leaf': 0.02417086181438803, 'min_weight_fraction_leaf': 0.023545748025393606, 'max_features': 0.8960313031654736}. Best is trial 43 with value: 0.9060889153451036.[0m
[32m[I 2022-04-21 11:48:43,819][0m Trial 55 finished with value: 0.9086552789532311 and parameters: {'splitter': 'random', 'min_samples_split': 0.02070770946095865, 'min_samples_leaf': 0.021102591178573743, 'min_weight_fraction_leaf': 0.027518811362423685, 'max_features': 0.9770224257104252}. Best is trial 55 with value: 0.9086552789532311.[0m
[32m[I 2022-04-21 11:48:47,010][0m Trial 56 finished with value: 0.9026186422977982 and parameters: {'splitter': 'random', 'min_samples_split': 0.02284682389244423, 'min_samples_leaf': 0.02164827950644584, 'min_weight_fraction_leaf': 0.04923435986594628, 'max_features': 0.9662222702405521}. Best is trial 55 with value: 0.9086552789532311.[0m
[32m[I 2022-04-21 11:48:48,612][0m Trial 57 finished with value: 0.8797245818194697 and parameters: {'splitter': 'random', 'min_samples_split': 0.024594834387695705, 'min_samples_leaf': 0.04725558810581579, 'min_weight_fraction_leaf': 0.2310453193269622, 'max_features': 0.9998091555772124}. Best is trial 55 with value: 0.9086552789532311.[0m
[32m[I 2022-04-21 11:48:50,309][0m Trial 58 finished with value: 0.8943844939493969 and parameters: {'splitter': 'random', 'min_samples_split': 0.08318873078883116, 'min_samples_leaf': 0.01360736107511165, 'min_weight_fraction_leaf': 0.07036469866987163, 'max_features': 0.8497649459568984}. Best is trial 55 with value: 0.9086552789532311.[0m
[32m[I 2022-04-21 11:48:51,732][0m Trial 59 finished with value: 0.8959055314918846 and parameters: {'splitter': 'random', 'min_samples_split': 0.11060299830139482, 'min_samples_leaf': 0.08332183559165585, 'min_weight_fraction_leaf': 0.051428741555804076, 'max_features': 0.970367636743341}. Best is trial 55 with value: 0.9086552789532311.[0m
[32m[I 2022-04-21 11:48:53,187][0m Trial 60 finished with value: 0.36658141227181906 and parameters: {'splitter': 'random', 'min_samples_split': 0.0016594925894146267, 'min_samples_leaf': 0.054822593638355205, 'min_weight_fraction_leaf': 0.11322050614771713, 'max_features': 0.4187919414239111}. Best is trial 55 with value: 0.9086552789532311.[0m
[32m[I 2022-04-21 11:48:55,382][0m Trial 61 finished with value: 0.9010247390728029 and parameters: {'splitter': 'random', 'min_samples_split': 0.022311273549922156, 'min_samples_leaf': 0.017976871175909327, 'min_weight_fraction_leaf': 0.026912954924631513, 'max_features': 0.9713776292509739}. Best is trial 55 with value: 0.9086552789532311.[0m
