[32m[I 2022-05-16 06:04:29,736][0m Trial 581 finished with value: 0.7391549112473005 and parameters: {'loss': 'coxph', 'learning_rate': 8.529605408209876e-05, 'n_estimators': 499, 'criterion': 'friedman_mse', 'min_samples_split': 5, 'min_samples_leaf': 5, 'min_weight_fraction_leaf': 0.09353090008911089, 'min_impurity_decrease': 0.7465845010005263, 'max_features': 0.7776351137336431, 'subsample': 0.11379842308425488, 'dropout_rate': 0.12213641233441547, 'ccp_alpha': 0.3785934288625836}. Best is trial 573 with value: 0.8538054350764822.[0m
[32m[I 2022-05-16 06:25:38,029][0m Trial 582 finished with value: 0.7844574353528498 and parameters: {'loss': 'coxph', 'learning_rate': 0.00011754725929743372, 'n_estimators': 471, 'criterion': 'friedman_mse', 'min_samples_split': 4, 'min_samples_leaf': 5, 'min_weight_fraction_leaf': 0.10185090678809046, 'min_impurity_decrease': 0.816451213011262, 'max_features': 0.7240337357176884, 'subsample': 0.15282384985466513, 'dropout_rate': 0.694811033802875, 'ccp_alpha': 0.09769662719254989}. Best is trial 573 with value: 0.8538054350764822.[0m
[32m[I 2022-05-16 06:51:37,213][0m Trial 583 finished with value: 0.7842331597432116 and parameters: {'loss': 'coxph', 'learning_rate': 4.602050060940716e-05, 'n_estimators': 540, 'criterion': 'friedman_mse', 'min_samples_split': 4, 'min_samples_leaf': 5, 'min_weight_fraction_leaf': 0.0804311166058545, 'min_impurity_decrease': 0.8470595505551851, 'max_features': 0.7561669419068514, 'subsample': 0.09047349255495499, 'dropout_rate': 0.7358663761927148, 'ccp_alpha': 0.08957949033799793}. Best is trial 573 with value: 0.8538054350764822.[0m
[32m[I 2022-05-16 07:09:33,327][0m Trial 584 finished with value: 0.7628832602325605 and parameters: {'loss': 'coxph', 'learning_rate': 0.00019910408193264434, 'n_estimators': 393, 'criterion': 'friedman_mse', 'min_samples_split': 4, 'min_samples_leaf': 5, 'min_weight_fraction_leaf': 0.06876549941628995, 'min_impurity_decrease': 0.6592800321664761, 'max_features': 0.8076682432495598, 'subsample': 0.1273000192481182, 'dropout_rate': 0.7204698272805244, 'ccp_alpha': 0.2528231008030511}. Best is trial 573 with value: 0.8538054350764822.[0m
[32m[I 2022-05-16 07:32:52,562][0m Trial 585 finished with value: 0.8468004947795451 and parameters: {'loss': 'coxph', 'learning_rate': 6.19635794655351e-05, 'n_estimators': 428, 'criterion': 'friedman_mse', 'min_samples_split': 5, 'min_samples_leaf': 5, 'min_weight_fraction_leaf': 0.06151296098386297, 'min_impurity_decrease': 0.7226384395352802, 'max_features': 0.7783789824303563, 'subsample': 0.026527245387753626, 'dropout_rate': 0.34010128740977796, 'ccp_alpha': 0.0023772489207296316}. Best is trial 573 with value: 0.8538054350764822.[0m
[32m[I 2022-05-16 07:58:02,075][0m Trial 586 finished with value: 0.7635093155266957 and parameters: {'loss': 'coxph', 'learning_rate': 0.00014754749660780467, 'n_estimators': 525, 'criterion': 'friedman_mse', 'min_samples_split': 4, 'min_samples_leaf': 5, 'min_weight_fraction_leaf': 0.10863812600567734, 'min_impurity_decrease': 0.9344662139698411, 'max_features': 0.7426438104803349, 'subsample': 0.10600077237337112, 'dropout_rate': 0.6316915145343917, 'ccp_alpha': 0.17493329691065687}. Best is trial 573 with value: 0.8538054350764822.[0m
[32m[I 2022-05-16 08:25:52,817][0m Trial 587 finished with value: 0.7906193214778949 and parameters: {'loss': 'coxph', 'learning_rate': 5.0558509073198526e-05, 'n_estimators': 566, 'criterion': 'friedman_mse', 'min_samples_split': 5, 'min_samples_leaf': 5, 'min_weight_fraction_leaf': 0.09085491265471818, 'min_impurity_decrease': 0.7953261762625718, 'max_features': 0.819431968407073, 'subsample': 0.07897310783628406, 'dropout_rate': 0.691857894018424, 'ccp_alpha': 0.08190510484215112}. Best is trial 573 with value: 0.8538054350764822.[0m
[32m[I 2022-05-16 08:45:48,402][0m Trial 588 finished with value: 0.8506797769210916 and parameters: {'loss': 'coxph', 'learning_rate': 8.774049465705071e-05, 'n_estimators': 377, 'criterion': 'friedman_mse', 'min_samples_split': 3, 'min_samples_leaf': 5, 'min_weight_fraction_leaf': 0.1001664430776503, 'min_impurity_decrease': 0.7633103045945069, 'max_features': 0.7887024726736592, 'subsample': 0.06380370240235175, 'dropout_rate': 0.15701119882592607, 'ccp_alpha': 0.003605349520593079}. Best is trial 573 with value: 0.8538054350764822.[0m
[32m[I 2022-05-16 09:04:09,815][0m Trial 589 finished with value: 0.7627954228036451 and parameters: {'loss': 'coxph', 'learning_rate': 0.00011501100866040482, 'n_estimators': 382, 'criterion': 'friedman_mse', 'min_samples_split': 4, 'min_samples_leaf': 5, 'min_weight_fraction_leaf': 0.10093793378165744, 'min_impurity_decrease': 0.9126813142638825, 'max_features': 0.7679839804844883, 'subsample': 0.14032300168701747, 'dropout_rate': 0.1402091939331254, 'ccp_alpha': 0.1637295623254108}. Best is trial 573 with value: 0.8538054350764822.[0m
[32m[I 2022-05-16 09:20:50,120][0m Trial 590 finished with value: 0.7394583310141121 and parameters: {'loss': 'coxph', 'learning_rate': 8.848337068610596e-05, 'n_estimators': 369, 'criterion': 'friedman_mse', 'min_samples_split': 4, 'min_samples_leaf': 5, 'min_weight_fraction_leaf': 0.07954781023804769, 'min_impurity_decrease': 0.8591821693719734, 'max_features': 0.7881323611582736, 'subsample': 0.18079851999954097, 'dropout_rate': 0.20117042792427536, 'ccp_alpha': 0.3361148960258644}. Best is trial 573 with value: 0.8538054350764822.[0m
[32m[I 2022-05-16 09:40:53,218][0m Trial 591 finished with value: 0.7847702591367404 and parameters: {'loss': 'coxph', 'learning_rate': 0.05359601709868238, 'n_estimators': 393, 'criterion': 'friedman_mse', 'min_samples_split': 5, 'min_samples_leaf': 5, 'min_weight_fraction_leaf': 0.09707559091263418, 'min_impurity_decrease': 0.8245201000795755, 'max_features': 0.723249367362452, 'subsample': 0.0830411353691094, 'dropout_rate': 0.16736491384957267, 'ccp_alpha': 0.10181812990731158}. Best is trial 573 with value: 0.8538054350764822.[0m
[32m[I 2022-05-16 10:07:20,202][0m Trial 592 finished with value: 0.8522102764638481 and parameters: {'loss': 'coxph', 'learning_rate': 7.897495815338916e-05, 'n_estimators': 496, 'criterion': 'friedman_mse', 'min_samples_split': 4, 'min_samples_leaf': 5, 'min_weight_fraction_leaf': 0.11113403404963043, 'min_impurity_decrease': 0.735024806820817, 'max_features': 0.7554848851956305, 'subsample': 0.06285878210857246, 'dropout_rate': 0.3122974934256054, 'ccp_alpha': 0.0020945861697969836}. Best is trial 573 with value: 0.8538054350764822.[0m
[32m[I 2022-05-16 10:33:55,944][0m Trial 593 finished with value: 0.7658451662389809 and parameters: {'loss': 'coxph', 'learning_rate': 0.0004439066267794065, 'n_estimators': 502, 'criterion': 'friedman_mse', 'min_samples_split': 4, 'min_samples_leaf': 5, 'min_weight_fraction_leaf': 0.1115719839371509, 'min_impurity_decrease': 0.7378424164531113, 'max_features': 0.7496585676760792, 'subsample': 0.06458139291424712, 'dropout_rate': 0.19531484968097093, 'ccp_alpha': 0.23492105912402786}. Best is trial 573 with value: 0.8538054350764822.[0m
/media/san2_ssd/data/Workdir/survival/venv/lib/python3.8/site-packages/sksurv/ensemble/boosting.py:955: RuntimeWarning: divide by zero encountered in log
  time = numpy.log(time)
/media/san2_ssd/data/Workdir/survival/venv/lib/python3.8/site-packages/sksurv/ensemble/boosting.py:955: RuntimeWarning: divide by zero encountered in log
  time = numpy.log(time)
/media/san2_ssd/data/Workdir/survival/venv/lib/python3.8/site-packages/sksurv/ensemble/boosting.py:955: RuntimeWarning: divide by zero encountered in log
  time = numpy.log(time)
/media/san2_ssd/data/Workdir/survival/venv/lib/python3.8/site-packages/sksurv/ensemble/boosting.py:955: RuntimeWarning: divide by zero encountered in log
  time = numpy.log(time)
/media/san2_ssd/data/Workdir/survival/venv/lib/python3.8/site-packages/sksurv/ensemble/boosting.py:955: RuntimeWarning: divide by zero encountered in log
  time = numpy.log(time)
[32m[I 2022-05-16 10:33:56,014][0m Trial 594 finished with value: -1.0 and parameters: {'loss': 'squared', 'learning_rate': 9.593211349103045e-05, 'n_estimators': 482, 'criterion': 'friedman_mse', 'min_samples_split': 4, 'min_samples_leaf': 5, 'min_weight_fraction_leaf': 0.12112701279062899, 'min_impurity_decrease': 0.6897476541764498, 'max_features': 0.689681124521556, 'subsample': 0.0770140424336697, 'dropout_rate': 0.30750395921755314, 'ccp_alpha': 0.00422162496077135}. Best is trial 573 with value: 0.8538054350764822.[0m
[32m[I 2022-05-16 11:02:30,026][0m Trial 595 finished with value: 0.849905178552738 and parameters: {'loss': 'coxph', 'learning_rate': 8.083626947139326e-05, 'n_estimators': 517, 'criterion': 'friedman_mse', 'min_samples_split': 5, 'min_samples_leaf': 5, 'min_weight_fraction_leaf': 0.12965094198310842, 'min_impurity_decrease': 0.7595948262564529, 'max_features': 0.7409558590536317, 'subsample': 0.057425978511975485, 'dropout_rate': 0.15905476986254757, 'ccp_alpha': 0.0017124063307919829}. Best is trial 573 with value: 0.8538054350764822.[0m
[32m[I 2022-05-16 11:29:58,557][0m Trial 596 finished with value: 0.7782663188733967 and parameters: {'loss': 'coxph', 'learning_rate': 7.530339093124974e-05, 'n_estimators': 533, 'criterion': 'friedman_mse', 'min_samples_split': 5, 'min_samples_leaf': 5, 'min_weight_fraction_leaf': 0.13157681295543697, 'min_impurity_decrease': 0.7619431868352765, 'max_features': 0.7318796660636486, 'subsample': 0.103384044061933, 'dropout_rate': 0.16358163571247086, 'ccp_alpha': 0.1617843626042424}. Best is trial 573 with value: 0.8538054350764822.[0m
[32m[I 2022-05-16 12:01:34,937][0m Trial 597 finished with value: 0.7885378321956357 and parameters: {'loss': 'coxph', 'learning_rate': 7.393705195955537e-05, 'n_estimators': 582, 'criterion': 'friedman_mse', 'min_samples_split': 5, 'min_samples_leaf': 5, 'min_weight_fraction_leaf': 0.12543499420986462, 'min_impurity_decrease': 0.779791957574368, 'max_features': 0.7106632988400059, 'subsample': 0.05779465494465109, 'dropout_rate': 0.21243019395587387, 'ccp_alpha': 0.10614484560835424}. Best is trial 573 with value: 0.8538054350764822.[0m
[32m[I 2022-05-16 12:30:18,634][0m Trial 598 finished with value: 0.7643569434421457 and parameters: {'loss': 'coxph', 'learning_rate': 0.00010179812389768264, 'n_estimators': 514, 'criterion': 'friedman_mse', 'min_samples_split': 5, 'min_samples_leaf': 5, 'min_weight_fraction_leaf': 0.11372872855930322, 'min_impurity_decrease': 0.8045155795036283, 'max_features': 0.7490173631940268, 'subsample': 0.08731784635014453, 'dropout_rate': 0.19903476049788107, 'ccp_alpha': 0.2642912459390191}. Best is trial 573 with value: 0.8538054350764822.[0m
[32m[I 2022-05-16 13:00:51,798][0m Trial 599 finished with value: 0.5 and parameters: {'loss': 'coxph', 'learning_rate': 6.578052127839534e-05, 'n_estimators': 565, 'criterion': 'friedman_mse', 'min_samples_split': 5, 'min_samples_leaf': 5, 'min_weight_fraction_leaf': 0.1286426207406574, 'min_impurity_decrease': 0.7497255380044819, 'max_features': 0.7637902425294959, 'subsample': 0.06216712927415537, 'dropout_rate': 0.11566157290738321, 'ccp_alpha': 2.6805776808808766}. Best is trial 573 with value: 0.8538054350764822.[0m
[32m[I 2022-05-16 13:26:50,597][0m Trial 600 finished with value: 0.5 and parameters: {'loss': 'coxph', 'learning_rate': 8.25144246520109e-05, 'n_estimators': 472, 'criterion': 'squared_error', 'min_samples_split': 5, 'min_samples_leaf': 5, 'min_weight_fraction_leaf': 0.10578018293476597, 'min_impurity_decrease': 0.8739163550052876, 'max_features': 0.7356371674451853, 'subsample': 0.09316230525337217, 'dropout_rate': 0.08526262953644118, 'ccp_alpha': 0.09459287514785236}. Best is trial 573 with value: 0.8538054350764822.[0m
[32m[I 2022-05-16 13:55:58,231][0m Trial 601 finished with value: 0.7732707950438508 and parameters: {'loss': 'coxph', 'learning_rate': 9.173736323356411e-05, 'n_estimators': 550, 'criterion': 'friedman_mse', 'min_samples_split': 5, 'min_samples_leaf': 5, 'min_weight_fraction_leaf': 0.11783687412480948, 'min_impurity_decrease': 0.8409327084681129, 'max_features': 0.7660526693842125, 'subsample': 0.06690091210223428, 'dropout_rate': 0.2644394268196635, 'ccp_alpha': 0.17429111443993237}. Best is trial 573 with value: 0.8538054350764822.[0m
[32m[I 2022-05-16 14:25:20,525][0m Trial 602 finished with value: 0.8473143426055975 and parameters: {'loss': 'coxph', 'learning_rate': 0.00011889638004582511, 'n_estimators': 525, 'criterion': 'friedman_mse', 'min_samples_split': 5, 'min_samples_leaf': 5, 'min_weight_fraction_leaf': 0.10704450554882937, 'min_impurity_decrease': 0.7970882468746759, 'max_features': 0.7182567566282471, 'subsample': 0.04783030905568539, 'dropout_rate': 0.14417855820642556, 'ccp_alpha': 0.0045147227722562334}. Best is trial 573 with value: 0.8538054350764822.[0m
[32m[I 2022-05-16 14:48:17,654][0m Trial 603 finished with value: 0.7800773307097628 and parameters: {'loss': 'coxph', 'learning_rate': 6.402842064731962e-05, 'n_estimators': 449, 'criterion': 'friedman_mse', 'min_samples_split': 5, 'min_samples_leaf': 5, 'min_weight_fraction_leaf': 0.13314475732430922, 'min_impurity_decrease': 0.7632074284706933, 'max_features': 0.74550163161241, 'subsample': 0.11442760385248028, 'dropout_rate': 0.1602106450018209, 'ccp_alpha': 0.1019531758721758}. Best is trial 573 with value: 0.8538054350764822.[0m
[32m[I 2022-05-16 15:08:14,642][0m Trial 604 finished with value: 0.5 and parameters: {'loss': 'coxph', 'learning_rate': 5.838061652758245e-05, 'n_estimators': 404, 'criterion': 'friedman_mse', 'min_samples_split': 5, 'min_samples_leaf': 5, 'min_weight_fraction_leaf': 0.12168973879706786, 'min_impurity_decrease': 0.7056255470443409, 'max_features': 0.7778020154120393, 'subsample': 0.08433170245826503, 'dropout_rate': 0.7519851537839186, 'ccp_alpha': 3.192187819856505}. Best is trial 573 with value: 0.8538054350764822.[0m
[32m[I 2022-05-16 15:36:06,712][0m Trial 605 finished with value: 0.849065924777071 and parameters: {'loss': 'coxph', 'learning_rate': 0.00011208255333436821, 'n_estimators': 495, 'criterion': 'friedman_mse', 'min_samples_split': 2, 'min_samples_leaf': 5, 'min_weight_fraction_leaf': 0.09649697202427764, 'min_impurity_decrease': 0.7796739180096232, 'max_features': 0.6924141750408291, 'subsample': 0.04417017750722878, 'dropout_rate': 0.17372777410487406, 'ccp_alpha': 0.002424143093165823}. Best is trial 573 with value: 0.8538054350764822.[0m
[32m[I 2022-05-16 16:03:00,627][0m Trial 606 finished with value: 0.7799295947903774 and parameters: {'loss': 'coxph', 'learning_rate': 0.00011110475813081339, 'n_estimators': 491, 'criterion': 'friedman_mse', 'min_samples_split': 2, 'min_samples_leaf': 5, 'min_weight_fraction_leaf': 0.10113893849101241, 'min_impurity_decrease': 0.7409971043351662, 'max_features': 0.6829587830716588, 'subsample': 0.04078871013136974, 'dropout_rate': 0.18586321721374677, 'ccp_alpha': 0.18036029800822856}. Best is trial 573 with value: 0.8538054350764822.[0m
[32m[I 2022-05-16 16:29:50,134][0m Trial 607 finished with value: 0.8449912805306002 and parameters: {'loss': 'coxph', 'learning_rate': 8.232583488158567e-05, 'n_estimators': 474, 'criterion': 'friedman_mse', 'min_samples_split': 2, 'min_samples_leaf': 5, 'min_weight_fraction_leaf': 0.08562888081466051, 'min_impurity_decrease': 0.780033080094381, 'max_features': 0.7161929772328635, 'subsample': 0.02655467263143954, 'dropout_rate': 0.12985646225358222, 'ccp_alpha': 0.0018848289635366997}. Best is trial 573 with value: 0.8538054350764822.[0m
[32m[I 2022-05-16 16:57:30,179][0m Trial 608 finished with value: 0.6432066345263946 and parameters: {'loss': 'coxph', 'learning_rate': 0.0001379648144218293, 'n_estimators': 519, 'criterion': 'friedman_mse', 'min_samples_split': 3, 'min_samples_leaf': 5, 'min_weight_fraction_leaf': 0.09536364686991457, 'min_impurity_decrease': 0.8959014728840056, 'max_features': 0.7370619701713396, 'subsample': 0.05065968714502383, 'dropout_rate': 0.16874470368937078, 'ccp_alpha': 0.4293109123926206}. Best is trial 573 with value: 0.8538054350764822.[0m
[32m[I 2022-05-16 17:22:13,157][0m Trial 609 finished with value: 0.7635442635470252 and parameters: {'loss': 'coxph', 'learning_rate': 0.00010857595326904894, 'n_estimators': 499, 'criterion': 'friedman_mse', 'min_samples_split': 2, 'min_samples_leaf': 5, 'min_weight_fraction_leaf': 0.10882613666339647, 'min_impurity_decrease': 0.8686417603472553, 'max_features': 0.7590914414149246, 'subsample': 0.10661371236597258, 'dropout_rate': 0.36068357685688673, 'ccp_alpha': 0.25751931838109426}. Best is trial 573 with value: 0.8538054350764822.[0m
[32m[I 2022-05-16 17:54:56,861][0m Trial 610 finished with value: 0.7941609135629993 and parameters: {'loss': 'coxph', 'learning_rate': 0.00018016557696641758, 'n_estimators': 604, 'criterion': 'friedman_mse', 'min_samples_split': 3, 'min_samples_leaf': 5, 'min_weight_fraction_leaf': 0.08201586296217875, 'min_impurity_decrease': 0.754526149440141, 'max_features': 0.7041125058853949, 'subsample': 0.07291638495564613, 'dropout_rate': 0.1584976702810195, 'ccp_alpha': 0.09961403233527885}. Best is trial 573 with value: 0.8538054350764822.[0m
[32m[I 2022-05-16 18:19:18,423][0m Trial 611 finished with value: 0.5 and parameters: {'loss': 'coxph', 'learning_rate': 8.167502253772014e-05, 'n_estimators': 447, 'criterion': 'friedman_mse', 'min_samples_split': 4, 'min_samples_leaf': 5, 'min_weight_fraction_leaf': 0.0913544543435992, 'min_impurity_decrease': 0.9141479375693278, 'max_features': 0.7438136871119437, 'subsample': 0.017141628961976466, 'dropout_rate': 0.18254615326343243, 'ccp_alpha': 2.966977558765564}. Best is trial 573 with value: 0.8538054350764822.[0m
[32m[I 2022-05-16 18:49:58,520][0m Trial 612 finished with value: 0.8528046089777351 and parameters: {'loss': 'coxph', 'learning_rate': 0.0001237046242504642, 'n_estimators': 542, 'criterion': 'friedman_mse', 'min_samples_split': 3, 'min_samples_leaf': 5, 'min_weight_fraction_leaf': 0.0725404378821066, 'min_impurity_decrease': 0.7222450457163656, 'max_features': 0.7861651992768609, 'subsample': 0.04494823357165498, 'dropout_rate': 0.11679290057913708, 'ccp_alpha': 0.001226590346305308}. Best is trial 573 with value: 0.8538054350764822.[0m
/media/san2_ssd/data/Workdir/survival/venv/lib/python3.8/site-packages/sksurv/ensemble/boosting.py:955: RuntimeWarning: divide by zero encountered in log
  time = numpy.log(time)
/media/san2_ssd/data/Workdir/survival/venv/lib/python3.8/site-packages/sksurv/ensemble/boosting.py:955: RuntimeWarning: divide by zero encountered in log
  time = numpy.log(time)
/media/san2_ssd/data/Workdir/survival/venv/lib/python3.8/site-packages/sksurv/ensemble/boosting.py:955: RuntimeWarning: divide by zero encountered in log
  time = numpy.log(time)
/media/san2_ssd/data/Workdir/survival/venv/lib/python3.8/site-packages/sksurv/ensemble/boosting.py:955: RuntimeWarning: divide by zero encountered in log
  time = numpy.log(time)
/media/san2_ssd/data/Workdir/survival/venv/lib/python3.8/site-packages/sksurv/ensemble/boosting.py:955: RuntimeWarning: divide by zero encountered in log
  time = numpy.log(time)
[32m[I 2022-05-16 18:49:58,591][0m Trial 613 finished with value: -1.0 and parameters: {'loss': 'squared', 'learning_rate': 0.0002644461189107543, 'n_estimators': 553, 'criterion': 'friedman_mse', 'min_samples_split': 2, 'min_samples_leaf': 5, 'min_weight_fraction_leaf': 0.10228125748178955, 'min_impurity_decrease': 0.7262824837664122, 'max_features': 0.7848059289375969, 'subsample': 0.10096045890228052, 'dropout_rate': 0.1567769804444475, 'ccp_alpha': 0.17474795802860002}. Best is trial 573 with value: 0.8538054350764822.[0m
[32m[I 2022-05-16 19:20:09,915][0m Trial 614 finished with value: 0.7850263308228228 and parameters: {'loss': 'coxph', 'learning_rate': 0.0001425442704679785, 'n_estimators': 586, 'criterion': 'friedman_mse', 'min_samples_split': 3, 'min_samples_leaf': 5, 'min_weight_fraction_leaf': 0.11451914666982776, 'min_impurity_decrease': 0.7320557256673897, 'max_features': 0.7283207126744787, 'subsample': 0.12511147685246654, 'dropout_rate': 0.11797444064037835, 'ccp_alpha': 0.1138498135722358}. Best is trial 573 with value: 0.8538054350764822.[0m
[32m[I 2022-05-16 19:50:11,300][0m Trial 615 finished with value: 0.7609792969552475 and parameters: {'loss': 'coxph', 'learning_rate': 0.00010954625458722787, 'n_estimators': 552, 'criterion': 'friedman_mse', 'min_samples_split': 3, 'min_samples_leaf': 5, 'min_weight_fraction_leaf': 0.09617367655415227, 'min_impurity_decrease': 0.6825970506474479, 'max_features': 0.6984455828054382, 'subsample': 0.05224927881131772, 'dropout_rate': 0.14364030647680262, 'ccp_alpha': 0.30683518115735453}. Best is trial 573 with value: 0.8538054350764822.[0m
[32m[I 2022-05-16 20:17:40,816][0m Trial 616 finished with value: 0.5 and parameters: {'loss': 'coxph', 'learning_rate': 0.00018073146014634372, 'n_estimators': 524, 'criterion': 'friedman_mse', 'min_samples_split': 2, 'min_samples_leaf': 5, 'min_weight_fraction_leaf': 0.07128056075191246, 'min_impurity_decrease': 0.7120654687727108, 'max_features': 0.7915490152406486, 'subsample': 0.07812957227013648, 'dropout_rate': 0.07390897351041766, 'ccp_alpha': 4.811945297650924}. Best is trial 573 with value: 0.8538054350764822.[0m
[32m[I 2022-05-16 20:37:22,756][0m Trial 617 finished with value: 0.7798900054968485 and parameters: {'loss': 'coxph', 'learning_rate': 0.00013224043253831516, 'n_estimators': 420, 'criterion': 'friedman_mse', 'min_samples_split': 5, 'min_samples_leaf': 5, 'min_weight_fraction_leaf': 0.10981223002018457, 'min_impurity_decrease': 0.7724641275472884, 'max_features': 0.7657725206580205, 'subsample': 0.15874470470197977, 'dropout_rate': 0.2620217358848993, 'ccp_alpha': 0.099029101374057}. Best is trial 573 with value: 0.8538054350764822.[0m
