[32m[I 2022-04-23 16:06:24,661][0m Trial 506 finished with value: 0.8072838952295298 and parameters: {'n_hidden': 1024, 'mixture_components': 6, 'use_sparse_layer': False, 'use_batchnorm': False, 'use_dropout': False, 'mlp_size_1': 6, 'mlp_size_2': 1, 'mlp_size_3': 0, 'kernel': 'LogLogistic', 'loss_name': 'AlternativeNLLLoss'}. Best is trial 477 with value: 0.9281730871914304.[0m
[32m[I 2022-04-23 16:11:14,141][0m Trial 507 finished with value: 0.926973614888664 and parameters: {'n_hidden': 1024, 'mixture_components': 3, 'use_sparse_layer': False, 'use_batchnorm': False, 'use_dropout': False, 'mlp_size_1': 6, 'mlp_size_2': 1, 'mlp_size_3': 0, 'kernel': 'Normal', 'loss_name': 'AlternativeNLLLoss'}. Best is trial 477 with value: 0.9281730871914304.[0m
[32m[I 2022-04-23 16:16:15,254][0m Trial 508 finished with value: 0.9262386049804933 and parameters: {'n_hidden': 1024, 'mixture_components': 4, 'use_sparse_layer': False, 'use_batchnorm': False, 'use_dropout': False, 'mlp_size_1': 6, 'mlp_size_2': 1, 'mlp_size_3': 0, 'kernel': 'Normal', 'loss_name': 'AlternativeNLLLoss'}. Best is trial 477 with value: 0.9281730871914304.[0m
[32m[I 2022-04-23 16:18:07,853][0m Trial 509 finished with value: -0.5 and parameters: {'n_hidden': 512, 'mixture_components': 6, 'use_sparse_layer': False, 'use_batchnorm': False, 'use_dropout': False, 'mlp_size_1': 6, 'mlp_size_2': 0, 'mlp_size_3': 0, 'kernel': 'Exponential', 'loss_name': 'CensoredNLLLoss'}. Best is trial 477 with value: 0.9281730871914304.[0m
[32m[I 2022-04-23 16:22:06,148][0m Trial 510 finished with value: 0.8078616225317298 and parameters: {'n_hidden': 1024, 'mixture_components': 6, 'use_sparse_layer': False, 'use_batchnorm': False, 'use_dropout': False, 'mlp_size_1': 6, 'mlp_size_2': 1, 'mlp_size_3': 0, 'kernel': 'Normal', 'loss_name': 'NLLLoss'}. Best is trial 477 with value: 0.9281730871914304.[0m
[32m[I 2022-04-23 16:27:26,822][0m Trial 511 finished with value: 0.9268527196538109 and parameters: {'n_hidden': 1024, 'mixture_components': 5, 'use_sparse_layer': False, 'use_batchnorm': False, 'use_dropout': False, 'mlp_size_1': 6, 'mlp_size_2': 1, 'mlp_size_3': 0, 'kernel': 'Normal', 'loss_name': 'AlternativeNLLLoss'}. Best is trial 477 with value: 0.9281730871914304.[0m
[32m[I 2022-04-23 16:32:33,203][0m Trial 512 finished with value: 0.9262316680101346 and parameters: {'n_hidden': 1024, 'mixture_components': 4, 'use_sparse_layer': False, 'use_batchnorm': False, 'use_dropout': False, 'mlp_size_1': 6, 'mlp_size_2': 1, 'mlp_size_3': 0, 'kernel': 'Normal', 'loss_name': 'AlternativeNLLLoss'}. Best is trial 477 with value: 0.9281730871914304.[0m
[32m[I 2022-04-23 16:37:15,121][0m Trial 513 finished with value: 0.7155922768009034 and parameters: {'n_hidden': 1024, 'mixture_components': 7, 'use_sparse_layer': False, 'use_batchnorm': False, 'use_dropout': False, 'mlp_size_1': 6, 'mlp_size_2': 1, 'mlp_size_3': 0, 'kernel': 'Normal', 'loss_name': 'AlternativeNLLLoss'}. Best is trial 477 with value: 0.9281730871914304.[0m
[32m[I 2022-04-23 16:42:10,064][0m Trial 514 finished with value: 0.9265255428989544 and parameters: {'n_hidden': 1024, 'mixture_components': 6, 'use_sparse_layer': False, 'use_batchnorm': False, 'use_dropout': False, 'mlp_size_1': 6, 'mlp_size_2': 1, 'mlp_size_3': 0, 'kernel': 'Normal', 'loss_name': 'AlternativeNLLLoss'}. Best is trial 477 with value: 0.9281730871914304.[0m
[32m[I 2022-04-23 16:47:13,329][0m Trial 515 finished with value: 0.9239510317659757 and parameters: {'n_hidden': 128, 'mixture_components': 5, 'use_sparse_layer': False, 'use_batchnorm': False, 'use_dropout': False, 'mlp_size_1': 4, 'mlp_size_2': 0, 'mlp_size_3': 0, 'kernel': 'Normal', 'loss_name': 'AlternativeNLLLoss'}. Best is trial 477 with value: 0.9281730871914304.[0m
[32m[I 2022-04-23 16:53:34,964][0m Trial 516 finished with value: 0.9244993625599139 and parameters: {'n_hidden': 64, 'mixture_components': 5, 'use_sparse_layer': False, 'use_batchnorm': False, 'use_dropout': False, 'mlp_size_1': 3, 'mlp_size_2': 0, 'mlp_size_3': 0, 'kernel': 'Normal', 'loss_name': 'AlternativeNLLLoss'}. Best is trial 477 with value: 0.9281730871914304.[0m
[32m[I 2022-04-23 16:58:17,820][0m Trial 517 finished with value: 0.9249856573363339 and parameters: {'n_hidden': 1024, 'mixture_components': 6, 'use_sparse_layer': False, 'use_batchnorm': False, 'use_dropout': False, 'mlp_size_1': 6, 'mlp_size_2': 1, 'mlp_size_3': 0, 'kernel': 'Normal', 'loss_name': 'AlternativeNLLLoss'}. Best is trial 477 with value: 0.9281730871914304.[0m
[32m[I 2022-04-23 17:01:14,689][0m Trial 518 finished with value: 0.4009908736552689 and parameters: {'n_hidden': 1024, 'mixture_components': 3, 'use_sparse_layer': False, 'use_batchnorm': False, 'use_dropout': True, 'dropout': 0.8982574996459608, 'mlp_size_1': 6, 'mlp_size_2': 1, 'mlp_size_3': 0, 'kernel': 'Normal', 'loss_name': 'CensoredNLLLoss'}. Best is trial 477 with value: 0.9281730871914304.[0m
[32m[I 2022-04-23 17:06:18,027][0m Trial 519 finished with value: 0.9146619601024977 and parameters: {'n_hidden': 1024, 'mixture_components': 6, 'use_sparse_layer': False, 'use_batchnorm': False, 'use_dropout': False, 'mlp_size_1': 6, 'mlp_size_2': 1, 'mlp_size_3': 0, 'kernel': 'Normal', 'loss_name': 'AlternativeNLLLoss'}. Best is trial 477 with value: 0.9281730871914304.[0m
[32m[I 2022-04-23 17:15:51,324][0m Trial 520 finished with value: 0.9191120256650361 and parameters: {'n_hidden': 2048, 'mixture_components': 5, 'use_sparse_layer': False, 'use_batchnorm': True, 'use_dropout': False, 'mlp_size_1': 5, 'mlp_size_2': 2, 'mlp_size_3': 0, 'kernel': 'Normal', 'loss_name': 'AlternativeNLLLoss'}. Best is trial 477 with value: 0.9281730871914304.[0m
[32m[I 2022-04-23 17:20:24,553][0m Trial 521 finished with value: 0.9266872888801936 and parameters: {'n_hidden': 1024, 'mixture_components': 4, 'use_sparse_layer': True, 'use_sparse_loss': True, 'lmbd': 6.508105889043634e-06, 'use_batchnorm': False, 'use_dropout': False, 'mlp_size_1': 6, 'mlp_size_2': 1, 'mlp_size_3': 0, 'kernel': 'Logistic', 'loss_name': 'AlternativeNLLLoss'}. Best is trial 477 with value: 0.9281730871914304.[0m
[32m[I 2022-04-23 17:24:52,819][0m Trial 522 finished with value: 0.8178521538520185 and parameters: {'n_hidden': 256, 'mixture_components': 6, 'use_sparse_layer': False, 'use_batchnorm': False, 'use_dropout': False, 'mlp_size_1': 5, 'mlp_size_2': 0, 'mlp_size_3': 0, 'kernel': 'Normal', 'loss_name': 'AlternativeNLLLoss'}. Best is trial 477 with value: 0.9281730871914304.[0m
[32m[I 2022-04-23 17:29:46,954][0m Trial 523 finished with value: 0.9230831255339635 and parameters: {'n_hidden': 1024, 'mixture_components': 5, 'use_sparse_layer': False, 'use_batchnorm': False, 'use_dropout': False, 'mlp_size_1': 6, 'mlp_size_2': 1, 'mlp_size_3': 0, 'kernel': 'Normal', 'loss_name': 'AlternativeNLLLoss'}. Best is trial 477 with value: 0.9281730871914304.[0m
[32m[I 2022-04-23 17:34:47,196][0m Trial 524 finished with value: 0.8161170640821724 and parameters: {'n_hidden': 1024, 'mixture_components': 6, 'use_sparse_layer': False, 'use_batchnorm': False, 'use_dropout': False, 'mlp_size_1': 6, 'mlp_size_2': 1, 'mlp_size_3': 0, 'kernel': 'Normal', 'loss_name': 'AlternativeNLLLoss'}. Best is trial 477 with value: 0.9281730871914304.[0m
[32m[I 2022-04-23 17:40:06,562][0m Trial 525 finished with value: 0.8237125372926876 and parameters: {'n_hidden': 1024, 'mixture_components': 4, 'use_sparse_layer': False, 'use_batchnorm': False, 'use_dropout': False, 'mlp_size_1': 6, 'mlp_size_2': 1, 'mlp_size_3': 0, 'kernel': 'Normal', 'loss_name': 'AlternativeNLLLoss'}. Best is trial 477 with value: 0.9281730871914304.[0m
[32m[I 2022-04-23 17:45:29,408][0m Trial 526 finished with value: 0.9272511571832844 and parameters: {'n_hidden': 1024, 'mixture_components': 5, 'use_sparse_layer': False, 'use_batchnorm': False, 'use_dropout': False, 'mlp_size_1': 6, 'mlp_size_2': 1, 'mlp_size_3': 0, 'kernel': 'Normal', 'loss_name': 'CensoredNLLLoss'}. Best is trial 477 with value: 0.9281730871914304.[0m
[32m[I 2022-04-23 17:50:40,618][0m Trial 527 finished with value: 0.9246946950398047 and parameters: {'n_hidden': 1024, 'mixture_components': 5, 'use_sparse_layer': False, 'use_batchnorm': False, 'use_dropout': False, 'mlp_size_1': 6, 'mlp_size_2': 1, 'mlp_size_3': 0, 'kernel': 'Normal', 'loss_name': 'CensoredNLLLoss'}. Best is trial 477 with value: 0.9281730871914304.[0m
[32m[I 2022-04-23 17:56:48,722][0m Trial 528 finished with value: 0.9260544262201501 and parameters: {'n_hidden': 1024, 'mixture_components': 5, 'use_sparse_layer': False, 'use_batchnorm': False, 'use_dropout': False, 'mlp_size_1': 6, 'mlp_size_2': 1, 'mlp_size_3': 0, 'kernel': 'Normal', 'loss_name': 'CensoredNLLLoss'}. Best is trial 477 with value: 0.9281730871914304.[0m
[32m[I 2022-04-23 18:02:01,583][0m Trial 529 finished with value: 0.9261376921959352 and parameters: {'n_hidden': 1024, 'mixture_components': 5, 'use_sparse_layer': False, 'use_batchnorm': False, 'use_dropout': False, 'mlp_size_1': 6, 'mlp_size_2': 1, 'mlp_size_3': 0, 'kernel': 'Normal', 'loss_name': 'CensoredNLLLoss'}. Best is trial 477 with value: 0.9281730871914304.[0m
[32m[I 2022-04-23 18:06:33,546][0m Trial 530 finished with value: 0.9229933297890499 and parameters: {'n_hidden': 1024, 'mixture_components': 5, 'use_sparse_layer': False, 'use_batchnorm': False, 'use_dropout': False, 'mlp_size_1': 6, 'mlp_size_2': 1, 'mlp_size_3': 0, 'kernel': 'LogLogistic', 'loss_name': 'CensoredNLLLoss'}. Best is trial 477 with value: 0.9281730871914304.[0m
[32m[I 2022-04-23 18:11:34,851][0m Trial 531 finished with value: 0.9271298827491273 and parameters: {'n_hidden': 1024, 'mixture_components': 5, 'use_sparse_layer': False, 'use_batchnorm': False, 'use_dropout': False, 'mlp_size_1': 6, 'mlp_size_2': 1, 'mlp_size_3': 0, 'kernel': 'Normal', 'loss_name': 'CensoredNLLLoss'}. Best is trial 477 with value: 0.9281730871914304.[0m
[32m[I 2022-04-23 18:14:01,891][0m Trial 532 finished with value: -0.5 and parameters: {'n_hidden': 1024, 'mixture_components': 5, 'use_sparse_layer': False, 'use_batchnorm': False, 'use_dropout': False, 'mlp_size_1': 6, 'mlp_size_2': 1, 'mlp_size_3': 0, 'kernel': 'Exponential', 'loss_name': 'CensoredNLLLoss'}. Best is trial 477 with value: 0.9281730871914304.[0m
[32m[I 2022-04-23 18:19:37,322][0m Trial 533 finished with value: 0.927942666626987 and parameters: {'n_hidden': 1024, 'mixture_components': 5, 'use_sparse_layer': False, 'use_batchnorm': False, 'use_dropout': False, 'mlp_size_1': 6, 'mlp_size_2': 1, 'mlp_size_3': 0, 'kernel': 'Normal', 'loss_name': 'CensoredNLLLoss'}. Best is trial 477 with value: 0.9281730871914304.[0m
[32m[I 2022-04-23 18:25:00,638][0m Trial 534 finished with value: 0.9263296260464694 and parameters: {'n_hidden': 1024, 'mixture_components': 5, 'use_sparse_layer': False, 'use_batchnorm': False, 'use_dropout': False, 'mlp_size_1': 6, 'mlp_size_2': 1, 'mlp_size_3': 0, 'kernel': 'Normal', 'loss_name': 'CensoredNLLLoss'}. Best is trial 477 with value: 0.9281730871914304.[0m
[32m[I 2022-04-23 18:30:05,265][0m Trial 535 finished with value: 0.9247006990687308 and parameters: {'n_hidden': 1024, 'mixture_components': 5, 'use_sparse_layer': False, 'use_batchnorm': False, 'use_dropout': False, 'mlp_size_1': 6, 'mlp_size_2': 1, 'mlp_size_3': 0, 'kernel': 'Normal', 'loss_name': 'CensoredNLLLoss'}. Best is trial 477 with value: 0.9281730871914304.[0m
[32m[I 2022-04-23 18:35:36,579][0m Trial 536 finished with value: 0.9247701180461263 and parameters: {'n_hidden': 512, 'mixture_components': 5, 'use_sparse_layer': False, 'use_batchnorm': False, 'use_dropout': False, 'mlp_size_1': 6, 'mlp_size_2': 0, 'mlp_size_3': 0, 'kernel': 'Normal', 'loss_name': 'CensoredNLLLoss'}. Best is trial 477 with value: 0.9281730871914304.[0m
[32m[I 2022-04-23 18:40:48,925][0m Trial 537 finished with value: 0.9246672937065554 and parameters: {'n_hidden': 1024, 'mixture_components': 5, 'use_sparse_layer': False, 'use_batchnorm': False, 'use_dropout': False, 'mlp_size_1': 6, 'mlp_size_2': 1, 'mlp_size_3': 0, 'kernel': 'Normal', 'loss_name': 'CensoredNLLLoss'}. Best is trial 477 with value: 0.9281730871914304.[0m
[32m[I 2022-04-23 18:47:50,307][0m Trial 538 finished with value: 0.9231185549076132 and parameters: {'n_hidden': 32, 'mixture_components': 5, 'use_sparse_layer': False, 'use_batchnorm': False, 'use_dropout': False, 'mlp_size_1': 2, 'mlp_size_2': 0, 'mlp_size_3': 0, 'kernel': 'Normal', 'loss_name': 'CensoredNLLLoss'}. Best is trial 477 with value: 0.9281730871914304.[0m
[32m[I 2022-04-23 18:55:33,534][0m Trial 539 finished with value: 0.617324485308279 and parameters: {'n_hidden': 1024, 'mixture_components': 5, 'use_sparse_layer': False, 'use_batchnorm': True, 'use_dropout': False, 'mlp_size_1': 6, 'mlp_size_2': 1, 'mlp_size_3': 0, 'kernel': 'Normal', 'loss_name': 'CensoredNLLLoss'}. Best is trial 477 with value: 0.9281730871914304.[0m
[32m[I 2022-04-23 19:01:11,387][0m Trial 540 finished with value: 0.924688237888253 and parameters: {'n_hidden': 128, 'mixture_components': 5, 'use_sparse_layer': False, 'use_batchnorm': False, 'use_dropout': False, 'mlp_size_1': 4, 'mlp_size_2': 0, 'mlp_size_3': 0, 'kernel': 'Normal', 'loss_name': 'CensoredNLLLoss'}. Best is trial 477 with value: 0.9281730871914304.[0m
[32m[I 2022-04-23 19:06:26,854][0m Trial 541 finished with value: 0.9258531487812041 and parameters: {'n_hidden': 1024, 'mixture_components': 5, 'use_sparse_layer': True, 'use_sparse_loss': False, 'use_batchnorm': False, 'use_dropout': True, 'dropout': 0.09638314824550853, 'mlp_size_1': 6, 'mlp_size_2': 1, 'mlp_size_3': 0, 'kernel': 'Normal', 'loss_name': 'CensoredNLLLoss'}. Best is trial 477 with value: 0.9281730871914304.[0m
[32m[I 2022-04-23 19:11:06,715][0m Trial 542 finished with value: 0.8200998105172296 and parameters: {'n_hidden': 1024, 'mixture_components': 5, 'use_sparse_layer': False, 'use_batchnorm': False, 'use_dropout': False, 'mlp_size_1': 6, 'mlp_size_2': 1, 'mlp_size_3': 0, 'kernel': 'Normal', 'loss_name': 'CensoredNLLLoss'}. Best is trial 477 with value: 0.9281730871914304.[0m
[32m[I 2022-04-23 19:16:38,718][0m Trial 543 finished with value: 0.9264451342337512 and parameters: {'n_hidden': 1024, 'mixture_components': 5, 'use_sparse_layer': False, 'use_batchnorm': False, 'use_dropout': False, 'mlp_size_1': 6, 'mlp_size_2': 1, 'mlp_size_3': 0, 'kernel': 'Normal', 'loss_name': 'CensoredNLLLoss'}. Best is trial 477 with value: 0.9281730871914304.[0m
[32m[I 2022-04-23 19:21:43,434][0m Trial 544 finished with value: 0.9263235305090106 and parameters: {'n_hidden': 1024, 'mixture_components': 5, 'use_sparse_layer': False, 'use_batchnorm': False, 'use_dropout': False, 'mlp_size_1': 6, 'mlp_size_2': 1, 'mlp_size_3': 0, 'kernel': 'Normal', 'loss_name': 'CensoredNLLLoss'}. Best is trial 477 with value: 0.9281730871914304.[0m
[32m[I 2022-04-23 19:26:48,507][0m Trial 545 finished with value: 0.9238696625195424 and parameters: {'n_hidden': 64, 'mixture_components': 2, 'use_sparse_layer': False, 'use_batchnorm': False, 'use_dropout': False, 'mlp_size_1': 3, 'mlp_size_2': 0, 'mlp_size_3': 0, 'kernel': 'Logistic', 'loss_name': 'CensoredNLLLoss'}. Best is trial 477 with value: 0.9281730871914304.[0m
[32m[I 2022-04-23 19:31:56,146][0m Trial 546 finished with value: 0.9257932542304654 and parameters: {'n_hidden': 1024, 'mixture_components': 5, 'use_sparse_layer': False, 'use_batchnorm': False, 'use_dropout': False, 'mlp_size_1': 6, 'mlp_size_2': 1, 'mlp_size_3': 0, 'kernel': 'Normal', 'loss_name': 'CensoredNLLLoss'}. Best is trial 477 with value: 0.9281730871914304.[0m
[32m[I 2022-04-23 19:36:12,648][0m Trial 547 finished with value: 0.9133129300396353 and parameters: {'n_hidden': 1024, 'mixture_components': 1, 'use_sparse_layer': False, 'use_batchnorm': False, 'use_dropout': False, 'mlp_size_1': 6, 'mlp_size_2': 1, 'mlp_size_3': 0, 'kernel': 'Normal', 'loss_name': 'NLLLoss'}. Best is trial 477 with value: 0.9281730871914304.[0m
[32m[I 2022-04-23 19:41:51,686][0m Trial 548 finished with value: 0.9267252744519178 and parameters: {'n_hidden': 1024, 'mixture_components': 5, 'use_sparse_layer': False, 'use_batchnorm': False, 'use_dropout': False, 'mlp_size_1': 6, 'mlp_size_2': 1, 'mlp_size_3': 0, 'kernel': 'Normal', 'loss_name': 'CensoredNLLLoss'}. Best is trial 477 with value: 0.9281730871914304.[0m
[32m[I 2022-04-23 19:47:25,970][0m Trial 549 finished with value: 0.8264618276412454 and parameters: {'n_hidden': 1024, 'mixture_components': 5, 'use_sparse_layer': False, 'use_batchnorm': False, 'use_dropout': False, 'mlp_size_1': 6, 'mlp_size_2': 1, 'mlp_size_3': 0, 'kernel': 'Normal', 'loss_name': 'CensoredNLLLoss'}. Best is trial 477 with value: 0.9281730871914304.[0m
[32m[I 2022-04-23 19:53:55,945][0m Trial 550 finished with value: 0.919014341555133 and parameters: {'n_hidden': 2048, 'mixture_components': 5, 'use_sparse_layer': False, 'use_batchnorm': False, 'use_dropout': False, 'mlp_size_1': 7, 'mlp_size_2': 1, 'mlp_size_3': 0, 'kernel': 'Normal', 'loss_name': 'CensoredNLLLoss'}. Best is trial 477 with value: 0.9281730871914304.[0m
[32m[I 2022-04-23 19:59:51,830][0m Trial 551 finished with value: 0.9247591542426079 and parameters: {'n_hidden': 256, 'mixture_components': 7, 'use_sparse_layer': False, 'use_batchnorm': False, 'use_dropout': False, 'mlp_size_1': 5, 'mlp_size_2': 0, 'mlp_size_3': 0, 'kernel': 'Normal', 'loss_name': 'CensoredNLLLoss'}. Best is trial 477 with value: 0.9281730871914304.[0m
[32m[I 2022-04-23 20:05:55,618][0m Trial 552 finished with value: 0.8269294026179077 and parameters: {'n_hidden': 1024, 'mixture_components': 6, 'use_sparse_layer': False, 'use_batchnorm': False, 'use_dropout': False, 'mlp_size_1': 6, 'mlp_size_2': 1, 'mlp_size_3': 0, 'kernel': 'Normal', 'loss_name': 'AlternativeNLLLoss'}. Best is trial 477 with value: 0.9281730871914304.[0m
[32m[I 2022-04-23 20:10:58,051][0m Trial 553 finished with value: 0.9164426941109465 and parameters: {'n_hidden': 1024, 'mixture_components': 5, 'use_sparse_layer': False, 'use_batchnorm': False, 'use_dropout': False, 'mlp_size_1': 6, 'mlp_size_2': 1, 'mlp_size_3': 0, 'kernel': 'Normal', 'loss_name': 'AlternativeNLLLoss'}. Best is trial 477 with value: 0.9281730871914304.[0m
[32m[I 2022-04-23 20:16:05,283][0m Trial 554 finished with value: 0.9239577425724226 and parameters: {'n_hidden': 1024, 'mixture_components': 6, 'use_sparse_layer': False, 'use_batchnorm': False, 'use_dropout': False, 'mlp_size_1': 6, 'mlp_size_2': 1, 'mlp_size_3': 0, 'kernel': 'Normal', 'loss_name': 'AlternativeNLLLoss'}. Best is trial 477 with value: 0.9281730871914304.[0m
[32m[I 2022-04-23 20:19:48,234][0m Trial 555 finished with value: 0.7838402559488198 and parameters: {'n_hidden': 1024, 'mixture_components': 5, 'use_sparse_layer': False, 'use_batchnorm': False, 'use_dropout': False, 'mlp_size_1': 6, 'mlp_size_2': 1, 'mlp_size_3': 0, 'kernel': 'LogLogistic', 'loss_name': 'NLLLoss'}. Best is trial 477 with value: 0.9281730871914304.[0m
[32m[I 2022-04-23 20:25:37,855][0m Trial 556 finished with value: 0.927449160764507 and parameters: {'n_hidden': 1024, 'mixture_components': 6, 'use_sparse_layer': False, 'use_batchnorm': False, 'use_dropout': False, 'mlp_size_1': 6, 'mlp_size_2': 1, 'mlp_size_3': 0, 'kernel': 'Normal', 'loss_name': 'AlternativeNLLLoss'}. Best is trial 477 with value: 0.9281730871914304.[0m
[32m[I 2022-04-23 20:28:02,425][0m Trial 557 finished with value: -0.5 and parameters: {'n_hidden': 1024, 'mixture_components': 6, 'use_sparse_layer': False, 'use_batchnorm': False, 'use_dropout': True, 'dropout': 0.5297603932728289, 'mlp_size_1': 6, 'mlp_size_2': 1, 'mlp_size_3': 0, 'kernel': 'Exponential', 'loss_name': 'AlternativeNLLLoss'}. Best is trial 477 with value: 0.9281730871914304.[0m
[32m[I 2022-04-23 20:36:00,405][0m Trial 558 finished with value: 0.7174445010726215 and parameters: {'n_hidden': 1024, 'mixture_components': 5, 'use_sparse_layer': False, 'use_batchnorm': True, 'use_dropout': False, 'mlp_size_1': 6, 'mlp_size_2': 1, 'mlp_size_3': 0, 'kernel': 'Normal', 'loss_name': 'AlternativeNLLLoss'}. Best is trial 477 with value: 0.9281730871914304.[0m
[32m[I 2022-04-23 20:42:19,006][0m Trial 559 finished with value: 0.9271606034736344 and parameters: {'n_hidden': 1024, 'mixture_components': 7, 'use_sparse_layer': False, 'use_batchnorm': False, 'use_dropout': False, 'mlp_size_1': 6, 'mlp_size_2': 1, 'mlp_size_3': 0, 'kernel': 'Normal', 'loss_name': 'CensoredNLLLoss'}. Best is trial 477 with value: 0.9281730871914304.[0m
[32m[I 2022-04-23 20:47:08,977][0m Trial 560 finished with value: 0.8154217959231268 and parameters: {'n_hidden': 1024, 'mixture_components': 6, 'use_sparse_layer': False, 'use_batchnorm': False, 'use_dropout': False, 'mlp_size_1': 6, 'mlp_size_2': 1, 'mlp_size_3': 0, 'kernel': 'Normal', 'loss_name': 'AlternativeNLLLoss'}. Best is trial 477 with value: 0.9281730871914304.[0m
[32m[I 2022-04-23 20:52:35,920][0m Trial 561 finished with value: 0.9267421536022319 and parameters: {'n_hidden': 1024, 'mixture_components': 5, 'use_sparse_layer': True, 'use_sparse_loss': False, 'use_batchnorm': False, 'use_dropout': False, 'mlp_size_1': 6, 'mlp_size_2': 1, 'mlp_size_3': 0, 'kernel': 'Normal', 'loss_name': 'AlternativeNLLLoss'}. Best is trial 477 with value: 0.9281730871914304.[0m
[32m[I 2022-04-23 20:58:23,620][0m Trial 562 finished with value: 0.9272903836379263 and parameters: {'n_hidden': 1024, 'mixture_components': 6, 'use_sparse_layer': False, 'use_batchnorm': False, 'use_dropout': False, 'mlp_size_1': 6, 'mlp_size_2': 1, 'mlp_size_3': 0, 'kernel': 'Normal', 'loss_name': 'AlternativeNLLLoss'}. Best is trial 477 with value: 0.9281730871914304.[0m
