[32m[I 2022-04-21 12:41:30,658][0m Trial 435 finished with value: 0.9082115035098924 and parameters: {'splitter': 'random', 'min_samples_split': 0.066179220770864, 'min_samples_leaf': 0.0333815041444784, 'min_weight_fraction_leaf': 0.02369814571006955, 'max_features': 0.611705761201618}. Best is trial 253 with value: 0.9108382257790575.[0m
[32m[I 2022-04-21 12:41:31,845][0m Trial 436 finished with value: 0.27767972743265307 and parameters: {'splitter': 'random', 'min_samples_split': 0.09175163694884117, 'min_samples_leaf': 0.3028758360780304, 'min_weight_fraction_leaf': 0.016031827120127705, 'max_features': 0.6004948660915566}. Best is trial 253 with value: 0.9108382257790575.[0m
[32m[I 2022-04-21 12:41:33,218][0m Trial 437 finished with value: 0.8784468215552625 and parameters: {'splitter': 'random', 'min_samples_split': 0.07533799929759147, 'min_samples_leaf': 0.23645537284933416, 'min_weight_fraction_leaf': 0.020803782644260197, 'max_features': 0.9657165852335952}. Best is trial 253 with value: 0.9108382257790575.[0m
[32m[I 2022-04-21 12:41:35,499][0m Trial 438 finished with value: 0.8993525714635375 and parameters: {'splitter': 'random', 'min_samples_split': 0.08291180088585552, 'min_samples_leaf': 0.027024638452785767, 'min_weight_fraction_leaf': 0.007242168708698735, 'max_features': 0.8124773344758472}. Best is trial 253 with value: 0.9108382257790575.[0m
[32m[I 2022-04-21 12:41:37,210][0m Trial 439 finished with value: 0.9016728103777378 and parameters: {'splitter': 'random', 'min_samples_split': 0.06787308960160976, 'min_samples_leaf': 0.037474551829200724, 'min_weight_fraction_leaf': 7.841101508633541e-05, 'max_features': 0.9372620101612481}. Best is trial 253 with value: 0.9108382257790575.[0m
[32m[I 2022-04-21 12:41:38,852][0m Trial 440 finished with value: 0.8992083114066525 and parameters: {'splitter': 'random', 'min_samples_split': 0.06401992749321965, 'min_samples_leaf': 0.06002416609707485, 'min_weight_fraction_leaf': 0.02778501154955227, 'max_features': 0.8989664775342362}. Best is trial 253 with value: 0.9108382257790575.[0m
[32m[I 2022-04-21 12:41:40,714][0m Trial 441 finished with value: 0.9021690405920688 and parameters: {'splitter': 'random', 'min_samples_split': 0.07293958038419754, 'min_samples_leaf': 0.017664560814399585, 'min_weight_fraction_leaf': 0.03667929946841772, 'max_features': 0.9746548735592157}. Best is trial 253 with value: 0.9108382257790575.[0m
[32m[I 2022-04-21 12:41:42,204][0m Trial 442 finished with value: 0.8705240119569204 and parameters: {'splitter': 'random', 'min_samples_split': 0.05895997806427561, 'min_samples_leaf': 0.04666026248781306, 'min_weight_fraction_leaf': 0.018673210914489327, 'max_features': 0.22505921418025998}. Best is trial 253 with value: 0.9108382257790575.[0m
[32m[I 2022-04-21 12:41:44,264][0m Trial 443 finished with value: 0.9053238947287141 and parameters: {'splitter': 'random', 'min_samples_split': 0.05166386828500798, 'min_samples_leaf': 0.029329472977402318, 'min_weight_fraction_leaf': 0.03211406664587176, 'max_features': 0.9503993001969785}. Best is trial 253 with value: 0.9108382257790575.[0m
[32m[I 2022-04-21 12:41:45,354][0m Trial 444 finished with value: 0.8541570878155751 and parameters: {'splitter': 'random', 'min_samples_split': 0.07826991706202888, 'min_samples_leaf': 0.03320688227921222, 'min_weight_fraction_leaf': 0.02499776973670078, 'max_features': 0.2737097776287258}. Best is trial 253 with value: 0.9108382257790575.[0m
[32m[I 2022-04-21 12:41:47,150][0m Trial 445 finished with value: 0.8956718926884195 and parameters: {'splitter': 'random', 'min_samples_split': 0.06515134807323217, 'min_samples_leaf': 0.019546888326513398, 'min_weight_fraction_leaf': 0.03838702201850329, 'max_features': 0.6173242424166702}. Best is trial 253 with value: 0.9108382257790575.[0m
[32m[I 2022-04-21 12:41:49,308][0m Trial 446 finished with value: 0.9066476863686745 and parameters: {'splitter': 'random', 'min_samples_split': 0.08909014565584154, 'min_samples_leaf': 0.04524668228132971, 'min_weight_fraction_leaf': 0.012999026509395092, 'max_features': 0.9185183541236275}. Best is trial 253 with value: 0.9108382257790575.[0m
[32m[I 2022-04-21 12:41:51,550][0m Trial 447 finished with value: 0.8967437169456218 and parameters: {'splitter': 'random', 'min_samples_split': 0.032858742951952805, 'min_samples_leaf': 0.056428780652402984, 'min_weight_fraction_leaf': 0.04139941619545012, 'max_features': 0.4325882084259478}. Best is trial 253 with value: 0.9108382257790575.[0m
[32m[I 2022-04-21 12:41:54,449][0m Trial 448 finished with value: 0.9084744073926279 and parameters: {'splitter': 'random', 'min_samples_split': 0.0408365056316356, 'min_samples_leaf': 0.011790637224427063, 'min_weight_fraction_leaf': 0.0219589171268491, 'max_features': 0.8740222465033687}. Best is trial 253 with value: 0.9108382257790575.[0m
[32m[I 2022-04-21 12:41:55,286][0m Trial 449 finished with value: 0.25329544094439393 and parameters: {'splitter': 'random', 'min_samples_split': 0.023842730386054833, 'min_samples_leaf': 0.001978100175773073, 'min_weight_fraction_leaf': 0.36398922819156665, 'max_features': 0.46792789798139234}. Best is trial 253 with value: 0.9108382257790575.[0m
[32m[I 2022-04-21 12:41:57,424][0m Trial 450 finished with value: 0.9071667676850479 and parameters: {'splitter': 'random', 'min_samples_split': 0.04296465643683962, 'min_samples_leaf': 0.010962644919602145, 'min_weight_fraction_leaf': 0.012968208119375272, 'max_features': 0.7481175591016562}. Best is trial 253 with value: 0.9108382257790575.[0m
[32m[I 2022-04-21 12:41:59,868][0m Trial 451 finished with value: 0.9003915056905585 and parameters: {'splitter': 'random', 'min_samples_split': 0.044428976475142434, 'min_samples_leaf': 0.008646658713772216, 'min_weight_fraction_leaf': 0.006721808028886552, 'max_features': 0.7229660397899086}. Best is trial 253 with value: 0.9108382257790575.[0m
[32m[I 2022-04-21 12:42:01,551][0m Trial 452 finished with value: 0.8925146951036144 and parameters: {'splitter': 'random', 'min_samples_split': 0.16913227649503673, 'min_samples_leaf': 0.011767174196459517, 'min_weight_fraction_leaf': 0.012984410234784742, 'max_features': 0.8362824824951637}. Best is trial 253 with value: 0.9108382257790575.[0m
[32m[I 2022-04-21 12:42:02,929][0m Trial 453 finished with value: 0.9060966290168633 and parameters: {'splitter': 'random', 'min_samples_split': 0.04068091949985003, 'min_samples_leaf': 0.011150389123555104, 'min_weight_fraction_leaf': 0.01922695968354985, 'max_features': 0.8700333783905239}. Best is trial 253 with value: 0.9108382257790575.[0m
[32m[I 2022-04-21 12:46:40,505][0m Trial 454 finished with value: 0.8873281252738361 and parameters: {'splitter': 'best', 'min_samples_split': 0.053238975855452904, 'min_samples_leaf': 0.00232597300142285, 'min_weight_fraction_leaf': 0.010512407491914557, 'max_features': 0.7686498545861279}. Best is trial 253 with value: 0.9108382257790575.[0m
[32m[I 2022-04-21 12:46:43,278][0m Trial 455 finished with value: 0.8992853593423146 and parameters: {'splitter': 'random', 'min_samples_split': 0.025558021316069636, 'min_samples_leaf': 0.016969765112470198, 'min_weight_fraction_leaf': 0.016885664526703852, 'max_features': 0.8000550275133463}. Best is trial 253 with value: 0.9108382257790575.[0m
[32m[I 2022-04-21 12:46:46,811][0m Trial 456 finished with value: 0.90106690608584 and parameters: {'splitter': 'random', 'min_samples_split': 0.036837480758481894, 'min_samples_leaf': 0.018029445719620358, 'min_weight_fraction_leaf': 0.02570492377997959, 'max_features': 0.645346751099371}. Best is trial 253 with value: 0.9108382257790575.[0m
[32m[I 2022-04-21 12:46:48,576][0m Trial 457 finished with value: 0.9051924507453222 and parameters: {'splitter': 'random', 'min_samples_split': 0.045973413850697156, 'min_samples_leaf': 0.02239753243450934, 'min_weight_fraction_leaf': 0.00021062273459306752, 'max_features': 0.5403606244668826}. Best is trial 253 with value: 0.9108382257790575.[0m
[32m[I 2022-04-21 12:46:51,895][0m Trial 458 finished with value: 0.9065892379196802 and parameters: {'splitter': 'random', 'min_samples_split': 0.062226765405158, 'min_samples_leaf': 0.00990324331975138, 'min_weight_fraction_leaf': 0.023851112731618655, 'max_features': 0.9976406574967582}. Best is trial 253 with value: 0.9108382257790575.[0m
[32m[I 2022-04-21 12:46:53,228][0m Trial 459 finished with value: 0.9045599577880665 and parameters: {'splitter': 'random', 'min_samples_split': 0.3892298972514325, 'min_samples_leaf': 0.024512483941457053, 'min_weight_fraction_leaf': 0.009450321007396319, 'max_features': 0.7605541616226097}. Best is trial 253 with value: 0.9108382257790575.[0m
[32m[I 2022-04-21 12:46:55,117][0m Trial 460 finished with value: 0.9012759268707974 and parameters: {'splitter': 'random', 'min_samples_split': 0.0300150943197523, 'min_samples_leaf': 0.01356417284216334, 'min_weight_fraction_leaf': 0.02948231350932314, 'max_features': 0.6931354610117276}. Best is trial 253 with value: 0.9108382257790575.[0m
[32m[I 2022-04-21 12:46:57,099][0m Trial 461 finished with value: 0.9000785916679984 and parameters: {'splitter': 'random', 'min_samples_split': 0.01725991058281399, 'min_samples_leaf': 0.026037535821865094, 'min_weight_fraction_leaf': 0.019397811294002684, 'max_features': 0.6753798980769935}. Best is trial 253 with value: 0.9108382257790575.[0m
[32m[I 2022-04-21 12:46:58,985][0m Trial 462 finished with value: 0.8974590709077568 and parameters: {'splitter': 'random', 'min_samples_split': 0.07563313989151899, 'min_samples_leaf': 0.035505207568943126, 'min_weight_fraction_leaf': 0.030804170124102886, 'max_features': 0.5686136790754784}. Best is trial 253 with value: 0.9108382257790575.[0m
[32m[I 2022-04-21 12:47:00,719][0m Trial 463 finished with value: 0.8952305051722828 and parameters: {'splitter': 'random', 'min_samples_split': 0.12563659672569927, 'min_samples_leaf': 0.0013572345690636865, 'min_weight_fraction_leaf': 0.01978283985662466, 'max_features': 0.7125271639426383}. Best is trial 253 with value: 0.9108382257790575.[0m
[32m[I 2022-04-21 12:47:03,358][0m Trial 464 finished with value: 0.9004655449797948 and parameters: {'splitter': 'random', 'min_samples_split': 0.10975004793772203, 'min_samples_leaf': 0.021140106341911893, 'min_weight_fraction_leaf': 0.009494174080062388, 'max_features': 0.9393196606069876}. Best is trial 253 with value: 0.9108382257790575.[0m
[32m[I 2022-04-21 12:47:05,262][0m Trial 465 finished with value: 0.8803008758513791 and parameters: {'splitter': 'random', 'min_samples_split': 0.05313971857895068, 'min_samples_leaf': 0.0010434046869382783, 'min_weight_fraction_leaf': 0.15728769917148908, 'max_features': 0.9269025222714452}. Best is trial 253 with value: 0.9108382257790575.[0m
[32m[I 2022-04-21 12:47:07,495][0m Trial 466 finished with value: 0.9058574576624678 and parameters: {'splitter': 'random', 'min_samples_split': 0.0685805286353556, 'min_samples_leaf': 0.030123718165875203, 'min_weight_fraction_leaf': 0.03308757879739925, 'max_features': 0.9602699332887037}. Best is trial 253 with value: 0.9108382257790575.[0m
[32m[I 2022-04-21 12:47:09,786][0m Trial 467 finished with value: 0.9019123597504416 and parameters: {'splitter': 'random', 'min_samples_split': 0.03866996479129243, 'min_samples_leaf': 0.012755328296568422, 'min_weight_fraction_leaf': 0.02556911755797898, 'max_features': 0.8859057064742111}. Best is trial 253 with value: 0.9108382257790575.[0m
[32m[I 2022-04-21 12:47:12,618][0m Trial 468 finished with value: 0.885614122412085 and parameters: {'splitter': 'random', 'min_samples_split': 0.048942066417494066, 'min_samples_leaf': 0.04141323483799453, 'min_weight_fraction_leaf': 0.04088012261711476, 'max_features': 0.4981118610012439}. Best is trial 253 with value: 0.9108382257790575.[0m
[32m[I 2022-04-21 12:47:14,022][0m Trial 469 finished with value: 0.25 and parameters: {'splitter': 'random', 'min_samples_split': 0.028347972830786834, 'min_samples_leaf': 0.024982613250153114, 'min_weight_fraction_leaf': 0.4498787497081512, 'max_features': 0.6549591669206088}. Best is trial 253 with value: 0.9108382257790575.[0m
[32m[I 2022-04-21 12:47:16,263][0m Trial 470 finished with value: 0.9017670648804632 and parameters: {'splitter': 'random', 'min_samples_split': 0.08304680491177074, 'min_samples_leaf': 0.03578809609927412, 'min_weight_fraction_leaf': 0.0007426937791771664, 'max_features': 0.8519792642527657}. Best is trial 253 with value: 0.9108382257790575.[0m
[32m[I 2022-04-21 12:47:18,913][0m Trial 471 finished with value: 0.9016153117260555 and parameters: {'splitter': 'random', 'min_samples_split': 0.09774099581213894, 'min_samples_leaf': 0.012583257833856032, 'min_weight_fraction_leaf': 0.01661271808599072, 'max_features': 0.9429458730110973}. Best is trial 253 with value: 0.9108382257790575.[0m
[32m[I 2022-04-21 12:47:20,964][0m Trial 472 finished with value: 0.8986830052774305 and parameters: {'splitter': 'random', 'min_samples_split': 0.26013618199510885, 'min_samples_leaf': 0.029128699626863735, 'min_weight_fraction_leaf': 0.03286370363291606, 'max_features': 0.8970318520482617}. Best is trial 253 with value: 0.9108382257790575.[0m
[32m[I 2022-04-21 12:50:45,648][0m Trial 473 finished with value: 0.8855819630942176 and parameters: {'splitter': 'best', 'min_samples_split': 0.05978008540453486, 'min_samples_leaf': 0.02066407604240353, 'min_weight_fraction_leaf': 0.024819326263207653, 'max_features': 0.9303306367051248}. Best is trial 253 with value: 0.9108382257790575.[0m
[32m[I 2022-04-21 12:50:48,729][0m Trial 474 finished with value: 0.9041544992442627 and parameters: {'splitter': 'random', 'min_samples_split': 0.016565779187771162, 'min_samples_leaf': 0.040054733715551044, 'min_weight_fraction_leaf': 0.041327076965297624, 'max_features': 0.9790891037652935}. Best is trial 253 with value: 0.9108382257790575.[0m
/media/san2_ssd/data/Workdir/survival/utils.py:305: RuntimeWarning: invalid value encountered in true_divide
  pdfs = np.gradient(1-survs,axis=1)/norms
[32m[I 2022-04-21 12:50:52,312][0m Trial 475 finished with value: 0.8991688759027664 and parameters: {'splitter': 'random', 'min_samples_split': 0.04135760637257728, 'min_samples_leaf': 0.010808020204463588, 'min_weight_fraction_leaf': 0.010971442041230847, 'max_features': 0.9160722624135499}. Best is trial 253 with value: 0.9108382257790575.[0m
[32m[I 2022-04-21 12:50:54,872][0m Trial 476 finished with value: 0.8902544480376694 and parameters: {'splitter': 'random', 'min_samples_split': 0.06829804049808447, 'min_samples_leaf': 0.0692732377023994, 'min_weight_fraction_leaf': 0.03337615305609363, 'max_features': 0.9569617608753097}. Best is trial 253 with value: 0.9108382257790575.[0m
[32m[I 2022-04-21 12:50:58,234][0m Trial 477 finished with value: 0.9000035637933038 and parameters: {'splitter': 'random', 'min_samples_split': 0.031750482791578064, 'min_samples_leaf': 0.04991278014075494, 'min_weight_fraction_leaf': 0.020331659408868386, 'max_features': 0.8898456551530677}. Best is trial 253 with value: 0.9108382257790575.[0m
[32m[I 2022-04-21 12:51:01,634][0m Trial 478 finished with value: 0.9069469350705667 and parameters: {'splitter': 'random', 'min_samples_split': 0.056827651575091766, 'min_samples_leaf': 0.021223361164543347, 'min_weight_fraction_leaf': 0.04541169369404317, 'max_features': 0.9251258629908944}. Best is trial 253 with value: 0.9108382257790575.[0m
[32m[I 2022-04-21 12:51:02,939][0m Trial 479 finished with value: 0.9005372892957793 and parameters: {'splitter': 'random', 'min_samples_split': 0.011717650700097212, 'min_samples_leaf': 0.03174013937249285, 'min_weight_fraction_leaf': 0.02769894541313264, 'max_features': 0.8701499509722592}. Best is trial 253 with value: 0.9108382257790575.[0m
[32m[I 2022-04-21 12:51:03,768][0m Trial 480 finished with value: 0.8992348721213945 and parameters: {'splitter': 'random', 'min_samples_split': 0.023465419949174438, 'min_samples_leaf': 0.12120841811314581, 'min_weight_fraction_leaf': 0.010137067305943335, 'max_features': 0.9065830556394967}. Best is trial 253 with value: 0.9108382257790575.[0m
[32m[I 2022-04-21 12:51:05,648][0m Trial 481 finished with value: 0.901307764010767 and parameters: {'splitter': 'random', 'min_samples_split': 0.049188063231456525, 'min_samples_leaf': 0.040717085976452246, 'min_weight_fraction_leaf': 0.03785623283399483, 'max_features': 0.9458661329930963}. Best is trial 253 with value: 0.9108382257790575.[0m
[32m[I 2022-04-21 12:51:07,845][0m Trial 482 finished with value: 0.9079157374319253 and parameters: {'splitter': 'random', 'min_samples_split': 0.07662400108817015, 'min_samples_leaf': 0.01040184701940974, 'min_weight_fraction_leaf': 0.019569232035231195, 'max_features': 0.7523077816506483}. Best is trial 253 with value: 0.9108382257790575.[0m
[32m[I 2022-04-21 12:51:09,872][0m Trial 483 finished with value: 0.9008943622856694 and parameters: {'splitter': 'random', 'min_samples_split': 0.09326176349791414, 'min_samples_leaf': 0.009894103682197425, 'min_weight_fraction_leaf': 0.017317254215909354, 'max_features': 0.6704020978022921}. Best is trial 253 with value: 0.9108382257790575.[0m
/media/san2_ssd/data/Workdir/survival/utils.py:305: RuntimeWarning: invalid value encountered in true_divide
  pdfs = np.gradient(1-survs,axis=1)/norms
[32m[I 2022-04-21 12:51:11,921][0m Trial 484 finished with value: 0.8995184898577573 and parameters: {'splitter': 'random', 'min_samples_split': 0.08394491851248113, 'min_samples_leaf': 0.001721418873374788, 'min_weight_fraction_leaf': 0.008142478864864744, 'max_features': 0.7287125239817638}. Best is trial 253 with value: 0.9108382257790575.[0m
[32m[I 2022-04-21 12:51:13,018][0m Trial 485 finished with value: 0.9036186093204097 and parameters: {'splitter': 'random', 'min_samples_split': 0.07594256678755956, 'min_samples_leaf': 0.015760163631630103, 'min_weight_fraction_leaf': 1.4227917548693611e-05, 'max_features': 0.6313303606548396}. Best is trial 253 with value: 0.9108382257790575.[0m
[32m[I 2022-04-21 12:51:14,318][0m Trial 486 finished with value: 0.9005344397195165 and parameters: {'splitter': 'random', 'min_samples_split': 0.0781542419134964, 'min_samples_leaf': 0.008259451186267206, 'min_weight_fraction_leaf': 0.022667716413935862, 'max_features': 0.7429039952729662}. Best is trial 253 with value: 0.9108382257790575.[0m
[32m[I 2022-04-21 12:51:15,461][0m Trial 487 finished with value: 0.9031151873436137 and parameters: {'splitter': 'random', 'min_samples_split': 0.06956234482680017, 'min_samples_leaf': 0.020721113723424174, 'min_weight_fraction_leaf': 0.017173483037816982, 'max_features': 0.7866005514263036}. Best is trial 253 with value: 0.9108382257790575.[0m
[32m[I 2022-04-21 12:51:16,575][0m Trial 488 finished with value: 0.9052431747073614 and parameters: {'splitter': 'random', 'min_samples_split': 0.28726192742524553, 'min_samples_leaf': 0.029244201928991825, 'min_weight_fraction_leaf': 0.027739643389320386, 'max_features': 0.7508254563088627}. Best is trial 253 with value: 0.9108382257790575.[0m
[32m[I 2022-04-21 12:51:18,271][0m Trial 489 finished with value: 0.8797245818194697 and parameters: {'splitter': 'random', 'min_samples_split': 0.09657974876066569, 'min_samples_leaf': 0.05520193405533513, 'min_weight_fraction_leaf': 0.2072163022059613, 'max_features': 0.9713544658995541}. Best is trial 253 with value: 0.9108382257790575.[0m
[32m[I 2022-04-21 12:51:21,489][0m Trial 490 finished with value: 0.8996443875226212 and parameters: {'splitter': 'random', 'min_samples_split': 0.08485482317837194, 'min_samples_leaf': 0.03659424496378059, 'min_weight_fraction_leaf': 0.010491413345982904, 'max_features': 0.811271522138645}. Best is trial 253 with value: 0.9108382257790575.[0m
[32m[I 2022-04-21 12:51:23,652][0m Trial 491 finished with value: 0.8972534000176863 and parameters: {'splitter': 'random', 'min_samples_split': 0.06430415247549692, 'min_samples_leaf': 0.01692384361051172, 'min_weight_fraction_leaf': 0.03264187526064906, 'max_features': 0.8276386743303553}. Best is trial 253 with value: 0.9108382257790575.[0m
[32m[I 2022-04-21 12:51:25,464][0m Trial 492 finished with value: 0.9069592665488588 and parameters: {'splitter': 'random', 'min_samples_split': 0.07217743546327218, 'min_samples_leaf': 0.08000257375573458, 'min_weight_fraction_leaf': 0.02374211354379282, 'max_features': 0.9290656581371263}. Best is trial 253 with value: 0.9108382257790575.[0m
[32m[I 2022-04-21 12:54:22,340][0m Trial 493 finished with value: 0.8867536002629295 and parameters: {'splitter': 'best', 'min_samples_split': 0.06061632890016891, 'min_samples_leaf': 0.04827631447569443, 'min_weight_fraction_leaf': 0.03944907392644001, 'max_features': 0.8895576564685627}. Best is trial 253 with value: 0.9108382257790575.[0m
[32m[I 2022-04-21 12:54:24,373][0m Trial 494 finished with value: 0.9043263933869776 and parameters: {'splitter': 'random', 'min_samples_split': 0.05537453926430356, 'min_samples_leaf': 0.02878791306114374, 'min_weight_fraction_leaf': 0.015422440640649196, 'max_features': 0.9073805098012424}. Best is trial 253 with value: 0.9108382257790575.[0m
[32m[I 2022-04-21 12:54:26,979][0m Trial 495 finished with value: 0.8995813848431029 and parameters: {'splitter': 'random', 'min_samples_split': 0.09007621430695276, 'min_samples_leaf': 0.011107305158780395, 'min_weight_fraction_leaf': 0.030233475642520387, 'max_features': 0.6824715268866363}. Best is trial 253 with value: 0.9108382257790575.[0m
[32m[I 2022-04-21 12:54:28,380][0m Trial 496 finished with value: 0.8948356633669231 and parameters: {'splitter': 'random', 'min_samples_split': 0.10365912678793296, 'min_samples_leaf': 0.09503707187423555, 'min_weight_fraction_leaf': 0.04509547752484559, 'max_features': 0.8495179228938983}. Best is trial 253 with value: 0.9108382257790575.[0m
