[32m[I 2022-04-28 00:06:56,399][0m Trial 715 finished with value: 0.8501935982440042 and parameters: {'n_hidden': 2048, 'mixture_components': 4, 'use_sparse_layer': False, 'use_batchnorm': False, 'use_dropout': False, 'mlp_size_1': 8, 'mlp_size_2': 0, 'mlp_size_3': 0, 'kernel': 'Normal', 'loss_name': 'AlternativeNLLLoss'}. Best is trial 644 with value: 0.8553858439194377.[0m
[32m[I 2022-04-28 00:11:59,427][0m Trial 716 finished with value: 0.8468591829050254 and parameters: {'n_hidden': 2048, 'mixture_components': 6, 'use_sparse_layer': False, 'use_batchnorm': False, 'use_dropout': False, 'mlp_size_1': 7, 'mlp_size_2': 1, 'mlp_size_3': 0, 'kernel': 'LogLogistic', 'loss_name': 'CensoredNLLLoss'}. Best is trial 644 with value: 0.8553858439194377.[0m
[32m[I 2022-04-28 00:17:29,041][0m Trial 717 finished with value: 0.8541106702887703 and parameters: {'n_hidden': 2048, 'mixture_components': 5, 'use_sparse_layer': False, 'use_batchnorm': False, 'use_dropout': False, 'mlp_size_1': 7, 'mlp_size_2': 1, 'mlp_size_3': 0, 'kernel': 'Normal', 'loss_name': 'AlternativeNLLLoss'}. Best is trial 644 with value: 0.8553858439194377.[0m
[32m[I 2022-04-28 00:22:33,715][0m Trial 718 finished with value: 0.8427079973666727 and parameters: {'n_hidden': 2048, 'mixture_components': 4, 'use_sparse_layer': False, 'use_batchnorm': False, 'use_dropout': False, 'mlp_size_1': 7, 'mlp_size_2': 1, 'mlp_size_3': 0, 'kernel': 'Normal', 'loss_name': 'AlternativeNLLLoss'}. Best is trial 644 with value: 0.8553858439194377.[0m
[32m[I 2022-04-28 00:23:57,876][0m Trial 719 finished with value: -1.0 and parameters: {'n_hidden': 128, 'mixture_components': 5, 'use_sparse_layer': False, 'use_batchnorm': False, 'use_dropout': False, 'mlp_size_1': 4, 'mlp_size_2': 0, 'mlp_size_3': 0, 'kernel': 'Exponential', 'loss_name': 'AlternativeNLLLoss'}. Best is trial 644 with value: 0.8553858439194377.[0m
[32m[I 2022-04-28 00:29:47,635][0m Trial 720 finished with value: 0.8530855809361814 and parameters: {'n_hidden': 2048, 'mixture_components': 4, 'use_sparse_layer': False, 'use_batchnorm': False, 'use_dropout': False, 'mlp_size_1': 7, 'mlp_size_2': 1, 'mlp_size_3': 0, 'kernel': 'Normal', 'loss_name': 'AlternativeNLLLoss'}. Best is trial 644 with value: 0.8553858439194377.[0m
[32m[I 2022-04-28 00:34:33,971][0m Trial 721 finished with value: 0.8182298513463075 and parameters: {'n_hidden': 2048, 'mixture_components': 6, 'use_sparse_layer': False, 'use_batchnorm': False, 'use_dropout': False, 'mlp_size_1': 7, 'mlp_size_2': 1, 'mlp_size_3': 0, 'kernel': 'LogLogistic', 'loss_name': 'AlternativeNLLLoss'}. Best is trial 644 with value: 0.8553858439194377.[0m
[32m[I 2022-04-28 00:40:10,731][0m Trial 722 finished with value: 0.8471301805979918 and parameters: {'n_hidden': 2048, 'mixture_components': 5, 'use_sparse_layer': False, 'use_batchnorm': False, 'use_dropout': False, 'mlp_size_1': 7, 'mlp_size_2': 1, 'mlp_size_3': 0, 'kernel': 'Normal', 'loss_name': 'AlternativeNLLLoss'}. Best is trial 644 with value: 0.8553858439194377.[0m
[32m[I 2022-04-28 00:44:53,205][0m Trial 723 finished with value: 0.8372608081103898 and parameters: {'n_hidden': 2048, 'mixture_components': 5, 'use_sparse_layer': False, 'use_batchnorm': False, 'use_dropout': False, 'mlp_size_1': 7, 'mlp_size_2': 1, 'mlp_size_3': 0, 'kernel': 'Normal', 'loss_name': 'AlternativeNLLLoss'}. Best is trial 644 with value: 0.8553858439194377.[0m
[32m[I 2022-04-28 00:50:45,744][0m Trial 724 finished with value: 0.8249325278467037 and parameters: {'n_hidden': 2048, 'mixture_components': 5, 'use_sparse_layer': False, 'use_batchnorm': False, 'use_dropout': False, 'mlp_size_1': 7, 'mlp_size_2': 1, 'mlp_size_3': 0, 'kernel': 'Normal', 'loss_name': 'AlternativeNLLLoss'}. Best is trial 644 with value: 0.8553858439194377.[0m
[32m[I 2022-04-28 00:54:31,632][0m Trial 725 finished with value: 0.8512920375417655 and parameters: {'n_hidden': 1024, 'mixture_components': 4, 'use_sparse_layer': False, 'use_batchnorm': False, 'use_dropout': False, 'mlp_size_1': 7, 'mlp_size_2': 0, 'mlp_size_3': 0, 'kernel': 'LogLogistic', 'loss_name': 'CensoredNLLLoss'}. Best is trial 644 with value: 0.8553858439194377.[0m
[32m[I 2022-04-28 00:58:46,292][0m Trial 726 finished with value: 0.7739088839636261 and parameters: {'n_hidden': 2048, 'mixture_components': 6, 'use_sparse_layer': False, 'use_batchnorm': False, 'use_dropout': False, 'mlp_size_1': 7, 'mlp_size_2': 1, 'mlp_size_3': 0, 'kernel': 'Normal', 'loss_name': 'AlternativeNLLLoss'}. Best is trial 644 with value: 0.8553858439194377.[0m
[32m[I 2022-04-28 01:04:00,178][0m Trial 727 finished with value: 0.8344215998344884 and parameters: {'n_hidden': 2048, 'mixture_components': 4, 'use_sparse_layer': False, 'use_batchnorm': False, 'use_dropout': False, 'mlp_size_1': 7, 'mlp_size_2': 1, 'mlp_size_3': 0, 'kernel': 'Normal', 'loss_name': 'AlternativeNLLLoss'}. Best is trial 644 with value: 0.8553858439194377.[0m
[32m[I 2022-04-28 01:08:10,689][0m Trial 728 finished with value: 0.8404990159620912 and parameters: {'n_hidden': 512, 'mixture_components': 5, 'use_sparse_layer': False, 'use_batchnorm': False, 'use_dropout': False, 'mlp_size_1': 6, 'mlp_size_2': 0, 'mlp_size_3': 0, 'kernel': 'Normal', 'loss_name': 'AlternativeNLLLoss'}. Best is trial 644 with value: 0.8553858439194377.[0m
[32m[I 2022-04-28 01:12:49,825][0m Trial 729 finished with value: 0.7493318375670818 and parameters: {'n_hidden': 2048, 'mixture_components': 7, 'use_sparse_layer': False, 'use_batchnorm': False, 'use_dropout': False, 'mlp_size_1': 7, 'mlp_size_2': 1, 'mlp_size_3': 0, 'kernel': 'LogLogistic', 'loss_name': 'AlternativeNLLLoss'}. Best is trial 644 with value: 0.8553858439194377.[0m
[32m[I 2022-04-28 01:18:55,316][0m Trial 730 finished with value: 0.8443228749767206 and parameters: {'n_hidden': 2048, 'mixture_components': 4, 'use_sparse_layer': False, 'use_batchnorm': False, 'use_dropout': False, 'mlp_size_1': 8, 'mlp_size_2': 0, 'mlp_size_3': 0, 'kernel': 'Normal', 'loss_name': 'AlternativeNLLLoss'}. Best is trial 644 with value: 0.8553858439194377.[0m
[32m[I 2022-04-28 01:25:01,768][0m Trial 731 finished with value: 0.8531233860078776 and parameters: {'n_hidden': 2048, 'mixture_components': 5, 'use_sparse_layer': False, 'use_batchnorm': False, 'use_dropout': False, 'mlp_size_1': 7, 'mlp_size_2': 1, 'mlp_size_3': 0, 'kernel': 'Normal', 'loss_name': 'AlternativeNLLLoss'}. Best is trial 644 with value: 0.8553858439194377.[0m
[32m[I 2022-04-28 01:29:10,116][0m Trial 732 finished with value: 0.46635700896886095 and parameters: {'n_hidden': 2048, 'mixture_components': 6, 'use_sparse_layer': False, 'use_batchnorm': False, 'use_dropout': False, 'mlp_size_1': 7, 'mlp_size_2': 1, 'mlp_size_3': 0, 'kernel': 'LogLogistic', 'loss_name': 'AlternativeNLLLoss'}. Best is trial 644 with value: 0.8553858439194377.[0m
[32m[I 2022-04-28 01:39:42,015][0m Trial 733 finished with value: 0.8439063820147729 and parameters: {'n_hidden': 2048, 'mixture_components': 4, 'use_sparse_layer': False, 'use_batchnorm': True, 'use_dropout': False, 'mlp_size_1': 7, 'mlp_size_2': 1, 'mlp_size_3': 0, 'kernel': 'Normal', 'loss_name': 'CensoredNLLLoss'}. Best is trial 644 with value: 0.8553858439194377.[0m
[32m[I 2022-04-28 01:46:20,184][0m Trial 734 finished with value: 0.8507654732775414 and parameters: {'n_hidden': 64, 'mixture_components': 5, 'use_sparse_layer': False, 'use_batchnorm': False, 'use_dropout': False, 'mlp_size_1': 3, 'mlp_size_2': 0, 'mlp_size_3': 0, 'kernel': 'Normal', 'loss_name': 'AlternativeNLLLoss'}. Best is trial 644 with value: 0.8553858439194377.[0m
[32m[I 2022-04-28 01:51:44,856][0m Trial 735 finished with value: 0.8521276100313514 and parameters: {'n_hidden': 2048, 'mixture_components': 5, 'use_sparse_layer': False, 'use_batchnorm': False, 'use_dropout': False, 'mlp_size_1': 7, 'mlp_size_2': 1, 'mlp_size_3': 0, 'kernel': 'Normal', 'loss_name': 'AlternativeNLLLoss'}. Best is trial 644 with value: 0.8553858439194377.[0m
[32m[I 2022-04-28 01:56:29,239][0m Trial 736 finished with value: 0.8329763078876157 and parameters: {'n_hidden': 2048, 'mixture_components': 5, 'use_sparse_layer': False, 'use_batchnorm': False, 'use_dropout': False, 'mlp_size_1': 7, 'mlp_size_2': 1, 'mlp_size_3': 0, 'kernel': 'LogLogistic', 'loss_name': 'NLLLoss'}. Best is trial 644 with value: 0.8553858439194377.[0m
[32m[I 2022-04-28 02:02:08,641][0m Trial 737 finished with value: 0.850957650024505 and parameters: {'n_hidden': 2048, 'mixture_components': 4, 'use_sparse_layer': False, 'use_batchnorm': False, 'use_dropout': False, 'mlp_size_1': 7, 'mlp_size_2': 1, 'mlp_size_3': 0, 'kernel': 'Normal', 'loss_name': 'AlternativeNLLLoss'}. Best is trial 644 with value: 0.8553858439194377.[0m
[32m[I 2022-04-28 02:07:41,176][0m Trial 738 finished with value: 0.7531319573252583 and parameters: {'n_hidden': 2048, 'mixture_components': 6, 'use_sparse_layer': False, 'use_batchnorm': False, 'use_dropout': False, 'mlp_size_1': 7, 'mlp_size_2': 1, 'mlp_size_3': 0, 'kernel': 'Normal', 'loss_name': 'AlternativeNLLLoss'}. Best is trial 644 with value: 0.8553858439194377.[0m
[32m[I 2022-04-28 02:12:03,997][0m Trial 739 finished with value: 0.46060496507427207 and parameters: {'n_hidden': 2048, 'mixture_components': 5, 'use_sparse_layer': False, 'use_batchnorm': False, 'use_dropout': False, 'mlp_size_1': 7, 'mlp_size_2': 1, 'mlp_size_3': 0, 'kernel': 'Normal', 'loss_name': 'AlternativeNLLLoss'}. Best is trial 644 with value: 0.8553858439194377.[0m
[32m[I 2022-04-28 02:15:15,005][0m Trial 740 finished with value: 0.8450318067344954 and parameters: {'n_hidden': 256, 'mixture_components': 5, 'use_sparse_layer': False, 'use_batchnorm': False, 'use_dropout': False, 'mlp_size_1': 5, 'mlp_size_2': 0, 'mlp_size_3': 0, 'kernel': 'LogLogistic', 'loss_name': 'AlternativeNLLLoss'}. Best is trial 644 with value: 0.8553858439194377.[0m
[32m[I 2022-04-28 02:21:11,952][0m Trial 741 finished with value: 0.8439846403991937 and parameters: {'n_hidden': 2048, 'mixture_components': 4, 'use_sparse_layer': False, 'use_batchnorm': False, 'use_dropout': False, 'mlp_size_1': 7, 'mlp_size_2': 1, 'mlp_size_3': 0, 'kernel': 'Normal', 'loss_name': 'AlternativeNLLLoss'}. Best is trial 644 with value: 0.8553858439194377.[0m
[32m[I 2022-04-28 02:23:55,545][0m Trial 742 finished with value: -1.0 and parameters: {'n_hidden': 2048, 'mixture_components': 6, 'use_sparse_layer': False, 'use_batchnorm': False, 'use_dropout': False, 'mlp_size_1': 8, 'mlp_size_2': 0, 'mlp_size_3': 0, 'kernel': 'Exponential', 'loss_name': 'AlternativeNLLLoss'}. Best is trial 644 with value: 0.8553858439194377.[0m
[32m[I 2022-04-28 02:28:16,254][0m Trial 743 finished with value: 0.8519255345705161 and parameters: {'n_hidden': 512, 'mixture_components': 4, 'use_sparse_layer': False, 'use_batchnorm': False, 'use_dropout': False, 'mlp_size_1': 6, 'mlp_size_2': 0, 'mlp_size_3': 0, 'kernel': 'Normal', 'loss_name': 'AlternativeNLLLoss'}. Best is trial 644 with value: 0.8553858439194377.[0m
[32m[I 2022-04-28 02:34:28,720][0m Trial 744 finished with value: 0.8536371522639354 and parameters: {'n_hidden': 2048, 'mixture_components': 5, 'use_sparse_layer': False, 'use_batchnorm': False, 'use_dropout': False, 'mlp_size_1': 7, 'mlp_size_2': 1, 'mlp_size_3': 0, 'kernel': 'Normal', 'loss_name': 'CensoredNLLLoss'}. Best is trial 644 with value: 0.8553858439194377.[0m
[32m[I 2022-04-28 02:39:45,451][0m Trial 745 finished with value: 0.8493816838234174 and parameters: {'n_hidden': 32, 'mixture_components': 10, 'use_sparse_layer': False, 'use_batchnorm': False, 'use_dropout': False, 'mlp_size_1': 2, 'mlp_size_2': 0, 'mlp_size_3': 0, 'kernel': 'LogLogistic', 'loss_name': 'AlternativeNLLLoss'}. Best is trial 644 with value: 0.8553858439194377.[0m
[32m[I 2022-04-28 02:45:16,994][0m Trial 746 finished with value: 0.8527296112873625 and parameters: {'n_hidden': 2048, 'mixture_components': 4, 'use_sparse_layer': False, 'use_batchnorm': False, 'use_dropout': False, 'mlp_size_1': 7, 'mlp_size_2': 1, 'mlp_size_3': 0, 'kernel': 'Normal', 'loss_name': 'AlternativeNLLLoss'}. Best is trial 644 with value: 0.8553858439194377.[0m
[32m[I 2022-04-28 02:50:47,319][0m Trial 747 finished with value: 0.8396328368696885 and parameters: {'n_hidden': 2048, 'mixture_components': 5, 'use_sparse_layer': False, 'use_batchnorm': False, 'use_dropout': False, 'mlp_size_1': 7, 'mlp_size_2': 1, 'mlp_size_3': 0, 'kernel': 'Normal', 'loss_name': 'AlternativeNLLLoss'}. Best is trial 644 with value: 0.8553858439194377.[0m
[32m[I 2022-04-28 02:55:34,716][0m Trial 748 finished with value: 0.8333280620741595 and parameters: {'n_hidden': 128, 'mixture_components': 6, 'use_sparse_layer': False, 'use_batchnorm': False, 'use_dropout': False, 'mlp_size_1': 4, 'mlp_size_2': 0, 'mlp_size_3': 0, 'kernel': 'Normal', 'loss_name': 'AlternativeNLLLoss'}. Best is trial 644 with value: 0.8553858439194377.[0m
[32m[I 2022-04-28 02:59:54,185][0m Trial 749 finished with value: 0.7848309577763071 and parameters: {'n_hidden': 2048, 'mixture_components': 5, 'use_sparse_layer': False, 'use_batchnorm': False, 'use_dropout': False, 'mlp_size_1': 7, 'mlp_size_2': 1, 'mlp_size_3': 0, 'kernel': 'LogLogistic', 'loss_name': 'AlternativeNLLLoss'}. Best is trial 644 with value: 0.8553858439194377.[0m
[32m[I 2022-04-28 03:05:53,939][0m Trial 750 finished with value: 0.854366559315659 and parameters: {'n_hidden': 2048, 'mixture_components': 4, 'use_sparse_layer': False, 'use_batchnorm': False, 'use_dropout': False, 'mlp_size_1': 7, 'mlp_size_2': 1, 'mlp_size_3': 0, 'kernel': 'Normal', 'loss_name': 'AlternativeNLLLoss'}. Best is trial 644 with value: 0.8553858439194377.[0m
[32m[I 2022-04-28 03:11:45,070][0m Trial 751 finished with value: 0.8551351854248068 and parameters: {'n_hidden': 2048, 'mixture_components': 4, 'use_sparse_layer': False, 'use_batchnorm': False, 'use_dropout': False, 'mlp_size_1': 7, 'mlp_size_2': 1, 'mlp_size_3': 0, 'kernel': 'Normal', 'loss_name': 'CensoredNLLLoss'}. Best is trial 644 with value: 0.8553858439194377.[0m
[32m[I 2022-04-28 03:17:28,837][0m Trial 752 finished with value: 0.8543652871412476 and parameters: {'n_hidden': 2048, 'mixture_components': 4, 'use_sparse_layer': False, 'use_batchnorm': False, 'use_dropout': False, 'mlp_size_1': 7, 'mlp_size_2': 1, 'mlp_size_3': 0, 'kernel': 'Normal', 'loss_name': 'CensoredNLLLoss'}. Best is trial 644 with value: 0.8553858439194377.[0m
[32m[I 2022-04-28 03:23:02,389][0m Trial 753 finished with value: 0.851457458578295 and parameters: {'n_hidden': 2048, 'mixture_components': 4, 'use_sparse_layer': False, 'use_batchnorm': False, 'use_dropout': False, 'mlp_size_1': 7, 'mlp_size_2': 1, 'mlp_size_3': 0, 'kernel': 'Normal', 'loss_name': 'CensoredNLLLoss'}. Best is trial 644 with value: 0.8553858439194377.[0m
[32m[I 2022-04-28 03:34:08,768][0m Trial 754 finished with value: 0.841492510982708 and parameters: {'n_hidden': 2048, 'mixture_components': 4, 'use_sparse_layer': False, 'use_batchnorm': True, 'use_dropout': False, 'mlp_size_1': 7, 'mlp_size_2': 1, 'mlp_size_3': 0, 'kernel': 'LogLogistic', 'loss_name': 'CensoredNLLLoss'}. Best is trial 644 with value: 0.8553858439194377.[0m
[32m[I 2022-04-28 03:40:07,120][0m Trial 755 finished with value: 0.8530109184699803 and parameters: {'n_hidden': 2048, 'mixture_components': 4, 'use_sparse_layer': False, 'use_batchnorm': False, 'use_dropout': False, 'mlp_size_1': 7, 'mlp_size_2': 1, 'mlp_size_3': 0, 'kernel': 'Normal', 'loss_name': 'CensoredNLLLoss'}. Best is trial 644 with value: 0.8553858439194377.[0m
[32m[I 2022-04-28 03:45:35,180][0m Trial 756 finished with value: 0.8523359384398767 and parameters: {'n_hidden': 2048, 'mixture_components': 4, 'use_sparse_layer': False, 'use_batchnorm': False, 'use_dropout': False, 'mlp_size_1': 7, 'mlp_size_2': 1, 'mlp_size_3': 0, 'kernel': 'Normal', 'loss_name': 'CensoredNLLLoss'}. Best is trial 644 with value: 0.8553858439194377.[0m
[32m[I 2022-04-28 03:50:30,120][0m Trial 757 finished with value: 0.8405701690535684 and parameters: {'n_hidden': 2048, 'mixture_components': 4, 'use_sparse_layer': False, 'use_batchnorm': False, 'use_dropout': False, 'mlp_size_1': 7, 'mlp_size_2': 1, 'mlp_size_3': 0, 'kernel': 'LogLogistic', 'loss_name': 'CensoredNLLLoss'}. Best is trial 644 with value: 0.8553858439194377.[0m
[32m[I 2022-04-28 03:56:10,964][0m Trial 758 finished with value: 0.8532116985569077 and parameters: {'n_hidden': 2048, 'mixture_components': 4, 'use_sparse_layer': False, 'use_batchnorm': False, 'use_dropout': False, 'mlp_size_1': 7, 'mlp_size_2': 1, 'mlp_size_3': 0, 'kernel': 'Normal', 'loss_name': 'CensoredNLLLoss'}. Best is trial 644 with value: 0.8553858439194377.[0m
[32m[I 2022-04-28 04:01:13,953][0m Trial 759 finished with value: 0.848613951948191 and parameters: {'n_hidden': 2048, 'mixture_components': 4, 'use_sparse_layer': False, 'use_batchnorm': False, 'use_dropout': False, 'mlp_size_1': 7, 'mlp_size_2': 1, 'mlp_size_3': 0, 'kernel': 'Normal', 'loss_name': 'CensoredNLLLoss'}. Best is trial 644 with value: 0.8553858439194377.[0m
[32m[I 2022-04-28 04:06:41,867][0m Trial 760 finished with value: 0.8521924882654422 and parameters: {'n_hidden': 2048, 'mixture_components': 4, 'use_sparse_layer': False, 'use_batchnorm': False, 'use_dropout': False, 'mlp_size_1': 7, 'mlp_size_2': 1, 'mlp_size_3': 0, 'kernel': 'Normal', 'loss_name': 'CensoredNLLLoss'}. Best is trial 644 with value: 0.8553858439194377.[0m
[32m[I 2022-04-28 04:12:06,948][0m Trial 761 finished with value: 0.8516945672264242 and parameters: {'n_hidden': 2048, 'mixture_components': 4, 'use_sparse_layer': False, 'use_batchnorm': False, 'use_dropout': False, 'mlp_size_1': 7, 'mlp_size_2': 1, 'mlp_size_3': 0, 'kernel': 'LogLogistic', 'loss_name': 'CensoredNLLLoss'}. Best is trial 644 with value: 0.8553858439194377.[0m
[32m[I 2022-04-28 04:18:06,529][0m Trial 762 finished with value: 0.853125667457757 and parameters: {'n_hidden': 2048, 'mixture_components': 4, 'use_sparse_layer': False, 'use_batchnorm': False, 'use_dropout': False, 'mlp_size_1': 7, 'mlp_size_2': 1, 'mlp_size_3': 0, 'kernel': 'Normal', 'loss_name': 'CensoredNLLLoss'}. Best is trial 644 with value: 0.8553858439194377.[0m
[32m[I 2022-04-28 04:24:02,261][0m Trial 763 finished with value: 0.852725662263898 and parameters: {'n_hidden': 2048, 'mixture_components': 7, 'use_sparse_layer': False, 'use_batchnorm': False, 'use_dropout': False, 'mlp_size_1': 7, 'mlp_size_2': 1, 'mlp_size_3': 0, 'kernel': 'Normal', 'loss_name': 'CensoredNLLLoss'}. Best is trial 644 with value: 0.8553858439194377.[0m
[32m[I 2022-04-28 04:29:45,293][0m Trial 764 finished with value: 0.8533868419643454 and parameters: {'n_hidden': 2048, 'mixture_components': 4, 'use_sparse_layer': False, 'use_batchnorm': False, 'use_dropout': False, 'mlp_size_1': 7, 'mlp_size_2': 1, 'mlp_size_3': 0, 'kernel': 'Normal', 'loss_name': 'CensoredNLLLoss'}. Best is trial 644 with value: 0.8553858439194377.[0m
[32m[I 2022-04-28 04:33:36,110][0m Trial 765 finished with value: 0.8371334689406605 and parameters: {'n_hidden': 1024, 'mixture_components': 4, 'use_sparse_layer': False, 'use_batchnorm': False, 'use_dropout': False, 'mlp_size_1': 7, 'mlp_size_2': 0, 'mlp_size_3': 0, 'kernel': 'LogLogistic', 'loss_name': 'CensoredNLLLoss'}. Best is trial 644 with value: 0.8553858439194377.[0m
[32m[I 2022-04-28 04:39:33,584][0m Trial 766 finished with value: 0.8549350043498738 and parameters: {'n_hidden': 2048, 'mixture_components': 4, 'use_sparse_layer': False, 'use_batchnorm': False, 'use_dropout': False, 'mlp_size_1': 7, 'mlp_size_2': 1, 'mlp_size_3': 0, 'kernel': 'Normal', 'loss_name': 'CensoredNLLLoss'}. Best is trial 644 with value: 0.8553858439194377.[0m
[32m[I 2022-04-28 04:45:19,860][0m Trial 767 finished with value: 0.8527701829021025 and parameters: {'n_hidden': 2048, 'mixture_components': 4, 'use_sparse_layer': False, 'use_batchnorm': False, 'use_dropout': False, 'mlp_size_1': 7, 'mlp_size_2': 1, 'mlp_size_3': 0, 'kernel': 'Normal', 'loss_name': 'CensoredNLLLoss'}. Best is trial 644 with value: 0.8553858439194377.[0m
[32m[I 2022-04-28 04:51:03,758][0m Trial 768 finished with value: 0.8534390819864621 and parameters: {'n_hidden': 2048, 'mixture_components': 4, 'use_sparse_layer': False, 'use_batchnorm': False, 'use_dropout': False, 'mlp_size_1': 7, 'mlp_size_2': 1, 'mlp_size_3': 0, 'kernel': 'Normal', 'loss_name': 'CensoredNLLLoss'}. Best is trial 644 with value: 0.8553858439194377.[0m
[32m[I 2022-04-28 04:56:17,507][0m Trial 769 finished with value: 0.8538499774674937 and parameters: {'n_hidden': 2048, 'mixture_components': 4, 'use_sparse_layer': False, 'use_batchnorm': False, 'use_dropout': False, 'mlp_size_1': 7, 'mlp_size_2': 1, 'mlp_size_3': 0, 'kernel': 'LogLogistic', 'loss_name': 'CensoredNLLLoss'}. Best is trial 644 with value: 0.8553858439194377.[0m
[32m[I 2022-04-28 05:02:24,236][0m Trial 770 finished with value: 0.852354082847096 and parameters: {'n_hidden': 2048, 'mixture_components': 4, 'use_sparse_layer': False, 'use_batchnorm': False, 'use_dropout': False, 'mlp_size_1': 7, 'mlp_size_2': 1, 'mlp_size_3': 0, 'kernel': 'Normal', 'loss_name': 'CensoredNLLLoss'}. Best is trial 644 with value: 0.8553858439194377.[0m
[32m[I 2022-04-28 05:05:26,739][0m Trial 771 finished with value: -1.0 and parameters: {'n_hidden': 2048, 'mixture_components': 4, 'use_sparse_layer': False, 'use_batchnorm': True, 'use_dropout': False, 'mlp_size_1': 7, 'mlp_size_2': 1, 'mlp_size_3': 0, 'kernel': 'Exponential', 'loss_name': 'CensoredNLLLoss'}. Best is trial 644 with value: 0.8553858439194377.[0m
