[32m[I 2022-04-21 14:12:56,208][0m Trial 930 finished with value: 0.900471934044163 and parameters: {'splitter': 'random', 'min_samples_split': 0.07213644935747189, 'min_samples_leaf': 0.028823816389042998, 'min_weight_fraction_leaf': 0.022386836340690535, 'max_features': 0.9064576947371649}. Best is trial 677 with value: 0.9113497956229912.[0m
[32m[I 2022-04-21 14:12:57,895][0m Trial 931 finished with value: 0.37352803050186595 and parameters: {'splitter': 'random', 'min_samples_split': 0.046463928739618576, 'min_samples_leaf': 0.242902214087168, 'min_weight_fraction_leaf': 0.03291479181767594, 'max_features': 0.946172390454384}. Best is trial 677 with value: 0.9113497956229912.[0m
[32m[I 2022-04-21 14:13:01,323][0m Trial 932 finished with value: 0.9051278001883404 and parameters: {'splitter': 'random', 'min_samples_split': 0.0851296281075593, 'min_samples_leaf': 0.007832804932613832, 'min_weight_fraction_leaf': 0.016703071820860317, 'max_features': 0.8801950281610791}. Best is trial 677 with value: 0.9113497956229912.[0m
[32m[I 2022-04-21 14:13:04,540][0m Trial 933 finished with value: 0.9093247923494931 and parameters: {'splitter': 'random', 'min_samples_split': 0.06335759346334731, 'min_samples_leaf': 0.04337502407874286, 'min_weight_fraction_leaf': 0.038752776087506276, 'max_features': 0.9216173639260271}. Best is trial 677 with value: 0.9113497956229912.[0m
[32m[I 2022-04-21 14:13:06,883][0m Trial 934 finished with value: 0.9026186422977982 and parameters: {'splitter': 'random', 'min_samples_split': 0.07538717355879529, 'min_samples_leaf': 0.0492813534770344, 'min_weight_fraction_leaf': 0.03955839526130142, 'max_features': 0.95947000533812}. Best is trial 677 with value: 0.9113497956229912.[0m
[32m[I 2022-04-21 14:13:09,375][0m Trial 935 finished with value: 0.9044792080209373 and parameters: {'splitter': 'random', 'min_samples_split': 0.0563292422925946, 'min_samples_leaf': 0.017398739302700115, 'min_weight_fraction_leaf': 0.02522699838797409, 'max_features': 0.8992327433029692}. Best is trial 677 with value: 0.9113497956229912.[0m
[32m[I 2022-04-21 14:13:11,653][0m Trial 936 finished with value: 0.8979632764079037 and parameters: {'splitter': 'random', 'min_samples_split': 0.042794030059050324, 'min_samples_leaf': 0.02811547369499246, 'min_weight_fraction_leaf': 0.007499053912375313, 'max_features': 0.8546586754037839}. Best is trial 677 with value: 0.9113497956229912.[0m
[32m[I 2022-04-21 14:13:14,215][0m Trial 937 finished with value: 0.9065635563080218 and parameters: {'splitter': 'random', 'min_samples_split': 0.08600443989406156, 'min_samples_leaf': 0.0088136567750512, 'min_weight_fraction_leaf': 0.049216489689023216, 'max_features': 0.9302104880478917}. Best is trial 677 with value: 0.9113497956229912.[0m
[32m[I 2022-04-21 14:13:15,433][0m Trial 938 finished with value: 0.8996240749151145 and parameters: {'splitter': 'random', 'min_samples_split': 0.06422455871063018, 'min_samples_leaf': 0.06269498467251114, 'min_weight_fraction_leaf': 0.041975333846015275, 'max_features': 0.9062928972214849}. Best is trial 677 with value: 0.9113497956229912.[0m
[32m[I 2022-04-21 14:17:50,756][0m Trial 939 finished with value: 0.8870794465645281 and parameters: {'splitter': 'best', 'min_samples_split': 0.05294985655532814, 'min_samples_leaf': 0.0011758648455678367, 'min_weight_fraction_leaf': 0.01603282867076211, 'max_features': 0.9414211345785521}. Best is trial 677 with value: 0.9113497956229912.[0m
[32m[I 2022-04-21 14:17:53,012][0m Trial 940 finished with value: 0.9045005964965582 and parameters: {'splitter': 'random', 'min_samples_split': 0.044564438841814685, 'min_samples_leaf': 0.03476977409541005, 'min_weight_fraction_leaf': 0.027779813626019372, 'max_features': 0.9597351836378177}. Best is trial 677 with value: 0.9113497956229912.[0m
[32m[I 2022-04-21 14:17:56,118][0m Trial 941 finished with value: 0.898010221818226 and parameters: {'splitter': 'random', 'min_samples_split': 0.06557545842836851, 'min_samples_leaf': 0.018253838567709145, 'min_weight_fraction_leaf': 0.007360253866857392, 'max_features': 0.9147045091335397}. Best is trial 677 with value: 0.9113497956229912.[0m
[32m[I 2022-04-21 14:17:59,039][0m Trial 942 finished with value: 0.9035612726624718 and parameters: {'splitter': 'random', 'min_samples_split': 0.0948173696634663, 'min_samples_leaf': 0.04601156125990131, 'min_weight_fraction_leaf': 0.048556355573654036, 'max_features': 0.9307892578827188}. Best is trial 677 with value: 0.9113497956229912.[0m
[32m[I 2022-04-21 14:18:00,658][0m Trial 943 finished with value: 0.9033241511065029 and parameters: {'splitter': 'random', 'min_samples_split': 0.07505261109640456, 'min_samples_leaf': 0.025020246254792187, 'min_weight_fraction_leaf': 0.05789729267211309, 'max_features': 0.8790832491068737}. Best is trial 677 with value: 0.9113497956229912.[0m
[32m[I 2022-04-21 14:18:01,762][0m Trial 944 finished with value: 0.8953155985324003 and parameters: {'splitter': 'random', 'min_samples_split': 0.1051704760936776, 'min_samples_leaf': 0.05573401164330687, 'min_weight_fraction_leaf': 0.037982581677808026, 'max_features': 0.9579047860183292}. Best is trial 677 with value: 0.9113497956229912.[0m
[32m[I 2022-04-21 14:18:03,053][0m Trial 945 finished with value: 0.9007565350473186 and parameters: {'splitter': 'random', 'min_samples_split': 0.2944625070546189, 'min_samples_leaf': 0.03448219662492757, 'min_weight_fraction_leaf': 0.036100950370922855, 'max_features': 0.9397024594345006}. Best is trial 677 with value: 0.9113497956229912.[0m
[32m[I 2022-04-21 14:18:04,761][0m Trial 946 finished with value: 0.902140109659386 and parameters: {'splitter': 'random', 'min_samples_split': 0.06655067964252469, 'min_samples_leaf': 0.017017299787568666, 'min_weight_fraction_leaf': 0.04445077610066246, 'max_features': 0.9002570073462424}. Best is trial 677 with value: 0.9113497956229912.[0m
[32m[I 2022-04-21 14:18:06,514][0m Trial 947 finished with value: 0.9069974386025395 and parameters: {'splitter': 'random', 'min_samples_split': 0.08002642159929801, 'min_samples_leaf': 0.0013278184005111058, 'min_weight_fraction_leaf': 0.06827550942983591, 'max_features': 0.9234795865647142}. Best is trial 677 with value: 0.9113497956229912.[0m
[32m[I 2022-04-21 14:18:07,858][0m Trial 948 finished with value: 0.8998159709574916 and parameters: {'splitter': 'random', 'min_samples_split': 0.06680348526079331, 'min_samples_leaf': 0.04098200165804767, 'min_weight_fraction_leaf': 0.05511656091968091, 'max_features': 0.893654924327057}. Best is trial 677 with value: 0.9113497956229912.[0m
[32m[I 2022-04-21 14:18:10,277][0m Trial 949 finished with value: 0.8962421327210034 and parameters: {'splitter': 'random', 'min_samples_split': 0.04112733953104499, 'min_samples_leaf': 0.025392440049000216, 'min_weight_fraction_leaf': 0.02078398173108757, 'max_features': 0.9140654392909583}. Best is trial 677 with value: 0.9113497956229912.[0m
[32m[I 2022-04-21 14:18:12,184][0m Trial 950 finished with value: 0.8997902197210198 and parameters: {'splitter': 'random', 'min_samples_split': 0.05319740071468387, 'min_samples_leaf': 0.01539378263129849, 'min_weight_fraction_leaf': 0.026221828570562624, 'max_features': 0.9620270772611251}. Best is trial 677 with value: 0.9113497956229912.[0m
[32m[I 2022-04-21 14:18:14,009][0m Trial 951 finished with value: 0.9010757444363783 and parameters: {'splitter': 'random', 'min_samples_split': 0.040487220798061066, 'min_samples_leaf': 0.033467967749517366, 'min_weight_fraction_leaf': 0.014509183577156647, 'max_features': 0.8642580484642844}. Best is trial 677 with value: 0.9113497956229912.[0m
[32m[I 2022-04-21 14:18:17,767][0m Trial 952 finished with value: 0.9035991077363189 and parameters: {'splitter': 'random', 'min_samples_split': 0.07881600483242317, 'min_samples_leaf': 0.04800569737689833, 'min_weight_fraction_leaf': 0.035221844514802224, 'max_features': 0.9438614564429503}. Best is trial 677 with value: 0.9113497956229912.[0m
[32m[I 2022-04-21 14:18:20,672][0m Trial 953 finished with value: 0.9068259439191889 and parameters: {'splitter': 'random', 'min_samples_split': 0.06218721974858031, 'min_samples_leaf': 0.009044153150689082, 'min_weight_fraction_leaf': 0.04620193148276401, 'max_features': 0.9187649699090017}. Best is trial 677 with value: 0.9113497956229912.[0m
[32m[I 2022-04-21 14:18:22,750][0m Trial 954 finished with value: 0.9036692869891139 and parameters: {'splitter': 'random', 'min_samples_split': 0.05410323835273656, 'min_samples_leaf': 0.0246212361223246, 'min_weight_fraction_leaf': 0.0007739665279671813, 'max_features': 0.8861915195071038}. Best is trial 677 with value: 0.9113497956229912.[0m
[32m[I 2022-04-21 14:18:24,845][0m Trial 955 finished with value: 0.9008028993014738 and parameters: {'splitter': 'random', 'min_samples_split': 0.08909972525770893, 'min_samples_leaf': 0.04046087936408907, 'min_weight_fraction_leaf': 0.03487314684201315, 'max_features': 0.9360658912452661}. Best is trial 677 with value: 0.9113497956229912.[0m
[32m[I 2022-04-21 14:18:27,096][0m Trial 956 finished with value: 0.9071142962176172 and parameters: {'splitter': 'random', 'min_samples_split': 0.07056410304674121, 'min_samples_leaf': 0.01823339283838157, 'min_weight_fraction_leaf': 0.047766925735483384, 'max_features': 0.9094842840667017}. Best is trial 677 with value: 0.9113497956229912.[0m
[32m[I 2022-04-21 14:18:28,614][0m Trial 957 finished with value: 0.893239029881965 and parameters: {'splitter': 'random', 'min_samples_split': 0.0608880673097025, 'min_samples_leaf': 0.0673496464478415, 'min_weight_fraction_leaf': 0.03339097279288812, 'max_features': 0.9600831189493245}. Best is trial 677 with value: 0.9113497956229912.[0m
[32m[I 2022-04-21 14:22:27,819][0m Trial 958 finished with value: 0.8838885716788418 and parameters: {'splitter': 'best', 'min_samples_split': 0.07629469278016898, 'min_samples_leaf': 0.0013371109098021762, 'min_weight_fraction_leaf': 0.0610251599616329, 'max_features': 0.9302485874839586}. Best is trial 677 with value: 0.9113497956229912.[0m
[32m[I 2022-04-21 14:22:29,022][0m Trial 959 finished with value: 0.9058385167635009 and parameters: {'splitter': 'random', 'min_samples_split': 0.043291323455752206, 'min_samples_leaf': 0.030207008079779094, 'min_weight_fraction_leaf': 0.01909242094336032, 'max_features': 0.8899757017926806}. Best is trial 677 with value: 0.9113497956229912.[0m
[32m[I 2022-04-21 14:22:31,438][0m Trial 960 finished with value: 0.9035374272070019 and parameters: {'splitter': 'random', 'min_samples_split': 0.05069820014504872, 'min_samples_leaf': 0.053363467103589926, 'min_weight_fraction_leaf': 0.04247094338024602, 'max_features': 0.9449902791926527}. Best is trial 677 with value: 0.9113497956229912.[0m
[32m[I 2022-04-21 14:22:32,969][0m Trial 961 finished with value: 0.8797245818194697 and parameters: {'splitter': 'random', 'min_samples_split': 0.05470627572958896, 'min_samples_leaf': 0.17155471735610536, 'min_weight_fraction_leaf': 0.024929578237617992, 'max_features': 0.9059135017053496}. Best is trial 677 with value: 0.9113497956229912.[0m
[32m[I 2022-04-21 14:22:35,362][0m Trial 962 finished with value: 0.9009690339865111 and parameters: {'splitter': 'random', 'min_samples_split': 0.06725359796148324, 'min_samples_leaf': 0.04437564153697736, 'min_weight_fraction_leaf': 0.03529984716452653, 'max_features': 0.9693751162254117}. Best is trial 677 with value: 0.9113497956229912.[0m
[32m[I 2022-04-21 14:22:37,498][0m Trial 963 finished with value: 0.9024147198942105 and parameters: {'splitter': 'random', 'min_samples_split': 0.08725379369095475, 'min_samples_leaf': 0.011127333042151867, 'min_weight_fraction_leaf': 0.049657521399711274, 'max_features': 0.9275150953085193}. Best is trial 677 with value: 0.9113497956229912.[0m
[32m[I 2022-04-21 14:22:38,840][0m Trial 964 finished with value: 0.900833254903484 and parameters: {'splitter': 'random', 'min_samples_split': 0.06367757174363185, 'min_samples_leaf': 0.024526328259411916, 'min_weight_fraction_leaf': 0.031048144136819472, 'max_features': 0.8661963377831369}. Best is trial 677 with value: 0.9113497956229912.[0m
[32m[I 2022-04-21 14:22:39,844][0m Trial 965 finished with value: 0.9113497956229912 and parameters: {'splitter': 'random', 'min_samples_split': 0.04410061434886591, 'min_samples_leaf': 0.03410943907799186, 'min_weight_fraction_leaf': 0.010827692808808687, 'max_features': 0.9070010833410627}. Best is trial 677 with value: 0.9113497956229912.[0m
[32m[I 2022-04-21 14:22:41,558][0m Trial 966 finished with value: 0.9060966290168633 and parameters: {'splitter': 'random', 'min_samples_split': 0.03918223895400057, 'min_samples_leaf': 0.019272219835754296, 'min_weight_fraction_leaf': 0.002198445679532913, 'max_features': 0.8793385866033114}. Best is trial 677 with value: 0.9113497956229912.[0m
[32m[I 2022-04-21 14:22:43,190][0m Trial 967 finished with value: 0.9025825788416035 and parameters: {'splitter': 'random', 'min_samples_split': 0.036704769350136356, 'min_samples_leaf': 0.027443201542170476, 'min_weight_fraction_leaf': 0.008655966818557374, 'max_features': 0.8381168984204853}. Best is trial 677 with value: 0.9113497956229912.[0m
[32m[I 2022-04-21 14:22:44,570][0m Trial 968 finished with value: 0.8985948603198773 and parameters: {'splitter': 'random', 'min_samples_split': 0.03967359116792192, 'min_samples_leaf': 0.009748953839256265, 'min_weight_fraction_leaf': 0.0004577195050739745, 'max_features': 0.8880778699232026}. Best is trial 677 with value: 0.9113497956229912.[0m
[32m[I 2022-04-21 14:22:45,665][0m Trial 969 finished with value: 0.9049854703626673 and parameters: {'splitter': 'random', 'min_samples_split': 0.04954526991204929, 'min_samples_leaf': 0.031823139546124396, 'min_weight_fraction_leaf': 0.013303555547566796, 'max_features': 0.907109536150143}. Best is trial 677 with value: 0.9113497956229912.[0m
[32m[I 2022-04-21 14:22:46,937][0m Trial 970 finished with value: 0.9002618083423141 and parameters: {'splitter': 'random', 'min_samples_split': 0.04042932970822577, 'min_samples_leaf': 0.016541073811951718, 'min_weight_fraction_leaf': 0.014157746611248202, 'max_features': 0.8974531239102465}. Best is trial 677 with value: 0.9113497956229912.[0m
[32m[I 2022-04-21 14:22:48,181][0m Trial 971 finished with value: 0.9037203765356641 and parameters: {'splitter': 'random', 'min_samples_split': 0.04742424248799499, 'min_samples_leaf': 0.03326435031900519, 'min_weight_fraction_leaf': 0.00031875656034422405, 'max_features': 0.9477698712298158}. Best is trial 677 with value: 0.9113497956229912.[0m
/media/san2_ssd/data/Workdir/survival/utils.py:305: RuntimeWarning: invalid value encountered in true_divide
  pdfs = np.gradient(1-survs,axis=1)/norms
[32m[I 2022-04-21 14:22:49,801][0m Trial 972 finished with value: 0.8969867421989861 and parameters: {'splitter': 'random', 'min_samples_split': 0.05768760454349057, 'min_samples_leaf': 0.010210730232800945, 'min_weight_fraction_leaf': 0.013514500593481771, 'max_features': 0.8718260321946432}. Best is trial 677 with value: 0.9113497956229912.[0m
[32m[I 2022-04-21 14:22:50,816][0m Trial 973 finished with value: 0.3425804518366971 and parameters: {'splitter': 'random', 'min_samples_split': 0.073202862314935, 'min_samples_leaf': 0.3288731387952297, 'min_weight_fraction_leaf': 0.028238972473126536, 'max_features': 0.9267212045262577}. Best is trial 677 with value: 0.9113497956229912.[0m
[32m[I 2022-04-21 14:22:51,899][0m Trial 974 finished with value: 0.3425804518366971 and parameters: {'splitter': 'random', 'min_samples_split': 0.042693701847750606, 'min_samples_leaf': 0.3499319253445312, 'min_weight_fraction_leaf': 0.00839755616453633, 'max_features': 0.972286609595785}. Best is trial 677 with value: 0.9113497956229912.[0m
[32m[I 2022-04-21 14:22:53,211][0m Trial 975 finished with value: 0.3425804518366971 and parameters: {'splitter': 'random', 'min_samples_split': 0.03668155622578785, 'min_samples_leaf': 0.021381387334814175, 'min_weight_fraction_leaf': 0.36477925119499643, 'max_features': 0.9463270613034737}. Best is trial 677 with value: 0.9113497956229912.[0m
[32m[I 2022-04-21 14:22:54,246][0m Trial 976 finished with value: 0.9063150089472296 and parameters: {'splitter': 'random', 'min_samples_split': 0.0792735523156911, 'min_samples_leaf': 0.0375893831347202, 'min_weight_fraction_leaf': 0.056767562547892385, 'max_features': 0.9137696657771123}. Best is trial 677 with value: 0.9113497956229912.[0m
[32m[I 2022-04-21 14:24:23,841][0m Trial 977 finished with value: 0.897631993423247 and parameters: {'splitter': 'best', 'min_samples_split': 0.057435035782542054, 'min_samples_leaf': 0.023061079890841604, 'min_weight_fraction_leaf': 0.019809339128051405, 'max_features': 0.25519186129593513}. Best is trial 677 with value: 0.9113497956229912.[0m
[32m[I 2022-04-21 14:24:25,894][0m Trial 978 finished with value: 0.9027723930203824 and parameters: {'splitter': 'random', 'min_samples_split': 0.05427739379966978, 'min_samples_leaf': 0.014432178100684267, 'min_weight_fraction_leaf': 0.017419514028960668, 'max_features': 0.552099192891503}. Best is trial 677 with value: 0.9113497956229912.[0m
[32m[I 2022-04-21 14:24:28,759][0m Trial 979 finished with value: 0.9020457954531151 and parameters: {'splitter': 'random', 'min_samples_split': 0.048038884109369615, 'min_samples_leaf': 0.031038443383227435, 'min_weight_fraction_leaf': 0.009443528660674778, 'max_features': 0.8998147403652962}. Best is trial 677 with value: 0.9113497956229912.[0m
[32m[I 2022-04-21 14:24:30,534][0m Trial 980 finished with value: 0.9036496904693454 and parameters: {'splitter': 'random', 'min_samples_split': 0.0986805781698601, 'min_samples_leaf': 0.04384665292060093, 'min_weight_fraction_leaf': 0.04371217365259194, 'max_features': 0.9368032818382431}. Best is trial 677 with value: 0.9113497956229912.[0m
[32m[I 2022-04-21 14:24:32,394][0m Trial 981 finished with value: 0.9050816428165624 and parameters: {'splitter': 'random', 'min_samples_split': 0.03586887741460265, 'min_samples_leaf': 0.0010764336593440998, 'min_weight_fraction_leaf': 0.01918533296668087, 'max_features': 0.8540320406730356}. Best is trial 677 with value: 0.9113497956229912.[0m
[32m[I 2022-04-21 14:24:34,799][0m Trial 982 finished with value: 0.9082934407163619 and parameters: {'splitter': 'random', 'min_samples_split': 0.049125139736505605, 'min_samples_leaf': 0.023256092400497252, 'min_weight_fraction_leaf': 0.026083528619535015, 'max_features': 0.9598408979016096}. Best is trial 677 with value: 0.9113497956229912.[0m
[32m[I 2022-04-21 14:24:35,785][0m Trial 983 finished with value: 0.3425804518366971 and parameters: {'splitter': 'random', 'min_samples_split': 0.186863360902999, 'min_samples_leaf': 0.05257934162642768, 'min_weight_fraction_leaf': 0.28996564132475205, 'max_features': 0.9208447782782005}. Best is trial 677 with value: 0.9113497956229912.[0m
[32m[I 2022-04-21 14:24:36,841][0m Trial 984 finished with value: 0.8797245818194697 and parameters: {'splitter': 'random', 'min_samples_split': 0.11165555803343868, 'min_samples_leaf': 0.01184151803655721, 'min_weight_fraction_leaf': 0.23100958460955434, 'max_features': 0.9009992807384468}. Best is trial 677 with value: 0.9113497956229912.[0m
[32m[I 2022-04-21 14:24:37,847][0m Trial 985 finished with value: 0.8785678178918717 and parameters: {'splitter': 'random', 'min_samples_split': 0.06985024177333676, 'min_samples_leaf': 0.03618691452661453, 'min_weight_fraction_leaf': 0.17172853556002324, 'max_features': 0.8810409706175373}. Best is trial 677 with value: 0.9113497956229912.[0m
[32m[I 2022-04-21 14:24:38,583][0m Trial 986 finished with value: 0.3425804518366971 and parameters: {'splitter': 'random', 'min_samples_split': 0.08741454904357868, 'min_samples_leaf': 0.31076756936713523, 'min_weight_fraction_leaf': 0.03798343714209705, 'max_features': 0.940331130738196}. Best is trial 677 with value: 0.9113497956229912.[0m
[32m[I 2022-04-21 14:24:39,696][0m Trial 987 finished with value: 0.9068911098091308 and parameters: {'splitter': 'random', 'min_samples_split': 0.07273834315648178, 'min_samples_leaf': 0.06011358298203954, 'min_weight_fraction_leaf': 0.07108868221523103, 'max_features': 0.9199795489960496}. Best is trial 677 with value: 0.9113497956229912.[0m
[32m[I 2022-04-21 14:24:41,350][0m Trial 988 finished with value: 0.9024364590134326 and parameters: {'splitter': 'random', 'min_samples_split': 0.036882518921708546, 'min_samples_leaf': 0.027703606517245065, 'min_weight_fraction_leaf': 0.012519368398142697, 'max_features': 0.9655422080457338}. Best is trial 677 with value: 0.9113497956229912.[0m
[32m[I 2022-04-21 14:24:43,330][0m Trial 989 finished with value: 0.9069915919424736 and parameters: {'splitter': 'random', 'min_samples_split': 0.06135344601274634, 'min_samples_leaf': 0.009148229621929146, 'min_weight_fraction_leaf': 0.02198359736913341, 'max_features': 0.9090351601411925}. Best is trial 677 with value: 0.9113497956229912.[0m
[32m[I 2022-04-21 14:24:44,465][0m Trial 990 finished with value: 0.652866353264551 and parameters: {'splitter': 'random', 'min_samples_split': 0.06278444069049922, 'min_samples_leaf': 0.25845255672307876, 'min_weight_fraction_leaf': 0.027420405197248074, 'max_features': 0.8902606287910583}. Best is trial 677 with value: 0.9113497956229912.[0m
[32m[I 2022-04-21 14:24:45,734][0m Trial 991 finished with value: 0.8803243072182646 and parameters: {'splitter': 'random', 'min_samples_split': 0.057401442073199846, 'min_samples_leaf': 0.017301771395355187, 'min_weight_fraction_leaf': 0.1349057099478666, 'max_features': 0.9466736468856367}. Best is trial 677 with value: 0.9113497956229912.[0m
