[32m[I 2022-04-21 15:02:55,924][0m Trial 278 finished with value: 0.8292060993854153 and parameters: {'alpha': 0.010322684485359002, 'ties': 'breslow'}. Best is trial 211 with value: 0.830053417686198.[0m
[32m[I 2022-04-21 15:03:04,306][0m Trial 279 finished with value: 0.830041755098869 and parameters: {'alpha': 1.9270574048084865, 'ties': 'breslow'}. Best is trial 211 with value: 0.830053417686198.[0m
[32m[I 2022-04-21 15:03:13,331][0m Trial 280 finished with value: 0.8300234402119642 and parameters: {'alpha': 1.8124657884985858, 'ties': 'breslow'}. Best is trial 211 with value: 0.830053417686198.[0m
[32m[I 2022-04-21 15:03:22,490][0m Trial 281 finished with value: 0.8299845794946453 and parameters: {'alpha': 2.0115323042090787, 'ties': 'breslow'}. Best is trial 211 with value: 0.830053417686198.[0m
[32m[I 2022-04-21 15:03:30,590][0m Trial 282 finished with value: 0.8299442423319183 and parameters: {'alpha': 2.1061485411197842, 'ties': 'breslow'}. Best is trial 211 with value: 0.830053417686198.[0m
[32m[I 2022-04-21 15:03:39,741][0m Trial 283 finished with value: 0.830041755098869 and parameters: {'alpha': 1.9270014572759593, 'ties': 'breslow'}. Best is trial 211 with value: 0.830053417686198.[0m
[32m[I 2022-04-21 15:03:49,639][0m Trial 284 finished with value: 0.8300112178681676 and parameters: {'alpha': 1.7727972199222577, 'ties': 'breslow'}. Best is trial 211 with value: 0.830053417686198.[0m
[32m[I 2022-04-21 15:03:57,440][0m Trial 285 finished with value: 0.8299632036601265 and parameters: {'alpha': 1.5855354129695542, 'ties': 'breslow'}. Best is trial 211 with value: 0.830053417686198.[0m
[32m[I 2022-04-21 15:04:04,069][0m Trial 286 finished with value: 0.830048958231693 and parameters: {'alpha': 1.888772562051472, 'ties': 'breslow'}. Best is trial 211 with value: 0.830053417686198.[0m
[32m[I 2022-04-21 15:04:10,731][0m Trial 287 finished with value: 0.8299842448207343 and parameters: {'alpha': 2.010169652742718, 'ties': 'breslow'}. Best is trial 211 with value: 0.830053417686198.[0m
[32m[I 2022-04-21 15:04:20,609][0m Trial 288 finished with value: 0.8299373427460057 and parameters: {'alpha': 2.2488763622056602, 'ties': 'breslow'}. Best is trial 211 with value: 0.830053417686198.[0m
[32m[I 2022-04-21 15:04:30,393][0m Trial 289 finished with value: 0.8299420746732696 and parameters: {'alpha': 2.093404866578585, 'ties': 'breslow'}. Best is trial 211 with value: 0.830053417686198.[0m
[32m[I 2022-04-21 15:04:36,830][0m Trial 290 finished with value: 0.8299889018767335 and parameters: {'alpha': 1.7131748256124189, 'ties': 'breslow'}. Best is trial 211 with value: 0.830053417686198.[0m
[32m[I 2022-04-21 15:04:44,414][0m Trial 291 finished with value: 0.8300315184916449 and parameters: {'alpha': 1.8437904950583532, 'ties': 'breslow'}. Best is trial 211 with value: 0.830053417686198.[0m
[32m[I 2022-04-21 15:04:56,869][0m Trial 292 finished with value: 0.8298595502975445 and parameters: {'alpha': 1.9582861676570518, 'ties': 'efron'}. Best is trial 211 with value: 0.830053417686198.[0m
[32m[I 2022-04-21 15:05:05,244][0m Trial 293 finished with value: 0.83001434327052 and parameters: {'alpha': 1.8015823912770126, 'ties': 'breslow'}. Best is trial 211 with value: 0.830053417686198.[0m
[32m[I 2022-04-21 15:05:14,088][0m Trial 294 finished with value: 0.8299843172795229 and parameters: {'alpha': 2.007364363392778, 'ties': 'breslow'}. Best is trial 211 with value: 0.830053417686198.[0m
[32m[I 2022-04-21 15:05:19,801][0m Trial 295 finished with value: 0.8299425742588464 and parameters: {'alpha': 2.177262107906186, 'ties': 'breslow'}. Best is trial 211 with value: 0.830053417686198.[0m
[32m[I 2022-04-21 15:05:27,403][0m Trial 296 finished with value: 0.8300446008867141 and parameters: {'alpha': 1.8872400015350297, 'ties': 'breslow'}. Best is trial 211 with value: 0.830053417686198.[0m
[32m[I 2022-04-21 15:05:35,127][0m Trial 297 finished with value: 0.8298133612068519 and parameters: {'alpha': 0.8347473971991115, 'ties': 'breslow'}. Best is trial 211 with value: 0.830053417686198.[0m
[32m[I 2022-04-21 15:05:42,315][0m Trial 298 finished with value: 0.8299415387102973 and parameters: {'alpha': 2.093506769393002, 'ties': 'breslow'}. Best is trial 211 with value: 0.830053417686198.[0m
[32m[I 2022-04-21 15:05:51,459][0m Trial 299 finished with value: 0.8299856449394893 and parameters: {'alpha': 1.6973659803232968, 'ties': 'breslow'}. Best is trial 211 with value: 0.830053417686198.[0m
[32m[I 2022-04-21 15:05:58,645][0m Trial 300 finished with value: 0.8295316188477667 and parameters: {'alpha': 0.30845431797092093, 'ties': 'breslow'}. Best is trial 211 with value: 0.830053417686198.[0m
[32m[I 2022-04-21 15:06:04,970][0m Trial 301 finished with value: 0.8300452432146452 and parameters: {'alpha': 1.9486907996474958, 'ties': 'breslow'}. Best is trial 211 with value: 0.830053417686198.[0m
[32m[I 2022-04-21 15:06:15,371][0m Trial 302 finished with value: 0.8298928218391055 and parameters: {'alpha': 2.9252868845510234, 'ties': 'breslow'}. Best is trial 211 with value: 0.830053417686198.[0m
[32m[I 2022-04-21 15:06:22,604][0m Trial 303 finished with value: 0.8300194655374789 and parameters: {'alpha': 1.8079362513783952, 'ties': 'breslow'}. Best is trial 211 with value: 0.830053417686198.[0m
[32m[I 2022-04-21 15:06:31,411][0m Trial 304 finished with value: 0.8299885457518104 and parameters: {'alpha': 2.0211088108113593, 'ties': 'breslow'}. Best is trial 211 with value: 0.830053417686198.[0m
[32m[I 2022-04-21 15:06:41,407][0m Trial 305 finished with value: 0.830042001158229 and parameters: {'alpha': 1.8751580610200855, 'ties': 'breslow'}. Best is trial 211 with value: 0.830053417686198.[0m
[32m[I 2022-04-21 15:06:51,143][0m Trial 306 finished with value: 0.8299554381178093 and parameters: {'alpha': 1.4582860230088817, 'ties': 'breslow'}. Best is trial 211 with value: 0.830053417686198.[0m
[32m[I 2022-04-21 15:07:00,116][0m Trial 307 finished with value: 0.8299431099676087 and parameters: {'alpha': 2.0878720139349083, 'ties': 'breslow'}. Best is trial 211 with value: 0.830053417686198.[0m
[32m[I 2022-04-21 15:07:07,213][0m Trial 308 finished with value: 0.8299343455926567 and parameters: {'alpha': 2.3182153483059453, 'ties': 'breslow'}. Best is trial 211 with value: 0.830053417686198.[0m
[32m[I 2022-04-21 15:07:15,170][0m Trial 309 finished with value: 0.8299692682982018 and parameters: {'alpha': 1.6501111554674215, 'ties': 'breslow'}. Best is trial 211 with value: 0.830053417686198.[0m
[32m[I 2022-04-21 15:07:26,299][0m Trial 310 finished with value: 0.8298556049011092 and parameters: {'alpha': 1.9385400344075874, 'ties': 'efron'}. Best is trial 211 with value: 0.830053417686198.[0m
[32m[I 2022-04-21 15:07:33,751][0m Trial 311 finished with value: 0.8300152125918091 and parameters: {'alpha': 1.7557529778073395, 'ties': 'breslow'}. Best is trial 211 with value: 0.830053417686198.[0m
[32m[I 2022-04-21 15:07:41,241][0m Trial 312 finished with value: 0.8299853289144554 and parameters: {'alpha': 1.9942094154408168, 'ties': 'breslow'}. Best is trial 211 with value: 0.830053417686198.[0m
[32m[I 2022-04-21 15:07:46,681][0m Trial 313 finished with value: 0.8299428134279042 and parameters: {'alpha': 2.1766074318977684, 'ties': 'breslow'}. Best is trial 211 with value: 0.830053417686198.[0m
[32m[I 2022-04-21 15:07:54,464][0m Trial 314 finished with value: 0.8300394758041072 and parameters: {'alpha': 1.8792675742088967, 'ties': 'breslow'}. Best is trial 211 with value: 0.830053417686198.[0m
[32m[I 2022-04-21 15:08:05,206][0m Trial 315 finished with value: 0.8299462004846976 and parameters: {'alpha': 2.065084636670574, 'ties': 'breslow'}. Best is trial 211 with value: 0.830053417686198.[0m
[32m[I 2022-04-21 15:08:13,757][0m Trial 316 finished with value: 0.8300115970791552 and parameters: {'alpha': 1.7728715173763365, 'ties': 'breslow'}. Best is trial 211 with value: 0.830053417686198.[0m
[32m[I 2022-04-21 15:08:19,803][0m Trial 317 finished with value: 0.8300439651397914 and parameters: {'alpha': 1.919826817145183, 'ties': 'breslow'}. Best is trial 211 with value: 0.830053417686198.[0m
[32m[I 2022-04-21 15:08:27,292][0m Trial 318 finished with value: 0.8299581116727079 and parameters: {'alpha': 1.579818036307765, 'ties': 'breslow'}. Best is trial 211 with value: 0.830053417686198.[0m
[32m[I 2022-04-21 15:08:35,360][0m Trial 319 finished with value: 0.8300321940087467 and parameters: {'alpha': 1.8369885832822728, 'ties': 'breslow'}. Best is trial 211 with value: 0.830053417686198.[0m
[32m[I 2022-04-21 15:08:44,963][0m Trial 320 finished with value: 0.8299569552390722 and parameters: {'alpha': 2.1200457042354444, 'ties': 'breslow'}. Best is trial 211 with value: 0.830053417686198.[0m
[32m[I 2022-04-21 15:08:51,910][0m Trial 321 finished with value: 0.8299856821864917 and parameters: {'alpha': 2.0070291593649703, 'ties': 'breslow'}. Best is trial 211 with value: 0.830053417686198.[0m
[32m[I 2022-04-21 15:08:59,549][0m Trial 322 finished with value: 0.8299901895855555 and parameters: {'alpha': 1.7140529257470714, 'ties': 'breslow'}. Best is trial 211 with value: 0.830053417686198.[0m
[32m[I 2022-04-21 15:09:09,780][0m Trial 323 finished with value: 0.8300444788952797 and parameters: {'alpha': 1.9324059976937398, 'ties': 'breslow'}. Best is trial 211 with value: 0.830053417686198.[0m
[32m[I 2022-04-21 15:09:18,188][0m Trial 324 finished with value: 0.8300324264522263 and parameters: {'alpha': 1.8294157441426218, 'ties': 'breslow'}. Best is trial 211 with value: 0.830053417686198.[0m
[32m[I 2022-04-21 15:09:27,347][0m Trial 325 finished with value: 0.8299859494212305 and parameters: {'alpha': 2.007195749648343, 'ties': 'breslow'}. Best is trial 211 with value: 0.830053417686198.[0m
[32m[I 2022-04-21 15:09:35,161][0m Trial 326 finished with value: 0.8299449426313705 and parameters: {'alpha': 2.1623990330623535, 'ties': 'breslow'}. Best is trial 211 with value: 0.830053417686198.[0m
[32m[I 2022-04-21 15:09:41,339][0m Trial 327 finished with value: 0.8300478377460362 and parameters: {'alpha': 1.8905388067559052, 'ties': 'breslow'}. Best is trial 211 with value: 0.830053417686198.[0m
[32m[I 2022-04-21 15:09:48,427][0m Trial 328 finished with value: 0.8300114611725288 and parameters: {'alpha': 1.7476160697519245, 'ties': 'breslow'}. Best is trial 211 with value: 0.830053417686198.[0m
[32m[I 2022-04-21 15:09:56,495][0m Trial 329 finished with value: 0.8299669482768814 and parameters: {'alpha': 2.033443047856749, 'ties': 'breslow'}. Best is trial 211 with value: 0.830053417686198.[0m
[32m[I 2022-04-21 15:10:04,768][0m Trial 330 finished with value: 0.829939194123925 and parameters: {'alpha': 2.2191822571505355, 'ties': 'breslow'}. Best is trial 211 with value: 0.830053417686198.[0m
[32m[I 2022-04-21 15:10:17,234][0m Trial 331 finished with value: 0.8298580625966723 and parameters: {'alpha': 1.9309535086419167, 'ties': 'efron'}. Best is trial 211 with value: 0.830053417686198.[0m
[32m[I 2022-04-21 15:10:24,951][0m Trial 332 finished with value: 0.8300305551113503 and parameters: {'alpha': 1.8248083031713922, 'ties': 'breslow'}. Best is trial 211 with value: 0.830053417686198.[0m
[32m[I 2022-04-21 15:10:34,239][0m Trial 333 finished with value: 0.8299825119628638 and parameters: {'alpha': 1.6686855547225228, 'ties': 'breslow'}. Best is trial 211 with value: 0.830053417686198.[0m
[32m[I 2022-04-21 15:10:41,030][0m Trial 334 finished with value: 0.8298136500865596 and parameters: {'alpha': 3.6325535181147552, 'ties': 'breslow'}. Best is trial 211 with value: 0.830053417686198.[0m
[32m[I 2022-04-21 15:10:46,715][0m Trial 335 finished with value: 0.8299461154568697 and parameters: {'alpha': 2.0988533851719646, 'ties': 'breslow'}. Best is trial 211 with value: 0.830053417686198.[0m
[32m[I 2022-04-21 15:10:52,907][0m Trial 336 finished with value: 0.8300442576614921 and parameters: {'alpha': 1.9608544051028265, 'ties': 'breslow'}. Best is trial 211 with value: 0.830053417686198.[0m
[32m[I 2022-04-21 15:10:59,014][0m Trial 337 finished with value: 0.830028830044953 and parameters: {'alpha': 1.8230915379790433, 'ties': 'breslow'}. Best is trial 211 with value: 0.830053417686198.[0m
[32m[I 2022-04-21 15:11:05,710][0m Trial 338 finished with value: 0.8299587772344758 and parameters: {'alpha': 2.052679191522141, 'ties': 'breslow'}. Best is trial 211 with value: 0.830053417686198.[0m
[32m[I 2022-04-21 15:11:15,385][0m Trial 339 finished with value: 0.829922308067234 and parameters: {'alpha': 2.2977477391100853, 'ties': 'breslow'}. Best is trial 211 with value: 0.830053417686198.[0m
[32m[I 2022-04-21 15:11:22,273][0m Trial 340 finished with value: 0.830045431980712 and parameters: {'alpha': 1.933213037611422, 'ties': 'breslow'}. Best is trial 211 with value: 0.830053417686198.[0m
[32m[I 2022-04-21 15:11:29,902][0m Trial 341 finished with value: 0.8300156206220416 and parameters: {'alpha': 1.7584970789255956, 'ties': 'breslow'}. Best is trial 211 with value: 0.830053417686198.[0m
[32m[I 2022-04-21 15:11:38,576][0m Trial 342 finished with value: 0.8300394850705018 and parameters: {'alpha': 1.879542404767184, 'ties': 'breslow'}. Best is trial 211 with value: 0.830053417686198.[0m
[32m[I 2022-04-21 15:11:48,352][0m Trial 343 finished with value: 0.8298058616026737 and parameters: {'alpha': 4.394458070030806, 'ties': 'breslow'}. Best is trial 211 with value: 0.830053417686198.[0m
[32m[I 2022-04-21 15:11:57,791][0m Trial 344 finished with value: 0.8299846816935114 and parameters: {'alpha': 2.004656286908259, 'ties': 'breslow'}. Best is trial 211 with value: 0.830053417686198.[0m
[32m[I 2022-04-21 15:12:04,680][0m Trial 345 finished with value: 0.8299731035278795 and parameters: {'alpha': 1.6097227849386062, 'ties': 'breslow'}. Best is trial 211 with value: 0.830053417686198.[0m
[32m[I 2022-04-21 15:12:13,723][0m Trial 346 finished with value: 0.8299404672606319 and parameters: {'alpha': 2.1501417964541694, 'ties': 'breslow'}. Best is trial 211 with value: 0.830053417686198.[0m
[32m[I 2022-04-21 15:12:21,172][0m Trial 347 finished with value: 0.8300350947933591 and parameters: {'alpha': 1.861363370719275, 'ties': 'breslow'}. Best is trial 211 with value: 0.830053417686198.[0m
[32m[I 2022-04-21 15:12:30,736][0m Trial 348 finished with value: 0.8299873790072407 and parameters: {'alpha': 1.9994773832401056, 'ties': 'breslow'}. Best is trial 211 with value: 0.830053417686198.[0m
[32m[I 2022-04-21 15:12:38,008][0m Trial 349 finished with value: 0.8299983563538536 and parameters: {'alpha': 1.7333871207992868, 'ties': 'breslow'}. Best is trial 211 with value: 0.830053417686198.[0m
[32m[I 2022-04-21 15:12:49,151][0m Trial 350 finished with value: 0.8295249321089113 and parameters: {'alpha': 0.6777854954278502, 'ties': 'efron'}. Best is trial 211 with value: 0.830053417686198.[0m
[32m[I 2022-04-21 15:12:53,914][0m Trial 351 finished with value: 0.8300444421475479 and parameters: {'alpha': 1.9191075619506364, 'ties': 'breslow'}. Best is trial 211 with value: 0.830053417686198.[0m
[32m[I 2022-04-21 15:13:00,790][0m Trial 352 finished with value: 0.830016804182989 and parameters: {'alpha': 1.8035834345078345, 'ties': 'breslow'}. Best is trial 211 with value: 0.830053417686198.[0m
[32m[I 2022-04-21 15:13:06,742][0m Trial 353 finished with value: 0.8299415089528084 and parameters: {'alpha': 2.079779197957063, 'ties': 'breslow'}. Best is trial 211 with value: 0.830053417686198.[0m
[32m[I 2022-04-21 15:13:14,577][0m Trial 354 finished with value: 0.8300494648724313 and parameters: {'alpha': 1.975858864177487, 'ties': 'breslow'}. Best is trial 211 with value: 0.830053417686198.[0m
[32m[I 2022-04-21 15:13:23,013][0m Trial 355 finished with value: 0.8299366596003059 and parameters: {'alpha': 2.217942412699913, 'ties': 'breslow'}. Best is trial 211 with value: 0.830053417686198.[0m
[32m[I 2022-04-21 15:13:36,556][0m Trial 356 finished with value: 0.829921367785883 and parameters: {'alpha': 2.710454419571405, 'ties': 'breslow'}. Best is trial 211 with value: 0.830053417686198.[0m
[32m[I 2022-04-21 15:13:45,303][0m Trial 357 finished with value: 0.8299489280532546 and parameters: {'alpha': 2.06749691937708, 'ties': 'breslow'}. Best is trial 211 with value: 0.830053417686198.[0m
[32m[I 2022-04-21 15:13:54,105][0m Trial 358 finished with value: 0.8300492066147903 and parameters: {'alpha': 1.9759489691053285, 'ties': 'breslow'}. Best is trial 211 with value: 0.830053417686198.[0m
[32m[I 2022-04-21 15:14:01,841][0m Trial 359 finished with value: 0.8300388541197259 and parameters: {'alpha': 1.8828455241981823, 'ties': 'breslow'}. Best is trial 211 with value: 0.830053417686198.[0m
[32m[I 2022-04-21 15:14:11,030][0m Trial 360 finished with value: 0.8299699164275987 and parameters: {'alpha': 1.6387264717611554, 'ties': 'breslow'}. Best is trial 211 with value: 0.830053417686198.[0m
[32m[I 2022-04-21 15:14:17,388][0m Trial 361 finished with value: 0.830042872381693 and parameters: {'alpha': 1.9667845416142384, 'ties': 'breslow'}. Best is trial 211 with value: 0.830053417686198.[0m
[32m[I 2022-04-21 15:14:24,050][0m Trial 362 finished with value: 0.829950738218422 and parameters: {'alpha': 2.111749585650928, 'ties': 'breslow'}. Best is trial 211 with value: 0.830053417686198.[0m
[32m[I 2022-04-21 15:14:30,842][0m Trial 363 finished with value: 0.8300124355032326 and parameters: {'alpha': 1.7720367738711778, 'ties': 'breslow'}. Best is trial 211 with value: 0.830053417686198.[0m
[32m[I 2022-04-21 15:14:41,517][0m Trial 364 finished with value: 0.8299243712452172 and parameters: {'alpha': 2.435912444770458, 'ties': 'breslow'}. Best is trial 211 with value: 0.830053417686198.[0m
[32m[I 2022-04-21 15:14:49,036][0m Trial 365 finished with value: 0.830032000646715 and parameters: {'alpha': 1.8572710130075674, 'ties': 'breslow'}. Best is trial 211 with value: 0.830053417686198.[0m
[32m[I 2022-04-21 15:14:55,652][0m Trial 366 finished with value: 0.8300469776802244 and parameters: {'alpha': 1.9845862187526668, 'ties': 'breslow'}. Best is trial 211 with value: 0.830053417686198.[0m
[32m[I 2022-04-21 15:15:05,087][0m Trial 367 finished with value: 0.8299428148523706 and parameters: {'alpha': 2.157503433981661, 'ties': 'breslow'}. Best is trial 211 with value: 0.830053417686198.[0m
[32m[I 2022-04-21 15:15:13,420][0m Trial 368 finished with value: 0.8298824808706765 and parameters: {'alpha': 0.9855291675417646, 'ties': 'breslow'}. Best is trial 211 with value: 0.830053417686198.[0m
[32m[I 2022-04-21 15:15:23,816][0m Trial 369 finished with value: 0.8297877599052038 and parameters: {'alpha': 1.7361702421797265, 'ties': 'efron'}. Best is trial 211 with value: 0.830053417686198.[0m
[32m[I 2022-04-21 15:15:32,013][0m Trial 370 finished with value: 0.8300350592063891 and parameters: {'alpha': 1.8721258454377283, 'ties': 'breslow'}. Best is trial 211 with value: 0.830053417686198.[0m
[32m[I 2022-04-21 15:15:39,342][0m Trial 371 finished with value: 0.8299527201927142 and parameters: {'alpha': 1.4961807592539307, 'ties': 'breslow'}. Best is trial 211 with value: 0.830053417686198.[0m
[32m[I 2022-04-21 15:15:46,230][0m Trial 372 finished with value: 0.8299839336946079 and parameters: {'alpha': 2.007833159896852, 'ties': 'breslow'}. Best is trial 211 with value: 0.830053417686198.[0m
[32m[I 2022-04-21 15:15:52,891][0m Trial 373 finished with value: 0.8299430246689079 and parameters: {'alpha': 2.0809626745839855, 'ties': 'breslow'}. Best is trial 211 with value: 0.830053417686198.[0m
[32m[I 2022-04-21 15:16:00,109][0m Trial 374 finished with value: 0.8299412754547324 and parameters: {'alpha': 2.240831313074814, 'ties': 'breslow'}. Best is trial 211 with value: 0.830053417686198.[0m
[32m[I 2022-04-21 15:16:08,944][0m Trial 375 finished with value: 0.830050729992314 and parameters: {'alpha': 1.9143205628221165, 'ties': 'breslow'}. Best is trial 211 with value: 0.830053417686198.[0m
[32m[I 2022-04-21 15:16:15,735][0m Trial 376 finished with value: 0.8300131809496092 and parameters: {'alpha': 1.779842260083683, 'ties': 'breslow'}. Best is trial 211 with value: 0.830053417686198.[0m
[32m[I 2022-04-21 15:16:24,431][0m Trial 377 finished with value: 0.8299823386531043 and parameters: {'alpha': 1.668829131013989, 'ties': 'breslow'}. Best is trial 211 with value: 0.830053417686198.[0m
[32m[I 2022-04-21 15:16:30,682][0m Trial 378 finished with value: 0.8300488572591845 and parameters: {'alpha': 1.8916863152692036, 'ties': 'breslow'}. Best is trial 211 with value: 0.830053417686198.[0m
[32m[I 2022-04-21 15:16:37,081][0m Trial 379 finished with value: 0.8299332416736667 and parameters: {'alpha': 1.33106318748482, 'ties': 'breslow'}. Best is trial 211 with value: 0.830053417686198.[0m
[32m[I 2022-04-21 15:16:45,666][0m Trial 380 finished with value: 0.8300254871791626 and parameters: {'alpha': 1.8186480886196725, 'ties': 'breslow'}. Best is trial 211 with value: 0.830053417686198.[0m
[32m[I 2022-04-21 15:16:53,460][0m Trial 381 finished with value: 0.830041177852029 and parameters: {'alpha': 1.9314560373444953, 'ties': 'breslow'}. Best is trial 211 with value: 0.830053417686198.[0m
[32m[I 2022-04-21 15:17:01,867][0m Trial 382 finished with value: 0.8299523629269826 and parameters: {'alpha': 2.0624789182788086, 'ties': 'breslow'}. Best is trial 211 with value: 0.830053417686198.[0m
[32m[I 2022-04-21 15:17:10,670][0m Trial 383 finished with value: 0.8299976871018794 and parameters: {'alpha': 1.7198758061852935, 'ties': 'breslow'}. Best is trial 211 with value: 0.830053417686198.[0m
[32m[I 2022-04-21 15:17:19,726][0m Trial 384 finished with value: 0.8300316027431057 and parameters: {'alpha': 1.8422843815509036, 'ties': 'breslow'}. Best is trial 211 with value: 0.830053417686198.[0m
