No protocol specified
[32m[I 2022-04-21 11:35:40,340][0m A new study created in memory with name: no-name-b24ef230-9bb3-41b4-8173-c5deca50af48[0m
[32m[I 2022-04-21 11:35:49,019][0m Trial 0 finished with value: 0.9149453164130346 and parameters: {'alpha': 2.472541082475198, 'ties': 'efron'}. Best is trial 0 with value: 0.9149453164130346.[0m
[32m[I 2022-04-21 11:35:57,381][0m Trial 1 finished with value: 0.9148797025520539 and parameters: {'alpha': 4.8337029260386535, 'ties': 'efron'}. Best is trial 0 with value: 0.9149453164130346.[0m
[32m[I 2022-04-21 11:36:04,906][0m Trial 2 finished with value: 0.9149018876174331 and parameters: {'alpha': 1.6963303053173966, 'ties': 'efron'}. Best is trial 0 with value: 0.9149453164130346.[0m
[32m[I 2022-04-21 11:36:10,785][0m Trial 3 finished with value: 0.9149255236945416 and parameters: {'alpha': 4.058927961110813, 'ties': 'breslow'}. Best is trial 0 with value: 0.9149453164130346.[0m
[32m[I 2022-04-21 11:36:15,792][0m Trial 4 finished with value: 0.9149526659069057 and parameters: {'alpha': 1.0182474453475863, 'ties': 'breslow'}. Best is trial 4 with value: 0.9149526659069057.[0m
[32m[I 2022-04-21 11:36:23,787][0m Trial 5 finished with value: 0.9144532881481465 and parameters: {'alpha': 0.0784849374950357, 'ties': 'efron'}. Best is trial 4 with value: 0.9149526659069057.[0m
[32m[I 2022-04-21 11:36:29,711][0m Trial 6 finished with value: 0.9149106682080589 and parameters: {'alpha': 4.306075326985964, 'ties': 'breslow'}. Best is trial 4 with value: 0.9149526659069057.[0m
[32m[I 2022-04-21 11:36:37,960][0m Trial 7 finished with value: 0.9149298503373601 and parameters: {'alpha': 2.0200639520868315, 'ties': 'efron'}. Best is trial 4 with value: 0.9149526659069057.[0m
[32m[I 2022-04-21 11:36:43,387][0m Trial 8 finished with value: 0.9149084958391287 and parameters: {'alpha': 3.661427329425118, 'ties': 'breslow'}. Best is trial 4 with value: 0.9149526659069057.[0m
[32m[I 2022-04-21 11:36:53,427][0m Trial 9 finished with value: 0.9149231049056746 and parameters: {'alpha': 3.4933719752692096, 'ties': 'breslow'}. Best is trial 4 with value: 0.9149526659069057.[0m
[32m[I 2022-04-21 11:37:04,307][0m Trial 10 finished with value: 0.9148810342686111 and parameters: {'alpha': 0.7085630208754019, 'ties': 'breslow'}. Best is trial 4 with value: 0.9149526659069057.[0m
[32m[I 2022-04-21 11:37:17,870][0m Trial 11 finished with value: 0.9148610222148198 and parameters: {'alpha': 1.2571455929186268, 'ties': 'efron'}. Best is trial 4 with value: 0.9149526659069057.[0m
[32m[I 2022-04-21 11:37:28,153][0m Trial 12 finished with value: 0.9149576228171196 and parameters: {'alpha': 2.6593446696793515, 'ties': 'breslow'}. Best is trial 12 with value: 0.9149576228171196.[0m
[32m[I 2022-04-21 11:37:38,623][0m Trial 13 finished with value: 0.9149545770623835 and parameters: {'alpha': 2.7496562066982926, 'ties': 'breslow'}. Best is trial 12 with value: 0.9149576228171196.[0m
[32m[I 2022-04-21 11:37:50,351][0m Trial 14 finished with value: 0.9149411891685855 and parameters: {'alpha': 2.967029830162429, 'ties': 'breslow'}. Best is trial 12 with value: 0.9149576228171196.[0m
[32m[I 2022-04-21 11:38:04,052][0m Trial 15 finished with value: 0.9149540980840938 and parameters: {'alpha': 2.858059552625401, 'ties': 'breslow'}. Best is trial 12 with value: 0.9149576228171196.[0m
[32m[I 2022-04-21 11:38:15,632][0m Trial 16 finished with value: 0.9149654956916209 and parameters: {'alpha': 2.37299965730502, 'ties': 'breslow'}. Best is trial 16 with value: 0.9149654956916209.[0m
[32m[I 2022-04-21 11:38:26,000][0m Trial 17 finished with value: 0.9150253887884039 and parameters: {'alpha': 1.9093817432724298, 'ties': 'breslow'}. Best is trial 17 with value: 0.9150253887884039.[0m
[32m[I 2022-04-21 11:38:34,858][0m Trial 18 finished with value: 0.914994277002729 and parameters: {'alpha': 1.995613056276669, 'ties': 'breslow'}. Best is trial 17 with value: 0.9150253887884039.[0m
[32m[I 2022-04-21 11:38:44,811][0m Trial 19 finished with value: 0.9149871189561448 and parameters: {'alpha': 1.6604572364711876, 'ties': 'breslow'}. Best is trial 17 with value: 0.9150253887884039.[0m
[32m[I 2022-04-21 11:38:55,875][0m Trial 20 finished with value: 0.9147319741684047 and parameters: {'alpha': 0.2364121837945512, 'ties': 'breslow'}. Best is trial 17 with value: 0.9150253887884039.[0m
[32m[I 2022-04-21 11:39:08,295][0m Trial 21 finished with value: 0.9149988640196302 and parameters: {'alpha': 1.7330882726269552, 'ties': 'breslow'}. Best is trial 17 with value: 0.9150253887884039.[0m
[32m[I 2022-04-21 11:39:18,218][0m Trial 22 finished with value: 0.9150237262191071 and parameters: {'alpha': 1.912006349913163, 'ties': 'breslow'}. Best is trial 17 with value: 0.9150253887884039.[0m
[32m[I 2022-04-21 11:39:29,738][0m Trial 23 finished with value: 0.914966979024032 and parameters: {'alpha': 1.328495464473479, 'ties': 'breslow'}. Best is trial 17 with value: 0.9150253887884039.[0m
[32m[I 2022-04-21 11:39:40,944][0m Trial 24 finished with value: 0.9150211041938803 and parameters: {'alpha': 1.963187680064692, 'ties': 'breslow'}. Best is trial 17 with value: 0.9150253887884039.[0m
[32m[I 2022-04-21 11:39:52,016][0m Trial 25 finished with value: 0.9148796718872102 and parameters: {'alpha': 0.7266640036144778, 'ties': 'breslow'}. Best is trial 17 with value: 0.9150253887884039.[0m
[32m[I 2022-04-21 11:40:04,034][0m Trial 26 finished with value: 0.9149705595292822 and parameters: {'alpha': 2.2274611830202975, 'ties': 'breslow'}. Best is trial 17 with value: 0.9150253887884039.[0m
[32m[I 2022-04-21 11:40:17,072][0m Trial 27 finished with value: 0.9149395001057353 and parameters: {'alpha': 3.336581542704208, 'ties': 'breslow'}. Best is trial 17 with value: 0.9150253887884039.[0m
[32m[I 2022-04-21 11:40:28,870][0m Trial 28 finished with value: 0.9149728979300751 and parameters: {'alpha': 1.3613674744360065, 'ties': 'breslow'}. Best is trial 17 with value: 0.9150253887884039.[0m
[32m[I 2022-04-21 11:40:44,934][0m Trial 29 finished with value: 0.9149700375774661 and parameters: {'alpha': 2.336580681520237, 'ties': 'efron'}. Best is trial 17 with value: 0.9150253887884039.[0m
[32m[I 2022-04-21 11:40:54,149][0m Trial 30 finished with value: 0.9149359768486274 and parameters: {'alpha': 3.0541936672173335, 'ties': 'breslow'}. Best is trial 17 with value: 0.9150253887884039.[0m
[32m[I 2022-04-21 11:41:06,505][0m Trial 31 finished with value: 0.9150024253197533 and parameters: {'alpha': 1.7418903468365599, 'ties': 'breslow'}. Best is trial 17 with value: 0.9150253887884039.[0m
[32m[I 2022-04-21 11:41:18,907][0m Trial 32 finished with value: 0.914992101826267 and parameters: {'alpha': 2.0090259275757476, 'ties': 'breslow'}. Best is trial 17 with value: 0.9150253887884039.[0m
[32m[I 2022-04-21 11:41:31,180][0m Trial 33 finished with value: 0.9149852175076049 and parameters: {'alpha': 1.6381449437575772, 'ties': 'breslow'}. Best is trial 17 with value: 0.9150253887884039.[0m
[32m[I 2022-04-21 11:41:45,914][0m Trial 34 finished with value: 0.9148428695329087 and parameters: {'alpha': 0.9679103139833648, 'ties': 'efron'}. Best is trial 17 with value: 0.9150253887884039.[0m
[32m[I 2022-04-21 11:41:57,107][0m Trial 35 finished with value: 0.9150223696141075 and parameters: {'alpha': 1.9320938393217812, 'ties': 'breslow'}. Best is trial 17 with value: 0.9150253887884039.[0m
[32m[I 2022-04-21 11:42:08,771][0m Trial 36 finished with value: 0.9149625150027365 and parameters: {'alpha': 2.4653622255013414, 'ties': 'breslow'}. Best is trial 17 with value: 0.9150253887884039.[0m
[32m[I 2022-04-21 11:42:25,321][0m Trial 37 finished with value: 0.9149327320118431 and parameters: {'alpha': 2.0458887583808405, 'ties': 'efron'}. Best is trial 17 with value: 0.9150253887884039.[0m
[32m[I 2022-04-21 11:42:36,637][0m Trial 38 finished with value: 0.9149767039023017 and parameters: {'alpha': 1.4579635624371463, 'ties': 'breslow'}. Best is trial 17 with value: 0.9150253887884039.[0m
[32m[I 2022-04-21 11:42:48,183][0m Trial 39 finished with value: 0.9149578525753193 and parameters: {'alpha': 2.558007584120275, 'ties': 'breslow'}. Best is trial 17 with value: 0.9150253887884039.[0m
[32m[I 2022-04-21 11:43:01,759][0m Trial 40 finished with value: 0.9148756292896831 and parameters: {'alpha': 1.133290878486265, 'ties': 'efron'}. Best is trial 17 with value: 0.9150253887884039.[0m
[32m[I 2022-04-21 11:43:11,269][0m Trial 41 finished with value: 0.9150059394063277 and parameters: {'alpha': 1.7842254004211051, 'ties': 'breslow'}. Best is trial 17 with value: 0.9150253887884039.[0m
[32m[I 2022-04-21 11:43:22,688][0m Trial 42 finished with value: 0.9150190712858143 and parameters: {'alpha': 1.881002572778662, 'ties': 'breslow'}. Best is trial 17 with value: 0.9150253887884039.[0m
[32m[I 2022-04-21 11:43:34,143][0m Trial 43 finished with value: 0.9149775224518452 and parameters: {'alpha': 2.1186526307165665, 'ties': 'breslow'}. Best is trial 17 with value: 0.9150253887884039.[0m
[32m[I 2022-04-21 11:43:44,818][0m Trial 44 finished with value: 0.914901101232978 and parameters: {'alpha': 0.8257895549954546, 'ties': 'breslow'}. Best is trial 17 with value: 0.9150253887884039.[0m
[32m[I 2022-04-21 11:43:54,765][0m Trial 45 finished with value: 0.915015512965439 and parameters: {'alpha': 1.837691056714751, 'ties': 'breslow'}. Best is trial 17 with value: 0.9150253887884039.[0m
[32m[I 2022-04-21 11:44:05,306][0m Trial 46 finished with value: 0.9149763486348027 and parameters: {'alpha': 1.493879948719544, 'ties': 'breslow'}. Best is trial 17 with value: 0.9150253887884039.[0m
[32m[I 2022-04-21 11:44:16,079][0m Trial 47 finished with value: 0.9148699991728027 and parameters: {'alpha': 4.737043663486567, 'ties': 'breslow'}. Best is trial 17 with value: 0.9150253887884039.[0m
[32m[I 2022-04-21 11:44:28,279][0m Trial 48 finished with value: 0.9149677083718177 and parameters: {'alpha': 2.3186640895620787, 'ties': 'breslow'}. Best is trial 17 with value: 0.9150253887884039.[0m
[32m[I 2022-04-21 11:44:43,584][0m Trial 49 finished with value: 0.9149269285705447 and parameters: {'alpha': 1.9356898222244143, 'ties': 'efron'}. Best is trial 17 with value: 0.9150253887884039.[0m
[32m[I 2022-04-21 11:44:54,296][0m Trial 50 finished with value: 0.9149577868037422 and parameters: {'alpha': 2.724899810318672, 'ties': 'breslow'}. Best is trial 17 with value: 0.9150253887884039.[0m
[32m[I 2022-04-21 11:45:05,398][0m Trial 51 finished with value: 0.9150197407983771 and parameters: {'alpha': 1.8849511583305503, 'ties': 'breslow'}. Best is trial 17 with value: 0.9150253887884039.[0m
[32m[I 2022-04-21 11:45:15,523][0m Trial 52 finished with value: 0.9149726902104114 and parameters: {'alpha': 1.5201463385790817, 'ties': 'breslow'}. Best is trial 17 with value: 0.9150253887884039.[0m
[32m[I 2022-04-21 11:45:26,025][0m Trial 53 finished with value: 0.9149738319237992 and parameters: {'alpha': 2.1815483285828847, 'ties': 'breslow'}. Best is trial 17 with value: 0.9150253887884039.[0m
[32m[I 2022-04-21 11:45:34,991][0m Trial 54 finished with value: 0.9149513507523759 and parameters: {'alpha': 1.1575851919776112, 'ties': 'breslow'}. Best is trial 17 with value: 0.9150253887884039.[0m
[32m[I 2022-04-21 11:45:46,414][0m Trial 55 finished with value: 0.9149558685379091 and parameters: {'alpha': 2.5218252610651355, 'ties': 'breslow'}. Best is trial 17 with value: 0.9150253887884039.[0m
[32m[I 2022-04-21 11:45:57,056][0m Trial 56 finished with value: 0.9150172487217072 and parameters: {'alpha': 1.8659957075816107, 'ties': 'breslow'}. Best is trial 17 with value: 0.9150253887884039.[0m
[32m[I 2022-04-21 11:46:09,171][0m Trial 57 finished with value: 0.9147738299563997 and parameters: {'alpha': 0.3493375487301986, 'ties': 'breslow'}. Best is trial 17 with value: 0.9150253887884039.[0m
[32m[I 2022-04-21 11:46:19,817][0m Trial 58 finished with value: 0.9149401928265906 and parameters: {'alpha': 3.1368763132818125, 'ties': 'breslow'}. Best is trial 17 with value: 0.9150253887884039.[0m
[32m[I 2022-04-21 11:46:31,275][0m Trial 59 finished with value: 0.9149806368223737 and parameters: {'alpha': 1.5825354948222805, 'ties': 'breslow'}. Best is trial 17 with value: 0.9150253887884039.[0m
[32m[I 2022-04-21 11:46:40,535][0m Trial 60 finished with value: 0.9149734020962867 and parameters: {'alpha': 2.1850850483950897, 'ties': 'breslow'}. Best is trial 17 with value: 0.9150253887884039.[0m
[32m[I 2022-04-21 11:46:52,925][0m Trial 61 finished with value: 0.915022677787911 and parameters: {'alpha': 1.9690270421066194, 'ties': 'breslow'}. Best is trial 17 with value: 0.9150253887884039.[0m
[32m[I 2022-04-21 11:47:02,447][0m Trial 62 finished with value: 0.9150254598642178 and parameters: {'alpha': 1.9045567032395683, 'ties': 'breslow'}. Best is trial 62 with value: 0.9150254598642178.[0m
[32m[I 2022-04-21 11:47:14,115][0m Trial 63 finished with value: 0.9149716929450739 and parameters: {'alpha': 2.088335394731055, 'ties': 'breslow'}. Best is trial 62 with value: 0.9150254598642178.[0m
[32m[I 2022-04-21 11:47:25,594][0m Trial 64 finished with value: 0.9149625846214141 and parameters: {'alpha': 1.3173635969118225, 'ties': 'breslow'}. Best is trial 62 with value: 0.9150254598642178.[0m
[32m[I 2022-04-21 11:47:34,796][0m Trial 65 finished with value: 0.9149620840567512 and parameters: {'alpha': 2.391638391080686, 'ties': 'breslow'}. Best is trial 62 with value: 0.9150254598642178.[0m
[32m[I 2022-04-21 11:47:46,203][0m Trial 66 finished with value: 0.9149601914303963 and parameters: {'alpha': 2.6165367320190986, 'ties': 'breslow'}. Best is trial 62 with value: 0.9150254598642178.[0m
[32m[I 2022-04-21 11:47:59,347][0m Trial 67 finished with value: 0.9149576136427756 and parameters: {'alpha': 2.264627969264136, 'ties': 'efron'}. Best is trial 62 with value: 0.9150254598642178.[0m
[32m[I 2022-04-21 11:48:08,421][0m Trial 68 finished with value: 0.9149905311335805 and parameters: {'alpha': 1.6705661278951398, 'ties': 'breslow'}. Best is trial 62 with value: 0.9150254598642178.[0m
[32m[I 2022-04-21 11:48:19,778][0m Trial 69 finished with value: 0.9150053802866276 and parameters: {'alpha': 1.7708559651080549, 'ties': 'breslow'}. Best is trial 62 with value: 0.9150254598642178.[0m
[32m[I 2022-04-21 11:48:29,740][0m Trial 70 finished with value: 0.9150216695060978 and parameters: {'alpha': 1.9535908909635609, 'ties': 'breslow'}. Best is trial 62 with value: 0.9150254598642178.[0m
[32m[I 2022-04-21 11:48:38,553][0m Trial 71 finished with value: 0.9149939326456187 and parameters: {'alpha': 2.001298119534941, 'ties': 'breslow'}. Best is trial 62 with value: 0.9150254598642178.[0m
[32m[I 2022-04-21 11:48:48,339][0m Trial 72 finished with value: 0.9149723827211111 and parameters: {'alpha': 1.4380177080866576, 'ties': 'breslow'}. Best is trial 62 with value: 0.9150254598642178.[0m
[32m[I 2022-04-21 11:48:57,999][0m Trial 73 finished with value: 0.9150230126069966 and parameters: {'alpha': 1.9518926960845124, 'ties': 'breslow'}. Best is trial 62 with value: 0.9150254598642178.[0m
[32m[I 2022-04-21 11:49:08,845][0m Trial 74 finished with value: 0.9149552827279311 and parameters: {'alpha': 2.8719836021678615, 'ties': 'breslow'}. Best is trial 62 with value: 0.9150254598642178.[0m
[32m[I 2022-04-21 11:49:19,932][0m Trial 75 finished with value: 0.9149859846457483 and parameters: {'alpha': 1.642592861951036, 'ties': 'breslow'}. Best is trial 62 with value: 0.9150254598642178.[0m
[32m[I 2022-04-21 11:49:29,696][0m Trial 76 finished with value: 0.9149739603181495 and parameters: {'alpha': 2.109162990752181, 'ties': 'breslow'}. Best is trial 62 with value: 0.9150254598642178.[0m
[32m[I 2022-04-21 11:49:43,251][0m Trial 77 finished with value: 0.9149615831506868 and parameters: {'alpha': 2.4201214115513516, 'ties': 'breslow'}. Best is trial 62 with value: 0.9150254598642178.[0m
[32m[I 2022-04-21 11:49:58,337][0m Trial 78 finished with value: 0.9148799803006529 and parameters: {'alpha': 1.1884916836556885, 'ties': 'efron'}. Best is trial 62 with value: 0.9150254598642178.[0m
[32m[I 2022-04-21 11:50:09,924][0m Trial 79 finished with value: 0.9149194685023894 and parameters: {'alpha': 3.97661208800588, 'ties': 'breslow'}. Best is trial 62 with value: 0.9150254598642178.[0m
[32m[I 2022-04-21 11:50:19,781][0m Trial 80 finished with value: 0.914963435033765 and parameters: {'alpha': 2.276873643788476, 'ties': 'breslow'}. Best is trial 62 with value: 0.9150254598642178.[0m
[32m[I 2022-04-21 11:50:30,105][0m Trial 81 finished with value: 0.915021960885487 and parameters: {'alpha': 1.918240442519384, 'ties': 'breslow'}. Best is trial 62 with value: 0.9150254598642178.[0m
[32m[I 2022-04-21 11:50:39,653][0m Trial 82 finished with value: 0.9149939565555874 and parameters: {'alpha': 1.995335629449103, 'ties': 'breslow'}. Best is trial 62 with value: 0.9150254598642178.[0m
[32m[I 2022-04-21 11:50:50,777][0m Trial 83 finished with value: 0.9150059392869745 and parameters: {'alpha': 1.7695984355789698, 'ties': 'breslow'}. Best is trial 62 with value: 0.9150254598642178.[0m
[32m[I 2022-04-21 11:51:00,934][0m Trial 84 finished with value: 0.9150252328679557 and parameters: {'alpha': 1.9405383638385498, 'ties': 'breslow'}. Best is trial 62 with value: 0.9150254598642178.[0m
[32m[I 2022-04-21 11:51:10,155][0m Trial 85 finished with value: 0.9149790419134746 and parameters: {'alpha': 1.5894205008524716, 'ties': 'breslow'}. Best is trial 62 with value: 0.9150254598642178.[0m
[32m[I 2022-04-21 11:51:17,246][0m Trial 86 finished with value: 0.9149693254746543 and parameters: {'alpha': 2.1536843881955847, 'ties': 'breslow'}. Best is trial 62 with value: 0.9150254598642178.[0m
[32m[I 2022-04-21 11:51:26,853][0m Trial 87 finished with value: 0.9150168773602119 and parameters: {'alpha': 1.8634251507470152, 'ties': 'breslow'}. Best is trial 62 with value: 0.9150254598642178.[0m
[32m[I 2022-04-21 11:51:36,614][0m Trial 88 finished with value: 0.914941681139692 and parameters: {'alpha': 0.9830736469219415, 'ties': 'breslow'}. Best is trial 62 with value: 0.9150254598642178.[0m
[32m[I 2022-04-21 11:51:46,169][0m Trial 89 finished with value: 0.9149695072005166 and parameters: {'alpha': 1.3863340117872325, 'ties': 'breslow'}. Best is trial 62 with value: 0.9150254598642178.[0m
[32m[I 2022-04-21 11:51:56,727][0m Trial 90 finished with value: 0.9149936981432278 and parameters: {'alpha': 1.7086780280194636, 'ties': 'breslow'}. Best is trial 62 with value: 0.9150254598642178.[0m
[32m[I 2022-04-21 11:52:06,138][0m Trial 91 finished with value: 0.9150224401439322 and parameters: {'alpha': 1.9449613665469936, 'ties': 'breslow'}. Best is trial 62 with value: 0.9150254598642178.[0m
[32m[I 2022-04-21 11:52:15,895][0m Trial 92 finished with value: 0.915021620124697 and parameters: {'alpha': 1.944567363321905, 'ties': 'breslow'}. Best is trial 62 with value: 0.9150254598642178.[0m
[32m[I 2022-04-21 11:52:24,968][0m Trial 93 finished with value: 0.9149724345501291 and parameters: {'alpha': 2.0846504564498707, 'ties': 'breslow'}. Best is trial 62 with value: 0.9150254598642178.[0m
[32m[I 2022-04-21 11:52:35,763][0m Trial 94 finished with value: 0.9149630999655824 and parameters: {'alpha': 2.292298143717448, 'ties': 'breslow'}. Best is trial 62 with value: 0.9150254598642178.[0m
[32m[I 2022-04-21 11:52:45,897][0m Trial 95 finished with value: 0.9149598411886679 and parameters: {'alpha': 2.4840581897748857, 'ties': 'breslow'}. Best is trial 62 with value: 0.9150254598642178.[0m
[32m[I 2022-04-21 11:52:59,919][0m Trial 96 finished with value: 0.9148855489161856 and parameters: {'alpha': 1.567557450043425, 'ties': 'efron'}. Best is trial 62 with value: 0.9150254598642178.[0m
[32m[I 2022-04-21 11:53:08,981][0m Trial 97 finished with value: 0.9150057760705727 and parameters: {'alpha': 1.7751725087670023, 'ties': 'breslow'}. Best is trial 62 with value: 0.9150254598642178.[0m
[32m[I 2022-04-21 11:53:18,999][0m Trial 98 finished with value: 0.91499284877792 and parameters: {'alpha': 2.0036697064260514, 'ties': 'breslow'}. Best is trial 62 with value: 0.9150254598642178.[0m
[32m[I 2022-04-21 11:53:29,530][0m Trial 99 finished with value: 0.9150256598855607 and parameters: {'alpha': 1.9031158827322474, 'ties': 'breslow'}. Best is trial 99 with value: 0.9150256598855607.[0m
[32m[I 2022-04-21 11:53:39,508][0m Trial 100 finished with value: 0.9149707234500541 and parameters: {'alpha': 2.2292351168214974, 'ties': 'breslow'}. Best is trial 99 with value: 0.9150256598855607.[0m
[32m[I 2022-04-21 11:53:49,442][0m Trial 101 finished with value: 0.9150248014713467 and parameters: {'alpha': 1.892088803720381, 'ties': 'breslow'}. Best is trial 99 with value: 0.9150256598855607.[0m
[32m[I 2022-04-21 11:53:58,555][0m Trial 102 finished with value: 0.9149917641259474 and parameters: {'alpha': 1.7029375608159654, 'ties': 'breslow'}. Best is trial 99 with value: 0.9150256598855607.[0m
[32m[I 2022-04-21 11:54:06,808][0m Trial 103 finished with value: 0.9150172266170384 and parameters: {'alpha': 1.8688680220227547, 'ties': 'breslow'}. Best is trial 99 with value: 0.9150256598855607.[0m
[32m[I 2022-04-21 11:54:16,758][0m Trial 104 finished with value: 0.9149741265669415 and parameters: {'alpha': 1.5069338335353168, 'ties': 'breslow'}. Best is trial 99 with value: 0.9150256598855607.[0m
[32m[I 2022-04-21 11:54:27,273][0m Trial 105 finished with value: 0.9149737128051154 and parameters: {'alpha': 2.171979461100183, 'ties': 'breslow'}. Best is trial 99 with value: 0.9150256598855607.[0m
[32m[I 2022-04-21 11:54:37,529][0m Trial 106 finished with value: 0.9150132471408577 and parameters: {'alpha': 1.8190667887915124, 'ties': 'breslow'}. Best is trial 99 with value: 0.9150256598855607.[0m
