[32m[I 2022-04-21 17:50:04,698][0m Trial 558 finished with value: 0.799281833511347 and parameters: {'splitter': 'random', 'min_samples_split': 0.25946212769892063, 'min_samples_leaf': 0.11456028155536341, 'min_weight_fraction_leaf': 0.057210978940344874, 'max_features': 0.9059651090171106}. Best is trial 441 with value: 0.8118070902918568.[0m
[32m[I 2022-04-21 17:50:05,454][0m Trial 559 finished with value: 0.8112229513277963 and parameters: {'splitter': 'random', 'min_samples_split': 0.2735368891994116, 'min_samples_leaf': 0.09498956967467662, 'min_weight_fraction_leaf': 0.06323220825012658, 'max_features': 0.9216522424546335}. Best is trial 441 with value: 0.8118070902918568.[0m
[32m[I 2022-04-21 17:50:06,286][0m Trial 560 finished with value: 0.7660841954414641 and parameters: {'splitter': 'random', 'min_samples_split': 0.3083975311986044, 'min_samples_leaf': 0.10212109183868122, 'min_weight_fraction_leaf': 0.2222653396344897, 'max_features': 0.8132594412313712}. Best is trial 441 with value: 0.8118070902918568.[0m
[32m[I 2022-04-21 17:50:07,227][0m Trial 561 finished with value: 0.7645669710097607 and parameters: {'splitter': 'random', 'min_samples_split': 0.28808004302168383, 'min_samples_leaf': 0.09299118859227724, 'min_weight_fraction_leaf': 0.06978629705018019, 'max_features': 0.9510693885043449}. Best is trial 441 with value: 0.8118070902918568.[0m
[32m[I 2022-04-21 17:50:07,638][0m Trial 562 finished with value: 0.7752835040527123 and parameters: {'splitter': 'random', 'min_samples_split': 0.2647351617906305, 'min_samples_leaf': 0.11166667019260879, 'min_weight_fraction_leaf': 0.04977960349794422, 'max_features': 0.8783280654721503}. Best is trial 441 with value: 0.8118070902918568.[0m
[32m[I 2022-04-21 17:50:08,111][0m Trial 563 finished with value: 0.8027100826224253 and parameters: {'splitter': 'random', 'min_samples_split': 0.2753164999133751, 'min_samples_leaf': 0.08068100944867534, 'min_weight_fraction_leaf': 0.07420898174700105, 'max_features': 0.9386526141118705}. Best is trial 441 with value: 0.8118070902918568.[0m
[32m[I 2022-04-21 17:50:08,627][0m Trial 564 finished with value: 0.8032272519689826 and parameters: {'splitter': 'random', 'min_samples_split': 0.28439625181018346, 'min_samples_leaf': 0.06987946080157138, 'min_weight_fraction_leaf': 0.06874949100765, 'max_features': 0.9777478730085937}. Best is trial 441 with value: 0.8118070902918568.[0m
[32m[I 2022-04-21 17:50:09,240][0m Trial 565 finished with value: 0.8092642586581607 and parameters: {'splitter': 'random', 'min_samples_split': 0.3010058470005022, 'min_samples_leaf': 0.08138404940440813, 'min_weight_fraction_leaf': 0.06265268494506317, 'max_features': 0.922300645574027}. Best is trial 441 with value: 0.8118070902918568.[0m
[32m[I 2022-04-21 17:50:09,741][0m Trial 566 finished with value: 0.7718175427041111 and parameters: {'splitter': 'random', 'min_samples_split': 0.28344382156651093, 'min_samples_leaf': 0.05740575217787131, 'min_weight_fraction_leaf': 0.11865453725462452, 'max_features': 0.9561549274405197}. Best is trial 441 with value: 0.8118070902918568.[0m
[32m[I 2022-04-21 17:50:10,512][0m Trial 567 finished with value: 0.7645669710097607 and parameters: {'splitter': 'random', 'min_samples_split': 0.2795938550993298, 'min_samples_leaf': 0.06970533193961412, 'min_weight_fraction_leaf': 0.09153752573317969, 'max_features': 0.931670803570498}. Best is trial 441 with value: 0.8118070902918568.[0m
[32m[I 2022-04-21 17:50:11,034][0m Trial 568 finished with value: 0.7980511841820873 and parameters: {'splitter': 'random', 'min_samples_split': 0.2881430248381126, 'min_samples_leaf': 0.09785968431976175, 'min_weight_fraction_leaf': 0.10089971850347748, 'max_features': 0.903777898900141}. Best is trial 441 with value: 0.8118070902918568.[0m
[32m[I 2022-04-21 17:50:11,478][0m Trial 569 finished with value: 0.7645669710097607 and parameters: {'splitter': 'random', 'min_samples_split': 0.29806067770296757, 'min_samples_leaf': 0.08974141666916116, 'min_weight_fraction_leaf': 0.0624165332280603, 'max_features': 0.9529348019139117}. Best is trial 441 with value: 0.8118070902918568.[0m
[32m[I 2022-04-21 17:50:11,904][0m Trial 570 finished with value: 0.7658405528004703 and parameters: {'splitter': 'random', 'min_samples_split': 0.27112736346903854, 'min_samples_leaf': 0.1216000436409744, 'min_weight_fraction_leaf': 0.049924493862634235, 'max_features': 0.9092104471687323}. Best is trial 441 with value: 0.8118070902918568.[0m
[32m[I 2022-04-21 17:50:12,426][0m Trial 571 finished with value: 0.810455310005268 and parameters: {'splitter': 'random', 'min_samples_split': 0.2906318334590213, 'min_samples_leaf': 0.05506558757600845, 'min_weight_fraction_leaf': 0.0793890371845258, 'max_features': 0.9282429519914255}. Best is trial 441 with value: 0.8118070902918568.[0m
[32m[I 2022-04-21 17:50:12,876][0m Trial 572 finished with value: 0.7963956610153005 and parameters: {'splitter': 'random', 'min_samples_split': 0.306447265579102, 'min_samples_leaf': 0.07744277888195478, 'min_weight_fraction_leaf': 0.039104204459363065, 'max_features': 0.8875593467037872}. Best is trial 441 with value: 0.8118070902918568.[0m
[32m[I 2022-04-21 17:50:13,357][0m Trial 573 finished with value: 0.7620525676982435 and parameters: {'splitter': 'random', 'min_samples_split': 0.2528855544772562, 'min_samples_leaf': 0.14272312613917343, 'min_weight_fraction_leaf': 0.11175819653577174, 'max_features': 0.8710910537279446}. Best is trial 441 with value: 0.8118070902918568.[0m
[32m[I 2022-04-21 17:50:13,917][0m Trial 574 finished with value: 0.810455310005268 and parameters: {'splitter': 'random', 'min_samples_split': 0.2799011602268933, 'min_samples_leaf': 0.062080835311950605, 'min_weight_fraction_leaf': 0.0683462541515975, 'max_features': 0.9144212507388246}. Best is trial 441 with value: 0.8118070902918568.[0m
[32m[I 2022-04-21 17:50:14,431][0m Trial 575 finished with value: 0.7707466208696517 and parameters: {'splitter': 'random', 'min_samples_split': 0.2792228725446059, 'min_samples_leaf': 0.05967010102839269, 'min_weight_fraction_leaf': 0.08758649481447386, 'max_features': 0.9457429033686947}. Best is trial 441 with value: 0.8118070902918568.[0m
[32m[I 2022-04-21 17:50:14,857][0m Trial 576 finished with value: 0.7989883908314254 and parameters: {'splitter': 'random', 'min_samples_split': 0.27534025714534616, 'min_samples_leaf': 0.1062535560751205, 'min_weight_fraction_leaf': 0.06752249159749861, 'max_features': 0.8970174899310948}. Best is trial 441 with value: 0.8118070902918568.[0m
[32m[I 2022-04-21 17:50:15,381][0m Trial 577 finished with value: 0.7737414327341314 and parameters: {'splitter': 'random', 'min_samples_split': 0.29260175630508595, 'min_samples_leaf': 0.055688675474396744, 'min_weight_fraction_leaf': 0.08617343407713875, 'max_features': 0.9703639898877159}. Best is trial 441 with value: 0.8118070902918568.[0m
[32m[I 2022-04-21 17:50:15,968][0m Trial 578 finished with value: 0.8118070902918568 and parameters: {'splitter': 'random', 'min_samples_split': 0.24672348553000978, 'min_samples_leaf': 0.093048174558545, 'min_weight_fraction_leaf': 0.03870480634356615, 'max_features': 0.9099180232792953}. Best is trial 441 with value: 0.8118070902918568.[0m
[32m[I 2022-04-21 17:50:16,455][0m Trial 579 finished with value: 0.7583888457217192 and parameters: {'splitter': 'random', 'min_samples_split': 0.2356750306953826, 'min_samples_leaf': 0.09636230642961399, 'min_weight_fraction_leaf': 0.051648389989275206, 'max_features': 0.8298268363975788}. Best is trial 441 with value: 0.8118070902918568.[0m
[32m[I 2022-04-21 17:50:16,943][0m Trial 580 finished with value: 0.8092642586581607 and parameters: {'splitter': 'random', 'min_samples_split': 0.31105161343837057, 'min_samples_leaf': 0.07401853994441411, 'min_weight_fraction_leaf': 0.08065432508477319, 'max_features': 0.9300083942425702}. Best is trial 441 with value: 0.8118070902918568.[0m
[32m[I 2022-04-21 17:50:17,513][0m Trial 581 finished with value: 0.7764318283850216 and parameters: {'splitter': 'random', 'min_samples_split': 0.2424467300740859, 'min_samples_leaf': 0.1058121763332924, 'min_weight_fraction_leaf': 0.03744639019473093, 'max_features': 0.8668321003545898}. Best is trial 441 with value: 0.8118070902918568.[0m
[32m[I 2022-04-21 17:50:18,022][0m Trial 582 finished with value: 0.6851609036733942 and parameters: {'splitter': 'random', 'min_samples_split': 0.2472468754703331, 'min_samples_leaf': 0.35771044095447957, 'min_weight_fraction_leaf': 0.0982476051699454, 'max_features': 0.8905283955786175}. Best is trial 441 with value: 0.8118070902918568.[0m
[32m[I 2022-04-21 17:50:18,372][0m Trial 583 finished with value: 0.7625690704543565 and parameters: {'splitter': 'random', 'min_samples_split': 0.2551047990010782, 'min_samples_leaf': 0.09009706852691025, 'min_weight_fraction_leaf': 0.03833812845000341, 'max_features': 0.4887269148793435}. Best is trial 441 with value: 0.8118070902918568.[0m
[32m[I 2022-04-21 17:50:18,833][0m Trial 584 finished with value: 0.8019439913309814 and parameters: {'splitter': 'random', 'min_samples_split': 0.013910942495480139, 'min_samples_leaf': 0.09869076391236886, 'min_weight_fraction_leaf': 0.052528740718152556, 'max_features': 0.9179674560878796}. Best is trial 441 with value: 0.8118070902918568.[0m
[32m[I 2022-04-21 17:50:19,295][0m Trial 585 finished with value: 0.785560883574644 and parameters: {'splitter': 'random', 'min_samples_split': 0.2637239777481575, 'min_samples_leaf': 0.08524548934773446, 'min_weight_fraction_leaf': 0.06156187519718419, 'max_features': 0.9472994738226238}. Best is trial 441 with value: 0.8118070902918568.[0m
[32m[I 2022-04-21 17:50:19,627][0m Trial 586 finished with value: 0.6851609036733942 and parameters: {'splitter': 'random', 'min_samples_split': 0.25167387704207034, 'min_samples_leaf': 0.11086491136090948, 'min_weight_fraction_leaf': 0.31477425207193416, 'max_features': 0.9024888534471279}. Best is trial 441 with value: 0.8118070902918568.[0m
[32m[I 2022-04-21 17:50:20,090][0m Trial 587 finished with value: 0.7852957894985817 and parameters: {'splitter': 'random', 'min_samples_split': 0.2593167474154483, 'min_samples_leaf': 0.07198410444400621, 'min_weight_fraction_leaf': 0.07905660552166106, 'max_features': 0.8509296591294656}. Best is trial 441 with value: 0.8118070902918568.[0m
[32m[I 2022-04-21 17:50:20,609][0m Trial 588 finished with value: 0.7762683710639544 and parameters: {'splitter': 'random', 'min_samples_split': 0.23661922697714094, 'min_samples_leaf': 0.09445702667305002, 'min_weight_fraction_leaf': 0.04126999050959277, 'max_features': 0.8821401183390065}. Best is trial 441 with value: 0.8118070902918568.[0m
[32m[I 2022-04-21 17:50:21,967][0m Trial 589 finished with value: 0.810455310005268 and parameters: {'splitter': 'random', 'min_samples_split': 0.26524397796050697, 'min_samples_leaf': 0.08223984230248449, 'min_weight_fraction_leaf': 0.0365094621837074, 'max_features': 0.9076879910129643}. Best is trial 441 with value: 0.8118070902918568.[0m
[32m[I 2022-04-21 17:50:22,759][0m Trial 590 finished with value: 0.7989883908314254 and parameters: {'splitter': 'random', 'min_samples_split': 0.26621167874222007, 'min_samples_leaf': 0.12336426286326163, 'min_weight_fraction_leaf': 0.036261976373447045, 'max_features': 0.8914901541099958}. Best is trial 441 with value: 0.8118070902918568.[0m
[32m[I 2022-04-21 17:50:23,226][0m Trial 591 finished with value: 0.810095230018675 and parameters: {'splitter': 'random', 'min_samples_split': 0.24780441072607226, 'min_samples_leaf': 0.08555147532432728, 'min_weight_fraction_leaf': 0.05675963116975907, 'max_features': 0.917922615759158}. Best is trial 441 with value: 0.8118070902918568.[0m
[32m[I 2022-04-21 17:50:23,640][0m Trial 592 finished with value: 0.7606486144365292 and parameters: {'splitter': 'random', 'min_samples_split': 0.3004733786026817, 'min_samples_leaf': 0.09604717042045455, 'min_weight_fraction_leaf': 0.12142996802986654, 'max_features': 0.9406035421386767}. Best is trial 441 with value: 0.8118070902918568.[0m
[32m[I 2022-04-21 17:50:24,035][0m Trial 593 finished with value: 0.7720767720828625 and parameters: {'splitter': 'random', 'min_samples_split': 0.27243075645424475, 'min_samples_leaf': 0.10489632590555963, 'min_weight_fraction_leaf': 0.05010373695781584, 'max_features': 0.9173364191553413}. Best is trial 441 with value: 0.8118070902918568.[0m
[32m[I 2022-04-21 17:50:24,535][0m Trial 594 finished with value: 0.7737414327341314 and parameters: {'splitter': 'random', 'min_samples_split': 0.2955360528676662, 'min_samples_leaf': 0.05511473606797591, 'min_weight_fraction_leaf': 0.07578358306611918, 'max_features': 0.9735761743519561}. Best is trial 441 with value: 0.8118070902918568.[0m
[32m[I 2022-04-21 17:50:25,190][0m Trial 595 finished with value: 0.775684232099894 and parameters: {'splitter': 'random', 'min_samples_split': 0.2654108340773175, 'min_samples_leaf': 0.07886067995498205, 'min_weight_fraction_leaf': 0.04718310475156585, 'max_features': 0.8633542374132734}. Best is trial 441 with value: 0.8118070902918568.[0m
[32m[I 2022-04-21 17:50:25,645][0m Trial 596 finished with value: 0.7977286215404128 and parameters: {'splitter': 'random', 'min_samples_split': 0.27399069332107084, 'min_samples_leaf': 0.09053590390396438, 'min_weight_fraction_leaf': 0.04523346611840952, 'max_features': 0.8966956613410754}. Best is trial 441 with value: 0.8118070902918568.[0m
[32m[I 2022-04-21 17:50:26,163][0m Trial 597 finished with value: 0.7746678951442512 and parameters: {'splitter': 'random', 'min_samples_split': 0.2925467583695711, 'min_samples_leaf': 0.08507372638754486, 'min_weight_fraction_leaf': 0.06689256477539329, 'max_features': 0.8787988613164613}. Best is trial 441 with value: 0.8118070902918568.[0m
[32m[I 2022-04-21 17:50:27,098][0m Trial 598 finished with value: 0.810095230018675 and parameters: {'splitter': 'random', 'min_samples_split': 0.2542708002227448, 'min_samples_leaf': 0.08117767938370608, 'min_weight_fraction_leaf': 0.05497781002828405, 'max_features': 0.9147429197541012}. Best is trial 441 with value: 0.8118070902918568.[0m
[32m[I 2022-04-21 17:50:27,520][0m Trial 599 finished with value: 0.795073011130887 and parameters: {'splitter': 'random', 'min_samples_split': 0.23508884636642363, 'min_samples_leaf': 0.1162107036777276, 'min_weight_fraction_leaf': 0.04943977055563013, 'max_features': 0.901354607556331}. Best is trial 441 with value: 0.8118070902918568.[0m
[32m[I 2022-04-21 17:50:27,950][0m Trial 600 finished with value: 0.7717877357158678 and parameters: {'splitter': 'random', 'min_samples_split': 0.2876986052343137, 'min_samples_leaf': 0.09846412376118069, 'min_weight_fraction_leaf': 0.07867937404301073, 'max_features': 0.9562433592441419}. Best is trial 441 with value: 0.8118070902918568.[0m
[32m[I 2022-04-21 17:50:28,825][0m Trial 601 finished with value: 0.7645669710097607 and parameters: {'splitter': 'random', 'min_samples_split': 0.2795224972808111, 'min_samples_leaf': 0.07131701532211587, 'min_weight_fraction_leaf': 0.09592752735617799, 'max_features': 0.9371628309259685}. Best is trial 441 with value: 0.8118070902918568.[0m
[32m[I 2022-04-21 17:50:29,630][0m Trial 602 finished with value: 0.810455310005268 and parameters: {'splitter': 'random', 'min_samples_split': 0.27088559816649543, 'min_samples_leaf': 0.05387958961741762, 'min_weight_fraction_leaf': 0.061556878752922456, 'max_features': 0.9125611213354657}. Best is trial 441 with value: 0.8118070902918568.[0m
[32m[I 2022-04-21 17:50:30,162][0m Trial 603 finished with value: 0.6851609036733942 and parameters: {'splitter': 'random', 'min_samples_split': 0.30639256674175797, 'min_samples_leaf': 0.469373772935023, 'min_weight_fraction_leaf': 0.06803522146651624, 'max_features': 0.9361580279047065}. Best is trial 441 with value: 0.8118070902918568.[0m
[32m[I 2022-04-21 17:50:30,719][0m Trial 604 finished with value: 0.7765460027548666 and parameters: {'splitter': 'random', 'min_samples_split': 0.2589204528043738, 'min_samples_leaf': 0.10379323987277975, 'min_weight_fraction_leaf': 0.06148952090799069, 'max_features': 0.8772739439460492}. Best is trial 441 with value: 0.8118070902918568.[0m
[32m[I 2022-04-21 17:50:31,413][0m Trial 605 finished with value: 0.7860042925264542 and parameters: {'splitter': 'random', 'min_samples_split': 0.27288393224519475, 'min_samples_leaf': 0.08996421579656003, 'min_weight_fraction_leaf': 0.034423238337895755, 'max_features': 0.8481294410944891}. Best is trial 441 with value: 0.8118070902918568.[0m
[32m[I 2022-04-21 17:50:32,254][0m Trial 606 finished with value: 0.7850120192445157 and parameters: {'splitter': 'random', 'min_samples_split': 0.07021473491856603, 'min_samples_leaf': 0.07378739427134347, 'min_weight_fraction_leaf': 0.04857785238899501, 'max_features': 0.9629054510804284}. Best is trial 441 with value: 0.8118070902918568.[0m
[32m[I 2022-04-21 17:50:33,058][0m Trial 607 finished with value: 0.7645669710097607 and parameters: {'splitter': 'random', 'min_samples_split': 0.2888106887779589, 'min_samples_leaf': 0.06384225974647585, 'min_weight_fraction_leaf': 0.0905343823985596, 'max_features': 0.9304683932956181}. Best is trial 441 with value: 0.8118070902918568.[0m
[32m[I 2022-04-21 17:50:33,613][0m Trial 608 finished with value: 0.6851609036733942 and parameters: {'splitter': 'random', 'min_samples_split': 0.29750587324058625, 'min_samples_leaf': 0.39005961275281514, 'min_weight_fraction_leaf': 0.0680756849779574, 'max_features': 0.896175455227019}. Best is trial 441 with value: 0.8118070902918568.[0m
[32m[I 2022-04-21 17:50:34,006][0m Trial 609 finished with value: 0.7475994367877548 and parameters: {'splitter': 'random', 'min_samples_split': 0.281641858104221, 'min_samples_leaf': 0.1604788662148112, 'min_weight_fraction_leaf': 0.08288446557162246, 'max_features': 0.5228547912575994}. Best is trial 441 with value: 0.8118070902918568.[0m
[32m[I 2022-04-21 17:50:34,903][0m Trial 610 finished with value: 0.8105666058619081 and parameters: {'splitter': 'random', 'min_samples_split': 0.2550203965206311, 'min_samples_leaf': 0.08972040257538512, 'min_weight_fraction_leaf': 0.04061013135625083, 'max_features': 0.9070427119354768}. Best is trial 441 with value: 0.8118070902918568.[0m
[32m[I 2022-04-21 17:50:36,080][0m Trial 611 finished with value: 0.8032272519689826 and parameters: {'splitter': 'random', 'min_samples_split': 0.31274066600192313, 'min_samples_leaf': 0.06662077737720586, 'min_weight_fraction_leaf': 0.09985834179002168, 'max_features': 0.9817730674226858}. Best is trial 441 with value: 0.8118070902918568.[0m
[32m[I 2022-04-21 17:50:36,809][0m Trial 612 finished with value: 0.7470560610037319 and parameters: {'splitter': 'random', 'min_samples_split': 0.24424156628497035, 'min_samples_leaf': 0.25072966384626943, 'min_weight_fraction_leaf': 0.07787417263683899, 'max_features': 0.9498323555360837}. Best is trial 441 with value: 0.8118070902918568.[0m
[32m[I 2022-04-21 17:50:37,288][0m Trial 613 finished with value: 0.7963072401901873 and parameters: {'splitter': 'random', 'min_samples_split': 0.2462292133949356, 'min_samples_leaf': 0.1128024088009964, 'min_weight_fraction_leaf': 0.07463712019760453, 'max_features': 0.8937995610885051}. Best is trial 441 with value: 0.8118070902918568.[0m
[32m[I 2022-04-21 17:50:38,042][0m Trial 614 finished with value: 0.8118070902918568 and parameters: {'splitter': 'random', 'min_samples_split': 0.23075903410444099, 'min_samples_leaf': 0.09432396129016199, 'min_weight_fraction_leaf': 0.055092316413868955, 'max_features': 0.9203215793707055}. Best is trial 441 with value: 0.8118070902918568.[0m
[32m[I 2022-04-21 17:50:38,792][0m Trial 615 finished with value: 0.7672437310246556 and parameters: {'splitter': 'random', 'min_samples_split': 0.24176966606583417, 'min_samples_leaf': 0.10577763339145703, 'min_weight_fraction_leaf': 0.0525442188470726, 'max_features': 0.9246506763260334}. Best is trial 441 with value: 0.8118070902918568.[0m
[32m[I 2022-04-21 17:50:39,327][0m Trial 616 finished with value: 0.802090957212744 and parameters: {'splitter': 'random', 'min_samples_split': 0.23326675596706817, 'min_samples_leaf': 0.048965946109880344, 'min_weight_fraction_leaf': 0.040145622161809995, 'max_features': 0.86674637208553}. Best is trial 441 with value: 0.8118070902918568.[0m
[32m[I 2022-04-21 17:50:39,731][0m Trial 617 finished with value: 0.7658556353315025 and parameters: {'splitter': 'random', 'min_samples_split': 0.22426518761809533, 'min_samples_leaf': 0.1289909811214741, 'min_weight_fraction_leaf': 0.0350995515173536, 'max_features': 0.9070243315146409}. Best is trial 441 with value: 0.8118070902918568.[0m
[32m[I 2022-04-21 17:50:40,413][0m Trial 618 finished with value: 0.7862150500822881 and parameters: {'splitter': 'random', 'min_samples_split': 0.25436078762312664, 'min_samples_leaf': 0.09558085168171317, 'min_weight_fraction_leaf': 0.056606712242397765, 'max_features': 0.8379832504476437}. Best is trial 441 with value: 0.8118070902918568.[0m
[32m[I 2022-04-21 17:50:40,801][0m Trial 619 finished with value: 0.7339102778388138 and parameters: {'splitter': 'random', 'min_samples_split': 0.23206976157889697, 'min_samples_leaf': 0.10237386738648034, 'min_weight_fraction_leaf': 0.06402182574344152, 'max_features': 0.46740442312083125}. Best is trial 441 with value: 0.8118070902918568.[0m
[32m[I 2022-04-21 17:50:41,290][0m Trial 620 finished with value: 0.7651648883729563 and parameters: {'splitter': 'random', 'min_samples_split': 0.22443399517856313, 'min_samples_leaf': 0.0919685204766587, 'min_weight_fraction_leaf': 0.07236300112470143, 'max_features': 0.9444524677379543}. Best is trial 441 with value: 0.8118070902918568.[0m
