[32m[I 2022-04-21 13:23:15,263][0m Trial 683 finished with value: 0.9050513591607233 and parameters: {'splitter': 'random', 'min_samples_split': 0.0482209416418591, 'min_samples_leaf': 0.016092126573101263, 'min_weight_fraction_leaf': 0.009546672013496104, 'max_features': 0.9576968546916811}. Best is trial 677 with value: 0.9113497956229912.[0m
[32m[I 2022-04-21 13:23:16,065][0m Trial 684 finished with value: 0.8797245818194697 and parameters: {'splitter': 'random', 'min_samples_split': 0.05925564171637389, 'min_samples_leaf': 0.20098488474002246, 'min_weight_fraction_leaf': 0.04018031456043181, 'max_features': 0.9082386412734973}. Best is trial 677 with value: 0.9113497956229912.[0m
[32m[I 2022-04-21 13:23:18,088][0m Trial 685 finished with value: 0.9016728103777378 and parameters: {'splitter': 'random', 'min_samples_split': 0.042504864754446224, 'min_samples_leaf': 0.03732018194491857, 'min_weight_fraction_leaf': 0.031070158768820313, 'max_features': 0.938790221154633}. Best is trial 677 with value: 0.9113497956229912.[0m
[32m[I 2022-04-21 13:23:20,222][0m Trial 686 finished with value: 0.8988217899154586 and parameters: {'splitter': 'random', 'min_samples_split': 0.06819567881331476, 'min_samples_leaf': 0.02587994957109415, 'min_weight_fraction_leaf': 0.057551573804840314, 'max_features': 0.8912817109778866}. Best is trial 677 with value: 0.9113497956229912.[0m
[32m[I 2022-04-21 13:23:22,821][0m Trial 687 finished with value: 0.9063078117010039 and parameters: {'splitter': 'random', 'min_samples_split': 0.05267616517238374, 'min_samples_leaf': 0.008230930000241221, 'min_weight_fraction_leaf': 0.020247406935158724, 'max_features': 0.9157720558880595}. Best is trial 677 with value: 0.9113497956229912.[0m
[32m[I 2022-04-21 13:26:03,657][0m Trial 688 finished with value: 0.8792722362034251 and parameters: {'splitter': 'best', 'min_samples_split': 0.036680246596322345, 'min_samples_leaf': 0.05440797647497589, 'min_weight_fraction_leaf': 0.04382948688697544, 'max_features': 0.961111012254079}. Best is trial 677 with value: 0.9113497956229912.[0m
[32m[I 2022-04-21 13:26:05,261][0m Trial 689 finished with value: 0.904106913162738 and parameters: {'splitter': 'random', 'min_samples_split': 0.010910952158587516, 'min_samples_leaf': 0.033953567719747835, 'min_weight_fraction_leaf': 0.009306470414538515, 'max_features': 0.932730162395501}. Best is trial 677 with value: 0.9113497956229912.[0m
[32m[I 2022-04-21 13:26:07,266][0m Trial 690 finished with value: 0.9051080914940097 and parameters: {'splitter': 'random', 'min_samples_split': 0.0018335776672721016, 'min_samples_leaf': 0.009613366511067124, 'min_weight_fraction_leaf': 0.03262960761992833, 'max_features': 0.8569788394016948}. Best is trial 677 with value: 0.9113497956229912.[0m
[32m[I 2022-04-21 13:26:08,764][0m Trial 691 finished with value: 0.8985046900755123 and parameters: {'splitter': 'random', 'min_samples_split': 0.04279726794931378, 'min_samples_leaf': 0.021476673140297785, 'min_weight_fraction_leaf': 0.07714545391462138, 'max_features': 0.8953718239442875}. Best is trial 677 with value: 0.9113497956229912.[0m
[32m[I 2022-04-21 13:26:10,350][0m Trial 692 finished with value: 0.906056181803014 and parameters: {'splitter': 'random', 'min_samples_split': 0.0654234183004247, 'min_samples_leaf': 0.04259688180127719, 'min_weight_fraction_leaf': 0.04850631645573885, 'max_features': 0.9174492755730755}. Best is trial 677 with value: 0.9113497956229912.[0m
[32m[I 2022-04-21 13:26:12,161][0m Trial 693 finished with value: 0.8996946774896605 and parameters: {'splitter': 'random', 'min_samples_split': 0.027130598735948083, 'min_samples_leaf': 0.026890044892728095, 'min_weight_fraction_leaf': 0.019582763446484425, 'max_features': 0.9475893421379622}. Best is trial 677 with value: 0.9113497956229912.[0m
[32m[I 2022-04-21 13:26:14,437][0m Trial 694 finished with value: 0.9016655049871533 and parameters: {'splitter': 'random', 'min_samples_split': 0.014941025678398974, 'min_samples_leaf': 0.0013946951447069353, 'min_weight_fraction_leaf': 0.03775457302872093, 'max_features': 0.9335530485311835}. Best is trial 677 with value: 0.9113497956229912.[0m
[32m[I 2022-04-21 13:26:16,509][0m Trial 695 finished with value: 0.9018569881467255 and parameters: {'splitter': 'random', 'min_samples_split': 0.03404631136341914, 'min_samples_leaf': 0.016698395344120643, 'min_weight_fraction_leaf': 0.02748680613405041, 'max_features': 0.9604322241308857}. Best is trial 677 with value: 0.9113497956229912.[0m
[32m[I 2022-04-21 13:26:18,743][0m Trial 696 finished with value: 0.8879201487754067 and parameters: {'splitter': 'random', 'min_samples_split': 0.056424351924695734, 'min_samples_leaf': 0.07760921552831176, 'min_weight_fraction_leaf': 0.05555232206003129, 'max_features': 0.8763008384000109}. Best is trial 677 with value: 0.9113497956229912.[0m
[32m[I 2022-04-21 13:26:22,333][0m Trial 697 finished with value: 0.8974667484493061 and parameters: {'splitter': 'random', 'min_samples_split': 0.01794953223646119, 'min_samples_leaf': 0.038597093317078585, 'min_weight_fraction_leaf': 0.009709938041716135, 'max_features': 0.9055999113692353}. Best is trial 677 with value: 0.9113497956229912.[0m
[32m[I 2022-04-21 13:26:24,361][0m Trial 698 finished with value: 0.9027521621117234 and parameters: {'splitter': 'random', 'min_samples_split': 0.3303868045121008, 'min_samples_leaf': 0.052331342368184784, 'min_weight_fraction_leaf': 0.04113555821883396, 'max_features': 0.9168059389818198}. Best is trial 677 with value: 0.9113497956229912.[0m
[32m[I 2022-04-21 13:26:26,113][0m Trial 699 finished with value: 0.9026990429796106 and parameters: {'splitter': 'random', 'min_samples_split': 0.04597578229538823, 'min_samples_leaf': 0.0634793150556428, 'min_weight_fraction_leaf': 0.029504600818711958, 'max_features': 0.9398725670639889}. Best is trial 677 with value: 0.9113497956229912.[0m
[32m[I 2022-04-21 13:26:28,812][0m Trial 700 finished with value: 0.9058740167704885 and parameters: {'splitter': 'random', 'min_samples_split': 0.0016950081360181963, 'min_samples_leaf': 0.030285041470059205, 'min_weight_fraction_leaf': 0.0007375929592184222, 'max_features': 0.894369831061239}. Best is trial 677 with value: 0.9113497956229912.[0m
[32m[I 2022-04-21 13:26:30,963][0m Trial 701 finished with value: 0.9031813279115772 and parameters: {'splitter': 'random', 'min_samples_split': 0.07309266481973803, 'min_samples_leaf': 0.010216258595985683, 'min_weight_fraction_leaf': 0.0198961996088524, 'max_features': 0.960369514248137}. Best is trial 677 with value: 0.9113497956229912.[0m
[32m[I 2022-04-21 13:26:32,690][0m Trial 702 finished with value: 0.9067548055488868 and parameters: {'splitter': 'random', 'min_samples_split': 0.028995436860383583, 'min_samples_leaf': 0.01959594940429424, 'min_weight_fraction_leaf': 0.06641021473782674, 'max_features': 0.9243861688214137}. Best is trial 677 with value: 0.9113497956229912.[0m
[32m[I 2022-04-21 13:26:36,038][0m Trial 703 finished with value: 0.9001649359072619 and parameters: {'splitter': 'random', 'min_samples_split': 0.012156717336161322, 'min_samples_leaf': 0.0010584629624971805, 'min_weight_fraction_leaf': 0.04523777690948956, 'max_features': 0.8697845134015401}. Best is trial 677 with value: 0.9113497956229912.[0m
[32m[I 2022-04-21 13:26:37,530][0m Trial 704 finished with value: 0.899104059033407 and parameters: {'splitter': 'random', 'min_samples_split': 0.03727373589801518, 'min_samples_leaf': 0.04158379125846729, 'min_weight_fraction_leaf': 0.03346251778235582, 'max_features': 0.9039236471027537}. Best is trial 677 with value: 0.9113497956229912.[0m
[32m[I 2022-04-21 13:26:39,425][0m Trial 705 finished with value: 0.9093539059620296 and parameters: {'splitter': 'random', 'min_samples_split': 0.05888270202161707, 'min_samples_leaf': 0.026138082246551148, 'min_weight_fraction_leaf': 0.016671631817622407, 'max_features': 0.9449499331856591}. Best is trial 677 with value: 0.9113497956229912.[0m
[32m[I 2022-04-21 13:26:40,422][0m Trial 706 finished with value: 0.3425804518366971 and parameters: {'splitter': 'random', 'min_samples_split': 0.06985553424291763, 'min_samples_leaf': 0.01932548420583987, 'min_weight_fraction_leaf': 0.4091998154626033, 'max_features': 0.9604286378779023}. Best is trial 677 with value: 0.9113497956229912.[0m
[32m[I 2022-04-21 13:30:30,958][0m Trial 707 finished with value: 0.8870869669563932 and parameters: {'splitter': 'best', 'min_samples_split': 0.06344125186754579, 'min_samples_leaf': 0.012719655769619469, 'min_weight_fraction_leaf': 0.006987951411738677, 'max_features': 0.9429296821675341}. Best is trial 677 with value: 0.9113497956229912.[0m
[32m[I 2022-04-21 13:30:32,759][0m Trial 708 finished with value: 0.9029946562746012 and parameters: {'splitter': 'random', 'min_samples_split': 0.05632276648592363, 'min_samples_leaf': 0.020682612838122137, 'min_weight_fraction_leaf': 0.013408264253186756, 'max_features': 0.956910038018545}. Best is trial 677 with value: 0.9113497956229912.[0m
[32m[I 2022-04-21 13:30:34,160][0m Trial 709 finished with value: 0.9032644345536663 and parameters: {'splitter': 'random', 'min_samples_split': 0.055874378413085665, 'min_samples_leaf': 0.028956094335133534, 'min_weight_fraction_leaf': 0.01656746358069657, 'max_features': 0.9698752444211534}. Best is trial 677 with value: 0.9113497956229912.[0m
[32m[I 2022-04-21 13:30:35,499][0m Trial 710 finished with value: 0.9009477176230825 and parameters: {'splitter': 'random', 'min_samples_split': 0.06301923184500324, 'min_samples_leaf': 0.010925146804271455, 'min_weight_fraction_leaf': 0.01873755303195217, 'max_features': 0.9404740883533873}. Best is trial 677 with value: 0.9113497956229912.[0m
[32m[I 2022-04-21 13:30:37,229][0m Trial 711 finished with value: 0.8988774257990076 and parameters: {'splitter': 'random', 'min_samples_split': 0.07228606696560558, 'min_samples_leaf': 0.02707696724532089, 'min_weight_fraction_leaf': 0.0017841936263991963, 'max_features': 0.9347248052876636}. Best is trial 677 with value: 0.9113497956229912.[0m
[32m[I 2022-04-21 13:30:38,384][0m Trial 712 finished with value: 0.9042811943299844 and parameters: {'splitter': 'random', 'min_samples_split': 0.049576018799275444, 'min_samples_leaf': 0.05119160736831336, 'min_weight_fraction_leaf': 0.023782841001525844, 'max_features': 0.894267537333775}. Best is trial 677 with value: 0.9113497956229912.[0m
[32m[I 2022-04-21 13:30:39,442][0m Trial 713 finished with value: 0.9083645748386966 and parameters: {'splitter': 'random', 'min_samples_split': 0.05013390305811367, 'min_samples_leaf': 0.03994369525719468, 'min_weight_fraction_leaf': 0.010790468526569032, 'max_features': 0.920985168961384}. Best is trial 677 with value: 0.9113497956229912.[0m
[32m[I 2022-04-21 13:30:41,539][0m Trial 714 finished with value: 0.8942999721283542 and parameters: {'splitter': 'random', 'min_samples_split': 0.049647254067959154, 'min_samples_leaf': 0.06121989863180227, 'min_weight_fraction_leaf': 0.006202004582018453, 'max_features': 0.9656972587412471}. Best is trial 677 with value: 0.9113497956229912.[0m
[32m[I 2022-04-21 13:30:42,674][0m Trial 715 finished with value: 0.9046404359471021 and parameters: {'splitter': 'random', 'min_samples_split': 0.06689581733098288, 'min_samples_leaf': 0.05095855258524368, 'min_weight_fraction_leaf': 0.001247138046150887, 'max_features': 0.946941237970047}. Best is trial 677 with value: 0.9113497956229912.[0m
[32m[I 2022-04-21 13:30:44,206][0m Trial 716 finished with value: 0.9049515979539745 and parameters: {'splitter': 'random', 'min_samples_split': 0.042596914805059866, 'min_samples_leaf': 0.009645440961039966, 'min_weight_fraction_leaf': 0.02593276247960577, 'max_features': 0.9224516495087871}. Best is trial 677 with value: 0.9113497956229912.[0m
[32m[I 2022-04-21 13:30:45,351][0m Trial 717 finished with value: 0.7797722362636331 and parameters: {'splitter': 'random', 'min_samples_split': 0.07804120556271554, 'min_samples_leaf': 0.17550937928573718, 'min_weight_fraction_leaf': 0.012694954286159316, 'max_features': 0.9640201908181152}. Best is trial 677 with value: 0.9113497956229912.[0m
[32m[I 2022-04-21 13:30:47,293][0m Trial 718 finished with value: 0.9000172288275705 and parameters: {'splitter': 'random', 'min_samples_split': 0.05989668994522528, 'min_samples_leaf': 0.035049205059269645, 'min_weight_fraction_leaf': 0.028142590948984587, 'max_features': 0.889822321152551}. Best is trial 677 with value: 0.9113497956229912.[0m
[32m[I 2022-04-21 13:30:48,368][0m Trial 719 finished with value: 0.9043484425628595 and parameters: {'splitter': 'random', 'min_samples_split': 0.03981397893807429, 'min_samples_leaf': 0.02031506432147294, 'min_weight_fraction_leaf': 0.02365878492046646, 'max_features': 0.8610760857411293}. Best is trial 677 with value: 0.9113497956229912.[0m
[32m[I 2022-04-21 13:30:49,961][0m Trial 720 finished with value: 0.9027521621117234 and parameters: {'splitter': 'random', 'min_samples_split': 0.3996674615553939, 'min_samples_leaf': 0.039760574114167495, 'min_weight_fraction_leaf': 2.308714914862897e-06, 'max_features': 0.9180268546502595}. Best is trial 677 with value: 0.9113497956229912.[0m
[32m[I 2022-04-21 13:30:52,310][0m Trial 721 finished with value: 0.9054884836224947 and parameters: {'splitter': 'random', 'min_samples_split': 0.08410155828333335, 'min_samples_leaf': 0.027565083486601562, 'min_weight_fraction_leaf': 0.03548523169322623, 'max_features': 0.9420738191873039}. Best is trial 677 with value: 0.9113497956229912.[0m
[32m[I 2022-04-21 13:30:54,456][0m Trial 722 finished with value: 0.5953505813837586 and parameters: {'splitter': 'random', 'min_samples_split': 0.46738643061199103, 'min_samples_leaf': 0.0446701812442892, 'min_weight_fraction_leaf': 0.017303840402259844, 'max_features': 0.9375180309654247}. Best is trial 677 with value: 0.9113497956229912.[0m
[32m[I 2022-04-21 13:30:56,277][0m Trial 723 finished with value: 0.9047118082154928 and parameters: {'splitter': 'random', 'min_samples_split': 0.049981230135970514, 'min_samples_leaf': 0.015741521696622685, 'min_weight_fraction_leaf': 0.011851686244039254, 'max_features': 0.9133781558639957}. Best is trial 677 with value: 0.9113497956229912.[0m
[32m[I 2022-04-21 13:30:57,801][0m Trial 724 finished with value: 0.9018850324058351 and parameters: {'splitter': 'random', 'min_samples_split': 0.13953637741208855, 'min_samples_leaf': 0.00192261627559474, 'min_weight_fraction_leaf': 0.03373671832251741, 'max_features': 0.8851500765340711}. Best is trial 677 with value: 0.9113497956229912.[0m
[32m[I 2022-04-21 13:30:58,700][0m Trial 725 finished with value: 0.8947214966641794 and parameters: {'splitter': 'random', 'min_samples_split': 0.057916490175293364, 'min_samples_leaf': 0.056871347657660165, 'min_weight_fraction_leaf': 0.011553520111890453, 'max_features': 0.9606851963298011}. Best is trial 677 with value: 0.9113497956229912.[0m
[32m[I 2022-04-21 13:33:47,757][0m Trial 726 finished with value: 0.879563030086139 and parameters: {'splitter': 'best', 'min_samples_split': 0.03369336095567442, 'min_samples_leaf': 0.031996295685551596, 'min_weight_fraction_leaf': 0.052403611294270534, 'max_features': 0.9672632365068425}. Best is trial 677 with value: 0.9113497956229912.[0m
[32m[I 2022-04-21 13:33:49,197][0m Trial 727 finished with value: 0.37352803050186595 and parameters: {'splitter': 'random', 'min_samples_split': 0.06586753680459824, 'min_samples_leaf': 0.0115405912487028, 'min_weight_fraction_leaf': 0.24120803475945823, 'max_features': 0.9106179815532307}. Best is trial 677 with value: 0.9113497956229912.[0m
[32m[I 2022-04-21 13:33:50,692][0m Trial 728 finished with value: 0.9018704940614967 and parameters: {'splitter': 'random', 'min_samples_split': 0.02999584464199559, 'min_samples_leaf': 0.03634464729370165, 'min_weight_fraction_leaf': 0.02537837291394182, 'max_features': 0.932194998377179}. Best is trial 677 with value: 0.9113497956229912.[0m
[32m[I 2022-04-21 13:33:52,133][0m Trial 729 finished with value: 0.9032601542542545 and parameters: {'splitter': 'random', 'min_samples_split': 0.04269795598141114, 'min_samples_leaf': 0.046612490212230365, 'min_weight_fraction_leaf': 0.04526773361019629, 'max_features': 0.9441329412789871}. Best is trial 677 with value: 0.9113497956229912.[0m
[32m[I 2022-04-21 13:33:53,486][0m Trial 730 finished with value: 0.9007490846623629 and parameters: {'splitter': 'random', 'min_samples_split': 0.07776038523891655, 'min_samples_leaf': 0.022866239991407945, 'min_weight_fraction_leaf': 0.032691227957600086, 'max_features': 0.9038333397304015}. Best is trial 677 with value: 0.9113497956229912.[0m
[32m[I 2022-04-21 13:33:55,388][0m Trial 731 finished with value: 0.9019094551585809 and parameters: {'splitter': 'random', 'min_samples_split': 0.0537109153601573, 'min_samples_leaf': 0.009449962574692005, 'min_weight_fraction_leaf': 0.00925809226659335, 'max_features': 0.8351486616993025}. Best is trial 677 with value: 0.9113497956229912.[0m
[32m[I 2022-04-21 13:33:56,391][0m Trial 732 finished with value: 0.9067881481094965 and parameters: {'splitter': 'random', 'min_samples_split': 0.0244399208365563, 'min_samples_leaf': 0.03220708872104508, 'min_weight_fraction_leaf': 0.021418245657153435, 'max_features': 0.9746154965511564}. Best is trial 677 with value: 0.9113497956229912.[0m
[32m[I 2022-04-21 13:33:58,116][0m Trial 733 finished with value: 0.8974667484493061 and parameters: {'splitter': 'random', 'min_samples_split': 0.03864278130256329, 'min_samples_leaf': 0.02104995760149858, 'min_weight_fraction_leaf': 0.038720274741465555, 'max_features': 0.8842598820758278}. Best is trial 677 with value: 0.9113497956229912.[0m
[32m[I 2022-04-21 13:33:59,346][0m Trial 734 finished with value: 0.3425804518366971 and parameters: {'splitter': 'random', 'min_samples_split': 0.017002898812354433, 'min_samples_leaf': 0.02531061825117494, 'min_weight_fraction_leaf': 0.32419785755083835, 'max_features': 0.9265440158105062}. Best is trial 677 with value: 0.9113497956229912.[0m
[32m[I 2022-04-21 13:34:02,396][0m Trial 735 finished with value: 0.8988217899154586 and parameters: {'splitter': 'random', 'min_samples_split': 0.07187243373721057, 'min_samples_leaf': 0.0013777922616562827, 'min_weight_fraction_leaf': 0.05753175390894075, 'max_features': 0.9048808799448124}. Best is trial 677 with value: 0.9113497956229912.[0m
[32m[I 2022-04-21 13:34:04,960][0m Trial 736 finished with value: 0.9006261468410022 and parameters: {'splitter': 'random', 'min_samples_split': 0.224835879825176, 'min_samples_leaf': 0.015665272931253884, 'min_weight_fraction_leaf': 0.026862909299445476, 'max_features': 0.8768381818026889}. Best is trial 677 with value: 0.9113497956229912.[0m
[32m[I 2022-04-21 13:34:08,263][0m Trial 737 finished with value: 0.901084508788123 and parameters: {'splitter': 'random', 'min_samples_split': 0.02660782164753054, 'min_samples_leaf': 0.029058526537553885, 'min_weight_fraction_leaf': 0.04454904654285549, 'max_features': 0.9471722831317085}. Best is trial 677 with value: 0.9113497956229912.[0m
[32m[I 2022-04-21 13:34:10,238][0m Trial 738 finished with value: 0.9026548555818741 and parameters: {'splitter': 'random', 'min_samples_split': 0.04453059730742971, 'min_samples_leaf': 0.009402527951709426, 'min_weight_fraction_leaf': 0.019576980457494873, 'max_features': 0.9046097856236426}. Best is trial 677 with value: 0.9113497956229912.[0m
[32m[I 2022-04-21 13:34:11,852][0m Trial 739 finished with value: 0.901084508788123 and parameters: {'splitter': 'random', 'min_samples_split': 0.05006819083600585, 'min_samples_leaf': 0.04427936975276825, 'min_weight_fraction_leaf': 0.018235028211008558, 'max_features': 0.9313736559679032}. Best is trial 677 with value: 0.9113497956229912.[0m
[32m[I 2022-04-21 13:34:13,124][0m Trial 740 finished with value: 0.8850777010596257 and parameters: {'splitter': 'random', 'min_samples_split': 0.06152960097121454, 'min_samples_leaf': 0.09323777603270031, 'min_weight_fraction_leaf': 0.031814155326883094, 'max_features': 0.9754762644859499}. Best is trial 677 with value: 0.9113497956229912.[0m
[32m[I 2022-04-21 13:34:14,644][0m Trial 741 finished with value: 0.9024147198942105 and parameters: {'splitter': 'random', 'min_samples_split': 0.03386205048251721, 'min_samples_leaf': 0.018486097257917708, 'min_weight_fraction_leaf': 0.04973395980547524, 'max_features': 0.91349153530461}. Best is trial 677 with value: 0.9113497956229912.[0m
[32m[I 2022-04-21 13:34:15,521][0m Trial 742 finished with value: 0.902348563436209 and parameters: {'splitter': 'random', 'min_samples_split': 0.022954103494094318, 'min_samples_leaf': 0.07036850812939868, 'min_weight_fraction_leaf': 0.038088853428889256, 'max_features': 0.9504623459259823}. Best is trial 677 with value: 0.9113497956229912.[0m
[32m[I 2022-04-21 13:34:16,847][0m Trial 743 finished with value: 0.9035635389392083 and parameters: {'splitter': 'random', 'min_samples_split': 0.05440658181427622, 'min_samples_leaf': 0.052205377595045094, 'min_weight_fraction_leaf': 0.008250331203036818, 'max_features': 0.9234579427938355}. Best is trial 677 with value: 0.9113497956229912.[0m
[32m[I 2022-04-21 13:34:17,991][0m Trial 744 finished with value: 0.9035840858759198 and parameters: {'splitter': 'random', 'min_samples_split': 0.010510901749729771, 'min_samples_leaf': 0.026145097840562813, 'min_weight_fraction_leaf': 0.039367124150564294, 'max_features': 0.955808713983665}. Best is trial 677 with value: 0.9113497956229912.[0m
