[32m[I 2022-05-13 06:32:49,895][0m Trial 360 finished with value: 0.7944453803910949 and parameters: {'loss': 'coxph', 'learning_rate': 1.6992692213410245e-05, 'n_estimators': 913, 'criterion': 'friedman_mse', 'min_samples_split': 7, 'min_samples_leaf': 2, 'min_weight_fraction_leaf': 0.1599107999500708, 'min_impurity_decrease': 0.08381053449287604, 'max_features': 0.3122808356650769, 'subsample': 0.4168204220025323, 'dropout_rate': 0.8351939929466274, 'ccp_alpha': 0.17747332204070737}. Best is trial 285 with value: 0.8408994882022112.[0m
[32m[I 2022-05-13 06:45:45,898][0m Trial 361 finished with value: 0.8197858278443542 and parameters: {'loss': 'coxph', 'learning_rate': 1.245024765884599e-05, 'n_estimators': 267, 'criterion': 'absolute_error', 'min_samples_split': 8, 'min_samples_leaf': 3, 'min_weight_fraction_leaf': 0.18499483120520085, 'min_impurity_decrease': 0.025219052377547922, 'max_features': 0.9758029623733095, 'subsample': 0.32556989500182015, 'dropout_rate': 0.4616812443167172, 'ccp_alpha': 0.0012598607624534873}. Best is trial 285 with value: 0.8408994882022112.[0m
[32m[I 2022-05-13 06:54:43,226][0m Trial 362 finished with value: 0.7579370750759258 and parameters: {'loss': 'coxph', 'learning_rate': 1.1729289445416756e-05, 'n_estimators': 238, 'criterion': 'friedman_mse', 'min_samples_split': 8, 'min_samples_leaf': 4, 'min_weight_fraction_leaf': 0.11132102289279308, 'min_impurity_decrease': 0.019894065908677844, 'max_features': 0.9717216845094704, 'subsample': 0.3254319056221721, 'dropout_rate': 0.5090559705024368, 'ccp_alpha': 0.10565548528764597}. Best is trial 285 with value: 0.8408994882022112.[0m
[32m[I 2022-05-13 07:36:17,972][0m Trial 363 finished with value: 0.8012209285081406 and parameters: {'loss': 'coxph', 'learning_rate': 8.775389866024125e-06, 'n_estimators': 957, 'criterion': 'friedman_mse', 'min_samples_split': 8, 'min_samples_leaf': 3, 'min_weight_fraction_leaf': 0.2276129818633416, 'min_impurity_decrease': 0.060407662210039514, 'max_features': 0.9761726274928197, 'subsample': 0.3489481326157043, 'dropout_rate': 0.4656556474442794, 'ccp_alpha': 0.0011974837953565246}. Best is trial 285 with value: 0.8408994882022112.[0m
[32m[I 2022-05-13 07:49:56,497][0m Trial 364 finished with value: 0.5 and parameters: {'loss': 'coxph', 'learning_rate': 1.2613279133373746e-05, 'n_estimators': 274, 'criterion': 'absolute_error', 'min_samples_split': 8, 'min_samples_leaf': 5, 'min_weight_fraction_leaf': 0.1768329833703398, 'min_impurity_decrease': 0.02460582455140134, 'max_features': 0.9511771704666776, 'subsample': 0.3994312027755411, 'dropout_rate': 0.7703528713350087, 'ccp_alpha': 0.3235763139124337}. Best is trial 285 with value: 0.8408994882022112.[0m
[32m[I 2022-05-13 08:29:18,149][0m Trial 365 finished with value: 0.7628495631289269 and parameters: {'loss': 'coxph', 'learning_rate': 1.4911267955108455e-05, 'n_estimators': 958, 'criterion': 'friedman_mse', 'min_samples_split': 8, 'min_samples_leaf': 3, 'min_weight_fraction_leaf': 0.1657772298166499, 'min_impurity_decrease': 0.05048430925211738, 'max_features': 0.9595759011526147, 'subsample': 0.3675440711230008, 'dropout_rate': 0.8128379489654575, 'ccp_alpha': 0.17026532027283942}. Best is trial 285 with value: 0.8408994882022112.[0m
[32m[I 2022-05-13 08:41:37,945][0m Trial 366 finished with value: 0.8280499696072529 and parameters: {'loss': 'coxph', 'learning_rate': 8.691056770430398e-06, 'n_estimators': 259, 'criterion': 'absolute_error', 'min_samples_split': 8, 'min_samples_leaf': 2, 'min_weight_fraction_leaf': 0.18498851322740656, 'min_impurity_decrease': 0.0011856350049682662, 'max_features': 0.8947669229382041, 'subsample': 0.3117295716384425, 'dropout_rate': 0.44140017779014523, 'ccp_alpha': 0.001846084972718891}. Best is trial 285 with value: 0.8408994882022112.[0m
[32m[I 2022-05-13 08:52:55,823][0m Trial 367 finished with value: 0.7589427629836601 and parameters: {'loss': 'coxph', 'learning_rate': 8.910658875656843e-06, 'n_estimators': 297, 'criterion': 'squared_error', 'min_samples_split': 8, 'min_samples_leaf': 2, 'min_weight_fraction_leaf': 0.1780980931683476, 'min_impurity_decrease': 0.0016166241593917826, 'max_features': 0.8901051530561209, 'subsample': 0.335825450930116, 'dropout_rate': 0.42263327279133717, 'ccp_alpha': 0.10711585905202792}. Best is trial 285 with value: 0.8408994882022112.[0m
[32m[I 2022-05-13 09:02:14,594][0m Trial 368 finished with value: 0.7392751505372163 and parameters: {'loss': 'coxph', 'learning_rate': 1.0792668271834733e-05, 'n_estimators': 258, 'criterion': 'friedman_mse', 'min_samples_split': 8, 'min_samples_leaf': 3, 'min_weight_fraction_leaf': 0.18519637029384353, 'min_impurity_decrease': 0.0193527521486261, 'max_features': 0.8490273217058667, 'subsample': 0.3869087085798728, 'dropout_rate': 0.4441862689728587, 'ccp_alpha': 0.2750154790431664}. Best is trial 285 with value: 0.8408994882022112.[0m
[32m[I 2022-05-13 09:18:07,382][0m Trial 369 finished with value: 0.7392325403351245 and parameters: {'loss': 'coxph', 'learning_rate': 8.213234928678474e-06, 'n_estimators': 311, 'criterion': 'absolute_error', 'min_samples_split': 8, 'min_samples_leaf': 2, 'min_weight_fraction_leaf': 0.20425969873696426, 'min_impurity_decrease': 0.0019762104358183284, 'max_features': 0.8744339382148258, 'subsample': 0.46270974578518287, 'dropout_rate': 0.7289646488495256, 'ccp_alpha': 0.1667506289868781}. Best is trial 285 with value: 0.8408994882022112.[0m
[32m[I 2022-05-13 09:28:12,526][0m Trial 370 finished with value: 0.7581675226040436 and parameters: {'loss': 'coxph', 'learning_rate': 1.2323789548627287e-05, 'n_estimators': 263, 'criterion': 'friedman_mse', 'min_samples_split': 8, 'min_samples_leaf': 2, 'min_weight_fraction_leaf': 0.15174742984980202, 'min_impurity_decrease': 0.02890626192293466, 'max_features': 0.9390329746053289, 'subsample': 0.31446729391773387, 'dropout_rate': 0.45002805012311115, 'ccp_alpha': 0.09702650966932581}. Best is trial 285 with value: 0.8408994882022112.[0m
[32m[I 2022-05-13 09:38:01,497][0m Trial 371 finished with value: 0.7624150277413448 and parameters: {'loss': 'coxph', 'learning_rate': 1.0515396313626827e-05, 'n_estimators': 222, 'criterion': 'friedman_mse', 'min_samples_split': 8, 'min_samples_leaf': 2, 'min_weight_fraction_leaf': 0.16604892582794628, 'min_impurity_decrease': 0.06733015889233732, 'max_features': 0.9748696705737168, 'subsample': 0.16058661197249535, 'dropout_rate': 0.42411636899583915, 'ccp_alpha': 0.23502385366199843}. Best is trial 285 with value: 0.8408994882022112.[0m
/media/san2_ssd/data/Workdir/survival/venv/lib/python3.8/site-packages/sksurv/ensemble/boosting.py:955: RuntimeWarning: divide by zero encountered in log
  time = numpy.log(time)
/media/san2_ssd/data/Workdir/survival/venv/lib/python3.8/site-packages/sksurv/ensemble/boosting.py:955: RuntimeWarning: divide by zero encountered in log
  time = numpy.log(time)
/media/san2_ssd/data/Workdir/survival/venv/lib/python3.8/site-packages/sksurv/ensemble/boosting.py:955: RuntimeWarning: divide by zero encountered in log
  time = numpy.log(time)
/media/san2_ssd/data/Workdir/survival/venv/lib/python3.8/site-packages/sksurv/ensemble/boosting.py:955: RuntimeWarning: divide by zero encountered in log
  time = numpy.log(time)
/media/san2_ssd/data/Workdir/survival/venv/lib/python3.8/site-packages/sksurv/ensemble/boosting.py:955: RuntimeWarning: divide by zero encountered in log
  time = numpy.log(time)
[32m[I 2022-05-13 09:38:01,558][0m Trial 372 finished with value: -1.0 and parameters: {'loss': 'squared', 'learning_rate': 1.5052669936076223e-05, 'n_estimators': 268, 'criterion': 'absolute_error', 'min_samples_split': 8, 'min_samples_leaf': 2, 'min_weight_fraction_leaf': 0.1857766524163611, 'min_impurity_decrease': 0.0012106122565816863, 'max_features': 0.38179615487231616, 'subsample': 0.36436396261778753, 'dropout_rate': 0.5031145373898551, 'ccp_alpha': 0.09850824076043047}. Best is trial 285 with value: 0.8408994882022112.[0m
[32m[I 2022-05-13 09:48:59,012][0m Trial 373 finished with value: 0.7624377255498067 and parameters: {'loss': 'coxph', 'learning_rate': 8.257134371071652e-06, 'n_estimators': 256, 'criterion': 'friedman_mse', 'min_samples_split': 8, 'min_samples_leaf': 2, 'min_weight_fraction_leaf': 0.1975909162743919, 'min_impurity_decrease': 0.029328611247279927, 'max_features': 0.4742439181646363, 'subsample': 0.18907300371718758, 'dropout_rate': 0.4864211902160211, 'ccp_alpha': 0.18667407939939043}. Best is trial 285 with value: 0.8408994882022112.[0m
[32m[I 2022-05-13 09:59:54,015][0m Trial 374 finished with value: 0.7834631575446902 and parameters: {'loss': 'coxph', 'learning_rate': 1.8052661552124953e-05, 'n_estimators': 215, 'criterion': 'absolute_error', 'min_samples_split': 8, 'min_samples_leaf': 4, 'min_weight_fraction_leaf': 0.13464036537675944, 'min_impurity_decrease': 0.0464316081109348, 'max_features': 0.9510126514911257, 'subsample': 0.40449656102768256, 'dropout_rate': 0.8004427922374987, 'ccp_alpha': 0.08538248179279706}. Best is trial 285 with value: 0.8408994882022112.[0m
[32m[I 2022-05-13 10:08:46,402][0m Trial 375 finished with value: 0.5 and parameters: {'loss': 'coxph', 'learning_rate': 1.292755303896521e-05, 'n_estimators': 240, 'criterion': 'friedman_mse', 'min_samples_split': 8, 'min_samples_leaf': 2, 'min_weight_fraction_leaf': 0.2098641667937347, 'min_impurity_decrease': 0.08294003453227781, 'max_features': 0.9001313271873231, 'subsample': 0.33858074045507863, 'dropout_rate': 0.4670457150920416, 'ccp_alpha': 2.3800304791193363}. Best is trial 285 with value: 0.8408994882022112.[0m
[32m[I 2022-05-13 10:21:26,688][0m Trial 376 finished with value: 0.8180968234852676 and parameters: {'loss': 'coxph', 'learning_rate': 1.034090093350124e-05, 'n_estimators': 254, 'criterion': 'absolute_error', 'min_samples_split': 8, 'min_samples_leaf': 2, 'min_weight_fraction_leaf': 0.172003510006737, 'min_impurity_decrease': 0.019947450547743883, 'max_features': 0.9283819966863757, 'subsample': 0.369312021063405, 'dropout_rate': 0.4877660883177081, 'ccp_alpha': 0.008543739371750417}. Best is trial 285 with value: 0.8408994882022112.[0m
[32m[I 2022-05-13 10:29:48,241][0m Trial 377 finished with value: 0.5 and parameters: {'loss': 'coxph', 'learning_rate': 8.381346826800959e-06, 'n_estimators': 233, 'criterion': 'friedman_mse', 'min_samples_split': 8, 'min_samples_leaf': 3, 'min_weight_fraction_leaf': 0.17105798918163367, 'min_impurity_decrease': 0.022384912365243034, 'max_features': 0.9204159044207302, 'subsample': 0.38513382248784445, 'dropout_rate': 0.42311412728905695, 'ccp_alpha': 0.38186927522859104}. Best is trial 285 with value: 0.8408994882022112.[0m
[32m[I 2022-05-13 10:39:35,508][0m Trial 378 finished with value: 0.7627964012570088 and parameters: {'loss': 'coxph', 'learning_rate': 1.0072089080437855e-05, 'n_estimators': 286, 'criterion': 'friedman_mse', 'min_samples_split': 8, 'min_samples_leaf': 2, 'min_weight_fraction_leaf': 0.1555417974149937, 'min_impurity_decrease': 0.016146467718510443, 'max_features': 0.8820838857886544, 'subsample': 0.4211980146221817, 'dropout_rate': 0.7886964103801839, 'ccp_alpha': 0.1688288220118403}. Best is trial 285 with value: 0.8408994882022112.[0m
[32m[I 2022-05-13 10:52:54,920][0m Trial 379 finished with value: 0.8196938389869933 and parameters: {'loss': 'coxph', 'learning_rate': 1.7785339547340836e-05, 'n_estimators': 282, 'criterion': 'absolute_error', 'min_samples_split': 8, 'min_samples_leaf': 2, 'min_weight_fraction_leaf': 0.17604086855809967, 'min_impurity_decrease': 0.014324667619737198, 'max_features': 0.8135988920749715, 'subsample': 0.3214338686059652, 'dropout_rate': 0.46496325683419015, 'ccp_alpha': 0.00581957097873941}. Best is trial 285 with value: 0.8408994882022112.[0m
[32m[I 2022-05-13 11:03:29,427][0m Trial 380 finished with value: 0.7685550092751261 and parameters: {'loss': 'coxph', 'learning_rate': 1.8513309826710312e-05, 'n_estimators': 278, 'criterion': 'friedman_mse', 'min_samples_split': 8, 'min_samples_leaf': 2, 'min_weight_fraction_leaf': 0.18651576194199154, 'min_impurity_decrease': 0.0021694657212527743, 'max_features': 0.844466595794905, 'subsample': 0.31813698041729205, 'dropout_rate': 0.522130654600286, 'ccp_alpha': 0.0944301771421359}. Best is trial 285 with value: 0.8408994882022112.[0m
[32m[I 2022-05-13 11:15:06,160][0m Trial 381 finished with value: 0.5 and parameters: {'loss': 'coxph', 'learning_rate': 1.581035435284259e-05, 'n_estimators': 249, 'criterion': 'absolute_error', 'min_samples_split': 5, 'min_samples_leaf': 2, 'min_weight_fraction_leaf': 0.17882929963520444, 'min_impurity_decrease': 0.05795899459532662, 'max_features': 0.8322697053926296, 'subsample': 0.3451006094811042, 'dropout_rate': 0.40177948375981903, 'ccp_alpha': 0.26964876012413336}. Best is trial 285 with value: 0.8408994882022112.[0m
[32m[I 2022-05-13 11:27:01,734][0m Trial 382 finished with value: 0.763433642758646 and parameters: {'loss': 'coxph', 'learning_rate': 2.102156160312578e-05, 'n_estimators': 309, 'criterion': 'friedman_mse', 'min_samples_split': 8, 'min_samples_leaf': 2, 'min_weight_fraction_leaf': 0.16358394088996467, 'min_impurity_decrease': 0.032920821608998174, 'max_features': 0.8801026786769364, 'subsample': 0.32176980264907745, 'dropout_rate': 0.4280467123186818, 'ccp_alpha': 0.0964034820529919}. Best is trial 285 with value: 0.8408994882022112.[0m
[32m[I 2022-05-13 11:39:59,023][0m Trial 383 finished with value: 0.8075337772649117 and parameters: {'loss': 'coxph', 'learning_rate': 1.4272647445736038e-05, 'n_estimators': 284, 'criterion': 'absolute_error', 'min_samples_split': 8, 'min_samples_leaf': 3, 'min_weight_fraction_leaf': 0.18595207054120236, 'min_impurity_decrease': 0.07047223615583208, 'max_features': 0.8016775345969868, 'subsample': 0.30711209012647656, 'dropout_rate': 0.4714739224131634, 'ccp_alpha': 0.0022061236501913625}. Best is trial 285 with value: 0.8408994882022112.[0m
[32m[I 2022-05-13 11:51:31,997][0m Trial 384 finished with value: 0.7624365332643467 and parameters: {'loss': 'coxph', 'learning_rate': 1.7709256094903756e-05, 'n_estimators': 263, 'criterion': 'friedman_mse', 'min_samples_split': 8, 'min_samples_leaf': 2, 'min_weight_fraction_leaf': 0.17305539454151164, 'min_impurity_decrease': 0.01869768835366337, 'max_features': 0.8119536582657385, 'subsample': 0.14225841159555677, 'dropout_rate': 0.822978553590627, 'ccp_alpha': 0.1885660475515052}. Best is trial 285 with value: 0.8408994882022112.[0m
[32m[I 2022-05-13 12:03:12,086][0m Trial 385 finished with value: 0.7627952178620966 and parameters: {'loss': 'coxph', 'learning_rate': 0.0011296189972018421, 'n_estimators': 250, 'criterion': 'absolute_error', 'min_samples_split': 8, 'min_samples_leaf': 2, 'min_weight_fraction_leaf': 0.1880917609588597, 'min_impurity_decrease': 0.1085818278113187, 'max_features': 0.8653951956388883, 'subsample': 0.34713106393873094, 'dropout_rate': 0.3742901178496405, 'ccp_alpha': 0.10026453450189955}. Best is trial 285 with value: 0.8408994882022112.[0m
[32m[I 2022-05-13 12:13:30,428][0m Trial 386 finished with value: 0.8196831118160075 and parameters: {'loss': 'coxph', 'learning_rate': 1.3910462503525728e-05, 'n_estimators': 295, 'criterion': 'friedman_mse', 'min_samples_split': 8, 'min_samples_leaf': 2, 'min_weight_fraction_leaf': 0.19938942051181252, 'min_impurity_decrease': 0.0473755471280113, 'max_features': 0.900637862032845, 'subsample': 0.40040498830560833, 'dropout_rate': 0.7651324216113226, 'ccp_alpha': 0.0015814401113337234}. Best is trial 285 with value: 0.8408994882022112.[0m
[32m[I 2022-05-13 12:25:08,902][0m Trial 387 finished with value: 0.8227662175444334 and parameters: {'loss': 'coxph', 'learning_rate': 1.9882616301127405e-05, 'n_estimators': 317, 'criterion': 'friedman_mse', 'min_samples_split': 8, 'min_samples_leaf': 2, 'min_weight_fraction_leaf': 0.17939337165439048, 'min_impurity_decrease': 0.03526377484143871, 'max_features': 0.8527580659122268, 'subsample': 0.3997725295739173, 'dropout_rate': 0.4472558716618086, 'ccp_alpha': 0.003666723150583096}. Best is trial 285 with value: 0.8408994882022112.[0m
[32m[I 2022-05-13 12:36:00,225][0m Trial 388 finished with value: 0.7904474733440469 and parameters: {'loss': 'coxph', 'learning_rate': 2.081532355231555e-05, 'n_estimators': 301, 'criterion': 'squared_error', 'min_samples_split': 8, 'min_samples_leaf': 2, 'min_weight_fraction_leaf': 0.1456418709330281, 'min_impurity_decrease': 0.04821304495126228, 'max_features': 0.8339424527447988, 'subsample': 0.40463495364088775, 'dropout_rate': 0.4453618671689077, 'ccp_alpha': 0.0023466418486073554}. Best is trial 285 with value: 0.8408994882022112.[0m
[32m[I 2022-05-13 12:46:21,710][0m Trial 389 finished with value: 0.7393764757476943 and parameters: {'loss': 'coxph', 'learning_rate': 1.3566850263723124e-05, 'n_estimators': 292, 'criterion': 'friedman_mse', 'min_samples_split': 8, 'min_samples_leaf': 2, 'min_weight_fraction_leaf': 0.15527627666652893, 'min_impurity_decrease': 0.03665758802117269, 'max_features': 0.8564450737019079, 'subsample': 0.4217264335925499, 'dropout_rate': 0.47751527676059774, 'ccp_alpha': 0.2700264871046335}. Best is trial 285 with value: 0.8408994882022112.[0m
[32m[I 2022-05-13 13:00:09,802][0m Trial 390 finished with value: 0.7392245350698075 and parameters: {'loss': 'coxph', 'learning_rate': 1.7209660818156486e-05, 'n_estimators': 283, 'criterion': 'absolute_error', 'min_samples_split': 8, 'min_samples_leaf': 3, 'min_weight_fraction_leaf': 0.17759784007575163, 'min_impurity_decrease': 0.05186864264363958, 'max_features': 0.8187492213778905, 'subsample': 0.3978766207316659, 'dropout_rate': 0.4650342484025383, 'ccp_alpha': 0.17089168711543232}. Best is trial 285 with value: 0.8408994882022112.[0m
[32m[I 2022-05-13 13:10:56,952][0m Trial 391 finished with value: 0.7637946913564442 and parameters: {'loss': 'coxph', 'learning_rate': 2.0481794570329792e-05, 'n_estimators': 276, 'criterion': 'friedman_mse', 'min_samples_split': 8, 'min_samples_leaf': 2, 'min_weight_fraction_leaf': 0.16369938852494242, 'min_impurity_decrease': 0.028516695196448633, 'max_features': 0.852937228894975, 'subsample': 0.296028671494014, 'dropout_rate': 0.4417947452218766, 'ccp_alpha': 0.09188628070958652}. Best is trial 285 with value: 0.8408994882022112.[0m
/media/san2_ssd/data/Workdir/survival/venv/lib/python3.8/site-packages/sksurv/ensemble/boosting.py:955: RuntimeWarning: divide by zero encountered in log
  time = numpy.log(time)
/media/san2_ssd/data/Workdir/survival/venv/lib/python3.8/site-packages/sksurv/ensemble/boosting.py:955: RuntimeWarning: divide by zero encountered in log
  time = numpy.log(time)
/media/san2_ssd/data/Workdir/survival/venv/lib/python3.8/site-packages/sksurv/ensemble/boosting.py:955: RuntimeWarning: divide by zero encountered in log
  time = numpy.log(time)
/media/san2_ssd/data/Workdir/survival/venv/lib/python3.8/site-packages/sksurv/ensemble/boosting.py:955: RuntimeWarning: divide by zero encountered in log
  time = numpy.log(time)
/media/san2_ssd/data/Workdir/survival/venv/lib/python3.8/site-packages/sksurv/ensemble/boosting.py:955: RuntimeWarning: divide by zero encountered in log
  time = numpy.log(time)
[32m[I 2022-05-13 13:10:57,013][0m Trial 392 finished with value: -1.0 and parameters: {'loss': 'squared', 'learning_rate': 1.3075825059051227e-05, 'n_estimators': 297, 'criterion': 'absolute_error', 'min_samples_split': 8, 'min_samples_leaf': 2, 'min_weight_fraction_leaf': 0.19615106873828955, 'min_impurity_decrease': 0.001023331408337269, 'max_features': 0.8722382496880546, 'subsample': 0.3312249821741883, 'dropout_rate': 0.7531220281877714, 'ccp_alpha': 0.20069931784862427}. Best is trial 285 with value: 0.8408994882022112.[0m
[32m[I 2022-05-13 13:22:54,582][0m Trial 393 finished with value: 0.7678424649856999 and parameters: {'loss': 'coxph', 'learning_rate': 1.599202719070985e-05, 'n_estimators': 326, 'criterion': 'friedman_mse', 'min_samples_split': 8, 'min_samples_leaf': 2, 'min_weight_fraction_leaf': 0.21902796788333506, 'min_impurity_decrease': 0.06605898121618213, 'max_features': 0.8916070648156056, 'subsample': 0.38344711101848644, 'dropout_rate': 0.4571928786025681, 'ccp_alpha': 0.11343226679257523}. Best is trial 285 with value: 0.8408994882022112.[0m
[32m[I 2022-05-13 13:35:16,281][0m Trial 394 finished with value: 0.5 and parameters: {'loss': 'coxph', 'learning_rate': 5.828115284752003e-06, 'n_estimators': 270, 'criterion': 'absolute_error', 'min_samples_split': 8, 'min_samples_leaf': 2, 'min_weight_fraction_leaf': 0.17681040136170598, 'min_impurity_decrease': 0.03379703986451383, 'max_features': 0.8977935979870061, 'subsample': 0.17282753418208746, 'dropout_rate': 0.7687496346621729, 'ccp_alpha': 0.3623916826661564}. Best is trial 285 with value: 0.8408994882022112.[0m
[32m[I 2022-05-13 13:51:32,010][0m Trial 395 finished with value: 0.8247968508705643 and parameters: {'loss': 'coxph', 'learning_rate': 1.1382885646070669e-05, 'n_estimators': 332, 'criterion': 'friedman_mse', 'min_samples_split': 8, 'min_samples_leaf': 2, 'min_weight_fraction_leaf': 0.19910654801400807, 'min_impurity_decrease': 0.0012940260185780258, 'max_features': 0.8701469974967475, 'subsample': 0.061762090049741425, 'dropout_rate': 0.7434672102487948, 'ccp_alpha': 0.0032862774653227332}. Best is trial 285 with value: 0.8408994882022112.[0m
