[32m[I 2022-04-21 12:54:30,182][0m Trial 497 finished with value: 0.9057555097905186 and parameters: {'splitter': 'random', 'min_samples_split': 0.07306845162244874, 'min_samples_leaf': 0.002266881730815293, 'min_weight_fraction_leaf': 0.008594926351694463, 'max_features': 0.5922800548048602}. Best is trial 253 with value: 0.9108382257790575.[0m
[32m[I 2022-04-21 12:54:32,096][0m Trial 498 finished with value: 0.8801663204029481 and parameters: {'splitter': 'random', 'min_samples_split': 0.0010503497418875574, 'min_samples_leaf': 0.02318983318193004, 'min_weight_fraction_leaf': 0.1190459657433145, 'max_features': 0.9413239513524481}. Best is trial 253 with value: 0.9108382257790575.[0m
[32m[I 2022-04-21 12:54:34,350][0m Trial 499 finished with value: 0.9016784527837866 and parameters: {'splitter': 'random', 'min_samples_split': 0.04449286371115682, 'min_samples_leaf': 0.04063181797792981, 'min_weight_fraction_leaf': 0.021044318871280658, 'max_features': 0.9604184317523894}. Best is trial 253 with value: 0.9108382257790575.[0m
[32m[I 2022-04-21 12:54:35,390][0m Trial 500 finished with value: 0.9017520051580299 and parameters: {'splitter': 'random', 'min_samples_split': 0.06302972704497542, 'min_samples_leaf': 0.06296885417883785, 'min_weight_fraction_leaf': 0.035032972641129756, 'max_features': 0.8741809746308071}. Best is trial 253 with value: 0.9108382257790575.[0m
[32m[I 2022-04-21 12:54:37,682][0m Trial 501 finished with value: 0.8923208234584432 and parameters: {'splitter': 'random', 'min_samples_split': 0.07964288663729059, 'min_samples_leaf': 0.031257263066542036, 'min_weight_fraction_leaf': 0.04786227408849305, 'max_features': 0.7933795222830435}. Best is trial 253 with value: 0.9108382257790575.[0m
[32m[I 2022-04-21 12:54:40,427][0m Trial 502 finished with value: 0.9073429131516875 and parameters: {'splitter': 'random', 'min_samples_split': 0.015418282090236823, 'min_samples_leaf': 0.015833933756310065, 'min_weight_fraction_leaf': 0.024519708794349414, 'max_features': 0.9988205217467849}. Best is trial 253 with value: 0.9108382257790575.[0m
/media/san2_ssd/data/Workdir/survival/utils.py:305: RuntimeWarning: invalid value encountered in true_divide
  pdfs = np.gradient(1-survs,axis=1)/norms
[32m[I 2022-04-21 12:54:42,262][0m Trial 503 finished with value: 0.8991672371996765 and parameters: {'splitter': 'random', 'min_samples_split': 0.010693292638564807, 'min_samples_leaf': 0.013590918786820677, 'min_weight_fraction_leaf': 0.0018129594616089796, 'max_features': 0.9902661310671887}. Best is trial 253 with value: 0.9108382257790575.[0m
[32m[I 2022-04-21 12:54:44,366][0m Trial 504 finished with value: 0.8985841656498701 and parameters: {'splitter': 'random', 'min_samples_split': 0.021233163174551033, 'min_samples_leaf': 0.008887015784165744, 'min_weight_fraction_leaf': 0.017326192742972035, 'max_features': 0.9935089572883324}. Best is trial 253 with value: 0.9108382257790575.[0m
[32m[I 2022-04-21 12:54:47,040][0m Trial 505 finished with value: 0.9079955880755051 and parameters: {'splitter': 'random', 'min_samples_split': 0.010364486265310448, 'min_samples_leaf': 0.01887942603650147, 'min_weight_fraction_leaf': 0.02397338122422741, 'max_features': 0.999569251715766}. Best is trial 253 with value: 0.9108382257790575.[0m
[32m[I 2022-04-21 12:54:48,840][0m Trial 506 finished with value: 0.9003350890988617 and parameters: {'splitter': 'random', 'min_samples_split': 0.009741255271806176, 'min_samples_leaf': 0.020621449032774783, 'min_weight_fraction_leaf': 0.02643033871900891, 'max_features': 0.9924235777316042}. Best is trial 253 with value: 0.9108382257790575.[0m
[32m[I 2022-04-21 12:54:50,535][0m Trial 507 finished with value: 0.3246287772912735 and parameters: {'splitter': 'random', 'min_samples_split': 0.008071244827719015, 'min_samples_leaf': 0.022958769093628265, 'min_weight_fraction_leaf': 0.4780883016233607, 'max_features': 0.9887580096955891}. Best is trial 253 with value: 0.9108382257790575.[0m
[32m[I 2022-04-21 12:54:51,945][0m Trial 508 finished with value: 0.3425804518366971 and parameters: {'splitter': 'random', 'min_samples_split': 0.003235503526714624, 'min_samples_leaf': 0.0012502310068984307, 'min_weight_fraction_leaf': 0.4229223249261541, 'max_features': 0.9972025399293483}. Best is trial 253 with value: 0.9108382257790575.[0m
[32m[I 2022-04-21 12:54:53,453][0m Trial 509 finished with value: 0.3425804518366971 and parameters: {'splitter': 'random', 'min_samples_split': 0.017221923102570848, 'min_samples_leaf': 0.27025286186743575, 'min_weight_fraction_leaf': 0.03246456683723628, 'max_features': 0.9979244355336017}. Best is trial 253 with value: 0.9108382257790575.[0m
[32m[I 2022-04-21 12:54:55,887][0m Trial 510 finished with value: 0.9032644345536663 and parameters: {'splitter': 'random', 'min_samples_split': 0.01591467245903774, 'min_samples_leaf': 0.029045626424326967, 'min_weight_fraction_leaf': 0.02543668511605332, 'max_features': 0.972322016732424}. Best is trial 253 with value: 0.9108382257790575.[0m
[32m[I 2022-04-21 12:54:57,225][0m Trial 511 finished with value: 0.8797245818194697 and parameters: {'splitter': 'random', 'min_samples_split': 0.020380133057410273, 'min_samples_leaf': 0.21847818544633574, 'min_weight_fraction_leaf': 0.03752505278596441, 'max_features': 0.9667571376844526}. Best is trial 253 with value: 0.9108382257790575.[0m
[32m[I 2022-04-21 12:58:04,791][0m Trial 512 finished with value: 0.7747012063135165 and parameters: {'splitter': 'best', 'min_samples_split': 0.00879872724983871, 'min_samples_leaf': 0.019111337463089413, 'min_weight_fraction_leaf': 0.021007202751322243, 'max_features': 0.9801597589783281}. Best is trial 253 with value: 0.9108382257790575.[0m
[32m[I 2022-04-21 12:58:07,041][0m Trial 513 finished with value: 0.9037254641212424 and parameters: {'splitter': 'random', 'min_samples_split': 0.0013860112502463995, 'min_samples_leaf': 0.03537399502782676, 'min_weight_fraction_leaf': 0.033847415853093796, 'max_features': 0.9795014614966471}. Best is trial 253 with value: 0.9108382257790575.[0m
[32m[I 2022-04-21 12:58:08,188][0m Trial 514 finished with value: 0.3425804518366971 and parameters: {'splitter': 'random', 'min_samples_split': 0.027645271286240683, 'min_samples_leaf': 0.04536965780166191, 'min_weight_fraction_leaf': 0.3808143904204887, 'max_features': 0.9666971543770694}. Best is trial 253 with value: 0.9108382257790575.[0m
[32m[I 2022-04-21 12:58:09,937][0m Trial 515 finished with value: 0.9024486231656794 and parameters: {'splitter': 'random', 'min_samples_split': 0.017485387398708332, 'min_samples_leaf': 0.016583527002370417, 'min_weight_fraction_leaf': 0.015761515869449017, 'max_features': 0.9652703858498487}. Best is trial 253 with value: 0.9108382257790575.[0m
[32m[I 2022-04-21 12:58:10,828][0m Trial 516 finished with value: 0.3425804518366971 and parameters: {'splitter': 'random', 'min_samples_split': 0.026306439263875145, 'min_samples_leaf': 0.34287276936046673, 'min_weight_fraction_leaf': 0.026438067686120868, 'max_features': 0.9557655392301954}. Best is trial 253 with value: 0.9108382257790575.[0m
[32m[I 2022-04-21 12:58:12,476][0m Trial 517 finished with value: 0.90486635054204 and parameters: {'splitter': 'random', 'min_samples_split': 0.030492466283951854, 'min_samples_leaf': 0.02760415595803823, 'min_weight_fraction_leaf': 0.03929344694186649, 'max_features': 0.9838786855423894}. Best is trial 253 with value: 0.9108382257790575.[0m
[32m[I 2022-04-21 12:58:15,711][0m Trial 518 finished with value: 0.9036823251743715 and parameters: {'splitter': 'random', 'min_samples_split': 0.016384949673520045, 'min_samples_leaf': 0.03584183117176305, 'min_weight_fraction_leaf': 0.00921368393403528, 'max_features': 0.9965178461431132}. Best is trial 253 with value: 0.9108382257790575.[0m
[32m[I 2022-04-21 12:58:18,652][0m Trial 519 finished with value: 0.9076801728756824 and parameters: {'splitter': 'random', 'min_samples_split': 0.014754875726777679, 'min_samples_leaf': 0.0011947195099909838, 'min_weight_fraction_leaf': 0.02431367702891606, 'max_features': 0.9995504467014065}. Best is trial 253 with value: 0.9108382257790575.[0m
[32m[I 2022-04-21 12:58:20,192][0m Trial 520 finished with value: 0.903459622551041 and parameters: {'splitter': 'random', 'min_samples_split': 0.0011883513875420616, 'min_samples_leaf': 0.007127563198085721, 'min_weight_fraction_leaf': 0.021843153081971458, 'max_features': 0.9995018575644111}. Best is trial 253 with value: 0.9108382257790575.[0m
/media/san2_ssd/data/Workdir/survival/utils.py:305: RuntimeWarning: invalid value encountered in true_divide
  pdfs = np.gradient(1-survs,axis=1)/norms
/media/san2_ssd/data/Workdir/survival/utils.py:305: RuntimeWarning: invalid value encountered in true_divide
  pdfs = np.gradient(1-survs,axis=1)/norms
[32m[I 2022-04-21 12:58:22,961][0m Trial 521 finished with value: 0.8968258875085668 and parameters: {'splitter': 'random', 'min_samples_split': 0.01220488213739556, 'min_samples_leaf': 0.007948445531387377, 'min_weight_fraction_leaf': 0.008336190397203156, 'max_features': 0.9793737398097336}. Best is trial 253 with value: 0.9108382257790575.[0m
[32m[I 2022-04-21 12:58:26,853][0m Trial 522 finished with value: 0.9050697398208962 and parameters: {'splitter': 'random', 'min_samples_split': 0.025836844957536194, 'min_samples_leaf': 0.0031240911798117426, 'min_weight_fraction_leaf': 0.016992760442959182, 'max_features': 0.9600246450494871}. Best is trial 253 with value: 0.9108382257790575.[0m
[32m[I 2022-04-21 12:58:29,616][0m Trial 523 finished with value: 0.9081781390681438 and parameters: {'splitter': 'random', 'min_samples_split': 0.013025386392061189, 'min_samples_leaf': 0.013523479738006616, 'min_weight_fraction_leaf': 0.028402175850089664, 'max_features': 0.9962449921534413}. Best is trial 253 with value: 0.9108382257790575.[0m
[32m[I 2022-04-21 12:58:31,256][0m Trial 524 finished with value: 0.9054189141566147 and parameters: {'splitter': 'random', 'min_samples_split': 0.012483895583750109, 'min_samples_leaf': 0.011675581581926107, 'min_weight_fraction_leaf': 0.030162237145397452, 'max_features': 0.9840015003274715}. Best is trial 253 with value: 0.9108382257790575.[0m
[32m[I 2022-04-21 12:58:32,648][0m Trial 525 finished with value: 0.9022002881643607 and parameters: {'splitter': 'random', 'min_samples_split': 0.009084932032423729, 'min_samples_leaf': 0.0017243666694215787, 'min_weight_fraction_leaf': 0.03742116131438386, 'max_features': 0.9982898009815335}. Best is trial 253 with value: 0.9108382257790575.[0m
[32m[I 2022-04-21 12:58:35,144][0m Trial 526 finished with value: 0.9074963364756723 and parameters: {'splitter': 'random', 'min_samples_split': 0.02296964188365121, 'min_samples_leaf': 0.01395043261382423, 'min_weight_fraction_leaf': 0.030762818235728642, 'max_features': 0.9785200565349798}. Best is trial 253 with value: 0.9108382257790575.[0m
[32m[I 2022-04-21 12:58:37,249][0m Trial 527 finished with value: 0.9053806696502236 and parameters: {'splitter': 'random', 'min_samples_split': 0.023967019474286935, 'min_samples_leaf': 0.0017656140572432574, 'min_weight_fraction_leaf': 0.02506196698491234, 'max_features': 0.9993507943783471}. Best is trial 253 with value: 0.9108382257790575.[0m
[32m[I 2022-04-21 12:58:38,424][0m Trial 528 finished with value: 0.8990603857230621 and parameters: {'splitter': 'random', 'min_samples_split': 0.01732605627349459, 'min_samples_leaf': 0.014345100699312174, 'min_weight_fraction_leaf': 0.03110672464338678, 'max_features': 0.9741653657002118}. Best is trial 253 with value: 0.9108382257790575.[0m
[32m[I 2022-04-21 12:58:40,366][0m Trial 529 finished with value: 0.9025813098955732 and parameters: {'splitter': 'random', 'min_samples_split': 0.0014687359053738164, 'min_samples_leaf': 0.0015045957759807615, 'min_weight_fraction_leaf': 0.02199721526064774, 'max_features': 0.9689158296016055}. Best is trial 253 with value: 0.9108382257790575.[0m
[32m[I 2022-04-21 12:58:42,298][0m Trial 530 finished with value: 0.3425804518366971 and parameters: {'splitter': 'random', 'min_samples_split': 0.020084087688675333, 'min_samples_leaf': 0.015457387155674636, 'min_weight_fraction_leaf': 0.34235525918638277, 'max_features': 0.9979170297928425}. Best is trial 253 with value: 0.9108382257790575.[0m
[32m[I 2022-04-21 12:58:44,209][0m Trial 531 finished with value: 0.9021232597725335 and parameters: {'splitter': 'random', 'min_samples_split': 0.03233956259976182, 'min_samples_leaf': 0.016809097565858792, 'min_weight_fraction_leaf': 0.03746888725757032, 'max_features': 0.9811977304487232}. Best is trial 253 with value: 0.9108382257790575.[0m
[32m[I 2022-04-21 12:58:45,561][0m Trial 532 finished with value: 0.9086552789532311 and parameters: {'splitter': 'random', 'min_samples_split': 0.010833948919482476, 'min_samples_leaf': 0.01264860278302854, 'min_weight_fraction_leaf': 0.027566446809307067, 'max_features': 0.9768926081754473}. Best is trial 253 with value: 0.9108382257790575.[0m
[32m[I 2022-04-21 13:02:24,654][0m Trial 533 finished with value: 0.8801359499387917 and parameters: {'splitter': 'best', 'min_samples_split': 0.008481945865976889, 'min_samples_leaf': 0.008934216303964248, 'min_weight_fraction_leaf': 0.04525699446695146, 'max_features': 0.9713854889209382}. Best is trial 253 with value: 0.9108382257790575.[0m
[32m[I 2022-04-21 13:02:26,492][0m Trial 534 finished with value: 0.9069452791681112 and parameters: {'splitter': 'random', 'min_samples_split': 0.024435219139862033, 'min_samples_leaf': 0.02139119417559674, 'min_weight_fraction_leaf': 0.02989194749217172, 'max_features': 0.9539351521137471}. Best is trial 253 with value: 0.9108382257790575.[0m
[32m[I 2022-04-21 13:02:28,699][0m Trial 535 finished with value: 0.8797245818194697 and parameters: {'splitter': 'random', 'min_samples_split': 0.0094280920272811, 'min_samples_leaf': 0.0013322252909718987, 'min_weight_fraction_leaf': 0.2205773505820843, 'max_features': 0.9783403412855902}. Best is trial 253 with value: 0.9108382257790575.[0m
[32m[I 2022-04-21 13:02:31,336][0m Trial 536 finished with value: 0.8949994343144546 and parameters: {'splitter': 'random', 'min_samples_split': 0.03147493351083923, 'min_samples_leaf': 0.011365061217109626, 'min_weight_fraction_leaf': 0.018943657289289265, 'max_features': 0.950273056792453}. Best is trial 253 with value: 0.9108382257790575.[0m
[32m[I 2022-04-21 13:02:33,089][0m Trial 537 finished with value: 0.8859087713520555 and parameters: {'splitter': 'random', 'min_samples_split': 0.02185362444562201, 'min_samples_leaf': 0.02245338903037617, 'min_weight_fraction_leaf': 0.13686302500473238, 'max_features': 0.972519870174944}. Best is trial 253 with value: 0.9108382257790575.[0m
/media/san2_ssd/data/Workdir/survival/utils.py:305: RuntimeWarning: invalid value encountered in true_divide
  pdfs = np.gradient(1-survs,axis=1)/norms
[32m[I 2022-04-21 13:02:34,576][0m Trial 538 finished with value: 0.7963679426848801 and parameters: {'splitter': 'random', 'min_samples_split': 0.0012410918330672902, 'min_samples_leaf': 0.01075863731224617, 'min_weight_fraction_leaf': 0.0005158887300989283, 'max_features': 0.9529698072604403}. Best is trial 253 with value: 0.9108382257790575.[0m
[32m[I 2022-04-21 13:02:35,792][0m Trial 539 finished with value: 0.9044597891653456 and parameters: {'splitter': 'random', 'min_samples_split': 0.01650174423749033, 'min_samples_leaf': 0.02189158476974642, 'min_weight_fraction_leaf': 0.04152806697888505, 'max_features': 0.9987598892508388}. Best is trial 253 with value: 0.9108382257790575.[0m
[32m[I 2022-04-21 13:02:37,796][0m Trial 540 finished with value: 0.9036389058786828 and parameters: {'splitter': 'random', 'min_samples_split': 0.034431183795164196, 'min_samples_leaf': 0.011937002103041407, 'min_weight_fraction_leaf': 0.03392827267501146, 'max_features': 0.9528826841147583}. Best is trial 253 with value: 0.9108382257790575.[0m
[32m[I 2022-04-21 13:02:39,996][0m Trial 541 finished with value: 0.9053806696502236 and parameters: {'splitter': 'random', 'min_samples_split': 0.011393542583546596, 'min_samples_leaf': 0.025053843360618694, 'min_weight_fraction_leaf': 0.017482945870774, 'max_features': 0.9770367433562367}. Best is trial 253 with value: 0.9108382257790575.[0m
[32m[I 2022-04-21 13:02:42,480][0m Trial 542 finished with value: 0.9085058249191282 and parameters: {'splitter': 'random', 'min_samples_split': 0.03448786512695595, 'min_samples_leaf': 0.0015116552234802055, 'min_weight_fraction_leaf': 0.02812916833252794, 'max_features': 0.9448602679587705}. Best is trial 253 with value: 0.9108382257790575.[0m
[32m[I 2022-04-21 13:02:44,534][0m Trial 543 finished with value: 0.8778564347217358 and parameters: {'splitter': 'random', 'min_samples_split': 0.022525765472848, 'min_samples_leaf': 0.0013379037204320626, 'min_weight_fraction_leaf': 0.04887946216473619, 'max_features': 0.13554047320540397}. Best is trial 253 with value: 0.9108382257790575.[0m
[32m[I 2022-04-21 13:02:47,972][0m Trial 544 finished with value: 0.9054940541642222 and parameters: {'splitter': 'random', 'min_samples_split': 0.03268787442930513, 'min_samples_leaf': 0.0018150843333868132, 'min_weight_fraction_leaf': 0.032133284993955936, 'max_features': 0.9617378473560454}. Best is trial 253 with value: 0.9108382257790575.[0m
[32m[I 2022-04-21 13:02:50,165][0m Trial 545 finished with value: 0.90440757994838 and parameters: {'splitter': 'random', 'min_samples_split': 0.025414551627946334, 'min_samples_leaf': 0.01851776415741454, 'min_weight_fraction_leaf': 0.040929783886290906, 'max_features': 0.9777615248065176}. Best is trial 253 with value: 0.9108382257790575.[0m
[32m[I 2022-04-21 13:02:52,729][0m Trial 546 finished with value: 0.9071155437188093 and parameters: {'splitter': 'random', 'min_samples_split': 0.036007056223170596, 'min_samples_leaf': 0.026098298657270588, 'min_weight_fraction_leaf': 0.013680985348841726, 'max_features': 0.9496104137771102}. Best is trial 253 with value: 0.9108382257790575.[0m
[32m[I 2022-04-21 13:02:54,494][0m Trial 547 finished with value: 0.9051447768960648 and parameters: {'splitter': 'random', 'min_samples_split': 0.012984443737364397, 'min_samples_leaf': 0.014757774832166741, 'min_weight_fraction_leaf': 0.02686809011622434, 'max_features': 0.9419331466728925}. Best is trial 253 with value: 0.9108382257790575.[0m
[32m[I 2022-04-21 13:02:55,740][0m Trial 548 finished with value: 0.9027346550299014 and parameters: {'splitter': 'random', 'min_samples_split': 0.02267401704892739, 'min_samples_leaf': 0.009317554242166407, 'min_weight_fraction_leaf': 0.048924159293762634, 'max_features': 0.9748574604888655}. Best is trial 253 with value: 0.9108382257790575.[0m
[32m[I 2022-04-21 13:02:57,386][0m Trial 549 finished with value: 0.9071278044644435 and parameters: {'splitter': 'random', 'min_samples_split': 0.03418888967139359, 'min_samples_leaf': 0.026399174950226964, 'min_weight_fraction_leaf': 0.023109461406975958, 'max_features': 0.9388624938589863}. Best is trial 253 with value: 0.9108382257790575.[0m
[32m[I 2022-04-21 13:02:59,290][0m Trial 550 finished with value: 0.9022658911914675 and parameters: {'splitter': 'random', 'min_samples_split': 0.0013704621731250345, 'min_samples_leaf': 0.0011259355860721333, 'min_weight_fraction_leaf': 0.036828401555701495, 'max_features': 0.9633702262215564}. Best is trial 253 with value: 0.9108382257790575.[0m
[32m[I 2022-04-21 13:03:00,812][0m Trial 551 finished with value: 0.9040620115741772 and parameters: {'splitter': 'random', 'min_samples_split': 0.01378978086951913, 'min_samples_leaf': 0.01720076752445925, 'min_weight_fraction_leaf': 0.00832474847724198, 'max_features': 0.9987784043409654}. Best is trial 253 with value: 0.9108382257790575.[0m
[32m[I 2022-04-21 13:03:01,512][0m Trial 552 finished with value: 0.26841203089413485 and parameters: {'splitter': 'random', 'min_samples_split': 0.037322320635726006, 'min_samples_leaf': 0.4845998348505469, 'min_weight_fraction_leaf': 0.028429720372697444, 'max_features': 0.9461284972404196}. Best is trial 253 with value: 0.9108382257790575.[0m
[32m[I 2022-04-21 13:03:03,224][0m Trial 553 finished with value: 0.9081781390681438 and parameters: {'splitter': 'random', 'min_samples_split': 0.025961214489549998, 'min_samples_leaf': 0.02834301853692328, 'min_weight_fraction_leaf': 0.01641059877910829, 'max_features': 0.9786754574963795}. Best is trial 253 with value: 0.9108382257790575.[0m
[32m[I 2022-04-21 13:05:51,318][0m Trial 554 finished with value: 0.8850372306384686 and parameters: {'splitter': 'best', 'min_samples_split': 0.03110950284079178, 'min_samples_leaf': 0.031100240399672754, 'min_weight_fraction_leaf': 0.01002947205206028, 'max_features': 0.9366681856574524}. Best is trial 253 with value: 0.9108382257790575.[0m
[32m[I 2022-04-21 13:05:52,951][0m Trial 555 finished with value: 0.9032712183227896 and parameters: {'splitter': 'random', 'min_samples_split': 0.008954671948892143, 'min_samples_leaf': 0.030567833645530937, 'min_weight_fraction_leaf': 0.00045649360806316805, 'max_features': 0.959856183217531}. Best is trial 253 with value: 0.9108382257790575.[0m
[32m[I 2022-04-21 13:05:54,173][0m Trial 556 finished with value: 0.9075831418152458 and parameters: {'splitter': 'random', 'min_samples_split': 0.03758297984416837, 'min_samples_leaf': 0.02409926765058671, 'min_weight_fraction_leaf': 0.016706305003210877, 'max_features': 0.9353367229948083}. Best is trial 253 with value: 0.9108382257790575.[0m
[32m[I 2022-04-21 13:05:55,804][0m Trial 557 finished with value: 0.9059483789402029 and parameters: {'splitter': 'random', 'min_samples_split': 0.01933125300681359, 'min_samples_leaf': 0.03292366767473847, 'min_weight_fraction_leaf': 0.017347881673033673, 'max_features': 0.9660441251836137}. Best is trial 253 with value: 0.9108382257790575.[0m
