[32m[I 2022-05-19 18:47:35,355][0m Trial 952 finished with value: 0.762402764521118 and parameters: {'loss': 'coxph', 'learning_rate': 0.06399303859078102, 'n_estimators': 185, 'criterion': 'friedman_mse', 'min_samples_split': 3, 'min_samples_leaf': 3, 'min_weight_fraction_leaf': 0.001999966663126601, 'min_impurity_decrease': 0.46929608334605116, 'max_features': 0.6480051890344232, 'subsample': 0.24337601560670014, 'dropout_rate': 0.05245229312073972, 'ccp_alpha': 0.15608389786743604}. Best is trial 899 with value: 0.8627512492330924.[0m
[32m[I 2022-05-19 18:54:39,701][0m Trial 953 finished with value: 0.7947564093689037 and parameters: {'loss': 'coxph', 'learning_rate': 0.05579662745189555, 'n_estimators': 173, 'criterion': 'friedman_mse', 'min_samples_split': 3, 'min_samples_leaf': 3, 'min_weight_fraction_leaf': 0.011887786673675176, 'min_impurity_decrease': 0.46059100625317967, 'max_features': 0.6002549439168302, 'subsample': 0.19683388468757845, 'dropout_rate': 0.03605471652779998, 'ccp_alpha': 0.0895152465292851}. Best is trial 899 with value: 0.8627512492330924.[0m
[32m[I 2022-05-19 19:01:06,377][0m Trial 954 finished with value: 0.7580007272224702 and parameters: {'loss': 'coxph', 'learning_rate': 0.07608380525697223, 'n_estimators': 160, 'criterion': 'friedman_mse', 'min_samples_split': 3, 'min_samples_leaf': 3, 'min_weight_fraction_leaf': 0.001021063412850973, 'min_impurity_decrease': 0.4329735546013934, 'max_features': 0.6193931430161208, 'subsample': 0.2040440695437006, 'dropout_rate': 0.0717458094498368, 'ccp_alpha': 0.22705143209055703}. Best is trial 899 with value: 0.8627512492330924.[0m
[32m[I 2022-05-19 19:08:41,058][0m Trial 955 finished with value: 0.7945112994583916 and parameters: {'loss': 'coxph', 'learning_rate': 0.07104342239569694, 'n_estimators': 191, 'criterion': 'friedman_mse', 'min_samples_split': 3, 'min_samples_leaf': 3, 'min_weight_fraction_leaf': 0.011686342109305336, 'min_impurity_decrease': 0.4923055158028623, 'max_features': 0.5955594515720708, 'subsample': 0.23251642733557165, 'dropout_rate': 0.038394845914231014, 'ccp_alpha': 0.09807195645610274}. Best is trial 899 with value: 0.8627512492330924.[0m
[32m[I 2022-05-19 19:15:44,311][0m Trial 956 finished with value: 0.5 and parameters: {'loss': 'coxph', 'learning_rate': 0.09975899877307667, 'n_estimators': 178, 'criterion': 'friedman_mse', 'min_samples_split': 3, 'min_samples_leaf': 3, 'min_weight_fraction_leaf': 0.2801106661298118, 'min_impurity_decrease': 0.4717447595338635, 'max_features': 0.637857761887327, 'subsample': 0.21599157658313167, 'dropout_rate': 0.09070234263740647, 'ccp_alpha': 1.9428290291040577}. Best is trial 899 with value: 0.8627512492330924.[0m
[32m[I 2022-05-19 19:22:46,735][0m Trial 957 finished with value: 0.690078467987217 and parameters: {'loss': 'coxph', 'learning_rate': 0.054609013233738325, 'n_estimators': 170, 'criterion': 'friedman_mse', 'min_samples_split': 3, 'min_samples_leaf': 3, 'min_weight_fraction_leaf': 0.011924178909799502, 'min_impurity_decrease': 0.5113992143220748, 'max_features': 0.6587188637654695, 'subsample': 0.17739727301725228, 'dropout_rate': 0.036058626712691805, 'ccp_alpha': 0.36270822019894655}. Best is trial 899 with value: 0.8627512492330924.[0m
[32m[I 2022-05-19 19:29:22,653][0m Trial 958 finished with value: 0.7626248223241119 and parameters: {'loss': 'coxph', 'learning_rate': 0.07626279721689445, 'n_estimators': 162, 'criterion': 'friedman_mse', 'min_samples_split': 3, 'min_samples_leaf': 3, 'min_weight_fraction_leaf': 0.013013583141006538, 'min_impurity_decrease': 0.4594260316962996, 'max_features': 0.6172015516263762, 'subsample': 0.19479352033598732, 'dropout_rate': 0.05993363263351302, 'ccp_alpha': 0.15841991537660668}. Best is trial 899 with value: 0.8627512492330924.[0m
[32m[I 2022-05-19 19:36:50,858][0m Trial 959 finished with value: 0.8573457241114031 and parameters: {'loss': 'coxph', 'learning_rate': 0.05293890672636246, 'n_estimators': 178, 'criterion': 'friedman_mse', 'min_samples_split': 3, 'min_samples_leaf': 3, 'min_weight_fraction_leaf': 0.018179203122891147, 'min_impurity_decrease': 0.44782163845828016, 'max_features': 0.5925604491168877, 'subsample': 0.18581868551115954, 'dropout_rate': 0.03687534466264437, 'ccp_alpha': 0.0037046838024954046}. Best is trial 899 with value: 0.8627512492330924.[0m
[32m[I 2022-05-19 19:45:05,205][0m Trial 960 finished with value: 0.7627997880333296 and parameters: {'loss': 'coxph', 'learning_rate': 0.05064779633452234, 'n_estimators': 198, 'criterion': 'friedman_mse', 'min_samples_split': 3, 'min_samples_leaf': 3, 'min_weight_fraction_leaf': 0.009885779778285413, 'min_impurity_decrease': 0.4865931659249372, 'max_features': 0.5900268282769613, 'subsample': 0.18381818122849036, 'dropout_rate': 0.032339201033392266, 'ccp_alpha': 0.21929695113242792}. Best is trial 899 with value: 0.8627512492330924.[0m
[32m[I 2022-05-19 19:52:57,524][0m Trial 961 finished with value: 0.7977896941741957 and parameters: {'loss': 'coxph', 'learning_rate': 0.05053330470749528, 'n_estimators': 189, 'criterion': 'friedman_mse', 'min_samples_split': 3, 'min_samples_leaf': 3, 'min_weight_fraction_leaf': 0.018185188904566846, 'min_impurity_decrease': 0.42132239039529096, 'max_features': 0.5994368193591904, 'subsample': 0.18311332309225642, 'dropout_rate': 0.03236792797219977, 'ccp_alpha': 0.09232768902229654}. Best is trial 899 with value: 0.8627512492330924.[0m
[32m[I 2022-05-19 20:00:25,721][0m Trial 962 finished with value: 0.8574511205699386 and parameters: {'loss': 'coxph', 'learning_rate': 0.07667979369287967, 'n_estimators': 176, 'criterion': 'friedman_mse', 'min_samples_split': 3, 'min_samples_leaf': 3, 'min_weight_fraction_leaf': 0.0022715748584230325, 'min_impurity_decrease': 0.5362843305225656, 'max_features': 0.5830660655489157, 'subsample': 0.17319731679364972, 'dropout_rate': 0.04423440950341968, 'ccp_alpha': 0.0014725580939674984}. Best is trial 899 with value: 0.8627512492330924.[0m
[32m[I 2022-05-19 20:07:34,819][0m Trial 963 finished with value: 0.7632807949942191 and parameters: {'loss': 'coxph', 'learning_rate': 0.08114336061460461, 'n_estimators': 178, 'criterion': 'friedman_mse', 'min_samples_split': 3, 'min_samples_leaf': 3, 'min_weight_fraction_leaf': 0.0014738782772071616, 'min_impurity_decrease': 0.5296774521320113, 'max_features': 0.5837464602767434, 'subsample': 0.21357086437595058, 'dropout_rate': 0.05476980395466973, 'ccp_alpha': 0.16982598737447338}. Best is trial 899 with value: 0.8627512492330924.[0m
/media/san2_ssd/data/Workdir/survival/venv/lib/python3.8/site-packages/sksurv/ensemble/boosting.py:955: RuntimeWarning: divide by zero encountered in log
  time = numpy.log(time)
/media/san2_ssd/data/Workdir/survival/venv/lib/python3.8/site-packages/sksurv/ensemble/boosting.py:955: RuntimeWarning: divide by zero encountered in log
  time = numpy.log(time)
/media/san2_ssd/data/Workdir/survival/venv/lib/python3.8/site-packages/sksurv/ensemble/boosting.py:955: RuntimeWarning: divide by zero encountered in log
  time = numpy.log(time)
/media/san2_ssd/data/Workdir/survival/venv/lib/python3.8/site-packages/sksurv/ensemble/boosting.py:955: RuntimeWarning: divide by zero encountered in log
  time = numpy.log(time)
/media/san2_ssd/data/Workdir/survival/venv/lib/python3.8/site-packages/sksurv/ensemble/boosting.py:955: RuntimeWarning: divide by zero encountered in log
  time = numpy.log(time)
[32m[I 2022-05-19 20:07:34,904][0m Trial 964 finished with value: -1.0 and parameters: {'loss': 'squared', 'learning_rate': 0.06145250886096096, 'n_estimators': 177, 'criterion': 'friedman_mse', 'min_samples_split': 3, 'min_samples_leaf': 3, 'min_weight_fraction_leaf': 0.00879698510856939, 'min_impurity_decrease': 0.4497805805700047, 'max_features': 0.6082643093252598, 'subsample': 0.17889088123626434, 'dropout_rate': 0.025148902984654747, 'ccp_alpha': 3.876025834007902}. Best is trial 899 with value: 0.8627512492330924.[0m
[32m[I 2022-05-19 20:15:22,113][0m Trial 965 finished with value: 0.739410678374352 and parameters: {'loss': 'coxph', 'learning_rate': 0.04701107110886945, 'n_estimators': 185, 'criterion': 'friedman_mse', 'min_samples_split': 3, 'min_samples_leaf': 3, 'min_weight_fraction_leaf': 0.00785398594732075, 'min_impurity_decrease': 0.5231031867343919, 'max_features': 0.5860665374174878, 'subsample': 0.16621365626338408, 'dropout_rate': 0.045573940847981366, 'ccp_alpha': 0.30179117349108003}. Best is trial 899 with value: 0.8627512492330924.[0m
[32m[I 2022-05-19 20:22:22,244][0m Trial 966 finished with value: 0.5 and parameters: {'loss': 'coxph', 'learning_rate': 0.08022265474510097, 'n_estimators': 173, 'criterion': 'friedman_mse', 'min_samples_split': 3, 'min_samples_leaf': 3, 'min_weight_fraction_leaf': 0.017892206454340573, 'min_impurity_decrease': 0.45297598167362124, 'max_features': 0.6114460216534697, 'subsample': 0.19840516868949634, 'dropout_rate': 0.02457099224332577, 'ccp_alpha': 1.0419121663081135}. Best is trial 899 with value: 0.8627512492330924.[0m
[32m[I 2022-05-19 20:28:29,622][0m Trial 967 finished with value: 0.7910240011269544 and parameters: {'loss': 'coxph', 'learning_rate': 0.05429313092690094, 'n_estimators': 154, 'criterion': 'friedman_mse', 'min_samples_split': 3, 'min_samples_leaf': 3, 'min_weight_fraction_leaf': 0.0014807463271080436, 'min_impurity_decrease': 0.5439808317696667, 'max_features': 0.5971926378068322, 'subsample': 0.2172013408122359, 'dropout_rate': 0.05149537892193735, 'ccp_alpha': 0.08671504059562338}. Best is trial 899 with value: 0.8627512492330924.[0m
[32m[I 2022-05-19 20:36:09,524][0m Trial 968 finished with value: 0.5 and parameters: {'loss': 'coxph', 'learning_rate': 0.08220163593005482, 'n_estimators': 196, 'criterion': 'squared_error', 'min_samples_split': 3, 'min_samples_leaf': 3, 'min_weight_fraction_leaf': 0.015205918487608992, 'min_impurity_decrease': 0.43938214350950666, 'max_features': 0.6243014733753959, 'subsample': 0.23672750021358346, 'dropout_rate': 0.019344510875722448, 'ccp_alpha': 0.0011592508489636944}. Best is trial 899 with value: 0.8627512492330924.[0m
[32m[I 2022-05-19 20:42:59,813][0m Trial 969 finished with value: 0.7953519598455083 and parameters: {'loss': 'coxph', 'learning_rate': 0.06044297404601428, 'n_estimators': 164, 'criterion': 'friedman_mse', 'min_samples_split': 3, 'min_samples_leaf': 3, 'min_weight_fraction_leaf': 0.02804188555250988, 'min_impurity_decrease': 0.5431133985777434, 'max_features': 0.5800170403506829, 'subsample': 0.17507996634857773, 'dropout_rate': 0.01887356055140923, 'ccp_alpha': 0.0966320714458759}. Best is trial 899 with value: 0.8627512492330924.[0m
[32m[I 2022-05-19 20:50:36,574][0m Trial 970 finished with value: 0.5 and parameters: {'loss': 'coxph', 'learning_rate': 0.097442660770014, 'n_estimators': 181, 'criterion': 'friedman_mse', 'min_samples_split': 3, 'min_samples_leaf': 3, 'min_weight_fraction_leaf': 0.00240675282406546, 'min_impurity_decrease': 0.4092259785469842, 'max_features': 0.6185955599401525, 'subsample': 0.16224639735544727, 'dropout_rate': 0.043531102694000456, 'ccp_alpha': 3.5564119968465695}. Best is trial 899 with value: 0.8627512492330924.[0m
[32m[I 2022-05-19 20:56:50,406][0m Trial 971 finished with value: 0.7624956868325541 and parameters: {'loss': 'coxph', 'learning_rate': 0.045204730029696556, 'n_estimators': 157, 'criterion': 'friedman_mse', 'min_samples_split': 3, 'min_samples_leaf': 3, 'min_weight_fraction_leaf': 0.013366866903923413, 'min_impurity_decrease': 0.3935751756449707, 'max_features': 0.5952517991613573, 'subsample': 0.22043810801088082, 'dropout_rate': 0.06799229650709412, 'ccp_alpha': 0.17819314384224302}. Best is trial 899 with value: 0.8627512492330924.[0m
[32m[I 2022-05-19 21:04:12,257][0m Trial 972 finished with value: 0.7962452172006206 and parameters: {'loss': 'coxph', 'learning_rate': 0.09991795555325399, 'n_estimators': 175, 'criterion': 'friedman_mse', 'min_samples_split': 3, 'min_samples_leaf': 3, 'min_weight_fraction_leaf': 0.029186881550753677, 'min_impurity_decrease': 0.5444695226260318, 'max_features': 0.6478960095183991, 'subsample': 0.1717068586609426, 'dropout_rate': 0.02000134778202334, 'ccp_alpha': 0.08857179887991758}. Best is trial 899 with value: 0.8627512492330924.[0m
[32m[I 2022-05-19 21:10:48,163][0m Trial 973 finished with value: 0.7581766260217271 and parameters: {'loss': 'coxph', 'learning_rate': 0.06556848557111382, 'n_estimators': 163, 'criterion': 'friedman_mse', 'min_samples_split': 3, 'min_samples_leaf': 3, 'min_weight_fraction_leaf': 0.018280028191670974, 'min_impurity_decrease': 0.5103430522296726, 'max_features': 0.08199302413555326, 'subsample': 0.19453845529233965, 'dropout_rate': 0.034948705153086276, 'ccp_alpha': 0.23323261834974957}. Best is trial 899 with value: 0.8627512492330924.[0m
[32m[I 2022-05-19 21:19:01,259][0m Trial 974 finished with value: 0.8566129387888572 and parameters: {'loss': 'coxph', 'learning_rate': 0.06814896438060254, 'n_estimators': 191, 'criterion': 'friedman_mse', 'min_samples_split': 3, 'min_samples_leaf': 3, 'min_weight_fraction_leaf': 0.008715140380359107, 'min_impurity_decrease': 0.4833484568142436, 'max_features': 0.5797712559494925, 'subsample': 0.1619541024933402, 'dropout_rate': 0.08418855895907507, 'ccp_alpha': 0.003095533902310182}. Best is trial 899 with value: 0.8627512492330924.[0m
[32m[I 2022-05-19 21:25:16,634][0m Trial 975 finished with value: 0.7957093615629123 and parameters: {'loss': 'coxph', 'learning_rate': 0.07932541860199352, 'n_estimators': 152, 'criterion': 'friedman_mse', 'min_samples_split': 3, 'min_samples_leaf': 3, 'min_weight_fraction_leaf': 0.02795460430390085, 'min_impurity_decrease': 0.5366913063769091, 'max_features': 0.6257460436176113, 'subsample': 0.18312268641397358, 'dropout_rate': 0.05266170495420977, 'ccp_alpha': 0.09688203367247512}. Best is trial 899 with value: 0.8627512492330924.[0m
[32m[I 2022-05-19 21:32:26,627][0m Trial 976 finished with value: 0.5 and parameters: {'loss': 'coxph', 'learning_rate': 0.05202619835700514, 'n_estimators': 170, 'criterion': 'friedman_mse', 'min_samples_split': 3, 'min_samples_leaf': 3, 'min_weight_fraction_leaf': 0.0020731434260421837, 'min_impurity_decrease': 0.5533184840765699, 'max_features': 0.6033950795942112, 'subsample': 0.15957490948782138, 'dropout_rate': 0.015984725898449494, 'ccp_alpha': 2.1693564386734505}. Best is trial 899 with value: 0.8627512492330924.[0m
[32m[I 2022-05-19 21:41:12,891][0m Trial 977 finished with value: 0.7391548930625401 and parameters: {'loss': 'coxph', 'learning_rate': 0.04509678942728158, 'n_estimators': 207, 'criterion': 'friedman_mse', 'min_samples_split': 3, 'min_samples_leaf': 3, 'min_weight_fraction_leaf': 0.018599200550987315, 'min_impurity_decrease': 0.5280284395771881, 'max_features': 0.6575322659800685, 'subsample': 0.16610424763388543, 'dropout_rate': 0.0328667561142544, 'ccp_alpha': 0.3106257810478753}. Best is trial 899 with value: 0.8627512492330924.[0m
[32m[I 2022-05-19 21:48:01,821][0m Trial 978 finished with value: 0.7629635708459125 and parameters: {'loss': 'coxph', 'learning_rate': 0.09918976048741146, 'n_estimators': 169, 'criterion': 'friedman_mse', 'min_samples_split': 3, 'min_samples_leaf': 3, 'min_weight_fraction_leaf': 0.03292701494007748, 'min_impurity_decrease': 0.5064785580933518, 'max_features': 0.5840113687445118, 'subsample': 0.20760810108776678, 'dropout_rate': 0.049555501135476784, 'ccp_alpha': 0.1657908049531035}. Best is trial 899 with value: 0.8627512492330924.[0m
[32m[I 2022-05-19 21:55:42,753][0m Trial 979 finished with value: 0.7905809190175468 and parameters: {'loss': 'coxph', 'learning_rate': 0.06258613834809883, 'n_estimators': 184, 'criterion': 'friedman_mse', 'min_samples_split': 3, 'min_samples_leaf': 3, 'min_weight_fraction_leaf': 0.012983524362779171, 'min_impurity_decrease': 0.5600727073870573, 'max_features': 0.6365859668286729, 'subsample': 0.18215115569757417, 'dropout_rate': 0.01571853891183155, 'ccp_alpha': 0.08029883503079963}. Best is trial 899 with value: 0.8627512492330924.[0m
[32m[I 2022-05-19 22:02:21,509][0m Trial 980 finished with value: 0.5 and parameters: {'loss': 'coxph', 'learning_rate': 0.07813919993273878, 'n_estimators': 158, 'criterion': 'friedman_mse', 'min_samples_split': 3, 'min_samples_leaf': 3, 'min_weight_fraction_leaf': 0.001769637913134104, 'min_impurity_decrease': 0.5387668820574147, 'max_features': 0.6107143917232478, 'subsample': 0.15620424817820136, 'dropout_rate': 0.07202184420106625, 'ccp_alpha': 3.2420514824748197}. Best is trial 899 with value: 0.8627512492330924.[0m
[32m[I 2022-05-19 22:09:52,347][0m Trial 981 finished with value: 0.7626815175112461 and parameters: {'loss': 'coxph', 'learning_rate': 0.05800592343949553, 'n_estimators': 175, 'criterion': 'friedman_mse', 'min_samples_split': 3, 'min_samples_leaf': 3, 'min_weight_fraction_leaf': 0.023066807478907297, 'min_impurity_decrease': 0.48599891706976045, 'max_features': 0.5766895915387353, 'subsample': 0.1489249643830286, 'dropout_rate': 0.03623621228549542, 'ccp_alpha': 0.17260808880118836}. Best is trial 899 with value: 0.8627512492330924.[0m
[32m[I 2022-05-19 22:16:44,608][0m Trial 982 finished with value: 0.8571251056760353 and parameters: {'loss': 'coxph', 'learning_rate': 0.041518872037532996, 'n_estimators': 164, 'criterion': 'friedman_mse', 'min_samples_split': 3, 'min_samples_leaf': 3, 'min_weight_fraction_leaf': 0.03675547848355977, 'min_impurity_decrease': 0.5585182200582776, 'max_features': 0.6045130630166181, 'subsample': 0.18225474137276929, 'dropout_rate': 0.019087197418693247, 'ccp_alpha': 0.0022826836690665077}. Best is trial 899 with value: 0.8627512492330924.[0m
/media/san2_ssd/data/Workdir/survival/venv/lib/python3.8/site-packages/sksurv/ensemble/boosting.py:955: RuntimeWarning: divide by zero encountered in log
  time = numpy.log(time)
/media/san2_ssd/data/Workdir/survival/venv/lib/python3.8/site-packages/sksurv/ensemble/boosting.py:955: RuntimeWarning: divide by zero encountered in log
  time = numpy.log(time)
/media/san2_ssd/data/Workdir/survival/venv/lib/python3.8/site-packages/sksurv/ensemble/boosting.py:955: RuntimeWarning: divide by zero encountered in log
  time = numpy.log(time)
/media/san2_ssd/data/Workdir/survival/venv/lib/python3.8/site-packages/sksurv/ensemble/boosting.py:955: RuntimeWarning: divide by zero encountered in log
  time = numpy.log(time)
/media/san2_ssd/data/Workdir/survival/venv/lib/python3.8/site-packages/sksurv/ensemble/boosting.py:955: RuntimeWarning: divide by zero encountered in log
  time = numpy.log(time)
[32m[I 2022-05-19 22:16:44,694][0m Trial 983 finished with value: -1.0 and parameters: {'loss': 'squared', 'learning_rate': 0.040855434393524334, 'n_estimators': 151, 'criterion': 'friedman_mse', 'min_samples_split': 3, 'min_samples_leaf': 3, 'min_weight_fraction_leaf': 0.04187310426925241, 'min_impurity_decrease': 0.5171896721204541, 'max_features': 0.593766807749837, 'subsample': 0.24369688555745622, 'dropout_rate': 0.01672627906244384, 'ccp_alpha': 0.09553838301059303}. Best is trial 899 with value: 0.8627512492330924.[0m
[32m[I 2022-05-19 22:26:01,015][0m Trial 984 finished with value: 0.860307888189975 and parameters: {'loss': 'coxph', 'learning_rate': 0.043344127596855506, 'n_estimators': 222, 'criterion': 'friedman_mse', 'min_samples_split': 3, 'min_samples_leaf': 3, 'min_weight_fraction_leaf': 0.04125322025688926, 'min_impurity_decrease': 0.46652230129715355, 'max_features': 0.569239837105419, 'subsample': 0.20822876657082537, 'dropout_rate': 0.0006183342318107424, 'ccp_alpha': 0.0036340394506035505}. Best is trial 899 with value: 0.8627512492330924.[0m
[32m[I 2022-05-19 22:34:47,181][0m Trial 985 finished with value: 0.8603959536269887 and parameters: {'loss': 'coxph', 'learning_rate': 0.0991897618049684, 'n_estimators': 212, 'criterion': 'friedman_mse', 'min_samples_split': 3, 'min_samples_leaf': 3, 'min_weight_fraction_leaf': 0.05088837378185332, 'min_impurity_decrease': 0.4686534121695084, 'max_features': 0.5677341215977962, 'subsample': 0.21642743880142334, 'dropout_rate': 0.015410249896567557, 'ccp_alpha': 0.002526563389259639}. Best is trial 899 with value: 0.8627512492330924.[0m
[32m[I 2022-05-19 22:43:58,027][0m Trial 986 finished with value: 0.7397160861039792 and parameters: {'loss': 'coxph', 'learning_rate': 0.07845017735460817, 'n_estimators': 234, 'criterion': 'friedman_mse', 'min_samples_split': 3, 'min_samples_leaf': 3, 'min_weight_fraction_leaf': 0.05049050247766846, 'min_impurity_decrease': 0.4638333929469637, 'max_features': 0.5655874577734898, 'subsample': 0.2541327278219564, 'dropout_rate': 0.00020356502980624008, 'ccp_alpha': 0.27319207978564963}. Best is trial 899 with value: 0.8627512492330924.[0m
[32m[I 2022-05-19 22:52:56,267][0m Trial 987 finished with value: 0.8595961047639176 and parameters: {'loss': 'coxph', 'learning_rate': 0.08223761763374315, 'n_estimators': 214, 'criterion': 'friedman_mse', 'min_samples_split': 3, 'min_samples_leaf': 3, 'min_weight_fraction_leaf': 0.04531920479669929, 'min_impurity_decrease': 0.435774471423611, 'max_features': 0.5646615271962298, 'subsample': 0.2029072939125714, 'dropout_rate': 0.030413239536787835, 'ccp_alpha': 0.0019951977033814345}. Best is trial 899 with value: 0.8627512492330924.[0m
[32m[I 2022-05-19 23:01:48,678][0m Trial 988 finished with value: 0.7624313870496313 and parameters: {'loss': 'coxph', 'learning_rate': 0.09919944675768987, 'n_estimators': 218, 'criterion': 'friedman_mse', 'min_samples_split': 3, 'min_samples_leaf': 3, 'min_weight_fraction_leaf': 0.048621537118600004, 'min_impurity_decrease': 0.4133993843428593, 'max_features': 0.5652587870898818, 'subsample': 0.21141002416432592, 'dropout_rate': 0.018932358583557594, 'ccp_alpha': 0.16569272738885413}. Best is trial 899 with value: 0.8627512492330924.[0m
