[32m[I 2022-05-19 00:38:38,068][0m Trial 767 finished with value: 0.8065538683656583 and parameters: {'loss': 'coxph', 'learning_rate': 0.07327113650478864, 'n_estimators': 112, 'criterion': 'friedman_mse', 'min_samples_split': 3, 'min_samples_leaf': 4, 'min_weight_fraction_leaf': 0.019525990512411932, 'min_impurity_decrease': 0.5820760962474456, 'max_features': 0.5373178630520046, 'subsample': 0.12701121197787865, 'dropout_rate': 8.903361413922783e-05, 'ccp_alpha': 0.08985710669631478}. Best is trial 759 with value: 0.8618735483942033.[0m
[32m[I 2022-05-19 00:43:55,648][0m Trial 768 finished with value: 0.7636777857247867 and parameters: {'loss': 'coxph', 'learning_rate': 0.06017199762961026, 'n_estimators': 113, 'criterion': 'friedman_mse', 'min_samples_split': 3, 'min_samples_leaf': 4, 'min_weight_fraction_leaf': 0.02300220624396305, 'min_impurity_decrease': 0.597027109824171, 'max_features': 0.517712678356549, 'subsample': 0.10480917904236751, 'dropout_rate': 0.0378035099228209, 'ccp_alpha': 0.1802012454806375}. Best is trial 759 with value: 0.8618735483942033.[0m
[32m[I 2022-05-19 00:51:20,210][0m Trial 769 finished with value: 0.8001117285390338 and parameters: {'loss': 'coxph', 'learning_rate': 0.08989357413568061, 'n_estimators': 164, 'criterion': 'friedman_mse', 'min_samples_split': 3, 'min_samples_leaf': 4, 'min_weight_fraction_leaf': 0.005575307562889573, 'min_impurity_decrease': 0.6239594347199927, 'max_features': 0.5567691529645324, 'subsample': 0.14681414597350095, 'dropout_rate': 0.059617191702280414, 'ccp_alpha': 0.09646880509155886}. Best is trial 759 with value: 0.8618735483942033.[0m
[32m[I 2022-05-19 00:57:20,168][0m Trial 770 finished with value: 0.7396749560149601 and parameters: {'loss': 'coxph', 'learning_rate': 0.06387874749134455, 'n_estimators': 131, 'criterion': 'friedman_mse', 'min_samples_split': 3, 'min_samples_leaf': 4, 'min_weight_fraction_leaf': 0.02983105737444877, 'min_impurity_decrease': 0.659705640777661, 'max_features': 0.6079629705444148, 'subsample': 0.12622880364532868, 'dropout_rate': 0.02696576940787185, 'ccp_alpha': 0.3017516065372969}. Best is trial 759 with value: 0.8618735483942033.[0m
/media/san2_ssd/data/Workdir/survival/venv/lib/python3.8/site-packages/sksurv/ensemble/boosting.py:955: RuntimeWarning: divide by zero encountered in log
  time = numpy.log(time)
/media/san2_ssd/data/Workdir/survival/venv/lib/python3.8/site-packages/sksurv/ensemble/boosting.py:955: RuntimeWarning: divide by zero encountered in log
  time = numpy.log(time)
/media/san2_ssd/data/Workdir/survival/venv/lib/python3.8/site-packages/sksurv/ensemble/boosting.py:955: RuntimeWarning: divide by zero encountered in log
  time = numpy.log(time)
/media/san2_ssd/data/Workdir/survival/venv/lib/python3.8/site-packages/sksurv/ensemble/boosting.py:955: RuntimeWarning: divide by zero encountered in log
  time = numpy.log(time)
/media/san2_ssd/data/Workdir/survival/venv/lib/python3.8/site-packages/sksurv/ensemble/boosting.py:955: RuntimeWarning: divide by zero encountered in log
  time = numpy.log(time)
[32m[I 2022-05-19 00:57:20,257][0m Trial 771 finished with value: -1.0 and parameters: {'loss': 'squared', 'learning_rate': 0.03665515853366278, 'n_estimators': 108, 'criterion': 'friedman_mse', 'min_samples_split': 3, 'min_samples_leaf': 4, 'min_weight_fraction_leaf': 0.02436460022622799, 'min_impurity_decrease': 0.6759426097889076, 'max_features': 0.48452911891613, 'subsample': 0.1692798961189618, 'dropout_rate': 0.034223774120955675, 'ccp_alpha': 0.002522014939065742}. Best is trial 759 with value: 0.8618735483942033.[0m
[32m[I 2022-05-19 01:02:46,472][0m Trial 772 finished with value: 0.8553121807239739 and parameters: {'loss': 'coxph', 'learning_rate': 0.05832041303628504, 'n_estimators': 120, 'criterion': 'friedman_mse', 'min_samples_split': 3, 'min_samples_leaf': 4, 'min_weight_fraction_leaf': 0.007853909828327184, 'min_impurity_decrease': 0.6371115231847492, 'max_features': 0.5707127845230103, 'subsample': 0.14527803882260598, 'dropout_rate': 0.05902538938426704, 'ccp_alpha': 0.001697152708886313}. Best is trial 759 with value: 0.8618735483942033.[0m
[32m[I 2022-05-19 01:07:11,868][0m Trial 773 finished with value: 0.7624346253871005 and parameters: {'loss': 'coxph', 'learning_rate': 0.05795613261463935, 'n_estimators': 102, 'criterion': 'friedman_mse', 'min_samples_split': 3, 'min_samples_leaf': 4, 'min_weight_fraction_leaf': 0.007294950887024441, 'min_impurity_decrease': 0.6395138261408383, 'max_features': 0.5679338056515706, 'subsample': 0.1467043592387252, 'dropout_rate': 0.05860683826545827, 'ccp_alpha': 0.16998560340138696}. Best is trial 759 with value: 0.8618735483942033.[0m
[32m[I 2022-05-19 01:16:25,692][0m Trial 774 finished with value: 0.5 and parameters: {'loss': 'coxph', 'learning_rate': 0.0742236296263225, 'n_estimators': 209, 'criterion': 'squared_error', 'min_samples_split': 2, 'min_samples_leaf': 4, 'min_weight_fraction_leaf': 0.011652127551307286, 'min_impurity_decrease': 0.6106874784829912, 'max_features': 0.5328712907268531, 'subsample': 0.12476883341625032, 'dropout_rate': 0.018959988541532587, 'ccp_alpha': 0.0933790528247629}. Best is trial 759 with value: 0.8618735483942033.[0m
[32m[I 2022-05-19 01:21:24,910][0m Trial 775 finished with value: 0.7623919770424825 and parameters: {'loss': 'coxph', 'learning_rate': 0.05016258540909917, 'n_estimators': 118, 'criterion': 'friedman_mse', 'min_samples_split': 3, 'min_samples_leaf': 4, 'min_weight_fraction_leaf': 0.032161897923306246, 'min_impurity_decrease': 0.6534653523632115, 'max_features': 0.593439248917698, 'subsample': 0.1470952931420124, 'dropout_rate': 0.042788015394889176, 'ccp_alpha': 0.223264705719746}. Best is trial 759 with value: 0.8618735483942033.[0m
[32m[I 2022-05-19 01:25:43,522][0m Trial 776 finished with value: 0.5 and parameters: {'loss': 'coxph', 'learning_rate': 0.08944188541328729, 'n_estimators': 100, 'criterion': 'friedman_mse', 'min_samples_split': 3, 'min_samples_leaf': 4, 'min_weight_fraction_leaf': 0.014172092141389413, 'min_impurity_decrease': 0.5919773127723796, 'max_features': 0.5766435270183069, 'subsample': 0.12041785977524878, 'dropout_rate': 0.06726124861310573, 'ccp_alpha': 1.686239786756124}. Best is trial 759 with value: 0.8618735483942033.[0m
[32m[I 2022-05-19 01:29:59,275][0m Trial 777 finished with value: 0.8550643268101901 and parameters: {'loss': 'coxph', 'learning_rate': 0.03813225413840877, 'n_estimators': 103, 'criterion': 'friedman_mse', 'min_samples_split': 3, 'min_samples_leaf': 4, 'min_weight_fraction_leaf': 0.02515599981285333, 'min_impurity_decrease': 0.6287980405495459, 'max_features': 0.5469157319139788, 'subsample': 0.16905057274369473, 'dropout_rate': 0.019968374571180877, 'ccp_alpha': 0.002775772021922374}. Best is trial 759 with value: 0.8618735483942033.[0m
[32m[I 2022-05-19 01:34:53,490][0m Trial 778 finished with value: 0.8567072520400218 and parameters: {'loss': 'coxph', 'learning_rate': 0.035234915157322466, 'n_estimators': 118, 'criterion': 'friedman_mse', 'min_samples_split': 2, 'min_samples_leaf': 4, 'min_weight_fraction_leaf': 0.02443359640751434, 'min_impurity_decrease': 0.6297812264326591, 'max_features': 0.5501957534127065, 'subsample': 0.17231037183237763, 'dropout_rate': 0.0007932545507966828, 'ccp_alpha': 0.0015142790598892462}. Best is trial 759 with value: 0.8618735483942033.[0m
[32m[I 2022-05-19 01:39:38,073][0m Trial 779 finished with value: 0.7624456717099986 and parameters: {'loss': 'coxph', 'learning_rate': 0.03830335950503472, 'n_estimators': 116, 'criterion': 'friedman_mse', 'min_samples_split': 3, 'min_samples_leaf': 4, 'min_weight_fraction_leaf': 0.025841489458966978, 'min_impurity_decrease': 0.6220563926278021, 'max_features': 0.5451066442924826, 'subsample': 0.17688982513837526, 'dropout_rate': 0.01609926896788382, 'ccp_alpha': 0.1610537436527156}. Best is trial 759 with value: 0.8618735483942033.[0m
[32m[I 2022-05-19 01:44:02,201][0m Trial 780 finished with value: 0.7996581076526202 and parameters: {'loss': 'coxph', 'learning_rate': 0.05559355287496568, 'n_estimators': 107, 'criterion': 'friedman_mse', 'min_samples_split': 2, 'min_samples_leaf': 4, 'min_weight_fraction_leaf': 0.022118741856219433, 'min_impurity_decrease': 0.6341680831083889, 'max_features': 0.5061119825960423, 'subsample': 0.16931531178303144, 'dropout_rate': 0.02269054995556948, 'ccp_alpha': 0.10407822685966665}. Best is trial 759 with value: 0.8618735483942033.[0m
[32m[I 2022-05-19 01:49:32,006][0m Trial 781 finished with value: 0.7441738391098821 and parameters: {'loss': 'coxph', 'learning_rate': 0.033557062671149385, 'n_estimators': 124, 'criterion': 'friedman_mse', 'min_samples_split': 2, 'min_samples_leaf': 4, 'min_weight_fraction_leaf': 0.0013538050261426241, 'min_impurity_decrease': 0.5796863321883016, 'max_features': 0.5299651551039921, 'subsample': 0.10482895323585521, 'dropout_rate': 0.0030899527449615915, 'ccp_alpha': 0.27075816928774055}. Best is trial 759 with value: 0.8618735483942033.[0m
[32m[I 2022-05-19 01:54:11,284][0m Trial 782 finished with value: 0.7984721105938998 and parameters: {'loss': 'coxph', 'learning_rate': 0.043872113331295245, 'n_estimators': 113, 'criterion': 'friedman_mse', 'min_samples_split': 2, 'min_samples_leaf': 4, 'min_weight_fraction_leaf': 0.033579686965984734, 'min_impurity_decrease': 0.6543680750641072, 'max_features': 0.5603036455091638, 'subsample': 0.16906455241240406, 'dropout_rate': 0.0418376187874375, 'ccp_alpha': 0.09210171639662891}. Best is trial 759 with value: 0.8618735483942033.[0m
[32m[I 2022-05-19 01:59:14,991][0m Trial 783 finished with value: 0.5 and parameters: {'loss': 'coxph', 'learning_rate': 0.09880772249618361, 'n_estimators': 118, 'criterion': 'friedman_mse', 'min_samples_split': 2, 'min_samples_leaf': 4, 'min_weight_fraction_leaf': 0.011653734695262007, 'min_impurity_decrease': 0.6084658592138643, 'max_features': 0.5897119604881218, 'subsample': 0.12854405926483867, 'dropout_rate': 0.022284453819789055, 'ccp_alpha': 4.031395833760655}. Best is trial 759 with value: 0.8618735483942033.[0m
[32m[I 2022-05-19 02:04:03,374][0m Trial 784 finished with value: 0.5 and parameters: {'loss': 'coxph', 'learning_rate': 0.029847421790666923, 'n_estimators': 109, 'criterion': 'friedman_mse', 'min_samples_split': 3, 'min_samples_leaf': 4, 'min_weight_fraction_leaf': 0.02164837423968724, 'min_impurity_decrease': 0.5560793919767439, 'max_features': 0.5511677422645488, 'subsample': 0.10331926602535275, 'dropout_rate': 0.0018423046273483672, 'ccp_alpha': 0.4033862736705377}. Best is trial 759 with value: 0.8618735483942033.[0m
[32m[I 2022-05-19 02:09:23,098][0m Trial 785 finished with value: 0.8535351514032259 and parameters: {'loss': 'coxph', 'learning_rate': 0.06155414552839201, 'n_estimators': 128, 'criterion': 'friedman_mse', 'min_samples_split': 3, 'min_samples_leaf': 4, 'min_weight_fraction_leaf': 0.036589491155899115, 'min_impurity_decrease': 0.6382109988345844, 'max_features': 0.461074478705255, 'subsample': 0.17170114516239685, 'dropout_rate': 0.05244655934777077, 'ccp_alpha': 0.0033364211530375397}. Best is trial 759 with value: 0.8618735483942033.[0m
[32m[I 2022-05-19 02:14:34,754][0m Trial 786 finished with value: 0.7624585390051998 and parameters: {'loss': 'coxph', 'learning_rate': 0.0712002238628328, 'n_estimators': 123, 'criterion': 'friedman_mse', 'min_samples_split': 2, 'min_samples_leaf': 4, 'min_weight_fraction_leaf': 0.030766799297777297, 'min_impurity_decrease': 0.6256583829289755, 'max_features': 0.4732483191650794, 'subsample': 0.14760071980917752, 'dropout_rate': 0.05274766847415666, 'ccp_alpha': 0.17712426666857697}. Best is trial 759 with value: 0.8618735483942033.[0m
[32m[I 2022-05-19 02:20:01,348][0m Trial 787 finished with value: 0.7919094669870596 and parameters: {'loss': 'coxph', 'learning_rate': 0.04218834698546887, 'n_estimators': 126, 'criterion': 'friedman_mse', 'min_samples_split': 3, 'min_samples_leaf': 4, 'min_weight_fraction_leaf': 0.03995907823801754, 'min_impurity_decrease': 0.6694139635587022, 'max_features': 0.5020053336893886, 'subsample': 0.12967420724212528, 'dropout_rate': 0.037708997935495286, 'ccp_alpha': 0.08621397804737098}. Best is trial 759 with value: 0.8618735483942033.[0m
[32m[I 2022-05-19 02:24:37,230][0m Trial 788 finished with value: 0.7989223920446398 and parameters: {'loss': 'coxph', 'learning_rate': 0.059897738054623756, 'n_estimators': 113, 'criterion': 'friedman_mse', 'min_samples_split': 3, 'min_samples_leaf': 4, 'min_weight_fraction_leaf': 0.013619242724053234, 'min_impurity_decrease': 0.6374667904099048, 'max_features': 0.5695219559224204, 'subsample': 0.18241470431470674, 'dropout_rate': 0.00024319845943064763, 'ccp_alpha': 0.09275314338700402}. Best is trial 759 with value: 0.8618735483942033.[0m
[32m[I 2022-05-19 02:30:25,295][0m Trial 789 finished with value: 0.856083880699859 and parameters: {'loss': 'coxph', 'learning_rate': 0.055162604754768044, 'n_estimators': 130, 'criterion': 'friedman_mse', 'min_samples_split': 3, 'min_samples_leaf': 4, 'min_weight_fraction_leaf': 0.030839681009535123, 'min_impurity_decrease': 0.5919265405824388, 'max_features': 0.5441107767892079, 'subsample': 0.10949258455698568, 'dropout_rate': 0.02456274848685439, 'ccp_alpha': 0.0038511260153488453}. Best is trial 759 with value: 0.8618735483942033.[0m
[32m[I 2022-05-19 02:36:18,554][0m Trial 790 finished with value: 0.7404660933151653 and parameters: {'loss': 'coxph', 'learning_rate': 0.05309176753952227, 'n_estimators': 132, 'criterion': 'friedman_mse', 'min_samples_split': 3, 'min_samples_leaf': 4, 'min_weight_fraction_leaf': 0.028818184382668623, 'min_impurity_decrease': 0.5983686778875775, 'max_features': 0.4301388054030789, 'subsample': 0.09977616851936283, 'dropout_rate': 0.02681535412969642, 'ccp_alpha': 0.2766062817922485}. Best is trial 759 with value: 0.8618735483942033.[0m
[32m[I 2022-05-19 02:41:07,472][0m Trial 791 finished with value: 0.7626688570994773 and parameters: {'loss': 'coxph', 'learning_rate': 0.0765013421714493, 'n_estimators': 116, 'criterion': 'friedman_mse', 'min_samples_split': 3, 'min_samples_leaf': 4, 'min_weight_fraction_leaf': 0.024564347024046695, 'min_impurity_decrease': 0.575511461123218, 'max_features': 0.6122417153373281, 'subsample': 0.16207092752279606, 'dropout_rate': 0.059480305283143194, 'ccp_alpha': 0.16817529682979124}. Best is trial 759 with value: 0.8618735483942033.[0m
[32m[I 2022-05-19 02:46:47,030][0m Trial 792 finished with value: 0.7997432405664416 and parameters: {'loss': 'coxph', 'learning_rate': 0.034712429294922346, 'n_estimators': 127, 'criterion': 'friedman_mse', 'min_samples_split': 3, 'min_samples_leaf': 4, 'min_weight_fraction_leaf': 0.03512182060151328, 'min_impurity_decrease': 0.623318550695504, 'max_features': 0.5404087908091308, 'subsample': 0.10131942938757965, 'dropout_rate': 0.03777351040664369, 'ccp_alpha': 0.09640498945159388}. Best is trial 759 with value: 0.8618735483942033.[0m
[32m[I 2022-05-19 02:51:50,034][0m Trial 793 finished with value: 0.762653685358602 and parameters: {'loss': 'coxph', 'learning_rate': 0.047140777218679264, 'n_estimators': 119, 'criterion': 'friedman_mse', 'min_samples_split': 3, 'min_samples_leaf': 4, 'min_weight_fraction_leaf': 0.01634378752306815, 'min_impurity_decrease': 0.5394440932444585, 'max_features': 0.5206035030852243, 'subsample': 0.14154618999524987, 'dropout_rate': 0.02239892631031077, 'ccp_alpha': 0.21857927461580093}. Best is trial 759 with value: 0.8618735483942033.[0m
/media/san2_ssd/data/Workdir/survival/venv/lib/python3.8/site-packages/sksurv/ensemble/boosting.py:955: RuntimeWarning: divide by zero encountered in log
  time = numpy.log(time)
/media/san2_ssd/data/Workdir/survival/venv/lib/python3.8/site-packages/sksurv/ensemble/boosting.py:955: RuntimeWarning: divide by zero encountered in log
  time = numpy.log(time)
/media/san2_ssd/data/Workdir/survival/venv/lib/python3.8/site-packages/sksurv/ensemble/boosting.py:955: RuntimeWarning: divide by zero encountered in log
  time = numpy.log(time)
/media/san2_ssd/data/Workdir/survival/venv/lib/python3.8/site-packages/sksurv/ensemble/boosting.py:955: RuntimeWarning: divide by zero encountered in log
  time = numpy.log(time)
/media/san2_ssd/data/Workdir/survival/venv/lib/python3.8/site-packages/sksurv/ensemble/boosting.py:955: RuntimeWarning: divide by zero encountered in log
  time = numpy.log(time)
[32m[I 2022-05-19 02:51:50,110][0m Trial 794 finished with value: -1.0 and parameters: {'loss': 'squared', 'learning_rate': 0.06358886586041147, 'n_estimators': 106, 'criterion': 'friedman_mse', 'min_samples_split': 3, 'min_samples_leaf': 4, 'min_weight_fraction_leaf': 0.03908269321507107, 'min_impurity_decrease': 0.6512926634532035, 'max_features': 0.44564897467822095, 'subsample': 0.11068792810624588, 'dropout_rate': 0.07327852717975196, 'ccp_alpha': 0.005254119852322342}. Best is trial 759 with value: 0.8618735483942033.[0m
[32m[I 2022-05-19 02:57:27,171][0m Trial 795 finished with value: 0.7624925576679074 and parameters: {'loss': 'coxph', 'learning_rate': 0.03936130852068339, 'n_estimators': 137, 'criterion': 'friedman_mse', 'min_samples_split': 2, 'min_samples_leaf': 4, 'min_weight_fraction_leaf': 0.0018547986757083204, 'min_impurity_decrease': 0.6051030605424639, 'max_features': 0.5879656335436265, 'subsample': 0.1797864522853438, 'dropout_rate': 0.045509760503418796, 'ccp_alpha': 0.16412752316641294}. Best is trial 759 with value: 0.8618735483942033.[0m
[32m[I 2022-05-19 03:02:55,715][0m Trial 796 finished with value: 0.7396458151732428 and parameters: {'loss': 'coxph', 'learning_rate': 0.025870161073388423, 'n_estimators': 128, 'criterion': 'friedman_mse', 'min_samples_split': 3, 'min_samples_leaf': 4, 'min_weight_fraction_leaf': 0.027501912114791527, 'min_impurity_decrease': 0.6398743529293397, 'max_features': 0.5647530898602618, 'subsample': 0.1347912535697264, 'dropout_rate': 0.020318311583672515, 'ccp_alpha': 0.3259469523922497}. Best is trial 759 with value: 0.8618735483942033.[0m
[32m[I 2022-05-19 03:07:13,511][0m Trial 797 finished with value: 0.5 and parameters: {'loss': 'coxph', 'learning_rate': 0.05168652593433344, 'n_estimators': 103, 'criterion': 'friedman_mse', 'min_samples_split': 3, 'min_samples_leaf': 4, 'min_weight_fraction_leaf': 0.012537723988568004, 'min_impurity_decrease': 0.6819195839738685, 'max_features': 0.49439495773432707, 'subsample': 0.15027573032330066, 'dropout_rate': 0.0018401358829693328, 'ccp_alpha': 0.5624128962859477}. Best is trial 759 with value: 0.8618735483942033.[0m
[32m[I 2022-05-19 03:11:32,868][0m Trial 798 finished with value: 0.5 and parameters: {'loss': 'coxph', 'learning_rate': 0.07512741680702725, 'n_estimators': 100, 'criterion': 'squared_error', 'min_samples_split': 3, 'min_samples_leaf': 4, 'min_weight_fraction_leaf': 0.04005600319497832, 'min_impurity_decrease': 0.6605453126885097, 'max_features': 0.45732673392644435, 'subsample': 0.11637886357842703, 'dropout_rate': 0.05457026561633224, 'ccp_alpha': 0.08965854654686578}. Best is trial 759 with value: 0.8618735483942033.[0m
[32m[I 2022-05-19 03:16:04,368][0m Trial 799 finished with value: 0.8520047822325438 and parameters: {'loss': 'coxph', 'learning_rate': 0.0341808537558706, 'n_estimators': 109, 'criterion': 'friedman_mse', 'min_samples_split': 3, 'min_samples_leaf': 4, 'min_weight_fraction_leaf': 0.018087413882545915, 'min_impurity_decrease': 0.611609930032097, 'max_features': 0.5338314967457181, 'subsample': 0.16768150803975795, 'dropout_rate': 0.021288768840186524, 'ccp_alpha': 0.005607050144212535}. Best is trial 759 with value: 0.8618735483942033.[0m
[32m[I 2022-05-19 03:21:26,080][0m Trial 800 finished with value: 0.8571640185931271 and parameters: {'loss': 'coxph', 'learning_rate': 0.02454294474111746, 'n_estimators': 123, 'criterion': 'friedman_mse', 'min_samples_split': 3, 'min_samples_leaf': 4, 'min_weight_fraction_leaf': 0.028398796527016396, 'min_impurity_decrease': 0.5912855424009962, 'max_features': 0.6050146794174345, 'subsample': 0.13067863869453003, 'dropout_rate': 0.0005447135570332273, 'ccp_alpha': 0.0012195479180432045}. Best is trial 759 with value: 0.8618735483942033.[0m
[32m[I 2022-05-19 03:26:54,331][0m Trial 801 finished with value: 0.7617717575057716 and parameters: {'loss': 'coxph', 'learning_rate': 0.022958497929892942, 'n_estimators': 123, 'criterion': 'friedman_mse', 'min_samples_split': 3, 'min_samples_leaf': 4, 'min_weight_fraction_leaf': 0.02553565241278679, 'min_impurity_decrease': 0.5589431133397039, 'max_features': 0.6056631597374368, 'subsample': 0.10320580395698245, 'dropout_rate': 0.0020772884637695367, 'ccp_alpha': 0.1681023357287668}. Best is trial 759 with value: 0.8618735483942033.[0m
[32m[I 2022-05-19 03:31:51,161][0m Trial 802 finished with value: 0.8540268304366505 and parameters: {'loss': 'coxph', 'learning_rate': 0.03180785782347151, 'n_estimators': 113, 'criterion': 'friedman_mse', 'min_samples_split': 3, 'min_samples_leaf': 4, 'min_weight_fraction_leaf': 0.008349292404516949, 'min_impurity_decrease': 0.5833680477888226, 'max_features': 0.5764302888958786, 'subsample': 0.12180082894229144, 'dropout_rate': 0.030469781485889146, 'ccp_alpha': 0.0017033153007355137}. Best is trial 759 with value: 0.8618735483942033.[0m
[32m[I 2022-05-19 03:36:58,743][0m Trial 803 finished with value: 0.7975364291670192 and parameters: {'loss': 'coxph', 'learning_rate': 0.029844077827584713, 'n_estimators': 115, 'criterion': 'friedman_mse', 'min_samples_split': 2, 'min_samples_leaf': 4, 'min_weight_fraction_leaf': 0.010436525939253543, 'min_impurity_decrease': 0.5787708322604994, 'max_features': 0.5779250777069386, 'subsample': 0.09912972448948759, 'dropout_rate': 0.030564957872884494, 'ccp_alpha': 0.10695019990982742}. Best is trial 759 with value: 0.8618735483942033.[0m
