[32m[I 2022-04-21 17:51:54,482][0m Trial 747 finished with value: 0.7728686984485973 and parameters: {'splitter': 'random', 'min_samples_split': 0.21054834651140694, 'min_samples_leaf': 0.08694388986660068, 'min_weight_fraction_leaf': 0.05879039027191514, 'max_features': 0.9449125377900586}. Best is trial 660 with value: 0.812979986296886.[0m
[32m[I 2022-04-21 17:51:55,961][0m Trial 748 finished with value: 0.797004317397622 and parameters: {'splitter': 'random', 'min_samples_split': 0.23297612159833742, 'min_samples_leaf': 0.09411357122181033, 'min_weight_fraction_leaf': 0.0641559615624121, 'max_features': 0.8872958306824853}. Best is trial 660 with value: 0.812979986296886.[0m
[32m[I 2022-04-21 17:51:56,467][0m Trial 749 finished with value: 0.7594491636389396 and parameters: {'splitter': 'random', 'min_samples_split': 0.21777441408211706, 'min_samples_leaf': 0.21050876869691473, 'min_weight_fraction_leaf': 0.08313706653074451, 'max_features': 0.9114254355271026}. Best is trial 660 with value: 0.812979986296886.[0m
[32m[I 2022-04-21 17:53:28,365][0m Trial 750 finished with value: 0.781385347251788 and parameters: {'splitter': 'best', 'min_samples_split': 0.19434919138731577, 'min_samples_leaf': 0.10643293696845627, 'min_weight_fraction_leaf': 0.054076228653480114, 'max_features': 0.9273176830173252}. Best is trial 660 with value: 0.812979986296886.[0m
[32m[I 2022-04-21 17:53:28,799][0m Trial 751 finished with value: 0.7715333501877661 and parameters: {'splitter': 'random', 'min_samples_split': 0.23682715825525852, 'min_samples_leaf': 0.11708931769098088, 'min_weight_fraction_leaf': 0.07256748122168281, 'max_features': 0.9623602227808059}. Best is trial 660 with value: 0.812979986296886.[0m
[32m[I 2022-04-21 17:53:29,102][0m Trial 752 finished with value: 0.6851609036733942 and parameters: {'splitter': 'random', 'min_samples_split': 0.20921362084720455, 'min_samples_leaf': 0.3439074890032922, 'min_weight_fraction_leaf': 0.04903963198641885, 'max_features': 0.8694223579627488}. Best is trial 660 with value: 0.812979986296886.[0m
[32m[I 2022-04-21 17:53:29,601][0m Trial 753 finished with value: 0.810095230018675 and parameters: {'splitter': 'random', 'min_samples_split': 0.2232739521100956, 'min_samples_leaf': 0.08043468520431549, 'min_weight_fraction_leaf': 0.0630775696229559, 'max_features': 0.9092258573469731}. Best is trial 660 with value: 0.812979986296886.[0m
[32m[I 2022-04-21 17:53:29,920][0m Trial 754 finished with value: 0.6851609036733942 and parameters: {'splitter': 'random', 'min_samples_split': 0.1823734611999732, 'min_samples_leaf': 0.09603608207680919, 'min_weight_fraction_leaf': 0.36814595864055033, 'max_features': 0.934977480233569}. Best is trial 660 with value: 0.812979986296886.[0m
[32m[I 2022-04-21 17:53:30,344][0m Trial 755 finished with value: 0.7974997136522995 and parameters: {'splitter': 'random', 'min_samples_split': 0.19420123074536422, 'min_samples_leaf': 0.08862381638244113, 'min_weight_fraction_leaf': 0.08103266396534922, 'max_features': 0.8917903844631948}. Best is trial 660 with value: 0.812979986296886.[0m
[32m[I 2022-04-21 17:53:30,614][0m Trial 756 finished with value: 0.6851609036733942 and parameters: {'splitter': 'random', 'min_samples_split': 0.23931351285464456, 'min_samples_leaf': 0.31420791646997953, 'min_weight_fraction_leaf': 0.05220470818075053, 'max_features': 0.9513978876429929}. Best is trial 660 with value: 0.812979986296886.[0m
[32m[I 2022-04-21 17:53:31,016][0m Trial 757 finished with value: 0.7594491636389396 and parameters: {'splitter': 'random', 'min_samples_split': 0.20564766284529634, 'min_samples_leaf': 0.1473346866585942, 'min_weight_fraction_leaf': 0.2170068344426172, 'max_features': 0.9786580806956873}. Best is trial 660 with value: 0.812979986296886.[0m
[32m[I 2022-04-21 17:53:31,297][0m Trial 758 finished with value: 0.6851609036733942 and parameters: {'splitter': 'random', 'min_samples_split': 0.21794346103197318, 'min_samples_leaf': 0.3758261693579461, 'min_weight_fraction_leaf': 0.07317435439078936, 'max_features': 0.9225470286910378}. Best is trial 660 with value: 0.812979986296886.[0m
[32m[I 2022-04-21 17:53:31,702][0m Trial 759 finished with value: 0.7963475833141842 and parameters: {'splitter': 'random', 'min_samples_split': 0.22939579563015575, 'min_samples_leaf': 0.1021223345539409, 'min_weight_fraction_leaf': 0.06378572392102706, 'max_features': 0.9041922399890561}. Best is trial 660 with value: 0.812979986296886.[0m
[32m[I 2022-04-21 17:53:32,119][0m Trial 760 finished with value: 0.7590531836201678 and parameters: {'splitter': 'random', 'min_samples_split': 0.21160454909967083, 'min_samples_leaf': 0.1676606433068886, 'min_weight_fraction_leaf': 0.083221265652208, 'max_features': 0.8597890487704108}. Best is trial 660 with value: 0.812979986296886.[0m
[32m[I 2022-04-21 17:53:32,710][0m Trial 761 finished with value: 0.7986385745544113 and parameters: {'splitter': 'random', 'min_samples_split': 0.22599209636976003, 'min_samples_leaf': 0.0786683609476646, 'min_weight_fraction_leaf': 0.05307372997791987, 'max_features': 0.9410119679686071}. Best is trial 660 with value: 0.812979986296886.[0m
[32m[I 2022-04-21 17:53:33,130][0m Trial 762 finished with value: 0.7700124675144846 and parameters: {'splitter': 'random', 'min_samples_split': 0.16719716948340052, 'min_samples_leaf': 0.09066924836904723, 'min_weight_fraction_leaf': 0.06471709764206869, 'max_features': 0.8828904511085054}. Best is trial 660 with value: 0.812979986296886.[0m
[32m[I 2022-04-21 17:53:33,753][0m Trial 763 finished with value: 0.7719324174672123 and parameters: {'splitter': 'random', 'min_samples_split': 0.23830029994818308, 'min_samples_leaf': 0.10912641142883302, 'min_weight_fraction_leaf': 0.04474616205224212, 'max_features': 0.9618799268351855}. Best is trial 660 with value: 0.812979986296886.[0m
[32m[I 2022-04-21 17:53:34,352][0m Trial 764 finished with value: 0.813044970304316 and parameters: {'splitter': 'random', 'min_samples_split': 0.20135448626099745, 'min_samples_leaf': 0.07525936821013107, 'min_weight_fraction_leaf': 0.07368827793291982, 'max_features': 0.9239304892831753}. Best is trial 764 with value: 0.813044970304316.[0m
[32m[I 2022-04-21 17:53:35,244][0m Trial 765 finished with value: 0.7683738991383459 and parameters: {'splitter': 'random', 'min_samples_split': 0.19162787696652858, 'min_samples_leaf': 0.04468987440877059, 'min_weight_fraction_leaf': 0.09515775369329545, 'max_features': 0.9317266122585678}. Best is trial 764 with value: 0.813044970304316.[0m
[32m[I 2022-04-21 17:53:35,924][0m Trial 766 finished with value: 0.7795525256213025 and parameters: {'splitter': 'random', 'min_samples_split': 0.19882991608214026, 'min_samples_leaf': 0.07121685442705067, 'min_weight_fraction_leaf': 0.07801157066759534, 'max_features': 0.959240845675081}. Best is trial 764 with value: 0.813044970304316.[0m
[32m[I 2022-04-21 17:53:36,485][0m Trial 767 finished with value: 0.8083360460820949 and parameters: {'splitter': 'random', 'min_samples_split': 0.18113406329501244, 'min_samples_leaf': 0.060678388554148845, 'min_weight_fraction_leaf': 0.09051849866757841, 'max_features': 0.9834860546891485}. Best is trial 764 with value: 0.813044970304316.[0m
[32m[I 2022-04-21 17:55:15,405][0m Trial 768 finished with value: 0.7873025789792459 and parameters: {'splitter': 'best', 'min_samples_split': 0.2024476899222404, 'min_samples_leaf': 0.07562274303807154, 'min_weight_fraction_leaf': 0.07299326423425455, 'max_features': 0.9412053916407243}. Best is trial 764 with value: 0.813044970304316.[0m
[32m[I 2022-04-21 17:55:15,886][0m Trial 769 finished with value: 0.8127039260507465 and parameters: {'splitter': 'random', 'min_samples_split': 0.19120562251953838, 'min_samples_leaf': 0.07060997577755607, 'min_weight_fraction_leaf': 0.08315968907070778, 'max_features': 0.9231498232200268}. Best is trial 764 with value: 0.813044970304316.[0m
[32m[I 2022-04-21 17:55:16,500][0m Trial 770 finished with value: 0.8112209791248602 and parameters: {'splitter': 'random', 'min_samples_split': 0.17238770545143178, 'min_samples_leaf': 0.04670526226561723, 'min_weight_fraction_leaf': 0.08538476044258345, 'max_features': 0.9987578345174396}. Best is trial 764 with value: 0.813044970304316.[0m
[32m[I 2022-04-21 17:55:17,232][0m Trial 771 finished with value: 0.7594615166272627 and parameters: {'splitter': 'random', 'min_samples_split': 0.1556682427943469, 'min_samples_leaf': 0.05426207991823336, 'min_weight_fraction_leaf': 0.10024511036555225, 'max_features': 0.8348485212905339}. Best is trial 764 with value: 0.813044970304316.[0m
[32m[I 2022-04-21 17:55:17,876][0m Trial 772 finished with value: 0.8114112826585449 and parameters: {'splitter': 'random', 'min_samples_split': 0.19307941962120964, 'min_samples_leaf': 0.04371279530614472, 'min_weight_fraction_leaf': 0.08881497418154019, 'max_features': 0.9237783548407613}. Best is trial 764 with value: 0.813044970304316.[0m
[32m[I 2022-04-21 17:55:18,430][0m Trial 773 finished with value: 0.8118348628302042 and parameters: {'splitter': 'random', 'min_samples_split': 0.20217066025243507, 'min_samples_leaf': 0.04161711396632127, 'min_weight_fraction_leaf': 0.08610590241712401, 'max_features': 0.921398860340824}. Best is trial 764 with value: 0.813044970304316.[0m
[32m[I 2022-04-21 17:55:18,952][0m Trial 774 finished with value: 0.7672437310246556 and parameters: {'splitter': 'random', 'min_samples_split': 0.19072235092723586, 'min_samples_leaf': 0.04783237050953062, 'min_weight_fraction_leaf': 0.10882692442867903, 'max_features': 0.9116400561039057}. Best is trial 764 with value: 0.813044970304316.[0m
[32m[I 2022-04-21 17:55:19,550][0m Trial 775 finished with value: 0.7950481493355436 and parameters: {'splitter': 'random', 'min_samples_split': 0.18980786599371866, 'min_samples_leaf': 0.04180615472344394, 'min_weight_fraction_leaf': 0.10690962603946942, 'max_features': 0.8957949803451921}. Best is trial 764 with value: 0.813044970304316.[0m
[32m[I 2022-04-21 17:55:20,149][0m Trial 776 finished with value: 0.7658556353315025 and parameters: {'splitter': 'random', 'min_samples_split': 0.19746249805409502, 'min_samples_leaf': 0.05705572961386189, 'min_weight_fraction_leaf': 0.12722876516546175, 'max_features': 0.9277060718020478}. Best is trial 764 with value: 0.813044970304316.[0m
[32m[I 2022-04-21 17:55:20,703][0m Trial 777 finished with value: 0.7640334787079823 and parameters: {'splitter': 'random', 'min_samples_split': 0.20479304275935456, 'min_samples_leaf': 0.0451221108257342, 'min_weight_fraction_leaf': 0.09792274097711809, 'max_features': 0.9396566901948261}. Best is trial 764 with value: 0.813044970304316.[0m
[32m[I 2022-04-21 17:55:21,232][0m Trial 778 finished with value: 0.8011188728660563 and parameters: {'splitter': 'random', 'min_samples_split': 0.18908527845748785, 'min_samples_leaf': 0.04746475416744744, 'min_weight_fraction_leaf': 0.09903246686698139, 'max_features': 0.9264366457931171}. Best is trial 764 with value: 0.813044970304316.[0m
[32m[I 2022-04-21 17:55:21,752][0m Trial 779 finished with value: 0.7672038462035327 and parameters: {'splitter': 'random', 'min_samples_split': 0.2005925361033371, 'min_samples_leaf': 0.0403938754723847, 'min_weight_fraction_leaf': 0.09025053089497145, 'max_features': 0.9470162867260271}. Best is trial 764 with value: 0.813044970304316.[0m
[32m[I 2022-04-21 17:55:22,259][0m Trial 780 finished with value: 0.797004317397622 and parameters: {'splitter': 'random', 'min_samples_split': 0.21614939311892772, 'min_samples_leaf': 0.043584652621887154, 'min_weight_fraction_leaf': 0.09137325041462417, 'max_features': 0.900953556856329}. Best is trial 764 with value: 0.813044970304316.[0m
[32m[I 2022-04-21 17:55:22,492][0m Trial 781 finished with value: 0.5 and parameters: {'splitter': 'random', 'min_samples_split': 0.20770961568215643, 'min_samples_leaf': 0.05630036783114762, 'min_weight_fraction_leaf': 0.315987266377226, 'max_features': 0.01775537876536004}. Best is trial 764 with value: 0.813044970304316.[0m
[32m[I 2022-04-21 17:55:23,206][0m Trial 782 finished with value: 0.8115153744138326 and parameters: {'splitter': 'random', 'min_samples_split': 0.18015308103229274, 'min_samples_leaf': 0.042289896696743476, 'min_weight_fraction_leaf': 0.08937471363715649, 'max_features': 0.9233808538275168}. Best is trial 764 with value: 0.813044970304316.[0m
[32m[I 2022-04-21 17:55:23,966][0m Trial 783 finished with value: 0.7728780673444804 and parameters: {'splitter': 'random', 'min_samples_split': 0.17697079374641514, 'min_samples_leaf': 0.03817463742935237, 'min_weight_fraction_leaf': 0.10412613388975969, 'max_features': 0.916025957197373}. Best is trial 764 with value: 0.813044970304316.[0m
[32m[I 2022-04-21 17:55:24,490][0m Trial 784 finished with value: 0.7665032984419018 and parameters: {'splitter': 'random', 'min_samples_split': 0.18585070335114715, 'min_samples_leaf': 0.03965412210381063, 'min_weight_fraction_leaf': 0.09849285049923354, 'max_features': 0.9456172414910886}. Best is trial 764 with value: 0.813044970304316.[0m
[32m[I 2022-04-21 17:55:24,984][0m Trial 785 finished with value: 0.7974997136522995 and parameters: {'splitter': 'random', 'min_samples_split': 0.17806878064990594, 'min_samples_leaf': 0.04816774500765709, 'min_weight_fraction_leaf': 0.08759816592292961, 'max_features': 0.8873542857777402}. Best is trial 764 with value: 0.813044970304316.[0m
[32m[I 2022-04-21 17:55:25,493][0m Trial 786 finished with value: 0.8131474120894296 and parameters: {'splitter': 'random', 'min_samples_split': 0.19589403792813595, 'min_samples_leaf': 0.05175034462917652, 'min_weight_fraction_leaf': 0.09117070642771825, 'max_features': 0.9282507237600933}. Best is trial 786 with value: 0.8131474120894296.[0m
[32m[I 2022-04-21 17:57:12,898][0m Trial 787 finished with value: 0.782530675609826 and parameters: {'splitter': 'best', 'min_samples_split': 0.19347236157117031, 'min_samples_leaf': 0.0418138441402658, 'min_weight_fraction_leaf': 0.10862536460072075, 'max_features': 0.899576336806926}. Best is trial 786 with value: 0.8131474120894296.[0m
[32m[I 2022-04-21 17:57:13,982][0m Trial 788 finished with value: 0.760240958952549 and parameters: {'splitter': 'random', 'min_samples_split': 0.16581076985320445, 'min_samples_leaf': 0.05274825615587086, 'min_weight_fraction_leaf': 0.11029213013305425, 'max_features': 0.9332192203291143}. Best is trial 786 with value: 0.8131474120894296.[0m
[32m[I 2022-04-21 17:57:14,889][0m Trial 789 finished with value: 0.7715333501877661 and parameters: {'splitter': 'random', 'min_samples_split': 0.1814124178983059, 'min_samples_leaf': 0.03582941014157211, 'min_weight_fraction_leaf': 0.11740110013544724, 'max_features': 0.9559581314082163}. Best is trial 786 with value: 0.8131474120894296.[0m
[32m[I 2022-04-21 17:57:15,826][0m Trial 790 finished with value: 0.7604146064075576 and parameters: {'splitter': 'random', 'min_samples_split': 0.19545041633210525, 'min_samples_leaf': 0.053845060974552175, 'min_weight_fraction_leaf': 0.10341685269995464, 'max_features': 0.935438418108753}. Best is trial 786 with value: 0.8131474120894296.[0m
[32m[I 2022-04-21 17:57:16,683][0m Trial 791 finished with value: 0.7741018687531224 and parameters: {'splitter': 'random', 'min_samples_split': 0.20237282554675623, 'min_samples_leaf': 0.047868593343908486, 'min_weight_fraction_leaf': 0.092076989018657, 'max_features': 0.9574402799149513}. Best is trial 786 with value: 0.8131474120894296.[0m
[32m[I 2022-04-21 17:57:17,408][0m Trial 792 finished with value: 0.7658405528004703 and parameters: {'splitter': 'random', 'min_samples_split': 0.18631154219889592, 'min_samples_leaf': 0.058739674781358046, 'min_weight_fraction_leaf': 0.13584640545452215, 'max_features': 0.9116734771025644}. Best is trial 786 with value: 0.8131474120894296.[0m
[32m[I 2022-04-21 17:57:17,934][0m Trial 793 finished with value: 0.7547499809894004 and parameters: {'splitter': 'random', 'min_samples_split': 0.21605403968892142, 'min_samples_leaf': 0.0495402696932111, 'min_weight_fraction_leaf': 0.11441672050404461, 'max_features': 0.37490648740295507}. Best is trial 786 with value: 0.8131474120894296.[0m
[32m[I 2022-04-21 17:57:18,761][0m Trial 794 finished with value: 0.8009667378475427 and parameters: {'splitter': 'random', 'min_samples_split': 0.20429939274723785, 'min_samples_leaf': 0.04464735973095777, 'min_weight_fraction_leaf': 0.09901010001403462, 'max_features': 0.9260977686298463}. Best is trial 786 with value: 0.8131474120894296.[0m
[32m[I 2022-04-21 17:57:19,242][0m Trial 795 finished with value: 0.7665032984419018 and parameters: {'splitter': 'random', 'min_samples_split': 0.19425347944123167, 'min_samples_leaf': 0.062252125224943736, 'min_weight_fraction_leaf': 0.09815014579246091, 'max_features': 0.9505054502043883}. Best is trial 786 with value: 0.8131474120894296.[0m
[32m[I 2022-04-21 17:57:20,040][0m Trial 796 finished with value: 0.7736441906372783 and parameters: {'splitter': 'random', 'min_samples_split': 0.17355231925932316, 'min_samples_leaf': 0.04041783438647559, 'min_weight_fraction_leaf': 0.09379591231715156, 'max_features': 0.8747241967130894}. Best is trial 786 with value: 0.8131474120894296.[0m
[32m[I 2022-04-21 17:57:20,911][0m Trial 797 finished with value: 0.810095230018675 and parameters: {'splitter': 'random', 'min_samples_split': 0.2105933094391215, 'min_samples_leaf': 0.037735788620233336, 'min_weight_fraction_leaf': 0.08604398674108146, 'max_features': 0.9294898378531076}. Best is trial 786 with value: 0.8131474120894296.[0m
[32m[I 2022-04-21 17:57:21,455][0m Trial 798 finished with value: 0.810095230018675 and parameters: {'splitter': 'random', 'min_samples_split': 0.22482840441084528, 'min_samples_leaf': 0.05752559515318216, 'min_weight_fraction_leaf': 0.08306081672111376, 'max_features': 0.917536125741139}. Best is trial 786 with value: 0.8131474120894296.[0m
[32m[I 2022-04-21 17:57:21,985][0m Trial 799 finished with value: 0.7978584574512089 and parameters: {'splitter': 'random', 'min_samples_split': 0.18636621591896985, 'min_samples_leaf': 0.06279751309331882, 'min_weight_fraction_leaf': 0.0904660305212139, 'max_features': 0.8961276529611689}. Best is trial 786 with value: 0.8131474120894296.[0m
[32m[I 2022-04-21 17:57:22,454][0m Trial 800 finished with value: 0.7752997467662333 and parameters: {'splitter': 'random', 'min_samples_split': 0.20204956308313232, 'min_samples_leaf': 0.053589479963470896, 'min_weight_fraction_leaf': 0.08454736751270618, 'max_features': 0.8792338710487397}. Best is trial 786 with value: 0.8131474120894296.[0m
[32m[I 2022-04-21 17:57:22,919][0m Trial 801 finished with value: 0.7672437310246556 and parameters: {'splitter': 'random', 'min_samples_split': 0.21721131761846008, 'min_samples_leaf': 0.06464579285664293, 'min_weight_fraction_leaf': 0.10560639420010143, 'max_features': 0.9088864031938901}. Best is trial 786 with value: 0.8131474120894296.[0m
[32m[I 2022-04-21 17:57:23,519][0m Trial 802 finished with value: 0.7877403879684994 and parameters: {'splitter': 'random', 'min_samples_split': 0.19667442188342776, 'min_samples_leaf': 0.03933889029772218, 'min_weight_fraction_leaf': 0.08247206912622518, 'max_features': 0.960066530593406}. Best is trial 786 with value: 0.8131474120894296.[0m
[32m[I 2022-04-21 17:57:24,029][0m Trial 803 finished with value: 0.7640334787079823 and parameters: {'splitter': 'random', 'min_samples_split': 0.21061443804777416, 'min_samples_leaf': 0.048687539668867304, 'min_weight_fraction_leaf': 0.09484955070044264, 'max_features': 0.9409465729697982}. Best is trial 786 with value: 0.8131474120894296.[0m
[32m[I 2022-04-21 17:57:24,599][0m Trial 804 finished with value: 0.8104986208565723 and parameters: {'splitter': 'random', 'min_samples_split': 0.22036875401647063, 'min_samples_leaf': 0.03518090464384738, 'min_weight_fraction_leaf': 0.08849857233530606, 'max_features': 0.9246992555943523}. Best is trial 786 with value: 0.8131474120894296.[0m
[32m[I 2022-04-21 17:57:25,104][0m Trial 805 finished with value: 0.7969658937357031 and parameters: {'splitter': 'random', 'min_samples_split': 0.22728684535794355, 'min_samples_leaf': 0.06681828417626559, 'min_weight_fraction_leaf': 0.0807116258474941, 'max_features': 0.8958413844366038}. Best is trial 786 with value: 0.8131474120894296.[0m
[32m[I 2022-04-21 17:59:11,836][0m Trial 806 finished with value: 0.7822295593915918 and parameters: {'splitter': 'best', 'min_samples_split': 0.18757163819399383, 'min_samples_leaf': 0.05708483656369582, 'min_weight_fraction_leaf': 0.07920577281997233, 'max_features': 0.9113276611442922}. Best is trial 786 with value: 0.8131474120894296.[0m
[32m[I 2022-04-21 17:59:12,702][0m Trial 807 finished with value: 0.7686882225979675 and parameters: {'splitter': 'random', 'min_samples_split': 0.1624954193520472, 'min_samples_leaf': 0.04996202411680595, 'min_weight_fraction_leaf': 0.08963012670075203, 'max_features': 0.9392132083674875}. Best is trial 786 with value: 0.8131474120894296.[0m
[32m[I 2022-04-21 17:59:13,393][0m Trial 808 finished with value: 0.7752835040527123 and parameters: {'splitter': 'random', 'min_samples_split': 0.20649128911558526, 'min_samples_leaf': 0.05694980478879785, 'min_weight_fraction_leaf': 0.12037827123179574, 'max_features': 0.8753485132827253}. Best is trial 786 with value: 0.8131474120894296.[0m
[32m[I 2022-04-21 17:59:13,884][0m Trial 809 finished with value: 0.7873720118246464 and parameters: {'splitter': 'random', 'min_samples_split': 0.1969281304579141, 'min_samples_leaf': 0.06886949732237804, 'min_weight_fraction_leaf': 0.07821542014076716, 'max_features': 0.961517973657495}. Best is trial 786 with value: 0.8131474120894296.[0m
