[32m[I 2022-04-21 14:00:35,222][0m Trial 868 finished with value: 0.8881799187854977 and parameters: {'splitter': 'random', 'min_samples_split': 0.07908765222225772, 'min_samples_leaf': 0.007772960254854031, 'min_weight_fraction_leaf': 0.0751214618957686, 'max_features': 0.8688381156875068}. Best is trial 677 with value: 0.9113497956229912.[0m
[32m[I 2022-04-21 14:00:37,740][0m Trial 869 finished with value: 0.9042540208671215 and parameters: {'splitter': 'random', 'min_samples_split': 0.0729785264280426, 'min_samples_leaf': 0.01301479646222242, 'min_weight_fraction_leaf': 0.05800071333599309, 'max_features': 0.9239952754756976}. Best is trial 677 with value: 0.9113497956229912.[0m
[32m[I 2022-04-21 14:00:39,903][0m Trial 870 finished with value: 0.902140109659386 and parameters: {'splitter': 'random', 'min_samples_split': 0.0894652582440741, 'min_samples_leaf': 0.009141371480971706, 'min_weight_fraction_leaf': 0.0442956410958276, 'max_features': 0.8882522936454651}. Best is trial 677 with value: 0.9113497956229912.[0m
[32m[I 2022-04-21 14:00:42,236][0m Trial 871 finished with value: 0.3425804518366971 and parameters: {'splitter': 'random', 'min_samples_split': 0.07150168997074956, 'min_samples_leaf': 0.025928750353149854, 'min_weight_fraction_leaf': 0.33530173559685345, 'max_features': 0.9333963248062673}. Best is trial 677 with value: 0.9113497956229912.[0m
[32m[I 2022-04-21 14:00:44,337][0m Trial 872 finished with value: 0.9024147198942105 and parameters: {'splitter': 'random', 'min_samples_split': 0.08319096711856608, 'min_samples_leaf': 0.017100879757690604, 'min_weight_fraction_leaf': 0.04977269912648261, 'max_features': 0.9085517901506884}. Best is trial 677 with value: 0.9113497956229912.[0m
[32m[I 2022-04-21 14:00:46,577][0m Trial 873 finished with value: 0.9083645748386966 and parameters: {'splitter': 'random', 'min_samples_split': 0.059164832981699764, 'min_samples_leaf': 0.03737759857228253, 'min_weight_fraction_leaf': 0.03947173827699001, 'max_features': 0.9249443950533726}. Best is trial 677 with value: 0.9113497956229912.[0m
[32m[I 2022-04-21 14:00:48,322][0m Trial 874 finished with value: 0.9000172288275705 and parameters: {'splitter': 'random', 'min_samples_split': 0.06168918768114829, 'min_samples_leaf': 0.008609344353767721, 'min_weight_fraction_leaf': 0.0349420821342854, 'max_features': 0.8973358984887541}. Best is trial 677 with value: 0.9113497956229912.[0m
[32m[I 2022-04-21 14:00:49,408][0m Trial 875 finished with value: 0.8885052344901853 and parameters: {'splitter': 'random', 'min_samples_split': 0.07440260110171243, 'min_samples_leaf': 0.10252058578619368, 'min_weight_fraction_leaf': 0.061009381172131824, 'max_features': 0.8762394786684493}. Best is trial 677 with value: 0.9113497956229912.[0m
[32m[I 2022-04-21 14:00:51,023][0m Trial 876 finished with value: 0.9043040745810771 and parameters: {'splitter': 'random', 'min_samples_split': 0.05828259493061984, 'min_samples_leaf': 0.02388808486549194, 'min_weight_fraction_leaf': 0.04189076288484756, 'max_features': 0.9335724388781194}. Best is trial 677 with value: 0.9113497956229912.[0m
[32m[I 2022-04-21 14:00:52,919][0m Trial 877 finished with value: 0.9022997977480248 and parameters: {'splitter': 'random', 'min_samples_split': 0.11824791755217065, 'min_samples_leaf': 0.0010725012700623735, 'min_weight_fraction_leaf': 0.029817836298002512, 'max_features': 0.9152064802125472}. Best is trial 677 with value: 0.9113497956229912.[0m
[32m[I 2022-04-21 14:00:54,172][0m Trial 878 finished with value: 0.9046404359471021 and parameters: {'splitter': 'random', 'min_samples_split': 0.10253869713204589, 'min_samples_leaf': 0.03490219727664581, 'min_weight_fraction_leaf': 0.05084263164743903, 'max_features': 0.945708635366401}. Best is trial 677 with value: 0.9113497956229912.[0m
[32m[I 2022-04-21 14:00:55,310][0m Trial 879 finished with value: 0.9023656455578957 and parameters: {'splitter': 'random', 'min_samples_split': 0.08479295536698456, 'min_samples_leaf': 0.043587391017113834, 'min_weight_fraction_leaf': 0.013163385469137335, 'max_features': 0.8981921519457552}. Best is trial 677 with value: 0.9113497956229912.[0m
[32m[I 2022-04-21 14:00:56,662][0m Trial 880 finished with value: 0.8918122615753292 and parameters: {'splitter': 'random', 'min_samples_split': 0.06691217447386992, 'min_samples_leaf': 0.017174789263267213, 'min_weight_fraction_leaf': 0.0371246412623801, 'max_features': 0.38959835892762074}. Best is trial 677 with value: 0.9113497956229912.[0m
[32m[I 2022-04-21 14:04:42,988][0m Trial 881 finished with value: 0.8859403454451475 and parameters: {'splitter': 'best', 'min_samples_split': 0.05353494949529998, 'min_samples_leaf': 0.008884200633787236, 'min_weight_fraction_leaf': 0.024895989903001774, 'max_features': 0.8468411522975746}. Best is trial 677 with value: 0.9113497956229912.[0m
[32m[I 2022-04-21 14:04:44,292][0m Trial 882 finished with value: 0.8804391066728773 and parameters: {'splitter': 'random', 'min_samples_split': 0.07729623357969723, 'min_samples_leaf': 0.021662316517245137, 'min_weight_fraction_leaf': 0.15800298689836706, 'max_features': 0.9429088388216946}. Best is trial 677 with value: 0.9113497956229912.[0m
[32m[I 2022-04-21 14:04:45,555][0m Trial 883 finished with value: 0.9067548055488868 and parameters: {'splitter': 'random', 'min_samples_split': 0.05642611972098332, 'min_samples_leaf': 0.03259050516110623, 'min_weight_fraction_leaf': 0.06762376647981137, 'max_features': 0.9187065380316588}. Best is trial 677 with value: 0.9113497956229912.[0m
[32m[I 2022-04-21 14:04:48,186][0m Trial 884 finished with value: 0.8949116333806597 and parameters: {'splitter': 'random', 'min_samples_split': 0.06977419966794617, 'min_samples_leaf': 0.010691624493119377, 'min_weight_fraction_leaf': 0.008920662599199432, 'max_features': 0.8780662469763701}. Best is trial 677 with value: 0.9113497956229912.[0m
[32m[I 2022-04-21 14:04:50,861][0m Trial 885 finished with value: 0.9034873013225866 and parameters: {'splitter': 'random', 'min_samples_split': 0.049679902028918865, 'min_samples_leaf': 0.025277393303421, 'min_weight_fraction_leaf': 0.046057195143024324, 'max_features': 0.9510617903307885}. Best is trial 677 with value: 0.9113497956229912.[0m
[32m[I 2022-04-21 14:04:52,575][0m Trial 886 finished with value: 0.9088794235055886 and parameters: {'splitter': 'random', 'min_samples_split': 0.06334575644329199, 'min_samples_leaf': 0.040779302814703045, 'min_weight_fraction_leaf': 0.03591154304248906, 'max_features': 0.923420259469502}. Best is trial 677 with value: 0.9113497956229912.[0m
[32m[I 2022-04-21 14:04:54,414][0m Trial 887 finished with value: 0.8988217899154586 and parameters: {'splitter': 'random', 'min_samples_split': 0.06579711854984506, 'min_samples_leaf': 0.056875049137654995, 'min_weight_fraction_leaf': 0.05164063505458327, 'max_features': 0.8976714419292987}. Best is trial 677 with value: 0.9113497956229912.[0m
[32m[I 2022-04-21 14:04:56,108][0m Trial 888 finished with value: 0.9069141428073916 and parameters: {'splitter': 'random', 'min_samples_split': 0.08460231953571924, 'min_samples_leaf': 0.04890839026136628, 'min_weight_fraction_leaf': 0.0603956750481297, 'max_features': 0.9103619311746092}. Best is trial 677 with value: 0.9113497956229912.[0m
[32m[I 2022-04-21 14:04:57,994][0m Trial 889 finished with value: 0.9029674135866971 and parameters: {'splitter': 'random', 'min_samples_split': 0.0738775673966862, 'min_samples_leaf': 0.04227390767838314, 'min_weight_fraction_leaf': 0.03952965369529418, 'max_features': 0.8653324585735447}. Best is trial 677 with value: 0.9113497956229912.[0m
[32m[I 2022-04-21 14:04:59,184][0m Trial 890 finished with value: 0.8994437184889948 and parameters: {'splitter': 'random', 'min_samples_split': 0.06131527504133755, 'min_samples_leaf': 0.0553725680532836, 'min_weight_fraction_leaf': 0.03654023347766592, 'max_features': 0.8878612887168204}. Best is trial 677 with value: 0.9113497956229912.[0m
[32m[I 2022-04-21 14:05:00,888][0m Trial 891 finished with value: 0.9067776908652053 and parameters: {'splitter': 'random', 'min_samples_split': 0.07171004521997343, 'min_samples_leaf': 0.04201382322974123, 'min_weight_fraction_leaf': 0.08207608077919842, 'max_features': 0.923301716839305}. Best is trial 677 with value: 0.9113497956229912.[0m
[32m[I 2022-04-21 14:05:02,296][0m Trial 892 finished with value: 0.9030485291402208 and parameters: {'splitter': 'random', 'min_samples_split': 0.0558308371625867, 'min_samples_leaf': 0.03687711407642573, 'min_weight_fraction_leaf': 0.052607601176437875, 'max_features': 0.9063758221563707}. Best is trial 677 with value: 0.9113497956229912.[0m
[32m[I 2022-04-21 14:05:04,538][0m Trial 893 finished with value: 0.906372481287167 and parameters: {'splitter': 'random', 'min_samples_split': 0.09475286696581954, 'min_samples_leaf': 0.06266414928680808, 'min_weight_fraction_leaf': 0.029732519437756153, 'max_features': 0.9283449563129591}. Best is trial 677 with value: 0.9113497956229912.[0m
[32m[I 2022-04-21 14:05:07,168][0m Trial 894 finished with value: 0.9022210808616185 and parameters: {'splitter': 'random', 'min_samples_split': 0.07910958473603111, 'min_samples_leaf': 0.044991324910649194, 'min_weight_fraction_leaf': 0.04259435050855874, 'max_features': 0.8862927112311292}. Best is trial 677 with value: 0.9113497956229912.[0m
[32m[I 2022-04-21 14:05:09,571][0m Trial 895 finished with value: 0.909537474018656 and parameters: {'splitter': 'random', 'min_samples_split': 0.06107952332252714, 'min_samples_leaf': 0.03483082167604803, 'min_weight_fraction_leaf': 0.018610100428017327, 'max_features': 0.9118879953584564}. Best is trial 677 with value: 0.9113497956229912.[0m
[32m[I 2022-04-21 14:05:11,537][0m Trial 896 finished with value: 0.3425804518366971 and parameters: {'splitter': 'random', 'min_samples_split': 0.04935791449316149, 'min_samples_leaf': 0.030511666122256177, 'min_weight_fraction_leaf': 0.27723977686022966, 'max_features': 0.8567557786173211}. Best is trial 677 with value: 0.9113497956229912.[0m
[32m[I 2022-04-21 14:05:13,459][0m Trial 897 finished with value: 0.9024866643944947 and parameters: {'splitter': 'random', 'min_samples_split': 0.06034481596817147, 'min_samples_leaf': 0.03390324826294208, 'min_weight_fraction_leaf': 0.008663914320225764, 'max_features': 0.901890311654376}. Best is trial 677 with value: 0.9113497956229912.[0m
[32m[I 2022-04-21 14:05:15,206][0m Trial 898 finished with value: 0.8975232357581966 and parameters: {'splitter': 'random', 'min_samples_split': 0.04992241963177447, 'min_samples_leaf': 0.0295647771450491, 'min_weight_fraction_leaf': 0.016142548498417345, 'max_features': 0.9140372267550618}. Best is trial 677 with value: 0.9113497956229912.[0m
[32m[I 2022-04-21 14:05:17,631][0m Trial 899 finished with value: 0.9003514878654002 and parameters: {'splitter': 'random', 'min_samples_split': 0.3170684570065917, 'min_samples_leaf': 0.021608373525802006, 'min_weight_fraction_leaf': 0.020564476885174307, 'max_features': 0.9322951448609058}. Best is trial 677 with value: 0.9113497956229912.[0m
[32m[I 2022-04-21 14:05:19,889][0m Trial 900 finished with value: 0.9016833553306011 and parameters: {'splitter': 'random', 'min_samples_split': 0.0673139071061979, 'min_samples_leaf': 0.034308323533777836, 'min_weight_fraction_leaf': 3.3579836679759056e-06, 'max_features': 0.8679824797584463}. Best is trial 677 with value: 0.9113497956229912.[0m
[32m[I 2022-04-21 14:08:19,373][0m Trial 901 finished with value: 0.889293942685238 and parameters: {'splitter': 'best', 'min_samples_split': 0.047527391626963955, 'min_samples_leaf': 0.0490185331273875, 'min_weight_fraction_leaf': 0.015708020562227077, 'max_features': 0.8859124406348162}. Best is trial 677 with value: 0.9113497956229912.[0m
[32m[I 2022-04-21 14:08:21,566][0m Trial 902 finished with value: 0.8980682271853346 and parameters: {'splitter': 'random', 'min_samples_split': 0.06566949410830854, 'min_samples_leaf': 0.02500785197779663, 'min_weight_fraction_leaf': 0.010056285258401793, 'max_features': 0.9000248025604647}. Best is trial 677 with value: 0.9113497956229912.[0m
[32m[I 2022-04-21 14:08:22,757][0m Trial 903 finished with value: 0.9088794235055886 and parameters: {'splitter': 'random', 'min_samples_split': 0.05702354553221028, 'min_samples_leaf': 0.04052090368796016, 'min_weight_fraction_leaf': 0.023432739344234198, 'max_features': 0.9193755494400997}. Best is trial 677 with value: 0.9113497956229912.[0m
[32m[I 2022-04-21 14:08:24,084][0m Trial 904 finished with value: 0.9060207506120495 and parameters: {'splitter': 'random', 'min_samples_split': 0.05974390027051013, 'min_samples_leaf': 0.01900517172483384, 'min_weight_fraction_leaf': 0.019436243412780052, 'max_features': 0.88206453743972}. Best is trial 677 with value: 0.9113497956229912.[0m
[32m[I 2022-04-21 14:08:26,246][0m Trial 905 finished with value: 0.905878510434842 and parameters: {'splitter': 'random', 'min_samples_split': 0.05308354842973244, 'min_samples_leaf': 0.036368046354165434, 'min_weight_fraction_leaf': 0.009976279650612513, 'max_features': 0.9139170920741334}. Best is trial 677 with value: 0.9113497956229912.[0m
[32m[I 2022-04-21 14:08:28,249][0m Trial 906 finished with value: 0.9073460092318097 and parameters: {'splitter': 'random', 'min_samples_split': 0.06044432783732322, 'min_samples_leaf': 0.02759690050466139, 'min_weight_fraction_leaf': 0.022429271103444504, 'max_features': 0.9371646277613053}. Best is trial 677 with value: 0.9113497956229912.[0m
[32m[I 2022-04-21 14:08:30,473][0m Trial 907 finished with value: 0.9017633805715803 and parameters: {'splitter': 'random', 'min_samples_split': 0.04804519642145449, 'min_samples_leaf': 0.018527940699589057, 'min_weight_fraction_leaf': 0.00796391798747991, 'max_features': 0.9056805573538061}. Best is trial 677 with value: 0.9113497956229912.[0m
[32m[I 2022-04-21 14:08:31,967][0m Trial 908 finished with value: 0.9044081692456045 and parameters: {'splitter': 'random', 'min_samples_split': 0.07692662800919553, 'min_samples_leaf': 0.04217641876582945, 'min_weight_fraction_leaf': 0.0214632830290359, 'max_features': 0.9322761395154766}. Best is trial 677 with value: 0.9113497956229912.[0m
[32m[I 2022-04-21 14:08:33,322][0m Trial 909 finished with value: 0.8995527812218201 and parameters: {'splitter': 'random', 'min_samples_split': 0.06175080966524956, 'min_samples_leaf': 0.029551354086470853, 'min_weight_fraction_leaf': 0.027115556763904147, 'max_features': 0.8760682285639028}. Best is trial 677 with value: 0.9113497956229912.[0m
/media/san2_ssd/data/Workdir/survival/utils.py:305: RuntimeWarning: invalid value encountered in true_divide
  pdfs = np.gradient(1-survs,axis=1)/norms
[32m[I 2022-04-21 14:08:35,739][0m Trial 910 finished with value: 0.8906967819699656 and parameters: {'splitter': 'random', 'min_samples_split': 0.0685093942248878, 'min_samples_leaf': 0.0010858356222593693, 'min_weight_fraction_leaf': 4.3688033167125356e-05, 'max_features': 0.9208034710807321}. Best is trial 677 with value: 0.9113497956229912.[0m
[32m[I 2022-04-21 14:08:38,041][0m Trial 911 finished with value: 0.8985881210310988 and parameters: {'splitter': 'random', 'min_samples_split': 0.05340829705769662, 'min_samples_leaf': 0.01792797213261893, 'min_weight_fraction_leaf': 0.016508751416354973, 'max_features': 0.8979885847553356}. Best is trial 677 with value: 0.9113497956229912.[0m
[32m[I 2022-04-21 14:08:39,845][0m Trial 912 finished with value: 0.8820167393539912 and parameters: {'splitter': 'random', 'min_samples_split': 0.04444672346948851, 'min_samples_leaf': 0.0511489035185492, 'min_weight_fraction_leaf': 0.10193313760428246, 'max_features': 0.9450385754742555}. Best is trial 677 with value: 0.9113497956229912.[0m
[32m[I 2022-04-21 14:08:41,336][0m Trial 913 finished with value: 0.901488817708145 and parameters: {'splitter': 'random', 'min_samples_split': 0.08386736959957329, 'min_samples_leaf': 0.037003818605719795, 'min_weight_fraction_leaf': 0.029909860465177376, 'max_features': 0.8434607448141247}. Best is trial 677 with value: 0.9113497956229912.[0m
[32m[I 2022-04-21 14:08:44,480][0m Trial 914 finished with value: 0.9030125591176745 and parameters: {'splitter': 'random', 'min_samples_split': 0.05671280277479418, 'min_samples_leaf': 0.014794309284150611, 'min_weight_fraction_leaf': 0.009449599528745242, 'max_features': 0.8234321535176978}. Best is trial 677 with value: 0.9113497956229912.[0m
[32m[I 2022-04-21 14:08:47,990][0m Trial 915 finished with value: 0.9083963061501981 and parameters: {'splitter': 'random', 'min_samples_split': 0.07044660516349514, 'min_samples_leaf': 0.02677425437005836, 'min_weight_fraction_leaf': 0.02053315514438862, 'max_features': 0.919861041994366}. Best is trial 677 with value: 0.9113497956229912.[0m
[32m[I 2022-04-21 14:08:50,030][0m Trial 916 finished with value: 0.9041249517985277 and parameters: {'splitter': 'random', 'min_samples_split': 0.047371502947928044, 'min_samples_leaf': 0.010452599478785119, 'min_weight_fraction_leaf': 0.031529741105823586, 'max_features': 0.9482520372028274}. Best is trial 677 with value: 0.9113497956229912.[0m
[32m[I 2022-04-21 14:08:51,770][0m Trial 917 finished with value: 0.9028780373458363 and parameters: {'splitter': 'random', 'min_samples_split': 0.06232639388790516, 'min_samples_leaf': 0.03651592954213947, 'min_weight_fraction_leaf': 0.014468188326453472, 'max_features': 0.8912251549284577}. Best is trial 677 with value: 0.9113497956229912.[0m
[32m[I 2022-04-21 14:08:53,016][0m Trial 918 finished with value: 0.8677556463964734 and parameters: {'splitter': 'random', 'min_samples_split': 0.07026258504821871, 'min_samples_leaf': 0.025606183183194294, 'min_weight_fraction_leaf': 0.025681624133204902, 'max_features': 0.15511550215039538}. Best is trial 677 with value: 0.9113497956229912.[0m
[32m[I 2022-04-21 14:08:54,118][0m Trial 919 finished with value: 0.9035511139963326 and parameters: {'splitter': 'random', 'min_samples_split': 0.08729743815947343, 'min_samples_leaf': 0.051060444195467417, 'min_weight_fraction_leaf': 0.007719832168861339, 'max_features': 0.933295480920286}. Best is trial 677 with value: 0.9113497956229912.[0m
[32m[I 2022-04-21 14:12:43,184][0m Trial 920 finished with value: 0.889756726137867 and parameters: {'splitter': 'best', 'min_samples_split': 0.056036023754923385, 'min_samples_leaf': 0.008121918599286284, 'min_weight_fraction_leaf': 0.03123647843074094, 'max_features': 0.9027850128305811}. Best is trial 677 with value: 0.9113497956229912.[0m
[32m[I 2022-04-21 14:12:44,662][0m Trial 921 finished with value: 0.9020425819370426 and parameters: {'splitter': 'random', 'min_samples_split': 0.0763920791066797, 'min_samples_leaf': 0.04139597433951674, 'min_weight_fraction_leaf': 0.017237760479470468, 'max_features': 0.950901724952178}. Best is trial 677 with value: 0.9113497956229912.[0m
[32m[I 2022-04-21 14:12:45,891][0m Trial 922 finished with value: 0.9082091733943551 and parameters: {'splitter': 'random', 'min_samples_split': 0.044036943576606626, 'min_samples_leaf': 0.021701552436761168, 'min_weight_fraction_leaf': 0.00011563149785522031, 'max_features': 0.919191407960644}. Best is trial 677 with value: 0.9113497956229912.[0m
[32m[I 2022-04-21 14:12:46,944][0m Trial 923 finished with value: 0.897624286948696 and parameters: {'splitter': 'random', 'min_samples_split': 0.05536749739562042, 'min_samples_leaf': 0.03069808773822573, 'min_weight_fraction_leaf': 0.0229319816486727, 'max_features': 0.4939001957281659}. Best is trial 677 with value: 0.9113497956229912.[0m
[32m[I 2022-04-21 14:12:48,047][0m Trial 924 finished with value: 0.3425804518366971 and parameters: {'splitter': 'random', 'min_samples_split': 0.04547287363841703, 'min_samples_leaf': 0.012240646308183363, 'min_weight_fraction_leaf': 0.3044748013225166, 'max_features': 0.8671271358852064}. Best is trial 677 with value: 0.9113497956229912.[0m
[32m[I 2022-04-21 14:12:48,940][0m Trial 925 finished with value: 0.8803243072182646 and parameters: {'splitter': 'random', 'min_samples_split': 0.06693820538215563, 'min_samples_leaf': 0.13478423760637953, 'min_weight_fraction_leaf': 0.03257691066081477, 'max_features': 0.9356624334763346}. Best is trial 677 with value: 0.9113497956229912.[0m
[32m[I 2022-04-21 14:12:49,825][0m Trial 926 finished with value: 0.9068911098091308 and parameters: {'splitter': 'random', 'min_samples_split': 0.07824154033057472, 'min_samples_leaf': 0.07107177284754951, 'min_weight_fraction_leaf': 0.013926639668514748, 'max_features': 0.9126641053721476}. Best is trial 677 with value: 0.9113497956229912.[0m
[32m[I 2022-04-21 14:12:51,058][0m Trial 927 finished with value: 0.9023442930814362 and parameters: {'splitter': 'random', 'min_samples_split': 0.06108120830466471, 'min_samples_leaf': 0.019701347607621284, 'min_weight_fraction_leaf': 0.026189908527996675, 'max_features': 0.956642237292852}. Best is trial 677 with value: 0.9113497956229912.[0m
[32m[I 2022-04-21 14:12:52,797][0m Trial 928 finished with value: 0.8967056284997351 and parameters: {'splitter': 'random', 'min_samples_split': 0.09791836611923796, 'min_samples_leaf': 0.038087318950371526, 'min_weight_fraction_leaf': 0.03599795007716866, 'max_features': 0.8876183847323798}. Best is trial 677 with value: 0.9113497956229912.[0m
[32m[I 2022-04-21 14:12:54,197][0m Trial 929 finished with value: 0.9065877028505916 and parameters: {'splitter': 'random', 'min_samples_split': 0.05103990160524431, 'min_samples_leaf': 0.056195016218309836, 'min_weight_fraction_leaf': 0.008404496642911614, 'max_features': 0.9287782289170333}. Best is trial 677 with value: 0.9113497956229912.[0m
