[32m[I 2022-05-06 20:12:41,605][0m Trial 30 finished with value: 0.5 and parameters: {'loss': 'coxph', 'learning_rate': 0.007665074419728326, 'n_estimators': 219, 'criterion': 'squared_error', 'min_samples_split': 9, 'min_samples_leaf': 6, 'min_weight_fraction_leaf': 0.3050913770738468, 'min_impurity_decrease': 0.5176844527091795, 'max_features': 0.4616439497269111, 'subsample': 0.4589562701855076, 'dropout_rate': 0.2463738324901631, 'ccp_alpha': 0.9604419916789888}. Best is trial 3 with value: 0.5.[0m
[32m[I 2022-05-06 20:20:56,545][0m Trial 31 finished with value: 0.5 and parameters: {'loss': 'coxph', 'learning_rate': 0.0026616937803828843, 'n_estimators': 224, 'criterion': 'friedman_mse', 'min_samples_split': 5, 'min_samples_leaf': 3, 'min_weight_fraction_leaf': 0.14829109635619503, 'min_impurity_decrease': 0.10369062529957847, 'max_features': 0.8808270993989001, 'subsample': 0.36913067089664076, 'dropout_rate': 0.16240843212446082, 'ccp_alpha': 3.9792854708453427}. Best is trial 3 with value: 0.5.[0m
[32m[I 2022-05-06 20:28:15,352][0m Trial 32 finished with value: 0.5 and parameters: {'loss': 'coxph', 'learning_rate': 0.000957258977167899, 'n_estimators': 166, 'criterion': 'friedman_mse', 'min_samples_split': 6, 'min_samples_leaf': 7, 'min_weight_fraction_leaf': 0.44608426808271057, 'min_impurity_decrease': 0.270095974421669, 'max_features': 0.8272036971992593, 'subsample': 0.14075334748273383, 'dropout_rate': 0.6012581176721394, 'ccp_alpha': 1.2800260381616024}. Best is trial 3 with value: 0.5.[0m
[32m[I 2022-05-06 20:39:18,841][0m Trial 33 finished with value: 0.5 and parameters: {'loss': 'coxph', 'learning_rate': 0.0003898524695288289, 'n_estimators': 216, 'criterion': 'absolute_error', 'min_samples_split': 7, 'min_samples_leaf': 6, 'min_weight_fraction_leaf': 0.4399592298499715, 'min_impurity_decrease': 0.5888386132251993, 'max_features': 0.4750886109301826, 'subsample': 0.8082404106405648, 'dropout_rate': 0.23924574090384718, 'ccp_alpha': 0.7855954549622046}. Best is trial 3 with value: 0.5.[0m
/media/san2_ssd/data/Workdir/survival/venv/lib/python3.8/site-packages/sksurv/ensemble/boosting.py:955: RuntimeWarning: divide by zero encountered in log
  time = numpy.log(time)
/media/san2_ssd/data/Workdir/survival/venv/lib/python3.8/site-packages/sksurv/ensemble/boosting.py:955: RuntimeWarning: divide by zero encountered in log
  time = numpy.log(time)
/media/san2_ssd/data/Workdir/survival/venv/lib/python3.8/site-packages/sksurv/ensemble/boosting.py:955: RuntimeWarning: divide by zero encountered in log
  time = numpy.log(time)
/media/san2_ssd/data/Workdir/survival/venv/lib/python3.8/site-packages/sksurv/ensemble/boosting.py:955: RuntimeWarning: divide by zero encountered in log
  time = numpy.log(time)
/media/san2_ssd/data/Workdir/survival/venv/lib/python3.8/site-packages/sksurv/ensemble/boosting.py:955: RuntimeWarning: divide by zero encountered in log
  time = numpy.log(time)
[32m[I 2022-05-06 20:39:18,883][0m Trial 34 finished with value: -1.0 and parameters: {'loss': 'squared', 'learning_rate': 0.00014224810403196475, 'n_estimators': 179, 'criterion': 'absolute_error', 'min_samples_split': 4, 'min_samples_leaf': 7, 'min_weight_fraction_leaf': 0.29545350811105936, 'min_impurity_decrease': 0.09761454047731226, 'max_features': 0.3861247787971024, 'subsample': 0.6785472805494567, 'dropout_rate': 0.5940605152398687, 'ccp_alpha': 0.7219175085050267}. Best is trial 3 with value: 0.5.[0m
[32m[I 2022-05-06 21:13:17,553][0m Trial 35 finished with value: 0.5 and parameters: {'loss': 'coxph', 'learning_rate': 0.024854454660973878, 'n_estimators': 620, 'criterion': 'squared_error', 'min_samples_split': 2, 'min_samples_leaf': 3, 'min_weight_fraction_leaf': 0.081535032061249, 'min_impurity_decrease': 0.7245942056567249, 'max_features': 0.18674882068159537, 'subsample': 0.01976301476203013, 'dropout_rate': 0.3501764513035115, 'ccp_alpha': 4.9162409369049564}. Best is trial 3 with value: 0.5.[0m
[32m[I 2022-05-06 21:28:18,888][0m Trial 36 finished with value: 0.5 and parameters: {'loss': 'coxph', 'learning_rate': 0.00044581691313229653, 'n_estimators': 394, 'criterion': 'squared_error', 'min_samples_split': 3, 'min_samples_leaf': 4, 'min_weight_fraction_leaf': 0.34089593608909924, 'min_impurity_decrease': 0.8905734041474241, 'max_features': 0.009687622533791173, 'subsample': 0.2629972194846661, 'dropout_rate': 0.9336693128860579, 'ccp_alpha': 0.08743534498073657}. Best is trial 3 with value: 0.5.[0m
/media/san2_ssd/data/Workdir/survival/venv/lib/python3.8/site-packages/sksurv/ensemble/boosting.py:955: RuntimeWarning: divide by zero encountered in log
  time = numpy.log(time)
/media/san2_ssd/data/Workdir/survival/venv/lib/python3.8/site-packages/sksurv/ensemble/boosting.py:955: RuntimeWarning: divide by zero encountered in log
  time = numpy.log(time)
/media/san2_ssd/data/Workdir/survival/venv/lib/python3.8/site-packages/sksurv/ensemble/boosting.py:955: RuntimeWarning: divide by zero encountered in log
  time = numpy.log(time)
/media/san2_ssd/data/Workdir/survival/venv/lib/python3.8/site-packages/sksurv/ensemble/boosting.py:955: RuntimeWarning: divide by zero encountered in log
  time = numpy.log(time)
/media/san2_ssd/data/Workdir/survival/venv/lib/python3.8/site-packages/sksurv/ensemble/boosting.py:955: RuntimeWarning: divide by zero encountered in log
  time = numpy.log(time)
[32m[I 2022-05-06 21:28:18,930][0m Trial 37 finished with value: -1.0 and parameters: {'loss': 'squared', 'learning_rate': 0.01651055394428913, 'n_estimators': 348, 'criterion': 'friedman_mse', 'min_samples_split': 3, 'min_samples_leaf': 5, 'min_weight_fraction_leaf': 0.21392850457357523, 'min_impurity_decrease': 0.847539782812076, 'max_features': 0.2843085229393253, 'subsample': 0.26658999726306337, 'dropout_rate': 0.8852209451452137, 'ccp_alpha': 4.509916897042734}. Best is trial 3 with value: 0.5.[0m
[32m[I 2022-05-06 21:31:40,795][0m Trial 38 finished with value: 0.5 and parameters: {'loss': 'coxph', 'learning_rate': 0.041132304168696794, 'n_estimators': 106, 'criterion': 'squared_error', 'min_samples_split': 4, 'min_samples_leaf': 2, 'min_weight_fraction_leaf': 0.25469700588204625, 'min_impurity_decrease': 0.21925261011834885, 'max_features': 0.6433964369998489, 'subsample': 0.50541567619392, 'dropout_rate': 0.7923052202070757, 'ccp_alpha': 3.517511581441779}. Best is trial 3 with value: 0.5.[0m
/media/san2_ssd/data/Workdir/survival/venv/lib/python3.8/site-packages/sksurv/ensemble/boosting.py:955: RuntimeWarning: divide by zero encountered in log
  time = numpy.log(time)
/media/san2_ssd/data/Workdir/survival/venv/lib/python3.8/site-packages/sksurv/ensemble/boosting.py:955: RuntimeWarning: divide by zero encountered in log
  time = numpy.log(time)
/media/san2_ssd/data/Workdir/survival/venv/lib/python3.8/site-packages/sksurv/ensemble/boosting.py:955: RuntimeWarning: divide by zero encountered in log
  time = numpy.log(time)
/media/san2_ssd/data/Workdir/survival/venv/lib/python3.8/site-packages/sksurv/ensemble/boosting.py:955: RuntimeWarning: divide by zero encountered in log
  time = numpy.log(time)
/media/san2_ssd/data/Workdir/survival/venv/lib/python3.8/site-packages/sksurv/ensemble/boosting.py:955: RuntimeWarning: divide by zero encountered in log
  time = numpy.log(time)
[32m[I 2022-05-06 21:31:40,838][0m Trial 39 finished with value: -1.0 and parameters: {'loss': 'squared', 'learning_rate': 0.041321988994252594, 'n_estimators': 438, 'criterion': 'squared_error', 'min_samples_split': 2, 'min_samples_leaf': 1, 'min_weight_fraction_leaf': 0.11822415758385162, 'min_impurity_decrease': 0.94550278889204, 'max_features': 0.24013632658727624, 'subsample': 0.3008154800688336, 'dropout_rate': 0.8988540342024881, 'ccp_alpha': 4.420799427348206}. Best is trial 3 with value: 0.5.[0m
[32m[I 2022-05-06 22:13:44,812][0m Trial 40 finished with value: 0.5 and parameters: {'loss': 'coxph', 'learning_rate': 0.002829581492750061, 'n_estimators': 818, 'criterion': 'squared_error', 'min_samples_split': 5, 'min_samples_leaf': 2, 'min_weight_fraction_leaf': 0.39273452524509256, 'min_impurity_decrease': 0.06901218159738128, 'max_features': 0.658004577741332, 'subsample': 0.1389349488148119, 'dropout_rate': 0.17697061511424306, 'ccp_alpha': 1.8579323735418154}. Best is trial 3 with value: 0.5.[0m
[32m[I 2022-05-06 22:26:16,400][0m Trial 41 finished with value: 0.5 and parameters: {'loss': 'coxph', 'learning_rate': 0.010317803017182178, 'n_estimators': 291, 'criterion': 'squared_error', 'min_samples_split': 3, 'min_samples_leaf': 1, 'min_weight_fraction_leaf': 0.07185391012703382, 'min_impurity_decrease': 0.9883486067347336, 'max_features': 0.9813074171596906, 'subsample': 0.1904067696518698, 'dropout_rate': 0.3954971117939656, 'ccp_alpha': 3.1066928757951}. Best is trial 3 with value: 0.5.[0m
[32m[I 2022-05-06 22:39:35,033][0m Trial 42 finished with value: 0.5 and parameters: {'loss': 'coxph', 'learning_rate': 0.09499301004817114, 'n_estimators': 319, 'criterion': 'squared_error', 'min_samples_split': 4, 'min_samples_leaf': 3, 'min_weight_fraction_leaf': 0.09785258262871888, 'min_impurity_decrease': 0.9152887916540371, 'max_features': 0.14026433056607363, 'subsample': 0.23177796258799935, 'dropout_rate': 0.30347739419952413, 'ccp_alpha': 3.6866953351194347}. Best is trial 3 with value: 0.5.[0m
[32m[I 2022-05-06 22:53:08,454][0m Trial 43 finished with value: 0.5 and parameters: {'loss': 'coxph', 'learning_rate': 0.0014494015406854059, 'n_estimators': 322, 'criterion': 'squared_error', 'min_samples_split': 3, 'min_samples_leaf': 5, 'min_weight_fraction_leaf': 0.22852097778580616, 'min_impurity_decrease': 0.8009124600223005, 'max_features': 0.2752365846617471, 'subsample': 0.2124722411085313, 'dropout_rate': 0.45305874804495894, 'ccp_alpha': 2.866356030365981}. Best is trial 3 with value: 0.5.[0m
[32m[I 2022-05-06 23:10:05,137][0m Trial 44 finished with value: 0.5 and parameters: {'loss': 'coxph', 'learning_rate': 0.0008915814779562575, 'n_estimators': 372, 'criterion': 'squared_error', 'min_samples_split': 2, 'min_samples_leaf': 5, 'min_weight_fraction_leaf': 0.15708315824906932, 'min_impurity_decrease': 0.6951211537855884, 'max_features': 0.026091198098115494, 'subsample': 0.07131305414003555, 'dropout_rate': 0.9957691156043077, 'ccp_alpha': 2.4041493705011083}. Best is trial 3 with value: 0.5.[0m
[32m[I 2022-05-06 23:22:52,008][0m Trial 45 finished with value: 0.5 and parameters: {'loss': 'coxph', 'learning_rate': 0.09532160195944303, 'n_estimators': 248, 'criterion': 'squared_error', 'min_samples_split': 4, 'min_samples_leaf': 5, 'min_weight_fraction_leaf': 0.04280359559376981, 'min_impurity_decrease': 0.14816994597299982, 'max_features': 0.9921189813798933, 'subsample': 0.0050659029917977105, 'dropout_rate': 0.774264394749899, 'ccp_alpha': 3.2894103885541637}. Best is trial 3 with value: 0.5.[0m
/media/san2_ssd/data/Workdir/survival/venv/lib/python3.8/site-packages/sksurv/ensemble/boosting.py:955: RuntimeWarning: divide by zero encountered in log
  time = numpy.log(time)
/media/san2_ssd/data/Workdir/survival/venv/lib/python3.8/site-packages/sksurv/ensemble/boosting.py:955: RuntimeWarning: divide by zero encountered in log
  time = numpy.log(time)
/media/san2_ssd/data/Workdir/survival/venv/lib/python3.8/site-packages/sksurv/ensemble/boosting.py:955: RuntimeWarning: divide by zero encountered in log
  time = numpy.log(time)
/media/san2_ssd/data/Workdir/survival/venv/lib/python3.8/site-packages/sksurv/ensemble/boosting.py:955: RuntimeWarning: divide by zero encountered in log
  time = numpy.log(time)
/media/san2_ssd/data/Workdir/survival/venv/lib/python3.8/site-packages/sksurv/ensemble/boosting.py:955: RuntimeWarning: divide by zero encountered in log
  time = numpy.log(time)
[32m[I 2022-05-06 23:22:52,051][0m Trial 46 finished with value: -1.0 and parameters: {'loss': 'squared', 'learning_rate': 0.051516070641059404, 'n_estimators': 284, 'criterion': 'squared_error', 'min_samples_split': 4, 'min_samples_leaf': 7, 'min_weight_fraction_leaf': 0.15055790352913, 'min_impurity_decrease': 0.8040847484012886, 'max_features': 0.9406879205477751, 'subsample': 0.41285038799861207, 'dropout_rate': 0.7995696914804451, 'ccp_alpha': 3.661179663502128}. Best is trial 3 with value: 0.5.[0m
[32m[I 2022-05-06 23:48:51,989][0m Trial 47 finished with value: 0.5 and parameters: {'loss': 'coxph', 'learning_rate': 0.015263463199007364, 'n_estimators': 477, 'criterion': 'squared_error', 'min_samples_split': 3, 'min_samples_leaf': 1, 'min_weight_fraction_leaf': 0.03877375425084743, 'min_impurity_decrease': 0.9030957490397209, 'max_features': 0.10892177129519595, 'subsample': 0.007674772771005256, 'dropout_rate': 0.33585411449503527, 'ccp_alpha': 3.3595936629541105}. Best is trial 3 with value: 0.5.[0m
[32m[I 2022-05-07 00:01:06,866][0m Trial 48 finished with value: 0.5 and parameters: {'loss': 'coxph', 'learning_rate': 0.005332434093796302, 'n_estimators': 253, 'criterion': 'absolute_error', 'min_samples_split': 5, 'min_samples_leaf': 2, 'min_weight_fraction_leaf': 0.2714443660717843, 'min_impurity_decrease': 0.02002955820345336, 'max_features': 0.7583153987478445, 'subsample': 0.4685167790166046, 'dropout_rate': 0.2733197280020314, 'ccp_alpha': 2.2771057872184057}. Best is trial 3 with value: 0.5.[0m
[32m[I 2022-05-07 00:07:59,450][0m Trial 49 finished with value: 0.5 and parameters: {'loss': 'coxph', 'learning_rate': 0.006871855125810084, 'n_estimators': 148, 'criterion': 'squared_error', 'min_samples_split': 6, 'min_samples_leaf': 2, 'min_weight_fraction_leaf': 0.045901290043323044, 'min_impurity_decrease': 0.4444679068245776, 'max_features': 0.3537858392105344, 'subsample': 0.09722219591305256, 'dropout_rate': 0.4404041554450445, 'ccp_alpha': 1.4878420003169583}. Best is trial 3 with value: 0.5.[0m
[32m[I 2022-05-07 00:16:51,796][0m Trial 50 finished with value: 0.5 and parameters: {'loss': 'coxph', 'learning_rate': 0.003852487802168005, 'n_estimators': 193, 'criterion': 'absolute_error', 'min_samples_split': 5, 'min_samples_leaf': 3, 'min_weight_fraction_leaf': 0.0041328819377667025, 'min_impurity_decrease': 0.044794414674776926, 'max_features': 0.5387080815662613, 'subsample': 0.1757713044692635, 'dropout_rate': 0.10229456710165627, 'ccp_alpha': 2.5635903699347278}. Best is trial 3 with value: 0.5.[0m
[32m[I 2022-05-07 00:23:56,808][0m Trial 51 finished with value: 0.5 and parameters: {'loss': 'coxph', 'learning_rate': 0.00024661096441557206, 'n_estimators': 153, 'criterion': 'absolute_error', 'min_samples_split': 6, 'min_samples_leaf': 6, 'min_weight_fraction_leaf': 0.23898732949688534, 'min_impurity_decrease': 0.46885472416600155, 'max_features': 0.8137647062742914, 'subsample': 0.5534642076698042, 'dropout_rate': 0.6607671238666968, 'ccp_alpha': 1.4191886169707613}. Best is trial 3 with value: 0.5.[0m
[32m[I 2022-05-07 00:34:33,496][0m Trial 52 finished with value: 0.5 and parameters: {'loss': 'coxph', 'learning_rate': 0.0019002565250804525, 'n_estimators': 231, 'criterion': 'absolute_error', 'min_samples_split': 9, 'min_samples_leaf': 6, 'min_weight_fraction_leaf': 0.2889496124246308, 'min_impurity_decrease': 0.14421556097141391, 'max_features': 0.4491889239620647, 'subsample': 0.6495547982245079, 'dropout_rate': 0.22530814088165677, 'ccp_alpha': 1.12635394178813}. Best is trial 3 with value: 0.5.[0m
[32m[I 2022-05-07 00:43:52,272][0m Trial 53 finished with value: 0.5 and parameters: {'loss': 'coxph', 'learning_rate': 0.00017201371180836534, 'n_estimators': 202, 'criterion': 'absolute_error', 'min_samples_split': 7, 'min_samples_leaf': 6, 'min_weight_fraction_leaf': 0.2474351869847901, 'min_impurity_decrease': 0.342757038303311, 'max_features': 0.8119832424936607, 'subsample': 0.5460707229377277, 'dropout_rate': 0.664113013745952, 'ccp_alpha': 0.5493390553458204}. Best is trial 3 with value: 0.5.[0m
[32m[I 2022-05-07 00:51:51,358][0m Trial 54 finished with value: 0.5 and parameters: {'loss': 'coxph', 'learning_rate': 0.0029702906078974043, 'n_estimators': 219, 'criterion': 'friedman_mse', 'min_samples_split': 5, 'min_samples_leaf': 7, 'min_weight_fraction_leaf': 0.38302121559487257, 'min_impurity_decrease': 0.1022351812395822, 'max_features': 0.9174260242101214, 'subsample': 0.37971936739512835, 'dropout_rate': 0.10217933893272833, 'ccp_alpha': 2.066878814745153}. Best is trial 3 with value: 0.5.[0m
[32m[I 2022-05-07 00:57:51,727][0m Trial 55 finished with value: 0.5 and parameters: {'loss': 'coxph', 'learning_rate': 6.557637384620524e-05, 'n_estimators': 187, 'criterion': 'friedman_mse', 'min_samples_split': 9, 'min_samples_leaf': 8, 'min_weight_fraction_leaf': 0.3166326338489331, 'min_impurity_decrease': 0.5700355563577013, 'max_features': 0.7977083200808344, 'subsample': 0.5398497329346175, 'dropout_rate': 0.5525616433124244, 'ccp_alpha': 0.5342001803522953}. Best is trial 3 with value: 0.5.[0m
/media/san2_ssd/data/Workdir/survival/venv/lib/python3.8/site-packages/sksurv/ensemble/boosting.py:955: RuntimeWarning: divide by zero encountered in log
  time = numpy.log(time)
/media/san2_ssd/data/Workdir/survival/venv/lib/python3.8/site-packages/sksurv/ensemble/boosting.py:955: RuntimeWarning: divide by zero encountered in log
  time = numpy.log(time)
/media/san2_ssd/data/Workdir/survival/venv/lib/python3.8/site-packages/sksurv/ensemble/boosting.py:955: RuntimeWarning: divide by zero encountered in log
  time = numpy.log(time)
/media/san2_ssd/data/Workdir/survival/venv/lib/python3.8/site-packages/sksurv/ensemble/boosting.py:955: RuntimeWarning: divide by zero encountered in log
  time = numpy.log(time)
/media/san2_ssd/data/Workdir/survival/venv/lib/python3.8/site-packages/sksurv/ensemble/boosting.py:955: RuntimeWarning: divide by zero encountered in log
  time = numpy.log(time)
[32m[I 2022-05-07 00:57:51,770][0m Trial 56 finished with value: -1.0 and parameters: {'loss': 'squared', 'learning_rate': 0.0010092397428723727, 'n_estimators': 171, 'criterion': 'friedman_mse', 'min_samples_split': 6, 'min_samples_leaf': 7, 'min_weight_fraction_leaf': 0.4575367804229701, 'min_impurity_decrease': 0.20616164601365433, 'max_features': 0.8591992752636017, 'subsample': 0.394257177650457, 'dropout_rate': 0.16361897427604485, 'ccp_alpha': 1.0891920923890812}. Best is trial 3 with value: 0.5.[0m
[32m[I 2022-05-07 01:11:25,682][0m Trial 57 finished with value: 0.5 and parameters: {'loss': 'coxph', 'learning_rate': 7.871312699494844e-05, 'n_estimators': 299, 'criterion': 'friedman_mse', 'min_samples_split': 5, 'min_samples_leaf': 8, 'min_weight_fraction_leaf': 0.0930523921148461, 'min_impurity_decrease': 0.0012500275810607211, 'max_features': 0.7121058068335158, 'subsample': 0.13882807603248667, 'dropout_rate': 0.45990376858051374, 'ccp_alpha': 1.6829877863291849}. Best is trial 3 with value: 0.5.[0m
[32m[I 2022-05-07 01:16:56,702][0m Trial 58 finished with value: 0.5 and parameters: {'loss': 'coxph', 'learning_rate': 0.0005313548034509557, 'n_estimators': 172, 'criterion': 'friedman_mse', 'min_samples_split': 7, 'min_samples_leaf': 6, 'min_weight_fraction_leaf': 0.45496323242439807, 'min_impurity_decrease': 0.5688429873883933, 'max_features': 0.4582038606609005, 'subsample': 0.7509259086393594, 'dropout_rate': 0.23378707292583423, 'ccp_alpha': 0.8835443071833798}. Best is trial 3 with value: 0.5.[0m
[32m[I 2022-05-07 01:21:21,522][0m Trial 59 finished with value: 0.5 and parameters: {'loss': 'coxph', 'learning_rate': 3.655824803419622e-05, 'n_estimators': 134, 'criterion': 'friedman_mse', 'min_samples_split': 8, 'min_samples_leaf': 9, 'min_weight_fraction_leaf': 0.4278501314183889, 'min_impurity_decrease': 0.5051219410631489, 'max_features': 0.7231704974932921, 'subsample': 0.8800714247308588, 'dropout_rate': 0.719368564512061, 'ccp_alpha': 1.654506304391642}. Best is trial 3 with value: 0.5.[0m
[32m[I 2022-05-07 01:26:49,283][0m Trial 60 finished with value: 0.5 and parameters: {'loss': 'coxph', 'learning_rate': 0.0005423975257340621, 'n_estimators': 169, 'criterion': 'friedman_mse', 'min_samples_split': 7, 'min_samples_leaf': 6, 'min_weight_fraction_leaf': 0.45757989624804396, 'min_impurity_decrease': 0.2708023219482587, 'max_features': 0.40132466071371725, 'subsample': 0.7820812464814192, 'dropout_rate': 0.2428192061917396, 'ccp_alpha': 0.8493428229274285}. Best is trial 3 with value: 0.5.[0m
[32m[I 2022-05-07 01:47:00,502][0m Trial 61 finished with value: 0.5762641628349325 and parameters: {'loss': 'coxph', 'learning_rate': 0.0004060176324063035, 'n_estimators': 583, 'criterion': 'friedman_mse', 'min_samples_split': 8, 'min_samples_leaf': 4, 'min_weight_fraction_leaf': 0.43044105214256173, 'min_impurity_decrease': 0.6661769293081478, 'max_features': 0.5172215811318627, 'subsample': 0.8911633992696764, 'dropout_rate': 0.7264386399283097, 'ccp_alpha': 0.22259562115013143}. Best is trial 61 with value: 0.5762641628349325.[0m
[32m[I 2022-05-07 02:15:57,112][0m Trial 62 finished with value: 0.5 and parameters: {'loss': 'coxph', 'learning_rate': 0.00045025952016203617, 'n_estimators': 713, 'criterion': 'friedman_mse', 'min_samples_split': 7, 'min_samples_leaf': 4, 'min_weight_fraction_leaf': 0.3523030342387382, 'min_impurity_decrease': 0.6898533374912702, 'max_features': 0.4122403318560973, 'subsample': 0.888362496428865, 'dropout_rate': 0.04667908230304767, 'ccp_alpha': 4.7465207303766865}. Best is trial 61 with value: 0.5762641628349325.[0m
