[32m[I 2022-04-21 17:49:26,598][0m Trial 495 finished with value: 0.7658405528004703 and parameters: {'splitter': 'random', 'min_samples_split': 0.3027573727653126, 'min_samples_leaf': 0.11888389091859228, 'min_weight_fraction_leaf': 0.08724753501024773, 'max_features': 0.9088688078907983}. Best is trial 441 with value: 0.8118070902918568.[0m
[32m[I 2022-04-21 17:49:27,478][0m Trial 496 finished with value: 0.7752835040527123 and parameters: {'splitter': 'random', 'min_samples_split': 0.2843813548463161, 'min_samples_leaf': 0.09282273265122887, 'min_weight_fraction_leaf': 0.1084489776742901, 'max_features': 0.8755731625062556}. Best is trial 441 with value: 0.8118070902918568.[0m
[32m[I 2022-04-21 17:49:28,347][0m Trial 497 finished with value: 0.7660361862171381 and parameters: {'splitter': 'random', 'min_samples_split': 0.26811561202150946, 'min_samples_leaf': 0.10797047708577626, 'min_weight_fraction_leaf': 0.04831077857504055, 'max_features': 0.9146218197025372}. Best is trial 441 with value: 0.8118070902918568.[0m
[32m[I 2022-04-21 17:49:29,032][0m Trial 498 finished with value: 0.785560883574644 and parameters: {'splitter': 'random', 'min_samples_split': 0.27900160757222525, 'min_samples_leaf': 0.08411436696419687, 'min_weight_fraction_leaf': 0.055469833096985145, 'max_features': 0.9462216663460282}. Best is trial 441 with value: 0.8118070902918568.[0m
[32m[I 2022-04-21 17:49:29,759][0m Trial 499 finished with value: 0.7737414327341314 and parameters: {'splitter': 'random', 'min_samples_split': 0.29194400303455753, 'min_samples_leaf': 0.061021902972048264, 'min_weight_fraction_leaf': 0.07769092461211896, 'max_features': 0.9703886771875729}. Best is trial 441 with value: 0.8118070902918568.[0m
[32m[I 2022-04-21 17:49:30,220][0m Trial 500 finished with value: 0.797004317397622 and parameters: {'splitter': 'random', 'min_samples_split': 0.25458565129851096, 'min_samples_leaf': 0.09789132347523036, 'min_weight_fraction_leaf': 0.04371147422388486, 'max_features': 0.8894941739499211}. Best is trial 441 with value: 0.8118070902918568.[0m
[32m[I 2022-04-21 17:49:30,663][0m Trial 501 finished with value: 0.7860042925264542 and parameters: {'splitter': 'random', 'min_samples_split': 0.2738114528360942, 'min_samples_leaf': 0.07898765318860052, 'min_weight_fraction_leaf': 0.05128977698010919, 'max_features': 0.8563503221237679}. Best is trial 441 with value: 0.8118070902918568.[0m
[32m[I 2022-04-21 17:49:31,275][0m Trial 502 finished with value: 0.8008085001193752 and parameters: {'splitter': 'random', 'min_samples_split': 0.24556379227967196, 'min_samples_leaf': 0.05906474234100259, 'min_weight_fraction_leaf': 0.09767413479637985, 'max_features': 0.9236377234860803}. Best is trial 441 with value: 0.8118070902918568.[0m
[32m[I 2022-04-21 17:49:32,087][0m Trial 503 finished with value: 0.8003298014557689 and parameters: {'splitter': 'random', 'min_samples_split': 0.28844567191395215, 'min_samples_leaf': 0.06245467101462404, 'min_weight_fraction_leaf': 0.08009772323697999, 'max_features': 0.9385187762689173}. Best is trial 441 with value: 0.8118070902918568.[0m
[32m[I 2022-04-21 17:49:32,948][0m Trial 504 finished with value: 0.7713069786155475 and parameters: {'splitter': 'random', 'min_samples_split': 0.27928005553757446, 'min_samples_leaf': 0.06741988389639492, 'min_weight_fraction_leaf': 0.09145097977242088, 'max_features': 0.9626484352395281}. Best is trial 441 with value: 0.8118070902918568.[0m
[32m[I 2022-04-21 17:49:33,450][0m Trial 505 finished with value: 0.7645669710097607 and parameters: {'splitter': 'random', 'min_samples_split': 0.2643253011507399, 'min_samples_leaf': 0.05657070881205259, 'min_weight_fraction_leaf': 0.09146789382459869, 'max_features': 0.9384593072697126}. Best is trial 441 with value: 0.8118070902918568.[0m
[32m[I 2022-04-21 17:49:33,804][0m Trial 506 finished with value: 0.7594491636389396 and parameters: {'splitter': 'random', 'min_samples_split': 0.30437221686802196, 'min_samples_leaf': 0.23437262575259177, 'min_weight_fraction_leaf': 0.06250953529126428, 'max_features': 0.9255619330761454}. Best is trial 441 with value: 0.8118070902918568.[0m
[32m[I 2022-04-21 17:49:34,493][0m Trial 507 finished with value: 0.7645669710097607 and parameters: {'splitter': 'random', 'min_samples_split': 0.28442921817847205, 'min_samples_leaf': 0.0900361950641143, 'min_weight_fraction_leaf': 0.07290285154049275, 'max_features': 0.9454300828532288}. Best is trial 441 with value: 0.8118070902918568.[0m
[32m[I 2022-04-21 17:49:34,997][0m Trial 508 finished with value: 0.8016555385919716 and parameters: {'splitter': 'random', 'min_samples_split': 0.2943105736695822, 'min_samples_leaf': 0.07379328186570722, 'min_weight_fraction_leaf': 0.07325611762027132, 'max_features': 0.9318857818088004}. Best is trial 441 with value: 0.8118070902918568.[0m
[32m[I 2022-04-21 17:49:35,493][0m Trial 509 finished with value: 0.7737414327341314 and parameters: {'splitter': 'random', 'min_samples_split': 0.29303536400100083, 'min_samples_leaf': 0.07081721316672236, 'min_weight_fraction_leaf': 0.0835493240849342, 'max_features': 0.9673720881042672}. Best is trial 441 with value: 0.8118070902918568.[0m
[32m[I 2022-04-21 17:49:35,887][0m Trial 510 finished with value: 0.7989883908314254 and parameters: {'splitter': 'random', 'min_samples_split': 0.26044581329966815, 'min_samples_leaf': 0.13249912635134756, 'min_weight_fraction_leaf': 0.044816432781541356, 'max_features': 0.9037926520058224}. Best is trial 441 with value: 0.8118070902918568.[0m
[32m[I 2022-04-21 17:49:36,363][0m Trial 511 finished with value: 0.810455310005268 and parameters: {'splitter': 'random', 'min_samples_split': 0.2808210658474877, 'min_samples_leaf': 0.07986134685304525, 'min_weight_fraction_leaf': 0.06951578553019652, 'max_features': 0.9187356576593588}. Best is trial 441 with value: 0.8118070902918568.[0m
[32m[I 2022-04-21 17:49:36,781][0m Trial 512 finished with value: 0.7989883908314254 and parameters: {'splitter': 'random', 'min_samples_split': 0.28083262192502206, 'min_samples_leaf': 0.10023451996371051, 'min_weight_fraction_leaf': 0.10435789402614404, 'max_features': 0.8842632188547871}. Best is trial 441 with value: 0.8118070902918568.[0m
[32m[I 2022-04-21 17:49:37,285][0m Trial 513 finished with value: 0.7780192455861134 and parameters: {'splitter': 'random', 'min_samples_split': 0.30513106125800316, 'min_samples_leaf': 0.06474522421922849, 'min_weight_fraction_leaf': 0.0666383930762438, 'max_features': 0.9544854425973834}. Best is trial 441 with value: 0.8118070902918568.[0m
[32m[I 2022-04-21 17:49:37,681][0m Trial 514 finished with value: 0.6851609036733942 and parameters: {'splitter': 'random', 'min_samples_split': 0.274212262929202, 'min_samples_leaf': 0.08920774251375675, 'min_weight_fraction_leaf': 0.3719035167209966, 'max_features': 0.9327243803910948}. Best is trial 441 with value: 0.8118070902918568.[0m
[32m[I 2022-04-21 17:49:38,003][0m Trial 515 finished with value: 0.7594491636389396 and parameters: {'splitter': 'random', 'min_samples_split': 0.24247876616741243, 'min_samples_leaf': 0.21091890963602683, 'min_weight_fraction_leaf': 0.059309338951164074, 'max_features': 0.9015076335433673}. Best is trial 441 with value: 0.8118070902918568.[0m
[32m[I 2022-04-21 17:49:38,804][0m Trial 516 finished with value: 0.775684232099894 and parameters: {'splitter': 'random', 'min_samples_split': 0.276075452598498, 'min_samples_leaf': 0.058456054144168615, 'min_weight_fraction_leaf': 0.09152537056364633, 'max_features': 0.8680818878910159}. Best is trial 441 with value: 0.8118070902918568.[0m
[32m[I 2022-04-21 17:49:39,215][0m Trial 517 finished with value: 0.7655091399278021 and parameters: {'splitter': 'random', 'min_samples_split': 0.2615977425175906, 'min_samples_leaf': 0.10845404130920396, 'min_weight_fraction_leaf': 0.059747604509665486, 'max_features': 0.9131092620898222}. Best is trial 441 with value: 0.8118070902918568.[0m
[32m[I 2022-04-21 17:49:39,670][0m Trial 518 finished with value: 0.8003298014557689 and parameters: {'splitter': 'random', 'min_samples_split': 0.2956997205850086, 'min_samples_leaf': 0.07983099348135411, 'min_weight_fraction_leaf': 0.07966839191503206, 'max_features': 0.9478974596857286}. Best is trial 441 with value: 0.8118070902918568.[0m
[32m[I 2022-04-21 17:49:40,253][0m Trial 519 finished with value: 0.797004317397622 and parameters: {'splitter': 'random', 'min_samples_split': 0.2518688673365682, 'min_samples_leaf': 0.07082719035150085, 'min_weight_fraction_leaf': 0.09645117339616613, 'max_features': 0.903402688245835}. Best is trial 441 with value: 0.8118070902918568.[0m
[32m[I 2022-04-21 17:49:40,897][0m Trial 520 finished with value: 0.7967066593147615 and parameters: {'splitter': 'random', 'min_samples_split': 0.28910428573538133, 'min_samples_leaf': 0.09294905015828168, 'min_weight_fraction_leaf': 0.07414240210173662, 'max_features': 0.8909252057158326}. Best is trial 441 with value: 0.8118070902918568.[0m
[32m[I 2022-04-21 17:49:41,370][0m Trial 521 finished with value: 0.7737414327341314 and parameters: {'splitter': 'random', 'min_samples_split': 0.2680799790233257, 'min_samples_leaf': 0.07198914577571135, 'min_weight_fraction_leaf': 0.07083787406270659, 'max_features': 0.9688559768642562}. Best is trial 441 with value: 0.8118070902918568.[0m
[32m[I 2022-04-21 17:49:41,833][0m Trial 522 finished with value: 0.81037708687203 and parameters: {'splitter': 'random', 'min_samples_split': 0.2616792364215389, 'min_samples_leaf': 0.08312281336059052, 'min_weight_fraction_leaf': 0.08420169840604143, 'max_features': 0.9291320069456632}. Best is trial 441 with value: 0.8118070902918568.[0m
[32m[I 2022-04-21 17:49:42,532][0m Trial 523 finished with value: 0.7821804825595345 and parameters: {'splitter': 'random', 'min_samples_split': 0.27125340749535, 'min_samples_leaf': 0.0989100840181177, 'min_weight_fraction_leaf': 0.0565788249488296, 'max_features': 0.8380931640263614}. Best is trial 441 with value: 0.8118070902918568.[0m
[32m[I 2022-04-21 17:49:43,182][0m Trial 524 finished with value: 0.7731857347031788 and parameters: {'splitter': 'random', 'min_samples_split': 0.29855752826026916, 'min_samples_leaf': 0.1146460876633541, 'min_weight_fraction_leaf': 0.045529288508009184, 'max_features': 0.8674431163848249}. Best is trial 441 with value: 0.8118070902918568.[0m
[32m[I 2022-04-21 17:49:43,936][0m Trial 525 finished with value: 0.810455310005268 and parameters: {'splitter': 'random', 'min_samples_split': 0.2824758135822729, 'min_samples_leaf': 0.061571040971290465, 'min_weight_fraction_leaf': 0.08689689223238953, 'max_features': 0.9130751277491003}. Best is trial 441 with value: 0.8118070902918568.[0m
[32m[I 2022-04-21 17:49:44,270][0m Trial 526 finished with value: 0.6851609036733942 and parameters: {'splitter': 'random', 'min_samples_split': 0.2785822199217695, 'min_samples_leaf': 0.08147858545653681, 'min_weight_fraction_leaf': 0.2636430213504994, 'max_features': 0.8800406929890192}. Best is trial 441 with value: 0.8118070902918568.[0m
[32m[I 2022-04-21 17:49:44,834][0m Trial 527 finished with value: 0.7977496350835417 and parameters: {'splitter': 'random', 'min_samples_split': 0.25546657027291286, 'min_samples_leaf': 0.08929833075849433, 'min_weight_fraction_leaf': 0.043598839846723705, 'max_features': 0.9033306202001788}. Best is trial 441 with value: 0.8118070902918568.[0m
[32m[I 2022-04-21 17:49:45,117][0m Trial 528 finished with value: 0.6851609036733942 and parameters: {'splitter': 'random', 'min_samples_split': 0.30806343669341213, 'min_samples_leaf': 0.4255491325664239, 'min_weight_fraction_leaf': 0.07298770961943685, 'max_features': 0.9359371051605659}. Best is trial 441 with value: 0.8118070902918568.[0m
[32m[I 2022-04-21 17:49:45,454][0m Trial 529 finished with value: 0.6851609036733942 and parameters: {'splitter': 'random', 'min_samples_split': 0.2399607605198155, 'min_samples_leaf': 0.3243398910467956, 'min_weight_fraction_leaf': 0.04266114794816647, 'max_features': 0.9126262972723886}. Best is trial 441 with value: 0.8118070902918568.[0m
[32m[I 2022-04-21 17:49:45,873][0m Trial 530 finished with value: 0.7645669710097607 and parameters: {'splitter': 'random', 'min_samples_split': 0.2857059090507987, 'min_samples_leaf': 0.1051990384737742, 'min_weight_fraction_leaf': 0.06747736829929342, 'max_features': 0.953472882555815}. Best is trial 441 with value: 0.8118070902918568.[0m
[32m[I 2022-04-21 17:49:46,364][0m Trial 531 finished with value: 0.7657343577721109 and parameters: {'splitter': 'random', 'min_samples_split': 0.28410203196286427, 'min_samples_leaf': 0.06384697214340143, 'min_weight_fraction_leaf': 0.10846710351340934, 'max_features': 0.9285395236484152}. Best is trial 441 with value: 0.8118070902918568.[0m
[32m[I 2022-04-21 17:49:46,950][0m Trial 532 finished with value: 0.7967066593147615 and parameters: {'splitter': 'random', 'min_samples_split': 0.295542473010668, 'min_samples_leaf': 0.09346083158278994, 'min_weight_fraction_leaf': 0.05693071792901913, 'max_features': 0.8945192241729254}. Best is trial 441 with value: 0.8118070902918568.[0m
[32m[I 2022-04-21 17:49:47,389][0m Trial 533 finished with value: 0.7737414327341314 and parameters: {'splitter': 'random', 'min_samples_split': 0.26541298585723977, 'min_samples_leaf': 0.08861995898610041, 'min_weight_fraction_leaf': 0.05555306826311281, 'max_features': 0.9743289443943618}. Best is trial 441 with value: 0.8118070902918568.[0m
[32m[I 2022-04-21 17:49:47,720][0m Trial 534 finished with value: 0.7308388579011129 and parameters: {'splitter': 'random', 'min_samples_split': 0.2504517271346539, 'min_samples_leaf': 0.07610792436441652, 'min_weight_fraction_leaf': 0.08064166471445908, 'max_features': 0.25593399622547874}. Best is trial 441 with value: 0.8118070902918568.[0m
[32m[I 2022-04-21 17:49:48,259][0m Trial 535 finished with value: 0.8003404626579271 and parameters: {'splitter': 'random', 'min_samples_split': 0.30572289986339585, 'min_samples_leaf': 0.09930635589849925, 'min_weight_fraction_leaf': 0.04314507896662928, 'max_features': 0.919160652861163}. Best is trial 441 with value: 0.8118070902918568.[0m
[32m[I 2022-04-21 17:49:48,706][0m Trial 536 finished with value: 0.775684232099894 and parameters: {'splitter': 'random', 'min_samples_split': 0.2657925479681874, 'min_samples_leaf': 0.08879799742239024, 'min_weight_fraction_leaf': 0.057104919355195016, 'max_features': 0.8773394331606047}. Best is trial 441 with value: 0.8118070902918568.[0m
[32m[I 2022-04-21 17:49:49,221][0m Trial 537 finished with value: 0.7978584574512089 and parameters: {'splitter': 'random', 'min_samples_split': 0.03979133069818622, 'min_samples_leaf': 0.055040030480545614, 'min_weight_fraction_leaf': 0.0929596486477809, 'max_features': 0.8946673936698447}. Best is trial 441 with value: 0.8118070902918568.[0m
[32m[I 2022-04-21 17:49:49,786][0m Trial 538 finished with value: 0.8016555385919716 and parameters: {'splitter': 'random', 'min_samples_split': 0.27488565604894266, 'min_samples_leaf': 0.06522417831182134, 'min_weight_fraction_leaf': 0.061673575364838355, 'max_features': 0.9416044340745168}. Best is trial 441 with value: 0.8118070902918568.[0m
[32m[I 2022-04-21 17:49:50,495][0m Trial 539 finished with value: 0.6851609036733942 and parameters: {'splitter': 'random', 'min_samples_split': 0.29111341275484504, 'min_samples_leaf': 0.07555152492772083, 'min_weight_fraction_leaf': 0.4214906069820106, 'max_features': 0.9187552407610197}. Best is trial 441 with value: 0.8118070902918568.[0m
[32m[I 2022-04-21 17:49:51,528][0m Trial 540 finished with value: 0.758275987044344 and parameters: {'splitter': 'random', 'min_samples_split': 0.2584706060499534, 'min_samples_leaf': 0.12380474904737843, 'min_weight_fraction_leaf': 0.06324198348524522, 'max_features': 0.8549303636594582}. Best is trial 441 with value: 0.8118070902918568.[0m
[32m[I 2022-04-21 17:49:52,766][0m Trial 541 finished with value: 0.8016555385919716 and parameters: {'splitter': 'random', 'min_samples_split': 0.28543755436748425, 'min_samples_leaf': 0.055944746541029725, 'min_weight_fraction_leaf': 0.06897778721940838, 'max_features': 0.9445011399628076}. Best is trial 441 with value: 0.8118070902918568.[0m
[32m[I 2022-04-21 17:49:53,771][0m Trial 542 finished with value: 0.7970346531254762 and parameters: {'splitter': 'random', 'min_samples_split': 0.2717128760826383, 'min_samples_leaf': 0.07829808055871533, 'min_weight_fraction_leaf': 0.04859770626263853, 'max_features': 0.9059330496391372}. Best is trial 441 with value: 0.8118070902918568.[0m
[32m[I 2022-04-21 17:49:55,276][0m Trial 543 finished with value: 0.775684232099894 and parameters: {'splitter': 'random', 'min_samples_split': 0.2731046742224999, 'min_samples_leaf': 0.08474754624224723, 'min_weight_fraction_leaf': 0.04385590402379635, 'max_features': 0.879322394500535}. Best is trial 441 with value: 0.8118070902918568.[0m
[32m[I 2022-04-21 17:49:56,794][0m Trial 544 finished with value: 0.7963072401901873 and parameters: {'splitter': 'random', 'min_samples_split': 0.246025155501102, 'min_samples_leaf': 0.10933389188202292, 'min_weight_fraction_leaf': 0.06367860557378452, 'max_features': 0.9020136319590961}. Best is trial 441 with value: 0.8118070902918568.[0m
[32m[I 2022-04-21 17:49:57,590][0m Trial 545 finished with value: 0.7717877357158678 and parameters: {'splitter': 'random', 'min_samples_split': 0.2814678177035882, 'min_samples_leaf': 0.09541950537041055, 'min_weight_fraction_leaf': 0.054850875810308175, 'max_features': 0.9582865226121717}. Best is trial 441 with value: 0.8118070902918568.[0m
[32m[I 2022-04-21 17:49:58,280][0m Trial 546 finished with value: 0.8010874511114974 and parameters: {'splitter': 'random', 'min_samples_split': 0.2573435313632588, 'min_samples_leaf': 0.06796540207320109, 'min_weight_fraction_leaf': 0.05403129789236852, 'max_features': 0.9382506966729913}. Best is trial 441 with value: 0.8118070902918568.[0m
[32m[I 2022-04-21 17:49:58,614][0m Trial 547 finished with value: 0.7595444725272662 and parameters: {'splitter': 'random', 'min_samples_split': 0.3031637051427632, 'min_samples_leaf': 0.17683832070590771, 'min_weight_fraction_leaf': 0.08077917312018972, 'max_features': 0.9677706401675424}. Best is trial 441 with value: 0.8118070902918568.[0m
[32m[I 2022-04-21 17:49:59,107][0m Trial 548 finished with value: 0.8016555385919716 and parameters: {'splitter': 'random', 'min_samples_split': 0.27869231030995784, 'min_samples_leaf': 0.06882581557436127, 'min_weight_fraction_leaf': 0.03976797825174107, 'max_features': 0.9322729216510137}. Best is trial 441 with value: 0.8118070902918568.[0m
[32m[I 2022-04-21 17:49:59,610][0m Trial 549 finished with value: 0.791108541178912 and parameters: {'splitter': 'random', 'min_samples_split': 0.26814732902307653, 'min_samples_leaf': 0.05595152543767798, 'min_weight_fraction_leaf': 0.10037661441547266, 'max_features': 0.9181823592595355}. Best is trial 441 with value: 0.8118070902918568.[0m
[32m[I 2022-04-21 17:49:59,864][0m Trial 550 finished with value: 0.5 and parameters: {'splitter': 'random', 'min_samples_split': 0.26805537740061713, 'min_samples_leaf': 0.06952362782223558, 'min_weight_fraction_leaf': 0.08188507391475357, 'max_features': 0.07778142188586468}. Best is trial 441 with value: 0.8118070902918568.[0m
[32m[I 2022-04-21 17:50:00,374][0m Trial 551 finished with value: 0.7966546589745455 and parameters: {'splitter': 'random', 'min_samples_split': 0.2567103818907036, 'min_samples_leaf': 0.0814510852902968, 'min_weight_fraction_leaf': 0.04040543160443008, 'max_features': 0.887592190875822}. Best is trial 441 with value: 0.8118070902918568.[0m
[32m[I 2022-04-21 17:50:01,067][0m Trial 552 finished with value: 0.8032272519689826 and parameters: {'splitter': 'random', 'min_samples_split': 0.29001108668354086, 'min_samples_leaf': 0.06446829957695321, 'min_weight_fraction_leaf': 0.08718038996094425, 'max_features': 0.9767790923957674}. Best is trial 441 with value: 0.8118070902918568.[0m
[32m[I 2022-04-21 17:50:01,352][0m Trial 553 finished with value: 0.6851609036733942 and parameters: {'splitter': 'random', 'min_samples_split': 0.2980468953108615, 'min_samples_leaf': 0.2952605195386552, 'min_weight_fraction_leaf': 0.07503075307392024, 'max_features': 0.9539541995382536}. Best is trial 441 with value: 0.8118070902918568.[0m
[32m[I 2022-04-21 17:50:01,849][0m Trial 554 finished with value: 0.8016555385919716 and parameters: {'splitter': 'random', 'min_samples_split': 0.2926460545076905, 'min_samples_leaf': 0.07651489592838645, 'min_weight_fraction_leaf': 0.07312435887241567, 'max_features': 0.93380166066407}. Best is trial 441 with value: 0.8118070902918568.[0m
[32m[I 2022-04-21 17:50:02,535][0m Trial 555 finished with value: 0.7903629432041878 and parameters: {'splitter': 'random', 'min_samples_split': 0.09621648083461959, 'min_samples_leaf': 0.10107440636549186, 'min_weight_fraction_leaf': 0.09320763276960126, 'max_features': 0.9196252362643633}. Best is trial 441 with value: 0.8118070902918568.[0m
[32m[I 2022-04-21 17:50:03,208][0m Trial 556 finished with value: 0.7590531836201678 and parameters: {'splitter': 'random', 'min_samples_split': 0.24105384150373957, 'min_samples_leaf': 0.08819876100941439, 'min_weight_fraction_leaf': 0.1863953905331004, 'max_features': 0.8604118928763809}. Best is trial 441 with value: 0.8118070902918568.[0m
[32m[I 2022-04-21 17:50:04,081][0m Trial 557 finished with value: 0.7967066593147615 and parameters: {'splitter': 'random', 'min_samples_split': 0.28095175980822323, 'min_samples_leaf': 0.056845711887379295, 'min_weight_fraction_leaf': 0.08492821076045902, 'max_features': 0.8929414938863423}. Best is trial 441 with value: 0.8118070902918568.[0m
