[32m[I 2022-04-21 12:23:12,791][0m Trial 311 finished with value: 0.903499310317087 and parameters: {'splitter': 'random', 'min_samples_split': 0.060581980477688896, 'min_samples_leaf': 0.04055176206325004, 'min_weight_fraction_leaf': 0.05659782806087253, 'max_features': 0.9423473790041774}. Best is trial 253 with value: 0.9108382257790575.[0m
[32m[I 2022-04-21 12:23:13,594][0m Trial 312 finished with value: 0.8797245818194697 and parameters: {'splitter': 'random', 'min_samples_split': 0.019392479234685785, 'min_samples_leaf': 0.23532521007769244, 'min_weight_fraction_leaf': 0.027801855971361235, 'max_features': 0.9199306581063865}. Best is trial 253 with value: 0.9108382257790575.[0m
[32m[I 2022-04-21 12:23:15,246][0m Trial 313 finished with value: 0.9055906163461683 and parameters: {'splitter': 'random', 'min_samples_split': 0.031161135404267546, 'min_samples_leaf': 0.009081728077487378, 'min_weight_fraction_leaf': 0.017742753419715044, 'max_features': 0.9731249632501313}. Best is trial 253 with value: 0.9108382257790575.[0m
[32m[I 2022-04-21 12:23:16,394][0m Trial 314 finished with value: 0.9000837539538395 and parameters: {'splitter': 'random', 'min_samples_split': 0.04262653924191365, 'min_samples_leaf': 0.030064257021615755, 'min_weight_fraction_leaf': 0.04576988327997618, 'max_features': 0.8624089733577915}. Best is trial 253 with value: 0.9108382257790575.[0m
[32m[I 2022-04-21 12:23:17,384][0m Trial 315 finished with value: 0.9010934120632308 and parameters: {'splitter': 'random', 'min_samples_split': 0.06105590438612891, 'min_samples_leaf': 0.048557567433547257, 'min_weight_fraction_leaf': 0.03513775926641953, 'max_features': 0.9057106262808197}. Best is trial 253 with value: 0.9108382257790575.[0m
[32m[I 2022-04-21 12:23:18,535][0m Trial 316 finished with value: 0.9034327170609309 and parameters: {'splitter': 'random', 'min_samples_split': 0.008909965628440117, 'min_samples_leaf': 0.02162836558485137, 'min_weight_fraction_leaf': 0.055498306181043316, 'max_features': 0.9353581508057918}. Best is trial 253 with value: 0.9108382257790575.[0m
[32m[I 2022-04-21 12:23:37,813][0m Trial 317 finished with value: 0.2828328603381454 and parameters: {'splitter': 'best', 'min_samples_split': 0.03379029247265462, 'min_samples_leaf': 0.32309097774265433, 'min_weight_fraction_leaf': 0.17091710788782477, 'max_features': 0.88754967312733}. Best is trial 253 with value: 0.9108382257790575.[0m
[32m[I 2022-04-21 12:23:38,890][0m Trial 318 finished with value: 0.8880210403230588 and parameters: {'splitter': 'random', 'min_samples_split': 0.27211448874139077, 'min_samples_leaf': 0.058269897660060264, 'min_weight_fraction_leaf': 0.02496485102111228, 'max_features': 0.9540086500443106}. Best is trial 253 with value: 0.9108382257790575.[0m
[32m[I 2022-04-21 12:23:40,849][0m Trial 319 finished with value: 0.8823570752356737 and parameters: {'splitter': 'random', 'min_samples_split': 0.05085196585453267, 'min_samples_leaf': 0.03382823432606037, 'min_weight_fraction_leaf': 0.04609545266272602, 'max_features': 0.2512798685771229}. Best is trial 253 with value: 0.9108382257790575.[0m
[32m[I 2022-04-21 12:23:42,548][0m Trial 320 finished with value: 0.906372481287167 and parameters: {'splitter': 'random', 'min_samples_split': 0.017434547604481942, 'min_samples_leaf': 0.011265226825165084, 'min_weight_fraction_leaf': 0.06274150989687469, 'max_features': 0.926652331046808}. Best is trial 253 with value: 0.9108382257790575.[0m
[32m[I 2022-04-21 12:23:45,039][0m Trial 321 finished with value: 0.9027453514333846 and parameters: {'splitter': 'random', 'min_samples_split': 0.04036126932768351, 'min_samples_leaf': 0.042179576052653434, 'min_weight_fraction_leaf': 0.011194736117961604, 'max_features': 0.9040376964039248}. Best is trial 253 with value: 0.9108382257790575.[0m
[32m[I 2022-04-21 12:23:46,639][0m Trial 322 finished with value: 0.9018094977324141 and parameters: {'splitter': 'random', 'min_samples_split': 0.0010680331470146118, 'min_samples_leaf': 0.022572772145035815, 'min_weight_fraction_leaf': 0.036806599824931015, 'max_features': 0.9427623578554497}. Best is trial 253 with value: 0.9108382257790575.[0m
[32m[I 2022-04-21 12:23:48,237][0m Trial 323 finished with value: 0.8962083104568632 and parameters: {'splitter': 'random', 'min_samples_split': 0.06159850940597529, 'min_samples_leaf': 0.034802785081538876, 'min_weight_fraction_leaf': 0.024752824163900917, 'max_features': 0.6522002858542327}. Best is trial 253 with value: 0.9108382257790575.[0m
[32m[I 2022-04-21 12:23:49,126][0m Trial 324 finished with value: 0.9064367313313747 and parameters: {'splitter': 'random', 'min_samples_split': 0.028102611082092523, 'min_samples_leaf': 0.05055044702712231, 'min_weight_fraction_leaf': 0.05101683428792396, 'max_features': 0.7484657140219229}. Best is trial 253 with value: 0.9108382257790575.[0m
[32m[I 2022-04-21 12:23:50,261][0m Trial 325 finished with value: 0.9042801918520468 and parameters: {'splitter': 'random', 'min_samples_split': 0.07566844891640424, 'min_samples_leaf': 0.018643466357906802, 'min_weight_fraction_leaf': 0.036964564921303525, 'max_features': 0.9137352696273072}. Best is trial 253 with value: 0.9108382257790575.[0m
[32m[I 2022-04-21 12:23:52,214][0m Trial 326 finished with value: 0.8880781244054525 and parameters: {'splitter': 'random', 'min_samples_split': 0.05249069940523753, 'min_samples_leaf': 0.008490584017721273, 'min_weight_fraction_leaf': 0.07664555738853479, 'max_features': 0.8774093830849263}. Best is trial 253 with value: 0.9108382257790575.[0m
[32m[I 2022-04-21 12:23:54,508][0m Trial 327 finished with value: 0.9026286545510651 and parameters: {'splitter': 'random', 'min_samples_split': 0.021973751714634174, 'min_samples_leaf': 0.027309954066701406, 'min_weight_fraction_leaf': 0.015082585255886818, 'max_features': 0.9766375402298699}. Best is trial 253 with value: 0.9108382257790575.[0m
[32m[I 2022-04-21 12:23:56,128][0m Trial 328 finished with value: 0.7999334701884966 and parameters: {'splitter': 'random', 'min_samples_split': 0.350919379253381, 'min_samples_leaf': 0.03817118021453506, 'min_weight_fraction_leaf': 0.04454727713102067, 'max_features': 0.932285923428485}. Best is trial 253 with value: 0.9108382257790575.[0m
[32m[I 2022-04-21 12:23:58,695][0m Trial 329 finished with value: 0.9001845856327348 and parameters: {'splitter': 'random', 'min_samples_split': 0.06639572604557123, 'min_samples_leaf': 0.02524230209301823, 'min_weight_fraction_leaf': 0.06618844461377041, 'max_features': 0.8980064951626114}. Best is trial 253 with value: 0.9108382257790575.[0m
[32m[I 2022-04-21 12:24:00,088][0m Trial 330 finished with value: 0.9026499938596528 and parameters: {'splitter': 'random', 'min_samples_split': 0.03541908524541741, 'min_samples_leaf': 0.048727309536986105, 'min_weight_fraction_leaf': 0.0316898593133689, 'max_features': 0.9572506725598859}. Best is trial 253 with value: 0.9108382257790575.[0m
[32m[I 2022-04-21 12:24:02,216][0m Trial 331 finished with value: 0.9062228404242789 and parameters: {'splitter': 'random', 'min_samples_split': 0.048355874715330975, 'min_samples_leaf': 0.06463530707885841, 'min_weight_fraction_leaf': 0.05431081568922767, 'max_features': 0.9205321256145182}. Best is trial 253 with value: 0.9108382257790575.[0m
[32m[I 2022-04-21 12:24:03,562][0m Trial 332 finished with value: 0.8994941954157127 and parameters: {'splitter': 'random', 'min_samples_split': 0.011718776431211744, 'min_samples_leaf': 0.0032987394989366647, 'min_weight_fraction_leaf': 0.14786187795289485, 'max_features': 0.891072074938611}. Best is trial 253 with value: 0.9108382257790575.[0m
[32m[I 2022-04-21 12:24:05,166][0m Trial 333 finished with value: 0.8997087555716293 and parameters: {'splitter': 'random', 'min_samples_split': 0.04235761918103783, 'min_samples_leaf': 0.017724423792986953, 'min_weight_fraction_leaf': 0.0011303562773491461, 'max_features': 0.9392574821616236}. Best is trial 253 with value: 0.9108382257790575.[0m
[32m[I 2022-04-21 12:24:06,697][0m Trial 334 finished with value: 0.9014252783172308 and parameters: {'splitter': 'random', 'min_samples_split': 0.05898857476459184, 'min_samples_leaf': 0.03537334895994047, 'min_weight_fraction_leaf': 0.02165155210447173, 'max_features': 0.8557124643301351}. Best is trial 253 with value: 0.9108382257790575.[0m
[32m[I 2022-04-21 12:24:09,031][0m Trial 335 finished with value: 0.9099889314668935 and parameters: {'splitter': 'random', 'min_samples_split': 0.07721508542637821, 'min_samples_leaf': 0.042329947529253856, 'min_weight_fraction_leaf': 0.04078662256391041, 'max_features': 0.9135692112544671}. Best is trial 253 with value: 0.9108382257790575.[0m
[32m[I 2022-04-21 12:25:55,199][0m Trial 336 finished with value: 0.7840542345537634 and parameters: {'splitter': 'best', 'min_samples_split': 0.08523600995798288, 'min_samples_leaf': 0.06035425653240701, 'min_weight_fraction_leaf': 0.1288614952244384, 'max_features': 0.8806192231404293}. Best is trial 253 with value: 0.9108382257790575.[0m
[32m[I 2022-04-21 12:25:56,219][0m Trial 337 finished with value: 0.9068422141505674 and parameters: {'splitter': 'random', 'min_samples_split': 0.07270786979131741, 'min_samples_leaf': 0.04574935469895229, 'min_weight_fraction_leaf': 0.033789559395609375, 'max_features': 0.9077962417879427}. Best is trial 253 with value: 0.9108382257790575.[0m
[32m[I 2022-04-21 12:25:57,183][0m Trial 338 finished with value: 0.8815604621118179 and parameters: {'splitter': 'random', 'min_samples_split': 0.08021815281664986, 'min_samples_leaf': 0.05551912850614915, 'min_weight_fraction_leaf': 0.030700590231708902, 'max_features': 0.4040780289310714}. Best is trial 253 with value: 0.9108382257790575.[0m
[32m[I 2022-04-21 12:25:58,324][0m Trial 339 finished with value: 0.9003019757272849 and parameters: {'splitter': 'random', 'min_samples_split': 0.07446813755879136, 'min_samples_leaf': 0.06952866008012182, 'min_weight_fraction_leaf': 0.018827614234003295, 'max_features': 0.9016091258637579}. Best is trial 253 with value: 0.9108382257790575.[0m
[32m[I 2022-04-21 12:25:59,782][0m Trial 340 finished with value: 0.8933618417468097 and parameters: {'splitter': 'random', 'min_samples_split': 0.01746983295635205, 'min_samples_leaf': 0.0511864362311444, 'min_weight_fraction_leaf': 0.01088095685803846, 'max_features': 0.8355018712020107}. Best is trial 253 with value: 0.9108382257790575.[0m
[32m[I 2022-04-21 12:26:01,601][0m Trial 341 finished with value: 0.8972949795673385 and parameters: {'splitter': 'random', 'min_samples_split': 0.06706587376837403, 'min_samples_leaf': 0.038562197477131986, 'min_weight_fraction_leaf': 0.041501764526542126, 'max_features': 0.9596157915016341}. Best is trial 253 with value: 0.9108382257790575.[0m
[32m[I 2022-04-21 12:26:03,479][0m Trial 342 finished with value: 0.9068079156547334 and parameters: {'splitter': 'random', 'min_samples_split': 0.026228749858417572, 'min_samples_leaf': 0.029632656510253125, 'min_weight_fraction_leaf': 0.05609597461847718, 'max_features': 0.9855391311087836}. Best is trial 253 with value: 0.9108382257790575.[0m
[32m[I 2022-04-21 12:26:05,227][0m Trial 343 finished with value: 0.9027521621117234 and parameters: {'splitter': 'random', 'min_samples_split': 0.33726747458219064, 'min_samples_leaf': 0.08700065374529858, 'min_weight_fraction_leaf': 0.04338925710406158, 'max_features': 0.9269828601326492}. Best is trial 253 with value: 0.9108382257790575.[0m
[32m[I 2022-04-21 12:26:07,103][0m Trial 344 finished with value: 0.9034873013225866 and parameters: {'splitter': 'random', 'min_samples_split': 0.0910783493672665, 'min_samples_leaf': 0.045731041998667676, 'min_weight_fraction_leaf': 0.027790573845078256, 'max_features': 0.9408831550444199}. Best is trial 253 with value: 0.9108382257790575.[0m
[32m[I 2022-04-21 12:26:08,478][0m Trial 345 finished with value: 0.9016791287078936 and parameters: {'splitter': 'random', 'min_samples_split': 0.00823325243806853, 'min_samples_leaf': 0.013246059223612725, 'min_weight_fraction_leaf': 0.03439161820432812, 'max_features': 0.865869314133782}. Best is trial 253 with value: 0.9108382257790575.[0m
[32m[I 2022-04-21 12:26:10,456][0m Trial 346 finished with value: 0.9067548055488868 and parameters: {'splitter': 'random', 'min_samples_split': 0.035557419098309784, 'min_samples_leaf': 0.033170333183957165, 'min_weight_fraction_leaf': 0.06759174207592053, 'max_features': 0.9177046024891496}. Best is trial 253 with value: 0.9108382257790575.[0m
[32m[I 2022-04-21 12:26:12,459][0m Trial 347 finished with value: 0.9046404359471021 and parameters: {'splitter': 'random', 'min_samples_split': 0.10397961913822934, 'min_samples_leaf': 0.001432190515061528, 'min_weight_fraction_leaf': 0.049794395268977346, 'max_features': 0.9530796338837876}. Best is trial 253 with value: 0.9108382257790575.[0m
[32m[I 2022-04-21 12:26:13,401][0m Trial 348 finished with value: 0.3425804518366971 and parameters: {'splitter': 'random', 'min_samples_split': 0.056530802796353245, 'min_samples_leaf': 0.45709235774925294, 'min_weight_fraction_leaf': 0.020760533145220632, 'max_features': 0.8911564121060054}. Best is trial 253 with value: 0.9108382257790575.[0m
[32m[I 2022-04-21 12:26:14,443][0m Trial 349 finished with value: 0.9066476863686745 and parameters: {'splitter': 'random', 'min_samples_split': 0.07410827871356962, 'min_samples_leaf': 0.04494423677120225, 'min_weight_fraction_leaf': 0.008274289427996209, 'max_features': 0.9085807536234544}. Best is trial 253 with value: 0.9108382257790575.[0m
[32m[I 2022-04-21 12:26:16,174][0m Trial 350 finished with value: 0.9016038914991201 and parameters: {'splitter': 'random', 'min_samples_split': 0.08622987928567213, 'min_samples_leaf': 0.025615614090855186, 'min_weight_fraction_leaf': 0.03446671399939749, 'max_features': 0.8784796790699325}. Best is trial 253 with value: 0.9108382257790575.[0m
[32m[I 2022-04-21 12:26:17,186][0m Trial 351 finished with value: 0.25 and parameters: {'splitter': 'random', 'min_samples_split': 0.001089802023311326, 'min_samples_leaf': 0.10221335524188582, 'min_weight_fraction_leaf': 0.05793392736241437, 'max_features': 0.14998706586892552}. Best is trial 253 with value: 0.9108382257790575.[0m
[32m[I 2022-04-21 12:26:18,705][0m Trial 352 finished with value: 0.8988217899154586 and parameters: {'splitter': 'random', 'min_samples_split': 0.067314133269884, 'min_samples_leaf': 0.05813584142442978, 'min_weight_fraction_leaf': 0.02449612685164812, 'max_features': 0.9042435796762139}. Best is trial 253 with value: 0.9108382257790575.[0m
[32m[I 2022-04-21 12:26:19,792][0m Trial 353 finished with value: 0.25 and parameters: {'splitter': 'random', 'min_samples_split': 0.07745661956962943, 'min_samples_leaf': 0.49597703330692544, 'min_weight_fraction_leaf': 0.03523965463768934, 'max_features': 0.9334230847186752}. Best is trial 253 with value: 0.9108382257790575.[0m
[32m[I 2022-04-21 12:26:22,351][0m Trial 354 finished with value: 0.9034323451798973 and parameters: {'splitter': 'random', 'min_samples_split': 0.04266661554844353, 'min_samples_leaf': 0.01717526059822194, 'min_weight_fraction_leaf': 0.046703760949228415, 'max_features': 0.9749114135321878}. Best is trial 253 with value: 0.9108382257790575.[0m
[32m[I 2022-04-21 12:26:24,255][0m Trial 355 finished with value: 0.9093247923494931 and parameters: {'splitter': 'random', 'min_samples_split': 0.05460132517181978, 'min_samples_leaf': 0.04274831078878413, 'min_weight_fraction_leaf': 0.018145266055947122, 'max_features': 0.9206065217343594}. Best is trial 253 with value: 0.9108382257790575.[0m
[32m[I 2022-04-21 12:29:08,104][0m Trial 356 finished with value: 0.8840429602940392 and parameters: {'splitter': 'best', 'min_samples_split': 0.021867364491442796, 'min_samples_leaf': 0.03442920753431605, 'min_weight_fraction_leaf': 0.013132409407293448, 'max_features': 0.944324747323433}. Best is trial 253 with value: 0.9108382257790575.[0m
[32m[I 2022-04-21 12:29:09,547][0m Trial 357 finished with value: 0.9010934120632308 and parameters: {'splitter': 'random', 'min_samples_split': 0.04998441061262752, 'min_samples_leaf': 0.0477816286963962, 'min_weight_fraction_leaf': 0.018785366966922856, 'max_features': 0.8904271635529059}. Best is trial 253 with value: 0.9108382257790575.[0m
[32m[I 2022-04-21 12:29:12,163][0m Trial 358 finished with value: 0.9022770194628515 and parameters: {'splitter': 'random', 'min_samples_split': 0.05322773890265015, 'min_samples_leaf': 0.026465641863771303, 'min_weight_fraction_leaf': 0.02790190333586004, 'max_features': 0.9644877945844466}. Best is trial 253 with value: 0.9108382257790575.[0m
[32m[I 2022-04-21 12:29:14,245][0m Trial 359 finished with value: 0.9022120742478654 and parameters: {'splitter': 'random', 'min_samples_split': 0.03127475054010233, 'min_samples_leaf': 0.017843002163209408, 'min_weight_fraction_leaf': 0.012244784692881254, 'max_features': 0.931192248738119}. Best is trial 253 with value: 0.9108382257790575.[0m
[32m[I 2022-04-21 12:29:15,021][0m Trial 360 finished with value: 0.8870199524338682 and parameters: {'splitter': 'random', 'min_samples_split': 0.1868973392600796, 'min_samples_leaf': 0.07292306051231881, 'min_weight_fraction_leaf': 0.006608265770463435, 'max_features': 0.4846749224378172}. Best is trial 253 with value: 0.9108382257790575.[0m
[32m[I 2022-04-21 12:29:16,746][0m Trial 361 finished with value: 0.8977920326768191 and parameters: {'splitter': 'random', 'min_samples_split': 0.01416212978383569, 'min_samples_leaf': 0.010284808072336971, 'min_weight_fraction_leaf': 0.0011206891026123746, 'max_features': 0.9191134289213451}. Best is trial 253 with value: 0.9108382257790575.[0m
[32m[I 2022-04-21 12:29:17,965][0m Trial 362 finished with value: 0.8785678178918717 and parameters: {'splitter': 'random', 'min_samples_split': 0.4131442321934244, 'min_samples_leaf': 0.2047978981527981, 'min_weight_fraction_leaf': 0.0815061971473971, 'max_features': 0.8639018582642481}. Best is trial 253 with value: 0.9108382257790575.[0m
[32m[I 2022-04-21 12:29:18,910][0m Trial 363 finished with value: 0.8938377260231942 and parameters: {'splitter': 'random', 'min_samples_split': 0.13888563548219168, 'min_samples_leaf': 0.03770453856596909, 'min_weight_fraction_leaf': 0.025888475876908037, 'max_features': 0.9554651012240531}. Best is trial 253 with value: 0.9108382257790575.[0m
[32m[I 2022-04-21 12:29:19,792][0m Trial 364 finished with value: 0.9007440633082086 and parameters: {'splitter': 'random', 'min_samples_split': 0.06539650595388224, 'min_samples_leaf': 0.05478764883875165, 'min_weight_fraction_leaf': 0.036081013573881195, 'max_features': 0.780686100797193}. Best is trial 253 with value: 0.9108382257790575.[0m
[32m[I 2022-04-21 12:29:20,784][0m Trial 365 finished with value: 0.8890324866556616 and parameters: {'splitter': 'random', 'min_samples_split': 0.07815642111568352, 'min_samples_leaf': 0.044957794950202495, 'min_weight_fraction_leaf': 0.025771352924286187, 'max_features': 0.8209240157166262}. Best is trial 253 with value: 0.9108382257790575.[0m
[32m[I 2022-04-21 12:29:21,730][0m Trial 366 finished with value: 0.8984829468678516 and parameters: {'splitter': 'random', 'min_samples_split': 0.23158015844653615, 'min_samples_leaf': 0.03665778039403214, 'min_weight_fraction_leaf': 0.06390424368353034, 'max_features': 0.9039831716948776}. Best is trial 253 with value: 0.9108382257790575.[0m
[32m[I 2022-04-21 12:29:22,853][0m Trial 367 finished with value: 0.9035160154447034 and parameters: {'splitter': 'random', 'min_samples_split': 0.03631998258285397, 'min_samples_leaf': 0.023251293992334523, 'min_weight_fraction_leaf': 0.04381755033683987, 'max_features': 0.9309023657811648}. Best is trial 253 with value: 0.9108382257790575.[0m
[32m[I 2022-04-21 12:29:23,781][0m Trial 368 finished with value: 0.9030894874750539 and parameters: {'splitter': 'random', 'min_samples_split': 0.06511977742020922, 'min_samples_leaf': 0.042784976241480074, 'min_weight_fraction_leaf': 0.016585115242353468, 'max_features': 0.8844232001283818}. Best is trial 253 with value: 0.9108382257790575.[0m
[32m[I 2022-04-21 12:29:24,770][0m Trial 369 finished with value: 0.9064039744936121 and parameters: {'splitter': 'random', 'min_samples_split': 0.09534133838002053, 'min_samples_leaf': 0.06584294414413625, 'min_weight_fraction_leaf': 0.0350426189407123, 'max_features': 0.910708509363738}. Best is trial 253 with value: 0.9108382257790575.[0m
[32m[I 2022-04-21 12:29:25,586][0m Trial 370 finished with value: 0.8937329218808149 and parameters: {'splitter': 'random', 'min_samples_split': 0.046675373581833775, 'min_samples_leaf': 0.05593277176777142, 'min_weight_fraction_leaf': 0.018334271616193464, 'max_features': 0.5305213953569125}. Best is trial 253 with value: 0.9108382257790575.[0m
[32m[I 2022-04-21 12:29:27,269][0m Trial 371 finished with value: 0.9034327170609309 and parameters: {'splitter': 'random', 'min_samples_split': 0.009928642027301135, 'min_samples_leaf': 0.03220665304846886, 'min_weight_fraction_leaf': 0.05555508382517857, 'max_features': 0.9443620284181926}. Best is trial 253 with value: 0.9108382257790575.[0m
[32m[I 2022-04-21 12:29:28,918][0m Trial 372 finished with value: 0.905552544310039 and parameters: {'splitter': 'random', 'min_samples_split': 0.02446164810830365, 'min_samples_leaf': 0.00896263128598285, 'min_weight_fraction_leaf': 0.0692665599783088, 'max_features': 0.9827265657927331}. Best is trial 253 with value: 0.9108382257790575.[0m
