[32m[I 2022-04-21 16:29:49,779][0m Trial 917 finished with value: 0.8299739483045432 and parameters: {'alpha': 1.6147994878910206, 'ties': 'breslow'}. Best is trial 671 with value: 0.8300537566720008.[0m
[32m[I 2022-04-21 16:29:55,697][0m Trial 918 finished with value: 0.8300149247989304 and parameters: {'alpha': 1.7603715494010324, 'ties': 'breslow'}. Best is trial 671 with value: 0.8300537566720008.[0m
[32m[I 2022-04-21 16:30:02,872][0m Trial 919 finished with value: 0.8300329800020683 and parameters: {'alpha': 1.8644237402154968, 'ties': 'breslow'}. Best is trial 671 with value: 0.8300537566720008.[0m
[32m[I 2022-04-21 16:30:11,308][0m Trial 920 finished with value: 0.8299422150025031 and parameters: {'alpha': 2.1662248680928706, 'ties': 'breslow'}. Best is trial 671 with value: 0.8300537566720008.[0m
[32m[I 2022-04-21 16:30:17,374][0m Trial 921 finished with value: 0.8300433077816052 and parameters: {'alpha': 1.9592760283860753, 'ties': 'breslow'}. Best is trial 671 with value: 0.8300537566720008.[0m
[32m[I 2022-04-21 16:30:24,815][0m Trial 922 finished with value: 0.8299468885787036 and parameters: {'alpha': 2.099384472563181, 'ties': 'breslow'}. Best is trial 671 with value: 0.8300537566720008.[0m
[32m[I 2022-04-21 16:30:33,036][0m Trial 923 finished with value: 0.8300509824350877 and parameters: {'alpha': 1.8961146108422327, 'ties': 'breslow'}. Best is trial 671 with value: 0.8300537566720008.[0m
[32m[I 2022-04-21 16:30:40,150][0m Trial 924 finished with value: 0.8300135870285439 and parameters: {'alpha': 1.7510038542985709, 'ties': 'breslow'}. Best is trial 671 with value: 0.8300537566720008.[0m
[32m[I 2022-04-21 16:30:50,955][0m Trial 925 finished with value: 0.8299882410055688 and parameters: {'alpha': 2.0152343125117786, 'ties': 'breslow'}. Best is trial 671 with value: 0.8300537566720008.[0m
[32m[I 2022-04-21 16:30:59,465][0m Trial 926 finished with value: 0.8300348385044781 and parameters: {'alpha': 1.8617133026297512, 'ties': 'breslow'}. Best is trial 671 with value: 0.8300537566720008.[0m
[32m[I 2022-04-21 16:31:07,335][0m Trial 927 finished with value: 0.8298246813092138 and parameters: {'alpha': 0.8962181636487516, 'ties': 'breslow'}. Best is trial 671 with value: 0.8300537566720008.[0m
[32m[I 2022-04-21 16:31:15,421][0m Trial 928 finished with value: 0.8299684166661955 and parameters: {'alpha': 1.6558248200018735, 'ties': 'breslow'}. Best is trial 671 with value: 0.8300537566720008.[0m
[32m[I 2022-04-21 16:31:23,953][0m Trial 929 finished with value: 0.8298611087610823 and parameters: {'alpha': 1.9659610300704922, 'ties': 'efron'}. Best is trial 671 with value: 0.8300537566720008.[0m
[32m[I 2022-04-21 16:31:31,773][0m Trial 930 finished with value: 0.8299426083684495 and parameters: {'alpha': 2.0759964523509145, 'ties': 'breslow'}. Best is trial 671 with value: 0.8300537566720008.[0m
[32m[I 2022-04-21 16:31:38,980][0m Trial 931 finished with value: 0.8300257930955037 and parameters: {'alpha': 1.8199279356533073, 'ties': 'breslow'}. Best is trial 671 with value: 0.8300537566720008.[0m
[32m[I 2022-04-21 16:31:49,264][0m Trial 932 finished with value: 0.8300512960366675 and parameters: {'alpha': 1.9361269206959122, 'ties': 'breslow'}. Best is trial 671 with value: 0.8300537566720008.[0m
[32m[I 2022-04-21 16:31:58,799][0m Trial 933 finished with value: 0.8299474901688862 and parameters: {'alpha': 2.1697580255247835, 'ties': 'breslow'}. Best is trial 671 with value: 0.8300537566720008.[0m
[32m[I 2022-04-21 16:32:04,088][0m Trial 934 finished with value: 0.8299696204435211 and parameters: {'alpha': 2.046470556529066, 'ties': 'breslow'}. Best is trial 671 with value: 0.8300537566720008.[0m
[32m[I 2022-04-21 16:32:11,739][0m Trial 935 finished with value: 0.8299307613092021 and parameters: {'alpha': 2.2695094245378136, 'ties': 'breslow'}. Best is trial 671 with value: 0.8300537566720008.[0m
[32m[I 2022-04-21 16:32:20,587][0m Trial 936 finished with value: 0.8300432041780791 and parameters: {'alpha': 1.958743648803336, 'ties': 'breslow'}. Best is trial 671 with value: 0.8300537566720008.[0m
[32m[I 2022-04-21 16:32:28,163][0m Trial 937 finished with value: 0.8300121904825245 and parameters: {'alpha': 1.7688108669222253, 'ties': 'breslow'}. Best is trial 671 with value: 0.8300537566720008.[0m
[32m[I 2022-04-21 16:32:35,881][0m Trial 938 finished with value: 0.8300394275731764 and parameters: {'alpha': 1.9308101300369964, 'ties': 'breslow'}. Best is trial 671 with value: 0.8300537566720008.[0m
[32m[I 2022-04-21 16:32:44,595][0m Trial 939 finished with value: 0.8298717978518859 and parameters: {'alpha': 3.290125192797093, 'ties': 'breslow'}. Best is trial 671 with value: 0.8300537566720008.[0m
[32m[I 2022-04-21 16:32:54,416][0m Trial 940 finished with value: 0.8299410168979906 and parameters: {'alpha': 2.093915733455061, 'ties': 'breslow'}. Best is trial 671 with value: 0.8300537566720008.[0m
[32m[I 2022-04-21 16:33:04,000][0m Trial 941 finished with value: 0.829923161336434 and parameters: {'alpha': 2.3853574789653016, 'ties': 'breslow'}. Best is trial 671 with value: 0.8300537566720008.[0m
[32m[I 2022-04-21 16:33:11,381][0m Trial 942 finished with value: 0.8300496664250826 and parameters: {'alpha': 1.974550699240979, 'ties': 'breslow'}. Best is trial 671 with value: 0.8300537566720008.[0m
[32m[I 2022-04-21 16:33:19,220][0m Trial 943 finished with value: 0.8300321300709342 and parameters: {'alpha': 1.8417523247071894, 'ties': 'breslow'}. Best is trial 671 with value: 0.8300537566720008.[0m
[32m[I 2022-04-21 16:33:28,262][0m Trial 944 finished with value: 0.8299850504620405 and parameters: {'alpha': 1.7050042109616472, 'ties': 'breslow'}. Best is trial 671 with value: 0.8300537566720008.[0m
[32m[I 2022-04-21 16:33:37,152][0m Trial 945 finished with value: 0.8299851707027391 and parameters: {'alpha': 2.028263550368396, 'ties': 'breslow'}. Best is trial 671 with value: 0.8300537566720008.[0m
[32m[I 2022-04-21 16:33:45,221][0m Trial 946 finished with value: 0.8299459793919747 and parameters: {'alpha': 2.1868083246909684, 'ties': 'breslow'}. Best is trial 671 with value: 0.8300537566720008.[0m
[32m[I 2022-04-21 16:33:52,999][0m Trial 947 finished with value: 0.8300403056565575 and parameters: {'alpha': 1.8741909015885834, 'ties': 'breslow'}. Best is trial 671 with value: 0.8300537566720008.[0m
[32m[I 2022-04-21 16:34:01,560][0m Trial 948 finished with value: 0.8300174119844073 and parameters: {'alpha': 1.804306418964961, 'ties': 'breslow'}. Best is trial 671 with value: 0.8300537566720008.[0m
[32m[I 2022-04-21 16:34:10,239][0m Trial 949 finished with value: 0.8299643366010965 and parameters: {'alpha': 2.0349680358805586, 'ties': 'breslow'}. Best is trial 671 with value: 0.8300537566720008.[0m
[32m[I 2022-04-21 16:34:22,366][0m Trial 950 finished with value: 0.8298568703534454 and parameters: {'alpha': 1.9263613720883734, 'ties': 'efron'}. Best is trial 671 with value: 0.8300537566720008.[0m
[32m[I 2022-04-21 16:34:30,391][0m Trial 951 finished with value: 0.8299477660375836 and parameters: {'alpha': 2.1087651391475504, 'ties': 'breslow'}. Best is trial 671 with value: 0.8300537566720008.[0m
[32m[I 2022-04-21 16:34:39,563][0m Trial 952 finished with value: 0.8299834374626552 and parameters: {'alpha': 1.6751339470659437, 'ties': 'breslow'}. Best is trial 671 with value: 0.8300537566720008.[0m
[32m[I 2022-04-21 16:34:48,017][0m Trial 953 finished with value: 0.8300424684659113 and parameters: {'alpha': 1.9177592754666803, 'ties': 'breslow'}. Best is trial 671 with value: 0.8300537566720008.[0m
[32m[I 2022-04-21 16:34:56,945][0m Trial 954 finished with value: 0.8300129667662748 and parameters: {'alpha': 1.7998448162171627, 'ties': 'breslow'}. Best is trial 671 with value: 0.8300537566720008.[0m
[32m[I 2022-04-21 16:35:04,687][0m Trial 955 finished with value: 0.8299486873633413 and parameters: {'alpha': 1.549515041887839, 'ties': 'breslow'}. Best is trial 671 with value: 0.8300537566720008.[0m
[32m[I 2022-04-21 16:35:11,597][0m Trial 956 finished with value: 0.8299869153034445 and parameters: {'alpha': 1.9918544940228566, 'ties': 'breslow'}. Best is trial 671 with value: 0.8300537566720008.[0m
[32m[I 2022-04-21 16:35:21,993][0m Trial 957 finished with value: 0.8300349230477606 and parameters: {'alpha': 1.8693038140355127, 'ties': 'breslow'}. Best is trial 671 with value: 0.8300537566720008.[0m
[32m[I 2022-04-21 16:35:31,705][0m Trial 958 finished with value: 0.8299979503817569 and parameters: {'alpha': 1.735193085225857, 'ties': 'breslow'}. Best is trial 671 with value: 0.8300537566720008.[0m
[32m[I 2022-04-21 16:35:39,951][0m Trial 959 finished with value: 0.82995238301848 and parameters: {'alpha': 2.1281178189944305, 'ties': 'breslow'}. Best is trial 671 with value: 0.8300537566720008.[0m
[32m[I 2022-04-21 16:35:48,287][0m Trial 960 finished with value: 0.8299871592757098 and parameters: {'alpha': 2.026220804841632, 'ties': 'breslow'}. Best is trial 671 with value: 0.8300537566720008.[0m
[32m[I 2022-04-21 16:35:54,983][0m Trial 961 finished with value: 0.8300414878641306 and parameters: {'alpha': 1.9272618810051874, 'ties': 'breslow'}. Best is trial 671 with value: 0.8300537566720008.[0m
[32m[I 2022-04-21 16:36:03,240][0m Trial 962 finished with value: 0.8300216600419908 and parameters: {'alpha': 1.8103150658327933, 'ties': 'breslow'}. Best is trial 671 with value: 0.8300537566720008.[0m
[32m[I 2022-04-21 16:36:11,177][0m Trial 963 finished with value: 0.8299350623919605 and parameters: {'alpha': 1.3983430762672728, 'ties': 'breslow'}. Best is trial 671 with value: 0.8300537566720008.[0m
[32m[I 2022-04-21 16:36:18,368][0m Trial 964 finished with value: 0.8299456637970406 and parameters: {'alpha': 2.191610450024046, 'ties': 'breslow'}. Best is trial 671 with value: 0.8300537566720008.[0m
[32m[I 2022-04-21 16:36:24,897][0m Trial 965 finished with value: 0.8298869534789365 and parameters: {'alpha': 1.1164903024689679, 'ties': 'breslow'}. Best is trial 671 with value: 0.8300537566720008.[0m
[32m[I 2022-04-21 16:36:33,906][0m Trial 966 finished with value: 0.8299883108531236 and parameters: {'alpha': 2.0148201971502773, 'ties': 'breslow'}. Best is trial 671 with value: 0.8300537566720008.[0m
[32m[I 2022-04-21 16:36:42,544][0m Trial 967 finished with value: 0.8300387541287039 and parameters: {'alpha': 1.88277145635516, 'ties': 'breslow'}. Best is trial 671 with value: 0.8300537566720008.[0m
[32m[I 2022-04-21 16:36:49,637][0m Trial 968 finished with value: 0.829996379770753 and parameters: {'alpha': 1.718804978708211, 'ties': 'breslow'}. Best is trial 671 with value: 0.8300537566720008.[0m
[32m[I 2022-04-21 16:37:02,351][0m Trial 969 finished with value: 0.8297948085552317 and parameters: {'alpha': 1.6443098048658584, 'ties': 'efron'}. Best is trial 671 with value: 0.8300537566720008.[0m
[32m[I 2022-04-21 16:37:10,686][0m Trial 970 finished with value: 0.8300418779481223 and parameters: {'alpha': 1.9581874555099836, 'ties': 'breslow'}. Best is trial 671 with value: 0.8300537566720008.[0m
[32m[I 2022-04-21 16:37:18,842][0m Trial 971 finished with value: 0.8299427481049728 and parameters: {'alpha': 2.0964292856439823, 'ties': 'breslow'}. Best is trial 671 with value: 0.8300537566720008.[0m
[32m[I 2022-04-21 16:37:26,255][0m Trial 972 finished with value: 0.8300292200851498 and parameters: {'alpha': 1.8237617379574855, 'ties': 'breslow'}. Best is trial 671 with value: 0.8300537566720008.[0m
[32m[I 2022-04-21 16:37:35,091][0m Trial 973 finished with value: 0.8299326403831051 and parameters: {'alpha': 2.3173056355569845, 'ties': 'breslow'}. Best is trial 671 with value: 0.8300537566720008.[0m
[32m[I 2022-04-21 16:37:45,666][0m Trial 974 finished with value: 0.8300436026132669 and parameters: {'alpha': 1.926539492467592, 'ties': 'breslow'}. Best is trial 671 with value: 0.8300537566720008.[0m
[32m[I 2022-04-21 16:37:53,557][0m Trial 975 finished with value: 0.8300114961790198 and parameters: {'alpha': 1.7629528963507308, 'ties': 'breslow'}. Best is trial 671 with value: 0.8300537566720008.[0m
[32m[I 2022-04-21 16:38:00,931][0m Trial 976 finished with value: 0.8299597311389769 and parameters: {'alpha': 2.0497165307790386, 'ties': 'breslow'}. Best is trial 671 with value: 0.8300537566720008.[0m
[32m[I 2022-04-21 16:38:07,183][0m Trial 977 finished with value: 0.8300362275611419 and parameters: {'alpha': 1.8730322757424536, 'ties': 'breslow'}. Best is trial 671 with value: 0.8300537566720008.[0m
[32m[I 2022-04-21 16:38:15,171][0m Trial 978 finished with value: 0.8300504171685483 and parameters: {'alpha': 1.974245196064767, 'ties': 'breslow'}. Best is trial 671 with value: 0.8300537566720008.[0m
[32m[I 2022-04-21 16:38:23,924][0m Trial 979 finished with value: 0.8299703510916882 and parameters: {'alpha': 1.6074162401489718, 'ties': 'breslow'}. Best is trial 671 with value: 0.8300537566720008.[0m
[32m[I 2022-04-21 16:38:34,608][0m Trial 980 finished with value: 0.8299473115267629 and parameters: {'alpha': 2.1368616427364926, 'ties': 'breslow'}. Best is trial 671 with value: 0.8300537566720008.[0m
[32m[I 2022-04-21 16:38:41,040][0m Trial 981 finished with value: 0.8300235398285227 and parameters: {'alpha': 1.8140343017794218, 'ties': 'breslow'}. Best is trial 671 with value: 0.8300537566720008.[0m
[32m[I 2022-04-21 16:38:48,908][0m Trial 982 finished with value: 0.8299648510253643 and parameters: {'alpha': 2.0322159301238085, 'ties': 'breslow'}. Best is trial 671 with value: 0.8300537566720008.[0m
[32m[I 2022-04-21 16:38:58,428][0m Trial 983 finished with value: 0.830050468844717 and parameters: {'alpha': 1.8989101291602435, 'ties': 'breslow'}. Best is trial 671 with value: 0.8300537566720008.[0m
[32m[I 2022-04-21 16:39:06,780][0m Trial 984 finished with value: 0.82993984310308 and parameters: {'alpha': 2.223463447483378, 'ties': 'breslow'}. Best is trial 671 with value: 0.8300537566720008.[0m
[32m[I 2022-04-21 16:39:14,028][0m Trial 985 finished with value: 0.8299984861774673 and parameters: {'alpha': 1.734951437430095, 'ties': 'breslow'}. Best is trial 671 with value: 0.8300537566720008.[0m
[32m[I 2022-04-21 16:39:21,655][0m Trial 986 finished with value: 0.8300426051469543 and parameters: {'alpha': 1.9667229878367958, 'ties': 'breslow'}. Best is trial 671 with value: 0.8300537566720008.[0m
[32m[I 2022-04-21 16:39:30,176][0m Trial 987 finished with value: 0.8300299805101712 and parameters: {'alpha': 1.8427083044355277, 'ties': 'breslow'}. Best is trial 671 with value: 0.8300537566720008.[0m
[32m[I 2022-04-21 16:39:37,406][0m Trial 988 finished with value: 0.8299476480853709 and parameters: {'alpha': 2.0697835603130734, 'ties': 'breslow'}. Best is trial 671 with value: 0.8300537566720008.[0m
[32m[I 2022-04-21 16:39:44,566][0m Trial 989 finished with value: 0.83001790518608 and parameters: {'alpha': 1.7548666465227467, 'ties': 'breslow'}. Best is trial 671 with value: 0.8300537566720008.[0m
[32m[I 2022-04-21 16:39:54,785][0m Trial 990 finished with value: 0.8298199478259545 and parameters: {'alpha': 3.8559661072310583, 'ties': 'breslow'}. Best is trial 671 with value: 0.8300537566720008.[0m
[32m[I 2022-04-21 16:40:04,738][0m Trial 991 finished with value: 0.8298489775575645 and parameters: {'alpha': 1.9213921256848834, 'ties': 'efron'}. Best is trial 671 with value: 0.8300537566720008.[0m
[32m[I 2022-04-21 16:40:12,868][0m Trial 992 finished with value: 0.8299818523531641 and parameters: {'alpha': 1.6665777691214287, 'ties': 'breslow'}. Best is trial 671 with value: 0.8300537566720008.[0m
[32m[I 2022-04-21 16:40:20,091][0m Trial 993 finished with value: 0.8299885294678875 and parameters: {'alpha': 1.9926591000890943, 'ties': 'breslow'}. Best is trial 671 with value: 0.8300537566720008.[0m
[32m[I 2022-04-21 16:40:28,088][0m Trial 994 finished with value: 0.8299552069173359 and parameters: {'alpha': 2.1232661489816542, 'ties': 'breslow'}. Best is trial 671 with value: 0.8300537566720008.[0m
[32m[I 2022-04-21 16:40:36,693][0m Trial 995 finished with value: 0.8300319263149041 and parameters: {'alpha': 1.8456702395772162, 'ties': 'breslow'}. Best is trial 671 with value: 0.8300537566720008.[0m
[32m[I 2022-04-21 16:40:45,959][0m Trial 996 finished with value: 0.8300403643680957 and parameters: {'alpha': 1.9291688102791809, 'ties': 'breslow'}. Best is trial 671 with value: 0.8300537566720008.[0m
[32m[I 2022-04-21 16:40:55,453][0m Trial 997 finished with value: 0.830009816714818 and parameters: {'alpha': 1.7951331291900434, 'ties': 'breslow'}. Best is trial 671 with value: 0.8300537566720008.[0m
[32m[I 2022-04-21 16:41:02,735][0m Trial 998 finished with value: 0.829967257423035 and parameters: {'alpha': 2.0454958290040706, 'ties': 'breslow'}. Best is trial 671 with value: 0.8300537566720008.[0m
[32m[I 2022-04-21 16:41:10,060][0m Trial 999 finished with value: 0.8299415770665762 and parameters: {'alpha': 2.229202224045411, 'ties': 'breslow'}. Best is trial 671 with value: 0.8300537566720008.[0m
CoxPH
Running Optimizer with LogRank binary scoring
{'alpha': 1.902531234373698, 'ties': 'breslow', 'UnoC_LR': 0.9150268460560183}
Running Optimizer normaly
{'alpha': 1.901950441915944, 'ties': 'breslow', 'UnoC': 0.8300537566720008}
