[32m[I 2022-04-21 16:15:06,790][0m Trial 811 finished with value: 0.8299568221383865 and parameters: {'alpha': 1.5751632885984346, 'ties': 'breslow'}. Best is trial 671 with value: 0.8300537566720008.[0m
[32m[I 2022-04-21 16:15:14,011][0m Trial 812 finished with value: 0.8299900488613531 and parameters: {'alpha': 2.0190510473152665, 'ties': 'breslow'}. Best is trial 671 with value: 0.8300537566720008.[0m
[32m[I 2022-04-21 16:15:22,718][0m Trial 813 finished with value: 0.829803828166372 and parameters: {'alpha': 4.432430390336242, 'ties': 'breslow'}. Best is trial 671 with value: 0.8300537566720008.[0m
[32m[I 2022-04-21 16:15:31,465][0m Trial 814 finished with value: 0.8300184621986697 and parameters: {'alpha': 1.7819951052410983, 'ties': 'breslow'}. Best is trial 671 with value: 0.8300537566720008.[0m
[32m[I 2022-04-21 16:15:42,694][0m Trial 815 finished with value: 0.8297322596774016 and parameters: {'alpha': 1.3068191357879655, 'ties': 'efron'}. Best is trial 671 with value: 0.8300537566720008.[0m
[32m[I 2022-04-21 16:15:50,381][0m Trial 816 finished with value: 0.8300417069567766 and parameters: {'alpha': 1.875341315057572, 'ties': 'breslow'}. Best is trial 671 with value: 0.8300537566720008.[0m
[32m[I 2022-04-21 16:15:58,686][0m Trial 817 finished with value: 0.8300477447676997 and parameters: {'alpha': 1.9706421405029881, 'ties': 'breslow'}. Best is trial 671 with value: 0.8300537566720008.[0m
[32m[I 2022-04-21 16:16:06,696][0m Trial 818 finished with value: 0.8299395398394205 and parameters: {'alpha': 2.2208593985882943, 'ties': 'breslow'}. Best is trial 671 with value: 0.8300537566720008.[0m
[32m[I 2022-04-21 16:16:16,262][0m Trial 819 finished with value: 0.829952099446607 and parameters: {'alpha': 2.060375589578819, 'ties': 'breslow'}. Best is trial 671 with value: 0.8300537566720008.[0m
[32m[I 2022-04-21 16:16:26,040][0m Trial 820 finished with value: 0.8300334438918071 and parameters: {'alpha': 1.8317211411904846, 'ties': 'breslow'}. Best is trial 671 with value: 0.8300537566720008.[0m
[32m[I 2022-04-21 16:16:34,005][0m Trial 821 finished with value: 0.8299832100228587 and parameters: {'alpha': 1.6957608800819668, 'ties': 'breslow'}. Best is trial 671 with value: 0.8300537566720008.[0m
[32m[I 2022-04-21 16:16:41,095][0m Trial 822 finished with value: 0.8300513066185431 and parameters: {'alpha': 1.93667014715248, 'ties': 'breslow'}. Best is trial 671 with value: 0.8300537566720008.[0m
[32m[I 2022-04-21 16:16:49,161][0m Trial 823 finished with value: 0.8299543969657656 and parameters: {'alpha': 2.1136118783460507, 'ties': 'breslow'}. Best is trial 671 with value: 0.8300537566720008.[0m
[32m[I 2022-04-21 16:16:57,622][0m Trial 824 finished with value: 0.8299263638896246 and parameters: {'alpha': 2.2882925679911317, 'ties': 'breslow'}. Best is trial 671 with value: 0.8300537566720008.[0m
[32m[I 2022-04-21 16:17:07,065][0m Trial 825 finished with value: 0.8300436051105692 and parameters: {'alpha': 1.9568228237985308, 'ties': 'breslow'}. Best is trial 671 with value: 0.8300537566720008.[0m
[32m[I 2022-04-21 16:17:16,197][0m Trial 826 finished with value: 0.8299879357072708 and parameters: {'alpha': 2.0184530366898183, 'ties': 'breslow'}. Best is trial 671 with value: 0.8300537566720008.[0m
[32m[I 2022-04-21 16:17:24,489][0m Trial 827 finished with value: 0.8300414397220379 and parameters: {'alpha': 1.8754274022587882, 'ties': 'breslow'}. Best is trial 671 with value: 0.8300537566720008.[0m
[32m[I 2022-04-21 16:17:31,525][0m Trial 828 finished with value: 0.8300121904825245 and parameters: {'alpha': 1.7689275836098177, 'ties': 'breslow'}. Best is trial 671 with value: 0.8300537566720008.[0m
[32m[I 2022-04-21 16:17:38,873][0m Trial 829 finished with value: 0.8299480625969192 and parameters: {'alpha': 2.1090429616388313, 'ties': 'breslow'}. Best is trial 671 with value: 0.8300537566720008.[0m
[32m[I 2022-04-21 16:17:46,504][0m Trial 830 finished with value: 0.8300433843915785 and parameters: {'alpha': 1.9247798653480148, 'ties': 'breslow'}. Best is trial 671 with value: 0.8300537566720008.[0m
[32m[I 2022-04-21 16:17:54,445][0m Trial 831 finished with value: 0.8299870846243763 and parameters: {'alpha': 2.0021020337702553, 'ties': 'breslow'}. Best is trial 671 with value: 0.8300537566720008.[0m
[32m[I 2022-04-21 16:18:02,530][0m Trial 832 finished with value: 0.8300337994742172 and parameters: {'alpha': 1.8314207167566958, 'ties': 'breslow'}. Best is trial 671 with value: 0.8300537566720008.[0m
[32m[I 2022-04-21 16:18:12,270][0m Trial 833 finished with value: 0.8299667777574786 and parameters: {'alpha': 1.5998813784261825, 'ties': 'breslow'}. Best is trial 671 with value: 0.8300537566720008.[0m
[32m[I 2022-04-21 16:18:20,789][0m Trial 834 finished with value: 0.8299456632291988 and parameters: {'alpha': 2.1908229529856897, 'ties': 'breslow'}. Best is trial 671 with value: 0.8300537566720008.[0m
[32m[I 2022-04-21 16:18:28,553][0m Trial 835 finished with value: 0.8300127514423297 and parameters: {'alpha': 1.7490775316872704, 'ties': 'breslow'}. Best is trial 671 with value: 0.8300537566720008.[0m
[32m[I 2022-04-21 16:18:42,135][0m Trial 836 finished with value: 0.8298391722550335 and parameters: {'alpha': 1.9094632680018224, 'ties': 'efron'}. Best is trial 671 with value: 0.8300537566720008.[0m
[32m[I 2022-04-21 16:18:49,848][0m Trial 837 finished with value: 0.829965864138577 and parameters: {'alpha': 2.044162126522384, 'ties': 'breslow'}. Best is trial 671 with value: 0.8300537566720008.[0m
[32m[I 2022-04-21 16:18:59,519][0m Trial 838 finished with value: 0.8300433846808757 and parameters: {'alpha': 1.9248663425239474, 'ties': 'breslow'}. Best is trial 671 with value: 0.8300537566720008.[0m
[32m[I 2022-04-21 16:19:09,173][0m Trial 839 finished with value: 0.8300125198363408 and parameters: {'alpha': 1.7913056740044349, 'ties': 'breslow'}. Best is trial 671 with value: 0.8300537566720008.[0m
[32m[I 2022-04-21 16:19:17,949][0m Trial 840 finished with value: 0.8299063899533328 and parameters: {'alpha': 2.833099333165916, 'ties': 'breslow'}. Best is trial 671 with value: 0.8300537566720008.[0m
[32m[I 2022-04-21 16:19:26,033][0m Trial 841 finished with value: 0.8299467296609684 and parameters: {'alpha': 2.101235087613614, 'ties': 'breslow'}. Best is trial 671 with value: 0.8300537566720008.[0m
[32m[I 2022-04-21 16:19:33,304][0m Trial 842 finished with value: 0.82998346655513 and parameters: {'alpha': 1.6800863748203982, 'ties': 'breslow'}. Best is trial 671 with value: 0.8300537566720008.[0m
[32m[I 2022-04-21 16:19:41,746][0m Trial 843 finished with value: 0.8300480776023728 and parameters: {'alpha': 1.9775213957818, 'ties': 'breslow'}. Best is trial 671 with value: 0.8300537566720008.[0m
[32m[I 2022-04-21 16:19:49,793][0m Trial 844 finished with value: 0.8300329710249705 and parameters: {'alpha': 1.8641558348348866, 'ties': 'breslow'}. Best is trial 671 with value: 0.8300537566720008.[0m
[32m[I 2022-04-21 16:19:57,438][0m Trial 845 finished with value: 0.8299883968829634 and parameters: {'alpha': 2.0243013334287334, 'ties': 'breslow'}. Best is trial 671 with value: 0.8300537566720008.[0m
[32m[I 2022-04-21 16:20:06,282][0m Trial 846 finished with value: 0.8300324612434853 and parameters: {'alpha': 1.8370714807142228, 'ties': 'breslow'}. Best is trial 671 with value: 0.8300537566720008.[0m
[32m[I 2022-04-21 16:20:14,249][0m Trial 847 finished with value: 0.8299423511206523 and parameters: {'alpha': 2.204094290921149, 'ties': 'breslow'}. Best is trial 671 with value: 0.8300537566720008.[0m
[32m[I 2022-04-21 16:20:22,536][0m Trial 848 finished with value: 0.8300438654188718 and parameters: {'alpha': 1.925829907546724, 'ties': 'breslow'}. Best is trial 671 with value: 0.8300537566720008.[0m
[32m[I 2022-04-21 16:20:30,805][0m Trial 849 finished with value: 0.8299222182493564 and parameters: {'alpha': 2.3933817534302633, 'ties': 'breslow'}. Best is trial 671 with value: 0.8300537566720008.[0m
[32m[I 2022-04-21 16:20:39,231][0m Trial 850 finished with value: 0.8299995421720743 and parameters: {'alpha': 1.7245105708158952, 'ties': 'breslow'}. Best is trial 671 with value: 0.8300537566720008.[0m
[32m[I 2022-04-21 16:20:47,137][0m Trial 851 finished with value: 0.829943307255073 and parameters: {'alpha': 2.0926418264349556, 'ties': 'breslow'}. Best is trial 671 with value: 0.8300537566720008.[0m
[32m[I 2022-04-21 16:20:55,773][0m Trial 852 finished with value: 0.8300432701680162 and parameters: {'alpha': 1.96757261341789, 'ties': 'breslow'}. Best is trial 671 with value: 0.8300537566720008.[0m
[32m[I 2022-04-21 16:21:03,900][0m Trial 853 finished with value: 0.8300230848324002 and parameters: {'alpha': 1.8118118415567699, 'ties': 'breslow'}. Best is trial 671 with value: 0.8300537566720008.[0m
[32m[I 2022-04-21 16:21:13,662][0m Trial 854 finished with value: 0.8298285901329306 and parameters: {'alpha': 1.8922875183159245, 'ties': 'efron'}. Best is trial 671 with value: 0.8300537566720008.[0m
[32m[I 2022-04-21 16:21:20,481][0m Trial 855 finished with value: 0.8292640937962721 and parameters: {'alpha': 0.05806875010283763, 'ties': 'breslow'}. Best is trial 671 with value: 0.8300537566720008.[0m
[32m[I 2022-04-21 16:21:28,286][0m Trial 856 finished with value: 0.8299743922037699 and parameters: {'alpha': 1.6304063224804357, 'ties': 'breslow'}. Best is trial 671 with value: 0.8300537566720008.[0m
[32m[I 2022-04-21 16:21:35,662][0m Trial 857 finished with value: 0.8299661833354062 and parameters: {'alpha': 2.0315381722777923, 'ties': 'breslow'}. Best is trial 671 with value: 0.8300537566720008.[0m
[32m[I 2022-04-21 16:21:42,151][0m Trial 858 finished with value: 0.8300115134704811 and parameters: {'alpha': 1.7968623731628632, 'ties': 'breslow'}. Best is trial 671 with value: 0.8300537566720008.[0m
[32m[I 2022-04-21 16:21:52,784][0m Trial 859 finished with value: 0.8299441779171838 and parameters: {'alpha': 2.1455590364497623, 'ties': 'breslow'}. Best is trial 671 with value: 0.8300537566720008.[0m
[32m[I 2022-04-21 16:22:02,348][0m Trial 860 finished with value: 0.8300437266725755 and parameters: {'alpha': 1.9458215346167975, 'ties': 'breslow'}. Best is trial 671 with value: 0.8300537566720008.[0m
[32m[I 2022-04-21 16:22:10,033][0m Trial 861 finished with value: 0.8300007587170578 and parameters: {'alpha': 1.7252586913005952, 'ties': 'breslow'}. Best is trial 671 with value: 0.8300537566720008.[0m
[32m[I 2022-04-21 16:22:18,930][0m Trial 862 finished with value: 0.829949894758214 and parameters: {'alpha': 1.5126472699898719, 'ties': 'breslow'}. Best is trial 671 with value: 0.8300537566720008.[0m
[32m[I 2022-04-21 16:22:28,164][0m Trial 863 finished with value: 0.8300389676843969 and parameters: {'alpha': 1.883871985376491, 'ties': 'breslow'}. Best is trial 671 with value: 0.8300537566720008.[0m
[32m[I 2022-04-21 16:22:35,905][0m Trial 864 finished with value: 0.8299471655227387 and parameters: {'alpha': 2.0660985990754073, 'ties': 'breslow'}. Best is trial 671 with value: 0.8300537566720008.[0m
[32m[I 2022-04-21 16:22:44,745][0m Trial 865 finished with value: 0.8300454154690196 and parameters: {'alpha': 1.985326025180393, 'ties': 'breslow'}. Best is trial 671 with value: 0.8300537566720008.[0m
[32m[I 2022-04-21 16:22:53,548][0m Trial 866 finished with value: 0.8299274018382604 and parameters: {'alpha': 2.3058175252292847, 'ties': 'breslow'}. Best is trial 671 with value: 0.8300537566720008.[0m
[32m[I 2022-04-21 16:23:03,444][0m Trial 867 finished with value: 0.8300356835220322 and parameters: {'alpha': 1.862846959100884, 'ties': 'breslow'}. Best is trial 671 with value: 0.8300537566720008.[0m
[32m[I 2022-04-21 16:23:10,850][0m Trial 868 finished with value: 0.8300137793130483 and parameters: {'alpha': 1.7891095376404378, 'ties': 'breslow'}. Best is trial 671 with value: 0.8300537566720008.[0m
[32m[I 2022-04-21 16:23:16,453][0m Trial 869 finished with value: 0.8300486675984988 and parameters: {'alpha': 1.9877386791628622, 'ties': 'breslow'}. Best is trial 671 with value: 0.8300537566720008.[0m
[32m[I 2022-04-21 16:23:24,010][0m Trial 870 finished with value: 0.8299820977917507 and parameters: {'alpha': 1.6660316806665705, 'ties': 'breslow'}. Best is trial 671 with value: 0.8300537566720008.[0m
[32m[I 2022-04-21 16:23:35,576][0m Trial 871 finished with value: 0.8299478038140192 and parameters: {'alpha': 2.1824675790658388, 'ties': 'breslow'}. Best is trial 671 with value: 0.8300537566720008.[0m
[32m[I 2022-04-21 16:23:44,053][0m Trial 872 finished with value: 0.8300493428990553 and parameters: {'alpha': 1.8920403635336278, 'ties': 'breslow'}. Best is trial 671 with value: 0.8300537566720008.[0m
[32m[I 2022-04-21 16:23:56,217][0m Trial 873 finished with value: 0.8298751257443662 and parameters: {'alpha': 2.078988144043725, 'ties': 'efron'}. Best is trial 671 with value: 0.8300537566720008.[0m
[32m[I 2022-04-21 16:24:03,273][0m Trial 874 finished with value: 0.8300101864883261 and parameters: {'alpha': 1.7855385429424049, 'ties': 'breslow'}. Best is trial 671 with value: 0.8300537566720008.[0m
[32m[I 2022-04-21 16:24:11,355][0m Trial 875 finished with value: 0.8300494431778936 and parameters: {'alpha': 1.9793319064007744, 'ties': 'breslow'}. Best is trial 671 with value: 0.8300537566720008.[0m
[32m[I 2022-04-21 16:24:19,802][0m Trial 876 finished with value: 0.8300371658287748 and parameters: {'alpha': 1.8673880706690984, 'ties': 'breslow'}. Best is trial 671 with value: 0.8300537566720008.[0m
[32m[I 2022-04-21 16:24:29,145][0m Trial 877 finished with value: 0.8299422788595553 and parameters: {'alpha': 2.0976762890791787, 'ties': 'breslow'}. Best is trial 671 with value: 0.8300537566720008.[0m
[32m[I 2022-04-21 16:24:36,677][0m Trial 878 finished with value: 0.8300004356292922 and parameters: {'alpha': 1.7294231031755083, 'ties': 'breslow'}. Best is trial 671 with value: 0.8300537566720008.[0m
[32m[I 2022-04-21 16:24:44,180][0m Trial 879 finished with value: 0.8300447392282153 and parameters: {'alpha': 1.9322316640647776, 'ties': 'breslow'}. Best is trial 671 with value: 0.8300537566720008.[0m
[32m[I 2022-04-21 16:24:52,288][0m Trial 880 finished with value: 0.8300344083514763 and parameters: {'alpha': 1.8331215311800786, 'ties': 'breslow'}. Best is trial 671 with value: 0.8300537566720008.[0m
[32m[I 2022-04-21 16:25:02,500][0m Trial 881 finished with value: 0.8299753709168585 and parameters: {'alpha': 1.6273155210097299, 'ties': 'breslow'}. Best is trial 671 with value: 0.8300537566720008.[0m
[32m[I 2022-04-21 16:25:11,795][0m Trial 882 finished with value: 0.8299868911013226 and parameters: {'alpha': 2.0264424261468736, 'ties': 'breslow'}. Best is trial 671 with value: 0.8300537566720008.[0m
[32m[I 2022-04-21 16:25:18,455][0m Trial 883 finished with value: 0.8300402138580919 and parameters: {'alpha': 1.929898004621352, 'ties': 'breslow'}. Best is trial 671 with value: 0.8300537566720008.[0m
[32m[I 2022-04-21 16:25:26,872][0m Trial 884 finished with value: 0.8299558894676171 and parameters: {'alpha': 2.1241081250422527, 'ties': 'breslow'}. Best is trial 671 with value: 0.8300537566720008.[0m
[32m[I 2022-04-21 16:25:36,508][0m Trial 885 finished with value: 0.8299272837669209 and parameters: {'alpha': 2.26430980859091, 'ties': 'breslow'}. Best is trial 671 with value: 0.8300537566720008.[0m
[32m[I 2022-04-21 16:25:44,525][0m Trial 886 finished with value: 0.8300150942366888 and parameters: {'alpha': 1.7591662806550814, 'ties': 'breslow'}. Best is trial 671 with value: 0.8300537566720008.[0m
[32m[I 2022-04-21 16:25:52,108][0m Trial 887 finished with value: 0.8299909181317935 and parameters: {'alpha': 2.020100797970703, 'ties': 'breslow'}. Best is trial 671 with value: 0.8300537566720008.[0m
[32m[I 2022-04-21 16:26:01,257][0m Trial 888 finished with value: 0.8300338800622443 and parameters: {'alpha': 1.8563353514674208, 'ties': 'breslow'}. Best is trial 671 with value: 0.8300537566720008.[0m
[32m[I 2022-04-21 16:26:09,069][0m Trial 889 finished with value: 0.8300474374253153 and parameters: {'alpha': 1.9113558555261259, 'ties': 'breslow'}. Best is trial 671 with value: 0.8300537566720008.[0m
[32m[I 2022-04-21 16:26:14,665][0m Trial 890 finished with value: 0.8299859257788992 and parameters: {'alpha': 1.701084197525513, 'ties': 'breslow'}. Best is trial 671 with value: 0.8300537566720008.[0m
[32m[I 2022-04-21 16:26:20,439][0m Trial 891 finished with value: 0.8299472688203531 and parameters: {'alpha': 2.1855405033728257, 'ties': 'breslow'}. Best is trial 671 with value: 0.8300537566720008.[0m
[32m[I 2022-04-21 16:26:34,036][0m Trial 892 finished with value: 0.8298551715424034 and parameters: {'alpha': 1.9865695356974407, 'ties': 'efron'}. Best is trial 671 with value: 0.8300537566720008.[0m
[32m[I 2022-04-21 16:26:43,068][0m Trial 893 finished with value: 0.8300115521411451 and parameters: {'alpha': 1.775240652561887, 'ties': 'breslow'}. Best is trial 671 with value: 0.8300537566720008.[0m
[32m[I 2022-04-21 16:26:51,053][0m Trial 894 finished with value: 0.8299558800790784 and parameters: {'alpha': 2.0639580002974807, 'ties': 'breslow'}. Best is trial 671 with value: 0.8300537566720008.[0m
[32m[I 2022-04-21 16:27:00,601][0m Trial 895 finished with value: 0.8299570898698327 and parameters: {'alpha': 1.5763126528581257, 'ties': 'breslow'}. Best is trial 671 with value: 0.8300537566720008.[0m
[32m[I 2022-04-21 16:27:08,081][0m Trial 896 finished with value: 0.8300362541983886 and parameters: {'alpha': 1.8535257998924115, 'ties': 'breslow'}. Best is trial 671 with value: 0.8300537566720008.[0m
[32m[I 2022-04-21 16:27:15,228][0m Trial 897 finished with value: 0.8300463949670899 and parameters: {'alpha': 1.9439984759476487, 'ties': 'breslow'}. Best is trial 671 with value: 0.8300537566720008.[0m
[32m[I 2022-04-21 16:27:19,781][0m Trial 898 finished with value: 0.830021133470137 and parameters: {'alpha': 1.8115007686466267, 'ties': 'breslow'}. Best is trial 671 with value: 0.8300537566720008.[0m
[32m[I 2022-04-21 16:27:26,562][0m Trial 899 finished with value: 0.829986611221722 and parameters: {'alpha': 2.0027846728765244, 'ties': 'breslow'}. Best is trial 671 with value: 0.8300537566720008.[0m
[32m[I 2022-04-21 16:27:33,750][0m Trial 900 finished with value: 0.8299832668510867 and parameters: {'alpha': 1.6742693735224394, 'ties': 'breslow'}. Best is trial 671 with value: 0.8300537566720008.[0m
[32m[I 2022-04-21 16:27:41,743][0m Trial 901 finished with value: 0.8299423920914537 and parameters: {'alpha': 2.164549027724798, 'ties': 'breslow'}. Best is trial 671 with value: 0.8300537566720008.[0m
[32m[I 2022-04-21 16:27:50,786][0m Trial 902 finished with value: 0.8300510503912572 and parameters: {'alpha': 1.9036963063456704, 'ties': 'breslow'}. Best is trial 671 with value: 0.8300537566720008.[0m
[32m[I 2022-04-21 16:27:59,771][0m Trial 903 finished with value: 0.8299474465829098 and parameters: {'alpha': 2.073928311337828, 'ties': 'breslow'}. Best is trial 671 with value: 0.8300537566720008.[0m
[32m[I 2022-04-21 16:28:07,741][0m Trial 904 finished with value: 0.8300110054560704 and parameters: {'alpha': 1.7759302504766914, 'ties': 'breslow'}. Best is trial 671 with value: 0.8300537566720008.[0m
[32m[I 2022-04-21 16:28:14,516][0m Trial 905 finished with value: 0.8300502791619554 and parameters: {'alpha': 1.9352986988045935, 'ties': 'breslow'}. Best is trial 671 with value: 0.8300537566720008.[0m
[32m[I 2022-04-21 16:28:22,034][0m Trial 906 finished with value: 0.8300318868903538 and parameters: {'alpha': 1.8286827102038252, 'ties': 'breslow'}. Best is trial 671 with value: 0.8300537566720008.[0m
[32m[I 2022-04-21 16:28:28,831][0m Trial 907 finished with value: 0.8299863042577755 and parameters: {'alpha': 2.0291641012394375, 'ties': 'breslow'}. Best is trial 671 with value: 0.8300537566720008.[0m
[32m[I 2022-04-21 16:28:38,107][0m Trial 908 finished with value: 0.8299903313165021 and parameters: {'alpha': 1.7135899250232953, 'ties': 'breslow'}. Best is trial 671 with value: 0.8300537566720008.[0m
[32m[I 2022-04-21 16:28:45,295][0m Trial 909 finished with value: 0.8300529721471619 and parameters: {'alpha': 1.906358613782909, 'ties': 'breslow'}. Best is trial 671 with value: 0.8300537566720008.[0m
[32m[I 2022-04-21 16:28:53,531][0m Trial 910 finished with value: 0.8299447145392765 and parameters: {'alpha': 2.1065166093466887, 'ties': 'breslow'}. Best is trial 671 with value: 0.8300537566720008.[0m
[32m[I 2022-04-21 16:29:04,654][0m Trial 911 finished with value: 0.8298567952687698 and parameters: {'alpha': 1.953709923431957, 'ties': 'efron'}. Best is trial 671 with value: 0.8300537566720008.[0m
[32m[I 2022-04-21 16:29:12,597][0m Trial 912 finished with value: 0.8299322463686882 and parameters: {'alpha': 2.2580722826484045, 'ties': 'breslow'}. Best is trial 671 with value: 0.8300537566720008.[0m
[32m[I 2022-04-21 16:29:19,456][0m Trial 913 finished with value: 0.8299189762459622 and parameters: {'alpha': 2.4974983576091927, 'ties': 'breslow'}. Best is trial 671 with value: 0.8300537566720008.[0m
[32m[I 2022-04-21 16:29:28,295][0m Trial 914 finished with value: 0.8300321361155983 and parameters: {'alpha': 1.841584966447105, 'ties': 'breslow'}. Best is trial 671 with value: 0.8300537566720008.[0m
[32m[I 2022-04-21 16:29:35,532][0m Trial 915 finished with value: 0.8299529362604933 and parameters: {'alpha': 1.488169567941505, 'ties': 'breslow'}. Best is trial 671 with value: 0.8300537566720008.[0m
[32m[I 2022-04-21 16:29:45,052][0m Trial 916 finished with value: 0.8299858053108947 and parameters: {'alpha': 2.0111688165936683, 'ties': 'breslow'}. Best is trial 671 with value: 0.8300537566720008.[0m
